[I 2025-09-01 10:12:35,261] Trial 404 finished with values: [-0.03306775811026963, 0.03286953053139759] and parameters: {'p_sma': 18, 'p_std': 16, 'p_atr': 15, 'p_adx': 25, 'rsi_period': 63, 'ema1': 11, 'ema2': 42, 'slip_atr_k': 0.05513382946664256, 'slip_spread_k': 0.6066116429874573, 'spread_hl_frac': 0.027775185062282888, 'bb_std_mult': 1.7672617377263424, 'rsi_os': 41, 'rsi_ob': 86, 'vol_spike': 0.03752274791669026, 'adx_thresh': 24.30258479431391, 'atr_min_pct': 0.013586894700077908, 'atr_max_pct': 0.05967224270856787, 'tp_mult': 2.357495488582604, 'tsl_mult': 0.7599693289715707, 'strategy': 'breakout', 'time_stop': 256, 'use_sma': True, 'use_atr': False, 'use_adx': False, 'use_ema': True, 'use_spike': True, 'rsi_required': True, 'edge_k': 0.7819915855688027, 'edge_cap': 0.5834966959406915, 'bull_strategy': 'breakout', 'bull_bb_std_mult': 3.599237270240732, 'bull_rsi_os': 46, 'bull_rsi_ob': 83, 'bull_adx_thresh': 18.244935021405393, 'bull_atr_min_pct': 0.0018541700124169833, 'bull_atr_max_pct': 0.02110815312043704, 'bull_tp_mult': 2.975147375266976, 'bull_tsl_mult': 0.3681993858078536, 'bull_time_stop': 144, 'bull_use_sma': True, 'bull_use_ema': False, 'bull_use_atr': True, 'bull_use_adx': False, 'bull_use_spike': False, 'bull_rsi_required': True, 'bear_strategy': 'mean_reversion', 'bear_bb_std_mult': 0.8224742797294708, 'bear_rsi_os': 55, 'bear_rsi_ob': 73, 'bear_adx_thresh': 23.315624335321736, 'bear_atr_min_pct': 0.002183103847431272, 'bear_atr_max_pct': 0.0744742085757914, 'bear_tp_mult': 1.689862950835841, 'bear_tsl_mult': 0.47228221086111294, 'bear_time_stop': 285, 'bear_use_sma': False, 'bear_use_ema': True, 'bear_use_atr': True, 'bear_use_adx': False, 'bear_use_spike': False, 'bear_rsi_required': True, 'sideways_strategy': 'mean_reversion', 'sideways_bb_std_mult': 0.7889748945921933, 'sideways_rsi_os': 53, 'sideways_rsi_ob': 92, 'sideways_adx_thresh': 21.44436280246224, 'sideways_atr_min_pct': 0.00910201683536519, 'sideways_atr_max_pct': 0.07678871283301421, 'sideways_tp_mult': 2.832701301505426, 'sideways_tsl_mult': 0.46568763729701734, 'sideways_time_stop': 42, 'sideways_use_sma': True, 'sideways_use_ema': False, 'sideways_use_atr': False, 'sideways_use_adx': True, 'sideways_use_spike': True, 'sideways_rsi_required': False}.
[I 2025-09-01 10:13:12,447] Trial 408 finished with values: [-0.033014104861689875, 0.03366997011464859] and parameters: {'p_sma': 24, 'p_std': 50, 'p_atr': 10, 'p_adx': 26, 'rsi_period': 25, 'ema1': 13, 'ema2': 58, 'slip_atr_k': 0.055778624975228966, 'slip_spread_k': 0.42530095701162013, 'spread_hl_frac': 0.003241383686190428, 'bb_std_mult': 1.8793140253161131, 'rsi_os': 42, 'rsi_ob': 86, 'vol_spike': 0.08467815946104429, 'adx_thresh': 24.204904652330683, 'atr_min_pct': 0.009371250395129937, 'atr_max_pct': 0.13362276723307348, 'tp_mult': 1.085574111719365, 'tsl_mult': 0.8509360917258257, 'strategy': 'breakout', 'time_stop': 223, 'use_sma': True, 'use_atr': False, 'use_adx': True, 'use_ema': True, 'use_spike': False, 'rsi_required': False, 'edge_k': 1.8224550659091885, 'edge_cap': 0.7676547457663152, 'bull_strategy': 'mean_reversion', 'bull_bb_std_mult': 2.87763298538108, 'bull_rsi_os': 49, 'bull_rsi_ob': 48, 'bull_adx_thresh': 6.617378959116972, 'bull_atr_min_pct': 0.0009022550888671557, 'bull_atr_max_pct': 0.08540192016835205, 'bull_tp_mult': 2.9129537124028833, 'bull_tsl_mult': 0.3718119850762472, 'bull_time_stop': 128, 'bull_use_sma': False, 'bull_use_ema': False, 'bull_use_atr': True, 'bull_use_adx': True, 'bull_use_spike': True, 'bull_rsi_required': False, 'bear_strategy': 'breakout', 'bear_bb_std_mult': 1.0035085830808166, 'bear_rsi_os': 51, 'bear_rsi_ob': 75, 'bear_adx_thresh': 14.411263477631852, 'bear_atr_min_pct': 0.005230397171539955, 'bear_atr_max_pct': 0.05385533525733722, 'bear_tp_mult': 2.767361288825574, 'bear_tsl_mult': 0.46225250745523505, 'bear_time_stop': 236, 'bear_use_sma': True, 'bear_use_ema': False, 'bear_use_atr': True, 'bear_use_adx': True, 'bear_use_spike': True, 'bear_rsi_required': False, 'sideways_strategy': 'breakout', 'sideways_bb_std_mult': 3.3404068372830946, 'sideways_rsi_os': 43, 'sideways_rsi_ob': 90, 'sideways_adx_thresh': 13.946850689473049, 'sideways_atr_min_pct': 0.010240965802882009, 'sideways_atr_max_pct': 0.10339741330319646, 'sideways_tp_mult': 1.8195895886172762, 'sideways_tsl_mult': 0.6454865096561657, 'sideways_time_stop': 41, 'sideways_use_sma': False, 'sideways_use_ema': False, 'sideways_use_atr': False, 'sideways_use_adx': False, 'sideways_use_spike': False, 'sideways_rsi_required': False}.
[I 2025-09-01 10:13:13,460] Trial 406 finished with values: [-0.033033341558514784, 0.032876504321138006] and parameters: {'p_sma': 17, 'p_std': 42, 'p_atr': 10, 'p_adx': 26, 'rsi_period': 26, 'ema1': 13, 'ema2': 47, 'slip_atr_k': 0.0562208811949697, 'slip_spread_k': 0.6972121735170704, 'spread_hl_frac': 0.002990382453623812, 'bb_std_mult': 3.4678573700725863, 'rsi_os': 45, 'rsi_ob': 86, 'vol_spike': 0.08788683000617753, 'adx_thresh': 32.61050189321627, 'atr_min_pct': 0.013205419011375362, 'atr_max_pct': 0.13488315738385567, 'tp_mult': 1.1742086071907887, 'tsl_mult': 0.7528974182454803, 'strategy': 'breakout', 'time_stop': 73, 'use_sma': True, 'use_atr': False, 'use_adx': True, 'use_ema': True, 'use_spike': True, 'rsi_required': False, 'edge_k': 1.4212061847949777, 'edge_cap': 0.7301696426475359, 'bull_strategy': 'mean_reversion', 'bull_bb_std_mult': 2.8714580958415823, 'bull_rsi_os': 46, 'bull_rsi_ob': 91, 'bull_adx_thresh': 5.025438994694639, 'bull_atr_min_pct': 0.000580205027237837, 'bull_atr_max_pct': 0.08496346329700903, 'bull_tp_mult': 2.8999822801065576, 'bull_tsl_mult': 0.7754588106560757, 'bull_time_stop': 142, 'bull_use_sma': True, 'bull_use_ema': False, 'bull_use_atr': True, 'bull_use_adx': True, 'bull_use_spike': True, 'bull_rsi_required': False, 'bear_strategy': 'breakout', 'bear_bb_std_mult': 3.299861994681696, 'bear_rsi_os': 42, 'bear_rsi_ob': 75, 'bear_adx_thresh': 24.460036458932464, 'bear_atr_min_pct': 0.005147629960735152, 'bear_atr_max_pct': 0.1422415590773155, 'bear_tp_mult': 1.0332027225036433, 'bear_tsl_mult': 0.4827892779415946, 'bear_time_stop': 82, 'bear_use_sma': True, 'bear_use_ema': False, 'bear_use_atr': True, 'bear_use_adx': False, 'bear_use_spike': True, 'bear_rsi_required': False, 'sideways_strategy': 'mean_reversion', 'sideways_bb_std_mult': 1.2817169002937017, 'sideways_rsi_os': 45, 'sideways_rsi_ob': 89, 'sideways_adx_thresh': 21.447840137155158, 'sideways_atr_min_pct': 0.010400602513164148, 'sideways_atr_max_pct': 0.08857440584126021, 'sideways_tp_mult': 2.8319044017326007, 'sideways_tsl_mult': 0.47074983372099427, 'sideways_time_stop': 79, 'sideways_use_sma': False, 'sideways_use_ema': False, 'sideways_use_atr': False, 'sideways_use_adx': False, 'sideways_use_spike': False, 'sideways_rsi_required': False}.
[I 2025-09-01 10:13:14,286] Trial 407 finished with values: [-0.04378725017137863, 0.04366652734296285] and parameters: {'p_sma': 17, 'p_std': 32, 'p_atr': 16, 'p_adx': 26, 'rsi_period': 59, 'ema1': 13, 'ema2': 47, 'slip_atr_k': 0.0547307107704246, 'slip_spread_k': 0.7052552356006703, 'spread_hl_frac': 0.027844733611892988, 'bb_std_mult': 1.947352715235, 'rsi_os': 43, 'rsi_ob': 85, 'vol_spike': 0.08950098958506189, 'adx_thresh': 32.69915187759466, 'atr_min_pct': 0.013570544988516753, 'atr_max_pct': 0.13202805013324265, 'tp_mult': 2.665769689647192, 'tsl_mult': 0.7547421840320855, 'strategy': 'breakout', 'time_stop': 226, 'use_sma': True, 'use_atr': False, 'use_adx': True, 'use_ema': True, 'use_spike': True, 'rsi_required': False, 'edge_k': 0.9479933577793241, 'edge_cap': 0.5808056775155824, 'bull_strategy': 'mean_reversion', 'bull_bb_std_mult': 3.5988218917091945, 'bull_rsi_os': 49, 'bull_rsi_ob': 48, 'bull_adx_thresh': 5.4388959640774726, 'bull_atr_min_pct': 0.0005222655568674657, 'bull_atr_max_pct': 0.11080977052110881, 'bull_tp_mult': 2.9976083066167574, 'bull_tsl_mult': 0.3745396290910405, 'bull_time_stop': 180, 'bull_use_sma': True, 'bull_use_ema': False, 'bull_use_atr': True, 'bull_use_adx': True, 'bull_use_spike': True, 'bull_rsi_required': False, 'bear_strategy': 'breakout', 'bear_bb_std_mult': 1.0438162981743022, 'bear_rsi_os': 28, 'bear_rsi_ob': 75, 'bear_adx_thresh': 24.532482179359867, 'bear_atr_min_pct': 0.005351618284151324, 'bear_atr_max_pct': 0.05319836628978476, 'bear_tp_mult': 2.0597349016547177, 'bear_tsl_mult': 0.48563744153069716, 'bear_time_stop': 294, 'bear_use_sma': True, 'bear_use_ema': False, 'bear_use_atr': True, 'bear_use_adx': False, 'bear_use_spike': True, 'bear_rsi_required': False, 'sideways_strategy': 'mean_reversion', 'sideways_bb_std_mult': 3.148615154938893, 'sideways_rsi_os': 43, 'sideways_rsi_ob': 89, 'sideways_adx_thresh': 20.78498846461285, 'sideways_atr_min_pct': 0.010284346884316925, 'sideways_atr_max_pct': 0.07239463025272011, 'sideways_tp_mult': 2.59257941349111, 'sideways_tsl_mult': 0.47235979966905633, 'sideways_time_stop': 42, 'sideways_use_sma': False, 'sideways_use_ema': False, 'sideways_use_atr': False, 'sideways_use_adx': False, 'sideways_use_spike': False, 'sideways_rsi_required': False}.
[I 2025-09-01 10:13:14,829] Trial 409 finished with values: [-1000000000.0, 1000000000.0] and parameters: {'p_sma': 20, 'p_std': 52, 'p_atr': 11, 'p_adx': 24, 'rsi_period': 81, 'ema1': 13, 'ema2': 16, 'slip_atr_k': 0.055797593555713725, 'slip_spread_k': 0.4315730881876983, 'spread_hl_frac': 0.04013902741770163, 'bb_std_mult': 3.483501153795134, 'rsi_os': 28, 'rsi_ob': 69, 'vol_spike': 0.12301882517252481, 'adx_thresh': 13.74649020349942, 'atr_min_pct': 0.010294027712297538, 'atr_max_pct': 0.134372494597175, 'tp_mult': 1.0911302922926318, 'tsl_mult': 0.3442793133472448, 'strategy': 'mean_reversion', 'time_stop': 227, 'use_sma': False, 'use_atr': True, 'use_adx': True, 'use_ema': True, 'use_spike': False, 'rsi_required': False, 'edge_k': 1.2735819494121294, 'edge_cap': 0.7338379592413362, 'bull_strategy': 'mean_reversion', 'bull_bb_std_mult': 3.545897369058943, 'bull_rsi_os': 35, 'bull_rsi_ob': 91, 'bull_adx_thresh': 6.706649316644663, 'bull_atr_min_pct': 0.0005665871231531866, 'bull_atr_max_pct': 0.0841169606269433, 'bull_tp_mult': 2.904621844644215, 'bull_tsl_mult': 0.7081046578118962, 'bull_time_stop': 180, 'bull_use_sma': False, 'bull_use_ema': True, 'bull_use_atr': True, 'bull_use_adx': True, 'bull_use_spike': True, 'bull_rsi_required': False, 'bear_strategy': 'breakout', 'bear_bb_std_mult': 1.0237898084181491, 'bear_rsi_os': 28, 'bear_rsi_ob': 75, 'bear_adx_thresh': 14.384667112366754, 'bear_atr_min_pct': 0.005197455718992993, 'bear_atr_max_pct': 0.05358643950457463, 'bear_tp_mult': 2.0611221419642005, 'bear_tsl_mult': 0.4931653835235225, 'bear_time_stop': 296, 'bear_use_sma': True, 'bear_use_ema': False, 'bear_use_atr': True, 'bear_use_adx': True, 'bear_use_spike': True, 'bear_rsi_required': False, 'sideways_strategy': 'breakout', 'sideways_bb_std_mult': 1.5204741759893605, 'sideways_rsi_os': 14, 'sideways_rsi_ob': 89, 'sideways_adx_thresh': 13.463757138833893, 'sideways_atr_min_pct': 0.010222036175084787, 'sideways_atr_max_pct': 0.07105791200957144, 'sideways_tp_mult': 1.825716122288804, 'sideways_tsl_mult': 0.5279029712792099, 'sideways_time_stop': 9, 'sideways_use_sma': False, 'sideways_use_ema': False, 'sideways_use_atr': True, 'sideways_use_adx': False, 'sideways_use_spike': False, 'sideways_rsi_required': False}.
[I 2025-09-01 10:13:56,426] Trial 410 finished with values: [-1000000000.0, 1000000000.0] and parameters: {'p_sma': 15, 'p_std': 42, 'p_atr': 16, 'p_adx': 24, 'rsi_period': 23, 'ema1': 18, 'ema2': 14, 'slip_atr_k': 0.04840874979452327, 'slip_spread_k': 0.6589933544096174, 'spread_hl_frac': 0.03066354006890498, 'bb_std_mult': 3.4618495032487537, 'rsi_os': 20, 'rsi_ob': 67, 'vol_spike': 0.08923234295270709, 'adx_thresh': 14.631600759034963, 'atr_min_pct': 0.010251217506195481, 'atr_max_pct': 0.14173402523828865, 'tp_mult': 2.6617708395259, 'tsl_mult': 0.6788436039445614, 'strategy': 'mean_reversion', 'time_stop': 199, 'use_sma': False, 'use_atr': True, 'use_adx': True, 'use_ema': True, 'use_spike': True, 'rsi_required': True, 'edge_k': 1.413110703259215, 'edge_cap': 0.33724326853532355, 'bull_strategy': 'mean_reversion', 'bull_bb_std_mult': 1.3511409315881209, 'bull_rsi_os': 31, 'bull_rsi_ob': 47, 'bull_adx_thresh': 26.053323789354803, 'bull_atr_min_pct': 0.0005442229142794506, 'bull_atr_max_pct': 0.08291622117655026, 'bull_tp_mult': 2.903477092878004, 'bull_tsl_mult': 0.4172688326741247, 'bull_time_stop': 111, 'bull_use_sma': True, 'bull_use_ema': True, 'bull_use_atr': True, 'bull_use_adx': False, 'bull_use_spike': False, 'bull_rsi_required': True, 'bear_strategy': 'breakout', 'bear_bb_std_mult': 3.2181564271663685, 'bear_rsi_os': 28, 'bear_rsi_ob': 76, 'bear_adx_thresh': 21.621310075780485, 'bear_atr_min_pct': 0.005970462583979573, 'bear_atr_max_pct': 0.03355893158126559, 'bear_tp_mult': 1.263077531922342, 'bear_tsl_mult': 0.47890377069145, 'bear_time_stop': 296, 'bear_use_sma': True, 'bear_use_ema': False, 'bear_use_atr': True, 'bear_use_adx': False, 'bear_use_spike': True, 'bear_rsi_required': False, 'sideways_strategy': 'mean_reversion', 'sideways_bb_std_mult': 2.4704168352732063, 'sideways_rsi_os': 14, 'sideways_rsi_ob': 71, 'sideways_adx_thresh': 24.088986511957856, 'sideways_atr_min_pct': 0.019928804211707864, 'sideways_atr_max_pct': 0.07175931867233416, 'sideways_tp_mult': 2.4090288312927552, 'sideways_tsl_mult': 0.3928236719988986, 'sideways_time_stop': 6, 'sideways_use_sma': False, 'sideways_use_ema': False, 'sideways_use_atr': True, 'sideways_use_adx': True, 'sideways_use_spike': False, 'sideways_rsi_required': False}.
[I 2025-09-01 10:13:57,324] Trial 413 finished with values: [-1000000000.0, 1000000000.0] and parameters: {'p_sma': 13, 'p_std': 45, 'p_atr': 27, 'p_adx': 24, 'rsi_period': 79, 'ema1': 26, 'ema2': 31, 'slip_atr_k': 0.15322154279137906, 'slip_spread_k': 0.6574956769743072, 'spread_hl_frac': 0.03077080608094592, 'bb_std_mult': 3.0354063449224413, 'rsi_os': 21, 'rsi_ob': 63, 'vol_spike': 0.11040289428992951, 'adx_thresh': 31.713637918075626, 'atr_min_pct': 0.007458032304359183, 'atr_max_pct': 0.14254489625867728, 'tp_mult': 1.2265916199908424, 'tsl_mult': 0.6747890915511885, 'strategy': 'mean_reversion', 'time_stop': 265, 'use_sma': False, 'use_atr': True, 'use_adx': False, 'use_ema': False, 'use_spike': True, 'rsi_required': True, 'edge_k': 0.16904391005339692, 'edge_cap': 0.5546109799297023, 'bull_strategy': 'mean_reversion', 'bull_bb_std_mult': 2.403200043505465, 'bull_rsi_os': 44, 'bull_rsi_ob': 47, 'bull_adx_thresh': 8.520369439308602, 'bull_atr_min_pct': 0.02116538371885003, 'bull_atr_max_pct': 0.11423280469518018, 'bull_tp_mult': 2.9507944794733487, 'bull_tsl_mult': 0.46185792714436325, 'bull_time_stop': 49, 'bull_use_sma': True, 'bull_use_ema': True, 'bull_use_atr': False, 'bull_use_adx': False, 'bull_use_spike': False, 'bull_rsi_required': True, 'bear_strategy': 'mean_reversion', 'bear_bb_std_mult': 0.9072352576799348, 'bear_rsi_os': 53, 'bear_rsi_ob': 76, 'bear_adx_thresh': 25.392300849370205, 'bear_atr_min_pct': 0.006465758811411188, 'bear_atr_max_pct': 0.010052867976883983, 'bear_tp_mult': 1.2447301739830168, 'bear_tsl_mult': 0.5229923397303361, 'bear_time_stop': 300, 'bear_use_sma': True, 'bear_use_ema': False, 'bear_use_atr': False, 'bear_use_adx': False, 'bear_use_spike': False, 'bear_rsi_required': False, 'sideways_strategy': 'mean_reversion', 'sideways_bb_std_mult': 0.9414943393134553, 'sideways_rsi_os': 15, 'sideways_rsi_ob': 58, 'sideways_adx_thresh': 23.042511885675612, 'sideways_atr_min_pct': 0.011380717852307539, 'sideways_atr_max_pct': 0.06616572354053492, 'sideways_tp_mult': 2.410570245340341, 'sideways_tsl_mult': 0.4064102922247642, 'sideways_time_stop': 69, 'sideways_use_sma': True, 'sideways_use_ema': True, 'sideways_use_atr': True, 'sideways_use_adx': True, 'sideways_use_spike': False, 'sideways_rsi_required': False}.
[I 2025-09-01 10:13:58,039] Trial 412 finished with values: [-1000000000.0, 1000000000.0] and parameters: {'p_sma': 14, 'p_std': 22, 'p_atr': 27, 'p_adx': 24, 'rsi_period': 79, 'ema1': 18, 'ema2': 15, 'slip_atr_k': 0.15290395867616088, 'slip_spread_k': 0.942562315686189, 'spread_hl_frac': 0.02935337455295633, 'bb_std_mult': 1.4974030120205628, 'rsi_os': 21, 'rsi_ob': 73, 'vol_spike': 0.10632864188431435, 'adx_thresh': 14.520598515450464, 'atr_min_pct': 0.0256672594645025, 'atr_max_pct': 0.1403818427718787, 'tp_mult': 1.1196540080642743, 'tsl_mult': 0.994901933238963, 'strategy': 'mean_reversion', 'time_stop': 14, 'use_sma': False, 'use_atr': True, 'use_adx': False, 'use_ema': False, 'use_spike': True, 'rsi_required': True, 'edge_k': 0.4123910768956508, 'edge_cap': 0.09843155930861036, 'bull_strategy': 'mean_reversion', 'bull_bb_std_mult': 2.4314415462131156, 'bull_rsi_os': 5, 'bull_rsi_ob': 60, 'bull_adx_thresh': 12.273076326969985, 'bull_atr_min_pct': 0.001533829636483423, 'bull_atr_max_pct': 0.11413958366694707, 'bull_tp_mult': 2.9573916783060645, 'bull_tsl_mult': 0.46322656051154687, 'bull_time_stop': 193, 'bull_use_sma': True, 'bull_use_ema': True, 'bull_use_atr': False, 'bull_use_adx': False, 'bull_use_spike': False, 'bull_rsi_required': True, 'bear_strategy': 'mean_reversion', 'bear_bb_std_mult': 3.2340967521522055, 'bear_rsi_os': 53, 'bear_rsi_ob': 76, 'bear_adx_thresh': 25.31039898538825, 'bear_atr_min_pct': 0.006279265667269163, 'bear_atr_max_pct': 0.03325887071378046, 'bear_tp_mult': 1.2478005024350947, 'bear_tsl_mult': 0.5075696214746752, 'bear_time_stop': 290, 'bear_use_sma': True, 'bear_use_ema': False, 'bear_use_atr': False, 'bear_use_adx': False, 'bear_use_spike': False, 'bear_rsi_required': False, 'sideways_strategy': 'mean_reversion', 'sideways_bb_std_mult': 1.0511283062034182, 'sideways_rsi_os': 50, 'sideways_rsi_ob': 91, 'sideways_adx_thresh': 11.493474669177118, 'sideways_atr_min_pct': 0.019627903388003742, 'sideways_atr_max_pct': 0.11725319971282905, 'sideways_tp_mult': 2.4106847218474696, 'sideways_tsl_mult': 0.39884261117637, 'sideways_time_stop': 19, 'sideways_use_sma': True, 'sideways_use_ema': True, 'sideways_use_atr': True, 'sideways_use_adx': True, 'sideways_use_spike': False, 'sideways_rsi_required': False}.
[I 2025-09-01 10:13:58,985] Trial 411 finished with values: [-1000000000.0, 1000000000.0] and parameters: {'p_sma': 15, 'p_std': 46, 'p_atr': 18, 'p_adx': 24, 'rsi_period': 81, 'ema1': 18, 'ema2': 14, 'slip_atr_k': 0.04727041062446907, 'slip_spread_k': 0.6513075566367891, 'spread_hl_frac': 0.042331719514827754, 'bb_std_mult': 2.7699869594731426, 'rsi_os': 43, 'rsi_ob': 63, 'vol_spike': 0.11498273250573633, 'adx_thresh': 32.01529557494884, 'atr_min_pct': 0.010296335146660854, 'atr_max_pct': 0.14173235970072046, 'tp_mult': 2.673994425511328, 'tsl_mult': 0.6789492949155321, 'strategy': 'mean_reversion', 'time_stop': 16, 'use_sma': False, 'use_atr': True, 'use_adx': False, 'use_ema': True, 'use_spike': False, 'rsi_required': True, 'edge_k': 0.39930249965429077, 'edge_cap': 0.07879903358632229, 'bull_strategy': 'mean_reversion', 'bull_bb_std_mult': 3.5336084222631126, 'bull_rsi_os': 19, 'bull_rsi_ob': 75, 'bull_adx_thresh': 6.914761008245874, 'bull_atr_min_pct': 0.0073762222334055145, 'bull_atr_max_pct': 0.11423536453210578, 'bull_tp_mult': 2.960417696580091, 'bull_tsl_mult': 0.10832020846732049, 'bull_time_stop': 106, 'bull_use_sma': True, 'bull_use_ema': True, 'bull_use_atr': True, 'bull_use_adx': False, 'bull_use_spike': False, 'bull_rsi_required': True, 'bear_strategy': 'mean_reversion', 'bear_bb_std_mult': 1.037297530017894, 'bear_rsi_os': 36, 'bear_rsi_ob': 76, 'bear_adx_thresh': 25.369641182354155, 'bear_atr_min_pct': 0.005802453760415541, 'bear_atr_max_pct': 0.04009336935185268, 'bear_tp_mult': 1.2353200180496435, 'bear_tsl_mult': 0.5186646309635856, 'bear_time_stop': 296, 'bear_use_sma': True, 'bear_use_ema': False, 'bear_use_atr': False, 'bear_use_adx': False, 'bear_use_spike': False, 'bear_rsi_required': False, 'sideways_strategy': 'mean_reversion', 'sideways_bb_std_mult': 1.0742437432556948, 'sideways_rsi_os': 14, 'sideways_rsi_ob': 91, 'sideways_adx_thresh': 23.611742147543527, 'sideways_atr_min_pct': 0.017638536749314374, 'sideways_atr_max_pct': 0.010338281983558947, 'sideways_tp_mult': 2.4058068577615166, 'sideways_tsl_mult': 0.5204063628444885, 'sideways_time_stop': 258, 'sideways_use_sma': True, 'sideways_use_ema': True, 'sideways_use_atr': True, 'sideways_use_adx': True, 'sideways_use_spike': False, 'sideways_rsi_required': False}.
