[I 2025-09-01 10:09:44,610] Trial 386 finished with values: [-1000000000.0, 1000000000.0] and parameters: {'p_sma': 8, 'p_std': 54, 'p_atr': 17, 'p_adx': 25, 'rsi_period': 23, 'ema1': 18, 'ema2': 54, 'slip_atr_k': 0.051850342047812865, 'slip_spread_k': 0.6675628602255955, 'spread_hl_frac': 1.8166241823543844e-05, 'bb_std_mult': 1.3250258731040856, 'rsi_os': 42, 'rsi_ob': 69, 'vol_spike': 0.07793142534463876, 'adx_thresh': 33.26699002453703, 'atr_min_pct': 0.0204343792124993, 'atr_max_pct': 0.11216226650741529, 'tp_mult': 1.8816795013433347, 'tsl_mult': 0.1897722887427145, 'strategy': 'breakout', 'time_stop': 94, 'use_sma': True, 'use_atr': True, 'use_adx': True, 'use_ema': True, 'use_spike': True, 'rsi_required': True, 'edge_k': 0.598368225270475, 'edge_cap': 0.5636577835580422, 'bull_strategy': 'mean_reversion', 'bull_bb_std_mult': 3.3528137828739615, 'bull_rsi_os': 24, 'bull_rsi_ob': 45, 'bull_adx_thresh': 7.619000066569001, 'bull_atr_min_pct': 0.0013743682872191336, 'bull_atr_max_pct': 0.08928532872960222, 'bull_tp_mult': 2.9668756457024745, 'bull_tsl_mult': 0.41733730539687197, 'bull_time_stop': 208, 'bull_use_sma': True, 'bull_use_ema': False, 'bull_use_atr': True, 'bull_use_adx': False, 'bull_use_spike': False, 'bull_rsi_required': True, 'bear_strategy': 'mean_reversion', 'bear_bb_std_mult': 2.4697102069451, 'bear_rsi_os': 54, 'bear_rsi_ob': 75, 'bear_adx_thresh': 26.446623891476253, 'bear_atr_min_pct': 0.00018253422988804592, 'bear_atr_max_pct': 0.051192510627380956, 'bear_tp_mult': 1.0942594897335998, 'bear_tsl_mult': 0.4928341501696253, 'bear_time_stop': 250, 'bear_use_sma': False, 'bear_use_ema': False, 'bear_use_atr': True, 'bear_use_adx': False, 'bear_use_spike': True, 'bear_rsi_required': True, 'sideways_strategy': 'mean_reversion', 'sideways_bb_std_mult': 2.864363259163453, 'sideways_rsi_os': 52, 'sideways_rsi_ob': 86, 'sideways_adx_thresh': 22.254020329337347, 'sideways_atr_min_pct': 0.009841312075597837, 'sideways_atr_max_pct': 0.1344437086066234, 'sideways_tp_mult': 2.4193394706128157, 'sideways_tsl_mult': 0.5829964275279826, 'sideways_time_stop': 35, 'sideways_use_sma': True, 'sideways_use_ema': False, 'sideways_use_atr': False, 'sideways_use_adx': True, 'sideways_use_spike': True, 'sideways_rsi_required': False}.
[I 2025-09-01 10:09:45,270] Trial 388 finished with values: [-1000000000.0, 1000000000.0] and parameters: {'p_sma': 8, 'p_std': 54, 'p_atr': 17, 'p_adx': 25, 'rsi_period': 24, 'ema1': 18, 'ema2': 10, 'slip_atr_k': 0.05050832650664011, 'slip_spread_k': 0.20327695822591302, 'spread_hl_frac': 0.03820357283435691, 'bb_std_mult': 1.3906330951217218, 'rsi_os': 50, 'rsi_ob': 89, 'vol_spike': 0.07656308385182752, 'adx_thresh': 33.272322871628, 'atr_min_pct': 0.012514841948256271, 'atr_max_pct': 0.06416920896251489, 'tp_mult': 1.36497831340164, 'tsl_mult': 0.6926025832411024, 'strategy': 'breakout', 'time_stop': 165, 'use_sma': True, 'use_atr': True, 'use_adx': True, 'use_ema': True, 'use_spike': True, 'rsi_required': False, 'edge_k': 1.2432349776695755, 'edge_cap': 0.6391836120353663, 'bull_strategy': 'breakout', 'bull_bb_std_mult': 3.535940742413292, 'bull_rsi_os': 45, 'bull_rsi_ob': 48, 'bull_adx_thresh': 7.291105573132732, 'bull_atr_min_pct': 0.0012276237136656576, 'bull_atr_max_pct': 0.07802299020733236, 'bull_tp_mult': 2.975125175084694, 'bull_tsl_mult': 0.6544855723113161, 'bull_time_stop': 206, 'bull_use_sma': False, 'bull_use_ema': False, 'bull_use_atr': True, 'bull_use_adx': False, 'bull_use_spike': False, 'bull_rsi_required': False, 'bear_strategy': 'mean_reversion', 'bear_bb_std_mult': 2.56138269615861, 'bear_rsi_os': 54, 'bear_rsi_ob': 74, 'bear_adx_thresh': 26.15679126204733, 'bear_atr_min_pct': 0.007638230433587006, 'bear_atr_max_pct': 0.06901677304929169, 'bear_tp_mult': 1.1366015932651359, 'bear_tsl_mult': 0.4976769709649471, 'bear_time_stop': 273, 'bear_use_sma': False, 'bear_use_ema': True, 'bear_use_atr': True, 'bear_use_adx': False, 'bear_use_spike': True, 'bear_rsi_required': True, 'sideways_strategy': 'mean_reversion', 'sideways_bb_std_mult': 3.2698754938315706, 'sideways_rsi_os': 11, 'sideways_rsi_ob': 86, 'sideways_adx_thresh': 12.896225876424497, 'sideways_atr_min_pct': 0.008416721049116732, 'sideways_atr_max_pct': 0.1499203399182762, 'sideways_tp_mult': 1.1684994946473757, 'sideways_tsl_mult': 0.45696737245081076, 'sideways_time_stop': 35, 'sideways_use_sma': True, 'sideways_use_ema': False, 'sideways_use_atr': False, 'sideways_use_adx': False, 'sideways_use_spike': True, 'sideways_rsi_required': False}.
[I 2025-09-01 10:10:25,605] Trial 391 finished with values: [-1000000000.0, 1000000000.0] and parameters: {'p_sma': 19, 'p_std': 34, 'p_atr': 19, 'p_adx': 25, 'rsi_period': 24, 'ema1': 19, 'ema2': 21, 'slip_atr_k': 0.0972829321287576, 'slip_spread_k': 0.17324750623443852, 'spread_hl_frac': 0.028882251901213622, 'bb_std_mult': 1.439201555103761, 'rsi_os': 13, 'rsi_ob': 72, 'vol_spike': 0.060422918532553715, 'adx_thresh': 32.11361705966213, 'atr_min_pct': 0.022317363879413438, 'atr_max_pct': 0.14589970942369215, 'tp_mult': 1.0419138024906982, 'tsl_mult': 0.9320760503677271, 'strategy': 'breakout', 'time_stop': 255, 'use_sma': True, 'use_atr': False, 'use_adx': False, 'use_ema': True, 'use_spike': False, 'rsi_required': False, 'edge_k': 1.2404418263557964, 'edge_cap': 0.5937163385459775, 'bull_strategy': 'mean_reversion', 'bull_bb_std_mult': 0.5547223176961074, 'bull_rsi_os': 45, 'bull_rsi_ob': 48, 'bull_adx_thresh': 13.658878921497784, 'bull_atr_min_pct': 0.025134366827483753, 'bull_atr_max_pct': 0.08180376232799151, 'bull_tp_mult': 2.9340401407467627, 'bull_tsl_mult': 0.44233517751425955, 'bull_time_stop': 198, 'bull_use_sma': True, 'bull_use_ema': False, 'bull_use_atr': True, 'bull_use_adx': True, 'bull_use_spike': True, 'bull_rsi_required': False, 'bear_strategy': 'breakout', 'bear_bb_std_mult': 2.3309488805353946, 'bear_rsi_os': 39, 'bear_rsi_ob': 74, 'bear_adx_thresh': 24.685873944183324, 'bear_atr_min_pct': 0.02081951132387088, 'bear_atr_max_pct': 0.06711732563463223, 'bear_tp_mult': 1.133050014255999, 'bear_tsl_mult': 0.45689091922035, 'bear_time_stop': 273, 'bear_use_sma': True, 'bear_use_ema': False, 'bear_use_atr': False, 'bear_use_adx': True, 'bear_use_spike': False, 'bear_rsi_required': False, 'sideways_strategy': 'breakout', 'sideways_bb_std_mult': 3.445699811424859, 'sideways_rsi_os': 18, 'sideways_rsi_ob': 74, 'sideways_adx_thresh': 19.62508283520743, 'sideways_atr_min_pct': 0.008551398927784948, 'sideways_atr_max_pct': 0.1222170060809176, 'sideways_tp_mult': 1.169253955605453, 'sideways_tsl_mult': 0.21437780174367838, 'sideways_time_stop': 14, 'sideways_use_sma': False, 'sideways_use_ema': False, 'sideways_use_atr': True, 'sideways_use_adx': False, 'sideways_use_spike': False, 'sideways_rsi_required': False}.
[I 2025-09-01 10:10:26,545] Trial 390 finished with values: [-0.038628171603660166, 0.038496681161852085] and parameters: {'p_sma': 19, 'p_std': 34, 'p_atr': 19, 'p_adx': 25, 'rsi_period': 24, 'ema1': 18, 'ema2': 16, 'slip_atr_k': 0.11740282643220716, 'slip_spread_k': 0.08158112549557028, 'spread_hl_frac': 0.007567483149554653, 'bb_std_mult': 1.4555917300355252, 'rsi_os': 23, 'rsi_ob': 72, 'vol_spike': 0.1918751941748138, 'adx_thresh': 32.043531673098826, 'atr_min_pct': 0.005775576644563194, 'atr_max_pct': 0.14637213887592276, 'tp_mult': 1.1013508153723952, 'tsl_mult': 0.8771058926822533, 'strategy': 'breakout', 'time_stop': 114, 'use_sma': True, 'use_atr': False, 'use_adx': False, 'use_ema': True, 'use_spike': True, 'rsi_required': True, 'edge_k': 0.5832165616792847, 'edge_cap': 0.5673466491489346, 'bull_strategy': 'mean_reversion', 'bull_bb_std_mult': 0.5576482861446848, 'bull_rsi_os': 45, 'bull_rsi_ob': 93, 'bull_adx_thresh': 7.376256735583786, 'bull_atr_min_pct': 0.0011708452082981032, 'bull_atr_max_pct': 0.07822450835748676, 'bull_tp_mult': 2.955906925790716, 'bull_tsl_mult': 0.653215283661801, 'bull_time_stop': 199, 'bull_use_sma': True, 'bull_use_ema': False, 'bull_use_atr': True, 'bull_use_adx': False, 'bull_use_spike': False, 'bull_rsi_required': True, 'bear_strategy': 'mean_reversion', 'bear_bb_std_mult': 0.9719852390250263, 'bear_rsi_os': 14, 'bear_rsi_ob': 74, 'bear_adx_thresh': 26.077725831480937, 'bear_atr_min_pct': 0.020558593977365057, 'bear_atr_max_pct': 0.06776128685918588, 'bear_tp_mult': 1.1399060477685548, 'bear_tsl_mult': 0.5025464190346263, 'bear_time_stop': 294, 'bear_use_sma': True, 'bear_use_ema': False, 'bear_use_atr': True, 'bear_use_adx': True, 'bear_use_spike': False, 'bear_rsi_required': False, 'sideways_strategy': 'breakout', 'sideways_bb_std_mult': 2.852155932804053, 'sideways_rsi_os': 6, 'sideways_rsi_ob': 89, 'sideways_adx_thresh': 25.46532914662855, 'sideways_atr_min_pct': 0.008711764415613795, 'sideways_atr_max_pct': 0.03802213551399518, 'sideways_tp_mult': 2.4492873651599276, 'sideways_tsl_mult': 0.4248495827006629, 'sideways_time_stop': 19, 'sideways_use_sma': False, 'sideways_use_ema': False, 'sideways_use_atr': True, 'sideways_use_adx': True, 'sideways_use_spike': False, 'sideways_rsi_required': False}.
[I 2025-09-01 10:10:26,765] Trial 389 finished with values: [-1000000000.0, 1000000000.0] and parameters: {'p_sma': 19, 'p_std': 30, 'p_atr': 19, 'p_adx': 25, 'rsi_period': 24, 'ema1': 18, 'ema2': 16, 'slip_atr_k': 0.04981688915017411, 'slip_spread_k': 0.08608153185014566, 'spread_hl_frac': 0.0077516580382012805, 'bb_std_mult': 1.447268487352436, 'rsi_os': 15, 'rsi_ob': 89, 'vol_spike': 0.14805160188692806, 'adx_thresh': 32.43831462424167, 'atr_min_pct': 0.005622748297894923, 'atr_max_pct': 0.06464616544205191, 'tp_mult': 1.0441249666943941, 'tsl_mult': 0.6014770746836545, 'strategy': 'breakout', 'time_stop': 117, 'use_sma': True, 'use_atr': False, 'use_adx': False, 'use_ema': True, 'use_spike': True, 'rsi_required': True, 'edge_k': 1.1845503156794643, 'edge_cap': 0.5608441537231391, 'bull_strategy': 'mean_reversion', 'bull_bb_std_mult': 3.5971335274111373, 'bull_rsi_os': 28, 'bull_rsi_ob': 64, 'bull_adx_thresh': 7.498026668514256, 'bull_atr_min_pct': 0.025102506368575424, 'bull_atr_max_pct': 0.08227075199721726, 'bull_tp_mult': 2.9998789618040536, 'bull_tsl_mult': 0.43567948027935754, 'bull_time_stop': 241, 'bull_use_sma': True, 'bull_use_ema': False, 'bull_use_atr': True, 'bull_use_adx': False, 'bull_use_spike': False, 'bull_rsi_required': True, 'bear_strategy': 'mean_reversion', 'bear_bb_std_mult': 0.9868133353134732, 'bear_rsi_os': 14, 'bear_rsi_ob': 74, 'bear_adx_thresh': 15.611327743220235, 'bear_atr_min_pct': 0.006215387056590879, 'bear_atr_max_pct': 0.06722369704915669, 'bear_tp_mult': 1.2124083376770893, 'bear_tsl_mult': 0.4466494424012864, 'bear_time_stop': 273, 'bear_use_sma': True, 'bear_use_ema': False, 'bear_use_atr': True, 'bear_use_adx': True, 'bear_use_spike': False, 'bear_rsi_required': False, 'sideways_strategy': 'breakout', 'sideways_bb_std_mult': 3.0232158525457664, 'sideways_rsi_os': 55, 'sideways_rsi_ob': 95, 'sideways_adx_thresh': 12.899242939165287, 'sideways_atr_min_pct': 0.009880414355333298, 'sideways_atr_max_pct': 0.12256025145682468, 'sideways_tp_mult': 1.1692669577540469, 'sideways_tsl_mult': 0.4286178949916064, 'sideways_time_stop': 215, 'sideways_use_sma': False, 'sideways_use_ema': False, 'sideways_use_atr': True, 'sideways_use_adx': True, 'sideways_use_spike': False, 'sideways_rsi_required': False}.
[I 2025-09-01 10:10:27,313] Trial 392 finished with values: [-0.05550355143418384, 0.05535337691316752] and parameters: {'p_sma': 21, 'p_std': 9, 'p_atr': 19, 'p_adx': 25, 'rsi_period': 22, 'ema1': 14, 'ema2': 16, 'slip_atr_k': 0.04478975674144149, 'slip_spread_k': 0.2579710434027262, 'spread_hl_frac': 0.029000825793038615, 'bb_std_mult': 1.4552864381030892, 'rsi_os': 31, 'rsi_ob': 71, 'vol_spike': 0.22798958717214285, 'adx_thresh': 32.3858728319426, 'atr_min_pct': 0.0188045020108082, 'atr_max_pct': 0.10230890988114733, 'tp_mult': 1.0382311009544742, 'tsl_mult': 0.6873180110645316, 'strategy': 'breakout', 'time_stop': 118, 'use_sma': True, 'use_atr': False, 'use_adx': False, 'use_ema': False, 'use_spike': False, 'rsi_required': True, 'edge_k': 1.1807064035808945, 'edge_cap': 0.5938469615804044, 'bull_strategy': 'mean_reversion', 'bull_bb_std_mult': 1.0704372373245574, 'bull_rsi_os': 51, 'bull_rsi_ob': 46, 'bull_adx_thresh': 30.99132132082614, 'bull_atr_min_pct': 0.0005983157375217993, 'bull_atr_max_pct': 0.10647645413916124, 'bull_tp_mult': 2.93218862896535, 'bull_tsl_mult': 0.43780599824900934, 'bull_time_stop': 242, 'bull_use_sma': True, 'bull_use_ema': False, 'bull_use_atr': False, 'bull_use_adx': True, 'bull_use_spike': True, 'bull_rsi_required': True, 'bear_strategy': 'breakout', 'bear_bb_std_mult': 2.327339826284068, 'bear_rsi_os': 55, 'bear_rsi_ob': 73, 'bear_adx_thresh': 15.793335545095061, 'bear_atr_min_pct': 0.00618327373143589, 'bear_atr_max_pct': 0.08102112655126209, 'bear_tp_mult': 1.548169499860857, 'bear_tsl_mult': 0.4566167974653218, 'bear_time_stop': 119, 'bear_use_sma': True, 'bear_use_ema': False, 'bear_use_atr': False, 'bear_use_adx': True, 'bear_use_spike': False, 'bear_rsi_required': False, 'sideways_strategy': 'breakout', 'sideways_bb_std_mult': 0.7082819095629811, 'sideways_rsi_os': 37, 'sideways_rsi_ob': 90, 'sideways_adx_thresh': 23.744671019845697, 'sideways_atr_min_pct': 0.00993414918876881, 'sideways_atr_max_pct': 0.031879678031432594, 'sideways_tp_mult': 2.371933622078646, 'sideways_tsl_mult': 0.8091625327118397, 'sideways_time_stop': 16, 'sideways_use_sma': False, 'sideways_use_ema': True, 'sideways_use_atr': True, 'sideways_use_adx': True, 'sideways_use_spike': False, 'sideways_rsi_required': False}.
[I 2025-09-01 10:10:28,095] Trial 394 finished with values: [-1000000000.0, 1000000000.0] and parameters: {'p_sma': 21, 'p_std': 49, 'p_atr': 18, 'p_adx': 26, 'rsi_period': 22, 'ema1': 15, 'ema2': 34, 'slip_atr_k': 0.01353595438056275, 'slip_spread_k': 0.5030484624908264, 'spread_hl_frac': 0.029765725967097558, 'bb_std_mult': 1.668265793274752, 'rsi_os': 48, 'rsi_ob': 48, 'vol_spike': 0.14866621368400054, 'adx_thresh': 31.195848972522988, 'atr_min_pct': 0.004403504460007759, 'atr_max_pct': 0.10146028958911302, 'tp_mult': 1.085257968424032, 'tsl_mult': 0.6091717544051177, 'strategy': 'mean_reversion', 'time_stop': 236, 'use_sma': False, 'use_atr': False, 'use_adx': False, 'use_ema': False, 'use_spike': True, 'rsi_required': True, 'edge_k': 1.180030898249242, 'edge_cap': 0.21994431989792457, 'bull_strategy': 'mean_reversion', 'bull_bb_std_mult': 1.5304180680909067, 'bull_rsi_os': 48, 'bull_rsi_ob': 50, 'bull_adx_thresh': 33.46778031811564, 'bull_atr_min_pct': 0.003719805385308171, 'bull_atr_max_pct': 0.10557986479272924, 'bull_tp_mult': 2.999928221216636, 'bull_tsl_mult': 0.1782129272621391, 'bull_time_stop': 70, 'bull_use_sma': True, 'bull_use_ema': True, 'bull_use_atr': False, 'bull_use_adx': True, 'bull_use_spike': True, 'bull_rsi_required': True, 'bear_strategy': 'mean_reversion', 'bear_bb_std_mult': 0.9679641304183119, 'bear_rsi_os': 23, 'bear_rsi_ob': 77, 'bear_adx_thresh': 6.205236807671367, 'bear_atr_min_pct': 0.006191482489437739, 'bear_atr_max_pct': 0.027598425756931146, 'bear_tp_mult': 1.6143783336070245, 'bear_tsl_mult': 0.4469793536877496, 'bear_time_stop': 147, 'bear_use_sma': True, 'bear_use_ema': False, 'bear_use_atr': True, 'bear_use_adx': False, 'bear_use_spike': False, 'bear_rsi_required': False, 'sideways_strategy': 'mean_reversion', 'sideways_bb_std_mult': 1.1914599298856041, 'sideways_rsi_os': 55, 'sideways_rsi_ob': 90, 'sideways_adx_thresh': 5.568575509952577, 'sideways_atr_min_pct': 0.009820810469306343, 'sideways_atr_max_pct': 0.07068440142591305, 'sideways_tp_mult': 1.4996749469108215, 'sideways_tsl_mult': 0.514532915388473, 'sideways_time_stop': 179, 'sideways_use_sma': True, 'sideways_use_ema': True, 'sideways_use_atr': False, 'sideways_use_adx': True, 'sideways_use_spike': False, 'sideways_rsi_required': True}.
[I 2025-09-01 10:11:08,009] Trial 397 finished with values: [-1000000000.0, 1000000000.0] and parameters: {'p_sma': 14, 'p_std': 48, 'p_atr': 8, 'p_adx': 26, 'rsi_period': 22, 'ema1': 17, 'ema2': 13, 'slip_atr_k': 0.18451751984776227, 'slip_spread_k': 0.6333288866074738, 'spread_hl_frac': 0.015823214565188155, 'bb_std_mult': 3.108237966570314, 'rsi_os': 41, 'rsi_ob': 66, 'vol_spike': 0.2093477820051847, 'adx_thresh': 25.63088021373467, 'atr_min_pct': 0.014730180300450226, 'atr_max_pct': 0.12853357585840755, 'tp_mult': 2.9240922097883026, 'tsl_mult': 0.7101984498108198, 'strategy': 'mean_reversion', 'time_stop': 251, 'use_sma': False, 'use_atr': False, 'use_adx': False, 'use_ema': True, 'use_spike': True, 'rsi_required': True, 'edge_k': 1.3024083389926724, 'edge_cap': 0.535502282439448, 'bull_strategy': 'breakout', 'bull_bb_std_mult': 3.545362720134609, 'bull_rsi_os': 37, 'bull_rsi_ob': 46, 'bull_adx_thresh': 6.361779136183577, 'bull_atr_min_pct': 0.0164127435245115, 'bull_atr_max_pct': 0.08577429323438975, 'bull_tp_mult': 2.9220280756329697, 'bull_tsl_mult': 0.39597068508381766, 'bull_time_stop': 189, 'bull_use_sma': False, 'bull_use_ema': True, 'bull_use_atr': True, 'bull_use_adx': False, 'bull_use_spike': False, 'bull_rsi_required': True, 'bear_strategy': 'mean_reversion', 'bear_bb_std_mult': 1.105575891746741, 'bear_rsi_os': 12, 'bear_rsi_ob': 76, 'bear_adx_thresh': 28.114516235323347, 'bear_atr_min_pct': 0.004609498056708098, 'bear_atr_max_pct': 0.11148618914398835, 'bear_tp_mult': 1.307944427177537, 'bear_tsl_mult': 0.4767608262228316, 'bear_time_stop': 284, 'bear_use_sma': True, 'bear_use_ema': True, 'bear_use_atr': True, 'bear_use_adx': False, 'bear_use_spike': False, 'bear_rsi_required': False, 'sideways_strategy': 'mean_reversion', 'sideways_bb_std_mult': 0.8121285847562256, 'sideways_rsi_os': 50, 'sideways_rsi_ob': 91, 'sideways_adx_thresh': 20.55161697780205, 'sideways_atr_min_pct': 0.013468237238998815, 'sideways_atr_max_pct': 0.07584681746441393, 'sideways_tp_mult': 2.943272002503623, 'sideways_tsl_mult': 0.8884779231236306, 'sideways_time_stop': 27, 'sideways_use_sma': True, 'sideways_use_ema': False, 'sideways_use_atr': False, 'sideways_use_adx': True, 'sideways_use_spike': False, 'sideways_rsi_required': False}.
[I 2025-09-01 10:11:09,294] Trial 393 finished with values: [-1000000000.0, 1000000000.0] and parameters: {'p_sma': 14, 'p_std': 47, 'p_atr': 18, 'p_adx': 25, 'rsi_period': 22, 'ema1': 14, 'ema2': 13, 'slip_atr_k': 0.014477982887574015, 'slip_spread_k': 0.6280708911802231, 'spread_hl_frac': 0.030052360492642052, 'bb_std_mult': 1.6174982555267094, 'rsi_os': 31, 'rsi_ob': 66, 'vol_spike': 0.1498019863300121, 'adx_thresh': 30.476860103780943, 'atr_min_pct': 0.014714521030675626, 'atr_max_pct': 0.10159087081782292, 'tp_mult': 1.0904463652078176, 'tsl_mult': 0.22854991879176179, 'strategy': 'breakout', 'time_stop': 232, 'use_sma': True, 'use_atr': False, 'use_adx': False, 'use_ema': False, 'use_spike': True, 'rsi_required': True, 'edge_k': 1.1651168848370559, 'edge_cap': 0.564183904864115, 'bull_strategy': 'mean_reversion', 'bull_bb_std_mult': 0.8490023461845451, 'bull_rsi_os': 37, 'bull_rsi_ob': 46, 'bull_adx_thresh': 27.84312833235267, 'bull_atr_min_pct': 0.016612405418405012, 'bull_atr_max_pct': 0.10569997271074816, 'bull_tp_mult': 2.9334559828417506, 'bull_tsl_mult': 0.3933172496144275, 'bull_time_stop': 69, 'bull_use_sma': True, 'bull_use_ema': False, 'bull_use_atr': False, 'bull_use_adx': False, 'bull_use_spike': False, 'bull_rsi_required': True, 'bear_strategy': 'mean_reversion', 'bear_bb_std_mult': 3.389574333714501, 'bear_rsi_os': 21, 'bear_rsi_ob': 77, 'bear_adx_thresh': 5.887726339972611, 'bear_atr_min_pct': 0.012516532744215686, 'bear_atr_max_pct': 0.1351661979867402, 'bear_tp_mult': 1.3037817259405913, 'bear_tsl_mult': 0.45064142246427386, 'bear_time_stop': 294, 'bear_use_sma': True, 'bear_use_ema': False, 'bear_use_atr': True, 'bear_use_adx': True, 'bear_use_spike': False, 'bear_rsi_required': False, 'sideways_strategy': 'breakout', 'sideways_bb_std_mult': 0.7228352662055749, 'sideways_rsi_os': 7, 'sideways_rsi_ob': 88, 'sideways_adx_thresh': 25.721958961679473, 'sideways_atr_min_pct': 0.014437576438035128, 'sideways_atr_max_pct': 0.03695925306308323, 'sideways_tp_mult': 2.4574658790676978, 'sideways_tsl_mult': 0.4201223559187073, 'sideways_time_stop': 216, 'sideways_use_sma': True, 'sideways_use_ema': True, 'sideways_use_atr': True, 'sideways_use_adx': True, 'sideways_use_spike': False, 'sideways_rsi_required': False}.
