[I 2025-09-01 10:00:30,826] Trial 331 finished with values: [-1000000000.0, 1000000000.0] and parameters: {'p_sma': 15, 'p_std': 48, 'p_atr': 17, 'p_adx': 25, 'rsi_period': 67, 'ema1': 7, 'ema2': 20, 'slip_atr_k': 0.01582245004956777, 'slip_spread_k': 0.6258761021942516, 'spread_hl_frac': 0.029556293684405596, 'bb_std_mult': 1.8767564644831176, 'rsi_os': 16, 'rsi_ob': 86, 'vol_spike': 0.1548268619513348, 'adx_thresh': 30.74389267740202, 'atr_min_pct': 0.013163021952048189, 'atr_max_pct': 0.04753123135232491, 'tp_mult': 2.1766045690958284, 'tsl_mult': 0.7748124842312365, 'strategy': 'breakout', 'time_stop': 123, 'use_sma': True, 'use_atr': False, 'use_adx': False, 'use_ema': True, 'use_spike': True, 'rsi_required': False, 'edge_k': 1.205952491956638, 'edge_cap': 0.5480694939426561, 'bull_strategy': 'mean_reversion', 'bull_bb_std_mult': 3.5932053190409, 'bull_rsi_os': 16, 'bull_rsi_ob': 45, 'bull_adx_thresh': 33.27858113448286, 'bull_atr_min_pct': 0.0019873194560714987, 'bull_atr_max_pct': 0.1258957628689545, 'bull_tp_mult': 2.868674469836491, 'bull_tsl_mult': 0.12571623790816627, 'bull_time_stop': 213, 'bull_use_sma': True, 'bull_use_ema': False, 'bull_use_atr': True, 'bull_use_adx': False, 'bull_use_spike': True, 'bull_rsi_required': False, 'bear_strategy': 'mean_reversion', 'bear_bb_std_mult': 1.42164458387038, 'bear_rsi_os': 53, 'bear_rsi_ob': 59, 'bear_adx_thresh': 13.899059933836874, 'bear_atr_min_pct': 0.007371304331388707, 'bear_atr_max_pct': 0.057254987541241226, 'bear_tp_mult': 2.597487731736056, 'bear_tsl_mult': 0.670309394479326, 'bear_time_stop': 250, 'bear_use_sma': True, 'bear_use_ema': False, 'bear_use_atr': True, 'bear_use_adx': True, 'bear_use_spike': False, 'bear_rsi_required': False, 'sideways_strategy': 'breakout', 'sideways_bb_std_mult': 0.6275844168753243, 'sideways_rsi_os': 39, 'sideways_rsi_ob': 87, 'sideways_adx_thresh': 21.170055627336218, 'sideways_atr_min_pct': 0.010282125580086763, 'sideways_atr_max_pct': 0.12597567580851438, 'sideways_tp_mult': 2.421693679086587, 'sideways_tsl_mult': 0.018595212607747824, 'sideways_time_stop': 25, 'sideways_use_sma': True, 'sideways_use_ema': False, 'sideways_use_atr': False, 'sideways_use_adx': False, 'sideways_use_spike': True, 'sideways_rsi_required': False}.
[I 2025-09-01 10:00:31,917] Trial 337 finished with values: [-1000000000.0, 1000000000.0] and parameters: {'p_sma': 18, 'p_std': 43, 'p_atr': 29, 'p_adx': 27, 'rsi_period': 20, 'ema1': 27, 'ema2': 17, 'slip_atr_k': 0.04630597036464998, 'slip_spread_k': 0.5205269784702291, 'spread_hl_frac': 0.009790409423188155, 'bb_std_mult': 1.515050709235392, 'rsi_os': 52, 'rsi_ob': 84, 'vol_spike': 0.13277155525988354, 'adx_thresh': 28.681019430505103, 'atr_min_pct': 0.014937806287868923, 'atr_max_pct': 0.037348446453032036, 'tp_mult': 1.2086076414373992, 'tsl_mult': 0.698452539821457, 'strategy': 'mean_reversion', 'time_stop': 239, 'use_sma': False, 'use_atr': True, 'use_adx': False, 'use_ema': True, 'use_spike': False, 'rsi_required': True, 'edge_k': 1.3067573670295787, 'edge_cap': 0.6958621055740398, 'bull_strategy': 'mean_reversion', 'bull_bb_std_mult': 3.5303861176856586, 'bull_rsi_os': 50, 'bull_rsi_ob': 47, 'bull_adx_thresh': 8.052314284829945, 'bull_atr_min_pct': 0.0019186459886836847, 'bull_atr_max_pct': 0.09478682681371207, 'bull_tp_mult': 2.6960371250866895, 'bull_tsl_mult': 0.38115582788027297, 'bull_time_stop': 270, 'bull_use_sma': False, 'bull_use_ema': True, 'bull_use_atr': True, 'bull_use_adx': False, 'bull_use_spike': False, 'bull_rsi_required': True, 'bear_strategy': 'mean_reversion', 'bear_bb_std_mult': 0.854436666193765, 'bear_rsi_os': 55, 'bear_rsi_ob': 73, 'bear_adx_thresh': 24.33922559796844, 'bear_atr_min_pct': 0.005911011894084647, 'bear_atr_max_pct': 0.0868437607307602, 'bear_tp_mult': 1.984173545493084, 'bear_tsl_mult': 0.3311138425663732, 'bear_time_stop': 294, 'bear_use_sma': False, 'bear_use_ema': False, 'bear_use_atr': False, 'bear_use_adx': False, 'bear_use_spike': False, 'bear_rsi_required': True, 'sideways_strategy': 'mean_reversion', 'sideways_bb_std_mult': 1.149689345879388, 'sideways_rsi_os': 25, 'sideways_rsi_ob': 80, 'sideways_adx_thresh': 22.845240482252358, 'sideways_atr_min_pct': 0.014148892029361718, 'sideways_atr_max_pct': 0.06657604109330219, 'sideways_tp_mult': 2.5005181446195186, 'sideways_tsl_mult': 0.5252209180083222, 'sideways_time_stop': 137, 'sideways_use_sma': True, 'sideways_use_ema': False, 'sideways_use_atr': False, 'sideways_use_adx': True, 'sideways_use_spike': False, 'sideways_rsi_required': True}.
[I 2025-09-01 10:01:10,976] Trial 334 finished with values: [-1000000000.0, 1000000000.0] and parameters: {'p_sma': 16, 'p_std': 51, 'p_atr': 17, 'p_adx': 27, 'rsi_period': 80, 'ema1': 7, 'ema2': 14, 'slip_atr_k': 0.04031294805886538, 'slip_spread_k': 0.22221223035554333, 'spread_hl_frac': 0.02913611045853768, 'bb_std_mult': 2.6501263830880726, 'rsi_os': 33, 'rsi_ob': 64, 'vol_spike': 0.18493892646038695, 'adx_thresh': 30.70677223814762, 'atr_min_pct': 0.012107094425832523, 'atr_max_pct': 0.018684613886150683, 'tp_mult': 1.5283949468360085, 'tsl_mult': 0.784922449147862, 'strategy': 'breakout', 'time_stop': 246, 'use_sma': True, 'use_atr': False, 'use_adx': False, 'use_ema': True, 'use_spike': True, 'rsi_required': True, 'edge_k': 1.1935848927118233, 'edge_cap': 0.591793037671184, 'bull_strategy': 'mean_reversion', 'bull_bb_std_mult': 3.5447483818841214, 'bull_rsi_os': 50, 'bull_rsi_ob': 56, 'bull_adx_thresh': 5.809662181462542, 'bull_atr_min_pct': 0.0042638152175002685, 'bull_atr_max_pct': 0.09543547042357647, 'bull_tp_mult': 2.997334203891561, 'bull_tsl_mult': 0.3867139872634766, 'bull_time_stop': 270, 'bull_use_sma': False, 'bull_use_ema': False, 'bull_use_atr': True, 'bull_use_adx': False, 'bull_use_spike': False, 'bull_rsi_required': True, 'bear_strategy': 'mean_reversion', 'bear_bb_std_mult': 2.325512709920572, 'bear_rsi_os': 55, 'bear_rsi_ob': 75, 'bear_adx_thresh': 25.697844085901416, 'bear_atr_min_pct': 0.01614470153915551, 'bear_atr_max_pct': 0.1217088447439948, 'bear_tp_mult': 1.198322807906598, 'bear_tsl_mult': 0.5867639511064857, 'bear_time_stop': 5, 'bear_use_sma': True, 'bear_use_ema': False, 'bear_use_atr': True, 'bear_use_adx': False, 'bear_use_spike': False, 'bear_rsi_required': False, 'sideways_strategy': 'mean_reversion', 'sideways_bb_std_mult': 0.8808850551434616, 'sideways_rsi_os': 12, 'sideways_rsi_ob': 92, 'sideways_adx_thresh': 20.085982146585746, 'sideways_atr_min_pct': 0.017372608232530257, 'sideways_atr_max_pct': 0.1262974250898137, 'sideways_tp_mult': 2.5071380112813686, 'sideways_tsl_mult': 0.44669699030326804, 'sideways_time_stop': 18, 'sideways_use_sma': True, 'sideways_use_ema': False, 'sideways_use_atr': False, 'sideways_use_adx': True, 'sideways_use_spike': False, 'sideways_rsi_required': False}.
[I 2025-09-01 10:01:12,241] Trial 335 finished with values: [-1000000000.0, 1000000000.0] and parameters: {'p_sma': 18, 'p_std': 51, 'p_atr': 17, 'p_adx': 27, 'rsi_period': 44, 'ema1': 7, 'ema2': 38, 'slip_atr_k': 0.12985660347128547, 'slip_spread_k': 0.525749180792215, 'spread_hl_frac': 0.030614593473373333, 'bb_std_mult': 1.5340987049101795, 'rsi_os': 27, 'rsi_ob': 49, 'vol_spike': 0.185923485348713, 'adx_thresh': 19.309505398259326, 'atr_min_pct': 0.012229082335963717, 'atr_max_pct': 0.09051243014677923, 'tp_mult': 1.5283431493619424, 'tsl_mult': 0.696790735753311, 'strategy': 'breakout', 'time_stop': 215, 'use_sma': True, 'use_atr': False, 'use_adx': False, 'use_ema': True, 'use_spike': True, 'rsi_required': False, 'edge_k': 1.3071978825473562, 'edge_cap': 0.5525491500716667, 'bull_strategy': 'mean_reversion', 'bull_bb_std_mult': 3.5335958988982474, 'bull_rsi_os': 16, 'bull_rsi_ob': 47, 'bull_adx_thresh': 14.228324168794444, 'bull_atr_min_pct': 0.001669230955334147, 'bull_atr_max_pct': 0.12626881674133256, 'bull_tp_mult': 2.1145222496808396, 'bull_tsl_mult': 0.38169431792198594, 'bull_time_stop': 26, 'bull_use_sma': False, 'bull_use_ema': False, 'bull_use_atr': True, 'bull_use_adx': False, 'bull_use_spike': False, 'bull_rsi_required': False, 'bear_strategy': 'mean_reversion', 'bear_bb_std_mult': 0.9042230967978083, 'bear_rsi_os': 42, 'bear_rsi_ob': 73, 'bear_adx_thresh': 24.461611183593515, 'bear_atr_min_pct': 0.005942531396788242, 'bear_atr_max_pct': 0.09623466862005016, 'bear_tp_mult': 1.2035296199180385, 'bear_tsl_mult': 0.33631121427215466, 'bear_time_stop': 263, 'bear_use_sma': True, 'bear_use_ema': False, 'bear_use_atr': True, 'bear_use_adx': False, 'bear_use_spike': False, 'bear_rsi_required': False, 'sideways_strategy': 'mean_reversion', 'sideways_bb_std_mult': 1.3187670215020049, 'sideways_rsi_os': 54, 'sideways_rsi_ob': 84, 'sideways_adx_thresh': 20.17687961541057, 'sideways_atr_min_pct': 0.009016848209528734, 'sideways_atr_max_pct': 0.06650965485556562, 'sideways_tp_mult': 2.5180457270610033, 'sideways_tsl_mult': 0.08260767407955771, 'sideways_time_stop': 17, 'sideways_use_sma': True, 'sideways_use_ema': False, 'sideways_use_atr': False, 'sideways_use_adx': False, 'sideways_use_spike': False, 'sideways_rsi_required': False}.
[I 2025-09-01 10:01:12,788] Trial 336 finished with values: [-1000000000.0, 1000000000.0] and parameters: {'p_sma': 18, 'p_std': 43, 'p_atr': 17, 'p_adx': 27, 'rsi_period': 68, 'ema1': 7, 'ema2': 14, 'slip_atr_k': 0.03988369677725512, 'slip_spread_k': 0.6314126686558859, 'spread_hl_frac': 0.014059375737103932, 'bb_std_mult': 1.5320611153388144, 'rsi_os': 42, 'rsi_ob': 84, 'vol_spike': 0.13195120860036397, 'adx_thresh': 28.743399253394205, 'atr_min_pct': 0.014907558686853095, 'atr_max_pct': 0.03572569943261788, 'tp_mult': 1.504831871072568, 'tsl_mult': 0.27784028069185207, 'strategy': 'breakout', 'time_stop': 31, 'use_sma': True, 'use_atr': False, 'use_adx': False, 'use_ema': True, 'use_spike': True, 'rsi_required': True, 'edge_k': 1.3064927646231275, 'edge_cap': 0.7069870419041334, 'bull_strategy': 'mean_reversion', 'bull_bb_std_mult': 3.5493999195502655, 'bull_rsi_os': 34, 'bull_rsi_ob': 56, 'bull_adx_thresh': 28.340427174743972, 'bull_atr_min_pct': 0.0020098370910172593, 'bull_atr_max_pct': 0.09440657375533004, 'bull_tp_mult': 2.370959323270552, 'bull_tsl_mult': 0.3771974433466896, 'bull_time_stop': 25, 'bull_use_sma': False, 'bull_use_ema': False, 'bull_use_atr': True, 'bull_use_adx': False, 'bull_use_spike': False, 'bull_rsi_required': True, 'bear_strategy': 'mean_reversion', 'bear_bb_std_mult': 0.8658596999787128, 'bear_rsi_os': 55, 'bear_rsi_ob': 73, 'bear_adx_thresh': 24.22687727367619, 'bear_atr_min_pct': 0.0066494972626859015, 'bear_atr_max_pct': 0.036071690209481415, 'bear_tp_mult': 1.2089317556287629, 'bear_tsl_mult': 0.8684317133878223, 'bear_time_stop': 295, 'bear_use_sma': False, 'bear_use_ema': False, 'bear_use_atr': True, 'bear_use_adx': False, 'bear_use_spike': False, 'bear_rsi_required': True, 'sideways_strategy': 'mean_reversion', 'sideways_bb_std_mult': 0.8721758516665904, 'sideways_rsi_os': 39, 'sideways_rsi_ob': 80, 'sideways_adx_thresh': 20.216895293886772, 'sideways_atr_min_pct': 0.010126307605903561, 'sideways_atr_max_pct': 0.12577816786750398, 'sideways_tp_mult': 2.4943286291496096, 'sideways_tsl_mult': 0.9470968538200186, 'sideways_time_stop': 16, 'sideways_use_sma': True, 'sideways_use_ema': False, 'sideways_use_atr': False, 'sideways_use_adx': True, 'sideways_use_spike': False, 'sideways_rsi_required': False}.
[I 2025-09-01 10:01:13,375] Trial 338 finished with values: [-1000000000.0, 1000000000.0] and parameters: {'p_sma': 16, 'p_std': 38, 'p_atr': 15, 'p_adx': 21, 'rsi_period': 27, 'ema1': 18, 'ema2': 42, 'slip_atr_k': 0.05946402857960151, 'slip_spread_k': 0.10548319105491721, 'spread_hl_frac': 0.014251561638900106, 'bb_std_mult': 1.3447931666878916, 'rsi_os': 40, 'rsi_ob': 68, 'vol_spike': 0.04513971061865095, 'adx_thresh': 32.44773204394354, 'atr_min_pct': 0.012533379013605923, 'atr_max_pct': 0.11275471477509388, 'tp_mult': 1.3953753632737094, 'tsl_mult': 0.6567656022826189, 'strategy': 'breakout', 'time_stop': 247, 'use_sma': True, 'use_atr': False, 'use_adx': False, 'use_ema': False, 'use_spike': True, 'rsi_required': True, 'edge_k': 1.2943275474853095, 'edge_cap': 0.6171073283235696, 'bull_strategy': 'mean_reversion', 'bull_bb_std_mult': 3.5395801244817897, 'bull_rsi_os': 10, 'bull_rsi_ob': 67, 'bull_adx_thresh': 14.283249858400428, 'bull_atr_min_pct': 0.001980886483074856, 'bull_atr_max_pct': 0.09197206227492229, 'bull_tp_mult': 2.248511064821007, 'bull_tsl_mult': 0.43747759259674857, 'bull_time_stop': 225, 'bull_use_sma': False, 'bull_use_ema': False, 'bull_use_atr': False, 'bull_use_adx': True, 'bull_use_spike': False, 'bull_rsi_required': True, 'bear_strategy': 'breakout', 'bear_bb_std_mult': 0.9154611933027578, 'bear_rsi_os': 55, 'bear_rsi_ob': 75, 'bear_adx_thresh': 24.74072383250039, 'bear_atr_min_pct': 0.006638430648665578, 'bear_atr_max_pct': 0.12256185231064262, 'bear_tp_mult': 1.6003748525317492, 'bear_tsl_mult': 0.28070577581214706, 'bear_time_stop': 239, 'bear_use_sma': True, 'bear_use_ema': False, 'bear_use_atr': True, 'bear_use_adx': False, 'bear_use_spike': False, 'bear_rsi_required': False, 'sideways_strategy': 'mean_reversion', 'sideways_bb_std_mult': 0.8896744315809774, 'sideways_rsi_os': 54, 'sideways_rsi_ob': 83, 'sideways_adx_thresh': 8.756449121069036, 'sideways_atr_min_pct': 0.011134438014171941, 'sideways_atr_max_pct': 0.07068255469069834, 'sideways_tp_mult': 2.531079576535606, 'sideways_tsl_mult': 0.4451582745278412, 'sideways_time_stop': 143, 'sideways_use_sma': False, 'sideways_use_ema': True, 'sideways_use_atr': False, 'sideways_use_adx': True, 'sideways_use_spike': False, 'sideways_rsi_required': False}.
[I 2025-09-01 10:01:51,987] Trial 340 finished with values: [-0.06828877599377048, 0.0683746364683614] and parameters: {'p_sma': 53, 'p_std': 41, 'p_atr': 7, 'p_adx': 24, 'rsi_period': 11, 'ema1': 18, 'ema2': 17, 'slip_atr_k': 0.14890804734489624, 'slip_spread_k': 0.15678533459384192, 'spread_hl_frac': 0.013621913819243672, 'bb_std_mult': 1.3432848745244321, 'rsi_os': 42, 'rsi_ob': 70, 'vol_spike': 0.28846432441987485, 'adx_thresh': 25.907653144227627, 'atr_min_pct': 0.016966794456081458, 'atr_max_pct': 0.1337225880512782, 'tp_mult': 2.9981461267126672, 'tsl_mult': 0.27306737268293735, 'strategy': 'breakout', 'time_stop': 263, 'use_sma': True, 'use_atr': False, 'use_adx': True, 'use_ema': False, 'use_spike': True, 'rsi_required': True, 'edge_k': 1.2485032784954488, 'edge_cap': 0.6311545090975084, 'bull_strategy': 'mean_reversion', 'bull_bb_std_mult': 1.7617735843252813, 'bull_rsi_os': 53, 'bull_rsi_ob': 48, 'bull_adx_thresh': 28.399664346105574, 'bull_atr_min_pct': 0.017790271298471966, 'bull_atr_max_pct': 0.08334601344909107, 'bull_tp_mult': 2.5261997274214054, 'bull_tsl_mult': 0.43462769535072, 'bull_time_stop': 228, 'bull_use_sma': True, 'bull_use_ema': False, 'bull_use_atr': False, 'bull_use_adx': True, 'bull_use_spike': False, 'bull_rsi_required': True, 'bear_strategy': 'breakout', 'bear_bb_std_mult': 3.3289450926904456, 'bear_rsi_os': 55, 'bear_rsi_ob': 50, 'bear_adx_thresh': 26.64333299970912, 'bear_atr_min_pct': 0.003685518770659442, 'bear_atr_max_pct': 0.03513624406624459, 'bear_tp_mult': 1.2037135057968191, 'bear_tsl_mult': 0.8649135734100124, 'bear_time_stop': 105, 'bear_use_sma': False, 'bear_use_ema': False, 'bear_use_atr': True, 'bear_use_adx': False, 'bear_use_spike': True, 'bear_rsi_required': True, 'sideways_strategy': 'mean_reversion', 'sideways_bb_std_mult': 0.7954782350177214, 'sideways_rsi_os': 20, 'sideways_rsi_ob': 90, 'sideways_adx_thresh': 25.1443537246775, 'sideways_atr_min_pct': 0.006199298059004096, 'sideways_atr_max_pct': 0.07058464585692814, 'sideways_tp_mult': 1.6594448815107854, 'sideways_tsl_mult': 0.43644813013959055, 'sideways_time_stop': 143, 'sideways_use_sma': False, 'sideways_use_ema': True, 'sideways_use_atr': True, 'sideways_use_adx': True, 'sideways_use_spike': False, 'sideways_rsi_required': False}.
[I 2025-09-01 10:01:52,349] Trial 342 finished with values: [-1000000000.0, 1000000000.0] and parameters: {'p_sma': 53, 'p_std': 35, 'p_atr': 18, 'p_adx': 24, 'rsi_period': 9, 'ema1': 19, 'ema2': 17, 'slip_atr_k': 0.11064251373884851, 'slip_spread_k': 0.7720143405908656, 'spread_hl_frac': 0.023640207537473118, 'bb_std_mult': 3.169002180209664, 'rsi_os': 26, 'rsi_ob': 70, 'vol_spike': 0.09718452517345412, 'adx_thresh': 9.199456790937601, 'atr_min_pct': 0.0193504581230872, 'atr_max_pct': 0.14219477574210918, 'tp_mult': 2.9948425373940117, 'tsl_mult': 0.9770865284551637, 'strategy': 'mean_reversion', 'time_stop': 149, 'use_sma': False, 'use_atr': True, 'use_adx': True, 'use_ema': False, 'use_spike': False, 'rsi_required': True, 'edge_k': 1.2453093339407404, 'edge_cap': 0.5883157153674806, 'bull_strategy': 'mean_reversion', 'bull_bb_std_mult': 2.2141524909392576, 'bull_rsi_os': 18, 'bull_rsi_ob': 93, 'bull_adx_thresh': 6.382965621357311, 'bull_atr_min_pct': 0.02330151340821832, 'bull_atr_max_pct': 0.08234789000614313, 'bull_tp_mult': 2.5241124493736367, 'bull_tsl_mult': 0.7540590270511294, 'bull_time_stop': 35, 'bull_use_sma': True, 'bull_use_ema': True, 'bull_use_atr': False, 'bull_use_adx': True, 'bull_use_spike': False, 'bull_rsi_required': True, 'bear_strategy': 'breakout', 'bear_bb_std_mult': 1.0595122916028759, 'bear_rsi_os': 54, 'bear_rsi_ob': 51, 'bear_adx_thresh': 23.49191740019311, 'bear_atr_min_pct': 0.018843690392994075, 'bear_atr_max_pct': 0.10026931952210286, 'bear_tp_mult': 1.3284388237415534, 'bear_tsl_mult': 0.4998736913781598, 'bear_time_stop': 195, 'bear_use_sma': True, 'bear_use_ema': False, 'bear_use_atr': False, 'bear_use_adx': False, 'bear_use_spike': True, 'bear_rsi_required': False, 'sideways_strategy': 'mean_reversion', 'sideways_bb_std_mult': 0.740458791608838, 'sideways_rsi_os': 51, 'sideways_rsi_ob': 90, 'sideways_adx_thresh': 25.271233398652623, 'sideways_atr_min_pct': 0.025511413365358112, 'sideways_atr_max_pct': 0.029304833852024058, 'sideways_tp_mult': 2.447408886210278, 'sideways_tsl_mult': 0.4917780822543153, 'sideways_time_stop': 54, 'sideways_use_sma': False, 'sideways_use_ema': True, 'sideways_use_atr': True, 'sideways_use_adx': True, 'sideways_use_spike': False, 'sideways_rsi_required': True}.
[I 2025-09-01 10:01:52,967] Trial 341 finished with values: [-1000000000.0, 1000000000.0] and parameters: {'p_sma': 16, 'p_std': 59, 'p_atr': 7, 'p_adx': 24, 'rsi_period': 61, 'ema1': 18, 'ema2': 27, 'slip_atr_k': 0.0586632358897303, 'slip_spread_k': 0.8097069386132425, 'spread_hl_frac': 0.02723953977072046, 'bb_std_mult': 1.7000490652055285, 'rsi_os': 48, 'rsi_ob': 70, 'vol_spike': 0.04258709008835336, 'adx_thresh': 32.31367654250888, 'atr_min_pct': 0.019909324641233697, 'atr_max_pct': 0.13404535025810224, 'tp_mult': 1.669333563338176, 'tsl_mult': 0.6514141372085903, 'strategy': 'mean_reversion', 'time_stop': 77, 'use_sma': False, 'use_atr': True, 'use_adx': True, 'use_ema': False, 'use_spike': False, 'rsi_required': True, 'edge_k': 1.7246070685405313, 'edge_cap': 0.6328431679011155, 'bull_strategy': 'mean_reversion', 'bull_bb_std_mult': 2.7502669813834353, 'bull_rsi_os': 9, 'bull_rsi_ob': 48, 'bull_adx_thresh': 32.331833743826, 'bull_atr_min_pct': 0.0035041162302100175, 'bull_atr_max_pct': 0.08137445662230866, 'bull_tp_mult': 2.805679842551265, 'bull_tsl_mult': 0.28002021226651663, 'bull_time_stop': 226, 'bull_use_sma': True, 'bull_use_ema': True, 'bull_use_atr': False, 'bull_use_adx': True, 'bull_use_spike': False, 'bull_rsi_required': True, 'bear_strategy': 'breakout', 'bear_bb_std_mult': 0.6472328073053517, 'bear_rsi_os': 54, 'bear_rsi_ob': 74, 'bear_adx_thresh': 18.053138289364593, 'bear_atr_min_pct': 0.022674487265504337, 'bear_atr_max_pct': 0.1004011712275955, 'bear_tp_mult': 1.3246953694270136, 'bear_tsl_mult': 0.30492252723294855, 'bear_time_stop': 105, 'bear_use_sma': True, 'bear_use_ema': False, 'bear_use_atr': False, 'bear_use_adx': False, 'bear_use_spike': True, 'bear_rsi_required': False, 'sideways_strategy': 'mean_reversion', 'sideways_bb_std_mult': 0.7650702860399562, 'sideways_rsi_os': 20, 'sideways_rsi_ob': 90, 'sideways_adx_thresh': 14.221808330464905, 'sideways_atr_min_pct': 0.025840478537466183, 'sideways_atr_max_pct': 0.07131974760238896, 'sideways_tp_mult': 2.2939256475834, 'sideways_tsl_mult': 0.49704568172856867, 'sideways_time_stop': 55, 'sideways_use_sma': False, 'sideways_use_ema': True, 'sideways_use_atr': True, 'sideways_use_adx': True, 'sideways_use_spike': False, 'sideways_rsi_required': True}.
