[I 2025-09-01 09:32:06,171] Trial 159 finished with values: [-1000000000.0, 1000000000.0] and parameters: {'p_sma': 18, 'p_std': 22, 'p_atr': 17, 'p_adx': 19, 'rsi_period': 22, 'ema1': 19, 'ema2': 12, 'slip_atr_k': 0.08369381051298548, 'slip_spread_k': 0.2896866714686779, 'spread_hl_frac': 0.027247466750509406, 'bb_std_mult': 1.274977057723655, 'rsi_os': 38, 'rsi_ob': 66, 'vol_spike': 0.058599852771777844, 'adx_thresh': 30.21931887104915, 'atr_min_pct': 0.026025668617200903, 'atr_max_pct': 0.03749528207845313, 'tp_mult': 2.4029089995478685, 'tsl_mult': 0.45463857541847413, 'strategy': 'breakout', 'time_stop': 223, 'use_sma': True, 'use_atr': False, 'use_adx': False, 'use_ema': True, 'use_spike': True, 'rsi_required': True, 'edge_k': 1.470347123642042, 'edge_cap': 0.971154428128261, 'bull_strategy': 'breakout', 'bull_bb_std_mult': 0.7217433092843415, 'bull_rsi_os': 46, 'bull_rsi_ob': 54, 'bull_adx_thresh': 6.891835751500469, 'bull_atr_min_pct': 0.02871083986833444, 'bull_atr_max_pct': 0.08297923341574016, 'bull_tp_mult': 1.4687508699590077, 'bull_tsl_mult': 0.9741459101015455, 'bull_time_stop': 224, 'bull_use_sma': True, 'bull_use_ema': False, 'bull_use_atr': True, 'bull_use_adx': False, 'bull_use_spike': False, 'bull_rsi_required': True, 'bear_strategy': 'breakout', 'bear_bb_std_mult': 2.1644259747079984, 'bear_rsi_os': 50, 'bear_rsi_ob': 45, 'bear_adx_thresh': 6.595290011155315, 'bear_atr_min_pct': 0.026173171162249903, 'bear_atr_max_pct': 0.04228534693585396, 'bear_tp_mult': 2.172970894241584, 'bear_tsl_mult': 0.5313408415910392, 'bear_time_stop': 15, 'bear_use_sma': True, 'bear_use_ema': True, 'bear_use_atr': True, 'bear_use_adx': False, 'bear_use_spike': False, 'bear_rsi_required': False, 'sideways_strategy': 'mean_reversion', 'sideways_bb_std_mult': 3.4010693049302656, 'sideways_rsi_os': 53, 'sideways_rsi_ob': 92, 'sideways_adx_thresh': 31.691804650980984, 'sideways_atr_min_pct': 0.01134579846193929, 'sideways_atr_max_pct': 0.14221692304072986, 'sideways_tp_mult': 1.8495556571666896, 'sideways_tsl_mult': 0.39292343656468065, 'sideways_time_stop': 46, 'sideways_use_sma': True, 'sideways_use_ema': False, 'sideways_use_atr': False, 'sideways_use_adx': True, 'sideways_use_spike': True, 'sideways_rsi_required': False}.
[I 2025-09-01 09:32:06,708] Trial 165 finished with values: [-1000000000.0, 1000000000.0] and parameters: {'p_sma': 18, 'p_std': 43, 'p_atr': 18, 'p_adx': 18, 'rsi_period': 23, 'ema1': 20, 'ema2': 15, 'slip_atr_k': 0.05158668825261675, 'slip_spread_k': 0.9900508231237499, 'spread_hl_frac': 0.04905476313597747, 'bb_std_mult': 2.1250453062343833, 'rsi_os': 17, 'rsi_ob': 65, 'vol_spike': 0.017096831447305, 'adx_thresh': 33.66410616916679, 'atr_min_pct': 0.028768507718323476, 'atr_max_pct': 0.010922800582085848, 'tp_mult': 1.0887619945574323, 'tsl_mult': 0.38970119896079797, 'strategy': 'breakout', 'time_stop': 278, 'use_sma': True, 'use_atr': False, 'use_adx': False, 'use_ema': True, 'use_spike': True, 'rsi_required': True, 'edge_k': 1.9957556132956107, 'edge_cap': 0.7987531664103042, 'bull_strategy': 'breakout', 'bull_bb_std_mult': 3.432835559926623, 'bull_rsi_os': 47, 'bull_rsi_ob': 50, 'bull_adx_thresh': 8.207513766249258, 'bull_atr_min_pct': 0.02531274265616893, 'bull_atr_max_pct': 0.09210078328224128, 'bull_tp_mult': 2.199458131780064, 'bull_tsl_mult': 0.6658600288989717, 'bull_time_stop': 246, 'bull_use_sma': True, 'bull_use_ema': False, 'bull_use_atr': True, 'bull_use_adx': True, 'bull_use_spike': False, 'bull_rsi_required': True, 'bear_strategy': 'mean_reversion', 'bear_bb_std_mult': 1.9268892898423933, 'bear_rsi_os': 52, 'bear_rsi_ob': 94, 'bear_adx_thresh': 9.859067070748265, 'bear_atr_min_pct': 0.028479417503114262, 'bear_atr_max_pct': 0.07193931066474757, 'bear_tp_mult': 2.1994409101215076, 'bear_tsl_mult': 0.21555863335328523, 'bear_time_stop': 291, 'bear_use_sma': True, 'bear_use_ema': True, 'bear_use_atr': True, 'bear_use_adx': False, 'bear_use_spike': False, 'bear_rsi_required': False, 'sideways_strategy': 'mean_reversion', 'sideways_bb_std_mult': 0.9776585246829113, 'sideways_rsi_os': 51, 'sideways_rsi_ob': 63, 'sideways_adx_thresh': 26.948102430897883, 'sideways_atr_min_pct': 0.023155402672977596, 'sideways_atr_max_pct': 0.06610459730723195, 'sideways_tp_mult': 2.0366302706352792, 'sideways_tsl_mult': 0.0215426040197067, 'sideways_time_stop': 37, 'sideways_use_sma': True, 'sideways_use_ema': False, 'sideways_use_atr': False, 'sideways_use_adx': True, 'sideways_use_spike': False, 'sideways_rsi_required': False}.
[I 2025-09-01 09:32:43,401] Trial 164 finished with values: [-1000000000.0, 1000000000.0] and parameters: {'p_sma': 22, 'p_std': 12, 'p_atr': 17, 'p_adx': 30, 'rsi_period': 23, 'ema1': 19, 'ema2': 16, 'slip_atr_k': 0.048364317353127455, 'slip_spread_k': 0.39567509212224056, 'spread_hl_frac': 0.03134968461598279, 'bb_std_mult': 1.241800226928002, 'rsi_os': 37, 'rsi_ob': 64, 'vol_spike': 0.01905023107349921, 'adx_thresh': 29.19042759279234, 'atr_min_pct': 0.027660442540424428, 'atr_max_pct': 0.06569087414078464, 'tp_mult': 1.0822243150829567, 'tsl_mult': 0.46728539534204994, 'strategy': 'breakout', 'time_stop': 282, 'use_sma': True, 'use_atr': False, 'use_adx': False, 'use_ema': True, 'use_spike': True, 'rsi_required': True, 'edge_k': 1.3156548745901029, 'edge_cap': 0.8030451652382065, 'bull_strategy': 'breakout', 'bull_bb_std_mult': 0.9773323726181455, 'bull_rsi_os': 45, 'bull_rsi_ob': 50, 'bull_adx_thresh': 7.883125249976324, 'bull_atr_min_pct': 0.027843865140062103, 'bull_atr_max_pct': 0.09197743088396507, 'bull_tp_mult': 2.4589982628219387, 'bull_tsl_mult': 0.6493818996807528, 'bull_time_stop': 277, 'bull_use_sma': True, 'bull_use_ema': False, 'bull_use_atr': True, 'bull_use_adx': False, 'bull_use_spike': False, 'bull_rsi_required': True, 'bear_strategy': 'mean_reversion', 'bear_bb_std_mult': 1.0038190128909785, 'bear_rsi_os': 52, 'bear_rsi_ob': 93, 'bear_adx_thresh': 9.744105171397965, 'bear_atr_min_pct': 0.004802900998492338, 'bear_atr_max_pct': 0.07114954398406122, 'bear_tp_mult': 2.5341072915995646, 'bear_tsl_mult': 0.37384560902045655, 'bear_time_stop': 290, 'bear_use_sma': True, 'bear_use_ema': True, 'bear_use_atr': True, 'bear_use_adx': False, 'bear_use_spike': False, 'bear_rsi_required': False, 'sideways_strategy': 'mean_reversion', 'sideways_bb_std_mult': 0.9673035909208807, 'sideways_rsi_os': 51, 'sideways_rsi_ob': 89, 'sideways_adx_thresh': 26.91417310634121, 'sideways_atr_min_pct': 0.0290618680354991, 'sideways_atr_max_pct': 0.13858780345188101, 'sideways_tp_mult': 2.0232309174229437, 'sideways_tsl_mult': 0.38956673317235807, 'sideways_time_stop': 34, 'sideways_use_sma': True, 'sideways_use_ema': False, 'sideways_use_atr': False, 'sideways_use_adx': True, 'sideways_use_spike': False, 'sideways_rsi_required': False}.
[I 2025-09-01 09:32:44,090] Trial 166 finished with values: [-1000000000.0, 1000000000.0] and parameters: {'p_sma': 38, 'p_std': 38, 'p_atr': 19, 'p_adx': 18, 'rsi_period': 23, 'ema1': 20, 'ema2': 54, 'slip_atr_k': 0.04908098886720453, 'slip_spread_k': 0.395579306579695, 'spread_hl_frac': 0.011562106338090251, 'bb_std_mult': 2.197975195418651, 'rsi_os': 19, 'rsi_ob': 65, 'vol_spike': 0.007191022642749609, 'adx_thresh': 33.683895936658836, 'atr_min_pct': 0.027721873894427276, 'atr_max_pct': 0.06576708416797097, 'tp_mult': 1.0748361441451066, 'tsl_mult': 0.7457260356185481, 'strategy': 'breakout', 'time_stop': 281, 'use_sma': True, 'use_atr': False, 'use_adx': False, 'use_ema': True, 'use_spike': True, 'rsi_required': True, 'edge_k': 1.3023836897449264, 'edge_cap': 0.8096726553740274, 'bull_strategy': 'breakout', 'bull_bb_std_mult': 2.82384121381995, 'bull_rsi_os': 5, 'bull_rsi_ob': 50, 'bull_adx_thresh': 8.123866771777553, 'bull_atr_min_pct': 0.02518783487161444, 'bull_atr_max_pct': 0.09131528678257839, 'bull_tp_mult': 2.4091986046880733, 'bull_tsl_mult': 0.9296504625115044, 'bull_time_stop': 274, 'bull_use_sma': True, 'bull_use_ema': False, 'bull_use_atr': True, 'bull_use_adx': True, 'bull_use_spike': False, 'bull_rsi_required': True, 'bear_strategy': 'mean_reversion', 'bear_bb_std_mult': 1.0339447011506249, 'bear_rsi_os': 52, 'bear_rsi_ob': 47, 'bear_adx_thresh': 24.18821080843575, 'bear_atr_min_pct': 0.02831220295792981, 'bear_atr_max_pct': 0.027922418328182742, 'bear_tp_mult': 2.223998895523717, 'bear_tsl_mult': 0.22757458329699176, 'bear_time_stop': 175, 'bear_use_sma': True, 'bear_use_ema': True, 'bear_use_atr': True, 'bear_use_adx': False, 'bear_use_spike': False, 'bear_rsi_required': False, 'sideways_strategy': 'mean_reversion', 'sideways_bb_std_mult': 0.9795857751800301, 'sideways_rsi_os': 51, 'sideways_rsi_ob': 91, 'sideways_adx_thresh': 26.838046960897742, 'sideways_atr_min_pct': 0.02535937847153851, 'sideways_atr_max_pct': 0.12801450269797088, 'sideways_tp_mult': 2.0398489790398924, 'sideways_tsl_mult': 0.21231811714156623, 'sideways_time_stop': 300, 'sideways_use_sma': True, 'sideways_use_ema': False, 'sideways_use_atr': False, 'sideways_use_adx': True, 'sideways_use_spike': False, 'sideways_rsi_required': False}.
[I 2025-09-01 09:32:44,668] Trial 167 finished with values: [-1000000000.0, 1000000000.0] and parameters: {'p_sma': 22, 'p_std': 38, 'p_atr': 17, 'p_adx': 18, 'rsi_period': 53, 'ema1': 28, 'ema2': 18, 'slip_atr_k': 0.0461087111632677, 'slip_spread_k': 0.36618750759193064, 'spread_hl_frac': 0.017352217358334476, 'bb_std_mult': 1.191257437809737, 'rsi_os': 35, 'rsi_ob': 86, 'vol_spike': 0.13869820644442266, 'adx_thresh': 29.105866561944865, 'atr_min_pct': 0.011816538610931957, 'atr_max_pct': 0.06492939917694097, 'tp_mult': 1.0695032813796952, 'tsl_mult': 0.7524753242247673, 'strategy': 'breakout', 'time_stop': 283, 'use_sma': True, 'use_atr': False, 'use_adx': False, 'use_ema': True, 'use_spike': True, 'rsi_required': True, 'edge_k': 1.309420404219189, 'edge_cap': 0.8011310702669746, 'bull_strategy': 'breakout', 'bull_bb_std_mult': 0.9195518027355711, 'bull_rsi_os': 45, 'bull_rsi_ob': 86, 'bull_adx_thresh': 5.001828512383362, 'bull_atr_min_pct': 0.005717395367377374, 'bull_atr_max_pct': 0.0891231065991034, 'bull_tp_mult': 2.3940226387040013, 'bull_tsl_mult': 0.7090843470372911, 'bull_time_stop': 276, 'bull_use_sma': True, 'bull_use_ema': False, 'bull_use_atr': True, 'bull_use_adx': False, 'bull_use_spike': False, 'bull_rsi_required': True, 'bear_strategy': 'mean_reversion', 'bear_bb_std_mult': 1.0541732147345346, 'bear_rsi_os': 55, 'bear_rsi_ob': 94, 'bear_adx_thresh': 19.27832924610757, 'bear_atr_min_pct': 0.005078639147894163, 'bear_atr_max_pct': 0.02513866703639598, 'bear_tp_mult': 2.9588188025762063, 'bear_tsl_mult': 0.5875742108857289, 'bear_time_stop': 300, 'bear_use_sma': True, 'bear_use_ema': True, 'bear_use_atr': True, 'bear_use_adx': False, 'bear_use_spike': False, 'bear_rsi_required': False, 'sideways_strategy': 'mean_reversion', 'sideways_bb_std_mult': 2.9472780752615826, 'sideways_rsi_os': 11, 'sideways_rsi_ob': 89, 'sideways_adx_thresh': 26.28373989417557, 'sideways_atr_min_pct': 0.02454716797754017, 'sideways_atr_max_pct': 0.12949134807790547, 'sideways_tp_mult': 1.7610392717817152, 'sideways_tsl_mult': 0.4595540379214282, 'sideways_time_stop': 299, 'sideways_use_sma': True, 'sideways_use_ema': False, 'sideways_use_atr': False, 'sideways_use_adx': True, 'sideways_use_spike': False, 'sideways_rsi_required': False}.
[I 2025-09-01 09:32:45,084] Trial 163 finished with values: [-1000000000.0, 1000000000.0] and parameters: {'p_sma': 38, 'p_std': 25, 'p_atr': 17, 'p_adx': 18, 'rsi_period': 52, 'ema1': 19, 'ema2': 60, 'slip_atr_k': 0.02836384534725989, 'slip_spread_k': 0.9916196156346389, 'spread_hl_frac': 0.027295332601446773, 'bb_std_mult': 2.1613670965640157, 'rsi_os': 35, 'rsi_ob': 85, 'vol_spike': 0.056413755754982135, 'adx_thresh': 33.57147063165452, 'atr_min_pct': 0.027626297810445705, 'atr_max_pct': 0.06559614481904119, 'tp_mult': 1.0938322817902002, 'tsl_mult': 0.7409254958838656, 'strategy': 'breakout', 'time_stop': 172, 'use_sma': True, 'use_atr': False, 'use_adx': False, 'use_ema': True, 'use_spike': True, 'rsi_required': True, 'edge_k': 1.6720284125018412, 'edge_cap': 0.6921109641260212, 'bull_strategy': 'breakout', 'bull_bb_std_mult': 0.9489413048237456, 'bull_rsi_os': 48, 'bull_rsi_ob': 54, 'bull_adx_thresh': 5.001724173950831, 'bull_atr_min_pct': 0.02098155627205447, 'bull_atr_max_pct': 0.10156501507541969, 'bull_tp_mult': 2.3637986295666784, 'bull_tsl_mult': 0.9238916111776824, 'bull_time_stop': 224, 'bull_use_sma': True, 'bull_use_ema': False, 'bull_use_atr': True, 'bull_use_adx': False, 'bull_use_spike': False, 'bull_rsi_required': True, 'bear_strategy': 'mean_reversion', 'bear_bb_std_mult': 2.0483723649322227, 'bear_rsi_os': 47, 'bear_rsi_ob': 93, 'bear_adx_thresh': 16.923116074056978, 'bear_atr_min_pct': 0.0050825614977516986, 'bear_atr_max_pct': 0.0428902419470486, 'bear_tp_mult': 2.991547203537766, 'bear_tsl_mult': 0.15951234827261687, 'bear_time_stop': 7, 'bear_use_sma': True, 'bear_use_ema': True, 'bear_use_atr': True, 'bear_use_adx': False, 'bear_use_spike': False, 'bear_rsi_required': False, 'sideways_strategy': 'mean_reversion', 'sideways_bb_std_mult': 3.4055319409732268, 'sideways_rsi_os': 53, 'sideways_rsi_ob': 92, 'sideways_adx_thresh': 27.28094442894598, 'sideways_atr_min_pct': 0.022473590760437492, 'sideways_atr_max_pct': 0.14097987086074165, 'sideways_tp_mult': 2.541011788841902, 'sideways_tsl_mult': 0.3935336064069303, 'sideways_time_stop': 293, 'sideways_use_sma': True, 'sideways_use_ema': False, 'sideways_use_atr': False, 'sideways_use_adx': True, 'sideways_use_spike': False, 'sideways_rsi_required': False}.
[I 2025-09-01 09:33:27,032] Trial 171 finished with values: [-1000000000.0, 1000000000.0] and parameters: {'p_sma': 20, 'p_std': 29, 'p_atr': 14, 'p_adx': 24, 'rsi_period': 58, 'ema1': 18, 'ema2': 47, 'slip_atr_k': 0.222078281613293, 'slip_spread_k': 0.5736763567309464, 'spread_hl_frac': 0.030654084619110736, 'bb_std_mult': 2.607687021110867, 'rsi_os': 11, 'rsi_ob': 68, 'vol_spike': 0.035661410790284495, 'adx_thresh': 25.969174282107065, 'atr_min_pct': 0.000905179897996395, 'atr_max_pct': 0.06873445363147704, 'tp_mult': 1.8804819799470163, 'tsl_mult': 0.790745040712669, 'strategy': 'breakout', 'time_stop': 266, 'use_sma': True, 'use_atr': False, 'use_adx': False, 'use_ema': True, 'use_spike': True, 'rsi_required': True, 'edge_k': 0.7802458877962777, 'edge_cap': 0.8470713756442201, 'bull_strategy': 'breakout', 'bull_bb_std_mult': 3.47842016563217, 'bull_rsi_os': 50, 'bull_rsi_ob': 52, 'bull_adx_thresh': 5.889324415209894, 'bull_atr_min_pct': 0.004285000960666346, 'bull_atr_max_pct': 0.08523065215670772, 'bull_tp_mult': 1.6294969065010931, 'bull_tsl_mult': 0.777282164172159, 'bull_time_stop': 116, 'bull_use_sma': True, 'bull_use_ema': False, 'bull_use_atr': True, 'bull_use_adx': False, 'bull_use_spike': False, 'bull_rsi_required': True, 'bear_strategy': 'mean_reversion', 'bear_bb_std_mult': 1.8573549610398463, 'bear_rsi_os': 54, 'bear_rsi_ob': 87, 'bear_adx_thresh': 15.450279822082766, 'bear_atr_min_pct': 0.027767377411404243, 'bear_atr_max_pct': 0.12031418443872835, 'bear_tp_mult': 2.1305382657148657, 'bear_tsl_mult': 0.1142483757843396, 'bear_time_stop': 45, 'bear_use_sma': True, 'bear_use_ema': True, 'bear_use_atr': True, 'bear_use_adx': False, 'bear_use_spike': False, 'bear_rsi_required': False, 'sideways_strategy': 'mean_reversion', 'sideways_bb_std_mult': 2.8276966598090967, 'sideways_rsi_os': 21, 'sideways_rsi_ob': 94, 'sideways_adx_thresh': 27.8537868117459, 'sideways_atr_min_pct': 0.012725973510872096, 'sideways_atr_max_pct': 0.07179979440022669, 'sideways_tp_mult': 1.9681891197360746, 'sideways_tsl_mult': 0.5507958422711119, 'sideways_time_stop': 13, 'sideways_use_sma': True, 'sideways_use_ema': False, 'sideways_use_atr': False, 'sideways_use_adx': True, 'sideways_use_spike': False, 'sideways_rsi_required': True}.
[I 2025-09-01 09:33:27,035] Trial 170 finished with values: [-1000000000.0, 1000000000.0] and parameters: {'p_sma': 55, 'p_std': 49, 'p_atr': 14, 'p_adx': 17, 'rsi_period': 58, 'ema1': 18, 'ema2': 23, 'slip_atr_k': 0.19379427995545323, 'slip_spread_k': 0.0864212825768807, 'spread_hl_frac': 0.030280309499625072, 'bb_std_mult': 1.415337876821028, 'rsi_os': 11, 'rsi_ob': 68, 'vol_spike': 0.04067148645632735, 'adx_thresh': 26.18576220628228, 'atr_min_pct': 0.02886418357618995, 'atr_max_pct': 0.06885247019439845, 'tp_mult': 1.1244958525841207, 'tsl_mult': 0.4249366600847542, 'strategy': 'breakout', 'time_stop': 266, 'use_sma': True, 'use_atr': False, 'use_adx': False, 'use_ema': True, 'use_spike': True, 'rsi_required': True, 'edge_k': 1.1653550068454, 'edge_cap': 0.5305928001111663, 'bull_strategy': 'breakout', 'bull_bb_std_mult': 3.280666919316191, 'bull_rsi_os': 21, 'bull_rsi_ob': 53, 'bull_adx_thresh': 33.10744815717788, 'bull_atr_min_pct': 0.007685262834175207, 'bull_atr_max_pct': 0.05583878480515175, 'bull_tp_mult': 2.938104116844617, 'bull_tsl_mult': 0.9409994164858893, 'bull_time_stop': 19, 'bull_use_sma': True, 'bull_use_ema': False, 'bull_use_atr': True, 'bull_use_adx': False, 'bull_use_spike': False, 'bull_rsi_required': True, 'bear_strategy': 'mean_reversion', 'bear_bb_std_mult': 2.532058506369232, 'bear_rsi_os': 37, 'bear_rsi_ob': 95, 'bear_adx_thresh': 24.236582155890037, 'bear_atr_min_pct': 0.027650288153103143, 'bear_atr_max_pct': 0.118995432447661, 'bear_tp_mult': 2.1507588919434077, 'bear_tsl_mult': 0.17428131805858987, 'bear_time_stop': 280, 'bear_use_sma': True, 'bear_use_ema': True, 'bear_use_atr': True, 'bear_use_adx': False, 'bear_use_spike': False, 'bear_rsi_required': False, 'sideways_strategy': 'mean_reversion', 'sideways_bb_std_mult': 0.9152172419051714, 'sideways_rsi_os': 20, 'sideways_rsi_ob': 95, 'sideways_adx_thresh': 34.8574510795033, 'sideways_atr_min_pct': 0.022531658332113277, 'sideways_atr_max_pct': 0.07029087749502146, 'sideways_tp_mult': 1.9698002525387528, 'sideways_tsl_mult': 0.35954149800422636, 'sideways_time_stop': 14, 'sideways_use_sma': True, 'sideways_use_ema': False, 'sideways_use_atr': False, 'sideways_use_adx': True, 'sideways_use_spike': False, 'sideways_rsi_required': True}.
[I 2025-09-01 09:33:27,036] Trial 168 finished with values: [-1000000000.0, 1000000000.0] and parameters: {'p_sma': 38, 'p_std': 38, 'p_atr': 18, 'p_adx': 18, 'rsi_period': 53, 'ema1': 28, 'ema2': 54, 'slip_atr_k': 0.239840327179056, 'slip_spread_k': 0.5733949063915248, 'spread_hl_frac': 0.030099137211040617, 'bb_std_mult': 1.9218146773361808, 'rsi_os': 54, 'rsi_ob': 84, 'vol_spike': 0.04123566737702574, 'adx_thresh': 25.240442785237338, 'atr_min_pct': 0.02758176232894034, 'atr_max_pct': 0.0686471382970493, 'tp_mult': 1.0648939768346402, 'tsl_mult': 0.4091047941985671, 'strategy': 'breakout', 'time_stop': 298, 'use_sma': True, 'use_atr': False, 'use_adx': False, 'use_ema': True, 'use_spike': True, 'rsi_required': True, 'edge_k': 0.8709195712714184, 'edge_cap': 0.5111563783431358, 'bull_strategy': 'breakout', 'bull_bb_std_mult': 0.5044945546249413, 'bull_rsi_os': 21, 'bull_rsi_ob': 87, 'bull_adx_thresh': 5.1425119477143255, 'bull_atr_min_pct': 0.022452256184498625, 'bull_atr_max_pct': 0.0982295032730111, 'bull_tp_mult': 2.38631334211874, 'bull_tsl_mult': 0.7837257798013895, 'bull_time_stop': 57, 'bull_use_sma': True, 'bull_use_ema': False, 'bull_use_atr': True, 'bull_use_adx': False, 'bull_use_spike': False, 'bull_rsi_required': True, 'bear_strategy': 'mean_reversion', 'bear_bb_std_mult': 2.06853103645049, 'bear_rsi_os': 55, 'bear_rsi_ob': 95, 'bear_adx_thresh': 24.360343507516927, 'bear_atr_min_pct': 0.027588194392658985, 'bear_atr_max_pct': 0.01580712426599798, 'bear_tp_mult': 2.132168884774321, 'bear_tsl_mult': 0.17068851000430574, 'bear_time_stop': 300, 'bear_use_sma': True, 'bear_use_ema': True, 'bear_use_atr': True, 'bear_use_adx': False, 'bear_use_spike': False, 'bear_rsi_required': False, 'sideways_strategy': 'mean_reversion', 'sideways_bb_std_mult': 0.8571358225984804, 'sideways_rsi_os': 7, 'sideways_rsi_ob': 94, 'sideways_adx_thresh': 26.367419330219096, 'sideways_atr_min_pct': 0.02518190081012582, 'sideways_atr_max_pct': 0.0726087635559972, 'sideways_tp_mult': 1.7266339088126967, 'sideways_tsl_mult': 0.5367080985438661, 'sideways_time_stop': 14, 'sideways_use_sma': True, 'sideways_use_ema': False, 'sideways_use_atr': False, 'sideways_use_adx': True, 'sideways_use_spike': False, 'sideways_rsi_required': True}.
