[I 2025-09-01 10:17:32,185] Trial 434 finished with values: [-1000000000.0, 1000000000.0] and parameters: {'p_sma': 15, 'p_std': 14, 'p_atr': 19, 'p_adx': 25, 'rsi_period': 20, 'ema1': 9, 'ema2': 52, 'slip_atr_k': 0.045506451245462536, 'slip_spread_k': 0.8351200916091477, 'spread_hl_frac': 0.02965601340210003, 'bb_std_mult': 1.5681738300562387, 'rsi_os': 42, 'rsi_ob': 67, 'vol_spike': 0.2362504866165665, 'adx_thresh': 30.835212118118736, 'atr_min_pct': 0.006981755422957935, 'atr_max_pct': 0.14730893747651783, 'tp_mult': 1.1422546700461484, 'tsl_mult': 0.7087702743063166, 'strategy': 'breakout', 'time_stop': 90, 'use_sma': True, 'use_atr': False, 'use_adx': True, 'use_ema': False, 'use_spike': True, 'rsi_required': True, 'edge_k': 0.4653530183861768, 'edge_cap': 0.2797473887676814, 'bull_strategy': 'mean_reversion', 'bull_bb_std_mult': 3.4647276178394337, 'bull_rsi_os': 46, 'bull_rsi_ob': 94, 'bull_adx_thresh': 31.855898991303754, 'bull_atr_min_pct': 0.026423257571507503, 'bull_atr_max_pct': 0.025690292360830022, 'bull_tp_mult': 2.233290180266955, 'bull_tsl_mult': 0.5629996160387917, 'bull_time_stop': 152, 'bull_use_sma': True, 'bull_use_ema': False, 'bull_use_atr': False, 'bull_use_adx': False, 'bull_use_spike': False, 'bull_rsi_required': True, 'bear_strategy': 'breakout', 'bear_bb_std_mult': 0.8587166135532991, 'bear_rsi_os': 52, 'bear_rsi_ob': 57, 'bear_adx_thresh': 24.326880406838296, 'bear_atr_min_pct': 0.015445478070999847, 'bear_atr_max_pct': 0.05865873233920804, 'bear_tp_mult': 1.1443546916212912, 'bear_tsl_mult': 0.46642879548153565, 'bear_time_stop': 208, 'bear_use_sma': True, 'bear_use_ema': False, 'bear_use_atr': False, 'bear_use_adx': False, 'bear_use_spike': True, 'bear_rsi_required': False, 'sideways_strategy': 'mean_reversion', 'sideways_bb_std_mult': 0.997431517318202, 'sideways_rsi_os': 50, 'sideways_rsi_ob': 94, 'sideways_adx_thresh': 21.726968823665395, 'sideways_atr_min_pct': 0.010498803769999296, 'sideways_atr_max_pct': 0.06426103037298989, 'sideways_tp_mult': 2.442426805928813, 'sideways_tsl_mult': 0.33597725544010915, 'sideways_time_stop': 13, 'sideways_use_sma': False, 'sideways_use_ema': True, 'sideways_use_atr': False, 'sideways_use_adx': True, 'sideways_use_spike': False, 'sideways_rsi_required': True}.
[I 2025-09-01 10:17:32,580] Trial 433 finished with values: [-1000000000.0, 1000000000.0] and parameters: {'p_sma': 12, 'p_std': 55, 'p_atr': 18, 'p_adx': 10, 'rsi_period': 61, 'ema1': 20, 'ema2': 11, 'slip_atr_k': 0.04462713941571243, 'slip_spread_k': 0.14717767781230878, 'spread_hl_frac': 0.04404148354443301, 'bb_std_mult': 1.4101744497182862, 'rsi_os': 42, 'rsi_ob': 79, 'vol_spike': 0.05167289456919921, 'adx_thresh': 31.01950747063433, 'atr_min_pct': 0.006985818417729857, 'atr_max_pct': 0.1435038899111726, 'tp_mult': 1.8536249068291635, 'tsl_mult': 0.6821653363550378, 'strategy': 'breakout', 'time_stop': 162, 'use_sma': True, 'use_atr': False, 'use_adx': True, 'use_ema': True, 'use_spike': True, 'rsi_required': True, 'edge_k': 1.5623048052300137, 'edge_cap': 0.5044546150935072, 'bull_strategy': 'mean_reversion', 'bull_bb_std_mult': 2.118148066681377, 'bull_rsi_os': 11, 'bull_rsi_ob': 45, 'bull_adx_thresh': 6.955468306746013, 'bull_atr_min_pct': 0.019029212360376847, 'bull_atr_max_pct': 0.02470177883511264, 'bull_tp_mult': 2.999135662121011, 'bull_tsl_mult': 0.4981446981108807, 'bull_time_stop': 11, 'bull_use_sma': True, 'bull_use_ema': False, 'bull_use_atr': False, 'bull_use_adx': False, 'bull_use_spike': False, 'bull_rsi_required': True, 'bear_strategy': 'breakout', 'bear_bb_std_mult': 0.869670610636179, 'bear_rsi_os': 52, 'bear_rsi_ob': 47, 'bear_adx_thresh': 23.084513345791724, 'bear_atr_min_pct': 0.011130431472403102, 'bear_atr_max_pct': 0.05865827578834005, 'bear_tp_mult': 1.1575994675841874, 'bear_tsl_mult': 0.4627114396291808, 'bear_time_stop': 210, 'bear_use_sma': True, 'bear_use_ema': False, 'bear_use_atr': False, 'bear_use_adx': False, 'bear_use_spike': True, 'bear_rsi_required': False, 'sideways_strategy': 'mean_reversion', 'sideways_bb_std_mult': 1.0124221164785914, 'sideways_rsi_os': 31, 'sideways_rsi_ob': 91, 'sideways_adx_thresh': 6.131710605154323, 'sideways_atr_min_pct': 0.010733572413263354, 'sideways_atr_max_pct': 0.06425398270181595, 'sideways_tp_mult': 1.2233880230269096, 'sideways_tsl_mult': 0.785238954547328, 'sideways_time_stop': 192, 'sideways_use_sma': False, 'sideways_use_ema': True, 'sideways_use_atr': False, 'sideways_use_adx': True, 'sideways_use_spike': False, 'sideways_rsi_required': True}.
[I 2025-09-01 10:17:33,079] Trial 432 finished with values: [-1000000000.0, 1000000000.0] and parameters: {'p_sma': 43, 'p_std': 48, 'p_atr': 18, 'p_adx': 25, 'rsi_period': 20, 'ema1': 18, 'ema2': 53, 'slip_atr_k': 0.051527401819420976, 'slip_spread_k': 0.13853072121261356, 'spread_hl_frac': 0.031248359921307936, 'bb_std_mult': 1.4023681302835347, 'rsi_os': 42, 'rsi_ob': 67, 'vol_spike': 0.05047241111387629, 'adx_thresh': 30.762334207479608, 'atr_min_pct': 0.02125931728812407, 'atr_max_pct': 0.12772228458697887, 'tp_mult': 2.243946730068851, 'tsl_mult': 0.6805516459614726, 'strategy': 'breakout', 'time_stop': 260, 'use_sma': True, 'use_atr': False, 'use_adx': True, 'use_ema': True, 'use_spike': True, 'rsi_required': True, 'edge_k': 0.2989858172916512, 'edge_cap': 0.9947576831639784, 'bull_strategy': 'mean_reversion', 'bull_bb_std_mult': 2.2561296697212474, 'bull_rsi_os': 11, 'bull_rsi_ob': 45, 'bull_adx_thresh': 31.961436916858574, 'bull_atr_min_pct': 0.02663529280867133, 'bull_atr_max_pct': 0.02493290958782559, 'bull_tp_mult': 2.9997776640794793, 'bull_tsl_mult': 0.38627463461171174, 'bull_time_stop': 246, 'bull_use_sma': True, 'bull_use_ema': False, 'bull_use_atr': False, 'bull_use_adx': False, 'bull_use_spike': False, 'bull_rsi_required': True, 'bear_strategy': 'mean_reversion', 'bear_bb_std_mult': 0.8648426214221756, 'bear_rsi_os': 52, 'bear_rsi_ob': 47, 'bear_adx_thresh': 23.400327225684233, 'bear_atr_min_pct': 0.015690869043555572, 'bear_atr_max_pct': 0.05897105060190373, 'bear_tp_mult': 1.1183066168427611, 'bear_tsl_mult': 0.4916468318493328, 'bear_time_stop': 207, 'bear_use_sma': True, 'bear_use_ema': False, 'bear_use_atr': False, 'bear_use_adx': False, 'bear_use_spike': True, 'bear_rsi_required': False, 'sideways_strategy': 'mean_reversion', 'sideways_bb_std_mult': 3.073945414076705, 'sideways_rsi_os': 31, 'sideways_rsi_ob': 95, 'sideways_adx_thresh': 21.41297655456225, 'sideways_atr_min_pct': 0.0013593822159070137, 'sideways_atr_max_pct': 0.06361672595708782, 'sideways_tp_mult': 2.565361911153294, 'sideways_tsl_mult': 0.5161226432569838, 'sideways_time_stop': 35, 'sideways_use_sma': False, 'sideways_use_ema': True, 'sideways_use_atr': False, 'sideways_use_adx': True, 'sideways_use_spike': False, 'sideways_rsi_required': False}.
[I 2025-09-01 10:18:12,633] Trial 435 finished with values: [-1000000000.0, 1000000000.0] and parameters: {'p_sma': 18, 'p_std': 56, 'p_atr': 21, 'p_adx': 8, 'rsi_period': 20, 'ema1': 9, 'ema2': 15, 'slip_atr_k': 0.04121686508403171, 'slip_spread_k': 0.3105617185234294, 'spread_hl_frac': 0.00589991051957443, 'bb_std_mult': 0.5409333716613856, 'rsi_os': 39, 'rsi_ob': 80, 'vol_spike': 0.23543893269437027, 'adx_thresh': 30.909916107939296, 'atr_min_pct': 0.02159259400162112, 'atr_max_pct': 0.12792221131694567, 'tp_mult': 2.2310670743877945, 'tsl_mult': 0.2572096769746151, 'strategy': 'breakout', 'time_stop': 161, 'use_sma': True, 'use_atr': False, 'use_adx': True, 'use_ema': False, 'use_spike': True, 'rsi_required': True, 'edge_k': 0.2856335031336461, 'edge_cap': 0.5789734730722689, 'bull_strategy': 'mean_reversion', 'bull_bb_std_mult': 2.1173378021618965, 'bull_rsi_os': 39, 'bull_rsi_ob': 50, 'bull_adx_thresh': 18.91131789309763, 'bull_atr_min_pct': 0.0012322813508136457, 'bull_atr_max_pct': 0.09523645967672364, 'bull_tp_mult': 2.03689961404671, 'bull_tsl_mult': 0.31815173213469383, 'bull_time_stop': 155, 'bull_use_sma': True, 'bull_use_ema': False, 'bull_use_atr': True, 'bull_use_adx': False, 'bull_use_spike': False, 'bull_rsi_required': True, 'bear_strategy': 'breakout', 'bear_bb_std_mult': 1.5908525154883617, 'bear_rsi_os': 51, 'bear_rsi_ob': 74, 'bear_adx_thresh': 32.48642125861808, 'bear_atr_min_pct': 0.015545554712804232, 'bear_atr_max_pct': 0.058115601021224504, 'bear_tp_mult': 1.1475197414860052, 'bear_tsl_mult': 0.4654168998819101, 'bear_time_stop': 213, 'bear_use_sma': True, 'bear_use_ema': False, 'bear_use_atr': True, 'bear_use_adx': False, 'bear_use_spike': True, 'bear_rsi_required': False, 'sideways_strategy': 'mean_reversion', 'sideways_bb_std_mult': 3.0932966639877186, 'sideways_rsi_os': 33, 'sideways_rsi_ob': 91, 'sideways_adx_thresh': 21.881707306280344, 'sideways_atr_min_pct': 0.010994693178617393, 'sideways_atr_max_pct': 0.06409807840347066, 'sideways_tp_mult': 2.4345336885380764, 'sideways_tsl_mult': 0.8696656430789973, 'sideways_time_stop': 19, 'sideways_use_sma': False, 'sideways_use_ema': False, 'sideways_use_atr': False, 'sideways_use_adx': True, 'sideways_use_spike': False, 'sideways_rsi_required': True}.
[I 2025-09-01 10:18:13,129] Trial 436 finished with values: [-1000000000.0, 1000000000.0] and parameters: {'p_sma': 18, 'p_std': 8, 'p_atr': 24, 'p_adx': 25, 'rsi_period': 41, 'ema1': 8, 'ema2': 15, 'slip_atr_k': 0.07261296366751233, 'slip_spread_k': 0.6434800735088572, 'spread_hl_frac': 0.0431102630225233, 'bb_std_mult': 1.6528707804197817, 'rsi_os': 39, 'rsi_ob': 69, 'vol_spike': 0.08240803635733868, 'adx_thresh': 23.473417314362628, 'atr_min_pct': 0.009655377808250851, 'atr_max_pct': 0.12901983076616724, 'tp_mult': 2.236739373274649, 'tsl_mult': 0.6722367120480246, 'strategy': 'breakout', 'time_stop': 254, 'use_sma': True, 'use_atr': False, 'use_adx': True, 'use_ema': True, 'use_spike': True, 'rsi_required': True, 'edge_k': 1.2095280059183322, 'edge_cap': 0.5006782702200689, 'bull_strategy': 'mean_reversion', 'bull_bb_std_mult': 2.2257866994940594, 'bull_rsi_os': 45, 'bull_rsi_ob': 81, 'bull_adx_thresh': 7.13174415155269, 'bull_atr_min_pct': 0.023697080039904547, 'bull_atr_max_pct': 0.09432893213161714, 'bull_tp_mult': 2.9982031363057153, 'bull_tsl_mult': 0.5016032681045901, 'bull_time_stop': 227, 'bull_use_sma': True, 'bull_use_ema': False, 'bull_use_atr': True, 'bull_use_adx': False, 'bull_use_spike': False, 'bull_rsi_required': True, 'bear_strategy': 'mean_reversion', 'bear_bb_std_mult': 0.9812462316003385, 'bear_rsi_os': 12, 'bear_rsi_ob': 50, 'bear_adx_thresh': 32.195168838123756, 'bear_atr_min_pct': 0.010947290837929438, 'bear_atr_max_pct': 0.07312043176503116, 'bear_tp_mult': 1.1706031656127736, 'bear_tsl_mult': 0.44150978158841014, 'bear_time_stop': 53, 'bear_use_sma': True, 'bear_use_ema': False, 'bear_use_atr': True, 'bear_use_adx': False, 'bear_use_spike': True, 'bear_rsi_required': False, 'sideways_strategy': 'mean_reversion', 'sideways_bb_std_mult': 2.029018436316817, 'sideways_rsi_os': 52, 'sideways_rsi_ob': 91, 'sideways_adx_thresh': 22.126261476869608, 'sideways_atr_min_pct': 0.008729304685630117, 'sideways_atr_max_pct': 0.11382360585784027, 'sideways_tp_mult': 1.046772798028989, 'sideways_tsl_mult': 0.5184970660795858, 'sideways_time_stop': 28, 'sideways_use_sma': False, 'sideways_use_ema': False, 'sideways_use_atr': False, 'sideways_use_adx': True, 'sideways_use_spike': False, 'sideways_rsi_required': False}.
[I 2025-09-01 10:18:13,526] Trial 437 finished with values: [-1000000000.0, 1000000000.0] and parameters: {'p_sma': 18, 'p_std': 12, 'p_atr': 14, 'p_adx': 25, 'rsi_period': 41, 'ema1': 23, 'ema2': 13, 'slip_atr_k': 0.2084640324196541, 'slip_spread_k': 0.6391888559735959, 'spread_hl_frac': 0.005637225593367382, 'bb_std_mult': 2.4015320905493422, 'rsi_os': 39, 'rsi_ob': 49, 'vol_spike': 0.11039922451019099, 'adx_thresh': 32.789398783128355, 'atr_min_pct': 0.015773798046820234, 'atr_max_pct': 0.12893591506131719, 'tp_mult': 1.760200628786428, 'tsl_mult': 0.6655437802789387, 'strategy': 'breakout', 'time_stop': 106, 'use_sma': True, 'use_atr': False, 'use_adx': False, 'use_ema': True, 'use_spike': True, 'rsi_required': False, 'edge_k': 0.29688027461155286, 'edge_cap': 0.43595951613459727, 'bull_strategy': 'mean_reversion', 'bull_bb_std_mult': 3.556173413358223, 'bull_rsi_os': 51, 'bull_rsi_ob': 63, 'bull_adx_thresh': 6.0306419627577235, 'bull_atr_min_pct': 0.023661674807349813, 'bull_atr_max_pct': 0.09380289456055481, 'bull_tp_mult': 2.9652141213712553, 'bull_tsl_mult': 0.5361023032430049, 'bull_time_stop': 285, 'bull_use_sma': True, 'bull_use_ema': False, 'bull_use_atr': True, 'bull_use_adx': True, 'bull_use_spike': True, 'bull_rsi_required': False, 'bear_strategy': 'mean_reversion', 'bear_bb_std_mult': 0.6985526544733276, 'bear_rsi_os': 55, 'bear_rsi_ob': 73, 'bear_adx_thresh': 24.985362920634625, 'bear_atr_min_pct': 0.0064692370250441335, 'bear_atr_max_pct': 0.07288565854865117, 'bear_tp_mult': 1.580658983635892, 'bear_tsl_mult': 0.4445628086592261, 'bear_time_stop': 279, 'bear_use_sma': True, 'bear_use_ema': False, 'bear_use_atr': True, 'bear_use_adx': False, 'bear_use_spike': False, 'bear_rsi_required': False, 'sideways_strategy': 'mean_reversion', 'sideways_bb_std_mult': 0.5590403485060742, 'sideways_rsi_os': 33, 'sideways_rsi_ob': 91, 'sideways_adx_thresh': 24.10821470473021, 'sideways_atr_min_pct': 0.008934704734932583, 'sideways_atr_max_pct': 0.07071063608251374, 'sideways_tp_mult': 2.5685834850433125, 'sideways_tsl_mult': 0.3763557667670725, 'sideways_time_stop': 46, 'sideways_use_sma': True, 'sideways_use_ema': False, 'sideways_use_atr': False, 'sideways_use_adx': False, 'sideways_use_spike': False, 'sideways_rsi_required': False}.
[I 2025-09-01 10:18:13,894] Trial 438 finished with values: [-0.11389247876869923, 0.11370125880079078] and parameters: {'p_sma': 18, 'p_std': 6, 'p_atr': 14, 'p_adx': 12, 'rsi_period': 24, 'ema1': 27, 'ema2': 15, 'slip_atr_k': 0.19282004814149536, 'slip_spread_k': 0.6424031836970802, 'spread_hl_frac': 0.04717992373054005, 'bb_std_mult': 2.3802704272053368, 'rsi_os': 39, 'rsi_ob': 91, 'vol_spike': 0.11260040113670172, 'adx_thresh': 23.341281764001405, 'atr_min_pct': 0.015983362078197914, 'atr_max_pct': 0.13369845119405382, 'tp_mult': 1.701500373403096, 'tsl_mult': 0.3741370324061077, 'strategy': 'breakout', 'time_stop': 109, 'use_sma': True, 'use_atr': False, 'use_adx': False, 'use_ema': False, 'use_spike': True, 'rsi_required': False, 'edge_k': 1.2110780608627294, 'edge_cap': 0.5871230688854224, 'bull_strategy': 'mean_reversion', 'bull_bb_std_mult': 3.539420937337953, 'bull_rsi_os': 50, 'bull_rsi_ob': 81, 'bull_adx_thresh': 10.227768108069062, 'bull_atr_min_pct': 0.0010321372775831373, 'bull_atr_max_pct': 0.14391779412849717, 'bull_tp_mult': 2.0310436567065873, 'bull_tsl_mult': 0.8715343682439838, 'bull_time_stop': 226, 'bull_use_sma': False, 'bull_use_ema': False, 'bull_use_atr': True, 'bull_use_adx': True, 'bull_use_spike': True, 'bull_rsi_required': False, 'bear_strategy': 'mean_reversion', 'bear_bb_std_mult': 0.9767803060118819, 'bear_rsi_os': 55, 'bear_rsi_ob': 49, 'bear_adx_thresh': 16.73965875644015, 'bear_atr_min_pct': 0.021295645594553332, 'bear_atr_max_pct': 0.021491970089830496, 'bear_tp_mult': 1.2408854117694648, 'bear_tsl_mult': 0.43869298042351523, 'bear_time_stop': 55, 'bear_use_sma': False, 'bear_use_ema': False, 'bear_use_atr': True, 'bear_use_adx': False, 'bear_use_spike': False, 'bear_rsi_required': True, 'sideways_strategy': 'mean_reversion', 'sideways_bb_std_mult': 1.8262814965531242, 'sideways_rsi_os': 36, 'sideways_rsi_ob': 81, 'sideways_adx_thresh': 24.27077185759839, 'sideways_atr_min_pct': 0.008836416670576948, 'sideways_atr_max_pct': 0.07056583153341367, 'sideways_tp_mult': 1.054282024841223, 'sideways_tsl_mult': 0.0007131695522853421, 'sideways_time_stop': 47, 'sideways_use_sma': True, 'sideways_use_ema': False, 'sideways_use_atr': False, 'sideways_use_adx': False, 'sideways_use_spike': True, 'sideways_rsi_required': False}.
[I 2025-09-01 10:18:14,732] Trial 440 finished with values: [-1000000000.0, 1000000000.0] and parameters: {'p_sma': 16, 'p_std': 43, 'p_atr': 19, 'p_adx': 11, 'rsi_period': 23, 'ema1': 25, 'ema2': 37, 'slip_atr_k': 0.20074132602391204, 'slip_spread_k': 0.6815516391218833, 'spread_hl_frac': 0.028545860146700734, 'bb_std_mult': 2.3879131653899095, 'rsi_os': 41, 'rsi_ob': 49, 'vol_spike': 0.10980498097477767, 'adx_thresh': 32.7887573052292, 'atr_min_pct': 0.015740447483288254, 'atr_max_pct': 0.13528136581219968, 'tp_mult': 1.6964063001899627, 'tsl_mult': 0.3609367484496936, 'strategy': 'mean_reversion', 'time_stop': 232, 'use_sma': False, 'use_atr': False, 'use_adx': False, 'use_ema': True, 'use_spike': True, 'rsi_required': False, 'edge_k': 0.5543784393453484, 'edge_cap': 0.44135888790968375, 'bull_strategy': 'breakout', 'bull_bb_std_mult': 3.599516477784877, 'bull_rsi_os': 50, 'bull_rsi_ob': 48, 'bull_adx_thresh': 5.067944171990815, 'bull_atr_min_pct': 0.0017889734291303661, 'bull_atr_max_pct': 0.14340054339052788, 'bull_tp_mult': 2.8720881497614146, 'bull_tsl_mult': 0.07305799956591791, 'bull_time_stop': 217, 'bull_use_sma': False, 'bull_use_ema': True, 'bull_use_atr': True, 'bull_use_adx': True, 'bull_use_spike': True, 'bull_rsi_required': False, 'bear_strategy': 'mean_reversion', 'bear_bb_std_mult': 3.496556112590951, 'bear_rsi_os': 55, 'bear_rsi_ob': 74, 'bear_adx_thresh': 25.03486235950927, 'bear_atr_min_pct': 0.00764031849863206, 'bear_atr_max_pct': 0.09368374406682822, 'bear_tp_mult': 1.2410066798608643, 'bear_tsl_mult': 0.5300564169108072, 'bear_time_stop': 300, 'bear_use_sma': False, 'bear_use_ema': True, 'bear_use_atr': True, 'bear_use_adx': False, 'bear_use_spike': False, 'bear_rsi_required': True, 'sideways_strategy': 'mean_reversion', 'sideways_bb_std_mult': 0.8437332214371863, 'sideways_rsi_os': 36, 'sideways_rsi_ob': 81, 'sideways_adx_thresh': 24.092494887611032, 'sideways_atr_min_pct': 0.010037350257449998, 'sideways_atr_max_pct': 0.09597088581620504, 'sideways_tp_mult': 2.4642128489657917, 'sideways_tsl_mult': 0.825141229609401, 'sideways_time_stop': 29, 'sideways_use_sma': True, 'sideways_use_ema': False, 'sideways_use_atr': True, 'sideways_use_adx': False, 'sideways_use_spike': True, 'sideways_rsi_required': False}.
[I 2025-09-01 10:18:14,742] Trial 441 finished with values: [-1000000000.0, 1000000000.0] and parameters: {'p_sma': 50, 'p_std': 53, 'p_atr': 9, 'p_adx': 11, 'rsi_period': 23, 'ema1': 24, 'ema2': 36, 'slip_atr_k': 0.057833911003432784, 'slip_spread_k': 0.6822355375498487, 'spread_hl_frac': 0.028766002149254025, 'bb_std_mult': 1.3109523861802757, 'rsi_os': 51, 'rsi_ob': 66, 'vol_spike': 0.11755110215596978, 'adx_thresh': 31.594704735418347, 'atr_min_pct': 0.01255140982301264, 'atr_max_pct': 0.1349779544020226, 'tp_mult': 1.082468770095408, 'tsl_mult': 0.717845418522145, 'strategy': 'mean_reversion', 'time_stop': 6, 'use_sma': False, 'use_atr': False, 'use_adx': False, 'use_ema': True, 'use_spike': True, 'rsi_required': False, 'edge_k': 1.095722800678457, 'edge_cap': 0.5994123173770395, 'bull_strategy': 'breakout', 'bull_bb_std_mult': 3.4704723327351443, 'bull_rsi_os': 44, 'bull_rsi_ob': 48, 'bull_adx_thresh': 6.037405141889104, 'bull_atr_min_pct': 0.0010343597537298547, 'bull_atr_max_pct': 0.08649083403191656, 'bull_tp_mult': 1.898951802517432, 'bull_tsl_mult': 0.41119451613793134, 'bull_time_stop': 218, 'bull_use_sma': False, 'bull_use_ema': True, 'bull_use_atr': True, 'bull_use_adx': True, 'bull_use_spike': True, 'bull_rsi_required': False, 'bear_strategy': 'mean_reversion', 'bear_bb_std_mult': 0.9504264024023333, 'bear_rsi_os': 54, 'bear_rsi_ob': 75, 'bear_adx_thresh': 24.086409506693627, 'bear_atr_min_pct': 0.00761520819365917, 'bear_atr_max_pct': 0.021295105681953752, 'bear_tp_mult': 2.474399380039264, 'bear_tsl_mult': 0.8945463865574181, 'bear_time_stop': 268, 'bear_use_sma': False, 'bear_use_ema': True, 'bear_use_atr': True, 'bear_use_adx': False, 'bear_use_spike': False, 'bear_rsi_required': True, 'sideways_strategy': 'mean_reversion', 'sideways_bb_std_mult': 0.8190727544978875, 'sideways_rsi_os': 51, 'sideways_rsi_ob': 70, 'sideways_adx_thresh': 25.25235963967661, 'sideways_atr_min_pct': 0.011755425718975983, 'sideways_atr_max_pct': 0.06813127208927548, 'sideways_tp_mult': 1.544939651678002, 'sideways_tsl_mult': 0.11294963601306335, 'sideways_time_stop': 24, 'sideways_use_sma': True, 'sideways_use_ema': False, 'sideways_use_atr': True, 'sideways_use_adx': False, 'sideways_use_spike': True, 'sideways_rsi_required': False}.
