[I 2025-09-01 10:01:53,225] Trial 339 finished with values: [-1000000000.0, 1000000000.0] and parameters: {'p_sma': 19, 'p_std': 35, 'p_atr': 15, 'p_adx': 21, 'rsi_period': 29, 'ema1': 18, 'ema2': 40, 'slip_atr_k': 0.13078022996019142, 'slip_spread_k': 0.0999382251335379, 'spread_hl_frac': 0.03052198994690545, 'bb_std_mult': 1.5499113344374909, 'rsi_os': 42, 'rsi_ob': 70, 'vol_spike': 0.04472128241172854, 'adx_thresh': 32.30020231917688, 'atr_min_pct': 0.019265468405386486, 'atr_max_pct': 0.1323326649416239, 'tp_mult': 2.8360514740995795, 'tsl_mult': 0.9834602804410887, 'strategy': 'breakout', 'time_stop': 28, 'use_sma': True, 'use_atr': False, 'use_adx': False, 'use_ema': False, 'use_spike': True, 'rsi_required': True, 'edge_k': 1.2634174032815328, 'edge_cap': 0.394491663468711, 'bull_strategy': 'mean_reversion', 'bull_bb_std_mult': 3.599272707632707, 'bull_rsi_os': 9, 'bull_rsi_ob': 47, 'bull_adx_thresh': 7.396256257758607, 'bull_atr_min_pct': 0.008010075667986786, 'bull_atr_max_pct': 0.05703022103202997, 'bull_tp_mult': 2.5212062898559653, 'bull_tsl_mult': 0.7481727295300091, 'bull_time_stop': 88, 'bull_use_sma': True, 'bull_use_ema': False, 'bull_use_atr': False, 'bull_use_adx': True, 'bull_use_spike': False, 'bull_rsi_required': True, 'bear_strategy': 'breakout', 'bear_bb_std_mult': 0.6365659167188567, 'bear_rsi_os': 55, 'bear_rsi_ob': 48, 'bear_adx_thresh': 24.392149804697592, 'bear_atr_min_pct': 0.003800483091007297, 'bear_atr_max_pct': 0.035991558486713135, 'bear_tp_mult': 2.384953558554146, 'bear_tsl_mult': 0.29354945489719964, 'bear_time_stop': 194, 'bear_use_sma': True, 'bear_use_ema': False, 'bear_use_atr': True, 'bear_use_adx': False, 'bear_use_spike': False, 'bear_rsi_required': False, 'sideways_strategy': 'mean_reversion', 'sideways_bb_std_mult': 0.5008117650050377, 'sideways_rsi_os': 51, 'sideways_rsi_ob': 90, 'sideways_adx_thresh': 8.70463142737618, 'sideways_atr_min_pct': 0.02660766172748366, 'sideways_atr_max_pct': 0.0686481609236026, 'sideways_tp_mult': 1.1340884830747286, 'sideways_tsl_mult': 0.49124767712437556, 'sideways_time_stop': 30, 'sideways_use_sma': False, 'sideways_use_ema': True, 'sideways_use_atr': True, 'sideways_use_adx': True, 'sideways_use_spike': False, 'sideways_rsi_required': False}.
[I 2025-09-01 10:02:31,049] Trial 346 finished with values: [-1000000000.0, 1000000000.0] and parameters: {'p_sma': 34, 'p_std': 15, 'p_atr': 18, 'p_adx': 25, 'rsi_period': 20, 'ema1': 8, 'ema2': 13, 'slip_atr_k': 0.050593083032697855, 'slip_spread_k': 0.6440832952704669, 'spread_hl_frac': 0.027997323108175168, 'bb_std_mult': 1.959004412596407, 'rsi_os': 22, 'rsi_ob': 67, 'vol_spike': 0.11248990720131502, 'adx_thresh': 33.1031402641957, 'atr_min_pct': 0.013759987062110613, 'atr_max_pct': 0.09681540113245607, 'tp_mult': 1.075334008039536, 'tsl_mult': 0.33007849551194157, 'strategy': 'breakout', 'time_stop': 135, 'use_sma': True, 'use_atr': False, 'use_adx': False, 'use_ema': True, 'use_spike': True, 'rsi_required': False, 'edge_k': 1.168316308082179, 'edge_cap': 0.5630994839639247, 'bull_strategy': 'mean_reversion', 'bull_bb_std_mult': 3.4429072015111917, 'bull_rsi_os': 47, 'bull_rsi_ob': 62, 'bull_adx_thresh': 9.708926626951051, 'bull_atr_min_pct': 0.011015123458909305, 'bull_atr_max_pct': 0.05345120267335084, 'bull_tp_mult': 2.932683918086283, 'bull_tsl_mult': 0.34898590838096727, 'bull_time_stop': 236, 'bull_use_sma': True, 'bull_use_ema': False, 'bull_use_atr': True, 'bull_use_adx': False, 'bull_use_spike': True, 'bull_rsi_required': False, 'bear_strategy': 'mean_reversion', 'bear_bb_std_mult': 2.806576902639436, 'bear_rsi_os': 38, 'bear_rsi_ob': 80, 'bear_adx_thresh': 15.378928443244869, 'bear_atr_min_pct': 0.00248093905541439, 'bear_atr_max_pct': 0.06451273707299655, 'bear_tp_mult': 1.2756991891575575, 'bear_tsl_mult': 0.6265695176282737, 'bear_time_stop': 65, 'bear_use_sma': True, 'bear_use_ema': False, 'bear_use_atr': True, 'bear_use_adx': True, 'bear_use_spike': False, 'bear_rsi_required': False, 'sideways_strategy': 'breakout', 'sideways_bb_std_mult': 1.0510122062126788, 'sideways_rsi_os': 35, 'sideways_rsi_ob': 46, 'sideways_adx_thresh': 21.983537855460767, 'sideways_atr_min_pct': 0.008833376729978804, 'sideways_atr_max_pct': 0.09222618914430326, 'sideways_tp_mult': 2.3495644955329116, 'sideways_tsl_mult': 0.5379302906410198, 'sideways_time_stop': 36, 'sideways_use_sma': True, 'sideways_use_ema': False, 'sideways_use_atr': False, 'sideways_use_adx': False, 'sideways_use_spike': False, 'sideways_rsi_required': False}.
[I 2025-09-01 10:02:31,439] Trial 345 finished with values: [-0.10145982427640177, 0.10129895041188981] and parameters: {'p_sma': 20, 'p_std': 12, 'p_atr': 18, 'p_adx': 25, 'rsi_period': 26, 'ema1': 13, 'ema2': 18, 'slip_atr_k': 0.048553673834371536, 'slip_spread_k': 0.9755245060202533, 'spread_hl_frac': 0.03032201163136045, 'bb_std_mult': 2.905120518341242, 'rsi_os': 40, 'rsi_ob': 67, 'vol_spike': 0.05384808438266116, 'adx_thresh': 33.08678129413166, 'atr_min_pct': 0.010678375814220122, 'atr_max_pct': 0.10004282624639521, 'tp_mult': 1.0694977918691537, 'tsl_mult': 0.9054237600767847, 'strategy': 'breakout', 'time_stop': 259, 'use_sma': True, 'use_atr': False, 'use_adx': False, 'use_ema': True, 'use_spike': True, 'rsi_required': True, 'edge_k': 1.1529347457019559, 'edge_cap': 0.5754193292562308, 'bull_strategy': 'mean_reversion', 'bull_bb_std_mult': 3.595578144389113, 'bull_rsi_os': 47, 'bull_rsi_ob': 51, 'bull_adx_thresh': 7.503069947284702, 'bull_atr_min_pct': 1.9371308868992246e-06, 'bull_atr_max_pct': 0.11233560285070379, 'bull_tp_mult': 2.915310897805269, 'bull_tsl_mult': 0.35011953039134347, 'bull_time_stop': 235, 'bull_use_sma': True, 'bull_use_ema': False, 'bull_use_atr': True, 'bull_use_adx': False, 'bull_use_spike': True, 'bull_rsi_required': True, 'bear_strategy': 'mean_reversion', 'bear_bb_std_mult': 0.9889465348433603, 'bear_rsi_os': 20, 'bear_rsi_ob': 68, 'bear_adx_thresh': 21.880557728346577, 'bear_atr_min_pct': 0.005089090471211154, 'bear_atr_max_pct': 0.06458322179156839, 'bear_tp_mult': 1.2757265720000386, 'bear_tsl_mult': 0.7221296154110066, 'bear_time_stop': 289, 'bear_use_sma': True, 'bear_use_ema': False, 'bear_use_atr': True, 'bear_use_adx': True, 'bear_use_spike': False, 'bear_rsi_required': False, 'sideways_strategy': 'breakout', 'sideways_bb_std_mult': 1.6428894716105993, 'sideways_rsi_os': 35, 'sideways_rsi_ob': 92, 'sideways_adx_thresh': 18.87786574073847, 'sideways_atr_min_pct': 0.007839886052066092, 'sideways_atr_max_pct': 0.07539519138001519, 'sideways_tp_mult': 1.5261200286464036, 'sideways_tsl_mult': 0.12394833069971517, 'sideways_time_stop': 30, 'sideways_use_sma': True, 'sideways_use_ema': False, 'sideways_use_atr': False, 'sideways_use_adx': True, 'sideways_use_spike': False, 'sideways_rsi_required': False}.
[I 2025-09-01 10:02:31,469] Trial 344 finished with values: [-1000000000.0, 1000000000.0] and parameters: {'p_sma': 41, 'p_std': 37, 'p_atr': 9, 'p_adx': 25, 'rsi_period': 29, 'ema1': 18, 'ema2': 18, 'slip_atr_k': 0.04882098088164353, 'slip_spread_k': 0.9665556364306784, 'spread_hl_frac': 0.02759975855069013, 'bb_std_mult': 3.5855320769683203, 'rsi_os': 22, 'rsi_ob': 67, 'vol_spike': 0.07011382992210805, 'adx_thresh': 33.028330527317074, 'atr_min_pct': 0.008823653972408285, 'atr_max_pct': 0.1232443851267311, 'tp_mult': 1.065901750087273, 'tsl_mult': 0.6795768839471423, 'strategy': 'breakout', 'time_stop': 249, 'use_sma': True, 'use_atr': True, 'use_adx': False, 'use_ema': True, 'use_spike': True, 'rsi_required': True, 'edge_k': 0.8050006774158647, 'edge_cap': 0.5657200330322719, 'bull_strategy': 'mean_reversion', 'bull_bb_std_mult': 3.463042276150998, 'bull_rsi_os': 27, 'bull_rsi_ob': 51, 'bull_adx_thresh': 6.622720879882795, 'bull_atr_min_pct': 0.010929108546875545, 'bull_atr_max_pct': 0.08790694112303858, 'bull_tp_mult': 2.8118475032874217, 'bull_tsl_mult': 0.40388470809794663, 'bull_time_stop': 218, 'bull_use_sma': True, 'bull_use_ema': False, 'bull_use_atr': True, 'bull_use_adx': False, 'bull_use_spike': True, 'bull_rsi_required': True, 'bear_strategy': 'mean_reversion', 'bear_bb_std_mult': 0.6381438554991898, 'bear_rsi_os': 37, 'bear_rsi_ob': 63, 'bear_adx_thresh': 23.672624363955336, 'bear_atr_min_pct': 0.005108554245663764, 'bear_atr_max_pct': 0.06492218256100185, 'bear_tp_mult': 1.448967470988593, 'bear_tsl_mult': 0.6270606791953837, 'bear_time_stop': 300, 'bear_use_sma': True, 'bear_use_ema': False, 'bear_use_atr': False, 'bear_use_adx': True, 'bear_use_spike': False, 'bear_rsi_required': False, 'sideways_strategy': 'breakout', 'sideways_bb_std_mult': 1.7732858644939324, 'sideways_rsi_os': 46, 'sideways_rsi_ob': 92, 'sideways_adx_thresh': 22.5916579502975, 'sideways_atr_min_pct': 0.026782231666717678, 'sideways_atr_max_pct': 0.0921231952998272, 'sideways_tp_mult': 2.3015363267879487, 'sideways_tsl_mult': 0.5579384876638644, 'sideways_time_stop': 30, 'sideways_use_sma': True, 'sideways_use_ema': False, 'sideways_use_atr': False, 'sideways_use_adx': True, 'sideways_use_spike': False, 'sideways_rsi_required': False}.
[I 2025-09-01 10:02:31,707] Trial 343 finished with values: [-1000000000.0, 1000000000.0] and parameters: {'p_sma': 19, 'p_std': 16, 'p_atr': 12, 'p_adx': 22, 'rsi_period': 29, 'ema1': 24, 'ema2': 47, 'slip_atr_k': 0.048159209645628115, 'slip_spread_k': 0.60646983852607, 'spread_hl_frac': 0.045779220539530804, 'bb_std_mult': 1.4363575896879894, 'rsi_os': 40, 'rsi_ob': 68, 'vol_spike': 0.06984168339166674, 'adx_thresh': 33.16645595701384, 'atr_min_pct': 0.01962240977921001, 'atr_max_pct': 0.10026301664582157, 'tp_mult': 1.6538371879746872, 'tsl_mult': 0.7181780536839425, 'strategy': 'mean_reversion', 'time_stop': 7, 'use_sma': False, 'use_atr': True, 'use_adx': True, 'use_ema': True, 'use_spike': False, 'rsi_required': True, 'edge_k': 0.1645158940812308, 'edge_cap': 0.39763747459473797, 'bull_strategy': 'mean_reversion', 'bull_bb_std_mult': 3.5993596001449104, 'bull_rsi_os': 18, 'bull_rsi_ob': 51, 'bull_adx_thresh': 7.426194599343753, 'bull_atr_min_pct': 0.020774599486133596, 'bull_atr_max_pct': 0.08661231490980509, 'bull_tp_mult': 2.788645378914738, 'bull_tsl_mult': 0.3507984104274928, 'bull_time_stop': 203, 'bull_use_sma': True, 'bull_use_ema': True, 'bull_use_atr': True, 'bull_use_adx': False, 'bull_use_spike': False, 'bull_rsi_required': True, 'bear_strategy': 'mean_reversion', 'bear_bb_std_mult': 2.813777742685105, 'bear_rsi_os': 10, 'bear_rsi_ob': 47, 'bear_adx_thresh': 21.88272520520932, 'bear_atr_min_pct': 0.004707328084728846, 'bear_atr_max_pct': 0.0652922039091703, 'bear_tp_mult': 1.330971817627393, 'bear_tsl_mult': 0.037180772496525405, 'bear_time_stop': 290, 'bear_use_sma': True, 'bear_use_ema': False, 'bear_use_atr': False, 'bear_use_adx': False, 'bear_use_spike': True, 'bear_rsi_required': False, 'sideways_strategy': 'mean_reversion', 'sideways_bb_std_mult': 0.7487793344122806, 'sideways_rsi_os': 46, 'sideways_rsi_ob': 90, 'sideways_adx_thresh': 22.732219840036347, 'sideways_atr_min_pct': 0.02583105856738232, 'sideways_atr_max_pct': 0.09357756043215912, 'sideways_tp_mult': 2.2927142665509983, 'sideways_tsl_mult': 0.49289066359474604, 'sideways_time_stop': 31, 'sideways_use_sma': True, 'sideways_use_ema': False, 'sideways_use_atr': False, 'sideways_use_adx': True, 'sideways_use_spike': False, 'sideways_rsi_required': True}.
[I 2025-09-01 10:03:14,170] Trial 350 finished with values: [-1000000000.0, 1000000000.0] and parameters: {'p_sma': 17, 'p_std': 44, 'p_atr': 13, 'p_adx': 26, 'rsi_period': 21, 'ema1': 15, 'ema2': 57, 'slip_atr_k': 0.10424535820174743, 'slip_spread_k': 0.6937472164090341, 'spread_hl_frac': 0.030340594207054365, 'bb_std_mult': 3.512931679719797, 'rsi_os': 43, 'rsi_ob': 55, 'vol_spike': 0.08077564333579959, 'adx_thresh': 15.63231168296727, 'atr_min_pct': 0.014390684146848243, 'atr_max_pct': 0.14661423673360566, 'tp_mult': 2.3175287158732694, 'tsl_mult': 0.7186014698638599, 'strategy': 'breakout', 'time_stop': 237, 'use_sma': True, 'use_atr': False, 'use_adx': False, 'use_ema': True, 'use_spike': True, 'rsi_required': False, 'edge_k': 1.9690587685351728, 'edge_cap': 0.31786324664403, 'bull_strategy': 'mean_reversion', 'bull_bb_std_mult': 1.6955338227174324, 'bull_rsi_os': 29, 'bull_rsi_ob': 71, 'bull_adx_thresh': 6.087166980003765, 'bull_atr_min_pct': 0.005609476675470208, 'bull_atr_max_pct': 0.1368930841861364, 'bull_tp_mult': 2.759011238871103, 'bull_tsl_mult': 0.4084364430568721, 'bull_time_stop': 191, 'bull_use_sma': True, 'bull_use_ema': False, 'bull_use_atr': True, 'bull_use_adx': False, 'bull_use_spike': False, 'bull_rsi_required': False, 'bear_strategy': 'mean_reversion', 'bear_bb_std_mult': 0.9773288102261987, 'bear_rsi_os': 15, 'bear_rsi_ob': 87, 'bear_adx_thresh': 23.27519063458231, 'bear_atr_min_pct': 0.014530290529764768, 'bear_atr_max_pct': 0.046231706405818494, 'bear_tp_mult': 1.3621678666034778, 'bear_tsl_mult': 0.4505642516224821, 'bear_time_stop': 278, 'bear_use_sma': False, 'bear_use_ema': False, 'bear_use_atr': True, 'bear_use_adx': False, 'bear_use_spike': False, 'bear_rsi_required': True, 'sideways_strategy': 'mean_reversion', 'sideways_bb_std_mult': 0.9758142681894152, 'sideways_rsi_os': 9, 'sideways_rsi_ob': 48, 'sideways_adx_thresh': 11.966903720524218, 'sideways_atr_min_pct': 0.009821126655091827, 'sideways_atr_max_pct': 0.0807394973769495, 'sideways_tp_mult': 2.437017105027298, 'sideways_tsl_mult': 0.055182892842858766, 'sideways_time_stop': 10, 'sideways_use_sma': True, 'sideways_use_ema': False, 'sideways_use_atr': False, 'sideways_use_adx': False, 'sideways_use_spike': True, 'sideways_rsi_required': False}.
[I 2025-09-01 10:03:14,517] Trial 348 finished with values: [-1000000000.0, 1000000000.0] and parameters: {'p_sma': 17, 'p_std': 49, 'p_atr': 14, 'p_adx': 22, 'rsi_period': 64, 'ema1': 24, 'ema2': 49, 'slip_atr_k': 0.05559610488939238, 'slip_spread_k': 0.686309715282934, 'spread_hl_frac': 0.04575991128373995, 'bb_std_mult': 2.2218442070393785, 'rsi_os': 30, 'rsi_ob': 55, 'vol_spike': 0.09264931419656297, 'adx_thresh': 29.5384214933066, 'atr_min_pct': 0.005318804053307706, 'atr_max_pct': 0.0515929910886721, 'tp_mult': 2.315492472793494, 'tsl_mult': 0.7221189434584819, 'strategy': 'mean_reversion', 'time_stop': 267, 'use_sma': False, 'use_atr': False, 'use_adx': False, 'use_ema': True, 'use_spike': False, 'rsi_required': True, 'edge_k': 1.9584665876109741, 'edge_cap': 0.3074260064577976, 'bull_strategy': 'mean_reversion', 'bull_bb_std_mult': 2.3102098871862293, 'bull_rsi_os': 45, 'bull_rsi_ob': 79, 'bull_adx_thresh': 26.635573742123107, 'bull_atr_min_pct': 0.0009927851031205559, 'bull_atr_max_pct': 0.028984818455730643, 'bull_tp_mult': 1.1592819130983287, 'bull_tsl_mult': 0.403344960247855, 'bull_time_stop': 209, 'bull_use_sma': True, 'bull_use_ema': True, 'bull_use_atr': True, 'bull_use_adx': False, 'bull_use_spike': False, 'bull_rsi_required': True, 'bear_strategy': 'mean_reversion', 'bear_bb_std_mult': 0.9312918160182589, 'bear_rsi_os': 52, 'bear_rsi_ob': 82, 'bear_adx_thresh': 23.13450822439477, 'bear_atr_min_pct': 0.0044832762686551056, 'bear_atr_max_pct': 0.10691518589763292, 'bear_tp_mult': 2.8133357665293106, 'bear_tsl_mult': 0.41781324971011935, 'bear_time_stop': 279, 'bear_use_sma': False, 'bear_use_ema': False, 'bear_use_atr': True, 'bear_use_adx': False, 'bear_use_spike': False, 'bear_rsi_required': True, 'sideways_strategy': 'mean_reversion', 'sideways_bb_std_mult': 0.9720524894137998, 'sideways_rsi_os': 53, 'sideways_rsi_ob': 94, 'sideways_adx_thresh': 12.141723034814024, 'sideways_atr_min_pct': 0.009775244564410205, 'sideways_atr_max_pct': 0.06109439768963418, 'sideways_tp_mult': 2.4275518006743, 'sideways_tsl_mult': 0.8625701940389567, 'sideways_time_stop': 10, 'sideways_use_sma': True, 'sideways_use_ema': False, 'sideways_use_atr': False, 'sideways_use_adx': True, 'sideways_use_spike': True, 'sideways_rsi_required': True}.
[I 2025-09-01 10:03:14,797] Trial 347 finished with values: [-1000000000.0, 1000000000.0] and parameters: {'p_sma': 41, 'p_std': 44, 'p_atr': 9, 'p_adx': 22, 'rsi_period': 36, 'ema1': 17, 'ema2': 18, 'slip_atr_k': 0.04752816980826731, 'slip_spread_k': 0.6106412787511682, 'spread_hl_frac': 0.026609838555821542, 'bb_std_mult': 3.5803342260935827, 'rsi_os': 40, 'rsi_ob': 66, 'vol_spike': 0.06902359544914027, 'adx_thresh': 31.83394797201547, 'atr_min_pct': 0.008716467926106952, 'atr_max_pct': 0.06021358214456657, 'tp_mult': 2.043891389208762, 'tsl_mult': 0.7179315859466802, 'strategy': 'breakout', 'time_stop': 237, 'use_sma': True, 'use_atr': False, 'use_adx': False, 'use_ema': True, 'use_spike': True, 'rsi_required': True, 'edge_k': 0.6254678004897245, 'edge_cap': 0.6108760414931237, 'bull_strategy': 'mean_reversion', 'bull_bb_std_mult': 3.4853515400613615, 'bull_rsi_os': 39, 'bull_rsi_ob': 50, 'bull_adx_thresh': 6.313139815100899, 'bull_atr_min_pct': 0.019480681693135323, 'bull_atr_max_pct': 0.0881503274763193, 'bull_tp_mult': 2.7721839734537967, 'bull_tsl_mult': 0.39683977355652045, 'bull_time_stop': 203, 'bull_use_sma': True, 'bull_use_ema': False, 'bull_use_atr': True, 'bull_use_adx': False, 'bull_use_spike': False, 'bull_rsi_required': True, 'bear_strategy': 'mean_reversion', 'bear_bb_std_mult': 0.9809348452484881, 'bear_rsi_os': 9, 'bear_rsi_ob': 69, 'bear_adx_thresh': 30.745953162455564, 'bear_atr_min_pct': 0.005007782799829709, 'bear_atr_max_pct': 0.04346418939526906, 'bear_tp_mult': 1.3593200579205837, 'bear_tsl_mult': 0.04125360316176235, 'bear_time_stop': 279, 'bear_use_sma': True, 'bear_use_ema': False, 'bear_use_atr': True, 'bear_use_adx': False, 'bear_use_spike': False, 'bear_rsi_required': True, 'sideways_strategy': 'mean_reversion', 'sideways_bb_std_mult': 0.9652366073740928, 'sideways_rsi_os': 48, 'sideways_rsi_ob': 94, 'sideways_adx_thresh': 15.724872310369987, 'sideways_atr_min_pct': 0.007867571867372691, 'sideways_atr_max_pct': 0.07569224135795488, 'sideways_tp_mult': 2.5727228606647907, 'sideways_tsl_mult': 0.7226217296574675, 'sideways_time_stop': 31, 'sideways_use_sma': True, 'sideways_use_ema': False, 'sideways_use_atr': False, 'sideways_use_adx': True, 'sideways_use_spike': True, 'sideways_rsi_required': False}.
[I 2025-09-01 10:03:15,080] Trial 349 finished with values: [-1000000000.0, 1000000000.0] and parameters: {'p_sma': 17, 'p_std': 49, 'p_atr': 19, 'p_adx': 22, 'rsi_period': 71, 'ema1': 19, 'ema2': 15, 'slip_atr_k': 0.12316345584282468, 'slip_spread_k': 0.6926297929224828, 'spread_hl_frac': 0.02614224736113785, 'bb_std_mult': 1.4195455538041601, 'rsi_os': 43, 'rsi_ob': 68, 'vol_spike': 0.08288100307282247, 'adx_thresh': 14.016128081071592, 'atr_min_pct': 0.0050887345691581366, 'atr_max_pct': 0.1044419771573033, 'tp_mult': 1.1482471896900994, 'tsl_mult': 0.7199773910915801, 'strategy': 'mean_reversion', 'time_stop': 268, 'use_sma': False, 'use_atr': False, 'use_adx': False, 'use_ema': True, 'use_spike': False, 'rsi_required': True, 'edge_k': 1.943448872799062, 'edge_cap': 0.601099883177269, 'bull_strategy': 'mean_reversion', 'bull_bb_std_mult': 3.0987356644618944, 'bull_rsi_os': 45, 'bull_rsi_ob': 46, 'bull_adx_thresh': 26.699553873880443, 'bull_atr_min_pct': 0.005536058252114975, 'bull_atr_max_pct': 0.08689655299522552, 'bull_tp_mult': 2.761252941061046, 'bull_tsl_mult': 0.40682920719678567, 'bull_time_stop': 206, 'bull_use_sma': True, 'bull_use_ema': True, 'bull_use_atr': True, 'bull_use_adx': False, 'bull_use_spike': False, 'bull_rsi_required': True, 'bear_strategy': 'mean_reversion', 'bear_bb_std_mult': 3.5984900919647647, 'bear_rsi_os': 52, 'bear_rsi_ob': 85, 'bear_adx_thresh': 23.04927836949514, 'bear_atr_min_pct': 0.004690721891019859, 'bear_atr_max_pct': 0.04899407470934403, 'bear_tp_mult': 1.1086884437634126, 'bear_tsl_mult': 0.19830057184544725, 'bear_time_stop': 278, 'bear_use_sma': False, 'bear_use_ema': False, 'bear_use_atr': True, 'bear_use_adx': False, 'bear_use_spike': False, 'bear_rsi_required': True, 'sideways_strategy': 'mean_reversion', 'sideways_bb_std_mult': 1.2358072047090891, 'sideways_rsi_os': 53, 'sideways_rsi_ob': 94, 'sideways_adx_thresh': 23.71443827945814, 'sideways_atr_min_pct': 0.009838763920880048, 'sideways_atr_max_pct': 0.06015111202854138, 'sideways_tp_mult': 2.439952488109247, 'sideways_tsl_mult': 0.5177077619345353, 'sideways_time_stop': 8, 'sideways_use_sma': True, 'sideways_use_ema': False, 'sideways_use_atr': False, 'sideways_use_adx': True, 'sideways_use_spike': True, 'sideways_rsi_required': True}.
