[I 2025-09-01 09:54:45,265] Trial 299 finished with values: [-1000000000.0, 1000000000.0] and parameters: {'p_sma': 18, 'p_std': 55, 'p_atr': 17, 'p_adx': 25, 'rsi_period': 13, 'ema1': 17, 'ema2': 51, 'slip_atr_k': 0.07000948552086331, 'slip_spread_k': 0.4837691526877484, 'spread_hl_frac': 0.0006524003796724888, 'bb_std_mult': 2.4191751291161263, 'rsi_os': 49, 'rsi_ob': 84, 'vol_spike': 0.15165691257866518, 'adx_thresh': 5.8006908213210515, 'atr_min_pct': 0.0023368051585655122, 'atr_max_pct': 0.023495223054760705, 'tp_mult': 1.1467847174862085, 'tsl_mult': 0.7217457249813833, 'strategy': 'breakout', 'time_stop': 104, 'use_sma': True, 'use_atr': True, 'use_adx': False, 'use_ema': True, 'use_spike': False, 'rsi_required': False, 'edge_k': 0.5263735852164837, 'edge_cap': 0.2081740629293976, 'bull_strategy': 'mean_reversion', 'bull_bb_std_mult': 3.5951787255341663, 'bull_rsi_os': 48, 'bull_rsi_ob': 46, 'bull_adx_thresh': 5.680480867599244, 'bull_atr_min_pct': 0.0032242653510874807, 'bull_atr_max_pct': 0.11397886276551678, 'bull_tp_mult': 2.5387601242679994, 'bull_tsl_mult': 0.3921402931201217, 'bull_time_stop': 216, 'bull_use_sma': True, 'bull_use_ema': False, 'bull_use_atr': True, 'bull_use_adx': True, 'bull_use_spike': True, 'bull_rsi_required': False, 'bear_strategy': 'breakout', 'bear_bb_std_mult': 1.0399478963480047, 'bear_rsi_os': 28, 'bear_rsi_ob': 58, 'bear_adx_thresh': 33.95602136539666, 'bear_atr_min_pct': 0.007217247588634994, 'bear_atr_max_pct': 0.04811853168936479, 'bear_tp_mult': 1.2491118832350507, 'bear_tsl_mult': 0.45870361696385153, 'bear_time_stop': 284, 'bear_use_sma': True, 'bear_use_ema': False, 'bear_use_atr': False, 'bear_use_adx': False, 'bear_use_spike': False, 'bear_rsi_required': False, 'sideways_strategy': 'mean_reversion', 'sideways_bb_std_mult': 1.20196100977113, 'sideways_rsi_os': 24, 'sideways_rsi_ob': 52, 'sideways_adx_thresh': 20.481850798752525, 'sideways_atr_min_pct': 0.016668759292858843, 'sideways_atr_max_pct': 0.06944576043801531, 'sideways_tp_mult': 2.3326445212590796, 'sideways_tsl_mult': 0.2294048902347875, 'sideways_time_stop': 47, 'sideways_use_sma': True, 'sideways_use_ema': False, 'sideways_use_atr': True, 'sideways_use_adx': False, 'sideways_use_spike': False, 'sideways_rsi_required': True}.
[I 2025-09-01 09:54:46,109] Trial 300 finished with values: [-0.03052517706316682, 0.030338908327762877] and parameters: {'p_sma': 55, 'p_std': 51, 'p_atr': 17, 'p_adx': 25, 'rsi_period': 30, 'ema1': 17, 'ema2': 34, 'slip_atr_k': 0.22649096441579653, 'slip_spread_k': 0.48707578109133964, 'spread_hl_frac': 0.0005239126874585914, 'bb_std_mult': 1.3838030173742044, 'rsi_os': 10, 'rsi_ob': 60, 'vol_spike': 0.12346908500189026, 'adx_thresh': 27.76924151099552, 'atr_min_pct': 0.018276293363736488, 'atr_max_pct': 0.12686515158061798, 'tp_mult': 1.1446908458448437, 'tsl_mult': 0.7118034998742417, 'strategy': 'breakout', 'time_stop': 248, 'use_sma': True, 'use_atr': True, 'use_adx': False, 'use_ema': True, 'use_spike': False, 'rsi_required': False, 'edge_k': 0.5140943993841545, 'edge_cap': 0.19730761441253108, 'bull_strategy': 'mean_reversion', 'bull_bb_std_mult': 3.5967248589138023, 'bull_rsi_os': 44, 'bull_rsi_ob': 50, 'bull_adx_thresh': 29.44005394647946, 'bull_atr_min_pct': 0.0012135665149541758, 'bull_atr_max_pct': 0.048452116929654704, 'bull_tp_mult': 2.716073313864167, 'bull_tsl_mult': 0.40188388273335796, 'bull_time_stop': 215, 'bull_use_sma': True, 'bull_use_ema': False, 'bull_use_atr': True, 'bull_use_adx': True, 'bull_use_spike': True, 'bull_rsi_required': False, 'bear_strategy': 'breakout', 'bear_bb_std_mult': 1.0122975773652296, 'bear_rsi_os': 55, 'bear_rsi_ob': 71, 'bear_adx_thresh': 23.240978454828735, 'bear_atr_min_pct': 0.018128837878479367, 'bear_atr_max_pct': 0.13221452106346424, 'bear_tp_mult': 1.236658249549114, 'bear_tsl_mult': 0.4631461862388411, 'bear_time_stop': 100, 'bear_use_sma': True, 'bear_use_ema': False, 'bear_use_atr': False, 'bear_use_adx': False, 'bear_use_spike': False, 'bear_rsi_required': False, 'sideways_strategy': 'mean_reversion', 'sideways_bb_std_mult': 2.008101419738109, 'sideways_rsi_os': 24, 'sideways_rsi_ob': 93, 'sideways_adx_thresh': 20.39861063346896, 'sideways_atr_min_pct': 0.011228848184828513, 'sideways_atr_max_pct': 0.08963248822694778, 'sideways_tp_mult': 1.062172554426136, 'sideways_tsl_mult': 0.4457438298413023, 'sideways_time_stop': 198, 'sideways_use_sma': True, 'sideways_use_ema': False, 'sideways_use_atr': True, 'sideways_use_adx': False, 'sideways_use_spike': False, 'sideways_rsi_required': True}.
[I 2025-09-01 09:54:46,736] Trial 298 finished with values: [-1000000000.0, 1000000000.0] and parameters: {'p_sma': 19, 'p_std': 52, 'p_atr': 17, 'p_adx': 11, 'rsi_period': 30, 'ema1': 18, 'ema2': 16, 'slip_atr_k': 0.05956631803926077, 'slip_spread_k': 0.7316655199273672, 'spread_hl_frac': 0.022613881552619255, 'bb_std_mult': 0.5039624262826199, 'rsi_os': 10, 'rsi_ob': 91, 'vol_spike': 0.04938566492662934, 'adx_thresh': 30.868412969182234, 'atr_min_pct': 0.018302311748733993, 'atr_max_pct': 0.13012935758881639, 'tp_mult': 1.8431281287717682, 'tsl_mult': 0.7218868993479167, 'strategy': 'breakout', 'time_stop': 232, 'use_sma': True, 'use_atr': False, 'use_adx': False, 'use_ema': True, 'use_spike': True, 'rsi_required': False, 'edge_k': 1.2608377920740996, 'edge_cap': 0.19866881388426255, 'bull_strategy': 'mean_reversion', 'bull_bb_std_mult': 3.5462105109420636, 'bull_rsi_os': 46, 'bull_rsi_ob': 50, 'bull_adx_thresh': 19.61319208359646, 'bull_atr_min_pct': 0.024570790447056304, 'bull_atr_max_pct': 0.09213329531261358, 'bull_tp_mult': 2.464945435905501, 'bull_tsl_mult': 0.7947259277002151, 'bull_time_stop': 215, 'bull_use_sma': True, 'bull_use_ema': False, 'bull_use_atr': True, 'bull_use_adx': False, 'bull_use_spike': True, 'bull_rsi_required': False, 'bear_strategy': 'breakout', 'bear_bb_std_mult': 1.0386668215585015, 'bear_rsi_os': 54, 'bear_rsi_ob': 71, 'bear_adx_thresh': 33.99930871701007, 'bear_atr_min_pct': 0.005092808575045292, 'bear_atr_max_pct': 0.13069475298537953, 'bear_tp_mult': 1.2481734542301355, 'bear_tsl_mult': 0.602305822245524, 'bear_time_stop': 189, 'bear_use_sma': True, 'bear_use_ema': False, 'bear_use_atr': True, 'bear_use_adx': False, 'bear_use_spike': False, 'bear_rsi_required': False, 'sideways_strategy': 'mean_reversion', 'sideways_bb_std_mult': 1.0666767045751955, 'sideways_rsi_os': 32, 'sideways_rsi_ob': 91, 'sideways_adx_thresh': 34.27391722709168, 'sideways_atr_min_pct': 0.011424050830519523, 'sideways_atr_max_pct': 0.07725130863926365, 'sideways_tp_mult': 2.3372615667520553, 'sideways_tsl_mult': 0.5340454442834003, 'sideways_time_stop': 272, 'sideways_use_sma': True, 'sideways_use_ema': False, 'sideways_use_atr': True, 'sideways_use_adx': False, 'sideways_use_spike': True, 'sideways_rsi_required': False}.
[I 2025-09-01 09:54:47,266] Trial 297 finished with values: [-1000000000.0, 1000000000.0] and parameters: {'p_sma': 19, 'p_std': 45, 'p_atr': 17, 'p_adx': 26, 'rsi_period': 29, 'ema1': 18, 'ema2': 17, 'slip_atr_k': 0.05492761279927094, 'slip_spread_k': 0.32253688435863703, 'spread_hl_frac': 0.04993968933822132, 'bb_std_mult': 2.4121428829410214, 'rsi_os': 50, 'rsi_ob': 45, 'vol_spike': 0.0771967042752032, 'adx_thresh': 30.71183282758519, 'atr_min_pct': 0.018289495461569875, 'atr_max_pct': 0.10954531241920867, 'tp_mult': 2.506851449975483, 'tsl_mult': 0.13373457226196778, 'strategy': 'breakout', 'time_stop': 232, 'use_sma': True, 'use_atr': False, 'use_adx': False, 'use_ema': True, 'use_spike': True, 'rsi_required': True, 'edge_k': 0.34320989477923647, 'edge_cap': 0.5215129115120836, 'bull_strategy': 'mean_reversion', 'bull_bb_std_mult': 3.592798355082814, 'bull_rsi_os': 46, 'bull_rsi_ob': 69, 'bull_adx_thresh': 5.501828200639688, 'bull_atr_min_pct': 0.025953416451637144, 'bull_atr_max_pct': 0.09235224309940623, 'bull_tp_mult': 2.8364168514413466, 'bull_tsl_mult': 0.7904140079434031, 'bull_time_stop': 185, 'bull_use_sma': True, 'bull_use_ema': False, 'bull_use_atr': True, 'bull_use_adx': False, 'bull_use_spike': True, 'bull_rsi_required': True, 'bear_strategy': 'breakout', 'bear_bb_std_mult': 2.399535076802186, 'bear_rsi_os': 53, 'bear_rsi_ob': 86, 'bear_adx_thresh': 21.3128508474708, 'bear_atr_min_pct': 0.018094194450699142, 'bear_atr_max_pct': 0.0829412513682703, 'bear_tp_mult': 1.1282982308577951, 'bear_tsl_mult': 0.5624493325696802, 'bear_time_stop': 290, 'bear_use_sma': True, 'bear_use_ema': False, 'bear_use_atr': True, 'bear_use_adx': False, 'bear_use_spike': False, 'bear_rsi_required': False, 'sideways_strategy': 'mean_reversion', 'sideways_bb_std_mult': 1.0694471928833351, 'sideways_rsi_os': 34, 'sideways_rsi_ob': 91, 'sideways_adx_thresh': 16.33489750990286, 'sideways_atr_min_pct': 0.0115356840821838, 'sideways_atr_max_pct': 0.07714977853737705, 'sideways_tp_mult': 1.0786311929153638, 'sideways_tsl_mult': 0.2271143273452932, 'sideways_time_stop': 272, 'sideways_use_sma': True, 'sideways_use_ema': False, 'sideways_use_atr': False, 'sideways_use_adx': True, 'sideways_use_spike': True, 'sideways_rsi_required': False}.
[I 2025-09-01 09:55:33,819] Trial 302 finished with values: [-1000000000.0, 1000000000.0] and parameters: {'p_sma': 53, 'p_std': 50, 'p_atr': 23, 'p_adx': 11, 'rsi_period': 15, 'ema1': 18, 'ema2': 55, 'slip_atr_k': 0.05922258847012338, 'slip_spread_k': 0.6701076832388216, 'spread_hl_frac': 0.03731746795796281, 'bb_std_mult': 3.4550689219233863, 'rsi_os': 42, 'rsi_ob': 54, 'vol_spike': 0.0488110284868383, 'adx_thresh': 22.74941978497241, 'atr_min_pct': 0.012542452656768302, 'atr_max_pct': 0.13098881407040736, 'tp_mult': 2.7833179151623337, 'tsl_mult': 0.7551580550265418, 'strategy': 'breakout', 'time_stop': 234, 'use_sma': True, 'use_atr': False, 'use_adx': True, 'use_ema': False, 'use_spike': True, 'rsi_required': True, 'edge_k': 1.8777688994433475, 'edge_cap': 0.5850448458086915, 'bull_strategy': 'mean_reversion', 'bull_bb_std_mult': 3.50897470949128, 'bull_rsi_os': 47, 'bull_rsi_ob': 87, 'bull_adx_thresh': 8.497567345960952, 'bull_atr_min_pct': 0.024929414930188652, 'bull_atr_max_pct': 0.09266021951493335, 'bull_tp_mult': 1.789896474154098, 'bull_tsl_mult': 0.016770915137834408, 'bull_time_stop': 188, 'bull_use_sma': False, 'bull_use_ema': False, 'bull_use_atr': True, 'bull_use_adx': False, 'bull_use_spike': False, 'bull_rsi_required': True, 'bear_strategy': 'mean_reversion', 'bear_bb_std_mult': 0.8148685075330875, 'bear_rsi_os': 53, 'bear_rsi_ob': 51, 'bear_adx_thresh': 18.903302868401834, 'bear_atr_min_pct': 0.017197781414217236, 'bear_atr_max_pct': 0.0528292477799248, 'bear_tp_mult': 1.9221847073348597, 'bear_tsl_mult': 0.25186450365566815, 'bear_time_stop': 295, 'bear_use_sma': True, 'bear_use_ema': False, 'bear_use_atr': True, 'bear_use_adx': False, 'bear_use_spike': True, 'bear_rsi_required': False, 'sideways_strategy': 'mean_reversion', 'sideways_bb_std_mult': 0.721974069819166, 'sideways_rsi_os': 51, 'sideways_rsi_ob': 66, 'sideways_adx_thresh': 24.39143013747253, 'sideways_atr_min_pct': 0.010672045629262139, 'sideways_atr_max_pct': 0.07291710907060402, 'sideways_tp_mult': 2.4918467009193397, 'sideways_tsl_mult': 0.4595126800387936, 'sideways_time_stop': 189, 'sideways_use_sma': True, 'sideways_use_ema': True, 'sideways_use_atr': False, 'sideways_use_adx': True, 'sideways_use_spike': False, 'sideways_rsi_required': False}.
[I 2025-09-01 09:55:34,632] Trial 303 finished with values: [-1000000000.0, 1000000000.0] and parameters: {'p_sma': 15, 'p_std': 49, 'p_atr': 19, 'p_adx': 26, 'rsi_period': 15, 'ema1': 19, 'ema2': 55, 'slip_atr_k': 0.054151921556445166, 'slip_spread_k': 0.9946601295954717, 'spread_hl_frac': 0.029724242973999806, 'bb_std_mult': 1.6565447421592772, 'rsi_os': 5, 'rsi_ob': 93, 'vol_spike': 0.09085875652940154, 'adx_thresh': 31.825299031961308, 'atr_min_pct': 0.0015522299908513146, 'atr_max_pct': 0.1082087833067856, 'tp_mult': 2.7794117838798447, 'tsl_mult': 0.9412871558411438, 'strategy': 'breakout', 'time_stop': 166, 'use_sma': True, 'use_atr': False, 'use_adx': True, 'use_ema': False, 'use_spike': True, 'rsi_required': True, 'edge_k': 1.1879677513912539, 'edge_cap': 0.5939829708183176, 'bull_strategy': 'mean_reversion', 'bull_bb_std_mult': 1.821425459616552, 'bull_rsi_os': 47, 'bull_rsi_ob': 48, 'bull_adx_thresh': 6.910860004225585, 'bull_atr_min_pct': 0.012371677516789394, 'bull_atr_max_pct': 0.08664966481306986, 'bull_tp_mult': 2.9082563532870145, 'bull_tsl_mult': 0.4479465667851296, 'bull_time_stop': 197, 'bull_use_sma': False, 'bull_use_ema': False, 'bull_use_atr': True, 'bull_use_adx': False, 'bull_use_spike': False, 'bull_rsi_required': True, 'bear_strategy': 'mean_reversion', 'bear_bb_std_mult': 2.7141651932438693, 'bear_rsi_os': 55, 'bear_rsi_ob': 81, 'bear_adx_thresh': 18.810616258629494, 'bear_atr_min_pct': 0.0061898829975001205, 'bear_atr_max_pct': 0.029902219085394047, 'bear_tp_mult': 1.1253117847900176, 'bear_tsl_mult': 0.49095087789264574, 'bear_time_stop': 143, 'bear_use_sma': False, 'bear_use_ema': False, 'bear_use_atr': True, 'bear_use_adx': True, 'bear_use_spike': True, 'bear_rsi_required': True, 'sideways_strategy': 'breakout', 'sideways_bb_std_mult': 0.6967780286082977, 'sideways_rsi_os': 51, 'sideways_rsi_ob': 90, 'sideways_adx_thresh': 24.122091650685235, 'sideways_atr_min_pct': 0.0260388910071441, 'sideways_atr_max_pct': 0.1328506649114969, 'sideways_tp_mult': 2.4870854478930045, 'sideways_tsl_mult': 0.457281125937322, 'sideways_time_stop': 35, 'sideways_use_sma': True, 'sideways_use_ema': True, 'sideways_use_atr': False, 'sideways_use_adx': True, 'sideways_use_spike': False, 'sideways_rsi_required': False}.
[I 2025-09-01 09:55:35,143] Trial 304 finished with values: [-1000000000.0, 1000000000.0] and parameters: {'p_sma': 42, 'p_std': 49, 'p_atr': 27, 'p_adx': 15, 'rsi_period': 7, 'ema1': 19, 'ema2': 57, 'slip_atr_k': 0.037268352253391555, 'slip_spread_k': 0.5590061976132041, 'spread_hl_frac': 0.008534857215329952, 'bb_std_mult': 2.825816315915061, 'rsi_os': 40, 'rsi_ob': 95, 'vol_spike': 0.08654286393017634, 'adx_thresh': 31.93487308737014, 'atr_min_pct': 0.0013289020192246686, 'atr_max_pct': 0.14028171041392706, 'tp_mult': 1.1051970020124244, 'tsl_mult': 0.9602999212142013, 'strategy': 'breakout', 'time_stop': 258, 'use_sma': True, 'use_atr': False, 'use_adx': True, 'use_ema': False, 'use_spike': True, 'rsi_required': True, 'edge_k': 1.2019200301425874, 'edge_cap': 0.5810915521093767, 'bull_strategy': 'mean_reversion', 'bull_bb_std_mult': 3.5078815537744488, 'bull_rsi_os': 47, 'bull_rsi_ob': 48, 'bull_adx_thresh': 7.194517273576345, 'bull_atr_min_pct': 0.022740101043153726, 'bull_atr_max_pct': 0.14538710421738144, 'bull_tp_mult': 2.903301997856366, 'bull_tsl_mult': 0.4449822841943905, 'bull_time_stop': 195, 'bull_use_sma': False, 'bull_use_ema': False, 'bull_use_atr': False, 'bull_use_adx': False, 'bull_use_spike': False, 'bull_rsi_required': True, 'bear_strategy': 'mean_reversion', 'bear_bb_std_mult': 2.6844711165197355, 'bear_rsi_os': 38, 'bear_rsi_ob': 55, 'bear_adx_thresh': 11.22976461603036, 'bear_atr_min_pct': 0.006092567925740573, 'bear_atr_max_pct': 0.0296458727322502, 'bear_tp_mult': 1.916666256586909, 'bear_tsl_mult': 0.7065043717200865, 'bear_time_stop': 300, 'bear_use_sma': False, 'bear_use_ema': False, 'bear_use_atr': True, 'bear_use_adx': True, 'bear_use_spike': True, 'bear_rsi_required': True, 'sideways_strategy': 'breakout', 'sideways_bb_std_mult': 0.7160778675972657, 'sideways_rsi_os': 51, 'sideways_rsi_ob': 59, 'sideways_adx_thresh': 24.104616651913318, 'sideways_atr_min_pct': 0.010471478028024906, 'sideways_atr_max_pct': 0.07197307169258264, 'sideways_tp_mult': 2.481828872107041, 'sideways_tsl_mult': 0.4526520955140571, 'sideways_time_stop': 256, 'sideways_use_sma': False, 'sideways_use_ema': True, 'sideways_use_atr': False, 'sideways_use_adx': True, 'sideways_use_spike': False, 'sideways_rsi_required': False}.
[I 2025-09-01 09:55:35,447] Trial 301 finished with values: [-1000000000.0, 1000000000.0] and parameters: {'p_sma': 15, 'p_std': 50, 'p_atr': 27, 'p_adx': 26, 'rsi_period': 14, 'ema1': 18, 'ema2': 36, 'slip_atr_k': 0.08130576157663108, 'slip_spread_k': 0.6690764468067604, 'spread_hl_frac': 0.030052587146280604, 'bb_std_mult': 0.9772292975892387, 'rsi_os': 40, 'rsi_ob': 47, 'vol_spike': 0.0867381985754655, 'adx_thresh': 32.01174548781496, 'atr_min_pct': 0.0016456787994190043, 'atr_max_pct': 0.09928145130884905, 'tp_mult': 1.0823181599971903, 'tsl_mult': 0.7654102432230658, 'strategy': 'breakout', 'time_stop': 234, 'use_sma': True, 'use_atr': False, 'use_adx': False, 'use_ema': False, 'use_spike': True, 'rsi_required': False, 'edge_k': 1.5807567496464046, 'edge_cap': 0.5928930720253556, 'bull_strategy': 'mean_reversion', 'bull_bb_std_mult': 3.515815180254606, 'bull_rsi_os': 44, 'bull_rsi_ob': 50, 'bull_adx_thresh': 29.16231862365916, 'bull_atr_min_pct': 0.01484161885860242, 'bull_atr_max_pct': 0.1458519061883607, 'bull_tp_mult': 2.9122905370667587, 'bull_tsl_mult': 0.41314502439972667, 'bull_time_stop': 194, 'bull_use_sma': False, 'bull_use_ema': False, 'bull_use_atr': True, 'bull_use_adx': False, 'bull_use_spike': False, 'bull_rsi_required': False, 'bear_strategy': 'breakout', 'bear_bb_std_mult': 2.7018857220428107, 'bear_rsi_os': 55, 'bear_rsi_ob': 55, 'bear_adx_thresh': 22.08596087581508, 'bear_atr_min_pct': 0.01749346800431266, 'bear_atr_max_pct': 0.13241718799199684, 'bear_tp_mult': 1.9098114519683842, 'bear_tsl_mult': 0.250577545699736, 'bear_time_stop': 300, 'bear_use_sma': True, 'bear_use_ema': False, 'bear_use_atr': True, 'bear_use_adx': False, 'bear_use_spike': False, 'bear_rsi_required': False, 'sideways_strategy': 'mean_reversion', 'sideways_bb_std_mult': 1.8045175300796357, 'sideways_rsi_os': 51, 'sideways_rsi_ob': 90, 'sideways_adx_thresh': 24.23138057839409, 'sideways_atr_min_pct': 0.011126275819925204, 'sideways_atr_max_pct': 0.12243632605698596, 'sideways_tp_mult': 2.4992381912672212, 'sideways_tsl_mult': 0.4440078518306649, 'sideways_time_stop': 37, 'sideways_use_sma': True, 'sideways_use_ema': True, 'sideways_use_atr': True, 'sideways_use_adx': False, 'sideways_use_spike': False, 'sideways_rsi_required': False}.
[I 2025-09-01 09:56:17,331] Trial 306 finished with values: [-1000000000.0, 1000000000.0] and parameters: {'p_sma': 42, 'p_std': 42, 'p_atr': 18, 'p_adx': 23, 'rsi_period': 35, 'ema1': 13, 'ema2': 18, 'slip_atr_k': 0.13673127505447166, 'slip_spread_k': 0.5538404451067661, 'spread_hl_frac': 0.03131649143875382, 'bb_std_mult': 2.81833851884668, 'rsi_os': 39, 'rsi_ob': 71, 'vol_spike': 0.09616420285645619, 'adx_thresh': 33.15377756340468, 'atr_min_pct': 0.010694486024987923, 'atr_max_pct': 0.1396985482929545, 'tp_mult': 1.0814593189921031, 'tsl_mult': 0.7374988290813502, 'strategy': 'breakout', 'time_stop': 261, 'use_sma': True, 'use_atr': False, 'use_adx': False, 'use_ema': True, 'use_spike': True, 'rsi_required': True, 'edge_k': 0.7476140854140545, 'edge_cap': 0.550206554905884, 'bull_strategy': 'mean_reversion', 'bull_bb_std_mult': 1.063826580155026, 'bull_rsi_os': 55, 'bull_rsi_ob': 79, 'bull_adx_thresh': 6.141941686600335, 'bull_atr_min_pct': 0.022277660685800053, 'bull_atr_max_pct': 0.1466088573973387, 'bull_tp_mult': 2.5846629323473547, 'bull_tsl_mult': 0.8373986141069498, 'bull_time_stop': 231, 'bull_use_sma': True, 'bull_use_ema': False, 'bull_use_atr': False, 'bull_use_adx': False, 'bull_use_spike': False, 'bull_rsi_required': True, 'bear_strategy': 'mean_reversion', 'bear_bb_std_mult': 0.9552816309088945, 'bear_rsi_os': 55, 'bear_rsi_ob': 62, 'bear_adx_thresh': 22.384306335528454, 'bear_atr_min_pct': 0.008494244034298534, 'bear_atr_max_pct': 0.0672903823709119, 'bear_tp_mult': 1.2990160887845148, 'bear_tsl_mult': 0.3129747142191889, 'bear_time_stop': 132, 'bear_use_sma': False, 'bear_use_ema': False, 'bear_use_atr': True, 'bear_use_adx': False, 'bear_use_spike': False, 'bear_rsi_required': True, 'sideways_strategy': 'mean_reversion', 'sideways_bb_std_mult': 2.2102644264109577, 'sideways_rsi_os': 10, 'sideways_rsi_ob': 92, 'sideways_adx_thresh': 13.516004931864877, 'sideways_atr_min_pct': 0.009377795915927217, 'sideways_atr_max_pct': 0.06947926351679266, 'sideways_tp_mult': 2.3896492899710684, 'sideways_tsl_mult': 0.5087979488113145, 'sideways_time_stop': 151, 'sideways_use_sma': False, 'sideways_use_ema': False, 'sideways_use_atr': False, 'sideways_use_adx': True, 'sideways_use_spike': False, 'sideways_rsi_required': False}.
