[I 2025-09-01 09:38:23,148] Trial 201 finished with values: [-1000000000.0, 1000000000.0] and parameters: {'p_sma': 18, 'p_std': 42, 'p_atr': 19, 'p_adx': 17, 'rsi_period': 60, 'ema1': 17, 'ema2': 56, 'slip_atr_k': 0.17997231866011595, 'slip_spread_k': 0.6650708966137745, 'spread_hl_frac': 0.03166281816455612, 'bb_std_mult': 3.1863917442151153, 'rsi_os': 6, 'rsi_ob': 68, 'vol_spike': 0.07351190126768625, 'adx_thresh': 20.01658973181846, 'atr_min_pct': 0.009541325328105497, 'atr_max_pct': 0.07550989368267436, 'tp_mult': 1.0115836624751775, 'tsl_mult': 0.38183401857363525, 'strategy': 'breakout', 'time_stop': 64, 'use_sma': True, 'use_atr': False, 'use_adx': False, 'use_ema': True, 'use_spike': True, 'rsi_required': True, 'edge_k': 1.7530374201775945, 'edge_cap': 0.8255364143527866, 'bull_strategy': 'breakout', 'bull_bb_std_mult': 0.634288683065793, 'bull_rsi_os': 51, 'bull_rsi_ob': 45, 'bull_adx_thresh': 10.6652877760575, 'bull_atr_min_pct': 0.02153559732277244, 'bull_atr_max_pct': 0.08664698635045145, 'bull_tp_mult': 1.7751352851734408, 'bull_tsl_mult': 0.8181967306140713, 'bull_time_stop': 265, 'bull_use_sma': True, 'bull_use_ema': False, 'bull_use_atr': True, 'bull_use_adx': False, 'bull_use_spike': False, 'bull_rsi_required': True, 'bear_strategy': 'breakout', 'bear_bb_std_mult': 1.9311043578259242, 'bear_rsi_os': 8, 'bear_rsi_ob': 83, 'bear_adx_thresh': 19.44355724588398, 'bear_atr_min_pct': 0.02735174687728437, 'bear_atr_max_pct': 0.021658240273083475, 'bear_tp_mult': 1.1325190592431844, 'bear_tsl_mult': 0.5456994961513777, 'bear_time_stop': 294, 'bear_use_sma': True, 'bear_use_ema': True, 'bear_use_atr': True, 'bear_use_adx': False, 'bear_use_spike': False, 'bear_rsi_required': False, 'sideways_strategy': 'mean_reversion', 'sideways_bb_std_mult': 1.424098338570914, 'sideways_rsi_os': 15, 'sideways_rsi_ob': 92, 'sideways_adx_thresh': 28.077237198553018, 'sideways_atr_min_pct': 0.022621148786511818, 'sideways_atr_max_pct': 0.06877082136374373, 'sideways_tp_mult': 2.05618787737596, 'sideways_tsl_mult': 0.06806195598638953, 'sideways_time_stop': 156, 'sideways_use_sma': True, 'sideways_use_ema': False, 'sideways_use_atr': False, 'sideways_use_adx': True, 'sideways_use_spike': False, 'sideways_rsi_required': True}.
[I 2025-09-01 09:38:23,559] Trial 200 finished with values: [-1000000000.0, 1000000000.0] and parameters: {'p_sma': 18, 'p_std': 49, 'p_atr': 19, 'p_adx': 17, 'rsi_period': 27, 'ema1': 15, 'ema2': 53, 'slip_atr_k': 0.24996881567668094, 'slip_spread_k': 0.02698780150834379, 'spread_hl_frac': 0.03166470163439509, 'bb_std_mult': 1.1829978668320353, 'rsi_os': 6, 'rsi_ob': 83, 'vol_spike': 0.29306570529574294, 'adx_thresh': 31.712924821206762, 'atr_min_pct': 0.028817200206407805, 'atr_max_pct': 0.07532301098407677, 'tp_mult': 1.1342973458949464, 'tsl_mult': 0.37912348582435523, 'strategy': 'breakout', 'time_stop': 66, 'use_sma': True, 'use_atr': False, 'use_adx': False, 'use_ema': True, 'use_spike': True, 'rsi_required': True, 'edge_k': 1.1174017257904287, 'edge_cap': 0.8166875846838125, 'bull_strategy': 'breakout', 'bull_bb_std_mult': 2.451813051955178, 'bull_rsi_os': 48, 'bull_rsi_ob': 60, 'bull_adx_thresh': 10.719823507556471, 'bull_atr_min_pct': 0.004591109221727278, 'bull_atr_max_pct': 0.08256218796270125, 'bull_tp_mult': 2.8789536737033745, 'bull_tsl_mult': 0.8181769249204771, 'bull_time_stop': 267, 'bull_use_sma': True, 'bull_use_ema': False, 'bull_use_atr': True, 'bull_use_adx': False, 'bull_use_spike': False, 'bull_rsi_required': True, 'bear_strategy': 'breakout', 'bear_bb_std_mult': 1.9272826471554718, 'bear_rsi_os': 54, 'bear_rsi_ob': 59, 'bear_adx_thresh': 22.917836588144706, 'bear_atr_min_pct': 0.02707686160415944, 'bear_atr_max_pct': 0.017338847971296367, 'bear_tp_mult': 2.0289480857735924, 'bear_tsl_mult': 0.5006932550726408, 'bear_time_stop': 150, 'bear_use_sma': True, 'bear_use_ema': True, 'bear_use_atr': True, 'bear_use_adx': False, 'bear_use_spike': False, 'bear_rsi_required': False, 'sideways_strategy': 'mean_reversion', 'sideways_bb_std_mult': 0.7203843223000911, 'sideways_rsi_os': 15, 'sideways_rsi_ob': 92, 'sideways_adx_thresh': 32.60203936864156, 'sideways_atr_min_pct': 0.024118387127584434, 'sideways_atr_max_pct': 0.06966201952499293, 'sideways_tp_mult': 2.0610036934393943, 'sideways_tsl_mult': 0.3882727868977538, 'sideways_time_stop': 26, 'sideways_use_sma': True, 'sideways_use_ema': False, 'sideways_use_atr': False, 'sideways_use_adx': True, 'sideways_use_spike': False, 'sideways_rsi_required': False}.
[I 2025-09-01 09:38:24,262] Trial 199 finished with values: [-1000000000.0, 1000000000.0] and parameters: {'p_sma': 22, 'p_std': 43, 'p_atr': 19, 'p_adx': 17, 'rsi_period': 48, 'ema1': 30, 'ema2': 18, 'slip_atr_k': 0.04720484171020185, 'slip_spread_k': 0.6623195321539382, 'spread_hl_frac': 0.03081980296099642, 'bb_std_mult': 1.4535434233060875, 'rsi_os': 39, 'rsi_ob': 69, 'vol_spike': 0.07369455214406512, 'adx_thresh': 18.1144822178691, 'atr_min_pct': 0.009530533481561111, 'atr_max_pct': 0.07422960657368302, 'tp_mult': 2.8262071623935237, 'tsl_mult': 0.5064629097527181, 'strategy': 'breakout', 'time_stop': 68, 'use_sma': True, 'use_atr': False, 'use_adx': False, 'use_ema': True, 'use_spike': True, 'rsi_required': True, 'edge_k': 1.7854150552847385, 'edge_cap': 0.8013487416100532, 'bull_strategy': 'breakout', 'bull_bb_std_mult': 3.319312921879368, 'bull_rsi_os': 47, 'bull_rsi_ob': 77, 'bull_adx_thresh': 10.762981066197414, 'bull_atr_min_pct': 0.021545657366421903, 'bull_atr_max_pct': 0.051276013003358045, 'bull_tp_mult': 1.777152125726373, 'bull_tsl_mult': 0.9688136668079221, 'bull_time_stop': 27, 'bull_use_sma': True, 'bull_use_ema': False, 'bull_use_atr': True, 'bull_use_adx': False, 'bull_use_spike': False, 'bull_rsi_required': True, 'bear_strategy': 'breakout', 'bear_bb_std_mult': 2.780762023569636, 'bear_rsi_os': 55, 'bear_rsi_ob': 83, 'bear_adx_thresh': 22.977451414345918, 'bear_atr_min_pct': 0.027207747863815177, 'bear_atr_max_pct': 0.07096668346768176, 'bear_tp_mult': 2.03085494514246, 'bear_tsl_mult': 0.5098025490358274, 'bear_time_stop': 294, 'bear_use_sma': True, 'bear_use_ema': True, 'bear_use_atr': True, 'bear_use_adx': False, 'bear_use_spike': False, 'bear_rsi_required': False, 'sideways_strategy': 'mean_reversion', 'sideways_bb_std_mult': 0.9101797458968477, 'sideways_rsi_os': 53, 'sideways_rsi_ob': 92, 'sideways_adx_thresh': 27.56544057228826, 'sideways_atr_min_pct': 0.022036161056239168, 'sideways_atr_max_pct': 0.07616503028244476, 'sideways_tp_mult': 2.05600349347925, 'sideways_tsl_mult': 0.38452266523636025, 'sideways_time_stop': 158, 'sideways_use_sma': True, 'sideways_use_ema': False, 'sideways_use_atr': False, 'sideways_use_adx': True, 'sideways_use_spike': True, 'sideways_rsi_required': False}.
[I 2025-09-01 09:38:24,480] Trial 198 finished with values: [-1000000000.0, 1000000000.0] and parameters: {'p_sma': 18, 'p_std': 42, 'p_atr': 21, 'p_adx': 17, 'rsi_period': 9, 'ema1': 15, 'ema2': 56, 'slip_atr_k': 0.04718228096081247, 'slip_spread_k': 0.6589677641494722, 'spread_hl_frac': 0.03200349803257459, 'bb_std_mult': 1.4264896869453432, 'rsi_os': 36, 'rsi_ob': 69, 'vol_spike': 0.04305887834772844, 'adx_thresh': 24.46920294825772, 'atr_min_pct': 0.028816384359645696, 'atr_max_pct': 0.07471809245513818, 'tp_mult': 2.819383495139916, 'tsl_mult': 0.9970472767629893, 'strategy': 'breakout', 'time_stop': 119, 'use_sma': True, 'use_atr': False, 'use_adx': False, 'use_ema': True, 'use_spike': True, 'rsi_required': True, 'edge_k': 1.7482263850070034, 'edge_cap': 0.7920823222765598, 'bull_strategy': 'breakout', 'bull_bb_std_mult': 3.30758506328882, 'bull_rsi_os': 47, 'bull_rsi_ob': 47, 'bull_adx_thresh': 5.467578667562119, 'bull_atr_min_pct': 0.01516026711540042, 'bull_atr_max_pct': 0.1026008985386349, 'bull_tp_mult': 2.195806327760689, 'bull_tsl_mult': 0.7398190777612317, 'bull_time_stop': 239, 'bull_use_sma': True, 'bull_use_ema': False, 'bull_use_atr': True, 'bull_use_adx': False, 'bull_use_spike': False, 'bull_rsi_required': True, 'bear_strategy': 'breakout', 'bear_bb_std_mult': 1.9834711209930427, 'bear_rsi_os': 55, 'bear_rsi_ob': 95, 'bear_adx_thresh': 19.51704122004853, 'bear_atr_min_pct': 0.02728087781192732, 'bear_atr_max_pct': 0.07104092972483689, 'bear_tp_mult': 2.3339515735286147, 'bear_tsl_mult': 0.3022756541484647, 'bear_time_stop': 146, 'bear_use_sma': True, 'bear_use_ema': True, 'bear_use_atr': True, 'bear_use_adx': False, 'bear_use_spike': False, 'bear_rsi_required': False, 'sideways_strategy': 'mean_reversion', 'sideways_bb_std_mult': 0.9095730815508474, 'sideways_rsi_os': 53, 'sideways_rsi_ob': 92, 'sideways_adx_thresh': 27.764631624340527, 'sideways_atr_min_pct': 0.021949499322233185, 'sideways_atr_max_pct': 0.016287163646819272, 'sideways_tp_mult': 1.6854447897825644, 'sideways_tsl_mult': 0.3808889394317817, 'sideways_time_stop': 158, 'sideways_use_sma': True, 'sideways_use_ema': False, 'sideways_use_atr': False, 'sideways_use_adx': True, 'sideways_use_spike': True, 'sideways_rsi_required': False}.
[I 2025-09-01 09:39:05,991] Trial 203 finished with values: [-1000000000.0, 1000000000.0] and parameters: {'p_sma': 21, 'p_std': 44, 'p_atr': 23, 'p_adx': 16, 'rsi_period': 56, 'ema1': 18, 'ema2': 14, 'slip_atr_k': 0.04376074979044081, 'slip_spread_k': 0.33361049841174273, 'spread_hl_frac': 0.018968769366505586, 'bb_std_mult': 1.3437065825006602, 'rsi_os': 36, 'rsi_ob': 65, 'vol_spike': 0.015376033906686959, 'adx_thresh': 24.647238588283145, 'atr_min_pct': 0.027074932202331734, 'atr_max_pct': 0.0452204942107255, 'tp_mult': 2.637457615140896, 'tsl_mult': 0.5100975840518858, 'strategy': 'breakout', 'time_stop': 119, 'use_sma': True, 'use_atr': False, 'use_adx': False, 'use_ema': True, 'use_spike': True, 'rsi_required': True, 'edge_k': 1.38881981905629, 'edge_cap': 0.49391705970360744, 'bull_strategy': 'breakout', 'bull_bb_std_mult': 1.1008099780796932, 'bull_rsi_os': 8, 'bull_rsi_ob': 95, 'bull_adx_thresh': 6.526226262116761, 'bull_atr_min_pct': 0.019273532998136583, 'bull_atr_max_pct': 0.08692962730511766, 'bull_tp_mult': 2.6392651302979346, 'bull_tsl_mult': 0.9691114355701894, 'bull_time_stop': 44, 'bull_use_sma': True, 'bull_use_ema': False, 'bull_use_atr': True, 'bull_use_adx': False, 'bull_use_spike': False, 'bull_rsi_required': True, 'bear_strategy': 'mean_reversion', 'bear_bb_std_mult': 2.7617115718681746, 'bear_rsi_os': 53, 'bear_rsi_ob': 63, 'bear_adx_thresh': 17.453307275673197, 'bear_atr_min_pct': 0.028048529293154253, 'bear_atr_max_pct': 0.13055825196023627, 'bear_tp_mult': 2.2414033386599415, 'bear_tsl_mult': 0.026757132553392626, 'bear_time_stop': 282, 'bear_use_sma': True, 'bear_use_ema': True, 'bear_use_atr': True, 'bear_use_adx': False, 'bear_use_spike': False, 'bear_rsi_required': False, 'sideways_strategy': 'mean_reversion', 'sideways_bb_std_mult': 1.087483361052309, 'sideways_rsi_os': 53, 'sideways_rsi_ob': 55, 'sideways_adx_thresh': 25.59729811147163, 'sideways_atr_min_pct': 0.023078061771740228, 'sideways_atr_max_pct': 0.06589034915909345, 'sideways_tp_mult': 1.6984287131704403, 'sideways_tsl_mult': 0.36231779212314585, 'sideways_time_stop': 204, 'sideways_use_sma': True, 'sideways_use_ema': False, 'sideways_use_atr': False, 'sideways_use_adx': True, 'sideways_use_spike': False, 'sideways_rsi_required': False}.
[I 2025-09-01 09:39:06,975] Trial 202 finished with values: [-1000000000.0, 1000000000.0] and parameters: {'p_sma': 18, 'p_std': 31, 'p_atr': 9, 'p_adx': 30, 'rsi_period': 38, 'ema1': 25, 'ema2': 12, 'slip_atr_k': 0.047222071432382245, 'slip_spread_k': 0.06905186240516864, 'spread_hl_frac': 0.020245276306012767, 'bb_std_mult': 1.1849302937326127, 'rsi_os': 28, 'rsi_ob': 83, 'vol_spike': 0.2929828863935659, 'adx_thresh': 31.637497720148055, 'atr_min_pct': 0.02877635408127707, 'atr_max_pct': 0.06965134733220488, 'tp_mult': 1.0745720568753863, 'tsl_mult': 0.42257268070850823, 'strategy': 'breakout', 'time_stop': 287, 'use_sma': True, 'use_atr': False, 'use_adx': False, 'use_ema': True, 'use_spike': True, 'rsi_required': True, 'edge_k': 1.1266067044388037, 'edge_cap': 0.815878480989892, 'bull_strategy': 'breakout', 'bull_bb_std_mult': 3.3254734988493984, 'bull_rsi_os': 42, 'bull_rsi_ob': 77, 'bull_adx_thresh': 6.624109458307425, 'bull_atr_min_pct': 0.01905844864297732, 'bull_atr_max_pct': 0.08236517694936514, 'bull_tp_mult': 2.926095062753456, 'bull_tsl_mult': 0.9710233024804347, 'bull_time_stop': 48, 'bull_use_sma': True, 'bull_use_ema': False, 'bull_use_atr': True, 'bull_use_adx': False, 'bull_use_spike': False, 'bull_rsi_required': True, 'bear_strategy': 'breakout', 'bear_bb_std_mult': 1.7537736426934005, 'bear_rsi_os': 54, 'bear_rsi_ob': 95, 'bear_adx_thresh': 24.5610873981561, 'bear_atr_min_pct': 0.02801234195889104, 'bear_atr_max_pct': 0.13670209199529332, 'bear_tp_mult': 2.3158588748262123, 'bear_tsl_mult': 0.26825812730290244, 'bear_time_stop': 300, 'bear_use_sma': True, 'bear_use_ema': True, 'bear_use_atr': True, 'bear_use_adx': False, 'bear_use_spike': False, 'bear_rsi_required': False, 'sideways_strategy': 'mean_reversion', 'sideways_bb_std_mult': 3.0213289008771866, 'sideways_rsi_os': 19, 'sideways_rsi_ob': 76, 'sideways_adx_thresh': 25.65169968583473, 'sideways_atr_min_pct': 0.024131274021753045, 'sideways_atr_max_pct': 0.08143166332111865, 'sideways_tp_mult': 1.6926342120642173, 'sideways_tsl_mult': 0.37202845781910987, 'sideways_time_stop': 210, 'sideways_use_sma': True, 'sideways_use_ema': False, 'sideways_use_atr': False, 'sideways_use_adx': True, 'sideways_use_spike': False, 'sideways_rsi_required': False}.
[I 2025-09-01 09:39:06,998] Trial 204 finished with values: [-1000000000.0, 1000000000.0] and parameters: {'p_sma': 22, 'p_std': 45, 'p_atr': 9, 'p_adx': 27, 'rsi_period': 19, 'ema1': 25, 'ema2': 13, 'slip_atr_k': 0.044062567246226314, 'slip_spread_k': 0.3473488101179253, 'spread_hl_frac': 0.019907765625572026, 'bb_std_mult': 1.3314825689615932, 'rsi_os': 36, 'rsi_ob': 82, 'vol_spike': 0.014762046575314103, 'adx_thresh': 30.506614636094195, 'atr_min_pct': 0.027229169479115835, 'atr_max_pct': 0.06788781815385199, 'tp_mult': 2.938393050531279, 'tsl_mult': 0.4304505075030437, 'strategy': 'breakout', 'time_stop': 289, 'use_sma': True, 'use_atr': False, 'use_adx': False, 'use_ema': True, 'use_spike': True, 'rsi_required': True, 'edge_k': 1.3549228792472285, 'edge_cap': 0.49739462678121993, 'bull_strategy': 'breakout', 'bull_bb_std_mult': 3.218596048716746, 'bull_rsi_os': 24, 'bull_rsi_ob': 75, 'bull_adx_thresh': 6.44566362173731, 'bull_atr_min_pct': 0.003401475805237827, 'bull_atr_max_pct': 0.0880907905754487, 'bull_tp_mult': 2.5246616612929005, 'bull_tsl_mult': 0.9416130200773766, 'bull_time_stop': 230, 'bull_use_sma': True, 'bull_use_ema': False, 'bull_use_atr': True, 'bull_use_adx': True, 'bull_use_spike': False, 'bull_rsi_required': True, 'bear_strategy': 'mean_reversion', 'bear_bb_std_mult': 2.256266394513408, 'bear_rsi_os': 30, 'bear_rsi_ob': 95, 'bear_adx_thresh': 24.425857425645415, 'bear_atr_min_pct': 0.02787652750371599, 'bear_atr_max_pct': 0.06558265198536649, 'bear_tp_mult': 2.246013285323969, 'bear_tsl_mult': 0.27217140601942047, 'bear_time_stop': 282, 'bear_use_sma': True, 'bear_use_ema': True, 'bear_use_atr': True, 'bear_use_adx': False, 'bear_use_spike': False, 'bear_rsi_required': False, 'sideways_strategy': 'mean_reversion', 'sideways_bb_std_mult': 2.745555993889683, 'sideways_rsi_os': 9, 'sideways_rsi_ob': 54, 'sideways_adx_thresh': 22.138804164924327, 'sideways_atr_min_pct': 0.023189488213037623, 'sideways_atr_max_pct': 0.018623129822731385, 'sideways_tp_mult': 1.9888096368181445, 'sideways_tsl_mult': 0.3548178706399825, 'sideways_time_stop': 208, 'sideways_use_sma': True, 'sideways_use_ema': False, 'sideways_use_atr': False, 'sideways_use_adx': True, 'sideways_use_spike': False, 'sideways_rsi_required': True}.
[I 2025-09-01 09:39:07,231] Trial 205 finished with values: [-1000000000.0, 1000000000.0] and parameters: {'p_sma': 30, 'p_std': 45, 'p_atr': 13, 'p_adx': 26, 'rsi_period': 19, 'ema1': 18, 'ema2': 16, 'slip_atr_k': 0.042622325555642215, 'slip_spread_k': 0.6373354416002864, 'spread_hl_frac': 0.02853480919164624, 'bb_std_mult': 1.37185649388363, 'rsi_os': 17, 'rsi_ob': 82, 'vol_spike': 0.014160977998933254, 'adx_thresh': 31.718606875346122, 'atr_min_pct': 0.005124706990683479, 'atr_max_pct': 0.06817918724221927, 'tp_mult': 2.9453659142952335, 'tsl_mult': 0.42548003649318, 'strategy': 'breakout', 'time_stop': 288, 'use_sma': True, 'use_atr': False, 'use_adx': False, 'use_ema': True, 'use_spike': True, 'rsi_required': True, 'edge_k': 1.3746415205413782, 'edge_cap': 0.8492724596451483, 'bull_strategy': 'breakout', 'bull_bb_std_mult': 3.2053607889014666, 'bull_rsi_os': 45, 'bull_rsi_ob': 48, 'bull_adx_thresh': 7.852716663430843, 'bull_atr_min_pct': 0.011955273895420008, 'bull_atr_max_pct': 0.11629541402004626, 'bull_tp_mult': 1.470228230366514, 'bull_tsl_mult': 0.9331159018954756, 'bull_time_stop': 229, 'bull_use_sma': True, 'bull_use_ema': False, 'bull_use_atr': True, 'bull_use_adx': True, 'bull_use_spike': False, 'bull_rsi_required': True, 'bear_strategy': 'mean_reversion', 'bear_bb_std_mult': 2.2287928344405525, 'bear_rsi_os': 30, 'bear_rsi_ob': 95, 'bear_adx_thresh': 24.379490214863235, 'bear_atr_min_pct': 0.028789932103793527, 'bear_atr_max_pct': 0.14588735692392202, 'bear_tp_mult': 2.2382911159710948, 'bear_tsl_mult': 0.4633011377649569, 'bear_time_stop': 213, 'bear_use_sma': True, 'bear_use_ema': True, 'bear_use_atr': True, 'bear_use_adx': False, 'bear_use_spike': False, 'bear_rsi_required': False, 'sideways_strategy': 'mean_reversion', 'sideways_bb_std_mult': 1.8429972958603058, 'sideways_rsi_os': 30, 'sideways_rsi_ob': 54, 'sideways_adx_thresh': 25.867707726023983, 'sideways_atr_min_pct': 0.029054700087974436, 'sideways_atr_max_pct': 0.06635981135642184, 'sideways_tp_mult': 1.9797768298908844, 'sideways_tsl_mult': 0.002374235788056678, 'sideways_time_stop': 17, 'sideways_use_sma': True, 'sideways_use_ema': False, 'sideways_use_atr': False, 'sideways_use_adx': True, 'sideways_use_spike': False, 'sideways_rsi_required': True}.
[I 2025-09-01 09:39:49,270] Trial 209 finished with values: [-1000000000.0, 1000000000.0] and parameters: {'p_sma': 21, 'p_std': 37, 'p_atr': 16, 'p_adx': 18, 'rsi_period': 22, 'ema1': 19, 'ema2': 47, 'slip_atr_k': 0.058951429506525196, 'slip_spread_k': 0.6136153346529444, 'spread_hl_frac': 0.03344619642167874, 'bb_std_mult': 1.2605025373621355, 'rsi_os': 25, 'rsi_ob': 65, 'vol_spike': 0.030168589167918466, 'adx_thresh': 33.40359860742147, 'atr_min_pct': 0.015767225794568376, 'atr_max_pct': 0.038966764613274384, 'tp_mult': 1.0113602874145837, 'tsl_mult': 0.47373837859904694, 'strategy': 'breakout', 'time_stop': 256, 'use_sma': True, 'use_atr': False, 'use_adx': False, 'use_ema': True, 'use_spike': True, 'rsi_required': True, 'edge_k': 1.5309923929589546, 'edge_cap': 0.8328928519634455, 'bull_strategy': 'breakout', 'bull_bb_std_mult': 3.5340094535467035, 'bull_rsi_os': 42, 'bull_rsi_ob': 49, 'bull_adx_thresh': 5.080981437737817, 'bull_atr_min_pct': 0.0076991074617863585, 'bull_atr_max_pct': 0.09588957474862093, 'bull_tp_mult': 1.9168930376916293, 'bull_tsl_mult': 0.9402846449425338, 'bull_time_stop': 286, 'bull_use_sma': True, 'bull_use_ema': False, 'bull_use_atr': True, 'bull_use_adx': False, 'bull_use_spike': False, 'bull_rsi_required': True, 'bear_strategy': 'mean_reversion', 'bear_bb_std_mult': 2.6494244440689494, 'bear_rsi_os': 27, 'bear_rsi_ob': 90, 'bear_adx_thresh': 25.344308492903764, 'bear_atr_min_pct': 0.029601825208774694, 'bear_atr_max_pct': 0.08486777482538842, 'bear_tp_mult': 1.7700641312084153, 'bear_tsl_mult': 0.14263156765694687, 'bear_time_stop': 272, 'bear_use_sma': False, 'bear_use_ema': True, 'bear_use_atr': True, 'bear_use_adx': False, 'bear_use_spike': False, 'bear_rsi_required': False, 'sideways_strategy': 'mean_reversion', 'sideways_bb_std_mult': 0.7724609995603092, 'sideways_rsi_os': 6, 'sideways_rsi_ob': 90, 'sideways_adx_thresh': 27.383395075801666, 'sideways_atr_min_pct': 0.02122851508655185, 'sideways_atr_max_pct': 0.07201367026917958, 'sideways_tp_mult': 1.9464180249602827, 'sideways_tsl_mult': 0.4109933022284572, 'sideways_time_stop': 244, 'sideways_use_sma': True, 'sideways_use_ema': False, 'sideways_use_atr': False, 'sideways_use_adx': True, 'sideways_use_spike': False, 'sideways_rsi_required': False}.
