[I 2025-09-01 10:32:04,839] Trial 539 finished with values: [-0.056402854998443996, 0.05620906517585537] and parameters: {'p_sma': 13, 'p_std': 11, 'p_atr': 14, 'p_adx': 17, 'rsi_period': 40, 'ema1': 8, 'ema2': 10, 'slip_atr_k': 0.026017804005546798, 'slip_spread_k': 0.8315614699704069, 'spread_hl_frac': 0.01572481635970874, 'bb_std_mult': 1.0689420464815522, 'rsi_os': 16, 'rsi_ob': 60, 'vol_spike': 0.04485045830153751, 'adx_thresh': 23.235806347135796, 'atr_min_pct': 0.016316650238949543, 'atr_max_pct': 0.02343989640064082, 'tp_mult': 1.539887983999776, 'tsl_mult': 0.16142175710642936, 'strategy': 'breakout', 'time_stop': 131, 'use_sma': True, 'use_atr': True, 'use_adx': False, 'use_ema': False, 'use_spike': False, 'rsi_required': True, 'edge_k': 1.5235463198302335, 'edge_cap': 0.4495967833501381, 'bull_strategy': 'mean_reversion', 'bull_bb_std_mult': 0.5093218183178327, 'bull_rsi_os': 15, 'bull_rsi_ob': 75, 'bull_adx_thresh': 13.6077822720516, 'bull_atr_min_pct': 0.0013813559516654085, 'bull_atr_max_pct': 0.011721408531570731, 'bull_tp_mult': 1.113066622018951, 'bull_tsl_mult': 0.8081382973760456, 'bull_time_stop': 276, 'bull_use_sma': True, 'bull_use_ema': False, 'bull_use_atr': False, 'bull_use_adx': True, 'bull_use_spike': True, 'bull_rsi_required': True, 'bear_strategy': 'breakout', 'bear_bb_std_mult': 1.8893835784139803, 'bear_rsi_os': 17, 'bear_rsi_ob': 83, 'bear_adx_thresh': 25.911532864789418, 'bear_atr_min_pct': 0.0023688421248802658, 'bear_atr_max_pct': 0.1048016994936615, 'bear_tp_mult': 1.0432331191588395, 'bear_tsl_mult': 0.33156877495634146, 'bear_time_stop': 267, 'bear_use_sma': False, 'bear_use_ema': False, 'bear_use_atr': False, 'bear_use_adx': True, 'bear_use_spike': True, 'bear_rsi_required': False, 'sideways_strategy': 'breakout', 'sideways_bb_std_mult': 0.6520864273569233, 'sideways_rsi_os': 41, 'sideways_rsi_ob': 74, 'sideways_adx_thresh': 30.987012430261615, 'sideways_atr_min_pct': 0.005978930073064619, 'sideways_atr_max_pct': 0.05033653356593476, 'sideways_tp_mult': 2.096114414641288, 'sideways_tsl_mult': 0.32782481080865505, 'sideways_time_stop': 251, 'sideways_use_sma': False, 'sideways_use_ema': True, 'sideways_use_atr': True, 'sideways_use_adx': False, 'sideways_use_spike': False, 'sideways_rsi_required': True}.
[I 2025-09-01 10:32:05,805] Trial 540 finished with values: [-1000000000.0, 1000000000.0] and parameters: {'p_sma': 14, 'p_std': 32, 'p_atr': 13, 'p_adx': 17, 'rsi_period': 40, 'ema1': 8, 'ema2': 12, 'slip_atr_k': 0.026101268562955533, 'slip_spread_k': 0.8727432322275526, 'spread_hl_frac': 0.010673033141971667, 'bb_std_mult': 1.0148623381497015, 'rsi_os': 18, 'rsi_ob': 61, 'vol_spike': 0.06917942567961737, 'adx_thresh': 23.37291243152157, 'atr_min_pct': 0.01679166406106277, 'atr_max_pct': 0.022753418559810536, 'tp_mult': 1.4201537084614966, 'tsl_mult': 0.15784635768989902, 'strategy': 'mean_reversion', 'time_stop': 132, 'use_sma': False, 'use_atr': True, 'use_adx': True, 'use_ema': False, 'use_spike': False, 'rsi_required': False, 'edge_k': 1.5211275538054478, 'edge_cap': 0.12462345080226611, 'bull_strategy': 'mean_reversion', 'bull_bb_std_mult': 0.5959959991115619, 'bull_rsi_os': 16, 'bull_rsi_ob': 75, 'bull_adx_thresh': 14.546788352545272, 'bull_atr_min_pct': 0.0011097303209132005, 'bull_atr_max_pct': 0.01607476510914746, 'bull_tp_mult': 1.126554690125745, 'bull_tsl_mult': 0.6289925232074884, 'bull_time_stop': 278, 'bull_use_sma': True, 'bull_use_ema': True, 'bull_use_atr': False, 'bull_use_adx': True, 'bull_use_spike': True, 'bull_rsi_required': False, 'bear_strategy': 'breakout', 'bear_bb_std_mult': 2.2225062179245993, 'bear_rsi_os': 21, 'bear_rsi_ob': 85, 'bear_adx_thresh': 25.940095486493085, 'bear_atr_min_pct': 0.0023667688472769283, 'bear_atr_max_pct': 0.10813202164128652, 'bear_tp_mult': 1.0489182856851813, 'bear_tsl_mult': 0.3325898377140189, 'bear_time_stop': 266, 'bear_use_sma': True, 'bear_use_ema': False, 'bear_use_atr': False, 'bear_use_adx': True, 'bear_use_spike': True, 'bear_rsi_required': False, 'sideways_strategy': 'breakout', 'sideways_bb_std_mult': 0.5918933104087367, 'sideways_rsi_os': 54, 'sideways_rsi_ob': 55, 'sideways_adx_thresh': 30.89481782042298, 'sideways_atr_min_pct': 0.00607858967554208, 'sideways_atr_max_pct': 0.05910411885011013, 'sideways_tp_mult': 2.1166387469508368, 'sideways_tsl_mult': 0.3285654763285464, 'sideways_time_stop': 243, 'sideways_use_sma': False, 'sideways_use_ema': True, 'sideways_use_atr': True, 'sideways_use_adx': False, 'sideways_use_spike': False, 'sideways_rsi_required': True}.
[I 2025-09-01 10:32:48,583] Trial 545 finished with values: [-1000000000.0, 1000000000.0] and parameters: {'p_sma': 15, 'p_std': 60, 'p_atr': 12, 'p_adx': 21, 'rsi_period': 43, 'ema1': 7, 'ema2': 11, 'slip_atr_k': 0.017604622527716968, 'slip_spread_k': 0.8499874049050357, 'spread_hl_frac': 0.01371340240356407, 'bb_std_mult': 0.934440330338336, 'rsi_os': 17, 'rsi_ob': 57, 'vol_spike': 0.06383959820806716, 'adx_thresh': 24.197411886489625, 'atr_min_pct': 0.015357993014086017, 'atr_max_pct': 0.018575200601422013, 'tp_mult': 1.4809231074534603, 'tsl_mult': 0.1287702391409054, 'strategy': 'breakout', 'time_stop': 139, 'use_sma': True, 'use_atr': False, 'use_adx': False, 'use_ema': False, 'use_spike': False, 'rsi_required': True, 'edge_k': 1.5775506582561403, 'edge_cap': 0.20565680134591505, 'bull_strategy': 'mean_reversion', 'bull_bb_std_mult': 0.647473175219438, 'bull_rsi_os': 20, 'bull_rsi_ob': 77, 'bull_adx_thresh': 14.927642144298156, 'bull_atr_min_pct': 0.01862649549551585, 'bull_atr_max_pct': 0.019365134718064725, 'bull_tp_mult': 1.0895651583657935, 'bull_tsl_mult': 0.5951871556971445, 'bull_time_stop': 253, 'bull_use_sma': True, 'bull_use_ema': False, 'bull_use_atr': False, 'bull_use_adx': True, 'bull_use_spike': True, 'bull_rsi_required': True, 'bear_strategy': 'breakout', 'bear_bb_std_mult': 2.0962619210541806, 'bear_rsi_os': 19, 'bear_rsi_ob': 86, 'bear_adx_thresh': 27.50281674647422, 'bear_atr_min_pct': 0.0012965657715054493, 'bear_atr_max_pct': 0.13839205324346165, 'bear_tp_mult': 2.572161188453609, 'bear_tsl_mult': 0.297204969903977, 'bear_time_stop': 273, 'bear_use_sma': True, 'bear_use_ema': False, 'bear_use_atr': False, 'bear_use_adx': True, 'bear_use_spike': True, 'bear_rsi_required': False, 'sideways_strategy': 'breakout', 'sideways_bb_std_mult': 0.5019114885401449, 'sideways_rsi_os': 6, 'sideways_rsi_ob': 80, 'sideways_adx_thresh': 28.57460883767771, 'sideways_atr_min_pct': 0.007302136130364074, 'sideways_atr_max_pct': 0.052114642703988454, 'sideways_tp_mult': 2.038546279657278, 'sideways_tsl_mult': 0.3050560421147232, 'sideways_time_stop': 256, 'sideways_use_sma': False, 'sideways_use_ema': True, 'sideways_use_atr': True, 'sideways_use_adx': False, 'sideways_use_spike': False, 'sideways_rsi_required': True}.
[I 2025-09-01 10:32:49,052] Trial 542 finished with values: [-1000000000.0, 1000000000.0] and parameters: {'p_sma': 15, 'p_std': 60, 'p_atr': 13, 'p_adx': 17, 'rsi_period': 43, 'ema1': 8, 'ema2': 12, 'slip_atr_k': 0.023327134891118238, 'slip_spread_k': 0.8806440516638813, 'spread_hl_frac': 0.01064569425162619, 'bb_std_mult': 1.0681013460133593, 'rsi_os': 18, 'rsi_ob': 61, 'vol_spike': 0.0709665290750226, 'adx_thresh': 23.62290586039796, 'atr_min_pct': 0.018411693652738207, 'atr_max_pct': 0.01926703099510426, 'tp_mult': 1.4147230279649483, 'tsl_mult': 0.12586893587891904, 'strategy': 'mean_reversion', 'time_stop': 133, 'use_sma': False, 'use_atr': True, 'use_adx': True, 'use_ema': False, 'use_spike': False, 'rsi_required': False, 'edge_k': 1.5166297239226818, 'edge_cap': 0.4545851459545944, 'bull_strategy': 'mean_reversion', 'bull_bb_std_mult': 0.6238400687376897, 'bull_rsi_os': 20, 'bull_rsi_ob': 76, 'bull_adx_thresh': 13.24672517859851, 'bull_atr_min_pct': 0.0012708366463878556, 'bull_atr_max_pct': 0.015309003509099658, 'bull_tp_mult': 1.0278578316534368, 'bull_tsl_mult': 0.6469513787141441, 'bull_time_stop': 252, 'bull_use_sma': True, 'bull_use_ema': True, 'bull_use_atr': False, 'bull_use_adx': True, 'bull_use_spike': True, 'bull_rsi_required': False, 'bear_strategy': 'breakout', 'bear_bb_std_mult': 2.1982686963591176, 'bear_rsi_os': 21, 'bear_rsi_ob': 87, 'bear_adx_thresh': 25.707128644391187, 'bear_atr_min_pct': 0.0026542266396240733, 'bear_atr_max_pct': 0.10829293654263183, 'bear_tp_mult': 1.012569298899606, 'bear_tsl_mult': 0.33009675168211505, 'bear_time_stop': 245, 'bear_use_sma': True, 'bear_use_ema': False, 'bear_use_atr': False, 'bear_use_adx': True, 'bear_use_spike': True, 'bear_rsi_required': False, 'sideways_strategy': 'breakout', 'sideways_bb_std_mult': 0.5911936953953885, 'sideways_rsi_os': 27, 'sideways_rsi_ob': 55, 'sideways_adx_thresh': 28.359118130972586, 'sideways_atr_min_pct': 0.007510609409416926, 'sideways_atr_max_pct': 0.04935777901664067, 'sideways_tp_mult': 2.064236143898451, 'sideways_tsl_mult': 0.32487564122155127, 'sideways_time_stop': 254, 'sideways_use_sma': False, 'sideways_use_ema': True, 'sideways_use_atr': True, 'sideways_use_adx': False, 'sideways_use_spike': False, 'sideways_rsi_required': True}.
[I 2025-09-01 10:32:49,361] Trial 544 finished with values: [-1000000000.0, 1000000000.0] and parameters: {'p_sma': 15, 'p_std': 5, 'p_atr': 12, 'p_adx': 21, 'rsi_period': 43, 'ema1': 7, 'ema2': 11, 'slip_atr_k': 0.01653982986422696, 'slip_spread_k': 0.8768613491077524, 'spread_hl_frac': 0.013925083886046326, 'bb_std_mult': 1.0211997804958657, 'rsi_os': 15, 'rsi_ob': 57, 'vol_spike': 0.055940501066928355, 'adx_thresh': 24.05257438212529, 'atr_min_pct': 0.017153415746270394, 'atr_max_pct': 0.018415303574033568, 'tp_mult': 1.4373024993733532, 'tsl_mult': 0.13008005346501603, 'strategy': 'mean_reversion', 'time_stop': 139, 'use_sma': False, 'use_atr': False, 'use_adx': True, 'use_ema': False, 'use_spike': False, 'rsi_required': True, 'edge_k': 1.5857936317564558, 'edge_cap': 0.31355831128777045, 'bull_strategy': 'mean_reversion', 'bull_bb_std_mult': 0.625544437651612, 'bull_rsi_os': 17, 'bull_rsi_ob': 77, 'bull_adx_thresh': 14.55095520257313, 'bull_atr_min_pct': 0.014670382945287037, 'bull_atr_max_pct': 0.015248727245738098, 'bull_tp_mult': 1.06531382929084, 'bull_tsl_mult': 0.5863815393894365, 'bull_time_stop': 253, 'bull_use_sma': True, 'bull_use_ema': True, 'bull_use_atr': False, 'bull_use_adx': True, 'bull_use_spike': True, 'bull_rsi_required': True, 'bear_strategy': 'breakout', 'bear_bb_std_mult': 1.5899277493430322, 'bear_rsi_os': 20, 'bear_rsi_ob': 86, 'bear_adx_thresh': 27.669129222185443, 'bear_atr_min_pct': 0.0026819069694660764, 'bear_atr_max_pct': 0.12620900292091708, 'bear_tp_mult': 1.8408849132713272, 'bear_tsl_mult': 0.29417603125193986, 'bear_time_stop': 245, 'bear_use_sma': True, 'bear_use_ema': False, 'bear_use_atr': False, 'bear_use_adx': True, 'bear_use_spike': True, 'bear_rsi_required': False, 'sideways_strategy': 'breakout', 'sideways_bb_std_mult': 0.5909601276042433, 'sideways_rsi_os': 54, 'sideways_rsi_ob': 66, 'sideways_adx_thresh': 27.80476949932783, 'sideways_atr_min_pct': 0.007817372861894323, 'sideways_atr_max_pct': 0.05945704775114578, 'sideways_tp_mult': 2.0456149155538754, 'sideways_tsl_mult': 0.3432722518516195, 'sideways_time_stop': 256, 'sideways_use_sma': False, 'sideways_use_ema': True, 'sideways_use_atr': True, 'sideways_use_adx': False, 'sideways_use_spike': False, 'sideways_rsi_required': True}.
[I 2025-09-01 10:32:49,554] Trial 543 finished with values: [-0.020945233587760015, 0.020821599476726828] and parameters: {'p_sma': 15, 'p_std': 36, 'p_atr': 12, 'p_adx': 21, 'rsi_period': 43, 'ema1': 7, 'ema2': 12, 'slip_atr_k': 0.023473714380001395, 'slip_spread_k': 0.8421416586398092, 'spread_hl_frac': 0.011943146109527776, 'bb_std_mult': 1.0037377944688306, 'rsi_os': 15, 'rsi_ob': 61, 'vol_spike': 0.06158380039489848, 'adx_thresh': 23.82613031483295, 'atr_min_pct': 0.018194540049103543, 'atr_max_pct': 0.018224194556842616, 'tp_mult': 1.491579386291826, 'tsl_mult': 0.1474416567709113, 'strategy': 'breakout', 'time_stop': 139, 'use_sma': True, 'use_atr': True, 'use_adx': False, 'use_ema': False, 'use_spike': False, 'rsi_required': True, 'edge_k': 1.5118490351435092, 'edge_cap': 0.13292529493813554, 'bull_strategy': 'mean_reversion', 'bull_bb_std_mult': 0.6040066946719659, 'bull_rsi_os': 20, 'bull_rsi_ob': 77, 'bull_adx_thresh': 14.560542337177662, 'bull_atr_min_pct': 0.0012995515756306305, 'bull_atr_max_pct': 0.015306381706279902, 'bull_tp_mult': 1.1271706747383234, 'bull_tsl_mult': 0.6348617503173678, 'bull_time_stop': 266, 'bull_use_sma': True, 'bull_use_ema': False, 'bull_use_atr': False, 'bull_use_adx': True, 'bull_use_spike': True, 'bull_rsi_required': True, 'bear_strategy': 'breakout', 'bear_bb_std_mult': 2.3520726985726634, 'bear_rsi_os': 16, 'bear_rsi_ob': 82, 'bear_adx_thresh': 27.406474038576913, 'bear_atr_min_pct': 0.002298334072615506, 'bear_atr_max_pct': 0.11633877425769924, 'bear_tp_mult': 1.0318117321338698, 'bear_tsl_mult': 0.2975389456556369, 'bear_time_stop': 274, 'bear_use_sma': True, 'bear_use_ema': False, 'bear_use_atr': False, 'bear_use_adx': True, 'bear_use_spike': True, 'bear_rsi_required': False, 'sideways_strategy': 'breakout', 'sideways_bb_std_mult': 0.5727717766028861, 'sideways_rsi_os': 54, 'sideways_rsi_ob': 54, 'sideways_adx_thresh': 28.64643065663611, 'sideways_atr_min_pct': 0.007472051673402828, 'sideways_atr_max_pct': 0.05042088179252463, 'sideways_tp_mult': 2.031011770458379, 'sideways_tsl_mult': 0.33019823676681076, 'sideways_time_stop': 254, 'sideways_use_sma': False, 'sideways_use_ema': True, 'sideways_use_atr': True, 'sideways_use_adx': False, 'sideways_use_spike': False, 'sideways_rsi_required': True}.
[I 2025-09-01 10:32:50,795] Trial 546 finished with values: [-1000000000.0, 1000000000.0] and parameters: {'p_sma': 15, 'p_std': 16, 'p_atr': 13, 'p_adx': 21, 'rsi_period': 35, 'ema1': 7, 'ema2': 11, 'slip_atr_k': 0.021685181194259003, 'slip_spread_k': 0.8065152362690359, 'spread_hl_frac': 0.011783912927335135, 'bb_std_mult': 1.0043056794647613, 'rsi_os': 15, 'rsi_ob': 61, 'vol_spike': 0.06190588088901363, 'adx_thresh': 23.944322192115415, 'atr_min_pct': 0.016837212498860166, 'atr_max_pct': 0.015119869970478542, 'tp_mult': 1.4881626472374372, 'tsl_mult': 0.12350435439027016, 'strategy': 'breakout', 'time_stop': 149, 'use_sma': True, 'use_atr': False, 'use_adx': False, 'use_ema': False, 'use_spike': False, 'rsi_required': True, 'edge_k': 1.5758746143084417, 'edge_cap': 0.3105976760487453, 'bull_strategy': 'mean_reversion', 'bull_bb_std_mult': 0.5727767440568128, 'bull_rsi_os': 17, 'bull_rsi_ob': 76, 'bull_adx_thresh': 15.584383730017125, 'bull_atr_min_pct': 0.004140166847691024, 'bull_atr_max_pct': 0.01464976237387353, 'bull_tp_mult': 1.198692969958354, 'bull_tsl_mult': 0.6459462337220487, 'bull_time_stop': 267, 'bull_use_sma': True, 'bull_use_ema': False, 'bull_use_atr': False, 'bull_use_adx': True, 'bull_use_spike': True, 'bull_rsi_required': True, 'bear_strategy': 'breakout', 'bear_bb_std_mult': 1.609013850332269, 'bear_rsi_os': 16, 'bear_rsi_ob': 82, 'bear_adx_thresh': 28.05112908770876, 'bear_atr_min_pct': 0.0027005882692077723, 'bear_atr_max_pct': 0.14020201242640296, 'bear_tp_mult': 1.8183989174662045, 'bear_tsl_mult': 0.31927422773459163, 'bear_time_stop': 257, 'bear_use_sma': True, 'bear_use_ema': False, 'bear_use_atr': False, 'bear_use_adx': True, 'bear_use_spike': True, 'bear_rsi_required': False, 'sideways_strategy': 'breakout', 'sideways_bb_std_mult': 0.5846710975887066, 'sideways_rsi_os': 27, 'sideways_rsi_ob': 51, 'sideways_adx_thresh': 27.882680780153002, 'sideways_atr_min_pct': 0.007555340963504441, 'sideways_atr_max_pct': 0.04737836551653177, 'sideways_tp_mult': 1.9653445522685897, 'sideways_tsl_mult': 0.3477288639179822, 'sideways_time_stop': 232, 'sideways_use_sma': False, 'sideways_use_ema': True, 'sideways_use_atr': True, 'sideways_use_adx': False, 'sideways_use_spike': False, 'sideways_rsi_required': True}.
[I 2025-09-01 10:32:50,835] Trial 548 finished with values: [-1000000000.0, 1000000000.0] and parameters: {'p_sma': 12, 'p_std': 17, 'p_atr': 13, 'p_adx': 20, 'rsi_period': 35, 'ema1': 7, 'ema2': 10, 'slip_atr_k': 0.015126107905395899, 'slip_spread_k': 0.8084338366436071, 'spread_hl_frac': 0.01447615748390983, 'bb_std_mult': 0.9766341057735081, 'rsi_os': 17, 'rsi_ob': 59, 'vol_spike': 0.06457029808819664, 'adx_thresh': 25.419842498721824, 'atr_min_pct': 0.01780965958938042, 'atr_max_pct': 0.015494681789087012, 'tp_mult': 1.4882870309083056, 'tsl_mult': 0.09965872270650278, 'strategy': 'breakout', 'time_stop': 146, 'use_sma': True, 'use_atr': False, 'use_adx': False, 'use_ema': False, 'use_spike': False, 'rsi_required': True, 'edge_k': 1.6829235824274345, 'edge_cap': 0.14880266071185538, 'bull_strategy': 'breakout', 'bull_bb_std_mult': 0.5725038887428757, 'bull_rsi_os': 19, 'bull_rsi_ob': 78, 'bull_adx_thresh': 15.390432995903353, 'bull_atr_min_pct': 0.010441128356357746, 'bull_atr_max_pct': 0.02025062004180259, 'bull_tp_mult': 1.1950260199378562, 'bull_tsl_mult': 0.6945696105322494, 'bull_time_stop': 266, 'bull_use_sma': True, 'bull_use_ema': False, 'bull_use_atr': False, 'bull_use_adx': True, 'bull_use_spike': True, 'bull_rsi_required': True, 'bear_strategy': 'breakout', 'bear_bb_std_mult': 2.3711208858331636, 'bear_rsi_os': 16, 'bear_rsi_ob': 82, 'bear_adx_thresh': 27.045930067071716, 'bear_atr_min_pct': 0.0017597665858162324, 'bear_atr_max_pct': 0.14063582162621177, 'bear_tp_mult': 1.7638411887886336, 'bear_tsl_mult': 0.3647970381093942, 'bear_time_stop': 263, 'bear_use_sma': True, 'bear_use_ema': True, 'bear_use_atr': False, 'bear_use_adx': True, 'bear_use_spike': True, 'bear_rsi_required': False, 'sideways_strategy': 'breakout', 'sideways_bb_std_mult': 0.5424467409259873, 'sideways_rsi_os': 18, 'sideways_rsi_ob': 54, 'sideways_adx_thresh': 29.365063445292183, 'sideways_atr_min_pct': 0.007915389942631388, 'sideways_atr_max_pct': 0.055376674611885494, 'sideways_tp_mult': 1.9865825855599804, 'sideways_tsl_mult': 0.2917821005578203, 'sideways_time_stop': 224, 'sideways_use_sma': False, 'sideways_use_ema': True, 'sideways_use_atr': True, 'sideways_use_adx': False, 'sideways_use_spike': True, 'sideways_rsi_required': True}.
[I 2025-09-01 10:32:50,903] Trial 549 finished with values: [-1000000000.0, 1000000000.0] and parameters: {'p_sma': 12, 'p_std': 16, 'p_atr': 13, 'p_adx': 20, 'rsi_period': 36, 'ema1': 6, 'ema2': 10, 'slip_atr_k': 0.019683296270445752, 'slip_spread_k': 0.8054552093450402, 'spread_hl_frac': 0.015164046242959493, 'bb_std_mult': 0.7719580770835617, 'rsi_os': 17, 'rsi_ob': 59, 'vol_spike': 0.05127125082548342, 'adx_thresh': 25.557879961031393, 'atr_min_pct': 0.015599123800573584, 'atr_max_pct': 0.015337090133126072, 'tp_mult': 1.485443873617287, 'tsl_mult': 0.08117400097986202, 'strategy': 'breakout', 'time_stop': 147, 'use_sma': True, 'use_atr': False, 'use_adx': False, 'use_ema': False, 'use_spike': False, 'rsi_required': True, 'edge_k': 1.564391440102948, 'edge_cap': 0.6833173828423827, 'bull_strategy': 'breakout', 'bull_bb_std_mult': 0.5008609267095816, 'bull_rsi_os': 19, 'bull_rsi_ob': 73, 'bull_adx_thresh': 15.481887994205675, 'bull_atr_min_pct': 0.004162995816404632, 'bull_atr_max_pct': 0.022542672959325487, 'bull_tp_mult': 1.1866064878895646, 'bull_tsl_mult': 0.6973681405910271, 'bull_time_stop': 264, 'bull_use_sma': True, 'bull_use_ema': False, 'bull_use_atr': False, 'bull_use_adx': True, 'bull_use_spike': True, 'bull_rsi_required': True, 'bear_strategy': 'breakout', 'bear_bb_std_mult': 1.6154858560807464, 'bear_rsi_os': 16, 'bear_rsi_ob': 85, 'bear_adx_thresh': 26.671216463301654, 'bear_atr_min_pct': 0.001541199483279099, 'bear_atr_max_pct': 0.1399381017158313, 'bear_tp_mult': 2.2996522462451576, 'bear_tsl_mult': 0.35933152223125936, 'bear_time_stop': 263, 'bear_use_sma': True, 'bear_use_ema': True, 'bear_use_atr': False, 'bear_use_adx': True, 'bear_use_spike': True, 'bear_rsi_required': False, 'sideways_strategy': 'breakout', 'sideways_bb_std_mult': 0.5532948894291775, 'sideways_rsi_os': 18, 'sideways_rsi_ob': 81, 'sideways_adx_thresh': 29.188429695952856, 'sideways_atr_min_pct': 0.007024331844168426, 'sideways_atr_max_pct': 0.055387458137140126, 'sideways_tp_mult': 1.9824841263647022, 'sideways_tsl_mult': 0.2957848736944458, 'sideways_time_stop': 232, 'sideways_use_sma': False, 'sideways_use_ema': True, 'sideways_use_atr': True, 'sideways_use_adx': False, 'sideways_use_spike': True, 'sideways_rsi_required': True}.
