[I 2025-09-01 10:37:13,745] Trial 585 finished with values: [-1000000000.0, 1000000000.0] and parameters: {'p_sma': 25, 'p_std': 53, 'p_atr': 12, 'p_adx': 18, 'rsi_period': 44, 'ema1': 7, 'ema2': 10, 'slip_atr_k': 0.18561184051501828, 'slip_spread_k': 0.7770764291855237, 'spread_hl_frac': 0.014112975545366429, 'bb_std_mult': 1.1528159151628679, 'rsi_os': 19, 'rsi_ob': 92, 'vol_spike': 0.05419097252340692, 'adx_thresh': 13.388403358644204, 'atr_min_pct': 0.015231826847292185, 'atr_max_pct': 0.022692318588654555, 'tp_mult': 1.5174006702118623, 'tsl_mult': 0.15816016344011063, 'strategy': 'breakout', 'time_stop': 157, 'use_sma': True, 'use_atr': False, 'use_adx': False, 'use_ema': False, 'use_spike': False, 'rsi_required': False, 'edge_k': 0.14230909185180918, 'edge_cap': 0.22044390909598308, 'bull_strategy': 'mean_reversion', 'bull_bb_std_mult': 0.615002124146095, 'bull_rsi_os': 17, 'bull_rsi_ob': 72, 'bull_adx_thresh': 14.02218274545802, 'bull_atr_min_pct': 0.01994315527239589, 'bull_atr_max_pct': 0.1336330481661676, 'bull_tp_mult': 2.1962090149696265, 'bull_tsl_mult': 0.5591425504115777, 'bull_time_stop': 30, 'bull_use_sma': False, 'bull_use_ema': False, 'bull_use_atr': False, 'bull_use_adx': True, 'bull_use_spike': True, 'bull_rsi_required': False, 'bear_strategy': 'breakout', 'bear_bb_std_mult': 1.7721843510760722, 'bear_rsi_os': 21, 'bear_rsi_ob': 85, 'bear_adx_thresh': 26.041007721622538, 'bear_atr_min_pct': 0.014516922572486556, 'bear_atr_max_pct': 0.14312363253481447, 'bear_tp_mult': 2.3331787470810266, 'bear_tsl_mult': 0.37322457007683524, 'bear_time_stop': 274, 'bear_use_sma': True, 'bear_use_ema': True, 'bear_use_atr': False, 'bear_use_adx': True, 'bear_use_spike': True, 'bear_rsi_required': True, 'sideways_strategy': 'breakout', 'sideways_bb_std_mult': 0.6866449207758762, 'sideways_rsi_os': 46, 'sideways_rsi_ob': 68, 'sideways_adx_thresh': 28.099146475769523, 'sideways_atr_min_pct': 0.018375275918114276, 'sideways_atr_max_pct': 0.05026976274590271, 'sideways_tp_mult': 2.116301143167284, 'sideways_tsl_mult': 0.2806074875755867, 'sideways_time_stop': 236, 'sideways_use_sma': False, 'sideways_use_ema': True, 'sideways_use_atr': True, 'sideways_use_adx': False, 'sideways_use_spike': False, 'sideways_rsi_required': True}.
[I 2025-09-01 10:37:17,181] Trial 586 finished with values: [-0.08037336636184378, 0.08021128532112437] and parameters: {'p_sma': 25, 'p_std': 9, 'p_atr': 14, 'p_adx': 23, 'rsi_period': 59, 'ema1': 7, 'ema2': 54, 'slip_atr_k': 0.022317179817369713, 'slip_spread_k': 0.7734989004353199, 'spread_hl_frac': 0.014169071852912149, 'bb_std_mult': 1.154627052520393, 'rsi_os': 10, 'rsi_ob': 87, 'vol_spike': 0.0533106603061511, 'adx_thresh': 5.684193376586133, 'atr_min_pct': 0.016799309314569372, 'atr_max_pct': 0.021171911860820646, 'tp_mult': 1.4594619045376696, 'tsl_mult': 0.15395336898840528, 'strategy': 'breakout', 'time_stop': 136, 'use_sma': True, 'use_atr': False, 'use_adx': False, 'use_ema': False, 'use_spike': False, 'rsi_required': False, 'edge_k': 1.533917205729888, 'edge_cap': 0.13587183761242977, 'bull_strategy': 'mean_reversion', 'bull_bb_std_mult': 0.5922822307314772, 'bull_rsi_os': 18, 'bull_rsi_ob': 72, 'bull_adx_thresh': 13.508367134817123, 'bull_atr_min_pct': 0.0004887896629218401, 'bull_atr_max_pct': 0.13255423018359763, 'bull_tp_mult': 2.202108300321337, 'bull_tsl_mult': 0.8643566215817144, 'bull_time_stop': 271, 'bull_use_sma': False, 'bull_use_ema': False, 'bull_use_atr': False, 'bull_use_adx': True, 'bull_use_spike': True, 'bull_rsi_required': False, 'bear_strategy': 'breakout', 'bear_bb_std_mult': 1.773360159288039, 'bear_rsi_os': 22, 'bear_rsi_ob': 85, 'bear_adx_thresh': 27.821566234378555, 'bear_atr_min_pct': 0.025019606692093632, 'bear_atr_max_pct': 0.1171151920711167, 'bear_tp_mult': 1.5340589103410631, 'bear_tsl_mult': 0.37375284787222063, 'bear_time_stop': 199, 'bear_use_sma': True, 'bear_use_ema': True, 'bear_use_atr': False, 'bear_use_adx': True, 'bear_use_spike': True, 'bear_rsi_required': True, 'sideways_strategy': 'breakout', 'sideways_bb_std_mult': 0.6938464693585611, 'sideways_rsi_os': 53, 'sideways_rsi_ob': 79, 'sideways_adx_thresh': 28.406255825236762, 'sideways_atr_min_pct': 0.013978545100868546, 'sideways_atr_max_pct': 0.10249636760975288, 'sideways_tp_mult': 2.2325237099357986, 'sideways_tsl_mult': 0.2814517796873517, 'sideways_time_stop': 282, 'sideways_use_sma': False, 'sideways_use_ema': True, 'sideways_use_atr': True, 'sideways_use_adx': False, 'sideways_use_spike': False, 'sideways_rsi_required': True}.
[I 2025-09-01 10:37:17,196] Trial 587 finished with values: [-1000000000.0, 1000000000.0] and parameters: {'p_sma': 28, 'p_std': 53, 'p_atr': 12, 'p_adx': 16, 'rsi_period': 77, 'ema1': 7, 'ema2': 10, 'slip_atr_k': 0.1146256566338726, 'slip_spread_k': 0.8135017451002633, 'spread_hl_frac': 0.017374945661435295, 'bb_std_mult': 1.1469287067990899, 'rsi_os': 19, 'rsi_ob': 92, 'vol_spike': 0.05480601912917782, 'adx_thresh': 24.232861960842644, 'atr_min_pct': 0.026132780728655113, 'atr_max_pct': 0.018718203174531753, 'tp_mult': 2.280202627330187, 'tsl_mult': 0.1559816556937767, 'strategy': 'breakout', 'time_stop': 155, 'use_sma': True, 'use_atr': False, 'use_adx': False, 'use_ema': False, 'use_spike': False, 'rsi_required': True, 'edge_k': 1.5246512617194385, 'edge_cap': 0.3999941128506507, 'bull_strategy': 'mean_reversion', 'bull_bb_std_mult': 2.4992527763113555, 'bull_rsi_os': 17, 'bull_rsi_ob': 77, 'bull_adx_thresh': 14.256689413454746, 'bull_atr_min_pct': 0.02070328922380072, 'bull_atr_max_pct': 0.015029319945832778, 'bull_tp_mult': 2.216522111994073, 'bull_tsl_mult': 0.5937073162444968, 'bull_time_stop': 270, 'bull_use_sma': True, 'bull_use_ema': False, 'bull_use_atr': False, 'bull_use_adx': True, 'bull_use_spike': True, 'bull_rsi_required': True, 'bear_strategy': 'breakout', 'bear_bb_std_mult': 1.342620117002791, 'bear_rsi_os': 21, 'bear_rsi_ob': 61, 'bear_adx_thresh': 25.566066321128517, 'bear_atr_min_pct': 0.01957719005429612, 'bear_atr_max_pct': 0.11520452992918183, 'bear_tp_mult': 2.167360286928903, 'bear_tsl_mult': 0.32689134184132046, 'bear_time_stop': 272, 'bear_use_sma': False, 'bear_use_ema': True, 'bear_use_atr': False, 'bear_use_adx': True, 'bear_use_spike': True, 'bear_rsi_required': False, 'sideways_strategy': 'breakout', 'sideways_bb_std_mult': 0.7045530311589088, 'sideways_rsi_os': 53, 'sideways_rsi_ob': 66, 'sideways_adx_thresh': 28.235866661436035, 'sideways_atr_min_pct': 0.014170207948189255, 'sideways_atr_max_pct': 0.05469335848161156, 'sideways_tp_mult': 2.132014595829747, 'sideways_tsl_mult': 0.27861383933143735, 'sideways_time_stop': 160, 'sideways_use_sma': False, 'sideways_use_ema': True, 'sideways_use_atr': True, 'sideways_use_adx': False, 'sideways_use_spike': False, 'sideways_rsi_required': True}.
[I 2025-09-01 10:37:18,451] Trial 590 finished with values: [-1000000000.0, 1000000000.0] and parameters: {'p_sma': 28, 'p_std': 38, 'p_atr': 7, 'p_adx': 21, 'rsi_period': 63, 'ema1': 26, 'ema2': 10, 'slip_atr_k': 0.014684342985070337, 'slip_spread_k': 0.3766048206339027, 'spread_hl_frac': 0.017176742199863287, 'bb_std_mult': 1.0451486135728685, 'rsi_os': 18, 'rsi_ob': 53, 'vol_spike': 0.06518520251917302, 'adx_thresh': 21.116394880963117, 'atr_min_pct': 0.021916189320421935, 'atr_max_pct': 0.014075366146511469, 'tp_mult': 1.4671685346399859, 'tsl_mult': 0.12323766209354665, 'strategy': 'mean_reversion', 'time_stop': 151, 'use_sma': False, 'use_atr': True, 'use_adx': True, 'use_ema': False, 'use_spike': False, 'rsi_required': True, 'edge_k': 0.7626907824327277, 'edge_cap': 0.4068961869248168, 'bull_strategy': 'mean_reversion', 'bull_bb_std_mult': 0.8804771998912, 'bull_rsi_os': 17, 'bull_rsi_ob': 77, 'bull_adx_thresh': 13.286578347899852, 'bull_atr_min_pct': 0.009789825350141806, 'bull_atr_max_pct': 0.11979320934821222, 'bull_tp_mult': 1.1615654961937243, 'bull_tsl_mult': 0.220213176858171, 'bull_time_stop': 45, 'bull_use_sma': True, 'bull_use_ema': True, 'bull_use_atr': False, 'bull_use_adx': True, 'bull_use_spike': True, 'bull_rsi_required': True, 'bear_strategy': 'breakout', 'bear_bb_std_mult': 3.445212414839883, 'bear_rsi_os': 17, 'bear_rsi_ob': 83, 'bear_adx_thresh': 25.667475937973094, 'bear_atr_min_pct': 0.0038736886994495297, 'bear_atr_max_pct': 0.12850414465680365, 'bear_tp_mult': 2.2690602764295265, 'bear_tsl_mult': 0.33065872547591835, 'bear_time_stop': 184, 'bear_use_sma': False, 'bear_use_ema': False, 'bear_use_atr': False, 'bear_use_adx': True, 'bear_use_spike': True, 'bear_rsi_required': False, 'sideways_strategy': 'breakout', 'sideways_bb_std_mult': 0.5577331567108675, 'sideways_rsi_os': 55, 'sideways_rsi_ob': 78, 'sideways_adx_thresh': 29.509441638241483, 'sideways_atr_min_pct': 0.007080555737294035, 'sideways_atr_max_pct': 0.09019010318489284, 'sideways_tp_mult': 2.0851755753630297, 'sideways_tsl_mult': 0.23293142056292632, 'sideways_time_stop': 241, 'sideways_use_sma': False, 'sideways_use_ema': True, 'sideways_use_atr': True, 'sideways_use_adx': False, 'sideways_use_spike': False, 'sideways_rsi_required': True}.
[I 2025-09-01 10:37:18,479] Trial 591 finished with values: [-1000000000.0, 1000000000.0] and parameters: {'p_sma': 12, 'p_std': 18, 'p_atr': 13, 'p_adx': 21, 'rsi_period': 38, 'ema1': 8, 'ema2': 13, 'slip_atr_k': 0.16259589425691304, 'slip_spread_k': 0.29871837574070803, 'spread_hl_frac': 0.0125004412802949, 'bb_std_mult': 1.0418231310911987, 'rsi_os': 18, 'rsi_ob': 60, 'vol_spike': 0.21481988398779533, 'adx_thresh': 23.526796444104022, 'atr_min_pct': 0.01714146003397756, 'atr_max_pct': 0.013788933038816984, 'tp_mult': 1.638397099134925, 'tsl_mult': 0.12516019966309225, 'strategy': 'mean_reversion', 'time_stop': 123, 'use_sma': False, 'use_atr': True, 'use_adx': True, 'use_ema': False, 'use_spike': False, 'rsi_required': True, 'edge_k': 1.7113598623000383, 'edge_cap': 0.30602042243300015, 'bull_strategy': 'mean_reversion', 'bull_bb_std_mult': 0.5571218263489021, 'bull_rsi_os': 27, 'bull_rsi_ob': 77, 'bull_adx_thresh': 17.228437526415323, 'bull_atr_min_pct': 0.0010382147527332756, 'bull_atr_max_pct': 0.019446496039509896, 'bull_tp_mult': 1.189884959222864, 'bull_tsl_mult': 0.03767800222479328, 'bull_time_stop': 123, 'bull_use_sma': True, 'bull_use_ema': True, 'bull_use_atr': False, 'bull_use_adx': True, 'bull_use_spike': True, 'bull_rsi_required': True, 'bear_strategy': 'breakout', 'bear_bb_std_mult': 2.7892709711099504, 'bear_rsi_os': 23, 'bear_rsi_ob': 64, 'bear_adx_thresh': 26.924485449346154, 'bear_atr_min_pct': 0.01624752264537648, 'bear_atr_max_pct': 0.11042306641640438, 'bear_tp_mult': 2.6741653998526287, 'bear_tsl_mult': 0.3385245347203413, 'bear_time_stop': 138, 'bear_use_sma': False, 'bear_use_ema': False, 'bear_use_atr': False, 'bear_use_adx': True, 'bear_use_spike': True, 'bear_rsi_required': False, 'sideways_strategy': 'breakout', 'sideways_bb_std_mult': 2.466019002053929, 'sideways_rsi_os': 55, 'sideways_rsi_ob': 80, 'sideways_adx_thresh': 29.402281155134578, 'sideways_atr_min_pct': 0.0051871224766434606, 'sideways_atr_max_pct': 0.14751048213894544, 'sideways_tp_mult': 2.0669414383581075, 'sideways_tsl_mult': 0.614762165938249, 'sideways_time_stop': 147, 'sideways_use_sma': False, 'sideways_use_ema': True, 'sideways_use_atr': True, 'sideways_use_adx': False, 'sideways_use_spike': False, 'sideways_rsi_required': True}.
[I 2025-09-01 10:37:20,002] Trial 592 finished with values: [-1000000000.0, 1000000000.0] and parameters: {'p_sma': 12, 'p_std': 44, 'p_atr': 14, 'p_adx': 22, 'rsi_period': 39, 'ema1': 5, 'ema2': 11, 'slip_atr_k': 0.011932542959311745, 'slip_spread_k': 0.8162899756644678, 'spread_hl_frac': 0.012695157618832808, 'bb_std_mult': 1.0442054943563235, 'rsi_os': 5, 'rsi_ob': 60, 'vol_spike': 0.2142922262419075, 'adx_thresh': 16.84880539589799, 'atr_min_pct': 0.017013075200644403, 'atr_max_pct': 0.013413517128924654, 'tp_mult': 1.6321618464262113, 'tsl_mult': 0.1867739169486485, 'strategy': 'mean_reversion', 'time_stop': 122, 'use_sma': False, 'use_atr': True, 'use_adx': True, 'use_ema': False, 'use_spike': False, 'rsi_required': True, 'edge_k': 0.8730007670192976, 'edge_cap': 0.08748407968435262, 'bull_strategy': 'mean_reversion', 'bull_bb_std_mult': 2.6474943165620966, 'bull_rsi_os': 35, 'bull_rsi_ob': 79, 'bull_adx_thresh': 17.028809312637406, 'bull_atr_min_pct': 0.016023484653306486, 'bull_atr_max_pct': 0.019805955615050757, 'bull_tp_mult': 1.1783011156314716, 'bull_tsl_mult': 0.7239457207757379, 'bull_time_stop': 126, 'bull_use_sma': True, 'bull_use_ema': True, 'bull_use_atr': False, 'bull_use_adx': True, 'bull_use_spike': True, 'bull_rsi_required': True, 'bear_strategy': 'breakout', 'bear_bb_std_mult': 2.803082875921122, 'bear_rsi_os': 5, 'bear_rsi_ob': 48, 'bear_adx_thresh': 26.52000576289078, 'bear_atr_min_pct': 0.017589807872939726, 'bear_atr_max_pct': 0.10903198784907055, 'bear_tp_mult': 2.66215067112754, 'bear_tsl_mult': 0.27657156109910663, 'bear_time_stop': 267, 'bear_use_sma': True, 'bear_use_ema': False, 'bear_use_atr': False, 'bear_use_adx': True, 'bear_use_spike': True, 'bear_rsi_required': False, 'sideways_strategy': 'breakout', 'sideways_bb_std_mult': 0.6219323354303491, 'sideways_rsi_os': 42, 'sideways_rsi_ob': 71, 'sideways_adx_thresh': 28.97029579026068, 'sideways_atr_min_pct': 0.005405043157223987, 'sideways_atr_max_pct': 0.0574989759182985, 'sideways_tp_mult': 2.0735121062395674, 'sideways_tsl_mult': 0.027048909388844966, 'sideways_time_stop': 260, 'sideways_use_sma': False, 'sideways_use_ema': True, 'sideways_use_atr': True, 'sideways_use_adx': False, 'sideways_use_spike': False, 'sideways_rsi_required': True}.
[I 2025-09-01 10:37:59,548] Trial 589 finished with values: [-1000000000.0, 1000000000.0] and parameters: {'p_sma': 46, 'p_std': 40, 'p_atr': 14, 'p_adx': 16, 'rsi_period': 62, 'ema1': 9, 'ema2': 13, 'slip_atr_k': 0.014147519745149984, 'slip_spread_k': 0.8103599750072463, 'spread_hl_frac': 0.012546393364244927, 'bb_std_mult': 1.0406210408476024, 'rsi_os': 18, 'rsi_ob': 87, 'vol_spike': 0.06387004951040615, 'adx_thresh': 24.04865584243103, 'atr_min_pct': 0.0171402874201949, 'atr_max_pct': 0.061737384848087044, 'tp_mult': 2.131236723143652, 'tsl_mult': 0.19000622264733788, 'strategy': 'mean_reversion', 'time_stop': 138, 'use_sma': False, 'use_atr': True, 'use_adx': True, 'use_ema': False, 'use_spike': False, 'rsi_required': True, 'edge_k': 1.5264480359640344, 'edge_cap': 0.30424388035079075, 'bull_strategy': 'mean_reversion', 'bull_bb_std_mult': 2.4975815762590705, 'bull_rsi_os': 27, 'bull_rsi_ob': 77, 'bull_adx_thresh': 13.397655423455431, 'bull_atr_min_pct': 0.0004843941970198655, 'bull_atr_max_pct': 0.14989343270651936, 'bull_tp_mult': 1.170274899023115, 'bull_tsl_mult': 0.03802216568972544, 'bull_time_stop': 100, 'bull_use_sma': True, 'bull_use_ema': True, 'bull_use_atr': False, 'bull_use_adx': True, 'bull_use_spike': True, 'bull_rsi_required': True, 'bear_strategy': 'breakout', 'bear_bb_std_mult': 2.4271420750482604, 'bear_rsi_os': 17, 'bear_rsi_ob': 85, 'bear_adx_thresh': 26.70006633379126, 'bear_atr_min_pct': 0.003908783992782053, 'bear_atr_max_pct': 0.1098494306017494, 'bear_tp_mult': 1.6682981647887982, 'bear_tsl_mult': 0.108055636317059, 'bear_time_stop': 197, 'bear_use_sma': False, 'bear_use_ema': True, 'bear_use_atr': False, 'bear_use_adx': True, 'bear_use_spike': True, 'bear_rsi_required': False, 'sideways_strategy': 'breakout', 'sideways_bb_std_mult': 0.5746863456831759, 'sideways_rsi_os': 53, 'sideways_rsi_ob': 49, 'sideways_adx_thresh': 29.430109781569076, 'sideways_atr_min_pct': 0.005472254981213673, 'sideways_atr_max_pct': 0.05713014909018055, 'sideways_tp_mult': 2.865044769283699, 'sideways_tsl_mult': 0.8444211985758112, 'sideways_time_stop': 162, 'sideways_use_sma': False, 'sideways_use_ema': True, 'sideways_use_atr': True, 'sideways_use_adx': False, 'sideways_use_spike': False, 'sideways_rsi_required': True}.
[I 2025-09-01 10:38:00,202] Trial 588 finished with values: [-1000000000.0, 1000000000.0] and parameters: {'p_sma': 25, 'p_std': 53, 'p_atr': 12, 'p_adx': 21, 'rsi_period': 73, 'ema1': 9, 'ema2': 10, 'slip_atr_k': 0.22899803909288802, 'slip_spread_k': 0.8097867037870065, 'spread_hl_frac': 0.016898196756265183, 'bb_std_mult': 0.9669023982396436, 'rsi_os': 19, 'rsi_ob': 60, 'vol_spike': 0.06486776642550016, 'adx_thresh': 24.04222359646531, 'atr_min_pct': 0.017227624546088487, 'atr_max_pct': 0.019245699613623463, 'tp_mult': 1.665093851213413, 'tsl_mult': 0.13364148159812875, 'strategy': 'mean_reversion', 'time_stop': 136, 'use_sma': False, 'use_atr': True, 'use_adx': True, 'use_ema': False, 'use_spike': False, 'rsi_required': True, 'edge_k': 1.514737388182664, 'edge_cap': 0.13432657083995947, 'bull_strategy': 'mean_reversion', 'bull_bb_std_mult': 0.7797565005779572, 'bull_rsi_os': 27, 'bull_rsi_ob': 77, 'bull_adx_thresh': 13.482360663579636, 'bull_atr_min_pct': 0.020506959838176825, 'bull_atr_max_pct': 0.13416264837880812, 'bull_tp_mult': 1.8762344805596416, 'bull_tsl_mult': 0.599120635508001, 'bull_time_stop': 101, 'bull_use_sma': True, 'bull_use_ema': True, 'bull_use_atr': False, 'bull_use_adx': True, 'bull_use_spike': True, 'bull_rsi_required': True, 'bear_strategy': 'breakout', 'bear_bb_std_mult': 3.4477474382709143, 'bear_rsi_os': 23, 'bear_rsi_ob': 85, 'bear_adx_thresh': 25.659712199482655, 'bear_atr_min_pct': 0.012457587689190482, 'bear_atr_max_pct': 0.11010733301735044, 'bear_tp_mult': 1.5455004049268866, 'bear_tsl_mult': 0.3305767766733436, 'bear_time_stop': 5, 'bear_use_sma': False, 'bear_use_ema': True, 'bear_use_atr': False, 'bear_use_adx': True, 'bear_use_spike': True, 'bear_rsi_required': False, 'sideways_strategy': 'breakout', 'sideways_bb_std_mult': 0.6900770196548471, 'sideways_rsi_os': 53, 'sideways_rsi_ob': 79, 'sideways_adx_thresh': 29.372662020799662, 'sideways_atr_min_pct': 0.014067218962514505, 'sideways_atr_max_pct': 0.05707582085884379, 'sideways_tp_mult': 2.102109845353182, 'sideways_tsl_mult': 0.27998519682658346, 'sideways_time_stop': 148, 'sideways_use_sma': False, 'sideways_use_ema': True, 'sideways_use_atr': True, 'sideways_use_adx': False, 'sideways_use_spike': False, 'sideways_rsi_required': True}.
[I 2025-09-01 10:38:04,441] Trial 593 finished with values: [-0.04315632203204167, 0.04309670047465245] and parameters: {'p_sma': 14, 'p_std': 11, 'p_atr': 14, 'p_adx': 23, 'rsi_period': 83, 'ema1': 10, 'ema2': 13, 'slip_atr_k': 0.011406037150297445, 'slip_spread_k': 0.8138271427801942, 'spread_hl_frac': 0.04870747498624402, 'bb_std_mult': 0.9620071506668074, 'rsi_os': 15, 'rsi_ob': 62, 'vol_spike': 0.06114699006496658, 'adx_thresh': 22.580539944274328, 'atr_min_pct': 0.01680848948779516, 'atr_max_pct': 0.0609957296123691, 'tp_mult': 1.5601177068022092, 'tsl_mult': 0.33000088964721974, 'strategy': 'breakout', 'time_stop': 137, 'use_sma': True, 'use_atr': False, 'use_adx': False, 'use_ema': False, 'use_spike': False, 'rsi_required': True, 'edge_k': 0.5169642771213642, 'edge_cap': 0.7567077658603945, 'bull_strategy': 'mean_reversion', 'bull_bb_std_mult': 0.7756866064170052, 'bull_rsi_os': 8, 'bull_rsi_ob': 86, 'bull_adx_thresh': 26.153334534101177, 'bull_atr_min_pct': 8.368157331643724e-06, 'bull_atr_max_pct': 0.023350091880336474, 'bull_tp_mult': 2.3692000344784256, 'bull_tsl_mult': 0.7240745794217537, 'bull_time_stop': 100, 'bull_use_sma': True, 'bull_use_ema': False, 'bull_use_atr': False, 'bull_use_adx': True, 'bull_use_spike': True, 'bull_rsi_required': True, 'bear_strategy': 'breakout', 'bear_bb_std_mult': 1.4426801230474333, 'bear_rsi_os': 15, 'bear_rsi_ob': 84, 'bear_adx_thresh': 26.55488551772767, 'bear_atr_min_pct': 0.012555876555891349, 'bear_atr_max_pct': 0.10565221360951679, 'bear_tp_mult': 1.806193106763492, 'bear_tsl_mult': 0.7888039121901551, 'bear_time_stop': 6, 'bear_use_sma': True, 'bear_use_ema': False, 'bear_use_atr': False, 'bear_use_adx': True, 'bear_use_spike': True, 'bear_rsi_required': False, 'sideways_strategy': 'breakout', 'sideways_bb_std_mult': 0.6096266912035304, 'sideways_rsi_os': 42, 'sideways_rsi_ob': 56, 'sideways_adx_thresh': 7.414968652339647, 'sideways_atr_min_pct': 0.008151700416712041, 'sideways_atr_max_pct': 0.031752492230467395, 'sideways_tp_mult': 2.1586744969475387, 'sideways_tsl_mult': 0.3019189013170645, 'sideways_time_stop': 257, 'sideways_use_sma': False, 'sideways_use_ema': True, 'sideways_use_atr': True, 'sideways_use_adx': False, 'sideways_use_spike': False, 'sideways_rsi_required': True}.
