[I 2025-09-01 10:16:06,032] Trial 423 finished with values: [-1000000000.0, 1000000000.0] and parameters: {'p_sma': 25, 'p_std': 29, 'p_atr': 17, 'p_adx': 26, 'rsi_period': 66, 'ema1': 17, 'ema2': 16, 'slip_atr_k': 0.06313224919465378, 'slip_spread_k': 0.6488395068451793, 'spread_hl_frac': 0.030404984623861913, 'bb_std_mult': 1.4895943323436953, 'rsi_os': 40, 'rsi_ob': 70, 'vol_spike': 0.09487480066870134, 'adx_thresh': 15.543336167588606, 'atr_min_pct': 0.024527756749408283, 'atr_max_pct': 0.13832384469536133, 'tp_mult': 1.2680640371092204, 'tsl_mult': 0.7292285974159971, 'strategy': 'breakout', 'time_stop': 250, 'use_sma': True, 'use_atr': False, 'use_adx': False, 'use_ema': False, 'use_spike': True, 'rsi_required': False, 'edge_k': 1.2626545354808354, 'edge_cap': 0.9195193088441818, 'bull_strategy': 'breakout', 'bull_bb_std_mult': 3.381984844654301, 'bull_rsi_os': 47, 'bull_rsi_ob': 47, 'bull_adx_thresh': 28.84303045561407, 'bull_atr_min_pct': 0.011556965720881428, 'bull_atr_max_pct': 0.08742970195110239, 'bull_tp_mult': 2.8973285339886994, 'bull_tsl_mult': 0.4391569888514286, 'bull_time_stop': 238, 'bull_use_sma': False, 'bull_use_ema': False, 'bull_use_atr': True, 'bull_use_adx': True, 'bull_use_spike': True, 'bull_rsi_required': False, 'bear_strategy': 'mean_reversion', 'bear_bb_std_mult': 0.945694776807772, 'bear_rsi_os': 49, 'bear_rsi_ob': 75, 'bear_adx_thresh': 8.953584574940779, 'bear_atr_min_pct': 0.006857585883450554, 'bear_atr_max_pct': 0.1170020496171141, 'bear_tp_mult': 1.9917710045584631, 'bear_tsl_mult': 0.4541585193095013, 'bear_time_stop': 174, 'bear_use_sma': False, 'bear_use_ema': True, 'bear_use_atr': True, 'bear_use_adx': False, 'bear_use_spike': False, 'bear_rsi_required': True, 'sideways_strategy': 'mean_reversion', 'sideways_bb_std_mult': 2.2932761247162015, 'sideways_rsi_os': 28, 'sideways_rsi_ob': 93, 'sideways_adx_thresh': 24.655287303790963, 'sideways_atr_min_pct': 0.009770478225342032, 'sideways_atr_max_pct': 0.12923279244727146, 'sideways_tp_mult': 1.6512705708507571, 'sideways_tsl_mult': 0.43790847062899696, 'sideways_time_stop': 226, 'sideways_use_sma': True, 'sideways_use_ema': False, 'sideways_use_atr': False, 'sideways_use_adx': False, 'sideways_use_spike': True, 'sideways_rsi_required': False}.
[I 2025-09-01 10:16:06,500] Trial 424 finished with values: [-1000000000.0, 1000000000.0] and parameters: {'p_sma': 36, 'p_std': 55, 'p_atr': 19, 'p_adx': 26, 'rsi_period': 48, 'ema1': 19, 'ema2': 16, 'slip_atr_k': 0.04595484896556293, 'slip_spread_k': 0.0018622747283609242, 'spread_hl_frac': 0.02584372042029017, 'bb_std_mult': 1.587294051098145, 'rsi_os': 40, 'rsi_ob': 70, 'vol_spike': 0.07203378202855691, 'adx_thresh': 32.97286346270414, 'atr_min_pct': 0.024436286288461884, 'atr_max_pct': 0.13733660755466864, 'tp_mult': 2.082910314065187, 'tsl_mult': 0.7264054902206404, 'strategy': 'breakout', 'time_stop': 250, 'use_sma': True, 'use_atr': False, 'use_adx': False, 'use_ema': True, 'use_spike': True, 'rsi_required': False, 'edge_k': 0.9135977927800216, 'edge_cap': 0.16227106167877503, 'bull_strategy': 'breakout', 'bull_bb_std_mult': 3.5996232540983772, 'bull_rsi_os': 48, 'bull_rsi_ob': 67, 'bull_adx_thresh': 5.57348455256485, 'bull_atr_min_pct': 0.02930863258628864, 'bull_atr_max_pct': 0.1292769036160951, 'bull_tp_mult': 2.9078540033008653, 'bull_tsl_mult': 0.4336917687223667, 'bull_time_stop': 93, 'bull_use_sma': False, 'bull_use_ema': False, 'bull_use_atr': True, 'bull_use_adx': True, 'bull_use_spike': True, 'bull_rsi_required': False, 'bear_strategy': 'mean_reversion', 'bear_bb_std_mult': 2.8576008896404654, 'bear_rsi_os': 53, 'bear_rsi_ob': 75, 'bear_adx_thresh': 8.881209927061951, 'bear_atr_min_pct': 0.007045968919319351, 'bear_atr_max_pct': 0.11810265584753879, 'bear_tp_mult': 1.1990562689466973, 'bear_tsl_mult': 0.4301285706814861, 'bear_time_stop': 223, 'bear_use_sma': True, 'bear_use_ema': True, 'bear_use_atr': True, 'bear_use_adx': False, 'bear_use_spike': False, 'bear_rsi_required': False, 'sideways_strategy': 'mean_reversion', 'sideways_bb_std_mult': 0.7432768223773812, 'sideways_rsi_os': 29, 'sideways_rsi_ob': 92, 'sideways_adx_thresh': 18.097676116982846, 'sideways_atr_min_pct': 0.0076465172472999585, 'sideways_atr_max_pct': 0.14528697869172585, 'sideways_tp_mult': 2.252404307898418, 'sideways_tsl_mult': 0.4789006459515605, 'sideways_time_stop': 107, 'sideways_use_sma': False, 'sideways_use_ema': False, 'sideways_use_atr': False, 'sideways_use_adx': False, 'sideways_use_spike': False, 'sideways_rsi_required': False}.
[I 2025-09-01 10:16:06,923] Trial 422 finished with values: [-1000000000.0, 1000000000.0] and parameters: {'p_sma': 19, 'p_std': 47, 'p_atr': 17, 'p_adx': 26, 'rsi_period': 7, 'ema1': 17, 'ema2': 44, 'slip_atr_k': 0.1065259108395798, 'slip_spread_k': 0.680738219893859, 'spread_hl_frac': 0.025881015924237173, 'bb_std_mult': 1.5008956308151205, 'rsi_os': 40, 'rsi_ob': 70, 'vol_spike': 0.06674032969682811, 'adx_thresh': 8.663966320125631, 'atr_min_pct': 0.00873234404491079, 'atr_max_pct': 0.13846082236811336, 'tp_mult': 2.096961118857652, 'tsl_mult': 0.652740541130056, 'strategy': 'breakout', 'time_stop': 250, 'use_sma': True, 'use_atr': False, 'use_adx': False, 'use_ema': False, 'use_spike': True, 'rsi_required': False, 'edge_k': 1.2472341468355617, 'edge_cap': 0.6020363858301432, 'bull_strategy': 'breakout', 'bull_bb_std_mult': 3.3681722484770997, 'bull_rsi_os': 47, 'bull_rsi_ob': 47, 'bull_adx_thresh': 5.693850171566631, 'bull_atr_min_pct': 0.00846189453209082, 'bull_atr_max_pct': 0.08709798635722867, 'bull_tp_mult': 2.8945281647202323, 'bull_tsl_mult': 0.4335774481522219, 'bull_time_stop': 204, 'bull_use_sma': False, 'bull_use_ema': False, 'bull_use_atr': True, 'bull_use_adx': True, 'bull_use_spike': True, 'bull_rsi_required': False, 'bear_strategy': 'mean_reversion', 'bear_bb_std_mult': 1.1806917394535048, 'bear_rsi_os': 54, 'bear_rsi_ob': 76, 'bear_adx_thresh': 24.107403759132787, 'bear_atr_min_pct': 0.02585646915360048, 'bear_atr_max_pct': 0.04930458117632646, 'bear_tp_mult': 2.010707298651343, 'bear_tsl_mult': 0.924340876846778, 'bear_time_stop': 88, 'bear_use_sma': False, 'bear_use_ema': True, 'bear_use_atr': True, 'bear_use_adx': False, 'bear_use_spike': False, 'bear_rsi_required': True, 'sideways_strategy': 'mean_reversion', 'sideways_bb_std_mult': 2.290412465067978, 'sideways_rsi_os': 28, 'sideways_rsi_ob': 50, 'sideways_adx_thresh': 34.927436863124484, 'sideways_atr_min_pct': 0.012743743182263732, 'sideways_atr_max_pct': 0.12988045358537453, 'sideways_tp_mult': 2.2249036768814867, 'sideways_tsl_mult': 0.04193625912965754, 'sideways_time_stop': 225, 'sideways_use_sma': True, 'sideways_use_ema': False, 'sideways_use_atr': False, 'sideways_use_adx': False, 'sideways_use_spike': True, 'sideways_rsi_required': False}.
[I 2025-09-01 10:16:08,109] Trial 429 finished with values: [-1000000000.0, 1000000000.0] and parameters: {'p_sma': 17, 'p_std': 60, 'p_atr': 18, 'p_adx': 24, 'rsi_period': 25, 'ema1': 6, 'ema2': 19, 'slip_atr_k': 0.09026810603086485, 'slip_spread_k': 0.996951148168808, 'spread_hl_frac': 0.026972729782787367, 'bb_std_mult': 1.3757388641819766, 'rsi_os': 42, 'rsi_ob': 46, 'vol_spike': 0.2695790171813407, 'adx_thresh': 32.18606794664998, 'atr_min_pct': 0.0031960416382620423, 'atr_max_pct': 0.12437069091826805, 'tp_mult': 2.753419284486398, 'tsl_mult': 0.9625815278277078, 'strategy': 'mean_reversion', 'time_stop': 35, 'use_sma': False, 'use_atr': True, 'use_adx': True, 'use_ema': True, 'use_spike': False, 'rsi_required': True, 'edge_k': 1.031394688945153, 'edge_cap': 0.5571322654656998, 'bull_strategy': 'mean_reversion', 'bull_bb_std_mult': 3.27097748844277, 'bull_rsi_os': 43, 'bull_rsi_ob': 84, 'bull_adx_thresh': 7.873559674490236, 'bull_atr_min_pct': 3.747476612380829e-05, 'bull_atr_max_pct': 0.035166343447157175, 'bull_tp_mult': 1.7277678106251475, 'bull_tsl_mult': 0.35914926749702303, 'bull_time_stop': 168, 'bull_use_sma': True, 'bull_use_ema': True, 'bull_use_atr': True, 'bull_use_adx': False, 'bull_use_spike': False, 'bull_rsi_required': True, 'bear_strategy': 'breakout', 'bear_bb_std_mult': 1.6793827949653437, 'bear_rsi_os': 8, 'bear_rsi_ob': 73, 'bear_adx_thresh': 22.10050399431055, 'bear_atr_min_pct': 0.02239347037265503, 'bear_atr_max_pct': 0.10868337645613224, 'bear_tp_mult': 1.2245988279542288, 'bear_tsl_mult': 0.8465715600995459, 'bear_time_stop': 35, 'bear_use_sma': True, 'bear_use_ema': False, 'bear_use_atr': True, 'bear_use_adx': True, 'bear_use_spike': True, 'bear_rsi_required': False, 'sideways_strategy': 'breakout', 'sideways_bb_std_mult': 2.1493845010490156, 'sideways_rsi_os': 38, 'sideways_rsi_ob': 84, 'sideways_adx_thresh': 20.633067611801984, 'sideways_atr_min_pct': 0.009597645542099827, 'sideways_atr_max_pct': 0.07556396107402744, 'sideways_tp_mult': 1.3709971470596602, 'sideways_tsl_mult': 0.7220718473139494, 'sideways_time_stop': 287, 'sideways_use_sma': True, 'sideways_use_ema': False, 'sideways_use_atr': True, 'sideways_use_adx': True, 'sideways_use_spike': False, 'sideways_rsi_required': True}.
[I 2025-09-01 10:16:46,846] Trial 427 finished with values: [-1000000000.0, 1000000000.0] and parameters: {'p_sma': 20, 'p_std': 60, 'p_atr': 18, 'p_adx': 24, 'rsi_period': 54, 'ema1': 19, 'ema2': 14, 'slip_atr_k': 0.0508621417342572, 'slip_spread_k': 0.46589752629207243, 'spread_hl_frac': 0.028203632101868416, 'bb_std_mult': 2.869893410095732, 'rsi_os': 9, 'rsi_ob': 54, 'vol_spike': 0.10041135520208735, 'adx_thresh': 32.126840804397055, 'atr_min_pct': 0.011805406978343955, 'atr_max_pct': 0.12142968384434523, 'tp_mult': 1.0706233066437971, 'tsl_mult': 0.8005827690390301, 'strategy': 'mean_reversion', 'time_stop': 37, 'use_sma': False, 'use_atr': True, 'use_adx': False, 'use_ema': True, 'use_spike': False, 'rsi_required': True, 'edge_k': 1.5058168727741121, 'edge_cap': 0.5615763531818347, 'bull_strategy': 'mean_reversion', 'bull_bb_std_mult': 3.255057490786727, 'bull_rsi_os': 34, 'bull_rsi_ob': 48, 'bull_adx_thresh': 15.045318029297839, 'bull_atr_min_pct': 0.0025606083922925568, 'bull_atr_max_pct': 0.07994004626324948, 'bull_tp_mult': 2.942758206340562, 'bull_tsl_mult': 0.35373509771204315, 'bull_time_stop': 169, 'bull_use_sma': True, 'bull_use_ema': True, 'bull_use_atr': True, 'bull_use_adx': False, 'bull_use_spike': False, 'bull_rsi_required': True, 'bear_strategy': 'mean_reversion', 'bear_bb_std_mult': 1.5066079018535, 'bear_rsi_os': 20, 'bear_rsi_ob': 76, 'bear_adx_thresh': 22.23348572920946, 'bear_atr_min_pct': 0.022552391102842104, 'bear_atr_max_pct': 0.12516181822101052, 'bear_tp_mult': 1.2916702736179584, 'bear_tsl_mult': 0.528273085057411, 'bear_time_stop': 286, 'bear_use_sma': True, 'bear_use_ema': False, 'bear_use_atr': True, 'bear_use_adx': True, 'bear_use_spike': False, 'bear_rsi_required': False, 'sideways_strategy': 'breakout', 'sideways_bb_std_mult': 0.8713747132904864, 'sideways_rsi_os': 54, 'sideways_rsi_ob': 90, 'sideways_adx_thresh': 23.460261827894104, 'sideways_atr_min_pct': 0.012743833729093075, 'sideways_atr_max_pct': 0.07556651971328619, 'sideways_tp_mult': 2.3768180335487945, 'sideways_tsl_mult': 0.717078212468548, 'sideways_time_stop': 185, 'sideways_use_sma': True, 'sideways_use_ema': False, 'sideways_use_atr': True, 'sideways_use_adx': True, 'sideways_use_spike': False, 'sideways_rsi_required': False}.
[I 2025-09-01 10:16:47,535] Trial 426 finished with values: [-1000000000.0, 1000000000.0] and parameters: {'p_sma': 11, 'p_std': 51, 'p_atr': 7, 'p_adx': 26, 'rsi_period': 27, 'ema1': 19, 'ema2': 16, 'slip_atr_k': 0.23829726705088605, 'slip_spread_k': 0.4690182755767271, 'spread_hl_frac': 0.025810269010136375, 'bb_std_mult': 2.2225001439803487, 'rsi_os': 47, 'rsi_ob': 68, 'vol_spike': 0.07135503669242592, 'adx_thresh': 29.23176447297753, 'atr_min_pct': 0.0029780996838921613, 'atr_max_pct': 0.12285028441875606, 'tp_mult': 1.0439234306525427, 'tsl_mult': 0.956879953961657, 'strategy': 'breakout', 'time_stop': 260, 'use_sma': True, 'use_atr': True, 'use_adx': False, 'use_ema': True, 'use_spike': False, 'rsi_required': True, 'edge_k': 1.317236607753542, 'edge_cap': 0.558113214261112, 'bull_strategy': 'mean_reversion', 'bull_bb_std_mult': 3.5275858199480106, 'bull_rsi_os': 28, 'bull_rsi_ob': 70, 'bull_adx_thresh': 5.550526337668095, 'bull_atr_min_pct': 0.008316694259003546, 'bull_atr_max_pct': 0.1275731156769365, 'bull_tp_mult': 2.927644408180904, 'bull_tsl_mult': 0.355113784979255, 'bull_time_stop': 32, 'bull_use_sma': True, 'bull_use_ema': False, 'bull_use_atr': True, 'bull_use_adx': False, 'bull_use_spike': False, 'bull_rsi_required': True, 'bear_strategy': 'mean_reversion', 'bear_bb_std_mult': 2.8847394814961875, 'bear_rsi_os': 55, 'bear_rsi_ob': 53, 'bear_adx_thresh': 23.35807922604136, 'bear_atr_min_pct': 0.004216471362040964, 'bear_atr_max_pct': 0.049385835859314456, 'bear_tp_mult': 1.2084316064574283, 'bear_tsl_mult': 0.9872835124069232, 'bear_time_stop': 287, 'bear_use_sma': True, 'bear_use_ema': False, 'bear_use_atr': True, 'bear_use_adx': True, 'bear_use_spike': False, 'bear_rsi_required': False, 'sideways_strategy': 'breakout', 'sideways_bb_std_mult': 2.726973692113005, 'sideways_rsi_os': 12, 'sideways_rsi_ob': 85, 'sideways_adx_thresh': 14.761264912481169, 'sideways_atr_min_pct': 0.012641932417137422, 'sideways_atr_max_pct': 0.07406958704751261, 'sideways_tp_mult': 1.7750136069857696, 'sideways_tsl_mult': 0.07021903206594099, 'sideways_time_stop': 25, 'sideways_use_sma': True, 'sideways_use_ema': False, 'sideways_use_atr': False, 'sideways_use_adx': True, 'sideways_use_spike': False, 'sideways_rsi_required': False}.
[I 2025-09-01 10:16:48,273] Trial 428 finished with values: [-1000000000.0, 1000000000.0] and parameters: {'p_sma': 17, 'p_std': 49, 'p_atr': 18, 'p_adx': 24, 'rsi_period': 7, 'ema1': 19, 'ema2': 22, 'slip_atr_k': 0.051654056854222835, 'slip_spread_k': 0.6648947405631043, 'spread_hl_frac': 0.02704961837659061, 'bb_std_mult': 3.378088132156522, 'rsi_os': 42, 'rsi_ob': 54, 'vol_spike': 0.06648635876241428, 'adx_thresh': 29.134828818723527, 'atr_min_pct': 0.008824352864524087, 'atr_max_pct': 0.12301609839029018, 'tp_mult': 1.5672999978937223, 'tsl_mult': 0.9594462913329723, 'strategy': 'mean_reversion', 'time_stop': 260, 'use_sma': False, 'use_atr': True, 'use_adx': False, 'use_ema': True, 'use_spike': False, 'rsi_required': True, 'edge_k': 1.303730231906741, 'edge_cap': 0.5412651849051513, 'bull_strategy': 'mean_reversion', 'bull_bb_std_mult': 0.7146479127329151, 'bull_rsi_os': 43, 'bull_rsi_ob': 55, 'bull_adx_thresh': 5.646123023604821, 'bull_atr_min_pct': 0.0021076099581067596, 'bull_atr_max_pct': 0.0805436654003629, 'bull_tp_mult': 1.754947416847512, 'bull_tsl_mult': 0.3889909075196201, 'bull_time_stop': 164, 'bull_use_sma': True, 'bull_use_ema': True, 'bull_use_atr': True, 'bull_use_adx': False, 'bull_use_spike': False, 'bull_rsi_required': True, 'bear_strategy': 'mean_reversion', 'bear_bb_std_mult': 2.757195127409392, 'bear_rsi_os': 40, 'bear_rsi_ob': 76, 'bear_adx_thresh': 22.093484958164105, 'bear_atr_min_pct': 0.005635002443569889, 'bear_atr_max_pct': 0.08621236337846554, 'bear_tp_mult': 2.431711344994777, 'bear_tsl_mult': 0.4869684669372735, 'bear_time_stop': 288, 'bear_use_sma': True, 'bear_use_ema': False, 'bear_use_atr': True, 'bear_use_adx': True, 'bear_use_spike': False, 'bear_rsi_required': False, 'sideways_strategy': 'breakout', 'sideways_bb_std_mult': 2.1392746213544784, 'sideways_rsi_os': 54, 'sideways_rsi_ob': 88, 'sideways_adx_thresh': 9.972923455121565, 'sideways_atr_min_pct': 0.009510230810600798, 'sideways_atr_max_pct': 0.0744123234476652, 'sideways_tp_mult': 2.72281497302942, 'sideways_tsl_mult': 0.5444562683453359, 'sideways_time_stop': 36, 'sideways_use_sma': True, 'sideways_use_ema': False, 'sideways_use_atr': True, 'sideways_use_adx': True, 'sideways_use_spike': False, 'sideways_rsi_required': False}.
[I 2025-09-01 10:16:48,765] Trial 430 finished with values: [-1000000000.0, 1000000000.0] and parameters: {'p_sma': 20, 'p_std': 51, 'p_atr': 18, 'p_adx': 10, 'rsi_period': 54, 'ema1': 19, 'ema2': 11, 'slip_atr_k': 0.050761716524860806, 'slip_spread_k': 0.7390834159257373, 'spread_hl_frac': 0.031305551641064175, 'bb_std_mult': 1.4159401033312384, 'rsi_os': 6, 'rsi_ob': 93, 'vol_spike': 0.2863057677537004, 'adx_thresh': 11.519163771223274, 'atr_min_pct': 0.0008326108889033391, 'atr_max_pct': 0.12176275361683576, 'tp_mult': 1.8522004243415755, 'tsl_mult': 0.6873737072922566, 'strategy': 'breakout', 'time_stop': 263, 'use_sma': True, 'use_atr': False, 'use_adx': False, 'use_ema': True, 'use_spike': False, 'rsi_required': True, 'edge_k': 1.9164499146924254, 'edge_cap': 0.5439124111632682, 'bull_strategy': 'mean_reversion', 'bull_bb_std_mult': 3.527547940314713, 'bull_rsi_os': 11, 'bull_rsi_ob': 48, 'bull_adx_thresh': 6.8334745410772095, 'bull_atr_min_pct': 0.002502662364893846, 'bull_atr_max_pct': 0.09063035088122151, 'bull_tp_mult': 2.937988045923931, 'bull_tsl_mult': 0.3878497565870882, 'bull_time_stop': 40, 'bull_use_sma': True, 'bull_use_ema': False, 'bull_use_atr': False, 'bull_use_adx': False, 'bull_use_spike': False, 'bull_rsi_required': True, 'bear_strategy': 'mean_reversion', 'bear_bb_std_mult': 0.8994358083705664, 'bear_rsi_os': 55, 'bear_rsi_ob': 77, 'bear_adx_thresh': 23.227938470821286, 'bear_atr_min_pct': 0.02461468010778172, 'bear_atr_max_pct': 0.14943904032674227, 'bear_tp_mult': 1.285993742121416, 'bear_tsl_mult': 0.9988878192037189, 'bear_time_stop': 287, 'bear_use_sma': True, 'bear_use_ema': False, 'bear_use_atr': False, 'bear_use_adx': True, 'bear_use_spike': False, 'bear_rsi_required': False, 'sideways_strategy': 'breakout', 'sideways_bb_std_mult': 1.3823678172297849, 'sideways_rsi_os': 12, 'sideways_rsi_ob': 90, 'sideways_adx_thresh': 10.015260114590072, 'sideways_atr_min_pct': 0.00592233288733874, 'sideways_atr_max_pct': 0.0202329716441575, 'sideways_tp_mult': 1.2970994764733486, 'sideways_tsl_mult': 0.1322934658256525, 'sideways_time_stop': 24, 'sideways_use_sma': True, 'sideways_use_ema': True, 'sideways_use_atr': False, 'sideways_use_adx': True, 'sideways_use_spike': False, 'sideways_rsi_required': False}.
[I 2025-09-01 10:17:31,659] Trial 431 finished with values: [-1000000000.0, 1000000000.0] and parameters: {'p_sma': 29, 'p_std': 18, 'p_atr': 18, 'p_adx': 25, 'rsi_period': 23, 'ema1': 18, 'ema2': 32, 'slip_atr_k': 0.05088917963965416, 'slip_spread_k': 0.1476528511052419, 'spread_hl_frac': 0.010297873437169034, 'bb_std_mult': 3.213879400433007, 'rsi_os': 42, 'rsi_ob': 94, 'vol_spike': 0.0008784212014961157, 'adx_thresh': 29.18823206408308, 'atr_min_pct': 0.0206860481935675, 'atr_max_pct': 0.14674180197125536, 'tp_mult': 1.5756130467090996, 'tsl_mult': 0.10248976505374735, 'strategy': 'breakout', 'time_stop': 260, 'use_sma': True, 'use_atr': False, 'use_adx': False, 'use_ema': True, 'use_spike': True, 'rsi_required': True, 'edge_k': 1.5668934222698683, 'edge_cap': 0.2831317412608838, 'bull_strategy': 'mean_reversion', 'bull_bb_std_mult': 0.7259454277798187, 'bull_rsi_os': 29, 'bull_rsi_ob': 55, 'bull_adx_thresh': 7.186682193031791, 'bull_atr_min_pct': 0.014886093210323003, 'bull_atr_max_pct': 0.08979594017472552, 'bull_tp_mult': 2.9394114014421793, 'bull_tsl_mult': 0.40838440730087333, 'bull_time_stop': 198, 'bull_use_sma': True, 'bull_use_ema': False, 'bull_use_atr': False, 'bull_use_adx': False, 'bull_use_spike': False, 'bull_rsi_required': True, 'bear_strategy': 'mean_reversion', 'bear_bb_std_mult': 1.790542397737492, 'bear_rsi_os': 10, 'bear_rsi_ob': 61, 'bear_adx_thresh': 23.286512628452552, 'bear_atr_min_pct': 0.004600618108807256, 'bear_atr_max_pct': 0.08277042742320698, 'bear_tp_mult': 1.498487639083807, 'bear_tsl_mult': 0.4947967492963069, 'bear_time_stop': 12, 'bear_use_sma': True, 'bear_use_ema': False, 'bear_use_atr': False, 'bear_use_adx': False, 'bear_use_spike': False, 'bear_rsi_required': False, 'sideways_strategy': 'mean_reversion', 'sideways_bb_std_mult': 0.9752811627903503, 'sideways_rsi_os': 50, 'sideways_rsi_ob': 95, 'sideways_adx_thresh': 9.849656328010491, 'sideways_atr_min_pct': 0.016989100440688975, 'sideways_atr_max_pct': 0.0729825906285599, 'sideways_tp_mult': 2.742447999463123, 'sideways_tsl_mult': 0.7904218497078405, 'sideways_time_stop': 247, 'sideways_use_sma': True, 'sideways_use_ema': True, 'sideways_use_atr': False, 'sideways_use_adx': True, 'sideways_use_spike': False, 'sideways_rsi_required': False}.
