[I 2025-09-01 10:23:04,007] Trial 468 finished with values: [-0.03818993433561868, 0.037982316799522686] and parameters: {'p_sma': 34, 'p_std': 49, 'p_atr': 12, 'p_adx': 23, 'rsi_period': 30, 'ema1': 22, 'ema2': 10, 'slip_atr_k': 0.011380019073024803, 'slip_spread_k': 0.7481757568368387, 'spread_hl_frac': 0.02456783027335136, 'bb_std_mult': 1.2141057874070118, 'rsi_os': 19, 'rsi_ob': 61, 'vol_spike': 0.0832912045481702, 'adx_thresh': 24.750403357187107, 'atr_min_pct': 0.017894445653999058, 'atr_max_pct': 0.027921005423832843, 'tp_mult': 1.4976499480770036, 'tsl_mult': 0.03774832074767663, 'strategy': 'breakout', 'time_stop': 147, 'use_sma': True, 'use_atr': False, 'use_adx': True, 'use_ema': True, 'use_spike': False, 'rsi_required': True, 'edge_k': 1.4273706648527942, 'edge_cap': 0.3291760991972802, 'bull_strategy': 'mean_reversion', 'bull_bb_std_mult': 1.0268633148565827, 'bull_rsi_os': 13, 'bull_rsi_ob': 68, 'bull_adx_thresh': 8.564785896579329, 'bull_atr_min_pct': 5.704711509933562e-05, 'bull_atr_max_pct': 0.010238109968306416, 'bull_tp_mult': 1.4209594075846803, 'bull_tsl_mult': 0.48368051093892106, 'bull_time_stop': 256, 'bull_use_sma': True, 'bull_use_ema': False, 'bull_use_atr': True, 'bull_use_adx': False, 'bull_use_spike': False, 'bull_rsi_required': True, 'bear_strategy': 'breakout', 'bear_bb_std_mult': 1.482150860600518, 'bear_rsi_os': 17, 'bear_rsi_ob': 79, 'bear_adx_thresh': 29.10766797539186, 'bear_atr_min_pct': 0.0021219756070694233, 'bear_atr_max_pct': 0.14463246698343854, 'bear_tp_mult': 1.4123346381026605, 'bear_tsl_mult': 0.40315552848614455, 'bear_time_stop': 250, 'bear_use_sma': True, 'bear_use_ema': False, 'bear_use_atr': True, 'bear_use_adx': True, 'bear_use_spike': False, 'bear_rsi_required': False, 'sideways_strategy': 'breakout', 'sideways_bb_std_mult': 0.774117342346109, 'sideways_rsi_os': 55, 'sideways_rsi_ob': 95, 'sideways_adx_thresh': 24.569529977984654, 'sideways_atr_min_pct': 0.006769853634660761, 'sideways_atr_max_pct': 0.06112248536259408, 'sideways_tp_mult': 2.1709110730445507, 'sideways_tsl_mult': 0.39744961701387554, 'sideways_time_stop': 266, 'sideways_use_sma': True, 'sideways_use_ema': False, 'sideways_use_atr': False, 'sideways_use_adx': True, 'sideways_use_spike': False, 'sideways_rsi_required': True}.
[I 2025-09-01 10:23:04,655] Trial 470 finished with values: [-0.01981734573620486, 0.019694906697948794] and parameters: {'p_sma': 17, 'p_std': 50, 'p_atr': 15, 'p_adx': 23, 'rsi_period': 30, 'ema1': 18, 'ema2': 11, 'slip_atr_k': 0.010136358972425694, 'slip_spread_k': 0.7422827451848533, 'spread_hl_frac': 0.02463606527238682, 'bb_std_mult': 1.1843278550619578, 'rsi_os': 19, 'rsi_ob': 60, 'vol_spike': 0.08550835837770726, 'adx_thresh': 24.74137874926714, 'atr_min_pct': 0.015164581498883712, 'atr_max_pct': 0.023662937468229464, 'tp_mult': 1.4994244103936494, 'tsl_mult': 0.14672377155474126, 'strategy': 'breakout', 'time_stop': 152, 'use_sma': True, 'use_atr': False, 'use_adx': True, 'use_ema': True, 'use_spike': False, 'rsi_required': True, 'edge_k': 1.3658439470228843, 'edge_cap': 0.32297102221721347, 'bull_strategy': 'mean_reversion', 'bull_bb_std_mult': 0.6513144480158721, 'bull_rsi_os': 14, 'bull_rsi_ob': 69, 'bull_adx_thresh': 8.505471469257929, 'bull_atr_min_pct': 3.1546897626495566e-05, 'bull_atr_max_pct': 0.01182361720498045, 'bull_tp_mult': 1.3730929282200535, 'bull_tsl_mult': 0.484155248496282, 'bull_time_stop': 256, 'bull_use_sma': True, 'bull_use_ema': False, 'bull_use_atr': True, 'bull_use_adx': False, 'bull_use_spike': False, 'bull_rsi_required': True, 'bear_strategy': 'breakout', 'bear_bb_std_mult': 1.1733806010456638, 'bear_rsi_os': 17, 'bear_rsi_ob': 79, 'bear_adx_thresh': 29.453170679531926, 'bear_atr_min_pct': 0.0021980946027785864, 'bear_atr_max_pct': 0.1450256640307786, 'bear_tp_mult': 1.4066786150284285, 'bear_tsl_mult': 0.42287910481470853, 'bear_time_stop': 253, 'bear_use_sma': True, 'bear_use_ema': False, 'bear_use_atr': True, 'bear_use_adx': True, 'bear_use_spike': False, 'bear_rsi_required': False, 'sideways_strategy': 'breakout', 'sideways_bb_std_mult': 0.7562746541670536, 'sideways_rsi_os': 55, 'sideways_rsi_ob': 95, 'sideways_adx_thresh': 24.53048837715958, 'sideways_atr_min_pct': 0.006785387991803352, 'sideways_atr_max_pct': 0.06302119818164077, 'sideways_tp_mult': 2.171939627928457, 'sideways_tsl_mult': 0.4147239235729388, 'sideways_time_stop': 264, 'sideways_use_sma': True, 'sideways_use_ema': False, 'sideways_use_atr': False, 'sideways_use_adx': True, 'sideways_use_spike': False, 'sideways_rsi_required': True}.
[I 2025-09-01 10:23:05,703] Trial 469 finished with values: [-0.019838298238613605, 0.019716319094335882] and parameters: {'p_sma': 17, 'p_std': 50, 'p_atr': 15, 'p_adx': 23, 'rsi_period': 30, 'ema1': 10, 'ema2': 11, 'slip_atr_k': 0.006890702249871235, 'slip_spread_k': 0.7419805197011382, 'spread_hl_frac': 0.025809818678642325, 'bb_std_mult': 1.1949493126515358, 'rsi_os': 19, 'rsi_ob': 61, 'vol_spike': 0.08372129461138036, 'adx_thresh': 24.953945258158946, 'atr_min_pct': 0.015176726490091608, 'atr_max_pct': 0.02641809516776923, 'tp_mult': 1.7920655872610567, 'tsl_mult': 0.027693413386053356, 'strategy': 'breakout', 'time_stop': 150, 'use_sma': True, 'use_atr': False, 'use_adx': True, 'use_ema': True, 'use_spike': False, 'rsi_required': True, 'edge_k': 1.390077289816464, 'edge_cap': 0.3163005107351488, 'bull_strategy': 'mean_reversion', 'bull_bb_std_mult': 1.0176486773571216, 'bull_rsi_os': 13, 'bull_rsi_ob': 71, 'bull_adx_thresh': 8.52671995202137, 'bull_atr_min_pct': 0.00011795335142500437, 'bull_atr_max_pct': 0.010186681165861012, 'bull_tp_mult': 1.4133081164020733, 'bull_tsl_mult': 0.4828315031644628, 'bull_time_stop': 255, 'bull_use_sma': True, 'bull_use_ema': False, 'bull_use_atr': True, 'bull_use_adx': False, 'bull_use_spike': False, 'bull_rsi_required': True, 'bear_strategy': 'breakout', 'bear_bb_std_mult': 1.4594633098605196, 'bear_rsi_os': 17, 'bear_rsi_ob': 78, 'bear_adx_thresh': 29.270389745876535, 'bear_atr_min_pct': 0.0019210818447335685, 'bear_atr_max_pct': 0.14349925793325277, 'bear_tp_mult': 1.3917953248556472, 'bear_tsl_mult': 0.416670909363951, 'bear_time_stop': 253, 'bear_use_sma': True, 'bear_use_ema': False, 'bear_use_atr': True, 'bear_use_adx': True, 'bear_use_spike': False, 'bear_rsi_required': False, 'sideways_strategy': 'breakout', 'sideways_bb_std_mult': 0.7526520812897706, 'sideways_rsi_os': 55, 'sideways_rsi_ob': 95, 'sideways_adx_thresh': 24.377573580061487, 'sideways_atr_min_pct': 0.006816504641155928, 'sideways_atr_max_pct': 0.057939908477930326, 'sideways_tp_mult': 2.1637066688268396, 'sideways_tsl_mult': 0.394712561327366, 'sideways_time_stop': 266, 'sideways_use_sma': True, 'sideways_use_ema': False, 'sideways_use_atr': False, 'sideways_use_adx': True, 'sideways_use_spike': False, 'sideways_rsi_required': True}.
[I 2025-09-01 10:23:05,714] Trial 471 finished with values: [-0.032686405126561624, 0.0324777843212527] and parameters: {'p_sma': 27, 'p_std': 50, 'p_atr': 15, 'p_adx': 23, 'rsi_period': 30, 'ema1': 18, 'ema2': 11, 'slip_atr_k': 0.009497887407726212, 'slip_spread_k': 0.7420895519773545, 'spread_hl_frac': 0.02507170201385104, 'bb_std_mult': 1.2061559180895896, 'rsi_os': 19, 'rsi_ob': 61, 'vol_spike': 0.08460207692133478, 'adx_thresh': 24.896793235998956, 'atr_min_pct': 0.015217894930368488, 'atr_max_pct': 0.03584868949239839, 'tp_mult': 1.8033444659951703, 'tsl_mult': 0.1393893553772417, 'strategy': 'breakout', 'time_stop': 145, 'use_sma': True, 'use_atr': False, 'use_adx': True, 'use_ema': True, 'use_spike': False, 'rsi_required': True, 'edge_k': 1.393504517193558, 'edge_cap': 0.3228071458306221, 'bull_strategy': 'mean_reversion', 'bull_bb_std_mult': 1.027737589474829, 'bull_rsi_os': 14, 'bull_rsi_ob': 69, 'bull_adx_thresh': 8.715374735575516, 'bull_atr_min_pct': 0.00011236866235671015, 'bull_atr_max_pct': 0.01002234713466997, 'bull_tp_mult': 1.3759429947626525, 'bull_tsl_mult': 0.47713787629811966, 'bull_time_stop': 256, 'bull_use_sma': True, 'bull_use_ema': False, 'bull_use_atr': True, 'bull_use_adx': False, 'bull_use_spike': False, 'bull_rsi_required': True, 'bear_strategy': 'breakout', 'bear_bb_std_mult': 1.1584290301098814, 'bear_rsi_os': 17, 'bear_rsi_ob': 79, 'bear_adx_thresh': 29.27428991946645, 'bear_atr_min_pct': 0.0020333089660624273, 'bear_atr_max_pct': 0.1453199969700437, 'bear_tp_mult': 1.4002013423580608, 'bear_tsl_mult': 0.42212407348089914, 'bear_time_stop': 249, 'bear_use_sma': True, 'bear_use_ema': False, 'bear_use_atr': True, 'bear_use_adx': True, 'bear_use_spike': False, 'bear_rsi_required': False, 'sideways_strategy': 'breakout', 'sideways_bb_std_mult': 0.7782811952017967, 'sideways_rsi_os': 55, 'sideways_rsi_ob': 95, 'sideways_adx_thresh': 24.271346176250788, 'sideways_atr_min_pct': 0.006846092572026087, 'sideways_atr_max_pct': 0.06065229353939297, 'sideways_tp_mult': 2.151548163650373, 'sideways_tsl_mult': 0.4091500865542766, 'sideways_time_stop': 267, 'sideways_use_sma': True, 'sideways_use_ema': False, 'sideways_use_atr': False, 'sideways_use_adx': True, 'sideways_use_spike': False, 'sideways_rsi_required': True}.
[I 2025-09-01 10:23:44,458] Trial 475 finished with values: [-0.01696875975878176, 0.01684709448607267] and parameters: {'p_sma': 17, 'p_std': 50, 'p_atr': 16, 'p_adx': 23, 'rsi_period': 31, 'ema1': 18, 'ema2': 12, 'slip_atr_k': 0.004097466583481382, 'slip_spread_k': 0.7350625681363581, 'spread_hl_frac': 0.024412535607331455, 'bb_std_mult': 1.2472143983216601, 'rsi_os': 18, 'rsi_ob': 59, 'vol_spike': 0.08032934535985074, 'adx_thresh': 25.326383832374276, 'atr_min_pct': 0.015254447875950013, 'atr_max_pct': 0.025532002764397994, 'tp_mult': 1.3994822779570215, 'tsl_mult': 0.06829461324143483, 'strategy': 'breakout', 'time_stop': 153, 'use_sma': True, 'use_atr': False, 'use_adx': False, 'use_ema': False, 'use_spike': False, 'rsi_required': True, 'edge_k': 1.3879579425593362, 'edge_cap': 0.3026374879155914, 'bull_strategy': 'mean_reversion', 'bull_bb_std_mult': 0.6748052237469221, 'bull_rsi_os': 15, 'bull_rsi_ob': 71, 'bull_adx_thresh': 9.486644059717973, 'bull_atr_min_pct': 1.1355781270085683e-06, 'bull_atr_max_pct': 0.012985587174744379, 'bull_tp_mult': 1.3624383895873928, 'bull_tsl_mult': 0.4808254107897805, 'bull_time_stop': 265, 'bull_use_sma': True, 'bull_use_ema': False, 'bull_use_atr': False, 'bull_use_adx': False, 'bull_use_spike': False, 'bull_rsi_required': True, 'bear_strategy': 'breakout', 'bear_bb_std_mult': 1.1828883226196836, 'bear_rsi_os': 16, 'bear_rsi_ob': 80, 'bear_adx_thresh': 28.315697425792752, 'bear_atr_min_pct': 0.002395154721031137, 'bear_atr_max_pct': 0.14684151613302918, 'bear_tp_mult': 1.3696044572611012, 'bear_tsl_mult': 0.43160570149984606, 'bear_time_stop': 256, 'bear_use_sma': True, 'bear_use_ema': False, 'bear_use_atr': True, 'bear_use_adx': True, 'bear_use_spike': True, 'bear_rsi_required': False, 'sideways_strategy': 'breakout', 'sideways_bb_std_mult': 0.7077626441236213, 'sideways_rsi_os': 55, 'sideways_rsi_ob': 95, 'sideways_adx_thresh': 24.67024648636953, 'sideways_atr_min_pct': 0.007320306149854811, 'sideways_atr_max_pct': 0.058568367196198984, 'sideways_tp_mult': 2.1026127017267, 'sideways_tsl_mult': 0.3863843569696322, 'sideways_time_stop': 261, 'sideways_use_sma': True, 'sideways_use_ema': False, 'sideways_use_atr': False, 'sideways_use_adx': True, 'sideways_use_spike': False, 'sideways_rsi_required': True}.
[I 2025-09-01 10:23:45,014] Trial 473 finished with values: [-0.01767138470734153, 0.017548964618521137] and parameters: {'p_sma': 17, 'p_std': 50, 'p_atr': 16, 'p_adx': 23, 'rsi_period': 31, 'ema1': 18, 'ema2': 11, 'slip_atr_k': 0.008348821882146222, 'slip_spread_k': 0.738528017033288, 'spread_hl_frac': 0.025009603500013855, 'bb_std_mult': 1.2341057264179882, 'rsi_os': 19, 'rsi_ob': 60, 'vol_spike': 0.0820175149411666, 'adx_thresh': 25.176000112334705, 'atr_min_pct': 0.015194699577059696, 'atr_max_pct': 0.038034476014111036, 'tp_mult': 1.4112482814099367, 'tsl_mult': 0.12361538645567695, 'strategy': 'breakout', 'time_stop': 153, 'use_sma': True, 'use_atr': False, 'use_adx': False, 'use_ema': True, 'use_spike': False, 'rsi_required': True, 'edge_k': 1.3911191039263144, 'edge_cap': 0.3072750343390496, 'bull_strategy': 'mean_reversion', 'bull_bb_std_mult': 0.8778152960925074, 'bull_rsi_os': 14, 'bull_rsi_ob': 71, 'bull_adx_thresh': 9.524407687010338, 'bull_atr_min_pct': 0.00015647127985460334, 'bull_atr_max_pct': 0.010079630811809358, 'bull_tp_mult': 1.3591701593986933, 'bull_tsl_mult': 0.47931995184022697, 'bull_time_stop': 258, 'bull_use_sma': True, 'bull_use_ema': False, 'bull_use_atr': True, 'bull_use_adx': False, 'bull_use_spike': False, 'bull_rsi_required': True, 'bear_strategy': 'breakout', 'bear_bb_std_mult': 1.2046345912726264, 'bear_rsi_os': 16, 'bear_rsi_ob': 80, 'bear_adx_thresh': 29.52858294812067, 'bear_atr_min_pct': 0.0023042881225065663, 'bear_atr_max_pct': 0.14582237362540526, 'bear_tp_mult': 1.379177724068008, 'bear_tsl_mult': 0.41744509880187175, 'bear_time_stop': 244, 'bear_use_sma': True, 'bear_use_ema': False, 'bear_use_atr': True, 'bear_use_adx': True, 'bear_use_spike': True, 'bear_rsi_required': False, 'sideways_strategy': 'breakout', 'sideways_bb_std_mult': 0.7258181134820678, 'sideways_rsi_os': 55, 'sideways_rsi_ob': 95, 'sideways_adx_thresh': 24.3410717521488, 'sideways_atr_min_pct': 0.007009644037165048, 'sideways_atr_max_pct': 0.059389529786979325, 'sideways_tp_mult': 2.1401030050805505, 'sideways_tsl_mult': 0.39169900391976026, 'sideways_time_stop': 263, 'sideways_use_sma': True, 'sideways_use_ema': False, 'sideways_use_atr': False, 'sideways_use_adx': True, 'sideways_use_spike': False, 'sideways_rsi_required': True}.
[I 2025-09-01 10:23:45,445] Trial 472 finished with values: [-0.017816260638456316, 0.0176943079791999] and parameters: {'p_sma': 17, 'p_std': 51, 'p_atr': 15, 'p_adx': 23, 'rsi_period': 31, 'ema1': 18, 'ema2': 11, 'slip_atr_k': 0.006180072094590103, 'slip_spread_k': 0.7409702722957685, 'spread_hl_frac': 0.024429172760484317, 'bb_std_mult': 1.1761296409672368, 'rsi_os': 18, 'rsi_ob': 60, 'vol_spike': 0.08703661975714236, 'adx_thresh': 25.094112852164, 'atr_min_pct': 0.015048019286587699, 'atr_max_pct': 0.03678131122992324, 'tp_mult': 1.7315722497464923, 'tsl_mult': 0.1471574053083558, 'strategy': 'breakout', 'time_stop': 214, 'use_sma': True, 'use_atr': False, 'use_adx': False, 'use_ema': True, 'use_spike': False, 'rsi_required': True, 'edge_k': 1.3948657150931054, 'edge_cap': 0.32122360547376494, 'bull_strategy': 'mean_reversion', 'bull_bb_std_mult': 0.6182521575867397, 'bull_rsi_os': 14, 'bull_rsi_ob': 71, 'bull_adx_thresh': 8.945346220819106, 'bull_atr_min_pct': 0.0001661370438455206, 'bull_atr_max_pct': 0.018710439291341738, 'bull_tp_mult': 1.3627982271542425, 'bull_tsl_mult': 0.4802885532130565, 'bull_time_stop': 251, 'bull_use_sma': True, 'bull_use_ema': False, 'bull_use_atr': True, 'bull_use_adx': False, 'bull_use_spike': False, 'bull_rsi_required': True, 'bear_strategy': 'breakout', 'bear_bb_std_mult': 1.2237527283466865, 'bear_rsi_os': 16, 'bear_rsi_ob': 79, 'bear_adx_thresh': 29.5004762432936, 'bear_atr_min_pct': 0.002293633414721408, 'bear_atr_max_pct': 0.1459747515806598, 'bear_tp_mult': 1.3440393567652043, 'bear_tsl_mult': 0.4209475486911499, 'bear_time_stop': 254, 'bear_use_sma': True, 'bear_use_ema': False, 'bear_use_atr': True, 'bear_use_adx': True, 'bear_use_spike': False, 'bear_rsi_required': False, 'sideways_strategy': 'breakout', 'sideways_bb_std_mult': 0.7940294597742383, 'sideways_rsi_os': 55, 'sideways_rsi_ob': 95, 'sideways_adx_thresh': 24.588418875124276, 'sideways_atr_min_pct': 0.007158723650786858, 'sideways_atr_max_pct': 0.059718438418076315, 'sideways_tp_mult': 2.148022785780421, 'sideways_tsl_mult': 0.3975300978886827, 'sideways_time_stop': 262, 'sideways_use_sma': True, 'sideways_use_ema': False, 'sideways_use_atr': False, 'sideways_use_adx': True, 'sideways_use_spike': False, 'sideways_rsi_required': True}.
[I 2025-09-01 10:23:45,934] Trial 474 finished with values: [-0.017125221588523032, 0.01700310105786172] and parameters: {'p_sma': 17, 'p_std': 51, 'p_atr': 16, 'p_adx': 23, 'rsi_period': 31, 'ema1': 18, 'ema2': 12, 'slip_atr_k': 0.0067384857001143, 'slip_spread_k': 0.7372906640953992, 'spread_hl_frac': 0.024325368229435165, 'bb_std_mult': 1.1870146349059434, 'rsi_os': 18, 'rsi_ob': 59, 'vol_spike': 0.08093478093164455, 'adx_thresh': 25.483428884746594, 'atr_min_pct': 0.015108769678373926, 'atr_max_pct': 0.04629681578125084, 'tp_mult': 1.3988870469308423, 'tsl_mult': 0.11710999689810268, 'strategy': 'breakout', 'time_stop': 153, 'use_sma': True, 'use_atr': False, 'use_adx': False, 'use_ema': False, 'use_spike': False, 'rsi_required': True, 'edge_k': 1.3850135726341164, 'edge_cap': 0.3047464536775063, 'bull_strategy': 'mean_reversion', 'bull_bb_std_mult': 0.5229605846808877, 'bull_rsi_os': 17, 'bull_rsi_ob': 71, 'bull_adx_thresh': 9.553270298883113, 'bull_atr_min_pct': 4.115566283886525e-05, 'bull_atr_max_pct': 0.012592201051583568, 'bull_tp_mult': 1.367752600906003, 'bull_tsl_mult': 0.4885662814451924, 'bull_time_stop': 263, 'bull_use_sma': True, 'bull_use_ema': False, 'bull_use_atr': False, 'bull_use_adx': False, 'bull_use_spike': False, 'bull_rsi_required': True, 'bear_strategy': 'breakout', 'bear_bb_std_mult': 1.189690958829456, 'bear_rsi_os': 16, 'bear_rsi_ob': 80, 'bear_adx_thresh': 28.506704783785786, 'bear_atr_min_pct': 0.0025616755408441184, 'bear_atr_max_pct': 0.14696229073786168, 'bear_tp_mult': 1.3777141619908393, 'bear_tsl_mult': 0.42362430661096084, 'bear_time_stop': 256, 'bear_use_sma': True, 'bear_use_ema': False, 'bear_use_atr': True, 'bear_use_adx': True, 'bear_use_spike': True, 'bear_rsi_required': False, 'sideways_strategy': 'breakout', 'sideways_bb_std_mult': 0.7347553672689314, 'sideways_rsi_os': 55, 'sideways_rsi_ob': 95, 'sideways_adx_thresh': 24.604989988534726, 'sideways_atr_min_pct': 0.00729917813221327, 'sideways_atr_max_pct': 0.061410906046869905, 'sideways_tp_mult': 2.1160379148355233, 'sideways_tsl_mult': 0.3888256544095726, 'sideways_time_stop': 262, 'sideways_use_sma': True, 'sideways_use_ema': False, 'sideways_use_atr': False, 'sideways_use_adx': True, 'sideways_use_spike': False, 'sideways_rsi_required': True}.
[I 2025-09-01 10:24:25,580] Trial 479 finished with values: [-0.01713090032584641, 0.017009737956634043] and parameters: {'p_sma': 17, 'p_std': 50, 'p_atr': 16, 'p_adx': 23, 'rsi_period': 34, 'ema1': 18, 'ema2': 12, 'slip_atr_k': 0.0011457382973792184, 'slip_spread_k': 0.7672690182375881, 'spread_hl_frac': 0.023890889783337484, 'bb_std_mult': 1.1445535864785894, 'rsi_os': 17, 'rsi_ob': 59, 'vol_spike': 0.07823105596255905, 'adx_thresh': 25.42539365141499, 'atr_min_pct': 0.015200323210167253, 'atr_max_pct': 0.02385284363494064, 'tp_mult': 1.3950178566724767, 'tsl_mult': 0.06555728574342992, 'strategy': 'breakout', 'time_stop': 153, 'use_sma': True, 'use_atr': False, 'use_adx': False, 'use_ema': False, 'use_spike': False, 'rsi_required': True, 'edge_k': 1.4782421206924803, 'edge_cap': 0.30313638732111736, 'bull_strategy': 'mean_reversion', 'bull_bb_std_mult': 0.6317119625956323, 'bull_rsi_os': 14, 'bull_rsi_ob': 71, 'bull_adx_thresh': 9.773258975427165, 'bull_atr_min_pct': 0.00019661691982781208, 'bull_atr_max_pct': 0.01340148728117948, 'bull_tp_mult': 1.341876329776075, 'bull_tsl_mult': 0.5193192966329161, 'bull_time_stop': 267, 'bull_use_sma': True, 'bull_use_ema': False, 'bull_use_atr': False, 'bull_use_adx': False, 'bull_use_spike': False, 'bull_rsi_required': True, 'bear_strategy': 'breakout', 'bear_bb_std_mult': 1.2453016611904795, 'bear_rsi_os': 16, 'bear_rsi_ob': 80, 'bear_adx_thresh': 27.22942640452712, 'bear_atr_min_pct': 0.0024739286882308944, 'bear_atr_max_pct': 0.1475423456459756, 'bear_tp_mult': 1.4303373614419, 'bear_tsl_mult': 0.396901452521355, 'bear_time_stop': 254, 'bear_use_sma': True, 'bear_use_ema': False, 'bear_use_atr': True, 'bear_use_adx': True, 'bear_use_spike': True, 'bear_rsi_required': False, 'sideways_strategy': 'breakout', 'sideways_bb_std_mult': 0.6417762957436575, 'sideways_rsi_os': 55, 'sideways_rsi_ob': 95, 'sideways_adx_thresh': 26.319320629344126, 'sideways_atr_min_pct': 0.0063243679147713195, 'sideways_atr_max_pct': 0.05634397145357527, 'sideways_tp_mult': 2.0907559893280867, 'sideways_tsl_mult': 0.36550093478846396, 'sideways_time_stop': 261, 'sideways_use_sma': False, 'sideways_use_ema': False, 'sideways_use_atr': False, 'sideways_use_adx': True, 'sideways_use_spike': False, 'sideways_rsi_required': True}.
