[I 2025-09-01 10:18:15,835] Trial 443 finished with values: [-1000000000.0, 1000000000.0] and parameters: {'p_sma': 32, 'p_std': 27, 'p_atr': 29, 'p_adx': 15, 'rsi_period': 26, 'ema1': 22, 'ema2': 18, 'slip_atr_k': 0.020698724159797163, 'slip_spread_k': 0.6129789031123835, 'spread_hl_frac': 0.029278587022082612, 'bb_std_mult': 1.3271587557152194, 'rsi_os': 51, 'rsi_ob': 66, 'vol_spike': 0.1417634926528385, 'adx_thresh': 31.61741685007511, 'atr_min_pct': 0.012660076447850341, 'atr_max_pct': 0.11840930128232392, 'tp_mult': 1.0839611118036032, 'tsl_mult': 0.7376770072722972, 'strategy': 'mean_reversion', 'time_stop': 245, 'use_sma': False, 'use_atr': True, 'use_adx': False, 'use_ema': True, 'use_spike': True, 'rsi_required': True, 'edge_k': 1.2671526210906783, 'edge_cap': 0.8995278996604392, 'bull_strategy': 'breakout', 'bull_bb_std_mult': 1.4609350255000244, 'bull_rsi_os': 44, 'bull_rsi_ob': 65, 'bull_adx_thresh': 11.268026010534046, 'bull_atr_min_pct': 0.0013027209330684303, 'bull_atr_max_pct': 0.08538151125618254, 'bull_tp_mult': 2.956824819972039, 'bull_tsl_mult': 0.2767218196631965, 'bull_time_stop': 260, 'bull_use_sma': True, 'bull_use_ema': True, 'bull_use_atr': True, 'bull_use_adx': False, 'bull_use_spike': False, 'bull_rsi_required': True, 'bear_strategy': 'mean_reversion', 'bear_bb_std_mult': 2.5296142783090936, 'bear_rsi_os': 54, 'bear_rsi_ob': 75, 'bear_adx_thresh': 24.173647945058722, 'bear_atr_min_pct': 0.005090843700891327, 'bear_atr_max_pct': 0.06387214600719426, 'bear_tp_mult': 1.734915041688041, 'bear_tsl_mult': 0.4776499487822108, 'bear_time_stop': 291, 'bear_use_sma': True, 'bear_use_ema': True, 'bear_use_atr': True, 'bear_use_adx': False, 'bear_use_spike': False, 'bear_rsi_required': False, 'sideways_strategy': 'mean_reversion', 'sideways_bb_std_mult': 0.6643159535587491, 'sideways_rsi_os': 51, 'sideways_rsi_ob': 70, 'sideways_adx_thresh': 23.32782550870068, 'sideways_atr_min_pct': 0.014982112640470295, 'sideways_atr_max_pct': 0.03438840616932415, 'sideways_tp_mult': 1.4547928172395916, 'sideways_tsl_mult': 0.4602935795910757, 'sideways_time_stop': 119, 'sideways_use_sma': True, 'sideways_use_ema': False, 'sideways_use_atr': True, 'sideways_use_adx': True, 'sideways_use_spike': False, 'sideways_rsi_required': False}.
[I 2025-09-01 10:18:53,310] Trial 439 finished with values: [-1000000000.0, 1000000000.0] and parameters: {'p_sma': 18, 'p_std': 43, 'p_atr': 19, 'p_adx': 25, 'rsi_period': 84, 'ema1': 23, 'ema2': 36, 'slip_atr_k': 0.09914424280419555, 'slip_spread_k': 0.6391523395187265, 'spread_hl_frac': 0.029537518079304645, 'bb_std_mult': 1.650240509191815, 'rsi_os': 41, 'rsi_ob': 69, 'vol_spike': 0.10910163920874268, 'adx_thresh': 32.68049022680861, 'atr_min_pct': 0.006060705477850449, 'atr_max_pct': 0.13377787935770902, 'tp_mult': 1.0842243309132016, 'tsl_mult': 0.7143123819386382, 'strategy': 'mean_reversion', 'time_stop': 254, 'use_sma': False, 'use_atr': False, 'use_adx': False, 'use_ema': True, 'use_spike': True, 'rsi_required': False, 'edge_k': 1.204222087387547, 'edge_cap': 0.6660650916426206, 'bull_strategy': 'breakout', 'bull_bb_std_mult': 3.5405327925472707, 'bull_rsi_os': 22, 'bull_rsi_ob': 80, 'bull_adx_thresh': 10.897932398019574, 'bull_atr_min_pct': 0.023602328749125726, 'bull_atr_max_pct': 0.138511445672161, 'bull_tp_mult': 2.950515307701346, 'bull_tsl_mult': 0.412256120960621, 'bull_time_stop': 285, 'bull_use_sma': False, 'bull_use_ema': True, 'bull_use_atr': True, 'bull_use_adx': True, 'bull_use_spike': True, 'bull_rsi_required': False, 'bear_strategy': 'mean_reversion', 'bear_bb_std_mult': 0.9853613405826421, 'bear_rsi_os': 45, 'bear_rsi_ob': 74, 'bear_adx_thresh': 18.269721212926203, 'bear_atr_min_pct': 0.006089990074395954, 'bear_atr_max_pct': 0.07249546032837614, 'bear_tp_mult': 1.2380242618614388, 'bear_tsl_mult': 0.4378878699233292, 'bear_time_stop': 242, 'bear_use_sma': False, 'bear_use_ema': True, 'bear_use_atr': True, 'bear_use_adx': False, 'bear_use_spike': False, 'bear_rsi_required': True, 'sideways_strategy': 'mean_reversion', 'sideways_bb_std_mult': 0.8365694604249327, 'sideways_rsi_os': 51, 'sideways_rsi_ob': 88, 'sideways_adx_thresh': 24.06214121675804, 'sideways_atr_min_pct': 0.008665201077091766, 'sideways_atr_max_pct': 0.07026412163643138, 'sideways_tp_mult': 2.460201167346492, 'sideways_tsl_mult': 0.4177825545577063, 'sideways_time_stop': 100, 'sideways_use_sma': True, 'sideways_use_ema': False, 'sideways_use_atr': True, 'sideways_use_adx': False, 'sideways_use_spike': True, 'sideways_rsi_required': False}.
[I 2025-09-01 10:18:53,740] Trial 442 finished with values: [-0.038396001670462976, 0.0381573306798871] and parameters: {'p_sma': 32, 'p_std': 43, 'p_atr': 17, 'p_adx': 15, 'rsi_period': 26, 'ema1': 12, 'ema2': 18, 'slip_atr_k': 0.09966811488777474, 'slip_spread_k': 0.7692474994605445, 'spread_hl_frac': 0.028623460957386312, 'bb_std_mult': 1.2942764740660158, 'rsi_os': 41, 'rsi_ob': 66, 'vol_spike': 0.16088009904699832, 'adx_thresh': 31.678649080774164, 'atr_min_pct': 0.01279580128936412, 'atr_max_pct': 0.11854267489435684, 'tp_mult': 2.8692877385158626, 'tsl_mult': 0.29021934510707836, 'strategy': 'mean_reversion', 'time_stop': 232, 'use_sma': False, 'use_atr': True, 'use_adx': False, 'use_ema': True, 'use_spike': True, 'rsi_required': True, 'edge_k': 0.09744325417168331, 'edge_cap': 0.8950471035912106, 'bull_strategy': 'breakout', 'bull_bb_std_mult': 1.4788989610848933, 'bull_rsi_os': 44, 'bull_rsi_ob': 48, 'bull_adx_thresh': 10.960480470016304, 'bull_atr_min_pct': 0.0015537227581142708, 'bull_atr_max_pct': 0.08659112205330524, 'bull_tp_mult': 2.8805098340446644, 'bull_tsl_mult': 0.41142665021953695, 'bull_time_stop': 215, 'bull_use_sma': False, 'bull_use_ema': True, 'bull_use_atr': True, 'bull_use_adx': False, 'bull_use_spike': False, 'bull_rsi_required': True, 'bear_strategy': 'mean_reversion', 'bear_bb_std_mult': 3.1258743272097833, 'bear_rsi_os': 54, 'bear_rsi_ob': 88, 'bear_adx_thresh': 24.04497103806159, 'bear_atr_min_pct': 0.02320711642540424, 'bear_atr_max_pct': 0.06319890962263461, 'bear_tp_mult': 1.3496425732123511, 'bear_tsl_mult': 0.5351746046554163, 'bear_time_stop': 292, 'bear_use_sma': False, 'bear_use_ema': True, 'bear_use_atr': True, 'bear_use_adx': False, 'bear_use_spike': False, 'bear_rsi_required': True, 'sideways_strategy': 'mean_reversion', 'sideways_bb_std_mult': 0.8506995774179917, 'sideways_rsi_os': 51, 'sideways_rsi_ob': 87, 'sideways_adx_thresh': 5.059101883543736, 'sideways_atr_min_pct': 0.009727021620672828, 'sideways_atr_max_pct': 0.07813381769160989, 'sideways_tp_mult': 2.451703351413486, 'sideways_tsl_mult': 0.4172040258015576, 'sideways_time_stop': 131, 'sideways_use_sma': True, 'sideways_use_ema': False, 'sideways_use_atr': True, 'sideways_use_adx': True, 'sideways_use_spike': True, 'sideways_rsi_required': False}.
[I 2025-09-01 10:18:55,345] Trial 444 finished with values: [-0.04848930282573016, 0.0483299292932874] and parameters: {'p_sma': 23, 'p_std': 40, 'p_atr': 22, 'p_adx': 7, 'rsi_period': 75, 'ema1': 29, 'ema2': 18, 'slip_atr_k': 0.10116580766851657, 'slip_spread_k': 0.6194987998198735, 'spread_hl_frac': 0.029695279170401975, 'bb_std_mult': 1.1346751287295473, 'rsi_os': 43, 'rsi_ob': 68, 'vol_spike': 0.1425988528057008, 'adx_thresh': 20.05026876898471, 'atr_min_pct': 0.01864597338444898, 'atr_max_pct': 0.13193749792466453, 'tp_mult': 2.8685881170376275, 'tsl_mult': 0.7369357245795803, 'strategy': 'breakout', 'time_stop': 245, 'use_sma': True, 'use_atr': True, 'use_adx': False, 'use_ema': True, 'use_spike': True, 'rsi_required': True, 'edge_k': 1.2683069941260599, 'edge_cap': 0.6606500745635674, 'bull_strategy': 'mean_reversion', 'bull_bb_std_mult': 0.8129238633613529, 'bull_rsi_os': 46, 'bull_rsi_ob': 90, 'bull_adx_thresh': 7.801514384214175, 'bull_atr_min_pct': 0.0014051241770200427, 'bull_atr_max_pct': 0.014339716971205174, 'bull_tp_mult': 1.9412631093630848, 'bull_tsl_mult': 0.4223684909521736, 'bull_time_stop': 259, 'bull_use_sma': True, 'bull_use_ema': False, 'bull_use_atr': True, 'bull_use_adx': False, 'bull_use_spike': False, 'bull_rsi_required': True, 'bear_strategy': 'breakout', 'bear_bb_std_mult': 1.0400173119309255, 'bear_rsi_os': 54, 'bear_rsi_ob': 76, 'bear_adx_thresh': 18.35349130921864, 'bear_atr_min_pct': 0.00519984133322237, 'bear_atr_max_pct': 0.02895283458464579, 'bear_tp_mult': 1.745330679790168, 'bear_tsl_mult': 0.5066347766966103, 'bear_time_stop': 101, 'bear_use_sma': True, 'bear_use_ema': False, 'bear_use_atr': True, 'bear_use_adx': False, 'bear_use_spike': False, 'bear_rsi_required': False, 'sideways_strategy': 'mean_reversion', 'sideways_bb_std_mult': 0.6856967543550673, 'sideways_rsi_os': 10, 'sideways_rsi_ob': 93, 'sideways_adx_thresh': 23.017839158691576, 'sideways_atr_min_pct': 0.014973493527969109, 'sideways_atr_max_pct': 0.10910184091442644, 'sideways_tp_mult': 2.370504800860809, 'sideways_tsl_mult': 0.46427166509463785, 'sideways_time_stop': 135, 'sideways_use_sma': True, 'sideways_use_ema': False, 'sideways_use_atr': False, 'sideways_use_adx': True, 'sideways_use_spike': False, 'sideways_rsi_required': True}.
[I 2025-09-01 10:18:58,049] Trial 445 finished with values: [-1000000000.0, 1000000000.0] and parameters: {'p_sma': 41, 'p_std': 40, 'p_atr': 17, 'p_adx': 25, 'rsi_period': 75, 'ema1': 17, 'ema2': 17, 'slip_atr_k': 0.05677163586239624, 'slip_spread_k': 0.6606106136944296, 'spread_hl_frac': 0.03001075203917098, 'bb_std_mult': 1.7043922840666723, 'rsi_os': 17, 'rsi_ob': 69, 'vol_spike': 0.25442856431117855, 'adx_thresh': 19.993516398139466, 'atr_min_pct': 0.0017186500544586827, 'atr_max_pct': 0.14479294585914987, 'tp_mult': 1.1465419053613612, 'tsl_mult': 0.20741108202993613, 'strategy': 'breakout', 'time_stop': 238, 'use_sma': True, 'use_atr': False, 'use_adx': False, 'use_ema': True, 'use_spike': False, 'rsi_required': True, 'edge_k': 1.356357517754804, 'edge_cap': 0.05047620209139181, 'bull_strategy': 'mean_reversion', 'bull_bb_std_mult': 3.4775058048903316, 'bull_rsi_os': 46, 'bull_rsi_ob': 90, 'bull_adx_thresh': 9.113670423689396, 'bull_atr_min_pct': 0.020250255731622327, 'bull_atr_max_pct': 0.08955621830081369, 'bull_tp_mult': 2.922233347584177, 'bull_tsl_mult': 0.3770793324529018, 'bull_time_stop': 237, 'bull_use_sma': True, 'bull_use_ema': False, 'bull_use_atr': True, 'bull_use_adx': False, 'bull_use_spike': False, 'bull_rsi_required': True, 'bear_strategy': 'breakout', 'bear_bb_std_mult': 3.159186059569721, 'bear_rsi_os': 50, 'bear_rsi_ob': 77, 'bear_adx_thresh': 22.710984056910426, 'bear_atr_min_pct': 0.005726931711225504, 'bear_atr_max_pct': 0.10255629864261576, 'bear_tp_mult': 1.8538471301560604, 'bear_tsl_mult': 0.007256117934131945, 'bear_time_stop': 153, 'bear_use_sma': True, 'bear_use_ema': False, 'bear_use_atr': True, 'bear_use_adx': False, 'bear_use_spike': False, 'bear_rsi_required': False, 'sideways_strategy': 'mean_reversion', 'sideways_bb_std_mult': 0.8953368404885922, 'sideways_rsi_os': 19, 'sideways_rsi_ob': 88, 'sideways_adx_thresh': 32.87105356923456, 'sideways_atr_min_pct': 0.00964801214359963, 'sideways_atr_max_pct': 0.13903678337032604, 'sideways_tp_mult': 2.4017001411215952, 'sideways_tsl_mult': 0.41501908950909816, 'sideways_time_stop': 138, 'sideways_use_sma': True, 'sideways_use_ema': False, 'sideways_use_atr': False, 'sideways_use_adx': True, 'sideways_use_spike': False, 'sideways_rsi_required': True}.
[I 2025-09-01 10:19:38,173] Trial 447 finished with values: [-0.05151059458449925, 0.05202275149715143] and parameters: {'p_sma': 23, 'p_std': 10, 'p_atr': 18, 'p_adx': 26, 'rsi_period': 52, 'ema1': 17, 'ema2': 17, 'slip_atr_k': 0.05754791588863466, 'slip_spread_k': 0.6613839719226842, 'spread_hl_frac': 0.049791583944815344, 'bb_std_mult': 1.5459526325934942, 'rsi_os': 32, 'rsi_ob': 68, 'vol_spike': 0.12815137593337989, 'adx_thresh': 17.404730847514756, 'atr_min_pct': 0.004038826955694673, 'atr_max_pct': 0.14557813434035352, 'tp_mult': 1.205128009271957, 'tsl_mult': 0.6925495899775104, 'strategy': 'breakout', 'time_stop': 271, 'use_sma': True, 'use_atr': False, 'use_adx': False, 'use_ema': False, 'use_spike': False, 'rsi_required': True, 'edge_k': 1.7208824415447848, 'edge_cap': 0.571829739836924, 'bull_strategy': 'mean_reversion', 'bull_bb_std_mult': 2.7333870951642916, 'bull_rsi_os': 46, 'bull_rsi_ob': 46, 'bull_adx_thresh': 9.06795971912362, 'bull_atr_min_pct': 0.003566158810821422, 'bull_atr_max_pct': 0.0902770078489035, 'bull_tp_mult': 1.092271296251114, 'bull_tsl_mult': 0.3728158811573632, 'bull_time_stop': 174, 'bull_use_sma': True, 'bull_use_ema': False, 'bull_use_atr': True, 'bull_use_adx': False, 'bull_use_spike': False, 'bull_rsi_required': True, 'bear_strategy': 'breakout', 'bear_bb_std_mult': 3.0465100154753815, 'bear_rsi_os': 53, 'bear_rsi_ob': 77, 'bear_adx_thresh': 5.144484494509378, 'bear_atr_min_pct': 0.005451443682104148, 'bear_atr_max_pct': 0.10298162141454308, 'bear_tp_mult': 1.2818980315263855, 'bear_tsl_mult': 0.5026305269333207, 'bear_time_stop': 300, 'bear_use_sma': True, 'bear_use_ema': False, 'bear_use_atr': True, 'bear_use_adx': True, 'bear_use_spike': False, 'bear_rsi_required': False, 'sideways_strategy': 'breakout', 'sideways_bb_std_mult': 0.7448837467104162, 'sideways_rsi_os': 16, 'sideways_rsi_ob': 72, 'sideways_adx_thresh': 20.16673566167673, 'sideways_atr_min_pct': 0.010506773765564872, 'sideways_atr_max_pct': 0.05674494463777475, 'sideways_tp_mult': 2.36659411359352, 'sideways_tsl_mult': 0.4876329913324085, 'sideways_time_stop': 139, 'sideways_use_sma': True, 'sideways_use_ema': False, 'sideways_use_atr': False, 'sideways_use_adx': True, 'sideways_use_spike': False, 'sideways_rsi_required': True}.
[I 2025-09-01 10:19:38,745] Trial 446 finished with values: [-1000000000.0, 1000000000.0] and parameters: {'p_sma': 14, 'p_std': 45, 'p_atr': 23, 'p_adx': 24, 'rsi_period': 25, 'ema1': 17, 'ema2': 17, 'slip_atr_k': 0.1406763328499793, 'slip_spread_k': 0.770684314172244, 'spread_hl_frac': 0.032155391471024725, 'bb_std_mult': 1.5906415800777274, 'rsi_os': 44, 'rsi_ob': 71, 'vol_spike': 0.2537153890425851, 'adx_thresh': 28.034086476964582, 'atr_min_pct': 0.002015137445713612, 'atr_max_pct': 0.1450689077223888, 'tp_mult': 1.903093542585544, 'tsl_mult': 0.693139665659785, 'strategy': 'breakout', 'time_stop': 188, 'use_sma': True, 'use_atr': True, 'use_adx': False, 'use_ema': False, 'use_spike': False, 'rsi_required': True, 'edge_k': 0.23695127724098763, 'edge_cap': 0.5716400687944855, 'bull_strategy': 'mean_reversion', 'bull_bb_std_mult': 0.8105727651825572, 'bull_rsi_os': 32, 'bull_rsi_ob': 46, 'bull_adx_thresh': 21.40804398416757, 'bull_atr_min_pct': 2.5769605413309034e-05, 'bull_atr_max_pct': 0.01452697412512452, 'bull_tp_mult': 1.0337658420553688, 'bull_tsl_mult': 0.37711351520772596, 'bull_time_stop': 203, 'bull_use_sma': True, 'bull_use_ema': False, 'bull_use_atr': True, 'bull_use_adx': False, 'bull_use_spike': False, 'bull_rsi_required': True, 'bear_strategy': 'breakout', 'bear_bb_std_mult': 0.7746889719403085, 'bear_rsi_os': 38, 'bear_rsi_ob': 88, 'bear_adx_thresh': 10.39536225568627, 'bear_atr_min_pct': 0.00560238228447159, 'bear_atr_max_pct': 0.028172372266729116, 'bear_tp_mult': 1.0122139291692616, 'bear_tsl_mult': 0.017323147460680588, 'bear_time_stop': 293, 'bear_use_sma': True, 'bear_use_ema': False, 'bear_use_atr': True, 'bear_use_adx': True, 'bear_use_spike': False, 'bear_rsi_required': False, 'sideways_strategy': 'breakout', 'sideways_bb_std_mult': 0.9042543552923119, 'sideways_rsi_os': 55, 'sideways_rsi_ob': 75, 'sideways_adx_thresh': 22.843331142715414, 'sideways_atr_min_pct': 0.00969627020568457, 'sideways_atr_max_pct': 0.041257517219889295, 'sideways_tp_mult': 1.718936005952658, 'sideways_tsl_mult': 0.48609419018518, 'sideways_time_stop': 38, 'sideways_use_sma': True, 'sideways_use_ema': False, 'sideways_use_atr': False, 'sideways_use_adx': True, 'sideways_use_spike': False, 'sideways_rsi_required': True}.
[I 2025-09-01 10:19:39,744] Trial 448 finished with values: [-1000000000.0, 1000000000.0] and parameters: {'p_sma': 14, 'p_std': 50, 'p_atr': 16, 'p_adx': 24, 'rsi_period': 56, 'ema1': 17, 'ema2': 27, 'slip_atr_k': 0.1751302958251559, 'slip_spread_k': 0.7287684672768286, 'spread_hl_frac': 0.03204477287849205, 'bb_std_mult': 2.021403068601788, 'rsi_os': 24, 'rsi_ob': 71, 'vol_spike': 0.05935719902853529, 'adx_thresh': 21.967933410598082, 'atr_min_pct': 0.007696855091041883, 'atr_max_pct': 0.04256037848313999, 'tp_mult': 1.2124739628137542, 'tsl_mult': 0.6948532738253277, 'strategy': 'breakout', 'time_stop': 239, 'use_sma': True, 'use_atr': False, 'use_adx': False, 'use_ema': False, 'use_spike': False, 'rsi_required': True, 'edge_k': 0.7082891382935734, 'edge_cap': 0.5728078313800281, 'bull_strategy': 'mean_reversion', 'bull_bb_std_mult': 0.9575867398040756, 'bull_rsi_os': 48, 'bull_rsi_ob': 62, 'bull_adx_thresh': 29.648771941341387, 'bull_atr_min_pct': 0.02023814030937117, 'bull_atr_max_pct': 0.05691219637594498, 'bull_tp_mult': 1.2394583757467967, 'bull_tsl_mult': 0.8083674488601268, 'bull_time_stop': 136, 'bull_use_sma': True, 'bull_use_ema': False, 'bull_use_atr': True, 'bull_use_adx': False, 'bull_use_spike': False, 'bull_rsi_required': True, 'bear_strategy': 'breakout', 'bear_bb_std_mult': 2.641337916265504, 'bear_rsi_os': 53, 'bear_rsi_ob': 77, 'bear_adx_thresh': 10.41142302332719, 'bear_atr_min_pct': 0.00567817862789568, 'bear_atr_max_pct': 0.07898789873438483, 'bear_tp_mult': 2.6508692837540755, 'bear_tsl_mult': 0.4867183552146235, 'bear_time_stop': 154, 'bear_use_sma': True, 'bear_use_ema': False, 'bear_use_atr': True, 'bear_use_adx': True, 'bear_use_spike': False, 'bear_rsi_required': False, 'sideways_strategy': 'breakout', 'sideways_bb_std_mult': 3.183493165441118, 'sideways_rsi_os': 16, 'sideways_rsi_ob': 89, 'sideways_adx_thresh': 20.28202150043608, 'sideways_atr_min_pct': 0.0034281822554364655, 'sideways_atr_max_pct': 0.05714392634696553, 'sideways_tp_mult': 2.5000490352444027, 'sideways_tsl_mult': 0.48113899518571124, 'sideways_time_stop': 36, 'sideways_use_sma': True, 'sideways_use_ema': True, 'sideways_use_atr': False, 'sideways_use_adx': True, 'sideways_use_spike': False, 'sideways_rsi_required': True}.
[I 2025-09-01 10:19:40,297] Trial 449 finished with values: [-0.033497711509217876, 0.03319519194925854] and parameters: {'p_sma': 38, 'p_std': 10, 'p_atr': 18, 'p_adx': 26, 'rsi_period': 22, 'ema1': 18, 'ema2': 16, 'slip_atr_k': 0.060867469354047986, 'slip_spread_k': 0.7112330306067082, 'spread_hl_frac': 0.02117355794456342, 'bb_std_mult': 1.545501066847672, 'rsi_os': 49, 'rsi_ob': 71, 'vol_spike': 0.12681758641986357, 'adx_thresh': 33.982884192860496, 'atr_min_pct': 0.008001189007781576, 'atr_max_pct': 0.12536569774329495, 'tp_mult': 2.8023956976563547, 'tsl_mult': 0.5828685404378329, 'strategy': 'breakout', 'time_stop': 59, 'use_sma': True, 'use_atr': False, 'use_adx': False, 'use_ema': False, 'use_spike': False, 'rsi_required': True, 'edge_k': 1.139668374293077, 'edge_cap': 0.3808817504828497, 'bull_strategy': 'mean_reversion', 'bull_bb_std_mult': 3.5390663870769643, 'bull_rsi_os': 47, 'bull_rsi_ob': 62, 'bull_adx_thresh': 21.235242713073436, 'bull_atr_min_pct': 0.0035119178904232835, 'bull_atr_max_pct': 0.09027518954987034, 'bull_tp_mult': 1.649462837385312, 'bull_tsl_mult': 0.3367061222875757, 'bull_time_stop': 203, 'bull_use_sma': True, 'bull_use_ema': False, 'bull_use_atr': False, 'bull_use_adx': False, 'bull_use_spike': False, 'bull_rsi_required': True, 'bear_strategy': 'mean_reversion', 'bear_bb_std_mult': 2.985015092321941, 'bear_rsi_os': 31, 'bear_rsi_ob': 73, 'bear_adx_thresh': 13.443906462582202, 'bear_atr_min_pct': 0.006392018225810065, 'bear_atr_max_pct': 0.03517025890779343, 'bear_tp_mult': 1.4501530439265666, 'bear_tsl_mult': 0.17291478032902352, 'bear_time_stop': 112, 'bear_use_sma': True, 'bear_use_ema': False, 'bear_use_atr': False, 'bear_use_adx': True, 'bear_use_spike': False, 'bear_rsi_required': False, 'sideways_strategy': 'breakout', 'sideways_bb_std_mult': 0.76123784684711, 'sideways_rsi_os': 25, 'sideways_rsi_ob': 90, 'sideways_adx_thresh': 19.19296009802891, 'sideways_atr_min_pct': 0.003277091687308293, 'sideways_atr_max_pct': 0.0844872247986736, 'sideways_tp_mult': 2.5169280778470737, 'sideways_tsl_mult': 0.48114018557155525, 'sideways_time_stop': 38, 'sideways_use_sma': True, 'sideways_use_ema': True, 'sideways_use_atr': False, 'sideways_use_adx': True, 'sideways_use_spike': False, 'sideways_rsi_required': False}.
