[I 2025-09-01 10:08:18,984] Trial 376 finished with values: [-1000000000.0, 1000000000.0] and parameters: {'p_sma': 6, 'p_std': 39, 'p_atr': 26, 'p_adx': 25, 'rsi_period': 25, 'ema1': 18, 'ema2': 45, 'slip_atr_k': 0.03662694214796101, 'slip_spread_k': 0.7517723091290187, 'spread_hl_frac': 0.030419943444198835, 'bb_std_mult': 0.9215997464576637, 'rsi_os': 18, 'rsi_ob': 67, 'vol_spike': 0.14004751705356117, 'adx_thresh': 28.153700796601406, 'atr_min_pct': 0.017070378183554308, 'atr_max_pct': 0.14947631384104906, 'tp_mult': 1.1231588546211246, 'tsl_mult': 0.5689611597319987, 'strategy': 'breakout', 'time_stop': 103, 'use_sma': True, 'use_atr': False, 'use_adx': False, 'use_ema': False, 'use_spike': True, 'rsi_required': True, 'edge_k': 1.1191235522063199, 'edge_cap': 0.9681309318129152, 'bull_strategy': 'breakout', 'bull_bb_std_mult': 3.5988701794518807, 'bull_rsi_os': 44, 'bull_rsi_ob': 57, 'bull_adx_thresh': 30.01034548346049, 'bull_atr_min_pct': 0.01731436960166525, 'bull_atr_max_pct': 0.032013855740361474, 'bull_tp_mult': 2.9121581638643397, 'bull_tsl_mult': 0.6202799025294918, 'bull_time_stop': 122, 'bull_use_sma': True, 'bull_use_ema': False, 'bull_use_atr': False, 'bull_use_adx': True, 'bull_use_spike': False, 'bull_rsi_required': True, 'bear_strategy': 'breakout', 'bear_bb_std_mult': 3.4638876730648507, 'bear_rsi_os': 18, 'bear_rsi_ob': 72, 'bear_adx_thresh': 23.338106172110397, 'bear_atr_min_pct': 0.0076238394437372434, 'bear_atr_max_pct': 0.06189710261186366, 'bear_tp_mult': 2.624886908849288, 'bear_tsl_mult': 0.4107167127359731, 'bear_time_stop': 134, 'bear_use_sma': True, 'bear_use_ema': True, 'bear_use_atr': True, 'bear_use_adx': False, 'bear_use_spike': False, 'bear_rsi_required': False, 'sideways_strategy': 'mean_reversion', 'sideways_bb_std_mult': 2.606281927539822, 'sideways_rsi_os': 42, 'sideways_rsi_ob': 70, 'sideways_adx_thresh': 23.19731855369667, 'sideways_atr_min_pct': 0.011852033453122898, 'sideways_atr_max_pct': 0.0735275298157883, 'sideways_tp_mult': 2.7868243288006385, 'sideways_tsl_mult': 0.7582358058372713, 'sideways_time_stop': 127, 'sideways_use_sma': False, 'sideways_use_ema': True, 'sideways_use_atr': False, 'sideways_use_adx': True, 'sideways_use_spike': False, 'sideways_rsi_required': False}.
[I 2025-09-01 10:08:19,326] Trial 375 finished with values: [-0.02295825395852158, 0.022732128096554054] and parameters: {'p_sma': 7, 'p_std': 6, 'p_atr': 20, 'p_adx': 24, 'rsi_period': 25, 'ema1': 27, 'ema2': 26, 'slip_atr_k': 0.03415057865876866, 'slip_spread_k': 0.6441269640591711, 'spread_hl_frac': 0.004332282127087462, 'bb_std_mult': 1.4198129262627668, 'rsi_os': 43, 'rsi_ob': 45, 'vol_spike': 0.23961278964556457, 'adx_thresh': 30.189518081101717, 'atr_min_pct': 0.003932104096942688, 'atr_max_pct': 0.09050026481294011, 'tp_mult': 1.1149036530737506, 'tsl_mult': 0.7333332146245901, 'strategy': 'breakout', 'time_stop': 249, 'use_sma': True, 'use_atr': False, 'use_adx': False, 'use_ema': False, 'use_spike': True, 'rsi_required': True, 'edge_k': 1.122712821735628, 'edge_cap': 0.5951935615698923, 'bull_strategy': 'breakout', 'bull_bb_std_mult': 3.5985769639490934, 'bull_rsi_os': 44, 'bull_rsi_ob': 76, 'bull_adx_thresh': 19.201864168080903, 'bull_atr_min_pct': 0.0012800383237922609, 'bull_atr_max_pct': 0.08129168037373972, 'bull_tp_mult': 2.911379692715747, 'bull_tsl_mult': 0.1348049376945452, 'bull_time_stop': 156, 'bull_use_sma': True, 'bull_use_ema': False, 'bull_use_atr': False, 'bull_use_adx': True, 'bull_use_spike': False, 'bull_rsi_required': True, 'bear_strategy': 'breakout', 'bear_bb_std_mult': 0.7577770768954482, 'bear_rsi_os': 14, 'bear_rsi_ob': 72, 'bear_adx_thresh': 23.478425499328456, 'bear_atr_min_pct': 0.005610100781871079, 'bear_atr_max_pct': 0.08617930451507982, 'bear_tp_mult': 2.417592376391681, 'bear_tsl_mult': 0.4271164282963362, 'bear_time_stop': 255, 'bear_use_sma': True, 'bear_use_ema': True, 'bear_use_atr': True, 'bear_use_adx': False, 'bear_use_spike': False, 'bear_rsi_required': False, 'sideways_strategy': 'mean_reversion', 'sideways_bb_std_mult': 1.040099116908319, 'sideways_rsi_os': 51, 'sideways_rsi_ob': 70, 'sideways_adx_thresh': 9.340005195803114, 'sideways_atr_min_pct': 0.010647822639816241, 'sideways_atr_max_pct': 0.07341531362646112, 'sideways_tp_mult': 1.6200442577048468, 'sideways_tsl_mult': 0.542726427363221, 'sideways_time_stop': 253, 'sideways_use_sma': False, 'sideways_use_ema': True, 'sideways_use_atr': False, 'sideways_use_adx': True, 'sideways_use_spike': False, 'sideways_rsi_required': False}.
[I 2025-09-01 10:08:20,255] Trial 381 finished with values: [-1000000000.0, 1000000000.0] and parameters: {'p_sma': 51, 'p_std': 36, 'p_atr': 24, 'p_adx': 24, 'rsi_period': 69, 'ema1': 10, 'ema2': 15, 'slip_atr_k': 0.19692923137717033, 'slip_spread_k': 0.6473077237561157, 'spread_hl_frac': 0.0018863260191819935, 'bb_std_mult': 1.5513892298226404, 'rsi_os': 53, 'rsi_ob': 68, 'vol_spike': 0.05186534672199203, 'adx_thresh': 12.956420564474815, 'atr_min_pct': 0.010565184284134537, 'atr_max_pct': 0.09656470772141011, 'tp_mult': 1.3060526540473703, 'tsl_mult': 0.029968386035578165, 'strategy': 'mean_reversion', 'time_stop': 250, 'use_sma': False, 'use_atr': False, 'use_adx': False, 'use_ema': True, 'use_spike': False, 'rsi_required': True, 'edge_k': 0.8641493091567454, 'edge_cap': 0.5834639281871491, 'bull_strategy': 'mean_reversion', 'bull_bb_std_mult': 3.4820742133394074, 'bull_rsi_os': 22, 'bull_rsi_ob': 61, 'bull_adx_thresh': 5.406830822839855, 'bull_atr_min_pct': 0.010097794570597136, 'bull_atr_max_pct': 0.09620269969232254, 'bull_tp_mult': 1.1951523665486512, 'bull_tsl_mult': 0.8486113412679868, 'bull_time_stop': 166, 'bull_use_sma': True, 'bull_use_ema': True, 'bull_use_atr': True, 'bull_use_adx': False, 'bull_use_spike': False, 'bull_rsi_required': True, 'bear_strategy': 'mean_reversion', 'bear_bb_std_mult': 0.7456647248528567, 'bear_rsi_os': 32, 'bear_rsi_ob': 79, 'bear_adx_thresh': 8.21505066794435, 'bear_atr_min_pct': 0.005395516469547433, 'bear_atr_max_pct': 0.04661996728047543, 'bear_tp_mult': 1.2638798300983694, 'bear_tsl_mult': 0.4675179405493524, 'bear_time_stop': 290, 'bear_use_sma': True, 'bear_use_ema': False, 'bear_use_atr': False, 'bear_use_adx': False, 'bear_use_spike': False, 'bear_rsi_required': False, 'sideways_strategy': 'mean_reversion', 'sideways_bb_std_mult': 0.8850785981711571, 'sideways_rsi_os': 27, 'sideways_rsi_ob': 54, 'sideways_adx_thresh': 21.177904296668522, 'sideways_atr_min_pct': 0.010655174803058661, 'sideways_atr_max_pct': 0.04855332822676563, 'sideways_tp_mult': 2.876979537612586, 'sideways_tsl_mult': 0.5616556667300109, 'sideways_time_stop': 23, 'sideways_use_sma': True, 'sideways_use_ema': False, 'sideways_use_atr': False, 'sideways_use_adx': True, 'sideways_use_spike': False, 'sideways_rsi_required': True}.
[I 2025-09-01 10:09:00,043] Trial 384 finished with values: [-1000000000.0, 1000000000.0] and parameters: {'p_sma': 16, 'p_std': 51, 'p_atr': 18, 'p_adx': 25, 'rsi_period': 22, 'ema1': 17, 'ema2': 15, 'slip_atr_k': 0.059784037971720556, 'slip_spread_k': 0.6867887119565537, 'spread_hl_frac': 0.031670207777603224, 'bb_std_mult': 1.516866492642551, 'rsi_os': 26, 'rsi_ob': 95, 'vol_spike': 0.217241566828501, 'adx_thresh': 31.477826217654595, 'atr_min_pct': 0.02313606686955149, 'atr_max_pct': 0.09104517561951732, 'tp_mult': 1.1809369716192448, 'tsl_mult': 0.7320377473172758, 'strategy': 'breakout', 'time_stop': 208, 'use_sma': True, 'use_atr': False, 'use_adx': False, 'use_ema': True, 'use_spike': True, 'rsi_required': True, 'edge_k': 1.2220216014131644, 'edge_cap': 0.4551989821920005, 'bull_strategy': 'mean_reversion', 'bull_bb_std_mult': 3.009204444231199, 'bull_rsi_os': 47, 'bull_rsi_ob': 47, 'bull_adx_thresh': 9.202179222942025, 'bull_atr_min_pct': 0.001976637807860209, 'bull_atr_max_pct': 0.010903508793080455, 'bull_tp_mult': 2.9498407876539177, 'bull_tsl_mult': 0.22922698420229237, 'bull_time_stop': 228, 'bull_use_sma': True, 'bull_use_ema': False, 'bull_use_atr': True, 'bull_use_adx': False, 'bull_use_spike': False, 'bull_rsi_required': True, 'bear_strategy': 'mean_reversion', 'bear_bb_std_mult': 0.9631437226994428, 'bear_rsi_os': 52, 'bear_rsi_ob': 76, 'bear_adx_thresh': 25.115772312270845, 'bear_atr_min_pct': 0.0035154721410021877, 'bear_atr_max_pct': 0.05618415522647388, 'bear_tp_mult': 1.2126444795483258, 'bear_tsl_mult': 0.4754713499176991, 'bear_time_stop': 187, 'bear_use_sma': True, 'bear_use_ema': False, 'bear_use_atr': True, 'bear_use_adx': False, 'bear_use_spike': False, 'bear_rsi_required': False, 'sideways_strategy': 'mean_reversion', 'sideways_bb_std_mult': 1.0040804555092746, 'sideways_rsi_os': 53, 'sideways_rsi_ob': 90, 'sideways_adx_thresh': 18.38113808017344, 'sideways_atr_min_pct': 0.004934395557500165, 'sideways_atr_max_pct': 0.02250514586576128, 'sideways_tp_mult': 2.5946577275000045, 'sideways_tsl_mult': 0.4957731148386335, 'sideways_time_stop': 62, 'sideways_use_sma': True, 'sideways_use_ema': False, 'sideways_use_atr': False, 'sideways_use_adx': True, 'sideways_use_spike': False, 'sideways_rsi_required': False}.
[I 2025-09-01 10:09:00,047] Trial 380 finished with values: [-1000000000.0, 1000000000.0] and parameters: {'p_sma': 16, 'p_std': 52, 'p_atr': 20, 'p_adx': 24, 'rsi_period': 69, 'ema1': 10, 'ema2': 30, 'slip_atr_k': 0.0594398751194813, 'slip_spread_k': 0.7890958542977655, 'spread_hl_frac': 0.004532057922466384, 'bb_std_mult': 1.531500825465092, 'rsi_os': 43, 'rsi_ob': 67, 'vol_spike': 0.21974378276327006, 'adx_thresh': 31.501104028641098, 'atr_min_pct': 0.0036446523157255377, 'atr_max_pct': 0.12569524369471383, 'tp_mult': 1.3052950159091998, 'tsl_mult': 0.11415558081993654, 'strategy': 'breakout', 'time_stop': 187, 'use_sma': True, 'use_atr': False, 'use_adx': False, 'use_ema': True, 'use_spike': True, 'rsi_required': True, 'edge_k': 1.3360559514661814, 'edge_cap': 0.5848605786800632, 'bull_strategy': 'mean_reversion', 'bull_bb_std_mult': 3.488275334200392, 'bull_rsi_os': 47, 'bull_rsi_ob': 47, 'bull_adx_thresh': 30.295298188196284, 'bull_atr_min_pct': 0.02862648345650593, 'bull_atr_max_pct': 0.09894105948270467, 'bull_tp_mult': 2.902371986849823, 'bull_tsl_mult': 0.7283041430320829, 'bull_time_stop': 233, 'bull_use_sma': True, 'bull_use_ema': False, 'bull_use_atr': True, 'bull_use_adx': False, 'bull_use_spike': False, 'bull_rsi_required': True, 'bear_strategy': 'mean_reversion', 'bear_bb_std_mult': 0.724902101065481, 'bear_rsi_os': 54, 'bear_rsi_ob': 45, 'bear_adx_thresh': 12.260877842785138, 'bear_atr_min_pct': 0.025149343663681805, 'bear_atr_max_pct': 0.06169532381674736, 'bear_tp_mult': 1.2620649208092398, 'bear_tsl_mult': 0.46407364405373897, 'bear_time_stop': 291, 'bear_use_sma': True, 'bear_use_ema': False, 'bear_use_atr': True, 'bear_use_adx': False, 'bear_use_spike': False, 'bear_rsi_required': False, 'sideways_strategy': 'mean_reversion', 'sideways_bb_std_mult': 2.583194270934909, 'sideways_rsi_os': 31, 'sideways_rsi_ob': 68, 'sideways_adx_thresh': 6.73324726214941, 'sideways_atr_min_pct': 0.010673263116071582, 'sideways_atr_max_pct': 0.024028603689085527, 'sideways_tp_mult': 1.7042620724672553, 'sideways_tsl_mult': 0.4815606958262588, 'sideways_time_stop': 126, 'sideways_use_sma': True, 'sideways_use_ema': False, 'sideways_use_atr': False, 'sideways_use_adx': True, 'sideways_use_spike': False, 'sideways_rsi_required': False}.
[I 2025-09-01 10:09:00,048] Trial 382 finished with values: [-1000000000.0, 1000000000.0] and parameters: {'p_sma': 52, 'p_std': 57, 'p_atr': 24, 'p_adx': 24, 'rsi_period': 37, 'ema1': 28, 'ema2': 15, 'slip_atr_k': 0.059255967381222456, 'slip_spread_k': 0.6434506507626697, 'spread_hl_frac': 0.03163676459010767, 'bb_std_mult': 1.5217048371609387, 'rsi_os': 26, 'rsi_ob': 61, 'vol_spike': 0.16382835406922566, 'adx_thresh': 12.872371109476278, 'atr_min_pct': 0.023325829219242658, 'atr_max_pct': 0.024890499998142197, 'tp_mult': 1.263931221018021, 'tsl_mult': 0.07761785072464616, 'strategy': 'mean_reversion', 'time_stop': 210, 'use_sma': False, 'use_atr': False, 'use_adx': False, 'use_ema': True, 'use_spike': False, 'rsi_required': True, 'edge_k': 1.7599179458600513, 'edge_cap': 0.5644351894188034, 'bull_strategy': 'mean_reversion', 'bull_bb_std_mult': 3.467315837897745, 'bull_rsi_os': 47, 'bull_rsi_ob': 47, 'bull_adx_thresh': 5.420415868657206, 'bull_atr_min_pct': 0.010172115007938323, 'bull_atr_max_pct': 0.09957719702210949, 'bull_tp_mult': 2.6006028362354385, 'bull_tsl_mult': 0.36579298794868204, 'bull_time_stop': 232, 'bull_use_sma': True, 'bull_use_ema': True, 'bull_use_atr': True, 'bull_use_adx': False, 'bull_use_spike': False, 'bull_rsi_required': True, 'bear_strategy': 'mean_reversion', 'bear_bb_std_mult': 1.2392374781025066, 'bear_rsi_os': 32, 'bear_rsi_ob': 79, 'bear_adx_thresh': 12.310098263511957, 'bear_atr_min_pct': 0.00572612956440522, 'bear_atr_max_pct': 0.05518902443771761, 'bear_tp_mult': 1.9494847588519673, 'bear_tsl_mult': 0.8051391804222487, 'bear_time_stop': 289, 'bear_use_sma': True, 'bear_use_ema': False, 'bear_use_atr': False, 'bear_use_adx': False, 'bear_use_spike': False, 'bear_rsi_required': False, 'sideways_strategy': 'mean_reversion', 'sideways_bb_std_mult': 1.003022331793803, 'sideways_rsi_os': 53, 'sideways_rsi_ob': 45, 'sideways_adx_thresh': 21.294805823135864, 'sideways_atr_min_pct': 0.0036560415693072806, 'sideways_atr_max_pct': 0.06438556585687771, 'sideways_tp_mult': 1.2564817178547678, 'sideways_tsl_mult': 0.09190291150137986, 'sideways_time_stop': 23, 'sideways_use_sma': True, 'sideways_use_ema': False, 'sideways_use_atr': False, 'sideways_use_adx': True, 'sideways_use_spike': False, 'sideways_rsi_required': True}.
[I 2025-09-01 10:09:00,294] Trial 383 finished with values: [-1000000000.0, 1000000000.0] and parameters: {'p_sma': 16, 'p_std': 7, 'p_atr': 18, 'p_adx': 25, 'rsi_period': 22, 'ema1': 23, 'ema2': 15, 'slip_atr_k': 0.059390130767150204, 'slip_spread_k': 0.67922889350593, 'spread_hl_frac': 0.03140891320040757, 'bb_std_mult': 1.5256456517947945, 'rsi_os': 33, 'rsi_ob': 95, 'vol_spike': 0.11806048948233806, 'adx_thresh': 19.407765177980725, 'atr_min_pct': 0.011939657606027942, 'atr_max_pct': 0.09127370672296156, 'tp_mult': 1.1732882633797042, 'tsl_mult': 0.3112807222360273, 'strategy': 'mean_reversion', 'time_stop': 247, 'use_sma': False, 'use_atr': False, 'use_adx': False, 'use_ema': True, 'use_spike': True, 'rsi_required': True, 'edge_k': 1.1771892990771602, 'edge_cap': 0.6796716790157196, 'bull_strategy': 'mean_reversion', 'bull_bb_std_mult': 3.4758442421276565, 'bull_rsi_os': 47, 'bull_rsi_ob': 47, 'bull_adx_thresh': 19.412666083517518, 'bull_atr_min_pct': 0.0018739686400115196, 'bull_atr_max_pct': 0.09894028295912663, 'bull_tp_mult': 2.9538198548574717, 'bull_tsl_mult': 0.7289381154231643, 'bull_time_stop': 231, 'bull_use_sma': True, 'bull_use_ema': True, 'bull_use_atr': True, 'bull_use_adx': False, 'bull_use_spike': False, 'bull_rsi_required': True, 'bear_strategy': 'mean_reversion', 'bear_bb_std_mult': 0.5652940677474905, 'bear_rsi_os': 52, 'bear_rsi_ob': 75, 'bear_adx_thresh': 12.412566248718703, 'bear_atr_min_pct': 0.005419419502047456, 'bear_atr_max_pct': 0.046880354934565924, 'bear_tp_mult': 1.2579118979050385, 'bear_tsl_mult': 0.46978201246094864, 'bear_time_stop': 289, 'bear_use_sma': True, 'bear_use_ema': False, 'bear_use_atr': True, 'bear_use_adx': False, 'bear_use_spike': False, 'bear_rsi_required': False, 'sideways_strategy': 'mean_reversion', 'sideways_bb_std_mult': 1.031047688599336, 'sideways_rsi_os': 34, 'sideways_rsi_ob': 56, 'sideways_adx_thresh': 9.311314977981075, 'sideways_atr_min_pct': 0.010644860637532097, 'sideways_atr_max_pct': 0.06597472191495182, 'sideways_tp_mult': 2.419582132112784, 'sideways_tsl_mult': 0.5769375449843479, 'sideways_time_stop': 268, 'sideways_use_sma': True, 'sideways_use_ema': False, 'sideways_use_atr': False, 'sideways_use_adx': True, 'sideways_use_spike': False, 'sideways_rsi_required': True}.
[I 2025-09-01 10:09:43,338] Trial 385 finished with values: [-1000000000.0, 1000000000.0] and parameters: {'p_sma': 10, 'p_std': 54, 'p_atr': 17, 'p_adx': 25, 'rsi_period': 23, 'ema1': 27, 'ema2': 19, 'slip_atr_k': 0.024339642322769722, 'slip_spread_k': 0.6719673255515705, 'spread_hl_frac': 0.009092898589960003, 'bb_std_mult': 2.15120284362882, 'rsi_os': 42, 'rsi_ob': 69, 'vol_spike': 0.08458775755727012, 'adx_thresh': 34.968416806833076, 'atr_min_pct': 0.01245768456964742, 'atr_max_pct': 0.10725457076146873, 'tp_mult': 1.1495151739129592, 'tsl_mult': 0.3133184959022335, 'strategy': 'breakout', 'time_stop': 263, 'use_sma': True, 'use_atr': True, 'use_adx': True, 'use_ema': True, 'use_spike': True, 'rsi_required': True, 'edge_k': 0.21507614006665032, 'edge_cap': 0.6471852767569168, 'bull_strategy': 'mean_reversion', 'bull_bb_std_mult': 3.3121703619632363, 'bull_rsi_os': 20, 'bull_rsi_ob': 45, 'bull_adx_thresh': 16.363055524098478, 'bull_atr_min_pct': 0.022047131278139582, 'bull_atr_max_pct': 0.14149226092654654, 'bull_tp_mult': 2.9635397554617597, 'bull_tsl_mult': 0.4672617793210624, 'bull_time_stop': 209, 'bull_use_sma': True, 'bull_use_ema': False, 'bull_use_atr': True, 'bull_use_adx': False, 'bull_use_spike': False, 'bull_rsi_required': True, 'bear_strategy': 'mean_reversion', 'bear_bb_std_mult': 0.8782497829906277, 'bear_rsi_os': 54, 'bear_rsi_ob': 75, 'bear_adx_thresh': 22.775315163269628, 'bear_atr_min_pct': 0.016853880495695257, 'bear_atr_max_pct': 0.08541128234114315, 'bear_tp_mult': 1.0773360575436857, 'bear_tsl_mult': 0.4937071201342159, 'bear_time_stop': 48, 'bear_use_sma': False, 'bear_use_ema': False, 'bear_use_atr': True, 'bear_use_adx': False, 'bear_use_spike': True, 'bear_rsi_required': True, 'sideways_strategy': 'mean_reversion', 'sideways_bb_std_mult': 3.254050599932211, 'sideways_rsi_os': 52, 'sideways_rsi_ob': 92, 'sideways_adx_thresh': 22.320315000860912, 'sideways_atr_min_pct': 0.027994555549404238, 'sideways_atr_max_pct': 0.05239839897827525, 'sideways_tp_mult': 1.1013581746146484, 'sideways_tsl_mult': 0.4623532178237926, 'sideways_time_stop': 33, 'sideways_use_sma': True, 'sideways_use_ema': False, 'sideways_use_atr': False, 'sideways_use_adx': True, 'sideways_use_spike': True, 'sideways_rsi_required': False}.
[I 2025-09-01 10:09:43,376] Trial 387 finished with values: [-1000000000.0, 1000000000.0] and parameters: {'p_sma': 43, 'p_std': 50, 'p_atr': 17, 'p_adx': 25, 'rsi_period': 24, 'ema1': 18, 'ema2': 18, 'slip_atr_k': 0.02582444432241182, 'slip_spread_k': 0.6646860594730121, 'spread_hl_frac': 0.02678157018758658, 'bb_std_mult': 1.3398664796934934, 'rsi_os': 38, 'rsi_ob': 59, 'vol_spike': 0.07663663941023059, 'adx_thresh': 33.172800412063516, 'atr_min_pct': 0.009064438920334917, 'atr_max_pct': 0.1109317095850624, 'tp_mult': 1.6083492843089553, 'tsl_mult': 0.17951716728931566, 'strategy': 'breakout', 'time_stop': 262, 'use_sma': True, 'use_atr': True, 'use_adx': True, 'use_ema': True, 'use_spike': True, 'rsi_required': False, 'edge_k': 2.26170620230004e-05, 'edge_cap': 0.6373263332226407, 'bull_strategy': 'breakout', 'bull_bb_std_mult': 3.5573662316056, 'bull_rsi_os': 26, 'bull_rsi_ob': 48, 'bull_adx_thresh': 16.023517274488317, 'bull_atr_min_pct': 0.02191021180276011, 'bull_atr_max_pct': 0.06269415879259083, 'bull_tp_mult': 2.9995124023329836, 'bull_tsl_mult': 0.08858551464665382, 'bull_time_stop': 210, 'bull_use_sma': False, 'bull_use_ema': False, 'bull_use_atr': True, 'bull_use_adx': False, 'bull_use_spike': False, 'bull_rsi_required': False, 'bear_strategy': 'mean_reversion', 'bear_bb_std_mult': 0.8736659234980299, 'bear_rsi_os': 54, 'bear_rsi_ob': 76, 'bear_adx_thresh': 22.252861457695495, 'bear_atr_min_pct': 0.011851145750190141, 'bear_atr_max_pct': 0.05097763335882097, 'bear_tp_mult': 1.0853198220755478, 'bear_tsl_mult': 0.4939547718103449, 'bear_time_stop': 281, 'bear_use_sma': False, 'bear_use_ema': True, 'bear_use_atr': True, 'bear_use_adx': False, 'bear_use_spike': True, 'bear_rsi_required': True, 'sideways_strategy': 'mean_reversion', 'sideways_bb_std_mult': 2.3349011625070037, 'sideways_rsi_os': 52, 'sideways_rsi_ob': 92, 'sideways_adx_thresh': 22.217201106210027, 'sideways_atr_min_pct': 0.02798714483443486, 'sideways_atr_max_pct': 0.05497376725077489, 'sideways_tp_mult': 2.6923540580346006, 'sideways_tsl_mult': 0.8424070981012213, 'sideways_time_stop': 34, 'sideways_use_sma': True, 'sideways_use_ema': False, 'sideways_use_atr': False, 'sideways_use_adx': False, 'sideways_use_spike': True, 'sideways_rsi_required': False}.
