[I 2025-09-01 09:13:00,788] Trial 36 finished with values: [-1000000000.0, 1000000000.0] and parameters: {'p_sma': 54, 'p_std': 37, 'p_atr': 21, 'p_adx': 7, 'rsi_period': 16, 'ema1': 8, 'ema2': 27, 'slip_atr_k': 0.10206202763885903, 'slip_spread_k': 0.6232051619297564, 'spread_hl_frac': 0.013919549763961047, 'bb_std_mult': 1.863527046558923, 'rsi_os': 11, 'rsi_ob': 74, 'vol_spike': 0.12972393337882107, 'adx_thresh': 5.334075324274438, 'atr_min_pct': 0.016263659688017393, 'atr_max_pct': 0.10864869525235323, 'tp_mult': 2.4640559023372046, 'tsl_mult': 0.9829609037648026, 'strategy': 'breakout', 'time_stop': 239, 'use_sma': False, 'use_atr': False, 'use_adx': True, 'use_ema': False, 'use_spike': False, 'rsi_required': True, 'edge_k': 0.152694558244013, 'edge_cap': 0.33936677270024984, 'bull_strategy': 'mean_reversion', 'bull_bb_std_mult': 2.6959692846297543, 'bull_rsi_os': 25, 'bull_rsi_ob': 72, 'bull_adx_thresh': 22.054715008881065, 'bull_atr_min_pct': 0.026161773504398127, 'bull_atr_max_pct': 0.10586101614014044, 'bull_tp_mult': 1.1860819582430915, 'bull_tsl_mult': 0.26852123541083117, 'bull_time_stop': 184, 'bull_use_sma': False, 'bull_use_ema': True, 'bull_use_atr': False, 'bull_use_adx': True, 'bull_use_spike': True, 'bull_rsi_required': True, 'bear_strategy': 'breakout', 'bear_bb_std_mult': 1.5474893806988812, 'bear_rsi_os': 19, 'bear_rsi_ob': 84, 'bear_adx_thresh': 33.139449504239124, 'bear_atr_min_pct': 0.013199668673774685, 'bear_atr_max_pct': 0.09000334299914521, 'bear_tp_mult': 1.2954243559328726, 'bear_tsl_mult': 0.25467519923515575, 'bear_time_stop': 158, 'bear_use_sma': False, 'bear_use_ema': True, 'bear_use_atr': True, 'bear_use_adx': False, 'bear_use_spike': True, 'bear_rsi_required': True, 'sideways_strategy': 'mean_reversion', 'sideways_bb_std_mult': 1.9356767388115232, 'sideways_rsi_os': 42, 'sideways_rsi_ob': 81, 'sideways_adx_thresh': 14.944985000385282, 'sideways_atr_min_pct': 0.010502203367161837, 'sideways_atr_max_pct': 0.026816222066958925, 'sideways_tp_mult': 1.9651711917394707, 'sideways_tsl_mult': 0.8977795394589221, 'sideways_time_stop': 134, 'sideways_use_sma': True, 'sideways_use_ema': False, 'sideways_use_atr': True, 'sideways_use_adx': False, 'sideways_use_spike': True, 'sideways_rsi_required': True}.
[I 2025-09-01 09:13:01,522] Trial 38 finished with values: [-1000000000.0, 1000000000.0] and parameters: {'p_sma': 20, 'p_std': 37, 'p_atr': 21, 'p_adx': 17, 'rsi_period': 81, 'ema1': 12, 'ema2': 26, 'slip_atr_k': 0.16223226770595517, 'slip_spread_k': 0.40950345615754336, 'spread_hl_frac': 0.013549314772984572, 'bb_std_mult': 2.0045897690606465, 'rsi_os': 38, 'rsi_ob': 73, 'vol_spike': 0.12651329568719555, 'adx_thresh': 30.702534644588745, 'atr_min_pct': 0.0186911955226459, 'atr_max_pct': 0.13063817038173337, 'tp_mult': 2.3563380786277834, 'tsl_mult': 0.989274702983241, 'strategy': 'breakout', 'time_stop': 253, 'use_sma': False, 'use_atr': False, 'use_adx': False, 'use_ema': False, 'use_spike': False, 'rsi_required': True, 'edge_k': 0.19693017113492894, 'edge_cap': 0.42827754584974487, 'bull_strategy': 'breakout', 'bull_bb_std_mult': 3.1013516159344783, 'bull_rsi_os': 16, 'bull_rsi_ob': 57, 'bull_adx_thresh': 17.49331334946964, 'bull_atr_min_pct': 0.009662289030111723, 'bull_atr_max_pct': 0.10655967625105131, 'bull_tp_mult': 1.170882527063808, 'bull_tsl_mult': 0.3073835315228304, 'bull_time_stop': 268, 'bull_use_sma': True, 'bull_use_ema': True, 'bull_use_atr': True, 'bull_use_adx': True, 'bull_use_spike': True, 'bull_rsi_required': True, 'bear_strategy': 'breakout', 'bear_bb_std_mult': 3.1184588460823615, 'bear_rsi_os': 50, 'bear_rsi_ob': 72, 'bear_adx_thresh': 5.194477876395666, 'bear_atr_min_pct': 0.016008108079993675, 'bear_atr_max_pct': 0.05411260282290546, 'bear_tp_mult': 2.2478493474833527, 'bear_tsl_mult': 0.47823155758530883, 'bear_time_stop': 95, 'bear_use_sma': False, 'bear_use_ema': True, 'bear_use_atr': True, 'bear_use_adx': False, 'bear_use_spike': False, 'bear_rsi_required': False, 'sideways_strategy': 'mean_reversion', 'sideways_bb_std_mult': 0.5170603106698057, 'sideways_rsi_os': 25, 'sideways_rsi_ob': 83, 'sideways_adx_thresh': 14.67436425336729, 'sideways_atr_min_pct': 0.009814222982792166, 'sideways_atr_max_pct': 0.12654822688925982, 'sideways_tp_mult': 1.947006450357807, 'sideways_tsl_mult': 0.9058461366795426, 'sideways_time_stop': 274, 'sideways_use_sma': True, 'sideways_use_ema': False, 'sideways_use_atr': False, 'sideways_use_adx': True, 'sideways_use_spike': True, 'sideways_rsi_required': True}.
[I 2025-09-01 09:13:02,070] Trial 39 finished with values: [-1000000000.0, 1000000000.0] and parameters: {'p_sma': 42, 'p_std': 55, 'p_atr': 15, 'p_adx': 17, 'rsi_period': 79, 'ema1': 25, 'ema2': 20, 'slip_atr_k': 0.1542884690372574, 'slip_spread_k': 0.9238890113437541, 'spread_hl_frac': 0.012333852564763681, 'bb_std_mult': 1.9032517749537872, 'rsi_os': 32, 'rsi_ob': 62, 'vol_spike': 0.13351865167077903, 'adx_thresh': 17.697031183234614, 'atr_min_pct': 0.025204384112957126, 'atr_max_pct': 0.08217260939244321, 'tp_mult': 2.3759068359754405, 'tsl_mult': 0.8299364637052571, 'strategy': 'breakout', 'time_stop': 244, 'use_sma': False, 'use_atr': False, 'use_adx': False, 'use_ema': False, 'use_spike': False, 'rsi_required': True, 'edge_k': 1.7896342468009867, 'edge_cap': 0.42707798300947536, 'bull_strategy': 'breakout', 'bull_bb_std_mult': 3.142088091601118, 'bull_rsi_os': 13, 'bull_rsi_ob': 57, 'bull_adx_thresh': 25.23039635080078, 'bull_atr_min_pct': 0.010148330043953354, 'bull_atr_max_pct': 0.10591255109377821, 'bull_tp_mult': 1.452911976574174, 'bull_tsl_mult': 0.46590497048949514, 'bull_time_stop': 270, 'bull_use_sma': True, 'bull_use_ema': True, 'bull_use_atr': True, 'bull_use_adx': True, 'bull_use_spike': True, 'bull_rsi_required': True, 'bear_strategy': 'breakout', 'bear_bb_std_mult': 2.575507077344822, 'bear_rsi_os': 47, 'bear_rsi_ob': 80, 'bear_adx_thresh': 12.525323945737034, 'bear_atr_min_pct': 0.024183218792130586, 'bear_atr_max_pct': 0.052719401719395875, 'bear_tp_mult': 2.2926126073629858, 'bear_tsl_mult': 0.4762858487646372, 'bear_time_stop': 88, 'bear_use_sma': True, 'bear_use_ema': True, 'bear_use_atr': True, 'bear_use_adx': False, 'bear_use_spike': False, 'bear_rsi_required': False, 'sideways_strategy': 'mean_reversion', 'sideways_bb_std_mult': 1.2790742472336087, 'sideways_rsi_os': 41, 'sideways_rsi_ob': 90, 'sideways_adx_thresh': 15.087520613409772, 'sideways_atr_min_pct': 0.0023675364864362675, 'sideways_atr_max_pct': 0.1483149456863907, 'sideways_tp_mult': 1.9536186834402458, 'sideways_tsl_mult': 0.3907325262280884, 'sideways_time_stop': 66, 'sideways_use_sma': True, 'sideways_use_ema': False, 'sideways_use_atr': False, 'sideways_use_adx': True, 'sideways_use_spike': False, 'sideways_rsi_required': True}.
[I 2025-09-01 09:13:02,769] Trial 37 finished with values: [-1000000000.0, 1000000000.0] and parameters: {'p_sma': 21, 'p_std': 39, 'p_atr': 21, 'p_adx': 7, 'rsi_period': 79, 'ema1': 27, 'ema2': 27, 'slip_atr_k': 0.11032975275219699, 'slip_spread_k': 0.6558819442027334, 'spread_hl_frac': 0.011275432227992044, 'bb_std_mult': 1.8401841753596149, 'rsi_os': 33, 'rsi_ob': 74, 'vol_spike': 0.11475984602879435, 'adx_thresh': 30.45095506425649, 'atr_min_pct': 0.01846576241270366, 'atr_max_pct': 0.13033472621842188, 'tp_mult': 2.3905887792215155, 'tsl_mult': 0.0009203773471321841, 'strategy': 'breakout', 'time_stop': 236, 'use_sma': False, 'use_atr': False, 'use_adx': False, 'use_ema': False, 'use_spike': False, 'rsi_required': True, 'edge_k': 0.16271556906414159, 'edge_cap': 0.4629019771756391, 'bull_strategy': 'breakout', 'bull_bb_std_mult': 2.5718925019329517, 'bull_rsi_os': 17, 'bull_rsi_ob': 55, 'bull_adx_thresh': 18.026191005791368, 'bull_atr_min_pct': 0.018980658143213706, 'bull_atr_max_pct': 0.036945435486885315, 'bull_tp_mult': 1.2631819879515567, 'bull_tsl_mult': 0.4730464068141981, 'bull_time_stop': 270, 'bull_use_sma': True, 'bull_use_ema': True, 'bull_use_atr': True, 'bull_use_adx': True, 'bull_use_spike': True, 'bull_rsi_required': True, 'bear_strategy': 'breakout', 'bear_bb_std_mult': 3.089621998314839, 'bear_rsi_os': 48, 'bear_rsi_ob': 72, 'bear_adx_thresh': 31.808457312982938, 'bear_atr_min_pct': 0.01604439692093816, 'bear_atr_max_pct': 0.11851541346451948, 'bear_tp_mult': 2.2121479743423818, 'bear_tsl_mult': 0.2772710863902792, 'bear_time_stop': 83, 'bear_use_sma': False, 'bear_use_ema': True, 'bear_use_atr': True, 'bear_use_adx': False, 'bear_use_spike': True, 'bear_rsi_required': True, 'sideways_strategy': 'mean_reversion', 'sideways_bb_std_mult': 1.1385838869561242, 'sideways_rsi_os': 25, 'sideways_rsi_ob': 81, 'sideways_adx_thresh': 20.282168415116008, 'sideways_atr_min_pct': 0.01034410573262333, 'sideways_atr_max_pct': 0.07564161576499882, 'sideways_tp_mult': 2.0003524971330893, 'sideways_tsl_mult': 0.38581504504165987, 'sideways_time_stop': 136, 'sideways_use_sma': True, 'sideways_use_ema': False, 'sideways_use_atr': True, 'sideways_use_adx': True, 'sideways_use_spike': True, 'sideways_rsi_required': True}.
[I 2025-09-01 09:13:40,994] Trial 41 finished with values: [-1000000000.0, 1000000000.0] and parameters: {'p_sma': 40, 'p_std': 54, 'p_atr': 15, 'p_adx': 13, 'rsi_period': 78, 'ema1': 22, 'ema2': 22, 'slip_atr_k': 0.029886614247729093, 'slip_spread_k': 0.9294240956693575, 'spread_hl_frac': 0.04998709727769197, 'bb_std_mult': 0.5416036741317356, 'rsi_os': 33, 'rsi_ob': 79, 'vol_spike': 0.05739440403314777, 'adx_thresh': 13.496360796527863, 'atr_min_pct': 0.014496215236975474, 'atr_max_pct': 0.06454991028882615, 'tp_mult': 1.9882333376427062, 'tsl_mult': 0.83335686515475, 'strategy': 'breakout', 'time_stop': 89, 'use_sma': False, 'use_atr': True, 'use_adx': False, 'use_ema': True, 'use_spike': False, 'rsi_required': True, 'edge_k': 1.8346695585066117, 'edge_cap': 0.4441314816442741, 'bull_strategy': 'breakout', 'bull_bb_std_mult': 3.0795874428256984, 'bull_rsi_os': 44, 'bull_rsi_ob': 87, 'bull_adx_thresh': 8.555812709207814, 'bull_atr_min_pct': 0.011043705367104327, 'bull_atr_max_pct': 0.12299742678423327, 'bull_tp_mult': 1.475427614674051, 'bull_tsl_mult': 0.45240110901949343, 'bull_time_stop': 235, 'bull_use_sma': True, 'bull_use_ema': True, 'bull_use_atr': True, 'bull_use_adx': False, 'bull_use_spike': True, 'bull_rsi_required': True, 'bear_strategy': 'breakout', 'bear_bb_std_mult': 2.1264383964658036, 'bear_rsi_os': 22, 'bear_rsi_ob': 80, 'bear_adx_thresh': 13.48654668414433, 'bear_atr_min_pct': 0.023190325916155545, 'bear_atr_max_pct': 0.13355459156964153, 'bear_tp_mult': 1.626307983249044, 'bear_tsl_mult': 0.1798315912228018, 'bear_time_stop': 40, 'bear_use_sma': True, 'bear_use_ema': True, 'bear_use_atr': True, 'bear_use_adx': False, 'bear_use_spike': True, 'bear_rsi_required': False, 'sideways_strategy': 'mean_reversion', 'sideways_bb_std_mult': 1.1315937888625651, 'sideways_rsi_os': 51, 'sideways_rsi_ob': 89, 'sideways_adx_thresh': 18.593890713951243, 'sideways_atr_min_pct': 0.002396385386981935, 'sideways_atr_max_pct': 0.0758576818993905, 'sideways_tp_mult': 2.115843940857115, 'sideways_tsl_mult': 0.39635171027672367, 'sideways_time_stop': 63, 'sideways_use_sma': True, 'sideways_use_ema': False, 'sideways_use_atr': False, 'sideways_use_adx': True, 'sideways_use_spike': False, 'sideways_rsi_required': False}.
[I 2025-09-01 09:13:42,531] Trial 42 finished with values: [-1000000000.0, 1000000000.0] and parameters: {'p_sma': 32, 'p_std': 16, 'p_atr': 15, 'p_adx': 30, 'rsi_period': 84, 'ema1': 22, 'ema2': 15, 'slip_atr_k': 0.029381891302001806, 'slip_spread_k': 0.5600634684734646, 'spread_hl_frac': 0.01785206054782882, 'bb_std_mult': 2.694488427650642, 'rsi_os': 25, 'rsi_ob': 79, 'vol_spike': 0.05874754852251714, 'adx_thresh': 13.693456420929998, 'atr_min_pct': 0.014180208297563654, 'atr_max_pct': 0.059350644874947844, 'tp_mult': 2.0277419746183534, 'tsl_mult': 0.5561363065911505, 'strategy': 'breakout', 'time_stop': 87, 'use_sma': True, 'use_atr': True, 'use_adx': True, 'use_ema': True, 'use_spike': False, 'rsi_required': False, 'edge_k': 0.40661428616180617, 'edge_cap': 0.4861256117009258, 'bull_strategy': 'breakout', 'bull_bb_std_mult': 2.4618660273968724, 'bull_rsi_os': 43, 'bull_rsi_ob': 81, 'bull_adx_thresh': 8.570886114176602, 'bull_atr_min_pct': 0.00438694130008011, 'bull_atr_max_pct': 0.09440027196710729, 'bull_tp_mult': 1.6907538860958602, 'bull_tsl_mult': 0.244966258928099, 'bull_time_stop': 235, 'bull_use_sma': True, 'bull_use_ema': False, 'bull_use_atr': True, 'bull_use_adx': False, 'bull_use_spike': True, 'bull_rsi_required': False, 'bear_strategy': 'mean_reversion', 'bear_bb_std_mult': 3.1994193328072993, 'bear_rsi_os': 22, 'bear_rsi_ob': 51, 'bear_adx_thresh': 31.30906234131419, 'bear_atr_min_pct': 0.016211141026189806, 'bear_atr_max_pct': 0.13536299062738197, 'bear_tp_mult': 1.1215494079997748, 'bear_tsl_mult': 0.3400539902141929, 'bear_time_stop': 39, 'bear_use_sma': True, 'bear_use_ema': False, 'bear_use_atr': True, 'bear_use_adx': False, 'bear_use_spike': True, 'bear_rsi_required': False, 'sideways_strategy': 'mean_reversion', 'sideways_bb_std_mult': 0.97882456472666, 'sideways_rsi_os': 51, 'sideways_rsi_ob': 71, 'sideways_adx_thresh': 18.735905432762618, 'sideways_atr_min_pct': 0.01636698613749684, 'sideways_atr_max_pct': 0.0775546008578226, 'sideways_tp_mult': 1.1454604444110077, 'sideways_tsl_mult': 0.5322711859592337, 'sideways_time_stop': 219, 'sideways_use_sma': True, 'sideways_use_ema': True, 'sideways_use_atr': True, 'sideways_use_adx': False, 'sideways_use_spike': False, 'sideways_rsi_required': False}.
[I 2025-09-01 09:13:42,824] Trial 40 finished with values: [-1000000000.0, 1000000000.0] and parameters: {'p_sma': 40, 'p_std': 16, 'p_atr': 16, 'p_adx': 29, 'rsi_period': 79, 'ema1': 12, 'ema2': 15, 'slip_atr_k': 0.1564872590483517, 'slip_spread_k': 0.42055038551286367, 'spread_hl_frac': 0.007656594968037948, 'bb_std_mult': 2.680249269282801, 'rsi_os': 38, 'rsi_ob': 79, 'vol_spike': 0.051483182467031374, 'adx_thresh': 17.57017521515131, 'atr_min_pct': 0.01436571506728276, 'atr_max_pct': 0.05853173736941889, 'tp_mult': 1.6244259034471777, 'tsl_mult': 0.7596436906319667, 'strategy': 'breakout', 'time_stop': 92, 'use_sma': False, 'use_atr': False, 'use_adx': False, 'use_ema': False, 'use_spike': False, 'rsi_required': True, 'edge_k': 0.23179390927212778, 'edge_cap': 0.4826714421870819, 'bull_strategy': 'breakout', 'bull_bb_std_mult': 3.124624773537848, 'bull_rsi_os': 45, 'bull_rsi_ob': 55, 'bull_adx_thresh': 8.507794258932556, 'bull_atr_min_pct': 0.010216568595874, 'bull_atr_max_pct': 0.08844539206242724, 'bull_tp_mult': 1.463756402343334, 'bull_tsl_mult': 0.22999859824178948, 'bull_time_stop': 230, 'bull_use_sma': True, 'bull_use_ema': True, 'bull_use_atr': True, 'bull_use_adx': False, 'bull_use_spike': True, 'bull_rsi_required': True, 'bear_strategy': 'breakout', 'bear_bb_std_mult': 3.096904193305457, 'bear_rsi_os': 47, 'bear_rsi_ob': 79, 'bear_adx_thresh': 6.131824815491701, 'bear_atr_min_pct': 0.016175150369133754, 'bear_atr_max_pct': 0.056176970813876285, 'bear_tp_mult': 2.270607204921656, 'bear_tsl_mult': 0.01676613299647589, 'bear_time_stop': 88, 'bear_use_sma': True, 'bear_use_ema': True, 'bear_use_atr': True, 'bear_use_adx': False, 'bear_use_spike': False, 'bear_rsi_required': False, 'sideways_strategy': 'mean_reversion', 'sideways_bb_std_mult': 0.5719144122884878, 'sideways_rsi_os': 50, 'sideways_rsi_ob': 90, 'sideways_adx_thresh': 20.38804053381895, 'sideways_atr_min_pct': 0.0023833383808889146, 'sideways_atr_max_pct': 0.07588069152647527, 'sideways_tp_mult': 1.1952295017737604, 'sideways_tsl_mult': 0.38284295575061833, 'sideways_time_stop': 67, 'sideways_use_sma': True, 'sideways_use_ema': False, 'sideways_use_atr': False, 'sideways_use_adx': True, 'sideways_use_spike': False, 'sideways_rsi_required': True}.
[I 2025-09-01 09:13:43,238] Trial 43 finished with values: [-1000000000.0, 1000000000.0] and parameters: {'p_sma': 8, 'p_std': 16, 'p_atr': 16, 'p_adx': 9, 'rsi_period': 69, 'ema1': 22, 'ema2': 33, 'slip_atr_k': 0.03936713066751968, 'slip_spread_k': 0.5515240611591253, 'spread_hl_frac': 0.04803870984775743, 'bb_std_mult': 2.6671898633008997, 'rsi_os': 25, 'rsi_ob': 77, 'vol_spike': 0.03962362118176341, 'adx_thresh': 13.281581540477546, 'atr_min_pct': 0.021334499957466203, 'atr_max_pct': 0.06466134851319266, 'tp_mult': 2.023485522880346, 'tsl_mult': 0.5670503224346239, 'strategy': 'mean_reversion', 'time_stop': 86, 'use_sma': True, 'use_atr': True, 'use_adx': True, 'use_ema': True, 'use_spike': False, 'rsi_required': False, 'edge_k': 0.4440690562810916, 'edge_cap': 0.8113472225785254, 'bull_strategy': 'mean_reversion', 'bull_bb_std_mult': 1.833727434924577, 'bull_rsi_os': 45, 'bull_rsi_ob': 86, 'bull_adx_thresh': 31.44685666437146, 'bull_atr_min_pct': 0.005646882631957492, 'bull_atr_max_pct': 0.12402277759018569, 'bull_tp_mult': 1.6474900589382946, 'bull_tsl_mult': 0.21454353906335472, 'bull_time_stop': 160, 'bull_use_sma': False, 'bull_use_ema': False, 'bull_use_atr': False, 'bull_use_adx': False, 'bull_use_spike': True, 'bull_rsi_required': False, 'bear_strategy': 'mean_reversion', 'bear_bb_std_mult': 1.7413360871947603, 'bear_rsi_os': 23, 'bear_rsi_ob': 49, 'bear_adx_thresh': 8.250957093626697, 'bear_atr_min_pct': 0.007428171914836692, 'bear_atr_max_pct': 0.021376797779164132, 'bear_tp_mult': 1.6434748268371389, 'bear_tsl_mult': 0.8361478682263348, 'bear_time_stop': 38, 'bear_use_sma': True, 'bear_use_ema': False, 'bear_use_atr': True, 'bear_use_adx': True, 'bear_use_spike': True, 'bear_rsi_required': False, 'sideways_strategy': 'breakout', 'sideways_bb_std_mult': 3.167987681655646, 'sideways_rsi_os': 49, 'sideways_rsi_ob': 67, 'sideways_adx_thresh': 18.318101289115162, 'sideways_atr_min_pct': 0.01623314374091982, 'sideways_atr_max_pct': 0.0781721410105385, 'sideways_tp_mult': 1.162352651543088, 'sideways_tsl_mult': 0.9884883658242983, 'sideways_time_stop': 216, 'sideways_use_sma': False, 'sideways_use_ema': True, 'sideways_use_atr': True, 'sideways_use_adx': False, 'sideways_use_spike': False, 'sideways_rsi_required': False}.
[I 2025-09-01 09:14:22,235] Trial 46 finished with values: [-1000000000.0, 1000000000.0] and parameters: {'p_sma': 9, 'p_std': 44, 'p_atr': 9, 'p_adx': 16, 'rsi_period': 68, 'ema1': 5, 'ema2': 33, 'slip_atr_k': 0.1227917377583384, 'slip_spread_k': 0.5476934015285428, 'spread_hl_frac': 0.04056603753722519, 'bb_std_mult': 1.470277200855063, 'rsi_os': 28, 'rsi_ob': 57, 'vol_spike': 0.15539473450250482, 'adx_thresh': 6.860618681229248, 'atr_min_pct': 0.021865526136434676, 'atr_max_pct': 0.08531812245017584, 'tp_mult': 2.788167375623951, 'tsl_mult': 0.6977590772892688, 'strategy': 'mean_reversion', 'time_stop': 29, 'use_sma': True, 'use_atr': True, 'use_adx': True, 'use_ema': True, 'use_spike': False, 'rsi_required': False, 'edge_k': 1.6017589584595813, 'edge_cap': 0.799169318917794, 'bull_strategy': 'mean_reversion', 'bull_bb_std_mult': 3.588086796228297, 'bull_rsi_os': 28, 'bull_rsi_ob': 67, 'bull_adx_thresh': 29.889062157670608, 'bull_atr_min_pct': 0.006074850637229092, 'bull_atr_max_pct': 0.11590299140670376, 'bull_tp_mult': 2.7055809354479674, 'bull_tsl_mult': 0.0969135919291341, 'bull_time_stop': 161, 'bull_use_sma': False, 'bull_use_ema': False, 'bull_use_atr': False, 'bull_use_adx': False, 'bull_use_spike': True, 'bull_rsi_required': False, 'bear_strategy': 'mean_reversion', 'bear_bb_std_mult': 3.2577261057011606, 'bear_rsi_os': 9, 'bear_rsi_ob': 56, 'bear_adx_thresh': 8.099653955876178, 'bear_atr_min_pct': 0.007559086212299354, 'bear_atr_max_pct': 0.01971325138494829, 'bear_tp_mult': 2.0019790385915863, 'bear_tsl_mult': 0.8358774691307671, 'bear_time_stop': 126, 'bear_use_sma': False, 'bear_use_ema': False, 'bear_use_atr': False, 'bear_use_adx': True, 'bear_use_spike': True, 'bear_rsi_required': True, 'sideways_strategy': 'breakout', 'sideways_bb_std_mult': 2.7389697397664823, 'sideways_rsi_os': 46, 'sideways_rsi_ob': 66, 'sideways_adx_thresh': 6.514956891068879, 'sideways_atr_min_pct': 0.005100513735905495, 'sideways_atr_max_pct': 0.014037588985835917, 'sideways_tp_mult': 2.234273836648999, 'sideways_tsl_mult': 0.9987283558516037, 'sideways_time_stop': 26, 'sideways_use_sma': False, 'sideways_use_ema': True, 'sideways_use_atr': True, 'sideways_use_adx': False, 'sideways_use_spike': False, 'sideways_rsi_required': False}.
