[I 2025-09-01 10:06:49,071] Trial 368 finished with values: [-0.043340698066292815, 0.04308283581378366] and parameters: {'p_sma': 15, 'p_std': 41, 'p_atr': 18, 'p_adx': 9, 'rsi_period': 32, 'ema1': 19, 'ema2': 17, 'slip_atr_k': 0.23449370360530258, 'slip_spread_k': 0.6234463668059076, 'spread_hl_frac': 0.033310541281340214, 'bb_std_mult': 3.267532055224696, 'rsi_os': 5, 'rsi_ob': 68, 'vol_spike': 0.09423143726256039, 'adx_thresh': 10.867420637432925, 'atr_min_pct': 0.017793532855871617, 'atr_max_pct': 0.13616338896040486, 'tp_mult': 1.4559923450661203, 'tsl_mult': 0.6343513462956389, 'strategy': 'breakout', 'time_stop': 256, 'use_sma': True, 'use_atr': False, 'use_adx': True, 'use_ema': True, 'use_spike': True, 'rsi_required': True, 'edge_k': 1.265068351213314, 'edge_cap': 0.4878925978355225, 'bull_strategy': 'breakout', 'bull_bb_std_mult': 3.5325864363355053, 'bull_rsi_os': 43, 'bull_rsi_ob': 70, 'bull_adx_thresh': 8.177237109594746, 'bull_atr_min_pct': 0.00044267750435193765, 'bull_atr_max_pct': 0.11692761745711816, 'bull_tp_mult': 2.6905515019542663, 'bull_tsl_mult': 0.8254234117957677, 'bull_time_stop': 191, 'bull_use_sma': False, 'bull_use_ema': False, 'bull_use_atr': True, 'bull_use_adx': False, 'bull_use_spike': False, 'bull_rsi_required': True, 'bear_strategy': 'mean_reversion', 'bear_bb_std_mult': 1.020306324295709, 'bear_rsi_os': 55, 'bear_rsi_ob': 66, 'bear_adx_thresh': 34.7285101045429, 'bear_atr_min_pct': 0.010043073687684787, 'bear_atr_max_pct': 0.03127563152337019, 'bear_tp_mult': 1.1684141286875225, 'bear_tsl_mult': 0.5834034162653219, 'bear_time_stop': 171, 'bear_use_sma': False, 'bear_use_ema': True, 'bear_use_atr': True, 'bear_use_adx': False, 'bear_use_spike': True, 'bear_rsi_required': True, 'sideways_strategy': 'mean_reversion', 'sideways_bb_std_mult': 0.8411386101361581, 'sideways_rsi_os': 52, 'sideways_rsi_ob': 93, 'sideways_adx_thresh': 10.6680400936536, 'sideways_atr_min_pct': 0.010363548196186219, 'sideways_atr_max_pct': 0.07848482951389507, 'sideways_tp_mult': 2.4960000089320613, 'sideways_tsl_mult': 0.671178261738162, 'sideways_time_stop': 39, 'sideways_use_sma': True, 'sideways_use_ema': False, 'sideways_use_atr': True, 'sideways_use_adx': False, 'sideways_use_spike': True, 'sideways_rsi_required': False}.
[I 2025-09-01 10:06:49,086] Trial 370 finished with values: [-0.09265431829080695, 0.09239786059157029] and parameters: {'p_sma': 39, 'p_std': 11, 'p_atr': 18, 'p_adx': 14, 'rsi_period': 21, 'ema1': 18, 'ema2': 17, 'slip_atr_k': 0.05494876386789163, 'slip_spread_k': 0.6201692123270781, 'spread_hl_frac': 0.0279504192142643, 'bb_std_mult': 0.8386754115475368, 'rsi_os': 44, 'rsi_ob': 65, 'vol_spike': 0.09545184474919481, 'adx_thresh': 16.28521931587918, 'atr_min_pct': 0.014090361908240806, 'atr_max_pct': 0.021286212184694224, 'tp_mult': 1.0627913885206943, 'tsl_mult': 0.8224874593822531, 'strategy': 'breakout', 'time_stop': 130, 'use_sma': True, 'use_atr': False, 'use_adx': True, 'use_ema': True, 'use_spike': True, 'rsi_required': False, 'edge_k': 1.207745234890388, 'edge_cap': 0.6128657906934992, 'bull_strategy': 'mean_reversion', 'bull_bb_std_mult': 0.7623401964528409, 'bull_rsi_os': 46, 'bull_rsi_ob': 68, 'bull_adx_thresh': 13.019813795944987, 'bull_atr_min_pct': 0.00043498545576916127, 'bull_atr_max_pct': 0.14951143758946653, 'bull_tp_mult': 2.5632275637499173, 'bull_tsl_mult': 0.0010741503739403746, 'bull_time_stop': 60, 'bull_use_sma': False, 'bull_use_ema': False, 'bull_use_atr': True, 'bull_use_adx': False, 'bull_use_spike': True, 'bull_rsi_required': False, 'bear_strategy': 'mean_reversion', 'bear_bb_std_mult': 1.0110412375045672, 'bear_rsi_os': 45, 'bear_rsi_ob': 70, 'bear_adx_thresh': 19.867814565804448, 'bear_atr_min_pct': 0.006278314788898271, 'bear_atr_max_pct': 0.0435749088192902, 'bear_tp_mult': 1.1778352895169348, 'bear_tsl_mult': 0.5884191744960313, 'bear_time_stop': 115, 'bear_use_sma': False, 'bear_use_ema': False, 'bear_use_atr': True, 'bear_use_adx': True, 'bear_use_spike': True, 'bear_rsi_required': True, 'sideways_strategy': 'breakout', 'sideways_bb_std_mult': 0.9015432374277826, 'sideways_rsi_os': 52, 'sideways_rsi_ob': 89, 'sideways_adx_thresh': 31.1110041780315, 'sideways_atr_min_pct': 0.010115044446412343, 'sideways_atr_max_pct': 0.0682704476798666, 'sideways_tp_mult': 2.3386275583420835, 'sideways_tsl_mult': 0.17099304749213262, 'sideways_time_stop': 298, 'sideways_use_sma': True, 'sideways_use_ema': False, 'sideways_use_atr': True, 'sideways_use_adx': False, 'sideways_use_spike': True, 'sideways_rsi_required': False}.
[I 2025-09-01 10:07:36,572] Trial 373 finished with values: [-1000000000.0, 1000000000.0] and parameters: {'p_sma': 17, 'p_std': 24, 'p_atr': 30, 'p_adx': 14, 'rsi_period': 19, 'ema1': 16, 'ema2': 16, 'slip_atr_k': 0.07234535261380795, 'slip_spread_k': 0.8692127838304042, 'spread_hl_frac': 0.006301894644222043, 'bb_std_mult': 2.064398029571741, 'rsi_os': 40, 'rsi_ob': 65, 'vol_spike': 0.12728287335803704, 'adx_thresh': 5.120758737652075, 'atr_min_pct': 7.091352149030637e-05, 'atr_max_pct': 0.011645943228002081, 'tp_mult': 1.0530089638749645, 'tsl_mult': 0.6643053617764849, 'strategy': 'breakout', 'time_stop': 62, 'use_sma': True, 'use_atr': True, 'use_adx': False, 'use_ema': True, 'use_spike': True, 'rsi_required': False, 'edge_k': 0.7094212659532985, 'edge_cap': 0.6090252674193469, 'bull_strategy': 'mean_reversion', 'bull_bb_std_mult': 3.413729505090141, 'bull_rsi_os': 11, 'bull_rsi_ob': 49, 'bull_adx_thresh': 12.864223306146677, 'bull_atr_min_pct': 0.013533966154611905, 'bull_atr_max_pct': 0.07417954251843105, 'bull_tp_mult': 2.4736649369606756, 'bull_tsl_mult': 0.45584019183087643, 'bull_time_stop': 265, 'bull_use_sma': True, 'bull_use_ema': False, 'bull_use_atr': True, 'bull_use_adx': False, 'bull_use_spike': True, 'bull_rsi_required': False, 'bear_strategy': 'mean_reversion', 'bear_bb_std_mult': 0.8290929226315049, 'bear_rsi_os': 55, 'bear_rsi_ob': 52, 'bear_adx_thresh': 20.060322984784708, 'bear_atr_min_pct': 0.005713612060191368, 'bear_atr_max_pct': 0.072698885631388, 'bear_tp_mult': 1.1863762461046239, 'bear_tsl_mult': 0.4903149575953476, 'bear_time_stop': 284, 'bear_use_sma': True, 'bear_use_ema': False, 'bear_use_atr': True, 'bear_use_adx': True, 'bear_use_spike': False, 'bear_rsi_required': False, 'sideways_strategy': 'breakout', 'sideways_bb_std_mult': 0.7793290179060446, 'sideways_rsi_os': 54, 'sideways_rsi_ob': 49, 'sideways_adx_thresh': 21.901157129104643, 'sideways_atr_min_pct': 0.009342614683351616, 'sideways_atr_max_pct': 0.06797375809676603, 'sideways_tp_mult': 1.0169479706080753, 'sideways_tsl_mult': 0.17127502569291897, 'sideways_time_stop': 106, 'sideways_use_sma': True, 'sideways_use_ema': False, 'sideways_use_atr': False, 'sideways_use_adx': True, 'sideways_use_spike': False, 'sideways_rsi_required': False}.
[I 2025-09-01 10:07:37,076] Trial 374 finished with values: [-1000000000.0, 1000000000.0] and parameters: {'p_sma': 37, 'p_std': 23, 'p_atr': 19, 'p_adx': 29, 'rsi_period': 31, 'ema1': 16, 'ema2': 19, 'slip_atr_k': 0.17982364496768521, 'slip_spread_k': 0.6722490598324102, 'spread_hl_frac': 0.02837820976697104, 'bb_std_mult': 1.0035731111288355, 'rsi_os': 40, 'rsi_ob': 66, 'vol_spike': 0.1273845171821006, 'adx_thresh': 23.067146584910816, 'atr_min_pct': 0.015491739858038898, 'atr_max_pct': 0.03207484050602966, 'tp_mult': 1.9555879477950562, 'tsl_mult': 0.6716240482645093, 'strategy': 'breakout', 'time_stop': 85, 'use_sma': True, 'use_atr': True, 'use_adx': False, 'use_ema': True, 'use_spike': True, 'rsi_required': True, 'edge_k': 0.48596322854374674, 'edge_cap': 0.5240019447417648, 'bull_strategy': 'mean_reversion', 'bull_bb_std_mult': 1.8848364659894572, 'bull_rsi_os': 40, 'bull_rsi_ob': 47, 'bull_adx_thresh': 6.091886121453341, 'bull_atr_min_pct': 0.012917688417569533, 'bull_atr_max_pct': 0.04497347368934955, 'bull_tp_mult': 2.4690501061488774, 'bull_tsl_mult': 0.5080935712326422, 'bull_time_stop': 196, 'bull_use_sma': True, 'bull_use_ema': False, 'bull_use_atr': True, 'bull_use_adx': False, 'bull_use_spike': True, 'bull_rsi_required': True, 'bear_strategy': 'mean_reversion', 'bear_bb_std_mult': 1.7416253351409736, 'bear_rsi_os': 55, 'bear_rsi_ob': 76, 'bear_adx_thresh': 24.67785212492134, 'bear_atr_min_pct': 0.004105078111776774, 'bear_atr_max_pct': 0.023241435656282457, 'bear_tp_mult': 1.2896043187445096, 'bear_tsl_mult': 0.6973347630053803, 'bear_time_stop': 73, 'bear_use_sma': True, 'bear_use_ema': False, 'bear_use_atr': False, 'bear_use_adx': True, 'bear_use_spike': False, 'bear_rsi_required': False, 'sideways_strategy': 'breakout', 'sideways_bb_std_mult': 0.7798827127109098, 'sideways_rsi_os': 13, 'sideways_rsi_ob': 76, 'sideways_adx_thresh': 21.912007925164556, 'sideways_atr_min_pct': 0.009354900364148615, 'sideways_atr_max_pct': 0.043029989544528496, 'sideways_tp_mult': 2.422957770503024, 'sideways_tsl_mult': 0.998433894179585, 'sideways_time_stop': 15, 'sideways_use_sma': True, 'sideways_use_ema': False, 'sideways_use_atr': False, 'sideways_use_adx': True, 'sideways_use_spike': False, 'sideways_rsi_required': False}.
[I 2025-09-01 10:07:37,663] Trial 372 finished with values: [-1000000000.0, 1000000000.0] and parameters: {'p_sma': 18, 'p_std': 39, 'p_atr': 30, 'p_adx': 12, 'rsi_period': 20, 'ema1': 18, 'ema2': 17, 'slip_atr_k': 0.08746971852956761, 'slip_spread_k': 0.1245179954959435, 'spread_hl_frac': 0.02756351882444217, 'bb_std_mult': 2.0547787201789873, 'rsi_os': 40, 'rsi_ob': 65, 'vol_spike': 0.2596936787100903, 'adx_thresh': 16.435291104909055, 'atr_min_pct': 0.01708353658336793, 'atr_max_pct': 0.14976405149224706, 'tp_mult': 2.261693959940438, 'tsl_mult': 0.5659314920645726, 'strategy': 'breakout', 'time_stop': 249, 'use_sma': True, 'use_atr': True, 'use_adx': False, 'use_ema': True, 'use_spike': True, 'rsi_required': False, 'edge_k': 1.1245705251360176, 'edge_cap': 0.6094456854647857, 'bull_strategy': 'breakout', 'bull_bb_std_mult': 3.599431854609717, 'bull_rsi_os': 44, 'bull_rsi_ob': 49, 'bull_adx_thresh': 8.207251270500247, 'bull_atr_min_pct': 0.015215495366282972, 'bull_atr_max_pct': 0.1177100388120024, 'bull_tp_mult': 2.704042319116865, 'bull_tsl_mult': 0.6153489361565208, 'bull_time_stop': 156, 'bull_use_sma': False, 'bull_use_ema': False, 'bull_use_atr': True, 'bull_use_adx': False, 'bull_use_spike': True, 'bull_rsi_required': False, 'bear_strategy': 'mean_reversion', 'bear_bb_std_mult': 0.8335946636326143, 'bear_rsi_os': 50, 'bear_rsi_ob': 72, 'bear_adx_thresh': 30.32685853306721, 'bear_atr_min_pct': 0.004167415127155984, 'bear_atr_max_pct': 0.07905597008440002, 'bear_tp_mult': 1.1777465990756488, 'bear_tsl_mult': 0.4297497318346009, 'bear_time_stop': 96, 'bear_use_sma': True, 'bear_use_ema': True, 'bear_use_atr': True, 'bear_use_adx': True, 'bear_use_spike': False, 'bear_rsi_required': False, 'sideways_strategy': 'breakout', 'sideways_bb_std_mult': 2.172845667231528, 'sideways_rsi_os': 54, 'sideways_rsi_ob': 82, 'sideways_adx_thresh': 31.31517025539762, 'sideways_atr_min_pct': 0.009271931302140199, 'sideways_atr_max_pct': 0.06831157245418808, 'sideways_tp_mult': 2.427432285270948, 'sideways_tsl_mult': 0.6887682726515354, 'sideways_time_stop': 295, 'sideways_use_sma': True, 'sideways_use_ema': False, 'sideways_use_atr': True, 'sideways_use_adx': False, 'sideways_use_spike': False, 'sideways_rsi_required': False}.
[I 2025-09-01 10:07:38,722] Trial 371 finished with values: [-0.21774141887233456, 0.21760368481568643] and parameters: {'p_sma': 59, 'p_std': 25, 'p_atr': 19, 'p_adx': 25, 'rsi_period': 20, 'ema1': 18, 'ema2': 17, 'slip_atr_k': 0.03630406458286105, 'slip_spread_k': 0.8600049041322553, 'spread_hl_frac': 0.01981396296541551, 'bb_std_mult': 1.419173079333512, 'rsi_os': 40, 'rsi_ob': 65, 'vol_spike': 0.058405163037924916, 'adx_thresh': 7.754181505636055, 'atr_min_pct': 5.9619101855819256e-05, 'atr_max_pct': 0.14933311391238158, 'tp_mult': 1.9582594131614348, 'tsl_mult': 0.6709861455610229, 'strategy': 'breakout', 'time_stop': 129, 'use_sma': True, 'use_atr': True, 'use_adx': False, 'use_ema': True, 'use_spike': True, 'rsi_required': False, 'edge_k': 1.1294705876362667, 'edge_cap': 0.5251533501426284, 'bull_strategy': 'breakout', 'bull_bb_std_mult': 3.494281602467621, 'bull_rsi_os': 44, 'bull_rsi_ob': 49, 'bull_adx_thresh': 11.768964357472514, 'bull_atr_min_pct': 0.0032226202930998437, 'bull_atr_max_pct': 0.0735556271137052, 'bull_tp_mult': 2.094667202110618, 'bull_tsl_mult': 0.01590661186929293, 'bull_time_stop': 263, 'bull_use_sma': False, 'bull_use_ema': False, 'bull_use_atr': True, 'bull_use_adx': False, 'bull_use_spike': True, 'bull_rsi_required': False, 'bear_strategy': 'mean_reversion', 'bear_bb_std_mult': 1.7468301103891708, 'bear_rsi_os': 55, 'bear_rsi_ob': 72, 'bear_adx_thresh': 19.542551618032793, 'bear_atr_min_pct': 0.015862559945997497, 'bear_atr_max_pct': 0.03098783053944193, 'bear_tp_mult': 1.172472175904839, 'bear_tsl_mult': 0.4318611281227515, 'bear_time_stop': 76, 'bear_use_sma': True, 'bear_use_ema': True, 'bear_use_atr': True, 'bear_use_adx': True, 'bear_use_spike': False, 'bear_rsi_required': False, 'sideways_strategy': 'breakout', 'sideways_bb_std_mult': 0.8230817941449899, 'sideways_rsi_os': 54, 'sideways_rsi_ob': 76, 'sideways_adx_thresh': 31.397706286694095, 'sideways_atr_min_pct': 2.9141099738783094e-05, 'sideways_atr_max_pct': 0.07328211586829357, 'sideways_tp_mult': 1.6115150070365853, 'sideways_tsl_mult': 0.6870771369068371, 'sideways_time_stop': 44, 'sideways_use_sma': True, 'sideways_use_ema': False, 'sideways_use_atr': True, 'sideways_use_adx': False, 'sideways_use_spike': False, 'sideways_rsi_required': False}.
[I 2025-09-01 10:07:39,469] Trial 378 finished with values: [-1000000000.0, 1000000000.0] and parameters: {'p_sma': 6, 'p_std': 5, 'p_atr': 17, 'p_adx': 20, 'rsi_period': 24, 'ema1': 26, 'ema2': 12, 'slip_atr_k': 0.06531069948000313, 'slip_spread_k': 0.7528113131173066, 'spread_hl_frac': 0.03044193007024879, 'bb_std_mult': 2.976016458465939, 'rsi_os': 45, 'rsi_ob': 50, 'vol_spike': 0.11066413336330444, 'adx_thresh': 30.444436691527624, 'atr_min_pct': 0.012893431668573683, 'atr_max_pct': 0.13978613032660284, 'tp_mult': 1.1208869285098209, 'tsl_mult': 0.7093802358704778, 'strategy': 'mean_reversion', 'time_stop': 19, 'use_sma': False, 'use_atr': False, 'use_adx': False, 'use_ema': False, 'use_spike': False, 'rsi_required': True, 'edge_k': 0.06235095657300216, 'edge_cap': 0.9785360495799234, 'bull_strategy': 'mean_reversion', 'bull_bb_std_mult': 3.5401352397719235, 'bull_rsi_os': 13, 'bull_rsi_ob': 46, 'bull_adx_thresh': 6.183637840831389, 'bull_atr_min_pct': 0.0014412973698427122, 'bull_atr_max_pct': 0.12207741441700987, 'bull_tp_mult': 1.6827844528329197, 'bull_tsl_mult': 0.4090066181142183, 'bull_time_stop': 102, 'bull_use_sma': True, 'bull_use_ema': True, 'bull_use_atr': False, 'bull_use_adx': True, 'bull_use_spike': False, 'bull_rsi_required': True, 'bear_strategy': 'breakout', 'bear_bb_std_mult': 2.6158697881305426, 'bear_rsi_os': 29, 'bear_rsi_ob': 64, 'bear_adx_thresh': 23.555222875186033, 'bear_atr_min_pct': 0.008205576177231881, 'bear_atr_max_pct': 0.05788343792745752, 'bear_tp_mult': 1.415261386081106, 'bear_tsl_mult': 0.5470849574194463, 'bear_time_stop': 133, 'bear_use_sma': True, 'bear_use_ema': False, 'bear_use_atr': False, 'bear_use_adx': False, 'bear_use_spike': False, 'bear_rsi_required': False, 'sideways_strategy': 'mean_reversion', 'sideways_bb_std_mult': 2.6854607839979394, 'sideways_rsi_os': 29, 'sideways_rsi_ob': 91, 'sideways_adx_thresh': 23.098241236745622, 'sideways_atr_min_pct': 0.018144986869388386, 'sideways_atr_max_pct': 0.07384539783316472, 'sideways_tp_mult': 2.992183991104167, 'sideways_tsl_mult': 0.5310702175840346, 'sideways_time_stop': 27, 'sideways_use_sma': False, 'sideways_use_ema': True, 'sideways_use_atr': False, 'sideways_use_adx': True, 'sideways_use_spike': False, 'sideways_rsi_required': True}.
[I 2025-09-01 10:08:17,964] Trial 379 finished with values: [-1000000000.0, 1000000000.0] and parameters: {'p_sma': 26, 'p_std': 48, 'p_atr': 16, 'p_adx': 15, 'rsi_period': 42, 'ema1': 17, 'ema2': 41, 'slip_atr_k': 0.17176540912549687, 'slip_spread_k': 0.6098682841651814, 'spread_hl_frac': 0.029180040757898505, 'bb_std_mult': 0.9367558534333771, 'rsi_os': 42, 'rsi_ob': 82, 'vol_spike': 0.15248834846727882, 'adx_thresh': 33.66683300695037, 'atr_min_pct': 0.0073985796990640425, 'atr_max_pct': 0.05431817148741546, 'tp_mult': 1.0908369125856048, 'tsl_mult': 0.7355418981991096, 'strategy': 'breakout', 'time_stop': 237, 'use_sma': True, 'use_atr': False, 'use_adx': False, 'use_ema': False, 'use_spike': True, 'rsi_required': True, 'edge_k': 1.2214468292219938, 'edge_cap': 0.3678910178263465, 'bull_strategy': 'mean_reversion', 'bull_bb_std_mult': 1.3993667721785708, 'bull_rsi_os': 33, 'bull_rsi_ob': 76, 'bull_adx_thresh': 6.2116576581960175, 'bull_atr_min_pct': 0.018357622237486607, 'bull_atr_max_pct': 0.08032979214122465, 'bull_tp_mult': 2.821418845899327, 'bull_tsl_mult': 0.3863274046963154, 'bull_time_stop': 76, 'bull_use_sma': True, 'bull_use_ema': False, 'bull_use_atr': False, 'bull_use_adx': True, 'bull_use_spike': False, 'bull_rsi_required': True, 'bear_strategy': 'breakout', 'bear_bb_std_mult': 3.1042287763266585, 'bear_rsi_os': 54, 'bear_rsi_ob': 69, 'bear_adx_thresh': 24.163663210825984, 'bear_atr_min_pct': 0.02372319745663201, 'bear_atr_max_pct': 0.10485979931708998, 'bear_tp_mult': 2.600518041020277, 'bear_tsl_mult': 0.31919931824711245, 'bear_time_stop': 258, 'bear_use_sma': True, 'bear_use_ema': False, 'bear_use_atr': True, 'bear_use_adx': False, 'bear_use_spike': False, 'bear_rsi_required': False, 'sideways_strategy': 'mean_reversion', 'sideways_bb_std_mult': 0.9450937978548275, 'sideways_rsi_os': 51, 'sideways_rsi_ob': 65, 'sideways_adx_thresh': 24.523849513284365, 'sideways_atr_min_pct': 0.011701011729534224, 'sideways_atr_max_pct': 0.07209021530965777, 'sideways_tp_mult': 2.5442485202504157, 'sideways_tsl_mult': 0.41133172733388224, 'sideways_time_stop': 251, 'sideways_use_sma': False, 'sideways_use_ema': True, 'sideways_use_atr': False, 'sideways_use_adx': True, 'sideways_use_spike': False, 'sideways_rsi_required': False}.
[I 2025-09-01 10:08:18,566] Trial 377 finished with values: [-1000000000.0, 1000000000.0] and parameters: {'p_sma': 6, 'p_std': 43, 'p_atr': 26, 'p_adx': 11, 'rsi_period': 25, 'ema1': 17, 'ema2': 26, 'slip_atr_k': 0.03540917357123659, 'slip_spread_k': 0.6078992958011553, 'spread_hl_frac': 0.020094379029126263, 'bb_std_mult': 1.4272439747496972, 'rsi_os': 18, 'rsi_ob': 45, 'vol_spike': 0.2404445732066881, 'adx_thresh': 8.000159345578872, 'atr_min_pct': 0.003730146712705242, 'atr_max_pct': 0.0396614583782717, 'tp_mult': 1.7515193926122752, 'tsl_mult': 0.7046205630827784, 'strategy': 'breakout', 'time_stop': 151, 'use_sma': True, 'use_atr': False, 'use_adx': False, 'use_ema': False, 'use_spike': True, 'rsi_required': True, 'edge_k': 1.3289684645816453, 'edge_cap': 0.18134807141166465, 'bull_strategy': 'mean_reversion', 'bull_bb_std_mult': 1.1584543149143187, 'bull_rsi_os': 13, 'bull_rsi_ob': 95, 'bull_adx_thresh': 34.96823256576223, 'bull_atr_min_pct': 0.028275498032659885, 'bull_atr_max_pct': 0.12218695641711752, 'bull_tp_mult': 2.8536526251542496, 'bull_tsl_mult': 0.024772051994622457, 'bull_time_stop': 221, 'bull_use_sma': True, 'bull_use_ema': False, 'bull_use_atr': False, 'bull_use_adx': True, 'bull_use_spike': False, 'bull_rsi_required': True, 'bear_strategy': 'breakout', 'bear_bb_std_mult': 1.1259062798136306, 'bear_rsi_os': 5, 'bear_rsi_ob': 83, 'bear_adx_thresh': 23.82224187411133, 'bear_atr_min_pct': 0.0013094656087770159, 'bear_atr_max_pct': 0.060817894029112, 'bear_tp_mult': 1.483061260068478, 'bear_tsl_mult': 0.5365894988137889, 'bear_time_stop': 292, 'bear_use_sma': True, 'bear_use_ema': False, 'bear_use_atr': True, 'bear_use_adx': False, 'bear_use_spike': False, 'bear_rsi_required': False, 'sideways_strategy': 'mean_reversion', 'sideways_bb_std_mult': 1.9888016529537564, 'sideways_rsi_os': 51, 'sideways_rsi_ob': 64, 'sideways_adx_thresh': 23.232680634760733, 'sideways_atr_min_pct': 0.011863324089089921, 'sideways_atr_max_pct': 0.07409979731524907, 'sideways_tp_mult': 1.585376316608428, 'sideways_tsl_mult': 0.7436843291582138, 'sideways_time_stop': 162, 'sideways_use_sma': False, 'sideways_use_ema': True, 'sideways_use_atr': False, 'sideways_use_adx': True, 'sideways_use_spike': False, 'sideways_rsi_required': False}.
