[I 2025-09-01 10:11:10,345] Trial 395 finished with values: [-1000000000.0, 1000000000.0] and parameters: {'p_sma': 60, 'p_std': 19, 'p_atr': 18, 'p_adx': 26, 'rsi_period': 22, 'ema1': 17, 'ema2': 18, 'slip_atr_k': 0.24916007859741524, 'slip_spread_k': 0.641906104758483, 'spread_hl_frac': 0.03410991322011828, 'bb_std_mult': 3.119738980947208, 'rsi_os': 7, 'rsi_ob': 77, 'vol_spike': 0.10283188664014911, 'adx_thresh': 31.0925050810836, 'atr_min_pct': 0.014673538374491873, 'atr_max_pct': 0.13686071814461553, 'tp_mult': 2.9242343418114634, 'tsl_mult': 0.6897546326164434, 'strategy': 'mean_reversion', 'time_stop': 237, 'use_sma': False, 'use_atr': False, 'use_adx': False, 'use_ema': False, 'use_spike': False, 'rsi_required': True, 'edge_k': 1.2900404385519038, 'edge_cap': 0.5315848388051784, 'bull_strategy': 'mean_reversion', 'bull_bb_std_mult': 2.1740354173055207, 'bull_rsi_os': 48, 'bull_rsi_ob': 58, 'bull_adx_thresh': 27.789267057350294, 'bull_atr_min_pct': 0.016259087534861796, 'bull_atr_max_pct': 0.0875773195408446, 'bull_tp_mult': 2.9261291159761518, 'bull_tsl_mult': 0.3905645664760983, 'bull_time_stop': 187, 'bull_use_sma': True, 'bull_use_ema': True, 'bull_use_atr': False, 'bull_use_adx': True, 'bull_use_spike': True, 'bull_rsi_required': True, 'bear_strategy': 'breakout', 'bear_bb_std_mult': 1.0976401761634422, 'bear_rsi_os': 23, 'bear_rsi_ob': 77, 'bear_adx_thresh': 27.897072086769306, 'bear_atr_min_pct': 0.01878270224197705, 'bear_atr_max_pct': 0.09666488373300969, 'bear_tp_mult': 1.3091113505212149, 'bear_tsl_mult': 0.47759100783568165, 'bear_time_stop': 145, 'bear_use_sma': True, 'bear_use_ema': False, 'bear_use_atr': False, 'bear_use_adx': False, 'bear_use_spike': False, 'bear_rsi_required': False, 'sideways_strategy': 'mean_reversion', 'sideways_bb_std_mult': 0.6924322437293706, 'sideways_rsi_os': 51, 'sideways_rsi_ob': 57, 'sideways_adx_thresh': 23.900739241469324, 'sideways_atr_min_pct': 0.0110915941215626, 'sideways_atr_max_pct': 0.06961162560312614, 'sideways_tp_mult': 2.3861122921413074, 'sideways_tsl_mult': 0.8064343603810162, 'sideways_time_stop': 26, 'sideways_use_sma': True, 'sideways_use_ema': True, 'sideways_use_atr': False, 'sideways_use_adx': True, 'sideways_use_spike': False, 'sideways_rsi_required': True}.
[I 2025-09-01 10:11:10,872] Trial 396 finished with values: [-1000000000.0, 1000000000.0] and parameters: {'p_sma': 33, 'p_std': 45, 'p_atr': 18, 'p_adx': 26, 'rsi_period': 21, 'ema1': 17, 'ema2': 49, 'slip_atr_k': 0.21287160357109447, 'slip_spread_k': 0.6335918789539392, 'spread_hl_frac': 0.03427428815362983, 'bb_std_mult': 1.6321125899818012, 'rsi_os': 11, 'rsi_ob': 66, 'vol_spike': 0.2096192654643847, 'adx_thresh': 31.055244179099066, 'atr_min_pct': 0.014317895485713317, 'atr_max_pct': 0.12106464902975084, 'tp_mult': 2.461332934667416, 'tsl_mult': 0.7142464146884495, 'strategy': 'mean_reversion', 'time_stop': 251, 'use_sma': False, 'use_atr': False, 'use_adx': False, 'use_ema': False, 'use_spike': True, 'rsi_required': True, 'edge_k': 1.3199243420251336, 'edge_cap': 0.5450365848356796, 'bull_strategy': 'breakout', 'bull_bb_std_mult': 1.8060212179473631, 'bull_rsi_os': 55, 'bull_rsi_ob': 50, 'bull_adx_thresh': 6.173788762544948, 'bull_atr_min_pct': 0.002969809104103215, 'bull_atr_max_pct': 0.08773944560544443, 'bull_tp_mult': 2.932951986989801, 'bull_tsl_mult': 0.3924149909355218, 'bull_time_stop': 186, 'bull_use_sma': False, 'bull_use_ema': True, 'bull_use_atr': False, 'bull_use_adx': False, 'bull_use_spike': False, 'bull_rsi_required': True, 'bear_strategy': 'mean_reversion', 'bear_bb_std_mult': 1.1240663441750978, 'bear_rsi_os': 22, 'bear_rsi_ob': 77, 'bear_adx_thresh': 28.131197984461696, 'bear_atr_min_pct': 0.004530883629554036, 'bear_atr_max_pct': 0.13506528469016382, 'bear_tp_mult': 2.4029448643309905, 'bear_tsl_mult': 0.4823600293725439, 'bear_time_stop': 141, 'bear_use_sma': True, 'bear_use_ema': True, 'bear_use_atr': True, 'bear_use_adx': False, 'bear_use_spike': False, 'bear_rsi_required': False, 'sideways_strategy': 'mean_reversion', 'sideways_bb_std_mult': 1.1855061882581024, 'sideways_rsi_os': 9, 'sideways_rsi_ob': 52, 'sideways_adx_thresh': 29.774056365980236, 'sideways_atr_min_pct': 0.013694594010487718, 'sideways_atr_max_pct': 0.06997298761291593, 'sideways_tp_mult': 1.501788641529586, 'sideways_tsl_mult': 0.503896324708671, 'sideways_time_stop': 173, 'sideways_use_sma': True, 'sideways_use_ema': True, 'sideways_use_atr': False, 'sideways_use_adx': True, 'sideways_use_spike': False, 'sideways_rsi_required': True}.
[I 2025-09-01 10:11:51,662] Trial 398 finished with values: [-1000000000.0, 1000000000.0] and parameters: {'p_sma': 17, 'p_std': 38, 'p_atr': 18, 'p_adx': 24, 'rsi_period': 21, 'ema1': 19, 'ema2': 18, 'slip_atr_k': 0.06928841784663779, 'slip_spread_k': 0.33387642229593884, 'spread_hl_frac': 0.03393463154129576, 'bb_std_mult': 2.680716415577329, 'rsi_os': 39, 'rsi_ob': 70, 'vol_spike': 0.10064168454125749, 'adx_thresh': 30.383014803009413, 'atr_min_pct': 0.008122035964830635, 'atr_max_pct': 0.13682472306996163, 'tp_mult': 1.2051257987946842, 'tsl_mult': 0.9033561099133849, 'strategy': 'breakout', 'time_stop': 247, 'use_sma': True, 'use_atr': False, 'use_adx': False, 'use_ema': True, 'use_spike': True, 'rsi_required': True, 'edge_k': 1.2847351069237691, 'edge_cap': 0.35508402571774017, 'bull_strategy': 'mean_reversion', 'bull_bb_std_mult': 3.4180985675075704, 'bull_rsi_os': 15, 'bull_rsi_ob': 72, 'bull_adx_thresh': 5.951397232688914, 'bull_atr_min_pct': 0.0026817370542169, 'bull_atr_max_pct': 0.09331966428129058, 'bull_tp_mult': 2.9369289387860316, 'bull_tsl_mult': 0.13802230805308896, 'bull_time_stop': 223, 'bull_use_sma': True, 'bull_use_ema': False, 'bull_use_atr': True, 'bull_use_adx': False, 'bull_use_spike': False, 'bull_rsi_required': True, 'bear_strategy': 'mean_reversion', 'bear_bb_std_mult': 2.947922242578921, 'bear_rsi_os': 30, 'bear_rsi_ob': 77, 'bear_adx_thresh': 23.88016814970131, 'bear_atr_min_pct': 0.00708185208274605, 'bear_atr_max_pct': 0.13414504725943255, 'bear_tp_mult': 1.7997430821722809, 'bear_tsl_mult': 0.5175709510401927, 'bear_time_stop': 40, 'bear_use_sma': True, 'bear_use_ema': False, 'bear_use_atr': False, 'bear_use_adx': False, 'bear_use_spike': False, 'bear_rsi_required': False, 'sideways_strategy': 'mean_reversion', 'sideways_bb_std_mult': 0.922243775713988, 'sideways_rsi_os': 51, 'sideways_rsi_ob': 55, 'sideways_adx_thresh': 24.55357641209436, 'sideways_atr_min_pct': 0.007134601363952109, 'sideways_atr_max_pct': 0.08192316743312689, 'sideways_tp_mult': 2.5241136199715926, 'sideways_tsl_mult': 0.37219384117452037, 'sideways_time_stop': 27, 'sideways_use_sma': True, 'sideways_use_ema': False, 'sideways_use_atr': False, 'sideways_use_adx': True, 'sideways_use_spike': False, 'sideways_rsi_required': True}.
[I 2025-09-01 10:11:52,335] Trial 401 finished with values: [-1000000000.0, 1000000000.0] and parameters: {'p_sma': 17, 'p_std': 38, 'p_atr': 14, 'p_adx': 24, 'rsi_period': 25, 'ema1': 29, 'ema2': 17, 'slip_atr_k': 0.06684527344126631, 'slip_spread_k': 0.33827285435959065, 'spread_hl_frac': 0.01718906935117413, 'bb_std_mult': 2.4724917490262155, 'rsi_os': 39, 'rsi_ob': 91, 'vol_spike': 0.1355294876900807, 'adx_thresh': 29.921481949981263, 'atr_min_pct': 0.00818973774770728, 'atr_max_pct': 0.14065171301025642, 'tp_mult': 1.1425691268158036, 'tsl_mult': 0.6552901569696139, 'strategy': 'breakout', 'time_stop': 244, 'use_sma': True, 'use_atr': True, 'use_adx': True, 'use_ema': True, 'use_spike': True, 'rsi_required': False, 'edge_k': 1.3540540877260407, 'edge_cap': 0.6184161797807826, 'bull_strategy': 'mean_reversion', 'bull_bb_std_mult': 3.4316382824317953, 'bull_rsi_os': 41, 'bull_rsi_ob': 54, 'bull_adx_thresh': 24.388470681079298, 'bull_atr_min_pct': 0.006753912224344549, 'bull_atr_max_pct': 0.09335943956839847, 'bull_tp_mult': 2.968461003594032, 'bull_tsl_mult': 0.33252987973743314, 'bull_time_stop': 222, 'bull_use_sma': True, 'bull_use_ema': False, 'bull_use_atr': True, 'bull_use_adx': False, 'bull_use_spike': False, 'bull_rsi_required': False, 'bear_strategy': 'mean_reversion', 'bear_bb_std_mult': 0.9332276932760322, 'bear_rsi_os': 53, 'bear_rsi_ob': 75, 'bear_adx_thresh': 17.72774879397019, 'bear_atr_min_pct': 0.007064551627879658, 'bear_atr_max_pct': 0.014466340523300841, 'bear_tp_mult': 1.1976262232943655, 'bear_tsl_mult': 0.5156763179906109, 'bear_time_stop': 296, 'bear_use_sma': False, 'bear_use_ema': False, 'bear_use_atr': True, 'bear_use_adx': False, 'bear_use_spike': True, 'bear_rsi_required': True, 'sideways_strategy': 'mean_reversion', 'sideways_bb_std_mult': 0.5833329547826642, 'sideways_rsi_os': 40, 'sideways_rsi_ob': 93, 'sideways_adx_thresh': 19.142958216680352, 'sideways_atr_min_pct': 0.024900497199827804, 'sideways_atr_max_pct': 0.08075574175270231, 'sideways_tp_mult': 2.5343303110553106, 'sideways_tsl_mult': 0.488863748448802, 'sideways_time_stop': 30, 'sideways_use_sma': True, 'sideways_use_ema': False, 'sideways_use_atr': False, 'sideways_use_adx': False, 'sideways_use_spike': True, 'sideways_rsi_required': False}.
[I 2025-09-01 10:11:52,348] Trial 399 finished with values: [-1000000000.0, 1000000000.0] and parameters: {'p_sma': 55, 'p_std': 44, 'p_atr': 13, 'p_adx': 24, 'rsi_period': 25, 'ema1': 9, 'ema2': 46, 'slip_atr_k': 0.24993841813040377, 'slip_spread_k': 0.40257430145187517, 'spread_hl_frac': 0.028078999078644522, 'bb_std_mult': 2.4867979918928147, 'rsi_os': 43, 'rsi_ob': 70, 'vol_spike': 0.10081820321909457, 'adx_thresh': 9.384637951758801, 'atr_min_pct': 0.0069491577368818724, 'atr_max_pct': 0.11561007887477691, 'tp_mult': 1.2073903620353517, 'tsl_mult': 0.6619643936286567, 'strategy': 'breakout', 'time_stop': 245, 'use_sma': True, 'use_atr': False, 'use_adx': False, 'use_ema': True, 'use_spike': False, 'rsi_required': False, 'edge_k': 1.359621998161089, 'edge_cap': 0.4212182002225835, 'bull_strategy': 'mean_reversion', 'bull_bb_std_mult': 2.5946311235817943, 'bull_rsi_os': 15, 'bull_rsi_ob': 86, 'bull_adx_thresh': 5.8897312529051975, 'bull_atr_min_pct': 0.0030901737174506344, 'bull_atr_max_pct': 0.09384436320866726, 'bull_tp_mult': 2.9701242327635295, 'bull_tsl_mult': 0.13845934057568443, 'bull_time_stop': 222, 'bull_use_sma': False, 'bull_use_ema': False, 'bull_use_atr': True, 'bull_use_adx': False, 'bull_use_spike': False, 'bull_rsi_required': False, 'bear_strategy': 'breakout', 'bear_bb_std_mult': 0.9263290595416456, 'bear_rsi_os': 53, 'bear_rsi_ob': 78, 'bear_adx_thresh': 17.46115595369717, 'bear_atr_min_pct': 0.018924013128988074, 'bear_atr_max_pct': 0.09638949149049693, 'bear_tp_mult': 1.2110462012905319, 'bear_tsl_mult': 0.5127256387717958, 'bear_time_stop': 295, 'bear_use_sma': True, 'bear_use_ema': False, 'bear_use_atr': False, 'bear_use_adx': False, 'bear_use_spike': False, 'bear_rsi_required': False, 'sideways_strategy': 'mean_reversion', 'sideways_bb_std_mult': 0.8738171693428554, 'sideways_rsi_os': 53, 'sideways_rsi_ob': 52, 'sideways_adx_thresh': 24.941036321839324, 'sideways_atr_min_pct': 0.010962242398855869, 'sideways_atr_max_pct': 0.08101578926592619, 'sideways_tp_mult': 2.5312333696777256, 'sideways_tsl_mult': 0.5443739207879492, 'sideways_time_stop': 50, 'sideways_use_sma': True, 'sideways_use_ema': False, 'sideways_use_atr': False, 'sideways_use_adx': False, 'sideways_use_spike': False, 'sideways_rsi_required': True}.
[I 2025-09-01 10:11:53,273] Trial 400 finished with values: [-0.02319551753654181, 0.022979052164203408] and parameters: {'p_sma': 32, 'p_std': 37, 'p_atr': 29, 'p_adx': 24, 'rsi_period': 21, 'ema1': 25, 'ema2': 31, 'slip_atr_k': 0.0820870083487675, 'slip_spread_k': 0.551736593297444, 'spread_hl_frac': 0.027704843591062785, 'bb_std_mult': 2.664178606125277, 'rsi_os': 39, 'rsi_ob': 70, 'vol_spike': 0.13809915505407813, 'adx_thresh': 24.367143995006426, 'atr_min_pct': 0.007807859117937372, 'atr_max_pct': 0.1212753933333052, 'tp_mult': 1.149916217111483, 'tsl_mult': 0.6523225028575727, 'strategy': 'breakout', 'time_stop': 71, 'use_sma': True, 'use_atr': False, 'use_adx': False, 'use_ema': True, 'use_spike': True, 'rsi_required': False, 'edge_k': 0.39365039416320546, 'edge_cap': 0.3432683634224792, 'bull_strategy': 'breakout', 'bull_bb_std_mult': 3.395776397891285, 'bull_rsi_os': 45, 'bull_rsi_ob': 88, 'bull_adx_thresh': 18.49730132744032, 'bull_atr_min_pct': 0.0019787205952988707, 'bull_atr_max_pct': 0.09321686662769861, 'bull_tp_mult': 2.971226249391612, 'bull_tsl_mult': 0.41544425089004144, 'bull_time_stop': 110, 'bull_use_sma': False, 'bull_use_ema': False, 'bull_use_atr': True, 'bull_use_adx': False, 'bull_use_spike': False, 'bull_rsi_required': False, 'bear_strategy': 'mean_reversion', 'bear_bb_std_mult': 0.8314495839361146, 'bear_rsi_os': 53, 'bear_rsi_ob': 73, 'bear_adx_thresh': 33.38128474887585, 'bear_atr_min_pct': 0.007151612920103107, 'bear_atr_max_pct': 0.1438970474469583, 'bear_tp_mult': 2.833218212810695, 'bear_tsl_mult': 0.5098219208277412, 'bear_time_stop': 84, 'bear_use_sma': False, 'bear_use_ema': True, 'bear_use_atr': True, 'bear_use_adx': False, 'bear_use_spike': False, 'bear_rsi_required': True, 'sideways_strategy': 'mean_reversion', 'sideways_bb_std_mult': 3.1748029585050723, 'sideways_rsi_os': 53, 'sideways_rsi_ob': 47, 'sideways_adx_thresh': 24.663684673180395, 'sideways_atr_min_pct': 0.007394664946478569, 'sideways_atr_max_pct': 0.07024446386843095, 'sideways_tp_mult': 2.5468779814197555, 'sideways_tsl_mult': 0.24567313454691247, 'sideways_time_stop': 44, 'sideways_use_sma': True, 'sideways_use_ema': False, 'sideways_use_atr': False, 'sideways_use_adx': False, 'sideways_use_spike': True, 'sideways_rsi_required': False}.
[I 2025-09-01 10:12:33,149] Trial 405 finished with values: [-1000000000.0, 1000000000.0] and parameters: {'p_sma': 18, 'p_std': 13, 'p_atr': 12, 'p_adx': 25, 'rsi_period': 50, 'ema1': 19, 'ema2': 28, 'slip_atr_k': 0.08255124850663527, 'slip_spread_k': 0.606767817120133, 'spread_hl_frac': 0.026647047623482037, 'bb_std_mult': 1.5757731318897605, 'rsi_os': 41, 'rsi_ob': 68, 'vol_spike': 0.11378187603685636, 'adx_thresh': 34.243132572033105, 'atr_min_pct': 0.011762363994108627, 'atr_max_pct': 0.13177450738499574, 'tp_mult': 1.1349090934122559, 'tsl_mult': 0.1485841164177441, 'strategy': 'breakout', 'time_stop': 255, 'use_sma': True, 'use_atr': True, 'use_adx': False, 'use_ema': True, 'use_spike': True, 'rsi_required': True, 'edge_k': 1.0768071404658777, 'edge_cap': 0.5778147536855638, 'bull_strategy': 'mean_reversion', 'bull_bb_std_mult': 1.9768164804328026, 'bull_rsi_os': 46, 'bull_rsi_ob': 80, 'bull_adx_thresh': 32.52772635427256, 'bull_atr_min_pct': 0.014196915216813735, 'bull_atr_max_pct': 0.09019661119001068, 'bull_tp_mult': 2.9984305084511225, 'bull_tsl_mult': 0.7982725578530016, 'bull_time_stop': 18, 'bull_use_sma': True, 'bull_use_ema': False, 'bull_use_atr': True, 'bull_use_adx': False, 'bull_use_spike': False, 'bull_rsi_required': True, 'bear_strategy': 'mean_reversion', 'bear_bb_std_mult': 0.7941905930428554, 'bear_rsi_os': 55, 'bear_rsi_ob': 75, 'bear_adx_thresh': 33.36183702365199, 'bear_atr_min_pct': 0.005458949927940331, 'bear_atr_max_pct': 0.05894560024329934, 'bear_tp_mult': 1.8804965339290893, 'bear_tsl_mult': 0.4733561033330856, 'bear_time_stop': 283, 'bear_use_sma': False, 'bear_use_ema': True, 'bear_use_atr': True, 'bear_use_adx': False, 'bear_use_spike': False, 'bear_rsi_required': True, 'sideways_strategy': 'mean_reversion', 'sideways_bb_std_mult': 0.8373075242488414, 'sideways_rsi_os': 53, 'sideways_rsi_ob': 91, 'sideways_adx_thresh': 22.68585555198935, 'sideways_atr_min_pct': 0.0008655330546223396, 'sideways_atr_max_pct': 0.07550886624764697, 'sideways_tp_mult': 2.349621967206718, 'sideways_tsl_mult': 0.44423949524365025, 'sideways_time_stop': 154, 'sideways_use_sma': True, 'sideways_use_ema': False, 'sideways_use_atr': False, 'sideways_use_adx': True, 'sideways_use_spike': True, 'sideways_rsi_required': False}.
[I 2025-09-01 10:12:33,627] Trial 403 finished with values: [-1000000000.0, 1000000000.0] and parameters: {'p_sma': 18, 'p_std': 40, 'p_atr': 12, 'p_adx': 25, 'rsi_period': 23, 'ema1': 19, 'ema2': 25, 'slip_atr_k': 0.14635382674898026, 'slip_spread_k': 0.3829539049041363, 'spread_hl_frac': 0.03262665002951175, 'bb_std_mult': 1.7472688425078378, 'rsi_os': 41, 'rsi_ob': 68, 'vol_spike': 0.2456485815392585, 'adx_thresh': 17.788497784342646, 'atr_min_pct': 0.015484870554621102, 'atr_max_pct': 0.08878612948529019, 'tp_mult': 1.1370490521104888, 'tsl_mult': 0.7268122632992563, 'strategy': 'breakout', 'time_stop': 256, 'use_sma': True, 'use_atr': False, 'use_adx': False, 'use_ema': True, 'use_spike': True, 'rsi_required': True, 'edge_k': 1.2263304602862934, 'edge_cap': 0.5946555308561764, 'bull_strategy': 'breakout', 'bull_bb_std_mult': 1.9699841998351015, 'bull_rsi_os': 46, 'bull_rsi_ob': 88, 'bull_adx_thresh': 18.249401905015077, 'bull_atr_min_pct': 0.0021586944911358274, 'bull_atr_max_pct': 0.08955810490924057, 'bull_tp_mult': 2.9643381956386308, 'bull_tsl_mult': 0.4177395271942062, 'bull_time_stop': 213, 'bull_use_sma': True, 'bull_use_ema': False, 'bull_use_atr': True, 'bull_use_adx': False, 'bull_use_spike': False, 'bull_rsi_required': True, 'bear_strategy': 'mean_reversion', 'bear_bb_std_mult': 0.8387187577721794, 'bear_rsi_os': 55, 'bear_rsi_ob': 73, 'bear_adx_thresh': 33.3685043889188, 'bear_atr_min_pct': 0.003764108028755554, 'bear_atr_max_pct': 0.07111701842939859, 'bear_tp_mult': 2.8396538066924637, 'bear_tsl_mult': 0.4331049988333484, 'bear_time_stop': 284, 'bear_use_sma': False, 'bear_use_ema': True, 'bear_use_atr': True, 'bear_use_adx': False, 'bear_use_spike': False, 'bear_rsi_required': True, 'sideways_strategy': 'mean_reversion', 'sideways_bb_std_mult': 0.7862974922447719, 'sideways_rsi_os': 53, 'sideways_rsi_ob': 79, 'sideways_adx_thresh': 34.10191810900434, 'sideways_atr_min_pct': 0.009236210961703375, 'sideways_atr_max_pct': 0.06772809029321426, 'sideways_tp_mult': 2.461047367633735, 'sideways_tsl_mult': 0.2453195756874067, 'sideways_time_stop': 239, 'sideways_use_sma': True, 'sideways_use_ema': False, 'sideways_use_atr': False, 'sideways_use_adx': True, 'sideways_use_spike': True, 'sideways_rsi_required': False}.
[I 2025-09-01 10:12:34,726] Trial 402 finished with values: [-1000000000.0, 1000000000.0] and parameters: {'p_sma': 18, 'p_std': 59, 'p_atr': 21, 'p_adx': 25, 'rsi_period': 26, 'ema1': 22, 'ema2': 28, 'slip_atr_k': 0.08124461761339802, 'slip_spread_k': 0.6975351810211726, 'spread_hl_frac': 0.03264526062072253, 'bb_std_mult': 1.5843988848517692, 'rsi_os': 41, 'rsi_ob': 75, 'vol_spike': 0.03954394172485144, 'adx_thresh': 34.42037641746504, 'atr_min_pct': 0.013500027707322872, 'atr_max_pct': 0.08719118084201127, 'tp_mult': 1.1456202256740535, 'tsl_mult': 0.7332187614064135, 'strategy': 'breakout', 'time_stop': 70, 'use_sma': True, 'use_atr': False, 'use_adx': False, 'use_ema': True, 'use_spike': True, 'rsi_required': True, 'edge_k': 1.2250086936272877, 'edge_cap': 0.5815090082298877, 'bull_strategy': 'breakout', 'bull_bb_std_mult': 3.598430103408125, 'bull_rsi_os': 46, 'bull_rsi_ob': 88, 'bull_adx_thresh': 5.190436038735144, 'bull_atr_min_pct': 0.019824875667266886, 'bull_atr_max_pct': 0.05247752586199876, 'bull_tp_mult': 2.999006842638466, 'bull_tsl_mult': 0.417104065471258, 'bull_time_stop': 19, 'bull_use_sma': True, 'bull_use_ema': False, 'bull_use_atr': True, 'bull_use_adx': False, 'bull_use_spike': False, 'bull_rsi_required': True, 'bear_strategy': 'mean_reversion', 'bear_bb_std_mult': 0.8072991439343327, 'bear_rsi_os': 55, 'bear_rsi_ob': 73, 'bear_adx_thresh': 24.58063298279596, 'bear_atr_min_pct': 0.0037903416377323526, 'bear_atr_max_pct': 0.14202416685875463, 'bear_tp_mult': 1.698298393412925, 'bear_tsl_mult': 0.4341569738000203, 'bear_time_stop': 281, 'bear_use_sma': False, 'bear_use_ema': True, 'bear_use_atr': True, 'bear_use_adx': False, 'bear_use_spike': False, 'bear_rsi_required': True, 'sideways_strategy': 'mean_reversion', 'sideways_bb_std_mult': 0.8510727073838975, 'sideways_rsi_os': 53, 'sideways_rsi_ob': 92, 'sideways_adx_thresh': 7.319207946269927, 'sideways_atr_min_pct': 0.009244747859783188, 'sideways_atr_max_pct': 0.14138083614632763, 'sideways_tp_mult': 2.4723305408238554, 'sideways_tsl_mult': 0.4418446508027497, 'sideways_time_stop': 116, 'sideways_use_sma': True, 'sideways_use_ema': False, 'sideways_use_atr': False, 'sideways_use_adx': True, 'sideways_use_spike': True, 'sideways_rsi_required': False}.
