[I 2025-09-01 09:42:29,607] Trial 223 finished with values: [-1000000000.0, 1000000000.0] and parameters: {'p_sma': 27, 'p_std': 56, 'p_atr': 20, 'p_adx': 29, 'rsi_period': 27, 'ema1': 17, 'ema2': 15, 'slip_atr_k': 0.054328937160882294, 'slip_spread_k': 0.6746103768820791, 'spread_hl_frac': 0.03046968252802832, 'bb_std_mult': 1.5194156867263942, 'rsi_os': 42, 'rsi_ob': 67, 'vol_spike': 0.1300379588139295, 'adx_thresh': 34.28529503974991, 'atr_min_pct': 0.011015530418247113, 'atr_max_pct': 0.12691085065424793, 'tp_mult': 1.2527141350592161, 'tsl_mult': 0.6395329954739346, 'strategy': 'breakout', 'time_stop': 251, 'use_sma': True, 'use_atr': False, 'use_adx': True, 'use_ema': True, 'use_spike': False, 'rsi_required': False, 'edge_k': 1.1399226948061243, 'edge_cap': 0.427363391123317, 'bull_strategy': 'mean_reversion', 'bull_bb_std_mult': 3.596521938971013, 'bull_rsi_os': 44, 'bull_rsi_ob': 46, 'bull_adx_thresh': 7.036033176253914, 'bull_atr_min_pct': 0.0023866184812506193, 'bull_atr_max_pct': 0.08411753843624378, 'bull_tp_mult': 2.1150353104001662, 'bull_tsl_mult': 0.38187635805712233, 'bull_time_stop': 192, 'bull_use_sma': True, 'bull_use_ema': False, 'bull_use_atr': True, 'bull_use_adx': False, 'bull_use_spike': True, 'bull_rsi_required': False, 'bear_strategy': 'mean_reversion', 'bear_bb_std_mult': 0.7734184168894056, 'bear_rsi_os': 55, 'bear_rsi_ob': 76, 'bear_adx_thresh': 23.92791537921127, 'bear_atr_min_pct': 0.007145614726390588, 'bear_atr_max_pct': 0.05205361593784975, 'bear_tp_mult': 1.2775020755443214, 'bear_tsl_mult': 0.4943000464577202, 'bear_time_stop': 159, 'bear_use_sma': True, 'bear_use_ema': False, 'bear_use_atr': True, 'bear_use_adx': False, 'bear_use_spike': False, 'bear_rsi_required': True, 'sideways_strategy': 'mean_reversion', 'sideways_bb_std_mult': 0.6975101125127108, 'sideways_rsi_os': 53, 'sideways_rsi_ob': 93, 'sideways_adx_thresh': 21.166569081812266, 'sideways_atr_min_pct': 0.009130445623460454, 'sideways_atr_max_pct': 0.06787064540336828, 'sideways_tp_mult': 2.3162034839842476, 'sideways_tsl_mult': 0.5565994064786508, 'sideways_time_stop': 28, 'sideways_use_sma': False, 'sideways_use_ema': True, 'sideways_use_atr': True, 'sideways_use_adx': False, 'sideways_use_spike': False, 'sideways_rsi_required': False}.
[I 2025-09-01 09:42:30,093] Trial 225 finished with values: [-0.05785787924341679, 0.057519711412737144] and parameters: {'p_sma': 30, 'p_std': 56, 'p_atr': 20, 'p_adx': 23, 'rsi_period': 36, 'ema1': 17, 'ema2': 18, 'slip_atr_k': 0.0962412363122361, 'slip_spread_k': 0.6756576004017261, 'spread_hl_frac': 0.030700141425103935, 'bb_std_mult': 1.675402809774359, 'rsi_os': 42, 'rsi_ob': 78, 'vol_spike': 0.08471160028122883, 'adx_thresh': 34.178472197097925, 'atr_min_pct': 0.011066901603105495, 'atr_max_pct': 0.1273753752391644, 'tp_mult': 1.2170166999272147, 'tsl_mult': 0.7294333682878433, 'strategy': 'mean_reversion', 'time_stop': 252, 'use_sma': False, 'use_atr': False, 'use_adx': True, 'use_ema': False, 'use_spike': False, 'rsi_required': False, 'edge_k': 1.146545846494941, 'edge_cap': 0.40942255050050286, 'bull_strategy': 'mean_reversion', 'bull_bb_std_mult': 3.5993858493106323, 'bull_rsi_os': 44, 'bull_rsi_ob': 45, 'bull_adx_thresh': 9.887213352754847, 'bull_atr_min_pct': 0.0009930093442087839, 'bull_atr_max_pct': 0.092930547428808, 'bull_tp_mult': 2.9842774388383937, 'bull_tsl_mult': 0.3566811193043547, 'bull_time_stop': 210, 'bull_use_sma': False, 'bull_use_ema': True, 'bull_use_atr': False, 'bull_use_adx': False, 'bull_use_spike': True, 'bull_rsi_required': False, 'bear_strategy': 'breakout', 'bear_bb_std_mult': 0.76263029562639, 'bear_rsi_os': 54, 'bear_rsi_ob': 78, 'bear_adx_thresh': 23.99285494685585, 'bear_atr_min_pct': 0.0026277167842531355, 'bear_atr_max_pct': 0.05320374250683779, 'bear_tp_mult': 1.2784402832689832, 'bear_tsl_mult': 0.5745170596140987, 'bear_time_stop': 299, 'bear_use_sma': True, 'bear_use_ema': False, 'bear_use_atr': True, 'bear_use_adx': False, 'bear_use_spike': False, 'bear_rsi_required': True, 'sideways_strategy': 'mean_reversion', 'sideways_bb_std_mult': 0.6803616011123681, 'sideways_rsi_os': 27, 'sideways_rsi_ob': 93, 'sideways_adx_thresh': 21.061948202874383, 'sideways_atr_min_pct': 0.008828818096011428, 'sideways_atr_max_pct': 0.06704149894583128, 'sideways_tp_mult': 2.3152823338789372, 'sideways_tsl_mult': 0.5489885175245508, 'sideways_time_stop': 35, 'sideways_use_sma': False, 'sideways_use_ema': True, 'sideways_use_atr': True, 'sideways_use_adx': False, 'sideways_use_spike': True, 'sideways_rsi_required': False}.
[I 2025-09-01 09:43:06,768] Trial 227 finished with values: [-1000000000.0, 1000000000.0] and parameters: {'p_sma': 13, 'p_std': 41, 'p_atr': 19, 'p_adx': 29, 'rsi_period': 24, 'ema1': 17, 'ema2': 28, 'slip_atr_k': 0.05673589346240708, 'slip_spread_k': 0.6709206946428841, 'spread_hl_frac': 0.02291013949396365, 'bb_std_mult': 1.587842667383797, 'rsi_os': 44, 'rsi_ob': 51, 'vol_spike': 0.12287094788192483, 'adx_thresh': 34.4685851747145, 'atr_min_pct': 0.01370925726559817, 'atr_max_pct': 0.12883656179172642, 'tp_mult': 1.1609690216774196, 'tsl_mult': 0.7274232549189859, 'strategy': 'breakout', 'time_stop': 234, 'use_sma': True, 'use_atr': False, 'use_adx': False, 'use_ema': True, 'use_spike': True, 'rsi_required': True, 'edge_k': 1.1839024081182985, 'edge_cap': 0.4130033204544652, 'bull_strategy': 'mean_reversion', 'bull_bb_std_mult': 3.5999275053286475, 'bull_rsi_os': 44, 'bull_rsi_ob': 45, 'bull_adx_thresh': 22.714061693537033, 'bull_atr_min_pct': 0.0015054937385681126, 'bull_atr_max_pct': 0.09355484178615561, 'bull_tp_mult': 2.633258301546324, 'bull_tsl_mult': 0.4744542726892407, 'bull_time_stop': 207, 'bull_use_sma': True, 'bull_use_ema': False, 'bull_use_atr': True, 'bull_use_adx': False, 'bull_use_spike': False, 'bull_rsi_required': True, 'bear_strategy': 'mean_reversion', 'bear_bb_std_mult': 1.3479713445414558, 'bear_rsi_os': 43, 'bear_rsi_ob': 79, 'bear_adx_thresh': 24.713824150550206, 'bear_atr_min_pct': 0.003514168704050278, 'bear_atr_max_pct': 0.04758987136677463, 'bear_tp_mult': 1.2623919398702819, 'bear_tsl_mult': 0.5804253061349306, 'bear_time_stop': 42, 'bear_use_sma': True, 'bear_use_ema': False, 'bear_use_atr': True, 'bear_use_adx': False, 'bear_use_spike': False, 'bear_rsi_required': False, 'sideways_strategy': 'mean_reversion', 'sideways_bb_std_mult': 0.6695788684569927, 'sideways_rsi_os': 50, 'sideways_rsi_ob': 93, 'sideways_adx_thresh': 23.204554460394032, 'sideways_atr_min_pct': 0.00910386100892409, 'sideways_atr_max_pct': 0.06309464512778797, 'sideways_tp_mult': 2.5144846734369213, 'sideways_tsl_mult': 0.5038109908088731, 'sideways_time_stop': 120, 'sideways_use_sma': True, 'sideways_use_ema': False, 'sideways_use_atr': False, 'sideways_use_adx': True, 'sideways_use_spike': False, 'sideways_rsi_required': False}.
[I 2025-09-01 09:43:06,769] Trial 230 finished with values: [-1000000000.0, 1000000000.0] and parameters: {'p_sma': 13, 'p_std': 41, 'p_atr': 19, 'p_adx': 23, 'rsi_period': 24, 'ema1': 18, 'ema2': 28, 'slip_atr_k': 0.06281513266688649, 'slip_spread_k': 0.6608044698447652, 'spread_hl_frac': 0.028791388049728105, 'bb_std_mult': 1.599820829772137, 'rsi_os': 44, 'rsi_ob': 94, 'vol_spike': 0.12375187151153533, 'adx_thresh': 33.11738582529913, 'atr_min_pct': 0.0139038698134881, 'atr_max_pct': 0.13497974366384946, 'tp_mult': 1.15224851954838, 'tsl_mult': 0.8374945482058993, 'strategy': 'breakout', 'time_stop': 238, 'use_sma': True, 'use_atr': False, 'use_adx': False, 'use_ema': True, 'use_spike': True, 'rsi_required': True, 'edge_k': 1.1924500356888317, 'edge_cap': 0.7051744633371562, 'bull_strategy': 'mean_reversion', 'bull_bb_std_mult': 3.536760597040255, 'bull_rsi_os': 41, 'bull_rsi_ob': 47, 'bull_adx_thresh': 25.999635981974464, 'bull_atr_min_pct': 0.0016006610253557001, 'bull_atr_max_pct': 0.03509486388790603, 'bull_tp_mult': 2.7177370721404848, 'bull_tsl_mult': 0.44366474775805864, 'bull_time_stop': 218, 'bull_use_sma': True, 'bull_use_ema': False, 'bull_use_atr': True, 'bull_use_adx': False, 'bull_use_spike': False, 'bull_rsi_required': True, 'bear_strategy': 'mean_reversion', 'bear_bb_std_mult': 1.4098871361487864, 'bear_rsi_os': 41, 'bear_rsi_ob': 80, 'bear_adx_thresh': 22.695364528072883, 'bear_atr_min_pct': 9.518091326083354e-05, 'bear_atr_max_pct': 0.04822083566578618, 'bear_tp_mult': 1.109040445625006, 'bear_tsl_mult': 0.575701594744021, 'bear_time_stop': 236, 'bear_use_sma': True, 'bear_use_ema': False, 'bear_use_atr': True, 'bear_use_adx': False, 'bear_use_spike': False, 'bear_rsi_required': False, 'sideways_strategy': 'mean_reversion', 'sideways_bb_std_mult': 0.7580647982886288, 'sideways_rsi_os': 50, 'sideways_rsi_ob': 91, 'sideways_adx_thresh': 23.151788865537682, 'sideways_atr_min_pct': 0.01074301898998635, 'sideways_atr_max_pct': 0.07019014911523787, 'sideways_tp_mult': 2.667864464985326, 'sideways_tsl_mult': 0.49740646121364535, 'sideways_time_stop': 43, 'sideways_use_sma': True, 'sideways_use_ema': False, 'sideways_use_atr': False, 'sideways_use_adx': True, 'sideways_use_spike': False, 'sideways_rsi_required': False}.
[I 2025-09-01 09:43:07,432] Trial 228 finished with values: [-1000000000.0, 1000000000.0] and parameters: {'p_sma': 13, 'p_std': 46, 'p_atr': 19, 'p_adx': 29, 'rsi_period': 24, 'ema1': 17, 'ema2': 26, 'slip_atr_k': 0.24163764809500426, 'slip_spread_k': 0.6672305027273348, 'spread_hl_frac': 0.03076073596961257, 'bb_std_mult': 1.5624607796971846, 'rsi_os': 44, 'rsi_ob': 51, 'vol_spike': 0.1281851703093155, 'adx_thresh': 34.364927660352556, 'atr_min_pct': 0.010340942084249592, 'atr_max_pct': 0.13639160448767526, 'tp_mult': 1.1777653248659161, 'tsl_mult': 0.7891707584701184, 'strategy': 'breakout', 'time_stop': 246, 'use_sma': True, 'use_atr': False, 'use_adx': False, 'use_ema': True, 'use_spike': True, 'rsi_required': True, 'edge_k': 1.1478733419451648, 'edge_cap': 0.54618230302972, 'bull_strategy': 'mean_reversion', 'bull_bb_std_mult': 3.538883454923427, 'bull_rsi_os': 41, 'bull_rsi_ob': 45, 'bull_adx_thresh': 30.48155107814039, 'bull_atr_min_pct': 0.0016941757702178084, 'bull_atr_max_pct': 0.1494335997748022, 'bull_tp_mult': 2.991653534859214, 'bull_tsl_mult': 0.38543636912068197, 'bull_time_stop': 200, 'bull_use_sma': True, 'bull_use_ema': False, 'bull_use_atr': True, 'bull_use_adx': False, 'bull_use_spike': False, 'bull_rsi_required': True, 'bear_strategy': 'mean_reversion', 'bear_bb_std_mult': 1.354311772488042, 'bear_rsi_os': 55, 'bear_rsi_ob': 79, 'bear_adx_thresh': 23.126192616663815, 'bear_atr_min_pct': 0.0023351828609024317, 'bear_atr_max_pct': 0.04800786730740861, 'bear_tp_mult': 1.137421203693981, 'bear_tsl_mult': 0.5747037645537438, 'bear_time_stop': 159, 'bear_use_sma': True, 'bear_use_ema': False, 'bear_use_atr': True, 'bear_use_adx': False, 'bear_use_spike': False, 'bear_rsi_required': False, 'sideways_strategy': 'mean_reversion', 'sideways_bb_std_mult': 0.6597981882436965, 'sideways_rsi_os': 50, 'sideways_rsi_ob': 93, 'sideways_adx_thresh': 23.55670305407563, 'sideways_atr_min_pct': 0.008364258081206298, 'sideways_atr_max_pct': 0.0694289252590927, 'sideways_tp_mult': 2.326548793332221, 'sideways_tsl_mult': 0.4931726019360506, 'sideways_time_stop': 141, 'sideways_use_sma': True, 'sideways_use_ema': False, 'sideways_use_atr': False, 'sideways_use_adx': True, 'sideways_use_spike': False, 'sideways_rsi_required': False}.
[I 2025-09-01 09:43:07,983] Trial 229 finished with values: [-1000000000.0, 1000000000.0] and parameters: {'p_sma': 10, 'p_std': 41, 'p_atr': 19, 'p_adx': 23, 'rsi_period': 24, 'ema1': 18, 'ema2': 29, 'slip_atr_k': 0.06356270044560357, 'slip_spread_k': 0.6555813525092533, 'spread_hl_frac': 0.04821594178048608, 'bb_std_mult': 1.5639852243325199, 'rsi_os': 44, 'rsi_ob': 94, 'vol_spike': 0.11958253424733278, 'adx_thresh': 28.529323822552076, 'atr_min_pct': 0.013735056456666806, 'atr_max_pct': 0.13591145241207642, 'tp_mult': 1.1372177618212203, 'tsl_mult': 0.7263105261041399, 'strategy': 'breakout', 'time_stop': 237, 'use_sma': True, 'use_atr': False, 'use_adx': False, 'use_ema': True, 'use_spike': True, 'rsi_required': True, 'edge_k': 1.1975167923921686, 'edge_cap': 0.6671541552109037, 'bull_strategy': 'mean_reversion', 'bull_bb_std_mult': 3.5296949772345205, 'bull_rsi_os': 10, 'bull_rsi_ob': 86, 'bull_adx_thresh': 26.181565746861132, 'bull_atr_min_pct': 0.0015658749065618287, 'bull_atr_max_pct': 0.0933750715136846, 'bull_tp_mult': 2.6603017228094106, 'bull_tsl_mult': 0.4671869190152148, 'bull_time_stop': 204, 'bull_use_sma': True, 'bull_use_ema': False, 'bull_use_atr': True, 'bull_use_adx': False, 'bull_use_spike': False, 'bull_rsi_required': True, 'bear_strategy': 'mean_reversion', 'bear_bb_std_mult': 0.9717788292827455, 'bear_rsi_os': 54, 'bear_rsi_ob': 79, 'bear_adx_thresh': 22.908437264822442, 'bear_atr_min_pct': 0.0033621738160689724, 'bear_atr_max_pct': 0.04898785426265878, 'bear_tp_mult': 1.152010449863228, 'bear_tsl_mult': 0.571123521063465, 'bear_time_stop': 138, 'bear_use_sma': True, 'bear_use_ema': False, 'bear_use_atr': True, 'bear_use_adx': False, 'bear_use_spike': False, 'bear_rsi_required': False, 'sideways_strategy': 'mean_reversion', 'sideways_bb_std_mult': 0.8192717635144395, 'sideways_rsi_os': 50, 'sideways_rsi_ob': 91, 'sideways_adx_thresh': 23.545665731023075, 'sideways_atr_min_pct': 0.011111528581044854, 'sideways_atr_max_pct': 0.06334875090015481, 'sideways_tp_mult': 2.6795310117916444, 'sideways_tsl_mult': 0.5395816250651083, 'sideways_time_stop': 44, 'sideways_use_sma': True, 'sideways_use_ema': False, 'sideways_use_atr': False, 'sideways_use_adx': True, 'sideways_use_spike': False, 'sideways_rsi_required': False}.
[I 2025-09-01 09:43:46,989] Trial 232 finished with values: [-1000000000.0, 1000000000.0] and parameters: {'p_sma': 11, 'p_std': 31, 'p_atr': 18, 'p_adx': 27, 'rsi_period': 23, 'ema1': 18, 'ema2': 49, 'slip_atr_k': 0.1853221547575773, 'slip_spread_k': 0.4721640068905123, 'spread_hl_frac': 0.0010616546576128587, 'bb_std_mult': 1.4668207720546222, 'rsi_os': 46, 'rsi_ob': 69, 'vol_spike': 0.10897126136846616, 'adx_thresh': 17.34820309312615, 'atr_min_pct': 0.014449222724092003, 'atr_max_pct': 0.14185658187689548, 'tp_mult': 1.1272314046342407, 'tsl_mult': 0.8037081394570113, 'strategy': 'breakout', 'time_stop': 259, 'use_sma': True, 'use_atr': False, 'use_adx': False, 'use_ema': True, 'use_spike': True, 'rsi_required': True, 'edge_k': 1.2207440156762757, 'edge_cap': 0.6644923674998762, 'bull_strategy': 'mean_reversion', 'bull_bb_std_mult': 0.5790462202382218, 'bull_rsi_os': 10, 'bull_rsi_ob': 47, 'bull_adx_thresh': 31.807770161482672, 'bull_atr_min_pct': 0.0007843148559321721, 'bull_atr_max_pct': 0.010516819395712945, 'bull_tp_mult': 2.3260519046191974, 'bull_tsl_mult': 0.31644806927001934, 'bull_time_stop': 198, 'bull_use_sma': True, 'bull_use_ema': False, 'bull_use_atr': True, 'bull_use_adx': False, 'bull_use_spike': False, 'bull_rsi_required': True, 'bear_strategy': 'mean_reversion', 'bear_bb_std_mult': 1.5731319635467604, 'bear_rsi_os': 6, 'bear_rsi_ob': 69, 'bear_adx_thresh': 21.730977785570516, 'bear_atr_min_pct': 0.005999993619428882, 'bear_atr_max_pct': 0.058677294585474334, 'bear_tp_mult': 1.1857914931385225, 'bear_tsl_mult': 0.6869445928436143, 'bear_time_stop': 199, 'bear_use_sma': True, 'bear_use_ema': False, 'bear_use_atr': True, 'bear_use_adx': False, 'bear_use_spike': True, 'bear_rsi_required': False, 'sideways_strategy': 'mean_reversion', 'sideways_bb_std_mult': 0.7832570585808819, 'sideways_rsi_os': 55, 'sideways_rsi_ob': 91, 'sideways_adx_thresh': 24.030174046654125, 'sideways_atr_min_pct': 0.014803114626383607, 'sideways_atr_max_pct': 0.05729300783917787, 'sideways_tp_mult': 2.3976593507425044, 'sideways_tsl_mult': 0.4669885140235494, 'sideways_time_stop': 16, 'sideways_use_sma': True, 'sideways_use_ema': False, 'sideways_use_atr': False, 'sideways_use_adx': True, 'sideways_use_spike': False, 'sideways_rsi_required': False}.
[I 2025-09-01 09:43:47,432] Trial 234 finished with values: [-0.11019521919437159, 0.11002963820379694] and parameters: {'p_sma': 27, 'p_std': 15, 'p_atr': 18, 'p_adx': 27, 'rsi_period': 22, 'ema1': 18, 'ema2': 48, 'slip_atr_k': 0.05109631513704795, 'slip_spread_k': 0.6511413484845477, 'spread_hl_frac': 0.002242210179351379, 'bb_std_mult': 1.78389790260933, 'rsi_os': 47, 'rsi_ob': 70, 'vol_spike': 0.15420517360922661, 'adx_thresh': 13.16141884133011, 'atr_min_pct': 0.014829733209201425, 'atr_max_pct': 0.14425800345322914, 'tp_mult': 1.1315750748294333, 'tsl_mult': 0.5883437327656426, 'strategy': 'breakout', 'time_stop': 259, 'use_sma': True, 'use_atr': True, 'use_adx': False, 'use_ema': True, 'use_spike': True, 'rsi_required': True, 'edge_k': 0.7067144344445839, 'edge_cap': 0.5925612977154213, 'bull_strategy': 'mean_reversion', 'bull_bb_std_mult': 1.3168604162418012, 'bull_rsi_os': 37, 'bull_rsi_ob': 47, 'bull_adx_thresh': 5.028322431415887, 'bull_atr_min_pct': 3.613339309186509e-05, 'bull_atr_max_pct': 0.08718891194738182, 'bull_tp_mult': 2.4978549400867838, 'bull_tsl_mult': 0.32681430509781023, 'bull_time_stop': 215, 'bull_use_sma': True, 'bull_use_ema': False, 'bull_use_atr': True, 'bull_use_adx': True, 'bull_use_spike': False, 'bull_rsi_required': True, 'bear_strategy': 'mean_reversion', 'bear_bb_std_mult': 0.5772231437729798, 'bear_rsi_os': 7, 'bear_rsi_ob': 69, 'bear_adx_thresh': 15.97169672060023, 'bear_atr_min_pct': 0.004320442996387961, 'bear_atr_max_pct': 0.058436954161714294, 'bear_tp_mult': 1.1887149882619625, 'bear_tsl_mult': 0.685615564581919, 'bear_time_stop': 81, 'bear_use_sma': True, 'bear_use_ema': False, 'bear_use_atr': False, 'bear_use_adx': False, 'bear_use_spike': True, 'bear_rsi_required': False, 'sideways_strategy': 'mean_reversion', 'sideways_bb_std_mult': 3.1342646949583086, 'sideways_rsi_os': 55, 'sideways_rsi_ob': 95, 'sideways_adx_thresh': 20.586631221813438, 'sideways_atr_min_pct': 0.017809290865921555, 'sideways_atr_max_pct': 0.07140837468054351, 'sideways_tp_mult': 2.2542490002314555, 'sideways_tsl_mult': 0.4765735561459701, 'sideways_time_stop': 17, 'sideways_use_sma': True, 'sideways_use_ema': False, 'sideways_use_atr': False, 'sideways_use_adx': True, 'sideways_use_spike': False, 'sideways_rsi_required': True}.
[I 2025-09-01 09:43:47,711] Trial 231 finished with values: [-1000000000.0, 1000000000.0] and parameters: {'p_sma': 27, 'p_std': 39, 'p_atr': 18, 'p_adx': 27, 'rsi_period': 23, 'ema1': 16, 'ema2': 43, 'slip_atr_k': 0.24237963213169902, 'slip_spread_k': 0.6485343115805773, 'spread_hl_frac': 0.04948202649447361, 'bb_std_mult': 1.562825427575768, 'rsi_os': 43, 'rsi_ob': 70, 'vol_spike': 0.06408228815425177, 'adx_thresh': 33.586277425167566, 'atr_min_pct': 0.014654865134730848, 'atr_max_pct': 0.11920900690222447, 'tp_mult': 1.1431704237297247, 'tsl_mult': 0.5906988004784741, 'strategy': 'breakout', 'time_stop': 245, 'use_sma': True, 'use_atr': False, 'use_adx': False, 'use_ema': True, 'use_spike': True, 'rsi_required': True, 'edge_k': 1.2371224905570077, 'edge_cap': 0.6687543552665757, 'bull_strategy': 'mean_reversion', 'bull_bb_std_mult': 1.317785966580824, 'bull_rsi_os': 37, 'bull_rsi_ob': 73, 'bull_adx_thresh': 34.873121562447, 'bull_atr_min_pct': 0.0006279602927371317, 'bull_atr_max_pct': 0.059907684292452815, 'bull_tp_mult': 2.4934328735899656, 'bull_tsl_mult': 0.4253347547759181, 'bull_time_stop': 198, 'bull_use_sma': True, 'bull_use_ema': False, 'bull_use_atr': True, 'bull_use_adx': False, 'bull_use_spike': False, 'bull_rsi_required': True, 'bear_strategy': 'mean_reversion', 'bear_bb_std_mult': 0.9630252152226502, 'bear_rsi_os': 13, 'bear_rsi_ob': 74, 'bear_adx_thresh': 16.03564982971787, 'bear_atr_min_pct': 0.005855643090662086, 'bear_atr_max_pct': 0.059253044332424065, 'bear_tp_mult': 1.2031886166661552, 'bear_tsl_mult': 0.6874788479166274, 'bear_time_stop': 295, 'bear_use_sma': True, 'bear_use_ema': False, 'bear_use_atr': True, 'bear_use_adx': False, 'bear_use_spike': True, 'bear_rsi_required': False, 'sideways_strategy': 'mean_reversion', 'sideways_bb_std_mult': 0.8074044164855831, 'sideways_rsi_os': 10, 'sideways_rsi_ob': 80, 'sideways_adx_thresh': 23.864865072710337, 'sideways_atr_min_pct': 0.014918504205648608, 'sideways_atr_max_pct': 0.059657949684654585, 'sideways_tp_mult': 2.210400697187432, 'sideways_tsl_mult': 0.47600083623301404, 'sideways_time_stop': 16, 'sideways_use_sma': True, 'sideways_use_ema': False, 'sideways_use_atr': False, 'sideways_use_adx': True, 'sideways_use_spike': False, 'sideways_rsi_required': False}.
