[I 2025-09-01 09:24:34,843] Trial 118 finished with values: [-1000000000.0, 1000000000.0] and parameters: {'p_sma': 28, 'p_std': 58, 'p_atr': 30, 'p_adx': 17, 'rsi_period': 28, 'ema1': 8, 'ema2': 13, 'slip_atr_k': 0.12336066258622982, 'slip_spread_k': 0.4800150551598466, 'spread_hl_frac': 0.03195352926285052, 'bb_std_mult': 1.6646908421672708, 'rsi_os': 34, 'rsi_ob': 67, 'vol_spike': 0.011266288167631896, 'adx_thresh': 34.95059555447566, 'atr_min_pct': 9.555852385232343e-05, 'atr_max_pct': 0.08755743092224642, 'tp_mult': 1.0168587055159837, 'tsl_mult': 0.5372379381609775, 'strategy': 'breakout', 'time_stop': 259, 'use_sma': True, 'use_atr': True, 'use_adx': True, 'use_ema': False, 'use_spike': False, 'rsi_required': True, 'edge_k': 1.3431182339324117, 'edge_cap': 0.6278355993099397, 'bull_strategy': 'breakout', 'bull_bb_std_mult': 3.3337475818444005, 'bull_rsi_os': 42, 'bull_rsi_ob': 63, 'bull_adx_thresh': 7.2890500599358585, 'bull_atr_min_pct': 0.023304678914048853, 'bull_atr_max_pct': 0.07333635976206543, 'bull_tp_mult': 1.3161683557353552, 'bull_tsl_mult': 0.5709757684613912, 'bull_time_stop': 173, 'bull_use_sma': False, 'bull_use_ema': False, 'bull_use_atr': False, 'bull_use_adx': False, 'bull_use_spike': True, 'bull_rsi_required': True, 'bear_strategy': 'mean_reversion', 'bear_bb_std_mult': 2.2345752504494922, 'bear_rsi_os': 51, 'bear_rsi_ob': 81, 'bear_adx_thresh': 27.03353215375301, 'bear_atr_min_pct': 0.029235540600641204, 'bear_atr_max_pct': 0.06661076632133056, 'bear_tp_mult': 1.3151132327804214, 'bear_tsl_mult': 0.055266405947455174, 'bear_time_stop': 275, 'bear_use_sma': True, 'bear_use_ema': True, 'bear_use_atr': False, 'bear_use_adx': False, 'bear_use_spike': False, 'bear_rsi_required': True, 'sideways_strategy': 'mean_reversion', 'sideways_bb_std_mult': 1.1846925923894815, 'sideways_rsi_os': 33, 'sideways_rsi_ob': 93, 'sideways_adx_thresh': 16.883882040644366, 'sideways_atr_min_pct': 0.015632751183299185, 'sideways_atr_max_pct': 0.08019346662884391, 'sideways_tp_mult': 1.9061843705786707, 'sideways_tsl_mult': 0.8792409917936364, 'sideways_time_stop': 19, 'sideways_use_sma': False, 'sideways_use_ema': True, 'sideways_use_atr': False, 'sideways_use_adx': True, 'sideways_use_spike': True, 'sideways_rsi_required': True}.
[I 2025-09-01 09:24:35,328] Trial 117 finished with values: [-1000000000.0, 1000000000.0] and parameters: {'p_sma': 28, 'p_std': 58, 'p_atr': 30, 'p_adx': 17, 'rsi_period': 28, 'ema1': 6, 'ema2': 13, 'slip_atr_k': 0.12095128801303068, 'slip_spread_k': 0.5879581079366476, 'spread_hl_frac': 0.03230680653051482, 'bb_std_mult': 1.7568634571816024, 'rsi_os': 34, 'rsi_ob': 72, 'vol_spike': 0.010344610344024535, 'adx_thresh': 34.087148822371866, 'atr_min_pct': 0.006199148489095143, 'atr_max_pct': 0.08955174909817533, 'tp_mult': 1.0732789895451462, 'tsl_mult': 0.567202997565034, 'strategy': 'breakout', 'time_stop': 259, 'use_sma': True, 'use_atr': True, 'use_adx': True, 'use_ema': False, 'use_spike': False, 'rsi_required': True, 'edge_k': 1.3515788942151157, 'edge_cap': 0.6497729474210485, 'bull_strategy': 'breakout', 'bull_bb_std_mult': 3.214213711109729, 'bull_rsi_os': 43, 'bull_rsi_ob': 63, 'bull_adx_thresh': 7.557802313207434, 'bull_atr_min_pct': 0.026262188830763367, 'bull_atr_max_pct': 0.10876147336587828, 'bull_tp_mult': 1.318289307780149, 'bull_tsl_mult': 0.9081476566135253, 'bull_time_stop': 41, 'bull_use_sma': False, 'bull_use_ema': False, 'bull_use_atr': False, 'bull_use_adx': True, 'bull_use_spike': True, 'bull_rsi_required': True, 'bear_strategy': 'mean_reversion', 'bear_bb_std_mult': 2.652608554723578, 'bear_rsi_os': 51, 'bear_rsi_ob': 79, 'bear_adx_thresh': 25.404299362061945, 'bear_atr_min_pct': 0.028842379746074412, 'bear_atr_max_pct': 0.06556033608554343, 'bear_tp_mult': 1.4520071691385703, 'bear_tsl_mult': 0.06600517863079852, 'bear_time_stop': 276, 'bear_use_sma': True, 'bear_use_ema': True, 'bear_use_atr': False, 'bear_use_adx': False, 'bear_use_spike': True, 'bear_rsi_required': True, 'sideways_strategy': 'mean_reversion', 'sideways_bb_std_mult': 1.0689115710397847, 'sideways_rsi_os': 26, 'sideways_rsi_ob': 93, 'sideways_adx_thresh': 19.18704581821383, 'sideways_atr_min_pct': 0.017324817154060042, 'sideways_atr_max_pct': 0.07970235306713186, 'sideways_tp_mult': 1.9119344233503466, 'sideways_tsl_mult': 0.10586581598619133, 'sideways_time_stop': 15, 'sideways_use_sma': False, 'sideways_use_ema': True, 'sideways_use_atr': False, 'sideways_use_adx': True, 'sideways_use_spike': True, 'sideways_rsi_required': True}.
[I 2025-09-01 09:25:15,474] Trial 121 finished with values: [-0.027993727110906863, 0.027763968740489767] and parameters: {'p_sma': 22, 'p_std': 57, 'p_atr': 30, 'p_adx': 17, 'rsi_period': 23, 'ema1': 5, 'ema2': 15, 'slip_atr_k': 0.10376818004480556, 'slip_spread_k': 0.5902860584234212, 'spread_hl_frac': 0.03254893958202771, 'bb_std_mult': 1.2515917464150905, 'rsi_os': 38, 'rsi_ob': 65, 'vol_spike': 0.020650275108564643, 'adx_thresh': 34.07434450322328, 'atr_min_pct': 0.006017302824811626, 'atr_max_pct': 0.08948473268416268, 'tp_mult': 1.0741397108142308, 'tsl_mult': 0.5244875611003125, 'strategy': 'breakout', 'time_stop': 245, 'use_sma': True, 'use_atr': True, 'use_adx': True, 'use_ema': False, 'use_spike': True, 'rsi_required': True, 'edge_k': 1.2969629891257153, 'edge_cap': 0.8053822366146818, 'bull_strategy': 'breakout', 'bull_bb_std_mult': 3.1963403821523473, 'bull_rsi_os': 45, 'bull_rsi_ob': 61, 'bull_adx_thresh': 8.162584507746764, 'bull_atr_min_pct': 7.952899425762647e-05, 'bull_atr_max_pct': 0.10878536412701995, 'bull_tp_mult': 1.3088086329123831, 'bull_tsl_mult': 0.9407423577269597, 'bull_time_stop': 42, 'bull_use_sma': True, 'bull_use_ema': False, 'bull_use_atr': True, 'bull_use_adx': True, 'bull_use_spike': True, 'bull_rsi_required': True, 'bear_strategy': 'mean_reversion', 'bear_bb_std_mult': 2.538911754435473, 'bear_rsi_os': 52, 'bear_rsi_ob': 78, 'bear_adx_thresh': 30.495413162289285, 'bear_atr_min_pct': 0.028487616064827675, 'bear_atr_max_pct': 0.07133354878077877, 'bear_tp_mult': 1.4268981215716854, 'bear_tsl_mult': 0.21558699873237352, 'bear_time_stop': 291, 'bear_use_sma': True, 'bear_use_ema': True, 'bear_use_atr': False, 'bear_use_adx': False, 'bear_use_spike': True, 'bear_rsi_required': True, 'sideways_strategy': 'mean_reversion', 'sideways_bb_std_mult': 0.9891915507773221, 'sideways_rsi_os': 30, 'sideways_rsi_ob': 94, 'sideways_adx_thresh': 19.155537853601814, 'sideways_atr_min_pct': 0.01760581095515488, 'sideways_atr_max_pct': 0.0662674863855746, 'sideways_tp_mult': 2.0155142888737254, 'sideways_tsl_mult': 0.3588337472208877, 'sideways_time_stop': 35, 'sideways_use_sma': True, 'sideways_use_ema': True, 'sideways_use_atr': False, 'sideways_use_adx': True, 'sideways_use_spike': False, 'sideways_rsi_required': False}.
[I 2025-09-01 09:25:16,145] Trial 122 finished with values: [-0.026654558664311656, 0.026439041132377935] and parameters: {'p_sma': 22, 'p_std': 55, 'p_atr': 30, 'p_adx': 17, 'rsi_period': 20, 'ema1': 19, 'ema2': 15, 'slip_atr_k': 0.048513911133673746, 'slip_spread_k': 0.6393505347019326, 'spread_hl_frac': 0.03556226223815919, 'bb_std_mult': 1.23978258184309, 'rsi_os': 38, 'rsi_ob': 63, 'vol_spike': 0.019299414713950802, 'adx_thresh': 31.486983695582637, 'atr_min_pct': 0.02008140985669027, 'atr_max_pct': 0.08404367308351936, 'tp_mult': 1.070477106793053, 'tsl_mult': 0.5027371885815752, 'strategy': 'breakout', 'time_stop': 281, 'use_sma': True, 'use_atr': True, 'use_adx': False, 'use_ema': False, 'use_spike': True, 'rsi_required': True, 'edge_k': 1.2384607987249705, 'edge_cap': 0.8307856400629936, 'bull_strategy': 'breakout', 'bull_bb_std_mult': 3.5328789850576294, 'bull_rsi_os': 46, 'bull_rsi_ob': 47, 'bull_adx_thresh': 7.644613222885597, 'bull_atr_min_pct': 0.00017361035969088888, 'bull_atr_max_pct': 0.10288316745296805, 'bull_tp_mult': 1.374457763990086, 'bull_tsl_mult': 0.9443418806349848, 'bull_time_stop': 183, 'bull_use_sma': True, 'bull_use_ema': False, 'bull_use_atr': True, 'bull_use_adx': False, 'bull_use_spike': False, 'bull_rsi_required': True, 'bear_strategy': 'mean_reversion', 'bear_bb_std_mult': 2.000108316806792, 'bear_rsi_os': 53, 'bear_rsi_ob': 83, 'bear_adx_thresh': 25.823573019938827, 'bear_atr_min_pct': 0.026805048534530834, 'bear_atr_max_pct': 0.07219769991300029, 'bear_tp_mult': 1.5464320664827362, 'bear_tsl_mult': 0.3043890362225354, 'bear_time_stop': 291, 'bear_use_sma': True, 'bear_use_ema': True, 'bear_use_atr': False, 'bear_use_adx': False, 'bear_use_spike': True, 'bear_rsi_required': True, 'sideways_strategy': 'mean_reversion', 'sideways_bb_std_mult': 1.0238453862731776, 'sideways_rsi_os': 51, 'sideways_rsi_ob': 90, 'sideways_adx_thresh': 20.439986739756918, 'sideways_atr_min_pct': 0.01930845845722994, 'sideways_atr_max_pct': 0.06646345693808609, 'sideways_tp_mult': 2.0090666708953537, 'sideways_tsl_mult': 0.9483983658662747, 'sideways_time_stop': 33, 'sideways_use_sma': True, 'sideways_use_ema': True, 'sideways_use_atr': False, 'sideways_use_adx': True, 'sideways_use_spike': False, 'sideways_rsi_required': False}.
[I 2025-09-01 09:25:16,551] Trial 120 finished with values: [-0.03081289712341151, 0.030584157215078654] and parameters: {'p_sma': 29, 'p_std': 57, 'p_atr': 30, 'p_adx': 17, 'rsi_period': 28, 'ema1': 5, 'ema2': 13, 'slip_atr_k': 0.10170266128196111, 'slip_spread_k': 0.60075616072975, 'spread_hl_frac': 0.0331289034465683, 'bb_std_mult': 1.6247992901120163, 'rsi_os': 34, 'rsi_ob': 65, 'vol_spike': 0.012817146415207259, 'adx_thresh': 34.32249224947397, 'atr_min_pct': 0.005763037617907743, 'atr_max_pct': 0.0886412430687237, 'tp_mult': 1.0194720363597694, 'tsl_mult': 0.5255230116830584, 'strategy': 'breakout', 'time_stop': 260, 'use_sma': True, 'use_atr': True, 'use_adx': True, 'use_ema': False, 'use_spike': False, 'rsi_required': True, 'edge_k': 1.3498855863799366, 'edge_cap': 0.35460744913806763, 'bull_strategy': 'breakout', 'bull_bb_std_mult': 3.2031912146888364, 'bull_rsi_os': 42, 'bull_rsi_ob': 63, 'bull_adx_thresh': 7.8040748138293194, 'bull_atr_min_pct': 0.00025541935215912836, 'bull_atr_max_pct': 0.10944421320237847, 'bull_tp_mult': 1.3048120983683766, 'bull_tsl_mult': 0.9383870281350848, 'bull_time_stop': 227, 'bull_use_sma': False, 'bull_use_ema': False, 'bull_use_atr': False, 'bull_use_adx': True, 'bull_use_spike': True, 'bull_rsi_required': True, 'bear_strategy': 'mean_reversion', 'bear_bb_std_mult': 2.2521358023604643, 'bear_rsi_os': 52, 'bear_rsi_ob': 79, 'bear_adx_thresh': 25.832864031732313, 'bear_atr_min_pct': 0.02892191515586995, 'bear_atr_max_pct': 0.0648269850391264, 'bear_tp_mult': 1.320483691974119, 'bear_tsl_mult': 0.047284698488648816, 'bear_time_stop': 274, 'bear_use_sma': True, 'bear_use_ema': True, 'bear_use_atr': False, 'bear_use_adx': False, 'bear_use_spike': False, 'bear_rsi_required': True, 'sideways_strategy': 'mean_reversion', 'sideways_bb_std_mult': 0.9907186877687982, 'sideways_rsi_os': 29, 'sideways_rsi_ob': 93, 'sideways_adx_thresh': 18.998843673241705, 'sideways_atr_min_pct': 0.015763650561627245, 'sideways_atr_max_pct': 0.06709311625552179, 'sideways_tp_mult': 1.909443068602333, 'sideways_tsl_mult': 0.8866611196129316, 'sideways_time_stop': 15, 'sideways_use_sma': True, 'sideways_use_ema': True, 'sideways_use_atr': False, 'sideways_use_adx': True, 'sideways_use_spike': True, 'sideways_rsi_required': True}.
[I 2025-09-01 09:25:17,069] Trial 119 finished with values: [-1000000000.0, 1000000000.0] and parameters: {'p_sma': 28, 'p_std': 58, 'p_atr': 30, 'p_adx': 17, 'rsi_period': 28, 'ema1': 5, 'ema2': 13, 'slip_atr_k': 0.05123631372611118, 'slip_spread_k': 0.5907144513295121, 'spread_hl_frac': 0.03245660127154026, 'bb_std_mult': 1.5813110259175918, 'rsi_os': 34, 'rsi_ob': 72, 'vol_spike': 0.012260340800065187, 'adx_thresh': 34.86186730111837, 'atr_min_pct': 0.006078550335355731, 'atr_max_pct': 0.0894696673297014, 'tp_mult': 1.0646966908709474, 'tsl_mult': 0.5364636936684106, 'strategy': 'breakout', 'time_stop': 258, 'use_sma': True, 'use_atr': True, 'use_adx': True, 'use_ema': False, 'use_spike': False, 'rsi_required': True, 'edge_k': 1.310369425877022, 'edge_cap': 0.6614459678924561, 'bull_strategy': 'breakout', 'bull_bb_std_mult': 3.2603617508886398, 'bull_rsi_os': 46, 'bull_rsi_ob': 63, 'bull_adx_thresh': 10.766272585586766, 'bull_atr_min_pct': 0.013880005183818883, 'bull_atr_max_pct': 0.10427151069074382, 'bull_tp_mult': 1.3484412515383775, 'bull_tsl_mult': 0.8334149357436585, 'bull_time_stop': 39, 'bull_use_sma': False, 'bull_use_ema': False, 'bull_use_atr': False, 'bull_use_adx': True, 'bull_use_spike': True, 'bull_rsi_required': True, 'bear_strategy': 'mean_reversion', 'bear_bb_std_mult': 2.2334613441270457, 'bear_rsi_os': 52, 'bear_rsi_ob': 81, 'bear_adx_thresh': 25.602730278037328, 'bear_atr_min_pct': 0.029184159248833913, 'bear_atr_max_pct': 0.06456127141592415, 'bear_tp_mult': 1.3221504236654507, 'bear_tsl_mult': 0.04940342064524883, 'bear_time_stop': 278, 'bear_use_sma': True, 'bear_use_ema': True, 'bear_use_atr': False, 'bear_use_adx': False, 'bear_use_spike': False, 'bear_rsi_required': True, 'sideways_strategy': 'mean_reversion', 'sideways_bb_std_mult': 1.0299677536671206, 'sideways_rsi_os': 29, 'sideways_rsi_ob': 92, 'sideways_adx_thresh': 18.97569766404653, 'sideways_atr_min_pct': 0.01548540556433736, 'sideways_atr_max_pct': 0.06756412478542985, 'sideways_tp_mult': 1.9232786816945966, 'sideways_tsl_mult': 0.8789843091326861, 'sideways_time_stop': 34, 'sideways_use_sma': False, 'sideways_use_ema': True, 'sideways_use_atr': False, 'sideways_use_adx': True, 'sideways_use_spike': True, 'sideways_rsi_required': True}.
[I 2025-09-01 09:25:59,416] Trial 125 finished with values: [-0.026757427327362193, 0.026540701448139248] and parameters: {'p_sma': 22, 'p_std': 55, 'p_atr': 30, 'p_adx': 18, 'rsi_period': 22, 'ema1': 19, 'ema2': 14, 'slip_atr_k': 0.05407632987523055, 'slip_spread_k': 0.6379653584014827, 'spread_hl_frac': 0.03307093102486209, 'bb_std_mult': 1.2389783288997593, 'rsi_os': 37, 'rsi_ob': 65, 'vol_spike': 0.021747129149340516, 'adx_thresh': 31.84884769786783, 'atr_min_pct': 0.008131274187741351, 'atr_max_pct': 0.08458103086034374, 'tp_mult': 1.062509352838051, 'tsl_mult': 0.43747969725330826, 'strategy': 'breakout', 'time_stop': 281, 'use_sma': True, 'use_atr': True, 'use_adx': False, 'use_ema': False, 'use_spike': True, 'rsi_required': True, 'edge_k': 1.2861315481340772, 'edge_cap': 0.8315277196073609, 'bull_strategy': 'breakout', 'bull_bb_std_mult': 3.554339240678944, 'bull_rsi_os': 46, 'bull_rsi_ob': 46, 'bull_adx_thresh': 5.810977174781929, 'bull_atr_min_pct': 0.00017978858552902032, 'bull_atr_max_pct': 0.10091912374496642, 'bull_tp_mult': 1.5183961493571239, 'bull_tsl_mult': 0.950499208597535, 'bull_time_stop': 230, 'bull_use_sma': True, 'bull_use_ema': False, 'bull_use_atr': True, 'bull_use_adx': True, 'bull_use_spike': False, 'bull_rsi_required': True, 'bear_strategy': 'mean_reversion', 'bear_bb_std_mult': 1.9167710294466456, 'bear_rsi_os': 53, 'bear_rsi_ob': 87, 'bear_adx_thresh': 24.03594642568009, 'bear_atr_min_pct': 0.026794012670891685, 'bear_atr_max_pct': 0.07142556936241626, 'bear_tp_mult': 1.59114074817718, 'bear_tsl_mult': 0.310793443333227, 'bear_time_stop': 290, 'bear_use_sma': True, 'bear_use_ema': True, 'bear_use_atr': False, 'bear_use_adx': False, 'bear_use_spike': False, 'bear_rsi_required': True, 'sideways_strategy': 'mean_reversion', 'sideways_bb_std_mult': 0.9249128827530013, 'sideways_rsi_os': 52, 'sideways_rsi_ob': 90, 'sideways_adx_thresh': 20.536887202424072, 'sideways_atr_min_pct': 0.019884826267422655, 'sideways_atr_max_pct': 0.06703795089414694, 'sideways_tp_mult': 2.0339456145026102, 'sideways_tsl_mult': 0.9445422020127553, 'sideways_time_stop': 24, 'sideways_use_sma': True, 'sideways_use_ema': True, 'sideways_use_atr': False, 'sideways_use_adx': True, 'sideways_use_spike': False, 'sideways_rsi_required': False}.
[I 2025-09-01 09:25:59,437] Trial 123 finished with values: [-0.024901993526938004, 0.024700455923296494] and parameters: {'p_sma': 19, 'p_std': 55, 'p_atr': 30, 'p_adx': 18, 'rsi_period': 20, 'ema1': 19, 'ema2': 17, 'slip_atr_k': 0.09811522403691529, 'slip_spread_k': 0.5532576501205272, 'spread_hl_frac': 0.029969121784576645, 'bb_std_mult': 1.5529379611728231, 'rsi_os': 38, 'rsi_ob': 65, 'vol_spike': 0.025716050056959046, 'adx_thresh': 31.26852116464306, 'atr_min_pct': 0.005236711872429427, 'atr_max_pct': 0.0847759965506866, 'tp_mult': 1.0577129158829657, 'tsl_mult': 0.5153182752245493, 'strategy': 'breakout', 'time_stop': 297, 'use_sma': True, 'use_atr': True, 'use_adx': False, 'use_ema': False, 'use_spike': True, 'rsi_required': True, 'edge_k': 1.2579053015673758, 'edge_cap': 0.8228498165691751, 'bull_strategy': 'breakout', 'bull_bb_std_mult': 3.1613880252878652, 'bull_rsi_os': 45, 'bull_rsi_ob': 60, 'bull_adx_thresh': 8.394428012054773, 'bull_atr_min_pct': 0.00010912621908406939, 'bull_atr_max_pct': 0.09988932922230538, 'bull_tp_mult': 1.52029150854305, 'bull_tsl_mult': 0.943860798947953, 'bull_time_stop': 59, 'bull_use_sma': True, 'bull_use_ema': False, 'bull_use_atr': True, 'bull_use_adx': True, 'bull_use_spike': False, 'bull_rsi_required': True, 'bear_strategy': 'mean_reversion', 'bear_bb_std_mult': 2.033020190844456, 'bear_rsi_os': 53, 'bear_rsi_ob': 78, 'bear_adx_thresh': 30.110115341399446, 'bear_atr_min_pct': 0.027706872439892626, 'bear_atr_max_pct': 0.07100674432434037, 'bear_tp_mult': 1.4260668456140573, 'bear_tsl_mult': 0.21588751017882038, 'bear_time_stop': 288, 'bear_use_sma': True, 'bear_use_ema': True, 'bear_use_atr': False, 'bear_use_adx': False, 'bear_use_spike': False, 'bear_rsi_required': True, 'sideways_strategy': 'mean_reversion', 'sideways_bb_std_mult': 0.9836656070579973, 'sideways_rsi_os': 29, 'sideways_rsi_ob': 94, 'sideways_adx_thresh': 20.628335470727304, 'sideways_atr_min_pct': 0.019316946781752733, 'sideways_atr_max_pct': 0.06616026139685244, 'sideways_tp_mult': 2.176681839297646, 'sideways_tsl_mult': 0.356508149700152, 'sideways_time_stop': 27, 'sideways_use_sma': True, 'sideways_use_ema': True, 'sideways_use_atr': False, 'sideways_use_adx': True, 'sideways_use_spike': False, 'sideways_rsi_required': False}.
[I 2025-09-01 09:25:59,743] Trial 124 finished with values: [-0.024897613113077588, 0.024681474438505324] and parameters: {'p_sma': 20, 'p_std': 55, 'p_atr': 30, 'p_adx': 18, 'rsi_period': 23, 'ema1': 19, 'ema2': 17, 'slip_atr_k': 0.05113686964563823, 'slip_spread_k': 0.6426672127516976, 'spread_hl_frac': 0.03322415167361458, 'bb_std_mult': 1.2530335947257534, 'rsi_os': 38, 'rsi_ob': 65, 'vol_spike': 0.021109834421086385, 'adx_thresh': 31.550660523128162, 'atr_min_pct': 0.023405828132956774, 'atr_max_pct': 0.0849534540061117, 'tp_mult': 1.0489383335078055, 'tsl_mult': 0.4970732846509604, 'strategy': 'breakout', 'time_stop': 283, 'use_sma': True, 'use_atr': True, 'use_adx': False, 'use_ema': False, 'use_spike': True, 'rsi_required': True, 'edge_k': 1.2626799330071987, 'edge_cap': 0.837530193824105, 'bull_strategy': 'breakout', 'bull_bb_std_mult': 3.5375829842888984, 'bull_rsi_os': 46, 'bull_rsi_ob': 48, 'bull_adx_thresh': 5.975625933239005, 'bull_atr_min_pct': 0.0003861668703832076, 'bull_atr_max_pct': 0.09867486595427777, 'bull_tp_mult': 1.4037995979923548, 'bull_tsl_mult': 0.9457439301043763, 'bull_time_stop': 224, 'bull_use_sma': True, 'bull_use_ema': False, 'bull_use_atr': True, 'bull_use_adx': False, 'bull_use_spike': False, 'bull_rsi_required': True, 'bear_strategy': 'mean_reversion', 'bear_bb_std_mult': 2.034665805048064, 'bear_rsi_os': 53, 'bear_rsi_ob': 94, 'bear_adx_thresh': 23.911565363372958, 'bear_atr_min_pct': 0.02672490663072023, 'bear_atr_max_pct': 0.072382783452232, 'bear_tp_mult': 1.5633745262272651, 'bear_tsl_mult': 0.29795569358897445, 'bear_time_stop': 291, 'bear_use_sma': True, 'bear_use_ema': True, 'bear_use_atr': False, 'bear_use_adx': False, 'bear_use_spike': False, 'bear_rsi_required': True, 'sideways_strategy': 'mean_reversion', 'sideways_bb_std_mult': 0.9584779236821713, 'sideways_rsi_os': 52, 'sideways_rsi_ob': 90, 'sideways_adx_thresh': 20.908709134288593, 'sideways_atr_min_pct': 0.021240472964654842, 'sideways_atr_max_pct': 0.06801224783565704, 'sideways_tp_mult': 2.0254947487226116, 'sideways_tsl_mult': 0.4093121678783041, 'sideways_time_stop': 34, 'sideways_use_sma': True, 'sideways_use_ema': True, 'sideways_use_atr': False, 'sideways_use_adx': True, 'sideways_use_spike': False, 'sideways_rsi_required': False}.
