[I 2025-09-01 10:03:56,425] Trial 352 finished with values: [-1000000000.0, 1000000000.0] and parameters: {'p_sma': 15, 'p_std': 53, 'p_atr': 19, 'p_adx': 23, 'rsi_period': 16, 'ema1': 16, 'ema2': 12, 'slip_atr_k': 0.12095967067462297, 'slip_spread_k': 0.6619538394694765, 'spread_hl_frac': 0.01734426084849709, 'bb_std_mult': 1.4895949271658613, 'rsi_os': 46, 'rsi_ob': 66, 'vol_spike': 0.10308243914779532, 'adx_thresh': 27.36410178241054, 'atr_min_pct': 0.016163040192559673, 'atr_max_pct': 0.10479112491935583, 'tp_mult': 1.150559300414982, 'tsl_mult': 0.6829829896251781, 'strategy': 'breakout', 'time_stop': 224, 'use_sma': True, 'use_atr': False, 'use_adx': False, 'use_ema': True, 'use_spike': True, 'rsi_required': True, 'edge_k': 1.4548007801798173, 'edge_cap': 0.5984258501491655, 'bull_strategy': 'mean_reversion', 'bull_bb_std_mult': 3.5190419579520364, 'bull_rsi_os': 45, 'bull_rsi_ob': 46, 'bull_adx_thresh': 5.810209449107733, 'bull_atr_min_pct': 0.026390559915703833, 'bull_atr_max_pct': 0.09835379818477999, 'bull_tp_mult': 2.6781634415943185, 'bull_tsl_mult': 0.5300962418276379, 'bull_time_stop': 54, 'bull_use_sma': True, 'bull_use_ema': False, 'bull_use_atr': True, 'bull_use_adx': False, 'bull_use_spike': False, 'bull_rsi_required': True, 'bear_strategy': 'mean_reversion', 'bear_bb_std_mult': 0.7857433182253971, 'bear_rsi_os': 34, 'bear_rsi_ob': 78, 'bear_adx_thresh': 14.724488225337904, 'bear_atr_min_pct': 0.013735262485523113, 'bear_atr_max_pct': 0.08147822974005492, 'bear_tp_mult': 1.1209891582541565, 'bear_tsl_mult': 0.10049041962164795, 'bear_time_stop': 300, 'bear_use_sma': True, 'bear_use_ema': False, 'bear_use_atr': True, 'bear_use_adx': False, 'bear_use_spike': False, 'bear_rsi_required': False, 'sideways_strategy': 'mean_reversion', 'sideways_bb_std_mult': 1.9228312589281418, 'sideways_rsi_os': 32, 'sideways_rsi_ob': 88, 'sideways_adx_thresh': 23.60674527351224, 'sideways_atr_min_pct': 0.00681487930832142, 'sideways_atr_max_pct': 0.07490541432491488, 'sideways_tp_mult': 1.3980074564639482, 'sideways_tsl_mult': 0.3084632994002227, 'sideways_time_stop': 39, 'sideways_use_sma': True, 'sideways_use_ema': False, 'sideways_use_atr': False, 'sideways_use_adx': True, 'sideways_use_spike': False, 'sideways_rsi_required': False}.
[I 2025-09-01 10:03:56,787] Trial 354 finished with values: [-0.04233275559590444, 0.04206453558325843] and parameters: {'p_sma': 44, 'p_std': 55, 'p_atr': 18, 'p_adx': 13, 'rsi_period': 83, 'ema1': 29, 'ema2': 39, 'slip_atr_k': 0.2209752132675472, 'slip_spread_k': 0.6543751734993488, 'spread_hl_frac': 0.028066226406543108, 'bb_std_mult': 1.4887405581315778, 'rsi_os': 46, 'rsi_ob': 79, 'vol_spike': 0.10354373381683732, 'adx_thresh': 20.371929437908292, 'atr_min_pct': 0.011394553439483122, 'atr_max_pct': 0.10880047396346176, 'tp_mult': 1.1095258466164855, 'tsl_mult': 0.6856192670478799, 'strategy': 'breakout', 'time_stop': 252, 'use_sma': True, 'use_atr': False, 'use_adx': True, 'use_ema': True, 'use_spike': True, 'rsi_required': False, 'edge_k': 1.5321511424537504, 'edge_cap': 0.13242253963920292, 'bull_strategy': 'mean_reversion', 'bull_bb_std_mult': 3.5189013043047255, 'bull_rsi_os': 46, 'bull_rsi_ob': 48, 'bull_adx_thresh': 5.720400445860932, 'bull_atr_min_pct': 0.0007058417891551208, 'bull_atr_max_pct': 0.013133155525855228, 'bull_tp_mult': 1.8162247386778785, 'bull_tsl_mult': 0.4588136069324012, 'bull_time_stop': 137, 'bull_use_sma': False, 'bull_use_ema': False, 'bull_use_atr': True, 'bull_use_adx': False, 'bull_use_spike': False, 'bull_rsi_required': False, 'bear_strategy': 'mean_reversion', 'bear_bb_std_mult': 3.1809699204412976, 'bear_rsi_os': 24, 'bear_rsi_ob': 79, 'bear_adx_thresh': 10.685057388635117, 'bear_atr_min_pct': 0.013617240444393693, 'bear_atr_max_pct': 0.03855134181717912, 'bear_tp_mult': 1.183596188976861, 'bear_tsl_mult': 0.3890464194120987, 'bear_time_stop': 29, 'bear_use_sma': True, 'bear_use_ema': False, 'bear_use_atr': True, 'bear_use_adx': False, 'bear_use_spike': True, 'bear_rsi_required': False, 'sideways_strategy': 'mean_reversion', 'sideways_bb_std_mult': 2.5004026289519388, 'sideways_rsi_os': 52, 'sideways_rsi_ob': 89, 'sideways_adx_thresh': 32.6545840156314, 'sideways_atr_min_pct': 0.016286060848491345, 'sideways_atr_max_pct': 0.07261780654998883, 'sideways_tp_mult': 2.47209826840011, 'sideways_tsl_mult': 0.32089669294373346, 'sideways_time_stop': 208, 'sideways_use_sma': True, 'sideways_use_ema': False, 'sideways_use_atr': True, 'sideways_use_adx': False, 'sideways_use_spike': False, 'sideways_rsi_required': False}.
[I 2025-09-01 10:03:57,037] Trial 351 finished with values: [-1000000000.0, 1000000000.0] and parameters: {'p_sma': 17, 'p_std': 53, 'p_atr': 19, 'p_adx': 23, 'rsi_period': 16, 'ema1': 17, 'ema2': 16, 'slip_atr_k': 0.05664919719878861, 'slip_spread_k': 0.6638745644295069, 'spread_hl_frac': 0.02897407228662941, 'bb_std_mult': 0.7378770191637811, 'rsi_os': 51, 'rsi_ob': 76, 'vol_spike': 0.278250177546134, 'adx_thresh': 5.661086924397003, 'atr_min_pct': 0.016134726007611195, 'atr_max_pct': 0.10555623833604116, 'tp_mult': 2.0384290207971145, 'tsl_mult': 0.6713630170979171, 'strategy': 'breakout', 'time_stop': 267, 'use_sma': True, 'use_atr': False, 'use_adx': False, 'use_ema': True, 'use_spike': True, 'rsi_required': True, 'edge_k': 1.4615815144095576, 'edge_cap': 0.11530212383226812, 'bull_strategy': 'mean_reversion', 'bull_bb_std_mult': 2.311189994029939, 'bull_rsi_os': 45, 'bull_rsi_ob': 79, 'bull_adx_thresh': 27.092318117681256, 'bull_atr_min_pct': 0.0008914698645028854, 'bull_atr_max_pct': 0.02816610704947755, 'bull_tp_mult': 1.8832960902904294, 'bull_tsl_mult': 0.4329896858652011, 'bull_time_stop': 197, 'bull_use_sma': True, 'bull_use_ema': False, 'bull_use_atr': True, 'bull_use_adx': False, 'bull_use_spike': False, 'bull_rsi_required': True, 'bear_strategy': 'mean_reversion', 'bear_bb_std_mult': 0.7692816585984128, 'bear_rsi_os': 34, 'bear_rsi_ob': 71, 'bear_adx_thresh': 22.38142402034739, 'bear_atr_min_pct': 0.024217322804803, 'bear_atr_max_pct': 0.04859387633579801, 'bear_tp_mult': 2.5057734823480944, 'bear_tsl_mult': 0.39290373689684177, 'bear_time_stop': 17, 'bear_use_sma': False, 'bear_use_ema': False, 'bear_use_atr': True, 'bear_use_adx': False, 'bear_use_spike': False, 'bear_rsi_required': True, 'sideways_strategy': 'mean_reversion', 'sideways_bb_std_mult': 2.939097139448882, 'sideways_rsi_os': 53, 'sideways_rsi_ob': 94, 'sideways_adx_thresh': 23.878632971949784, 'sideways_atr_min_pct': 0.016287486212761833, 'sideways_atr_max_pct': 0.06808363687981307, 'sideways_tp_mult': 1.4302400011404868, 'sideways_tsl_mult': 0.5173852812808788, 'sideways_time_stop': 284, 'sideways_use_sma': True, 'sideways_use_ema': False, 'sideways_use_atr': False, 'sideways_use_adx': True, 'sideways_use_spike': True, 'sideways_rsi_required': False}.
[I 2025-09-01 10:03:57,209] Trial 353 finished with values: [-1000000000.0, 1000000000.0] and parameters: {'p_sma': 15, 'p_std': 55, 'p_atr': 18, 'p_adx': 13, 'rsi_period': 71, 'ema1': 11, 'ema2': 16, 'slip_atr_k': 0.0006065992542681059, 'slip_spread_k': 0.6628821389446141, 'spread_hl_frac': 0.032678020826255406, 'bb_std_mult': 1.4729258957133635, 'rsi_os': 29, 'rsi_ob': 69, 'vol_spike': 0.10802874362978981, 'adx_thresh': 27.210127076946236, 'atr_min_pct': 0.011053459759255473, 'atr_max_pct': 0.04462931662596742, 'tp_mult': 1.1436179549544394, 'tsl_mult': 0.6829041134710764, 'strategy': 'breakout', 'time_stop': 252, 'use_sma': True, 'use_atr': False, 'use_adx': False, 'use_ema': True, 'use_spike': True, 'rsi_required': True, 'edge_k': 1.5325895529272102, 'edge_cap': 0.5894570459021086, 'bull_strategy': 'mean_reversion', 'bull_bb_std_mult': 3.0760251076501532, 'bull_rsi_os': 44, 'bull_rsi_ob': 46, 'bull_adx_thresh': 5.600308544326939, 'bull_atr_min_pct': 0.0007838511025150474, 'bull_atr_max_pct': 0.09180397654663755, 'bull_tp_mult': 1.989054216342237, 'bull_tsl_mult': 0.2571650539792587, 'bull_time_stop': 8, 'bull_use_sma': False, 'bull_use_ema': False, 'bull_use_atr': True, 'bull_use_adx': False, 'bull_use_spike': False, 'bull_rsi_required': True, 'bear_strategy': 'mean_reversion', 'bear_bb_std_mult': 0.7960504194862774, 'bear_rsi_os': 34, 'bear_rsi_ob': 76, 'bear_adx_thresh': 25.085419503040587, 'bear_atr_min_pct': 0.009113059416183018, 'bear_atr_max_pct': 0.012298632294137302, 'bear_tp_mult': 1.120297954309925, 'bear_tsl_mult': 0.5446067731966541, 'bear_time_stop': 295, 'bear_use_sma': True, 'bear_use_ema': False, 'bear_use_atr': True, 'bear_use_adx': False, 'bear_use_spike': False, 'bear_rsi_required': False, 'sideways_strategy': 'mean_reversion', 'sideways_bb_std_mult': 0.5787219789311774, 'sideways_rsi_os': 52, 'sideways_rsi_ob': 88, 'sideways_adx_thresh': 17.06908852795323, 'sideways_atr_min_pct': 0.011220006026003006, 'sideways_atr_max_pct': 0.10066333149121923, 'sideways_tp_mult': 1.786647683410616, 'sideways_tsl_mult': 0.2924296397909835, 'sideways_time_stop': 96, 'sideways_use_sma': True, 'sideways_use_ema': False, 'sideways_use_atr': False, 'sideways_use_adx': True, 'sideways_use_spike': False, 'sideways_rsi_required': False}.
[I 2025-09-01 10:04:37,192] Trial 356 finished with values: [-1000000000.0, 1000000000.0] and parameters: {'p_sma': 16, 'p_std': 46, 'p_atr': 23, 'p_adx': 28, 'rsi_period': 26, 'ema1': 21, 'ema2': 16, 'slip_atr_k': 0.06910910719605744, 'slip_spread_k': 0.8329595544831858, 'spread_hl_frac': 0.011340013231541757, 'bb_std_mult': 1.580106584468002, 'rsi_os': 29, 'rsi_ob': 69, 'vol_spike': 0.13696159555441859, 'adx_thresh': 22.15105876311036, 'atr_min_pct': 0.02478820349883379, 'atr_max_pct': 0.08169890641104877, 'tp_mult': 1.2440377655814334, 'tsl_mult': 0.6636277974125168, 'strategy': 'breakout', 'time_stop': 246, 'use_sma': True, 'use_atr': True, 'use_adx': False, 'use_ema': True, 'use_spike': True, 'rsi_required': True, 'edge_k': 0.2575398718228462, 'edge_cap': 0.2608760751493685, 'bull_strategy': 'mean_reversion', 'bull_bb_std_mult': 3.3533844221580362, 'bull_rsi_os': 49, 'bull_rsi_ob': 47, 'bull_adx_thresh': 17.60544002330029, 'bull_atr_min_pct': 0.027590593948692073, 'bull_atr_max_pct': 0.09105387093830573, 'bull_tp_mult': 2.338485343295156, 'bull_tsl_mult': 0.43650014667854176, 'bull_time_stop': 168, 'bull_use_sma': True, 'bull_use_ema': False, 'bull_use_atr': False, 'bull_use_adx': True, 'bull_use_spike': True, 'bull_rsi_required': True, 'bear_strategy': 'mean_reversion', 'bear_bb_std_mult': 1.0586367249852513, 'bear_rsi_os': 54, 'bear_rsi_ob': 71, 'bear_adx_thresh': 16.51008055218939, 'bear_atr_min_pct': 0.009010570412008975, 'bear_atr_max_pct': 0.11805095387640242, 'bear_tp_mult': 2.5119578540722167, 'bear_tsl_mult': 0.22734469385764822, 'bear_time_stop': 294, 'bear_use_sma': True, 'bear_use_ema': False, 'bear_use_atr': False, 'bear_use_adx': True, 'bear_use_spike': False, 'bear_rsi_required': False, 'sideways_strategy': 'breakout', 'sideways_bb_std_mult': 1.399418361193465, 'sideways_rsi_os': 51, 'sideways_rsi_ob': 92, 'sideways_adx_thresh': 17.457686369253473, 'sideways_atr_min_pct': 0.015407915997893878, 'sideways_atr_max_pct': 0.08692404286543601, 'sideways_tp_mult': 2.1682720177033095, 'sideways_tsl_mult': 0.28356808018094615, 'sideways_time_stop': 97, 'sideways_use_sma': False, 'sideways_use_ema': False, 'sideways_use_atr': False, 'sideways_use_adx': True, 'sideways_use_spike': False, 'sideways_rsi_required': False}.
[I 2025-09-01 10:04:37,253] Trial 355 finished with values: [-0.03842583029265911, 0.0381863549130136] and parameters: {'p_sma': 35, 'p_std': 46, 'p_atr': 25, 'p_adx': 13, 'rsi_period': 27, 'ema1': 19, 'ema2': 37, 'slip_atr_k': 0.0617398877834963, 'slip_spread_k': 0.3536582838188784, 'spread_hl_frac': 0.044244915842325164, 'bb_std_mult': 1.5766816104134052, 'rsi_os': 8, 'rsi_ob': 69, 'vol_spike': 0.2785081101528045, 'adx_thresh': 24.93167994476735, 'atr_min_pct': 0.011300272913361541, 'atr_max_pct': 0.10996129259658716, 'tp_mult': 1.2269654266609225, 'tsl_mult': 0.7466345195126608, 'strategy': 'breakout', 'time_stop': 253, 'use_sma': True, 'use_atr': True, 'use_adx': True, 'use_ema': True, 'use_spike': True, 'rsi_required': False, 'edge_k': 1.2226663236428879, 'edge_cap': 0.5147433045547724, 'bull_strategy': 'mean_reversion', 'bull_bb_std_mult': 2.674441244133327, 'bull_rsi_os': 47, 'bull_rsi_ob': 48, 'bull_adx_thresh': 5.480053511893396, 'bull_atr_min_pct': 0.0008578803027100422, 'bull_atr_max_pct': 0.09125676167595297, 'bull_tp_mult': 1.3530820651803692, 'bull_tsl_mult': 0.4493051631237372, 'bull_time_stop': 97, 'bull_use_sma': False, 'bull_use_ema': False, 'bull_use_atr': True, 'bull_use_adx': False, 'bull_use_spike': True, 'bull_rsi_required': False, 'bear_strategy': 'mean_reversion', 'bear_bb_std_mult': 1.0586289258347417, 'bear_rsi_os': 54, 'bear_rsi_ob': 89, 'bear_adx_thresh': 32.90108103527503, 'bear_atr_min_pct': 0.009045286972329234, 'bear_atr_max_pct': 0.03987248686024842, 'bear_tp_mult': 1.0380881662711348, 'bear_tsl_mult': 0.3856399348951753, 'bear_time_stop': 291, 'bear_use_sma': True, 'bear_use_ema': False, 'bear_use_atr': True, 'bear_use_adx': True, 'bear_use_spike': True, 'bear_rsi_required': False, 'sideways_strategy': 'breakout', 'sideways_bb_std_mult': 2.952482323495941, 'sideways_rsi_os': 52, 'sideways_rsi_ob': 63, 'sideways_adx_thresh': 21.686305773119916, 'sideways_atr_min_pct': 0.011171915494146936, 'sideways_atr_max_pct': 0.014854886984925625, 'sideways_tp_mult': 2.187443261811284, 'sideways_tsl_mult': 0.47287054222877994, 'sideways_time_stop': 188, 'sideways_use_sma': True, 'sideways_use_ema': False, 'sideways_use_atr': True, 'sideways_use_adx': False, 'sideways_use_spike': False, 'sideways_rsi_required': False}.
[I 2025-09-01 10:04:38,549] Trial 357 finished with values: [-0.037020030106525104, 0.036851543193329256] and parameters: {'p_sma': 19, 'p_std': 46, 'p_atr': 23, 'p_adx': 28, 'rsi_period': 26, 'ema1': 21, 'ema2': 37, 'slip_atr_k': 0.15867251113105907, 'slip_spread_k': 0.3574318184569315, 'spread_hl_frac': 0.020893520809383826, 'bb_std_mult': 1.5885052661424108, 'rsi_os': 12, 'rsi_ob': 69, 'vol_spike': 0.2517236952913209, 'adx_thresh': 6.838661959824453, 'atr_min_pct': 0.005963661600178347, 'atr_max_pct': 0.11874677751182858, 'tp_mult': 1.212905022333048, 'tsl_mult': 0.7501223137083182, 'strategy': 'breakout', 'time_stop': 258, 'use_sma': True, 'use_atr': True, 'use_adx': False, 'use_ema': False, 'use_spike': True, 'rsi_required': False, 'edge_k': 1.0927510128335245, 'edge_cap': 0.26002791573120804, 'bull_strategy': 'mean_reversion', 'bull_bb_std_mult': 2.6927979822569346, 'bull_rsi_os': 49, 'bull_rsi_ob': 47, 'bull_adx_thresh': 6.8716684670063435, 'bull_atr_min_pct': 0.0011782893674259199, 'bull_atr_max_pct': 0.09080085079020857, 'bull_tp_mult': 2.8342713420283885, 'bull_tsl_mult': 0.2550297967886316, 'bull_time_stop': 218, 'bull_use_sma': False, 'bull_use_ema': False, 'bull_use_atr': False, 'bull_use_adx': True, 'bull_use_spike': True, 'bull_rsi_required': False, 'bear_strategy': 'breakout', 'bear_bb_std_mult': 1.2031960209517314, 'bear_rsi_os': 54, 'bear_rsi_ob': 89, 'bear_adx_thresh': 9.250293286670082, 'bear_atr_min_pct': 0.005774263661381117, 'bear_atr_max_pct': 0.06981804107957058, 'bear_tp_mult': 2.93094349012807, 'bear_tsl_mult': 0.36786247919501747, 'bear_time_stop': 271, 'bear_use_sma': True, 'bear_use_ema': False, 'bear_use_atr': False, 'bear_use_adx': True, 'bear_use_spike': False, 'bear_rsi_required': False, 'sideways_strategy': 'breakout', 'sideways_bb_std_mult': 1.4684309353436467, 'sideways_rsi_os': 18, 'sideways_rsi_ob': 92, 'sideways_adx_thresh': 16.848234895997894, 'sideways_atr_min_pct': 0.010932501795464723, 'sideways_atr_max_pct': 0.014229163822003746, 'sideways_tp_mult': 2.388038696484262, 'sideways_tsl_mult': 0.38823122174914576, 'sideways_time_stop': 22, 'sideways_use_sma': False, 'sideways_use_ema': True, 'sideways_use_atr': True, 'sideways_use_adx': False, 'sideways_use_spike': False, 'sideways_rsi_required': False}.
[I 2025-09-01 10:04:38,925] Trial 358 finished with values: [-0.03831134192867247, 0.038095220257673326] and parameters: {'p_sma': 35, 'p_std': 47, 'p_atr': 20, 'p_adx': 28, 'rsi_period': 55, 'ema1': 21, 'ema2': 33, 'slip_atr_k': 0.060696462869884685, 'slip_spread_k': 0.01913000407498544, 'spread_hl_frac': 0.011498407285466567, 'bb_std_mult': 1.5710220659471823, 'rsi_os': 41, 'rsi_ob': 80, 'vol_spike': 0.11690657869287305, 'adx_thresh': 22.555994101770622, 'atr_min_pct': 0.006513748545647985, 'atr_max_pct': 0.12983884630117334, 'tp_mult': 2.5624747230445823, 'tsl_mult': 0.750528993576573, 'strategy': 'breakout', 'time_stop': 259, 'use_sma': True, 'use_atr': True, 'use_adx': True, 'use_ema': False, 'use_spike': True, 'rsi_required': False, 'edge_k': 1.2393796310155631, 'edge_cap': 0.5442231812323097, 'bull_strategy': 'mean_reversion', 'bull_bb_std_mult': 2.061690138357656, 'bull_rsi_os': 7, 'bull_rsi_ob': 74, 'bull_adx_thresh': 6.750903360776159, 'bull_atr_min_pct': 0.0015307109149102509, 'bull_atr_max_pct': 0.08921965653552161, 'bull_tp_mult': 2.8785099838578936, 'bull_tsl_mult': 0.37038007689091057, 'bull_time_stop': 218, 'bull_use_sma': True, 'bull_use_ema': False, 'bull_use_atr': False, 'bull_use_adx': True, 'bull_use_spike': True, 'bull_rsi_required': False, 'bear_strategy': 'breakout', 'bear_bb_std_mult': 1.070035015375667, 'bear_rsi_os': 41, 'bear_rsi_ob': 74, 'bear_adx_thresh': 24.13500183833399, 'bear_atr_min_pct': 0.005781691368488826, 'bear_atr_max_pct': 0.019817128163903665, 'bear_tp_mult': 1.23933926463814, 'bear_tsl_mult': 0.36998475743279374, 'bear_time_stop': 289, 'bear_use_sma': True, 'bear_use_ema': False, 'bear_use_atr': False, 'bear_use_adx': True, 'bear_use_spike': True, 'bear_rsi_required': False, 'sideways_strategy': 'breakout', 'sideways_bb_std_mult': 0.8869808140976819, 'sideways_rsi_os': 22, 'sideways_rsi_ob': 68, 'sideways_adx_thresh': 21.675603294553785, 'sideways_atr_min_pct': 0.015415125809402989, 'sideways_atr_max_pct': 0.0648285744542347, 'sideways_tp_mult': 2.38429675652816, 'sideways_tsl_mult': 0.4599505120962573, 'sideways_time_stop': 19, 'sideways_use_sma': False, 'sideways_use_ema': True, 'sideways_use_atr': True, 'sideways_use_adx': False, 'sideways_use_spike': False, 'sideways_rsi_required': False}.
[I 2025-09-01 10:05:21,877] Trial 362 finished with values: [-0.041642348982552924, 0.041464522725029665] and parameters: {'p_sma': 20, 'p_std': 31, 'p_atr': 21, 'p_adx': 20, 'rsi_period': 13, 'ema1': 18, 'ema2': 35, 'slip_atr_k': 0.04324573933575105, 'slip_spread_k': 0.7234925697016326, 'spread_hl_frac': 0.03096863417206947, 'bb_std_mult': 3.3931723652202552, 'rsi_os': 41, 'rsi_ob': 71, 'vol_spike': 0.17999078761981688, 'adx_thresh': 34.174625610655774, 'atr_min_pct': 0.00995967233631902, 'atr_max_pct': 0.11331625012251889, 'tp_mult': 1.1107757409040566, 'tsl_mult': 0.6987673267882711, 'strategy': 'mean_reversion', 'time_stop': 172, 'use_sma': False, 'use_atr': False, 'use_adx': False, 'use_ema': True, 'use_spike': False, 'rsi_required': True, 'edge_k': 1.346137585905756, 'edge_cap': 0.5786810662900966, 'bull_strategy': 'breakout', 'bull_bb_std_mult': 1.5776752762135025, 'bull_rsi_os': 47, 'bull_rsi_ob': 53, 'bull_adx_thresh': 10.306323619255028, 'bull_atr_min_pct': 0.002452805619024322, 'bull_atr_max_pct': 0.08390520285437245, 'bull_tp_mult': 2.4271455744825277, 'bull_tsl_mult': 0.4169991149212446, 'bull_time_stop': 180, 'bull_use_sma': True, 'bull_use_ema': True, 'bull_use_atr': True, 'bull_use_adx': False, 'bull_use_spike': False, 'bull_rsi_required': True, 'bear_strategy': 'mean_reversion', 'bear_bb_std_mult': 0.8626855760947902, 'bear_rsi_os': 53, 'bear_rsi_ob': 54, 'bear_adx_thresh': 23.854068428153266, 'bear_atr_min_pct': 0.002875944671730499, 'bear_atr_max_pct': 0.05485919990255923, 'bear_tp_mult': 1.1681987397333515, 'bear_tsl_mult': 0.5180982808907524, 'bear_time_stop': 56, 'bear_use_sma': False, 'bear_use_ema': True, 'bear_use_atr': True, 'bear_use_adx': False, 'bear_use_spike': False, 'bear_rsi_required': False, 'sideways_strategy': 'mean_reversion', 'sideways_bb_std_mult': 0.8189984939697206, 'sideways_rsi_os': 54, 'sideways_rsi_ob': 51, 'sideways_adx_thresh': 24.513315044919377, 'sideways_atr_min_pct': 0.019196469272365114, 'sideways_atr_max_pct': 0.13666180059374353, 'sideways_tp_mult': 2.5593305091382, 'sideways_tsl_mult': 0.4296876665216276, 'sideways_time_stop': 168, 'sideways_use_sma': True, 'sideways_use_ema': False, 'sideways_use_atr': False, 'sideways_use_adx': True, 'sideways_use_spike': False, 'sideways_rsi_required': True}.
