[I 2025-09-01 10:21:00,733] Trial 458 finished with values: [-1000000000.0, 1000000000.0] and parameters: {'p_sma': 19, 'p_std': 25, 'p_atr': 15, 'p_adx': 24, 'rsi_period': 24, 'ema1': 20, 'ema2': 60, 'slip_atr_k': 0.054425291111866586, 'slip_spread_k': 0.1906570904301309, 'spread_hl_frac': 0.03101068110629178, 'bb_std_mult': 1.5307086127031295, 'rsi_os': 41, 'rsi_ob': 68, 'vol_spike': 0.15491295626839552, 'adx_thresh': 6.52682341847129, 'atr_min_pct': 0.011562699158215275, 'atr_max_pct': 0.13168039122246147, 'tp_mult': 1.0101650220913867, 'tsl_mult': 0.8783698861655335, 'strategy': 'mean_reversion', 'time_stop': 253, 'use_sma': False, 'use_atr': True, 'use_adx': False, 'use_ema': True, 'use_spike': True, 'rsi_required': False, 'edge_k': 0.9909689254901621, 'edge_cap': 0.9521369638538597, 'bull_strategy': 'breakout', 'bull_bb_std_mult': 1.1951381456068537, 'bull_rsi_os': 39, 'bull_rsi_ob': 45, 'bull_adx_thresh': 17.533596081255894, 'bull_atr_min_pct': 0.0004952586944401715, 'bull_atr_max_pct': 0.07047813158136432, 'bull_tp_mult': 2.877428980236831, 'bull_tsl_mult': 0.39648677755159784, 'bull_time_stop': 210, 'bull_use_sma': False, 'bull_use_ema': True, 'bull_use_atr': True, 'bull_use_adx': True, 'bull_use_spike': True, 'bull_rsi_required': False, 'bear_strategy': 'mean_reversion', 'bear_bb_std_mult': 0.8404660064360487, 'bear_rsi_os': 19, 'bear_rsi_ob': 54, 'bear_adx_thresh': 30.506079132760192, 'bear_atr_min_pct': 0.017073562049830317, 'bear_atr_max_pct': 0.0688499588694436, 'bear_tp_mult': 1.2784798805683237, 'bear_tsl_mult': 0.5500099907735405, 'bear_time_stop': 26, 'bear_use_sma': False, 'bear_use_ema': True, 'bear_use_atr': True, 'bear_use_adx': False, 'bear_use_spike': False, 'bear_rsi_required': True, 'sideways_strategy': 'mean_reversion', 'sideways_bb_std_mult': 0.6133693554252313, 'sideways_rsi_os': 45, 'sideways_rsi_ob': 92, 'sideways_adx_thresh': 15.79164106116784, 'sideways_atr_min_pct': 0.010170347947399953, 'sideways_atr_max_pct': 0.07278215659388268, 'sideways_tp_mult': 2.295383137684359, 'sideways_tsl_mult': 0.45563054113566825, 'sideways_time_stop': 29, 'sideways_use_sma': True, 'sideways_use_ema': False, 'sideways_use_atr': True, 'sideways_use_adx': False, 'sideways_use_spike': True, 'sideways_rsi_required': False}.
[I 2025-09-01 10:21:40,711] Trial 463 finished with values: [-0.020953648503880706, 0.020809009573487434] and parameters: {'p_sma': 17, 'p_std': 49, 'p_atr': 17, 'p_adx': 23, 'rsi_period': 27, 'ema1': 18, 'ema2': 16, 'slip_atr_k': 0.008060491917722457, 'slip_spread_k': 0.6761251944432298, 'spread_hl_frac': 0.02804129334559268, 'bb_std_mult': 1.3812089010187596, 'rsi_os': 19, 'rsi_ob': 60, 'vol_spike': 0.08564570574046868, 'adx_thresh': 24.93814286955541, 'atr_min_pct': 0.015156146834021571, 'atr_max_pct': 0.13613221974179185, 'tp_mult': 1.16663005932696, 'tsl_mult': 0.036480230391724267, 'strategy': 'breakout', 'time_stop': 169, 'use_sma': True, 'use_atr': False, 'use_adx': False, 'use_ema': True, 'use_spike': True, 'rsi_required': True, 'edge_k': 1.2983413061766997, 'edge_cap': 0.3271410831100988, 'bull_strategy': 'mean_reversion', 'bull_bb_std_mult': 0.6443692768487248, 'bull_rsi_os': 14, 'bull_rsi_ob': 47, 'bull_adx_thresh': 7.582822779470695, 'bull_atr_min_pct': 0.0008710699458452879, 'bull_atr_max_pct': 0.032586878212421275, 'bull_tp_mult': 1.4070928314050568, 'bull_tsl_mult': 0.41883686658765434, 'bull_time_stop': 251, 'bull_use_sma': True, 'bull_use_ema': False, 'bull_use_atr': True, 'bull_use_adx': False, 'bull_use_spike': False, 'bull_rsi_required': True, 'bear_strategy': 'breakout', 'bear_bb_std_mult': 0.94252041305448, 'bear_rsi_os': 16, 'bear_rsi_ob': 76, 'bear_adx_thresh': 28.723627643092314, 'bear_atr_min_pct': 0.004059059013796985, 'bear_atr_max_pct': 0.14575194212152906, 'bear_tp_mult': 1.2257861260801526, 'bear_tsl_mult': 0.4619929494024356, 'bear_time_stop': 231, 'bear_use_sma': True, 'bear_use_ema': False, 'bear_use_atr': True, 'bear_use_adx': False, 'bear_use_spike': False, 'bear_rsi_required': False, 'sideways_strategy': 'mean_reversion', 'sideways_bb_std_mult': 0.8586166446915737, 'sideways_rsi_os': 54, 'sideways_rsi_ob': 93, 'sideways_adx_thresh': 23.479922140058083, 'sideways_atr_min_pct': 0.009335483761364439, 'sideways_atr_max_pct': 0.06955591385165141, 'sideways_tp_mult': 2.1394711168979983, 'sideways_tsl_mult': 0.45848095944352424, 'sideways_time_stop': 235, 'sideways_use_sma': True, 'sideways_use_ema': False, 'sideways_use_atr': False, 'sideways_use_adx': True, 'sideways_use_spike': False, 'sideways_rsi_required': True}.
[I 2025-09-01 10:21:41,576] Trial 461 finished with values: [-1000000000.0, 1000000000.0] and parameters: {'p_sma': 40, 'p_std': 46, 'p_atr': 17, 'p_adx': 14, 'rsi_period': 24, 'ema1': 20, 'ema2': 16, 'slip_atr_k': 0.053409543702606505, 'slip_spread_k': 0.6674914124092335, 'spread_hl_frac': 0.02805334956745735, 'bb_std_mult': 1.4927364299403791, 'rsi_os': 43, 'rsi_ob': 69, 'vol_spike': 0.15695721780237726, 'adx_thresh': 32.45427108328027, 'atr_min_pct': 0.014248814355871123, 'atr_max_pct': 0.13710321759718364, 'tp_mult': 1.1280296843275055, 'tsl_mult': 0.719536926789693, 'strategy': 'mean_reversion', 'time_stop': 256, 'use_sma': False, 'use_atr': True, 'use_adx': False, 'use_ema': True, 'use_spike': True, 'rsi_required': True, 'edge_k': 0.9852207428346057, 'edge_cap': 0.706549831559341, 'bull_strategy': 'breakout', 'bull_bb_std_mult': 1.1127061372248053, 'bull_rsi_os': 21, 'bull_rsi_ob': 49, 'bull_adx_thresh': 7.3455207551328785, 'bull_atr_min_pct': 0.006353497968025517, 'bull_atr_max_pct': 0.08872163484405417, 'bull_tp_mult': 2.868940657498045, 'bull_tsl_mult': 0.398740220445282, 'bull_time_stop': 253, 'bull_use_sma': False, 'bull_use_ema': True, 'bull_use_atr': True, 'bull_use_adx': False, 'bull_use_spike': False, 'bull_rsi_required': True, 'bear_strategy': 'mean_reversion', 'bear_bb_std_mult': 3.542493908620721, 'bear_rsi_os': 15, 'bear_rsi_ob': 63, 'bear_adx_thresh': 23.02517102144847, 'bear_atr_min_pct': 0.007493258435568343, 'bear_atr_max_pct': 0.06702128249716661, 'bear_tp_mult': 2.931347686250705, 'bear_tsl_mult': 0.07185536934865766, 'bear_time_stop': 290, 'bear_use_sma': False, 'bear_use_ema': True, 'bear_use_atr': True, 'bear_use_adx': False, 'bear_use_spike': False, 'bear_rsi_required': False, 'sideways_strategy': 'mean_reversion', 'sideways_bb_std_mult': 1.3337146509991364, 'sideways_rsi_os': 49, 'sideways_rsi_ob': 93, 'sideways_adx_thresh': 23.48217670061992, 'sideways_atr_min_pct': 0.011873921789921752, 'sideways_atr_max_pct': 0.07124692775904926, 'sideways_tp_mult': 1.411433379166826, 'sideways_tsl_mult': 0.6610370043713935, 'sideways_time_stop': 253, 'sideways_use_sma': True, 'sideways_use_ema': False, 'sideways_use_atr': True, 'sideways_use_adx': True, 'sideways_use_spike': True, 'sideways_rsi_required': False}.
[I 2025-09-01 10:21:42,111] Trial 460 finished with values: [-0.03446546756940172, 0.0342841991878625] and parameters: {'p_sma': 46, 'p_std': 46, 'p_atr': 17, 'p_adx': 25, 'rsi_period': 43, 'ema1': 19, 'ema2': 16, 'slip_atr_k': 0.004047217555386312, 'slip_spread_k': 0.2417495683093448, 'spread_hl_frac': 0.028192295698050807, 'bb_std_mult': 1.512149729079646, 'rsi_os': 43, 'rsi_ob': 68, 'vol_spike': 0.15432708443405893, 'adx_thresh': 30.13106850968503, 'atr_min_pct': 0.008863999991553649, 'atr_max_pct': 0.032435780680796514, 'tp_mult': 1.34758509782525, 'tsl_mult': 0.8831368462793914, 'strategy': 'mean_reversion', 'time_stop': 246, 'use_sma': False, 'use_atr': True, 'use_adx': False, 'use_ema': True, 'use_spike': True, 'rsi_required': True, 'edge_k': 1.3076751542899132, 'edge_cap': 0.5901764180101883, 'bull_strategy': 'breakout', 'bull_bb_std_mult': 3.009766657909437, 'bull_rsi_os': 54, 'bull_rsi_ob': 47, 'bull_adx_thresh': 5.092737088655513, 'bull_atr_min_pct': 0.0004511377661567178, 'bull_atr_max_pct': 0.050450726558567166, 'bull_tp_mult': 1.3981594496159224, 'bull_tsl_mult': 0.40676499782573405, 'bull_time_stop': 210, 'bull_use_sma': False, 'bull_use_ema': True, 'bull_use_atr': True, 'bull_use_adx': True, 'bull_use_spike': True, 'bull_rsi_required': True, 'bear_strategy': 'mean_reversion', 'bear_bb_std_mult': 0.5710380872302991, 'bear_rsi_os': 53, 'bear_rsi_ob': 74, 'bear_adx_thresh': 31.20064471375061, 'bear_atr_min_pct': 0.008345008396073769, 'bear_atr_max_pct': 0.07028465938247642, 'bear_tp_mult': 1.2842498734223922, 'bear_tsl_mult': 0.5080542543383589, 'bear_time_stop': 290, 'bear_use_sma': False, 'bear_use_ema': True, 'bear_use_atr': True, 'bear_use_adx': False, 'bear_use_spike': False, 'bear_rsi_required': True, 'sideways_strategy': 'mean_reversion', 'sideways_bb_std_mult': 0.6065396035038144, 'sideways_rsi_os': 23, 'sideways_rsi_ob': 93, 'sideways_adx_thresh': 24.924194563364438, 'sideways_atr_min_pct': 0.008205776143021959, 'sideways_atr_max_pct': 0.07544214388213687, 'sideways_tp_mult': 2.12717870350824, 'sideways_tsl_mult': 0.45329645038765926, 'sideways_time_stop': 252, 'sideways_use_sma': True, 'sideways_use_ema': False, 'sideways_use_atr': True, 'sideways_use_adx': True, 'sideways_use_spike': True, 'sideways_rsi_required': False}.
[I 2025-09-01 10:21:42,294] Trial 462 finished with values: [-0.12958320776741694, 0.12900922783764454] and parameters: {'p_sma': 40, 'p_std': 31, 'p_atr': 17, 'p_adx': 16, 'rsi_period': 24, 'ema1': 20, 'ema2': 43, 'slip_atr_k': 0.05535148803454242, 'slip_spread_k': 0.6977972807419326, 'spread_hl_frac': 0.027993185214080677, 'bb_std_mult': 2.5537170396841904, 'rsi_os': 43, 'rsi_ob': 56, 'vol_spike': 0.2018401484442593, 'adx_thresh': 30.035942696956806, 'atr_min_pct': 0.00932864677131606, 'atr_max_pct': 0.11436666465708673, 'tp_mult': 1.1185039598637831, 'tsl_mult': 0.5059935395538366, 'strategy': 'mean_reversion', 'time_stop': 27, 'use_sma': False, 'use_atr': False, 'use_adx': False, 'use_ema': True, 'use_spike': True, 'rsi_required': True, 'edge_k': 1.8507340397404617, 'edge_cap': 0.5558231821211487, 'bull_strategy': 'breakout', 'bull_bb_std_mult': 0.6139508784885255, 'bull_rsi_os': 19, 'bull_rsi_ob': 47, 'bull_adx_thresh': 22.89518467681628, 'bull_atr_min_pct': 0.0005234178975103176, 'bull_atr_max_pct': 0.07138226801477497, 'bull_tp_mult': 2.931550687681465, 'bull_tsl_mult': 0.8373203792995928, 'bull_time_stop': 208, 'bull_use_sma': True, 'bull_use_ema': True, 'bull_use_atr': True, 'bull_use_adx': False, 'bull_use_spike': False, 'bull_rsi_required': True, 'bear_strategy': 'mean_reversion', 'bear_bb_std_mult': 2.1950910150089884, 'bear_rsi_os': 19, 'bear_rsi_ob': 52, 'bear_adx_thresh': 28.88862721279162, 'bear_atr_min_pct': 0.0014983979574221436, 'bear_atr_max_pct': 0.061324153752132314, 'bear_tp_mult': 1.2166332488634786, 'bear_tsl_mult': 0.45075802424041356, 'bear_time_stop': 290, 'bear_use_sma': True, 'bear_use_ema': False, 'bear_use_atr': True, 'bear_use_adx': False, 'bear_use_spike': False, 'bear_rsi_required': False, 'sideways_strategy': 'mean_reversion', 'sideways_bb_std_mult': 1.3269880340481088, 'sideways_rsi_os': 50, 'sideways_rsi_ob': 45, 'sideways_adx_thresh': 30.566806957993293, 'sideways_atr_min_pct': 0.009181602786886449, 'sideways_atr_max_pct': 0.06083545962309255, 'sideways_tp_mult': 2.5980934435997645, 'sideways_tsl_mult': 0.45955940492073977, 'sideways_time_stop': 63, 'sideways_use_sma': True, 'sideways_use_ema': False, 'sideways_use_atr': False, 'sideways_use_adx': True, 'sideways_use_spike': False, 'sideways_rsi_required': False}.
[I 2025-09-01 10:22:21,695] Trial 465 finished with values: [-0.01851751344750152, 0.018394962643521046] and parameters: {'p_sma': 17, 'p_std': 50, 'p_atr': 16, 'p_adx': 23, 'rsi_period': 29, 'ema1': 18, 'ema2': 12, 'slip_atr_k': 0.009137301425397704, 'slip_spread_k': 0.7232985467543213, 'spread_hl_frac': 0.026447792011125418, 'bb_std_mult': 1.2825071339671443, 'rsi_os': 19, 'rsi_ob': 60, 'vol_spike': 0.08333982247846239, 'adx_thresh': 24.86763865650115, 'atr_min_pct': 0.01519698157040526, 'atr_max_pct': 0.034374487077992094, 'tp_mult': 1.4207340402120772, 'tsl_mult': 0.12522192056381032, 'strategy': 'breakout', 'time_stop': 181, 'use_sma': True, 'use_atr': False, 'use_adx': False, 'use_ema': True, 'use_spike': False, 'rsi_required': True, 'edge_k': 1.3336608874617575, 'edge_cap': 0.32514526955357365, 'bull_strategy': 'mean_reversion', 'bull_bb_std_mult': 0.6697313790893927, 'bull_rsi_os': 14, 'bull_rsi_ob': 71, 'bull_adx_thresh': 8.266363922779236, 'bull_atr_min_pct': 0.00011799259834341478, 'bull_atr_max_pct': 0.010250083855319447, 'bull_tp_mult': 1.4071001529305263, 'bull_tsl_mult': 0.4563799303718019, 'bull_time_stop': 254, 'bull_use_sma': True, 'bull_use_ema': False, 'bull_use_atr': True, 'bull_use_adx': False, 'bull_use_spike': False, 'bull_rsi_required': True, 'bear_strategy': 'breakout', 'bear_bb_std_mult': 1.0648420912723682, 'bear_rsi_os': 16, 'bear_rsi_ob': 78, 'bear_adx_thresh': 28.898148877167007, 'bear_atr_min_pct': 0.0024193237284165794, 'bear_atr_max_pct': 0.1449700631285004, 'bear_tp_mult': 1.3258917051043606, 'bear_tsl_mult': 0.4465171906349932, 'bear_time_stop': 248, 'bear_use_sma': True, 'bear_use_ema': False, 'bear_use_atr': True, 'bear_use_adx': True, 'bear_use_spike': False, 'bear_rsi_required': False, 'sideways_strategy': 'breakout', 'sideways_bb_std_mult': 0.8119529547522797, 'sideways_rsi_os': 55, 'sideways_rsi_ob': 95, 'sideways_adx_thresh': 23.961418058330995, 'sideways_atr_min_pct': 0.007844134146929804, 'sideways_atr_max_pct': 0.06582982268778184, 'sideways_tp_mult': 2.151289187844862, 'sideways_tsl_mult': 0.438503451329133, 'sideways_time_stop': 266, 'sideways_use_sma': True, 'sideways_use_ema': False, 'sideways_use_atr': False, 'sideways_use_adx': True, 'sideways_use_spike': False, 'sideways_rsi_required': True}.
[I 2025-09-01 10:22:22,417] Trial 464 finished with values: [-0.020523609967919798, 0.02040164874934689] and parameters: {'p_sma': 17, 'p_std': 49, 'p_atr': 16, 'p_adx': 23, 'rsi_period': 28, 'ema1': 18, 'ema2': 12, 'slip_atr_k': 0.007573140668121334, 'slip_spread_k': 0.7196108346118957, 'spread_hl_frac': 0.026018585228580925, 'bb_std_mult': 1.216669094987461, 'rsi_os': 19, 'rsi_ob': 58, 'vol_spike': 0.08359362707867979, 'adx_thresh': 24.88500297393978, 'atr_min_pct': 0.015461297733999792, 'atr_max_pct': 0.13669687428796426, 'tp_mult': 1.3852884754986374, 'tsl_mult': 0.03020365667586754, 'strategy': 'breakout', 'time_stop': 155, 'use_sma': True, 'use_atr': False, 'use_adx': False, 'use_ema': True, 'use_spike': False, 'rsi_required': True, 'edge_k': 1.3742783080185061, 'edge_cap': 0.31848724913709453, 'bull_strategy': 'mean_reversion', 'bull_bb_std_mult': 0.6318495362219576, 'bull_rsi_os': 14, 'bull_rsi_ob': 49, 'bull_adx_thresh': 8.550144207403513, 'bull_atr_min_pct': 0.00021439263129890702, 'bull_atr_max_pct': 0.04281997619497171, 'bull_tp_mult': 1.3930602559080256, 'bull_tsl_mult': 0.4785034300081465, 'bull_time_stop': 253, 'bull_use_sma': True, 'bull_use_ema': False, 'bull_use_atr': True, 'bull_use_adx': False, 'bull_use_spike': False, 'bull_rsi_required': True, 'bear_strategy': 'breakout', 'bear_bb_std_mult': 1.053471777102873, 'bear_rsi_os': 15, 'bear_rsi_ob': 78, 'bear_adx_thresh': 29.0270852283323, 'bear_atr_min_pct': 0.0022882272195564046, 'bear_atr_max_pct': 0.1451105093728526, 'bear_tp_mult': 1.3670763291657564, 'bear_tsl_mult': 0.4582538085834655, 'bear_time_stop': 227, 'bear_use_sma': True, 'bear_use_ema': False, 'bear_use_atr': True, 'bear_use_adx': False, 'bear_use_spike': False, 'bear_rsi_required': False, 'sideways_strategy': 'mean_reversion', 'sideways_bb_std_mult': 0.78216795347539, 'sideways_rsi_os': 55, 'sideways_rsi_ob': 95, 'sideways_adx_thresh': 23.63937537047537, 'sideways_atr_min_pct': 0.00802125178570643, 'sideways_atr_max_pct': 0.05997286639269084, 'sideways_tp_mult': 2.1174245669762435, 'sideways_tsl_mult': 0.45009952005503606, 'sideways_time_stop': 244, 'sideways_use_sma': True, 'sideways_use_ema': False, 'sideways_use_atr': False, 'sideways_use_adx': True, 'sideways_use_spike': False, 'sideways_rsi_required': True}.
[I 2025-09-01 10:22:23,089] Trial 466 finished with values: [-0.018980119073053747, 0.018857886183809965] and parameters: {'p_sma': 17, 'p_std': 50, 'p_atr': 16, 'p_adx': 23, 'rsi_period': 29, 'ema1': 18, 'ema2': 48, 'slip_atr_k': 0.0074913622145826725, 'slip_spread_k': 0.726897787131229, 'spread_hl_frac': 0.026659834834212994, 'bb_std_mult': 1.2089454046736072, 'rsi_os': 19, 'rsi_ob': 58, 'vol_spike': 0.08449035910918083, 'adx_thresh': 25.68404124780227, 'atr_min_pct': 0.015303653090057765, 'atr_max_pct': 0.1360862655114191, 'tp_mult': 1.386748238345366, 'tsl_mult': 0.02929149892147982, 'strategy': 'breakout', 'time_stop': 148, 'use_sma': True, 'use_atr': False, 'use_adx': True, 'use_ema': True, 'use_spike': False, 'rsi_required': True, 'edge_k': 1.396923933705949, 'edge_cap': 0.32684677276426566, 'bull_strategy': 'mean_reversion', 'bull_bb_std_mult': 1.5884211138347715, 'bull_rsi_os': 14, 'bull_rsi_ob': 47, 'bull_adx_thresh': 8.454920616265023, 'bull_atr_min_pct': 8.79081741271342e-06, 'bull_atr_max_pct': 0.03157423179829503, 'bull_tp_mult': 1.4167961847513846, 'bull_tsl_mult': 0.46886181297818447, 'bull_time_stop': 251, 'bull_use_sma': True, 'bull_use_ema': False, 'bull_use_atr': True, 'bull_use_adx': False, 'bull_use_spike': False, 'bull_rsi_required': True, 'bear_strategy': 'breakout', 'bear_bb_std_mult': 1.1375109656343794, 'bear_rsi_os': 17, 'bear_rsi_ob': 77, 'bear_adx_thresh': 28.96128453245972, 'bear_atr_min_pct': 0.002190357930131644, 'bear_atr_max_pct': 0.14526796995179814, 'bear_tp_mult': 1.3265238043217336, 'bear_tsl_mult': 0.4480045064600368, 'bear_time_stop': 233, 'bear_use_sma': True, 'bear_use_ema': False, 'bear_use_atr': True, 'bear_use_adx': True, 'bear_use_spike': True, 'bear_rsi_required': False, 'sideways_strategy': 'breakout', 'sideways_bb_std_mult': 0.8190686301703364, 'sideways_rsi_os': 55, 'sideways_rsi_ob': 95, 'sideways_adx_thresh': 23.784010311862943, 'sideways_atr_min_pct': 0.007291631196656754, 'sideways_atr_max_pct': 0.060953334959317845, 'sideways_tp_mult': 2.151250026921268, 'sideways_tsl_mult': 0.4344841959580523, 'sideways_time_stop': 234, 'sideways_use_sma': True, 'sideways_use_ema': False, 'sideways_use_atr': False, 'sideways_use_adx': True, 'sideways_use_spike': False, 'sideways_rsi_required': True}.
[I 2025-09-01 10:22:23,089] Trial 467 finished with values: [-0.01967658404259187, 0.019554238132613987] and parameters: {'p_sma': 17, 'p_std': 49, 'p_atr': 16, 'p_adx': 23, 'rsi_period': 29, 'ema1': 18, 'ema2': 13, 'slip_atr_k': 0.009168105530063655, 'slip_spread_k': 0.7080780817690884, 'spread_hl_frac': 0.026369037621703197, 'bb_std_mult': 1.264029058504085, 'rsi_os': 19, 'rsi_ob': 61, 'vol_spike': 0.08357195264748542, 'adx_thresh': 25.110426578272506, 'atr_min_pct': 0.015324338753376198, 'atr_max_pct': 0.026504574028296257, 'tp_mult': 1.35995272078135, 'tsl_mult': 0.22676754122897502, 'strategy': 'breakout', 'time_stop': 155, 'use_sma': True, 'use_atr': False, 'use_adx': True, 'use_ema': False, 'use_spike': False, 'rsi_required': True, 'edge_k': 1.3785389751365673, 'edge_cap': 0.3227155733684665, 'bull_strategy': 'mean_reversion', 'bull_bb_std_mult': 1.5590742708616394, 'bull_rsi_os': 13, 'bull_rsi_ob': 68, 'bull_adx_thresh': 8.442536067463703, 'bull_atr_min_pct': 3.532394254550722e-05, 'bull_atr_max_pct': 0.021926207060501888, 'bull_tp_mult': 1.4221872656226555, 'bull_tsl_mult': 0.4715900690661785, 'bull_time_stop': 250, 'bull_use_sma': True, 'bull_use_ema': False, 'bull_use_atr': True, 'bull_use_adx': False, 'bull_use_spike': False, 'bull_rsi_required': True, 'bear_strategy': 'breakout', 'bear_bb_std_mult': 1.0456218250429548, 'bear_rsi_os': 13, 'bear_rsi_ob': 78, 'bear_adx_thresh': 29.075121596345728, 'bear_atr_min_pct': 0.00327708894458501, 'bear_atr_max_pct': 0.14515693797802692, 'bear_tp_mult': 2.7922762374575716, 'bear_tsl_mult': 0.43237463541783955, 'bear_time_stop': 229, 'bear_use_sma': True, 'bear_use_ema': False, 'bear_use_atr': True, 'bear_use_adx': True, 'bear_use_spike': True, 'bear_rsi_required': False, 'sideways_strategy': 'breakout', 'sideways_bb_std_mult': 0.7871342998308832, 'sideways_rsi_os': 55, 'sideways_rsi_ob': 95, 'sideways_adx_thresh': 23.69437423704073, 'sideways_atr_min_pct': 0.007850964751668582, 'sideways_atr_max_pct': 0.061691798747508166, 'sideways_tp_mult': 2.161032340872214, 'sideways_tsl_mult': 0.4350324332700614, 'sideways_time_stop': 263, 'sideways_use_sma': True, 'sideways_use_ema': False, 'sideways_use_atr': False, 'sideways_use_adx': True, 'sideways_use_spike': False, 'sideways_rsi_required': True}.
