[I 2025-09-01 10:29:49,297] Trial 523 finished with values: [-1000000000.0, 1000000000.0] and parameters: {'p_sma': 14, 'p_std': 15, 'p_atr': 14, 'p_adx': 21, 'rsi_period': 40, 'ema1': 8, 'ema2': 12, 'slip_atr_k': 0.02939009090089281, 'slip_spread_k': 0.8275679239949775, 'spread_hl_frac': 0.0156045524708747, 'bb_std_mult': 1.0769888333507203, 'rsi_os': 19, 'rsi_ob': 61, 'vol_spike': 0.06867846162300677, 'adx_thresh': 23.343473052912692, 'atr_min_pct': 0.016514238092035605, 'atr_max_pct': 0.01016225753657381, 'tp_mult': 1.4067630510879643, 'tsl_mult': 0.14588165315708101, 'strategy': 'breakout', 'time_stop': 134, 'use_sma': True, 'use_atr': False, 'use_adx': True, 'use_ema': False, 'use_spike': False, 'rsi_required': False, 'edge_k': 1.5343010160262414, 'edge_cap': 0.42922313122841127, 'bull_strategy': 'mean_reversion', 'bull_bb_std_mult': 0.6218869449733251, 'bull_rsi_os': 16, 'bull_rsi_ob': 77, 'bull_adx_thresh': 14.873415787766131, 'bull_atr_min_pct': 0.0015183665116997908, 'bull_atr_max_pct': 0.022981112267110606, 'bull_tp_mult': 1.1557555920082418, 'bull_tsl_mult': 0.6083328198637031, 'bull_time_stop': 273, 'bull_use_sma': True, 'bull_use_ema': False, 'bull_use_atr': False, 'bull_use_adx': True, 'bull_use_spike': True, 'bull_rsi_required': False, 'bear_strategy': 'breakout', 'bear_bb_std_mult': 1.9317832053258148, 'bear_rsi_os': 19, 'bear_rsi_ob': 85, 'bear_adx_thresh': 26.64953598708036, 'bear_atr_min_pct': 0.0027547857151267547, 'bear_atr_max_pct': 0.09882781163100969, 'bear_tp_mult': 1.69794047823632, 'bear_tsl_mult': 0.35074765695128024, 'bear_time_stop': 246, 'bear_use_sma': True, 'bear_use_ema': False, 'bear_use_atr': False, 'bear_use_adx': True, 'bear_use_spike': True, 'bear_rsi_required': False, 'sideways_strategy': 'breakout', 'sideways_bb_std_mult': 0.5549667089823578, 'sideways_rsi_os': 54, 'sideways_rsi_ob': 68, 'sideways_adx_thresh': 30.174601295521807, 'sideways_atr_min_pct': 0.0069152253504707216, 'sideways_atr_max_pct': 0.05874684795118991, 'sideways_tp_mult': 2.053269872223164, 'sideways_tsl_mult': 0.2572527465607305, 'sideways_time_stop': 229, 'sideways_use_sma': False, 'sideways_use_ema': True, 'sideways_use_atr': True, 'sideways_use_adx': False, 'sideways_use_spike': False, 'sideways_rsi_required': True}.
[I 2025-09-01 10:30:29,763] Trial 524 finished with values: [-1000000000.0, 1000000000.0] and parameters: {'p_sma': 14, 'p_std': 25, 'p_atr': 13, 'p_adx': 22, 'rsi_period': 37, 'ema1': 8, 'ema2': 12, 'slip_atr_k': 0.029147827440559798, 'slip_spread_k': 0.8358902212785086, 'spread_hl_frac': 0.011387022628548326, 'bb_std_mult': 1.0688063687913185, 'rsi_os': 15, 'rsi_ob': 62, 'vol_spike': 0.0684437694689515, 'adx_thresh': 24.659772323303496, 'atr_min_pct': 0.016640908219973778, 'atr_max_pct': 0.016753591736980072, 'tp_mult': 1.4343963627965837, 'tsl_mult': 0.13694619404398392, 'strategy': 'breakout', 'time_stop': 134, 'use_sma': True, 'use_atr': True, 'use_adx': True, 'use_ema': False, 'use_spike': False, 'rsi_required': False, 'edge_k': 1.6553436413117546, 'edge_cap': 0.43364484864354647, 'bull_strategy': 'mean_reversion', 'bull_bb_std_mult': 0.5009711303209771, 'bull_rsi_os': 15, 'bull_rsi_ob': 77, 'bull_adx_thresh': 14.03062004895558, 'bull_atr_min_pct': 0.019395260030459285, 'bull_atr_max_pct': 0.015693656583652665, 'bull_tp_mult': 1.1382762864837077, 'bull_tsl_mult': 0.6591891594510882, 'bull_time_stop': 255, 'bull_use_sma': True, 'bull_use_ema': False, 'bull_use_atr': False, 'bull_use_adx': True, 'bull_use_spike': True, 'bull_rsi_required': False, 'bear_strategy': 'breakout', 'bear_bb_std_mult': 2.288495882336422, 'bear_rsi_os': 17, 'bear_rsi_ob': 85, 'bear_adx_thresh': 26.880665072770153, 'bear_atr_min_pct': 0.00264982564804868, 'bear_atr_max_pct': 0.12940470300590717, 'bear_tp_mult': 1.9920817656561596, 'bear_tsl_mult': 0.3319647414488159, 'bear_time_stop': 270, 'bear_use_sma': False, 'bear_use_ema': False, 'bear_use_atr': False, 'bear_use_adx': True, 'bear_use_spike': True, 'bear_rsi_required': False, 'sideways_strategy': 'breakout', 'sideways_bb_std_mult': 0.6524659700128325, 'sideways_rsi_os': 54, 'sideways_rsi_ob': 86, 'sideways_adx_thresh': 30.615998230243605, 'sideways_atr_min_pct': 0.007129969976020896, 'sideways_atr_max_pct': 0.058242154043656416, 'sideways_tp_mult': 2.0612445028186426, 'sideways_tsl_mult': 0.2638423209594123, 'sideways_time_stop': 230, 'sideways_use_sma': False, 'sideways_use_ema': True, 'sideways_use_atr': True, 'sideways_use_adx': False, 'sideways_use_spike': False, 'sideways_rsi_required': True}.
[I 2025-09-01 10:30:30,392] Trial 522 finished with values: [-1000000000.0, 1000000000.0] and parameters: {'p_sma': 10, 'p_std': 59, 'p_atr': 14, 'p_adx': 20, 'rsi_period': 41, 'ema1': 8, 'ema2': 10, 'slip_atr_k': 0.027661638588656737, 'slip_spread_k': 0.8349994274328275, 'spread_hl_frac': 0.015750614707097575, 'bb_std_mult': 1.069853271770528, 'rsi_os': 14, 'rsi_ob': 62, 'vol_spike': 0.06729284960724724, 'adx_thresh': 23.629951156024344, 'atr_min_pct': 0.01593210372501229, 'atr_max_pct': 0.016485388111776036, 'tp_mult': 1.4025100225402893, 'tsl_mult': 0.13910891867853262, 'strategy': 'breakout', 'time_stop': 135, 'use_sma': True, 'use_atr': False, 'use_adx': True, 'use_ema': False, 'use_spike': False, 'rsi_required': False, 'edge_k': 1.7087232547547369, 'edge_cap': 0.2166859041594144, 'bull_strategy': 'mean_reversion', 'bull_bb_std_mult': 0.6018641425738558, 'bull_rsi_os': 17, 'bull_rsi_ob': 76, 'bull_adx_thresh': 14.802477454957513, 'bull_atr_min_pct': 0.005002314543569744, 'bull_atr_max_pct': 0.015237950051816159, 'bull_tp_mult': 1.07337384736783, 'bull_tsl_mult': 0.6564880375615525, 'bull_time_stop': 274, 'bull_use_sma': True, 'bull_use_ema': False, 'bull_use_atr': False, 'bull_use_adx': True, 'bull_use_spike': True, 'bull_rsi_required': False, 'bear_strategy': 'breakout', 'bear_bb_std_mult': 2.272404465726632, 'bear_rsi_os': 17, 'bear_rsi_ob': 86, 'bear_adx_thresh': 26.107168486251197, 'bear_atr_min_pct': 0.0013359607999103087, 'bear_atr_max_pct': 0.1294173639313131, 'bear_tp_mult': 1.5843926149109255, 'bear_tsl_mult': 0.34971548993371027, 'bear_time_stop': 270, 'bear_use_sma': False, 'bear_use_ema': False, 'bear_use_atr': False, 'bear_use_adx': True, 'bear_use_spike': True, 'bear_rsi_required': False, 'sideways_strategy': 'breakout', 'sideways_bb_std_mult': 0.5698803198362457, 'sideways_rsi_os': 55, 'sideways_rsi_ob': 78, 'sideways_adx_thresh': 30.37853237062791, 'sideways_atr_min_pct': 0.005596185707943936, 'sideways_atr_max_pct': 0.05230002220357974, 'sideways_tp_mult': 2.0517794771019284, 'sideways_tsl_mult': 0.25469959965903777, 'sideways_time_stop': 230, 'sideways_use_sma': False, 'sideways_use_ema': True, 'sideways_use_atr': True, 'sideways_use_adx': False, 'sideways_use_spike': False, 'sideways_rsi_required': True}.
[I 2025-09-01 10:30:32,554] Trial 526 finished with values: [-1000000000.0, 1000000000.0] and parameters: {'p_sma': 12, 'p_std': 38, 'p_atr': 13, 'p_adx': 22, 'rsi_period': 37, 'ema1': 7, 'ema2': 12, 'slip_atr_k': 0.017279435812822617, 'slip_spread_k': 0.8545094339392082, 'spread_hl_frac': 0.011466380064864563, 'bb_std_mult': 0.9694469686356106, 'rsi_os': 17, 'rsi_ob': 62, 'vol_spike': 0.05922499682400848, 'adx_thresh': 24.322116405178335, 'atr_min_pct': 0.01681902767387856, 'atr_max_pct': 0.01698190797052759, 'tp_mult': 1.4193869404667594, 'tsl_mult': 0.1376656671477746, 'strategy': 'mean_reversion', 'time_stop': 149, 'use_sma': False, 'use_atr': True, 'use_adx': False, 'use_ema': False, 'use_spike': False, 'rsi_required': False, 'edge_k': 1.7127314779869065, 'edge_cap': 0.10399780992344365, 'bull_strategy': 'mean_reversion', 'bull_bb_std_mult': 0.5088173120540379, 'bull_rsi_os': 19, 'bull_rsi_ob': 77, 'bull_adx_thresh': 13.994094838574979, 'bull_atr_min_pct': 0.012044173732181918, 'bull_atr_max_pct': 0.020222184134321468, 'bull_tp_mult': 1.119711445300006, 'bull_tsl_mult': 0.7469479329413488, 'bull_time_stop': 266, 'bull_use_sma': True, 'bull_use_ema': True, 'bull_use_atr': False, 'bull_use_adx': True, 'bull_use_spike': True, 'bull_rsi_required': False, 'bear_strategy': 'breakout', 'bear_bb_std_mult': 1.31697686258097, 'bear_rsi_os': 17, 'bear_rsi_ob': 86, 'bear_adx_thresh': 27.805144541908856, 'bear_atr_min_pct': 0.0017210947311112237, 'bear_atr_max_pct': 0.11946006580864987, 'bear_tp_mult': 1.8535997812412315, 'bear_tsl_mult': 0.3257950318511526, 'bear_time_stop': 271, 'bear_use_sma': True, 'bear_use_ema': False, 'bear_use_atr': False, 'bear_use_adx': True, 'bear_use_spike': True, 'bear_rsi_required': False, 'sideways_strategy': 'breakout', 'sideways_bb_std_mult': 0.6660602847047417, 'sideways_rsi_os': 54, 'sideways_rsi_ob': 83, 'sideways_adx_thresh': 29.046402566108526, 'sideways_atr_min_pct': 0.007523938432112169, 'sideways_atr_max_pct': 0.05140342057207121, 'sideways_tp_mult': 2.059987844873716, 'sideways_tsl_mult': 0.331275615620157, 'sideways_time_stop': 249, 'sideways_use_sma': False, 'sideways_use_ema': True, 'sideways_use_atr': True, 'sideways_use_adx': False, 'sideways_use_spike': False, 'sideways_rsi_required': True}.
[I 2025-09-01 10:30:32,563] Trial 525 finished with values: [-1000000000.0, 1000000000.0] and parameters: {'p_sma': 12, 'p_std': 15, 'p_atr': 13, 'p_adx': 21, 'rsi_period': 41, 'ema1': 8, 'ema2': 12, 'slip_atr_k': 0.0179532560825829, 'slip_spread_k': 0.8527235463679745, 'spread_hl_frac': 0.014456660727614227, 'bb_std_mult': 1.0545335829141367, 'rsi_os': 17, 'rsi_ob': 62, 'vol_spike': 0.0696655279487344, 'adx_thresh': 23.42314290316855, 'atr_min_pct': 0.016655016203336186, 'atr_max_pct': 0.016921317634784397, 'tp_mult': 1.412400188127284, 'tsl_mult': 0.13947618669677733, 'strategy': 'mean_reversion', 'time_stop': 134, 'use_sma': False, 'use_atr': True, 'use_adx': True, 'use_ema': False, 'use_spike': False, 'rsi_required': False, 'edge_k': 1.7061356746933578, 'edge_cap': 0.42882642317397923, 'bull_strategy': 'mean_reversion', 'bull_bb_std_mult': 0.5525955140452858, 'bull_rsi_os': 16, 'bull_rsi_ob': 77, 'bull_adx_thresh': 14.03254518552691, 'bull_atr_min_pct': 0.0016625783162601323, 'bull_atr_max_pct': 0.021602688941565182, 'bull_tp_mult': 1.142574209392163, 'bull_tsl_mult': 0.6596272580142876, 'bull_time_stop': 265, 'bull_use_sma': True, 'bull_use_ema': True, 'bull_use_atr': False, 'bull_use_adx': True, 'bull_use_spike': True, 'bull_rsi_required': False, 'bear_strategy': 'breakout', 'bear_bb_std_mult': 1.9268559478969847, 'bear_rsi_os': 17, 'bear_rsi_ob': 87, 'bear_adx_thresh': 26.73616481767984, 'bear_atr_min_pct': 0.002574473287848151, 'bear_atr_max_pct': 0.09122939333095784, 'bear_tp_mult': 2.0306867701061653, 'bear_tsl_mult': 0.33127464501480525, 'bear_time_stop': 270, 'bear_use_sma': True, 'bear_use_ema': False, 'bear_use_atr': False, 'bear_use_adx': True, 'bear_use_spike': True, 'bear_rsi_required': False, 'sideways_strategy': 'breakout', 'sideways_bb_std_mult': 0.5045905150528278, 'sideways_rsi_os': 54, 'sideways_rsi_ob': 84, 'sideways_adx_thresh': 29.207867220650133, 'sideways_atr_min_pct': 0.007067480372257971, 'sideways_atr_max_pct': 0.05844774628730931, 'sideways_tp_mult': 2.0670347695698075, 'sideways_tsl_mult': 0.31840591630975074, 'sideways_time_stop': 250, 'sideways_use_sma': False, 'sideways_use_ema': True, 'sideways_use_atr': True, 'sideways_use_adx': False, 'sideways_use_spike': False, 'sideways_rsi_required': True}.
[I 2025-09-01 10:30:33,366] Trial 527 finished with values: [-1000000000.0, 1000000000.0] and parameters: {'p_sma': 13, 'p_std': 59, 'p_atr': 13, 'p_adx': 16, 'rsi_period': 50, 'ema1': 7, 'ema2': 12, 'slip_atr_k': 0.0212667919149939, 'slip_spread_k': 0.8879398218229033, 'spread_hl_frac': 0.014231707880258258, 'bb_std_mult': 0.9741455450418353, 'rsi_os': 17, 'rsi_ob': 60, 'vol_spike': 0.060735724243803996, 'adx_thresh': 23.834844992446993, 'atr_min_pct': 0.017917034997371708, 'atr_max_pct': 0.01727944249170398, 'tp_mult': 1.569233690727974, 'tsl_mult': 0.12936647073002605, 'strategy': 'mean_reversion', 'time_stop': 148, 'use_sma': False, 'use_atr': False, 'use_adx': False, 'use_ema': False, 'use_spike': False, 'rsi_required': True, 'edge_k': 1.6945314553835715, 'edge_cap': 0.38297008360808515, 'bull_strategy': 'mean_reversion', 'bull_bb_std_mult': 0.5525683763243012, 'bull_rsi_os': 19, 'bull_rsi_ob': 76, 'bull_adx_thresh': 14.417609667858672, 'bull_atr_min_pct': 0.004998794109850569, 'bull_atr_max_pct': 0.021300961254680537, 'bull_tp_mult': 1.1930372790109773, 'bull_tsl_mult': 0.7388062637902858, 'bull_time_stop': 266, 'bull_use_sma': True, 'bull_use_ema': True, 'bull_use_atr': False, 'bull_use_adx': True, 'bull_use_spike': True, 'bull_rsi_required': True, 'bear_strategy': 'breakout', 'bear_bb_std_mult': 1.6622082410843868, 'bear_rsi_os': 21, 'bear_rsi_ob': 86, 'bear_adx_thresh': 27.827872941921193, 'bear_atr_min_pct': 0.0013487033075469089, 'bear_atr_max_pct': 0.0933441704530476, 'bear_tp_mult': 1.922588086549951, 'bear_tsl_mult': 0.31170532670888695, 'bear_time_stop': 270, 'bear_use_sma': True, 'bear_use_ema': False, 'bear_use_atr': False, 'bear_use_adx': True, 'bear_use_spike': True, 'bear_rsi_required': False, 'sideways_strategy': 'breakout', 'sideways_bb_std_mult': 0.6512512111441293, 'sideways_rsi_os': 54, 'sideways_rsi_ob': 64, 'sideways_adx_thresh': 28.236733743524898, 'sideways_atr_min_pct': 0.007635101489315112, 'sideways_atr_max_pct': 0.05195128764416409, 'sideways_tp_mult': 2.0056899956919145, 'sideways_tsl_mult': 0.3312593665350421, 'sideways_time_stop': 249, 'sideways_use_sma': False, 'sideways_use_ema': True, 'sideways_use_atr': True, 'sideways_use_adx': False, 'sideways_use_spike': False, 'sideways_rsi_required': True}.
[I 2025-09-01 10:31:16,056] Trial 530 finished with values: [-1000000000.0, 1000000000.0] and parameters: {'p_sma': 14, 'p_std': 30, 'p_atr': 13, 'p_adx': 16, 'rsi_period': 49, 'ema1': 6, 'ema2': 11, 'slip_atr_k': 0.021712094713467422, 'slip_spread_k': 0.8979387855887435, 'spread_hl_frac': 0.014533036297101036, 'bb_std_mult': 0.9402772477331005, 'rsi_os': 18, 'rsi_ob': 58, 'vol_spike': 0.05955351030608962, 'adx_thresh': 25.083648364471987, 'atr_min_pct': 0.015505629242415135, 'atr_max_pct': 0.021699467888330617, 'tp_mult': 1.5991897271167788, 'tsl_mult': 0.09432115909773076, 'strategy': 'breakout', 'time_stop': 139, 'use_sma': True, 'use_atr': False, 'use_adx': False, 'use_ema': False, 'use_spike': False, 'rsi_required': True, 'edge_k': 1.6040895589446549, 'edge_cap': 0.3860211373304892, 'bull_strategy': 'mean_reversion', 'bull_bb_std_mult': 0.5604767914286679, 'bull_rsi_os': 21, 'bull_rsi_ob': 76, 'bull_adx_thresh': 14.266755526004664, 'bull_atr_min_pct': 0.015844877798299715, 'bull_atr_max_pct': 0.015920276589340646, 'bull_tp_mult': 1.2370456269631032, 'bull_tsl_mult': 0.7280489002193278, 'bull_time_stop': 280, 'bull_use_sma': True, 'bull_use_ema': False, 'bull_use_atr': False, 'bull_use_adx': True, 'bull_use_spike': True, 'bull_rsi_required': True, 'bear_strategy': 'breakout', 'bear_bb_std_mult': 1.6871451515159264, 'bear_rsi_os': 20, 'bear_rsi_ob': 82, 'bear_adx_thresh': 27.263229479849045, 'bear_atr_min_pct': 0.0035470116244904187, 'bear_atr_max_pct': 0.09424036505891588, 'bear_tp_mult': 1.9073520495030825, 'bear_tsl_mult': 0.2962188854119878, 'bear_time_stop': 254, 'bear_use_sma': True, 'bear_use_ema': False, 'bear_use_atr': False, 'bear_use_adx': True, 'bear_use_spike': True, 'bear_rsi_required': False, 'sideways_strategy': 'breakout', 'sideways_bb_std_mult': 0.6143817896964594, 'sideways_rsi_os': 55, 'sideways_rsi_ob': 60, 'sideways_adx_thresh': 28.14747373139471, 'sideways_atr_min_pct': 0.004835937915622665, 'sideways_atr_max_pct': 0.04744781097488378, 'sideways_tp_mult': 2.121105090306618, 'sideways_tsl_mult': 0.3373151751874536, 'sideways_time_stop': 245, 'sideways_use_sma': False, 'sideways_use_ema': True, 'sideways_use_atr': True, 'sideways_use_adx': False, 'sideways_use_spike': False, 'sideways_rsi_required': True}.
[I 2025-09-01 10:31:16,540] Trial 529 finished with values: [-0.06437003065608371, 0.06417594591582103] and parameters: {'p_sma': 14, 'p_std': 13, 'p_atr': 13, 'p_adx': 16, 'rsi_period': 49, 'ema1': 6, 'ema2': 11, 'slip_atr_k': 0.02244539141214537, 'slip_spread_k': 0.7956213553220175, 'spread_hl_frac': 0.01434977435848035, 'bb_std_mult': 0.9439797573830194, 'rsi_os': 18, 'rsi_ob': 58, 'vol_spike': 0.06007127095419612, 'adx_thresh': 24.929853770456564, 'atr_min_pct': 0.017664505176239083, 'atr_max_pct': 0.02101991109307951, 'tp_mult': 1.583977136020966, 'tsl_mult': 0.1863955789017271, 'strategy': 'breakout', 'time_stop': 140, 'use_sma': True, 'use_atr': False, 'use_adx': False, 'use_ema': False, 'use_spike': False, 'rsi_required': True, 'edge_k': 1.5894736117345094, 'edge_cap': 0.38969213614084164, 'bull_strategy': 'mean_reversion', 'bull_bb_std_mult': 0.5653990518336247, 'bull_rsi_os': 21, 'bull_rsi_ob': 76, 'bull_adx_thresh': 15.160374450741566, 'bull_atr_min_pct': 0.0008004398720554027, 'bull_atr_max_pct': 0.012197240955740664, 'bull_tp_mult': 1.2246652742036097, 'bull_tsl_mult': 0.7251494655743174, 'bull_time_stop': 258, 'bull_use_sma': True, 'bull_use_ema': False, 'bull_use_atr': False, 'bull_use_adx': True, 'bull_use_spike': True, 'bull_rsi_required': True, 'bear_strategy': 'breakout', 'bear_bb_std_mult': 1.6918647911928917, 'bear_rsi_os': 20, 'bear_rsi_ob': 82, 'bear_adx_thresh': 27.664629103485773, 'bear_atr_min_pct': 0.0034731472669708528, 'bear_atr_max_pct': 0.09405111804120521, 'bear_tp_mult': 1.9180005509334808, 'bear_tsl_mult': 0.3195377281402977, 'bear_time_stop': 252, 'bear_use_sma': True, 'bear_use_ema': False, 'bear_use_atr': False, 'bear_use_adx': True, 'bear_use_spike': True, 'bear_rsi_required': False, 'sideways_strategy': 'breakout', 'sideways_bb_std_mult': 0.6229081630023072, 'sideways_rsi_os': 55, 'sideways_rsi_ob': 63, 'sideways_adx_thresh': 28.373958902555092, 'sideways_atr_min_pct': 0.007929811672322318, 'sideways_atr_max_pct': 0.04461165943672422, 'sideways_tp_mult': 2.0106506106194626, 'sideways_tsl_mult': 0.30379233976429615, 'sideways_time_stop': 249, 'sideways_use_sma': False, 'sideways_use_ema': True, 'sideways_use_atr': True, 'sideways_use_adx': False, 'sideways_use_spike': False, 'sideways_rsi_required': True}.
[I 2025-09-01 10:31:16,956] Trial 528 finished with values: [-1000000000.0, 1000000000.0] and parameters: {'p_sma': 11, 'p_std': 38, 'p_atr': 13, 'p_adx': 19, 'rsi_period': 49, 'ema1': 7, 'ema2': 11, 'slip_atr_k': 0.018586178182112292, 'slip_spread_k': 0.8584860127298957, 'spread_hl_frac': 0.014454128648936613, 'bb_std_mult': 1.0009812115459662, 'rsi_os': 17, 'rsi_ob': 60, 'vol_spike': 0.05834406661501093, 'adx_thresh': 24.35806923783683, 'atr_min_pct': 0.016821579968527622, 'atr_max_pct': 0.017465990629787556, 'tp_mult': 1.57338482345756, 'tsl_mult': 0.08923613423915092, 'strategy': 'mean_reversion', 'time_stop': 147, 'use_sma': False, 'use_atr': True, 'use_adx': False, 'use_ema': False, 'use_spike': False, 'rsi_required': True, 'edge_k': 1.6040515932209476, 'edge_cap': 0.3552383948965443, 'bull_strategy': 'mean_reversion', 'bull_bb_std_mult': 0.5378737804767104, 'bull_rsi_os': 19, 'bull_rsi_ob': 77, 'bull_adx_thresh': 14.160374986058947, 'bull_atr_min_pct': 0.0016551090525693968, 'bull_atr_max_pct': 0.021279676857930828, 'bull_tp_mult': 1.235980789491714, 'bull_tsl_mult': 0.7269960221191185, 'bull_time_stop': 267, 'bull_use_sma': True, 'bull_use_ema': True, 'bull_use_atr': False, 'bull_use_adx': True, 'bull_use_spike': True, 'bull_rsi_required': True, 'bear_strategy': 'breakout', 'bear_bb_std_mult': 1.3179681715373714, 'bear_rsi_os': 19, 'bear_rsi_ob': 82, 'bear_adx_thresh': 27.9283371307463, 'bear_atr_min_pct': 0.003460623889765039, 'bear_atr_max_pct': 0.11906306306479694, 'bear_tp_mult': 2.060220276617811, 'bear_tsl_mult': 0.3135328026196142, 'bear_time_stop': 251, 'bear_use_sma': True, 'bear_use_ema': False, 'bear_use_atr': False, 'bear_use_adx': True, 'bear_use_spike': True, 'bear_rsi_required': False, 'sideways_strategy': 'breakout', 'sideways_bb_std_mult': 0.5025238231789589, 'sideways_rsi_os': 54, 'sideways_rsi_ob': 84, 'sideways_adx_thresh': 29.10143592863952, 'sideways_atr_min_pct': 0.007789172788789388, 'sideways_atr_max_pct': 0.04531595220491039, 'sideways_tp_mult': 1.9942332580693343, 'sideways_tsl_mult': 0.2979986826471453, 'sideways_time_stop': 248, 'sideways_use_sma': False, 'sideways_use_ema': True, 'sideways_use_atr': True, 'sideways_use_adx': False, 'sideways_use_spike': False, 'sideways_rsi_required': True}.
