[I 2025-09-01 10:34:17,430] Trial 555 finished with values: [-0.06437239902012148, 0.06412504945338743] and parameters: {'p_sma': 60, 'p_std': 8, 'p_atr': 14, 'p_adx': 13, 'rsi_period': 45, 'ema1': 9, 'ema2': 10, 'slip_atr_k': 0.009719738135360152, 'slip_spread_k': 0.8296871534899429, 'spread_hl_frac': 0.013439515286316553, 'bb_std_mult': 0.9482655061134093, 'rsi_os': 18, 'rsi_ob': 60, 'vol_spike': 0.0726148887321045, 'adx_thresh': 22.674840717824146, 'atr_min_pct': 0.0162605378226615, 'atr_max_pct': 0.01747075048738515, 'tp_mult': 1.435600866322331, 'tsl_mult': 0.11927291927365369, 'strategy': 'mean_reversion', 'time_stop': 136, 'use_sma': False, 'use_atr': False, 'use_adx': True, 'use_ema': False, 'use_spike': False, 'rsi_required': True, 'edge_k': 1.7470412698155138, 'edge_cap': 0.4084567149906426, 'bull_strategy': 'mean_reversion', 'bull_bb_std_mult': 0.5598962007271616, 'bull_rsi_os': 21, 'bull_rsi_ob': 75, 'bull_adx_thresh': 14.800609680200557, 'bull_atr_min_pct': 0.0005858170965310038, 'bull_atr_max_pct': 0.012070088863027878, 'bull_tp_mult': 1.1014746911894329, 'bull_tsl_mult': 0.678786254882953, 'bull_time_stop': 284, 'bull_use_sma': True, 'bull_use_ema': True, 'bull_use_atr': False, 'bull_use_adx': True, 'bull_use_spike': True, 'bull_rsi_required': True, 'bear_strategy': 'breakout', 'bear_bb_std_mult': 1.2332907977538965, 'bear_rsi_os': 15, 'bear_rsi_ob': 85, 'bear_adx_thresh': 25.60015001730214, 'bear_atr_min_pct': 0.0030300570311770215, 'bear_atr_max_pct': 0.013412675504675245, 'bear_tp_mult': 2.1371512963695523, 'bear_tsl_mult': 0.3427133536813595, 'bear_time_stop': 240, 'bear_use_sma': True, 'bear_use_ema': False, 'bear_use_atr': False, 'bear_use_adx': True, 'bear_use_spike': True, 'bear_rsi_required': False, 'sideways_strategy': 'breakout', 'sideways_bb_std_mult': 0.6356539850006766, 'sideways_rsi_os': 39, 'sideways_rsi_ob': 75, 'sideways_adx_thresh': 30.310516753619403, 'sideways_atr_min_pct': 0.007138510860126994, 'sideways_atr_max_pct': 0.05569259988536205, 'sideways_tp_mult': 2.085795390176348, 'sideways_tsl_mult': 0.28281361221626083, 'sideways_time_stop': 239, 'sideways_use_sma': False, 'sideways_use_ema': True, 'sideways_use_atr': True, 'sideways_use_adx': False, 'sideways_use_spike': False, 'sideways_rsi_required': True}.
[I 2025-09-01 10:34:18,597] Trial 561 finished with values: [-1000000000.0, 1000000000.0] and parameters: {'p_sma': 11, 'p_std': 42, 'p_atr': 12, 'p_adx': 13, 'rsi_period': 47, 'ema1': 7, 'ema2': 11, 'slip_atr_k': 0.029713434859354324, 'slip_spread_k': 0.7836006231150529, 'spread_hl_frac': 0.01645228488222588, 'bb_std_mult': 0.9800629068082493, 'rsi_os': 18, 'rsi_ob': 56, 'vol_spike': 0.058628148374899346, 'adx_thresh': 23.484327286248167, 'atr_min_pct': 0.017151713449971205, 'atr_max_pct': 0.013068539974945432, 'tp_mult': 1.5919718769372695, 'tsl_mult': 0.13775428327710504, 'strategy': 'breakout', 'time_stop': 132, 'use_sma': True, 'use_atr': True, 'use_adx': False, 'use_ema': False, 'use_spike': False, 'rsi_required': True, 'edge_k': 1.6736128022380932, 'edge_cap': 0.3380548196124817, 'bull_strategy': 'breakout', 'bull_bb_std_mult': 0.6498168106451483, 'bull_rsi_os': 17, 'bull_rsi_ob': 77, 'bull_adx_thresh': 16.59538121787789, 'bull_atr_min_pct': 0.0017392844219772333, 'bull_atr_max_pct': 0.02632503124888489, 'bull_tp_mult': 1.2403386536391108, 'bull_tsl_mult': 0.8548983724818479, 'bull_time_stop': 274, 'bull_use_sma': True, 'bull_use_ema': False, 'bull_use_atr': False, 'bull_use_adx': True, 'bull_use_spike': True, 'bull_rsi_required': True, 'bear_strategy': 'breakout', 'bear_bb_std_mult': 1.4120269247809139, 'bear_rsi_os': 17, 'bear_rsi_ob': 85, 'bear_adx_thresh': 26.131546293613503, 'bear_atr_min_pct': 0.01829424935079159, 'bear_atr_max_pct': 0.11903848197642364, 'bear_tp_mult': 2.793117230470622, 'bear_tsl_mult': 0.3029369508963066, 'bear_time_stop': 243, 'bear_use_sma': True, 'bear_use_ema': False, 'bear_use_atr': False, 'bear_use_adx': True, 'bear_use_spike': True, 'bear_rsi_required': False, 'sideways_strategy': 'breakout', 'sideways_bb_std_mult': 2.5215694083582427, 'sideways_rsi_os': 7, 'sideways_rsi_ob': 75, 'sideways_adx_thresh': 28.763915883374423, 'sideways_atr_min_pct': 0.008040970012643709, 'sideways_atr_max_pct': 0.04934865490558282, 'sideways_tp_mult': 2.0801922115360387, 'sideways_tsl_mult': 0.2733131182293337, 'sideways_time_stop': 236, 'sideways_use_sma': False, 'sideways_use_ema': True, 'sideways_use_atr': True, 'sideways_use_adx': False, 'sideways_use_spike': True, 'sideways_rsi_required': True}.
[I 2025-09-01 10:34:18,641] Trial 559 finished with values: [-1000000000.0, 1000000000.0] and parameters: {'p_sma': 37, 'p_std': 42, 'p_atr': 12, 'p_adx': 7, 'rsi_period': 47, 'ema1': 8, 'ema2': 11, 'slip_atr_k': 0.020720465539075042, 'slip_spread_k': 0.8264559739863108, 'spread_hl_frac': 0.016543064876768668, 'bb_std_mult': 0.9638236726869855, 'rsi_os': 13, 'rsi_ob': 58, 'vol_spike': 0.05971050727279334, 'adx_thresh': 22.80048237253091, 'atr_min_pct': 0.01747028849745258, 'atr_max_pct': 0.01394944544732046, 'tp_mult': 1.45357797251425, 'tsl_mult': 0.1471472592698639, 'strategy': 'mean_reversion', 'time_stop': 135, 'use_sma': False, 'use_atr': True, 'use_adx': True, 'use_ema': False, 'use_spike': False, 'rsi_required': True, 'edge_k': 1.6547214078684909, 'edge_cap': 0.18776839033152337, 'bull_strategy': 'breakout', 'bull_bb_std_mult': 0.7233740547598021, 'bull_rsi_os': 16, 'bull_rsi_ob': 74, 'bull_adx_thresh': 12.98054045237831, 'bull_atr_min_pct': 0.013736568999426104, 'bull_atr_max_pct': 0.013575009009403128, 'bull_tp_mult': 1.2554143143897138, 'bull_tsl_mult': 0.6662834435472168, 'bull_time_stop': 261, 'bull_use_sma': True, 'bull_use_ema': True, 'bull_use_atr': False, 'bull_use_adx': True, 'bull_use_spike': True, 'bull_rsi_required': True, 'bear_strategy': 'breakout', 'bear_bb_std_mult': 2.114257961995315, 'bear_rsi_os': 19, 'bear_rsi_ob': 85, 'bear_adx_thresh': 25.76736812662095, 'bear_atr_min_pct': 0.0030779991762708834, 'bear_atr_max_pct': 0.015130500265581437, 'bear_tp_mult': 2.0106405148278927, 'bear_tsl_mult': 0.2981371958020171, 'bear_time_stop': 267, 'bear_use_sma': True, 'bear_use_ema': False, 'bear_use_atr': False, 'bear_use_adx': True, 'bear_use_spike': True, 'bear_rsi_required': False, 'sideways_strategy': 'breakout', 'sideways_bb_std_mult': 0.6029392648532019, 'sideways_rsi_os': 9, 'sideways_rsi_ob': 74, 'sideways_adx_thresh': 28.27794144049228, 'sideways_atr_min_pct': 0.00703113978552904, 'sideways_atr_max_pct': 0.04706237218067798, 'sideways_tp_mult': 2.0789831868145052, 'sideways_tsl_mult': 0.2688313809622919, 'sideways_time_stop': 249, 'sideways_use_sma': False, 'sideways_use_ema': True, 'sideways_use_atr': True, 'sideways_use_adx': False, 'sideways_use_spike': True, 'sideways_rsi_required': True}.
[I 2025-09-01 10:34:18,651] Trial 560 finished with values: [-1000000000.0, 1000000000.0] and parameters: {'p_sma': 44, 'p_std': 41, 'p_atr': 13, 'p_adx': 13, 'rsi_period': 37, 'ema1': 7, 'ema2': 11, 'slip_atr_k': 0.0062524192603517405, 'slip_spread_k': 0.7873485486897069, 'spread_hl_frac': 0.012017235765098739, 'bb_std_mult': 0.989527099971882, 'rsi_os': 18, 'rsi_ob': 57, 'vol_spike': 0.07244449024568983, 'adx_thresh': 21.840233392656355, 'atr_min_pct': 0.017170866412712794, 'atr_max_pct': 0.014846626448328602, 'tp_mult': 1.55041854468665, 'tsl_mult': 0.17392999080334826, 'strategy': 'breakout', 'time_stop': 130, 'use_sma': True, 'use_atr': True, 'use_adx': False, 'use_ema': False, 'use_spike': False, 'rsi_required': True, 'edge_k': 1.7422654267480948, 'edge_cap': 0.06237697546350368, 'bull_strategy': 'breakout', 'bull_bb_std_mult': 0.6179105257393586, 'bull_rsi_os': 17, 'bull_rsi_ob': 77, 'bull_adx_thresh': 16.20357400224501, 'bull_atr_min_pct': 0.0020441627781878744, 'bull_atr_max_pct': 0.02714172660025471, 'bull_tp_mult': 1.2575044621744185, 'bull_tsl_mult': 0.718273960281428, 'bull_time_stop': 275, 'bull_use_sma': True, 'bull_use_ema': False, 'bull_use_atr': False, 'bull_use_adx': True, 'bull_use_spike': True, 'bull_rsi_required': True, 'bear_strategy': 'breakout', 'bear_bb_std_mult': 1.9595136321241624, 'bear_rsi_os': 17, 'bear_rsi_ob': 85, 'bear_adx_thresh': 28.51112362370235, 'bear_atr_min_pct': 0.002527493241948761, 'bear_atr_max_pct': 0.11852969784515435, 'bear_tp_mult': 2.794968202290531, 'bear_tsl_mult': 0.2901832381515159, 'bear_time_stop': 240, 'bear_use_sma': True, 'bear_use_ema': False, 'bear_use_atr': False, 'bear_use_adx': True, 'bear_use_spike': True, 'bear_rsi_required': False, 'sideways_strategy': 'breakout', 'sideways_bb_std_mult': 0.5647128854647846, 'sideways_rsi_os': 24, 'sideways_rsi_ob': 60, 'sideways_adx_thresh': 30.36793359011081, 'sideways_atr_min_pct': 0.008234026734905751, 'sideways_atr_max_pct': 0.047327191985467434, 'sideways_tp_mult': 2.0573082116469634, 'sideways_tsl_mult': 0.2826407883969526, 'sideways_time_stop': 234, 'sideways_use_sma': False, 'sideways_use_ema': True, 'sideways_use_atr': True, 'sideways_use_adx': False, 'sideways_use_spike': True, 'sideways_rsi_required': True}.
[I 2025-09-01 10:34:18,732] Trial 562 finished with values: [-1000000000.0, 1000000000.0] and parameters: {'p_sma': 37, 'p_std': 42, 'p_atr': 12, 'p_adx': 19, 'rsi_period': 47, 'ema1': 7, 'ema2': 11, 'slip_atr_k': 0.025110790623504298, 'slip_spread_k': 0.7849707080437575, 'spread_hl_frac': 0.01213743853668391, 'bb_std_mult': 0.835895636164516, 'rsi_os': 16, 'rsi_ob': 62, 'vol_spike': 0.05889275497919297, 'adx_thresh': 21.820004070004618, 'atr_min_pct': 0.017456768612696346, 'atr_max_pct': 0.014005655141193556, 'tp_mult': 1.6032493940156844, 'tsl_mult': 0.13608580530588257, 'strategy': 'breakout', 'time_stop': 128, 'use_sma': True, 'use_atr': True, 'use_adx': False, 'use_ema': False, 'use_spike': False, 'rsi_required': True, 'edge_k': 1.5925486819739136, 'edge_cap': 0.33196950455075463, 'bull_strategy': 'breakout', 'bull_bb_std_mult': 0.6501526200643225, 'bull_rsi_os': 17, 'bull_rsi_ob': 77, 'bull_adx_thresh': 15.869880241400947, 'bull_atr_min_pct': 0.02165667494600763, 'bull_atr_max_pct': 0.02715459736046879, 'bull_tp_mult': 1.269824537458771, 'bull_tsl_mult': 0.7141925080150158, 'bull_time_stop': 5, 'bull_use_sma': True, 'bull_use_ema': False, 'bull_use_atr': False, 'bull_use_adx': True, 'bull_use_spike': True, 'bull_rsi_required': True, 'bear_strategy': 'breakout', 'bear_bb_std_mult': 1.3932755742979628, 'bear_rsi_os': 17, 'bear_rsi_ob': 86, 'bear_adx_thresh': 28.649667499541845, 'bear_atr_min_pct': 0.0023795287237737862, 'bear_atr_max_pct': 0.11963909843406628, 'bear_tp_mult': 2.028458654817395, 'bear_tsl_mult': 0.2991103871057839, 'bear_time_stop': 256, 'bear_use_sma': True, 'bear_use_ema': False, 'bear_use_atr': False, 'bear_use_adx': True, 'bear_use_spike': True, 'bear_rsi_required': False, 'sideways_strategy': 'breakout', 'sideways_bb_std_mult': 0.5005094770004455, 'sideways_rsi_os': 24, 'sideways_rsi_ob': 79, 'sideways_adx_thresh': 28.90732499676261, 'sideways_atr_min_pct': 0.00808315832970867, 'sideways_atr_max_pct': 0.049833203236068636, 'sideways_tp_mult': 2.0552963878762807, 'sideways_tsl_mult': 0.26461490259408926, 'sideways_time_stop': 233, 'sideways_use_sma': False, 'sideways_use_ema': True, 'sideways_use_atr': True, 'sideways_use_adx': False, 'sideways_use_spike': True, 'sideways_rsi_required': True}.
[I 2025-09-01 10:34:19,914] Trial 563 finished with values: [-1000000000.0, 1000000000.0] and parameters: {'p_sma': 37, 'p_std': 58, 'p_atr': 12, 'p_adx': 10, 'rsi_period': 37, 'ema1': 7, 'ema2': 11, 'slip_atr_k': 0.02267296310501616, 'slip_spread_k': 0.7957288243621838, 'spread_hl_frac': 0.012193019875991123, 'bb_std_mult': 0.8413939819412535, 'rsi_os': 16, 'rsi_ob': 62, 'vol_spike': 0.06837444603664568, 'adx_thresh': 24.020309201262503, 'atr_min_pct': 0.017301646122089266, 'atr_max_pct': 0.012698469113519484, 'tp_mult': 1.553743604297208, 'tsl_mult': 0.14469968129973987, 'strategy': 'breakout', 'time_stop': 118, 'use_sma': True, 'use_atr': False, 'use_adx': False, 'use_ema': False, 'use_spike': False, 'rsi_required': False, 'edge_k': 1.6354500268130685, 'edge_cap': 0.06592499656560785, 'bull_strategy': 'breakout', 'bull_bb_std_mult': 0.6295691729413244, 'bull_rsi_os': 17, 'bull_rsi_ob': 76, 'bull_adx_thresh': 12.957953529860056, 'bull_atr_min_pct': 0.012939092915842255, 'bull_atr_max_pct': 0.01674593773146236, 'bull_tp_mult': 1.2686769562836488, 'bull_tsl_mult': 0.5858017831532581, 'bull_time_stop': 249, 'bull_use_sma': True, 'bull_use_ema': False, 'bull_use_atr': False, 'bull_use_adx': True, 'bull_use_spike': True, 'bull_rsi_required': False, 'bear_strategy': 'breakout', 'bear_bb_std_mult': 1.9408143865048046, 'bear_rsi_os': 17, 'bear_rsi_ob': 86, 'bear_adx_thresh': 28.369344092539862, 'bear_atr_min_pct': 0.002440807983574099, 'bear_atr_max_pct': 0.017299355942334935, 'bear_tp_mult': 1.8832991934264491, 'bear_tsl_mult': 0.28576718505231485, 'bear_time_stop': 258, 'bear_use_sma': True, 'bear_use_ema': True, 'bear_use_atr': False, 'bear_use_adx': True, 'bear_use_spike': True, 'bear_rsi_required': False, 'sideways_strategy': 'breakout', 'sideways_bb_std_mult': 0.5513396916937187, 'sideways_rsi_os': 21, 'sideways_rsi_ob': 85, 'sideways_adx_thresh': 29.69400444181551, 'sideways_atr_min_pct': 0.00410396454641212, 'sideways_atr_max_pct': 0.04733774194939211, 'sideways_tp_mult': 1.8951495515112737, 'sideways_tsl_mult': 0.32562079010261724, 'sideways_time_stop': 244, 'sideways_use_sma': False, 'sideways_use_ema': True, 'sideways_use_atr': True, 'sideways_use_adx': False, 'sideways_use_spike': True, 'sideways_rsi_required': True}.
[I 2025-09-01 10:34:20,497] Trial 567 finished with values: [-1000000000.0, 1000000000.0] and parameters: {'p_sma': 15, 'p_std': 19, 'p_atr': 13, 'p_adx': 21, 'rsi_period': 39, 'ema1': 5, 'ema2': 12, 'slip_atr_k': 0.0134509830266962, 'slip_spread_k': 0.8607089804052246, 'spread_hl_frac': 0.014087829143595588, 'bb_std_mult': 1.0461620669149174, 'rsi_os': 21, 'rsi_ob': 58, 'vol_spike': 0.048027698084069224, 'adx_thresh': 23.6813301633479, 'atr_min_pct': 0.01600136569904292, 'atr_max_pct': 0.010204374919802375, 'tp_mult': 1.3893030164653262, 'tsl_mult': 0.17539087296213243, 'strategy': 'breakout', 'time_stop': 142, 'use_sma': True, 'use_atr': False, 'use_adx': False, 'use_ema': False, 'use_spike': False, 'rsi_required': False, 'edge_k': 1.5267720453261355, 'edge_cap': 0.7742279706408142, 'bull_strategy': 'mean_reversion', 'bull_bb_std_mult': 0.5644119036943505, 'bull_rsi_os': 19, 'bull_rsi_ob': 76, 'bull_adx_thresh': 13.655668768641021, 'bull_atr_min_pct': 0.029847095575158092, 'bull_atr_max_pct': 0.01913757810408042, 'bull_tp_mult': 1.1988164671686512, 'bull_tsl_mult': 0.7410011809635328, 'bull_time_stop': 269, 'bull_use_sma': False, 'bull_use_ema': False, 'bull_use_atr': False, 'bull_use_adx': True, 'bull_use_spike': True, 'bull_rsi_required': False, 'bear_strategy': 'breakout', 'bear_bb_std_mult': 1.8259844223365307, 'bear_rsi_os': 20, 'bear_rsi_ob': 83, 'bear_adx_thresh': 27.305901767220583, 'bear_atr_min_pct': 0.0010092138192790852, 'bear_atr_max_pct': 0.08438684442302206, 'bear_tp_mult': 2.7261390833056685, 'bear_tsl_mult': 0.3167475541808046, 'bear_time_stop': 265, 'bear_use_sma': True, 'bear_use_ema': True, 'bear_use_atr': False, 'bear_use_adx': True, 'bear_use_spike': True, 'bear_rsi_required': True, 'sideways_strategy': 'breakout', 'sideways_bb_std_mult': 3.3655894221551064, 'sideways_rsi_os': 44, 'sideways_rsi_ob': 48, 'sideways_adx_thresh': 29.283537572731294, 'sideways_atr_min_pct': 0.005261564501359093, 'sideways_atr_max_pct': 0.05274843020467522, 'sideways_tp_mult': 2.031694125770451, 'sideways_tsl_mult': 0.22425988816483228, 'sideways_time_stop': 244, 'sideways_use_sma': False, 'sideways_use_ema': True, 'sideways_use_atr': True, 'sideways_use_adx': False, 'sideways_use_spike': False, 'sideways_rsi_required': True}.
[I 2025-09-01 10:35:02,443] Trial 566 finished with values: [-1000000000.0, 1000000000.0] and parameters: {'p_sma': 15, 'p_std': 58, 'p_atr': 13, 'p_adx': 15, 'rsi_period': 39, 'ema1': 8, 'ema2': 12, 'slip_atr_k': 0.012102125773132853, 'slip_spread_k': 0.862813472208791, 'spread_hl_frac': 0.014355038306069564, 'bb_std_mult': 1.0989931372656463, 'rsi_os': 16, 'rsi_ob': 58, 'vol_spike': 0.05024294654778465, 'adx_thresh': 24.042731283867766, 'atr_min_pct': 0.018002632732775158, 'atr_max_pct': 0.019712321994288042, 'tp_mult': 1.5043692680676772, 'tsl_mult': 0.0969851501489738, 'strategy': 'breakout', 'time_stop': 141, 'use_sma': True, 'use_atr': False, 'use_adx': False, 'use_ema': False, 'use_spike': False, 'rsi_required': False, 'edge_k': 1.4853471972707122, 'edge_cap': 0.36763970861700473, 'bull_strategy': 'mean_reversion', 'bull_bb_std_mult': 0.5005509667533685, 'bull_rsi_os': 19, 'bull_rsi_ob': 79, 'bull_adx_thresh': 17.15739754725793, 'bull_atr_min_pct': 0.011674584855544401, 'bull_atr_max_pct': 0.01692104524393211, 'bull_tp_mult': 1.1837657156519155, 'bull_tsl_mult': 0.5811593043328799, 'bull_time_stop': 252, 'bull_use_sma': False, 'bull_use_ema': False, 'bull_use_atr': False, 'bull_use_adx': True, 'bull_use_spike': True, 'bull_rsi_required': False, 'bear_strategy': 'breakout', 'bear_bb_std_mult': 2.6997979418653015, 'bear_rsi_os': 20, 'bear_rsi_ob': 87, 'bear_adx_thresh': 27.35365449936178, 'bear_atr_min_pct': 0.02014952288871367, 'bear_atr_max_pct': 0.11285026930021475, 'bear_tp_mult': 2.7140202396661235, 'bear_tsl_mult': 0.3228619472984037, 'bear_time_stop': 255, 'bear_use_sma': True, 'bear_use_ema': True, 'bear_use_atr': False, 'bear_use_adx': True, 'bear_use_spike': True, 'bear_rsi_required': True, 'sideways_strategy': 'breakout', 'sideways_bb_std_mult': 0.5513066174158912, 'sideways_rsi_os': 11, 'sideways_rsi_ob': 86, 'sideways_adx_thresh': 29.39204695497267, 'sideways_atr_min_pct': 0.005890912713881027, 'sideways_atr_max_pct': 0.05251420101523439, 'sideways_tp_mult': 1.8959242202839317, 'sideways_tsl_mult': 0.32313999277964167, 'sideways_time_stop': 245, 'sideways_use_sma': False, 'sideways_use_ema': True, 'sideways_use_atr': True, 'sideways_use_adx': False, 'sideways_use_spike': False, 'sideways_rsi_required': True}.
[I 2025-09-01 10:35:03,008] Trial 565 finished with values: [-1000000000.0, 1000000000.0] and parameters: {'p_sma': 15, 'p_std': 35, 'p_atr': 13, 'p_adx': 19, 'rsi_period': 39, 'ema1': 7, 'ema2': 12, 'slip_atr_k': 0.02489608721620458, 'slip_spread_k': 0.8650124477278696, 'spread_hl_frac': 0.014408830914464725, 'bb_std_mult': 0.8473622769827622, 'rsi_os': 16, 'rsi_ob': 62, 'vol_spike': 0.0486886910455602, 'adx_thresh': 24.107620815257327, 'atr_min_pct': 0.018153632229038496, 'atr_max_pct': 0.025681293372570045, 'tp_mult': 1.6135925458757667, 'tsl_mult': 0.1733318669060861, 'strategy': 'breakout', 'time_stop': 118, 'use_sma': True, 'use_atr': False, 'use_adx': False, 'use_ema': False, 'use_spike': False, 'rsi_required': False, 'edge_k': 1.5973559081514854, 'edge_cap': 0.37410334526479866, 'bull_strategy': 'mean_reversion', 'bull_bb_std_mult': 0.5752577524512535, 'bull_rsi_os': 19, 'bull_rsi_ob': 76, 'bull_adx_thresh': 15.713663179512713, 'bull_atr_min_pct': 0.021653630602342145, 'bull_atr_max_pct': 0.01668285813388107, 'bull_tp_mult': 1.201917279446409, 'bull_tsl_mult': 0.6211853276388566, 'bull_time_stop': 255, 'bull_use_sma': False, 'bull_use_ema': False, 'bull_use_atr': False, 'bull_use_adx': True, 'bull_use_spike': True, 'bull_rsi_required': False, 'bear_strategy': 'breakout', 'bear_bb_std_mult': 1.830795079668392, 'bear_rsi_os': 20, 'bear_rsi_ob': 87, 'bear_adx_thresh': 27.002859581071334, 'bear_atr_min_pct': 0.0021095532937002288, 'bear_atr_max_pct': 0.09151554141785757, 'bear_tp_mult': 1.6018356391203838, 'bear_tsl_mult': 0.3142695014384691, 'bear_time_stop': 256, 'bear_use_sma': True, 'bear_use_ema': True, 'bear_use_atr': False, 'bear_use_adx': True, 'bear_use_spike': True, 'bear_rsi_required': True, 'sideways_strategy': 'breakout', 'sideways_bb_std_mult': 0.5001513748073959, 'sideways_rsi_os': 54, 'sideways_rsi_ob': 83, 'sideways_adx_thresh': 29.61692304847634, 'sideways_atr_min_pct': 0.029425018406721022, 'sideways_atr_max_pct': 0.0520622145592977, 'sideways_tp_mult': 1.86633693894114, 'sideways_tsl_mult': 0.3149080897064233, 'sideways_time_stop': 244, 'sideways_use_sma': False, 'sideways_use_ema': True, 'sideways_use_atr': True, 'sideways_use_adx': False, 'sideways_use_spike': False, 'sideways_rsi_required': True}.
