[I 2025-09-01 09:41:09,587] Trial 218 finished with values: [-0.04175495054970235, 0.041550230497514266] and parameters: {'p_sma': 58, 'p_std': 34, 'p_atr': 17, 'p_adx': 13, 'rsi_period': 23, 'ema1': 9, 'ema2': 19, 'slip_atr_k': 0.06921954349760531, 'slip_spread_k': 0.6384974500215195, 'spread_hl_frac': 0.012526717296283497, 'bb_std_mult': 3.545254747661999, 'rsi_os': 37, 'rsi_ob': 70, 'vol_spike': 0.01911412535097626, 'adx_thresh': 27.051768411321177, 'atr_min_pct': 0.010320847222393802, 'atr_max_pct': 0.07117070072789314, 'tp_mult': 1.92212223996705, 'tsl_mult': 0.9710425055241734, 'strategy': 'breakout', 'time_stop': 300, 'use_sma': True, 'use_atr': False, 'use_adx': False, 'use_ema': True, 'use_spike': True, 'rsi_required': False, 'edge_k': 1.2510264471113735, 'edge_cap': 0.80850165873568, 'bull_strategy': 'mean_reversion', 'bull_bb_std_mult': 3.59497562522081, 'bull_rsi_os': 19, 'bull_rsi_ob': 48, 'bull_adx_thresh': 19.0009009266207, 'bull_atr_min_pct': 0.002535391650768791, 'bull_atr_max_pct': 0.08978594050096764, 'bull_tp_mult': 1.494393826184797, 'bull_tsl_mult': 0.9831625861211735, 'bull_time_stop': 59, 'bull_use_sma': True, 'bull_use_ema': False, 'bull_use_atr': True, 'bull_use_adx': False, 'bull_use_spike': False, 'bull_rsi_required': False, 'bear_strategy': 'breakout', 'bear_bb_std_mult': 2.5122095828389988, 'bear_rsi_os': 22, 'bear_rsi_ob': 78, 'bear_adx_thresh': 22.16213472978376, 'bear_atr_min_pct': 0.01517741686261896, 'bear_atr_max_pct': 0.09091859728715602, 'bear_tp_mult': 1.248887775363774, 'bear_tsl_mult': 0.37847005938312545, 'bear_time_stop': 292, 'bear_use_sma': True, 'bear_use_ema': False, 'bear_use_atr': True, 'bear_use_adx': False, 'bear_use_spike': False, 'bear_rsi_required': False, 'sideways_strategy': 'mean_reversion', 'sideways_bb_std_mult': 2.3088973850609786, 'sideways_rsi_os': 36, 'sideways_rsi_ob': 91, 'sideways_adx_thresh': 8.023831248772305, 'sideways_atr_min_pct': 0.019840141905414884, 'sideways_atr_max_pct': 0.07486177681616389, 'sideways_tp_mult': 1.8138784762904525, 'sideways_tsl_mult': 0.46618411336387366, 'sideways_time_stop': 25, 'sideways_use_sma': True, 'sideways_use_ema': False, 'sideways_use_atr': True, 'sideways_use_adx': False, 'sideways_use_spike': False, 'sideways_rsi_required': False}.
[I 2025-09-01 09:41:10,188] Trial 217 finished with values: [-0.02128605720796295, 0.021136947736172855] and parameters: {'p_sma': 17, 'p_std': 48, 'p_atr': 18, 'p_adx': 25, 'rsi_period': 23, 'ema1': 18, 'ema2': 16, 'slip_atr_k': 0.05331614559274308, 'slip_spread_k': 0.6505202956839106, 'spread_hl_frac': 0.029468074972673685, 'bb_std_mult': 1.507293289032836, 'rsi_os': 41, 'rsi_ob': 68, 'vol_spike': 0.10303726204154652, 'adx_thresh': 32.386049089893284, 'atr_min_pct': 0.01036449568529271, 'atr_max_pct': 0.13600668717289238, 'tp_mult': 1.118309784295025, 'tsl_mult': 0.6954209349981755, 'strategy': 'breakout', 'time_stop': 250, 'use_sma': True, 'use_atr': False, 'use_adx': False, 'use_ema': True, 'use_spike': True, 'rsi_required': True, 'edge_k': 1.2398312325884535, 'edge_cap': 0.5769426945527161, 'bull_strategy': 'mean_reversion', 'bull_bb_std_mult': 3.598555111704766, 'bull_rsi_os': 46, 'bull_rsi_ob': 47, 'bull_adx_thresh': 6.12509482917547, 'bull_atr_min_pct': 0.0012649931321011836, 'bull_atr_max_pct': 0.08831664302619137, 'bull_tp_mult': 2.9753495933253076, 'bull_tsl_mult': 0.4058554282153062, 'bull_time_stop': 209, 'bull_use_sma': True, 'bull_use_ema': False, 'bull_use_atr': True, 'bull_use_adx': False, 'bull_use_spike': False, 'bull_rsi_required': True, 'bear_strategy': 'mean_reversion', 'bear_bb_std_mult': 0.9282627937552066, 'bear_rsi_os': 55, 'bear_rsi_ob': 75, 'bear_adx_thresh': 23.850816014254548, 'bear_atr_min_pct': 0.005783891105758143, 'bear_atr_max_pct': 0.05736441740558183, 'bear_tp_mult': 1.2175088924362423, 'bear_tsl_mult': 0.47380284153097074, 'bear_time_stop': 294, 'bear_use_sma': True, 'bear_use_ema': False, 'bear_use_atr': True, 'bear_use_adx': False, 'bear_use_spike': False, 'bear_rsi_required': False, 'sideways_strategy': 'mean_reversion', 'sideways_bb_std_mult': 0.862533364332822, 'sideways_rsi_os': 52, 'sideways_rsi_ob': 91, 'sideways_adx_thresh': 22.663407814510567, 'sideways_atr_min_pct': 0.009988782370175385, 'sideways_atr_max_pct': 0.0709642606131581, 'sideways_tp_mult': 2.4451063746720045, 'sideways_tsl_mult': 0.46795327633448697, 'sideways_time_stop': 26, 'sideways_use_sma': True, 'sideways_use_ema': False, 'sideways_use_atr': False, 'sideways_use_adx': True, 'sideways_use_spike': False, 'sideways_rsi_required': False}.
[I 2025-09-01 09:41:10,534] Trial 214 finished with values: [-0.045737283986723165, 0.04553284088627443] and parameters: {'p_sma': 51, 'p_std': 48, 'p_atr': 18, 'p_adx': 18, 'rsi_period': 45, 'ema1': 20, 'ema2': 20, 'slip_atr_k': 0.06808992948802087, 'slip_spread_k': 0.5105278535095551, 'spread_hl_frac': 0.029436340319131008, 'bb_std_mult': 3.555403389287676, 'rsi_os': 38, 'rsi_ob': 68, 'vol_spike': 0.023984790704479106, 'adx_thresh': 32.58888962973872, 'atr_min_pct': 0.024920939771763972, 'atr_max_pct': 0.0711706740515532, 'tp_mult': 1.0584648288854586, 'tsl_mult': 0.195006231031631, 'strategy': 'breakout', 'time_stop': 300, 'use_sma': True, 'use_atr': False, 'use_adx': False, 'use_ema': True, 'use_spike': True, 'rsi_required': True, 'edge_k': 1.2385183677658478, 'edge_cap': 0.5588522094006794, 'bull_strategy': 'mean_reversion', 'bull_bb_std_mult': 1.8763875966909476, 'bull_rsi_os': 46, 'bull_rsi_ob': 47, 'bull_adx_thresh': 19.005776669680596, 'bull_atr_min_pct': 0.0013133557397793216, 'bull_atr_max_pct': 0.08885207951289169, 'bull_tp_mult': 2.280486990234029, 'bull_tsl_mult': 0.4022593887328789, 'bull_time_stop': 256, 'bull_use_sma': True, 'bull_use_ema': False, 'bull_use_atr': True, 'bull_use_adx': False, 'bull_use_spike': False, 'bull_rsi_required': True, 'bear_strategy': 'mean_reversion', 'bear_bb_std_mult': 1.9941513757236091, 'bear_rsi_os': 19, 'bear_rsi_ob': 57, 'bear_adx_thresh': 8.99733325939934, 'bear_atr_min_pct': 0.015247512757798115, 'bear_atr_max_pct': 0.0575017400627361, 'bear_tp_mult': 1.2222497773442589, 'bear_tsl_mult': 0.6099730271370158, 'bear_time_stop': 292, 'bear_use_sma': True, 'bear_use_ema': False, 'bear_use_atr': True, 'bear_use_adx': False, 'bear_use_spike': False, 'bear_rsi_required': False, 'sideways_strategy': 'mean_reversion', 'sideways_bb_std_mult': 2.3209812554327187, 'sideways_rsi_os': 33, 'sideways_rsi_ob': 48, 'sideways_adx_thresh': 8.021070649471797, 'sideways_atr_min_pct': 0.02216278102381034, 'sideways_atr_max_pct': 0.07167554101030717, 'sideways_tp_mult': 1.5353020198413045, 'sideways_tsl_mult': 0.43911849866884484, 'sideways_time_stop': 21, 'sideways_use_sma': True, 'sideways_use_ema': False, 'sideways_use_atr': False, 'sideways_use_adx': True, 'sideways_use_spike': False, 'sideways_rsi_required': False}.
[I 2025-09-01 09:41:50,882] Trial 221 finished with values: [-0.033522676064512646, 0.03332330487987301] and parameters: {'p_sma': 14, 'p_std': 36, 'p_atr': 19, 'p_adx': 25, 'rsi_period': 26, 'ema1': 17, 'ema2': 16, 'slip_atr_k': 0.06486383355813986, 'slip_spread_k': 0.705114515066252, 'spread_hl_frac': 0.016370829940706225, 'bb_std_mult': 1.5425049623016813, 'rsi_os': 44, 'rsi_ob': 72, 'vol_spike': 0.13872544047821647, 'adx_thresh': 34.52684226922483, 'atr_min_pct': 0.006971593151971607, 'atr_max_pct': 0.1369299545827932, 'tp_mult': 1.1764420845498018, 'tsl_mult': 0.6745754298518882, 'strategy': 'breakout', 'time_stop': 242, 'use_sma': True, 'use_atr': True, 'use_adx': False, 'use_ema': True, 'use_spike': True, 'rsi_required': True, 'edge_k': 1.207013798929936, 'edge_cap': 0.46898043540646994, 'bull_strategy': 'mean_reversion', 'bull_bb_std_mult': 3.5903480289807614, 'bull_rsi_os': 43, 'bull_rsi_ob': 45, 'bull_adx_thresh': 6.252899148612879, 'bull_atr_min_pct': 0.0005875306000501958, 'bull_atr_max_pct': 0.08566735101597928, 'bull_tp_mult': 2.837788146187096, 'bull_tsl_mult': 0.41375871491016913, 'bull_time_stop': 202, 'bull_use_sma': True, 'bull_use_ema': False, 'bull_use_atr': True, 'bull_use_adx': True, 'bull_use_spike': False, 'bull_rsi_required': True, 'bear_strategy': 'mean_reversion', 'bear_bb_std_mult': 1.1080846111854485, 'bear_rsi_os': 36, 'bear_rsi_ob': 73, 'bear_adx_thresh': 22.33110475163417, 'bear_atr_min_pct': 0.004304894447154487, 'bear_atr_max_pct': 0.05689441980115182, 'bear_tp_mult': 1.2151445325714063, 'bear_tsl_mult': 0.6056138042024526, 'bear_time_stop': 293, 'bear_use_sma': False, 'bear_use_ema': False, 'bear_use_atr': False, 'bear_use_adx': True, 'bear_use_spike': False, 'bear_rsi_required': False, 'sideways_strategy': 'breakout', 'sideways_bb_std_mult': 0.6020230270547033, 'sideways_rsi_os': 51, 'sideways_rsi_ob': 93, 'sideways_adx_thresh': 22.55482641410138, 'sideways_atr_min_pct': 0.013039123372510395, 'sideways_atr_max_pct': 0.065037248295379, 'sideways_tp_mult': 2.451070494534637, 'sideways_tsl_mult': 0.5203127406177589, 'sideways_time_stop': 30, 'sideways_use_sma': True, 'sideways_use_ema': False, 'sideways_use_atr': False, 'sideways_use_adx': True, 'sideways_use_spike': False, 'sideways_rsi_required': True}.
[I 2025-09-01 09:41:51,141] Trial 222 finished with values: [-0.0619658732329208, 0.06176628998420403] and parameters: {'p_sma': 15, 'p_std': 22, 'p_atr': 19, 'p_adx': 28, 'rsi_period': 25, 'ema1': 17, 'ema2': 16, 'slip_atr_k': 0.06185816502910855, 'slip_spread_k': 0.7079296980957076, 'spread_hl_frac': 0.027189900111920583, 'bb_std_mult': 1.68167214645064, 'rsi_os': 43, 'rsi_ob': 74, 'vol_spike': 0.14007837589790229, 'adx_thresh': 33.82706593129576, 'atr_min_pct': 0.006992382863260581, 'atr_max_pct': 0.10294465968605865, 'tp_mult': 1.1838711904235417, 'tsl_mult': 0.6812171627700397, 'strategy': 'breakout', 'time_stop': 238, 'use_sma': True, 'use_atr': True, 'use_adx': False, 'use_ema': False, 'use_spike': True, 'rsi_required': True, 'edge_k': 1.9416155757439848, 'edge_cap': 0.6890419170681397, 'bull_strategy': 'mean_reversion', 'bull_bb_std_mult': 3.5958830100866135, 'bull_rsi_os': 45, 'bull_rsi_ob': 45, 'bull_adx_thresh': 6.190537958509227, 'bull_atr_min_pct': 0.00047309926369447266, 'bull_atr_max_pct': 0.07153026012626586, 'bull_tp_mult': 2.961549201414752, 'bull_tsl_mult': 0.44089618074774495, 'bull_time_stop': 209, 'bull_use_sma': True, 'bull_use_ema': False, 'bull_use_atr': True, 'bull_use_adx': True, 'bull_use_spike': False, 'bull_rsi_required': True, 'bear_strategy': 'breakout', 'bear_bb_std_mult': 1.1429888885056831, 'bear_rsi_os': 54, 'bear_rsi_ob': 73, 'bear_adx_thresh': 22.72395392087354, 'bear_atr_min_pct': 0.005614518465684373, 'bear_atr_max_pct': 0.0501627195042043, 'bear_tp_mult': 1.2007916996247012, 'bear_tsl_mult': 0.4772489027183501, 'bear_time_stop': 297, 'bear_use_sma': False, 'bear_use_ema': False, 'bear_use_atr': False, 'bear_use_adx': True, 'bear_use_spike': True, 'bear_rsi_required': False, 'sideways_strategy': 'breakout', 'sideways_bb_std_mult': 0.5960573845296397, 'sideways_rsi_os': 52, 'sideways_rsi_ob': 94, 'sideways_adx_thresh': 22.478212544053875, 'sideways_atr_min_pct': 0.009748422477434335, 'sideways_atr_max_pct': 0.06528591321489816, 'sideways_tp_mult': 2.550567726340695, 'sideways_tsl_mult': 0.5146168304915236, 'sideways_time_stop': 33, 'sideways_use_sma': True, 'sideways_use_ema': False, 'sideways_use_atr': False, 'sideways_use_adx': True, 'sideways_use_spike': False, 'sideways_rsi_required': True}.
[I 2025-09-01 09:41:51,359] Trial 219 finished with values: [-1000000000.0, 1000000000.0] and parameters: {'p_sma': 19, 'p_std': 60, 'p_atr': 7, 'p_adx': 28, 'rsi_period': 21, 'ema1': 21, 'ema2': 15, 'slip_atr_k': 0.056066031139390286, 'slip_spread_k': 0.12839262528020357, 'spread_hl_frac': 0.024571605220023055, 'bb_std_mult': 2.8342330037447567, 'rsi_os': 39, 'rsi_ob': 45, 'vol_spike': 0.004899313709835498, 'adx_thresh': 32.394416646305764, 'atr_min_pct': 0.02727358310386387, 'atr_max_pct': 0.06984181749852522, 'tp_mult': 1.9939107919746402, 'tsl_mult': 0.682102596220832, 'strategy': 'breakout', 'time_stop': 239, 'use_sma': True, 'use_atr': True, 'use_adx': False, 'use_ema': True, 'use_spike': True, 'rsi_required': True, 'edge_k': 1.9244218791797, 'edge_cap': 0.8669081192709855, 'bull_strategy': 'breakout', 'bull_bb_std_mult': 3.5004127888869676, 'bull_rsi_os': 45, 'bull_rsi_ob': 93, 'bull_adx_thresh': 5.987565535295618, 'bull_atr_min_pct': 0.0020891503716049965, 'bull_atr_max_pct': 0.07088107391476015, 'bull_tp_mult': 1.5360014699320803, 'bull_tsl_mult': 0.9484674939555229, 'bull_time_stop': 254, 'bull_use_sma': True, 'bull_use_ema': False, 'bull_use_atr': True, 'bull_use_adx': True, 'bull_use_spike': False, 'bull_rsi_required': True, 'bear_strategy': 'mean_reversion', 'bear_bb_std_mult': 1.9077594257167956, 'bear_rsi_os': 25, 'bear_rsi_ob': 85, 'bear_adx_thresh': 12.704901162749703, 'bear_atr_min_pct': 0.026583652023709027, 'bear_atr_max_pct': 0.05801134800705332, 'bear_tp_mult': 2.2643220950724885, 'bear_tsl_mult': 0.5989244316220738, 'bear_time_stop': 283, 'bear_use_sma': False, 'bear_use_ema': True, 'bear_use_atr': False, 'bear_use_adx': True, 'bear_use_spike': True, 'bear_rsi_required': False, 'sideways_strategy': 'breakout', 'sideways_bb_std_mult': 2.3865214958125383, 'sideways_rsi_os': 17, 'sideways_rsi_ob': 88, 'sideways_adx_thresh': 5.962036553332732, 'sideways_atr_min_pct': 0.021984495307788936, 'sideways_atr_max_pct': 0.07053782949215881, 'sideways_tp_mult': 2.4402480726120857, 'sideways_tsl_mult': 0.41767662976049097, 'sideways_time_stop': 32, 'sideways_use_sma': True, 'sideways_use_ema': False, 'sideways_use_atr': False, 'sideways_use_adx': True, 'sideways_use_spike': False, 'sideways_rsi_required': True}.
[I 2025-09-01 09:41:51,601] Trial 220 finished with values: [-1000000000.0, 1000000000.0] and parameters: {'p_sma': 19, 'p_std': 60, 'p_atr': 17, 'p_adx': 28, 'rsi_period': 26, 'ema1': 18, 'ema2': 16, 'slip_atr_k': 0.052727939078025754, 'slip_spread_k': 0.29413793278988815, 'spread_hl_frac': 0.024542173864300958, 'bb_std_mult': 1.5014337608647845, 'rsi_os': 39, 'rsi_ob': 72, 'vol_spike': 0.14411775379199476, 'adx_thresh': 32.44878592808051, 'atr_min_pct': 0.0016632099288270401, 'atr_max_pct': 0.07358050736234563, 'tp_mult': 1.0886556862681933, 'tsl_mult': 0.3930911766525639, 'strategy': 'breakout', 'time_stop': 249, 'use_sma': True, 'use_atr': True, 'use_adx': False, 'use_ema': True, 'use_spike': True, 'rsi_required': True, 'edge_k': 1.3251206261735364, 'edge_cap': 0.8310898990533887, 'bull_strategy': 'breakout', 'bull_bb_std_mult': 2.347064412577124, 'bull_rsi_os': 45, 'bull_rsi_ob': 51, 'bull_adx_thresh': 6.104417506099799, 'bull_atr_min_pct': 0.0021164089494931, 'bull_atr_max_pct': 0.08624018852425969, 'bull_tp_mult': 2.0848720708257757, 'bull_tsl_mult': 0.5205405535528215, 'bull_time_stop': 255, 'bull_use_sma': True, 'bull_use_ema': False, 'bull_use_atr': True, 'bull_use_adx': True, 'bull_use_spike': False, 'bull_rsi_required': True, 'bear_strategy': 'mean_reversion', 'bear_bb_std_mult': 1.9928653848161635, 'bear_rsi_os': 55, 'bear_rsi_ob': 86, 'bear_adx_thresh': 15.14547314455617, 'bear_atr_min_pct': 0.02654098574511231, 'bear_atr_max_pct': 0.10114793126866087, 'bear_tp_mult': 1.6979151870933085, 'bear_tsl_mult': 0.1922431137785776, 'bear_time_stop': 284, 'bear_use_sma': False, 'bear_use_ema': True, 'bear_use_atr': False, 'bear_use_adx': True, 'bear_use_spike': True, 'bear_rsi_required': False, 'sideways_strategy': 'breakout', 'sideways_bb_std_mult': 0.8652939702649496, 'sideways_rsi_os': 52, 'sideways_rsi_ob': 48, 'sideways_adx_thresh': 30.74998843550625, 'sideways_atr_min_pct': 0.02208707469645924, 'sideways_atr_max_pct': 0.0269411598979188, 'sideways_tp_mult': 2.580081889198076, 'sideways_tsl_mult': 0.4050632664923445, 'sideways_time_stop': 26, 'sideways_use_sma': True, 'sideways_use_ema': False, 'sideways_use_atr': False, 'sideways_use_adx': True, 'sideways_use_spike': False, 'sideways_rsi_required': True}.
[I 2025-09-01 09:42:29,230] Trial 224 finished with values: [-1000000000.0, 1000000000.0] and parameters: {'p_sma': 30, 'p_std': 56, 'p_atr': 20, 'p_adx': 26, 'rsi_period': 27, 'ema1': 18, 'ema2': 17, 'slip_atr_k': 0.05252064047865498, 'slip_spread_k': 0.30509089751937823, 'spread_hl_frac': 0.030308779516568494, 'bb_std_mult': 1.5196387147854618, 'rsi_os': 42, 'rsi_ob': 67, 'vol_spike': 0.08557214714828576, 'adx_thresh': 34.153463003395586, 'atr_min_pct': 0.011095150575562159, 'atr_max_pct': 0.1496384985958445, 'tp_mult': 1.2382801019967549, 'tsl_mult': 0.647824373688004, 'strategy': 'mean_reversion', 'time_stop': 253, 'use_sma': False, 'use_atr': False, 'use_adx': True, 'use_ema': False, 'use_spike': False, 'rsi_required': False, 'edge_k': 0.7536804587912573, 'edge_cap': 0.4343549139286032, 'bull_strategy': 'mean_reversion', 'bull_bb_std_mult': 3.5902781938105077, 'bull_rsi_os': 43, 'bull_rsi_ob': 46, 'bull_adx_thresh': 29.09887571692386, 'bull_atr_min_pct': 9.886659699750089e-06, 'bull_atr_max_pct': 0.08376936542453217, 'bull_tp_mult': 2.5796325439765035, 'bull_tsl_mult': 0.35133933884175883, 'bull_time_stop': 192, 'bull_use_sma': False, 'bull_use_ema': True, 'bull_use_atr': False, 'bull_use_adx': False, 'bull_use_spike': True, 'bull_rsi_required': False, 'bear_strategy': 'mean_reversion', 'bear_bb_std_mult': 0.7851816517646912, 'bear_rsi_os': 55, 'bear_rsi_ob': 76, 'bear_adx_thresh': 24.09717622596996, 'bear_atr_min_pct': 0.007224541851032103, 'bear_atr_max_pct': 0.05252605581428578, 'bear_tp_mult': 1.1622423450072477, 'bear_tsl_mult': 0.5343760111918207, 'bear_time_stop': 300, 'bear_use_sma': True, 'bear_use_ema': False, 'bear_use_atr': True, 'bear_use_adx': False, 'bear_use_spike': False, 'bear_rsi_required': True, 'sideways_strategy': 'mean_reversion', 'sideways_bb_std_mult': 0.7415429800513506, 'sideways_rsi_os': 53, 'sideways_rsi_ob': 92, 'sideways_adx_thresh': 21.767731253111553, 'sideways_atr_min_pct': 0.006341475898937268, 'sideways_atr_max_pct': 0.06762869453348018, 'sideways_tp_mult': 2.5901088827860943, 'sideways_tsl_mult': 0.5518899152355602, 'sideways_time_stop': 28, 'sideways_use_sma': False, 'sideways_use_ema': True, 'sideways_use_atr': True, 'sideways_use_adx': False, 'sideways_use_spike': False, 'sideways_rsi_required': False}.
[I 2025-09-01 09:42:29,267] Trial 226 finished with values: [-1000000000.0, 1000000000.0] and parameters: {'p_sma': 31, 'p_std': 50, 'p_atr': 20, 'p_adx': 24, 'rsi_period': 36, 'ema1': 17, 'ema2': 18, 'slip_atr_k': 0.23330662072870073, 'slip_spread_k': 0.6793492284579702, 'spread_hl_frac': 0.028513347385803564, 'bb_std_mult': 1.6829048933265454, 'rsi_os': 45, 'rsi_ob': 67, 'vol_spike': 0.1129305649930091, 'adx_thresh': 15.843965366296176, 'atr_min_pct': 0.011091300286200848, 'atr_max_pct': 0.12472081068050525, 'tp_mult': 1.2335798869304302, 'tsl_mult': 0.6334560936952615, 'strategy': 'mean_reversion', 'time_stop': 252, 'use_sma': False, 'use_atr': False, 'use_adx': True, 'use_ema': False, 'use_spike': False, 'rsi_required': False, 'edge_k': 0.9376856895455853, 'edge_cap': 0.44185267551995383, 'bull_strategy': 'mean_reversion', 'bull_bb_std_mult': 2.572554596747552, 'bull_rsi_os': 44, 'bull_rsi_ob': 46, 'bull_adx_thresh': 6.994713469737877, 'bull_atr_min_pct': 0.0010244715558864186, 'bull_atr_max_pct': 0.08338640022258283, 'bull_tp_mult': 2.4387940214616135, 'bull_tsl_mult': 0.36664557717203416, 'bull_time_stop': 192, 'bull_use_sma': False, 'bull_use_ema': True, 'bull_use_atr': False, 'bull_use_adx': False, 'bull_use_spike': True, 'bull_rsi_required': False, 'bear_strategy': 'breakout', 'bear_bb_std_mult': 1.4981752377096451, 'bear_rsi_os': 54, 'bear_rsi_ob': 76, 'bear_adx_thresh': 24.03380754569769, 'bear_atr_min_pct': 0.007452235012245975, 'bear_atr_max_pct': 0.0527238811296792, 'bear_tp_mult': 1.2876481768211643, 'bear_tsl_mult': 0.5414472947300071, 'bear_time_stop': 171, 'bear_use_sma': True, 'bear_use_ema': False, 'bear_use_atr': True, 'bear_use_adx': False, 'bear_use_spike': False, 'bear_rsi_required': True, 'sideways_strategy': 'mean_reversion', 'sideways_bb_std_mult': 0.7263835494585945, 'sideways_rsi_os': 27, 'sideways_rsi_ob': 93, 'sideways_adx_thresh': 21.435747487606257, 'sideways_atr_min_pct': 0.011802399513188871, 'sideways_atr_max_pct': 0.06859432094206654, 'sideways_tp_mult': 2.399010151668693, 'sideways_tsl_mult': 0.4860028313041983, 'sideways_time_stop': 256, 'sideways_use_sma': False, 'sideways_use_ema': True, 'sideways_use_atr': True, 'sideways_use_adx': False, 'sideways_use_spike': True, 'sideways_rsi_required': False}.
