[I 2025-09-01 10:25:52,375] Trial 486 finished with values: [-1000000000.0, 1000000000.0] and parameters: {'p_sma': 17, 'p_std': 51, 'p_atr': 14, 'p_adx': 23, 'rsi_period': 35, 'ema1': 8, 'ema2': 11, 'slip_atr_k': 0.004895041239223339, 'slip_spread_k': 0.7973729081642221, 'spread_hl_frac': 0.016476907279449775, 'bb_std_mult': 1.0368877570976254, 'rsi_os': 16, 'rsi_ob': 58, 'vol_spike': 0.07379968140809487, 'adx_thresh': 26.03311885462157, 'atr_min_pct': 0.017463598218367564, 'atr_max_pct': 0.02322300717957103, 'tp_mult': 1.3778530696477478, 'tsl_mult': 0.06428585170479212, 'strategy': 'mean_reversion', 'time_stop': 153, 'use_sma': False, 'use_atr': False, 'use_adx': True, 'use_ema': False, 'use_spike': False, 'rsi_required': False, 'edge_k': 1.5159612361896404, 'edge_cap': 0.29923121078365006, 'bull_strategy': 'mean_reversion', 'bull_bb_std_mult': 0.6631643169946435, 'bull_rsi_os': 18, 'bull_rsi_ob': 74, 'bull_adx_thresh': 15.786822381669573, 'bull_atr_min_pct': 7.680275302730227e-05, 'bull_atr_max_pct': 0.019680584605432087, 'bull_tp_mult': 1.2822958638838333, 'bull_tsl_mult': 0.7058769981598129, 'bull_time_stop': 272, 'bull_use_sma': True, 'bull_use_ema': True, 'bull_use_atr': False, 'bull_use_adx': False, 'bull_use_spike': False, 'bull_rsi_required': False, 'bear_strategy': 'breakout', 'bear_bb_std_mult': 1.4334324869969308, 'bear_rsi_os': 16, 'bear_rsi_ob': 85, 'bear_adx_thresh': 27.44952932433004, 'bear_atr_min_pct': 0.0015834236019700255, 'bear_atr_max_pct': 0.14906946842188912, 'bear_tp_mult': 1.4785173676263597, 'bear_tsl_mult': 0.37374722923580495, 'bear_time_stop': 255, 'bear_use_sma': True, 'bear_use_ema': False, 'bear_use_atr': True, 'bear_use_adx': True, 'bear_use_spike': True, 'bear_rsi_required': False, 'sideways_strategy': 'breakout', 'sideways_bb_std_mult': 0.5337038339511352, 'sideways_rsi_os': 55, 'sideways_rsi_ob': 95, 'sideways_adx_thresh': 26.418808713774155, 'sideways_atr_min_pct': 0.006024982403781662, 'sideways_atr_max_pct': 0.049823711664019145, 'sideways_tp_mult': 2.086084219788657, 'sideways_tsl_mult': 0.3272819309962537, 'sideways_time_stop': 261, 'sideways_use_sma': False, 'sideways_use_ema': False, 'sideways_use_atr': False, 'sideways_use_adx': False, 'sideways_use_spike': False, 'sideways_rsi_required': True}.
[I 2025-09-01 10:25:52,510] Trial 485 finished with values: [-1000000000.0, 1000000000.0] and parameters: {'p_sma': 17, 'p_std': 51, 'p_atr': 15, 'p_adx': 23, 'rsi_period': 34, 'ema1': 18, 'ema2': 12, 'slip_atr_k': 0.005340159576046925, 'slip_spread_k': 0.7881757916015049, 'spread_hl_frac': 0.01687757343935118, 'bb_std_mult': 1.0493884732597982, 'rsi_os': 16, 'rsi_ob': 58, 'vol_spike': 0.07977542281700538, 'adx_thresh': 25.933323860039668, 'atr_min_pct': 0.014919090268009447, 'atr_max_pct': 0.02272281849381451, 'tp_mult': 1.3776963505529238, 'tsl_mult': 0.0571538709746617, 'strategy': 'mean_reversion', 'time_stop': 154, 'use_sma': False, 'use_atr': False, 'use_adx': True, 'use_ema': False, 'use_spike': False, 'rsi_required': False, 'edge_k': 1.4759651331966275, 'edge_cap': 0.292322422166193, 'bull_strategy': 'mean_reversion', 'bull_bb_std_mult': 0.6592611773541451, 'bull_rsi_os': 16, 'bull_rsi_ob': 74, 'bull_adx_thresh': 11.845074863487747, 'bull_atr_min_pct': 2.2375308527982407e-05, 'bull_atr_max_pct': 0.02134515798263606, 'bull_tp_mult': 1.2933292296720071, 'bull_tsl_mult': 0.5306552771785223, 'bull_time_stop': 276, 'bull_use_sma': True, 'bull_use_ema': True, 'bull_use_atr': False, 'bull_use_adx': False, 'bull_use_spike': False, 'bull_rsi_required': False, 'bear_strategy': 'breakout', 'bear_bb_std_mult': 1.2314972234760488, 'bear_rsi_os': 16, 'bear_rsi_ob': 87, 'bear_adx_thresh': 27.525371341298623, 'bear_atr_min_pct': 0.0015172545590571365, 'bear_atr_max_pct': 0.14931851661095566, 'bear_tp_mult': 1.380365227721852, 'bear_tsl_mult': 0.4013234391325553, 'bear_time_stop': 256, 'bear_use_sma': True, 'bear_use_ema': False, 'bear_use_atr': True, 'bear_use_adx': True, 'bear_use_spike': True, 'bear_rsi_required': False, 'sideways_strategy': 'breakout', 'sideways_bb_std_mult': 0.504751859772448, 'sideways_rsi_os': 55, 'sideways_rsi_ob': 95, 'sideways_adx_thresh': 26.381196449177196, 'sideways_atr_min_pct': 0.00596263346887973, 'sideways_atr_max_pct': 0.051901567084645286, 'sideways_tp_mult': 2.0975880671045055, 'sideways_tsl_mult': 0.33239922069567995, 'sideways_time_stop': 260, 'sideways_use_sma': False, 'sideways_use_ema': False, 'sideways_use_atr': False, 'sideways_use_adx': False, 'sideways_use_spike': False, 'sideways_rsi_required': True}.
[I 2025-09-01 10:26:37,721] Trial 490 finished with values: [-1000000000.0, 1000000000.0] and parameters: {'p_sma': 13, 'p_std': 49, 'p_atr': 14, 'p_adx': 23, 'rsi_period': 37, 'ema1': 8, 'ema2': 12, 'slip_atr_k': 0.000940514003474448, 'slip_spread_k': 0.8155206926733197, 'spread_hl_frac': 0.019445778088270665, 'bb_std_mult': 1.1417960705482935, 'rsi_os': 18, 'rsi_ob': 57, 'vol_spike': 0.07928171778151528, 'adx_thresh': 25.19671829458956, 'atr_min_pct': 0.014272838564693805, 'atr_max_pct': 0.02600047812475413, 'tp_mult': 1.4507821420188776, 'tsl_mult': 0.028230693739688395, 'strategy': 'breakout', 'time_stop': 159, 'use_sma': True, 'use_atr': False, 'use_adx': False, 'use_ema': False, 'use_spike': False, 'rsi_required': True, 'edge_k': 1.513483530320753, 'edge_cap': 0.27370449586660406, 'bull_strategy': 'mean_reversion', 'bull_bb_std_mult': 0.5976161848349761, 'bull_rsi_os': 19, 'bull_rsi_ob': 73, 'bull_adx_thresh': 16.437142002230367, 'bull_atr_min_pct': 0.0004631891540617887, 'bull_atr_max_pct': 0.0160193601323312, 'bull_tp_mult': 1.2575873487400977, 'bull_tsl_mult': 0.7605434134667525, 'bull_time_stop': 264, 'bull_use_sma': False, 'bull_use_ema': False, 'bull_use_atr': False, 'bull_use_adx': False, 'bull_use_spike': False, 'bull_rsi_required': True, 'bear_strategy': 'breakout', 'bear_bb_std_mult': 1.3980660850971787, 'bear_rsi_os': 15, 'bear_rsi_ob': 90, 'bear_adx_thresh': 28.472847863356627, 'bear_atr_min_pct': 0.002423360241522088, 'bear_atr_max_pct': 0.14656481388731243, 'bear_tp_mult': 1.4523010446609852, 'bear_tsl_mult': 0.39492064127736565, 'bear_time_stop': 267, 'bear_use_sma': True, 'bear_use_ema': False, 'bear_use_atr': True, 'bear_use_adx': True, 'bear_use_spike': True, 'bear_rsi_required': True, 'sideways_strategy': 'breakout', 'sideways_bb_std_mult': 0.5010283825624885, 'sideways_rsi_os': 55, 'sideways_rsi_ob': 95, 'sideways_adx_thresh': 26.388930230748066, 'sideways_atr_min_pct': 0.0052450416811246035, 'sideways_atr_max_pct': 0.051701219796574396, 'sideways_tp_mult': 2.1357807951498655, 'sideways_tsl_mult': 0.3443091858537187, 'sideways_time_stop': 270, 'sideways_use_sma': False, 'sideways_use_ema': True, 'sideways_use_atr': True, 'sideways_use_adx': False, 'sideways_use_spike': True, 'sideways_rsi_required': True}.
[I 2025-09-01 10:26:38,401] Trial 491 finished with values: [-1000000000.0, 1000000000.0] and parameters: {'p_sma': 13, 'p_std': 50, 'p_atr': 14, 'p_adx': 23, 'rsi_period': 36, 'ema1': 6, 'ema2': 12, 'slip_atr_k': 0.0003894291148134449, 'slip_spread_k': 0.7908866650812932, 'spread_hl_frac': 0.018669270739201535, 'bb_std_mult': 1.1621010851464044, 'rsi_os': 18, 'rsi_ob': 57, 'vol_spike': 0.06987686557059745, 'adx_thresh': 25.253891176489702, 'atr_min_pct': 0.014264607259768745, 'atr_max_pct': 0.025956679033913143, 'tp_mult': 1.4352782652181817, 'tsl_mult': 0.027526754170456406, 'strategy': 'breakout', 'time_stop': 160, 'use_sma': True, 'use_atr': False, 'use_adx': False, 'use_ema': False, 'use_spike': False, 'rsi_required': True, 'edge_k': 1.4928022519608968, 'edge_cap': 0.2627301714614543, 'bull_strategy': 'mean_reversion', 'bull_bb_std_mult': 0.7577679316432212, 'bull_rsi_os': 19, 'bull_rsi_ob': 75, 'bull_adx_thresh': 14.648168425450645, 'bull_atr_min_pct': 5.5437360738419453e-05, 'bull_atr_max_pct': 0.018238655667075353, 'bull_tp_mult': 1.2662658562938927, 'bull_tsl_mult': 0.5579215975155463, 'bull_time_stop': 269, 'bull_use_sma': False, 'bull_use_ema': False, 'bull_use_atr': False, 'bull_use_adx': False, 'bull_use_spike': True, 'bull_rsi_required': True, 'bear_strategy': 'breakout', 'bear_bb_std_mult': 1.40230795628042, 'bear_rsi_os': 14, 'bear_rsi_ob': 84, 'bear_adx_thresh': 28.353873398142408, 'bear_atr_min_pct': 0.0021757309945639215, 'bear_atr_max_pct': 0.1460326387066422, 'bear_tp_mult': 1.425831527077599, 'bear_tsl_mult': 0.37730748557928107, 'bear_time_stop': 242, 'bear_use_sma': False, 'bear_use_ema': False, 'bear_use_atr': False, 'bear_use_adx': True, 'bear_use_spike': True, 'bear_rsi_required': True, 'sideways_strategy': 'breakout', 'sideways_bb_std_mult': 0.5029436653841137, 'sideways_rsi_os': 55, 'sideways_rsi_ob': 95, 'sideways_adx_thresh': 25.80528000331334, 'sideways_atr_min_pct': 0.0054041682777362324, 'sideways_atr_max_pct': 0.05404225785186843, 'sideways_tp_mult': 2.1398458445000657, 'sideways_tsl_mult': 0.3542538491058016, 'sideways_time_stop': 271, 'sideways_use_sma': False, 'sideways_use_ema': True, 'sideways_use_atr': True, 'sideways_use_adx': False, 'sideways_use_spike': True, 'sideways_rsi_required': True}.
[I 2025-09-01 10:26:38,962] Trial 488 finished with values: [-0.019459887796601794, 0.01933857256911874] and parameters: {'p_sma': 17, 'p_std': 50, 'p_atr': 14, 'p_adx': 23, 'rsi_period': 36, 'ema1': 8, 'ema2': 11, 'slip_atr_k': 0.006041569008052166, 'slip_spread_k': 0.7836621340978507, 'spread_hl_frac': 0.019296714264111642, 'bb_std_mult': 1.1129593698492972, 'rsi_os': 16, 'rsi_ob': 57, 'vol_spike': 0.07365531282129274, 'adx_thresh': 25.278156634828967, 'atr_min_pct': 0.014512870781521477, 'atr_max_pct': 0.022967004953616896, 'tp_mult': 1.4232758727704158, 'tsl_mult': 0.05263023739057243, 'strategy': 'breakout', 'time_stop': 152, 'use_sma': True, 'use_atr': False, 'use_adx': True, 'use_ema': False, 'use_spike': False, 'rsi_required': True, 'edge_k': 1.5132324089068143, 'edge_cap': 0.3026371988336873, 'bull_strategy': 'mean_reversion', 'bull_bb_std_mult': 0.5941539205561093, 'bull_rsi_os': 19, 'bull_rsi_ob': 75, 'bull_adx_thresh': 14.567592268512255, 'bull_atr_min_pct': 4.6610840419453243e-05, 'bull_atr_max_pct': 0.019913318835643002, 'bull_tp_mult': 1.2753595908884072, 'bull_tsl_mult': 0.7644175908182373, 'bull_time_stop': 265, 'bull_use_sma': True, 'bull_use_ema': False, 'bull_use_atr': False, 'bull_use_adx': False, 'bull_use_spike': False, 'bull_rsi_required': True, 'bear_strategy': 'breakout', 'bear_bb_std_mult': 1.431075848741155, 'bear_rsi_os': 16, 'bear_rsi_ob': 87, 'bear_adx_thresh': 26.6336429795956, 'bear_atr_min_pct': 0.0017137287637320271, 'bear_atr_max_pct': 0.14836391435238194, 'bear_tp_mult': 1.462768827848626, 'bear_tsl_mult': 0.38504894802013867, 'bear_time_stop': 262, 'bear_use_sma': True, 'bear_use_ema': False, 'bear_use_atr': True, 'bear_use_adx': True, 'bear_use_spike': True, 'bear_rsi_required': False, 'sideways_strategy': 'breakout', 'sideways_bb_std_mult': 0.5355567534132715, 'sideways_rsi_os': 55, 'sideways_rsi_ob': 95, 'sideways_adx_thresh': 26.390616374195993, 'sideways_atr_min_pct': 0.005473933715974703, 'sideways_atr_max_pct': 0.05286323014288363, 'sideways_tp_mult': 2.0777152360070072, 'sideways_tsl_mult': 0.3332914387511094, 'sideways_time_stop': 263, 'sideways_use_sma': False, 'sideways_use_ema': True, 'sideways_use_atr': True, 'sideways_use_adx': False, 'sideways_use_spike': False, 'sideways_rsi_required': True}.
[I 2025-09-01 10:26:39,450] Trial 489 finished with values: [-0.019498677629994243, 0.019377113624846544] and parameters: {'p_sma': 17, 'p_std': 49, 'p_atr': 14, 'p_adx': 23, 'rsi_period': 37, 'ema1': 8, 'ema2': 10, 'slip_atr_k': 0.007232472061898963, 'slip_spread_k': 0.7880944989113979, 'spread_hl_frac': 0.019513382542615802, 'bb_std_mult': 1.1378083974929076, 'rsi_os': 18, 'rsi_ob': 57, 'vol_spike': 0.07440625561116615, 'adx_thresh': 25.275374909208328, 'atr_min_pct': 0.014222291904579631, 'atr_max_pct': 0.025975526153168338, 'tp_mult': 1.4378699439118352, 'tsl_mult': 0.024902602732041264, 'strategy': 'breakout', 'time_stop': 158, 'use_sma': True, 'use_atr': False, 'use_adx': False, 'use_ema': False, 'use_spike': False, 'rsi_required': True, 'edge_k': 1.519175688776809, 'edge_cap': 0.263059819010502, 'bull_strategy': 'mean_reversion', 'bull_bb_std_mult': 0.6103130876714653, 'bull_rsi_os': 19, 'bull_rsi_ob': 73, 'bull_adx_thresh': 14.711524756996173, 'bull_atr_min_pct': 1.9449744361633986e-05, 'bull_atr_max_pct': 0.01898260568999961, 'bull_tp_mult': 1.2552991050082387, 'bull_tsl_mult': 0.6032477170843081, 'bull_time_stop': 265, 'bull_use_sma': True, 'bull_use_ema': False, 'bull_use_atr': False, 'bull_use_adx': False, 'bull_use_spike': False, 'bull_rsi_required': True, 'bear_strategy': 'breakout', 'bear_bb_std_mult': 1.421180137274915, 'bear_rsi_os': 15, 'bear_rsi_ob': 90, 'bear_adx_thresh': 28.20917635384813, 'bear_atr_min_pct': 0.0024809603433462012, 'bear_atr_max_pct': 0.14755591480949057, 'bear_tp_mult': 1.4849676185977183, 'bear_tsl_mult': 0.3803212455393157, 'bear_time_stop': 245, 'bear_use_sma': True, 'bear_use_ema': False, 'bear_use_atr': True, 'bear_use_adx': True, 'bear_use_spike': True, 'bear_rsi_required': False, 'sideways_strategy': 'breakout', 'sideways_bb_std_mult': 0.5102655197796548, 'sideways_rsi_os': 55, 'sideways_rsi_ob': 95, 'sideways_adx_thresh': 26.511253115561075, 'sideways_atr_min_pct': 0.005327084095143094, 'sideways_atr_max_pct': 0.05163040471140799, 'sideways_tp_mult': 2.135760658212628, 'sideways_tsl_mult': 0.3458866247811943, 'sideways_time_stop': 258, 'sideways_use_sma': False, 'sideways_use_ema': True, 'sideways_use_atr': True, 'sideways_use_adx': False, 'sideways_use_spike': True, 'sideways_rsi_required': True}.
[I 2025-09-01 10:27:24,852] Trial 493 finished with values: [-1000000000.0, 1000000000.0] and parameters: {'p_sma': 7, 'p_std': 49, 'p_atr': 14, 'p_adx': 22, 'rsi_period': 37, 'ema1': 7, 'ema2': 10, 'slip_atr_k': 0.008151279749095238, 'slip_spread_k': 0.7740437389631283, 'spread_hl_frac': 0.015272385920179399, 'bb_std_mult': 1.096000163705041, 'rsi_os': 15, 'rsi_ob': 59, 'vol_spike': 0.0742408917741022, 'adx_thresh': 24.870950670741564, 'atr_min_pct': 0.015484020540993395, 'atr_max_pct': 0.01867856937021408, 'tp_mult': 1.3397970188427135, 'tsl_mult': 0.08866320155257018, 'strategy': 'breakout', 'time_stop': 146, 'use_sma': True, 'use_atr': False, 'use_adx': False, 'use_ema': False, 'use_spike': False, 'rsi_required': True, 'edge_k': 1.5499860494661792, 'edge_cap': 0.3173100262721645, 'bull_strategy': 'mean_reversion', 'bull_bb_std_mult': 0.5508523682640024, 'bull_rsi_os': 18, 'bull_rsi_ob': 75, 'bull_adx_thresh': 13.197726846384995, 'bull_atr_min_pct': 0.00010147533984893739, 'bull_atr_max_pct': 0.023028022672246358, 'bull_tp_mult': 1.319422318943004, 'bull_tsl_mult': 0.5967233643047847, 'bull_time_stop': 263, 'bull_use_sma': True, 'bull_use_ema': False, 'bull_use_atr': False, 'bull_use_adx': False, 'bull_use_spike': False, 'bull_rsi_required': True, 'bear_strategy': 'breakout', 'bear_bb_std_mult': 1.535521133865977, 'bear_rsi_os': 17, 'bear_rsi_ob': 91, 'bear_adx_thresh': 26.87683938903048, 'bear_atr_min_pct': 0.0028731951739952976, 'bear_atr_max_pct': 0.14424384714664018, 'bear_tp_mult': 1.4409302495911114, 'bear_tsl_mult': 0.3572531611050243, 'bear_time_stop': 234, 'bear_use_sma': True, 'bear_use_ema': False, 'bear_use_atr': True, 'bear_use_adx': True, 'bear_use_spike': True, 'bear_rsi_required': False, 'sideways_strategy': 'breakout', 'sideways_bb_std_mult': 0.5773384616309383, 'sideways_rsi_os': 55, 'sideways_rsi_ob': 95, 'sideways_adx_thresh': 26.95800422862108, 'sideways_atr_min_pct': 0.006723166476858331, 'sideways_atr_max_pct': 0.05545134483188662, 'sideways_tp_mult': 2.0653866452927856, 'sideways_tsl_mult': 0.3136420109838679, 'sideways_time_stop': 255, 'sideways_use_sma': False, 'sideways_use_ema': False, 'sideways_use_atr': False, 'sideways_use_adx': False, 'sideways_use_spike': False, 'sideways_rsi_required': True}.
[I 2025-09-01 10:27:25,582] Trial 494 finished with values: [-0.01617830574761303, 0.016056533758524835] and parameters: {'p_sma': 16, 'p_std': 49, 'p_atr': 14, 'p_adx': 22, 'rsi_period': 37, 'ema1': 7, 'ema2': 10, 'slip_atr_k': 0.008384467767566605, 'slip_spread_k': 0.8162265415774854, 'spread_hl_frac': 0.015327147862964087, 'bb_std_mult': 1.1073084075317747, 'rsi_os': 17, 'rsi_ob': 59, 'vol_spike': 0.07254252113500796, 'adx_thresh': 24.667190477349187, 'atr_min_pct': 0.015683074940314092, 'atr_max_pct': 0.019282313404690152, 'tp_mult': 1.3391057201637036, 'tsl_mult': 0.10679020700882574, 'strategy': 'breakout', 'time_stop': 147, 'use_sma': True, 'use_atr': False, 'use_adx': False, 'use_ema': False, 'use_spike': False, 'rsi_required': True, 'edge_k': 1.578911377106744, 'edge_cap': 0.3187913317210209, 'bull_strategy': 'mean_reversion', 'bull_bb_std_mult': 0.591055778177541, 'bull_rsi_os': 18, 'bull_rsi_ob': 75, 'bull_adx_thresh': 14.92088944755018, 'bull_atr_min_pct': 0.0005983135347206192, 'bull_atr_max_pct': 0.018041108982921675, 'bull_tp_mult': 1.2095238190274578, 'bull_tsl_mult': 0.6677144626977318, 'bull_time_stop': 265, 'bull_use_sma': True, 'bull_use_ema': False, 'bull_use_atr': False, 'bull_use_adx': False, 'bull_use_spike': False, 'bull_rsi_required': True, 'bear_strategy': 'breakout', 'bear_bb_std_mult': 1.534671347998958, 'bear_rsi_os': 17, 'bear_rsi_ob': 84, 'bear_adx_thresh': 26.829389428905692, 'bear_atr_min_pct': 0.0026980847749108684, 'bear_atr_max_pct': 0.14416794175382305, 'bear_tp_mult': 1.4267562281112796, 'bear_tsl_mult': 0.3488966397550933, 'bear_time_stop': 262, 'bear_use_sma': True, 'bear_use_ema': False, 'bear_use_atr': True, 'bear_use_adx': True, 'bear_use_spike': True, 'bear_rsi_required': False, 'sideways_strategy': 'breakout', 'sideways_bb_std_mult': 0.5620633785121617, 'sideways_rsi_os': 55, 'sideways_rsi_ob': 95, 'sideways_adx_thresh': 26.749363355559282, 'sideways_atr_min_pct': 0.006680332452235794, 'sideways_atr_max_pct': 0.05476347224182478, 'sideways_tp_mult': 2.0751857133621794, 'sideways_tsl_mult': 0.31706279668094095, 'sideways_time_stop': 249, 'sideways_use_sma': False, 'sideways_use_ema': False, 'sideways_use_atr': False, 'sideways_use_adx': False, 'sideways_use_spike': False, 'sideways_rsi_required': True}.
[I 2025-09-01 10:27:26,187] Trial 495 finished with values: [-0.015578765916004489, 0.015456939857726771] and parameters: {'p_sma': 15, 'p_std': 49, 'p_atr': 13, 'p_adx': 22, 'rsi_period': 36, 'ema1': 8, 'ema2': 10, 'slip_atr_k': 0.006900195614274389, 'slip_spread_k': 0.8191641840766027, 'spread_hl_frac': 0.01737343803361818, 'bb_std_mult': 1.1567946409683854, 'rsi_os': 17, 'rsi_ob': 59, 'vol_spike': 0.07338162560032198, 'adx_thresh': 26.433994255076087, 'atr_min_pct': 0.01566523695446912, 'atr_max_pct': 0.018468009614187923, 'tp_mult': 1.334358098344104, 'tsl_mult': 0.07795435338026901, 'strategy': 'breakout', 'time_stop': 149, 'use_sma': True, 'use_atr': False, 'use_adx': False, 'use_ema': False, 'use_spike': False, 'rsi_required': True, 'edge_k': 1.5427617567097065, 'edge_cap': 0.3186521785307777, 'bull_strategy': 'mean_reversion', 'bull_bb_std_mult': 0.5173679397160282, 'bull_rsi_os': 18, 'bull_rsi_ob': 75, 'bull_adx_thresh': 13.448888953573613, 'bull_atr_min_pct': 0.0005730536422336783, 'bull_atr_max_pct': 0.01812794394442939, 'bull_tp_mult': 1.3236391619156525, 'bull_tsl_mult': 0.563650351792834, 'bull_time_stop': 281, 'bull_use_sma': True, 'bull_use_ema': False, 'bull_use_atr': False, 'bull_use_adx': True, 'bull_use_spike': False, 'bull_rsi_required': True, 'bear_strategy': 'breakout', 'bear_bb_std_mult': 1.5093515107025102, 'bear_rsi_os': 17, 'bear_rsi_ob': 85, 'bear_adx_thresh': 26.760993318307513, 'bear_atr_min_pct': 0.002492993922916973, 'bear_atr_max_pct': 0.1468832398826419, 'bear_tp_mult': 1.4167218372884043, 'bear_tsl_mult': 0.3568107339424646, 'bear_time_stop': 262, 'bear_use_sma': True, 'bear_use_ema': False, 'bear_use_atr': True, 'bear_use_adx': True, 'bear_use_spike': True, 'bear_rsi_required': False, 'sideways_strategy': 'breakout', 'sideways_bb_std_mult': 0.564300857680165, 'sideways_rsi_os': 55, 'sideways_rsi_ob': 95, 'sideways_adx_thresh': 26.66192501559165, 'sideways_atr_min_pct': 0.006471456963131511, 'sideways_atr_max_pct': 0.05505060318676763, 'sideways_tp_mult': 2.071553490506336, 'sideways_tsl_mult': 0.312080199331628, 'sideways_time_stop': 257, 'sideways_use_sma': False, 'sideways_use_ema': False, 'sideways_use_atr': False, 'sideways_use_adx': False, 'sideways_use_spike': False, 'sideways_rsi_required': True}.
