[I 2025-09-01 09:50:00,468] Trial 268 finished with values: [-1000000000.0, 1000000000.0] and parameters: {'p_sma': 16, 'p_std': 32, 'p_atr': 19, 'p_adx': 23, 'rsi_period': 20, 'ema1': 26, 'ema2': 15, 'slip_atr_k': 0.05973926382777147, 'slip_spread_k': 0.9631890775958416, 'spread_hl_frac': 0.02934533313920564, 'bb_std_mult': 1.562377964974029, 'rsi_os': 42, 'rsi_ob': 88, 'vol_spike': 0.1313625341173042, 'adx_thresh': 15.95559980609974, 'atr_min_pct': 0.00822933341055277, 'atr_max_pct': 0.042988871587969116, 'tp_mult': 1.2747585961490056, 'tsl_mult': 0.6976110749283785, 'strategy': 'mean_reversion', 'time_stop': 262, 'use_sma': False, 'use_atr': False, 'use_adx': False, 'use_ema': True, 'use_spike': False, 'rsi_required': True, 'edge_k': 0.9594414769214122, 'edge_cap': 0.5357735977685626, 'bull_strategy': 'mean_reversion', 'bull_bb_std_mult': 1.7385282249070255, 'bull_rsi_os': 46, 'bull_rsi_ob': 56, 'bull_adx_thresh': 16.986487610865392, 'bull_atr_min_pct': 0.0016857658939414258, 'bull_atr_max_pct': 0.07719818697652074, 'bull_tp_mult': 2.970964057454275, 'bull_tsl_mult': 0.3993561379858707, 'bull_time_stop': 160, 'bull_use_sma': True, 'bull_use_ema': True, 'bull_use_atr': True, 'bull_use_adx': True, 'bull_use_spike': False, 'bull_rsi_required': True, 'bear_strategy': 'mean_reversion', 'bear_bb_std_mult': 0.8401577099263877, 'bear_rsi_os': 40, 'bear_rsi_ob': 66, 'bear_adx_thresh': 5.945052006249371, 'bear_atr_min_pct': 0.013009107736982384, 'bear_atr_max_pct': 0.09456994729291861, 'bear_tp_mult': 2.863715110038121, 'bear_tsl_mult': 0.000355267110457691, 'bear_time_stop': 289, 'bear_use_sma': True, 'bear_use_ema': False, 'bear_use_atr': False, 'bear_use_adx': False, 'bear_use_spike': False, 'bear_rsi_required': False, 'sideways_strategy': 'mean_reversion', 'sideways_bb_std_mult': 3.3640158076238555, 'sideways_rsi_os': 17, 'sideways_rsi_ob': 90, 'sideways_adx_thresh': 21.388461054297732, 'sideways_atr_min_pct': 0.008668169077576426, 'sideways_atr_max_pct': 0.07509520759031184, 'sideways_tp_mult': 2.446601407641603, 'sideways_tsl_mult': 0.19383202636249336, 'sideways_time_stop': 30, 'sideways_use_sma': True, 'sideways_use_ema': False, 'sideways_use_atr': False, 'sideways_use_adx': True, 'sideways_use_spike': False, 'sideways_rsi_required': True}.
[I 2025-09-01 09:50:38,269] Trial 272 finished with values: [-1000000000.0, 1000000000.0] and parameters: {'p_sma': 18, 'p_std': 59, 'p_atr': 18, 'p_adx': 28, 'rsi_period': 26, 'ema1': 30, 'ema2': 25, 'slip_atr_k': 0.058905897180660347, 'slip_spread_k': 0.6594398675486352, 'spread_hl_frac': 0.027172940712760246, 'bb_std_mult': 1.4742131896298205, 'rsi_os': 52, 'rsi_ob': 85, 'vol_spike': 0.11527565188594535, 'adx_thresh': 32.97746492546882, 'atr_min_pct': 0.0033873820491641202, 'atr_max_pct': 0.04237408279852068, 'tp_mult': 1.1101921315148977, 'tsl_mult': 0.657881923716103, 'strategy': 'breakout', 'time_stop': 145, 'use_sma': True, 'use_atr': False, 'use_adx': True, 'use_ema': False, 'use_spike': True, 'rsi_required': True, 'edge_k': 1.2474569088887848, 'edge_cap': 0.6067729061308368, 'bull_strategy': 'mean_reversion', 'bull_bb_std_mult': 2.9092468238866918, 'bull_rsi_os': 17, 'bull_rsi_ob': 49, 'bull_adx_thresh': 17.228613633868992, 'bull_atr_min_pct': 0.00014074621130048988, 'bull_atr_max_pct': 0.044441364910147024, 'bull_tp_mult': 2.937898297673674, 'bull_tsl_mult': 0.41268918627087625, 'bull_time_stop': 154, 'bull_use_sma': False, 'bull_use_ema': False, 'bull_use_atr': False, 'bull_use_adx': False, 'bull_use_spike': False, 'bull_rsi_required': True, 'bear_strategy': 'mean_reversion', 'bear_bb_std_mult': 0.7292524346227618, 'bear_rsi_os': 54, 'bear_rsi_ob': 80, 'bear_adx_thresh': 16.67529603742668, 'bear_atr_min_pct': 0.005643294685946722, 'bear_atr_max_pct': 0.033333353356236495, 'bear_tp_mult': 2.5196773067555474, 'bear_tsl_mult': 0.031239482320249368, 'bear_time_stop': 295, 'bear_use_sma': False, 'bear_use_ema': False, 'bear_use_atr': True, 'bear_use_adx': True, 'bear_use_spike': True, 'bear_rsi_required': True, 'sideways_strategy': 'breakout', 'sideways_bb_std_mult': 3.597043640722677, 'sideways_rsi_os': 52, 'sideways_rsi_ob': 92, 'sideways_adx_thresh': 21.32679990128487, 'sideways_atr_min_pct': 0.00946752996682997, 'sideways_atr_max_pct': 0.0626800849745308, 'sideways_tp_mult': 2.4312501159400526, 'sideways_tsl_mult': 0.1319979394862884, 'sideways_time_stop': 57, 'sideways_use_sma': False, 'sideways_use_ema': False, 'sideways_use_atr': False, 'sideways_use_adx': True, 'sideways_use_spike': False, 'sideways_rsi_required': False}.
[I 2025-09-01 09:50:38,705] Trial 271 finished with values: [-1000000000.0, 1000000000.0] and parameters: {'p_sma': 18, 'p_std': 26, 'p_atr': 18, 'p_adx': 28, 'rsi_period': 39, 'ema1': 8, 'ema2': 43, 'slip_atr_k': 0.20532287309555858, 'slip_spread_k': 0.8303974417745502, 'spread_hl_frac': 0.03286120308338654, 'bb_std_mult': 2.731557673488565, 'rsi_os': 41, 'rsi_ob': 88, 'vol_spike': 0.0637191586719712, 'adx_thresh': 31.4578888733896, 'atr_min_pct': 0.012640626366523355, 'atr_max_pct': 0.09224673264250988, 'tp_mult': 1.2855989091427442, 'tsl_mult': 0.7546175883791837, 'strategy': 'breakout', 'time_stop': 141, 'use_sma': True, 'use_atr': False, 'use_adx': True, 'use_ema': True, 'use_spike': True, 'rsi_required': True, 'edge_k': 1.167810996643477, 'edge_cap': 0.6148947643808115, 'bull_strategy': 'mean_reversion', 'bull_bb_std_mult': 1.2202262712737681, 'bull_rsi_os': 5, 'bull_rsi_ob': 55, 'bull_adx_thresh': 30.717550194012478, 'bull_atr_min_pct': 8.483584529495546e-05, 'bull_atr_max_pct': 0.08755186652243718, 'bull_tp_mult': 2.9426622569176586, 'bull_tsl_mult': 0.4029690111486087, 'bull_time_stop': 162, 'bull_use_sma': True, 'bull_use_ema': False, 'bull_use_atr': True, 'bull_use_adx': False, 'bull_use_spike': False, 'bull_rsi_required': True, 'bear_strategy': 'mean_reversion', 'bear_bb_std_mult': 0.9662423764053021, 'bear_rsi_os': 54, 'bear_rsi_ob': 66, 'bear_adx_thresh': 28.676824286499794, 'bear_atr_min_pct': 0.005366353969246497, 'bear_atr_max_pct': 0.022903376015759466, 'bear_tp_mult': 2.8529175593994824, 'bear_tsl_mult': 0.4709857363605485, 'bear_time_stop': 290, 'bear_use_sma': True, 'bear_use_ema': False, 'bear_use_atr': True, 'bear_use_adx': False, 'bear_use_spike': False, 'bear_rsi_required': True, 'sideways_strategy': 'mean_reversion', 'sideways_bb_std_mult': 0.8046493349886957, 'sideways_rsi_os': 17, 'sideways_rsi_ob': 60, 'sideways_adx_thresh': 21.174125227316235, 'sideways_atr_min_pct': 0.009704076947858783, 'sideways_atr_max_pct': 0.1444410817613282, 'sideways_tp_mult': 2.451026624504151, 'sideways_tsl_mult': 0.19286473380051838, 'sideways_time_stop': 12, 'sideways_use_sma': False, 'sideways_use_ema': False, 'sideways_use_atr': False, 'sideways_use_adx': True, 'sideways_use_spike': False, 'sideways_rsi_required': False}.
[I 2025-09-01 09:50:39,191] Trial 273 finished with values: [-0.08445044864286844, 0.08427844833178606] and parameters: {'p_sma': 54, 'p_std': 26, 'p_atr': 18, 'p_adx': 28, 'rsi_period': 81, 'ema1': 17, 'ema2': 17, 'slip_atr_k': 0.043363237985207956, 'slip_spread_k': 0.6630002557285607, 'spread_hl_frac': 0.025937438589917164, 'bb_std_mult': 1.4763979043116804, 'rsi_os': 41, 'rsi_ob': 68, 'vol_spike': 0.11317750717785868, 'adx_thresh': 33.39560971160987, 'atr_min_pct': 0.008953776640381442, 'atr_max_pct': 0.010004374932530494, 'tp_mult': 1.1024018304162444, 'tsl_mult': 0.6498591579762636, 'strategy': 'breakout', 'time_stop': 246, 'use_sma': True, 'use_atr': False, 'use_adx': True, 'use_ema': False, 'use_spike': True, 'rsi_required': True, 'edge_k': 1.2440948030934094, 'edge_cap': 0.5942594751331661, 'bull_strategy': 'mean_reversion', 'bull_bb_std_mult': 3.5264682366155675, 'bull_rsi_os': 18, 'bull_rsi_ob': 49, 'bull_adx_thresh': 6.8476837801491115, 'bull_atr_min_pct': 0.00016991534495912276, 'bull_atr_max_pct': 0.08382677730167715, 'bull_tp_mult': 2.947731452322258, 'bull_tsl_mult': 0.6882564286766678, 'bull_time_stop': 139, 'bull_use_sma': False, 'bull_use_ema': False, 'bull_use_atr': False, 'bull_use_adx': False, 'bull_use_spike': False, 'bull_rsi_required': True, 'bear_strategy': 'mean_reversion', 'bear_bb_std_mult': 0.9696591204475602, 'bear_rsi_os': 44, 'bear_rsi_ob': 80, 'bear_adx_thresh': 30.90277963031447, 'bear_atr_min_pct': 0.005482832941907003, 'bear_atr_max_pct': 0.02703534070129477, 'bear_tp_mult': 2.5538849928629253, 'bear_tsl_mult': 0.5950672846915688, 'bear_time_stop': 25, 'bear_use_sma': False, 'bear_use_ema': False, 'bear_use_atr': True, 'bear_use_adx': True, 'bear_use_spike': True, 'bear_rsi_required': True, 'sideways_strategy': 'breakout', 'sideways_bb_std_mult': 0.8251837700200356, 'sideways_rsi_os': 52, 'sideways_rsi_ob': 92, 'sideways_adx_thresh': 33.3232787691867, 'sideways_atr_min_pct': 0.010967499960967587, 'sideways_atr_max_pct': 0.02772655057763329, 'sideways_tp_mult': 2.5171783984777774, 'sideways_tsl_mult': 0.7744861261533844, 'sideways_time_stop': 262, 'sideways_use_sma': False, 'sideways_use_ema': True, 'sideways_use_atr': False, 'sideways_use_adx': True, 'sideways_use_spike': False, 'sideways_rsi_required': False}.
[I 2025-09-01 09:50:39,417] Trial 274 finished with values: [-0.09008507333784765, 0.08983497285896995] and parameters: {'p_sma': 48, 'p_std': 14, 'p_atr': 18, 'p_adx': 28, 'rsi_period': 60, 'ema1': 17, 'ema2': 17, 'slip_atr_k': 0.04305691198982476, 'slip_spread_k': 0.0735430987359929, 'spread_hl_frac': 0.0323914437886305, 'bb_std_mult': 1.5012606216372397, 'rsi_os': 41, 'rsi_ob': 68, 'vol_spike': 0.1154531538886871, 'adx_thresh': 32.92233635034566, 'atr_min_pct': 0.0036276453909730643, 'atr_max_pct': 0.05062344751340156, 'tp_mult': 2.2299335089165573, 'tsl_mult': 0.643445446907056, 'strategy': 'breakout', 'time_stop': 235, 'use_sma': True, 'use_atr': False, 'use_adx': True, 'use_ema': False, 'use_spike': True, 'rsi_required': True, 'edge_k': 1.2379342292378688, 'edge_cap': 0.6002705999076131, 'bull_strategy': 'mean_reversion', 'bull_bb_std_mult': 3.543341110931232, 'bull_rsi_os': 44, 'bull_rsi_ob': 49, 'bull_adx_thresh': 6.69116491033305, 'bull_atr_min_pct': 0.00010143116220403918, 'bull_atr_max_pct': 0.08490402479193337, 'bull_tp_mult': 2.94128105706154, 'bull_tsl_mult': 0.4110208273200462, 'bull_time_stop': 22, 'bull_use_sma': False, 'bull_use_ema': False, 'bull_use_atr': False, 'bull_use_adx': False, 'bull_use_spike': False, 'bull_rsi_required': True, 'bear_strategy': 'mean_reversion', 'bear_bb_std_mult': 0.9676259734216227, 'bear_rsi_os': 26, 'bear_rsi_ob': 80, 'bear_adx_thresh': 23.27724331162394, 'bear_atr_min_pct': 0.005693469870024232, 'bear_atr_max_pct': 0.032464793531526065, 'bear_tp_mult': 2.5639019508648357, 'bear_tsl_mult': 0.7518191448577123, 'bear_time_stop': 295, 'bear_use_sma': False, 'bear_use_ema': False, 'bear_use_atr': True, 'bear_use_adx': True, 'bear_use_spike': True, 'bear_rsi_required': True, 'sideways_strategy': 'breakout', 'sideways_bb_std_mult': 0.8439081873258953, 'sideways_rsi_os': 52, 'sideways_rsi_ob': 94, 'sideways_adx_thresh': 12.160821441678785, 'sideways_atr_min_pct': 0.010972200327455533, 'sideways_atr_max_pct': 0.07116758585189799, 'sideways_tp_mult': 2.521026371280287, 'sideways_tsl_mult': 0.5064730602431433, 'sideways_time_stop': 8, 'sideways_use_sma': False, 'sideways_use_ema': True, 'sideways_use_atr': False, 'sideways_use_adx': True, 'sideways_use_spike': False, 'sideways_rsi_required': False}.
[I 2025-09-01 09:51:18,219] Trial 278 finished with values: [-0.05033473347235107, 0.05012606452870163] and parameters: {'p_sma': 15, 'p_std': 20, 'p_atr': 14, 'p_adx': 7, 'rsi_period': 25, 'ema1': 18, 'ema2': 16, 'slip_atr_k': 0.10768619561633226, 'slip_spread_k': 0.6116351910860496, 'spread_hl_frac': 0.02760448681082544, 'bb_std_mult': 1.906518847514643, 'rsi_os': 12, 'rsi_ob': 81, 'vol_spike': 0.2564430252509857, 'adx_thresh': 33.702214541954575, 'atr_min_pct': 0.01054893500973239, 'atr_max_pct': 0.1340763185969013, 'tp_mult': 1.0937733726478045, 'tsl_mult': 0.7090629595556248, 'strategy': 'breakout', 'time_stop': 251, 'use_sma': True, 'use_atr': False, 'use_adx': False, 'use_ema': True, 'use_spike': True, 'rsi_required': False, 'edge_k': 1.1353801079888028, 'edge_cap': 0.5745099978061683, 'bull_strategy': 'mean_reversion', 'bull_bb_std_mult': 3.468042596014614, 'bull_rsi_os': 23, 'bull_rsi_ob': 47, 'bull_adx_thresh': 27.853914261115982, 'bull_atr_min_pct': 0.0013060877032518678, 'bull_atr_max_pct': 0.09097209076231061, 'bull_tp_mult': 2.628381177958072, 'bull_tsl_mult': 0.6411735145271438, 'bull_time_stop': 191, 'bull_use_sma': True, 'bull_use_ema': False, 'bull_use_atr': True, 'bull_use_adx': False, 'bull_use_spike': True, 'bull_rsi_required': False, 'bear_strategy': 'breakout', 'bear_bb_std_mult': 1.0536860220616315, 'bear_rsi_os': 5, 'bear_rsi_ob': 48, 'bear_adx_thresh': 32.535814729242425, 'bear_atr_min_pct': 0.00691990802131316, 'bear_atr_max_pct': 0.11277141904361798, 'bear_tp_mult': 2.6559689187789193, 'bear_tsl_mult': 0.37300652615328855, 'bear_time_stop': 219, 'bear_use_sma': True, 'bear_use_ema': False, 'bear_use_atr': True, 'bear_use_adx': False, 'bear_use_spike': False, 'bear_rsi_required': False, 'sideways_strategy': 'mean_reversion', 'sideways_bb_std_mult': 0.6668066737782155, 'sideways_rsi_os': 50, 'sideways_rsi_ob': 69, 'sideways_adx_thresh': 11.352820949719767, 'sideways_atr_min_pct': 0.01009235752302363, 'sideways_atr_max_pct': 0.03548276801425793, 'sideways_tp_mult': 2.460490847104866, 'sideways_tsl_mult': 0.07101159775739674, 'sideways_time_stop': 231, 'sideways_use_sma': True, 'sideways_use_ema': False, 'sideways_use_atr': True, 'sideways_use_adx': True, 'sideways_use_spike': True, 'sideways_rsi_required': False}.
[I 2025-09-01 09:51:20,692] Trial 277 finished with values: [-0.0915525209685718, 0.09131418614188883] and parameters: {'p_sma': 48, 'p_std': 38, 'p_atr': 13, 'p_adx': 21, 'rsi_period': 25, 'ema1': 18, 'ema2': 16, 'slip_atr_k': 0.16801104090677715, 'slip_spread_k': 0.6065677803256692, 'spread_hl_frac': 0.02791282376421431, 'bb_std_mult': 1.3825580478251889, 'rsi_os': 24, 'rsi_ob': 70, 'vol_spike': 0.16115869467329236, 'adx_thresh': 32.81867835791981, 'atr_min_pct': 0.007165329586842507, 'atr_max_pct': 0.034683492870672336, 'tp_mult': 2.216835301084355, 'tsl_mult': 0.6743633558672524, 'strategy': 'breakout', 'time_stop': 126, 'use_sma': True, 'use_atr': False, 'use_adx': False, 'use_ema': True, 'use_spike': True, 'rsi_required': False, 'edge_k': 1.1100858517173156, 'edge_cap': 0.5861417333929596, 'bull_strategy': 'mean_reversion', 'bull_bb_std_mult': 3.551219347572655, 'bull_rsi_os': 23, 'bull_rsi_ob': 70, 'bull_adx_thresh': 6.3326530099545, 'bull_atr_min_pct': 0.0010872464611377617, 'bull_atr_max_pct': 0.12052600651461333, 'bull_tp_mult': 2.621455358262897, 'bull_tsl_mult': 0.3844253173427063, 'bull_time_stop': 83, 'bull_use_sma': True, 'bull_use_ema': False, 'bull_use_atr': True, 'bull_use_adx': False, 'bull_use_spike': True, 'bull_rsi_required': False, 'bear_strategy': 'breakout', 'bear_bb_std_mult': 0.9512675762041537, 'bear_rsi_os': 26, 'bear_rsi_ob': 68, 'bear_adx_thresh': 23.514868067322148, 'bear_atr_min_pct': 0.00676262236858945, 'bear_atr_max_pct': 0.1247151501901316, 'bear_tp_mult': 1.2942124113005502, 'bear_tsl_mult': 0.6611506931870772, 'bear_time_stop': 244, 'bear_use_sma': True, 'bear_use_ema': False, 'bear_use_atr': True, 'bear_use_adx': False, 'bear_use_spike': False, 'bear_rsi_required': False, 'sideways_strategy': 'mean_reversion', 'sideways_bb_std_mult': 1.0263323202253296, 'sideways_rsi_os': 52, 'sideways_rsi_ob': 70, 'sideways_adx_thresh': 11.073630956904154, 'sideways_atr_min_pct': 0.010301477205867493, 'sideways_atr_max_pct': 0.07075849836790328, 'sideways_tp_mult': 2.3486434183669953, 'sideways_tsl_mult': 0.43866875206989425, 'sideways_time_stop': 21, 'sideways_use_sma': True, 'sideways_use_ema': True, 'sideways_use_atr': True, 'sideways_use_adx': True, 'sideways_use_spike': True, 'sideways_rsi_required': False}.
[I 2025-09-01 09:51:21,341] Trial 275 finished with values: [-0.13251660694527712, 0.13225061488481885] and parameters: {'p_sma': 45, 'p_std': 12, 'p_atr': 14, 'p_adx': 21, 'rsi_period': 38, 'ema1': 17, 'ema2': 17, 'slip_atr_k': 0.1677445599914012, 'slip_spread_k': 0.196738845589233, 'spread_hl_frac': 0.03245314451771464, 'bb_std_mult': 1.4171362265778527, 'rsi_os': 7, 'rsi_ob': 92, 'vol_spike': 0.14093461842285024, 'adx_thresh': 33.59788944158299, 'atr_min_pct': 0.011553846724534456, 'atr_max_pct': 0.14299406475213194, 'tp_mult': 1.0929935875874213, 'tsl_mult': 0.6508977636907094, 'strategy': 'breakout', 'time_stop': 248, 'use_sma': True, 'use_atr': False, 'use_adx': True, 'use_ema': True, 'use_spike': True, 'rsi_required': False, 'edge_k': 1.1309804669013113, 'edge_cap': 0.5898605272356238, 'bull_strategy': 'mean_reversion', 'bull_bb_std_mult': 3.5447470927303883, 'bull_rsi_os': 23, 'bull_rsi_ob': 47, 'bull_adx_thresh': 6.774849228036801, 'bull_atr_min_pct': 0.0011287071005844928, 'bull_atr_max_pct': 0.08432027231544309, 'bull_tp_mult': 2.87615365200507, 'bull_tsl_mult': 0.6323984823831971, 'bull_time_stop': 56, 'bull_use_sma': True, 'bull_use_ema': False, 'bull_use_atr': True, 'bull_use_adx': False, 'bull_use_spike': True, 'bull_rsi_required': False, 'bear_strategy': 'breakout', 'bear_bb_std_mult': 0.9629311709911178, 'bear_rsi_os': 26, 'bear_rsi_ob': 68, 'bear_adx_thresh': 7.185784030599763, 'bear_atr_min_pct': 0.006810419736425814, 'bear_atr_max_pct': 0.010125786915647722, 'bear_tp_mult': 1.2674904747223963, 'bear_tsl_mult': 0.6688961490686756, 'bear_time_stop': 90, 'bear_use_sma': True, 'bear_use_ema': False, 'bear_use_atr': True, 'bear_use_adx': False, 'bear_use_spike': False, 'bear_rsi_required': True, 'sideways_strategy': 'mean_reversion', 'sideways_bb_std_mult': 3.090438843220954, 'sideways_rsi_os': 52, 'sideways_rsi_ob': 69, 'sideways_adx_thresh': 25.072171386773746, 'sideways_atr_min_pct': 0.011008756276017159, 'sideways_atr_max_pct': 0.07092722217380647, 'sideways_tp_mult': 2.5214622893882512, 'sideways_tsl_mult': 0.5067833972381959, 'sideways_time_stop': 262, 'sideways_use_sma': False, 'sideways_use_ema': True, 'sideways_use_atr': True, 'sideways_use_adx': True, 'sideways_use_spike': True, 'sideways_rsi_required': False}.
[I 2025-09-01 09:51:21,579] Trial 276 finished with values: [-0.057523116125700824, 0.057365248307835986] and parameters: {'p_sma': 44, 'p_std': 14, 'p_atr': 10, 'p_adx': 21, 'rsi_period': 25, 'ema1': 18, 'ema2': 39, 'slip_atr_k': 0.042133343123338204, 'slip_spread_k': 0.06563227535422606, 'spread_hl_frac': 0.026354747826702444, 'bb_std_mult': 1.389383188837468, 'rsi_os': 22, 'rsi_ob': 68, 'vol_spike': 0.15749523952210218, 'adx_thresh': 33.623685567873295, 'atr_min_pct': 0.011418967383050701, 'atr_max_pct': 0.13436389206335175, 'tp_mult': 1.097468534192544, 'tsl_mult': 0.6532184470009238, 'strategy': 'breakout', 'time_stop': 131, 'use_sma': True, 'use_atr': False, 'use_adx': False, 'use_ema': True, 'use_spike': True, 'rsi_required': False, 'edge_k': 1.1065836131841742, 'edge_cap': 0.5866375990867696, 'bull_strategy': 'mean_reversion', 'bull_bb_std_mult': 3.5518395732363532, 'bull_rsi_os': 23, 'bull_rsi_ob': 47, 'bull_adx_thresh': 30.011702635088973, 'bull_atr_min_pct': 0.001655773750215048, 'bull_atr_max_pct': 0.08458127630428329, 'bull_tp_mult': 2.621427723836945, 'bull_tsl_mult': 0.0346621618299211, 'bull_time_stop': 132, 'bull_use_sma': True, 'bull_use_ema': False, 'bull_use_atr': False, 'bull_use_adx': False, 'bull_use_spike': True, 'bull_rsi_required': False, 'bear_strategy': 'breakout', 'bear_bb_std_mult': 0.963626985861757, 'bear_rsi_os': 25, 'bear_rsi_ob': 53, 'bear_adx_thresh': 23.474008821693708, 'bear_atr_min_pct': 0.0064435392638008, 'bear_atr_max_pct': 0.08883924750997822, 'bear_tp_mult': 1.2976522192596545, 'bear_tsl_mult': 0.3140622777881723, 'bear_time_stop': 244, 'bear_use_sma': False, 'bear_use_ema': False, 'bear_use_atr': True, 'bear_use_adx': True, 'bear_use_spike': True, 'bear_rsi_required': False, 'sideways_strategy': 'breakout', 'sideways_bb_std_mult': 3.4949402956828566, 'sideways_rsi_os': 52, 'sideways_rsi_ob': 93, 'sideways_adx_thresh': 25.096563226792576, 'sideways_atr_min_pct': 0.010761506650544239, 'sideways_atr_max_pct': 0.07129623583216774, 'sideways_tp_mult': 2.5149325378983027, 'sideways_tsl_mult': 0.5112631105723366, 'sideways_time_stop': 236, 'sideways_use_sma': True, 'sideways_use_ema': True, 'sideways_use_atr': True, 'sideways_use_adx': True, 'sideways_use_spike': True, 'sideways_rsi_required': False}.
