[I 2025-09-01 09:16:23,436] Trial 62 finished with values: [-1000000000.0, 1000000000.0] and parameters: {'p_sma': 28, 'p_std': 57, 'p_atr': 7, 'p_adx': 28, 'rsi_period': 70, 'ema1': 15, 'ema2': 52, 'slip_atr_k': 0.0907500853601062, 'slip_spread_k': 0.9750862497196486, 'spread_hl_frac': 0.04223555904158589, 'bb_std_mult': 0.9697103928674411, 'rsi_os': 17, 'rsi_ob': 63, 'vol_spike': 0.14476106114215875, 'adx_thresh': 14.922504246007804, 'atr_min_pct': 0.02996308087646226, 'atr_max_pct': 0.13664538117175212, 'tp_mult': 1.050516126613581, 'tsl_mult': 0.1785375281670055, 'strategy': 'mean_reversion', 'time_stop': 58, 'use_sma': False, 'use_atr': True, 'use_adx': True, 'use_ema': False, 'use_spike': False, 'rsi_required': True, 'edge_k': 0.39029288771828385, 'edge_cap': 0.1358161107596243, 'bull_strategy': 'breakout', 'bull_bb_std_mult': 3.274699238300813, 'bull_rsi_os': 49, 'bull_rsi_ob': 76, 'bull_adx_thresh': 16.73729542934716, 'bull_atr_min_pct': 0.004849288410731758, 'bull_atr_max_pct': 0.1373115272827022, 'bull_tp_mult': 1.010411856903049, 'bull_tsl_mult': 0.3414156406631068, 'bull_time_stop': 159, 'bull_use_sma': True, 'bull_use_ema': True, 'bull_use_atr': True, 'bull_use_adx': True, 'bull_use_spike': True, 'bull_rsi_required': True, 'bear_strategy': 'breakout', 'bear_bb_std_mult': 3.308862604154049, 'bear_rsi_os': 43, 'bear_rsi_ob': 71, 'bear_adx_thresh': 34.223569780482634, 'bear_atr_min_pct': 0.021715252652665197, 'bear_atr_max_pct': 0.03105133517647949, 'bear_tp_mult': 1.7308545515932259, 'bear_tsl_mult': 0.8408824162200225, 'bear_time_stop': 77, 'bear_use_sma': False, 'bear_use_ema': True, 'bear_use_atr': True, 'bear_use_adx': True, 'bear_use_spike': True, 'bear_rsi_required': True, 'sideways_strategy': 'breakout', 'sideways_bb_std_mult': 2.240613452444055, 'sideways_rsi_os': 43, 'sideways_rsi_ob': 73, 'sideways_adx_thresh': 17.378071266784264, 'sideways_atr_min_pct': 0.025608569776167628, 'sideways_atr_max_pct': 0.08311159273095081, 'sideways_tp_mult': 1.1178355441417236, 'sideways_tsl_mult': 0.07593940830054102, 'sideways_time_stop': 51, 'sideways_use_sma': False, 'sideways_use_ema': True, 'sideways_use_atr': False, 'sideways_use_adx': True, 'sideways_use_spike': False, 'sideways_rsi_required': False}.
[I 2025-09-01 09:16:23,833] Trial 63 finished with values: [-1000000000.0, 1000000000.0] and parameters: {'p_sma': 9, 'p_std': 45, 'p_atr': 29, 'p_adx': 28, 'rsi_period': 76, 'ema1': 5, 'ema2': 42, 'slip_atr_k': 0.09045264012264007, 'slip_spread_k': 0.7484442967021245, 'spread_hl_frac': 0.03466199085910779, 'bb_std_mult': 0.9210280519896973, 'rsi_os': 18, 'rsi_ob': 64, 'vol_spike': 0.1596878874742086, 'adx_thresh': 32.909315777450914, 'atr_min_pct': 0.009821121342899954, 'atr_max_pct': 0.1387419636340143, 'tp_mult': 1.2997022645933578, 'tsl_mult': 0.02944950635365634, 'strategy': 'mean_reversion', 'time_stop': 5, 'use_sma': False, 'use_atr': True, 'use_adx': True, 'use_ema': True, 'use_spike': False, 'rsi_required': False, 'edge_k': 1.6016496752009086, 'edge_cap': 0.7350126507796293, 'bull_strategy': 'mean_reversion', 'bull_bb_std_mult': 2.17894971604691, 'bull_rsi_os': 31, 'bull_rsi_ob': 76, 'bull_adx_thresh': 16.697262631272473, 'bull_atr_min_pct': 0.003668581913830551, 'bull_atr_max_pct': 0.1463832681777399, 'bull_tp_mult': 2.4752247102152207, 'bull_tsl_mult': 0.32839913074345434, 'bull_time_stop': 155, 'bull_use_sma': False, 'bull_use_ema': True, 'bull_use_atr': False, 'bull_use_adx': False, 'bull_use_spike': True, 'bull_rsi_required': False, 'bear_strategy': 'mean_reversion', 'bear_bb_std_mult': 2.424152771842352, 'bear_rsi_os': 25, 'bear_rsi_ob': 77, 'bear_adx_thresh': 34.15886520033921, 'bear_atr_min_pct': 0.01989165512894821, 'bear_atr_max_pct': 0.14293680174074735, 'bear_tp_mult': 1.1666792199720821, 'bear_tsl_mult': 0.08850107035502325, 'bear_time_stop': 79, 'bear_use_sma': False, 'bear_use_ema': False, 'bear_use_atr': True, 'bear_use_adx': True, 'bear_use_spike': True, 'bear_rsi_required': True, 'sideways_strategy': 'breakout', 'sideways_bb_std_mult': 2.251286948774681, 'sideways_rsi_os': 40, 'sideways_rsi_ob': 73, 'sideways_adx_thresh': 7.0843998272781565, 'sideways_atr_min_pct': 0.018072368888412974, 'sideways_atr_max_pct': 0.06902991844017521, 'sideways_tp_mult': 1.108513921274791, 'sideways_tsl_mult': 0.8550980037400968, 'sideways_time_stop': 82, 'sideways_use_sma': False, 'sideways_use_ema': True, 'sideways_use_atr': False, 'sideways_use_adx': False, 'sideways_use_spike': False, 'sideways_rsi_required': False}.
[I 2025-09-01 09:16:24,074] Trial 64 finished with values: [-1000000000.0, 1000000000.0] and parameters: {'p_sma': 46, 'p_std': 46, 'p_atr': 29, 'p_adx': 9, 'rsi_period': 82, 'ema1': 15, 'ema2': 51, 'slip_atr_k': 0.06305340394764014, 'slip_spread_k': 0.6748544986844889, 'spread_hl_frac': 0.041883916362900786, 'bb_std_mult': 0.9525291316954498, 'rsi_os': 34, 'rsi_ob': 83, 'vol_spike': 0.16252162358696182, 'adx_thresh': 11.198503282901884, 'atr_min_pct': 0.009068428830115351, 'atr_max_pct': 0.1128487295941093, 'tp_mult': 1.3244200440624503, 'tsl_mult': 0.03267260133719736, 'strategy': 'mean_reversion', 'time_stop': 15, 'use_sma': False, 'use_atr': True, 'use_adx': True, 'use_ema': True, 'use_spike': False, 'rsi_required': False, 'edge_k': 1.5315097985883335, 'edge_cap': 0.7460525148232888, 'bull_strategy': 'mean_reversion', 'bull_bb_std_mult': 2.9261093757008103, 'bull_rsi_os': 27, 'bull_rsi_ob': 76, 'bull_adx_thresh': 16.66454393964512, 'bull_atr_min_pct': 0.0036572207558210985, 'bull_atr_max_pct': 0.13790783520021901, 'bull_tp_mult': 1.2530996536734555, 'bull_tsl_mult': 0.33522507484843794, 'bull_time_stop': 154, 'bull_use_sma': False, 'bull_use_ema': True, 'bull_use_atr': False, 'bull_use_adx': False, 'bull_use_spike': True, 'bull_rsi_required': False, 'bear_strategy': 'mean_reversion', 'bear_bb_std_mult': 3.508142864120693, 'bear_rsi_os': 20, 'bear_rsi_ob': 89, 'bear_adx_thresh': 34.58070389457194, 'bear_atr_min_pct': 0.0215672246495416, 'bear_atr_max_pct': 0.11295026029845551, 'bear_tp_mult': 1.7353062103218475, 'bear_tsl_mult': 0.7447795578642875, 'bear_time_stop': 76, 'bear_use_sma': False, 'bear_use_ema': False, 'bear_use_atr': True, 'bear_use_adx': True, 'bear_use_spike': True, 'bear_rsi_required': True, 'sideways_strategy': 'breakout', 'sideways_bb_std_mult': 2.233493730431999, 'sideways_rsi_os': 40, 'sideways_rsi_ob': 73, 'sideways_adx_thresh': 7.396919302232995, 'sideways_atr_min_pct': 0.018482932812472687, 'sideways_atr_max_pct': 0.06835427896756599, 'sideways_tp_mult': 1.2441239009064486, 'sideways_tsl_mult': 0.08419443293648898, 'sideways_time_stop': 82, 'sideways_use_sma': False, 'sideways_use_ema': True, 'sideways_use_atr': False, 'sideways_use_adx': False, 'sideways_use_spike': False, 'sideways_rsi_required': False}.
[I 2025-09-01 09:17:02,113] Trial 66 finished with values: [-1000000000.0, 1000000000.0] and parameters: {'p_sma': 30, 'p_std': 8, 'p_atr': 26, 'p_adx': 28, 'rsi_period': 82, 'ema1': 16, 'ema2': 52, 'slip_atr_k': 0.16101968176870207, 'slip_spread_k': 0.8178703171815535, 'spread_hl_frac': 0.03438749976459322, 'bb_std_mult': 0.9457958677747899, 'rsi_os': 35, 'rsi_ob': 82, 'vol_spike': 0.08997789028273617, 'adx_thresh': 11.529450296939054, 'atr_min_pct': 0.00899065630394325, 'atr_max_pct': 0.13715366024936082, 'tp_mult': 1.28905669899627, 'tsl_mult': 0.018795963730579623, 'strategy': 'mean_reversion', 'time_stop': 14, 'use_sma': False, 'use_atr': False, 'use_adx': True, 'use_ema': False, 'use_spike': True, 'rsi_required': False, 'edge_k': 0.09108536145155696, 'edge_cap': 0.39985946611732354, 'bull_strategy': 'mean_reversion', 'bull_bb_std_mult': 2.9036508838962023, 'bull_rsi_os': 38, 'bull_rsi_ob': 62, 'bull_adx_thresh': 16.914151038896797, 'bull_atr_min_pct': 0.0031122144288613, 'bull_atr_max_pct': 0.14788263478161337, 'bull_tp_mult': 1.2691507201401435, 'bull_tsl_mult': 0.32598428763353915, 'bull_time_stop': 154, 'bull_use_sma': False, 'bull_use_ema': True, 'bull_use_atr': False, 'bull_use_adx': False, 'bull_use_spike': True, 'bull_rsi_required': False, 'bear_strategy': 'mean_reversion', 'bear_bb_std_mult': 3.5006311331438917, 'bear_rsi_os': 42, 'bear_rsi_ob': 77, 'bear_adx_thresh': 34.49308437307069, 'bear_atr_min_pct': 0.020925150218916104, 'bear_atr_max_pct': 0.11144347976973937, 'bear_tp_mult': 1.1680417609408735, 'bear_tsl_mult': 0.09614515025009873, 'bear_time_stop': 153, 'bear_use_sma': True, 'bear_use_ema': False, 'bear_use_atr': True, 'bear_use_adx': False, 'bear_use_spike': True, 'bear_rsi_required': False, 'sideways_strategy': 'mean_reversion', 'sideways_bb_std_mult': 2.255345077912985, 'sideways_rsi_os': 5, 'sideways_rsi_ob': 68, 'sideways_adx_thresh': 17.482426657982497, 'sideways_atr_min_pct': 0.001453214828146417, 'sideways_atr_max_pct': 0.05816931367805299, 'sideways_tp_mult': 1.114364001031203, 'sideways_tsl_mult': 0.9690225316425871, 'sideways_time_stop': 80, 'sideways_use_sma': False, 'sideways_use_ema': False, 'sideways_use_atr': True, 'sideways_use_adx': False, 'sideways_use_spike': False, 'sideways_rsi_required': False}.
[I 2025-09-01 09:17:02,685] Trial 67 finished with values: [-1000000000.0, 1000000000.0] and parameters: {'p_sma': 60, 'p_std': 42, 'p_atr': 26, 'p_adx': 9, 'rsi_period': 82, 'ema1': 8, 'ema2': 42, 'slip_atr_k': 0.06585157814033646, 'slip_spread_k': 0.8171694255002145, 'spread_hl_frac': 0.03327829381907447, 'bb_std_mult': 0.6365645497392468, 'rsi_os': 35, 'rsi_ob': 70, 'vol_spike': 0.1910642907964311, 'adx_thresh': 32.738980611959754, 'atr_min_pct': 0.008853669836668975, 'atr_max_pct': 0.030684543215771458, 'tp_mult': 1.2412992430877368, 'tsl_mult': 0.018999232912601388, 'strategy': 'breakout', 'time_stop': 15, 'use_sma': False, 'use_atr': False, 'use_adx': True, 'use_ema': False, 'use_spike': True, 'rsi_required': False, 'edge_k': 0.09327314037886658, 'edge_cap': 0.38862239633499485, 'bull_strategy': 'mean_reversion', 'bull_bb_std_mult': 2.3833186918791913, 'bull_rsi_os': 14, 'bull_rsi_ob': 62, 'bull_adx_thresh': 18.527522594158654, 'bull_atr_min_pct': 0.0032851718852818165, 'bull_atr_max_pct': 0.1462731844707434, 'bull_tp_mult': 1.2751324238458601, 'bull_tsl_mult': 0.26326201949772554, 'bull_time_stop': 98, 'bull_use_sma': False, 'bull_use_ema': True, 'bull_use_atr': False, 'bull_use_adx': False, 'bull_use_spike': True, 'bull_rsi_required': False, 'bear_strategy': 'mean_reversion', 'bear_bb_std_mult': 2.429848633138561, 'bear_rsi_os': 40, 'bear_rsi_ob': 77, 'bear_adx_thresh': 32.820245146436115, 'bear_atr_min_pct': 0.020131398405726583, 'bear_atr_max_pct': 0.038254019447220074, 'bear_tp_mult': 1.1932544171099757, 'bear_tsl_mult': 0.754961418534977, 'bear_time_stop': 49, 'bear_use_sma': True, 'bear_use_ema': False, 'bear_use_atr': False, 'bear_use_adx': False, 'bear_use_spike': True, 'bear_rsi_required': False, 'sideways_strategy': 'mean_reversion', 'sideways_bb_std_mult': 2.433524581344956, 'sideways_rsi_os': 34, 'sideways_rsi_ob': 83, 'sideways_adx_thresh': 16.760520557947, 'sideways_atr_min_pct': 0.001187663305660224, 'sideways_atr_max_pct': 0.058288384459967375, 'sideways_tp_mult': 1.2574108404926065, 'sideways_tsl_mult': 0.8570535651908449, 'sideways_time_stop': 85, 'sideways_use_sma': True, 'sideways_use_ema': False, 'sideways_use_atr': True, 'sideways_use_adx': False, 'sideways_use_spike': False, 'sideways_rsi_required': False}.
[I 2025-09-01 09:17:03,601] Trial 69 finished with values: [-1000000000.0, 1000000000.0] and parameters: {'p_sma': 57, 'p_std': 42, 'p_atr': 26, 'p_adx': 25, 'rsi_period': 56, 'ema1': 24, 'ema2': 30, 'slip_atr_k': 0.0162316033937471, 'slip_spread_k': 0.8207075939954085, 'spread_hl_frac': 0.03898158126016229, 'bb_std_mult': 0.6271586617633264, 'rsi_os': 27, 'rsi_ob': 70, 'vol_spike': 0.1911290585259043, 'adx_thresh': 16.3552641805392, 'atr_min_pct': 0.028761841576815817, 'atr_max_pct': 0.03022607573405054, 'tp_mult': 1.5659939649758292, 'tsl_mult': 0.07523864348664555, 'strategy': 'breakout', 'time_stop': 41, 'use_sma': False, 'use_atr': False, 'use_adx': False, 'use_ema': False, 'use_spike': True, 'rsi_required': False, 'edge_k': 0.08842560604267358, 'edge_cap': 0.8494355221305905, 'bull_strategy': 'mean_reversion', 'bull_bb_std_mult': 2.43673539009378, 'bull_rsi_os': 41, 'bull_rsi_ob': 62, 'bull_adx_thresh': 15.072920543341896, 'bull_atr_min_pct': 0.00028110763689466814, 'bull_atr_max_pct': 0.12669753228063962, 'bull_tp_mult': 1.2356984932023465, 'bull_tsl_mult': 0.3969300545708138, 'bull_time_stop': 210, 'bull_use_sma': False, 'bull_use_ema': True, 'bull_use_atr': False, 'bull_use_adx': False, 'bull_use_spike': False, 'bull_rsi_required': False, 'bear_strategy': 'mean_reversion', 'bear_bb_std_mult': 1.6233211320231444, 'bear_rsi_os': 14, 'bear_rsi_ob': 57, 'bear_adx_thresh': 32.85498772767159, 'bear_atr_min_pct': 0.01469887035839649, 'bear_atr_max_pct': 0.011176928483064008, 'bear_tp_mult': 2.928007066791527, 'bear_tsl_mult': 0.8042654072896579, 'bear_time_stop': 55, 'bear_use_sma': True, 'bear_use_ema': False, 'bear_use_atr': False, 'bear_use_adx': False, 'bear_use_spike': True, 'bear_rsi_required': False, 'sideways_strategy': 'mean_reversion', 'sideways_bb_std_mult': 2.4866674936544615, 'sideways_rsi_os': 5, 'sideways_rsi_ob': 83, 'sideways_adx_thresh': 16.467760557556133, 'sideways_atr_min_pct': 0.0012144034970239393, 'sideways_atr_max_pct': 0.05574705403173965, 'sideways_tp_mult': 1.3935329470304159, 'sideways_tsl_mult': 0.9661869450307731, 'sideways_time_stop': 237, 'sideways_use_sma': True, 'sideways_use_ema': False, 'sideways_use_atr': True, 'sideways_use_adx': False, 'sideways_use_spike': True, 'sideways_rsi_required': False}.
[I 2025-09-01 09:17:04,060] Trial 68 finished with values: [-0.21550365754351664, 0.2154196804275893] and parameters: {'p_sma': 60, 'p_std': 51, 'p_atr': 26, 'p_adx': 10, 'rsi_period': 82, 'ema1': 8, 'ema2': 18, 'slip_atr_k': 0.06422046425605524, 'slip_spread_k': 0.8113818754373612, 'spread_hl_frac': 0.039019150850023915, 'bb_std_mult': 0.5885890346212443, 'rsi_os': 9, 'rsi_ob': 69, 'vol_spike': 0.28582119268017714, 'adx_thresh': 11.624924293019385, 'atr_min_pct': 0.018705071850163277, 'atr_max_pct': 0.032351382354159866, 'tp_mult': 1.342314981159802, 'tsl_mult': 0.018940179591180044, 'strategy': 'breakout', 'time_stop': 135, 'use_sma': False, 'use_atr': False, 'use_adx': False, 'use_ema': False, 'use_spike': True, 'rsi_required': False, 'edge_k': 0.07299138974449429, 'edge_cap': 0.39481488030279765, 'bull_strategy': 'mean_reversion', 'bull_bb_std_mult': 2.949944018713863, 'bull_rsi_os': 13, 'bull_rsi_ob': 62, 'bull_adx_thresh': 18.894741020562034, 'bull_atr_min_pct': 0.000275035155566262, 'bull_atr_max_pct': 0.12706432969340392, 'bull_tp_mult': 1.2329905680707525, 'bull_tsl_mult': 0.2565265111228904, 'bull_time_stop': 215, 'bull_use_sma': False, 'bull_use_ema': True, 'bull_use_atr': False, 'bull_use_adx': False, 'bull_use_spike': False, 'bull_rsi_required': False, 'bear_strategy': 'mean_reversion', 'bear_bb_std_mult': 3.496670808860456, 'bear_rsi_os': 39, 'bear_rsi_ob': 89, 'bear_adx_thresh': 10.849198092076273, 'bear_atr_min_pct': 0.014723497181201518, 'bear_atr_max_pct': 0.04765689016138164, 'bear_tp_mult': 2.9215825910996847, 'bear_tsl_mult': 0.8047818050145912, 'bear_time_stop': 152, 'bear_use_sma': True, 'bear_use_ema': False, 'bear_use_atr': False, 'bear_use_adx': False, 'bear_use_spike': True, 'bear_rsi_required': False, 'sideways_strategy': 'mean_reversion', 'sideways_bb_std_mult': 2.4894598927763605, 'sideways_rsi_os': 5, 'sideways_rsi_ob': 52, 'sideways_adx_thresh': 16.240235869875868, 'sideways_atr_min_pct': 0.0010432957137881077, 'sideways_atr_max_pct': 0.05777276208583677, 'sideways_tp_mult': 1.2542817251873521, 'sideways_tsl_mult': 0.5722482244310269, 'sideways_time_stop': 73, 'sideways_use_sma': True, 'sideways_use_ema': False, 'sideways_use_atr': True, 'sideways_use_adx': False, 'sideways_use_spike': True, 'sideways_rsi_required': False}.
[I 2025-09-01 09:17:42,161] Trial 70 finished with values: [-1000000000.0, 1000000000.0] and parameters: {'p_sma': 57, 'p_std': 50, 'p_atr': 27, 'p_adx': 19, 'rsi_period': 41, 'ema1': 8, 'ema2': 19, 'slip_atr_k': 0.2119401561968678, 'slip_spread_k': 0.7167848611028577, 'spread_hl_frac': 0.03938591175818143, 'bb_std_mult': 3.592697695998461, 'rsi_os': 9, 'rsi_ob': 71, 'vol_spike': 0.2299587348346348, 'adx_thresh': 16.700998599148384, 'atr_min_pct': 0.018778982648971383, 'atr_max_pct': 0.03641191585164233, 'tp_mult': 1.5631548807513371, 'tsl_mult': 0.08143538392091434, 'strategy': 'breakout', 'time_stop': 196, 'use_sma': False, 'use_atr': False, 'use_adx': False, 'use_ema': False, 'use_spike': True, 'rsi_required': False, 'edge_k': 0.8084515667961027, 'edge_cap': 0.28232395485976963, 'bull_strategy': 'mean_reversion', 'bull_bb_std_mult': 2.4044638049379636, 'bull_rsi_os': 13, 'bull_rsi_ob': 61, 'bull_adx_thresh': 15.162781614905718, 'bull_atr_min_pct': 0.00016904322000474274, 'bull_atr_max_pct': 0.11387211616808594, 'bull_tp_mult': 1.3855039153471966, 'bull_tsl_mult': 0.2644626686615875, 'bull_time_stop': 220, 'bull_use_sma': False, 'bull_use_ema': True, 'bull_use_atr': False, 'bull_use_adx': False, 'bull_use_spike': False, 'bull_rsi_required': False, 'bear_strategy': 'mean_reversion', 'bear_bb_std_mult': 2.837819629512004, 'bear_rsi_os': 39, 'bear_rsi_ob': 74, 'bear_adx_thresh': 27.137263540681438, 'bear_atr_min_pct': 0.016830342595356415, 'bear_atr_max_pct': 0.03865032917313207, 'bear_tp_mult': 2.8314406371025114, 'bear_tsl_mult': 0.7955098384937112, 'bear_time_stop': 52, 'bear_use_sma': True, 'bear_use_ema': False, 'bear_use_atr': False, 'bear_use_adx': False, 'bear_use_spike': True, 'bear_rsi_required': False, 'sideways_strategy': 'mean_reversion', 'sideways_bb_std_mult': 2.4615492218910093, 'sideways_rsi_os': 10, 'sideways_rsi_ob': 95, 'sideways_adx_thresh': 16.128652965204303, 'sideways_atr_min_pct': 0.003481273567848801, 'sideways_atr_max_pct': 0.04286956814206013, 'sideways_tp_mult': 1.370687282764727, 'sideways_tsl_mult': 0.5870695438607274, 'sideways_time_stop': 113, 'sideways_use_sma': True, 'sideways_use_ema': False, 'sideways_use_atr': True, 'sideways_use_adx': False, 'sideways_use_spike': True, 'sideways_rsi_required': True}.
[I 2025-09-01 09:17:43,069] Trial 73 finished with values: [-1000000000.0, 1000000000.0] and parameters: {'p_sma': 13, 'p_std': 23, 'p_atr': 28, 'p_adx': 15, 'rsi_period': 76, 'ema1': 9, 'ema2': 56, 'slip_atr_k': 0.05050688890020473, 'slip_spread_k': 0.19033833519348525, 'spread_hl_frac': 0.00624805080282715, 'bb_std_mult': 3.5112730752102657, 'rsi_os': 37, 'rsi_ob': 52, 'vol_spike': 0.22810943955902407, 'adx_thresh': 22.804331682611988, 'atr_min_pct': 0.00675563889777993, 'atr_max_pct': 0.10179792087735393, 'tp_mult': 1.1315590865333462, 'tsl_mult': 0.20659226110363177, 'strategy': 'mean_reversion', 'time_stop': 191, 'use_sma': True, 'use_atr': True, 'use_adx': True, 'use_ema': False, 'use_spike': False, 'rsi_required': False, 'edge_k': 0.835476182390724, 'edge_cap': 0.9484859958730575, 'bull_strategy': 'mean_reversion', 'bull_bb_std_mult': 1.6888292012819341, 'bull_rsi_os': 10, 'bull_rsi_ob': 80, 'bull_adx_thresh': 12.150053916756775, 'bull_atr_min_pct': 0.014699916505538785, 'bull_atr_max_pct': 0.11309157059332653, 'bull_tp_mult': 1.1439324253148186, 'bull_tsl_mult': 0.4194253186894581, 'bull_time_stop': 168, 'bull_use_sma': False, 'bull_use_ema': False, 'bull_use_atr': False, 'bull_use_adx': False, 'bull_use_spike': True, 'bull_rsi_required': False, 'bear_strategy': 'mean_reversion', 'bear_bb_std_mult': 2.85301640285722, 'bear_rsi_os': 28, 'bear_rsi_ob': 74, 'bear_adx_thresh': 30.363201417621333, 'bear_atr_min_pct': 0.016794460937745413, 'bear_atr_max_pct': 0.08784906323885128, 'bear_tp_mult': 2.619672666225482, 'bear_tsl_mult': 0.19450599389003592, 'bear_time_stop': 20, 'bear_use_sma': False, 'bear_use_ema': False, 'bear_use_atr': False, 'bear_use_adx': True, 'bear_use_spike': True, 'bear_rsi_required': True, 'sideways_strategy': 'breakout', 'sideways_bb_std_mult': 1.9706834885385505, 'sideways_rsi_os': 44, 'sideways_rsi_ob': 86, 'sideways_adx_thresh': 33.15065405721634, 'sideways_atr_min_pct': 0.003316482942718805, 'sideways_atr_max_pct': 0.040365268745993756, 'sideways_tp_mult': 1.0134874582304696, 'sideways_tsl_mult': 0.7950926003635572, 'sideways_time_stop': 286, 'sideways_use_sma': False, 'sideways_use_ema': True, 'sideways_use_atr': True, 'sideways_use_adx': True, 'sideways_use_spike': False, 'sideways_rsi_required': True}.
