[I 2025-09-01 09:48:41,685] Trial 262 finished with values: [-0.04086297804325023, 0.04070447650384495] and parameters: {'p_sma': 17, 'p_std': 30, 'p_atr': 8, 'p_adx': 25, 'rsi_period': 24, 'ema1': 29, 'ema2': 18, 'slip_atr_k': 0.048399432850273434, 'slip_spread_k': 0.24306504243065047, 'spread_hl_frac': 0.02078992623102649, 'bb_std_mult': 1.4917708542909995, 'rsi_os': 40, 'rsi_ob': 47, 'vol_spike': 0.07269148626562229, 'adx_thresh': 32.409077195837405, 'atr_min_pct': 0.0023725978460548813, 'atr_max_pct': 0.11198389051476236, 'tp_mult': 2.678112743710362, 'tsl_mult': 0.7285819091336441, 'strategy': 'breakout', 'time_stop': 248, 'use_sma': True, 'use_atr': False, 'use_adx': False, 'use_ema': True, 'use_spike': True, 'rsi_required': True, 'edge_k': 1.2623505585088983, 'edge_cap': 0.6027634793692834, 'bull_strategy': 'mean_reversion', 'bull_bb_std_mult': 2.787678140282645, 'bull_rsi_os': 12, 'bull_rsi_ob': 89, 'bull_adx_thresh': 12.202760298866565, 'bull_atr_min_pct': 0.0007957521383042945, 'bull_atr_max_pct': 0.08778616025590907, 'bull_tp_mult': 2.7379609760327472, 'bull_tsl_mult': 0.4297759632898496, 'bull_time_stop': 149, 'bull_use_sma': True, 'bull_use_ema': False, 'bull_use_atr': True, 'bull_use_adx': False, 'bull_use_spike': True, 'bull_rsi_required': True, 'bear_strategy': 'mean_reversion', 'bear_bb_std_mult': 0.9267218041760117, 'bear_rsi_os': 17, 'bear_rsi_ob': 80, 'bear_adx_thresh': 22.930468313436613, 'bear_atr_min_pct': 0.007668672425767225, 'bear_atr_max_pct': 0.030002451910127625, 'bear_tp_mult': 1.1685106501040838, 'bear_tsl_mult': 0.9344875140368362, 'bear_time_stop': 74, 'bear_use_sma': False, 'bear_use_ema': False, 'bear_use_atr': True, 'bear_use_adx': True, 'bear_use_spike': False, 'bear_rsi_required': False, 'sideways_strategy': 'breakout', 'sideways_bb_std_mult': 2.853523275801314, 'sideways_rsi_os': 13, 'sideways_rsi_ob': 81, 'sideways_adx_thresh': 22.131983486940015, 'sideways_atr_min_pct': 0.009237063204590121, 'sideways_atr_max_pct': 0.06987054902019514, 'sideways_tp_mult': 2.4832426065725812, 'sideways_tsl_mult': 0.6743568175061859, 'sideways_time_stop': 202, 'sideways_use_sma': True, 'sideways_use_ema': False, 'sideways_use_atr': False, 'sideways_use_adx': False, 'sideways_use_spike': False, 'sideways_rsi_required': False}.
[I 2025-09-01 09:48:43,008] Trial 259 finished with values: [-1000000000.0, 1000000000.0] and parameters: {'p_sma': 17, 'p_std': 44, 'p_atr': 18, 'p_adx': 26, 'rsi_period': 62, 'ema1': 13, 'ema2': 18, 'slip_atr_k': 0.026961593951319793, 'slip_spread_k': 0.15741088563074573, 'spread_hl_frac': 0.0301451792333039, 'bb_std_mult': 1.434328333515534, 'rsi_os': 40, 'rsi_ob': 67, 'vol_spike': 0.1063797970483881, 'adx_thresh': 32.03050193599379, 'atr_min_pct': 0.00452528184266552, 'atr_max_pct': 0.09736628681549638, 'tp_mult': 2.0770609596454643, 'tsl_mult': 0.7160139034545299, 'strategy': 'breakout', 'time_stop': 98, 'use_sma': True, 'use_atr': False, 'use_adx': False, 'use_ema': True, 'use_spike': True, 'rsi_required': False, 'edge_k': 0.5618181002252751, 'edge_cap': 0.5619132737656038, 'bull_strategy': 'mean_reversion', 'bull_bb_std_mult': 3.5999203255183563, 'bull_rsi_os': 12, 'bull_rsi_ob': 75, 'bull_adx_thresh': 22.03828960378879, 'bull_atr_min_pct': 0.0028507736945883235, 'bull_atr_max_pct': 0.09179863520978827, 'bull_tp_mult': 2.674367011621177, 'bull_tsl_mult': 0.4308380283988027, 'bull_time_stop': 177, 'bull_use_sma': True, 'bull_use_ema': False, 'bull_use_atr': True, 'bull_use_adx': False, 'bull_use_spike': True, 'bull_rsi_required': False, 'bear_strategy': 'breakout', 'bear_bb_std_mult': 1.0090817691067646, 'bear_rsi_os': 31, 'bear_rsi_ob': 64, 'bear_adx_thresh': 24.885662454446564, 'bear_atr_min_pct': 0.012310458089419612, 'bear_atr_max_pct': 0.04073476071090201, 'bear_tp_mult': 1.1772140157519593, 'bear_tsl_mult': 0.47907681298704985, 'bear_time_stop': 59, 'bear_use_sma': True, 'bear_use_ema': False, 'bear_use_atr': True, 'bear_use_adx': False, 'bear_use_spike': False, 'bear_rsi_required': False, 'sideways_strategy': 'mean_reversion', 'sideways_bb_std_mult': 1.7152346426819458, 'sideways_rsi_os': 54, 'sideways_rsi_ob': 91, 'sideways_adx_thresh': 23.46982069930378, 'sideways_atr_min_pct': 0.009646525871018293, 'sideways_atr_max_pct': 0.04482929168753413, 'sideways_tp_mult': 2.484116573889089, 'sideways_tsl_mult': 0.4565878176529366, 'sideways_time_stop': 41, 'sideways_use_sma': True, 'sideways_use_ema': True, 'sideways_use_atr': True, 'sideways_use_adx': False, 'sideways_use_spike': True, 'sideways_rsi_required': False}.
[I 2025-09-01 09:49:19,308] Trial 263 finished with values: [-1000000000.0, 1000000000.0] and parameters: {'p_sma': 17, 'p_std': 50, 'p_atr': 8, 'p_adx': 25, 'rsi_period': 56, 'ema1': 19, 'ema2': 55, 'slip_atr_k': 0.05152336785145867, 'slip_spread_k': 0.25284818008105747, 'spread_hl_frac': 0.0304861480904846, 'bb_std_mult': 1.4466189116824617, 'rsi_os': 40, 'rsi_ob': 90, 'vol_spike': 0.05574819285985584, 'adx_thresh': 32.06725150497266, 'atr_min_pct': 0.009557026006852928, 'atr_max_pct': 0.11230777307334605, 'tp_mult': 1.2127571384748528, 'tsl_mult': 0.691162320097295, 'strategy': 'breakout', 'time_stop': 249, 'use_sma': True, 'use_atr': True, 'use_adx': False, 'use_ema': True, 'use_spike': True, 'rsi_required': True, 'edge_k': 1.276234367213617, 'edge_cap': 0.5724038158401881, 'bull_strategy': 'mean_reversion', 'bull_bb_std_mult': 2.7955980322290412, 'bull_rsi_os': 40, 'bull_rsi_ob': 78, 'bull_adx_thresh': 8.217667684361974, 'bull_atr_min_pct': 0.028759025535310456, 'bull_atr_max_pct': 0.10995094497798394, 'bull_tp_mult': 2.6871723322430543, 'bull_tsl_mult': 0.40641192764484324, 'bull_time_stop': 282, 'bull_use_sma': True, 'bull_use_ema': False, 'bull_use_atr': True, 'bull_use_adx': False, 'bull_use_spike': False, 'bull_rsi_required': True, 'bear_strategy': 'mean_reversion', 'bear_bb_std_mult': 0.9149831185737509, 'bear_rsi_os': 19, 'bear_rsi_ob': 82, 'bear_adx_thresh': 23.127610854514767, 'bear_atr_min_pct': 0.009390041952087957, 'bear_atr_max_pct': 0.0385848931245128, 'bear_tp_mult': 1.2537472048363634, 'bear_tsl_mult': 0.8634733528494623, 'bear_time_stop': 175, 'bear_use_sma': True, 'bear_use_ema': False, 'bear_use_atr': True, 'bear_use_adx': False, 'bear_use_spike': False, 'bear_rsi_required': False, 'sideways_strategy': 'mean_reversion', 'sideways_bb_std_mult': 1.0906453438998653, 'sideways_rsi_os': 14, 'sideways_rsi_ob': 91, 'sideways_adx_thresh': 24.336984132133537, 'sideways_atr_min_pct': 0.01049682282408522, 'sideways_atr_max_pct': 0.06918981358441453, 'sideways_tp_mult': 2.49876767554277, 'sideways_tsl_mult': 0.46675211035155795, 'sideways_time_stop': 278, 'sideways_use_sma': True, 'sideways_use_ema': False, 'sideways_use_atr': False, 'sideways_use_adx': False, 'sideways_use_spike': False, 'sideways_rsi_required': False}.
[I 2025-09-01 09:49:20,100] Trial 266 finished with values: [-1000000000.0, 1000000000.0] and parameters: {'p_sma': 15, 'p_std': 24, 'p_atr': 17, 'p_adx': 25, 'rsi_period': 34, 'ema1': 19, 'ema2': 50, 'slip_atr_k': 0.05177419757371373, 'slip_spread_k': 0.6772607824490577, 'spread_hl_frac': 0.029557590409184372, 'bb_std_mult': 3.1407059790802663, 'rsi_os': 41, 'rsi_ob': 79, 'vol_spike': 0.052751835054586305, 'adx_thresh': 33.11389140997783, 'atr_min_pct': 0.01756930619530323, 'atr_max_pct': 0.12943985051686693, 'tp_mult': 1.4089982254352889, 'tsl_mult': 0.6886879013203785, 'strategy': 'mean_reversion', 'time_stop': 84, 'use_sma': False, 'use_atr': True, 'use_adx': False, 'use_ema': True, 'use_spike': True, 'rsi_required': True, 'edge_k': 1.3439063464370395, 'edge_cap': 0.5813017318105324, 'bull_strategy': 'mean_reversion', 'bull_bb_std_mult': 2.131421659363197, 'bull_rsi_os': 48, 'bull_rsi_ob': 78, 'bull_adx_thresh': 6.185117861907473, 'bull_atr_min_pct': 0.029161658412374496, 'bull_atr_max_pct': 0.08344647534852195, 'bull_tp_mult': 2.6008595116402486, 'bull_tsl_mult': 0.3693944035887639, 'bull_time_stop': 125, 'bull_use_sma': True, 'bull_use_ema': True, 'bull_use_atr': True, 'bull_use_adx': True, 'bull_use_spike': False, 'bull_rsi_required': True, 'bear_strategy': 'mean_reversion', 'bear_bb_std_mult': 0.9039030894390092, 'bear_rsi_os': 55, 'bear_rsi_ob': 84, 'bear_adx_thresh': 24.434184144832916, 'bear_atr_min_pct': 0.001997647362829714, 'bear_atr_max_pct': 0.02790942795196207, 'bear_tp_mult': 1.2459395771852277, 'bear_tsl_mult': 0.5211030199640524, 'bear_time_stop': 208, 'bear_use_sma': True, 'bear_use_ema': False, 'bear_use_atr': True, 'bear_use_adx': False, 'bear_use_spike': False, 'bear_rsi_required': False, 'sideways_strategy': 'mean_reversion', 'sideways_bb_std_mult': 2.122012558673436, 'sideways_rsi_os': 53, 'sideways_rsi_ob': 58, 'sideways_adx_thresh': 24.40182409025492, 'sideways_atr_min_pct': 0.010583655731140035, 'sideways_atr_max_pct': 0.06883641437354618, 'sideways_tp_mult': 2.405755351820237, 'sideways_tsl_mult': 0.47828710107202504, 'sideways_time_stop': 218, 'sideways_use_sma': True, 'sideways_use_ema': False, 'sideways_use_atr': False, 'sideways_use_adx': True, 'sideways_use_spike': False, 'sideways_rsi_required': False}.
[I 2025-09-01 09:49:20,679] Trial 264 finished with values: [-0.022559002941732298, 0.022327923916029425] and parameters: {'p_sma': 16, 'p_std': 7, 'p_atr': 10, 'p_adx': 25, 'rsi_period': 32, 'ema1': 29, 'ema2': 15, 'slip_atr_k': 0.05270379104547303, 'slip_spread_k': 0.06003082436803131, 'spread_hl_frac': 0.007924887078740037, 'bb_std_mult': 2.2936874476193116, 'rsi_os': 41, 'rsi_ob': 84, 'vol_spike': 0.05534350786787771, 'adx_thresh': 31.922997856245676, 'atr_min_pct': 0.009381534196162614, 'atr_max_pct': 0.09169347332272261, 'tp_mult': 2.0801644249351967, 'tsl_mult': 0.6877228399299691, 'strategy': 'mean_reversion', 'time_stop': 252, 'use_sma': False, 'use_atr': True, 'use_adx': False, 'use_ema': True, 'use_spike': True, 'rsi_required': True, 'edge_k': 1.2627628923601113, 'edge_cap': 0.5781748289868064, 'bull_strategy': 'mean_reversion', 'bull_bb_std_mult': 3.5195195076003385, 'bull_rsi_os': 20, 'bull_rsi_ob': 71, 'bull_adx_thresh': 6.220396728551066, 'bull_atr_min_pct': 0.0008909600722631663, 'bull_atr_max_pct': 0.11065823691571329, 'bull_tp_mult': 2.6824150784431953, 'bull_tsl_mult': 0.3705801442110203, 'bull_time_stop': 224, 'bull_use_sma': True, 'bull_use_ema': True, 'bull_use_atr': True, 'bull_use_adx': True, 'bull_use_spike': False, 'bull_rsi_required': True, 'bear_strategy': 'mean_reversion', 'bear_bb_std_mult': 0.926027501172301, 'bear_rsi_os': 25, 'bear_rsi_ob': 80, 'bear_adx_thresh': 28.5929311993385, 'bear_atr_min_pct': 0.007726701926673631, 'bear_atr_max_pct': 0.02974343448498585, 'bear_tp_mult': 1.24279054763564, 'bear_tsl_mult': 0.9890276146665942, 'bear_time_stop': 290, 'bear_use_sma': True, 'bear_use_ema': False, 'bear_use_atr': True, 'bear_use_adx': False, 'bear_use_spike': False, 'bear_rsi_required': False, 'sideways_strategy': 'mean_reversion', 'sideways_bb_std_mult': 2.1185807957235196, 'sideways_rsi_os': 34, 'sideways_rsi_ob': 83, 'sideways_adx_thresh': 32.38189255759177, 'sideways_atr_min_pct': 0.008661913650699266, 'sideways_atr_max_pct': 0.06965093481147117, 'sideways_tp_mult': 2.4806141808744493, 'sideways_tsl_mult': 0.4784779285223949, 'sideways_time_stop': 261, 'sideways_use_sma': True, 'sideways_use_ema': False, 'sideways_use_atr': False, 'sideways_use_adx': True, 'sideways_use_spike': False, 'sideways_rsi_required': False}.
[I 2025-09-01 09:49:21,395] Trial 265 finished with values: [-1000000000.0, 1000000000.0] and parameters: {'p_sma': 16, 'p_std': 55, 'p_atr': 20, 'p_adx': 24, 'rsi_period': 67, 'ema1': 19, 'ema2': 15, 'slip_atr_k': 0.05182037565424018, 'slip_spread_k': 0.10533766747571327, 'spread_hl_frac': 0.008115838015790338, 'bb_std_mult': 1.590850723160984, 'rsi_os': 42, 'rsi_ob': 68, 'vol_spike': 0.05584098384668369, 'adx_thresh': 32.01462098155905, 'atr_min_pct': 0.01761268559228309, 'atr_max_pct': 0.021751564134869193, 'tp_mult': 2.08288350607757, 'tsl_mult': 0.697694255046066, 'strategy': 'mean_reversion', 'time_stop': 78, 'use_sma': False, 'use_atr': True, 'use_adx': False, 'use_ema': True, 'use_spike': True, 'rsi_required': True, 'edge_k': 0.9853952722972061, 'edge_cap': 0.5792172146274686, 'bull_strategy': 'mean_reversion', 'bull_bb_std_mult': 2.140119668587231, 'bull_rsi_os': 47, 'bull_rsi_ob': 71, 'bull_adx_thresh': 5.098520382599928, 'bull_atr_min_pct': 0.028060488896637606, 'bull_atr_max_pct': 0.09212562816734104, 'bull_tp_mult': 2.674989112550484, 'bull_tsl_mult': 0.3673804974168019, 'bull_time_stop': 6, 'bull_use_sma': True, 'bull_use_ema': True, 'bull_use_atr': True, 'bull_use_adx': True, 'bull_use_spike': False, 'bull_rsi_required': True, 'bear_strategy': 'mean_reversion', 'bear_bb_std_mult': 0.9132609727357213, 'bear_rsi_os': 21, 'bear_rsi_ob': 70, 'bear_adx_thresh': 24.35010801345818, 'bear_atr_min_pct': 0.011834177501344252, 'bear_atr_max_pct': 0.09394075953329363, 'bear_tp_mult': 1.2453511405658264, 'bear_tsl_mult': 0.352132831589551, 'bear_time_stop': 211, 'bear_use_sma': True, 'bear_use_ema': False, 'bear_use_atr': True, 'bear_use_adx': False, 'bear_use_spike': False, 'bear_rsi_required': False, 'sideways_strategy': 'mean_reversion', 'sideways_bb_std_mult': 3.385567268887316, 'sideways_rsi_os': 34, 'sideways_rsi_ob': 90, 'sideways_adx_thresh': 32.23231399055175, 'sideways_atr_min_pct': 0.01102068396349843, 'sideways_atr_max_pct': 0.07498850105790268, 'sideways_tp_mult': 2.4083853462075413, 'sideways_tsl_mult': 0.4655693001652588, 'sideways_time_stop': 292, 'sideways_use_sma': True, 'sideways_use_ema': False, 'sideways_use_atr': False, 'sideways_use_adx': True, 'sideways_use_spike': False, 'sideways_rsi_required': False}.
[I 2025-09-01 09:49:59,264] Trial 267 finished with values: [-0.07160806403535047, 0.07132198805821278] and parameters: {'p_sma': 16, 'p_std': 8, 'p_atr': 22, 'p_adx': 27, 'rsi_period': 20, 'ema1': 17, 'ema2': 31, 'slip_atr_k': 0.053937307737833354, 'slip_spread_k': 0.6767685362989847, 'spread_hl_frac': 0.029338100801048983, 'bb_std_mult': 1.5838622305762178, 'rsi_os': 42, 'rsi_ob': 55, 'vol_spike': 0.13372132655217303, 'adx_thresh': 16.358173735693327, 'atr_min_pct': 0.005507732855061282, 'atr_max_pct': 0.13971234638222324, 'tp_mult': 2.0214160041247164, 'tsl_mult': 0.689301736645628, 'strategy': 'mean_reversion', 'time_stop': 262, 'use_sma': False, 'use_atr': True, 'use_adx': False, 'use_ema': True, 'use_spike': False, 'rsi_required': True, 'edge_k': 0.9940741796127787, 'edge_cap': 0.5397583267216122, 'bull_strategy': 'mean_reversion', 'bull_bb_std_mult': 1.5724974950170627, 'bull_rsi_os': 30, 'bull_rsi_ob': 45, 'bull_adx_thresh': 5.027614524101885, 'bull_atr_min_pct': 0.0021564323870153983, 'bull_atr_max_pct': 0.01705687107645712, 'bull_tp_mult': 2.8188206057295564, 'bull_tsl_mult': 0.3690525117289515, 'bull_time_stop': 102, 'bull_use_sma': True, 'bull_use_ema': True, 'bull_use_atr': True, 'bull_use_adx': True, 'bull_use_spike': False, 'bull_rsi_required': True, 'bear_strategy': 'mean_reversion', 'bear_bb_std_mult': 0.8508858311051823, 'bear_rsi_os': 55, 'bear_rsi_ob': 62, 'bear_adx_thresh': 24.348916481719023, 'bear_atr_min_pct': 0.0018695079695411256, 'bear_atr_max_pct': 0.03564868442149914, 'bear_tp_mult': 2.722429957812964, 'bear_tsl_mult': 0.34422205315684695, 'bear_time_stop': 287, 'bear_use_sma': True, 'bear_use_ema': False, 'bear_use_atr': False, 'bear_use_adx': False, 'bear_use_spike': False, 'bear_rsi_required': False, 'sideways_strategy': 'mean_reversion', 'sideways_bb_std_mult': 0.9236592387593943, 'sideways_rsi_os': 53, 'sideways_rsi_ob': 90, 'sideways_adx_thresh': 9.479147566027615, 'sideways_atr_min_pct': 0.008631885343475929, 'sideways_atr_max_pct': 0.07488725736805835, 'sideways_tp_mult': 2.375218969624525, 'sideways_tsl_mult': 0.4861705882407066, 'sideways_time_stop': 31, 'sideways_use_sma': True, 'sideways_use_ema': False, 'sideways_use_atr': False, 'sideways_use_adx': True, 'sideways_use_spike': False, 'sideways_rsi_required': True}.
[I 2025-09-01 09:49:59,871] Trial 270 finished with values: [-1000000000.0, 1000000000.0] and parameters: {'p_sma': 18, 'p_std': 7, 'p_atr': 23, 'p_adx': 23, 'rsi_period': 22, 'ema1': 26, 'ema2': 43, 'slip_atr_k': 0.20493619400400745, 'slip_spread_k': 0.6909504002994163, 'spread_hl_frac': 0.018042452930058524, 'bb_std_mult': 1.558757034832384, 'rsi_os': 41, 'rsi_ob': 53, 'vol_spike': 0.08002297277668048, 'adx_thresh': 31.434813508912335, 'atr_min_pct': 0.01241928488959901, 'atr_max_pct': 0.08953277728940395, 'tp_mult': 1.6478084390313492, 'tsl_mult': 0.7507245239997508, 'strategy': 'breakout', 'time_stop': 263, 'use_sma': True, 'use_atr': False, 'use_adx': False, 'use_ema': True, 'use_spike': False, 'rsi_required': True, 'edge_k': 1.1798401694237575, 'edge_cap': 0.5363700225305291, 'bull_strategy': 'mean_reversion', 'bull_bb_std_mult': 1.2096677889240621, 'bull_rsi_os': 6, 'bull_rsi_ob': 46, 'bull_adx_thresh': 20.814941128231048, 'bull_atr_min_pct': 0.003813362303400618, 'bull_atr_max_pct': 0.06719565863678904, 'bull_tp_mult': 2.995510879651814, 'bull_tsl_mult': 0.3929747387359238, 'bull_time_stop': 105, 'bull_use_sma': True, 'bull_use_ema': False, 'bull_use_atr': True, 'bull_use_adx': False, 'bull_use_spike': False, 'bull_rsi_required': True, 'bear_strategy': 'mean_reversion', 'bear_bb_std_mult': 0.8338254389451035, 'bear_rsi_os': 40, 'bear_rsi_ob': 71, 'bear_adx_thresh': 5.000147084716254, 'bear_atr_min_pct': 0.005279365191687792, 'bear_atr_max_pct': 0.022851293025132433, 'bear_tp_mult': 1.2094960751698538, 'bear_tsl_mult': 0.9986962086075757, 'bear_time_stop': 286, 'bear_use_sma': True, 'bear_use_ema': False, 'bear_use_atr': False, 'bear_use_adx': False, 'bear_use_spike': False, 'bear_rsi_required': False, 'sideways_strategy': 'mean_reversion', 'sideways_bb_std_mult': 2.7967174065365974, 'sideways_rsi_os': 37, 'sideways_rsi_ob': 64, 'sideways_adx_thresh': 22.913677936360873, 'sideways_atr_min_pct': 0.008883636007050524, 'sideways_atr_max_pct': 0.07281225418523497, 'sideways_tp_mult': 2.446077524936977, 'sideways_tsl_mult': 0.18330189451335516, 'sideways_time_stop': 32, 'sideways_use_sma': True, 'sideways_use_ema': False, 'sideways_use_atr': False, 'sideways_use_adx': True, 'sideways_use_spike': False, 'sideways_rsi_required': True}.
[I 2025-09-01 09:50:00,185] Trial 269 finished with values: [-1000000000.0, 1000000000.0] and parameters: {'p_sma': 16, 'p_std': 32, 'p_atr': 18, 'p_adx': 23, 'rsi_period': 12, 'ema1': 16, 'ema2': 15, 'slip_atr_k': 0.20516264523523967, 'slip_spread_k': 0.684435810486658, 'spread_hl_frac': 0.011822148308078442, 'bb_std_mult': 2.2750825948175075, 'rsi_os': 42, 'rsi_ob': 49, 'vol_spike': 0.1337461107044886, 'adx_thresh': 31.508225587996932, 'atr_min_pct': 0.005566077958742525, 'atr_max_pct': 0.09157628516206817, 'tp_mult': 2.5463326481027067, 'tsl_mult': 0.7455810507325332, 'strategy': 'breakout', 'time_stop': 253, 'use_sma': True, 'use_atr': False, 'use_adx': False, 'use_ema': True, 'use_spike': False, 'rsi_required': True, 'edge_k': 1.1735525162821034, 'edge_cap': 0.5389442712613686, 'bull_strategy': 'mean_reversion', 'bull_bb_std_mult': 2.007677383690815, 'bull_rsi_os': 33, 'bull_rsi_ob': 61, 'bull_adx_thresh': 5.001371968212779, 'bull_atr_min_pct': 0.0036827480391696957, 'bull_atr_max_pct': 0.08771923801681548, 'bull_tp_mult': 2.816668450222954, 'bull_tsl_mult': 0.40249704990300667, 'bull_time_stop': 227, 'bull_use_sma': True, 'bull_use_ema': False, 'bull_use_atr': True, 'bull_use_adx': True, 'bull_use_spike': False, 'bull_rsi_required': True, 'bear_strategy': 'mean_reversion', 'bear_bb_std_mult': 0.838928973504847, 'bear_rsi_os': 21, 'bear_rsi_ob': 70, 'bear_adx_thresh': 5.745934281137345, 'bear_atr_min_pct': 0.006344725216950606, 'bear_atr_max_pct': 0.013581358111576451, 'bear_tp_mult': 1.1997591969085855, 'bear_tsl_mult': 0.35536050512262557, 'bear_time_stop': 287, 'bear_use_sma': True, 'bear_use_ema': False, 'bear_use_atr': False, 'bear_use_adx': False, 'bear_use_spike': False, 'bear_rsi_required': False, 'sideways_strategy': 'mean_reversion', 'sideways_bb_std_mult': 0.9455426690309909, 'sideways_rsi_os': 37, 'sideways_rsi_ob': 89, 'sideways_adx_thresh': 22.850208994903365, 'sideways_atr_min_pct': 0.008664948787064853, 'sideways_atr_max_pct': 0.07467496479750428, 'sideways_tp_mult': 2.385099411023444, 'sideways_tsl_mult': 0.18692451937767762, 'sideways_time_stop': 291, 'sideways_use_sma': True, 'sideways_use_ema': False, 'sideways_use_atr': False, 'sideways_use_adx': True, 'sideways_use_spike': False, 'sideways_rsi_required': True}.
