[I 2025-09-01 09:11:35,429] Trial 26 finished with values: [-1000000000.0, 1000000000.0] and parameters: {'p_sma': 12, 'p_std': 47, 'p_atr': 23, 'p_adx': 11, 'rsi_period': 26, 'ema1': 8, 'ema2': 51, 'slip_atr_k': 0.1688996064913912, 'slip_spread_k': 0.3126917601947013, 'spread_hl_frac': 0.03558721091126421, 'bb_std_mult': 2.308019433745492, 'rsi_os': 23, 'rsi_ob': 93, 'vol_spike': 0.2703528791856766, 'adx_thresh': 15.647359915050135, 'atr_min_pct': 0.005488205936470399, 'atr_max_pct': 0.11916262826647407, 'tp_mult': 2.2468248061664724, 'tsl_mult': 0.6208246511834825, 'strategy': 'breakout', 'time_stop': 284, 'use_sma': False, 'use_atr': False, 'use_adx': True, 'use_ema': True, 'use_spike': False, 'rsi_required': True, 'edge_k': 0.29497504994137347, 'edge_cap': 0.3977448778703737, 'bull_strategy': 'mean_reversion', 'bull_bb_std_mult': 1.053360959740187, 'bull_rsi_os': 30, 'bull_rsi_ob': 45, 'bull_adx_thresh': 14.253516679577453, 'bull_atr_min_pct': 0.012875086800122747, 'bull_atr_max_pct': 0.14940056243636934, 'bull_tp_mult': 1.5155702834446418, 'bull_tsl_mult': 0.28295850783814536, 'bull_time_stop': 251, 'bull_use_sma': False, 'bull_use_ema': True, 'bull_use_atr': False, 'bull_use_adx': False, 'bull_use_spike': True, 'bull_rsi_required': True, 'bear_strategy': 'breakout', 'bear_bb_std_mult': 2.969345515271986, 'bear_rsi_os': 18, 'bear_rsi_ob': 86, 'bear_adx_thresh': 29.994426064047097, 'bear_atr_min_pct': 0.028478765403563533, 'bear_atr_max_pct': 0.015522979422345484, 'bear_tp_mult': 2.075208895324203, 'bear_tsl_mult': 0.886464504482164, 'bear_time_stop': 112, 'bear_use_sma': True, 'bear_use_ema': False, 'bear_use_atr': True, 'bear_use_adx': False, 'bear_use_spike': True, 'bear_rsi_required': False, 'sideways_strategy': 'mean_reversion', 'sideways_bb_std_mult': 2.9119391421935212, 'sideways_rsi_os': 55, 'sideways_rsi_ob': 85, 'sideways_adx_thresh': 22.436928439519825, 'sideways_atr_min_pct': 0.004095987831987308, 'sideways_atr_max_pct': 0.08892482609313891, 'sideways_tp_mult': 1.891647273917133, 'sideways_tsl_mult': 0.8288738484353257, 'sideways_time_stop': 165, 'sideways_use_sma': False, 'sideways_use_ema': False, 'sideways_use_atr': False, 'sideways_use_adx': True, 'sideways_use_spike': False, 'sideways_rsi_required': False}.
[I 2025-09-01 09:11:36,156] Trial 25 finished with values: [-0.13291079193142452, 0.13286566450126777] and parameters: {'p_sma': 11, 'p_std': 31, 'p_atr': 23, 'p_adx': 11, 'rsi_period': 30, 'ema1': 9, 'ema2': 51, 'slip_atr_k': 0.16726549120424905, 'slip_spread_k': 0.29699522398195305, 'spread_hl_frac': 0.035114838657918666, 'bb_std_mult': 2.2718971203407237, 'rsi_os': 22, 'rsi_ob': 92, 'vol_spike': 0.29572756049470783, 'adx_thresh': 14.838606853892205, 'atr_min_pct': 0.006854049161676007, 'atr_max_pct': 0.11934270290217827, 'tp_mult': 2.193045071222256, 'tsl_mult': 0.9891640652560831, 'strategy': 'mean_reversion', 'time_stop': 233, 'use_sma': False, 'use_atr': True, 'use_adx': True, 'use_ema': False, 'use_spike': False, 'rsi_required': False, 'edge_k': 0.31891611062643316, 'edge_cap': 0.40272436145739005, 'bull_strategy': 'mean_reversion', 'bull_bb_std_mult': 2.15313129117532, 'bull_rsi_os': 30, 'bull_rsi_ob': 62, 'bull_adx_thresh': 15.272857222950947, 'bull_atr_min_pct': 0.014591748315944526, 'bull_atr_max_pct': 0.1498884510247529, 'bull_tp_mult': 1.378057355067834, 'bull_tsl_mult': 0.28815163623259465, 'bull_time_stop': 49, 'bull_use_sma': False, 'bull_use_ema': True, 'bull_use_atr': False, 'bull_use_adx': False, 'bull_use_spike': True, 'bull_rsi_required': False, 'bear_strategy': 'breakout', 'bear_bb_std_mult': 2.9291121988879723, 'bear_rsi_os': 54, 'bear_rsi_ob': 63, 'bear_adx_thresh': 29.924299472855616, 'bear_atr_min_pct': 0.00024670623777571683, 'bear_atr_max_pct': 0.034509062573277294, 'bear_tp_mult': 2.0615693205528154, 'bear_tsl_mult': 0.8666626159674007, 'bear_time_stop': 120, 'bear_use_sma': False, 'bear_use_ema': False, 'bear_use_atr': False, 'bear_use_adx': False, 'bear_use_spike': True, 'bear_rsi_required': True, 'sideways_strategy': 'mean_reversion', 'sideways_bb_std_mult': 3.012563953902906, 'sideways_rsi_os': 8, 'sideways_rsi_ob': 85, 'sideways_adx_thresh': 9.575730238752376, 'sideways_atr_min_pct': 0.00442014882269481, 'sideways_atr_max_pct': 0.10182302580854485, 'sideways_tp_mult': 1.843487475988237, 'sideways_tsl_mult': 0.8388295080210961, 'sideways_time_stop': 153, 'sideways_use_sma': False, 'sideways_use_ema': True, 'sideways_use_atr': False, 'sideways_use_adx': True, 'sideways_use_spike': False, 'sideways_rsi_required': False}.
[I 2025-09-01 09:11:36,371] Trial 30 finished with values: [-1000000000.0, 1000000000.0] and parameters: {'p_sma': 11, 'p_std': 51, 'p_atr': 28, 'p_adx': 11, 'rsi_period': 50, 'ema1': 7, 'ema2': 49, 'slip_atr_k': 0.13864349163138567, 'slip_spread_k': 0.26369520383728084, 'spread_hl_frac': 0.037067707699333374, 'bb_std_mult': 2.2550901262181924, 'rsi_os': 55, 'rsi_ob': 54, 'vol_spike': 0.2632951890345685, 'adx_thresh': 13.712851703664446, 'atr_min_pct': 0.02375345301332804, 'atr_max_pct': 0.14980587340471319, 'tp_mult': 2.9599317612374296, 'tsl_mult': 0.4321489389053205, 'strategy': 'mean_reversion', 'time_stop': 168, 'use_sma': True, 'use_atr': True, 'use_adx': True, 'use_ema': True, 'use_spike': True, 'rsi_required': False, 'edge_k': 0.9049993515864937, 'edge_cap': 0.6742168935030757, 'bull_strategy': 'mean_reversion', 'bull_bb_std_mult': 1.1702374327342298, 'bull_rsi_os': 33, 'bull_rsi_ob': 63, 'bull_adx_thresh': 11.663906601308673, 'bull_atr_min_pct': 0.006946347423662562, 'bull_atr_max_pct': 0.134504561897776, 'bull_tp_mult': 1.1963416463146797, 'bull_tsl_mult': 0.9832925086887772, 'bull_time_stop': 70, 'bull_use_sma': False, 'bull_use_ema': False, 'bull_use_atr': False, 'bull_use_adx': False, 'bull_use_spike': False, 'bull_rsi_required': False, 'bear_strategy': 'mean_reversion', 'bear_bb_std_mult': 2.9082493258727453, 'bear_rsi_os': 10, 'bear_rsi_ob': 63, 'bear_adx_thresh': 28.482450060342355, 'bear_atr_min_pct': 5.329383131926803e-05, 'bear_atr_max_pct': 0.07895612244234892, 'bear_tp_mult': 1.744231002320181, 'bear_tsl_mult': 0.792497267088647, 'bear_time_stop': 139, 'bear_use_sma': True, 'bear_use_ema': False, 'bear_use_atr': False, 'bear_use_adx': True, 'bear_use_spike': True, 'bear_rsi_required': False, 'sideways_strategy': 'breakout', 'sideways_bb_std_mult': 2.3084892589030224, 'sideways_rsi_os': 35, 'sideways_rsi_ob': 87, 'sideways_adx_thresh': 21.818377569459678, 'sideways_atr_min_pct': 0.003825481860613526, 'sideways_atr_max_pct': 0.10193208369502754, 'sideways_tp_mult': 1.3269124197951898, 'sideways_tsl_mult': 0.8207817382146768, 'sideways_time_stop': 40, 'sideways_use_sma': False, 'sideways_use_ema': True, 'sideways_use_atr': True, 'sideways_use_adx': False, 'sideways_use_spike': False, 'sideways_rsi_required': False}.
[I 2025-09-01 09:11:36,438] Trial 29 finished with values: [-1000000000.0, 1000000000.0] and parameters: {'p_sma': 11, 'p_std': 48, 'p_atr': 28, 'p_adx': 12, 'rsi_period': 51, 'ema1': 7, 'ema2': 49, 'slip_atr_k': 0.14008946013240886, 'slip_spread_k': 0.27501912015631347, 'spread_hl_frac': 0.04418762497185599, 'bb_std_mult': 2.2834527299384653, 'rsi_os': 55, 'rsi_ob': 54, 'vol_spike': 0.18162179546639362, 'adx_thresh': 5.270939409262051, 'atr_min_pct': 0.01237286624330065, 'atr_max_pct': 0.0858594354939715, 'tp_mult': 2.130898652489971, 'tsl_mult': 0.4707197793981843, 'strategy': 'mean_reversion', 'time_stop': 207, 'use_sma': True, 'use_atr': True, 'use_adx': True, 'use_ema': True, 'use_spike': True, 'rsi_required': False, 'edge_k': 0.8894702439740698, 'edge_cap': 0.2004117813118679, 'bull_strategy': 'mean_reversion', 'bull_bb_std_mult': 1.1356209253849872, 'bull_rsi_os': 33, 'bull_rsi_ob': 63, 'bull_adx_thresh': 11.33260773035202, 'bull_atr_min_pct': 0.00776926944591159, 'bull_atr_max_pct': 0.13204871357863174, 'bull_tp_mult': 1.6736351001659393, 'bull_tsl_mult': 0.9507075251722538, 'bull_time_stop': 50, 'bull_use_sma': False, 'bull_use_ema': False, 'bull_use_atr': False, 'bull_use_adx': False, 'bull_use_spike': False, 'bull_rsi_required': False, 'bear_strategy': 'mean_reversion', 'bear_bb_std_mult': 2.924546620254861, 'bear_rsi_os': 35, 'bear_rsi_ob': 65, 'bear_adx_thresh': 28.241080474133234, 'bear_atr_min_pct': 0.00012757569889115632, 'bear_atr_max_pct': 0.08013120732661881, 'bear_tp_mult': 1.8607298467016316, 'bear_tsl_mult': 0.7562686220798456, 'bear_time_stop': 134, 'bear_use_sma': True, 'bear_use_ema': False, 'bear_use_atr': False, 'bear_use_adx': True, 'bear_use_spike': True, 'bear_rsi_required': False, 'sideways_strategy': 'breakout', 'sideways_bb_std_mult': 2.3838069235921457, 'sideways_rsi_os': 36, 'sideways_rsi_ob': 87, 'sideways_adx_thresh': 31.250019729650276, 'sideways_atr_min_pct': 0.004179266476345051, 'sideways_atr_max_pct': 0.10021677723792514, 'sideways_tp_mult': 1.3180434762485944, 'sideways_tsl_mult': 0.8204195422282923, 'sideways_time_stop': 50, 'sideways_use_sma': False, 'sideways_use_ema': True, 'sideways_use_atr': True, 'sideways_use_adx': False, 'sideways_use_spike': False, 'sideways_rsi_required': False}.
[I 2025-09-01 09:11:36,562] Trial 32 finished with values: [-1000000000.0, 1000000000.0] and parameters: {'p_sma': 11, 'p_std': 31, 'p_atr': 28, 'p_adx': 23, 'rsi_period': 50, 'ema1': 7, 'ema2': 39, 'slip_atr_k': 0.13459324671917924, 'slip_spread_k': 0.14333037997194842, 'spread_hl_frac': 0.0438076692497328, 'bb_std_mult': 2.185087710957291, 'rsi_os': 55, 'rsi_ob': 86, 'vol_spike': 0.2418784877087308, 'adx_thresh': 8.116479159268756, 'atr_min_pct': 0.012651238682280517, 'atr_max_pct': 0.1068853368774903, 'tp_mult': 2.1514814408646785, 'tsl_mult': 0.4189576970534459, 'strategy': 'mean_reversion', 'time_stop': 182, 'use_sma': True, 'use_atr': True, 'use_adx': True, 'use_ema': False, 'use_spike': True, 'rsi_required': False, 'edge_k': 0.5261985724348675, 'edge_cap': 0.2103270014649511, 'bull_strategy': 'mean_reversion', 'bull_bb_std_mult': 1.162615242237488, 'bull_rsi_os': 32, 'bull_rsi_ob': 63, 'bull_adx_thresh': 11.724395277329378, 'bull_atr_min_pct': 0.007823604519844136, 'bull_atr_max_pct': 0.1347862350654072, 'bull_tp_mult': 2.278702460299049, 'bull_tsl_mult': 0.926013142819486, 'bull_time_stop': 80, 'bull_use_sma': False, 'bull_use_ema': False, 'bull_use_atr': False, 'bull_use_adx': False, 'bull_use_spike': False, 'bull_rsi_required': False, 'bear_strategy': 'mean_reversion', 'bear_bb_std_mult': 2.7743885169431857, 'bear_rsi_os': 38, 'bear_rsi_ob': 64, 'bear_adx_thresh': 27.968890440994958, 'bear_atr_min_pct': 0.019582437163720684, 'bear_atr_max_pct': 0.08082207907039024, 'bear_tp_mult': 1.834187176165035, 'bear_tsl_mult': 0.7769611509991079, 'bear_time_stop': 235, 'bear_use_sma': False, 'bear_use_ema': False, 'bear_use_atr': False, 'bear_use_adx': True, 'bear_use_spike': True, 'bear_rsi_required': True, 'sideways_strategy': 'breakout', 'sideways_bb_std_mult': 2.238837650934103, 'sideways_rsi_os': 35, 'sideways_rsi_ob': 89, 'sideways_adx_thresh': 30.967202252701796, 'sideways_atr_min_pct': 0.023869841131300012, 'sideways_atr_max_pct': 0.04145458939739676, 'sideways_tp_mult': 1.3471995912354928, 'sideways_tsl_mult': 0.23716720663950258, 'sideways_time_stop': 34, 'sideways_use_sma': False, 'sideways_use_ema': True, 'sideways_use_atr': True, 'sideways_use_adx': False, 'sideways_use_spike': False, 'sideways_rsi_required': False}.
[I 2025-09-01 09:12:16,955] Trial 31 finished with values: [-1000000000.0, 1000000000.0] and parameters: {'p_sma': 10, 'p_std': 31, 'p_atr': 12, 'p_adx': 23, 'rsi_period': 50, 'ema1': 7, 'ema2': 40, 'slip_atr_k': 0.13159683244937403, 'slip_spread_k': 0.057993791954247476, 'spread_hl_frac': 0.0436328133793811, 'bb_std_mult': 0.9600004682945024, 'rsi_os': 47, 'rsi_ob': 85, 'vol_spike': 0.1773380330766183, 'adx_thresh': 8.669701586321118, 'atr_min_pct': 0.011681634453319899, 'atr_max_pct': 0.10629767509162018, 'tp_mult': 1.7824319153618613, 'tsl_mult': 0.4161004805411503, 'strategy': 'mean_reversion', 'time_stop': 164, 'use_sma': True, 'use_atr': True, 'use_adx': True, 'use_ema': False, 'use_spike': True, 'rsi_required': False, 'edge_k': 0.49116167664218163, 'edge_cap': 0.20121841668394436, 'bull_strategy': 'mean_reversion', 'bull_bb_std_mult': 1.2325212361907338, 'bull_rsi_os': 33, 'bull_rsi_ob': 64, 'bull_adx_thresh': 11.212410166785286, 'bull_atr_min_pct': 0.007653447297366572, 'bull_atr_max_pct': 0.1326170706251012, 'bull_tp_mult': 2.2294954785455237, 'bull_tsl_mult': 0.8134567074458234, 'bull_time_stop': 50, 'bull_use_sma': False, 'bull_use_ema': False, 'bull_use_atr': False, 'bull_use_adx': False, 'bull_use_spike': False, 'bull_rsi_required': False, 'bear_strategy': 'mean_reversion', 'bear_bb_std_mult': 3.368279712441334, 'bear_rsi_os': 37, 'bear_rsi_ob': 64, 'bear_adx_thresh': 20.084706026220505, 'bear_atr_min_pct': 0.0002399018544273039, 'bear_atr_max_pct': 0.0829463802554304, 'bear_tp_mult': 1.8016988978808803, 'bear_tsl_mult': 0.7826781672807885, 'bear_time_stop': 255, 'bear_use_sma': False, 'bear_use_ema': False, 'bear_use_atr': False, 'bear_use_adx': True, 'bear_use_spike': True, 'bear_rsi_required': True, 'sideways_strategy': 'breakout', 'sideways_bb_std_mult': 2.3123722293788687, 'sideways_rsi_os': 13, 'sideways_rsi_ob': 76, 'sideways_adx_thresh': 31.268124262509758, 'sideways_atr_min_pct': 0.0038871886680853507, 'sideways_atr_max_pct': 0.10416070435057624, 'sideways_tp_mult': 1.3359744085417078, 'sideways_tsl_mult': 0.8990760007755616, 'sideways_time_stop': 38, 'sideways_use_sma': False, 'sideways_use_ema': True, 'sideways_use_atr': True, 'sideways_use_adx': False, 'sideways_use_spike': False, 'sideways_rsi_required': False}.
[I 2025-09-01 09:12:17,957] Trial 34 finished with values: [-1000000000.0, 1000000000.0] and parameters: {'p_sma': 54, 'p_std': 31, 'p_atr': 25, 'p_adx': 23, 'rsi_period': 62, 'ema1': 7, 'ema2': 39, 'slip_atr_k': 0.1048932300820714, 'slip_spread_k': 0.62545588974097, 'spread_hl_frac': 0.043982183729103494, 'bb_std_mult': 2.9212756729616274, 'rsi_os': 12, 'rsi_ob': 87, 'vol_spike': 0.2374144875272931, 'adx_thresh': 8.472465821262361, 'atr_min_pct': 0.017385941123979856, 'atr_max_pct': 0.1090162297295098, 'tp_mult': 1.8229718736172686, 'tsl_mult': 0.4127379954384936, 'strategy': 'mean_reversion', 'time_stop': 148, 'use_sma': False, 'use_atr': True, 'use_adx': True, 'use_ema': False, 'use_spike': False, 'rsi_required': False, 'edge_k': 0.18205438048132994, 'edge_cap': 0.34036574203201075, 'bull_strategy': 'mean_reversion', 'bull_bb_std_mult': 2.7875997104942427, 'bull_rsi_os': 25, 'bull_rsi_ob': 72, 'bull_adx_thresh': 22.1657224940596, 'bull_atr_min_pct': 0.02518951200948895, 'bull_atr_max_pct': 0.029594612720330253, 'bull_tp_mult': 2.2438960967876174, 'bull_tsl_mult': 0.34380316328098315, 'bull_time_stop': 186, 'bull_use_sma': False, 'bull_use_ema': True, 'bull_use_atr': False, 'bull_use_adx': True, 'bull_use_spike': True, 'bull_rsi_required': False, 'bear_strategy': 'mean_reversion', 'bear_bb_std_mult': 3.4061935705925865, 'bear_rsi_os': 41, 'bear_rsi_ob': 65, 'bear_adx_thresh': 32.65017087053329, 'bear_atr_min_pct': 0.01889782310559374, 'bear_atr_max_pct': 0.09058164058576407, 'bear_tp_mult': 1.2571129323267625, 'bear_tsl_mult': 0.9338806832008686, 'bear_time_stop': 167, 'bear_use_sma': False, 'bear_use_ema': False, 'bear_use_atr': False, 'bear_use_adx': True, 'bear_use_spike': True, 'bear_rsi_required': True, 'sideways_strategy': 'breakout', 'sideways_bb_std_mult': 1.8597752949401756, 'sideways_rsi_os': 44, 'sideways_rsi_ob': 75, 'sideways_adx_thresh': 8.962062104549501, 'sideways_atr_min_pct': 0.025672661205662545, 'sideways_atr_max_pct': 0.02660453291586197, 'sideways_tp_mult': 2.425058743540414, 'sideways_tsl_mult': 0.2509418499929177, 'sideways_time_stop': 98, 'sideways_use_sma': False, 'sideways_use_ema': True, 'sideways_use_atr': True, 'sideways_use_adx': False, 'sideways_use_spike': False, 'sideways_rsi_required': True}.
[I 2025-09-01 09:12:19,000] Trial 33 finished with values: [-1000000000.0, 1000000000.0] and parameters: {'p_sma': 49, 'p_std': 31, 'p_atr': 25, 'p_adx': 7, 'rsi_period': 37, 'ema1': 7, 'ema2': 40, 'slip_atr_k': 0.10743366151630568, 'slip_spread_k': 0.12161100576166162, 'spread_hl_frac': 0.04400136282379888, 'bb_std_mult': 0.9193558744453534, 'rsi_os': 15, 'rsi_ob': 85, 'vol_spike': 0.18736793831095727, 'adx_thresh': 5.298049069873464, 'atr_min_pct': 0.010387923656388494, 'atr_max_pct': 0.1099845288708255, 'tp_mult': 2.176037642151427, 'tsl_mult': 0.00026758926851799814, 'strategy': 'mean_reversion', 'time_stop': 210, 'use_sma': True, 'use_atr': True, 'use_adx': True, 'use_ema': False, 'use_spike': True, 'rsi_required': False, 'edge_k': 0.4939089422510943, 'edge_cap': 0.9931736812340901, 'bull_strategy': 'mean_reversion', 'bull_bb_std_mult': 2.783962319315475, 'bull_rsi_os': 24, 'bull_rsi_ob': 70, 'bull_adx_thresh': 21.744566269551395, 'bull_atr_min_pct': 0.024963890972581133, 'bull_atr_max_pct': 0.03468938205029338, 'bull_tp_mult': 2.245501162232394, 'bull_tsl_mult': 0.8850816265308308, 'bull_time_stop': 58, 'bull_use_sma': False, 'bull_use_ema': False, 'bull_use_atr': False, 'bull_use_adx': True, 'bull_use_spike': False, 'bull_rsi_required': False, 'bear_strategy': 'mean_reversion', 'bear_bb_std_mult': 3.440367878449896, 'bear_rsi_os': 34, 'bear_rsi_ob': 65, 'bear_adx_thresh': 21.44691331539514, 'bear_atr_min_pct': 0.019790867364683794, 'bear_atr_max_pct': 0.08334325898054241, 'bear_tp_mult': 1.2351050303441973, 'bear_tsl_mult': 0.27081456895022515, 'bear_time_stop': 249, 'bear_use_sma': False, 'bear_use_ema': False, 'bear_use_atr': False, 'bear_use_adx': True, 'bear_use_spike': True, 'bear_rsi_required': True, 'sideways_strategy': 'breakout', 'sideways_bb_std_mult': 1.8899833399811705, 'sideways_rsi_os': 44, 'sideways_rsi_ob': 75, 'sideways_adx_thresh': 30.965098958635544, 'sideways_atr_min_pct': 0.01698209504192229, 'sideways_atr_max_pct': 0.0431374804143628, 'sideways_tp_mult': 2.4010736635191696, 'sideways_tsl_mult': 0.17819545902519823, 'sideways_time_stop': 140, 'sideways_use_sma': False, 'sideways_use_ema': True, 'sideways_use_atr': True, 'sideways_use_adx': False, 'sideways_use_spike': True, 'sideways_rsi_required': True}.
[I 2025-09-01 09:12:19,499] Trial 35 finished with values: [-1000000000.0, 1000000000.0] and parameters: {'p_sma': 21, 'p_std': 38, 'p_atr': 21, 'p_adx': 7, 'rsi_period': 37, 'ema1': 7, 'ema2': 27, 'slip_atr_k': 0.09868008263286848, 'slip_spread_k': 0.6148959659943797, 'spread_hl_frac': 0.038398123294661364, 'bb_std_mult': 2.9613339221232904, 'rsi_os': 46, 'rsi_ob': 74, 'vol_spike': 0.1015353612645833, 'adx_thresh': 21.12674727623554, 'atr_min_pct': 0.017762551185112847, 'atr_max_pct': 0.12993622619798947, 'tp_mult': 1.846241501422526, 'tsl_mult': 0.23961265564334866, 'strategy': 'breakout', 'time_stop': 151, 'use_sma': False, 'use_atr': True, 'use_adx': True, 'use_ema': False, 'use_spike': False, 'rsi_required': True, 'edge_k': 0.1470745576519094, 'edge_cap': 0.9979346984472199, 'bull_strategy': 'mean_reversion', 'bull_bb_std_mult': 2.7551693988664105, 'bull_rsi_os': 26, 'bull_rsi_ob': 72, 'bull_adx_thresh': 17.659752122110024, 'bull_atr_min_pct': 0.01858086561363731, 'bull_atr_max_pct': 0.030613873407069003, 'bull_tp_mult': 1.17466383985414, 'bull_tsl_mult': 0.3310711532437742, 'bull_time_stop': 239, 'bull_use_sma': False, 'bull_use_ema': True, 'bull_use_atr': False, 'bull_use_adx': True, 'bull_use_spike': True, 'bull_rsi_required': True, 'bear_strategy': 'mean_reversion', 'bear_bb_std_mult': 3.3985114820044857, 'bear_rsi_os': 27, 'bear_rsi_ob': 72, 'bear_adx_thresh': 32.35622853045463, 'bear_atr_min_pct': 0.013974965133524354, 'bear_atr_max_pct': 0.11728304204035205, 'bear_tp_mult': 1.2621937546382622, 'bear_tsl_mult': 0.24517396945359482, 'bear_time_stop': 170, 'bear_use_sma': False, 'bear_use_ema': False, 'bear_use_atr': False, 'bear_use_adx': True, 'bear_use_spike': True, 'bear_rsi_required': True, 'sideways_strategy': 'breakout', 'sideways_bb_std_mult': 1.8116682119577578, 'sideways_rsi_os': 11, 'sideways_rsi_ob': 75, 'sideways_adx_thresh': 9.927556276556523, 'sideways_atr_min_pct': 0.009527369207861184, 'sideways_atr_max_pct': 0.026796039830924656, 'sideways_tp_mult': 2.409646940862809, 'sideways_tsl_mult': 0.8956829015485072, 'sideways_time_stop': 94, 'sideways_use_sma': False, 'sideways_use_ema': True, 'sideways_use_atr': True, 'sideways_use_adx': False, 'sideways_use_spike': True, 'sideways_rsi_required': True}.
