[I 2025-09-01 09:17:43,098] Trial 71 finished with values: [-0.034058494490537106, 0.03394369293350226] and parameters: {'p_sma': 34, 'p_std': 51, 'p_atr': 28, 'p_adx': 25, 'rsi_period': 41, 'ema1': 11, 'ema2': 30, 'slip_atr_k': 0.18698856361615576, 'slip_spread_k': 0.21081121406502795, 'spread_hl_frac': 0.038728593819381964, 'bb_std_mult': 3.5026081078396247, 'rsi_os': 41, 'rsi_ob': 95, 'vol_spike': 0.28462736039466774, 'adx_thresh': 16.510738749805398, 'atr_min_pct': 0.019198326330580627, 'atr_max_pct': 0.1454228020512136, 'tp_mult': 1.1142092919513975, 'tsl_mult': 0.08121288868901931, 'strategy': 'breakout', 'time_stop': 45, 'use_sma': True, 'use_atr': True, 'use_adx': False, 'use_ema': False, 'use_spike': True, 'rsi_required': False, 'edge_k': 1.1189997039212214, 'edge_cap': 0.943808665486987, 'bull_strategy': 'mean_reversion', 'bull_bb_std_mult': 1.6071417666352485, 'bull_rsi_os': 8, 'bull_rsi_ob': 83, 'bull_adx_thresh': 14.753737283494992, 'bull_atr_min_pct': 0.00017016614469120132, 'bull_atr_max_pct': 0.12671628693812864, 'bull_tp_mult': 1.3812376723862165, 'bull_tsl_mult': 0.4341119160075708, 'bull_time_stop': 219, 'bull_use_sma': False, 'bull_use_ema': False, 'bull_use_atr': False, 'bull_use_adx': False, 'bull_use_spike': False, 'bull_rsi_required': False, 'bear_strategy': 'mean_reversion', 'bear_bb_std_mult': 3.1817601334809056, 'bear_rsi_os': 28, 'bear_rsi_ob': 57, 'bear_adx_thresh': 10.705580299847583, 'bear_atr_min_pct': 0.014717515360962287, 'bear_atr_max_pct': 0.012201808145830856, 'bear_tp_mult': 1.5202041351934084, 'bear_tsl_mult': 0.9984577070234244, 'bear_time_stop': 116, 'bear_use_sma': False, 'bear_use_ema': False, 'bear_use_atr': False, 'bear_use_adx': True, 'bear_use_spike': True, 'bear_rsi_required': True, 'sideways_strategy': 'breakout', 'sideways_bb_std_mult': 1.9986960580491335, 'sideways_rsi_os': 9, 'sideways_rsi_ob': 53, 'sideways_adx_thresh': 33.67928521340252, 'sideways_atr_min_pct': 0.003444959678597005, 'sideways_atr_max_pct': 0.040577253793389806, 'sideways_tp_mult': 2.93258000647553, 'sideways_tsl_mult': 0.8013587853008202, 'sideways_time_stop': 282, 'sideways_use_sma': True, 'sideways_use_ema': True, 'sideways_use_atr': True, 'sideways_use_adx': False, 'sideways_use_spike': True, 'sideways_rsi_required': True}.
[I 2025-09-01 09:17:43,550] Trial 72 finished with values: [-1000000000.0, 1000000000.0] and parameters: {'p_sma': 13, 'p_std': 52, 'p_atr': 28, 'p_adx': 15, 'rsi_period': 63, 'ema1': 27, 'ema2': 56, 'slip_atr_k': 0.21645881647702658, 'slip_spread_k': 0.7145475769192828, 'spread_hl_frac': 0.020449253580249245, 'bb_std_mult': 1.2062350932431642, 'rsi_os': 41, 'rsi_ob': 52, 'vol_spike': 0.28661491167839603, 'adx_thresh': 7.694398414784824, 'atr_min_pct': 0.013226561756326903, 'atr_max_pct': 0.14938604357806282, 'tp_mult': 1.691543316074358, 'tsl_mult': 0.23722994911665155, 'strategy': 'mean_reversion', 'time_stop': 190, 'use_sma': True, 'use_atr': True, 'use_adx': False, 'use_ema': False, 'use_spike': False, 'rsi_required': False, 'edge_k': 1.0543150068762368, 'edge_cap': 0.9500905078396339, 'bull_strategy': 'mean_reversion', 'bull_bb_std_mult': 2.6160544410595, 'bull_rsi_os': 9, 'bull_rsi_ob': 83, 'bull_adx_thresh': 12.528897386483987, 'bull_atr_min_pct': 0.008760998338946238, 'bull_atr_max_pct': 0.11206061142185796, 'bull_tp_mult': 1.416917002270183, 'bull_tsl_mult': 0.873331899724736, 'bull_time_stop': 222, 'bull_use_sma': False, 'bull_use_ema': False, 'bull_use_atr': False, 'bull_use_adx': False, 'bull_use_spike': False, 'bull_rsi_required': False, 'bear_strategy': 'mean_reversion', 'bear_bb_std_mult': 2.8915076766790047, 'bear_rsi_os': 29, 'bear_rsi_ob': 82, 'bear_adx_thresh': 10.82687681571835, 'bear_atr_min_pct': 0.01690241782204426, 'bear_atr_max_pct': 0.048454145988709243, 'bear_tp_mult': 2.699225150036277, 'bear_tsl_mult': 0.6176783906018516, 'bear_time_stop': 28, 'bear_use_sma': False, 'bear_use_ema': False, 'bear_use_atr': False, 'bear_use_adx': True, 'bear_use_spike': True, 'bear_rsi_required': True, 'sideways_strategy': 'breakout', 'sideways_bb_std_mult': 1.7222790510534327, 'sideways_rsi_os': 8, 'sideways_rsi_ob': 51, 'sideways_adx_thresh': 32.819721940695516, 'sideways_atr_min_pct': 0.01462869757526957, 'sideways_atr_max_pct': 0.04612393836241893, 'sideways_tp_mult': 1.5283222740911633, 'sideways_tsl_mult': 0.575938621487428, 'sideways_time_stop': 117, 'sideways_use_sma': False, 'sideways_use_ema': True, 'sideways_use_atr': True, 'sideways_use_adx': False, 'sideways_use_spike': True, 'sideways_rsi_required': True}.
[I 2025-09-01 09:18:21,499] Trial 77 finished with values: [-1000000000.0, 1000000000.0] and parameters: {'p_sma': 8, 'p_std': 40, 'p_atr': 13, 'p_adx': 11, 'rsi_period': 77, 'ema1': 11, 'ema2': 45, 'slip_atr_k': 0.1380695918931668, 'slip_spread_k': 0.8780907006593477, 'spread_hl_frac': 0.03737948185963342, 'bb_std_mult': 0.7154854610175512, 'rsi_os': 30, 'rsi_ob': 91, 'vol_spike': 0.2071699690339073, 'adx_thresh': 6.145948801858903, 'atr_min_pct': 0.0171625926238497, 'atr_max_pct': 0.07025174959545613, 'tp_mult': 1.435139637788108, 'tsl_mult': 0.11859035409657892, 'strategy': 'mean_reversion', 'time_stop': 108, 'use_sma': False, 'use_atr': True, 'use_adx': True, 'use_ema': False, 'use_spike': False, 'rsi_required': False, 'edge_k': 0.23083851136966255, 'edge_cap': 0.5278754855876574, 'bull_strategy': 'breakout', 'bull_bb_std_mult': 2.07042456713499, 'bull_rsi_os': 47, 'bull_rsi_ob': 74, 'bull_adx_thresh': 13.89287348093745, 'bull_atr_min_pct': 0.027388164719495074, 'bull_atr_max_pct': 0.11933051935819305, 'bull_tp_mult': 1.8142432215143363, 'bull_tsl_mult': 0.3028514402173627, 'bull_time_stop': 189, 'bull_use_sma': True, 'bull_use_ema': True, 'bull_use_atr': True, 'bull_use_adx': False, 'bull_use_spike': True, 'bull_rsi_required': False, 'bear_strategy': 'mean_reversion', 'bear_bb_std_mult': 0.7398705910922692, 'bear_rsi_os': 32, 'bear_rsi_ob': 71, 'bear_adx_thresh': 18.215924538541064, 'bear_atr_min_pct': 0.018868670019882485, 'bear_atr_max_pct': 0.12769107004496272, 'bear_tp_mult': 1.429052381378979, 'bear_tsl_mult': 0.8757202558401733, 'bear_time_stop': 106, 'bear_use_sma': False, 'bear_use_ema': True, 'bear_use_atr': False, 'bear_use_adx': True, 'bear_use_spike': False, 'bear_rsi_required': True, 'sideways_strategy': 'breakout', 'sideways_bb_std_mult': 1.3612828961893233, 'sideways_rsi_os': 53, 'sideways_rsi_ob': 92, 'sideways_adx_thresh': 12.423478385444598, 'sideways_atr_min_pct': 0.005427457170150448, 'sideways_atr_max_pct': 0.03750172832834565, 'sideways_tp_mult': 2.97554491957139, 'sideways_tsl_mult': 0.7151841191564379, 'sideways_time_stop': 60, 'sideways_use_sma': False, 'sideways_use_ema': True, 'sideways_use_atr': True, 'sideways_use_adx': False, 'sideways_use_spike': False, 'sideways_rsi_required': False}.
[I 2025-09-01 09:18:22,962] Trial 76 finished with values: [-1000000000.0, 1000000000.0] and parameters: {'p_sma': 10, 'p_std': 40, 'p_atr': 11, 'p_adx': 22, 'rsi_period': 63, 'ema1': 28, 'ema2': 46, 'slip_atr_k': 0.1355610197551308, 'slip_spread_k': 0.5839794702706383, 'spread_hl_frac': 0.04710340399407062, 'bb_std_mult': 0.7352986176796681, 'rsi_os': 41, 'rsi_ob': 93, 'vol_spike': 0.20769977213759422, 'adx_thresh': 21.730569272634387, 'atr_min_pct': 0.013422647781916593, 'atr_max_pct': 0.14799364829985798, 'tp_mult': 1.4285429599028034, 'tsl_mult': 0.12310898413518573, 'strategy': 'mean_reversion', 'time_stop': 107, 'use_sma': True, 'use_atr': True, 'use_adx': True, 'use_ema': False, 'use_spike': False, 'rsi_required': False, 'edge_k': 0.24517025399140174, 'edge_cap': 0.36210929628963123, 'bull_strategy': 'breakout', 'bull_bb_std_mult': 2.0868928711191526, 'bull_rsi_os': 48, 'bull_rsi_ob': 74, 'bull_adx_thresh': 10.293241928491977, 'bull_atr_min_pct': 0.008761215448090148, 'bull_atr_max_pct': 0.137196810530619, 'bull_tp_mult': 1.0732488804827394, 'bull_tsl_mult': 0.8545331298374649, 'bull_time_stop': 186, 'bull_use_sma': True, 'bull_use_ema': False, 'bull_use_atr': True, 'bull_use_adx': False, 'bull_use_spike': True, 'bull_rsi_required': False, 'bear_strategy': 'mean_reversion', 'bear_bb_std_mult': 3.167283488353413, 'bear_rsi_os': 45, 'bear_rsi_ob': 70, 'bear_adx_thresh': 17.300927958553597, 'bear_atr_min_pct': 0.018693470115020875, 'bear_atr_max_pct': 0.12312719522058271, 'bear_tp_mult': 1.4081002682449029, 'bear_tsl_mult': 0.613953672289998, 'bear_time_stop': 103, 'bear_use_sma': False, 'bear_use_ema': True, 'bear_use_atr': False, 'bear_use_adx': True, 'bear_use_spike': True, 'bear_rsi_required': True, 'sideways_strategy': 'breakout', 'sideways_bb_std_mult': 1.3516157844248804, 'sideways_rsi_os': 22, 'sideways_rsi_ob': 64, 'sideways_adx_thresh': 12.800767924693574, 'sideways_atr_min_pct': 0.004711565994663661, 'sideways_atr_max_pct': 0.036353389975379805, 'sideways_tp_mult': 2.8775000491077627, 'sideways_tsl_mult': 0.7153809295133999, 'sideways_time_stop': 148, 'sideways_use_sma': False, 'sideways_use_ema': True, 'sideways_use_atr': True, 'sideways_use_adx': False, 'sideways_use_spike': False, 'sideways_rsi_required': False}.
[I 2025-09-01 09:18:23,216] Trial 74 finished with values: [-1000000000.0, 1000000000.0] and parameters: {'p_sma': 35, 'p_std': 19, 'p_atr': 28, 'p_adx': 15, 'rsi_period': 77, 'ema1': 5, 'ema2': 57, 'slip_atr_k': 0.11491065774869802, 'slip_spread_k': 0.866056350810852, 'spread_hl_frac': 0.016620167479416498, 'bb_std_mult': 0.7314155644616553, 'rsi_os': 29, 'rsi_ob': 95, 'vol_spike': 0.030102950645454804, 'adx_thresh': 8.11603333839744, 'atr_min_pct': 0.013329741789694417, 'atr_max_pct': 0.10268800719724366, 'tp_mult': 1.146757406835767, 'tsl_mult': 0.11093499730286202, 'strategy': 'mean_reversion', 'time_stop': 24, 'use_sma': True, 'use_atr': True, 'use_adx': True, 'use_ema': False, 'use_spike': False, 'rsi_required': False, 'edge_k': 1.115849741806976, 'edge_cap': 0.9331380835064005, 'bull_strategy': 'mean_reversion', 'bull_bb_std_mult': 2.1330782904654937, 'bull_rsi_os': 29, 'bull_rsi_ob': 93, 'bull_adx_thresh': 12.85748056171274, 'bull_atr_min_pct': 0.028091360812405444, 'bull_atr_max_pct': 0.11996868927115076, 'bull_tp_mult': 1.1452351700070804, 'bull_tsl_mult': 0.08139761619688224, 'bull_time_stop': 127, 'bull_use_sma': False, 'bull_use_ema': False, 'bull_use_atr': False, 'bull_use_adx': False, 'bull_use_spike': True, 'bull_rsi_required': False, 'bear_strategy': 'mean_reversion', 'bear_bb_std_mult': 0.7066014142358565, 'bear_rsi_os': 28, 'bear_rsi_ob': 59, 'bear_adx_thresh': 17.878814758810716, 'bear_atr_min_pct': 0.025553843337823824, 'bear_atr_max_pct': 0.12322090594028597, 'bear_tp_mult': 2.6487352175101093, 'bear_tsl_mult': 0.18246234463022498, 'bear_time_stop': 123, 'bear_use_sma': False, 'bear_use_ema': False, 'bear_use_atr': False, 'bear_use_adx': True, 'bear_use_spike': False, 'bear_rsi_required': True, 'sideways_strategy': 'breakout', 'sideways_bb_std_mult': 2.357927160561091, 'sideways_rsi_os': 44, 'sideways_rsi_ob': 86, 'sideways_adx_thresh': 33.74359968952817, 'sideways_atr_min_pct': 0.014824554042272245, 'sideways_atr_max_pct': 0.03809938299366287, 'sideways_tp_mult': 2.9889948740670613, 'sideways_tsl_mult': 0.7851054836127687, 'sideways_time_stop': 63, 'sideways_use_sma': False, 'sideways_use_ema': True, 'sideways_use_atr': True, 'sideways_use_adx': False, 'sideways_use_spike': False, 'sideways_rsi_required': True}.
[I 2025-09-01 09:18:23,227] Trial 75 finished with values: [-1000000000.0, 1000000000.0] and parameters: {'p_sma': 9, 'p_std': 39, 'p_atr': 13, 'p_adx': 22, 'rsi_period': 19, 'ema1': 11, 'ema2': 45, 'slip_atr_k': 0.13930148175759047, 'slip_spread_k': 0.8695585310150388, 'spread_hl_frac': 0.03754815264657049, 'bb_std_mult': 1.0523623111912186, 'rsi_os': 41, 'rsi_ob': 95, 'vol_spike': 0.2048344865809329, 'adx_thresh': 7.775931505577352, 'atr_min_pct': 0.011442275308674275, 'atr_max_pct': 0.070753830353949, 'tp_mult': 1.4364465386056335, 'tsl_mult': 0.10942822495467164, 'strategy': 'mean_reversion', 'time_stop': 222, 'use_sma': True, 'use_atr': True, 'use_adx': True, 'use_ema': False, 'use_spike': False, 'rsi_required': False, 'edge_k': 1.0482836267741835, 'edge_cap': 0.5541108817921008, 'bull_strategy': 'breakout', 'bull_bb_std_mult': 2.0313987055086145, 'bull_rsi_os': 28, 'bull_rsi_ob': 84, 'bull_adx_thresh': 12.587470657119113, 'bull_atr_min_pct': 0.029473290232961663, 'bull_atr_max_pct': 0.12014711330461328, 'bull_tp_mult': 1.0701718839829404, 'bull_tsl_mult': 0.8108371891822088, 'bull_time_stop': 26, 'bull_use_sma': True, 'bull_use_ema': False, 'bull_use_atr': True, 'bull_use_adx': False, 'bull_use_spike': True, 'bull_rsi_required': False, 'bear_strategy': 'mean_reversion', 'bear_bb_std_mult': 3.1788234803928948, 'bear_rsi_os': 32, 'bear_rsi_ob': 70, 'bear_adx_thresh': 30.954671766567248, 'bear_atr_min_pct': 0.00956880051928036, 'bear_atr_max_pct': 0.025090850013598703, 'bear_tp_mult': 1.5010965769447193, 'bear_tsl_mult': 0.6288616940656927, 'bear_time_stop': 106, 'bear_use_sma': False, 'bear_use_ema': True, 'bear_use_atr': False, 'bear_use_adx': True, 'bear_use_spike': True, 'bear_rsi_required': True, 'sideways_strategy': 'breakout', 'sideways_bb_std_mult': 1.300797937454857, 'sideways_rsi_os': 27, 'sideways_rsi_ob': 77, 'sideways_adx_thresh': 12.541682490083394, 'sideways_atr_min_pct': 0.0048167360200283265, 'sideways_atr_max_pct': 0.03739289878373121, 'sideways_tp_mult': 2.9960323043624184, 'sideways_tsl_mult': 0.21180319100085232, 'sideways_time_stop': 93, 'sideways_use_sma': False, 'sideways_use_ema': True, 'sideways_use_atr': True, 'sideways_use_adx': False, 'sideways_use_spike': False, 'sideways_rsi_required': False}.
[I 2025-09-01 09:19:02,135] Trial 78 finished with values: [-1000000000.0, 1000000000.0] and parameters: {'p_sma': 23, 'p_std': 19, 'p_atr': 17, 'p_adx': 21, 'rsi_period': 21, 'ema1': 6, 'ema2': 31, 'slip_atr_k': 0.15314452699365394, 'slip_spread_k': 0.5914142687939753, 'spread_hl_frac': 0.02410446770815775, 'bb_std_mult': 0.73338042708774, 'rsi_os': 14, 'rsi_ob': 94, 'vol_spike': 0.11865853484019137, 'adx_thresh': 21.868489845861617, 'atr_min_pct': 0.015396543767560783, 'atr_max_pct': 0.09803305381350766, 'tp_mult': 2.9971565110123666, 'tsl_mult': 0.8973857186362503, 'strategy': 'mean_reversion', 'time_stop': 227, 'use_sma': False, 'use_atr': True, 'use_adx': True, 'use_ema': False, 'use_spike': False, 'rsi_required': True, 'edge_k': 0.259386625252145, 'edge_cap': 0.25880795616462315, 'bull_strategy': 'breakout', 'bull_bb_std_mult': 2.311828201260968, 'bull_rsi_os': 28, 'bull_rsi_ob': 84, 'bull_adx_thresh': 23.865648014821563, 'bull_atr_min_pct': 0.02091570543981876, 'bull_atr_max_pct': 0.0610119032213778, 'bull_tp_mult': 1.0658355542506026, 'bull_tsl_mult': 0.1601545862347145, 'bull_time_stop': 83, 'bull_use_sma': False, 'bull_use_ema': True, 'bull_use_atr': False, 'bull_use_adx': True, 'bull_use_spike': True, 'bull_rsi_required': True, 'bear_strategy': 'breakout', 'bear_bb_std_mult': 3.1590950331425374, 'bear_rsi_os': 14, 'bear_rsi_ob': 54, 'bear_adx_thresh': 29.26787200556457, 'bear_atr_min_pct': 0.023695047116368426, 'bear_atr_max_pct': 0.12139728930517554, 'bear_tp_mult': 1.5156156519715631, 'bear_tsl_mult': 0.978669432193467, 'bear_time_stop': 132, 'bear_use_sma': False, 'bear_use_ema': True, 'bear_use_atr': False, 'bear_use_adx': True, 'bear_use_spike': True, 'bear_rsi_required': True, 'sideways_strategy': 'breakout', 'sideways_bb_std_mult': 2.349813143513604, 'sideways_rsi_os': 28, 'sideways_rsi_ob': 77, 'sideways_adx_thresh': 13.053661502464356, 'sideways_atr_min_pct': 0.027030806894833344, 'sideways_atr_max_pct': 0.05173780646222292, 'sideways_tp_mult': 2.3110456333644374, 'sideways_tsl_mult': 0.9091573833654784, 'sideways_time_stop': 30, 'sideways_use_sma': False, 'sideways_use_ema': True, 'sideways_use_atr': False, 'sideways_use_adx': True, 'sideways_use_spike': False, 'sideways_rsi_required': False}.
[I 2025-09-01 09:19:02,181] Trial 80 finished with values: [-1000000000.0, 1000000000.0] and parameters: {'p_sma': 7, 'p_std': 13, 'p_atr': 18, 'p_adx': 12, 'rsi_period': 68, 'ema1': 24, 'ema2': 32, 'slip_atr_k': 0.15102977519702365, 'slip_spread_k': 0.048025563106150804, 'spread_hl_frac': 0.03185320116763788, 'bb_std_mult': 0.8364180091667937, 'rsi_os': 53, 'rsi_ob': 59, 'vol_spike': 0.1065722151976999, 'adx_thresh': 10.613161475722201, 'atr_min_pct': 0.015086851549790257, 'atr_max_pct': 0.07710085344025007, 'tp_mult': 1.8697934958624172, 'tsl_mult': 0.3643769325613928, 'strategy': 'breakout', 'time_stop': 270, 'use_sma': False, 'use_atr': True, 'use_adx': True, 'use_ema': True, 'use_spike': False, 'rsi_required': True, 'edge_k': 0.44420472603410766, 'edge_cap': 0.6815850456259067, 'bull_strategy': 'mean_reversion', 'bull_bb_std_mult': 2.272744091610385, 'bull_rsi_os': 19, 'bull_rsi_ob': 68, 'bull_adx_thresh': 14.490996815165722, 'bull_atr_min_pct': 0.022076913013915143, 'bull_atr_max_pct': 0.13159848376488353, 'bull_tp_mult': 2.8146030733902174, 'bull_tsl_mult': 0.6793363810058933, 'bull_time_stop': 10, 'bull_use_sma': False, 'bull_use_ema': True, 'bull_use_atr': False, 'bull_use_adx': True, 'bull_use_spike': True, 'bull_rsi_required': True, 'bear_strategy': 'breakout', 'bear_bb_std_mult': 3.0300974587871727, 'bear_rsi_os': 5, 'bear_rsi_ob': 63, 'bear_adx_thresh': 32.16427938287687, 'bear_atr_min_pct': 0.022920369932381928, 'bear_atr_max_pct': 0.06999322983765854, 'bear_tp_mult': 1.6027407605966943, 'bear_tsl_mult': 0.6633485414109139, 'bear_time_stop': 94, 'bear_use_sma': False, 'bear_use_ema': False, 'bear_use_atr': True, 'bear_use_adx': True, 'bear_use_spike': True, 'bear_rsi_required': True, 'sideways_strategy': 'breakout', 'sideways_bb_std_mult': 2.009884162801671, 'sideways_rsi_os': 48, 'sideways_rsi_ob': 59, 'sideways_adx_thresh': 10.726766788125538, 'sideways_atr_min_pct': 0.003161592744508196, 'sideways_atr_max_pct': 0.051356651864174846, 'sideways_tp_mult': 2.1926882621808206, 'sideways_tsl_mult': 0.9059802481068164, 'sideways_time_stop': 28, 'sideways_use_sma': True, 'sideways_use_ema': True, 'sideways_use_atr': False, 'sideways_use_adx': True, 'sideways_use_spike': False, 'sideways_rsi_required': False}.
[I 2025-09-01 09:19:02,501] Trial 79 finished with values: [-0.03640533299819071, 0.036163907371757564] and parameters: {'p_sma': 45, 'p_std': 10, 'p_atr': 25, 'p_adx': 12, 'rsi_period': 27, 'ema1': 21, 'ema2': 32, 'slip_atr_k': 0.14693903632322036, 'slip_spread_k': 0.09381833239987236, 'spread_hl_frac': 0.009364295191421509, 'bb_std_mult': 0.8513811235662334, 'rsi_os': 15, 'rsi_ob': 60, 'vol_spike': 0.12090782728244853, 'adx_thresh': 31.186928529671558, 'atr_min_pct': 0.015065700550072213, 'atr_max_pct': 0.07892962939197176, 'tp_mult': 2.951724728436532, 'tsl_mult': 0.6883745474914043, 'strategy': 'breakout', 'time_stop': 292, 'use_sma': False, 'use_atr': True, 'use_adx': True, 'use_ema': True, 'use_spike': False, 'rsi_required': True, 'edge_k': 0.4656097628460272, 'edge_cap': 0.2670663908320838, 'bull_strategy': 'mean_reversion', 'bull_bb_std_mult': 2.2777883058845125, 'bull_rsi_os': 51, 'bull_rsi_ob': 65, 'bull_adx_thresh': 15.913113830399457, 'bull_atr_min_pct': 0.006491128736745247, 'bull_atr_max_pct': 0.13123867388846241, 'bull_tp_mult': 2.5982483754948063, 'bull_tsl_mult': 0.16197477047740377, 'bull_time_stop': 83, 'bull_use_sma': False, 'bull_use_ema': True, 'bull_use_atr': False, 'bull_use_adx': True, 'bull_use_spike': True, 'bull_rsi_required': True, 'bear_strategy': 'breakout', 'bear_bb_std_mult': 3.0376588062974577, 'bear_rsi_os': 5, 'bear_rsi_ob': 54, 'bear_adx_thresh': 29.31627213537864, 'bear_atr_min_pct': 0.02224649336801628, 'bear_atr_max_pct': 0.13361799546707798, 'bear_tp_mult': 1.615396404010768, 'bear_tsl_mult': 0.3775231560795285, 'bear_time_stop': 94, 'bear_use_sma': False, 'bear_use_ema': False, 'bear_use_atr': True, 'bear_use_adx': True, 'bear_use_spike': True, 'bear_rsi_required': True, 'sideways_strategy': 'breakout', 'sideways_bb_std_mult': 0.881176666039871, 'sideways_rsi_os': 43, 'sideways_rsi_ob': 88, 'sideways_adx_thresh': 10.504604943957178, 'sideways_atr_min_pct': 0.003042067159339412, 'sideways_atr_max_pct': 0.08702019453875608, 'sideways_tp_mult': 2.505321963204663, 'sideways_tsl_mult': 0.8335157259418999, 'sideways_time_stop': 31, 'sideways_use_sma': True, 'sideways_use_ema': True, 'sideways_use_atr': False, 'sideways_use_adx': True, 'sideways_use_spike': False, 'sideways_rsi_required': False}.
