[I 2025-09-01 09:28:01,858] Trial 135 finished with values: [-0.025691821847211083, 0.025476626739599058] and parameters: {'p_sma': 20, 'p_std': 55, 'p_atr': 17, 'p_adx': 18, 'rsi_period': 23, 'ema1': 19, 'ema2': 16, 'slip_atr_k': 0.05021116124815288, 'slip_spread_k': 0.6270838167973336, 'spread_hl_frac': 0.02913917449450624, 'bb_std_mult': 1.3281506957009597, 'rsi_os': 38, 'rsi_ob': 68, 'vol_spike': 0.022478304644592908, 'adx_thresh': 27.68011198935163, 'atr_min_pct': 0.028028584222731825, 'atr_max_pct': 0.07086552601025231, 'tp_mult': 1.1396348369968008, 'tsl_mult': 0.431925332755299, 'strategy': 'breakout', 'time_stop': 280, 'use_sma': True, 'use_atr': False, 'use_adx': False, 'use_ema': True, 'use_spike': True, 'rsi_required': True, 'edge_k': 1.24724361354543, 'edge_cap': 0.8317005979267994, 'bull_strategy': 'breakout', 'bull_bb_std_mult': 3.5330564091526675, 'bull_rsi_os': 47, 'bull_rsi_ob': 48, 'bull_adx_thresh': 5.979080490176166, 'bull_atr_min_pct': 0.0005864601428083885, 'bull_atr_max_pct': 0.08503747007906527, 'bull_tp_mult': 1.525324434781816, 'bull_tsl_mult': 0.9669395001020581, 'bull_time_stop': 228, 'bull_use_sma': True, 'bull_use_ema': False, 'bull_use_atr': True, 'bull_use_adx': False, 'bull_use_spike': False, 'bull_rsi_required': True, 'bear_strategy': 'mean_reversion', 'bear_bb_std_mult': 2.017382291284363, 'bear_rsi_os': 55, 'bear_rsi_ob': 95, 'bear_adx_thresh': 24.53459647654053, 'bear_atr_min_pct': 0.02804787361896149, 'bear_atr_max_pct': 0.07344459965486703, 'bear_tp_mult': 2.2279283469468405, 'bear_tsl_mult': 0.2584202703116707, 'bear_time_stop': 292, 'bear_use_sma': True, 'bear_use_ema': True, 'bear_use_atr': True, 'bear_use_adx': False, 'bear_use_spike': False, 'bear_rsi_required': False, 'sideways_strategy': 'mean_reversion', 'sideways_bb_std_mult': 0.9440052187021827, 'sideways_rsi_os': 52, 'sideways_rsi_ob': 89, 'sideways_adx_thresh': 27.168481480638572, 'sideways_atr_min_pct': 0.022106005185671573, 'sideways_atr_max_pct': 0.07363547403134389, 'sideways_tp_mult': 2.0150192212333597, 'sideways_tsl_mult': 0.4054611817189062, 'sideways_time_stop': 22, 'sideways_use_sma': True, 'sideways_use_ema': False, 'sideways_use_atr': False, 'sideways_use_adx': True, 'sideways_use_spike': False, 'sideways_rsi_required': False}.
[I 2025-09-01 09:28:02,369] Trial 136 finished with values: [-0.02302760715380614, 0.02283095599720891] and parameters: {'p_sma': 20, 'p_std': 54, 'p_atr': 17, 'p_adx': 18, 'rsi_period': 22, 'ema1': 19, 'ema2': 16, 'slip_atr_k': 0.05025146129280331, 'slip_spread_k': 0.6340685538451909, 'spread_hl_frac': 0.029480292222528754, 'bb_std_mult': 1.3326091113003309, 'rsi_os': 38, 'rsi_ob': 68, 'vol_spike': 0.021579267993183854, 'adx_thresh': 31.84673128757526, 'atr_min_pct': 0.027887600464421482, 'atr_max_pct': 0.07290643246736848, 'tp_mult': 1.015325872269413, 'tsl_mult': 0.43390904266711744, 'strategy': 'breakout', 'time_stop': 280, 'use_sma': True, 'use_atr': False, 'use_adx': False, 'use_ema': True, 'use_spike': True, 'rsi_required': True, 'edge_k': 1.270058680216505, 'edge_cap': 0.8340002507644777, 'bull_strategy': 'breakout', 'bull_bb_std_mult': 3.5419427443613944, 'bull_rsi_os': 47, 'bull_rsi_ob': 48, 'bull_adx_thresh': 5.969994996868524, 'bull_atr_min_pct': 0.0013916688428632215, 'bull_atr_max_pct': 0.08799973434632334, 'bull_tp_mult': 1.523132751832349, 'bull_tsl_mult': 0.9660343367988778, 'bull_time_stop': 244, 'bull_use_sma': True, 'bull_use_ema': False, 'bull_use_atr': True, 'bull_use_adx': False, 'bull_use_spike': False, 'bull_rsi_required': True, 'bear_strategy': 'mean_reversion', 'bear_bb_std_mult': 2.015822694308212, 'bear_rsi_os': 55, 'bear_rsi_ob': 95, 'bear_adx_thresh': 24.075063262880263, 'bear_atr_min_pct': 0.028061588210902863, 'bear_atr_max_pct': 0.07328802825330745, 'bear_tp_mult': 2.2090334953393644, 'bear_tsl_mult': 0.3404578874881434, 'bear_time_stop': 292, 'bear_use_sma': True, 'bear_use_ema': True, 'bear_use_atr': True, 'bear_use_adx': False, 'bear_use_spike': False, 'bear_rsi_required': False, 'sideways_strategy': 'mean_reversion', 'sideways_bb_std_mult': 0.9284989822117911, 'sideways_rsi_os': 52, 'sideways_rsi_ob': 90, 'sideways_adx_thresh': 27.05939879487566, 'sideways_atr_min_pct': 0.021945878051298037, 'sideways_atr_max_pct': 0.07460228511097398, 'sideways_tp_mult': 2.0060406868938845, 'sideways_tsl_mult': 0.4177529458726613, 'sideways_time_stop': 24, 'sideways_use_sma': True, 'sideways_use_ema': False, 'sideways_use_atr': False, 'sideways_use_adx': True, 'sideways_use_spike': False, 'sideways_rsi_required': False}.
[I 2025-09-01 09:28:02,370] Trial 137 finished with values: [-0.02541814867048886, 0.025233166625598966] and parameters: {'p_sma': 20, 'p_std': 54, 'p_atr': 29, 'p_adx': 18, 'rsi_period': 23, 'ema1': 19, 'ema2': 16, 'slip_atr_k': 0.04891758782112355, 'slip_spread_k': 0.6381754303950808, 'spread_hl_frac': 0.025399499937065882, 'bb_std_mult': 1.3295823357932568, 'rsi_os': 38, 'rsi_ob': 64, 'vol_spike': 0.0221079792926356, 'adx_thresh': 28.19467371033135, 'atr_min_pct': 0.02756379939221217, 'atr_max_pct': 0.0654837917243763, 'tp_mult': 1.1465396125942575, 'tsl_mult': 0.4373069281023348, 'strategy': 'breakout', 'time_stop': 280, 'use_sma': True, 'use_atr': False, 'use_adx': False, 'use_ema': True, 'use_spike': True, 'rsi_required': True, 'edge_k': 1.2283535242315713, 'edge_cap': 0.8244706100651599, 'bull_strategy': 'breakout', 'bull_bb_std_mult': 3.3804468127962424, 'bull_rsi_os': 46, 'bull_rsi_ob': 49, 'bull_adx_thresh': 5.917411309866764, 'bull_atr_min_pct': 9.197123549076663e-06, 'bull_atr_max_pct': 0.08684967150318358, 'bull_tp_mult': 1.5232619780862033, 'bull_tsl_mult': 0.9664389665879066, 'bull_time_stop': 243, 'bull_use_sma': True, 'bull_use_ema': False, 'bull_use_atr': True, 'bull_use_adx': False, 'bull_use_spike': False, 'bull_rsi_required': True, 'bear_strategy': 'breakout', 'bear_bb_std_mult': 2.0178851887737608, 'bear_rsi_os': 55, 'bear_rsi_ob': 95, 'bear_adx_thresh': 24.510963477521308, 'bear_atr_min_pct': 0.02807211599394765, 'bear_atr_max_pct': 0.08164546150933184, 'bear_tp_mult': 2.229104062557006, 'bear_tsl_mult': 0.22900678156470688, 'bear_time_stop': 293, 'bear_use_sma': True, 'bear_use_ema': True, 'bear_use_atr': True, 'bear_use_adx': False, 'bear_use_spike': False, 'bear_rsi_required': False, 'sideways_strategy': 'mean_reversion', 'sideways_bb_std_mult': 0.9414757250017542, 'sideways_rsi_os': 53, 'sideways_rsi_ob': 91, 'sideways_adx_thresh': 26.88701012194241, 'sideways_atr_min_pct': 0.02193751953178195, 'sideways_atr_max_pct': 0.0747627027376122, 'sideways_tp_mult': 2.037781164150456, 'sideways_tsl_mult': 0.4080041336755467, 'sideways_time_stop': 24, 'sideways_use_sma': True, 'sideways_use_ema': False, 'sideways_use_atr': False, 'sideways_use_adx': True, 'sideways_use_spike': False, 'sideways_rsi_required': False}.
[I 2025-09-01 09:28:02,579] Trial 138 finished with values: [-1000000000.0, 1000000000.0] and parameters: {'p_sma': 19, 'p_std': 54, 'p_atr': 17, 'p_adx': 18, 'rsi_period': 23, 'ema1': 19, 'ema2': 17, 'slip_atr_k': 0.04832684698112612, 'slip_spread_k': 0.6360596576907951, 'spread_hl_frac': 0.025338554313596807, 'bb_std_mult': 1.3344522157366077, 'rsi_os': 38, 'rsi_ob': 67, 'vol_spike': 0.02321812031053619, 'adx_thresh': 28.053134588066055, 'atr_min_pct': 0.02753027476966817, 'atr_max_pct': 0.06689060394099115, 'tp_mult': 1.1458274684113796, 'tsl_mult': 0.44290945815697863, 'strategy': 'breakout', 'time_stop': 279, 'use_sma': True, 'use_atr': False, 'use_adx': False, 'use_ema': True, 'use_spike': True, 'rsi_required': True, 'edge_k': 1.2449482070246682, 'edge_cap': 0.8272134495808064, 'bull_strategy': 'breakout', 'bull_bb_std_mult': 3.391476188364083, 'bull_rsi_os': 47, 'bull_rsi_ob': 49, 'bull_adx_thresh': 5.943590882599153, 'bull_atr_min_pct': 0.001740256210619594, 'bull_atr_max_pct': 0.08622019385204907, 'bull_tp_mult': 1.5417537216816048, 'bull_tsl_mult': 0.9632704344893527, 'bull_time_stop': 243, 'bull_use_sma': True, 'bull_use_ema': False, 'bull_use_atr': True, 'bull_use_adx': False, 'bull_use_spike': False, 'bull_rsi_required': True, 'bear_strategy': 'breakout', 'bear_bb_std_mult': 2.007414326325891, 'bear_rsi_os': 55, 'bear_rsi_ob': 95, 'bear_adx_thresh': 24.23109447344007, 'bear_atr_min_pct': 0.027945319241131285, 'bear_atr_max_pct': 0.07474941001638648, 'bear_tp_mult': 2.204697906360837, 'bear_tsl_mult': 0.20863622321741343, 'bear_time_stop': 292, 'bear_use_sma': True, 'bear_use_ema': True, 'bear_use_atr': True, 'bear_use_adx': False, 'bear_use_spike': False, 'bear_rsi_required': False, 'sideways_strategy': 'mean_reversion', 'sideways_bb_std_mult': 0.9279189620737576, 'sideways_rsi_os': 52, 'sideways_rsi_ob': 90, 'sideways_adx_thresh': 26.873387298315425, 'sideways_atr_min_pct': 0.02201247571415617, 'sideways_atr_max_pct': 0.074385883931973, 'sideways_tp_mult': 2.035579423659135, 'sideways_tsl_mult': 0.42705078793333295, 'sideways_time_stop': 23, 'sideways_use_sma': True, 'sideways_use_ema': False, 'sideways_use_atr': False, 'sideways_use_adx': True, 'sideways_use_spike': False, 'sideways_rsi_required': False}.
[I 2025-09-01 09:28:43,107] Trial 142 finished with values: [-1000000000.0, 1000000000.0] and parameters: {'p_sma': 19, 'p_std': 50, 'p_atr': 16, 'p_adx': 20, 'rsi_period': 17, 'ema1': 21, 'ema2': 18, 'slip_atr_k': 0.057694087394523044, 'slip_spread_k': 0.6482886210378838, 'spread_hl_frac': 0.02830271541369144, 'bb_std_mult': 1.4329916860001781, 'rsi_os': 39, 'rsi_ob': 69, 'vol_spike': 0.031389264059632466, 'adx_thresh': 33.2470546593877, 'atr_min_pct': 0.02800237976308765, 'atr_max_pct': 0.07263616675734137, 'tp_mult': 1.0389844452301853, 'tsl_mult': 0.3933402527534787, 'strategy': 'breakout', 'time_stop': 287, 'use_sma': True, 'use_atr': False, 'use_adx': False, 'use_ema': True, 'use_spike': True, 'rsi_required': True, 'edge_k': 1.1967613595294606, 'edge_cap': 0.883798424602703, 'bull_strategy': 'breakout', 'bull_bb_std_mult': 3.5045576226298096, 'bull_rsi_os': 48, 'bull_rsi_ob': 48, 'bull_adx_thresh': 5.461828655304245, 'bull_atr_min_pct': 0.009445900663625797, 'bull_atr_max_pct': 0.09021498463261322, 'bull_tp_mult': 1.6052988147324967, 'bull_tsl_mult': 0.9828339134838177, 'bull_time_stop': 249, 'bull_use_sma': True, 'bull_use_ema': False, 'bull_use_atr': True, 'bull_use_adx': False, 'bull_use_spike': False, 'bull_rsi_required': True, 'bear_strategy': 'breakout', 'bear_bb_std_mult': 1.8921671260951625, 'bear_rsi_os': 54, 'bear_rsi_ob': 94, 'bear_adx_thresh': 22.213899082796082, 'bear_atr_min_pct': 0.026324167735418968, 'bear_atr_max_pct': 0.08310275931956501, 'bear_tp_mult': 2.270668036470366, 'bear_tsl_mult': 0.2641075185185378, 'bear_time_stop': 299, 'bear_use_sma': True, 'bear_use_ema': True, 'bear_use_atr': True, 'bear_use_adx': False, 'bear_use_spike': False, 'bear_rsi_required': False, 'sideways_strategy': 'mean_reversion', 'sideways_bb_std_mult': 1.21243402565223, 'sideways_rsi_os': 50, 'sideways_rsi_ob': 89, 'sideways_adx_thresh': 26.175730427321522, 'sideways_atr_min_pct': 0.022877698172088044, 'sideways_atr_max_pct': 0.08299962200360607, 'sideways_tp_mult': 1.961725850200003, 'sideways_tsl_mult': 0.47907330913494794, 'sideways_time_stop': 9, 'sideways_use_sma': True, 'sideways_use_ema': False, 'sideways_use_atr': False, 'sideways_use_adx': True, 'sideways_use_spike': False, 'sideways_rsi_required': False}.
[I 2025-09-01 09:28:43,342] Trial 141 finished with values: [-1000000000.0, 1000000000.0] and parameters: {'p_sma': 19, 'p_std': 50, 'p_atr': 16, 'p_adx': 20, 'rsi_period': 18, 'ema1': 20, 'ema2': 19, 'slip_atr_k': 0.03291403306090093, 'slip_spread_k': 0.614183412633998, 'spread_hl_frac': 0.028556773737261353, 'bb_std_mult': 1.4289103203946343, 'rsi_os': 39, 'rsi_ob': 69, 'vol_spike': 0.030990691871689444, 'adx_thresh': 33.125102577588244, 'atr_min_pct': 0.028331999108443418, 'atr_max_pct': 0.06776416702221918, 'tp_mult': 1.0356610099505943, 'tsl_mult': 0.40707146286052226, 'strategy': 'breakout', 'time_stop': 287, 'use_sma': True, 'use_atr': False, 'use_adx': False, 'use_ema': True, 'use_spike': True, 'rsi_required': True, 'edge_k': 1.3908077327062707, 'edge_cap': 0.8934811256435646, 'bull_strategy': 'breakout', 'bull_bb_std_mult': 3.513512068351802, 'bull_rsi_os': 49, 'bull_rsi_ob': 48, 'bull_adx_thresh': 5.322203594473708, 'bull_atr_min_pct': 0.009096919418970173, 'bull_atr_max_pct': 0.08172621307369002, 'bull_tp_mult': 1.620404619241295, 'bull_tsl_mult': 0.9711815960382046, 'bull_time_stop': 247, 'bull_use_sma': True, 'bull_use_ema': False, 'bull_use_atr': True, 'bull_use_adx': False, 'bull_use_spike': False, 'bull_rsi_required': True, 'bear_strategy': 'breakout', 'bear_bb_std_mult': 1.917902721756723, 'bear_rsi_os': 54, 'bear_rsi_ob': 94, 'bear_adx_thresh': 24.878696839851212, 'bear_atr_min_pct': 0.02690781847408599, 'bear_atr_max_pct': 0.08204448673313734, 'bear_tp_mult': 2.295199825660504, 'bear_tsl_mult': 0.5120105281420231, 'bear_time_stop': 299, 'bear_use_sma': True, 'bear_use_ema': True, 'bear_use_atr': True, 'bear_use_adx': False, 'bear_use_spike': False, 'bear_rsi_required': False, 'sideways_strategy': 'mean_reversion', 'sideways_bb_std_mult': 1.2149540550762166, 'sideways_rsi_os': 50, 'sideways_rsi_ob': 89, 'sideways_adx_thresh': 26.19579923148413, 'sideways_atr_min_pct': 0.022945518153526426, 'sideways_atr_max_pct': 0.0847509586180795, 'sideways_tp_mult': 1.96926530265615, 'sideways_tsl_mult': 0.4852157481535562, 'sideways_time_stop': 12, 'sideways_use_sma': True, 'sideways_use_ema': False, 'sideways_use_atr': False, 'sideways_use_adx': True, 'sideways_use_spike': False, 'sideways_rsi_required': False}.
[I 2025-09-01 09:28:43,674] Trial 140 finished with values: [-1000000000.0, 1000000000.0] and parameters: {'p_sma': 20, 'p_std': 54, 'p_atr': 17, 'p_adx': 19, 'rsi_period': 16, 'ema1': 21, 'ema2': 17, 'slip_atr_k': 0.05832201794647503, 'slip_spread_k': 0.6399505579325595, 'spread_hl_frac': 0.0281854992226373, 'bb_std_mult': 1.4626474215437675, 'rsi_os': 38, 'rsi_ob': 69, 'vol_spike': 0.04925084136331227, 'adx_thresh': 33.09631326742912, 'atr_min_pct': 0.028215148477603813, 'atr_max_pct': 0.06734906500513078, 'tp_mult': 1.1546035629747284, 'tsl_mult': 0.4019521524529815, 'strategy': 'breakout', 'time_stop': 281, 'use_sma': True, 'use_atr': False, 'use_adx': False, 'use_ema': True, 'use_spike': True, 'rsi_required': True, 'edge_k': 1.2091106009637382, 'edge_cap': 0.8921240803350329, 'bull_strategy': 'breakout', 'bull_bb_std_mult': 3.4022414129244063, 'bull_rsi_os': 49, 'bull_rsi_ob': 49, 'bull_adx_thresh': 6.101012792791066, 'bull_atr_min_pct': 0.00828035447349283, 'bull_atr_max_pct': 0.09020326557214388, 'bull_tp_mult': 1.5539960705533131, 'bull_tsl_mult': 0.9733623831616731, 'bull_time_stop': 240, 'bull_use_sma': True, 'bull_use_ema': False, 'bull_use_atr': True, 'bull_use_adx': False, 'bull_use_spike': False, 'bull_rsi_required': True, 'bear_strategy': 'breakout', 'bear_bb_std_mult': 2.0834099380441207, 'bear_rsi_os': 54, 'bear_rsi_ob': 95, 'bear_adx_thresh': 22.000851700863524, 'bear_atr_min_pct': 0.026745484578006774, 'bear_atr_max_pct': 0.08195515404871959, 'bear_tp_mult': 2.252032244215437, 'bear_tsl_mult': 0.4266508632299948, 'bear_time_stop': 299, 'bear_use_sma': True, 'bear_use_ema': True, 'bear_use_atr': True, 'bear_use_adx': False, 'bear_use_spike': False, 'bear_rsi_required': False, 'sideways_strategy': 'mean_reversion', 'sideways_bb_std_mult': 0.9131500793175948, 'sideways_rsi_os': 51, 'sideways_rsi_ob': 90, 'sideways_adx_thresh': 26.60631110488226, 'sideways_atr_min_pct': 0.02225810829657036, 'sideways_atr_max_pct': 0.0763974621808599, 'sideways_tp_mult': 2.050319749808534, 'sideways_tsl_mult': 0.46406982672905417, 'sideways_time_stop': 11, 'sideways_use_sma': True, 'sideways_use_ema': False, 'sideways_use_atr': False, 'sideways_use_adx': True, 'sideways_use_spike': False, 'sideways_rsi_required': False}.
[I 2025-09-01 09:28:43,856] Trial 139 finished with values: [-1000000000.0, 1000000000.0] and parameters: {'p_sma': 19, 'p_std': 54, 'p_atr': 17, 'p_adx': 20, 'rsi_period': 19, 'ema1': 21, 'ema2': 18, 'slip_atr_k': 0.033164131672132835, 'slip_spread_k': 0.638348218382673, 'spread_hl_frac': 0.027988288545900374, 'bb_std_mult': 1.458876421111305, 'rsi_os': 8, 'rsi_ob': 69, 'vol_spike': 0.044881042608347674, 'adx_thresh': 32.98809315799193, 'atr_min_pct': 0.028196419147806188, 'atr_max_pct': 0.0640487298344708, 'tp_mult': 1.157896287502032, 'tsl_mult': 0.40109112000395075, 'strategy': 'breakout', 'time_stop': 276, 'use_sma': True, 'use_atr': False, 'use_adx': False, 'use_ema': True, 'use_spike': True, 'rsi_required': True, 'edge_k': 1.1961615654995403, 'edge_cap': 0.9019094081330246, 'bull_strategy': 'breakout', 'bull_bb_std_mult': 3.3691816714541685, 'bull_rsi_os': 49, 'bull_rsi_ob': 49, 'bull_adx_thresh': 6.261349473919032, 'bull_atr_min_pct': 0.0084059466681333, 'bull_atr_max_pct': 0.09049181241714613, 'bull_tp_mult': 1.5996153666432822, 'bull_tsl_mult': 0.9690303786979594, 'bull_time_stop': 243, 'bull_use_sma': True, 'bull_use_ema': False, 'bull_use_atr': True, 'bull_use_adx': False, 'bull_use_spike': False, 'bull_rsi_required': True, 'bear_strategy': 'breakout', 'bear_bb_std_mult': 1.9195518231238915, 'bear_rsi_os': 54, 'bear_rsi_ob': 95, 'bear_adx_thresh': 24.818468045979195, 'bear_atr_min_pct': 0.0265778182706789, 'bear_atr_max_pct': 0.08164796633832763, 'bear_tp_mult': 2.237285002561342, 'bear_tsl_mult': 0.42436987484795563, 'bear_time_stop': 298, 'bear_use_sma': True, 'bear_use_ema': True, 'bear_use_atr': True, 'bear_use_adx': False, 'bear_use_spike': False, 'bear_rsi_required': False, 'sideways_strategy': 'mean_reversion', 'sideways_bb_std_mult': 0.9228122837996843, 'sideways_rsi_os': 51, 'sideways_rsi_ob': 90, 'sideways_adx_thresh': 26.817518025367196, 'sideways_atr_min_pct': 0.022335923543886367, 'sideways_atr_max_pct': 0.07534629983022477, 'sideways_tp_mult': 1.994737820341236, 'sideways_tsl_mult': 0.4774945168480071, 'sideways_time_stop': 25, 'sideways_use_sma': True, 'sideways_use_ema': False, 'sideways_use_atr': False, 'sideways_use_adx': True, 'sideways_use_spike': False, 'sideways_rsi_required': False}.
[I 2025-09-01 09:29:26,632] Trial 146 finished with values: [-1000000000.0, 1000000000.0] and parameters: {'p_sma': 17, 'p_std': 52, 'p_atr': 19, 'p_adx': 18, 'rsi_period': 20, 'ema1': 19, 'ema2': 15, 'slip_atr_k': 0.07213059908657116, 'slip_spread_k': 0.5575677508086433, 'spread_hl_frac': 0.03092318696554834, 'bb_std_mult': 1.2943901557457067, 'rsi_os': 37, 'rsi_ob': 71, 'vol_spike': 0.020141234756472802, 'adx_thresh': 31.79386203208737, 'atr_min_pct': 0.029372811185292638, 'atr_max_pct': 0.0766827270995408, 'tp_mult': 1.0113202792302962, 'tsl_mult': 0.3379267028779054, 'strategy': 'breakout', 'time_stop': 268, 'use_sma': True, 'use_atr': False, 'use_adx': False, 'use_ema': True, 'use_spike': True, 'rsi_required': True, 'edge_k': 1.2811379481255991, 'edge_cap': 0.8432049491587942, 'bull_strategy': 'breakout', 'bull_bb_std_mult': 3.4836875479286467, 'bull_rsi_os': 46, 'bull_rsi_ob': 45, 'bull_adx_thresh': 7.02151437449593, 'bull_atr_min_pct': 0.011034870276787765, 'bull_atr_max_pct': 0.08442472657458272, 'bull_tp_mult': 1.4919150667137486, 'bull_tsl_mult': 0.8720372938371811, 'bull_time_stop': 235, 'bull_use_sma': True, 'bull_use_ema': False, 'bull_use_atr': True, 'bull_use_adx': False, 'bull_use_spike': False, 'bull_rsi_required': True, 'bear_strategy': 'mean_reversion', 'bear_bb_std_mult': 2.094045662466924, 'bear_rsi_os': 49, 'bear_rsi_ob': 93, 'bear_adx_thresh': 20.866185427743602, 'bear_atr_min_pct': 0.025790683458751597, 'bear_atr_max_pct': 0.07609104181758221, 'bear_tp_mult': 2.4102954055332466, 'bear_tsl_mult': 0.1575613692700117, 'bear_time_stop': 284, 'bear_use_sma': True, 'bear_use_ema': True, 'bear_use_atr': True, 'bear_use_adx': False, 'bear_use_spike': False, 'bear_rsi_required': False, 'sideways_strategy': 'mean_reversion', 'sideways_bb_std_mult': 0.8002954215632272, 'sideways_rsi_os': 54, 'sideways_rsi_ob': 91, 'sideways_adx_thresh': 27.893102223941273, 'sideways_atr_min_pct': 0.019198444778089102, 'sideways_atr_max_pct': 0.07073151540825151, 'sideways_tp_mult': 1.8444062478716725, 'sideways_tsl_mult': 0.4092794852180126, 'sideways_time_stop': 23, 'sideways_use_sma': True, 'sideways_use_ema': False, 'sideways_use_atr': False, 'sideways_use_adx': True, 'sideways_use_spike': True, 'sideways_rsi_required': False}.
