[I 2025-09-01 09:29:26,902] Trial 144 finished with values: [-1000000000.0, 1000000000.0] and parameters: {'p_sma': 20, 'p_std': 54, 'p_atr': 17, 'p_adx': 19, 'rsi_period': 19, 'ema1': 19, 'ema2': 16, 'slip_atr_k': 0.07424042656776463, 'slip_spread_k': 0.6135517236541822, 'spread_hl_frac': 0.026974596256909775, 'bb_std_mult': 1.5078194096279638, 'rsi_os': 8, 'rsi_ob': 70, 'vol_spike': 0.04944673147616624, 'adx_thresh': 31.984300704427614, 'atr_min_pct': 0.02947797874433926, 'atr_max_pct': 0.062196722769512804, 'tp_mult': 1.1289056350456823, 'tsl_mult': 0.33549476772158676, 'strategy': 'breakout', 'time_stop': 274, 'use_sma': True, 'use_atr': False, 'use_adx': False, 'use_ema': True, 'use_spike': True, 'rsi_required': True, 'edge_k': 1.2106899889409493, 'edge_cap': 0.8414677949268641, 'bull_strategy': 'breakout', 'bull_bb_std_mult': 3.3742814884716177, 'bull_rsi_os': 46, 'bull_rsi_ob': 50, 'bull_adx_thresh': 6.407109844113467, 'bull_atr_min_pct': 0.008385183578582256, 'bull_atr_max_pct': 0.08682484633331336, 'bull_tp_mult': 1.5051174951563144, 'bull_tsl_mult': 0.8729572499112199, 'bull_time_stop': 239, 'bull_use_sma': True, 'bull_use_ema': False, 'bull_use_atr': True, 'bull_use_adx': False, 'bull_use_spike': False, 'bull_rsi_required': True, 'bear_strategy': 'mean_reversion', 'bear_bb_std_mult': 2.0818383711244763, 'bear_rsi_os': 54, 'bear_rsi_ob': 94, 'bear_adx_thresh': 21.14422745384478, 'bear_atr_min_pct': 0.0298601835620882, 'bear_atr_max_pct': 0.07647123031719892, 'bear_tp_mult': 2.2170047064540364, 'bear_tsl_mult': 0.4177323746540891, 'bear_time_stop': 286, 'bear_use_sma': True, 'bear_use_ema': True, 'bear_use_atr': True, 'bear_use_adx': False, 'bear_use_spike': False, 'bear_rsi_required': False, 'sideways_strategy': 'mean_reversion', 'sideways_bb_std_mult': 0.8173956383552037, 'sideways_rsi_os': 54, 'sideways_rsi_ob': 45, 'sideways_adx_thresh': 27.32235267283678, 'sideways_atr_min_pct': 0.01978738773836161, 'sideways_atr_max_pct': 0.07633803274187405, 'sideways_tp_mult': 2.1515368929874334, 'sideways_tsl_mult': 0.40417340050182105, 'sideways_time_stop': 24, 'sideways_use_sma': True, 'sideways_use_ema': False, 'sideways_use_atr': False, 'sideways_use_adx': True, 'sideways_use_spike': True, 'sideways_rsi_required': False}.
[I 2025-09-01 09:29:27,734] Trial 143 finished with values: [-1000000000.0, 1000000000.0] and parameters: {'p_sma': 20, 'p_std': 54, 'p_atr': 19, 'p_adx': 19, 'rsi_period': 20, 'ema1': 19, 'ema2': 16, 'slip_atr_k': 0.07028015988787503, 'slip_spread_k': 0.5632664661361203, 'spread_hl_frac': 0.026898864942396617, 'bb_std_mult': 1.521106226299533, 'rsi_os': 9, 'rsi_ob': 68, 'vol_spike': 0.0472005292012293, 'adx_thresh': 31.7283710395532, 'atr_min_pct': 0.02926472266794446, 'atr_max_pct': 0.0611709423335306, 'tp_mult': 1.145128106268484, 'tsl_mult': 0.4838781180136305, 'strategy': 'breakout', 'time_stop': 273, 'use_sma': True, 'use_atr': False, 'use_adx': False, 'use_ema': True, 'use_spike': True, 'rsi_required': True, 'edge_k': 1.2109990284027854, 'edge_cap': 0.8433853837751281, 'bull_strategy': 'breakout', 'bull_bb_std_mult': 3.350691315237372, 'bull_rsi_os': 50, 'bull_rsi_ob': 50, 'bull_adx_thresh': 6.410695509306924, 'bull_atr_min_pct': 0.008374515636519256, 'bull_atr_max_pct': 0.09266478207741656, 'bull_tp_mult': 1.5142595522381206, 'bull_tsl_mult': 0.8975505336844046, 'bull_time_stop': 238, 'bull_use_sma': True, 'bull_use_ema': False, 'bull_use_atr': True, 'bull_use_adx': False, 'bull_use_spike': False, 'bull_rsi_required': True, 'bear_strategy': 'mean_reversion', 'bear_bb_std_mult': 2.1119478062723553, 'bear_rsi_os': 54, 'bear_rsi_ob': 94, 'bear_adx_thresh': 21.15827971281774, 'bear_atr_min_pct': 0.027863220028589843, 'bear_atr_max_pct': 0.07712655758434185, 'bear_tp_mult': 2.4312559336204154, 'bear_tsl_mult': 0.236839833192108, 'bear_time_stop': 285, 'bear_use_sma': True, 'bear_use_ema': True, 'bear_use_atr': True, 'bear_use_adx': False, 'bear_use_spike': False, 'bear_rsi_required': False, 'sideways_strategy': 'mean_reversion', 'sideways_bb_std_mult': 0.8151318276093653, 'sideways_rsi_os': 54, 'sideways_rsi_ob': 91, 'sideways_adx_thresh': 27.320743533074097, 'sideways_atr_min_pct': 0.019572701287538064, 'sideways_atr_max_pct': 0.07439175812223345, 'sideways_tp_mult': 2.0625649464134597, 'sideways_tsl_mult': 0.4073991500716145, 'sideways_time_stop': 24, 'sideways_use_sma': True, 'sideways_use_ema': False, 'sideways_use_atr': False, 'sideways_use_adx': True, 'sideways_use_spike': True, 'sideways_rsi_required': False}.
[I 2025-09-01 09:29:27,744] Trial 145 finished with values: [-1000000000.0, 1000000000.0] and parameters: {'p_sma': 21, 'p_std': 52, 'p_atr': 18, 'p_adx': 19, 'rsi_period': 20, 'ema1': 19, 'ema2': 15, 'slip_atr_k': 0.07145223017072783, 'slip_spread_k': 0.6143277768245609, 'spread_hl_frac': 0.03051318610057694, 'bb_std_mult': 1.5326300707475173, 'rsi_os': 8, 'rsi_ob': 68, 'vol_spike': 0.004052529141941014, 'adx_thresh': 31.979311149579555, 'atr_min_pct': 0.02912818865108941, 'atr_max_pct': 0.07715058557773331, 'tp_mult': 1.1064850276897407, 'tsl_mult': 0.48004807321627185, 'strategy': 'breakout', 'time_stop': 271, 'use_sma': True, 'use_atr': False, 'use_adx': False, 'use_ema': True, 'use_spike': True, 'rsi_required': True, 'edge_k': 1.2847315301914628, 'edge_cap': 0.8466558768423936, 'bull_strategy': 'breakout', 'bull_bb_std_mult': 3.341552438783927, 'bull_rsi_os': 48, 'bull_rsi_ob': 45, 'bull_adx_thresh': 6.255907377162473, 'bull_atr_min_pct': 0.015454187148730866, 'bull_atr_max_pct': 0.08533225788370812, 'bull_tp_mult': 1.4906374351873748, 'bull_tsl_mult': 0.8918292763238838, 'bull_time_stop': 273, 'bull_use_sma': True, 'bull_use_ema': False, 'bull_use_atr': True, 'bull_use_adx': False, 'bull_use_spike': False, 'bull_rsi_required': True, 'bear_strategy': 'mean_reversion', 'bear_bb_std_mult': 1.841424404240048, 'bear_rsi_os': 49, 'bear_rsi_ob': 93, 'bear_adx_thresh': 21.199902369945384, 'bear_atr_min_pct': 0.029983548364972804, 'bear_atr_max_pct': 0.07598296397231977, 'bear_tp_mult': 2.1983817942628336, 'bear_tsl_mult': 0.3421783348018793, 'bear_time_stop': 287, 'bear_use_sma': True, 'bear_use_ema': True, 'bear_use_atr': True, 'bear_use_adx': False, 'bear_use_spike': False, 'bear_rsi_required': False, 'sideways_strategy': 'mean_reversion', 'sideways_bb_std_mult': 0.8023243877787891, 'sideways_rsi_os': 54, 'sideways_rsi_ob': 91, 'sideways_adx_thresh': 27.33108052120181, 'sideways_atr_min_pct': 0.019567880284010315, 'sideways_atr_max_pct': 0.07417309752720154, 'sideways_tp_mult': 2.128253932159057, 'sideways_tsl_mult': 0.4097099420932795, 'sideways_time_stop': 25, 'sideways_use_sma': True, 'sideways_use_ema': False, 'sideways_use_atr': False, 'sideways_use_adx': True, 'sideways_use_spike': True, 'sideways_rsi_required': False}.
[I 2025-09-01 09:30:06,520] Trial 147 finished with values: [-1000000000.0, 1000000000.0] and parameters: {'p_sma': 21, 'p_std': 52, 'p_atr': 18, 'p_adx': 18, 'rsi_period': 21, 'ema1': 20, 'ema2': 20, 'slip_atr_k': 0.044577784181157924, 'slip_spread_k': 0.6667588028227726, 'spread_hl_frac': 0.02975826589287804, 'bb_std_mult': 1.5493747255071433, 'rsi_os': 12, 'rsi_ob': 71, 'vol_spike': 0.002551421234711769, 'adx_thresh': 30.237503138723543, 'atr_min_pct': 0.027165428237018074, 'atr_max_pct': 0.07430837488515428, 'tp_mult': 1.1081571960145418, 'tsl_mult': 0.48346567323110623, 'strategy': 'breakout', 'time_stop': 292, 'use_sma': True, 'use_atr': False, 'use_adx': False, 'use_ema': True, 'use_spike': True, 'rsi_required': True, 'edge_k': 1.2520938081910222, 'edge_cap': 0.7781866732755592, 'bull_strategy': 'breakout', 'bull_bb_std_mult': 3.307412203676594, 'bull_rsi_os': 48, 'bull_rsi_ob': 47, 'bull_adx_thresh': 5.4709550365268225, 'bull_atr_min_pct': 0.01537831666634205, 'bull_atr_max_pct': 0.09537583330012389, 'bull_tp_mult': 1.6691493180431483, 'bull_tsl_mult': 0.9297789112277284, 'bull_time_stop': 253, 'bull_use_sma': True, 'bull_use_ema': False, 'bull_use_atr': True, 'bull_use_adx': False, 'bull_use_spike': False, 'bull_rsi_required': True, 'bear_strategy': 'mean_reversion', 'bear_bb_std_mult': 1.8128808276427506, 'bear_rsi_os': 53, 'bear_rsi_ob': 92, 'bear_adx_thresh': 24.193891476418763, 'bear_atr_min_pct': 0.028270185025068666, 'bear_atr_max_pct': 0.06874017745449564, 'bear_tp_mult': 2.3156435041328898, 'bear_tsl_mult': 0.33652039674484546, 'bear_time_stop': 266, 'bear_use_sma': True, 'bear_use_ema': True, 'bear_use_atr': True, 'bear_use_adx': False, 'bear_use_spike': False, 'bear_rsi_required': False, 'sideways_strategy': 'mean_reversion', 'sideways_bb_std_mult': 0.6470486773341022, 'sideways_rsi_os': 53, 'sideways_rsi_ob': 91, 'sideways_adx_thresh': 24.616882543197853, 'sideways_atr_min_pct': 0.020986198270745094, 'sideways_atr_max_pct': 0.07263144219015534, 'sideways_tp_mult': 2.2611463351537697, 'sideways_tsl_mult': 0.43959893843609593, 'sideways_time_stop': 265, 'sideways_use_sma': True, 'sideways_use_ema': False, 'sideways_use_atr': False, 'sideways_use_adx': True, 'sideways_use_spike': False, 'sideways_rsi_required': False}.
[I 2025-09-01 09:30:07,068] Trial 148 finished with values: [-1000000000.0, 1000000000.0] and parameters: {'p_sma': 21, 'p_std': 52, 'p_atr': 18, 'p_adx': 18, 'rsi_period': 21, 'ema1': 20, 'ema2': 16, 'slip_atr_k': 0.04492795137358657, 'slip_spread_k': 0.6747770823349181, 'spread_hl_frac': 0.029751927453508426, 'bb_std_mult': 1.5483364215113957, 'rsi_os': 40, 'rsi_ob': 68, 'vol_spike': 0.00032968275188974966, 'adx_thresh': 31.078585153755462, 'atr_min_pct': 0.027355902110938524, 'atr_max_pct': 0.056574669217429624, 'tp_mult': 2.0619731294966157, 'tsl_mult': 0.4852032329019934, 'strategy': 'breakout', 'time_stop': 291, 'use_sma': True, 'use_atr': False, 'use_adx': False, 'use_ema': True, 'use_spike': True, 'rsi_required': True, 'edge_k': 1.0609281235062837, 'edge_cap': 0.7819713078253889, 'bull_strategy': 'breakout', 'bull_bb_std_mult': 3.594690333092481, 'bull_rsi_os': 50, 'bull_rsi_ob': 46, 'bull_adx_thresh': 5.546011966036744, 'bull_atr_min_pct': 0.012689684160770324, 'bull_atr_max_pct': 0.09400002857805358, 'bull_tp_mult': 1.6999455170369853, 'bull_tsl_mult': 0.004661873262535365, 'bull_time_stop': 253, 'bull_use_sma': True, 'bull_use_ema': False, 'bull_use_atr': True, 'bull_use_adx': False, 'bull_use_spike': False, 'bull_rsi_required': True, 'bear_strategy': 'mean_reversion', 'bear_bb_std_mult': 1.9855567257789823, 'bear_rsi_os': 53, 'bear_rsi_ob': 92, 'bear_adx_thresh': 24.034290588653068, 'bear_atr_min_pct': 0.0279252950656707, 'bear_atr_max_pct': 0.0547769262076863, 'bear_tp_mult': 2.1838648003414387, 'bear_tsl_mult': 0.34443585284333733, 'bear_time_stop': 289, 'bear_use_sma': True, 'bear_use_ema': True, 'bear_use_atr': True, 'bear_use_adx': False, 'bear_use_spike': False, 'bear_rsi_required': False, 'sideways_strategy': 'mean_reversion', 'sideways_bb_std_mult': 0.6997556474962203, 'sideways_rsi_os': 52, 'sideways_rsi_ob': 91, 'sideways_adx_thresh': 28.66946259462214, 'sideways_atr_min_pct': 0.02090460669643762, 'sideways_atr_max_pct': 0.08194857345310683, 'sideways_tp_mult': 2.2956810049148473, 'sideways_tsl_mult': 0.37785293031962863, 'sideways_time_stop': 251, 'sideways_use_sma': True, 'sideways_use_ema': False, 'sideways_use_atr': False, 'sideways_use_adx': True, 'sideways_use_spike': False, 'sideways_rsi_required': False}.
[I 2025-09-01 09:30:07,584] Trial 150 finished with values: [-1000000000.0, 1000000000.0] and parameters: {'p_sma': 26, 'p_std': 53, 'p_atr': 14, 'p_adx': 18, 'rsi_period': 25, 'ema1': 16, 'ema2': 20, 'slip_atr_k': 0.04460069157275191, 'slip_spread_k': 0.6614977298708207, 'spread_hl_frac': 0.029807689824882688, 'bb_std_mult': 1.3882242473528266, 'rsi_os': 40, 'rsi_ob': 67, 'vol_spike': 0.026780642598328373, 'adx_thresh': 30.91512451077798, 'atr_min_pct': 0.02694474698757691, 'atr_max_pct': 0.07144824072501867, 'tp_mult': 1.0461489224606597, 'tsl_mult': 0.4395525375925174, 'strategy': 'breakout', 'time_stop': 292, 'use_sma': True, 'use_atr': False, 'use_adx': False, 'use_ema': True, 'use_spike': True, 'rsi_required': True, 'edge_k': 1.0840428191978193, 'edge_cap': 0.7798686982143834, 'bull_strategy': 'breakout', 'bull_bb_std_mult': 3.5984163114039776, 'bull_rsi_os': 47, 'bull_rsi_ob': 47, 'bull_adx_thresh': 5.630543589299897, 'bull_atr_min_pct': 0.007171372287915757, 'bull_atr_max_pct': 0.09511670461083818, 'bull_tp_mult': 1.6917732596643378, 'bull_tsl_mult': 0.9232283027937125, 'bull_time_stop': 250, 'bull_use_sma': True, 'bull_use_ema': False, 'bull_use_atr': True, 'bull_use_adx': False, 'bull_use_spike': False, 'bull_rsi_required': True, 'bear_strategy': 'mean_reversion', 'bear_bb_std_mult': 1.9639219919993391, 'bear_rsi_os': 55, 'bear_rsi_ob': 92, 'bear_adx_thresh': 23.900600605074114, 'bear_atr_min_pct': 0.02789327087127101, 'bear_atr_max_pct': 0.08711381963904825, 'bear_tp_mult': 2.319535606480044, 'bear_tsl_mult': 0.39606358547537895, 'bear_time_stop': 266, 'bear_use_sma': True, 'bear_use_ema': True, 'bear_use_atr': True, 'bear_use_adx': False, 'bear_use_spike': False, 'bear_rsi_required': False, 'sideways_strategy': 'mean_reversion', 'sideways_bb_std_mult': 0.6875324037105528, 'sideways_rsi_os': 52, 'sideways_rsi_ob': 88, 'sideways_adx_thresh': 24.9888405542367, 'sideways_atr_min_pct': 0.021331888679046705, 'sideways_atr_max_pct': 0.08177470641490263, 'sideways_tp_mult': 2.2749474083598344, 'sideways_tsl_mult': 0.37044246125755304, 'sideways_time_stop': 250, 'sideways_use_sma': True, 'sideways_use_ema': False, 'sideways_use_atr': False, 'sideways_use_adx': True, 'sideways_use_spike': False, 'sideways_rsi_required': False}.
[I 2025-09-01 09:30:08,277] Trial 149 finished with values: [-1000000000.0, 1000000000.0] and parameters: {'p_sma': 25, 'p_std': 53, 'p_atr': 15, 'p_adx': 18, 'rsi_period': 24, 'ema1': 16, 'ema2': 21, 'slip_atr_k': 0.042086363916317586, 'slip_spread_k': 0.14532760287880325, 'spread_hl_frac': 0.029491689372691744, 'bb_std_mult': 1.3703116633893135, 'rsi_os': 40, 'rsi_ob': 67, 'vol_spike': 0.01929217512511693, 'adx_thresh': 31.11626885652196, 'atr_min_pct': 0.026619450379136614, 'atr_max_pct': 0.07107871637570615, 'tp_mult': 2.4408291411348184, 'tsl_mult': 0.4247036607013745, 'strategy': 'breakout', 'time_stop': 289, 'use_sma': True, 'use_atr': False, 'use_adx': False, 'use_ema': True, 'use_spike': True, 'rsi_required': True, 'edge_k': 1.090459070452175, 'edge_cap': 0.787073351184992, 'bull_strategy': 'breakout', 'bull_bb_std_mult': 3.447946341197713, 'bull_rsi_os': 53, 'bull_rsi_ob': 47, 'bull_adx_thresh': 5.16505956212378, 'bull_atr_min_pct': 0.011598734002138452, 'bull_atr_max_pct': 0.09642138421303399, 'bull_tp_mult': 1.6644463856877003, 'bull_tsl_mult': 0.004793533555276064, 'bull_time_stop': 252, 'bull_use_sma': True, 'bull_use_ema': False, 'bull_use_atr': True, 'bull_use_adx': False, 'bull_use_spike': False, 'bull_rsi_required': True, 'bear_strategy': 'mean_reversion', 'bear_bb_std_mult': 1.78089127874372, 'bear_rsi_os': 55, 'bear_rsi_ob': 91, 'bear_adx_thresh': 22.3840375769689, 'bear_atr_min_pct': 0.028259418190736157, 'bear_atr_max_pct': 0.05398496672420387, 'bear_tp_mult': 2.320406564620422, 'bear_tsl_mult': 0.4921303048427804, 'bear_time_stop': 267, 'bear_use_sma': True, 'bear_use_ema': True, 'bear_use_atr': True, 'bear_use_adx': False, 'bear_use_spike': False, 'bear_rsi_required': False, 'sideways_strategy': 'mean_reversion', 'sideways_bb_std_mult': 0.6173407095587059, 'sideways_rsi_os': 52, 'sideways_rsi_ob': 87, 'sideways_adx_thresh': 25.252326440414222, 'sideways_atr_min_pct': 0.02132872077258702, 'sideways_atr_max_pct': 0.08046388785415351, 'sideways_tp_mult': 2.149912230563536, 'sideways_tsl_mult': 0.4408185987814001, 'sideways_time_stop': 265, 'sideways_use_sma': True, 'sideways_use_ema': False, 'sideways_use_atr': False, 'sideways_use_adx': True, 'sideways_use_spike': False, 'sideways_rsi_required': False}.
[I 2025-09-01 09:30:46,259] Trial 154 finished with values: [-1000000000.0, 1000000000.0] and parameters: {'p_sma': 16, 'p_std': 60, 'p_atr': 17, 'p_adx': 24, 'rsi_period': 23, 'ema1': 18, 'ema2': 16, 'slip_atr_k': 0.05475707667314429, 'slip_spread_k': 0.6237378625689943, 'spread_hl_frac': 0.031118522795438988, 'bb_std_mult': 1.3427766424694083, 'rsi_os': 37, 'rsi_ob': 46, 'vol_spike': 0.03311170944630079, 'adx_thresh': 27.667933793365247, 'atr_min_pct': 0.027849976548170795, 'atr_max_pct': 0.0742049089041564, 'tp_mult': 1.0140715910335005, 'tsl_mult': 0.45224865973419376, 'strategy': 'breakout', 'time_stop': 210, 'use_sma': True, 'use_atr': False, 'use_adx': False, 'use_ema': True, 'use_spike': True, 'rsi_required': True, 'edge_k': 1.3770843382765268, 'edge_cap': 0.8168832764252686, 'bull_strategy': 'breakout', 'bull_bb_std_mult': 3.522678544533752, 'bull_rsi_os': 45, 'bull_rsi_ob': 51, 'bull_adx_thresh': 7.246299947163875, 'bull_atr_min_pct': 0.014155882985034597, 'bull_atr_max_pct': 0.10075358232362594, 'bull_tp_mult': 1.4234428032111484, 'bull_tsl_mult': 0.9438410039244164, 'bull_time_stop': 229, 'bull_use_sma': True, 'bull_use_ema': False, 'bull_use_atr': True, 'bull_use_adx': True, 'bull_use_spike': False, 'bull_rsi_required': True, 'bear_strategy': 'mean_reversion', 'bear_bb_std_mult': 2.034224053628902, 'bear_rsi_os': 55, 'bear_rsi_ob': 95, 'bear_adx_thresh': 23.50638351477907, 'bear_atr_min_pct': 0.027072602771381158, 'bear_atr_max_pct': 0.07376177856331659, 'bear_tp_mult': 2.0949288271249378, 'bear_tsl_mult': 0.3098163715746477, 'bear_time_stop': 293, 'bear_use_sma': True, 'bear_use_ema': True, 'bear_use_atr': True, 'bear_use_adx': False, 'bear_use_spike': False, 'bear_rsi_required': False, 'sideways_strategy': 'mean_reversion', 'sideways_bb_std_mult': 0.502002512686966, 'sideways_rsi_os': 49, 'sideways_rsi_ob': 89, 'sideways_adx_thresh': 25.827839884646696, 'sideways_atr_min_pct': 0.023899130550402305, 'sideways_atr_max_pct': 0.0706659881897597, 'sideways_tp_mult': 2.8087307885910207, 'sideways_tsl_mult': 0.4241164459085555, 'sideways_time_stop': 144, 'sideways_use_sma': True, 'sideways_use_ema': False, 'sideways_use_atr': False, 'sideways_use_adx': True, 'sideways_use_spike': False, 'sideways_rsi_required': True}.
[I 2025-09-01 09:30:47,066] Trial 152 finished with values: [-1000000000.0, 1000000000.0] and parameters: {'p_sma': 25, 'p_std': 55, 'p_atr': 15, 'p_adx': 21, 'rsi_period': 22, 'ema1': 16, 'ema2': 14, 'slip_atr_k': 0.05803991149091735, 'slip_spread_k': 0.42658787877981047, 'spread_hl_frac': 0.02535813506838507, 'bb_std_mult': 1.37544477255695, 'rsi_os': 42, 'rsi_ob': 46, 'vol_spike': 0.01786987560912895, 'adx_thresh': 32.47903108599419, 'atr_min_pct': 0.026704247105675392, 'atr_max_pct': 0.07048533721122907, 'tp_mult': 1.0475398342332718, 'tsl_mult': 0.4277184368223871, 'strategy': 'breakout', 'time_stop': 286, 'use_sma': True, 'use_atr': False, 'use_adx': False, 'use_ema': True, 'use_spike': True, 'rsi_required': True, 'edge_k': 1.4003932981218743, 'edge_cap': 0.8690686020849271, 'bull_strategy': 'breakout', 'bull_bb_std_mult': 3.4497867472275425, 'bull_rsi_os': 47, 'bull_rsi_ob': 51, 'bull_adx_thresh': 8.54334191770532, 'bull_atr_min_pct': 0.016368422366014636, 'bull_atr_max_pct': 0.07948177082122462, 'bull_tp_mult': 1.4303405554807516, 'bull_tsl_mult': 0.9498845656842673, 'bull_time_stop': 232, 'bull_use_sma': True, 'bull_use_ema': False, 'bull_use_atr': True, 'bull_use_adx': True, 'bull_use_spike': False, 'bull_rsi_required': True, 'bear_strategy': 'mean_reversion', 'bear_bb_std_mult': 2.3720449999318487, 'bear_rsi_os': 55, 'bear_rsi_ob': 91, 'bear_adx_thresh': 22.77253682837245, 'bear_atr_min_pct': 0.0063881024600132424, 'bear_atr_max_pct': 0.08632820116208369, 'bear_tp_mult': 2.099571090362584, 'bear_tsl_mult': 0.3986356032003391, 'bear_time_stop': 267, 'bear_use_sma': True, 'bear_use_ema': True, 'bear_use_atr': True, 'bear_use_adx': False, 'bear_use_spike': False, 'bear_rsi_required': False, 'sideways_strategy': 'mean_reversion', 'sideways_bb_std_mult': 0.8636156479169635, 'sideways_rsi_os': 50, 'sideways_rsi_ob': 88, 'sideways_adx_thresh': 25.50247004221241, 'sideways_atr_min_pct': 0.024774257540683336, 'sideways_atr_max_pct': 0.08556055471444207, 'sideways_tp_mult': 2.1660803048983763, 'sideways_tsl_mult': 0.3711147641876539, 'sideways_time_stop': 147, 'sideways_use_sma': True, 'sideways_use_ema': False, 'sideways_use_atr': False, 'sideways_use_adx': True, 'sideways_use_spike': False, 'sideways_rsi_required': True}.
