[I 2025-09-01 10:35:49,397] Trial 577 finished with values: [-1000000000.0, 1000000000.0] and parameters: {'p_sma': 11, 'p_std': 36, 'p_atr': 13, 'p_adx': 22, 'rsi_period': 48, 'ema1': 8, 'ema2': 11, 'slip_atr_k': 0.018395468988189476, 'slip_spread_k': 0.8290225383878707, 'spread_hl_frac': 0.016142185849160398, 'bb_std_mult': 0.9062889345013885, 'rsi_os': 17, 'rsi_ob': 57, 'vol_spike': 0.27589556420025374, 'adx_thresh': 23.567920329459305, 'atr_min_pct': 0.01584806355481598, 'atr_max_pct': 0.010120324589423274, 'tp_mult': 1.4197892047006615, 'tsl_mult': 0.1293022784326233, 'strategy': 'mean_reversion', 'time_stop': 122, 'use_sma': False, 'use_atr': True, 'use_adx': True, 'use_ema': False, 'use_spike': False, 'rsi_required': True, 'edge_k': 1.6299115815644745, 'edge_cap': 0.15473645998469188, 'bull_strategy': 'mean_reversion', 'bull_bb_std_mult': 0.5001024772779643, 'bull_rsi_os': 15, 'bull_rsi_ob': 75, 'bull_adx_thresh': 14.894039344592938, 'bull_atr_min_pct': 0.028221654843174716, 'bull_atr_max_pct': 0.013704438895730673, 'bull_tp_mult': 1.0557161117112357, 'bull_tsl_mult': 0.788506450623969, 'bull_time_stop': 271, 'bull_use_sma': True, 'bull_use_ema': True, 'bull_use_atr': False, 'bull_use_adx': True, 'bull_use_spike': True, 'bull_rsi_required': True, 'bear_strategy': 'breakout', 'bear_bb_std_mult': 2.615130767703474, 'bear_rsi_os': 16, 'bear_rsi_ob': 82, 'bear_adx_thresh': 9.576711150808492, 'bear_atr_min_pct': 0.02193445359265916, 'bear_atr_max_pct': 0.02442221636511825, 'bear_tp_mult': 2.5994855146662657, 'bear_tsl_mult': 0.3420679818527237, 'bear_time_stop': 267, 'bear_use_sma': True, 'bear_use_ema': False, 'bear_use_atr': False, 'bear_use_adx': True, 'bear_use_spike': True, 'bear_rsi_required': False, 'sideways_strategy': 'breakout', 'sideways_bb_std_mult': 1.5639923910757096, 'sideways_rsi_os': 55, 'sideways_rsi_ob': 76, 'sideways_adx_thresh': 29.087530160476334, 'sideways_atr_min_pct': 0.016918619927655112, 'sideways_atr_max_pct': 0.016215390816371883, 'sideways_tp_mult': 2.1594108399540235, 'sideways_tsl_mult': 0.2967366590139237, 'sideways_time_stop': 229, 'sideways_use_sma': False, 'sideways_use_ema': True, 'sideways_use_atr': True, 'sideways_use_adx': False, 'sideways_use_spike': False, 'sideways_rsi_required': True}.
[I 2025-09-01 10:35:50,841] Trial 579 finished with values: [-1000000000.0, 1000000000.0] and parameters: {'p_sma': 42, 'p_std': 32, 'p_atr': 13, 'p_adx': 22, 'rsi_period': 33, 'ema1': 8, 'ema2': 13, 'slip_atr_k': 0.017014501456620916, 'slip_spread_k': 0.8330435591758321, 'spread_hl_frac': 0.015203446240731042, 'bb_std_mult': 1.0004262814411673, 'rsi_os': 27, 'rsi_ob': 59, 'vol_spike': 0.07586597186801433, 'adx_thresh': 23.68564794417398, 'atr_min_pct': 0.023743301195739877, 'atr_max_pct': 0.020375392643467338, 'tp_mult': 1.45277303924818, 'tsl_mult': 0.2150183367918017, 'strategy': 'breakout', 'time_stop': 99, 'use_sma': True, 'use_atr': False, 'use_adx': False, 'use_ema': False, 'use_spike': False, 'rsi_required': True, 'edge_k': 1.597309471187965, 'edge_cap': 0.46351428392080235, 'bull_strategy': 'breakout', 'bull_bb_std_mult': 2.0188279574178565, 'bull_rsi_os': 18, 'bull_rsi_ob': 75, 'bull_adx_thresh': 16.48121726866707, 'bull_atr_min_pct': 0.0015409340487828078, 'bull_atr_max_pct': 0.030426045056205622, 'bull_tp_mult': 2.2654459985611246, 'bull_tsl_mult': 0.6553426265608945, 'bull_time_stop': 259, 'bull_use_sma': True, 'bull_use_ema': False, 'bull_use_atr': False, 'bull_use_adx': True, 'bull_use_spike': True, 'bull_rsi_required': True, 'bear_strategy': 'breakout', 'bear_bb_std_mult': 1.6281588501370945, 'bear_rsi_os': 19, 'bear_rsi_ob': 83, 'bear_adx_thresh': 25.41678896731145, 'bear_atr_min_pct': 0.003065283443298332, 'bear_atr_max_pct': 0.133003810919642, 'bear_tp_mult': 1.8423973911550808, 'bear_tsl_mult': 0.3411045865610926, 'bear_time_stop': 261, 'bear_use_sma': True, 'bear_use_ema': False, 'bear_use_atr': False, 'bear_use_adx': True, 'bear_use_spike': True, 'bear_rsi_required': False, 'sideways_strategy': 'breakout', 'sideways_bb_std_mult': 2.610471941847326, 'sideways_rsi_os': 54, 'sideways_rsi_ob': 51, 'sideways_adx_thresh': 30.570100605840985, 'sideways_atr_min_pct': 0.006703376167062471, 'sideways_atr_max_pct': 0.05047220414553394, 'sideways_tp_mult': 1.114481857141619, 'sideways_tsl_mult': 0.3098954714935103, 'sideways_time_stop': 248, 'sideways_use_sma': False, 'sideways_use_ema': True, 'sideways_use_atr': True, 'sideways_use_adx': False, 'sideways_use_spike': True, 'sideways_rsi_required': True}.
[I 2025-09-01 10:35:59,609] Trial 581 finished with values: [-1000000000.0, 1000000000.0] and parameters: {'p_sma': 14, 'p_std': 27, 'p_atr': 13, 'p_adx': 9, 'rsi_period': 32, 'ema1': 7, 'ema2': 34, 'slip_atr_k': 0.010674853836060151, 'slip_spread_k': 0.49602631952870024, 'spread_hl_frac': 0.011122372562364102, 'bb_std_mult': 0.9861863880516895, 'rsi_os': 14, 'rsi_ob': 58, 'vol_spike': 0.06345443148275884, 'adx_thresh': 25.343032181480254, 'atr_min_pct': 0.019055225178879108, 'atr_max_pct': 0.0162715343988383, 'tp_mult': 2.958485004746601, 'tsl_mult': 0.23697973933677507, 'strategy': 'breakout', 'time_stop': 130, 'use_sma': True, 'use_atr': False, 'use_adx': False, 'use_ema': False, 'use_spike': False, 'rsi_required': True, 'edge_k': 1.6874461142188155, 'edge_cap': 0.4983145481977417, 'bull_strategy': 'mean_reversion', 'bull_bb_std_mult': 1.8983137437680186, 'bull_rsi_os': 18, 'bull_rsi_ob': 76, 'bull_adx_thresh': 15.28175187607003, 'bull_atr_min_pct': 0.002507057088189409, 'bull_atr_max_pct': 0.0176955688910809, 'bull_tp_mult': 1.160644074439562, 'bull_tsl_mult': 0.7647104502030837, 'bull_time_stop': 286, 'bull_use_sma': True, 'bull_use_ema': False, 'bull_use_atr': False, 'bull_use_adx': True, 'bull_use_spike': True, 'bull_rsi_required': True, 'bear_strategy': 'breakout', 'bear_bb_std_mult': 2.200076620762996, 'bear_rsi_os': 20, 'bear_rsi_ob': 45, 'bear_adx_thresh': 18.821134540209247, 'bear_atr_min_pct': 0.0009656387174675439, 'bear_atr_max_pct': 0.09094810856903723, 'bear_tp_mult': 2.9988916996469097, 'bear_tsl_mult': 0.3410316320601881, 'bear_time_stop': 94, 'bear_use_sma': True, 'bear_use_ema': True, 'bear_use_atr': False, 'bear_use_adx': True, 'bear_use_spike': True, 'bear_rsi_required': False, 'sideways_strategy': 'breakout', 'sideways_bb_std_mult': 0.6158554030220383, 'sideways_rsi_os': 35, 'sideways_rsi_ob': 46, 'sideways_adx_thresh': 12.33823329849713, 'sideways_atr_min_pct': 0.02652370411694818, 'sideways_atr_max_pct': 0.043669863951447604, 'sideways_tp_mult': 2.9232850132370167, 'sideways_tsl_mult': 0.33962004391960304, 'sideways_time_stop': 240, 'sideways_use_sma': False, 'sideways_use_ema': True, 'sideways_use_atr': True, 'sideways_use_adx': False, 'sideways_use_spike': False, 'sideways_rsi_required': True}.
[I 2025-09-01 10:36:12,369] Trial 573 finished with values: [-1000000000.0, 1000000000.0] and parameters: {'p_sma': 58, 'p_std': 24, 'p_atr': 14, 'p_adx': 12, 'rsi_period': 41, 'ema1': 6, 'ema2': 10, 'slip_atr_k': 0.006655644528815195, 'slip_spread_k': 0.8388054806045576, 'spread_hl_frac': 0.009519202689151032, 'bb_std_mult': 0.898788313059393, 'rsi_os': 20, 'rsi_ob': 59, 'vol_spike': 0.24592141357003344, 'adx_thresh': 26.139818764549418, 'atr_min_pct': 0.016122593854708968, 'atr_max_pct': 0.01715446040918823, 'tp_mult': 1.3978471444861909, 'tsl_mult': 0.07221629555764816, 'strategy': 'breakout', 'time_stop': 142, 'use_sma': True, 'use_atr': False, 'use_adx': False, 'use_ema': False, 'use_spike': False, 'rsi_required': True, 'edge_k': 1.5689740729078734, 'edge_cap': 0.1697697562652937, 'bull_strategy': 'mean_reversion', 'bull_bb_std_mult': 0.5095144284083284, 'bull_rsi_os': 20, 'bull_rsi_ob': 75, 'bull_adx_thresh': 15.181809441748026, 'bull_atr_min_pct': 0.006834584216742788, 'bull_atr_max_pct': 0.011885030588447813, 'bull_tp_mult': 1.0772972715504208, 'bull_tsl_mult': 0.6512746373784727, 'bull_time_stop': 262, 'bull_use_sma': True, 'bull_use_ema': False, 'bull_use_atr': False, 'bull_use_adx': True, 'bull_use_spike': True, 'bull_rsi_required': True, 'bear_strategy': 'breakout', 'bear_bb_std_mult': 1.5240177644685124, 'bear_rsi_os': 16, 'bear_rsi_ob': 81, 'bear_adx_thresh': 17.072273175344584, 'bear_atr_min_pct': 0.0018041648323483383, 'bear_atr_max_pct': 0.12464551020517049, 'bear_tp_mult': 1.4711901666820983, 'bear_tsl_mult': 0.8782556875529199, 'bear_time_stop': 247, 'bear_use_sma': False, 'bear_use_ema': False, 'bear_use_atr': False, 'bear_use_adx': True, 'bear_use_spike': True, 'bear_rsi_required': False, 'sideways_strategy': 'breakout', 'sideways_bb_std_mult': 0.6097577189793807, 'sideways_rsi_os': 32, 'sideways_rsi_ob': 63, 'sideways_adx_thresh': 28.830745164104083, 'sideways_atr_min_pct': 0.02379338150041797, 'sideways_atr_max_pct': 0.042986778346129635, 'sideways_tp_mult': 2.0191923273119667, 'sideways_tsl_mult': 0.24658400270986436, 'sideways_time_stop': 229, 'sideways_use_sma': False, 'sideways_use_ema': True, 'sideways_use_atr': True, 'sideways_use_adx': False, 'sideways_use_spike': False, 'sideways_rsi_required': True}.
[I 2025-09-01 10:36:20,845] Trial 578 finished with values: [-0.036990320331598214, 0.03699855589176603] and parameters: {'p_sma': 11, 'p_std': 14, 'p_atr': 13, 'p_adx': 9, 'rsi_period': 33, 'ema1': 8, 'ema2': 11, 'slip_atr_k': 0.016556992726765883, 'slip_spread_k': 0.8387776867315727, 'spread_hl_frac': 0.015911611532997607, 'bb_std_mult': 0.9298288870350357, 'rsi_os': 17, 'rsi_ob': 57, 'vol_spike': 0.07673574591245007, 'adx_thresh': 25.36733959492483, 'atr_min_pct': 0.015941817153678206, 'atr_max_pct': 0.029063767310065866, 'tp_mult': 2.960725598770317, 'tsl_mult': 0.20797105338942712, 'strategy': 'breakout', 'time_stop': 130, 'use_sma': True, 'use_atr': True, 'use_adx': False, 'use_ema': False, 'use_spike': False, 'rsi_required': True, 'edge_k': 1.6379300998702901, 'edge_cap': 0.49797433608398445, 'bull_strategy': 'breakout', 'bull_bb_std_mult': 1.6078956832387301, 'bull_rsi_os': 14, 'bull_rsi_ob': 75, 'bull_adx_thresh': 15.017884770833867, 'bull_atr_min_pct': 0.001554634724868368, 'bull_atr_max_pct': 0.01031715013815511, 'bull_tp_mult': 1.0974753789646898, 'bull_tsl_mult': 0.6983862226670512, 'bull_time_stop': 257, 'bull_use_sma': True, 'bull_use_ema': False, 'bull_use_atr': False, 'bull_use_adx': True, 'bull_use_spike': True, 'bull_rsi_required': True, 'bear_strategy': 'breakout', 'bear_bb_std_mult': 1.6390408134749146, 'bear_rsi_os': 15, 'bear_rsi_ob': 82, 'bear_adx_thresh': 19.209928334839862, 'bear_atr_min_pct': 0.003274954826118377, 'bear_atr_max_pct': 0.08671756670493269, 'bear_tp_mult': 1.845571200743089, 'bear_tsl_mult': 0.7597772641083298, 'bear_time_stop': 260, 'bear_use_sma': True, 'bear_use_ema': False, 'bear_use_atr': False, 'bear_use_adx': True, 'bear_use_spike': True, 'bear_rsi_required': False, 'sideways_strategy': 'breakout', 'sideways_bb_std_mult': 1.7054696209734623, 'sideways_rsi_os': 35, 'sideways_rsi_ob': 50, 'sideways_adx_thresh': 27.46229682400648, 'sideways_atr_min_pct': 0.016856058831664925, 'sideways_atr_max_pct': 0.11151256549466212, 'sideways_tp_mult': 2.7991362851480264, 'sideways_tsl_mult': 0.3080301261973444, 'sideways_time_stop': 251, 'sideways_use_sma': False, 'sideways_use_ema': True, 'sideways_use_atr': True, 'sideways_use_adx': False, 'sideways_use_spike': True, 'sideways_rsi_required': True}.
[I 2025-09-01 10:36:24,273] Trial 580 finished with values: [-0.03957459940770236, 0.039367649299658115] and parameters: {'p_sma': 35, 'p_std': 26, 'p_atr': 13, 'p_adx': 9, 'rsi_period': 32, 'ema1': 6, 'ema2': 38, 'slip_atr_k': 0.01117690980877879, 'slip_spread_k': 0.8502248492838299, 'spread_hl_frac': 0.015203200882634143, 'bb_std_mult': 1.0015116627825598, 'rsi_os': 14, 'rsi_ob': 59, 'vol_spike': 0.1962645616313897, 'adx_thresh': 25.273007354173377, 'atr_min_pct': 0.015984626979015117, 'atr_max_pct': 0.016626434066891915, 'tp_mult': 2.9570747595080165, 'tsl_mult': 0.07390868626553151, 'strategy': 'breakout', 'time_stop': 131, 'use_sma': True, 'use_atr': False, 'use_adx': False, 'use_ema': False, 'use_spike': False, 'rsi_required': True, 'edge_k': 1.5687608780458275, 'edge_cap': 0.43647676051490125, 'bull_strategy': 'breakout', 'bull_bb_std_mult': 1.596912424776591, 'bull_rsi_os': 18, 'bull_rsi_ob': 76, 'bull_adx_thresh': 16.322100948485005, 'bull_atr_min_pct': 0.0016694122136829553, 'bull_atr_max_pct': 0.01736003937327654, 'bull_tp_mult': 1.0553995354560675, 'bull_tsl_mult': 0.656050149999162, 'bull_time_stop': 288, 'bull_use_sma': True, 'bull_use_ema': False, 'bull_use_atr': False, 'bull_use_adx': True, 'bull_use_spike': True, 'bull_rsi_required': True, 'bear_strategy': 'breakout', 'bear_bb_std_mult': 1.6379132405003114, 'bear_rsi_os': 19, 'bear_rsi_ob': 83, 'bear_adx_thresh': 27.688541401759814, 'bear_atr_min_pct': 0.010352385385707982, 'bear_atr_max_pct': 0.133482781433309, 'bear_tp_mult': 1.8733363375215488, 'bear_tsl_mult': 0.7358382703790047, 'bear_time_stop': 96, 'bear_use_sma': True, 'bear_use_ema': False, 'bear_use_atr': False, 'bear_use_adx': True, 'bear_use_spike': True, 'bear_rsi_required': False, 'sideways_strategy': 'breakout', 'sideways_bb_std_mult': 2.633347837718044, 'sideways_rsi_os': 20, 'sideways_rsi_ob': 59, 'sideways_adx_thresh': 30.46965967771514, 'sideways_atr_min_pct': 0.00677557556534965, 'sideways_atr_max_pct': 0.05228177379729272, 'sideways_tp_mult': 1.1029398968441328, 'sideways_tsl_mult': 0.3367581889100275, 'sideways_time_stop': 250, 'sideways_use_sma': False, 'sideways_use_ema': True, 'sideways_use_atr': True, 'sideways_use_adx': False, 'sideways_use_spike': True, 'sideways_rsi_required': True}.
[I 2025-09-01 10:36:33,642] Trial 582 finished with values: [-0.029788119246351052, 0.029856621073186766] and parameters: {'p_sma': 58, 'p_std': 35, 'p_atr': 11, 'p_adx': 18, 'rsi_period': 51, 'ema1': 6, 'ema2': 51, 'slip_atr_k': 0.024229925943385036, 'slip_spread_k': 0.8552605689560155, 'spread_hl_frac': 0.014040511276387158, 'bb_std_mult': 1.1141863175386233, 'rsi_os': 22, 'rsi_ob': 61, 'vol_spike': 0.24919958349800878, 'adx_thresh': 13.434269782799785, 'atr_min_pct': 0.01545958091956672, 'atr_max_pct': 0.0448752593616466, 'tp_mult': 1.535228034723526, 'tsl_mult': 0.09283243599510696, 'strategy': 'breakout', 'time_stop': 132, 'use_sma': True, 'use_atr': False, 'use_adx': False, 'use_ema': False, 'use_spike': False, 'rsi_required': False, 'edge_k': 0.1423090673440489, 'edge_cap': 0.21518020710125235, 'bull_strategy': 'breakout', 'bull_bb_std_mult': 0.5996229266723705, 'bull_rsi_os': 22, 'bull_rsi_ob': 79, 'bull_adx_thresh': 14.415334143289009, 'bull_atr_min_pct': 0.0013376963689505931, 'bull_atr_max_pct': 0.024161738657869983, 'bull_tp_mult': 1.973487671096684, 'bull_tsl_mult': 0.5653549767496369, 'bull_time_stop': 263, 'bull_use_sma': False, 'bull_use_ema': False, 'bull_use_atr': False, 'bull_use_adx': True, 'bull_use_spike': True, 'bull_rsi_required': False, 'bear_strategy': 'breakout', 'bear_bb_std_mult': 3.314629604132347, 'bear_rsi_os': 18, 'bear_rsi_ob': 89, 'bear_adx_thresh': 26.23037260229409, 'bear_atr_min_pct': 0.0032930540855685155, 'bear_atr_max_pct': 0.14273837765996442, 'bear_tp_mult': 1.7126626134792875, 'bear_tsl_mult': 0.7367310847658881, 'bear_time_stop': 258, 'bear_use_sma': True, 'bear_use_ema': False, 'bear_use_atr': False, 'bear_use_adx': True, 'bear_use_spike': True, 'bear_rsi_required': True, 'sideways_strategy': 'breakout', 'sideways_bb_std_mult': 2.0582305527860836, 'sideways_rsi_os': 15, 'sideways_rsi_ob': 62, 'sideways_adx_thresh': 27.577779448725536, 'sideways_atr_min_pct': 0.007514237124760471, 'sideways_atr_max_pct': 0.05138345460404732, 'sideways_tp_mult': 1.6663726809648747, 'sideways_tsl_mult': 0.7522514233517961, 'sideways_time_stop': 236, 'sideways_use_sma': False, 'sideways_use_ema': True, 'sideways_use_atr': True, 'sideways_use_adx': False, 'sideways_use_spike': True, 'sideways_rsi_required': True}.
[I 2025-09-01 10:36:58,799] Trial 583 finished with values: [-1000000000.0, 1000000000.0] and parameters: {'p_sma': 33, 'p_std': 12, 'p_atr': 11, 'p_adx': 18, 'rsi_period': 44, 'ema1': 7, 'ema2': 11, 'slip_atr_k': 0.023822260858939213, 'slip_spread_k': 0.7766264310476836, 'spread_hl_frac': 0.014300211868583063, 'bb_std_mult': 2.9303776868556435, 'rsi_os': 17, 'rsi_ob': 61, 'vol_spike': 0.19303220082626532, 'adx_thresh': 22.441170219572328, 'atr_min_pct': 0.015244276503604536, 'atr_max_pct': 0.021940500045541413, 'tp_mult': 2.3744144636620446, 'tsl_mult': 0.1542023887445039, 'strategy': 'breakout', 'time_stop': 132, 'use_sma': True, 'use_atr': False, 'use_adx': False, 'use_ema': False, 'use_spike': False, 'rsi_required': False, 'edge_k': 1.997579010273257, 'edge_cap': 0.3317195916155923, 'bull_strategy': 'breakout', 'bull_bb_std_mult': 0.6073412262914806, 'bull_rsi_os': 33, 'bull_rsi_ob': 72, 'bull_adx_thresh': 14.258892882012997, 'bull_atr_min_pct': 0.019814773105399225, 'bull_atr_max_pct': 0.01010105743947009, 'bull_tp_mult': 1.1260973803450427, 'bull_tsl_mult': 0.566220005279967, 'bull_time_stop': 53, 'bull_use_sma': False, 'bull_use_ema': False, 'bull_use_atr': False, 'bull_use_adx': True, 'bull_use_spike': True, 'bull_rsi_required': False, 'bear_strategy': 'breakout', 'bear_bb_std_mult': 1.6979306894644535, 'bear_rsi_os': 18, 'bear_rsi_ob': 89, 'bear_adx_thresh': 15.080336716394429, 'bear_atr_min_pct': 0.02495673297746637, 'bear_atr_max_pct': 0.14297379229819962, 'bear_tp_mult': 1.626529768224304, 'bear_tsl_mult': 0.37271925618170243, 'bear_time_stop': 260, 'bear_use_sma': True, 'bear_use_ema': False, 'bear_use_atr': False, 'bear_use_adx': True, 'bear_use_spike': True, 'bear_rsi_required': True, 'sideways_strategy': 'breakout', 'sideways_bb_std_mult': 1.7107649544527979, 'sideways_rsi_os': 13, 'sideways_rsi_ob': 58, 'sideways_adx_thresh': 27.632152950623084, 'sideways_atr_min_pct': 0.018428229703049068, 'sideways_atr_max_pct': 0.0499124580630174, 'sideways_tp_mult': 2.7981922560207675, 'sideways_tsl_mult': 0.3335372105692659, 'sideways_time_stop': 236, 'sideways_use_sma': False, 'sideways_use_ema': True, 'sideways_use_atr': True, 'sideways_use_adx': False, 'sideways_use_spike': True, 'sideways_rsi_required': True}.
[I 2025-09-01 10:37:13,278] Trial 584 finished with values: [-1000000000.0, 1000000000.0] and parameters: {'p_sma': 13, 'p_std': 56, 'p_atr': 13, 'p_adx': 18, 'rsi_period': 67, 'ema1': 7, 'ema2': 51, 'slip_atr_k': 0.022362540772698045, 'slip_spread_k': 0.8006964510495231, 'spread_hl_frac': 0.014345808808159836, 'bb_std_mult': 1.1726481657170549, 'rsi_os': 23, 'rsi_ob': 76, 'vol_spike': 0.05309687031401488, 'adx_thresh': 24.51435102178708, 'atr_min_pct': 0.014994556868186945, 'atr_max_pct': 0.04608294298497957, 'tp_mult': 1.5175923336572499, 'tsl_mult': 0.15863025307329537, 'strategy': 'breakout', 'time_stop': 55, 'use_sma': True, 'use_atr': False, 'use_adx': False, 'use_ema': False, 'use_spike': False, 'rsi_required': False, 'edge_k': 1.5851773010217272, 'edge_cap': 0.44227933924544494, 'bull_strategy': 'mean_reversion', 'bull_bb_std_mult': 0.5842543188211012, 'bull_rsi_os': 22, 'bull_rsi_ob': 64, 'bull_adx_thresh': 12.565735080496111, 'bull_atr_min_pct': 0.019729440513187847, 'bull_atr_max_pct': 0.015424653468041383, 'bull_tp_mult': 1.2203784605795884, 'bull_tsl_mult': 0.7300375308655488, 'bull_time_stop': 30, 'bull_use_sma': False, 'bull_use_ema': False, 'bull_use_atr': False, 'bull_use_adx': True, 'bull_use_spike': True, 'bull_rsi_required': False, 'bear_strategy': 'breakout', 'bear_bb_std_mult': 1.3515037817700317, 'bear_rsi_os': 18, 'bear_rsi_ob': 60, 'bear_adx_thresh': 27.651868847327158, 'bear_atr_min_pct': 0.014863407897851134, 'bear_atr_max_pct': 0.11617678802024603, 'bear_tp_mult': 2.164920723793852, 'bear_tsl_mult': 0.3733189656141129, 'bear_time_stop': 273, 'bear_use_sma': True, 'bear_use_ema': False, 'bear_use_atr': False, 'bear_use_adx': True, 'bear_use_spike': True, 'bear_rsi_required': True, 'sideways_strategy': 'breakout', 'sideways_bb_std_mult': 2.798882503756551, 'sideways_rsi_os': 54, 'sideways_rsi_ob': 59, 'sideways_adx_thresh': 27.785473369010887, 'sideways_atr_min_pct': 0.0074441350129557165, 'sideways_atr_max_pct': 0.13612329030586645, 'sideways_tp_mult': 1.9385129916884694, 'sideways_tsl_mult': 0.3325794450277737, 'sideways_time_stop': 219, 'sideways_use_sma': False, 'sideways_use_ema': True, 'sideways_use_atr': True, 'sideways_use_adx': False, 'sideways_use_spike': False, 'sideways_rsi_required': True}.
