[I 2025-09-01 10:24:26,071] Trial 476 finished with values: [-0.016686146787249, 0.01656591451555326] and parameters: {'p_sma': 17, 'p_std': 50, 'p_atr': 15, 'p_adx': 23, 'rsi_period': 34, 'ema1': 18, 'ema2': 12, 'slip_atr_k': 0.0001834326982675643, 'slip_spread_k': 0.7542785933731992, 'spread_hl_frac': 0.016837261592414332, 'bb_std_mult': 1.1589736472403405, 'rsi_os': 17, 'rsi_ob': 59, 'vol_spike': 0.08038590083002455, 'adx_thresh': 25.480007317053268, 'atr_min_pct': 0.015149429896856, 'atr_max_pct': 0.02331005926741235, 'tp_mult': 1.3964775514966796, 'tsl_mult': 0.054178632077614516, 'strategy': 'breakout', 'time_stop': 153, 'use_sma': True, 'use_atr': False, 'use_adx': False, 'use_ema': False, 'use_spike': False, 'rsi_required': True, 'edge_k': 1.4362765191620888, 'edge_cap': 0.3001847318414175, 'bull_strategy': 'mean_reversion', 'bull_bb_std_mult': 0.6592808075656421, 'bull_rsi_os': 17, 'bull_rsi_ob': 74, 'bull_adx_thresh': 11.648634001928825, 'bull_atr_min_pct': 0.0001334056189049561, 'bull_atr_max_pct': 0.01843112663495917, 'bull_tp_mult': 1.3391400322434839, 'bull_tsl_mult': 0.5175017174568254, 'bull_time_stop': 267, 'bull_use_sma': True, 'bull_use_ema': False, 'bull_use_atr': False, 'bull_use_adx': False, 'bull_use_spike': False, 'bull_rsi_required': True, 'bear_strategy': 'breakout', 'bear_bb_std_mult': 1.2534140019356799, 'bear_rsi_os': 16, 'bear_rsi_ob': 82, 'bear_adx_thresh': 27.452807576534557, 'bear_atr_min_pct': 0.0025342384209811, 'bear_atr_max_pct': 0.14739003173195867, 'bear_tp_mult': 1.388176143213166, 'bear_tsl_mult': 0.40689731576311094, 'bear_time_stop': 258, 'bear_use_sma': True, 'bear_use_ema': False, 'bear_use_atr': True, 'bear_use_adx': True, 'bear_use_spike': True, 'bear_rsi_required': False, 'sideways_strategy': 'breakout', 'sideways_bb_std_mult': 0.6548197006021046, 'sideways_rsi_os': 55, 'sideways_rsi_ob': 95, 'sideways_adx_thresh': 26.108801151712512, 'sideways_atr_min_pct': 0.00649407251282234, 'sideways_atr_max_pct': 0.05400631717760965, 'sideways_tp_mult': 2.1005511674118957, 'sideways_tsl_mult': 0.3648077914962571, 'sideways_time_stop': 261, 'sideways_use_sma': False, 'sideways_use_ema': False, 'sideways_use_atr': False, 'sideways_use_adx': True, 'sideways_use_spike': False, 'sideways_rsi_required': True}.
[I 2025-09-01 10:24:26,886] Trial 478 finished with values: [-1000000000.0, 1000000000.0] and parameters: {'p_sma': 5, 'p_std': 50, 'p_atr': 16, 'p_adx': 23, 'rsi_period': 33, 'ema1': 30, 'ema2': 12, 'slip_atr_k': 5.7535817925705515e-06, 'slip_spread_k': 0.7583280979975093, 'spread_hl_frac': 0.012253859550700855, 'bb_std_mult': 1.144728649491946, 'rsi_os': 17, 'rsi_ob': 59, 'vol_spike': 0.07719152320704528, 'adx_thresh': 25.48693952161493, 'atr_min_pct': 0.015168933192619702, 'atr_max_pct': 0.02439395971589541, 'tp_mult': 1.4041652997970109, 'tsl_mult': 0.0742145540094517, 'strategy': 'breakout', 'time_stop': 152, 'use_sma': True, 'use_atr': False, 'use_adx': False, 'use_ema': False, 'use_spike': False, 'rsi_required': True, 'edge_k': 1.472811485550627, 'edge_cap': 0.3025905573817366, 'bull_strategy': 'mean_reversion', 'bull_bb_std_mult': 0.6544795626303213, 'bull_rsi_os': 17, 'bull_rsi_ob': 71, 'bull_adx_thresh': 9.64933830678868, 'bull_atr_min_pct': 1.794635561125536e-05, 'bull_atr_max_pct': 0.018260545288588035, 'bull_tp_mult': 1.340569617023542, 'bull_tsl_mult': 0.5183181506420256, 'bull_time_stop': 268, 'bull_use_sma': True, 'bull_use_ema': False, 'bull_use_atr': False, 'bull_use_adx': False, 'bull_use_spike': False, 'bull_rsi_required': True, 'bear_strategy': 'breakout', 'bear_bb_std_mult': 1.2571558390744817, 'bear_rsi_os': 16, 'bear_rsi_ob': 80, 'bear_adx_thresh': 27.325015868121373, 'bear_atr_min_pct': 0.0027430021526719858, 'bear_atr_max_pct': 0.14752592580204288, 'bear_tp_mult': 1.3787662146553852, 'bear_tsl_mult': 0.3980379880705554, 'bear_time_stop': 260, 'bear_use_sma': True, 'bear_use_ema': False, 'bear_use_atr': True, 'bear_use_adx': True, 'bear_use_spike': True, 'bear_rsi_required': False, 'sideways_strategy': 'breakout', 'sideways_bb_std_mult': 0.6347879798764209, 'sideways_rsi_os': 55, 'sideways_rsi_ob': 95, 'sideways_adx_thresh': 26.08933596031131, 'sideways_atr_min_pct': 0.006518480673206413, 'sideways_atr_max_pct': 0.05339733522027218, 'sideways_tp_mult': 2.1075763544687196, 'sideways_tsl_mult': 0.3590238223925772, 'sideways_time_stop': 261, 'sideways_use_sma': False, 'sideways_use_ema': False, 'sideways_use_atr': False, 'sideways_use_adx': True, 'sideways_use_spike': False, 'sideways_rsi_required': True}.
[I 2025-09-01 10:24:27,752] Trial 477 finished with values: [-0.017617208981471566, 0.01749739521321142] and parameters: {'p_sma': 20, 'p_std': 52, 'p_atr': 15, 'p_adx': 23, 'rsi_period': 34, 'ema1': 18, 'ema2': 12, 'slip_atr_k': 0.0010634725177463317, 'slip_spread_k': 0.7560925628911799, 'spread_hl_frac': 0.0125417794078556, 'bb_std_mult': 1.1440040713130064, 'rsi_os': 17, 'rsi_ob': 59, 'vol_spike': 0.07715956965116007, 'adx_thresh': 25.544077069958256, 'atr_min_pct': 0.015023662017011438, 'atr_max_pct': 0.023747032939858814, 'tp_mult': 1.3765154944266278, 'tsl_mult': 0.05892362115616554, 'strategy': 'breakout', 'time_stop': 155, 'use_sma': True, 'use_atr': False, 'use_adx': False, 'use_ema': False, 'use_spike': False, 'rsi_required': True, 'edge_k': 1.4563576822944093, 'edge_cap': 0.30319741767552283, 'bull_strategy': 'mean_reversion', 'bull_bb_std_mult': 0.5956680474328839, 'bull_rsi_os': 17, 'bull_rsi_ob': 71, 'bull_adx_thresh': 9.790955623704686, 'bull_atr_min_pct': 5.8224502339470954e-05, 'bull_atr_max_pct': 0.02001919105525237, 'bull_tp_mult': 1.3396507632916794, 'bull_tsl_mult': 0.5195774067041191, 'bull_time_stop': 266, 'bull_use_sma': True, 'bull_use_ema': False, 'bull_use_atr': False, 'bull_use_adx': False, 'bull_use_spike': False, 'bull_rsi_required': True, 'bear_strategy': 'breakout', 'bear_bb_std_mult': 1.2387605110238535, 'bear_rsi_os': 16, 'bear_rsi_ob': 80, 'bear_adx_thresh': 27.4323098296754, 'bear_atr_min_pct': 0.0015838246275936287, 'bear_atr_max_pct': 0.1472455628242294, 'bear_tp_mult': 1.3782187743746201, 'bear_tsl_mult': 0.3980096215540329, 'bear_time_stop': 233, 'bear_use_sma': True, 'bear_use_ema': False, 'bear_use_atr': True, 'bear_use_adx': True, 'bear_use_spike': True, 'bear_rsi_required': False, 'sideways_strategy': 'breakout', 'sideways_bb_std_mult': 0.5563917776099815, 'sideways_rsi_os': 55, 'sideways_rsi_ob': 95, 'sideways_adx_thresh': 26.36089742246622, 'sideways_atr_min_pct': 0.006326513105864366, 'sideways_atr_max_pct': 0.05340854833993618, 'sideways_tp_mult': 2.0937067179057864, 'sideways_tsl_mult': 0.36711272476965845, 'sideways_time_stop': 262, 'sideways_use_sma': False, 'sideways_use_ema': False, 'sideways_use_atr': False, 'sideways_use_adx': True, 'sideways_use_spike': False, 'sideways_rsi_required': True}.
[I 2025-09-01 10:25:07,728] Trial 483 finished with values: [-0.016712224239500584, 0.016590722714736376] and parameters: {'p_sma': 17, 'p_std': 51, 'p_atr': 15, 'p_adx': 23, 'rsi_period': 35, 'ema1': 6, 'ema2': 10, 'slip_atr_k': 0.00677471142650919, 'slip_spread_k': 0.7813458035902915, 'spread_hl_frac': 0.016990062180394346, 'bb_std_mult': 1.0650922510735046, 'rsi_os': 17, 'rsi_ob': 58, 'vol_spike': 0.0796105775495379, 'adx_thresh': 25.833332572992887, 'atr_min_pct': 0.015122782539627327, 'atr_max_pct': 0.02377123664038436, 'tp_mult': 1.3875851158958112, 'tsl_mult': 0.06102659626471012, 'strategy': 'breakout', 'time_stop': 156, 'use_sma': True, 'use_atr': False, 'use_adx': True, 'use_ema': False, 'use_spike': False, 'rsi_required': True, 'edge_k': 1.4847201433959847, 'edge_cap': 0.29739680297156934, 'bull_strategy': 'mean_reversion', 'bull_bb_std_mult': 0.6765536673007, 'bull_rsi_os': 17, 'bull_rsi_ob': 74, 'bull_adx_thresh': 13.804022749077307, 'bull_atr_min_pct': 2.345752175767052e-05, 'bull_atr_max_pct': 0.021901300166434698, 'bull_tp_mult': 1.290451658298294, 'bull_tsl_mult': 0.527816628175659, 'bull_time_stop': 274, 'bull_use_sma': True, 'bull_use_ema': False, 'bull_use_atr': False, 'bull_use_adx': False, 'bull_use_spike': False, 'bull_rsi_required': True, 'bear_strategy': 'breakout', 'bear_bb_std_mult': 1.2710669747169927, 'bear_rsi_os': 15, 'bear_rsi_ob': 90, 'bear_adx_thresh': 27.571290744084394, 'bear_atr_min_pct': 0.0024452203971431, 'bear_atr_max_pct': 0.1488854727366398, 'bear_tp_mult': 1.3838802410288789, 'bear_tsl_mult': 0.37831978060899735, 'bear_time_stop': 256, 'bear_use_sma': True, 'bear_use_ema': False, 'bear_use_atr': True, 'bear_use_adx': True, 'bear_use_spike': True, 'bear_rsi_required': False, 'sideways_strategy': 'breakout', 'sideways_bb_std_mult': 0.5133957725170548, 'sideways_rsi_os': 55, 'sideways_rsi_ob': 95, 'sideways_adx_thresh': 26.450965812408395, 'sideways_atr_min_pct': 0.006224187694324878, 'sideways_atr_max_pct': 0.04959686155185579, 'sideways_tp_mult': 2.108191566232424, 'sideways_tsl_mult': 0.3350611137014528, 'sideways_time_stop': 261, 'sideways_use_sma': False, 'sideways_use_ema': False, 'sideways_use_atr': False, 'sideways_use_adx': False, 'sideways_use_spike': False, 'sideways_rsi_required': True}.
[I 2025-09-01 10:25:07,707] Trial 481 finished with values: [-0.0189497024941353, 0.018828889579549597] and parameters: {'p_sma': 17, 'p_std': 50, 'p_atr': 14, 'p_adx': 23, 'rsi_period': 35, 'ema1': 18, 'ema2': 12, 'slip_atr_k': 0.0013325840233591956, 'slip_spread_k': 0.7806214995417612, 'spread_hl_frac': 0.022045237044724764, 'bb_std_mult': 1.1242557417137986, 'rsi_os': 17, 'rsi_ob': 58, 'vol_spike': 0.07775030002004954, 'adx_thresh': 25.464721513111357, 'atr_min_pct': 0.015126348143107884, 'atr_max_pct': 0.022931319138938373, 'tp_mult': 1.3982624213216392, 'tsl_mult': 0.05168752273010654, 'strategy': 'breakout', 'time_stop': 154, 'use_sma': True, 'use_atr': False, 'use_adx': False, 'use_ema': False, 'use_spike': False, 'rsi_required': True, 'edge_k': 1.450924969231608, 'edge_cap': 0.3002779863029079, 'bull_strategy': 'mean_reversion', 'bull_bb_std_mult': 0.6480363119130841, 'bull_rsi_os': 17, 'bull_rsi_ob': 74, 'bull_adx_thresh': 12.019127813075995, 'bull_atr_min_pct': 4.355999275536986e-06, 'bull_atr_max_pct': 0.01998626460965382, 'bull_tp_mult': 1.2921774065746197, 'bull_tsl_mult': 0.5248704891013498, 'bull_time_stop': 269, 'bull_use_sma': True, 'bull_use_ema': False, 'bull_use_atr': False, 'bull_use_adx': False, 'bull_use_spike': False, 'bull_rsi_required': True, 'bear_strategy': 'breakout', 'bear_bb_std_mult': 1.2477861883781602, 'bear_rsi_os': 16, 'bear_rsi_ob': 90, 'bear_adx_thresh': 27.2684543367973, 'bear_atr_min_pct': 0.002544006173980212, 'bear_atr_max_pct': 0.14999794540551814, 'bear_tp_mult': 1.3680167220150026, 'bear_tsl_mult': 0.3888659815068404, 'bear_time_stop': 257, 'bear_use_sma': True, 'bear_use_ema': False, 'bear_use_atr': True, 'bear_use_adx': True, 'bear_use_spike': True, 'bear_rsi_required': False, 'sideways_strategy': 'breakout', 'sideways_bb_std_mult': 0.502240309225722, 'sideways_rsi_os': 55, 'sideways_rsi_ob': 95, 'sideways_adx_thresh': 25.988929451436647, 'sideways_atr_min_pct': 0.00611291525704405, 'sideways_atr_max_pct': 0.05313584263664975, 'sideways_tp_mult': 2.0877219749130176, 'sideways_tsl_mult': 0.36724909970209735, 'sideways_time_stop': 261, 'sideways_use_sma': False, 'sideways_use_ema': False, 'sideways_use_atr': False, 'sideways_use_adx': False, 'sideways_use_spike': False, 'sideways_rsi_required': True}.
[I 2025-09-01 10:25:08,467] Trial 480 finished with values: [-0.016353383347750383, 0.01623289787992889] and parameters: {'p_sma': 17, 'p_std': 50, 'p_atr': 14, 'p_adx': 23, 'rsi_period': 35, 'ema1': 8, 'ema2': 12, 'slip_atr_k': 0.0007091443869190096, 'slip_spread_k': 0.7844923818702487, 'spread_hl_frac': 0.01721911450331337, 'bb_std_mult': 1.135293026349067, 'rsi_os': 17, 'rsi_ob': 58, 'vol_spike': 0.07821363008241444, 'adx_thresh': 25.43333438337792, 'atr_min_pct': 0.014927161078372985, 'atr_max_pct': 0.023055981009586255, 'tp_mult': 1.3905931684896957, 'tsl_mult': 0.06277766699014196, 'strategy': 'breakout', 'time_stop': 153, 'use_sma': True, 'use_atr': False, 'use_adx': False, 'use_ema': False, 'use_spike': False, 'rsi_required': True, 'edge_k': 1.4849452174571938, 'edge_cap': 0.29587943817822737, 'bull_strategy': 'mean_reversion', 'bull_bb_std_mult': 0.6628725453515021, 'bull_rsi_os': 18, 'bull_rsi_ob': 74, 'bull_adx_thresh': 14.873439599668131, 'bull_atr_min_pct': 9.290405338444714e-05, 'bull_atr_max_pct': 0.019235471373248034, 'bull_tp_mult': 1.2841916001683051, 'bull_tsl_mult': 0.5548383054737517, 'bull_time_stop': 267, 'bull_use_sma': True, 'bull_use_ema': False, 'bull_use_atr': False, 'bull_use_adx': False, 'bull_use_spike': False, 'bull_rsi_required': True, 'bear_strategy': 'breakout', 'bear_bb_std_mult': 1.4057390215923307, 'bear_rsi_os': 16, 'bear_rsi_ob': 85, 'bear_adx_thresh': 27.216612587987484, 'bear_atr_min_pct': 0.0024613986352671393, 'bear_atr_max_pct': 0.14971541266368016, 'bear_tp_mult': 1.3890699721073076, 'bear_tsl_mult': 0.40000830621082173, 'bear_time_stop': 258, 'bear_use_sma': True, 'bear_use_ema': False, 'bear_use_atr': True, 'bear_use_adx': True, 'bear_use_spike': True, 'bear_rsi_required': False, 'sideways_strategy': 'breakout', 'sideways_bb_std_mult': 0.5101849904441411, 'sideways_rsi_os': 55, 'sideways_rsi_ob': 95, 'sideways_adx_thresh': 26.215768244109945, 'sideways_atr_min_pct': 0.00627169908018691, 'sideways_atr_max_pct': 0.053070627924667074, 'sideways_tp_mult': 2.1008594980516504, 'sideways_tsl_mult': 0.35439346524288606, 'sideways_time_stop': 260, 'sideways_use_sma': False, 'sideways_use_ema': False, 'sideways_use_atr': False, 'sideways_use_adx': False, 'sideways_use_spike': False, 'sideways_rsi_required': True}.
[I 2025-09-01 10:25:09,684] Trial 482 finished with values: [-0.01935321955535707, 0.019231773958723594] and parameters: {'p_sma': 17, 'p_std': 51, 'p_atr': 13, 'p_adx': 23, 'rsi_period': 36, 'ema1': 18, 'ema2': 11, 'slip_atr_k': 0.005079635475122416, 'slip_spread_k': 0.7860913844351394, 'spread_hl_frac': 0.021813871078826506, 'bb_std_mult': 1.121676462616574, 'rsi_os': 16, 'rsi_ob': 58, 'vol_spike': 0.08035639887187594, 'adx_thresh': 25.0851405056677, 'atr_min_pct': 0.014865307409881491, 'atr_max_pct': 0.02339693322853771, 'tp_mult': 1.427229275167048, 'tsl_mult': 0.06135891648689703, 'strategy': 'breakout', 'time_stop': 155, 'use_sma': True, 'use_atr': False, 'use_adx': True, 'use_ema': False, 'use_spike': False, 'rsi_required': True, 'edge_k': 1.4900462786731232, 'edge_cap': 0.2995449473358337, 'bull_strategy': 'mean_reversion', 'bull_bb_std_mult': 0.6772913605396571, 'bull_rsi_os': 17, 'bull_rsi_ob': 73, 'bull_adx_thresh': 13.933172614187317, 'bull_atr_min_pct': 3.3401430922758266e-05, 'bull_atr_max_pct': 0.0204064915568873, 'bull_tp_mult': 1.2969002595342949, 'bull_tsl_mult': 0.5332135064305847, 'bull_time_stop': 273, 'bull_use_sma': True, 'bull_use_ema': False, 'bull_use_atr': False, 'bull_use_adx': False, 'bull_use_spike': False, 'bull_rsi_required': True, 'bear_strategy': 'breakout', 'bear_bb_std_mult': 1.262261277322641, 'bear_rsi_os': 16, 'bear_rsi_ob': 91, 'bear_adx_thresh': 27.658467755056385, 'bear_atr_min_pct': 0.001605944235779104, 'bear_atr_max_pct': 0.14939914333122364, 'bear_tp_mult': 1.4426440228974802, 'bear_tsl_mult': 0.382848227625013, 'bear_time_stop': 253, 'bear_use_sma': True, 'bear_use_ema': False, 'bear_use_atr': True, 'bear_use_adx': True, 'bear_use_spike': True, 'bear_rsi_required': False, 'sideways_strategy': 'breakout', 'sideways_bb_std_mult': 0.5067686328570646, 'sideways_rsi_os': 55, 'sideways_rsi_ob': 95, 'sideways_adx_thresh': 26.49172463384486, 'sideways_atr_min_pct': 0.006062404807049469, 'sideways_atr_max_pct': 0.05087199175657027, 'sideways_tp_mult': 2.1008927300423954, 'sideways_tsl_mult': 0.34524695506301645, 'sideways_time_stop': 261, 'sideways_use_sma': False, 'sideways_use_ema': True, 'sideways_use_atr': False, 'sideways_use_adx': False, 'sideways_use_spike': False, 'sideways_rsi_required': True}.
[I 2025-09-01 10:25:51,680] Trial 487 finished with values: [-1000000000.0, 1000000000.0] and parameters: {'p_sma': 17, 'p_std': 51, 'p_atr': 14, 'p_adx': 23, 'rsi_period': 35, 'ema1': 7, 'ema2': 11, 'slip_atr_k': 0.0034284542584489828, 'slip_spread_k': 0.7958186769734827, 'spread_hl_frac': 0.01680299218309985, 'bb_std_mult': 1.0364285919216916, 'rsi_os': 17, 'rsi_ob': 58, 'vol_spike': 0.07401906628502958, 'adx_thresh': 25.743906950439875, 'atr_min_pct': 0.0150695405221952, 'atr_max_pct': 0.021318628683609418, 'tp_mult': 1.3883200289731066, 'tsl_mult': 0.06632433857135671, 'strategy': 'mean_reversion', 'time_stop': 154, 'use_sma': False, 'use_atr': False, 'use_adx': True, 'use_ema': False, 'use_spike': False, 'rsi_required': False, 'edge_k': 1.4914274740384355, 'edge_cap': 0.2902426068586068, 'bull_strategy': 'mean_reversion', 'bull_bb_std_mult': 0.6809801102005244, 'bull_rsi_os': 18, 'bull_rsi_ob': 74, 'bull_adx_thresh': 13.92487460933701, 'bull_atr_min_pct': 0.00018107222400471907, 'bull_atr_max_pct': 0.021463482411491402, 'bull_tp_mult': 1.2854377564105979, 'bull_tsl_mult': 0.639724840094975, 'bull_time_stop': 273, 'bull_use_sma': True, 'bull_use_ema': True, 'bull_use_atr': False, 'bull_use_adx': False, 'bull_use_spike': True, 'bull_rsi_required': False, 'bear_strategy': 'breakout', 'bear_bb_std_mult': 1.4156992357038025, 'bear_rsi_os': 16, 'bear_rsi_ob': 85, 'bear_adx_thresh': 27.52761903270381, 'bear_atr_min_pct': 0.0014535616335239882, 'bear_atr_max_pct': 0.14983897033721386, 'bear_tp_mult': 1.3835297841390455, 'bear_tsl_mult': 0.37757287185238175, 'bear_time_stop': 254, 'bear_use_sma': False, 'bear_use_ema': False, 'bear_use_atr': True, 'bear_use_adx': True, 'bear_use_spike': True, 'bear_rsi_required': False, 'sideways_strategy': 'breakout', 'sideways_bb_std_mult': 0.5000348743697427, 'sideways_rsi_os': 55, 'sideways_rsi_ob': 95, 'sideways_adx_thresh': 26.210386569992323, 'sideways_atr_min_pct': 0.006036688939170744, 'sideways_atr_max_pct': 0.05034161526512418, 'sideways_tp_mult': 2.104613337246891, 'sideways_tsl_mult': 0.3278186444390223, 'sideways_time_stop': 260, 'sideways_use_sma': False, 'sideways_use_ema': False, 'sideways_use_atr': False, 'sideways_use_adx': False, 'sideways_use_spike': False, 'sideways_rsi_required': True}.
[I 2025-09-01 10:25:52,079] Trial 484 finished with values: [-1000000000.0, 1000000000.0] and parameters: {'p_sma': 17, 'p_std': 51, 'p_atr': 15, 'p_adx': 23, 'rsi_period': 35, 'ema1': 18, 'ema2': 11, 'slip_atr_k': 0.004884898976785578, 'slip_spread_k': 0.7774818154469554, 'spread_hl_frac': 0.016431802484796438, 'bb_std_mult': 1.082946405426264, 'rsi_os': 16, 'rsi_ob': 58, 'vol_spike': 0.08103361931626052, 'adx_thresh': 25.76143756064557, 'atr_min_pct': 0.015030030340600724, 'atr_max_pct': 0.02276845778949739, 'tp_mult': 1.3738924076309167, 'tsl_mult': 0.059101381511231836, 'strategy': 'mean_reversion', 'time_stop': 153, 'use_sma': False, 'use_atr': False, 'use_adx': True, 'use_ema': False, 'use_spike': False, 'rsi_required': False, 'edge_k': 1.4563446783610947, 'edge_cap': 0.300612412631763, 'bull_strategy': 'mean_reversion', 'bull_bb_std_mult': 0.6648865769523035, 'bull_rsi_os': 17, 'bull_rsi_ob': 74, 'bull_adx_thresh': 12.010797665204823, 'bull_atr_min_pct': 7.315994786079762e-05, 'bull_atr_max_pct': 0.020961440465337627, 'bull_tp_mult': 1.2960548907984322, 'bull_tsl_mult': 0.5258950103202383, 'bull_time_stop': 273, 'bull_use_sma': True, 'bull_use_ema': True, 'bull_use_atr': False, 'bull_use_adx': False, 'bull_use_spike': False, 'bull_rsi_required': False, 'bear_strategy': 'breakout', 'bear_bb_std_mult': 1.2744357694976338, 'bear_rsi_os': 16, 'bear_rsi_ob': 86, 'bear_adx_thresh': 27.2111047697747, 'bear_atr_min_pct': 0.0018059217855661827, 'bear_atr_max_pct': 0.1499590634112843, 'bear_tp_mult': 1.3814498998141995, 'bear_tsl_mult': 0.3806272450021127, 'bear_time_stop': 261, 'bear_use_sma': True, 'bear_use_ema': False, 'bear_use_atr': True, 'bear_use_adx': True, 'bear_use_spike': True, 'bear_rsi_required': False, 'sideways_strategy': 'breakout', 'sideways_bb_std_mult': 0.5971476611221472, 'sideways_rsi_os': 55, 'sideways_rsi_ob': 95, 'sideways_adx_thresh': 26.203323867650784, 'sideways_atr_min_pct': 0.006224283377345955, 'sideways_atr_max_pct': 0.05050611117272449, 'sideways_tp_mult': 2.0804037574742495, 'sideways_tsl_mult': 0.3395618247350854, 'sideways_time_stop': 263, 'sideways_use_sma': False, 'sideways_use_ema': False, 'sideways_use_atr': False, 'sideways_use_adx': False, 'sideways_use_spike': False, 'sideways_rsi_required': True}.
