[I 2025-09-01 09:56:18,148] Trial 308 finished with values: [-1000000000.0, 1000000000.0] and parameters: {'p_sma': 34, 'p_std': 54, 'p_atr': 9, 'p_adx': 22, 'rsi_period': 33, 'ema1': 12, 'ema2': 18, 'slip_atr_k': 0.05188861862237277, 'slip_spread_k': 0.4307667931101504, 'spread_hl_frac': 0.046777683326788666, 'bb_std_mult': 3.2198260120719935, 'rsi_os': 20, 'rsi_ob': 70, 'vol_spike': 0.25237079704573445, 'adx_thresh': 33.15282438708623, 'atr_min_pct': 0.010683584441809243, 'atr_max_pct': 0.05731762429099053, 'tp_mult': 1.253903272561914, 'tsl_mult': 0.19485667648049715, 'strategy': 'mean_reversion', 'time_stop': 251, 'use_sma': False, 'use_atr': True, 'use_adx': False, 'use_ema': True, 'use_spike': False, 'rsi_required': True, 'edge_k': 0.7416486745093596, 'edge_cap': 0.5508022780901687, 'bull_strategy': 'mean_reversion', 'bull_bb_std_mult': 0.5026897153296519, 'bull_rsi_os': 45, 'bull_rsi_ob': 46, 'bull_adx_thresh': 34.35370017052412, 'bull_atr_min_pct': 0.0018249267870465407, 'bull_atr_max_pct': 0.1395066287455448, 'bull_tp_mult': 2.170106813669848, 'bull_tsl_mult': 0.3615816341584839, 'bull_time_stop': 51, 'bull_use_sma': True, 'bull_use_ema': True, 'bull_use_atr': False, 'bull_use_adx': True, 'bull_use_spike': False, 'bull_rsi_required': True, 'bear_strategy': 'mean_reversion', 'bear_bb_std_mult': 0.9488752278515027, 'bear_rsi_os': 55, 'bear_rsi_ob': 82, 'bear_adx_thresh': 15.009296607257694, 'bear_atr_min_pct': 0.0033302171473190605, 'bear_atr_max_pct': 0.06653089127049437, 'bear_tp_mult': 1.825518042699298, 'bear_tsl_mult': 0.5315010511626617, 'bear_time_stop': 285, 'bear_use_sma': True, 'bear_use_ema': False, 'bear_use_atr': False, 'bear_use_adx': False, 'bear_use_spike': False, 'bear_rsi_required': False, 'sideways_strategy': 'mean_reversion', 'sideways_bb_std_mult': 0.9461192204636057, 'sideways_rsi_os': 48, 'sideways_rsi_ob': 55, 'sideways_adx_thresh': 14.755679659075032, 'sideways_atr_min_pct': 0.008056232613390333, 'sideways_atr_max_pct': 0.058376446315863736, 'sideways_tp_mult': 1.7486183583006838, 'sideways_tsl_mult': 0.5007312073896565, 'sideways_time_stop': 148, 'sideways_use_sma': False, 'sideways_use_ema': False, 'sideways_use_atr': False, 'sideways_use_adx': True, 'sideways_use_spike': False, 'sideways_rsi_required': True}.
[I 2025-09-01 09:56:19,008] Trial 307 finished with values: [-1000000000.0, 1000000000.0] and parameters: {'p_sma': 17, 'p_std': 54, 'p_atr': 18, 'p_adx': 8, 'rsi_period': 27, 'ema1': 12, 'ema2': 29, 'slip_atr_k': 0.1974546293703464, 'slip_spread_k': 0.9267208170507372, 'spread_hl_frac': 0.012719904278484864, 'bb_std_mult': 2.566281231307222, 'rsi_os': 20, 'rsi_ob': 70, 'vol_spike': 0.2063866325346258, 'adx_thresh': 33.193486298734136, 'atr_min_pct': 0.0068243883384791135, 'atr_max_pct': 0.05639785298732661, 'tp_mult': 1.2379840800199893, 'tsl_mult': 0.6955851265490408, 'strategy': 'mean_reversion', 'time_stop': 252, 'use_sma': False, 'use_atr': True, 'use_adx': False, 'use_ema': True, 'use_spike': False, 'rsi_required': True, 'edge_k': 1.2437060197998235, 'edge_cap': 0.9973218043668739, 'bull_strategy': 'mean_reversion', 'bull_bb_std_mult': 1.0002782845298375, 'bull_rsi_os': 45, 'bull_rsi_ob': 52, 'bull_adx_thresh': 34.30910702210174, 'bull_atr_min_pct': 0.009739462274803372, 'bull_atr_max_pct': 0.041744484684695646, 'bull_tp_mult': 2.6665757672704054, 'bull_tsl_mult': 0.3612303205127612, 'bull_time_stop': 45, 'bull_use_sma': True, 'bull_use_ema': True, 'bull_use_atr': False, 'bull_use_adx': True, 'bull_use_spike': False, 'bull_rsi_required': True, 'bear_strategy': 'mean_reversion', 'bear_bb_std_mult': 0.9421701593660419, 'bear_rsi_os': 14, 'bear_rsi_ob': 75, 'bear_adx_thresh': 23.39486657000101, 'bear_atr_min_pct': 0.02201172315305888, 'bear_atr_max_pct': 0.06570807848002713, 'bear_tp_mult': 1.3123136763788985, 'bear_tsl_mult': 0.4365403632809954, 'bear_time_stop': 285, 'bear_use_sma': True, 'bear_use_ema': False, 'bear_use_atr': False, 'bear_use_adx': False, 'bear_use_spike': False, 'bear_rsi_required': False, 'sideways_strategy': 'mean_reversion', 'sideways_bb_std_mult': 0.5460647919449053, 'sideways_rsi_os': 36, 'sideways_rsi_ob': 57, 'sideways_adx_thresh': 21.717618984747467, 'sideways_atr_min_pct': 0.009352425292473793, 'sideways_atr_max_pct': 0.06373844195030637, 'sideways_tp_mult': 2.384410529441128, 'sideways_tsl_mult': 0.5101976751892505, 'sideways_time_stop': 173, 'sideways_use_sma': False, 'sideways_use_ema': False, 'sideways_use_atr': False, 'sideways_use_adx': True, 'sideways_use_spike': False, 'sideways_rsi_required': True}.
[I 2025-09-01 09:56:19,017] Trial 305 finished with values: [-1000000000.0, 1000000000.0] and parameters: {'p_sma': 15, 'p_std': 48, 'p_atr': 27, 'p_adx': 8, 'rsi_period': 34, 'ema1': 25, 'ema2': 18, 'slip_atr_k': 0.03959284064918133, 'slip_spread_k': 0.9261085406912999, 'spread_hl_frac': 0.02981540300393131, 'bb_std_mult': 2.8167612543131475, 'rsi_os': 40, 'rsi_ob': 93, 'vol_spike': 0.08931546845869731, 'adx_thresh': 31.904773190978602, 'atr_min_pct': 0.0012444754573991516, 'atr_max_pct': 0.09890747030233576, 'tp_mult': 1.074511141042995, 'tsl_mult': 0.6982751928342587, 'strategy': 'breakout', 'time_stop': 259, 'use_sma': True, 'use_atr': False, 'use_adx': False, 'use_ema': False, 'use_spike': True, 'rsi_required': True, 'edge_k': 1.4208306384789844, 'edge_cap': 0.932632873601464, 'bull_strategy': 'mean_reversion', 'bull_bb_std_mult': 3.4883124056574375, 'bull_rsi_os': 44, 'bull_rsi_ob': 48, 'bull_adx_thresh': 24.1513820622638, 'bull_atr_min_pct': 0.0018650812063841088, 'bull_atr_max_pct': 0.08782427629029742, 'bull_tp_mult': 2.9048062950022926, 'bull_tsl_mult': 0.4506964119517669, 'bull_time_stop': 231, 'bull_use_sma': False, 'bull_use_ema': False, 'bull_use_atr': False, 'bull_use_adx': False, 'bull_use_spike': False, 'bull_rsi_required': True, 'bear_strategy': 'mean_reversion', 'bear_bb_std_mult': 0.9737696843935995, 'bear_rsi_os': 55, 'bear_rsi_ob': 83, 'bear_adx_thresh': 25.040339070925057, 'bear_atr_min_pct': 0.006251917978592942, 'bear_atr_max_pct': 0.14712225636963405, 'bear_tp_mult': 1.3099618850448727, 'bear_tsl_mult': 0.4959629113771804, 'bear_time_stop': 299, 'bear_use_sma': False, 'bear_use_ema': False, 'bear_use_atr': True, 'bear_use_adx': True, 'bear_use_spike': False, 'bear_rsi_required': True, 'sideways_strategy': 'breakout', 'sideways_bb_std_mult': 3.4397551139523763, 'sideways_rsi_os': 50, 'sideways_rsi_ob': 90, 'sideways_adx_thresh': 24.03808497215391, 'sideways_atr_min_pct': 0.009278112013512915, 'sideways_atr_max_pct': 0.024916715677024352, 'sideways_tp_mult': 1.6306465196693907, 'sideways_tsl_mult': 0.5041890668951822, 'sideways_time_stop': 37, 'sideways_use_sma': False, 'sideways_use_ema': True, 'sideways_use_atr': False, 'sideways_use_adx': True, 'sideways_use_spike': False, 'sideways_rsi_required': False}.
[I 2025-09-01 09:57:02,705] Trial 312 finished with values: [-0.03331935173892675, 0.03314608811909765] and parameters: {'p_sma': 17, 'p_std': 44, 'p_atr': 22, 'p_adx': 10, 'rsi_period': 72, 'ema1': 17, 'ema2': 13, 'slip_atr_k': 0.16344058911727824, 'slip_spread_k': 0.6488716996608708, 'spread_hl_frac': 0.02705096124707856, 'bb_std_mult': 2.1586411179932083, 'rsi_os': 24, 'rsi_ob': 51, 'vol_spike': 0.22223402718809687, 'adx_thresh': 6.564054384463391, 'atr_min_pct': 0.015309438701722713, 'atr_max_pct': 0.14478208652852673, 'tp_mult': 1.1862694050422955, 'tsl_mult': 0.6651246930263308, 'strategy': 'breakout', 'time_stop': 90, 'use_sma': True, 'use_atr': False, 'use_adx': False, 'use_ema': True, 'use_spike': True, 'rsi_required': True, 'edge_k': 1.1703391581543279, 'edge_cap': 0.3777187788124986, 'bull_strategy': 'mean_reversion', 'bull_bb_std_mult': 3.388793988028471, 'bull_rsi_os': 30, 'bull_rsi_ob': 64, 'bull_adx_thresh': 6.382486628398032, 'bull_atr_min_pct': 0.0006552115861871085, 'bull_atr_max_pct': 0.06127056313513865, 'bull_tp_mult': 2.0559058339960803, 'bull_tsl_mult': 0.667215790242989, 'bull_time_stop': 208, 'bull_use_sma': True, 'bull_use_ema': False, 'bull_use_atr': True, 'bull_use_adx': False, 'bull_use_spike': False, 'bull_rsi_required': True, 'bear_strategy': 'mean_reversion', 'bear_bb_std_mult': 0.7979500462100826, 'bear_rsi_os': 53, 'bear_rsi_ob': 79, 'bear_adx_thresh': 9.992997736288208, 'bear_atr_min_pct': 0.004403162488361513, 'bear_atr_max_pct': 0.04300251803633914, 'bear_tp_mult': 1.2163747200491206, 'bear_tsl_mult': 0.1255928793569997, 'bear_time_stop': 293, 'bear_use_sma': True, 'bear_use_ema': False, 'bear_use_atr': True, 'bear_use_adx': False, 'bear_use_spike': False, 'bear_rsi_required': False, 'sideways_strategy': 'mean_reversion', 'sideways_bb_std_mult': 0.8246431139033337, 'sideways_rsi_os': 44, 'sideways_rsi_ob': 65, 'sideways_adx_thresh': 23.120135769747844, 'sideways_atr_min_pct': 0.018048499624907656, 'sideways_atr_max_pct': 0.0380685464790267, 'sideways_tp_mult': 2.4504216079337975, 'sideways_tsl_mult': 0.8251734775691594, 'sideways_time_stop': 14, 'sideways_use_sma': True, 'sideways_use_ema': False, 'sideways_use_atr': True, 'sideways_use_adx': True, 'sideways_use_spike': True, 'sideways_rsi_required': False}.
[I 2025-09-01 09:57:02,722] Trial 309 finished with values: [-1000000000.0, 1000000000.0] and parameters: {'p_sma': 17, 'p_std': 54, 'p_atr': 19, 'p_adx': 22, 'rsi_period': 33, 'ema1': 12, 'ema2': 30, 'slip_atr_k': 0.05280418733208934, 'slip_spread_k': 0.6512202082609914, 'spread_hl_frac': 0.048195733179401394, 'bb_std_mult': 2.572462526358003, 'rsi_os': 41, 'rsi_ob': 67, 'vol_spike': 0.10417629185812527, 'adx_thresh': 33.83539876477427, 'atr_min_pct': 0.006986681590080419, 'atr_max_pct': 0.05722102811250296, 'tp_mult': 1.1830877079218818, 'tsl_mult': 0.2443375685959659, 'strategy': 'mean_reversion', 'time_stop': 157, 'use_sma': False, 'use_atr': True, 'use_adx': False, 'use_ema': True, 'use_spike': False, 'rsi_required': True, 'edge_k': 1.2302581327443198, 'edge_cap': 0.5681341880427568, 'bull_strategy': 'mean_reversion', 'bull_bb_std_mult': 3.3955151145167553, 'bull_rsi_os': 45, 'bull_rsi_ob': 94, 'bull_adx_thresh': 21.583536198371196, 'bull_atr_min_pct': 0.0006349098099285901, 'bull_atr_max_pct': 0.08201713270313375, 'bull_tp_mult': 2.9591771887083995, 'bull_tsl_mult': 0.3810294686502065, 'bull_time_stop': 180, 'bull_use_sma': True, 'bull_use_ema': True, 'bull_use_atr': True, 'bull_use_adx': True, 'bull_use_spike': False, 'bull_rsi_required': True, 'bear_strategy': 'mean_reversion', 'bear_bb_std_mult': 0.8153901360847786, 'bear_rsi_os': 7, 'bear_rsi_ob': 83, 'bear_adx_thresh': 10.009566108788652, 'bear_atr_min_pct': 0.021820166782027008, 'bear_atr_max_pct': 0.047497096231448994, 'bear_tp_mult': 1.8387130082457388, 'bear_tsl_mult': 0.13077110887707682, 'bear_time_stop': 122, 'bear_use_sma': True, 'bear_use_ema': False, 'bear_use_atr': False, 'bear_use_adx': False, 'bear_use_spike': False, 'bear_rsi_required': False, 'sideways_strategy': 'mean_reversion', 'sideways_bb_std_mult': 0.838004014283477, 'sideways_rsi_os': 19, 'sideways_rsi_ob': 85, 'sideways_adx_thresh': 21.778487415273467, 'sideways_atr_min_pct': 0.008162399701821067, 'sideways_atr_max_pct': 0.06322544749177178, 'sideways_tp_mult': 1.7389720302437948, 'sideways_tsl_mult': 0.7062457658299272, 'sideways_time_stop': 13, 'sideways_use_sma': True, 'sideways_use_ema': False, 'sideways_use_atr': False, 'sideways_use_adx': True, 'sideways_use_spike': False, 'sideways_rsi_required': True}.
[I 2025-09-01 09:57:03,295] Trial 311 finished with values: [-1000000000.0, 1000000000.0] and parameters: {'p_sma': 17, 'p_std': 44, 'p_atr': 22, 'p_adx': 25, 'rsi_period': 31, 'ema1': 29, 'ema2': 13, 'slip_atr_k': 0.020598401838302846, 'slip_spread_k': 0.6480983938606785, 'spread_hl_frac': 0.04763684347135175, 'bb_std_mult': 1.5748303596454147, 'rsi_os': 42, 'rsi_ob': 68, 'vol_spike': 0.10394421758914688, 'adx_thresh': 23.68276827327192, 'atr_min_pct': 0.0005248987839467003, 'atr_max_pct': 0.08395685475623008, 'tp_mult': 1.176630372857387, 'tsl_mult': 0.8965595553918317, 'strategy': 'breakout', 'time_stop': 157, 'use_sma': True, 'use_atr': False, 'use_adx': False, 'use_ema': True, 'use_spike': True, 'rsi_required': True, 'edge_k': 1.2316240453789267, 'edge_cap': 0.5681753321331479, 'bull_strategy': 'mean_reversion', 'bull_bb_std_mult': 3.391649586107455, 'bull_rsi_os': 36, 'bull_rsi_ob': 47, 'bull_adx_thresh': 21.482540496360308, 'bull_atr_min_pct': 0.0006313182811997537, 'bull_atr_max_pct': 0.06948044038460137, 'bull_tp_mult': 2.504562680995059, 'bull_tsl_mult': 0.665715904948875, 'bull_time_stop': 208, 'bull_use_sma': True, 'bull_use_ema': False, 'bull_use_atr': True, 'bull_use_adx': False, 'bull_use_spike': False, 'bull_rsi_required': True, 'bear_strategy': 'mean_reversion', 'bear_bb_std_mult': 0.8095016244839103, 'bear_rsi_os': 53, 'bear_rsi_ob': 79, 'bear_adx_thresh': 23.895388549085396, 'bear_atr_min_pct': 0.0055899315877110875, 'bear_atr_max_pct': 0.09245199909843183, 'bear_tp_mult': 1.2159218719695222, 'bear_tsl_mult': 0.14787474824656116, 'bear_time_stop': 44, 'bear_use_sma': True, 'bear_use_ema': False, 'bear_use_atr': True, 'bear_use_adx': False, 'bear_use_spike': False, 'bear_rsi_required': False, 'sideways_strategy': 'mean_reversion', 'sideways_bb_std_mult': 0.837028671705407, 'sideways_rsi_os': 44, 'sideways_rsi_ob': 94, 'sideways_adx_thresh': 23.056489839791507, 'sideways_atr_min_pct': 0.010133092886302908, 'sideways_atr_max_pct': 0.06478421017650458, 'sideways_tp_mult': 2.4279668798428427, 'sideways_tsl_mult': 0.472057912450481, 'sideways_time_stop': 27, 'sideways_use_sma': True, 'sideways_use_ema': False, 'sideways_use_atr': True, 'sideways_use_adx': True, 'sideways_use_spike': True, 'sideways_rsi_required': False}.
[I 2025-09-01 09:57:03,650] Trial 310 finished with values: [-1000000000.0, 1000000000.0] and parameters: {'p_sma': 17, 'p_std': 53, 'p_atr': 18, 'p_adx': 23, 'rsi_period': 77, 'ema1': 17, 'ema2': 32, 'slip_atr_k': 0.16365142164925717, 'slip_spread_k': 0.6446708554482534, 'spread_hl_frac': 0.0048409154393305245, 'bb_std_mult': 1.5578172523275686, 'rsi_os': 24, 'rsi_ob': 67, 'vol_spike': 0.2045052633105645, 'adx_thresh': 25.1199211348344, 'atr_min_pct': 0.017288278731910522, 'atr_max_pct': 0.14530943540086524, 'tp_mult': 2.9048639409707127, 'tsl_mult': 0.24651418978092998, 'strategy': 'breakout', 'time_stop': 247, 'use_sma': True, 'use_atr': False, 'use_adx': False, 'use_ema': True, 'use_spike': True, 'rsi_required': True, 'edge_k': 1.2350626626999253, 'edge_cap': 0.08459429628506054, 'bull_strategy': 'mean_reversion', 'bull_bb_std_mult': 1.1326955951119055, 'bull_rsi_os': 25, 'bull_rsi_ob': 47, 'bull_adx_thresh': 31.71925716199172, 'bull_atr_min_pct': 0.0006296162426389642, 'bull_atr_max_pct': 0.04193164078129452, 'bull_tp_mult': 2.0448167711101717, 'bull_tsl_mult': 0.3827432099251459, 'bull_time_stop': 121, 'bull_use_sma': True, 'bull_use_ema': False, 'bull_use_atr': True, 'bull_use_adx': False, 'bull_use_spike': False, 'bull_rsi_required': True, 'bear_strategy': 'mean_reversion', 'bear_bb_std_mult': 0.8137815975374688, 'bear_rsi_os': 7, 'bear_rsi_ob': 75, 'bear_adx_thresh': 25.198148134025313, 'bear_atr_min_pct': 0.02470289811202256, 'bear_atr_max_pct': 0.14662464339181885, 'bear_tp_mult': 1.2239785878133853, 'bear_tsl_mult': 0.13107878057929895, 'bear_time_stop': 180, 'bear_use_sma': True, 'bear_use_ema': False, 'bear_use_atr': True, 'bear_use_adx': True, 'bear_use_spike': False, 'bear_rsi_required': False, 'sideways_strategy': 'breakout', 'sideways_bb_std_mult': 0.8273978640411972, 'sideways_rsi_os': 55, 'sideways_rsi_ob': 93, 'sideways_adx_thresh': 21.396010452631067, 'sideways_atr_min_pct': 0.009874674646171786, 'sideways_atr_max_pct': 0.06429108564096365, 'sideways_tp_mult': 2.5400037043859176, 'sideways_tsl_mult': 0.42383255217039717, 'sideways_time_stop': 14, 'sideways_use_sma': True, 'sideways_use_ema': False, 'sideways_use_atr': False, 'sideways_use_adx': True, 'sideways_use_spike': True, 'sideways_rsi_required': False}.
[I 2025-09-01 09:57:42,831] Trial 316 finished with values: [-1000000000.0, 1000000000.0] and parameters: {'p_sma': 14, 'p_std': 39, 'p_atr': 19, 'p_adx': 24, 'rsi_period': 10, 'ema1': 19, 'ema2': 23, 'slip_atr_k': 0.23024211288315033, 'slip_spread_k': 0.890204784832547, 'spread_hl_frac': 0.042640690763316974, 'bb_std_mult': 1.4463281280101337, 'rsi_os': 18, 'rsi_ob': 66, 'vol_spike': 0.06055182932584983, 'adx_thresh': 32.52647775419909, 'atr_min_pct': 0.014010812123934744, 'atr_max_pct': 0.12323325210396735, 'tp_mult': 1.1458741829612609, 'tsl_mult': 0.6950035635860332, 'strategy': 'breakout', 'time_stop': 71, 'use_sma': True, 'use_atr': False, 'use_adx': True, 'use_ema': True, 'use_spike': True, 'rsi_required': False, 'edge_k': 1.0447249013554232, 'edge_cap': 0.5316789576762859, 'bull_strategy': 'mean_reversion', 'bull_bb_std_mult': 3.5452937208996103, 'bull_rsi_os': 20, 'bull_rsi_ob': 54, 'bull_adx_thresh': 12.646725696415704, 'bull_atr_min_pct': 0.018775912827760553, 'bull_atr_max_pct': 0.07736287707812353, 'bull_tp_mult': 2.8392565467515545, 'bull_tsl_mult': 0.42433117212503, 'bull_time_stop': 74, 'bull_use_sma': True, 'bull_use_ema': False, 'bull_use_atr': True, 'bull_use_adx': False, 'bull_use_spike': True, 'bull_rsi_required': False, 'bear_strategy': 'breakout', 'bear_bb_std_mult': 2.5849969566639635, 'bear_rsi_os': 11, 'bear_rsi_ob': 70, 'bear_adx_thresh': 23.717625443255756, 'bear_atr_min_pct': 0.007034822475666431, 'bear_atr_max_pct': 0.06092798495509563, 'bear_tp_mult': 1.1518677182771244, 'bear_tsl_mult': 0.08214537605605554, 'bear_time_stop': 291, 'bear_use_sma': True, 'bear_use_ema': False, 'bear_use_atr': True, 'bear_use_adx': False, 'bear_use_spike': True, 'bear_rsi_required': False, 'sideways_strategy': 'mean_reversion', 'sideways_bb_std_mult': 0.9487126105289458, 'sideways_rsi_os': 52, 'sideways_rsi_ob': 92, 'sideways_adx_thresh': 20.8438847989739, 'sideways_atr_min_pct': 0.010617967767715559, 'sideways_atr_max_pct': 0.10278074386370743, 'sideways_tp_mult': 2.965811441445912, 'sideways_tsl_mult': 0.551635077791255, 'sideways_time_stop': 25, 'sideways_use_sma': True, 'sideways_use_ema': False, 'sideways_use_atr': False, 'sideways_use_adx': False, 'sideways_use_spike': False, 'sideways_rsi_required': False}.
[I 2025-09-01 09:57:43,625] Trial 315 finished with values: [-1000000000.0, 1000000000.0] and parameters: {'p_sma': 18, 'p_std': 39, 'p_atr': 18, 'p_adx': 29, 'rsi_period': 76, 'ema1': 17, 'ema2': 23, 'slip_atr_k': 0.06204205895153181, 'slip_spread_k': 0.8918411995268842, 'spread_hl_frac': 0.035621424698218926, 'bb_std_mult': 2.711671435956958, 'rsi_os': 41, 'rsi_ob': 67, 'vol_spike': 0.06295413910029936, 'adx_thresh': 32.63495339889994, 'atr_min_pct': 0.0030198230942574955, 'atr_max_pct': 0.03243190823316817, 'tp_mult': 1.5757073039017073, 'tsl_mult': 0.7091530607515245, 'strategy': 'breakout', 'time_stop': 241, 'use_sma': True, 'use_atr': False, 'use_adx': True, 'use_ema': True, 'use_spike': True, 'rsi_required': False, 'edge_k': 1.067396578269808, 'edge_cap': 0.09137309287732687, 'bull_strategy': 'mean_reversion', 'bull_bb_std_mult': 3.542852369067346, 'bull_rsi_os': 49, 'bull_rsi_ob': 46, 'bull_adx_thresh': 5.567559876758825, 'bull_atr_min_pct': 0.015699559266809385, 'bull_atr_max_pct': 0.07793051751297755, 'bull_tp_mult': 1.2618847613458852, 'bull_tsl_mult': 0.42065682911790325, 'bull_time_stop': 221, 'bull_use_sma': True, 'bull_use_ema': False, 'bull_use_atr': True, 'bull_use_adx': False, 'bull_use_spike': True, 'bull_rsi_required': False, 'bear_strategy': 'mean_reversion', 'bear_bb_std_mult': 1.1097865007805596, 'bear_rsi_os': 35, 'bear_rsi_ob': 49, 'bear_adx_thresh': 17.237684006680357, 'bear_atr_min_pct': 0.006777923141050897, 'bear_atr_max_pct': 0.06087652358123802, 'bear_tp_mult': 1.7467632455933515, 'bear_tsl_mult': 0.7391281736578637, 'bear_time_stop': 153, 'bear_use_sma': True, 'bear_use_ema': False, 'bear_use_atr': True, 'bear_use_adx': True, 'bear_use_spike': True, 'bear_rsi_required': False, 'sideways_strategy': 'breakout', 'sideways_bb_std_mult': 0.9396722361144972, 'sideways_rsi_os': 53, 'sideways_rsi_ob': 93, 'sideways_adx_thresh': 19.515684412984626, 'sideways_atr_min_pct': 0.00861304769617875, 'sideways_atr_max_pct': 0.07265381995922361, 'sideways_tp_mult': 2.2999153615548193, 'sideways_tsl_mult': 0.40315971775376175, 'sideways_time_stop': 21, 'sideways_use_sma': True, 'sideways_use_ema': False, 'sideways_use_atr': False, 'sideways_use_adx': False, 'sideways_use_spike': False, 'sideways_rsi_required': False}.
