[I 2025-09-01 10:29:45,685] Trial 516 finished with values: [-1000000000.0, 1000000000.0] and parameters: {'p_sma': 12, 'p_std': 23, 'p_atr': 12, 'p_adx': 19, 'rsi_period': 48, 'ema1': 7, 'ema2': 11, 'slip_atr_k': 0.026629391891050673, 'slip_spread_k': 0.8268456396175652, 'spread_hl_frac': 0.012574377643599652, 'bb_std_mult': 1.0248861206042197, 'rsi_os': 16, 'rsi_ob': 59, 'vol_spike': 0.047231199821453095, 'adx_thresh': 22.91504239380817, 'atr_min_pct': 0.017268468144614864, 'atr_max_pct': 0.020294946459815305, 'tp_mult': 1.4698863651104475, 'tsl_mult': 0.12597999415646582, 'strategy': 'breakout', 'time_stop': 132, 'use_sma': True, 'use_atr': False, 'use_adx': False, 'use_ema': False, 'use_spike': False, 'rsi_required': True, 'edge_k': 1.57628049064253, 'edge_cap': 0.11998976599725808, 'bull_strategy': 'mean_reversion', 'bull_bb_std_mult': 0.5061611030731831, 'bull_rsi_os': 17, 'bull_rsi_ob': 76, 'bull_adx_thresh': 15.18799716062533, 'bull_atr_min_pct': 0.007810566120189031, 'bull_atr_max_pct': 0.015608692167268805, 'bull_tp_mult': 1.193491746010168, 'bull_tsl_mult': 0.651608640756956, 'bull_time_stop': 261, 'bull_use_sma': True, 'bull_use_ema': False, 'bull_use_atr': False, 'bull_use_adx': True, 'bull_use_spike': True, 'bull_rsi_required': True, 'bear_strategy': 'breakout', 'bear_bb_std_mult': 1.6220232901037424, 'bear_rsi_os': 17, 'bear_rsi_ob': 85, 'bear_adx_thresh': 26.924672436708928, 'bear_atr_min_pct': 0.0020657042846971537, 'bear_atr_max_pct': 0.11245615197871088, 'bear_tp_mult': 1.72648077259681, 'bear_tsl_mult': 0.2913863382699451, 'bear_time_stop': 254, 'bear_use_sma': True, 'bear_use_ema': False, 'bear_use_atr': False, 'bear_use_adx': True, 'bear_use_spike': True, 'bear_rsi_required': False, 'sideways_strategy': 'breakout', 'sideways_bb_std_mult': 0.6331057745522, 'sideways_rsi_os': 54, 'sideways_rsi_ob': 85, 'sideways_adx_thresh': 28.548363045666285, 'sideways_atr_min_pct': 0.007756195116232371, 'sideways_atr_max_pct': 0.04723470669558859, 'sideways_tp_mult': 2.1039502745175156, 'sideways_tsl_mult': 0.31283603855862446, 'sideways_time_stop': 246, 'sideways_use_sma': False, 'sideways_use_ema': True, 'sideways_use_atr': True, 'sideways_use_adx': False, 'sideways_use_spike': False, 'sideways_rsi_required': True}.
[I 2025-09-01 10:29:46,432] Trial 514 finished with values: [-1000000000.0, 1000000000.0] and parameters: {'p_sma': 14, 'p_std': 34, 'p_atr': 12, 'p_adx': 19, 'rsi_period': 39, 'ema1': 7, 'ema2': 11, 'slip_atr_k': 0.013389274331275774, 'slip_spread_k': 0.8161071585050289, 'spread_hl_frac': 0.012772017219668886, 'bb_std_mult': 1.0295958018881484, 'rsi_os': 16, 'rsi_ob': 59, 'vol_spike': 0.06327691074090483, 'adx_thresh': 23.063464899747817, 'atr_min_pct': 0.01737173611497327, 'atr_max_pct': 0.019334157051600305, 'tp_mult': 1.4468152249880906, 'tsl_mult': 0.12494709617483116, 'strategy': 'breakout', 'time_stop': 125, 'use_sma': True, 'use_atr': False, 'use_adx': False, 'use_ema': False, 'use_spike': False, 'rsi_required': True, 'edge_k': 1.570198587982388, 'edge_cap': 0.3701056561103784, 'bull_strategy': 'mean_reversion', 'bull_bb_std_mult': 0.5053948256890249, 'bull_rsi_os': 16, 'bull_rsi_ob': 78, 'bull_adx_thresh': 15.324828451460645, 'bull_atr_min_pct': 0.010796269865620843, 'bull_atr_max_pct': 0.01808762331495565, 'bull_tp_mult': 1.190601436408335, 'bull_tsl_mult': 0.7143264611513185, 'bull_time_stop': 261, 'bull_use_sma': True, 'bull_use_ema': False, 'bull_use_atr': False, 'bull_use_adx': True, 'bull_use_spike': True, 'bull_rsi_required': True, 'bear_strategy': 'breakout', 'bear_bb_std_mult': 1.885034153507826, 'bear_rsi_os': 17, 'bear_rsi_ob': 82, 'bear_adx_thresh': 27.007193701472506, 'bear_atr_min_pct': 0.0018295826623640746, 'bear_atr_max_pct': 0.1100702889781893, 'bear_tp_mult': 1.5328091560215737, 'bear_tsl_mult': 0.30997742145683405, 'bear_time_stop': 270, 'bear_use_sma': True, 'bear_use_ema': False, 'bear_use_atr': False, 'bear_use_adx': True, 'bear_use_spike': True, 'bear_rsi_required': False, 'sideways_strategy': 'breakout', 'sideways_bb_std_mult': 0.621458262255725, 'sideways_rsi_os': 55, 'sideways_rsi_ob': 82, 'sideways_adx_thresh': 28.583729992515636, 'sideways_atr_min_pct': 0.007713639410710673, 'sideways_atr_max_pct': 0.04951766413430067, 'sideways_tp_mult': 2.118366368576183, 'sideways_tsl_mult': 0.31394245226598033, 'sideways_time_stop': 247, 'sideways_use_sma': False, 'sideways_use_ema': True, 'sideways_use_atr': True, 'sideways_use_adx': False, 'sideways_use_spike': False, 'sideways_rsi_required': True}.
[I 2025-09-01 10:29:46,439] Trial 512 finished with values: [-0.03729723351058767, 0.03709767110865215] and parameters: {'p_sma': 13, 'p_std': 20, 'p_atr': 13, 'p_adx': 19, 'rsi_period': 42, 'ema1': 6, 'ema2': 11, 'slip_atr_k': 0.022944749905048294, 'slip_spread_k': 0.8221290259744007, 'spread_hl_frac': 0.012621703022027114, 'bb_std_mult': 1.0282069777359495, 'rsi_os': 16, 'rsi_ob': 59, 'vol_spike': 0.06345112176557884, 'adx_thresh': 24.491887667683663, 'atr_min_pct': 0.01734059059353742, 'atr_max_pct': 0.020406102003391983, 'tp_mult': 1.4502984685596483, 'tsl_mult': 0.17002339751903756, 'strategy': 'breakout', 'time_stop': 126, 'use_sma': True, 'use_atr': False, 'use_adx': False, 'use_ema': False, 'use_spike': False, 'rsi_required': True, 'edge_k': 1.6718162608537344, 'edge_cap': 0.3730871116177055, 'bull_strategy': 'mean_reversion', 'bull_bb_std_mult': 0.506860770781747, 'bull_rsi_os': 20, 'bull_rsi_ob': 78, 'bull_adx_thresh': 14.085211475252178, 'bull_atr_min_pct': 0.0011092257719938253, 'bull_atr_max_pct': 0.01839097119028115, 'bull_tp_mult': 1.2048968665498159, 'bull_tsl_mult': 0.7047290864868729, 'bull_time_stop': 260, 'bull_use_sma': True, 'bull_use_ema': False, 'bull_use_atr': False, 'bull_use_adx': True, 'bull_use_spike': True, 'bull_rsi_required': True, 'bear_strategy': 'breakout', 'bear_bb_std_mult': 1.8573414384074245, 'bear_rsi_os': 20, 'bear_rsi_ob': 85, 'bear_adx_thresh': 27.91489027962234, 'bear_atr_min_pct': 0.002095090651307445, 'bear_atr_max_pct': 0.10593370911887322, 'bear_tp_mult': 1.6551713917129793, 'bear_tsl_mult': 0.3141374220106667, 'bear_time_stop': 255, 'bear_use_sma': True, 'bear_use_ema': False, 'bear_use_atr': False, 'bear_use_adx': True, 'bear_use_spike': True, 'bear_rsi_required': False, 'sideways_strategy': 'breakout', 'sideways_bb_std_mult': 0.6165343659637375, 'sideways_rsi_os': 54, 'sideways_rsi_ob': 85, 'sideways_adx_thresh': 28.753118514194156, 'sideways_atr_min_pct': 0.007692063023144817, 'sideways_atr_max_pct': 0.050500457484239564, 'sideways_tp_mult': 2.0342557587767267, 'sideways_tsl_mult': 0.31049376346472485, 'sideways_time_stop': 246, 'sideways_use_sma': False, 'sideways_use_ema': True, 'sideways_use_atr': True, 'sideways_use_adx': False, 'sideways_use_spike': False, 'sideways_rsi_required': True}.
[I 2025-09-01 10:29:46,809] Trial 513 finished with values: [-1000000000.0, 1000000000.0] and parameters: {'p_sma': 13, 'p_std': 19, 'p_atr': 13, 'p_adx': 21, 'rsi_period': 39, 'ema1': 7, 'ema2': 11, 'slip_atr_k': 0.013424420309567838, 'slip_spread_k': 0.8115347772117805, 'spread_hl_frac': 0.012911380591632323, 'bb_std_mult': 1.0219902308976678, 'rsi_os': 16, 'rsi_ob': 59, 'vol_spike': 0.06373156560880391, 'adx_thresh': 22.830983027583596, 'atr_min_pct': 0.017167337551569104, 'atr_max_pct': 0.018887863852670665, 'tp_mult': 1.4554480293862626, 'tsl_mult': 0.17254065827099052, 'strategy': 'breakout', 'time_stop': 129, 'use_sma': True, 'use_atr': False, 'use_adx': False, 'use_ema': False, 'use_spike': False, 'rsi_required': True, 'edge_k': 1.5662601496583684, 'edge_cap': 0.4021773260008823, 'bull_strategy': 'mean_reversion', 'bull_bb_std_mult': 0.5069966924419849, 'bull_rsi_os': 20, 'bull_rsi_ob': 78, 'bull_adx_thresh': 15.629549956371665, 'bull_atr_min_pct': 0.021225780874588797, 'bull_atr_max_pct': 0.018890388869335473, 'bull_tp_mult': 1.19579206604728, 'bull_tsl_mult': 0.6273656196076497, 'bull_time_stop': 263, 'bull_use_sma': True, 'bull_use_ema': False, 'bull_use_atr': False, 'bull_use_adx': True, 'bull_use_spike': True, 'bull_rsi_required': True, 'bear_strategy': 'breakout', 'bear_bb_std_mult': 1.615306754746664, 'bear_rsi_os': 20, 'bear_rsi_ob': 85, 'bear_adx_thresh': 27.1986804119299, 'bear_atr_min_pct': 0.0019349572080417654, 'bear_atr_max_pct': 0.11105334923845964, 'bear_tp_mult': 1.549552569703326, 'bear_tsl_mult': 0.3034418126685335, 'bear_time_stop': 254, 'bear_use_sma': True, 'bear_use_ema': False, 'bear_use_atr': False, 'bear_use_adx': True, 'bear_use_spike': True, 'bear_rsi_required': False, 'sideways_strategy': 'breakout', 'sideways_bb_std_mult': 0.6380179670924616, 'sideways_rsi_os': 54, 'sideways_rsi_ob': 82, 'sideways_adx_thresh': 28.486560297321073, 'sideways_atr_min_pct': 0.0065869954495829264, 'sideways_atr_max_pct': 0.04865694639150829, 'sideways_tp_mult': 2.1091865867357567, 'sideways_tsl_mult': 0.3151454114682338, 'sideways_time_stop': 243, 'sideways_use_sma': False, 'sideways_use_ema': True, 'sideways_use_atr': True, 'sideways_use_adx': False, 'sideways_use_spike': False, 'sideways_rsi_required': True}.
[I 2025-09-01 10:29:48,099] Trial 517 finished with values: [-1000000000.0, 1000000000.0] and parameters: {'p_sma': 12, 'p_std': 31, 'p_atr': 12, 'p_adx': 21, 'rsi_period': 44, 'ema1': 7, 'ema2': 10, 'slip_atr_k': 0.011740687163517815, 'slip_spread_k': 0.8078449909958818, 'spread_hl_frac': 0.013077628226119397, 'bb_std_mult': 0.7992121532539526, 'rsi_os': 18, 'rsi_ob': 60, 'vol_spike': 0.05309287385700896, 'adx_thresh': 24.254829362422957, 'atr_min_pct': 0.015724533061049574, 'atr_max_pct': 0.01355145622664685, 'tp_mult': 1.5157491823942328, 'tsl_mult': 0.10800196291324651, 'strategy': 'breakout', 'time_stop': 143, 'use_sma': True, 'use_atr': False, 'use_adx': False, 'use_ema': False, 'use_spike': False, 'rsi_required': True, 'edge_k': 1.6104211128143573, 'edge_cap': 0.2422123708548205, 'bull_strategy': 'breakout', 'bull_bb_std_mult': 0.6048640183702138, 'bull_rsi_os': 18, 'bull_rsi_ob': 75, 'bull_adx_thresh': 15.9582390175833, 'bull_atr_min_pct': 0.0010728456706085901, 'bull_atr_max_pct': 0.01125364820720146, 'bull_tp_mult': 1.1701780382986957, 'bull_tsl_mult': 0.7605914839727512, 'bull_time_stop': 277, 'bull_use_sma': False, 'bull_use_ema': False, 'bull_use_atr': False, 'bull_use_adx': True, 'bull_use_spike': True, 'bull_rsi_required': True, 'bear_strategy': 'breakout', 'bear_bb_std_mult': 1.7412833568146948, 'bear_rsi_os': 18, 'bear_rsi_ob': 83, 'bear_adx_thresh': 25.92459645995116, 'bear_atr_min_pct': 0.0034239596821737973, 'bear_atr_max_pct': 0.1158198409821679, 'bear_tp_mult': 1.7780679602140481, 'bear_tsl_mult': 0.2809192994155372, 'bear_time_stop': 264, 'bear_use_sma': True, 'bear_use_ema': True, 'bear_use_atr': False, 'bear_use_adx': True, 'bear_use_spike': True, 'bear_rsi_required': True, 'sideways_strategy': 'breakout', 'sideways_bb_std_mult': 0.5674920026773204, 'sideways_rsi_os': 55, 'sideways_rsi_ob': 79, 'sideways_adx_thresh': 29.302589799243325, 'sideways_atr_min_pct': 0.006465942372780984, 'sideways_atr_max_pct': 0.054794902423876135, 'sideways_tp_mult': 2.155358626144015, 'sideways_tsl_mult': 0.2873354352232295, 'sideways_time_stop': 239, 'sideways_use_sma': False, 'sideways_use_ema': True, 'sideways_use_atr': True, 'sideways_use_adx': False, 'sideways_use_spike': True, 'sideways_rsi_required': True}.
[I 2025-09-01 10:29:48,153] Trial 518 finished with values: [-1000000000.0, 1000000000.0] and parameters: {'p_sma': 12, 'p_std': 28, 'p_atr': 12, 'p_adx': 20, 'rsi_period': 46, 'ema1': 7, 'ema2': 10, 'slip_atr_k': 0.011491268686305164, 'slip_spread_k': 0.8076530813767088, 'spread_hl_frac': 0.0135810603915824, 'bb_std_mult': 0.8690825543114954, 'rsi_os': 19, 'rsi_ob': 60, 'vol_spike': 0.05131054515698198, 'adx_thresh': 22.40884703290828, 'atr_min_pct': 0.01600521051804476, 'atr_max_pct': 0.013935413060123261, 'tp_mult': 1.5070996029452641, 'tsl_mult': 0.10908592947864174, 'strategy': 'breakout', 'time_stop': 144, 'use_sma': True, 'use_atr': False, 'use_adx': False, 'use_ema': False, 'use_spike': False, 'rsi_required': True, 'edge_k': 1.5398737779264913, 'edge_cap': 0.2513367963207371, 'bull_strategy': 'breakout', 'bull_bb_std_mult': 0.6123405949471523, 'bull_rsi_os': 18, 'bull_rsi_ob': 75, 'bull_adx_thresh': 15.786614799511224, 'bull_atr_min_pct': 0.01343182875513392, 'bull_atr_max_pct': 0.014509567157718839, 'bull_tp_mult': 1.0805753221172045, 'bull_tsl_mult': 0.7798636667108763, 'bull_time_stop': 271, 'bull_use_sma': False, 'bull_use_ema': False, 'bull_use_atr': False, 'bull_use_adx': True, 'bull_use_spike': True, 'bull_rsi_required': True, 'bear_strategy': 'breakout', 'bear_bb_std_mult': 2.1444565152140473, 'bear_rsi_os': 18, 'bear_rsi_ob': 83, 'bear_adx_thresh': 26.262389912764778, 'bear_atr_min_pct': 0.0028115116714858136, 'bear_atr_max_pct': 0.13815635296973997, 'bear_tp_mult': 2.103350464895907, 'bear_tsl_mult': 0.35349175668043964, 'bear_time_stop': 264, 'bear_use_sma': True, 'bear_use_ema': True, 'bear_use_atr': False, 'bear_use_adx': True, 'bear_use_spike': True, 'bear_rsi_required': True, 'sideways_strategy': 'breakout', 'sideways_bb_std_mult': 0.5736356791243109, 'sideways_rsi_os': 55, 'sideways_rsi_ob': 77, 'sideways_adx_thresh': 29.279238371139535, 'sideways_atr_min_pct': 0.00617246610137234, 'sideways_atr_max_pct': 0.05429869384813852, 'sideways_tp_mult': 1.9512787756040881, 'sideways_tsl_mult': 0.2878334822637707, 'sideways_time_stop': 240, 'sideways_use_sma': False, 'sideways_use_ema': True, 'sideways_use_atr': True, 'sideways_use_adx': False, 'sideways_use_spike': True, 'sideways_rsi_required': True}.
[I 2025-09-01 10:29:48,181] Trial 520 finished with values: [-1000000000.0, 1000000000.0] and parameters: {'p_sma': 10, 'p_std': 28, 'p_atr': 12, 'p_adx': 20, 'rsi_period': 44, 'ema1': 8, 'ema2': 10, 'slip_atr_k': 0.0106093555887713, 'slip_spread_k': 0.8321103152032542, 'spread_hl_frac': 0.013648217767135092, 'bb_std_mult': 0.8506319498176895, 'rsi_os': 14, 'rsi_ob': 62, 'vol_spike': 0.05316536043307687, 'adx_thresh': 24.209197900100584, 'atr_min_pct': 0.016064455516902987, 'atr_max_pct': 0.01375617850069559, 'tp_mult': 1.5025824649561235, 'tsl_mult': 0.10366266092858017, 'strategy': 'breakout', 'time_stop': 143, 'use_sma': True, 'use_atr': False, 'use_adx': False, 'use_ema': False, 'use_spike': False, 'rsi_required': True, 'edge_k': 1.6181658009711095, 'edge_cap': 0.14915743443995788, 'bull_strategy': 'breakout', 'bull_bb_std_mult': 0.585626668236119, 'bull_rsi_os': 17, 'bull_rsi_ob': 76, 'bull_adx_thresh': 16.068586114818046, 'bull_atr_min_pct': 0.014229492451456402, 'bull_atr_max_pct': 0.012658602750126587, 'bull_tp_mult': 1.0831413306451902, 'bull_tsl_mult': 0.7680407086029886, 'bull_time_stop': 272, 'bull_use_sma': False, 'bull_use_ema': False, 'bull_use_atr': False, 'bull_use_adx': True, 'bull_use_spike': True, 'bull_rsi_required': True, 'bear_strategy': 'breakout', 'bear_bb_std_mult': 2.145911154482868, 'bear_rsi_os': 18, 'bear_rsi_ob': 83, 'bear_adx_thresh': 26.11913448200054, 'bear_atr_min_pct': 0.0009646549280968612, 'bear_atr_max_pct': 0.1338000527705702, 'bear_tp_mult': 1.7719664840638012, 'bear_tsl_mult': 0.28191381258080034, 'bear_time_stop': 262, 'bear_use_sma': False, 'bear_use_ema': True, 'bear_use_atr': False, 'bear_use_adx': True, 'bear_use_spike': True, 'bear_rsi_required': True, 'sideways_strategy': 'breakout', 'sideways_bb_std_mult': 0.6056401238574843, 'sideways_rsi_os': 55, 'sideways_rsi_ob': 78, 'sideways_adx_thresh': 30.342143453218956, 'sideways_atr_min_pct': 0.006230062409172942, 'sideways_atr_max_pct': 0.05439900359418137, 'sideways_tp_mult': 2.1724901251162003, 'sideways_tsl_mult': 0.2893607929784398, 'sideways_time_stop': 238, 'sideways_use_sma': False, 'sideways_use_ema': True, 'sideways_use_atr': True, 'sideways_use_adx': False, 'sideways_use_spike': True, 'sideways_rsi_required': True}.
[I 2025-09-01 10:29:48,193] Trial 519 finished with values: [-1000000000.0, 1000000000.0] and parameters: {'p_sma': 14, 'p_std': 31, 'p_atr': 12, 'p_adx': 21, 'rsi_period': 44, 'ema1': 7, 'ema2': 10, 'slip_atr_k': 0.011661432405875123, 'slip_spread_k': 0.8057697925395767, 'spread_hl_frac': 0.01573371413884296, 'bb_std_mult': 0.8142704570914153, 'rsi_os': 19, 'rsi_ob': 60, 'vol_spike': 0.053160647253914756, 'adx_thresh': 23.434882532530708, 'atr_min_pct': 0.015850490920324003, 'atr_max_pct': 0.013516193814335227, 'tp_mult': 1.511657668746568, 'tsl_mult': 0.11176742016483214, 'strategy': 'breakout', 'time_stop': 145, 'use_sma': True, 'use_atr': False, 'use_adx': False, 'use_ema': False, 'use_spike': False, 'rsi_required': True, 'edge_k': 1.6168279298330743, 'edge_cap': 0.2312352699701615, 'bull_strategy': 'breakout', 'bull_bb_std_mult': 0.6162764569764438, 'bull_rsi_os': 18, 'bull_rsi_ob': 75, 'bull_adx_thresh': 14.763679124604346, 'bull_atr_min_pct': 0.0009969990910772208, 'bull_atr_max_pct': 0.010038096840731084, 'bull_tp_mult': 1.1704143887760983, 'bull_tsl_mult': 0.7726758115105874, 'bull_time_stop': 272, 'bull_use_sma': False, 'bull_use_ema': False, 'bull_use_atr': False, 'bull_use_adx': True, 'bull_use_spike': True, 'bull_rsi_required': True, 'bear_strategy': 'breakout', 'bear_bb_std_mult': 1.5256722797350946, 'bear_rsi_os': 18, 'bear_rsi_ob': 83, 'bear_adx_thresh': 25.932547460138622, 'bear_atr_min_pct': 0.003335954968957408, 'bear_atr_max_pct': 0.1001081388176731, 'bear_tp_mult': 1.5680665930044744, 'bear_tsl_mult': 0.3502906103382296, 'bear_time_stop': 263, 'bear_use_sma': True, 'bear_use_ema': True, 'bear_use_atr': False, 'bear_use_adx': True, 'bear_use_spike': True, 'bear_rsi_required': True, 'sideways_strategy': 'breakout', 'sideways_bb_std_mult': 0.5699210970120835, 'sideways_rsi_os': 55, 'sideways_rsi_ob': 79, 'sideways_adx_thresh': 29.429106192800564, 'sideways_atr_min_pct': 0.0060962535265069685, 'sideways_atr_max_pct': 0.05477386169020271, 'sideways_tp_mult': 2.156652187123728, 'sideways_tsl_mult': 0.285567410939519, 'sideways_time_stop': 238, 'sideways_use_sma': False, 'sideways_use_ema': True, 'sideways_use_atr': True, 'sideways_use_adx': False, 'sideways_use_spike': True, 'sideways_rsi_required': True}.
[I 2025-09-01 10:29:49,294] Trial 521 finished with values: [-1000000000.0, 1000000000.0] and parameters: {'p_sma': 14, 'p_std': 25, 'p_atr': 14, 'p_adx': 20, 'rsi_period': 47, 'ema1': 6, 'ema2': 10, 'slip_atr_k': 0.0195323154042206, 'slip_spread_k': 0.832070606818303, 'spread_hl_frac': 0.01574906379443653, 'bb_std_mult': 0.9234001102068392, 'rsi_os': 14, 'rsi_ob': 62, 'vol_spike': 0.04801713172387018, 'adx_thresh': 22.38545983888274, 'atr_min_pct': 0.015997929670334296, 'atr_max_pct': 0.015092399983660864, 'tp_mult': 1.5099985631257087, 'tsl_mult': 0.13668498327504985, 'strategy': 'breakout', 'time_stop': 135, 'use_sma': True, 'use_atr': False, 'use_adx': True, 'use_ema': False, 'use_spike': False, 'rsi_required': True, 'edge_k': 1.5334370120028245, 'edge_cap': 0.22577101495362983, 'bull_strategy': 'mean_reversion', 'bull_bb_std_mult': 0.6220284662135023, 'bull_rsi_os': 17, 'bull_rsi_ob': 75, 'bull_adx_thresh': 14.866123995017972, 'bull_atr_min_pct': 0.028977370804298866, 'bull_atr_max_pct': 0.0146094634563766, 'bull_tp_mult': 1.0533495666778292, 'bull_tsl_mult': 0.7745240818521302, 'bull_time_stop': 256, 'bull_use_sma': True, 'bull_use_ema': False, 'bull_use_atr': False, 'bull_use_adx': True, 'bull_use_spike': True, 'bull_rsi_required': True, 'bear_strategy': 'breakout', 'bear_bb_std_mult': 2.2653207626261445, 'bear_rsi_os': 18, 'bear_rsi_ob': 85, 'bear_adx_thresh': 25.882843795453613, 'bear_atr_min_pct': 0.0009383643140017633, 'bear_atr_max_pct': 0.09801269880809219, 'bear_tp_mult': 2.1163831465614935, 'bear_tsl_mult': 0.3514707406694704, 'bear_time_stop': 263, 'bear_use_sma': False, 'bear_use_ema': False, 'bear_use_atr': False, 'bear_use_adx': True, 'bear_use_spike': True, 'bear_rsi_required': False, 'sideways_strategy': 'breakout', 'sideways_bb_std_mult': 0.5635385099202707, 'sideways_rsi_os': 55, 'sideways_rsi_ob': 69, 'sideways_adx_thresh': 30.30774486529104, 'sideways_atr_min_pct': 0.005619070351138572, 'sideways_atr_max_pct': 0.05299548882545513, 'sideways_tp_mult': 2.0133252683813394, 'sideways_tsl_mult': 0.2583526512023295, 'sideways_time_stop': 230, 'sideways_use_sma': False, 'sideways_use_ema': True, 'sideways_use_atr': True, 'sideways_use_adx': False, 'sideways_use_spike': False, 'sideways_rsi_required': True}.
