[I 2025-09-01 09:15:01,294] Trial 57 finished with values: [-1000000000.0, 1000000000.0] and parameters: {'p_sma': 6, 'p_std': 5, 'p_atr': 27, 'p_adx': 16, 'rsi_period': 60, 'ema1': 20, 'ema2': 43, 'slip_atr_k': 0.11964278690116865, 'slip_spread_k': 0.3757958656507133, 'spread_hl_frac': 0.03859282596908624, 'bb_std_mult': 1.436583235829682, 'rsi_os': 48, 'rsi_ob': 58, 'vol_spike': 0.08152843257501373, 'adx_thresh': 12.45797385802356, 'atr_min_pct': 0.022928243327178546, 'atr_max_pct': 0.0904735229858642, 'tp_mult': 2.5506984712585172, 'tsl_mult': 0.04522180693019265, 'strategy': 'mean_reversion', 'time_stop': 6, 'use_sma': False, 'use_atr': True, 'use_adx': False, 'use_ema': False, 'use_spike': False, 'rsi_required': False, 'edge_k': 0.08880891624465204, 'edge_cap': 0.36588526695973644, 'bull_strategy': 'mean_reversion', 'bull_bb_std_mult': 0.8742264450719317, 'bull_rsi_os': 35, 'bull_rsi_ob': 68, 'bull_adx_thresh': 24.288491525296763, 'bull_atr_min_pct': 0.0037716941408143497, 'bull_atr_max_pct': 0.11573706767192671, 'bull_tp_mult': 2.8639730979319173, 'bull_tsl_mult': 0.6215628798611103, 'bull_time_stop': 195, 'bull_use_sma': False, 'bull_use_ema': True, 'bull_use_atr': False, 'bull_use_adx': False, 'bull_use_spike': True, 'bull_rsi_required': False, 'bear_strategy': 'mean_reversion', 'bear_bb_std_mult': 0.9855392428926439, 'bear_rsi_os': 32, 'bear_rsi_ob': 46, 'bear_adx_thresh': 23.68762919866738, 'bear_atr_min_pct': 0.021143432374782313, 'bear_atr_max_pct': 0.03249715813579026, 'bear_tp_mult': 2.487004282263019, 'bear_tsl_mult': 0.7315674342131189, 'bear_time_stop': 215, 'bear_use_sma': True, 'bear_use_ema': False, 'bear_use_atr': False, 'bear_use_adx': True, 'bear_use_spike': True, 'bear_rsi_required': True, 'sideways_strategy': 'breakout', 'sideways_bb_std_mult': 2.451301893135352, 'sideways_rsi_os': 41, 'sideways_rsi_ob': 62, 'sideways_adx_thresh': 27.561710656639715, 'sideways_atr_min_pct': 0.005383406001217985, 'sideways_atr_max_pct': 0.05321602374737501, 'sideways_tp_mult': 1.5682597845245008, 'sideways_tsl_mult': 0.7702609317622845, 'sideways_time_stop': 103, 'sideways_use_sma': False, 'sideways_use_ema': False, 'sideways_use_atr': False, 'sideways_use_adx': False, 'sideways_use_spike': False, 'sideways_rsi_required': False}.
[I 2025-09-01 09:15:02,592] Trial 53 finished with values: [-1000000000.0, 1000000000.0] and parameters: {'p_sma': 7, 'p_std': 34, 'p_atr': 24, 'p_adx': 16, 'rsi_period': 66, 'ema1': 6, 'ema2': 10, 'slip_atr_k': 0.24633484617427584, 'slip_spread_k': 0.6890065878595437, 'spread_hl_frac': 0.030846817822170233, 'bb_std_mult': 0.8402022673076373, 'rsi_os': 49, 'rsi_ob': 58, 'vol_spike': 0.27495630334677507, 'adx_thresh': 6.827525780621912, 'atr_min_pct': 0.01961506829271494, 'atr_max_pct': 0.04966433397527528, 'tp_mult': 1.3916461393002333, 'tsl_mult': 0.1326584708399087, 'strategy': 'mean_reversion', 'time_stop': 30, 'use_sma': False, 'use_atr': False, 'use_adx': True, 'use_ema': False, 'use_spike': False, 'rsi_required': False, 'edge_k': 0.311454223383275, 'edge_cap': 0.3176351459169372, 'bull_strategy': 'mean_reversion', 'bull_bb_std_mult': 0.8155962530122458, 'bull_rsi_os': 35, 'bull_rsi_ob': 65, 'bull_adx_thresh': 12.906502252801193, 'bull_atr_min_pct': 0.0014522870041959143, 'bull_atr_max_pct': 0.07553806690991217, 'bull_tp_mult': 1.095643851089969, 'bull_tsl_mult': 0.6187015995701934, 'bull_time_stop': 178, 'bull_use_sma': False, 'bull_use_ema': True, 'bull_use_atr': False, 'bull_use_adx': False, 'bull_use_spike': True, 'bull_rsi_required': False, 'bear_strategy': 'mean_reversion', 'bear_bb_std_mult': 1.2037938735040976, 'bear_rsi_os': 16, 'bear_rsi_ob': 67, 'bear_adx_thresh': 15.729666842541501, 'bear_atr_min_pct': 0.0029180241502477014, 'bear_atr_max_pct': 0.12387317689690973, 'bear_tp_mult': 1.352307961607723, 'bear_tsl_mult': 0.7059291039386213, 'bear_time_stop': 142, 'bear_use_sma': False, 'bear_use_ema': False, 'bear_use_atr': False, 'bear_use_adx': True, 'bear_use_spike': True, 'bear_rsi_required': True, 'sideways_strategy': 'breakout', 'sideways_bb_std_mult': 3.5906050160489773, 'sideways_rsi_os': 46, 'sideways_rsi_ob': 57, 'sideways_adx_thresh': 12.043243284061747, 'sideways_atr_min_pct': 0.002317972830476545, 'sideways_atr_max_pct': 0.06327970708494177, 'sideways_tp_mult': 2.736976473066677, 'sideways_tsl_mult': 0.9358759674208285, 'sideways_time_stop': 105, 'sideways_use_sma': False, 'sideways_use_ema': True, 'sideways_use_atr': True, 'sideways_use_adx': False, 'sideways_use_spike': True, 'sideways_rsi_required': False}.
[I 2025-09-01 09:15:03,174] Trial 56 finished with values: [-1000000000.0, 1000000000.0] and parameters: {'p_sma': 5, 'p_std': 33, 'p_atr': 27, 'p_adx': 17, 'rsi_period': 66, 'ema1': 6, 'ema2': 36, 'slip_atr_k': 0.12283200639372074, 'slip_spread_k': 0.8904787375030817, 'spread_hl_frac': 0.03670412811473007, 'bb_std_mult': 0.8320313145488905, 'rsi_os': 48, 'rsi_ob': 55, 'vol_spike': 0.0004778983691752503, 'adx_thresh': 9.811389332319006, 'atr_min_pct': 0.023261523296236812, 'atr_max_pct': 0.05011921954628587, 'tp_mult': 1.4022538479499778, 'tsl_mult': 0.15634757137778593, 'strategy': 'mean_reversion', 'time_stop': 36, 'use_sma': True, 'use_atr': True, 'use_adx': True, 'use_ema': True, 'use_spike': False, 'rsi_required': False, 'edge_k': 0.601065273563414, 'edge_cap': 0.3342866523540332, 'bull_strategy': 'mean_reversion', 'bull_bb_std_mult': 0.8870801128767956, 'bull_rsi_os': 30, 'bull_rsi_ob': 66, 'bull_adx_thresh': 27.692219118356025, 'bull_atr_min_pct': 0.0012931613506424525, 'bull_atr_max_pct': 0.0774587532992837, 'bull_tp_mult': 1.0952369850013284, 'bull_tsl_mult': 0.6086824257863754, 'bull_time_stop': 128, 'bull_use_sma': False, 'bull_use_ema': False, 'bull_use_atr': False, 'bull_use_adx': False, 'bull_use_spike': True, 'bull_rsi_required': False, 'bear_strategy': 'mean_reversion', 'bear_bb_std_mult': 3.005979019818434, 'bear_rsi_os': 16, 'bear_rsi_ob': 46, 'bear_adx_thresh': 29.040268023302858, 'bear_atr_min_pct': 0.004371482480903919, 'bear_atr_max_pct': 0.0735185023714016, 'bear_tp_mult': 1.9295462683697953, 'bear_tsl_mult': 0.6925602912195831, 'bear_time_stop': 101, 'bear_use_sma': False, 'bear_use_ema': False, 'bear_use_atr': False, 'bear_use_adx': True, 'bear_use_spike': True, 'bear_rsi_required': True, 'sideways_strategy': 'breakout', 'sideways_bb_std_mult': 2.616705533839566, 'sideways_rsi_os': 46, 'sideways_rsi_ob': 63, 'sideways_adx_thresh': 29.157395354841068, 'sideways_atr_min_pct': 0.0018167861907160045, 'sideways_atr_max_pct': 0.04849888951015498, 'sideways_tp_mult': 2.695103126960972, 'sideways_tsl_mult': 0.9355318919454447, 'sideways_time_stop': 105, 'sideways_use_sma': False, 'sideways_use_ema': False, 'sideways_use_atr': False, 'sideways_use_adx': False, 'sideways_use_spike': True, 'sideways_rsi_required': True}.
[I 2025-09-01 09:15:03,621] Trial 54 finished with values: [-0.054509669077583034, 0.054219582481245275] and parameters: {'p_sma': 14, 'p_std': 46, 'p_atr': 24, 'p_adx': 16, 'rsi_period': 66, 'ema1': 6, 'ema2': 10, 'slip_atr_k': 0.23291520246897296, 'slip_spread_k': 0.6785202307032786, 'spread_hl_frac': 0.03606388605892605, 'bb_std_mult': 0.8771915999506137, 'rsi_os': 49, 'rsi_ob': 57, 'vol_spike': 0.16882133006140096, 'adx_thresh': 19.14796118625506, 'atr_min_pct': 0.0038423088517118287, 'atr_max_pct': 0.12463506610657532, 'tp_mult': 1.3644003404754461, 'tsl_mult': 0.17046885484724106, 'strategy': 'mean_reversion', 'time_stop': 36, 'use_sma': False, 'use_atr': False, 'use_adx': True, 'use_ema': False, 'use_spike': False, 'rsi_required': False, 'edge_k': 0.2936018734218949, 'edge_cap': 0.301594046778661, 'bull_strategy': 'mean_reversion', 'bull_bb_std_mult': 0.8427500340335103, 'bull_rsi_os': 40, 'bull_rsi_ob': 65, 'bull_adx_thresh': 20.55805669918034, 'bull_atr_min_pct': 0.0013365484287710628, 'bull_atr_max_pct': 0.11344459808131956, 'bull_tp_mult': 1.1096150981399944, 'bull_tsl_mult': 0.5979365629060602, 'bull_time_stop': 120, 'bull_use_sma': False, 'bull_use_ema': True, 'bull_use_atr': False, 'bull_use_adx': False, 'bull_use_spike': True, 'bull_rsi_required': False, 'bear_strategy': 'mean_reversion', 'bear_bb_std_mult': 3.517097005817609, 'bear_rsi_os': 16, 'bear_rsi_ob': 83, 'bear_adx_thresh': 33.793733355851394, 'bear_atr_min_pct': 0.021099860797535737, 'bear_atr_max_pct': 0.14937854105448803, 'bear_tp_mult': 1.9463816513333345, 'bear_tsl_mult': 0.7137995389747942, 'bear_time_stop': 97, 'bear_use_sma': False, 'bear_use_ema': False, 'bear_use_atr': False, 'bear_use_adx': True, 'bear_use_spike': True, 'bear_rsi_required': True, 'sideways_strategy': 'breakout', 'sideways_bb_std_mult': 2.5958134237313653, 'sideways_rsi_os': 46, 'sideways_rsi_ob': 68, 'sideways_adx_thresh': 11.67890264239864, 'sideways_atr_min_pct': 0.0019069408061856974, 'sideways_atr_max_pct': 0.047498908092745526, 'sideways_tp_mult': 1.4843017162910848, 'sideways_tsl_mult': 0.7793269948626045, 'sideways_time_stop': 103, 'sideways_use_sma': False, 'sideways_use_ema': True, 'sideways_use_atr': True, 'sideways_use_adx': False, 'sideways_use_spike': True, 'sideways_rsi_required': False}.
[I 2025-09-01 09:15:42,641] Trial 61 finished with values: [-1000000000.0, 1000000000.0] and parameters: {'p_sma': 15, 'p_std': 29, 'p_atr': 29, 'p_adx': 13, 'rsi_period': 14, 'ema1': 18, 'ema2': 48, 'slip_atr_k': 0.20179563401430836, 'slip_spread_k': 0.7613899831987266, 'spread_hl_frac': 0.04615565025408137, 'bb_std_mult': 0.6711865966508161, 'rsi_os': 52, 'rsi_ob': 47, 'vol_spike': 0.20102166806964844, 'adx_thresh': 28.392857911780453, 'atr_min_pct': 0.004023405461796515, 'atr_max_pct': 0.12250066896198154, 'tp_mult': 1.5396129421100406, 'tsl_mult': 0.060863371461894564, 'strategy': 'breakout', 'time_stop': 62, 'use_sma': False, 'use_atr': True, 'use_adx': False, 'use_ema': False, 'use_spike': False, 'rsi_required': True, 'edge_k': 1.9674789240936166, 'edge_cap': 0.17767875519723517, 'bull_strategy': 'breakout', 'bull_bb_std_mult': 1.857869788537705, 'bull_rsi_os': 23, 'bull_rsi_ob': 70, 'bull_adx_thresh': 20.241688789132375, 'bull_atr_min_pct': 0.02298177955559763, 'bull_atr_max_pct': 0.12847537819714686, 'bull_tp_mult': 1.0127736702841652, 'bull_tsl_mult': 0.19262407130068748, 'bull_time_stop': 197, 'bull_use_sma': True, 'bull_use_ema': True, 'bull_use_atr': True, 'bull_use_adx': True, 'bull_use_spike': True, 'bull_rsi_required': True, 'bear_strategy': 'breakout', 'bear_bb_std_mult': 2.0178595141931264, 'bear_rsi_os': 7, 'bear_rsi_ob': 74, 'bear_adx_thresh': 31.560906279039955, 'bear_atr_min_pct': 0.012334158324527621, 'bear_atr_max_pct': 0.059959423434153156, 'bear_tp_mult': 2.1462769704146067, 'bear_tsl_mult': 0.6370735719984605, 'bear_time_stop': 182, 'bear_use_sma': True, 'bear_use_ema': True, 'bear_use_atr': False, 'bear_use_adx': False, 'bear_use_spike': False, 'bear_rsi_required': False, 'sideways_strategy': 'mean_reversion', 'sideways_bb_std_mult': 1.7930134977525722, 'sideways_rsi_os': 15, 'sideways_rsi_ob': 92, 'sideways_adx_thresh': 13.888024217464977, 'sideways_atr_min_pct': 0.012045279469762832, 'sideways_atr_max_pct': 0.033997713959106765, 'sideways_tp_mult': 1.2457739403738484, 'sideways_tsl_mult': 0.6836067834870694, 'sideways_time_stop': 53, 'sideways_use_sma': True, 'sideways_use_ema': True, 'sideways_use_atr': True, 'sideways_use_adx': True, 'sideways_use_spike': False, 'sideways_rsi_required': False}.
[I 2025-09-01 09:15:43,342] Trial 60 finished with values: [-1000000000.0, 1000000000.0] and parameters: {'p_sma': 14, 'p_std': 29, 'p_atr': 7, 'p_adx': 13, 'rsi_period': 70, 'ema1': 5, 'ema2': 48, 'slip_atr_k': 0.22888061435666424, 'slip_spread_k': 0.4520610507047731, 'spread_hl_frac': 0.041982910197806755, 'bb_std_mult': 0.6309109366512196, 'rsi_os': 44, 'rsi_ob': 52, 'vol_spike': 0.1498961204633771, 'adx_thresh': 14.65830483138232, 'atr_min_pct': 0.004120678792043192, 'atr_max_pct': 0.1256240697193569, 'tp_mult': 2.7791255981754506, 'tsl_mult': 0.08058311600217749, 'strategy': 'mean_reversion', 'time_stop': 58, 'use_sma': False, 'use_atr': True, 'use_adx': False, 'use_ema': False, 'use_spike': False, 'rsi_required': True, 'edge_k': 0.4059543432959148, 'edge_cap': 0.1810754771538634, 'bull_strategy': 'breakout', 'bull_bb_std_mult': 3.267098004711035, 'bull_rsi_os': 23, 'bull_rsi_ob': 71, 'bull_adx_thresh': 6.847147994651113, 'bull_atr_min_pct': 0.005547641199335599, 'bull_atr_max_pct': 0.09938163418177086, 'bull_tp_mult': 2.1203320133325656, 'bull_tsl_mult': 0.19247543691127839, 'bull_time_stop': 148, 'bull_use_sma': True, 'bull_use_ema': True, 'bull_use_atr': True, 'bull_use_adx': True, 'bull_use_spike': True, 'bull_rsi_required': True, 'bear_strategy': 'breakout', 'bear_bb_std_mult': 3.2550106556759006, 'bear_rsi_os': 7, 'bear_rsi_ob': 82, 'bear_adx_thresh': 31.4836003133445, 'bear_atr_min_pct': 0.01240054230189461, 'bear_atr_max_pct': 0.03075292976908845, 'bear_tp_mult': 1.7159687687534564, 'bear_tsl_mult': 0.8581033744083697, 'bear_time_stop': 271, 'bear_use_sma': False, 'bear_use_ema': True, 'bear_use_atr': False, 'bear_use_adx': True, 'bear_use_spike': False, 'bear_rsi_required': True, 'sideways_strategy': 'breakout', 'sideways_bb_std_mult': 2.7391896330563554, 'sideways_rsi_os': 33, 'sideways_rsi_ob': 55, 'sideways_adx_thresh': 14.122936043940644, 'sideways_atr_min_pct': 0.01232367161025816, 'sideways_atr_max_pct': 0.01874823301181982, 'sideways_tp_mult': 1.7557784843223194, 'sideways_tsl_mult': 0.3135449173491802, 'sideways_time_stop': 53, 'sideways_use_sma': False, 'sideways_use_ema': True, 'sideways_use_atr': True, 'sideways_use_adx': True, 'sideways_use_spike': False, 'sideways_rsi_required': False}.
[I 2025-09-01 09:15:43,343] Trial 58 finished with values: [-1000000000.0, 1000000000.0] and parameters: {'p_sma': 5, 'p_std': 59, 'p_atr': 24, 'p_adx': 13, 'rsi_period': 71, 'ema1': 6, 'ema2': 10, 'slip_atr_k': 0.23620363886922774, 'slip_spread_k': 0.972390789808818, 'spread_hl_frac': 0.04595219213812374, 'bb_std_mult': 3.1091219220563637, 'rsi_os': 44, 'rsi_ob': 56, 'vol_spike': 0.013426570110754377, 'adx_thresh': 9.84775982501962, 'atr_min_pct': 0.016183686705852452, 'atr_max_pct': 0.12396502295557973, 'tp_mult': 1.0737149847171779, 'tsl_mult': 0.17274896724491978, 'strategy': 'mean_reversion', 'time_stop': 31, 'use_sma': False, 'use_atr': True, 'use_adx': True, 'use_ema': False, 'use_spike': False, 'rsi_required': True, 'edge_k': 0.5855605751421311, 'edge_cap': 0.3139834803411984, 'bull_strategy': 'mean_reversion', 'bull_bb_std_mult': 1.8276790483306327, 'bull_rsi_os': 20, 'bull_rsi_ob': 69, 'bull_adx_thresh': 20.85055427239684, 'bull_atr_min_pct': 0.004986576503818001, 'bull_atr_max_pct': 0.09918795697077526, 'bull_tp_mult': 2.3671167996423947, 'bull_tsl_mult': 0.19701274136500535, 'bull_time_stop': 148, 'bull_use_sma': False, 'bull_use_ema': True, 'bull_use_atr': False, 'bull_use_adx': True, 'bull_use_spike': True, 'bull_rsi_required': True, 'bear_strategy': 'breakout', 'bear_bb_std_mult': 1.10968116963114, 'bear_rsi_os': 17, 'bear_rsi_ob': 54, 'bear_adx_thresh': 29.053011156725844, 'bear_atr_min_pct': 0.012288616250773867, 'bear_atr_max_pct': 0.07520301737405216, 'bear_tp_mult': 1.33541978681032, 'bear_tsl_mult': 0.6828010382768664, 'bear_time_stop': 144, 'bear_use_sma': False, 'bear_use_ema': False, 'bear_use_atr': False, 'bear_use_adx': True, 'bear_use_spike': False, 'bear_rsi_required': True, 'sideways_strategy': 'breakout', 'sideways_bb_std_mult': 3.5897981319864103, 'sideways_rsi_os': 17, 'sideways_rsi_ob': 58, 'sideways_adx_thresh': 23.820234699902098, 'sideways_atr_min_pct': 0.011717736956934347, 'sideways_atr_max_pct': 0.010272484874517832, 'sideways_tp_mult': 2.6963066288190825, 'sideways_tsl_mult': 0.936134617393785, 'sideways_time_stop': 53, 'sideways_use_sma': False, 'sideways_use_ema': True, 'sideways_use_atr': True, 'sideways_use_adx': False, 'sideways_use_spike': False, 'sideways_rsi_required': False}.
[I 2025-09-01 09:15:43,655] Trial 59 finished with values: [-1000000000.0, 1000000000.0] and parameters: {'p_sma': 5, 'p_std': 29, 'p_atr': 29, 'p_adx': 13, 'rsi_period': 14, 'ema1': 6, 'ema2': 36, 'slip_atr_k': 0.09178146752258363, 'slip_spread_k': 0.45426107019849526, 'spread_hl_frac': 0.04193702872792223, 'bb_std_mult': 3.1012799485721674, 'rsi_os': 45, 'rsi_ob': 55, 'vol_spike': 0.1674840863801002, 'adx_thresh': 9.74626510408516, 'atr_min_pct': 0.016408043918663597, 'atr_max_pct': 0.12599573082876736, 'tp_mult': 1.022577234772913, 'tsl_mult': 0.18094650278730318, 'strategy': 'mean_reversion', 'time_stop': 38, 'use_sma': True, 'use_atr': True, 'use_adx': True, 'use_ema': True, 'use_spike': False, 'rsi_required': True, 'edge_k': 0.39469646169724815, 'edge_cap': 0.16985816243300858, 'bull_strategy': 'breakout', 'bull_bb_std_mult': 1.754955033760797, 'bull_rsi_os': 20, 'bull_rsi_ob': 70, 'bull_adx_thresh': 20.464691412057046, 'bull_atr_min_pct': 0.004766565154435767, 'bull_atr_max_pct': 0.04415362038318872, 'bull_tp_mult': 1.0119179822399107, 'bull_tsl_mult': 0.18923584598663923, 'bull_time_stop': 197, 'bull_use_sma': True, 'bull_use_ema': False, 'bull_use_atr': True, 'bull_use_adx': True, 'bull_use_spike': True, 'bull_rsi_required': True, 'bear_strategy': 'breakout', 'bear_bb_std_mult': 3.2681851794229226, 'bear_rsi_os': 8, 'bear_rsi_ob': 78, 'bear_adx_thresh': 33.90541023477712, 'bear_atr_min_pct': 0.02732491712918459, 'bear_atr_max_pct': 0.07461260591343306, 'bear_tp_mult': 1.7176957188832835, 'bear_tsl_mult': 0.8523079798333945, 'bear_time_stop': 76, 'bear_use_sma': False, 'bear_use_ema': True, 'bear_use_atr': False, 'bear_use_adx': True, 'bear_use_spike': False, 'bear_rsi_required': True, 'sideways_strategy': 'breakout', 'sideways_bb_std_mult': 2.701376129428386, 'sideways_rsi_os': 41, 'sideways_rsi_ob': 73, 'sideways_adx_thresh': 7.850180889459576, 'sideways_atr_min_pct': 0.018368526159458835, 'sideways_atr_max_pct': 0.08252522704123269, 'sideways_tp_mult': 1.7593222124700798, 'sideways_tsl_mult': 0.01227293229246057, 'sideways_time_stop': 52, 'sideways_use_sma': False, 'sideways_use_ema': True, 'sideways_use_atr': False, 'sideways_use_adx': True, 'sideways_use_spike': False, 'sideways_rsi_required': True}.
[I 2025-09-01 09:16:22,787] Trial 65 finished with values: [-0.07403044585702134, 0.07373707692136668] and parameters: {'p_sma': 9, 'p_std': 8, 'p_atr': 26, 'p_adx': 28, 'rsi_period': 82, 'ema1': 24, 'ema2': 31, 'slip_atr_k': 0.1597148184200704, 'slip_spread_k': 0.8133413439429827, 'spread_hl_frac': 0.03399050032235851, 'bb_std_mult': 0.9509210133307306, 'rsi_os': 18, 'rsi_ob': 63, 'vol_spike': 0.09212117718580873, 'adx_thresh': 32.258760858936604, 'atr_min_pct': 0.009850987106705974, 'atr_max_pct': 0.113383704011236, 'tp_mult': 1.3308392903503092, 'tsl_mult': 0.03499633720246931, 'strategy': 'mean_reversion', 'time_stop': 14, 'use_sma': False, 'use_atr': True, 'use_adx': True, 'use_ema': False, 'use_spike': True, 'rsi_required': False, 'edge_k': 1.5837009370288997, 'edge_cap': 0.7129418907585555, 'bull_strategy': 'mean_reversion', 'bull_bb_std_mult': 2.1478797607817195, 'bull_rsi_os': 27, 'bull_rsi_ob': 76, 'bull_adx_thresh': 16.46026837021083, 'bull_atr_min_pct': 0.0032762471501024235, 'bull_atr_max_pct': 0.14741612105742635, 'bull_tp_mult': 1.2337297543584091, 'bull_tsl_mult': 0.3433522240467586, 'bull_time_stop': 156, 'bull_use_sma': False, 'bull_use_ema': True, 'bull_use_atr': False, 'bull_use_adx': False, 'bull_use_spike': True, 'bull_rsi_required': False, 'bear_strategy': 'mean_reversion', 'bear_bb_std_mult': 2.4738444059844134, 'bear_rsi_os': 44, 'bear_rsi_ob': 71, 'bear_adx_thresh': 34.572237828916535, 'bear_atr_min_pct': 0.021205539497182978, 'bear_atr_max_pct': 0.038283972895877344, 'bear_tp_mult': 1.1739941671550773, 'bear_tsl_mult': 0.110343983562187, 'bear_time_stop': 126, 'bear_use_sma': False, 'bear_use_ema': False, 'bear_use_atr': True, 'bear_use_adx': True, 'bear_use_spike': True, 'bear_rsi_required': True, 'sideways_strategy': 'breakout', 'sideways_bb_std_mult': 2.242389495320987, 'sideways_rsi_os': 43, 'sideways_rsi_ob': 52, 'sideways_adx_thresh': 17.584742927451092, 'sideways_atr_min_pct': 0.000922434171852548, 'sideways_atr_max_pct': 0.07166885886459773, 'sideways_tp_mult': 1.1082235757710086, 'sideways_tsl_mult': 0.8479741900457559, 'sideways_time_stop': 82, 'sideways_use_sma': False, 'sideways_use_ema': False, 'sideways_use_atr': True, 'sideways_use_adx': False, 'sideways_use_spike': False, 'sideways_rsi_required': False}.
