[I 2025-09-01 09:14:22,921] Trial 45 finished with values: [-0.03966261807088489, 0.039918552667306505] and parameters: {'p_sma': 8, 'p_std': 45, 'p_atr': 8, 'p_adx': 9, 'rsi_period': 68, 'ema1': 5, 'ema2': 10, 'slip_atr_k': 0.11764187384667862, 'slip_spread_k': 0.7933384377387915, 'spread_hl_frac': 0.007927969793914386, 'bb_std_mult': 3.2698344834478887, 'rsi_os': 27, 'rsi_ob': 61, 'vol_spike': 0.15716850092511248, 'adx_thresh': 26.251153932332066, 'atr_min_pct': 0.02147360419140714, 'atr_max_pct': 0.04822189484356067, 'tp_mult': 2.7716159032406353, 'tsl_mult': 0.7181974457119101, 'strategy': 'mean_reversion', 'time_stop': 22, 'use_sma': True, 'use_atr': True, 'use_adx': True, 'use_ema': True, 'use_spike': False, 'rsi_required': False, 'edge_k': 1.559487943683419, 'edge_cap': 0.7849647441460748, 'bull_strategy': 'mean_reversion', 'bull_bb_std_mult': 2.21023723825134, 'bull_rsi_os': 29, 'bull_rsi_ob': 67, 'bull_adx_thresh': 33.98467389444696, 'bull_atr_min_pct': 0.006166944717286676, 'bull_atr_max_pct': 0.07818391343591712, 'bull_tp_mult': 1.876020215077344, 'bull_tsl_mult': 0.23285711393662595, 'bull_time_stop': 165, 'bull_use_sma': False, 'bull_use_ema': False, 'bull_use_atr': False, 'bull_use_adx': False, 'bull_use_spike': True, 'bull_rsi_required': False, 'bear_strategy': 'mean_reversion', 'bear_bb_std_mult': 3.241822917359567, 'bear_rsi_os': 9, 'bear_rsi_ob': 55, 'bear_adx_thresh': 9.132797939458355, 'bear_atr_min_pct': 0.007050611124636194, 'bear_atr_max_pct': 0.01014090249814699, 'bear_tp_mult': 2.483263524526526, 'bear_tsl_mult': 0.842379346484011, 'bear_time_stop': 122, 'bear_use_sma': True, 'bear_use_ema': False, 'bear_use_atr': False, 'bear_use_adx': True, 'bear_use_spike': False, 'bear_rsi_required': True, 'sideways_strategy': 'breakout', 'sideways_bb_std_mult': 3.04729040581856, 'sideways_rsi_os': 39, 'sideways_rsi_ob': 65, 'sideways_adx_thresh': 6.2861379606959105, 'sideways_atr_min_pct': 0.0003078528117393771, 'sideways_atr_max_pct': 0.014173135676256665, 'sideways_tp_mult': 1.8001538336323555, 'sideways_tsl_mult': 0.9917132500621277, 'sideways_time_stop': 233, 'sideways_use_sma': False, 'sideways_use_ema': True, 'sideways_use_atr': True, 'sideways_use_adx': False, 'sideways_use_spike': False, 'sideways_rsi_required': False}.
[I 2025-09-01 09:14:23,442] Trial 44 finished with values: [-0.05510942578170508, 0.055036326493998804] and parameters: {'p_sma': 8, 'p_std': 15, 'p_atr': 10, 'p_adx': 9, 'rsi_period': 66, 'ema1': 30, 'ema2': 17, 'slip_atr_k': 0.12189404714896238, 'slip_spread_k': 0.5298287567391975, 'spread_hl_frac': 0.04095362755323749, 'bb_std_mult': 2.6758561254535267, 'rsi_os': 27, 'rsi_ob': 61, 'vol_spike': 0.15877292295109635, 'adx_thresh': 17.76242580468096, 'atr_min_pct': 0.02166034422244513, 'atr_max_pct': 0.050941032609229414, 'tp_mult': 2.697130092737405, 'tsl_mult': 0.564582069799837, 'strategy': 'mean_reversion', 'time_stop': 22, 'use_sma': True, 'use_atr': True, 'use_adx': True, 'use_ema': True, 'use_spike': False, 'rsi_required': False, 'edge_k': 1.556344322069656, 'edge_cap': 0.3270876954865962, 'bull_strategy': 'mean_reversion', 'bull_bb_std_mult': 2.30409955745631, 'bull_rsi_os': 55, 'bull_rsi_ob': 81, 'bull_adx_thresh': 32.50018973495541, 'bull_atr_min_pct': 0.004917736521339494, 'bull_atr_max_pct': 0.08020200440370287, 'bull_tp_mult': 1.8923013048591282, 'bull_tsl_mult': 0.2378236426353324, 'bull_time_stop': 173, 'bull_use_sma': False, 'bull_use_ema': False, 'bull_use_atr': False, 'bull_use_adx': False, 'bull_use_spike': True, 'bull_rsi_required': False, 'bear_strategy': 'mean_reversion', 'bear_bb_std_mult': 3.248500899807644, 'bear_rsi_os': 9, 'bear_rsi_ob': 51, 'bear_adx_thresh': 10.321845780415696, 'bear_atr_min_pct': 0.007208832739277664, 'bear_atr_max_pct': 0.018850647136662554, 'bear_tp_mult': 1.9348065363585945, 'bear_tsl_mult': 0.868202281264686, 'bear_time_stop': 122, 'bear_use_sma': True, 'bear_use_ema': False, 'bear_use_atr': False, 'bear_use_adx': True, 'bear_use_spike': True, 'bear_rsi_required': True, 'sideways_strategy': 'breakout', 'sideways_bb_std_mult': 3.081285821359135, 'sideways_rsi_os': 39, 'sideways_rsi_ob': 71, 'sideways_adx_thresh': 6.424628994019248, 'sideways_atr_min_pct': 0.0002697230051708692, 'sideways_atr_max_pct': 0.015825406675048788, 'sideways_tp_mult': 1.1808524758321266, 'sideways_tsl_mult': 0.5483487522322857, 'sideways_time_stop': 227, 'sideways_use_sma': False, 'sideways_use_ema': True, 'sideways_use_atr': True, 'sideways_use_adx': False, 'sideways_use_spike': False, 'sideways_rsi_required': False}.
[I 2025-09-01 09:14:23,625] Trial 47 finished with values: [-0.13458535538085703, 0.13438665748439824] and parameters: {'p_sma': 8, 'p_std': 45, 'p_atr': 9, 'p_adx': 16, 'rsi_period': 31, 'ema1': 5, 'ema2': 11, 'slip_atr_k': 0.11668881510531524, 'slip_spread_k': 0.4965757801371776, 'spread_hl_frac': 0.041406570280776954, 'bb_std_mult': 3.1883112424187505, 'rsi_os': 29, 'rsi_ob': 57, 'vol_spike': 0.16183567038896704, 'adx_thresh': 26.32303226480706, 'atr_min_pct': 0.02271784403757102, 'atr_max_pct': 0.08968750262425636, 'tp_mult': 2.742920401960283, 'tsl_mult': 0.11262309731531744, 'strategy': 'mean_reversion', 'time_stop': 29, 'use_sma': True, 'use_atr': True, 'use_adx': True, 'use_ema': True, 'use_spike': False, 'rsi_required': False, 'edge_k': 1.5055754721068517, 'edge_cap': 0.315281949253733, 'bull_strategy': 'mean_reversion', 'bull_bb_std_mult': 2.1613912863745908, 'bull_rsi_os': 35, 'bull_rsi_ob': 67, 'bull_adx_thresh': 13.495659105655449, 'bull_atr_min_pct': 0.012079757036648717, 'bull_atr_max_pct': 0.010504071578321741, 'bull_tp_mult': 2.7077511755753276, 'bull_tsl_mult': 0.09547247984049678, 'bull_time_stop': 123, 'bull_use_sma': False, 'bull_use_ema': False, 'bull_use_atr': False, 'bull_use_adx': False, 'bull_use_spike': True, 'bull_rsi_required': False, 'bear_strategy': 'mean_reversion', 'bear_bb_std_mult': 1.1421221632175091, 'bear_rsi_os': 9, 'bear_rsi_ob': 61, 'bear_adx_thresh': 16.107229393347893, 'bear_atr_min_pct': 0.0258609255990003, 'bear_atr_max_pct': 0.14406757565057432, 'bear_tp_mult': 2.4627369786865208, 'bear_tsl_mult': 0.7090749308931104, 'bear_time_stop': 124, 'bear_use_sma': False, 'bear_use_ema': False, 'bear_use_atr': False, 'bear_use_adx': True, 'bear_use_spike': False, 'bear_rsi_required': True, 'sideways_strategy': 'breakout', 'sideways_bb_std_mult': 2.684659426993229, 'sideways_rsi_os': 40, 'sideways_rsi_ob': 56, 'sideways_adx_thresh': 6.378651597094537, 'sideways_atr_min_pct': 6.599530945704745e-05, 'sideways_atr_max_pct': 0.014669770566210216, 'sideways_tp_mult': 2.682571931794155, 'sideways_tsl_mult': 0.7783758995610585, 'sideways_time_stop': 178, 'sideways_use_sma': False, 'sideways_use_ema': True, 'sideways_use_atr': True, 'sideways_use_adx': False, 'sideways_use_spike': False, 'sideways_rsi_required': False}.
[I 2025-09-01 09:14:23,902] Trial 48 finished with values: [-1000000000.0, 1000000000.0] and parameters: {'p_sma': 18, 'p_std': 25, 'p_atr': 12, 'p_adx': 20, 'rsi_period': 31, 'ema1': 29, 'ema2': 17, 'slip_atr_k': 0.14550683328633657, 'slip_spread_k': 0.49611659092639054, 'spread_hl_frac': 0.02704469407774686, 'bb_std_mult': 3.299933148225718, 'rsi_os': 6, 'rsi_ob': 62, 'vol_spike': 0.21973040873822797, 'adx_thresh': 27.075803913929164, 'atr_min_pct': 0.02633967095625591, 'atr_max_pct': 0.019939503384212617, 'tp_mult': 2.6267400913870427, 'tsl_mult': 0.10528582011870105, 'strategy': 'mean_reversion', 'time_stop': 73, 'use_sma': False, 'use_atr': True, 'use_adx': True, 'use_ema': False, 'use_spike': True, 'rsi_required': False, 'edge_k': 1.203634067065653, 'edge_cap': 0.6353465117626365, 'bull_strategy': 'mean_reversion', 'bull_bb_std_mult': 2.20675585116497, 'bull_rsi_os': 36, 'bull_rsi_ob': 49, 'bull_adx_thresh': 13.796099201455966, 'bull_atr_min_pct': 0.012356561961579242, 'bull_atr_max_pct': 0.015441192618374483, 'bull_tp_mult': 1.9041348480066922, 'bull_tsl_mult': 0.5433217619196148, 'bull_time_stop': 300, 'bull_use_sma': False, 'bull_use_ema': True, 'bull_use_atr': False, 'bull_use_adx': False, 'bull_use_spike': False, 'bull_rsi_required': False, 'bear_strategy': 'mean_reversion', 'bear_bb_std_mult': 2.699974372913332, 'bear_rsi_os': 53, 'bear_rsi_ob': 61, 'bear_adx_thresh': 26.17703511834638, 'bear_atr_min_pct': 0.024876741873517967, 'bear_atr_max_pct': 0.10561812059920198, 'bear_tp_mult': 1.041198121988025, 'bear_tsl_mult': 0.5859825530743599, 'bear_time_stop': 117, 'bear_use_sma': False, 'bear_use_ema': False, 'bear_use_atr': False, 'bear_use_adx': True, 'bear_use_spike': False, 'bear_rsi_required': True, 'sideways_strategy': 'breakout', 'sideways_bb_std_mult': 3.083114840770099, 'sideways_rsi_os': 39, 'sideways_rsi_ob': 78, 'sideways_adx_thresh': 25.515461993106655, 'sideways_atr_min_pct': 0.0003311133060753581, 'sideways_atr_max_pct': 0.1122914246137683, 'sideways_tp_mult': 2.590226133161502, 'sideways_tsl_mult': 0.8629030537931077, 'sideways_time_stop': 177, 'sideways_use_sma': False, 'sideways_use_ema': True, 'sideways_use_atr': True, 'sideways_use_adx': False, 'sideways_use_spike': False, 'sideways_rsi_required': False}.
[I 2025-09-01 09:14:23,955] Trial 50 finished with values: [-1000000000.0, 1000000000.0] and parameters: {'p_sma': 17, 'p_std': 25, 'p_atr': 30, 'p_adx': 14, 'rsi_period': 73, 'ema1': 9, 'ema2': 23, 'slip_atr_k': 0.17780300613684272, 'slip_spread_k': 0.7996723307909612, 'spread_hl_frac': 0.026366705588654456, 'bb_std_mult': 2.430920530548659, 'rsi_os': 31, 'rsi_ob': 61, 'vol_spike': 0.2164392537087101, 'adx_thresh': 23.91930115999546, 'atr_min_pct': 0.026352180668755578, 'atr_max_pct': 0.01923651521652188, 'tp_mult': 1.1949174182035613, 'tsl_mult': 0.061596340979456994, 'strategy': 'mean_reversion', 'time_stop': 17, 'use_sma': False, 'use_atr': True, 'use_adx': True, 'use_ema': False, 'use_spike': True, 'rsi_required': False, 'edge_k': 1.3254011549018663, 'edge_cap': 0.23285027627024193, 'bull_strategy': 'mean_reversion', 'bull_bb_std_mult': 1.4318217408368992, 'bull_rsi_os': 53, 'bull_rsi_ob': 90, 'bull_adx_thresh': 14.67282685289039, 'bull_atr_min_pct': 0.002327334808827023, 'bull_atr_max_pct': 0.14124490191821779, 'bull_tp_mult': 1.9717670885827374, 'bull_tsl_mult': 0.5309680184388924, 'bull_time_stop': 175, 'bull_use_sma': False, 'bull_use_ema': True, 'bull_use_atr': False, 'bull_use_adx': False, 'bull_use_spike': False, 'bull_rsi_required': False, 'bear_strategy': 'mean_reversion', 'bear_bb_std_mult': 2.6500987133883234, 'bear_rsi_os': 55, 'bear_rsi_ob': 61, 'bear_adx_thresh': 25.46282912631767, 'bear_atr_min_pct': 0.01869599247313407, 'bear_atr_max_pct': 0.10635182450364074, 'bear_tp_mult': 1.5496007605935411, 'bear_tsl_mult': 0.9320982283374357, 'bear_time_stop': 117, 'bear_use_sma': False, 'bear_use_ema': False, 'bear_use_atr': False, 'bear_use_adx': True, 'bear_use_spike': True, 'bear_rsi_required': True, 'sideways_strategy': 'breakout', 'sideways_bb_std_mult': 2.054241611094917, 'sideways_rsi_os': 38, 'sideways_rsi_ob': 79, 'sideways_adx_thresh': 26.130300985313053, 'sideways_atr_min_pct': 0.021544309160821385, 'sideways_atr_max_pct': 0.12402931980423545, 'sideways_tp_mult': 1.8104561872875027, 'sideways_tsl_mult': 0.44268360212360097, 'sideways_time_stop': 257, 'sideways_use_sma': False, 'sideways_use_ema': True, 'sideways_use_atr': True, 'sideways_use_adx': False, 'sideways_use_spike': False, 'sideways_rsi_required': False}.
[I 2025-09-01 09:14:23,961] Trial 49 finished with values: [-1000000000.0, 1000000000.0] and parameters: {'p_sma': 35, 'p_std': 25, 'p_atr': 30, 'p_adx': 19, 'rsi_period': 73, 'ema1': 30, 'ema2': 12, 'slip_atr_k': 0.1457916439296418, 'slip_spread_k': 0.785021931030361, 'spread_hl_frac': 0.026273626285250425, 'bb_std_mult': 1.0820701811822675, 'rsi_os': 39, 'rsi_ob': 61, 'vol_spike': 0.2511572508724109, 'adx_thresh': 20.460481200335305, 'atr_min_pct': 0.0262965367649878, 'atr_max_pct': 0.019279892438839367, 'tp_mult': 1.2017349517962297, 'tsl_mult': 0.09340098871350735, 'strategy': 'mean_reversion', 'time_stop': 23, 'use_sma': False, 'use_atr': True, 'use_adx': True, 'use_ema': False, 'use_spike': True, 'rsi_required': False, 'edge_k': 1.3297861426189193, 'edge_cap': 0.25128808295066246, 'bull_strategy': 'mean_reversion', 'bull_bb_std_mult': 1.364880247060086, 'bull_rsi_os': 54, 'bull_rsi_ob': 49, 'bull_adx_thresh': 34.94543801558993, 'bull_atr_min_pct': 0.0023409410769707818, 'bull_atr_max_pct': 0.14279988165876625, 'bull_tp_mult': 1.8888399193151848, 'bull_tsl_mult': 0.7403501086411397, 'bull_time_stop': 30, 'bull_use_sma': False, 'bull_use_ema': True, 'bull_use_atr': False, 'bull_use_adx': False, 'bull_use_spike': False, 'bull_rsi_required': False, 'bear_strategy': 'mean_reversion', 'bear_bb_std_mult': 2.732288165513499, 'bear_rsi_os': 12, 'bear_rsi_ob': 61, 'bear_adx_thresh': 33.77033992958015, 'bear_atr_min_pct': 0.018044484926049882, 'bear_atr_max_pct': 0.09909406771631636, 'bear_tp_mult': 2.4919130781405823, 'bear_tsl_mult': 0.9426270569012085, 'bear_time_stop': 299, 'bear_use_sma': False, 'bear_use_ema': False, 'bear_use_atr': False, 'bear_use_adx': True, 'bear_use_spike': False, 'bear_rsi_required': True, 'sideways_strategy': 'breakout', 'sideways_bb_std_mult': 2.1092047137425656, 'sideways_rsi_os': 37, 'sideways_rsi_ob': 56, 'sideways_adx_thresh': 25.045287668313282, 'sideways_atr_min_pct': 0.00010694595473786342, 'sideways_atr_max_pct': 0.12352554007531692, 'sideways_tp_mult': 1.4466888602309456, 'sideways_tsl_mult': 0.4672319731263619, 'sideways_time_stop': 77, 'sideways_use_sma': False, 'sideways_use_ema': True, 'sideways_use_atr': True, 'sideways_use_adx': False, 'sideways_use_spike': False, 'sideways_rsi_required': False}.
[I 2025-09-01 09:14:23,998] Trial 51 finished with values: [-1000000000.0, 1000000000.0] and parameters: {'p_sma': 18, 'p_std': 23, 'p_atr': 30, 'p_adx': 14, 'rsi_period': 75, 'ema1': 30, 'ema2': 54, 'slip_atr_k': 0.2481437100428921, 'slip_spread_k': 0.6860003290056016, 'spread_hl_frac': 0.030441587313759684, 'bb_std_mult': 1.0973765098182178, 'rsi_os': 39, 'rsi_ob': 60, 'vol_spike': 0.22202502811168875, 'adx_thresh': 6.860046607194959, 'atr_min_pct': 0.026272043155975894, 'atr_max_pct': 0.02141990425721995, 'tp_mult': 1.1808203798221142, 'tsl_mult': 0.26503170116137487, 'strategy': 'mean_reversion', 'time_stop': 68, 'use_sma': False, 'use_atr': True, 'use_adx': True, 'use_ema': False, 'use_spike': True, 'rsi_required': False, 'edge_k': 1.2603436066143923, 'edge_cap': 0.22862845567653325, 'bull_strategy': 'mean_reversion', 'bull_bb_std_mult': 1.3738875661782681, 'bull_rsi_os': 54, 'bull_rsi_ob': 91, 'bull_adx_thresh': 34.62348692196416, 'bull_atr_min_pct': 0.0025605568737941046, 'bull_atr_max_pct': 0.14261446315365522, 'bull_tp_mult': 1.9502996629751286, 'bull_tsl_mult': 0.5259969342667379, 'bull_time_stop': 175, 'bull_use_sma': False, 'bull_use_ema': True, 'bull_use_atr': False, 'bull_use_adx': False, 'bull_use_spike': False, 'bull_rsi_required': False, 'bear_strategy': 'mean_reversion', 'bear_bb_std_mult': 0.5260819504679211, 'bear_rsi_os': 53, 'bear_rsi_ob': 67, 'bear_adx_thresh': 18.521056599989887, 'bear_atr_min_pct': 0.017717245130359723, 'bear_atr_max_pct': 0.10485325296179251, 'bear_tp_mult': 1.0911032961002862, 'bear_tsl_mult': 0.5706682934674129, 'bear_time_stop': 294, 'bear_use_sma': False, 'bear_use_ema': False, 'bear_use_atr': False, 'bear_use_adx': True, 'bear_use_spike': True, 'bear_rsi_required': True, 'sideways_strategy': 'breakout', 'sideways_bb_std_mult': 2.134742266149736, 'sideways_rsi_os': 37, 'sideways_rsi_ob': 78, 'sideways_adx_thresh': 25.384861432818383, 'sideways_atr_min_pct': 0.02275610111242636, 'sideways_atr_max_pct': 0.06282577150312793, 'sideways_tp_mult': 1.4330462968895903, 'sideways_tsl_mult': 0.44593997688662373, 'sideways_time_stop': 78, 'sideways_use_sma': False, 'sideways_use_ema': True, 'sideways_use_atr': True, 'sideways_use_adx': False, 'sideways_use_spike': False, 'sideways_rsi_required': False}.
[I 2025-09-01 09:14:24,259] Trial 52 finished with values: [-1000000000.0, 1000000000.0] and parameters: {'p_sma': 13, 'p_std': 35, 'p_atr': 30, 'p_adx': 14, 'rsi_period': 75, 'ema1': 9, 'ema2': 23, 'slip_atr_k': 0.18029062846964514, 'slip_spread_k': 0.7852784680017708, 'spread_hl_frac': 0.030969287981208626, 'bb_std_mult': 1.1176770841171373, 'rsi_os': 39, 'rsi_ob': 50, 'vol_spike': 0.25218253485429687, 'adx_thresh': 19.24144491635461, 'atr_min_pct': 0.02013102299614857, 'atr_max_pct': 0.101787747002408, 'tp_mult': 1.6080069081034958, 'tsl_mult': 0.2658096634758446, 'strategy': 'mean_reversion', 'time_stop': 20, 'use_sma': False, 'use_atr': False, 'use_adx': True, 'use_ema': False, 'use_spike': False, 'rsi_required': False, 'edge_k': 0.2713527742479925, 'edge_cap': 0.09736073925672745, 'bull_strategy': 'mean_reversion', 'bull_bb_std_mult': 1.3604337170160727, 'bull_rsi_os': 9, 'bull_rsi_ob': 78, 'bull_adx_thresh': 32.97262315104685, 'bull_atr_min_pct': 0.0021036416164114252, 'bull_atr_max_pct': 0.07808185544881559, 'bull_tp_mult': 1.1292362771323938, 'bull_tsl_mult': 0.7290252810190183, 'bull_time_stop': 171, 'bull_use_sma': False, 'bull_use_ema': True, 'bull_use_atr': False, 'bull_use_adx': False, 'bull_use_spike': False, 'bull_rsi_required': False, 'bear_strategy': 'mean_reversion', 'bear_bb_std_mult': 3.480172264715766, 'bear_rsi_os': 12, 'bear_rsi_ob': 67, 'bear_adx_thresh': 33.53460372642028, 'bear_atr_min_pct': 0.017837510641590677, 'bear_atr_max_pct': 0.09447757269231488, 'bear_tp_mult': 1.5646026327789038, 'bear_tsl_mult': 0.9243489128098814, 'bear_time_stop': 176, 'bear_use_sma': False, 'bear_use_ema': False, 'bear_use_atr': False, 'bear_use_adx': True, 'bear_use_spike': True, 'bear_rsi_required': True, 'sideways_strategy': 'breakout', 'sideways_bb_std_mult': 2.1066821102437454, 'sideways_rsi_os': 37, 'sideways_rsi_ob': 69, 'sideways_adx_thresh': 11.729646505020545, 'sideways_atr_min_pct': 0.008162039349492783, 'sideways_atr_max_pct': 0.13086666424083315, 'sideways_tp_mult': 1.4475808600137907, 'sideways_tsl_mult': 0.45741113659467075, 'sideways_time_stop': 17, 'sideways_use_sma': False, 'sideways_use_ema': True, 'sideways_use_atr': True, 'sideways_use_adx': False, 'sideways_use_spike': True, 'sideways_rsi_required': False}.
[I 2025-09-01 09:14:24,315] Trial 55 finished with values: [-1000000000.0, 1000000000.0] and parameters: {'p_sma': 7, 'p_std': 34, 'p_atr': 27, 'p_adx': 16, 'rsi_period': 66, 'ema1': 6, 'ema2': 60, 'slip_atr_k': 0.12766401120165, 'slip_spread_k': 0.8910681471150501, 'spread_hl_frac': 0.03630647359906966, 'bb_std_mult': 0.815783776159237, 'rsi_os': 50, 'rsi_ob': 54, 'vol_spike': 0.2800568636596509, 'adx_thresh': 25.557070280515248, 'atr_min_pct': 0.020520243968364518, 'atr_max_pct': 0.047600688210227074, 'tp_mult': 1.3690136698174609, 'tsl_mult': 0.1358005000209554, 'strategy': 'mean_reversion', 'time_stop': 33, 'use_sma': True, 'use_atr': False, 'use_adx': True, 'use_ema': True, 'use_spike': False, 'rsi_required': False, 'edge_k': 0.30409261807177884, 'edge_cap': 0.31152289578897024, 'bull_strategy': 'mean_reversion', 'bull_bb_std_mult': 0.7561716753778276, 'bull_rsi_os': 40, 'bull_rsi_ob': 65, 'bull_adx_thresh': 26.708402612601052, 'bull_atr_min_pct': 0.0013661273745367477, 'bull_atr_max_pct': 0.08225548939237826, 'bull_tp_mult': 1.1074805242039458, 'bull_tsl_mult': 0.3741835043422249, 'bull_time_stop': 122, 'bull_use_sma': False, 'bull_use_ema': False, 'bull_use_atr': False, 'bull_use_adx': False, 'bull_use_spike': True, 'bull_rsi_required': False, 'bear_strategy': 'mean_reversion', 'bear_bb_std_mult': 2.9771989908428993, 'bear_rsi_os': 26, 'bear_rsi_ob': 89, 'bear_adx_thresh': 16.017857688270222, 'bear_atr_min_pct': 0.0037766775953138963, 'bear_atr_max_pct': 0.1497643063746242, 'bear_tp_mult': 1.9198151327462334, 'bear_tsl_mult': 0.7078832965328277, 'bear_time_stop': 98, 'bear_use_sma': False, 'bear_use_ema': False, 'bear_use_atr': False, 'bear_use_adx': True, 'bear_use_spike': True, 'bear_rsi_required': True, 'sideways_strategy': 'breakout', 'sideways_bb_std_mult': 2.5705736867369327, 'sideways_rsi_os': 46, 'sideways_rsi_ob': 72, 'sideways_adx_thresh': 11.776952498809882, 'sideways_atr_min_pct': 0.0023244631215973764, 'sideways_atr_max_pct': 0.04799673901493379, 'sideways_tp_mult': 2.6307513601703856, 'sideways_tsl_mult': 0.9314488780851353, 'sideways_time_stop': 20, 'sideways_use_sma': False, 'sideways_use_ema': True, 'sideways_use_atr': True, 'sideways_use_adx': False, 'sideways_use_spike': True, 'sideways_rsi_required': True}.
