[I 2025-09-01 10:38:09,083] Trial 597 finished with values: [-1000000000.0, 1000000000.0] and parameters: {'p_sma': 9, 'p_std': 56, 'p_atr': 13, 'p_adx': 20, 'rsi_period': 35, 'ema1': 14, 'ema2': 12, 'slip_atr_k': 0.02956201124895677, 'slip_spread_k': 0.9719890802943405, 'spread_hl_frac': 0.015418659811842622, 'bb_std_mult': 0.7443806244731856, 'rsi_os': 16, 'rsi_ob': 58, 'vol_spike': 0.07238070775632736, 'adx_thresh': 15.137931488871368, 'atr_min_pct': 0.016313656605964184, 'atr_max_pct': 0.010251262297158623, 'tp_mult': 1.4392060017109627, 'tsl_mult': 0.09254926197455882, 'strategy': 'breakout', 'time_stop': 114, 'use_sma': True, 'use_atr': False, 'use_adx': False, 'use_ema': False, 'use_spike': False, 'rsi_required': True, 'edge_k': 1.6081726605261817, 'edge_cap': 0.24430236876250458, 'bull_strategy': 'breakout', 'bull_bb_std_mult': 0.7065209206714697, 'bull_rsi_os': 19, 'bull_rsi_ob': 93, 'bull_adx_thresh': 32.8437171097469, 'bull_atr_min_pct': 0.002369143260001031, 'bull_atr_max_pct': 0.014735581247168388, 'bull_tp_mult': 1.1294067892652928, 'bull_tsl_mult': 0.8096403717483605, 'bull_time_stop': 248, 'bull_use_sma': True, 'bull_use_ema': False, 'bull_use_atr': False, 'bull_use_adx': True, 'bull_use_spike': True, 'bull_rsi_required': True, 'bear_strategy': 'breakout', 'bear_bb_std_mult': 0.5111577465966262, 'bear_rsi_os': 27, 'bear_rsi_ob': 83, 'bear_adx_thresh': 8.553662765767006, 'bear_atr_min_pct': 0.0027249806538315394, 'bear_atr_max_pct': 0.09550780272749945, 'bear_tp_mult': 2.4016980425091026, 'bear_tsl_mult': 0.9283857394862214, 'bear_time_stop': 169, 'bear_use_sma': True, 'bear_use_ema': False, 'bear_use_atr': False, 'bear_use_adx': True, 'bear_use_spike': True, 'bear_rsi_required': False, 'sideways_strategy': 'breakout', 'sideways_bb_std_mult': 3.503829329194179, 'sideways_rsi_os': 17, 'sideways_rsi_ob': 85, 'sideways_adx_thresh': 30.878493511580828, 'sideways_atr_min_pct': 0.02062640684175383, 'sideways_atr_max_pct': 0.06146767551764673, 'sideways_tp_mult': 2.050734613085077, 'sideways_tsl_mult': 0.15551169443745866, 'sideways_time_stop': 245, 'sideways_use_sma': False, 'sideways_use_ema': True, 'sideways_use_atr': True, 'sideways_use_adx': False, 'sideways_use_spike': True, 'sideways_rsi_required': True}.
[I 2025-09-01 10:38:10,290] Trial 594 finished with values: [-1000000000.0, 1000000000.0] and parameters: {'p_sma': 14, 'p_std': 21, 'p_atr': 15, 'p_adx': 30, 'rsi_period': 41, 'ema1': 9, 'ema2': 12, 'slip_atr_k': 0.2436350602311671, 'slip_spread_k': 0.8052288371825786, 'spread_hl_frac': 0.046370480319901416, 'bb_std_mult': 0.9538526704332478, 'rsi_os': 12, 'rsi_ob': 78, 'vol_spike': 0.22956314098589692, 'adx_thresh': 24.01619911134702, 'atr_min_pct': 0.01769404703997519, 'atr_max_pct': 0.03935900620826458, 'tp_mult': 2.127435343791043, 'tsl_mult': 0.5385771124930601, 'strategy': 'breakout', 'time_stop': 138, 'use_sma': True, 'use_atr': False, 'use_adx': False, 'use_ema': False, 'use_spike': False, 'rsi_required': True, 'edge_k': 0.5020350597869396, 'edge_cap': 0.24120075393307255, 'bull_strategy': 'mean_reversion', 'bull_bb_std_mult': 0.7535054591896289, 'bull_rsi_os': 19, 'bull_rsi_ob': 83, 'bull_adx_thresh': 26.195922118764628, 'bull_atr_min_pct': 0.017132739245973017, 'bull_atr_max_pct': 0.022991804393791736, 'bull_tp_mult': 2.0996717040379775, 'bull_tsl_mult': 0.6774803452930145, 'bull_time_stop': 99, 'bull_use_sma': True, 'bull_use_ema': False, 'bull_use_atr': False, 'bull_use_adx': True, 'bull_use_spike': True, 'bull_rsi_required': True, 'bear_strategy': 'breakout', 'bear_bb_std_mult': 1.8753566017509105, 'bear_rsi_os': 30, 'bear_rsi_ob': 86, 'bear_adx_thresh': 8.218630446849923, 'bear_atr_min_pct': 0.002445566400961452, 'bear_atr_max_pct': 0.08463489326738893, 'bear_tp_mult': 1.7738833310841042, 'bear_tsl_mult': 0.7087622121580732, 'bear_time_stop': 127, 'bear_use_sma': True, 'bear_use_ema': False, 'bear_use_atr': False, 'bear_use_adx': True, 'bear_use_spike': True, 'bear_rsi_required': False, 'sideways_strategy': 'breakout', 'sideways_bb_std_mult': 0.5580318615081616, 'sideways_rsi_os': 54, 'sideways_rsi_ob': 57, 'sideways_adx_thresh': 30.94810416188193, 'sideways_atr_min_pct': 0.007749847118300474, 'sideways_atr_max_pct': 0.03233764162028923, 'sideways_tp_mult': 2.186270587394329, 'sideways_tsl_mult': 0.30383277300642314, 'sideways_time_stop': 245, 'sideways_use_sma': False, 'sideways_use_ema': True, 'sideways_use_atr': True, 'sideways_use_adx': False, 'sideways_use_spike': False, 'sideways_rsi_required': True}.
[I 2025-09-01 10:38:53,113] Trial 595 finished with values: [-1000000000.0, 1000000000.0] and parameters: {'p_sma': 10, 'p_std': 37, 'p_atr': 23, 'p_adx': 20, 'rsi_period': 50, 'ema1': 10, 'ema2': 12, 'slip_atr_k': 0.24182371827774068, 'slip_spread_k': 0.973246231003099, 'spread_hl_frac': 0.015477276450473454, 'bb_std_mult': 0.9799988372026727, 'rsi_os': 17, 'rsi_ob': 62, 'vol_spike': 0.04371439376488269, 'adx_thresh': 22.438506812741743, 'atr_min_pct': 0.016542831991164655, 'atr_max_pct': 0.049181696244236225, 'tp_mult': 2.7139844110895237, 'tsl_mult': 0.09582608954844254, 'strategy': 'breakout', 'time_stop': 143, 'use_sma': True, 'use_atr': False, 'use_adx': False, 'use_ema': False, 'use_spike': False, 'rsi_required': True, 'edge_k': 0.5314647305354907, 'edge_cap': 0.26483916971738375, 'bull_strategy': 'mean_reversion', 'bull_bb_std_mult': 1.8242692069221074, 'bull_rsi_os': 8, 'bull_rsi_ob': 73, 'bull_adx_thresh': 15.915562356366419, 'bull_atr_min_pct': 0.01694138090781158, 'bull_atr_max_pct': 0.014233568554485706, 'bull_tp_mult': 2.1057048413380293, 'bull_tsl_mult': 0.8126216511420157, 'bull_time_stop': 247, 'bull_use_sma': True, 'bull_use_ema': False, 'bull_use_atr': False, 'bull_use_adx': True, 'bull_use_spike': True, 'bull_rsi_required': True, 'bear_strategy': 'breakout', 'bear_bb_std_mult': 1.4235172702745138, 'bear_rsi_os': 30, 'bear_rsi_ob': 54, 'bear_adx_thresh': 27.045775194938763, 'bear_atr_min_pct': 0.013990786629798023, 'bear_atr_max_pct': 0.09528196554294129, 'bear_tp_mult': 2.414809889617726, 'bear_tsl_mult': 0.3107693979755735, 'bear_time_stop': 126, 'bear_use_sma': True, 'bear_use_ema': False, 'bear_use_atr': False, 'bear_use_adx': True, 'bear_use_spike': True, 'bear_rsi_required': False, 'sideways_strategy': 'breakout', 'sideways_bb_std_mult': 2.3912551969540807, 'sideways_rsi_os': 37, 'sideways_rsi_ob': 69, 'sideways_adx_thresh': 30.23290964363837, 'sideways_atr_min_pct': 0.008006942477260378, 'sideways_atr_max_pct': 0.01287617893242557, 'sideways_tp_mult': 2.18348212317315, 'sideways_tsl_mult': 0.31276440374689085, 'sideways_time_stop': 245, 'sideways_use_sma': False, 'sideways_use_ema': True, 'sideways_use_atr': True, 'sideways_use_adx': False, 'sideways_use_spike': False, 'sideways_rsi_required': True}.
[I 2025-09-01 10:38:53,725] Trial 596 finished with values: [-1000000000.0, 1000000000.0] and parameters: {'p_sma': 9, 'p_std': 22, 'p_atr': 13, 'p_adx': 20, 'rsi_period': 36, 'ema1': 8, 'ema2': 12, 'slip_atr_k': 0.018512215118454547, 'slip_spread_k': 0.8714047908470689, 'spread_hl_frac': 0.04474766183728439, 'bb_std_mult': 0.7639047814329898, 'rsi_os': 53, 'rsi_ob': 62, 'vol_spike': 0.04379731411614849, 'adx_thresh': 22.98286088835039, 'atr_min_pct': 0.018686574796576066, 'atr_max_pct': 0.05442249556471719, 'tp_mult': 1.5641133593806937, 'tsl_mult': 0.09621553863722143, 'strategy': 'breakout', 'time_stop': 21, 'use_sma': True, 'use_atr': False, 'use_adx': False, 'use_ema': False, 'use_spike': False, 'rsi_required': True, 'edge_k': 0.5139889642493547, 'edge_cap': 0.1950329737075671, 'bull_strategy': 'breakout', 'bull_bb_std_mult': 0.5028665258094942, 'bull_rsi_os': 19, 'bull_rsi_ob': 73, 'bull_adx_thresh': 34.065845400632504, 'bull_atr_min_pct': 0.002463466060017455, 'bull_atr_max_pct': 0.04395980964476026, 'bull_tp_mult': 2.0946432339017718, 'bull_tsl_mult': 0.6823658724432834, 'bull_time_stop': 279, 'bull_use_sma': True, 'bull_use_ema': False, 'bull_use_atr': False, 'bull_use_adx': True, 'bull_use_spike': True, 'bull_rsi_required': True, 'bear_strategy': 'breakout', 'bear_bb_std_mult': 2.075129241627767, 'bear_rsi_os': 19, 'bear_rsi_ob': 83, 'bear_adx_thresh': 27.35702932378858, 'bear_atr_min_pct': 0.002654471709089854, 'bear_atr_max_pct': 0.09497976497231236, 'bear_tp_mult': 2.8605745754045735, 'bear_tsl_mult': 0.9293853074235521, 'bear_time_stop': 248, 'bear_use_sma': True, 'bear_use_ema': False, 'bear_use_atr': False, 'bear_use_adx': True, 'bear_use_spike': True, 'bear_rsi_required': False, 'sideways_strategy': 'breakout', 'sideways_bb_std_mult': 2.3411318087998865, 'sideways_rsi_os': 17, 'sideways_rsi_ob': 72, 'sideways_adx_thresh': 31.144530189242335, 'sideways_atr_min_pct': 0.02035172946328561, 'sideways_atr_max_pct': 0.032561739281450015, 'sideways_tp_mult': 2.1935720596819412, 'sideways_tsl_mult': 0.9638019422538574, 'sideways_time_stop': 245, 'sideways_use_sma': False, 'sideways_use_ema': True, 'sideways_use_atr': True, 'sideways_use_adx': False, 'sideways_use_spike': False, 'sideways_rsi_required': True}.
[I 2025-09-01 10:38:58,244] Trial 598 finished with values: [-0.04453797002544213, 0.04449807053645195] and parameters: {'p_sma': 10, 'p_std': 22, 'p_atr': 25, 'p_adx': 11, 'rsi_period': 55, 'ema1': 24, 'ema2': 24, 'slip_atr_k': 0.24139454438569996, 'slip_spread_k': 0.8746637836922213, 'spread_hl_frac': 0.013179137045212763, 'bb_std_mult': 0.9706391431203817, 'rsi_os': 12, 'rsi_ob': 55, 'vol_spike': 0.045752302934316855, 'adx_thresh': 9.598281493786548, 'atr_min_pct': 0.015422945722010613, 'atr_max_pct': 0.05367475525544355, 'tp_mult': 1.3230661401683257, 'tsl_mult': 0.8322921333499171, 'strategy': 'breakout', 'time_stop': 88, 'use_sma': True, 'use_atr': False, 'use_adx': False, 'use_ema': False, 'use_spike': False, 'rsi_required': True, 'edge_k': 1.7833787904476672, 'edge_cap': 0.7888815081127426, 'bull_strategy': 'mean_reversion', 'bull_bb_std_mult': 0.5545057055342233, 'bull_rsi_os': 18, 'bull_rsi_ob': 76, 'bull_adx_thresh': 16.06458451824919, 'bull_atr_min_pct': 0.023015847864392775, 'bull_atr_max_pct': 0.05367409804783675, 'bull_tp_mult': 1.2203432615183705, 'bull_tsl_mult': 0.6787042003057377, 'bull_time_stop': 255, 'bull_use_sma': True, 'bull_use_ema': False, 'bull_use_atr': False, 'bull_use_adx': True, 'bull_use_spike': True, 'bull_rsi_required': True, 'bear_strategy': 'breakout', 'bear_bb_std_mult': 2.1509276422178143, 'bear_rsi_os': 19, 'bear_rsi_ob': 51, 'bear_adx_thresh': 27.268191043471752, 'bear_atr_min_pct': 0.001177679169704464, 'bear_atr_max_pct': 0.09788724434979285, 'bear_tp_mult': 1.7709956732805616, 'bear_tsl_mult': 0.30599799980457437, 'bear_time_stop': 79, 'bear_use_sma': True, 'bear_use_ema': False, 'bear_use_atr': False, 'bear_use_adx': True, 'bear_use_spike': True, 'bear_rsi_required': False, 'sideways_strategy': 'breakout', 'sideways_bb_std_mult': 1.8139621626602933, 'sideways_rsi_os': 54, 'sideways_rsi_ob': 87, 'sideways_adx_thresh': 14.316915129011623, 'sideways_atr_min_pct': 0.002371364155302723, 'sideways_atr_max_pct': 0.05362439783997592, 'sideways_tp_mult': 1.3176648040748393, 'sideways_tsl_mult': 0.09603805030380891, 'sideways_time_stop': 177, 'sideways_use_sma': False, 'sideways_use_ema': True, 'sideways_use_atr': True, 'sideways_use_adx': False, 'sideways_use_spike': False, 'sideways_rsi_required': True}.
[I 2025-09-01 10:38:58,712] Trial 599 finished with values: [-1000000000.0, 1000000000.0] and parameters: {'p_sma': 30, 'p_std': 45, 'p_atr': 24, 'p_adx': 20, 'rsi_period': 50, 'ema1': 6, 'ema2': 10, 'slip_atr_k': 0.21573096202100278, 'slip_spread_k': 0.8729132156784503, 'spread_hl_frac': 0.0014131929736464002, 'bb_std_mult': 3.281069849530795, 'rsi_os': 17, 'rsi_ob': 59, 'vol_spike': 0.0754135936028709, 'adx_thresh': 23.080765517014918, 'atr_min_pct': 0.015552794369546014, 'atr_max_pct': 0.05483330866773006, 'tp_mult': 1.4959266912305458, 'tsl_mult': 0.10618380323422662, 'strategy': 'breakout', 'time_stop': 143, 'use_sma': True, 'use_atr': False, 'use_adx': False, 'use_ema': False, 'use_spike': False, 'rsi_required': True, 'edge_k': 1.7805704655578878, 'edge_cap': 0.19497920759098963, 'bull_strategy': 'mean_reversion', 'bull_bb_std_mult': 0.5007631528776351, 'bull_rsi_os': 25, 'bull_rsi_ob': 76, 'bull_adx_thresh': 15.83582823174681, 'bull_atr_min_pct': 0.022973296274907924, 'bull_atr_max_pct': 0.1250703558809228, 'bull_tp_mult': 1.0120380146789971, 'bull_tsl_mult': 0.7557436917947693, 'bull_time_stop': 265, 'bull_use_sma': True, 'bull_use_ema': False, 'bull_use_atr': False, 'bull_use_adx': True, 'bull_use_spike': True, 'bull_rsi_required': True, 'bear_strategy': 'breakout', 'bear_bb_std_mult': 2.1527374585649968, 'bear_rsi_os': 19, 'bear_rsi_ob': 54, 'bear_adx_thresh': 6.717632770580771, 'bear_atr_min_pct': 0.019200942205777748, 'bear_atr_max_pct': 0.12261259728723327, 'bear_tp_mult': 1.9764004219807947, 'bear_tsl_mult': 0.04904629694891288, 'bear_time_stop': 69, 'bear_use_sma': True, 'bear_use_ema': False, 'bear_use_atr': False, 'bear_use_adx': True, 'bear_use_spike': True, 'bear_rsi_required': False, 'sideways_strategy': 'breakout', 'sideways_bb_std_mult': 2.708372456185437, 'sideways_rsi_os': 37, 'sideways_rsi_ob': 69, 'sideways_adx_thresh': 14.503941421718926, 'sideways_atr_min_pct': 0.006605118451490711, 'sideways_atr_max_pct': 0.11984615853706915, 'sideways_tp_mult': 2.0093607180987205, 'sideways_tsl_mult': 0.3196339800199537, 'sideways_time_stop': 76, 'sideways_use_sma': False, 'sideways_use_ema': True, 'sideways_use_atr': True, 'sideways_use_adx': False, 'sideways_use_spike': False, 'sideways_rsi_required': True}.
Starting optimization (600 trials, n_jobs=4) | multi-objective=True
Saved trials CSV -> runs/REAL_FUT_SHORT_US_EU_ret/h0-1-2-3_r0.04_s912/trials_metrics.csv
Saved Pareto plot -> runs/REAL_FUT_SHORT_US_EU_ret/h0-1-2-3_r0.04_s912/pareto_return_vs_drawdown.png
Top-K under DD cap: [510] (agg='median')
=== Selected trial(s) ===
top_k=1 selected_trial_numbers=[510] primary=510
ret%_train=0.00% dd%_train=0.00% trades=0
ret%_test=0.00% dd%_test=0.00% pnl_test=0.00 trades_test=0
WFO fold 1: OOS PnL=0.00 trades=0 win_rate=0.00% avg=0.000000 ret%=0.00% maxDD=0.000000 maxDD%=0.00%
WFO fold 2: OOS PnL=0.00 trades=0 win_rate=0.00% avg=0.000000 ret%=0.00% maxDD=0.000000 maxDD%=0.00%
WFO fold 3: OOS PnL=0.00 trades=0 win_rate=0.00% avg=0.000000 ret%=0.00% maxDD=0.000000 maxDD%=0.00%
WFO fold 4: OOS PnL=0.00 trades=0 win_rate=0.00% avg=0.000000 ret%=0.00% maxDD=0.000000 maxDD%=0.00%
WFO fold 5: OOS PnL=0.00 trades=0 win_rate=0.00% avg=0.000000 ret%=0.00% maxDD=0.000000 maxDD%=0.00%
WFO fold 6: OOS PnL=0.00 trades=0 win_rate=0.00% avg=0.000000 ret%=0.00% maxDD=0.000000 maxDD%=0.00%
WFO summary: meanPnL=0.00 stdPnL=0.00 meanWR=0.00% meanAvg=0.000000 meanRet%=0.00% worstDD=0.000000 worstDD%=0.00% folds=6 trades=0
Wrote runs/REAL_FUT_SHORT_US_EU_ret/h0-1-2-3_r0.04_s912/strategy_profile.json
=== ECHO SELECTED PARAMS (JSON) ===
{
  "adx_thresh": 22.715440951969153,
  "aggregate_params": "median",
  "atr_max_pct": 0.01962815277673575,
  "atr_min_pct": 0.016345590037450133,
  "bar_priority": "stop_first",
  "bb_std_mult": 0.9062913095116694,
  "bear_adx_thresh": 27.368197338520815,
  "bear_atr_max_pct": 0.13160716862214625,
  "bear_atr_min_pct": 0.002422343547899992,
  "bear_bb_std_mult": 1.7510555900603206,
  "bear_rsi_ob": 84,
  "bear_rsi_os": 20,
  "bear_rsi_required": false,
  "bear_strategy": "breakout",
  "bear_time_stop": 258,
  "bear_tp_mult": 1.8735319757397209,
  "bear_tsl_mult": 0.3464322129057292,
  "bear_use_adx": true,
  "bear_use_atr": false,
  "bear_use_ema": false,
  "bear_use_sma": true,
  "bear_use_spike": true,
  "bull_adx_thresh": 15.67539276936481,
  "bull_atr_max_pct": 0.017405494684085934,
  "bull_atr_min_pct": 0.021013027405609112,
  "bull_bb_std_mult": 0.5778832848498,
  "bull_rsi_ob": 78,
  "bull_rsi_os": 20,
  "bull_rsi_required": true,
  "bull_strategy": "mean_reversion",
  "bull_time_stop": 269,
  "bull_tp_mult": 1.1112784342788995,
  "bull_tsl_mult": 0.6252335076248979,
  "bull_use_adx": true,
  "bull_use_atr": false,
  "bull_use_ema": true,
  "bull_use_sma": true,
  "bull_use_spike": true,
  "cooldown_bars": 30,
  "daily_loss_limit_pct": 0.12,
  "edge_cap": 0.405446674278571,
  "edge_k": 1.6585000014092668,
  "ema1": 6,
  "ema2": 11,
  "embargo_bars": 150,
  "fee": 0.001,
  "fill_timing": "next_open",
  "include_hours_set": "{0, 1, 2, 3}",
  "lockout_bars": 100,
  "max_consec_losses": 7,
  "max_notional_pct_equity": 1.0,
  "min_notional": 5.0,
  "ml_thresh": 0.0,
  "objective": "multi",
  "p_adx": 21,
  "p_atr": 13,
  "p_sma": 13,
  "p_std": 21,
  "participation_cap": 1.0,
  "price_step": 0.0001,
  "proba_temp": 1.0,
  "qty_step": 0.0001,
  "regime_adapt": true,
  "regime_band": 0.006,
  "regime_fast": 50,
  "regime_overrides": {
    "bear": {
      "adx": 20.0,
      "allowed_sides": [
        "long",
        "short"
      ],
      "atr_range": [
        0.0015,
        0.06
      ],
      "bb_std_mult": 1.2571599337995167,
      "mode": "breakout",
      "rsi_required": true,
      "time_stop_bars": 122,
      "tp_mult": 1.7149673432024581,
      "tsl_mult": 0.25,
      "use_adx": true,
      "use_atr": true
    },
    "bull": {
      "adx": 18.0,
      "allowed_sides": [
        "long",
        "short"
      ],
      "atr_range": [
        0.0008,
        0.06
      ],
      "bb_std_mult": 2.0169431746748376,
      "mode": "mean_reversion",
      "rsi_required": false,
      "time_stop_bars": 214,
      "tp_mult": 1.9194251920826044,
      "tsl_mult": 0.6891458682949287,
      "use_adx": true,
      "use_atr": true
    },
    "sideways": {
      "adx": 15.0,
      "allowed_sides": [
        "long",
        "short"
      ],
      "atr_range": [
        0.001,
        0.14
      ],
      "bb_std_mult": 1.5828092896467827,
      "mode": "breakout",
      "rsi_required": true,
      "time_stop_bars": 235,
      "tp_mult": 2.341879695778944,
      "tsl_mult": 0.651967765830165,
      "use_adx": true,
      "use_atr": true
    }
  },
  "regime_slow": 200,
  "risk_min_stop_frac": 0.001,
  "risk_per_trade": 0.04,
  "risk_stop_atr_mult": 1.0,
  "round_exits": true,
  "rsi_key": "rsi42",
  "rsi_ob": 61,
  "rsi_os": 17,
  "rsi_period": 42,
  "rsi_required": true,
  "select_top_k": 1,
  "session_end": 24,
  "session_start": 0,
  "sides": "short",
  "sideways_adx_thresh": 29.84148420802787,
  "sideways_atr_max_pct": 0.05735479648699441,
  "sideways_atr_min_pct": 0.006504942796386094,
  "sideways_bb_std_mult": 0.5167049422939587,
  "sideways_rsi_ob": 75,
  "sideways_rsi_os": 54,
  "sideways_rsi_required": true,
  "sideways_strategy": "breakout",
  "sideways_time_stop": 243,
  "sideways_tp_mult": 2.0380219510880364,
  "sideways_tsl_mult": 0.29254868504148285,
  "sideways_use_adx": false,
  "sideways_use_atr": true,
  "sideways_use_ema": true,
  "sideways_use_sma": false,
  "sideways_use_spike": false,
  "slip_atr_k": 0.014473421170928164,
  "slip_spread_k": 0.866976254879516,
  "slippage": 0.0006,
  "spread_hl_frac": 0.014881479988700175,
  "start_equity": 20000.0,
  "stop_extra_slip": 0.0,
  "strategy": "mean_reversion",
  "time_stop": 130,
  "tp_mult": 1.5599921653553268,
  "tsl_mult": 0.1616013541915531,
  "use_adx": false,
  "use_atr": true,
  "use_ema": false,
  "use_ml": false,
  "use_sma": false,
  "use_spike": false,
  "vol_spike": 0.061506020851840516,
  "wfo_folds": 6
}
Wrote runs/REAL_FUT_SHORT_US_EU_ret/h0-1-2-3_r0.04_s912/best_params.pkl
