[I 2025-09-01 09:45:53,069] Trial 244 finished with values: [-1000000000.0, 1000000000.0] and parameters: {'p_sma': 16, 'p_std': 35, 'p_atr': 19, 'p_adx': 24, 'rsi_period': 65, 'ema1': 27, 'ema2': 16, 'slip_atr_k': 0.08625018473707402, 'slip_spread_k': 0.7070698672161306, 'spread_hl_frac': 0.0070504584038463165, 'bb_std_mult': 3.0741705588444526, 'rsi_os': 10, 'rsi_ob': 66, 'vol_spike': 0.19062158192320136, 'adx_thresh': 34.70497173873953, 'atr_min_pct': 0.016016392482631713, 'atr_max_pct': 0.1376870813857409, 'tp_mult': 1.1674559393616846, 'tsl_mult': 0.6988399631565763, 'strategy': 'breakout', 'time_stop': 248, 'use_sma': True, 'use_atr': False, 'use_adx': False, 'use_ema': True, 'use_spike': True, 'rsi_required': True, 'edge_k': 1.8622900848128958, 'edge_cap': 0.4774701050065742, 'bull_strategy': 'mean_reversion', 'bull_bb_std_mult': 3.5450955034500553, 'bull_rsi_os': 54, 'bull_rsi_ob': 80, 'bull_adx_thresh': 24.993973034710347, 'bull_atr_min_pct': 0.0011519873283965367, 'bull_atr_max_pct': 0.06399811447422755, 'bull_tp_mult': 2.8494426170536498, 'bull_tsl_mult': 0.41525332356077715, 'bull_time_stop': 206, 'bull_use_sma': True, 'bull_use_ema': False, 'bull_use_atr': True, 'bull_use_adx': True, 'bull_use_spike': False, 'bull_rsi_required': True, 'bear_strategy': 'mean_reversion', 'bear_bb_std_mult': 1.0851699368702716, 'bear_rsi_os': 37, 'bear_rsi_ob': 75, 'bear_adx_thresh': 20.426202692224305, 'bear_atr_min_pct': 0.008027391605093671, 'bear_atr_max_pct': 0.06353114953851664, 'bear_tp_mult': 1.223759971055436, 'bear_tsl_mult': 0.4428965190766181, 'bear_time_stop': 18, 'bear_use_sma': True, 'bear_use_ema': False, 'bear_use_atr': True, 'bear_use_adx': False, 'bear_use_spike': False, 'bear_rsi_required': False, 'sideways_strategy': 'mean_reversion', 'sideways_bb_std_mult': 0.6121178058067265, 'sideways_rsi_os': 51, 'sideways_rsi_ob': 90, 'sideways_adx_thresh': 22.717833383496302, 'sideways_atr_min_pct': 0.009934530549258814, 'sideways_atr_max_pct': 0.13325873443889913, 'sideways_tp_mult': 2.617824248851132, 'sideways_tsl_mult': 0.5170624756619663, 'sideways_time_stop': 32, 'sideways_use_sma': True, 'sideways_use_ema': False, 'sideways_use_atr': False, 'sideways_use_adx': True, 'sideways_use_spike': False, 'sideways_rsi_required': False}.
[I 2025-09-01 09:45:54,012] Trial 245 finished with values: [-1000000000.0, 1000000000.0] and parameters: {'p_sma': 16, 'p_std': 45, 'p_atr': 19, 'p_adx': 21, 'rsi_period': 42, 'ema1': 14, 'ema2': 16, 'slip_atr_k': 0.04733871592039987, 'slip_spread_k': 0.7133920603778233, 'spread_hl_frac': 0.01662457184822117, 'bb_std_mult': 1.965757515336361, 'rsi_os': 49, 'rsi_ob': 76, 'vol_spike': 0.1491702962157637, 'adx_thresh': 19.84839783630915, 'atr_min_pct': 0.006335296617795902, 'atr_max_pct': 0.1381600477275622, 'tp_mult': 1.1636671246085077, 'tsl_mult': 0.7002101344693117, 'strategy': 'breakout', 'time_stop': 254, 'use_sma': True, 'use_atr': True, 'use_adx': False, 'use_ema': True, 'use_spike': True, 'rsi_required': True, 'edge_k': 0.05638885264245186, 'edge_cap': 0.6523126328092843, 'bull_strategy': 'mean_reversion', 'bull_bb_std_mult': 1.0184071317695944, 'bull_rsi_os': 43, 'bull_rsi_ob': 81, 'bull_adx_thresh': 6.368751408201726, 'bull_atr_min_pct': 0.001977103686008602, 'bull_atr_max_pct': 0.08599848468108645, 'bull_tp_mult': 2.855096741568159, 'bull_tsl_mult': 0.40500655909723327, 'bull_time_stop': 205, 'bull_use_sma': True, 'bull_use_ema': False, 'bull_use_atr': True, 'bull_use_adx': True, 'bull_use_spike': True, 'bull_rsi_required': True, 'bear_strategy': 'mean_reversion', 'bear_bb_std_mult': 1.0832139500515274, 'bear_rsi_os': 36, 'bear_rsi_ob': 75, 'bear_adx_thresh': 31.829693081156407, 'bear_atr_min_pct': 0.008761336240481234, 'bear_atr_max_pct': 0.06294334789102182, 'bear_tp_mult': 1.0899226062111325, 'bear_tsl_mult': 0.44412105008614683, 'bear_time_stop': 294, 'bear_use_sma': False, 'bear_use_ema': False, 'bear_use_atr': True, 'bear_use_adx': True, 'bear_use_spike': False, 'bear_rsi_required': False, 'sideways_strategy': 'breakout', 'sideways_bb_std_mult': 0.7785366512151293, 'sideways_rsi_os': 53, 'sideways_rsi_ob': 90, 'sideways_adx_thresh': 21.689550991418038, 'sideways_atr_min_pct': 0.009589198331848077, 'sideways_atr_max_pct': 0.07004993832696829, 'sideways_tp_mult': 2.646816357594971, 'sideways_tsl_mult': 0.526938685709802, 'sideways_time_stop': 103, 'sideways_use_sma': True, 'sideways_use_ema': False, 'sideways_use_atr': False, 'sideways_use_adx': True, 'sideways_use_spike': False, 'sideways_rsi_required': False}.
[I 2025-09-01 09:45:54,534] Trial 246 finished with values: [-1000000000.0, 1000000000.0] and parameters: {'p_sma': 16, 'p_std': 36, 'p_atr': 21, 'p_adx': 24, 'rsi_period': 28, 'ema1': 24, 'ema2': 24, 'slip_atr_k': 0.04609894914748401, 'slip_spread_k': 0.8709008172579744, 'spread_hl_frac': 0.016175366606518204, 'bb_std_mult': 1.5060293350617378, 'rsi_os': 47, 'rsi_ob': 75, 'vol_spike': 0.1348530314637634, 'adx_thresh': 34.856221675621754, 'atr_min_pct': 0.015690352621045414, 'atr_max_pct': 0.13089286997623048, 'tp_mult': 1.1667687268564686, 'tsl_mult': 0.6978487296840717, 'strategy': 'mean_reversion', 'time_stop': 257, 'use_sma': False, 'use_atr': True, 'use_adx': False, 'use_ema': True, 'use_spike': False, 'rsi_required': True, 'edge_k': 1.2136165874535565, 'edge_cap': 0.4620367715699872, 'bull_strategy': 'mean_reversion', 'bull_bb_std_mult': 0.7060368596598445, 'bull_rsi_os': 43, 'bull_rsi_ob': 46, 'bull_adx_thresh': 6.361594713570572, 'bull_atr_min_pct': 0.0010887398914318075, 'bull_atr_max_pct': 0.08574571220414694, 'bull_tp_mult': 2.856230905056785, 'bull_tsl_mult': 0.4163158233337746, 'bull_time_stop': 205, 'bull_use_sma': True, 'bull_use_ema': True, 'bull_use_atr': True, 'bull_use_adx': True, 'bull_use_spike': True, 'bull_rsi_required': True, 'bear_strategy': 'mean_reversion', 'bear_bb_std_mult': 1.0827584149188358, 'bear_rsi_os': 54, 'bear_rsi_ob': 75, 'bear_adx_thresh': 22.425129744655827, 'bear_atr_min_pct': 0.008876660027309935, 'bear_atr_max_pct': 0.06413638558720638, 'bear_tp_mult': 1.121167618068588, 'bear_tsl_mult': 0.8904956365247614, 'bear_time_stop': 187, 'bear_use_sma': False, 'bear_use_ema': False, 'bear_use_atr': False, 'bear_use_adx': True, 'bear_use_spike': False, 'bear_rsi_required': False, 'sideways_strategy': 'breakout', 'sideways_bb_std_mult': 0.7558274266255948, 'sideways_rsi_os': 51, 'sideways_rsi_ob': 77, 'sideways_adx_thresh': 24.589998399607623, 'sideways_atr_min_pct': 0.010023059953582497, 'sideways_atr_max_pct': 0.14977141788850318, 'sideways_tp_mult': 2.8477395570228605, 'sideways_tsl_mult': 0.5318428620858617, 'sideways_time_stop': 102, 'sideways_use_sma': True, 'sideways_use_ema': False, 'sideways_use_atr': False, 'sideways_use_adx': True, 'sideways_use_spike': False, 'sideways_rsi_required': True}.
[I 2025-09-01 09:45:54,780] Trial 243 finished with values: [-0.03560913942680277, 0.03548191010880761] and parameters: {'p_sma': 25, 'p_std': 33, 'p_atr': 19, 'p_adx': 24, 'rsi_period': 41, 'ema1': 14, 'ema2': 15, 'slip_atr_k': 0.05600138660922541, 'slip_spread_k': 0.4150372917887173, 'spread_hl_frac': 0.045126450094825986, 'bb_std_mult': 3.411832012211116, 'rsi_os': 41, 'rsi_ob': 75, 'vol_spike': 0.19384360625014543, 'adx_thresh': 29.094609507351688, 'atr_min_pct': 0.008778488851337985, 'atr_max_pct': 0.10705097578012318, 'tp_mult': 2.286987619164222, 'tsl_mult': 0.8393640482094313, 'strategy': 'breakout', 'time_stop': 258, 'use_sma': True, 'use_atr': False, 'use_adx': False, 'use_ema': True, 'use_spike': True, 'rsi_required': True, 'edge_k': 1.267606074273608, 'edge_cap': 0.6475328734354275, 'bull_strategy': 'mean_reversion', 'bull_bb_std_mult': 1.6493905636715729, 'bull_rsi_os': 7, 'bull_rsi_ob': 81, 'bull_adx_thresh': 18.069172685097996, 'bull_atr_min_pct': 0.0012465205766094593, 'bull_atr_max_pct': 0.09859852846737488, 'bull_tp_mult': 2.5569748631192772, 'bull_tsl_mult': 0.48676757323789716, 'bull_time_stop': 211, 'bull_use_sma': True, 'bull_use_ema': False, 'bull_use_atr': True, 'bull_use_adx': False, 'bull_use_spike': False, 'bull_rsi_required': True, 'bear_strategy': 'mean_reversion', 'bear_bb_std_mult': 0.5072704971999291, 'bear_rsi_os': 54, 'bear_rsi_ob': 72, 'bear_adx_thresh': 20.532027789329856, 'bear_atr_min_pct': 0.0008221401483122937, 'bear_atr_max_pct': 0.06259369324279432, 'bear_tp_mult': 1.0105740812857023, 'bear_tsl_mult': 0.8864804272370267, 'bear_time_stop': 50, 'bear_use_sma': True, 'bear_use_ema': False, 'bear_use_atr': True, 'bear_use_adx': False, 'bear_use_spike': False, 'bear_rsi_required': False, 'sideways_strategy': 'mean_reversion', 'sideways_bb_std_mult': 0.7455294302798277, 'sideways_rsi_os': 51, 'sideways_rsi_ob': 61, 'sideways_adx_thresh': 21.626310558614268, 'sideways_atr_min_pct': 0.004372694823666128, 'sideways_atr_max_pct': 0.1152715382028201, 'sideways_tp_mult': 2.629624179338834, 'sideways_tsl_mult': 0.6397150377503417, 'sideways_time_stop': 51, 'sideways_use_sma': True, 'sideways_use_ema': False, 'sideways_use_atr': False, 'sideways_use_adx': False, 'sideways_use_spike': False, 'sideways_rsi_required': False}.
[I 2025-09-01 09:46:35,876] Trial 247 finished with values: [-1000000000.0, 1000000000.0] and parameters: {'p_sma': 15, 'p_std': 47, 'p_atr': 19, 'p_adx': 21, 'rsi_period': 25, 'ema1': 18, 'ema2': 16, 'slip_atr_k': 0.001235820903322471, 'slip_spread_k': 0.7323655416345649, 'spread_hl_frac': 0.03162354817339942, 'bb_std_mult': 1.5180674669952512, 'rsi_os': 31, 'rsi_ob': 87, 'vol_spike': 0.1489764832309437, 'adx_thresh': 19.71234567459727, 'atr_min_pct': 0.006394192278245775, 'atr_max_pct': 0.13209418974735526, 'tp_mult': 1.1799448593762751, 'tsl_mult': 0.6588972100135277, 'strategy': 'mean_reversion', 'time_stop': 255, 'use_sma': False, 'use_atr': True, 'use_adx': False, 'use_ema': True, 'use_spike': False, 'rsi_required': True, 'edge_k': 0.4141018838243593, 'edge_cap': 0.5811401418221519, 'bull_strategy': 'mean_reversion', 'bull_bb_std_mult': 3.597050685241552, 'bull_rsi_os': 47, 'bull_rsi_ob': 46, 'bull_adx_thresh': 6.465840557579145, 'bull_atr_min_pct': 0.0016719976432588957, 'bull_atr_max_pct': 0.08668693574266359, 'bull_tp_mult': 2.8810596228049734, 'bull_tsl_mult': 0.3973109976539137, 'bull_time_stop': 204, 'bull_use_sma': True, 'bull_use_ema': True, 'bull_use_atr': True, 'bull_use_adx': False, 'bull_use_spike': True, 'bull_rsi_required': True, 'bear_strategy': 'mean_reversion', 'bear_bb_std_mult': 0.8195612677380424, 'bear_rsi_os': 54, 'bear_rsi_ob': 73, 'bear_adx_thresh': 23.774866650832426, 'bear_atr_min_pct': 0.00458814121538305, 'bear_atr_max_pct': 0.046029998120440015, 'bear_tp_mult': 1.1256254225580122, 'bear_tsl_mult': 0.6513316920056116, 'bear_time_stop': 294, 'bear_use_sma': False, 'bear_use_ema': False, 'bear_use_atr': False, 'bear_use_adx': True, 'bear_use_spike': False, 'bear_rsi_required': False, 'sideways_strategy': 'breakout', 'sideways_bb_std_mult': 0.7398174664726942, 'sideways_rsi_os': 51, 'sideways_rsi_ob': 77, 'sideways_adx_thresh': 20.76327559674521, 'sideways_atr_min_pct': 0.011428607385953634, 'sideways_atr_max_pct': 0.1258213607405251, 'sideways_tp_mult': 2.8327656911037566, 'sideways_tsl_mult': 0.241325378213104, 'sideways_time_stop': 26, 'sideways_use_sma': True, 'sideways_use_ema': False, 'sideways_use_atr': False, 'sideways_use_adx': True, 'sideways_use_spike': False, 'sideways_rsi_required': True}.
[I 2025-09-01 09:46:36,294] Trial 249 finished with values: [-1000000000.0, 1000000000.0] and parameters: {'p_sma': 14, 'p_std': 11, 'p_atr': 8, 'p_adx': 23, 'rsi_period': 54, 'ema1': 16, 'ema2': 14, 'slip_atr_k': 0.053411093604324104, 'slip_spread_k': 0.4136704154371429, 'spread_hl_frac': 0.03470856204058565, 'bb_std_mult': 2.9348653084558656, 'rsi_os': 41, 'rsi_ob': 71, 'vol_spike': 0.18307920337661376, 'adx_thresh': 31.851094249603793, 'atr_min_pct': 0.010104280973427629, 'atr_max_pct': 0.12254413657668121, 'tp_mult': 2.437127829651349, 'tsl_mult': 0.6655736118394011, 'strategy': 'mean_reversion', 'time_stop': 182, 'use_sma': False, 'use_atr': False, 'use_adx': True, 'use_ema': True, 'use_spike': False, 'rsi_required': True, 'edge_k': 1.1849651456233197, 'edge_cap': 0.6372167956048308, 'bull_strategy': 'mean_reversion', 'bull_bb_std_mult': 3.5467500813145065, 'bull_rsi_os': 47, 'bull_rsi_ob': 90, 'bull_adx_thresh': 32.79410712833236, 'bull_atr_min_pct': 0.0015911008715847235, 'bull_atr_max_pct': 0.07976679148266935, 'bull_tp_mult': 2.9163336849801818, 'bull_tsl_mult': 0.3896377262833982, 'bull_time_stop': 218, 'bull_use_sma': True, 'bull_use_ema': True, 'bull_use_atr': True, 'bull_use_adx': False, 'bull_use_spike': False, 'bull_rsi_required': True, 'bear_strategy': 'mean_reversion', 'bear_bb_std_mult': 0.8329521555237904, 'bear_rsi_os': 23, 'bear_rsi_ob': 73, 'bear_adx_thresh': 23.7964814615298, 'bear_atr_min_pct': 0.0008256941292284449, 'bear_atr_max_pct': 0.045335399487436014, 'bear_tp_mult': 1.214653552381611, 'bear_tsl_mult': 0.5529759618337724, 'bear_time_stop': 52, 'bear_use_sma': True, 'bear_use_ema': False, 'bear_use_atr': True, 'bear_use_adx': False, 'bear_use_spike': False, 'bear_rsi_required': True, 'sideways_strategy': 'mean_reversion', 'sideways_bb_std_mult': 0.5459010515105229, 'sideways_rsi_os': 51, 'sideways_rsi_ob': 51, 'sideways_adx_thresh': 20.88598630576099, 'sideways_atr_min_pct': 0.008353783137433336, 'sideways_atr_max_pct': 0.11402148146708586, 'sideways_tp_mult': 2.4128961412098535, 'sideways_tsl_mult': 0.5708064118080995, 'sideways_time_stop': 27, 'sideways_use_sma': True, 'sideways_use_ema': False, 'sideways_use_atr': False, 'sideways_use_adx': True, 'sideways_use_spike': False, 'sideways_rsi_required': False}.
[I 2025-09-01 09:46:36,651] Trial 248 finished with values: [-1000000000.0, 1000000000.0] and parameters: {'p_sma': 14, 'p_std': 36, 'p_atr': 21, 'p_adx': 24, 'rsi_period': 54, 'ema1': 28, 'ema2': 46, 'slip_atr_k': 0.06510800387085719, 'slip_spread_k': 0.6365334064277026, 'spread_hl_frac': 0.03161162713005861, 'bb_std_mult': 1.5045591754430534, 'rsi_os': 19, 'rsi_ob': 71, 'vol_spike': 0.19957219731430015, 'adx_thresh': 9.92609261994005, 'atr_min_pct': 0.016528254629303435, 'atr_max_pct': 0.1210609510406811, 'tp_mult': 1.538951840256954, 'tsl_mult': 0.6636261881221877, 'strategy': 'mean_reversion', 'time_stop': 188, 'use_sma': False, 'use_atr': False, 'use_adx': True, 'use_ema': True, 'use_spike': False, 'rsi_required': True, 'edge_k': 0.3797250181365105, 'edge_cap': 0.6404838293476343, 'bull_strategy': 'mean_reversion', 'bull_bb_std_mult': 3.493029807875653, 'bull_rsi_os': 47, 'bull_rsi_ob': 46, 'bull_adx_thresh': 6.773147311365943, 'bull_atr_min_pct': 0.0014384365469538342, 'bull_atr_max_pct': 0.11661026586486012, 'bull_tp_mult': 2.908464054312659, 'bull_tsl_mult': 0.3781962568612578, 'bull_time_stop': 202, 'bull_use_sma': True, 'bull_use_ema': True, 'bull_use_atr': True, 'bull_use_adx': False, 'bull_use_spike': False, 'bull_rsi_required': True, 'bear_strategy': 'mean_reversion', 'bear_bb_std_mult': 0.8731802080388306, 'bear_rsi_os': 54, 'bear_rsi_ob': 73, 'bear_adx_thresh': 23.802385337376688, 'bear_atr_min_pct': 0.0007499691333884223, 'bear_atr_max_pct': 0.051331256680225985, 'bear_tp_mult': 1.12704451114889, 'bear_tsl_mult': 0.5395148502630783, 'bear_time_stop': 292, 'bear_use_sma': True, 'bear_use_ema': False, 'bear_use_atr': False, 'bear_use_adx': False, 'bear_use_spike': False, 'bear_rsi_required': True, 'sideways_strategy': 'mean_reversion', 'sideways_bb_std_mult': 0.870679858457429, 'sideways_rsi_os': 51, 'sideways_rsi_ob': 77, 'sideways_adx_thresh': 24.483108069521364, 'sideways_atr_min_pct': 0.01153117155022262, 'sideways_atr_max_pct': 0.04090296122955282, 'sideways_tp_mult': 2.346335248679658, 'sideways_tsl_mult': 0.15392600539255324, 'sideways_time_stop': 24, 'sideways_use_sma': True, 'sideways_use_ema': False, 'sideways_use_atr': False, 'sideways_use_adx': True, 'sideways_use_spike': False, 'sideways_rsi_required': True}.
[I 2025-09-01 09:46:36,903] Trial 250 finished with values: [-1000000000.0, 1000000000.0] and parameters: {'p_sma': 14, 'p_std': 53, 'p_atr': 18, 'p_adx': 28, 'rsi_period': 58, 'ema1': 28, 'ema2': 16, 'slip_atr_k': 0.06284223100984386, 'slip_spread_k': 0.6336741013096279, 'spread_hl_frac': 0.031670020308241946, 'bb_std_mult': 1.531660128761082, 'rsi_os': 42, 'rsi_ob': 71, 'vol_spike': 0.18388580116172526, 'adx_thresh': 25.479082008931538, 'atr_min_pct': 0.010055085390532917, 'atr_max_pct': 0.124711198919939, 'tp_mult': 1.5696551393123523, 'tsl_mult': 0.6664374470350912, 'strategy': 'mean_reversion', 'time_stop': 159, 'use_sma': False, 'use_atr': False, 'use_adx': True, 'use_ema': True, 'use_spike': False, 'rsi_required': True, 'edge_k': 0.6270243866493506, 'edge_cap': 0.5779824999551699, 'bull_strategy': 'mean_reversion', 'bull_bb_std_mult': 3.599223201698042, 'bull_rsi_os': 47, 'bull_rsi_ob': 48, 'bull_adx_thresh': 33.19280352428159, 'bull_atr_min_pct': 0.0018289540335085098, 'bull_atr_max_pct': 0.08034868119268851, 'bull_tp_mult': 2.898413396153168, 'bull_tsl_mult': 0.3881321847646896, 'bull_time_stop': 199, 'bull_use_sma': True, 'bull_use_ema': True, 'bull_use_atr': True, 'bull_use_adx': False, 'bull_use_spike': False, 'bull_rsi_required': True, 'bear_strategy': 'mean_reversion', 'bear_bb_std_mult': 0.8663568864189488, 'bear_rsi_os': 55, 'bear_rsi_ob': 73, 'bear_adx_thresh': 23.702570563017574, 'bear_atr_min_pct': 0.00506604097437143, 'bear_atr_max_pct': 0.05121272261696576, 'bear_tp_mult': 1.2180993895412529, 'bear_tsl_mult': 0.5511390619209651, 'bear_time_stop': 292, 'bear_use_sma': True, 'bear_use_ema': False, 'bear_use_atr': False, 'bear_use_adx': False, 'bear_use_spike': True, 'bear_rsi_required': True, 'sideways_strategy': 'mean_reversion', 'sideways_bb_std_mult': 0.8795043499558652, 'sideways_rsi_os': 24, 'sideways_rsi_ob': 50, 'sideways_adx_thresh': 20.877568256293006, 'sideways_atr_min_pct': 0.010530397595299711, 'sideways_atr_max_pct': 0.05405787376453602, 'sideways_tp_mult': 2.435932995951061, 'sideways_tsl_mult': 0.48188980591859937, 'sideways_time_stop': 26, 'sideways_use_sma': True, 'sideways_use_ema': False, 'sideways_use_atr': False, 'sideways_use_adx': True, 'sideways_use_spike': False, 'sideways_rsi_required': True}.
[I 2025-09-01 09:47:17,490] Trial 253 finished with values: [-0.021509139522207676, 0.021351825462978473] and parameters: {'p_sma': 17, 'p_std': 55, 'p_atr': 25, 'p_adx': 22, 'rsi_period': 10, 'ema1': 18, 'ema2': 22, 'slip_atr_k': 0.10099742196732228, 'slip_spread_k': 0.0293489479864259, 'spread_hl_frac': 0.028526188050425446, 'bb_std_mult': 2.309513510982156, 'rsi_os': 21, 'rsi_ob': 69, 'vol_spike': 0.07200593579390319, 'adx_thresh': 23.734524561176435, 'atr_min_pct': 0.005471310198446889, 'atr_max_pct': 0.09750286897966806, 'tp_mult': 2.751246490759656, 'tsl_mult': 0.6820013682864408, 'strategy': 'breakout', 'time_stop': 159, 'use_sma': True, 'use_atr': False, 'use_adx': False, 'use_ema': True, 'use_spike': True, 'rsi_required': True, 'edge_k': 0.9852287110917274, 'edge_cap': 0.5631847430414, 'bull_strategy': 'mean_reversion', 'bull_bb_std_mult': 2.747105825275682, 'bull_rsi_os': 45, 'bull_rsi_ob': 48, 'bull_adx_thresh': 5.463053014756969, 'bull_atr_min_pct': 0.00037269274132318935, 'bull_atr_max_pct': 0.02704666762021371, 'bull_tp_mult': 2.9977455291301687, 'bull_tsl_mult': 0.437177900878493, 'bull_time_stop': 217, 'bull_use_sma': True, 'bull_use_ema': False, 'bull_use_atr': True, 'bull_use_adx': False, 'bull_use_spike': False, 'bull_rsi_required': True, 'bear_strategy': 'mean_reversion', 'bear_bb_std_mult': 1.0217442719209697, 'bear_rsi_os': 21, 'bear_rsi_ob': 76, 'bear_adx_thresh': 24.89044283251745, 'bear_atr_min_pct': 0.012115126916156224, 'bear_atr_max_pct': 0.035997150263848574, 'bear_tp_mult': 1.1699491683096324, 'bear_tsl_mult': 0.4827080414481695, 'bear_time_stop': 281, 'bear_use_sma': True, 'bear_use_ema': False, 'bear_use_atr': True, 'bear_use_adx': False, 'bear_use_spike': True, 'bear_rsi_required': False, 'sideways_strategy': 'mean_reversion', 'sideways_bb_std_mult': 2.9552319204318165, 'sideways_rsi_os': 53, 'sideways_rsi_ob': 45, 'sideways_adx_thresh': 19.801607464417195, 'sideways_atr_min_pct': 0.010397065312725698, 'sideways_atr_max_pct': 0.06969875275657923, 'sideways_tp_mult': 2.447217314443313, 'sideways_tsl_mult': 0.47975102281856663, 'sideways_time_stop': 20, 'sideways_use_sma': False, 'sideways_use_ema': False, 'sideways_use_atr': False, 'sideways_use_adx': True, 'sideways_use_spike': False, 'sideways_rsi_required': False}.
