[I 2025-09-01 09:34:49,766] Trial 178 finished with values: [-1000000000.0, 1000000000.0] and parameters: {'p_sma': 19, 'p_std': 5, 'p_atr': 18, 'p_adx': 17, 'rsi_period': 20, 'ema1': 21, 'ema2': 17, 'slip_atr_k': 0.06031465410556076, 'slip_spread_k': 0.9521607822412115, 'spread_hl_frac': 0.005401897084932099, 'bb_std_mult': 2.4974380454513057, 'rsi_os': 30, 'rsi_ob': 69, 'vol_spike': 0.0820817613893793, 'adx_thresh': 31.355760640983835, 'atr_min_pct': 0.028512294815632225, 'atr_max_pct': 0.13167014138233415, 'tp_mult': 1.971974680887375, 'tsl_mult': 0.3531202442057042, 'strategy': 'breakout', 'time_stop': 273, 'use_sma': True, 'use_atr': False, 'use_adx': False, 'use_ema': True, 'use_spike': True, 'rsi_required': True, 'edge_k': 1.2727794152804899, 'edge_cap': 0.9065379741514586, 'bull_strategy': 'breakout', 'bull_bb_std_mult': 1.4300925960387798, 'bull_rsi_os': 45, 'bull_rsi_ob': 49, 'bull_adx_thresh': 7.247208676024032, 'bull_atr_min_pct': 0.01809684823666432, 'bull_atr_max_pct': 0.09413839373625768, 'bull_tp_mult': 1.5833124312603764, 'bull_tsl_mult': 0.9013617034679651, 'bull_time_stop': 73, 'bull_use_sma': True, 'bull_use_ema': False, 'bull_use_atr': True, 'bull_use_adx': False, 'bull_use_spike': False, 'bull_rsi_required': True, 'bear_strategy': 'breakout', 'bear_bb_std_mult': 1.9906818456161004, 'bear_rsi_os': 54, 'bear_rsi_ob': 92, 'bear_adx_thresh': 5.499676186631747, 'bear_atr_min_pct': 0.026886857373640605, 'bear_atr_max_pct': 0.06936872387403425, 'bear_tp_mult': 1.9766512712167899, 'bear_tsl_mult': 0.32515562520796376, 'bear_time_stop': 248, 'bear_use_sma': True, 'bear_use_ema': True, 'bear_use_atr': True, 'bear_use_adx': False, 'bear_use_spike': False, 'bear_rsi_required': False, 'sideways_strategy': 'mean_reversion', 'sideways_bb_std_mult': 3.543311362907458, 'sideways_rsi_os': 52, 'sideways_rsi_ob': 85, 'sideways_adx_thresh': 28.08163591612869, 'sideways_atr_min_pct': 0.010933003418860342, 'sideways_atr_max_pct': 0.09836135501928892, 'sideways_tp_mult': 2.6286211507509956, 'sideways_tsl_mult': 0.46463508084880495, 'sideways_time_stop': 31, 'sideways_use_sma': True, 'sideways_use_ema': False, 'sideways_use_atr': False, 'sideways_use_adx': True, 'sideways_use_spike': True, 'sideways_rsi_required': False}.
[I 2025-09-01 09:34:50,167] Trial 179 finished with values: [-1000000000.0, 1000000000.0] and parameters: {'p_sma': 33, 'p_std': 6, 'p_atr': 18, 'p_adx': 17, 'rsi_period': 19, 'ema1': 18, 'ema2': 50, 'slip_atr_k': 0.06050976289130102, 'slip_spread_k': 0.5932128415358766, 'spread_hl_frac': 0.03350613136028627, 'bb_std_mult': 1.1064742692758787, 'rsi_os': 51, 'rsi_ob': 78, 'vol_spike': 0.02304573023845355, 'adx_thresh': 20.775003358194347, 'atr_min_pct': 0.029749731493166, 'atr_max_pct': 0.05383942604069909, 'tp_mult': 1.6056020521184866, 'tsl_mult': 0.5847804832873237, 'strategy': 'breakout', 'time_stop': 272, 'use_sma': True, 'use_atr': False, 'use_adx': False, 'use_ema': True, 'use_spike': True, 'rsi_required': True, 'edge_k': 1.2836878240073935, 'edge_cap': 0.8607968760595223, 'bull_strategy': 'breakout', 'bull_bb_std_mult': 3.4772609829387515, 'bull_rsi_os': 52, 'bull_rsi_ob': 46, 'bull_adx_thresh': 22.794612891169194, 'bull_atr_min_pct': 0.016101195293781477, 'bull_atr_max_pct': 0.07592863301608357, 'bull_tp_mult': 1.5953358897461942, 'bull_tsl_mult': 0.04381358067422486, 'bull_time_stop': 249, 'bull_use_sma': True, 'bull_use_ema': False, 'bull_use_atr': True, 'bull_use_adx': False, 'bull_use_spike': False, 'bull_rsi_required': True, 'bear_strategy': 'breakout', 'bear_bb_std_mult': 1.8864060585650444, 'bear_rsi_os': 55, 'bear_rsi_ob': 92, 'bear_adx_thresh': 13.437044441876619, 'bear_atr_min_pct': 0.024279725708717927, 'bear_atr_max_pct': 0.0622061677502916, 'bear_tp_mult': 2.5958960954191186, 'bear_tsl_mult': 0.4323292522067567, 'bear_time_stop': 296, 'bear_use_sma': True, 'bear_use_ema': True, 'bear_use_atr': True, 'bear_use_adx': False, 'bear_use_spike': False, 'bear_rsi_required': False, 'sideways_strategy': 'mean_reversion', 'sideways_bb_std_mult': 1.6794226839341466, 'sideways_rsi_os': 23, 'sideways_rsi_ob': 88, 'sideways_adx_thresh': 5.933599709904135, 'sideways_atr_min_pct': 0.008893054295848492, 'sideways_atr_max_pct': 0.0733491094032447, 'sideways_tp_mult': 1.610834109700075, 'sideways_tsl_mult': 0.4487510500314254, 'sideways_time_stop': 134, 'sideways_use_sma': True, 'sideways_use_ema': False, 'sideways_use_atr': False, 'sideways_use_adx': True, 'sideways_use_spike': True, 'sideways_rsi_required': False}.
[I 2025-09-01 09:35:28,419] Trial 185 finished with values: [-1000000000.0, 1000000000.0] and parameters: {'p_sma': 19, 'p_std': 60, 'p_atr': 17, 'p_adx': 19, 'rsi_period': 24, 'ema1': 12, 'ema2': 44, 'slip_atr_k': 0.09692134678853592, 'slip_spread_k': 0.4773304457754057, 'spread_hl_frac': 0.03246303250187233, 'bb_std_mult': 1.324804281512584, 'rsi_os': 15, 'rsi_ob': 67, 'vol_spike': 0.29937026374506015, 'adx_thresh': 30.769005211538822, 'atr_min_pct': 0.02707528613327471, 'atr_max_pct': 0.07368887094432398, 'tp_mult': 2.8054938893685546, 'tsl_mult': 0.4114962991249338, 'strategy': 'breakout', 'time_stop': 131, 'use_sma': True, 'use_atr': False, 'use_adx': False, 'use_ema': True, 'use_spike': True, 'rsi_required': True, 'edge_k': 1.1940335034395382, 'edge_cap': 0.732405705245206, 'bull_strategy': 'breakout', 'bull_bb_std_mult': 3.3738268151862902, 'bull_rsi_os': 48, 'bull_rsi_ob': 48, 'bull_adx_thresh': 28.264842625502556, 'bull_atr_min_pct': 0.0142845202384341, 'bull_atr_max_pct': 0.0852422015257725, 'bull_tp_mult': 2.53385754503902, 'bull_tsl_mult': 0.937690529725509, 'bull_time_stop': 235, 'bull_use_sma': True, 'bull_use_ema': False, 'bull_use_atr': True, 'bull_use_adx': False, 'bull_use_spike': False, 'bull_rsi_required': True, 'bear_strategy': 'mean_reversion', 'bear_bb_std_mult': 1.4074079492468083, 'bear_rsi_os': 52, 'bear_rsi_ob': 95, 'bear_adx_thresh': 24.495019382352798, 'bear_atr_min_pct': 0.011544805833652869, 'bear_atr_max_pct': 0.10332118090557098, 'bear_tp_mult': 2.356875753030378, 'bear_tsl_mult': 0.3000587128412635, 'bear_time_stop': 274, 'bear_use_sma': True, 'bear_use_ema': True, 'bear_use_atr': True, 'bear_use_adx': False, 'bear_use_spike': False, 'bear_rsi_required': False, 'sideways_strategy': 'mean_reversion', 'sideways_bb_std_mult': 1.1656179784438068, 'sideways_rsi_os': 52, 'sideways_rsi_ob': 91, 'sideways_adx_thresh': 26.50203497413645, 'sideways_atr_min_pct': 0.014089681242518899, 'sideways_atr_max_pct': 0.07361303613064746, 'sideways_tp_mult': 2.2057298940553878, 'sideways_tsl_mult': 0.35895313526017253, 'sideways_time_stop': 5, 'sideways_use_sma': True, 'sideways_use_ema': False, 'sideways_use_atr': False, 'sideways_use_adx': True, 'sideways_use_spike': False, 'sideways_rsi_required': True}.
[I 2025-09-01 09:35:28,421] Trial 184 finished with values: [-1000000000.0, 1000000000.0] and parameters: {'p_sma': 20, 'p_std': 26, 'p_atr': 17, 'p_adx': 18, 'rsi_period': 26, 'ema1': 19, 'ema2': 14, 'slip_atr_k': 0.04881683572601006, 'slip_spread_k': 0.1148925037385845, 'spread_hl_frac': 0.04738961287750709, 'bb_std_mult': 1.2324270408220828, 'rsi_os': 37, 'rsi_ob': 68, 'vol_spike': 0.14949114504954947, 'adx_thresh': 31.373477242536627, 'atr_min_pct': 0.02727608681668885, 'atr_max_pct': 0.0526408905424067, 'tp_mult': 1.614433684234494, 'tsl_mult': 0.21944135863700437, 'strategy': 'breakout', 'time_stop': 285, 'use_sma': True, 'use_atr': False, 'use_adx': False, 'use_ema': True, 'use_spike': True, 'rsi_required': True, 'edge_k': 0.5586325838802991, 'edge_cap': 0.4676400837316361, 'bull_strategy': 'breakout', 'bull_bb_std_mult': 3.4755419014867766, 'bull_rsi_os': 48, 'bull_rsi_ob': 90, 'bull_adx_thresh': 28.69107485877969, 'bull_atr_min_pct': 0.014607870231049747, 'bull_atr_max_pct': 0.08500941833767592, 'bull_tp_mult': 2.0125182458028856, 'bull_tsl_mult': 0.9563079487638122, 'bull_time_stop': 236, 'bull_use_sma': True, 'bull_use_ema': False, 'bull_use_atr': True, 'bull_use_adx': False, 'bull_use_spike': False, 'bull_rsi_required': True, 'bear_strategy': 'mean_reversion', 'bear_bb_std_mult': 1.471291104239925, 'bear_rsi_os': 52, 'bear_rsi_ob': 95, 'bear_adx_thresh': 22.83179584368476, 'bear_atr_min_pct': 0.028384521503539224, 'bear_atr_max_pct': 0.06631852943145772, 'bear_tp_mult': 2.805265378237083, 'bear_tsl_mult': 0.43140350785212855, 'bear_time_stop': 295, 'bear_use_sma': True, 'bear_use_ema': True, 'bear_use_atr': True, 'bear_use_adx': False, 'bear_use_spike': False, 'bear_rsi_required': False, 'sideways_strategy': 'mean_reversion', 'sideways_bb_std_mult': 1.1619575240283329, 'sideways_rsi_os': 52, 'sideways_rsi_ob': 51, 'sideways_adx_thresh': 31.808582638447042, 'sideways_atr_min_pct': 0.009028039235224945, 'sideways_atr_max_pct': 0.07376331823411195, 'sideways_tp_mult': 2.0577912892530756, 'sideways_tsl_mult': 0.1404424177697418, 'sideways_time_stop': 27, 'sideways_use_sma': True, 'sideways_use_ema': False, 'sideways_use_atr': False, 'sideways_use_adx': True, 'sideways_use_spike': False, 'sideways_rsi_required': True}.
[I 2025-09-01 09:35:28,878] Trial 183 finished with values: [-1000000000.0, 1000000000.0] and parameters: {'p_sma': 19, 'p_std': 40, 'p_atr': 11, 'p_adx': 19, 'rsi_period': 26, 'ema1': 20, 'ema2': 44, 'slip_atr_k': 0.22787980266521551, 'slip_spread_k': 0.9471899914997641, 'spread_hl_frac': 0.0011434858184786179, 'bb_std_mult': 1.0809573847430378, 'rsi_os': 30, 'rsi_ob': 75, 'vol_spike': 0.26897296902684964, 'adx_thresh': 31.590557185957305, 'atr_min_pct': 0.0299328065551598, 'atr_max_pct': 0.05406915944621048, 'tp_mult': 1.6672807910661698, 'tsl_mult': 0.5041295510980475, 'strategy': 'breakout', 'time_stop': 285, 'use_sma': True, 'use_atr': False, 'use_adx': False, 'use_ema': True, 'use_spike': True, 'rsi_required': True, 'edge_k': 0.6697527425605136, 'edge_cap': 0.1528014373152483, 'bull_strategy': 'breakout', 'bull_bb_std_mult': 3.4061615048459277, 'bull_rsi_os': 55, 'bull_rsi_ob': 48, 'bull_adx_thresh': 8.92229331886531, 'bull_atr_min_pct': 0.016498530528951852, 'bull_atr_max_pct': 0.05862434253846631, 'bull_tp_mult': 2.0152089852964004, 'bull_tsl_mult': 0.9599362475847114, 'bull_time_stop': 236, 'bull_use_sma': True, 'bull_use_ema': False, 'bull_use_atr': True, 'bull_use_adx': False, 'bull_use_spike': False, 'bull_rsi_required': True, 'bear_strategy': 'mean_reversion', 'bear_bb_std_mult': 2.3621881951750687, 'bear_rsi_os': 52, 'bear_rsi_ob': 95, 'bear_adx_thresh': 26.786246522296537, 'bear_atr_min_pct': 0.026689204211638933, 'bear_atr_max_pct': 0.07156343689725862, 'bear_tp_mult': 2.78760907041601, 'bear_tsl_mult': 0.11766014829906546, 'bear_time_stop': 295, 'bear_use_sma': True, 'bear_use_ema': True, 'bear_use_atr': True, 'bear_use_adx': False, 'bear_use_spike': False, 'bear_rsi_required': False, 'sideways_strategy': 'mean_reversion', 'sideways_bb_std_mult': 3.526610855203656, 'sideways_rsi_os': 52, 'sideways_rsi_ob': 58, 'sideways_adx_thresh': 20.63268232299239, 'sideways_atr_min_pct': 0.013729626475462019, 'sideways_atr_max_pct': 0.09845882853630648, 'sideways_tp_mult': 2.8964798235920113, 'sideways_tsl_mult': 0.29193823881453423, 'sideways_time_stop': 30, 'sideways_use_sma': True, 'sideways_use_ema': False, 'sideways_use_atr': False, 'sideways_use_adx': True, 'sideways_use_spike': False, 'sideways_rsi_required': False}.
[I 2025-09-01 09:35:30,144] Trial 182 finished with values: [-1000000000.0, 1000000000.0] and parameters: {'p_sma': 41, 'p_std': 40, 'p_atr': 18, 'p_adx': 17, 'rsi_period': 21, 'ema1': 18, 'ema2': 17, 'slip_atr_k': 0.019082235988381338, 'slip_spread_k': 0.9419790095054235, 'spread_hl_frac': 0.0056714224969340934, 'bb_std_mult': 1.4705239061134188, 'rsi_os': 45, 'rsi_ob': 68, 'vol_spike': 0.015448571043027937, 'adx_thresh': 31.194465673382943, 'atr_min_pct': 0.029523919041804257, 'atr_max_pct': 0.1412220460362067, 'tp_mult': 1.2037508407014212, 'tsl_mult': 0.3514977573085672, 'strategy': 'breakout', 'time_stop': 284, 'use_sma': True, 'use_atr': False, 'use_adx': False, 'use_ema': True, 'use_spike': True, 'rsi_required': True, 'edge_k': 1.2742718077396944, 'edge_cap': 0.7435383526818155, 'bull_strategy': 'breakout', 'bull_bb_std_mult': 1.4298924967519473, 'bull_rsi_os': 45, 'bull_rsi_ob': 48, 'bull_adx_thresh': 9.093103841472152, 'bull_atr_min_pct': 0.016263733080483275, 'bull_atr_max_pct': 0.09385302364629898, 'bull_tp_mult': 1.9991716027655004, 'bull_tsl_mult': 0.9547456401858343, 'bull_time_stop': 91, 'bull_use_sma': True, 'bull_use_ema': False, 'bull_use_atr': True, 'bull_use_adx': False, 'bull_use_spike': False, 'bull_rsi_required': True, 'bear_strategy': 'breakout', 'bear_bb_std_mult': 1.2945800695170888, 'bear_rsi_os': 52, 'bear_rsi_ob': 95, 'bear_adx_thresh': 26.76284861448272, 'bear_atr_min_pct': 0.026533143704883636, 'bear_atr_max_pct': 0.0775640398114595, 'bear_tp_mult': 2.7973417057505503, 'bear_tsl_mult': 0.4334283028549432, 'bear_time_stop': 227, 'bear_use_sma': True, 'bear_use_ema': True, 'bear_use_atr': True, 'bear_use_adx': False, 'bear_use_spike': False, 'bear_rsi_required': False, 'sideways_strategy': 'mean_reversion', 'sideways_bb_std_mult': 1.1261616059567836, 'sideways_rsi_os': 52, 'sideways_rsi_ob': 59, 'sideways_adx_thresh': 8.855855934430858, 'sideways_atr_min_pct': 0.014299089076885204, 'sideways_atr_max_pct': 0.0737080575941309, 'sideways_tp_mult': 2.7540690411712334, 'sideways_tsl_mult': 0.7019012135455038, 'sideways_time_stop': 167, 'sideways_use_sma': True, 'sideways_use_ema': False, 'sideways_use_atr': False, 'sideways_use_adx': True, 'sideways_use_spike': False, 'sideways_rsi_required': False}.
[I 2025-09-01 09:36:16,863] Trial 189 finished with values: [-1000000000.0, 1000000000.0] and parameters: {'p_sma': 59, 'p_std': 49, 'p_atr': 23, 'p_adx': 8, 'rsi_period': 22, 'ema1': 27, 'ema2': 12, 'slip_atr_k': 0.20873318019261328, 'slip_spread_k': 0.6183474112360029, 'spread_hl_frac': 0.028347360244726196, 'bb_std_mult': 3.4528632471568512, 'rsi_os': 37, 'rsi_ob': 64, 'vol_spike': 0.03130533643627813, 'adx_thresh': 29.84930811685846, 'atr_min_pct': 0.02635421286995051, 'atr_max_pct': 0.06215826289327084, 'tp_mult': 1.0501589993994564, 'tsl_mult': 0.4029262610786673, 'strategy': 'breakout', 'time_stop': 145, 'use_sma': True, 'use_atr': False, 'use_adx': False, 'use_ema': True, 'use_spike': True, 'rsi_required': True, 'edge_k': 1.3340623220202457, 'edge_cap': 0.8074196968995069, 'bull_strategy': 'breakout', 'bull_bb_std_mult': 1.2866752005510036, 'bull_rsi_os': 47, 'bull_rsi_ob': 91, 'bull_adx_thresh': 27.35420517741156, 'bull_atr_min_pct': 0.013187837551529687, 'bull_atr_max_pct': 0.08157173205940206, 'bull_tp_mult': 1.3812587597719845, 'bull_tsl_mult': 0.6293039325886626, 'bull_time_stop': 102, 'bull_use_sma': True, 'bull_use_ema': False, 'bull_use_atr': True, 'bull_use_adx': False, 'bull_use_spike': False, 'bull_rsi_required': True, 'bear_strategy': 'mean_reversion', 'bear_bb_std_mult': 2.1140269075213665, 'bear_rsi_os': 6, 'bear_rsi_ob': 88, 'bear_adx_thresh': 25.900028430760955, 'bear_atr_min_pct': 0.02983441161859869, 'bear_atr_max_pct': 0.10978661004072164, 'bear_tp_mult': 2.224972520203266, 'bear_tsl_mult': 0.35512875673241556, 'bear_time_stop': 164, 'bear_use_sma': True, 'bear_use_ema': True, 'bear_use_atr': True, 'bear_use_adx': False, 'bear_use_spike': False, 'bear_rsi_required': False, 'sideways_strategy': 'mean_reversion', 'sideways_bb_std_mult': 0.9790672641783466, 'sideways_rsi_os': 12, 'sideways_rsi_ob': 91, 'sideways_adx_thresh': 27.518080010357874, 'sideways_atr_min_pct': 0.020752459342395065, 'sideways_atr_max_pct': 0.1127958958652828, 'sideways_tp_mult': 1.9347829899904274, 'sideways_tsl_mult': 0.49291238590979713, 'sideways_time_stop': 39, 'sideways_use_sma': True, 'sideways_use_ema': False, 'sideways_use_atr': False, 'sideways_use_adx': True, 'sideways_use_spike': False, 'sideways_rsi_required': True}.
[I 2025-09-01 09:36:17,692] Trial 188 finished with values: [-1000000000.0, 1000000000.0] and parameters: {'p_sma': 42, 'p_std': 59, 'p_atr': 22, 'p_adx': 18, 'rsi_period': 22, 'ema1': 20, 'ema2': 24, 'slip_atr_k': 0.209335793899396, 'slip_spread_k': 0.6218791379673372, 'spread_hl_frac': 0.0040026693088523226, 'bb_std_mult': 1.3649539292676496, 'rsi_os': 37, 'rsi_ob': 63, 'vol_spike': 0.03287621596797563, 'adx_thresh': 32.94398350561105, 'atr_min_pct': 0.029148353374025698, 'atr_max_pct': 0.12834416861912645, 'tp_mult': 1.038107321084115, 'tsl_mult': 0.4057657846885585, 'strategy': 'breakout', 'time_stop': 200, 'use_sma': True, 'use_atr': False, 'use_adx': False, 'use_ema': True, 'use_spike': True, 'rsi_required': True, 'edge_k': 1.2150259891660455, 'edge_cap': 0.7617072446997349, 'bull_strategy': 'breakout', 'bull_bb_std_mult': 3.5061207538310706, 'bull_rsi_os': 49, 'bull_rsi_ob': 84, 'bull_adx_thresh': 30.26413138195479, 'bull_atr_min_pct': 0.01302362422640655, 'bull_atr_max_pct': 0.029299146100488456, 'bull_tp_mult': 1.3931897758601473, 'bull_tsl_mult': 0.4647178288992293, 'bull_time_stop': 246, 'bull_use_sma': True, 'bull_use_ema': False, 'bull_use_atr': True, 'bull_use_adx': False, 'bull_use_spike': False, 'bull_rsi_required': True, 'bear_strategy': 'mean_reversion', 'bear_bb_std_mult': 2.1098490724216914, 'bear_rsi_os': 33, 'bear_rsi_ob': 88, 'bear_adx_thresh': 21.758062556727527, 'bear_atr_min_pct': 0.010322727084372168, 'bear_atr_max_pct': 0.0797491806455159, 'bear_tp_mult': 2.880948463158815, 'bear_tsl_mult': 0.3557396413203199, 'bear_time_stop': 286, 'bear_use_sma': True, 'bear_use_ema': True, 'bear_use_atr': True, 'bear_use_adx': False, 'bear_use_spike': False, 'bear_rsi_required': False, 'sideways_strategy': 'mean_reversion', 'sideways_bb_std_mult': 0.9823552049728592, 'sideways_rsi_os': 54, 'sideways_rsi_ob': 46, 'sideways_adx_thresh': 8.620844134547951, 'sideways_atr_min_pct': 0.020410674325972773, 'sideways_atr_max_pct': 0.07938719880676257, 'sideways_tp_mult': 2.7703963040165993, 'sideways_tsl_mult': 0.6889940949055388, 'sideways_time_stop': 174, 'sideways_use_sma': True, 'sideways_use_ema': False, 'sideways_use_atr': False, 'sideways_use_adx': True, 'sideways_use_spike': False, 'sideways_rsi_required': False}.
[I 2025-09-01 09:36:17,892] Trial 187 finished with values: [-1000000000.0, 1000000000.0] and parameters: {'p_sma': 24, 'p_std': 10, 'p_atr': 7, 'p_adx': 11, 'rsi_period': 21, 'ema1': 20, 'ema2': 22, 'slip_atr_k': 0.03288125720025209, 'slip_spread_k': 0.6313652128689352, 'spread_hl_frac': 0.028127134668804284, 'bb_std_mult': 2.9967854148942488, 'rsi_os': 37, 'rsi_ob': 63, 'vol_spike': 0.25703066912361494, 'adx_thresh': 32.7289330281676, 'atr_min_pct': 0.02652796486932926, 'atr_max_pct': 0.14026682261719042, 'tp_mult': 1.04187433605199, 'tsl_mult': 0.40883034832777143, 'strategy': 'breakout', 'time_stop': 199, 'use_sma': True, 'use_atr': False, 'use_adx': False, 'use_ema': True, 'use_spike': True, 'rsi_required': True, 'edge_k': 1.3205932212455496, 'edge_cap': 0.7700878645991843, 'bull_strategy': 'breakout', 'bull_bb_std_mult': 3.508189723316338, 'bull_rsi_os': 49, 'bull_rsi_ob': 92, 'bull_adx_thresh': 27.444708996350002, 'bull_atr_min_pct': 0.013144589474754456, 'bull_atr_max_pct': 0.01305795271368658, 'bull_tp_mult': 1.3787865958388255, 'bull_tsl_mult': 0.11122679827172594, 'bull_time_stop': 92, 'bull_use_sma': True, 'bull_use_ema': False, 'bull_use_atr': True, 'bull_use_adx': False, 'bull_use_spike': False, 'bull_rsi_required': True, 'bear_strategy': 'mean_reversion', 'bear_bb_std_mult': 1.2208279673327043, 'bear_rsi_os': 54, 'bear_rsi_ob': 60, 'bear_adx_thresh': 26.118015257437214, 'bear_atr_min_pct': 0.0101440909579672, 'bear_atr_max_pct': 0.08003164440853482, 'bear_tp_mult': 2.223638137528616, 'bear_tsl_mult': 0.35719056036996405, 'bear_time_stop': 182, 'bear_use_sma': True, 'bear_use_ema': True, 'bear_use_atr': True, 'bear_use_adx': False, 'bear_use_spike': False, 'bear_rsi_required': False, 'sideways_strategy': 'mean_reversion', 'sideways_bb_std_mult': 0.9736670013323994, 'sideways_rsi_os': 54, 'sideways_rsi_ob': 68, 'sideways_adx_thresh': 26.107458799543522, 'sideways_atr_min_pct': 0.020735680938139916, 'sideways_atr_max_pct': 0.10875532706433387, 'sideways_tp_mult': 1.9339501970036261, 'sideways_tsl_mult': 0.6991253247363662, 'sideways_time_stop': 39, 'sideways_use_sma': True, 'sideways_use_ema': False, 'sideways_use_atr': False, 'sideways_use_adx': True, 'sideways_use_spike': False, 'sideways_rsi_required': False}.
