[I 2025-09-01 09:33:27,389] Trial 169 finished with values: [-1000000000.0, 1000000000.0] and parameters: {'p_sma': 49, 'p_std': 28, 'p_atr': 18, 'p_adx': 24, 'rsi_period': 49, 'ema1': 23, 'ema2': 18, 'slip_atr_k': 0.04414799649922714, 'slip_spread_k': 0.6602873475804618, 'spread_hl_frac': 0.018001500933856007, 'bb_std_mult': 1.4043646884373553, 'rsi_os': 54, 'rsi_ob': 86, 'vol_spike': 0.0951909686898132, 'adx_thresh': 26.463400698209803, 'atr_min_pct': 0.012097004007621315, 'atr_max_pct': 0.026357653818065777, 'tp_mult': 2.1564943650595296, 'tsl_mult': 0.44036250885412387, 'strategy': 'breakout', 'time_stop': 300, 'use_sma': True, 'use_atr': False, 'use_adx': False, 'use_ema': True, 'use_spike': True, 'rsi_required': True, 'edge_k': 1.0061940939729672, 'edge_cap': 0.5388677860350496, 'bull_strategy': 'breakout', 'bull_bb_std_mult': 1.0894006103698228, 'bull_rsi_os': 22, 'bull_rsi_ob': 53, 'bull_adx_thresh': 24.548152315853805, 'bull_atr_min_pct': 0.022660085772253695, 'bull_atr_max_pct': 0.09782780967330199, 'bull_tp_mult': 2.3080292882856437, 'bull_tsl_mult': 0.9414954099846955, 'bull_time_stop': 298, 'bull_use_sma': True, 'bull_use_ema': False, 'bull_use_atr': True, 'bull_use_adx': False, 'bull_use_spike': False, 'bull_rsi_required': True, 'bear_strategy': 'mean_reversion', 'bear_bb_std_mult': 2.0504751158236796, 'bear_rsi_os': 47, 'bear_rsi_ob': 95, 'bear_adx_thresh': 16.589611768131505, 'bear_atr_min_pct': 0.02761798046207979, 'bear_atr_max_pct': 0.1197068484036794, 'bear_tp_mult': 2.9035207734195994, 'bear_tsl_mult': 0.5913991331796146, 'bear_time_stop': 281, 'bear_use_sma': True, 'bear_use_ema': True, 'bear_use_atr': True, 'bear_use_adx': False, 'bear_use_spike': False, 'bear_rsi_required': False, 'sideways_strategy': 'mean_reversion', 'sideways_bb_std_mult': 2.8916059828208094, 'sideways_rsi_os': 16, 'sideways_rsi_ob': 56, 'sideways_adx_thresh': 34.550559312423815, 'sideways_atr_min_pct': 0.022318751641686015, 'sideways_atr_max_pct': 0.10312335307158035, 'sideways_tp_mult': 1.9725598059681408, 'sideways_tsl_mult': 0.04884147478950995, 'sideways_time_stop': 13, 'sideways_use_sma': True, 'sideways_use_ema': False, 'sideways_use_atr': False, 'sideways_use_adx': True, 'sideways_use_spike': False, 'sideways_rsi_required': True}.
[I 2025-09-01 09:33:27,887] Trial 173 finished with values: [-1000000000.0, 1000000000.0] and parameters: {'p_sma': 49, 'p_std': 44, 'p_atr': 12, 'p_adx': 23, 'rsi_period': 30, 'ema1': 23, 'ema2': 19, 'slip_atr_k': 0.06587162688100251, 'slip_spread_k': 0.6699367237385204, 'spread_hl_frac': 0.014887525727530626, 'bb_std_mult': 2.7684080997964218, 'rsi_os': 41, 'rsi_ob': 80, 'vol_spike': 0.08981112996421237, 'adx_thresh': 32.1633919029908, 'atr_min_pct': 0.028305189420266674, 'atr_max_pct': 0.024771982058979326, 'tp_mult': 1.010014191336495, 'tsl_mult': 0.27695642419538935, 'strategy': 'breakout', 'time_stop': 278, 'use_sma': True, 'use_atr': False, 'use_adx': False, 'use_ema': True, 'use_spike': True, 'rsi_required': True, 'edge_k': 1.146374147490384, 'edge_cap': 0.8277901466912998, 'bull_strategy': 'breakout', 'bull_bb_std_mult': 3.551181809762297, 'bull_rsi_os': 49, 'bull_rsi_ob': 49, 'bull_adx_thresh': 6.06009495476623, 'bull_atr_min_pct': 0.02709299460441742, 'bull_atr_max_pct': 0.047512702604478686, 'bull_tp_mult': 1.5229328789691035, 'bull_tsl_mult': 0.9753863900778698, 'bull_time_stop': 298, 'bull_use_sma': True, 'bull_use_ema': False, 'bull_use_atr': True, 'bull_use_adx': True, 'bull_use_spike': False, 'bull_rsi_required': True, 'bear_strategy': 'mean_reversion', 'bear_bb_std_mult': 0.7768045791646094, 'bear_rsi_os': 53, 'bear_rsi_ob': 52, 'bear_adx_thresh': 25.098936819830428, 'bear_atr_min_pct': 0.029244565117096267, 'bear_atr_max_pct': 0.07369087899048014, 'bear_tp_mult': 2.275663750786061, 'bear_tsl_mult': 0.19113269365694824, 'bear_time_stop': 32, 'bear_use_sma': True, 'bear_use_ema': True, 'bear_use_atr': True, 'bear_use_adx': False, 'bear_use_spike': False, 'bear_rsi_required': False, 'sideways_strategy': 'mean_reversion', 'sideways_bb_std_mult': 1.0392091306330251, 'sideways_rsi_os': 50, 'sideways_rsi_ob': 90, 'sideways_adx_thresh': 29.60029496087866, 'sideways_atr_min_pct': 0.021038258420682136, 'sideways_atr_max_pct': 0.06769839107109106, 'sideways_tp_mult': 2.098413705878572, 'sideways_tsl_mult': 0.4301078920365316, 'sideways_time_stop': 215, 'sideways_use_sma': True, 'sideways_use_ema': False, 'sideways_use_atr': False, 'sideways_use_adx': True, 'sideways_use_spike': False, 'sideways_rsi_required': False}.
[I 2025-09-01 09:33:28,006] Trial 176 finished with values: [-1000000000.0, 1000000000.0] and parameters: {'p_sma': 15, 'p_std': 15, 'p_atr': 16, 'p_adx': 20, 'rsi_period': 15, 'ema1': 14, 'ema2': 15, 'slip_atr_k': 0.052541686938258676, 'slip_spread_k': 0.6918497497592773, 'spread_hl_frac': 0.010726241039826579, 'bb_std_mult': 1.2442914501367146, 'rsi_os': 36, 'rsi_ob': 90, 'vol_spike': 0.006075879581535732, 'adx_thresh': 17.114047845041586, 'atr_min_pct': 0.026991990645769324, 'atr_max_pct': 0.016339871376517684, 'tp_mult': 1.0615903206481025, 'tsl_mult': 0.3889569945971353, 'strategy': 'breakout', 'time_stop': 82, 'use_sma': True, 'use_atr': False, 'use_adx': False, 'use_ema': True, 'use_spike': True, 'rsi_required': True, 'edge_k': 1.2329446224575538, 'edge_cap': 0.8272026894668113, 'bull_strategy': 'breakout', 'bull_bb_std_mult': 3.406651207255792, 'bull_rsi_os': 47, 'bull_rsi_ob': 47, 'bull_adx_thresh': 33.96934017723326, 'bull_atr_min_pct': 0.017069322423205243, 'bull_atr_max_pct': 0.06769284559045811, 'bull_tp_mult': 2.680577496913602, 'bull_tsl_mult': 0.9771748941867336, 'bull_time_stop': 215, 'bull_use_sma': True, 'bull_use_ema': False, 'bull_use_atr': True, 'bull_use_adx': False, 'bull_use_spike': False, 'bull_rsi_required': True, 'bear_strategy': 'mean_reversion', 'bear_bb_std_mult': 1.9511573598314125, 'bear_rsi_os': 41, 'bear_rsi_ob': 94, 'bear_adx_thresh': 23.676969916378845, 'bear_atr_min_pct': 0.02862417766370521, 'bear_atr_max_pct': 0.050384254036563964, 'bear_tp_mult': 2.2347298627829097, 'bear_tsl_mult': 0.25745937605873137, 'bear_time_stop': 287, 'bear_use_sma': True, 'bear_use_ema': True, 'bear_use_atr': True, 'bear_use_adx': False, 'bear_use_spike': False, 'bear_rsi_required': False, 'sideways_strategy': 'mean_reversion', 'sideways_bb_std_mult': 0.8735788281393837, 'sideways_rsi_os': 48, 'sideways_rsi_ob': 90, 'sideways_adx_thresh': 27.610921036006967, 'sideways_atr_min_pct': 0.021811478766004866, 'sideways_atr_max_pct': 0.10518669775126388, 'sideways_tp_mult': 1.9401799869362384, 'sideways_tsl_mult': 0.6166287052899593, 'sideways_time_stop': 39, 'sideways_use_sma': True, 'sideways_use_ema': False, 'sideways_use_atr': False, 'sideways_use_adx': True, 'sideways_use_spike': False, 'sideways_rsi_required': False}.
[I 2025-09-01 09:34:04,504] Trial 174 finished with values: [-1000000000.0, 1000000000.0] and parameters: {'p_sma': 21, 'p_std': 19, 'p_atr': 16, 'p_adx': 23, 'rsi_period': 38, 'ema1': 26, 'ema2': 19, 'slip_atr_k': 0.06650230614607879, 'slip_spread_k': 0.6843754107064799, 'spread_hl_frac': 0.014616568007041588, 'bb_std_mult': 2.7489854315807243, 'rsi_os': 39, 'rsi_ob': 80, 'vol_spike': 0.006871571157164929, 'adx_thresh': 32.222561103987836, 'atr_min_pct': 0.010918982874985095, 'atr_max_pct': 0.0730109131330388, 'tp_mult': 1.0435465077243422, 'tsl_mult': 0.2539095210382376, 'strategy': 'breakout', 'time_stop': 246, 'use_sma': True, 'use_atr': False, 'use_adx': False, 'use_ema': True, 'use_spike': True, 'rsi_required': True, 'edge_k': 1.1578650707924185, 'edge_cap': 0.8280993503391055, 'bull_strategy': 'breakout', 'bull_bb_std_mult': 3.577730483097216, 'bull_rsi_os': 15, 'bull_rsi_ob': 80, 'bull_adx_thresh': 6.2806335589114815, 'bull_atr_min_pct': 0.024419313231302583, 'bull_atr_max_pct': 0.04697913309308239, 'bull_tp_mult': 1.5231874638820413, 'bull_tsl_mult': 0.9850972705798166, 'bull_time_stop': 242, 'bull_use_sma': True, 'bull_use_ema': False, 'bull_use_atr': True, 'bull_use_adx': True, 'bull_use_spike': False, 'bull_rsi_required': True, 'bear_strategy': 'mean_reversion', 'bear_bb_std_mult': 0.6748196952075534, 'bear_rsi_os': 54, 'bear_rsi_ob': 94, 'bear_adx_thresh': 25.007161828941957, 'bear_atr_min_pct': 0.02902823018170089, 'bear_atr_max_pct': 0.07452860837632247, 'bear_tp_mult': 2.298291443611727, 'bear_tsl_mult': 0.2039590214006213, 'bear_time_stop': 288, 'bear_use_sma': True, 'bear_use_ema': True, 'bear_use_atr': True, 'bear_use_adx': False, 'bear_use_spike': False, 'bear_rsi_required': False, 'sideways_strategy': 'mean_reversion', 'sideways_bb_std_mult': 1.0202515780601495, 'sideways_rsi_os': 50, 'sideways_rsi_ob': 90, 'sideways_adx_thresh': 29.331906951192394, 'sideways_atr_min_pct': 0.0070977484375578225, 'sideways_atr_max_pct': 0.13511904536063232, 'sideways_tp_mult': 2.4373137438713735, 'sideways_tsl_mult': 0.41344153195744293, 'sideways_time_stop': 21, 'sideways_use_sma': True, 'sideways_use_ema': False, 'sideways_use_atr': False, 'sideways_use_adx': True, 'sideways_use_spike': False, 'sideways_rsi_required': False}.
[I 2025-09-01 09:34:04,917] Trial 172 finished with values: [-1000000000.0, 1000000000.0] and parameters: {'p_sma': 16, 'p_std': 20, 'p_atr': 16, 'p_adx': 17, 'rsi_period': 15, 'ema1': 20, 'ema2': 19, 'slip_atr_k': 0.04162200054980009, 'slip_spread_k': 0.678238849397182, 'spread_hl_frac': 0.02896045724283189, 'bb_std_mult': 1.2374107057695793, 'rsi_os': 36, 'rsi_ob': 90, 'vol_spike': 0.09524258805962545, 'adx_thresh': 32.25659692855024, 'atr_min_pct': 0.028361101352834147, 'atr_max_pct': 0.1327774147142823, 'tp_mult': 1.752206008608854, 'tsl_mult': 0.4377403935725491, 'strategy': 'breakout', 'time_stop': 278, 'use_sma': True, 'use_atr': False, 'use_adx': False, 'use_ema': True, 'use_spike': True, 'rsi_required': True, 'edge_k': 1.371469477307806, 'edge_cap': 0.9095662018641522, 'bull_strategy': 'breakout', 'bull_bb_std_mult': 3.552082085850715, 'bull_rsi_os': 43, 'bull_rsi_ob': 79, 'bull_adx_thresh': 24.673177132014803, 'bull_atr_min_pct': 0.017311271659033064, 'bull_atr_max_pct': 0.019864244669234025, 'bull_tp_mult': 1.5201713471554092, 'bull_tsl_mult': 0.981685980537765, 'bull_time_stop': 241, 'bull_use_sma': True, 'bull_use_ema': False, 'bull_use_atr': True, 'bull_use_adx': True, 'bull_use_spike': False, 'bull_rsi_required': True, 'bear_strategy': 'mean_reversion', 'bear_bb_std_mult': 1.9571654672604732, 'bear_rsi_os': 53, 'bear_rsi_ob': 52, 'bear_adx_thresh': 5.212911079521879, 'bear_atr_min_pct': 0.029194172030738468, 'bear_atr_max_pct': 0.03555108635693158, 'bear_tp_mult': 2.2768358116472904, 'bear_tsl_mult': 0.2555079851807005, 'bear_time_stop': 284, 'bear_use_sma': True, 'bear_use_ema': True, 'bear_use_atr': True, 'bear_use_adx': False, 'bear_use_spike': False, 'bear_rsi_required': False, 'sideways_strategy': 'mean_reversion', 'sideways_bb_std_mult': 1.0327793407654555, 'sideways_rsi_os': 50, 'sideways_rsi_ob': 57, 'sideways_adx_thresh': 27.98349380312423, 'sideways_atr_min_pct': 0.02619133459761825, 'sideways_atr_max_pct': 0.06798190908169234, 'sideways_tp_mult': 2.0955888779051777, 'sideways_tsl_mult': 0.6349777626881993, 'sideways_time_stop': 22, 'sideways_use_sma': True, 'sideways_use_ema': False, 'sideways_use_atr': False, 'sideways_use_adx': True, 'sideways_use_spike': False, 'sideways_rsi_required': False}.
[I 2025-09-01 09:34:05,208] Trial 175 finished with values: [-1000000000.0, 1000000000.0] and parameters: {'p_sma': 21, 'p_std': 20, 'p_atr': 9, 'p_adx': 20, 'rsi_period': 30, 'ema1': 25, 'ema2': 15, 'slip_atr_k': 0.05275623257339191, 'slip_spread_k': 0.6518549848359613, 'spread_hl_frac': 0.014835034548285157, 'bb_std_mult': 2.8870598385699022, 'rsi_os': 39, 'rsi_ob': 69, 'vol_spike': 0.008577400428832805, 'adx_thresh': 32.120585152673065, 'atr_min_pct': 0.02836478843180308, 'atr_max_pct': 0.08284625137872385, 'tp_mult': 2.4866190080040655, 'tsl_mult': 0.2624975172638358, 'strategy': 'breakout', 'time_stop': 244, 'use_sma': True, 'use_atr': False, 'use_adx': False, 'use_ema': True, 'use_spike': True, 'rsi_required': True, 'edge_k': 1.7371314946791165, 'edge_cap': 0.8333712098966573, 'bull_strategy': 'breakout', 'bull_bb_std_mult': 3.5508495085152783, 'bull_rsi_os': 17, 'bull_rsi_ob': 49, 'bull_adx_thresh': 5.8472982074687385, 'bull_atr_min_pct': 0.012236120155720984, 'bull_atr_max_pct': 0.047870462975522186, 'bull_tp_mult': 1.5798852718138998, 'bull_tsl_mult': 0.9893157923009205, 'bull_time_stop': 215, 'bull_use_sma': True, 'bull_use_ema': False, 'bull_use_atr': True, 'bull_use_adx': True, 'bull_use_spike': False, 'bull_rsi_required': True, 'bear_strategy': 'mean_reversion', 'bear_bb_std_mult': 0.6123799261946727, 'bear_rsi_os': 42, 'bear_rsi_ob': 94, 'bear_adx_thresh': 25.156347830432246, 'bear_atr_min_pct': 0.029160987982040504, 'bear_atr_max_pct': 0.06981394011531199, 'bear_tp_mult': 2.2779730166317305, 'bear_tsl_mult': 0.32642304585234, 'bear_time_stop': 31, 'bear_use_sma': True, 'bear_use_ema': True, 'bear_use_atr': True, 'bear_use_adx': False, 'bear_use_spike': False, 'bear_rsi_required': False, 'sideways_strategy': 'mean_reversion', 'sideways_bb_std_mult': 1.0590645874237596, 'sideways_rsi_os': 50, 'sideways_rsi_ob': 89, 'sideways_adx_thresh': 29.519114368283525, 'sideways_atr_min_pct': 0.006932823575001291, 'sideways_atr_max_pct': 0.0757811468751429, 'sideways_tp_mult': 2.097080632824829, 'sideways_tsl_mult': 0.43121875529651754, 'sideways_time_stop': 21, 'sideways_use_sma': True, 'sideways_use_ema': False, 'sideways_use_atr': False, 'sideways_use_adx': True, 'sideways_use_spike': False, 'sideways_rsi_required': False}.
[I 2025-09-01 09:34:05,868] Trial 177 finished with values: [-1000000000.0, 1000000000.0] and parameters: {'p_sma': 17, 'p_std': 18, 'p_atr': 19, 'p_adx': 7, 'rsi_period': 19, 'ema1': 21, 'ema2': 50, 'slip_atr_k': 0.06132741238676614, 'slip_spread_k': 0.9073330395423236, 'spread_hl_frac': 0.02914386585169836, 'bb_std_mult': 2.343122396170404, 'rsi_os': 39, 'rsi_ob': 77, 'vol_spike': 0.11135482974177231, 'adx_thresh': 32.34824328284083, 'atr_min_pct': 0.0014725812514411237, 'atr_max_pct': 0.13266494812031415, 'tp_mult': 1.1100434298062416, 'tsl_mult': 0.6658643201711603, 'strategy': 'breakout', 'time_stop': 244, 'use_sma': True, 'use_atr': False, 'use_adx': False, 'use_ema': True, 'use_spike': True, 'rsi_required': True, 'edge_k': 1.3615857714172348, 'edge_cap': 0.9150674456801783, 'bull_strategy': 'breakout', 'bull_bb_std_mult': 3.5922248776789254, 'bull_rsi_os': 12, 'bull_rsi_ob': 45, 'bull_adx_thresh': 6.59557908053844, 'bull_atr_min_pct': 0.018141622617286513, 'bull_atr_max_pct': 0.08874723063480924, 'bull_tp_mult': 1.584207652665326, 'bull_tsl_mult': 0.9003538242573996, 'bull_time_stop': 288, 'bull_use_sma': True, 'bull_use_ema': False, 'bull_use_atr': True, 'bull_use_adx': True, 'bull_use_spike': False, 'bull_rsi_required': True, 'bear_strategy': 'mean_reversion', 'bear_bb_std_mult': 0.6549970936801133, 'bear_rsi_os': 54, 'bear_rsi_ob': 92, 'bear_adx_thresh': 23.24961253585559, 'bear_atr_min_pct': 0.023900012618716257, 'bear_atr_max_pct': 0.06882023508142107, 'bear_tp_mult': 2.1944088947521494, 'bear_tsl_mult': 0.32548605415290127, 'bear_time_stop': 292, 'bear_use_sma': True, 'bear_use_ema': True, 'bear_use_atr': True, 'bear_use_adx': False, 'bear_use_spike': False, 'bear_rsi_required': False, 'sideways_strategy': 'mean_reversion', 'sideways_bb_std_mult': 1.6650358191560322, 'sideways_rsi_os': 55, 'sideways_rsi_ob': 88, 'sideways_adx_thresh': 30.43990654572874, 'sideways_atr_min_pct': 0.026317827855052628, 'sideways_atr_max_pct': 0.13547040558501866, 'sideways_tp_mult': 1.590504757836289, 'sideways_tsl_mult': 0.41691159942933553, 'sideways_time_stop': 20, 'sideways_use_sma': True, 'sideways_use_ema': False, 'sideways_use_atr': False, 'sideways_use_adx': True, 'sideways_use_spike': True, 'sideways_rsi_required': False}.
[I 2025-09-01 09:34:47,713] Trial 181 finished with values: [-0.04944148889069733, 0.04919681466734857] and parameters: {'p_sma': 32, 'p_std': 5, 'p_atr': 17, 'p_adx': 18, 'rsi_period': 18, 'ema1': 10, 'ema2': 16, 'slip_atr_k': 0.005231508457454126, 'slip_spread_k': 0.630948633625889, 'spread_hl_frac': 0.03151497251017941, 'bb_std_mult': 3.337891647894873, 'rsi_os': 41, 'rsi_ob': 71, 'vol_spike': 0.021962787716821402, 'adx_thresh': 23.400234253573966, 'atr_min_pct': 0.02413884777686679, 'atr_max_pct': 0.07698650740171498, 'tp_mult': 1.168372929438615, 'tsl_mult': 0.46845455652017826, 'strategy': 'breakout', 'time_stop': 272, 'use_sma': True, 'use_atr': False, 'use_adx': False, 'use_ema': True, 'use_spike': True, 'rsi_required': True, 'edge_k': 1.2571555808710422, 'edge_cap': 0.8591122155338689, 'bull_strategy': 'breakout', 'bull_bb_std_mult': 3.072186411399775, 'bull_rsi_os': 6, 'bull_rsi_ob': 48, 'bull_adx_thresh': 19.74969989001775, 'bull_atr_min_pct': 0.007034040405523658, 'bull_atr_max_pct': 0.06437581143993279, 'bull_tp_mult': 2.760401480131784, 'bull_tsl_mult': 0.5704621946837638, 'bull_time_stop': 258, 'bull_use_sma': True, 'bull_use_ema': False, 'bull_use_atr': True, 'bull_use_adx': False, 'bull_use_spike': False, 'bull_rsi_required': True, 'bear_strategy': 'breakout', 'bear_bb_std_mult': 0.8526652493602531, 'bear_rsi_os': 55, 'bear_rsi_ob': 48, 'bear_adx_thresh': 12.647787303085424, 'bear_atr_min_pct': 0.0038870273948612855, 'bear_atr_max_pct': 0.06277690648971404, 'bear_tp_mult': 2.625225361082204, 'bear_tsl_mult': 0.07934966690828477, 'bear_time_stop': 249, 'bear_use_sma': True, 'bear_use_ema': True, 'bear_use_atr': True, 'bear_use_adx': False, 'bear_use_spike': False, 'bear_rsi_required': False, 'sideways_strategy': 'mean_reversion', 'sideways_bb_std_mult': 3.1388478779427156, 'sideways_rsi_os': 23, 'sideways_rsi_ob': 86, 'sideways_adx_thresh': 24.809257919778293, 'sideways_atr_min_pct': 0.023489158172086643, 'sideways_atr_max_pct': 0.09536710459924388, 'sideways_tp_mult': 2.6333917383628416, 'sideways_tsl_mult': 0.44887243831475937, 'sideways_time_stop': 132, 'sideways_use_sma': True, 'sideways_use_ema': False, 'sideways_use_atr': False, 'sideways_use_adx': True, 'sideways_use_spike': True, 'sideways_rsi_required': False}.
[I 2025-09-01 09:34:49,296] Trial 180 finished with values: [-0.048080229528837504, 0.04754800626804779] and parameters: {'p_sma': 33, 'p_std': 34, 'p_atr': 18, 'p_adx': 17, 'rsi_period': 21, 'ema1': 18, 'ema2': 17, 'slip_atr_k': 0.00967206583318346, 'slip_spread_k': 0.5973938908308255, 'spread_hl_frac': 0.0056991598320700505, 'bb_std_mult': 1.6578689844050045, 'rsi_os': 51, 'rsi_ob': 71, 'vol_spike': 0.016281451074879494, 'adx_thresh': 20.986265908061984, 'atr_min_pct': 0.007745302915649308, 'atr_max_pct': 0.07688609991991764, 'tp_mult': 1.2000003695553052, 'tsl_mult': 0.3580959039919692, 'strategy': 'breakout', 'time_stop': 273, 'use_sma': True, 'use_atr': False, 'use_adx': False, 'use_ema': True, 'use_spike': True, 'rsi_required': True, 'edge_k': 1.273619334133461, 'edge_cap': 0.5764634797920013, 'bull_strategy': 'breakout', 'bull_bb_std_mult': 1.4195807973575296, 'bull_rsi_os': 11, 'bull_rsi_ob': 46, 'bull_adx_thresh': 7.383988225107148, 'bull_atr_min_pct': 0.018062754486461587, 'bull_atr_max_pct': 0.07550897061608981, 'bull_tp_mult': 1.9633673823726276, 'bull_tsl_mult': 0.8983375020683912, 'bull_time_stop': 248, 'bull_use_sma': True, 'bull_use_ema': False, 'bull_use_atr': True, 'bull_use_adx': False, 'bull_use_spike': False, 'bull_rsi_required': True, 'bear_strategy': 'breakout', 'bear_bb_std_mult': 2.0114954306194583, 'bear_rsi_os': 55, 'bear_rsi_ob': 92, 'bear_adx_thresh': 23.29477414470105, 'bear_atr_min_pct': 0.0031333856102232407, 'bear_atr_max_pct': 0.0772288206673726, 'bear_tp_mult': 1.9671942294368794, 'bear_tsl_mult': 0.07750942918507275, 'bear_time_stop': 229, 'bear_use_sma': True, 'bear_use_ema': True, 'bear_use_atr': True, 'bear_use_adx': False, 'bear_use_spike': False, 'bear_rsi_required': False, 'sideways_strategy': 'mean_reversion', 'sideways_bb_std_mult': 1.603653033320744, 'sideways_rsi_os': 55, 'sideways_rsi_ob': 85, 'sideways_adx_thresh': 24.777358573903356, 'sideways_atr_min_pct': 0.027773211449425673, 'sideways_atr_max_pct': 0.011700603576072402, 'sideways_tp_mult': 2.0120527953770684, 'sideways_tsl_mult': 0.4563903578399481, 'sideways_time_stop': 32, 'sideways_use_sma': True, 'sideways_use_ema': False, 'sideways_use_atr': False, 'sideways_use_adx': True, 'sideways_use_spike': True, 'sideways_rsi_required': False}.
