[I 2025-09-01 09:10:11,673] Trial 17 finished with values: [-1000000000.0, 1000000000.0] and parameters: {'p_sma': 5, 'p_std': 43, 'p_atr': 26, 'p_adx': 13, 'rsi_period': 55, 'ema1': 14, 'ema2': 41, 'slip_atr_k': 0.18713560022592135, 'slip_spread_k': 0.7305910701994486, 'spread_hl_frac': 0.00027693297269645173, 'bb_std_mult': 1.2658846281419436, 'rsi_os': 42, 'rsi_ob': 65, 'vol_spike': 0.19611199966447362, 'adx_thresh': 22.543210128374422, 'atr_min_pct': 0.021810295904039257, 'atr_max_pct': 0.09825716873441856, 'tp_mult': 1.4729047114683973, 'tsl_mult': 0.3597334356898795, 'strategy': 'mean_reversion', 'time_stop': 129, 'use_sma': False, 'use_atr': True, 'use_adx': True, 'use_ema': False, 'use_spike': False, 'rsi_required': False, 'edge_k': 0.05044235677405973, 'edge_cap': 0.2816011485110641, 'bull_strategy': 'mean_reversion', 'bull_bb_std_mult': 1.6259355467148988, 'bull_rsi_os': 6, 'bull_rsi_ob': 74, 'bull_adx_thresh': 19.532107044031005, 'bull_atr_min_pct': 0.0004020745550009396, 'bull_atr_max_pct': 0.058000719010783006, 'bull_tp_mult': 1.0723733672251217, 'bull_tsl_mult': 0.0016647711052379943, 'bull_time_stop': 209, 'bull_use_sma': False, 'bull_use_ema': True, 'bull_use_atr': False, 'bull_use_adx': True, 'bull_use_spike': True, 'bull_rsi_required': False, 'bear_strategy': 'mean_reversion', 'bear_bb_std_mult': 3.5980227092819392, 'bear_rsi_os': 15, 'bear_rsi_ob': 69, 'bear_adx_thresh': 34.93347753673327, 'bear_atr_min_pct': 0.010940584671062875, 'bear_atr_max_pct': 0.06879224735149991, 'bear_tp_mult': 2.8309027233773043, 'bear_tsl_mult': 0.652969695199526, 'bear_time_stop': 147, 'bear_use_sma': False, 'bear_use_ema': False, 'bear_use_atr': False, 'bear_use_adx': True, 'bear_use_spike': True, 'bear_rsi_required': True, 'sideways_strategy': 'breakout', 'sideways_bb_std_mult': 2.5505695254413685, 'sideways_rsi_os': 23, 'sideways_rsi_ob': 93, 'sideways_adx_thresh': 11.79356816814844, 'sideways_atr_min_pct': 0.005979499097145377, 'sideways_atr_max_pct': 0.059674535921748956, 'sideways_tp_mult': 1.0388070872487976, 'sideways_tsl_mult': 0.9957895497936481, 'sideways_time_stop': 114, 'sideways_use_sma': False, 'sideways_use_ema': True, 'sideways_use_atr': True, 'sideways_use_adx': False, 'sideways_use_spike': True, 'sideways_rsi_required': False}.
[I 2025-09-01 09:10:12,165] Trial 19 finished with values: [-1000000000.0, 1000000000.0] and parameters: {'p_sma': 15, 'p_std': 42, 'p_atr': 26, 'p_adx': 21, 'rsi_period': 47, 'ema1': 12, 'ema2': 59, 'slip_atr_k': 0.0728985409033109, 'slip_spread_k': 0.7201344875018583, 'spread_hl_frac': 0.0019391299539521997, 'bb_std_mult': 1.2932537597865021, 'rsi_os': 41, 'rsi_ob': 65, 'vol_spike': 0.10461354881939189, 'adx_thresh': 12.07236486714866, 'atr_min_pct': 0.0008481878696445216, 'atr_max_pct': 0.07439174302222165, 'tp_mult': 1.4852547179324664, 'tsl_mult': 0.5021993872189585, 'strategy': 'mean_reversion', 'time_stop': 6, 'use_sma': False, 'use_atr': True, 'use_adx': True, 'use_ema': False, 'use_spike': False, 'rsi_required': False, 'edge_k': 0.6574696273655558, 'edge_cap': 0.26081010462808585, 'bull_strategy': 'breakout', 'bull_bb_std_mult': 0.6748014241673552, 'bull_rsi_os': 5, 'bull_rsi_ob': 74, 'bull_adx_thresh': 22.30227071584339, 'bull_atr_min_pct': 0.0036532410270731907, 'bull_atr_max_pct': 0.09577750110354834, 'bull_tp_mult': 2.974469896163679, 'bull_tsl_mult': 0.4074202807958159, 'bull_time_stop': 208, 'bull_use_sma': False, 'bull_use_ema': True, 'bull_use_atr': False, 'bull_use_adx': True, 'bull_use_spike': True, 'bull_rsi_required': False, 'bear_strategy': 'mean_reversion', 'bear_bb_std_mult': 3.588633486323314, 'bear_rsi_os': 31, 'bear_rsi_ob': 69, 'bear_adx_thresh': 33.70363698561265, 'bear_atr_min_pct': 0.022620280632927432, 'bear_atr_max_pct': 0.06473803670135263, 'bear_tp_mult': 2.620454882464257, 'bear_tsl_mult': 0.7283342669131792, 'bear_time_stop': 196, 'bear_use_sma': False, 'bear_use_ema': True, 'bear_use_atr': False, 'bear_use_adx': True, 'bear_use_spike': True, 'bear_rsi_required': True, 'sideways_strategy': 'breakout', 'sideways_bb_std_mult': 1.6722896141521266, 'sideways_rsi_os': 28, 'sideways_rsi_ob': 50, 'sideways_adx_thresh': 15.30266931422311, 'sideways_atr_min_pct': 0.0072793130892687356, 'sideways_atr_max_pct': 0.06535192678448501, 'sideways_tp_mult': 1.038435708766653, 'sideways_tsl_mult': 0.9829392674744154, 'sideways_time_stop': 295, 'sideways_use_sma': False, 'sideways_use_ema': True, 'sideways_use_atr': True, 'sideways_use_adx': False, 'sideways_use_spike': False, 'sideways_rsi_required': False}.
[I 2025-09-01 09:10:13,150] Trial 18 finished with values: [-1000000000.0, 1000000000.0] and parameters: {'p_sma': 16, 'p_std': 21, 'p_atr': 26, 'p_adx': 20, 'rsi_period': 45, 'ema1': 13, 'ema2': 37, 'slip_atr_k': 0.19744888422937112, 'slip_spread_k': 0.7395951699252824, 'spread_hl_frac': 0.0046894343497909385, 'bb_std_mult': 1.3677799697567765, 'rsi_os': 41, 'rsi_ob': 66, 'vol_spike': 0.07849542135788751, 'adx_thresh': 11.368375057487922, 'atr_min_pct': 0.00016573594270584413, 'atr_max_pct': 0.14333925449579166, 'tp_mult': 1.4868630454087477, 'tsl_mult': 0.20767034356648567, 'strategy': 'mean_reversion', 'time_stop': 145, 'use_sma': False, 'use_atr': True, 'use_adx': True, 'use_ema': False, 'use_spike': True, 'rsi_required': False, 'edge_k': 0.6838286094427404, 'edge_cap': 0.27485477951764997, 'bull_strategy': 'breakout', 'bull_bb_std_mult': 0.5515027478359125, 'bull_rsi_os': 9, 'bull_rsi_ob': 78, 'bull_adx_thresh': 19.55374424322709, 'bull_atr_min_pct': 0.002000639815773184, 'bull_atr_max_pct': 0.061577967323425034, 'bull_tp_mult': 2.9513136228809254, 'bull_tsl_mult': 0.4832509897563281, 'bull_time_stop': 215, 'bull_use_sma': False, 'bull_use_ema': True, 'bull_use_atr': False, 'bull_use_adx': True, 'bull_use_spike': False, 'bull_rsi_required': False, 'bear_strategy': 'mean_reversion', 'bear_bb_std_mult': 1.318117797955217, 'bear_rsi_os': 6, 'bear_rsi_ob': 69, 'bear_adx_thresh': 34.979779029511256, 'bear_atr_min_pct': 0.021211590124922106, 'bear_atr_max_pct': 0.06501006975489514, 'bear_tp_mult': 2.9905135632375304, 'bear_tsl_mult': 0.6719861817142705, 'bear_time_stop': 194, 'bear_use_sma': False, 'bear_use_ema': True, 'bear_use_atr': False, 'bear_use_adx': True, 'bear_use_spike': True, 'bear_rsi_required': True, 'sideways_strategy': 'breakout', 'sideways_bb_std_mult': 1.6135594367651769, 'sideways_rsi_os': 29, 'sideways_rsi_ob': 46, 'sideways_adx_thresh': 15.876068783925628, 'sideways_atr_min_pct': 0.006997921545731036, 'sideways_atr_max_pct': 0.06922104775921319, 'sideways_tp_mult': 1.5307657085129982, 'sideways_tsl_mult': 0.9528159597690155, 'sideways_time_stop': 299, 'sideways_use_sma': False, 'sideways_use_ema': True, 'sideways_use_atr': True, 'sideways_use_adx': False, 'sideways_use_spike': True, 'sideways_rsi_required': False}.
[I 2025-09-01 09:10:52,813] Trial 22 finished with values: [-1000000000.0, 1000000000.0] and parameters: {'p_sma': 25, 'p_std': 5, 'p_atr': 18, 'p_adx': 18, 'rsi_period': 74, 'ema1': 10, 'ema2': 30, 'slip_atr_k': 0.0803949810646521, 'slip_spread_k': 0.8439119727148474, 'spread_hl_frac': 0.022646621465318283, 'bb_std_mult': 1.6422529158815031, 'rsi_os': 36, 'rsi_ob': 68, 'vol_spike': 0.2968890923665284, 'adx_thresh': 10.227700503488458, 'atr_min_pct': 0.0022991118158540644, 'atr_max_pct': 0.07573224055353014, 'tp_mult': 1.2974275454960011, 'tsl_mult': 0.2109526585665458, 'strategy': 'mean_reversion', 'time_stop': 51, 'use_sma': False, 'use_atr': True, 'use_adx': False, 'use_ema': False, 'use_spike': False, 'rsi_required': False, 'edge_k': 0.6930080745307274, 'edge_cap': 0.5951540857832489, 'bull_strategy': 'breakout', 'bull_bb_std_mult': 1.9948610946306764, 'bull_rsi_os': 18, 'bull_rsi_ob': 60, 'bull_adx_thresh': 16.55455451549329, 'bull_atr_min_pct': 0.016295938906570512, 'bull_atr_max_pct': 0.06976062223432097, 'bull_tp_mult': 1.3208450051027107, 'bull_tsl_mult': 0.14443805949591904, 'bull_time_stop': 141, 'bull_use_sma': True, 'bull_use_ema': True, 'bull_use_atr': True, 'bull_use_adx': False, 'bull_use_spike': True, 'bull_rsi_required': False, 'bear_strategy': 'mean_reversion', 'bear_bb_std_mult': 2.3210555257661047, 'bear_rsi_os': 27, 'bear_rsi_ob': 75, 'bear_adx_thresh': 30.572453460413826, 'bear_atr_min_pct': 0.029859357977126244, 'bear_atr_max_pct': 0.04411665210063603, 'bear_tp_mult': 1.423511386145744, 'bear_tsl_mult': 0.4159392154643631, 'bear_time_stop': 67, 'bear_use_sma': False, 'bear_use_ema': True, 'bear_use_atr': False, 'bear_use_adx': True, 'bear_use_spike': False, 'bear_rsi_required': True, 'sideways_strategy': 'breakout', 'sideways_bb_std_mult': 1.5786588882603245, 'sideways_rsi_os': 31, 'sideways_rsi_ob': 50, 'sideways_adx_thresh': 16.871169290628195, 'sideways_atr_min_pct': 0.029800345750615704, 'sideways_atr_max_pct': 0.035431263108755065, 'sideways_tp_mult': 1.6499017891018861, 'sideways_tsl_mult': 0.619501624968134, 'sideways_time_stop': 297, 'sideways_use_sma': True, 'sideways_use_ema': True, 'sideways_use_atr': False, 'sideways_use_adx': True, 'sideways_use_spike': False, 'sideways_rsi_required': False}.
[I 2025-09-01 09:10:53,519] Trial 21 finished with values: [-1000000000.0, 1000000000.0] and parameters: {'p_sma': 26, 'p_std': 27, 'p_atr': 18, 'p_adx': 30, 'rsi_period': 33, 'ema1': 10, 'ema2': 37, 'slip_atr_k': 0.07606372576469456, 'slip_spread_k': 0.8454635335698253, 'spread_hl_frac': 0.022969401462614565, 'bb_std_mult': 1.5955555671972106, 'rsi_os': 36, 'rsi_ob': 68, 'vol_spike': 0.29637437784393195, 'adx_thresh': 10.322102059104834, 'atr_min_pct': 0.014504467500202635, 'atr_max_pct': 0.07280286368035047, 'tp_mult': 1.2974598680895182, 'tsl_mult': 0.18681747461804643, 'strategy': 'mean_reversion', 'time_stop': 50, 'use_sma': False, 'use_atr': True, 'use_adx': False, 'use_ema': False, 'use_spike': False, 'rsi_required': False, 'edge_k': 0.7144884076507787, 'edge_cap': 0.5722291722142598, 'bull_strategy': 'breakout', 'bull_bb_std_mult': 1.8935265947668007, 'bull_rsi_os': 21, 'bull_rsi_ob': 60, 'bull_adx_thresh': 15.67436289635664, 'bull_atr_min_pct': 0.015937802489692975, 'bull_atr_max_pct': 0.06843554581529322, 'bull_tp_mult': 1.341680554905224, 'bull_tsl_mult': 0.13240798856037916, 'bull_time_stop': 140, 'bull_use_sma': True, 'bull_use_ema': True, 'bull_use_atr': True, 'bull_use_adx': False, 'bull_use_spike': True, 'bull_rsi_required': False, 'bear_strategy': 'mean_reversion', 'bear_bb_std_mult': 2.3246715241151765, 'bear_rsi_os': 29, 'bear_rsi_ob': 74, 'bear_adx_thresh': 29.857040611669166, 'bear_atr_min_pct': 0.01383032912195456, 'bear_atr_max_pct': 0.04434958024857798, 'bear_tp_mult': 1.4591281271094063, 'bear_tsl_mult': 0.4160203895879718, 'bear_time_stop': 61, 'bear_use_sma': False, 'bear_use_ema': True, 'bear_use_atr': False, 'bear_use_adx': True, 'bear_use_spike': False, 'bear_rsi_required': True, 'sideways_strategy': 'breakout', 'sideways_bb_std_mult': 1.6335603796300775, 'sideways_rsi_os': 32, 'sideways_rsi_ob': 48, 'sideways_adx_thresh': 16.441180464114478, 'sideways_atr_min_pct': 0.028341904709519028, 'sideways_atr_max_pct': 0.03196545869137376, 'sideways_tp_mult': 1.697060997192397, 'sideways_tsl_mult': 0.6232557569791315, 'sideways_time_stop': 200, 'sideways_use_sma': True, 'sideways_use_ema': True, 'sideways_use_atr': False, 'sideways_use_adx': True, 'sideways_use_spike': False, 'sideways_rsi_required': False}.
[I 2025-09-01 09:10:54,107] Trial 23 finished with values: [-1000000000.0, 1000000000.0] and parameters: {'p_sma': 25, 'p_std': 59, 'p_atr': 19, 'p_adx': 18, 'rsi_period': 74, 'ema1': 10, 'ema2': 30, 'slip_atr_k': 0.17358050380531523, 'slip_spread_k': 0.8298809980972672, 'spread_hl_frac': 0.022468095412363876, 'bb_std_mult': 1.5926347765401627, 'rsi_os': 22, 'rsi_ob': 51, 'vol_spike': 0.29665103537894755, 'adx_thresh': 8.91715779280154, 'atr_min_pct': 0.029988053249334123, 'atr_max_pct': 0.1187533686690871, 'tp_mult': 1.259969851950442, 'tsl_mult': 0.14929899612968334, 'strategy': 'mean_reversion', 'time_stop': 47, 'use_sma': False, 'use_atr': True, 'use_adx': False, 'use_ema': False, 'use_spike': False, 'rsi_required': False, 'edge_k': 1.233067996991832, 'edge_cap': 0.5140279065201538, 'bull_strategy': 'mean_reversion', 'bull_bb_std_mult': 2.0034087832778242, 'bull_rsi_os': 32, 'bull_rsi_ob': 45, 'bull_adx_thresh': 15.449042807978907, 'bull_atr_min_pct': 0.029966724869020512, 'bull_atr_max_pct': 0.07058703315332132, 'bull_tp_mult': 1.2953892642707314, 'bull_tsl_mult': 0.16409001604767265, 'bull_time_stop': 137, 'bull_use_sma': True, 'bull_use_ema': True, 'bull_use_atr': True, 'bull_use_adx': False, 'bull_use_spike': True, 'bull_rsi_required': False, 'bear_strategy': 'mean_reversion', 'bear_bb_std_mult': 2.2894722336566007, 'bear_rsi_os': 30, 'bear_rsi_ob': 76, 'bear_adx_thresh': 29.969456423905644, 'bear_atr_min_pct': 0.028734938744142145, 'bear_atr_max_pct': 0.042487143372102854, 'bear_tp_mult': 1.4644143061778718, 'bear_tsl_mult': 0.41416756705138846, 'bear_time_stop': 62, 'bear_use_sma': False, 'bear_use_ema': False, 'bear_use_atr': False, 'bear_use_adx': True, 'bear_use_spike': False, 'bear_rsi_required': True, 'sideways_strategy': 'breakout', 'sideways_bb_std_mult': 1.5061505916799618, 'sideways_rsi_os': 55, 'sideways_rsi_ob': 45, 'sideways_adx_thresh': 17.676439092377183, 'sideways_atr_min_pct': 0.028549517695776405, 'sideways_atr_max_pct': 0.0922134180431996, 'sideways_tp_mult': 1.6624220945735202, 'sideways_tsl_mult': 0.6165215315980987, 'sideways_time_stop': 205, 'sideways_use_sma': True, 'sideways_use_ema': True, 'sideways_use_atr': False, 'sideways_use_adx': True, 'sideways_use_spike': False, 'sideways_rsi_required': False}.
[I 2025-09-01 09:10:54,375] Trial 24 finished with values: [-1000000000.0, 1000000000.0] and parameters: {'p_sma': 26, 'p_std': 27, 'p_atr': 23, 'p_adx': 18, 'rsi_period': 72, 'ema1': 10, 'ema2': 34, 'slip_atr_k': 0.16773290667440305, 'slip_spread_k': 0.8395509389950095, 'spread_hl_frac': 0.02143831907565081, 'bb_std_mult': 0.5012738644065498, 'rsi_os': 35, 'rsi_ob': 89, 'vol_spike': 0.2731531617288187, 'adx_thresh': 15.634628123287435, 'atr_min_pct': 0.007191434379038145, 'atr_max_pct': 0.11487491799456055, 'tp_mult': 2.2120329538964767, 'tsl_mult': 0.6229400596593044, 'strategy': 'mean_reversion', 'time_stop': 46, 'use_sma': False, 'use_atr': True, 'use_adx': False, 'use_ema': False, 'use_spike': False, 'rsi_required': False, 'edge_k': 0.33115896676434875, 'edge_cap': 0.4269476751634173, 'bull_strategy': 'mean_reversion', 'bull_bb_std_mult': 2.0270970552470358, 'bull_rsi_os': 29, 'bull_rsi_ob': 60, 'bull_adx_thresh': 15.62815570410157, 'bull_atr_min_pct': 0.01683828158380389, 'bull_atr_max_pct': 0.1303623235105095, 'bull_tp_mult': 1.3814899447018776, 'bull_tsl_mult': 0.14324100945525015, 'bull_time_stop': 137, 'bull_use_sma': True, 'bull_use_ema': True, 'bull_use_atr': True, 'bull_use_adx': False, 'bull_use_spike': True, 'bull_rsi_required': False, 'bear_strategy': 'breakout', 'bear_bb_std_mult': 2.7778084169519444, 'bear_rsi_os': 49, 'bear_rsi_ob': 76, 'bear_adx_thresh': 30.787639759419864, 'bear_atr_min_pct': 0.029569131345839772, 'bear_atr_max_pct': 0.032500515729732005, 'bear_tp_mult': 1.490554924904667, 'bear_tsl_mult': 0.8940138631172876, 'bear_time_stop': 62, 'bear_use_sma': False, 'bear_use_ema': False, 'bear_use_atr': False, 'bear_use_adx': False, 'bear_use_spike': False, 'bear_rsi_required': True, 'sideways_strategy': 'mean_reversion', 'sideways_bb_std_mult': 2.8464207692348245, 'sideways_rsi_os': 54, 'sideways_rsi_ob': 85, 'sideways_adx_thresh': 22.620743695873852, 'sideways_atr_min_pct': 0.0036619693800835143, 'sideways_atr_max_pct': 0.0950996625236448, 'sideways_tp_mult': 1.801312449687288, 'sideways_tsl_mult': 0.865039543926013, 'sideways_time_stop': 156, 'sideways_use_sma': True, 'sideways_use_ema': True, 'sideways_use_atr': False, 'sideways_use_adx': True, 'sideways_use_spike': False, 'sideways_rsi_required': False}.
[I 2025-09-01 09:11:35,045] Trial 28 finished with values: [-1000000000.0, 1000000000.0] and parameters: {'p_sma': 11, 'p_std': 37, 'p_atr': 23, 'p_adx': 12, 'rsi_period': 24, 'ema1': 17, 'ema2': 54, 'slip_atr_k': 0.0018590357771275934, 'slip_spread_k': 0.6225625277014749, 'spread_hl_frac': 0.033886271621269226, 'bb_std_mult': 3.5990221330465992, 'rsi_os': 46, 'rsi_ob': 60, 'vol_spike': 0.17680499680268075, 'adx_thresh': 15.675575216868985, 'atr_min_pct': 0.016183005129739365, 'atr_max_pct': 0.12727262129040165, 'tp_mult': 1.7617015818408128, 'tsl_mult': 0.9300866261862584, 'strategy': 'breakout', 'time_stop': 282, 'use_sma': False, 'use_atr': False, 'use_adx': True, 'use_ema': True, 'use_spike': False, 'rsi_required': True, 'edge_k': 0.9637666920527316, 'edge_cap': 0.3666924234355794, 'bull_strategy': 'mean_reversion', 'bull_bb_std_mult': 2.2666391398549344, 'bull_rsi_os': 43, 'bull_rsi_ob': 95, 'bull_adx_thresh': 9.369626847213981, 'bull_atr_min_pct': 0.013462814796849977, 'bull_atr_max_pct': 0.10504205180897822, 'bull_tp_mult': 1.5590473346570421, 'bull_tsl_mult': 0.2858563202022602, 'bull_time_stop': 253, 'bull_use_sma': False, 'bull_use_ema': True, 'bull_use_atr': False, 'bull_use_adx': False, 'bull_use_spike': True, 'bull_rsi_required': True, 'bear_strategy': 'breakout', 'bear_bb_std_mult': 3.0977516834456194, 'bear_rsi_os': 18, 'bear_rsi_ob': 85, 'bear_adx_thresh': 21.78244828871955, 'bear_atr_min_pct': 0.026298723287680084, 'bear_atr_max_pct': 0.12811556963706777, 'bear_tp_mult': 2.0826790059764373, 'bear_tsl_mult': 0.5788960528422287, 'bear_time_stop': 107, 'bear_use_sma': True, 'bear_use_ema': False, 'bear_use_atr': True, 'bear_use_adx': False, 'bear_use_spike': True, 'bear_rsi_required': False, 'sideways_strategy': 'mean_reversion', 'sideways_bb_std_mult': 2.971304326669598, 'sideways_rsi_os': 7, 'sideways_rsi_ob': 80, 'sideways_adx_thresh': 9.054280624018098, 'sideways_atr_min_pct': 0.00975782965213664, 'sideways_atr_max_pct': 0.013264211868741743, 'sideways_tp_mult': 1.3156401501862744, 'sideways_tsl_mult': 0.126702577810287, 'sideways_time_stop': 89, 'sideways_use_sma': False, 'sideways_use_ema': False, 'sideways_use_atr': True, 'sideways_use_adx': False, 'sideways_use_spike': False, 'sideways_rsi_required': False}.
[I 2025-09-01 09:11:35,050] Trial 27 finished with values: [-0.07054790357937513, 0.07034486257045562] and parameters: {'p_sma': 11, 'p_std': 47, 'p_atr': 22, 'p_adx': 12, 'rsi_period': 26, 'ema1': 8, 'ema2': 32, 'slip_atr_k': 0.012684580154706845, 'slip_spread_k': 0.2916269733136371, 'spread_hl_frac': 0.03720791002555616, 'bb_std_mult': 2.2981134344854306, 'rsi_os': 47, 'rsi_ob': 91, 'vol_spike': 0.18035872114065957, 'adx_thresh': 15.425511080639055, 'atr_min_pct': 0.004940163276434465, 'atr_max_pct': 0.13477220223489625, 'tp_mult': 2.1810386619534463, 'tsl_mult': 0.9890886565263963, 'strategy': 'breakout', 'time_stop': 266, 'use_sma': False, 'use_atr': False, 'use_adx': True, 'use_ema': True, 'use_spike': False, 'rsi_required': True, 'edge_k': 0.2379259617784954, 'edge_cap': 0.41680522617485505, 'bull_strategy': 'mean_reversion', 'bull_bb_std_mult': 1.1975372682451817, 'bull_rsi_os': 27, 'bull_rsi_ob': 95, 'bull_adx_thresh': 10.036302560237363, 'bull_atr_min_pct': 0.013210992566340401, 'bull_atr_max_pct': 0.1350524092803554, 'bull_tp_mult': 1.5858475010090523, 'bull_tsl_mult': 0.25857808313644715, 'bull_time_stop': 264, 'bull_use_sma': False, 'bull_use_ema': True, 'bull_use_atr': False, 'bull_use_adx': False, 'bull_use_spike': True, 'bull_rsi_required': True, 'bear_strategy': 'breakout', 'bear_bb_std_mult': 2.9696018080948305, 'bear_rsi_os': 54, 'bear_rsi_ob': 85, 'bear_adx_thresh': 20.440651579883298, 'bear_atr_min_pct': 0.0007272720579888352, 'bear_atr_max_pct': 0.01398991775668837, 'bear_tp_mult': 2.092639160854652, 'bear_tsl_mult': 0.9113356942403192, 'bear_time_stop': 108, 'bear_use_sma': True, 'bear_use_ema': False, 'bear_use_atr': True, 'bear_use_adx': False, 'bear_use_spike': True, 'bear_rsi_required': False, 'sideways_strategy': 'mean_reversion', 'sideways_bb_std_mult': 2.890375287351681, 'sideways_rsi_os': 14, 'sideways_rsi_ob': 84, 'sideways_adx_thresh': 22.161615302272413, 'sideways_atr_min_pct': 0.0035657350722335234, 'sideways_atr_max_pct': 0.09878476090043256, 'sideways_tp_mult': 1.8993393130681895, 'sideways_tsl_mult': 0.8548989794929983, 'sideways_time_stop': 154, 'sideways_use_sma': False, 'sideways_use_ema': False, 'sideways_use_atr': True, 'sideways_use_adx': False, 'sideways_use_spike': False, 'sideways_rsi_required': False}.
