[I 2025-09-01 09:57:44,283] Trial 313 finished with values: [-1000000000.0, 1000000000.0] and parameters: {'p_sma': 18, 'p_std': 40, 'p_atr': 18, 'p_adx': 23, 'rsi_period': 31, 'ema1': 19, 'ema2': 16, 'slip_atr_k': 0.07598259139153662, 'slip_spread_k': 0.5963088683730492, 'spread_hl_frac': 0.03395834132620253, 'bb_std_mult': 1.81432616428721, 'rsi_os': 41, 'rsi_ob': 68, 'vol_spike': 0.13893791466717048, 'adx_thresh': 32.535903404969986, 'atr_min_pct': 0.02331976351746233, 'atr_max_pct': 0.14830927291333793, 'tp_mult': 1.139730840795401, 'tsl_mult': 0.09989731051429179, 'strategy': 'breakout', 'time_stop': 242, 'use_sma': True, 'use_atr': False, 'use_adx': True, 'use_ema': True, 'use_spike': True, 'rsi_required': False, 'edge_k': 1.2750087988435228, 'edge_cap': 0.5231215875448759, 'bull_strategy': 'mean_reversion', 'bull_bb_std_mult': 2.4363069477645856, 'bull_rsi_os': 36, 'bull_rsi_ob': 47, 'bull_adx_thresh': 16.23621285802135, 'bull_atr_min_pct': 0.0012386979918955297, 'bull_atr_max_pct': 0.06961296545656039, 'bull_tp_mult': 2.402929115398874, 'bull_tsl_mult': 0.41950819878988266, 'bull_time_stop': 151, 'bull_use_sma': True, 'bull_use_ema': False, 'bull_use_atr': True, 'bull_use_adx': False, 'bull_use_spike': True, 'bull_rsi_required': False, 'bear_strategy': 'mean_reversion', 'bear_bb_std_mult': 1.1300080912207484, 'bear_rsi_os': 11, 'bear_rsi_ob': 70, 'bear_adx_thresh': 23.77760874458463, 'bear_atr_min_pct': 0.005439508873555051, 'bear_atr_max_pct': 0.09223519656357562, 'bear_tp_mult': 1.7497493455422615, 'bear_tsl_mult': 0.8283271192297335, 'bear_time_stop': 179, 'bear_use_sma': True, 'bear_use_ema': False, 'bear_use_atr': True, 'bear_use_adx': True, 'bear_use_spike': True, 'bear_rsi_required': False, 'sideways_strategy': 'breakout', 'sideways_bb_std_mult': 0.9278239383097299, 'sideways_rsi_os': 55, 'sideways_rsi_ob': 93, 'sideways_adx_thresh': 30.309422146787504, 'sideways_atr_min_pct': 0.01015270274262799, 'sideways_atr_max_pct': 0.0727371287565569, 'sideways_tp_mult': 2.423681113337859, 'sideways_tsl_mult': 0.4182214156201761, 'sideways_time_stop': 26, 'sideways_use_sma': True, 'sideways_use_ema': False, 'sideways_use_atr': False, 'sideways_use_adx': False, 'sideways_use_spike': True, 'sideways_rsi_required': False}.
[I 2025-09-01 09:57:44,634] Trial 314 finished with values: [-1000000000.0, 1000000000.0] and parameters: {'p_sma': 39, 'p_std': 40, 'p_atr': 18, 'p_adx': 23, 'rsi_period': 77, 'ema1': 19, 'ema2': 16, 'slip_atr_k': 0.060683775717961214, 'slip_spread_k': 0.5944914927246218, 'spread_hl_frac': 0.035656501647743546, 'bb_std_mult': 1.8011523143854204, 'rsi_os': 42, 'rsi_ob': 68, 'vol_spike': 0.0648484372171669, 'adx_thresh': 23.9570344199933, 'atr_min_pct': 0.0005720650491375517, 'atr_max_pct': 0.11687073666682746, 'tp_mult': 2.895459400165708, 'tsl_mult': 0.7107036012607599, 'strategy': 'breakout', 'time_stop': 244, 'use_sma': True, 'use_atr': False, 'use_adx': True, 'use_ema': True, 'use_spike': True, 'rsi_required': False, 'edge_k': 0.8963295422871461, 'edge_cap': 0.5243221898917941, 'bull_strategy': 'mean_reversion', 'bull_bb_std_mult': 2.6178445850063614, 'bull_rsi_os': 25, 'bull_rsi_ob': 59, 'bull_adx_thresh': 31.317957931233238, 'bull_atr_min_pct': 0.00888254232615611, 'bull_atr_max_pct': 0.10709455014267658, 'bull_tp_mult': 2.843119085172895, 'bull_tsl_mult': 0.4207364054342135, 'bull_time_stop': 150, 'bull_use_sma': True, 'bull_use_ema': False, 'bull_use_atr': True, 'bull_use_adx': False, 'bull_use_spike': True, 'bull_rsi_required': False, 'bear_strategy': 'mean_reversion', 'bear_bb_std_mult': 1.09083934500684, 'bear_rsi_os': 29, 'bear_rsi_ob': 78, 'bear_adx_thresh': 24.031586823959113, 'bear_atr_min_pct': 0.005555181536918505, 'bear_atr_max_pct': 0.060771857776322685, 'bear_tp_mult': 1.6882680072008789, 'bear_tsl_mult': 0.15190189910883944, 'bear_time_stop': 181, 'bear_use_sma': True, 'bear_use_ema': False, 'bear_use_atr': True, 'bear_use_adx': True, 'bear_use_spike': True, 'bear_rsi_required': False, 'sideways_strategy': 'breakout', 'sideways_bb_std_mult': 1.002483259277704, 'sideways_rsi_os': 55, 'sideways_rsi_ob': 50, 'sideways_adx_thresh': 5.6137691792936675, 'sideways_atr_min_pct': 0.010071959610096399, 'sideways_atr_max_pct': 0.07376160132351856, 'sideways_tp_mult': 2.5421019120751196, 'sideways_tsl_mult': 0.42713398597108443, 'sideways_time_stop': 64, 'sideways_use_sma': True, 'sideways_use_ema': False, 'sideways_use_atr': False, 'sideways_use_adx': False, 'sideways_use_spike': True, 'sideways_rsi_required': False}.
[I 2025-09-01 09:57:45,605] Trial 319 finished with values: [-1000000000.0, 1000000000.0] and parameters: {'p_sma': 16, 'p_std': 46, 'p_atr': 20, 'p_adx': 7, 'rsi_period': 18, 'ema1': 22, 'ema2': 25, 'slip_atr_k': 0.0446824273047655, 'slip_spread_k': 0.27839909686396447, 'spread_hl_frac': 0.039315576645319705, 'bb_std_mult': 2.2944110016235193, 'rsi_os': 54, 'rsi_ob': 74, 'vol_spike': 0.1451827897807701, 'adx_thresh': 31.322153286862807, 'atr_min_pct': 0.022536305196444718, 'atr_max_pct': 0.03993768139596469, 'tp_mult': 1.1264084172887214, 'tsl_mult': 0.1637561793521401, 'strategy': 'mean_reversion', 'time_stop': 267, 'use_sma': False, 'use_atr': True, 'use_adx': False, 'use_ema': True, 'use_spike': False, 'rsi_required': True, 'edge_k': 0.9292173973954561, 'edge_cap': 0.6100192941700452, 'bull_strategy': 'mean_reversion', 'bull_bb_std_mult': 0.6468510539496868, 'bull_rsi_os': 32, 'bull_rsi_ob': 46, 'bull_adx_thresh': 11.402468540802904, 'bull_atr_min_pct': 0.02986168752598673, 'bull_atr_max_pct': 0.017734997919453828, 'bull_tp_mult': 2.7831683418760673, 'bull_tsl_mult': 0.8576771555728393, 'bull_time_stop': 164, 'bull_use_sma': False, 'bull_use_ema': True, 'bull_use_atr': True, 'bull_use_adx': True, 'bull_use_spike': False, 'bull_rsi_required': True, 'bear_strategy': 'mean_reversion', 'bear_bb_std_mult': 0.8642037733627711, 'bear_rsi_os': 19, 'bear_rsi_ob': 72, 'bear_adx_thresh': 28.851186203126684, 'bear_atr_min_pct': 0.01961133373860479, 'bear_atr_max_pct': 0.03966994858484339, 'bear_tp_mult': 2.469067096368869, 'bear_tsl_mult': 0.42078844089890793, 'bear_time_stop': 280, 'bear_use_sma': False, 'bear_use_ema': False, 'bear_use_atr': False, 'bear_use_adx': False, 'bear_use_spike': False, 'bear_rsi_required': True, 'sideways_strategy': 'mean_reversion', 'sideways_bb_std_mult': 2.5419028271663464, 'sideways_rsi_os': 53, 'sideways_rsi_ob': 53, 'sideways_adx_thresh': 22.542433669098955, 'sideways_atr_min_pct': 0.004947927108460665, 'sideways_atr_max_pct': 0.06920246789549014, 'sideways_tp_mult': 2.5991294470709123, 'sideways_tsl_mult': 0.14838152691277962, 'sideways_time_stop': 77, 'sideways_use_sma': True, 'sideways_use_ema': False, 'sideways_use_atr': False, 'sideways_use_adx': True, 'sideways_use_spike': False, 'sideways_rsi_required': True}.
[I 2025-09-01 09:58:24,501] Trial 317 finished with values: [-0.04104325158978661, 0.04082200166475187] and parameters: {'p_sma': 37, 'p_std': 46, 'p_atr': 18, 'p_adx': 14, 'rsi_period': 51, 'ema1': 18, 'ema2': 16, 'slip_atr_k': 0.07638007109759942, 'slip_spread_k': 0.5894372224562031, 'spread_hl_frac': 0.039308441585539054, 'bb_std_mult': 1.3826016083008938, 'rsi_os': 42, 'rsi_ob': 89, 'vol_spike': 0.1454860398951277, 'adx_thresh': 31.37857520535156, 'atr_min_pct': 0.003063863812142669, 'atr_max_pct': 0.14915331669897208, 'tp_mult': 1.115662256723719, 'tsl_mult': 0.003909629628237321, 'strategy': 'breakout', 'time_stop': 241, 'use_sma': True, 'use_atr': False, 'use_adx': True, 'use_ema': True, 'use_spike': True, 'rsi_required': False, 'edge_k': 1.8073425740752682, 'edge_cap': 0.052710538713030164, 'bull_strategy': 'mean_reversion', 'bull_bb_std_mult': 2.8612220017935943, 'bull_rsi_os': 48, 'bull_rsi_ob': 46, 'bull_adx_thresh': 8.855285386634629, 'bull_atr_min_pct': 0.001215357893804524, 'bull_atr_max_pct': 0.015996429644894575, 'bull_tp_mult': 2.7932461828574993, 'bull_tsl_mult': 0.4070177405464924, 'bull_time_stop': 223, 'bull_use_sma': True, 'bull_use_ema': False, 'bull_use_atr': True, 'bull_use_adx': False, 'bull_use_spike': False, 'bull_rsi_required': False, 'bear_strategy': 'mean_reversion', 'bear_bb_std_mult': 1.1432206717612723, 'bear_rsi_os': 54, 'bear_rsi_ob': 72, 'bear_adx_thresh': 24.74786365126077, 'bear_atr_min_pct': 0.007507179243207077, 'bear_atr_max_pct': 0.12499482249881122, 'bear_tp_mult': 2.7590358044678975, 'bear_tsl_mult': 0.8181284981022174, 'bear_time_stop': 280, 'bear_use_sma': True, 'bear_use_ema': False, 'bear_use_atr': True, 'bear_use_adx': False, 'bear_use_spike': True, 'bear_rsi_required': True, 'sideways_strategy': 'mean_reversion', 'sideways_bb_std_mult': 2.0838390044344863, 'sideways_rsi_os': 53, 'sideways_rsi_ob': 53, 'sideways_adx_thresh': 30.3697524657583, 'sideways_atr_min_pct': 0.008608944923051469, 'sideways_atr_max_pct': 0.07326659145210465, 'sideways_tp_mult': 1.5698487123026639, 'sideways_tsl_mult': 0.40480445815519644, 'sideways_time_stop': 116, 'sideways_use_sma': True, 'sideways_use_ema': False, 'sideways_use_atr': False, 'sideways_use_adx': False, 'sideways_use_spike': False, 'sideways_rsi_required': False}.
[I 2025-09-01 09:58:25,061] Trial 318 finished with values: [-0.09554689162834806, 0.09528189264134655] and parameters: {'p_sma': 16, 'p_std': 9, 'p_atr': 18, 'p_adx': 30, 'rsi_period': 18, 'ema1': 8, 'ema2': 16, 'slip_atr_k': 0.07704564653095711, 'slip_spread_k': 0.2773331833157784, 'spread_hl_frac': 0.028985026202084496, 'bb_std_mult': 2.324291277665452, 'rsi_os': 44, 'rsi_ob': 73, 'vol_spike': 0.11050440492464902, 'adx_thresh': 31.534230341153147, 'atr_min_pct': 0.008899908485930256, 'atr_max_pct': 0.1159275647468737, 'tp_mult': 1.1096421651959794, 'tsl_mult': 0.6652619112327833, 'strategy': 'breakout', 'time_stop': 114, 'use_sma': True, 'use_atr': True, 'use_adx': False, 'use_ema': True, 'use_spike': False, 'rsi_required': True, 'edge_k': 1.2821221957175741, 'edge_cap': 0.6069266344923498, 'bull_strategy': 'mean_reversion', 'bull_bb_std_mult': 0.6728683008320853, 'bull_rsi_os': 32, 'bull_rsi_ob': 59, 'bull_adx_thresh': 6.278679034956696, 'bull_atr_min_pct': 0.0012394536194708903, 'bull_atr_max_pct': 0.09703338337978896, 'bull_tp_mult': 1.9298148366113816, 'bull_tsl_mult': 0.05632388339383465, 'bull_time_stop': 201, 'bull_use_sma': True, 'bull_use_ema': False, 'bull_use_atr': True, 'bull_use_adx': False, 'bull_use_spike': False, 'bull_rsi_required': True, 'bear_strategy': 'mean_reversion', 'bear_bb_std_mult': 0.8608426541073677, 'bear_rsi_os': 54, 'bear_rsi_ob': 65, 'bear_adx_thresh': 29.37073336239156, 'bear_atr_min_pct': 0.01981181322490181, 'bear_atr_max_pct': 0.054272174945898324, 'bear_tp_mult': 1.514557132949431, 'bear_tsl_mult': 0.36597721985759757, 'bear_time_stop': 269, 'bear_use_sma': False, 'bear_use_ema': False, 'bear_use_atr': False, 'bear_use_adx': False, 'bear_use_spike': False, 'bear_rsi_required': True, 'sideways_strategy': 'mean_reversion', 'sideways_bb_std_mult': 2.7778379523860273, 'sideways_rsi_os': 16, 'sideways_rsi_ob': 61, 'sideways_adx_thresh': 24.7610035385643, 'sideways_atr_min_pct': 0.02487234134388202, 'sideways_atr_max_pct': 0.11217975215832937, 'sideways_tp_mult': 1.337889487631244, 'sideways_tsl_mult': 0.2680510558187602, 'sideways_time_stop': 74, 'sideways_use_sma': True, 'sideways_use_ema': False, 'sideways_use_atr': False, 'sideways_use_adx': True, 'sideways_use_spike': False, 'sideways_rsi_required': False}.
[I 2025-09-01 09:58:26,108] Trial 320 finished with values: [-1000000000.0, 1000000000.0] and parameters: {'p_sma': 50, 'p_std': 47, 'p_atr': 20, 'p_adx': 25, 'rsi_period': 18, 'ema1': 18, 'ema2': 15, 'slip_atr_k': 0.04568233831443274, 'slip_spread_k': 0.2864586774477457, 'spread_hl_frac': 0.025624787887240347, 'bb_std_mult': 2.3121261681012886, 'rsi_os': 44, 'rsi_ob': 74, 'vol_spike': 0.1458996864138255, 'adx_thresh': 31.401618573585505, 'atr_min_pct': 0.0050344771170160035, 'atr_max_pct': 0.09411695581530709, 'tp_mult': 1.1143182126699782, 'tsl_mult': 0.16771891690659002, 'strategy': 'mean_reversion', 'time_stop': 263, 'use_sma': False, 'use_atr': True, 'use_adx': False, 'use_ema': False, 'use_spike': False, 'rsi_required': True, 'edge_k': 0.11185156117535888, 'edge_cap': 0.171812233650659, 'bull_strategy': 'mean_reversion', 'bull_bb_std_mult': 1.3713454110810992, 'bull_rsi_os': 48, 'bull_rsi_ob': 46, 'bull_adx_thresh': 6.306360681412094, 'bull_atr_min_pct': 0.029915849887448283, 'bull_atr_max_pct': 0.01700565192438093, 'bull_tp_mult': 1.9632464387076993, 'bull_tsl_mult': 0.060879749374066705, 'bull_time_stop': 129, 'bull_use_sma': False, 'bull_use_ema': True, 'bull_use_atr': True, 'bull_use_adx': True, 'bull_use_spike': False, 'bull_rsi_required': True, 'bear_strategy': 'breakout', 'bear_bb_std_mult': 1.519057448385363, 'bear_rsi_os': 54, 'bear_rsi_ob': 57, 'bear_adx_thresh': 29.483236443905383, 'bear_atr_min_pct': 0.020010061683027616, 'bear_atr_max_pct': 0.053618721396937796, 'bear_tp_mult': 2.444180033624774, 'bear_tsl_mult': 0.4028952716698003, 'bear_time_stop': 294, 'bear_use_sma': False, 'bear_use_ema': False, 'bear_use_atr': False, 'bear_use_adx': False, 'bear_use_spike': False, 'bear_rsi_required': True, 'sideways_strategy': 'mean_reversion', 'sideways_bb_std_mult': 2.776035451967832, 'sideways_rsi_os': 16, 'sideways_rsi_ob': 89, 'sideways_adx_thresh': 6.45648578164807, 'sideways_atr_min_pct': 0.029969644456546325, 'sideways_atr_max_pct': 0.06970797476269654, 'sideways_tp_mult': 1.331221647218488, 'sideways_tsl_mult': 0.14784068973299613, 'sideways_time_stop': 5, 'sideways_use_sma': True, 'sideways_use_ema': True, 'sideways_use_atr': True, 'sideways_use_adx': True, 'sideways_use_spike': False, 'sideways_rsi_required': True}.
[I 2025-09-01 09:58:27,377] Trial 321 finished with values: [-0.07564522135519891, 0.07540444049523466] and parameters: {'p_sma': 47, 'p_std': 52, 'p_atr': 25, 'p_adx': 30, 'rsi_period': 19, 'ema1': 30, 'ema2': 15, 'slip_atr_k': 0.2124729245808744, 'slip_spread_k': 0.6192008521810732, 'spread_hl_frac': 0.025014405573402863, 'bb_std_mult': 1.4130981192256034, 'rsi_os': 43, 'rsi_ob': 72, 'vol_spike': 0.12043887863032557, 'adx_thresh': 21.281811849774908, 'atr_min_pct': 0.01594154875063332, 'atr_max_pct': 0.09379888817801893, 'tp_mult': 1.0684986000189627, 'tsl_mult': 0.010861610364295893, 'strategy': 'breakout', 'time_stop': 249, 'use_sma': True, 'use_atr': False, 'use_adx': False, 'use_ema': False, 'use_spike': True, 'rsi_required': True, 'edge_k': 1.1568051161622583, 'edge_cap': 0.5762511185324899, 'bull_strategy': 'mean_reversion', 'bull_bb_std_mult': 3.450048480896576, 'bull_rsi_os': 48, 'bull_rsi_ob': 49, 'bull_adx_thresh': 6.987939825281772, 'bull_atr_min_pct': 0.0014111646995046232, 'bull_atr_max_pct': 0.08819799812197561, 'bull_tp_mult': 2.649508805737767, 'bull_tsl_mult': 0.39754716892597164, 'bull_time_stop': 173, 'bull_use_sma': True, 'bull_use_ema': False, 'bull_use_atr': True, 'bull_use_adx': False, 'bull_use_spike': False, 'bull_rsi_required': True, 'bear_strategy': 'breakout', 'bear_bb_std_mult': 1.027356286355389, 'bear_rsi_os': 54, 'bear_rsi_ob': 76, 'bear_adx_thresh': 24.684035528536747, 'bear_atr_min_pct': 0.004418132286602526, 'bear_atr_max_pct': 0.032876568972036585, 'bear_tp_mult': 1.5404260759050585, 'bear_tsl_mult': 0.5626915404100504, 'bear_time_stop': 295, 'bear_use_sma': False, 'bear_use_ema': False, 'bear_use_atr': True, 'bear_use_adx': False, 'bear_use_spike': False, 'bear_rsi_required': True, 'sideways_strategy': 'mean_reversion', 'sideways_bb_std_mult': 2.0820803593600137, 'sideways_rsi_os': 52, 'sideways_rsi_ob': 67, 'sideways_adx_thresh': 23.29576265591246, 'sideways_atr_min_pct': 0.008825892970130103, 'sideways_atr_max_pct': 0.1186772420299274, 'sideways_tp_mult': 1.3543710424380655, 'sideways_tsl_mult': 0.25768524408620164, 'sideways_time_stop': 180, 'sideways_use_sma': True, 'sideways_use_ema': True, 'sideways_use_atr': True, 'sideways_use_adx': True, 'sideways_use_spike': False, 'sideways_rsi_required': False}.
[I 2025-09-01 09:59:05,331] Trial 325 finished with values: [-1000000000.0, 1000000000.0] and parameters: {'p_sma': 20, 'p_std': 37, 'p_atr': 19, 'p_adx': 26, 'rsi_period': 27, 'ema1': 18, 'ema2': 17, 'slip_atr_k': 0.06793844101220986, 'slip_spread_k': 0.6784026820233581, 'spread_hl_frac': 0.027584369667349222, 'bb_std_mult': 1.5228626280272575, 'rsi_os': 7, 'rsi_ob': 66, 'vol_spike': 0.12581732208275875, 'adx_thresh': 18.6543174184262, 'atr_min_pct': 0.004024450561931564, 'atr_max_pct': 0.13522468339172472, 'tp_mult': 1.9838473245822839, 'tsl_mult': 0.6162479079838478, 'strategy': 'breakout', 'time_stop': 37, 'use_sma': True, 'use_atr': False, 'use_adx': False, 'use_ema': True, 'use_spike': True, 'rsi_required': True, 'edge_k': 0.43858582560689985, 'edge_cap': 0.7271649996012793, 'bull_strategy': 'mean_reversion', 'bull_bb_std_mult': 1.4683987815776487, 'bull_rsi_os': 40, 'bull_rsi_ob': 89, 'bull_adx_thresh': 20.09010917806277, 'bull_atr_min_pct': 0.028621434813698714, 'bull_atr_max_pct': 0.13246158100399966, 'bull_tp_mult': 2.722434558448417, 'bull_tsl_mult': 0.48119421804777684, 'bull_time_stop': 283, 'bull_use_sma': True, 'bull_use_ema': False, 'bull_use_atr': False, 'bull_use_adx': False, 'bull_use_spike': False, 'bull_rsi_required': True, 'bear_strategy': 'mean_reversion', 'bear_bb_std_mult': 0.916154178791256, 'bear_rsi_os': 51, 'bear_rsi_ob': 69, 'bear_adx_thresh': 22.835381654441214, 'bear_atr_min_pct': 0.0032632638666777567, 'bear_atr_max_pct': 0.01574988124123522, 'bear_tp_mult': 1.2647317429307674, 'bear_tsl_mult': 0.4426978067674339, 'bear_time_stop': 84, 'bear_use_sma': True, 'bear_use_ema': False, 'bear_use_atr': True, 'bear_use_adx': False, 'bear_use_spike': False, 'bear_rsi_required': False, 'sideways_strategy': 'mean_reversion', 'sideways_bb_std_mult': 3.181136739665898, 'sideways_rsi_os': 49, 'sideways_rsi_ob': 78, 'sideways_adx_thresh': 33.22154326329414, 'sideways_atr_min_pct': 0.009553282658433759, 'sideways_atr_max_pct': 0.05163941554728214, 'sideways_tp_mult': 2.3538329456517446, 'sideways_tsl_mult': 0.6616588545622729, 'sideways_time_stop': 242, 'sideways_use_sma': False, 'sideways_use_ema': False, 'sideways_use_atr': False, 'sideways_use_adx': True, 'sideways_use_spike': False, 'sideways_rsi_required': False}.
[I 2025-09-01 09:59:06,306] Trial 322 finished with values: [-1000000000.0, 1000000000.0] and parameters: {'p_sma': 47, 'p_std': 10, 'p_atr': 19, 'p_adx': 28, 'rsi_period': 19, 'ema1': 18, 'ema2': 15, 'slip_atr_k': 0.05728002722852721, 'slip_spread_k': 0.6766224103168893, 'spread_hl_frac': 0.015366920323149874, 'bb_std_mult': 1.6278856907313608, 'rsi_os': 44, 'rsi_ob': 81, 'vol_spike': 0.2713584833548215, 'adx_thresh': 17.719463029634376, 'atr_min_pct': 0.006058510575030081, 'atr_max_pct': 0.09399638686686262, 'tp_mult': 1.3199448636358082, 'tsl_mult': 0.7396864958246757, 'strategy': 'mean_reversion', 'time_stop': 184, 'use_sma': False, 'use_atr': True, 'use_adx': False, 'use_ema': False, 'use_spike': False, 'rsi_required': True, 'edge_k': 1.6665715750018575, 'edge_cap': 0.5716378766331539, 'bull_strategy': 'mean_reversion', 'bull_bb_std_mult': 1.4879788276107082, 'bull_rsi_os': 43, 'bull_rsi_ob': 89, 'bull_adx_thresh': 7.052426525138738, 'bull_atr_min_pct': 0.0027824080583920413, 'bull_atr_max_pct': 0.08910386649142746, 'bull_tp_mult': 2.7448688187025447, 'bull_tsl_mult': 0.47686007879509, 'bull_time_stop': 174, 'bull_use_sma': True, 'bull_use_ema': True, 'bull_use_atr': True, 'bull_use_adx': False, 'bull_use_spike': False, 'bull_rsi_required': True, 'bear_strategy': 'breakout', 'bear_bb_std_mult': 0.9946360026158708, 'bear_rsi_os': 17, 'bear_rsi_ob': 65, 'bear_adx_thresh': 29.852448601703642, 'bear_atr_min_pct': 0.006359438709999723, 'bear_atr_max_pct': 0.05278145342868285, 'bear_tp_mult': 1.2698004185095042, 'bear_tsl_mult': 0.946891694784046, 'bear_time_stop': 165, 'bear_use_sma': False, 'bear_use_ema': False, 'bear_use_atr': False, 'bear_use_adx': False, 'bear_use_spike': False, 'bear_rsi_required': False, 'sideways_strategy': 'mean_reversion', 'sideways_bb_std_mult': 0.769793758671224, 'sideways_rsi_os': 52, 'sideways_rsi_ob': 91, 'sideways_adx_thresh': 23.40624726006105, 'sideways_atr_min_pct': 0.009628509598944377, 'sideways_atr_max_pct': 0.02075729290967565, 'sideways_tp_mult': 1.4799025300413304, 'sideways_tsl_mult': 0.6277013268774618, 'sideways_time_stop': 33, 'sideways_use_sma': True, 'sideways_use_ema': True, 'sideways_use_atr': True, 'sideways_use_adx': True, 'sideways_use_spike': False, 'sideways_rsi_required': True}.
