[I 2025-09-01 09:47:18,103] Trial 251 finished with values: [-1000000000.0, 1000000000.0] and parameters: {'p_sma': 17, 'p_std': 17, 'p_atr': 18, 'p_adx': 22, 'rsi_period': 47, 'ema1': 28, 'ema2': 14, 'slip_atr_k': 0.0630482344708955, 'slip_spread_k': 0.6325434461143383, 'spread_hl_frac': 0.03470155584717262, 'bb_std_mult': 2.9340965826290772, 'rsi_os': 16, 'rsi_ob': 69, 'vol_spike': 0.2008997096531837, 'adx_thresh': 9.843484113966738, 'atr_min_pct': 0.01660205077493448, 'atr_max_pct': 0.12399707976512726, 'tp_mult': 2.462903336117166, 'tsl_mult': 0.6760015700044166, 'strategy': 'breakout', 'time_stop': 240, 'use_sma': True, 'use_atr': False, 'use_adx': True, 'use_ema': True, 'use_spike': True, 'rsi_required': True, 'edge_k': 1.2054245952758753, 'edge_cap': 0.5023299875232636, 'bull_strategy': 'mean_reversion', 'bull_bb_std_mult': 3.488791774163265, 'bull_rsi_os': 47, 'bull_rsi_ob': 48, 'bull_adx_thresh': 11.308037106341933, 'bull_atr_min_pct': 0.02691941417405002, 'bull_atr_max_pct': 0.07994414773914418, 'bull_tp_mult': 2.920434347892117, 'bull_tsl_mult': 0.39139940295771797, 'bull_time_stop': 219, 'bull_use_sma': True, 'bull_use_ema': False, 'bull_use_atr': True, 'bull_use_adx': False, 'bull_use_spike': False, 'bull_rsi_required': True, 'bear_strategy': 'mean_reversion', 'bear_bb_std_mult': 0.910945183009327, 'bear_rsi_os': 55, 'bear_rsi_ob': 76, 'bear_adx_thresh': 24.53541497768614, 'bear_atr_min_pct': 0.002838723608131858, 'bear_atr_max_pct': 0.05063395638759939, 'bear_tp_mult': 1.2160676978166518, 'bear_tsl_mult': 0.5496173971734205, 'bear_time_stop': 281, 'bear_use_sma': True, 'bear_use_ema': False, 'bear_use_atr': True, 'bear_use_adx': False, 'bear_use_spike': True, 'bear_rsi_required': True, 'sideways_strategy': 'mean_reversion', 'sideways_bb_std_mult': 1.4346284465887973, 'sideways_rsi_os': 8, 'sideways_rsi_ob': 92, 'sideways_adx_thresh': 18.652771081598956, 'sideways_atr_min_pct': 0.010456513045967954, 'sideways_atr_max_pct': 0.010001289826762683, 'sideways_tp_mult': 2.5607392419907367, 'sideways_tsl_mult': 0.4823809416852744, 'sideways_time_stop': 23, 'sideways_use_sma': True, 'sideways_use_ema': False, 'sideways_use_atr': False, 'sideways_use_adx': True, 'sideways_use_spike': False, 'sideways_rsi_required': False}.
[I 2025-09-01 09:47:18,523] Trial 252 finished with values: [-0.07956875393769369, 0.07935921532281975] and parameters: {'p_sma': 17, 'p_std': 17, 'p_atr': 18, 'p_adx': 22, 'rsi_period': 21, 'ema1': 11, 'ema2': 11, 'slip_atr_k': 0.06519262233474002, 'slip_spread_k': 0.6363317743846529, 'spread_hl_frac': 0.0285325285913838, 'bb_std_mult': 2.0865854505371053, 'rsi_os': 42, 'rsi_ob': 69, 'vol_spike': 0.08969557923847372, 'adx_thresh': 9.867185711249517, 'atr_min_pct': 0.016558810554372576, 'atr_max_pct': 0.1012160705944401, 'tp_mult': 1.1200442964582036, 'tsl_mult': 0.6810774397703534, 'strategy': 'breakout', 'time_stop': 239, 'use_sma': True, 'use_atr': False, 'use_adx': True, 'use_ema': True, 'use_spike': True, 'rsi_required': True, 'edge_k': 1.2144120509395426, 'edge_cap': 0.5037269038798027, 'bull_strategy': 'mean_reversion', 'bull_bb_std_mult': 3.492486129055614, 'bull_rsi_os': 45, 'bull_rsi_ob': 48, 'bull_adx_thresh': 5.607769297509531, 'bull_atr_min_pct': 0.0002926018796921196, 'bull_atr_max_pct': 0.08096406713211719, 'bull_tp_mult': 2.957828437737193, 'bull_tsl_mult': 0.4426756271873271, 'bull_time_stop': 200, 'bull_use_sma': True, 'bull_use_ema': False, 'bull_use_atr': True, 'bull_use_adx': False, 'bull_use_spike': False, 'bull_rsi_required': True, 'bear_strategy': 'mean_reversion', 'bear_bb_std_mult': 1.159159497081409, 'bear_rsi_os': 55, 'bear_rsi_ob': 77, 'bear_adx_thresh': 25.508394454704618, 'bear_atr_min_pct': 0.0036798882751112104, 'bear_atr_max_pct': 0.05081972833043713, 'bear_tp_mult': 1.4104105663985922, 'bear_tsl_mult': 0.5057578894561715, 'bear_time_stop': 282, 'bear_use_sma': True, 'bear_use_ema': False, 'bear_use_atr': True, 'bear_use_adx': False, 'bear_use_spike': True, 'bear_rsi_required': True, 'sideways_strategy': 'mean_reversion', 'sideways_bb_std_mult': 0.8884823968455992, 'sideways_rsi_os': 8, 'sideways_rsi_ob': 92, 'sideways_adx_thresh': 18.66201877924626, 'sideways_atr_min_pct': 0.011631469027945018, 'sideways_atr_max_pct': 0.04094851862834445, 'sideways_tp_mult': 2.452752380421899, 'sideways_tsl_mult': 0.04859123349040001, 'sideways_time_stop': 165, 'sideways_use_sma': False, 'sideways_use_ema': False, 'sideways_use_atr': False, 'sideways_use_adx': True, 'sideways_use_spike': False, 'sideways_rsi_required': False}.
[I 2025-09-01 09:47:19,072] Trial 254 finished with values: [-1000000000.0, 1000000000.0] and parameters: {'p_sma': 17, 'p_std': 46, 'p_atr': 25, 'p_adx': 22, 'rsi_period': 10, 'ema1': 23, 'ema2': 58, 'slip_atr_k': 0.04080212664637635, 'slip_spread_k': 0.6562647389880091, 'spread_hl_frac': 0.028634471905429594, 'bb_std_mult': 2.362328477719121, 'rsi_os': 55, 'rsi_ob': 69, 'vol_spike': 0.11490746477950267, 'adx_thresh': 22.461210606863656, 'atr_min_pct': 0.013073196576810508, 'atr_max_pct': 0.10300914581857454, 'tp_mult': 2.737929131145566, 'tsl_mult': 0.6861567781750149, 'strategy': 'breakout', 'time_stop': 110, 'use_sma': True, 'use_atr': False, 'use_adx': False, 'use_ema': False, 'use_spike': True, 'rsi_required': True, 'edge_k': 1.2087987928273332, 'edge_cap': 0.5049724034025233, 'bull_strategy': 'mean_reversion', 'bull_bb_std_mult': 3.508189941059268, 'bull_rsi_os': 45, 'bull_rsi_ob': 47, 'bull_adx_thresh': 5.572496895237405, 'bull_atr_min_pct': 0.02681743096382898, 'bull_atr_max_pct': 0.10515342975555338, 'bull_tp_mult': 2.9954634272123624, 'bull_tsl_mult': 0.4469334013139258, 'bull_time_stop': 215, 'bull_use_sma': False, 'bull_use_ema': False, 'bull_use_atr': False, 'bull_use_adx': False, 'bull_use_spike': False, 'bull_rsi_required': True, 'bear_strategy': 'breakout', 'bear_bb_std_mult': 1.1711185959658024, 'bear_rsi_os': 53, 'bear_rsi_ob': 76, 'bear_adx_thresh': 10.42935435847991, 'bear_atr_min_pct': 0.010986862629908094, 'bear_atr_max_pct': 0.05711124449831174, 'bear_tp_mult': 1.3944727880122751, 'bear_tsl_mult': 0.49143611051451563, 'bear_time_stop': 282, 'bear_use_sma': True, 'bear_use_ema': False, 'bear_use_atr': True, 'bear_use_adx': False, 'bear_use_spike': True, 'bear_rsi_required': False, 'sideways_strategy': 'mean_reversion', 'sideways_bb_std_mult': 0.9881276101088765, 'sideways_rsi_os': 6, 'sideways_rsi_ob': 71, 'sideways_adx_thresh': 19.858357539735934, 'sideways_atr_min_pct': 0.007378403867887105, 'sideways_atr_max_pct': 0.07458468933521321, 'sideways_tp_mult': 2.892051506231275, 'sideways_tsl_mult': 0.45108529955328164, 'sideways_time_stop': 19, 'sideways_use_sma': False, 'sideways_use_ema': False, 'sideways_use_atr': False, 'sideways_use_adx': True, 'sideways_use_spike': True, 'sideways_rsi_required': False}.
[I 2025-09-01 09:48:00,722] Trial 257 finished with values: [-0.02922506619348275, 0.029010400618193558] and parameters: {'p_sma': 54, 'p_std': 30, 'p_atr': 18, 'p_adx': 26, 'rsi_period': 23, 'ema1': 18, 'ema2': 55, 'slip_atr_k': 0.07552384942382664, 'slip_spread_k': 0.6623446198485784, 'spread_hl_frac': 0.01867978776971868, 'bb_std_mult': 1.4405986042166146, 'rsi_os': 40, 'rsi_ob': 67, 'vol_spike': 0.06980708016408656, 'adx_thresh': 33.61867447358493, 'atr_min_pct': 0.005612195072504092, 'atr_max_pct': 0.09716690265690267, 'tp_mult': 2.760606038999282, 'tsl_mult': 0.7122746279918238, 'strategy': 'breakout', 'time_stop': 171, 'use_sma': True, 'use_atr': False, 'use_adx': False, 'use_ema': False, 'use_spike': True, 'rsi_required': False, 'edge_k': 1.284641938185729, 'edge_cap': 0.6149869616072675, 'bull_strategy': 'mean_reversion', 'bull_bb_std_mult': 2.785707866524546, 'bull_rsi_os': 45, 'bull_rsi_ob': 47, 'bull_adx_thresh': 6.987196016691113, 'bull_atr_min_pct': 0.002873153557566845, 'bull_atr_max_pct': 0.09221812585952852, 'bull_tp_mult': 2.712564752233238, 'bull_tsl_mult': 0.3662378428339375, 'bull_time_stop': 149, 'bull_use_sma': False, 'bull_use_ema': False, 'bull_use_atr': False, 'bull_use_adx': False, 'bull_use_spike': True, 'bull_rsi_required': False, 'bear_strategy': 'breakout', 'bear_bb_std_mult': 1.0068614620915777, 'bear_rsi_os': 31, 'bear_rsi_ob': 81, 'bear_adx_thresh': 23.036313533408393, 'bear_atr_min_pct': 0.01344458803228209, 'bear_atr_max_pct': 0.04091772717289589, 'bear_tp_mult': 1.280757795083747, 'bear_tsl_mult': 0.9399732747932822, 'bear_time_stop': 37, 'bear_use_sma': True, 'bear_use_ema': False, 'bear_use_atr': True, 'bear_use_adx': False, 'bear_use_spike': False, 'bear_rsi_required': False, 'sideways_strategy': 'mean_reversion', 'sideways_bb_std_mult': 1.0256967754948962, 'sideways_rsi_os': 19, 'sideways_rsi_ob': 70, 'sideways_adx_thresh': 23.35717560093418, 'sideways_atr_min_pct': 0.00952656026181804, 'sideways_atr_max_pct': 0.06948372419052476, 'sideways_tp_mult': 2.3753937644922636, 'sideways_tsl_mult': 0.2906917298000016, 'sideways_time_stop': 18, 'sideways_use_sma': False, 'sideways_use_ema': True, 'sideways_use_atr': True, 'sideways_use_adx': True, 'sideways_use_spike': True, 'sideways_rsi_required': False}.
[I 2025-09-01 09:48:01,041] Trial 258 finished with values: [-1000000000.0, 1000000000.0] and parameters: {'p_sma': 29, 'p_std': 21, 'p_atr': 26, 'p_adx': 25, 'rsi_period': 23, 'ema1': 18, 'ema2': 22, 'slip_atr_k': 0.1980845010905805, 'slip_spread_k': 0.00033718697510187745, 'spread_hl_frac': 0.03000067628285554, 'bb_std_mult': 3.2589582022869394, 'rsi_os': 29, 'rsi_ob': 67, 'vol_spike': 0.10807454826284854, 'adx_thresh': 30.438060933998635, 'atr_min_pct': 0.005489911001092926, 'atr_max_pct': 0.09725775197293278, 'tp_mult': 1.4530389369649621, 'tsl_mult': 0.7107717860015238, 'strategy': 'breakout', 'time_stop': 169, 'use_sma': True, 'use_atr': False, 'use_adx': False, 'use_ema': False, 'use_spike': True, 'rsi_required': False, 'edge_k': 1.5599368143355137, 'edge_cap': 0.555936458332183, 'bull_strategy': 'mean_reversion', 'bull_bb_std_mult': 2.4953612556685223, 'bull_rsi_os': 16, 'bull_rsi_ob': 47, 'bull_adx_thresh': 6.985714693885048, 'bull_atr_min_pct': 0.0031105931946803413, 'bull_atr_max_pct': 0.09151008296848236, 'bull_tp_mult': 2.711341031640811, 'bull_tsl_mult': 0.3670081095319224, 'bull_time_stop': 177, 'bull_use_sma': False, 'bull_use_ema': False, 'bull_use_atr': False, 'bull_use_adx': False, 'bull_use_spike': True, 'bull_rsi_required': False, 'bear_strategy': 'breakout', 'bear_bb_std_mult': 0.9988195556850021, 'bear_rsi_os': 52, 'bear_rsi_ob': 82, 'bear_adx_thresh': 33.37312495441819, 'bear_atr_min_pct': 0.016405568956705287, 'bear_atr_max_pct': 0.037249722828599494, 'bear_tp_mult': 1.1729223913746092, 'bear_tsl_mult': 0.41304269884713757, 'bear_time_stop': 34, 'bear_use_sma': True, 'bear_use_ema': False, 'bear_use_atr': True, 'bear_use_adx': False, 'bear_use_spike': False, 'bear_rsi_required': False, 'sideways_strategy': 'mean_reversion', 'sideways_bb_std_mult': 1.7009657873108746, 'sideways_rsi_os': 53, 'sideways_rsi_ob': 46, 'sideways_adx_thresh': 23.084770635577353, 'sideways_atr_min_pct': 0.00957969879827752, 'sideways_atr_max_pct': 0.10072816987140783, 'sideways_tp_mult': 2.7781736010655957, 'sideways_tsl_mult': 0.2647069193986722, 'sideways_time_stop': 14, 'sideways_use_sma': True, 'sideways_use_ema': True, 'sideways_use_atr': True, 'sideways_use_adx': True, 'sideways_use_spike': True, 'sideways_rsi_required': False}.
[I 2025-09-01 09:48:01,919] Trial 255 finished with values: [-0.08302195675015378, 0.08244926546171893] and parameters: {'p_sma': 37, 'p_std': 28, 'p_atr': 18, 'p_adx': 22, 'rsi_period': 21, 'ema1': 11, 'ema2': 59, 'slip_atr_k': 0.10105108674151667, 'slip_spread_k': 0.6676922096075577, 'spread_hl_frac': 0.02845862914437102, 'bb_std_mult': 2.076698302472904, 'rsi_os': 16, 'rsi_ob': 69, 'vol_spike': 0.09276616888544222, 'adx_thresh': 21.372166617106437, 'atr_min_pct': 0.004653172989053658, 'atr_max_pct': 0.027399151003071963, 'tp_mult': 2.358130813882794, 'tsl_mult': 0.714003438083774, 'strategy': 'breakout', 'time_stop': 109, 'use_sma': True, 'use_atr': False, 'use_adx': False, 'use_ema': False, 'use_spike': True, 'rsi_required': False, 'edge_k': 1.3001856962593559, 'edge_cap': 0.5606684634801969, 'bull_strategy': 'mean_reversion', 'bull_bb_std_mult': 3.488056473545813, 'bull_rsi_os': 45, 'bull_rsi_ob': 48, 'bull_adx_thresh': 5.781931695119002, 'bull_atr_min_pct': 0.02707025780194515, 'bull_atr_max_pct': 0.026723523035004373, 'bull_tp_mult': 2.218008800422779, 'bull_tsl_mult': 0.44165681759701886, 'bull_time_stop': 116, 'bull_use_sma': False, 'bull_use_ema': False, 'bull_use_atr': False, 'bull_use_adx': False, 'bull_use_spike': False, 'bull_rsi_required': False, 'bear_strategy': 'breakout', 'bear_bb_std_mult': 0.997368046174234, 'bear_rsi_os': 53, 'bear_rsi_ob': 81, 'bear_adx_thresh': 25.45686461750966, 'bear_atr_min_pct': 0.0028663951146407256, 'bear_atr_max_pct': 0.042058244812709415, 'bear_tp_mult': 1.2821690620244706, 'bear_tsl_mult': 0.4058654384628391, 'bear_time_stop': 60, 'bear_use_sma': True, 'bear_use_ema': False, 'bear_use_atr': True, 'bear_use_adx': False, 'bear_use_spike': True, 'bear_rsi_required': False, 'sideways_strategy': 'mean_reversion', 'sideways_bb_std_mult': 1.4577451860571817, 'sideways_rsi_os': 8, 'sideways_rsi_ob': 45, 'sideways_adx_thresh': 19.760419787680515, 'sideways_atr_min_pct': 0.010283905527062653, 'sideways_atr_max_pct': 0.04494070238110106, 'sideways_tp_mult': 2.9165678124416217, 'sideways_tsl_mult': 0.4499406024841038, 'sideways_time_stop': 152, 'sideways_use_sma': False, 'sideways_use_ema': True, 'sideways_use_atr': True, 'sideways_use_adx': True, 'sideways_use_spike': True, 'sideways_rsi_required': False}.
[I 2025-09-01 09:48:01,929] Trial 256 finished with values: [-1000000000.0, 1000000000.0] and parameters: {'p_sma': 39, 'p_std': 29, 'p_atr': 25, 'p_adx': 11, 'rsi_period': 22, 'ema1': 18, 'ema2': 13, 'slip_atr_k': 0.025344048125290036, 'slip_spread_k': 0.4477316302757748, 'spread_hl_frac': 0.028590366232273092, 'bb_std_mult': 2.53344288904372, 'rsi_os': 21, 'rsi_ob': 67, 'vol_spike': 0.08915147967911556, 'adx_thresh': 23.884354925750714, 'atr_min_pct': 0.0003869200247017916, 'atr_max_pct': 0.1012490281306408, 'tp_mult': 1.116694335488588, 'tsl_mult': 0.7115279317452783, 'strategy': 'breakout', 'time_stop': 93, 'use_sma': True, 'use_atr': False, 'use_adx': False, 'use_ema': False, 'use_spike': True, 'rsi_required': False, 'edge_k': 0.5739075738730408, 'edge_cap': 0.5542098581887558, 'bull_strategy': 'mean_reversion', 'bull_bb_std_mult': 3.53484310290695, 'bull_rsi_os': 45, 'bull_rsi_ob': 75, 'bull_adx_thresh': 5.588340547413886, 'bull_atr_min_pct': 0.0030191309321469123, 'bull_atr_max_pct': 0.09092973106564924, 'bull_tp_mult': 2.251840805707701, 'bull_tsl_mult': 0.44986849172691534, 'bull_time_stop': 173, 'bull_use_sma': False, 'bull_use_ema': False, 'bull_use_atr': False, 'bull_use_adx': False, 'bull_use_spike': False, 'bull_rsi_required': False, 'bear_strategy': 'breakout', 'bear_bb_std_mult': 1.011868618650128, 'bear_rsi_os': 53, 'bear_rsi_ob': 64, 'bear_adx_thresh': 25.255821269774344, 'bear_atr_min_pct': 0.010710787816153571, 'bear_atr_max_pct': 0.04078603719806801, 'bear_tp_mult': 1.3839969555223666, 'bear_tsl_mult': 0.4016566331093436, 'bear_time_stop': 300, 'bear_use_sma': True, 'bear_use_ema': False, 'bear_use_atr': True, 'bear_use_adx': False, 'bear_use_spike': False, 'bear_rsi_required': False, 'sideways_strategy': 'mean_reversion', 'sideways_bb_std_mult': 2.984526990114569, 'sideways_rsi_os': 54, 'sideways_rsi_ob': 71, 'sideways_adx_thresh': 23.721532719125957, 'sideways_atr_min_pct': 0.010034418071883032, 'sideways_atr_max_pct': 0.04574247666279063, 'sideways_tp_mult': 2.904309743868251, 'sideways_tsl_mult': 0.45432438513478546, 'sideways_time_stop': 165, 'sideways_use_sma': False, 'sideways_use_ema': True, 'sideways_use_atr': True, 'sideways_use_adx': True, 'sideways_use_spike': True, 'sideways_rsi_required': False}.
[I 2025-09-01 09:48:40,606] Trial 261 finished with values: [-0.04239591378831009, 0.04225425243433522] and parameters: {'p_sma': 17, 'p_std': 30, 'p_atr': 18, 'p_adx': 26, 'rsi_period': 24, 'ema1': 22, 'ema2': 19, 'slip_atr_k': 0.07422194627406031, 'slip_spread_k': 0.025486417218893775, 'spread_hl_frac': 0.013813803127369373, 'bb_std_mult': 1.4183074084380196, 'rsi_os': 40, 'rsi_ob': 65, 'vol_spike': 0.09848430388597984, 'adx_thresh': 32.56429955084315, 'atr_min_pct': 0.022852517406342254, 'atr_max_pct': 0.11832859775336549, 'tp_mult': 2.865084435511377, 'tsl_mult': 0.729536201528274, 'strategy': 'breakout', 'time_stop': 213, 'use_sma': True, 'use_atr': False, 'use_adx': False, 'use_ema': True, 'use_spike': True, 'rsi_required': True, 'edge_k': 0.12536843235684325, 'edge_cap': 0.604266553284894, 'bull_strategy': 'mean_reversion', 'bull_bb_std_mult': 3.5961330674179512, 'bull_rsi_os': 12, 'bull_rsi_ob': 92, 'bull_adx_thresh': 7.145564335871993, 'bull_atr_min_pct': 0.0008436236881197135, 'bull_atr_max_pct': 0.09648732398024631, 'bull_tp_mult': 2.7400490993072997, 'bull_tsl_mult': 0.4199103365583312, 'bull_time_stop': 188, 'bull_use_sma': True, 'bull_use_ema': False, 'bull_use_atr': True, 'bull_use_adx': False, 'bull_use_spike': True, 'bull_rsi_required': True, 'bear_strategy': 'mean_reversion', 'bear_bb_std_mult': 0.9325509708676716, 'bear_rsi_os': 31, 'bear_rsi_ob': 78, 'bear_adx_thresh': 13.951479660986227, 'bear_atr_min_pct': 0.01368999875233932, 'bear_atr_max_pct': 0.03417667248805007, 'bear_tp_mult': 1.1611812512375406, 'bear_tsl_mult': 0.7194633814348577, 'bear_time_stop': 74, 'bear_use_sma': False, 'bear_use_ema': False, 'bear_use_atr': True, 'bear_use_adx': True, 'bear_use_spike': False, 'bear_rsi_required': False, 'sideways_strategy': 'breakout', 'sideways_bb_std_mult': 2.4281711610684087, 'sideways_rsi_os': 31, 'sideways_rsi_ob': 81, 'sideways_adx_thresh': 22.141072839740296, 'sideways_atr_min_pct': 0.009370324872013985, 'sideways_atr_max_pct': 0.0930462698797755, 'sideways_tp_mult': 2.4067907537203572, 'sideways_tsl_mult': 0.291721262484726, 'sideways_time_stop': 41, 'sideways_use_sma': True, 'sideways_use_ema': False, 'sideways_use_atr': False, 'sideways_use_adx': False, 'sideways_use_spike': False, 'sideways_rsi_required': False}.
[I 2025-09-01 09:48:41,071] Trial 260 finished with values: [-1000000000.0, 1000000000.0] and parameters: {'p_sma': 17, 'p_std': 50, 'p_atr': 8, 'p_adx': 26, 'rsi_period': 24, 'ema1': 18, 'ema2': 18, 'slip_atr_k': 0.01587677748222044, 'slip_spread_k': 0.8541047434712542, 'spread_hl_frac': 0.021560107568632934, 'bb_std_mult': 1.463544310751498, 'rsi_os': 40, 'rsi_ob': 67, 'vol_spike': 0.06943555862924605, 'adx_thresh': 32.44804660827106, 'atr_min_pct': 0.004599084833921343, 'atr_max_pct': 0.11119980665049364, 'tp_mult': 2.355934439238456, 'tsl_mult': 0.7184692507055688, 'strategy': 'breakout', 'time_stop': 97, 'use_sma': True, 'use_atr': False, 'use_adx': False, 'use_ema': True, 'use_spike': True, 'rsi_required': False, 'edge_k': 1.2993478617957752, 'edge_cap': 0.5618266215447618, 'bull_strategy': 'mean_reversion', 'bull_bb_std_mult': 2.8046957403949677, 'bull_rsi_os': 45, 'bull_rsi_ob': 92, 'bull_adx_thresh': 14.086133156010824, 'bull_atr_min_pct': 0.0027086410945626966, 'bull_atr_max_pct': 0.09573196045864517, 'bull_tp_mult': 2.779477819126857, 'bull_tsl_mult': 0.43334575871589653, 'bull_time_stop': 114, 'bull_use_sma': True, 'bull_use_ema': False, 'bull_use_atr': True, 'bull_use_adx': False, 'bull_use_spike': False, 'bull_rsi_required': False, 'bear_strategy': 'mean_reversion', 'bear_bb_std_mult': 1.0060456635556565, 'bear_rsi_os': 53, 'bear_rsi_ob': 78, 'bear_adx_thresh': 23.040496513775675, 'bear_atr_min_pct': 0.01433387348935047, 'bear_atr_max_pct': 0.04133394675565907, 'bear_tp_mult': 1.2786930050871976, 'bear_tsl_mult': 0.4838184039648253, 'bear_time_stop': 300, 'bear_use_sma': False, 'bear_use_ema': False, 'bear_use_atr': True, 'bear_use_adx': True, 'bear_use_spike': False, 'bear_rsi_required': False, 'sideways_strategy': 'breakout', 'sideways_bb_std_mult': 3.000274147215868, 'sideways_rsi_os': 19, 'sideways_rsi_ob': 91, 'sideways_adx_thresh': 23.595211079983223, 'sideways_atr_min_pct': 0.01011506485315089, 'sideways_atr_max_pct': 0.10550180245571446, 'sideways_tp_mult': 2.488723126250651, 'sideways_tsl_mult': 0.304126087092655, 'sideways_time_stop': 279, 'sideways_use_sma': True, 'sideways_use_ema': False, 'sideways_use_atr': True, 'sideways_use_adx': False, 'sideways_use_spike': False, 'sideways_rsi_required': False}.
