[I 2025-09-01 09:59:07,036] Trial 324 finished with values: [-0.07428207132963816, 0.07404908211759824] and parameters: {'p_sma': 47, 'p_std': 6, 'p_atr': 19, 'p_adx': 10, 'rsi_period': 16, 'ema1': 14, 'ema2': 15, 'slip_atr_k': 0.1746159011693927, 'slip_spread_k': 0.1808127382129589, 'spread_hl_frac': 0.0030357648033350476, 'bb_std_mult': 1.6287700385044614, 'rsi_os': 39, 'rsi_ob': 65, 'vol_spike': 0.12220455167149817, 'adx_thresh': 21.46666962093085, 'atr_min_pct': 0.02124441361400272, 'atr_max_pct': 0.12627205068730404, 'tp_mult': 1.0638439831337918, 'tsl_mult': 0.6145414065421778, 'strategy': 'breakout', 'time_stop': 180, 'use_sma': True, 'use_atr': False, 'use_adx': False, 'use_ema': False, 'use_spike': True, 'rsi_required': True, 'edge_k': 0.4339489033466869, 'edge_cap': 0.5732753784046877, 'bull_strategy': 'mean_reversion', 'bull_bb_std_mult': 3.4680906658059985, 'bull_rsi_os': 47, 'bull_rsi_ob': 49, 'bull_adx_thresh': 5.009058996134596, 'bull_atr_min_pct': 0.0027036447107202178, 'bull_atr_max_pct': 0.09013222866000954, 'bull_tp_mult': 2.7316898474096876, 'bull_tsl_mult': 0.4852519639518769, 'bull_time_stop': 175, 'bull_use_sma': True, 'bull_use_ema': False, 'bull_use_atr': False, 'bull_use_adx': False, 'bull_use_spike': False, 'bull_rsi_required': True, 'bear_strategy': 'breakout', 'bear_bb_std_mult': 0.7117906980459584, 'bear_rsi_os': 55, 'bear_rsi_ob': 67, 'bear_adx_thresh': 22.715751576553902, 'bear_atr_min_pct': 0.02298900422633436, 'bear_atr_max_pct': 0.025823967191654244, 'bear_tp_mult': 1.2552872482979238, 'bear_tsl_mult': 0.564556071895669, 'bear_time_stop': 294, 'bear_use_sma': True, 'bear_use_ema': False, 'bear_use_atr': True, 'bear_use_adx': False, 'bear_use_spike': False, 'bear_rsi_required': False, 'sideways_strategy': 'mean_reversion', 'sideways_bb_std_mult': 2.4224538437231495, 'sideways_rsi_os': 52, 'sideways_rsi_ob': 78, 'sideways_adx_thresh': 23.47528948290225, 'sideways_atr_min_pct': 0.00953875553057179, 'sideways_atr_max_pct': 0.05592827900527953, 'sideways_tp_mult': 2.3578205318115035, 'sideways_tsl_mult': 0.7652836287038316, 'sideways_time_stop': 31, 'sideways_use_sma': False, 'sideways_use_ema': True, 'sideways_use_atr': True, 'sideways_use_adx': True, 'sideways_use_spike': False, 'sideways_rsi_required': False}.
[I 2025-09-01 09:59:07,258] Trial 323 finished with values: [-1000000000.0, 1000000000.0] and parameters: {'p_sma': 46, 'p_std': 52, 'p_atr': 19, 'p_adx': 28, 'rsi_period': 16, 'ema1': 18, 'ema2': 15, 'slip_atr_k': 0.1855707941657, 'slip_spread_k': 0.6792932021441294, 'spread_hl_frac': 0.025269633557486307, 'bb_std_mult': 1.6302124970253096, 'rsi_os': 39, 'rsi_ob': 77, 'vol_spike': 0.12358634475080828, 'adx_thresh': 30.131760766633544, 'atr_min_pct': 0.0042454785122266105, 'atr_max_pct': 0.12678620271073465, 'tp_mult': 2.4066656874802623, 'tsl_mult': 0.6835449651513977, 'strategy': 'mean_reversion', 'time_stop': 251, 'use_sma': False, 'use_atr': False, 'use_adx': False, 'use_ema': False, 'use_spike': True, 'rsi_required': True, 'edge_k': 1.1437397201437165, 'edge_cap': 0.5708001925575847, 'bull_strategy': 'mean_reversion', 'bull_bb_std_mult': 3.4859772329035, 'bull_rsi_os': 43, 'bull_rsi_ob': 49, 'bull_adx_thresh': 6.886192593211332, 'bull_atr_min_pct': 0.01686272587959963, 'bull_atr_max_pct': 0.13281925917836096, 'bull_tp_mult': 2.6501689581765624, 'bull_tsl_mult': 0.33020448398787394, 'bull_time_stop': 175, 'bull_use_sma': False, 'bull_use_ema': True, 'bull_use_atr': False, 'bull_use_adx': True, 'bull_use_spike': False, 'bull_rsi_required': True, 'bear_strategy': 'breakout', 'bear_bb_std_mult': 3.423903559326329, 'bear_rsi_os': 51, 'bear_rsi_ob': 67, 'bear_adx_thresh': 22.880922305904843, 'bear_atr_min_pct': 0.004439219772899177, 'bear_atr_max_pct': 0.1107500251506692, 'bear_tp_mult': 1.247622890888672, 'bear_tsl_mult': 0.9519915944058115, 'bear_time_stop': 111, 'bear_use_sma': True, 'bear_use_ema': False, 'bear_use_atr': True, 'bear_use_adx': False, 'bear_use_spike': False, 'bear_rsi_required': False, 'sideways_strategy': 'mean_reversion', 'sideways_bb_std_mult': 2.3869507520796986, 'sideways_rsi_os': 28, 'sideways_rsi_ob': 89, 'sideways_adx_thresh': 9.714466452843698, 'sideways_atr_min_pct': 0.009608937071521184, 'sideways_atr_max_pct': 0.14708956304235207, 'sideways_tp_mult': 1.7983406544865208, 'sideways_tsl_mult': 0.47938434427316284, 'sideways_time_stop': 123, 'sideways_use_sma': False, 'sideways_use_ema': True, 'sideways_use_atr': True, 'sideways_use_adx': True, 'sideways_use_spike': False, 'sideways_rsi_required': True}.
[I 2025-09-01 09:59:46,009] Trial 327 finished with values: [-1000000000.0, 1000000000.0] and parameters: {'p_sma': 32, 'p_std': 42, 'p_atr': 11, 'p_adx': 24, 'rsi_period': 74, 'ema1': 22, 'ema2': 11, 'slip_atr_k': 0.05192516019704581, 'slip_spread_k': 0.4571296574270899, 'spread_hl_frac': 0.03121499445913839, 'bb_std_mult': 3.087732937951438, 'rsi_os': 39, 'rsi_ob': 69, 'vol_spike': 0.17353167474915593, 'adx_thresh': 33.66783218748351, 'atr_min_pct': 0.007972504462730855, 'atr_max_pct': 0.08684529182936379, 'tp_mult': 2.697470657385783, 'tsl_mult': 0.6755525336240161, 'strategy': 'breakout', 'time_stop': 51, 'use_sma': True, 'use_atr': False, 'use_adx': False, 'use_ema': True, 'use_spike': True, 'rsi_required': True, 'edge_k': 0.03767543019000674, 'edge_cap': 0.23943284325029685, 'bull_strategy': 'mean_reversion', 'bull_bb_std_mult': 2.946606317845564, 'bull_rsi_os': 46, 'bull_rsi_ob': 48, 'bull_adx_thresh': 5.059590770872193, 'bull_atr_min_pct': 0.021556174043164247, 'bull_atr_max_pct': 0.0358473872695172, 'bull_tp_mult': 2.958952836563631, 'bull_tsl_mult': 0.09742086597270605, 'bull_time_stop': 82, 'bull_use_sma': False, 'bull_use_ema': False, 'bull_use_atr': False, 'bull_use_adx': True, 'bull_use_spike': False, 'bull_rsi_required': True, 'bear_strategy': 'mean_reversion', 'bear_bb_std_mult': 0.7311579318492716, 'bear_rsi_os': 46, 'bear_rsi_ob': 78, 'bear_adx_thresh': 11.899890199651248, 'bear_atr_min_pct': 0.005210327850410564, 'bear_atr_max_pct': 0.13973043265238777, 'bear_tp_mult': 1.1546247711797173, 'bear_tsl_mult': 0.5148802499697147, 'bear_time_stop': 288, 'bear_use_sma': True, 'bear_use_ema': False, 'bear_use_atr': True, 'bear_use_adx': False, 'bear_use_spike': False, 'bear_rsi_required': False, 'sideways_strategy': 'mean_reversion', 'sideways_bb_std_mult': 2.403064768860589, 'sideways_rsi_os': 50, 'sideways_rsi_ob': 73, 'sideways_adx_thresh': 22.035141831740052, 'sideways_atr_min_pct': 0.010751478307690642, 'sideways_atr_max_pct': 0.06807439462478543, 'sideways_tp_mult': 2.465715088059126, 'sideways_tsl_mult': 0.7881217563256815, 'sideways_time_stop': 44, 'sideways_use_sma': False, 'sideways_use_ema': False, 'sideways_use_atr': False, 'sideways_use_adx': True, 'sideways_use_spike': False, 'sideways_rsi_required': False}.
[I 2025-09-01 09:59:46,793] Trial 326 finished with values: [-1000000000.0, 1000000000.0] and parameters: {'p_sma': 57, 'p_std': 42, 'p_atr': 11, 'p_adx': 15, 'rsi_period': 57, 'ema1': 25, 'ema2': 53, 'slip_atr_k': 0.05559505724297996, 'slip_spread_k': 0.7150519062324544, 'spread_hl_frac': 0.03167221650407059, 'bb_std_mult': 1.606573725001621, 'rsi_os': 39, 'rsi_ob': 69, 'vol_spike': 0.21479167080774297, 'adx_thresh': 33.676772465965804, 'atr_min_pct': 0.021059079294725308, 'atr_max_pct': 0.127422385348319, 'tp_mult': 2.412746156609569, 'tsl_mult': 0.7360411500049092, 'strategy': 'mean_reversion', 'time_stop': 50, 'use_sma': False, 'use_atr': False, 'use_adx': False, 'use_ema': True, 'use_spike': True, 'rsi_required': True, 'edge_k': 1.376337375865261, 'edge_cap': 0.23358232829516007, 'bull_strategy': 'mean_reversion', 'bull_bb_std_mult': 3.4721697931655076, 'bull_rsi_os': 21, 'bull_rsi_ob': 77, 'bull_adx_thresh': 22.285571652886613, 'bull_atr_min_pct': 0.002924354036640172, 'bull_atr_max_pct': 0.09047227608566082, 'bull_tp_mult': 1.7380068705562894, 'bull_tsl_mult': 0.584255535845619, 'bull_time_stop': 111, 'bull_use_sma': True, 'bull_use_ema': True, 'bull_use_atr': True, 'bull_use_adx': True, 'bull_use_spike': False, 'bull_rsi_required': True, 'bear_strategy': 'mean_reversion', 'bear_bb_std_mult': 2.505733816169889, 'bear_rsi_os': 22, 'bear_rsi_ob': 77, 'bear_adx_thresh': 22.946112433177593, 'bear_atr_min_pct': 0.008452198955301552, 'bear_atr_max_pct': 0.02532023643693016, 'bear_tp_mult': 1.1479876375929208, 'bear_tsl_mult': 0.47282962092337955, 'bear_time_stop': 288, 'bear_use_sma': True, 'bear_use_ema': False, 'bear_use_atr': True, 'bear_use_adx': False, 'bear_use_spike': False, 'bear_rsi_required': False, 'sideways_strategy': 'mean_reversion', 'sideways_bb_std_mult': 3.0825760761150787, 'sideways_rsi_os': 41, 'sideways_rsi_ob': 91, 'sideways_adx_thresh': 32.075644087429716, 'sideways_atr_min_pct': 0.010716229203031943, 'sideways_atr_max_pct': 0.03375878332263204, 'sideways_tp_mult': 2.4587018412433754, 'sideways_tsl_mult': 0.6225359796506584, 'sideways_time_stop': 32, 'sideways_use_sma': True, 'sideways_use_ema': False, 'sideways_use_atr': False, 'sideways_use_adx': True, 'sideways_use_spike': False, 'sideways_rsi_required': True}.
[I 2025-09-01 09:59:47,375] Trial 328 finished with values: [-1000000000.0, 1000000000.0] and parameters: {'p_sma': 56, 'p_std': 56, 'p_atr': 10, 'p_adx': 29, 'rsi_period': 13, 'ema1': 17, 'ema2': 20, 'slip_atr_k': 0.05120610192234994, 'slip_spread_k': 0.6262466557445256, 'spread_hl_frac': 0.03198089058554451, 'bb_std_mult': 0.612556701358588, 'rsi_os': 13, 'rsi_ob': 59, 'vol_spike': 0.23062180276778316, 'adx_thresh': 33.79837871131199, 'atr_min_pct': 0.013157835846130799, 'atr_max_pct': 0.0869849227810308, 'tp_mult': 2.1744276850358006, 'tsl_mult': 0.6427321823788892, 'strategy': 'breakout', 'time_stop': 256, 'use_sma': True, 'use_atr': False, 'use_adx': False, 'use_ema': True, 'use_spike': True, 'rsi_required': True, 'edge_k': 1.3891296350242581, 'edge_cap': 0.5990916415580511, 'bull_strategy': 'mean_reversion', 'bull_bb_std_mult': 3.5929972851022596, 'bull_rsi_os': 46, 'bull_rsi_ob': 82, 'bull_adx_thresh': 22.272336304822264, 'bull_atr_min_pct': 0.013966215391292369, 'bull_atr_max_pct': 0.08452041317595876, 'bull_tp_mult': 2.590919951061305, 'bull_tsl_mult': 0.5821312668831083, 'bull_time_stop': 184, 'bull_use_sma': True, 'bull_use_ema': False, 'bull_use_atr': True, 'bull_use_adx': False, 'bull_use_spike': True, 'bull_rsi_required': True, 'bear_strategy': 'mean_reversion', 'bear_bb_std_mult': 0.9379021230565506, 'bear_rsi_os': 46, 'bear_rsi_ob': 77, 'bear_adx_thresh': 28.22668782176088, 'bear_atr_min_pct': 0.005230746063045038, 'bear_atr_max_pct': 0.05000274840464081, 'bear_tp_mult': 1.152165384547333, 'bear_tsl_mult': 0.17632634664235902, 'bear_time_stop': 37, 'bear_use_sma': True, 'bear_use_ema': False, 'bear_use_atr': True, 'bear_use_adx': True, 'bear_use_spike': False, 'bear_rsi_required': False, 'sideways_strategy': 'breakout', 'sideways_bb_std_mult': 2.2675089890741926, 'sideways_rsi_os': 50, 'sideways_rsi_ob': 91, 'sideways_adx_thresh': 22.21011997667757, 'sideways_atr_min_pct': 0.010630818265894997, 'sideways_atr_max_pct': 0.10679599393927161, 'sideways_tp_mult': 2.4552283204187177, 'sideways_tsl_mult': 0.9249291592729796, 'sideways_time_stop': 42, 'sideways_use_sma': True, 'sideways_use_ema': False, 'sideways_use_atr': False, 'sideways_use_adx': True, 'sideways_use_spike': True, 'sideways_rsi_required': False}.
[I 2025-09-01 09:59:47,859] Trial 329 finished with values: [-0.06496043650608885, 0.06475014520496807] and parameters: {'p_sma': 56, 'p_std': 56, 'p_atr': 17, 'p_adx': 29, 'rsi_period': 58, 'ema1': 10, 'ema2': 20, 'slip_atr_k': 0.053894697620957804, 'slip_spread_k': 0.4554428149921923, 'spread_hl_frac': 0.03213054401851851, 'bb_std_mult': 0.5960407575258608, 'rsi_os': 16, 'rsi_ob': 58, 'vol_spike': 0.15921520207377052, 'adx_thresh': 12.106124964084474, 'atr_min_pct': 0.009934759760850991, 'atr_max_pct': 0.04813118970816586, 'tp_mult': 1.162584923169235, 'tsl_mult': 0.7250712811612691, 'strategy': 'breakout', 'time_stop': 253, 'use_sma': True, 'use_atr': False, 'use_adx': False, 'use_ema': True, 'use_spike': True, 'rsi_required': True, 'edge_k': 1.201395548638314, 'edge_cap': 0.23809457288533414, 'bull_strategy': 'mean_reversion', 'bull_bb_std_mult': 2.944309514467907, 'bull_rsi_os': 46, 'bull_rsi_ob': 77, 'bull_adx_thresh': 5.600152551632684, 'bull_atr_min_pct': 3.424164299934557e-05, 'bull_atr_max_pct': 0.08475775365808576, 'bull_tp_mult': 2.9636258604468493, 'bull_tsl_mult': 0.5726758517204186, 'bull_time_stop': 143, 'bull_use_sma': True, 'bull_use_ema': False, 'bull_use_atr': True, 'bull_use_adx': False, 'bull_use_spike': True, 'bull_rsi_required': True, 'bear_strategy': 'mean_reversion', 'bear_bb_std_mult': 1.451260975859007, 'bear_rsi_os': 32, 'bear_rsi_ob': 60, 'bear_adx_thresh': 13.612025896349714, 'bear_atr_min_pct': 0.008409089099653277, 'bear_atr_max_pct': 0.13713269821474552, 'bear_tp_mult': 2.9901890102808037, 'bear_tsl_mult': 0.5341761734615796, 'bear_time_stop': 286, 'bear_use_sma': True, 'bear_use_ema': False, 'bear_use_atr': True, 'bear_use_adx': True, 'bear_use_spike': False, 'bear_rsi_required': False, 'sideways_strategy': 'breakout', 'sideways_bb_std_mult': 0.6403910103134165, 'sideways_rsi_os': 50, 'sideways_rsi_ob': 73, 'sideways_adx_thresh': 7.674156483482532, 'sideways_atr_min_pct': 0.0039096297641138915, 'sideways_atr_max_pct': 0.1400537562813562, 'sideways_tp_mult': 2.392970305984432, 'sideways_tsl_mult': 0.020527394363142992, 'sideways_time_stop': 49, 'sideways_use_sma': True, 'sideways_use_ema': False, 'sideways_use_atr': False, 'sideways_use_adx': True, 'sideways_use_spike': True, 'sideways_rsi_required': False}.
[I 2025-09-01 10:00:27,475] Trial 333 finished with values: [-1000000000.0, 1000000000.0] and parameters: {'p_sma': 14, 'p_std': 48, 'p_atr': 18, 'p_adx': 20, 'rsi_period': 28, 'ema1': 19, 'ema2': 59, 'slip_atr_k': 0.06549215434360837, 'slip_spread_k': 0.6595852046917434, 'spread_hl_frac': 0.007033750072633828, 'bb_std_mult': 1.4545801396414735, 'rsi_os': 41, 'rsi_ob': 52, 'vol_spike': 0.07929816868575146, 'adx_thresh': 14.881299823935064, 'atr_min_pct': 0.007451725735999826, 'atr_max_pct': 0.13842581977762644, 'tp_mult': 2.6465388815036275, 'tsl_mult': 0.045358246486342235, 'strategy': 'breakout', 'time_stop': 205, 'use_sma': True, 'use_atr': True, 'use_adx': True, 'use_ema': True, 'use_spike': False, 'rsi_required': False, 'edge_k': 1.2839189871623895, 'edge_cap': 0.5445556645554717, 'bull_strategy': 'mean_reversion', 'bull_bb_std_mult': 1.628566662234658, 'bull_rsi_os': 44, 'bull_rsi_ob': 45, 'bull_adx_thresh': 25.70681294589499, 'bull_atr_min_pct': 0.007146114266233003, 'bull_atr_max_pct': 0.11880608778554794, 'bull_tp_mult': 2.862969706789473, 'bull_tsl_mult': 0.6954800865208883, 'bull_time_stop': 159, 'bull_use_sma': True, 'bull_use_ema': False, 'bull_use_atr': True, 'bull_use_adx': False, 'bull_use_spike': False, 'bull_rsi_required': False, 'bear_strategy': 'mean_reversion', 'bear_bb_std_mult': 1.0058641860506166, 'bear_rsi_os': 52, 'bear_rsi_ob': 81, 'bear_adx_thresh': 23.418259439056527, 'bear_atr_min_pct': 0.007417057185931117, 'bear_atr_max_pct': 0.04101309815153622, 'bear_tp_mult': 2.663548745887752, 'bear_tsl_mult': 0.780714202464593, 'bear_time_stop': 23, 'bear_use_sma': True, 'bear_use_ema': False, 'bear_use_atr': False, 'bear_use_adx': False, 'bear_use_spike': True, 'bear_rsi_required': False, 'sideways_strategy': 'mean_reversion', 'sideways_bb_std_mult': 1.0125988000835946, 'sideways_rsi_os': 14, 'sideways_rsi_ob': 87, 'sideways_adx_thresh': 24.978020060850774, 'sideways_atr_min_pct': 0.012184516857586813, 'sideways_atr_max_pct': 0.07760564774479126, 'sideways_tp_mult': 1.2258675454370893, 'sideways_tsl_mult': 0.4689234577035252, 'sideways_time_stop': 25, 'sideways_use_sma': True, 'sideways_use_ema': False, 'sideways_use_atr': False, 'sideways_use_adx': False, 'sideways_use_spike': False, 'sideways_rsi_required': False}.
[I 2025-09-01 10:00:29,104] Trial 330 finished with values: [-1000000000.0, 1000000000.0] and parameters: {'p_sma': 13, 'p_std': 56, 'p_atr': 10, 'p_adx': 26, 'rsi_period': 46, 'ema1': 17, 'ema2': 52, 'slip_atr_k': 0.03178935314714747, 'slip_spread_k': 0.22475747403356333, 'spread_hl_frac': 0.029118017473781038, 'bb_std_mult': 1.4495453588916025, 'rsi_os': 41, 'rsi_ob': 64, 'vol_spike': 0.24153608862884157, 'adx_thresh': 12.358322688478385, 'atr_min_pct': 0.009855932452919266, 'atr_max_pct': 0.13799516316565638, 'tp_mult': 2.186253635094285, 'tsl_mult': 0.7790276965942529, 'strategy': 'breakout', 'time_stop': 255, 'use_sma': True, 'use_atr': False, 'use_adx': False, 'use_ema': True, 'use_spike': True, 'rsi_required': True, 'edge_k': 1.3837255461481774, 'edge_cap': 0.5923178906811718, 'bull_strategy': 'mean_reversion', 'bull_bb_std_mult': 3.597083151791143, 'bull_rsi_os': 45, 'bull_rsi_ob': 82, 'bull_adx_thresh': 18.63095057679961, 'bull_atr_min_pct': 0.004431115925343216, 'bull_atr_max_pct': 0.06496999991906605, 'bull_tp_mult': 2.5866337681016787, 'bull_tsl_mult': 0.5837441877883295, 'bull_time_stop': 292, 'bull_use_sma': True, 'bull_use_ema': False, 'bull_use_atr': True, 'bull_use_adx': False, 'bull_use_spike': True, 'bull_rsi_required': True, 'bear_strategy': 'mean_reversion', 'bear_bb_std_mult': 2.932587267201624, 'bear_rsi_os': 53, 'bear_rsi_ob': 59, 'bear_adx_thresh': 25.583613877274537, 'bear_atr_min_pct': 0.016505703359490965, 'bear_atr_max_pct': 0.05864251676842856, 'bear_tp_mult': 1.1019383732976729, 'bear_tsl_mult': 0.4748417969778886, 'bear_time_stop': 225, 'bear_use_sma': True, 'bear_use_ema': False, 'bear_use_atr': True, 'bear_use_adx': True, 'bear_use_spike': False, 'bear_rsi_required': False, 'sideways_strategy': 'breakout', 'sideways_bb_std_mult': 3.294272650149269, 'sideways_rsi_os': 41, 'sideways_rsi_ob': 91, 'sideways_adx_thresh': 20.96779919115836, 'sideways_atr_min_pct': 0.010498847459709372, 'sideways_atr_max_pct': 0.1063027928692199, 'sideways_tp_mult': 2.3959183701057984, 'sideways_tsl_mult': 0.4639527852261489, 'sideways_time_stop': 23, 'sideways_use_sma': True, 'sideways_use_ema': False, 'sideways_use_atr': False, 'sideways_use_adx': True, 'sideways_use_spike': True, 'sideways_rsi_required': False}.
[I 2025-09-01 10:00:30,106] Trial 332 finished with values: [-1000000000.0, 1000000000.0] and parameters: {'p_sma': 14, 'p_std': 51, 'p_atr': 21, 'p_adx': 22, 'rsi_period': 44, 'ema1': 17, 'ema2': 60, 'slip_atr_k': 0.0649893930851328, 'slip_spread_k': 0.6595527430202596, 'spread_hl_frac': 0.029022371165088053, 'bb_std_mult': 2.5037471374752256, 'rsi_os': 32, 'rsi_ob': 87, 'vol_spike': 0.15789169971515465, 'adx_thresh': 12.190029825639497, 'atr_min_pct': 0.007321004066996223, 'atr_max_pct': 0.11908963754792168, 'tp_mult': 1.7798829325584873, 'tsl_mult': 0.7757285792798199, 'strategy': 'breakout', 'time_stop': 217, 'use_sma': True, 'use_atr': False, 'use_adx': True, 'use_ema': True, 'use_spike': True, 'rsi_required': False, 'edge_k': 1.1967398968332288, 'edge_cap': 0.54110843334124, 'bull_strategy': 'mean_reversion', 'bull_bb_std_mult': 2.5499048302735914, 'bull_rsi_os': 16, 'bull_rsi_ob': 91, 'bull_adx_thresh': 5.901918412366575, 'bull_atr_min_pct': 0.004657198486792465, 'bull_atr_max_pct': 0.08636081257370645, 'bull_tp_mult': 2.946217526197221, 'bull_tsl_mult': 0.187576055170877, 'bull_time_stop': 201, 'bull_use_sma': True, 'bull_use_ema': False, 'bull_use_atr': True, 'bull_use_adx': False, 'bull_use_spike': False, 'bull_rsi_required': False, 'bear_strategy': 'mean_reversion', 'bear_bb_std_mult': 3.516528960323196, 'bear_rsi_os': 53, 'bear_rsi_ob': 61, 'bear_adx_thresh': 25.76037212694827, 'bear_atr_min_pct': 0.007415470951816692, 'bear_atr_max_pct': 0.057813363886388955, 'bear_tp_mult': 2.9976706095925127, 'bear_tsl_mult': 0.7788350277900759, 'bear_time_stop': 284, 'bear_use_sma': True, 'bear_use_ema': False, 'bear_use_atr': True, 'bear_use_adx': False, 'bear_use_spike': True, 'bear_rsi_required': False, 'sideways_strategy': 'mean_reversion', 'sideways_bb_std_mult': 0.638905553891161, 'sideways_rsi_os': 7, 'sideways_rsi_ob': 87, 'sideways_adx_thresh': 21.10646972589418, 'sideways_atr_min_pct': 0.011936617051899509, 'sideways_atr_max_pct': 0.07569064313199063, 'sideways_tp_mult': 2.394424786621593, 'sideways_tsl_mult': 0.474181246004276, 'sideways_time_stop': 23, 'sideways_use_sma': True, 'sideways_use_ema': False, 'sideways_use_atr': False, 'sideways_use_adx': False, 'sideways_use_spike': True, 'sideways_rsi_required': False}.
