[I 2025-09-01 10:28:14,650] Trial 504 finished with values: [-1000000000.0, 1000000000.0] and parameters: {'p_sma': 11, 'p_std': 27, 'p_atr': 13, 'p_adx': 20, 'rsi_period': 40, 'ema1': 7, 'ema2': 10, 'slip_atr_k': 0.01742451029918053, 'slip_spread_k': 0.8476969852630192, 'spread_hl_frac': 0.013653641566748706, 'bb_std_mult': 0.9691758773347767, 'rsi_os': 18, 'rsi_ob': 60, 'vol_spike': 0.05761940785050642, 'adx_thresh': 23.782790189026752, 'atr_min_pct': 0.016819119460146557, 'atr_max_pct': 0.014371444356958486, 'tp_mult': 1.4942940566764942, 'tsl_mult': 0.12381825503160043, 'strategy': 'breakout', 'time_stop': 140, 'use_sma': True, 'use_atr': False, 'use_adx': True, 'use_ema': False, 'use_spike': False, 'rsi_required': True, 'edge_k': 1.611528677670922, 'edge_cap': 0.392466785473597, 'bull_strategy': 'mean_reversion', 'bull_bb_std_mult': 0.5405123854502697, 'bull_rsi_os': 19, 'bull_rsi_ob': 76, 'bull_adx_thresh': 15.148595920762432, 'bull_atr_min_pct': 0.024455389835930874, 'bull_atr_max_pct': 0.013347557694640588, 'bull_tp_mult': 1.1535830983964048, 'bull_tsl_mult': 0.6884452865886591, 'bull_time_stop': 280, 'bull_use_sma': False, 'bull_use_ema': False, 'bull_use_atr': False, 'bull_use_adx': True, 'bull_use_spike': True, 'bull_rsi_required': True, 'bear_strategy': 'breakout', 'bear_bb_std_mult': 1.695725703018741, 'bear_rsi_os': 22, 'bear_rsi_ob': 83, 'bear_adx_thresh': 26.253982786667198, 'bear_atr_min_pct': 0.003153231541576088, 'bear_atr_max_pct': 0.1215361955902748, 'bear_tp_mult': 1.7931088551669658, 'bear_tsl_mult': 0.32639316817957875, 'bear_time_stop': 267, 'bear_use_sma': False, 'bear_use_ema': False, 'bear_use_atr': False, 'bear_use_adx': True, 'bear_use_spike': True, 'bear_rsi_required': True, 'sideways_strategy': 'breakout', 'sideways_bb_std_mult': 0.5726130134106279, 'sideways_rsi_os': 55, 'sideways_rsi_ob': 94, 'sideways_adx_thresh': 29.114119918298265, 'sideways_atr_min_pct': 0.007222361294115681, 'sideways_atr_max_pct': 0.05372071507480397, 'sideways_tp_mult': 2.080227087645248, 'sideways_tsl_mult': 0.2709961087177536, 'sideways_time_stop': 236, 'sideways_use_sma': False, 'sideways_use_ema': True, 'sideways_use_atr': True, 'sideways_use_adx': False, 'sideways_use_spike': True, 'sideways_rsi_required': True}.
[I 2025-09-01 10:28:14,720] Trial 505 finished with values: [-1000000000.0, 1000000000.0] and parameters: {'p_sma': 11, 'p_std': 29, 'p_atr': 12, 'p_adx': 20, 'rsi_period': 45, 'ema1': 7, 'ema2': 10, 'slip_atr_k': 0.018546122925933318, 'slip_spread_k': 0.8408159168190968, 'spread_hl_frac': 0.01394572538481726, 'bb_std_mult': 0.974920415472696, 'rsi_os': 15, 'rsi_ob': 62, 'vol_spike': 0.05901958911529602, 'adx_thresh': 23.850499112140078, 'atr_min_pct': 0.016886478865566813, 'atr_max_pct': 0.01662801289339933, 'tp_mult': 1.4769656485215439, 'tsl_mult': 0.12365476109908913, 'strategy': 'breakout', 'time_stop': 136, 'use_sma': True, 'use_atr': False, 'use_adx': True, 'use_ema': False, 'use_spike': False, 'rsi_required': True, 'edge_k': 1.6394002385887503, 'edge_cap': 0.20910951126502886, 'bull_strategy': 'mean_reversion', 'bull_bb_std_mult': 0.5058468897120189, 'bull_rsi_os': 19, 'bull_rsi_ob': 76, 'bull_adx_thresh': 15.167749785575717, 'bull_atr_min_pct': 0.024479923923441532, 'bull_atr_max_pct': 0.01315704571318744, 'bull_tp_mult': 1.1646497471952673, 'bull_tsl_mult': 0.6834427234719372, 'bull_time_stop': 278, 'bull_use_sma': False, 'bull_use_ema': False, 'bull_use_atr': False, 'bull_use_adx': True, 'bull_use_spike': True, 'bull_rsi_required': True, 'bear_strategy': 'breakout', 'bear_bb_std_mult': 1.7103748585392287, 'bear_rsi_os': 18, 'bear_rsi_ob': 83, 'bear_adx_thresh': 26.492152764278668, 'bear_atr_min_pct': 0.003205216038240285, 'bear_atr_max_pct': 0.12280917145101668, 'bear_tp_mult': 1.819101169660514, 'bear_tsl_mult': 0.32716034643993414, 'bear_time_stop': 267, 'bear_use_sma': False, 'bear_use_ema': False, 'bear_use_atr': False, 'bear_use_adx': True, 'bear_use_spike': True, 'bear_rsi_required': True, 'sideways_strategy': 'breakout', 'sideways_bb_std_mult': 0.56414546187235, 'sideways_rsi_os': 55, 'sideways_rsi_ob': 76, 'sideways_adx_thresh': 29.16704336325629, 'sideways_atr_min_pct': 0.007186047282240503, 'sideways_atr_max_pct': 0.053552527189337264, 'sideways_tp_mult': 2.0794618645211655, 'sideways_tsl_mult': 0.27394939904172255, 'sideways_time_stop': 241, 'sideways_use_sma': False, 'sideways_use_ema': True, 'sideways_use_atr': True, 'sideways_use_adx': False, 'sideways_use_spike': True, 'sideways_rsi_required': True}.
[I 2025-09-01 10:28:15,351] Trial 507 finished with values: [-1000000000.0, 1000000000.0] and parameters: {'p_sma': 12, 'p_std': 28, 'p_atr': 13, 'p_adx': 19, 'rsi_period': 45, 'ema1': 7, 'ema2': 10, 'slip_atr_k': 0.017605647056990595, 'slip_spread_k': 0.8492239821706811, 'spread_hl_frac': 0.013395138169477593, 'bb_std_mult': 0.9190601094258001, 'rsi_os': 18, 'rsi_ob': 61, 'vol_spike': 0.05540038897309301, 'adx_thresh': 23.654337476839363, 'atr_min_pct': 0.01678885536355138, 'atr_max_pct': 0.0100252898120696, 'tp_mult': 1.4834669934720104, 'tsl_mult': 0.15162726771987134, 'strategy': 'mean_reversion', 'time_stop': 138, 'use_sma': False, 'use_atr': True, 'use_adx': False, 'use_ema': False, 'use_spike': False, 'rsi_required': False, 'edge_k': 1.5996422150858547, 'edge_cap': 0.41538257116186755, 'bull_strategy': 'mean_reversion', 'bull_bb_std_mult': 0.5571550754133017, 'bull_rsi_os': 18, 'bull_rsi_ob': 77, 'bull_adx_thresh': 14.48739838239956, 'bull_atr_min_pct': 0.01554251689823666, 'bull_atr_max_pct': 0.012742259100900143, 'bull_tp_mult': 1.136946613662539, 'bull_tsl_mult': 0.680158274719942, 'bull_time_stop': 266, 'bull_use_sma': True, 'bull_use_ema': True, 'bull_use_atr': False, 'bull_use_adx': True, 'bull_use_spike': True, 'bull_rsi_required': False, 'bear_strategy': 'breakout', 'bear_bb_std_mult': 1.8200051387264369, 'bear_rsi_os': 19, 'bear_rsi_ob': 84, 'bear_adx_thresh': 26.356706323040296, 'bear_atr_min_pct': 0.003163318903572802, 'bear_atr_max_pct': 0.124198060610904, 'bear_tp_mult': 1.9465336570315188, 'bear_tsl_mult': 0.33028615783390514, 'bear_time_stop': 267, 'bear_use_sma': True, 'bear_use_ema': False, 'bear_use_atr': False, 'bear_use_adx': True, 'bear_use_spike': True, 'bear_rsi_required': False, 'sideways_strategy': 'breakout', 'sideways_bb_std_mult': 0.6056164998940685, 'sideways_rsi_os': 54, 'sideways_rsi_ob': 80, 'sideways_adx_thresh': 29.51337682413653, 'sideways_atr_min_pct': 0.007153364071411446, 'sideways_atr_max_pct': 0.0582520577119768, 'sideways_tp_mult': 1.9882812458219474, 'sideways_tsl_mult': 0.28692940431946806, 'sideways_time_stop': 242, 'sideways_use_sma': False, 'sideways_use_ema': True, 'sideways_use_atr': True, 'sideways_use_adx': False, 'sideways_use_spike': False, 'sideways_rsi_required': True}.
[I 2025-09-01 10:28:15,407] Trial 506 finished with values: [-1000000000.0, 1000000000.0] and parameters: {'p_sma': 13, 'p_std': 26, 'p_atr': 13, 'p_adx': 20, 'rsi_period': 40, 'ema1': 6, 'ema2': 10, 'slip_atr_k': 0.017567252043489405, 'slip_spread_k': 0.8511283677004338, 'spread_hl_frac': 0.014405137163934417, 'bb_std_mult': 0.9570247009583029, 'rsi_os': 18, 'rsi_ob': 61, 'vol_spike': 0.05780414883865182, 'adx_thresh': 23.83960805647898, 'atr_min_pct': 0.016394021713382216, 'atr_max_pct': 0.014823589635617154, 'tp_mult': 1.5015841529309162, 'tsl_mult': 0.14379100798447259, 'strategy': 'mean_reversion', 'time_stop': 138, 'use_sma': False, 'use_atr': True, 'use_adx': True, 'use_ema': False, 'use_spike': False, 'rsi_required': True, 'edge_k': 1.6198990680318825, 'edge_cap': 0.18588688265819242, 'bull_strategy': 'mean_reversion', 'bull_bb_std_mult': 0.5615480820276323, 'bull_rsi_os': 19, 'bull_rsi_ob': 76, 'bull_adx_thresh': 14.51084666782748, 'bull_atr_min_pct': 0.028038359869272313, 'bull_atr_max_pct': 0.013051641830559062, 'bull_tp_mult': 1.1417364370568002, 'bull_tsl_mult': 0.662211220127852, 'bull_time_stop': 278, 'bull_use_sma': True, 'bull_use_ema': True, 'bull_use_atr': False, 'bull_use_adx': True, 'bull_use_spike': True, 'bull_rsi_required': True, 'bear_strategy': 'breakout', 'bear_bb_std_mult': 1.8197733692325633, 'bear_rsi_os': 19, 'bear_rsi_ob': 84, 'bear_adx_thresh': 26.35306116149817, 'bear_atr_min_pct': 0.0031437723101949097, 'bear_atr_max_pct': 0.127495105523217, 'bear_tp_mult': 1.8908701964590533, 'bear_tsl_mult': 0.3377231008097467, 'bear_time_stop': 264, 'bear_use_sma': False, 'bear_use_ema': False, 'bear_use_atr': False, 'bear_use_adx': True, 'bear_use_spike': True, 'bear_rsi_required': False, 'sideways_strategy': 'breakout', 'sideways_bb_std_mult': 0.5643389622641339, 'sideways_rsi_os': 55, 'sideways_rsi_ob': 80, 'sideways_adx_thresh': 29.67643400139271, 'sideways_atr_min_pct': 0.007091118461366571, 'sideways_atr_max_pct': 0.057053356963303874, 'sideways_tp_mult': 2.0720554310945625, 'sideways_tsl_mult': 0.28111064462462726, 'sideways_time_stop': 240, 'sideways_use_sma': False, 'sideways_use_ema': True, 'sideways_use_atr': True, 'sideways_use_adx': False, 'sideways_use_spike': False, 'sideways_rsi_required': True}.
[I 2025-09-01 10:28:58,993] Trial 509 finished with values: [-1000000000.0, 1000000000.0] and parameters: {'p_sma': 13, 'p_std': 17, 'p_atr': 13, 'p_adx': 21, 'rsi_period': 43, 'ema1': 6, 'ema2': 10, 'slip_atr_k': 0.02445396513492476, 'slip_spread_k': 0.87657138958757, 'spread_hl_frac': 0.014712736782678653, 'bb_std_mult': 0.8951698893243545, 'rsi_os': 18, 'rsi_ob': 61, 'vol_spike': 0.05427829613208111, 'adx_thresh': 24.278907512758042, 'atr_min_pct': 0.016515696767527677, 'atr_max_pct': 0.018287993470703697, 'tp_mult': 1.542330752668677, 'tsl_mult': 0.15378647737322004, 'strategy': 'mean_reversion', 'time_stop': 129, 'use_sma': False, 'use_atr': True, 'use_adx': False, 'use_ema': False, 'use_spike': False, 'rsi_required': False, 'edge_k': 1.5917301426721648, 'edge_cap': 0.17961458203304076, 'bull_strategy': 'mean_reversion', 'bull_bb_std_mult': 0.5797875045890672, 'bull_rsi_os': 18, 'bull_rsi_ob': 77, 'bull_adx_thresh': 14.614567515478287, 'bull_atr_min_pct': 0.0007892200055897224, 'bull_atr_max_pct': 0.01691245267286956, 'bull_tp_mult': 1.1166408759545088, 'bull_tsl_mult': 0.7351514986680086, 'bull_time_stop': 268, 'bull_use_sma': True, 'bull_use_ema': True, 'bull_use_atr': False, 'bull_use_adx': True, 'bull_use_spike': True, 'bull_rsi_required': False, 'bear_strategy': 'breakout', 'bear_bb_std_mult': 1.7962838580757263, 'bear_rsi_os': 19, 'bear_rsi_ob': 84, 'bear_adx_thresh': 27.114634852819595, 'bear_atr_min_pct': 0.0023904294702024806, 'bear_atr_max_pct': 0.12662305514776234, 'bear_tp_mult': 1.6293254364678842, 'bear_tsl_mult': 0.3399274834808032, 'bear_time_stop': 258, 'bear_use_sma': True, 'bear_use_ema': False, 'bear_use_atr': False, 'bear_use_adx': True, 'bear_use_spike': True, 'bear_rsi_required': False, 'sideways_strategy': 'breakout', 'sideways_bb_std_mult': 0.5039292629099877, 'sideways_rsi_os': 54, 'sideways_rsi_ob': 74, 'sideways_adx_thresh': 29.956270538273884, 'sideways_atr_min_pct': 0.0068734199630939696, 'sideways_atr_max_pct': 0.057309385931747885, 'sideways_tp_mult': 1.9926028108521834, 'sideways_tsl_mult': 0.3088306361173534, 'sideways_time_stop': 242, 'sideways_use_sma': False, 'sideways_use_ema': True, 'sideways_use_atr': True, 'sideways_use_adx': False, 'sideways_use_spike': False, 'sideways_rsi_required': True}.
[I 2025-09-01 10:28:59,451] Trial 508 finished with values: [-1000000000.0, 1000000000.0] and parameters: {'p_sma': 13, 'p_std': 21, 'p_atr': 13, 'p_adx': 20, 'rsi_period': 42, 'ema1': 6, 'ema2': 10, 'slip_atr_k': 0.022765684242026483, 'slip_spread_k': 0.8651272169201454, 'spread_hl_frac': 0.014565349228097914, 'bb_std_mult': 0.9905192785590835, 'rsi_os': 17, 'rsi_ob': 61, 'vol_spike': 0.05707629257594367, 'adx_thresh': 23.774765766244407, 'atr_min_pct': 0.01632752280472077, 'atr_max_pct': 0.016681891035987953, 'tp_mult': 1.5399837050808671, 'tsl_mult': 0.1513997558151022, 'strategy': 'mean_reversion', 'time_stop': 136, 'use_sma': False, 'use_atr': True, 'use_adx': False, 'use_ema': False, 'use_spike': False, 'rsi_required': False, 'edge_k': 1.660105248260475, 'edge_cap': 0.41851718826887196, 'bull_strategy': 'mean_reversion', 'bull_bb_std_mult': 0.5727641158665001, 'bull_rsi_os': 18, 'bull_rsi_ob': 77, 'bull_adx_thresh': 14.544187344718198, 'bull_atr_min_pct': 0.01837016936036994, 'bull_atr_max_pct': 0.01694068129351081, 'bull_tp_mult': 1.1260889182343048, 'bull_tsl_mult': 0.7397327579690864, 'bull_time_stop': 267, 'bull_use_sma': True, 'bull_use_ema': True, 'bull_use_atr': False, 'bull_use_adx': True, 'bull_use_spike': True, 'bull_rsi_required': False, 'bear_strategy': 'breakout', 'bear_bb_std_mult': 1.8151160098844008, 'bear_rsi_os': 19, 'bear_rsi_ob': 84, 'bear_adx_thresh': 27.540617315061354, 'bear_atr_min_pct': 0.0028590540786201193, 'bear_atr_max_pct': 0.12696388782822005, 'bear_tp_mult': 1.9469495903682987, 'bear_tsl_mult': 0.33956313607425664, 'bear_time_stop': 260, 'bear_use_sma': True, 'bear_use_ema': False, 'bear_use_atr': False, 'bear_use_adx': True, 'bear_use_spike': True, 'bear_rsi_required': False, 'sideways_strategy': 'breakout', 'sideways_bb_std_mult': 0.5059939766087478, 'sideways_rsi_os': 54, 'sideways_rsi_ob': 76, 'sideways_adx_thresh': 29.8360970198581, 'sideways_atr_min_pct': 0.007401310531029239, 'sideways_atr_max_pct': 0.05734123427352325, 'sideways_tp_mult': 1.9773654936386469, 'sideways_tsl_mult': 0.30549208352885265, 'sideways_time_stop': 235, 'sideways_use_sma': False, 'sideways_use_ema': True, 'sideways_use_atr': True, 'sideways_use_adx': False, 'sideways_use_spike': False, 'sideways_rsi_required': True}.
[I 2025-09-01 10:29:00,674] Trial 510 finished with values: [-1000000000.0, 1000000000.0] and parameters: {'p_sma': 13, 'p_std': 21, 'p_atr': 13, 'p_adx': 21, 'rsi_period': 42, 'ema1': 6, 'ema2': 11, 'slip_atr_k': 0.014473421170928164, 'slip_spread_k': 0.866976254879516, 'spread_hl_frac': 0.014881479988700175, 'bb_std_mult': 0.9062913095116694, 'rsi_os': 17, 'rsi_ob': 61, 'vol_spike': 0.061506020851840516, 'adx_thresh': 22.715440951969153, 'atr_min_pct': 0.016345590037450133, 'atr_max_pct': 0.01962815277673575, 'tp_mult': 1.5599921653553268, 'tsl_mult': 0.1616013541915531, 'strategy': 'mean_reversion', 'time_stop': 130, 'use_sma': False, 'use_atr': True, 'use_adx': False, 'use_ema': False, 'use_spike': False, 'rsi_required': True, 'edge_k': 1.6585000014092668, 'edge_cap': 0.405446674278571, 'bull_strategy': 'mean_reversion', 'bull_bb_std_mult': 0.5778832848498, 'bull_rsi_os': 20, 'bull_rsi_ob': 78, 'bull_adx_thresh': 15.67539276936481, 'bull_atr_min_pct': 0.021013027405609112, 'bull_atr_max_pct': 0.017405494684085934, 'bull_tp_mult': 1.1112784342788995, 'bull_tsl_mult': 0.6252335076248979, 'bull_time_stop': 269, 'bull_use_sma': True, 'bull_use_ema': True, 'bull_use_atr': False, 'bull_use_adx': True, 'bull_use_spike': True, 'bull_rsi_required': True, 'bear_strategy': 'breakout', 'bear_bb_std_mult': 1.7510555900603206, 'bear_rsi_os': 20, 'bear_rsi_ob': 84, 'bear_adx_thresh': 27.368197338520815, 'bear_atr_min_pct': 0.002422343547899992, 'bear_atr_max_pct': 0.13160716862214625, 'bear_tp_mult': 1.8735319757397209, 'bear_tsl_mult': 0.3464322129057292, 'bear_time_stop': 258, 'bear_use_sma': True, 'bear_use_ema': False, 'bear_use_atr': False, 'bear_use_adx': True, 'bear_use_spike': True, 'bear_rsi_required': False, 'sideways_strategy': 'breakout', 'sideways_bb_std_mult': 0.5167049422939587, 'sideways_rsi_os': 54, 'sideways_rsi_ob': 75, 'sideways_adx_thresh': 29.84148420802787, 'sideways_atr_min_pct': 0.006504942796386094, 'sideways_atr_max_pct': 0.05735479648699441, 'sideways_tp_mult': 2.0380219510880364, 'sideways_tsl_mult': 0.29254868504148285, 'sideways_time_stop': 243, 'sideways_use_sma': False, 'sideways_use_ema': True, 'sideways_use_atr': True, 'sideways_use_adx': False, 'sideways_use_spike': False, 'sideways_rsi_required': True}.
[I 2025-09-01 10:29:01,000] Trial 511 finished with values: [-1000000000.0, 1000000000.0] and parameters: {'p_sma': 13, 'p_std': 19, 'p_atr': 13, 'p_adx': 21, 'rsi_period': 42, 'ema1': 6, 'ema2': 11, 'slip_atr_k': 0.022029542082156472, 'slip_spread_k': 0.8735234894519874, 'spread_hl_frac': 0.015094050615812699, 'bb_std_mult': 0.8955117840205025, 'rsi_os': 17, 'rsi_ob': 61, 'vol_spike': 0.06281455606210877, 'adx_thresh': 23.180719048922885, 'atr_min_pct': 0.016163168426585668, 'atr_max_pct': 0.019817955809654605, 'tp_mult': 1.540322728441053, 'tsl_mult': 0.1650164128475926, 'strategy': 'breakout', 'time_stop': 128, 'use_sma': True, 'use_atr': False, 'use_adx': False, 'use_ema': False, 'use_spike': False, 'rsi_required': False, 'edge_k': 1.6812373685007034, 'edge_cap': 0.25046486138982815, 'bull_strategy': 'mean_reversion', 'bull_bb_std_mult': 0.5932592698706315, 'bull_rsi_os': 20, 'bull_rsi_ob': 78, 'bull_adx_thresh': 15.523201942604599, 'bull_atr_min_pct': 0.009648489175485282, 'bull_atr_max_pct': 0.018050595983384946, 'bull_tp_mult': 1.1042622799318575, 'bull_tsl_mult': 0.6357986740764131, 'bull_time_stop': 269, 'bull_use_sma': True, 'bull_use_ema': False, 'bull_use_atr': False, 'bull_use_adx': True, 'bull_use_spike': True, 'bull_rsi_required': False, 'bear_strategy': 'breakout', 'bear_bb_std_mult': 1.6405651699495905, 'bear_rsi_os': 20, 'bear_rsi_ob': 84, 'bear_adx_thresh': 27.192591927770128, 'bear_atr_min_pct': 0.0023798573920949828, 'bear_atr_max_pct': 0.10646869470400223, 'bear_tp_mult': 1.6364254567727967, 'bear_tsl_mult': 0.31613091064760984, 'bear_time_stop': 258, 'bear_use_sma': True, 'bear_use_ema': False, 'bear_use_atr': False, 'bear_use_adx': True, 'bear_use_spike': True, 'bear_rsi_required': False, 'sideways_strategy': 'breakout', 'sideways_bb_std_mult': 0.5029377221041755, 'sideways_rsi_os': 54, 'sideways_rsi_ob': 73, 'sideways_adx_thresh': 28.76273768630899, 'sideways_atr_min_pct': 0.006642155023346428, 'sideways_atr_max_pct': 0.04912145363258612, 'sideways_tp_mult': 2.0356731489816466, 'sideways_tsl_mult': 0.3131613804280126, 'sideways_time_stop': 232, 'sideways_use_sma': False, 'sideways_use_ema': True, 'sideways_use_atr': True, 'sideways_use_adx': False, 'sideways_use_spike': False, 'sideways_rsi_required': True}.
[I 2025-09-01 10:29:02,130] Trial 515 finished with values: [-1000000000.0, 1000000000.0] and parameters: {'p_sma': 14, 'p_std': 35, 'p_atr': 13, 'p_adx': 19, 'rsi_period': 39, 'ema1': 7, 'ema2': 11, 'slip_atr_k': 0.014745199600543112, 'slip_spread_k': 0.8120676024872049, 'spread_hl_frac': 0.012262854694793856, 'bb_std_mult': 0.9716898857660214, 'rsi_os': 16, 'rsi_ob': 59, 'vol_spike': 0.06443530925108577, 'adx_thresh': 24.505729658743704, 'atr_min_pct': 0.017507782988882923, 'atr_max_pct': 0.012619676455981086, 'tp_mult': 1.4483839482746452, 'tsl_mult': 0.11794883284640481, 'strategy': 'breakout', 'time_stop': 141, 'use_sma': True, 'use_atr': False, 'use_adx': False, 'use_ema': False, 'use_spike': False, 'rsi_required': True, 'edge_k': 1.5670222125926674, 'edge_cap': 0.45205435341467237, 'bull_strategy': 'mean_reversion', 'bull_bb_std_mult': 0.5293189573118013, 'bull_rsi_os': 16, 'bull_rsi_ob': 75, 'bull_adx_thresh': 13.988636912304912, 'bull_atr_min_pct': 0.0012408619141220077, 'bull_atr_max_pct': 0.02024100591568312, 'bull_tp_mult': 1.1923652674920753, 'bull_tsl_mult': 0.7137025808557529, 'bull_time_stop': 261, 'bull_use_sma': False, 'bull_use_ema': False, 'bull_use_atr': False, 'bull_use_adx': True, 'bull_use_spike': True, 'bull_rsi_required': True, 'bear_strategy': 'breakout', 'bear_bb_std_mult': 1.5977255799893868, 'bear_rsi_os': 17, 'bear_rsi_ob': 82, 'bear_adx_thresh': 28.00617152737295, 'bear_atr_min_pct': 0.001060176753710011, 'bear_atr_max_pct': 0.11092585781979204, 'bear_tp_mult': 1.5448919128750744, 'bear_tsl_mult': 0.30971212048147073, 'bear_time_stop': 250, 'bear_use_sma': True, 'bear_use_ema': False, 'bear_use_atr': False, 'bear_use_adx': True, 'bear_use_spike': True, 'bear_rsi_required': True, 'sideways_strategy': 'breakout', 'sideways_bb_std_mult': 0.6273314071133343, 'sideways_rsi_os': 55, 'sideways_rsi_ob': 82, 'sideways_adx_thresh': 28.7217389309926, 'sideways_atr_min_pct': 0.00761405459916897, 'sideways_atr_max_pct': 0.05175305750515696, 'sideways_tp_mult': 2.1121074454244084, 'sideways_tsl_mult': 0.2573378227620242, 'sideways_time_stop': 230, 'sideways_use_sma': False, 'sideways_use_ema': True, 'sideways_use_atr': True, 'sideways_use_adx': False, 'sideways_use_spike': False, 'sideways_rsi_required': True}.
