[I 2025-09-01 10:14:36,080] Trial 417 finished with values: [-0.048073937829441804, 0.047769218855255785] and parameters: {'p_sma': 49, 'p_std': 53, 'p_atr': 22, 'p_adx': 25, 'rsi_period': 73, 'ema1': 17, 'ema2': 19, 'slip_atr_k': 0.13401511723684711, 'slip_spread_k': 0.542429617842307, 'spread_hl_frac': 0.012864154627370228, 'bb_std_mult': 1.3786277434011986, 'rsi_os': 38, 'rsi_ob': 68, 'vol_spike': 0.12141491564699888, 'adx_thresh': 33.59792225736704, 'atr_min_pct': 0.006430500151225455, 'atr_max_pct': 0.12942866818135704, 'tp_mult': 1.0539073050717191, 'tsl_mult': 0.6294769145234862, 'strategy': 'breakout', 'time_stop': 241, 'use_sma': True, 'use_atr': False, 'use_adx': False, 'use_ema': True, 'use_spike': True, 'rsi_required': True, 'edge_k': 1.2120076842444787, 'edge_cap': 0.5150508857859131, 'bull_strategy': 'breakout', 'bull_bb_std_mult': 3.4988619040194866, 'bull_rsi_os': 42, 'bull_rsi_ob': 45, 'bull_adx_thresh': 6.152980838366364, 'bull_atr_min_pct': 0.023160237356877153, 'bull_atr_max_pct': 0.05911173843071965, 'bull_tp_mult': 2.941930290817232, 'bull_tsl_mult': 0.4064802375327218, 'bull_time_stop': 85, 'bull_use_sma': False, 'bull_use_ema': False, 'bull_use_atr': True, 'bull_use_adx': False, 'bull_use_spike': False, 'bull_rsi_required': True, 'bear_strategy': 'mean_reversion', 'bear_bb_std_mult': 0.8778309050242582, 'bear_rsi_os': 47, 'bear_rsi_ob': 74, 'bear_adx_thresh': 7.640424297756413, 'bear_atr_min_pct': 0.014649408986178017, 'bear_atr_max_pct': 0.07775944469390483, 'bear_tp_mult': 1.1626377215368013, 'bear_tsl_mult': 0.4373178962872114, 'bear_time_stop': 127, 'bear_use_sma': True, 'bear_use_ema': False, 'bear_use_atr': True, 'bear_use_adx': True, 'bear_use_spike': False, 'bear_rsi_required': False, 'sideways_strategy': 'breakout', 'sideways_bb_std_mult': 1.7403282594311846, 'sideways_rsi_os': 51, 'sideways_rsi_ob': 61, 'sideways_adx_thresh': 19.822975944389803, 'sideways_atr_min_pct': 0.0022932522862273517, 'sideways_atr_max_pct': 0.06283893714766653, 'sideways_tp_mult': 2.4811941924965506, 'sideways_tsl_mult': 0.976518617910723, 'sideways_time_stop': 21, 'sideways_use_sma': True, 'sideways_use_ema': False, 'sideways_use_atr': False, 'sideways_use_adx': True, 'sideways_use_spike': False, 'sideways_rsi_required': True}.
[I 2025-09-01 10:14:37,199] Trial 415 finished with values: [-0.07176747408551543, 0.07160200347634621] and parameters: {'p_sma': 31, 'p_std': 22, 'p_atr': 29, 'p_adx': 25, 'rsi_period': 21, 'ema1': 18, 'ema2': 56, 'slip_atr_k': 0.039964918830528495, 'slip_spread_k': 0.6785003002994482, 'spread_hl_frac': 0.023285953466858644, 'bb_std_mult': 2.768134245176318, 'rsi_os': 38, 'rsi_ob': 67, 'vol_spike': 0.10754858357574096, 'adx_thresh': 10.332230474334876, 'atr_min_pct': 0.010977174811875007, 'atr_max_pct': 0.1271809940181443, 'tp_mult': 1.1134586211770614, 'tsl_mult': 0.6344335674322433, 'strategy': 'breakout', 'time_stop': 240, 'use_sma': True, 'use_atr': False, 'use_adx': False, 'use_ema': True, 'use_spike': False, 'rsi_required': True, 'edge_k': 0.6461282399980337, 'edge_cap': 0.07743140932852105, 'bull_strategy': 'mean_reversion', 'bull_bb_std_mult': 3.4964590684557746, 'bull_rsi_os': 53, 'bull_rsi_ob': 49, 'bull_adx_thresh': 6.398256885342737, 'bull_atr_min_pct': 0.0015682081333876193, 'bull_atr_max_pct': 0.09138091796197036, 'bull_tp_mult': 2.970088723148668, 'bull_tsl_mult': 0.04845890253560148, 'bull_time_stop': 193, 'bull_use_sma': True, 'bull_use_ema': False, 'bull_use_atr': True, 'bull_use_adx': False, 'bull_use_spike': False, 'bull_rsi_required': True, 'bear_strategy': 'mean_reversion', 'bear_bb_std_mult': 1.2924208778744322, 'bear_rsi_os': 18, 'bear_rsi_ob': 74, 'bear_adx_thresh': 11.18238210241726, 'bear_atr_min_pct': 0.005834678186928001, 'bear_atr_max_pct': 0.037843424545521656, 'bear_tp_mult': 2.6896274938934495, 'bear_tsl_mult': 0.5069459093096043, 'bear_time_stop': 290, 'bear_use_sma': True, 'bear_use_ema': False, 'bear_use_atr': False, 'bear_use_adx': False, 'bear_use_spike': False, 'bear_rsi_required': False, 'sideways_strategy': 'mean_reversion', 'sideways_bb_std_mult': 1.067064530189962, 'sideways_rsi_os': 23, 'sideways_rsi_ob': 61, 'sideways_adx_thresh': 22.395075093847165, 'sideways_atr_min_pct': 0.008153490251734535, 'sideways_atr_max_pct': 0.11747892603208544, 'sideways_tp_mult': 2.4932972524899415, 'sideways_tsl_mult': 0.49474425844540965, 'sideways_time_stop': 18, 'sideways_use_sma': True, 'sideways_use_ema': True, 'sideways_use_atr': False, 'sideways_use_adx': True, 'sideways_use_spike': False, 'sideways_rsi_required': True}.
[I 2025-09-01 10:14:38,175] Trial 416 finished with values: [-1000000000.0, 1000000000.0] and parameters: {'p_sma': 58, 'p_std': 37, 'p_atr': 20, 'p_adx': 25, 'rsi_period': 21, 'ema1': 25, 'ema2': 56, 'slip_atr_k': 0.11273726009482075, 'slip_spread_k': 0.5619645610046666, 'spread_hl_frac': 0.029092917682810103, 'bb_std_mult': 0.6697340256935949, 'rsi_os': 44, 'rsi_ob': 67, 'vol_spike': 0.1280673835191961, 'adx_thresh': 33.54145587098187, 'atr_min_pct': 0.011058404627718421, 'atr_max_pct': 0.13011959780701438, 'tp_mult': 2.0050591000171933, 'tsl_mult': 0.6315222005511032, 'strategy': 'breakout', 'time_stop': 241, 'use_sma': True, 'use_atr': False, 'use_adx': False, 'use_ema': True, 'use_spike': False, 'rsi_required': True, 'edge_k': 1.2150706315826327, 'edge_cap': 0.6198658974300464, 'bull_strategy': 'mean_reversion', 'bull_bb_std_mult': 3.515592448750129, 'bull_rsi_os': 45, 'bull_rsi_ob': 52, 'bull_adx_thresh': 6.352672801938243, 'bull_atr_min_pct': 0.005022395743333505, 'bull_atr_max_pct': 0.09090814252110366, 'bull_tp_mult': 2.9535041962251927, 'bull_tsl_mult': 0.4087450662683964, 'bull_time_stop': 87, 'bull_use_sma': False, 'bull_use_ema': False, 'bull_use_atr': True, 'bull_use_adx': False, 'bull_use_spike': False, 'bull_rsi_required': True, 'bear_strategy': 'mean_reversion', 'bear_bb_std_mult': 1.3264540047498103, 'bear_rsi_os': 44, 'bear_rsi_ob': 74, 'bear_adx_thresh': 23.61896568941693, 'bear_atr_min_pct': 0.005836535451743529, 'bear_atr_max_pct': 0.0419762703154011, 'bear_tp_mult': 1.3518135067827248, 'bear_tsl_mult': 0.44961748742421564, 'bear_time_stop': 164, 'bear_use_sma': True, 'bear_use_ema': False, 'bear_use_atr': True, 'bear_use_adx': True, 'bear_use_spike': False, 'bear_rsi_required': False, 'sideways_strategy': 'breakout', 'sideways_bb_std_mult': 0.9322680612801519, 'sideways_rsi_os': 48, 'sideways_rsi_ob': 47, 'sideways_adx_thresh': 8.19226022465172, 'sideways_atr_min_pct': 0.01859581775464998, 'sideways_atr_max_pct': 0.026381111208377613, 'sideways_tp_mult': 2.496322227361483, 'sideways_tsl_mult': 0.6039054349448176, 'sideways_time_stop': 22, 'sideways_use_sma': True, 'sideways_use_ema': False, 'sideways_use_atr': False, 'sideways_use_adx': True, 'sideways_use_spike': False, 'sideways_rsi_required': True}.
[I 2025-09-01 10:14:39,071] Trial 414 finished with values: [-1000000000.0, 1000000000.0] and parameters: {'p_sma': 16, 'p_std': 44, 'p_atr': 25, 'p_adx': 25, 'rsi_period': 21, 'ema1': 18, 'ema2': 15, 'slip_atr_k': 0.040788975104488756, 'slip_spread_k': 0.9404668448828657, 'spread_hl_frac': 0.023131252419567087, 'bb_std_mult': 2.754499418614408, 'rsi_os': 38, 'rsi_ob': 68, 'vol_spike': 0.11787029341970527, 'adx_thresh': 31.67760860396595, 'atr_min_pct': 0.011031920761180347, 'atr_max_pct': 0.1404273587384659, 'tp_mult': 1.109004508296089, 'tsl_mult': 0.7052704168061578, 'strategy': 'breakout', 'time_stop': 82, 'use_sma': True, 'use_atr': False, 'use_adx': False, 'use_ema': False, 'use_spike': True, 'rsi_required': True, 'edge_k': 0.3837495176044389, 'edge_cap': 0.07640193407128038, 'bull_strategy': 'mean_reversion', 'bull_bb_std_mult': 2.404241457490387, 'bull_rsi_os': 53, 'bull_rsi_ob': 49, 'bull_adx_thresh': 6.4599712539347625, 'bull_atr_min_pct': 0.0014507157078489747, 'bull_atr_max_pct': 0.06680872277031469, 'bull_tp_mult': 2.9683643117231053, 'bull_tsl_mult': 0.4684596411560826, 'bull_time_stop': 117, 'bull_use_sma': True, 'bull_use_ema': False, 'bull_use_atr': False, 'bull_use_adx': False, 'bull_use_spike': False, 'bull_rsi_required': True, 'bear_strategy': 'mean_reversion', 'bear_bb_std_mult': 1.3497675403000466, 'bear_rsi_os': 25, 'bear_rsi_ob': 76, 'bear_adx_thresh': 7.682310263104666, 'bear_atr_min_pct': 0.006419043125280148, 'bear_atr_max_pct': 0.03981015338649103, 'bear_tp_mult': 2.5586239640083597, 'bear_tsl_mult': 0.5054643256158744, 'bear_time_stop': 300, 'bear_use_sma': True, 'bear_use_ema': False, 'bear_use_atr': False, 'bear_use_adx': False, 'bear_use_spike': False, 'bear_rsi_required': False, 'sideways_strategy': 'mean_reversion', 'sideways_bb_std_mult': 0.9122329829276592, 'sideways_rsi_os': 51, 'sideways_rsi_ob': 61, 'sideways_adx_thresh': 8.22709404771244, 'sideways_atr_min_pct': 0.011303234496552704, 'sideways_atr_max_pct': 0.06669674011942833, 'sideways_tp_mult': 2.493246117145561, 'sideways_tsl_mult': 0.500301627940443, 'sideways_time_stop': 70, 'sideways_use_sma': True, 'sideways_use_ema': True, 'sideways_use_atr': False, 'sideways_use_adx': True, 'sideways_use_spike': False, 'sideways_rsi_required': False}.
[I 2025-09-01 10:15:22,834] Trial 419 finished with values: [-1000000000.0, 1000000000.0] and parameters: {'p_sma': 16, 'p_std': 20, 'p_atr': 20, 'p_adx': 25, 'rsi_period': 24, 'ema1': 16, 'ema2': 17, 'slip_atr_k': 0.22559942206004552, 'slip_spread_k': 0.5890274975379336, 'spread_hl_frac': 0.02887900436016966, 'bb_std_mult': 2.6146448246085163, 'rsi_os': 54, 'rsi_ob': 51, 'vol_spike': 0.13273483126797, 'adx_thresh': 33.7129194013338, 'atr_min_pct': 0.004704105080363318, 'atr_max_pct': 0.14439454811691435, 'tp_mult': 1.1856348870551, 'tsl_mult': 0.7000154506070229, 'strategy': 'breakout', 'time_stop': 269, 'use_sma': True, 'use_atr': False, 'use_adx': False, 'use_ema': True, 'use_spike': True, 'rsi_required': True, 'edge_k': 1.1570997229492577, 'edge_cap': 0.6234220608506844, 'bull_strategy': 'mean_reversion', 'bull_bb_std_mult': 3.5996438567272944, 'bull_rsi_os': 45, 'bull_rsi_ob': 46, 'bull_adx_thresh': 25.30392805575438, 'bull_atr_min_pct': 0.0021175085663528693, 'bull_atr_max_pct': 0.1356559719783841, 'bull_tp_mult': 2.9955273350850615, 'bull_tsl_mult': 0.19908542060943907, 'bull_time_stop': 117, 'bull_use_sma': True, 'bull_use_ema': False, 'bull_use_atr': False, 'bull_use_adx': False, 'bull_use_spike': False, 'bull_rsi_required': True, 'bear_strategy': 'mean_reversion', 'bear_bb_std_mult': 1.36629717235865, 'bear_rsi_os': 25, 'bear_rsi_ob': 74, 'bear_adx_thresh': 23.746342758709254, 'bear_atr_min_pct': 0.004879803312288956, 'bear_atr_max_pct': 0.04545267447299361, 'bear_tp_mult': 2.356485691518225, 'bear_tsl_mult': 0.41564442362106346, 'bear_time_stop': 67, 'bear_use_sma': False, 'bear_use_ema': False, 'bear_use_atr': True, 'bear_use_adx': True, 'bear_use_spike': False, 'bear_rsi_required': True, 'sideways_strategy': 'breakout', 'sideways_bb_std_mult': 1.6415236065964436, 'sideways_rsi_os': 52, 'sideways_rsi_ob': 66, 'sideways_adx_thresh': 16.15687588543694, 'sideways_atr_min_pct': 0.024390479517873355, 'sideways_atr_max_pct': 0.05895463353573133, 'sideways_tp_mult': 2.660183124045044, 'sideways_tsl_mult': 0.45101284602540515, 'sideways_time_stop': 29, 'sideways_use_sma': True, 'sideways_use_ema': False, 'sideways_use_atr': False, 'sideways_use_adx': True, 'sideways_use_spike': True, 'sideways_rsi_required': False}.
[I 2025-09-01 10:15:23,297] Trial 418 finished with values: [-1000000000.0, 1000000000.0] and parameters: {'p_sma': 16, 'p_std': 37, 'p_atr': 20, 'p_adx': 25, 'rsi_period': 21, 'ema1': 20, 'ema2': 59, 'slip_atr_k': 0.06364983295354298, 'slip_spread_k': 0.6255739347953199, 'spread_hl_frac': 0.023569863771044985, 'bb_std_mult': 0.6715434587290019, 'rsi_os': 44, 'rsi_ob': 51, 'vol_spike': 0.13213631400108816, 'adx_thresh': 32.86486054957666, 'atr_min_pct': 0.0164797366485846, 'atr_max_pct': 0.1255666670797738, 'tp_mult': 1.4230796514784065, 'tsl_mult': 0.7032692875605756, 'strategy': 'breakout', 'time_stop': 80, 'use_sma': True, 'use_atr': False, 'use_adx': False, 'use_ema': True, 'use_spike': True, 'rsi_required': True, 'edge_k': 1.147312021559746, 'edge_cap': 0.619709456180579, 'bull_strategy': 'mean_reversion', 'bull_bb_std_mult': 3.5376229723592756, 'bull_rsi_os': 45, 'bull_rsi_ob': 49, 'bull_adx_thresh': 20.004193245713093, 'bull_atr_min_pct': 0.012512979000469729, 'bull_atr_max_pct': 0.045964953628567506, 'bull_tp_mult': 2.9962661304074696, 'bull_tsl_mult': 0.6868167667495125, 'bull_time_stop': 215, 'bull_use_sma': True, 'bull_use_ema': False, 'bull_use_atr': True, 'bull_use_adx': False, 'bull_use_spike': False, 'bull_rsi_required': True, 'bear_strategy': 'mean_reversion', 'bear_bb_std_mult': 1.3356827464591738, 'bear_rsi_os': 55, 'bear_rsi_ob': 74, 'bear_adx_thresh': 22.87166355259682, 'bear_atr_min_pct': 0.004682285108081354, 'bear_atr_max_pct': 0.04340467895222407, 'bear_tp_mult': 2.3520769985118566, 'bear_tsl_mult': 0.41185532869601355, 'bear_time_stop': 164, 'bear_use_sma': True, 'bear_use_ema': False, 'bear_use_atr': True, 'bear_use_adx': False, 'bear_use_spike': False, 'bear_rsi_required': False, 'sideways_strategy': 'mean_reversion', 'sideways_bb_std_mult': 1.6532275500007536, 'sideways_rsi_os': 47, 'sideways_rsi_ob': 47, 'sideways_adx_thresh': 22.60604983254112, 'sideways_atr_min_pct': 0.004465341885286125, 'sideways_atr_max_pct': 0.06916428281323493, 'sideways_tp_mult': 2.3173979686275845, 'sideways_tsl_mult': 0.49290331185894, 'sideways_time_stop': 277, 'sideways_use_sma': True, 'sideways_use_ema': False, 'sideways_use_atr': False, 'sideways_use_adx': True, 'sideways_use_spike': False, 'sideways_rsi_required': True}.
[I 2025-09-01 10:15:24,150] Trial 420 finished with values: [-1000000000.0, 1000000000.0] and parameters: {'p_sma': 54, 'p_std': 58, 'p_atr': 17, 'p_adx': 26, 'rsi_period': 23, 'ema1': 16, 'ema2': 17, 'slip_atr_k': 0.06264322417072649, 'slip_spread_k': 0.5934962893206773, 'spread_hl_frac': 0.030037628939017933, 'bb_std_mult': 1.4871178579605837, 'rsi_os': 40, 'rsi_ob': 69, 'vol_spike': 0.09440396694939852, 'adx_thresh': 18.52772661454168, 'atr_min_pct': 0.005104731708617112, 'atr_max_pct': 0.13850069587346348, 'tp_mult': 1.1720693098574042, 'tsl_mult': 0.6977774197028521, 'strategy': 'breakout', 'time_stop': 177, 'use_sma': True, 'use_atr': False, 'use_adx': False, 'use_ema': False, 'use_spike': True, 'rsi_required': True, 'edge_k': 1.6771234581598071, 'edge_cap': 0.9230944724019512, 'bull_strategy': 'breakout', 'bull_bb_std_mult': 3.4216716883711116, 'bull_rsi_os': 47, 'bull_rsi_ob': 46, 'bull_adx_thresh': 22.518738937803285, 'bull_atr_min_pct': 0.027409787599958164, 'bull_atr_max_pct': 0.06588305727635355, 'bull_tp_mult': 2.9967511558713684, 'bull_tsl_mult': 0.29635813903157376, 'bull_time_stop': 202, 'bull_use_sma': True, 'bull_use_ema': False, 'bull_use_atr': False, 'bull_use_adx': False, 'bull_use_spike': False, 'bull_rsi_required': True, 'bear_strategy': 'mean_reversion', 'bear_bb_std_mult': 0.7477173610312404, 'bear_rsi_os': 54, 'bear_rsi_ob': 75, 'bear_adx_thresh': 22.754112407662365, 'bear_atr_min_pct': 0.02548705995044894, 'bear_atr_max_pct': 0.045779811197711524, 'bear_tp_mult': 2.359804158314003, 'bear_tsl_mult': 0.4635309610839403, 'bear_time_stop': 20, 'bear_use_sma': False, 'bear_use_ema': True, 'bear_use_atr': True, 'bear_use_adx': False, 'bear_use_spike': False, 'bear_rsi_required': True, 'sideways_strategy': 'mean_reversion', 'sideways_bb_std_mult': 0.6445384913986979, 'sideways_rsi_os': 52, 'sideways_rsi_ob': 93, 'sideways_adx_thresh': 34.96216501682506, 'sideways_atr_min_pct': 0.024305040017165526, 'sideways_atr_max_pct': 0.06885245050641527, 'sideways_tp_mult': 2.3587944980676845, 'sideways_tsl_mult': 0.44309629163406866, 'sideways_time_stop': 32, 'sideways_use_sma': True, 'sideways_use_ema': False, 'sideways_use_atr': False, 'sideways_use_adx': True, 'sideways_use_spike': True, 'sideways_rsi_required': False}.
[I 2025-09-01 10:15:24,599] Trial 421 finished with values: [-1000000000.0, 1000000000.0] and parameters: {'p_sma': 45, 'p_std': 58, 'p_atr': 17, 'p_adx': 26, 'rsi_period': 24, 'ema1': 16, 'ema2': 17, 'slip_atr_k': 0.06354636113132751, 'slip_spread_k': 0.6220325132334197, 'spread_hl_frac': 0.0247588172638684, 'bb_std_mult': 1.496382137593881, 'rsi_os': 40, 'rsi_ob': 60, 'vol_spike': 0.14059408705393808, 'adx_thresh': 7.202169293178141, 'atr_min_pct': 0.004868027567438203, 'atr_max_pct': 0.1374516709910874, 'tp_mult': 1.1768833987103746, 'tsl_mult': 0.05416912273631752, 'strategy': 'breakout', 'time_stop': 175, 'use_sma': True, 'use_atr': False, 'use_adx': False, 'use_ema': True, 'use_spike': True, 'rsi_required': True, 'edge_k': 1.2568441418038685, 'edge_cap': 0.604602628000335, 'bull_strategy': 'breakout', 'bull_bb_std_mult': 3.397879375925592, 'bull_rsi_os': 48, 'bull_rsi_ob': 46, 'bull_adx_thresh': 16.92063003184458, 'bull_atr_min_pct': 0.012578467151644214, 'bull_atr_max_pct': 0.09630929679023384, 'bull_tp_mult': 2.91034248894315, 'bull_tsl_mult': 0.2952389715558429, 'bull_time_stop': 214, 'bull_use_sma': True, 'bull_use_ema': False, 'bull_use_atr': True, 'bull_use_adx': False, 'bull_use_spike': False, 'bull_rsi_required': True, 'bear_strategy': 'mean_reversion', 'bear_bb_std_mult': 0.9410819452235931, 'bear_rsi_os': 54, 'bear_rsi_ob': 75, 'bear_adx_thresh': 24.020878934356634, 'bear_atr_min_pct': 0.017680253362339075, 'bear_atr_max_pct': 0.1387717766403066, 'bear_tp_mult': 1.1987370847603775, 'bear_tsl_mult': 0.4182772730041656, 'bear_time_stop': 88, 'bear_use_sma': False, 'bear_use_ema': True, 'bear_use_atr': True, 'bear_use_adx': False, 'bear_use_spike': False, 'bear_rsi_required': True, 'sideways_strategy': 'mean_reversion', 'sideways_bb_std_mult': 0.755254323376279, 'sideways_rsi_os': 47, 'sideways_rsi_ob': 92, 'sideways_adx_thresh': 18.309143277978592, 'sideways_atr_min_pct': 0.02963255709406902, 'sideways_atr_max_pct': 0.09925486775289147, 'sideways_tp_mult': 2.329255488102194, 'sideways_tsl_mult': 0.44557893200450355, 'sideways_time_stop': 29, 'sideways_use_sma': True, 'sideways_use_ema': False, 'sideways_use_atr': False, 'sideways_use_adx': True, 'sideways_use_spike': True, 'sideways_rsi_required': False}.
[I 2025-09-01 10:16:06,018] Trial 425 finished with values: [-1000000000.0, 1000000000.0] and parameters: {'p_sma': 26, 'p_std': 47, 'p_atr': 19, 'p_adx': 24, 'rsi_period': 65, 'ema1': 28, 'ema2': 39, 'slip_atr_k': 0.03083307284829806, 'slip_spread_k': 0.058200058404456856, 'spread_hl_frac': 0.01824285218099108, 'bb_std_mult': 0.765905529389721, 'rsi_os': 25, 'rsi_ob': 70, 'vol_spike': 0.08018337665274324, 'adx_thresh': 20.74170033800285, 'atr_min_pct': 0.01779596899995603, 'atr_max_pct': 0.13245523226185807, 'tp_mult': 1.2598180411159299, 'tsl_mult': 0.6536069524552253, 'strategy': 'breakout', 'time_stop': 248, 'use_sma': True, 'use_atr': False, 'use_adx': True, 'use_ema': True, 'use_spike': True, 'rsi_required': False, 'edge_k': 0.8304963910236745, 'edge_cap': 0.16078765332559547, 'bull_strategy': 'mean_reversion', 'bull_bb_std_mult': 1.6647034214171308, 'bull_rsi_os': 24, 'bull_rsi_ob': 47, 'bull_adx_thresh': 29.12820518826294, 'bull_atr_min_pct': 0.0010634947346747688, 'bull_atr_max_pct': 0.08767339529775908, 'bull_tp_mult': 2.8872760362344634, 'bull_tsl_mult': 0.43356054602367977, 'bull_time_stop': 95, 'bull_use_sma': False, 'bull_use_ema': False, 'bull_use_atr': True, 'bull_use_adx': True, 'bull_use_spike': True, 'bull_rsi_required': False, 'bear_strategy': 'breakout', 'bear_bb_std_mult': 1.1854785695405088, 'bear_rsi_os': 53, 'bear_rsi_ob': 58, 'bear_adx_thresh': 26.981337850392578, 'bear_atr_min_pct': 0.006952357787800125, 'bear_atr_max_pct': 0.0633405543693597, 'bear_tp_mult': 1.160696293232479, 'bear_tsl_mult': 0.4556050791601432, 'bear_time_stop': 222, 'bear_use_sma': True, 'bear_use_ema': False, 'bear_use_atr': True, 'bear_use_adx': False, 'bear_use_spike': True, 'bear_rsi_required': False, 'sideways_strategy': 'mean_reversion', 'sideways_bb_std_mult': 2.277636499007099, 'sideways_rsi_os': 21, 'sideways_rsi_ob': 78, 'sideways_adx_thresh': 32.23849497110917, 'sideways_atr_min_pct': 0.007482106347719675, 'sideways_atr_max_pct': 0.1453503393525542, 'sideways_tp_mult': 2.446734044653325, 'sideways_tsl_mult': 0.9442409574959467, 'sideways_time_stop': 14, 'sideways_use_sma': False, 'sideways_use_ema': False, 'sideways_use_atr': False, 'sideways_use_adx': False, 'sideways_use_spike': False, 'sideways_rsi_required': False}.
