[I 2025-09-01 09:09:27,879] Trial 10 finished with values: [-1000000000.0, 1000000000.0] and parameters: {'p_sma': 38, 'p_std': 11, 'p_atr': 23, 'p_adx': 27, 'rsi_period': 36, 'ema1': 29, 'ema2': 44, 'slip_atr_k': 0.24238055756971066, 'slip_spread_k': 0.6234764879010387, 'spread_hl_frac': 0.04848717042237527, 'bb_std_mult': 3.3419363764174888, 'rsi_os': 30, 'rsi_ob': 80, 'vol_spike': 0.16325571676006692, 'adx_thresh': 7.0129542515388055, 'atr_min_pct': 0.02156927130749128, 'atr_max_pct': 0.042891680969472774, 'tp_mult': 2.6317761102882993, 'tsl_mult': 0.13207121489105544, 'strategy': 'mean_reversion', 'time_stop': 299, 'use_sma': True, 'use_atr': True, 'use_adx': False, 'use_ema': True, 'use_spike': True, 'rsi_required': False, 'edge_k': 0.3653725455617103, 'edge_cap': 0.7202747094206765, 'bull_strategy': 'mean_reversion', 'bull_bb_std_mult': 2.87993300978275, 'bull_rsi_os': 55, 'bull_rsi_ob': 51, 'bull_adx_thresh': 13.046079439258294, 'bull_atr_min_pct': 0.01481379594782087, 'bull_atr_max_pct': 0.016167101061683523, 'bull_tp_mult': 2.0539287284821373, 'bull_tsl_mult': 0.37055202943062704, 'bull_time_stop': 22, 'bull_use_sma': True, 'bull_use_ema': False, 'bull_use_atr': False, 'bull_use_adx': False, 'bull_use_spike': True, 'bull_rsi_required': True, 'bear_strategy': 'breakout', 'bear_bb_std_mult': 3.188296280286385, 'bear_rsi_os': 24, 'bear_rsi_ob': 51, 'bear_adx_thresh': 32.16092931537658, 'bear_atr_min_pct': 0.017775630588870803, 'bear_atr_max_pct': 0.039913350438109535, 'bear_tp_mult': 1.8389756304870393, 'bear_tsl_mult': 0.39553440892455516, 'bear_time_stop': 40, 'bear_use_sma': False, 'bear_use_ema': False, 'bear_use_atr': False, 'bear_use_adx': False, 'bear_use_spike': False, 'bear_rsi_required': True, 'sideways_strategy': 'breakout', 'sideways_bb_std_mult': 0.7700962277889599, 'sideways_rsi_os': 43, 'sideways_rsi_ob': 62, 'sideways_adx_thresh': 5.330529255476835, 'sideways_atr_min_pct': 0.013733044443222655, 'sideways_atr_max_pct': 0.08445148454854827, 'sideways_tp_mult': 1.473960989218942, 'sideways_tsl_mult': 0.8187925670037515, 'sideways_time_stop': 244, 'sideways_use_sma': False, 'sideways_use_ema': False, 'sideways_use_atr': True, 'sideways_use_adx': False, 'sideways_use_spike': False, 'sideways_rsi_required': False}.
[I 2025-09-01 09:09:28,503] Trial 8 finished with values: [-1000000000.0, 1000000000.0] and parameters: {'p_sma': 38, 'p_std': 10, 'p_atr': 21, 'p_adx': 10, 'rsi_period': 79, 'ema1': 22, 'ema2': 12, 'slip_atr_k': 0.04321446577238136, 'slip_spread_k': 0.5282354490909441, 'spread_hl_frac': 0.04032983081721779, 'bb_std_mult': 2.0424573934080774, 'rsi_os': 51, 'rsi_ob': 73, 'vol_spike': 0.2578072513555973, 'adx_thresh': 24.844230846843303, 'atr_min_pct': 0.015310662304707975, 'atr_max_pct': 0.04062480314104362, 'tp_mult': 2.445516373736768, 'tsl_mult': 0.7832213180572731, 'strategy': 'breakout', 'time_stop': 186, 'use_sma': False, 'use_atr': False, 'use_adx': False, 'use_ema': True, 'use_spike': True, 'rsi_required': True, 'edge_k': 0.541583780565486, 'edge_cap': 0.8767814443164694, 'bull_strategy': 'mean_reversion', 'bull_bb_std_mult': 2.368487406732734, 'bull_rsi_os': 35, 'bull_rsi_ob': 88, 'bull_adx_thresh': 9.954330528511385, 'bull_atr_min_pct': 0.0074782814631294955, 'bull_atr_max_pct': 0.12075378325799559, 'bull_tp_mult': 2.4581738162225584, 'bull_tsl_mult': 0.5437637621193424, 'bull_time_stop': 77, 'bull_use_sma': True, 'bull_use_ema': True, 'bull_use_atr': True, 'bull_use_adx': False, 'bull_use_spike': False, 'bull_rsi_required': False, 'bear_strategy': 'mean_reversion', 'bear_bb_std_mult': 1.806577735487618, 'bear_rsi_os': 36, 'bear_rsi_ob': 60, 'bear_adx_thresh': 16.357748936762654, 'bear_atr_min_pct': 0.01483636736663163, 'bear_atr_max_pct': 0.1395885917575464, 'bear_tp_mult': 1.1337257859812655, 'bear_tsl_mult': 0.5149438519955033, 'bear_time_stop': 75, 'bear_use_sma': True, 'bear_use_ema': True, 'bear_use_atr': False, 'bear_use_adx': False, 'bear_use_spike': True, 'bear_rsi_required': False, 'sideways_strategy': 'breakout', 'sideways_bb_std_mult': 2.15367127914268, 'sideways_rsi_os': 38, 'sideways_rsi_ob': 60, 'sideways_adx_thresh': 19.00473865109801, 'sideways_atr_min_pct': 0.01914225577809327, 'sideways_atr_max_pct': 0.021218172979994024, 'sideways_tp_mult': 2.7953121787887656, 'sideways_tsl_mult': 0.043812742710676145, 'sideways_time_stop': 84, 'sideways_use_sma': False, 'sideways_use_ema': True, 'sideways_use_atr': False, 'sideways_use_adx': False, 'sideways_use_spike': False, 'sideways_rsi_required': True}.
[I 2025-09-01 09:09:30,083] Trial 11 finished with values: [-1000000000.0, 1000000000.0] and parameters: {'p_sma': 60, 'p_std': 34, 'p_atr': 19, 'p_adx': 26, 'rsi_period': 10, 'ema1': 19, 'ema2': 25, 'slip_atr_k': 0.224292830079659, 'slip_spread_k': 0.9168321089131289, 'spread_hl_frac': 0.032782177542624615, 'bb_std_mult': 2.9668811827160106, 'rsi_os': 52, 'rsi_ob': 57, 'vol_spike': 0.14397513003567622, 'adx_thresh': 18.928529115477044, 'atr_min_pct': 0.023779948964103924, 'atr_max_pct': 0.11724269840355882, 'tp_mult': 1.0127989329983262, 'tsl_mult': 0.31306944997093666, 'strategy': 'breakout', 'time_stop': 65, 'use_sma': False, 'use_atr': False, 'use_adx': True, 'use_ema': True, 'use_spike': False, 'rsi_required': True, 'edge_k': 1.6937364675629083, 'edge_cap': 0.9236034581032346, 'bull_strategy': 'mean_reversion', 'bull_bb_std_mult': 3.4750594441772376, 'bull_rsi_os': 47, 'bull_rsi_ob': 81, 'bull_adx_thresh': 18.129607752757767, 'bull_atr_min_pct': 0.021810571978008984, 'bull_atr_max_pct': 0.1407494837993653, 'bull_tp_mult': 2.615882374453299, 'bull_tsl_mult': 0.06568274762318305, 'bull_time_stop': 294, 'bull_use_sma': False, 'bull_use_ema': True, 'bull_use_atr': False, 'bull_use_adx': False, 'bull_use_spike': True, 'bull_rsi_required': True, 'bear_strategy': 'breakout', 'bear_bb_std_mult': 2.543051507860681, 'bear_rsi_os': 20, 'bear_rsi_ob': 58, 'bear_adx_thresh': 27.550460509667545, 'bear_atr_min_pct': 0.0061282358165367055, 'bear_atr_max_pct': 0.09689416053078809, 'bear_tp_mult': 1.1970590094386675, 'bear_tsl_mult': 0.9768257520298043, 'bear_time_stop': 110, 'bear_use_sma': True, 'bear_use_ema': False, 'bear_use_atr': True, 'bear_use_adx': True, 'bear_use_spike': False, 'bear_rsi_required': True, 'sideways_strategy': 'mean_reversion', 'sideways_bb_std_mult': 1.9558825050588953, 'sideways_rsi_os': 48, 'sideways_rsi_ob': 65, 'sideways_adx_thresh': 13.208048287304587, 'sideways_atr_min_pct': 0.01980425403677532, 'sideways_atr_max_pct': 0.13884538881638772, 'sideways_tp_mult': 2.348258906556072, 'sideways_tsl_mult': 0.31296116212904945, 'sideways_time_stop': 177, 'sideways_use_sma': True, 'sideways_use_ema': False, 'sideways_use_atr': False, 'sideways_use_adx': True, 'sideways_use_spike': False, 'sideways_rsi_required': True}.
[I 2025-09-01 09:09:31,005] Trial 12 finished with values: [-1000000000.0, 1000000000.0] and parameters: {'p_sma': 50, 'p_std': 49, 'p_atr': 10, 'p_adx': 16, 'rsi_period': 69, 'ema1': 25, 'ema2': 19, 'slip_atr_k': 0.09882006611086985, 'slip_spread_k': 0.4547083162330514, 'spread_hl_frac': 0.02810514182824675, 'bb_std_mult': 1.0183033803072798, 'rsi_os': 6, 'rsi_ob': 74, 'vol_spike': 0.00431379997523067, 'adx_thresh': 13.478699464478453, 'atr_min_pct': 0.008303964876482366, 'atr_max_pct': 0.029681207025670422, 'tp_mult': 1.6344382597269818, 'tsl_mult': 0.03923988140796164, 'strategy': 'mean_reversion', 'time_stop': 246, 'use_sma': True, 'use_atr': False, 'use_adx': False, 'use_ema': False, 'use_spike': False, 'rsi_required': False, 'edge_k': 1.1061021144580763, 'edge_cap': 0.3919972963718302, 'bull_strategy': 'mean_reversion', 'bull_bb_std_mult': 2.592133789682045, 'bull_rsi_os': 49, 'bull_rsi_ob': 51, 'bull_adx_thresh': 30.287704243865974, 'bull_atr_min_pct': 0.00959505510764842, 'bull_atr_max_pct': 0.11923260464614699, 'bull_tp_mult': 1.1740399559374706, 'bull_tsl_mult': 0.7039561648709429, 'bull_time_stop': 12, 'bull_use_sma': False, 'bull_use_ema': False, 'bull_use_atr': True, 'bull_use_adx': False, 'bull_use_spike': True, 'bull_rsi_required': False, 'bear_strategy': 'breakout', 'bear_bb_std_mult': 2.5881076151983424, 'bear_rsi_os': 42, 'bear_rsi_ob': 95, 'bear_adx_thresh': 23.102647126130375, 'bear_atr_min_pct': 0.02050600193657419, 'bear_atr_max_pct': 0.11114699807065537, 'bear_tp_mult': 1.4003231395566456, 'bear_tsl_mult': 0.8205277974511059, 'bear_time_stop': 286, 'bear_use_sma': False, 'bear_use_ema': False, 'bear_use_atr': False, 'bear_use_adx': True, 'bear_use_spike': False, 'bear_rsi_required': False, 'sideways_strategy': 'breakout', 'sideways_bb_std_mult': 2.6649068064123105, 'sideways_rsi_os': 55, 'sideways_rsi_ob': 57, 'sideways_adx_thresh': 7.614014601737111, 'sideways_atr_min_pct': 0.020527054439623157, 'sideways_atr_max_pct': 0.11488807420967229, 'sideways_tp_mult': 2.849302068500888, 'sideways_tsl_mult': 0.7561102379741018, 'sideways_time_stop': 41, 'sideways_use_sma': False, 'sideways_use_ema': False, 'sideways_use_atr': True, 'sideways_use_adx': False, 'sideways_use_spike': False, 'sideways_rsi_required': True}.
[I 2025-09-01 09:09:31,012] Trial 13 finished with values: [-1000000000.0, 1000000000.0] and parameters: {'p_sma': 31, 'p_std': 21, 'p_atr': 29, 'p_adx': 15, 'rsi_period': 65, 'ema1': 5, 'ema2': 46, 'slip_atr_k': 0.058572203640247913, 'slip_spread_k': 0.9674408776052956, 'spread_hl_frac': 0.03336378201349953, 'bb_std_mult': 0.7626037058148634, 'rsi_os': 19, 'rsi_ob': 48, 'vol_spike': 0.23647937515113776, 'adx_thresh': 11.10025068761748, 'atr_min_pct': 0.017543188051158978, 'atr_max_pct': 0.0926590369514989, 'tp_mult': 1.1394525814579564, 'tsl_mult': 0.30829186204966896, 'strategy': 'mean_reversion', 'time_stop': 86, 'use_sma': False, 'use_atr': False, 'use_adx': True, 'use_ema': False, 'use_spike': True, 'rsi_required': False, 'edge_k': 0.7454970144469699, 'edge_cap': 0.07514872912183218, 'bull_strategy': 'mean_reversion', 'bull_bb_std_mult': 1.5241726504887687, 'bull_rsi_os': 37, 'bull_rsi_ob': 66, 'bull_adx_thresh': 6.541034269830874, 'bull_atr_min_pct': 0.021126093523621315, 'bull_atr_max_pct': 0.11065072761307057, 'bull_tp_mult': 2.6733523700110924, 'bull_tsl_mult': 0.6498753108095572, 'bull_time_stop': 96, 'bull_use_sma': False, 'bull_use_ema': True, 'bull_use_atr': False, 'bull_use_adx': False, 'bull_use_spike': False, 'bull_rsi_required': False, 'bear_strategy': 'mean_reversion', 'bear_bb_std_mult': 0.9024964214072226, 'bear_rsi_os': 36, 'bear_rsi_ob': 93, 'bear_adx_thresh': 24.537624994287473, 'bear_atr_min_pct': 0.009584885536847186, 'bear_atr_max_pct': 0.10136658571317918, 'bear_tp_mult': 1.0138988816424197, 'bear_tsl_mult': 0.5401503636473943, 'bear_time_stop': 11, 'bear_use_sma': False, 'bear_use_ema': False, 'bear_use_atr': False, 'bear_use_adx': True, 'bear_use_spike': True, 'bear_rsi_required': True, 'sideways_strategy': 'breakout', 'sideways_bb_std_mult': 3.362949586865665, 'sideways_rsi_os': 19, 'sideways_rsi_ob': 94, 'sideways_adx_thresh': 34.70706035290095, 'sideways_atr_min_pct': 0.0009908315259495944, 'sideways_atr_max_pct': 0.04755480211365632, 'sideways_tp_mult': 2.858258366410708, 'sideways_tsl_mult': 0.03362982033328965, 'sideways_time_stop': 8, 'sideways_use_sma': False, 'sideways_use_ema': True, 'sideways_use_atr': True, 'sideways_use_adx': False, 'sideways_use_spike': True, 'sideways_rsi_required': False}.
[I 2025-09-01 09:09:31,039] Trial 14 finished with values: [-1000000000.0, 1000000000.0] and parameters: {'p_sma': 7, 'p_std': 40, 'p_atr': 30, 'p_adx': 15, 'rsi_period': 58, 'ema1': 5, 'ema2': 45, 'slip_atr_k': 0.21889558887533245, 'slip_spread_k': 0.9911730127278887, 'spread_hl_frac': 0.029315599049778467, 'bb_std_mult': 0.6799606498616817, 'rsi_os': 42, 'rsi_ob': 45, 'vol_spike': 0.20523358410307543, 'adx_thresh': 34.39114294152854, 'atr_min_pct': 0.02065882402864619, 'atr_max_pct': 0.10081246916655753, 'tp_mult': 1.0482114844392285, 'tsl_mult': 0.327732629374867, 'strategy': 'mean_reversion', 'time_stop': 111, 'use_sma': False, 'use_atr': True, 'use_adx': True, 'use_ema': False, 'use_spike': False, 'rsi_required': False, 'edge_k': 0.016973028889066544, 'edge_cap': 0.05520806421349539, 'bull_strategy': 'mean_reversion', 'bull_bb_std_mult': 1.4918754095763171, 'bull_rsi_os': 39, 'bull_rsi_ob': 69, 'bull_adx_thresh': 5.462117680840276, 'bull_atr_min_pct': 9.936958125733369e-05, 'bull_atr_max_pct': 0.05085835069144537, 'bull_tp_mult': 1.0325568402644003, 'bull_tsl_mult': 0.03150236630443928, 'bull_time_stop': 102, 'bull_use_sma': False, 'bull_use_ema': True, 'bull_use_atr': False, 'bull_use_adx': False, 'bull_use_spike': True, 'bull_rsi_required': False, 'bear_strategy': 'mean_reversion', 'bear_bb_std_mult': 0.6232529945890672, 'bear_rsi_os': 15, 'bear_rsi_ob': 93, 'bear_adx_thresh': 26.526570341579884, 'bear_atr_min_pct': 0.01096092373423246, 'bear_atr_max_pct': 0.1054546547972865, 'bear_tp_mult': 2.686517015870052, 'bear_tsl_mult': 0.9866958880836046, 'bear_time_stop': 131, 'bear_use_sma': False, 'bear_use_ema': False, 'bear_use_atr': False, 'bear_use_adx': True, 'bear_use_spike': True, 'bear_rsi_required': True, 'sideways_strategy': 'breakout', 'sideways_bb_std_mult': 3.4504702665269207, 'sideways_rsi_os': 20, 'sideways_rsi_ob': 94, 'sideways_adx_thresh': 12.879693884421172, 'sideways_atr_min_pct': 0.0013995308484546747, 'sideways_atr_max_pct': 0.05782475490880666, 'sideways_tp_mult': 2.5694632749632005, 'sideways_tsl_mult': 0.7387693537332063, 'sideways_time_stop': 117, 'sideways_use_sma': False, 'sideways_use_ema': True, 'sideways_use_atr': True, 'sideways_use_adx': False, 'sideways_use_spike': True, 'sideways_rsi_required': False}.
[I 2025-09-01 09:09:31,066] Trial 15 finished with values: [-1000000000.0, 1000000000.0] and parameters: {'p_sma': 6, 'p_std': 20, 'p_atr': 28, 'p_adx': 14, 'rsi_period': 63, 'ema1': 5, 'ema2': 44, 'slip_atr_k': 0.19544887244355907, 'slip_spread_k': 0.7708953754586235, 'spread_hl_frac': 0.029349862889165922, 'bb_std_mult': 0.7545231622557782, 'rsi_os': 42, 'rsi_ob': 50, 'vol_spike': 0.21296310545127978, 'adx_thresh': 34.67245532698386, 'atr_min_pct': 0.019673981874185245, 'atr_max_pct': 0.09630550116692371, 'tp_mult': 1.4541100746621627, 'tsl_mult': 0.2993940442680938, 'strategy': 'mean_reversion', 'time_stop': 101, 'use_sma': False, 'use_atr': True, 'use_adx': True, 'use_ema': False, 'use_spike': True, 'rsi_required': False, 'edge_k': 0.018079565713061907, 'edge_cap': 0.1391223791392532, 'bull_strategy': 'mean_reversion', 'bull_bb_std_mult': 1.5910695428197053, 'bull_rsi_os': 38, 'bull_rsi_ob': 66, 'bull_adx_thresh': 19.197791748149122, 'bull_atr_min_pct': 0.0009060378076875068, 'bull_atr_max_pct': 0.052431806167395956, 'bull_tp_mult': 1.020548935298619, 'bull_tsl_mult': 0.5758404733885394, 'bull_time_stop': 110, 'bull_use_sma': False, 'bull_use_ema': True, 'bull_use_atr': False, 'bull_use_adx': True, 'bull_use_spike': False, 'bull_rsi_required': False, 'bear_strategy': 'mean_reversion', 'bear_bb_std_mult': 0.8273736727960812, 'bear_rsi_os': 12, 'bear_rsi_ob': 95, 'bear_adx_thresh': 25.07874937352487, 'bear_atr_min_pct': 0.010682814877219183, 'bear_atr_max_pct': 0.11523915351145403, 'bear_tp_mult': 1.3326433805430944, 'bear_tsl_mult': 0.6563639423603794, 'bear_time_stop': 5, 'bear_use_sma': False, 'bear_use_ema': False, 'bear_use_atr': False, 'bear_use_adx': True, 'bear_use_spike': True, 'bear_rsi_required': True, 'sideways_strategy': 'breakout', 'sideways_bb_std_mult': 3.4751172051430457, 'sideways_rsi_os': 20, 'sideways_rsi_ob': 94, 'sideways_adx_thresh': 34.93342234453348, 'sideways_atr_min_pct': 0.0004486446571064811, 'sideways_atr_max_pct': 0.05122204123482918, 'sideways_tp_mult': 2.999706072291807, 'sideways_tsl_mult': 0.721165662321563, 'sideways_time_stop': 11, 'sideways_use_sma': False, 'sideways_use_ema': True, 'sideways_use_atr': True, 'sideways_use_adx': False, 'sideways_use_spike': True, 'sideways_rsi_required': False}.
[I 2025-09-01 09:09:31,274] Trial 16 finished with values: [-1000000000.0, 1000000000.0] and parameters: {'p_sma': 5, 'p_std': 19, 'p_atr': 30, 'p_adx': 15, 'rsi_period': 55, 'ema1': 5, 'ema2': 45, 'slip_atr_k': 0.1958517703679442, 'slip_spread_k': 0.7110355052304097, 'spread_hl_frac': 0.0026699794638159573, 'bb_std_mult': 1.2020682864487007, 'rsi_os': 43, 'rsi_ob': 45, 'vol_spike': 0.20863991790805625, 'adx_thresh': 33.532054325843966, 'atr_min_pct': 0.01948264403798495, 'atr_max_pct': 0.09496822845780939, 'tp_mult': 1.5072464815584272, 'tsl_mult': 0.3393958057206056, 'strategy': 'mean_reversion', 'time_stop': 121, 'use_sma': False, 'use_atr': True, 'use_adx': True, 'use_ema': False, 'use_spike': True, 'rsi_required': False, 'edge_k': 0.013208573244329863, 'edge_cap': 0.1412267711834408, 'bull_strategy': 'mean_reversion', 'bull_bb_std_mult': 1.6709987016279213, 'bull_rsi_os': 41, 'bull_rsi_ob': 68, 'bull_adx_thresh': 5.755806631397432, 'bull_atr_min_pct': 0.00011284949458350213, 'bull_atr_max_pct': 0.047481701769316625, 'bull_tp_mult': 1.0317501629694392, 'bull_tsl_mult': 0.03439308776633637, 'bull_time_stop': 110, 'bull_use_sma': False, 'bull_use_ema': True, 'bull_use_atr': False, 'bull_use_adx': True, 'bull_use_spike': False, 'bull_rsi_required': False, 'bear_strategy': 'mean_reversion', 'bear_bb_std_mult': 0.8287857695908396, 'bear_rsi_os': 14, 'bear_rsi_ob': 69, 'bear_adx_thresh': 34.79625056053967, 'bear_atr_min_pct': 0.010793951815100794, 'bear_atr_max_pct': 0.06284388929771988, 'bear_tp_mult': 2.845871908295013, 'bear_tsl_mult': 0.6246023635405591, 'bear_time_stop': 19, 'bear_use_sma': False, 'bear_use_ema': False, 'bear_use_atr': False, 'bear_use_adx': True, 'bear_use_spike': True, 'bear_rsi_required': True, 'sideways_strategy': 'breakout', 'sideways_bb_std_mult': 3.2849785459294836, 'sideways_rsi_os': 20, 'sideways_rsi_ob': 93, 'sideways_adx_thresh': 13.388226819455078, 'sideways_atr_min_pct': 0.0014397472292746213, 'sideways_atr_max_pct': 0.05511378976520852, 'sideways_tp_mult': 1.5767889003357318, 'sideways_tsl_mult': 0.6700755662966924, 'sideways_time_stop': 117, 'sideways_use_sma': False, 'sideways_use_ema': True, 'sideways_use_atr': True, 'sideways_use_adx': False, 'sideways_use_spike': True, 'sideways_rsi_required': False}.
[I 2025-09-01 09:10:11,083] Trial 20 finished with values: [-1000000000.0, 1000000000.0] and parameters: {'p_sma': 14, 'p_std': 41, 'p_atr': 25, 'p_adx': 21, 'rsi_period': 43, 'ema1': 15, 'ema2': 57, 'slip_atr_k': 0.0849853847684224, 'slip_spread_k': 0.23056433267318893, 'spread_hl_frac': 0.039852547849820806, 'bb_std_mult': 1.2914159057929286, 'rsi_os': 21, 'rsi_ob': 66, 'vol_spike': 0.07412415192389568, 'adx_thresh': 22.85364764479923, 'atr_min_pct': 0.024462502829577785, 'atr_max_pct': 0.1387701499734996, 'tp_mult': 1.736183400804213, 'tsl_mult': 0.49465788480393413, 'strategy': 'mean_reversion', 'time_stop': 11, 'use_sma': False, 'use_atr': True, 'use_adx': True, 'use_ema': False, 'use_spike': False, 'rsi_required': False, 'edge_k': 0.7669926423630574, 'edge_cap': 0.29003821387026407, 'bull_strategy': 'breakout', 'bull_bb_std_mult': 0.5166106927742686, 'bull_rsi_os': 5, 'bull_rsi_ob': 76, 'bull_adx_thresh': 22.271842738375998, 'bull_atr_min_pct': 0.004415572350767699, 'bull_atr_max_pct': 0.09409271505051006, 'bull_tp_mult': 2.979562487791413, 'bull_tsl_mult': 0.41395091693070196, 'bull_time_stop': 198, 'bull_use_sma': False, 'bull_use_ema': True, 'bull_use_atr': False, 'bull_use_adx': False, 'bull_use_spike': True, 'bull_rsi_required': False, 'bear_strategy': 'mean_reversion', 'bear_bb_std_mult': 1.389001414984283, 'bear_rsi_os': 5, 'bear_rsi_ob': 69, 'bear_adx_thresh': 5.849342857398412, 'bear_atr_min_pct': 0.022321655700084205, 'bear_atr_max_pct': 0.0683487619836707, 'bear_tp_mult': 2.3869322144140734, 'bear_tsl_mult': 0.045762128824945514, 'bear_time_stop': 205, 'bear_use_sma': False, 'bear_use_ema': True, 'bear_use_atr': False, 'bear_use_adx': True, 'bear_use_spike': True, 'bear_rsi_required': True, 'sideways_strategy': 'breakout', 'sideways_bb_std_mult': 2.4668637361927046, 'sideways_rsi_os': 30, 'sideways_rsi_ob': 71, 'sideways_adx_thresh': 10.69759732058445, 'sideways_atr_min_pct': 0.00644289492649547, 'sideways_atr_max_pct': 0.06903077127955207, 'sideways_tp_mult': 1.041367838422598, 'sideways_tsl_mult': 0.9538406898925681, 'sideways_time_stop': 128, 'sideways_use_sma': False, 'sideways_use_ema': True, 'sideways_use_atr': True, 'sideways_use_adx': False, 'sideways_use_spike': False, 'sideways_rsi_required': False}.
