[I 2025-09-01 09:20:25,734] Trial 90 finished with values: [-1000000000.0, 1000000000.0] and parameters: {'p_sma': 35, 'p_std': 27, 'p_atr': 27, 'p_adx': 19, 'rsi_period': 84, 'ema1': 7, 'ema2': 35, 'slip_atr_k': 0.12778311372850623, 'slip_spread_k': 0.7801361588052557, 'spread_hl_frac': 0.0427222688484826, 'bb_std_mult': 1.3475467062713586, 'rsi_os': 43, 'rsi_ob': 76, 'vol_spike': 0.17771626211122193, 'adx_thresh': 28.634503729184836, 'atr_min_pct': 0.018070457773898367, 'atr_max_pct': 0.054551044811021666, 'tp_mult': 2.090691253542785, 'tsl_mult': 0.45723760741846287, 'strategy': 'breakout', 'time_stop': 162, 'use_sma': False, 'use_atr': False, 'use_adx': True, 'use_ema': False, 'use_spike': False, 'rsi_required': False, 'edge_k': 0.0009566489683585644, 'edge_cap': 0.21714972824348408, 'bull_strategy': 'breakout', 'bull_bb_std_mult': 1.694512867372599, 'bull_rsi_os': 39, 'bull_rsi_ob': 59, 'bull_adx_thresh': 5.001811948608854, 'bull_atr_min_pct': 0.01878227907116251, 'bull_atr_max_pct': 0.13407090149224243, 'bull_tp_mult': 1.7496616592019962, 'bull_tsl_mult': 0.12563992288307205, 'bull_time_stop': 168, 'bull_use_sma': False, 'bull_use_ema': True, 'bull_use_atr': False, 'bull_use_adx': False, 'bull_use_spike': True, 'bull_rsi_required': False, 'bear_strategy': 'mean_reversion', 'bear_bb_std_mult': 1.4817999297580644, 'bear_rsi_os': 18, 'bear_rsi_ob': 73, 'bear_adx_thresh': 27.70577160681445, 'bear_atr_min_pct': 0.001548728086106163, 'bear_atr_max_pct': 0.05998133747565072, 'bear_tp_mult': 2.143402463040211, 'bear_tsl_mult': 0.7732565974508883, 'bear_time_stop': 87, 'bear_use_sma': True, 'bear_use_ema': True, 'bear_use_atr': False, 'bear_use_adx': False, 'bear_use_spike': True, 'bear_rsi_required': True, 'sideways_strategy': 'mean_reversion', 'sideways_bb_std_mult': 0.619340505300048, 'sideways_rsi_os': 36, 'sideways_rsi_ob': 70, 'sideways_adx_thresh': 13.789510189992349, 'sideways_atr_min_pct': 0.0002952862643922959, 'sideways_atr_max_pct': 0.09546771638113848, 'sideways_tp_mult': 1.1938301618714215, 'sideways_tsl_mult': 0.9979689791077091, 'sideways_time_stop': 192, 'sideways_use_sma': False, 'sideways_use_ema': True, 'sideways_use_atr': True, 'sideways_use_adx': False, 'sideways_use_spike': False, 'sideways_rsi_required': False}.
[I 2025-09-01 09:20:26,049] Trial 91 finished with values: [-1000000000.0, 1000000000.0] and parameters: {'p_sma': 16, 'p_std': 7, 'p_atr': 25, 'p_adx': 24, 'rsi_period': 53, 'ema1': 7, 'ema2': 40, 'slip_atr_k': 0.0021729268492547554, 'slip_spread_k': 0.7920658031475796, 'spread_hl_frac': 0.04313668790332327, 'bb_std_mult': 1.0331299464439865, 'rsi_os': 37, 'rsi_ob': 89, 'vol_spike': 0.19751799694567623, 'adx_thresh': 6.077011829635536, 'atr_min_pct': 0.01686069930162568, 'atr_max_pct': 0.013416844641323339, 'tp_mult': 2.506462458459664, 'tsl_mult': 0.1555109941972016, 'strategy': 'breakout', 'time_stop': 24, 'use_sma': True, 'use_atr': True, 'use_adx': True, 'use_ema': False, 'use_spike': False, 'rsi_required': True, 'edge_k': 1.7054757840474428, 'edge_cap': 0.8683161525702328, 'bull_strategy': 'breakout', 'bull_bb_std_mult': 1.5002575716799222, 'bull_rsi_os': 39, 'bull_rsi_ob': 69, 'bull_adx_thresh': 17.547928092253017, 'bull_atr_min_pct': 0.0008278697932199907, 'bull_atr_max_pct': 0.13049228416098388, 'bull_tp_mult': 1.0566149344939066, 'bull_tsl_mult': 0.13346842004599366, 'bull_time_stop': 204, 'bull_use_sma': False, 'bull_use_ema': False, 'bull_use_atr': False, 'bull_use_adx': False, 'bull_use_spike': True, 'bull_rsi_required': True, 'bear_strategy': 'breakout', 'bear_bb_std_mult': 3.0638359874235617, 'bear_rsi_os': 13, 'bear_rsi_ob': 65, 'bear_adx_thresh': 7.983587289985184, 'bear_atr_min_pct': 0.009546313303651795, 'bear_atr_max_pct': 0.06729023582015095, 'bear_tp_mult': 2.3649214865786723, 'bear_tsl_mult': 0.8225058515368431, 'bear_time_stop': 86, 'bear_use_sma': False, 'bear_use_ema': True, 'bear_use_atr': False, 'bear_use_adx': False, 'bear_use_spike': True, 'bear_rsi_required': True, 'sideways_strategy': 'mean_reversion', 'sideways_bb_std_mult': 0.683382365737996, 'sideways_rsi_os': 48, 'sideways_rsi_ob': 61, 'sideways_adx_thresh': 14.32817510144994, 'sideways_atr_min_pct': 0.0062667861238935195, 'sideways_atr_max_pct': 0.10758627361293349, 'sideways_tp_mult': 1.2043570612648207, 'sideways_tsl_mult': 0.7441197740175357, 'sideways_time_stop': 239, 'sideways_use_sma': False, 'sideways_use_ema': True, 'sideways_use_atr': False, 'sideways_use_adx': True, 'sideways_use_spike': False, 'sideways_rsi_required': False}.
[I 2025-09-01 09:21:04,638] Trial 94 finished with values: [-0.09479545064379236, 0.09464607810398726] and parameters: {'p_sma': 12, 'p_std': 32, 'p_atr': 8, 'p_adx': 14, 'rsi_period': 40, 'ema1': 14, 'ema2': 40, 'slip_atr_k': 0.13373162136182146, 'slip_spread_k': 0.20190120734001427, 'spread_hl_frac': 0.008858085792791622, 'bb_std_mult': 1.0178915105350073, 'rsi_os': 5, 'rsi_ob': 56, 'vol_spike': 0.23753891239034527, 'adx_thresh': 6.208145954406026, 'atr_min_pct': 0.01922789839379143, 'atr_max_pct': 0.09430565363369203, 'tp_mult': 2.9040975947528986, 'tsl_mult': 0.15421541981711712, 'strategy': 'mean_reversion', 'time_stop': 23, 'use_sma': True, 'use_atr': True, 'use_adx': True, 'use_ema': False, 'use_spike': False, 'rsi_required': True, 'edge_k': 0.20418325800830933, 'edge_cap': 0.11254205935304323, 'bull_strategy': 'mean_reversion', 'bull_bb_std_mult': 0.6258783760538036, 'bull_rsi_os': 31, 'bull_rsi_ob': 52, 'bull_adx_thresh': 17.663997190228756, 'bull_atr_min_pct': 0.0007638852264304705, 'bull_atr_max_pct': 0.12962242849331357, 'bull_tp_mult': 1.063307177595354, 'bull_tsl_mult': 0.2985813863478941, 'bull_time_stop': 142, 'bull_use_sma': False, 'bull_use_ema': False, 'bull_use_atr': False, 'bull_use_adx': False, 'bull_use_spike': True, 'bull_rsi_required': True, 'bear_strategy': 'breakout', 'bear_bb_std_mult': 3.0731563435682943, 'bear_rsi_os': 15, 'bear_rsi_ob': 65, 'bear_adx_thresh': 7.612558504764966, 'bear_atr_min_pct': 0.02051766176486916, 'bear_atr_max_pct': 0.12716301510977224, 'bear_tp_mult': 2.337815880341594, 'bear_tsl_mult': 0.7496925321315077, 'bear_time_stop': 128, 'bear_use_sma': False, 'bear_use_ema': False, 'bear_use_atr': False, 'bear_use_adx': True, 'bear_use_spike': True, 'bear_rsi_required': True, 'sideways_strategy': 'breakout', 'sideways_bb_std_mult': 3.3336703130325516, 'sideways_rsi_os': 45, 'sideways_rsi_ob': 60, 'sideways_adx_thresh': 30.01743483549034, 'sideways_atr_min_pct': 0.0019470624182099307, 'sideways_atr_max_pct': 0.11718750373874434, 'sideways_tp_mult': 1.2961723985669453, 'sideways_tsl_mult': 0.5145987499310627, 'sideways_time_stop': 70, 'sideways_use_sma': False, 'sideways_use_ema': True, 'sideways_use_atr': False, 'sideways_use_adx': True, 'sideways_use_spike': False, 'sideways_rsi_required': False}.
[I 2025-09-01 09:21:05,092] Trial 92 finished with values: [-1000000000.0, 1000000000.0] and parameters: {'p_sma': 12, 'p_std': 21, 'p_atr': 8, 'p_adx': 8, 'rsi_period': 74, 'ema1': 7, 'ema2': 40, 'slip_atr_k': 0.131462605911924, 'slip_spread_k': 0.7822072249758087, 'spread_hl_frac': 0.04057215841392093, 'bb_std_mult': 1.0325826927903188, 'rsi_os': 5, 'rsi_ob': 76, 'vol_spike': 0.2266553797733506, 'adx_thresh': 12.804185042389555, 'atr_min_pct': 0.0171856956207725, 'atr_max_pct': 0.09307612551342981, 'tp_mult': 1.6943891377821847, 'tsl_mult': 0.4672157624412852, 'strategy': 'breakout', 'time_stop': 24, 'use_sma': True, 'use_atr': True, 'use_adx': True, 'use_ema': False, 'use_spike': False, 'rsi_required': True, 'edge_k': 0.20820874035760759, 'edge_cap': 0.10376585771305052, 'bull_strategy': 'breakout', 'bull_bb_std_mult': 1.5157091499850905, 'bull_rsi_os': 39, 'bull_rsi_ob': 69, 'bull_adx_thresh': 17.279873731432083, 'bull_atr_min_pct': 0.015628358099363877, 'bull_atr_max_pct': 0.054249415292250816, 'bull_tp_mult': 1.748609136762459, 'bull_tsl_mult': 0.2979908991686967, 'bull_time_stop': 145, 'bull_use_sma': False, 'bull_use_ema': False, 'bull_use_atr': False, 'bull_use_adx': False, 'bull_use_spike': True, 'bull_rsi_required': True, 'bear_strategy': 'breakout', 'bear_bb_std_mult': 3.246348229054895, 'bear_rsi_os': 13, 'bear_rsi_ob': 66, 'bear_adx_thresh': 8.654167036498466, 'bear_atr_min_pct': 0.02721341856564613, 'bear_atr_max_pct': 0.10904233083161452, 'bear_tp_mult': 2.5477847194005268, 'bear_tsl_mult': 0.8204782016926226, 'bear_time_stop': 87, 'bear_use_sma': False, 'bear_use_ema': True, 'bear_use_atr': False, 'bear_use_adx': False, 'bear_use_spike': True, 'bear_rsi_required': True, 'sideways_strategy': 'mean_reversion', 'sideways_bb_std_mult': 3.3132837093122696, 'sideways_rsi_os': 45, 'sideways_rsi_ob': 70, 'sideways_adx_thresh': 13.84277034544046, 'sideways_atr_min_pct': 0.001780882752177555, 'sideways_atr_max_pct': 0.11054378201501946, 'sideways_tp_mult': 1.201654194010592, 'sideways_tsl_mult': 0.16751638326079998, 'sideways_time_stop': 183, 'sideways_use_sma': False, 'sideways_use_ema': True, 'sideways_use_atr': False, 'sideways_use_adx': True, 'sideways_use_spike': False, 'sideways_rsi_required': False}.
[I 2025-09-01 09:21:05,324] Trial 95 finished with values: [-0.03838148998663271, 0.03814098992474193] and parameters: {'p_sma': 12, 'p_std': 32, 'p_atr': 29, 'p_adx': 10, 'rsi_period': 73, 'ema1': 17, 'ema2': 37, 'slip_atr_k': 0.1735137798263523, 'slip_spread_k': 0.21391754792795692, 'spread_hl_frac': 0.04042566296655152, 'bb_std_mult': 0.5652556804631126, 'rsi_os': 24, 'rsi_ob': 56, 'vol_spike': 0.22654291203694166, 'adx_thresh': 12.713081233286228, 'atr_min_pct': 0.01954844736836182, 'atr_max_pct': 0.09437203505048711, 'tp_mult': 1.6900157105583737, 'tsl_mult': 0.9479732091293478, 'strategy': 'mean_reversion', 'time_stop': 24, 'use_sma': False, 'use_atr': True, 'use_adx': True, 'use_ema': False, 'use_spike': False, 'rsi_required': False, 'edge_k': 0.20560182247002337, 'edge_cap': 0.333566891603721, 'bull_strategy': 'mean_reversion', 'bull_bb_std_mult': 1.2448285502467313, 'bull_rsi_os': 31, 'bull_rsi_ob': 72, 'bull_adx_thresh': 26.61503440046515, 'bull_atr_min_pct': 0.023756377623048344, 'bull_atr_max_pct': 0.1434478853017715, 'bull_tp_mult': 1.1298085170768108, 'bull_tsl_mult': 0.2950128463503585, 'bull_time_stop': 147, 'bull_use_sma': False, 'bull_use_ema': True, 'bull_use_atr': False, 'bull_use_adx': False, 'bull_use_spike': True, 'bull_rsi_required': False, 'bear_strategy': 'mean_reversion', 'bear_bb_std_mult': 3.2671760000735315, 'bear_rsi_os': 16, 'bear_rsi_ob': 71, 'bear_adx_thresh': 26.08673046688473, 'bear_atr_min_pct': 0.019386874302515157, 'bear_atr_max_pct': 0.07815702835718986, 'bear_tp_mult': 1.0755533777476618, 'bear_tsl_mult': 0.7267225996282575, 'bear_time_stop': 67, 'bear_use_sma': False, 'bear_use_ema': False, 'bear_use_atr': False, 'bear_use_adx': True, 'bear_use_spike': True, 'bear_rsi_required': True, 'sideways_strategy': 'breakout', 'sideways_bb_std_mult': 3.2845742985935664, 'sideways_rsi_os': 45, 'sideways_rsi_ob': 49, 'sideways_adx_thresh': 23.206950626208737, 'sideways_atr_min_pct': 0.0017754604554219358, 'sideways_atr_max_pct': 0.023297336171786653, 'sideways_tp_mult': 1.2885540798319641, 'sideways_tsl_mult': 0.34811677307457195, 'sideways_time_stop': 71, 'sideways_use_sma': False, 'sideways_use_ema': True, 'sideways_use_atr': True, 'sideways_use_adx': False, 'sideways_use_spike': False, 'sideways_rsi_required': False}.
[I 2025-09-01 09:21:05,861] Trial 93 finished with values: [-1000000000.0, 1000000000.0] and parameters: {'p_sma': 36, 'p_std': 7, 'p_atr': 25, 'p_adx': 14, 'rsi_period': 40, 'ema1': 7, 'ema2': 39, 'slip_atr_k': 0.17229827516430987, 'slip_spread_k': 0.21360404984700399, 'spread_hl_frac': 0.045043515559309785, 'bb_std_mult': 1.0153138435405655, 'rsi_os': 37, 'rsi_ob': 88, 'vol_spike': 0.19706344973455173, 'adx_thresh': 12.404441625141061, 'atr_min_pct': 0.019499017451467475, 'atr_max_pct': 0.09521529956890491, 'tp_mult': 1.4819563093508399, 'tsl_mult': 0.8056074508783618, 'strategy': 'breakout', 'time_stop': 22, 'use_sma': True, 'use_atr': True, 'use_adx': True, 'use_ema': False, 'use_spike': False, 'rsi_required': True, 'edge_k': 1.6907069365148286, 'edge_cap': 0.10669466793050264, 'bull_strategy': 'breakout', 'bull_bb_std_mult': 2.646952101204673, 'bull_rsi_os': 31, 'bull_rsi_ob': 53, 'bull_adx_thresh': 25.755534906914157, 'bull_atr_min_pct': 0.013362996386936853, 'bull_atr_max_pct': 0.14360820839707042, 'bull_tp_mult': 1.0530149694052253, 'bull_tsl_mult': 0.3076706832070458, 'bull_time_stop': 202, 'bull_use_sma': False, 'bull_use_ema': False, 'bull_use_atr': False, 'bull_use_adx': False, 'bull_use_spike': True, 'bull_rsi_required': True, 'bear_strategy': 'breakout', 'bear_bb_std_mult': 3.0671363254020507, 'bear_rsi_os': 11, 'bear_rsi_ob': 49, 'bear_adx_thresh': 8.521258989564288, 'bear_atr_min_pct': 0.008304718488671725, 'bear_atr_max_pct': 0.11636490258268592, 'bear_tp_mult': 2.162593400685564, 'bear_tsl_mult': 0.7357725782007436, 'bear_time_stop': 68, 'bear_use_sma': False, 'bear_use_ema': True, 'bear_use_atr': False, 'bear_use_adx': False, 'bear_use_spike': True, 'bear_rsi_required': True, 'sideways_strategy': 'mean_reversion', 'sideways_bb_std_mult': 2.1533278055174754, 'sideways_rsi_os': 45, 'sideways_rsi_ob': 60, 'sideways_adx_thresh': 14.31134055367148, 'sideways_atr_min_pct': 0.0017047046503038577, 'sideways_atr_max_pct': 0.11616817551257401, 'sideways_tp_mult': 1.1976387776564534, 'sideways_tsl_mult': 0.9974405184480206, 'sideways_time_stop': 69, 'sideways_use_sma': False, 'sideways_use_ema': True, 'sideways_use_atr': False, 'sideways_use_adx': True, 'sideways_use_spike': False, 'sideways_rsi_required': False}.
[I 2025-09-01 09:21:46,592] Trial 97 finished with values: [-1000000000.0, 1000000000.0] and parameters: {'p_sma': 50, 'p_std': 33, 'p_atr': 29, 'p_adx': 14, 'rsi_period': 68, 'ema1': 18, 'ema2': 37, 'slip_atr_k': 0.1737900138174367, 'slip_spread_k': 0.7013119742635233, 'spread_hl_frac': 0.04517936429551456, 'bb_std_mult': 0.9000608843053908, 'rsi_os': 46, 'rsi_ob': 57, 'vol_spike': 0.2173068967757692, 'adx_thresh': 9.155040755396211, 'atr_min_pct': 0.019613387244794587, 'atr_max_pct': 0.10540761301192392, 'tp_mult': 1.3758652293804094, 'tsl_mult': 0.37938124211463664, 'strategy': 'mean_reversion', 'time_stop': 137, 'use_sma': False, 'use_atr': True, 'use_adx': True, 'use_ema': False, 'use_spike': False, 'rsi_required': False, 'edge_k': 0.1838589008084503, 'edge_cap': 0.334968019467336, 'bull_strategy': 'mean_reversion', 'bull_bb_std_mult': 1.0248809823032294, 'bull_rsi_os': 31, 'bull_rsi_ob': 52, 'bull_adx_thresh': 13.460157467129395, 'bull_atr_min_pct': 0.024028403848980577, 'bull_atr_max_pct': 0.042996619458969924, 'bull_tp_mult': 1.1513944408518912, 'bull_tsl_mult': 0.9633364503976174, 'bull_time_stop': 66, 'bull_use_sma': False, 'bull_use_ema': True, 'bull_use_atr': False, 'bull_use_adx': False, 'bull_use_spike': True, 'bull_rsi_required': False, 'bear_strategy': 'mean_reversion', 'bear_bb_std_mult': 3.305046877323295, 'bear_rsi_os': 10, 'bear_rsi_ob': 75, 'bear_adx_thresh': 11.918318372591935, 'bear_atr_min_pct': 0.008565360420295303, 'bear_atr_max_pct': 0.09282216834322982, 'bear_tp_mult': 2.0116705405706874, 'bear_tsl_mult': 0.7254553486997853, 'bear_time_stop': 68, 'bear_use_sma': False, 'bear_use_ema': False, 'bear_use_atr': False, 'bear_use_adx': True, 'bear_use_spike': True, 'bear_rsi_required': True, 'sideways_strategy': 'breakout', 'sideways_bb_std_mult': 2.1974463434087452, 'sideways_rsi_os': 18, 'sideways_rsi_ob': 84, 'sideways_adx_thresh': 9.583117414842361, 'sideways_atr_min_pct': 0.024359641996056766, 'sideways_atr_max_pct': 0.11768725786582032, 'sideways_tp_mult': 1.294531384082894, 'sideways_tsl_mult': 0.5142681467476006, 'sideways_time_stop': 71, 'sideways_use_sma': False, 'sideways_use_ema': True, 'sideways_use_atr': True, 'sideways_use_adx': False, 'sideways_use_spike': False, 'sideways_rsi_required': False}.
[I 2025-09-01 09:21:47,159] Trial 96 finished with values: [-1000000000.0, 1000000000.0] and parameters: {'p_sma': 7, 'p_std': 36, 'p_atr': 29, 'p_adx': 14, 'rsi_period': 40, 'ema1': 18, 'ema2': 38, 'slip_atr_k': 0.021047398099174414, 'slip_spread_k': 0.1819714508864782, 'spread_hl_frac': 5.7259782976548657e-05, 'bb_std_mult': 0.5629397885432441, 'rsi_os': 23, 'rsi_ob': 61, 'vol_spike': 0.22322293209484192, 'adx_thresh': 12.363628888828375, 'atr_min_pct': 0.01967490336613177, 'atr_max_pct': 0.09332473713501817, 'tp_mult': 1.34214730669016, 'tsl_mult': 0.8193279308584089, 'strategy': 'mean_reversion', 'time_stop': 24, 'use_sma': True, 'use_atr': True, 'use_adx': True, 'use_ema': False, 'use_spike': False, 'rsi_required': True, 'edge_k': 0.22153481236885464, 'edge_cap': 0.33803076644935903, 'bull_strategy': 'mean_reversion', 'bull_bb_std_mult': 0.6059834419516668, 'bull_rsi_os': 34, 'bull_rsi_ob': 71, 'bull_adx_thresh': 25.459216612451613, 'bull_atr_min_pct': 0.002603751971249578, 'bull_atr_max_pct': 0.14316306261379677, 'bull_tp_mult': 1.1334341811691406, 'bull_tsl_mult': 0.30097159895263226, 'bull_time_stop': 135, 'bull_use_sma': False, 'bull_use_ema': False, 'bull_use_atr': False, 'bull_use_adx': False, 'bull_use_spike': True, 'bull_rsi_required': True, 'bear_strategy': 'mean_reversion', 'bear_bb_std_mult': 3.2436526231211014, 'bear_rsi_os': 35, 'bear_rsi_ob': 66, 'bear_adx_thresh': 26.452836126195823, 'bear_atr_min_pct': 0.02728620237681978, 'bear_atr_max_pct': 0.09085364441556891, 'bear_tp_mult': 2.0025513517655127, 'bear_tsl_mult': 0.551135926593885, 'bear_time_stop': 69, 'bear_use_sma': False, 'bear_use_ema': False, 'bear_use_atr': False, 'bear_use_adx': True, 'bear_use_spike': True, 'bear_rsi_required': True, 'sideways_strategy': 'breakout', 'sideways_bb_std_mult': 2.1614918962572967, 'sideways_rsi_os': 45, 'sideways_rsi_ob': 65, 'sideways_adx_thresh': 15.40027738921844, 'sideways_atr_min_pct': 0.020751633759530787, 'sideways_atr_max_pct': 0.1464828929419363, 'sideways_tp_mult': 1.3022378095877918, 'sideways_tsl_mult': 0.8041245277588418, 'sideways_time_stop': 69, 'sideways_use_sma': False, 'sideways_use_ema': True, 'sideways_use_atr': True, 'sideways_use_adx': True, 'sideways_use_spike': False, 'sideways_rsi_required': False}.
[I 2025-09-01 09:21:47,588] Trial 98 finished with values: [-1000000000.0, 1000000000.0] and parameters: {'p_sma': 7, 'p_std': 53, 'p_atr': 29, 'p_adx': 10, 'rsi_period': 35, 'ema1': 18, 'ema2': 37, 'slip_atr_k': 0.17523719127541876, 'slip_spread_k': 0.6606979728295785, 'spread_hl_frac': 0.015639243518446658, 'bb_std_mult': 0.8914266299047949, 'rsi_os': 23, 'rsi_ob': 61, 'vol_spike': 0.21530030758495441, 'adx_thresh': 9.136705225059716, 'atr_min_pct': 0.020570696545843346, 'atr_max_pct': 0.1058001181233848, 'tp_mult': 1.369006395162472, 'tsl_mult': 0.3830726387740282, 'strategy': 'mean_reversion', 'time_stop': 124, 'use_sma': False, 'use_atr': True, 'use_adx': True, 'use_ema': False, 'use_spike': False, 'rsi_required': False, 'edge_k': 0.6414516633574061, 'edge_cap': 0.3392639214425958, 'bull_strategy': 'mean_reversion', 'bull_bb_std_mult': 1.275792474892717, 'bull_rsi_os': 31, 'bull_rsi_ob': 67, 'bull_adx_thresh': 28.683883724241227, 'bull_atr_min_pct': 0.002833821710512756, 'bull_atr_max_pct': 0.04451581752685967, 'bull_tp_mult': 1.119472959811203, 'bull_tsl_mult': 0.7572053289291673, 'bull_time_stop': 133, 'bull_use_sma': False, 'bull_use_ema': True, 'bull_use_atr': False, 'bull_use_adx': False, 'bull_use_spike': True, 'bull_rsi_required': False, 'bear_strategy': 'mean_reversion', 'bear_bb_std_mult': 1.7018049113720728, 'bear_rsi_os': 36, 'bear_rsi_ob': 50, 'bear_adx_thresh': 24.592344686953645, 'bear_atr_min_pct': 0.01927075244318146, 'bear_atr_max_pct': 0.14987290675702855, 'bear_tp_mult': 1.8596581627118565, 'bear_tsl_mult': 0.7328764860095609, 'bear_time_stop': 67, 'bear_use_sma': False, 'bear_use_ema': False, 'bear_use_atr': False, 'bear_use_adx': True, 'bear_use_spike': True, 'bear_rsi_required': True, 'sideways_strategy': 'breakout', 'sideways_bb_std_mult': 2.1875093087194926, 'sideways_rsi_os': 40, 'sideways_rsi_ob': 84, 'sideways_adx_thresh': 15.462146834330355, 'sideways_atr_min_pct': 0.002896775873708399, 'sideways_atr_max_pct': 0.1455460127512665, 'sideways_tp_mult': 1.3664180942057398, 'sideways_tsl_mult': 0.8065938481199175, 'sideways_time_stop': 60, 'sideways_use_sma': False, 'sideways_use_ema': True, 'sideways_use_atr': True, 'sideways_use_adx': False, 'sideways_use_spike': False, 'sideways_rsi_required': False}.
