[I 2025-09-01 10:19:41,345] Trial 453 finished with values: [-1000000000.0, 1000000000.0] and parameters: {'p_sma': 16, 'p_std': 36, 'p_atr': 19, 'p_adx': 9, 'rsi_period': 46, 'ema1': 11, 'ema2': 14, 'slip_atr_k': 0.12479659394389651, 'slip_spread_k': 0.03890225002854347, 'spread_hl_frac': 0.04108842517900543, 'bb_std_mult': 1.4430097773652029, 'rsi_os': 30, 'rsi_ob': 83, 'vol_spike': 0.22497458680914867, 'adx_thresh': 26.90206746585124, 'atr_min_pct': 0.025034228980968798, 'atr_max_pct': 0.01870690473961408, 'tp_mult': 1.1266506596998151, 'tsl_mult': 0.6559212955414387, 'strategy': 'breakout', 'time_stop': 203, 'use_sma': True, 'use_atr': False, 'use_adx': True, 'use_ema': True, 'use_spike': True, 'rsi_required': True, 'edge_k': 1.6463428920907053, 'edge_cap': 0.5330284966355808, 'bull_strategy': 'mean_reversion', 'bull_bb_std_mult': 1.7207916941698207, 'bull_rsi_os': 45, 'bull_rsi_ob': 72, 'bull_adx_thresh': 6.482014906876403, 'bull_atr_min_pct': 0.022512361232120654, 'bull_atr_max_pct': 0.07675501170238436, 'bull_tp_mult': 2.303744457248868, 'bull_tsl_mult': 0.23486595997644139, 'bull_time_stop': 184, 'bull_use_sma': True, 'bull_use_ema': False, 'bull_use_atr': False, 'bull_use_adx': False, 'bull_use_spike': False, 'bull_rsi_required': True, 'bear_strategy': 'mean_reversion', 'bear_bb_std_mult': 1.0967515463402449, 'bear_rsi_os': 55, 'bear_rsi_ob': 75, 'bear_adx_thresh': 24.693354858305586, 'bear_atr_min_pct': 0.013103412611348893, 'bear_atr_max_pct': 0.07604012657320844, 'bear_tp_mult': 1.198888438223254, 'bear_tsl_mult': 0.41887634120211276, 'bear_time_stop': 281, 'bear_use_sma': True, 'bear_use_ema': False, 'bear_use_atr': False, 'bear_use_adx': False, 'bear_use_spike': True, 'bear_rsi_required': False, 'sideways_strategy': 'mean_reversion', 'sideways_bb_std_mult': 0.9470071032617812, 'sideways_rsi_os': 53, 'sideways_rsi_ob': 63, 'sideways_adx_thresh': 20.899441442304564, 'sideways_atr_min_pct': 0.02751408206294631, 'sideways_atr_max_pct': 0.02889310643658953, 'sideways_tp_mult': 2.4310773769447387, 'sideways_tsl_mult': 0.5434787292696285, 'sideways_time_stop': 16, 'sideways_use_sma': False, 'sideways_use_ema': False, 'sideways_use_atr': False, 'sideways_use_adx': True, 'sideways_use_spike': False, 'sideways_rsi_required': False}.
[I 2025-09-01 10:19:41,679] Trial 454 finished with values: [-1000000000.0, 1000000000.0] and parameters: {'p_sma': 57, 'p_std': 57, 'p_atr': 13, 'p_adx': 25, 'rsi_period': 9, 'ema1': 18, 'ema2': 20, 'slip_atr_k': 0.22165537819464493, 'slip_spread_k': 0.9086718006596968, 'spread_hl_frac': 0.015096578006380772, 'bb_std_mult': 1.462349402487694, 'rsi_os': 33, 'rsi_ob': 52, 'vol_spike': 0.09022675843147412, 'adx_thresh': 32.19342810042229, 'atr_min_pct': 0.016734765102216723, 'atr_max_pct': 0.012574002030464437, 'tp_mult': 1.632367955937062, 'tsl_mult': 0.7142483458948132, 'strategy': 'breakout', 'time_stop': 123, 'use_sma': True, 'use_atr': False, 'use_adx': False, 'use_ema': True, 'use_spike': True, 'rsi_required': True, 'edge_k': 1.304928247823821, 'edge_cap': 0.5945139393334494, 'bull_strategy': 'mean_reversion', 'bull_bb_std_mult': 3.5995386445130184, 'bull_rsi_os': 42, 'bull_rsi_ob': 50, 'bull_adx_thresh': 5.922320463776895, 'bull_atr_min_pct': 0.017613566466449113, 'bull_atr_max_pct': 0.08361838454104047, 'bull_tp_mult': 2.9610239736564066, 'bull_tsl_mult': 0.45078421379535644, 'bull_time_stop': 77, 'bull_use_sma': True, 'bull_use_ema': False, 'bull_use_atr': True, 'bull_use_adx': False, 'bull_use_spike': False, 'bull_rsi_required': True, 'bear_strategy': 'mean_reversion', 'bear_bb_std_mult': 0.9118400029966063, 'bear_rsi_os': 55, 'bear_rsi_ob': 73, 'bear_adx_thresh': 21.35325391172279, 'bear_atr_min_pct': 0.009783490454349772, 'bear_atr_max_pct': 0.05660735614565085, 'bear_tp_mult': 1.18541083597439, 'bear_tsl_mult': 0.09435463450735004, 'bear_time_stop': 294, 'bear_use_sma': True, 'bear_use_ema': False, 'bear_use_atr': True, 'bear_use_adx': False, 'bear_use_spike': False, 'bear_rsi_required': False, 'sideways_strategy': 'mean_reversion', 'sideways_bb_std_mult': 1.125420673191829, 'sideways_rsi_os': 52, 'sideways_rsi_ob': 92, 'sideways_adx_thresh': 25.809318214001667, 'sideways_atr_min_pct': 0.011138030092852686, 'sideways_atr_max_pct': 0.06679357548012765, 'sideways_tp_mult': 2.5438584007109477, 'sideways_tsl_mult': 0.509161902755969, 'sideways_time_stop': 24, 'sideways_use_sma': False, 'sideways_use_ema': False, 'sideways_use_atr': False, 'sideways_use_adx': True, 'sideways_use_spike': False, 'sideways_rsi_required': False}.
[I 2025-09-01 10:20:17,394] Trial 452 finished with values: [-1000000000.0, 1000000000.0] and parameters: {'p_sma': 16, 'p_std': 35, 'p_atr': 19, 'p_adx': 26, 'rsi_period': 39, 'ema1': 5, 'ema2': 41, 'slip_atr_k': 0.1266349434799233, 'slip_spread_k': 0.5866613386133378, 'spread_hl_frac': 0.02727885274616863, 'bb_std_mult': 1.4575381580599274, 'rsi_os': 8, 'rsi_ob': 81, 'vol_spike': 0.122224714092252, 'adx_thresh': 33.764847572518605, 'atr_min_pct': 0.022583389863027305, 'atr_max_pct': 0.12548080704730386, 'tp_mult': 2.6134411039717502, 'tsl_mult': 0.6587460676968676, 'strategy': 'breakout', 'time_stop': 44, 'use_sma': True, 'use_atr': False, 'use_adx': True, 'use_ema': True, 'use_spike': True, 'rsi_required': True, 'edge_k': 1.7736990542452737, 'edge_cap': 0.13673087050675287, 'bull_strategy': 'mean_reversion', 'bull_bb_std_mult': 3.5476325709332075, 'bull_rsi_os': 7, 'bull_rsi_ob': 59, 'bull_adx_thresh': 6.450382066030611, 'bull_atr_min_pct': 0.022681308731920286, 'bull_atr_max_pct': 0.08221980846402127, 'bull_tp_mult': 2.966450380426754, 'bull_tsl_mult': 0.4467159775679844, 'bull_time_stop': 189, 'bull_use_sma': True, 'bull_use_ema': False, 'bull_use_atr': False, 'bull_use_adx': False, 'bull_use_spike': False, 'bull_rsi_required': True, 'bear_strategy': 'mean_reversion', 'bear_bb_std_mult': 0.9082467436431726, 'bear_rsi_os': 36, 'bear_rsi_ob': 73, 'bear_adx_thresh': 24.76344806110249, 'bear_atr_min_pct': 0.0042497534774001144, 'bear_atr_max_pct': 0.05625493072925372, 'bear_tp_mult': 2.8798424636601223, 'bear_tsl_mult': 0.4666217360776277, 'bear_time_stop': 282, 'bear_use_sma': True, 'bear_use_ema': False, 'bear_use_atr': False, 'bear_use_adx': False, 'bear_use_spike': True, 'bear_rsi_required': False, 'sideways_strategy': 'mean_reversion', 'sideways_bb_std_mult': 1.1601970618781428, 'sideways_rsi_os': 53, 'sideways_rsi_ob': 90, 'sideways_adx_thresh': 21.072518050767574, 'sideways_atr_min_pct': 0.011229819598671663, 'sideways_atr_max_pct': 0.04599259026740016, 'sideways_tp_mult': 2.518652008058145, 'sideways_tsl_mult': 0.5555645225996704, 'sideways_time_stop': 92, 'sideways_use_sma': False, 'sideways_use_ema': True, 'sideways_use_atr': False, 'sideways_use_adx': True, 'sideways_use_spike': False, 'sideways_rsi_required': False}.
[I 2025-09-01 10:20:17,800] Trial 450 finished with values: [-1000000000.0, 1000000000.0] and parameters: {'p_sma': 9, 'p_std': 36, 'p_atr': 18, 'p_adx': 24, 'rsi_period': 22, 'ema1': 18, 'ema2': 27, 'slip_atr_k': 0.1396844095633443, 'slip_spread_k': 0.032836455311692936, 'spread_hl_frac': 0.032133699885212925, 'bb_std_mult': 1.5999353789747883, 'rsi_os': 55, 'rsi_ob': 64, 'vol_spike': 0.10246082587686514, 'adx_thresh': 34.01467925501053, 'atr_min_pct': 0.007887279987578317, 'atr_max_pct': 0.14011628767877488, 'tp_mult': 2.4296756812270592, 'tsl_mult': 0.656385026110944, 'strategy': 'breakout', 'time_stop': 193, 'use_sma': True, 'use_atr': False, 'use_adx': False, 'use_ema': False, 'use_spike': True, 'rsi_required': True, 'edge_k': 1.1622884582706652, 'edge_cap': 0.5373193363631747, 'bull_strategy': 'mean_reversion', 'bull_bb_std_mult': 1.7427984679449966, 'bull_rsi_os': 48, 'bull_rsi_ob': 62, 'bull_adx_thresh': 6.556136584011027, 'bull_atr_min_pct': 0.002033348793863448, 'bull_atr_max_pct': 0.08303811206399997, 'bull_tp_mult': 2.9630092939346513, 'bull_tsl_mult': 0.1642272508432035, 'bull_time_stop': 195, 'bull_use_sma': True, 'bull_use_ema': False, 'bull_use_atr': False, 'bull_use_adx': False, 'bull_use_spike': False, 'bull_rsi_required': True, 'bear_strategy': 'mean_reversion', 'bear_bb_std_mult': 0.7847084909182265, 'bear_rsi_os': 55, 'bear_rsi_ob': 78, 'bear_adx_thresh': 24.5177895551046, 'bear_atr_min_pct': 0.0066014523459325255, 'bear_atr_max_pct': 0.08929589224573226, 'bear_tp_mult': 1.4508760181400566, 'bear_tsl_mult': 0.4085823426150929, 'bear_time_stop': 281, 'bear_use_sma': True, 'bear_use_ema': False, 'bear_use_atr': False, 'bear_use_adx': True, 'bear_use_spike': False, 'bear_rsi_required': False, 'sideways_strategy': 'breakout', 'sideways_bb_std_mult': 0.9461573861046795, 'sideways_rsi_os': 55, 'sideways_rsi_ob': 49, 'sideways_adx_thresh': 22.603644897140967, 'sideways_atr_min_pct': 0.027498905752002516, 'sideways_atr_max_pct': 0.06646319063077138, 'sideways_tp_mult': 2.537972954822029, 'sideways_tsl_mult': 0.2055231938024994, 'sideways_time_stop': 38, 'sideways_use_sma': False, 'sideways_use_ema': True, 'sideways_use_atr': False, 'sideways_use_adx': True, 'sideways_use_spike': False, 'sideways_rsi_required': False}.
[I 2025-09-01 10:20:18,085] Trial 451 finished with values: [-1000000000.0, 1000000000.0] and parameters: {'p_sma': 48, 'p_std': 33, 'p_atr': 13, 'p_adx': 26, 'rsi_period': 22, 'ema1': 18, 'ema2': 14, 'slip_atr_k': 0.04675583598768725, 'slip_spread_k': 0.03830639611096098, 'spread_hl_frac': 0.03866685807719985, 'bb_std_mult': 2.0232795535567316, 'rsi_os': 13, 'rsi_ob': 67, 'vol_spike': 0.09939050961021151, 'adx_thresh': 26.331962283422985, 'atr_min_pct': 0.007800243069439172, 'atr_max_pct': 0.012679620068740044, 'tp_mult': 1.62181865240856, 'tsl_mult': 0.9149335509664126, 'strategy': 'breakout', 'time_stop': 45, 'use_sma': True, 'use_atr': False, 'use_adx': True, 'use_ema': True, 'use_spike': True, 'rsi_required': True, 'edge_k': 1.1539033143920534, 'edge_cap': 0.6064630454008852, 'bull_strategy': 'mean_reversion', 'bull_bb_std_mult': 0.9650267378768751, 'bull_rsi_os': 17, 'bull_rsi_ob': 50, 'bull_adx_thresh': 6.658897571169267, 'bull_atr_min_pct': 0.017669167093224802, 'bull_atr_max_pct': 0.08260246120973178, 'bull_tp_mult': 1.2352439403659665, 'bull_tsl_mult': 0.448129591244888, 'bull_time_stop': 132, 'bull_use_sma': True, 'bull_use_ema': False, 'bull_use_atr': False, 'bull_use_adx': False, 'bull_use_spike': False, 'bull_rsi_required': True, 'bear_strategy': 'mean_reversion', 'bear_bb_std_mult': 1.0864366482107257, 'bear_rsi_os': 36, 'bear_rsi_ob': 78, 'bear_adx_thresh': 13.283100450847968, 'bear_atr_min_pct': 0.006537807493035941, 'bear_atr_max_pct': 0.05563566365919971, 'bear_tp_mult': 1.1933627785938694, 'bear_tsl_mult': 0.4795515638570869, 'bear_time_stop': 281, 'bear_use_sma': True, 'bear_use_ema': False, 'bear_use_atr': False, 'bear_use_adx': False, 'bear_use_spike': True, 'bear_rsi_required': False, 'sideways_strategy': 'mean_reversion', 'sideways_bb_std_mult': 3.5971598531258326, 'sideways_rsi_os': 53, 'sideways_rsi_ob': 67, 'sideways_adx_thresh': 21.14610156657068, 'sideways_atr_min_pct': 0.002912748724070482, 'sideways_atr_max_pct': 0.06728568950428736, 'sideways_tp_mult': 2.507728895237088, 'sideways_tsl_mult': 0.20442435283969795, 'sideways_time_stop': 17, 'sideways_use_sma': False, 'sideways_use_ema': True, 'sideways_use_atr': False, 'sideways_use_adx': True, 'sideways_use_spike': False, 'sideways_rsi_required': False}.
[I 2025-09-01 10:20:19,159] Trial 455 finished with values: [-0.05162411525394184, 0.051503646532296575] and parameters: {'p_sma': 19, 'p_std': 33, 'p_atr': 18, 'p_adx': 8, 'rsi_period': 19, 'ema1': 15, 'ema2': 23, 'slip_atr_k': 0.04666933479243271, 'slip_spread_k': 0.5727023771615577, 'spread_hl_frac': 0.02732830662147539, 'bb_std_mult': 2.12963859725653, 'rsi_os': 45, 'rsi_ob': 64, 'vol_spike': 0.10269143879417525, 'adx_thresh': 33.36130082256809, 'atr_min_pct': 0.011673083465114703, 'atr_max_pct': 0.14133223072942547, 'tp_mult': 2.427309088633162, 'tsl_mult': 0.08874743477945918, 'strategy': 'breakout', 'time_stop': 134, 'use_sma': True, 'use_atr': False, 'use_adx': True, 'use_ema': True, 'use_spike': True, 'rsi_required': False, 'edge_k': 1.229834459458374, 'edge_cap': 0.635846209738027, 'bull_strategy': 'mean_reversion', 'bull_bb_std_mult': 1.3194984388070452, 'bull_rsi_os': 26, 'bull_rsi_ob': 57, 'bull_adx_thresh': 6.548178319560226, 'bull_atr_min_pct': 0.0007457332361210931, 'bull_atr_max_pct': 0.06132333724665279, 'bull_tp_mult': 1.817359312578532, 'bull_tsl_mult': 0.430676333155581, 'bull_time_stop': 271, 'bull_use_sma': True, 'bull_use_ema': False, 'bull_use_atr': True, 'bull_use_adx': False, 'bull_use_spike': False, 'bull_rsi_required': False, 'bear_strategy': 'mean_reversion', 'bear_bb_std_mult': 2.4104547955341724, 'bear_rsi_os': 13, 'bear_rsi_ob': 72, 'bear_adx_thresh': 23.735571043103683, 'bear_atr_min_pct': 0.004723480080330005, 'bear_atr_max_pct': 0.08814421760349808, 'bear_tp_mult': 1.643233381478926, 'bear_tsl_mult': 0.5533068170066311, 'bear_time_stop': 190, 'bear_use_sma': True, 'bear_use_ema': False, 'bear_use_atr': True, 'bear_use_adx': False, 'bear_use_spike': True, 'bear_rsi_required': False, 'sideways_strategy': 'mean_reversion', 'sideways_bb_std_mult': 1.9357126365381385, 'sideways_rsi_os': 53, 'sideways_rsi_ob': 83, 'sideways_adx_thresh': 15.773598671781503, 'sideways_atr_min_pct': 0.010231202342878908, 'sideways_atr_max_pct': 0.07253206452377763, 'sideways_tp_mult': 2.411640382404438, 'sideways_tsl_mult': 0.9027144126755159, 'sideways_time_stop': 169, 'sideways_use_sma': True, 'sideways_use_ema': False, 'sideways_use_atr': False, 'sideways_use_adx': False, 'sideways_use_spike': False, 'sideways_rsi_required': False}.
[I 2025-09-01 10:20:59,509] Trial 456 finished with values: [-0.04902036850047331, 0.04893203221392576] and parameters: {'p_sma': 48, 'p_std': 32, 'p_atr': 8, 'p_adx': 24, 'rsi_period': 19, 'ema1': 15, 'ema2': 60, 'slip_atr_k': 0.0689457112643658, 'slip_spread_k': 0.624372074634601, 'spread_hl_frac': 0.030694044939791696, 'bb_std_mult': 1.6195930529414337, 'rsi_os': 55, 'rsi_ob': 64, 'vol_spike': 0.2917079597125904, 'adx_thresh': 33.26676490947104, 'atr_min_pct': 0.011583479015542067, 'atr_max_pct': 0.1310161615213337, 'tp_mult': 1.0125198964218893, 'tsl_mult': 0.9218298294607291, 'strategy': 'breakout', 'time_stop': 253, 'use_sma': True, 'use_atr': False, 'use_adx': False, 'use_ema': True, 'use_spike': True, 'rsi_required': False, 'edge_k': 1.2428900005875732, 'edge_cap': 0.4736922696302879, 'bull_strategy': 'mean_reversion', 'bull_bb_std_mult': 3.4502367960612585, 'bull_rsi_os': 30, 'bull_rsi_ob': 46, 'bull_adx_thresh': 24.106989919163343, 'bull_atr_min_pct': 0.0020612235001484414, 'bull_atr_max_pct': 0.03766620215661633, 'bull_tp_mult': 1.808546113184997, 'bull_tsl_mult': 0.3946325678352095, 'bull_time_stop': 231, 'bull_use_sma': True, 'bull_use_ema': False, 'bull_use_atr': True, 'bull_use_adx': True, 'bull_use_spike': True, 'bull_rsi_required': False, 'bear_strategy': 'mean_reversion', 'bear_bb_std_mult': 2.4480651120558696, 'bear_rsi_os': 54, 'bear_rsi_ob': 56, 'bear_adx_thresh': 23.701579057567116, 'bear_atr_min_pct': 0.004790003095461267, 'bear_atr_max_pct': 0.04809354943934875, 'bear_tp_mult': 1.4105526118114797, 'bear_tsl_mult': 0.5519200452478841, 'bear_time_stop': 300, 'bear_use_sma': True, 'bear_use_ema': False, 'bear_use_atr': True, 'bear_use_adx': False, 'bear_use_spike': False, 'bear_rsi_required': True, 'sideways_strategy': 'mean_reversion', 'sideways_bb_std_mult': 1.4692840191973806, 'sideways_rsi_os': 52, 'sideways_rsi_ob': 67, 'sideways_adx_thresh': 22.405050089570775, 'sideways_atr_min_pct': 0.010399712439054609, 'sideways_atr_max_pct': 0.07260889297688239, 'sideways_tp_mult': 2.4504778170775676, 'sideways_tsl_mult': 0.203957116652572, 'sideways_time_stop': 12, 'sideways_use_sma': True, 'sideways_use_ema': False, 'sideways_use_atr': False, 'sideways_use_adx': False, 'sideways_use_spike': False, 'sideways_rsi_required': False}.
[I 2025-09-01 10:20:59,798] Trial 459 finished with values: [-1000000000.0, 1000000000.0] and parameters: {'p_sma': 15, 'p_std': 52, 'p_atr': 11, 'p_adx': 25, 'rsi_period': 43, 'ema1': 19, 'ema2': 29, 'slip_atr_k': 0.16899650925419, 'slip_spread_k': 0.622423956397606, 'spread_hl_frac': 0.03720149639438374, 'bb_std_mult': 1.5254460351506567, 'rsi_os': 41, 'rsi_ob': 68, 'vol_spike': 0.0755361081719362, 'adx_thresh': 33.2325239406897, 'atr_min_pct': 0.020166365496895333, 'atr_max_pct': 0.1315693789380877, 'tp_mult': 1.0396042862239352, 'tsl_mult': 0.7593433201517221, 'strategy': 'mean_reversion', 'time_stop': 248, 'use_sma': False, 'use_atr': True, 'use_adx': False, 'use_ema': True, 'use_spike': True, 'rsi_required': False, 'edge_k': 1.2453994030614746, 'edge_cap': 0.4684179393935496, 'bull_strategy': 'breakout', 'bull_bb_std_mult': 3.463975145702695, 'bull_rsi_os': 47, 'bull_rsi_ob': 78, 'bull_adx_thresh': 5.099785727083997, 'bull_atr_min_pct': 0.0028755667292323203, 'bull_atr_max_pct': 0.09234320283563127, 'bull_tp_mult': 2.919403317487675, 'bull_tsl_mult': 0.38975650037444415, 'bull_time_stop': 211, 'bull_use_sma': False, 'bull_use_ema': True, 'bull_use_atr': True, 'bull_use_adx': True, 'bull_use_spike': True, 'bull_rsi_required': False, 'bear_strategy': 'mean_reversion', 'bear_bb_std_mult': 3.3755660969745804, 'bear_rsi_os': 33, 'bear_rsi_ob': 56, 'bear_adx_thresh': 25.841207699225755, 'bear_atr_min_pct': 0.008108747911701245, 'bear_atr_max_pct': 0.11436958559712251, 'bear_tp_mult': 1.270324401355666, 'bear_tsl_mult': 0.5106037624848494, 'bear_time_stop': 29, 'bear_use_sma': False, 'bear_use_ema': True, 'bear_use_atr': True, 'bear_use_adx': False, 'bear_use_spike': False, 'bear_rsi_required': True, 'sideways_strategy': 'mean_reversion', 'sideways_bb_std_mult': 3.4500439118119974, 'sideways_rsi_os': 52, 'sideways_rsi_ob': 92, 'sideways_adx_thresh': 22.216699291434907, 'sideways_atr_min_pct': 0.008242494542427831, 'sideways_atr_max_pct': 0.07736115384258704, 'sideways_tp_mult': 2.2774326412779384, 'sideways_tsl_mult': 0.23250978935686323, 'sideways_time_stop': 31, 'sideways_use_sma': True, 'sideways_use_ema': False, 'sideways_use_atr': True, 'sideways_use_adx': False, 'sideways_use_spike': True, 'sideways_rsi_required': False}.
[I 2025-09-01 10:21:00,431] Trial 457 finished with values: [-1000000000.0, 1000000000.0] and parameters: {'p_sma': 19, 'p_std': 46, 'p_atr': 26, 'p_adx': 8, 'rsi_period': 25, 'ema1': 15, 'ema2': 60, 'slip_atr_k': 0.06969782752007306, 'slip_spread_k': 0.6267600877487431, 'spread_hl_frac': 0.0378916322438706, 'bb_std_mult': 1.8509217907705808, 'rsi_os': 11, 'rsi_ob': 67, 'vol_spike': 0.2999107687617046, 'adx_thresh': 6.4744877207763505, 'atr_min_pct': 0.01163397134342507, 'atr_max_pct': 0.05110672496703836, 'tp_mult': 1.0391485717341964, 'tsl_mult': 0.7745525519920549, 'strategy': 'breakout', 'time_stop': 254, 'use_sma': True, 'use_atr': True, 'use_adx': False, 'use_ema': True, 'use_spike': True, 'rsi_required': False, 'edge_k': 1.2387740752822396, 'edge_cap': 0.4645207659452162, 'bull_strategy': 'mean_reversion', 'bull_bb_std_mult': 3.4711165266273682, 'bull_rsi_os': 21, 'bull_rsi_ob': 76, 'bull_adx_thresh': 5.104408437134361, 'bull_atr_min_pct': 0.006321261170697598, 'bull_atr_max_pct': 0.04880278480992617, 'bull_tp_mult': 1.3356680005871153, 'bull_tsl_mult': 0.40083511815768164, 'bull_time_stop': 231, 'bull_use_sma': False, 'bull_use_ema': False, 'bull_use_atr': True, 'bull_use_adx': True, 'bull_use_spike': True, 'bull_rsi_required': False, 'bear_strategy': 'mean_reversion', 'bear_bb_std_mult': 1.0469197085592756, 'bear_rsi_os': 43, 'bear_rsi_ob': 62, 'bear_adx_thresh': 23.693581981568865, 'bear_atr_min_pct': 0.007252594517416244, 'bear_atr_max_pct': 0.03746179996052308, 'bear_tp_mult': 2.9273280632400787, 'bear_tsl_mult': 0.5412547279629857, 'bear_time_stop': 122, 'bear_use_sma': False, 'bear_use_ema': True, 'bear_use_atr': True, 'bear_use_adx': False, 'bear_use_spike': False, 'bear_rsi_required': True, 'sideways_strategy': 'mean_reversion', 'sideways_bb_std_mult': 1.4731049179787687, 'sideways_rsi_os': 52, 'sideways_rsi_ob': 65, 'sideways_adx_thresh': 25.019703941772917, 'sideways_atr_min_pct': 0.010421481961444082, 'sideways_atr_max_pct': 0.07314671372474775, 'sideways_tp_mult': 2.268391791022867, 'sideways_tsl_mult': 0.43231769677858656, 'sideways_time_stop': 254, 'sideways_use_sma': True, 'sideways_use_ema': False, 'sideways_use_atr': True, 'sideways_use_adx': False, 'sideways_use_spike': True, 'sideways_rsi_required': False}.
