[I 2025-09-01 09:36:18,079] Trial 186 finished with values: [-1000000000.0, 1000000000.0] and parameters: {'p_sma': 52, 'p_std': 59, 'p_atr': 22, 'p_adx': 18, 'rsi_period': 21, 'ema1': 20, 'ema2': 17, 'slip_atr_k': 0.039217445710771716, 'slip_spread_k': 0.6249211277401302, 'spread_hl_frac': 0.003578079272847902, 'bb_std_mult': 3.006627822938544, 'rsi_os': 48, 'rsi_ob': 92, 'vol_spike': 0.1267073640874598, 'adx_thresh': 29.6197138797911, 'atr_min_pct': 0.026543394539292314, 'atr_max_pct': 0.0720484595992797, 'tp_mult': 1.0436313876433085, 'tsl_mult': 0.4132749904053236, 'strategy': 'breakout', 'time_stop': 198, 'use_sma': True, 'use_atr': False, 'use_adx': False, 'use_ema': True, 'use_spike': True, 'rsi_required': True, 'edge_k': 1.3257774787973797, 'edge_cap': 0.8507498954759618, 'bull_strategy': 'breakout', 'bull_bb_std_mult': 3.484374951246312, 'bull_rsi_os': 49, 'bull_rsi_ob': 51, 'bull_adx_thresh': 5.804737676955703, 'bull_atr_min_pct': 0.013600675017446322, 'bull_atr_max_pct': 0.030345894755597548, 'bull_tp_mult': 1.498664774988068, 'bull_tsl_mult': 0.9990696302643279, 'bull_time_stop': 89, 'bull_use_sma': True, 'bull_use_ema': False, 'bull_use_atr': True, 'bull_use_adx': False, 'bull_use_spike': False, 'bull_rsi_required': True, 'bear_strategy': 'mean_reversion', 'bear_bb_std_mult': 1.2005017068325918, 'bear_rsi_os': 54, 'bear_rsi_ob': 88, 'bear_adx_thresh': 25.88074579386152, 'bear_atr_min_pct': 0.006040698175777234, 'bear_atr_max_pct': 0.07768554479024832, 'bear_tp_mult': 2.2227623183632996, 'bear_tsl_mult': 0.3972708601111751, 'bear_time_stop': 183, 'bear_use_sma': True, 'bear_use_ema': True, 'bear_use_atr': True, 'bear_use_adx': False, 'bear_use_spike': False, 'bear_rsi_required': False, 'sideways_strategy': 'mean_reversion', 'sideways_bb_std_mult': 0.9741281446200312, 'sideways_rsi_os': 12, 'sideways_rsi_ob': 93, 'sideways_adx_thresh': 26.070909987476604, 'sideways_atr_min_pct': 0.02030649157784822, 'sideways_atr_max_pct': 0.10950239348250326, 'sideways_tp_mult': 2.749670821459894, 'sideways_tsl_mult': 0.4907267784669777, 'sideways_time_stop': 39, 'sideways_use_sma': True, 'sideways_use_ema': False, 'sideways_use_atr': False, 'sideways_use_adx': True, 'sideways_use_spike': False, 'sideways_rsi_required': False}.
[I 2025-09-01 09:36:58,941] Trial 191 finished with values: [-1000000000.0, 1000000000.0] and parameters: {'p_sma': 24, 'p_std': 13, 'p_atr': 17, 'p_adx': 18, 'rsi_period': 17, 'ema1': 19, 'ema2': 15, 'slip_atr_k': 0.07791907419371268, 'slip_spread_k': 0.6501958989584534, 'spread_hl_frac': 0.029498725277016732, 'bb_std_mult': 3.021572107144836, 'rsi_os': 40, 'rsi_ob': 70, 'vol_spike': 0.023247446013064083, 'adx_thresh': 29.751727177561932, 'atr_min_pct': 0.028090756370469473, 'atr_max_pct': 0.03417306513778869, 'tp_mult': 1.0117026213147593, 'tsl_mult': 0.924105876454025, 'strategy': 'breakout', 'time_stop': 264, 'use_sma': True, 'use_atr': False, 'use_adx': False, 'use_ema': True, 'use_spike': True, 'rsi_required': True, 'edge_k': 0.6110047354076611, 'edge_cap': 0.8558870074225073, 'bull_strategy': 'breakout', 'bull_bb_std_mult': 3.001478125485042, 'bull_rsi_os': 44, 'bull_rsi_ob': 50, 'bull_adx_thresh': 5.948500637361178, 'bull_atr_min_pct': 0.00945516206087588, 'bull_atr_max_pct': 0.013200145374090769, 'bull_tp_mult': 1.4873572580009202, 'bull_tsl_mult': 0.9209176659318637, 'bull_time_stop': 259, 'bull_use_sma': True, 'bull_use_ema': False, 'bull_use_atr': True, 'bull_use_adx': True, 'bull_use_spike': False, 'bull_rsi_required': True, 'bear_strategy': 'mean_reversion', 'bear_bb_std_mult': 1.8457033566505232, 'bear_rsi_os': 38, 'bear_rsi_ob': 93, 'bear_adx_thresh': 23.745759999340137, 'bear_atr_min_pct': 0.0066164397898191805, 'bear_atr_max_pct': 0.07463277547717495, 'bear_tp_mult': 2.1740422161886936, 'bear_tsl_mult': 0.39286624654662566, 'bear_time_stop': 279, 'bear_use_sma': True, 'bear_use_ema': True, 'bear_use_atr': True, 'bear_use_adx': False, 'bear_use_spike': False, 'bear_rsi_required': False, 'sideways_strategy': 'mean_reversion', 'sideways_bb_std_mult': 0.8786198705830598, 'sideways_rsi_os': 54, 'sideways_rsi_ob': 93, 'sideways_adx_thresh': 28.801813265486555, 'sideways_atr_min_pct': 0.022965008789555555, 'sideways_atr_max_pct': 0.08993064743837505, 'sideways_tp_mult': 1.8756964519095725, 'sideways_tsl_mult': 0.7588083582940932, 'sideways_time_stop': 183, 'sideways_use_sma': True, 'sideways_use_ema': False, 'sideways_use_atr': False, 'sideways_use_adx': True, 'sideways_use_spike': False, 'sideways_rsi_required': False}.
[I 2025-09-01 09:36:59,181] Trial 193 finished with values: [-1000000000.0, 1000000000.0] and parameters: {'p_sma': 56, 'p_std': 13, 'p_atr': 16, 'p_adx': 19, 'rsi_period': 17, 'ema1': 29, 'ema2': 15, 'slip_atr_k': 0.0796833026800707, 'slip_spread_k': 0.2636618563435591, 'spread_hl_frac': 0.029228722555769842, 'bb_std_mult': 2.0366418628893053, 'rsi_os': 21, 'rsi_ob': 70, 'vol_spike': 0.022171704738007947, 'adx_thresh': 21.94812956159165, 'atr_min_pct': 0.014057477298363433, 'atr_max_pct': 0.0851174821989728, 'tp_mult': 2.535430825570921, 'tsl_mult': 0.6424179068297453, 'strategy': 'breakout', 'time_stop': 101, 'use_sma': True, 'use_atr': False, 'use_adx': False, 'use_ema': True, 'use_spike': True, 'rsi_required': True, 'edge_k': 1.4230445954286834, 'edge_cap': 0.9846898545922111, 'bull_strategy': 'breakout', 'bull_bb_std_mult': 2.9999971700013446, 'bull_rsi_os': 44, 'bull_rsi_ob': 47, 'bull_adx_thresh': 6.683501477364947, 'bull_atr_min_pct': 0.010563365164002338, 'bull_atr_max_pct': 0.0883767164599407, 'bull_tp_mult': 1.6386522952553992, 'bull_tsl_mult': 0.5513744602168268, 'bull_time_stop': 253, 'bull_use_sma': True, 'bull_use_ema': False, 'bull_use_atr': True, 'bull_use_adx': True, 'bull_use_spike': False, 'bull_rsi_required': True, 'bear_strategy': 'mean_reversion', 'bear_bb_std_mult': 1.8460269510813152, 'bear_rsi_os': 55, 'bear_rsi_ob': 93, 'bear_adx_thresh': 23.96879468434079, 'bear_atr_min_pct': 0.02817546313187961, 'bear_atr_max_pct': 0.11449802839182205, 'bear_tp_mult': 2.1733644434622357, 'bear_tsl_mult': 0.2404805530240311, 'bear_time_stop': 257, 'bear_use_sma': True, 'bear_use_ema': True, 'bear_use_atr': True, 'bear_use_adx': False, 'bear_use_spike': False, 'bear_rsi_required': False, 'sideways_strategy': 'mean_reversion', 'sideways_bb_std_mult': 1.2682677472020591, 'sideways_rsi_os': 48, 'sideways_rsi_ob': 72, 'sideways_adx_thresh': 28.780495035834583, 'sideways_atr_min_pct': 0.018754268415494067, 'sideways_atr_max_pct': 0.03364902367170707, 'sideways_tp_mult': 2.014771343546731, 'sideways_tsl_mult': 0.4113529015410739, 'sideways_time_stop': 112, 'sideways_use_sma': True, 'sideways_use_ema': False, 'sideways_use_atr': False, 'sideways_use_adx': True, 'sideways_use_spike': False, 'sideways_rsi_required': True}.
[I 2025-09-01 09:36:59,500] Trial 190 finished with values: [-1000000000.0, 1000000000.0] and parameters: {'p_sma': 24, 'p_std': 9, 'p_atr': 17, 'p_adx': 18, 'rsi_period': 17, 'ema1': 20, 'ema2': 26, 'slip_atr_k': 0.040295820672896374, 'slip_spread_k': 0.6439768551419128, 'spread_hl_frac': 0.0037037078615285365, 'bb_std_mult': 1.8252990671224782, 'rsi_os': 40, 'rsi_ob': 92, 'vol_spike': 0.02278026057672136, 'adx_thresh': 32.82704006692637, 'atr_min_pct': 0.027924340613634545, 'atr_max_pct': 0.08034266996571242, 'tp_mult': 1.02025021721636, 'tsl_mult': 0.4676347098969305, 'strategy': 'breakout', 'time_stop': 295, 'use_sma': True, 'use_atr': False, 'use_adx': False, 'use_ema': True, 'use_spike': True, 'rsi_required': True, 'edge_k': 1.8389643288698423, 'edge_cap': 0.8522047628811047, 'bull_strategy': 'breakout', 'bull_bb_std_mult': 3.497716014934919, 'bull_rsi_os': 49, 'bull_rsi_ob': 50, 'bull_adx_thresh': 5.922945808122905, 'bull_atr_min_pct': 0.010565763178088418, 'bull_atr_max_pct': 0.03173443524809003, 'bull_tp_mult': 1.5158512091271654, 'bull_tsl_mult': 0.9997265607525416, 'bull_time_stop': 254, 'bull_use_sma': True, 'bull_use_ema': False, 'bull_use_atr': True, 'bull_use_adx': True, 'bull_use_spike': False, 'bull_rsi_required': True, 'bear_strategy': 'mean_reversion', 'bear_bb_std_mult': 1.8550490745099775, 'bear_rsi_os': 39, 'bear_rsi_ob': 93, 'bear_adx_thresh': 23.84263059849417, 'bear_atr_min_pct': 0.010532201470615616, 'bear_atr_max_pct': 0.07943475497832325, 'bear_tp_mult': 2.1745292007913357, 'bear_tsl_mult': 0.396362245821086, 'bear_time_stop': 59, 'bear_use_sma': True, 'bear_use_ema': True, 'bear_use_atr': True, 'bear_use_adx': False, 'bear_use_spike': False, 'bear_rsi_required': False, 'sideways_strategy': 'mean_reversion', 'sideways_bb_std_mult': 1.2689253687386444, 'sideways_rsi_os': 54, 'sideways_rsi_ob': 62, 'sideways_adx_thresh': 26.22175478807758, 'sideways_atr_min_pct': 0.018914694441159164, 'sideways_atr_max_pct': 0.10836208308164548, 'sideways_tp_mult': 1.8661216931375844, 'sideways_tsl_mult': 0.5913306095901213, 'sideways_time_stop': 177, 'sideways_use_sma': True, 'sideways_use_ema': False, 'sideways_use_atr': False, 'sideways_use_adx': True, 'sideways_use_spike': False, 'sideways_rsi_required': False}.
[I 2025-09-01 09:36:59,510] Trial 192 finished with values: [-1000000000.0, 1000000000.0] and parameters: {'p_sma': 56, 'p_std': 47, 'p_atr': 16, 'p_adx': 19, 'rsi_period': 12, 'ema1': 22, 'ema2': 15, 'slip_atr_k': 0.05587624262677325, 'slip_spread_k': 0.27134201084198584, 'spread_hl_frac': 0.029905300623031435, 'bb_std_mult': 1.2772581335448372, 'rsi_os': 40, 'rsi_ob': 49, 'vol_spike': 0.02282481841715133, 'adx_thresh': 22.022933325132833, 'atr_min_pct': 0.027952627458075772, 'atr_max_pct': 0.08006919327683175, 'tp_mult': 2.7055727240960508, 'tsl_mult': 0.9232022958850836, 'strategy': 'breakout', 'time_stop': 278, 'use_sma': True, 'use_atr': False, 'use_adx': False, 'use_ema': True, 'use_spike': True, 'rsi_required': True, 'edge_k': 1.2326816077307037, 'edge_cap': 0.08188063472449048, 'bull_strategy': 'breakout', 'bull_bb_std_mult': 2.8662019515945065, 'bull_rsi_os': 44, 'bull_rsi_ob': 56, 'bull_adx_thresh': 6.669765646434586, 'bull_atr_min_pct': 0.006021351593668528, 'bull_atr_max_pct': 0.0897138026966434, 'bull_tp_mult': 1.6423030677959976, 'bull_tsl_mult': 0.5871604360201315, 'bull_time_stop': 257, 'bull_use_sma': True, 'bull_use_ema': False, 'bull_use_atr': True, 'bull_use_adx': True, 'bull_use_spike': False, 'bull_rsi_required': True, 'bear_strategy': 'mean_reversion', 'bear_bb_std_mult': 1.8577997496746863, 'bear_rsi_os': 39, 'bear_rsi_ob': 93, 'bear_adx_thresh': 23.89078779798713, 'bear_atr_min_pct': 0.028261953507626603, 'bear_atr_max_pct': 0.0741139576375459, 'bear_tp_mult': 2.6912003487517078, 'bear_tsl_mult': 0.6169442562713218, 'bear_time_stop': 255, 'bear_use_sma': True, 'bear_use_ema': True, 'bear_use_atr': True, 'bear_use_adx': False, 'bear_use_spike': False, 'bear_rsi_required': False, 'sideways_strategy': 'mean_reversion', 'sideways_bb_std_mult': 1.2570667036000494, 'sideways_rsi_os': 49, 'sideways_rsi_ob': 62, 'sideways_adx_thresh': 28.92277991887948, 'sideways_atr_min_pct': 0.018733742023177166, 'sideways_atr_max_pct': 0.12436291507817385, 'sideways_tp_mult': 1.8629652102001701, 'sideways_tsl_mult': 0.4045083605615062, 'sideways_time_stop': 110, 'sideways_use_sma': True, 'sideways_use_ema': False, 'sideways_use_atr': False, 'sideways_use_adx': True, 'sideways_use_spike': False, 'sideways_rsi_required': True}.
[I 2025-09-01 09:37:41,699] Trial 195 finished with values: [-1000000000.0, 1000000000.0] and parameters: {'p_sma': 20, 'p_std': 35, 'p_atr': 17, 'p_adx': 22, 'rsi_period': 24, 'ema1': 19, 'ema2': 29, 'slip_atr_k': 0.05360043100693858, 'slip_spread_k': 0.5917561457014292, 'spread_hl_frac': 0.030222182277417162, 'bb_std_mult': 1.2847870569619768, 'rsi_os': 38, 'rsi_ob': 67, 'vol_spike': 0.03871958380814059, 'adx_thresh': 34.08004704484172, 'atr_min_pct': 0.023505342429963702, 'atr_max_pct': 0.0714267170546311, 'tp_mult': 1.0844252565628358, 'tsl_mult': 0.4425512315492939, 'strategy': 'breakout', 'time_stop': 281, 'use_sma': True, 'use_atr': False, 'use_adx': False, 'use_ema': True, 'use_spike': True, 'rsi_required': True, 'edge_k': 1.183734869277847, 'edge_cap': 0.8850303697080195, 'bull_strategy': 'breakout', 'bull_bb_std_mult': 3.436663573186135, 'bull_rsi_os': 46, 'bull_rsi_ob': 57, 'bull_adx_thresh': 7.628066324329592, 'bull_atr_min_pct': 0.005330698794272114, 'bull_atr_max_pct': 0.09120590509832521, 'bull_tp_mult': 1.5499553553584797, 'bull_tsl_mult': 0.9562948094247122, 'bull_time_stop': 242, 'bull_use_sma': True, 'bull_use_ema': False, 'bull_use_atr': True, 'bull_use_adx': False, 'bull_use_spike': False, 'bull_rsi_required': True, 'bear_strategy': 'mean_reversion', 'bear_bb_std_mult': 2.047905758345661, 'bear_rsi_os': 53, 'bear_rsi_ob': 94, 'bear_adx_thresh': 11.452451260452847, 'bear_atr_min_pct': 0.008191490962305531, 'bear_atr_max_pct': 0.07276838401555018, 'bear_tp_mult': 2.4056645451876033, 'bear_tsl_mult': 0.2899775618187778, 'bear_time_stop': 290, 'bear_use_sma': True, 'bear_use_ema': True, 'bear_use_atr': True, 'bear_use_adx': False, 'bear_use_spike': False, 'bear_rsi_required': False, 'sideways_strategy': 'mean_reversion', 'sideways_bb_std_mult': 0.8473076693151664, 'sideways_rsi_os': 51, 'sideways_rsi_ob': 89, 'sideways_adx_thresh': 26.882978142473597, 'sideways_atr_min_pct': 0.021342736530333847, 'sideways_atr_max_pct': 0.061017840218080835, 'sideways_tp_mult': 2.0146239234493732, 'sideways_tsl_mult': 0.4258466734219723, 'sideways_time_stop': 27, 'sideways_use_sma': True, 'sideways_use_ema': False, 'sideways_use_atr': False, 'sideways_use_adx': True, 'sideways_use_spike': False, 'sideways_rsi_required': False}.
[I 2025-09-01 09:37:41,701] Trial 194 finished with values: [-1000000000.0, 1000000000.0] and parameters: {'p_sma': 20, 'p_std': 57, 'p_atr': 17, 'p_adx': 25, 'rsi_period': 43, 'ema1': 19, 'ema2': 16, 'slip_atr_k': 0.05461553242178946, 'slip_spread_k': 0.5951089633814881, 'spread_hl_frac': 0.02636147483807708, 'bb_std_mult': 1.8388949677267303, 'rsi_os': 38, 'rsi_ob': 67, 'vol_spike': 0.01208724502810225, 'adx_thresh': 34.02257181496704, 'atr_min_pct': 0.02777251560472941, 'atr_max_pct': 0.0812853829731189, 'tp_mult': 1.0923023043256934, 'tsl_mult': 0.44400590038983395, 'strategy': 'breakout', 'time_stop': 293, 'use_sma': True, 'use_atr': False, 'use_adx': False, 'use_ema': True, 'use_spike': True, 'rsi_required': True, 'edge_k': 1.2321821053707824, 'edge_cap': 0.886937216444355, 'bull_strategy': 'breakout', 'bull_bb_std_mult': 3.5955512685749884, 'bull_rsi_os': 46, 'bull_rsi_ob': 49, 'bull_adx_thresh': 32.11497720292583, 'bull_atr_min_pct': 0.020310087457500497, 'bull_atr_max_pct': 0.040266289828557664, 'bull_tp_mult': 1.5346404666670403, 'bull_tsl_mult': 0.7181540593692606, 'bull_time_stop': 244, 'bull_use_sma': True, 'bull_use_ema': False, 'bull_use_atr': True, 'bull_use_adx': False, 'bull_use_spike': False, 'bull_rsi_required': True, 'bear_strategy': 'mean_reversion', 'bear_bb_std_mult': 2.0250661248182675, 'bear_rsi_os': 44, 'bear_rsi_ob': 94, 'bear_adx_thresh': 14.096170709504628, 'bear_atr_min_pct': 0.028647772055808804, 'bear_atr_max_pct': 0.06739639895197827, 'bear_tp_mult': 2.128840812450246, 'bear_tsl_mult': 0.5635992885540966, 'bear_time_stop': 257, 'bear_use_sma': True, 'bear_use_ema': True, 'bear_use_atr': True, 'bear_use_adx': False, 'bear_use_spike': False, 'bear_rsi_required': False, 'sideways_strategy': 'mean_reversion', 'sideways_bb_std_mult': 0.821062905062319, 'sideways_rsi_os': 51, 'sideways_rsi_ob': 89, 'sideways_adx_thresh': 27.136202779878232, 'sideways_atr_min_pct': 0.02189523335041495, 'sideways_atr_max_pct': 0.06210672792891306, 'sideways_tp_mult': 2.817093367398525, 'sideways_tsl_mult': 0.19668911640068204, 'sideways_time_stop': 18, 'sideways_use_sma': True, 'sideways_use_ema': False, 'sideways_use_atr': False, 'sideways_use_adx': True, 'sideways_use_spike': False, 'sideways_rsi_required': False}.
[I 2025-09-01 09:37:42,552] Trial 197 finished with values: [-1000000000.0, 1000000000.0] and parameters: {'p_sma': 20, 'p_std': 57, 'p_atr': 17, 'p_adx': 22, 'rsi_period': 23, 'ema1': 19, 'ema2': 16, 'slip_atr_k': 0.04850115350161567, 'slip_spread_k': 0.7141043237863316, 'spread_hl_frac': 0.026346143712281292, 'bb_std_mult': 1.4195505586876502, 'rsi_os': 38, 'rsi_ob': 69, 'vol_spike': 0.042548713994573606, 'adx_thresh': 18.25944860715413, 'atr_min_pct': 0.0028058224173375737, 'atr_max_pct': 0.07214858608235183, 'tp_mult': 1.105713786795107, 'tsl_mult': 0.4484114913569615, 'strategy': 'breakout', 'time_stop': 153, 'use_sma': True, 'use_atr': False, 'use_adx': False, 'use_ema': True, 'use_spike': True, 'rsi_required': True, 'edge_k': 1.168320446247986, 'edge_cap': 0.7900170625070344, 'bull_strategy': 'breakout', 'bull_bb_std_mult': 3.4111028167350055, 'bull_rsi_os': 47, 'bull_rsi_ob': 47, 'bull_adx_thresh': 5.389903574238062, 'bull_atr_min_pct': 0.020393871084769276, 'bull_atr_max_pct': 0.05098160810607737, 'bull_tp_mult': 2.1726273058277727, 'bull_tsl_mult': 0.7110576744737802, 'bull_time_stop': 242, 'bull_use_sma': True, 'bull_use_ema': False, 'bull_use_atr': True, 'bull_use_adx': False, 'bull_use_spike': False, 'bull_rsi_required': True, 'bear_strategy': 'mean_reversion', 'bear_bb_std_mult': 2.0387393370494555, 'bear_rsi_os': 55, 'bear_rsi_ob': 94, 'bear_adx_thresh': 14.513469685911286, 'bear_atr_min_pct': 0.027227097499955596, 'bear_atr_max_pct': 0.07146320711942487, 'bear_tp_mult': 2.118635545550349, 'bear_tsl_mult': 0.29884180736642285, 'bear_time_stop': 289, 'bear_use_sma': True, 'bear_use_ema': True, 'bear_use_atr': True, 'bear_use_adx': False, 'bear_use_spike': False, 'bear_rsi_required': False, 'sideways_strategy': 'mean_reversion', 'sideways_bb_std_mult': 0.9058945924549006, 'sideways_rsi_os': 53, 'sideways_rsi_ob': 89, 'sideways_adx_thresh': 26.881074171521227, 'sideways_atr_min_pct': 0.02158291157049741, 'sideways_atr_max_pct': 0.07659979470456305, 'sideways_tp_mult': 2.37150081012096, 'sideways_tsl_mult': 0.2148777889890785, 'sideways_time_stop': 221, 'sideways_use_sma': True, 'sideways_use_ema': False, 'sideways_use_atr': False, 'sideways_use_adx': True, 'sideways_use_spike': True, 'sideways_rsi_required': False}.
[I 2025-09-01 09:37:43,053] Trial 196 finished with values: [-1000000000.0, 1000000000.0] and parameters: {'p_sma': 20, 'p_std': 57, 'p_atr': 17, 'p_adx': 22, 'rsi_period': 24, 'ema1': 19, 'ema2': 18, 'slip_atr_k': 0.04996356298378582, 'slip_spread_k': 0.596607962010938, 'spread_hl_frac': 0.0266349595838486, 'bb_std_mult': 1.4397801373238934, 'rsi_os': 14, 'rsi_ob': 69, 'vol_spike': 0.03676493288327011, 'adx_thresh': 18.306745694057106, 'atr_min_pct': 0.0029307002480670388, 'atr_max_pct': 0.07142893859460978, 'tp_mult': 2.8628401167048505, 'tsl_mult': 0.44558024291237874, 'strategy': 'breakout', 'time_stop': 138, 'use_sma': True, 'use_atr': False, 'use_adx': False, 'use_ema': True, 'use_spike': True, 'rsi_required': True, 'edge_k': 1.174875425759639, 'edge_cap': 0.19290307052662498, 'bull_strategy': 'breakout', 'bull_bb_std_mult': 3.594012198516159, 'bull_rsi_os': 47, 'bull_rsi_ob': 82, 'bull_adx_thresh': 11.898291308855855, 'bull_atr_min_pct': 0.02036359817076959, 'bull_atr_max_pct': 0.09211493933311073, 'bull_tp_mult': 1.544196610418522, 'bull_tsl_mult': 0.7302828607546537, 'bull_time_stop': 31, 'bull_use_sma': True, 'bull_use_ema': False, 'bull_use_atr': True, 'bull_use_adx': False, 'bull_use_spike': False, 'bull_rsi_required': True, 'bear_strategy': 'mean_reversion', 'bear_bb_std_mult': 2.042066858516064, 'bear_rsi_os': 55, 'bear_rsi_ob': 95, 'bear_adx_thresh': 23.185082346124485, 'bear_atr_min_pct': 0.008021186702717696, 'bear_atr_max_pct': 0.07165544443880047, 'bear_tp_mult': 2.027658273832249, 'bear_tsl_mult': 0.513232362783798, 'bear_time_stop': 149, 'bear_use_sma': True, 'bear_use_ema': True, 'bear_use_atr': True, 'bear_use_adx': False, 'bear_use_spike': False, 'bear_rsi_required': False, 'sideways_strategy': 'mean_reversion', 'sideways_bb_std_mult': 0.8316344243812223, 'sideways_rsi_os': 51, 'sideways_rsi_ob': 89, 'sideways_adx_thresh': 26.965582247315172, 'sideways_atr_min_pct': 0.021815399662393976, 'sideways_atr_max_pct': 0.07678190002341932, 'sideways_tp_mult': 2.367594137610162, 'sideways_tsl_mult': 0.43258687800455997, 'sideways_time_stop': 125, 'sideways_use_sma': True, 'sideways_use_ema': False, 'sideways_use_atr': False, 'sideways_use_adx': True, 'sideways_use_spike': True, 'sideways_rsi_required': False}.
