[I 2025-09-01 10:35:03,027] Trial 564 finished with values: [-1000000000.0, 1000000000.0] and parameters: {'p_sma': 15, 'p_std': 41, 'p_atr': 13, 'p_adx': 15, 'rsi_period': 37, 'ema1': 5, 'ema2': 12, 'slip_atr_k': 0.012954964900908014, 'slip_spread_k': 0.7961414234523095, 'spread_hl_frac': 0.012031683932130005, 'bb_std_mult': 0.821290399952865, 'rsi_os': 16, 'rsi_ob': 62, 'vol_spike': 0.26363650302285857, 'adx_thresh': 21.79461116866655, 'atr_min_pct': 0.01795379210752366, 'atr_max_pct': 0.024568365680232587, 'tp_mult': 1.5722362022374095, 'tsl_mult': 0.16693109582609408, 'strategy': 'breakout', 'time_stop': 128, 'use_sma': True, 'use_atr': False, 'use_adx': False, 'use_ema': False, 'use_spike': False, 'rsi_required': False, 'edge_k': 1.4787661730196613, 'edge_cap': 0.36049399257386955, 'bull_strategy': 'mean_reversion', 'bull_bb_std_mult': 0.6270816219987337, 'bull_rsi_os': 19, 'bull_rsi_ob': 76, 'bull_adx_thresh': 15.646743167100542, 'bull_atr_min_pct': 0.0022718267305640574, 'bull_atr_max_pct': 0.016594420816263136, 'bull_tp_mult': 1.1986189146036892, 'bull_tsl_mult': 0.8921437924333225, 'bull_time_stop': 251, 'bull_use_sma': False, 'bull_use_ema': False, 'bull_use_atr': False, 'bull_use_adx': True, 'bull_use_spike': True, 'bull_rsi_required': False, 'bear_strategy': 'breakout', 'bear_bb_std_mult': 1.6727905741626106, 'bear_rsi_os': 17, 'bear_rsi_ob': 86, 'bear_adx_thresh': 28.28235189297923, 'bear_atr_min_pct': 0.0024012668276067826, 'bear_atr_max_pct': 0.11198287374380023, 'bear_tp_mult': 1.574425867460327, 'bear_tsl_mult': 0.3229721115953749, 'bear_time_stop': 254, 'bear_use_sma': True, 'bear_use_ema': True, 'bear_use_atr': False, 'bear_use_adx': True, 'bear_use_spike': True, 'bear_rsi_required': True, 'sideways_strategy': 'breakout', 'sideways_bb_std_mult': 0.5489906879509088, 'sideways_rsi_os': 11, 'sideways_rsi_ob': 67, 'sideways_adx_thresh': 29.940638282186047, 'sideways_atr_min_pct': 0.008049455267054558, 'sideways_atr_max_pct': 0.06087326712064641, 'sideways_tp_mult': 1.8899380920758888, 'sideways_tsl_mult': 0.32509605384278184, 'sideways_time_stop': 232, 'sideways_use_sma': False, 'sideways_use_ema': True, 'sideways_use_atr': True, 'sideways_use_adx': False, 'sideways_use_spike': False, 'sideways_rsi_required': True}.
[I 2025-09-01 10:35:03,388] Trial 568 finished with values: [-1000000000.0, 1000000000.0] and parameters: {'p_sma': 15, 'p_std': 53, 'p_atr': 13, 'p_adx': 15, 'rsi_period': 42, 'ema1': 8, 'ema2': 12, 'slip_atr_k': 0.016806333175954244, 'slip_spread_k': 0.9131713401705644, 'spread_hl_frac': 0.014614517242581495, 'bb_std_mult': 1.087357686570216, 'rsi_os': 17, 'rsi_ob': 60, 'vol_spike': 0.26016733898994293, 'adx_thresh': 24.65877473850738, 'atr_min_pct': 0.01495420802442641, 'atr_max_pct': 0.02194239227664073, 'tp_mult': 1.4849427991186006, 'tsl_mult': 0.10297727802355922, 'strategy': 'breakout', 'time_stop': 145, 'use_sma': True, 'use_atr': False, 'use_adx': False, 'use_ema': False, 'use_spike': False, 'rsi_required': True, 'edge_k': 1.490481314657449, 'edge_cap': 0.3650198511135514, 'bull_strategy': 'mean_reversion', 'bull_bb_std_mult': 0.5634069270224904, 'bull_rsi_os': 19, 'bull_rsi_ob': 80, 'bull_adx_thresh': 15.541600494194855, 'bull_atr_min_pct': 0.011437801625023784, 'bull_atr_max_pct': 0.015930518774300018, 'bull_tp_mult': 1.1723288839341937, 'bull_tsl_mult': 0.6241624594246401, 'bull_time_stop': 270, 'bull_use_sma': False, 'bull_use_ema': False, 'bull_use_atr': False, 'bull_use_adx': True, 'bull_use_spike': True, 'bull_rsi_required': True, 'bear_strategy': 'breakout', 'bear_bb_std_mult': 2.7360455095911687, 'bear_rsi_os': 18, 'bear_rsi_ob': 87, 'bear_adx_thresh': 26.931768830751242, 'bear_atr_min_pct': 0.02025076703539751, 'bear_atr_max_pct': 0.13525194760288567, 'bear_tp_mult': 2.461809499577255, 'bear_tsl_mult': 0.23913547791944967, 'bear_time_stop': 251, 'bear_use_sma': True, 'bear_use_ema': False, 'bear_use_atr': False, 'bear_use_adx': True, 'bear_use_spike': True, 'bear_rsi_required': True, 'sideways_strategy': 'breakout', 'sideways_bb_std_mult': 0.6918837576518337, 'sideways_rsi_os': 54, 'sideways_rsi_ob': 82, 'sideways_adx_thresh': 29.900691267473672, 'sideways_atr_min_pct': 0.02845935172502989, 'sideways_atr_max_pct': 0.060852601368046044, 'sideways_tp_mult': 1.9775570868301486, 'sideways_tsl_mult': 0.35034848142717906, 'sideways_time_stop': 253, 'sideways_use_sma': False, 'sideways_use_ema': True, 'sideways_use_atr': True, 'sideways_use_adx': False, 'sideways_use_spike': False, 'sideways_rsi_required': True}.
[I 2025-09-01 10:35:45,296] Trial 570 finished with values: [-0.054009899626436764, 0.05385364625823176] and parameters: {'p_sma': 52, 'p_std': 44, 'p_atr': 14, 'p_adx': 21, 'rsi_period': 43, 'ema1': 6, 'ema2': 48, 'slip_atr_k': 0.0059548649868162735, 'slip_spread_k': 0.8173858682578783, 'spread_hl_frac': 0.01521400726006248, 'bb_std_mult': 1.0477466867321175, 'rsi_os': 15, 'rsi_ob': 60, 'vol_spike': 0.06694099482039671, 'adx_thresh': 24.591153617076802, 'atr_min_pct': 0.016785829241756395, 'atr_max_pct': 0.017922567844543512, 'tp_mult': 1.4986430066711853, 'tsl_mult': 0.11472326429564253, 'strategy': 'breakout', 'time_stop': 148, 'use_sma': True, 'use_atr': False, 'use_adx': False, 'use_ema': False, 'use_spike': False, 'rsi_required': True, 'edge_k': 1.6946085009248963, 'edge_cap': 0.2914846750615868, 'bull_strategy': 'mean_reversion', 'bull_bb_std_mult': 0.562482849799296, 'bull_rsi_os': 18, 'bull_rsi_ob': 74, 'bull_adx_thresh': 14.508531746382028, 'bull_atr_min_pct': 0.0012574454361284856, 'bull_atr_max_pct': 0.020646236430016684, 'bull_tp_mult': 1.149413642055411, 'bull_tsl_mult': 0.6360476952168241, 'bull_time_stop': 269, 'bull_use_sma': True, 'bull_use_ema': False, 'bull_use_atr': False, 'bull_use_adx': True, 'bull_use_spike': True, 'bull_rsi_required': True, 'bear_strategy': 'breakout', 'bear_bb_std_mult': 2.485526536490114, 'bear_rsi_os': 18, 'bear_rsi_ob': 84, 'bear_adx_thresh': 26.440099504857603, 'bear_atr_min_pct': 0.00011133544324712493, 'bear_atr_max_pct': 0.10734694647995616, 'bear_tp_mult': 2.4602205953086442, 'bear_tsl_mult': 0.2537865910945418, 'bear_time_stop': 62, 'bear_use_sma': False, 'bear_use_ema': False, 'bear_use_atr': False, 'bear_use_adx': True, 'bear_use_spike': True, 'bear_rsi_required': False, 'sideways_strategy': 'breakout', 'sideways_bb_std_mult': 1.8905832796114597, 'sideways_rsi_os': 54, 'sideways_rsi_ob': 81, 'sideways_adx_thresh': 28.5765970526296, 'sideways_atr_min_pct': 0.006148241835406764, 'sideways_atr_max_pct': 0.05921926709476565, 'sideways_tp_mult': 2.1051249819048277, 'sideways_tsl_mult': 0.29661542595284013, 'sideways_time_stop': 239, 'sideways_use_sma': False, 'sideways_use_ema': True, 'sideways_use_atr': True, 'sideways_use_adx': False, 'sideways_use_spike': False, 'sideways_rsi_required': True}.
[I 2025-09-01 10:35:46,766] Trial 572 finished with values: [-1000000000.0, 1000000000.0] and parameters: {'p_sma': 51, 'p_std': 29, 'p_atr': 14, 'p_adx': 19, 'rsi_period': 42, 'ema1': 6, 'ema2': 10, 'slip_atr_k': 0.005636625981902977, 'slip_spread_k': 0.8157572228203522, 'spread_hl_frac': 0.013073363744012691, 'bb_std_mult': 1.0300078747997212, 'rsi_os': 20, 'rsi_ob': 60, 'vol_spike': 0.06617227312585292, 'adx_thresh': 23.227238147513795, 'atr_min_pct': 0.0166951051907953, 'atr_max_pct': 0.018443619594868232, 'tp_mult': 1.4090156248580392, 'tsl_mult': 0.0776697062251544, 'strategy': 'breakout', 'time_stop': 148, 'use_sma': True, 'use_atr': False, 'use_adx': False, 'use_ema': False, 'use_spike': False, 'rsi_required': True, 'edge_k': 1.5577557526618917, 'edge_cap': 0.7151664864408712, 'bull_strategy': 'mean_reversion', 'bull_bb_std_mult': 0.5038983914487944, 'bull_rsi_os': 20, 'bull_rsi_ob': 72, 'bull_adx_thresh': 14.39056859876756, 'bull_atr_min_pct': 0.0261129697653371, 'bull_atr_max_pct': 0.020398214581612374, 'bull_tp_mult': 1.146261002698629, 'bull_tsl_mult': 0.542799617513235, 'bull_time_stop': 264, 'bull_use_sma': True, 'bull_use_ema': False, 'bull_use_atr': False, 'bull_use_adx': True, 'bull_use_spike': True, 'bull_rsi_required': True, 'bear_strategy': 'breakout', 'bear_bb_std_mult': 2.4858887781467525, 'bear_rsi_os': 19, 'bear_rsi_ob': 84, 'bear_adx_thresh': 16.205064349670533, 'bear_atr_min_pct': 0.02395135012982455, 'bear_atr_max_pct': 0.12532504229794986, 'bear_tp_mult': 1.4735181131410915, 'bear_tsl_mult': 0.37843633061032245, 'bear_time_stop': 247, 'bear_use_sma': False, 'bear_use_ema': False, 'bear_use_atr': False, 'bear_use_adx': True, 'bear_use_spike': True, 'bear_rsi_required': False, 'sideways_strategy': 'breakout', 'sideways_bb_std_mult': 0.7029629061601782, 'sideways_rsi_os': 54, 'sideways_rsi_ob': 81, 'sideways_adx_thresh': 28.82111109492726, 'sideways_atr_min_pct': 0.0061501418859588805, 'sideways_atr_max_pct': 0.03955694008779568, 'sideways_tp_mult': 2.1268322546251017, 'sideways_tsl_mult': 0.28846167470905654, 'sideways_time_stop': 239, 'sideways_use_sma': False, 'sideways_use_ema': True, 'sideways_use_atr': True, 'sideways_use_adx': False, 'sideways_use_spike': False, 'sideways_rsi_required': True}.
[I 2025-09-01 10:35:46,778] Trial 571 finished with values: [-0.0787582070016346, 0.07862567043295618] and parameters: {'p_sma': 55, 'p_std': 37, 'p_atr': 14, 'p_adx': 21, 'rsi_period': 43, 'ema1': 6, 'ema2': 45, 'slip_atr_k': 0.005028944916327315, 'slip_spread_k': 0.8101528176883889, 'spread_hl_frac': 0.009579410994614979, 'bb_std_mult': 1.1166455417947077, 'rsi_os': 15, 'rsi_ob': 60, 'vol_spike': 0.28308219678126634, 'adx_thresh': 24.570318733049586, 'atr_min_pct': 0.016673858137038443, 'atr_max_pct': 0.021425792102715634, 'tp_mult': 1.4762802031113913, 'tsl_mult': 0.11173503494609853, 'strategy': 'breakout', 'time_stop': 147, 'use_sma': True, 'use_atr': False, 'use_adx': False, 'use_ema': False, 'use_spike': False, 'rsi_required': True, 'edge_k': 1.5582960913353778, 'edge_cap': 0.17359443347918385, 'bull_strategy': 'mean_reversion', 'bull_bb_std_mult': 0.5063692633643818, 'bull_rsi_os': 20, 'bull_rsi_ob': 74, 'bull_adx_thresh': 14.525071278457975, 'bull_atr_min_pct': 0.0006510423744058589, 'bull_atr_max_pct': 0.020426879932736883, 'bull_tp_mult': 1.1331106857745412, 'bull_tsl_mult': 0.638342819182724, 'bull_time_stop': 263, 'bull_use_sma': True, 'bull_use_ema': False, 'bull_use_atr': False, 'bull_use_adx': True, 'bull_use_spike': True, 'bull_rsi_required': True, 'bear_strategy': 'breakout', 'bear_bb_std_mult': 1.4988044041937432, 'bear_rsi_os': 18, 'bear_rsi_ob': 84, 'bear_adx_thresh': 26.242988821122616, 'bear_atr_min_pct': 0.0037523906429744206, 'bear_atr_max_pct': 0.13698326761394763, 'bear_tp_mult': 2.4792661878767213, 'bear_tsl_mult': 0.8308209716079554, 'bear_time_stop': 274, 'bear_use_sma': False, 'bear_use_ema': False, 'bear_use_atr': False, 'bear_use_adx': True, 'bear_use_spike': True, 'bear_rsi_required': False, 'sideways_strategy': 'breakout', 'sideways_bb_std_mult': 2.21342842047401, 'sideways_rsi_os': 32, 'sideways_rsi_ob': 53, 'sideways_adx_thresh': 28.526323555841277, 'sideways_atr_min_pct': 0.025227085397366095, 'sideways_atr_max_pct': 0.058686572522837425, 'sideways_tp_mult': 1.993685898808027, 'sideways_tsl_mult': 0.35799824224734983, 'sideways_time_stop': 257, 'sideways_use_sma': False, 'sideways_use_ema': True, 'sideways_use_atr': True, 'sideways_use_adx': False, 'sideways_use_spike': False, 'sideways_rsi_required': True}.
[I 2025-09-01 10:35:47,333] Trial 569 finished with values: [-0.030558816283335566, 0.030405517282418332] and parameters: {'p_sma': 14, 'p_std': 31, 'p_atr': 11, 'p_adx': 19, 'rsi_period': 41, 'ema1': 7, 'ema2': 10, 'slip_atr_k': 0.007365915160929673, 'slip_spread_k': 0.8921026539569552, 'spread_hl_frac': 0.013270221812839865, 'bb_std_mult': 0.8887735486141012, 'rsi_os': 15, 'rsi_ob': 61, 'vol_spike': 0.03990664816339491, 'adx_thresh': 23.006686686264114, 'atr_min_pct': 0.014841644587949548, 'atr_max_pct': 0.02522748747695041, 'tp_mult': 1.5105844737128336, 'tsl_mult': 0.10815946278758248, 'strategy': 'breakout', 'time_stop': 146, 'use_sma': True, 'use_atr': False, 'use_adx': False, 'use_ema': False, 'use_spike': False, 'rsi_required': True, 'edge_k': 1.4955468451115985, 'edge_cap': 0.2784627940725498, 'bull_strategy': 'mean_reversion', 'bull_bb_std_mult': 0.5774326161628096, 'bull_rsi_os': 20, 'bull_rsi_ob': 74, 'bull_adx_thresh': 15.825714263393387, 'bull_atr_min_pct': 0.0006168183702864997, 'bull_atr_max_pct': 0.01998598742658163, 'bull_tp_mult': 1.2107377786491702, 'bull_tsl_mult': 0.6183893145993784, 'bull_time_stop': 294, 'bull_use_sma': True, 'bull_use_ema': False, 'bull_use_atr': False, 'bull_use_adx': True, 'bull_use_spike': True, 'bull_rsi_required': True, 'bear_strategy': 'breakout', 'bear_bb_std_mult': 1.5011817185123049, 'bear_rsi_os': 18, 'bear_rsi_ob': 84, 'bear_adx_thresh': 26.966595754028564, 'bear_atr_min_pct': 0.0021385678334104007, 'bear_atr_max_pct': 0.12528359964045588, 'bear_tp_mult': 2.3906768388049637, 'bear_tsl_mult': 0.25593176470780815, 'bear_time_stop': 62, 'bear_use_sma': False, 'bear_use_ema': False, 'bear_use_atr': False, 'bear_use_adx': True, 'bear_use_spike': True, 'bear_rsi_required': False, 'sideways_strategy': 'breakout', 'sideways_bb_std_mult': 0.5033680715817003, 'sideways_rsi_os': 54, 'sideways_rsi_ob': 82, 'sideways_adx_thresh': 29.876375574764808, 'sideways_atr_min_pct': 0.006249214419719732, 'sideways_atr_max_pct': 0.05978705219903449, 'sideways_tp_mult': 1.9714147801659954, 'sideways_tsl_mult': 0.35723167581602017, 'sideways_time_stop': 210, 'sideways_use_sma': False, 'sideways_use_ema': True, 'sideways_use_atr': True, 'sideways_use_adx': False, 'sideways_use_spike': False, 'sideways_rsi_required': True}.
[I 2025-09-01 10:35:48,195] Trial 575 finished with values: [-1000000000.0, 1000000000.0] and parameters: {'p_sma': 12, 'p_std': 59, 'p_atr': 12, 'p_adx': 12, 'rsi_period': 36, 'ema1': 7, 'ema2': 10, 'slip_atr_k': 0.03098806153236061, 'slip_spread_k': 0.8862618359455807, 'spread_hl_frac': 0.013285783291965792, 'bb_std_mult': 0.7148095057031452, 'rsi_os': 18, 'rsi_ob': 59, 'vol_spike': 0.07226843413052877, 'adx_thresh': 25.943500413412753, 'atr_min_pct': 0.029915268121083846, 'atr_max_pct': 0.016246616147815404, 'tp_mult': 1.3554967783333118, 'tsl_mult': 0.15171600103399735, 'strategy': 'mean_reversion', 'time_stop': 140, 'use_sma': False, 'use_atr': False, 'use_adx': True, 'use_ema': False, 'use_spike': False, 'rsi_required': True, 'edge_k': 1.601709618659974, 'edge_cap': 0.23315990356300575, 'bull_strategy': 'mean_reversion', 'bull_bb_std_mult': 0.6824876268785252, 'bull_rsi_os': 16, 'bull_rsi_ob': 78, 'bull_adx_thresh': 13.6553685721933, 'bull_atr_min_pct': 0.015279169620727142, 'bull_atr_max_pct': 0.012997091096474294, 'bull_tp_mult': 1.2285917603582723, 'bull_tsl_mult': 0.7538743791888276, 'bull_time_stop': 279, 'bull_use_sma': True, 'bull_use_ema': True, 'bull_use_atr': False, 'bull_use_adx': True, 'bull_use_spike': True, 'bull_rsi_required': True, 'bear_strategy': 'breakout', 'bear_bb_std_mult': 1.5413314629178132, 'bear_rsi_os': 22, 'bear_rsi_ob': 81, 'bear_adx_thresh': 11.449375848726223, 'bear_atr_min_pct': 0.0016527067963062613, 'bear_atr_max_pct': 0.0970871042301065, 'bear_tp_mult': 1.785779559824348, 'bear_tsl_mult': 0.8856390988014852, 'bear_time_stop': 46, 'bear_use_sma': True, 'bear_use_ema': False, 'bear_use_atr': False, 'bear_use_adx': True, 'bear_use_spike': True, 'bear_rsi_required': False, 'sideways_strategy': 'breakout', 'sideways_bb_std_mult': 0.6044456425181752, 'sideways_rsi_os': 55, 'sideways_rsi_ob': 64, 'sideways_adx_thresh': 31.762617331875393, 'sideways_atr_min_pct': 0.0006174774523184465, 'sideways_atr_max_pct': 0.05630741758377329, 'sideways_tp_mult': 2.0283664870436664, 'sideways_tsl_mult': 0.25886199212238303, 'sideways_time_stop': 210, 'sideways_use_sma': False, 'sideways_use_ema': True, 'sideways_use_atr': True, 'sideways_use_adx': False, 'sideways_use_spike': False, 'sideways_rsi_required': True}.
[I 2025-09-01 10:35:48,252] Trial 574 finished with values: [-1000000000.0, 1000000000.0] and parameters: {'p_sma': 14, 'p_std': 24, 'p_atr': 12, 'p_adx': 20, 'rsi_period': 52, 'ema1': 7, 'ema2': 57, 'slip_atr_k': 0.018905589242953026, 'slip_spread_k': 0.8861156342726573, 'spread_hl_frac': 0.013567191540704506, 'bb_std_mult': 0.8802853928043182, 'rsi_os': 18, 'rsi_ob': 61, 'vol_spike': 0.05585855632070983, 'adx_thresh': 23.16776891849664, 'atr_min_pct': 0.016165719742208408, 'atr_max_pct': 0.013083375060324368, 'tp_mult': 1.3630352972602784, 'tsl_mult': 0.12979766694959688, 'strategy': 'mean_reversion', 'time_stop': 140, 'use_sma': False, 'use_atr': False, 'use_adx': True, 'use_ema': False, 'use_spike': False, 'rsi_required': True, 'edge_k': 1.6432339417866275, 'edge_cap': 0.2827297013137679, 'bull_strategy': 'mean_reversion', 'bull_bb_std_mult': 0.5025057763042614, 'bull_rsi_os': 16, 'bull_rsi_ob': 77, 'bull_adx_thresh': 13.814742305700076, 'bull_atr_min_pct': 0.015158835007572974, 'bull_atr_max_pct': 0.013351613985237336, 'bull_tp_mult': 1.080790491725274, 'bull_tsl_mult': 0.8244103999443065, 'bull_time_stop': 278, 'bull_use_sma': True, 'bull_use_ema': True, 'bull_use_atr': False, 'bull_use_adx': True, 'bull_use_spike': True, 'bull_rsi_required': True, 'bear_strategy': 'breakout', 'bear_bb_std_mult': 1.4929148140424304, 'bear_rsi_os': 16, 'bear_rsi_ob': 81, 'bear_adx_thresh': 34.90113828879811, 'bear_atr_min_pct': 0.001717021257813301, 'bear_atr_max_pct': 0.08169214267955685, 'bear_tp_mult': 2.627211179561783, 'bear_tsl_mult': 0.9618416315946579, 'bear_time_stop': 266, 'bear_use_sma': True, 'bear_use_ema': False, 'bear_use_atr': False, 'bear_use_adx': True, 'bear_use_spike': True, 'bear_rsi_required': False, 'sideways_strategy': 'breakout', 'sideways_bb_std_mult': 1.5416116043878176, 'sideways_rsi_os': 55, 'sideways_rsi_ob': 76, 'sideways_adx_thresh': 31.6545778921705, 'sideways_atr_min_pct': 0.007471938709987406, 'sideways_atr_max_pct': 0.05494892782739728, 'sideways_tp_mult': 2.0284462187913728, 'sideways_tsl_mult': 0.2564420203068868, 'sideways_time_stop': 227, 'sideways_use_sma': False, 'sideways_use_ema': True, 'sideways_use_atr': True, 'sideways_use_adx': False, 'sideways_use_spike': False, 'sideways_rsi_required': True}.
[I 2025-09-01 10:35:48,257] Trial 576 finished with values: [-1000000000.0, 1000000000.0] and parameters: {'p_sma': 11, 'p_std': 24, 'p_atr': 12, 'p_adx': 20, 'rsi_period': 36, 'ema1': 8, 'ema2': 40, 'slip_atr_k': 0.029410130027465398, 'slip_spread_k': 0.840608149073891, 'spread_hl_frac': 0.015950473609096728, 'bb_std_mult': 0.9068621815373621, 'rsi_os': 17, 'rsi_ob': 56, 'vol_spike': 0.058789444574464216, 'adx_thresh': 19.05061027130974, 'atr_min_pct': 0.015983573897036606, 'atr_max_pct': 0.012798275799942653, 'tp_mult': 1.4139124311098012, 'tsl_mult': 0.12772373639984105, 'strategy': 'mean_reversion', 'time_stop': 140, 'use_sma': False, 'use_atr': True, 'use_adx': True, 'use_ema': False, 'use_spike': False, 'rsi_required': True, 'edge_k': 1.645233758888366, 'edge_cap': 0.20488650226309263, 'bull_strategy': 'mean_reversion', 'bull_bb_std_mult': 0.6851292664122008, 'bull_rsi_os': 15, 'bull_rsi_ob': 78, 'bull_adx_thresh': 15.074595694181328, 'bull_atr_min_pct': 0.006682451352030171, 'bull_atr_max_pct': 0.013819724503440212, 'bull_tp_mult': 1.1057384743795151, 'bull_tsl_mult': 0.6883541093417218, 'bull_time_stop': 273, 'bull_use_sma': True, 'bull_use_ema': True, 'bull_use_atr': False, 'bull_use_adx': True, 'bull_use_spike': True, 'bull_rsi_required': True, 'bear_strategy': 'breakout', 'bear_bb_std_mult': 2.5846357646008333, 'bear_rsi_os': 16, 'bear_rsi_ob': 81, 'bear_adx_thresh': 11.592151352165716, 'bear_atr_min_pct': 0.029952930088979327, 'bear_atr_max_pct': 0.08812315209466565, 'bear_tp_mult': 1.506073333143451, 'bear_tsl_mult': 0.8828748157506078, 'bear_time_stop': 266, 'bear_use_sma': True, 'bear_use_ema': False, 'bear_use_atr': False, 'bear_use_adx': True, 'bear_use_spike': True, 'bear_rsi_required': False, 'sideways_strategy': 'breakout', 'sideways_bb_std_mult': 1.581996142236104, 'sideways_rsi_os': 30, 'sideways_rsi_ob': 73, 'sideways_adx_thresh': 27.767450213562462, 'sideways_atr_min_pct': 0.01667359324420031, 'sideways_atr_max_pct': 0.05511810111197046, 'sideways_tp_mult': 2.0344621696346215, 'sideways_tsl_mult': 0.3012669278350433, 'sideways_time_stop': 252, 'sideways_use_sma': False, 'sideways_use_ema': True, 'sideways_use_atr': True, 'sideways_use_adx': False, 'sideways_use_spike': False, 'sideways_rsi_required': True}.
