[I 2025-09-01 09:43:47,926] Trial 233 finished with values: [-0.03733594051319089, 0.03720973783243732] and parameters: {'p_sma': 27, 'p_std': 39, 'p_atr': 18, 'p_adx': 27, 'rsi_period': 23, 'ema1': 18, 'ema2': 48, 'slip_atr_k': 0.059883891739993304, 'slip_spread_k': 0.649745811895786, 'spread_hl_frac': 0.0017955156532960571, 'bb_std_mult': 1.49098604471282, 'rsi_os': 43, 'rsi_ob': 70, 'vol_spike': 0.06510109252534546, 'adx_thresh': 11.753073185455921, 'atr_min_pct': 0.01489566172037328, 'atr_max_pct': 0.14155018076434253, 'tp_mult': 1.120024216820223, 'tsl_mult': 0.8089365462731074, 'strategy': 'breakout', 'time_stop': 242, 'use_sma': True, 'use_atr': False, 'use_adx': False, 'use_ema': True, 'use_spike': True, 'rsi_required': True, 'edge_k': 1.2293604326616294, 'edge_cap': 0.5987374920352614, 'bull_strategy': 'mean_reversion', 'bull_bb_std_mult': 0.5769986645914031, 'bull_rsi_os': 46, 'bull_rsi_ob': 47, 'bull_adx_thresh': 13.23877400420898, 'bull_atr_min_pct': 0.0006255554821027199, 'bull_atr_max_pct': 0.05905754134822701, 'bull_tp_mult': 2.3355530075527837, 'bull_tsl_mult': 0.4589426615459338, 'bull_time_stop': 197, 'bull_use_sma': True, 'bull_use_ema': False, 'bull_use_atr': True, 'bull_use_adx': False, 'bull_use_spike': False, 'bull_rsi_required': True, 'bear_strategy': 'mean_reversion', 'bear_bb_std_mult': 0.9353671479001683, 'bear_rsi_os': 10, 'bear_rsi_ob': 69, 'bear_adx_thresh': 21.78984169791807, 'bear_atr_min_pct': 0.005751537404210403, 'bear_atr_max_pct': 0.05965415955423312, 'bear_tp_mult': 1.182859353019938, 'bear_tsl_mult': 0.6984415470297303, 'bear_time_stop': 138, 'bear_use_sma': True, 'bear_use_ema': False, 'bear_use_atr': True, 'bear_use_adx': False, 'bear_use_spike': True, 'bear_rsi_required': False, 'sideways_strategy': 'mean_reversion', 'sideways_bb_std_mult': 1.560212313536701, 'sideways_rsi_os': 52, 'sideways_rsi_ob': 91, 'sideways_adx_thresh': 23.85105040706645, 'sideways_atr_min_pct': 0.012180200064999336, 'sideways_atr_max_pct': 0.07116801982600086, 'sideways_tp_mult': 2.2587552135100024, 'sideways_tsl_mult': 0.5258658738655496, 'sideways_time_stop': 21, 'sideways_use_sma': True, 'sideways_use_ema': False, 'sideways_use_atr': False, 'sideways_use_adx': True, 'sideways_use_spike': False, 'sideways_rsi_required': False}.
[I 2025-09-01 09:44:29,120] Trial 237 finished with values: [-0.06302053096515359, 0.06244458188205172] and parameters: {'p_sma': 43, 'p_std': 43, 'p_atr': 18, 'p_adx': 25, 'rsi_period': 26, 'ema1': 18, 'ema2': 52, 'slip_atr_k': 0.011025458954027761, 'slip_spread_k': 0.22591468525479869, 'spread_hl_frac': 0.02744692192605748, 'bb_std_mult': 1.748662734908699, 'rsi_os': 42, 'rsi_ob': 68, 'vol_spike': 0.16502394563575631, 'adx_thresh': 11.342181438006035, 'atr_min_pct': 0.007738637081743233, 'atr_max_pct': 0.14741846227147426, 'tp_mult': 1.189637701550791, 'tsl_mult': 0.559052535085554, 'strategy': 'mean_reversion', 'time_stop': 242, 'use_sma': False, 'use_atr': True, 'use_adx': True, 'use_ema': False, 'use_spike': False, 'rsi_required': True, 'edge_k': 0.8220122303117137, 'edge_cap': 0.5111631010773631, 'bull_strategy': 'mean_reversion', 'bull_bb_std_mult': 2.067429103419211, 'bull_rsi_os': 46, 'bull_rsi_ob': 61, 'bull_adx_thresh': 7.693054733013043, 'bull_atr_min_pct': 0.002556771462861457, 'bull_atr_max_pct': 0.08889036082619671, 'bull_tp_mult': 2.9174075799300025, 'bull_tsl_mult': 0.5517945510182245, 'bull_time_stop': 186, 'bull_use_sma': False, 'bull_use_ema': True, 'bull_use_atr': False, 'bull_use_adx': False, 'bull_use_spike': True, 'bull_rsi_required': True, 'bear_strategy': 'breakout', 'bear_bb_std_mult': 1.6905936542207838, 'bear_rsi_os': 35, 'bear_rsi_ob': 77, 'bear_adx_thresh': 24.632281353558188, 'bear_atr_min_pct': 0.0016633936727057366, 'bear_atr_max_pct': 0.055108758116303516, 'bear_tp_mult': 1.3095856776443724, 'bear_tsl_mult': 0.46611097696815257, 'bear_time_stop': 289, 'bear_use_sma': False, 'bear_use_ema': False, 'bear_use_atr': False, 'bear_use_adx': True, 'bear_use_spike': False, 'bear_rsi_required': True, 'sideways_strategy': 'breakout', 'sideways_bb_std_mult': 2.6584598654481058, 'sideways_rsi_os': 21, 'sideways_rsi_ob': 94, 'sideways_adx_thresh': 22.723627030730984, 'sideways_atr_min_pct': 0.012264628951600142, 'sideways_atr_max_pct': 0.07303755357816416, 'sideways_tp_mult': 2.4661107176947223, 'sideways_tsl_mult': 0.5955517483843111, 'sideways_time_stop': 237, 'sideways_use_sma': False, 'sideways_use_ema': True, 'sideways_use_atr': False, 'sideways_use_adx': True, 'sideways_use_spike': True, 'sideways_rsi_required': True}.
[I 2025-09-01 09:44:29,691] Trial 238 finished with values: [-1000000000.0, 1000000000.0] and parameters: {'p_sma': 34, 'p_std': 43, 'p_atr': 18, 'p_adx': 25, 'rsi_period': 25, 'ema1': 17, 'ema2': 17, 'slip_atr_k': 0.05085327427600469, 'slip_spread_k': 0.37232153605877805, 'spread_hl_frac': 0.027809993978365373, 'bb_std_mult': 1.7330252735227534, 'rsi_os': 42, 'rsi_ob': 66, 'vol_spike': 0.09892749560539611, 'adx_thresh': 32.88890158814116, 'atr_min_pct': 0.007793928606151254, 'atr_max_pct': 0.11326862177185126, 'tp_mult': 2.1235388865872307, 'tsl_mult': 0.5530658725184939, 'strategy': 'mean_reversion', 'time_stop': 229, 'use_sma': False, 'use_atr': True, 'use_adx': True, 'use_ema': False, 'use_spike': False, 'rsi_required': False, 'edge_k': 0.7877501821817169, 'edge_cap': 0.5750716403708005, 'bull_strategy': 'mean_reversion', 'bull_bb_std_mult': 2.6410276181001366, 'bull_rsi_os': 46, 'bull_rsi_ob': 48, 'bull_adx_thresh': 6.68815720860189, 'bull_atr_min_pct': 0.00291539422617943, 'bull_atr_max_pct': 0.088644702734982, 'bull_tp_mult': 1.8375777397067143, 'bull_tsl_mult': 0.5485648437971936, 'bull_time_stop': 184, 'bull_use_sma': False, 'bull_use_ema': True, 'bull_use_atr': False, 'bull_use_adx': True, 'bull_use_spike': True, 'bull_rsi_required': False, 'bear_strategy': 'breakout', 'bear_bb_std_mult': 1.6463833109201853, 'bear_rsi_os': 51, 'bear_rsi_ob': 77, 'bear_adx_thresh': 23.402782704252697, 'bear_atr_min_pct': 0.009870057400823817, 'bear_atr_max_pct': 0.06267880275047405, 'bear_tp_mult': 1.329114882937307, 'bear_tsl_mult': 0.6296420378086003, 'bear_time_stop': 287, 'bear_use_sma': False, 'bear_use_ema': False, 'bear_use_atr': False, 'bear_use_adx': True, 'bear_use_spike': False, 'bear_rsi_required': True, 'sideways_strategy': 'breakout', 'sideways_bb_std_mult': 0.8554530244353695, 'sideways_rsi_os': 52, 'sideways_rsi_ob': 94, 'sideways_adx_thresh': 22.020379795895906, 'sideways_atr_min_pct': 0.007446770620412847, 'sideways_atr_max_pct': 0.07367975860273657, 'sideways_tp_mult': 2.4763671214904854, 'sideways_tsl_mult': 0.5011712074529676, 'sideways_time_stop': 26, 'sideways_use_sma': False, 'sideways_use_ema': True, 'sideways_use_atr': True, 'sideways_use_adx': True, 'sideways_use_spike': True, 'sideways_rsi_required': True}.
[I 2025-09-01 09:44:30,017] Trial 236 finished with values: [-0.03781663380502287, 0.037582481534693] and parameters: {'p_sma': 29, 'p_std': 43, 'p_atr': 18, 'p_adx': 25, 'rsi_period': 26, 'ema1': 18, 'ema2': 17, 'slip_atr_k': 0.05776065604853175, 'slip_spread_k': 0.901012769986234, 'spread_hl_frac': 0.01036568764155732, 'bb_std_mult': 1.712611961384111, 'rsi_os': 43, 'rsi_ob': 68, 'vol_spike': 0.1730410494056234, 'adx_thresh': 11.662032193450372, 'atr_min_pct': 0.007704892367567582, 'atr_max_pct': 0.14651619166307644, 'tp_mult': 1.1865801184161655, 'tsl_mult': 0.7694460570704013, 'strategy': 'breakout', 'time_stop': 244, 'use_sma': True, 'use_atr': False, 'use_adx': True, 'use_ema': False, 'use_spike': True, 'rsi_required': True, 'edge_k': 1.2651682582016426, 'edge_cap': 0.5251684801996404, 'bull_strategy': 'mean_reversion', 'bull_bb_std_mult': 0.8242968256785297, 'bull_rsi_os': 46, 'bull_rsi_ob': 48, 'bull_adx_thresh': 7.5371094371104626, 'bull_atr_min_pct': 0.0006457315494100756, 'bull_atr_max_pct': 0.08983868381890849, 'bull_tp_mult': 1.8560853976206497, 'bull_tsl_mult': 0.5469020364172593, 'bull_time_stop': 181, 'bull_use_sma': False, 'bull_use_ema': False, 'bull_use_atr': False, 'bull_use_adx': False, 'bull_use_spike': False, 'bull_rsi_required': True, 'bear_strategy': 'breakout', 'bear_bb_std_mult': 1.6395189569287385, 'bear_rsi_os': 55, 'bear_rsi_ob': 75, 'bear_adx_thresh': 7.533756076462682, 'bear_atr_min_pct': 0.012684143844909932, 'bear_atr_max_pct': 0.05549504870398413, 'bear_tp_mult': 1.3230679726291845, 'bear_tsl_mult': 0.6292564383025772, 'bear_time_stop': 288, 'bear_use_sma': False, 'bear_use_ema': False, 'bear_use_atr': True, 'bear_use_adx': True, 'bear_use_spike': False, 'bear_rsi_required': True, 'sideways_strategy': 'breakout', 'sideways_bb_std_mult': 3.219455878050774, 'sideways_rsi_os': 21, 'sideways_rsi_ob': 92, 'sideways_adx_thresh': 22.186570959485543, 'sideways_atr_min_pct': 0.012337824842647269, 'sideways_atr_max_pct': 0.04857568787893519, 'sideways_tp_mult': 2.222830754321344, 'sideways_tsl_mult': 0.5217093639596233, 'sideways_time_stop': 23, 'sideways_use_sma': False, 'sideways_use_ema': True, 'sideways_use_atr': False, 'sideways_use_adx': True, 'sideways_use_spike': True, 'sideways_rsi_required': False}.
[I 2025-09-01 09:44:30,228] Trial 235 finished with values: [-0.03754184250606707, 0.03745496144831816] and parameters: {'p_sma': 40, 'p_std': 49, 'p_atr': 18, 'p_adx': 26, 'rsi_period': 22, 'ema1': 18, 'ema2': 17, 'slip_atr_k': 0.05066792706111637, 'slip_spread_k': 0.6465216766375826, 'spread_hl_frac': 0.04654691478898819, 'bb_std_mult': 1.7306530205541946, 'rsi_os': 43, 'rsi_ob': 68, 'vol_spike': 0.15564378060188, 'adx_thresh': 13.224774995428648, 'atr_min_pct': 0.007436160319025954, 'atr_max_pct': 0.1461455410231527, 'tp_mult': 1.1346134962982435, 'tsl_mult': 0.5862060383427505, 'strategy': 'breakout', 'time_stop': 244, 'use_sma': True, 'use_atr': True, 'use_adx': False, 'use_ema': False, 'use_spike': True, 'rsi_required': True, 'edge_k': 1.0322437288128614, 'edge_cap': 0.5944138240938226, 'bull_strategy': 'mean_reversion', 'bull_bb_std_mult': 0.8309133939943429, 'bull_rsi_os': 46, 'bull_rsi_ob': 58, 'bull_adx_thresh': 13.50285871383862, 'bull_atr_min_pct': 0.0003209368659899723, 'bull_atr_max_pct': 0.08930659916784882, 'bull_tp_mult': 1.854956358893618, 'bull_tsl_mult': 0.42630431124056084, 'bull_time_stop': 184, 'bull_use_sma': False, 'bull_use_ema': False, 'bull_use_atr': False, 'bull_use_adx': True, 'bull_use_spike': False, 'bull_rsi_required': True, 'bear_strategy': 'breakout', 'bear_bb_std_mult': 1.6498038359819458, 'bear_rsi_os': 13, 'bear_rsi_ob': 74, 'bear_adx_thresh': 30.147593270517568, 'bear_atr_min_pct': 0.0043339355351207295, 'bear_atr_max_pct': 0.06093275585694693, 'bear_tp_mult': 1.338198280892216, 'bear_tsl_mult': 0.46349620200271097, 'bear_time_stop': 288, 'bear_use_sma': True, 'bear_use_ema': False, 'bear_use_atr': False, 'bear_use_adx': False, 'bear_use_spike': True, 'bear_rsi_required': False, 'sideways_strategy': 'mean_reversion', 'sideways_bb_std_mult': 0.8425763541031426, 'sideways_rsi_os': 52, 'sideways_rsi_ob': 91, 'sideways_adx_thresh': 22.73479601145342, 'sideways_atr_min_pct': 0.012446164363232804, 'sideways_atr_max_pct': 0.07225023588773281, 'sideways_tp_mult': 2.2469439686218973, 'sideways_tsl_mult': 0.49545727148368973, 'sideways_time_stop': 269, 'sideways_use_sma': True, 'sideways_use_ema': True, 'sideways_use_atr': False, 'sideways_use_adx': True, 'sideways_use_spike': True, 'sideways_rsi_required': True}.
[I 2025-09-01 09:45:10,352] Trial 242 finished with values: [-1000000000.0, 1000000000.0] and parameters: {'p_sma': 11, 'p_std': 58, 'p_atr': 11, 'p_adx': 30, 'rsi_period': 20, 'ema1': 17, 'ema2': 13, 'slip_atr_k': 0.22356701608759977, 'slip_spread_k': 0.6864270127030457, 'spread_hl_frac': 0.029349555184451984, 'bb_std_mult': 1.6415117503089707, 'rsi_os': 45, 'rsi_ob': 48, 'vol_spike': 0.0795276085777499, 'adx_thresh': 29.96958714848098, 'atr_min_pct': 0.012002809325400184, 'atr_max_pct': 0.10932869273398854, 'tp_mult': 1.112443343451144, 'tsl_mult': 0.6161328766944643, 'strategy': 'breakout', 'time_stop': 252, 'use_sma': True, 'use_atr': False, 'use_adx': False, 'use_ema': True, 'use_spike': True, 'rsi_required': False, 'edge_k': 1.0971370683358677, 'edge_cap': 0.5507481434736534, 'bull_strategy': 'mean_reversion', 'bull_bb_std_mult': 3.1443997400758548, 'bull_rsi_os': 22, 'bull_rsi_ob': 46, 'bull_adx_thresh': 5.675242628811478, 'bull_atr_min_pct': 0.0022107525977476217, 'bull_atr_max_pct': 0.05465527575544658, 'bull_tp_mult': 2.8141185594345464, 'bull_tsl_mult': 0.39285294492284495, 'bull_time_stop': 221, 'bull_use_sma': True, 'bull_use_ema': False, 'bull_use_atr': True, 'bull_use_adx': False, 'bull_use_spike': False, 'bull_rsi_required': False, 'bear_strategy': 'mean_reversion', 'bear_bb_std_mult': 1.287576641977239, 'bear_rsi_os': 33, 'bear_rsi_ob': 67, 'bear_adx_thresh': 9.41024159352637, 'bear_atr_min_pct': 0.006667814833785006, 'bear_atr_max_pct': 0.055850243763227364, 'bear_tp_mult': 1.2535436734478411, 'bear_tsl_mult': 0.41529916834545627, 'bear_time_stop': 300, 'bear_use_sma': True, 'bear_use_ema': False, 'bear_use_atr': True, 'bear_use_adx': False, 'bear_use_spike': False, 'bear_rsi_required': False, 'sideways_strategy': 'mean_reversion', 'sideways_bb_std_mult': 2.5241519169291826, 'sideways_rsi_os': 54, 'sideways_rsi_ob': 66, 'sideways_adx_thresh': 20.2503371752378, 'sideways_atr_min_pct': 0.006597364546389227, 'sideways_atr_max_pct': 0.06760071430115647, 'sideways_tp_mult': 2.535497523050967, 'sideways_tsl_mult': 0.4643648646152873, 'sideways_time_stop': 36, 'sideways_use_sma': True, 'sideways_use_ema': False, 'sideways_use_atr': True, 'sideways_use_adx': False, 'sideways_use_spike': False, 'sideways_rsi_required': False}.
[I 2025-09-01 09:45:10,869] Trial 241 finished with values: [-1000000000.0, 1000000000.0] and parameters: {'p_sma': 14, 'p_std': 26, 'p_atr': 11, 'p_adx': 30, 'rsi_period': 51, 'ema1': 17, 'ema2': 15, 'slip_atr_k': 0.05680937365458952, 'slip_spread_k': 0.6279947085793867, 'spread_hl_frac': 0.04481398614762909, 'bb_std_mult': 1.6508948510766697, 'rsi_os': 41, 'rsi_ob': 69, 'vol_spike': 0.07697505693025883, 'adx_thresh': 14.361959550532397, 'atr_min_pct': 0.011963772954047979, 'atr_max_pct': 0.11671963810765443, 'tp_mult': 1.8550660128306435, 'tsl_mult': 0.8534763947411099, 'strategy': 'breakout', 'time_stop': 257, 'use_sma': True, 'use_atr': False, 'use_adx': False, 'use_ema': True, 'use_spike': True, 'rsi_required': False, 'edge_k': 0.5008900745070269, 'edge_cap': 0.6106488236685802, 'bull_strategy': 'mean_reversion', 'bull_bb_std_mult': 3.52255759160504, 'bull_rsi_os': 45, 'bull_rsi_ob': 85, 'bull_adx_thresh': 20.246036843675093, 'bull_atr_min_pct': 0.002276737254820828, 'bull_atr_max_pct': 0.09880019753168269, 'bull_tp_mult': 2.5597714564448797, 'bull_tsl_mult': 0.3455904478456436, 'bull_time_stop': 222, 'bull_use_sma': True, 'bull_use_ema': False, 'bull_use_atr': True, 'bull_use_adx': False, 'bull_use_spike': False, 'bull_rsi_required': False, 'bear_strategy': 'mean_reversion', 'bear_bb_std_mult': 0.8736616460552022, 'bear_rsi_os': 48, 'bear_rsi_ob': 67, 'bear_adx_thresh': 17.743618276711953, 'bear_atr_min_pct': 0.011160844316509428, 'bear_atr_max_pct': 0.05578691179641512, 'bear_tp_mult': 1.2474303312588866, 'bear_tsl_mult': 0.5200426088269485, 'bear_time_stop': 296, 'bear_use_sma': True, 'bear_use_ema': False, 'bear_use_atr': True, 'bear_use_adx': False, 'bear_use_spike': False, 'bear_rsi_required': False, 'sideways_strategy': 'mean_reversion', 'sideways_bb_std_mult': 1.3606822888520917, 'sideways_rsi_os': 47, 'sideways_rsi_ob': 72, 'sideways_adx_thresh': 19.389709911352472, 'sideways_atr_min_pct': 0.013428598415654991, 'sideways_atr_max_pct': 0.06598319284257652, 'sideways_tp_mult': 2.7254267727982855, 'sideways_tsl_mult': 0.645965704167283, 'sideways_time_stop': 185, 'sideways_use_sma': True, 'sideways_use_ema': False, 'sideways_use_atr': True, 'sideways_use_adx': False, 'sideways_use_spike': False, 'sideways_rsi_required': False}.
[I 2025-09-01 09:45:11,875] Trial 240 finished with values: [-0.0407696935452333, 0.04055560385832338] and parameters: {'p_sma': 31, 'p_std': 48, 'p_atr': 10, 'p_adx': 30, 'rsi_period': 21, 'ema1': 18, 'ema2': 15, 'slip_atr_k': 0.05687943353418145, 'slip_spread_k': 0.9139320987510846, 'spread_hl_frac': 0.010395736362771866, 'bb_std_mult': 2.63503234233713, 'rsi_os': 45, 'rsi_ob': 68, 'vol_spike': 0.19112306523474076, 'adx_thresh': 33.39915508801797, 'atr_min_pct': 0.011966446823709204, 'atr_max_pct': 0.10744118107945688, 'tp_mult': 1.4892874919313193, 'tsl_mult': 0.8375800345498073, 'strategy': 'breakout', 'time_stop': 248, 'use_sma': True, 'use_atr': False, 'use_adx': False, 'use_ema': True, 'use_spike': True, 'rsi_required': True, 'edge_k': 1.8494801354600372, 'edge_cap': 0.5283744210274545, 'bull_strategy': 'mean_reversion', 'bull_bb_std_mult': 3.148566734267546, 'bull_rsi_os': 54, 'bull_rsi_ob': 58, 'bull_adx_thresh': 5.773631779036751, 'bull_atr_min_pct': 0.001092434528441118, 'bull_atr_max_pct': 0.04041835949894972, 'bull_tp_mult': 2.769717976222515, 'bull_tsl_mult': 0.4160198581843793, 'bull_time_stop': 212, 'bull_use_sma': True, 'bull_use_ema': False, 'bull_use_atr': True, 'bull_use_adx': False, 'bull_use_spike': False, 'bull_rsi_required': True, 'bear_strategy': 'mean_reversion', 'bear_bb_std_mult': 1.2708619672399348, 'bear_rsi_os': 55, 'bear_rsi_ob': 72, 'bear_adx_thresh': 11.3580955757496, 'bear_atr_min_pct': 0.006717727719650674, 'bear_atr_max_pct': 0.0557333093997395, 'bear_tp_mult': 1.2373476652903301, 'bear_tsl_mult': 0.4162572033367486, 'bear_time_stop': 295, 'bear_use_sma': True, 'bear_use_ema': False, 'bear_use_atr': True, 'bear_use_adx': False, 'bear_use_spike': False, 'bear_rsi_required': False, 'sideways_strategy': 'mean_reversion', 'sideways_bb_std_mult': 1.344733779276331, 'sideways_rsi_os': 47, 'sideways_rsi_ob': 67, 'sideways_adx_thresh': 22.770517913357313, 'sideways_atr_min_pct': 0.013165877169087216, 'sideways_atr_max_pct': 0.06618164527506103, 'sideways_tp_mult': 2.5189720593028224, 'sideways_tsl_mult': 0.45810689583235437, 'sideways_time_stop': 35, 'sideways_use_sma': True, 'sideways_use_ema': False, 'sideways_use_atr': False, 'sideways_use_adx': False, 'sideways_use_spike': False, 'sideways_rsi_required': False}.
[I 2025-09-01 09:45:13,198] Trial 239 finished with values: [-1000000000.0, 1000000000.0] and parameters: {'p_sma': 31, 'p_std': 49, 'p_atr': 19, 'p_adx': 26, 'rsi_period': 42, 'ema1': 17, 'ema2': 17, 'slip_atr_k': 0.08880864296151365, 'slip_spread_k': 0.6238571153468666, 'spread_hl_frac': 0.02949934291434163, 'bb_std_mult': 1.6861307963625811, 'rsi_os': 41, 'rsi_ob': 66, 'vol_spike': 0.17141527009023455, 'adx_thresh': 33.062717135894935, 'atr_min_pct': 0.00913072018272323, 'atr_max_pct': 0.10642129504355236, 'tp_mult': 2.2652151236103695, 'tsl_mult': 0.8669811065062542, 'strategy': 'breakout', 'time_stop': 228, 'use_sma': True, 'use_atr': False, 'use_adx': False, 'use_ema': False, 'use_spike': True, 'rsi_required': False, 'edge_k': 1.2646470122462312, 'edge_cap': 0.6508557235126, 'bull_strategy': 'mean_reversion', 'bull_bb_std_mult': 3.1510790298481783, 'bull_rsi_os': 45, 'bull_rsi_ob': 82, 'bull_adx_thresh': 18.08135806578283, 'bull_atr_min_pct': 0.00201857069181733, 'bull_atr_max_pct': 0.055317648812937596, 'bull_tp_mult': 2.796273635554075, 'bull_tsl_mult': 0.5122580249480281, 'bull_time_stop': 212, 'bull_use_sma': False, 'bull_use_ema': False, 'bull_use_atr': False, 'bull_use_adx': True, 'bull_use_spike': False, 'bull_rsi_required': False, 'bear_strategy': 'breakout', 'bear_bb_std_mult': 0.504813497922708, 'bear_rsi_os': 51, 'bear_rsi_ob': 74, 'bear_adx_thresh': 31.590665091762343, 'bear_atr_min_pct': 0.009603232831103946, 'bear_atr_max_pct': 0.06187435804113547, 'bear_tp_mult': 1.3499967564911803, 'bear_tsl_mult': 0.4437243876553019, 'bear_time_stop': 223, 'bear_use_sma': True, 'bear_use_ema': False, 'bear_use_atr': True, 'bear_use_adx': False, 'bear_use_spike': False, 'bear_rsi_required': False, 'sideways_strategy': 'mean_reversion', 'sideways_bb_std_mult': 3.273965042307263, 'sideways_rsi_os': 47, 'sideways_rsi_ob': 90, 'sideways_adx_thresh': 21.948335942243293, 'sideways_atr_min_pct': 0.00768733708963676, 'sideways_atr_max_pct': 0.06515327831481672, 'sideways_tp_mult': 2.7128406202296116, 'sideways_tsl_mult': 0.4960670629777195, 'sideways_time_stop': 35, 'sideways_use_sma': False, 'sideways_use_ema': True, 'sideways_use_atr': True, 'sideways_use_adx': False, 'sideways_use_spike': True, 'sideways_rsi_required': False}.
