[I 2025-09-01 09:21:47,850] Trial 99 finished with values: [-1000000000.0, 1000000000.0] and parameters: {'p_sma': 52, 'p_std': 36, 'p_atr': 29, 'p_adx': 10, 'rsi_period': 34, 'ema1': 18, 'ema2': 38, 'slip_atr_k': 0.03981087453690137, 'slip_spread_k': 0.7386322096320374, 'spread_hl_frac': 0.037997405055060496, 'bb_std_mult': 0.5826163766418244, 'rsi_os': 46, 'rsi_ob': 61, 'vol_spike': 0.22155675970627775, 'adx_thresh': 9.066032592988318, 'atr_min_pct': 0.02099794570609496, 'atr_max_pct': 0.10526050193527321, 'tp_mult': 1.3514902265080462, 'tsl_mult': 0.09266451985495473, 'strategy': 'mean_reversion', 'time_stop': 14, 'use_sma': False, 'use_atr': True, 'use_adx': True, 'use_ema': True, 'use_spike': False, 'rsi_required': False, 'edge_k': 0.13410896110496884, 'edge_cap': 0.3456551894107512, 'bull_strategy': 'mean_reversion', 'bull_bb_std_mult': 3.431918286164376, 'bull_rsi_os': 32, 'bull_rsi_ob': 72, 'bull_adx_thresh': 31.27977588085169, 'bull_atr_min_pct': 0.002882934039648414, 'bull_atr_max_pct': 0.14090134737200696, 'bull_tp_mult': 1.1265069199611482, 'bull_tsl_mult': 0.76385347532452, 'bull_time_stop': 259, 'bull_use_sma': True, 'bull_use_ema': True, 'bull_use_atr': True, 'bull_use_adx': False, 'bull_use_spike': False, 'bull_rsi_required': False, 'bear_strategy': 'mean_reversion', 'bear_bb_std_mult': 3.226812629510253, 'bear_rsi_os': 34, 'bear_rsi_ob': 91, 'bear_adx_thresh': 11.832204031150196, 'bear_atr_min_pct': 0.013909199557382805, 'bear_atr_max_pct': 0.14927018618024634, 'bear_tp_mult': 1.916193536567905, 'bear_tsl_mult': 0.4485892223742721, 'bear_time_stop': 243, 'bear_use_sma': False, 'bear_use_ema': False, 'bear_use_atr': True, 'bear_use_adx': True, 'bear_use_spike': True, 'bear_rsi_required': True, 'sideways_strategy': 'breakout', 'sideways_bb_std_mult': 3.222899346356903, 'sideways_rsi_os': 18, 'sideways_rsi_ob': 66, 'sideways_adx_thresh': 5.002718966086244, 'sideways_atr_min_pct': 0.023640118460240556, 'sideways_atr_max_pct': 0.01995123454662489, 'sideways_tp_mult': 2.038111924641126, 'sideways_tsl_mult': 0.6626792788528224, 'sideways_time_stop': 89, 'sideways_use_sma': False, 'sideways_use_ema': True, 'sideways_use_atr': True, 'sideways_use_adx': False, 'sideways_use_spike': False, 'sideways_rsi_required': False}.
[I 2025-09-01 09:21:48,429] Trial 103 finished with values: [-1000000000.0, 1000000000.0] and parameters: {'p_sma': 9, 'p_std': 11, 'p_atr': 24, 'p_adx': 12, 'rsi_period': 60, 'ema1': 20, 'ema2': 33, 'slip_atr_k': 0.11031223458719339, 'slip_spread_k': 0.9424972650421801, 'spread_hl_frac': 0.019418501526495067, 'bb_std_mult': 1.1390930462962348, 'rsi_os': 53, 'rsi_ob': 54, 'vol_spike': 0.18729097897247823, 'adx_thresh': 5.303255584610643, 'atr_min_pct': 0.017956046173733305, 'atr_max_pct': 0.11096752298617275, 'tp_mult': 1.2926212646686763, 'tsl_mult': 0.0011004988287781, 'strategy': 'mean_reversion', 'time_stop': 41, 'use_sma': False, 'use_atr': False, 'use_adx': False, 'use_ema': True, 'use_spike': True, 'rsi_required': False, 'edge_k': 0.45628352500849034, 'edge_cap': 0.4493815520745206, 'bull_strategy': 'mean_reversion', 'bull_bb_std_mult': 1.6056949068015463, 'bull_rsi_os': 29, 'bull_rsi_ob': 89, 'bull_adx_thresh': 6.768561770875715, 'bull_atr_min_pct': 0.02014048284462479, 'bull_atr_max_pct': 0.08973180448070765, 'bull_tp_mult': 2.8777182076732046, 'bull_tsl_mult': 0.0564917899635094, 'bull_time_stop': 89, 'bull_use_sma': True, 'bull_use_ema': True, 'bull_use_atr': True, 'bull_use_adx': True, 'bull_use_spike': False, 'bull_rsi_required': False, 'bear_strategy': 'mean_reversion', 'bear_bb_std_mult': 0.9361866960669716, 'bear_rsi_os': 25, 'bear_rsi_ob': 85, 'bear_adx_thresh': 33.16118107158263, 'bear_atr_min_pct': 0.01834737214563892, 'bear_atr_max_pct': 0.024970855767678234, 'bear_tp_mult': 1.2312364338754986, 'bear_tsl_mult': 0.6811886192494185, 'bear_time_stop': 137, 'bear_use_sma': True, 'bear_use_ema': False, 'bear_use_atr': True, 'bear_use_adx': True, 'bear_use_spike': False, 'bear_rsi_required': False, 'sideways_strategy': 'breakout', 'sideways_bb_std_mult': 2.5600411353704815, 'sideways_rsi_os': 39, 'sideways_rsi_ob': 88, 'sideways_adx_thresh': 23.322382912906125, 'sideways_atr_min_pct': 0.013512667331289923, 'sideways_atr_max_pct': 0.04418989118727129, 'sideways_tp_mult': 1.4966000922076081, 'sideways_tsl_mult': 0.943100590397189, 'sideways_time_stop': 46, 'sideways_use_sma': True, 'sideways_use_ema': False, 'sideways_use_atr': True, 'sideways_use_adx': False, 'sideways_use_spike': True, 'sideways_rsi_required': True}.
[I 2025-09-01 09:22:28,240] Trial 102 finished with values: [-1000000000.0, 1000000000.0] and parameters: {'p_sma': 9, 'p_std': 60, 'p_atr': 24, 'p_adx': 15, 'rsi_period': 78, 'ema1': 13, 'ema2': 33, 'slip_atr_k': 0.11319527056142115, 'slip_spread_k': 0.84843659000641, 'spread_hl_frac': 0.037901658143600074, 'bb_std_mult': 1.1425343497299116, 'rsi_os': 40, 'rsi_ob': 53, 'vol_spike': 0.06724025026534716, 'adx_thresh': 5.239427298576813, 'atr_min_pct': 0.018109436233166656, 'atr_max_pct': 0.12055901114296821, 'tp_mult': 1.1754609555423834, 'tsl_mult': 0.8583676792174295, 'strategy': 'mean_reversion', 'time_stop': 42, 'use_sma': False, 'use_atr': False, 'use_adx': False, 'use_ema': True, 'use_spike': True, 'rsi_required': False, 'edge_k': 1.448876054209462, 'edge_cap': 0.3752857984088185, 'bull_strategy': 'mean_reversion', 'bull_bb_std_mult': 1.9515548844816046, 'bull_rsi_os': 29, 'bull_rsi_ob': 73, 'bull_adx_thresh': 31.15575397873699, 'bull_atr_min_pct': 0.004038388423368352, 'bull_atr_max_pct': 0.12334876588390076, 'bull_tp_mult': 2.800534489949658, 'bull_tsl_mult': 0.2767297953960396, 'bull_time_stop': 258, 'bull_use_sma': True, 'bull_use_ema': True, 'bull_use_atr': True, 'bull_use_adx': True, 'bull_use_spike': False, 'bull_rsi_required': False, 'bear_strategy': 'mean_reversion', 'bear_bb_std_mult': 3.4450558458224463, 'bear_rsi_os': 23, 'bear_rsi_ob': 87, 'bear_adx_thresh': 30.905428179108714, 'bear_atr_min_pct': 0.014072374080781765, 'bear_atr_max_pct': 0.07700681175017544, 'bear_tp_mult': 1.5323527070470562, 'bear_tsl_mult': 0.006193501069901131, 'bear_time_stop': 239, 'bear_use_sma': False, 'bear_use_ema': False, 'bear_use_atr': True, 'bear_use_adx': True, 'bear_use_spike': False, 'bear_rsi_required': False, 'sideways_strategy': 'breakout', 'sideways_bb_std_mult': 3.217615287098841, 'sideways_rsi_os': 31, 'sideways_rsi_ob': 95, 'sideways_adx_thresh': 23.1126137689835, 'sideways_atr_min_pct': 0.0007954832459272347, 'sideways_atr_max_pct': 0.02208471125971803, 'sideways_tp_mult': 2.088195029629514, 'sideways_tsl_mult': 0.2665747897237506, 'sideways_time_stop': 89, 'sideways_use_sma': True, 'sideways_use_ema': False, 'sideways_use_atr': True, 'sideways_use_adx': False, 'sideways_use_spike': True, 'sideways_rsi_required': True}.
[I 2025-09-01 09:22:28,554] Trial 101 finished with values: [-1000000000.0, 1000000000.0] and parameters: {'p_sma': 8, 'p_std': 53, 'p_atr': 24, 'p_adx': 20, 'rsi_period': 11, 'ema1': 20, 'ema2': 33, 'slip_atr_k': 0.15700925821284525, 'slip_spread_k': 0.7310043235854913, 'spread_hl_frac': 0.03808739169237746, 'bb_std_mult': 0.7793294139370464, 'rsi_os': 40, 'rsi_ob': 53, 'vol_spike': 0.21208232896251938, 'adx_thresh': 5.051585574931734, 'atr_min_pct': 0.020704993583169875, 'atr_max_pct': 0.12149403295013989, 'tp_mult': 1.1900944658694497, 'tsl_mult': 0.9042842933864763, 'strategy': 'mean_reversion', 'time_stop': 11, 'use_sma': False, 'use_atr': True, 'use_adx': False, 'use_ema': True, 'use_spike': True, 'rsi_required': False, 'edge_k': 1.431343851873724, 'edge_cap': 0.4465294296078448, 'bull_strategy': 'mean_reversion', 'bull_bb_std_mult': 3.4680410654561853, 'bull_rsi_os': 32, 'bull_rsi_ob': 64, 'bull_adx_thresh': 31.028212959959482, 'bull_atr_min_pct': 0.002085512948343374, 'bull_atr_max_pct': 0.14100931073201095, 'bull_tp_mult': 2.0471095348283352, 'bull_tsl_mult': 0.5101373571942401, 'bull_time_stop': 260, 'bull_use_sma': True, 'bull_use_ema': True, 'bull_use_atr': True, 'bull_use_adx': True, 'bull_use_spike': False, 'bull_rsi_required': False, 'bear_strategy': 'mean_reversion', 'bear_bb_std_mult': 1.7118278499700044, 'bear_rsi_os': 23, 'bear_rsi_ob': 91, 'bear_adx_thresh': 19.054828174266248, 'bear_atr_min_pct': 0.01938233374929638, 'bear_atr_max_pct': 0.1485132230661468, 'bear_tp_mult': 1.8864017795307513, 'bear_tsl_mult': 0.4571830699686445, 'bear_time_stop': 194, 'bear_use_sma': False, 'bear_use_ema': False, 'bear_use_atr': True, 'bear_use_adx': True, 'bear_use_spike': False, 'bear_rsi_required': True, 'sideways_strategy': 'breakout', 'sideways_bb_std_mult': 2.570437523747145, 'sideways_rsi_os': 14, 'sideways_rsi_ob': 49, 'sideways_adx_thresh': 18.047178960812786, 'sideways_atr_min_pct': 0.002808230646717846, 'sideways_atr_max_pct': 0.06413086553227659, 'sideways_tp_mult': 2.1097981575818885, 'sideways_tsl_mult': 0.6529079968550038, 'sideways_time_stop': 90, 'sideways_use_sma': False, 'sideways_use_ema': False, 'sideways_use_atr': True, 'sideways_use_adx': False, 'sideways_use_spike': True, 'sideways_rsi_required': True}.
[I 2025-09-01 09:22:29,026] Trial 100 finished with values: [-1000000000.0, 1000000000.0] and parameters: {'p_sma': 6, 'p_std': 38, 'p_atr': 29, 'p_adx': 10, 'rsi_period': 79, 'ema1': 23, 'ema2': 34, 'slip_atr_k': 0.11021349845458084, 'slip_spread_k': 0.7297020866837859, 'spread_hl_frac': 0.04054459801393881, 'bb_std_mult': 2.381200796919509, 'rsi_os': 40, 'rsi_ob': 62, 'vol_spike': 0.06826259673871864, 'adx_thresh': 14.501306360083822, 'atr_min_pct': 0.02067975534673182, 'atr_max_pct': 0.10941655037508695, 'tp_mult': 1.3336540226941676, 'tsl_mult': 0.8808936917818471, 'strategy': 'mean_reversion', 'time_stop': 44, 'use_sma': False, 'use_atr': True, 'use_adx': True, 'use_ema': True, 'use_spike': True, 'rsi_required': False, 'edge_k': 0.4708897111491632, 'edge_cap': 0.41453218889230165, 'bull_strategy': 'mean_reversion', 'bull_bb_std_mult': 1.9827161018500425, 'bull_rsi_os': 34, 'bull_rsi_ob': 71, 'bull_adx_thresh': 32.42331730750862, 'bull_atr_min_pct': 0.0027018459853384875, 'bull_atr_max_pct': 0.14023118154932424, 'bull_tp_mult': 1.1049681761833656, 'bull_tsl_mult': 0.497267377265375, 'bull_time_stop': 134, 'bull_use_sma': True, 'bull_use_ema': True, 'bull_use_atr': True, 'bull_use_adx': False, 'bull_use_spike': False, 'bull_rsi_required': False, 'bear_strategy': 'mean_reversion', 'bear_bb_std_mult': 1.704717311234357, 'bear_rsi_os': 34, 'bear_rsi_ob': 84, 'bear_adx_thresh': 26.359853622126437, 'bear_atr_min_pct': 0.024623128052921224, 'bear_atr_max_pct': 0.07917357900901621, 'bear_tp_mult': 1.040056991700897, 'bear_tsl_mult': 0.5552840003970793, 'bear_time_stop': 190, 'bear_use_sma': False, 'bear_use_ema': False, 'bear_use_atr': True, 'bear_use_adx': True, 'bear_use_spike': False, 'bear_rsi_required': True, 'sideways_strategy': 'breakout', 'sideways_bb_std_mult': 2.602129895056805, 'sideways_rsi_os': 32, 'sideways_rsi_ob': 67, 'sideways_adx_thresh': 15.555515796808072, 'sideways_atr_min_pct': 0.020638981991838817, 'sideways_atr_max_pct': 0.14913636563358412, 'sideways_tp_mult': 1.401985425471452, 'sideways_tsl_mult': 0.27877850137775184, 'sideways_time_stop': 90, 'sideways_use_sma': False, 'sideways_use_ema': True, 'sideways_use_atr': True, 'sideways_use_adx': False, 'sideways_use_spike': True, 'sideways_rsi_required': False}.
[I 2025-09-01 09:22:29,191] Trial 104 finished with values: [-1000000000.0, 1000000000.0] and parameters: {'p_sma': 5, 'p_std': 32, 'p_atr': 28, 'p_adx': 15, 'rsi_period': 78, 'ema1': 13, 'ema2': 35, 'slip_atr_k': 0.15553846084996942, 'slip_spread_k': 0.8436013378035382, 'spread_hl_frac': 0.040641239511604074, 'bb_std_mult': 0.7849673391097342, 'rsi_os': 43, 'rsi_ob': 56, 'vol_spike': 0.2336877280450806, 'adx_thresh': 14.086479009354406, 'atr_min_pct': 0.01864733738690254, 'atr_max_pct': 0.12196690969065566, 'tp_mult': 1.9082658198468334, 'tsl_mult': 0.8551420296350059, 'strategy': 'mean_reversion', 'time_stop': 10, 'use_sma': False, 'use_atr': True, 'use_adx': True, 'use_ema': False, 'use_spike': False, 'rsi_required': False, 'edge_k': 1.423951870379856, 'edge_cap': 0.2413556644452617, 'bull_strategy': 'mean_reversion', 'bull_bb_std_mult': 1.7930592746235048, 'bull_rsi_os': 34, 'bull_rsi_ob': 64, 'bull_adx_thresh': 26.627113145290313, 'bull_atr_min_pct': 0.011078006821647463, 'bull_atr_max_pct': 0.1287536347127377, 'bull_tp_mult': 1.0439943370189873, 'bull_tsl_mult': 0.2439301093023864, 'bull_time_stop': 190, 'bull_use_sma': False, 'bull_use_ema': True, 'bull_use_atr': False, 'bull_use_adx': False, 'bull_use_spike': True, 'bull_rsi_required': False, 'bear_strategy': 'breakout', 'bear_bb_std_mult': 3.4411687349018396, 'bear_rsi_os': 31, 'bear_rsi_ob': 71, 'bear_adx_thresh': 29.746931444074264, 'bear_atr_min_pct': 0.02074878080029082, 'bear_atr_max_pct': 0.12731780503204257, 'bear_tp_mult': 1.067947514590117, 'bear_tsl_mult': 0.015214133998333934, 'bear_time_stop': 195, 'bear_use_sma': False, 'bear_use_ema': False, 'bear_use_atr': False, 'bear_use_adx': True, 'bear_use_spike': True, 'bear_rsi_required': True, 'sideways_strategy': 'breakout', 'sideways_bb_std_mult': 1.8890007533735338, 'sideways_rsi_os': 31, 'sideways_rsi_ob': 82, 'sideways_adx_thresh': 18.154528522221735, 'sideways_atr_min_pct': 0.0008003792995281483, 'sideways_atr_max_pct': 0.06364026925939112, 'sideways_tp_mult': 1.4120553715990298, 'sideways_tsl_mult': 0.25203881608155954, 'sideways_time_stop': 97, 'sideways_use_sma': False, 'sideways_use_ema': True, 'sideways_use_atr': True, 'sideways_use_adx': False, 'sideways_use_spike': False, 'sideways_rsi_required': False}.
[I 2025-09-01 09:23:09,286] Trial 105 finished with values: [-1000000000.0, 1000000000.0] and parameters: {'p_sma': 5, 'p_std': 44, 'p_atr': 28, 'p_adx': 16, 'rsi_period': 12, 'ema1': 29, 'ema2': 35, 'slip_atr_k': 0.1581118629077624, 'slip_spread_k': 0.3458741290650174, 'spread_hl_frac': 0.009232521934939657, 'bb_std_mult': 0.7823334847709611, 'rsi_os': 43, 'rsi_ob': 56, 'vol_spike': 0.23349891905636957, 'adx_thresh': 7.465390403623437, 'atr_min_pct': 0.01883637883061363, 'atr_max_pct': 0.09826560627839541, 'tp_mult': 1.950176767620371, 'tsl_mult': 0.04846668567495096, 'strategy': 'mean_reversion', 'time_stop': 207, 'use_sma': False, 'use_atr': True, 'use_adx': True, 'use_ema': False, 'use_spike': False, 'rsi_required': False, 'edge_k': 0.5266665308123846, 'edge_cap': 0.23782695478574578, 'bull_strategy': 'mean_reversion', 'bull_bb_std_mult': 2.2295009296420742, 'bull_rsi_os': 27, 'bull_rsi_ob': 68, 'bull_adx_thresh': 14.70468191540372, 'bull_atr_min_pct': 0.001983168666262764, 'bull_atr_max_pct': 0.12916200930384394, 'bull_tp_mult': 2.0671887567758693, 'bull_tsl_mult': 0.24824523991996433, 'bull_time_stop': 5, 'bull_use_sma': False, 'bull_use_ema': True, 'bull_use_atr': False, 'bull_use_adx': False, 'bull_use_spike': True, 'bull_rsi_required': False, 'bear_strategy': 'breakout', 'bear_bb_std_mult': 3.1211493539748543, 'bear_rsi_os': 26, 'bear_rsi_ob': 70, 'bear_adx_thresh': 34.96553365969835, 'bear_atr_min_pct': 0.020758755005856493, 'bear_atr_max_pct': 0.09842209304018207, 'bear_tp_mult': 1.0779468633846148, 'bear_tsl_mult': 0.815605151784508, 'bear_time_stop': 126, 'bear_use_sma': False, 'bear_use_ema': False, 'bear_use_atr': False, 'bear_use_adx': True, 'bear_use_spike': True, 'bear_rsi_required': True, 'sideways_strategy': 'breakout', 'sideways_bb_std_mult': 2.066037218838655, 'sideways_rsi_os': 13, 'sideways_rsi_ob': 82, 'sideways_adx_thresh': 29.01858126960495, 'sideways_atr_min_pct': 0.001840228909697253, 'sideways_atr_max_pct': 0.06411476934567645, 'sideways_tp_mult': 1.156956923013178, 'sideways_tsl_mult': 0.9602075790672437, 'sideways_time_stop': 228, 'sideways_use_sma': False, 'sideways_use_ema': True, 'sideways_use_atr': False, 'sideways_use_adx': False, 'sideways_use_spike': False, 'sideways_rsi_required': False}.
[I 2025-09-01 09:23:09,944] Trial 107 finished with values: [-1000000000.0, 1000000000.0] and parameters: {'p_sma': 5, 'p_std': 30, 'p_atr': 28, 'p_adx': 16, 'rsi_period': 65, 'ema1': 26, 'ema2': 36, 'slip_atr_k': 0.14177093936705323, 'slip_spread_k': 0.5144921463735166, 'spread_hl_frac': 0.03956507754774485, 'bb_std_mult': 1.9729856027336214, 'rsi_os': 34, 'rsi_ob': 56, 'vol_spike': 0.23451627994987698, 'adx_thresh': 10.655059323887443, 'atr_min_pct': 0.01892768058341083, 'atr_max_pct': 0.04143436380638607, 'tp_mult': 1.1083253489524358, 'tsl_mult': 0.9536201392762539, 'strategy': 'breakout', 'time_stop': 97, 'use_sma': False, 'use_atr': True, 'use_adx': True, 'use_ema': False, 'use_spike': False, 'rsi_required': True, 'edge_k': 0.2755868945765574, 'edge_cap': 0.30453965082703033, 'bull_strategy': 'breakout', 'bull_bb_std_mult': 2.20885193502802, 'bull_rsi_os': 7, 'bull_rsi_ob': 66, 'bull_adx_thresh': 26.646402179477782, 'bull_atr_min_pct': 0.0008306429889108762, 'bull_atr_max_pct': 0.1298087137422145, 'bull_tp_mult': 1.0527497166178441, 'bull_tsl_mult': 0.9971461313572639, 'bull_time_stop': 191, 'bull_use_sma': False, 'bull_use_ema': True, 'bull_use_atr': False, 'bull_use_adx': False, 'bull_use_spike': True, 'bull_rsi_required': True, 'bear_strategy': 'breakout', 'bear_bb_std_mult': 3.128739935547048, 'bear_rsi_os': 30, 'bear_rsi_ob': 71, 'bear_adx_thresh': 34.92219360146761, 'bear_atr_min_pct': 0.020589260958918353, 'bear_atr_max_pct': 0.12734975286995684, 'bear_tp_mult': 1.5827125347078077, 'bear_tsl_mult': 0.8188324820037386, 'bear_time_stop': 128, 'bear_use_sma': True, 'bear_use_ema': True, 'bear_use_atr': False, 'bear_use_adx': False, 'bear_use_spike': True, 'bear_rsi_required': True, 'sideways_strategy': 'mean_reversion', 'sideways_bb_std_mult': 2.0441006502347974, 'sideways_rsi_os': 43, 'sideways_rsi_ob': 79, 'sideways_adx_thresh': 13.301203334407784, 'sideways_atr_min_pct': 0.001956178544556468, 'sideways_atr_max_pct': 0.09282865317288248, 'sideways_tp_mult': 1.0870497570831974, 'sideways_tsl_mult': 0.973024119884257, 'sideways_time_stop': 230, 'sideways_use_sma': False, 'sideways_use_ema': True, 'sideways_use_atr': False, 'sideways_use_adx': False, 'sideways_use_spike': False, 'sideways_rsi_required': False}.
[I 2025-09-01 09:23:10,427] Trial 106 finished with values: [-1000000000.0, 1000000000.0] and parameters: {'p_sma': 6, 'p_std': 43, 'p_atr': 28, 'p_adx': 16, 'rsi_period': 80, 'ema1': 5, 'ema2': 35, 'slip_atr_k': 0.14285315322410863, 'slip_spread_k': 0.7572384314012698, 'spread_hl_frac': 0.009337085448547493, 'bb_std_mult': 3.4083277017986644, 'rsi_os': 43, 'rsi_ob': 58, 'vol_spike': 0.23548217222993204, 'adx_thresh': 7.523575338738432, 'atr_min_pct': 0.018749368236887057, 'atr_max_pct': 0.08743784040870185, 'tp_mult': 2.6570868204464633, 'tsl_mult': 0.9499916189635991, 'strategy': 'mean_reversion', 'time_stop': 253, 'use_sma': False, 'use_atr': True, 'use_adx': True, 'use_ema': False, 'use_spike': False, 'rsi_required': False, 'edge_k': 0.2639592109076708, 'edge_cap': 0.30836529439517524, 'bull_strategy': 'mean_reversion', 'bull_bb_std_mult': 1.7881559739720672, 'bull_rsi_os': 34, 'bull_rsi_ob': 66, 'bull_adx_thresh': 14.696658771621138, 'bull_atr_min_pct': 0.0017240146180913212, 'bull_atr_max_pct': 0.015160808176172255, 'bull_tp_mult': 1.0359217726339067, 'bull_tsl_mult': 0.21310376562601907, 'bull_time_stop': 179, 'bull_use_sma': False, 'bull_use_ema': True, 'bull_use_atr': False, 'bull_use_adx': False, 'bull_use_spike': True, 'bull_rsi_required': False, 'bear_strategy': 'breakout', 'bear_bb_std_mult': 2.956650083358589, 'bear_rsi_os': 45, 'bear_rsi_ob': 71, 'bear_adx_thresh': 29.437605508670305, 'bear_atr_min_pct': 0.011610622734294782, 'bear_atr_max_pct': 0.13020602283085667, 'bear_tp_mult': 1.039510935663639, 'bear_tsl_mult': 0.1394934704263377, 'bear_time_stop': 109, 'bear_use_sma': False, 'bear_use_ema': False, 'bear_use_atr': False, 'bear_use_adx': True, 'bear_use_spike': True, 'bear_rsi_required': True, 'sideways_strategy': 'breakout', 'sideways_bb_std_mult': 2.0413077388949596, 'sideways_rsi_os': 22, 'sideways_rsi_ob': 76, 'sideways_adx_thresh': 28.192271126770986, 'sideways_atr_min_pct': 0.0020312881664272344, 'sideways_atr_max_pct': 0.05531439404365705, 'sideways_tp_mult': 1.1461093460268161, 'sideways_tsl_mult': 0.9660208586383988, 'sideways_time_stop': 225, 'sideways_use_sma': False, 'sideways_use_ema': True, 'sideways_use_atr': False, 'sideways_use_adx': False, 'sideways_use_spike': False, 'sideways_rsi_required': False}.
