[I 2025-09-01 09:19:02,837] Trial 81 finished with values: [-1000000000.0, 1000000000.0] and parameters: {'p_sma': 47, 'p_std': 14, 'p_atr': 18, 'p_adx': 12, 'rsi_period': 26, 'ema1': 24, 'ema2': 32, 'slip_atr_k': 0.18576583732271984, 'slip_spread_k': 0.04906807072164343, 'spread_hl_frac': 0.024153291199884283, 'bb_std_mult': 1.1693465727427474, 'rsi_os': 26, 'rsi_ob': 66, 'vol_spike': 0.1184433349667145, 'adx_thresh': 18.900023958995895, 'atr_min_pct': 0.015319561297235565, 'atr_max_pct': 0.14304413799471072, 'tp_mult': 1.2449052743773654, 'tsl_mult': 0.7112940036166269, 'strategy': 'breakout', 'time_stop': 272, 'use_sma': False, 'use_atr': True, 'use_adx': True, 'use_ema': True, 'use_spike': False, 'rsi_required': True, 'edge_k': 0.3379915265819787, 'edge_cap': 0.25371745480893376, 'bull_strategy': 'mean_reversion', 'bull_bb_std_mult': 2.317523283551177, 'bull_rsi_os': 19, 'bull_rsi_ob': 57, 'bull_adx_thresh': 15.9147831580089, 'bull_atr_min_pct': 0.021969228073963037, 'bull_atr_max_pct': 0.06316755252894429, 'bull_tp_mult': 2.5456931640457494, 'bull_tsl_mult': 0.6833710864585385, 'bull_time_stop': 108, 'bull_use_sma': False, 'bull_use_ema': True, 'bull_use_atr': False, 'bull_use_adx': True, 'bull_use_spike': True, 'bull_rsi_required': True, 'bear_strategy': 'breakout', 'bear_bb_std_mult': 2.151307423810902, 'bear_rsi_os': 24, 'bear_rsi_ob': 53, 'bear_adx_thresh': 32.3886478316678, 'bear_atr_min_pct': 0.023164730415818645, 'bear_atr_max_pct': 0.1359403459770771, 'bear_tp_mult': 1.789924967114594, 'bear_tsl_mult': 0.37757693200630327, 'bear_time_stop': 93, 'bear_use_sma': False, 'bear_use_ema': False, 'bear_use_atr': True, 'bear_use_adx': True, 'bear_use_spike': True, 'bear_rsi_required': True, 'sideways_strategy': 'breakout', 'sideways_bb_std_mult': 1.5030714213469474, 'sideways_rsi_os': 39, 'sideways_rsi_ob': 88, 'sideways_adx_thresh': 11.10058491982051, 'sideways_atr_min_pct': 0.02660690384506911, 'sideways_atr_max_pct': 0.051409778310746154, 'sideways_tp_mult': 1.2963775053086068, 'sideways_tsl_mult': 0.9115542227470874, 'sideways_time_stop': 5, 'sideways_use_sma': True, 'sideways_use_ema': True, 'sideways_use_atr': False, 'sideways_use_adx': True, 'sideways_use_spike': False, 'sideways_rsi_required': False}.
[I 2025-09-01 09:19:42,788] Trial 85 finished with values: [-1000000000.0, 1000000000.0] and parameters: {'p_sma': 53, 'p_std': 48, 'p_atr': 20, 'p_adx': 26, 'rsi_period': 80, 'ema1': 21, 'ema2': 28, 'slip_atr_k': 0.16009234211908674, 'slip_spread_k': 0.6500134168895377, 'spread_hl_frac': 0.035337646637654194, 'bb_std_mult': 2.7975252315873136, 'rsi_os': 20, 'rsi_ob': 60, 'vol_spike': 0.17025275029823844, 'adx_thresh': 9.112868775021493, 'atr_min_pct': 0.024583177143638127, 'atr_max_pct': 0.11549097738264923, 'tp_mult': 2.3032100957174926, 'tsl_mult': 0.05630406545311576, 'strategy': 'mean_reversion', 'time_stop': 11, 'use_sma': False, 'use_atr': True, 'use_adx': False, 'use_ema': False, 'use_spike': True, 'rsi_required': False, 'edge_k': 0.14509372450917124, 'edge_cap': 0.2901114604929953, 'bull_strategy': 'mean_reversion', 'bull_bb_std_mult': 1.9132444137687892, 'bull_rsi_os': 51, 'bull_rsi_ob': 65, 'bull_adx_thresh': 29.480326323926185, 'bull_atr_min_pct': 0.0014911288325896981, 'bull_atr_max_pct': 0.02367541266128561, 'bull_tp_mult': 1.197705963084184, 'bull_tsl_mult': 0.22835420791119235, 'bull_time_stop': 179, 'bull_use_sma': False, 'bull_use_ema': True, 'bull_use_atr': False, 'bull_use_adx': False, 'bull_use_spike': False, 'bull_rsi_required': False, 'bear_strategy': 'mean_reversion', 'bear_bb_std_mult': 3.362881889477025, 'bear_rsi_os': 20, 'bear_rsi_ob': 68, 'bear_adx_thresh': 13.305856634668396, 'bear_atr_min_pct': 0.01542950975974846, 'bear_atr_max_pct': 0.09565049214231698, 'bear_tp_mult': 2.7578511612980288, 'bear_tsl_mult': 0.8979504621289104, 'bear_time_stop': 114, 'bear_use_sma': False, 'bear_use_ema': False, 'bear_use_atr': False, 'bear_use_adx': False, 'bear_use_spike': False, 'bear_rsi_required': False, 'sideways_strategy': 'mean_reversion', 'sideways_bb_std_mult': 2.822583139798298, 'sideways_rsi_os': 42, 'sideways_rsi_ob': 80, 'sideways_adx_thresh': 14.761078304375276, 'sideways_atr_min_pct': 0.0077809450096339595, 'sideways_atr_max_pct': 0.0869009684287813, 'sideways_tp_mult': 1.0725640448188423, 'sideways_tsl_mult': 0.8321747773356993, 'sideways_time_stop': 259, 'sideways_use_sma': False, 'sideways_use_ema': False, 'sideways_use_atr': True, 'sideways_use_adx': False, 'sideways_use_spike': True, 'sideways_rsi_required': True}.
[I 2025-09-01 09:19:43,365] Trial 82 finished with values: [-1000000000.0, 1000000000.0] and parameters: {'p_sma': 46, 'p_std': 48, 'p_atr': 22, 'p_adx': 17, 'rsi_period': 8, 'ema1': 6, 'ema2': 38, 'slip_atr_k': 0.16670470824497186, 'slip_spread_k': 0.00887482019708069, 'spread_hl_frac': 0.03542275068657093, 'bb_std_mult': 0.5047685285372003, 'rsi_os': 26, 'rsi_ob': 59, 'vol_spike': 0.24526831534087368, 'adx_thresh': 19.157644492408537, 'atr_min_pct': 0.021245209368602865, 'atr_max_pct': 0.14414977522294142, 'tp_mult': 2.2726710911184433, 'tsl_mult': 0.664910205480522, 'strategy': 'mean_reversion', 'time_stop': 296, 'use_sma': False, 'use_atr': True, 'use_adx': False, 'use_ema': True, 'use_spike': True, 'rsi_required': False, 'edge_k': 0.3374429756361823, 'edge_cap': 0.2872862337526805, 'bull_strategy': 'mean_reversion', 'bull_bb_std_mult': 1.5809620297839817, 'bull_rsi_os': 37, 'bull_rsi_ob': 65, 'bull_adx_thresh': 15.969908285236137, 'bull_atr_min_pct': 0.0009819080197812154, 'bull_atr_max_pct': 0.13864607713986007, 'bull_tp_mult': 1.198534834593133, 'bull_tsl_mult': 0.23438633418709443, 'bull_time_stop': 110, 'bull_use_sma': False, 'bull_use_ema': True, 'bull_use_atr': False, 'bull_use_adx': False, 'bull_use_spike': False, 'bull_rsi_required': False, 'bear_strategy': 'mean_reversion', 'bear_bb_std_mult': 3.3721483769836036, 'bear_rsi_os': 20, 'bear_rsi_ob': 68, 'bear_adx_thresh': 20.22029867626249, 'bear_atr_min_pct': 0.01567023916495324, 'bear_atr_max_pct': 0.1008313541536272, 'bear_tp_mult': 1.7989913874449315, 'bear_tsl_mult': 0.31955296137937195, 'bear_time_stop': 116, 'bear_use_sma': False, 'bear_use_ema': False, 'bear_use_atr': True, 'bear_use_adx': True, 'bear_use_spike': True, 'bear_rsi_required': True, 'sideways_strategy': 'breakout', 'sideways_bb_std_mult': 1.5092209328477755, 'sideways_rsi_os': 42, 'sideways_rsi_ob': 47, 'sideways_adx_thresh': 15.463272463858262, 'sideways_atr_min_pct': 0.008019262570866626, 'sideways_atr_max_pct': 0.030051891465381873, 'sideways_tp_mult': 2.483387242020776, 'sideways_tsl_mult': 0.837167634005697, 'sideways_time_stop': 5, 'sideways_use_sma': False, 'sideways_use_ema': True, 'sideways_use_atr': True, 'sideways_use_adx': False, 'sideways_use_spike': True, 'sideways_rsi_required': False}.
[I 2025-09-01 09:19:43,387] Trial 84 finished with values: [-0.10354203787075533, 0.10331911493659776] and parameters: {'p_sma': 45, 'p_std': 48, 'p_atr': 27, 'p_adx': 17, 'rsi_period': 72, 'ema1': 6, 'ema2': 28, 'slip_atr_k': 0.12787729410613938, 'slip_spread_k': 0.006070316533753506, 'spread_hl_frac': 0.04301476634426531, 'bb_std_mult': 2.8584548074975786, 'rsi_os': 21, 'rsi_ob': 59, 'vol_spike': 0.2613303169442825, 'adx_thresh': 18.739460832293727, 'atr_min_pct': 0.0222386810003696, 'atr_max_pct': 0.115167704596413, 'tp_mult': 2.8973987596951405, 'tsl_mult': 0.6366141003936207, 'strategy': 'mean_reversion', 'time_stop': 6, 'use_sma': False, 'use_atr': True, 'use_adx': False, 'use_ema': True, 'use_spike': True, 'rsi_required': False, 'edge_k': 0.005831770646797074, 'edge_cap': 0.29276321111614517, 'bull_strategy': 'mean_reversion', 'bull_bb_std_mult': 1.5195143486232598, 'bull_rsi_os': 51, 'bull_rsi_ob': 58, 'bull_adx_thresh': 16.19139307055012, 'bull_atr_min_pct': 0.006713480701035279, 'bull_atr_max_pct': 0.026511353249868162, 'bull_tp_mult': 2.5886924129536464, 'bull_tsl_mult': 0.226450063124845, 'bull_time_stop': 143, 'bull_use_sma': False, 'bull_use_ema': True, 'bull_use_atr': False, 'bull_use_adx': False, 'bull_use_spike': False, 'bull_rsi_required': False, 'bear_strategy': 'mean_reversion', 'bear_bb_std_mult': 2.1730738253866106, 'bear_rsi_os': 21, 'bear_rsi_ob': 68, 'bear_adx_thresh': 14.789610620433471, 'bear_atr_min_pct': 0.0021367055505293314, 'bear_atr_max_pct': 0.059679969819250535, 'bear_tp_mult': 2.7546754979402213, 'bear_tsl_mult': 0.7728441485316326, 'bear_time_stop': 117, 'bear_use_sma': False, 'bear_use_ema': False, 'bear_use_atr': True, 'bear_use_adx': True, 'bear_use_spike': True, 'bear_rsi_required': True, 'sideways_strategy': 'breakout', 'sideways_bb_std_mult': 0.7581639703479142, 'sideways_rsi_os': 42, 'sideways_rsi_ob': 47, 'sideways_adx_thresh': 19.56700976652295, 'sideways_atr_min_pct': 2.6300215662379816e-05, 'sideways_atr_max_pct': 0.03039813033968812, 'sideways_tp_mult': 2.4865794441239277, 'sideways_tsl_mult': 0.32946364729581945, 'sideways_time_stop': 6, 'sideways_use_sma': False, 'sideways_use_ema': True, 'sideways_use_atr': True, 'sideways_use_adx': False, 'sideways_use_spike': True, 'sideways_rsi_required': False}.
[I 2025-09-01 09:19:43,629] Trial 83 finished with values: [-1000000000.0, 1000000000.0] and parameters: {'p_sma': 43, 'p_std': 36, 'p_atr': 20, 'p_adx': 26, 'rsi_period': 72, 'ema1': 6, 'ema2': 38, 'slip_atr_k': 0.12971536748812207, 'slip_spread_k': 0.7637666292990973, 'spread_hl_frac': 0.040066166442681746, 'bb_std_mult': 1.734831722392148, 'rsi_os': 26, 'rsi_ob': 59, 'vol_spike': 0.26371808571311905, 'adx_thresh': 18.74582905916055, 'atr_min_pct': 0.024561983370376957, 'atr_max_pct': 0.11558178950921494, 'tp_mult': 1.2300442644708578, 'tsl_mult': 0.7481383485727751, 'strategy': 'mean_reversion', 'time_stop': 46, 'use_sma': False, 'use_atr': True, 'use_adx': False, 'use_ema': True, 'use_spike': True, 'rsi_required': False, 'edge_k': 0.35248372733662114, 'edge_cap': 0.3542927077022625, 'bull_strategy': 'mean_reversion', 'bull_bb_std_mult': 1.9328719687630322, 'bull_rsi_os': 41, 'bull_rsi_ob': 65, 'bull_adx_thresh': 29.56324620793454, 'bull_atr_min_pct': 0.006498893990273314, 'bull_atr_max_pct': 0.021002200383424187, 'bull_tp_mult': 2.140410715542756, 'bull_tsl_mult': 0.4408381650748288, 'bull_time_stop': 280, 'bull_use_sma': False, 'bull_use_ema': True, 'bull_use_atr': False, 'bull_use_adx': False, 'bull_use_spike': False, 'bull_rsi_required': False, 'bear_strategy': 'mean_reversion', 'bear_bb_std_mult': 3.359808377076262, 'bear_rsi_os': 21, 'bear_rsi_ob': 68, 'bear_adx_thresh': 14.19437429596267, 'bear_atr_min_pct': 0.02229908726275097, 'bear_atr_max_pct': 0.13357197549722968, 'bear_tp_mult': 1.366653943131432, 'bear_tsl_mult': 0.36065099364848263, 'bear_time_stop': 114, 'bear_use_sma': False, 'bear_use_ema': False, 'bear_use_atr': True, 'bear_use_adx': True, 'bear_use_spike': True, 'bear_rsi_required': True, 'sideways_strategy': 'breakout', 'sideways_bb_std_mult': 1.5204800087413808, 'sideways_rsi_os': 42, 'sideways_rsi_ob': 81, 'sideways_adx_thresh': 19.618507343599905, 'sideways_atr_min_pct': 0.008038527460062518, 'sideways_atr_max_pct': 0.029745541545630652, 'sideways_tp_mult': 1.4915280617066842, 'sideways_tsl_mult': 0.31806749149293145, 'sideways_time_stop': 44, 'sideways_use_sma': False, 'sideways_use_ema': True, 'sideways_use_atr': True, 'sideways_use_adx': False, 'sideways_use_spike': True, 'sideways_rsi_required': False}.
[I 2025-09-01 09:19:44,221] Trial 87 finished with values: [-1000000000.0, 1000000000.0] and parameters: {'p_sma': 10, 'p_std': 9, 'p_atr': 14, 'p_adx': 18, 'rsi_period': 47, 'ema1': 5, 'ema2': 35, 'slip_atr_k': 0.1450680251392693, 'slip_spread_k': 0.7437871990443445, 'spread_hl_frac': 0.0020865362830178973, 'bb_std_mult': 0.8225464371582488, 'rsi_os': 32, 'rsi_ob': 48, 'vol_spike': 0.13523697091046138, 'adx_thresh': 23.96385398249956, 'atr_min_pct': 0.0010916259277144753, 'atr_max_pct': 0.07933976957505963, 'tp_mult': 1.1020933684708965, 'tsl_mult': 0.6026951131664778, 'strategy': 'mean_reversion', 'time_stop': 76, 'use_sma': False, 'use_atr': False, 'use_adx': True, 'use_ema': False, 'use_spike': False, 'rsi_required': False, 'edge_k': 1.8303644551803055, 'edge_cap': 0.6031126984354078, 'bull_strategy': 'mean_reversion', 'bull_bb_std_mult': 2.5402336899646776, 'bull_rsi_os': 24, 'bull_rsi_ob': 67, 'bull_adx_thresh': 19.42312980654718, 'bull_atr_min_pct': 0.0019190581908128737, 'bull_atr_max_pct': 0.12532548658662454, 'bull_tp_mult': 1.5961927444263728, 'bull_tsl_mult': 0.3671108703254491, 'bull_time_stop': 36, 'bull_use_sma': True, 'bull_use_ema': True, 'bull_use_atr': True, 'bull_use_adx': True, 'bull_use_spike': True, 'bull_rsi_required': False, 'bear_strategy': 'mean_reversion', 'bear_bb_std_mult': 3.5679221834612216, 'bear_rsi_os': 17, 'bear_rsi_ob': 93, 'bear_adx_thresh': 21.887324721590648, 'bear_atr_min_pct': 0.0024714792143811556, 'bear_atr_max_pct': 0.08687769360504498, 'bear_tp_mult': 1.2818512333062924, 'bear_tsl_mult': 0.5182516322027788, 'bear_time_stop': 215, 'bear_use_sma': True, 'bear_use_ema': False, 'bear_use_atr': False, 'bear_use_adx': True, 'bear_use_spike': False, 'bear_rsi_required': False, 'sideways_strategy': 'breakout', 'sideways_bb_std_mult': 0.893279476748339, 'sideways_rsi_os': 38, 'sideways_rsi_ob': 53, 'sideways_adx_thresh': 21.586788682198403, 'sideways_atr_min_pct': 0.0029611234681463233, 'sideways_atr_max_pct': 0.07198060474629464, 'sideways_tp_mult': 1.6267884115283557, 'sideways_tsl_mult': 0.9670554573158582, 'sideways_time_stop': 122, 'sideways_use_sma': True, 'sideways_use_ema': False, 'sideways_use_atr': True, 'sideways_use_adx': False, 'sideways_use_spike': False, 'sideways_rsi_required': True}.
[I 2025-09-01 09:20:23,575] Trial 88 finished with values: [-1000000000.0, 1000000000.0] and parameters: {'p_sma': 10, 'p_std': 23, 'p_atr': 27, 'p_adx': 19, 'rsi_period': 46, 'ema1': 5, 'ema2': 34, 'slip_atr_k': 0.14347082381176193, 'slip_spread_k': 0.3266809060488213, 'spread_hl_frac': 0.0029829116996596163, 'bb_std_mult': 2.467670103710234, 'rsi_os': 32, 'rsi_ob': 56, 'vol_spike': 0.1828143623439077, 'adx_thresh': 24.371530577540216, 'atr_min_pct': 0.022253624422604742, 'atr_max_pct': 0.08150256582859823, 'tp_mult': 1.5196543605398714, 'tsl_mult': 0.6126109139309055, 'strategy': 'mean_reversion', 'time_stop': 163, 'use_sma': False, 'use_atr': False, 'use_adx': True, 'use_ema': False, 'use_spike': False, 'rsi_required': False, 'edge_k': 1.9009429980982553, 'edge_cap': 0.2184236110711284, 'bull_strategy': 'mean_reversion', 'bull_bb_std_mult': 1.7348815388418708, 'bull_rsi_os': 33, 'bull_rsi_ob': 59, 'bull_adx_thresh': 22.960895428053703, 'bull_atr_min_pct': 0.018397896012633842, 'bull_atr_max_pct': 0.13443709322929392, 'bull_tp_mult': 1.3348364837798299, 'bull_tsl_mult': 0.36950192023808426, 'bull_time_stop': 166, 'bull_use_sma': True, 'bull_use_ema': True, 'bull_use_atr': True, 'bull_use_adx': True, 'bull_use_spike': True, 'bull_rsi_required': False, 'bear_strategy': 'mean_reversion', 'bear_bb_std_mult': 1.3732279539398249, 'bear_rsi_os': 18, 'bear_rsi_ob': 73, 'bear_adx_thresh': 27.75613758927393, 'bear_atr_min_pct': 0.001903888539373724, 'bear_atr_max_pct': 0.06109634059055767, 'bear_tp_mult': 1.6528695390304198, 'bear_tsl_mult': 0.7733263159103718, 'bear_time_stop': 220, 'bear_use_sma': True, 'bear_use_ema': False, 'bear_use_atr': False, 'bear_use_adx': True, 'bear_use_spike': False, 'bear_rsi_required': False, 'sideways_strategy': 'breakout', 'sideways_bb_std_mult': 0.7943882644639024, 'sideways_rsi_os': 35, 'sideways_rsi_ob': 91, 'sideways_adx_thresh': 21.523862735816966, 'sideways_atr_min_pct': 0.029835045167627337, 'sideways_atr_max_pct': 0.07221085568099, 'sideways_tp_mult': 1.6542221208739376, 'sideways_tsl_mult': 0.8807725812966501, 'sideways_time_stop': 170, 'sideways_use_sma': True, 'sideways_use_ema': False, 'sideways_use_atr': True, 'sideways_use_adx': False, 'sideways_use_spike': False, 'sideways_rsi_required': True}.
[I 2025-09-01 09:20:23,561] Trial 89 finished with values: [-1000000000.0, 1000000000.0] and parameters: {'p_sma': 6, 'p_std': 27, 'p_atr': 27, 'p_adx': 18, 'rsi_period': 84, 'ema1': 5, 'ema2': 36, 'slip_atr_k': 0.14821694879271885, 'slip_spread_k': 0.09143149761170993, 'spread_hl_frac': 0.04337739464233706, 'bb_std_mult': 2.116054999985903, 'rsi_os': 32, 'rsi_ob': 64, 'vol_spike': 0.1785936695070761, 'adx_thresh': 30.794706489450665, 'atr_min_pct': 0.022206122603467184, 'atr_max_pct': 0.08284373654544444, 'tp_mult': 2.1089183271422507, 'tsl_mult': 0.6003553736016718, 'strategy': 'mean_reversion', 'time_stop': 76, 'use_sma': False, 'use_atr': False, 'use_adx': True, 'use_ema': False, 'use_spike': False, 'rsi_required': False, 'edge_k': 0.018101431220144126, 'edge_cap': 0.6056248618972746, 'bull_strategy': 'mean_reversion', 'bull_bb_std_mult': 1.6966858681405028, 'bull_rsi_os': 26, 'bull_rsi_ob': 47, 'bull_adx_thresh': 23.35120666594843, 'bull_atr_min_pct': 0.017611369355432668, 'bull_atr_max_pct': 0.1352073544320248, 'bull_tp_mult': 2.35749676721148, 'bull_tsl_mult': 0.3738238301244436, 'bull_time_stop': 167, 'bull_use_sma': True, 'bull_use_ema': True, 'bull_use_atr': True, 'bull_use_adx': True, 'bull_use_spike': True, 'bull_rsi_required': False, 'bear_strategy': 'mean_reversion', 'bear_bb_std_mult': 1.8709751563081138, 'bear_rsi_os': 18, 'bear_rsi_ob': 72, 'bear_adx_thresh': 27.637129310091666, 'bear_atr_min_pct': 0.005315899002325876, 'bear_atr_max_pct': 0.06070529190675246, 'bear_tp_mult': 1.67748938041303, 'bear_tsl_mult': 0.7628657320890049, 'bear_time_stop': 265, 'bear_use_sma': True, 'bear_use_ema': False, 'bear_use_atr': False, 'bear_use_adx': True, 'bear_use_spike': False, 'bear_rsi_required': False, 'sideways_strategy': 'breakout', 'sideways_bb_std_mult': 0.8476225194652431, 'sideways_rsi_os': 35, 'sideways_rsi_ob': 54, 'sideways_adx_thresh': 21.021258109467027, 'sideways_atr_min_pct': 0.0005820148692791726, 'sideways_atr_max_pct': 0.1369490365252055, 'sideways_tp_mult': 1.3959361674601665, 'sideways_tsl_mult': 0.8800355293828269, 'sideways_time_stop': 128, 'sideways_use_sma': True, 'sideways_use_ema': False, 'sideways_use_atr': True, 'sideways_use_adx': False, 'sideways_use_spike': False, 'sideways_rsi_required': True}.
[I 2025-09-01 09:20:24,795] Trial 86 finished with values: [-0.03644593512613137, 0.03608607397159495] and parameters: {'p_sma': 44, 'p_std': 27, 'p_atr': 24, 'p_adx': 17, 'rsi_period': 8, 'ema1': 5, 'ema2': 38, 'slip_atr_k': 0.1281396717797132, 'slip_spread_k': 0.31728279262979403, 'spread_hl_frac': 0.04030196388159865, 'bb_std_mult': 0.5271643960429186, 'rsi_os': 23, 'rsi_ob': 56, 'vol_spike': 0.24471196306261755, 'adx_thresh': 12.52839865191518, 'atr_min_pct': 0.017090988768818816, 'atr_max_pct': 0.08379682197245884, 'tp_mult': 1.089202322673858, 'tsl_mult': 0.14989620000138443, 'strategy': 'mean_reversion', 'time_stop': 298, 'use_sma': False, 'use_atr': False, 'use_adx': True, 'use_ema': False, 'use_spike': False, 'rsi_required': False, 'edge_k': 0.0014005713509836482, 'edge_cap': 0.35133540644224936, 'bull_strategy': 'mean_reversion', 'bull_bb_std_mult': 1.5365678145448434, 'bull_rsi_os': 38, 'bull_rsi_ob': 67, 'bull_adx_thresh': 28.580784461743946, 'bull_atr_min_pct': 0.016987884478013533, 'bull_atr_max_pct': 0.12492173345408072, 'bull_tp_mult': 2.135860922958931, 'bull_tsl_mult': 0.43623473560147336, 'bull_time_stop': 167, 'bull_use_sma': False, 'bull_use_ema': True, 'bull_use_atr': False, 'bull_use_adx': False, 'bull_use_spike': True, 'bull_rsi_required': False, 'bear_strategy': 'mean_reversion', 'bear_bb_std_mult': 3.067637802610771, 'bear_rsi_os': 11, 'bear_rsi_ob': 92, 'bear_adx_thresh': 20.250280529625954, 'bear_atr_min_pct': 0.009173150643090423, 'bear_atr_max_pct': 0.060221655835955, 'bear_tp_mult': 2.114582840697846, 'bear_tsl_mult': 0.770848087886626, 'bear_time_stop': 228, 'bear_use_sma': True, 'bear_use_ema': False, 'bear_use_atr': True, 'bear_use_adx': True, 'bear_use_spike': True, 'bear_rsi_required': True, 'sideways_strategy': 'breakout', 'sideways_bb_std_mult': 0.7172059344698312, 'sideways_rsi_os': 43, 'sideways_rsi_ob': 53, 'sideways_adx_thresh': 15.469275505871941, 'sideways_atr_min_pct': 0.0029277382512430134, 'sideways_atr_max_pct': 0.14653907080042422, 'sideways_tp_mult': 1.1879036592500134, 'sideways_tsl_mult': 0.3096137242381537, 'sideways_time_stop': 42, 'sideways_use_sma': False, 'sideways_use_ema': True, 'sideways_use_atr': True, 'sideways_use_adx': False, 'sideways_use_spike': False, 'sideways_rsi_required': False}.
