[I 2025-09-01 09:30:47,451] Trial 153 finished with values: [-1000000000.0, 1000000000.0] and parameters: {'p_sma': 17, 'p_std': 55, 'p_atr': 15, 'p_adx': 21, 'rsi_period': 24, 'ema1': 16, 'ema2': 14, 'slip_atr_k': 0.0561491138841177, 'slip_spread_k': 0.16124724047138422, 'spread_hl_frac': 0.02583548552444273, 'bb_std_mult': 1.3357378670303677, 'rsi_os': 36, 'rsi_ob': 72, 'vol_spike': 0.03469022595722067, 'adx_thresh': 32.61205119920567, 'atr_min_pct': 0.025670757422020723, 'atr_max_pct': 0.06936406519445473, 'tp_mult': 1.0547740965529366, 'tsl_mult': 0.29915839527589744, 'strategy': 'breakout', 'time_stop': 267, 'use_sma': True, 'use_atr': False, 'use_adx': False, 'use_ema': True, 'use_spike': True, 'rsi_required': True, 'edge_k': 1.9074385270431367, 'edge_cap': 0.873889557172493, 'bull_strategy': 'breakout', 'bull_bb_std_mult': 3.42820224105791, 'bull_rsi_os': 44, 'bull_rsi_ob': 51, 'bull_adx_thresh': 8.4908675988809, 'bull_atr_min_pct': 0.011503423967907645, 'bull_atr_max_pct': 0.08001845944072461, 'bull_tp_mult': 1.419121815910237, 'bull_tsl_mult': 0.9490774930375511, 'bull_time_stop': 232, 'bull_use_sma': True, 'bull_use_ema': False, 'bull_use_atr': True, 'bull_use_adx': True, 'bull_use_spike': False, 'bull_rsi_required': True, 'bear_strategy': 'mean_reversion', 'bear_bb_std_mult': 1.7857600703385272, 'bear_rsi_os': 55, 'bear_rsi_ob': 90, 'bear_adx_thresh': 22.521586914086864, 'bear_atr_min_pct': 0.025146373221411746, 'bear_atr_max_pct': 0.07957582732904471, 'bear_tp_mult': 2.0890431305422137, 'bear_tsl_mult': 0.4852562508558186, 'bear_time_stop': 280, 'bear_use_sma': True, 'bear_use_ema': True, 'bear_use_atr': True, 'bear_use_adx': False, 'bear_use_spike': False, 'bear_rsi_required': False, 'sideways_strategy': 'mean_reversion', 'sideways_bb_std_mult': 0.8593435155232727, 'sideways_rsi_os': 49, 'sideways_rsi_ob': 89, 'sideways_adx_thresh': 25.704686199478846, 'sideways_atr_min_pct': 0.0232523194501136, 'sideways_atr_max_pct': 0.06975166813630079, 'sideways_tp_mult': 2.1565456465051365, 'sideways_tsl_mult': 0.4479321526259282, 'sideways_time_stop': 18, 'sideways_use_sma': True, 'sideways_use_ema': False, 'sideways_use_atr': False, 'sideways_use_adx': True, 'sideways_use_spike': False, 'sideways_rsi_required': True}.
[I 2025-09-01 09:30:47,704] Trial 151 finished with values: [-1000000000.0, 1000000000.0] and parameters: {'p_sma': 26, 'p_std': 55, 'p_atr': 15, 'p_adx': 21, 'rsi_period': 25, 'ema1': 16, 'ema2': 14, 'slip_atr_k': 0.05431221637824669, 'slip_spread_k': 0.5294740228865297, 'spread_hl_frac': 0.02874297777234659, 'bb_std_mult': 1.38579067334394, 'rsi_os': 42, 'rsi_ob': 46, 'vol_spike': 0.02593464954991046, 'adx_thresh': 31.26305414966206, 'atr_min_pct': 0.026856472421658884, 'atr_max_pct': 0.05758797616544832, 'tp_mult': 2.0488995397439385, 'tsl_mult': 0.423231352730399, 'strategy': 'breakout', 'time_stop': 290, 'use_sma': True, 'use_atr': False, 'use_adx': False, 'use_ema': True, 'use_spike': True, 'rsi_required': True, 'edge_k': 1.068844768671466, 'edge_cap': 0.869533003775004, 'bull_strategy': 'breakout', 'bull_bb_std_mult': 3.47261018855029, 'bull_rsi_os': 52, 'bull_rsi_ob': 47, 'bull_adx_thresh': 5.6715115028896035, 'bull_atr_min_pct': 0.0198043819998633, 'bull_atr_max_pct': 0.07955882979301275, 'bull_tp_mult': 1.4234435970558927, 'bull_tsl_mult': 0.9489744474970765, 'bull_time_stop': 254, 'bull_use_sma': True, 'bull_use_ema': False, 'bull_use_atr': True, 'bull_use_adx': True, 'bull_use_spike': False, 'bull_rsi_required': True, 'bear_strategy': 'mean_reversion', 'bear_bb_std_mult': 2.022009817974829, 'bear_rsi_os': 55, 'bear_rsi_ob': 91, 'bear_adx_thresh': 22.428091704355964, 'bear_atr_min_pct': 0.02742855830656301, 'bear_atr_max_pct': 0.056541546131239365, 'bear_tp_mult': 2.107552729175502, 'bear_tsl_mult': 0.4853991234714507, 'bear_time_stop': 292, 'bear_use_sma': True, 'bear_use_ema': True, 'bear_use_atr': True, 'bear_use_adx': False, 'bear_use_spike': False, 'bear_rsi_required': False, 'sideways_strategy': 'mean_reversion', 'sideways_bb_std_mult': 0.5359386886342072, 'sideways_rsi_os': 52, 'sideways_rsi_ob': 88, 'sideways_adx_thresh': 25.587162799374106, 'sideways_atr_min_pct': 0.02378380859773835, 'sideways_atr_max_pct': 0.08202108434360703, 'sideways_tp_mult': 2.080412820631634, 'sideways_tsl_mult': 0.3726473210073525, 'sideways_time_stop': 250, 'sideways_use_sma': True, 'sideways_use_ema': False, 'sideways_use_atr': False, 'sideways_use_adx': True, 'sideways_use_spike': False, 'sideways_rsi_required': True}.
[I 2025-09-01 09:31:24,546] Trial 156 finished with values: [-1000000000.0, 1000000000.0] and parameters: {'p_sma': 23, 'p_std': 47, 'p_atr': 16, 'p_adx': 26, 'rsi_period': 14, 'ema1': 17, 'ema2': 18, 'slip_atr_k': 0.03682018726917309, 'slip_spread_k': 0.5375209222836096, 'spread_hl_frac': 0.013085834676836772, 'bb_std_mult': 1.196341768917832, 'rsi_os': 36, 'rsi_ob': 73, 'vol_spike': 0.02706655428786413, 'adx_thresh': 31.579791851263845, 'atr_min_pct': 0.025126500026106894, 'atr_max_pct': 0.07936478058230115, 'tp_mult': 2.3232490271010806, 'tsl_mult': 0.30962865199443285, 'strategy': 'breakout', 'time_stop': 231, 'use_sma': True, 'use_atr': False, 'use_adx': False, 'use_ema': True, 'use_spike': True, 'rsi_required': True, 'edge_k': 1.2531757846672278, 'edge_cap': 0.7550414848446594, 'bull_strategy': 'breakout', 'bull_bb_std_mult': 3.4915790726160387, 'bull_rsi_os': 44, 'bull_rsi_ob': 46, 'bull_adx_thresh': 21.49965879745569, 'bull_atr_min_pct': 0.01978574060201851, 'bull_atr_max_pct': 0.08750712155916095, 'bull_tp_mult': 1.5536652824455321, 'bull_tsl_mult': 0.9973136758644594, 'bull_time_stop': 263, 'bull_use_sma': True, 'bull_use_ema': False, 'bull_use_atr': True, 'bull_use_adx': False, 'bull_use_spike': False, 'bull_rsi_required': True, 'bear_strategy': 'mean_reversion', 'bear_bb_std_mult': 2.1603882813666035, 'bear_rsi_os': 53, 'bear_rsi_ob': 95, 'bear_adx_thresh': 23.566042998017597, 'bear_atr_min_pct': 0.025348882372813575, 'bear_atr_max_pct': 0.07291094566029309, 'bear_tp_mult': 2.0497522498392944, 'bear_tsl_mult': 0.45376276688949413, 'bear_time_stop': 203, 'bear_use_sma': True, 'bear_use_ema': True, 'bear_use_atr': True, 'bear_use_adx': False, 'bear_use_spike': False, 'bear_rsi_required': False, 'sideways_strategy': 'mean_reversion', 'sideways_bb_std_mult': 1.1266395966775846, 'sideways_rsi_os': 55, 'sideways_rsi_ob': 90, 'sideways_adx_thresh': 28.401115920968472, 'sideways_atr_min_pct': 0.02164822136966056, 'sideways_atr_max_pct': 0.07755407571920035, 'sideways_tp_mult': 1.9937445657939155, 'sideways_tsl_mult': 0.42553254532680423, 'sideways_time_stop': 30, 'sideways_use_sma': True, 'sideways_use_ema': False, 'sideways_use_atr': False, 'sideways_use_adx': True, 'sideways_use_spike': False, 'sideways_rsi_required': False}.
[I 2025-09-01 09:31:24,587] Trial 157 finished with values: [-1000000000.0, 1000000000.0] and parameters: {'p_sma': 23, 'p_std': 46, 'p_atr': 16, 'p_adx': 22, 'rsi_period': 17, 'ema1': 17, 'ema2': 17, 'slip_atr_k': 0.03711983286653771, 'slip_spread_k': 0.5404026604337803, 'spread_hl_frac': 0.023802566792422618, 'bb_std_mult': 3.035785491363144, 'rsi_os': 37, 'rsi_ob': 70, 'vol_spike': 0.02821922466206643, 'adx_thresh': 31.635489666944927, 'atr_min_pct': 0.02864674450612642, 'atr_max_pct': 0.045355857451975234, 'tp_mult': 1.010295124453658, 'tsl_mult': 0.36920379993412766, 'strategy': 'breakout', 'time_stop': 155, 'use_sma': True, 'use_atr': False, 'use_adx': False, 'use_ema': True, 'use_spike': True, 'rsi_required': True, 'edge_k': 1.2564942514600193, 'edge_cap': 0.818219921694948, 'bull_strategy': 'breakout', 'bull_bb_std_mult': 3.533394108611562, 'bull_rsi_os': 16, 'bull_rsi_ob': 46, 'bull_adx_thresh': 21.088962742336026, 'bull_atr_min_pct': 0.019406969048369558, 'bull_atr_max_pct': 0.0875738970439153, 'bull_tp_mult': 1.551337344046292, 'bull_tsl_mult': 0.9911513511893495, 'bull_time_stop': 261, 'bull_use_sma': True, 'bull_use_ema': False, 'bull_use_atr': True, 'bull_use_adx': False, 'bull_use_spike': False, 'bull_rsi_required': True, 'bear_strategy': 'mean_reversion', 'bear_bb_std_mult': 1.9719444126526384, 'bear_rsi_os': 53, 'bear_rsi_ob': 94, 'bear_adx_thresh': 25.085139858221794, 'bear_atr_min_pct': 0.02737296075035086, 'bear_atr_max_pct': 0.07317653224257982, 'bear_tp_mult': 2.1437474566388626, 'bear_tsl_mult': 0.4507429584730457, 'bear_time_stop': 293, 'bear_use_sma': True, 'bear_use_ema': True, 'bear_use_atr': True, 'bear_use_adx': False, 'bear_use_spike': False, 'bear_rsi_required': False, 'sideways_strategy': 'mean_reversion', 'sideways_bb_std_mult': 0.9483230973218424, 'sideways_rsi_os': 53, 'sideways_rsi_ob': 87, 'sideways_adx_thresh': 29.487556260240613, 'sideways_atr_min_pct': 0.02159990231517486, 'sideways_atr_max_pct': 0.07783989311226047, 'sideways_tp_mult': 2.0008617738073653, 'sideways_tsl_mult': 0.34178883179986924, 'sideways_time_stop': 160, 'sideways_use_sma': True, 'sideways_use_ema': False, 'sideways_use_atr': False, 'sideways_use_adx': True, 'sideways_use_spike': False, 'sideways_rsi_required': False}.
[I 2025-09-01 09:31:25,779] Trial 155 finished with values: [-1000000000.0, 1000000000.0] and parameters: {'p_sma': 23, 'p_std': 46, 'p_atr': 16, 'p_adx': 27, 'rsi_period': 22, 'ema1': 17, 'ema2': 14, 'slip_atr_k': 0.036674701464221776, 'slip_spread_k': 0.43977978494170344, 'spread_hl_frac': 0.025541348842488584, 'bb_std_mult': 1.3067359516021686, 'rsi_os': 38, 'rsi_ob': 73, 'vol_spike': 0.02607006172754095, 'adx_thresh': 32.48893277454075, 'atr_min_pct': 0.0254485085536759, 'atr_max_pct': 0.08018217167530613, 'tp_mult': 1.0122407142061187, 'tsl_mult': 0.4292346756642165, 'strategy': 'breakout', 'time_stop': 232, 'use_sma': True, 'use_atr': False, 'use_adx': False, 'use_ema': True, 'use_spike': True, 'rsi_required': True, 'edge_k': 0.7239895615412961, 'edge_cap': 0.8693210482273711, 'bull_strategy': 'breakout', 'bull_bb_std_mult': 3.5379080404072085, 'bull_rsi_os': 46, 'bull_rsi_ob': 46, 'bull_adx_thresh': 21.493489747074957, 'bull_atr_min_pct': 0.029416759330437033, 'bull_atr_max_pct': 0.07967577641014739, 'bull_tp_mult': 1.4353216559452533, 'bull_tsl_mult': 0.9561963215463123, 'bull_time_stop': 232, 'bull_use_sma': True, 'bull_use_ema': False, 'bull_use_atr': True, 'bull_use_adx': False, 'bull_use_spike': False, 'bull_rsi_required': True, 'bear_strategy': 'mean_reversion', 'bear_bb_std_mult': 2.1497887350879923, 'bear_rsi_os': 53, 'bear_rsi_ob': 90, 'bear_adx_thresh': 24.83073784887509, 'bear_atr_min_pct': 0.025614101236702852, 'bear_atr_max_pct': 0.06931220343066241, 'bear_tp_mult': 2.0546736357234066, 'bear_tsl_mult': 0.4613174722071565, 'bear_time_stop': 280, 'bear_use_sma': True, 'bear_use_ema': True, 'bear_use_atr': True, 'bear_use_adx': False, 'bear_use_spike': False, 'bear_rsi_required': False, 'sideways_strategy': 'mean_reversion', 'sideways_bb_std_mult': 0.9340464544257022, 'sideways_rsi_os': 49, 'sideways_rsi_ob': 87, 'sideways_adx_thresh': 28.63135081602858, 'sideways_atr_min_pct': 0.020232176530383603, 'sideways_atr_max_pct': 0.07857399723216733, 'sideways_tp_mult': 2.0713273936935708, 'sideways_tsl_mult': 0.33854073462857714, 'sideways_time_stop': 30, 'sideways_use_sma': True, 'sideways_use_ema': False, 'sideways_use_atr': False, 'sideways_use_adx': True, 'sideways_use_spike': False, 'sideways_rsi_required': False}.
[I 2025-09-01 09:31:26,325] Trial 158 finished with values: [-1000000000.0, 1000000000.0] and parameters: {'p_sma': 23, 'p_std': 41, 'p_atr': 16, 'p_adx': 27, 'rsi_period': 44, 'ema1': 19, 'ema2': 11, 'slip_atr_k': 0.08505967859069971, 'slip_spread_k': 0.6330898570551282, 'spread_hl_frac': 0.023678885668868156, 'bb_std_mult': 1.2834707972191648, 'rsi_os': 38, 'rsi_ob': 70, 'vol_spike': 0.027224805190223536, 'adx_thresh': 30.198343660204877, 'atr_min_pct': 0.02546788128143134, 'atr_max_pct': 0.07837247669827635, 'tp_mult': 1.8081940680348925, 'tsl_mult': 0.45289432596796886, 'strategy': 'breakout', 'time_stop': 116, 'use_sma': True, 'use_atr': False, 'use_adx': False, 'use_ema': True, 'use_spike': True, 'rsi_required': True, 'edge_k': 1.4743569137865375, 'edge_cap': 0.8278391891199667, 'bull_strategy': 'breakout', 'bull_bb_std_mult': 3.53481714353484, 'bull_rsi_os': 46, 'bull_rsi_ob': 55, 'bull_adx_thresh': 7.114913039950158, 'bull_atr_min_pct': 0.010090571100962367, 'bull_atr_max_pct': 0.08744584246583739, 'bull_tp_mult': 1.5572719577673853, 'bull_tsl_mult': 0.9995601949616532, 'bull_time_stop': 265, 'bull_use_sma': True, 'bull_use_ema': False, 'bull_use_atr': True, 'bull_use_adx': False, 'bull_use_spike': False, 'bull_rsi_required': True, 'bear_strategy': 'breakout', 'bear_bb_std_mult': 2.1686261907771893, 'bear_rsi_os': 53, 'bear_rsi_ob': 95, 'bear_adx_thresh': 23.554187143208836, 'bear_atr_min_pct': 0.026077236199003467, 'bear_atr_max_pct': 0.06932242983056465, 'bear_tp_mult': 2.167872828797027, 'bear_tsl_mult': 0.2805292511681698, 'bear_time_stop': 204, 'bear_use_sma': True, 'bear_use_ema': True, 'bear_use_atr': True, 'bear_use_adx': False, 'bear_use_spike': False, 'bear_rsi_required': False, 'sideways_strategy': 'mean_reversion', 'sideways_bb_std_mult': 1.1148158686558296, 'sideways_rsi_os': 55, 'sideways_rsi_ob': 90, 'sideways_adx_thresh': 28.456117865979866, 'sideways_atr_min_pct': 0.021835497798325856, 'sideways_atr_max_pct': 0.0778631423747713, 'sideways_tp_mult': 2.0034579295094153, 'sideways_tsl_mult': 0.16422148810114995, 'sideways_time_stop': 30, 'sideways_use_sma': True, 'sideways_use_ema': False, 'sideways_use_atr': False, 'sideways_use_adx': True, 'sideways_use_spike': False, 'sideways_rsi_required': False}.
[I 2025-09-01 09:32:04,425] Trial 162 finished with values: [-1000000000.0, 1000000000.0] and parameters: {'p_sma': 22, 'p_std': 22, 'p_atr': 20, 'p_adx': 19, 'rsi_period': 25, 'ema1': 18, 'ema2': 58, 'slip_atr_k': 0.06287534579490375, 'slip_spread_k': 0.6055938946918962, 'spread_hl_frac': 0.021923200477122422, 'bb_std_mult': 3.2396942910100526, 'rsi_os': 39, 'rsi_ob': 66, 'vol_spike': 0.0191324018499444, 'adx_thresh': 19.95107056368533, 'atr_min_pct': 0.025962115776650294, 'atr_max_pct': 0.07370650889116281, 'tp_mult': 2.236075228335827, 'tsl_mult': 0.3604012317301948, 'strategy': 'breakout', 'time_stop': 218, 'use_sma': True, 'use_atr': False, 'use_adx': False, 'use_ema': True, 'use_spike': True, 'rsi_required': True, 'edge_k': 1.3000325310797676, 'edge_cap': 0.7145057834104183, 'bull_strategy': 'breakout', 'bull_bb_std_mult': 3.599129342831058, 'bull_rsi_os': 50, 'bull_rsi_ob': 48, 'bull_adx_thresh': 6.260954123605704, 'bull_atr_min_pct': 0.017650489715152665, 'bull_atr_max_pct': 0.08366169472107643, 'bull_tp_mult': 1.4669887201883833, 'bull_tsl_mult': 0.8491777179452512, 'bull_time_stop': 64, 'bull_use_sma': True, 'bull_use_ema': False, 'bull_use_atr': True, 'bull_use_adx': False, 'bull_use_spike': False, 'bull_rsi_required': True, 'bear_strategy': 'breakout', 'bear_bb_std_mult': 1.5924756344130666, 'bear_rsi_os': 50, 'bear_rsi_ob': 45, 'bear_adx_thresh': 6.58013963374956, 'bear_atr_min_pct': 0.028687169361568426, 'bear_atr_max_pct': 0.07947008708497, 'bear_tp_mult': 2.3712227352890656, 'bear_tsl_mult': 0.5271018813856676, 'bear_time_stop': 24, 'bear_use_sma': True, 'bear_use_ema': True, 'bear_use_atr': True, 'bear_use_adx': False, 'bear_use_spike': False, 'bear_rsi_required': False, 'sideways_strategy': 'mean_reversion', 'sideways_bb_std_mult': 0.7677664548339557, 'sideways_rsi_os': 47, 'sideways_rsi_ob': 86, 'sideways_adx_thresh': 27.79679783780251, 'sideways_atr_min_pct': 0.027511019146746928, 'sideways_atr_max_pct': 0.08779217674507055, 'sideways_tp_mult': 1.941489605134698, 'sideways_tsl_mult': 0.5108378077666389, 'sideways_time_stop': 194, 'sideways_use_sma': True, 'sideways_use_ema': False, 'sideways_use_atr': False, 'sideways_use_adx': True, 'sideways_use_spike': True, 'sideways_rsi_required': False}.
[I 2025-09-01 09:32:05,254] Trial 161 finished with values: [-0.13928179048913591, 0.13870976566949375] and parameters: {'p_sma': 18, 'p_std': 24, 'p_atr': 20, 'p_adx': 19, 'rsi_period': 25, 'ema1': 19, 'ema2': 60, 'slip_atr_k': 0.06288526197185387, 'slip_spread_k': 0.6422254140242709, 'spread_hl_frac': 0.027486785487749892, 'bb_std_mult': 1.1669383304545624, 'rsi_os': 38, 'rsi_ob': 66, 'vol_spike': 0.05883074196985373, 'adx_thresh': 30.52509945051218, 'atr_min_pct': 0.02993891531019651, 'atr_max_pct': 0.07539726163441852, 'tp_mult': 1.8040256421799699, 'tsl_mult': 0.5019215155111879, 'strategy': 'breakout', 'time_stop': 181, 'use_sma': True, 'use_atr': False, 'use_adx': False, 'use_ema': True, 'use_spike': True, 'rsi_required': True, 'edge_k': 1.6508412397433818, 'edge_cap': 0.06124419344681259, 'bull_strategy': 'breakout', 'bull_bb_std_mult': 0.773228891247683, 'bull_rsi_os': 48, 'bull_rsi_ob': 48, 'bull_adx_thresh': 6.638401442434625, 'bull_atr_min_pct': 0.02094814033848818, 'bull_atr_max_pct': 0.07536876099784992, 'bull_tp_mult': 1.4627662627567066, 'bull_tsl_mult': 0.9230260125772789, 'bull_time_stop': 227, 'bull_use_sma': True, 'bull_use_ema': False, 'bull_use_atr': True, 'bull_use_adx': False, 'bull_use_spike': False, 'bull_rsi_required': True, 'bear_strategy': 'breakout', 'bear_bb_std_mult': 1.6185102039856618, 'bear_rsi_os': 50, 'bear_rsi_ob': 93, 'bear_adx_thresh': 6.627336759241196, 'bear_atr_min_pct': 0.0010818484497062564, 'bear_atr_max_pct': 0.045502201664267945, 'bear_tp_mult': 2.2525313861124925, 'bear_tsl_mult': 0.28597674104799886, 'bear_time_stop': 10, 'bear_use_sma': True, 'bear_use_ema': True, 'bear_use_atr': True, 'bear_use_adx': False, 'bear_use_spike': False, 'bear_rsi_required': False, 'sideways_strategy': 'mean_reversion', 'sideways_bb_std_mult': 1.4264413972588936, 'sideways_rsi_os': 53, 'sideways_rsi_ob': 92, 'sideways_adx_thresh': 24.181821597162333, 'sideways_atr_min_pct': 0.022397447568727295, 'sideways_atr_max_pct': 0.12000157118566124, 'sideways_tp_mult': 1.8431540689850356, 'sideways_tsl_mult': 0.5039200506440256, 'sideways_time_stop': 44, 'sideways_use_sma': True, 'sideways_use_ema': False, 'sideways_use_atr': False, 'sideways_use_adx': True, 'sideways_use_spike': True, 'sideways_rsi_required': False}.
[I 2025-09-01 09:32:05,811] Trial 160 finished with values: [-1000000000.0, 1000000000.0] and parameters: {'p_sma': 22, 'p_std': 41, 'p_atr': 17, 'p_adx': 19, 'rsi_period': 32, 'ema1': 19, 'ema2': 16, 'slip_atr_k': 0.024297936562052938, 'slip_spread_k': 0.6101342127080629, 'spread_hl_frac': 0.02140338408660856, 'bb_std_mult': 1.2898564209049792, 'rsi_os': 38, 'rsi_ob': 66, 'vol_spike': 0.059364352726981, 'adx_thresh': 30.363973707248405, 'atr_min_pct': 0.0049355930803190815, 'atr_max_pct': 0.075248934987803, 'tp_mult': 1.225953294028765, 'tsl_mult': 0.4560968801944604, 'strategy': 'breakout', 'time_stop': 218, 'use_sma': True, 'use_atr': False, 'use_adx': False, 'use_ema': True, 'use_spike': True, 'rsi_required': True, 'edge_k': 1.4795660597129316, 'edge_cap': 0.918779595196145, 'bull_strategy': 'breakout', 'bull_bb_std_mult': 3.54679758911298, 'bull_rsi_os': 46, 'bull_rsi_ob': 48, 'bull_adx_thresh': 6.8318675600613386, 'bull_atr_min_pct': 0.010119775983702763, 'bull_atr_max_pct': 0.08321202218575839, 'bull_tp_mult': 1.4565755632341855, 'bull_tsl_mult': 0.9675445315823316, 'bull_time_stop': 226, 'bull_use_sma': True, 'bull_use_ema': False, 'bull_use_atr': True, 'bull_use_adx': False, 'bull_use_spike': False, 'bull_rsi_required': True, 'bear_strategy': 'breakout', 'bear_bb_std_mult': 2.1763453230865335, 'bear_rsi_os': 50, 'bear_rsi_ob': 93, 'bear_adx_thresh': 6.370301265957611, 'bear_atr_min_pct': 0.026093622965077855, 'bear_atr_max_pct': 0.04335507302697834, 'bear_tp_mult': 2.267126311162142, 'bear_tsl_mult': 0.3673737725961344, 'bear_time_stop': 6, 'bear_use_sma': True, 'bear_use_ema': True, 'bear_use_atr': True, 'bear_use_adx': False, 'bear_use_spike': False, 'bear_rsi_required': False, 'sideways_strategy': 'mean_reversion', 'sideways_bb_std_mult': 0.7490402102670779, 'sideways_rsi_os': 53, 'sideways_rsi_ob': 92, 'sideways_adx_thresh': 24.074532091546402, 'sideways_atr_min_pct': 0.020290780742751223, 'sideways_atr_max_pct': 0.14257795008130908, 'sideways_tp_mult': 2.3556817063545115, 'sideways_tsl_mult': 0.38915228218633946, 'sideways_time_stop': 47, 'sideways_use_sma': True, 'sideways_use_ema': False, 'sideways_use_atr': False, 'sideways_use_adx': True, 'sideways_use_spike': True, 'sideways_rsi_required': False}.
