[I 2025-09-01 09:26:00,111] Trial 126 finished with values: [-0.025451455879136886, 0.02522804273921652] and parameters: {'p_sma': 20, 'p_std': 55, 'p_atr': 30, 'p_adx': 18, 'rsi_period': 21, 'ema1': 21, 'ema2': 16, 'slip_atr_k': 0.07231873468992023, 'slip_spread_k': 0.6427655090646344, 'spread_hl_frac': 0.033870649813554046, 'bb_std_mult': 1.2980119996891661, 'rsi_os': 38, 'rsi_ob': 65, 'vol_spike': 0.020816982670278542, 'adx_thresh': 31.35195723803937, 'atr_min_pct': 0.020161365637901132, 'atr_max_pct': 0.08386033271427755, 'tp_mult': 1.1566261145119476, 'tsl_mult': 0.47983482805246974, 'strategy': 'breakout', 'time_stop': 283, 'use_sma': True, 'use_atr': True, 'use_adx': False, 'use_ema': True, 'use_spike': True, 'rsi_required': True, 'edge_k': 1.2504294916256524, 'edge_cap': 0.8409517224592191, 'bull_strategy': 'breakout', 'bull_bb_std_mult': 3.531734340184891, 'bull_rsi_os': 45, 'bull_rsi_ob': 47, 'bull_adx_thresh': 7.867563103438268, 'bull_atr_min_pct': 0.0001329088043181075, 'bull_atr_max_pct': 0.08502997317833796, 'bull_tp_mult': 1.509971452010887, 'bull_tsl_mult': 0.9411700423378311, 'bull_time_stop': 223, 'bull_use_sma': True, 'bull_use_ema': False, 'bull_use_atr': True, 'bull_use_adx': False, 'bull_use_spike': False, 'bull_rsi_required': True, 'bear_strategy': 'mean_reversion', 'bear_bb_std_mult': 2.040886062403332, 'bear_rsi_os': 55, 'bear_rsi_ob': 95, 'bear_adx_thresh': 24.183005651247605, 'bear_atr_min_pct': 0.025545512040660353, 'bear_atr_max_pct': 0.07177278997568975, 'bear_tp_mult': 1.607226391315209, 'bear_tsl_mult': 0.3037483905102814, 'bear_time_stop': 290, 'bear_use_sma': True, 'bear_use_ema': True, 'bear_use_atr': True, 'bear_use_adx': False, 'bear_use_spike': True, 'bear_rsi_required': False, 'sideways_strategy': 'mean_reversion', 'sideways_bb_std_mult': 0.9576302001582395, 'sideways_rsi_os': 52, 'sideways_rsi_ob': 90, 'sideways_adx_thresh': 20.885931184735927, 'sideways_atr_min_pct': 0.01965303602283848, 'sideways_atr_max_pct': 0.06714062703517275, 'sideways_tp_mult': 2.0313991424170763, 'sideways_tsl_mult': 0.9455378556687531, 'sideways_time_stop': 24, 'sideways_use_sma': True, 'sideways_use_ema': True, 'sideways_use_atr': False, 'sideways_use_adx': True, 'sideways_use_spike': False, 'sideways_rsi_required': False}.
[I 2025-09-01 09:26:39,638] Trial 130 finished with values: [-0.02748358696322828, 0.027268444700515367] and parameters: {'p_sma': 22, 'p_std': 55, 'p_atr': 17, 'p_adx': 18, 'rsi_period': 23, 'ema1': 19, 'ema2': 16, 'slip_atr_k': 0.04998669762529959, 'slip_spread_k': 0.6353066252132326, 'spread_hl_frac': 0.029953971868597534, 'bb_std_mult': 1.3624650442241346, 'rsi_os': 37, 'rsi_ob': 65, 'vol_spike': 0.02384789520441177, 'adx_thresh': 31.76636441202901, 'atr_min_pct': 0.025581419740441057, 'atr_max_pct': 0.07440976602878879, 'tp_mult': 1.0122615882110446, 'tsl_mult': 0.4461271616182338, 'strategy': 'breakout', 'time_stop': 280, 'use_sma': True, 'use_atr': True, 'use_adx': False, 'use_ema': False, 'use_spike': True, 'rsi_required': True, 'edge_k': 1.2600485602637932, 'edge_cap': 0.8128076152334576, 'bull_strategy': 'breakout', 'bull_bb_std_mult': 3.5410231276579878, 'bull_rsi_os': 45, 'bull_rsi_ob': 46, 'bull_adx_thresh': 6.1654650497038395, 'bull_atr_min_pct': 4.8635279686303086e-05, 'bull_atr_max_pct': 0.09888962392953816, 'bull_tp_mult': 1.4330932554949751, 'bull_tsl_mult': 0.940037148564605, 'bull_time_stop': 228, 'bull_use_sma': True, 'bull_use_ema': False, 'bull_use_atr': True, 'bull_use_adx': False, 'bull_use_spike': False, 'bull_rsi_required': True, 'bear_strategy': 'mean_reversion', 'bear_bb_std_mult': 2.005327770385348, 'bear_rsi_os': 55, 'bear_rsi_ob': 88, 'bear_adx_thresh': 23.846434318878966, 'bear_atr_min_pct': 0.027768692117901107, 'bear_atr_max_pct': 0.0716578347791385, 'bear_tp_mult': 1.5537447469138448, 'bear_tsl_mult': 0.30327332907968574, 'bear_time_stop': 292, 'bear_use_sma': True, 'bear_use_ema': True, 'bear_use_atr': False, 'bear_use_adx': False, 'bear_use_spike': False, 'bear_rsi_required': False, 'sideways_strategy': 'mean_reversion', 'sideways_bb_std_mult': 0.9636521274246131, 'sideways_rsi_os': 53, 'sideways_rsi_ob': 90, 'sideways_adx_thresh': 32.025606479825534, 'sideways_atr_min_pct': 0.021662323004868946, 'sideways_atr_max_pct': 0.07221696291451192, 'sideways_tp_mult': 2.0270534677984244, 'sideways_tsl_mult': 0.41777120923673744, 'sideways_time_stop': 26, 'sideways_use_sma': True, 'sideways_use_ema': False, 'sideways_use_atr': False, 'sideways_use_adx': True, 'sideways_use_spike': False, 'sideways_rsi_required': False}.
[I 2025-09-01 09:26:40,438] Trial 129 finished with values: [-0.024629761393951566, 0.02441605352795467] and parameters: {'p_sma': 20, 'p_std': 55, 'p_atr': 30, 'p_adx': 18, 'rsi_period': 23, 'ema1': 19, 'ema2': 18, 'slip_atr_k': 0.04775896180128299, 'slip_spread_k': 0.6540704003148529, 'spread_hl_frac': 0.029509019360459576, 'bb_std_mult': 1.253557501388098, 'rsi_os': 38, 'rsi_ob': 65, 'vol_spike': 0.020862650457234993, 'adx_thresh': 29.855882516119678, 'atr_min_pct': 0.027142767859800167, 'atr_max_pct': 0.08409585181004252, 'tp_mult': 1.0153154924485253, 'tsl_mult': 0.4424385041814153, 'strategy': 'breakout', 'time_stop': 281, 'use_sma': True, 'use_atr': False, 'use_adx': False, 'use_ema': False, 'use_spike': True, 'rsi_required': True, 'edge_k': 1.265410465039488, 'edge_cap': 0.8297404041500038, 'bull_strategy': 'breakout', 'bull_bb_std_mult': 3.5468071369419927, 'bull_rsi_os': 45, 'bull_rsi_ob': 49, 'bull_adx_thresh': 6.089395465396668, 'bull_atr_min_pct': 0.0003422837132862667, 'bull_atr_max_pct': 0.08607826544570071, 'bull_tp_mult': 1.518060363795231, 'bull_tsl_mult': 0.9440810589928559, 'bull_time_stop': 227, 'bull_use_sma': True, 'bull_use_ema': False, 'bull_use_atr': True, 'bull_use_adx': False, 'bull_use_spike': False, 'bull_rsi_required': True, 'bear_strategy': 'mean_reversion', 'bear_bb_std_mult': 1.9638351442863518, 'bear_rsi_os': 54, 'bear_rsi_ob': 95, 'bear_adx_thresh': 23.636189684363234, 'bear_atr_min_pct': 0.02826991628795777, 'bear_atr_max_pct': 0.07223913834492007, 'bear_tp_mult': 1.6768453837360484, 'bear_tsl_mult': 0.3012853151836585, 'bear_time_stop': 291, 'bear_use_sma': True, 'bear_use_ema': True, 'bear_use_atr': False, 'bear_use_adx': False, 'bear_use_spike': False, 'bear_rsi_required': False, 'sideways_strategy': 'mean_reversion', 'sideways_bb_std_mult': 0.9463059999558152, 'sideways_rsi_os': 52, 'sideways_rsi_ob': 90, 'sideways_adx_thresh': 27.322944351396124, 'sideways_atr_min_pct': 0.02242833307337399, 'sideways_atr_max_pct': 0.07320623511879175, 'sideways_tp_mult': 2.0263663171255653, 'sideways_tsl_mult': 0.417440091170274, 'sideways_time_stop': 24, 'sideways_use_sma': True, 'sideways_use_ema': False, 'sideways_use_atr': False, 'sideways_use_adx': True, 'sideways_use_spike': False, 'sideways_rsi_required': False}.
[I 2025-09-01 09:26:41,770] Trial 127 finished with values: [-0.025216906497349867, 0.02499624282559513] and parameters: {'p_sma': 20, 'p_std': 55, 'p_atr': 30, 'p_adx': 18, 'rsi_period': 20, 'ema1': 19, 'ema2': 17, 'slip_atr_k': 0.07353936396938378, 'slip_spread_k': 0.5444304326164409, 'spread_hl_frac': 0.025859921241663333, 'bb_std_mult': 1.5114408407469533, 'rsi_os': 38, 'rsi_ob': 65, 'vol_spike': 0.021891262573094088, 'adx_thresh': 30.930835782839175, 'atr_min_pct': 0.007730649042217175, 'atr_max_pct': 0.07823886602332206, 'tp_mult': 1.012232425881537, 'tsl_mult': 0.48737587161464563, 'strategy': 'breakout', 'time_stop': 293, 'use_sma': True, 'use_atr': True, 'use_adx': False, 'use_ema': True, 'use_spike': True, 'rsi_required': True, 'edge_k': 1.253507910390975, 'edge_cap': 0.8280996824615177, 'bull_strategy': 'breakout', 'bull_bb_std_mult': 3.032425027364161, 'bull_rsi_os': 45, 'bull_rsi_ob': 79, 'bull_adx_thresh': 8.164966398387861, 'bull_atr_min_pct': 0.000348984829977303, 'bull_atr_max_pct': 0.09128798535659574, 'bull_tp_mult': 1.5354667205343229, 'bull_tsl_mult': 0.9444115369337202, 'bull_time_stop': 59, 'bull_use_sma': True, 'bull_use_ema': False, 'bull_use_atr': True, 'bull_use_adx': True, 'bull_use_spike': False, 'bull_rsi_required': True, 'bear_strategy': 'mean_reversion', 'bear_bb_std_mult': 2.008763640806113, 'bear_rsi_os': 54, 'bear_rsi_ob': 78, 'bear_adx_thresh': 28.826303325171306, 'bear_atr_min_pct': 0.026690691223453897, 'bear_atr_max_pct': 0.0727978590798927, 'bear_tp_mult': 1.4244496612913968, 'bear_tsl_mult': 0.2102901724068162, 'bear_time_stop': 291, 'bear_use_sma': True, 'bear_use_ema': True, 'bear_use_atr': True, 'bear_use_adx': False, 'bear_use_spike': False, 'bear_rsi_required': False, 'sideways_strategy': 'mean_reversion', 'sideways_bb_std_mult': 0.7155667891340889, 'sideways_rsi_os': 28, 'sideways_rsi_ob': 94, 'sideways_adx_thresh': 26.899002043972295, 'sideways_atr_min_pct': 0.019511708574834266, 'sideways_atr_max_pct': 0.07379170902750566, 'sideways_tp_mult': 2.212518503956263, 'sideways_tsl_mult': 0.3591562386817379, 'sideways_time_stop': 22, 'sideways_use_sma': True, 'sideways_use_ema': True, 'sideways_use_atr': False, 'sideways_use_adx': True, 'sideways_use_spike': False, 'sideways_rsi_required': False}.
[I 2025-09-01 09:26:42,403] Trial 128 finished with values: [-0.027209887902926333, 0.026985992964485294] and parameters: {'p_sma': 22, 'p_std': 55, 'p_atr': 30, 'p_adx': 18, 'rsi_period': 20, 'ema1': 19, 'ema2': 16, 'slip_atr_k': 0.08045756480272644, 'slip_spread_k': 0.5585249379599415, 'spread_hl_frac': 0.02940345495418423, 'bb_std_mult': 1.8108190008815779, 'rsi_os': 38, 'rsi_ob': 65, 'vol_spike': 0.02013325027196099, 'adx_thresh': 31.738098971084973, 'atr_min_pct': 0.007906682001479967, 'atr_max_pct': 0.07812923762676614, 'tp_mult': 1.1171967927030289, 'tsl_mult': 0.4906018939717589, 'strategy': 'breakout', 'time_stop': 292, 'use_sma': True, 'use_atr': True, 'use_adx': False, 'use_ema': True, 'use_spike': True, 'rsi_required': True, 'edge_k': 1.2587094286104201, 'edge_cap': 0.845524236395935, 'bull_strategy': 'breakout', 'bull_bb_std_mult': 2.8388414909273196, 'bull_rsi_os': 45, 'bull_rsi_ob': 55, 'bull_adx_thresh': 8.49454716036105, 'bull_atr_min_pct': 0.00019127130734494612, 'bull_atr_max_pct': 0.085236603239196, 'bull_tp_mult': 1.5129601632722065, 'bull_tsl_mult': 0.9407259385248901, 'bull_time_stop': 59, 'bull_use_sma': True, 'bull_use_ema': False, 'bull_use_atr': True, 'bull_use_adx': True, 'bull_use_spike': False, 'bull_rsi_required': True, 'bear_strategy': 'mean_reversion', 'bear_bb_std_mult': 2.0014583100677035, 'bear_rsi_os': 54, 'bear_rsi_ob': 78, 'bear_adx_thresh': 30.185853345695705, 'bear_atr_min_pct': 0.02808047770350525, 'bear_atr_max_pct': 0.07346927332424806, 'bear_tp_mult': 1.4185102072045388, 'bear_tsl_mult': 0.2309303724276601, 'bear_time_stop': 289, 'bear_use_sma': True, 'bear_use_ema': True, 'bear_use_atr': True, 'bear_use_adx': False, 'bear_use_spike': False, 'bear_rsi_required': False, 'sideways_strategy': 'mean_reversion', 'sideways_bb_std_mult': 0.9787357308000701, 'sideways_rsi_os': 29, 'sideways_rsi_ob': 94, 'sideways_adx_thresh': 27.50955843004511, 'sideways_atr_min_pct': 0.019629465274068163, 'sideways_atr_max_pct': 0.07299200476209658, 'sideways_tp_mult': 2.168258064225554, 'sideways_tsl_mult': 0.4152803493533016, 'sideways_time_stop': 22, 'sideways_use_sma': True, 'sideways_use_ema': True, 'sideways_use_atr': False, 'sideways_use_adx': True, 'sideways_use_spike': False, 'sideways_rsi_required': False}.
[I 2025-09-01 09:27:21,580] Trial 133 finished with values: [-0.02698400305840354, 0.026771008397942938] and parameters: {'p_sma': 22, 'p_std': 54, 'p_atr': 30, 'p_adx': 18, 'rsi_period': 22, 'ema1': 19, 'ema2': 15, 'slip_atr_k': 0.047993868804551074, 'slip_spread_k': 0.6357727157513555, 'spread_hl_frac': 0.029561702037800595, 'bb_std_mult': 1.3570324254801414, 'rsi_os': 38, 'rsi_ob': 64, 'vol_spike': 0.023305729743405428, 'adx_thresh': 29.716632884639097, 'atr_min_pct': 0.027017428823714804, 'atr_max_pct': 0.0729084204841286, 'tp_mult': 1.0250111582716146, 'tsl_mult': 0.43803076852723244, 'strategy': 'breakout', 'time_stop': 280, 'use_sma': True, 'use_atr': False, 'use_adx': False, 'use_ema': True, 'use_spike': True, 'rsi_required': True, 'edge_k': 1.2773499501816623, 'edge_cap': 0.8293638424543281, 'bull_strategy': 'breakout', 'bull_bb_std_mult': 3.5335688460545156, 'bull_rsi_os': 46, 'bull_rsi_ob': 49, 'bull_adx_thresh': 6.022279659273904, 'bull_atr_min_pct': 1.1430167628584398e-05, 'bull_atr_max_pct': 0.08846078975141917, 'bull_tp_mult': 1.5181129324999876, 'bull_tsl_mult': 0.9501605307440937, 'bull_time_stop': 226, 'bull_use_sma': True, 'bull_use_ema': False, 'bull_use_atr': True, 'bull_use_adx': False, 'bull_use_spike': False, 'bull_rsi_required': True, 'bear_strategy': 'mean_reversion', 'bear_bb_std_mult': 2.00152735711648, 'bear_rsi_os': 55, 'bear_rsi_ob': 95, 'bear_adx_thresh': 24.09719986330552, 'bear_atr_min_pct': 0.028263469556178648, 'bear_atr_max_pct': 0.07227168805227717, 'bear_tp_mult': 1.6875876952071873, 'bear_tsl_mult': 0.2914464898484317, 'bear_time_stop': 292, 'bear_use_sma': True, 'bear_use_ema': True, 'bear_use_atr': False, 'bear_use_adx': False, 'bear_use_spike': False, 'bear_rsi_required': False, 'sideways_strategy': 'mean_reversion', 'sideways_bb_std_mult': 0.9590277426357656, 'sideways_rsi_os': 52, 'sideways_rsi_ob': 90, 'sideways_adx_thresh': 27.136548080252563, 'sideways_atr_min_pct': 0.02228637220121003, 'sideways_atr_max_pct': 0.07103240727967872, 'sideways_tp_mult': 2.0390550642308867, 'sideways_tsl_mult': 0.42064728925476963, 'sideways_time_stop': 23, 'sideways_use_sma': True, 'sideways_use_ema': False, 'sideways_use_atr': False, 'sideways_use_adx': True, 'sideways_use_spike': False, 'sideways_rsi_required': False}.
[I 2025-09-01 09:27:22,207] Trial 134 finished with values: [-0.024597472890576455, 0.024383980487859957] and parameters: {'p_sma': 20, 'p_std': 55, 'p_atr': 30, 'p_adx': 18, 'rsi_period': 23, 'ema1': 19, 'ema2': 16, 'slip_atr_k': 0.04823357503539492, 'slip_spread_k': 0.6278797065081501, 'spread_hl_frac': 0.02960507023741899, 'bb_std_mult': 1.261595460948425, 'rsi_os': 38, 'rsi_ob': 65, 'vol_spike': 0.02261923850766655, 'adx_thresh': 29.578827240298743, 'atr_min_pct': 0.027494826397116524, 'atr_max_pct': 0.07681229822923667, 'tp_mult': 1.0287485380341492, 'tsl_mult': 0.42920310168435855, 'strategy': 'breakout', 'time_stop': 280, 'use_sma': True, 'use_atr': False, 'use_adx': False, 'use_ema': True, 'use_spike': True, 'rsi_required': True, 'edge_k': 1.2666963250369205, 'edge_cap': 0.8396375094928058, 'bull_strategy': 'breakout', 'bull_bb_std_mult': 3.5259722779382616, 'bull_rsi_os': 46, 'bull_rsi_ob': 48, 'bull_adx_thresh': 5.915819912201972, 'bull_atr_min_pct': 3.159841968777561e-05, 'bull_atr_max_pct': 0.08636157227040532, 'bull_tp_mult': 1.508175352470747, 'bull_tsl_mult': 0.9423833340336737, 'bull_time_stop': 224, 'bull_use_sma': True, 'bull_use_ema': False, 'bull_use_atr': True, 'bull_use_adx': False, 'bull_use_spike': False, 'bull_rsi_required': True, 'bear_strategy': 'mean_reversion', 'bear_bb_std_mult': 1.9928340551472412, 'bear_rsi_os': 55, 'bear_rsi_ob': 95, 'bear_adx_thresh': 23.631947166146528, 'bear_atr_min_pct': 0.02823940347028107, 'bear_atr_max_pct': 0.07216491000516682, 'bear_tp_mult': 2.1982149105198383, 'bear_tsl_mult': 0.3020467144286574, 'bear_time_stop': 293, 'bear_use_sma': True, 'bear_use_ema': True, 'bear_use_atr': False, 'bear_use_adx': False, 'bear_use_spike': False, 'bear_rsi_required': False, 'sideways_strategy': 'mean_reversion', 'sideways_bb_std_mult': 0.9728492240868678, 'sideways_rsi_os': 52, 'sideways_rsi_ob': 90, 'sideways_adx_thresh': 27.000193986332835, 'sideways_atr_min_pct': 0.022242766823999012, 'sideways_atr_max_pct': 0.07466946518989499, 'sideways_tp_mult': 2.0433517849696115, 'sideways_tsl_mult': 0.4174710089173104, 'sideways_time_stop': 24, 'sideways_use_sma': True, 'sideways_use_ema': False, 'sideways_use_atr': False, 'sideways_use_adx': True, 'sideways_use_spike': False, 'sideways_rsi_required': False}.
[I 2025-09-01 09:27:22,236] Trial 131 finished with values: [-0.02650993835823634, 0.026295330326289085] and parameters: {'p_sma': 22, 'p_std': 55, 'p_atr': 30, 'p_adx': 20, 'rsi_period': 23, 'ema1': 19, 'ema2': 17, 'slip_atr_k': 0.0513309555447567, 'slip_spread_k': 0.6387150007678792, 'spread_hl_frac': 0.03000245323064566, 'bb_std_mult': 1.2683196289281065, 'rsi_os': 38, 'rsi_ob': 65, 'vol_spike': 0.023432829505543738, 'adx_thresh': 31.277924553762162, 'atr_min_pct': 0.02566322326232658, 'atr_max_pct': 0.07241326859269395, 'tp_mult': 1.0503498441643155, 'tsl_mult': 0.4933651184192772, 'strategy': 'breakout', 'time_stop': 281, 'use_sma': True, 'use_atr': True, 'use_adx': False, 'use_ema': True, 'use_spike': True, 'rsi_required': True, 'edge_k': 1.151161875878384, 'edge_cap': 0.8261512331620687, 'bull_strategy': 'breakout', 'bull_bb_std_mult': 3.553261141858028, 'bull_rsi_os': 45, 'bull_rsi_ob': 47, 'bull_adx_thresh': 6.208871162383877, 'bull_atr_min_pct': 0.00016447577429607772, 'bull_atr_max_pct': 0.09105200937640683, 'bull_tp_mult': 1.5174556301088646, 'bull_tsl_mult': 0.9413469895042613, 'bull_time_stop': 242, 'bull_use_sma': True, 'bull_use_ema': False, 'bull_use_atr': True, 'bull_use_adx': False, 'bull_use_spike': False, 'bull_rsi_required': True, 'bear_strategy': 'mean_reversion', 'bear_bb_std_mult': 2.010037194338925, 'bear_rsi_os': 55, 'bear_rsi_ob': 95, 'bear_adx_thresh': 23.609164329598997, 'bear_atr_min_pct': 0.027791714981389177, 'bear_atr_max_pct': 0.07125940516690572, 'bear_tp_mult': 1.558012778491799, 'bear_tsl_mult': 0.3002971874451232, 'bear_time_stop': 286, 'bear_use_sma': True, 'bear_use_ema': True, 'bear_use_atr': False, 'bear_use_adx': False, 'bear_use_spike': False, 'bear_rsi_required': False, 'sideways_strategy': 'mean_reversion', 'sideways_bb_std_mult': 0.9533342055563827, 'sideways_rsi_os': 52, 'sideways_rsi_ob': 90, 'sideways_adx_thresh': 24.588116373729104, 'sideways_atr_min_pct': 0.021935632843772302, 'sideways_atr_max_pct': 0.0744712063497572, 'sideways_tp_mult': 2.018019360155015, 'sideways_tsl_mult': 0.41166600899803496, 'sideways_time_stop': 27, 'sideways_use_sma': True, 'sideways_use_ema': False, 'sideways_use_atr': False, 'sideways_use_adx': True, 'sideways_use_spike': False, 'sideways_rsi_required': False}.
[I 2025-09-01 09:27:22,435] Trial 132 finished with values: [-0.024443332642229643, 0.024231072517090536] and parameters: {'p_sma': 20, 'p_std': 55, 'p_atr': 30, 'p_adx': 18, 'rsi_period': 22, 'ema1': 19, 'ema2': 17, 'slip_atr_k': 0.048182130541899425, 'slip_spread_k': 0.6497466579316031, 'spread_hl_frac': 0.025253011624940643, 'bb_std_mult': 1.24201284327136, 'rsi_os': 38, 'rsi_ob': 65, 'vol_spike': 0.021258536639471224, 'adx_thresh': 27.865630614234348, 'atr_min_pct': 0.02766598367113527, 'atr_max_pct': 0.07263682960746361, 'tp_mult': 1.0224643943373846, 'tsl_mult': 0.44715555730462786, 'strategy': 'breakout', 'time_stop': 282, 'use_sma': True, 'use_atr': False, 'use_adx': False, 'use_ema': True, 'use_spike': True, 'rsi_required': True, 'edge_k': 1.2577041481865525, 'edge_cap': 0.8256752016189773, 'bull_strategy': 'breakout', 'bull_bb_std_mult': 3.4131832475543957, 'bull_rsi_os': 46, 'bull_rsi_ob': 49, 'bull_adx_thresh': 5.8822722466931125, 'bull_atr_min_pct': 0.00011898143519615016, 'bull_atr_max_pct': 0.08565601204132721, 'bull_tp_mult': 1.520806443667577, 'bull_tsl_mult': 0.9505487366249759, 'bull_time_stop': 228, 'bull_use_sma': True, 'bull_use_ema': False, 'bull_use_atr': True, 'bull_use_adx': False, 'bull_use_spike': False, 'bull_rsi_required': True, 'bear_strategy': 'mean_reversion', 'bear_bb_std_mult': 2.0112870693120426, 'bear_rsi_os': 54, 'bear_rsi_ob': 95, 'bear_adx_thresh': 24.00097650840657, 'bear_atr_min_pct': 0.0284589641890623, 'bear_atr_max_pct': 0.07188149197846443, 'bear_tp_mult': 2.210074673830862, 'bear_tsl_mult': 0.3018612203420824, 'bear_time_stop': 293, 'bear_use_sma': True, 'bear_use_ema': True, 'bear_use_atr': False, 'bear_use_adx': False, 'bear_use_spike': False, 'bear_rsi_required': False, 'sideways_strategy': 'mean_reversion', 'sideways_bb_std_mult': 0.9525844088882569, 'sideways_rsi_os': 52, 'sideways_rsi_ob': 89, 'sideways_adx_thresh': 26.952077424132398, 'sideways_atr_min_pct': 0.021932096057458425, 'sideways_atr_max_pct': 0.07433539210700323, 'sideways_tp_mult': 2.041822608302345, 'sideways_tsl_mult': 0.4198419211691952, 'sideways_time_stop': 13, 'sideways_use_sma': True, 'sideways_use_ema': False, 'sideways_use_atr': False, 'sideways_use_adx': True, 'sideways_use_spike': False, 'sideways_rsi_required': False}.
