[I 2025-09-01 10:31:17,274] Trial 531 finished with values: [-0.03369555980652206, 0.033542525332950685] and parameters: {'p_sma': 14, 'p_std': 29, 'p_atr': 13, 'p_adx': 19, 'rsi_period': 38, 'ema1': 6, 'ema2': 11, 'slip_atr_k': 0.009011010193529852, 'slip_spread_k': 0.7947317152166578, 'spread_hl_frac': 0.014708827451869435, 'bb_std_mult': 0.9321742179861763, 'rsi_os': 20, 'rsi_ob': 58, 'vol_spike': 0.05651665832489848, 'adx_thresh': 25.198466317146384, 'atr_min_pct': 0.015717262633183387, 'atr_max_pct': 0.0206342118878214, 'tp_mult': 1.4594220322842644, 'tsl_mult': 0.09577361439765786, 'strategy': 'breakout', 'time_stop': 121, 'use_sma': True, 'use_atr': False, 'use_adx': False, 'use_ema': False, 'use_spike': False, 'rsi_required': True, 'edge_k': 1.6030225504769404, 'edge_cap': 0.3887175901013709, 'bull_strategy': 'mean_reversion', 'bull_bb_std_mult': 0.5591629450802438, 'bull_rsi_os': 20, 'bull_rsi_ob': 74, 'bull_adx_thresh': 15.352453972267636, 'bull_atr_min_pct': 0.0009622226423751754, 'bull_atr_max_pct': 0.015351954192920006, 'bull_tp_mult': 1.2397937230971994, 'bull_tsl_mult': 0.6967313285485153, 'bull_time_stop': 258, 'bull_use_sma': True, 'bull_use_ema': False, 'bull_use_atr': False, 'bull_use_adx': True, 'bull_use_spike': True, 'bull_rsi_required': True, 'bear_strategy': 'breakout', 'bear_bb_std_mult': 1.4660048296750916, 'bear_rsi_os': 19, 'bear_rsi_ob': 84, 'bear_adx_thresh': 27.324607164409, 'bear_atr_min_pct': 0.0034110448743735495, 'bear_atr_max_pct': 0.11448037728176388, 'bear_tp_mult': 2.0739871660526674, 'bear_tsl_mult': 0.27027982555376784, 'bear_time_stop': 251, 'bear_use_sma': True, 'bear_use_ema': False, 'bear_use_atr': False, 'bear_use_adx': True, 'bear_use_spike': True, 'bear_rsi_required': False, 'sideways_strategy': 'breakout', 'sideways_bb_std_mult': 0.6226970337402091, 'sideways_rsi_os': 55, 'sideways_rsi_ob': 60, 'sideways_adx_thresh': 28.001624209915928, 'sideways_atr_min_pct': 0.004583593794756343, 'sideways_atr_max_pct': 0.04459999800589001, 'sideways_tp_mult': 2.1920161223537296, 'sideways_tsl_mult': 0.2980591185046613, 'sideways_time_stop': 243, 'sideways_use_sma': False, 'sideways_use_ema': True, 'sideways_use_atr': True, 'sideways_use_adx': False, 'sideways_use_spike': False, 'sideways_rsi_required': True}.
[I 2025-09-01 10:31:18,227] Trial 533 finished with values: [-1000000000.0, 1000000000.0] and parameters: {'p_sma': 11, 'p_std': 23, 'p_atr': 12, 'p_adx': 19, 'rsi_period': 38, 'ema1': 7, 'ema2': 10, 'slip_atr_k': 0.013794832896555453, 'slip_spread_k': 0.7891521586672321, 'spread_hl_frac': 0.013179179975474105, 'bb_std_mult': 1.001874429938887, 'rsi_os': 20, 'rsi_ob': 59, 'vol_spike': 0.06412489731189767, 'adx_thresh': 24.303384684659274, 'atr_min_pct': 0.01559701935783667, 'atr_max_pct': 0.011711719603411733, 'tp_mult': 1.4741752932921095, 'tsl_mult': 0.09158273672983627, 'strategy': 'breakout', 'time_stop': 149, 'use_sma': True, 'use_atr': False, 'use_adx': False, 'use_ema': False, 'use_spike': False, 'rsi_required': True, 'edge_k': 1.5650178025768653, 'edge_cap': 0.34912623594048164, 'bull_strategy': 'breakout', 'bull_bb_std_mult': 0.7035598967347951, 'bull_rsi_os': 18, 'bull_rsi_ob': 79, 'bull_adx_thresh': 13.40514307640154, 'bull_atr_min_pct': 0.0017327355377929976, 'bull_atr_max_pct': 0.017963064193535834, 'bull_tp_mult': 1.2193306006026106, 'bull_tsl_mult': 0.7007643420537385, 'bull_time_stop': 261, 'bull_use_sma': True, 'bull_use_ema': False, 'bull_use_atr': False, 'bull_use_adx': True, 'bull_use_spike': True, 'bull_rsi_required': True, 'bear_strategy': 'breakout', 'bear_bb_std_mult': 1.4795659383189796, 'bear_rsi_os': 19, 'bear_rsi_ob': 84, 'bear_adx_thresh': 26.83493677421421, 'bear_atr_min_pct': 0.002988284188225225, 'bear_atr_max_pct': 0.11464355311954968, 'bear_tp_mult': 2.0879709168976626, 'bear_tsl_mult': 0.2713407920290601, 'bear_time_stop': 259, 'bear_use_sma': True, 'bear_use_ema': True, 'bear_use_atr': False, 'bear_use_adx': True, 'bear_use_spike': True, 'bear_rsi_required': False, 'sideways_strategy': 'breakout', 'sideways_bb_std_mult': 0.5266561836004765, 'sideways_rsi_os': 54, 'sideways_rsi_ob': 73, 'sideways_adx_thresh': 29.68146185972042, 'sideways_atr_min_pct': 0.0066726821089577015, 'sideways_atr_max_pct': 0.05606027877309403, 'sideways_tp_mult': 2.196174714826117, 'sideways_tsl_mult': 0.2937587484086252, 'sideways_time_stop': 236, 'sideways_use_sma': False, 'sideways_use_ema': True, 'sideways_use_atr': True, 'sideways_use_adx': False, 'sideways_use_spike': True, 'sideways_rsi_required': True}.
[I 2025-09-01 10:31:18,244] Trial 532 finished with values: [-1000000000.0, 1000000000.0] and parameters: {'p_sma': 11, 'p_std': 13, 'p_atr': 14, 'p_adx': 19, 'rsi_period': 38, 'ema1': 6, 'ema2': 11, 'slip_atr_k': 0.00850300344301349, 'slip_spread_k': 0.7902713990425076, 'spread_hl_frac': 0.011947084106596449, 'bb_std_mult': 0.9996310645911355, 'rsi_os': 20, 'rsi_ob': 58, 'vol_spike': 0.05509923471828233, 'adx_thresh': 24.668294156449193, 'atr_min_pct': 0.017458988416382975, 'atr_max_pct': 0.01127813561679842, 'tp_mult': 1.4670934571265846, 'tsl_mult': 0.18613261462800945, 'strategy': 'breakout', 'time_stop': 141, 'use_sma': True, 'use_atr': False, 'use_adx': False, 'use_ema': False, 'use_spike': False, 'rsi_required': True, 'edge_k': 1.5682793266700354, 'edge_cap': 0.3561246264753676, 'bull_strategy': 'mean_reversion', 'bull_bb_std_mult': 0.5523207248933878, 'bull_rsi_os': 18, 'bull_rsi_ob': 79, 'bull_adx_thresh': 15.154114625134016, 'bull_atr_min_pct': 0.017022334735880423, 'bull_atr_max_pct': 0.012874916211533003, 'bull_tp_mult': 1.2198936959499382, 'bull_tsl_mult': 0.6758343704896094, 'bull_time_stop': 258, 'bull_use_sma': True, 'bull_use_ema': False, 'bull_use_atr': False, 'bull_use_adx': True, 'bull_use_spike': True, 'bull_rsi_required': True, 'bear_strategy': 'breakout', 'bear_bb_std_mult': 1.551671095697706, 'bear_rsi_os': 19, 'bear_rsi_ob': 84, 'bear_adx_thresh': 26.918461605405174, 'bear_atr_min_pct': 0.0032520824818073864, 'bear_atr_max_pct': 0.1323074395914926, 'bear_tp_mult': 1.6156993759571938, 'bear_tsl_mult': 0.2754261975858807, 'bear_time_stop': 249, 'bear_use_sma': True, 'bear_use_ema': False, 'bear_use_atr': False, 'bear_use_adx': True, 'bear_use_spike': True, 'bear_rsi_required': False, 'sideways_strategy': 'breakout', 'sideways_bb_std_mult': 0.5135769639162776, 'sideways_rsi_os': 55, 'sideways_rsi_ob': 58, 'sideways_adx_thresh': 29.64493310506103, 'sideways_atr_min_pct': 0.006884148848569324, 'sideways_atr_max_pct': 0.056078074461369476, 'sideways_tp_mult': 2.2132471550056163, 'sideways_tsl_mult': 0.3020280479391871, 'sideways_time_stop': 236, 'sideways_use_sma': False, 'sideways_use_ema': True, 'sideways_use_atr': True, 'sideways_use_adx': False, 'sideways_use_spike': False, 'sideways_rsi_required': True}.
[I 2025-09-01 10:31:18,272] Trial 535 finished with values: [-1000000000.0, 1000000000.0] and parameters: {'p_sma': 12, 'p_std': 22, 'p_atr': 12, 'p_adx': 22, 'rsi_period': 46, 'ema1': 7, 'ema2': 10, 'slip_atr_k': 0.014511012556935921, 'slip_spread_k': 0.8095223059724226, 'spread_hl_frac': 0.013344061499682307, 'bb_std_mult': 0.8604165718104932, 'rsi_os': 15, 'rsi_ob': 59, 'vol_spike': 0.048878298446457115, 'adx_thresh': 22.480994947706197, 'atr_min_pct': 0.017345681271745378, 'atr_max_pct': 0.011185107582296613, 'tp_mult': 1.4745763569917376, 'tsl_mult': 0.11943054258859732, 'strategy': 'breakout', 'time_stop': 141, 'use_sma': True, 'use_atr': False, 'use_adx': False, 'use_ema': False, 'use_spike': False, 'rsi_required': True, 'edge_k': 1.6502869693179334, 'edge_cap': 0.4855103886980947, 'bull_strategy': 'breakout', 'bull_bb_std_mult': 0.6841009935328517, 'bull_rsi_os': 18, 'bull_rsi_ob': 74, 'bull_adx_thresh': 15.639349344384932, 'bull_atr_min_pct': 0.027530654919194354, 'bull_atr_max_pct': 0.018632196511759923, 'bull_tp_mult': 1.1611029110808369, 'bull_tsl_mult': 0.6723819396131204, 'bull_time_stop': 261, 'bull_use_sma': False, 'bull_use_ema': False, 'bull_use_atr': False, 'bull_use_adx': True, 'bull_use_spike': True, 'bull_rsi_required': True, 'bear_strategy': 'breakout', 'bear_bb_std_mult': 1.770070560764101, 'bear_rsi_os': 18, 'bear_rsi_ob': 84, 'bear_adx_thresh': 26.724322327659056, 'bear_atr_min_pct': 0.002028653333518418, 'bear_atr_max_pct': 0.13770427164757518, 'bear_tp_mult': 1.7020859480293975, 'bear_tsl_mult': 0.36095285706653, 'bear_time_stop': 260, 'bear_use_sma': False, 'bear_use_ema': True, 'bear_use_atr': False, 'bear_use_adx': True, 'bear_use_spike': True, 'bear_rsi_required': True, 'sideways_strategy': 'breakout', 'sideways_bb_std_mult': 0.5484276223126487, 'sideways_rsi_os': 54, 'sideways_rsi_ob': 72, 'sideways_adx_thresh': 29.849127041450952, 'sideways_atr_min_pct': 0.006681596545085352, 'sideways_atr_max_pct': 0.05596343389629109, 'sideways_tp_mult': 1.9455821487375977, 'sideways_tsl_mult': 0.3224426715764064, 'sideways_time_stop': 236, 'sideways_use_sma': False, 'sideways_use_ema': True, 'sideways_use_atr': True, 'sideways_use_adx': False, 'sideways_use_spike': True, 'sideways_rsi_required': True}.
[I 2025-09-01 10:31:18,275] Trial 534 finished with values: [-1000000000.0, 1000000000.0] and parameters: {'p_sma': 14, 'p_std': 34, 'p_atr': 14, 'p_adx': 20, 'rsi_period': 38, 'ema1': 6, 'ema2': 10, 'slip_atr_k': 0.007867786413160414, 'slip_spread_k': 0.788170895612309, 'spread_hl_frac': 0.012901786218034334, 'bb_std_mult': 0.8772210356422527, 'rsi_os': 19, 'rsi_ob': 59, 'vol_spike': 0.06600285926826933, 'adx_thresh': 22.26817263941044, 'atr_min_pct': 0.015623073779931376, 'atr_max_pct': 0.01187205780820381, 'tp_mult': 1.4619776217793745, 'tsl_mult': 0.11278053082990197, 'strategy': 'breakout', 'time_stop': 125, 'use_sma': True, 'use_atr': False, 'use_adx': False, 'use_ema': False, 'use_spike': False, 'rsi_required': True, 'edge_k': 1.6372452702420515, 'edge_cap': 0.47967960152360556, 'bull_strategy': 'breakout', 'bull_bb_std_mult': 0.6746086330944607, 'bull_rsi_os': 18, 'bull_rsi_ob': 79, 'bull_adx_thresh': 16.387225630032564, 'bull_atr_min_pct': 0.0007819117119463195, 'bull_atr_max_pct': 0.0183310904546361, 'bull_tp_mult': 1.1686688707326969, 'bull_tsl_mult': 0.6136494832726147, 'bull_time_stop': 259, 'bull_use_sma': False, 'bull_use_ema': False, 'bull_use_atr': False, 'bull_use_adx': True, 'bull_use_spike': True, 'bull_rsi_required': True, 'bear_strategy': 'breakout', 'bear_bb_std_mult': 1.4597511762490754, 'bear_rsi_os': 18, 'bear_rsi_ob': 84, 'bear_adx_thresh': 26.640828950432027, 'bear_atr_min_pct': 0.0019758079394867597, 'bear_atr_max_pct': 0.13249510288094601, 'bear_tp_mult': 1.605346716198974, 'bear_tsl_mult': 0.26748162399090214, 'bear_time_stop': 260, 'bear_use_sma': True, 'bear_use_ema': True, 'bear_use_atr': False, 'bear_use_adx': True, 'bear_use_spike': True, 'bear_rsi_required': True, 'sideways_strategy': 'breakout', 'sideways_bb_std_mult': 0.5512877091010583, 'sideways_rsi_os': 55, 'sideways_rsi_ob': 72, 'sideways_adx_thresh': 29.905122399555403, 'sideways_atr_min_pct': 0.006813232443123187, 'sideways_atr_max_pct': 0.05530378986281811, 'sideways_tp_mult': 2.1824276764273183, 'sideways_tsl_mult': 0.2776077470167627, 'sideways_time_stop': 236, 'sideways_use_sma': False, 'sideways_use_ema': True, 'sideways_use_atr': True, 'sideways_use_adx': False, 'sideways_use_spike': True, 'sideways_rsi_required': True}.
[I 2025-09-01 10:31:19,464] Trial 537 finished with values: [-1000000000.0, 1000000000.0] and parameters: {'p_sma': 12, 'p_std': 34, 'p_atr': 14, 'p_adx': 22, 'rsi_period': 46, 'ema1': 7, 'ema2': 10, 'slip_atr_k': 0.01429877011653169, 'slip_spread_k': 0.8346483744367225, 'spread_hl_frac': 0.013294218042304769, 'bb_std_mult': 0.8716728091929566, 'rsi_os': 16, 'rsi_ob': 60, 'vol_spike': 0.044341992628404485, 'adx_thresh': 22.147154243991466, 'atr_min_pct': 0.01636987486596593, 'atr_max_pct': 0.01445146919189727, 'tp_mult': 1.5243468951717691, 'tsl_mult': 0.1586747730885566, 'strategy': 'breakout', 'time_stop': 124, 'use_sma': True, 'use_atr': False, 'use_adx': False, 'use_ema': False, 'use_spike': False, 'rsi_required': True, 'edge_k': 1.6406832866404968, 'edge_cap': 0.47975748180113303, 'bull_strategy': 'breakout', 'bull_bb_std_mult': 0.5042591430081584, 'bull_rsi_os': 15, 'bull_rsi_ob': 74, 'bull_adx_thresh': 16.08302871380613, 'bull_atr_min_pct': 0.027261826535177835, 'bull_atr_max_pct': 0.010103168037274455, 'bull_tp_mult': 1.1821634984261515, 'bull_tsl_mult': 0.6075706858915533, 'bull_time_stop': 274, 'bull_use_sma': False, 'bull_use_ema': False, 'bull_use_atr': False, 'bull_use_adx': True, 'bull_use_spike': True, 'bull_rsi_required': True, 'bear_strategy': 'breakout', 'bear_bb_std_mult': 1.7516960447569345, 'bear_rsi_os': 18, 'bear_rsi_ob': 83, 'bear_adx_thresh': 26.337645873734008, 'bear_atr_min_pct': 0.0004984616891101148, 'bear_atr_max_pct': 0.13484425190671293, 'bear_tp_mult': 1.6768511425494126, 'bear_tsl_mult': 0.3612301201331738, 'bear_time_stop': 259, 'bear_use_sma': False, 'bear_use_ema': True, 'bear_use_atr': False, 'bear_use_adx': True, 'bear_use_spike': True, 'bear_rsi_required': True, 'sideways_strategy': 'breakout', 'sideways_bb_std_mult': 0.6666232890850992, 'sideways_rsi_os': 54, 'sideways_rsi_ob': 71, 'sideways_adx_thresh': 28.85432351148967, 'sideways_atr_min_pct': 0.005683012492408259, 'sideways_atr_max_pct': 0.049605304564554455, 'sideways_tp_mult': 2.102035641438591, 'sideways_tsl_mult': 0.2724236194128351, 'sideways_time_stop': 252, 'sideways_use_sma': False, 'sideways_use_ema': True, 'sideways_use_atr': True, 'sideways_use_adx': False, 'sideways_use_spike': True, 'sideways_rsi_required': True}.
[I 2025-09-01 10:31:19,467] Trial 536 finished with values: [-1000000000.0, 1000000000.0] and parameters: {'p_sma': 13, 'p_std': 57, 'p_atr': 14, 'p_adx': 22, 'rsi_period': 46, 'ema1': 5, 'ema2': 10, 'slip_atr_k': 0.007850030592766705, 'slip_spread_k': 0.8191769552716149, 'spread_hl_frac': 0.015709434474576848, 'bb_std_mult': 0.8580908716392595, 'rsi_os': 16, 'rsi_ob': 60, 'vol_spike': 0.04738081717116725, 'adx_thresh': 22.827717539036495, 'atr_min_pct': 0.016237340105523898, 'atr_max_pct': 0.011258324913712908, 'tp_mult': 1.5289246898273317, 'tsl_mult': 0.11380625718496998, 'strategy': 'breakout', 'time_stop': 126, 'use_sma': True, 'use_atr': False, 'use_adx': False, 'use_ema': False, 'use_spike': False, 'rsi_required': True, 'edge_k': 1.639518758262525, 'edge_cap': 0.19257591972870236, 'bull_strategy': 'mean_reversion', 'bull_bb_std_mult': 0.5034769557159677, 'bull_rsi_os': 17, 'bull_rsi_ob': 74, 'bull_adx_thresh': 16.63406616074937, 'bull_atr_min_pct': 0.007371133312722174, 'bull_atr_max_pct': 0.011768692321457903, 'bull_tp_mult': 1.1709782847288932, 'bull_tsl_mult': 0.8021741620087564, 'bull_time_stop': 273, 'bull_use_sma': False, 'bull_use_ema': False, 'bull_use_atr': False, 'bull_use_adx': True, 'bull_use_spike': True, 'bull_rsi_required': True, 'bear_strategy': 'breakout', 'bear_bb_std_mult': 1.877051032621396, 'bear_rsi_os': 18, 'bear_rsi_ob': 83, 'bear_adx_thresh': 26.565816860814365, 'bear_atr_min_pct': 0.0020349826362986894, 'bear_atr_max_pct': 0.10460676459748187, 'bear_tp_mult': 1.7239684455181241, 'bear_tsl_mult': 0.3635197460489386, 'bear_time_stop': 258, 'bear_use_sma': False, 'bear_use_ema': False, 'bear_use_atr': False, 'bear_use_adx': True, 'bear_use_spike': True, 'bear_rsi_required': True, 'sideways_strategy': 'breakout', 'sideways_bb_std_mult': 0.6723091564138235, 'sideways_rsi_os': 55, 'sideways_rsi_ob': 71, 'sideways_adx_thresh': 29.752423893659167, 'sideways_atr_min_pct': 0.006894341713366846, 'sideways_atr_max_pct': 0.05397405846317306, 'sideways_tp_mult': 1.9354880371378809, 'sideways_tsl_mult': 0.2674160197985126, 'sideways_time_stop': 220, 'sideways_use_sma': False, 'sideways_use_ema': True, 'sideways_use_atr': True, 'sideways_use_adx': False, 'sideways_use_spike': False, 'sideways_rsi_required': True}.
[I 2025-09-01 10:32:02,727] Trial 538 finished with values: [-1000000000.0, 1000000000.0] and parameters: {'p_sma': 13, 'p_std': 33, 'p_atr': 14, 'p_adx': 20, 'rsi_period': 40, 'ema1': 8, 'ema2': 10, 'slip_atr_k': 0.007873299064570426, 'slip_spread_k': 0.8260894452764782, 'spread_hl_frac': 0.015884375781653543, 'bb_std_mult': 1.1039318098351947, 'rsi_os': 16, 'rsi_ob': 60, 'vol_spike': 0.06738055579402129, 'adx_thresh': 23.13404066344268, 'atr_min_pct': 0.01626679475296337, 'atr_max_pct': 0.023126642220262623, 'tp_mult': 1.5466003515780484, 'tsl_mult': 0.1581144284630256, 'strategy': 'breakout', 'time_stop': 123, 'use_sma': True, 'use_atr': False, 'use_adx': False, 'use_ema': False, 'use_spike': False, 'rsi_required': True, 'edge_k': 1.6476986877473445, 'edge_cap': 0.17020941154708918, 'bull_strategy': 'mean_reversion', 'bull_bb_std_mult': 0.5100902442942823, 'bull_rsi_os': 15, 'bull_rsi_ob': 75, 'bull_adx_thresh': 16.14459582415011, 'bull_atr_min_pct': 0.00592135484973247, 'bull_atr_max_pct': 0.023782521144860583, 'bull_tp_mult': 1.1030939064439798, 'bull_tsl_mult': 0.6135030190258418, 'bull_time_stop': 274, 'bull_use_sma': False, 'bull_use_ema': False, 'bull_use_atr': False, 'bull_use_adx': True, 'bull_use_spike': True, 'bull_rsi_required': True, 'bear_strategy': 'breakout', 'bear_bb_std_mult': 1.8862449331061293, 'bear_rsi_os': 17, 'bear_rsi_ob': 85, 'bear_adx_thresh': 25.844985594787794, 'bear_atr_min_pct': 0.0004559097984673374, 'bear_atr_max_pct': 0.10406582895226726, 'bear_tp_mult': 1.521456090259639, 'bear_tsl_mult': 0.33657696601572096, 'bear_time_stop': 266, 'bear_use_sma': True, 'bear_use_ema': False, 'bear_use_atr': False, 'bear_use_adx': True, 'bear_use_spike': True, 'bear_rsi_required': True, 'sideways_strategy': 'breakout', 'sideways_bb_std_mult': 0.6711442680837549, 'sideways_rsi_os': 42, 'sideways_rsi_ob': 56, 'sideways_adx_thresh': 28.88589429854736, 'sideways_atr_min_pct': 0.00581857685476132, 'sideways_atr_max_pct': 0.05218910719179627, 'sideways_tp_mult': 2.1143609012814246, 'sideways_tsl_mult': 0.27021762468004396, 'sideways_time_stop': 243, 'sideways_use_sma': False, 'sideways_use_ema': True, 'sideways_use_atr': True, 'sideways_use_adx': False, 'sideways_use_spike': False, 'sideways_rsi_required': True}.
[I 2025-09-01 10:32:04,198] Trial 541 finished with values: [-1000000000.0, 1000000000.0] and parameters: {'p_sma': 14, 'p_std': 33, 'p_atr': 13, 'p_adx': 17, 'rsi_period': 40, 'ema1': 8, 'ema2': 12, 'slip_atr_k': 0.02750296573108861, 'slip_spread_k': 0.8645687836023724, 'spread_hl_frac': 0.010759353382925772, 'bb_std_mult': 1.0647603708781872, 'rsi_os': 18, 'rsi_ob': 61, 'vol_spike': 0.07028286544883743, 'adx_thresh': 23.300740635736556, 'atr_min_pct': 0.016821397956401078, 'atr_max_pct': 0.0229208094652043, 'tp_mult': 1.4184380621492663, 'tsl_mult': 0.17305243021743608, 'strategy': 'mean_reversion', 'time_stop': 132, 'use_sma': False, 'use_atr': True, 'use_adx': True, 'use_ema': False, 'use_spike': False, 'rsi_required': False, 'edge_k': 1.5350218652499639, 'edge_cap': 0.44998617370582666, 'bull_strategy': 'mean_reversion', 'bull_bb_std_mult': 0.6159147970928788, 'bull_rsi_os': 16, 'bull_rsi_ob': 75, 'bull_adx_thresh': 13.40296618667254, 'bull_atr_min_pct': 0.001133384683596577, 'bull_atr_max_pct': 0.016140864699635955, 'bull_tp_mult': 1.0153153237642019, 'bull_tsl_mult': 0.6367624030095537, 'bull_time_stop': 284, 'bull_use_sma': True, 'bull_use_ema': True, 'bull_use_atr': False, 'bull_use_adx': True, 'bull_use_spike': True, 'bull_rsi_required': False, 'bear_strategy': 'breakout', 'bear_bb_std_mult': 1.3814038991306583, 'bear_rsi_os': 21, 'bear_rsi_ob': 87, 'bear_adx_thresh': 25.861200341922487, 'bear_atr_min_pct': 0.0027935672805812686, 'bear_atr_max_pct': 0.12300615317939059, 'bear_tp_mult': 1.5065178367841383, 'bear_tsl_mult': 0.33326218775457, 'bear_time_stop': 268, 'bear_use_sma': True, 'bear_use_ema': False, 'bear_use_atr': False, 'bear_use_adx': True, 'bear_use_spike': True, 'bear_rsi_required': False, 'sideways_strategy': 'breakout', 'sideways_bb_std_mult': 0.5988031319515188, 'sideways_rsi_os': 26, 'sideways_rsi_ob': 57, 'sideways_adx_thresh': 30.945714684914982, 'sideways_atr_min_pct': 0.006173427427418724, 'sideways_atr_max_pct': 0.0585597817971069, 'sideways_tp_mult': 2.104883748251722, 'sideways_tsl_mult': 0.23484166153665326, 'sideways_time_stop': 243, 'sideways_use_sma': False, 'sideways_use_ema': True, 'sideways_use_atr': True, 'sideways_use_adx': False, 'sideways_use_spike': False, 'sideways_rsi_required': True}.
