[I 2025-09-01 10:05:22,640] Trial 359 finished with values: [-0.0425135896328116, 0.041916911060733676] and parameters: {'p_sma': 19, 'p_std': 33, 'p_atr': 18, 'p_adx': 26, 'rsi_period': 20, 'ema1': 20, 'ema2': 44, 'slip_atr_k': 0.04358070948892523, 'slip_spread_k': 0.042021226480134566, 'spread_hl_frac': 0.029716893935316905, 'bb_std_mult': 1.6610532635869646, 'rsi_os': 41, 'rsi_ob': 71, 'vol_spike': 0.19753680007672814, 'adx_thresh': 31.68619489261221, 'atr_min_pct': 0.006485826767043465, 'atr_max_pct': 0.11874936665160052, 'tp_mult': 2.5648652263251166, 'tsl_mult': 0.5195015007846426, 'strategy': 'mean_reversion', 'time_stop': 260, 'use_sma': False, 'use_atr': False, 'use_adx': False, 'use_ema': False, 'use_spike': False, 'rsi_required': True, 'edge_k': 0.36568330348437117, 'edge_cap': 0.5540600171130385, 'bull_strategy': 'mean_reversion', 'bull_bb_std_mult': 3.2392249221187184, 'bull_rsi_os': 48, 'bull_rsi_ob': 53, 'bull_adx_thresh': 6.698605895994753, 'bull_atr_min_pct': 0.011889222234305724, 'bull_atr_max_pct': 0.08440248092634084, 'bull_tp_mult': 2.877648001805792, 'bull_tsl_mult': 0.3266378919334382, 'bull_time_stop': 41, 'bull_use_sma': True, 'bull_use_ema': True, 'bull_use_atr': False, 'bull_use_adx': True, 'bull_use_spike': False, 'bull_rsi_required': True, 'bear_strategy': 'breakout', 'bear_bb_std_mult': 1.5575289913395338, 'bear_rsi_os': 53, 'bear_rsi_ob': 77, 'bear_adx_thresh': 7.112711192199264, 'bear_atr_min_pct': 0.0031655891429402446, 'bear_atr_max_pct': 0.06919902529755163, 'bear_tp_mult': 1.2457460626343968, 'bear_tsl_mult': 0.36011820885829404, 'bear_time_stop': 218, 'bear_use_sma': True, 'bear_use_ema': False, 'bear_use_atr': False, 'bear_use_adx': False, 'bear_use_spike': False, 'bear_rsi_required': False, 'sideways_strategy': 'mean_reversion', 'sideways_bb_std_mult': 3.5319979021682975, 'sideways_rsi_os': 22, 'sideways_rsi_ob': 59, 'sideways_adx_thresh': 22.856319065471375, 'sideways_atr_min_pct': 0.00271276880902987, 'sideways_atr_max_pct': 0.06570622340259728, 'sideways_tp_mult': 2.4048157141509203, 'sideways_tsl_mult': 0.9072154431310551, 'sideways_time_stop': 87, 'sideways_use_sma': False, 'sideways_use_ema': True, 'sideways_use_atr': False, 'sideways_use_adx': True, 'sideways_use_spike': False, 'sideways_rsi_required': True}.
[I 2025-09-01 10:05:23,128] Trial 361 finished with values: [-0.06151943469149734, 0.061225376829846065] and parameters: {'p_sma': 18, 'p_std': 21, 'p_atr': 28, 'p_adx': 7, 'rsi_period': 13, 'ema1': 20, 'ema2': 33, 'slip_atr_k': 0.04324276887990188, 'slip_spread_k': 0.712968684139127, 'spread_hl_frac': 0.031127534693128695, 'bb_std_mult': 1.7015334419505084, 'rsi_os': 41, 'rsi_ob': 57, 'vol_spike': 0.17543619398101473, 'adx_thresh': 31.92376041723025, 'atr_min_pct': 0.008014412704898565, 'atr_max_pct': 0.1301157543789271, 'tp_mult': 1.1058718462078894, 'tsl_mult': 0.6997227291904463, 'strategy': 'mean_reversion', 'time_stop': 243, 'use_sma': False, 'use_atr': False, 'use_adx': False, 'use_ema': False, 'use_spike': False, 'rsi_required': True, 'edge_k': 1.61332956610178, 'edge_cap': 0.5475628598067084, 'bull_strategy': 'breakout', 'bull_bb_std_mult': 3.4398418315714143, 'bull_rsi_os': 6, 'bull_rsi_ob': 74, 'bull_adx_thresh': 6.859824995926825, 'bull_atr_min_pct': 0.002381400340706814, 'bull_atr_max_pct': 0.08481240738248921, 'bull_tp_mult': 2.9979285069412183, 'bull_tsl_mult': 0.37493332662266415, 'bull_time_stop': 277, 'bull_use_sma': True, 'bull_use_ema': True, 'bull_use_atr': True, 'bull_use_adx': False, 'bull_use_spike': False, 'bull_rsi_required': True, 'bear_strategy': 'breakout', 'bear_bb_std_mult': 0.8615163756189139, 'bear_rsi_os': 53, 'bear_rsi_ob': 74, 'bear_adx_thresh': 23.863784865717413, 'bear_atr_min_pct': 0.0029299342350704582, 'bear_atr_max_pct': 0.018140712051875132, 'bear_tp_mult': 1.233307119845966, 'bear_tsl_mult': 0.26614568301760255, 'bear_time_stop': 285, 'bear_use_sma': True, 'bear_use_ema': True, 'bear_use_atr': True, 'bear_use_adx': False, 'bear_use_spike': False, 'bear_rsi_required': False, 'sideways_strategy': 'mean_reversion', 'sideways_bb_std_mult': 3.540688923679357, 'sideways_rsi_os': 49, 'sideways_rsi_ob': 59, 'sideways_adx_thresh': 19.460775186212377, 'sideways_atr_min_pct': 0.00907406364133292, 'sideways_atr_max_pct': 0.14367534888380226, 'sideways_tp_mult': 2.461795996815557, 'sideways_tsl_mult': 0.43056872487180026, 'sideways_time_stop': 85, 'sideways_use_sma': True, 'sideways_use_ema': True, 'sideways_use_atr': False, 'sideways_use_adx': True, 'sideways_use_spike': False, 'sideways_rsi_required': True}.
[I 2025-09-01 10:05:23,743] Trial 360 finished with values: [-1000000000.0, 1000000000.0] and parameters: {'p_sma': 49, 'p_std': 28, 'p_atr': 28, 'p_adx': 26, 'rsi_period': 47, 'ema1': 20, 'ema2': 50, 'slip_atr_k': 0.15841658774251502, 'slip_spread_k': 0.7151091583140767, 'spread_hl_frac': 0.04138852184646313, 'bb_std_mult': 1.380912438692822, 'rsi_os': 41, 'rsi_ob': 57, 'vol_spike': 0.17691933972653054, 'adx_thresh': 34.12422294498322, 'atr_min_pct': 0.010337708291767795, 'atr_max_pct': 0.14310344314523293, 'tp_mult': 2.5656529356293767, 'tsl_mult': 0.21465524688181176, 'strategy': 'mean_reversion', 'time_stop': 244, 'use_sma': False, 'use_atr': False, 'use_adx': False, 'use_ema': False, 'use_spike': False, 'rsi_required': True, 'edge_k': 1.6237457102370667, 'edge_cap': 0.5486381494040674, 'bull_strategy': 'mean_reversion', 'bull_bb_std_mult': 2.0797740053021, 'bull_rsi_os': 6, 'bull_rsi_ob': 87, 'bull_adx_thresh': 6.918011343017534, 'bull_atr_min_pct': 0.001454792808378149, 'bull_atr_max_pct': 0.0893217036871882, 'bull_tp_mult': 1.2857726828858373, 'bull_tsl_mult': 0.3616955057587452, 'bull_time_stop': 181, 'bull_use_sma': True, 'bull_use_ema': True, 'bull_use_atr': False, 'bull_use_adx': True, 'bull_use_spike': False, 'bull_rsi_required': True, 'bear_strategy': 'breakout', 'bear_bb_std_mult': 0.9037144829572106, 'bear_rsi_os': 41, 'bear_rsi_ob': 81, 'bear_adx_thresh': 6.923774622253889, 'bear_atr_min_pct': 0.021342472387055052, 'bear_atr_max_pct': 0.11426251410585488, 'bear_tp_mult': 1.2303512105819194, 'bear_tsl_mult': 0.6542806117445019, 'bear_time_stop': 287, 'bear_use_sma': True, 'bear_use_ema': False, 'bear_use_atr': False, 'bear_use_adx': False, 'bear_use_spike': False, 'bear_rsi_required': False, 'sideways_strategy': 'mean_reversion', 'sideways_bb_std_mult': 1.097634957246962, 'sideways_rsi_os': 49, 'sideways_rsi_ob': 91, 'sideways_adx_thresh': 34.75582408377274, 'sideways_atr_min_pct': 0.028948008768595733, 'sideways_atr_max_pct': 0.1312067395705054, 'sideways_tp_mult': 2.38189256549148, 'sideways_tsl_mult': 0.34887508039919446, 'sideways_time_stop': 21, 'sideways_use_sma': False, 'sideways_use_ema': True, 'sideways_use_atr': False, 'sideways_use_adx': True, 'sideways_use_spike': False, 'sideways_rsi_required': True}.
[I 2025-09-01 10:06:01,652] Trial 365 finished with values: [-1000000000.0, 1000000000.0] and parameters: {'p_sma': 12, 'p_std': 50, 'p_atr': 17, 'p_adx': 30, 'rsi_period': 23, 'ema1': 17, 'ema2': 51, 'slip_atr_k': 0.007778104128957131, 'slip_spread_k': 0.5779688104578031, 'spread_hl_frac': 0.02880967266754509, 'bb_std_mult': 1.0849817640925414, 'rsi_os': 39, 'rsi_ob': 47, 'vol_spike': 0.16774268099365214, 'adx_thresh': 30.994512843048337, 'atr_min_pct': 0.013521924111811634, 'atr_max_pct': 0.08397211703098066, 'tp_mult': 2.737231649088355, 'tsl_mult': 0.6503987506452843, 'strategy': 'breakout', 'time_stop': 44, 'use_sma': True, 'use_atr': False, 'use_adx': False, 'use_ema': True, 'use_spike': True, 'rsi_required': True, 'edge_k': 1.013558984099015, 'edge_cap': 0.9369969435398876, 'bull_strategy': 'mean_reversion', 'bull_bb_std_mult': 3.5980375525507973, 'bull_rsi_os': 52, 'bull_rsi_ob': 45, 'bull_adx_thresh': 24.78014089277109, 'bull_atr_min_pct': 0.0015901049527338156, 'bull_atr_max_pct': 0.04973751068860127, 'bull_tp_mult': 2.6307118650011856, 'bull_tsl_mult': 0.3076576199662241, 'bull_time_stop': 213, 'bull_use_sma': True, 'bull_use_ema': False, 'bull_use_atr': True, 'bull_use_adx': False, 'bull_use_spike': False, 'bull_rsi_required': True, 'bear_strategy': 'mean_reversion', 'bear_bb_std_mult': 0.9279727216762638, 'bear_rsi_os': 16, 'bear_rsi_ob': 81, 'bear_adx_thresh': 20.830262819564364, 'bear_atr_min_pct': 0.007987897650427216, 'bear_atr_max_pct': 0.1291689786317201, 'bear_tp_mult': 2.7121202337236348, 'bear_tsl_mult': 0.44739997357056194, 'bear_time_stop': 297, 'bear_use_sma': True, 'bear_use_ema': False, 'bear_use_atr': True, 'bear_use_adx': False, 'bear_use_spike': False, 'bear_rsi_required': False, 'sideways_strategy': 'mean_reversion', 'sideways_bb_std_mult': 1.1033162847701141, 'sideways_rsi_os': 51, 'sideways_rsi_ob': 91, 'sideways_adx_thresh': 15.108286136250221, 'sideways_atr_min_pct': 0.012778030785556452, 'sideways_atr_max_pct': 0.11066723950849525, 'sideways_tp_mult': 2.5215059334068934, 'sideways_tsl_mult': 0.4506419042735797, 'sideways_time_stop': 200, 'sideways_use_sma': True, 'sideways_use_ema': False, 'sideways_use_atr': False, 'sideways_use_adx': True, 'sideways_use_spike': False, 'sideways_rsi_required': False}.
[I 2025-09-01 10:06:02,069] Trial 363 finished with values: [-1000000000.0, 1000000000.0] and parameters: {'p_sma': 18, 'p_std': 60, 'p_atr': 28, 'p_adx': 26, 'rsi_period': 23, 'ema1': 30, 'ema2': 14, 'slip_atr_k': 0.052887068341099804, 'slip_spread_k': 0.6362585459466343, 'spread_hl_frac': 0.029505709904130935, 'bb_std_mult': 1.6697561298140506, 'rsi_os': 42, 'rsi_ob': 90, 'vol_spike': 0.17043148570331135, 'adx_thresh': 32.020276742883595, 'atr_min_pct': 0.002127970292956723, 'atr_max_pct': 0.143902564660732, 'tp_mult': 1.8214715089265583, 'tsl_mult': 0.696652324127271, 'strategy': 'mean_reversion', 'time_stop': 241, 'use_sma': False, 'use_atr': False, 'use_adx': False, 'use_ema': True, 'use_spike': False, 'rsi_required': True, 'edge_k': 1.8889709668608312, 'edge_cap': 0.941788690081615, 'bull_strategy': 'mean_reversion', 'bull_bb_std_mult': 1.2641330084965168, 'bull_rsi_os': 48, 'bull_rsi_ob': 49, 'bull_adx_thresh': 20.750484513489162, 'bull_atr_min_pct': 0.0023585439183949806, 'bull_atr_max_pct': 0.08724329434505403, 'bull_tp_mult': 2.9968404496470646, 'bull_tsl_mult': 0.3922157430757721, 'bull_time_stop': 277, 'bull_use_sma': True, 'bull_use_ema': True, 'bull_use_atr': True, 'bull_use_adx': False, 'bull_use_spike': False, 'bull_rsi_required': True, 'bear_strategy': 'mean_reversion', 'bear_bb_std_mult': 0.9126195153768513, 'bear_rsi_os': 49, 'bear_rsi_ob': 81, 'bear_adx_thresh': 20.818894482085433, 'bear_atr_min_pct': 0.006881589360539519, 'bear_atr_max_pct': 0.08952261215505147, 'bear_tp_mult': 1.2321484473428606, 'bear_tsl_mult': 0.6533891691946639, 'bear_time_stop': 300, 'bear_use_sma': True, 'bear_use_ema': False, 'bear_use_atr': True, 'bear_use_adx': False, 'bear_use_spike': False, 'bear_rsi_required': False, 'sideways_strategy': 'mean_reversion', 'sideways_bb_std_mult': 0.6952012744508825, 'sideways_rsi_os': 49, 'sideways_rsi_ob': 91, 'sideways_adx_thresh': 22.8139195127844, 'sideways_atr_min_pct': 0.009031465151382685, 'sideways_atr_max_pct': 0.11588565703069398, 'sideways_tp_mult': 2.465253310453408, 'sideways_tsl_mult': 0.4456085748390971, 'sideways_time_stop': 199, 'sideways_use_sma': True, 'sideways_use_ema': False, 'sideways_use_atr': False, 'sideways_use_adx': True, 'sideways_use_spike': False, 'sideways_rsi_required': True}.
[I 2025-09-01 10:06:02,365] Trial 364 finished with values: [-1000000000.0, 1000000000.0] and parameters: {'p_sma': 13, 'p_std': 27, 'p_atr': 28, 'p_adx': 16, 'rsi_period': 23, 'ema1': 30, 'ema2': 24, 'slip_atr_k': 0.24491897837441112, 'slip_spread_k': 0.5795848256306547, 'spread_hl_frac': 0.03666016461920924, 'bb_std_mult': 1.0826908754250906, 'rsi_os': 9, 'rsi_ob': 67, 'vol_spike': 0.2646482423308231, 'adx_thresh': 10.843133879987418, 'atr_min_pct': 0.008305150293005577, 'atr_max_pct': 0.12391758236909754, 'tp_mult': 2.1226575752476746, 'tsl_mult': 0.13330425862218076, 'strategy': 'breakout', 'time_stop': 244, 'use_sma': True, 'use_atr': False, 'use_adx': False, 'use_ema': True, 'use_spike': True, 'rsi_required': True, 'edge_k': 1.2713659022811994, 'edge_cap': 0.7472910056022954, 'bull_strategy': 'breakout', 'bull_bb_std_mult': 2.514581529351647, 'bull_rsi_os': 43, 'bull_rsi_ob': 65, 'bull_adx_thresh': 23.232419278824104, 'bull_atr_min_pct': 0.002418530194895948, 'bull_atr_max_pct': 0.08597872733056583, 'bull_tp_mult': 2.1686283204955705, 'bull_tsl_mult': 0.8776860118022562, 'bull_time_stop': 299, 'bull_use_sma': True, 'bull_use_ema': False, 'bull_use_atr': True, 'bull_use_adx': False, 'bull_use_spike': False, 'bull_rsi_required': True, 'bear_strategy': 'mean_reversion', 'bear_bb_std_mult': 0.9060355964628884, 'bear_rsi_os': 55, 'bear_rsi_ob': 66, 'bear_adx_thresh': 25.02588322582334, 'bear_atr_min_pct': 0.0068554344404821825, 'bear_atr_max_pct': 0.12783302003019292, 'bear_tp_mult': 2.8997559538180084, 'bear_tsl_mult': 0.6559938477167147, 'bear_time_stop': 156, 'bear_use_sma': True, 'bear_use_ema': True, 'bear_use_atr': True, 'bear_use_adx': False, 'bear_use_spike': False, 'bear_rsi_required': False, 'sideways_strategy': 'mean_reversion', 'sideways_bb_std_mult': 1.101143581220194, 'sideways_rsi_os': 49, 'sideways_rsi_ob': 72, 'sideways_adx_thresh': 10.722128074014062, 'sideways_atr_min_pct': 0.02887928789055801, 'sideways_atr_max_pct': 0.07084968698222165, 'sideways_tp_mult': 2.473404127938904, 'sideways_tsl_mult': 0.34520353033221285, 'sideways_time_stop': 26, 'sideways_use_sma': True, 'sideways_use_ema': False, 'sideways_use_atr': False, 'sideways_use_adx': True, 'sideways_use_spike': False, 'sideways_rsi_required': False}.
[I 2025-09-01 10:06:02,600] Trial 366 finished with values: [-1000000000.0, 1000000000.0] and parameters: {'p_sma': 15, 'p_std': 41, 'p_atr': 17, 'p_adx': 9, 'rsi_period': 39, 'ema1': 19, 'ema2': 14, 'slip_atr_k': 0.14126728427917132, 'slip_spread_k': 0.6384267446904761, 'spread_hl_frac': 0.022268173263304217, 'bb_std_mult': 3.296939945835243, 'rsi_os': 39, 'rsi_ob': 68, 'vol_spike': 0.2965032691728541, 'adx_thresh': 32.59355754625573, 'atr_min_pct': 0.009514099299676173, 'atr_max_pct': 0.11534596842715768, 'tp_mult': 1.1739617804375877, 'tsl_mult': 0.6403615071060089, 'strategy': 'breakout', 'time_stop': 140, 'use_sma': True, 'use_atr': False, 'use_adx': True, 'use_ema': True, 'use_spike': True, 'rsi_required': True, 'edge_k': 1.266654446233504, 'edge_cap': 0.4863666682165317, 'bull_strategy': 'mean_reversion', 'bull_bb_std_mult': 0.9638910782884362, 'bull_rsi_os': 43, 'bull_rsi_ob': 45, 'bull_adx_thresh': 23.587498130149157, 'bull_atr_min_pct': 0.009207896627272266, 'bull_atr_max_pct': 0.09386180386353178, 'bull_tp_mult': 2.1468558765732526, 'bull_tsl_mult': 0.39902373974887223, 'bull_time_stop': 298, 'bull_use_sma': True, 'bull_use_ema': False, 'bull_use_atr': True, 'bull_use_adx': False, 'bull_use_spike': False, 'bull_rsi_required': True, 'bear_strategy': 'mean_reversion', 'bear_bb_std_mult': 0.9491009577930979, 'bear_rsi_os': 27, 'bear_rsi_ob': 66, 'bear_adx_thresh': 32.036554451274014, 'bear_atr_min_pct': 0.006890032555938619, 'bear_atr_max_pct': 0.08995851400681815, 'bear_tp_mult': 2.7405375735570408, 'bear_tsl_mult': 0.757222520814192, 'bear_time_stop': 300, 'bear_use_sma': False, 'bear_use_ema': False, 'bear_use_atr': True, 'bear_use_adx': False, 'bear_use_spike': True, 'bear_rsi_required': True, 'sideways_strategy': 'mean_reversion', 'sideways_bb_std_mult': 0.6881525739825801, 'sideways_rsi_os': 50, 'sideways_rsi_ob': 62, 'sideways_adx_thresh': 10.450024901741424, 'sideways_atr_min_pct': 0.008446741136586926, 'sideways_atr_max_pct': 0.07829304423516921, 'sideways_tp_mult': 2.5023297299553904, 'sideways_tsl_mult': 0.4005170151462314, 'sideways_time_stop': 200, 'sideways_use_sma': True, 'sideways_use_ema': False, 'sideways_use_atr': False, 'sideways_use_adx': True, 'sideways_use_spike': True, 'sideways_rsi_required': False}.
[I 2025-09-01 10:06:46,995] Trial 367 finished with values: [-0.04970444919995043, 0.04950217604444226] and parameters: {'p_sma': 39, 'p_std': 41, 'p_atr': 18, 'p_adx': 16, 'rsi_period': 22, 'ema1': 19, 'ema2': 14, 'slip_atr_k': 0.05402925701433569, 'slip_spread_k': 0.6435162445097293, 'spread_hl_frac': 0.029954471115060066, 'bb_std_mult': 1.4964941570736914, 'rsi_os': 43, 'rsi_ob': 68, 'vol_spike': 0.297056649624162, 'adx_thresh': 32.74688882942798, 'atr_min_pct': 0.002370745776523823, 'atr_max_pct': 0.1227356184447618, 'tp_mult': 1.1802136688681144, 'tsl_mult': 0.8142541202171953, 'strategy': 'breakout', 'time_stop': 229, 'use_sma': True, 'use_atr': False, 'use_adx': True, 'use_ema': True, 'use_spike': True, 'rsi_required': True, 'edge_k': 1.273907054653232, 'edge_cap': 0.5760919780358782, 'bull_strategy': 'mean_reversion', 'bull_bb_std_mult': 1.2487504871523631, 'bull_rsi_os': 46, 'bull_rsi_ob': 66, 'bull_adx_thresh': 20.88347657785528, 'bull_atr_min_pct': 4.210874250604201e-05, 'bull_atr_max_pct': 0.09301823041328497, 'bull_tp_mult': 2.9559561690989753, 'bull_tsl_mult': 0.42468001243076176, 'bull_time_stop': 63, 'bull_use_sma': True, 'bull_use_ema': False, 'bull_use_atr': True, 'bull_use_adx': False, 'bull_use_spike': False, 'bull_rsi_required': True, 'bear_strategy': 'mean_reversion', 'bear_bb_std_mult': 1.0192690626210226, 'bear_rsi_os': 8, 'bear_rsi_ob': 66, 'bear_adx_thresh': 31.334499207292986, 'bear_atr_min_pct': 0.006704265978921783, 'bear_atr_max_pct': 0.05132153206646059, 'bear_tp_mult': 1.2814224609169527, 'bear_tsl_mult': 0.6085455680316653, 'bear_time_stop': 300, 'bear_use_sma': False, 'bear_use_ema': False, 'bear_use_atr': True, 'bear_use_adx': False, 'bear_use_spike': True, 'bear_rsi_required': True, 'sideways_strategy': 'mean_reversion', 'sideways_bb_std_mult': 1.8522807343278338, 'sideways_rsi_os': 50, 'sideways_rsi_ob': 93, 'sideways_adx_thresh': 33.615596661463, 'sideways_atr_min_pct': 0.005661515801720125, 'sideways_atr_max_pct': 0.07084546555411059, 'sideways_tp_mult': 2.4808926519616015, 'sideways_tsl_mult': 0.4766639840299813, 'sideways_time_stop': 38, 'sideways_use_sma': True, 'sideways_use_ema': False, 'sideways_use_atr': False, 'sideways_use_adx': True, 'sideways_use_spike': True, 'sideways_rsi_required': False}.
[I 2025-09-01 10:06:47,001] Trial 369 finished with values: [-1000000000.0, 1000000000.0] and parameters: {'p_sma': 16, 'p_std': 58, 'p_atr': 18, 'p_adx': 21, 'rsi_period': 52, 'ema1': 19, 'ema2': 22, 'slip_atr_k': 0.23206809157435887, 'slip_spread_k': 0.3123864204854652, 'spread_hl_frac': 0.0487431969753022, 'bb_std_mult': 0.8612602127958502, 'rsi_os': 55, 'rsi_ob': 53, 'vol_spike': 0.09610235228364065, 'adx_thresh': 32.576461960101376, 'atr_min_pct': 0.009392182083610142, 'atr_max_pct': 0.020232358234663975, 'tp_mult': 1.4628308900574103, 'tsl_mult': 0.5458929057937015, 'strategy': 'breakout', 'time_stop': 142, 'use_sma': True, 'use_atr': False, 'use_adx': True, 'use_ema': True, 'use_spike': True, 'rsi_required': False, 'edge_k': 1.181734876446058, 'edge_cap': 0.290777374713058, 'bull_strategy': 'mean_reversion', 'bull_bb_std_mult': 3.533824661056874, 'bull_rsi_os': 46, 'bull_rsi_ob': 84, 'bull_adx_thresh': 5.005387287271425, 'bull_atr_min_pct': 0.009226910434298286, 'bull_atr_max_pct': 0.0387034718725371, 'bull_tp_mult': 2.9524367245674292, 'bull_tsl_mult': 0.42896735445627415, 'bull_time_stop': 186, 'bull_use_sma': False, 'bull_use_ema': False, 'bull_use_atr': True, 'bull_use_adx': False, 'bull_use_spike': False, 'bull_rsi_required': False, 'bear_strategy': 'mean_reversion', 'bear_bb_std_mult': 3.017416334890187, 'bear_rsi_os': 6, 'bear_rsi_ob': 56, 'bear_adx_thresh': 22.426776884344637, 'bear_atr_min_pct': 0.006430193028185748, 'bear_atr_max_pct': 0.04308517041804012, 'bear_tp_mult': 1.6533654890445033, 'bear_tsl_mult': 0.06446753653639387, 'bear_time_stop': 206, 'bear_use_sma': False, 'bear_use_ema': False, 'bear_use_atr': True, 'bear_use_adx': False, 'bear_use_spike': True, 'bear_rsi_required': True, 'sideways_strategy': 'mean_reversion', 'sideways_bb_std_mult': 0.9069915647106173, 'sideways_rsi_os': 26, 'sideways_rsi_ob': 89, 'sideways_adx_thresh': 20.674595084610964, 'sideways_atr_min_pct': 0.010264341675052194, 'sideways_atr_max_pct': 0.07853818892807811, 'sideways_tp_mult': 2.3371660406114985, 'sideways_tsl_mult': 0.46932347468661206, 'sideways_time_stop': 231, 'sideways_use_sma': True, 'sideways_use_ema': False, 'sideways_use_atr': True, 'sideways_use_adx': False, 'sideways_use_spike': True, 'sideways_rsi_required': False}.
