[I 2025-09-01 10:27:26,981] Trial 492 finished with values: [-0.01569364111734517, 0.01557136931240393] and parameters: {'p_sma': 15, 'p_std': 49, 'p_atr': 14, 'p_adx': 22, 'rsi_period': 37, 'ema1': 7, 'ema2': 10, 'slip_atr_k': 0.009214717623390142, 'slip_spread_k': 0.8109838760500299, 'spread_hl_frac': 0.017881231881163556, 'bb_std_mult': 1.1538394807094856, 'rsi_os': 18, 'rsi_ob': 59, 'vol_spike': 0.06895909355963357, 'adx_thresh': 24.919097443713753, 'atr_min_pct': 0.015470484279222148, 'atr_max_pct': 0.018561903846762942, 'tp_mult': 1.3383123983600418, 'tsl_mult': 0.08902989075092332, 'strategy': 'breakout', 'time_stop': 148, 'use_sma': True, 'use_atr': False, 'use_adx': False, 'use_ema': False, 'use_spike': False, 'rsi_required': True, 'edge_k': 1.5353721305029668, 'edge_cap': 0.31076220015576855, 'bull_strategy': 'mean_reversion', 'bull_bb_std_mult': 0.7501356648290283, 'bull_rsi_os': 19, 'bull_rsi_ob': 75, 'bull_adx_thresh': 16.361513992109877, 'bull_atr_min_pct': 0.00041421583404810787, 'bull_atr_max_pct': 0.017755233712178197, 'bull_tp_mult': 1.2151157800327816, 'bull_tsl_mult': 0.5606273243222727, 'bull_time_stop': 266, 'bull_use_sma': True, 'bull_use_ema': False, 'bull_use_atr': False, 'bull_use_adx': False, 'bull_use_spike': True, 'bull_rsi_required': True, 'bear_strategy': 'breakout', 'bear_bb_std_mult': 1.5462693712330546, 'bear_rsi_os': 17, 'bear_rsi_ob': 84, 'bear_adx_thresh': 29.821748082220672, 'bear_atr_min_pct': 0.002603721490012043, 'bear_atr_max_pct': 0.14542319614344681, 'bear_tp_mult': 1.425705912156371, 'bear_tsl_mult': 0.3568374192950261, 'bear_time_stop': 241, 'bear_use_sma': False, 'bear_use_ema': False, 'bear_use_atr': False, 'bear_use_adx': True, 'bear_use_spike': True, 'bear_rsi_required': False, 'sideways_strategy': 'breakout', 'sideways_bb_std_mult': 0.5503389451074242, 'sideways_rsi_os': 55, 'sideways_rsi_ob': 95, 'sideways_adx_thresh': 26.786895501157375, 'sideways_atr_min_pct': 0.0053825175481370495, 'sideways_atr_max_pct': 0.054768776071627015, 'sideways_tp_mult': 2.0727440319300725, 'sideways_tsl_mult': 0.35111889009605374, 'sideways_time_stop': 256, 'sideways_use_sma': False, 'sideways_use_ema': True, 'sideways_use_atr': True, 'sideways_use_adx': False, 'sideways_use_spike': False, 'sideways_rsi_required': True}.
[I 2025-09-01 10:27:27,867] Trial 499 finished with values: [-1000000000.0, 1000000000.0] and parameters: {'p_sma': 12, 'p_std': 48, 'p_atr': 13, 'p_adx': 21, 'rsi_period': 38, 'ema1': 8, 'ema2': 10, 'slip_atr_k': 0.012771962444005764, 'slip_spread_k': 0.8261614255125197, 'spread_hl_frac': 0.017729169521608985, 'bb_std_mult': 1.1514242477331635, 'rsi_os': 17, 'rsi_ob': 60, 'vol_spike': 0.06523790329676568, 'adx_thresh': 26.85916305765001, 'atr_min_pct': 0.016417330700667, 'atr_max_pct': 0.01614175116904171, 'tp_mult': 1.3388157228150033, 'tsl_mult': 0.10291123070618004, 'strategy': 'breakout', 'time_stop': 144, 'use_sma': True, 'use_atr': False, 'use_adx': False, 'use_ema': False, 'use_spike': False, 'rsi_required': True, 'edge_k': 1.5930626888719002, 'edge_cap': 0.34934129851438556, 'bull_strategy': 'mean_reversion', 'bull_bb_std_mult': 0.5040701787937214, 'bull_rsi_os': 17, 'bull_rsi_ob': 77, 'bull_adx_thresh': 13.48165859447595, 'bull_atr_min_pct': 0.0006924201291080838, 'bull_atr_max_pct': 0.0155636739518707, 'bull_tp_mult': 1.3391941205753486, 'bull_tsl_mult': 0.5703485905367566, 'bull_time_stop': 290, 'bull_use_sma': True, 'bull_use_ema': False, 'bull_use_atr': False, 'bull_use_adx': True, 'bull_use_spike': True, 'bull_rsi_required': True, 'bear_strategy': 'breakout', 'bear_bb_std_mult': 1.5525996674263587, 'bear_rsi_os': 18, 'bear_rsi_ob': 84, 'bear_adx_thresh': 26.63332986132162, 'bear_atr_min_pct': 0.0026256353969111653, 'bear_atr_max_pct': 0.14073052069437822, 'bear_tp_mult': 1.4928501417643614, 'bear_tsl_mult': 0.3421042267921345, 'bear_time_stop': 262, 'bear_use_sma': True, 'bear_use_ema': False, 'bear_use_atr': False, 'bear_use_adx': True, 'bear_use_spike': True, 'bear_rsi_required': False, 'sideways_strategy': 'breakout', 'sideways_bb_std_mult': 0.5718852058956451, 'sideways_rsi_os': 55, 'sideways_rsi_ob': 94, 'sideways_adx_thresh': 27.52449981134678, 'sideways_atr_min_pct': 0.0065663972437623635, 'sideways_atr_max_pct': 0.055083077457134366, 'sideways_tp_mult': 2.064023030016298, 'sideways_tsl_mult': 0.29898116948322423, 'sideways_time_stop': 248, 'sideways_use_sma': False, 'sideways_use_ema': False, 'sideways_use_atr': True, 'sideways_use_adx': False, 'sideways_use_spike': False, 'sideways_rsi_required': True}.
[I 2025-09-01 10:27:27,874] Trial 498 finished with values: [-1000000000.0, 1000000000.0] and parameters: {'p_sma': 12, 'p_std': 48, 'p_atr': 13, 'p_adx': 21, 'rsi_period': 38, 'ema1': 8, 'ema2': 10, 'slip_atr_k': 0.011409279877456987, 'slip_spread_k': 0.8221900753952907, 'spread_hl_frac': 0.01743881690826058, 'bb_std_mult': 1.175855750532661, 'rsi_os': 17, 'rsi_ob': 60, 'vol_spike': 0.06560657186234754, 'adx_thresh': 22.929276505133803, 'atr_min_pct': 0.016317116273086428, 'atr_max_pct': 0.016009527857347675, 'tp_mult': 1.5154660372324296, 'tsl_mult': 0.10717047392868759, 'strategy': 'breakout', 'time_stop': 140, 'use_sma': True, 'use_atr': True, 'use_adx': False, 'use_ema': False, 'use_spike': False, 'rsi_required': True, 'edge_k': 1.5902787065968143, 'edge_cap': 0.35074825182201574, 'bull_strategy': 'mean_reversion', 'bull_bb_std_mult': 0.5063794247887478, 'bull_rsi_os': 17, 'bull_rsi_ob': 77, 'bull_adx_thresh': 13.633044497678112, 'bull_atr_min_pct': 0.000896118253387768, 'bull_atr_max_pct': 0.0160931546750183, 'bull_tp_mult': 1.3399882983672868, 'bull_tsl_mult': 0.5677925407973912, 'bull_time_stop': 290, 'bull_use_sma': True, 'bull_use_ema': False, 'bull_use_atr': False, 'bull_use_adx': True, 'bull_use_spike': True, 'bull_rsi_required': True, 'bear_strategy': 'breakout', 'bear_bb_std_mult': 1.5656065896872084, 'bear_rsi_os': 18, 'bear_rsi_ob': 86, 'bear_adx_thresh': 26.700516752017883, 'bear_atr_min_pct': 0.0006743233183165575, 'bear_atr_max_pct': 0.14205589542791539, 'bear_tp_mult': 1.4882409226564706, 'bear_tsl_mult': 0.35272050273803923, 'bear_time_stop': 263, 'bear_use_sma': True, 'bear_use_ema': False, 'bear_use_atr': False, 'bear_use_adx': True, 'bear_use_spike': True, 'bear_rsi_required': False, 'sideways_strategy': 'breakout', 'sideways_bb_std_mult': 0.5658573572976264, 'sideways_rsi_os': 55, 'sideways_rsi_ob': 94, 'sideways_adx_thresh': 28.175011720421132, 'sideways_atr_min_pct': 0.006420083714820424, 'sideways_atr_max_pct': 0.05648271529015022, 'sideways_tp_mult': 2.040427150160303, 'sideways_tsl_mult': 0.30383943631114235, 'sideways_time_stop': 243, 'sideways_use_sma': False, 'sideways_use_ema': False, 'sideways_use_atr': True, 'sideways_use_adx': False, 'sideways_use_spike': False, 'sideways_rsi_required': True}.
[I 2025-09-01 10:28:09,873] Trial 496 finished with values: [-0.030647301387651926, 0.03134524572568492] and parameters: {'p_sma': 30, 'p_std': 49, 'p_atr': 13, 'p_adx': 22, 'rsi_period': 34, 'ema1': 8, 'ema2': 12, 'slip_atr_k': 2.8699422140716024e-05, 'slip_spread_k': 0.8158638953209643, 'spread_hl_frac': 0.017716008954907526, 'bb_std_mult': 1.1353489672241346, 'rsi_os': 17, 'rsi_ob': 59, 'vol_spike': 0.06779259747261755, 'adx_thresh': 26.478722914018725, 'atr_min_pct': 0.014598172593212097, 'atr_max_pct': 0.01790074193466551, 'tp_mult': 1.4280456747323425, 'tsl_mult': 0.047460969334409915, 'strategy': 'breakout', 'time_stop': 166, 'use_sma': True, 'use_atr': False, 'use_adx': False, 'use_ema': False, 'use_spike': False, 'rsi_required': True, 'edge_k': 1.455246314823254, 'edge_cap': 0.2760953713645116, 'bull_strategy': 'mean_reversion', 'bull_bb_std_mult': 0.5922100634550297, 'bull_rsi_os': 17, 'bull_rsi_ob': 73, 'bull_adx_thresh': 16.86821382166049, 'bull_atr_min_pct': 4.1916390330273105e-05, 'bull_atr_max_pct': 0.018692721488538254, 'bull_tp_mult': 1.2222441842898497, 'bull_tsl_mult': 0.5505422562523432, 'bull_time_stop': 266, 'bull_use_sma': True, 'bull_use_ema': False, 'bull_use_atr': False, 'bull_use_adx': True, 'bull_use_spike': True, 'bull_rsi_required': True, 'bear_strategy': 'breakout', 'bear_bb_std_mult': 1.4609018711306427, 'bear_rsi_os': 15, 'bear_rsi_ob': 86, 'bear_adx_thresh': 26.81631048927068, 'bear_atr_min_pct': 0.0026368204218301977, 'bear_atr_max_pct': 0.14723924434924385, 'bear_tp_mult': 1.361654897029258, 'bear_tsl_mult': 0.39482150099405827, 'bear_time_stop': 262, 'bear_use_sma': True, 'bear_use_ema': False, 'bear_use_atr': False, 'bear_use_adx': True, 'bear_use_spike': True, 'bear_rsi_required': False, 'sideways_strategy': 'breakout', 'sideways_bb_std_mult': 0.5600763570162078, 'sideways_rsi_os': 55, 'sideways_rsi_ob': 94, 'sideways_adx_thresh': 25.672506006552247, 'sideways_atr_min_pct': 0.005490557424062099, 'sideways_atr_max_pct': 0.04717400343755909, 'sideways_tp_mult': 2.123155343747233, 'sideways_tsl_mult': 0.36756306464994665, 'sideways_time_stop': 247, 'sideways_use_sma': False, 'sideways_use_ema': True, 'sideways_use_atr': True, 'sideways_use_adx': False, 'sideways_use_spike': False, 'sideways_rsi_required': True}.
[I 2025-09-01 10:28:10,400] Trial 497 finished with values: [-0.013600475176669402, 0.013499236732161952] and parameters: {'p_sma': 14, 'p_std': 48, 'p_atr': 13, 'p_adx': 21, 'rsi_period': 40, 'ema1': 7, 'ema2': 10, 'slip_atr_k': 0.015548452852960828, 'slip_spread_k': 0.8247471893822023, 'spread_hl_frac': 0.014164585605790718, 'bb_std_mult': 0.9982191831377818, 'rsi_os': 17, 'rsi_ob': 60, 'vol_spike': 0.06278964124695591, 'adx_thresh': 24.0051044806004, 'atr_min_pct': 0.016292028056240814, 'atr_max_pct': 0.016727933491861035, 'tp_mult': 1.4765275436517227, 'tsl_mult': 0.12723997127848538, 'strategy': 'breakout', 'time_stop': 139, 'use_sma': True, 'use_atr': False, 'use_adx': False, 'use_ema': False, 'use_spike': False, 'rsi_required': True, 'edge_k': 1.5922752071587394, 'edge_cap': 0.3488376512736361, 'bull_strategy': 'mean_reversion', 'bull_bb_std_mult': 0.5019429427872831, 'bull_rsi_os': 18, 'bull_rsi_ob': 76, 'bull_adx_thresh': 14.847133196251836, 'bull_atr_min_pct': 0.0008741951365122549, 'bull_atr_max_pct': 0.015990243047350007, 'bull_tp_mult': 1.1678789103201228, 'bull_tsl_mult': 0.6792966264482609, 'bull_time_stop': 266, 'bull_use_sma': True, 'bull_use_ema': False, 'bull_use_atr': False, 'bull_use_adx': True, 'bull_use_spike': True, 'bull_rsi_required': True, 'bear_strategy': 'breakout', 'bear_bb_std_mult': 1.641018195198969, 'bear_rsi_os': 18, 'bear_rsi_ob': 84, 'bear_adx_thresh': 26.65008096123807, 'bear_atr_min_pct': 0.0026844798671048493, 'bear_atr_max_pct': 0.14005662781409497, 'bear_tp_mult': 1.4917096854803849, 'bear_tsl_mult': 0.33257087621435893, 'bear_time_stop': 263, 'bear_use_sma': True, 'bear_use_ema': False, 'bear_use_atr': False, 'bear_use_adx': True, 'bear_use_spike': True, 'bear_rsi_required': False, 'sideways_strategy': 'breakout', 'sideways_bb_std_mult': 0.5613042137496297, 'sideways_rsi_os': 55, 'sideways_rsi_ob': 94, 'sideways_adx_thresh': 29.057228734725967, 'sideways_atr_min_pct': 0.007071666907794065, 'sideways_atr_max_pct': 0.054459811357755905, 'sideways_tp_mult': 2.0708542193847843, 'sideways_tsl_mult': 0.30303586344008326, 'sideways_time_stop': 243, 'sideways_use_sma': False, 'sideways_use_ema': True, 'sideways_use_atr': True, 'sideways_use_adx': False, 'sideways_use_spike': False, 'sideways_rsi_required': True}.
[I 2025-09-01 10:28:13,202] Trial 500 finished with values: [-0.01538618081401999, 0.015246708108129102] and parameters: {'p_sma': 13, 'p_std': 49, 'p_atr': 13, 'p_adx': 22, 'rsi_period': 37, 'ema1': 9, 'ema2': 10, 'slip_atr_k': 0.01637860888747491, 'slip_spread_k': 0.847917081903915, 'spread_hl_frac': 0.017903385874836125, 'bb_std_mult': 1.1824128282165003, 'rsi_os': 17, 'rsi_ob': 60, 'vol_spike': 0.06683789718915084, 'adx_thresh': 22.78546449837062, 'atr_min_pct': 0.01630439966481971, 'atr_max_pct': 0.01797598077397336, 'tp_mult': 1.2950160206999344, 'tsl_mult': 0.11240261332875737, 'strategy': 'breakout', 'time_stop': 141, 'use_sma': True, 'use_atr': False, 'use_adx': False, 'use_ema': False, 'use_spike': False, 'rsi_required': True, 'edge_k': 1.5813116817821813, 'edge_cap': 0.3318145030808088, 'bull_strategy': 'mean_reversion', 'bull_bb_std_mult': 0.5272973329658752, 'bull_rsi_os': 19, 'bull_rsi_ob': 76, 'bull_adx_thresh': 13.98774998494946, 'bull_atr_min_pct': 0.0009737169960366293, 'bull_atr_max_pct': 0.018804518569150427, 'bull_tp_mult': 1.3627743002645645, 'bull_tsl_mult': 0.5529103102142269, 'bull_time_stop': 281, 'bull_use_sma': True, 'bull_use_ema': False, 'bull_use_atr': False, 'bull_use_adx': True, 'bull_use_spike': True, 'bull_rsi_required': True, 'bear_strategy': 'breakout', 'bear_bb_std_mult': 1.5976473929453474, 'bear_rsi_os': 18, 'bear_rsi_ob': 85, 'bear_adx_thresh': 26.757238707200894, 'bear_atr_min_pct': 0.002350382993085205, 'bear_atr_max_pct': 0.14643832782514843, 'bear_tp_mult': 1.482508257547861, 'bear_tsl_mult': 0.3491742967845151, 'bear_time_stop': 264, 'bear_use_sma': False, 'bear_use_ema': False, 'bear_use_atr': True, 'bear_use_adx': True, 'bear_use_spike': True, 'bear_rsi_required': False, 'sideways_strategy': 'breakout', 'sideways_bb_std_mult': 0.555734742075528, 'sideways_rsi_os': 55, 'sideways_rsi_ob': 95, 'sideways_adx_thresh': 28.328138692925222, 'sideways_atr_min_pct': 0.005433211999030922, 'sideways_atr_max_pct': 0.05752814806469769, 'sideways_tp_mult': 2.0722677516692403, 'sideways_tsl_mult': 0.2719131065906943, 'sideways_time_stop': 244, 'sideways_use_sma': False, 'sideways_use_ema': True, 'sideways_use_atr': False, 'sideways_use_adx': False, 'sideways_use_spike': False, 'sideways_rsi_required': True}.
[I 2025-09-01 10:28:13,573] Trial 501 finished with values: [-0.015520186258963786, 0.015380633494119951] and parameters: {'p_sma': 13, 'p_std': 49, 'p_atr': 13, 'p_adx': 22, 'rsi_period': 36, 'ema1': 10, 'ema2': 10, 'slip_atr_k': 0.01606265188901185, 'slip_spread_k': 0.8425106499673313, 'spread_hl_frac': 0.01828038153365439, 'bb_std_mult': 1.1174672681006848, 'rsi_os': 18, 'rsi_ob': 59, 'vol_spike': 0.07022479321313226, 'adx_thresh': 27.485402723532058, 'atr_min_pct': 0.016232410855447868, 'atr_max_pct': 0.019586520639916498, 'tp_mult': 1.314200041408232, 'tsl_mult': 0.09089280015329186, 'strategy': 'breakout', 'time_stop': 149, 'use_sma': True, 'use_atr': False, 'use_adx': True, 'use_ema': False, 'use_spike': False, 'rsi_required': True, 'edge_k': 1.5598613935325307, 'edge_cap': 0.321898083703185, 'bull_strategy': 'mean_reversion', 'bull_bb_std_mult': 0.581159254252986, 'bull_rsi_os': 19, 'bull_rsi_ob': 75, 'bull_adx_thresh': 12.75714124541823, 'bull_atr_min_pct': 0.0007793509801429282, 'bull_atr_max_pct': 0.018608502760743648, 'bull_tp_mult': 1.3708584129515855, 'bull_tsl_mult': 0.5869966364427693, 'bull_time_stop': 281, 'bull_use_sma': True, 'bull_use_ema': False, 'bull_use_atr': False, 'bull_use_adx': True, 'bull_use_spike': False, 'bull_rsi_required': True, 'bear_strategy': 'breakout', 'bear_bb_std_mult': 1.4940448180311108, 'bear_rsi_os': 17, 'bear_rsi_ob': 85, 'bear_adx_thresh': 26.435827429566217, 'bear_atr_min_pct': 0.0024318693764128043, 'bear_atr_max_pct': 0.14635542474268287, 'bear_tp_mult': 1.4487507838070606, 'bear_tsl_mult': 0.3338741283467155, 'bear_time_stop': 264, 'bear_use_sma': False, 'bear_use_ema': False, 'bear_use_atr': True, 'bear_use_adx': True, 'bear_use_spike': True, 'bear_rsi_required': False, 'sideways_strategy': 'breakout', 'sideways_bb_std_mult': 0.5472399841133392, 'sideways_rsi_os': 55, 'sideways_rsi_ob': 95, 'sideways_adx_thresh': 27.612046509118667, 'sideways_atr_min_pct': 0.005476040167529971, 'sideways_atr_max_pct': 0.0548740537729812, 'sideways_tp_mult': 2.0817792584260983, 'sideways_tsl_mult': 0.2793135721047198, 'sideways_time_stop': 256, 'sideways_use_sma': False, 'sideways_use_ema': True, 'sideways_use_atr': False, 'sideways_use_adx': False, 'sideways_use_spike': False, 'sideways_rsi_required': True}.
[I 2025-09-01 10:28:14,363] Trial 503 finished with values: [-1000000000.0, 1000000000.0] and parameters: {'p_sma': 11, 'p_std': 24, 'p_atr': 12, 'p_adx': 20, 'rsi_period': 40, 'ema1': 7, 'ema2': 10, 'slip_atr_k': 0.01944636746832239, 'slip_spread_k': 0.8470828985015314, 'spread_hl_frac': 0.01381193595442265, 'bb_std_mult': 0.9719815205486221, 'rsi_os': 15, 'rsi_ob': 62, 'vol_spike': 0.06055871858686015, 'adx_thresh': 21.38135568523597, 'atr_min_pct': 0.01697926011055454, 'atr_max_pct': 0.013275027492726037, 'tp_mult': 1.482594802373024, 'tsl_mult': 0.12421778823142272, 'strategy': 'breakout', 'time_stop': 135, 'use_sma': True, 'use_atr': False, 'use_adx': True, 'use_ema': False, 'use_spike': False, 'rsi_required': True, 'edge_k': 1.6336447907792682, 'edge_cap': 0.22105085834262672, 'bull_strategy': 'mean_reversion', 'bull_bb_std_mult': 0.5029803455009224, 'bull_rsi_os': 19, 'bull_rsi_ob': 76, 'bull_adx_thresh': 14.909432697695884, 'bull_atr_min_pct': 0.025723449749797324, 'bull_atr_max_pct': 0.013920473100391531, 'bull_tp_mult': 1.1637685965455276, 'bull_tsl_mult': 0.6790847925497853, 'bull_time_stop': 263, 'bull_use_sma': False, 'bull_use_ema': False, 'bull_use_atr': False, 'bull_use_adx': True, 'bull_use_spike': True, 'bull_rsi_required': True, 'bear_strategy': 'breakout', 'bear_bb_std_mult': 1.68718815508834, 'bear_rsi_os': 6, 'bear_rsi_ob': 83, 'bear_adx_thresh': 26.71258266190609, 'bear_atr_min_pct': 0.00328178979422268, 'bear_atr_max_pct': 0.12041698069446885, 'bear_tp_mult': 1.8080044694836017, 'bear_tsl_mult': 0.31751195233022217, 'bear_time_stop': 228, 'bear_use_sma': False, 'bear_use_ema': False, 'bear_use_atr': False, 'bear_use_adx': True, 'bear_use_spike': True, 'bear_rsi_required': True, 'sideways_strategy': 'breakout', 'sideways_bb_std_mult': 0.5527277596754945, 'sideways_rsi_os': 55, 'sideways_rsi_ob': 94, 'sideways_adx_thresh': 29.095097736201684, 'sideways_atr_min_pct': 0.0072682246630785, 'sideways_atr_max_pct': 0.05311719478663463, 'sideways_tp_mult': 2.078087726523033, 'sideways_tsl_mult': 0.2767673653211508, 'sideways_time_stop': 235, 'sideways_use_sma': False, 'sideways_use_ema': True, 'sideways_use_atr': True, 'sideways_use_adx': False, 'sideways_use_spike': True, 'sideways_rsi_required': True}.
[I 2025-09-01 10:28:14,366] Trial 502 finished with values: [-1000000000.0, 1000000000.0] and parameters: {'p_sma': 13, 'p_std': 48, 'p_atr': 12, 'p_adx': 22, 'rsi_period': 36, 'ema1': 9, 'ema2': 10, 'slip_atr_k': 0.018856310865927445, 'slip_spread_k': 0.8449161533003282, 'spread_hl_frac': 0.01838610703488376, 'bb_std_mult': 1.182439635100369, 'rsi_os': 15, 'rsi_ob': 60, 'vol_spike': 0.061306196838668524, 'adx_thresh': 21.42456643977038, 'atr_min_pct': 0.015871359622191755, 'atr_max_pct': 0.015006222529800153, 'tp_mult': 1.2831754423444932, 'tsl_mult': 0.08448058100829321, 'strategy': 'breakout', 'time_stop': 147, 'use_sma': True, 'use_atr': False, 'use_adx': True, 'use_ema': False, 'use_spike': False, 'rsi_required': True, 'edge_k': 1.552074873967218, 'edge_cap': 0.3250856468437213, 'bull_strategy': 'mean_reversion', 'bull_bb_std_mult': 0.5400575471767726, 'bull_rsi_os': 19, 'bull_rsi_ob': 75, 'bull_adx_thresh': 12.634368258846248, 'bull_atr_min_pct': 0.0008991891762167984, 'bull_atr_max_pct': 0.013561571300063434, 'bull_tp_mult': 1.384959947667044, 'bull_tsl_mult': 0.6014354954226583, 'bull_time_stop': 282, 'bull_use_sma': True, 'bull_use_ema': False, 'bull_use_atr': False, 'bull_use_adx': True, 'bull_use_spike': False, 'bull_rsi_required': True, 'bear_strategy': 'breakout', 'bear_bb_std_mult': 1.4844961412803097, 'bear_rsi_os': 18, 'bear_rsi_ob': 85, 'bear_adx_thresh': 26.307162817681164, 'bear_atr_min_pct': 0.0023112707952472585, 'bear_atr_max_pct': 0.14478879343710332, 'bear_tp_mult': 1.4368069793142728, 'bear_tsl_mult': 0.3287633535815069, 'bear_time_stop': 267, 'bear_use_sma': False, 'bear_use_ema': False, 'bear_use_atr': True, 'bear_use_adx': True, 'bear_use_spike': True, 'bear_rsi_required': False, 'sideways_strategy': 'breakout', 'sideways_bb_std_mult': 0.5585603387790062, 'sideways_rsi_os': 55, 'sideways_rsi_ob': 95, 'sideways_adx_thresh': 28.10064261277361, 'sideways_atr_min_pct': 0.007230802973601685, 'sideways_atr_max_pct': 0.05425957289537305, 'sideways_tp_mult': 2.07160929194095, 'sideways_tsl_mult': 0.2741554656961616, 'sideways_time_stop': 256, 'sideways_use_sma': False, 'sideways_use_ema': False, 'sideways_use_atr': False, 'sideways_use_adx': False, 'sideways_use_spike': True, 'sideways_rsi_required': True}.
