[I 2025-09-01 10:32:50,961] Trial 547 finished with values: [-1000000000.0, 1000000000.0] and parameters: {'p_sma': 13, 'p_std': 17, 'p_atr': 12, 'p_adx': 20, 'rsi_period': 35, 'ema1': 7, 'ema2': 11, 'slip_atr_k': 0.016152107788541148, 'slip_spread_k': 0.8077264419646089, 'spread_hl_frac': 0.015070227645395375, 'bb_std_mult': 0.7854120434534726, 'rsi_os': 17, 'rsi_ob': 59, 'vol_spike': 0.055140780180284066, 'adx_thresh': 24.00522469425203, 'atr_min_pct': 0.01694194478552154, 'atr_max_pct': 0.014882702432849218, 'tp_mult': 1.4860263799865172, 'tsl_mult': 0.08098074912410966, 'strategy': 'breakout', 'time_stop': 145, 'use_sma': True, 'use_atr': False, 'use_adx': False, 'use_ema': False, 'use_spike': False, 'rsi_required': True, 'edge_k': 1.5764396596463164, 'edge_cap': 0.6870316757911052, 'bull_strategy': 'mean_reversion', 'bull_bb_std_mult': 0.587548352670607, 'bull_rsi_os': 17, 'bull_rsi_ob': 78, 'bull_adx_thresh': 15.47038202462863, 'bull_atr_min_pct': 0.010507939441704483, 'bull_atr_max_pct': 0.022437088017686655, 'bull_tp_mult': 1.198915189153524, 'bull_tsl_mult': 0.6954601189128292, 'bull_time_stop': 266, 'bull_use_sma': True, 'bull_use_ema': False, 'bull_use_atr': False, 'bull_use_adx': True, 'bull_use_spike': True, 'bull_rsi_required': True, 'bear_strategy': 'breakout', 'bear_bb_std_mult': 1.552569110001153, 'bear_rsi_os': 20, 'bear_rsi_ob': 82, 'bear_adx_thresh': 27.992444974605235, 'bear_atr_min_pct': 0.0016270757548540894, 'bear_atr_max_pct': 0.1405034903720314, 'bear_tp_mult': 2.307434242661694, 'bear_tsl_mult': 0.36290219679704105, 'bear_time_stop': 262, 'bear_use_sma': True, 'bear_use_ema': False, 'bear_use_atr': False, 'bear_use_adx': True, 'bear_use_spike': True, 'bear_rsi_required': False, 'sideways_strategy': 'breakout', 'sideways_bb_std_mult': 0.5770947731741697, 'sideways_rsi_os': 55, 'sideways_rsi_ob': 69, 'sideways_adx_thresh': 29.374334387668178, 'sideways_atr_min_pct': 0.008014151101398925, 'sideways_atr_max_pct': 0.05941387943289965, 'sideways_tp_mult': 2.0206425510563233, 'sideways_tsl_mult': 0.3478089239131747, 'sideways_time_stop': 225, 'sideways_use_sma': False, 'sideways_use_ema': True, 'sideways_use_atr': True, 'sideways_use_adx': False, 'sideways_use_spike': False, 'sideways_rsi_required': True}.
[I 2025-09-01 10:32:51,970] Trial 550 finished with values: [-1000000000.0, 1000000000.0] and parameters: {'p_sma': 10, 'p_std': 39, 'p_atr': 11, 'p_adx': 20, 'rsi_period': 34, 'ema1': 6, 'ema2': 10, 'slip_atr_k': 0.012658875405818448, 'slip_spread_k': 0.7708844277228268, 'spread_hl_frac': 0.015613185127789518, 'bb_std_mult': 1.110750259244167, 'rsi_os': 17, 'rsi_ob': 59, 'vol_spike': 0.05108132633029639, 'adx_thresh': 25.552668505680202, 'atr_min_pct': 0.01589068859436552, 'atr_max_pct': 0.015216462864576147, 'tp_mult': 1.525432872807003, 'tsl_mult': 0.20173504581930074, 'strategy': 'breakout', 'time_stop': 143, 'use_sma': True, 'use_atr': False, 'use_adx': False, 'use_ema': False, 'use_spike': False, 'rsi_required': True, 'edge_k': 1.675533666166399, 'edge_cap': 0.7491774663368664, 'bull_strategy': 'breakout', 'bull_bb_std_mult': 0.5135828350409204, 'bull_rsi_os': 19, 'bull_rsi_ob': 78, 'bull_adx_thresh': 15.146821989661065, 'bull_atr_min_pct': 0.0006436758859857034, 'bull_atr_max_pct': 0.023251122140210384, 'bull_tp_mult': 1.1614773361206125, 'bull_tsl_mult': 0.7124599639720235, 'bull_time_stop': 267, 'bull_use_sma': True, 'bull_use_ema': False, 'bull_use_atr': False, 'bull_use_adx': True, 'bull_use_spike': True, 'bull_rsi_required': True, 'bear_strategy': 'breakout', 'bear_bb_std_mult': 1.3496812864517593, 'bear_rsi_os': 18, 'bear_rsi_ob': 84, 'bear_adx_thresh': 26.47471880664702, 'bear_atr_min_pct': 0.001629011328274093, 'bear_atr_max_pct': 0.12986882763694885, 'bear_tp_mult': 1.7410678640160802, 'bear_tsl_mult': 0.3668815000092083, 'bear_time_stop': 263, 'bear_use_sma': False, 'bear_use_ema': True, 'bear_use_atr': False, 'bear_use_adx': True, 'bear_use_spike': True, 'bear_rsi_required': False, 'sideways_strategy': 'breakout', 'sideways_bb_std_mult': 0.5012868688980132, 'sideways_rsi_os': 55, 'sideways_rsi_ob': 62, 'sideways_adx_thresh': 29.633478534665755, 'sideways_atr_min_pct': 0.00537614913239542, 'sideways_atr_max_pct': 0.05412378775667355, 'sideways_tp_mult': 2.006285445456717, 'sideways_tsl_mult': 0.24851978146181145, 'sideways_time_stop': 223, 'sideways_use_sma': False, 'sideways_use_ema': True, 'sideways_use_atr': True, 'sideways_use_adx': False, 'sideways_use_spike': True, 'sideways_rsi_required': True}.
[I 2025-09-01 10:33:34,135] Trial 554 finished with values: [-1000000000.0, 1000000000.0] and parameters: {'p_sma': 14, 'p_std': 57, 'p_atr': 13, 'p_adx': 12, 'rsi_period': 41, 'ema1': 5, 'ema2': 12, 'slip_atr_k': 0.006456616544779484, 'slip_spread_k': 0.8476983295558412, 'spread_hl_frac': 0.012728469650174759, 'bb_std_mult': 0.9252917530946356, 'rsi_os': 19, 'rsi_ob': 63, 'vol_spike': 0.0710593406168537, 'adx_thresh': 24.698900147854083, 'atr_min_pct': 0.015250613475017348, 'atr_max_pct': 0.020448236168716844, 'tp_mult': 1.3796211340649513, 'tsl_mult': 0.14420361589701472, 'strategy': 'breakout', 'time_stop': 153, 'use_sma': True, 'use_atr': False, 'use_adx': False, 'use_ema': False, 'use_spike': False, 'rsi_required': False, 'edge_k': 1.6206188073076548, 'edge_cap': 0.2611219989418467, 'bull_strategy': 'mean_reversion', 'bull_bb_std_mult': 0.6814947608710868, 'bull_rsi_os': 18, 'bull_rsi_ob': 76, 'bull_adx_thresh': 14.200293660406718, 'bull_atr_min_pct': 0.0020541981758062716, 'bull_atr_max_pct': 0.018295043582293342, 'bull_tp_mult': 1.2469030512225612, 'bull_tsl_mult': 0.7537162150334402, 'bull_time_stop': 280, 'bull_use_sma': False, 'bull_use_ema': False, 'bull_use_atr': False, 'bull_use_adx': True, 'bull_use_spike': True, 'bull_rsi_required': False, 'bear_strategy': 'breakout', 'bear_bb_std_mult': 1.7397971290110896, 'bear_rsi_os': 17, 'bear_rsi_ob': 85, 'bear_adx_thresh': 34.35286871804251, 'bear_atr_min_pct': 0.00367134084087929, 'bear_atr_max_pct': 0.10137924985582704, 'bear_tp_mult': 1.6715927445264656, 'bear_tsl_mult': 0.31962625770091124, 'bear_time_stop': 254, 'bear_use_sma': False, 'bear_use_ema': False, 'bear_use_atr': False, 'bear_use_adx': True, 'bear_use_spike': True, 'bear_rsi_required': True, 'sideways_strategy': 'breakout', 'sideways_bb_std_mult': 0.6841674096272008, 'sideways_rsi_os': 55, 'sideways_rsi_ob': 65, 'sideways_adx_thresh': 28.6309674830049, 'sideways_atr_min_pct': 0.006449523360342544, 'sideways_atr_max_pct': 0.05318984145175796, 'sideways_tp_mult': 2.1413993132651106, 'sideways_tsl_mult': 0.3159411353566137, 'sideways_time_stop': 244, 'sideways_use_sma': False, 'sideways_use_ema': True, 'sideways_use_atr': True, 'sideways_use_adx': False, 'sideways_use_spike': False, 'sideways_rsi_required': True}.
[I 2025-09-01 10:33:34,144] Trial 552 finished with values: [-1000000000.0, 1000000000.0] and parameters: {'p_sma': 9, 'p_std': 39, 'p_atr': 11, 'p_adx': 14, 'rsi_period': 41, 'ema1': 6, 'ema2': 11, 'slip_atr_k': 0.014848602164452841, 'slip_spread_k': 0.8490870023338248, 'spread_hl_frac': 0.015080063422685816, 'bb_std_mult': 0.9242457695105383, 'rsi_os': 19, 'rsi_ob': 63, 'vol_spike': 0.055126879880299344, 'adx_thresh': 25.002062723596094, 'atr_min_pct': 0.0154058565436196, 'atr_max_pct': 0.02064271002280611, 'tp_mult': 1.522021874631706, 'tsl_mult': 0.19152259776467379, 'strategy': 'breakout', 'time_stop': 154, 'use_sma': True, 'use_atr': False, 'use_adx': False, 'use_ema': False, 'use_spike': False, 'rsi_required': False, 'edge_k': 1.6219985023846226, 'edge_cap': 0.2535699169105782, 'bull_strategy': 'mean_reversion', 'bull_bb_std_mult': 0.5035830779140635, 'bull_rsi_os': 18, 'bull_rsi_ob': 78, 'bull_adx_thresh': 13.922803908890657, 'bull_atr_min_pct': 0.008985495478637478, 'bull_atr_max_pct': 0.018146628743181868, 'bull_tp_mult': 1.1498590701963647, 'bull_tsl_mult': 0.7967464712986629, 'bull_time_stop': 272, 'bull_use_sma': False, 'bull_use_ema': False, 'bull_use_atr': False, 'bull_use_adx': True, 'bull_use_spike': True, 'bull_rsi_required': False, 'bear_strategy': 'breakout', 'bear_bb_std_mult': 1.781636048444453, 'bear_rsi_os': 19, 'bear_rsi_ob': 84, 'bear_adx_thresh': 26.38436028597069, 'bear_atr_min_pct': 0.003684377036924022, 'bear_atr_max_pct': 0.10071057276243199, 'bear_tp_mult': 1.9641557270518535, 'bear_tsl_mult': 0.31822757381623845, 'bear_time_stop': 273, 'bear_use_sma': False, 'bear_use_ema': False, 'bear_use_atr': False, 'bear_use_adx': True, 'bear_use_spike': True, 'bear_rsi_required': True, 'sideways_strategy': 'breakout', 'sideways_bb_std_mult': 0.6430070725604395, 'sideways_rsi_os': 55, 'sideways_rsi_ob': 77, 'sideways_adx_thresh': 29.088615559440523, 'sideways_atr_min_pct': 0.0049474985731582394, 'sideways_atr_max_pct': 0.05274048732995831, 'sideways_tp_mult': 2.1520799589851327, 'sideways_tsl_mult': 0.24364409009426127, 'sideways_time_stop': 240, 'sideways_use_sma': False, 'sideways_use_ema': True, 'sideways_use_atr': True, 'sideways_use_adx': False, 'sideways_use_spike': False, 'sideways_rsi_required': True}.
[I 2025-09-01 10:33:34,601] Trial 553 finished with values: [-0.021820005724679903, 0.021675327911236206] and parameters: {'p_sma': 14, 'p_std': 39, 'p_atr': 13, 'p_adx': 14, 'rsi_period': 33, 'ema1': 6, 'ema2': 10, 'slip_atr_k': 0.009945702733899317, 'slip_spread_k': 0.8472592807305385, 'spread_hl_frac': 0.012671021106705442, 'bb_std_mult': 1.1113371141551267, 'rsi_os': 19, 'rsi_ob': 63, 'vol_spike': 0.07135433861200359, 'adx_thresh': 25.136862900568534, 'atr_min_pct': 0.01521342952966408, 'atr_max_pct': 0.020343641399994953, 'tp_mult': 1.3749046945117338, 'tsl_mult': 0.10841342168759656, 'strategy': 'breakout', 'time_stop': 153, 'use_sma': True, 'use_atr': False, 'use_adx': False, 'use_ema': False, 'use_spike': False, 'rsi_required': False, 'edge_k': 1.6165000976823416, 'edge_cap': 0.2530485565576265, 'bull_strategy': 'mean_reversion', 'bull_bb_std_mult': 0.5137834065234951, 'bull_rsi_os': 18, 'bull_rsi_ob': 76, 'bull_adx_thresh': 14.057756823522487, 'bull_atr_min_pct': 0.0007530341557601095, 'bull_atr_max_pct': 0.018325478003183675, 'bull_tp_mult': 1.145641618800062, 'bull_tsl_mult': 0.7856598712725981, 'bull_time_stop': 282, 'bull_use_sma': False, 'bull_use_ema': False, 'bull_use_atr': False, 'bull_use_adx': True, 'bull_use_spike': True, 'bull_rsi_required': False, 'bear_strategy': 'breakout', 'bear_bb_std_mult': 1.279975102077543, 'bear_rsi_os': 18, 'bear_rsi_ob': 84, 'bear_adx_thresh': 26.404396847417676, 'bear_atr_min_pct': 0.003723050480568685, 'bear_atr_max_pct': 0.10154208762592969, 'bear_tp_mult': 1.650173514911239, 'bear_tsl_mult': 0.3465914908444319, 'bear_time_stop': 253, 'bear_use_sma': False, 'bear_use_ema': False, 'bear_use_atr': False, 'bear_use_adx': True, 'bear_use_spike': True, 'bear_rsi_required': True, 'sideways_strategy': 'breakout', 'sideways_bb_std_mult': 0.6783794171275861, 'sideways_rsi_os': 55, 'sideways_rsi_ob': 65, 'sideways_adx_thresh': 30.172926523011988, 'sideways_atr_min_pct': 0.006370160713299711, 'sideways_atr_max_pct': 0.05319733143322811, 'sideways_tp_mult': 2.148377033360835, 'sideways_tsl_mult': 0.3089721764218188, 'sideways_time_stop': 241, 'sideways_use_sma': False, 'sideways_use_ema': True, 'sideways_use_atr': True, 'sideways_use_adx': False, 'sideways_use_spike': False, 'sideways_rsi_required': True}.
[I 2025-09-01 10:33:34,841] Trial 551 finished with values: [-0.08845503267092503, 0.0883009223882216] and parameters: {'p_sma': 13, 'p_std': 8, 'p_atr': 13, 'p_adx': 14, 'rsi_period': 33, 'ema1': 6, 'ema2': 10, 'slip_atr_k': 0.016533979241826424, 'slip_spread_k': 0.7683131534922211, 'spread_hl_frac': 0.014986094845708913, 'bb_std_mult': 0.9105589305697432, 'rsi_os': 19, 'rsi_ob': 63, 'vol_spike': 0.054377549305739986, 'adx_thresh': 24.78936426246991, 'atr_min_pct': 0.01559103548555375, 'atr_max_pct': 0.01627142507203563, 'tp_mult': 1.5402027647171241, 'tsl_mult': 0.08317478882800591, 'strategy': 'breakout', 'time_stop': 153, 'use_sma': True, 'use_atr': False, 'use_adx': False, 'use_ema': False, 'use_spike': False, 'rsi_required': True, 'edge_k': 1.6064789635875916, 'edge_cap': 0.412884228118407, 'bull_strategy': 'mean_reversion', 'bull_bb_std_mult': 0.5065878116560198, 'bull_rsi_os': 18, 'bull_rsi_ob': 73, 'bull_adx_thresh': 13.999583602025044, 'bull_atr_min_pct': 0.0006311905859763955, 'bull_atr_max_pct': 0.02191060792860933, 'bull_tp_mult': 1.1517959448231714, 'bull_tsl_mult': 0.7492050701254207, 'bull_time_stop': 269, 'bull_use_sma': True, 'bull_use_ema': False, 'bull_use_atr': False, 'bull_use_adx': True, 'bull_use_spike': True, 'bull_rsi_required': True, 'bear_strategy': 'breakout', 'bear_bb_std_mult': 1.2189878402992957, 'bear_rsi_os': 18, 'bear_rsi_ob': 84, 'bear_adx_thresh': 26.48046793991695, 'bear_atr_min_pct': 0.003835503138435485, 'bear_atr_max_pct': 0.13045598961633548, 'bear_tp_mult': 1.967375250112482, 'bear_tsl_mult': 0.3528077817722179, 'bear_time_stop': 262, 'bear_use_sma': False, 'bear_use_ema': True, 'bear_use_atr': False, 'bear_use_adx': True, 'bear_use_spike': True, 'bear_rsi_required': False, 'sideways_strategy': 'breakout', 'sideways_bb_std_mult': 0.5017113658712282, 'sideways_rsi_os': 55, 'sideways_rsi_ob': 77, 'sideways_adx_thresh': 29.142444193400607, 'sideways_atr_min_pct': 0.00659921540860152, 'sideways_atr_max_pct': 0.0563448423785318, 'sideways_tp_mult': 2.1418552282936782, 'sideways_tsl_mult': 0.3068345917658808, 'sideways_time_stop': 239, 'sideways_use_sma': False, 'sideways_use_ema': True, 'sideways_use_atr': True, 'sideways_use_adx': False, 'sideways_use_spike': False, 'sideways_rsi_required': True}.
[I 2025-09-01 10:34:16,414] Trial 556 finished with values: [-1000000000.0, 1000000000.0] and parameters: {'p_sma': 13, 'p_std': 26, 'p_atr': 14, 'p_adx': 22, 'rsi_period': 45, 'ema1': 9, 'ema2': 10, 'slip_atr_k': 0.011617164521121168, 'slip_spread_k': 0.8353296177234351, 'spread_hl_frac': 0.013780754443667512, 'bb_std_mult': 1.0955680091598001, 'rsi_os': 14, 'rsi_ob': 60, 'vol_spike': 0.06427515175206472, 'adx_thresh': 24.712365359958206, 'atr_min_pct': 0.01631895933708439, 'atr_max_pct': 0.017927767830711407, 'tp_mult': 1.4326093380138671, 'tsl_mult': 0.1069111452589972, 'strategy': 'mean_reversion', 'time_stop': 138, 'use_sma': False, 'use_atr': False, 'use_adx': True, 'use_ema': False, 'use_spike': False, 'rsi_required': True, 'edge_k': 1.5528396240731261, 'edge_cap': 0.4181238452368188, 'bull_strategy': 'mean_reversion', 'bull_bb_std_mult': 0.5567694832008937, 'bull_rsi_os': 22, 'bull_rsi_ob': 75, 'bull_adx_thresh': 14.815276232038284, 'bull_atr_min_pct': 0.000655226769930471, 'bull_atr_max_pct': 0.012601702650588156, 'bull_tp_mult': 1.1268981165522534, 'bull_tsl_mult': 0.6751816902138885, 'bull_time_stop': 260, 'bull_use_sma': True, 'bull_use_ema': True, 'bull_use_atr': False, 'bull_use_adx': True, 'bull_use_spike': True, 'bull_rsi_required': True, 'bear_strategy': 'breakout', 'bear_bb_std_mult': 1.2627630217930161, 'bear_rsi_os': 15, 'bear_rsi_ob': 83, 'bear_adx_thresh': 27.245685520263475, 'bear_atr_min_pct': 0.0030209478104173625, 'bear_atr_max_pct': 0.1219674797385086, 'bear_tp_mult': 2.5136281008281323, 'bear_tsl_mult': 0.3428212381810111, 'bear_time_stop': 274, 'bear_use_sma': True, 'bear_use_ema': False, 'bear_use_atr': False, 'bear_use_adx': True, 'bear_use_spike': True, 'bear_rsi_required': False, 'sideways_strategy': 'breakout', 'sideways_bb_std_mult': 0.6434493532434455, 'sideways_rsi_os': 39, 'sideways_rsi_ob': 84, 'sideways_adx_thresh': 27.78332837175182, 'sideways_atr_min_pct': 0.006591961018460131, 'sideways_atr_max_pct': 0.05693466978470379, 'sideways_tp_mult': 2.0771763937505856, 'sideways_tsl_mult': 0.309456970588044, 'sideways_time_stop': 248, 'sideways_use_sma': False, 'sideways_use_ema': True, 'sideways_use_atr': True, 'sideways_use_adx': False, 'sideways_use_spike': False, 'sideways_rsi_required': True}.
[I 2025-09-01 10:34:16,782] Trial 557 finished with values: [-1000000000.0, 1000000000.0] and parameters: {'p_sma': 13, 'p_std': 27, 'p_atr': 14, 'p_adx': 22, 'rsi_period': 45, 'ema1': 9, 'ema2': 10, 'slip_atr_k': 0.018477807096730185, 'slip_spread_k': 0.8259894068605568, 'spread_hl_frac': 0.013723047019151054, 'bb_std_mult': 0.9470248273393692, 'rsi_os': 16, 'rsi_ob': 60, 'vol_spike': 0.062482831552866575, 'adx_thresh': 22.793184413482248, 'atr_min_pct': 0.016343695195176, 'atr_max_pct': 0.017579569997462782, 'tp_mult': 1.443667672937447, 'tsl_mult': 0.14444443497004783, 'strategy': 'mean_reversion', 'time_stop': 137, 'use_sma': False, 'use_atr': False, 'use_adx': True, 'use_ema': False, 'use_spike': False, 'rsi_required': True, 'edge_k': 1.545539069951431, 'edge_cap': 0.10345162348152473, 'bull_strategy': 'mean_reversion', 'bull_bb_std_mult': 0.5677061311945729, 'bull_rsi_os': 21, 'bull_rsi_ob': 73, 'bull_adx_thresh': 14.788207544396691, 'bull_atr_min_pct': 0.025417115786072267, 'bull_atr_max_pct': 0.010222634127408634, 'bull_tp_mult': 1.0938829698607297, 'bull_tsl_mult': 0.6697612734095589, 'bull_time_stop': 260, 'bull_use_sma': True, 'bull_use_ema': True, 'bull_use_atr': False, 'bull_use_adx': True, 'bull_use_spike': True, 'bull_rsi_required': True, 'bear_strategy': 'breakout', 'bear_bb_std_mult': 1.20471168230169, 'bear_rsi_os': 19, 'bear_rsi_ob': 83, 'bear_adx_thresh': 25.614853563458055, 'bear_atr_min_pct': 0.0031217160566180003, 'bear_atr_max_pct': 0.09714069581938059, 'bear_tp_mult': 2.517842126156346, 'bear_tsl_mult': 0.3487584562837545, 'bear_time_stop': 271, 'bear_use_sma': True, 'bear_use_ema': False, 'bear_use_atr': False, 'bear_use_adx': True, 'bear_use_spike': True, 'bear_rsi_required': False, 'sideways_strategy': 'breakout', 'sideways_bb_std_mult': 0.650917378084272, 'sideways_rsi_os': 9, 'sideways_rsi_ob': 86, 'sideways_adx_thresh': 28.183990236638735, 'sideways_atr_min_pct': 0.007147047270922289, 'sideways_atr_max_pct': 0.05764734003191481, 'sideways_tp_mult': 2.0837647004379085, 'sideways_tsl_mult': 0.28638426753484486, 'sideways_time_stop': 247, 'sideways_use_sma': False, 'sideways_use_ema': True, 'sideways_use_atr': True, 'sideways_use_adx': False, 'sideways_use_spike': False, 'sideways_rsi_required': True}.
[I 2025-09-01 10:34:16,960] Trial 558 finished with values: [-1000000000.0, 1000000000.0] and parameters: {'p_sma': 13, 'p_std': 30, 'p_atr': 14, 'p_adx': 22, 'rsi_period': 45, 'ema1': 8, 'ema2': 12, 'slip_atr_k': 0.02092012216649452, 'slip_spread_k': 0.8208721045869726, 'spread_hl_frac': 0.016527837743543283, 'bb_std_mult': 1.042708490377458, 'rsi_os': 13, 'rsi_ob': 61, 'vol_spike': 0.06456812236957313, 'adx_thresh': 24.284326493004794, 'atr_min_pct': 0.01629133908816038, 'atr_max_pct': 0.02656242312430243, 'tp_mult': 1.4556281507791506, 'tsl_mult': 0.11700256833362231, 'strategy': 'mean_reversion', 'time_stop': 136, 'use_sma': False, 'use_atr': True, 'use_adx': True, 'use_ema': False, 'use_spike': False, 'rsi_required': True, 'edge_k': 1.5488838238421525, 'edge_cap': 0.10376831206638598, 'bull_strategy': 'mean_reversion', 'bull_bb_std_mult': 0.7429382933829979, 'bull_rsi_os': 16, 'bull_rsi_ob': 75, 'bull_adx_thresh': 14.931211086396374, 'bull_atr_min_pct': 0.0017334341871607468, 'bull_atr_max_pct': 0.013387835485473296, 'bull_tp_mult': 1.1004313976730837, 'bull_tsl_mult': 0.8260383282761492, 'bull_time_stop': 260, 'bull_use_sma': True, 'bull_use_ema': True, 'bull_use_atr': False, 'bull_use_adx': True, 'bull_use_spike': True, 'bull_rsi_required': True, 'bear_strategy': 'breakout', 'bear_bb_std_mult': 2.0666551859838598, 'bear_rsi_os': 19, 'bear_rsi_ob': 83, 'bear_adx_thresh': 27.203896620479394, 'bear_atr_min_pct': 0.002941798477901528, 'bear_atr_max_pct': 0.01311669900057022, 'bear_tp_mult': 2.0015473859965867, 'bear_tsl_mult': 0.31014921347182783, 'bear_time_stop': 270, 'bear_use_sma': True, 'bear_use_ema': False, 'bear_use_atr': False, 'bear_use_adx': True, 'bear_use_spike': True, 'bear_rsi_required': False, 'sideways_strategy': 'breakout', 'sideways_bb_std_mult': 0.6155265159270452, 'sideways_rsi_os': 38, 'sideways_rsi_ob': 68, 'sideways_adx_thresh': 28.082685712012413, 'sideways_atr_min_pct': 0.007234402375135996, 'sideways_atr_max_pct': 0.05724635111891642, 'sideways_tp_mult': 2.099309655870938, 'sideways_tsl_mult': 0.27918564063896, 'sideways_time_stop': 249, 'sideways_use_sma': False, 'sideways_use_ema': True, 'sideways_use_atr': True, 'sideways_use_adx': False, 'sideways_use_spike': False, 'sideways_rsi_required': True}.
