[I 2025-09-01 14:48:24,608] Trial 340 finished with values: [-0.022828165858935434, 0.027216803550087855] and parameters: {'p_sma': 29, 'p_std': 27, 'p_atr': 12, 'p_adx': 13, 'rsi_period': 82, 'ema1': 25, 'ema2': 56, 'slip_atr_k': 0.0041339474863106304, 'slip_spread_k': 0.42194100349254576, 'spread_hl_frac': 0.0071242929614198985, 'bb_std_mult': 2.2898957197832757, 'rsi_os': 31, 'rsi_ob': 76, 'vol_spike': 0.07776704207518352, 'adx_thresh': 28.46562750780655, 'atr_min_pct': 0.015999946523931465, 'atr_max_pct': 0.07170898244346446, 'tp_mult': 2.8641483059746387, 'tsl_mult': 0.42719093572527794, 'strategy': 'breakout', 'time_stop': 17, 'use_sma': False, 'use_atr': True, 'use_adx': False, 'use_ema': False, 'use_spike': True, 'rsi_required': False, 'edge_k': 1.6727608518402113, 'edge_cap': 0.8670167510751499, 'bull_strategy': 'breakout', 'bull_bb_std_mult': 1.007540348210879, 'bull_rsi_os': 24, 'bull_rsi_ob': 65, 'bull_adx_thresh': 5.488973887386219, 'bull_atr_min_pct': 0.011332580430340966, 'bull_atr_max_pct': 0.026122060940402016, 'bull_tp_mult': 1.4835785929939784, 'bull_tsl_mult': 0.9537993374358, 'bull_time_stop': 139, 'bull_use_sma': False, 'bull_use_ema': True, 'bull_use_atr': False, 'bull_use_adx': True, 'bull_use_spike': True, 'bull_rsi_required': False, 'bear_strategy': 'breakout', 'bear_bb_std_mult': 1.436030551203787, 'bear_rsi_os': 49, 'bear_rsi_ob': 51, 'bear_adx_thresh': 8.655060052231626, 'bear_atr_min_pct': 0.004361393944693797, 'bear_atr_max_pct': 0.039544846204947956, 'bear_tp_mult': 1.5772252319815223, 'bear_tsl_mult': 0.7029638050933187, 'bear_time_stop': 261, 'bear_use_sma': True, 'bear_use_ema': False, 'bear_use_atr': False, 'bear_use_adx': False, 'bear_use_spike': True, 'bear_rsi_required': False, 'sideways_strategy': 'mean_reversion', 'sideways_bb_std_mult': 1.0683279405673176, 'sideways_rsi_os': 24, 'sideways_rsi_ob': 75, 'sideways_adx_thresh': 30.595575041887642, 'sideways_atr_min_pct': 0.01174274399883756, 'sideways_atr_max_pct': 0.04554530229760191, 'sideways_tp_mult': 2.306134523150223, 'sideways_tsl_mult': 0.7891559983455253, 'sideways_time_stop': 49, 'sideways_use_sma': True, 'sideways_use_ema': False, 'sideways_use_atr': True, 'sideways_use_adx': True, 'sideways_use_spike': False, 'sideways_rsi_required': False}.
[I 2025-09-01 14:49:02,310] Trial 346 finished with values: [-0.03241116585233739, 0.035673335870271154] and parameters: {'p_sma': 29, 'p_std': 27, 'p_atr': 11, 'p_adx': 13, 'rsi_period': 17, 'ema1': 25, 'ema2': 56, 'slip_atr_k': 0.00022355985161749171, 'slip_spread_k': 0.38780255568255717, 'spread_hl_frac': 0.008119569494398297, 'bb_std_mult': 2.2729689637390447, 'rsi_os': 31, 'rsi_ob': 77, 'vol_spike': 0.09011570668057683, 'adx_thresh': 29.427484277292137, 'atr_min_pct': 0.015561813636037767, 'atr_max_pct': 0.07041827079124831, 'tp_mult': 2.3787519487025177, 'tsl_mult': 0.4433842100912588, 'strategy': 'breakout', 'time_stop': 19, 'use_sma': True, 'use_atr': True, 'use_adx': True, 'use_ema': False, 'use_spike': False, 'rsi_required': True, 'edge_k': 1.6766760947807482, 'edge_cap': 0.8905718586548168, 'bull_strategy': 'breakout', 'bull_bb_std_mult': 1.0409508960074616, 'bull_rsi_os': 25, 'bull_rsi_ob': 63, 'bull_adx_thresh': 5.900856823930928, 'bull_atr_min_pct': 0.011908176210416494, 'bull_atr_max_pct': 0.03176489564421384, 'bull_tp_mult': 1.4221099882569432, 'bull_tsl_mult': 0.9068186771869845, 'bull_time_stop': 145, 'bull_use_sma': False, 'bull_use_ema': False, 'bull_use_atr': False, 'bull_use_adx': False, 'bull_use_spike': False, 'bull_rsi_required': True, 'bear_strategy': 'breakout', 'bear_bb_std_mult': 1.4101121518625417, 'bear_rsi_os': 51, 'bear_rsi_ob': 50, 'bear_adx_thresh': 7.742310288708092, 'bear_atr_min_pct': 0.003911620071565312, 'bear_atr_max_pct': 0.04566691975238729, 'bear_tp_mult': 1.5680673199933595, 'bear_tsl_mult': 0.6916166659802391, 'bear_time_stop': 259, 'bear_use_sma': True, 'bear_use_ema': False, 'bear_use_atr': False, 'bear_use_adx': False, 'bear_use_spike': True, 'bear_rsi_required': True, 'sideways_strategy': 'breakout', 'sideways_bb_std_mult': 1.1615294819716933, 'sideways_rsi_os': 24, 'sideways_rsi_ob': 79, 'sideways_adx_thresh': 32.43091838870375, 'sideways_atr_min_pct': 0.013153652528864756, 'sideways_atr_max_pct': 0.04420848640615876, 'sideways_tp_mult': 2.1452382725691925, 'sideways_tsl_mult': 0.7983937459885161, 'sideways_time_stop': 62, 'sideways_use_sma': False, 'sideways_use_ema': False, 'sideways_use_atr': False, 'sideways_use_adx': True, 'sideways_use_spike': False, 'sideways_rsi_required': False}.
[I 2025-09-01 14:49:02,634] Trial 344 finished with values: [-0.025898979167179426, 0.0298062327786201] and parameters: {'p_sma': 28, 'p_std': 26, 'p_atr': 12, 'p_adx': 13, 'rsi_period': 82, 'ema1': 26, 'ema2': 56, 'slip_atr_k': 0.009958352633862697, 'slip_spread_k': 0.3982034242441053, 'spread_hl_frac': 0.007678264659718105, 'bb_std_mult': 2.2542698819050146, 'rsi_os': 31, 'rsi_ob': 77, 'vol_spike': 0.08721138938888148, 'adx_thresh': 29.412948952366687, 'atr_min_pct': 0.015473776291231837, 'atr_max_pct': 0.07055578773204686, 'tp_mult': 2.3790789568801727, 'tsl_mult': 0.4352716028751915, 'strategy': 'breakout', 'time_stop': 21, 'use_sma': False, 'use_atr': True, 'use_adx': True, 'use_ema': False, 'use_spike': False, 'rsi_required': True, 'edge_k': 1.6683978412645388, 'edge_cap': 0.8889356823814207, 'bull_strategy': 'breakout', 'bull_bb_std_mult': 1.0939423356894187, 'bull_rsi_os': 26, 'bull_rsi_ob': 64, 'bull_adx_thresh': 5.7017629931702, 'bull_atr_min_pct': 0.013423471035653778, 'bull_atr_max_pct': 0.03347323222968199, 'bull_tp_mult': 1.4406314018535746, 'bull_tsl_mult': 0.9378151637423862, 'bull_time_stop': 146, 'bull_use_sma': False, 'bull_use_ema': True, 'bull_use_atr': False, 'bull_use_adx': True, 'bull_use_spike': True, 'bull_rsi_required': False, 'bear_strategy': 'breakout', 'bear_bb_std_mult': 1.5142106224425285, 'bear_rsi_os': 50, 'bear_rsi_ob': 49, 'bear_adx_thresh': 8.464162405873447, 'bear_atr_min_pct': 0.00433053328318713, 'bear_atr_max_pct': 0.045266635842291285, 'bear_tp_mult': 1.6108767881284696, 'bear_tsl_mult': 0.6958521549375151, 'bear_time_stop': 258, 'bear_use_sma': True, 'bear_use_ema': False, 'bear_use_atr': False, 'bear_use_adx': False, 'bear_use_spike': True, 'bear_rsi_required': True, 'sideways_strategy': 'mean_reversion', 'sideways_bb_std_mult': 1.1978491493267158, 'sideways_rsi_os': 25, 'sideways_rsi_ob': 79, 'sideways_adx_thresh': 32.151692643037, 'sideways_atr_min_pct': 0.011741540434831579, 'sideways_atr_max_pct': 0.04424733186815347, 'sideways_tp_mult': 2.336958154730217, 'sideways_tsl_mult': 0.7919327944046651, 'sideways_time_stop': 67, 'sideways_use_sma': True, 'sideways_use_ema': False, 'sideways_use_atr': False, 'sideways_use_adx': True, 'sideways_use_spike': False, 'sideways_rsi_required': False}.
[I 2025-09-01 14:49:03,332] Trial 343 finished with values: [-0.024010695186140074, 0.02884653298883253] and parameters: {'p_sma': 29, 'p_std': 28, 'p_atr': 11, 'p_adx': 13, 'rsi_period': 10, 'ema1': 26, 'ema2': 56, 'slip_atr_k': 0.00975401458803321, 'slip_spread_k': 0.3908052038853147, 'spread_hl_frac': 0.007822917031142641, 'bb_std_mult': 2.263906292646202, 'rsi_os': 30, 'rsi_ob': 77, 'vol_spike': 0.08507180162214685, 'adx_thresh': 29.29921078998928, 'atr_min_pct': 0.01552239133930623, 'atr_max_pct': 0.13899639294573884, 'tp_mult': 2.377366005382874, 'tsl_mult': 0.442972570687856, 'strategy': 'breakout', 'time_stop': 19, 'use_sma': False, 'use_atr': True, 'use_adx': False, 'use_ema': False, 'use_spike': False, 'rsi_required': False, 'edge_k': 1.7816876232614018, 'edge_cap': 0.8816254507512333, 'bull_strategy': 'breakout', 'bull_bb_std_mult': 1.0269670184450688, 'bull_rsi_os': 25, 'bull_rsi_ob': 63, 'bull_adx_thresh': 5.534902280801287, 'bull_atr_min_pct': 0.013310069996772705, 'bull_atr_max_pct': 0.02132651048062581, 'bull_tp_mult': 1.4182081112113814, 'bull_tsl_mult': 0.34387089442764174, 'bull_time_stop': 146, 'bull_use_sma': False, 'bull_use_ema': True, 'bull_use_atr': False, 'bull_use_adx': False, 'bull_use_spike': True, 'bull_rsi_required': False, 'bear_strategy': 'breakout', 'bear_bb_std_mult': 1.43714576328669, 'bear_rsi_os': 49, 'bear_rsi_ob': 49, 'bear_adx_thresh': 7.851499246170131, 'bear_atr_min_pct': 0.004378708109209595, 'bear_atr_max_pct': 0.043788593192936, 'bear_tp_mult': 1.5745124009907852, 'bear_tsl_mult': 0.6886992392065362, 'bear_time_stop': 258, 'bear_use_sma': True, 'bear_use_ema': False, 'bear_use_atr': False, 'bear_use_adx': False, 'bear_use_spike': True, 'bear_rsi_required': False, 'sideways_strategy': 'breakout', 'sideways_bb_std_mult': 1.1842701025596918, 'sideways_rsi_os': 25, 'sideways_rsi_ob': 79, 'sideways_adx_thresh': 31.61953723447092, 'sideways_atr_min_pct': 0.011683099502072684, 'sideways_atr_max_pct': 0.04415135585564161, 'sideways_tp_mult': 2.2808212956079967, 'sideways_tsl_mult': 0.7928935039983402, 'sideways_time_stop': 46, 'sideways_use_sma': False, 'sideways_use_ema': False, 'sideways_use_atr': False, 'sideways_use_adx': True, 'sideways_use_spike': False, 'sideways_rsi_required': False}.
[I 2025-09-01 14:49:03,442] Trial 345 finished with values: [-0.02530717898566659, 0.029205369115684176] and parameters: {'p_sma': 29, 'p_std': 27, 'p_atr': 11, 'p_adx': 13, 'rsi_period': 29, 'ema1': 25, 'ema2': 57, 'slip_atr_k': 3.9085709094744195e-05, 'slip_spread_k': 0.3923913768542414, 'spread_hl_frac': 0.007907855082390907, 'bb_std_mult': 2.263674011768355, 'rsi_os': 31, 'rsi_ob': 77, 'vol_spike': 0.08839503216940883, 'adx_thresh': 29.37311427711814, 'atr_min_pct': 0.015482347894341055, 'atr_max_pct': 0.07008499566693326, 'tp_mult': 2.3881637241112754, 'tsl_mult': 0.405242040392004, 'strategy': 'breakout', 'time_stop': 22, 'use_sma': True, 'use_atr': True, 'use_adx': True, 'use_ema': False, 'use_spike': False, 'rsi_required': True, 'edge_k': 1.667248619351547, 'edge_cap': 0.8728119095608498, 'bull_strategy': 'breakout', 'bull_bb_std_mult': 1.0929271599147636, 'bull_rsi_os': 25, 'bull_rsi_ob': 64, 'bull_adx_thresh': 5.057524715330348, 'bull_atr_min_pct': 0.01180762276577356, 'bull_atr_max_pct': 0.027545205708417037, 'bull_tp_mult': 1.4519504769722111, 'bull_tsl_mult': 0.16548696009256303, 'bull_time_stop': 146, 'bull_use_sma': False, 'bull_use_ema': True, 'bull_use_atr': False, 'bull_use_adx': False, 'bull_use_spike': False, 'bull_rsi_required': True, 'bear_strategy': 'breakout', 'bear_bb_std_mult': 1.4259384835818059, 'bear_rsi_os': 50, 'bear_rsi_ob': 50, 'bear_adx_thresh': 7.822343650567086, 'bear_atr_min_pct': 0.00424446328197012, 'bear_atr_max_pct': 0.0450577776358189, 'bear_tp_mult': 1.5473580778046656, 'bear_tsl_mult': 0.6929121146565649, 'bear_time_stop': 257, 'bear_use_sma': True, 'bear_use_ema': False, 'bear_use_atr': False, 'bear_use_adx': False, 'bear_use_spike': True, 'bear_rsi_required': True, 'sideways_strategy': 'breakout', 'sideways_bb_std_mult': 1.156828302743271, 'sideways_rsi_os': 24, 'sideways_rsi_ob': 78, 'sideways_adx_thresh': 32.34622973460763, 'sideways_atr_min_pct': 0.011922992820879172, 'sideways_atr_max_pct': 0.044703028370427916, 'sideways_tp_mult': 2.149742278374676, 'sideways_tsl_mult': 0.7927508685231212, 'sideways_time_stop': 62, 'sideways_use_sma': False, 'sideways_use_ema': False, 'sideways_use_atr': False, 'sideways_use_adx': True, 'sideways_use_spike': False, 'sideways_rsi_required': False}.
[I 2025-09-01 14:49:40,617] Trial 349 finished with values: [-0.04054400244033751, 0.04059709963262684] and parameters: {'p_sma': 12, 'p_std': 28, 'p_atr': 12, 'p_adx': 13, 'rsi_period': 9, 'ema1': 26, 'ema2': 54, 'slip_atr_k': 0.0050344691324764445, 'slip_spread_k': 0.36279701926489405, 'spread_hl_frac': 0.009190779936669793, 'bb_std_mult': 2.319876368555788, 'rsi_os': 29, 'rsi_ob': 78, 'vol_spike': 0.07500262098193919, 'adx_thresh': 28.45273623504374, 'atr_min_pct': 0.014365951530808368, 'atr_max_pct': 0.07306157855200154, 'tp_mult': 2.880336878857323, 'tsl_mult': 0.42980806794502724, 'strategy': 'breakout', 'time_stop': 13, 'use_sma': False, 'use_atr': True, 'use_adx': False, 'use_ema': True, 'use_spike': True, 'rsi_required': False, 'edge_k': 1.7136480263069627, 'edge_cap': 0.9229632023288122, 'bull_strategy': 'mean_reversion', 'bull_bb_std_mult': 0.9973362818998663, 'bull_rsi_os': 23, 'bull_rsi_ob': 64, 'bull_adx_thresh': 6.31560679877369, 'bull_atr_min_pct': 0.013450518061263942, 'bull_atr_max_pct': 0.021947390211642583, 'bull_tp_mult': 1.5268925247998721, 'bull_tsl_mult': 0.9031300891523416, 'bull_time_stop': 137, 'bull_use_sma': True, 'bull_use_ema': True, 'bull_use_atr': False, 'bull_use_adx': True, 'bull_use_spike': False, 'bull_rsi_required': True, 'bear_strategy': 'mean_reversion', 'bear_bb_std_mult': 1.3189109612892662, 'bear_rsi_os': 49, 'bear_rsi_ob': 50, 'bear_adx_thresh': 8.51168743460795, 'bear_atr_min_pct': 0.003490351748268906, 'bear_atr_max_pct': 0.04926591915214689, 'bear_tp_mult': 1.6449635153336595, 'bear_tsl_mult': 0.7202858412347093, 'bear_time_stop': 273, 'bear_use_sma': True, 'bear_use_ema': False, 'bear_use_atr': True, 'bear_use_adx': True, 'bear_use_spike': True, 'bear_rsi_required': False, 'sideways_strategy': 'mean_reversion', 'sideways_bb_std_mult': 1.2092882634665638, 'sideways_rsi_os': 26, 'sideways_rsi_ob': 89, 'sideways_adx_thresh': 32.58441283554558, 'sideways_atr_min_pct': 0.012604863043818653, 'sideways_atr_max_pct': 0.04114634984413904, 'sideways_tp_mult': 2.287595773724602, 'sideways_tsl_mult': 0.8027950865663173, 'sideways_time_stop': 55, 'sideways_use_sma': True, 'sideways_use_ema': False, 'sideways_use_atr': True, 'sideways_use_adx': False, 'sideways_use_spike': False, 'sideways_rsi_required': True}.
[I 2025-09-01 14:49:41,105] Trial 348 finished with values: [-0.01935721739135443, 0.021600041940902346] and parameters: {'p_sma': 12, 'p_std': 28, 'p_atr': 12, 'p_adx': 13, 'rsi_period': 66, 'ema1': 26, 'ema2': 57, 'slip_atr_k': 0.00445995780540826, 'slip_spread_k': 0.3561942588703635, 'spread_hl_frac': 0.008727298941606036, 'bb_std_mult': 2.3044578396914295, 'rsi_os': 30, 'rsi_ob': 78, 'vol_spike': 0.07790153985495442, 'adx_thresh': 28.42674500845368, 'atr_min_pct': 0.017614261627251156, 'atr_max_pct': 0.0684952095555338, 'tp_mult': 2.1797184672123406, 'tsl_mult': 0.40776820465590624, 'strategy': 'breakout', 'time_stop': 12, 'use_sma': True, 'use_atr': True, 'use_adx': True, 'use_ema': True, 'use_spike': True, 'rsi_required': True, 'edge_k': 1.7176610012587015, 'edge_cap': 0.8746506486877142, 'bull_strategy': 'mean_reversion', 'bull_bb_std_mult': 1.0699350725557761, 'bull_rsi_os': 24, 'bull_rsi_ob': 68, 'bull_adx_thresh': 6.559801733157709, 'bull_atr_min_pct': 0.012541891511506366, 'bull_atr_max_pct': 0.026361437505739414, 'bull_tp_mult': 1.5059909630600874, 'bull_tsl_mult': 0.33999516374017213, 'bull_time_stop': 136, 'bull_use_sma': False, 'bull_use_ema': True, 'bull_use_atr': False, 'bull_use_adx': True, 'bull_use_spike': False, 'bull_rsi_required': True, 'bear_strategy': 'breakout', 'bear_bb_std_mult': 1.4257941409675436, 'bear_rsi_os': 50, 'bear_rsi_ob': 49, 'bear_adx_thresh': 7.820319632775995, 'bear_atr_min_pct': 0.0036997198738706986, 'bear_atr_max_pct': 0.04932283378969146, 'bear_tp_mult': 1.6449902560475376, 'bear_tsl_mult': 0.7089142683558081, 'bear_time_stop': 273, 'bear_use_sma': True, 'bear_use_ema': False, 'bear_use_atr': False, 'bear_use_adx': True, 'bear_use_spike': True, 'bear_rsi_required': True, 'sideways_strategy': 'mean_reversion', 'sideways_bb_std_mult': 1.058636406327197, 'sideways_rsi_os': 23, 'sideways_rsi_ob': 78, 'sideways_adx_thresh': 31.742992931488036, 'sideways_atr_min_pct': 0.012610706945731529, 'sideways_atr_max_pct': 0.040893809657825374, 'sideways_tp_mult': 2.294804046375169, 'sideways_tsl_mult': 0.7652133091498591, 'sideways_time_stop': 64, 'sideways_use_sma': True, 'sideways_use_ema': False, 'sideways_use_atr': True, 'sideways_use_adx': True, 'sideways_use_spike': False, 'sideways_rsi_required': True}.
[I 2025-09-01 14:49:41,485] Trial 347 finished with values: [-0.023276402688146458, 0.026943120090664553] and parameters: {'p_sma': 28, 'p_std': 26, 'p_atr': 12, 'p_adx': 13, 'rsi_period': 51, 'ema1': 26, 'ema2': 57, 'slip_atr_k': 0.004487032066305753, 'slip_spread_k': 0.4186780945423382, 'spread_hl_frac': 0.007417718123853237, 'bb_std_mult': 2.2528500319839218, 'rsi_os': 31, 'rsi_ob': 78, 'vol_spike': 0.08594474015354561, 'adx_thresh': 29.022034862950903, 'atr_min_pct': 0.016576769594279863, 'atr_max_pct': 0.06924430409608238, 'tp_mult': 2.7352210170385556, 'tsl_mult': 0.4104133745087497, 'strategy': 'breakout', 'time_stop': 23, 'use_sma': True, 'use_atr': True, 'use_adx': True, 'use_ema': True, 'use_spike': False, 'rsi_required': True, 'edge_k': 1.7009819651700984, 'edge_cap': 0.8734358060804704, 'bull_strategy': 'mean_reversion', 'bull_bb_std_mult': 1.1025294194005153, 'bull_rsi_os': 24, 'bull_rsi_ob': 66, 'bull_adx_thresh': 5.371014782017812, 'bull_atr_min_pct': 0.013397934516582681, 'bull_atr_max_pct': 0.024472425986857213, 'bull_tp_mult': 1.4840009689443723, 'bull_tsl_mult': 0.17469009455496898, 'bull_time_stop': 136, 'bull_use_sma': False, 'bull_use_ema': True, 'bull_use_atr': False, 'bull_use_adx': True, 'bull_use_spike': False, 'bull_rsi_required': True, 'bear_strategy': 'breakout', 'bear_bb_std_mult': 1.5011422756048174, 'bear_rsi_os': 49, 'bear_rsi_ob': 49, 'bear_adx_thresh': 8.535313723189722, 'bear_atr_min_pct': 0.004303622410281014, 'bear_atr_max_pct': 0.049681590707383615, 'bear_tp_mult': 1.6215724954275161, 'bear_tsl_mult': 0.7229444914224625, 'bear_time_stop': 273, 'bear_use_sma': True, 'bear_use_ema': False, 'bear_use_atr': False, 'bear_use_adx': False, 'bear_use_spike': True, 'bear_rsi_required': True, 'sideways_strategy': 'mean_reversion', 'sideways_bb_std_mult': 1.1756876629334705, 'sideways_rsi_os': 26, 'sideways_rsi_ob': 78, 'sideways_adx_thresh': 32.090883332411416, 'sideways_atr_min_pct': 0.011856607977022211, 'sideways_atr_max_pct': 0.04394903086649203, 'sideways_tp_mult': 2.0950976722888353, 'sideways_tsl_mult': 0.7958793984171194, 'sideways_time_stop': 58, 'sideways_use_sma': True, 'sideways_use_ema': False, 'sideways_use_atr': True, 'sideways_use_adx': True, 'sideways_use_spike': False, 'sideways_rsi_required': True}.
[I 2025-09-01 14:49:41,795] Trial 350 finished with values: [-0.0447590610362375, 0.045010601771592] and parameters: {'p_sma': 28, 'p_std': 28, 'p_atr': 12, 'p_adx': 13, 'rsi_period': 9, 'ema1': 26, 'ema2': 54, 'slip_atr_k': 0.004455114860526748, 'slip_spread_k': 0.42413937175587535, 'spread_hl_frac': 0.008893882146546269, 'bb_std_mult': 2.305973503316523, 'rsi_os': 29, 'rsi_ob': 78, 'vol_spike': 0.08027590323161261, 'adx_thresh': 28.529880504156058, 'atr_min_pct': 0.01817407071476973, 'atr_max_pct': 0.06860141996046897, 'tp_mult': 2.1987747933098776, 'tsl_mult': 0.4260926925828115, 'strategy': 'breakout', 'time_stop': 11, 'use_sma': False, 'use_atr': True, 'use_adx': False, 'use_ema': True, 'use_spike': True, 'rsi_required': False, 'edge_k': 1.718014198046339, 'edge_cap': 0.8609945344393066, 'bull_strategy': 'mean_reversion', 'bull_bb_std_mult': 0.9972525547564676, 'bull_rsi_os': 24, 'bull_rsi_ob': 64, 'bull_adx_thresh': 6.66233276253776, 'bull_atr_min_pct': 0.01487355289624184, 'bull_atr_max_pct': 0.09930579393484118, 'bull_tp_mult': 1.4974238852463901, 'bull_tsl_mult': 0.9002706661854021, 'bull_time_stop': 132, 'bull_use_sma': True, 'bull_use_ema': True, 'bull_use_atr': False, 'bull_use_adx': True, 'bull_use_spike': False, 'bull_rsi_required': True, 'bear_strategy': 'mean_reversion', 'bear_bb_std_mult': 1.301393197819092, 'bear_rsi_os': 51, 'bear_rsi_ob': 50, 'bear_adx_thresh': 8.509313182620906, 'bear_atr_min_pct': 0.0034916085237628224, 'bear_atr_max_pct': 0.04905534533903518, 'bear_tp_mult': 1.4784550980997577, 'bear_tsl_mult': 0.6865456132738337, 'bear_time_stop': 272, 'bear_use_sma': True, 'bear_use_ema': False, 'bear_use_atr': True, 'bear_use_adx': True, 'bear_use_spike': True, 'bear_rsi_required': False, 'sideways_strategy': 'mean_reversion', 'sideways_bb_std_mult': 1.1021905593704147, 'sideways_rsi_os': 26, 'sideways_rsi_ob': 80, 'sideways_adx_thresh': 32.75325415526853, 'sideways_atr_min_pct': 0.01319023725475978, 'sideways_atr_max_pct': 0.04143759601433725, 'sideways_tp_mult': 2.0909023970622322, 'sideways_tsl_mult': 0.7628771382281334, 'sideways_time_stop': 52, 'sideways_use_sma': True, 'sideways_use_ema': False, 'sideways_use_atr': True, 'sideways_use_adx': False, 'sideways_use_spike': False, 'sideways_rsi_required': True}.
