[I 2025-09-01 14:15:00,900] Trial 129 finished with values: [-1000000000.0, 1000000000.0] and parameters: {'p_sma': 50, 'p_std': 9, 'p_atr': 22, 'p_adx': 7, 'rsi_period': 71, 'ema1': 27, 'ema2': 29, 'slip_atr_k': 0.03438992831501906, 'slip_spread_k': 0.7245761240315454, 'spread_hl_frac': 0.0019354645764368301, 'bb_std_mult': 0.858890197039051, 'rsi_os': 13, 'rsi_ob': 65, 'vol_spike': 0.039743158781035355, 'adx_thresh': 13.024792852725103, 'atr_min_pct': 0.02755359047804567, 'atr_max_pct': 0.013494894432217866, 'tp_mult': 2.2054591206410654, 'tsl_mult': 0.3694098878778967, 'strategy': 'mean_reversion', 'time_stop': 292, 'use_sma': False, 'use_atr': False, 'use_adx': False, 'use_ema': False, 'use_spike': False, 'rsi_required': True, 'edge_k': 0.5042392892705932, 'edge_cap': 0.86832134116932, 'bull_strategy': 'breakout', 'bull_bb_std_mult': 1.4340131854373364, 'bull_rsi_os': 21, 'bull_rsi_ob': 59, 'bull_adx_thresh': 21.94829342929412, 'bull_atr_min_pct': 0.009022106149213043, 'bull_atr_max_pct': 0.03945391520042189, 'bull_tp_mult': 2.6357280837021175, 'bull_tsl_mult': 0.40381854220692026, 'bull_time_stop': 173, 'bull_use_sma': False, 'bull_use_ema': True, 'bull_use_atr': True, 'bull_use_adx': False, 'bull_use_spike': False, 'bull_rsi_required': True, 'bear_strategy': 'mean_reversion', 'bear_bb_std_mult': 2.3421736703636733, 'bear_rsi_os': 53, 'bear_rsi_ob': 82, 'bear_adx_thresh': 18.714377063828557, 'bear_atr_min_pct': 0.020125810644963306, 'bear_atr_max_pct': 0.07710476764345915, 'bear_tp_mult': 2.452092901304097, 'bear_tsl_mult': 0.716490586777762, 'bear_time_stop': 164, 'bear_use_sma': False, 'bear_use_ema': False, 'bear_use_atr': False, 'bear_use_adx': False, 'bear_use_spike': True, 'bear_rsi_required': True, 'sideways_strategy': 'breakout', 'sideways_bb_std_mult': 1.6192275503108022, 'sideways_rsi_os': 13, 'sideways_rsi_ob': 81, 'sideways_adx_thresh': 20.931187565341908, 'sideways_atr_min_pct': 0.0008160096122743141, 'sideways_atr_max_pct': 0.030136377001187466, 'sideways_tp_mult': 2.5816473527786465, 'sideways_tsl_mult': 0.06895541210498951, 'sideways_time_stop': 74, 'sideways_use_sma': False, 'sideways_use_ema': False, 'sideways_use_atr': False, 'sideways_use_adx': False, 'sideways_use_spike': False, 'sideways_rsi_required': False}.
[I 2025-09-01 14:15:43,863] Trial 126 finished with values: [-1000000000.0, 1000000000.0] and parameters: {'p_sma': 27, 'p_std': 54, 'p_atr': 7, 'p_adx': 7, 'rsi_period': 51, 'ema1': 27, 'ema2': 52, 'slip_atr_k': 0.035083114939126886, 'slip_spread_k': 0.532756902177117, 'spread_hl_frac': 0.04236743568909414, 'bb_std_mult': 2.2293758927620764, 'rsi_os': 13, 'rsi_ob': 57, 'vol_spike': 0.0268303121541918, 'adx_thresh': 27.282509180031152, 'atr_min_pct': 0.005419230199449914, 'atr_max_pct': 0.10732427424530046, 'tp_mult': 2.1293683870692965, 'tsl_mult': 0.6132795607255637, 'strategy': 'mean_reversion', 'time_stop': 99, 'use_sma': False, 'use_atr': False, 'use_adx': True, 'use_ema': False, 'use_spike': False, 'rsi_required': True, 'edge_k': 1.3605414661859256, 'edge_cap': 0.8667815136984831, 'bull_strategy': 'breakout', 'bull_bb_std_mult': 3.4814018006899987, 'bull_rsi_os': 10, 'bull_rsi_ob': 58, 'bull_adx_thresh': 14.096822094061576, 'bull_atr_min_pct': 0.00758940803793186, 'bull_atr_max_pct': 0.0382722156620808, 'bull_tp_mult': 2.63994220534393, 'bull_tsl_mult': 0.11860793649349266, 'bull_time_stop': 44, 'bull_use_sma': False, 'bull_use_ema': True, 'bull_use_atr': True, 'bull_use_adx': True, 'bull_use_spike': False, 'bull_rsi_required': True, 'bear_strategy': 'mean_reversion', 'bear_bb_std_mult': 2.988361642360983, 'bear_rsi_os': 20, 'bear_rsi_ob': 47, 'bear_adx_thresh': 5.046924182306495, 'bear_atr_min_pct': 0.011942032642265562, 'bear_atr_max_pct': 0.01774692670626481, 'bear_tp_mult': 1.0793847084108577, 'bear_tsl_mult': 0.7193517536085101, 'bear_time_stop': 259, 'bear_use_sma': False, 'bear_use_ema': True, 'bear_use_atr': False, 'bear_use_adx': True, 'bear_use_spike': False, 'bear_rsi_required': True, 'sideways_strategy': 'breakout', 'sideways_bb_std_mult': 3.4600439953740922, 'sideways_rsi_os': 43, 'sideways_rsi_ob': 81, 'sideways_adx_thresh': 32.44817208148642, 'sideways_atr_min_pct': 0.018544828443642268, 'sideways_atr_max_pct': 0.09751684987448056, 'sideways_tp_mult': 2.753230477923414, 'sideways_tsl_mult': 0.48419963332189614, 'sideways_time_stop': 76, 'sideways_use_sma': False, 'sideways_use_ema': False, 'sideways_use_atr': False, 'sideways_use_adx': False, 'sideways_use_spike': True, 'sideways_rsi_required': False}.
[I 2025-09-01 14:15:44,246] Trial 128 finished with values: [-1000000000.0, 1000000000.0] and parameters: {'p_sma': 26, 'p_std': 9, 'p_atr': 22, 'p_adx': 25, 'rsi_period': 71, 'ema1': 27, 'ema2': 41, 'slip_atr_k': 0.01554508249922423, 'slip_spread_k': 0.7470769237169552, 'spread_hl_frac': 0.039960790441265964, 'bb_std_mult': 0.7526898954351013, 'rsi_os': 13, 'rsi_ob': 65, 'vol_spike': 0.03986577220616911, 'adx_thresh': 30.70795409694493, 'atr_min_pct': 0.013990297866044304, 'atr_max_pct': 0.10458077488077235, 'tp_mult': 2.1934930802112165, 'tsl_mult': 0.22530917152289348, 'strategy': 'mean_reversion', 'time_stop': 97, 'use_sma': False, 'use_atr': False, 'use_adx': False, 'use_ema': False, 'use_spike': False, 'rsi_required': True, 'edge_k': 0.28063691876298635, 'edge_cap': 0.8679769300739314, 'bull_strategy': 'breakout', 'bull_bb_std_mult': 2.7327474084173646, 'bull_rsi_os': 10, 'bull_rsi_ob': 52, 'bull_adx_thresh': 13.755840487078848, 'bull_atr_min_pct': 0.008947508675786437, 'bull_atr_max_pct': 0.040566188912649306, 'bull_tp_mult': 1.2129712816047453, 'bull_tsl_mult': 0.10710030633760587, 'bull_time_stop': 35, 'bull_use_sma': False, 'bull_use_ema': True, 'bull_use_atr': True, 'bull_use_adx': True, 'bull_use_spike': False, 'bull_rsi_required': True, 'bear_strategy': 'mean_reversion', 'bear_bb_std_mult': 1.2003028187360596, 'bear_rsi_os': 20, 'bear_rsi_ob': 49, 'bear_adx_thresh': 6.075433529167723, 'bear_atr_min_pct': 0.005014688066871493, 'bear_atr_max_pct': 0.017208583493281183, 'bear_tp_mult': 2.418587045797961, 'bear_tsl_mult': 0.6710720158212424, 'bear_time_stop': 258, 'bear_use_sma': False, 'bear_use_ema': False, 'bear_use_atr': False, 'bear_use_adx': False, 'bear_use_spike': True, 'bear_rsi_required': True, 'sideways_strategy': 'breakout', 'sideways_bb_std_mult': 1.7285382516575538, 'sideways_rsi_os': 38, 'sideways_rsi_ob': 55, 'sideways_adx_thresh': 31.55749914549983, 'sideways_atr_min_pct': 0.016118875763097156, 'sideways_atr_max_pct': 0.029517630617257404, 'sideways_tp_mult': 1.01462588710613, 'sideways_tsl_mult': 0.9784811478215091, 'sideways_time_stop': 76, 'sideways_use_sma': False, 'sideways_use_ema': False, 'sideways_use_atr': False, 'sideways_use_adx': False, 'sideways_use_spike': False, 'sideways_rsi_required': False}.
[I 2025-09-01 14:15:44,598] Trial 130 finished with values: [-0.15045685886757676, 0.15023005522799238] and parameters: {'p_sma': 27, 'p_std': 18, 'p_atr': 15, 'p_adx': 9, 'rsi_period': 44, 'ema1': 28, 'ema2': 15, 'slip_atr_k': 0.16147760937612882, 'slip_spread_k': 0.7570559797558419, 'spread_hl_frac': 0.02055470472976314, 'bb_std_mult': 2.2687764270628477, 'rsi_os': 7, 'rsi_ob': 75, 'vol_spike': 0.0003132856642109848, 'adx_thresh': 30.351504454899214, 'atr_min_pct': 0.005233792736469034, 'atr_max_pct': 0.07031261194120737, 'tp_mult': 1.187241604776307, 'tsl_mult': 0.6050019652297149, 'strategy': 'mean_reversion', 'time_stop': 27, 'use_sma': False, 'use_atr': False, 'use_adx': True, 'use_ema': False, 'use_spike': True, 'rsi_required': False, 'edge_k': 1.0123100738217665, 'edge_cap': 0.34634236417006103, 'bull_strategy': 'mean_reversion', 'bull_bb_std_mult': 1.2137772028636507, 'bull_rsi_os': 13, 'bull_rsi_ob': 52, 'bull_adx_thresh': 14.049863497685559, 'bull_atr_min_pct': 0.027235774162343594, 'bull_atr_max_pct': 0.1149177859659308, 'bull_tp_mult': 1.0736571353841549, 'bull_tsl_mult': 0.8756195775170734, 'bull_time_stop': 159, 'bull_use_sma': False, 'bull_use_ema': True, 'bull_use_atr': True, 'bull_use_adx': True, 'bull_use_spike': False, 'bull_rsi_required': True, 'bear_strategy': 'mean_reversion', 'bear_bb_std_mult': 2.8353618643446103, 'bear_rsi_os': 55, 'bear_rsi_ob': 49, 'bear_adx_thresh': 5.656851516264069, 'bear_atr_min_pct': 0.0016017296074001715, 'bear_atr_max_pct': 0.01663237432935014, 'bear_tp_mult': 1.6628668403778992, 'bear_tsl_mult': 0.6705682501449473, 'bear_time_stop': 60, 'bear_use_sma': False, 'bear_use_ema': False, 'bear_use_atr': False, 'bear_use_adx': False, 'bear_use_spike': False, 'bear_rsi_required': False, 'sideways_strategy': 'breakout', 'sideways_bb_std_mult': 1.7390411049848034, 'sideways_rsi_os': 33, 'sideways_rsi_ob': 90, 'sideways_adx_thresh': 32.50952906505901, 'sideways_atr_min_pct': 0.016081842603890593, 'sideways_atr_max_pct': 0.06355333659930917, 'sideways_tp_mult': 2.24781879310355, 'sideways_tsl_mult': 0.994978930867198, 'sideways_time_stop': 101, 'sideways_use_sma': False, 'sideways_use_ema': False, 'sideways_use_atr': False, 'sideways_use_adx': False, 'sideways_use_spike': True, 'sideways_rsi_required': False}.
[I 2025-09-01 14:15:44,787] Trial 127 finished with values: [-1000000000.0, 1000000000.0] and parameters: {'p_sma': 27, 'p_std': 26, 'p_atr': 22, 'p_adx': 25, 'rsi_period': 71, 'ema1': 23, 'ema2': 59, 'slip_atr_k': 0.03415331000686295, 'slip_spread_k': 0.530912841124761, 'spread_hl_frac': 0.039711366067584145, 'bb_std_mult': 2.2507215573703423, 'rsi_os': 7, 'rsi_ob': 64, 'vol_spike': 0.024737909344670697, 'adx_thresh': 30.697421332708263, 'atr_min_pct': 0.005311903254366814, 'atr_max_pct': 0.06864237976391409, 'tp_mult': 2.1241208847980126, 'tsl_mult': 0.6101308276686351, 'strategy': 'mean_reversion', 'time_stop': 72, 'use_sma': False, 'use_atr': False, 'use_adx': True, 'use_ema': False, 'use_spike': False, 'rsi_required': True, 'edge_k': 0.4965984881875705, 'edge_cap': 0.9476766311578155, 'bull_strategy': 'breakout', 'bull_bb_std_mult': 1.4102650090092337, 'bull_rsi_os': 42, 'bull_rsi_ob': 58, 'bull_adx_thresh': 22.017783332662155, 'bull_atr_min_pct': 0.009029105249889324, 'bull_atr_max_pct': 0.03915262278788367, 'bull_tp_mult': 2.936754210374719, 'bull_tsl_mult': 0.874288398375507, 'bull_time_stop': 44, 'bull_use_sma': False, 'bull_use_ema': True, 'bull_use_atr': True, 'bull_use_adx': True, 'bull_use_spike': False, 'bull_rsi_required': True, 'bear_strategy': 'mean_reversion', 'bear_bb_std_mult': 2.456712308347606, 'bear_rsi_os': 53, 'bear_rsi_ob': 47, 'bear_adx_thresh': 32.63998533160519, 'bear_atr_min_pct': 0.003783286254045248, 'bear_atr_max_pct': 0.016732989250132325, 'bear_tp_mult': 2.2542253535830667, 'bear_tsl_mult': 0.7131994974760093, 'bear_time_stop': 257, 'bear_use_sma': False, 'bear_use_ema': True, 'bear_use_atr': False, 'bear_use_adx': True, 'bear_use_spike': False, 'bear_rsi_required': True, 'sideways_strategy': 'breakout', 'sideways_bb_std_mult': 1.6167804702571393, 'sideways_rsi_os': 38, 'sideways_rsi_ob': 81, 'sideways_adx_thresh': 23.932662300234675, 'sideways_atr_min_pct': 0.018552796132690605, 'sideways_atr_max_pct': 0.06396045477110007, 'sideways_tp_mult': 1.0449642608016934, 'sideways_tsl_mult': 0.16275470949010978, 'sideways_time_stop': 99, 'sideways_use_sma': False, 'sideways_use_ema': False, 'sideways_use_atr': False, 'sideways_use_adx': False, 'sideways_use_spike': True, 'sideways_rsi_required': False}.
[I 2025-09-01 14:16:26,294] Trial 131 finished with values: [-0.059026707496872, 0.05887998391172671] and parameters: {'p_sma': 22, 'p_std': 18, 'p_atr': 15, 'p_adx': 25, 'rsi_period': 69, 'ema1': 23, 'ema2': 15, 'slip_atr_k': 0.15693624501195347, 'slip_spread_k': 0.7597609759796333, 'spread_hl_frac': 0.020568921466810403, 'bb_std_mult': 1.8791724171032569, 'rsi_os': 7, 'rsi_ob': 91, 'vol_spike': 0.005259964486319944, 'adx_thresh': 30.4582225217877, 'atr_min_pct': 0.010029692329873281, 'atr_max_pct': 0.06821890260270227, 'tp_mult': 2.042132211034935, 'tsl_mult': 0.008475145006605678, 'strategy': 'breakout', 'time_stop': 71, 'use_sma': False, 'use_atr': False, 'use_adx': False, 'use_ema': False, 'use_spike': True, 'rsi_required': False, 'edge_k': 0.6074837328471281, 'edge_cap': 0.8022239884889438, 'bull_strategy': 'mean_reversion', 'bull_bb_std_mult': 1.1822771483604808, 'bull_rsi_os': 13, 'bull_rsi_ob': 90, 'bull_adx_thresh': 16.416657513691113, 'bull_atr_min_pct': 0.0015665146136613901, 'bull_atr_max_pct': 0.11282226501406489, 'bull_tp_mult': 1.2142305086578715, 'bull_tsl_mult': 0.8725166323838018, 'bull_time_stop': 31, 'bull_use_sma': False, 'bull_use_ema': False, 'bull_use_atr': False, 'bull_use_adx': True, 'bull_use_spike': False, 'bull_rsi_required': True, 'bear_strategy': 'breakout', 'bear_bb_std_mult': 2.4761641928021527, 'bear_rsi_os': 39, 'bear_rsi_ob': 45, 'bear_adx_thresh': 11.413406373082907, 'bear_atr_min_pct': 0.005101953703950616, 'bear_atr_max_pct': 0.08725871303712938, 'bear_tp_mult': 1.188623269031162, 'bear_tsl_mult': 0.7963555224956491, 'bear_time_stop': 57, 'bear_use_sma': False, 'bear_use_ema': False, 'bear_use_atr': False, 'bear_use_adx': False, 'bear_use_spike': True, 'bear_rsi_required': False, 'sideways_strategy': 'mean_reversion', 'sideways_bb_std_mult': 2.2190202829992898, 'sideways_rsi_os': 33, 'sideways_rsi_ob': 90, 'sideways_adx_thresh': 31.483021046047057, 'sideways_atr_min_pct': 0.01612595717825044, 'sideways_atr_max_pct': 0.06615816312205107, 'sideways_tp_mult': 1.6054641697092022, 'sideways_tsl_mult': 0.1576014195208198, 'sideways_time_stop': 96, 'sideways_use_sma': True, 'sideways_use_ema': True, 'sideways_use_atr': False, 'sideways_use_adx': True, 'sideways_use_spike': False, 'sideways_rsi_required': False}.
[I 2025-09-01 14:16:26,958] Trial 134 finished with values: [-0.0804970429087869, 0.08033654961785897] and parameters: {'p_sma': 25, 'p_std': 7, 'p_atr': 13, 'p_adx': 27, 'rsi_period': 69, 'ema1': 29, 'ema2': 19, 'slip_atr_k': 0.04636805820384652, 'slip_spread_k': 0.45231570194474424, 'spread_hl_frac': 0.03574604397100299, 'bb_std_mult': 1.8532723930175556, 'rsi_os': 16, 'rsi_ob': 71, 'vol_spike': 0.0064611975792452135, 'adx_thresh': 26.546914009419442, 'atr_min_pct': 0.009992341909436127, 'atr_max_pct': 0.04892097460066728, 'tp_mult': 2.04492274772548, 'tsl_mult': 0.8187941859509335, 'strategy': 'breakout', 'time_stop': 92, 'use_sma': True, 'use_atr': False, 'use_adx': False, 'use_ema': False, 'use_spike': False, 'rsi_required': True, 'edge_k': 0.7217639093981567, 'edge_cap': 0.7877541901602805, 'bull_strategy': 'breakout', 'bull_bb_std_mult': 1.4725809448044875, 'bull_rsi_os': 23, 'bull_rsi_ob': 83, 'bull_adx_thresh': 5.646215220449658, 'bull_atr_min_pct': 0.0017095962789337566, 'bull_atr_max_pct': 0.10516408007822678, 'bull_tp_mult': 1.0756346848381648, 'bull_tsl_mult': 0.28245233732684116, 'bull_time_stop': 245, 'bull_use_sma': False, 'bull_use_ema': False, 'bull_use_atr': False, 'bull_use_adx': True, 'bull_use_spike': False, 'bull_rsi_required': True, 'bear_strategy': 'breakout', 'bear_bb_std_mult': 1.8577072006413384, 'bear_rsi_os': 39, 'bear_rsi_ob': 86, 'bear_adx_thresh': 5.4737950733108125, 'bear_atr_min_pct': 0.0045930973666816425, 'bear_atr_max_pct': 0.06893835809699697, 'bear_tp_mult': 1.8925682815899547, 'bear_tsl_mult': 0.6359493190265164, 'bear_time_stop': 283, 'bear_use_sma': False, 'bear_use_ema': True, 'bear_use_atr': False, 'bear_use_adx': False, 'bear_use_spike': True, 'bear_rsi_required': True, 'sideways_strategy': 'mean_reversion', 'sideways_bb_std_mult': 1.432940521112127, 'sideways_rsi_os': 31, 'sideways_rsi_ob': 79, 'sideways_adx_thresh': 34.46135291068008, 'sideways_atr_min_pct': 0.0022363689067435195, 'sideways_atr_max_pct': 0.11702417024708195, 'sideways_tp_mult': 2.688321845846553, 'sideways_tsl_mult': 0.5428517564211004, 'sideways_time_stop': 85, 'sideways_use_sma': True, 'sideways_use_ema': True, 'sideways_use_atr': False, 'sideways_use_adx': True, 'sideways_use_spike': False, 'sideways_rsi_required': False}.
[I 2025-09-01 14:16:27,432] Trial 133 finished with values: [-0.05008756138085968, 0.04985611766994443] and parameters: {'p_sma': 22, 'p_std': 42, 'p_atr': 30, 'p_adx': 27, 'rsi_period': 74, 'ema1': 25, 'ema2': 34, 'slip_atr_k': 0.0729334502761401, 'slip_spread_k': 0.20708349350473026, 'spread_hl_frac': 0.0032613273971879983, 'bb_std_mult': 1.0003341403056087, 'rsi_os': 14, 'rsi_ob': 91, 'vol_spike': 0.0056393435391658, 'adx_thresh': 26.665267570443337, 'atr_min_pct': 0.021814138495177323, 'atr_max_pct': 0.06852200571444247, 'tp_mult': 2.3327073196842205, 'tsl_mult': 0.8448550965496875, 'strategy': 'breakout', 'time_stop': 74, 'use_sma': False, 'use_atr': False, 'use_adx': False, 'use_ema': False, 'use_spike': False, 'rsi_required': True, 'edge_k': 1.591605731269497, 'edge_cap': 0.978984980446792, 'bull_strategy': 'breakout', 'bull_bb_std_mult': 1.4779651165381316, 'bull_rsi_os': 15, 'bull_rsi_ob': 86, 'bull_adx_thresh': 18.36747381384184, 'bull_atr_min_pct': 0.0016364357982933397, 'bull_atr_max_pct': 0.04804420189262653, 'bull_tp_mult': 1.3730554850082195, 'bull_tsl_mult': 0.32949098930894427, 'bull_time_stop': 245, 'bull_use_sma': False, 'bull_use_ema': False, 'bull_use_atr': False, 'bull_use_adx': False, 'bull_use_spike': False, 'bull_rsi_required': True, 'bear_strategy': 'breakout', 'bear_bb_std_mult': 1.7515711577834505, 'bear_rsi_os': 50, 'bear_rsi_ob': 45, 'bear_adx_thresh': 11.364755076380185, 'bear_atr_min_pct': 0.0034375528405574053, 'bear_atr_max_pct': 0.09030705561665314, 'bear_tp_mult': 1.8696132669330403, 'bear_tsl_mult': 0.7974403316203573, 'bear_time_stop': 283, 'bear_use_sma': False, 'bear_use_ema': True, 'bear_use_atr': False, 'bear_use_adx': False, 'bear_use_spike': False, 'bear_rsi_required': True, 'sideways_strategy': 'mean_reversion', 'sideways_bb_std_mult': 2.218455483043227, 'sideways_rsi_os': 51, 'sideways_rsi_ob': 79, 'sideways_adx_thresh': 13.96143178905604, 'sideways_atr_min_pct': 0.016999971499756253, 'sideways_atr_max_pct': 0.11640248148928639, 'sideways_tp_mult': 2.8418005263423236, 'sideways_tsl_mult': 0.8200203972513989, 'sideways_time_stop': 268, 'sideways_use_sma': True, 'sideways_use_ema': True, 'sideways_use_atr': False, 'sideways_use_adx': True, 'sideways_use_spike': False, 'sideways_rsi_required': False}.
[I 2025-09-01 14:16:28,190] Trial 132 finished with values: [-0.09986459798324254, 0.09969147151034695] and parameters: {'p_sma': 46, 'p_std': 41, 'p_atr': 30, 'p_adx': 21, 'rsi_period': 28, 'ema1': 28, 'ema2': 40, 'slip_atr_k': 0.2436493866733891, 'slip_spread_k': 0.5735210422306843, 'spread_hl_frac': 0.020069569862859515, 'bb_std_mult': 2.4924781554488797, 'rsi_os': 7, 'rsi_ob': 69, 'vol_spike': 0.006194497583605452, 'adx_thresh': 26.82119364242251, 'atr_min_pct': 0.009918123987714278, 'atr_max_pct': 0.07007049402227508, 'tp_mult': 1.4151395202652577, 'tsl_mult': 0.12640306889286074, 'strategy': 'breakout', 'time_stop': 68, 'use_sma': False, 'use_atr': False, 'use_adx': True, 'use_ema': False, 'use_spike': True, 'rsi_required': False, 'edge_k': 1.0140590234564546, 'edge_cap': 0.8051286084176076, 'bull_strategy': 'mean_reversion', 'bull_bb_std_mult': 1.2023128890872663, 'bull_rsi_os': 23, 'bull_rsi_ob': 56, 'bull_adx_thresh': 18.27651248314226, 'bull_atr_min_pct': 0.0015834035063343362, 'bull_atr_max_pct': 0.015950927552673286, 'bull_tp_mult': 1.0788829889038936, 'bull_tsl_mult': 0.33365821380519084, 'bull_time_stop': 246, 'bull_use_sma': False, 'bull_use_ema': False, 'bull_use_atr': False, 'bull_use_adx': True, 'bull_use_spike': False, 'bull_rsi_required': True, 'bear_strategy': 'breakout', 'bear_bb_std_mult': 1.8449739059071357, 'bear_rsi_os': 42, 'bear_rsi_ob': 45, 'bear_adx_thresh': 16.749539973668174, 'bear_atr_min_pct': 0.0037200248073800883, 'bear_atr_max_pct': 0.08787165834876837, 'bear_tp_mult': 1.6263967542749378, 'bear_tsl_mult': 0.6956955702492967, 'bear_time_stop': 91, 'bear_use_sma': False, 'bear_use_ema': True, 'bear_use_atr': False, 'bear_use_adx': False, 'bear_use_spike': False, 'bear_rsi_required': False, 'sideways_strategy': 'mean_reversion', 'sideways_bb_std_mult': 1.4368165209969914, 'sideways_rsi_os': 33, 'sideways_rsi_ob': 77, 'sideways_adx_thresh': 8.459877299009358, 'sideways_atr_min_pct': 0.023773421504214076, 'sideways_atr_max_pct': 0.11627651666936903, 'sideways_tp_mult': 2.233795846999712, 'sideways_tsl_mult': 0.0019821328981096675, 'sideways_time_stop': 103, 'sideways_use_sma': True, 'sideways_use_ema': True, 'sideways_use_atr': False, 'sideways_use_adx': True, 'sideways_use_spike': True, 'sideways_rsi_required': False}.
