[I 2025-09-01 15:10:39,201] Trial 475 finished with values: [-1000000000.0, 1000000000.0] and parameters: {'p_sma': 31, 'p_std': 23, 'p_atr': 18, 'p_adx': 12, 'rsi_period': 41, 'ema1': 25, 'ema2': 52, 'slip_atr_k': 0.17045823555278272, 'slip_spread_k': 0.8305538404186259, 'spread_hl_frac': 0.03052434113656385, 'bb_std_mult': 2.2663093070285365, 'rsi_os': 15, 'rsi_ob': 80, 'vol_spike': 0.25082691964594206, 'adx_thresh': 28.80345616184474, 'atr_min_pct': 0.015412240831539619, 'atr_max_pct': 0.12029921659066081, 'tp_mult': 1.4582615151716647, 'tsl_mult': 0.3033533711845336, 'strategy': 'breakout', 'time_stop': 62, 'use_sma': False, 'use_atr': True, 'use_adx': True, 'use_ema': True, 'use_spike': False, 'rsi_required': True, 'edge_k': 1.2886329706050137, 'edge_cap': 0.9268998018509409, 'bull_strategy': 'mean_reversion', 'bull_bb_std_mult': 1.9929621968999633, 'bull_rsi_os': 25, 'bull_rsi_ob': 66, 'bull_adx_thresh': 7.108665305604252, 'bull_atr_min_pct': 0.02986474736938149, 'bull_atr_max_pct': 0.11145425237809867, 'bull_tp_mult': 1.4701574498266217, 'bull_tsl_mult': 0.1232775292051086, 'bull_time_stop': 100, 'bull_use_sma': False, 'bull_use_ema': True, 'bull_use_atr': False, 'bull_use_adx': True, 'bull_use_spike': False, 'bull_rsi_required': True, 'bear_strategy': 'breakout', 'bear_bb_std_mult': 2.5588250043370775, 'bear_rsi_os': 34, 'bear_rsi_ob': 51, 'bear_adx_thresh': 22.79268624496475, 'bear_atr_min_pct': 0.004769167352292811, 'bear_atr_max_pct': 0.047286272425569, 'bear_tp_mult': 1.46226098977024, 'bear_tsl_mult': 0.7630395033054785, 'bear_time_stop': 97, 'bear_use_sma': True, 'bear_use_ema': False, 'bear_use_atr': True, 'bear_use_adx': True, 'bear_use_spike': True, 'bear_rsi_required': True, 'sideways_strategy': 'breakout', 'sideways_bb_std_mult': 1.1373646490767018, 'sideways_rsi_os': 27, 'sideways_rsi_ob': 62, 'sideways_adx_thresh': 29.859316252078223, 'sideways_atr_min_pct': 0.02673273617614961, 'sideways_atr_max_pct': 0.0638975075570585, 'sideways_tp_mult': 1.6241935817308446, 'sideways_tsl_mult': 0.3695453848099248, 'sideways_time_stop': 41, 'sideways_use_sma': False, 'sideways_use_ema': False, 'sideways_use_atr': True, 'sideways_use_adx': True, 'sideways_use_spike': False, 'sideways_rsi_required': True}.
[I 2025-09-01 15:10:39,680] Trial 479 finished with values: [-1000000000.0, 1000000000.0] and parameters: {'p_sma': 32, 'p_std': 28, 'p_atr': 12, 'p_adx': 14, 'rsi_period': 70, 'ema1': 16, 'ema2': 52, 'slip_atr_k': 0.005944969084519655, 'slip_spread_k': 0.6076109031303627, 'spread_hl_frac': 0.007226469450051048, 'bb_std_mult': 0.7099544776863611, 'rsi_os': 40, 'rsi_ob': 79, 'vol_spike': 0.07322037431774452, 'adx_thresh': 31.163918092511004, 'atr_min_pct': 0.003450192362398909, 'atr_max_pct': 0.06688712236430311, 'tp_mult': 1.909078116738895, 'tsl_mult': 0.2237166319410031, 'strategy': 'breakout', 'time_stop': 45, 'use_sma': False, 'use_atr': True, 'use_adx': False, 'use_ema': True, 'use_spike': False, 'rsi_required': True, 'edge_k': 1.6277333279770887, 'edge_cap': 0.8726114806981894, 'bull_strategy': 'mean_reversion', 'bull_bb_std_mult': 1.9767144257131026, 'bull_rsi_os': 8, 'bull_rsi_ob': 72, 'bull_adx_thresh': 6.608417467378202, 'bull_atr_min_pct': 0.028442062275140456, 'bull_atr_max_pct': 0.03891839100996831, 'bull_tp_mult': 2.343799641769367, 'bull_tsl_mult': 0.6777046592019407, 'bull_time_stop': 139, 'bull_use_sma': False, 'bull_use_ema': False, 'bull_use_atr': False, 'bull_use_adx': True, 'bull_use_spike': False, 'bull_rsi_required': True, 'bear_strategy': 'breakout', 'bear_bb_std_mult': 0.5394335109951167, 'bear_rsi_os': 53, 'bear_rsi_ob': 79, 'bear_adx_thresh': 25.710711135901338, 'bear_atr_min_pct': 0.008215270111798751, 'bear_atr_max_pct': 0.03640204292360818, 'bear_tp_mult': 1.4648926209340136, 'bear_tsl_mult': 0.370906084168772, 'bear_time_stop': 248, 'bear_use_sma': True, 'bear_use_ema': False, 'bear_use_atr': False, 'bear_use_adx': True, 'bear_use_spike': True, 'bear_rsi_required': True, 'sideways_strategy': 'breakout', 'sideways_bb_std_mult': 2.78474452013558, 'sideways_rsi_os': 20, 'sideways_rsi_ob': 67, 'sideways_adx_thresh': 12.213656734296432, 'sideways_atr_min_pct': 0.012228682243195448, 'sideways_atr_max_pct': 0.07017159602209083, 'sideways_tp_mult': 2.2748466663369866, 'sideways_tsl_mult': 0.7546862327811068, 'sideways_time_stop': 224, 'sideways_use_sma': False, 'sideways_use_ema': False, 'sideways_use_atr': True, 'sideways_use_adx': True, 'sideways_use_spike': False, 'sideways_rsi_required': True}.
[I 2025-09-01 15:10:40,037] Trial 476 finished with values: [-1000000000.0, 1000000000.0] and parameters: {'p_sma': 29, 'p_std': 29, 'p_atr': 13, 'p_adx': 12, 'rsi_period': 75, 'ema1': 27, 'ema2': 59, 'slip_atr_k': 0.2425142408650657, 'slip_spread_k': 0.3890403818704915, 'spread_hl_frac': 0.007057037474426339, 'bb_std_mult': 0.6836361749401771, 'rsi_os': 31, 'rsi_ob': 79, 'vol_spike': 0.24826150811602962, 'adx_thresh': 32.37089442266062, 'atr_min_pct': 0.012634287728199843, 'atr_max_pct': 0.13303883867819488, 'tp_mult': 1.9227011346427167, 'tsl_mult': 0.34157164539864177, 'strategy': 'mean_reversion', 'time_stop': 63, 'use_sma': True, 'use_atr': True, 'use_adx': False, 'use_ema': True, 'use_spike': True, 'rsi_required': True, 'edge_k': 1.6184654567431498, 'edge_cap': 0.2944979638256063, 'bull_strategy': 'mean_reversion', 'bull_bb_std_mult': 0.779675523981953, 'bull_rsi_os': 25, 'bull_rsi_ob': 67, 'bull_adx_thresh': 7.078230868792923, 'bull_atr_min_pct': 0.015569901274027664, 'bull_atr_max_pct': 0.04483261172154199, 'bull_tp_mult': 1.4820296045861079, 'bull_tsl_mult': 0.02615599046927284, 'bull_time_stop': 155, 'bull_use_sma': False, 'bull_use_ema': True, 'bull_use_atr': True, 'bull_use_adx': True, 'bull_use_spike': False, 'bull_rsi_required': True, 'bear_strategy': 'breakout', 'bear_bb_std_mult': 1.3803896716693542, 'bear_rsi_os': 13, 'bear_rsi_ob': 53, 'bear_adx_thresh': 26.485819385332455, 'bear_atr_min_pct': 0.002173018661365064, 'bear_atr_max_pct': 0.03618556869434493, 'bear_tp_mult': 1.6554918771523046, 'bear_tsl_mult': 0.9760715158588744, 'bear_time_stop': 224, 'bear_use_sma': True, 'bear_use_ema': False, 'bear_use_atr': True, 'bear_use_adx': False, 'bear_use_spike': True, 'bear_rsi_required': True, 'sideways_strategy': 'mean_reversion', 'sideways_bb_std_mult': 1.1513253523464815, 'sideways_rsi_os': 15, 'sideways_rsi_ob': 62, 'sideways_adx_thresh': 12.175207052958505, 'sideways_atr_min_pct': 0.012345242371673604, 'sideways_atr_max_pct': 0.047363613581224116, 'sideways_tp_mult': 2.2641556359779718, 'sideways_tsl_mult': 0.23614895671240616, 'sideways_time_stop': 41, 'sideways_use_sma': True, 'sideways_use_ema': False, 'sideways_use_atr': True, 'sideways_use_adx': True, 'sideways_use_spike': False, 'sideways_rsi_required': True}.
[I 2025-09-01 15:10:41,030] Trial 482 finished with values: [-1000000000.0, 1000000000.0] and parameters: {'p_sma': 33, 'p_std': 45, 'p_atr': 12, 'p_adx': 15, 'rsi_period': 78, 'ema1': 8, 'ema2': 28, 'slip_atr_k': 0.012048099869139012, 'slip_spread_k': 0.9098263994815059, 'spread_hl_frac': 0.0058136397975703785, 'bb_std_mult': 3.260978324557069, 'rsi_os': 30, 'rsi_ob': 69, 'vol_spike': 0.050842490005366434, 'adx_thresh': 20.67891298499608, 'atr_min_pct': 0.016633157363803892, 'atr_max_pct': 0.01572805429038708, 'tp_mult': 1.866312415435799, 'tsl_mult': 0.8681466343553089, 'strategy': 'breakout', 'time_stop': 277, 'use_sma': False, 'use_atr': True, 'use_adx': False, 'use_ema': True, 'use_spike': False, 'rsi_required': False, 'edge_k': 1.71853145443129, 'edge_cap': 0.3211934514648942, 'bull_strategy': 'mean_reversion', 'bull_bb_std_mult': 0.9830061312478755, 'bull_rsi_os': 27, 'bull_rsi_ob': 69, 'bull_adx_thresh': 22.153775863526246, 'bull_atr_min_pct': 0.016534628892520088, 'bull_atr_max_pct': 0.03230693191048108, 'bull_tp_mult': 1.60139149883088, 'bull_tsl_mult': 0.353654913894097, 'bull_time_stop': 131, 'bull_use_sma': True, 'bull_use_ema': True, 'bull_use_atr': False, 'bull_use_adx': False, 'bull_use_spike': True, 'bull_rsi_required': False, 'bear_strategy': 'breakout', 'bear_bb_std_mult': 2.4383252174380994, 'bear_rsi_os': 21, 'bear_rsi_ob': 50, 'bear_adx_thresh': 8.00667864107995, 'bear_atr_min_pct': 0.005546914168844366, 'bear_atr_max_pct': 0.11477701023450591, 'bear_tp_mult': 1.6645810038576756, 'bear_tsl_mult': 0.7153558460768012, 'bear_time_stop': 237, 'bear_use_sma': True, 'bear_use_ema': False, 'bear_use_atr': False, 'bear_use_adx': False, 'bear_use_spike': True, 'bear_rsi_required': False, 'sideways_strategy': 'mean_reversion', 'sideways_bb_std_mult': 1.067369862737972, 'sideways_rsi_os': 53, 'sideways_rsi_ob': 88, 'sideways_adx_thresh': 17.250571616363175, 'sideways_atr_min_pct': 0.02432919315411322, 'sideways_atr_max_pct': 0.04743430590538641, 'sideways_tp_mult': 2.28360870824994, 'sideways_tsl_mult': 0.7722570872078054, 'sideways_time_stop': 54, 'sideways_use_sma': True, 'sideways_use_ema': False, 'sideways_use_atr': True, 'sideways_use_adx': False, 'sideways_use_spike': False, 'sideways_rsi_required': True}.
[I 2025-09-01 15:11:14,740] Trial 481 finished with values: [-1000000000.0, 1000000000.0] and parameters: {'p_sma': 52, 'p_std': 29, 'p_atr': 7, 'p_adx': 15, 'rsi_period': 82, 'ema1': 22, 'ema2': 56, 'slip_atr_k': 0.012217349735190015, 'slip_spread_k': 0.39358928017368827, 'spread_hl_frac': 0.04780925153207042, 'bb_std_mult': 2.0802423544499526, 'rsi_os': 33, 'rsi_ob': 74, 'vol_spike': 0.07418929974639468, 'adx_thresh': 28.298396274363345, 'atr_min_pct': 0.016785201027196665, 'atr_max_pct': 0.06668987289454761, 'tp_mult': 1.2188764970536727, 'tsl_mult': 0.3721438002488964, 'strategy': 'breakout', 'time_stop': 45, 'use_sma': False, 'use_atr': True, 'use_adx': False, 'use_ema': True, 'use_spike': False, 'rsi_required': False, 'edge_k': 0.21150719713863664, 'edge_cap': 0.8740684932464126, 'bull_strategy': 'mean_reversion', 'bull_bb_std_mult': 1.1124461988993672, 'bull_rsi_os': 27, 'bull_rsi_ob': 63, 'bull_adx_thresh': 6.603433822695188, 'bull_atr_min_pct': 0.016814215073165772, 'bull_atr_max_pct': 0.036876010124559044, 'bull_tp_mult': 1.5876133251822262, 'bull_tsl_mult': 0.02742460138314099, 'bull_time_stop': 135, 'bull_use_sma': True, 'bull_use_ema': False, 'bull_use_atr': False, 'bull_use_adx': False, 'bull_use_spike': False, 'bull_rsi_required': True, 'bear_strategy': 'breakout', 'bear_bb_std_mult': 3.5980132370279603, 'bear_rsi_os': 53, 'bear_rsi_ob': 50, 'bear_adx_thresh': 8.021047168732808, 'bear_atr_min_pct': 0.008436520171514875, 'bear_atr_max_pct': 0.11204199373047066, 'bear_tp_mult': 1.1891440248436145, 'bear_tsl_mult': 0.6656638689178076, 'bear_time_stop': 249, 'bear_use_sma': True, 'bear_use_ema': False, 'bear_use_atr': False, 'bear_use_adx': False, 'bear_use_spike': True, 'bear_rsi_required': False, 'sideways_strategy': 'mean_reversion', 'sideways_bb_std_mult': 1.0599874850650464, 'sideways_rsi_os': 20, 'sideways_rsi_ob': 69, 'sideways_adx_thresh': 8.341996616159244, 'sideways_atr_min_pct': 0.009420348890966563, 'sideways_atr_max_pct': 0.04746897398157964, 'sideways_tp_mult': 1.3647703069694823, 'sideways_tsl_mult': 0.7611113045600353, 'sideways_time_stop': 53, 'sideways_use_sma': True, 'sideways_use_ema': False, 'sideways_use_atr': True, 'sideways_use_adx': False, 'sideways_use_spike': False, 'sideways_rsi_required': True}.
[I 2025-09-01 15:11:15,278] Trial 480 finished with values: [-1000000000.0, 1000000000.0] and parameters: {'p_sma': 29, 'p_std': 52, 'p_atr': 7, 'p_adx': 14, 'rsi_period': 21, 'ema1': 8, 'ema2': 53, 'slip_atr_k': 0.015073105037438465, 'slip_spread_k': 0.3888082240647103, 'spread_hl_frac': 0.04693210298784816, 'bb_std_mult': 2.086894900654974, 'rsi_os': 33, 'rsi_ob': 79, 'vol_spike': 0.06594716392682509, 'adx_thresh': 28.46254780778378, 'atr_min_pct': 0.015486783484055109, 'atr_max_pct': 0.06603290386789264, 'tp_mult': 1.9248070636004915, 'tsl_mult': 0.3745026951677335, 'strategy': 'breakout', 'time_stop': 14, 'use_sma': False, 'use_atr': True, 'use_adx': False, 'use_ema': True, 'use_spike': False, 'rsi_required': True, 'edge_k': 1.6025606102854733, 'edge_cap': 0.29587763656578914, 'bull_strategy': 'mean_reversion', 'bull_bb_std_mult': 3.5299325613799715, 'bull_rsi_os': 7, 'bull_rsi_ob': 86, 'bull_adx_thresh': 6.490416174921428, 'bull_atr_min_pct': 0.02151601072421882, 'bull_atr_max_pct': 0.03259145771446339, 'bull_tp_mult': 2.9989461175817222, 'bull_tsl_mult': 0.028790355917510668, 'bull_time_stop': 226, 'bull_use_sma': False, 'bull_use_ema': False, 'bull_use_atr': False, 'bull_use_adx': False, 'bull_use_spike': False, 'bull_rsi_required': True, 'bear_strategy': 'breakout', 'bear_bb_std_mult': 1.4204676265425442, 'bear_rsi_os': 24, 'bear_rsi_ob': 50, 'bear_adx_thresh': 8.194674008454172, 'bear_atr_min_pct': 0.005223102693481113, 'bear_atr_max_pct': 0.0885962194767369, 'bear_tp_mult': 1.6626294979377203, 'bear_tsl_mult': 0.7880444776882394, 'bear_time_stop': 238, 'bear_use_sma': True, 'bear_use_ema': False, 'bear_use_atr': False, 'bear_use_adx': False, 'bear_use_spike': True, 'bear_rsi_required': True, 'sideways_strategy': 'mean_reversion', 'sideways_bb_std_mult': 1.7953818843479927, 'sideways_rsi_os': 20, 'sideways_rsi_ob': 89, 'sideways_adx_thresh': 17.748898759444508, 'sideways_atr_min_pct': 0.012203935314120205, 'sideways_atr_max_pct': 0.07963914486776526, 'sideways_tp_mult': 2.190254881434232, 'sideways_tsl_mult': 0.7578401321056252, 'sideways_time_stop': 75, 'sideways_use_sma': True, 'sideways_use_ema': False, 'sideways_use_atr': True, 'sideways_use_adx': False, 'sideways_use_spike': False, 'sideways_rsi_required': True}.
[I 2025-09-01 15:11:15,530] Trial 483 finished with values: [-1000000000.0, 1000000000.0] and parameters: {'p_sma': 52, 'p_std': 26, 'p_atr': 12, 'p_adx': 15, 'rsi_period': 71, 'ema1': 26, 'ema2': 56, 'slip_atr_k': 0.012596267443189004, 'slip_spread_k': 0.40577009554372023, 'spread_hl_frac': 0.03554852707064648, 'bb_std_mult': 2.0736211853678657, 'rsi_os': 33, 'rsi_ob': 76, 'vol_spike': 0.051643577597725907, 'adx_thresh': 28.28073737096204, 'atr_min_pct': 0.016563737579985378, 'atr_max_pct': 0.09313049025530637, 'tp_mult': 1.300703271966471, 'tsl_mult': 0.37989666386615, 'strategy': 'breakout', 'time_stop': 277, 'use_sma': False, 'use_atr': True, 'use_adx': False, 'use_ema': True, 'use_spike': False, 'rsi_required': False, 'edge_k': 0.3054189504307012, 'edge_cap': 0.8904983009921065, 'bull_strategy': 'mean_reversion', 'bull_bb_std_mult': 3.1795666049753883, 'bull_rsi_os': 14, 'bull_rsi_ob': 88, 'bull_adx_thresh': 19.231260588441824, 'bull_atr_min_pct': 0.02163205933817579, 'bull_atr_max_pct': 0.03305764530961965, 'bull_tp_mult': 1.377966040896596, 'bull_tsl_mult': 0.3494421611067114, 'bull_time_stop': 132, 'bull_use_sma': True, 'bull_use_ema': False, 'bull_use_atr': False, 'bull_use_adx': False, 'bull_use_spike': True, 'bull_rsi_required': False, 'bear_strategy': 'breakout', 'bear_bb_std_mult': 2.983397921987241, 'bear_rsi_os': 15, 'bear_rsi_ob': 57, 'bear_adx_thresh': 9.983179971723773, 'bear_atr_min_pct': 0.005529927945884017, 'bear_atr_max_pct': 0.07744846707847147, 'bear_tp_mult': 1.5707640010115478, 'bear_tsl_mult': 0.4097853586435567, 'bear_time_stop': 238, 'bear_use_sma': True, 'bear_use_ema': False, 'bear_use_atr': False, 'bear_use_adx': False, 'bear_use_spike': True, 'bear_rsi_required': False, 'sideways_strategy': 'mean_reversion', 'sideways_bb_std_mult': 0.6193344621676007, 'sideways_rsi_os': 53, 'sideways_rsi_ob': 82, 'sideways_adx_thresh': 8.379573444261311, 'sideways_atr_min_pct': 0.011645215590994695, 'sideways_atr_max_pct': 0.044354649641675944, 'sideways_tp_mult': 2.1989116734251466, 'sideways_tsl_mult': 0.7755431469129846, 'sideways_time_stop': 151, 'sideways_use_sma': True, 'sideways_use_ema': False, 'sideways_use_atr': True, 'sideways_use_adx': False, 'sideways_use_spike': False, 'sideways_rsi_required': True}.
[I 2025-09-01 15:11:15,868] Trial 484 finished with values: [-1000000000.0, 1000000000.0] and parameters: {'p_sma': 55, 'p_std': 52, 'p_atr': 7, 'p_adx': 15, 'rsi_period': 80, 'ema1': 14, 'ema2': 56, 'slip_atr_k': 0.02361407940660102, 'slip_spread_k': 0.8606748312870718, 'spread_hl_frac': 0.046840550803157854, 'bb_std_mult': 2.0993307124461436, 'rsi_os': 33, 'rsi_ob': 76, 'vol_spike': 0.06481739591801233, 'adx_thresh': 28.254036709422362, 'atr_min_pct': 0.010958524917855582, 'atr_max_pct': 0.01916957044448781, 'tp_mult': 2.015214935639733, 'tsl_mult': 0.3727537603392328, 'strategy': 'breakout', 'time_stop': 249, 'use_sma': False, 'use_atr': True, 'use_adx': False, 'use_ema': True, 'use_spike': False, 'rsi_required': True, 'edge_k': 1.2109608220592474, 'edge_cap': 0.8078580953708714, 'bull_strategy': 'mean_reversion', 'bull_bb_std_mult': 1.178603103360531, 'bull_rsi_os': 9, 'bull_rsi_ob': 78, 'bull_adx_thresh': 5.647620688750833, 'bull_atr_min_pct': 0.017335576640303052, 'bull_atr_max_pct': 0.042168045609098384, 'bull_tp_mult': 1.3633537793620967, 'bull_tsl_mult': 0.0711483536810991, 'bull_time_stop': 270, 'bull_use_sma': False, 'bull_use_ema': False, 'bull_use_atr': False, 'bull_use_adx': False, 'bull_use_spike': False, 'bull_rsi_required': True, 'bear_strategy': 'mean_reversion', 'bear_bb_std_mult': 2.9675944130950356, 'bear_rsi_os': 18, 'bear_rsi_ob': 50, 'bear_adx_thresh': 9.827042592825002, 'bear_atr_min_pct': 0.0053046562435279275, 'bear_atr_max_pct': 0.11187292907566815, 'bear_tp_mult': 1.1864575505732824, 'bear_tsl_mult': 0.4156812906566723, 'bear_time_stop': 77, 'bear_use_sma': True, 'bear_use_ema': False, 'bear_use_atr': False, 'bear_use_adx': False, 'bear_use_spike': True, 'bear_rsi_required': True, 'sideways_strategy': 'mean_reversion', 'sideways_bb_std_mult': 0.6482607876185924, 'sideways_rsi_os': 22, 'sideways_rsi_ob': 53, 'sideways_adx_thresh': 33.13803104922649, 'sideways_atr_min_pct': 0.01123694860190613, 'sideways_atr_max_pct': 0.02198394316871878, 'sideways_tp_mult': 2.1979059684644673, 'sideways_tsl_mult': 0.39940216636329146, 'sideways_time_stop': 150, 'sideways_use_sma': True, 'sideways_use_ema': False, 'sideways_use_atr': True, 'sideways_use_adx': False, 'sideways_use_spike': False, 'sideways_rsi_required': True}.
[I 2025-09-01 15:11:16,639] Trial 486 finished with values: [-1000000000.0, 1000000000.0] and parameters: {'p_sma': 50, 'p_std': 26, 'p_atr': 12, 'p_adx': 30, 'rsi_period': 71, 'ema1': 26, 'ema2': 59, 'slip_atr_k': 0.021136502672191693, 'slip_spread_k': 0.36618150951593015, 'spread_hl_frac': 0.004160941910125097, 'bb_std_mult': 0.9238024812467753, 'rsi_os': 17, 'rsi_ob': 76, 'vol_spike': 0.1830137456933225, 'adx_thresh': 26.452113253413206, 'atr_min_pct': 0.027108786518131586, 'atr_max_pct': 0.024646081225236517, 'tp_mult': 1.310145749736288, 'tsl_mult': 0.39171980507167237, 'strategy': 'breakout', 'time_stop': 182, 'use_sma': False, 'use_atr': True, 'use_adx': False, 'use_ema': True, 'use_spike': False, 'rsi_required': True, 'edge_k': 1.800316087827625, 'edge_cap': 0.8955112538943766, 'bull_strategy': 'mean_reversion', 'bull_bb_std_mult': 0.9286229893497572, 'bull_rsi_os': 24, 'bull_rsi_ob': 45, 'bull_adx_thresh': 5.948799541529266, 'bull_atr_min_pct': 0.024189245373908277, 'bull_atr_max_pct': 0.041777781613898515, 'bull_tp_mult': 1.3660361928721012, 'bull_tsl_mult': 0.06403558757969274, 'bull_time_stop': 76, 'bull_use_sma': False, 'bull_use_ema': True, 'bull_use_atr': False, 'bull_use_adx': True, 'bull_use_spike': True, 'bull_rsi_required': False, 'bear_strategy': 'mean_reversion', 'bear_bb_std_mult': 1.6085349752434932, 'bear_rsi_os': 49, 'bear_rsi_ob': 71, 'bear_adx_thresh': 9.925052724410817, 'bear_atr_min_pct': 0.0026972194740536044, 'bear_atr_max_pct': 0.031747429625870176, 'bear_tp_mult': 1.5767823184242598, 'bear_tsl_mult': 0.74492644442568, 'bear_time_stop': 88, 'bear_use_sma': True, 'bear_use_ema': False, 'bear_use_atr': False, 'bear_use_adx': False, 'bear_use_spike': True, 'bear_rsi_required': True, 'sideways_strategy': 'mean_reversion', 'sideways_bb_std_mult': 1.2105855698193848, 'sideways_rsi_os': 22, 'sideways_rsi_ob': 82, 'sideways_adx_thresh': 32.95945953727087, 'sideways_atr_min_pct': 0.01173193722334619, 'sideways_atr_max_pct': 0.050100687554400065, 'sideways_tp_mult': 2.2010942932116278, 'sideways_tsl_mult': 0.4259809454305955, 'sideways_time_stop': 151, 'sideways_use_sma': True, 'sideways_use_ema': False, 'sideways_use_atr': True, 'sideways_use_adx': True, 'sideways_use_spike': False, 'sideways_rsi_required': True}.
