[I 2025-09-01 15:16:13,512] Trial 523 finished with values: [-1000000000.0, 1000000000.0] and parameters: {'p_sma': 44, 'p_std': 27, 'p_atr': 12, 'p_adx': 14, 'rsi_period': 68, 'ema1': 26, 'ema2': 27, 'slip_atr_k': 0.019006146002864863, 'slip_spread_k': 0.3305730268464403, 'spread_hl_frac': 0.005498390957469539, 'bb_std_mult': 2.363160372963212, 'rsi_os': 34, 'rsi_ob': 82, 'vol_spike': 0.09850834896769912, 'adx_thresh': 17.13026068391954, 'atr_min_pct': 0.0166425778453753, 'atr_max_pct': 0.0651414331267631, 'tp_mult': 2.0032192206814097, 'tsl_mult': 0.4316522852876907, 'strategy': 'breakout', 'time_stop': 12, 'use_sma': False, 'use_atr': True, 'use_adx': False, 'use_ema': True, 'use_spike': True, 'rsi_required': True, 'edge_k': 1.7158942320187007, 'edge_cap': 0.21260191216480795, 'bull_strategy': 'mean_reversion', 'bull_bb_std_mult': 3.221455619009802, 'bull_rsi_os': 34, 'bull_rsi_ob': 68, 'bull_adx_thresh': 6.9736948647590635, 'bull_atr_min_pct': 0.01291687381896123, 'bull_atr_max_pct': 0.12681016241536924, 'bull_tp_mult': 2.9107549372340182, 'bull_tsl_mult': 0.49623094659279465, 'bull_time_stop': 133, 'bull_use_sma': False, 'bull_use_ema': True, 'bull_use_atr': False, 'bull_use_adx': True, 'bull_use_spike': True, 'bull_rsi_required': True, 'bear_strategy': 'mean_reversion', 'bear_bb_std_mult': 1.6433235026797348, 'bear_rsi_os': 53, 'bear_rsi_ob': 60, 'bear_adx_thresh': 14.76782425663613, 'bear_atr_min_pct': 0.004549641838367512, 'bear_atr_max_pct': 0.04499904603247174, 'bear_tp_mult': 1.715247215983743, 'bear_tsl_mult': 0.28833658968482045, 'bear_time_stop': 232, 'bear_use_sma': True, 'bear_use_ema': False, 'bear_use_atr': False, 'bear_use_adx': True, 'bear_use_spike': True, 'bear_rsi_required': True, 'sideways_strategy': 'breakout', 'sideways_bb_std_mult': 1.1019814768042833, 'sideways_rsi_os': 21, 'sideways_rsi_ob': 83, 'sideways_adx_thresh': 20.21970007405067, 'sideways_atr_min_pct': 0.012192471965310194, 'sideways_atr_max_pct': 0.05254729385506529, 'sideways_tp_mult': 2.1856158560947168, 'sideways_tsl_mult': 0.7846081326776019, 'sideways_time_stop': 64, 'sideways_use_sma': False, 'sideways_use_ema': False, 'sideways_use_atr': True, 'sideways_use_adx': True, 'sideways_use_spike': False, 'sideways_rsi_required': True}.
[I 2025-09-01 15:16:13,864] Trial 522 finished with values: [-1000000000.0, 1000000000.0] and parameters: {'p_sma': 54, 'p_std': 27, 'p_atr': 19, 'p_adx': 14, 'rsi_period': 67, 'ema1': 11, 'ema2': 27, 'slip_atr_k': 0.2152850671630343, 'slip_spread_k': 0.32851316816630866, 'spread_hl_frac': 0.006608569251546125, 'bb_std_mult': 0.8488333185817281, 'rsi_os': 34, 'rsi_ob': 71, 'vol_spike': 0.04110692255242229, 'adx_thresh': 27.515844658151575, 'atr_min_pct': 0.016601681232616926, 'atr_max_pct': 0.07417865703104262, 'tp_mult': 1.3771058690024722, 'tsl_mult': 0.4256963225318086, 'strategy': 'mean_reversion', 'time_stop': 193, 'use_sma': False, 'use_atr': True, 'use_adx': True, 'use_ema': True, 'use_spike': True, 'rsi_required': True, 'edge_k': 1.2470451788860881, 'edge_cap': 0.5757530618426177, 'bull_strategy': 'mean_reversion', 'bull_bb_std_mult': 1.1047809472217587, 'bull_rsi_os': 34, 'bull_rsi_ob': 69, 'bull_adx_thresh': 6.706617886223318, 'bull_atr_min_pct': 0.012815167450594564, 'bull_atr_max_pct': 0.04183732570526186, 'bull_tp_mult': 1.4994418283670792, 'bull_tsl_mult': 0.4970611703976806, 'bull_time_stop': 130, 'bull_use_sma': False, 'bull_use_ema': False, 'bull_use_atr': True, 'bull_use_adx': True, 'bull_use_spike': True, 'bull_rsi_required': True, 'bear_strategy': 'breakout', 'bear_bb_std_mult': 1.6639763204955977, 'bear_rsi_os': 35, 'bear_rsi_ob': 55, 'bear_adx_thresh': 18.390963362496763, 'bear_atr_min_pct': 0.004518760220709145, 'bear_atr_max_pct': 0.04375548462429491, 'bear_tp_mult': 2.713950081332765, 'bear_tsl_mult': 0.8036395273904673, 'bear_time_stop': 53, 'bear_use_sma': True, 'bear_use_ema': False, 'bear_use_atr': False, 'bear_use_adx': False, 'bear_use_spike': True, 'bear_rsi_required': True, 'sideways_strategy': 'breakout', 'sideways_bb_std_mult': 3.17988709995453, 'sideways_rsi_os': 22, 'sideways_rsi_ob': 71, 'sideways_adx_thresh': 30.344530205807633, 'sideways_atr_min_pct': 0.0056754639676047085, 'sideways_atr_max_pct': 0.019609884054123845, 'sideways_tp_mult': 1.2325920992292911, 'sideways_tsl_mult': 0.7851204619100153, 'sideways_time_stop': 64, 'sideways_use_sma': False, 'sideways_use_ema': False, 'sideways_use_atr': True, 'sideways_use_adx': True, 'sideways_use_spike': False, 'sideways_rsi_required': True}.
[I 2025-09-01 15:16:56,433] Trial 526 finished with values: [-1000000000.0, 1000000000.0] and parameters: {'p_sma': 35, 'p_std': 24, 'p_atr': 19, 'p_adx': 12, 'rsi_period': 71, 'ema1': 13, 'ema2': 14, 'slip_atr_k': 0.006366129391611983, 'slip_spread_k': 0.4231786883621823, 'spread_hl_frac': 0.00910410325706884, 'bb_std_mult': 3.2979456504818208, 'rsi_os': 28, 'rsi_ob': 80, 'vol_spike': 0.2655971671817776, 'adx_thresh': 27.847873933516567, 'atr_min_pct': 0.0023364093507306314, 'atr_max_pct': 0.06621224169753706, 'tp_mult': 1.0434456058738577, 'tsl_mult': 0.07285246957683317, 'strategy': 'breakout', 'time_stop': 18, 'use_sma': False, 'use_atr': True, 'use_adx': False, 'use_ema': True, 'use_spike': True, 'rsi_required': True, 'edge_k': 0.9675181940498605, 'edge_cap': 0.8560861218285093, 'bull_strategy': 'mean_reversion', 'bull_bb_std_mult': 1.0473242504522868, 'bull_rsi_os': 44, 'bull_rsi_ob': 65, 'bull_adx_thresh': 23.38884916632348, 'bull_atr_min_pct': 0.015810140519297192, 'bull_atr_max_pct': 0.03667146354191962, 'bull_tp_mult': 1.4938535341239125, 'bull_tsl_mult': 0.08691139732940178, 'bull_time_stop': 123, 'bull_use_sma': False, 'bull_use_ema': True, 'bull_use_atr': False, 'bull_use_adx': True, 'bull_use_spike': False, 'bull_rsi_required': False, 'bear_strategy': 'mean_reversion', 'bear_bb_std_mult': 1.2914231359934136, 'bear_rsi_os': 5, 'bear_rsi_ob': 65, 'bear_adx_thresh': 11.161141619636117, 'bear_atr_min_pct': 0.00016586033528209407, 'bear_atr_max_pct': 0.1238962622980007, 'bear_tp_mult': 1.6926991803354339, 'bear_tsl_mult': 0.8150684279031736, 'bear_time_stop': 248, 'bear_use_sma': True, 'bear_use_ema': False, 'bear_use_atr': True, 'bear_use_adx': False, 'bear_use_spike': True, 'bear_rsi_required': True, 'sideways_strategy': 'mean_reversion', 'sideways_bb_std_mult': 1.0396051681210765, 'sideways_rsi_os': 19, 'sideways_rsi_ob': 77, 'sideways_adx_thresh': 10.683994438764742, 'sideways_atr_min_pct': 0.013925529481579218, 'sideways_atr_max_pct': 0.020371925819265224, 'sideways_tp_mult': 2.2637700958202203, 'sideways_tsl_mult': 0.7008461927740964, 'sideways_time_stop': 230, 'sideways_use_sma': True, 'sideways_use_ema': False, 'sideways_use_atr': True, 'sideways_use_adx': True, 'sideways_use_spike': False, 'sideways_rsi_required': True}.
[I 2025-09-01 15:16:57,048] Trial 524 finished with values: [-1000000000.0, 1000000000.0] and parameters: {'p_sma': 8, 'p_std': 26, 'p_atr': 19, 'p_adx': 8, 'rsi_period': 75, 'ema1': 26, 'ema2': 56, 'slip_atr_k': 0.004144732272849491, 'slip_spread_k': 0.2968180516571467, 'spread_hl_frac': 0.036463032326325515, 'bb_std_mult': 0.8615288502459855, 'rsi_os': 30, 'rsi_ob': 50, 'vol_spike': 0.11244428814206195, 'adx_thresh': 27.461124757379263, 'atr_min_pct': 0.018762624418982576, 'atr_max_pct': 0.06568786255776897, 'tp_mult': 1.0201383806028113, 'tsl_mult': 0.328837512338989, 'strategy': 'breakout', 'time_stop': 19, 'use_sma': False, 'use_atr': True, 'use_adx': False, 'use_ema': True, 'use_spike': True, 'rsi_required': True, 'edge_k': 1.7013587582817857, 'edge_cap': 0.8601721161514255, 'bull_strategy': 'mean_reversion', 'bull_bb_std_mult': 1.09501540936406, 'bull_rsi_os': 40, 'bull_rsi_ob': 68, 'bull_adx_thresh': 23.299476426844976, 'bull_atr_min_pct': 0.01588700063341453, 'bull_atr_max_pct': 0.12692964332321496, 'bull_tp_mult': 1.4774446969104806, 'bull_tsl_mult': 0.08070205955980012, 'bull_time_stop': 198, 'bull_use_sma': False, 'bull_use_ema': True, 'bull_use_atr': False, 'bull_use_adx': True, 'bull_use_spike': True, 'bull_rsi_required': False, 'bear_strategy': 'mean_reversion', 'bear_bb_std_mult': 1.2909230479385472, 'bear_rsi_os': 53, 'bear_rsi_ob': 52, 'bear_adx_thresh': 9.939702807419655, 'bear_atr_min_pct': 0.00462573234705037, 'bear_atr_max_pct': 0.04314314005853096, 'bear_tp_mult': 1.7079278272595515, 'bear_tsl_mult': 0.7560624577967509, 'bear_time_stop': 248, 'bear_use_sma': True, 'bear_use_ema': False, 'bear_use_atr': False, 'bear_use_adx': True, 'bear_use_spike': True, 'bear_rsi_required': True, 'sideways_strategy': 'breakout', 'sideways_bb_std_mult': 1.0459345203943131, 'sideways_rsi_os': 21, 'sideways_rsi_ob': 79, 'sideways_adx_thresh': 14.990122772934829, 'sideways_atr_min_pct': 0.012384439172929118, 'sideways_atr_max_pct': 0.05242372544496724, 'sideways_tp_mult': 2.1717322642874675, 'sideways_tsl_mult': 0.5360036441622893, 'sideways_time_stop': 187, 'sideways_use_sma': False, 'sideways_use_ema': False, 'sideways_use_atr': True, 'sideways_use_adx': True, 'sideways_use_spike': False, 'sideways_rsi_required': True}.
[I 2025-09-01 15:16:57,497] Trial 525 finished with values: [-1000000000.0, 1000000000.0] and parameters: {'p_sma': 47, 'p_std': 38, 'p_atr': 19, 'p_adx': 18, 'rsi_period': 75, 'ema1': 27, 'ema2': 27, 'slip_atr_k': 0.061196572488316725, 'slip_spread_k': 0.4221690727963597, 'spread_hl_frac': 0.005720050391861033, 'bb_std_mult': 2.153107801740395, 'rsi_os': 54, 'rsi_ob': 79, 'vol_spike': 0.2679746358215377, 'adx_thresh': 27.364502372223058, 'atr_min_pct': 0.018816963436429184, 'atr_max_pct': 0.0439688227575749, 'tp_mult': 1.0464323382731304, 'tsl_mult': 0.43177678536503505, 'strategy': 'breakout', 'time_stop': 11, 'use_sma': False, 'use_atr': True, 'use_adx': False, 'use_ema': True, 'use_spike': True, 'rsi_required': True, 'edge_k': 1.2586322381800454, 'edge_cap': 0.8575800995759653, 'bull_strategy': 'mean_reversion', 'bull_bb_std_mult': 2.8752796394229456, 'bull_rsi_os': 50, 'bull_rsi_ob': 80, 'bull_adx_thresh': 6.993178435545621, 'bull_atr_min_pct': 0.015818379203216028, 'bull_atr_max_pct': 0.03662072447679459, 'bull_tp_mult': 1.4729204443018593, 'bull_tsl_mult': 0.6953873602946848, 'bull_time_stop': 201, 'bull_use_sma': False, 'bull_use_ema': True, 'bull_use_atr': False, 'bull_use_adx': True, 'bull_use_spike': False, 'bull_rsi_required': False, 'bear_strategy': 'mean_reversion', 'bear_bb_std_mult': 1.3928296370274311, 'bear_rsi_os': 32, 'bear_rsi_ob': 51, 'bear_adx_thresh': 9.292020452561802, 'bear_atr_min_pct': 0.010195068212416166, 'bear_atr_max_pct': 0.04255369991963734, 'bear_tp_mult': 2.0611006093526405, 'bear_tsl_mult': 0.4745063327413849, 'bear_time_stop': 186, 'bear_use_sma': True, 'bear_use_ema': False, 'bear_use_atr': True, 'bear_use_adx': True, 'bear_use_spike': True, 'bear_rsi_required': True, 'sideways_strategy': 'mean_reversion', 'sideways_bb_std_mult': 1.0730065524287506, 'sideways_rsi_os': 10, 'sideways_rsi_ob': 77, 'sideways_adx_thresh': 14.672389752468128, 'sideways_atr_min_pct': 0.012314259288452915, 'sideways_atr_max_pct': 0.05269507111483028, 'sideways_tp_mult': 1.4840799659836486, 'sideways_tsl_mult': 0.3727036615825233, 'sideways_time_stop': 65, 'sideways_use_sma': True, 'sideways_use_ema': False, 'sideways_use_atr': True, 'sideways_use_adx': True, 'sideways_use_spike': False, 'sideways_rsi_required': True}.
[I 2025-09-01 15:16:57,692] Trial 527 finished with values: [-1000000000.0, 1000000000.0] and parameters: {'p_sma': 35, 'p_std': 24, 'p_atr': 18, 'p_adx': 18, 'rsi_period': 75, 'ema1': 27, 'ema2': 56, 'slip_atr_k': 0.002968460575068185, 'slip_spread_k': 0.42308879176904085, 'spread_hl_frac': 0.024542176935899315, 'bb_std_mult': 2.162211655654052, 'rsi_os': 32, 'rsi_ob': 47, 'vol_spike': 0.07515675815986647, 'adx_thresh': 14.229589362254128, 'atr_min_pct': 0.022309732169608243, 'atr_max_pct': 0.06526811627959332, 'tp_mult': 2.7977181951181453, 'tsl_mult': 0.39629597665398036, 'strategy': 'breakout', 'time_stop': 152, 'use_sma': False, 'use_atr': True, 'use_adx': False, 'use_ema': True, 'use_spike': False, 'rsi_required': True, 'edge_k': 1.9961335036410834, 'edge_cap': 0.8640399610905793, 'bull_strategy': 'mean_reversion', 'bull_bb_std_mult': 2.8940397242355225, 'bull_rsi_os': 44, 'bull_rsi_ob': 65, 'bull_adx_thresh': 8.520899749027013, 'bull_atr_min_pct': 0.009660445114891697, 'bull_atr_max_pct': 0.03659003680981022, 'bull_tp_mult': 1.4657759374405401, 'bull_tsl_mult': 0.6857833972332972, 'bull_time_stop': 200, 'bull_use_sma': False, 'bull_use_ema': True, 'bull_use_atr': False, 'bull_use_adx': True, 'bull_use_spike': False, 'bull_rsi_required': False, 'bear_strategy': 'mean_reversion', 'bear_bb_std_mult': 0.7154650775907585, 'bear_rsi_os': 31, 'bear_rsi_ob': 49, 'bear_adx_thresh': 13.922873820159733, 'bear_atr_min_pct': 0.023671433578448794, 'bear_atr_max_pct': 0.03887039766073577, 'bear_tp_mult': 2.4378117771032777, 'bear_tsl_mult': 0.7540490754022373, 'bear_time_stop': 188, 'bear_use_sma': True, 'bear_use_ema': False, 'bear_use_atr': True, 'bear_use_adx': True, 'bear_use_spike': True, 'bear_rsi_required': True, 'sideways_strategy': 'mean_reversion', 'sideways_bb_std_mult': 1.0602609201530144, 'sideways_rsi_os': 43, 'sideways_rsi_ob': 45, 'sideways_adx_thresh': 14.950436790280612, 'sideways_atr_min_pct': 0.012706477864371818, 'sideways_atr_max_pct': 0.1465661928397904, 'sideways_tp_mult': 2.1477945242506813, 'sideways_tsl_mult': 0.8175005426509644, 'sideways_time_stop': 161, 'sideways_use_sma': True, 'sideways_use_ema': False, 'sideways_use_atr': True, 'sideways_use_adx': True, 'sideways_use_spike': False, 'sideways_rsi_required': True}.
