[I 2025-09-01 15:13:01,958] Trial 496 finished with values: [-1000000000.0, 1000000000.0] and parameters: {'p_sma': 32, 'p_std': 26, 'p_atr': 28, 'p_adx': 10, 'rsi_period': 13, 'ema1': 26, 'ema2': 48, 'slip_atr_k': 0.011454432973061845, 'slip_spread_k': 0.42937707928781704, 'spread_hl_frac': 0.03299410720559787, 'bb_std_mult': 2.7977525259344858, 'rsi_os': 32, 'rsi_ob': 79, 'vol_spike': 0.07721205400436382, 'adx_thresh': 20.131033132651023, 'atr_min_pct': 0.01615621681618128, 'atr_max_pct': 0.07228397642393017, 'tp_mult': 1.8750468149602684, 'tsl_mult': 0.7955600150548285, 'strategy': 'breakout', 'time_stop': 50, 'use_sma': False, 'use_atr': True, 'use_adx': False, 'use_ema': True, 'use_spike': False, 'rsi_required': False, 'edge_k': 0.9515591335033746, 'edge_cap': 0.3482195875477257, 'bull_strategy': 'mean_reversion', 'bull_bb_std_mult': 2.125825609067683, 'bull_rsi_os': 23, 'bull_rsi_ob': 67, 'bull_adx_thresh': 31.76881184389149, 'bull_atr_min_pct': 0.013604954269639613, 'bull_atr_max_pct': 0.03895171318231804, 'bull_tp_mult': 1.3377984123523663, 'bull_tsl_mult': 0.3853765831504641, 'bull_time_stop': 136, 'bull_use_sma': False, 'bull_use_ema': True, 'bull_use_atr': False, 'bull_use_adx': True, 'bull_use_spike': False, 'bull_rsi_required': True, 'bear_strategy': 'breakout', 'bear_bb_std_mult': 1.4634551450405235, 'bear_rsi_os': 52, 'bear_rsi_ob': 54, 'bear_adx_thresh': 29.50472427864613, 'bear_atr_min_pct': 0.021685838693128557, 'bear_atr_max_pct': 0.04116495694986699, 'bear_tp_mult': 1.6121730880342822, 'bear_tsl_mult': 0.11482524600933836, 'bear_time_stop': 300, 'bear_use_sma': True, 'bear_use_ema': False, 'bear_use_atr': False, 'bear_use_adx': False, 'bear_use_spike': True, 'bear_rsi_required': False, 'sideways_strategy': 'mean_reversion', 'sideways_bb_std_mult': 3.0866960043678544, 'sideways_rsi_os': 24, 'sideways_rsi_ob': 77, 'sideways_adx_thresh': 9.630279924705802, 'sideways_atr_min_pct': 0.012482050858547599, 'sideways_atr_max_pct': 0.04390093253300635, 'sideways_tp_mult': 2.3412875556069337, 'sideways_tsl_mult': 0.7912328668089579, 'sideways_time_stop': 48, 'sideways_use_sma': True, 'sideways_use_ema': False, 'sideways_use_atr': True, 'sideways_use_adx': True, 'sideways_use_spike': False, 'sideways_rsi_required': True}.
[I 2025-09-01 15:13:02,477] Trial 497 finished with values: [-1000000000.0, 1000000000.0] and parameters: {'p_sma': 32, 'p_std': 26, 'p_atr': 28, 'p_adx': 14, 'rsi_period': 12, 'ema1': 6, 'ema2': 24, 'slip_atr_k': 0.10021510105988958, 'slip_spread_k': 0.43661064163061064, 'spread_hl_frac': 0.013343589960765158, 'bb_std_mult': 2.3432567733910887, 'rsi_os': 50, 'rsi_ob': 79, 'vol_spike': 0.07444680188051593, 'adx_thresh': 27.86620548167705, 'atr_min_pct': 0.016238262127853714, 'atr_max_pct': 0.11636639610276536, 'tp_mult': 1.156695022428384, 'tsl_mult': 0.8131860482832294, 'strategy': 'breakout', 'time_stop': 265, 'use_sma': False, 'use_atr': True, 'use_adx': False, 'use_ema': True, 'use_spike': False, 'rsi_required': False, 'edge_k': 1.9529474367611432, 'edge_cap': 0.8707881838527238, 'bull_strategy': 'mean_reversion', 'bull_bb_std_mult': 2.52885574934261, 'bull_rsi_os': 22, 'bull_rsi_ob': 92, 'bull_adx_thresh': 24.962923444108167, 'bull_atr_min_pct': 0.01380863559098167, 'bull_atr_max_pct': 0.03855148901029931, 'bull_tp_mult': 1.3535158182688731, 'bull_tsl_mult': 0.03287845416996654, 'bull_time_stop': 213, 'bull_use_sma': False, 'bull_use_ema': True, 'bull_use_atr': False, 'bull_use_adx': True, 'bull_use_spike': False, 'bull_rsi_required': True, 'bear_strategy': 'breakout', 'bear_bb_std_mult': 1.4359960345825789, 'bear_rsi_os': 52, 'bear_rsi_ob': 54, 'bear_adx_thresh': 8.932618565464535, 'bear_atr_min_pct': 0.006024255126120533, 'bear_atr_max_pct': 0.05001169154264261, 'bear_tp_mult': 1.5092958746805494, 'bear_tsl_mult': 0.769604037494651, 'bear_time_stop': 178, 'bear_use_sma': True, 'bear_use_ema': False, 'bear_use_atr': False, 'bear_use_adx': False, 'bear_use_spike': True, 'bear_rsi_required': False, 'sideways_strategy': 'mean_reversion', 'sideways_bb_std_mult': 1.083435991612154, 'sideways_rsi_os': 23, 'sideways_rsi_ob': 77, 'sideways_adx_thresh': 30.740251229711355, 'sideways_atr_min_pct': 0.029590997447712555, 'sideways_atr_max_pct': 0.101979715914688, 'sideways_tp_mult': 2.841665894391204, 'sideways_tsl_mult': 0.7910504874781904, 'sideways_time_stop': 47, 'sideways_use_sma': True, 'sideways_use_ema': False, 'sideways_use_atr': True, 'sideways_use_adx': True, 'sideways_use_spike': False, 'sideways_rsi_required': True}.
[I 2025-09-01 15:13:02,512] Trial 498 finished with values: [-1000000000.0, 1000000000.0] and parameters: {'p_sma': 38, 'p_std': 26, 'p_atr': 10, 'p_adx': 15, 'rsi_period': 13, 'ema1': 26, 'ema2': 57, 'slip_atr_k': 0.010061723138305638, 'slip_spread_k': 0.438609801301986, 'spread_hl_frac': 0.006116034530979487, 'bb_std_mult': 2.328805119329354, 'rsi_os': 18, 'rsi_ob': 80, 'vol_spike': 0.12601101128476735, 'adx_thresh': 12.067562683758851, 'atr_min_pct': 0.004744410833124071, 'atr_max_pct': 0.05839869221013355, 'tp_mult': 1.1566212717479245, 'tsl_mult': 0.39888836664218125, 'strategy': 'breakout', 'time_stop': 50, 'use_sma': False, 'use_atr': True, 'use_adx': False, 'use_ema': True, 'use_spike': False, 'rsi_required': True, 'edge_k': 1.8427829680199883, 'edge_cap': 0.8740503575554847, 'bull_strategy': 'mean_reversion', 'bull_bb_std_mult': 0.6325024211140273, 'bull_rsi_os': 45, 'bull_rsi_ob': 61, 'bull_adx_thresh': 24.44937178136941, 'bull_atr_min_pct': 0.01358517635567162, 'bull_atr_max_pct': 0.021020001608718926, 'bull_tp_mult': 2.3914222699526557, 'bull_tsl_mult': 0.041387367744596275, 'bull_time_stop': 134, 'bull_use_sma': False, 'bull_use_ema': True, 'bull_use_atr': False, 'bull_use_adx': True, 'bull_use_spike': False, 'bull_rsi_required': True, 'bear_strategy': 'breakout', 'bear_bb_std_mult': 1.32417920810952, 'bear_rsi_os': 52, 'bear_rsi_ob': 81, 'bear_adx_thresh': 32.490508936913656, 'bear_atr_min_pct': 0.028396686525169183, 'bear_atr_max_pct': 0.0407061855876098, 'bear_tp_mult': 2.008922117934562, 'bear_tsl_mult': 0.7760159518243059, 'bear_time_stop': 245, 'bear_use_sma': True, 'bear_use_ema': False, 'bear_use_atr': False, 'bear_use_adx': False, 'bear_use_spike': True, 'bear_rsi_required': True, 'sideways_strategy': 'mean_reversion', 'sideways_bb_std_mult': 1.0959450995584064, 'sideways_rsi_os': 24, 'sideways_rsi_ob': 78, 'sideways_adx_thresh': 31.593611838569938, 'sideways_atr_min_pct': 0.007138209676604284, 'sideways_atr_max_pct': 0.1344798315090056, 'sideways_tp_mult': 1.8398029505076654, 'sideways_tsl_mult': 0.718960974320378, 'sideways_time_stop': 49, 'sideways_use_sma': True, 'sideways_use_ema': False, 'sideways_use_atr': True, 'sideways_use_adx': True, 'sideways_use_spike': False, 'sideways_rsi_required': True}.
[I 2025-09-01 15:13:03,287] Trial 495 finished with values: [-1000000000.0, 1000000000.0] and parameters: {'p_sma': 38, 'p_std': 23, 'p_atr': 8, 'p_adx': 13, 'rsi_period': 12, 'ema1': 26, 'ema2': 57, 'slip_atr_k': 0.08784245581456984, 'slip_spread_k': 0.1377533227722526, 'spread_hl_frac': 0.006036943881748288, 'bb_std_mult': 1.099171448463412, 'rsi_os': 32, 'rsi_ob': 78, 'vol_spike': 0.29226594004323003, 'adx_thresh': 20.11142396893136, 'atr_min_pct': 0.016166749530433837, 'atr_max_pct': 0.07224278380428055, 'tp_mult': 1.877460533515533, 'tsl_mult': 0.8423280762044578, 'strategy': 'breakout', 'time_stop': 49, 'use_sma': False, 'use_atr': True, 'use_adx': False, 'use_ema': True, 'use_spike': False, 'rsi_required': False, 'edge_k': 1.1021068515672348, 'edge_cap': 0.35249050820598504, 'bull_strategy': 'mean_reversion', 'bull_bb_std_mult': 3.3231694318597933, 'bull_rsi_os': 22, 'bull_rsi_ob': 68, 'bull_adx_thresh': 7.7669321718936555, 'bull_atr_min_pct': 0.014639168606450845, 'bull_atr_max_pct': 0.040011295063621256, 'bull_tp_mult': 1.3396794139707593, 'bull_tsl_mult': 0.042836212830934056, 'bull_time_stop': 123, 'bull_use_sma': True, 'bull_use_ema': True, 'bull_use_atr': False, 'bull_use_adx': True, 'bull_use_spike': True, 'bull_rsi_required': False, 'bear_strategy': 'breakout', 'bear_bb_std_mult': 1.7332118418736027, 'bear_rsi_os': 11, 'bear_rsi_ob': 51, 'bear_adx_thresh': 8.987805888659981, 'bear_atr_min_pct': 0.021674511342296598, 'bear_atr_max_pct': 0.03976743833996529, 'bear_tp_mult': 1.3145554141471605, 'bear_tsl_mult': 0.5116242615916046, 'bear_time_stop': 146, 'bear_use_sma': True, 'bear_use_ema': False, 'bear_use_atr': True, 'bear_use_adx': False, 'bear_use_spike': True, 'bear_rsi_required': False, 'sideways_strategy': 'mean_reversion', 'sideways_bb_std_mult': 3.3890243595351754, 'sideways_rsi_os': 25, 'sideways_rsi_ob': 77, 'sideways_adx_thresh': 31.482975818694584, 'sideways_atr_min_pct': 0.013669237984114655, 'sideways_atr_max_pct': 0.0554840289013129, 'sideways_tp_mult': 2.242782504216554, 'sideways_tsl_mult': 0.8053621193150113, 'sideways_time_stop': 136, 'sideways_use_sma': True, 'sideways_use_ema': False, 'sideways_use_atr': True, 'sideways_use_adx': True, 'sideways_use_spike': False, 'sideways_rsi_required': True}.
[I 2025-09-01 15:13:41,350] Trial 502 finished with values: [-0.024700732040126794, 0.027308499131455437] and parameters: {'p_sma': 30, 'p_std': 25, 'p_atr': 12, 'p_adx': 16, 'rsi_period': 58, 'ema1': 20, 'ema2': 15, 'slip_atr_k': 1.2440807864704667e-06, 'slip_spread_k': 0.4065392989192158, 'spread_hl_frac': 0.049192281273591376, 'bb_std_mult': 2.265649534044403, 'rsi_os': 29, 'rsi_ob': 72, 'vol_spike': 0.09581750650297075, 'adx_thresh': 29.088913974198242, 'atr_min_pct': 0.014827526698797512, 'atr_max_pct': 0.06307191650511842, 'tp_mult': 1.6029445690245625, 'tsl_mult': 0.4190689177754535, 'strategy': 'breakout', 'time_stop': 219, 'use_sma': True, 'use_atr': True, 'use_adx': False, 'use_ema': True, 'use_spike': False, 'rsi_required': True, 'edge_k': 1.0137313641241343, 'edge_cap': 0.6142895912722239, 'bull_strategy': 'mean_reversion', 'bull_bb_std_mult': 2.649913777991136, 'bull_rsi_os': 26, 'bull_rsi_ob': 83, 'bull_adx_thresh': 6.4874959775467556, 'bull_atr_min_pct': 0.016155548449140213, 'bull_atr_max_pct': 0.034970367756003116, 'bull_tp_mult': 1.4448208761910564, 'bull_tsl_mult': 0.582686610876405, 'bull_time_stop': 149, 'bull_use_sma': False, 'bull_use_ema': False, 'bull_use_atr': False, 'bull_use_adx': False, 'bull_use_spike': False, 'bull_rsi_required': True, 'bear_strategy': 'breakout', 'bear_bb_std_mult': 0.97354648785337, 'bear_rsi_os': 50, 'bear_rsi_ob': 66, 'bear_adx_thresh': 33.71972092588359, 'bear_atr_min_pct': 0.004982715116360467, 'bear_atr_max_pct': 0.07174030337055855, 'bear_tp_mult': 1.6334025081845385, 'bear_tsl_mult': 0.7156372709167365, 'bear_time_stop': 246, 'bear_use_sma': True, 'bear_use_ema': False, 'bear_use_atr': False, 'bear_use_adx': False, 'bear_use_spike': True, 'bear_rsi_required': True, 'sideways_strategy': 'mean_reversion', 'sideways_bb_std_mult': 2.0840631941797723, 'sideways_rsi_os': 27, 'sideways_rsi_ob': 59, 'sideways_adx_thresh': 33.06713579128382, 'sideways_atr_min_pct': 0.0029745289655581132, 'sideways_atr_max_pct': 0.04776138367768619, 'sideways_tp_mult': 2.903130824803949, 'sideways_tsl_mult': 0.7549573257499591, 'sideways_time_stop': 55, 'sideways_use_sma': True, 'sideways_use_ema': False, 'sideways_use_atr': True, 'sideways_use_adx': False, 'sideways_use_spike': False, 'sideways_rsi_required': True}.
[I 2025-09-01 15:13:42,088] Trial 500 finished with values: [-0.06762549772284343, 0.06745292699466302] and parameters: {'p_sma': 30, 'p_std': 27, 'p_atr': 12, 'p_adx': 16, 'rsi_period': 61, 'ema1': 27, 'ema2': 60, 'slip_atr_k': 0.015584679086220679, 'slip_spread_k': 0.5448007397915698, 'spread_hl_frac': 0.00713985835121435, 'bb_std_mult': 3.0743916533173996, 'rsi_os': 29, 'rsi_ob': 63, 'vol_spike': 0.20374215524552974, 'adx_thresh': 34.09656167951334, 'atr_min_pct': 0.014959407746561402, 'atr_max_pct': 0.06319941744675142, 'tp_mult': 2.0390517745230063, 'tsl_mult': 0.41812806277315995, 'strategy': 'breakout', 'time_stop': 14, 'use_sma': True, 'use_atr': True, 'use_adx': False, 'use_ema': True, 'use_spike': False, 'rsi_required': True, 'edge_k': 1.7462904960165382, 'edge_cap': 0.6183387472269708, 'bull_strategy': 'mean_reversion', 'bull_bb_std_mult': 1.0907786388867886, 'bull_rsi_os': 28, 'bull_rsi_ob': 64, 'bull_adx_thresh': 6.7421545293558385, 'bull_atr_min_pct': 3.608169725246267e-05, 'bull_atr_max_pct': 0.034928289153417294, 'bull_tp_mult': 1.534368076030785, 'bull_tsl_mult': 0.0011311772493074468, 'bull_time_stop': 150, 'bull_use_sma': True, 'bull_use_ema': False, 'bull_use_atr': False, 'bull_use_adx': False, 'bull_use_spike': False, 'bull_rsi_required': True, 'bear_strategy': 'breakout', 'bear_bb_std_mult': 1.5254744249573253, 'bear_rsi_os': 50, 'bear_rsi_ob': 68, 'bear_adx_thresh': 8.717223423126043, 'bear_atr_min_pct': 0.004825796588873848, 'bear_atr_max_pct': 0.04800801513819153, 'bear_tp_mult': 1.6490204626248155, 'bear_tsl_mult': 0.5103403272498117, 'bear_time_stop': 245, 'bear_use_sma': True, 'bear_use_ema': False, 'bear_use_atr': False, 'bear_use_adx': False, 'bear_use_spike': True, 'bear_rsi_required': True, 'sideways_strategy': 'mean_reversion', 'sideways_bb_std_mult': 1.1693810629971377, 'sideways_rsi_os': 11, 'sideways_rsi_ob': 87, 'sideways_adx_thresh': 32.69665621836695, 'sideways_atr_min_pct': 0.027935938377164828, 'sideways_atr_max_pct': 0.05359969679068313, 'sideways_tp_mult': 2.237178333135178, 'sideways_tsl_mult': 0.34212909286266535, 'sideways_time_stop': 208, 'sideways_use_sma': True, 'sideways_use_ema': False, 'sideways_use_atr': True, 'sideways_use_adx': False, 'sideways_use_spike': False, 'sideways_rsi_required': True}.
[I 2025-09-01 15:13:42,454] Trial 501 finished with values: [-0.028138520138754397, 0.030533620542020187] and parameters: {'p_sma': 30, 'p_std': 25, 'p_atr': 12, 'p_adx': 16, 'rsi_period': 52, 'ema1': 27, 'ema2': 60, 'slip_atr_k': 0.12188797239135113, 'slip_spread_k': 0.2728509845760551, 'spread_hl_frac': 0.026375884470357554, 'bb_std_mult': 1.0931225769645079, 'rsi_os': 29, 'rsi_ob': 52, 'vol_spike': 0.16149515395261407, 'adx_thresh': 13.57389831502661, 'atr_min_pct': 0.015324062115423878, 'atr_max_pct': 0.06402363871589183, 'tp_mult': 2.0391442868594654, 'tsl_mult': 0.1520775952372801, 'strategy': 'breakout', 'time_stop': 222, 'use_sma': True, 'use_atr': True, 'use_adx': False, 'use_ema': True, 'use_spike': False, 'rsi_required': True, 'edge_k': 1.02082053914314, 'edge_cap': 0.9309975678797404, 'bull_strategy': 'mean_reversion', 'bull_bb_std_mult': 1.773694851977024, 'bull_rsi_os': 23, 'bull_rsi_ob': 64, 'bull_adx_thresh': 29.218376558538363, 'bull_atr_min_pct': 0.016193879031026877, 'bull_atr_max_pct': 0.03466249047467081, 'bull_tp_mult': 1.9203896076349367, 'bull_tsl_mult': 0.32929405897687414, 'bull_time_stop': 149, 'bull_use_sma': True, 'bull_use_ema': False, 'bull_use_atr': False, 'bull_use_adx': False, 'bull_use_spike': False, 'bull_rsi_required': True, 'bear_strategy': 'breakout', 'bear_bb_std_mult': 1.5285752987106191, 'bear_rsi_os': 50, 'bear_rsi_ob': 51, 'bear_adx_thresh': 8.76565059526218, 'bear_atr_min_pct': 0.004920185851706886, 'bear_atr_max_pct': 0.04752785025205889, 'bear_tp_mult': 2.896397389027196, 'bear_tsl_mult': 0.022042542526440223, 'bear_time_stop': 130, 'bear_use_sma': True, 'bear_use_ema': False, 'bear_use_atr': False, 'bear_use_adx': False, 'bear_use_spike': True, 'bear_rsi_required': True, 'sideways_strategy': 'mean_reversion', 'sideways_bb_std_mult': 2.89664940642628, 'sideways_rsi_os': 50, 'sideways_rsi_ob': 59, 'sideways_adx_thresh': 33.0476732267081, 'sideways_atr_min_pct': 0.01232879229694037, 'sideways_atr_max_pct': 0.05493227687911772, 'sideways_tp_mult': 2.232523102088551, 'sideways_tsl_mult': 0.7560607130140167, 'sideways_time_stop': 196, 'sideways_use_sma': True, 'sideways_use_ema': False, 'sideways_use_atr': True, 'sideways_use_adx': False, 'sideways_use_spike': False, 'sideways_rsi_required': True}.
[I 2025-09-01 15:13:42,747] Trial 499 finished with values: [-1000000000.0, 1000000000.0] and parameters: {'p_sma': 30, 'p_std': 26, 'p_atr': 22, 'p_adx': 16, 'rsi_period': 52, 'ema1': 26, 'ema2': 60, 'slip_atr_k': 0.13132995502231096, 'slip_spread_k': 0.5417111823414829, 'spread_hl_frac': 0.0060940027899049915, 'bb_std_mult': 2.325128093323623, 'rsi_os': 29, 'rsi_ob': 52, 'vol_spike': 0.07109936870293176, 'adx_thresh': 29.023714890462557, 'atr_min_pct': 0.015376046437978196, 'atr_max_pct': 0.0595981319942918, 'tp_mult': 1.8360300116962522, 'tsl_mult': 0.3950460889493499, 'strategy': 'breakout', 'time_stop': 43, 'use_sma': False, 'use_atr': True, 'use_adx': False, 'use_ema': True, 'use_spike': False, 'rsi_required': True, 'edge_k': 1.8376225571709726, 'edge_cap': 0.87643279935145, 'bull_strategy': 'mean_reversion', 'bull_bb_std_mult': 1.0743574597879488, 'bull_rsi_os': 5, 'bull_rsi_ob': 50, 'bull_adx_thresh': 6.692125466961236, 'bull_atr_min_pct': 0.016250441031491626, 'bull_atr_max_pct': 0.021937299045214693, 'bull_tp_mult': 2.3894346498976957, 'bull_tsl_mult': 0.5437162918836802, 'bull_time_stop': 128, 'bull_use_sma': False, 'bull_use_ema': False, 'bull_use_atr': False, 'bull_use_adx': True, 'bull_use_spike': False, 'bull_rsi_required': True, 'bear_strategy': 'breakout', 'bear_bb_std_mult': 1.7297874957266504, 'bear_rsi_os': 33, 'bear_rsi_ob': 51, 'bear_adx_thresh': 8.855986010527676, 'bear_atr_min_pct': 0.006327143278268232, 'bear_atr_max_pct': 0.04948144016801254, 'bear_tp_mult': 2.015886504288172, 'bear_tsl_mult': 0.7815701153733016, 'bear_time_stop': 134, 'bear_use_sma': True, 'bear_use_ema': False, 'bear_use_atr': False, 'bear_use_adx': False, 'bear_use_spike': True, 'bear_rsi_required': True, 'sideways_strategy': 'mean_reversion', 'sideways_bb_std_mult': 2.3004741161187057, 'sideways_rsi_os': 37, 'sideways_rsi_ob': 78, 'sideways_adx_thresh': 31.759686191498446, 'sideways_atr_min_pct': 0.011248223147463363, 'sideways_atr_max_pct': 0.05581925257070444, 'sideways_tp_mult': 2.240559205980861, 'sideways_tsl_mult': 0.49206883632920323, 'sideways_time_stop': 49, 'sideways_use_sma': True, 'sideways_use_ema': False, 'sideways_use_atr': True, 'sideways_use_adx': True, 'sideways_use_spike': False, 'sideways_rsi_required': True}.
[I 2025-09-01 15:13:44,546] Trial 505 finished with values: [-1000000000.0, 1000000000.0] and parameters: {'p_sma': 13, 'p_std': 26, 'p_atr': 25, 'p_adx': 14, 'rsi_period': 49, 'ema1': 21, 'ema2': 58, 'slip_atr_k': 0.1343235777127959, 'slip_spread_k': 0.6625011330583921, 'spread_hl_frac': 0.016654955965109818, 'bb_std_mult': 2.1688438262207965, 'rsi_os': 41, 'rsi_ob': 48, 'vol_spike': 0.1924338896675068, 'adx_thresh': 27.733303462871113, 'atr_min_pct': 0.014142293186091887, 'atr_max_pct': 0.050112473407662485, 'tp_mult': 1.8271926272597354, 'tsl_mult': 0.3445999830592057, 'strategy': 'mean_reversion', 'time_stop': 134, 'use_sma': False, 'use_atr': True, 'use_adx': True, 'use_ema': True, 'use_spike': True, 'rsi_required': True, 'edge_k': 1.6934544521124621, 'edge_cap': 0.8316681293231554, 'bull_strategy': 'mean_reversion', 'bull_bb_std_mult': 2.34692596592949, 'bull_rsi_os': 29, 'bull_rsi_ob': 70, 'bull_adx_thresh': 5.479549482637658, 'bull_atr_min_pct': 0.016909153006499377, 'bull_atr_max_pct': 0.02800480460558316, 'bull_tp_mult': 1.4087436346084514, 'bull_tsl_mult': 0.06024460941636688, 'bull_time_stop': 129, 'bull_use_sma': False, 'bull_use_ema': True, 'bull_use_atr': True, 'bull_use_adx': True, 'bull_use_spike': True, 'bull_rsi_required': True, 'bear_strategy': 'mean_reversion', 'bear_bb_std_mult': 3.2271787879737497, 'bear_rsi_os': 43, 'bear_rsi_ob': 48, 'bear_adx_thresh': 10.534554320840426, 'bear_atr_min_pct': 0.014475560523743063, 'bear_atr_max_pct': 0.08506639597388545, 'bear_tp_mult': 2.614761490394678, 'bear_tsl_mult': 0.7297424229253102, 'bear_time_stop': 259, 'bear_use_sma': True, 'bear_use_ema': False, 'bear_use_atr': False, 'bear_use_adx': True, 'bear_use_spike': True, 'bear_rsi_required': True, 'sideways_strategy': 'breakout', 'sideways_bb_std_mult': 0.8870134274518342, 'sideways_rsi_os': 21, 'sideways_rsi_ob': 78, 'sideways_adx_thresh': 22.890942904802404, 'sideways_atr_min_pct': 0.012581662617275294, 'sideways_atr_max_pct': 0.04871463680423792, 'sideways_tp_mult': 1.4136713291884764, 'sideways_tsl_mult': 0.7712554460214559, 'sideways_time_stop': 284, 'sideways_use_sma': False, 'sideways_use_ema': False, 'sideways_use_atr': True, 'sideways_use_adx': True, 'sideways_use_spike': False, 'sideways_rsi_required': True}.
