[I 2025-09-01 13:59:19,987] Trial 25 finished with values: [-1000000000.0, 1000000000.0] and parameters: {'p_sma': 9, 'p_std': 5, 'p_atr': 29, 'p_adx': 28, 'rsi_period': 73, 'ema1': 15, 'ema2': 53, 'slip_atr_k': 0.1111316029020118, 'slip_spread_k': 0.07244813268815098, 'spread_hl_frac': 0.04278562664781274, 'bb_std_mult': 2.9012598468325783, 'rsi_os': 33, 'rsi_ob': 89, 'vol_spike': 0.297353829035526, 'adx_thresh': 7.980592995520302, 'atr_min_pct': 0.021884367958053833, 'atr_max_pct': 0.13558261694287987, 'tp_mult': 2.4606635995598083, 'tsl_mult': 0.5215528762340973, 'strategy': 'breakout', 'time_stop': 54, 'use_sma': False, 'use_atr': False, 'use_adx': False, 'use_ema': False, 'use_spike': False, 'rsi_required': True, 'edge_k': 1.1687795194993829, 'edge_cap': 0.9715126554416974, 'bull_strategy': 'breakout', 'bull_bb_std_mult': 0.953656857214936, 'bull_rsi_os': 32, 'bull_rsi_ob': 59, 'bull_adx_thresh': 32.11433988309727, 'bull_atr_min_pct': 0.002843330903722226, 'bull_atr_max_pct': 0.12823403300642403, 'bull_tp_mult': 2.00618855713676, 'bull_tsl_mult': 0.35569935611439996, 'bull_time_stop': 84, 'bull_use_sma': False, 'bull_use_ema': True, 'bull_use_atr': False, 'bull_use_adx': True, 'bull_use_spike': False, 'bull_rsi_required': True, 'bear_strategy': 'breakout', 'bear_bb_std_mult': 0.6656502025773594, 'bear_rsi_os': 46, 'bear_rsi_ob': 46, 'bear_adx_thresh': 32.083960726376425, 'bear_atr_min_pct': 0.004997388967256105, 'bear_atr_max_pct': 0.023135765708158763, 'bear_tp_mult': 1.3111293390188643, 'bear_tsl_mult': 0.049112057683332266, 'bear_time_stop': 147, 'bear_use_sma': False, 'bear_use_ema': True, 'bear_use_atr': False, 'bear_use_adx': False, 'bear_use_spike': True, 'bear_rsi_required': True, 'sideways_strategy': 'breakout', 'sideways_bb_std_mult': 0.5083383745225404, 'sideways_rsi_os': 33, 'sideways_rsi_ob': 88, 'sideways_adx_thresh': 32.51214132909427, 'sideways_atr_min_pct': 0.018855802923990677, 'sideways_atr_max_pct': 0.03014388930456486, 'sideways_tp_mult': 2.07270013644546, 'sideways_tsl_mult': 0.8948512701908544, 'sideways_time_stop': 261, 'sideways_use_sma': False, 'sideways_use_ema': True, 'sideways_use_atr': False, 'sideways_use_adx': True, 'sideways_use_spike': True, 'sideways_rsi_required': False}.
[I 2025-09-01 13:59:21,226] Trial 28 finished with values: [-1000000000.0, 1000000000.0] and parameters: {'p_sma': 51, 'p_std': 37, 'p_atr': 16, 'p_adx': 18, 'rsi_period': 55, 'ema1': 8, 'ema2': 35, 'slip_atr_k': 0.042617367834615734, 'slip_spread_k': 0.36625709400007506, 'spread_hl_frac': 0.024604944081594755, 'bb_std_mult': 3.5946349515875866, 'rsi_os': 50, 'rsi_ob': 76, 'vol_spike': 0.0344859783904657, 'adx_thresh': 20.3279259922516, 'atr_min_pct': 0.021828205413660276, 'atr_max_pct': 0.10744676156568056, 'tp_mult': 2.9862218242896175, 'tsl_mult': 0.6866376810453185, 'strategy': 'breakout', 'time_stop': 51, 'use_sma': False, 'use_atr': False, 'use_adx': False, 'use_ema': False, 'use_spike': False, 'rsi_required': True, 'edge_k': 1.1929191712547178, 'edge_cap': 0.645499337941754, 'bull_strategy': 'breakout', 'bull_bb_std_mult': 0.9818370471554227, 'bull_rsi_os': 49, 'bull_rsi_ob': 69, 'bull_adx_thresh': 13.634108992322943, 'bull_atr_min_pct': 0.009274752470605333, 'bull_atr_max_pct': 0.029493265069146412, 'bull_tp_mult': 1.5438882069071027, 'bull_tsl_mult': 0.32147442116779334, 'bull_time_stop': 46, 'bull_use_sma': False, 'bull_use_ema': True, 'bull_use_atr': False, 'bull_use_adx': True, 'bull_use_spike': False, 'bull_rsi_required': True, 'bear_strategy': 'breakout', 'bear_bb_std_mult': 2.4833367565342357, 'bear_rsi_os': 51, 'bear_rsi_ob': 49, 'bear_adx_thresh': 12.180780955407872, 'bear_atr_min_pct': 0.016865237249054733, 'bear_atr_max_pct': 0.0215687254484571, 'bear_tp_mult': 2.713568827406187, 'bear_tsl_mult': 0.24410782752703442, 'bear_time_stop': 264, 'bear_use_sma': False, 'bear_use_ema': True, 'bear_use_atr': False, 'bear_use_adx': False, 'bear_use_spike': True, 'bear_rsi_required': True, 'sideways_strategy': 'breakout', 'sideways_bb_std_mult': 2.0122295735567923, 'sideways_rsi_os': 15, 'sideways_rsi_ob': 77, 'sideways_adx_thresh': 22.120788851751218, 'sideways_atr_min_pct': 0.024330685316993388, 'sideways_atr_max_pct': 0.11925221260300445, 'sideways_tp_mult': 2.086368310523823, 'sideways_tsl_mult': 0.9016258578932543, 'sideways_time_stop': 187, 'sideways_use_sma': False, 'sideways_use_ema': True, 'sideways_use_atr': False, 'sideways_use_adx': True, 'sideways_use_spike': True, 'sideways_rsi_required': False}.
[I 2025-09-01 13:59:21,629] Trial 29 finished with values: [-1000000000.0, 1000000000.0] and parameters: {'p_sma': 52, 'p_std': 24, 'p_atr': 21, 'p_adx': 14, 'rsi_period': 35, 'ema1': 14, 'ema2': 27, 'slip_atr_k': 0.04296450943338056, 'slip_spread_k': 0.6012947099493525, 'spread_hl_frac': 0.021293820131995267, 'bb_std_mult': 3.542393093829725, 'rsi_os': 51, 'rsi_ob': 89, 'vol_spike': 0.09190758179025446, 'adx_thresh': 29.68004758721924, 'atr_min_pct': 0.021110661736602716, 'atr_max_pct': 0.08291904030145734, 'tp_mult': 1.9285996840656934, 'tsl_mult': 0.6698672237931383, 'strategy': 'breakout', 'time_stop': 115, 'use_sma': False, 'use_atr': False, 'use_adx': False, 'use_ema': True, 'use_spike': False, 'rsi_required': True, 'edge_k': 1.5263959794808746, 'edge_cap': 0.33917902818689016, 'bull_strategy': 'breakout', 'bull_bb_std_mult': 0.8382076003032213, 'bull_rsi_os': 51, 'bull_rsi_ob': 69, 'bull_adx_thresh': 14.198878033443053, 'bull_atr_min_pct': 0.010529227868855257, 'bull_atr_max_pct': 0.03478679168249294, 'bull_tp_mult': 1.913589869590687, 'bull_tsl_mult': 0.2666514575405974, 'bull_time_stop': 93, 'bull_use_sma': False, 'bull_use_ema': False, 'bull_use_atr': False, 'bull_use_adx': True, 'bull_use_spike': False, 'bull_rsi_required': True, 'bear_strategy': 'breakout', 'bear_bb_std_mult': 3.2116390420637533, 'bear_rsi_os': 51, 'bear_rsi_ob': 48, 'bear_adx_thresh': 11.334135909491327, 'bear_atr_min_pct': 0.01626571604517051, 'bear_atr_max_pct': 0.027687334720777026, 'bear_tp_mult': 2.774300638788203, 'bear_tsl_mult': 0.20221345433398313, 'bear_time_stop': 268, 'bear_use_sma': False, 'bear_use_ema': True, 'bear_use_atr': False, 'bear_use_adx': False, 'bear_use_spike': True, 'bear_rsi_required': True, 'sideways_strategy': 'breakout', 'sideways_bb_std_mult': 2.091962632853105, 'sideways_rsi_os': 13, 'sideways_rsi_ob': 77, 'sideways_adx_thresh': 15.430279603521447, 'sideways_atr_min_pct': 0.024400730987030446, 'sideways_atr_max_pct': 0.11829139855103601, 'sideways_tp_mult': 2.0449495774023183, 'sideways_tsl_mult': 0.8918078554181479, 'sideways_time_stop': 256, 'sideways_use_sma': False, 'sideways_use_ema': True, 'sideways_use_atr': False, 'sideways_use_adx': True, 'sideways_use_spike': True, 'sideways_rsi_required': False}.
[I 2025-09-01 13:59:56,288] Trial 33 finished with values: [-1000000000.0, 1000000000.0] and parameters: {'p_sma': 33, 'p_std': 21, 'p_atr': 23, 'p_adx': 20, 'rsi_period': 31, 'ema1': 24, 'ema2': 20, 'slip_atr_k': 0.13297593265299013, 'slip_spread_k': 0.45886250396495737, 'spread_hl_frac': 0.034709004605078655, 'bb_std_mult': 3.071061424985433, 'rsi_os': 42, 'rsi_ob': 81, 'vol_spike': 0.09723440474744706, 'adx_thresh': 23.3203581695085, 'atr_min_pct': 0.0022966615942072886, 'atr_max_pct': 0.025610489688801787, 'tp_mult': 2.6622539668154577, 'tsl_mult': 0.25460590002180766, 'strategy': 'mean_reversion', 'time_stop': 263, 'use_sma': True, 'use_atr': True, 'use_adx': True, 'use_ema': True, 'use_spike': True, 'rsi_required': True, 'edge_k': 0.8724835538936077, 'edge_cap': 0.4962993825625781, 'bull_strategy': 'mean_reversion', 'bull_bb_std_mult': 2.4802189628931948, 'bull_rsi_os': 42, 'bull_rsi_ob': 77, 'bull_adx_thresh': 9.003454778602874, 'bull_atr_min_pct': 0.015482946431930858, 'bull_atr_max_pct': 0.06772564588006287, 'bull_tp_mult': 1.0109503771407684, 'bull_tsl_mult': 0.04217489303848987, 'bull_time_stop': 46, 'bull_use_sma': True, 'bull_use_ema': False, 'bull_use_atr': True, 'bull_use_adx': True, 'bull_use_spike': True, 'bull_rsi_required': False, 'bear_strategy': 'mean_reversion', 'bear_bb_std_mult': 1.6882731645780116, 'bear_rsi_os': 43, 'bear_rsi_ob': 89, 'bear_adx_thresh': 16.343830088600487, 'bear_atr_min_pct': 0.02940184586488918, 'bear_atr_max_pct': 0.04519859907409917, 'bear_tp_mult': 2.072234740206699, 'bear_tsl_mult': 0.4216726418844837, 'bear_time_stop': 230, 'bear_use_sma': True, 'bear_use_ema': False, 'bear_use_atr': True, 'bear_use_adx': True, 'bear_use_spike': True, 'bear_rsi_required': True, 'sideways_strategy': 'mean_reversion', 'sideways_bb_std_mult': 2.54550445571557, 'sideways_rsi_os': 9, 'sideways_rsi_ob': 69, 'sideways_adx_thresh': 28.220815732746328, 'sideways_atr_min_pct': 0.015281916907174396, 'sideways_atr_max_pct': 0.08495440978464787, 'sideways_tp_mult': 2.678638584391482, 'sideways_tsl_mult': 0.5564092607721122, 'sideways_time_stop': 134, 'sideways_use_sma': True, 'sideways_use_ema': False, 'sideways_use_atr': True, 'sideways_use_adx': False, 'sideways_use_spike': False, 'sideways_rsi_required': True}.
[I 2025-09-01 13:59:58,655] Trial 32 finished with values: [-1000000000.0, 1000000000.0] and parameters: {'p_sma': 32, 'p_std': 23, 'p_atr': 22, 'p_adx': 13, 'rsi_period': 38, 'ema1': 24, 'ema2': 28, 'slip_atr_k': 0.030167465680081728, 'slip_spread_k': 0.6057813159283879, 'spread_hl_frac': 0.034580175706604446, 'bb_std_mult': 2.187836541408306, 'rsi_os': 43, 'rsi_ob': 80, 'vol_spike': 0.0963262553807985, 'adx_thresh': 34.91849228175628, 'atr_min_pct': 0.002754895598863897, 'atr_max_pct': 0.035062123795223776, 'tp_mult': 1.904984350154205, 'tsl_mult': 0.22015545710700796, 'strategy': 'breakout', 'time_stop': 241, 'use_sma': False, 'use_atr': False, 'use_adx': False, 'use_ema': True, 'use_spike': False, 'rsi_required': True, 'edge_k': 0.8551651532684796, 'edge_cap': 0.4707680518300804, 'bull_strategy': 'breakout', 'bull_bb_std_mult': 2.5124416424027634, 'bull_rsi_os': 40, 'bull_rsi_ob': 69, 'bull_adx_thresh': 10.581348973314519, 'bull_atr_min_pct': 0.014573859970006242, 'bull_atr_max_pct': 0.040635605020517496, 'bull_tp_mult': 1.2080160662089963, 'bull_tsl_mult': 0.4578511765171096, 'bull_time_stop': 96, 'bull_use_sma': False, 'bull_use_ema': False, 'bull_use_atr': False, 'bull_use_adx': True, 'bull_use_spike': False, 'bull_rsi_required': True, 'bear_strategy': 'breakout', 'bear_bb_std_mult': 3.0758038713625644, 'bear_rsi_os': 44, 'bear_rsi_ob': 89, 'bear_adx_thresh': 16.86521486626795, 'bear_atr_min_pct': 0.02255988791283978, 'bear_atr_max_pct': 0.03100737420989927, 'bear_tp_mult': 2.050902700814228, 'bear_tsl_mult': 0.1491636525312654, 'bear_time_stop': 218, 'bear_use_sma': False, 'bear_use_ema': True, 'bear_use_atr': False, 'bear_use_adx': True, 'bear_use_spike': True, 'bear_rsi_required': True, 'sideways_strategy': 'breakout', 'sideways_bb_std_mult': 2.686165431551837, 'sideways_rsi_os': 10, 'sideways_rsi_ob': 68, 'sideways_adx_thresh': 28.074523375047416, 'sideways_atr_min_pct': 0.023184724204254586, 'sideways_atr_max_pct': 0.11256882840354676, 'sideways_tp_mult': 2.7715772746935574, 'sideways_tsl_mult': 0.3867313374591844, 'sideways_time_stop': 152, 'sideways_use_sma': False, 'sideways_use_ema': True, 'sideways_use_atr': False, 'sideways_use_adx': False, 'sideways_use_spike': True, 'sideways_rsi_required': False}.
[I 2025-09-01 13:59:59,311] Trial 30 finished with values: [-1000000000.0, 1000000000.0] and parameters: {'p_sma': 54, 'p_std': 23, 'p_atr': 21, 'p_adx': 14, 'rsi_period': 36, 'ema1': 19, 'ema2': 28, 'slip_atr_k': 0.04359580995795578, 'slip_spread_k': 0.5907530325960029, 'spread_hl_frac': 0.02435559929653873, 'bb_std_mult': 3.5964133142677617, 'rsi_os': 50, 'rsi_ob': 81, 'vol_spike': 0.09151901192213599, 'adx_thresh': 34.76601007055417, 'atr_min_pct': 0.01183507991435496, 'atr_max_pct': 0.03156661632176551, 'tp_mult': 1.8987515664859367, 'tsl_mult': 0.6857249914177898, 'strategy': 'breakout', 'time_stop': 118, 'use_sma': False, 'use_atr': False, 'use_adx': False, 'use_ema': True, 'use_spike': False, 'rsi_required': True, 'edge_k': 1.55181777285766, 'edge_cap': 0.3116975778634634, 'bull_strategy': 'breakout', 'bull_bb_std_mult': 1.3459234547414283, 'bull_rsi_os': 49, 'bull_rsi_ob': 72, 'bull_adx_thresh': 9.75948138400508, 'bull_atr_min_pct': 0.008719271489356209, 'bull_atr_max_pct': 0.03500736279373168, 'bull_tp_mult': 1.2103535151154485, 'bull_tsl_mult': 0.28403808457682683, 'bull_time_stop': 47, 'bull_use_sma': False, 'bull_use_ema': False, 'bull_use_atr': False, 'bull_use_adx': True, 'bull_use_spike': False, 'bull_rsi_required': True, 'bear_strategy': 'breakout', 'bear_bb_std_mult': 3.2254418457812015, 'bear_rsi_os': 51, 'bear_rsi_ob': 50, 'bear_adx_thresh': 12.451882118671685, 'bear_atr_min_pct': 0.02991514552765604, 'bear_atr_max_pct': 0.02728738740761843, 'bear_tp_mult': 2.056010245693233, 'bear_tsl_mult': 0.2079257226129682, 'bear_time_stop': 264, 'bear_use_sma': False, 'bear_use_ema': True, 'bear_use_atr': False, 'bear_use_adx': False, 'bear_use_spike': True, 'bear_rsi_required': True, 'sideways_strategy': 'breakout', 'sideways_bb_std_mult': 2.007389965781434, 'sideways_rsi_os': 14, 'sideways_rsi_ob': 79, 'sideways_adx_thresh': 14.363225981979149, 'sideways_atr_min_pct': 0.02379959335155139, 'sideways_atr_max_pct': 0.11274751546913035, 'sideways_tp_mult': 2.1194330021507612, 'sideways_tsl_mult': 0.7661926379369196, 'sideways_time_stop': 180, 'sideways_use_sma': False, 'sideways_use_ema': True, 'sideways_use_atr': False, 'sideways_use_adx': True, 'sideways_use_spike': True, 'sideways_rsi_required': False}.
[I 2025-09-01 13:59:59,311] Trial 31 finished with values: [-1000000000.0, 1000000000.0] and parameters: {'p_sma': 53, 'p_std': 22, 'p_atr': 22, 'p_adx': 14, 'rsi_period': 34, 'ema1': 19, 'ema2': 28, 'slip_atr_k': 0.043264548664769184, 'slip_spread_k': 0.6154442517254521, 'spread_hl_frac': 0.021643436285885526, 'bb_std_mult': 2.1513816053426797, 'rsi_os': 50, 'rsi_ob': 80, 'vol_spike': 0.09786513390501844, 'adx_thresh': 18.67934870945351, 'atr_min_pct': 0.011575724761049393, 'atr_max_pct': 0.08682337507700111, 'tp_mult': 2.7235593464410455, 'tsl_mult': 0.6771349540719065, 'strategy': 'breakout', 'time_stop': 111, 'use_sma': False, 'use_atr': False, 'use_adx': False, 'use_ema': True, 'use_spike': False, 'rsi_required': True, 'edge_k': 0.8751784160161026, 'edge_cap': 0.4768190714898422, 'bull_strategy': 'breakout', 'bull_bb_std_mult': 2.611169697120136, 'bull_rsi_os': 50, 'bull_rsi_ob': 68, 'bull_adx_thresh': 9.005062030198738, 'bull_atr_min_pct': 0.010559784259004303, 'bull_atr_max_pct': 0.04064448447528116, 'bull_tp_mult': 1.162590050711514, 'bull_tsl_mult': 0.26530470039962695, 'bull_time_stop': 47, 'bull_use_sma': False, 'bull_use_ema': False, 'bull_use_atr': False, 'bull_use_adx': True, 'bull_use_spike': False, 'bull_rsi_required': True, 'bear_strategy': 'breakout', 'bear_bb_std_mult': 3.0824603277326763, 'bear_rsi_os': 52, 'bear_rsi_ob': 51, 'bear_adx_thresh': 11.979879696520282, 'bear_atr_min_pct': 0.016814805097664292, 'bear_atr_max_pct': 0.029352648218002386, 'bear_tp_mult': 2.7416764985534674, 'bear_tsl_mult': 0.17198800536193573, 'bear_time_stop': 264, 'bear_use_sma': False, 'bear_use_ema': True, 'bear_use_atr': False, 'bear_use_adx': False, 'bear_use_spike': True, 'bear_rsi_required': True, 'sideways_strategy': 'breakout', 'sideways_bb_std_mult': 2.7992686659692243, 'sideways_rsi_os': 14, 'sideways_rsi_ob': 69, 'sideways_adx_thresh': 14.848326671813798, 'sideways_atr_min_pct': 0.02271620275913064, 'sideways_atr_max_pct': 0.11200612290646042, 'sideways_tp_mult': 1.0114446207485592, 'sideways_tsl_mult': 0.7636742150085234, 'sideways_time_stop': 182, 'sideways_use_sma': False, 'sideways_use_ema': True, 'sideways_use_atr': False, 'sideways_use_adx': True, 'sideways_use_spike': True, 'sideways_rsi_required': False}.
[I 2025-09-01 14:00:34,376] Trial 37 finished with values: [-1000000000.0, 1000000000.0] and parameters: {'p_sma': 39, 'p_std': 11, 'p_atr': 11, 'p_adx': 11, 'rsi_period': 43, 'ema1': 21, 'ema2': 43, 'slip_atr_k': 0.09117193705745258, 'slip_spread_k': 0.3222691903048359, 'spread_hl_frac': 0.010250265255220985, 'bb_std_mult': 2.6258456971300586, 'rsi_os': 24, 'rsi_ob': 69, 'vol_spike': 0.05422628269202555, 'adx_thresh': 14.335054756801547, 'atr_min_pct': 0.006864711475511311, 'atr_max_pct': 0.0745057463533924, 'tp_mult': 2.2833824402673986, 'tsl_mult': 0.3392949062560453, 'strategy': 'mean_reversion', 'time_stop': 168, 'use_sma': True, 'use_atr': True, 'use_adx': True, 'use_ema': False, 'use_spike': True, 'rsi_required': False, 'edge_k': 1.3926716298379054, 'edge_cap': 0.775036708382668, 'bull_strategy': 'mean_reversion', 'bull_bb_std_mult': 2.1411174892558384, 'bull_rsi_os': 27, 'bull_rsi_ob': 75, 'bull_adx_thresh': 15.46143519473496, 'bull_atr_min_pct': 0.017211543622499496, 'bull_atr_max_pct': 0.060423919186376296, 'bull_tp_mult': 2.5435283449477977, 'bull_tsl_mult': 0.10787837702771674, 'bull_time_stop': 142, 'bull_use_sma': True, 'bull_use_ema': True, 'bull_use_atr': True, 'bull_use_adx': False, 'bull_use_spike': True, 'bull_rsi_required': False, 'bear_strategy': 'mean_reversion', 'bear_bb_std_mult': 2.7720282606173914, 'bear_rsi_os': 21, 'bear_rsi_ob': 78, 'bear_adx_thresh': 9.330588727909678, 'bear_atr_min_pct': 0.003052444247557309, 'bear_atr_max_pct': 0.07231478145953849, 'bear_tp_mult': 1.688781106846112, 'bear_tsl_mult': 0.6618472498295265, 'bear_time_stop': 286, 'bear_use_sma': False, 'bear_use_ema': False, 'bear_use_atr': False, 'bear_use_adx': False, 'bear_use_spike': False, 'bear_rsi_required': False, 'sideways_strategy': 'mean_reversion', 'sideways_bb_std_mult': 1.3069572347467364, 'sideways_rsi_os': 29, 'sideways_rsi_ob': 83, 'sideways_adx_thresh': 24.385074034779183, 'sideways_atr_min_pct': 0.005311401320943028, 'sideways_atr_max_pct': 0.042054222802334985, 'sideways_tp_mult': 2.4025129759825896, 'sideways_tsl_mult': 0.6668133608472879, 'sideways_time_stop': 97, 'sideways_use_sma': True, 'sideways_use_ema': False, 'sideways_use_atr': True, 'sideways_use_adx': False, 'sideways_use_spike': False, 'sideways_rsi_required': True}.
[I 2025-09-01 14:00:34,741] Trial 36 finished with values: [-1000000000.0, 1000000000.0] and parameters: {'p_sma': 39, 'p_std': 11, 'p_atr': 24, 'p_adx': 12, 'rsi_period': 67, 'ema1': 22, 'ema2': 37, 'slip_atr_k': 0.16946531589048874, 'slip_spread_k': 0.323149932145394, 'spread_hl_frac': 0.044317124854004505, 'bb_std_mult': 2.635104465995708, 'rsi_os': 24, 'rsi_ob': 70, 'vol_spike': 0.2675718878608512, 'adx_thresh': 13.787375927799118, 'atr_min_pct': 0.007557132137234757, 'atr_max_pct': 0.0734169765766922, 'tp_mult': 1.5381022780002973, 'tsl_mult': 0.11067321357384402, 'strategy': 'mean_reversion', 'time_stop': 78, 'use_sma': True, 'use_atr': True, 'use_adx': True, 'use_ema': False, 'use_spike': True, 'rsi_required': False, 'edge_k': 0.6873698404969815, 'edge_cap': 0.7905081498734035, 'bull_strategy': 'mean_reversion', 'bull_bb_std_mult': 1.4955041734890397, 'bull_rsi_os': 36, 'bull_rsi_ob': 74, 'bull_adx_thresh': 15.606601955311124, 'bull_atr_min_pct': 0.01738035816632789, 'bull_atr_max_pct': 0.024292998431164073, 'bull_tp_mult': 2.466507718811478, 'bull_tsl_mult': 0.1088633627551851, 'bull_time_stop': 143, 'bull_use_sma': True, 'bull_use_ema': True, 'bull_use_atr': True, 'bull_use_adx': False, 'bull_use_spike': True, 'bull_rsi_required': False, 'bear_strategy': 'mean_reversion', 'bear_bb_std_mult': 2.768205788651034, 'bear_rsi_os': 20, 'bear_rsi_ob': 76, 'bear_adx_thresh': 9.558525885180961, 'bear_atr_min_pct': 0.0029165988860914904, 'bear_atr_max_pct': 0.012119651744693545, 'bear_tp_mult': 1.9056491939496047, 'bear_tsl_mult': 0.39630034622784766, 'bear_time_stop': 298, 'bear_use_sma': False, 'bear_use_ema': False, 'bear_use_atr': False, 'bear_use_adx': False, 'bear_use_spike': False, 'bear_rsi_required': False, 'sideways_strategy': 'mean_reversion', 'sideways_bb_std_mult': 1.1901161896156336, 'sideways_rsi_os': 29, 'sideways_rsi_ob': 83, 'sideways_adx_thresh': 25.191611779776938, 'sideways_atr_min_pct': 0.00026325006913891814, 'sideways_atr_max_pct': 0.042171323679094035, 'sideways_tp_mult': 2.4192078490148115, 'sideways_tsl_mult': 0.12759954704002652, 'sideways_time_stop': 50, 'sideways_use_sma': True, 'sideways_use_ema': False, 'sideways_use_atr': True, 'sideways_use_adx': False, 'sideways_use_spike': False, 'sideways_rsi_required': True}.
