[I 2025-09-01 14:22:13,652] Trial 170 finished with values: [-1000000000.0, 1000000000.0] and parameters: {'p_sma': 27, 'p_std': 6, 'p_atr': 7, 'p_adx': 12, 'rsi_period': 42, 'ema1': 28, 'ema2': 29, 'slip_atr_k': 0.03496540688816067, 'slip_spread_k': 0.4715626393762357, 'spread_hl_frac': 0.00962359513959933, 'bb_std_mult': 2.3203036065304845, 'rsi_os': 22, 'rsi_ob': 77, 'vol_spike': 0.023987556889378106, 'adx_thresh': 28.04090317086079, 'atr_min_pct': 0.006756548602572828, 'atr_max_pct': 0.05070624877960992, 'tp_mult': 2.2315507045312764, 'tsl_mult': 0.43226104403917515, 'strategy': 'breakout', 'time_stop': 80, 'use_sma': False, 'use_atr': False, 'use_adx': True, 'use_ema': False, 'use_spike': False, 'rsi_required': True, 'edge_k': 0.8395012265126646, 'edge_cap': 0.656842549802145, 'bull_strategy': 'breakout', 'bull_bb_std_mult': 2.6960378202057984, 'bull_rsi_os': 36, 'bull_rsi_ob': 52, 'bull_adx_thresh': 16.148795855865224, 'bull_atr_min_pct': 0.0061660524576847755, 'bull_atr_max_pct': 0.0461317833478122, 'bull_tp_mult': 1.0754096730995675, 'bull_tsl_mult': 0.44167334492969645, 'bull_time_stop': 82, 'bull_use_sma': False, 'bull_use_ema': False, 'bull_use_atr': False, 'bull_use_adx': True, 'bull_use_spike': False, 'bull_rsi_required': True, 'bear_strategy': 'breakout', 'bear_bb_std_mult': 2.085076700084724, 'bear_rsi_os': 6, 'bear_rsi_ob': 82, 'bear_adx_thresh': 5.700364751070798, 'bear_atr_min_pct': 0.004357727955033286, 'bear_atr_max_pct': 0.04234561521945226, 'bear_tp_mult': 1.674026234915462, 'bear_tsl_mult': 0.622097333095785, 'bear_time_stop': 238, 'bear_use_sma': False, 'bear_use_ema': True, 'bear_use_atr': False, 'bear_use_adx': False, 'bear_use_spike': False, 'bear_rsi_required': True, 'sideways_strategy': 'mean_reversion', 'sideways_bb_std_mult': 0.5866751434683655, 'sideways_rsi_os': 36, 'sideways_rsi_ob': 48, 'sideways_adx_thresh': 32.67125212308254, 'sideways_atr_min_pct': 0.011951440096458429, 'sideways_atr_max_pct': 0.0889824983756285, 'sideways_tp_mult': 1.9610377360134812, 'sideways_tsl_mult': 0.8859957048077958, 'sideways_time_stop': 21, 'sideways_use_sma': True, 'sideways_use_ema': True, 'sideways_use_atr': False, 'sideways_use_adx': True, 'sideways_use_spike': True, 'sideways_rsi_required': False}.
[I 2025-09-01 14:22:13,838] Trial 171 finished with values: [-1000000000.0, 1000000000.0] and parameters: {'p_sma': 27, 'p_std': 29, 'p_atr': 15, 'p_adx': 30, 'rsi_period': 83, 'ema1': 30, 'ema2': 40, 'slip_atr_k': 0.11678734781215692, 'slip_spread_k': 0.8555872507809349, 'spread_hl_frac': 0.01020476394155693, 'bb_std_mult': 2.63035833880756, 'rsi_os': 41, 'rsi_ob': 60, 'vol_spike': 0.010593820288945571, 'adx_thresh': 27.995453182265745, 'atr_min_pct': 0.027452602882023218, 'atr_max_pct': 0.07409722601547511, 'tp_mult': 2.2394068572914163, 'tsl_mult': 0.4180447063165797, 'strategy': 'breakout', 'time_stop': 80, 'use_sma': False, 'use_atr': False, 'use_adx': False, 'use_ema': False, 'use_spike': False, 'rsi_required': True, 'edge_k': 0.4634429320560794, 'edge_cap': 0.37850862194910473, 'bull_strategy': 'breakout', 'bull_bb_std_mult': 3.006734935782747, 'bull_rsi_os': 19, 'bull_rsi_ob': 56, 'bull_adx_thresh': 16.069644198060594, 'bull_atr_min_pct': 0.02264511426835307, 'bull_atr_max_pct': 0.12109816939595093, 'bull_tp_mult': 1.2163354151696735, 'bull_tsl_mult': 0.43587739282344695, 'bull_time_stop': 256, 'bull_use_sma': False, 'bull_use_ema': False, 'bull_use_atr': False, 'bull_use_adx': True, 'bull_use_spike': False, 'bull_rsi_required': True, 'bear_strategy': 'breakout', 'bear_bb_std_mult': 3.1562021477745565, 'bear_rsi_os': 52, 'bear_rsi_ob': 82, 'bear_adx_thresh': 5.885768642418199, 'bear_atr_min_pct': 0.0060307901431390955, 'bear_atr_max_pct': 0.04184956367307985, 'bear_tp_mult': 2.5891988898770766, 'bear_tsl_mult': 0.05751999754304232, 'bear_time_stop': 237, 'bear_use_sma': False, 'bear_use_ema': True, 'bear_use_atr': False, 'bear_use_adx': False, 'bear_use_spike': False, 'bear_rsi_required': True, 'sideways_strategy': 'breakout', 'sideways_bb_std_mult': 1.5027961412753252, 'sideways_rsi_os': 17, 'sideways_rsi_ob': 47, 'sideways_adx_thresh': 24.60746806317791, 'sideways_atr_min_pct': 0.01208500303635194, 'sideways_atr_max_pct': 0.0899716328087883, 'sideways_tp_mult': 1.7718095429356795, 'sideways_tsl_mult': 0.949860042799771, 'sideways_time_stop': 56, 'sideways_use_sma': False, 'sideways_use_ema': True, 'sideways_use_atr': False, 'sideways_use_adx': True, 'sideways_use_spike': True, 'sideways_rsi_required': False}.
[I 2025-09-01 14:22:49,919] Trial 174 finished with values: [-0.042327972156637195, 0.042133678631457644] and parameters: {'p_sma': 23, 'p_std': 34, 'p_atr': 14, 'p_adx': 22, 'rsi_period': 69, 'ema1': 21, 'ema2': 20, 'slip_atr_k': 0.04391261723736598, 'slip_spread_k': 0.453023772655275, 'spread_hl_frac': 0.04633875671012552, 'bb_std_mult': 1.65960143726051, 'rsi_os': 9, 'rsi_ob': 83, 'vol_spike': 0.010170244246495392, 'adx_thresh': 26.18469610450532, 'atr_min_pct': 0.005921410492260171, 'atr_max_pct': 0.10101320961398716, 'tp_mult': 1.6861047619067697, 'tsl_mult': 0.5773749643069253, 'strategy': 'mean_reversion', 'time_stop': 95, 'use_sma': False, 'use_atr': False, 'use_adx': False, 'use_ema': False, 'use_spike': False, 'rsi_required': True, 'edge_k': 0.4642751906485644, 'edge_cap': 0.9215272897494228, 'bull_strategy': 'breakout', 'bull_bb_std_mult': 1.9417616246684803, 'bull_rsi_os': 18, 'bull_rsi_ob': 68, 'bull_adx_thresh': 8.152462256384123, 'bull_atr_min_pct': 0.0006294718891066923, 'bull_atr_max_pct': 0.01041652383632971, 'bull_tp_mult': 1.1409268220766555, 'bull_tsl_mult': 0.8824250554957869, 'bull_time_stop': 15, 'bull_use_sma': False, 'bull_use_ema': True, 'bull_use_atr': True, 'bull_use_adx': True, 'bull_use_spike': False, 'bull_rsi_required': True, 'bear_strategy': 'breakout', 'bear_bb_std_mult': 2.5591704447545665, 'bear_rsi_os': 53, 'bear_rsi_ob': 88, 'bear_adx_thresh': 18.856702588217697, 'bear_atr_min_pct': 0.013212726021833475, 'bear_atr_max_pct': 0.012511421731015325, 'bear_tp_mult': 1.8560225943725834, 'bear_tsl_mult': 0.41179629018356456, 'bear_time_stop': 49, 'bear_use_sma': False, 'bear_use_ema': False, 'bear_use_atr': False, 'bear_use_adx': False, 'bear_use_spike': False, 'bear_rsi_required': True, 'sideways_strategy': 'mean_reversion', 'sideways_bb_std_mult': 1.5187287092534278, 'sideways_rsi_os': 32, 'sideways_rsi_ob': 72, 'sideways_adx_thresh': 16.58783206493665, 'sideways_atr_min_pct': 0.018906001874787373, 'sideways_atr_max_pct': 0.14322279125338183, 'sideways_tp_mult': 1.703640254343241, 'sideways_tsl_mult': 0.8685645392452097, 'sideways_time_stop': 73, 'sideways_use_sma': True, 'sideways_use_ema': True, 'sideways_use_atr': True, 'sideways_use_adx': True, 'sideways_use_spike': True, 'sideways_rsi_required': True}.
[I 2025-09-01 14:22:50,276] Trial 176 finished with values: [-0.12340642632584808, 0.12332439711356055] and parameters: {'p_sma': 48, 'p_std': 12, 'p_atr': 14, 'p_adx': 22, 'rsi_period': 74, 'ema1': 21, 'ema2': 41, 'slip_atr_k': 0.0427852866094669, 'slip_spread_k': 0.4866541763860652, 'spread_hl_frac': 0.04208491713623179, 'bb_std_mult': 1.8035408320869681, 'rsi_os': 9, 'rsi_ob': 83, 'vol_spike': 0.26495252913839173, 'adx_thresh': 26.27511952653575, 'atr_min_pct': 0.007496274241263456, 'atr_max_pct': 0.06150457848059341, 'tp_mult': 1.7186251965233774, 'tsl_mult': 0.6226506748453883, 'strategy': 'mean_reversion', 'time_stop': 96, 'use_sma': False, 'use_atr': False, 'use_adx': False, 'use_ema': False, 'use_spike': False, 'rsi_required': True, 'edge_k': 0.6405617921229408, 'edge_cap': 0.9195792119131408, 'bull_strategy': 'breakout', 'bull_bb_std_mult': 1.1296724212172373, 'bull_rsi_os': 18, 'bull_rsi_ob': 68, 'bull_adx_thresh': 8.185836169890083, 'bull_atr_min_pct': 0.000608830889000293, 'bull_atr_max_pct': 0.09035684068640669, 'bull_tp_mult': 1.8245783617398919, 'bull_tsl_mult': 0.8887675167381393, 'bull_time_stop': 14, 'bull_use_sma': False, 'bull_use_ema': True, 'bull_use_atr': True, 'bull_use_adx': True, 'bull_use_spike': False, 'bull_rsi_required': True, 'bear_strategy': 'breakout', 'bear_bb_std_mult': 3.3599756545915516, 'bear_rsi_os': 53, 'bear_rsi_ob': 89, 'bear_adx_thresh': 18.402375030945684, 'bear_atr_min_pct': 0.003247543403685601, 'bear_atr_max_pct': 0.018841638579725956, 'bear_tp_mult': 1.7828204031938262, 'bear_tsl_mult': 0.6822667475469749, 'bear_time_stop': 227, 'bear_use_sma': False, 'bear_use_ema': False, 'bear_use_atr': False, 'bear_use_adx': False, 'bear_use_spike': False, 'bear_rsi_required': True, 'sideways_strategy': 'mean_reversion', 'sideways_bb_std_mult': 1.5956502395088155, 'sideways_rsi_os': 46, 'sideways_rsi_ob': 53, 'sideways_adx_thresh': 34.5596873548848, 'sideways_atr_min_pct': 0.02745870334747323, 'sideways_atr_max_pct': 0.02985695686078146, 'sideways_tp_mult': 2.7076985048397755, 'sideways_tsl_mult': 0.8662139270775981, 'sideways_time_stop': 73, 'sideways_use_sma': True, 'sideways_use_ema': True, 'sideways_use_atr': True, 'sideways_use_adx': True, 'sideways_use_spike': True, 'sideways_rsi_required': True}.
[I 2025-09-01 14:22:50,488] Trial 175 finished with values: [-0.0636773109914811, 0.06356553854924538] and parameters: {'p_sma': 49, 'p_std': 10, 'p_atr': 14, 'p_adx': 22, 'rsi_period': 74, 'ema1': 21, 'ema2': 20, 'slip_atr_k': 0.11700820621592259, 'slip_spread_k': 0.4565508832315577, 'spread_hl_frac': 0.024930550828951122, 'bb_std_mult': 2.60004418743685, 'rsi_os': 9, 'rsi_ob': 83, 'vol_spike': 0.08103734568446558, 'adx_thresh': 19.22225224718543, 'atr_min_pct': 0.0076524407008358285, 'atr_max_pct': 0.1313432161372527, 'tp_mult': 2.272334885778889, 'tsl_mult': 0.6251602149786954, 'strategy': 'mean_reversion', 'time_stop': 97, 'use_sma': False, 'use_atr': False, 'use_adx': False, 'use_ema': False, 'use_spike': False, 'rsi_required': True, 'edge_k': 0.47408123856632567, 'edge_cap': 0.6167387028086557, 'bull_strategy': 'breakout', 'bull_bb_std_mult': 1.3982858617068539, 'bull_rsi_os': 18, 'bull_rsi_ob': 81, 'bull_adx_thresh': 16.78906377531883, 'bull_atr_min_pct': 0.00017269060905073744, 'bull_atr_max_pct': 0.14993349814554102, 'bull_tp_mult': 2.024676432582404, 'bull_tsl_mult': 0.8761883481615068, 'bull_time_stop': 16, 'bull_use_sma': False, 'bull_use_ema': True, 'bull_use_atr': True, 'bull_use_adx': True, 'bull_use_spike': False, 'bull_rsi_required': True, 'bear_strategy': 'breakout', 'bear_bb_std_mult': 2.223430573641324, 'bear_rsi_os': 55, 'bear_rsi_ob': 91, 'bear_adx_thresh': 5.022968195025592, 'bear_atr_min_pct': 0.016830595681530655, 'bear_atr_max_pct': 0.01915158272487181, 'bear_tp_mult': 1.7797974785320227, 'bear_tsl_mult': 0.4492804758718867, 'bear_time_stop': 49, 'bear_use_sma': False, 'bear_use_ema': False, 'bear_use_atr': False, 'bear_use_adx': False, 'bear_use_spike': False, 'bear_rsi_required': True, 'sideways_strategy': 'mean_reversion', 'sideways_bb_std_mult': 1.4886374488118568, 'sideways_rsi_os': 34, 'sideways_rsi_ob': 72, 'sideways_adx_thresh': 34.46158237624419, 'sideways_atr_min_pct': 0.018941224639226886, 'sideways_atr_max_pct': 0.14342978126856548, 'sideways_tp_mult': 2.699539553430167, 'sideways_tsl_mult': 0.8676273593183585, 'sideways_time_stop': 139, 'sideways_use_sma': True, 'sideways_use_ema': True, 'sideways_use_atr': True, 'sideways_use_adx': True, 'sideways_use_spike': True, 'sideways_rsi_required': True}.
[I 2025-09-01 14:22:50,676] Trial 173 finished with values: [-0.042622501999764806, 0.04205615092355198] and parameters: {'p_sma': 48, 'p_std': 28, 'p_atr': 15, 'p_adx': 26, 'rsi_period': 20, 'ema1': 8, 'ema2': 40, 'slip_atr_k': 0.04702617745270671, 'slip_spread_k': 0.853290071916031, 'spread_hl_frac': 0.04680955101441946, 'bb_std_mult': 3.395931102362054, 'rsi_os': 41, 'rsi_ob': 60, 'vol_spike': 0.009471280772039318, 'adx_thresh': 27.745859771763325, 'atr_min_pct': 0.027756935711372294, 'atr_max_pct': 0.10012789865013583, 'tp_mult': 2.2497360018445964, 'tsl_mult': 0.4198727513893644, 'strategy': 'mean_reversion', 'time_stop': 28, 'use_sma': False, 'use_atr': False, 'use_adx': False, 'use_ema': False, 'use_spike': False, 'rsi_required': True, 'edge_k': 0.365567592658148, 'edge_cap': 0.9204962436221453, 'bull_strategy': 'breakout', 'bull_bb_std_mult': 3.453405465089914, 'bull_rsi_os': 18, 'bull_rsi_ob': 56, 'bull_adx_thresh': 16.451118183925356, 'bull_atr_min_pct': 0.012417124735875171, 'bull_atr_max_pct': 0.0464248386117383, 'bull_tp_mult': 1.0570511839427488, 'bull_tsl_mult': 0.9552063414889924, 'bull_time_stop': 191, 'bull_use_sma': False, 'bull_use_ema': True, 'bull_use_atr': True, 'bull_use_adx': True, 'bull_use_spike': False, 'bull_rsi_required': True, 'bear_strategy': 'breakout', 'bear_bb_std_mult': 3.16467660627365, 'bear_rsi_os': 52, 'bear_rsi_ob': 77, 'bear_adx_thresh': 18.94637846669474, 'bear_atr_min_pct': 0.00404148509385701, 'bear_atr_max_pct': 0.02286368982768651, 'bear_tp_mult': 1.780773335153255, 'bear_tsl_mult': 0.40286005829304944, 'bear_time_stop': 237, 'bear_use_sma': False, 'bear_use_ema': True, 'bear_use_atr': False, 'bear_use_adx': False, 'bear_use_spike': False, 'bear_rsi_required': True, 'sideways_strategy': 'mean_reversion', 'sideways_bb_std_mult': 1.5359750236282126, 'sideways_rsi_os': 46, 'sideways_rsi_ob': 83, 'sideways_adx_thresh': 24.905832833986793, 'sideways_atr_min_pct': 0.01732941747154072, 'sideways_atr_max_pct': 0.031496843393289634, 'sideways_tp_mult': 1.7005056497465985, 'sideways_tsl_mult': 0.6924894735913153, 'sideways_time_stop': 67, 'sideways_use_sma': True, 'sideways_use_ema': True, 'sideways_use_atr': False, 'sideways_use_adx': True, 'sideways_use_spike': True, 'sideways_rsi_required': True}.
[I 2025-09-01 14:23:30,317] Trial 179 finished with values: [-1000000000.0, 1000000000.0] and parameters: {'p_sma': 35, 'p_std': 10, 'p_atr': 16, 'p_adx': 26, 'rsi_period': 10, 'ema1': 27, 'ema2': 60, 'slip_atr_k': 0.06342837306581926, 'slip_spread_k': 0.08038627589136549, 'spread_hl_frac': 0.013855889238383802, 'bb_std_mult': 2.39963333966545, 'rsi_os': 51, 'rsi_ob': 85, 'vol_spike': 0.21684688435646762, 'adx_thresh': 8.947255833582485, 'atr_min_pct': 0.01781228487353037, 'atr_max_pct': 0.07021882473691347, 'tp_mult': 2.1635051413929243, 'tsl_mult': 0.48843206216201934, 'strategy': 'breakout', 'time_stop': 136, 'use_sma': True, 'use_atr': True, 'use_adx': False, 'use_ema': True, 'use_spike': False, 'rsi_required': True, 'edge_k': 1.968117409543559, 'edge_cap': 0.971852547618025, 'bull_strategy': 'breakout', 'bull_bb_std_mult': 1.5062275561185507, 'bull_rsi_os': 16, 'bull_rsi_ob': 55, 'bull_adx_thresh': 26.238129591748816, 'bull_atr_min_pct': 0.008338678073247669, 'bull_atr_max_pct': 0.054308377890122404, 'bull_tp_mult': 1.0551933516972254, 'bull_tsl_mult': 0.9988154687874378, 'bull_time_stop': 192, 'bull_use_sma': True, 'bull_use_ema': True, 'bull_use_atr': False, 'bull_use_adx': True, 'bull_use_spike': True, 'bull_rsi_required': True, 'bear_strategy': 'mean_reversion', 'bear_bb_std_mult': 2.41969698766787, 'bear_rsi_os': 51, 'bear_rsi_ob': 91, 'bear_adx_thresh': 7.021974611761626, 'bear_atr_min_pct': 0.0267544771886065, 'bear_atr_max_pct': 0.02529336809814699, 'bear_tp_mult': 2.7209564235927655, 'bear_tsl_mult': 0.5746749805819064, 'bear_time_stop': 248, 'bear_use_sma': True, 'bear_use_ema': True, 'bear_use_atr': False, 'bear_use_adx': False, 'bear_use_spike': True, 'bear_rsi_required': True, 'sideways_strategy': 'mean_reversion', 'sideways_bb_std_mult': 0.7946248589819089, 'sideways_rsi_os': 33, 'sideways_rsi_ob': 61, 'sideways_adx_thresh': 8.72331915147226, 'sideways_atr_min_pct': 0.02428639394982503, 'sideways_atr_max_pct': 0.03466874061558767, 'sideways_tp_mult': 2.6473426279862116, 'sideways_tsl_mult': 0.8276371857250269, 'sideways_time_stop': 215, 'sideways_use_sma': True, 'sideways_use_ema': False, 'sideways_use_atr': False, 'sideways_use_adx': False, 'sideways_use_spike': False, 'sideways_rsi_required': False}.
[I 2025-09-01 14:23:30,639] Trial 178 finished with values: [-1000000000.0, 1000000000.0] and parameters: {'p_sma': 25, 'p_std': 10, 'p_atr': 13, 'p_adx': 20, 'rsi_period': 50, 'ema1': 27, 'ema2': 40, 'slip_atr_k': 0.024418718795121405, 'slip_spread_k': 0.5452669361795773, 'spread_hl_frac': 0.023847195430456332, 'bb_std_mult': 3.4001064107009653, 'rsi_os': 7, 'rsi_ob': 85, 'vol_spike': 0.014577092026715598, 'adx_thresh': 6.223897542970434, 'atr_min_pct': 0.0066147728506621515, 'atr_max_pct': 0.07018774718449523, 'tp_mult': 1.0154157453588748, 'tsl_mult': 0.48642100068425187, 'strategy': 'breakout', 'time_stop': 32, 'use_sma': True, 'use_atr': True, 'use_adx': False, 'use_ema': True, 'use_spike': False, 'rsi_required': True, 'edge_k': 1.3492161636343163, 'edge_cap': 0.9745007934255594, 'bull_strategy': 'breakout', 'bull_bb_std_mult': 1.4336849957397002, 'bull_rsi_os': 16, 'bull_rsi_ob': 81, 'bull_adx_thresh': 26.235380072525512, 'bull_atr_min_pct': 0.028958050409376292, 'bull_atr_max_pct': 0.051684671981181665, 'bull_tp_mult': 2.926606844767275, 'bull_tsl_mult': 0.5241152241440884, 'bull_time_stop': 31, 'bull_use_sma': False, 'bull_use_ema': True, 'bull_use_atr': False, 'bull_use_adx': True, 'bull_use_spike': True, 'bull_rsi_required': True, 'bear_strategy': 'mean_reversion', 'bear_bb_std_mult': 1.5174835708168692, 'bear_rsi_os': 51, 'bear_rsi_ob': 46, 'bear_adx_thresh': 31.566229617763256, 'bear_atr_min_pct': 0.010148587287709104, 'bear_atr_max_pct': 0.01881350243841226, 'bear_tp_mult': 1.1614500432498711, 'bear_tsl_mult': 0.5781038859900731, 'bear_time_stop': 187, 'bear_use_sma': True, 'bear_use_ema': True, 'bear_use_atr': False, 'bear_use_adx': False, 'bear_use_spike': True, 'bear_rsi_required': True, 'sideways_strategy': 'mean_reversion', 'sideways_bb_std_mult': 1.3026552155072215, 'sideways_rsi_os': 34, 'sideways_rsi_ob': 61, 'sideways_adx_thresh': 30.93834371006961, 'sideways_atr_min_pct': 0.023127243678562608, 'sideways_atr_max_pct': 0.034458818124570835, 'sideways_tp_mult': 2.630068986543398, 'sideways_tsl_mult': 0.6413391340545571, 'sideways_time_stop': 139, 'sideways_use_sma': True, 'sideways_use_ema': False, 'sideways_use_atr': False, 'sideways_use_adx': False, 'sideways_use_spike': False, 'sideways_rsi_required': False}.
[I 2025-09-01 14:23:31,002] Trial 177 finished with values: [-1000000000.0, 1000000000.0] and parameters: {'p_sma': 49, 'p_std': 10, 'p_atr': 13, 'p_adx': 26, 'rsi_period': 51, 'ema1': 27, 'ema2': 40, 'slip_atr_k': 0.024597553437251833, 'slip_spread_k': 0.4895921752306557, 'spread_hl_frac': 0.012948733028439713, 'bb_std_mult': 2.3702482497394417, 'rsi_os': 20, 'rsi_ob': 67, 'vol_spike': 0.01638087686893961, 'adx_thresh': 25.21515399703841, 'atr_min_pct': 0.007710335910242658, 'atr_max_pct': 0.11126639946586, 'tp_mult': 2.5479141135854544, 'tsl_mult': 0.4854670108964057, 'strategy': 'mean_reversion', 'time_stop': 38, 'use_sma': False, 'use_atr': True, 'use_adx': False, 'use_ema': True, 'use_spike': False, 'rsi_required': True, 'edge_k': 0.5522485094696695, 'edge_cap': 0.9713372838827057, 'bull_strategy': 'breakout', 'bull_bb_std_mult': 3.3250059754844563, 'bull_rsi_os': 16, 'bull_rsi_ob': 55, 'bull_adx_thresh': 13.521360744848943, 'bull_atr_min_pct': 0.0034464173293970784, 'bull_atr_max_pct': 0.05225219881615168, 'bull_tp_mult': 1.8112556928035468, 'bull_tsl_mult': 0.8853033052083453, 'bull_time_stop': 197, 'bull_use_sma': False, 'bull_use_ema': True, 'bull_use_atr': True, 'bull_use_adx': True, 'bull_use_spike': False, 'bull_rsi_required': True, 'bear_strategy': 'mean_reversion', 'bear_bb_std_mult': 2.2127987005377916, 'bear_rsi_os': 55, 'bear_rsi_ob': 46, 'bear_adx_thresh': 5.103420501994159, 'bear_atr_min_pct': 0.017065843970639632, 'bear_atr_max_pct': 0.0184083915993236, 'bear_tp_mult': 1.7671624093633196, 'bear_tsl_mult': 0.6756319612010508, 'bear_time_stop': 249, 'bear_use_sma': True, 'bear_use_ema': True, 'bear_use_atr': False, 'bear_use_adx': False, 'bear_use_spike': False, 'bear_rsi_required': True, 'sideways_strategy': 'mean_reversion', 'sideways_bb_std_mult': 1.6090405285449576, 'sideways_rsi_os': 33, 'sideways_rsi_ob': 75, 'sideways_adx_thresh': 8.699757236554024, 'sideways_atr_min_pct': 0.026121703629247116, 'sideways_atr_max_pct': 0.03459909381646058, 'sideways_tp_mult': 2.636459736953043, 'sideways_tsl_mult': 0.0748141307061746, 'sideways_time_stop': 139, 'sideways_use_sma': True, 'sideways_use_ema': False, 'sideways_use_atr': True, 'sideways_use_adx': False, 'sideways_use_spike': True, 'sideways_rsi_required': True}.
