[I 2025-09-01 14:55:49,384] Trial 385 finished with values: [-1000000000.0, 1000000000.0] and parameters: {'p_sma': 30, 'p_std': 25, 'p_atr': 25, 'p_adx': 14, 'rsi_period': 71, 'ema1': 23, 'ema2': 60, 'slip_atr_k': 0.015017272820995551, 'slip_spread_k': 0.8915011511932971, 'spread_hl_frac': 0.006601564635736866, 'bb_std_mult': 2.245303246500678, 'rsi_os': 27, 'rsi_ob': 66, 'vol_spike': 0.07427284197856653, 'adx_thresh': 19.750923324371268, 'atr_min_pct': 0.01725053510581269, 'atr_max_pct': 0.02017728027996043, 'tp_mult': 2.040858612771726, 'tsl_mult': 0.3275000397801595, 'strategy': 'breakout', 'time_stop': 59, 'use_sma': False, 'use_atr': True, 'use_adx': False, 'use_ema': True, 'use_spike': False, 'rsi_required': True, 'edge_k': 1.5635935989958292, 'edge_cap': 0.1888435770814763, 'bull_strategy': 'mean_reversion', 'bull_bb_std_mult': 1.1367291443372103, 'bull_rsi_os': 24, 'bull_rsi_ob': 65, 'bull_adx_thresh': 6.996684381221369, 'bull_atr_min_pct': 0.014392849562679142, 'bull_atr_max_pct': 0.03893197431085594, 'bull_tp_mult': 1.4072271113751071, 'bull_tsl_mult': 0.1224989904354194, 'bull_time_stop': 154, 'bull_use_sma': False, 'bull_use_ema': True, 'bull_use_atr': False, 'bull_use_adx': False, 'bull_use_spike': False, 'bull_rsi_required': True, 'bear_strategy': 'breakout', 'bear_bb_std_mult': 3.0292274637811607, 'bear_rsi_os': 8, 'bear_rsi_ob': 52, 'bear_adx_thresh': 8.771076312155676, 'bear_atr_min_pct': 0.003055273604352101, 'bear_atr_max_pct': 0.038876696606648, 'bear_tp_mult': 2.3627762301330537, 'bear_tsl_mult': 0.7682251062760881, 'bear_time_stop': 264, 'bear_use_sma': True, 'bear_use_ema': False, 'bear_use_atr': False, 'bear_use_adx': False, 'bear_use_spike': True, 'bear_rsi_required': True, 'sideways_strategy': 'mean_reversion', 'sideways_bb_std_mult': 1.1286918210868975, 'sideways_rsi_os': 23, 'sideways_rsi_ob': 66, 'sideways_adx_thresh': 31.19141679418912, 'sideways_atr_min_pct': 0.01346485920577408, 'sideways_atr_max_pct': 0.048239936889857546, 'sideways_tp_mult': 2.2493708539938284, 'sideways_tsl_mult': 0.5532776090815112, 'sideways_time_stop': 68, 'sideways_use_sma': True, 'sideways_use_ema': False, 'sideways_use_atr': True, 'sideways_use_adx': True, 'sideways_use_spike': False, 'sideways_rsi_required': True}.
[I 2025-09-01 14:56:34,340] Trial 389 finished with values: [-1000000000.0, 1000000000.0] and parameters: {'p_sma': 32, 'p_std': 31, 'p_atr': 8, 'p_adx': 15, 'rsi_period': 71, 'ema1': 25, 'ema2': 60, 'slip_atr_k': 0.01834679838668223, 'slip_spread_k': 0.7100912279339475, 'spread_hl_frac': 0.009182406707971396, 'bb_std_mult': 2.1954416619190957, 'rsi_os': 29, 'rsi_ob': 77, 'vol_spike': 0.08519921491315618, 'adx_thresh': 19.628514111901367, 'atr_min_pct': 0.01644147288803867, 'atr_max_pct': 0.07147679892889106, 'tp_mult': 1.9775743348955066, 'tsl_mult': 0.404635430169906, 'strategy': 'breakout', 'time_stop': 50, 'use_sma': False, 'use_atr': True, 'use_adx': False, 'use_ema': True, 'use_spike': False, 'rsi_required': False, 'edge_k': 1.2062085140200696, 'edge_cap': 0.9048533222893012, 'bull_strategy': 'mean_reversion', 'bull_bb_std_mult': 0.9230518133915613, 'bull_rsi_os': 25, 'bull_rsi_ob': 67, 'bull_adx_thresh': 6.800798556050113, 'bull_atr_min_pct': 0.018390597907911633, 'bull_atr_max_pct': 0.028900769149983418, 'bull_tp_mult': 1.385852638068895, 'bull_tsl_mult': 0.1461529956749043, 'bull_time_stop': 127, 'bull_use_sma': False, 'bull_use_ema': True, 'bull_use_atr': False, 'bull_use_adx': True, 'bull_use_spike': True, 'bull_rsi_required': False, 'bear_strategy': 'breakout', 'bear_bb_std_mult': 1.6326032141841047, 'bear_rsi_os': 8, 'bear_rsi_ob': 50, 'bear_adx_thresh': 9.720699053352316, 'bear_atr_min_pct': 0.010704177786559403, 'bear_atr_max_pct': 0.04715877148042235, 'bear_tp_mult': 1.6693466253059888, 'bear_tsl_mult': 0.719534523924961, 'bear_time_stop': 248, 'bear_use_sma': True, 'bear_use_ema': False, 'bear_use_atr': True, 'bear_use_adx': False, 'bear_use_spike': True, 'bear_rsi_required': False, 'sideways_strategy': 'mean_reversion', 'sideways_bb_std_mult': 2.1801145433764013, 'sideways_rsi_os': 19, 'sideways_rsi_ob': 78, 'sideways_adx_thresh': 32.098656567143635, 'sideways_atr_min_pct': 0.011898576449262784, 'sideways_atr_max_pct': 0.05393694150194009, 'sideways_tp_mult': 2.2351020830447483, 'sideways_tsl_mult': 0.6640685504123337, 'sideways_time_stop': 64, 'sideways_use_sma': True, 'sideways_use_ema': False, 'sideways_use_atr': True, 'sideways_use_adx': True, 'sideways_use_spike': False, 'sideways_rsi_required': True}.
[I 2025-09-01 14:56:34,691] Trial 390 finished with values: [-1000000000.0, 1000000000.0] and parameters: {'p_sma': 32, 'p_std': 31, 'p_atr': 8, 'p_adx': 15, 'rsi_period': 72, 'ema1': 25, 'ema2': 60, 'slip_atr_k': 0.020069638843566828, 'slip_spread_k': 0.8912156400600162, 'spread_hl_frac': 0.009128230674768555, 'bb_std_mult': 2.1836958848558248, 'rsi_os': 31, 'rsi_ob': 81, 'vol_spike': 0.07580376361349124, 'adx_thresh': 27.5758668318581, 'atr_min_pct': 0.014667535696807432, 'atr_max_pct': 0.07134531687965925, 'tp_mult': 1.8921536455179404, 'tsl_mult': 0.40115389815443536, 'strategy': 'breakout', 'time_stop': 25, 'use_sma': False, 'use_atr': True, 'use_adx': False, 'use_ema': True, 'use_spike': False, 'rsi_required': False, 'edge_k': 1.7581061704262293, 'edge_cap': 0.07931378038742126, 'bull_strategy': 'mean_reversion', 'bull_bb_std_mult': 0.9353306691359071, 'bull_rsi_os': 25, 'bull_rsi_ob': 66, 'bull_adx_thresh': 6.7918560482451875, 'bull_atr_min_pct': 0.01851958855787445, 'bull_atr_max_pct': 0.04985824977025581, 'bull_tp_mult': 1.381409508552299, 'bull_tsl_mult': 0.052040692730352375, 'bull_time_stop': 127, 'bull_use_sma': False, 'bull_use_ema': True, 'bull_use_atr': False, 'bull_use_adx': True, 'bull_use_spike': True, 'bull_rsi_required': False, 'bear_strategy': 'breakout', 'bear_bb_std_mult': 1.6723144795683293, 'bear_rsi_os': 30, 'bear_rsi_ob': 52, 'bear_adx_thresh': 9.580387257428173, 'bear_atr_min_pct': 0.003873873421032944, 'bear_atr_max_pct': 0.04771545884908851, 'bear_tp_mult': 1.6734456610856274, 'bear_tsl_mult': 0.1480548863289401, 'bear_time_stop': 249, 'bear_use_sma': True, 'bear_use_ema': False, 'bear_use_atr': True, 'bear_use_adx': False, 'bear_use_spike': True, 'bear_rsi_required': False, 'sideways_strategy': 'mean_reversion', 'sideways_bb_std_mult': 1.0952251145103413, 'sideways_rsi_os': 20, 'sideways_rsi_ob': 78, 'sideways_adx_thresh': 30.226036633908134, 'sideways_atr_min_pct': 0.012234691814738689, 'sideways_atr_max_pct': 0.053731930570973835, 'sideways_tp_mult': 2.2358308190406357, 'sideways_tsl_mult': 0.6709525699210974, 'sideways_time_stop': 64, 'sideways_use_sma': True, 'sideways_use_ema': False, 'sideways_use_atr': True, 'sideways_use_adx': True, 'sideways_use_spike': False, 'sideways_rsi_required': True}.
[I 2025-09-01 14:56:34,928] Trial 391 finished with values: [-0.021967147449943658, 0.023833516022481727] and parameters: {'p_sma': 32, 'p_std': 21, 'p_atr': 30, 'p_adx': 15, 'rsi_period': 74, 'ema1': 25, 'ema2': 60, 'slip_atr_k': 0.007348924578266575, 'slip_spread_k': 0.43407908875910356, 'spread_hl_frac': 0.007417912241756152, 'bb_std_mult': 2.171558721923224, 'rsi_os': 29, 'rsi_ob': 81, 'vol_spike': 0.08599047872195098, 'adx_thresh': 27.52935760787407, 'atr_min_pct': 0.0146318501477018, 'atr_max_pct': 0.07067666298292759, 'tp_mult': 1.8980114931836924, 'tsl_mult': 0.4067765942046362, 'strategy': 'breakout', 'time_stop': 37, 'use_sma': False, 'use_atr': True, 'use_adx': False, 'use_ema': True, 'use_spike': False, 'rsi_required': False, 'edge_k': 1.4363955264779344, 'edge_cap': 0.7226404484954507, 'bull_strategy': 'mean_reversion', 'bull_bb_std_mult': 0.808609915279165, 'bull_rsi_os': 25, 'bull_rsi_ob': 69, 'bull_adx_thresh': 5.162698934389706, 'bull_atr_min_pct': 0.01597648846817089, 'bull_atr_max_pct': 0.04942718245826508, 'bull_tp_mult': 1.366871922657657, 'bull_tsl_mult': 0.05286268441967437, 'bull_time_stop': 126, 'bull_use_sma': True, 'bull_use_ema': True, 'bull_use_atr': False, 'bull_use_adx': True, 'bull_use_spike': True, 'bull_rsi_required': False, 'bear_strategy': 'breakout', 'bear_bb_std_mult': 1.6613377935027205, 'bear_rsi_os': 50, 'bear_rsi_ob': 50, 'bear_adx_thresh': 9.540034774403221, 'bear_atr_min_pct': 0.0038642202035165554, 'bear_atr_max_pct': 0.04706266040222201, 'bear_tp_mult': 1.6576035532680833, 'bear_tsl_mult': 0.7133507331967891, 'bear_time_stop': 249, 'bear_use_sma': True, 'bear_use_ema': False, 'bear_use_atr': True, 'bear_use_adx': True, 'bear_use_spike': True, 'bear_rsi_required': False, 'sideways_strategy': 'mean_reversion', 'sideways_bb_std_mult': 2.174272020919629, 'sideways_rsi_os': 20, 'sideways_rsi_ob': 78, 'sideways_adx_thresh': 6.83679949312441, 'sideways_atr_min_pct': 0.012188390371832183, 'sideways_atr_max_pct': 0.0532077467926017, 'sideways_tp_mult': 2.3293142932641224, 'sideways_tsl_mult': 0.749670035897158, 'sideways_time_stop': 46, 'sideways_use_sma': True, 'sideways_use_ema': False, 'sideways_use_atr': True, 'sideways_use_adx': True, 'sideways_use_spike': False, 'sideways_rsi_required': True}.
[I 2025-09-01 14:56:35,134] Trial 388 finished with values: [-1000000000.0, 1000000000.0] and parameters: {'p_sma': 32, 'p_std': 27, 'p_atr': 21, 'p_adx': 15, 'rsi_period': 72, 'ema1': 26, 'ema2': 60, 'slip_atr_k': 0.020009351223908744, 'slip_spread_k': 0.8963991342956301, 'spread_hl_frac': 0.007078241081103375, 'bb_std_mult': 2.2023945384239454, 'rsi_os': 32, 'rsi_ob': 66, 'vol_spike': 0.08886738851650744, 'adx_thresh': 27.733775399452778, 'atr_min_pct': 0.014955515342451318, 'atr_max_pct': 0.1188628373921832, 'tp_mult': 1.8979906510866442, 'tsl_mult': 0.3242304376767865, 'strategy': 'breakout', 'time_stop': 51, 'use_sma': False, 'use_atr': True, 'use_adx': False, 'use_ema': True, 'use_spike': False, 'rsi_required': False, 'edge_k': 1.3880329449511963, 'edge_cap': 0.7273363329761529, 'bull_strategy': 'mean_reversion', 'bull_bb_std_mult': 0.956370294727916, 'bull_rsi_os': 24, 'bull_rsi_ob': 69, 'bull_adx_thresh': 5.8003575814262875, 'bull_atr_min_pct': 0.01855891584769392, 'bull_atr_max_pct': 0.041194983528493836, 'bull_tp_mult': 1.4004146736766492, 'bull_tsl_mult': 0.028761639816784847, 'bull_time_stop': 151, 'bull_use_sma': False, 'bull_use_ema': True, 'bull_use_atr': False, 'bull_use_adx': True, 'bull_use_spike': False, 'bull_rsi_required': True, 'bear_strategy': 'breakout', 'bear_bb_std_mult': 1.5276836794204427, 'bear_rsi_os': 8, 'bear_rsi_ob': 52, 'bear_adx_thresh': 8.55737668444554, 'bear_atr_min_pct': 0.0034235405708975862, 'bear_atr_max_pct': 0.03909178575786573, 'bear_tp_mult': 2.9831748265123457, 'bear_tsl_mult': 0.7150260566936625, 'bear_time_stop': 248, 'bear_use_sma': True, 'bear_use_ema': False, 'bear_use_atr': False, 'bear_use_adx': True, 'bear_use_spike': True, 'bear_rsi_required': False, 'sideways_strategy': 'mean_reversion', 'sideways_bb_std_mult': 0.9763628837117138, 'sideways_rsi_os': 22, 'sideways_rsi_ob': 64, 'sideways_adx_thresh': 31.943166869618132, 'sideways_atr_min_pct': 0.0034948991741068323, 'sideways_atr_max_pct': 0.0533282724721046, 'sideways_tp_mult': 2.342165425876093, 'sideways_tsl_mult': 0.562388427408534, 'sideways_time_stop': 65, 'sideways_use_sma': True, 'sideways_use_ema': False, 'sideways_use_atr': True, 'sideways_use_adx': True, 'sideways_use_spike': False, 'sideways_rsi_required': True}.
[I 2025-09-01 14:57:18,657] Trial 393 finished with values: [-1000000000.0, 1000000000.0] and parameters: {'p_sma': 33, 'p_std': 28, 'p_atr': 30, 'p_adx': 15, 'rsi_period': 21, 'ema1': 17, 'ema2': 59, 'slip_atr_k': 0.007110668044122916, 'slip_spread_k': 0.4277363689964899, 'spread_hl_frac': 0.0033256695515958418, 'bb_std_mult': 2.0350579742399004, 'rsi_os': 31, 'rsi_ob': 47, 'vol_spike': 0.17214522786689168, 'adx_thresh': 30.972918603487045, 'atr_min_pct': 0.015163117298514987, 'atr_max_pct': 0.1236149290106727, 'tp_mult': 1.9016146903461506, 'tsl_mult': 0.43953073195966447, 'strategy': 'breakout', 'time_stop': 21, 'use_sma': False, 'use_atr': True, 'use_adx': False, 'use_ema': True, 'use_spike': False, 'rsi_required': True, 'edge_k': 1.4401843406812005, 'edge_cap': 0.8962366840729108, 'bull_strategy': 'mean_reversion', 'bull_bb_std_mult': 0.8124329300419089, 'bull_rsi_os': 22, 'bull_rsi_ob': 69, 'bull_adx_thresh': 5.4551209803239225, 'bull_atr_min_pct': 0.016090055856779174, 'bull_atr_max_pct': 0.10290829672491801, 'bull_tp_mult': 1.2997163762205532, 'bull_tsl_mult': 0.056431801581541347, 'bull_time_stop': 132, 'bull_use_sma': True, 'bull_use_ema': True, 'bull_use_atr': False, 'bull_use_adx': True, 'bull_use_spike': False, 'bull_rsi_required': True, 'bear_strategy': 'breakout', 'bear_bb_std_mult': 1.4742373449768822, 'bear_rsi_os': 26, 'bear_rsi_ob': 50, 'bear_adx_thresh': 10.696132683812282, 'bear_atr_min_pct': 0.01758280674371232, 'bear_atr_max_pct': 0.050604750101411584, 'bear_tp_mult': 2.9890288119679456, 'bear_tsl_mult': 0.7148023366781084, 'bear_time_stop': 254, 'bear_use_sma': True, 'bear_use_ema': False, 'bear_use_atr': False, 'bear_use_adx': True, 'bear_use_spike': True, 'bear_rsi_required': True, 'sideways_strategy': 'mean_reversion', 'sideways_bb_std_mult': 1.1569430515776844, 'sideways_rsi_os': 22, 'sideways_rsi_ob': 63, 'sideways_adx_thresh': 6.9770357537293854, 'sideways_atr_min_pct': 0.0032699265255974955, 'sideways_atr_max_pct': 0.05602153666443705, 'sideways_tp_mult': 2.327969269440359, 'sideways_tsl_mult': 0.7610007595711331, 'sideways_time_stop': 47, 'sideways_use_sma': True, 'sideways_use_ema': False, 'sideways_use_atr': True, 'sideways_use_adx': False, 'sideways_use_spike': False, 'sideways_rsi_required': True}.
[I 2025-09-01 14:57:19,534] Trial 394 finished with values: [-1000000000.0, 1000000000.0] and parameters: {'p_sma': 33, 'p_std': 21, 'p_atr': 19, 'p_adx': 14, 'rsi_period': 14, 'ema1': 24, 'ema2': 57, 'slip_atr_k': 0.006985920233286118, 'slip_spread_k': 0.43677239795921957, 'spread_hl_frac': 0.005498253353676069, 'bb_std_mult': 2.294305314552271, 'rsi_os': 30, 'rsi_ob': 50, 'vol_spike': 0.29253942544267336, 'adx_thresh': 7.171856196060025, 'atr_min_pct': 0.016958158881450917, 'atr_max_pct': 0.0672800293822387, 'tp_mult': 2.1004504388125373, 'tsl_mult': 0.44156516434069265, 'strategy': 'breakout', 'time_stop': 26, 'use_sma': False, 'use_atr': True, 'use_adx': False, 'use_ema': True, 'use_spike': False, 'rsi_required': True, 'edge_k': 1.4508715366942981, 'edge_cap': 0.4225568014701099, 'bull_strategy': 'mean_reversion', 'bull_bb_std_mult': 0.8112812851915314, 'bull_rsi_os': 22, 'bull_rsi_ob': 67, 'bull_adx_thresh': 5.100175550697125, 'bull_atr_min_pct': 0.016154843426093482, 'bull_atr_max_pct': 0.11399547187435304, 'bull_tp_mult': 1.309357332008078, 'bull_tsl_mult': 0.054829889803383325, 'bull_time_stop': 130, 'bull_use_sma': True, 'bull_use_ema': True, 'bull_use_atr': False, 'bull_use_adx': True, 'bull_use_spike': False, 'bull_rsi_required': True, 'bear_strategy': 'breakout', 'bear_bb_std_mult': 1.4584177170615684, 'bear_rsi_os': 50, 'bear_rsi_ob': 53, 'bear_adx_thresh': 10.239604672185672, 'bear_atr_min_pct': 0.017727752396286232, 'bear_atr_max_pct': 0.046231793584728446, 'bear_tp_mult': 2.7222425599676834, 'bear_tsl_mult': 0.8119644668780139, 'bear_time_stop': 256, 'bear_use_sma': True, 'bear_use_ema': False, 'bear_use_atr': False, 'bear_use_adx': False, 'bear_use_spike': True, 'bear_rsi_required': True, 'sideways_strategy': 'mean_reversion', 'sideways_bb_std_mult': 3.492748572874737, 'sideways_rsi_os': 25, 'sideways_rsi_ob': 78, 'sideways_adx_thresh': 32.95589904865369, 'sideways_atr_min_pct': 0.013886575468698197, 'sideways_atr_max_pct': 0.04670289317270496, 'sideways_tp_mult': 2.163104533444839, 'sideways_tsl_mult': 0.7645991846373069, 'sideways_time_stop': 246, 'sideways_use_sma': True, 'sideways_use_ema': False, 'sideways_use_atr': True, 'sideways_use_adx': False, 'sideways_use_spike': False, 'sideways_rsi_required': True}.
[I 2025-09-01 14:57:19,556] Trial 392 finished with values: [-1000000000.0, 1000000000.0] and parameters: {'p_sma': 33, 'p_std': 20, 'p_atr': 7, 'p_adx': 15, 'rsi_period': 31, 'ema1': 26, 'ema2': 57, 'slip_atr_k': 0.007165932780226027, 'slip_spread_k': 0.42711307325897907, 'spread_hl_frac': 0.007488239597899266, 'bb_std_mult': 2.9359441057956115, 'rsi_os': 31, 'rsi_ob': 81, 'vol_spike': 0.07238463212078466, 'adx_thresh': 27.358460935513783, 'atr_min_pct': 0.014863277904138968, 'atr_max_pct': 0.1215039906861968, 'tp_mult': 1.8804697574700113, 'tsl_mult': 0.31107638839142826, 'strategy': 'breakout', 'time_stop': 25, 'use_sma': False, 'use_atr': True, 'use_adx': False, 'use_ema': True, 'use_spike': False, 'rsi_required': False, 'edge_k': 1.7612529705071749, 'edge_cap': 0.4733443030951133, 'bull_strategy': 'mean_reversion', 'bull_bb_std_mult': 0.6976525185559039, 'bull_rsi_os': 44, 'bull_rsi_ob': 66, 'bull_adx_thresh': 5.034909288031167, 'bull_atr_min_pct': 0.015857853389776154, 'bull_atr_max_pct': 0.04095737096568267, 'bull_tp_mult': 1.3092846874218238, 'bull_tsl_mult': 0.05253701619652107, 'bull_time_stop': 161, 'bull_use_sma': True, 'bull_use_ema': True, 'bull_use_atr': False, 'bull_use_adx': True, 'bull_use_spike': False, 'bull_rsi_required': True, 'bear_strategy': 'breakout', 'bear_bb_std_mult': 1.4860683084769004, 'bear_rsi_os': 21, 'bear_rsi_ob': 53, 'bear_adx_thresh': 9.844033117819167, 'bear_atr_min_pct': 0.004192783476776232, 'bear_atr_max_pct': 0.050635904701427106, 'bear_tp_mult': 1.339735058537057, 'bear_tsl_mult': 0.7123795009260442, 'bear_time_stop': 255, 'bear_use_sma': True, 'bear_use_ema': False, 'bear_use_atr': False, 'bear_use_adx': True, 'bear_use_spike': True, 'bear_rsi_required': False, 'sideways_strategy': 'mean_reversion', 'sideways_bb_std_mult': 1.0752671410493237, 'sideways_rsi_os': 20, 'sideways_rsi_ob': 64, 'sideways_adx_thresh': 32.87641869372894, 'sideways_atr_min_pct': 0.012478207668989268, 'sideways_atr_max_pct': 0.054238414945243826, 'sideways_tp_mult': 2.164357713475314, 'sideways_tsl_mult': 0.6356724248321796, 'sideways_time_stop': 47, 'sideways_use_sma': True, 'sideways_use_ema': False, 'sideways_use_atr': True, 'sideways_use_adx': True, 'sideways_use_spike': False, 'sideways_rsi_required': True}.
[I 2025-09-01 14:57:20,268] Trial 395 finished with values: [-1000000000.0, 1000000000.0] and parameters: {'p_sma': 33, 'p_std': 21, 'p_atr': 19, 'p_adx': 14, 'rsi_period': 14, 'ema1': 24, 'ema2': 57, 'slip_atr_k': 0.00735299495198741, 'slip_spread_k': 0.4312821975046301, 'spread_hl_frac': 0.0032378684001646315, 'bb_std_mult': 2.036962023001673, 'rsi_os': 30, 'rsi_ob': 64, 'vol_spike': 0.06877945903777112, 'adx_thresh': 9.6157219327252, 'atr_min_pct': 0.01634177968127348, 'atr_max_pct': 0.06756489350553137, 'tp_mult': 1.929484865737252, 'tsl_mult': 0.44484480541764554, 'strategy': 'breakout', 'time_stop': 27, 'use_sma': False, 'use_atr': True, 'use_adx': False, 'use_ema': True, 'use_spike': False, 'rsi_required': True, 'edge_k': 1.4747703618134693, 'edge_cap': 0.10765252273247711, 'bull_strategy': 'mean_reversion', 'bull_bb_std_mult': 0.8242355414959208, 'bull_rsi_os': 22, 'bull_rsi_ob': 67, 'bull_adx_thresh': 25.249182654165615, 'bull_atr_min_pct': 0.015899638525680982, 'bull_atr_max_pct': 0.03097224554541052, 'bull_tp_mult': 1.3191481675884162, 'bull_tsl_mult': 0.06391024667738607, 'bull_time_stop': 129, 'bull_use_sma': True, 'bull_use_ema': True, 'bull_use_atr': False, 'bull_use_adx': True, 'bull_use_spike': False, 'bull_rsi_required': True, 'bear_strategy': 'breakout', 'bear_bb_std_mult': 1.4644345347608938, 'bear_rsi_os': 41, 'bear_rsi_ob': 56, 'bear_adx_thresh': 9.579837863435461, 'bear_atr_min_pct': 0.005021586225330664, 'bear_atr_max_pct': 0.05172260239065843, 'bear_tp_mult': 1.621112168052668, 'bear_tsl_mult': 0.3091828316421525, 'bear_time_stop': 165, 'bear_use_sma': True, 'bear_use_ema': False, 'bear_use_atr': False, 'bear_use_adx': False, 'bear_use_spike': True, 'bear_rsi_required': True, 'sideways_strategy': 'mean_reversion', 'sideways_bb_std_mult': 1.0556862079914016, 'sideways_rsi_os': 21, 'sideways_rsi_ob': 95, 'sideways_adx_thresh': 32.828918820152, 'sideways_atr_min_pct': 0.012329177610771565, 'sideways_atr_max_pct': 0.055999305625148314, 'sideways_tp_mult': 2.3011160614750215, 'sideways_tsl_mult': 0.7660526003363209, 'sideways_time_stop': 244, 'sideways_use_sma': True, 'sideways_use_ema': False, 'sideways_use_atr': True, 'sideways_use_adx': False, 'sideways_use_spike': False, 'sideways_rsi_required': True}.
