[I 2025-09-01 15:03:18,269] Trial 434 finished with values: [-1000000000.0, 1000000000.0] and parameters: {'p_sma': 32, 'p_std': 18, 'p_atr': 12, 'p_adx': 10, 'rsi_period': 53, 'ema1': 10, 'ema2': 47, 'slip_atr_k': 0.021242030972144117, 'slip_spread_k': 0.4520012551701671, 'spread_hl_frac': 0.005649036448177106, 'bb_std_mult': 2.248642509102723, 'rsi_os': 29, 'rsi_ob': 80, 'vol_spike': 0.1236221592844997, 'adx_thresh': 28.240198622120463, 'atr_min_pct': 0.01875039668899888, 'atr_max_pct': 0.1067769890422671, 'tp_mult': 1.909497054176651, 'tsl_mult': 0.435935695744731, 'strategy': 'breakout', 'time_stop': 28, 'use_sma': False, 'use_atr': True, 'use_adx': False, 'use_ema': True, 'use_spike': False, 'rsi_required': True, 'edge_k': 1.5012421202330613, 'edge_cap': 0.3002475042966197, 'bull_strategy': 'mean_reversion', 'bull_bb_std_mult': 3.501656388446534, 'bull_rsi_os': 22, 'bull_rsi_ob': 77, 'bull_adx_thresh': 7.134554787941493, 'bull_atr_min_pct': 0.01810421804295251, 'bull_atr_max_pct': 0.06069727336137692, 'bull_tp_mult': 1.4566453351999953, 'bull_tsl_mult': 0.4222953629038905, 'bull_time_stop': 129, 'bull_use_sma': False, 'bull_use_ema': False, 'bull_use_atr': False, 'bull_use_adx': True, 'bull_use_spike': False, 'bull_rsi_required': True, 'bear_strategy': 'breakout', 'bear_bb_std_mult': 1.5875775377667205, 'bear_rsi_os': 34, 'bear_rsi_ob': 61, 'bear_adx_thresh': 7.6726241349803335, 'bear_atr_min_pct': 0.004419501981139671, 'bear_atr_max_pct': 0.04424572534316244, 'bear_tp_mult': 1.523406974183206, 'bear_tsl_mult': 0.6726230421614116, 'bear_time_stop': 252, 'bear_use_sma': True, 'bear_use_ema': False, 'bear_use_atr': False, 'bear_use_adx': False, 'bear_use_spike': True, 'bear_rsi_required': True, 'sideways_strategy': 'mean_reversion', 'sideways_bb_std_mult': 1.1607813131900566, 'sideways_rsi_os': 47, 'sideways_rsi_ob': 59, 'sideways_adx_thresh': 33.192721616944986, 'sideways_atr_min_pct': 0.012822765376365959, 'sideways_atr_max_pct': 0.11674700887818734, 'sideways_tp_mult': 2.2110427902958714, 'sideways_tsl_mult': 0.2863875882669594, 'sideways_time_stop': 54, 'sideways_use_sma': True, 'sideways_use_ema': False, 'sideways_use_atr': True, 'sideways_use_adx': True, 'sideways_use_spike': False, 'sideways_rsi_required': True}.
[I 2025-09-01 15:03:18,659] Trial 432 finished with values: [-1000000000.0, 1000000000.0] and parameters: {'p_sma': 31, 'p_std': 32, 'p_atr': 12, 'p_adx': 14, 'rsi_period': 75, 'ema1': 6, 'ema2': 51, 'slip_atr_k': 0.11009508111921529, 'slip_spread_k': 0.6226467521903603, 'spread_hl_frac': 0.008029176791571198, 'bb_std_mult': 2.099292670693745, 'rsi_os': 45, 'rsi_ob': 79, 'vol_spike': 0.05533268391166521, 'adx_thresh': 10.805590553318165, 'atr_min_pct': 0.016915660501068918, 'atr_max_pct': 0.14951906518495156, 'tp_mult': 1.97993951596754, 'tsl_mult': 0.42021735963381535, 'strategy': 'breakout', 'time_stop': 261, 'use_sma': False, 'use_atr': True, 'use_adx': False, 'use_ema': True, 'use_spike': False, 'rsi_required': True, 'edge_k': 1.4730853808938755, 'edge_cap': 0.6322186352173534, 'bull_strategy': 'mean_reversion', 'bull_bb_std_mult': 1.1501234472586408, 'bull_rsi_os': 22, 'bull_rsi_ob': 69, 'bull_adx_thresh': 29.84989070078767, 'bull_atr_min_pct': 0.014837827725218952, 'bull_atr_max_pct': 0.13115911895960514, 'bull_tp_mult': 2.557861313019685, 'bull_tsl_mult': 0.6632806360852298, 'bull_time_stop': 143, 'bull_use_sma': False, 'bull_use_ema': False, 'bull_use_atr': False, 'bull_use_adx': True, 'bull_use_spike': False, 'bull_rsi_required': True, 'bear_strategy': 'breakout', 'bear_bb_std_mult': 1.558092196896909, 'bear_rsi_os': 51, 'bear_rsi_ob': 52, 'bear_adx_thresh': 9.172836427852552, 'bear_atr_min_pct': 0.011047760757201649, 'bear_atr_max_pct': 0.04000207300179058, 'bear_tp_mult': 1.489103532438222, 'bear_tsl_mult': 0.8555285242334953, 'bear_time_stop': 86, 'bear_use_sma': True, 'bear_use_ema': False, 'bear_use_atr': True, 'bear_use_adx': False, 'bear_use_spike': True, 'bear_rsi_required': True, 'sideways_strategy': 'mean_reversion', 'sideways_bb_std_mult': 0.8850659869412729, 'sideways_rsi_os': 48, 'sideways_rsi_ob': 76, 'sideways_adx_thresh': 16.432487194603503, 'sideways_atr_min_pct': 0.020855573630595765, 'sideways_atr_max_pct': 0.1179765830841964, 'sideways_tp_mult': 2.224010095830887, 'sideways_tsl_mult': 0.26982507193732463, 'sideways_time_stop': 57, 'sideways_use_sma': True, 'sideways_use_ema': False, 'sideways_use_atr': True, 'sideways_use_adx': True, 'sideways_use_spike': False, 'sideways_rsi_required': True}.
[I 2025-09-01 15:03:18,954] Trial 435 finished with values: [-1000000000.0, 1000000000.0] and parameters: {'p_sma': 32, 'p_std': 32, 'p_atr': 12, 'p_adx': 14, 'rsi_period': 84, 'ema1': 10, 'ema2': 56, 'slip_atr_k': 0.23035377420971487, 'slip_spread_k': 0.4410690769658079, 'spread_hl_frac': 0.021659836035474403, 'bb_std_mult': 2.252368238343464, 'rsi_os': 31, 'rsi_ob': 80, 'vol_spike': 0.07301768713949196, 'adx_thresh': 28.227965081650495, 'atr_min_pct': 0.01672541519954342, 'atr_max_pct': 0.06308620371398332, 'tp_mult': 1.929879781800563, 'tsl_mult': 0.42613721473715394, 'strategy': 'mean_reversion', 'time_stop': 225, 'use_sma': True, 'use_atr': True, 'use_adx': False, 'use_ema': True, 'use_spike': False, 'rsi_required': True, 'edge_k': 1.8476255725610717, 'edge_cap': 0.9141714772550078, 'bull_strategy': 'mean_reversion', 'bull_bb_std_mult': 0.793366385380841, 'bull_rsi_os': 12, 'bull_rsi_ob': 87, 'bull_adx_thresh': 7.082313017549917, 'bull_atr_min_pct': 0.01796158405961296, 'bull_atr_max_pct': 0.13207706355217005, 'bull_tp_mult': 1.4647748703748849, 'bull_tsl_mult': 0.4180831379350495, 'bull_time_stop': 68, 'bull_use_sma': False, 'bull_use_ema': False, 'bull_use_atr': True, 'bull_use_adx': False, 'bull_use_spike': False, 'bull_rsi_required': True, 'bear_strategy': 'breakout', 'bear_bb_std_mult': 2.731277179972437, 'bear_rsi_os': 23, 'bear_rsi_ob': 61, 'bear_adx_thresh': 10.366436753663603, 'bear_atr_min_pct': 0.004552978699538023, 'bear_atr_max_pct': 0.07517337033524808, 'bear_tp_mult': 1.5932055165681516, 'bear_tsl_mult': 0.859134462192739, 'bear_time_stop': 252, 'bear_use_sma': True, 'bear_use_ema': False, 'bear_use_atr': True, 'bear_use_adx': False, 'bear_use_spike': True, 'bear_rsi_required': True, 'sideways_strategy': 'mean_reversion', 'sideways_bb_std_mult': 1.0235314028006883, 'sideways_rsi_os': 48, 'sideways_rsi_ob': 58, 'sideways_adx_thresh': 16.55662016697017, 'sideways_atr_min_pct': 0.012654675210518582, 'sideways_atr_max_pct': 0.05627307498344235, 'sideways_tp_mult': 1.9265786746667506, 'sideways_tsl_mult': 0.06593158715190345, 'sideways_time_stop': 51, 'sideways_use_sma': True, 'sideways_use_ema': False, 'sideways_use_atr': True, 'sideways_use_adx': False, 'sideways_use_spike': False, 'sideways_rsi_required': True}.
[I 2025-09-01 15:03:19,270] Trial 433 finished with values: [-1000000000.0, 1000000000.0] and parameters: {'p_sma': 31, 'p_std': 26, 'p_atr': 12, 'p_adx': 27, 'rsi_period': 54, 'ema1': 16, 'ema2': 56, 'slip_atr_k': 0.023005248567143123, 'slip_spread_k': 0.4454300348665999, 'spread_hl_frac': 0.021465778847909487, 'bb_std_mult': 2.2493140303301926, 'rsi_os': 29, 'rsi_ob': 80, 'vol_spike': 0.07472283014130336, 'adx_thresh': 17.427905648540296, 'atr_min_pct': 0.01681376589290929, 'atr_max_pct': 0.06310895052465694, 'tp_mult': 1.9539457684067383, 'tsl_mult': 0.42661412410802946, 'strategy': 'breakout', 'time_stop': 27, 'use_sma': False, 'use_atr': True, 'use_adx': False, 'use_ema': True, 'use_spike': False, 'rsi_required': True, 'edge_k': 1.4721154194949837, 'edge_cap': 0.6373020978983812, 'bull_strategy': 'mean_reversion', 'bull_bb_std_mult': 1.1584060840061468, 'bull_rsi_os': 23, 'bull_rsi_ob': 47, 'bull_adx_thresh': 29.70172506640922, 'bull_atr_min_pct': 0.014644481029654759, 'bull_atr_max_pct': 0.1059635876588251, 'bull_tp_mult': 1.461322768387534, 'bull_tsl_mult': 0.0470465464718335, 'bull_time_stop': 70, 'bull_use_sma': False, 'bull_use_ema': True, 'bull_use_atr': False, 'bull_use_adx': True, 'bull_use_spike': False, 'bull_rsi_required': True, 'bear_strategy': 'breakout', 'bear_bb_std_mult': 1.5602896382784686, 'bear_rsi_os': 50, 'bear_rsi_ob': 61, 'bear_adx_thresh': 7.777475959720788, 'bear_atr_min_pct': 0.01129714911085869, 'bear_atr_max_pct': 0.13528817476160576, 'bear_tp_mult': 1.3770011707977396, 'bear_tsl_mult': 0.4364446001060037, 'bear_time_stop': 252, 'bear_use_sma': True, 'bear_use_ema': False, 'bear_use_atr': False, 'bear_use_adx': False, 'bear_use_spike': True, 'bear_rsi_required': True, 'sideways_strategy': 'mean_reversion', 'sideways_bb_std_mult': 2.8528369173183337, 'sideways_rsi_os': 22, 'sideways_rsi_ob': 79, 'sideways_adx_thresh': 16.319341907535648, 'sideways_atr_min_pct': 0.024850800177978555, 'sideways_atr_max_pct': 0.11797490238240423, 'sideways_tp_mult': 2.217853430603641, 'sideways_tsl_mult': 0.16770505255610169, 'sideways_time_stop': 52, 'sideways_use_sma': True, 'sideways_use_ema': False, 'sideways_use_atr': True, 'sideways_use_adx': True, 'sideways_use_spike': False, 'sideways_rsi_required': True}.
[I 2025-09-01 15:03:20,210] Trial 439 finished with values: [-1000000000.0, 1000000000.0] and parameters: {'p_sma': 33, 'p_std': 23, 'p_atr': 27, 'p_adx': 28, 'rsi_period': 73, 'ema1': 27, 'ema2': 58, 'slip_atr_k': 0.15162361675768368, 'slip_spread_k': 0.29323340618030436, 'spread_hl_frac': 0.00011923771112601692, 'bb_std_mult': 0.6200219257431003, 'rsi_os': 26, 'rsi_ob': 46, 'vol_spike': 0.06700734074511153, 'adx_thresh': 27.469176964955896, 'atr_min_pct': 0.01613782877577138, 'atr_max_pct': 0.06496756455260343, 'tp_mult': 2.125542545345109, 'tsl_mult': 0.39807205203965357, 'strategy': 'mean_reversion', 'time_stop': 39, 'use_sma': True, 'use_atr': True, 'use_adx': True, 'use_ema': True, 'use_spike': False, 'rsi_required': True, 'edge_k': 1.4326082119077501, 'edge_cap': 0.5438094754406385, 'bull_strategy': 'mean_reversion', 'bull_bb_std_mult': 1.83527590662728, 'bull_rsi_os': 26, 'bull_rsi_ob': 66, 'bull_adx_thresh': 8.246638460637692, 'bull_atr_min_pct': 0.015709504344890105, 'bull_atr_max_pct': 0.030939416058515204, 'bull_tp_mult': 1.7136131472497813, 'bull_tsl_mult': 0.11179230403564783, 'bull_time_stop': 149, 'bull_use_sma': False, 'bull_use_ema': True, 'bull_use_atr': True, 'bull_use_adx': False, 'bull_use_spike': True, 'bull_rsi_required': False, 'bear_strategy': 'breakout', 'bear_bb_std_mult': 1.2958424034230687, 'bear_rsi_os': 49, 'bear_rsi_ob': 51, 'bear_adx_thresh': 10.234904652273004, 'bear_atr_min_pct': 0.013432258530313674, 'bear_atr_max_pct': 0.13096533573275398, 'bear_tp_mult': 1.694216950268994, 'bear_tsl_mult': 0.7071063776765076, 'bear_time_stop': 38, 'bear_use_sma': True, 'bear_use_ema': False, 'bear_use_atr': False, 'bear_use_adx': False, 'bear_use_spike': True, 'bear_rsi_required': True, 'sideways_strategy': 'mean_reversion', 'sideways_bb_std_mult': 0.7731749382122803, 'sideways_rsi_os': 52, 'sideways_rsi_ob': 79, 'sideways_adx_thresh': 20.763815683681774, 'sideways_atr_min_pct': 0.002311054327239161, 'sideways_atr_max_pct': 0.10977883958099176, 'sideways_tp_mult': 1.6909542078214699, 'sideways_tsl_mult': 0.337888750658658, 'sideways_time_stop': 72, 'sideways_use_sma': True, 'sideways_use_ema': False, 'sideways_use_atr': True, 'sideways_use_adx': False, 'sideways_use_spike': False, 'sideways_rsi_required': True}.
[I 2025-09-01 15:04:01,301] Trial 437 finished with values: [-0.12238735234836606, 0.12206089936721605] and parameters: {'p_sma': 33, 'p_std': 23, 'p_atr': 7, 'p_adx': 28, 'rsi_period': 73, 'ema1': 27, 'ema2': 56, 'slip_atr_k': 0.008409327226319431, 'slip_spread_k': 0.4339920091911812, 'spread_hl_frac': 0.021930485105908604, 'bb_std_mult': 0.7354460693498899, 'rsi_os': 31, 'rsi_ob': 62, 'vol_spike': 0.07433353540471356, 'adx_thresh': 27.79294480641416, 'atr_min_pct': 0.016395363799441252, 'atr_max_pct': 0.06339261926041169, 'tp_mult': 1.9551989351291525, 'tsl_mult': 0.40341323626126846, 'strategy': 'mean_reversion', 'time_stop': 41, 'use_sma': True, 'use_atr': True, 'use_adx': True, 'use_ema': True, 'use_spike': False, 'rsi_required': True, 'edge_k': 1.4312277459632008, 'edge_cap': 0.9184021998208906, 'bull_strategy': 'mean_reversion', 'bull_bb_std_mult': 1.8441400486101607, 'bull_rsi_os': 12, 'bull_rsi_ob': 93, 'bull_adx_thresh': 24.02631551847052, 'bull_atr_min_pct': 0.014050291369593043, 'bull_atr_max_pct': 0.09090784616959391, 'bull_tp_mult': 1.2841011000946163, 'bull_tsl_mult': 0.05048578346346111, 'bull_time_stop': 67, 'bull_use_sma': False, 'bull_use_ema': True, 'bull_use_atr': True, 'bull_use_adx': False, 'bull_use_spike': False, 'bull_rsi_required': True, 'bear_strategy': 'breakout', 'bear_bb_std_mult': 3.167252321319401, 'bear_rsi_os': 49, 'bear_rsi_ob': 72, 'bear_adx_thresh': 10.27646916890722, 'bear_atr_min_pct': 0.001972761747734397, 'bear_atr_max_pct': 0.13437605279747225, 'bear_tp_mult': 1.585557258803393, 'bear_tsl_mult': 0.7049563725838728, 'bear_time_stop': 187, 'bear_use_sma': True, 'bear_use_ema': False, 'bear_use_atr': False, 'bear_use_adx': False, 'bear_use_spike': True, 'bear_rsi_required': True, 'sideways_strategy': 'mean_reversion', 'sideways_bb_std_mult': 1.0424442272495917, 'sideways_rsi_os': 26, 'sideways_rsi_ob': 79, 'sideways_adx_thresh': 32.29046866831133, 'sideways_atr_min_pct': 5.417944423588561e-06, 'sideways_atr_max_pct': 0.10845181946494795, 'sideways_tp_mult': 1.9471290080770565, 'sideways_tsl_mult': 0.7840757675641026, 'sideways_time_stop': 75, 'sideways_use_sma': True, 'sideways_use_ema': False, 'sideways_use_atr': True, 'sideways_use_adx': False, 'sideways_use_spike': False, 'sideways_rsi_required': True}.
[I 2025-09-01 15:04:01,961] Trial 438 finished with values: [-1000000000.0, 1000000000.0] and parameters: {'p_sma': 10, 'p_std': 53, 'p_atr': 20, 'p_adx': 15, 'rsi_period': 72, 'ema1': 12, 'ema2': 58, 'slip_atr_k': 0.007072230194127064, 'slip_spread_k': 0.01922835498252773, 'spread_hl_frac': 0.015772209829300388, 'bb_std_mult': 0.5759222749243456, 'rsi_os': 16, 'rsi_ob': 77, 'vol_spike': 0.06722638477188252, 'adx_thresh': 17.691760878936186, 'atr_min_pct': 0.01596893394619072, 'atr_max_pct': 0.13728438785192087, 'tp_mult': 1.947560931726254, 'tsl_mult': 0.4055006931066742, 'strategy': 'breakout', 'time_stop': 136, 'use_sma': False, 'use_atr': True, 'use_adx': True, 'use_ema': True, 'use_spike': False, 'rsi_required': True, 'edge_k': 1.4340325857194502, 'edge_cap': 0.09225151423065892, 'bull_strategy': 'mean_reversion', 'bull_bb_std_mult': 0.6633178302002732, 'bull_rsi_os': 26, 'bull_rsi_ob': 66, 'bull_adx_thresh': 8.17140577730291, 'bull_atr_min_pct': 0.01575555073649448, 'bull_atr_max_pct': 0.0281581503358213, 'bull_tp_mult': 1.7201431925709325, 'bull_tsl_mult': 0.04844828823950871, 'bull_time_stop': 150, 'bull_use_sma': False, 'bull_use_ema': True, 'bull_use_atr': False, 'bull_use_adx': True, 'bull_use_spike': True, 'bull_rsi_required': False, 'bear_strategy': 'breakout', 'bear_bb_std_mult': 1.285330738072829, 'bear_rsi_os': 19, 'bear_rsi_ob': 72, 'bear_adx_thresh': 10.279850813490656, 'bear_atr_min_pct': 0.01419028009912511, 'bear_atr_max_pct': 0.13623205322307458, 'bear_tp_mult': 1.0261636894762813, 'bear_tsl_mult': 0.8044800592126649, 'bear_time_stop': 36, 'bear_use_sma': True, 'bear_use_ema': False, 'bear_use_atr': False, 'bear_use_adx': False, 'bear_use_spike': True, 'bear_rsi_required': True, 'sideways_strategy': 'mean_reversion', 'sideways_bb_std_mult': 1.0584074095364817, 'sideways_rsi_os': 22, 'sideways_rsi_ob': 84, 'sideways_adx_thresh': 20.66538126293697, 'sideways_atr_min_pct': 0.011638907924206163, 'sideways_atr_max_pct': 0.1095322145051213, 'sideways_tp_mult': 1.0136735984385952, 'sideways_tsl_mult': 0.16145660255413596, 'sideways_time_stop': 73, 'sideways_use_sma': True, 'sideways_use_ema': False, 'sideways_use_atr': True, 'sideways_use_adx': True, 'sideways_use_spike': False, 'sideways_rsi_required': True}.
[I 2025-09-01 15:04:02,277] Trial 436 finished with values: [-1000000000.0, 1000000000.0] and parameters: {'p_sma': 33, 'p_std': 26, 'p_atr': 12, 'p_adx': 14, 'rsi_period': 35, 'ema1': 26, 'ema2': 56, 'slip_atr_k': 0.2053381353006808, 'slip_spread_k': 0.4273931145354695, 'spread_hl_frac': 0.016098286344696636, 'bb_std_mult': 2.0599661388626056, 'rsi_os': 31, 'rsi_ob': 77, 'vol_spike': 0.18973482531916394, 'adx_thresh': 14.025622465094195, 'atr_min_pct': 0.016667328944865775, 'atr_max_pct': 0.0636124130039162, 'tp_mult': 1.0691520172685798, 'tsl_mult': 0.4150716550966084, 'strategy': 'mean_reversion', 'time_stop': 207, 'use_sma': True, 'use_atr': True, 'use_adx': True, 'use_ema': True, 'use_spike': False, 'rsi_required': True, 'edge_k': 1.4387920335735211, 'edge_cap': 0.8807117903863072, 'bull_strategy': 'mean_reversion', 'bull_bb_std_mult': 1.8328722780675712, 'bull_rsi_os': 23, 'bull_rsi_ob': 84, 'bull_adx_thresh': 8.30339618214524, 'bull_atr_min_pct': 0.013878123516794906, 'bull_atr_max_pct': 0.1065352488816751, 'bull_tp_mult': 1.4180346673916349, 'bull_tsl_mult': 0.04952697340761871, 'bull_time_stop': 63, 'bull_use_sma': False, 'bull_use_ema': True, 'bull_use_atr': True, 'bull_use_adx': False, 'bull_use_spike': False, 'bull_rsi_required': True, 'bear_strategy': 'breakout', 'bear_bb_std_mult': 1.5349491316321742, 'bear_rsi_os': 50, 'bear_rsi_ob': 78, 'bear_adx_thresh': 10.38429030555116, 'bear_atr_min_pct': 0.021217265249752808, 'bear_atr_max_pct': 0.03932860808102331, 'bear_tp_mult': 1.2463219425608447, 'bear_tsl_mult': 0.5076076788214778, 'bear_time_stop': 248, 'bear_use_sma': True, 'bear_use_ema': False, 'bear_use_atr': True, 'bear_use_adx': False, 'bear_use_spike': True, 'bear_rsi_required': True, 'sideways_strategy': 'mean_reversion', 'sideways_bb_std_mult': 1.0311940710207834, 'sideways_rsi_os': 26, 'sideways_rsi_ob': 79, 'sideways_adx_thresh': 20.97349509474617, 'sideways_atr_min_pct': 0.005866372646505632, 'sideways_atr_max_pct': 0.04871372319011762, 'sideways_tp_mult': 1.9601438741750885, 'sideways_tsl_mult': 0.17572839702890297, 'sideways_time_stop': 75, 'sideways_use_sma': True, 'sideways_use_ema': False, 'sideways_use_atr': True, 'sideways_use_adx': False, 'sideways_use_spike': False, 'sideways_rsi_required': True}.
[I 2025-09-01 15:04:02,541] Trial 440 finished with values: [-1000000000.0, 1000000000.0] and parameters: {'p_sma': 29, 'p_std': 20, 'p_atr': 11, 'p_adx': 15, 'rsi_period': 71, 'ema1': 24, 'ema2': 58, 'slip_atr_k': 0.008333098920266466, 'slip_spread_k': 0.43066316898032947, 'spread_hl_frac': 0.008637272258660946, 'bb_std_mult': 2.158180357939003, 'rsi_os': 50, 'rsi_ob': 77, 'vol_spike': 0.2664304270312864, 'adx_thresh': 12.892471444789145, 'atr_min_pct': 0.015908192260883167, 'atr_max_pct': 0.14500177812031895, 'tp_mult': 1.850878405132391, 'tsl_mult': 0.19375046435176574, 'strategy': 'breakout', 'time_stop': 212, 'use_sma': False, 'use_atr': True, 'use_adx': True, 'use_ema': True, 'use_spike': False, 'rsi_required': True, 'edge_k': 1.956702082132341, 'edge_cap': 0.7098907649546712, 'bull_strategy': 'mean_reversion', 'bull_bb_std_mult': 2.6121405008274, 'bull_rsi_os': 31, 'bull_rsi_ob': 93, 'bull_adx_thresh': 7.610459054466357, 'bull_atr_min_pct': 0.013909287645124852, 'bull_atr_max_pct': 0.02728124366474085, 'bull_tp_mult': 1.277130998225597, 'bull_tsl_mult': 0.5121813749312807, 'bull_time_stop': 114, 'bull_use_sma': False, 'bull_use_ema': True, 'bull_use_atr': False, 'bull_use_adx': True, 'bull_use_spike': False, 'bull_rsi_required': True, 'bear_strategy': 'mean_reversion', 'bear_bb_std_mult': 3.305703672498685, 'bear_rsi_os': 30, 'bear_rsi_ob': 51, 'bear_adx_thresh': 24.0570283897681, 'bear_atr_min_pct': 0.004952827825580575, 'bear_atr_max_pct': 0.0481670272376383, 'bear_tp_mult': 1.646139389326207, 'bear_tsl_mult': 0.8074749471940317, 'bear_time_stop': 245, 'bear_use_sma': True, 'bear_use_ema': False, 'bear_use_atr': False, 'bear_use_adx': False, 'bear_use_spike': True, 'bear_rsi_required': True, 'sideways_strategy': 'breakout', 'sideways_bb_std_mult': 1.201711096780173, 'sideways_rsi_os': 14, 'sideways_rsi_ob': 78, 'sideways_adx_thresh': 32.35573052912607, 'sideways_atr_min_pct': 0.02263938402343129, 'sideways_atr_max_pct': 0.049663722384481905, 'sideways_tp_mult': 2.8683587812084212, 'sideways_tsl_mult': 0.7791889012878382, 'sideways_time_stop': 75, 'sideways_use_sma': False, 'sideways_use_ema': False, 'sideways_use_atr': True, 'sideways_use_adx': True, 'sideways_use_spike': False, 'sideways_rsi_required': True}.
