[I 2025-09-01 14:50:21,658] Trial 354 finished with values: [-0.004335801127849703, 0.01216302251082514] and parameters: {'p_sma': 31, 'p_std': 26, 'p_atr': 12, 'p_adx': 14, 'rsi_period': 72, 'ema1': 26, 'ema2': 58, 'slip_atr_k': 0.011068919082798907, 'slip_spread_k': 0.4223524841544171, 'spread_hl_frac': 0.0070494288871859835, 'bb_std_mult': 2.2078837349214933, 'rsi_os': 30, 'rsi_ob': 79, 'vol_spike': 0.07482029486039192, 'adx_thresh': 27.82480705704949, 'atr_min_pct': 0.016444828492126064, 'atr_max_pct': 0.06861057732394923, 'tp_mult': 1.965557937866445, 'tsl_mult': 0.4024372571978356, 'strategy': 'breakout', 'time_stop': 27, 'use_sma': False, 'use_atr': True, 'use_adx': False, 'use_ema': True, 'use_spike': False, 'rsi_required': True, 'edge_k': 1.472973008293129, 'edge_cap': 0.899357161968926, 'bull_strategy': 'mean_reversion', 'bull_bb_std_mult': 0.934061808815492, 'bull_rsi_os': 24, 'bull_rsi_ob': 66, 'bull_adx_thresh': 6.094774928851416, 'bull_atr_min_pct': 0.016173771158411086, 'bull_atr_max_pct': 0.03655581473938266, 'bull_tp_mult': 1.3872870707122864, 'bull_tsl_mult': 0.06523175316214769, 'bull_time_stop': 134, 'bull_use_sma': False, 'bull_use_ema': True, 'bull_use_atr': False, 'bull_use_adx': True, 'bull_use_spike': False, 'bull_rsi_required': True, 'bear_strategy': 'breakout', 'bear_bb_std_mult': 1.4822224173466831, 'bear_rsi_os': 51, 'bear_rsi_ob': 51, 'bear_adx_thresh': 9.22027185857343, 'bear_atr_min_pct': 0.0048387087636468425, 'bear_atr_max_pct': 0.0469445544542471, 'bear_tp_mult': 1.6378940780579332, 'bear_tsl_mult': 0.7212864238862393, 'bear_time_stop': 253, 'bear_use_sma': True, 'bear_use_ema': False, 'bear_use_atr': False, 'bear_use_adx': False, 'bear_use_spike': True, 'bear_rsi_required': True, 'sideways_strategy': 'mean_reversion', 'sideways_bb_std_mult': 1.0891755047520806, 'sideways_rsi_os': 23, 'sideways_rsi_ob': 78, 'sideways_adx_thresh': 32.850144047134954, 'sideways_atr_min_pct': 0.012531071367726734, 'sideways_atr_max_pct': 0.04865387544583906, 'sideways_tp_mult': 2.263310671186506, 'sideways_tsl_mult': 0.7635502682821511, 'sideways_time_stop': 65, 'sideways_use_sma': True, 'sideways_use_ema': False, 'sideways_use_atr': True, 'sideways_use_adx': True, 'sideways_use_spike': False, 'sideways_rsi_required': True}.
[I 2025-09-01 14:50:22,633] Trial 353 finished with values: [-0.03269908004893496, 0.03291185384277282] and parameters: {'p_sma': 28, 'p_std': 25, 'p_atr': 12, 'p_adx': 14, 'rsi_period': 48, 'ema1': 25, 'ema2': 57, 'slip_atr_k': 0.005020314546177646, 'slip_spread_k': 0.4240686994820074, 'spread_hl_frac': 0.007099844828343115, 'bb_std_mult': 2.1681978062044123, 'rsi_os': 30, 'rsi_ob': 79, 'vol_spike': 0.07253397785060775, 'adx_thresh': 28.32331965911343, 'atr_min_pct': 0.016347964643405932, 'atr_max_pct': 0.06732802239462764, 'tp_mult': 2.7372254227586055, 'tsl_mult': 0.4035890714250865, 'strategy': 'breakout', 'time_stop': 26, 'use_sma': False, 'use_atr': True, 'use_adx': False, 'use_ema': True, 'use_spike': True, 'rsi_required': True, 'edge_k': 1.5670468294559476, 'edge_cap': 0.9019272798232283, 'bull_strategy': 'mean_reversion', 'bull_bb_std_mult': 0.9568763640082699, 'bull_rsi_os': 24, 'bull_rsi_ob': 66, 'bull_adx_thresh': 6.3656484999338385, 'bull_atr_min_pct': 0.01783000934632216, 'bull_atr_max_pct': 0.0989462351322772, 'bull_tp_mult': 1.5027371943667325, 'bull_tsl_mult': 0.8962792672092981, 'bull_time_stop': 135, 'bull_use_sma': True, 'bull_use_ema': True, 'bull_use_atr': False, 'bull_use_adx': True, 'bull_use_spike': False, 'bull_rsi_required': True, 'bear_strategy': 'mean_reversion', 'bear_bb_std_mult': 1.368165727955305, 'bear_rsi_os': 51, 'bear_rsi_ob': 49, 'bear_adx_thresh': 7.556795183279849, 'bear_atr_min_pct': 0.0036746451821327198, 'bear_atr_max_pct': 0.0484220385888433, 'bear_tp_mult': 1.6319635567920066, 'bear_tsl_mult': 0.714029397004044, 'bear_time_stop': 251, 'bear_use_sma': True, 'bear_use_ema': False, 'bear_use_atr': True, 'bear_use_adx': False, 'bear_use_spike': True, 'bear_rsi_required': True, 'sideways_strategy': 'mean_reversion', 'sideways_bb_std_mult': 1.0970613435761023, 'sideways_rsi_os': 23, 'sideways_rsi_ob': 80, 'sideways_adx_thresh': 32.919651264443544, 'sideways_atr_min_pct': 0.013008906978400653, 'sideways_atr_max_pct': 0.040931727158057235, 'sideways_tp_mult': 2.0892014272033816, 'sideways_tsl_mult': 0.7787665162171412, 'sideways_time_stop': 69, 'sideways_use_sma': True, 'sideways_use_ema': False, 'sideways_use_atr': True, 'sideways_use_adx': False, 'sideways_use_spike': False, 'sideways_rsi_required': True}.
[I 2025-09-01 14:50:24,661] Trial 352 finished with values: [-0.031548938756259304, 0.031762072749990815] and parameters: {'p_sma': 28, 'p_std': 25, 'p_atr': 12, 'p_adx': 12, 'rsi_period': 48, 'ema1': 26, 'ema2': 57, 'slip_atr_k': 0.005048601434383629, 'slip_spread_k': 0.41906172883857407, 'spread_hl_frac': 0.006927813994263237, 'bb_std_mult': 2.3262525307537505, 'rsi_os': 30, 'rsi_ob': 79, 'vol_spike': 0.07825110452209509, 'adx_thresh': 28.675789167693864, 'atr_min_pct': 0.016489795184833764, 'atr_max_pct': 0.06854124893706487, 'tp_mult': 2.735655114404234, 'tsl_mult': 0.4088908213618241, 'strategy': 'breakout', 'time_stop': 10, 'use_sma': False, 'use_atr': True, 'use_adx': False, 'use_ema': True, 'use_spike': True, 'rsi_required': True, 'edge_k': 1.6252523695156231, 'edge_cap': 0.8392539067835296, 'bull_strategy': 'mean_reversion', 'bull_bb_std_mult': 0.9250245306605291, 'bull_rsi_os': 24, 'bull_rsi_ob': 69, 'bull_adx_thresh': 6.651343097302139, 'bull_atr_min_pct': 0.014893911745704798, 'bull_atr_max_pct': 0.025221365681929474, 'bull_tp_mult': 1.4877692788128354, 'bull_tsl_mult': 0.8950105527951947, 'bull_time_stop': 135, 'bull_use_sma': True, 'bull_use_ema': True, 'bull_use_atr': False, 'bull_use_adx': True, 'bull_use_spike': False, 'bull_rsi_required': True, 'bear_strategy': 'mean_reversion', 'bear_bb_std_mult': 1.4917164095304467, 'bear_rsi_os': 51, 'bear_rsi_ob': 49, 'bear_adx_thresh': 9.133257867610489, 'bear_atr_min_pct': 0.003726980930288827, 'bear_atr_max_pct': 0.047872742889865726, 'bear_tp_mult': 1.657190127163688, 'bear_tsl_mult': 0.681142477549428, 'bear_time_stop': 251, 'bear_use_sma': True, 'bear_use_ema': False, 'bear_use_atr': True, 'bear_use_adx': True, 'bear_use_spike': True, 'bear_rsi_required': True, 'sideways_strategy': 'mean_reversion', 'sideways_bb_std_mult': 1.048800049325043, 'sideways_rsi_os': 21, 'sideways_rsi_ob': 83, 'sideways_adx_thresh': 32.74950977168252, 'sideways_atr_min_pct': 0.013031941715838515, 'sideways_atr_max_pct': 0.041400851446558716, 'sideways_tp_mult': 1.992295317429598, 'sideways_tsl_mult': 0.762343761330292, 'sideways_time_stop': 66, 'sideways_use_sma': True, 'sideways_use_ema': False, 'sideways_use_atr': True, 'sideways_use_adx': False, 'sideways_use_spike': False, 'sideways_rsi_required': True}.
[I 2025-09-01 14:50:24,662] Trial 351 finished with values: [-0.01801479663157446, 0.024392485032854922] and parameters: {'p_sma': 28, 'p_std': 28, 'p_atr': 11, 'p_adx': 12, 'rsi_period': 33, 'ema1': 25, 'ema2': 57, 'slip_atr_k': 0.011652653662100351, 'slip_spread_k': 0.41617765902754655, 'spread_hl_frac': 0.008537633523900365, 'bb_std_mult': 2.191894976111719, 'rsi_os': 30, 'rsi_ob': 76, 'vol_spike': 0.08296954923026315, 'adx_thresh': 28.755737942887595, 'atr_min_pct': 0.016537016196182575, 'atr_max_pct': 0.06830318341852885, 'tp_mult': 2.951909945884977, 'tsl_mult': 0.4054919133632142, 'strategy': 'breakout', 'time_stop': 9, 'use_sma': False, 'use_atr': True, 'use_adx': False, 'use_ema': True, 'use_spike': True, 'rsi_required': True, 'edge_k': 1.6185051168531521, 'edge_cap': 0.8581827264529225, 'bull_strategy': 'mean_reversion', 'bull_bb_std_mult': 0.9826778115430949, 'bull_rsi_os': 24, 'bull_rsi_ob': 65, 'bull_adx_thresh': 7.1360206672584185, 'bull_atr_min_pct': 0.014707226131511819, 'bull_atr_max_pct': 0.03579599348667665, 'bull_tp_mult': 1.4781432292439938, 'bull_tsl_mult': 0.8953508462242475, 'bull_time_stop': 136, 'bull_use_sma': False, 'bull_use_ema': True, 'bull_use_atr': False, 'bull_use_adx': True, 'bull_use_spike': False, 'bull_rsi_required': True, 'bear_strategy': 'breakout', 'bear_bb_std_mult': 1.5077108958524947, 'bear_rsi_os': 51, 'bear_rsi_ob': 49, 'bear_adx_thresh': 9.038156801491047, 'bear_atr_min_pct': 0.004665201374254126, 'bear_atr_max_pct': 0.04329705177483066, 'bear_tp_mult': 1.630546945846301, 'bear_tsl_mult': 0.7118898640165467, 'bear_time_stop': 256, 'bear_use_sma': True, 'bear_use_ema': False, 'bear_use_atr': False, 'bear_use_adx': True, 'bear_use_spike': True, 'bear_rsi_required': True, 'sideways_strategy': 'mean_reversion', 'sideways_bb_std_mult': 1.0742146768982488, 'sideways_rsi_os': 23, 'sideways_rsi_ob': 78, 'sideways_adx_thresh': 31.937504969695034, 'sideways_atr_min_pct': 0.01299422201353523, 'sideways_atr_max_pct': 0.047693983276234315, 'sideways_tp_mult': 2.2390797495412804, 'sideways_tsl_mult': 0.7789034871741812, 'sideways_time_stop': 124, 'sideways_use_sma': True, 'sideways_use_ema': False, 'sideways_use_atr': True, 'sideways_use_adx': False, 'sideways_use_spike': False, 'sideways_rsi_required': True}.
[I 2025-09-01 14:50:25,489] Trial 358 finished with values: [-1000000000.0, 1000000000.0] and parameters: {'p_sma': 32, 'p_std': 25, 'p_atr': 10, 'p_adx': 16, 'rsi_period': 33, 'ema1': 25, 'ema2': 59, 'slip_atr_k': 0.0131223755714782, 'slip_spread_k': 0.37571116624535866, 'spread_hl_frac': 0.0058665515895766455, 'bb_std_mult': 2.0902195050380743, 'rsi_os': 32, 'rsi_ob': 79, 'vol_spike': 0.06846441438255782, 'adx_thresh': 28.048344963988537, 'atr_min_pct': 0.01719934415092908, 'atr_max_pct': 0.016115242088934154, 'tp_mult': 1.9752088914006467, 'tsl_mult': 0.36230711930828785, 'strategy': 'breakout', 'time_stop': 47, 'use_sma': False, 'use_atr': True, 'use_adx': False, 'use_ema': True, 'use_spike': True, 'rsi_required': False, 'edge_k': 1.372533666473188, 'edge_cap': 0.8494510445028375, 'bull_strategy': 'mean_reversion', 'bull_bb_std_mult': 0.8205128982607484, 'bull_rsi_os': 27, 'bull_rsi_ob': 68, 'bull_adx_thresh': 7.120374110134082, 'bull_atr_min_pct': 0.015496092127671111, 'bull_atr_max_pct': 0.036249240502006216, 'bull_tp_mult': 1.3710029375315855, 'bull_tsl_mult': 0.07718393142341679, 'bull_time_stop': 129, 'bull_use_sma': True, 'bull_use_ema': True, 'bull_use_atr': False, 'bull_use_adx': False, 'bull_use_spike': True, 'bull_rsi_required': False, 'bear_strategy': 'mean_reversion', 'bear_bb_std_mult': 1.588228298976648, 'bear_rsi_os': 47, 'bear_rsi_ob': 52, 'bear_adx_thresh': 13.116026396765491, 'bear_atr_min_pct': 0.0025635358122515738, 'bear_atr_max_pct': 0.04217845516015454, 'bear_tp_mult': 1.5189739968370424, 'bear_tsl_mult': 0.7636442238486676, 'bear_time_stop': 267, 'bear_use_sma': True, 'bear_use_ema': False, 'bear_use_atr': True, 'bear_use_adx': True, 'bear_use_spike': True, 'bear_rsi_required': False, 'sideways_strategy': 'breakout', 'sideways_bb_std_mult': 0.9902856738850934, 'sideways_rsi_os': 22, 'sideways_rsi_ob': 78, 'sideways_adx_thresh': 31.068971217774198, 'sideways_atr_min_pct': 0.012360893269709539, 'sideways_atr_max_pct': 0.05585833974189799, 'sideways_tp_mult': 2.244157067240954, 'sideways_tsl_mult': 0.6991844476144787, 'sideways_time_stop': 53, 'sideways_use_sma': False, 'sideways_use_ema': False, 'sideways_use_atr': True, 'sideways_use_adx': False, 'sideways_use_spike': False, 'sideways_rsi_required': True}.
[I 2025-09-01 14:51:03,042] Trial 356 finished with values: [-1000000000.0, 1000000000.0] and parameters: {'p_sma': 32, 'p_std': 24, 'p_atr': 11, 'p_adx': 15, 'rsi_period': 73, 'ema1': 25, 'ema2': 59, 'slip_atr_k': 0.012146420132673239, 'slip_spread_k': 0.35570239152220495, 'spread_hl_frac': 0.005201923640765493, 'bb_std_mult': 2.068647855652774, 'rsi_os': 32, 'rsi_ob': 79, 'vol_spike': 0.06902187694174615, 'adx_thresh': 17.352534343688877, 'atr_min_pct': 0.01731886679205622, 'atr_max_pct': 0.07210320143827799, 'tp_mult': 1.9768268402299436, 'tsl_mult': 0.38698760415899464, 'strategy': 'breakout', 'time_stop': 33, 'use_sma': False, 'use_atr': True, 'use_adx': False, 'use_ema': True, 'use_spike': True, 'rsi_required': False, 'edge_k': 1.2863548765930208, 'edge_cap': 0.8529723631614895, 'bull_strategy': 'mean_reversion', 'bull_bb_std_mult': 0.8152828189507562, 'bull_rsi_os': 26, 'bull_rsi_ob': 67, 'bull_adx_thresh': 6.918917437788477, 'bull_atr_min_pct': 0.01559222923805543, 'bull_atr_max_pct': 0.03562208005545866, 'bull_tp_mult': 1.3721366024865884, 'bull_tsl_mult': 0.04332470823309993, 'bull_time_stop': 131, 'bull_use_sma': True, 'bull_use_ema': True, 'bull_use_atr': False, 'bull_use_adx': False, 'bull_use_spike': True, 'bull_rsi_required': False, 'bear_strategy': 'mean_reversion', 'bear_bb_std_mult': 1.7139385668496092, 'bear_rsi_os': 47, 'bear_rsi_ob': 52, 'bear_adx_thresh': 9.568955526609388, 'bear_atr_min_pct': 0.013078461294097461, 'bear_atr_max_pct': 0.04123859361439953, 'bear_tp_mult': 1.5437248702275488, 'bear_tsl_mult': 0.7966300908496844, 'bear_time_stop': 266, 'bear_use_sma': True, 'bear_use_ema': False, 'bear_use_atr': True, 'bear_use_adx': True, 'bear_use_spike': True, 'bear_rsi_required': False, 'sideways_strategy': 'breakout', 'sideways_bb_std_mult': 1.0118995250148675, 'sideways_rsi_os': 22, 'sideways_rsi_ob': 83, 'sideways_adx_thresh': 31.375340346627517, 'sideways_atr_min_pct': 0.012389730476942144, 'sideways_atr_max_pct': 0.05443350938213993, 'sideways_tp_mult': 2.2002410993551265, 'sideways_tsl_mult': 0.6286559301430298, 'sideways_time_stop': 57, 'sideways_use_sma': False, 'sideways_use_ema': False, 'sideways_use_atr': True, 'sideways_use_adx': False, 'sideways_use_spike': False, 'sideways_rsi_required': True}.
[I 2025-09-01 14:51:05,194] Trial 359 finished with values: [-1000000000.0, 1000000000.0] and parameters: {'p_sma': 33, 'p_std': 24, 'p_atr': 11, 'p_adx': 15, 'rsi_period': 73, 'ema1': 26, 'ema2': 58, 'slip_atr_k': 0.014792511260886739, 'slip_spread_k': 0.8065639692984541, 'spread_hl_frac': 0.004929418859818424, 'bb_std_mult': 2.1368797419861765, 'rsi_os': 28, 'rsi_ob': 79, 'vol_spike': 0.06832546429805458, 'adx_thresh': 27.971138196568855, 'atr_min_pct': 0.017052191662127462, 'atr_max_pct': 0.06382469599257874, 'tp_mult': 1.9495369587449485, 'tsl_mult': 0.38642826338832675, 'strategy': 'breakout', 'time_stop': 29, 'use_sma': False, 'use_atr': True, 'use_adx': False, 'use_ema': True, 'use_spike': True, 'rsi_required': False, 'edge_k': 1.5009238726117178, 'edge_cap': 0.8516290563240552, 'bull_strategy': 'mean_reversion', 'bull_bb_std_mult': 0.8829813859604667, 'bull_rsi_os': 25, 'bull_rsi_ob': 67, 'bull_adx_thresh': 6.0533416818619665, 'bull_atr_min_pct': 0.016195501722095537, 'bull_atr_max_pct': 0.031214019859091977, 'bull_tp_mult': 1.3504354905518108, 'bull_tsl_mult': 0.044206292428651664, 'bull_time_stop': 120, 'bull_use_sma': True, 'bull_use_ema': True, 'bull_use_atr': False, 'bull_use_adx': False, 'bull_use_spike': True, 'bull_rsi_required': False, 'bear_strategy': 'mean_reversion', 'bear_bb_std_mult': 1.5356425825166193, 'bear_rsi_os': 48, 'bear_rsi_ob': 52, 'bear_adx_thresh': 13.444426695103886, 'bear_atr_min_pct': 0.0184391369002701, 'bear_atr_max_pct': 0.051924805446428794, 'bear_tp_mult': 1.5431057517640285, 'bear_tsl_mult': 0.8548183152514439, 'bear_time_stop': 269, 'bear_use_sma': True, 'bear_use_ema': False, 'bear_use_atr': True, 'bear_use_adx': True, 'bear_use_spike': True, 'bear_rsi_required': False, 'sideways_strategy': 'breakout', 'sideways_bb_std_mult': 0.9808208124401512, 'sideways_rsi_os': 22, 'sideways_rsi_ob': 79, 'sideways_adx_thresh': 31.667948139077353, 'sideways_atr_min_pct': 0.012634257396086462, 'sideways_atr_max_pct': 0.06425966167038455, 'sideways_tp_mult': 2.2118487914845577, 'sideways_tsl_mult': 0.6350522983466247, 'sideways_time_stop': 59, 'sideways_use_sma': False, 'sideways_use_ema': False, 'sideways_use_atr': True, 'sideways_use_adx': False, 'sideways_use_spike': False, 'sideways_rsi_required': True}.
[I 2025-09-01 14:51:05,195] Trial 357 finished with values: [-1000000000.0, 1000000000.0] and parameters: {'p_sma': 31, 'p_std': 24, 'p_atr': 10, 'p_adx': 16, 'rsi_period': 74, 'ema1': 25, 'ema2': 59, 'slip_atr_k': 0.011505742255744316, 'slip_spread_k': 0.36223801843601766, 'spread_hl_frac': 0.005316344649468306, 'bb_std_mult': 2.0722522407500326, 'rsi_os': 29, 'rsi_ob': 79, 'vol_spike': 0.06550625713155393, 'adx_thresh': 18.9597353255684, 'atr_min_pct': 0.01734919903187788, 'atr_max_pct': 0.06425034605645494, 'tp_mult': 1.9578993143007402, 'tsl_mult': 0.3638607283840718, 'strategy': 'breakout', 'time_stop': 32, 'use_sma': False, 'use_atr': True, 'use_adx': False, 'use_ema': True, 'use_spike': True, 'rsi_required': False, 'edge_k': 1.4693698016110412, 'edge_cap': 0.8498103679211503, 'bull_strategy': 'mean_reversion', 'bull_bb_std_mult': 0.8191257660529715, 'bull_rsi_os': 26, 'bull_rsi_ob': 67, 'bull_adx_thresh': 6.005733746241969, 'bull_atr_min_pct': 0.01577498712878878, 'bull_atr_max_pct': 0.036383198346340184, 'bull_tp_mult': 1.3768883687545947, 'bull_tsl_mult': 0.052517503863460324, 'bull_time_stop': 129, 'bull_use_sma': True, 'bull_use_ema': True, 'bull_use_atr': False, 'bull_use_adx': False, 'bull_use_spike': True, 'bull_rsi_required': False, 'bear_strategy': 'mean_reversion', 'bear_bb_std_mult': 1.620033951232223, 'bear_rsi_os': 50, 'bear_rsi_ob': 53, 'bear_adx_thresh': 11.685365389536463, 'bear_atr_min_pct': 0.012701396663056402, 'bear_atr_max_pct': 0.04175044992661751, 'bear_tp_mult': 1.5455612010147683, 'bear_tsl_mult': 0.7563827040529933, 'bear_time_stop': 266, 'bear_use_sma': True, 'bear_use_ema': False, 'bear_use_atr': True, 'bear_use_adx': True, 'bear_use_spike': True, 'bear_rsi_required': False, 'sideways_strategy': 'breakout', 'sideways_bb_std_mult': 0.9954245631643497, 'sideways_rsi_os': 23, 'sideways_rsi_ob': 78, 'sideways_adx_thresh': 31.3429206956201, 'sideways_atr_min_pct': 0.01097245275703763, 'sideways_atr_max_pct': 0.05485609856848798, 'sideways_tp_mult': 2.2587549531004196, 'sideways_tsl_mult': 0.6787755211396086, 'sideways_time_stop': 56, 'sideways_use_sma': False, 'sideways_use_ema': False, 'sideways_use_atr': True, 'sideways_use_adx': False, 'sideways_use_spike': False, 'sideways_rsi_required': True}.
[I 2025-09-01 14:51:05,631] Trial 355 finished with values: [-0.06268440680528187, 0.06222734317881123] and parameters: {'p_sma': 31, 'p_std': 24, 'p_atr': 10, 'p_adx': 15, 'rsi_period': 34, 'ema1': 25, 'ema2': 58, 'slip_atr_k': 0.014953968077336326, 'slip_spread_k': 0.36220388872779313, 'spread_hl_frac': 0.006859225631918505, 'bb_std_mult': 2.0268697452123328, 'rsi_os': 28, 'rsi_ob': 79, 'vol_spike': 0.07059003270220257, 'adx_thresh': 28.05684556075258, 'atr_min_pct': 0.017155459516492257, 'atr_max_pct': 0.02607785245108192, 'tp_mult': 1.9677932462651548, 'tsl_mult': 0.3908803580161089, 'strategy': 'breakout', 'time_stop': 48, 'use_sma': False, 'use_atr': True, 'use_adx': False, 'use_ema': True, 'use_spike': True, 'rsi_required': False, 'edge_k': 1.4623012482728033, 'edge_cap': 0.8381803670356189, 'bull_strategy': 'mean_reversion', 'bull_bb_std_mult': 0.8727396776644785, 'bull_rsi_os': 24, 'bull_rsi_ob': 67, 'bull_adx_thresh': 6.180960176744589, 'bull_atr_min_pct': 0.015602994325674623, 'bull_atr_max_pct': 0.015571606997142606, 'bull_tp_mult': 1.3629215025268082, 'bull_tsl_mult': 0.039667251790938704, 'bull_time_stop': 130, 'bull_use_sma': True, 'bull_use_ema': True, 'bull_use_atr': False, 'bull_use_adx': False, 'bull_use_spike': True, 'bull_rsi_required': False, 'bear_strategy': 'mean_reversion', 'bear_bb_std_mult': 1.7042364896000364, 'bear_rsi_os': 48, 'bear_rsi_ob': 52, 'bear_adx_thresh': 9.534139034791735, 'bear_atr_min_pct': 0.0028921027958512015, 'bear_atr_max_pct': 0.042278743911123656, 'bear_tp_mult': 1.51089311467211, 'bear_tsl_mult': 0.7569898532208005, 'bear_time_stop': 266, 'bear_use_sma': True, 'bear_use_ema': False, 'bear_use_atr': True, 'bear_use_adx': True, 'bear_use_spike': True, 'bear_rsi_required': False, 'sideways_strategy': 'breakout', 'sideways_bb_std_mult': 1.0416895471953007, 'sideways_rsi_os': 22, 'sideways_rsi_ob': 81, 'sideways_adx_thresh': 30.878079757963658, 'sideways_atr_min_pct': 0.012439647487716185, 'sideways_atr_max_pct': 0.053850455716898595, 'sideways_tp_mult': 2.2095869352223416, 'sideways_tsl_mult': 0.6872713051011159, 'sideways_time_stop': 53, 'sideways_use_sma': False, 'sideways_use_ema': False, 'sideways_use_atr': True, 'sideways_use_adx': False, 'sideways_use_spike': False, 'sideways_rsi_required': True}.
