[I 2025-09-01 15:13:44,833] Trial 507 finished with values: [-1000000000.0, 1000000000.0] and parameters: {'p_sma': 34, 'p_std': 25, 'p_atr': 13, 'p_adx': 15, 'rsi_period': 72, 'ema1': 15, 'ema2': 56, 'slip_atr_k': 0.22680880325226693, 'slip_spread_k': 0.40777723780163777, 'spread_hl_frac': 0.0010263621791904882, 'bb_std_mult': 2.225712857577163, 'rsi_os': 13, 'rsi_ob': 45, 'vol_spike': 0.057285921247574714, 'adx_thresh': 11.066795124032046, 'atr_min_pct': 0.012204824474094355, 'atr_max_pct': 0.07483876972065373, 'tp_mult': 2.163647284103008, 'tsl_mult': 0.4767642590145389, 'strategy': 'mean_reversion', 'time_stop': 163, 'use_sma': False, 'use_atr': True, 'use_adx': True, 'use_ema': True, 'use_spike': True, 'rsi_required': True, 'edge_k': 0.8873977119854196, 'edge_cap': 0.5556525847700078, 'bull_strategy': 'mean_reversion', 'bull_bb_std_mult': 0.9503490275472628, 'bull_rsi_os': 35, 'bull_rsi_ob': 66, 'bull_adx_thresh': 6.159808883176901, 'bull_atr_min_pct': 0.015263944413796873, 'bull_atr_max_pct': 0.045866643880007794, 'bull_tp_mult': 1.2690333076917004, 'bull_tsl_mult': 0.09853221990532626, 'bull_time_stop': 120, 'bull_use_sma': False, 'bull_use_ema': True, 'bull_use_atr': True, 'bull_use_adx': True, 'bull_use_spike': False, 'bull_rsi_required': False, 'bear_strategy': 'breakout', 'bear_bb_std_mult': 1.3531608083613862, 'bear_rsi_os': 45, 'bear_rsi_ob': 52, 'bear_adx_thresh': 27.971364270233003, 'bear_atr_min_pct': 0.011972197754293045, 'bear_atr_max_pct': 0.08014155327286178, 'bear_tp_mult': 1.676059759757707, 'bear_tsl_mult': 0.6649193714680518, 'bear_time_stop': 251, 'bear_use_sma': True, 'bear_use_ema': False, 'bear_use_atr': False, 'bear_use_adx': False, 'bear_use_spike': True, 'bear_rsi_required': True, 'sideways_strategy': 'mean_reversion', 'sideways_bb_std_mult': 1.0391151991311254, 'sideways_rsi_os': 22, 'sideways_rsi_ob': 84, 'sideways_adx_thresh': 33.87541393590102, 'sideways_atr_min_pct': 0.011980177056482936, 'sideways_atr_max_pct': 0.045375349823823324, 'sideways_tp_mult': 2.4339234963626986, 'sideways_tsl_mult': 0.7763957913218386, 'sideways_time_stop': 182, 'sideways_use_sma': True, 'sideways_use_ema': False, 'sideways_use_atr': True, 'sideways_use_adx': True, 'sideways_use_spike': False, 'sideways_rsi_required': True}.
[I 2025-09-01 15:14:20,071] Trial 503 finished with values: [-1000000000.0, 1000000000.0] and parameters: {'p_sma': 29, 'p_std': 27, 'p_atr': 12, 'p_adx': 15, 'rsi_period': 76, 'ema1': 14, 'ema2': 60, 'slip_atr_k': 0.01590769267669428, 'slip_spread_k': 0.40826864650290207, 'spread_hl_frac': 0.007262379986372951, 'bb_std_mult': 2.1893098373500774, 'rsi_os': 38, 'rsi_ob': 59, 'vol_spike': 0.19568714155916767, 'adx_thresh': 27.857861107720296, 'atr_min_pct': 0.013656748942744277, 'atr_max_pct': 0.14592719303393176, 'tp_mult': 1.8112470660557631, 'tsl_mult': 0.3574996532072384, 'strategy': 'breakout', 'time_stop': 139, 'use_sma': True, 'use_atr': True, 'use_adx': False, 'use_ema': True, 'use_spike': True, 'rsi_required': True, 'edge_k': 0.04348976196886001, 'edge_cap': 0.9262014594131409, 'bull_strategy': 'mean_reversion', 'bull_bb_std_mult': 0.9738929364600418, 'bull_rsi_os': 24, 'bull_rsi_ob': 63, 'bull_adx_thresh': 6.966213798975717, 'bull_atr_min_pct': 0.012280088827984812, 'bull_atr_max_pct': 0.0300612134233498, 'bull_tp_mult': 1.541321766661934, 'bull_tsl_mult': 0.10735166638058677, 'bull_time_stop': 129, 'bull_use_sma': False, 'bull_use_ema': False, 'bull_use_atr': False, 'bull_use_adx': True, 'bull_use_spike': False, 'bull_rsi_required': True, 'bear_strategy': 'breakout', 'bear_bb_std_mult': 1.3640348038621497, 'bear_rsi_os': 43, 'bear_rsi_ob': 76, 'bear_adx_thresh': 8.375456910010387, 'bear_atr_min_pct': 0.012263631717254116, 'bear_atr_max_pct': 0.08036118290965544, 'bear_tp_mult': 1.5310294516391283, 'bear_tsl_mult': 0.6644015478046302, 'bear_time_stop': 255, 'bear_use_sma': True, 'bear_use_ema': False, 'bear_use_atr': False, 'bear_use_adx': False, 'bear_use_spike': True, 'bear_rsi_required': True, 'sideways_strategy': 'mean_reversion', 'sideways_bb_std_mult': 0.8622791747728865, 'sideways_rsi_os': 5, 'sideways_rsi_ob': 78, 'sideways_adx_thresh': 32.41312308655763, 'sideways_atr_min_pct': 0.014882093313611136, 'sideways_atr_max_pct': 0.12331413460633864, 'sideways_tp_mult': 1.417426966460727, 'sideways_tsl_mult': 0.20606010780521938, 'sideways_time_stop': 200, 'sideways_use_sma': True, 'sideways_use_ema': False, 'sideways_use_atr': True, 'sideways_use_adx': True, 'sideways_use_spike': False, 'sideways_rsi_required': True}.
[I 2025-09-01 15:14:20,522] Trial 504 finished with values: [-1000000000.0, 1000000000.0] and parameters: {'p_sma': 33, 'p_std': 26, 'p_atr': 22, 'p_adx': 14, 'rsi_period': 77, 'ema1': 21, 'ema2': 58, 'slip_atr_k': 0.1317969087507715, 'slip_spread_k': 0.6695424811390376, 'spread_hl_frac': 0.018979902135647528, 'bb_std_mult': 2.1989496136162265, 'rsi_os': 41, 'rsi_ob': 80, 'vol_spike': 0.2590075324588065, 'adx_thresh': 15.498517470756, 'atr_min_pct': 0.013418725528238766, 'atr_max_pct': 0.14600261837081366, 'tp_mult': 1.9539854261823302, 'tsl_mult': 0.3590303600088732, 'strategy': 'mean_reversion', 'time_stop': 141, 'use_sma': False, 'use_atr': True, 'use_adx': True, 'use_ema': True, 'use_spike': True, 'rsi_required': True, 'edge_k': 1.6974542088911697, 'edge_cap': 0.5521656977470699, 'bull_strategy': 'mean_reversion', 'bull_bb_std_mult': 0.9954268076209185, 'bull_rsi_os': 24, 'bull_rsi_ob': 70, 'bull_adx_thresh': 5.3146543349526585, 'bull_atr_min_pct': 0.026664936409702557, 'bull_atr_max_pct': 0.0469071228740406, 'bull_tp_mult': 1.861138703364095, 'bull_tsl_mult': 0.10268442830569441, 'bull_time_stop': 173, 'bull_use_sma': False, 'bull_use_ema': True, 'bull_use_atr': True, 'bull_use_adx': True, 'bull_use_spike': True, 'bull_rsi_required': True, 'bear_strategy': 'mean_reversion', 'bear_bb_std_mult': 2.7465146592462117, 'bear_rsi_os': 39, 'bear_rsi_ob': 48, 'bear_adx_thresh': 9.348642183630277, 'bear_atr_min_pct': 0.003617957594170359, 'bear_atr_max_pct': 0.04242457599427197, 'bear_tp_mult': 1.6739855790454636, 'bear_tsl_mult': 0.7276075321653538, 'bear_time_stop': 260, 'bear_use_sma': True, 'bear_use_ema': False, 'bear_use_atr': False, 'bear_use_adx': True, 'bear_use_spike': True, 'bear_rsi_required': True, 'sideways_strategy': 'breakout', 'sideways_bb_std_mult': 0.8595392963179191, 'sideways_rsi_os': 37, 'sideways_rsi_ob': 65, 'sideways_adx_thresh': 22.796965145017, 'sideways_atr_min_pct': 0.01109549609634396, 'sideways_atr_max_pct': 0.09054078741514493, 'sideways_tp_mult': 1.435824111977665, 'sideways_tsl_mult': 0.5002738858418286, 'sideways_time_stop': 296, 'sideways_use_sma': False, 'sideways_use_ema': False, 'sideways_use_atr': True, 'sideways_use_adx': True, 'sideways_use_spike': False, 'sideways_rsi_required': True}.
[I 2025-09-01 15:14:20,776] Trial 506 finished with values: [-1000000000.0, 1000000000.0] and parameters: {'p_sma': 33, 'p_std': 41, 'p_atr': 24, 'p_adx': 15, 'rsi_period': 72, 'ema1': 21, 'ema2': 57, 'slip_atr_k': 0.22177860894906576, 'slip_spread_k': 0.4106846034668407, 'spread_hl_frac': 0.004363432466186538, 'bb_std_mult': 2.219389161206402, 'rsi_os': 48, 'rsi_ob': 89, 'vol_spike': 0.2220081472849123, 'adx_thresh': 27.916580029504217, 'atr_min_pct': 0.02817028478556002, 'atr_max_pct': 0.04929891287717173, 'tp_mult': 1.9834964450322832, 'tsl_mult': 0.19514083893940792, 'strategy': 'mean_reversion', 'time_stop': 161, 'use_sma': False, 'use_atr': True, 'use_adx': True, 'use_ema': True, 'use_spike': True, 'rsi_required': True, 'edge_k': 1.166231307386471, 'edge_cap': 0.26451621331128805, 'bull_strategy': 'mean_reversion', 'bull_bb_std_mult': 0.9732520008068432, 'bull_rsi_os': 30, 'bull_rsi_ob': 66, 'bull_adx_thresh': 5.427403748963588, 'bull_atr_min_pct': 0.015277800018400602, 'bull_atr_max_pct': 0.027138933839221998, 'bull_tp_mult': 1.273213506754911, 'bull_tsl_mult': 0.06409943675689332, 'bull_time_stop': 104, 'bull_use_sma': False, 'bull_use_ema': True, 'bull_use_atr': True, 'bull_use_adx': True, 'bull_use_spike': True, 'bull_rsi_required': False, 'bear_strategy': 'mean_reversion', 'bear_bb_std_mult': 1.3666717582484267, 'bear_rsi_os': 51, 'bear_rsi_ob': 75, 'bear_adx_thresh': 10.655097901154917, 'bear_atr_min_pct': 0.017934605402938758, 'bear_atr_max_pct': 0.05490699742319977, 'bear_tp_mult': 1.6739587823697974, 'bear_tsl_mult': 0.674570372514959, 'bear_time_stop': 215, 'bear_use_sma': True, 'bear_use_ema': False, 'bear_use_atr': False, 'bear_use_adx': True, 'bear_use_spike': True, 'bear_rsi_required': True, 'sideways_strategy': 'breakout', 'sideways_bb_std_mult': 0.911724076409603, 'sideways_rsi_os': 21, 'sideways_rsi_ob': 78, 'sideways_adx_thresh': 32.25266355605796, 'sideways_atr_min_pct': 0.012621112198085472, 'sideways_atr_max_pct': 0.09103257367350022, 'sideways_tp_mult': 2.3053695729269075, 'sideways_tsl_mult': 0.20683906900486193, 'sideways_time_stop': 259, 'sideways_use_sma': False, 'sideways_use_ema': False, 'sideways_use_atr': True, 'sideways_use_adx': True, 'sideways_use_spike': False, 'sideways_rsi_required': True}.
[I 2025-09-01 15:14:21,799] Trial 508 finished with values: [-1000000000.0, 1000000000.0] and parameters: {'p_sma': 33, 'p_std': 27, 'p_atr': 21, 'p_adx': 29, 'rsi_period': 70, 'ema1': 25, 'ema2': 12, 'slip_atr_k': 0.015004425357446945, 'slip_spread_k': 0.23701734013153186, 'spread_hl_frac': 0.004733413731637565, 'bb_std_mult': 2.2401328957779185, 'rsi_os': 46, 'rsi_ob': 81, 'vol_spike': 0.08331693130789479, 'adx_thresh': 9.080530700131034, 'atr_min_pct': 0.013499121813111085, 'atr_max_pct': 0.06849099755719143, 'tp_mult': 1.9528461279038132, 'tsl_mult': 0.3609369907168776, 'strategy': 'breakout', 'time_stop': 173, 'use_sma': False, 'use_atr': True, 'use_adx': False, 'use_ema': True, 'use_spike': False, 'rsi_required': True, 'edge_k': 1.2144529284350019, 'edge_cap': 0.9106230915596297, 'bull_strategy': 'mean_reversion', 'bull_bb_std_mult': 3.117086363550669, 'bull_rsi_os': 42, 'bull_rsi_ob': 67, 'bull_adx_thresh': 5.433784368176849, 'bull_atr_min_pct': 0.01901154730006372, 'bull_atr_max_pct': 0.03086455717416165, 'bull_tp_mult': 1.422720460164809, 'bull_tsl_mult': 0.05378949429688473, 'bull_time_stop': 140, 'bull_use_sma': False, 'bull_use_ema': True, 'bull_use_atr': False, 'bull_use_adx': True, 'bull_use_spike': False, 'bull_rsi_required': True, 'bear_strategy': 'mean_reversion', 'bear_bb_std_mult': 1.445307518770794, 'bear_rsi_os': 49, 'bear_rsi_ob': 49, 'bear_adx_thresh': 9.57745167956463, 'bear_atr_min_pct': 0.015779020560880916, 'bear_atr_max_pct': 0.05475631327507571, 'bear_tp_mult': 1.529776095092731, 'bear_tsl_mult': 0.23942665518605288, 'bear_time_stop': 261, 'bear_use_sma': True, 'bear_use_ema': False, 'bear_use_atr': False, 'bear_use_adx': True, 'bear_use_spike': True, 'bear_rsi_required': True, 'sideways_strategy': 'mean_reversion', 'sideways_bb_std_mult': 2.1279680707579924, 'sideways_rsi_os': 26, 'sideways_rsi_ob': 79, 'sideways_adx_thresh': 32.46126884097534, 'sideways_atr_min_pct': 0.01473138575217484, 'sideways_atr_max_pct': 0.049780736998311655, 'sideways_tp_mult': 2.2926436302188873, 'sideways_tsl_mult': 0.7178997936514893, 'sideways_time_stop': 219, 'sideways_use_sma': True, 'sideways_use_ema': False, 'sideways_use_atr': True, 'sideways_use_adx': True, 'sideways_use_spike': False, 'sideways_rsi_required': True}.
[I 2025-09-01 15:14:22,793] Trial 512 finished with values: [-1000000000.0, 1000000000.0] and parameters: {'p_sma': 6, 'p_std': 5, 'p_atr': 13, 'p_adx': 9, 'rsi_period': 30, 'ema1': 16, 'ema2': 50, 'slip_atr_k': 0.008144062085248534, 'slip_spread_k': 0.45500557089551497, 'spread_hl_frac': 0.008377541285448757, 'bb_std_mult': 2.134893941783339, 'rsi_os': 31, 'rsi_ob': 66, 'vol_spike': 0.08904930997187563, 'adx_thresh': 26.149944100795334, 'atr_min_pct': 0.017056384137519146, 'atr_max_pct': 0.010140432249563847, 'tp_mult': 2.6306354250822563, 'tsl_mult': 0.4492945719342711, 'strategy': 'breakout', 'time_stop': 285, 'use_sma': False, 'use_atr': True, 'use_adx': False, 'use_ema': True, 'use_spike': False, 'rsi_required': False, 'edge_k': 1.358260338047497, 'edge_cap': 0.9041987360123913, 'bull_strategy': 'mean_reversion', 'bull_bb_std_mult': 0.8330894157583616, 'bull_rsi_os': 26, 'bull_rsi_ob': 73, 'bull_adx_thresh': 6.102112233663903, 'bull_atr_min_pct': 0.022606259650242932, 'bull_atr_max_pct': 0.0904710316285664, 'bull_tp_mult': 1.384591454204715, 'bull_tsl_mult': 0.08076552183237959, 'bull_time_stop': 49, 'bull_use_sma': False, 'bull_use_ema': True, 'bull_use_atr': False, 'bull_use_adx': False, 'bull_use_spike': False, 'bull_rsi_required': True, 'bear_strategy': 'breakout', 'bear_bb_std_mult': 1.4807143298130927, 'bear_rsi_os': 53, 'bear_rsi_ob': 52, 'bear_adx_thresh': 23.582895434360623, 'bear_atr_min_pct': 0.02920220339508581, 'bear_atr_max_pct': 0.04395682191123954, 'bear_tp_mult': 1.5960345917771053, 'bear_tsl_mult': 0.9432825761745784, 'bear_time_stop': 114, 'bear_use_sma': True, 'bear_use_ema': False, 'bear_use_atr': True, 'bear_use_adx': False, 'bear_use_spike': True, 'bear_rsi_required': False, 'sideways_strategy': 'mean_reversion', 'sideways_bb_std_mult': 0.7204730688111314, 'sideways_rsi_os': 23, 'sideways_rsi_ob': 81, 'sideways_adx_thresh': 33.54713874031507, 'sideways_atr_min_pct': 0.02088954008305626, 'sideways_atr_max_pct': 0.06703644718434729, 'sideways_tp_mult': 2.2729331677646205, 'sideways_tsl_mult': 0.7446540606485249, 'sideways_time_stop': 78, 'sideways_use_sma': True, 'sideways_use_ema': False, 'sideways_use_atr': True, 'sideways_use_adx': False, 'sideways_use_spike': False, 'sideways_rsi_required': True}.
[I 2025-09-01 15:14:59,238] Trial 510 finished with values: [-1000000000.0, 1000000000.0] and parameters: {'p_sma': 31, 'p_std': 41, 'p_atr': 13, 'p_adx': 29, 'rsi_period': 70, 'ema1': 25, 'ema2': 50, 'slip_atr_k': 0.17498326801816083, 'slip_spread_k': 0.4680902766147339, 'spread_hl_frac': 0.004605992534277768, 'bb_std_mult': 2.267316697484945, 'rsi_os': 47, 'rsi_ob': 81, 'vol_spike': 0.1740090253428574, 'adx_thresh': 27.190022726184022, 'atr_min_pct': 0.028174337099229257, 'atr_max_pct': 0.06909654965536133, 'tp_mult': 1.9992559719770298, 'tsl_mult': 0.2016809930752082, 'strategy': 'breakout', 'time_stop': 288, 'use_sma': False, 'use_atr': True, 'use_adx': False, 'use_ema': True, 'use_spike': False, 'rsi_required': True, 'edge_k': 1.2075662303982817, 'edge_cap': 0.5014101352784167, 'bull_strategy': 'mean_reversion', 'bull_bb_std_mult': 0.8423790606274063, 'bull_rsi_os': 26, 'bull_rsi_ob': 67, 'bull_adx_thresh': 5.033100872761396, 'bull_atr_min_pct': 0.015625910817234388, 'bull_atr_max_pct': 0.10070415245196217, 'bull_tp_mult': 1.422167725442892, 'bull_tsl_mult': 0.06403934031316548, 'bull_time_stop': 139, 'bull_use_sma': False, 'bull_use_ema': True, 'bull_use_atr': False, 'bull_use_adx': True, 'bull_use_spike': False, 'bull_rsi_required': False, 'bear_strategy': 'breakout', 'bear_bb_std_mult': 1.444300893313781, 'bear_rsi_os': 49, 'bear_rsi_ob': 75, 'bear_adx_thresh': 10.063961252150804, 'bear_atr_min_pct': 0.018029122483337524, 'bear_atr_max_pct': 0.05353762320262222, 'bear_tp_mult': 2.8344041254315138, 'bear_tsl_mult': 0.24530300922906367, 'bear_time_stop': 269, 'bear_use_sma': True, 'bear_use_ema': False, 'bear_use_atr': True, 'bear_use_adx': False, 'bear_use_spike': True, 'bear_rsi_required': True, 'sideways_strategy': 'mean_reversion', 'sideways_bb_std_mult': 0.9638909127288999, 'sideways_rsi_os': 55, 'sideways_rsi_ob': 92, 'sideways_adx_thresh': 25.713578410953744, 'sideways_atr_min_pct': 0.013282388372659217, 'sideways_atr_max_pct': 0.04978976069781067, 'sideways_tp_mult': 2.2962311368540598, 'sideways_tsl_mult': 0.7139334673693001, 'sideways_time_stop': 240, 'sideways_use_sma': True, 'sideways_use_ema': False, 'sideways_use_atr': True, 'sideways_use_adx': True, 'sideways_use_spike': False, 'sideways_rsi_required': True}.
[I 2025-09-01 15:14:59,819] Trial 509 finished with values: [-1000000000.0, 1000000000.0] and parameters: {'p_sma': 33, 'p_std': 56, 'p_atr': 13, 'p_adx': 14, 'rsi_period': 70, 'ema1': 25, 'ema2': 57, 'slip_atr_k': 0.18642845819319048, 'slip_spread_k': 0.999322267752556, 'spread_hl_frac': 0.004664841787349857, 'bb_std_mult': 1.6233583769035067, 'rsi_os': 31, 'rsi_ob': 80, 'vol_spike': 0.0829349448654835, 'adx_thresh': 26.33799511585371, 'atr_min_pct': 0.016922670525595228, 'atr_max_pct': 0.06736763912323493, 'tp_mult': 1.9396143968918158, 'tsl_mult': 0.2721712259185076, 'strategy': 'breakout', 'time_stop': 40, 'use_sma': False, 'use_atr': True, 'use_adx': False, 'use_ema': True, 'use_spike': False, 'rsi_required': True, 'edge_k': 1.7750533418601862, 'edge_cap': 0.9128997775089502, 'bull_strategy': 'mean_reversion', 'bull_bb_std_mult': 0.8539615102262157, 'bull_rsi_os': 24, 'bull_rsi_ob': 67, 'bull_adx_thresh': 5.03621591818651, 'bull_atr_min_pct': 0.019524258098571473, 'bull_atr_max_pct': 0.09163658994058699, 'bull_tp_mult': 1.4258028037470885, 'bull_tsl_mult': 0.059435555247768716, 'bull_time_stop': 139, 'bull_use_sma': False, 'bull_use_ema': True, 'bull_use_atr': False, 'bull_use_adx': True, 'bull_use_spike': True, 'bull_rsi_required': False, 'bear_strategy': 'mean_reversion', 'bear_bb_std_mult': 2.7415066128194, 'bear_rsi_os': 49, 'bear_rsi_ob': 52, 'bear_adx_thresh': 9.354399341958983, 'bear_atr_min_pct': 0.01808858503932144, 'bear_atr_max_pct': 0.05490996982840909, 'bear_tp_mult': 1.6036379520013953, 'bear_tsl_mult': 0.06761281386424262, 'bear_time_stop': 264, 'bear_use_sma': True, 'bear_use_ema': False, 'bear_use_atr': False, 'bear_use_adx': True, 'bear_use_spike': True, 'bear_rsi_required': True, 'sideways_strategy': 'breakout', 'sideways_bb_std_mult': 0.9580054943502336, 'sideways_rsi_os': 41, 'sideways_rsi_ob': 65, 'sideways_adx_thresh': 25.049683898474974, 'sideways_atr_min_pct': 0.013088978710060586, 'sideways_atr_max_pct': 0.05002576367136014, 'sideways_tp_mult': 2.295825234848985, 'sideways_tsl_mult': 0.2689722900275634, 'sideways_time_stop': 79, 'sideways_use_sma': False, 'sideways_use_ema': False, 'sideways_use_atr': True, 'sideways_use_adx': True, 'sideways_use_spike': False, 'sideways_rsi_required': True}.
[I 2025-09-01 15:15:00,222] Trial 511 finished with values: [-1000000000.0, 1000000000.0] and parameters: {'p_sma': 32, 'p_std': 28, 'p_atr': 13, 'p_adx': 27, 'rsi_period': 25, 'ema1': 25, 'ema2': 17, 'slip_atr_k': 0.010569832016760526, 'slip_spread_k': 0.46793291672456183, 'spread_hl_frac': 0.008729939861169331, 'bb_std_mult': 1.364179610205565, 'rsi_os': 31, 'rsi_ob': 80, 'vol_spike': 0.07938921414078598, 'adx_thresh': 27.23344654650042, 'atr_min_pct': 0.0009926775436000252, 'atr_max_pct': 0.06771980721811614, 'tp_mult': 2.519753283485671, 'tsl_mult': 0.4605472346312742, 'strategy': 'breakout', 'time_stop': 292, 'use_sma': False, 'use_atr': True, 'use_adx': False, 'use_ema': True, 'use_spike': False, 'rsi_required': True, 'edge_k': 1.7762752032865592, 'edge_cap': 0.9125710194703844, 'bull_strategy': 'mean_reversion', 'bull_bb_std_mult': 3.0943534193984608, 'bull_rsi_os': 25, 'bull_rsi_ob': 67, 'bull_adx_thresh': 25.72445342408833, 'bull_atr_min_pct': 0.018842610683864086, 'bull_atr_max_pct': 0.08020669173922355, 'bull_tp_mult': 2.8520290702808597, 'bull_tsl_mult': 0.051982746669236884, 'bull_time_stop': 139, 'bull_use_sma': False, 'bull_use_ema': True, 'bull_use_atr': False, 'bull_use_adx': False, 'bull_use_spike': False, 'bull_rsi_required': True, 'bear_strategy': 'breakout', 'bear_bb_std_mult': 1.4477628261200624, 'bear_rsi_os': 47, 'bear_rsi_ob': 50, 'bear_adx_thresh': 7.290654252078024, 'bear_atr_min_pct': 0.005722331179400179, 'bear_atr_max_pct': 0.14218129606786703, 'bear_tp_mult': 1.606570544887679, 'bear_tsl_mult': 0.06777331767339984, 'bear_time_stop': 264, 'bear_use_sma': True, 'bear_use_ema': False, 'bear_use_atr': True, 'bear_use_adx': False, 'bear_use_spike': True, 'bear_rsi_required': True, 'sideways_strategy': 'mean_reversion', 'sideways_bb_std_mult': 0.9825429635966507, 'sideways_rsi_os': 23, 'sideways_rsi_ob': 81, 'sideways_adx_thresh': 11.565134727873405, 'sideways_atr_min_pct': 0.02089143099574343, 'sideways_atr_max_pct': 0.06811649453681509, 'sideways_tp_mult': 1.6790413389623404, 'sideways_tsl_mult': 0.7443809264481506, 'sideways_time_stop': 109, 'sideways_use_sma': True, 'sideways_use_ema': False, 'sideways_use_atr': True, 'sideways_use_adx': False, 'sideways_use_spike': False, 'sideways_rsi_required': True}.
