[I 2025-09-01 15:01:14,975] Trial 425 finished with values: [-1000000000.0, 1000000000.0] and parameters: {'p_sma': 33, 'p_std': 30, 'p_atr': 18, 'p_adx': 15, 'rsi_period': 11, 'ema1': 13, 'ema2': 59, 'slip_atr_k': 0.22299409145941052, 'slip_spread_k': 0.4412514401928973, 'spread_hl_frac': 0.004872973296096553, 'bb_std_mult': 1.9146071925987485, 'rsi_os': 35, 'rsi_ob': 59, 'vol_spike': 0.0985620426272837, 'adx_thresh': 7.727366921322801, 'atr_min_pct': 0.02760732432687428, 'atr_max_pct': 0.02381323956213713, 'tp_mult': 1.9785949884431666, 'tsl_mult': 0.7023856571739833, 'strategy': 'mean_reversion', 'time_stop': 14, 'use_sma': True, 'use_atr': True, 'use_adx': False, 'use_ema': True, 'use_spike': True, 'rsi_required': True, 'edge_k': 1.364984477509959, 'edge_cap': 0.6607465047366303, 'bull_strategy': 'mean_reversion', 'bull_bb_std_mult': 0.8928871454142819, 'bull_rsi_os': 34, 'bull_rsi_ob': 62, 'bull_adx_thresh': 6.211104794305987, 'bull_atr_min_pct': 0.014603204002806274, 'bull_atr_max_pct': 0.09567933905920183, 'bull_tp_mult': 1.348888956680872, 'bull_tsl_mult': 0.024032364345007863, 'bull_time_stop': 285, 'bull_use_sma': False, 'bull_use_ema': True, 'bull_use_atr': True, 'bull_use_adx': False, 'bull_use_spike': False, 'bull_rsi_required': True, 'bear_strategy': 'mean_reversion', 'bear_bb_std_mult': 1.7981381274239707, 'bear_rsi_os': 26, 'bear_rsi_ob': 55, 'bear_adx_thresh': 31.392828328039016, 'bear_atr_min_pct': 0.00476988225030503, 'bear_atr_max_pct': 0.08022201485776188, 'bear_tp_mult': 2.8568969687541674, 'bear_tsl_mult': 0.09145871751652129, 'bear_time_stop': 256, 'bear_use_sma': True, 'bear_use_ema': False, 'bear_use_atr': False, 'bear_use_adx': False, 'bear_use_spike': True, 'bear_rsi_required': True, 'sideways_strategy': 'breakout', 'sideways_bb_std_mult': 0.9967616304626645, 'sideways_rsi_os': 19, 'sideways_rsi_ob': 60, 'sideways_adx_thresh': 32.61734943255433, 'sideways_atr_min_pct': 0.013669484866658766, 'sideways_atr_max_pct': 0.1375445686254253, 'sideways_tp_mult': 2.2303941127987925, 'sideways_tsl_mult': 0.47332706236824823, 'sideways_time_stop': 123, 'sideways_use_sma': False, 'sideways_use_ema': False, 'sideways_use_atr': True, 'sideways_use_adx': True, 'sideways_use_spike': False, 'sideways_rsi_required': True}.
[I 2025-09-01 15:01:50,717] Trial 423 finished with values: [-1000000000.0, 1000000000.0] and parameters: {'p_sma': 35, 'p_std': 25, 'p_atr': 13, 'p_adx': 15, 'rsi_period': 69, 'ema1': 13, 'ema2': 29, 'slip_atr_k': 0.00978206416350958, 'slip_spread_k': 0.7246697136210288, 'spread_hl_frac': 0.004781933922182693, 'bb_std_mult': 3.1814148157891724, 'rsi_os': 33, 'rsi_ob': 58, 'vol_spike': 0.28638092776482693, 'adx_thresh': 26.975113399798825, 'atr_min_pct': 0.01779852160589298, 'atr_max_pct': 0.07602738878927454, 'tp_mult': 2.0738274822262732, 'tsl_mult': 0.6958029864560108, 'strategy': 'breakout', 'time_stop': 38, 'use_sma': False, 'use_atr': True, 'use_adx': False, 'use_ema': True, 'use_spike': False, 'rsi_required': False, 'edge_k': 1.5296479750931131, 'edge_cap': 0.5994172059603475, 'bull_strategy': 'mean_reversion', 'bull_bb_std_mult': 2.825758170746899, 'bull_rsi_os': 25, 'bull_rsi_ob': 65, 'bull_adx_thresh': 6.268426750733217, 'bull_atr_min_pct': 0.01714197559851355, 'bull_atr_max_pct': 0.034050099253423456, 'bull_tp_mult': 1.400976065096497, 'bull_tsl_mult': 0.032611415937402216, 'bull_time_stop': 122, 'bull_use_sma': True, 'bull_use_ema': True, 'bull_use_atr': False, 'bull_use_adx': True, 'bull_use_spike': False, 'bull_rsi_required': True, 'bear_strategy': 'mean_reversion', 'bear_bb_std_mult': 1.435649620660162, 'bear_rsi_os': 36, 'bear_rsi_ob': 55, 'bear_adx_thresh': 8.615950309193128, 'bear_atr_min_pct': 0.005426809293212185, 'bear_atr_max_pct': 0.055918603158620336, 'bear_tp_mult': 1.6359741949786661, 'bear_tsl_mult': 0.0925951320380255, 'bear_time_stop': 5, 'bear_use_sma': True, 'bear_use_ema': False, 'bear_use_atr': False, 'bear_use_adx': False, 'bear_use_spike': True, 'bear_rsi_required': False, 'sideways_strategy': 'mean_reversion', 'sideways_bb_std_mult': 1.1127874789377161, 'sideways_rsi_os': 40, 'sideways_rsi_ob': 80, 'sideways_adx_thresh': 23.298304806438566, 'sideways_atr_min_pct': 0.012261759059645395, 'sideways_atr_max_pct': 0.13811395474792562, 'sideways_tp_mult': 1.4109021997037727, 'sideways_tsl_mult': 0.7981982659954686, 'sideways_time_stop': 69, 'sideways_use_sma': True, 'sideways_use_ema': False, 'sideways_use_atr': True, 'sideways_use_adx': True, 'sideways_use_spike': False, 'sideways_rsi_required': True}.
[I 2025-09-01 15:01:51,893] Trial 427 finished with values: [-1000000000.0, 1000000000.0] and parameters: {'p_sma': 50, 'p_std': 25, 'p_atr': 26, 'p_adx': 14, 'rsi_period': 42, 'ema1': 15, 'ema2': 33, 'slip_atr_k': 0.00974724524966642, 'slip_spread_k': 0.4098627819263447, 'spread_hl_frac': 0.0021957158478282286, 'bb_std_mult': 2.326167875193513, 'rsi_os': 32, 'rsi_ob': 49, 'vol_spike': 0.13093048885680986, 'adx_thresh': 16.0650911888842, 'atr_min_pct': 0.017884039852631105, 'atr_max_pct': 0.06897919843938306, 'tp_mult': 1.866984391103563, 'tsl_mult': 0.40713054110394997, 'strategy': 'breakout', 'time_stop': 247, 'use_sma': False, 'use_atr': True, 'use_adx': False, 'use_ema': True, 'use_spike': False, 'rsi_required': False, 'edge_k': 1.4615813978543906, 'edge_cap': 0.908429601161467, 'bull_strategy': 'mean_reversion', 'bull_bb_std_mult': 0.9924163960462128, 'bull_rsi_os': 28, 'bull_rsi_ob': 68, 'bull_adx_thresh': 6.389056532001635, 'bull_atr_min_pct': 0.01666544213946019, 'bull_atr_max_pct': 0.14587921703896323, 'bull_tp_mult': 2.9648055364632286, 'bull_tsl_mult': 0.3012811848175609, 'bull_time_stop': 121, 'bull_use_sma': True, 'bull_use_ema': True, 'bull_use_atr': False, 'bull_use_adx': True, 'bull_use_spike': False, 'bull_rsi_required': True, 'bear_strategy': 'breakout', 'bear_bb_std_mult': 2.9103486550979007, 'bear_rsi_os': 52, 'bear_rsi_ob': 63, 'bear_adx_thresh': 8.55152204848113, 'bear_atr_min_pct': 0.01512412365374309, 'bear_atr_max_pct': 0.14319980379529937, 'bear_tp_mult': 2.0352592312155235, 'bear_tsl_mult': 0.9542223894690722, 'bear_time_stop': 280, 'bear_use_sma': True, 'bear_use_ema': False, 'bear_use_atr': False, 'bear_use_adx': True, 'bear_use_spike': True, 'bear_rsi_required': False, 'sideways_strategy': 'mean_reversion', 'sideways_bb_std_mult': 0.6986049587678382, 'sideways_rsi_os': 20, 'sideways_rsi_ob': 79, 'sideways_adx_thresh': 25.67749156531708, 'sideways_atr_min_pct': 0.021691670512137076, 'sideways_atr_max_pct': 0.07841802736988308, 'sideways_tp_mult': 1.6147393326752315, 'sideways_tsl_mult': 0.7326482654811362, 'sideways_time_stop': 264, 'sideways_use_sma': True, 'sideways_use_ema': False, 'sideways_use_atr': True, 'sideways_use_adx': True, 'sideways_use_spike': False, 'sideways_rsi_required': True}.
[I 2025-09-01 15:01:51,935] Trial 424 finished with values: [-1000000000.0, 1000000000.0] and parameters: {'p_sma': 8, 'p_std': 30, 'p_atr': 13, 'p_adx': 15, 'rsi_period': 69, 'ema1': 27, 'ema2': 60, 'slip_atr_k': 0.21729158171970453, 'slip_spread_k': 0.18510872695440517, 'spread_hl_frac': 0.02509417012709089, 'bb_std_mult': 1.9317665496848675, 'rsi_os': 35, 'rsi_ob': 81, 'vol_spike': 0.2853305927562551, 'adx_thresh': 26.943607660697335, 'atr_min_pct': 0.027552166291705933, 'atr_max_pct': 0.07620461888656622, 'tp_mult': 2.0642853033657156, 'tsl_mult': 0.8592887522588305, 'strategy': 'mean_reversion', 'time_stop': 165, 'use_sma': True, 'use_atr': True, 'use_adx': False, 'use_ema': True, 'use_spike': True, 'rsi_required': False, 'edge_k': 1.5303795195987175, 'edge_cap': 0.16621842393435488, 'bull_strategy': 'mean_reversion', 'bull_bb_std_mult': 2.855803013129735, 'bull_rsi_os': 25, 'bull_rsi_ob': 65, 'bull_adx_thresh': 6.125690996111228, 'bull_atr_min_pct': 0.017200429109604027, 'bull_atr_max_pct': 0.0350945627544062, 'bull_tp_mult': 1.6773861791469862, 'bull_tsl_mult': 0.026119132789365222, 'bull_time_stop': 219, 'bull_use_sma': True, 'bull_use_ema': True, 'bull_use_atr': True, 'bull_use_adx': False, 'bull_use_spike': False, 'bull_rsi_required': True, 'bear_strategy': 'mean_reversion', 'bear_bb_std_mult': 1.6742191786659677, 'bear_rsi_os': 52, 'bear_rsi_ob': 56, 'bear_adx_thresh': 31.71107548130201, 'bear_atr_min_pct': 0.005752442566562396, 'bear_atr_max_pct': 0.042828792124135436, 'bear_tp_mult': 1.6205273811843326, 'bear_tsl_mult': 0.7825446110417754, 'bear_time_stop': 260, 'bear_use_sma': True, 'bear_use_ema': False, 'bear_use_atr': False, 'bear_use_adx': False, 'bear_use_spike': True, 'bear_rsi_required': False, 'sideways_strategy': 'mean_reversion', 'sideways_bb_std_mult': 1.1009189138880613, 'sideways_rsi_os': 19, 'sideways_rsi_ob': 61, 'sideways_adx_thresh': 22.14318960548119, 'sideways_atr_min_pct': 0.021976886225625252, 'sideways_atr_max_pct': 0.09269263969628704, 'sideways_tp_mult': 2.9565325881360547, 'sideways_tsl_mult': 0.7980533321276265, 'sideways_time_stop': 70, 'sideways_use_sma': True, 'sideways_use_ema': False, 'sideways_use_atr': True, 'sideways_use_adx': True, 'sideways_use_spike': False, 'sideways_rsi_required': True}.
[I 2025-09-01 15:01:52,213] Trial 426 finished with values: [-1000000000.0, 1000000000.0] and parameters: {'p_sma': 35, 'p_std': 30, 'p_atr': 12, 'p_adx': 14, 'rsi_period': 80, 'ema1': 15, 'ema2': 60, 'slip_atr_k': 0.0027828530247162343, 'slip_spread_k': 0.41346566959041425, 'spread_hl_frac': 0.00454622633761652, 'bb_std_mult': 2.322751443277119, 'rsi_os': 34, 'rsi_ob': 81, 'vol_spike': 0.0842600994341924, 'adx_thresh': 7.818653470269734, 'atr_min_pct': 0.01518946900687917, 'atr_max_pct': 0.06964431395374819, 'tp_mult': 1.2588567904490668, 'tsl_mult': 0.7775864139839828, 'strategy': 'breakout', 'time_stop': 13, 'use_sma': False, 'use_atr': True, 'use_adx': False, 'use_ema': True, 'use_spike': True, 'rsi_required': False, 'edge_k': 1.3662042648135406, 'edge_cap': 0.6556066781485621, 'bull_strategy': 'mean_reversion', 'bull_bb_std_mult': 0.8840424962632071, 'bull_rsi_os': 36, 'bull_rsi_ob': 68, 'bull_adx_thresh': 6.35537569223165, 'bull_atr_min_pct': 0.01686716313141989, 'bull_atr_max_pct': 0.04174805380701325, 'bull_tp_mult': 2.9581662763208247, 'bull_tsl_mult': 0.08114996062019708, 'bull_time_stop': 220, 'bull_use_sma': True, 'bull_use_ema': True, 'bull_use_atr': False, 'bull_use_adx': True, 'bull_use_spike': False, 'bull_rsi_required': True, 'bear_strategy': 'breakout', 'bear_bb_std_mult': 1.7001594263797017, 'bear_rsi_os': 52, 'bear_rsi_ob': 49, 'bear_adx_thresh': 26.224629387337036, 'bear_atr_min_pct': 0.005463835250271721, 'bear_atr_max_pct': 0.10554019641460505, 'bear_tp_mult': 1.3106005162301595, 'bear_tsl_mult': 0.7219866343167749, 'bear_time_stop': 258, 'bear_use_sma': True, 'bear_use_ema': False, 'bear_use_atr': False, 'bear_use_adx': True, 'bear_use_spike': True, 'bear_rsi_required': False, 'sideways_strategy': 'breakout', 'sideways_bb_std_mult': 0.9939676022021837, 'sideways_rsi_os': 43, 'sideways_rsi_ob': 47, 'sideways_adx_thresh': 10.761511286874748, 'sideways_atr_min_pct': 0.013489915610987443, 'sideways_atr_max_pct': 0.08465473319284089, 'sideways_tp_mult': 1.2831298374931217, 'sideways_tsl_mult': 0.7207428430799735, 'sideways_time_stop': 204, 'sideways_use_sma': False, 'sideways_use_ema': False, 'sideways_use_atr': True, 'sideways_use_adx': True, 'sideways_use_spike': False, 'sideways_rsi_required': True}.
[I 2025-09-01 15:02:32,368] Trial 430 finished with values: [-0.02901226371929566, 0.02909479974010123] and parameters: {'p_sma': 37, 'p_std': 29, 'p_atr': 24, 'p_adx': 13, 'rsi_period': 7, 'ema1': 25, 'ema2': 57, 'slip_atr_k': 0.0020297989521325405, 'slip_spread_k': 0.677365712245283, 'spread_hl_frac': 0.04829360348060471, 'bb_std_mult': 2.125248865112653, 'rsi_os': 49, 'rsi_ob': 76, 'vol_spike': 0.08389387451993811, 'adx_thresh': 28.357930036141383, 'atr_min_pct': 0.015299224369089075, 'atr_max_pct': 0.07071515388337953, 'tp_mult': 1.2639834396501612, 'tsl_mult': 0.38472381854865323, 'strategy': 'breakout', 'time_stop': 20, 'use_sma': False, 'use_atr': True, 'use_adx': False, 'use_ema': True, 'use_spike': False, 'rsi_required': True, 'edge_k': 1.377975571809545, 'edge_cap': 0.3697716284958729, 'bull_strategy': 'mean_reversion', 'bull_bb_std_mult': 0.8852696771936248, 'bull_rsi_os': 43, 'bull_rsi_ob': 89, 'bull_adx_thresh': 32.010135409475396, 'bull_atr_min_pct': 0.016474894389191228, 'bull_atr_max_pct': 0.03773866087677025, 'bull_tp_mult': 2.859064880762527, 'bull_tsl_mult': 0.08062792445976925, 'bull_time_stop': 131, 'bull_use_sma': False, 'bull_use_ema': True, 'bull_use_atr': False, 'bull_use_adx': True, 'bull_use_spike': True, 'bull_rsi_required': False, 'bear_strategy': 'breakout', 'bear_bb_std_mult': 1.364219194639012, 'bear_rsi_os': 46, 'bear_rsi_ob': 49, 'bear_adx_thresh': 34.261519820042906, 'bear_atr_min_pct': 0.003213063944168088, 'bear_atr_max_pct': 0.04640135704169582, 'bear_tp_mult': 2.6445166950750405, 'bear_tsl_mult': 0.7530671962790174, 'bear_time_stop': 252, 'bear_use_sma': True, 'bear_use_ema': False, 'bear_use_atr': False, 'bear_use_adx': True, 'bear_use_spike': True, 'bear_rsi_required': True, 'sideways_strategy': 'breakout', 'sideways_bb_std_mult': 3.0585346344993454, 'sideways_rsi_os': 24, 'sideways_rsi_ob': 77, 'sideways_adx_thresh': 30.693901146622792, 'sideways_atr_min_pct': 0.013567542847131001, 'sideways_atr_max_pct': 0.052686782061547886, 'sideways_tp_mult': 2.280130575909029, 'sideways_tsl_mult': 0.7223051951195586, 'sideways_time_stop': 235, 'sideways_use_sma': False, 'sideways_use_ema': False, 'sideways_use_atr': True, 'sideways_use_adx': True, 'sideways_use_spike': False, 'sideways_rsi_required': True}.
[I 2025-09-01 15:02:33,144] Trial 431 finished with values: [-1000000000.0, 1000000000.0] and parameters: {'p_sma': 54, 'p_std': 47, 'p_atr': 11, 'p_adx': 13, 'rsi_period': 28, 'ema1': 7, 'ema2': 57, 'slip_atr_k': 0.24973481640664022, 'slip_spread_k': 0.36062786146118886, 'spread_hl_frac': 0.008089868726940223, 'bb_std_mult': 2.1142029817899615, 'rsi_os': 28, 'rsi_ob': 91, 'vol_spike': 0.0559834844816826, 'adx_thresh': 23.213321535666005, 'atr_min_pct': 0.0027344381240255074, 'atr_max_pct': 0.09177239730534023, 'tp_mult': 1.9961270794861474, 'tsl_mult': 0.3419229853819247, 'strategy': 'breakout', 'time_stop': 257, 'use_sma': False, 'use_atr': True, 'use_adx': False, 'use_ema': True, 'use_spike': False, 'rsi_required': True, 'edge_k': 0.05676324174994585, 'edge_cap': 0.4072861007894651, 'bull_strategy': 'mean_reversion', 'bull_bb_std_mult': 0.98324668889128, 'bull_rsi_os': 45, 'bull_rsi_ob': 66, 'bull_adx_thresh': 21.757351655141736, 'bull_atr_min_pct': 0.015116529872408926, 'bull_atr_max_pct': 0.10969293459774412, 'bull_tp_mult': 2.613678017076303, 'bull_tsl_mult': 0.07060086256660716, 'bull_time_stop': 140, 'bull_use_sma': False, 'bull_use_ema': False, 'bull_use_atr': False, 'bull_use_adx': True, 'bull_use_spike': True, 'bull_rsi_required': False, 'bear_strategy': 'breakout', 'bear_bb_std_mult': 1.361681390457435, 'bear_rsi_os': 46, 'bear_rsi_ob': 52, 'bear_adx_thresh': 9.175282960012762, 'bear_atr_min_pct': 0.01867568928826607, 'bear_atr_max_pct': 0.08760589502918341, 'bear_tp_mult': 2.9149447884039708, 'bear_tsl_mult': 0.35020681161573936, 'bear_time_stop': 181, 'bear_use_sma': True, 'bear_use_ema': False, 'bear_use_atr': True, 'bear_use_adx': False, 'bear_use_spike': True, 'bear_rsi_required': True, 'sideways_strategy': 'mean_reversion', 'sideways_bb_std_mult': 0.8918263296383363, 'sideways_rsi_os': 24, 'sideways_rsi_ob': 77, 'sideways_adx_thresh': 13.594816538049347, 'sideways_atr_min_pct': 0.011850020236394658, 'sideways_atr_max_pct': 0.05280640531424875, 'sideways_tp_mult': 2.2872472737614764, 'sideways_tsl_mult': 0.7623338830918596, 'sideways_time_stop': 62, 'sideways_use_sma': True, 'sideways_use_ema': False, 'sideways_use_atr': True, 'sideways_use_adx': True, 'sideways_use_spike': False, 'sideways_rsi_required': True}.
[I 2025-09-01 15:02:33,769] Trial 428 finished with values: [-0.09336279377066947, 0.09276967940621174] and parameters: {'p_sma': 31, 'p_std': 47, 'p_atr': 12, 'p_adx': 14, 'rsi_period': 29, 'ema1': 25, 'ema2': 60, 'slip_atr_k': 0.1597105643588817, 'slip_spread_k': 0.41160953027836056, 'spread_hl_frac': 0.001952514196561124, 'bb_std_mult': 2.3157205283474114, 'rsi_os': 45, 'rsi_ob': 81, 'vol_spike': 0.08285391194085424, 'adx_thresh': 16.02835078246467, 'atr_min_pct': 0.0027358961459844535, 'atr_max_pct': 0.06938564719040384, 'tp_mult': 1.2693961850868278, 'tsl_mult': 0.8278790902987356, 'strategy': 'breakout', 'time_stop': 258, 'use_sma': False, 'use_atr': True, 'use_adx': False, 'use_ema': True, 'use_spike': True, 'rsi_required': True, 'edge_k': 1.4696781367946319, 'edge_cap': 0.9094325433802122, 'bull_strategy': 'mean_reversion', 'bull_bb_std_mult': 1.153726628433442, 'bull_rsi_os': 43, 'bull_rsi_ob': 68, 'bull_adx_thresh': 7.129959455489409, 'bull_atr_min_pct': 0.01627446666682255, 'bull_atr_max_pct': 0.11699238644233317, 'bull_tp_mult': 2.5368036619181775, 'bull_tsl_mult': 0.08000394895726785, 'bull_time_stop': 139, 'bull_use_sma': False, 'bull_use_ema': True, 'bull_use_atr': False, 'bull_use_adx': True, 'bull_use_spike': False, 'bull_rsi_required': True, 'bear_strategy': 'breakout', 'bear_bb_std_mult': 2.9240069742610553, 'bear_rsi_os': 52, 'bear_rsi_ob': 49, 'bear_adx_thresh': 9.127816335716899, 'bear_atr_min_pct': 0.0030032295039880688, 'bear_atr_max_pct': 0.10717500264586818, 'bear_tp_mult': 1.3674029547325097, 'bear_tsl_mult': 0.4633057814416613, 'bear_time_stop': 259, 'bear_use_sma': True, 'bear_use_ema': False, 'bear_use_atr': False, 'bear_use_adx': True, 'bear_use_spike': True, 'bear_rsi_required': True, 'sideways_strategy': 'mean_reversion', 'sideways_bb_std_mult': 2.8282508792454566, 'sideways_rsi_os': 24, 'sideways_rsi_ob': 77, 'sideways_adx_thresh': 31.521210963225933, 'sideways_atr_min_pct': 0.013535910418689559, 'sideways_atr_max_pct': 0.08504607025283256, 'sideways_tp_mult': 1.2841133727033278, 'sideways_tsl_mult': 0.7186960890049224, 'sideways_time_stop': 265, 'sideways_use_sma': True, 'sideways_use_ema': False, 'sideways_use_atr': True, 'sideways_use_adx': True, 'sideways_use_spike': False, 'sideways_rsi_required': True}.
[I 2025-09-01 15:02:33,996] Trial 429 finished with values: [-1000000000.0, 1000000000.0] and parameters: {'p_sma': 53, 'p_std': 29, 'p_atr': 12, 'p_adx': 13, 'rsi_period': 75, 'ema1': 25, 'ema2': 60, 'slip_atr_k': 0.11107507797519799, 'slip_spread_k': 0.3946162558687971, 'spread_hl_frac': 0.008170750711436735, 'bb_std_mult': 2.339085284544032, 'rsi_os': 29, 'rsi_ob': 91, 'vol_spike': 0.08383420994400607, 'adx_thresh': 23.25413513062133, 'atr_min_pct': 0.018693926588137455, 'atr_max_pct': 0.07068736702227643, 'tp_mult': 2.0053211106123214, 'tsl_mult': 0.3810727422327739, 'strategy': 'breakout', 'time_stop': 19, 'use_sma': False, 'use_atr': True, 'use_adx': False, 'use_ema': True, 'use_spike': True, 'rsi_required': True, 'edge_k': 1.3860925898017908, 'edge_cap': 0.855677245075909, 'bull_strategy': 'mean_reversion', 'bull_bb_std_mult': 0.9272128935989646, 'bull_rsi_os': 36, 'bull_rsi_ob': 69, 'bull_adx_thresh': 5.747427592450448, 'bull_atr_min_pct': 0.014948243709842712, 'bull_atr_max_pct': 0.04118657553520992, 'bull_tp_mult': 1.3447189724799204, 'bull_tsl_mult': 0.07889734754914735, 'bull_time_stop': 130, 'bull_use_sma': False, 'bull_use_ema': True, 'bull_use_atr': False, 'bull_use_adx': True, 'bull_use_spike': False, 'bull_rsi_required': True, 'bear_strategy': 'breakout', 'bear_bb_std_mult': 1.669636292487556, 'bear_rsi_os': 51, 'bear_rsi_ob': 49, 'bear_adx_thresh': 7.966855701311857, 'bear_atr_min_pct': 0.018543720295286226, 'bear_atr_max_pct': 0.043513712364710085, 'bear_tp_mult': 1.5008106963699734, 'bear_tsl_mult': 0.3514479967886289, 'bear_time_stop': 263, 'bear_use_sma': True, 'bear_use_ema': False, 'bear_use_atr': False, 'bear_use_adx': True, 'bear_use_spike': True, 'bear_rsi_required': True, 'sideways_strategy': 'breakout', 'sideways_bb_std_mult': 1.192660464056243, 'sideways_rsi_os': 22, 'sideways_rsi_ob': 77, 'sideways_adx_thresh': 24.389941423374005, 'sideways_atr_min_pct': 0.02763282294358998, 'sideways_atr_max_pct': 0.09368886019397607, 'sideways_tp_mult': 2.2745331921657232, 'sideways_tsl_mult': 0.7599224798140064, 'sideways_time_stop': 232, 'sideways_use_sma': False, 'sideways_use_ema': False, 'sideways_use_atr': True, 'sideways_use_adx': True, 'sideways_use_spike': False, 'sideways_rsi_required': True}.
