[I 2025-09-01 14:04:30,729] Trial 60 finished with values: [-0.0458393119643451, 0.04705056628594881] and parameters: {'p_sma': 32, 'p_std': 20, 'p_atr': 7, 'p_adx': 24, 'rsi_period': 16, 'ema1': 6, 'ema2': 34, 'slip_atr_k': 0.06699710024137231, 'slip_spread_k': 0.3943797644123077, 'spread_hl_frac': 0.049006556868358905, 'bb_std_mult': 2.3092327549958025, 'rsi_os': 40, 'rsi_ob': 87, 'vol_spike': 0.07146044787858515, 'adx_thresh': 15.314235860988283, 'atr_min_pct': 0.018573318458403345, 'atr_max_pct': 0.047545909039038645, 'tp_mult': 2.6618024595754335, 'tsl_mult': 0.4557185917890306, 'strategy': 'breakout', 'time_stop': 68, 'use_sma': False, 'use_atr': False, 'use_adx': False, 'use_ema': False, 'use_spike': False, 'rsi_required': True, 'edge_k': 1.084014174377167, 'edge_cap': 0.5825692771611304, 'bull_strategy': 'breakout', 'bull_bb_std_mult': 1.8708150790511422, 'bull_rsi_os': 26, 'bull_rsi_ob': 84, 'bull_adx_thresh': 15.02618461951543, 'bull_atr_min_pct': 0.00012544415639685353, 'bull_atr_max_pct': 0.05011912801765661, 'bull_tp_mult': 2.6967032775123068, 'bull_tsl_mult': 0.6282133436803987, 'bull_time_stop': 63, 'bull_use_sma': False, 'bull_use_ema': True, 'bull_use_atr': False, 'bull_use_adx': True, 'bull_use_spike': False, 'bull_rsi_required': True, 'bear_strategy': 'breakout', 'bear_bb_std_mult': 2.37118140228708, 'bear_rsi_os': 16, 'bear_rsi_ob': 47, 'bear_adx_thresh': 6.25279583925915, 'bear_atr_min_pct': 0.009885746564890413, 'bear_atr_max_pct': 0.0527522803286968, 'bear_tp_mult': 2.6426069646318946, 'bear_tsl_mult': 0.2950413234013045, 'bear_time_stop': 20, 'bear_use_sma': False, 'bear_use_ema': True, 'bear_use_atr': False, 'bear_use_adx': False, 'bear_use_spike': True, 'bear_rsi_required': True, 'sideways_strategy': 'breakout', 'sideways_bb_std_mult': 3.264884504289397, 'sideways_rsi_os': 16, 'sideways_rsi_ob': 60, 'sideways_adx_thresh': 31.46204930834878, 'sideways_atr_min_pct': 0.02160979466986955, 'sideways_atr_max_pct': 0.026380104497176718, 'sideways_tp_mult': 2.6110488774060627, 'sideways_tsl_mult': 0.9473442996804495, 'sideways_time_stop': 222, 'sideways_use_sma': False, 'sideways_use_ema': True, 'sideways_use_atr': False, 'sideways_use_adx': False, 'sideways_use_spike': True, 'sideways_rsi_required': False}.
[I 2025-09-01 14:04:31,044] Trial 65 finished with values: [-1000000000.0, 1000000000.0] and parameters: {'p_sma': 27, 'p_std': 20, 'p_atr': 14, 'p_adx': 22, 'rsi_period': 72, 'ema1': 18, 'ema2': 40, 'slip_atr_k': 0.0887372256542669, 'slip_spread_k': 0.35965499071678714, 'spread_hl_frac': 0.042468093007374946, 'bb_std_mult': 2.7474129292063716, 'rsi_os': 49, 'rsi_ob': 86, 'vol_spike': 0.008044993463119387, 'adx_thresh': 19.623507981210043, 'atr_min_pct': 0.01953100565545795, 'atr_max_pct': 0.018070351865682892, 'tp_mult': 2.355636464715788, 'tsl_mult': 0.6540564437085123, 'strategy': 'breakout', 'time_stop': 84, 'use_sma': False, 'use_atr': False, 'use_adx': False, 'use_ema': False, 'use_spike': False, 'rsi_required': True, 'edge_k': 1.2396689035249047, 'edge_cap': 0.5696710289716788, 'bull_strategy': 'breakout', 'bull_bb_std_mult': 1.8538532391891445, 'bull_rsi_os': 38, 'bull_rsi_ob': 55, 'bull_adx_thresh': 13.047500629134586, 'bull_atr_min_pct': 0.00510516770405748, 'bull_atr_max_pct': 0.054813221861341445, 'bull_tp_mult': 1.1285644898023044, 'bull_tsl_mult': 0.8158972491266142, 'bull_time_stop': 167, 'bull_use_sma': False, 'bull_use_ema': True, 'bull_use_atr': False, 'bull_use_adx': True, 'bull_use_spike': False, 'bull_rsi_required': True, 'bear_strategy': 'breakout', 'bear_bb_std_mult': 2.931975435643908, 'bear_rsi_os': 34, 'bear_rsi_ob': 45, 'bear_adx_thresh': 13.327066109714186, 'bear_atr_min_pct': 0.005685451447928351, 'bear_atr_max_pct': 0.01800307106328913, 'bear_tp_mult': 2.6476729207971452, 'bear_tsl_mult': 0.6309821164899189, 'bear_time_stop': 172, 'bear_use_sma': False, 'bear_use_ema': True, 'bear_use_atr': False, 'bear_use_adx': False, 'bear_use_spike': True, 'bear_rsi_required': True, 'sideways_strategy': 'breakout', 'sideways_bb_std_mult': 1.970615659534187, 'sideways_rsi_os': 31, 'sideways_rsi_ob': 79, 'sideways_adx_thresh': 31.287232217414434, 'sideways_atr_min_pct': 0.017222982806545925, 'sideways_atr_max_pct': 0.025838736743032782, 'sideways_tp_mult': 2.671018065929043, 'sideways_tsl_mult': 0.8790422029606616, 'sideways_time_stop': 220, 'sideways_use_sma': False, 'sideways_use_ema': True, 'sideways_use_atr': False, 'sideways_use_adx': True, 'sideways_use_spike': True, 'sideways_rsi_required': False}.
[I 2025-09-01 14:05:08,175] Trial 64 finished with values: [-1000000000.0, 1000000000.0] and parameters: {'p_sma': 25, 'p_std': 20, 'p_atr': 16, 'p_adx': 24, 'rsi_period': 76, 'ema1': 6, 'ema2': 35, 'slip_atr_k': 0.0517566542623205, 'slip_spread_k': 0.3515591756430826, 'spread_hl_frac': 0.04164605594149531, 'bb_std_mult': 2.5484481595138817, 'rsi_os': 21, 'rsi_ob': 87, 'vol_spike': 0.009422303523287823, 'adx_thresh': 27.364252815118416, 'atr_min_pct': 0.0186237317333183, 'atr_max_pct': 0.1346320231178661, 'tp_mult': 2.683764520580773, 'tsl_mult': 0.571409562261869, 'strategy': 'breakout', 'time_stop': 84, 'use_sma': False, 'use_atr': False, 'use_adx': False, 'use_ema': False, 'use_spike': False, 'rsi_required': True, 'edge_k': 1.0645753324272005, 'edge_cap': 0.4391834838103684, 'bull_strategy': 'breakout', 'bull_bb_std_mult': 1.8479652152623214, 'bull_rsi_os': 38, 'bull_rsi_ob': 55, 'bull_adx_thresh': 10.241863999965354, 'bull_atr_min_pct': 0.022152705251513364, 'bull_atr_max_pct': 0.045732470928640315, 'bull_tp_mult': 1.1017408826002049, 'bull_tsl_mult': 0.06112138721957705, 'bull_time_stop': 88, 'bull_use_sma': False, 'bull_use_ema': True, 'bull_use_atr': False, 'bull_use_adx': True, 'bull_use_spike': False, 'bull_rsi_required': True, 'bear_strategy': 'breakout', 'bear_bb_std_mult': 2.0689436077134795, 'bear_rsi_os': 15, 'bear_rsi_ob': 45, 'bear_adx_thresh': 7.073374940707515, 'bear_atr_min_pct': 0.005484111394952925, 'bear_atr_max_pct': 0.018171497762889132, 'bear_tp_mult': 2.64703927615549, 'bear_tsl_mult': 0.6170034115705645, 'bear_time_stop': 175, 'bear_use_sma': False, 'bear_use_ema': True, 'bear_use_atr': False, 'bear_use_adx': False, 'bear_use_spike': True, 'bear_rsi_required': True, 'sideways_strategy': 'breakout', 'sideways_bb_std_mult': 1.9703098718060665, 'sideways_rsi_os': 51, 'sideways_rsi_ob': 86, 'sideways_adx_thresh': 31.48571410962353, 'sideways_atr_min_pct': 0.021602858593533662, 'sideways_atr_max_pct': 0.04686141429659164, 'sideways_tp_mult': 2.6317531643067666, 'sideways_tsl_mult': 0.8740928859145496, 'sideways_time_stop': 222, 'sideways_use_sma': False, 'sideways_use_ema': True, 'sideways_use_atr': False, 'sideways_use_adx': True, 'sideways_use_spike': True, 'sideways_rsi_required': False}.
[I 2025-09-01 14:05:08,684] Trial 68 finished with values: [-1000000000.0, 1000000000.0] and parameters: {'p_sma': 20, 'p_std': 60, 'p_atr': 16, 'p_adx': 27, 'rsi_period': 59, 'ema1': 28, 'ema2': 39, 'slip_atr_k': 0.035394185736307614, 'slip_spread_k': 0.3504100157957854, 'spread_hl_frac': 0.007780689171151694, 'bb_std_mult': 2.515998487730996, 'rsi_os': 8, 'rsi_ob': 66, 'vol_spike': 0.16121487500919798, 'adx_thresh': 26.82880621532026, 'atr_min_pct': 0.0013619599030882507, 'atr_max_pct': 0.06202895295780703, 'tp_mult': 1.2429487724374908, 'tsl_mult': 0.5704109819220663, 'strategy': 'breakout', 'time_stop': 41, 'use_sma': False, 'use_atr': False, 'use_adx': False, 'use_ema': False, 'use_spike': True, 'rsi_required': True, 'edge_k': 0.5812070500040425, 'edge_cap': 0.9350744511777676, 'bull_strategy': 'breakout', 'bull_bb_std_mult': 2.1512253214206494, 'bull_rsi_os': 20, 'bull_rsi_ob': 92, 'bull_adx_thresh': 5.004188091460612, 'bull_atr_min_pct': 0.011541852434542694, 'bull_atr_max_pct': 0.03569851480202127, 'bull_tp_mult': 1.45635591909739, 'bull_tsl_mult': 0.31337654862240966, 'bull_time_stop': 31, 'bull_use_sma': True, 'bull_use_ema': True, 'bull_use_atr': False, 'bull_use_adx': True, 'bull_use_spike': False, 'bull_rsi_required': False, 'bear_strategy': 'breakout', 'bear_bb_std_mult': 1.4197446735661279, 'bear_rsi_os': 53, 'bear_rsi_ob': 91, 'bear_adx_thresh': 5.060093457876061, 'bear_atr_min_pct': 0.007123359845408221, 'bear_atr_max_pct': 0.0241212993941024, 'bear_tp_mult': 1.6371208038129956, 'bear_tsl_mult': 0.24387752078306274, 'bear_time_stop': 273, 'bear_use_sma': True, 'bear_use_ema': True, 'bear_use_atr': False, 'bear_use_adx': True, 'bear_use_spike': False, 'bear_rsi_required': True, 'sideways_strategy': 'mean_reversion', 'sideways_bb_std_mult': 1.4011242711206553, 'sideways_rsi_os': 48, 'sideways_rsi_ob': 74, 'sideways_adx_thresh': 29.6235889232408, 'sideways_atr_min_pct': 0.01903354206406529, 'sideways_atr_max_pct': 0.035289974232498626, 'sideways_tp_mult': 2.1725392056708492, 'sideways_tsl_mult': 0.91888533944668, 'sideways_time_stop': 191, 'sideways_use_sma': True, 'sideways_use_ema': True, 'sideways_use_atr': False, 'sideways_use_adx': True, 'sideways_use_spike': True, 'sideways_rsi_required': False}.
[I 2025-09-01 14:05:09,176] Trial 66 finished with values: [-1000000000.0, 1000000000.0] and parameters: {'p_sma': 27, 'p_std': 60, 'p_atr': 23, 'p_adx': 22, 'rsi_period': 72, 'ema1': 18, 'ema2': 40, 'slip_atr_k': 0.03818282764391653, 'slip_spread_k': 0.34697279561660854, 'spread_hl_frac': 0.04155855503757404, 'bb_std_mult': 2.4941806575754155, 'rsi_os': 53, 'rsi_ob': 86, 'vol_spike': 0.011784453376779278, 'adx_thresh': 17.084308932182623, 'atr_min_pct': 0.0012816976279227642, 'atr_max_pct': 0.017144841759274665, 'tp_mult': 2.3621894085143604, 'tsl_mult': 0.5660766736552324, 'strategy': 'breakout', 'time_stop': 85, 'use_sma': False, 'use_atr': False, 'use_adx': False, 'use_ema': False, 'use_spike': False, 'rsi_required': True, 'edge_k': 0.5286839633994483, 'edge_cap': 0.5907438594879303, 'bull_strategy': 'breakout', 'bull_bb_std_mult': 1.8439098513593235, 'bull_rsi_os': 18, 'bull_rsi_ob': 82, 'bull_adx_thresh': 12.802970173226173, 'bull_atr_min_pct': 0.011826140281224458, 'bull_atr_max_pct': 0.019429536049323137, 'bull_tp_mult': 1.0713362412036949, 'bull_tsl_mult': 0.6184011170727484, 'bull_time_stop': 31, 'bull_use_sma': False, 'bull_use_ema': True, 'bull_use_atr': False, 'bull_use_adx': True, 'bull_use_spike': False, 'bull_rsi_required': True, 'bear_strategy': 'breakout', 'bear_bb_std_mult': 2.9076034524355476, 'bear_rsi_os': 48, 'bear_rsi_ob': 45, 'bear_adx_thresh': 13.588918910639109, 'bear_atr_min_pct': 0.005470448967421878, 'bear_atr_max_pct': 0.01774746717975103, 'bear_tp_mult': 1.6761534500084938, 'bear_tsl_mult': 0.7036150630401921, 'bear_time_stop': 254, 'bear_use_sma': False, 'bear_use_ema': True, 'bear_use_atr': False, 'bear_use_adx': False, 'bear_use_spike': True, 'bear_rsi_required': True, 'sideways_strategy': 'mean_reversion', 'sideways_bb_std_mult': 1.391428014893965, 'sideways_rsi_os': 48, 'sideways_rsi_ob': 74, 'sideways_adx_thresh': 29.371400102405225, 'sideways_atr_min_pct': 0.017166819951139296, 'sideways_atr_max_pct': 0.02555008210361473, 'sideways_tp_mult': 2.642593230903195, 'sideways_tsl_mult': 0.8829656198127114, 'sideways_time_stop': 219, 'sideways_use_sma': True, 'sideways_use_ema': True, 'sideways_use_atr': False, 'sideways_use_adx': True, 'sideways_use_spike': True, 'sideways_rsi_required': False}.
[I 2025-09-01 14:05:09,408] Trial 67 finished with values: [-0.005504173232481646, 0.01344888306637828] and parameters: {'p_sma': 25, 'p_std': 11, 'p_atr': 14, 'p_adx': 22, 'rsi_period': 72, 'ema1': 28, 'ema2': 40, 'slip_atr_k': 0.036032710478690416, 'slip_spread_k': 0.46958174913112166, 'spread_hl_frac': 0.041383233079365464, 'bb_std_mult': 2.4899728050524192, 'rsi_os': 8, 'rsi_ob': 84, 'vol_spike': 0.011739983369918864, 'adx_thresh': 26.96061612012862, 'atr_min_pct': 0.007461249609255554, 'atr_max_pct': 0.06714634417144472, 'tp_mult': 2.3512703814080536, 'tsl_mult': 0.5806338450745789, 'strategy': 'breakout', 'time_stop': 89, 'use_sma': False, 'use_atr': False, 'use_adx': False, 'use_ema': False, 'use_spike': False, 'rsi_required': True, 'edge_k': 0.503805544518337, 'edge_cap': 0.9407608022238141, 'bull_strategy': 'breakout', 'bull_bb_std_mult': 1.4671959040536424, 'bull_rsi_os': 19, 'bull_rsi_ob': 55, 'bull_adx_thresh': 12.647097405124729, 'bull_atr_min_pct': 0.004871257949977444, 'bull_atr_max_pct': 0.03762125268563237, 'bull_tp_mult': 1.0915817231489222, 'bull_tsl_mult': 0.8935250829168221, 'bull_time_stop': 22, 'bull_use_sma': False, 'bull_use_ema': True, 'bull_use_atr': False, 'bull_use_adx': True, 'bull_use_spike': False, 'bull_rsi_required': True, 'bear_strategy': 'breakout', 'bear_bb_std_mult': 2.095262010882659, 'bear_rsi_os': 53, 'bear_rsi_ob': 45, 'bear_adx_thresh': 5.006717191646492, 'bear_atr_min_pct': 0.00585092695266691, 'bear_atr_max_pct': 0.018042568770148457, 'bear_tp_mult': 1.7189424249726089, 'bear_tsl_mult': 0.6298283252068984, 'bear_time_stop': 244, 'bear_use_sma': False, 'bear_use_ema': True, 'bear_use_atr': False, 'bear_use_adx': False, 'bear_use_spike': False, 'bear_rsi_required': True, 'sideways_strategy': 'mean_reversion', 'sideways_bb_std_mult': 1.3934490767367187, 'sideways_rsi_os': 32, 'sideways_rsi_ob': 78, 'sideways_adx_thresh': 34.032218823664834, 'sideways_atr_min_pct': 0.017256943796685936, 'sideways_atr_max_pct': 0.03587404896021934, 'sideways_tp_mult': 2.6501789419242887, 'sideways_tsl_mult': 0.8714219550843941, 'sideways_time_stop': 82, 'sideways_use_sma': True, 'sideways_use_ema': True, 'sideways_use_atr': False, 'sideways_use_adx': True, 'sideways_use_spike': True, 'sideways_rsi_required': False}.
[I 2025-09-01 14:05:09,767] Trial 70 finished with values: [-1000000000.0, 1000000000.0] and parameters: {'p_sma': 28, 'p_std': 11, 'p_atr': 27, 'p_adx': 22, 'rsi_period': 49, 'ema1': 11, 'ema2': 45, 'slip_atr_k': 0.036510676399617345, 'slip_spread_k': 0.48407447642830437, 'spread_hl_frac': 0.03982651597145934, 'bb_std_mult': 2.9904888542874772, 'rsi_os': 53, 'rsi_ob': 78, 'vol_spike': 0.13636491139554813, 'adx_thresh': 17.09288076894119, 'atr_min_pct': 0.005295850051829817, 'atr_max_pct': 0.12431335194039103, 'tp_mult': 2.4661134814303414, 'tsl_mult': 0.7264550329734563, 'strategy': 'mean_reversion', 'time_stop': 280, 'use_sma': True, 'use_atr': False, 'use_adx': True, 'use_ema': True, 'use_spike': False, 'rsi_required': True, 'edge_k': 1.6024078407627353, 'edge_cap': 0.5162045267567701, 'bull_strategy': 'breakout', 'bull_bb_std_mult': 1.241983131522159, 'bull_rsi_os': 53, 'bull_rsi_ob': 63, 'bull_adx_thresh': 31.68331047323835, 'bull_atr_min_pct': 0.027571238527180637, 'bull_atr_max_pct': 0.020531892520758654, 'bull_tp_mult': 2.868802002723042, 'bull_tsl_mult': 0.14512234874291058, 'bull_time_stop': 77, 'bull_use_sma': False, 'bull_use_ema': False, 'bull_use_atr': True, 'bull_use_adx': True, 'bull_use_spike': False, 'bull_rsi_required': True, 'bear_strategy': 'breakout', 'bear_bb_std_mult': 2.569094314366959, 'bear_rsi_os': 49, 'bear_rsi_ob': 48, 'bear_adx_thresh': 30.784535747240106, 'bear_atr_min_pct': 0.011627078403370053, 'bear_atr_max_pct': 0.04149051295598662, 'bear_tp_mult': 1.8030902180523432, 'bear_tsl_mult': 0.5353570080735873, 'bear_time_stop': 254, 'bear_use_sma': False, 'bear_use_ema': True, 'bear_use_atr': False, 'bear_use_adx': False, 'bear_use_spike': True, 'bear_rsi_required': True, 'sideways_strategy': 'mean_reversion', 'sideways_bb_std_mult': 2.98289512137689, 'sideways_rsi_os': 19, 'sideways_rsi_ob': 95, 'sideways_adx_thresh': 13.296265593567863, 'sideways_atr_min_pct': 0.017719401671411825, 'sideways_atr_max_pct': 0.07529435088099985, 'sideways_tp_mult': 1.164488740919114, 'sideways_tsl_mult': 0.6606917420722724, 'sideways_time_stop': 79, 'sideways_use_sma': True, 'sideways_use_ema': True, 'sideways_use_atr': False, 'sideways_use_adx': True, 'sideways_use_spike': True, 'sideways_rsi_required': False}.
[I 2025-09-01 14:05:45,934] Trial 71 finished with values: [-1000000000.0, 1000000000.0] and parameters: {'p_sma': 34, 'p_std': 10, 'p_atr': 27, 'p_adx': 17, 'rsi_period': 49, 'ema1': 11, 'ema2': 46, 'slip_atr_k': 0.10184941299714417, 'slip_spread_k': 0.48836351463975247, 'spread_hl_frac': 0.039945069561991856, 'bb_std_mult': 3.204260066177857, 'rsi_os': 45, 'rsi_ob': 83, 'vol_spike': 0.11801134342197879, 'adx_thresh': 24.11406289698033, 'atr_min_pct': 0.02335530426255935, 'atr_max_pct': 0.09080507676332955, 'tp_mult': 2.491818358983546, 'tsl_mult': 0.7437325580098665, 'strategy': 'mean_reversion', 'time_stop': 281, 'use_sma': True, 'use_atr': False, 'use_adx': True, 'use_ema': True, 'use_spike': False, 'rsi_required': True, 'edge_k': 0.7985010157992388, 'edge_cap': 0.24706796004087073, 'bull_strategy': 'mean_reversion', 'bull_bb_std_mult': 1.0526863898571868, 'bull_rsi_os': 45, 'bull_rsi_ob': 51, 'bull_adx_thresh': 31.76285252259928, 'bull_atr_min_pct': 0.004858359868712681, 'bull_atr_max_pct': 0.0391982449824633, 'bull_tp_mult': 2.88424219189979, 'bull_tsl_mult': 0.49038106295030764, 'bull_time_stop': 77, 'bull_use_sma': True, 'bull_use_ema': False, 'bull_use_atr': True, 'bull_use_adx': True, 'bull_use_spike': False, 'bull_rsi_required': False, 'bear_strategy': 'breakout', 'bear_bb_std_mult': 2.5722814986218796, 'bear_rsi_os': 32, 'bear_rsi_ob': 80, 'bear_adx_thresh': 31.282878462018786, 'bear_atr_min_pct': 0.018838741790188976, 'bear_atr_max_pct': 0.07622560656304644, 'bear_tp_mult': 1.8113453359953335, 'bear_tsl_mult': 0.07409714699681713, 'bear_time_stop': 242, 'bear_use_sma': True, 'bear_use_ema': False, 'bear_use_atr': True, 'bear_use_adx': False, 'bear_use_spike': False, 'bear_rsi_required': True, 'sideways_strategy': 'breakout', 'sideways_bb_std_mult': 2.475988131906221, 'sideways_rsi_os': 19, 'sideways_rsi_ob': 78, 'sideways_adx_thresh': 34.114999660707426, 'sideways_atr_min_pct': 0.017831148281763905, 'sideways_atr_max_pct': 0.0889275987596016, 'sideways_tp_mult': 1.0910322450892784, 'sideways_tsl_mult': 0.6572761034126612, 'sideways_time_stop': 82, 'sideways_use_sma': False, 'sideways_use_ema': False, 'sideways_use_atr': True, 'sideways_use_adx': True, 'sideways_use_spike': False, 'sideways_rsi_required': False}.
[I 2025-09-01 14:05:46,255] Trial 72 finished with values: [-1000000000.0, 1000000000.0] and parameters: {'p_sma': 25, 'p_std': 11, 'p_atr': 14, 'p_adx': 26, 'rsi_period': 47, 'ema1': 29, 'ema2': 51, 'slip_atr_k': 0.16716631785173697, 'slip_spread_k': 0.5615717518878327, 'spread_hl_frac': 0.026211074296869766, 'bb_std_mult': 2.058185753998961, 'rsi_os': 10, 'rsi_ob': 84, 'vol_spike': 0.12575911808209403, 'adx_thresh': 31.464958415438506, 'atr_min_pct': 0.012659346315739386, 'atr_max_pct': 0.03835791658331589, 'tp_mult': 2.2692949688367032, 'tsl_mult': 0.7378508326344936, 'strategy': 'mean_reversion', 'time_stop': 97, 'use_sma': True, 'use_atr': True, 'use_adx': True, 'use_ema': True, 'use_spike': True, 'rsi_required': False, 'edge_k': 0.38465190810818156, 'edge_cap': 0.9356846079893312, 'bull_strategy': 'mean_reversion', 'bull_bb_std_mult': 1.2552399636350815, 'bull_rsi_os': 12, 'bull_rsi_ob': 51, 'bull_adx_thresh': 21.010356358900907, 'bull_atr_min_pct': 0.027363477004407756, 'bull_atr_max_pct': 0.030211443273517692, 'bull_tp_mult': 1.2284382222155428, 'bull_tsl_mult': 0.9220246127782303, 'bull_time_stop': 16, 'bull_use_sma': True, 'bull_use_ema': False, 'bull_use_atr': True, 'bull_use_adx': True, 'bull_use_spike': False, 'bull_rsi_required': False, 'bear_strategy': 'mean_reversion', 'bear_bb_std_mult': 1.7024461371000297, 'bear_rsi_os': 54, 'bear_rsi_ob': 83, 'bear_adx_thresh': 31.931528307043664, 'bear_atr_min_pct': 0.015547532606967337, 'bear_atr_max_pct': 0.025454613286622824, 'bear_tp_mult': 1.7847159381743565, 'bear_tsl_mult': 0.6931339923870736, 'bear_time_stop': 215, 'bear_use_sma': True, 'bear_use_ema': False, 'bear_use_atr': True, 'bear_use_adx': True, 'bear_use_spike': False, 'bear_rsi_required': False, 'sideways_strategy': 'mean_reversion', 'sideways_bb_std_mult': 2.4730033623296475, 'sideways_rsi_os': 43, 'sideways_rsi_ob': 71, 'sideways_adx_thresh': 34.25435927437602, 'sideways_atr_min_pct': 0.0137571218477278, 'sideways_atr_max_pct': 0.03788495930790841, 'sideways_tp_mult': 2.872942185208084, 'sideways_tsl_mult': 0.6444131697648281, 'sideways_time_stop': 80, 'sideways_use_sma': True, 'sideways_use_ema': False, 'sideways_use_atr': True, 'sideways_use_adx': True, 'sideways_use_spike': False, 'sideways_rsi_required': True}.
