[I 2025-09-01 14:34:43,677] Trial 253 finished with values: [-1000000000.0, 1000000000.0] and parameters: {'p_sma': 36, 'p_std': 8, 'p_atr': 15, 'p_adx': 27, 'rsi_period': 68, 'ema1': 29, 'ema2': 40, 'slip_atr_k': 0.24242844951770262, 'slip_spread_k': 0.42093864267537373, 'spread_hl_frac': 0.012396219542820885, 'bb_std_mult': 1.6419269995887764, 'rsi_os': 19, 'rsi_ob': 57, 'vol_spike': 0.13469640764560178, 'adx_thresh': 27.176607621271835, 'atr_min_pct': 0.02033162025065366, 'atr_max_pct': 0.05368911695810195, 'tp_mult': 2.3200643482903485, 'tsl_mult': 0.6847297080624372, 'strategy': 'breakout', 'time_stop': 79, 'use_sma': True, 'use_atr': False, 'use_adx': True, 'use_ema': False, 'use_spike': False, 'rsi_required': True, 'edge_k': 0.7248340532744544, 'edge_cap': 0.7365405006450116, 'bull_strategy': 'breakout', 'bull_bb_std_mult': 1.3735601512034665, 'bull_rsi_os': 21, 'bull_rsi_ob': 61, 'bull_adx_thresh': 12.449210107438098, 'bull_atr_min_pct': 0.00708446280498173, 'bull_atr_max_pct': 0.1082133145660587, 'bull_tp_mult': 1.1538057595964295, 'bull_tsl_mult': 0.8969308629544774, 'bull_time_stop': 25, 'bull_use_sma': False, 'bull_use_ema': False, 'bull_use_atr': False, 'bull_use_adx': True, 'bull_use_spike': False, 'bull_rsi_required': True, 'bear_strategy': 'mean_reversion', 'bear_bb_std_mult': 2.0626658975019323, 'bear_rsi_os': 53, 'bear_rsi_ob': 77, 'bear_adx_thresh': 19.48733174059065, 'bear_atr_min_pct': 0.00541292417231499, 'bear_atr_max_pct': 0.08546983864935791, 'bear_tp_mult': 1.7868398217851411, 'bear_tsl_mult': 0.8998021296180765, 'bear_time_stop': 84, 'bear_use_sma': False, 'bear_use_ema': False, 'bear_use_atr': True, 'bear_use_adx': True, 'bear_use_spike': False, 'bear_rsi_required': True, 'sideways_strategy': 'mean_reversion', 'sideways_bb_std_mult': 1.140992768181708, 'sideways_rsi_os': 12, 'sideways_rsi_ob': 78, 'sideways_adx_thresh': 34.40675852109738, 'sideways_atr_min_pct': 0.01781318964988659, 'sideways_atr_max_pct': 0.14747974966411836, 'sideways_tp_mult': 2.561957091593954, 'sideways_tsl_mult': 0.8686699573362299, 'sideways_time_stop': 180, 'sideways_use_sma': True, 'sideways_use_ema': True, 'sideways_use_atr': False, 'sideways_use_adx': False, 'sideways_use_spike': True, 'sideways_rsi_required': False}.
[I 2025-09-01 14:34:44,271] Trial 254 finished with values: [-1000000000.0, 1000000000.0] and parameters: {'p_sma': 19, 'p_std': 8, 'p_atr': 15, 'p_adx': 27, 'rsi_period': 72, 'ema1': 29, 'ema2': 34, 'slip_atr_k': 0.24078744868344482, 'slip_spread_k': 0.41415494669813124, 'spread_hl_frac': 0.012349330272135424, 'bb_std_mult': 2.3684079580488757, 'rsi_os': 19, 'rsi_ob': 63, 'vol_spike': 0.17049291145403642, 'adx_thresh': 27.216634966128325, 'atr_min_pct': 0.008946889260036159, 'atr_max_pct': 0.073474128731783, 'tp_mult': 2.3266353190447133, 'tsl_mult': 0.5617556322943679, 'strategy': 'breakout', 'time_stop': 52, 'use_sma': True, 'use_atr': False, 'use_adx': True, 'use_ema': False, 'use_spike': False, 'rsi_required': True, 'edge_k': 0.7040897310189322, 'edge_cap': 0.9678971840630112, 'bull_strategy': 'breakout', 'bull_bb_std_mult': 1.365566803659754, 'bull_rsi_os': 54, 'bull_rsi_ob': 55, 'bull_adx_thresh': 33.536335170482815, 'bull_atr_min_pct': 0.0079870788538133, 'bull_atr_max_pct': 0.13598717230818785, 'bull_tp_mult': 2.1402225651033744, 'bull_tsl_mult': 0.8997678337583235, 'bull_time_stop': 26, 'bull_use_sma': False, 'bull_use_ema': False, 'bull_use_atr': False, 'bull_use_adx': True, 'bull_use_spike': False, 'bull_rsi_required': True, 'bear_strategy': 'breakout', 'bear_bb_std_mult': 2.050279220471848, 'bear_rsi_os': 53, 'bear_rsi_ob': 71, 'bear_adx_thresh': 21.165500244269605, 'bear_atr_min_pct': 0.005138582839986643, 'bear_atr_max_pct': 0.08591832472002858, 'bear_tp_mult': 1.7882208467521874, 'bear_tsl_mult': 0.8882651716859378, 'bear_time_stop': 255, 'bear_use_sma': False, 'bear_use_ema': False, 'bear_use_atr': True, 'bear_use_adx': False, 'bear_use_spike': False, 'bear_rsi_required': True, 'sideways_strategy': 'mean_reversion', 'sideways_bb_std_mult': 1.4015191156935658, 'sideways_rsi_os': 33, 'sideways_rsi_ob': 78, 'sideways_adx_thresh': 16.737274732099372, 'sideways_atr_min_pct': 0.01309993617790536, 'sideways_atr_max_pct': 0.1472665570359805, 'sideways_tp_mult': 2.558347906958157, 'sideways_tsl_mult': 0.8601452113566318, 'sideways_time_stop': 94, 'sideways_use_sma': True, 'sideways_use_ema': True, 'sideways_use_atr': False, 'sideways_use_adx': True, 'sideways_use_spike': True, 'sideways_rsi_required': False}.
[I 2025-09-01 14:34:44,773] Trial 252 finished with values: [-1000000000.0, 1000000000.0] and parameters: {'p_sma': 19, 'p_std': 23, 'p_atr': 15, 'p_adx': 27, 'rsi_period': 74, 'ema1': 29, 'ema2': 41, 'slip_atr_k': 0.02109262396405092, 'slip_spread_k': 0.5788506628383585, 'spread_hl_frac': 0.012161675941151338, 'bb_std_mult': 2.4720920773344828, 'rsi_os': 7, 'rsi_ob': 54, 'vol_spike': 0.24432767930663418, 'adx_thresh': 27.451505469419452, 'atr_min_pct': 0.0030326797806953104, 'atr_max_pct': 0.06625426301407068, 'tp_mult': 2.3144064483390583, 'tsl_mult': 0.6251237833562427, 'strategy': 'breakout', 'time_stop': 158, 'use_sma': True, 'use_atr': False, 'use_adx': False, 'use_ema': False, 'use_spike': False, 'rsi_required': True, 'edge_k': 0.5190538213452605, 'edge_cap': 0.9380007223662566, 'bull_strategy': 'breakout', 'bull_bb_std_mult': 1.525957677996909, 'bull_rsi_os': 21, 'bull_rsi_ob': 62, 'bull_adx_thresh': 10.636378685678414, 'bull_atr_min_pct': 0.005273694628391619, 'bull_atr_max_pct': 0.06429506434845858, 'bull_tp_mult': 1.1504370055069941, 'bull_tsl_mult': 0.5658971125188993, 'bull_time_stop': 24, 'bull_use_sma': False, 'bull_use_ema': False, 'bull_use_atr': False, 'bull_use_adx': True, 'bull_use_spike': False, 'bull_rsi_required': True, 'bear_strategy': 'breakout', 'bear_bb_std_mult': 2.05421886059073, 'bear_rsi_os': 53, 'bear_rsi_ob': 45, 'bear_adx_thresh': 5.004113819922773, 'bear_atr_min_pct': 0.01479261063989114, 'bear_atr_max_pct': 0.0688122196496067, 'bear_tp_mult': 1.72488183180354, 'bear_tsl_mult': 0.15312790778415225, 'bear_time_stop': 238, 'bear_use_sma': False, 'bear_use_ema': False, 'bear_use_atr': True, 'bear_use_adx': True, 'bear_use_spike': False, 'bear_rsi_required': True, 'sideways_strategy': 'mean_reversion', 'sideways_bb_std_mult': 1.1960122587586428, 'sideways_rsi_os': 33, 'sideways_rsi_ob': 62, 'sideways_adx_thresh': 28.381603267780477, 'sideways_atr_min_pct': 0.017577116060376537, 'sideways_atr_max_pct': 0.08650005083446208, 'sideways_tp_mult': 1.9968237781510387, 'sideways_tsl_mult': 0.8599544737026394, 'sideways_time_stop': 93, 'sideways_use_sma': True, 'sideways_use_ema': True, 'sideways_use_atr': False, 'sideways_use_adx': True, 'sideways_use_spike': True, 'sideways_rsi_required': False}.
[I 2025-09-01 14:35:29,172] Trial 255 finished with values: [-1000000000.0, 1000000000.0] and parameters: {'p_sma': 41, 'p_std': 8, 'p_atr': 15, 'p_adx': 21, 'rsi_period': 20, 'ema1': 25, 'ema2': 33, 'slip_atr_k': 0.07754809403820437, 'slip_spread_k': 0.5783577137772858, 'spread_hl_frac': 0.03256399349118491, 'bb_std_mult': 1.5169451046868754, 'rsi_os': 12, 'rsi_ob': 83, 'vol_spike': 0.2795292240389251, 'adx_thresh': 27.154905191298376, 'atr_min_pct': 0.029966600293257664, 'atr_max_pct': 0.07838970443562979, 'tp_mult': 2.3342105932126316, 'tsl_mult': 0.6979811175808404, 'strategy': 'breakout', 'time_stop': 160, 'use_sma': True, 'use_atr': False, 'use_adx': True, 'use_ema': False, 'use_spike': False, 'rsi_required': True, 'edge_k': 1.165487225978212, 'edge_cap': 0.746143124682765, 'bull_strategy': 'breakout', 'bull_bb_std_mult': 1.3741919898952317, 'bull_rsi_os': 21, 'bull_rsi_ob': 62, 'bull_adx_thresh': 7.510530049009747, 'bull_atr_min_pct': 0.006932523060423237, 'bull_atr_max_pct': 0.01834660637767324, 'bull_tp_mult': 1.157440481582532, 'bull_tsl_mult': 0.8922576219506204, 'bull_time_stop': 28, 'bull_use_sma': False, 'bull_use_ema': False, 'bull_use_atr': False, 'bull_use_adx': True, 'bull_use_spike': False, 'bull_rsi_required': False, 'bear_strategy': 'breakout', 'bear_bb_std_mult': 3.092173332517957, 'bear_rsi_os': 53, 'bear_rsi_ob': 48, 'bear_adx_thresh': 19.32765673027309, 'bear_atr_min_pct': 0.0057924642715357225, 'bear_atr_max_pct': 0.11015132910029418, 'bear_tp_mult': 2.943194189178369, 'bear_tsl_mult': 0.4980676971779224, 'bear_time_stop': 82, 'bear_use_sma': False, 'bear_use_ema': False, 'bear_use_atr': True, 'bear_use_adx': True, 'bear_use_spike': False, 'bear_rsi_required': True, 'sideways_strategy': 'mean_reversion', 'sideways_bb_std_mult': 1.15417604795753, 'sideways_rsi_os': 33, 'sideways_rsi_ob': 78, 'sideways_adx_thresh': 32.96644786179644, 'sideways_atr_min_pct': 0.017577299905857005, 'sideways_atr_max_pct': 0.14726053744982065, 'sideways_tp_mult': 2.119620336240567, 'sideways_tsl_mult': 0.8620101817701233, 'sideways_time_stop': 180, 'sideways_use_sma': True, 'sideways_use_ema': True, 'sideways_use_atr': False, 'sideways_use_adx': True, 'sideways_use_spike': True, 'sideways_rsi_required': False}.
[I 2025-09-01 14:35:30,051] Trial 256 finished with values: [-1000000000.0, 1000000000.0] and parameters: {'p_sma': 22, 'p_std': 9, 'p_atr': 15, 'p_adx': 21, 'rsi_period': 18, 'ema1': 29, 'ema2': 11, 'slip_atr_k': 0.01913235190465796, 'slip_spread_k': 0.926286496552999, 'spread_hl_frac': 0.021135531945261854, 'bb_std_mult': 2.645870044140602, 'rsi_os': 8, 'rsi_ob': 83, 'vol_spike': 0.2789546674005867, 'adx_thresh': 27.163628869376875, 'atr_min_pct': 0.007337205728818116, 'atr_max_pct': 0.0701621611109631, 'tp_mult': 2.407784215597928, 'tsl_mult': 0.553860047968388, 'strategy': 'mean_reversion', 'time_stop': 167, 'use_sma': True, 'use_atr': False, 'use_adx': True, 'use_ema': False, 'use_spike': False, 'rsi_required': True, 'edge_k': 1.2378476406531798, 'edge_cap': 0.947035710969345, 'bull_strategy': 'breakout', 'bull_bb_std_mult': 1.5256843402996638, 'bull_rsi_os': 5, 'bull_rsi_ob': 82, 'bull_adx_thresh': 7.887243032448268, 'bull_atr_min_pct': 0.028445806165992328, 'bull_atr_max_pct': 0.06955277709948048, 'bull_tp_mult': 2.14467815086276, 'bull_tsl_mult': 0.570919782985836, 'bull_time_stop': 28, 'bull_use_sma': False, 'bull_use_ema': False, 'bull_use_atr': True, 'bull_use_adx': True, 'bull_use_spike': False, 'bull_rsi_required': False, 'bear_strategy': 'breakout', 'bear_bb_std_mult': 1.31245698720968, 'bear_rsi_os': 52, 'bear_rsi_ob': 87, 'bear_adx_thresh': 34.83478350361355, 'bear_atr_min_pct': 0.006139144051770773, 'bear_atr_max_pct': 0.08961612363988843, 'bear_tp_mult': 1.6169446194253378, 'bear_tsl_mult': 0.6252431035710196, 'bear_time_stop': 36, 'bear_use_sma': False, 'bear_use_ema': False, 'bear_use_atr': True, 'bear_use_adx': False, 'bear_use_spike': False, 'bear_rsi_required': True, 'sideways_strategy': 'mean_reversion', 'sideways_bb_std_mult': 3.2060590560505906, 'sideways_rsi_os': 33, 'sideways_rsi_ob': 75, 'sideways_adx_thresh': 16.714676050137836, 'sideways_atr_min_pct': 0.026733216492110565, 'sideways_atr_max_pct': 0.03409732245438151, 'sideways_tp_mult': 2.5178987723841395, 'sideways_tsl_mult': 0.8581996415221195, 'sideways_time_stop': 91, 'sideways_use_sma': True, 'sideways_use_ema': True, 'sideways_use_atr': False, 'sideways_use_adx': True, 'sideways_use_spike': True, 'sideways_rsi_required': False}.
[I 2025-09-01 14:35:30,696] Trial 258 finished with values: [-1000000000.0, 1000000000.0] and parameters: {'p_sma': 40, 'p_std': 27, 'p_atr': 14, 'p_adx': 21, 'rsi_period': 20, 'ema1': 25, 'ema2': 28, 'slip_atr_k': 0.22495204558509568, 'slip_spread_k': 0.44025620899076334, 'spread_hl_frac': 0.02111334245730201, 'bb_std_mult': 2.672518003178242, 'rsi_os': 8, 'rsi_ob': 82, 'vol_spike': 0.0002012471160444864, 'adx_thresh': 26.945254674851704, 'atr_min_pct': 0.007405932439065813, 'atr_max_pct': 0.10343039215206376, 'tp_mult': 2.3904346646034704, 'tsl_mult': 0.5957451771860914, 'strategy': 'mean_reversion', 'time_stop': 197, 'use_sma': False, 'use_atr': True, 'use_adx': False, 'use_ema': True, 'use_spike': False, 'rsi_required': True, 'edge_k': 1.2417529074531963, 'edge_cap': 0.9950797957413732, 'bull_strategy': 'mean_reversion', 'bull_bb_std_mult': 2.1692072661958903, 'bull_rsi_os': 5, 'bull_rsi_ob': 57, 'bull_adx_thresh': 7.3548185038935125, 'bull_atr_min_pct': 3.8274524348258857e-05, 'bull_atr_max_pct': 0.06980378077863843, 'bull_tp_mult': 1.0386035925650443, 'bull_tsl_mult': 0.635891556324298, 'bull_time_stop': 105, 'bull_use_sma': True, 'bull_use_ema': True, 'bull_use_atr': True, 'bull_use_adx': True, 'bull_use_spike': False, 'bull_rsi_required': False, 'bear_strategy': 'breakout', 'bear_bb_std_mult': 1.315204330570217, 'bear_rsi_os': 52, 'bear_rsi_ob': 48, 'bear_adx_thresh': 31.340059185795372, 'bear_atr_min_pct': 0.006127675433608231, 'bear_atr_max_pct': 0.01972295641805532, 'bear_tp_mult': 2.154232074628576, 'bear_tsl_mult': 0.5014905627926746, 'bear_time_stop': 30, 'bear_use_sma': True, 'bear_use_ema': True, 'bear_use_atr': False, 'bear_use_adx': False, 'bear_use_spike': True, 'bear_rsi_required': True, 'sideways_strategy': 'mean_reversion', 'sideways_bb_std_mult': 3.300428008064391, 'sideways_rsi_os': 30, 'sideways_rsi_ob': 81, 'sideways_adx_thresh': 33.17451459588342, 'sideways_atr_min_pct': 0.027082850792749767, 'sideways_atr_max_pct': 0.0329524180927958, 'sideways_tp_mult': 2.130189518070095, 'sideways_tsl_mult': 0.8940254195785653, 'sideways_time_stop': 82, 'sideways_use_sma': True, 'sideways_use_ema': True, 'sideways_use_atr': False, 'sideways_use_adx': True, 'sideways_use_spike': False, 'sideways_rsi_required': False}.
[I 2025-09-01 14:35:31,254] Trial 257 finished with values: [-1000000000.0, 1000000000.0] and parameters: {'p_sma': 44, 'p_std': 55, 'p_atr': 13, 'p_adx': 18, 'rsi_period': 70, 'ema1': 25, 'ema2': 39, 'slip_atr_k': 0.019033423580814147, 'slip_spread_k': 0.4369389691355332, 'spread_hl_frac': 0.022898018169929268, 'bb_std_mult': 1.5046197638402068, 'rsi_os': 21, 'rsi_ob': 83, 'vol_spike': 0.24421788429702967, 'adx_thresh': 26.722852602420648, 'atr_min_pct': 0.029806640535036406, 'atr_max_pct': 0.13228664000325968, 'tp_mult': 2.4123495530856225, 'tsl_mult': 0.9818247762925633, 'strategy': 'mean_reversion', 'time_stop': 128, 'use_sma': True, 'use_atr': True, 'use_adx': False, 'use_ema': False, 'use_spike': False, 'rsi_required': True, 'edge_k': 1.1519442243869447, 'edge_cap': 0.6850189526266699, 'bull_strategy': 'breakout', 'bull_bb_std_mult': 1.5262337028956743, 'bull_rsi_os': 21, 'bull_rsi_ob': 58, 'bull_adx_thresh': 6.9043318092560115, 'bull_atr_min_pct': 0.004704078669167218, 'bull_atr_max_pct': 0.018654498386932943, 'bull_tp_mult': 1.1228738562100122, 'bull_tsl_mult': 0.9687900228142539, 'bull_time_stop': 179, 'bull_use_sma': True, 'bull_use_ema': False, 'bull_use_atr': True, 'bull_use_adx': True, 'bull_use_spike': False, 'bull_rsi_required': False, 'bear_strategy': 'breakout', 'bear_bb_std_mult': 1.5509700727501625, 'bear_rsi_os': 52, 'bear_rsi_ob': 54, 'bear_adx_thresh': 13.98484120080408, 'bear_atr_min_pct': 0.01475663622591046, 'bear_atr_max_pct': 0.019096782622190632, 'bear_tp_mult': 2.1686881745527895, 'bear_tsl_mult': 0.6194439917723144, 'bear_time_stop': 33, 'bear_use_sma': True, 'bear_use_ema': True, 'bear_use_atr': False, 'bear_use_adx': False, 'bear_use_spike': False, 'bear_rsi_required': True, 'sideways_strategy': 'mean_reversion', 'sideways_bb_std_mult': 3.2122346781429894, 'sideways_rsi_os': 30, 'sideways_rsi_ob': 60, 'sideways_adx_thresh': 28.58694015560409, 'sideways_atr_min_pct': 0.010505887700480401, 'sideways_atr_max_pct': 0.034267780670989116, 'sideways_tp_mult': 2.7130714449514857, 'sideways_tsl_mult': 0.8825346230368969, 'sideways_time_stop': 292, 'sideways_use_sma': True, 'sideways_use_ema': True, 'sideways_use_atr': False, 'sideways_use_adx': True, 'sideways_use_spike': True, 'sideways_rsi_required': False}.
[I 2025-09-01 14:36:12,225] Trial 260 finished with values: [-1000000000.0, 1000000000.0] and parameters: {'p_sma': 26, 'p_std': 11, 'p_atr': 30, 'p_adx': 23, 'rsi_period': 59, 'ema1': 18, 'ema2': 39, 'slip_atr_k': 0.033529493463109475, 'slip_spread_k': 0.44050619214148906, 'spread_hl_frac': 0.04021607790834144, 'bb_std_mult': 2.870459201876314, 'rsi_os': 48, 'rsi_ob': 89, 'vol_spike': 0.005224135034427931, 'adx_thresh': 26.7883852186017, 'atr_min_pct': 0.0019993297622883325, 'atr_max_pct': 0.10300365471165727, 'tp_mult': 1.3668714670221465, 'tsl_mult': 0.5968719932742952, 'strategy': 'mean_reversion', 'time_stop': 131, 'use_sma': False, 'use_atr': True, 'use_adx': False, 'use_ema': True, 'use_spike': False, 'rsi_required': True, 'edge_k': 0.44876445357923966, 'edge_cap': 0.13485213080703795, 'bull_strategy': 'mean_reversion', 'bull_bb_std_mult': 3.2706944212690527, 'bull_rsi_os': 31, 'bull_rsi_ob': 57, 'bull_adx_thresh': 6.3708611016359775, 'bull_atr_min_pct': 0.016135022078096483, 'bull_atr_max_pct': 0.03651527448167844, 'bull_tp_mult': 1.5770889982493737, 'bull_tsl_mult': 0.6344631901100777, 'bull_time_stop': 34, 'bull_use_sma': True, 'bull_use_ema': True, 'bull_use_atr': True, 'bull_use_adx': False, 'bull_use_spike': False, 'bull_rsi_required': True, 'bear_strategy': 'mean_reversion', 'bear_bb_std_mult': 0.9181675278233519, 'bear_rsi_os': 46, 'bear_rsi_ob': 47, 'bear_adx_thresh': 30.835163108751445, 'bear_atr_min_pct': 0.004132985271667413, 'bear_atr_max_pct': 0.06287386729239877, 'bear_tp_mult': 1.6670276688481802, 'bear_tsl_mult': 0.6487085590691141, 'bear_time_stop': 30, 'bear_use_sma': True, 'bear_use_ema': True, 'bear_use_atr': False, 'bear_use_adx': False, 'bear_use_spike': True, 'bear_rsi_required': True, 'sideways_strategy': 'mean_reversion', 'sideways_bb_std_mult': 1.4551773701900694, 'sideways_rsi_os': 31, 'sideways_rsi_ob': 80, 'sideways_adx_thresh': 29.18604311565803, 'sideways_atr_min_pct': 0.00969043369868275, 'sideways_atr_max_pct': 0.0421998527258929, 'sideways_tp_mult': 2.7213687363013856, 'sideways_tsl_mult': 0.8931429622833176, 'sideways_time_stop': 81, 'sideways_use_sma': True, 'sideways_use_ema': False, 'sideways_use_atr': True, 'sideways_use_adx': False, 'sideways_use_spike': False, 'sideways_rsi_required': False}.
[I 2025-09-01 14:36:12,474] Trial 262 finished with values: [-1000000000.0, 1000000000.0] and parameters: {'p_sma': 26, 'p_std': 35, 'p_atr': 30, 'p_adx': 11, 'rsi_period': 76, 'ema1': 19, 'ema2': 13, 'slip_atr_k': 0.03516406612376144, 'slip_spread_k': 0.486033093242241, 'spread_hl_frac': 0.04021770313712349, 'bb_std_mult': 2.876929915174551, 'rsi_os': 48, 'rsi_ob': 68, 'vol_spike': 0.007104923564368809, 'adx_thresh': 16.94961969473048, 'atr_min_pct': 0.026654789611314463, 'atr_max_pct': 0.14743472069957902, 'tp_mult': 2.2048652730535045, 'tsl_mult': 0.5205505773425393, 'strategy': 'breakout', 'time_stop': 88, 'use_sma': False, 'use_atr': False, 'use_adx': False, 'use_ema': True, 'use_spike': True, 'rsi_required': True, 'edge_k': 0.3355055931610208, 'edge_cap': 0.13916575062676112, 'bull_strategy': 'mean_reversion', 'bull_bb_std_mult': 0.7895832356381547, 'bull_rsi_os': 23, 'bull_rsi_ob': 55, 'bull_adx_thresh': 20.033772478162703, 'bull_atr_min_pct': 0.002872483839720011, 'bull_atr_max_pct': 0.03577044997630946, 'bull_tp_mult': 1.5649675126977458, 'bull_tsl_mult': 0.2240834491003147, 'bull_time_stop': 41, 'bull_use_sma': False, 'bull_use_ema': True, 'bull_use_atr': False, 'bull_use_adx': False, 'bull_use_spike': False, 'bull_rsi_required': True, 'bear_strategy': 'mean_reversion', 'bear_bb_std_mult': 2.1805457611965324, 'bear_rsi_os': 32, 'bear_rsi_ob': 47, 'bear_adx_thresh': 6.295013325419553, 'bear_atr_min_pct': 0.0040728436697562344, 'bear_atr_max_pct': 0.06357581364513995, 'bear_tp_mult': 1.6709927586105884, 'bear_tsl_mult': 0.6505342701068717, 'bear_time_stop': 21, 'bear_use_sma': False, 'bear_use_ema': True, 'bear_use_atr': False, 'bear_use_adx': False, 'bear_use_spike': True, 'bear_rsi_required': True, 'sideways_strategy': 'mean_reversion', 'sideways_bb_std_mult': 1.434843254649688, 'sideways_rsi_os': 31, 'sideways_rsi_ob': 87, 'sideways_adx_thresh': 15.939893497638606, 'sideways_atr_min_pct': 0.0013714961844031974, 'sideways_atr_max_pct': 0.04436759871905352, 'sideways_tp_mult': 2.6427763397018023, 'sideways_tsl_mult': 0.8983672279865609, 'sideways_time_stop': 255, 'sideways_use_sma': True, 'sideways_use_ema': False, 'sideways_use_atr': True, 'sideways_use_adx': False, 'sideways_use_spike': False, 'sideways_rsi_required': False}.
