[I 2025-09-01 14:19:41,027] Trial 153 finished with values: [-0.016255354337728067, 0.02050230058080157] and parameters: {'p_sma': 20, 'p_std': 11, 'p_atr': 13, 'p_adx': 13, 'rsi_period': 80, 'ema1': 24, 'ema2': 46, 'slip_atr_k': 0.029389619805114404, 'slip_spread_k': 0.5137795004935776, 'spread_hl_frac': 0.04481494329387799, 'bb_std_mult': 2.55455747671778, 'rsi_os': 21, 'rsi_ob': 83, 'vol_spike': 0.06668684209921957, 'adx_thresh': 17.441429627357174, 'atr_min_pct': 0.0033703121789112923, 'atr_max_pct': 0.06417280025438865, 'tp_mult': 1.956373515736531, 'tsl_mult': 0.6311373775488053, 'strategy': 'mean_reversion', 'time_stop': 90, 'use_sma': False, 'use_atr': False, 'use_adx': False, 'use_ema': False, 'use_spike': False, 'rsi_required': True, 'edge_k': 1.1978311675339464, 'edge_cap': 0.8902766608366434, 'bull_strategy': 'breakout', 'bull_bb_std_mult': 1.5464610760326765, 'bull_rsi_os': 27, 'bull_rsi_ob': 53, 'bull_adx_thresh': 33.579435094648126, 'bull_atr_min_pct': 0.003998084444478991, 'bull_atr_max_pct': 0.0537296242009475, 'bull_tp_mult': 1.1699964928769793, 'bull_tsl_mult': 0.9973027262253046, 'bull_time_stop': 6, 'bull_use_sma': False, 'bull_use_ema': True, 'bull_use_atr': True, 'bull_use_adx': True, 'bull_use_spike': False, 'bull_rsi_required': False, 'bear_strategy': 'breakout', 'bear_bb_std_mult': 2.300356181323611, 'bear_rsi_os': 55, 'bear_rsi_ob': 68, 'bear_adx_thresh': 6.326719972419947, 'bear_atr_min_pct': 0.0055772199869806565, 'bear_atr_max_pct': 0.020242984110065858, 'bear_tp_mult': 2.3013067048621205, 'bear_tsl_mult': 0.6839711170373883, 'bear_time_stop': 103, 'bear_use_sma': False, 'bear_use_ema': False, 'bear_use_atr': False, 'bear_use_adx': False, 'bear_use_spike': True, 'bear_rsi_required': True, 'sideways_strategy': 'mean_reversion', 'sideways_bb_std_mult': 1.8033596366038291, 'sideways_rsi_os': 55, 'sideways_rsi_ob': 78, 'sideways_adx_thresh': 29.877063821052523, 'sideways_atr_min_pct': 0.013196063033664067, 'sideways_atr_max_pct': 0.019055165876605062, 'sideways_tp_mult': 1.3225791950781605, 'sideways_tsl_mult': 0.6350174115018048, 'sideways_time_stop': 38, 'sideways_use_sma': True, 'sideways_use_ema': True, 'sideways_use_atr': False, 'sideways_use_adx': True, 'sideways_use_spike': True, 'sideways_rsi_required': False}.
[I 2025-09-01 14:19:41,038] Trial 154 finished with values: [-0.02103683740451945, 0.02791574608334148] and parameters: {'p_sma': 52, 'p_std': 11, 'p_atr': 12, 'p_adx': 16, 'rsi_period': 70, 'ema1': 29, 'ema2': 38, 'slip_atr_k': 0.00018328103783565473, 'slip_spread_k': 0.37893736235882447, 'spread_hl_frac': 0.004875458337976837, 'bb_std_mult': 2.5349729028073007, 'rsi_os': 9, 'rsi_ob': 79, 'vol_spike': 0.018784172501171634, 'adx_thresh': 20.09877971092275, 'atr_min_pct': 0.0034997196284922132, 'atr_max_pct': 0.08944137818452713, 'tp_mult': 1.9335286836998382, 'tsl_mult': 0.5578968217841347, 'strategy': 'mean_reversion', 'time_stop': 89, 'use_sma': True, 'use_atr': False, 'use_adx': False, 'use_ema': False, 'use_spike': False, 'rsi_required': True, 'edge_k': 0.5495990137395546, 'edge_cap': 0.14900499792790733, 'bull_strategy': 'breakout', 'bull_bb_std_mult': 1.5133714656184643, 'bull_rsi_os': 19, 'bull_rsi_ob': 54, 'bull_adx_thresh': 34.17955104629174, 'bull_atr_min_pct': 0.00422216277658809, 'bull_atr_max_pct': 0.09687816955237376, 'bull_tp_mult': 1.0174922766095655, 'bull_tsl_mult': 0.4478190099402032, 'bull_time_stop': 97, 'bull_use_sma': False, 'bull_use_ema': False, 'bull_use_atr': True, 'bull_use_adx': True, 'bull_use_spike': False, 'bull_rsi_required': True, 'bear_strategy': 'breakout', 'bear_bb_std_mult': 1.9501686857840126, 'bear_rsi_os': 51, 'bear_rsi_ob': 88, 'bear_adx_thresh': 5.925814947530405, 'bear_atr_min_pct': 0.00525765468382537, 'bear_atr_max_pct': 0.14966629657340202, 'bear_tp_mult': 1.9017073798632926, 'bear_tsl_mult': 0.6492943547431969, 'bear_time_stop': 71, 'bear_use_sma': False, 'bear_use_ema': False, 'bear_use_atr': False, 'bear_use_adx': False, 'bear_use_spike': False, 'bear_rsi_required': True, 'sideways_strategy': 'mean_reversion', 'sideways_bb_std_mult': 2.3515131914757728, 'sideways_rsi_os': 28, 'sideways_rsi_ob': 73, 'sideways_adx_thresh': 33.804955191160744, 'sideways_atr_min_pct': 0.018101613689461636, 'sideways_atr_max_pct': 0.040708806884038135, 'sideways_tp_mult': 2.59275389346591, 'sideways_tsl_mult': 0.7868490481451673, 'sideways_time_stop': 62, 'sideways_use_sma': True, 'sideways_use_ema': True, 'sideways_use_atr': False, 'sideways_use_adx': True, 'sideways_use_spike': True, 'sideways_rsi_required': False}.
[I 2025-09-01 14:19:41,454] Trial 156 finished with values: [-1000000000.0, 1000000000.0] and parameters: {'p_sma': 5, 'p_std': 48, 'p_atr': 12, 'p_adx': 17, 'rsi_period': 74, 'ema1': 29, 'ema2': 43, 'slip_atr_k': 0.009889010656854415, 'slip_spread_k': 0.4893014492298371, 'spread_hl_frac': 0.01738906197130228, 'bb_std_mult': 1.6004263244725918, 'rsi_os': 8, 'rsi_ob': 79, 'vol_spike': 0.019417946845285375, 'adx_thresh': 24.24305730977549, 'atr_min_pct': 0.003695754538663767, 'atr_max_pct': 0.07681659102277728, 'tp_mult': 2.36046903917192, 'tsl_mult': 0.5668953150275153, 'strategy': 'mean_reversion', 'time_stop': 87, 'use_sma': False, 'use_atr': True, 'use_adx': False, 'use_ema': True, 'use_spike': False, 'rsi_required': True, 'edge_k': 0.5494085668599492, 'edge_cap': 0.9869351929440162, 'bull_strategy': 'breakout', 'bull_bb_std_mult': 1.4893465317281005, 'bull_rsi_os': 17, 'bull_rsi_ob': 54, 'bull_adx_thresh': 6.813987824215908, 'bull_atr_min_pct': 0.025200833279450444, 'bull_atr_max_pct': 0.03518610088872193, 'bull_tp_mult': 1.0119510249451487, 'bull_tsl_mult': 0.1492851217685373, 'bull_time_stop': 19, 'bull_use_sma': False, 'bull_use_ema': False, 'bull_use_atr': True, 'bull_use_adx': True, 'bull_use_spike': True, 'bull_rsi_required': True, 'bear_strategy': 'breakout', 'bear_bb_std_mult': 1.510699819235199, 'bear_rsi_os': 51, 'bear_rsi_ob': 74, 'bear_adx_thresh': 22.577331834687456, 'bear_atr_min_pct': 0.004962848371908328, 'bear_atr_max_pct': 0.1340961713304419, 'bear_tp_mult': 1.9383043880180848, 'bear_tsl_mult': 0.6455300989562043, 'bear_time_stop': 230, 'bear_use_sma': True, 'bear_use_ema': True, 'bear_use_atr': False, 'bear_use_adx': False, 'bear_use_spike': False, 'bear_rsi_required': True, 'sideways_strategy': 'mean_reversion', 'sideways_bb_std_mult': 2.367608340654083, 'sideways_rsi_os': 28, 'sideways_rsi_ob': 73, 'sideways_adx_thresh': 19.52217487376747, 'sideways_atr_min_pct': 0.018188818788887468, 'sideways_atr_max_pct': 0.040411137239485556, 'sideways_tp_mult': 2.676655195149675, 'sideways_tsl_mult': 0.7902470530698888, 'sideways_time_stop': 61, 'sideways_use_sma': True, 'sideways_use_ema': True, 'sideways_use_atr': False, 'sideways_use_adx': True, 'sideways_use_spike': True, 'sideways_rsi_required': False}.
[I 2025-09-01 14:19:41,673] Trial 155 finished with values: [-1000000000.0, 1000000000.0] and parameters: {'p_sma': 12, 'p_std': 11, 'p_atr': 12, 'p_adx': 16, 'rsi_period': 70, 'ema1': 29, 'ema2': 43, 'slip_atr_k': 0.011899805903332228, 'slip_spread_k': 0.3652965659090936, 'spread_hl_frac': 0.017657397320443274, 'bb_std_mult': 2.0240739827990146, 'rsi_os': 8, 'rsi_ob': 79, 'vol_spike': 0.01793236288594738, 'adx_thresh': 20.193124118946503, 'atr_min_pct': 0.006441764458545702, 'atr_max_pct': 0.08068019752695776, 'tp_mult': 1.91953817798063, 'tsl_mult': 0.5780478259839517, 'strategy': 'mean_reversion', 'time_stop': 88, 'use_sma': False, 'use_atr': True, 'use_adx': False, 'use_ema': False, 'use_spike': False, 'rsi_required': True, 'edge_k': 0.5857856355696526, 'edge_cap': 0.9841532292907228, 'bull_strategy': 'breakout', 'bull_bb_std_mult': 1.5780065460764252, 'bull_rsi_os': 19, 'bull_rsi_ob': 54, 'bull_adx_thresh': 33.5975968724485, 'bull_atr_min_pct': 0.028052738192063435, 'bull_atr_max_pct': 0.06687229415854483, 'bull_tp_mult': 1.0251007873612275, 'bull_tsl_mult': 0.7782985608998334, 'bull_time_stop': 17, 'bull_use_sma': False, 'bull_use_ema': False, 'bull_use_atr': True, 'bull_use_adx': True, 'bull_use_spike': False, 'bull_rsi_required': False, 'bear_strategy': 'breakout', 'bear_bb_std_mult': 1.947911846736294, 'bear_rsi_os': 51, 'bear_rsi_ob': 47, 'bear_adx_thresh': 23.484890572931313, 'bear_atr_min_pct': 0.00538242214316233, 'bear_atr_max_pct': 0.061253122841308724, 'bear_tp_mult': 1.905593082528158, 'bear_tsl_mult': 0.651172433789826, 'bear_time_stop': 252, 'bear_use_sma': True, 'bear_use_ema': True, 'bear_use_atr': False, 'bear_use_adx': False, 'bear_use_spike': False, 'bear_rsi_required': True, 'sideways_strategy': 'mean_reversion', 'sideways_bb_std_mult': 2.304618569545828, 'sideways_rsi_os': 28, 'sideways_rsi_ob': 45, 'sideways_adx_thresh': 10.261229962533573, 'sideways_atr_min_pct': 0.017586559235926766, 'sideways_atr_max_pct': 0.048915860354685675, 'sideways_tp_mult': 1.4986940445536787, 'sideways_tsl_mult': 0.41183421327562025, 'sideways_time_stop': 62, 'sideways_use_sma': True, 'sideways_use_ema': True, 'sideways_use_atr': False, 'sideways_use_adx': True, 'sideways_use_spike': True, 'sideways_rsi_required': False}.
[I 2025-09-01 14:20:19,067] Trial 159 finished with values: [-1000000000.0, 1000000000.0] and parameters: {'p_sma': 52, 'p_std': 45, 'p_atr': 14, 'p_adx': 23, 'rsi_period': 72, 'ema1': 28, 'ema2': 50, 'slip_atr_k': 0.014503721323901705, 'slip_spread_k': 0.3688570738432395, 'spread_hl_frac': 0.041068470076169566, 'bb_std_mult': 2.5556985049848553, 'rsi_os': 8, 'rsi_ob': 84, 'vol_spike': 0.13385384592224944, 'adx_thresh': 25.60998562629144, 'atr_min_pct': 0.029138678893341437, 'atr_max_pct': 0.06015822950324043, 'tp_mult': 2.957528922708455, 'tsl_mult': 0.5534336003656519, 'strategy': 'mean_reversion', 'time_stop': 162, 'use_sma': False, 'use_atr': False, 'use_adx': False, 'use_ema': False, 'use_spike': False, 'rsi_required': True, 'edge_k': 0.6072624175814962, 'edge_cap': 0.9635396336624228, 'bull_strategy': 'breakout', 'bull_bb_std_mult': 1.58595239041194, 'bull_rsi_os': 25, 'bull_rsi_ob': 77, 'bull_adx_thresh': 14.86971816448472, 'bull_atr_min_pct': 0.020319657874348595, 'bull_atr_max_pct': 0.14090715900708226, 'bull_tp_mult': 2.8254329388589663, 'bull_tsl_mult': 0.7742258149793316, 'bull_time_stop': 28, 'bull_use_sma': True, 'bull_use_ema': True, 'bull_use_atr': True, 'bull_use_adx': True, 'bull_use_spike': False, 'bull_rsi_required': True, 'bear_strategy': 'breakout', 'bear_bb_std_mult': 2.3212861429945053, 'bear_rsi_os': 32, 'bear_rsi_ob': 47, 'bear_adx_thresh': 19.941473974692194, 'bear_atr_min_pct': 0.009398055427273119, 'bear_atr_max_pct': 0.062328982089802656, 'bear_tp_mult': 1.7078076513493414, 'bear_tsl_mult': 0.350296094460429, 'bear_time_stop': 6, 'bear_use_sma': False, 'bear_use_ema': True, 'bear_use_atr': False, 'bear_use_adx': False, 'bear_use_spike': False, 'bear_rsi_required': True, 'sideways_strategy': 'mean_reversion', 'sideways_bb_std_mult': 1.4421464188388706, 'sideways_rsi_os': 10, 'sideways_rsi_ob': 77, 'sideways_adx_thresh': 28.483952707911456, 'sideways_atr_min_pct': 0.01762707362356821, 'sideways_atr_max_pct': 0.1099029598524145, 'sideways_tp_mult': 2.8941045861856116, 'sideways_tsl_mult': 0.9628890037832558, 'sideways_time_stop': 82, 'sideways_use_sma': True, 'sideways_use_ema': True, 'sideways_use_atr': False, 'sideways_use_adx': True, 'sideways_use_spike': False, 'sideways_rsi_required': False}.
[I 2025-09-01 14:20:19,478] Trial 160 finished with values: [-1000000000.0, 1000000000.0] and parameters: {'p_sma': 39, 'p_std': 24, 'p_atr': 14, 'p_adx': 12, 'rsi_period': 34, 'ema1': 28, 'ema2': 38, 'slip_atr_k': 0.04983692914383975, 'slip_spread_k': 0.3968287087106636, 'spread_hl_frac': 0.04857944602669668, 'bb_std_mult': 2.4637065941102474, 'rsi_os': 21, 'rsi_ob': 86, 'vol_spike': 0.1514543032395209, 'adx_thresh': 11.36401194477209, 'atr_min_pct': 0.0292272804546124, 'atr_max_pct': 0.14451546605322918, 'tp_mult': 2.9502079975018773, 'tsl_mult': 0.5495664737023669, 'strategy': 'mean_reversion', 'time_stop': 183, 'use_sma': False, 'use_atr': False, 'use_adx': False, 'use_ema': False, 'use_spike': False, 'rsi_required': True, 'edge_k': 0.6069217654251653, 'edge_cap': 0.9371981799830427, 'bull_strategy': 'breakout', 'bull_bb_std_mult': 1.3206471030614122, 'bull_rsi_os': 27, 'bull_rsi_ob': 90, 'bull_adx_thresh': 19.511711784812583, 'bull_atr_min_pct': 0.018188906393255194, 'bull_atr_max_pct': 0.14211487788583985, 'bull_tp_mult': 1.1070590760959127, 'bull_tsl_mult': 0.8600376840796968, 'bull_time_stop': 98, 'bull_use_sma': True, 'bull_use_ema': True, 'bull_use_atr': True, 'bull_use_adx': True, 'bull_use_spike': False, 'bull_rsi_required': True, 'bear_strategy': 'breakout', 'bear_bb_std_mult': 2.284720587668658, 'bear_rsi_os': 53, 'bear_rsi_ob': 47, 'bear_adx_thresh': 19.93412636564937, 'bear_atr_min_pct': 0.009398271612092293, 'bear_atr_max_pct': 0.023567520675449205, 'bear_tp_mult': 1.7381703382662863, 'bear_tsl_mult': 0.36651434137460226, 'bear_time_stop': 5, 'bear_use_sma': False, 'bear_use_ema': True, 'bear_use_atr': False, 'bear_use_adx': False, 'bear_use_spike': False, 'bear_rsi_required': True, 'sideways_strategy': 'mean_reversion', 'sideways_bb_std_mult': 1.4468587288825714, 'sideways_rsi_os': 40, 'sideways_rsi_ob': 77, 'sideways_adx_thresh': 11.111254334964334, 'sideways_atr_min_pct': 0.01565987597512313, 'sideways_atr_max_pct': 0.03200820607946335, 'sideways_tp_mult': 2.654675134378996, 'sideways_tsl_mult': 0.714817269355626, 'sideways_time_stop': 83, 'sideways_use_sma': True, 'sideways_use_ema': True, 'sideways_use_atr': True, 'sideways_use_adx': True, 'sideways_use_spike': False, 'sideways_rsi_required': True}.
[I 2025-09-01 14:20:20,468] Trial 157 finished with values: [-1000000000.0, 1000000000.0] and parameters: {'p_sma': 22, 'p_std': 14, 'p_atr': 18, 'p_adx': 16, 'rsi_period': 37, 'ema1': 29, 'ema2': 38, 'slip_atr_k': 0.013533789589156492, 'slip_spread_k': 0.4843693185033622, 'spread_hl_frac': 0.040966908006037514, 'bb_std_mult': 2.5609588690962846, 'rsi_os': 8, 'rsi_ob': 86, 'vol_spike': 0.01127308804122782, 'adx_thresh': 24.464809743691085, 'atr_min_pct': 0.003236313133692454, 'atr_max_pct': 0.09002527276008133, 'tp_mult': 2.359448858335498, 'tsl_mult': 0.5497607430147192, 'strategy': 'mean_reversion', 'time_stop': 161, 'use_sma': False, 'use_atr': True, 'use_adx': False, 'use_ema': False, 'use_spike': False, 'rsi_required': True, 'edge_k': 0.5417691060855493, 'edge_cap': 0.9399632392855879, 'bull_strategy': 'breakout', 'bull_bb_std_mult': 1.5714287421187905, 'bull_rsi_os': 32, 'bull_rsi_ob': 60, 'bull_adx_thresh': 19.874687223749717, 'bull_atr_min_pct': 0.02083672591620083, 'bull_atr_max_pct': 0.035518959616910636, 'bull_tp_mult': 1.015634445435377, 'bull_tsl_mult': 0.8656004729792729, 'bull_time_stop': 28, 'bull_use_sma': True, 'bull_use_ema': True, 'bull_use_atr': True, 'bull_use_adx': True, 'bull_use_spike': False, 'bull_rsi_required': True, 'bear_strategy': 'breakout', 'bear_bb_std_mult': 2.266862239174655, 'bear_rsi_os': 54, 'bear_rsi_ob': 88, 'bear_adx_thresh': 20.119282671979345, 'bear_atr_min_pct': 0.007769633470649986, 'bear_atr_max_pct': 0.01010737530170017, 'bear_tp_mult': 1.2898231009994565, 'bear_tsl_mult': 0.6553401805542556, 'bear_time_stop': 253, 'bear_use_sma': True, 'bear_use_ema': True, 'bear_use_atr': False, 'bear_use_adx': False, 'bear_use_spike': False, 'bear_rsi_required': True, 'sideways_strategy': 'mean_reversion', 'sideways_bb_std_mult': 2.3036697584341135, 'sideways_rsi_os': 28, 'sideways_rsi_ob': 77, 'sideways_adx_thresh': 5.886016063125744, 'sideways_atr_min_pct': 0.022370082439922893, 'sideways_atr_max_pct': 0.040807641751560535, 'sideways_tp_mult': 2.672082483638848, 'sideways_tsl_mult': 0.40320052156226116, 'sideways_time_stop': 252, 'sideways_use_sma': True, 'sideways_use_ema': True, 'sideways_use_atr': False, 'sideways_use_adx': True, 'sideways_use_spike': True, 'sideways_rsi_required': False}.
[I 2025-09-01 14:20:20,726] Trial 158 finished with values: [-1000000000.0, 1000000000.0] and parameters: {'p_sma': 22, 'p_std': 15, 'p_atr': 12, 'p_adx': 24, 'rsi_period': 35, 'ema1': 29, 'ema2': 38, 'slip_atr_k': 0.01336226200687507, 'slip_spread_k': 0.2543615061231317, 'spread_hl_frac': 0.004110397138894786, 'bb_std_mult': 2.5465513746556874, 'rsi_os': 8, 'rsi_ob': 86, 'vol_spike': 0.17014343104317015, 'adx_thresh': 29.732269868830905, 'atr_min_pct': 0.0041754582182579065, 'atr_max_pct': 0.07684220017472489, 'tp_mult': 2.916845283167472, 'tsl_mult': 0.5514624962720623, 'strategy': 'mean_reversion', 'time_stop': 101, 'use_sma': False, 'use_atr': True, 'use_adx': False, 'use_ema': False, 'use_spike': False, 'rsi_required': True, 'edge_k': 1.1990800428323538, 'edge_cap': 0.9434718723849012, 'bull_strategy': 'breakout', 'bull_bb_std_mult': 1.5462682430183068, 'bull_rsi_os': 45, 'bull_rsi_ob': 60, 'bull_adx_thresh': 14.933268513483844, 'bull_atr_min_pct': 0.007949184573154239, 'bull_atr_max_pct': 0.0665317621348145, 'bull_tp_mult': 1.0239895719501007, 'bull_tsl_mult': 0.7767198018575665, 'bull_time_stop': 98, 'bull_use_sma': True, 'bull_use_ema': True, 'bull_use_atr': True, 'bull_use_adx': True, 'bull_use_spike': False, 'bull_rsi_required': True, 'bear_strategy': 'breakout', 'bear_bb_std_mult': 2.2995512734169776, 'bear_rsi_os': 33, 'bear_rsi_ob': 47, 'bear_adx_thresh': 22.761902054376115, 'bear_atr_min_pct': 0.02324817456949506, 'bear_atr_max_pct': 0.13538174544434844, 'bear_tp_mult': 1.726532019275874, 'bear_tsl_mult': 0.6562143317875458, 'bear_time_stop': 296, 'bear_use_sma': True, 'bear_use_ema': True, 'bear_use_atr': False, 'bear_use_adx': False, 'bear_use_spike': False, 'bear_rsi_required': True, 'sideways_strategy': 'mean_reversion', 'sideways_bb_std_mult': 3.0309562486649075, 'sideways_rsi_os': 10, 'sideways_rsi_ob': 77, 'sideways_adx_thresh': 33.92941890660143, 'sideways_atr_min_pct': 0.018145499578746997, 'sideways_atr_max_pct': 0.03926905959976348, 'sideways_tp_mult': 1.2997117861049403, 'sideways_tsl_mult': 0.7176691264525715, 'sideways_time_stop': 61, 'sideways_use_sma': True, 'sideways_use_ema': True, 'sideways_use_atr': False, 'sideways_use_adx': True, 'sideways_use_spike': True, 'sideways_rsi_required': False}.
[I 2025-09-01 14:20:58,228] Trial 164 finished with values: [-1000000000.0, 1000000000.0] and parameters: {'p_sma': 26, 'p_std': 12, 'p_atr': 19, 'p_adx': 18, 'rsi_period': 47, 'ema1': 20, 'ema2': 41, 'slip_atr_k': 0.028055839825063683, 'slip_spread_k': 0.44919221140736515, 'spread_hl_frac': 0.040044265237141684, 'bb_std_mult': 0.9171138196267363, 'rsi_os': 6, 'rsi_ob': 84, 'vol_spike': 0.06396391194719803, 'adx_thresh': 26.00954919228512, 'atr_min_pct': 0.022630377660432213, 'atr_max_pct': 0.1378442114496806, 'tp_mult': 1.6190075056616815, 'tsl_mult': 0.5938971132370519, 'strategy': 'breakout', 'time_stop': 201, 'use_sma': False, 'use_atr': False, 'use_adx': True, 'use_ema': True, 'use_spike': False, 'rsi_required': True, 'edge_k': 0.6945361557168646, 'edge_cap': 0.911064319022862, 'bull_strategy': 'breakout', 'bull_bb_std_mult': 1.273620351991524, 'bull_rsi_os': 34, 'bull_rsi_ob': 57, 'bull_adx_thresh': 12.336780365852189, 'bull_atr_min_pct': 0.005028795851544839, 'bull_atr_max_pct': 0.08252022428917112, 'bull_tp_mult': 1.3153685347396609, 'bull_tsl_mult': 0.4671188993455539, 'bull_time_stop': 235, 'bull_use_sma': False, 'bull_use_ema': True, 'bull_use_atr': False, 'bull_use_adx': False, 'bull_use_spike': False, 'bull_rsi_required': False, 'bear_strategy': 'breakout', 'bear_bb_std_mult': 1.2595708827376382, 'bear_rsi_os': 53, 'bear_rsi_ob': 45, 'bear_adx_thresh': 13.99316427747313, 'bear_atr_min_pct': 0.006868558988939831, 'bear_atr_max_pct': 0.14098575382365952, 'bear_tp_mult': 2.0912462670522087, 'bear_tsl_mult': 0.261222321711003, 'bear_time_stop': 154, 'bear_use_sma': False, 'bear_use_ema': False, 'bear_use_atr': True, 'bear_use_adx': False, 'bear_use_spike': False, 'bear_rsi_required': True, 'sideways_strategy': 'mean_reversion', 'sideways_bb_std_mult': 1.8165274097198736, 'sideways_rsi_os': 31, 'sideways_rsi_ob': 70, 'sideways_adx_thresh': 33.44795130406881, 'sideways_atr_min_pct': 0.013957637017310308, 'sideways_atr_max_pct': 0.012097825271931331, 'sideways_tp_mult': 1.4278446935236015, 'sideways_tsl_mult': 0.44332508346879324, 'sideways_time_stop': 136, 'sideways_use_sma': True, 'sideways_use_ema': False, 'sideways_use_atr': True, 'sideways_use_adx': True, 'sideways_use_spike': True, 'sideways_rsi_required': True}.
