[I 2025-09-01 14:08:57,162] Trial 93 finished with values: [-0.17440615366624534, 0.17404476005590078] and parameters: {'p_sma': 10, 'p_std': 13, 'p_atr': 10, 'p_adx': 12, 'rsi_period': 68, 'ema1': 29, 'ema2': 17, 'slip_atr_k': 0.00904987585876791, 'slip_spread_k': 0.05938198596141847, 'spread_hl_frac': 0.01278967408845762, 'bb_std_mult': 1.7004956944133038, 'rsi_os': 12, 'rsi_ob': 81, 'vol_spike': 0.0007970957566853579, 'adx_thresh': 30.094369678576125, 'atr_min_pct': 0.003399607946485906, 'atr_max_pct': 0.08373551161652609, 'tp_mult': 1.1067286352203718, 'tsl_mult': 0.5437052892105722, 'strategy': 'mean_reversion', 'time_stop': 154, 'use_sma': True, 'use_atr': False, 'use_adx': True, 'use_ema': False, 'use_spike': False, 'rsi_required': True, 'edge_k': 0.11527741185333773, 'edge_cap': 0.8109622523613286, 'bull_strategy': 'breakout', 'bull_bb_std_mult': 1.081921282651996, 'bull_rsi_os': 24, 'bull_rsi_ob': 57, 'bull_adx_thresh': 34.67078590537591, 'bull_atr_min_pct': 0.022850752800480167, 'bull_atr_max_pct': 0.09922722121879388, 'bull_tp_mult': 1.1883517825507983, 'bull_tsl_mult': 0.8491974038312098, 'bull_time_stop': 216, 'bull_use_sma': False, 'bull_use_ema': False, 'bull_use_atr': True, 'bull_use_adx': True, 'bull_use_spike': False, 'bull_rsi_required': True, 'bear_strategy': 'breakout', 'bear_bb_std_mult': 1.3150654840415648, 'bear_rsi_os': 52, 'bear_rsi_ob': 92, 'bear_adx_thresh': 20.26788471391806, 'bear_atr_min_pct': 0.0001642524912303274, 'bear_atr_max_pct': 0.1135203828509462, 'bear_tp_mult': 1.7537058621335115, 'bear_tsl_mult': 0.595994441087179, 'bear_time_stop': 85, 'bear_use_sma': False, 'bear_use_ema': False, 'bear_use_atr': False, 'bear_use_adx': False, 'bear_use_spike': False, 'bear_rsi_required': True, 'sideways_strategy': 'mean_reversion', 'sideways_bb_std_mult': 1.4140721656845738, 'sideways_rsi_os': 33, 'sideways_rsi_ob': 68, 'sideways_adx_thresh': 32.072245514227184, 'sideways_atr_min_pct': 0.019322148018294044, 'sideways_atr_max_pct': 0.028767964253069465, 'sideways_tp_mult': 2.5304795592131573, 'sideways_tsl_mult': 0.8386012888568788, 'sideways_time_stop': 21, 'sideways_use_sma': True, 'sideways_use_ema': False, 'sideways_use_atr': False, 'sideways_use_adx': True, 'sideways_use_spike': False, 'sideways_rsi_required': False}.
[I 2025-09-01 14:08:57,170] Trial 91 finished with values: [-1000000000.0, 1000000000.0] and parameters: {'p_sma': 18, 'p_std': 14, 'p_atr': 10, 'p_adx': 10, 'rsi_period': 68, 'ema1': 30, 'ema2': 39, 'slip_atr_k': 0.008206708577574648, 'slip_spread_k': 0.4167942179254231, 'spread_hl_frac': 0.018471929174555302, 'bb_std_mult': 1.7539380101622868, 'rsi_os': 22, 'rsi_ob': 81, 'vol_spike': 0.0785909538713122, 'adx_thresh': 6.766764439668027, 'atr_min_pct': 0.005866663899791277, 'atr_max_pct': 0.08273460092823373, 'tp_mult': 1.8568449245157166, 'tsl_mult': 0.39735799442665665, 'strategy': 'mean_reversion', 'time_stop': 155, 'use_sma': True, 'use_atr': False, 'use_adx': True, 'use_ema': False, 'use_spike': False, 'rsi_required': True, 'edge_k': 0.43426792888195664, 'edge_cap': 0.9555526907130111, 'bull_strategy': 'breakout', 'bull_bb_std_mult': 2.3168467602346396, 'bull_rsi_os': 28, 'bull_rsi_ob': 57, 'bull_adx_thresh': 33.67088611056842, 'bull_atr_min_pct': 0.023463122489202834, 'bull_atr_max_pct': 0.08302954422642816, 'bull_tp_mult': 1.0987984049697797, 'bull_tsl_mult': 0.7916838352823607, 'bull_time_stop': 250, 'bull_use_sma': False, 'bull_use_ema': False, 'bull_use_atr': True, 'bull_use_adx': True, 'bull_use_spike': False, 'bull_rsi_required': True, 'bear_strategy': 'breakout', 'bear_bb_std_mult': 0.7435821550984792, 'bear_rsi_os': 50, 'bear_rsi_ob': 81, 'bear_adx_thresh': 24.072741539677182, 'bear_atr_min_pct': 0.007650868720016424, 'bear_atr_max_pct': 0.020971175324245916, 'bear_tp_mult': 1.893993105121711, 'bear_tsl_mult': 0.5957104721883535, 'bear_time_stop': 107, 'bear_use_sma': False, 'bear_use_ema': False, 'bear_use_atr': False, 'bear_use_adx': False, 'bear_use_spike': False, 'bear_rsi_required': True, 'sideways_strategy': 'mean_reversion', 'sideways_bb_std_mult': 1.612452224897881, 'sideways_rsi_os': 28, 'sideways_rsi_ob': 68, 'sideways_adx_thresh': 30.879644101615586, 'sideways_atr_min_pct': 0.012537873369219979, 'sideways_atr_max_pct': 0.043156627429416436, 'sideways_tp_mult': 2.59296899708061, 'sideways_tsl_mult': 0.8294649269116603, 'sideways_time_stop': 105, 'sideways_use_sma': True, 'sideways_use_ema': False, 'sideways_use_atr': False, 'sideways_use_adx': True, 'sideways_use_spike': False, 'sideways_rsi_required': False}.
[I 2025-09-01 14:08:57,421] Trial 90 finished with values: [-1000000000.0, 1000000000.0] and parameters: {'p_sma': 57, 'p_std': 14, 'p_atr': 10, 'p_adx': 13, 'rsi_period': 8, 'ema1': 25, 'ema2': 17, 'slip_atr_k': 0.012172958847984711, 'slip_spread_k': 0.4240613661645417, 'spread_hl_frac': 0.009068217602954, 'bb_std_mult': 1.4703793683039446, 'rsi_os': 26, 'rsi_ob': 78, 'vol_spike': 0.10438176711341271, 'adx_thresh': 6.858156156588482, 'atr_min_pct': 0.005866018116991438, 'atr_max_pct': 0.08325345507174141, 'tp_mult': 1.142993029473196, 'tsl_mult': 0.3921915704743822, 'strategy': 'mean_reversion', 'time_stop': 78, 'use_sma': True, 'use_atr': False, 'use_adx': True, 'use_ema': False, 'use_spike': False, 'rsi_required': True, 'edge_k': 0.6547340138928578, 'edge_cap': 0.9560854621132484, 'bull_strategy': 'breakout', 'bull_bb_std_mult': 0.756387978703165, 'bull_rsi_os': 14, 'bull_rsi_ob': 57, 'bull_adx_thresh': 34.20558018410349, 'bull_atr_min_pct': 0.02351322036233372, 'bull_atr_max_pct': 0.035438575310828106, 'bull_tp_mult': 1.290019724888747, 'bull_tsl_mult': 0.7819321550330688, 'bull_time_stop': 253, 'bull_use_sma': True, 'bull_use_ema': False, 'bull_use_atr': True, 'bull_use_adx': True, 'bull_use_spike': False, 'bull_rsi_required': True, 'bear_strategy': 'breakout', 'bear_bb_std_mult': 0.7260715069901876, 'bear_rsi_os': 50, 'bear_rsi_ob': 87, 'bear_adx_thresh': 24.47540582413298, 'bear_atr_min_pct': 0.00731251941184336, 'bear_atr_max_pct': 0.02128696808842425, 'bear_tp_mult': 1.8738335116652236, 'bear_tsl_mult': 0.6088715373507263, 'bear_time_stop': 78, 'bear_use_sma': False, 'bear_use_ema': False, 'bear_use_atr': False, 'bear_use_adx': False, 'bear_use_spike': False, 'bear_rsi_required': True, 'sideways_strategy': 'mean_reversion', 'sideways_bb_std_mult': 1.2565832885802013, 'sideways_rsi_os': 34, 'sideways_rsi_ob': 77, 'sideways_adx_thresh': 30.881854861641358, 'sideways_atr_min_pct': 0.012608406367721347, 'sideways_atr_max_pct': 0.04167071779288347, 'sideways_tp_mult': 2.592353095898857, 'sideways_tsl_mult': 0.779363961623532, 'sideways_time_stop': 43, 'sideways_use_sma': True, 'sideways_use_ema': False, 'sideways_use_atr': False, 'sideways_use_adx': True, 'sideways_use_spike': False, 'sideways_rsi_required': False}.
[I 2025-09-01 14:08:57,597] Trial 92 finished with values: [-1000000000.0, 1000000000.0] and parameters: {'p_sma': 11, 'p_std': 14, 'p_atr': 10, 'p_adx': 21, 'rsi_period': 68, 'ema1': 29, 'ema2': 30, 'slip_atr_k': 0.2320323862171821, 'slip_spread_k': 0.7235091626822155, 'spread_hl_frac': 0.013252771567152051, 'bb_std_mult': 1.781359196273487, 'rsi_os': 28, 'rsi_ob': 82, 'vol_spike': 0.004261251605438639, 'adx_thresh': 29.764917717106055, 'atr_min_pct': 0.008452861650911029, 'atr_max_pct': 0.08208036296931939, 'tp_mult': 1.6923440150204874, 'tsl_mult': 0.4064348365503525, 'strategy': 'mean_reversion', 'time_stop': 44, 'use_sma': True, 'use_atr': False, 'use_adx': True, 'use_ema': False, 'use_spike': False, 'rsi_required': True, 'edge_k': 1.9287037072282742, 'edge_cap': 0.9706977392817806, 'bull_strategy': 'breakout', 'bull_bb_std_mult': 1.0702204484032594, 'bull_rsi_os': 29, 'bull_rsi_ob': 57, 'bull_adx_thresh': 32.55091379140481, 'bull_atr_min_pct': 0.023228503090245496, 'bull_atr_max_pct': 0.0998861679805958, 'bull_tp_mult': 1.1855717602461222, 'bull_tsl_mult': 0.8554453277790958, 'bull_time_stop': 253, 'bull_use_sma': False, 'bull_use_ema': False, 'bull_use_atr': True, 'bull_use_adx': True, 'bull_use_spike': False, 'bull_rsi_required': True, 'bear_strategy': 'breakout', 'bear_bb_std_mult': 0.7544739430478842, 'bear_rsi_os': 50, 'bear_rsi_ob': 93, 'bear_adx_thresh': 20.346786215042933, 'bear_atr_min_pct': 0.00627408047347624, 'bear_atr_max_pct': 0.0708901733754068, 'bear_tp_mult': 1.7415075380423939, 'bear_tsl_mult': 0.5974575835186703, 'bear_time_stop': 42, 'bear_use_sma': False, 'bear_use_ema': False, 'bear_use_atr': False, 'bear_use_adx': False, 'bear_use_spike': False, 'bear_rsi_required': True, 'sideways_strategy': 'mean_reversion', 'sideways_bb_std_mult': 1.3884373919813477, 'sideways_rsi_os': 34, 'sideways_rsi_ob': 68, 'sideways_adx_thresh': 30.52756552474476, 'sideways_atr_min_pct': 0.0020255351616784694, 'sideways_atr_max_pct': 0.12105202477285426, 'sideways_tp_mult': 2.542046183652262, 'sideways_tsl_mult': 0.7327047960460087, 'sideways_time_stop': 105, 'sideways_use_sma': True, 'sideways_use_ema': False, 'sideways_use_atr': False, 'sideways_use_adx': True, 'sideways_use_spike': False, 'sideways_rsi_required': False}.
[I 2025-09-01 14:09:34,707] Trial 94 finished with values: [-1000000000.0, 1000000000.0] and parameters: {'p_sma': 13, 'p_std': 8, 'p_atr': 8, 'p_adx': 20, 'rsi_period': 66, 'ema1': 29, 'ema2': 37, 'slip_atr_k': 0.23553619141825155, 'slip_spread_k': 0.3800246842345123, 'spread_hl_frac': 0.023204011840737223, 'bb_std_mult': 1.8436486926205116, 'rsi_os': 29, 'rsi_ob': 88, 'vol_spike': 0.2985576709246757, 'adx_thresh': 29.256621578027822, 'atr_min_pct': 0.008625985134877945, 'atr_max_pct': 0.07183403277484185, 'tp_mult': 1.6942267282271612, 'tsl_mult': 0.7649757325085401, 'strategy': 'mean_reversion', 'time_stop': 42, 'use_sma': False, 'use_atr': False, 'use_adx': False, 'use_ema': False, 'use_spike': False, 'rsi_required': True, 'edge_k': 1.93423220868135, 'edge_cap': 0.9742875409057161, 'bull_strategy': 'breakout', 'bull_bb_std_mult': 1.722187589382059, 'bull_rsi_os': 20, 'bull_rsi_ob': 55, 'bull_adx_thresh': 32.97493288169206, 'bull_atr_min_pct': 0.014664240902400368, 'bull_atr_max_pct': 0.09269186780214143, 'bull_tp_mult': 2.579046252484492, 'bull_tsl_mult': 0.8534052727555983, 'bull_time_stop': 210, 'bull_use_sma': False, 'bull_use_ema': False, 'bull_use_atr': True, 'bull_use_adx': True, 'bull_use_spike': False, 'bull_rsi_required': True, 'bear_strategy': 'breakout', 'bear_bb_std_mult': 1.7961114848192996, 'bear_rsi_os': 13, 'bear_rsi_ob': 79, 'bear_adx_thresh': 20.758261525616806, 'bear_atr_min_pct': 0.0041135328307435, 'bear_atr_max_pct': 0.10184958036018042, 'bear_tp_mult': 1.7085106912656274, 'bear_tsl_mult': 0.6751202055451715, 'bear_time_stop': 54, 'bear_use_sma': False, 'bear_use_ema': False, 'bear_use_atr': False, 'bear_use_adx': False, 'bear_use_spike': False, 'bear_rsi_required': True, 'sideways_strategy': 'mean_reversion', 'sideways_bb_std_mult': 1.7474329767583647, 'sideways_rsi_os': 32, 'sideways_rsi_ob': 80, 'sideways_adx_thresh': 33.90357042696503, 'sideways_atr_min_pct': 0.016567142123938536, 'sideways_atr_max_pct': 0.10821174056204387, 'sideways_tp_mult': 2.6516116204456934, 'sideways_tsl_mult': 0.8770781163866813, 'sideways_time_stop': 91, 'sideways_use_sma': True, 'sideways_use_ema': False, 'sideways_use_atr': False, 'sideways_use_adx': True, 'sideways_use_spike': False, 'sideways_rsi_required': False}.
[I 2025-09-01 14:09:35,129] Trial 95 finished with values: [-1000000000.0, 1000000000.0] and parameters: {'p_sma': 14, 'p_std': 43, 'p_atr': 8, 'p_adx': 20, 'rsi_period': 65, 'ema1': 27, 'ema2': 26, 'slip_atr_k': 0.03210521387465009, 'slip_spread_k': 0.5084446760463497, 'spread_hl_frac': 0.023367505716808762, 'bb_std_mult': 3.4973463606297557, 'rsi_os': 29, 'rsi_ob': 75, 'vol_spike': 0.2572312167155449, 'adx_thresh': 29.098969813196074, 'atr_min_pct': 0.012142425242974524, 'atr_max_pct': 0.0719742306536755, 'tp_mult': 1.4906764927559837, 'tsl_mult': 0.3464489456200063, 'strategy': 'mean_reversion', 'time_stop': 101, 'use_sma': False, 'use_atr': False, 'use_adx': False, 'use_ema': False, 'use_spike': False, 'rsi_required': True, 'edge_k': 0.4822669887236022, 'edge_cap': 0.8642550813121448, 'bull_strategy': 'breakout', 'bull_bb_std_mult': 1.743253452406944, 'bull_rsi_os': 20, 'bull_rsi_ob': 55, 'bull_adx_thresh': 33.04095189202426, 'bull_atr_min_pct': 0.02610670950193073, 'bull_atr_max_pct': 0.09268162525778198, 'bull_tp_mult': 2.55141096480208, 'bull_tsl_mult': 0.9068831031625614, 'bull_time_stop': 194, 'bull_use_sma': False, 'bull_use_ema': False, 'bull_use_atr': True, 'bull_use_adx': True, 'bull_use_spike': False, 'bull_rsi_required': True, 'bear_strategy': 'breakout', 'bear_bb_std_mult': 1.8025770912791326, 'bear_rsi_os': 10, 'bear_rsi_ob': 78, 'bear_adx_thresh': 5.728508517692273, 'bear_atr_min_pct': 0.00630067892141109, 'bear_atr_max_pct': 0.09820513854943312, 'bear_tp_mult': 1.9455838999334902, 'bear_tsl_mult': 0.6374208711317917, 'bear_time_stop': 225, 'bear_use_sma': False, 'bear_use_ema': False, 'bear_use_atr': False, 'bear_use_adx': False, 'bear_use_spike': False, 'bear_rsi_required': True, 'sideways_strategy': 'mean_reversion', 'sideways_bb_std_mult': 1.3429384249519345, 'sideways_rsi_os': 32, 'sideways_rsi_ob': 80, 'sideways_adx_thresh': 34.15547350106585, 'sideways_atr_min_pct': 0.01653619546775657, 'sideways_atr_max_pct': 0.02807861827442537, 'sideways_tp_mult': 2.4497095366221058, 'sideways_tsl_mult': 0.743043506528185, 'sideways_time_stop': 6, 'sideways_use_sma': True, 'sideways_use_ema': False, 'sideways_use_atr': False, 'sideways_use_adx': True, 'sideways_use_spike': False, 'sideways_rsi_required': False}.
[I 2025-09-01 14:09:35,481] Trial 96 finished with values: [-1000000000.0, 1000000000.0] and parameters: {'p_sma': 26, 'p_std': 36, 'p_atr': 8, 'p_adx': 20, 'rsi_period': 67, 'ema1': 27, 'ema2': 26, 'slip_atr_k': 0.030904529531832137, 'slip_spread_k': 0.5158637102026637, 'spread_hl_frac': 0.03036910909309256, 'bb_std_mult': 2.878975233792329, 'rsi_os': 28, 'rsi_ob': 88, 'vol_spike': 0.29987975395488764, 'adx_thresh': 29.251477744411925, 'atr_min_pct': 0.008719747804130134, 'atr_max_pct': 0.07259541724372166, 'tp_mult': 1.6591459186775948, 'tsl_mult': 0.34764724125373747, 'strategy': 'mean_reversion', 'time_stop': 91, 'use_sma': False, 'use_atr': False, 'use_adx': False, 'use_ema': False, 'use_spike': False, 'rsi_required': True, 'edge_k': 0.46346220590322723, 'edge_cap': 0.9796163126513446, 'bull_strategy': 'breakout', 'bull_bb_std_mult': 1.711221837785974, 'bull_rsi_os': 20, 'bull_rsi_ob': 86, 'bull_adx_thresh': 32.787459924440384, 'bull_atr_min_pct': 0.01445111955224572, 'bull_atr_max_pct': 0.09039671357789536, 'bull_tp_mult': 1.0566640985694886, 'bull_tsl_mult': 0.8970705351265382, 'bull_time_stop': 287, 'bull_use_sma': False, 'bull_use_ema': False, 'bull_use_atr': True, 'bull_use_adx': True, 'bull_use_spike': False, 'bull_rsi_required': True, 'bear_strategy': 'breakout', 'bear_bb_std_mult': 1.3294590261506105, 'bear_rsi_os': 12, 'bear_rsi_ob': 78, 'bear_adx_thresh': 20.83356113239707, 'bear_atr_min_pct': 0.004267666972575952, 'bear_atr_max_pct': 0.10075964310479633, 'bear_tp_mult': 1.6533413765637732, 'bear_tsl_mult': 0.6352954555623216, 'bear_time_stop': 39, 'bear_use_sma': False, 'bear_use_ema': False, 'bear_use_atr': False, 'bear_use_adx': False, 'bear_use_spike': False, 'bear_rsi_required': True, 'sideways_strategy': 'mean_reversion', 'sideways_bb_std_mult': 1.362562160038049, 'sideways_rsi_os': 23, 'sideways_rsi_ob': 80, 'sideways_adx_thresh': 34.10582411517591, 'sideways_atr_min_pct': 0.016726979390333623, 'sideways_atr_max_pct': 0.08195396720368144, 'sideways_tp_mult': 2.4412265247694696, 'sideways_tsl_mult': 0.8644040155968935, 'sideways_time_stop': 61, 'sideways_use_sma': True, 'sideways_use_ema': False, 'sideways_use_atr': False, 'sideways_use_adx': True, 'sideways_use_spike': False, 'sideways_rsi_required': False}.
[I 2025-09-01 14:09:36,778] Trial 97 finished with values: [-1000000000.0, 1000000000.0] and parameters: {'p_sma': 14, 'p_std': 17, 'p_atr': 8, 'p_adx': 20, 'rsi_period': 65, 'ema1': 27, 'ema2': 26, 'slip_atr_k': 0.03007964429991947, 'slip_spread_k': 0.3785083408427703, 'spread_hl_frac': 0.0028261477908622934, 'bb_std_mult': 2.840514899731396, 'rsi_os': 14, 'rsi_ob': 75, 'vol_spike': 0.25735000837511623, 'adx_thresh': 27.16793010411963, 'atr_min_pct': 0.012091259568936972, 'atr_max_pct': 0.07242910155820195, 'tp_mult': 2.1160186581950113, 'tsl_mult': 0.31899670881773934, 'strategy': 'mean_reversion', 'time_stop': 90, 'use_sma': False, 'use_atr': False, 'use_adx': False, 'use_ema': False, 'use_spike': False, 'rsi_required': True, 'edge_k': 0.4431393031407318, 'edge_cap': 0.8480967259014907, 'bull_strategy': 'breakout', 'bull_bb_std_mult': 1.7456474124503916, 'bull_rsi_os': 20, 'bull_rsi_ob': 63, 'bull_adx_thresh': 33.13276673332964, 'bull_atr_min_pct': 0.0012042197127017959, 'bull_atr_max_pct': 0.1288319811273072, 'bull_tp_mult': 2.5599234602011247, 'bull_tsl_mult': 0.9049863557273994, 'bull_time_stop': 293, 'bull_use_sma': False, 'bull_use_ema': True, 'bull_use_atr': True, 'bull_use_adx': True, 'bull_use_spike': False, 'bull_rsi_required': True, 'bear_strategy': 'breakout', 'bear_bb_std_mult': 1.5863566827772027, 'bear_rsi_os': 13, 'bear_rsi_ob': 48, 'bear_adx_thresh': 18.208478294416565, 'bear_atr_min_pct': 0.004453156260533581, 'bear_atr_max_pct': 0.010031528631191639, 'bear_tp_mult': 1.6718497699103578, 'bear_tsl_mult': 0.6762076250348069, 'bear_time_stop': 228, 'bear_use_sma': False, 'bear_use_ema': True, 'bear_use_atr': False, 'bear_use_adx': False, 'bear_use_spike': False, 'bear_rsi_required': True, 'sideways_strategy': 'mean_reversion', 'sideways_bb_std_mult': 1.341017013080802, 'sideways_rsi_os': 38, 'sideways_rsi_ob': 80, 'sideways_adx_thresh': 33.95355007728949, 'sideways_atr_min_pct': 0.00983029167281016, 'sideways_atr_max_pct': 0.07461738289180113, 'sideways_tp_mult': 2.4383933595099574, 'sideways_tsl_mult': 0.8710354300935751, 'sideways_time_stop': 9, 'sideways_use_sma': True, 'sideways_use_ema': True, 'sideways_use_atr': False, 'sideways_use_adx': True, 'sideways_use_spike': True, 'sideways_rsi_required': False}.
[I 2025-09-01 14:10:28,649] Trial 98 finished with values: [-1000000000.0, 1000000000.0] and parameters: {'p_sma': 26, 'p_std': 10, 'p_atr': 11, 'p_adx': 23, 'rsi_period': 25, 'ema1': 27, 'ema2': 26, 'slip_atr_k': 0.029717715904507794, 'slip_spread_k': 0.5901087661215765, 'spread_hl_frac': 0.02998349310713024, 'bb_std_mult': 3.4929973656476934, 'rsi_os': 11, 'rsi_ob': 85, 'vol_spike': 0.21304934242515455, 'adx_thresh': 27.940936531926475, 'atr_min_pct': 0.004726617300669743, 'atr_max_pct': 0.06703768652828657, 'tp_mult': 1.3093810805424897, 'tsl_mult': 0.2784501244994525, 'strategy': 'mean_reversion', 'time_stop': 104, 'use_sma': False, 'use_atr': False, 'use_adx': False, 'use_ema': False, 'use_spike': False, 'rsi_required': True, 'edge_k': 0.4529321745905508, 'edge_cap': 0.771629729169131, 'bull_strategy': 'breakout', 'bull_bb_std_mult': 1.2239717174853553, 'bull_rsi_os': 8, 'bull_rsi_ob': 63, 'bull_adx_thresh': 13.404007977600052, 'bull_atr_min_pct': 0.019470940780750866, 'bull_atr_max_pct': 0.06491311484846193, 'bull_tp_mult': 2.3184000239663574, 'bull_tsl_mult': 0.8927016902526127, 'bull_time_stop': 283, 'bull_use_sma': False, 'bull_use_ema': True, 'bull_use_atr': True, 'bull_use_adx': True, 'bull_use_spike': False, 'bull_rsi_required': True, 'bear_strategy': 'breakout', 'bear_bb_std_mult': 1.5666889434711802, 'bear_rsi_os': 22, 'bear_rsi_ob': 69, 'bear_adx_thresh': 17.772883812273804, 'bear_atr_min_pct': 0.02607504707472582, 'bear_atr_max_pct': 0.01068497937902872, 'bear_tp_mult': 1.9611480577770233, 'bear_tsl_mult': 0.6475593962560703, 'bear_time_stop': 223, 'bear_use_sma': False, 'bear_use_ema': True, 'bear_use_atr': False, 'bear_use_adx': False, 'bear_use_spike': False, 'bear_rsi_required': True, 'sideways_strategy': 'mean_reversion', 'sideways_bb_std_mult': 1.3348063582330063, 'sideways_rsi_os': 23, 'sideways_rsi_ob': 79, 'sideways_adx_thresh': 32.679953167041596, 'sideways_atr_min_pct': 0.006846000384871332, 'sideways_atr_max_pct': 0.051856963674481324, 'sideways_tp_mult': 2.4630581053379963, 'sideways_tsl_mult': 0.8573280178045107, 'sideways_time_stop': 8, 'sideways_use_sma': True, 'sideways_use_ema': True, 'sideways_use_atr': False, 'sideways_use_adx': True, 'sideways_use_spike': True, 'sideways_rsi_required': False}.
