[I 2025-09-01 15:00:31,628] Trial 413 finished with values: [-1000000000.0, 1000000000.0] and parameters: {'p_sma': 32, 'p_std': 27, 'p_atr': 9, 'p_adx': 15, 'rsi_period': 71, 'ema1': 21, 'ema2': 54, 'slip_atr_k': 0.08969168081565523, 'slip_spread_k': 0.42097172752218986, 'spread_hl_frac': 0.007565322509443541, 'bb_std_mult': 2.8332808368076576, 'rsi_os': 53, 'rsi_ob': 78, 'vol_spike': 0.2741792731140486, 'adx_thresh': 5.733212360814104, 'atr_min_pct': 0.015441245346575724, 'atr_max_pct': 0.1343175357709639, 'tp_mult': 1.9270014179552095, 'tsl_mult': 0.287736236837207, 'strategy': 'breakout', 'time_stop': 24, 'use_sma': False, 'use_atr': True, 'use_adx': False, 'use_ema': True, 'use_spike': False, 'rsi_required': True, 'edge_k': 1.4822620954581966, 'edge_cap': 0.86644208895178, 'bull_strategy': 'mean_reversion', 'bull_bb_std_mult': 1.0945826256148952, 'bull_rsi_os': 51, 'bull_rsi_ob': 64, 'bull_adx_thresh': 5.015181208686103, 'bull_atr_min_pct': 0.01904771765403711, 'bull_atr_max_pct': 0.11947815053546171, 'bull_tp_mult': 1.9512518769217044, 'bull_tsl_mult': 0.07206034331318903, 'bull_time_stop': 108, 'bull_use_sma': False, 'bull_use_ema': False, 'bull_use_atr': False, 'bull_use_adx': True, 'bull_use_spike': True, 'bull_rsi_required': False, 'bear_strategy': 'breakout', 'bear_bb_std_mult': 3.460216123456081, 'bear_rsi_os': 22, 'bear_rsi_ob': 67, 'bear_adx_thresh': 9.732772269724121, 'bear_atr_min_pct': 0.0039558940049028634, 'bear_atr_max_pct': 0.049080350419448894, 'bear_tp_mult': 2.4042469377362594, 'bear_tsl_mult': 0.9935702292974437, 'bear_time_stop': 129, 'bear_use_sma': True, 'bear_use_ema': False, 'bear_use_atr': True, 'bear_use_adx': False, 'bear_use_spike': True, 'bear_rsi_required': True, 'sideways_strategy': 'mean_reversion', 'sideways_bb_std_mult': 2.9720548178672495, 'sideways_rsi_os': 23, 'sideways_rsi_ob': 81, 'sideways_adx_thresh': 11.415045913828124, 'sideways_atr_min_pct': 0.023368712671286797, 'sideways_atr_max_pct': 0.14994098259251012, 'sideways_tp_mult': 1.0770573502264584, 'sideways_tsl_mult': 0.7818835892144855, 'sideways_time_stop': 55, 'sideways_use_sma': True, 'sideways_use_ema': False, 'sideways_use_atr': True, 'sideways_use_adx': True, 'sideways_use_spike': False, 'sideways_rsi_required': True}.
[I 2025-09-01 15:00:32,404] Trial 414 finished with values: [-1000000000.0, 1000000000.0] and parameters: {'p_sma': 29, 'p_std': 27, 'p_atr': 9, 'p_adx': 7, 'rsi_period': 71, 'ema1': 14, 'ema2': 55, 'slip_atr_k': 0.02161519945385275, 'slip_spread_k': 0.07685225059973128, 'spread_hl_frac': 0.007246328877403379, 'bb_std_mult': 2.2099420411712485, 'rsi_os': 42, 'rsi_ob': 52, 'vol_spike': 0.07734149778100671, 'adx_thresh': 28.856153313395982, 'atr_min_pct': 0.01724733738285051, 'atr_max_pct': 0.0664080514639148, 'tp_mult': 1.854418798721186, 'tsl_mult': 0.17218093586270822, 'strategy': 'breakout', 'time_stop': 23, 'use_sma': False, 'use_atr': True, 'use_adx': False, 'use_ema': True, 'use_spike': False, 'rsi_required': True, 'edge_k': 1.5643145245577563, 'edge_cap': 0.8675707258650388, 'bull_strategy': 'mean_reversion', 'bull_bb_std_mult': 1.0848946221604898, 'bull_rsi_os': 23, 'bull_rsi_ob': 72, 'bull_adx_thresh': 28.13290066325827, 'bull_atr_min_pct': 0.015518312154462918, 'bull_atr_max_pct': 0.055498563419076344, 'bull_tp_mult': 2.3701238858254348, 'bull_tsl_mult': 0.057443465011409366, 'bull_time_stop': 131, 'bull_use_sma': False, 'bull_use_ema': False, 'bull_use_atr': False, 'bull_use_adx': True, 'bull_use_spike': True, 'bull_rsi_required': False, 'bear_strategy': 'breakout', 'bear_bb_std_mult': 0.6256939330368796, 'bear_rsi_os': 32, 'bear_rsi_ob': 51, 'bear_adx_thresh': 9.696845116387047, 'bear_atr_min_pct': 0.012046256908601807, 'bear_atr_max_pct': 0.047593056252337965, 'bear_tp_mult': 1.6123030482505496, 'bear_tsl_mult': 0.6961649532074529, 'bear_time_stop': 110, 'bear_use_sma': True, 'bear_use_ema': False, 'bear_use_atr': True, 'bear_use_adx': True, 'bear_use_spike': True, 'bear_rsi_required': True, 'sideways_strategy': 'breakout', 'sideways_bb_std_mult': 0.6248637302095561, 'sideways_rsi_os': 45, 'sideways_rsi_ob': 78, 'sideways_adx_thresh': 33.179589760768216, 'sideways_atr_min_pct': 0.010638846211860235, 'sideways_atr_max_pct': 0.10357554131835042, 'sideways_tp_mult': 2.1325605877488774, 'sideways_tsl_mult': 0.7770306572650458, 'sideways_time_stop': 62, 'sideways_use_sma': False, 'sideways_use_ema': False, 'sideways_use_atr': True, 'sideways_use_adx': True, 'sideways_use_spike': False, 'sideways_rsi_required': True}.
[I 2025-09-01 15:00:33,026] Trial 416 finished with values: [-0.05617365191861157, 0.05563061720392859] and parameters: {'p_sma': 30, 'p_std': 22, 'p_atr': 11, 'p_adx': 14, 'rsi_period': 73, 'ema1': 21, 'ema2': 54, 'slip_atr_k': 0.07389464387448659, 'slip_spread_k': 0.8688851934977049, 'spread_hl_frac': 0.00682619231112188, 'bb_std_mult': 2.1820069319923947, 'rsi_os': 37, 'rsi_ob': 94, 'vol_spike': 0.06843864781134595, 'adx_thresh': 5.741798973597959, 'atr_min_pct': 0.023267036984452594, 'atr_max_pct': 0.06638477014614691, 'tp_mult': 1.9765887873986492, 'tsl_mult': 0.405472794929202, 'strategy': 'breakout', 'time_stop': 185, 'use_sma': False, 'use_atr': True, 'use_adx': False, 'use_ema': True, 'use_spike': False, 'rsi_required': True, 'edge_k': 1.4741223691994745, 'edge_cap': 0.12961439615564252, 'bull_strategy': 'mean_reversion', 'bull_bb_std_mult': 0.8322486626081668, 'bull_rsi_os': 23, 'bull_rsi_ob': 85, 'bull_adx_thresh': 27.963729805296392, 'bull_atr_min_pct': 0.01567634854066472, 'bull_atr_max_pct': 0.06326532028806163, 'bull_tp_mult': 1.9557218857823326, 'bull_tsl_mult': 0.05321249678785732, 'bull_time_stop': 183, 'bull_use_sma': False, 'bull_use_ema': False, 'bull_use_atr': False, 'bull_use_adx': True, 'bull_use_spike': False, 'bull_rsi_required': True, 'bear_strategy': 'breakout', 'bear_bb_std_mult': 0.6342391397608256, 'bear_rsi_os': 52, 'bear_rsi_ob': 53, 'bear_adx_thresh': 9.605305880759946, 'bear_atr_min_pct': 0.003788839066325855, 'bear_atr_max_pct': 0.048545282441617765, 'bear_tp_mult': 2.4200793024546305, 'bear_tsl_mult': 0.6901486498194159, 'bear_time_stop': 244, 'bear_use_sma': True, 'bear_use_ema': False, 'bear_use_atr': True, 'bear_use_adx': False, 'bear_use_spike': True, 'bear_rsi_required': True, 'sideways_strategy': 'mean_reversion', 'sideways_bb_std_mult': 2.5230427911862168, 'sideways_rsi_os': 23, 'sideways_rsi_ob': 90, 'sideways_adx_thresh': 24.85144399520243, 'sideways_atr_min_pct': 0.007415736182126277, 'sideways_atr_max_pct': 0.13358287762453558, 'sideways_tp_mult': 2.3239673141782866, 'sideways_tsl_mult': 0.755807430137523, 'sideways_time_stop': 65, 'sideways_use_sma': True, 'sideways_use_ema': False, 'sideways_use_atr': True, 'sideways_use_adx': True, 'sideways_use_spike': False, 'sideways_rsi_required': True}.
[I 2025-09-01 15:00:34,012] Trial 418 finished with values: [-1000000000.0, 1000000000.0] and parameters: {'p_sma': 56, 'p_std': 22, 'p_atr': 17, 'p_adx': 14, 'rsi_period': 73, 'ema1': 26, 'ema2': 11, 'slip_atr_k': 0.19754490491149074, 'slip_spread_k': 0.40979606544196584, 'spread_hl_frac': 0.0068195961185425575, 'bb_std_mult': 2.1638281860408126, 'rsi_os': 27, 'rsi_ob': 80, 'vol_spike': 0.06927809234626346, 'adx_thresh': 30.04829488583568, 'atr_min_pct': 0.02606739892402391, 'atr_max_pct': 0.012213433618939687, 'tp_mult': 2.6078934472384008, 'tsl_mult': 0.803172940848549, 'strategy': 'breakout', 'time_stop': 30, 'use_sma': False, 'use_atr': True, 'use_adx': True, 'use_ema': True, 'use_spike': False, 'rsi_required': True, 'edge_k': 1.4332677436770316, 'edge_cap': 0.8914686698011745, 'bull_strategy': 'mean_reversion', 'bull_bb_std_mult': 0.8495650405976469, 'bull_rsi_os': 55, 'bull_rsi_ob': 67, 'bull_adx_thresh': 7.264098879926152, 'bull_atr_min_pct': 0.015913326626422506, 'bull_atr_max_pct': 0.0478425647057361, 'bull_tp_mult': 1.5784403881628477, 'bull_tsl_mult': 0.05087139469255942, 'bull_time_stop': 82, 'bull_use_sma': False, 'bull_use_ema': True, 'bull_use_atr': False, 'bull_use_adx': True, 'bull_use_spike': False, 'bull_rsi_required': True, 'bear_strategy': 'breakout', 'bear_bb_std_mult': 0.6370740819169554, 'bear_rsi_os': 10, 'bear_rsi_ob': 51, 'bear_adx_thresh': 28.73404811638276, 'bear_atr_min_pct': 0.009384731329032964, 'bear_atr_max_pct': 0.12282928238791707, 'bear_tp_mult': 1.67008063979054, 'bear_tsl_mult': 0.6841239183394849, 'bear_time_stop': 150, 'bear_use_sma': True, 'bear_use_ema': False, 'bear_use_atr': False, 'bear_use_adx': True, 'bear_use_spike': True, 'bear_rsi_required': True, 'sideways_strategy': 'breakout', 'sideways_bb_std_mult': 1.0145459404429145, 'sideways_rsi_os': 17, 'sideways_rsi_ob': 45, 'sideways_adx_thresh': 33.14951816073835, 'sideways_atr_min_pct': 0.013007123920660342, 'sideways_atr_max_pct': 0.12413726459196728, 'sideways_tp_mult': 2.358254003213527, 'sideways_tsl_mult': 0.751124940067244, 'sideways_time_stop': 65, 'sideways_use_sma': False, 'sideways_use_ema': False, 'sideways_use_atr': True, 'sideways_use_adx': False, 'sideways_use_spike': False, 'sideways_rsi_required': True}.
[I 2025-09-01 15:00:34,192] Trial 420 finished with values: [-1000000000.0, 1000000000.0] and parameters: {'p_sma': 48, 'p_std': 44, 'p_atr': 17, 'p_adx': 13, 'rsi_period': 17, 'ema1': 26, 'ema2': 16, 'slip_atr_k': 0.013837433441682092, 'slip_spread_k': 0.27054697635669933, 'spread_hl_frac': 0.009353828826939112, 'bb_std_mult': 3.3301026353845335, 'rsi_os': 27, 'rsi_ob': 79, 'vol_spike': 0.08855971687616584, 'adx_thresh': 18.775434417789306, 'atr_min_pct': 0.02632766395230955, 'atr_max_pct': 0.012693387386130989, 'tp_mult': 2.611572288169108, 'tsl_mult': 0.3706145004853852, 'strategy': 'mean_reversion', 'time_stop': 32, 'use_sma': True, 'use_atr': True, 'use_adx': True, 'use_ema': True, 'use_spike': False, 'rsi_required': True, 'edge_k': 1.4211894020360059, 'edge_cap': 0.8906168396791284, 'bull_strategy': 'mean_reversion', 'bull_bb_std_mult': 3.199471137989941, 'bull_rsi_os': 55, 'bull_rsi_ob': 67, 'bull_adx_thresh': 30.560090016664915, 'bull_atr_min_pct': 0.01655617671564112, 'bull_atr_max_pct': 0.01580800756187846, 'bull_tp_mult': 2.0854551365770115, 'bull_tsl_mult': 0.11028093055646038, 'bull_time_stop': 82, 'bull_use_sma': False, 'bull_use_ema': True, 'bull_use_atr': True, 'bull_use_adx': False, 'bull_use_spike': False, 'bull_rsi_required': True, 'bear_strategy': 'breakout', 'bear_bb_std_mult': 1.5292156514255686, 'bear_rsi_os': 15, 'bear_rsi_ob': 49, 'bear_adx_thresh': 10.828077410961392, 'bear_atr_min_pct': 0.0046706783673648115, 'bear_atr_max_pct': 0.11689088218193355, 'bear_tp_mult': 1.6799098172556723, 'bear_tsl_mult': 0.03513600937361511, 'bear_time_stop': 139, 'bear_use_sma': True, 'bear_use_ema': False, 'bear_use_atr': False, 'bear_use_adx': False, 'bear_use_spike': True, 'bear_rsi_required': True, 'sideways_strategy': 'mean_reversion', 'sideways_bb_std_mult': 3.33146105984517, 'sideways_rsi_os': 17, 'sideways_rsi_ob': 70, 'sideways_adx_thresh': 5.173394117426593, 'sideways_atr_min_pct': 0.012990752216556016, 'sideways_atr_max_pct': 0.019262805146309382, 'sideways_tp_mult': 2.3667542717353616, 'sideways_tsl_mult': 0.7310420265624875, 'sideways_time_stop': 176, 'sideways_use_sma': True, 'sideways_use_ema': False, 'sideways_use_atr': True, 'sideways_use_adx': False, 'sideways_use_spike': False, 'sideways_rsi_required': True}.
[I 2025-09-01 15:01:10,789] Trial 419 finished with values: [-1000000000.0, 1000000000.0] and parameters: {'p_sma': 48, 'p_std': 23, 'p_atr': 17, 'p_adx': 14, 'rsi_period': 74, 'ema1': 26, 'ema2': 58, 'slip_atr_k': 0.07481099249878416, 'slip_spread_k': 0.7739305386094449, 'spread_hl_frac': 0.006447783625115353, 'bb_std_mult': 2.185755333645982, 'rsi_os': 14, 'rsi_ob': 73, 'vol_spike': 0.2038296994444347, 'adx_thresh': 11.577918242559319, 'atr_min_pct': 0.016352190986414997, 'atr_max_pct': 0.10328020808531406, 'tp_mult': 2.9584729330071156, 'tsl_mult': 0.11767686590692211, 'strategy': 'breakout', 'time_stop': 32, 'use_sma': False, 'use_atr': True, 'use_adx': True, 'use_ema': True, 'use_spike': False, 'rsi_required': True, 'edge_k': 1.4233780938736953, 'edge_cap': 0.8931341399802616, 'bull_strategy': 'mean_reversion', 'bull_bb_std_mult': 0.8466503773026202, 'bull_rsi_os': 23, 'bull_rsi_ob': 67, 'bull_adx_thresh': 26.17086238398883, 'bull_atr_min_pct': 0.01610767765599683, 'bull_atr_max_pct': 0.019380676152574848, 'bull_tp_mult': 1.8550619213910962, 'bull_tsl_mult': 0.2368716239132737, 'bull_time_stop': 172, 'bull_use_sma': False, 'bull_use_ema': True, 'bull_use_atr': False, 'bull_use_adx': True, 'bull_use_spike': False, 'bull_rsi_required': True, 'bear_strategy': 'breakout', 'bear_bb_std_mult': 1.0354042352380681, 'bear_rsi_os': 10, 'bear_rsi_ob': 73, 'bear_adx_thresh': 10.883283952179035, 'bear_atr_min_pct': 0.00972590406534916, 'bear_atr_max_pct': 0.05157673754588023, 'bear_tp_mult': 1.6751325139567697, 'bear_tsl_mult': 0.22762650163142978, 'bear_time_stop': 247, 'bear_use_sma': True, 'bear_use_ema': False, 'bear_use_atr': False, 'bear_use_adx': False, 'bear_use_spike': True, 'bear_rsi_required': True, 'sideways_strategy': 'mean_reversion', 'sideways_bb_std_mult': 3.3203078097376175, 'sideways_rsi_os': 5, 'sideways_rsi_ob': 90, 'sideways_adx_thresh': 5.276901186721004, 'sideways_atr_min_pct': 0.008995121398616999, 'sideways_atr_max_pct': 0.048904314975407315, 'sideways_tp_mult': 1.732607118626796, 'sideways_tsl_mult': 0.360332845817426, 'sideways_time_stop': 65, 'sideways_use_sma': True, 'sideways_use_ema': False, 'sideways_use_atr': True, 'sideways_use_adx': False, 'sideways_use_spike': False, 'sideways_rsi_required': True}.
[I 2025-09-01 15:01:11,556] Trial 417 finished with values: [-1000000000.0, 1000000000.0] and parameters: {'p_sma': 30, 'p_std': 40, 'p_atr': 11, 'p_adx': 14, 'rsi_period': 70, 'ema1': 26, 'ema2': 55, 'slip_atr_k': 0.017282197967011886, 'slip_spread_k': 0.35262716102814173, 'spread_hl_frac': 0.006898094516942831, 'bb_std_mult': 2.23010349290665, 'rsi_os': 38, 'rsi_ob': 57, 'vol_spike': 0.19965808126082946, 'adx_thresh': 11.630126136240051, 'atr_min_pct': 0.022701983128196622, 'atr_max_pct': 0.11601811491760669, 'tp_mult': 2.149522261177802, 'tsl_mult': 0.2802816187617756, 'strategy': 'breakout', 'time_stop': 31, 'use_sma': False, 'use_atr': True, 'use_adx': True, 'use_ema': True, 'use_spike': False, 'rsi_required': True, 'edge_k': 1.563413497997604, 'edge_cap': 0.9024888918638382, 'bull_strategy': 'mean_reversion', 'bull_bb_std_mult': 2.9813273972980476, 'bull_rsi_os': 55, 'bull_rsi_ob': 64, 'bull_adx_thresh': 22.625566426316283, 'bull_atr_min_pct': 0.015803235255934408, 'bull_atr_max_pct': 0.047839251830499155, 'bull_tp_mult': 2.101567663811685, 'bull_tsl_mult': 0.052586143876786735, 'bull_time_stop': 82, 'bull_use_sma': False, 'bull_use_ema': True, 'bull_use_atr': False, 'bull_use_adx': True, 'bull_use_spike': False, 'bull_rsi_required': True, 'bear_strategy': 'breakout', 'bear_bb_std_mult': 0.5990631028337272, 'bear_rsi_os': 10, 'bear_rsi_ob': 53, 'bear_adx_thresh': 28.89645516467672, 'bear_atr_min_pct': 0.009428204568643017, 'bear_atr_max_pct': 0.05198890270786679, 'bear_tp_mult': 2.3934833951925216, 'bear_tsl_mult': 0.22626394482351497, 'bear_time_stop': 243, 'bear_use_sma': True, 'bear_use_ema': False, 'bear_use_atr': False, 'bear_use_adx': False, 'bear_use_spike': True, 'bear_rsi_required': True, 'sideways_strategy': 'mean_reversion', 'sideways_bb_std_mult': 2.5223385593652665, 'sideways_rsi_os': 45, 'sideways_rsi_ob': 80, 'sideways_adx_thresh': 27.02454171027429, 'sideways_atr_min_pct': 0.02327691799079626, 'sideways_atr_max_pct': 0.049670422197208616, 'sideways_tp_mult': 2.3654616636449144, 'sideways_tsl_mult': 0.7563019372592661, 'sideways_time_stop': 62, 'sideways_use_sma': True, 'sideways_use_ema': False, 'sideways_use_atr': True, 'sideways_use_adx': False, 'sideways_use_spike': False, 'sideways_rsi_required': True}.
[I 2025-09-01 15:01:13,635] Trial 422 finished with values: [-1000000000.0, 1000000000.0] and parameters: {'p_sma': 30, 'p_std': 35, 'p_atr': 13, 'p_adx': 15, 'rsi_period': 69, 'ema1': 27, 'ema2': 29, 'slip_atr_k': 0.01755276003632936, 'slip_spread_k': 0.44197989280497324, 'spread_hl_frac': 0.025079136906149588, 'bb_std_mult': 1.0767278414965071, 'rsi_os': 39, 'rsi_ob': 57, 'vol_spike': 0.2341178357341713, 'adx_thresh': 27.773656033405626, 'atr_min_pct': 0.013061715477051669, 'atr_max_pct': 0.07463910679135816, 'tp_mult': 2.066783117054634, 'tsl_mult': 0.9767138750035073, 'strategy': 'breakout', 'time_stop': 34, 'use_sma': False, 'use_atr': True, 'use_adx': False, 'use_ema': True, 'use_spike': False, 'rsi_required': False, 'edge_k': 1.5281847636034254, 'edge_cap': 0.5981341343066064, 'bull_strategy': 'mean_reversion', 'bull_bb_std_mult': 2.321596333928776, 'bull_rsi_os': 25, 'bull_rsi_ob': 65, 'bull_adx_thresh': 22.729587620574442, 'bull_atr_min_pct': 0.017199629359948013, 'bull_atr_max_pct': 0.03549203854132819, 'bull_tp_mult': 1.3993525647238827, 'bull_tsl_mult': 0.025292962475024834, 'bull_time_stop': 166, 'bull_use_sma': True, 'bull_use_ema': True, 'bull_use_atr': False, 'bull_use_adx': True, 'bull_use_spike': False, 'bull_rsi_required': True, 'bear_strategy': 'mean_reversion', 'bear_bb_std_mult': 1.4881864432118659, 'bear_rsi_os': 36, 'bear_rsi_ob': 56, 'bear_adx_thresh': 32.23917862762923, 'bear_atr_min_pct': 0.005665634440998912, 'bear_atr_max_pct': 0.08410671253821095, 'bear_tp_mult': 1.6141927316658828, 'bear_tsl_mult': 0.7897056935784383, 'bear_time_stop': 249, 'bear_use_sma': True, 'bear_use_ema': False, 'bear_use_atr': False, 'bear_use_adx': False, 'bear_use_spike': True, 'bear_rsi_required': False, 'sideways_strategy': 'mean_reversion', 'sideways_bb_std_mult': 1.0918186875421294, 'sideways_rsi_os': 21, 'sideways_rsi_ob': 79, 'sideways_adx_thresh': 22.29073236975784, 'sideways_atr_min_pct': 0.012217038526989044, 'sideways_atr_max_pct': 0.07535509200676395, 'sideways_tp_mult': 2.4143529645249973, 'sideways_tsl_mult': 0.02344684179935863, 'sideways_time_stop': 69, 'sideways_use_sma': True, 'sideways_use_ema': False, 'sideways_use_atr': True, 'sideways_use_adx': True, 'sideways_use_spike': False, 'sideways_rsi_required': True}.
[I 2025-09-01 15:01:14,040] Trial 421 finished with values: [-1000000000.0, 1000000000.0] and parameters: {'p_sma': 40, 'p_std': 24, 'p_atr': 13, 'p_adx': 13, 'rsi_period': 69, 'ema1': 26, 'ema2': 58, 'slip_atr_k': 0.014826041545767095, 'slip_spread_k': 0.8088163541761878, 'spread_hl_frac': 0.009311808225729414, 'bb_std_mult': 2.226404425540972, 'rsi_os': 35, 'rsi_ob': 79, 'vol_spike': 0.23261182308568312, 'adx_thresh': 27.67388295916054, 'atr_min_pct': 0.016203649054697598, 'atr_max_pct': 0.07531516492040924, 'tp_mult': 1.0288482478715202, 'tsl_mult': 0.96002256055372, 'strategy': 'mean_reversion', 'time_stop': 32, 'use_sma': True, 'use_atr': True, 'use_adx': True, 'use_ema': True, 'use_spike': False, 'rsi_required': True, 'edge_k': 1.5443648403048957, 'edge_cap': 0.8983309101851134, 'bull_strategy': 'mean_reversion', 'bull_bb_std_mult': 3.2841092143510164, 'bull_rsi_os': 25, 'bull_rsi_ob': 80, 'bull_adx_thresh': 30.484279992562143, 'bull_atr_min_pct': 0.013901354690499029, 'bull_atr_max_pct': 0.034048709195603585, 'bull_tp_mult': 1.272135384204522, 'bull_tsl_mult': 0.10959034654971411, 'bull_time_stop': 158, 'bull_use_sma': False, 'bull_use_ema': True, 'bull_use_atr': True, 'bull_use_adx': False, 'bull_use_spike': False, 'bull_rsi_required': True, 'bear_strategy': 'mean_reversion', 'bear_bb_std_mult': 1.442962125994591, 'bear_rsi_os': 36, 'bear_rsi_ob': 55, 'bear_adx_thresh': 7.567530171101577, 'bear_atr_min_pct': 0.02889065337696332, 'bear_atr_max_pct': 0.051762686060317906, 'bear_tp_mult': 1.6411731667857323, 'bear_tsl_mult': 0.08364766170475813, 'bear_time_stop': 139, 'bear_use_sma': True, 'bear_use_ema': False, 'bear_use_atr': False, 'bear_use_adx': False, 'bear_use_spike': True, 'bear_rsi_required': True, 'sideways_strategy': 'mean_reversion', 'sideways_bb_std_mult': 1.1024106588491491, 'sideways_rsi_os': 41, 'sideways_rsi_ob': 70, 'sideways_adx_thresh': 32.449861546125014, 'sideways_atr_min_pct': 0.012434330741561733, 'sideways_atr_max_pct': 0.010274355645786423, 'sideways_tp_mult': 2.963600108506593, 'sideways_tsl_mult': 0.38672088224936946, 'sideways_time_stop': 183, 'sideways_use_sma': True, 'sideways_use_ema': False, 'sideways_use_atr': True, 'sideways_use_adx': False, 'sideways_use_spike': False, 'sideways_rsi_required': True}.
