[I 2025-09-01 13:58:04,953] Trial 18 finished with values: [-1000000000.0, 1000000000.0] and parameters: {'p_sma': 13, 'p_std': 17, 'p_atr': 26, 'p_adx': 23, 'rsi_period': 67, 'ema1': 26, 'ema2': 49, 'slip_atr_k': 0.08990349770952508, 'slip_spread_k': 0.2146146252221789, 'spread_hl_frac': 0.03859397659430374, 'bb_std_mult': 2.4475420082975354, 'rsi_os': 38, 'rsi_ob': 95, 'vol_spike': 0.05743572910598803, 'adx_thresh': 10.200973815613683, 'atr_min_pct': 0.029583082564918806, 'atr_max_pct': 0.12143280774707796, 'tp_mult': 1.737010465024625, 'tsl_mult': 0.7878217913475652, 'strategy': 'breakout', 'time_stop': 24, 'use_sma': False, 'use_atr': False, 'use_adx': False, 'use_ema': False, 'use_spike': False, 'rsi_required': True, 'edge_k': 0.39256064739227714, 'edge_cap': 0.8910555171616481, 'bull_strategy': 'breakout', 'bull_bb_std_mult': 0.5140599194022003, 'bull_rsi_os': 55, 'bull_rsi_ob': 54, 'bull_adx_thresh': 28.89098921899157, 'bull_atr_min_pct': 0.00551502196408498, 'bull_atr_max_pct': 0.07824543882632898, 'bull_tp_mult': 2.2330552709329625, 'bull_tsl_mult': 0.4921964015521858, 'bull_time_stop': 194, 'bull_use_sma': False, 'bull_use_ema': True, 'bull_use_atr': False, 'bull_use_adx': True, 'bull_use_spike': False, 'bull_rsi_required': True, 'bear_strategy': 'breakout', 'bear_bb_std_mult': 0.9315181011792641, 'bear_rsi_os': 34, 'bear_rsi_ob': 72, 'bear_adx_thresh': 29.19942007838397, 'bear_atr_min_pct': 0.0010341465596840262, 'bear_atr_max_pct': 0.036947013982768104, 'bear_tp_mult': 1.790995361515388, 'bear_tsl_mult': 0.8010879886386049, 'bear_time_stop': 6, 'bear_use_sma': False, 'bear_use_ema': True, 'bear_use_atr': False, 'bear_use_adx': False, 'bear_use_spike': True, 'bear_rsi_required': True, 'sideways_strategy': 'breakout', 'sideways_bb_std_mult': 1.0755440107726406, 'sideways_rsi_os': 45, 'sideways_rsi_ob': 73, 'sideways_adx_thresh': 30.52911102725517, 'sideways_atr_min_pct': 0.01330106943095734, 'sideways_atr_max_pct': 0.010032265925418483, 'sideways_tp_mult': 2.013004543914172, 'sideways_tsl_mult': 0.8348396147509713, 'sideways_time_stop': 237, 'sideways_use_sma': False, 'sideways_use_ema': True, 'sideways_use_atr': False, 'sideways_use_adx': True, 'sideways_use_spike': True, 'sideways_rsi_required': False}.
[I 2025-09-01 13:58:05,267] Trial 16 finished with values: [-1000000000.0, 0.3769924453923258] and parameters: {'p_sma': 59, 'p_std': 5, 'p_atr': 30, 'p_adx': 30, 'rsi_period': 80, 'ema1': 30, 'ema2': 19, 'slip_atr_k': 0.08149178956531279, 'slip_spread_k': 0.13770142078159592, 'spread_hl_frac': 0.037051957804472124, 'bb_std_mult': 2.6572270094156547, 'rsi_os': 6, 'rsi_ob': 94, 'vol_spike': 0.006916028635154753, 'adx_thresh': 6.815532284253088, 'atr_min_pct': 0.028773087403439777, 'atr_max_pct': 0.14376519653510858, 'tp_mult': 1.7790404090743326, 'tsl_mult': 0.2785045190917262, 'strategy': 'mean_reversion', 'time_stop': 15, 'use_sma': False, 'use_atr': False, 'use_adx': False, 'use_ema': False, 'use_spike': False, 'rsi_required': True, 'edge_k': 1.235637606238557, 'edge_cap': 0.0960114836567113, 'bull_strategy': 'mean_reversion', 'bull_bb_std_mult': 1.762935924455899, 'bull_rsi_os': 55, 'bull_rsi_ob': 51, 'bull_adx_thresh': 6.224264317753185, 'bull_atr_min_pct': 0.0009370403533249267, 'bull_atr_max_pct': 0.14786795837481348, 'bull_tp_mult': 2.183897447287762, 'bull_tsl_mult': 0.5724838642349733, 'bull_time_stop': 28, 'bull_use_sma': False, 'bull_use_ema': False, 'bull_use_atr': True, 'bull_use_adx': True, 'bull_use_spike': False, 'bull_rsi_required': True, 'bear_strategy': 'breakout', 'bear_bb_std_mult': 3.5136928916464276, 'bear_rsi_os': 38, 'bear_rsi_ob': 45, 'bear_adx_thresh': 16.371611853905122, 'bear_atr_min_pct': 0.0005723714386260213, 'bear_atr_max_pct': 0.028358142830094114, 'bear_tp_mult': 2.9480086129623304, 'bear_tsl_mult': 0.06274489473527756, 'bear_time_stop': 252, 'bear_use_sma': True, 'bear_use_ema': True, 'bear_use_atr': False, 'bear_use_adx': False, 'bear_use_spike': True, 'bear_rsi_required': True, 'sideways_strategy': 'breakout', 'sideways_bb_std_mult': 0.5925997309181954, 'sideways_rsi_os': 55, 'sideways_rsi_ob': 46, 'sideways_adx_thresh': 31.799075898751976, 'sideways_atr_min_pct': 5.48421473649599e-06, 'sideways_atr_max_pct': 0.013670191632543682, 'sideways_tp_mult': 1.884448182325651, 'sideways_tsl_mult': 0.9641462378944979, 'sideways_time_stop': 14, 'sideways_use_sma': True, 'sideways_use_ema': True, 'sideways_use_atr': False, 'sideways_use_adx': True, 'sideways_use_spike': True, 'sideways_rsi_required': False}.
[I 2025-09-01 13:58:43,589] Trial 20 finished with values: [-1000000000.0, 1000000000.0] and parameters: {'p_sma': 14, 'p_std': 15, 'p_atr': 26, 'p_adx': 23, 'rsi_period': 74, 'ema1': 27, 'ema2': 45, 'slip_atr_k': 0.06866374586646626, 'slip_spread_k': 0.2600150564077686, 'spread_hl_frac': 0.039733904205679474, 'bb_std_mult': 2.3640507106544297, 'rsi_os': 46, 'rsi_ob': 85, 'vol_spike': 0.06965951962260462, 'adx_thresh': 9.678196360346266, 'atr_min_pct': 0.005058635694370471, 'atr_max_pct': 0.11955366830844674, 'tp_mult': 1.816360472701384, 'tsl_mult': 0.8019738751348465, 'strategy': 'breakout', 'time_stop': 88, 'use_sma': False, 'use_atr': False, 'use_adx': False, 'use_ema': False, 'use_spike': False, 'rsi_required': True, 'edge_k': 1.042650386705838, 'edge_cap': 0.8917187271909273, 'bull_strategy': 'breakout', 'bull_bb_std_mult': 0.5483227306027791, 'bull_rsi_os': 46, 'bull_rsi_ob': 53, 'bull_adx_thresh': 28.496475356918825, 'bull_atr_min_pct': 0.005511034809300602, 'bull_atr_max_pct': 0.07813288946988152, 'bull_tp_mult': 1.0730306842996717, 'bull_tsl_mult': 0.5266706235095561, 'bull_time_stop': 203, 'bull_use_sma': False, 'bull_use_ema': True, 'bull_use_atr': False, 'bull_use_adx': True, 'bull_use_spike': False, 'bull_rsi_required': True, 'bear_strategy': 'breakout', 'bear_bb_std_mult': 0.945038542834957, 'bear_rsi_os': 33, 'bear_rsi_ob': 56, 'bear_adx_thresh': 28.684076959157586, 'bear_atr_min_pct': 0.0012826877635652015, 'bear_atr_max_pct': 0.05365671960585291, 'bear_tp_mult': 2.2045076303380715, 'bear_tsl_mult': 0.8205356937990422, 'bear_time_stop': 247, 'bear_use_sma': False, 'bear_use_ema': True, 'bear_use_atr': False, 'bear_use_adx': False, 'bear_use_spike': True, 'bear_rsi_required': True, 'sideways_strategy': 'breakout', 'sideways_bb_std_mult': 1.2817450111219626, 'sideways_rsi_os': 45, 'sideways_rsi_ob': 73, 'sideways_adx_thresh': 30.427564991130254, 'sideways_atr_min_pct': 0.013143135756448116, 'sideways_atr_max_pct': 0.010896276079101694, 'sideways_tp_mult': 2.5259788600193103, 'sideways_tsl_mult': 0.8069358181641817, 'sideways_time_stop': 221, 'sideways_use_sma': False, 'sideways_use_ema': True, 'sideways_use_atr': False, 'sideways_use_adx': True, 'sideways_use_spike': True, 'sideways_rsi_required': False}.
[I 2025-09-01 13:58:43,814] Trial 22 finished with values: [-1000000000.0, 1000000000.0] and parameters: {'p_sma': 27, 'p_std': 14, 'p_atr': 23, 'p_adx': 29, 'rsi_period': 38, 'ema1': 19, 'ema2': 41, 'slip_atr_k': 0.058041789336998786, 'slip_spread_k': 0.12647965590945004, 'spread_hl_frac': 0.041223764574320775, 'bb_std_mult': 2.0161929930906837, 'rsi_os': 46, 'rsi_ob': 85, 'vol_spike': 0.006018087105439898, 'adx_thresh': 18.331818904328195, 'atr_min_pct': 0.004637597412792861, 'atr_max_pct': 0.08641905717094953, 'tp_mult': 2.387943587589577, 'tsl_mult': 0.5925131321709709, 'strategy': 'breakout', 'time_stop': 97, 'use_sma': False, 'use_atr': False, 'use_adx': False, 'use_ema': False, 'use_spike': False, 'rsi_required': True, 'edge_k': 1.0327782748586936, 'edge_cap': 0.5765997360440442, 'bull_strategy': 'breakout', 'bull_bb_std_mult': 1.7060619552843441, 'bull_rsi_os': 44, 'bull_rsi_ob': 51, 'bull_adx_thresh': 25.695216799213767, 'bull_atr_min_pct': 0.02143324546108454, 'bull_atr_max_pct': 0.05142248577958812, 'bull_tp_mult': 1.061775926116975, 'bull_tsl_mult': 0.7608904169199546, 'bull_time_stop': 124, 'bull_use_sma': False, 'bull_use_ema': True, 'bull_use_atr': False, 'bull_use_adx': True, 'bull_use_spike': False, 'bull_rsi_required': True, 'bear_strategy': 'breakout', 'bear_bb_std_mult': 0.8251393205211206, 'bear_rsi_os': 47, 'bear_rsi_ob': 58, 'bear_adx_thresh': 34.536380316708076, 'bear_atr_min_pct': 0.009702103856977663, 'bear_atr_max_pct': 0.05957681004406761, 'bear_tp_mult': 2.2142591913404086, 'bear_tsl_mult': 0.3428816698869143, 'bear_time_stop': 158, 'bear_use_sma': False, 'bear_use_ema': True, 'bear_use_atr': False, 'bear_use_adx': False, 'bear_use_spike': True, 'bear_rsi_required': True, 'sideways_strategy': 'breakout', 'sideways_bb_std_mult': 1.845345593536299, 'sideways_rsi_os': 18, 'sideways_rsi_ob': 80, 'sideways_adx_thresh': 31.388188647379337, 'sideways_atr_min_pct': 0.020859817083245285, 'sideways_atr_max_pct': 0.02980111670702836, 'sideways_tp_mult': 2.5191324095677716, 'sideways_tsl_mult': 0.47612730453155805, 'sideways_time_stop': 202, 'sideways_use_sma': False, 'sideways_use_ema': True, 'sideways_use_atr': False, 'sideways_use_adx': True, 'sideways_use_spike': True, 'sideways_rsi_required': False}.
[I 2025-09-01 13:58:44,060] Trial 23 finished with values: [-0.008146297113230117, 0.013918687466467513] and parameters: {'p_sma': 30, 'p_std': 12, 'p_atr': 23, 'p_adx': 17, 'rsi_period': 73, 'ema1': 19, 'ema2': 38, 'slip_atr_k': 0.04703483157928041, 'slip_spread_k': 0.36424040378229144, 'spread_hl_frac': 0.03980250161849856, 'bb_std_mult': 2.7307667855561615, 'rsi_os': 46, 'rsi_ob': 85, 'vol_spike': 0.008867604561545755, 'adx_thresh': 20.421823025523636, 'atr_min_pct': 0.004194604451093315, 'atr_max_pct': 0.13365334814212673, 'tp_mult': 2.483793684954239, 'tsl_mult': 0.5644861228406959, 'strategy': 'breakout', 'time_stop': 75, 'use_sma': False, 'use_atr': False, 'use_adx': False, 'use_ema': False, 'use_spike': False, 'rsi_required': True, 'edge_k': 1.138382493377281, 'edge_cap': 0.6113711942574307, 'bull_strategy': 'breakout', 'bull_bb_std_mult': 1.5786906621032115, 'bull_rsi_os': 46, 'bull_rsi_ob': 59, 'bull_adx_thresh': 12.433571608950992, 'bull_atr_min_pct': 0.0045912897365130885, 'bull_atr_max_pct': 0.04650015434663256, 'bull_tp_mult': 1.0593475785149584, 'bull_tsl_mult': 0.3545180642899657, 'bull_time_stop': 108, 'bull_use_sma': False, 'bull_use_ema': True, 'bull_use_atr': False, 'bull_use_adx': True, 'bull_use_spike': False, 'bull_rsi_required': True, 'bear_strategy': 'breakout', 'bear_bb_std_mult': 2.4404578371484975, 'bear_rsi_os': 47, 'bear_rsi_ob': 45, 'bear_adx_thresh': 5.260536567195963, 'bear_atr_min_pct': 0.005490658581241496, 'bear_atr_max_pct': 0.022202141929026302, 'bear_tp_mult': 2.263383141355773, 'bear_tsl_mult': 0.33513259711539634, 'bear_time_stop': 253, 'bear_use_sma': False, 'bear_use_ema': True, 'bear_use_atr': False, 'bear_use_adx': False, 'bear_use_spike': True, 'bear_rsi_required': True, 'sideways_strategy': 'breakout', 'sideways_bb_std_mult': 1.6853397997902697, 'sideways_rsi_os': 19, 'sideways_rsi_ob': 80, 'sideways_adx_thresh': 31.46151061799618, 'sideways_atr_min_pct': 0.019066327040618104, 'sideways_atr_max_pct': 0.03052584284862355, 'sideways_tp_mult': 2.544025413235446, 'sideways_tsl_mult': 0.8686995766602484, 'sideways_time_stop': 198, 'sideways_use_sma': False, 'sideways_use_ema': True, 'sideways_use_atr': False, 'sideways_use_adx': True, 'sideways_use_spike': True, 'sideways_rsi_required': False}.
[I 2025-09-01 13:58:44,184] Trial 21 finished with values: [-1000000000.0, 1000000000.0] and parameters: {'p_sma': 12, 'p_std': 15, 'p_atr': 24, 'p_adx': 28, 'rsi_period': 73, 'ema1': 19, 'ema2': 40, 'slip_atr_k': 0.06291580894100743, 'slip_spread_k': 0.18204056335610252, 'spread_hl_frac': 0.03901302403539324, 'bb_std_mult': 2.8461112768841033, 'rsi_os': 46, 'rsi_ob': 86, 'vol_spike': 0.14335971464612549, 'adx_thresh': 9.822256811331496, 'atr_min_pct': 0.004466103217990378, 'atr_max_pct': 0.11877335991321852, 'tp_mult': 2.4334151379491935, 'tsl_mult': 0.561094940447538, 'strategy': 'breakout', 'time_stop': 91, 'use_sma': False, 'use_atr': False, 'use_adx': False, 'use_ema': False, 'use_spike': False, 'rsi_required': True, 'edge_k': 1.1207154545528386, 'edge_cap': 0.5775939182760736, 'bull_strategy': 'breakout', 'bull_bb_std_mult': 1.6304187975469118, 'bull_rsi_os': 55, 'bull_rsi_ob': 53, 'bull_adx_thresh': 29.74179327474193, 'bull_atr_min_pct': 0.005817593679927392, 'bull_atr_max_pct': 0.05204204856864702, 'bull_tp_mult': 1.5371160714895622, 'bull_tsl_mult': 0.7667044002857593, 'bull_time_stop': 121, 'bull_use_sma': False, 'bull_use_ema': True, 'bull_use_atr': False, 'bull_use_adx': True, 'bull_use_spike': False, 'bull_rsi_required': True, 'bear_strategy': 'breakout', 'bear_bb_std_mult': 0.8816871281034744, 'bear_rsi_os': 48, 'bear_rsi_ob': 58, 'bear_adx_thresh': 27.95828031263517, 'bear_atr_min_pct': 0.006077699959722487, 'bear_atr_max_pct': 0.0576139149101805, 'bear_tp_mult': 2.271193984798544, 'bear_tsl_mult': 0.00378138522534488, 'bear_time_stop': 159, 'bear_use_sma': False, 'bear_use_ema': True, 'bear_use_atr': False, 'bear_use_adx': False, 'bear_use_spike': True, 'bear_rsi_required': True, 'sideways_strategy': 'breakout', 'sideways_bb_std_mult': 1.6563461500034622, 'sideways_rsi_os': 46, 'sideways_rsi_ob': 80, 'sideways_adx_thresh': 30.62287793680205, 'sideways_atr_min_pct': 0.019666120373027576, 'sideways_atr_max_pct': 0.031716571192392046, 'sideways_tp_mult': 2.4678430993944844, 'sideways_tsl_mult': 0.4541490050643345, 'sideways_time_stop': 206, 'sideways_use_sma': False, 'sideways_use_ema': True, 'sideways_use_atr': False, 'sideways_use_adx': True, 'sideways_use_spike': True, 'sideways_rsi_required': False}.
[I 2025-09-01 13:58:44,460] Trial 27 finished with values: [-1000000000.0, 1000000000.0] and parameters: {'p_sma': 26, 'p_std': 30, 'p_atr': 13, 'p_adx': 17, 'rsi_period': 52, 'ema1': 15, 'ema2': 17, 'slip_atr_k': 0.10402164314454415, 'slip_spread_k': 0.3802207237989781, 'spread_hl_frac': 0.03378588386033339, 'bb_std_mult': 2.9478427195384045, 'rsi_os': 55, 'rsi_ob': 76, 'vol_spike': 0.01896916883138484, 'adx_thresh': 20.92059615619977, 'atr_min_pct': 0.010457047497021272, 'atr_max_pct': 0.13718215206607165, 'tp_mult': 2.55589634583119, 'tsl_mult': 0.4681310584551787, 'strategy': 'mean_reversion', 'time_stop': 53, 'use_sma': False, 'use_atr': True, 'use_adx': False, 'use_ema': False, 'use_spike': False, 'rsi_required': True, 'edge_k': 0.8044028096886384, 'edge_cap': 0.4658085899968861, 'bull_strategy': 'mean_reversion', 'bull_bb_std_mult': 1.9247443562276016, 'bull_rsi_os': 31, 'bull_rsi_ob': 60, 'bull_adx_thresh': 12.409817325848946, 'bull_atr_min_pct': 0.029872073104052432, 'bull_atr_max_pct': 0.01590001913391142, 'bull_tp_mult': 1.329407871920724, 'bull_tsl_mult': 0.34753827791109876, 'bull_time_stop': 72, 'bull_use_sma': False, 'bull_use_ema': True, 'bull_use_atr': True, 'bull_use_adx': True, 'bull_use_spike': False, 'bull_rsi_required': True, 'bear_strategy': 'breakout', 'bear_bb_std_mult': 2.5084646386893943, 'bear_rsi_os': 55, 'bear_rsi_ob': 45, 'bear_adx_thresh': 5.853940753823339, 'bear_atr_min_pct': 0.00659939565810596, 'bear_atr_max_pct': 0.021519258409941313, 'bear_tp_mult': 2.4426015024964243, 'bear_tsl_mult': 0.33028432114725204, 'bear_time_stop': 257, 'bear_use_sma': True, 'bear_use_ema': True, 'bear_use_atr': True, 'bear_use_adx': False, 'bear_use_spike': True, 'bear_rsi_required': True, 'sideways_strategy': 'breakout', 'sideways_bb_std_mult': 1.527867413496251, 'sideways_rsi_os': 21, 'sideways_rsi_ob': 89, 'sideways_adx_thresh': 22.835103243923527, 'sideways_atr_min_pct': 0.018408533459761116, 'sideways_atr_max_pct': 0.06904604035616954, 'sideways_tp_mult': 2.688641917228349, 'sideways_tsl_mult': 0.6068348651154416, 'sideways_time_stop': 111, 'sideways_use_sma': False, 'sideways_use_ema': True, 'sideways_use_atr': False, 'sideways_use_adx': True, 'sideways_use_spike': False, 'sideways_rsi_required': False}.
[I 2025-09-01 13:58:44,472] Trial 26 finished with values: [-1000000000.0, 1000000000.0] and parameters: {'p_sma': 26, 'p_std': 34, 'p_atr': 16, 'p_adx': 17, 'rsi_period': 53, 'ema1': 8, 'ema2': 36, 'slip_atr_k': 0.0468902123748082, 'slip_spread_k': 0.38562820062112146, 'spread_hl_frac': 0.0326110456363959, 'bb_std_mult': 2.724206459693842, 'rsi_os': 55, 'rsi_ob': 76, 'vol_spike': 0.02750465166069273, 'adx_thresh': 21.281475476883923, 'atr_min_pct': 0.004044533485016469, 'atr_max_pct': 0.10794800889818118, 'tp_mult': 2.971328192808904, 'tsl_mult': 0.5384738017249341, 'strategy': 'mean_reversion', 'time_stop': 52, 'use_sma': False, 'use_atr': True, 'use_adx': False, 'use_ema': False, 'use_spike': False, 'rsi_required': True, 'edge_k': 1.1601908584623404, 'edge_cap': 0.6356091137467371, 'bull_strategy': 'mean_reversion', 'bull_bb_std_mult': 1.8206850681597344, 'bull_rsi_os': 31, 'bull_rsi_ob': 60, 'bull_adx_thresh': 12.768184312124236, 'bull_atr_min_pct': 0.002988005501886548, 'bull_atr_max_pct': 0.01320596219711629, 'bull_tp_mult': 1.479966481339177, 'bull_tsl_mult': 0.3040516182680308, 'bull_time_stop': 68, 'bull_use_sma': False, 'bull_use_ema': True, 'bull_use_atr': True, 'bull_use_adx': True, 'bull_use_spike': False, 'bull_rsi_required': True, 'bear_strategy': 'breakout', 'bear_bb_std_mult': 2.464473740265124, 'bear_rsi_os': 55, 'bear_rsi_ob': 45, 'bear_adx_thresh': 5.256224759970485, 'bear_atr_min_pct': 0.006909978962735468, 'bear_atr_max_pct': 0.022629991329696994, 'bear_tp_mult': 2.3695507559251343, 'bear_tsl_mult': 0.02606097969037169, 'bear_time_stop': 247, 'bear_use_sma': True, 'bear_use_ema': True, 'bear_use_atr': True, 'bear_use_adx': False, 'bear_use_spike': True, 'bear_rsi_required': True, 'sideways_strategy': 'breakout', 'sideways_bb_std_mult': 1.5670826226016834, 'sideways_rsi_os': 22, 'sideways_rsi_ob': 89, 'sideways_adx_thresh': 22.109448855322892, 'sideways_atr_min_pct': 0.018547582515809652, 'sideways_atr_max_pct': 0.0688176662122447, 'sideways_tp_mult': 2.991362698654245, 'sideways_tsl_mult': 0.5374693448754088, 'sideways_time_stop': 196, 'sideways_use_sma': False, 'sideways_use_ema': True, 'sideways_use_atr': False, 'sideways_use_adx': True, 'sideways_use_spike': False, 'sideways_rsi_required': False}.
[I 2025-09-01 13:59:19,516] Trial 24 finished with values: [-1000000000.0, 1000000000.0] and parameters: {'p_sma': 10, 'p_std': 5, 'p_atr': 29, 'p_adx': 28, 'rsi_period': 74, 'ema1': 14, 'ema2': 54, 'slip_atr_k': 0.11052663109820338, 'slip_spread_k': 0.06828028683703591, 'spread_hl_frac': 0.04252082726082569, 'bb_std_mult': 2.8795439800957814, 'rsi_os': 32, 'rsi_ob': 88, 'vol_spike': 0.14443558167742326, 'adx_thresh': 7.959159503755501, 'atr_min_pct': 0.02085916487255206, 'atr_max_pct': 0.13949015545121785, 'tp_mult': 2.391269523944229, 'tsl_mult': 0.4991155814312323, 'strategy': 'breakout', 'time_stop': 54, 'use_sma': False, 'use_atr': False, 'use_adx': False, 'use_ema': False, 'use_spike': False, 'rsi_required': True, 'edge_k': 1.1733039618332117, 'edge_cap': 0.9738145459548592, 'bull_strategy': 'breakout', 'bull_bb_std_mult': 0.8483667569156492, 'bull_rsi_os': 30, 'bull_rsi_ob': 48, 'bull_adx_thresh': 33.01276980115631, 'bull_atr_min_pct': 0.0032192573921603824, 'bull_atr_max_pct': 0.0905020542332466, 'bull_tp_mult': 1.99981000891707, 'bull_tsl_mult': 0.746938337079672, 'bull_time_stop': 136, 'bull_use_sma': False, 'bull_use_ema': True, 'bull_use_atr': False, 'bull_use_adx': True, 'bull_use_spike': False, 'bull_rsi_required': True, 'bear_strategy': 'breakout', 'bear_bb_std_mult': 0.6202672329187394, 'bear_rsi_os': 44, 'bear_rsi_ob': 46, 'bear_adx_thresh': 33.520887348612064, 'bear_atr_min_pct': 0.005006748530481879, 'bear_atr_max_pct': 0.01964819510149943, 'bear_tp_mult': 1.2413886725366148, 'bear_tsl_mult': 0.002630428381988903, 'bear_time_stop': 164, 'bear_use_sma': False, 'bear_use_ema': True, 'bear_use_atr': False, 'bear_use_adx': False, 'bear_use_spike': True, 'bear_rsi_required': True, 'sideways_strategy': 'breakout', 'sideways_bb_std_mult': 0.933865425274931, 'sideways_rsi_os': 34, 'sideways_rsi_ob': 88, 'sideways_adx_thresh': 32.50585859891897, 'sideways_atr_min_pct': 0.01829431269021151, 'sideways_atr_max_pct': 0.030891335623879364, 'sideways_tp_mult': 2.0409840889596045, 'sideways_tsl_mult': 0.9254161831344513, 'sideways_time_stop': 258, 'sideways_use_sma': False, 'sideways_use_ema': True, 'sideways_use_atr': False, 'sideways_use_adx': True, 'sideways_use_spike': True, 'sideways_rsi_required': False}.
