[I 2025-09-01 14:10:28,686] Trial 101 finished with values: [-1000000000.0, 1000000000.0] and parameters: {'p_sma': 41, 'p_std': 10, 'p_atr': 11, 'p_adx': 17, 'rsi_period': 24, 'ema1': 30, 'ema2': 54, 'slip_atr_k': 0.04379923613584913, 'slip_spread_k': 0.5915269560084072, 'spread_hl_frac': 0.04066901771742137, 'bb_std_mult': 0.8695714700075847, 'rsi_os': 33, 'rsi_ob': 84, 'vol_spike': 0.16281357450964584, 'adx_thresh': 25.63517428803841, 'atr_min_pct': 0.005078520916374427, 'atr_max_pct': 0.06422256844689475, 'tp_mult': 1.2611127816323704, 'tsl_mult': 0.05904294324679343, 'strategy': 'breakout', 'time_stop': 141, 'use_sma': True, 'use_atr': True, 'use_adx': True, 'use_ema': True, 'use_spike': False, 'rsi_required': False, 'edge_k': 0.5481388085535422, 'edge_cap': 0.3622614423391654, 'bull_strategy': 'breakout', 'bull_bb_std_mult': 1.5387152813722564, 'bull_rsi_os': 17, 'bull_rsi_ob': 76, 'bull_adx_thresh': 30.86702802810958, 'bull_atr_min_pct': 0.016571022843944752, 'bull_atr_max_pct': 0.06386265598897116, 'bull_tp_mult': 1.4126835920901595, 'bull_tsl_mult': 0.9417659535765776, 'bull_time_stop': 268, 'bull_use_sma': False, 'bull_use_ema': True, 'bull_use_atr': False, 'bull_use_adx': False, 'bull_use_spike': True, 'bull_rsi_required': True, 'bear_strategy': 'mean_reversion', 'bear_bb_std_mult': 2.282004538049788, 'bear_rsi_os': 54, 'bear_rsi_ob': 89, 'bear_adx_thresh': 5.914040656014487, 'bear_atr_min_pct': 0.026333463426393783, 'bear_atr_max_pct': 0.11772590542774614, 'bear_tp_mult': 1.5294716981750345, 'bear_tsl_mult': 0.7257769079689337, 'bear_time_stop': 100, 'bear_use_sma': True, 'bear_use_ema': True, 'bear_use_atr': False, 'bear_use_adx': True, 'bear_use_spike': False, 'bear_rsi_required': False, 'sideways_strategy': 'mean_reversion', 'sideways_bb_std_mult': 1.2509630156814846, 'sideways_rsi_os': 29, 'sideways_rsi_ob': 83, 'sideways_adx_thresh': 21.324151703566308, 'sideways_atr_min_pct': 0.007843127255251936, 'sideways_atr_max_pct': 0.04952642729824585, 'sideways_tp_mult': 2.82459425835511, 'sideways_tsl_mult': 0.823788170947185, 'sideways_time_stop': 29, 'sideways_use_sma': True, 'sideways_use_ema': True, 'sideways_use_atr': False, 'sideways_use_adx': False, 'sideways_use_spike': True, 'sideways_rsi_required': False}.
[I 2025-09-01 14:10:29,115] Trial 99 finished with values: [-0.03321371349754321, 0.03308167275244938] and parameters: {'p_sma': 26, 'p_std': 17, 'p_atr': 9, 'p_adx': 15, 'rsi_period': 70, 'ema1': 27, 'ema2': 44, 'slip_atr_k': 0.04141477551019347, 'slip_spread_k': 0.4486549575600215, 'spread_hl_frac': 0.04081419521795192, 'bb_std_mult': 1.6084805169247272, 'rsi_os': 14, 'rsi_ob': 85, 'vol_spike': 0.05569053386003964, 'adx_thresh': 23.73499283969726, 'atr_min_pct': 0.005038277965643146, 'atr_max_pct': 0.06564437799248875, 'tp_mult': 1.281120157495132, 'tsl_mult': 0.2814361136193556, 'strategy': 'breakout', 'time_stop': 91, 'use_sma': False, 'use_atr': False, 'use_adx': False, 'use_ema': False, 'use_spike': False, 'rsi_required': True, 'edge_k': 0.55806248538641, 'edge_cap': 0.05103956421275363, 'bull_strategy': 'breakout', 'bull_bb_std_mult': 1.5320383000639861, 'bull_rsi_os': 8, 'bull_rsi_ob': 77, 'bull_adx_thresh': 17.255195862990384, 'bull_atr_min_pct': 0.0010892007247256252, 'bull_atr_max_pct': 0.053777459033725945, 'bull_tp_mult': 1.4134391177784957, 'bull_tsl_mult': 0.7394544694400118, 'bull_time_stop': 285, 'bull_use_sma': False, 'bull_use_ema': True, 'bull_use_atr': False, 'bull_use_adx': False, 'bull_use_spike': False, 'bull_rsi_required': True, 'bear_strategy': 'mean_reversion', 'bear_bb_std_mult': 1.2864278001493972, 'bear_rsi_os': 23, 'bear_rsi_ob': 63, 'bear_adx_thresh': 18.056566866265953, 'bear_atr_min_pct': 0.005101625305201411, 'bear_atr_max_pct': 0.13163911507994072, 'bear_tp_mult': 1.6724372373566294, 'bear_tsl_mult': 0.7218929073121414, 'bear_time_stop': 99, 'bear_use_sma': False, 'bear_use_ema': True, 'bear_use_atr': False, 'bear_use_adx': False, 'bear_use_spike': False, 'bear_rsi_required': True, 'sideways_strategy': 'mean_reversion', 'sideways_bb_std_mult': 2.90987344165853, 'sideways_rsi_os': 23, 'sideways_rsi_ob': 75, 'sideways_adx_thresh': 32.33452880182964, 'sideways_atr_min_pct': 0.02045457525116803, 'sideways_atr_max_pct': 0.09453745161043033, 'sideways_tp_mult': 2.84230178337266, 'sideways_tsl_mult': 0.8211832385345985, 'sideways_time_stop': 61, 'sideways_use_sma': True, 'sideways_use_ema': True, 'sideways_use_atr': False, 'sideways_use_adx': False, 'sideways_use_spike': True, 'sideways_rsi_required': False}.
[I 2025-09-01 14:10:29,382] Trial 100 finished with values: [-0.03176534094409833, 0.03163554330925592] and parameters: {'p_sma': 30, 'p_std': 17, 'p_atr': 11, 'p_adx': 17, 'rsi_period': 79, 'ema1': 30, 'ema2': 44, 'slip_atr_k': 0.041519427886620525, 'slip_spread_k': 0.10247086136435746, 'spread_hl_frac': 0.002917061719898424, 'bb_std_mult': 2.4321913675748084, 'rsi_os': 33, 'rsi_ob': 85, 'vol_spike': 0.052737561984086787, 'adx_thresh': 23.92159699124454, 'atr_min_pct': 0.004618311073920493, 'atr_max_pct': 0.06681350615267875, 'tp_mult': 1.4446745617215737, 'tsl_mult': 0.2896755254129427, 'strategy': 'breakout', 'time_stop': 27, 'use_sma': False, 'use_atr': False, 'use_adx': False, 'use_ema': False, 'use_spike': False, 'rsi_required': False, 'edge_k': 0.8097674994258734, 'edge_cap': 0.3190095967185566, 'bull_strategy': 'breakout', 'bull_bb_std_mult': 1.5493640984764252, 'bull_rsi_os': 9, 'bull_rsi_ob': 77, 'bull_adx_thresh': 16.987655698195606, 'bull_atr_min_pct': 0.0009884990833147404, 'bull_atr_max_pct': 0.06592693213350716, 'bull_tp_mult': 1.3982741219629236, 'bull_tsl_mult': 0.9274008747934918, 'bull_time_stop': 36, 'bull_use_sma': False, 'bull_use_ema': True, 'bull_use_atr': False, 'bull_use_adx': False, 'bull_use_spike': False, 'bull_rsi_required': True, 'bear_strategy': 'mean_reversion', 'bear_bb_std_mult': 2.2848706213315246, 'bear_rsi_os': 7, 'bear_rsi_ob': 69, 'bear_adx_thresh': 17.79368503023734, 'bear_atr_min_pct': 0.025806531800683055, 'bear_atr_max_pct': 0.13588383474234145, 'bear_tp_mult': 1.8381214392968248, 'bear_tsl_mult': 0.7434621705635204, 'bear_time_stop': 231, 'bear_use_sma': False, 'bear_use_ema': True, 'bear_use_atr': False, 'bear_use_adx': True, 'bear_use_spike': False, 'bear_rsi_required': False, 'sideways_strategy': 'mean_reversion', 'sideways_bb_std_mult': 1.2525048526525877, 'sideways_rsi_os': 35, 'sideways_rsi_ob': 73, 'sideways_adx_thresh': 21.15297279645351, 'sideways_atr_min_pct': 0.00824100530418925, 'sideways_atr_max_pct': 0.07720726574936164, 'sideways_tp_mult': 2.832405293415989, 'sideways_tsl_mult': 0.827633611580619, 'sideways_time_stop': 27, 'sideways_use_sma': True, 'sideways_use_ema': True, 'sideways_use_atr': False, 'sideways_use_adx': False, 'sideways_use_spike': True, 'sideways_rsi_required': False}.
[I 2025-09-01 14:11:12,931] Trial 105 finished with values: [-1000000000.0, 1000000000.0] and parameters: {'p_sma': 28, 'p_std': 12, 'p_atr': 9, 'p_adx': 14, 'rsi_period': 70, 'ema1': 28, 'ema2': 12, 'slip_atr_k': 0.01773286171665056, 'slip_spread_k': 0.5358940159871902, 'spread_hl_frac': 0.04264967286652165, 'bb_std_mult': 2.339536027487734, 'rsi_os': 7, 'rsi_ob': 80, 'vol_spike': 0.023023591562187272, 'adx_thresh': 24.68829410840513, 'atr_min_pct': 0.007311853096292416, 'atr_max_pct': 0.051292315365073685, 'tp_mult': 1.4660618748398218, 'tsl_mult': 0.4934552134918085, 'strategy': 'breakout', 'time_stop': 299, 'use_sma': False, 'use_atr': False, 'use_adx': False, 'use_ema': False, 'use_spike': True, 'rsi_required': False, 'edge_k': 0.5367849032996677, 'edge_cap': 0.31005391887604594, 'bull_strategy': 'mean_reversion', 'bull_bb_std_mult': 1.391136266889407, 'bull_rsi_os': 6, 'bull_rsi_ob': 78, 'bull_adx_thresh': 34.852960387837605, 'bull_atr_min_pct': 0.021109325141286737, 'bull_atr_max_pct': 0.08092235722780985, 'bull_tp_mult': 1.5068934463506898, 'bull_tsl_mult': 0.8370655651134882, 'bull_time_stop': 13, 'bull_use_sma': False, 'bull_use_ema': True, 'bull_use_atr': False, 'bull_use_adx': False, 'bull_use_spike': False, 'bull_rsi_required': False, 'bear_strategy': 'mean_reversion', 'bear_bb_std_mult': 2.057578511387788, 'bear_rsi_os': 8, 'bear_rsi_ob': 74, 'bear_adx_thresh': 33.43097797890091, 'bear_atr_min_pct': 0.005354762433806274, 'bear_atr_max_pct': 0.1316437723828414, 'bear_tp_mult': 1.8182856501198583, 'bear_tsl_mult': 0.5749386785931415, 'bear_time_stop': 264, 'bear_use_sma': False, 'bear_use_ema': True, 'bear_use_atr': True, 'bear_use_adx': False, 'bear_use_spike': False, 'bear_rsi_required': False, 'sideways_strategy': 'mean_reversion', 'sideways_bb_std_mult': 2.9127778711309413, 'sideways_rsi_os': 36, 'sideways_rsi_ob': 77, 'sideways_adx_thresh': 23.078108547150467, 'sideways_atr_min_pct': 0.02048512204663538, 'sideways_atr_max_pct': 0.033996795355404834, 'sideways_tp_mult': 1.9690236213668375, 'sideways_tsl_mult': 0.9353457411926787, 'sideways_time_stop': 134, 'sideways_use_sma': True, 'sideways_use_ema': True, 'sideways_use_atr': True, 'sideways_use_adx': False, 'sideways_use_spike': True, 'sideways_rsi_required': True}.
[I 2025-09-01 14:11:13,302] Trial 102 finished with values: [-0.03839694182427844, 0.03817944915155774] and parameters: {'p_sma': 30, 'p_std': 7, 'p_atr': 9, 'p_adx': 15, 'rsi_period': 12, 'ema1': 7, 'ema2': 12, 'slip_atr_k': 0.02194349319375823, 'slip_spread_k': 0.32819290194462597, 'spread_hl_frac': 0.04258023030968989, 'bb_std_mult': 2.331408942398587, 'rsi_os': 16, 'rsi_ob': 80, 'vol_spike': 0.08941847595213173, 'adx_thresh': 8.817723285071626, 'atr_min_pct': 0.007353288531991596, 'atr_max_pct': 0.02664512320203949, 'tp_mult': 2.0009216285345093, 'tsl_mult': 0.5061315547844851, 'strategy': 'breakout', 'time_stop': 219, 'use_sma': False, 'use_atr': False, 'use_adx': False, 'use_ema': False, 'use_spike': False, 'rsi_required': True, 'edge_k': 0.8000828581392891, 'edge_cap': 0.3005443947003961, 'bull_strategy': 'breakout', 'bull_bb_std_mult': 1.3960819388331083, 'bull_rsi_os': 24, 'bull_rsi_ob': 52, 'bull_adx_thresh': 17.260261303809045, 'bull_atr_min_pct': 0.0024984386168384574, 'bull_atr_max_pct': 0.05309773371777446, 'bull_tp_mult': 2.777932033000549, 'bull_tsl_mult': 0.7386292085753922, 'bull_time_stop': 35, 'bull_use_sma': False, 'bull_use_ema': True, 'bull_use_atr': False, 'bull_use_adx': False, 'bull_use_spike': False, 'bull_rsi_required': False, 'bear_strategy': 'mean_reversion', 'bear_bb_std_mult': 2.0395304847251543, 'bear_rsi_os': 25, 'bear_rsi_ob': 63, 'bear_adx_thresh': 33.45255188116913, 'bear_atr_min_pct': 0.001120965645021343, 'bear_atr_max_pct': 0.13180174203018197, 'bear_tp_mult': 1.8241484638348624, 'bear_tsl_mult': 0.546234989716678, 'bear_time_stop': 269, 'bear_use_sma': False, 'bear_use_ema': True, 'bear_use_atr': True, 'bear_use_adx': False, 'bear_use_spike': False, 'bear_rsi_required': True, 'sideways_strategy': 'mean_reversion', 'sideways_bb_std_mult': 2.838799952149112, 'sideways_rsi_os': 31, 'sideways_rsi_ob': 73, 'sideways_adx_thresh': 31.837290946354308, 'sideways_atr_min_pct': 0.020337080006509082, 'sideways_atr_max_pct': 0.12405080092774104, 'sideways_tp_mult': 1.8456519949624968, 'sideways_tsl_mult': 0.8966640146987316, 'sideways_time_stop': 131, 'sideways_use_sma': True, 'sideways_use_ema': True, 'sideways_use_atr': True, 'sideways_use_adx': False, 'sideways_use_spike': True, 'sideways_rsi_required': True}.
[I 2025-09-01 14:11:15,449] Trial 104 finished with values: [-0.02982209745486819, 0.031016632288901533] and parameters: {'p_sma': 28, 'p_std': 57, 'p_atr': 9, 'p_adx': 14, 'rsi_period': 73, 'ema1': 9, 'ema2': 14, 'slip_atr_k': 0.019584759663503745, 'slip_spread_k': 0.453472307890329, 'spread_hl_frac': 0.04274163805119419, 'bb_std_mult': 1.589803375092845, 'rsi_os': 7, 'rsi_ob': 80, 'vol_spike': 0.02265318352508161, 'adx_thresh': 24.83906737056323, 'atr_min_pct': 0.009544013539409757, 'atr_max_pct': 0.028453198668075302, 'tp_mult': 1.4869651495358194, 'tsl_mult': 0.9200551634609049, 'strategy': 'breakout', 'time_stop': 219, 'use_sma': False, 'use_atr': False, 'use_adx': False, 'use_ema': False, 'use_spike': False, 'rsi_required': True, 'edge_k': 0.5746696048596791, 'edge_cap': 0.057039346945411296, 'bull_strategy': 'breakout', 'bull_bb_std_mult': 2.5082853098163542, 'bull_rsi_os': 6, 'bull_rsi_ob': 91, 'bull_adx_thresh': 22.983663285465415, 'bull_atr_min_pct': 0.0024123622965757066, 'bull_atr_max_pct': 0.05466845405532139, 'bull_tp_mult': 1.1408722139083174, 'bull_tsl_mult': 0.0038359940172889573, 'bull_time_stop': 11, 'bull_use_sma': False, 'bull_use_ema': True, 'bull_use_atr': False, 'bull_use_adx': False, 'bull_use_spike': False, 'bull_rsi_required': True, 'bear_strategy': 'breakout', 'bear_bb_std_mult': 2.029451979810671, 'bear_rsi_os': 52, 'bear_rsi_ob': 74, 'bear_adx_thresh': 6.800330162145289, 'bear_atr_min_pct': 0.005361584764155136, 'bear_atr_max_pct': 0.017809926034151283, 'bear_tp_mult': 1.8150081368170077, 'bear_tsl_mult': 0.5426269320039013, 'bear_time_stop': 271, 'bear_use_sma': False, 'bear_use_ema': True, 'bear_use_atr': False, 'bear_use_adx': False, 'bear_use_spike': False, 'bear_rsi_required': True, 'sideways_strategy': 'mean_reversion', 'sideways_bb_std_mult': 2.8958845177080614, 'sideways_rsi_os': 8, 'sideways_rsi_ob': 75, 'sideways_adx_thresh': 32.107259326819346, 'sideways_atr_min_pct': 0.013614949092134681, 'sideways_atr_max_pct': 0.09697149030877505, 'sideways_tp_mult': 2.6836218676547503, 'sideways_tsl_mult': 0.12443239471371143, 'sideways_time_stop': 162, 'sideways_use_sma': True, 'sideways_use_ema': True, 'sideways_use_atr': True, 'sideways_use_adx': True, 'sideways_use_spike': True, 'sideways_rsi_required': True}.
[I 2025-09-01 14:11:15,513] Trial 103 finished with values: [-1000000000.0, 1000000000.0] and parameters: {'p_sma': 30, 'p_std': 12, 'p_atr': 9, 'p_adx': 15, 'rsi_period': 12, 'ema1': 7, 'ema2': 13, 'slip_atr_k': 0.018511789946914436, 'slip_spread_k': 0.4506823065967623, 'spread_hl_frac': 0.035254305126228645, 'bb_std_mult': 2.33622786831011, 'rsi_os': 16, 'rsi_ob': 80, 'vol_spike': 0.05432567055187884, 'adx_thresh': 9.107514902442594, 'atr_min_pct': 0.009392994382310935, 'atr_max_pct': 0.05234581002372694, 'tp_mult': 1.8009228803871704, 'tsl_mult': 0.5066383039968299, 'strategy': 'breakout', 'time_stop': 80, 'use_sma': False, 'use_atr': False, 'use_adx': False, 'use_ema': False, 'use_spike': False, 'rsi_required': True, 'edge_k': 0.8464695397177472, 'edge_cap': 0.07576828552371778, 'bull_strategy': 'breakout', 'bull_bb_std_mult': 2.609260407888773, 'bull_rsi_os': 24, 'bull_rsi_ob': 92, 'bull_adx_thresh': 17.139440268068707, 'bull_atr_min_pct': 0.028931780775802288, 'bull_atr_max_pct': 0.05299250726265098, 'bull_tp_mult': 1.5226530368233908, 'bull_tsl_mult': 0.010846678039957591, 'bull_time_stop': 26, 'bull_use_sma': False, 'bull_use_ema': True, 'bull_use_atr': False, 'bull_use_adx': False, 'bull_use_spike': False, 'bull_rsi_required': False, 'bear_strategy': 'mean_reversion', 'bear_bb_std_mult': 0.5535711562422692, 'bear_rsi_os': 8, 'bear_rsi_ob': 45, 'bear_adx_thresh': 9.044713660303835, 'bear_atr_min_pct': 0.002748062252698878, 'bear_atr_max_pct': 0.040583740418055216, 'bear_tp_mult': 1.8262160245612256, 'bear_tsl_mult': 0.5472586298274189, 'bear_time_stop': 270, 'bear_use_sma': False, 'bear_use_ema': True, 'bear_use_atr': True, 'bear_use_adx': False, 'bear_use_spike': False, 'bear_rsi_required': True, 'sideways_strategy': 'mean_reversion', 'sideways_bb_std_mult': 1.5563225658944622, 'sideways_rsi_os': 31, 'sideways_rsi_ob': 85, 'sideways_adx_thresh': 32.16100876875071, 'sideways_atr_min_pct': 0.020012038491400506, 'sideways_atr_max_pct': 0.12464783237447746, 'sideways_tp_mult': 1.653212777264296, 'sideways_tsl_mult': 0.8184195036595645, 'sideways_time_stop': 162, 'sideways_use_sma': True, 'sideways_use_ema': True, 'sideways_use_atr': True, 'sideways_use_adx': False, 'sideways_use_spike': True, 'sideways_rsi_required': True}.
[I 2025-09-01 14:11:59,897] Trial 108 finished with values: [-0.11439963625161254, 0.11396690411546474] and parameters: {'p_sma': 55, 'p_std': 12, 'p_atr': 17, 'p_adx': 13, 'rsi_period': 79, 'ema1': 10, 'ema2': 38, 'slip_atr_k': 0.18331612235798583, 'slip_spread_k': 0.0332954319499964, 'spread_hl_frac': 0.03877319245978193, 'bb_std_mult': 2.4173896210954346, 'rsi_os': 18, 'rsi_ob': 82, 'vol_spike': 0.007187217718506114, 'adx_thresh': 26.976680279327937, 'atr_min_pct': 0.009433812675810822, 'atr_max_pct': 0.059750443524848, 'tp_mult': 1.795819019618087, 'tsl_mult': 0.5475690945027858, 'strategy': 'breakout', 'time_stop': 259, 'use_sma': True, 'use_atr': True, 'use_adx': True, 'use_ema': True, 'use_spike': False, 'rsi_required': True, 'edge_k': 0.3632856985665175, 'edge_cap': 0.9332522254696702, 'bull_strategy': 'breakout', 'bull_bb_std_mult': 0.5980961908926747, 'bull_rsi_os': 12, 'bull_rsi_ob': 80, 'bull_adx_thresh': 29.228224925650967, 'bull_atr_min_pct': 0.004666281072856907, 'bull_atr_max_pct': 0.03759552588015208, 'bull_tp_mult': 1.6115756049985421, 'bull_tsl_mult': 0.023254349355197157, 'bull_time_stop': 24, 'bull_use_sma': True, 'bull_use_ema': True, 'bull_use_atr': False, 'bull_use_adx': True, 'bull_use_spike': True, 'bull_rsi_required': True, 'bear_strategy': 'breakout', 'bear_bb_std_mult': 2.191802612335872, 'bear_rsi_os': 52, 'bear_rsi_ob': 47, 'bear_adx_thresh': 6.5528400371496165, 'bear_atr_min_pct': 0.0033931876308979404, 'bear_atr_max_pct': 0.14282088376352403, 'bear_tp_mult': 2.9922106134565603, 'bear_tsl_mult': 0.6168219846562895, 'bear_time_stop': 74, 'bear_use_sma': True, 'bear_use_ema': True, 'bear_use_atr': False, 'bear_use_adx': True, 'bear_use_spike': False, 'bear_rsi_required': True, 'sideways_strategy': 'mean_reversion', 'sideways_bb_std_mult': 1.561585699299132, 'sideways_rsi_os': 33, 'sideways_rsi_ob': 47, 'sideways_adx_thresh': 34.91533957935176, 'sideways_atr_min_pct': 0.01381219721763726, 'sideways_atr_max_pct': 0.023257420235184303, 'sideways_tp_mult': 1.2487088808935078, 'sideways_tsl_mult': 0.10932951003443486, 'sideways_time_stop': 161, 'sideways_use_sma': True, 'sideways_use_ema': True, 'sideways_use_atr': False, 'sideways_use_adx': True, 'sideways_use_spike': True, 'sideways_rsi_required': False}.
[I 2025-09-01 14:11:59,899] Trial 107 finished with values: [-1000000000.0, 1000000000.0] and parameters: {'p_sma': 54, 'p_std': 12, 'p_atr': 18, 'p_adx': 18, 'rsi_period': 73, 'ema1': 24, 'ema2': 38, 'slip_atr_k': 0.038477936506571525, 'slip_spread_k': 0.02586228377869365, 'spread_hl_frac': 0.026384572930344866, 'bb_std_mult': 2.4468501313925213, 'rsi_os': 8, 'rsi_ob': 84, 'vol_spike': 0.05956403705842342, 'adx_thresh': 34.24365376775779, 'atr_min_pct': 0.02298315396571663, 'atr_max_pct': 0.06836679848485047, 'tp_mult': 2.919467113086003, 'tsl_mult': 0.5555746396322863, 'strategy': 'breakout', 'time_stop': 78, 'use_sma': False, 'use_atr': True, 'use_adx': True, 'use_ema': True, 'use_spike': False, 'rsi_required': True, 'edge_k': 0.39680670596771506, 'edge_cap': 0.09433163300831165, 'bull_strategy': 'breakout', 'bull_bb_std_mult': 2.5283312198653847, 'bull_rsi_os': 11, 'bull_rsi_ob': 67, 'bull_adx_thresh': 12.30253977536994, 'bull_atr_min_pct': 0.02899520162072914, 'bull_atr_max_pct': 0.027378556282213307, 'bull_tp_mult': 2.439599893641086, 'bull_tsl_mult': 0.8052431337329337, 'bull_time_stop': 27, 'bull_use_sma': False, 'bull_use_ema': True, 'bull_use_atr': False, 'bull_use_adx': True, 'bull_use_spike': True, 'bull_rsi_required': True, 'bear_strategy': 'breakout', 'bear_bb_std_mult': 2.2151694770939248, 'bear_rsi_os': 52, 'bear_rsi_ob': 45, 'bear_adx_thresh': 6.6317416747469675, 'bear_atr_min_pct': 0.01851635223509069, 'bear_atr_max_pct': 0.01898339547999893, 'bear_tp_mult': 1.5750750194157574, 'bear_tsl_mult': 0.6219974089542493, 'bear_time_stop': 250, 'bear_use_sma': True, 'bear_use_ema': True, 'bear_use_atr': False, 'bear_use_adx': True, 'bear_use_spike': False, 'bear_rsi_required': True, 'sideways_strategy': 'mean_reversion', 'sideways_bb_std_mult': 1.4841692054226514, 'sideways_rsi_os': 33, 'sideways_rsi_ob': 75, 'sideways_adx_thresh': 6.787486872449605, 'sideways_atr_min_pct': 0.004601089269153038, 'sideways_atr_max_pct': 0.04587544487787717, 'sideways_tp_mult': 1.72668152135158, 'sideways_tsl_mult': 0.19007452458186702, 'sideways_time_stop': 251, 'sideways_use_sma': True, 'sideways_use_ema': True, 'sideways_use_atr': False, 'sideways_use_adx': True, 'sideways_use_spike': True, 'sideways_rsi_required': False}.
