[I 2025-09-01 15:15:01,209] Trial 513 finished with values: [-1000000000.0, 1000000000.0] and parameters: {'p_sma': 31, 'p_std': 25, 'p_atr': 11, 'p_adx': 14, 'rsi_period': 26, 'ema1': 7, 'ema2': 54, 'slip_atr_k': 0.23208468108036667, 'slip_spread_k': 0.06290867018102575, 'spread_hl_frac': 0.0031297435360439253, 'bb_std_mult': 2.0191809173665654, 'rsi_os': 31, 'rsi_ob': 79, 'vol_spike': 0.15229994283940732, 'adx_thresh': 27.08030330415769, 'atr_min_pct': 0.017595408648548867, 'atr_max_pct': 0.14995409617738414, 'tp_mult': 1.5415600466685768, 'tsl_mult': 0.12430545732336268, 'strategy': 'breakout', 'time_stop': 41, 'use_sma': False, 'use_atr': True, 'use_adx': False, 'use_ema': True, 'use_spike': False, 'rsi_required': True, 'edge_k': 0.1005505496700787, 'edge_cap': 0.8870996796495775, 'bull_strategy': 'mean_reversion', 'bull_bb_std_mult': 0.8824882071176505, 'bull_rsi_os': 25, 'bull_rsi_ob': 65, 'bull_adx_thresh': 30.813141177501784, 'bull_atr_min_pct': 0.024854755753185062, 'bull_atr_max_pct': 0.10370518738176746, 'bull_tp_mult': 2.595487942792123, 'bull_tsl_mult': 0.038753964838574684, 'bull_time_stop': 136, 'bull_use_sma': True, 'bull_use_ema': True, 'bull_use_atr': False, 'bull_use_adx': True, 'bull_use_spike': False, 'bull_rsi_required': False, 'bear_strategy': 'breakout', 'bear_bb_std_mult': 3.3697961965518695, 'bear_rsi_os': 25, 'bear_rsi_ob': 50, 'bear_adx_thresh': 7.347114101998581, 'bear_atr_min_pct': 0.013532247394890734, 'bear_atr_max_pct': 0.052081678109156294, 'bear_tp_mult': 1.1259267088765679, 'bear_tsl_mult': 0.7447786557476574, 'bear_time_stop': 241, 'bear_use_sma': True, 'bear_use_ema': False, 'bear_use_atr': True, 'bear_use_adx': False, 'bear_use_spike': True, 'bear_rsi_required': True, 'sideways_strategy': 'mean_reversion', 'sideways_bb_std_mult': 1.1221345646854084, 'sideways_rsi_os': 46, 'sideways_rsi_ob': 76, 'sideways_adx_thresh': 13.78154684626352, 'sideways_atr_min_pct': 0.013219320250475798, 'sideways_atr_max_pct': 0.045964232211106265, 'sideways_tp_mult': 1.711030343019958, 'sideways_tsl_mult': 0.3040488563762843, 'sideways_time_stop': 71, 'sideways_use_sma': True, 'sideways_use_ema': False, 'sideways_use_atr': True, 'sideways_use_adx': True, 'sideways_use_spike': False, 'sideways_rsi_required': True}.
[I 2025-09-01 15:15:37,050] Trial 514 finished with values: [-1000000000.0, 1000000000.0] and parameters: {'p_sma': 31, 'p_std': 28, 'p_atr': 10, 'p_adx': 14, 'rsi_period': 73, 'ema1': 23, 'ema2': 54, 'slip_atr_k': 0.008784106026341422, 'slip_spread_k': 0.3837211098857285, 'spread_hl_frac': 0.007807719995095082, 'bb_std_mult': 2.140010790973146, 'rsi_os': 26, 'rsi_ob': 79, 'vol_spike': 0.21093292326684873, 'adx_thresh': 28.559986485169976, 'atr_min_pct': 0.019878349812382054, 'atr_max_pct': 0.14244173107132901, 'tp_mult': 1.5400979201243497, 'tsl_mult': 0.39216516980413973, 'strategy': 'breakout', 'time_stop': 41, 'use_sma': False, 'use_atr': True, 'use_adx': False, 'use_ema': True, 'use_spike': False, 'rsi_required': True, 'edge_k': 0.09469392091038276, 'edge_cap': 0.12355320802947317, 'bull_strategy': 'mean_reversion', 'bull_bb_std_mult': 2.221282251903563, 'bull_rsi_os': 23, 'bull_rsi_ob': 65, 'bull_adx_thresh': 18.46707463950212, 'bull_atr_min_pct': 0.024834545593114758, 'bull_atr_max_pct': 0.08263805724898246, 'bull_tp_mult': 2.850649580119506, 'bull_tsl_mult': 0.014139459738492288, 'bull_time_stop': 300, 'bull_use_sma': True, 'bull_use_ema': True, 'bull_use_atr': False, 'bull_use_adx': True, 'bull_use_spike': False, 'bull_rsi_required': True, 'bear_strategy': 'breakout', 'bear_bb_std_mult': 3.514989443157437, 'bear_rsi_os': 22, 'bear_rsi_ob': 95, 'bear_adx_thresh': 7.413934648678371, 'bear_atr_min_pct': 0.005679408820383186, 'bear_atr_max_pct': 0.04619024833077533, 'bear_tp_mult': 1.6168687677315827, 'bear_tsl_mult': 0.9982419301021196, 'bear_time_stop': 242, 'bear_use_sma': True, 'bear_use_ema': False, 'bear_use_atr': False, 'bear_use_adx': False, 'bear_use_spike': True, 'bear_rsi_required': True, 'sideways_strategy': 'mean_reversion', 'sideways_bb_std_mult': 1.1202508713221568, 'sideways_rsi_os': 24, 'sideways_rsi_ob': 76, 'sideways_adx_thresh': 14.005358804554632, 'sideways_atr_min_pct': 0.011750716980725622, 'sideways_atr_max_pct': 0.04389530529622613, 'sideways_tp_mult': 1.9960209947357535, 'sideways_tsl_mult': 0.7494983029072263, 'sideways_time_stop': 72, 'sideways_use_sma': True, 'sideways_use_ema': False, 'sideways_use_atr': True, 'sideways_use_adx': True, 'sideways_use_spike': False, 'sideways_rsi_required': True}.
[I 2025-09-01 15:15:37,053] Trial 517 finished with values: [-1000000000.0, 1000000000.0] and parameters: {'p_sma': 40, 'p_std': 25, 'p_atr': 12, 'p_adx': 13, 'rsi_period': 73, 'ema1': 26, 'ema2': 45, 'slip_atr_k': 0.11599509247161646, 'slip_spread_k': 0.39074645796246166, 'spread_hl_frac': 0.0077786528643090025, 'bb_std_mult': 1.8854033998150175, 'rsi_os': 27, 'rsi_ob': 77, 'vol_spike': 0.07309711869036216, 'adx_thresh': 28.762888253302147, 'atr_min_pct': 0.024659056846196584, 'atr_max_pct': 0.0869415388076361, 'tp_mult': 2.0868850805120562, 'tsl_mult': 0.7226019297809139, 'strategy': 'breakout', 'time_stop': 16, 'use_sma': True, 'use_atr': True, 'use_adx': False, 'use_ema': True, 'use_spike': False, 'rsi_required': False, 'edge_k': 1.920683286200063, 'edge_cap': 0.7622217845942639, 'bull_strategy': 'mean_reversion', 'bull_bb_std_mult': 1.0333169255104182, 'bull_rsi_os': 23, 'bull_rsi_ob': 89, 'bull_adx_thresh': 32.25567341061077, 'bull_atr_min_pct': 0.017767405751918257, 'bull_atr_max_pct': 0.08536159931161685, 'bull_tp_mult': 1.3384053592346308, 'bull_tsl_mult': 0.017432466305358163, 'bull_time_stop': 117, 'bull_use_sma': True, 'bull_use_ema': True, 'bull_use_atr': False, 'bull_use_adx': True, 'bull_use_spike': False, 'bull_rsi_required': True, 'bear_strategy': 'breakout', 'bear_bb_std_mult': 1.819578159159862, 'bear_rsi_os': 52, 'bear_rsi_ob': 51, 'bear_adx_thresh': 34.98225510315015, 'bear_atr_min_pct': 0.020020714074496022, 'bear_atr_max_pct': 0.046127083766322505, 'bear_tp_mult': 1.0720116913687145, 'bear_tsl_mult': 0.6989706919767165, 'bear_time_stop': 251, 'bear_use_sma': True, 'bear_use_ema': False, 'bear_use_atr': False, 'bear_use_adx': False, 'bear_use_spike': True, 'bear_rsi_required': False, 'sideways_strategy': 'mean_reversion', 'sideways_bb_std_mult': 2.6826183031129958, 'sideways_rsi_os': 24, 'sideways_rsi_ob': 50, 'sideways_adx_thresh': 18.630613313007675, 'sideways_atr_min_pct': 0.011612208315568959, 'sideways_atr_max_pct': 0.07223736273544086, 'sideways_tp_mult': 1.7709448780503934, 'sideways_tsl_mult': 0.8167434703796131, 'sideways_time_stop': 61, 'sideways_use_sma': True, 'sideways_use_ema': False, 'sideways_use_atr': True, 'sideways_use_adx': True, 'sideways_use_spike': False, 'sideways_rsi_required': True}.
[I 2025-09-01 15:15:37,283] Trial 515 finished with values: [-1000000000.0, 1000000000.0] and parameters: {'p_sma': 31, 'p_std': 28, 'p_atr': 11, 'p_adx': 27, 'rsi_period': 73, 'ema1': 27, 'ema2': 16, 'slip_atr_k': 0.009916058630392785, 'slip_spread_k': 0.38741505498090917, 'spread_hl_frac': 0.010377660967252544, 'bb_std_mult': 2.9495664609478363, 'rsi_os': 51, 'rsi_ob': 77, 'vol_spike': 0.06729351531215608, 'adx_thresh': 28.283598976133778, 'atr_min_pct': 0.019932002117315894, 'atr_max_pct': 0.10368378700659124, 'tp_mult': 2.1031275895390515, 'tsl_mult': 0.11553872887505456, 'strategy': 'breakout', 'time_stop': 55, 'use_sma': True, 'use_atr': True, 'use_adx': False, 'use_ema': True, 'use_spike': False, 'rsi_required': True, 'edge_k': 1.5904223824317392, 'edge_cap': 0.8877174273998176, 'bull_strategy': 'mean_reversion', 'bull_bb_std_mult': 0.8964827155253798, 'bull_rsi_os': 47, 'bull_rsi_ob': 47, 'bull_adx_thresh': 30.96870167177031, 'bull_atr_min_pct': 0.017666978403722413, 'bull_atr_max_pct': 0.08333856623837815, 'bull_tp_mult': 2.5803812668914645, 'bull_tsl_mult': 0.017149134911113986, 'bull_time_stop': 87, 'bull_use_sma': True, 'bull_use_ema': True, 'bull_use_atr': False, 'bull_use_adx': False, 'bull_use_spike': False, 'bull_rsi_required': True, 'bear_strategy': 'breakout', 'bear_bb_std_mult': 1.5591705123777888, 'bear_rsi_os': 51, 'bear_rsi_ob': 50, 'bear_adx_thresh': 7.833610410885835, 'bear_atr_min_pct': 0.005765413003550239, 'bear_atr_max_pct': 0.050616911109051255, 'bear_tp_mult': 2.169344763248873, 'bear_tsl_mult': 0.6898754539673577, 'bear_time_stop': 170, 'bear_use_sma': True, 'bear_use_ema': False, 'bear_use_atr': False, 'bear_use_adx': False, 'bear_use_spike': True, 'bear_rsi_required': True, 'sideways_strategy': 'mean_reversion', 'sideways_bb_std_mult': 1.225040087227362, 'sideways_rsi_os': 24, 'sideways_rsi_ob': 76, 'sideways_adx_thresh': 11.42252381782993, 'sideways_atr_min_pct': 0.011438118923082087, 'sideways_atr_max_pct': 0.04293621088360528, 'sideways_tp_mult': 1.7223372740699119, 'sideways_tsl_mult': 0.14651833829979272, 'sideways_time_stop': 71, 'sideways_use_sma': True, 'sideways_use_ema': False, 'sideways_use_atr': True, 'sideways_use_adx': False, 'sideways_use_spike': False, 'sideways_rsi_required': True}.
[I 2025-09-01 15:15:37,588] Trial 516 finished with values: [-1000000000.0, 1000000000.0] and parameters: {'p_sma': 58, 'p_std': 25, 'p_atr': 11, 'p_adx': 13, 'rsi_period': 73, 'ema1': 26, 'ema2': 54, 'slip_atr_k': 0.02335015262971987, 'slip_spread_k': 0.04843200393273944, 'spread_hl_frac': 0.0030959890219044483, 'bb_std_mult': 2.9597038736448478, 'rsi_os': 30, 'rsi_ob': 77, 'vol_spike': 0.0668475792175898, 'adx_thresh': 28.29505629243514, 'atr_min_pct': 0.015826070952982156, 'atr_max_pct': 0.0857071645561427, 'tp_mult': 1.5306524117539058, 'tsl_mult': 0.7083836716401716, 'strategy': 'breakout', 'time_stop': 69, 'use_sma': True, 'use_atr': True, 'use_adx': False, 'use_ema': True, 'use_spike': False, 'rsi_required': False, 'edge_k': 1.604461505268702, 'edge_cap': 0.7743144732094495, 'bull_strategy': 'mean_reversion', 'bull_bb_std_mult': 2.2379862042533176, 'bull_rsi_os': 32, 'bull_rsi_ob': 48, 'bull_adx_thresh': 32.51422023088778, 'bull_atr_min_pct': 0.017768506321246828, 'bull_atr_max_pct': 0.1466871603322012, 'bull_tp_mult': 1.3395964737548078, 'bull_tsl_mult': 0.15781280885839827, 'bull_time_stop': 186, 'bull_use_sma': True, 'bull_use_ema': True, 'bull_use_atr': False, 'bull_use_adx': True, 'bull_use_spike': False, 'bull_rsi_required': True, 'bear_strategy': 'breakout', 'bear_bb_std_mult': 3.367675648316779, 'bear_rsi_os': 51, 'bear_rsi_ob': 53, 'bear_adx_thresh': 8.392014957851497, 'bear_atr_min_pct': 0.019992747254711615, 'bear_atr_max_pct': 0.051605465550497345, 'bear_tp_mult': 1.634619187975271, 'bear_tsl_mult': 0.6941343314342153, 'bear_time_stop': 169, 'bear_use_sma': True, 'bear_use_ema': False, 'bear_use_atr': False, 'bear_use_adx': False, 'bear_use_spike': True, 'bear_rsi_required': False, 'sideways_strategy': 'mean_reversion', 'sideways_bb_std_mult': 1.2194990970302426, 'sideways_rsi_os': 7, 'sideways_rsi_ob': 51, 'sideways_adx_thresh': 27.46410689345485, 'sideways_atr_min_pct': 0.009594209771450157, 'sideways_atr_max_pct': 0.07528620147934281, 'sideways_tp_mult': 1.72827546181926, 'sideways_tsl_mult': 0.300114313812094, 'sideways_time_stop': 70, 'sideways_use_sma': True, 'sideways_use_ema': False, 'sideways_use_atr': True, 'sideways_use_adx': True, 'sideways_use_spike': False, 'sideways_rsi_required': True}.
[I 2025-09-01 15:15:38,394] Trial 519 finished with values: [-1000000000.0, 1000000000.0] and parameters: {'p_sma': 58, 'p_std': 46, 'p_atr': 26, 'p_adx': 28, 'rsi_period': 43, 'ema1': 18, 'ema2': 59, 'slip_atr_k': 0.02338557153448314, 'slip_spread_k': 0.4419013312892704, 'spread_hl_frac': 0.010561478839750333, 'bb_std_mult': 2.97920548166943, 'rsi_os': 51, 'rsi_ob': 78, 'vol_spike': 0.06555981358509913, 'adx_thresh': 29.5255845995485, 'atr_min_pct': 0.015672103569655007, 'atr_max_pct': 0.0779622596271937, 'tp_mult': 2.026710569261504, 'tsl_mult': 0.2400141046709542, 'strategy': 'mean_reversion', 'time_stop': 60, 'use_sma': True, 'use_atr': True, 'use_adx': True, 'use_ema': True, 'use_spike': False, 'rsi_required': False, 'edge_k': 1.6046536268386344, 'edge_cap': 0.41341484772148096, 'bull_strategy': 'mean_reversion', 'bull_bb_std_mult': 3.027283901725171, 'bull_rsi_os': 11, 'bull_rsi_ob': 48, 'bull_adx_thresh': 6.169331568579213, 'bull_atr_min_pct': 0.017103894937959496, 'bull_atr_max_pct': 0.13472256915584357, 'bull_tp_mult': 1.3631028312752698, 'bull_tsl_mult': 0.6550312007645082, 'bull_time_stop': 160, 'bull_use_sma': False, 'bull_use_ema': False, 'bull_use_atr': True, 'bull_use_adx': False, 'bull_use_spike': False, 'bull_rsi_required': True, 'bear_strategy': 'breakout', 'bear_bb_std_mult': 3.1583373160299684, 'bear_rsi_os': 51, 'bear_rsi_ob': 53, 'bear_adx_thresh': 7.9758383291938575, 'bear_atr_min_pct': 0.0033494738651858105, 'bear_atr_max_pct': 0.10801460363809022, 'bear_tp_mult': 1.56467131672377, 'bear_tsl_mult': 0.7062991270930401, 'bear_time_stop': 167, 'bear_use_sma': True, 'bear_use_ema': False, 'bear_use_atr': False, 'bear_use_adx': False, 'bear_use_spike': True, 'bear_rsi_required': False, 'sideways_strategy': 'mean_reversion', 'sideways_bb_std_mult': 1.2439056559217236, 'sideways_rsi_os': 6, 'sideways_rsi_ob': 78, 'sideways_adx_thresh': 33.31463523439988, 'sideways_atr_min_pct': 0.022350242164151556, 'sideways_atr_max_pct': 0.06146925241660943, 'sideways_tp_mult': 2.398065935420584, 'sideways_tsl_mult': 0.76909352954241, 'sideways_time_stop': 56, 'sideways_use_sma': True, 'sideways_use_ema': False, 'sideways_use_atr': True, 'sideways_use_adx': False, 'sideways_use_spike': False, 'sideways_rsi_required': True}.
[I 2025-09-01 15:15:38,419] Trial 518 finished with values: [-1000000000.0, 1000000000.0] and parameters: {'p_sma': 29, 'p_std': 44, 'p_atr': 12, 'p_adx': 14, 'rsi_period': 43, 'ema1': 10, 'ema2': 59, 'slip_atr_k': 0.19416021558842994, 'slip_spread_k': 0.591991477867229, 'spread_hl_frac': 0.006571717489743314, 'bb_std_mult': 2.29198795540409, 'rsi_os': 51, 'rsi_ob': 90, 'vol_spike': 0.06387089409829566, 'adx_thresh': 22.81207775383332, 'atr_min_pct': 0.011519391785957062, 'atr_max_pct': 0.07419764704014306, 'tp_mult': 1.9216395591017303, 'tsl_mult': 0.4042846059141834, 'strategy': 'mean_reversion', 'time_stop': 124, 'use_sma': True, 'use_atr': True, 'use_adx': True, 'use_ema': True, 'use_spike': False, 'rsi_required': False, 'edge_k': 1.5965058973964394, 'edge_cap': 0.4113705034959019, 'bull_strategy': 'mean_reversion', 'bull_bb_std_mult': 3.0316590823083556, 'bull_rsi_os': 48, 'bull_rsi_ob': 49, 'bull_adx_thresh': 20.578412841920603, 'bull_atr_min_pct': 0.016919836645769806, 'bull_atr_max_pct': 0.0371837891664167, 'bull_tp_mult': 2.0214768380593413, 'bull_tsl_mult': 0.6404924550609511, 'bull_time_stop': 157, 'bull_use_sma': False, 'bull_use_ema': False, 'bull_use_atr': True, 'bull_use_adx': False, 'bull_use_spike': False, 'bull_rsi_required': True, 'bear_strategy': 'breakout', 'bear_bb_std_mult': 1.554667759539498, 'bear_rsi_os': 51, 'bear_rsi_ob': 57, 'bear_adx_thresh': 8.315533926700414, 'bear_atr_min_pct': 0.0034881792468699144, 'bear_atr_max_pct': 0.050402788712968466, 'bear_tp_mult': 2.7201225333462564, 'bear_tsl_mult': 0.8695181740268977, 'bear_time_stop': 254, 'bear_use_sma': True, 'bear_use_ema': False, 'bear_use_atr': False, 'bear_use_adx': False, 'bear_use_spike': True, 'bear_rsi_required': False, 'sideways_strategy': 'mean_reversion', 'sideways_bb_std_mult': 1.2187748387023685, 'sideways_rsi_os': 22, 'sideways_rsi_ob': 79, 'sideways_adx_thresh': 33.09723322388712, 'sideways_atr_min_pct': 0.009411350568190549, 'sideways_atr_max_pct': 0.05902291022218634, 'sideways_tp_mult': 2.3636806369498995, 'sideways_tsl_mult': 0.04013322149428361, 'sideways_time_stop': 57, 'sideways_use_sma': True, 'sideways_use_ema': False, 'sideways_use_atr': True, 'sideways_use_adx': False, 'sideways_use_spike': False, 'sideways_rsi_required': True}.
[I 2025-09-01 15:16:09,981] Trial 521 finished with values: [-1000000000.0, 1000000000.0] and parameters: {'p_sma': 10, 'p_std': 27, 'p_atr': 12, 'p_adx': 28, 'rsi_period': 68, 'ema1': 26, 'ema2': 59, 'slip_atr_k': 0.018785219922888466, 'slip_spread_k': 0.6957109071326989, 'spread_hl_frac': 0.006738967328757443, 'bb_std_mult': 2.2897226497718357, 'rsi_os': 34, 'rsi_ob': 82, 'vol_spike': 0.059163552593257285, 'adx_thresh': 23.627390689033735, 'atr_min_pct': 0.016685405430352324, 'atr_max_pct': 0.07168141041633125, 'tp_mult': 1.9248992678469024, 'tsl_mult': 0.40608205646480167, 'strategy': 'mean_reversion', 'time_stop': 124, 'use_sma': False, 'use_atr': True, 'use_adx': True, 'use_ema': True, 'use_spike': False, 'rsi_required': True, 'edge_k': 1.2716692289531857, 'edge_cap': 0.41100129149926146, 'bull_strategy': 'mean_reversion', 'bull_bb_std_mult': 0.9332083492248122, 'bull_rsi_os': 24, 'bull_rsi_ob': 62, 'bull_adx_thresh': 20.44603721377624, 'bull_atr_min_pct': 0.016853888627793374, 'bull_atr_max_pct': 0.04233401026068485, 'bull_tp_mult': 2.1252444292564094, 'bull_tsl_mult': 0.5521934945048799, 'bull_time_stop': 132, 'bull_use_sma': False, 'bull_use_ema': False, 'bull_use_atr': True, 'bull_use_adx': True, 'bull_use_spike': True, 'bull_rsi_required': True, 'bear_strategy': 'breakout', 'bear_bb_std_mult': 2.3844636440156433, 'bear_rsi_os': 53, 'bear_rsi_ob': 55, 'bear_adx_thresh': 22.167866781882587, 'bear_atr_min_pct': 0.0038503174159491595, 'bear_atr_max_pct': 0.044368537913856705, 'bear_tp_mult': 1.5571452532286891, 'bear_tsl_mult': 0.8717543957563827, 'bear_time_stop': 255, 'bear_use_sma': True, 'bear_use_ema': False, 'bear_use_atr': False, 'bear_use_adx': False, 'bear_use_spike': True, 'bear_rsi_required': True, 'sideways_strategy': 'breakout', 'sideways_bb_std_mult': 3.1858061393515493, 'sideways_rsi_os': 25, 'sideways_rsi_ob': 95, 'sideways_adx_thresh': 26.49812408166075, 'sideways_atr_min_pct': 0.022480756253645044, 'sideways_atr_max_pct': 0.015763886802174568, 'sideways_tp_mult': 1.101078503068602, 'sideways_tsl_mult': 0.7809222471622829, 'sideways_time_stop': 29, 'sideways_use_sma': False, 'sideways_use_ema': False, 'sideways_use_atr': True, 'sideways_use_adx': True, 'sideways_use_spike': False, 'sideways_rsi_required': True}.
[I 2025-09-01 15:16:10,437] Trial 520 finished with values: [-0.052914600178318505, 0.05241047168551343] and parameters: {'p_sma': 29, 'p_std': 27, 'p_atr': 12, 'p_adx': 13, 'rsi_period': 36, 'ema1': 18, 'ema2': 59, 'slip_atr_k': 0.02376241262043497, 'slip_spread_k': 0.3216179837842322, 'spread_hl_frac': 0.029366233041365236, 'bb_std_mult': 2.3679144327654775, 'rsi_os': 30, 'rsi_ob': 78, 'vol_spike': 0.06596175878411785, 'adx_thresh': 29.876930420577402, 'atr_min_pct': 0.01578649486805886, 'atr_max_pct': 0.13655021331930323, 'tp_mult': 1.366563184249574, 'tsl_mult': 0.24601835876136396, 'strategy': 'mean_reversion', 'time_stop': 192, 'use_sma': False, 'use_atr': True, 'use_adx': True, 'use_ema': True, 'use_spike': False, 'rsi_required': False, 'edge_k': 1.6251251545241074, 'edge_cap': 0.41374740585930353, 'bull_strategy': 'mean_reversion', 'bull_bb_std_mult': 0.9143594195877911, 'bull_rsi_os': 27, 'bull_rsi_ob': 69, 'bull_adx_thresh': 6.192552913732531, 'bull_atr_min_pct': 0.016860512493146376, 'bull_atr_max_pct': 0.062361433746346506, 'bull_tp_mult': 1.3625652817990268, 'bull_tsl_mult': 0.43464989790831143, 'bull_time_stop': 131, 'bull_use_sma': False, 'bull_use_ema': False, 'bull_use_atr': True, 'bull_use_adx': True, 'bull_use_spike': True, 'bull_rsi_required': True, 'bear_strategy': 'breakout', 'bear_bb_std_mult': 1.544638808816655, 'bear_rsi_os': 53, 'bear_rsi_ob': 60, 'bear_adx_thresh': 10.022510842701731, 'bear_atr_min_pct': 0.003538515910699403, 'bear_atr_max_pct': 0.10796037834116429, 'bear_tp_mult': 1.565090557911024, 'bear_tsl_mult': 0.7200049212074321, 'bear_time_stop': 55, 'bear_use_sma': True, 'bear_use_ema': False, 'bear_use_atr': False, 'bear_use_adx': False, 'bear_use_spike': True, 'bear_rsi_required': False, 'sideways_strategy': 'breakout', 'sideways_bb_std_mult': 1.0510023043499712, 'sideways_rsi_os': 22, 'sideways_rsi_ob': 79, 'sideways_adx_thresh': 30.634263649407423, 'sideways_atr_min_pct': 0.009607005776690304, 'sideways_atr_max_pct': 0.058540202900060845, 'sideways_tp_mult': 2.366664942878801, 'sideways_tsl_mult': 0.7782467603779191, 'sideways_time_stop': 60, 'sideways_use_sma': False, 'sideways_use_ema': False, 'sideways_use_atr': True, 'sideways_use_adx': True, 'sideways_use_spike': False, 'sideways_rsi_required': True}.
