[I 2025-09-01 14:26:14,239] Trial 198 finished with values: [-0.03551602179105662, 0.03526265912456718] and parameters: {'p_sma': 26, 'p_std': 13, 'p_atr': 11, 'p_adx': 25, 'rsi_period': 69, 'ema1': 10, 'ema2': 43, 'slip_atr_k': 0.19856281257464078, 'slip_spread_k': 0.0007728465397487394, 'spread_hl_frac': 0.008713196085347374, 'bb_std_mult': 2.4480576418406415, 'rsi_os': 9, 'rsi_ob': 79, 'vol_spike': 0.08331152650258215, 'adx_thresh': 25.784658928509035, 'atr_min_pct': 0.025876192374198918, 'atr_max_pct': 0.047195091105148385, 'tp_mult': 2.424364740259776, 'tsl_mult': 0.1053018907215576, 'strategy': 'breakout', 'time_stop': 280, 'use_sma': False, 'use_atr': True, 'use_adx': True, 'use_ema': True, 'use_spike': False, 'rsi_required': True, 'edge_k': 0.5364132186576238, 'edge_cap': 0.9311814888026602, 'bull_strategy': 'breakout', 'bull_bb_std_mult': 2.0150686243488622, 'bull_rsi_os': 17, 'bull_rsi_ob': 57, 'bull_adx_thresh': 21.407577500363665, 'bull_atr_min_pct': 0.002234088445420041, 'bull_atr_max_pct': 0.08041999584512495, 'bull_tp_mult': 1.0657079387295125, 'bull_tsl_mult': 0.8243637972977367, 'bull_time_stop': 278, 'bull_use_sma': False, 'bull_use_ema': True, 'bull_use_atr': False, 'bull_use_adx': False, 'bull_use_spike': False, 'bull_rsi_required': False, 'bear_strategy': 'breakout', 'bear_bb_std_mult': 1.3690809920518328, 'bear_rsi_os': 51, 'bear_rsi_ob': 45, 'bear_adx_thresh': 5.674070437039154, 'bear_atr_min_pct': 0.012341419783434998, 'bear_atr_max_pct': 0.05682162464861032, 'bear_tp_mult': 2.375763191380965, 'bear_tsl_mult': 0.09162098934512852, 'bear_time_stop': 244, 'bear_use_sma': True, 'bear_use_ema': False, 'bear_use_atr': True, 'bear_use_adx': True, 'bear_use_spike': False, 'bear_rsi_required': True, 'sideways_strategy': 'mean_reversion', 'sideways_bb_std_mult': 3.526596655072516, 'sideways_rsi_os': 42, 'sideways_rsi_ob': 50, 'sideways_adx_thresh': 13.972235737965102, 'sideways_atr_min_pct': 0.002847341938979028, 'sideways_atr_max_pct': 0.028873225257931984, 'sideways_tp_mult': 2.746918220586997, 'sideways_tsl_mult': 0.8536531167241068, 'sideways_time_stop': 80, 'sideways_use_sma': True, 'sideways_use_ema': True, 'sideways_use_atr': False, 'sideways_use_adx': True, 'sideways_use_spike': True, 'sideways_rsi_required': False}.
[I 2025-09-01 14:26:14,581] Trial 196 finished with values: [-0.08801242704548273, 0.08785773329905355] and parameters: {'p_sma': 11, 'p_std': 13, 'p_atr': 11, 'p_adx': 20, 'rsi_period': 40, 'ema1': 6, 'ema2': 43, 'slip_atr_k': 0.0932217178451928, 'slip_spread_k': 0.04584272421109753, 'spread_hl_frac': 0.008691683936515085, 'bb_std_mult': 1.348298429175557, 'rsi_os': 9, 'rsi_ob': 52, 'vol_spike': 0.16025908701747976, 'adx_thresh': 19.20035390129024, 'atr_min_pct': 0.00883743587935147, 'atr_max_pct': 0.06711895583794764, 'tp_mult': 2.3881672544637924, 'tsl_mult': 0.5858883197192649, 'strategy': 'breakout', 'time_stop': 277, 'use_sma': True, 'use_atr': True, 'use_adx': False, 'use_ema': False, 'use_spike': False, 'rsi_required': True, 'edge_k': 0.4264780880525814, 'edge_cap': 0.9866939233860184, 'bull_strategy': 'breakout', 'bull_bb_std_mult': 2.4398398074658596, 'bull_rsi_os': 17, 'bull_rsi_ob': 57, 'bull_adx_thresh': 20.57210542511465, 'bull_atr_min_pct': 0.0010889089937066209, 'bull_atr_max_pct': 0.035020073745772096, 'bull_tp_mult': 1.0854286946124565, 'bull_tsl_mult': 0.38235110174672704, 'bull_time_stop': 172, 'bull_use_sma': False, 'bull_use_ema': False, 'bull_use_atr': False, 'bull_use_adx': False, 'bull_use_spike': False, 'bull_rsi_required': False, 'bear_strategy': 'breakout', 'bear_bb_std_mult': 2.1634113272493605, 'bear_rsi_os': 51, 'bear_rsi_ob': 59, 'bear_adx_thresh': 12.132260925278835, 'bear_atr_min_pct': 0.003723329942165219, 'bear_atr_max_pct': 0.047575924675825415, 'bear_tp_mult': 2.3776165858411638, 'bear_tsl_mult': 0.6616139208207994, 'bear_time_stop': 71, 'bear_use_sma': True, 'bear_use_ema': True, 'bear_use_atr': True, 'bear_use_adx': True, 'bear_use_spike': False, 'bear_rsi_required': True, 'sideways_strategy': 'mean_reversion', 'sideways_bb_std_mult': 1.262276905670856, 'sideways_rsi_os': 30, 'sideways_rsi_ob': 95, 'sideways_adx_thresh': 14.039432931438423, 'sideways_atr_min_pct': 0.02929515932334368, 'sideways_atr_max_pct': 0.0474615067215015, 'sideways_tp_mult': 2.751171490488639, 'sideways_tsl_mult': 0.8655117628006234, 'sideways_time_stop': 41, 'sideways_use_sma': True, 'sideways_use_ema': True, 'sideways_use_atr': False, 'sideways_use_adx': True, 'sideways_use_spike': True, 'sideways_rsi_required': False}.
[I 2025-09-01 14:26:52,182] Trial 202 finished with values: [-0.012911216785433832, 0.020615345400146742] and parameters: {'p_sma': 24, 'p_std': 13, 'p_atr': 14, 'p_adx': 22, 'rsi_period': 74, 'ema1': 11, 'ema2': 39, 'slip_atr_k': 0.04616783115012043, 'slip_spread_k': 0.2775043793646405, 'spread_hl_frac': 0.008442324398176862, 'bb_std_mult': 2.61615256226115, 'rsi_os': 6, 'rsi_ob': 93, 'vol_spike': 0.27489287741985535, 'adx_thresh': 34.921378434331636, 'atr_min_pct': 0.021480222039180225, 'atr_max_pct': 0.03617893041799401, 'tp_mult': 2.378858757180384, 'tsl_mult': 0.4536191121463363, 'strategy': 'breakout', 'time_stop': 96, 'use_sma': False, 'use_atr': True, 'use_adx': True, 'use_ema': True, 'use_spike': True, 'rsi_required': False, 'edge_k': 0.5314980754938501, 'edge_cap': 0.928845545891381, 'bull_strategy': 'breakout', 'bull_bb_std_mult': 1.499647881249629, 'bull_rsi_os': 20, 'bull_rsi_ob': 57, 'bull_adx_thresh': 20.417176716389836, 'bull_atr_min_pct': 0.004531403586974571, 'bull_atr_max_pct': 0.03692545517416363, 'bull_tp_mult': 1.0816638662154667, 'bull_tsl_mult': 0.6078244266311287, 'bull_time_stop': 238, 'bull_use_sma': True, 'bull_use_ema': True, 'bull_use_atr': False, 'bull_use_adx': False, 'bull_use_spike': False, 'bull_rsi_required': False, 'bear_strategy': 'breakout', 'bear_bb_std_mult': 2.1713936066565265, 'bear_rsi_os': 51, 'bear_rsi_ob': 59, 'bear_adx_thresh': 17.541116887486925, 'bear_atr_min_pct': 0.005747270006639335, 'bear_atr_max_pct': 0.06000654274308083, 'bear_tp_mult': 1.65738713843471, 'bear_tsl_mult': 0.6255035790060512, 'bear_time_stop': 242, 'bear_use_sma': True, 'bear_use_ema': False, 'bear_use_atr': True, 'bear_use_adx': True, 'bear_use_spike': False, 'bear_rsi_required': False, 'sideways_strategy': 'mean_reversion', 'sideways_bb_std_mult': 1.2871207624996617, 'sideways_rsi_os': 37, 'sideways_rsi_ob': 76, 'sideways_adx_thresh': 21.64411797794187, 'sideways_atr_min_pct': 0.01752727386115383, 'sideways_atr_max_pct': 0.04100372456858064, 'sideways_tp_mult': 2.7526584855703238, 'sideways_tsl_mult': 0.2763697343352025, 'sideways_time_stop': 81, 'sideways_use_sma': True, 'sideways_use_ema': True, 'sideways_use_atr': False, 'sideways_use_adx': True, 'sideways_use_spike': True, 'sideways_rsi_required': True}.
[I 2025-09-01 14:26:52,393] Trial 203 finished with values: [-1000000000.0, 1000000000.0] and parameters: {'p_sma': 42, 'p_std': 56, 'p_atr': 17, 'p_adx': 22, 'rsi_period': 59, 'ema1': 18, 'ema2': 21, 'slip_atr_k': 0.14006120278689083, 'slip_spread_k': 0.2979242428075142, 'spread_hl_frac': 0.04005342501060052, 'bb_std_mult': 2.603816979537929, 'rsi_os': 38, 'rsi_ob': 70, 'vol_spike': 0.17599162142299052, 'adx_thresh': 23.131906705139926, 'atr_min_pct': 0.007668785337696713, 'atr_max_pct': 0.07428749008991388, 'tp_mult': 2.405784572346455, 'tsl_mult': 0.6382017362718793, 'strategy': 'breakout', 'time_stop': 65, 'use_sma': False, 'use_atr': False, 'use_adx': True, 'use_ema': True, 'use_spike': True, 'rsi_required': False, 'edge_k': 0.5285942138233952, 'edge_cap': 0.9286757459271714, 'bull_strategy': 'breakout', 'bull_bb_std_mult': 1.5181088754385108, 'bull_rsi_os': 20, 'bull_rsi_ob': 55, 'bull_adx_thresh': 14.463599220412974, 'bull_atr_min_pct': 0.005693361436548107, 'bull_atr_max_pct': 0.08383021814970815, 'bull_tp_mult': 2.2169526507580772, 'bull_tsl_mult': 0.6019711336373325, 'bull_time_stop': 256, 'bull_use_sma': True, 'bull_use_ema': True, 'bull_use_atr': False, 'bull_use_adx': False, 'bull_use_spike': False, 'bull_rsi_required': False, 'bear_strategy': 'mean_reversion', 'bear_bb_std_mult': 1.4146088346086676, 'bear_rsi_os': 52, 'bear_rsi_ob': 45, 'bear_adx_thresh': 25.39574482377981, 'bear_atr_min_pct': 0.006303010547749098, 'bear_atr_max_pct': 0.014626603456490672, 'bear_tp_mult': 2.6844013513719824, 'bear_tsl_mult': 0.6169444881951893, 'bear_time_stop': 244, 'bear_use_sma': False, 'bear_use_ema': False, 'bear_use_atr': True, 'bear_use_adx': True, 'bear_use_spike': False, 'bear_rsi_required': False, 'sideways_strategy': 'mean_reversion', 'sideways_bb_std_mult': 1.467100744326275, 'sideways_rsi_os': 37, 'sideways_rsi_ob': 50, 'sideways_adx_thresh': 33.443347793513176, 'sideways_atr_min_pct': 0.017606770403891213, 'sideways_atr_max_pct': 0.03809847738772873, 'sideways_tp_mult': 2.613772734856257, 'sideways_tsl_mult': 0.8093112849778789, 'sideways_time_stop': 238, 'sideways_use_sma': True, 'sideways_use_ema': True, 'sideways_use_atr': False, 'sideways_use_adx': False, 'sideways_use_spike': True, 'sideways_rsi_required': True}.
[I 2025-09-01 14:26:52,896] Trial 201 finished with values: [-1000000000.0, 1000000000.0] and parameters: {'p_sma': 24, 'p_std': 13, 'p_atr': 17, 'p_adx': 22, 'rsi_period': 30, 'ema1': 28, 'ema2': 39, 'slip_atr_k': 0.038290622107077295, 'slip_spread_k': 0.5042876021047752, 'spread_hl_frac': 0.04028875591746408, 'bb_std_mult': 3.48086349321841, 'rsi_os': 6, 'rsi_ob': 70, 'vol_spike': 0.00036422825598833586, 'adx_thresh': 23.080990455544487, 'atr_min_pct': 0.0077250081740249665, 'atr_max_pct': 0.0677910625597895, 'tp_mult': 2.394605997637789, 'tsl_mult': 0.5854331197741147, 'strategy': 'breakout', 'time_stop': 63, 'use_sma': False, 'use_atr': True, 'use_adx': True, 'use_ema': True, 'use_spike': True, 'rsi_required': False, 'edge_k': 0.5307010148853134, 'edge_cap': 0.9344140824549324, 'bull_strategy': 'breakout', 'bull_bb_std_mult': 1.521591336822801, 'bull_rsi_os': 55, 'bull_rsi_ob': 57, 'bull_adx_thresh': 23.417315790614765, 'bull_atr_min_pct': 0.008287104075876895, 'bull_atr_max_pct': 0.03751923448684105, 'bull_tp_mult': 1.0603393425025884, 'bull_tsl_mult': 0.6034468053726225, 'bull_time_stop': 270, 'bull_use_sma': True, 'bull_use_ema': True, 'bull_use_atr': False, 'bull_use_adx': False, 'bull_use_spike': False, 'bull_rsi_required': False, 'bear_strategy': 'breakout', 'bear_bb_std_mult': 1.3240686317994745, 'bear_rsi_os': 38, 'bear_rsi_ob': 45, 'bear_adx_thresh': 25.572893266968826, 'bear_atr_min_pct': 0.006000313293523275, 'bear_atr_max_pct': 0.11332710085803227, 'bear_tp_mult': 2.2726671777969116, 'bear_tsl_mult': 0.6224762795055884, 'bear_time_stop': 246, 'bear_use_sma': True, 'bear_use_ema': False, 'bear_use_atr': True, 'bear_use_adx': True, 'bear_use_spike': False, 'bear_rsi_required': False, 'sideways_strategy': 'mean_reversion', 'sideways_bb_std_mult': 1.2950120106935716, 'sideways_rsi_os': 37, 'sideways_rsi_ob': 76, 'sideways_adx_thresh': 33.50672429799624, 'sideways_atr_min_pct': 0.003022167873652542, 'sideways_atr_max_pct': 0.03835803582685426, 'sideways_tp_mult': 2.7468218857290743, 'sideways_tsl_mult': 0.2677432485355258, 'sideways_time_stop': 263, 'sideways_use_sma': True, 'sideways_use_ema': True, 'sideways_use_atr': False, 'sideways_use_adx': True, 'sideways_use_spike': True, 'sideways_rsi_required': True}.
[I 2025-09-01 14:26:52,896] Trial 200 finished with values: [-1000000000.0, 1000000000.0] and parameters: {'p_sma': 24, 'p_std': 13, 'p_atr': 17, 'p_adx': 22, 'rsi_period': 74, 'ema1': 15, 'ema2': 39, 'slip_atr_k': 0.03939329616366985, 'slip_spread_k': 0.49581014516955013, 'spread_hl_frac': 0.040386728481832654, 'bb_std_mult': 3.4739386872084697, 'rsi_os': 34, 'rsi_ob': 77, 'vol_spike': 0.2853326005606324, 'adx_thresh': 7.656702880753734, 'atr_min_pct': 0.0075660744946284605, 'atr_max_pct': 0.08222899514311408, 'tp_mult': 2.3921125307841757, 'tsl_mult': 0.5865092723744214, 'strategy': 'breakout', 'time_stop': 280, 'use_sma': False, 'use_atr': True, 'use_adx': True, 'use_ema': True, 'use_spike': True, 'rsi_required': False, 'edge_k': 0.5233720947857654, 'edge_cap': 0.936198585780436, 'bull_strategy': 'breakout', 'bull_bb_std_mult': 2.6460427935938693, 'bull_rsi_os': 20, 'bull_rsi_ob': 57, 'bull_adx_thresh': 14.53116325254357, 'bull_atr_min_pct': 0.015684467113923822, 'bull_atr_max_pct': 0.08306231168262933, 'bull_tp_mult': 1.0506545092284938, 'bull_tsl_mult': 0.7030793114407694, 'bull_time_stop': 26, 'bull_use_sma': False, 'bull_use_ema': True, 'bull_use_atr': False, 'bull_use_adx': False, 'bull_use_spike': False, 'bull_rsi_required': False, 'bear_strategy': 'mean_reversion', 'bear_bb_std_mult': 2.183724625977146, 'bear_rsi_os': 38, 'bear_rsi_ob': 45, 'bear_adx_thresh': 5.625720810878319, 'bear_atr_min_pct': 0.00623922316281926, 'bear_atr_max_pct': 0.07004827794761354, 'bear_tp_mult': 2.7654140418789908, 'bear_tsl_mult': 0.6223924204043466, 'bear_time_stop': 242, 'bear_use_sma': True, 'bear_use_ema': True, 'bear_use_atr': True, 'bear_use_adx': True, 'bear_use_spike': False, 'bear_rsi_required': False, 'sideways_strategy': 'mean_reversion', 'sideways_bb_std_mult': 1.2550726285182134, 'sideways_rsi_os': 42, 'sideways_rsi_ob': 76, 'sideways_adx_thresh': 34.27665554340682, 'sideways_atr_min_pct': 0.017623819979391324, 'sideways_atr_max_pct': 0.05681698335705236, 'sideways_tp_mult': 2.9781369046795154, 'sideways_tsl_mult': 0.8555081676695557, 'sideways_time_stop': 80, 'sideways_use_sma': True, 'sideways_use_ema': True, 'sideways_use_atr': False, 'sideways_use_adx': False, 'sideways_use_spike': True, 'sideways_rsi_required': True}.
[I 2025-09-01 14:27:29,933] Trial 206 finished with values: [-1000000000.0, 1000000000.0] and parameters: {'p_sma': 26, 'p_std': 25, 'p_atr': 14, 'p_adx': 25, 'rsi_period': 16, 'ema1': 10, 'ema2': 21, 'slip_atr_k': 0.04357977400723955, 'slip_spread_k': 0.47668884619438984, 'spread_hl_frac': 0.006955128043160563, 'bb_std_mult': 2.538726280546426, 'rsi_os': 27, 'rsi_ob': 93, 'vol_spike': 0.27165735627222043, 'adx_thresh': 9.549895371662224, 'atr_min_pct': 0.021682452711697407, 'atr_max_pct': 0.06362615296294113, 'tp_mult': 2.3507711290559214, 'tsl_mult': 0.6125094886741761, 'strategy': 'breakout', 'time_stop': 95, 'use_sma': False, 'use_atr': False, 'use_adx': False, 'use_ema': False, 'use_spike': False, 'rsi_required': True, 'edge_k': 1.3936110844936276, 'edge_cap': 0.5187217999764645, 'bull_strategy': 'mean_reversion', 'bull_bb_std_mult': 3.174486048136483, 'bull_rsi_os': 21, 'bull_rsi_ob': 88, 'bull_adx_thresh': 34.55897686886502, 'bull_atr_min_pct': 0.011351290836557625, 'bull_atr_max_pct': 0.07892879934859505, 'bull_tp_mult': 1.1166317894527165, 'bull_tsl_mult': 0.8284000107055807, 'bull_time_stop': 236, 'bull_use_sma': False, 'bull_use_ema': True, 'bull_use_atr': False, 'bull_use_adx': True, 'bull_use_spike': False, 'bull_rsi_required': True, 'bear_strategy': 'breakout', 'bear_bb_std_mult': 2.0663898663874476, 'bear_rsi_os': 35, 'bear_rsi_ob': 47, 'bear_adx_thresh': 5.007815678309473, 'bear_atr_min_pct': 0.005548833689542412, 'bear_atr_max_pct': 0.05761249858849969, 'bear_tp_mult': 1.6386062560614656, 'bear_tsl_mult': 0.5930613760391534, 'bear_time_stop': 127, 'bear_use_sma': False, 'bear_use_ema': True, 'bear_use_atr': False, 'bear_use_adx': False, 'bear_use_spike': False, 'bear_rsi_required': True, 'sideways_strategy': 'breakout', 'sideways_bb_std_mult': 3.0553437754209263, 'sideways_rsi_os': 20, 'sideways_rsi_ob': 79, 'sideways_adx_thresh': 34.52676989751833, 'sideways_atr_min_pct': 0.027933803943417584, 'sideways_atr_max_pct': 0.03223359217176183, 'sideways_tp_mult': 2.6844379425279876, 'sideways_tsl_mult': 0.48424567212315744, 'sideways_time_stop': 95, 'sideways_use_sma': False, 'sideways_use_ema': False, 'sideways_use_atr': False, 'sideways_use_adx': True, 'sideways_use_spike': True, 'sideways_rsi_required': False}.
[I 2025-09-01 14:27:30,334] Trial 207 finished with values: [-1000000000.0, 1000000000.0] and parameters: {'p_sma': 38, 'p_std': 32, 'p_atr': 14, 'p_adx': 22, 'rsi_period': 70, 'ema1': 29, 'ema2': 39, 'slip_atr_k': 0.04601846021420747, 'slip_spread_k': 0.4804234224171464, 'spread_hl_frac': 0.011665207445371969, 'bb_std_mult': 2.446836115139349, 'rsi_os': 7, 'rsi_ob': 63, 'vol_spike': 0.26916314900578286, 'adx_thresh': 24.046371487816224, 'atr_min_pct': 0.0007490080601433198, 'atr_max_pct': 0.12181708356723997, 'tp_mult': 2.346276168938114, 'tsl_mult': 0.09928119564296256, 'strategy': 'breakout', 'time_stop': 92, 'use_sma': False, 'use_atr': False, 'use_adx': False, 'use_ema': False, 'use_spike': False, 'rsi_required': True, 'edge_k': 1.5410867253890426, 'edge_cap': 0.904326541118577, 'bull_strategy': 'mean_reversion', 'bull_bb_std_mult': 2.1028211324161616, 'bull_rsi_os': 21, 'bull_rsi_ob': 79, 'bull_adx_thresh': 12.772274949770887, 'bull_atr_min_pct': 0.024648130060745295, 'bull_atr_max_pct': 0.031954192388022426, 'bull_tp_mult': 1.1225104381158681, 'bull_tsl_mult': 0.8206267918546595, 'bull_time_stop': 128, 'bull_use_sma': False, 'bull_use_ema': True, 'bull_use_atr': False, 'bull_use_adx': True, 'bull_use_spike': False, 'bull_rsi_required': True, 'bear_strategy': 'breakout', 'bear_bb_std_mult': 2.058648760737645, 'bear_rsi_os': 35, 'bear_rsi_ob': 53, 'bear_adx_thresh': 19.403560886292425, 'bear_atr_min_pct': 0.005498195642507539, 'bear_atr_max_pct': 0.05986275243457588, 'bear_tp_mult': 1.6507839107481803, 'bear_tsl_mult': 0.18079296689725222, 'bear_time_stop': 128, 'bear_use_sma': False, 'bear_use_ema': True, 'bear_use_atr': False, 'bear_use_adx': False, 'bear_use_spike': False, 'bear_rsi_required': True, 'sideways_strategy': 'breakout', 'sideways_bb_std_mult': 1.4429771214120217, 'sideways_rsi_os': 34, 'sideways_rsi_ob': 56, 'sideways_adx_thresh': 21.835898714877402, 'sideways_atr_min_pct': 0.016451569231421954, 'sideways_atr_max_pct': 0.04055390889833655, 'sideways_tp_mult': 2.1828809511313874, 'sideways_tsl_mult': 0.9878510980918687, 'sideways_time_stop': 107, 'sideways_use_sma': False, 'sideways_use_ema': False, 'sideways_use_atr': False, 'sideways_use_adx': True, 'sideways_use_spike': True, 'sideways_rsi_required': False}.
[I 2025-09-01 14:27:30,893] Trial 205 finished with values: [-1000000000.0, 1000000000.0] and parameters: {'p_sma': 24, 'p_std': 40, 'p_atr': 14, 'p_adx': 22, 'rsi_period': 30, 'ema1': 28, 'ema2': 21, 'slip_atr_k': 0.03783922331954401, 'slip_spread_k': 0.4891653167533437, 'spread_hl_frac': 0.04009604544104228, 'bb_std_mult': 2.4474150870636926, 'rsi_os': 34, 'rsi_ob': 93, 'vol_spike': 0.2870557863454343, 'adx_thresh': 23.734798183722546, 'atr_min_pct': 0.021692582034366376, 'atr_max_pct': 0.03508257282441229, 'tp_mult': 1.2134991601510023, 'tsl_mult': 0.5642832926800806, 'strategy': 'breakout', 'time_stop': 174, 'use_sma': False, 'use_atr': True, 'use_adx': False, 'use_ema': False, 'use_spike': True, 'rsi_required': False, 'edge_k': 0.48816396739593954, 'edge_cap': 0.9420362012548616, 'bull_strategy': 'mean_reversion', 'bull_bb_std_mult': 1.6013609549788894, 'bull_rsi_os': 21, 'bull_rsi_ob': 56, 'bull_adx_thresh': 21.553465607036696, 'bull_atr_min_pct': 0.01068022961734761, 'bull_atr_max_pct': 0.08016169790912288, 'bull_tp_mult': 1.0609230167837642, 'bull_tsl_mult': 0.841335467339206, 'bull_time_stop': 271, 'bull_use_sma': False, 'bull_use_ema': True, 'bull_use_atr': False, 'bull_use_adx': True, 'bull_use_spike': False, 'bull_rsi_required': True, 'bear_strategy': 'breakout', 'bear_bb_std_mult': 2.142428246783622, 'bear_rsi_os': 34, 'bear_rsi_ob': 45, 'bear_adx_thresh': 5.61144369883056, 'bear_atr_min_pct': 0.006199429019003901, 'bear_atr_max_pct': 0.11376565722733811, 'bear_tp_mult': 1.6655533288740374, 'bear_tsl_mult': 0.07557283262289483, 'bear_time_stop': 125, 'bear_use_sma': True, 'bear_use_ema': True, 'bear_use_atr': False, 'bear_use_adx': True, 'bear_use_spike': False, 'bear_rsi_required': False, 'sideways_strategy': 'mean_reversion', 'sideways_bb_std_mult': 3.520500669584564, 'sideways_rsi_os': 23, 'sideways_rsi_ob': 64, 'sideways_adx_thresh': 21.558917404546975, 'sideways_atr_min_pct': 0.02831542004500094, 'sideways_atr_max_pct': 0.03885915700857659, 'sideways_tp_mult': 2.0820076144401134, 'sideways_tsl_mult': 0.2818667182795378, 'sideways_time_stop': 261, 'sideways_use_sma': True, 'sideways_use_ema': True, 'sideways_use_atr': False, 'sideways_use_adx': True, 'sideways_use_spike': True, 'sideways_rsi_required': False}.
