[I 2025-09-01 14:53:01,885] Trial 368 finished with values: [-1000000000.0, 1000000000.0] and parameters: {'p_sma': 30, 'p_std': 26, 'p_atr': 12, 'p_adx': 14, 'rsi_period': 74, 'ema1': 26, 'ema2': 60, 'slip_atr_k': 0.009313544328622518, 'slip_spread_k': 0.2525019695792431, 'spread_hl_frac': 0.0068151817899129805, 'bb_std_mult': 2.1189594114107804, 'rsi_os': 27, 'rsi_ob': 78, 'vol_spike': 0.06245270797358373, 'adx_thresh': 34.54277640870954, 'atr_min_pct': 0.017759082452407707, 'atr_max_pct': 0.072661493815001, 'tp_mult': 2.0655072399342123, 'tsl_mult': 0.39806866576370675, 'strategy': 'breakout', 'time_stop': 53, 'use_sma': False, 'use_atr': True, 'use_adx': False, 'use_ema': True, 'use_spike': False, 'rsi_required': True, 'edge_k': 1.54151651340548, 'edge_cap': 0.8900840646099509, 'bull_strategy': 'mean_reversion', 'bull_bb_std_mult': 0.9570604285222368, 'bull_rsi_os': 25, 'bull_rsi_ob': 68, 'bull_adx_thresh': 5.722624707017767, 'bull_atr_min_pct': 0.014423888505783676, 'bull_atr_max_pct': 0.13684571882679375, 'bull_tp_mult': 1.4129449822950064, 'bull_tsl_mult': 0.08967987337025149, 'bull_time_stop': 124, 'bull_use_sma': False, 'bull_use_ema': True, 'bull_use_atr': False, 'bull_use_adx': True, 'bull_use_spike': True, 'bull_rsi_required': False, 'bear_strategy': 'breakout', 'bear_bb_std_mult': 1.488091264672786, 'bear_rsi_os': 50, 'bear_rsi_ob': 53, 'bear_adx_thresh': 11.201498566446832, 'bear_atr_min_pct': 0.021537324672662807, 'bear_atr_max_pct': 0.0510192993978112, 'bear_tp_mult': 1.6065874264033748, 'bear_tsl_mult': 0.7847097232337219, 'bear_time_stop': 9, 'bear_use_sma': True, 'bear_use_ema': False, 'bear_use_atr': False, 'bear_use_adx': False, 'bear_use_spike': True, 'bear_rsi_required': True, 'sideways_strategy': 'mean_reversion', 'sideways_bb_std_mult': 1.0373561484107952, 'sideways_rsi_os': 20, 'sideways_rsi_ob': 80, 'sideways_adx_thresh': 32.5404639450752, 'sideways_atr_min_pct': 0.01209925855539047, 'sideways_atr_max_pct': 0.058065976666517596, 'sideways_tp_mult': 2.2913841066980765, 'sideways_tsl_mult': 0.6523255968587034, 'sideways_time_stop': 49, 'sideways_use_sma': True, 'sideways_use_ema': False, 'sideways_use_atr': True, 'sideways_use_adx': True, 'sideways_use_spike': False, 'sideways_rsi_required': True}.
[I 2025-09-01 14:53:02,791] Trial 371 finished with values: [-1000000000.0, 1000000000.0] and parameters: {'p_sma': 34, 'p_std': 29, 'p_atr': 12, 'p_adx': 14, 'rsi_period': 38, 'ema1': 26, 'ema2': 57, 'slip_atr_k': 0.020514970553318426, 'slip_spread_k': 0.06096631720481649, 'spread_hl_frac': 0.00664517184431744, 'bb_std_mult': 2.1001029944172, 'rsi_os': 29, 'rsi_ob': 78, 'vol_spike': 0.08224602868176664, 'adx_thresh': 15.698216509288008, 'atr_min_pct': 0.01516515494159231, 'atr_max_pct': 0.07348179721680947, 'tp_mult': 2.0000122236506463, 'tsl_mult': 0.39329925429520984, 'strategy': 'breakout', 'time_stop': 28, 'use_sma': False, 'use_atr': True, 'use_adx': False, 'use_ema': True, 'use_spike': False, 'rsi_required': True, 'edge_k': 1.2701383175657401, 'edge_cap': 0.8608978165811217, 'bull_strategy': 'mean_reversion', 'bull_bb_std_mult': 0.9557076256320759, 'bull_rsi_os': 26, 'bull_rsi_ob': 68, 'bull_adx_thresh': 5.821348605260732, 'bull_atr_min_pct': 0.016362504811549425, 'bull_atr_max_pct': 0.03820644975342804, 'bull_tp_mult': 1.4025111612828103, 'bull_tsl_mult': 0.06553039337082191, 'bull_time_stop': 133, 'bull_use_sma': False, 'bull_use_ema': True, 'bull_use_atr': False, 'bull_use_adx': True, 'bull_use_spike': True, 'bull_rsi_required': False, 'bear_strategy': 'breakout', 'bear_bb_std_mult': 1.4769014924620054, 'bear_rsi_os': 35, 'bear_rsi_ob': 54, 'bear_adx_thresh': 10.436851074844562, 'bear_atr_min_pct': 0.004743163805180533, 'bear_atr_max_pct': 0.05100410713664631, 'bear_tp_mult': 1.488579658273571, 'bear_tsl_mult': 0.7908191720897957, 'bear_time_stop': 256, 'bear_use_sma': True, 'bear_use_ema': False, 'bear_use_atr': False, 'bear_use_adx': True, 'bear_use_spike': True, 'bear_rsi_required': True, 'sideways_strategy': 'mean_reversion', 'sideways_bb_std_mult': 1.0986983548397342, 'sideways_rsi_os': 21, 'sideways_rsi_ob': 81, 'sideways_adx_thresh': 22.667799684211868, 'sideways_atr_min_pct': 0.012146011415852804, 'sideways_atr_max_pct': 0.050084377892188975, 'sideways_tp_mult': 2.2454855107726917, 'sideways_tsl_mult': 0.659062351207006, 'sideways_time_stop': 59, 'sideways_use_sma': True, 'sideways_use_ema': False, 'sideways_use_atr': True, 'sideways_use_adx': True, 'sideways_use_spike': False, 'sideways_rsi_required': True}.
[I 2025-09-01 14:53:03,054] Trial 370 finished with values: [-1000000000.0, 1000000000.0] and parameters: {'p_sma': 34, 'p_std': 29, 'p_atr': 12, 'p_adx': 14, 'rsi_period': 74, 'ema1': 26, 'ema2': 60, 'slip_atr_k': 0.011073912238128262, 'slip_spread_k': 0.33625953423970345, 'spread_hl_frac': 0.006610441637908199, 'bb_std_mult': 2.2139847915640027, 'rsi_os': 29, 'rsi_ob': 78, 'vol_spike': 0.06367641468552046, 'adx_thresh': 28.920335857172663, 'atr_min_pct': 0.01773495139549299, 'atr_max_pct': 0.07326381802047, 'tp_mult': 1.9939933628075701, 'tsl_mult': 0.3938327761365439, 'strategy': 'breakout', 'time_stop': 30, 'use_sma': False, 'use_atr': True, 'use_adx': False, 'use_ema': True, 'use_spike': False, 'rsi_required': True, 'edge_k': 1.1881558604039066, 'edge_cap': 0.8619703880270322, 'bull_strategy': 'mean_reversion', 'bull_bb_std_mult': 0.9699013278938997, 'bull_rsi_os': 26, 'bull_rsi_ob': 68, 'bull_adx_thresh': 5.685938281231154, 'bull_atr_min_pct': 0.016512341284391312, 'bull_atr_max_pct': 0.12962323997592273, 'bull_tp_mult': 1.4064747782815477, 'bull_tsl_mult': 0.07341366447822774, 'bull_time_stop': 131, 'bull_use_sma': False, 'bull_use_ema': True, 'bull_use_atr': False, 'bull_use_adx': True, 'bull_use_spike': True, 'bull_rsi_required': False, 'bear_strategy': 'breakout', 'bear_bb_std_mult': 1.4744818188972557, 'bear_rsi_os': 6, 'bear_rsi_ob': 54, 'bear_adx_thresh': 11.242156650582793, 'bear_atr_min_pct': 0.004892042030300765, 'bear_atr_max_pct': 0.04985553538160858, 'bear_tp_mult': 1.619757942244643, 'bear_tsl_mult': 0.7920338807107039, 'bear_time_stop': 252, 'bear_use_sma': True, 'bear_use_ema': False, 'bear_use_atr': False, 'bear_use_adx': False, 'bear_use_spike': True, 'bear_rsi_required': True, 'sideways_strategy': 'mean_reversion', 'sideways_bb_std_mult': 1.101150521228455, 'sideways_rsi_os': 21, 'sideways_rsi_ob': 59, 'sideways_adx_thresh': 5.884355752457282, 'sideways_atr_min_pct': 0.012116202876174985, 'sideways_atr_max_pct': 0.0496492148568818, 'sideways_tp_mult': 2.222384006385388, 'sideways_tsl_mult': 0.6608034734451818, 'sideways_time_stop': 60, 'sideways_use_sma': True, 'sideways_use_ema': False, 'sideways_use_atr': True, 'sideways_use_adx': True, 'sideways_use_spike': False, 'sideways_rsi_required': True}.
[I 2025-09-01 14:53:41,672] Trial 375 finished with values: [-1000000000.0, 1000000000.0] and parameters: {'p_sma': 30, 'p_std': 28, 'p_atr': 12, 'p_adx': 14, 'rsi_period': 58, 'ema1': 25, 'ema2': 59, 'slip_atr_k': 0.01678292764803661, 'slip_spread_k': 0.9892471269244314, 'spread_hl_frac': 0.00863254810891027, 'bb_std_mult': 2.2187841287572168, 'rsi_os': 32, 'rsi_ob': 78, 'vol_spike': 0.08013893740869543, 'adx_thresh': 27.773096657282572, 'atr_min_pct': 0.016733287840616125, 'atr_max_pct': 0.06673686624451258, 'tp_mult': 1.9076913924304906, 'tsl_mult': 0.3698745064801249, 'strategy': 'breakout', 'time_stop': 5, 'use_sma': False, 'use_atr': True, 'use_adx': False, 'use_ema': True, 'use_spike': False, 'rsi_required': True, 'edge_k': 1.3167199616129146, 'edge_cap': 0.8990496254479744, 'bull_strategy': 'mean_reversion', 'bull_bb_std_mult': 0.8528636614753233, 'bull_rsi_os': 24, 'bull_rsi_ob': 66, 'bull_adx_thresh': 6.610173370261309, 'bull_atr_min_pct': 0.015973844445743825, 'bull_atr_max_pct': 0.12489207203625644, 'bull_tp_mult': 1.373302394100151, 'bull_tsl_mult': 0.05836103658450376, 'bull_time_stop': 110, 'bull_use_sma': False, 'bull_use_ema': True, 'bull_use_atr': False, 'bull_use_adx': True, 'bull_use_spike': False, 'bull_rsi_required': True, 'bear_strategy': 'breakout', 'bear_bb_std_mult': 1.621897692985274, 'bear_rsi_os': 24, 'bear_rsi_ob': 53, 'bear_adx_thresh': 9.522065836119488, 'bear_atr_min_pct': 0.004691830355518264, 'bear_atr_max_pct': 0.0436418885074823, 'bear_tp_mult': 1.6473178129922383, 'bear_tsl_mult': 0.7432348470355706, 'bear_time_stop': 107, 'bear_use_sma': True, 'bear_use_ema': False, 'bear_use_atr': True, 'bear_use_adx': True, 'bear_use_spike': True, 'bear_rsi_required': True, 'sideways_strategy': 'mean_reversion', 'sideways_bb_std_mult': 1.025954181622203, 'sideways_rsi_os': 24, 'sideways_rsi_ob': 94, 'sideways_adx_thresh': 13.31986259733106, 'sideways_atr_min_pct': 0.013080675712579225, 'sideways_atr_max_pct': 0.04803048101713822, 'sideways_tp_mult': 2.3590835790106626, 'sideways_tsl_mult': 0.7476706781756747, 'sideways_time_stop': 51, 'sideways_use_sma': True, 'sideways_use_ema': False, 'sideways_use_atr': True, 'sideways_use_adx': True, 'sideways_use_spike': False, 'sideways_rsi_required': True}.
[I 2025-09-01 14:53:42,987] Trial 372 finished with values: [-1000000000.0, 1000000000.0] and parameters: {'p_sma': 34, 'p_std': 29, 'p_atr': 12, 'p_adx': 14, 'rsi_period': 37, 'ema1': 26, 'ema2': 57, 'slip_atr_k': 0.01831131773154923, 'slip_spread_k': 0.9837922608653331, 'spread_hl_frac': 0.00625945211930953, 'bb_std_mult': 2.1084537692218244, 'rsi_os': 29, 'rsi_ob': 78, 'vol_spike': 0.0791030439151599, 'adx_thresh': 22.636274467532072, 'atr_min_pct': 0.015038200714629527, 'atr_max_pct': 0.09968226273179573, 'tp_mult': 1.9905836235908212, 'tsl_mult': 0.3773907962016196, 'strategy': 'breakout', 'time_stop': 5, 'use_sma': False, 'use_atr': True, 'use_adx': False, 'use_ema': True, 'use_spike': False, 'rsi_required': True, 'edge_k': 1.2623926604457245, 'edge_cap': 0.8647567929444405, 'bull_strategy': 'mean_reversion', 'bull_bb_std_mult': 1.0520854704616556, 'bull_rsi_os': 26, 'bull_rsi_ob': 68, 'bull_adx_thresh': 6.406934410058491, 'bull_atr_min_pct': 0.016009399190614587, 'bull_atr_max_pct': 0.03760752639700432, 'bull_tp_mult': 1.3443330321570766, 'bull_tsl_mult': 0.07584008124439919, 'bull_time_stop': 135, 'bull_use_sma': False, 'bull_use_ema': True, 'bull_use_atr': False, 'bull_use_adx': True, 'bull_use_spike': True, 'bull_rsi_required': False, 'bear_strategy': 'breakout', 'bear_bb_std_mult': 1.4620890844288792, 'bear_rsi_os': 24, 'bear_rsi_ob': 53, 'bear_adx_thresh': 10.081985568707298, 'bear_atr_min_pct': 0.0049736410106728125, 'bear_atr_max_pct': 0.04934418885564863, 'bear_tp_mult': 1.6404908071223085, 'bear_tsl_mult': 0.7464950803350595, 'bear_time_stop': 254, 'bear_use_sma': True, 'bear_use_ema': False, 'bear_use_atr': True, 'bear_use_adx': True, 'bear_use_spike': True, 'bear_rsi_required': True, 'sideways_strategy': 'mean_reversion', 'sideways_bb_std_mult': 1.0812331301093803, 'sideways_rsi_os': 21, 'sideways_rsi_ob': 51, 'sideways_adx_thresh': 32.45100455717948, 'sideways_atr_min_pct': 0.010036233255066137, 'sideways_atr_max_pct': 0.04918497827479214, 'sideways_tp_mult': 2.219961003350668, 'sideways_tsl_mult': 0.7479262302338575, 'sideways_time_stop': 58, 'sideways_use_sma': True, 'sideways_use_ema': False, 'sideways_use_atr': True, 'sideways_use_adx': True, 'sideways_use_spike': False, 'sideways_rsi_required': True}.
[I 2025-09-01 14:53:43,455] Trial 374 finished with values: [-1000000000.0, 1000000000.0] and parameters: {'p_sma': 33, 'p_std': 29, 'p_atr': 12, 'p_adx': 14, 'rsi_period': 71, 'ema1': 25, 'ema2': 59, 'slip_atr_k': 0.019905224064872343, 'slip_spread_k': 0.3405664130628705, 'spread_hl_frac': 0.00855055705625871, 'bb_std_mult': 2.1989190228736697, 'rsi_os': 31, 'rsi_ob': 78, 'vol_spike': 0.08122687012131753, 'adx_thresh': 22.00774489597809, 'atr_min_pct': 0.016675764579051747, 'atr_max_pct': 0.0999322655349861, 'tp_mult': 2.009111725555563, 'tsl_mult': 0.41445524261327576, 'strategy': 'breakout', 'time_stop': 7, 'use_sma': False, 'use_atr': True, 'use_adx': False, 'use_ema': True, 'use_spike': False, 'rsi_required': True, 'edge_k': 1.594680299833041, 'edge_cap': 0.902758902285339, 'bull_strategy': 'mean_reversion', 'bull_bb_std_mult': 0.7096004198909571, 'bull_rsi_os': 28, 'bull_rsi_ob': 66, 'bull_adx_thresh': 6.516975117796884, 'bull_atr_min_pct': 0.01618041760642343, 'bull_atr_max_pct': 0.034953116768749015, 'bull_tp_mult': 1.3631196276949542, 'bull_tsl_mult': 0.0660999528167003, 'bull_time_stop': 137, 'bull_use_sma': False, 'bull_use_ema': True, 'bull_use_atr': False, 'bull_use_adx': True, 'bull_use_spike': False, 'bull_rsi_required': True, 'bear_strategy': 'breakout', 'bear_bb_std_mult': 1.6449150298447823, 'bear_rsi_os': 6, 'bear_rsi_ob': 53, 'bear_adx_thresh': 9.82222214989085, 'bear_atr_min_pct': 0.016816835310422534, 'bear_atr_max_pct': 0.04827535717924695, 'bear_tp_mult': 1.1651385530435632, 'bear_tsl_mult': 0.7563405153069769, 'bear_time_stop': 278, 'bear_use_sma': True, 'bear_use_ema': False, 'bear_use_atr': True, 'bear_use_adx': False, 'bear_use_spike': True, 'bear_rsi_required': True, 'sideways_strategy': 'mean_reversion', 'sideways_bb_std_mult': 0.8955625940816417, 'sideways_rsi_os': 22, 'sideways_rsi_ob': 61, 'sideways_adx_thresh': 23.151259748181616, 'sideways_atr_min_pct': 0.009934417793369498, 'sideways_atr_max_pct': 0.04953118049940641, 'sideways_tp_mult': 2.3547545847803177, 'sideways_tsl_mult': 0.7536837329706952, 'sideways_time_stop': 50, 'sideways_use_sma': True, 'sideways_use_ema': False, 'sideways_use_atr': True, 'sideways_use_adx': True, 'sideways_use_spike': False, 'sideways_rsi_required': True}.
[I 2025-09-01 14:53:43,908] Trial 373 finished with values: [-1000000000.0, 1000000000.0] and parameters: {'p_sma': 34, 'p_std': 29, 'p_atr': 12, 'p_adx': 14, 'rsi_period': 58, 'ema1': 26, 'ema2': 57, 'slip_atr_k': 0.017979553328208876, 'slip_spread_k': 0.994105295605057, 'spread_hl_frac': 0.008138028200937496, 'bb_std_mult': 2.2361101728807578, 'rsi_os': 29, 'rsi_ob': 78, 'vol_spike': 0.0805308782024611, 'adx_thresh': 22.419722746271262, 'atr_min_pct': 0.015197527351748159, 'atr_max_pct': 0.14711206678480926, 'tp_mult': 2.0006177830778857, 'tsl_mult': 0.37567231218484426, 'strategy': 'breakout', 'time_stop': 30, 'use_sma': False, 'use_atr': True, 'use_adx': False, 'use_ema': True, 'use_spike': False, 'rsi_required': True, 'edge_k': 1.2874649317924503, 'edge_cap': 0.8615999337204592, 'bull_strategy': 'mean_reversion', 'bull_bb_std_mult': 0.7379087561728243, 'bull_rsi_os': 27, 'bull_rsi_ob': 68, 'bull_adx_thresh': 6.405677819182303, 'bull_atr_min_pct': 0.01637323459559569, 'bull_atr_max_pct': 0.1261192351902367, 'bull_tp_mult': 1.3973247537565956, 'bull_tsl_mult': 0.07118451649886576, 'bull_time_stop': 135, 'bull_use_sma': False, 'bull_use_ema': True, 'bull_use_atr': False, 'bull_use_adx': True, 'bull_use_spike': True, 'bull_rsi_required': False, 'bear_strategy': 'breakout', 'bear_bb_std_mult': 1.4689614770590032, 'bear_rsi_os': 50, 'bear_rsi_ob': 54, 'bear_adx_thresh': 10.127154031152916, 'bear_atr_min_pct': 0.011785809571652515, 'bear_atr_max_pct': 0.04794325751469547, 'bear_tp_mult': 1.6504630985690756, 'bear_tsl_mult': 0.7498798269292566, 'bear_time_stop': 254, 'bear_use_sma': True, 'bear_use_ema': False, 'bear_use_atr': True, 'bear_use_adx': True, 'bear_use_spike': True, 'bear_rsi_required': True, 'sideways_strategy': 'mean_reversion', 'sideways_bb_std_mult': 1.1091194000678677, 'sideways_rsi_os': 21, 'sideways_rsi_ob': 51, 'sideways_adx_thresh': 32.35849993012214, 'sideways_atr_min_pct': 0.010086570458311232, 'sideways_atr_max_pct': 0.05122217147442495, 'sideways_tp_mult': 2.22645489304567, 'sideways_tsl_mult': 0.7580403248324047, 'sideways_time_stop': 58, 'sideways_use_sma': True, 'sideways_use_ema': False, 'sideways_use_atr': True, 'sideways_use_adx': True, 'sideways_use_spike': False, 'sideways_rsi_required': True}.
[I 2025-09-01 14:54:26,321] Trial 378 finished with values: [-1000000000.0, 1000000000.0] and parameters: {'p_sma': 31, 'p_std': 23, 'p_atr': 11, 'p_adx': 15, 'rsi_period': 46, 'ema1': 26, 'ema2': 57, 'slip_atr_k': 0.009783093019632746, 'slip_spread_k': 0.4155208348379122, 'spread_hl_frac': 0.00751217704289578, 'bb_std_mult': 2.008508002730168, 'rsi_os': 30, 'rsi_ob': 76, 'vol_spike': 0.05478643778378986, 'adx_thresh': 16.74778219902011, 'atr_min_pct': 0.016176604355134662, 'atr_max_pct': 0.06969574383039849, 'tp_mult': 1.8653420635599285, 'tsl_mult': 0.41401130222338867, 'strategy': 'breakout', 'time_stop': 35, 'use_sma': False, 'use_atr': True, 'use_adx': False, 'use_ema': True, 'use_spike': False, 'rsi_required': False, 'edge_k': 1.3678821308990368, 'edge_cap': 0.6941767947137298, 'bull_strategy': 'mean_reversion', 'bull_bb_std_mult': 1.0575413169769503, 'bull_rsi_os': 24, 'bull_rsi_ob': 65, 'bull_adx_thresh': 5.392809484204026, 'bull_atr_min_pct': 0.015423611391035746, 'bull_atr_max_pct': 0.04292345630251557, 'bull_tp_mult': 1.4415112105320838, 'bull_tsl_mult': 0.025084066275964323, 'bull_time_stop': 142, 'bull_use_sma': True, 'bull_use_ema': True, 'bull_use_atr': False, 'bull_use_adx': False, 'bull_use_spike': False, 'bull_rsi_required': True, 'bear_strategy': 'breakout', 'bear_bb_std_mult': 1.5777893454366199, 'bear_rsi_os': 11, 'bear_rsi_ob': 51, 'bear_adx_thresh': 9.29552661849683, 'bear_atr_min_pct': 0.003979815012903905, 'bear_atr_max_pct': 0.036540742138769136, 'bear_tp_mult': 1.581105968151361, 'bear_tsl_mult': 0.7324715096887225, 'bear_time_stop': 262, 'bear_use_sma': True, 'bear_use_ema': False, 'bear_use_atr': False, 'bear_use_adx': False, 'bear_use_spike': True, 'bear_rsi_required': False, 'sideways_strategy': 'mean_reversion', 'sideways_bb_std_mult': 0.9887881079543128, 'sideways_rsi_os': 22, 'sideways_rsi_ob': 68, 'sideways_adx_thresh': 8.315275828654313, 'sideways_atr_min_pct': 0.014255266419633894, 'sideways_atr_max_pct': 0.052007644627459514, 'sideways_tp_mult': 2.184364571307521, 'sideways_tsl_mult': 0.7066952896074001, 'sideways_time_stop': 67, 'sideways_use_sma': True, 'sideways_use_ema': False, 'sideways_use_atr': True, 'sideways_use_adx': False, 'sideways_use_spike': False, 'sideways_rsi_required': True}.
[I 2025-09-01 14:54:26,686] Trial 377 finished with values: [-1000000000.0, 1000000000.0] and parameters: {'p_sma': 32, 'p_std': 23, 'p_atr': 12, 'p_adx': 15, 'rsi_period': 46, 'ema1': 25, 'ema2': 59, 'slip_atr_k': 0.009856417605649072, 'slip_spread_k': 0.9588126481583112, 'spread_hl_frac': 0.008274219509962794, 'bb_std_mult': 2.220193081464047, 'rsi_os': 31, 'rsi_ob': 80, 'vol_spike': 0.0552117696512526, 'adx_thresh': 21.111153106830237, 'atr_min_pct': 0.01668970366893044, 'atr_max_pct': 0.06895336068532246, 'tp_mult': 1.922873759956573, 'tsl_mult': 0.41982642240328183, 'strategy': 'breakout', 'time_stop': 36, 'use_sma': False, 'use_atr': True, 'use_adx': False, 'use_ema': True, 'use_spike': False, 'rsi_required': False, 'edge_k': 1.605290105131514, 'edge_cap': 0.3086817354747654, 'bull_strategy': 'mean_reversion', 'bull_bb_std_mult': 0.7742315870536622, 'bull_rsi_os': 25, 'bull_rsi_ob': 65, 'bull_adx_thresh': 5.094236517473927, 'bull_atr_min_pct': 0.014976045517415496, 'bull_atr_max_pct': 0.04480513067868644, 'bull_tp_mult': 1.3777769187809181, 'bull_tsl_mult': 0.002740069810634835, 'bull_time_stop': 143, 'bull_use_sma': True, 'bull_use_ema': True, 'bull_use_atr': False, 'bull_use_adx': True, 'bull_use_spike': False, 'bull_rsi_required': True, 'bear_strategy': 'breakout', 'bear_bb_std_mult': 1.5791492803084763, 'bear_rsi_os': 50, 'bear_rsi_ob': 52, 'bear_adx_thresh': 9.157688631175123, 'bear_atr_min_pct': 0.025327498061791118, 'bear_atr_max_pct': 0.053473088427989784, 'bear_tp_mult': 1.5752875743107215, 'bear_tsl_mult': 0.7679075885211067, 'bear_time_stop': 283, 'bear_use_sma': True, 'bear_use_ema': False, 'bear_use_atr': False, 'bear_use_adx': False, 'bear_use_spike': True, 'bear_rsi_required': False, 'sideways_strategy': 'mean_reversion', 'sideways_bb_std_mult': 0.9250128913727775, 'sideways_rsi_os': 22, 'sideways_rsi_ob': 68, 'sideways_adx_thresh': 21.24091361152981, 'sideways_atr_min_pct': 0.013801050516449576, 'sideways_atr_max_pct': 0.05041904149616719, 'sideways_tp_mult': 2.285587890648767, 'sideways_tsl_mult': 0.7298993311405214, 'sideways_time_stop': 65, 'sideways_use_sma': True, 'sideways_use_ema': False, 'sideways_use_atr': True, 'sideways_use_adx': True, 'sideways_use_spike': False, 'sideways_rsi_required': True}.
