[I 2025-09-01 14:41:59,112] Trial 298 finished with values: [-1000000000.0, 1000000000.0] and parameters: {'p_sma': 5, 'p_std': 11, 'p_atr': 14, 'p_adx': 24, 'rsi_period': 16, 'ema1': 7, 'ema2': 41, 'slip_atr_k': 0.026954636705203483, 'slip_spread_k': 0.43684341072226224, 'spread_hl_frac': 0.04230872999873938, 'bb_std_mult': 2.3962092736365266, 'rsi_os': 46, 'rsi_ob': 85, 'vol_spike': 0.010675887642470239, 'adx_thresh': 30.84012968237845, 'atr_min_pct': 0.020073893564458867, 'atr_max_pct': 0.06535064480954567, 'tp_mult': 2.914464966836103, 'tsl_mult': 0.6018569167461794, 'strategy': 'breakout', 'time_stop': 23, 'use_sma': False, 'use_atr': False, 'use_adx': True, 'use_ema': False, 'use_spike': False, 'rsi_required': False, 'edge_k': 0.47199363438901726, 'edge_cap': 0.9743458133935968, 'bull_strategy': 'breakout', 'bull_bb_std_mult': 1.6567420908341692, 'bull_rsi_os': 18, 'bull_rsi_ob': 53, 'bull_adx_thresh': 30.07687896891624, 'bull_atr_min_pct': 0.010095453118950784, 'bull_atr_max_pct': 0.10495595343355718, 'bull_tp_mult': 1.1750665575470736, 'bull_tsl_mult': 0.7836027652979073, 'bull_time_stop': 250, 'bull_use_sma': True, 'bull_use_ema': True, 'bull_use_atr': False, 'bull_use_adx': True, 'bull_use_spike': False, 'bull_rsi_required': False, 'bear_strategy': 'breakout', 'bear_bb_std_mult': 2.0206287310380606, 'bear_rsi_os': 51, 'bear_rsi_ob': 45, 'bear_adx_thresh': 5.387150362335095, 'bear_atr_min_pct': 0.004693362338044741, 'bear_atr_max_pct': 0.1490737831315958, 'bear_tp_mult': 1.6721018024211383, 'bear_tsl_mult': 0.18498440016410211, 'bear_time_stop': 229, 'bear_use_sma': False, 'bear_use_ema': False, 'bear_use_atr': False, 'bear_use_adx': True, 'bear_use_spike': True, 'bear_rsi_required': False, 'sideways_strategy': 'mean_reversion', 'sideways_bb_std_mult': 1.3672608392350611, 'sideways_rsi_os': 14, 'sideways_rsi_ob': 90, 'sideways_adx_thresh': 33.451956816297496, 'sideways_atr_min_pct': 0.017021624694876062, 'sideways_atr_max_pct': 0.027416031467323448, 'sideways_tp_mult': 2.437128934231963, 'sideways_tsl_mult': 0.8956059400353152, 'sideways_time_stop': 230, 'sideways_use_sma': True, 'sideways_use_ema': True, 'sideways_use_atr': False, 'sideways_use_adx': True, 'sideways_use_spike': True, 'sideways_rsi_required': False}.
[I 2025-09-01 14:41:59,316] Trial 296 finished with values: [-1000000000.0, 1000000000.0] and parameters: {'p_sma': 45, 'p_std': 11, 'p_atr': 14, 'p_adx': 24, 'rsi_period': 69, 'ema1': 27, 'ema2': 41, 'slip_atr_k': 0.023388593117685715, 'slip_spread_k': 0.44398634515909186, 'spread_hl_frac': 0.03736724745911738, 'bb_std_mult': 2.3666008260585305, 'rsi_os': 44, 'rsi_ob': 83, 'vol_spike': 0.2298322963988707, 'adx_thresh': 28.17711210750866, 'atr_min_pct': 0.018059492692334738, 'atr_max_pct': 0.023561165773879532, 'tp_mult': 2.2966762760705794, 'tsl_mult': 0.6065049800360515, 'strategy': 'breakout', 'time_stop': 272, 'use_sma': True, 'use_atr': False, 'use_adx': False, 'use_ema': False, 'use_spike': False, 'rsi_required': True, 'edge_k': 0.38161475628547903, 'edge_cap': 0.4471181792680748, 'bull_strategy': 'breakout', 'bull_bb_std_mult': 3.227611047876845, 'bull_rsi_os': 7, 'bull_rsi_ob': 58, 'bull_adx_thresh': 33.997561403116315, 'bull_atr_min_pct': 0.010765954052867406, 'bull_atr_max_pct': 0.10568357719398191, 'bull_tp_mult': 1.195328478432801, 'bull_tsl_mult': 0.7754449647249064, 'bull_time_stop': 251, 'bull_use_sma': True, 'bull_use_ema': True, 'bull_use_atr': False, 'bull_use_adx': True, 'bull_use_spike': False, 'bull_rsi_required': True, 'bear_strategy': 'breakout', 'bear_bb_std_mult': 2.050837736408557, 'bear_rsi_os': 31, 'bear_rsi_ob': 45, 'bear_adx_thresh': 29.42765682633247, 'bear_atr_min_pct': 0.021033442834829195, 'bear_atr_max_pct': 0.04388306565232319, 'bear_tp_mult': 1.6455901282844267, 'bear_tsl_mult': 0.18731140215275777, 'bear_time_stop': 48, 'bear_use_sma': False, 'bear_use_ema': True, 'bear_use_atr': False, 'bear_use_adx': True, 'bear_use_spike': True, 'bear_rsi_required': True, 'sideways_strategy': 'mean_reversion', 'sideways_bb_std_mult': 1.5499989651156678, 'sideways_rsi_os': 45, 'sideways_rsi_ob': 80, 'sideways_adx_thresh': 14.733444173568573, 'sideways_atr_min_pct': 0.013433342299539361, 'sideways_atr_max_pct': 0.038561511782785114, 'sideways_tp_mult': 2.688392571628424, 'sideways_tsl_mult': 0.055770959768201456, 'sideways_time_stop': 234, 'sideways_use_sma': True, 'sideways_use_ema': True, 'sideways_use_atr': False, 'sideways_use_adx': True, 'sideways_use_spike': True, 'sideways_rsi_required': False}.
[I 2025-09-01 14:42:35,586] Trial 301 finished with values: [-0.06137615774146665, 0.06131745156209299] and parameters: {'p_sma': 20, 'p_std': 14, 'p_atr': 7, 'p_adx': 22, 'rsi_period': 69, 'ema1': 28, 'ema2': 39, 'slip_atr_k': 0.0108602333304548, 'slip_spread_k': 0.20562813725724188, 'spread_hl_frac': 0.039636135775584086, 'bb_std_mult': 3.358244289701558, 'rsi_os': 43, 'rsi_ob': 67, 'vol_spike': 0.0780961478814198, 'adx_thresh': 21.410063142813947, 'atr_min_pct': 0.01032305552666912, 'atr_max_pct': 0.11997722503259023, 'tp_mult': 2.0697885845566217, 'tsl_mult': 0.553488226944213, 'strategy': 'breakout', 'time_stop': 81, 'use_sma': False, 'use_atr': True, 'use_adx': True, 'use_ema': True, 'use_spike': True, 'rsi_required': True, 'edge_k': 0.3933102461079745, 'edge_cap': 0.9102887151506938, 'bull_strategy': 'mean_reversion', 'bull_bb_std_mult': 1.5499917658216702, 'bull_rsi_os': 30, 'bull_rsi_ob': 57, 'bull_adx_thresh': 15.703990103398066, 'bull_atr_min_pct': 0.000835476449633837, 'bull_atr_max_pct': 0.0347411051378753, 'bull_tp_mult': 1.122426804288035, 'bull_tsl_mult': 0.7503063827893062, 'bull_time_stop': 30, 'bull_use_sma': False, 'bull_use_ema': False, 'bull_use_atr': False, 'bull_use_adx': False, 'bull_use_spike': True, 'bull_rsi_required': True, 'bear_strategy': 'mean_reversion', 'bear_bb_std_mult': 2.0613238944741634, 'bear_rsi_os': 52, 'bear_rsi_ob': 64, 'bear_adx_thresh': 10.884172393571209, 'bear_atr_min_pct': 0.028493906743074372, 'bear_atr_max_pct': 0.024405974966709147, 'bear_tp_mult': 1.802466614577438, 'bear_tsl_mult': 0.12333818318849032, 'bear_time_stop': 258, 'bear_use_sma': True, 'bear_use_ema': False, 'bear_use_atr': True, 'bear_use_adx': False, 'bear_use_spike': False, 'bear_rsi_required': True, 'sideways_strategy': 'mean_reversion', 'sideways_bb_std_mult': 1.5604053827996023, 'sideways_rsi_os': 33, 'sideways_rsi_ob': 62, 'sideways_adx_thresh': 27.739837083009025, 'sideways_atr_min_pct': 0.013580696515329713, 'sideways_atr_max_pct': 0.03454797605785616, 'sideways_tp_mult': 2.5791336293130867, 'sideways_tsl_mult': 0.3354736883528823, 'sideways_time_stop': 102, 'sideways_use_sma': False, 'sideways_use_ema': True, 'sideways_use_atr': False, 'sideways_use_adx': False, 'sideways_use_spike': True, 'sideways_rsi_required': False}.
[I 2025-09-01 14:42:35,977] Trial 302 finished with values: [-0.04042688836218944, 0.0402429514865113] and parameters: {'p_sma': 7, 'p_std': 14, 'p_atr': 11, 'p_adx': 19, 'rsi_period': 75, 'ema1': 22, 'ema2': 19, 'slip_atr_k': 0.04308801226024354, 'slip_spread_k': 0.9146218678684717, 'spread_hl_frac': 0.03959160893495614, 'bb_std_mult': 2.5545098772989476, 'rsi_os': 50, 'rsi_ob': 90, 'vol_spike': 0.01706335175770571, 'adx_thresh': 26.178173656892024, 'atr_min_pct': 0.017017279903074473, 'atr_max_pct': 0.05931730519221017, 'tp_mult': 2.3686524337184682, 'tsl_mult': 0.5784621577765785, 'strategy': 'breakout', 'time_stop': 224, 'use_sma': False, 'use_atr': True, 'use_adx': True, 'use_ema': True, 'use_spike': True, 'rsi_required': True, 'edge_k': 1.5644239097175143, 'edge_cap': 0.9169087477422992, 'bull_strategy': 'mean_reversion', 'bull_bb_std_mult': 1.5305655370931182, 'bull_rsi_os': 54, 'bull_rsi_ob': 55, 'bull_adx_thresh': 13.496047630905204, 'bull_atr_min_pct': 0.0009874269248956596, 'bull_atr_max_pct': 0.03547433995566836, 'bull_tp_mult': 2.5361430961132907, 'bull_tsl_mult': 0.7538426926750916, 'bull_time_stop': 31, 'bull_use_sma': False, 'bull_use_ema': False, 'bull_use_atr': False, 'bull_use_adx': False, 'bull_use_spike': True, 'bull_rsi_required': True, 'bear_strategy': 'mean_reversion', 'bear_bb_std_mult': 1.7728441631034348, 'bear_rsi_os': 52, 'bear_rsi_ob': 48, 'bear_adx_thresh': 10.960616786308337, 'bear_atr_min_pct': 0.005806766341038998, 'bear_atr_max_pct': 0.037599250365411896, 'bear_tp_mult': 1.7888698956941036, 'bear_tsl_mult': 0.6447102201529002, 'bear_time_stop': 260, 'bear_use_sma': True, 'bear_use_ema': False, 'bear_use_atr': True, 'bear_use_adx': False, 'bear_use_spike': False, 'bear_rsi_required': True, 'sideways_strategy': 'breakout', 'sideways_bb_std_mult': 2.049585799829209, 'sideways_rsi_os': 33, 'sideways_rsi_ob': 78, 'sideways_adx_thresh': 32.17021421440109, 'sideways_atr_min_pct': 0.006484540513611421, 'sideways_atr_max_pct': 0.03470694563154048, 'sideways_tp_mult': 1.5448347796083606, 'sideways_tsl_mult': 0.9253868455810422, 'sideways_time_stop': 89, 'sideways_use_sma': False, 'sideways_use_ema': True, 'sideways_use_atr': False, 'sideways_use_adx': False, 'sideways_use_spike': True, 'sideways_rsi_required': False}.
[I 2025-09-01 14:42:36,203] Trial 300 finished with values: [-1000000000.0, 1000000000.0] and parameters: {'p_sma': 23, 'p_std': 40, 'p_atr': 11, 'p_adx': 19, 'rsi_period': 74, 'ema1': 28, 'ema2': 52, 'slip_atr_k': 0.08176360874401908, 'slip_spread_k': 0.4759144186130229, 'spread_hl_frac': 0.03962368377823417, 'bb_std_mult': 2.209367487033914, 'rsi_os': 17, 'rsi_ob': 83, 'vol_spike': 0.11883004467170138, 'adx_thresh': 32.325026226663184, 'atr_min_pct': 0.022286195434883423, 'atr_max_pct': 0.05839477455593107, 'tp_mult': 1.3866220428775906, 'tsl_mult': 0.556193420047729, 'strategy': 'breakout', 'time_stop': 96, 'use_sma': False, 'use_atr': True, 'use_adx': True, 'use_ema': True, 'use_spike': True, 'rsi_required': True, 'edge_k': 0.6882929694176068, 'edge_cap': 0.6466591305601366, 'bull_strategy': 'mean_reversion', 'bull_bb_std_mult': 1.5532625854235897, 'bull_rsi_os': 30, 'bull_rsi_ob': 48, 'bull_adx_thresh': 15.841307376040806, 'bull_atr_min_pct': 0.004374031710998874, 'bull_atr_max_pct': 0.08144054727762043, 'bull_tp_mult': 1.2111372443295352, 'bull_tsl_mult': 0.20048389680502027, 'bull_time_stop': 31, 'bull_use_sma': False, 'bull_use_ema': False, 'bull_use_atr': False, 'bull_use_adx': False, 'bull_use_spike': True, 'bull_rsi_required': True, 'bear_strategy': 'mean_reversion', 'bear_bb_std_mult': 2.2981730894617893, 'bear_rsi_os': 14, 'bear_rsi_ob': 45, 'bear_adx_thresh': 33.035360572007576, 'bear_atr_min_pct': 0.005956213216794709, 'bear_atr_max_pct': 0.024629987171007728, 'bear_tp_mult': 1.810522862710835, 'bear_tsl_mult': 0.9162831829578834, 'bear_time_stop': 71, 'bear_use_sma': True, 'bear_use_ema': False, 'bear_use_atr': True, 'bear_use_adx': False, 'bear_use_spike': False, 'bear_rsi_required': True, 'sideways_strategy': 'mean_reversion', 'sideways_bb_std_mult': 2.07304536237304, 'sideways_rsi_os': 33, 'sideways_rsi_ob': 76, 'sideways_adx_thresh': 14.64428978937833, 'sideways_atr_min_pct': 0.013542534341851716, 'sideways_atr_max_pct': 0.03554904295010859, 'sideways_tp_mult': 2.662372357921927, 'sideways_tsl_mult': 0.8345415963071632, 'sideways_time_stop': 152, 'sideways_use_sma': False, 'sideways_use_ema': True, 'sideways_use_atr': False, 'sideways_use_adx': False, 'sideways_use_spike': True, 'sideways_rsi_required': False}.
[I 2025-09-01 14:42:36,481] Trial 299 finished with values: [-0.038181970027026724, 0.042248285638910206] and parameters: {'p_sma': 42, 'p_std': 11, 'p_atr': 11, 'p_adx': 19, 'rsi_period': 60, 'ema1': 28, 'ema2': 19, 'slip_atr_k': 0.025622194979048538, 'slip_spread_k': 0.4287090911866301, 'spread_hl_frac': 0.03757846588547071, 'bb_std_mult': 2.211937294580031, 'rsi_os': 29, 'rsi_ob': 83, 'vol_spike': 0.2526708555666158, 'adx_thresh': 32.49919701566598, 'atr_min_pct': 0.01691760324104503, 'atr_max_pct': 0.06891794643684054, 'tp_mult': 2.3706364251894896, 'tsl_mult': 0.6093999343300522, 'strategy': 'breakout', 'time_stop': 82, 'use_sma': False, 'use_atr': True, 'use_adx': True, 'use_ema': False, 'use_spike': True, 'rsi_required': False, 'edge_k': 0.37899770258213417, 'edge_cap': 0.9139932340163522, 'bull_strategy': 'breakout', 'bull_bb_std_mult': 1.5627125854175141, 'bull_rsi_os': 18, 'bull_rsi_ob': 53, 'bull_adx_thresh': 13.420921752480671, 'bull_atr_min_pct': 0.0025942868352090208, 'bull_atr_max_pct': 0.0817411401719597, 'bull_tp_mult': 1.166993383285916, 'bull_tsl_mult': 0.7752569371671356, 'bull_time_stop': 243, 'bull_use_sma': False, 'bull_use_ema': False, 'bull_use_atr': False, 'bull_use_adx': True, 'bull_use_spike': False, 'bull_rsi_required': False, 'bear_strategy': 'breakout', 'bear_bb_std_mult': 3.1165522745847363, 'bear_rsi_os': 52, 'bear_rsi_ob': 45, 'bear_adx_thresh': 24.857784958054047, 'bear_atr_min_pct': 0.005895404872081351, 'bear_atr_max_pct': 0.055704760935290046, 'bear_tp_mult': 1.6451392496144213, 'bear_tsl_mult': 0.6473268328691149, 'bear_time_stop': 279, 'bear_use_sma': True, 'bear_use_ema': False, 'bear_use_atr': False, 'bear_use_adx': False, 'bear_use_spike': True, 'bear_rsi_required': False, 'sideways_strategy': 'mean_reversion', 'sideways_bb_std_mult': 2.073332342716559, 'sideways_rsi_os': 35, 'sideways_rsi_ob': 63, 'sideways_adx_thresh': 7.899925464979926, 'sideways_atr_min_pct': 0.01732150267398689, 'sideways_atr_max_pct': 0.13551175058468373, 'sideways_tp_mult': 1.5551948966807803, 'sideways_tsl_mult': 0.2857466501970321, 'sideways_time_stop': 103, 'sideways_use_sma': True, 'sideways_use_ema': True, 'sideways_use_atr': False, 'sideways_use_adx': True, 'sideways_use_spike': True, 'sideways_rsi_required': False}.
[I 2025-09-01 14:42:37,279] Trial 305 finished with values: [-1000000000.0, 1000000000.0] and parameters: {'p_sma': 12, 'p_std': 12, 'p_atr': 10, 'p_adx': 16, 'rsi_period': 65, 'ema1': 30, 'ema2': 39, 'slip_atr_k': 0.03556720844299826, 'slip_spread_k': 0.47914708092389496, 'spread_hl_frac': 0.041487992369593475, 'bb_std_mult': 2.618034777385722, 'rsi_os': 9, 'rsi_ob': 50, 'vol_spike': 0.02283813969377653, 'adx_thresh': 16.29423210975508, 'atr_min_pct': 0.007412608683271669, 'atr_max_pct': 0.06773810631074316, 'tp_mult': 2.36384937772947, 'tsl_mult': 0.5376001857127745, 'strategy': 'mean_reversion', 'time_stop': 235, 'use_sma': True, 'use_atr': False, 'use_adx': False, 'use_ema': False, 'use_spike': False, 'rsi_required': False, 'edge_k': 0.003581119420159262, 'edge_cap': 0.9592225064065178, 'bull_strategy': 'breakout', 'bull_bb_std_mult': 0.5256377791090047, 'bull_rsi_os': 16, 'bull_rsi_ob': 55, 'bull_adx_thresh': 14.352688960066175, 'bull_atr_min_pct': 0.008310061838161577, 'bull_atr_max_pct': 0.0286502670105358, 'bull_tp_mult': 1.053005782897289, 'bull_tsl_mult': 0.9310519814595918, 'bull_time_stop': 244, 'bull_use_sma': False, 'bull_use_ema': True, 'bull_use_atr': True, 'bull_use_adx': True, 'bull_use_spike': False, 'bull_rsi_required': False, 'bear_strategy': 'breakout', 'bear_bb_std_mult': 3.0887852170936814, 'bear_rsi_os': 54, 'bear_rsi_ob': 46, 'bear_adx_thresh': 22.609967024998703, 'bear_atr_min_pct': 0.007819517328420542, 'bear_atr_max_pct': 0.05836426854096449, 'bear_tp_mult': 1.7222763874750635, 'bear_tsl_mult': 0.4525726954505619, 'bear_time_stop': 242, 'bear_use_sma': False, 'bear_use_ema': True, 'bear_use_atr': False, 'bear_use_adx': False, 'bear_use_spike': False, 'bear_rsi_required': False, 'sideways_strategy': 'mean_reversion', 'sideways_bb_std_mult': 1.2952162556849505, 'sideways_rsi_os': 36, 'sideways_rsi_ob': 78, 'sideways_adx_thresh': 34.96937551105872, 'sideways_atr_min_pct': 0.011706836530871133, 'sideways_atr_max_pct': 0.042320536130185604, 'sideways_tp_mult': 1.0360015092118369, 'sideways_tsl_mult': 0.883443347717742, 'sideways_time_stop': 83, 'sideways_use_sma': True, 'sideways_use_ema': False, 'sideways_use_atr': True, 'sideways_use_adx': True, 'sideways_use_spike': False, 'sideways_rsi_required': True}.
[I 2025-09-01 14:42:37,354] Trial 304 finished with values: [-1000000000.0, 1000000000.0] and parameters: {'p_sma': 10, 'p_std': 12, 'p_atr': 18, 'p_adx': 23, 'rsi_period': 74, 'ema1': 28, 'ema2': 55, 'slip_atr_k': 0.08315215919247021, 'slip_spread_k': 0.47992110901124335, 'spread_hl_frac': 0.04074306640807009, 'bb_std_mult': 1.747346587528164, 'rsi_os': 52, 'rsi_ob': 85, 'vol_spike': 0.024123939269253755, 'adx_thresh': 25.230204811327358, 'atr_min_pct': 0.023962487287164477, 'atr_max_pct': 0.06861779430278597, 'tp_mult': 2.345370749076506, 'tsl_mult': 0.5292237047471852, 'strategy': 'mean_reversion', 'time_stop': 233, 'use_sma': False, 'use_atr': False, 'use_adx': False, 'use_ema': False, 'use_spike': False, 'rsi_required': True, 'edge_k': 0.0026006997311682767, 'edge_cap': 0.9561904755389161, 'bull_strategy': 'breakout', 'bull_bb_std_mult': 1.400401917133285, 'bull_rsi_os': 13, 'bull_rsi_ob': 48, 'bull_adx_thresh': 8.984069707479875, 'bull_atr_min_pct': 0.004654898132377358, 'bull_atr_max_pct': 0.029751458855801414, 'bull_tp_mult': 2.343749099959417, 'bull_tsl_mult': 0.926134699695413, 'bull_time_stop': 243, 'bull_use_sma': False, 'bull_use_ema': True, 'bull_use_atr': True, 'bull_use_adx': True, 'bull_use_spike': False, 'bull_rsi_required': True, 'bear_strategy': 'breakout', 'bear_bb_std_mult': 3.107367498017987, 'bear_rsi_os': 52, 'bear_rsi_ob': 68, 'bear_adx_thresh': 7.040092868001805, 'bear_atr_min_pct': 0.005108790271151409, 'bear_atr_max_pct': 0.015018656991947332, 'bear_tp_mult': 1.7190384722313043, 'bear_tsl_mult': 0.06598749970458473, 'bear_time_stop': 240, 'bear_use_sma': False, 'bear_use_ema': True, 'bear_use_atr': False, 'bear_use_adx': False, 'bear_use_spike': False, 'bear_rsi_required': True, 'sideways_strategy': 'mean_reversion', 'sideways_bb_std_mult': 1.4519911492155504, 'sideways_rsi_os': 36, 'sideways_rsi_ob': 82, 'sideways_adx_thresh': 33.95458609769004, 'sideways_atr_min_pct': 0.02000857298093763, 'sideways_atr_max_pct': 0.0418735077714455, 'sideways_tp_mult': 2.667537071010222, 'sideways_tsl_mult': 0.8314204260745621, 'sideways_time_stop': 155, 'sideways_use_sma': True, 'sideways_use_ema': False, 'sideways_use_atr': True, 'sideways_use_adx': True, 'sideways_use_spike': False, 'sideways_rsi_required': True}.
[I 2025-09-01 14:42:37,363] Trial 306 finished with values: [-1000000000.0, 1000000000.0] and parameters: {'p_sma': 58, 'p_std': 45, 'p_atr': 19, 'p_adx': 23, 'rsi_period': 71, 'ema1': 30, 'ema2': 40, 'slip_atr_k': 0.035348313716126824, 'slip_spread_k': 0.09576239482354976, 'spread_hl_frac': 0.04127051533773736, 'bb_std_mult': 2.575409851027976, 'rsi_os': 52, 'rsi_ob': 47, 'vol_spike': 0.06855889977631421, 'adx_thresh': 25.66572169753195, 'atr_min_pct': 0.019229824906760916, 'atr_max_pct': 0.0725846988336913, 'tp_mult': 1.128774507983105, 'tsl_mult': 0.5312887243159187, 'strategy': 'mean_reversion', 'time_stop': 98, 'use_sma': True, 'use_atr': False, 'use_adx': False, 'use_ema': False, 'use_spike': False, 'rsi_required': True, 'edge_k': 0.2929318225213867, 'edge_cap': 0.9629757178156196, 'bull_strategy': 'breakout', 'bull_bb_std_mult': 1.3881980666272191, 'bull_rsi_os': 26, 'bull_rsi_ob': 71, 'bull_adx_thresh': 11.399168382525938, 'bull_atr_min_pct': 0.019919646731240914, 'bull_atr_max_pct': 0.029433897693226473, 'bull_tp_mult': 1.0379951220467838, 'bull_tsl_mult': 0.9344890887897913, 'bull_time_stop': 16, 'bull_use_sma': False, 'bull_use_ema': True, 'bull_use_atr': True, 'bull_use_adx': True, 'bull_use_spike': False, 'bull_rsi_required': True, 'bear_strategy': 'breakout', 'bear_bb_std_mult': 2.585364749951565, 'bear_rsi_os': 54, 'bear_rsi_ob': 46, 'bear_adx_thresh': 6.922993541427493, 'bear_atr_min_pct': 0.010270340393964749, 'bear_atr_max_pct': 0.014631973997255401, 'bear_tp_mult': 1.711844862438216, 'bear_tsl_mult': 0.6817699703319174, 'bear_time_stop': 250, 'bear_use_sma': False, 'bear_use_ema': True, 'bear_use_atr': False, 'bear_use_adx': False, 'bear_use_spike': False, 'bear_rsi_required': True, 'sideways_strategy': 'breakout', 'sideways_bb_std_mult': 1.28502584838085, 'sideways_rsi_os': 11, 'sideways_rsi_ob': 78, 'sideways_adx_thresh': 34.57468306023518, 'sideways_atr_min_pct': 0.024718978210965796, 'sideways_atr_max_pct': 0.042732078992920634, 'sideways_tp_mult': 2.060021218038056, 'sideways_tsl_mult': 0.44261340130724725, 'sideways_time_stop': 83, 'sideways_use_sma': True, 'sideways_use_ema': False, 'sideways_use_atr': True, 'sideways_use_adx': True, 'sideways_use_spike': False, 'sideways_rsi_required': True}.
