[I 2025-09-01 14:24:51,804] Trial 186 finished with values: [-0.10168584688105475, 0.1015579909270107] and parameters: {'p_sma': 28, 'p_std': 8, 'p_atr': 15, 'p_adx': 14, 'rsi_period': 71, 'ema1': 17, 'ema2': 48, 'slip_atr_k': 0.2148867201322248, 'slip_spread_k': 0.4695187653766391, 'spread_hl_frac': 0.027382463424508598, 'bb_std_mult': 1.212721149266819, 'rsi_os': 10, 'rsi_ob': 74, 'vol_spike': 0.021273648386963058, 'adx_thresh': 15.751369400081938, 'atr_min_pct': 0.006015369653746741, 'atr_max_pct': 0.07827513170829985, 'tp_mult': 1.7742947912758773, 'tsl_mult': 0.5673491502300816, 'strategy': 'breakout', 'time_stop': 47, 'use_sma': False, 'use_atr': False, 'use_adx': False, 'use_ema': False, 'use_spike': False, 'rsi_required': True, 'edge_k': 1.7474769196901319, 'edge_cap': 0.1668511053386597, 'bull_strategy': 'breakout', 'bull_bb_std_mult': 0.7260201699923046, 'bull_rsi_os': 22, 'bull_rsi_ob': 54, 'bull_adx_thresh': 10.748969641002878, 'bull_atr_min_pct': 0.0023843524898198108, 'bull_atr_max_pct': 0.028224800779925008, 'bull_tp_mult': 2.502319219272344, 'bull_tsl_mult': 0.2440431205696305, 'bull_time_stop': 164, 'bull_use_sma': False, 'bull_use_ema': False, 'bull_use_atr': False, 'bull_use_adx': True, 'bull_use_spike': False, 'bull_rsi_required': True, 'bear_strategy': 'breakout', 'bear_bb_std_mult': 1.8848262297696534, 'bear_rsi_os': 49, 'bear_rsi_ob': 46, 'bear_adx_thresh': 6.257222834479709, 'bear_atr_min_pct': 0.004906064880271671, 'bear_atr_max_pct': 0.08243681184282037, 'bear_tp_mult': 1.8641805728757368, 'bear_tsl_mult': 0.8669761967631995, 'bear_time_stop': 66, 'bear_use_sma': False, 'bear_use_ema': False, 'bear_use_atr': False, 'bear_use_adx': False, 'bear_use_spike': False, 'bear_rsi_required': True, 'sideways_strategy': 'mean_reversion', 'sideways_bb_std_mult': 1.3770528708075322, 'sideways_rsi_os': 31, 'sideways_rsi_ob': 81, 'sideways_adx_thresh': 31.77697787339183, 'sideways_atr_min_pct': 0.018113804935203773, 'sideways_atr_max_pct': 0.06926116136766314, 'sideways_tp_mult': 1.843281406153333, 'sideways_tsl_mult': 0.7979996388157092, 'sideways_time_stop': 147, 'sideways_use_sma': True, 'sideways_use_ema': True, 'sideways_use_atr': False, 'sideways_use_adx': True, 'sideways_use_spike': True, 'sideways_rsi_required': False}.
[I 2025-09-01 14:24:52,184] Trial 190 finished with values: [-0.05400797812069902, 0.05345696186708174] and parameters: {'p_sma': 7, 'p_std': 11, 'p_atr': 16, 'p_adx': 21, 'rsi_period': 71, 'ema1': 30, 'ema2': 24, 'slip_atr_k': 0.053452031540008396, 'slip_spread_k': 0.4648473350185208, 'spread_hl_frac': 0.04196431885939524, 'bb_std_mult': 2.4976975655295224, 'rsi_os': 24, 'rsi_ob': 87, 'vol_spike': 0.004367084228909995, 'adx_thresh': 26.84347683915741, 'atr_min_pct': 0.006904887962122988, 'atr_max_pct': 0.09638055381911226, 'tp_mult': 2.3319014552742106, 'tsl_mult': 0.9025485878358745, 'strategy': 'breakout', 'time_stop': 252, 'use_sma': False, 'use_atr': False, 'use_adx': False, 'use_ema': False, 'use_spike': False, 'rsi_required': True, 'edge_k': 0.7566134144067957, 'edge_cap': 0.9500237320374533, 'bull_strategy': 'breakout', 'bull_bb_std_mult': 1.3214683604075703, 'bull_rsi_os': 17, 'bull_rsi_ob': 66, 'bull_adx_thresh': 29.355376751328734, 'bull_atr_min_pct': 0.02562781611329161, 'bull_atr_max_pct': 0.10511847944796521, 'bull_tp_mult': 1.1457289180674286, 'bull_tsl_mult': 0.9128934358591475, 'bull_time_stop': 6, 'bull_use_sma': True, 'bull_use_ema': True, 'bull_use_atr': False, 'bull_use_adx': True, 'bull_use_spike': False, 'bull_rsi_required': True, 'bear_strategy': 'breakout', 'bear_bb_std_mult': 1.854894724378643, 'bear_rsi_os': 54, 'bear_rsi_ob': 46, 'bear_adx_thresh': 27.314684920422867, 'bear_atr_min_pct': 0.002495960161049502, 'bear_atr_max_pct': 0.016033997005880832, 'bear_tp_mult': 1.8400671402942848, 'bear_tsl_mult': 0.8345604384384419, 'bear_time_stop': 141, 'bear_use_sma': False, 'bear_use_ema': True, 'bear_use_atr': False, 'bear_use_adx': False, 'bear_use_spike': False, 'bear_rsi_required': True, 'sideways_strategy': 'breakout', 'sideways_bb_std_mult': 1.3499624395032865, 'sideways_rsi_os': 15, 'sideways_rsi_ob': 81, 'sideways_adx_thresh': 15.268344595858224, 'sideways_atr_min_pct': 0.009172014707917465, 'sideways_atr_max_pct': 0.04229761056026293, 'sideways_tp_mult': 2.278920596516118, 'sideways_tsl_mult': 0.9198285419355411, 'sideways_time_stop': 102, 'sideways_use_sma': False, 'sideways_use_ema': True, 'sideways_use_atr': True, 'sideways_use_adx': True, 'sideways_use_spike': True, 'sideways_rsi_required': False}.
[I 2025-09-01 14:24:52,973] Trial 192 finished with values: [-1000000000.0, 1000000000.0] and parameters: {'p_sma': 20, 'p_std': 39, 'p_atr': 25, 'p_adx': 21, 'rsi_period': 45, 'ema1': 17, 'ema2': 18, 'slip_atr_k': 0.03186110579087847, 'slip_spread_k': 0.4357866063621546, 'spread_hl_frac': 0.04383836725784494, 'bb_std_mult': 1.23617779975244, 'rsi_os': 53, 'rsi_ob': 84, 'vol_spike': 0.0049114633111181655, 'adx_thresh': 28.600952586205374, 'atr_min_pct': 0.010332135775684585, 'atr_max_pct': 0.04107834836512247, 'tp_mult': 1.0987132515408538, 'tsl_mult': 0.20747381114390245, 'strategy': 'mean_reversion', 'time_stop': 192, 'use_sma': False, 'use_atr': False, 'use_adx': False, 'use_ema': False, 'use_spike': False, 'rsi_required': True, 'edge_k': 0.7359307764532267, 'edge_cap': 0.9544290188981222, 'bull_strategy': 'breakout', 'bull_bb_std_mult': 1.006966092948096, 'bull_rsi_os': 52, 'bull_rsi_ob': 51, 'bull_adx_thresh': 24.91159620519215, 'bull_atr_min_pct': 0.026841646676767007, 'bull_atr_max_pct': 0.041393073622724305, 'bull_tp_mult': 1.0947736634195122, 'bull_tsl_mult': 0.9046513954160238, 'bull_time_stop': 38, 'bull_use_sma': False, 'bull_use_ema': True, 'bull_use_atr': True, 'bull_use_adx': True, 'bull_use_spike': True, 'bull_rsi_required': True, 'bear_strategy': 'breakout', 'bear_bb_std_mult': 2.722071249442393, 'bear_rsi_os': 40, 'bear_rsi_ob': 46, 'bear_adx_thresh': 26.155477074086853, 'bear_atr_min_pct': 0.008476577081348264, 'bear_atr_max_pct': 0.02217087223282538, 'bear_tp_mult': 1.6984513430197274, 'bear_tsl_mult': 0.8679735807138255, 'bear_time_stop': 219, 'bear_use_sma': False, 'bear_use_ema': True, 'bear_use_atr': False, 'bear_use_adx': False, 'bear_use_spike': True, 'bear_rsi_required': True, 'sideways_strategy': 'mean_reversion', 'sideways_bb_std_mult': 2.908381865980508, 'sideways_rsi_os': 35, 'sideways_rsi_ob': 78, 'sideways_adx_thresh': 34.952351774449966, 'sideways_atr_min_pct': 0.014208822336835776, 'sideways_atr_max_pct': 0.07042351537028911, 'sideways_tp_mult': 1.5969738127208135, 'sideways_tsl_mult': 0.04522525048083842, 'sideways_time_stop': 148, 'sideways_use_sma': True, 'sideways_use_ema': True, 'sideways_use_atr': False, 'sideways_use_adx': True, 'sideways_use_spike': False, 'sideways_rsi_required': False}.
[I 2025-09-01 14:25:32,373] Trial 193 finished with values: [-1000000000.0, 1000000000.0] and parameters: {'p_sma': 20, 'p_std': 58, 'p_atr': 25, 'p_adx': 21, 'rsi_period': 77, 'ema1': 22, 'ema2': 18, 'slip_atr_k': 0.03182562172709978, 'slip_spread_k': 0.43639309095672274, 'spread_hl_frac': 0.042311637375262695, 'bb_std_mult': 2.1913249461284283, 'rsi_os': 24, 'rsi_ob': 84, 'vol_spike': 0.006093582648278582, 'adx_thresh': 12.366204674649207, 'atr_min_pct': 0.010714231630112845, 'atr_max_pct': 0.12590789296490176, 'tp_mult': 2.288785195188624, 'tsl_mult': 0.6105051945099531, 'strategy': 'mean_reversion', 'time_stop': 251, 'use_sma': True, 'use_atr': False, 'use_adx': False, 'use_ema': False, 'use_spike': True, 'rsi_required': False, 'edge_k': 0.07812610030373213, 'edge_cap': 0.9512979123385669, 'bull_strategy': 'mean_reversion', 'bull_bb_std_mult': 1.6016714260384812, 'bull_rsi_os': 19, 'bull_rsi_ob': 51, 'bull_adx_thresh': 24.446677893559066, 'bull_atr_min_pct': 0.018894298549679295, 'bull_atr_max_pct': 0.04113411072690948, 'bull_tp_mult': 1.5530462472939381, 'bull_tsl_mult': 0.16284487573940704, 'bull_time_stop': 38, 'bull_use_sma': False, 'bull_use_ema': True, 'bull_use_atr': True, 'bull_use_adx': True, 'bull_use_spike': True, 'bull_rsi_required': True, 'bear_strategy': 'breakout', 'bear_bb_std_mult': 1.6398718651507544, 'bear_rsi_os': 54, 'bear_rsi_ob': 68, 'bear_adx_thresh': 26.888989103568278, 'bear_atr_min_pct': 0.019441806996141897, 'bear_atr_max_pct': 0.02274712154340394, 'bear_tp_mult': 1.0149725130393104, 'bear_tsl_mult': 0.300025748989347, 'bear_time_stop': 232, 'bear_use_sma': False, 'bear_use_ema': True, 'bear_use_atr': False, 'bear_use_adx': False, 'bear_use_spike': True, 'bear_rsi_required': False, 'sideways_strategy': 'mean_reversion', 'sideways_bb_std_mult': 2.922569141795467, 'sideways_rsi_os': 15, 'sideways_rsi_ob': 78, 'sideways_adx_thresh': 11.999388513494551, 'sideways_atr_min_pct': 0.015663184273778007, 'sideways_atr_max_pct': 0.031196563271863945, 'sideways_tp_mult': 1.606568081982436, 'sideways_tsl_mult': 0.19718478086840208, 'sideways_time_stop': 49, 'sideways_use_sma': True, 'sideways_use_ema': False, 'sideways_use_atr': False, 'sideways_use_adx': True, 'sideways_use_spike': False, 'sideways_rsi_required': True}.
[I 2025-09-01 14:25:32,790] Trial 195 finished with values: [-1000000000.0, 1000000000.0] and parameters: {'p_sma': 14, 'p_std': 11, 'p_atr': 12, 'p_adx': 20, 'rsi_period': 76, 'ema1': 30, 'ema2': 41, 'slip_atr_k': 0.24960300775181815, 'slip_spread_k': 0.4483696120913781, 'spread_hl_frac': 0.03809206593583088, 'bb_std_mult': 2.7293850081693636, 'rsi_os': 8, 'rsi_ob': 80, 'vol_spike': 0.01546627390191288, 'adx_thresh': 27.570341856343195, 'atr_min_pct': 0.00827564262064167, 'atr_max_pct': 0.014024624521068688, 'tp_mult': 2.288248831063243, 'tsl_mult': 0.16697748908821286, 'strategy': 'mean_reversion', 'time_stop': 88, 'use_sma': True, 'use_atr': False, 'use_adx': True, 'use_ema': False, 'use_spike': False, 'rsi_required': True, 'edge_k': 1.8224153003898755, 'edge_cap': 0.8994365316656145, 'bull_strategy': 'mean_reversion', 'bull_bb_std_mult': 1.4425926318194873, 'bull_rsi_os': 19, 'bull_rsi_ob': 76, 'bull_adx_thresh': 14.049507146490821, 'bull_atr_min_pct': 0.013356131335897145, 'bull_atr_max_pct': 0.11035284319836232, 'bull_tp_mult': 2.0399270108128587, 'bull_tsl_mult': 0.9396602854750679, 'bull_time_stop': 20, 'bull_use_sma': False, 'bull_use_ema': False, 'bull_use_atr': True, 'bull_use_adx': True, 'bull_use_spike': True, 'bull_rsi_required': True, 'bear_strategy': 'breakout', 'bear_bb_std_mult': 1.6544445365733123, 'bear_rsi_os': 29, 'bear_rsi_ob': 66, 'bear_adx_thresh': 5.524446748417756, 'bear_atr_min_pct': 0.014099171927421087, 'bear_atr_max_pct': 0.03249780778786281, 'bear_tp_mult': 1.7333072183146314, 'bear_tsl_mult': 0.13786340633835453, 'bear_time_stop': 256, 'bear_use_sma': False, 'bear_use_ema': True, 'bear_use_atr': False, 'bear_use_adx': False, 'bear_use_spike': False, 'bear_rsi_required': True, 'sideways_strategy': 'mean_reversion', 'sideways_bb_std_mult': 1.1843819254540193, 'sideways_rsi_os': 27, 'sideways_rsi_ob': 78, 'sideways_adx_thresh': 34.09679390198094, 'sideways_atr_min_pct': 0.01299327560799822, 'sideways_atr_max_pct': 0.08449514725454979, 'sideways_tp_mult': 2.6752504567122086, 'sideways_tsl_mult': 0.888438522537739, 'sideways_time_stop': 128, 'sideways_use_sma': True, 'sideways_use_ema': False, 'sideways_use_atr': False, 'sideways_use_adx': True, 'sideways_use_spike': False, 'sideways_rsi_required': False}.
[I 2025-09-01 14:25:33,370] Trial 194 finished with values: [-1000000000.0, 1000000000.0] and parameters: {'p_sma': 11, 'p_std': 11, 'p_atr': 11, 'p_adx': 20, 'rsi_period': 73, 'ema1': 30, 'ema2': 41, 'slip_atr_k': 0.002644232315900233, 'slip_spread_k': 0.4316773972358827, 'spread_hl_frac': 0.03817420685948365, 'bb_std_mult': 1.3147068420759354, 'rsi_os': 8, 'rsi_ob': 84, 'vol_spike': 0.1558404909500312, 'adx_thresh': 27.47006598799935, 'atr_min_pct': 0.008377104480181558, 'atr_max_pct': 0.062453921437081575, 'tp_mult': 2.3096763587601616, 'tsl_mult': 0.20536650937561912, 'strategy': 'mean_reversion', 'time_stop': 86, 'use_sma': True, 'use_atr': False, 'use_adx': False, 'use_ema': False, 'use_spike': False, 'rsi_required': True, 'edge_k': 0.03498374735158516, 'edge_cap': 0.46784033840087286, 'bull_strategy': 'breakout', 'bull_bb_std_mult': 1.4478151112893274, 'bull_rsi_os': 17, 'bull_rsi_ob': 75, 'bull_adx_thresh': 24.492481520808468, 'bull_atr_min_pct': 0.02676768250580597, 'bull_atr_max_pct': 0.04223768148747652, 'bull_tp_mult': 2.0532614649722256, 'bull_tsl_mult': 0.8957361081178601, 'bull_time_stop': 220, 'bull_use_sma': False, 'bull_use_ema': False, 'bull_use_atr': True, 'bull_use_adx': True, 'bull_use_spike': True, 'bull_rsi_required': True, 'bear_strategy': 'breakout', 'bear_bb_std_mult': 1.644600677679472, 'bear_rsi_os': 22, 'bear_rsi_ob': 66, 'bear_adx_thresh': 26.639348690556417, 'bear_atr_min_pct': 0.01948317675861046, 'bear_atr_max_pct': 0.04954491289678624, 'bear_tp_mult': 1.6950482721938849, 'bear_tsl_mult': 0.668060881696274, 'bear_time_stop': 77, 'bear_use_sma': False, 'bear_use_ema': True, 'bear_use_atr': False, 'bear_use_adx': False, 'bear_use_spike': True, 'bear_rsi_required': True, 'sideways_strategy': 'mean_reversion', 'sideways_bb_std_mult': 2.0115313942311563, 'sideways_rsi_os': 26, 'sideways_rsi_ob': 78, 'sideways_adx_thresh': 26.01187545286733, 'sideways_atr_min_pct': 0.014354651185261892, 'sideways_atr_max_pct': 0.04811629306750941, 'sideways_tp_mult': 1.553703168582755, 'sideways_tsl_mult': 0.04160425740222967, 'sideways_time_stop': 86, 'sideways_use_sma': True, 'sideways_use_ema': False, 'sideways_use_atr': False, 'sideways_use_adx': True, 'sideways_use_spike': False, 'sideways_rsi_required': False}.
[I 2025-09-01 14:25:33,904] Trial 191 finished with values: [-1000000000.0, 1000000000.0] and parameters: {'p_sma': 26, 'p_std': 59, 'p_atr': 14, 'p_adx': 21, 'rsi_period': 70, 'ema1': 12, 'ema2': 19, 'slip_atr_k': 0.20729340921592732, 'slip_spread_k': 0.22384129134459285, 'spread_hl_frac': 0.04219748133028246, 'bb_std_mult': 0.7725199251775876, 'rsi_os': 24, 'rsi_ob': 87, 'vol_spike': 0.2523928859383676, 'adx_thresh': 27.443658190485376, 'atr_min_pct': 0.026222251618531662, 'atr_max_pct': 0.12589136593257785, 'tp_mult': 2.2988928353057276, 'tsl_mult': 0.2510630090591341, 'strategy': 'breakout', 'time_stop': 48, 'use_sma': False, 'use_atr': False, 'use_adx': False, 'use_ema': False, 'use_spike': False, 'rsi_required': True, 'edge_k': 1.7493897394011175, 'edge_cap': 0.40655674371981926, 'bull_strategy': 'breakout', 'bull_bb_std_mult': 1.3319615518682308, 'bull_rsi_os': 52, 'bull_rsi_ob': 66, 'bull_adx_thresh': 24.499777551553287, 'bull_atr_min_pct': 0.017314199187917285, 'bull_atr_max_pct': 0.042650195830362836, 'bull_tp_mult': 2.5080068884458404, 'bull_tsl_mult': 0.36155472887311507, 'bull_time_stop': 281, 'bull_use_sma': False, 'bull_use_ema': True, 'bull_use_atr': False, 'bull_use_adx': True, 'bull_use_spike': True, 'bull_rsi_required': True, 'bear_strategy': 'breakout', 'bear_bb_std_mult': 3.054330762575189, 'bear_rsi_os': 11, 'bear_rsi_ob': 46, 'bear_adx_thresh': 6.067190565395839, 'bear_atr_min_pct': 0.002642695967634107, 'bear_atr_max_pct': 0.08233188424313237, 'bear_tp_mult': 2.4005881607508073, 'bear_tsl_mult': 0.8415918776956435, 'bear_time_stop': 232, 'bear_use_sma': False, 'bear_use_ema': True, 'bear_use_atr': False, 'bear_use_adx': False, 'bear_use_spike': False, 'bear_rsi_required': True, 'sideways_strategy': 'mean_reversion', 'sideways_bb_std_mult': 2.0270545496943257, 'sideways_rsi_os': 14, 'sideways_rsi_ob': 95, 'sideways_adx_thresh': 26.020100640828293, 'sideways_atr_min_pct': 0.014122810858661032, 'sideways_atr_max_pct': 0.029931568224952496, 'sideways_tp_mult': 2.300303573487541, 'sideways_tsl_mult': 0.8793866191665943, 'sideways_time_stop': 40, 'sideways_use_sma': True, 'sideways_use_ema': True, 'sideways_use_atr': False, 'sideways_use_adx': True, 'sideways_use_spike': False, 'sideways_rsi_required': False}.
[I 2025-09-01 14:26:13,300] Trial 199 finished with values: [-0.013514435040267947, 0.02080426802525295] and parameters: {'p_sma': 38, 'p_std': 14, 'p_atr': 12, 'p_adx': 25, 'rsi_period': 40, 'ema1': 29, 'ema2': 21, 'slip_atr_k': 0.04168924614882446, 'slip_spread_k': 0.4814455104579989, 'spread_hl_frac': 0.008653859275205521, 'bb_std_mult': 2.4474237763777067, 'rsi_os': 27, 'rsi_ob': 79, 'vol_spike': 0.28753479041948204, 'adx_thresh': 26.253098909989298, 'atr_min_pct': 0.007740283556831428, 'atr_max_pct': 0.03713456547564181, 'tp_mult': 2.3899503214336466, 'tsl_mult': 0.5807756411653844, 'strategy': 'breakout', 'time_stop': 94, 'use_sma': True, 'use_atr': True, 'use_adx': True, 'use_ema': True, 'use_spike': False, 'rsi_required': True, 'edge_k': 0.4301445671024121, 'edge_cap': 0.9862092019991245, 'bull_strategy': 'breakout', 'bull_bb_std_mult': 2.461939032873226, 'bull_rsi_os': 55, 'bull_rsi_ob': 57, 'bull_adx_thresh': 34.3595384344179, 'bull_atr_min_pct': 0.002160366764368209, 'bull_atr_max_pct': 0.0367190089830897, 'bull_tp_mult': 1.0674761802789559, 'bull_tsl_mult': 0.8218544502569681, 'bull_time_stop': 174, 'bull_use_sma': False, 'bull_use_ema': False, 'bull_use_atr': False, 'bull_use_adx': False, 'bull_use_spike': False, 'bull_rsi_required': False, 'bear_strategy': 'breakout', 'bear_bb_std_mult': 2.1583050715081096, 'bear_rsi_os': 52, 'bear_rsi_ob': 45, 'bear_adx_thresh': 19.543673846325788, 'bear_atr_min_pct': 0.0062150371194440454, 'bear_atr_max_pct': 0.05634572265755954, 'bear_tp_mult': 2.689865857200089, 'bear_tsl_mult': 0.18999096181779868, 'bear_time_stop': 244, 'bear_use_sma': True, 'bear_use_ema': False, 'bear_use_atr': True, 'bear_use_adx': True, 'bear_use_spike': False, 'bear_rsi_required': True, 'sideways_strategy': 'mean_reversion', 'sideways_bb_std_mult': 1.276389107703236, 'sideways_rsi_os': 31, 'sideways_rsi_ob': 64, 'sideways_adx_thresh': 33.48033155190365, 'sideways_atr_min_pct': 0.017814762164939366, 'sideways_atr_max_pct': 0.03845644312542344, 'sideways_tp_mult': 2.7546293924366574, 'sideways_tsl_mult': 0.8489086766617747, 'sideways_time_stop': 79, 'sideways_use_sma': True, 'sideways_use_ema': True, 'sideways_use_atr': False, 'sideways_use_adx': True, 'sideways_use_spike': True, 'sideways_rsi_required': False}.
[I 2025-09-01 14:26:14,226] Trial 197 finished with values: [-0.018926637142413494, 0.018712371109374903] and parameters: {'p_sma': 11, 'p_std': 13, 'p_atr': 11, 'p_adx': 20, 'rsi_period': 73, 'ema1': 10, 'ema2': 43, 'slip_atr_k': 0.0001595100380907986, 'slip_spread_k': 0.2237245697369235, 'spread_hl_frac': 0.014609041741997371, 'bb_std_mult': 2.5832190351594044, 'rsi_os': 9, 'rsi_ob': 52, 'vol_spike': 0.1553660275471267, 'adx_thresh': 32.62468968802369, 'atr_min_pct': 0.025386189738342804, 'atr_max_pct': 0.046795462870706496, 'tp_mult': 2.3977090225424997, 'tsl_mult': 0.8832332839645115, 'strategy': 'breakout', 'time_stop': 280, 'use_sma': True, 'use_atr': True, 'use_adx': False, 'use_ema': False, 'use_spike': False, 'rsi_required': True, 'edge_k': 1.5235068324876555, 'edge_cap': 0.4560153494225079, 'bull_strategy': 'breakout', 'bull_bb_std_mult': 1.5176723848832288, 'bull_rsi_os': 17, 'bull_rsi_ob': 57, 'bull_adx_thresh': 23.0485056016867, 'bull_atr_min_pct': 0.0022317127283229027, 'bull_atr_max_pct': 0.07991581092339659, 'bull_tp_mult': 1.0712266110406639, 'bull_tsl_mult': 0.3725199752333749, 'bull_time_stop': 269, 'bull_use_sma': False, 'bull_use_ema': False, 'bull_use_atr': False, 'bull_use_adx': False, 'bull_use_spike': False, 'bull_rsi_required': False, 'bear_strategy': 'breakout', 'bear_bb_std_mult': 2.348446680461391, 'bear_rsi_os': 11, 'bear_rsi_ob': 45, 'bear_adx_thresh': 19.491520104374235, 'bear_atr_min_pct': 0.0037842423216494863, 'bear_atr_max_pct': 0.046780475453396905, 'bear_tp_mult': 2.7714956707951277, 'bear_tsl_mult': 0.1911525003850995, 'bear_time_stop': 245, 'bear_use_sma': True, 'bear_use_ema': True, 'bear_use_atr': True, 'bear_use_adx': True, 'bear_use_spike': False, 'bear_rsi_required': True, 'sideways_strategy': 'mean_reversion', 'sideways_bb_std_mult': 1.2659900537358735, 'sideways_rsi_os': 31, 'sideways_rsi_ob': 76, 'sideways_adx_thresh': 33.534752020758866, 'sideways_atr_min_pct': 0.017383863027809143, 'sideways_atr_max_pct': 0.04843625993306553, 'sideways_tp_mult': 2.7467237827721562, 'sideways_tsl_mult': 0.8576728538331788, 'sideways_time_stop': 81, 'sideways_use_sma': True, 'sideways_use_ema': True, 'sideways_use_atr': False, 'sideways_use_adx': True, 'sideways_use_spike': True, 'sideways_rsi_required': False}.
