[I 2025-09-01 14:28:49,720] Trial 213 finished with values: [-0.030445002048161807, 0.03238162062686828] and parameters: {'p_sma': 60, 'p_std': 12, 'p_atr': 14, 'p_adx': 23, 'rsi_period': 62, 'ema1': 27, 'ema2': 23, 'slip_atr_k': 0.02852296894928085, 'slip_spread_k': 0.4563105606313685, 'spread_hl_frac': 0.043645135292179345, 'bb_std_mult': 2.499079325607006, 'rsi_os': 47, 'rsi_ob': 72, 'vol_spike': 0.013986054215927813, 'adx_thresh': 31.648687201762577, 'atr_min_pct': 0.015919991175226942, 'atr_max_pct': 0.08738227079832839, 'tp_mult': 1.8989462546836022, 'tsl_mult': 0.3730311822507684, 'strategy': 'breakout', 'time_stop': 56, 'use_sma': False, 'use_atr': False, 'use_adx': False, 'use_ema': False, 'use_spike': False, 'rsi_required': True, 'edge_k': 0.6083526738048741, 'edge_cap': 0.9737982733100634, 'bull_strategy': 'breakout', 'bull_bb_std_mult': 3.530976040302294, 'bull_rsi_os': 19, 'bull_rsi_ob': 54, 'bull_adx_thresh': 15.09925280984223, 'bull_atr_min_pct': 0.0038785577843917247, 'bull_atr_max_pct': 0.03331775197007027, 'bull_tp_mult': 1.984828311544663, 'bull_tsl_mult': 0.8836176280402271, 'bull_time_stop': 18, 'bull_use_sma': False, 'bull_use_ema': True, 'bull_use_atr': False, 'bull_use_adx': True, 'bull_use_spike': False, 'bull_rsi_required': True, 'bear_strategy': 'breakout', 'bear_bb_std_mult': 2.0026629572824115, 'bear_rsi_os': 54, 'bear_rsi_ob': 90, 'bear_adx_thresh': 5.650332451146685, 'bear_atr_min_pct': 0.0047767399977499715, 'bear_atr_max_pct': 0.14560401837256204, 'bear_tp_mult': 1.7887683738479792, 'bear_tsl_mult': 0.3243494448620966, 'bear_time_stop': 58, 'bear_use_sma': False, 'bear_use_ema': True, 'bear_use_atr': False, 'bear_use_adx': False, 'bear_use_spike': False, 'bear_rsi_required': True, 'sideways_strategy': 'mean_reversion', 'sideways_bb_std_mult': 2.736716943166601, 'sideways_rsi_os': 29, 'sideways_rsi_ob': 79, 'sideways_adx_thresh': 34.21400627345633, 'sideways_atr_min_pct': 0.01623180883256554, 'sideways_atr_max_pct': 0.028052501723335004, 'sideways_tp_mult': 2.4747362953295235, 'sideways_tsl_mult': 0.7385432972678635, 'sideways_time_stop': 79, 'sideways_use_sma': True, 'sideways_use_ema': False, 'sideways_use_atr': False, 'sideways_use_adx': True, 'sideways_use_spike': True, 'sideways_rsi_required': False}.
[I 2025-09-01 14:29:29,181] Trial 217 finished with values: [-1000000000.0, 1000000000.0] and parameters: {'p_sma': 27, 'p_std': 12, 'p_atr': 15, 'p_adx': 23, 'rsi_period': 67, 'ema1': 16, 'ema2': 42, 'slip_atr_k': 0.026563372982846882, 'slip_spread_k': 0.4513486565625389, 'spread_hl_frac': 0.03412948795565471, 'bb_std_mult': 3.5972719850017087, 'rsi_os': 18, 'rsi_ob': 72, 'vol_spike': 0.18728637644263418, 'adx_thresh': 21.08226955853445, 'atr_min_pct': 0.008390789306203105, 'atr_max_pct': 0.10538746398782775, 'tp_mult': 1.5276815667131374, 'tsl_mult': 0.38784322224289774, 'strategy': 'breakout', 'time_stop': 56, 'use_sma': True, 'use_atr': False, 'use_adx': False, 'use_ema': False, 'use_spike': False, 'rsi_required': True, 'edge_k': 0.4173160824648343, 'edge_cap': 0.914332085434774, 'bull_strategy': 'breakout', 'bull_bb_std_mult': 1.3655333285247813, 'bull_rsi_os': 18, 'bull_rsi_ob': 56, 'bull_adx_thresh': 15.379955051555081, 'bull_atr_min_pct': 0.017859573087002933, 'bull_atr_max_pct': 0.1392107910758585, 'bull_tp_mult': 1.1782063115062806, 'bull_tsl_mult': 0.7967176690752854, 'bull_time_stop': 19, 'bull_use_sma': False, 'bull_use_ema': True, 'bull_use_atr': False, 'bull_use_adx': True, 'bull_use_spike': False, 'bull_rsi_required': True, 'bear_strategy': 'breakout', 'bear_bb_std_mult': 2.2435647412907618, 'bear_rsi_os': 44, 'bear_rsi_ob': 46, 'bear_adx_thresh': 10.718634712457268, 'bear_atr_min_pct': 0.012244891186306898, 'bear_atr_max_pct': 0.06284350027864688, 'bear_tp_mult': 2.4857546215275836, 'bear_tsl_mult': 0.6247932433892034, 'bear_time_stop': 100, 'bear_use_sma': False, 'bear_use_ema': True, 'bear_use_atr': False, 'bear_use_adx': False, 'bear_use_spike': False, 'bear_rsi_required': True, 'sideways_strategy': 'mean_reversion', 'sideways_bb_std_mult': 1.0217358412108772, 'sideways_rsi_os': 32, 'sideways_rsi_ob': 79, 'sideways_adx_thresh': 17.609791579249777, 'sideways_atr_min_pct': 0.016148643047675937, 'sideways_atr_max_pct': 0.13922850047176177, 'sideways_tp_mult': 1.376019652920645, 'sideways_tsl_mult': 0.8342846970118905, 'sideways_time_stop': 83, 'sideways_use_sma': True, 'sideways_use_ema': True, 'sideways_use_atr': False, 'sideways_use_adx': True, 'sideways_use_spike': False, 'sideways_rsi_required': False}.
[I 2025-09-01 14:29:29,209] Trial 220 finished with values: [-1000000000.0, 1000000000.0] and parameters: {'p_sma': 18, 'p_std': 43, 'p_atr': 26, 'p_adx': 23, 'rsi_period': 48, 'ema1': 28, 'ema2': 42, 'slip_atr_k': 0.02946276635664559, 'slip_spread_k': 0.7817881578174267, 'spread_hl_frac': 0.03353441188849101, 'bb_std_mult': 3.5754705362310704, 'rsi_os': 6, 'rsi_ob': 85, 'vol_spike': 0.12920599092549, 'adx_thresh': 24.555227855636694, 'atr_min_pct': 0.008211474406982406, 'atr_max_pct': 0.06868085666824, 'tp_mult': 1.5288552306496148, 'tsl_mult': 0.5634710422253185, 'strategy': 'breakout', 'time_stop': 55, 'use_sma': True, 'use_atr': False, 'use_adx': False, 'use_ema': False, 'use_spike': False, 'rsi_required': True, 'edge_k': 0.2666127741384806, 'edge_cap': 0.5729983990901711, 'bull_strategy': 'mean_reversion', 'bull_bb_std_mult': 1.5608078790137234, 'bull_rsi_os': 19, 'bull_rsi_ob': 85, 'bull_adx_thresh': 13.565249599622675, 'bull_atr_min_pct': 0.02122824153406555, 'bull_atr_max_pct': 0.03713964041781636, 'bull_tp_mult': 1.189211909607435, 'bull_tsl_mult': 0.8679038358235255, 'bull_time_stop': 14, 'bull_use_sma': True, 'bull_use_ema': True, 'bull_use_atr': False, 'bull_use_adx': True, 'bull_use_spike': True, 'bull_rsi_required': True, 'bear_strategy': 'mean_reversion', 'bear_bb_std_mult': 2.8693726024541384, 'bear_rsi_os': 42, 'bear_rsi_ob': 79, 'bear_adx_thresh': 28.98668249362983, 'bear_atr_min_pct': 0.00529677317755122, 'bear_atr_max_pct': 0.06603267905537928, 'bear_tp_mult': 1.7022367554235263, 'bear_tsl_mult': 0.6657589605016289, 'bear_time_stop': 103, 'bear_use_sma': False, 'bear_use_ema': True, 'bear_use_atr': False, 'bear_use_adx': False, 'bear_use_spike': False, 'bear_rsi_required': True, 'sideways_strategy': 'breakout', 'sideways_bb_std_mult': 1.5366637537538492, 'sideways_rsi_os': 32, 'sideways_rsi_ob': 74, 'sideways_adx_thresh': 17.718274014514883, 'sideways_atr_min_pct': 0.01626545174796697, 'sideways_atr_max_pct': 0.03545144138927563, 'sideways_tp_mult': 1.2028879057816968, 'sideways_tsl_mult': 0.8218465709014267, 'sideways_time_stop': 201, 'sideways_use_sma': False, 'sideways_use_ema': True, 'sideways_use_atr': False, 'sideways_use_adx': False, 'sideways_use_spike': False, 'sideways_rsi_required': True}.
[I 2025-09-01 14:29:29,959] Trial 219 finished with values: [-1000000000.0, 1000000000.0] and parameters: {'p_sma': 19, 'p_std': 12, 'p_atr': 12, 'p_adx': 24, 'rsi_period': 75, 'ema1': 19, 'ema2': 42, 'slip_atr_k': 0.1853741676482569, 'slip_spread_k': 0.5352168660485346, 'spread_hl_frac': 0.03863430239289873, 'bb_std_mult': 2.9684272983659787, 'rsi_os': 29, 'rsi_ob': 85, 'vol_spike': 0.18848999513716594, 'adx_thresh': 34.89567761250913, 'atr_min_pct': 0.01632298975426234, 'atr_max_pct': 0.06849383364656063, 'tp_mult': 1.8652173995446995, 'tsl_mult': 0.3822152127215365, 'strategy': 'breakout', 'time_stop': 21, 'use_sma': True, 'use_atr': False, 'use_adx': False, 'use_ema': False, 'use_spike': False, 'rsi_required': True, 'edge_k': 0.9027009828482451, 'edge_cap': 0.5929758282953672, 'bull_strategy': 'mean_reversion', 'bull_bb_std_mult': 1.559528012156383, 'bull_rsi_os': 19, 'bull_rsi_ob': 71, 'bull_adx_thresh': 18.753538972126208, 'bull_atr_min_pct': 0.006501705545291504, 'bull_atr_max_pct': 0.03953142116968078, 'bull_tp_mult': 2.874734057639164, 'bull_tsl_mult': 0.0007718458832611796, 'bull_time_stop': 31, 'bull_use_sma': True, 'bull_use_ema': True, 'bull_use_atr': False, 'bull_use_adx': True, 'bull_use_spike': False, 'bull_rsi_required': True, 'bear_strategy': 'mean_reversion', 'bear_bb_std_mult': 2.020966982349232, 'bear_rsi_os': 19, 'bear_rsi_ob': 71, 'bear_adx_thresh': 21.64895709752207, 'bear_atr_min_pct': 0.0053530801643939694, 'bear_atr_max_pct': 0.013473109425894681, 'bear_tp_mult': 1.3321362517144077, 'bear_tsl_mult': 0.6618889534428165, 'bear_time_stop': 103, 'bear_use_sma': False, 'bear_use_ema': True, 'bear_use_atr': False, 'bear_use_adx': False, 'bear_use_spike': False, 'bear_rsi_required': True, 'sideways_strategy': 'mean_reversion', 'sideways_bb_std_mult': 1.0273853668192094, 'sideways_rsi_os': 33, 'sideways_rsi_ob': 74, 'sideways_adx_thresh': 9.856153998686343, 'sideways_atr_min_pct': 0.013382499581050259, 'sideways_atr_max_pct': 0.04249240127345328, 'sideways_tp_mult': 1.3815129686667236, 'sideways_tsl_mult': 0.2172256714616369, 'sideways_time_stop': 198, 'sideways_use_sma': True, 'sideways_use_ema': True, 'sideways_use_atr': False, 'sideways_use_adx': False, 'sideways_use_spike': False, 'sideways_rsi_required': False}.
[I 2025-09-01 14:29:29,977] Trial 218 finished with values: [-1000000000.0, 1000000000.0] and parameters: {'p_sma': 27, 'p_std': 12, 'p_atr': 15, 'p_adx': 23, 'rsi_period': 75, 'ema1': 14, 'ema2': 27, 'slip_atr_k': 0.18536417215950216, 'slip_spread_k': 0.5318395987402649, 'spread_hl_frac': 0.044582555043770615, 'bb_std_mult': 0.9416209678176108, 'rsi_os': 18, 'rsi_ob': 81, 'vol_spike': 0.010049814462984634, 'adx_thresh': 17.53650611415291, 'atr_min_pct': 0.008476561140206623, 'atr_max_pct': 0.05300485813532657, 'tp_mult': 1.8677757531568289, 'tsl_mult': 0.5534717187732638, 'strategy': 'breakout', 'time_stop': 15, 'use_sma': True, 'use_atr': False, 'use_adx': False, 'use_ema': False, 'use_spike': False, 'rsi_required': True, 'edge_k': 0.25545030088285514, 'edge_cap': 0.9161596910955419, 'bull_strategy': 'breakout', 'bull_bb_std_mult': 1.4805822702100033, 'bull_rsi_os': 17, 'bull_rsi_ob': 70, 'bull_adx_thresh': 18.14091586465593, 'bull_atr_min_pct': 0.0036862416090508643, 'bull_atr_max_pct': 0.039630057847440725, 'bull_tp_mult': 1.1833616201761195, 'bull_tsl_mult': 0.033186069539166474, 'bull_time_stop': 60, 'bull_use_sma': True, 'bull_use_ema': True, 'bull_use_atr': False, 'bull_use_adx': True, 'bull_use_spike': False, 'bull_rsi_required': True, 'bear_strategy': 'mean_reversion', 'bear_bb_std_mult': 2.01689040655541, 'bear_rsi_os': 44, 'bear_rsi_ob': 47, 'bear_adx_thresh': 5.00304441996572, 'bear_atr_min_pct': 0.021902099762269218, 'bear_atr_max_pct': 0.05598100082835271, 'bear_tp_mult': 1.3529482197615783, 'bear_tsl_mult': 0.6679117277025827, 'bear_time_stop': 148, 'bear_use_sma': False, 'bear_use_ema': True, 'bear_use_atr': False, 'bear_use_adx': False, 'bear_use_spike': False, 'bear_rsi_required': True, 'sideways_strategy': 'mean_reversion', 'sideways_bb_std_mult': 1.5545588237416592, 'sideways_rsi_os': 33, 'sideways_rsi_ob': 79, 'sideways_adx_thresh': 33.8490442640128, 'sideways_atr_min_pct': 0.01594162116158, 'sideways_atr_max_pct': 0.04373081785897498, 'sideways_tp_mult': 1.094223243601737, 'sideways_tsl_mult': 0.8301448524354068, 'sideways_time_stop': 56, 'sideways_use_sma': True, 'sideways_use_ema': True, 'sideways_use_atr': False, 'sideways_use_adx': False, 'sideways_use_spike': False, 'sideways_rsi_required': False}.
[I 2025-09-01 14:29:30,931] Trial 224 finished with values: [-1000000000.0, 1000000000.0] and parameters: {'p_sma': 23, 'p_std': 10, 'p_atr': 12, 'p_adx': 20, 'rsi_period': 71, 'ema1': 28, 'ema2': 40, 'slip_atr_k': 0.04929815227386066, 'slip_spread_k': 0.08576235821504102, 'spread_hl_frac': 0.0016509579809316603, 'bb_std_mult': 1.7065162202831985, 'rsi_os': 54, 'rsi_ob': 84, 'vol_spike': 0.019191346380591386, 'adx_thresh': 26.36344982213848, 'atr_min_pct': 0.006216551505463418, 'atr_max_pct': 0.023091417724373613, 'tp_mult': 1.6424222981576257, 'tsl_mult': 0.600572616524429, 'strategy': 'mean_reversion', 'time_stop': 82, 'use_sma': False, 'use_atr': True, 'use_adx': True, 'use_ema': False, 'use_spike': True, 'rsi_required': False, 'edge_k': 0.8090552089465946, 'edge_cap': 0.28243251424460486, 'bull_strategy': 'breakout', 'bull_bb_std_mult': 1.437555505668842, 'bull_rsi_os': 20, 'bull_rsi_ob': 58, 'bull_adx_thresh': 13.101306354918536, 'bull_atr_min_pct': 0.005466873995671994, 'bull_atr_max_pct': 0.035513514775892555, 'bull_tp_mult': 1.1032634224608047, 'bull_tsl_mult': 0.4096059664563251, 'bull_time_stop': 25, 'bull_use_sma': False, 'bull_use_ema': False, 'bull_use_atr': True, 'bull_use_adx': True, 'bull_use_spike': False, 'bull_rsi_required': True, 'bear_strategy': 'breakout', 'bear_bb_std_mult': 1.2904313637287281, 'bear_rsi_os': 31, 'bear_rsi_ob': 89, 'bear_adx_thresh': 23.8734713692511, 'bear_atr_min_pct': 0.004502040527625142, 'bear_atr_max_pct': 0.14547299697122562, 'bear_tp_mult': 1.6999474316824155, 'bear_tsl_mult': 0.3313682446199121, 'bear_time_stop': 239, 'bear_use_sma': True, 'bear_use_ema': True, 'bear_use_atr': False, 'bear_use_adx': False, 'bear_use_spike': True, 'bear_rsi_required': False, 'sideways_strategy': 'mean_reversion', 'sideways_bb_std_mult': 1.4061398452154916, 'sideways_rsi_os': 31, 'sideways_rsi_ob': 76, 'sideways_adx_thresh': 33.39531659314893, 'sideways_atr_min_pct': 0.017958017529736872, 'sideways_atr_max_pct': 0.1321961915629036, 'sideways_tp_mult': 2.7029868259148024, 'sideways_tsl_mult': 0.23459345804590376, 'sideways_time_stop': 94, 'sideways_use_sma': True, 'sideways_use_ema': False, 'sideways_use_atr': False, 'sideways_use_adx': True, 'sideways_use_spike': True, 'sideways_rsi_required': False}.
[I 2025-09-01 14:29:30,974] Trial 222 finished with values: [-1000000000.0, 1000000000.0] and parameters: {'p_sma': 23, 'p_std': 9, 'p_atr': 12, 'p_adx': 20, 'rsi_period': 71, 'ema1': 28, 'ema2': 40, 'slip_atr_k': 0.04903819410568649, 'slip_spread_k': 0.7302049220163185, 'spread_hl_frac': 0.002636299555595155, 'bb_std_mult': 2.403841215752881, 'rsi_os': 54, 'rsi_ob': 58, 'vol_spike': 0.017769143097709165, 'adx_thresh': 7.474399923957916, 'atr_min_pct': 0.023465956158108432, 'atr_max_pct': 0.05644714270248384, 'tp_mult': 2.3747493240808595, 'tsl_mult': 0.6007443885258027, 'strategy': 'mean_reversion', 'time_stop': 60, 'use_sma': False, 'use_atr': True, 'use_adx': True, 'use_ema': False, 'use_spike': True, 'rsi_required': False, 'edge_k': 0.824000141179045, 'edge_cap': 0.9576749864940595, 'bull_strategy': 'breakout', 'bull_bb_std_mult': 1.4641347181254776, 'bull_rsi_os': 20, 'bull_rsi_ob': 91, 'bull_adx_thresh': 11.725742805651889, 'bull_atr_min_pct': 0.022720560692980098, 'bull_atr_max_pct': 0.07544811282955796, 'bull_tp_mult': 1.980500308031738, 'bull_tsl_mult': 0.9040346200470135, 'bull_time_stop': 250, 'bull_use_sma': False, 'bull_use_ema': False, 'bull_use_atr': True, 'bull_use_adx': True, 'bull_use_spike': False, 'bull_rsi_required': True, 'bear_strategy': 'breakout', 'bear_bb_std_mult': 1.4623255793249192, 'bear_rsi_os': 53, 'bear_rsi_ob': 60, 'bear_adx_thresh': 6.07964230397293, 'bear_atr_min_pct': 0.004708958533953554, 'bear_atr_max_pct': 0.017820746547189174, 'bear_tp_mult': 1.7061175024920407, 'bear_tsl_mult': 0.33523613291094273, 'bear_time_stop': 238, 'bear_use_sma': True, 'bear_use_ema': True, 'bear_use_atr': False, 'bear_use_adx': False, 'bear_use_spike': True, 'bear_rsi_required': False, 'sideways_strategy': 'mean_reversion', 'sideways_bb_std_mult': 1.395348661524327, 'sideways_rsi_os': 31, 'sideways_rsi_ob': 85, 'sideways_adx_thresh': 33.28473865673596, 'sideways_atr_min_pct': 0.004610835502283334, 'sideways_atr_max_pct': 0.035979471832156565, 'sideways_tp_mult': 2.636245987851562, 'sideways_tsl_mult': 0.8069413904331536, 'sideways_time_stop': 161, 'sideways_use_sma': True, 'sideways_use_ema': False, 'sideways_use_atr': False, 'sideways_use_adx': True, 'sideways_use_spike': True, 'sideways_rsi_required': False}.
[I 2025-09-01 14:30:06,794] Trial 223 finished with values: [-1000000000.0, 1000000000.0] and parameters: {'p_sma': 23, 'p_std': 9, 'p_atr': 12, 'p_adx': 20, 'rsi_period': 71, 'ema1': 28, 'ema2': 23, 'slip_atr_k': 0.008710961513997657, 'slip_spread_k': 0.7277769148673071, 'spread_hl_frac': 0.04837615909780616, 'bb_std_mult': 2.403350068508528, 'rsi_os': 7, 'rsi_ob': 84, 'vol_spike': 0.14497175523602004, 'adx_thresh': 5.439845255082233, 'atr_min_pct': 0.023383640052573283, 'atr_max_pct': 0.05694196707847107, 'tp_mult': 2.3765678370710455, 'tsl_mult': 0.4448180330955701, 'strategy': 'mean_reversion', 'time_stop': 66, 'use_sma': False, 'use_atr': True, 'use_adx': True, 'use_ema': False, 'use_spike': True, 'rsi_required': False, 'edge_k': 0.4733356466915658, 'edge_cap': 0.958947587544858, 'bull_strategy': 'breakout', 'bull_bb_std_mult': 2.2451724165719513, 'bull_rsi_os': 20, 'bull_rsi_ob': 58, 'bull_adx_thresh': 12.784366898983613, 'bull_atr_min_pct': 0.022394413021497826, 'bull_atr_max_pct': 0.07468039686206614, 'bull_tp_mult': 1.1013596284232503, 'bull_tsl_mult': 0.910742586653786, 'bull_time_stop': 27, 'bull_use_sma': False, 'bull_use_ema': False, 'bull_use_atr': True, 'bull_use_adx': True, 'bull_use_spike': False, 'bull_rsi_required': True, 'bear_strategy': 'breakout', 'bear_bb_std_mult': 1.47304618107412, 'bear_rsi_os': 54, 'bear_rsi_ob': 46, 'bear_adx_thresh': 34.014871675195884, 'bear_atr_min_pct': 0.025627348388597752, 'bear_atr_max_pct': 0.01789274407708208, 'bear_tp_mult': 1.7040401423969906, 'bear_tsl_mult': 0.5865841614556979, 'bear_time_stop': 196, 'bear_use_sma': True, 'bear_use_ema': True, 'bear_use_atr': False, 'bear_use_adx': False, 'bear_use_spike': True, 'bear_rsi_required': False, 'sideways_strategy': 'mean_reversion', 'sideways_bb_std_mult': 1.305033666098737, 'sideways_rsi_os': 30, 'sideways_rsi_ob': 76, 'sideways_adx_thresh': 32.919250765920204, 'sideways_atr_min_pct': 0.0045464450051022655, 'sideways_atr_max_pct': 0.03636180560939531, 'sideways_tp_mult': 2.7038266217610514, 'sideways_tsl_mult': 0.9366409183216026, 'sideways_time_stop': 114, 'sideways_use_sma': True, 'sideways_use_ema': False, 'sideways_use_atr': False, 'sideways_use_adx': True, 'sideways_use_spike': True, 'sideways_rsi_required': False}.
[I 2025-09-01 14:30:07,312] Trial 221 finished with values: [-1000000000.0, 1000000000.0] and parameters: {'p_sma': 17, 'p_std': 17, 'p_atr': 29, 'p_adx': 20, 'rsi_period': 75, 'ema1': 26, 'ema2': 40, 'slip_atr_k': 0.04775914070191122, 'slip_spread_k': 0.5255411551104079, 'spread_hl_frac': 0.002696090713887201, 'bb_std_mult': 2.4015809398601493, 'rsi_os': 43, 'rsi_ob': 81, 'vol_spike': 0.010403577962146452, 'adx_thresh': 5.373952780164091, 'atr_min_pct': 0.012396884505626041, 'atr_max_pct': 0.06619360021477023, 'tp_mult': 1.6301509973755381, 'tsl_mult': 0.44064280689303914, 'strategy': 'mean_reversion', 'time_stop': 66, 'use_sma': False, 'use_atr': False, 'use_adx': False, 'use_ema': False, 'use_spike': False, 'rsi_required': True, 'edge_k': 0.49033476521579283, 'edge_cap': 0.9007307827257071, 'bull_strategy': 'mean_reversion', 'bull_bb_std_mult': 2.2526580026518004, 'bull_rsi_os': 37, 'bull_rsi_ob': 45, 'bull_adx_thresh': 13.119000674145532, 'bull_atr_min_pct': 0.003533643508890009, 'bull_atr_max_pct': 0.03495087522002151, 'bull_tp_mult': 2.868920931787447, 'bull_tsl_mult': 0.6843781646934461, 'bull_time_stop': 31, 'bull_use_sma': True, 'bull_use_ema': True, 'bull_use_atr': True, 'bull_use_adx': True, 'bull_use_spike': False, 'bull_rsi_required': True, 'bear_strategy': 'mean_reversion', 'bear_bb_std_mult': 2.0117258079691562, 'bear_rsi_os': 54, 'bear_rsi_ob': 47, 'bear_adx_thresh': 5.131913047174808, 'bear_atr_min_pct': 0.021900965888348865, 'bear_atr_max_pct': 0.1459288674566912, 'bear_tp_mult': 1.711529586284709, 'bear_tsl_mult': 0.590057054900422, 'bear_time_stop': 256, 'bear_use_sma': False, 'bear_use_ema': True, 'bear_use_atr': False, 'bear_use_adx': False, 'bear_use_spike': True, 'bear_rsi_required': True, 'sideways_strategy': 'mean_reversion', 'sideways_bb_std_mult': 1.3523919664108923, 'sideways_rsi_os': 33, 'sideways_rsi_ob': 82, 'sideways_adx_thresh': 33.74285717746553, 'sideways_atr_min_pct': 0.013555470329018687, 'sideways_atr_max_pct': 0.13264264741679335, 'sideways_tp_mult': 1.1062122551382374, 'sideways_tsl_mult': 0.9745197136384505, 'sideways_time_stop': 52, 'sideways_use_sma': True, 'sideways_use_ema': False, 'sideways_use_atr': False, 'sideways_use_adx': False, 'sideways_use_spike': True, 'sideways_rsi_required': False}.
