[I 2025-09-01 14:51:42,911] Trial 360 finished with values: [-1000000000.0, 1000000000.0] and parameters: {'p_sma': 31, 'p_std': 24, 'p_atr': 11, 'p_adx': 15, 'rsi_period': 73, 'ema1': 26, 'ema2': 58, 'slip_atr_k': 0.01491554993187654, 'slip_spread_k': 0.3722215770978622, 'spread_hl_frac': 0.005450506148207629, 'bb_std_mult': 2.171337429638513, 'rsi_os': 28, 'rsi_ob': 79, 'vol_spike': 0.0651847683745403, 'adx_thresh': 27.872201659667407, 'atr_min_pct': 0.016825366415553485, 'atr_max_pct': 0.06415264721617367, 'tp_mult': 1.9512312257203286, 'tsl_mult': 0.3762987997665032, 'strategy': 'breakout', 'time_stop': 42, 'use_sma': False, 'use_atr': True, 'use_adx': False, 'use_ema': True, 'use_spike': True, 'rsi_required': False, 'edge_k': 1.4136158580704867, 'edge_cap': 0.8725726958179618, 'bull_strategy': 'mean_reversion', 'bull_bb_std_mult': 0.8798121002179723, 'bull_rsi_os': 25, 'bull_rsi_ob': 67, 'bull_adx_thresh': 5.911506804225532, 'bull_atr_min_pct': 0.016687504649120877, 'bull_atr_max_pct': 0.030784351634768847, 'bull_tp_mult': 1.3930067766047847, 'bull_tsl_mult': 0.02422431621814053, 'bull_time_stop': 126, 'bull_use_sma': True, 'bull_use_ema': True, 'bull_use_atr': False, 'bull_use_adx': False, 'bull_use_spike': True, 'bull_rsi_required': False, 'bear_strategy': 'mean_reversion', 'bear_bb_std_mult': 1.6148868087566528, 'bear_rsi_os': 50, 'bear_rsi_ob': 52, 'bear_adx_thresh': 11.866368833883055, 'bear_atr_min_pct': 0.02367310600938005, 'bear_atr_max_pct': 0.052351413259736274, 'bear_tp_mult': 1.5657423063390306, 'bear_tsl_mult': 0.4839823169701597, 'bear_time_stop': 262, 'bear_use_sma': True, 'bear_use_ema': False, 'bear_use_atr': True, 'bear_use_adx': True, 'bear_use_spike': True, 'bear_rsi_required': False, 'sideways_strategy': 'breakout', 'sideways_bb_std_mult': 0.962507287956341, 'sideways_rsi_os': 23, 'sideways_rsi_ob': 85, 'sideways_adx_thresh': 31.851610526830623, 'sideways_atr_min_pct': 0.011118828529484455, 'sideways_atr_max_pct': 0.06626163721786238, 'sideways_tp_mult': 2.2565287663695206, 'sideways_tsl_mult': 0.6794933286421925, 'sideways_time_stop': 62, 'sideways_use_sma': False, 'sideways_use_ema': False, 'sideways_use_atr': True, 'sideways_use_adx': False, 'sideways_use_spike': False, 'sideways_rsi_required': True}.
[I 2025-09-01 14:51:42,959] Trial 361 finished with values: [-0.14261260899455175, 0.14222031888299977] and parameters: {'p_sma': 31, 'p_std': 30, 'p_atr': 11, 'p_adx': 17, 'rsi_period': 25, 'ema1': 24, 'ema2': 58, 'slip_atr_k': 0.016343107913737363, 'slip_spread_k': 0.3835048182705616, 'spread_hl_frac': 0.004878777474688704, 'bb_std_mult': 2.173503866126768, 'rsi_os': 30, 'rsi_ob': 80, 'vol_spike': 0.07553715081451708, 'adx_thresh': 27.60445956436325, 'atr_min_pct': 0.016347289569812424, 'atr_max_pct': 0.030427609520739994, 'tp_mult': 2.02234978534355, 'tsl_mult': 0.34185394092243565, 'strategy': 'breakout', 'time_stop': 41, 'use_sma': False, 'use_atr': True, 'use_adx': False, 'use_ema': True, 'use_spike': False, 'rsi_required': True, 'edge_k': 1.408455689248867, 'edge_cap': 0.8905473977516994, 'bull_strategy': 'mean_reversion', 'bull_bb_std_mult': 0.9252913294394282, 'bull_rsi_os': 23, 'bull_rsi_ob': 66, 'bull_adx_thresh': 7.069589931917882, 'bull_atr_min_pct': 0.017212700243382218, 'bull_atr_max_pct': 0.03259845459662757, 'bull_tp_mult': 1.4188394917285763, 'bull_tsl_mult': 0.13956093462271607, 'bull_time_stop': 140, 'bull_use_sma': False, 'bull_use_ema': True, 'bull_use_atr': False, 'bull_use_adx': False, 'bull_use_spike': False, 'bull_rsi_required': True, 'bear_strategy': 'breakout', 'bear_bb_std_mult': 1.5409277453236778, 'bear_rsi_os': 49, 'bear_rsi_ob': 51, 'bear_adx_thresh': 10.4004654596165, 'bear_atr_min_pct': 0.0011856481808845288, 'bear_atr_max_pct': 0.04580007294870371, 'bear_tp_mult': 1.641657220923258, 'bear_tsl_mult': 0.8327113766161439, 'bear_time_stop': 258, 'bear_use_sma': True, 'bear_use_ema': False, 'bear_use_atr': False, 'bear_use_adx': False, 'bear_use_spike': True, 'bear_rsi_required': True, 'sideways_strategy': 'breakout', 'sideways_bb_std_mult': 0.9398971119666819, 'sideways_rsi_os': 20, 'sideways_rsi_ob': 53, 'sideways_adx_thresh': 31.892120137934942, 'sideways_atr_min_pct': 0.011248320062042204, 'sideways_atr_max_pct': 0.05096142130664136, 'sideways_tp_mult': 2.27024459718203, 'sideways_tsl_mult': 0.732067096719254, 'sideways_time_stop': 44, 'sideways_use_sma': False, 'sideways_use_ema': False, 'sideways_use_atr': True, 'sideways_use_adx': True, 'sideways_use_spike': False, 'sideways_rsi_required': True}.
[I 2025-09-01 14:51:43,569] Trial 362 finished with values: [-0.1082017740602641, 0.10834849760652554] and parameters: {'p_sma': 31, 'p_std': 30, 'p_atr': 11, 'p_adx': 16, 'rsi_period': 77, 'ema1': 24, 'ema2': 58, 'slip_atr_k': 0.016126171702955355, 'slip_spread_k': 0.40044998870771853, 'spread_hl_frac': 0.0044979505185247905, 'bb_std_mult': 2.1945873939994756, 'rsi_os': 30, 'rsi_ob': 80, 'vol_spike': 0.07337358258164653, 'adx_thresh': 27.75734148037903, 'atr_min_pct': 0.015934821082786654, 'atr_max_pct': 0.06844893467760067, 'tp_mult': 1.9289591216466988, 'tsl_mult': 0.3700759031349187, 'strategy': 'breakout', 'time_stop': 42, 'use_sma': False, 'use_atr': True, 'use_adx': False, 'use_ema': True, 'use_spike': False, 'rsi_required': True, 'edge_k': 1.422051898045326, 'edge_cap': 0.8886149048544255, 'bull_strategy': 'mean_reversion', 'bull_bb_std_mult': 0.8875693159203819, 'bull_rsi_os': 23, 'bull_rsi_ob': 66, 'bull_adx_thresh': 7.232982244961086, 'bull_atr_min_pct': 0.016748604108994064, 'bull_atr_max_pct': 0.03287345109230275, 'bull_tp_mult': 1.4018467888805888, 'bull_tsl_mult': 0.10594862632090651, 'bull_time_stop': 140, 'bull_use_sma': False, 'bull_use_ema': True, 'bull_use_atr': False, 'bull_use_adx': False, 'bull_use_spike': False, 'bull_rsi_required': True, 'bear_strategy': 'breakout', 'bear_bb_std_mult': 1.5729150129426912, 'bear_rsi_os': 49, 'bear_rsi_ob': 51, 'bear_adx_thresh': 15.130702222910333, 'bear_atr_min_pct': 0.001733973490279355, 'bear_atr_max_pct': 0.04627808035844196, 'bear_tp_mult': 1.5805627119827494, 'bear_tsl_mult': 0.4866797059837163, 'bear_time_stop': 261, 'bear_use_sma': True, 'bear_use_ema': False, 'bear_use_atr': False, 'bear_use_adx': False, 'bear_use_spike': True, 'bear_rsi_required': True, 'sideways_strategy': 'breakout', 'sideways_bb_std_mult': 0.9439957234657264, 'sideways_rsi_os': 23, 'sideways_rsi_ob': 77, 'sideways_adx_thresh': 18.680191686896, 'sideways_atr_min_pct': 0.011275139089969553, 'sideways_atr_max_pct': 0.06071968791131094, 'sideways_tp_mult': 2.319989968473808, 'sideways_tsl_mult': 0.7218210045036544, 'sideways_time_stop': 62, 'sideways_use_sma': False, 'sideways_use_ema': False, 'sideways_use_atr': True, 'sideways_use_adx': True, 'sideways_use_spike': False, 'sideways_rsi_required': True}.
[I 2025-09-01 14:51:44,128] Trial 363 finished with values: [-0.1255294703321852, 0.1252437369508764] and parameters: {'p_sma': 32, 'p_std': 30, 'p_atr': 11, 'p_adx': 17, 'rsi_period': 77, 'ema1': 24, 'ema2': 58, 'slip_atr_k': 0.014340406913486568, 'slip_spread_k': 0.3960277789429755, 'spread_hl_frac': 0.005073802808021164, 'bb_std_mult': 2.173522925816972, 'rsi_os': 30, 'rsi_ob': 80, 'vol_spike': 0.07310154898069582, 'adx_thresh': 6.4151904367478085, 'atr_min_pct': 0.016413880330802, 'atr_max_pct': 0.1299967477335059, 'tp_mult': 2.0282015893460352, 'tsl_mult': 0.34678144798220206, 'strategy': 'breakout', 'time_stop': 39, 'use_sma': False, 'use_atr': True, 'use_adx': False, 'use_ema': True, 'use_spike': False, 'rsi_required': True, 'edge_k': 1.4109863587965006, 'edge_cap': 0.8804749362682754, 'bull_strategy': 'mean_reversion', 'bull_bb_std_mult': 0.9117255225730494, 'bull_rsi_os': 23, 'bull_rsi_ob': 66, 'bull_adx_thresh': 6.955409706032725, 'bull_atr_min_pct': 0.01678093547690351, 'bull_atr_max_pct': 0.03404792174296084, 'bull_tp_mult': 1.3145863697754365, 'bull_tsl_mult': 0.014853551991913287, 'bull_time_stop': 140, 'bull_use_sma': False, 'bull_use_ema': True, 'bull_use_atr': False, 'bull_use_adx': False, 'bull_use_spike': False, 'bull_rsi_required': True, 'bear_strategy': 'breakout', 'bear_bb_std_mult': 1.5326520137545665, 'bear_rsi_os': 49, 'bear_rsi_ob': 51, 'bear_adx_thresh': 12.23443383546417, 'bear_atr_min_pct': 0.0013798355821962732, 'bear_atr_max_pct': 0.04574103688811806, 'bear_tp_mult': 1.5984086727400775, 'bear_tsl_mult': 0.832994149044354, 'bear_time_stop': 260, 'bear_use_sma': True, 'bear_use_ema': False, 'bear_use_atr': False, 'bear_use_adx': False, 'bear_use_spike': True, 'bear_rsi_required': True, 'sideways_strategy': 'breakout', 'sideways_bb_std_mult': 1.057857389556793, 'sideways_rsi_os': 23, 'sideways_rsi_ob': 77, 'sideways_adx_thresh': 31.929940637500877, 'sideways_atr_min_pct': 0.011056649932272405, 'sideways_atr_max_pct': 0.060223654612728966, 'sideways_tp_mult': 2.259766088563724, 'sideways_tsl_mult': 0.7237438005745153, 'sideways_time_stop': 43, 'sideways_use_sma': False, 'sideways_use_ema': False, 'sideways_use_atr': True, 'sideways_use_adx': True, 'sideways_use_spike': False, 'sideways_rsi_required': True}.
[I 2025-09-01 14:52:22,586] Trial 364 finished with values: [-1000000000.0, 1000000000.0] and parameters: {'p_sma': 33, 'p_std': 22, 'p_atr': 12, 'p_adx': 16, 'rsi_period': 72, 'ema1': 26, 'ema2': 59, 'slip_atr_k': 0.009712122634771905, 'slip_spread_k': 0.40376650431795763, 'spread_hl_frac': 0.005887797182818698, 'bb_std_mult': 2.1399376340333216, 'rsi_os': 32, 'rsi_ob': 80, 'vol_spike': 0.07211330678864628, 'adx_thresh': 6.41103743662357, 'atr_min_pct': 0.015901890644469896, 'atr_max_pct': 0.10591190538320254, 'tp_mult': 1.9089025599478193, 'tsl_mult': 0.3984185646493757, 'strategy': 'breakout', 'time_stop': 36, 'use_sma': False, 'use_atr': True, 'use_adx': False, 'use_ema': True, 'use_spike': False, 'rsi_required': True, 'edge_k': 1.4543461063663876, 'edge_cap': 0.8759320290247378, 'bull_strategy': 'mean_reversion', 'bull_bb_std_mult': 0.7785858554202836, 'bull_rsi_os': 23, 'bull_rsi_ob': 65, 'bull_adx_thresh': 5.0067848491467455, 'bull_atr_min_pct': 0.017536047742181576, 'bull_atr_max_pct': 0.03679608230968552, 'bull_tp_mult': 1.3379849077189434, 'bull_tsl_mult': 0.12283913660850751, 'bull_time_stop': 151, 'bull_use_sma': False, 'bull_use_ema': True, 'bull_use_atr': False, 'bull_use_adx': True, 'bull_use_spike': False, 'bull_rsi_required': True, 'bear_strategy': 'breakout', 'bear_bb_std_mult': 1.5176734725039656, 'bear_rsi_os': 49, 'bear_rsi_ob': 51, 'bear_adx_thresh': 14.354083222813252, 'bear_atr_min_pct': 0.024487183178356093, 'bear_atr_max_pct': 0.046178628117245275, 'bear_tp_mult': 1.5982202549688864, 'bear_tsl_mult': 0.8790001190907938, 'bear_time_stop': 257, 'bear_use_sma': True, 'bear_use_ema': False, 'bear_use_atr': False, 'bear_use_adx': False, 'bear_use_spike': True, 'bear_rsi_required': True, 'sideways_strategy': 'mean_reversion', 'sideways_bb_std_mult': 1.0666794393509744, 'sideways_rsi_os': 23, 'sideways_rsi_ob': 77, 'sideways_adx_thresh': 18.774001305715494, 'sideways_atr_min_pct': 0.013905164799615144, 'sideways_atr_max_pct': 0.07082292422652209, 'sideways_tp_mult': 2.3209951949568977, 'sideways_tsl_mult': 0.593967330076644, 'sideways_time_stop': 64, 'sideways_use_sma': True, 'sideways_use_ema': False, 'sideways_use_atr': True, 'sideways_use_adx': True, 'sideways_use_spike': False, 'sideways_rsi_required': True}.
[I 2025-09-01 14:52:23,029] Trial 365 finished with values: [-1000000000.0, 1000000000.0] and parameters: {'p_sma': 32, 'p_std': 26, 'p_atr': 12, 'p_adx': 16, 'rsi_period': 78, 'ema1': 26, 'ema2': 59, 'slip_atr_k': 0.01089353387768878, 'slip_spread_k': 0.3909333329318416, 'spread_hl_frac': 0.004121627618041643, 'bb_std_mult': 2.1800208213015755, 'rsi_os': 32, 'rsi_ob': 80, 'vol_spike': 0.0744442476488828, 'adx_thresh': 34.62698221002998, 'atr_min_pct': 0.01595182331402172, 'atr_max_pct': 0.13194788088261816, 'tp_mult': 2.0488044820213145, 'tsl_mult': 0.4013211511409087, 'strategy': 'breakout', 'time_stop': 53, 'use_sma': False, 'use_atr': True, 'use_adx': False, 'use_ema': True, 'use_spike': False, 'rsi_required': True, 'edge_k': 1.5287795041546937, 'edge_cap': 0.8899541954102279, 'bull_strategy': 'mean_reversion', 'bull_bb_std_mult': 0.7936833182930962, 'bull_rsi_os': 24, 'bull_rsi_ob': 65, 'bull_adx_thresh': 6.437114191293153, 'bull_atr_min_pct': 0.017681497197012223, 'bull_atr_max_pct': 0.05613153844077304, 'bull_tp_mult': 1.3143969466976229, 'bull_tsl_mult': 0.10676490201734021, 'bull_time_stop': 120, 'bull_use_sma': False, 'bull_use_ema': True, 'bull_use_atr': False, 'bull_use_adx': True, 'bull_use_spike': False, 'bull_rsi_required': True, 'bear_strategy': 'breakout', 'bear_bb_std_mult': 1.5104022938145032, 'bear_rsi_os': 49, 'bear_rsi_ob': 51, 'bear_adx_thresh': 14.446565895099958, 'bear_atr_min_pct': 0.024470579202390895, 'bear_atr_max_pct': 0.045718780623414376, 'bear_tp_mult': 1.6008180815009152, 'bear_tsl_mult': 0.9297848471394715, 'bear_time_stop': 256, 'bear_use_sma': True, 'bear_use_ema': False, 'bear_use_atr': False, 'bear_use_adx': False, 'bear_use_spike': True, 'bear_rsi_required': True, 'sideways_strategy': 'mean_reversion', 'sideways_bb_std_mult': 1.0512637034070653, 'sideways_rsi_os': 23, 'sideways_rsi_ob': 88, 'sideways_adx_thresh': 32.08722220388038, 'sideways_atr_min_pct': 0.013534188296440987, 'sideways_atr_max_pct': 0.060072290556927053, 'sideways_tp_mult': 2.3133861104266615, 'sideways_tsl_mult': 0.5996454357193055, 'sideways_time_stop': 65, 'sideways_use_sma': True, 'sideways_use_ema': False, 'sideways_use_atr': True, 'sideways_use_adx': True, 'sideways_use_spike': False, 'sideways_rsi_required': True}.
[I 2025-09-01 14:52:23,529] Trial 367 finished with values: [-0.012044467870769182, 0.01728771065118165] and parameters: {'p_sma': 33, 'p_std': 22, 'p_atr': 12, 'p_adx': 15, 'rsi_period': 72, 'ema1': 26, 'ema2': 60, 'slip_atr_k': 0.010052075898026622, 'slip_spread_k': 0.3389798476995965, 'spread_hl_frac': 0.008807385707147057, 'bb_std_mult': 2.1067761991628444, 'rsi_os': 32, 'rsi_ob': 78, 'vol_spike': 0.07759264508832167, 'adx_thresh': 22.458397647322986, 'atr_min_pct': 0.01504879034452076, 'atr_max_pct': 0.07204326745791645, 'tp_mult': 1.999468957590766, 'tsl_mult': 0.3907592592613208, 'strategy': 'breakout', 'time_stop': 53, 'use_sma': False, 'use_atr': True, 'use_adx': False, 'use_ema': True, 'use_spike': False, 'rsi_required': True, 'edge_k': 1.5467859690197834, 'edge_cap': 0.8630071858521154, 'bull_strategy': 'mean_reversion', 'bull_bb_std_mult': 0.7392475184885403, 'bull_rsi_os': 25, 'bull_rsi_ob': 65, 'bull_adx_thresh': 5.758051031616912, 'bull_atr_min_pct': 0.017527941156324715, 'bull_atr_max_pct': 0.03755432873950426, 'bull_tp_mult': 1.3290715334764962, 'bull_tsl_mult': 0.07717167075244488, 'bull_time_stop': 120, 'bull_use_sma': False, 'bull_use_ema': True, 'bull_use_atr': False, 'bull_use_adx': True, 'bull_use_spike': False, 'bull_rsi_required': True, 'bear_strategy': 'breakout', 'bear_bb_std_mult': 1.4544173326676637, 'bear_rsi_os': 50, 'bear_rsi_ob': 54, 'bear_adx_thresh': 12.622552209913364, 'bear_atr_min_pct': 0.005026140005562897, 'bear_atr_max_pct': 0.04970525796529775, 'bear_tp_mult': 1.6035111925857066, 'bear_tsl_mult': 0.925464054796497, 'bear_time_stop': 255, 'bear_use_sma': True, 'bear_use_ema': False, 'bear_use_atr': False, 'bear_use_adx': False, 'bear_use_spike': True, 'bear_rsi_required': True, 'sideways_strategy': 'mean_reversion', 'sideways_bb_std_mult': 1.0185356853353296, 'sideways_rsi_os': 21, 'sideways_rsi_ob': 59, 'sideways_adx_thresh': 32.42729781467133, 'sideways_atr_min_pct': 0.01360133741743662, 'sideways_atr_max_pct': 0.06290467191694121, 'sideways_tp_mult': 2.3120563405518677, 'sideways_tsl_mult': 0.5992554977294806, 'sideways_time_stop': 65, 'sideways_use_sma': True, 'sideways_use_ema': False, 'sideways_use_atr': True, 'sideways_use_adx': True, 'sideways_use_spike': False, 'sideways_rsi_required': True}.
[I 2025-09-01 14:52:23,750] Trial 366 finished with values: [-0.013708147321928155, 0.022416708398706946] and parameters: {'p_sma': 33, 'p_std': 22, 'p_atr': 12, 'p_adx': 16, 'rsi_period': 46, 'ema1': 26, 'ema2': 59, 'slip_atr_k': 0.010887103673988473, 'slip_spread_k': 0.32668091716232994, 'spread_hl_frac': 0.006216924832342503, 'bb_std_mult': 2.113780070483011, 'rsi_os': 32, 'rsi_ob': 78, 'vol_spike': 0.07361718795327728, 'adx_thresh': 6.876316597525621, 'atr_min_pct': 0.01782889487803805, 'atr_max_pct': 0.10633815660022411, 'tp_mult': 2.0478981903699762, 'tsl_mult': 0.4112000160711004, 'strategy': 'breakout', 'time_stop': 53, 'use_sma': False, 'use_atr': True, 'use_adx': False, 'use_ema': True, 'use_spike': False, 'rsi_required': True, 'edge_k': 1.5289428631495656, 'edge_cap': 0.8742300706396932, 'bull_strategy': 'mean_reversion', 'bull_bb_std_mult': 0.7726251705236871, 'bull_rsi_os': 23, 'bull_rsi_ob': 65, 'bull_adx_thresh': 6.6589421982410775, 'bull_atr_min_pct': 0.01774767395143466, 'bull_atr_max_pct': 0.037956296054696005, 'bull_tp_mult': 1.3449303231670653, 'bull_tsl_mult': 0.004340813533855542, 'bull_time_stop': 124, 'bull_use_sma': False, 'bull_use_ema': True, 'bull_use_atr': False, 'bull_use_adx': True, 'bull_use_spike': False, 'bull_rsi_required': True, 'bear_strategy': 'breakout', 'bear_bb_std_mult': 1.4777084705170007, 'bear_rsi_os': 50, 'bear_rsi_ob': 53, 'bear_adx_thresh': 12.770397840287, 'bear_atr_min_pct': 0.004853964735696164, 'bear_atr_max_pct': 0.04713475612673414, 'bear_tp_mult': 1.6105488854984489, 'bear_tsl_mult': 0.8594433671729467, 'bear_time_stop': 256, 'bear_use_sma': True, 'bear_use_ema': False, 'bear_use_atr': False, 'bear_use_adx': False, 'bear_use_spike': True, 'bear_rsi_required': True, 'sideways_strategy': 'mean_reversion', 'sideways_bb_std_mult': 1.0746181059473072, 'sideways_rsi_os': 22, 'sideways_rsi_ob': 51, 'sideways_adx_thresh': 32.24895527162528, 'sideways_atr_min_pct': 0.013900867980586602, 'sideways_atr_max_pct': 0.05798483666748182, 'sideways_tp_mult': 2.2855061067356215, 'sideways_tsl_mult': 0.6516063102581234, 'sideways_time_stop': 64, 'sideways_use_sma': True, 'sideways_use_ema': False, 'sideways_use_atr': True, 'sideways_use_adx': True, 'sideways_use_spike': False, 'sideways_rsi_required': True}.
[I 2025-09-01 14:53:01,440] Trial 369 finished with values: [-0.0182691132960634, 0.022912064706932973] and parameters: {'p_sma': 34, 'p_std': 22, 'p_atr': 12, 'p_adx': 14, 'rsi_period': 58, 'ema1': 26, 'ema2': 60, 'slip_atr_k': 0.018994629164567813, 'slip_spread_k': 0.33317944274433614, 'spread_hl_frac': 0.008781842725127935, 'bb_std_mult': 2.1464850985232644, 'rsi_os': 27, 'rsi_ob': 78, 'vol_spike': 0.08021211796294986, 'adx_thresh': 28.7745253428307, 'atr_min_pct': 0.017660124804320956, 'atr_max_pct': 0.07305266414850511, 'tp_mult': 2.00266094353993, 'tsl_mult': 0.3897367323791268, 'strategy': 'breakout', 'time_stop': 5, 'use_sma': False, 'use_atr': True, 'use_adx': False, 'use_ema': True, 'use_spike': False, 'rsi_required': True, 'edge_k': 1.5558553417268257, 'edge_cap': 0.8609968727047064, 'bull_strategy': 'mean_reversion', 'bull_bb_std_mult': 0.9677020601735572, 'bull_rsi_os': 26, 'bull_rsi_ob': 68, 'bull_adx_thresh': 5.86141782966603, 'bull_atr_min_pct': 0.018770791718238932, 'bull_atr_max_pct': 0.129555342025795, 'bull_tp_mult': 1.4035560355750807, 'bull_tsl_mult': 0.0862920672601738, 'bull_time_stop': 134, 'bull_use_sma': False, 'bull_use_ema': True, 'bull_use_atr': False, 'bull_use_adx': True, 'bull_use_spike': True, 'bull_rsi_required': False, 'bear_strategy': 'breakout', 'bear_bb_std_mult': 1.4320857988505482, 'bear_rsi_os': 50, 'bear_rsi_ob': 54, 'bear_adx_thresh': 10.351896527845282, 'bear_atr_min_pct': 0.004627521240549443, 'bear_atr_max_pct': 0.04991466932935046, 'bear_tp_mult': 1.4941510584633266, 'bear_tsl_mult': 0.7843905625421312, 'bear_time_stop': 255, 'bear_use_sma': True, 'bear_use_ema': False, 'bear_use_atr': False, 'bear_use_adx': False, 'bear_use_spike': True, 'bear_rsi_required': True, 'sideways_strategy': 'mean_reversion', 'sideways_bb_std_mult': 1.0853856042462728, 'sideways_rsi_os': 21, 'sideways_rsi_ob': 65, 'sideways_adx_thresh': 13.492773857389455, 'sideways_atr_min_pct': 0.011954578980464614, 'sideways_atr_max_pct': 0.05052906710670776, 'sideways_tp_mult': 2.225986669197029, 'sideways_tsl_mult': 0.6628708654535517, 'sideways_time_stop': 52, 'sideways_use_sma': True, 'sideways_use_ema': False, 'sideways_use_atr': True, 'sideways_use_adx': True, 'sideways_use_spike': False, 'sideways_rsi_required': True}.
