[I 2025-09-01 15:09:08,086] Trial 469 finished with values: [-1000000000.0, 1000000000.0] and parameters: {'p_sma': 31, 'p_std': 25, 'p_atr': 12, 'p_adx': 17, 'rsi_period': 73, 'ema1': 26, 'ema2': 58, 'slip_atr_k': 0.017428184941241907, 'slip_spread_k': 0.42312022451046705, 'spread_hl_frac': 0.008710154534062754, 'bb_std_mult': 2.127594621311164, 'rsi_os': 37, 'rsi_ob': 78, 'vol_spike': 0.08020245928886799, 'adx_thresh': 14.8675396672874, 'atr_min_pct': 0.02932979053825638, 'atr_max_pct': 0.038993625340826385, 'tp_mult': 1.9815074576636862, 'tsl_mult': 0.4143616575683889, 'strategy': 'mean_reversion', 'time_stop': 44, 'use_sma': True, 'use_atr': True, 'use_adx': False, 'use_ema': True, 'use_spike': False, 'rsi_required': True, 'edge_k': 1.8930003503836115, 'edge_cap': 0.6807989000877409, 'bull_strategy': 'mean_reversion', 'bull_bb_std_mult': 0.8954361720000887, 'bull_rsi_os': 23, 'bull_rsi_ob': 68, 'bull_adx_thresh': 5.826303254823666, 'bull_atr_min_pct': 0.02548074706038333, 'bull_atr_max_pct': 0.14981481657464912, 'bull_tp_mult': 1.3120051907694799, 'bull_tsl_mult': 0.011255973054639351, 'bull_time_stop': 111, 'bull_use_sma': False, 'bull_use_ema': False, 'bull_use_atr': True, 'bull_use_adx': True, 'bull_use_spike': False, 'bull_rsi_required': True, 'bear_strategy': 'breakout', 'bear_bb_std_mult': 1.460754220670279, 'bear_rsi_os': 50, 'bear_rsi_ob': 49, 'bear_adx_thresh': 9.119921899286542, 'bear_atr_min_pct': 0.01543998801820153, 'bear_atr_max_pct': 0.05289285537088605, 'bear_tp_mult': 1.6336780402238869, 'bear_tsl_mult': 0.050643392220744654, 'bear_time_stop': 277, 'bear_use_sma': True, 'bear_use_ema': False, 'bear_use_atr': False, 'bear_use_adx': False, 'bear_use_spike': True, 'bear_rsi_required': True, 'sideways_strategy': 'mean_reversion', 'sideways_bb_std_mult': 2.006470346058709, 'sideways_rsi_os': 51, 'sideways_rsi_ob': 78, 'sideways_adx_thresh': 32.218805622542774, 'sideways_atr_min_pct': 0.003912637305612015, 'sideways_atr_max_pct': 0.050920234977677004, 'sideways_tp_mult': 2.3084556543127546, 'sideways_tsl_mult': 0.7758745626051746, 'sideways_time_stop': 116, 'sideways_use_sma': True, 'sideways_use_ema': False, 'sideways_use_atr': True, 'sideways_use_adx': True, 'sideways_use_spike': False, 'sideways_rsi_required': True}.
[I 2025-09-01 15:09:08,099] Trial 468 finished with values: [-1000000000.0, 1000000000.0] and parameters: {'p_sma': 31, 'p_std': 25, 'p_atr': 11, 'p_adx': 17, 'rsi_period': 72, 'ema1': 26, 'ema2': 58, 'slip_atr_k': 0.15632482572256717, 'slip_spread_k': 0.4202542655197717, 'spread_hl_frac': 0.027365235813391103, 'bb_std_mult': 2.135969378768451, 'rsi_os': 13, 'rsi_ob': 67, 'vol_spike': 0.08042157834684299, 'adx_thresh': 7.029690132469746, 'atr_min_pct': 0.018235291433396878, 'atr_max_pct': 0.06510827247852218, 'tp_mult': 1.9727896989854932, 'tsl_mult': 0.4145270678079966, 'strategy': 'breakout', 'time_stop': 47, 'use_sma': False, 'use_atr': True, 'use_adx': False, 'use_ema': True, 'use_spike': False, 'rsi_required': True, 'edge_k': 1.8727264211678327, 'edge_cap': 0.9006687740640524, 'bull_strategy': 'mean_reversion', 'bull_bb_std_mult': 1.2125678324458706, 'bull_rsi_os': 23, 'bull_rsi_ob': 64, 'bull_adx_thresh': 5.841767242693405, 'bull_atr_min_pct': 0.015027305334798662, 'bull_atr_max_pct': 0.05928494443405542, 'bull_tp_mult': 1.3164619438456318, 'bull_tsl_mult': 0.085353392128067, 'bull_time_stop': 113, 'bull_use_sma': False, 'bull_use_ema': False, 'bull_use_atr': False, 'bull_use_adx': True, 'bull_use_spike': False, 'bull_rsi_required': True, 'bear_strategy': 'breakout', 'bear_bb_std_mult': 1.5066646742099778, 'bear_rsi_os': 52, 'bear_rsi_ob': 52, 'bear_adx_thresh': 8.799970073368996, 'bear_atr_min_pct': 0.024675302949971188, 'bear_atr_max_pct': 0.05231446503424462, 'bear_tp_mult': 2.29068539842567, 'bear_tsl_mult': 0.685125250376454, 'bear_time_stop': 270, 'bear_use_sma': True, 'bear_use_ema': False, 'bear_use_atr': False, 'bear_use_adx': False, 'bear_use_spike': True, 'bear_rsi_required': True, 'sideways_strategy': 'mean_reversion', 'sideways_bb_std_mult': 1.1962216868857967, 'sideways_rsi_os': 23, 'sideways_rsi_ob': 79, 'sideways_adx_thresh': 31.850478237144948, 'sideways_atr_min_pct': 0.028801801866542416, 'sideways_atr_max_pct': 0.05137206998800306, 'sideways_tp_mult': 2.301406241512513, 'sideways_tsl_mult': 0.9926358620079916, 'sideways_time_stop': 64, 'sideways_use_sma': True, 'sideways_use_ema': False, 'sideways_use_atr': True, 'sideways_use_adx': True, 'sideways_use_spike': False, 'sideways_rsi_required': True}.
[I 2025-09-01 15:09:09,173] Trial 467 finished with values: [-1000000000.0, 1000000000.0] and parameters: {'p_sma': 43, 'p_std': 25, 'p_atr': 29, 'p_adx': 14, 'rsi_period': 72, 'ema1': 25, 'ema2': 57, 'slip_atr_k': 0.2020816937326552, 'slip_spread_k': 0.42008344303137396, 'spread_hl_frac': 0.008657203178715224, 'bb_std_mult': 3.365086886142377, 'rsi_os': 43, 'rsi_ob': 79, 'vol_spike': 0.08009794254190371, 'adx_thresh': 14.729508618674268, 'atr_min_pct': 0.021356471014599195, 'atr_max_pct': 0.06149750529956473, 'tp_mult': 1.9787265992706438, 'tsl_mult': 0.4152615405861217, 'strategy': 'breakout', 'time_stop': 8, 'use_sma': False, 'use_atr': True, 'use_adx': False, 'use_ema': True, 'use_spike': False, 'rsi_required': False, 'edge_k': 1.1645523962719655, 'edge_cap': 0.8950067541939787, 'bull_strategy': 'mean_reversion', 'bull_bb_std_mult': 2.946294362731961, 'bull_rsi_os': 23, 'bull_rsi_ob': 46, 'bull_adx_thresh': 21.173771953489382, 'bull_atr_min_pct': 0.019557089505913713, 'bull_atr_max_pct': 0.029108302466564054, 'bull_tp_mult': 1.3112392565102744, 'bull_tsl_mult': 0.5858683621680169, 'bull_time_stop': 293, 'bull_use_sma': True, 'bull_use_ema': True, 'bull_use_atr': False, 'bull_use_adx': True, 'bull_use_spike': True, 'bull_rsi_required': False, 'bear_strategy': 'breakout', 'bear_bb_std_mult': 1.5061373859988936, 'bear_rsi_os': 7, 'bear_rsi_ob': 52, 'bear_adx_thresh': 9.11604257112009, 'bear_atr_min_pct': 0.019335215972482292, 'bear_atr_max_pct': 0.09519280887632128, 'bear_tp_mult': 2.2657606035079954, 'bear_tsl_mult': 0.7091625684994478, 'bear_time_stop': 197, 'bear_use_sma': True, 'bear_use_ema': False, 'bear_use_atr': False, 'bear_use_adx': False, 'bear_use_spike': True, 'bear_rsi_required': False, 'sideways_strategy': 'mean_reversion', 'sideways_bb_std_mult': 3.544658868888609, 'sideways_rsi_os': 9, 'sideways_rsi_ob': 79, 'sideways_adx_thresh': 19.273457855004775, 'sideways_atr_min_pct': 0.010579120935886558, 'sideways_atr_max_pct': 0.08900077437328496, 'sideways_tp_mult': 2.2233768928410047, 'sideways_tsl_mult': 0.7819332466150125, 'sideways_time_stop': 117, 'sideways_use_sma': True, 'sideways_use_ema': False, 'sideways_use_atr': True, 'sideways_use_adx': True, 'sideways_use_spike': False, 'sideways_rsi_required': True}.
[I 2025-09-01 15:09:52,335] Trial 471 finished with values: [-1000000000.0, 1000000000.0] and parameters: {'p_sma': 36, 'p_std': 22, 'p_atr': 27, 'p_adx': 13, 'rsi_period': 76, 'ema1': 26, 'ema2': 58, 'slip_atr_k': 0.07916051670704397, 'slip_spread_k': 0.8002259183904279, 'spread_hl_frac': 0.034068583649397174, 'bb_std_mult': 2.1378889183218006, 'rsi_os': 31, 'rsi_ob': 64, 'vol_spike': 0.0798179183897863, 'adx_thresh': 24.064464576573304, 'atr_min_pct': 0.021509974863616454, 'atr_max_pct': 0.07116589290017555, 'tp_mult': 2.0719231784258025, 'tsl_mult': 0.40089765275005695, 'strategy': 'breakout', 'time_stop': 57, 'use_sma': False, 'use_atr': True, 'use_adx': False, 'use_ema': True, 'use_spike': False, 'rsi_required': True, 'edge_k': 1.0754937645836182, 'edge_cap': 0.8706555636136021, 'bull_strategy': 'mean_reversion', 'bull_bb_std_mult': 2.7905171346695834, 'bull_rsi_os': 25, 'bull_rsi_ob': 64, 'bull_adx_thresh': 21.30744759107531, 'bull_atr_min_pct': 0.018246113065477257, 'bull_atr_max_pct': 0.12854433166698903, 'bull_tp_mult': 2.499492129141296, 'bull_tsl_mult': 0.11304389566191295, 'bull_time_stop': 113, 'bull_use_sma': False, 'bull_use_ema': True, 'bull_use_atr': False, 'bull_use_adx': True, 'bull_use_spike': False, 'bull_rsi_required': True, 'bear_strategy': 'breakout', 'bear_bb_std_mult': 1.24369322435183, 'bear_rsi_os': 51, 'bear_rsi_ob': 92, 'bear_adx_thresh': 10.040304342797814, 'bear_atr_min_pct': 0.023924118410192707, 'bear_atr_max_pct': 0.05252504090053765, 'bear_tp_mult': 2.5092819953567345, 'bear_tsl_mult': 0.27104899931422244, 'bear_time_stop': 19, 'bear_use_sma': True, 'bear_use_ema': False, 'bear_use_atr': False, 'bear_use_adx': False, 'bear_use_spike': True, 'bear_rsi_required': True, 'sideways_strategy': 'mean_reversion', 'sideways_bb_std_mult': 1.869039642895735, 'sideways_rsi_os': 23, 'sideways_rsi_ob': 79, 'sideways_adx_thresh': 32.14045214982554, 'sideways_atr_min_pct': 0.02008359798325298, 'sideways_atr_max_pct': 0.05089900824073712, 'sideways_tp_mult': 2.234249525186251, 'sideways_tsl_mult': 0.8090370174828876, 'sideways_time_stop': 250, 'sideways_use_sma': True, 'sideways_use_ema': False, 'sideways_use_atr': True, 'sideways_use_adx': True, 'sideways_use_spike': False, 'sideways_rsi_required': True}.
[I 2025-09-01 15:09:53,274] Trial 474 finished with values: [-1000000000.0, 1000000000.0] and parameters: {'p_sma': 36, 'p_std': 43, 'p_atr': 26, 'p_adx': 13, 'rsi_period': 37, 'ema1': 7, 'ema2': 47, 'slip_atr_k': 0.16816983665413132, 'slip_spread_k': 0.07622257783400344, 'spread_hl_frac': 0.030543515847570486, 'bb_std_mult': 2.2765603569366974, 'rsi_os': 15, 'rsi_ob': 60, 'vol_spike': 0.06781935378462076, 'adx_thresh': 28.9960523220599, 'atr_min_pct': 0.01595148909737082, 'atr_max_pct': 0.10126969531600423, 'tp_mult': 2.0673330211747216, 'tsl_mult': 0.0009987626789399462, 'strategy': 'breakout', 'time_stop': 168, 'use_sma': False, 'use_atr': True, 'use_adx': True, 'use_ema': True, 'use_spike': False, 'rsi_required': True, 'edge_k': 1.7463259741671064, 'edge_cap': 0.3877825617936003, 'bull_strategy': 'mean_reversion', 'bull_bb_std_mult': 2.772188330723122, 'bull_rsi_os': 25, 'bull_rsi_ob': 66, 'bull_adx_thresh': 7.3576559624683044, 'bull_atr_min_pct': 0.013069164565598323, 'bull_atr_max_pct': 0.03542800501615394, 'bull_tp_mult': 2.1724141265155934, 'bull_tsl_mult': 0.124387071375085, 'bull_time_stop': 162, 'bull_use_sma': False, 'bull_use_ema': True, 'bull_use_atr': False, 'bull_use_adx': True, 'bull_use_spike': False, 'bull_rsi_required': True, 'bear_strategy': 'breakout', 'bear_bb_std_mult': 1.239794045132757, 'bear_rsi_os': 17, 'bear_rsi_ob': 84, 'bear_adx_thresh': 22.868646305686124, 'bear_atr_min_pct': 0.02048935796312517, 'bear_atr_max_pct': 0.04843359985187241, 'bear_tp_mult': 1.5380379787814715, 'bear_tsl_mult': 0.7591378026318144, 'bear_time_stop': 96, 'bear_use_sma': True, 'bear_use_ema': False, 'bear_use_atr': True, 'bear_use_adx': True, 'bear_use_spike': True, 'bear_rsi_required': True, 'sideways_strategy': 'breakout', 'sideways_bb_std_mult': 2.3476643366815697, 'sideways_rsi_os': 18, 'sideways_rsi_ob': 54, 'sideways_adx_thresh': 29.643494362044354, 'sideways_atr_min_pct': 0.026834551747324395, 'sideways_atr_max_pct': 0.05605296003568213, 'sideways_tp_mult': 1.6310925788113602, 'sideways_tsl_mult': 0.5314939845528922, 'sideways_time_stop': 76, 'sideways_use_sma': False, 'sideways_use_ema': False, 'sideways_use_atr': True, 'sideways_use_adx': True, 'sideways_use_spike': False, 'sideways_rsi_required': True}.
[I 2025-09-01 15:09:53,983] Trial 472 finished with values: [-1000000000.0, 1000000000.0] and parameters: {'p_sma': 29, 'p_std': 22, 'p_atr': 13, 'p_adx': 13, 'rsi_period': 47, 'ema1': 25, 'ema2': 57, 'slip_atr_k': 0.07920004028111949, 'slip_spread_k': 0.44679846849610394, 'spread_hl_frac': 0.007878699412467096, 'bb_std_mult': 2.3531555560447184, 'rsi_os': 31, 'rsi_ob': 64, 'vol_spike': 0.07226009974946834, 'adx_thresh': 5.090022871838594, 'atr_min_pct': 0.02126681136319615, 'atr_max_pct': 0.07078573744435589, 'tp_mult': 1.4514576946116078, 'tsl_mult': 0.3152924524323557, 'strategy': 'breakout', 'time_stop': 55, 'use_sma': False, 'use_atr': True, 'use_adx': True, 'use_ema': True, 'use_spike': False, 'rsi_required': True, 'edge_k': 1.7969139029135515, 'edge_cap': 0.9187807893033065, 'bull_strategy': 'mean_reversion', 'bull_bb_std_mult': 3.3979771253449633, 'bull_rsi_os': 25, 'bull_rsi_ob': 66, 'bull_adx_thresh': 7.261015292235791, 'bull_atr_min_pct': 0.0183730308087584, 'bull_atr_max_pct': 0.04405235411211437, 'bull_tp_mult': 2.6441526439885448, 'bull_tsl_mult': 0.1129732994520509, 'bull_time_stop': 55, 'bull_use_sma': False, 'bull_use_ema': True, 'bull_use_atr': False, 'bull_use_adx': True, 'bull_use_spike': False, 'bull_rsi_required': True, 'bear_strategy': 'breakout', 'bear_bb_std_mult': 1.3952608796565402, 'bear_rsi_os': 7, 'bear_rsi_ob': 84, 'bear_adx_thresh': 22.97034930038198, 'bear_atr_min_pct': 0.004712694883852256, 'bear_atr_max_pct': 0.09606272463853391, 'bear_tp_mult': 2.5306733364086007, 'bear_tsl_mult': 0.7542250732741517, 'bear_time_stop': 251, 'bear_use_sma': True, 'bear_use_ema': False, 'bear_use_atr': True, 'bear_use_adx': False, 'bear_use_spike': True, 'bear_rsi_required': True, 'sideways_strategy': 'mean_reversion', 'sideways_bb_std_mult': 2.58135999075356, 'sideways_rsi_os': 15, 'sideways_rsi_ob': 85, 'sideways_adx_thresh': 23.733663858562117, 'sideways_atr_min_pct': 0.012430397072076289, 'sideways_atr_max_pct': 0.04751846752620081, 'sideways_tp_mult': 2.229487199919808, 'sideways_tsl_mult': 0.8010830603714686, 'sideways_time_stop': 41, 'sideways_use_sma': True, 'sideways_use_ema': False, 'sideways_use_atr': True, 'sideways_use_adx': True, 'sideways_use_spike': False, 'sideways_rsi_required': True}.
[I 2025-09-01 15:09:54,357] Trial 473 finished with values: [-0.034670579664379475, 0.03449551438788936] and parameters: {'p_sma': 36, 'p_std': 22, 'p_atr': 13, 'p_adx': 13, 'rsi_period': 75, 'ema1': 25, 'ema2': 57, 'slip_atr_k': 0.12538938918710701, 'slip_spread_k': 0.44580289986416116, 'spread_hl_frac': 0.006839022703947356, 'bb_std_mult': 2.212650087239286, 'rsi_os': 31, 'rsi_ob': 80, 'vol_spike': 0.09653994687339414, 'adx_thresh': 32.28648842202099, 'atr_min_pct': 0.015792564857820875, 'atr_max_pct': 0.0451581369672892, 'tp_mult': 2.054582184075512, 'tsl_mult': 0.4312666455308088, 'strategy': 'breakout', 'time_stop': 240, 'use_sma': False, 'use_atr': True, 'use_adx': True, 'use_ema': True, 'use_spike': False, 'rsi_required': True, 'edge_k': 1.070547174537554, 'edge_cap': 0.3791533076131469, 'bull_strategy': 'mean_reversion', 'bull_bb_std_mult': 2.944019882280445, 'bull_rsi_os': 25, 'bull_rsi_ob': 66, 'bull_adx_thresh': 7.308454723966877, 'bull_atr_min_pct': 0.018013136446837583, 'bull_atr_max_pct': 0.03530682479554665, 'bull_tp_mult': 1.4897567239369285, 'bull_tsl_mult': 0.12395270425356732, 'bull_time_stop': 154, 'bull_use_sma': False, 'bull_use_ema': True, 'bull_use_atr': False, 'bull_use_adx': True, 'bull_use_spike': False, 'bull_rsi_required': True, 'bear_strategy': 'breakout', 'bear_bb_std_mult': 2.645269550592951, 'bear_rsi_os': 51, 'bear_rsi_ob': 53, 'bear_adx_thresh': 26.597047384221725, 'bear_atr_min_pct': 0.004894395682564495, 'bear_atr_max_pct': 0.04915702292180309, 'bear_tp_mult': 1.7052743232684566, 'bear_tsl_mult': 0.9769076672998824, 'bear_time_stop': 221, 'bear_use_sma': True, 'bear_use_ema': False, 'bear_use_atr': True, 'bear_use_adx': False, 'bear_use_spike': True, 'bear_rsi_required': True, 'sideways_strategy': 'mean_reversion', 'sideways_bb_std_mult': 1.1362215098342536, 'sideways_rsi_os': 18, 'sideways_rsi_ob': 46, 'sideways_adx_thresh': 29.710552060643355, 'sideways_atr_min_pct': 0.01984067810669828, 'sideways_atr_max_pct': 0.054962627743196005, 'sideways_tp_mult': 2.1127308226756285, 'sideways_tsl_mult': 0.7539555399467838, 'sideways_time_stop': 192, 'sideways_use_sma': True, 'sideways_use_ema': False, 'sideways_use_atr': True, 'sideways_use_adx': True, 'sideways_use_spike': False, 'sideways_rsi_required': True}.
[I 2025-09-01 15:09:55,370] Trial 477 finished with values: [-1000000000.0, 1000000000.0] and parameters: {'p_sma': 30, 'p_std': 54, 'p_atr': 12, 'p_adx': 18, 'rsi_period': 68, 'ema1': 27, 'ema2': 35, 'slip_atr_k': 0.24192614659640493, 'slip_spread_k': 0.001032339121691983, 'spread_hl_frac': 0.0064853282202533315, 'bb_std_mult': 2.1838070924846287, 'rsi_os': 52, 'rsi_ob': 80, 'vol_spike': 0.2529639867353962, 'adx_thresh': 31.964793013663474, 'atr_min_pct': 0.012874090923775694, 'atr_max_pct': 0.07627390837582312, 'tp_mult': 2.5612262676854094, 'tsl_mult': 0.3550148515414527, 'strategy': 'mean_reversion', 'time_stop': 42, 'use_sma': True, 'use_atr': True, 'use_adx': False, 'use_ema': True, 'use_spike': True, 'rsi_required': True, 'edge_k': 1.2872743362543735, 'edge_cap': 0.9282804235763219, 'bull_strategy': 'mean_reversion', 'bull_bb_std_mult': 0.7816277410008324, 'bull_rsi_os': 13, 'bull_rsi_ob': 67, 'bull_adx_thresh': 6.039185009310765, 'bull_atr_min_pct': 0.015492577685034018, 'bull_atr_max_pct': 0.06586533718260817, 'bull_tp_mult': 1.4679181020469512, 'bull_tsl_mult': 0.28375295788349575, 'bull_time_stop': 181, 'bull_use_sma': False, 'bull_use_ema': True, 'bull_use_atr': True, 'bull_use_adx': True, 'bull_use_spike': False, 'bull_rsi_required': True, 'bear_strategy': 'mean_reversion', 'bear_bb_std_mult': 1.5568465908177196, 'bear_rsi_os': 50, 'bear_rsi_ob': 53, 'bear_adx_thresh': 10.806076951898206, 'bear_atr_min_pct': 0.027174997240775697, 'bear_atr_max_pct': 0.046457482548529085, 'bear_tp_mult': 2.579199798250409, 'bear_tsl_mult': 0.20353297898310901, 'bear_time_stop': 264, 'bear_use_sma': True, 'bear_use_ema': False, 'bear_use_atr': False, 'bear_use_adx': False, 'bear_use_spike': True, 'bear_rsi_required': True, 'sideways_strategy': 'mean_reversion', 'sideways_bb_std_mult': 1.6718930298621908, 'sideways_rsi_os': 25, 'sideways_rsi_ob': 62, 'sideways_adx_thresh': 27.21134204250405, 'sideways_atr_min_pct': 0.013442630749694772, 'sideways_atr_max_pct': 0.06375244526799118, 'sideways_tp_mult': 2.340078281445177, 'sideways_tsl_mult': 0.7283649879471759, 'sideways_time_stop': 60, 'sideways_use_sma': True, 'sideways_use_ema': False, 'sideways_use_atr': True, 'sideways_use_adx': True, 'sideways_use_spike': False, 'sideways_rsi_required': True}.
[I 2025-09-01 15:10:38,593] Trial 478 finished with values: [-1000000000.0, 1000000000.0] and parameters: {'p_sma': 44, 'p_std': 29, 'p_atr': 20, 'p_adx': 14, 'rsi_period': 68, 'ema1': 27, 'ema2': 60, 'slip_atr_k': 0.0052931242038394555, 'slip_spread_k': 0.8260691477980475, 'spread_hl_frac': 0.006719844957135857, 'bb_std_mult': 2.195202530245639, 'rsi_os': 40, 'rsi_ob': 81, 'vol_spike': 0.08860490338012748, 'adx_thresh': 33.10598347758672, 'atr_min_pct': 0.016623634582404147, 'atr_max_pct': 0.07500434938339572, 'tp_mult': 1.9127062598842204, 'tsl_mult': 0.09560765989257375, 'strategy': 'mean_reversion', 'time_stop': 127, 'use_sma': True, 'use_atr': True, 'use_adx': False, 'use_ema': True, 'use_spike': True, 'rsi_required': True, 'edge_k': 1.2770553561357985, 'edge_cap': 0.11010417184862109, 'bull_strategy': 'mean_reversion', 'bull_bb_std_mult': 0.7783053646386573, 'bull_rsi_os': 24, 'bull_rsi_ob': 71, 'bull_adx_thresh': 6.227111079906028, 'bull_atr_min_pct': 0.015268248198962402, 'bull_atr_max_pct': 0.03926747332114636, 'bull_tp_mult': 1.4316005535407041, 'bull_tsl_mult': 0.6140462750158795, 'bull_time_stop': 204, 'bull_use_sma': False, 'bull_use_ema': True, 'bull_use_atr': True, 'bull_use_adx': True, 'bull_use_spike': False, 'bull_rsi_required': True, 'bear_strategy': 'mean_reversion', 'bear_bb_std_mult': 0.5446719460745677, 'bear_rsi_os': 13, 'bear_rsi_ob': 51, 'bear_adx_thresh': 16.08805076282308, 'bear_atr_min_pct': 0.00597654008173333, 'bear_atr_max_pct': 0.03698549515949258, 'bear_tp_mult': 1.4497240249492898, 'bear_tsl_mult': 0.7224072481207856, 'bear_time_stop': 163, 'bear_use_sma': True, 'bear_use_ema': False, 'bear_use_atr': False, 'bear_use_adx': True, 'bear_use_spike': True, 'bear_rsi_required': True, 'sideways_strategy': 'breakout', 'sideways_bb_std_mult': 1.7037107777114837, 'sideways_rsi_os': 25, 'sideways_rsi_ob': 52, 'sideways_adx_thresh': 12.531078207791033, 'sideways_atr_min_pct': 0.013237395905391022, 'sideways_atr_max_pct': 0.04374529788280062, 'sideways_tp_mult': 2.343259463625071, 'sideways_tsl_mult': 0.7217487703784627, 'sideways_time_stop': 60, 'sideways_use_sma': False, 'sideways_use_ema': False, 'sideways_use_atr': True, 'sideways_use_adx': True, 'sideways_use_spike': False, 'sideways_rsi_required': True}.
