[I 2025-09-01 14:54:27,339] Trial 379 finished with values: [-1000000000.0, 1000000000.0] and parameters: {'p_sma': 32, 'p_std': 22, 'p_atr': 11, 'p_adx': 15, 'rsi_period': 19, 'ema1': 26, 'ema2': 58, 'slip_atr_k': 0.010767247191375347, 'slip_spread_k': 0.42152690289769357, 'spread_hl_frac': 0.007703865708210427, 'bb_std_mult': 2.01129311376978, 'rsi_os': 30, 'rsi_ob': 76, 'vol_spike': 0.059503262261093974, 'adx_thresh': 16.793640105630622, 'atr_min_pct': 0.016063247463086218, 'atr_max_pct': 0.12723987582534477, 'tp_mult': 1.8729352101179468, 'tsl_mult': 0.421892101319124, 'strategy': 'breakout', 'time_stop': 46, 'use_sma': False, 'use_atr': True, 'use_adx': False, 'use_ema': True, 'use_spike': True, 'rsi_required': False, 'edge_k': 1.1135158144198483, 'edge_cap': 0.7574288804013332, 'bull_strategy': 'mean_reversion', 'bull_bb_std_mult': 1.0431509549174203, 'bull_rsi_os': 25, 'bull_rsi_ob': 65, 'bull_adx_thresh': 7.450732156818254, 'bull_atr_min_pct': 0.015298029382368268, 'bull_atr_max_pct': 0.028961105226571186, 'bull_tp_mult': 1.4469484748144192, 'bull_tsl_mult': 0.005338966430431337, 'bull_time_stop': 143, 'bull_use_sma': True, 'bull_use_ema': True, 'bull_use_atr': False, 'bull_use_adx': False, 'bull_use_spike': False, 'bull_rsi_required': True, 'bear_strategy': 'mean_reversion', 'bear_bb_std_mult': 1.5354048814201855, 'bear_rsi_os': 45, 'bear_rsi_ob': 51, 'bear_adx_thresh': 9.210885074677664, 'bear_atr_min_pct': 0.013809699687292539, 'bear_atr_max_pct': 0.05396879220358309, 'bear_tp_mult': 1.574865483163228, 'bear_tsl_mult': 0.7219028971801695, 'bear_time_stop': 260, 'bear_use_sma': True, 'bear_use_ema': False, 'bear_use_atr': False, 'bear_use_adx': False, 'bear_use_spike': True, 'bear_rsi_required': False, 'sideways_strategy': 'breakout', 'sideways_bb_std_mult': 1.1245505201036963, 'sideways_rsi_os': 24, 'sideways_rsi_ob': 68, 'sideways_adx_thresh': 9.802512960465041, 'sideways_atr_min_pct': 0.012858962197608565, 'sideways_atr_max_pct': 0.0524726371898651, 'sideways_tp_mult': 2.291706324137032, 'sideways_tsl_mult': 0.7087183205423301, 'sideways_time_stop': 37, 'sideways_use_sma': False, 'sideways_use_ema': False, 'sideways_use_atr': True, 'sideways_use_adx': False, 'sideways_use_spike': False, 'sideways_rsi_required': True}.
[I 2025-09-01 14:54:27,566] Trial 376 finished with values: [-1000000000.0, 1000000000.0] and parameters: {'p_sma': 33, 'p_std': 23, 'p_atr': 12, 'p_adx': 15, 'rsi_period': 27, 'ema1': 25, 'ema2': 57, 'slip_atr_k': 0.018384879726036522, 'slip_spread_k': 0.9473582953415802, 'spread_hl_frac': 0.008143862757237589, 'bb_std_mult': 2.150035816497242, 'rsi_os': 30, 'rsi_ob': 76, 'vol_spike': 0.07849515849275426, 'adx_thresh': 22.174307780737475, 'atr_min_pct': 0.01665718509082899, 'atr_max_pct': 0.07012998532220872, 'tp_mult': 1.9946871622416782, 'tsl_mult': 0.42315690124290206, 'strategy': 'breakout', 'time_stop': 45, 'use_sma': False, 'use_atr': True, 'use_adx': False, 'use_ema': True, 'use_spike': False, 'rsi_required': True, 'edge_k': 1.6004281082232104, 'edge_cap': 0.9031976298710771, 'bull_strategy': 'mean_reversion', 'bull_bb_std_mult': 1.0505545512925016, 'bull_rsi_os': 25, 'bull_rsi_ob': 66, 'bull_adx_thresh': 6.338711852360813, 'bull_atr_min_pct': 0.01555228926933747, 'bull_atr_max_pct': 0.03380145705838905, 'bull_tp_mult': 1.3415551879422487, 'bull_tsl_mult': 0.0019031383001218982, 'bull_time_stop': 137, 'bull_use_sma': True, 'bull_use_ema': True, 'bull_use_atr': False, 'bull_use_adx': True, 'bull_use_spike': False, 'bull_rsi_required': True, 'bear_strategy': 'breakout', 'bear_bb_std_mult': 1.4341970912949304, 'bear_rsi_os': 51, 'bear_rsi_ob': 51, 'bear_adx_thresh': 9.943253234310466, 'bear_atr_min_pct': 0.016471866681666593, 'bear_atr_max_pct': 0.05427973260518427, 'bear_tp_mult': 1.5722856368738032, 'bear_tsl_mult': 0.7418949975743764, 'bear_time_stop': 183, 'bear_use_sma': True, 'bear_use_ema': False, 'bear_use_atr': False, 'bear_use_adx': False, 'bear_use_spike': True, 'bear_rsi_required': True, 'sideways_strategy': 'mean_reversion', 'sideways_bb_std_mult': 0.9118196478618523, 'sideways_rsi_os': 22, 'sideways_rsi_ob': 79, 'sideways_adx_thresh': 32.50837531911241, 'sideways_atr_min_pct': 0.010383818925565544, 'sideways_atr_max_pct': 0.05225665206992303, 'sideways_tp_mult': 2.197001089093471, 'sideways_tsl_mult': 0.7104624381561844, 'sideways_time_stop': 55, 'sideways_use_sma': True, 'sideways_use_ema': False, 'sideways_use_atr': True, 'sideways_use_adx': True, 'sideways_use_spike': False, 'sideways_rsi_required': True}.
[I 2025-09-01 14:55:06,064] Trial 382 finished with values: [-1000000000.0, 1000000000.0] and parameters: {'p_sma': 31, 'p_std': 26, 'p_atr': 12, 'p_adx': 14, 'rsi_period': 76, 'ema1': 25, 'ema2': 58, 'slip_atr_k': 0.007141871199763722, 'slip_spread_k': 0.4343535920716761, 'spread_hl_frac': 0.009615807146569916, 'bb_std_mult': 2.1431894785653207, 'rsi_os': 28, 'rsi_ob': 80, 'vol_spike': 0.06900296615734255, 'adx_thresh': 28.637883543856653, 'atr_min_pct': 0.018350449034878466, 'atr_max_pct': 0.1125296961861234, 'tp_mult': 1.9493139719784762, 'tsl_mult': 0.3575025967681851, 'strategy': 'breakout', 'time_stop': 16, 'use_sma': False, 'use_atr': True, 'use_adx': False, 'use_ema': True, 'use_spike': False, 'rsi_required': True, 'edge_k': 1.4840094403338235, 'edge_cap': 0.23074960339028472, 'bull_strategy': 'mean_reversion', 'bull_bb_std_mult': 0.855647443465674, 'bull_rsi_os': 23, 'bull_rsi_ob': 67, 'bull_adx_thresh': 6.039312775471265, 'bull_atr_min_pct': 0.01739257027783357, 'bull_atr_max_pct': 0.1423960566632468, 'bull_tp_mult': 1.3281040053266298, 'bull_tsl_mult': 0.09377606660187461, 'bull_time_stop': 116, 'bull_use_sma': False, 'bull_use_ema': True, 'bull_use_atr': False, 'bull_use_adx': True, 'bull_use_spike': False, 'bull_rsi_required': True, 'bear_strategy': 'breakout', 'bear_bb_std_mult': 1.388721778324814, 'bear_rsi_os': 20, 'bear_rsi_ob': 50, 'bear_adx_thresh': 9.785556810953766, 'bear_atr_min_pct': 0.02226105572125313, 'bear_atr_max_pct': 0.0438158125106719, 'bear_tp_mult': 1.5189135807375822, 'bear_tsl_mult': 0.737464195192525, 'bear_time_stop': 251, 'bear_use_sma': True, 'bear_use_ema': False, 'bear_use_atr': False, 'bear_use_adx': False, 'bear_use_spike': True, 'bear_rsi_required': True, 'sideways_strategy': 'breakout', 'sideways_bb_std_mult': 1.0554014537292782, 'sideways_rsi_os': 24, 'sideways_rsi_ob': 80, 'sideways_adx_thresh': 32.78822360192713, 'sideways_atr_min_pct': 0.011653701338593286, 'sideways_atr_max_pct': 0.04677306806846949, 'sideways_tp_mult': 2.268227490211921, 'sideways_tsl_mult': 0.6182848168571621, 'sideways_time_stop': 54, 'sideways_use_sma': True, 'sideways_use_ema': False, 'sideways_use_atr': True, 'sideways_use_adx': True, 'sideways_use_spike': False, 'sideways_rsi_required': True}.
[I 2025-09-01 14:55:06,442] Trial 380 finished with values: [-1000000000.0, 1000000000.0] and parameters: {'p_sma': 30, 'p_std': 26, 'p_atr': 11, 'p_adx': 14, 'rsi_period': 76, 'ema1': 26, 'ema2': 55, 'slip_atr_k': 0.011316419899152805, 'slip_spread_k': 0.19363861847747804, 'spread_hl_frac': 0.005850781294203581, 'bb_std_mult': 2.107087866701447, 'rsi_os': 34, 'rsi_ob': 80, 'vol_spike': 0.06615053410431071, 'adx_thresh': 10.453352438888478, 'atr_min_pct': 0.01776288481868684, 'atr_max_pct': 0.06535394527231694, 'tp_mult': 1.9435344569439263, 'tsl_mult': 0.3555312057095199, 'strategy': 'breakout', 'time_stop': 15, 'use_sma': False, 'use_atr': True, 'use_adx': False, 'use_ema': True, 'use_spike': True, 'rsi_required': True, 'edge_k': 1.4856222051308836, 'edge_cap': 0.2271748879061859, 'bull_strategy': 'mean_reversion', 'bull_bb_std_mult': 0.9735627403679956, 'bull_rsi_os': 23, 'bull_rsi_ob': 70, 'bull_adx_thresh': 7.7453256667048285, 'bull_atr_min_pct': 0.017005887606173387, 'bull_atr_max_pct': 0.033830457232195035, 'bull_tp_mult': 1.4428657126849411, 'bull_tsl_mult': 0.10242134368761771, 'bull_time_stop': 116, 'bull_use_sma': False, 'bull_use_ema': True, 'bull_use_atr': False, 'bull_use_adx': True, 'bull_use_spike': False, 'bull_rsi_required': True, 'bear_strategy': 'mean_reversion', 'bear_bb_std_mult': 1.4019752959495062, 'bear_rsi_os': 51, 'bear_rsi_ob': 51, 'bear_adx_thresh': 9.081393278368337, 'bear_atr_min_pct': 0.022331587870586284, 'bear_atr_max_pct': 0.04386024961123559, 'bear_tp_mult': 1.2357426444645898, 'bear_tsl_mult': 0.7278143409909092, 'bear_time_stop': 294, 'bear_use_sma': True, 'bear_use_ema': False, 'bear_use_atr': False, 'bear_use_adx': False, 'bear_use_spike': True, 'bear_rsi_required': True, 'sideways_strategy': 'breakout', 'sideways_bb_std_mult': 1.1301576611665471, 'sideways_rsi_os': 24, 'sideways_rsi_ob': 79, 'sideways_adx_thresh': 26.120991947492445, 'sideways_atr_min_pct': 0.012709139758144875, 'sideways_atr_max_pct': 0.047536668286414396, 'sideways_tp_mult': 2.2783122546108556, 'sideways_tsl_mult': 0.70810591705853, 'sideways_time_stop': 255, 'sideways_use_sma': False, 'sideways_use_ema': False, 'sideways_use_atr': True, 'sideways_use_adx': True, 'sideways_use_spike': False, 'sideways_rsi_required': True}.
[I 2025-09-01 14:55:06,776] Trial 381 finished with values: [-1000000000.0, 1000000000.0] and parameters: {'p_sma': 30, 'p_std': 25, 'p_atr': 11, 'p_adx': 14, 'rsi_period': 76, 'ema1': 23, 'ema2': 58, 'slip_atr_k': 0.012431190577864808, 'slip_spread_k': 0.2249444950868137, 'spread_hl_frac': 0.009947268400962099, 'bb_std_mult': 2.0985436833536797, 'rsi_os': 27, 'rsi_ob': 80, 'vol_spike': 0.06419861786358222, 'adx_thresh': 5.234344506656747, 'atr_min_pct': 0.0176163471969002, 'atr_max_pct': 0.11287563487453973, 'tp_mult': 1.956270419128487, 'tsl_mult': 0.361774585461987, 'strategy': 'breakout', 'time_stop': 59, 'use_sma': False, 'use_atr': True, 'use_adx': False, 'use_ema': True, 'use_spike': True, 'rsi_required': True, 'edge_k': 1.1171920416603383, 'edge_cap': 0.8253505733442754, 'bull_strategy': 'mean_reversion', 'bull_bb_std_mult': 0.8667536646004245, 'bull_rsi_os': 23, 'bull_rsi_ob': 70, 'bull_adx_thresh': 7.218205153184635, 'bull_atr_min_pct': 0.01697279436680696, 'bull_atr_max_pct': 0.1429518846934737, 'bull_tp_mult': 1.4436421544717453, 'bull_tsl_mult': 0.09188725214109175, 'bull_time_stop': 119, 'bull_use_sma': False, 'bull_use_ema': True, 'bull_use_atr': False, 'bull_use_adx': True, 'bull_use_spike': False, 'bull_rsi_required': True, 'bear_strategy': 'mean_reversion', 'bear_bb_std_mult': 1.4206053170744675, 'bear_rsi_os': 46, 'bear_rsi_ob': 51, 'bear_adx_thresh': 9.029343143576229, 'bear_atr_min_pct': 0.004473813496069841, 'bear_atr_max_pct': 0.042763885478587574, 'bear_tp_mult': 2.350591383966863, 'bear_tsl_mult': 0.7723542810498367, 'bear_time_stop': 262, 'bear_use_sma': True, 'bear_use_ema': False, 'bear_use_atr': False, 'bear_use_adx': False, 'bear_use_spike': True, 'bear_rsi_required': True, 'sideways_strategy': 'breakout', 'sideways_bb_std_mult': 1.137366075819314, 'sideways_rsi_os': 24, 'sideways_rsi_ob': 66, 'sideways_adx_thresh': 31.36664806749307, 'sideways_atr_min_pct': 0.012769115602117541, 'sideways_atr_max_pct': 0.04831295709098828, 'sideways_tp_mult': 2.294451120884043, 'sideways_tsl_mult': 0.6218812726558325, 'sideways_time_stop': 67, 'sideways_use_sma': False, 'sideways_use_ema': False, 'sideways_use_atr': True, 'sideways_use_adx': True, 'sideways_use_spike': False, 'sideways_rsi_required': True}.
[I 2025-09-01 14:55:07,015] Trial 383 finished with values: [-1000000000.0, 1000000000.0] and parameters: {'p_sma': 30, 'p_std': 25, 'p_atr': 11, 'p_adx': 14, 'rsi_period': 76, 'ema1': 5, 'ema2': 58, 'slip_atr_k': 0.013684559692469993, 'slip_spread_k': 0.3168344335798651, 'spread_hl_frac': 0.006013953148162814, 'bb_std_mult': 2.1084260884745882, 'rsi_os': 28, 'rsi_ob': 80, 'vol_spike': 0.06884018197554183, 'adx_thresh': 28.60372306389238, 'atr_min_pct': 0.017517751762152603, 'atr_max_pct': 0.06486522376257725, 'tp_mult': 1.9391212988579194, 'tsl_mult': 0.35488842115650626, 'strategy': 'breakout', 'time_stop': 59, 'use_sma': False, 'use_atr': True, 'use_adx': False, 'use_ema': True, 'use_spike': True, 'rsi_required': True, 'edge_k': 1.4919289084085168, 'edge_cap': 0.6171043904993897, 'bull_strategy': 'mean_reversion', 'bull_bb_std_mult': 0.8807460132799685, 'bull_rsi_os': 23, 'bull_rsi_ob': 64, 'bull_adx_thresh': 7.52131152914051, 'bull_atr_min_pct': 0.01722535552798746, 'bull_atr_max_pct': 0.13400675472106607, 'bull_tp_mult': 1.3473531933506329, 'bull_tsl_mult': 0.09510691104297461, 'bull_time_stop': 119, 'bull_use_sma': False, 'bull_use_ema': True, 'bull_use_atr': False, 'bull_use_adx': True, 'bull_use_spike': False, 'bull_rsi_required': True, 'bear_strategy': 'mean_reversion', 'bear_bb_std_mult': 1.401240489868767, 'bear_rsi_os': 51, 'bear_rsi_ob': 50, 'bear_adx_thresh': 9.179739280929626, 'bear_atr_min_pct': 0.022245132203130853, 'bear_atr_max_pct': 0.04396469811548799, 'bear_tp_mult': 1.517269150077562, 'bear_tsl_mult': 0.7740035869822987, 'bear_time_stop': 292, 'bear_use_sma': True, 'bear_use_ema': False, 'bear_use_atr': False, 'bear_use_adx': False, 'bear_use_spike': True, 'bear_rsi_required': True, 'sideways_strategy': 'breakout', 'sideways_bb_std_mult': 1.0327157762395898, 'sideways_rsi_os': 24, 'sideways_rsi_ob': 80, 'sideways_adx_thresh': 31.51627927090777, 'sideways_atr_min_pct': 0.011502955409423789, 'sideways_atr_max_pct': 0.048278458215876806, 'sideways_tp_mult': 2.2484002167679473, 'sideways_tsl_mult': 0.5776655698107223, 'sideways_time_stop': 260, 'sideways_use_sma': False, 'sideways_use_ema': False, 'sideways_use_atr': True, 'sideways_use_adx': True, 'sideways_use_spike': False, 'sideways_rsi_required': True}.
[I 2025-09-01 14:55:47,850] Trial 386 finished with values: [-1000000000.0, 1000000000.0] and parameters: {'p_sma': 30, 'p_std': 27, 'p_atr': 12, 'p_adx': 14, 'rsi_period': 12, 'ema1': 16, 'ema2': 56, 'slip_atr_k': 0.0048098766707346625, 'slip_spread_k': 0.30127596433056186, 'spread_hl_frac': 0.006149270225784799, 'bb_std_mult': 2.2316093004516375, 'rsi_os': 32, 'rsi_ob': 79, 'vol_spike': 0.07694780799073175, 'adx_thresh': 28.283192921119834, 'atr_min_pct': 0.015757199893943096, 'atr_max_pct': 0.021502858762221196, 'tp_mult': 2.0510242363543387, 'tsl_mult': 0.3935394676110879, 'strategy': 'breakout', 'time_stop': 21, 'use_sma': False, 'use_atr': True, 'use_adx': False, 'use_ema': True, 'use_spike': False, 'rsi_required': True, 'edge_k': 1.5346371977759452, 'edge_cap': 0.19029896595024626, 'bull_strategy': 'mean_reversion', 'bull_bb_std_mult': 1.1272270544033045, 'bull_rsi_os': 28, 'bull_rsi_ob': 64, 'bull_adx_thresh': 5.617655928269706, 'bull_atr_min_pct': 0.014384256367659571, 'bull_atr_max_pct': 0.03812107848228636, 'bull_tp_mult': 1.3141330909056477, 'bull_tsl_mult': 0.12897797883953085, 'bull_time_stop': 124, 'bull_use_sma': False, 'bull_use_ema': True, 'bull_use_atr': False, 'bull_use_adx': False, 'bull_use_spike': False, 'bull_rsi_required': True, 'bear_strategy': 'breakout', 'bear_bb_std_mult': 3.022663458743846, 'bear_rsi_os': 16, 'bear_rsi_ob': 55, 'bear_adx_thresh': 10.377120907046248, 'bear_atr_min_pct': 0.02816489491210733, 'bear_atr_max_pct': 0.04841564135719647, 'bear_tp_mult': 2.297548708410835, 'bear_tsl_mult': 0.7672349091789321, 'bear_time_stop': 255, 'bear_use_sma': True, 'bear_use_ema': False, 'bear_use_atr': False, 'bear_use_adx': False, 'bear_use_spike': True, 'bear_rsi_required': True, 'sideways_strategy': 'mean_reversion', 'sideways_bb_std_mult': 1.0206868418641486, 'sideways_rsi_os': 23, 'sideways_rsi_ob': 82, 'sideways_adx_thresh': 24.108293825938897, 'sideways_atr_min_pct': 0.013387615916970942, 'sideways_atr_max_pct': 0.047920538615839635, 'sideways_tp_mult': 2.1776834964948537, 'sideways_tsl_mult': 0.7326392502519572, 'sideways_time_stop': 70, 'sideways_use_sma': True, 'sideways_use_ema': False, 'sideways_use_atr': True, 'sideways_use_adx': False, 'sideways_use_spike': False, 'sideways_rsi_required': True}.
[I 2025-09-01 14:55:48,977] Trial 387 finished with values: [-0.07956606801727761, 0.07914783998845655] and parameters: {'p_sma': 31, 'p_std': 27, 'p_atr': 18, 'p_adx': 14, 'rsi_period': 72, 'ema1': 26, 'ema2': 56, 'slip_atr_k': 0.006381671967534522, 'slip_spread_k': 0.4057571514992572, 'spread_hl_frac': 0.007048001357164643, 'bb_std_mult': 2.2336443529442063, 'rsi_os': 33, 'rsi_ob': 79, 'vol_spike': 0.09410673943614531, 'adx_thresh': 27.85379586311501, 'atr_min_pct': 0.015708915733769615, 'atr_max_pct': 0.06787048827714624, 'tp_mult': 2.0275044846234715, 'tsl_mult': 0.4607046558511123, 'strategy': 'breakout', 'time_stop': 26, 'use_sma': False, 'use_atr': True, 'use_adx': False, 'use_ema': True, 'use_spike': False, 'rsi_required': True, 'edge_k': 1.3683121741318744, 'edge_cap': 0.8810152947763532, 'bull_strategy': 'mean_reversion', 'bull_bb_std_mult': 0.9927340805286327, 'bull_rsi_os': 24, 'bull_rsi_ob': 65, 'bull_adx_thresh': 5.831470909837873, 'bull_atr_min_pct': 0.014420675120405685, 'bull_atr_max_pct': 0.038550676716553496, 'bull_tp_mult': 1.4013505171852738, 'bull_tsl_mult': 0.030705297678615323, 'bull_time_stop': 151, 'bull_use_sma': False, 'bull_use_ema': True, 'bull_use_atr': False, 'bull_use_adx': False, 'bull_use_spike': False, 'bull_rsi_required': True, 'bear_strategy': 'breakout', 'bear_bb_std_mult': 1.5297173011256746, 'bear_rsi_os': 48, 'bear_rsi_ob': 52, 'bear_adx_thresh': 8.303960074170904, 'bear_atr_min_pct': 0.0022741753571829722, 'bear_atr_max_pct': 0.039186539932105864, 'bear_tp_mult': 1.624300630800452, 'bear_tsl_mult': 0.804019291929294, 'bear_time_stop': 16, 'bear_use_sma': True, 'bear_use_ema': False, 'bear_use_atr': False, 'bear_use_adx': True, 'bear_use_spike': True, 'bear_rsi_required': True, 'sideways_strategy': 'mean_reversion', 'sideways_bb_std_mult': 1.0100687960150854, 'sideways_rsi_os': 23, 'sideways_rsi_ob': 76, 'sideways_adx_thresh': 32.9787630650202, 'sideways_atr_min_pct': 0.01341401833911761, 'sideways_atr_max_pct': 0.0512332990784096, 'sideways_tp_mult': 2.360459582246306, 'sideways_tsl_mult': 0.5564218200614776, 'sideways_time_stop': 70, 'sideways_use_sma': True, 'sideways_use_ema': False, 'sideways_use_atr': True, 'sideways_use_adx': False, 'sideways_use_spike': False, 'sideways_rsi_required': True}.
[I 2025-09-01 14:55:49,004] Trial 384 finished with values: [-1000000000.0, 1000000000.0] and parameters: {'p_sma': 30, 'p_std': 25, 'p_atr': 11, 'p_adx': 14, 'rsi_period': 72, 'ema1': 26, 'ema2': 55, 'slip_atr_k': 0.013265602770782866, 'slip_spread_k': 0.3178344136328184, 'spread_hl_frac': 0.006242292510938966, 'bb_std_mult': 2.102917566167996, 'rsi_os': 34, 'rsi_ob': 79, 'vol_spike': 0.09199791437041094, 'adx_thresh': 28.21312867680636, 'atr_min_pct': 0.017500362598256308, 'atr_max_pct': 0.06602145196263517, 'tp_mult': 2.0519945830441886, 'tsl_mult': 0.3915735906517071, 'strategy': 'breakout', 'time_stop': 60, 'use_sma': False, 'use_atr': True, 'use_adx': False, 'use_ema': True, 'use_spike': True, 'rsi_required': True, 'edge_k': 1.5520178626754508, 'edge_cap': 0.3915339938030704, 'bull_strategy': 'mean_reversion', 'bull_bb_std_mult': 0.9430817563123861, 'bull_rsi_os': 27, 'bull_rsi_ob': 70, 'bull_adx_thresh': 7.186457540156676, 'bull_atr_min_pct': 0.01733253743557482, 'bull_atr_max_pct': 0.10863810735259032, 'bull_tp_mult': 1.432597292827854, 'bull_tsl_mult': 0.1243024016427047, 'bull_time_stop': 153, 'bull_use_sma': False, 'bull_use_ema': True, 'bull_use_atr': False, 'bull_use_adx': True, 'bull_use_spike': False, 'bull_rsi_required': True, 'bear_strategy': 'mean_reversion', 'bear_bb_std_mult': 1.5303339995765635, 'bear_rsi_os': 51, 'bear_rsi_ob': 52, 'bear_adx_thresh': 8.839657977393083, 'bear_atr_min_pct': 0.0028910499639295748, 'bear_atr_max_pct': 0.04289552435896262, 'bear_tp_mult': 1.615638995909355, 'bear_tsl_mult': 0.779479744145863, 'bear_time_stop': 267, 'bear_use_sma': True, 'bear_use_ema': False, 'bear_use_atr': False, 'bear_use_adx': False, 'bear_use_spike': True, 'bear_rsi_required': True, 'sideways_strategy': 'mean_reversion', 'sideways_bb_std_mult': 1.001059695508014, 'sideways_rsi_os': 23, 'sideways_rsi_ob': 55, 'sideways_adx_thresh': 27.909596009167167, 'sideways_atr_min_pct': 0.012818182296554655, 'sideways_atr_max_pct': 0.049367891998002934, 'sideways_tp_mult': 2.3217651055909974, 'sideways_tsl_mult': 0.6862921314521305, 'sideways_time_stop': 69, 'sideways_use_sma': False, 'sideways_use_ema': False, 'sideways_use_atr': True, 'sideways_use_adx': True, 'sideways_use_spike': False, 'sideways_rsi_required': True}.
