[I 2025-09-01 14:00:35,591] Trial 35 finished with values: [-1000000000.0, 1000000000.0] and parameters: {'p_sma': 40, 'p_std': 10, 'p_atr': 24, 'p_adx': 11, 'rsi_period': 43, 'ema1': 20, 'ema2': 44, 'slip_atr_k': 0.05492592682383887, 'slip_spread_k': 0.31090172969666025, 'spread_hl_frac': 0.044074782735754145, 'bb_std_mult': 2.5827649826011196, 'rsi_os': 43, 'rsi_ob': 71, 'vol_spike': 0.2618555120506464, 'adx_thresh': 18.159629966609867, 'atr_min_pct': 0.011495202168288223, 'atr_max_pct': 0.12757413707637283, 'tp_mult': 2.7940116141842664, 'tsl_mult': 0.3791765017860102, 'strategy': 'breakout', 'time_stop': 75, 'use_sma': False, 'use_atr': False, 'use_adx': True, 'use_ema': False, 'use_spike': False, 'rsi_required': True, 'edge_k': 0.9665907051928195, 'edge_cap': 0.39088725383269163, 'bull_strategy': 'breakout', 'bull_bb_std_mult': 1.5053467682996589, 'bull_rsi_os': 27, 'bull_rsi_ob': 74, 'bull_adx_thresh': 7.61008371035455, 'bull_atr_min_pct': 0.00819721476820489, 'bull_atr_max_pct': 0.023708228709273423, 'bull_tp_mult': 2.4194713231988683, 'bull_tsl_mult': 0.23161335928161506, 'bull_time_stop': 144, 'bull_use_sma': True, 'bull_use_ema': True, 'bull_use_atr': False, 'bull_use_adx': False, 'bull_use_spike': True, 'bull_rsi_required': True, 'bear_strategy': 'breakout', 'bear_bb_std_mult': 2.7933958442880096, 'bear_rsi_os': 37, 'bear_rsi_ob': 76, 'bear_adx_thresh': 9.274040956487795, 'bear_atr_min_pct': 0.008478861580390167, 'bear_atr_max_pct': 0.06708295272234908, 'bear_tp_mult': 1.9286853541859077, 'bear_tsl_mult': 0.40015067440143465, 'bear_time_stop': 277, 'bear_use_sma': False, 'bear_use_ema': True, 'bear_use_atr': False, 'bear_use_adx': False, 'bear_use_spike': True, 'bear_rsi_required': True, 'sideways_strategy': 'mean_reversion', 'sideways_bb_std_mult': 1.3071800959757662, 'sideways_rsi_os': 20, 'sideways_rsi_ob': 84, 'sideways_adx_thresh': 24.416637317451723, 'sideways_atr_min_pct': 0.022312138333014323, 'sideways_atr_max_pct': 0.0405346883628827, 'sideways_tp_mult': 2.428053523399634, 'sideways_tsl_mult': 0.7474668452858528, 'sideways_time_stop': 175, 'sideways_use_sma': True, 'sideways_use_ema': False, 'sideways_use_atr': True, 'sideways_use_adx': True, 'sideways_use_spike': True, 'sideways_rsi_required': True}.
[I 2025-09-01 14:00:35,943] Trial 34 finished with values: [-0.023909474219132254, 0.03162367369039287] and parameters: {'p_sma': 39, 'p_std': 13, 'p_atr': 24, 'p_adx': 12, 'rsi_period': 68, 'ema1': 20, 'ema2': 37, 'slip_atr_k': 0.028091047581347714, 'slip_spread_k': 0.5942585887766598, 'spread_hl_frac': 0.0436549610261728, 'bb_std_mult': 2.620463742296951, 'rsi_os': 43, 'rsi_ob': 70, 'vol_spike': 0.05463092560277243, 'adx_thresh': 34.85921226525195, 'atr_min_pct': 0.011695751064696634, 'atr_max_pct': 0.03413600900835477, 'tp_mult': 2.312180300359949, 'tsl_mult': 0.33077506962555925, 'strategy': 'breakout', 'time_stop': 235, 'use_sma': False, 'use_atr': False, 'use_adx': False, 'use_ema': False, 'use_spike': False, 'rsi_required': True, 'edge_k': 0.9208957949615499, 'edge_cap': 0.454294418272033, 'bull_strategy': 'breakout', 'bull_bb_std_mult': 1.482143841716376, 'bull_rsi_os': 36, 'bull_rsi_ob': 66, 'bull_adx_thresh': 10.159461348582747, 'bull_atr_min_pct': 0.007938487800367142, 'bull_atr_max_pct': 0.041315547241099725, 'bull_tp_mult': 2.43046002932264, 'bull_tsl_mult': 0.4423017783566761, 'bull_time_stop': 139, 'bull_use_sma': False, 'bull_use_ema': True, 'bull_use_atr': False, 'bull_use_adx': True, 'bull_use_spike': False, 'bull_rsi_required': True, 'bear_strategy': 'breakout', 'bear_bb_std_mult': 2.780799260167976, 'bear_rsi_os': 37, 'bear_rsi_ob': 54, 'bear_adx_thresh': 15.362893940716038, 'bear_atr_min_pct': 0.0029911835011162454, 'bear_atr_max_pct': 0.032513285912276334, 'bear_tp_mult': 1.971059744737221, 'bear_tsl_mult': 0.12911584309017013, 'bear_time_stop': 231, 'bear_use_sma': False, 'bear_use_ema': True, 'bear_use_atr': False, 'bear_use_adx': False, 'bear_use_spike': True, 'bear_rsi_required': True, 'sideways_strategy': 'breakout', 'sideways_bb_std_mult': 2.770363280280079, 'sideways_rsi_os': 20, 'sideways_rsi_ob': 84, 'sideways_adx_thresh': 24.578325368254127, 'sideways_atr_min_pct': 0.023117949738305263, 'sideways_atr_max_pct': 0.04418872941355079, 'sideways_tp_mult': 2.4158789397547635, 'sideways_tsl_mult': 0.7230415656787258, 'sideways_time_stop': 150, 'sideways_use_sma': False, 'sideways_use_ema': True, 'sideways_use_atr': False, 'sideways_use_adx': True, 'sideways_use_spike': True, 'sideways_rsi_required': False}.
[I 2025-09-01 14:01:11,804] Trial 38 finished with values: [-0.17854085779404927, 0.17839935412814908] and parameters: {'p_sma': 43, 'p_std': 29, 'p_atr': 19, 'p_adx': 16, 'rsi_period': 68, 'ema1': 22, 'ema2': 37, 'slip_atr_k': 0.17824155834109218, 'slip_spread_k': 0.8018208932459092, 'spread_hl_frac': 0.04432918384806095, 'bb_std_mult': 0.968270631036223, 'rsi_os': 43, 'rsi_ob': 71, 'vol_spike': 0.275656031819879, 'adx_thresh': 18.599606752257774, 'atr_min_pct': 0.008884356900535632, 'atr_max_pct': 0.12913344086976378, 'tp_mult': 2.8053442651015423, 'tsl_mult': 0.11346332042652973, 'strategy': 'mean_reversion', 'time_stop': 5, 'use_sma': True, 'use_atr': False, 'use_adx': True, 'use_ema': False, 'use_spike': True, 'rsi_required': False, 'edge_k': 0.6986314799650132, 'edge_cap': 0.3784341813932217, 'bull_strategy': 'breakout', 'bull_bb_std_mult': 1.3738117793673361, 'bull_rsi_os': 35, 'bull_rsi_ob': 66, 'bull_adx_thresh': 7.276051542583604, 'bull_atr_min_pct': 0.0198466271010362, 'bull_atr_max_pct': 0.02629308261220749, 'bull_tp_mult': 1.6970228008608623, 'bull_tsl_mult': 0.22852869028696982, 'bull_time_stop': 235, 'bull_use_sma': True, 'bull_use_ema': True, 'bull_use_atr': True, 'bull_use_adx': False, 'bull_use_spike': True, 'bull_rsi_required': False, 'bear_strategy': 'mean_reversion', 'bear_bb_std_mult': 2.217318688306263, 'bear_rsi_os': 37, 'bear_rsi_ob': 55, 'bear_adx_thresh': 18.997527474606258, 'bear_atr_min_pct': 0.008644120689849828, 'bear_atr_max_pct': 0.010668502338225139, 'bear_tp_mult': 1.9063096772244654, 'bear_tsl_mult': 0.38496235468266615, 'bear_time_stop': 300, 'bear_use_sma': False, 'bear_use_ema': False, 'bear_use_atr': True, 'bear_use_adx': True, 'bear_use_spike': False, 'bear_rsi_required': False, 'sideways_strategy': 'mean_reversion', 'sideways_bb_std_mult': 2.219699149625837, 'sideways_rsi_os': 26, 'sideways_rsi_ob': 52, 'sideways_adx_thresh': 19.865524757172214, 'sideways_atr_min_pct': 0.001423249259863365, 'sideways_atr_max_pct': 0.020613588752083137, 'sideways_tp_mult': 1.542273768847552, 'sideways_tsl_mult': 0.38221062073504103, 'sideways_time_stop': 155, 'sideways_use_sma': True, 'sideways_use_ema': False, 'sideways_use_atr': True, 'sideways_use_adx': True, 'sideways_use_spike': False, 'sideways_rsi_required': True}.
[I 2025-09-01 14:01:12,350] Trial 39 finished with values: [-1000000000.0, 1000000000.0] and parameters: {'p_sma': 43, 'p_std': 29, 'p_atr': 18, 'p_adx': 16, 'rsi_period': 8, 'ema1': 9, 'ema2': 38, 'slip_atr_k': 0.19151884682642434, 'slip_spread_k': 0.7665874572909849, 'spread_hl_frac': 0.015210384538071827, 'bb_std_mult': 0.9840049529431298, 'rsi_os': 42, 'rsi_ob': 73, 'vol_spike': 0.16976786283022666, 'adx_thresh': 17.9593495005074, 'atr_min_pct': 0.009443514995561654, 'atr_max_pct': 0.09940989614551796, 'tp_mult': 2.520508425607547, 'tsl_mult': 0.34495534339307476, 'strategy': 'breakout', 'time_stop': 210, 'use_sma': False, 'use_atr': False, 'use_adx': True, 'use_ema': False, 'use_spike': False, 'rsi_required': False, 'edge_k': 0.9847712010402465, 'edge_cap': 0.6711863787624358, 'bull_strategy': 'breakout', 'bull_bb_std_mult': 1.9907796496195447, 'bull_rsi_os': 45, 'bull_rsi_ob': 65, 'bull_adx_thresh': 7.622742208410701, 'bull_atr_min_pct': 0.020742526168497998, 'bull_atr_max_pct': 0.14984601377451184, 'bull_tp_mult': 1.6885858889019252, 'bull_tsl_mult': 0.4157002134604225, 'bull_time_stop': 281, 'bull_use_sma': False, 'bull_use_ema': True, 'bull_use_atr': False, 'bull_use_adx': False, 'bull_use_spike': True, 'bull_rsi_required': True, 'bear_strategy': 'breakout', 'bear_bb_std_mult': 2.341224923484848, 'bear_rsi_os': 28, 'bear_rsi_ob': 83, 'bear_adx_thresh': 15.23715499886865, 'bear_atr_min_pct': 0.00813093605520088, 'bear_atr_max_pct': 0.09216260205515167, 'bear_tp_mult': 2.5106555381916458, 'bear_tsl_mult': 0.10425798399541258, 'bear_time_stop': 236, 'bear_use_sma': True, 'bear_use_ema': False, 'bear_use_atr': True, 'bear_use_adx': True, 'bear_use_spike': True, 'bear_rsi_required': False, 'sideways_strategy': 'mean_reversion', 'sideways_bb_std_mult': 0.8340307393390518, 'sideways_rsi_os': 25, 'sideways_rsi_ob': 53, 'sideways_adx_thresh': 32.87580149456745, 'sideways_atr_min_pct': 0.026923543240671845, 'sideways_atr_max_pct': 0.02103276812036562, 'sideways_tp_mult': 1.5438213551967936, 'sideways_tsl_mult': 0.3205712532577927, 'sideways_time_stop': 151, 'sideways_use_sma': True, 'sideways_use_ema': False, 'sideways_use_atr': True, 'sideways_use_adx': True, 'sideways_use_spike': True, 'sideways_rsi_required': True}.
[I 2025-09-01 14:01:12,639] Trial 40 finished with values: [-1000000000.0, 1000000000.0] and parameters: {'p_sma': 21, 'p_std': 28, 'p_atr': 18, 'p_adx': 16, 'rsi_period': 26, 'ema1': 17, 'ema2': 38, 'slip_atr_k': 0.19462010882027816, 'slip_spread_k': 0.7987678232998545, 'spread_hl_frac': 0.016183336284780248, 'bb_std_mult': 0.6607728362671654, 'rsi_os': 36, 'rsi_ob': 56, 'vol_spike': 0.18549101335495, 'adx_thresh': 23.471031458413737, 'atr_min_pct': 0.009264904959751834, 'atr_max_pct': 0.0585167728683606, 'tp_mult': 2.570323779602819, 'tsl_mult': 0.315540410399222, 'strategy': 'mean_reversion', 'time_stop': 6, 'use_sma': True, 'use_atr': False, 'use_adx': True, 'use_ema': False, 'use_spike': True, 'rsi_required': False, 'edge_k': 1.7860349149677126, 'edge_cap': 0.20046412281200604, 'bull_strategy': 'breakout', 'bull_bb_std_mult': 3.575435723065842, 'bull_rsi_os': 17, 'bull_rsi_ob': 65, 'bull_adx_thresh': 22.338479785935863, 'bull_atr_min_pct': 0.020269412731959945, 'bull_atr_max_pct': 0.06963571954183428, 'bull_tp_mult': 1.673015167030977, 'bull_tsl_mult': 0.42492446547323914, 'bull_time_stop': 265, 'bull_use_sma': False, 'bull_use_ema': True, 'bull_use_atr': True, 'bull_use_adx': False, 'bull_use_spike': True, 'bull_rsi_required': True, 'bear_strategy': 'mean_reversion', 'bear_bb_std_mult': 2.221947790015738, 'bear_rsi_os': 29, 'bear_rsi_ob': 55, 'bear_adx_thresh': 19.110359600342562, 'bear_atr_min_pct': 0.012629191756471694, 'bear_atr_max_pct': 0.04414707205317576, 'bear_tp_mult': 2.5504053407625777, 'bear_tsl_mult': 0.5654432377317924, 'bear_time_stop': 185, 'bear_use_sma': True, 'bear_use_ema': False, 'bear_use_atr': True, 'bear_use_adx': True, 'bear_use_spike': True, 'bear_rsi_required': False, 'sideways_strategy': 'mean_reversion', 'sideways_bb_std_mult': 0.7897151262368507, 'sideways_rsi_os': 24, 'sideways_rsi_ob': 92, 'sideways_adx_thresh': 18.92526391544502, 'sideways_atr_min_pct': 0.0032384874974276823, 'sideways_atr_max_pct': 0.024595164844117716, 'sideways_tp_mult': 1.4759721341424072, 'sideways_tsl_mult': 0.32397554045792754, 'sideways_time_stop': 243, 'sideways_use_sma': False, 'sideways_use_ema': True, 'sideways_use_atr': False, 'sideways_use_adx': True, 'sideways_use_spike': False, 'sideways_rsi_required': False}.
[I 2025-09-01 14:01:12,810] Trial 41 finished with values: [-1000000000.0, 1000000000.0] and parameters: {'p_sma': 47, 'p_std': 18, 'p_atr': 18, 'p_adx': 16, 'rsi_period': 80, 'ema1': 17, 'ema2': 16, 'slip_atr_k': 0.1994744338503162, 'slip_spread_k': 0.7679387379902973, 'spread_hl_frac': 0.014475201994488677, 'bb_std_mult': 0.7340543105433044, 'rsi_os': 35, 'rsi_ob': 59, 'vol_spike': 0.0172828605063664, 'adx_thresh': 11.721061247473875, 'atr_min_pct': 0.009005141566834702, 'atr_max_pct': 0.09809481640530754, 'tp_mult': 2.5341034981039803, 'tsl_mult': 0.8654835083708657, 'strategy': 'breakout', 'time_stop': 36, 'use_sma': False, 'use_atr': False, 'use_adx': True, 'use_ema': False, 'use_spike': True, 'rsi_required': False, 'edge_k': 1.7152737862167386, 'edge_cap': 0.1239419675574211, 'bull_strategy': 'breakout', 'bull_bb_std_mult': 2.0130548658631278, 'bull_rsi_os': 9, 'bull_rsi_ob': 65, 'bull_adx_thresh': 24.426790928357775, 'bull_atr_min_pct': 0.007131282138255255, 'bull_atr_max_pct': 0.04545489735220342, 'bull_tp_mult': 1.683855925770208, 'bull_tsl_mult': 0.4341555708963282, 'bull_time_stop': 180, 'bull_use_sma': False, 'bull_use_ema': True, 'bull_use_atr': False, 'bull_use_adx': True, 'bull_use_spike': False, 'bull_rsi_required': True, 'bear_strategy': 'mean_reversion', 'bear_bb_std_mult': 2.272805998337923, 'bear_rsi_os': 36, 'bear_rsi_ob': 53, 'bear_adx_thresh': 15.127845842333398, 'bear_atr_min_pct': 0.013023007471260156, 'bear_atr_max_pct': 0.09394544487955783, 'bear_tp_mult': 2.5410815258141275, 'bear_tsl_mult': 0.2764517995384043, 'bear_time_stop': 236, 'bear_use_sma': True, 'bear_use_ema': False, 'bear_use_atr': True, 'bear_use_adx': True, 'bear_use_spike': True, 'bear_rsi_required': False, 'sideways_strategy': 'mean_reversion', 'sideways_bb_std_mult': 2.2041755484138554, 'sideways_rsi_os': 25, 'sideways_rsi_ob': 55, 'sideways_adx_thresh': 19.124003571850213, 'sideways_atr_min_pct': 0.027043100655813904, 'sideways_atr_max_pct': 0.021357136428338128, 'sideways_tp_mult': 1.5903892436509837, 'sideways_tsl_mult': 0.9980687042371772, 'sideways_time_stop': 156, 'sideways_use_sma': False, 'sideways_use_ema': True, 'sideways_use_atr': False, 'sideways_use_adx': True, 'sideways_use_spike': False, 'sideways_rsi_required': False}.
[I 2025-09-01 14:01:50,683] Trial 42 finished with values: [-1000000000.0, 1000000000.0] and parameters: {'p_sma': 46, 'p_std': 28, 'p_atr': 19, 'p_adx': 16, 'rsi_period': 70, 'ema1': 17, 'ema2': 14, 'slip_atr_k': 0.20222901672750926, 'slip_spread_k': 0.8061955751253511, 'spread_hl_frac': 0.028299111508727465, 'bb_std_mult': 0.8264988623673899, 'rsi_os': 41, 'rsi_ob': 60, 'vol_spike': 0.01838768840609759, 'adx_thresh': 11.949481305251894, 'atr_min_pct': 0.009895555917571762, 'atr_max_pct': 0.12950055496269552, 'tp_mult': 2.5758865465960055, 'tsl_mult': 0.406107636796894, 'strategy': 'breakout', 'time_stop': 33, 'use_sma': True, 'use_atr': False, 'use_adx': True, 'use_ema': False, 'use_spike': True, 'rsi_required': False, 'edge_k': 1.8443002013568832, 'edge_cap': 0.15497908747755296, 'bull_strategy': 'breakout', 'bull_bb_std_mult': 1.9358747289832225, 'bull_rsi_os': 9, 'bull_rsi_ob': 65, 'bull_adx_thresh': 24.43095920645554, 'bull_atr_min_pct': 0.007174964770268339, 'bull_atr_max_pct': 0.08723680858837132, 'bull_tp_mult': 2.9989728604596886, 'bull_tsl_mult': 0.393301151089275, 'bull_time_stop': 106, 'bull_use_sma': False, 'bull_use_ema': True, 'bull_use_atr': False, 'bull_use_adx': False, 'bull_use_spike': True, 'bull_rsi_required': False, 'bear_strategy': 'mean_reversion', 'bear_bb_std_mult': 2.2670664994492347, 'bear_rsi_os': 27, 'bear_rsi_ob': 54, 'bear_adx_thresh': 14.341118125751928, 'bear_atr_min_pct': 0.01238702529067844, 'bear_atr_max_pct': 0.09229827361811019, 'bear_tp_mult': 2.532217386660355, 'bear_tsl_mult': 0.2815472860967847, 'bear_time_stop': 193, 'bear_use_sma': True, 'bear_use_ema': False, 'bear_use_atr': True, 'bear_use_adx': True, 'bear_use_spike': True, 'bear_rsi_required': False, 'sideways_strategy': 'mean_reversion', 'sideways_bb_std_mult': 2.310518535878034, 'sideways_rsi_os': 25, 'sideways_rsi_ob': 54, 'sideways_adx_thresh': 20.187970966884205, 'sideways_atr_min_pct': 0.026577943892120846, 'sideways_atr_max_pct': 0.01896077847520778, 'sideways_tp_mult': 1.6728433854991547, 'sideways_tsl_mult': 0.8423981146410106, 'sideways_time_stop': 152, 'sideways_use_sma': False, 'sideways_use_ema': False, 'sideways_use_atr': False, 'sideways_use_adx': True, 'sideways_use_spike': False, 'sideways_rsi_required': False}.
[I 2025-09-01 14:01:50,922] Trial 43 finished with values: [-1000000000.0, 1000000000.0] and parameters: {'p_sma': 18, 'p_std': 19, 'p_atr': 20, 'p_adx': 19, 'rsi_period': 69, 'ema1': 17, 'ema2': 33, 'slip_atr_k': 0.13491606977754791, 'slip_spread_k': 0.8885937879024955, 'spread_hl_frac': 0.028015897603618077, 'bb_std_mult': 0.5099862814359384, 'rsi_os': 52, 'rsi_ob': 58, 'vol_spike': 0.019282876633446654, 'adx_thresh': 11.97817970839148, 'atr_min_pct': 0.005623699951073254, 'atr_max_pct': 0.11166848177001779, 'tp_mult': 2.313676120662852, 'tsl_mult': 0.1581480597772985, 'strategy': 'breakout', 'time_stop': 230, 'use_sma': True, 'use_atr': True, 'use_adx': False, 'use_ema': False, 'use_spike': True, 'rsi_required': False, 'edge_k': 0.00210732583259432, 'edge_cap': 0.144177315790254, 'bull_strategy': 'breakout', 'bull_bb_std_mult': 1.352038451734136, 'bull_rsi_os': 35, 'bull_rsi_ob': 89, 'bull_adx_thresh': 21.156797799005812, 'bull_atr_min_pct': 0.0072913965408034995, 'bull_atr_max_pct': 0.06696421064001236, 'bull_tp_mult': 2.992759417131453, 'bull_tsl_mult': 0.38439521740489724, 'bull_time_stop': 179, 'bull_use_sma': True, 'bull_use_ema': True, 'bull_use_atr': False, 'bull_use_adx': True, 'bull_use_spike': False, 'bull_rsi_required': False, 'bear_strategy': 'mean_reversion', 'bear_bb_std_mult': 2.218716182869576, 'bear_rsi_os': 26, 'bear_rsi_ob': 54, 'bear_adx_thresh': 19.391805351402844, 'bear_atr_min_pct': 0.00359347405047204, 'bear_atr_max_pct': 0.04452901545893735, 'bear_tp_mult': 2.3634225343599278, 'bear_tsl_mult': 0.5769069110050761, 'bear_time_stop': 186, 'bear_use_sma': False, 'bear_use_ema': False, 'bear_use_atr': True, 'bear_use_adx': True, 'bear_use_spike': False, 'bear_rsi_required': False, 'sideways_strategy': 'mean_reversion', 'sideways_bb_std_mult': 2.106643183692062, 'sideways_rsi_os': 18, 'sideways_rsi_ob': 66, 'sideways_adx_thresh': 19.842074990626912, 'sideways_atr_min_pct': 0.0036172050295217983, 'sideways_atr_max_pct': 0.02259692237416166, 'sideways_tp_mult': 2.572428630993738, 'sideways_tsl_mult': 0.8494939753939081, 'sideways_time_stop': 242, 'sideways_use_sma': False, 'sideways_use_ema': True, 'sideways_use_atr': False, 'sideways_use_adx': False, 'sideways_use_spike': False, 'sideways_rsi_required': False}.
[I 2025-09-01 14:01:51,371] Trial 45 finished with values: [-1000000000.0, 1000000000.0] and parameters: {'p_sma': 16, 'p_std': 51, 'p_atr': 20, 'p_adx': 18, 'rsi_period': 69, 'ema1': 22, 'ema2': 60, 'slip_atr_k': 0.24892302452685353, 'slip_spread_k': 0.527641517873306, 'spread_hl_frac': 0.030296678302764314, 'bb_std_mult': 3.1337979184389186, 'rsi_os': 52, 'rsi_ob': 67, 'vol_spike': 0.04873647790702147, 'adx_thresh': 29.656802421852518, 'atr_min_pct': 0.0026668372660027563, 'atr_max_pct': 0.12934635665625083, 'tp_mult': 2.299295341569062, 'tsl_mult': 0.1445233746631922, 'strategy': 'breakout', 'time_stop': 166, 'use_sma': False, 'use_atr': True, 'use_adx': False, 'use_ema': False, 'use_spike': False, 'rsi_required': True, 'edge_k': 1.3049529307269145, 'edge_cap': 0.4016812620263579, 'bull_strategy': 'breakout', 'bull_bb_std_mult': 1.3879872467443908, 'bull_rsi_os': 35, 'bull_rsi_ob': 58, 'bull_adx_thresh': 19.992855712643138, 'bull_atr_min_pct': 0.02622054209350559, 'bull_atr_max_pct': 0.06220161256878946, 'bull_tp_mult': 1.3606809401473807, 'bull_tsl_mult': 0.1820804047118554, 'bull_time_stop': 222, 'bull_use_sma': True, 'bull_use_ema': False, 'bull_use_atr': False, 'bull_use_adx': True, 'bull_use_spike': False, 'bull_rsi_required': False, 'bear_strategy': 'breakout', 'bear_bb_std_mult': 1.886568440002163, 'bear_rsi_os': 41, 'bear_rsi_ob': 61, 'bear_adx_thresh': 7.426376066779632, 'bear_atr_min_pct': 0.00333326897811408, 'bear_atr_max_pct': 0.1084396810974921, 'bear_tp_mult': 1.6834647240016616, 'bear_tsl_mult': 0.7404858034946054, 'bear_time_stop': 61, 'bear_use_sma': False, 'bear_use_ema': True, 'bear_use_atr': False, 'bear_use_adx': False, 'bear_use_spike': False, 'bear_rsi_required': True, 'sideways_strategy': 'breakout', 'sideways_bb_std_mult': 1.7999586609861913, 'sideways_rsi_os': 6, 'sideways_rsi_ob': 64, 'sideways_adx_thresh': 28.805712078161758, 'sideways_atr_min_pct': 0.016531582997587186, 'sideways_atr_max_pct': 0.0489720934121575, 'sideways_tp_mult': 2.576748835856512, 'sideways_tsl_mult': 0.8571879071702505, 'sideways_time_stop': 208, 'sideways_use_sma': False, 'sideways_use_ema': True, 'sideways_use_atr': False, 'sideways_use_adx': False, 'sideways_use_spike': True, 'sideways_rsi_required': False}.
