[I 2025-09-01 14:20:58,565] Trial 162 finished with values: [-1000000000.0, 1000000000.0] and parameters: {'p_sma': 26, 'p_std': 13, 'p_atr': 18, 'p_adx': 11, 'rsi_period': 76, 'ema1': 27, 'ema2': 37, 'slip_atr_k': 0.08568667985950307, 'slip_spread_k': 0.6960925902537641, 'spread_hl_frac': 0.040295654783844136, 'bb_std_mult': 2.534990749127643, 'rsi_os': 9, 'rsi_ob': 85, 'vol_spike': 0.11589000987853207, 'adx_thresh': 29.915380109400353, 'atr_min_pct': 0.004269211508226987, 'atr_max_pct': 0.08968610528094961, 'tp_mult': 1.4826977893572455, 'tsl_mult': 0.5387588577942123, 'strategy': 'breakout', 'time_stop': 103, 'use_sma': False, 'use_atr': False, 'use_adx': False, 'use_ema': True, 'use_spike': False, 'rsi_required': True, 'edge_k': 0.6854931065257782, 'edge_cap': 0.909215968895861, 'bull_strategy': 'breakout', 'bull_bb_std_mult': 1.261895028899254, 'bull_rsi_os': 32, 'bull_rsi_ob': 70, 'bull_adx_thresh': 12.178325923208195, 'bull_atr_min_pct': 0.005109141755272888, 'bull_atr_max_pct': 0.03731141379809701, 'bull_tp_mult': 1.472354634927332, 'bull_tsl_mult': 0.8385758700481237, 'bull_time_stop': 135, 'bull_use_sma': False, 'bull_use_ema': True, 'bull_use_atr': False, 'bull_use_adx': True, 'bull_use_spike': False, 'bull_rsi_required': True, 'bear_strategy': 'breakout', 'bear_bb_std_mult': 1.2382865798288045, 'bear_rsi_os': 54, 'bear_rsi_ob': 87, 'bear_adx_thresh': 6.248608198892798, 'bear_atr_min_pct': 0.007995295210187499, 'bear_atr_max_pct': 0.11001803010429562, 'bear_tp_mult': 2.0122315340415486, 'bear_tsl_mult': 0.25441690987471405, 'bear_time_stop': 206, 'bear_use_sma': False, 'bear_use_ema': False, 'bear_use_atr': False, 'bear_use_adx': False, 'bear_use_spike': False, 'bear_rsi_required': True, 'sideways_strategy': 'mean_reversion', 'sideways_bb_std_mult': 1.2083369979730925, 'sideways_rsi_os': 27, 'sideways_rsi_ob': 80, 'sideways_adx_thresh': 33.75161030977194, 'sideways_atr_min_pct': 0.019430970981002632, 'sideways_atr_max_pct': 0.014888784323181567, 'sideways_tp_mult': 2.7971066879969597, 'sideways_tsl_mult': 0.46050331657965005, 'sideways_time_stop': 173, 'sideways_use_sma': True, 'sideways_use_ema': False, 'sideways_use_atr': False, 'sideways_use_adx': True, 'sideways_use_spike': True, 'sideways_rsi_required': False}.
[I 2025-09-01 14:20:59,436] Trial 161 finished with values: [-1000000000.0, 1000000000.0] and parameters: {'p_sma': 22, 'p_std': 15, 'p_atr': 10, 'p_adx': 18, 'rsi_period': 35, 'ema1': 20, 'ema2': 38, 'slip_atr_k': 0.030145993576953738, 'slip_spread_k': 0.2505809144917889, 'spread_hl_frac': 0.004075762517030473, 'bb_std_mult': 2.457211984294317, 'rsi_os': 10, 'rsi_ob': 86, 'vol_spike': 0.031824399232745895, 'adx_thresh': 6.686259237753074, 'atr_min_pct': 0.015531087421952595, 'atr_max_pct': 0.13870433327123688, 'tp_mult': 1.505638164803853, 'tsl_mult': 0.770394790550779, 'strategy': 'breakout', 'time_stop': 103, 'use_sma': False, 'use_atr': False, 'use_adx': False, 'use_ema': False, 'use_spike': False, 'rsi_required': True, 'edge_k': 1.2051727563054948, 'edge_cap': 0.9345764234889059, 'bull_strategy': 'breakout', 'bull_bb_std_mult': 1.298459036532098, 'bull_rsi_os': 34, 'bull_rsi_ob': 58, 'bull_adx_thresh': 31.98522603510741, 'bull_atr_min_pct': 0.0109446944446165, 'bull_atr_max_pct': 0.04061435213990085, 'bull_tp_mult': 1.11253037734441, 'bull_tsl_mult': 0.5866199283097563, 'bull_time_stop': 96, 'bull_use_sma': True, 'bull_use_ema': True, 'bull_use_atr': False, 'bull_use_adx': True, 'bull_use_spike': False, 'bull_rsi_required': True, 'bear_strategy': 'breakout', 'bear_bb_std_mult': 1.2508521163036033, 'bear_rsi_os': 54, 'bear_rsi_ob': 45, 'bear_adx_thresh': 24.477627717287376, 'bear_atr_min_pct': 0.023371381850383004, 'bear_atr_max_pct': 0.1498083600082566, 'bear_tp_mult': 1.732340681969699, 'bear_tsl_mult': 0.21538176519008417, 'bear_time_stop': 74, 'bear_use_sma': False, 'bear_use_ema': True, 'bear_use_atr': False, 'bear_use_adx': False, 'bear_use_spike': False, 'bear_rsi_required': True, 'sideways_strategy': 'mean_reversion', 'sideways_bb_std_mult': 1.1183497785620817, 'sideways_rsi_os': 40, 'sideways_rsi_ob': 77, 'sideways_adx_thresh': 33.984585802514545, 'sideways_atr_min_pct': 0.015564778067790039, 'sideways_atr_max_pct': 0.04080802277590262, 'sideways_tp_mult': 1.1999713703651949, 'sideways_tsl_mult': 0.23982168950006083, 'sideways_time_stop': 172, 'sideways_use_sma': True, 'sideways_use_ema': False, 'sideways_use_atr': True, 'sideways_use_adx': True, 'sideways_use_spike': True, 'sideways_rsi_required': True}.
[I 2025-09-01 14:20:59,703] Trial 163 finished with values: [-1000000000.0, 1000000000.0] and parameters: {'p_sma': 25, 'p_std': 15, 'p_atr': 19, 'p_adx': 11, 'rsi_period': 79, 'ema1': 19, 'ema2': 56, 'slip_atr_k': 0.030632548111352527, 'slip_spread_k': 0.4345227505094813, 'spread_hl_frac': 0.004235510175450264, 'bb_std_mult': 2.4321676679322817, 'rsi_os': 6, 'rsi_ob': 84, 'vol_spike': 0.04884529521090958, 'adx_thresh': 14.093230919987636, 'atr_min_pct': 0.012944711156345889, 'atr_max_pct': 0.06485972857063294, 'tp_mult': 2.4966708662141865, 'tsl_mult': 0.6579664651458106, 'strategy': 'breakout', 'time_stop': 105, 'use_sma': False, 'use_atr': False, 'use_adx': False, 'use_ema': True, 'use_spike': False, 'rsi_required': True, 'edge_k': 1.278016085811181, 'edge_cap': 0.24603261935052018, 'bull_strategy': 'breakout', 'bull_bb_std_mult': 0.6340797022294853, 'bull_rsi_os': 44, 'bull_rsi_ob': 58, 'bull_adx_thresh': 12.24550260183279, 'bull_atr_min_pct': 0.005165296683543408, 'bull_atr_max_pct': 0.061252455030660034, 'bull_tp_mult': 2.265554574213273, 'bull_tsl_mult': 0.8348623174877466, 'bull_time_stop': 139, 'bull_use_sma': False, 'bull_use_ema': True, 'bull_use_atr': False, 'bull_use_adx': True, 'bull_use_spike': True, 'bull_rsi_required': True, 'bear_strategy': 'breakout', 'bear_bb_std_mult': 1.8936363816559896, 'bear_rsi_os': 46, 'bear_rsi_ob': 45, 'bear_adx_thresh': 28.73762271429823, 'bear_atr_min_pct': 0.023201333941895066, 'bear_atr_max_pct': 0.01586021162351954, 'bear_tp_mult': 1.3911049200904702, 'bear_tsl_mult': 0.2689477911354806, 'bear_time_stop': 66, 'bear_use_sma': False, 'bear_use_ema': False, 'bear_use_atr': False, 'bear_use_adx': False, 'bear_use_spike': True, 'bear_rsi_required': True, 'sideways_strategy': 'mean_reversion', 'sideways_bb_std_mult': 1.2278108402310464, 'sideways_rsi_os': 31, 'sideways_rsi_ob': 76, 'sideways_adx_thresh': 33.863497263776814, 'sideways_atr_min_pct': 0.016470903084441286, 'sideways_atr_max_pct': 0.013463006879962481, 'sideways_tp_mult': 1.3128379273488424, 'sideways_tsl_mult': 0.9368939859855694, 'sideways_time_stop': 76, 'sideways_use_sma': True, 'sideways_use_ema': False, 'sideways_use_atr': False, 'sideways_use_adx': True, 'sideways_use_spike': True, 'sideways_rsi_required': False}.
[I 2025-09-01 14:21:35,388] Trial 165 finished with values: [-1000000000.0, 1000000000.0] and parameters: {'p_sma': 24, 'p_std': 8, 'p_atr': 10, 'p_adx': 10, 'rsi_period': 75, 'ema1': 27, 'ema2': 57, 'slip_atr_k': 0.17296392498954738, 'slip_spread_k': 0.4283898088912113, 'spread_hl_frac': 0.029321515398241214, 'bb_std_mult': 2.437512747567095, 'rsi_os': 37, 'rsi_ob': 82, 'vol_spike': 0.07027905448466407, 'adx_thresh': 27.199276626395854, 'atr_min_pct': 0.013177213702028862, 'atr_max_pct': 0.06499093961274408, 'tp_mult': 2.495666314401591, 'tsl_mult': 0.6624335068008506, 'strategy': 'breakout', 'time_stop': 75, 'use_sma': True, 'use_atr': False, 'use_adx': False, 'use_ema': False, 'use_spike': False, 'rsi_required': True, 'edge_k': 1.8791497294953827, 'edge_cap': 0.9667559516400467, 'bull_strategy': 'breakout', 'bull_bb_std_mult': 1.420823731268434, 'bull_rsi_os': 41, 'bull_rsi_ob': 58, 'bull_adx_thresh': 32.118093804755794, 'bull_atr_min_pct': 0.004037775415745926, 'bull_atr_max_pct': 0.09609973828806963, 'bull_tp_mult': 1.426589225509944, 'bull_tsl_mult': 0.19752209275806126, 'bull_time_stop': 110, 'bull_use_sma': False, 'bull_use_ema': True, 'bull_use_atr': False, 'bull_use_adx': True, 'bull_use_spike': True, 'bull_rsi_required': True, 'bear_strategy': 'breakout', 'bear_bb_std_mult': 1.424914248593953, 'bear_rsi_os': 55, 'bear_rsi_ob': 45, 'bear_adx_thresh': 24.64834521768796, 'bear_atr_min_pct': 0.025243149880791047, 'bear_atr_max_pct': 0.01567665920045641, 'bear_tp_mult': 2.170857495093509, 'bear_tsl_mult': 0.5922141282470959, 'bear_time_stop': 263, 'bear_use_sma': False, 'bear_use_ema': False, 'bear_use_atr': False, 'bear_use_adx': False, 'bear_use_spike': True, 'bear_rsi_required': True, 'sideways_strategy': 'mean_reversion', 'sideways_bb_std_mult': 1.1145443205342953, 'sideways_rsi_os': 55, 'sideways_rsi_ob': 79, 'sideways_adx_thresh': 34.410329455914614, 'sideways_atr_min_pct': 0.0163364576359859, 'sideways_atr_max_pct': 0.1023842607879172, 'sideways_tp_mult': 2.596929044817194, 'sideways_tsl_mult': 0.8535335276602906, 'sideways_time_stop': 35, 'sideways_use_sma': True, 'sideways_use_ema': False, 'sideways_use_atr': False, 'sideways_use_adx': True, 'sideways_use_spike': False, 'sideways_rsi_required': False}.
[I 2025-09-01 14:21:35,688] Trial 168 finished with values: [-1000000000.0, 1000000000.0] and parameters: {'p_sma': 33, 'p_std': 9, 'p_atr': 20, 'p_adx': 9, 'rsi_period': 72, 'ema1': 28, 'ema2': 12, 'slip_atr_k': 0.0006950444597736962, 'slip_spread_k': 0.509695803949044, 'spread_hl_frac': 0.039052376942228045, 'bb_std_mult': 3.0434380642710397, 'rsi_os': 26, 'rsi_ob': 81, 'vol_spike': 0.00017196039788026744, 'adx_thresh': 13.157540646546348, 'atr_min_pct': 0.008415096757225187, 'atr_max_pct': 0.07209016899227218, 'tp_mult': 2.82824770565857, 'tsl_mult': 0.5989796967256437, 'strategy': 'breakout', 'time_stop': 270, 'use_sma': True, 'use_atr': False, 'use_adx': True, 'use_ema': False, 'use_spike': True, 'rsi_required': False, 'edge_k': 0.5132679286014962, 'edge_cap': 0.5512150698777921, 'bull_strategy': 'mean_reversion', 'bull_bb_std_mult': 1.4931223071367001, 'bull_rsi_os': 10, 'bull_rsi_ob': 93, 'bull_adx_thresh': 34.23381957788603, 'bull_atr_min_pct': 0.02693003763608952, 'bull_atr_max_pct': 0.04159588350871433, 'bull_tp_mult': 1.6394715378229332, 'bull_tsl_mult': 0.20948999473836571, 'bull_time_stop': 112, 'bull_use_sma': False, 'bull_use_ema': False, 'bull_use_atr': False, 'bull_use_adx': False, 'bull_use_spike': False, 'bull_rsi_required': False, 'bear_strategy': 'mean_reversion', 'bear_bb_std_mult': 0.657168669839872, 'bear_rsi_os': 16, 'bear_rsi_ob': 48, 'bear_adx_thresh': 20.9497078784027, 'bear_atr_min_pct': 0.008661201586136048, 'bear_atr_max_pct': 0.02114907641525586, 'bear_tp_mult': 1.6051863218972238, 'bear_tsl_mult': 0.5852921904209987, 'bear_time_stop': 261, 'bear_use_sma': False, 'bear_use_ema': True, 'bear_use_atr': True, 'bear_use_adx': True, 'bear_use_spike': False, 'bear_rsi_required': False, 'sideways_strategy': 'breakout', 'sideways_bb_std_mult': 1.3903731663952639, 'sideways_rsi_os': 50, 'sideways_rsi_ob': 79, 'sideways_adx_thresh': 18.464962551489045, 'sideways_atr_min_pct': 0.006031800599930732, 'sideways_atr_max_pct': 0.14898534299881203, 'sideways_tp_mult': 2.593069293016723, 'sideways_tsl_mult': 0.8448084187325567, 'sideways_time_stop': 245, 'sideways_use_sma': False, 'sideways_use_ema': True, 'sideways_use_atr': False, 'sideways_use_adx': False, 'sideways_use_spike': False, 'sideways_rsi_required': False}.
[I 2025-09-01 14:21:36,309] Trial 166 finished with values: [-0.010328826991232387, 0.015988196772926996] and parameters: {'p_sma': 24, 'p_std': 9, 'p_atr': 16, 'p_adx': 9, 'rsi_period': 59, 'ema1': 27, 'ema2': 28, 'slip_atr_k': 0.031582068428704035, 'slip_spread_k': 0.4315664918948247, 'spread_hl_frac': 0.039061984073352304, 'bb_std_mult': 3.0343335590970986, 'rsi_os': 38, 'rsi_ob': 82, 'vol_spike': 0.02919479181724055, 'adx_thresh': 13.251777783643, 'atr_min_pct': 0.008504991191334623, 'atr_max_pct': 0.0658392186994304, 'tp_mult': 1.8552415742729294, 'tsl_mult': 0.5978967977709589, 'strategy': 'breakout', 'time_stop': 273, 'use_sma': True, 'use_atr': False, 'use_adx': False, 'use_ema': False, 'use_spike': False, 'rsi_required': True, 'edge_k': 0.8366989757775031, 'edge_cap': 0.6536670338529453, 'bull_strategy': 'breakout', 'bull_bb_std_mult': 0.6672317021879266, 'bull_rsi_os': 36, 'bull_rsi_ob': 58, 'bull_adx_thresh': 16.637235576997835, 'bull_atr_min_pct': 0.004029821138105318, 'bull_atr_max_pct': 0.1475929320509058, 'bull_tp_mult': 2.0161205542199494, 'bull_tsl_mult': 0.21569171681073518, 'bull_time_stop': 30, 'bull_use_sma': False, 'bull_use_ema': False, 'bull_use_atr': False, 'bull_use_adx': True, 'bull_use_spike': True, 'bull_rsi_required': True, 'bear_strategy': 'breakout', 'bear_bb_std_mult': 2.54187293866525, 'bear_rsi_os': 52, 'bear_rsi_ob': 45, 'bear_adx_thresh': 28.926642601333718, 'bear_atr_min_pct': 0.008504157890237493, 'bear_atr_max_pct': 0.015426573408093454, 'bear_tp_mult': 1.5993621226656014, 'bear_tsl_mult': 0.5868921198823074, 'bear_time_stop': 66, 'bear_use_sma': False, 'bear_use_ema': True, 'bear_use_atr': False, 'bear_use_adx': False, 'bear_use_spike': True, 'bear_rsi_required': True, 'sideways_strategy': 'mean_reversion', 'sideways_bb_std_mult': 0.5742708647840065, 'sideways_rsi_os': 36, 'sideways_rsi_ob': 72, 'sideways_adx_thresh': 18.29173000067821, 'sideways_atr_min_pct': 0.01628062988153489, 'sideways_atr_max_pct': 0.08996883578675205, 'sideways_tp_mult': 2.5775798726033035, 'sideways_tsl_mult': 0.21662436391682527, 'sideways_time_stop': 156, 'sideways_use_sma': True, 'sideways_use_ema': True, 'sideways_use_atr': True, 'sideways_use_adx': True, 'sideways_use_spike': False, 'sideways_rsi_required': True}.
[I 2025-09-01 14:21:36,323] Trial 167 finished with values: [-1000000000.0, 1000000000.0] and parameters: {'p_sma': 24, 'p_std': 9, 'p_atr': 7, 'p_adx': 12, 'rsi_period': 69, 'ema1': 28, 'ema2': 28, 'slip_atr_k': 0.03486900688824661, 'slip_spread_k': 0.4277270387625086, 'spread_hl_frac': 0.007375196402570734, 'bb_std_mult': 2.9287573065475887, 'rsi_os': 25, 'rsi_ob': 76, 'vol_spike': 0.0748430127361141, 'adx_thresh': 27.078136691217257, 'atr_min_pct': 0.008341443880599897, 'atr_max_pct': 0.06524340892961562, 'tp_mult': 2.485661029583663, 'tsl_mult': 0.3695427042641322, 'strategy': 'breakout', 'time_stop': 53, 'use_sma': True, 'use_atr': False, 'use_adx': True, 'use_ema': False, 'use_spike': True, 'rsi_required': False, 'edge_k': 0.5056056883596372, 'edge_cap': 0.5493335763521219, 'bull_strategy': 'mean_reversion', 'bull_bb_std_mult': 1.4472756248303293, 'bull_rsi_os': 24, 'bull_rsi_ob': 51, 'bull_adx_thresh': 11.138595660045935, 'bull_atr_min_pct': 0.004262354108956361, 'bull_atr_max_pct': 0.06114989819226367, 'bull_tp_mult': 1.6081716439197398, 'bull_tsl_mult': 0.9213748331317093, 'bull_time_stop': 262, 'bull_use_sma': False, 'bull_use_ema': False, 'bull_use_atr': False, 'bull_use_adx': False, 'bull_use_spike': True, 'bull_rsi_required': False, 'bear_strategy': 'breakout', 'bear_bb_std_mult': 3.483382595829757, 'bear_rsi_os': 6, 'bear_rsi_ob': 48, 'bear_adx_thresh': 30.660961313414614, 'bear_atr_min_pct': 0.005748363408302685, 'bear_atr_max_pct': 0.015609988973281924, 'bear_tp_mult': 1.6097361862248418, 'bear_tsl_mult': 0.6130337798146129, 'bear_time_stop': 262, 'bear_use_sma': False, 'bear_use_ema': True, 'bear_use_atr': True, 'bear_use_adx': True, 'bear_use_spike': True, 'bear_rsi_required': False, 'sideways_strategy': 'mean_reversion', 'sideways_bb_std_mult': 0.5830831578925284, 'sideways_rsi_os': 36, 'sideways_rsi_ob': 79, 'sideways_adx_thresh': 32.91673525987249, 'sideways_atr_min_pct': 0.01633607293142291, 'sideways_atr_max_pct': 0.1244059734661838, 'sideways_tp_mult': 2.5917210262340675, 'sideways_tsl_mult': 0.8504560455576746, 'sideways_time_stop': 157, 'sideways_use_sma': True, 'sideways_use_ema': True, 'sideways_use_atr': False, 'sideways_use_adx': True, 'sideways_use_spike': False, 'sideways_rsi_required': False}.
[I 2025-09-01 14:22:12,608] Trial 169 finished with values: [-1000000000.0, 1000000000.0] and parameters: {'p_sma': 33, 'p_std': 9, 'p_atr': 29, 'p_adx': 9, 'rsi_period': 72, 'ema1': 28, 'ema2': 46, 'slip_atr_k': 0.03503241546072059, 'slip_spread_k': 0.7917892287463921, 'spread_hl_frac': 0.015876128305207272, 'bb_std_mult': 2.3164384405153986, 'rsi_os': 25, 'rsi_ob': 76, 'vol_spike': 0.19494362725754796, 'adx_thresh': 28.112353301073714, 'atr_min_pct': 0.0087147330662198, 'atr_max_pct': 0.0726394843785585, 'tp_mult': 1.3536114253647504, 'tsl_mult': 0.5942077671590157, 'strategy': 'breakout', 'time_stop': 78, 'use_sma': True, 'use_atr': False, 'use_adx': True, 'use_ema': False, 'use_spike': True, 'rsi_required': False, 'edge_k': 0.5136035995261028, 'edge_cap': 0.9591551839479289, 'bull_strategy': 'mean_reversion', 'bull_bb_std_mult': 1.4939208166198694, 'bull_rsi_os': 11, 'bull_rsi_ob': 93, 'bull_adx_thresh': 34.27248700058115, 'bull_atr_min_pct': 0.009540038108358774, 'bull_atr_max_pct': 0.14735459955642805, 'bull_tp_mult': 1.6513805776738577, 'bull_tsl_mult': 0.9124668804540543, 'bull_time_stop': 295, 'bull_use_sma': False, 'bull_use_ema': False, 'bull_use_atr': False, 'bull_use_adx': False, 'bull_use_spike': False, 'bull_rsi_required': False, 'bear_strategy': 'mean_reversion', 'bear_bb_std_mult': 0.6454024402322662, 'bear_rsi_os': 16, 'bear_rsi_ob': 48, 'bear_adx_thresh': 5.524581042225915, 'bear_atr_min_pct': 0.005760511337960006, 'bear_atr_max_pct': 0.07927885907136013, 'bear_tp_mult': 1.5998738551695024, 'bear_tsl_mult': 0.618482763678138, 'bear_time_stop': 100, 'bear_use_sma': False, 'bear_use_ema': True, 'bear_use_atr': True, 'bear_use_adx': True, 'bear_use_spike': False, 'bear_rsi_required': False, 'sideways_strategy': 'breakout', 'sideways_bb_std_mult': 1.374993697629897, 'sideways_rsi_os': 29, 'sideways_rsi_ob': 74, 'sideways_adx_thresh': 20.808216856811292, 'sideways_atr_min_pct': 0.01207001462620812, 'sideways_atr_max_pct': 0.09075093405400754, 'sideways_tp_mult': 2.7430484616253903, 'sideways_tsl_mult': 0.8877948741839751, 'sideways_time_stop': 293, 'sideways_use_sma': False, 'sideways_use_ema': True, 'sideways_use_atr': False, 'sideways_use_adx': False, 'sideways_use_spike': False, 'sideways_rsi_required': False}.
[I 2025-09-01 14:22:13,488] Trial 172 finished with values: [-0.039076850891085035, 0.03999739893635732] and parameters: {'p_sma': 29, 'p_std': 28, 'p_atr': 15, 'p_adx': 17, 'rsi_period': 57, 'ema1': 30, 'ema2': 24, 'slip_atr_k': 0.10736751762825762, 'slip_spread_k': 0.8284670798546383, 'spread_hl_frac': 0.019191097975641794, 'bb_std_mult': 0.5131278673987194, 'rsi_os': 41, 'rsi_ob': 61, 'vol_spike': 0.010553725353337401, 'adx_thresh': 28.13694954144729, 'atr_min_pct': 0.00191840443805384, 'atr_max_pct': 0.050731875836181814, 'tp_mult': 1.8471163135392836, 'tsl_mult': 0.4181640293941631, 'strategy': 'breakout', 'time_stop': 79, 'use_sma': False, 'use_atr': False, 'use_adx': False, 'use_ema': False, 'use_spike': False, 'rsi_required': True, 'edge_k': 0.37057907395517087, 'edge_cap': 0.6589097270953149, 'bull_strategy': 'breakout', 'bull_bb_std_mult': 3.414918671359995, 'bull_rsi_os': 19, 'bull_rsi_ob': 56, 'bull_adx_thresh': 15.92726392315518, 'bull_atr_min_pct': 0.01254345932289612, 'bull_atr_max_pct': 0.026247519046128945, 'bull_tp_mult': 1.2184480439890077, 'bull_tsl_mult': 0.9538852855258554, 'bull_time_stop': 28, 'bull_use_sma': False, 'bull_use_ema': False, 'bull_use_atr': False, 'bull_use_adx': True, 'bull_use_spike': False, 'bull_rsi_required': True, 'bear_strategy': 'breakout', 'bear_bb_std_mult': 0.5109308304949729, 'bear_rsi_os': 52, 'bear_rsi_ob': 50, 'bear_adx_thresh': 7.6391029493249825, 'bear_atr_min_pct': 0.004289012735558142, 'bear_atr_max_pct': 0.03997272159897595, 'bear_tp_mult': 1.6790202967597914, 'bear_tsl_mult': 0.8996951913631477, 'bear_time_stop': 239, 'bear_use_sma': False, 'bear_use_ema': True, 'bear_use_atr': False, 'bear_use_adx': False, 'bear_use_spike': False, 'bear_rsi_required': True, 'sideways_strategy': 'breakout', 'sideways_bb_std_mult': 1.3091406135250232, 'sideways_rsi_os': 12, 'sideways_rsi_ob': 47, 'sideways_adx_thresh': 24.85215937924118, 'sideways_atr_min_pct': 0.017239012555862767, 'sideways_atr_max_pct': 0.09163045554329029, 'sideways_tp_mult': 1.9720900880818302, 'sideways_tsl_mult': 0.6805672453568563, 'sideways_time_stop': 111, 'sideways_use_sma': False, 'sideways_use_ema': True, 'sideways_use_atr': False, 'sideways_use_adx': True, 'sideways_use_spike': True, 'sideways_rsi_required': False}.
