[I 2025-09-01 14:13:29,195] Trial 117 finished with values: [-1000000000.0, 1000000000.0] and parameters: {'p_sma': 24, 'p_std': 16, 'p_atr': 21, 'p_adx': 23, 'rsi_period': 57, 'ema1': 26, 'ema2': 44, 'slip_atr_k': 0.04124496447749728, 'slip_spread_k': 0.9994741675976144, 'spread_hl_frac': 0.041870987040313765, 'bb_std_mult': 0.5860081747103014, 'rsi_os': 6, 'rsi_ob': 82, 'vol_spike': 0.0122275359482385, 'adx_thresh': 28.062048272304576, 'atr_min_pct': 0.019873860014713116, 'atr_max_pct': 0.04444574833798895, 'tp_mult': 2.380539808934587, 'tsl_mult': 0.9549523410945315, 'strategy': 'breakout', 'time_stop': 12, 'use_sma': False, 'use_atr': False, 'use_adx': False, 'use_ema': False, 'use_spike': False, 'rsi_required': True, 'edge_k': 0.7658983066012959, 'edge_cap': 0.7604830382645433, 'bull_strategy': 'breakout', 'bull_bb_std_mult': 1.5468750112877947, 'bull_rsi_os': 5, 'bull_rsi_ob': 50, 'bull_adx_thresh': 20.38038041843821, 'bull_atr_min_pct': 0.003489558576403218, 'bull_atr_max_pct': 0.03272137156390691, 'bull_tp_mult': 2.3686529911298058, 'bull_tsl_mult': 0.756535280498297, 'bull_time_stop': 228, 'bull_use_sma': True, 'bull_use_ema': True, 'bull_use_atr': False, 'bull_use_adx': False, 'bull_use_spike': False, 'bull_rsi_required': False, 'bear_strategy': 'mean_reversion', 'bear_bb_std_mult': 3.583256627570851, 'bear_rsi_os': 30, 'bear_rsi_ob': 76, 'bear_adx_thresh': 7.375306385927942, 'bear_atr_min_pct': 0.02138092999966675, 'bear_atr_max_pct': 0.05793560961985472, 'bear_tp_mult': 1.7178617596187211, 'bear_tsl_mult': 0.5811640565951948, 'bear_time_stop': 49, 'bear_use_sma': False, 'bear_use_ema': True, 'bear_use_atr': True, 'bear_use_adx': False, 'bear_use_spike': False, 'bear_rsi_required': True, 'sideways_strategy': 'mean_reversion', 'sideways_bb_std_mult': 1.073902826259388, 'sideways_rsi_os': 29, 'sideways_rsi_ob': 51, 'sideways_adx_thresh': 33.733313864292626, 'sideways_atr_min_pct': 0.025154155662794622, 'sideways_atr_max_pct': 0.13662252999267477, 'sideways_tp_mult': 2.6473828738707645, 'sideways_tsl_mult': 0.606359088648217, 'sideways_time_stop': 143, 'sideways_use_sma': True, 'sideways_use_ema': True, 'sideways_use_atr': True, 'sideways_use_adx': False, 'sideways_use_spike': True, 'sideways_rsi_required': True}.
[I 2025-09-01 14:14:13,493] Trial 120 finished with values: [-1000000000.0, 1000000000.0] and parameters: {'p_sma': 23, 'p_std': 46, 'p_atr': 16, 'p_adx': 22, 'rsi_period': 72, 'ema1': 26, 'ema2': 33, 'slip_atr_k': 0.10088711111222289, 'slip_spread_k': 0.9686347013832926, 'spread_hl_frac': 0.010319757073736823, 'bb_std_mult': 1.4554263350729326, 'rsi_os': 19, 'rsi_ob': 82, 'vol_spike': 0.10992740355136732, 'adx_thresh': 26.085798562796157, 'atr_min_pct': 0.007927644186742681, 'atr_max_pct': 0.010428052271772334, 'tp_mult': 2.457612466980483, 'tsl_mult': 0.476015731684914, 'strategy': 'breakout', 'time_stop': 48, 'use_sma': False, 'use_atr': False, 'use_adx': True, 'use_ema': False, 'use_spike': False, 'rsi_required': True, 'edge_k': 0.41659136792613266, 'edge_cap': 0.7482324006420606, 'bull_strategy': 'breakout', 'bull_bb_std_mult': 1.343222795914824, 'bull_rsi_os': 30, 'bull_rsi_ob': 56, 'bull_adx_thresh': 8.022905222483718, 'bull_atr_min_pct': 0.006433893671516509, 'bull_atr_max_pct': 0.057383249814326395, 'bull_tp_mult': 1.2516853273626696, 'bull_tsl_mult': 0.5489146097641638, 'bull_time_stop': 10, 'bull_use_sma': True, 'bull_use_ema': True, 'bull_use_atr': False, 'bull_use_adx': True, 'bull_use_spike': False, 'bull_rsi_required': False, 'bear_strategy': 'breakout', 'bear_bb_std_mult': 0.9320151106660854, 'bear_rsi_os': 30, 'bear_rsi_ob': 65, 'bear_adx_thresh': 7.281382167851538, 'bear_atr_min_pct': 0.021324115117533852, 'bear_atr_max_pct': 0.02376386872890665, 'bear_tp_mult': 2.1897609037677412, 'bear_tsl_mult': 0.5141215238942446, 'bear_time_stop': 46, 'bear_use_sma': False, 'bear_use_ema': True, 'bear_use_atr': True, 'bear_use_adx': False, 'bear_use_spike': False, 'bear_rsi_required': True, 'sideways_strategy': 'mean_reversion', 'sideways_bb_std_mult': 1.478959618604142, 'sideways_rsi_os': 49, 'sideways_rsi_ob': 70, 'sideways_adx_thresh': 33.526372566891304, 'sideways_atr_min_pct': 0.011934985468516532, 'sideways_atr_max_pct': 0.03314433755450241, 'sideways_tp_mult': 2.942460796404876, 'sideways_tsl_mult': 0.2637428386177023, 'sideways_time_stop': 143, 'sideways_use_sma': True, 'sideways_use_ema': True, 'sideways_use_atr': True, 'sideways_use_adx': True, 'sideways_use_spike': True, 'sideways_rsi_required': True}.
[I 2025-09-01 14:14:14,071] Trial 119 finished with values: [-1000000000.0, 1000000000.0] and parameters: {'p_sma': 23, 'p_std': 10, 'p_atr': 21, 'p_adx': 12, 'rsi_period': 55, 'ema1': 26, 'ema2': 22, 'slip_atr_k': 0.05369605679005164, 'slip_spread_k': 0.9705498135757205, 'spread_hl_frac': 0.01123434736285546, 'bb_std_mult': 0.6369077738004774, 'rsi_os': 11, 'rsi_ob': 60, 'vol_spike': 0.012980827199786708, 'adx_thresh': 28.189288208710074, 'atr_min_pct': 0.019733025343438557, 'atr_max_pct': 0.044859267187341074, 'tp_mult': 1.5874340497147772, 'tsl_mult': 0.46786538925838506, 'strategy': 'breakout', 'time_stop': 108, 'use_sma': False, 'use_atr': False, 'use_adx': False, 'use_ema': False, 'use_spike': False, 'rsi_required': True, 'edge_k': 0.023423105430336655, 'edge_cap': 0.8393423280790432, 'bull_strategy': 'breakout', 'bull_bb_std_mult': 1.9237636118854469, 'bull_rsi_os': 29, 'bull_rsi_ob': 95, 'bull_adx_thresh': 20.895556697584034, 'bull_atr_min_pct': 0.003458826085329209, 'bull_atr_max_pct': 0.03295531814142168, 'bull_tp_mult': 2.3739233836464253, 'bull_tsl_mult': 0.5577478561525363, 'bull_time_stop': 11, 'bull_use_sma': True, 'bull_use_ema': True, 'bull_use_atr': False, 'bull_use_adx': True, 'bull_use_spike': False, 'bull_rsi_required': False, 'bear_strategy': 'breakout', 'bear_bb_std_mult': 1.0009806295951948, 'bear_rsi_os': 54, 'bear_rsi_ob': 48, 'bear_adx_thresh': 29.953142988276706, 'bear_atr_min_pct': 0.013462325786974887, 'bear_atr_max_pct': 0.023233444037369006, 'bear_tp_mult': 1.3520750462241875, 'bear_tsl_mult': 0.5226816788491759, 'bear_time_stop': 15, 'bear_use_sma': False, 'bear_use_ema': True, 'bear_use_atr': True, 'bear_use_adx': False, 'bear_use_spike': False, 'bear_rsi_required': True, 'sideways_strategy': 'mean_reversion', 'sideways_bb_std_mult': 3.592696402523298, 'sideways_rsi_os': 48, 'sideways_rsi_ob': 63, 'sideways_adx_thresh': 25.48567487283711, 'sideways_atr_min_pct': 0.01956751112549171, 'sideways_atr_max_pct': 0.13733208293724378, 'sideways_tp_mult': 2.6312002972974664, 'sideways_tsl_mult': 0.5891115070453659, 'sideways_time_stop': 54, 'sideways_use_sma': True, 'sideways_use_ema': True, 'sideways_use_atr': True, 'sideways_use_adx': True, 'sideways_use_spike': True, 'sideways_rsi_required': True}.
[I 2025-09-01 14:14:14,804] Trial 118 finished with values: [-1000000000.0, 1000000000.0] and parameters: {'p_sma': 23, 'p_std': 10, 'p_atr': 16, 'p_adx': 17, 'rsi_period': 54, 'ema1': 30, 'ema2': 22, 'slip_atr_k': 0.04320101756686584, 'slip_spread_k': 0.44027859833312166, 'spread_hl_frac': 0.011597569879779657, 'bb_std_mult': 1.5204183185020128, 'rsi_os': 10, 'rsi_ob': 82, 'vol_spike': 0.10606036098540579, 'adx_thresh': 27.904549132007336, 'atr_min_pct': 0.007913663218750696, 'atr_max_pct': 0.06614055382180292, 'tp_mult': 2.454398688848422, 'tsl_mult': 0.18869344854674405, 'strategy': 'breakout', 'time_stop': 201, 'use_sma': False, 'use_atr': False, 'use_adx': False, 'use_ema': False, 'use_spike': False, 'rsi_required': True, 'edge_k': 0.660548239416177, 'edge_cap': 0.8257636095468417, 'bull_strategy': 'breakout', 'bull_bb_std_mult': 1.3498159279695225, 'bull_rsi_os': 31, 'bull_rsi_ob': 50, 'bull_adx_thresh': 15.66547934048199, 'bull_atr_min_pct': 0.018047340675673835, 'bull_atr_max_pct': 0.03647702930422412, 'bull_tp_mult': 1.1594971553027225, 'bull_tsl_mult': 0.7564902729595583, 'bull_time_stop': 11, 'bull_use_sma': True, 'bull_use_ema': True, 'bull_use_atr': False, 'bull_use_adx': False, 'bull_use_spike': False, 'bull_rsi_required': False, 'bear_strategy': 'mean_reversion', 'bear_bb_std_mult': 3.288014275964999, 'bear_rsi_os': 54, 'bear_rsi_ob': 95, 'bear_adx_thresh': 34.96194801887364, 'bear_atr_min_pct': 0.02195690879831505, 'bear_atr_max_pct': 0.02420258231877969, 'bear_tp_mult': 1.7017881174213536, 'bear_tsl_mult': 0.5838263818439011, 'bear_time_stop': 249, 'bear_use_sma': False, 'bear_use_ema': True, 'bear_use_atr': True, 'bear_use_adx': False, 'bear_use_spike': False, 'bear_rsi_required': True, 'sideways_strategy': 'mean_reversion', 'sideways_bb_std_mult': 1.0853947392524406, 'sideways_rsi_os': 29, 'sideways_rsi_ob': 76, 'sideways_adx_thresh': 16.269781810830423, 'sideways_atr_min_pct': 0.025458013631062114, 'sideways_atr_max_pct': 0.0445056440046222, 'sideways_tp_mult': 2.644572339408415, 'sideways_tsl_mult': 0.8509099847488455, 'sideways_time_stop': 232, 'sideways_use_sma': True, 'sideways_use_ema': True, 'sideways_use_atr': True, 'sideways_use_adx': False, 'sideways_use_spike': True, 'sideways_rsi_required': True}.
[I 2025-09-01 14:14:15,084] Trial 121 finished with values: [-1000000000.0, 1000000000.0] and parameters: {'p_sma': 8, 'p_std': 56, 'p_atr': 20, 'p_adx': 22, 'rsi_period': 54, 'ema1': 16, 'ema2': 22, 'slip_atr_k': 0.0531700517288549, 'slip_spread_k': 0.10283738343907467, 'spread_hl_frac': 0.04325525261419136, 'bb_std_mult': 1.457843396460997, 'rsi_os': 12, 'rsi_ob': 53, 'vol_spike': 0.10942336519853721, 'adx_thresh': 26.179809781177926, 'atr_min_pct': 0.008038736323272053, 'atr_max_pct': 0.09340083840616242, 'tp_mult': 1.5477677551813767, 'tsl_mult': 0.698179710071615, 'strategy': 'breakout', 'time_stop': 107, 'use_sma': False, 'use_atr': False, 'use_adx': True, 'use_ema': False, 'use_spike': False, 'rsi_required': True, 'edge_k': 0.9081088227845906, 'edge_cap': 0.9614323712856387, 'bull_strategy': 'breakout', 'bull_bb_std_mult': 3.1462198648331263, 'bull_rsi_os': 29, 'bull_rsi_ob': 56, 'bull_adx_thresh': 15.434422693630346, 'bull_atr_min_pct': 0.007182646410530926, 'bull_atr_max_pct': 0.057262079715868504, 'bull_tp_mult': 2.2631682357511864, 'bull_tsl_mult': 0.9807576540315719, 'bull_time_stop': 10, 'bull_use_sma': True, 'bull_use_ema': True, 'bull_use_atr': False, 'bull_use_adx': True, 'bull_use_spike': False, 'bull_rsi_required': False, 'bear_strategy': 'breakout', 'bear_bb_std_mult': 1.0011005493855312, 'bear_rsi_os': 49, 'bear_rsi_ob': 90, 'bear_adx_thresh': 14.672999968405492, 'bear_atr_min_pct': 0.008274616692507893, 'bear_atr_max_pct': 0.02660607168329587, 'bear_tp_mult': 1.4586872742198889, 'bear_tsl_mult': 0.18287724701245894, 'bear_time_stop': 220, 'bear_use_sma': False, 'bear_use_ema': True, 'bear_use_atr': True, 'bear_use_adx': True, 'bear_use_spike': False, 'bear_rsi_required': True, 'sideways_strategy': 'mean_reversion', 'sideways_bb_std_mult': 0.8805581773249818, 'sideways_rsi_os': 47, 'sideways_rsi_ob': 63, 'sideways_adx_thresh': 15.814607649564127, 'sideways_atr_min_pct': 0.02764703813182812, 'sideways_atr_max_pct': 0.05837864688515077, 'sideways_tp_mult': 2.80274363698837, 'sideways_tsl_mult': 0.9443586953757264, 'sideways_time_stop': 115, 'sideways_use_sma': True, 'sideways_use_ema': True, 'sideways_use_atr': True, 'sideways_use_adx': True, 'sideways_use_spike': True, 'sideways_rsi_required': True}.
[I 2025-09-01 14:14:58,899] Trial 125 finished with values: [-0.08060070663347974, 0.08047855384944826] and parameters: {'p_sma': 28, 'p_std': 11, 'p_atr': 12, 'p_adx': 14, 'rsi_period': 77, 'ema1': 29, 'ema2': 42, 'slip_atr_k': 0.1291779441355524, 'slip_spread_k': 0.4712544065752945, 'spread_hl_frac': 0.0406271463722305, 'bb_std_mult': 2.514686329309097, 'rsi_os': 14, 'rsi_ob': 89, 'vol_spike': 0.22619566386638873, 'adx_thresh': 23.98933893718633, 'atr_min_pct': 0.006627245908425817, 'atr_max_pct': 0.058555010419868, 'tp_mult': 1.0559718116485626, 'tsl_mult': 0.5770774822352043, 'strategy': 'breakout', 'time_stop': 86, 'use_sma': True, 'use_atr': True, 'use_adx': False, 'use_ema': True, 'use_spike': False, 'rsi_required': True, 'edge_k': 0.565508542101495, 'edge_cap': 0.05420919312143535, 'bull_strategy': 'breakout', 'bull_bb_std_mult': 3.584146784748291, 'bull_rsi_os': 36, 'bull_rsi_ob': 54, 'bull_adx_thresh': 9.285061236511197, 'bull_atr_min_pct': 0.0007896579680734114, 'bull_atr_max_pct': 0.13054694137497308, 'bull_tp_mult': 1.012317567774612, 'bull_tsl_mult': 0.7133424942061969, 'bull_time_stop': 19, 'bull_use_sma': False, 'bull_use_ema': False, 'bull_use_atr': False, 'bull_use_adx': True, 'bull_use_spike': True, 'bull_rsi_required': True, 'bear_strategy': 'breakout', 'bear_bb_std_mult': 2.248868931360127, 'bear_rsi_os': 51, 'bear_rsi_ob': 46, 'bear_adx_thresh': 26.443266868897823, 'bear_atr_min_pct': 0.007872193983439125, 'bear_atr_max_pct': 0.033813573353583794, 'bear_tp_mult': 2.7062182251922584, 'bear_tsl_mult': 0.31572506266768835, 'bear_time_stop': 67, 'bear_use_sma': True, 'bear_use_ema': True, 'bear_use_atr': False, 'bear_use_adx': False, 'bear_use_spike': False, 'bear_rsi_required': True, 'sideways_strategy': 'mean_reversion', 'sideways_bb_std_mult': 2.711603275680157, 'sideways_rsi_os': 28, 'sideways_rsi_ob': 73, 'sideways_adx_thresh': 34.458653241895945, 'sideways_atr_min_pct': 0.014946683912052658, 'sideways_atr_max_pct': 0.03551539966157703, 'sideways_tp_mult': 2.1507547363143606, 'sideways_tsl_mult': 0.7981911607250934, 'sideways_time_stop': 63, 'sideways_use_sma': True, 'sideways_use_ema': True, 'sideways_use_atr': False, 'sideways_use_adx': True, 'sideways_use_spike': True, 'sideways_rsi_required': False}.
[I 2025-09-01 14:14:58,901] Trial 124 finished with values: [-0.03759212272611234, 0.040811427385434] and parameters: {'p_sma': 28, 'p_std': 11, 'p_atr': 12, 'p_adx': 14, 'rsi_period': 40, 'ema1': 29, 'ema2': 43, 'slip_atr_k': 0.0016045799742658712, 'slip_spread_k': 0.4189622826328517, 'spread_hl_frac': 0.01457089650157934, 'bb_std_mult': 1.5954166113730999, 'rsi_os': 9, 'rsi_ob': 79, 'vol_spike': 0.019728612990143612, 'adx_thresh': 19.345558988392977, 'atr_min_pct': 0.0061775466932236685, 'atr_max_pct': 0.021364155831490886, 'tp_mult': 1.9356494120704872, 'tsl_mult': 0.5779008668062592, 'strategy': 'breakout', 'time_stop': 87, 'use_sma': True, 'use_atr': True, 'use_adx': False, 'use_ema': True, 'use_spike': False, 'rsi_required': True, 'edge_k': 0.5598069456040251, 'edge_cap': 0.1618637333689789, 'bull_strategy': 'breakout', 'bull_bb_std_mult': 2.4453612290219433, 'bull_rsi_os': 17, 'bull_rsi_ob': 54, 'bull_adx_thresh': 9.418025413905507, 'bull_atr_min_pct': 0.002232830274517967, 'bull_atr_max_pct': 0.028651884631949467, 'bull_tp_mult': 2.049783099800223, 'bull_tsl_mult': 0.8915455849693199, 'bull_time_stop': 19, 'bull_use_sma': False, 'bull_use_ema': False, 'bull_use_atr': False, 'bull_use_adx': True, 'bull_use_spike': True, 'bull_rsi_required': True, 'bear_strategy': 'breakout', 'bear_bb_std_mult': 1.9727644715391068, 'bear_rsi_os': 51, 'bear_rsi_ob': 46, 'bear_adx_thresh': 23.18691453839903, 'bear_atr_min_pct': 0.005094713597954853, 'bear_atr_max_pct': 0.035096156767033516, 'bear_tp_mult': 1.9243184242460705, 'bear_tsl_mult': 0.643633270922806, 'bear_time_stop': 70, 'bear_use_sma': True, 'bear_use_ema': True, 'bear_use_atr': False, 'bear_use_adx': False, 'bear_use_spike': False, 'bear_rsi_required': True, 'sideways_strategy': 'mean_reversion', 'sideways_bb_std_mult': 2.3676387506525325, 'sideways_rsi_os': 26, 'sideways_rsi_ob': 73, 'sideways_adx_thresh': 10.471129094844368, 'sideways_atr_min_pct': 0.0147488767063821, 'sideways_atr_max_pct': 0.04734714718378471, 'sideways_tp_mult': 1.522847691358331, 'sideways_tsl_mult': 0.7944002412367573, 'sideways_time_stop': 62, 'sideways_use_sma': True, 'sideways_use_ema': True, 'sideways_use_atr': False, 'sideways_use_adx': True, 'sideways_use_spike': True, 'sideways_rsi_required': False}.
[I 2025-09-01 14:14:59,525] Trial 123 finished with values: [-1000000000.0, 1000000000.0] and parameters: {'p_sma': 28, 'p_std': 54, 'p_atr': 14, 'p_adx': 14, 'rsi_period': 39, 'ema1': 30, 'ema2': 59, 'slip_atr_k': 0.0061906866450030205, 'slip_spread_k': 0.4115996352488378, 'spread_hl_frac': 0.006523293867581114, 'bb_std_mult': 1.5560749576880926, 'rsi_os': 20, 'rsi_ob': 56, 'vol_spike': 0.2285834351948176, 'adx_thresh': 20.90976198303092, 'atr_min_pct': 0.006574401655151969, 'atr_max_pct': 0.02202418125668467, 'tp_mult': 1.856626924403124, 'tsl_mult': 0.6118753191581231, 'strategy': 'breakout', 'time_stop': 85, 'use_sma': True, 'use_atr': True, 'use_adx': True, 'use_ema': True, 'use_spike': False, 'rsi_required': True, 'edge_k': 0.9048113758282287, 'edge_cap': 0.9500547138768461, 'bull_strategy': 'breakout', 'bull_bb_std_mult': 3.1020417710786123, 'bull_rsi_os': 17, 'bull_rsi_ob': 54, 'bull_adx_thresh': 15.455198517915125, 'bull_atr_min_pct': 0.007187895230630043, 'bull_atr_max_pct': 0.027446242466706697, 'bull_tp_mult': 1.335682988309646, 'bull_tsl_mult': 0.6950091951253673, 'bull_time_stop': 46, 'bull_use_sma': False, 'bull_use_ema': True, 'bull_use_atr': False, 'bull_use_adx': True, 'bull_use_spike': True, 'bull_rsi_required': True, 'bear_strategy': 'breakout', 'bear_bb_std_mult': 1.9836616978257835, 'bear_rsi_os': 49, 'bear_rsi_ob': 59, 'bear_adx_thresh': 5.020869437870141, 'bear_atr_min_pct': 0.02478909090238418, 'bear_atr_max_pct': 0.027286445419302745, 'bear_tp_mult': 1.0852454375749403, 'bear_tsl_mult': 0.1622781955623026, 'bear_time_stop': 220, 'bear_use_sma': True, 'bear_use_ema': True, 'bear_use_atr': False, 'bear_use_adx': True, 'bear_use_spike': False, 'bear_rsi_required': True, 'sideways_strategy': 'mean_reversion', 'sideways_bb_std_mult': 0.8555418795882104, 'sideways_rsi_os': 54, 'sideways_rsi_ob': 76, 'sideways_adx_thresh': 18.227891700709364, 'sideways_atr_min_pct': 0.006009146264721156, 'sideways_atr_max_pct': 0.04385240874961212, 'sideways_tp_mult': 2.1227007065319228, 'sideways_tsl_mult': 0.8476274888671947, 'sideways_time_stop': 116, 'sideways_use_sma': True, 'sideways_use_ema': True, 'sideways_use_atr': False, 'sideways_use_adx': True, 'sideways_use_spike': True, 'sideways_rsi_required': False}.
[I 2025-09-01 14:15:00,285] Trial 122 finished with values: [-0.043103134912023, 0.04297027138075229] and parameters: {'p_sma': 60, 'p_std': 26, 'p_atr': 12, 'p_adx': 12, 'rsi_period': 77, 'ema1': 29, 'ema2': 22, 'slip_atr_k': 0.07968971308101264, 'slip_spread_k': 0.41357390817375733, 'spread_hl_frac': 0.01511064334735377, 'bb_std_mult': 1.1920048384007673, 'rsi_os': 11, 'rsi_ob': 58, 'vol_spike': 0.025647731707431565, 'adx_thresh': 22.84250103065989, 'atr_min_pct': 0.014124688107492312, 'atr_max_pct': 0.0938160508215963, 'tp_mult': 1.5538838577634162, 'tsl_mult': 0.2366483911246846, 'strategy': 'breakout', 'time_stop': 112, 'use_sma': True, 'use_atr': True, 'use_adx': False, 'use_ema': True, 'use_spike': False, 'rsi_required': True, 'edge_k': 0.11915113108599118, 'edge_cap': 0.8426498978838666, 'bull_strategy': 'breakout', 'bull_bb_std_mult': 2.433330422989535, 'bull_rsi_os': 28, 'bull_rsi_ob': 95, 'bull_adx_thresh': 12.311204476843269, 'bull_atr_min_pct': 0.00029867619862704135, 'bull_atr_max_pct': 0.03707020000433366, 'bull_tp_mult': 1.1656395518507117, 'bull_tsl_mult': 0.9742123675227528, 'bull_time_stop': 46, 'bull_use_sma': False, 'bull_use_ema': True, 'bull_use_atr': False, 'bull_use_adx': True, 'bull_use_spike': False, 'bull_rsi_required': True, 'bear_strategy': 'breakout', 'bear_bb_std_mult': 2.989577978357146, 'bear_rsi_os': 54, 'bear_rsi_ob': 90, 'bear_adx_thresh': 19.67274944183381, 'bear_atr_min_pct': 0.02393588723112048, 'bear_atr_max_pct': 0.02790678343781622, 'bear_tp_mult': 1.4801562163437176, 'bear_tsl_mult': 0.6562661673398528, 'bear_time_stop': 253, 'bear_use_sma': True, 'bear_use_ema': True, 'bear_use_atr': False, 'bear_use_adx': True, 'bear_use_spike': False, 'bear_rsi_required': True, 'sideways_strategy': 'mean_reversion', 'sideways_bb_std_mult': 3.4279906022476316, 'sideways_rsi_os': 44, 'sideways_rsi_ob': 55, 'sideways_adx_thresh': 23.507513580223367, 'sideways_atr_min_pct': 0.01487723144061033, 'sideways_atr_max_pct': 0.09859382385336583, 'sideways_tp_mult': 1.0637670663294652, 'sideways_tsl_mult': 0.8484710233821541, 'sideways_time_stop': 53, 'sideways_use_sma': True, 'sideways_use_ema': True, 'sideways_use_atr': False, 'sideways_use_adx': True, 'sideways_use_spike': True, 'sideways_rsi_required': False}.
