[I 2025-09-01 14:31:35,974] Trial 231 finished with values: [-1000000000.0, 1000000000.0] and parameters: {'p_sma': 25, 'p_std': 11, 'p_atr': 27, 'p_adx': 24, 'rsi_period': 73, 'ema1': 23, 'ema2': 41, 'slip_atr_k': 0.1115384116528602, 'slip_spread_k': 0.4845738310222518, 'spread_hl_frac': 0.04300108944271905, 'bb_std_mult': 2.490386720242619, 'rsi_os': 10, 'rsi_ob': 51, 'vol_spike': 0.19736150777164468, 'adx_thresh': 26.2246965244578, 'atr_min_pct': 0.018548486636204994, 'atr_max_pct': 0.06337284658672288, 'tp_mult': 1.7294698211740962, 'tsl_mult': 0.7566582471351718, 'strategy': 'breakout', 'time_stop': 76, 'use_sma': False, 'use_atr': False, 'use_adx': True, 'use_ema': False, 'use_spike': False, 'rsi_required': True, 'edge_k': 1.0475769697963935, 'edge_cap': 0.1931286661766471, 'bull_strategy': 'breakout', 'bull_bb_std_mult': 1.277555979775101, 'bull_rsi_os': 42, 'bull_rsi_ob': 53, 'bull_adx_thresh': 27.82888804582751, 'bull_atr_min_pct': 0.018988899329173733, 'bull_atr_max_pct': 0.03758435374293827, 'bull_tp_mult': 1.7633133510957242, 'bull_tsl_mult': 0.8785347143483915, 'bull_time_stop': 18, 'bull_use_sma': False, 'bull_use_ema': True, 'bull_use_atr': False, 'bull_use_adx': False, 'bull_use_spike': False, 'bull_rsi_required': False, 'bear_strategy': 'breakout', 'bear_bb_std_mult': 2.175044780036281, 'bear_rsi_os': 21, 'bear_rsi_ob': 45, 'bear_adx_thresh': 6.782920956967805, 'bear_atr_min_pct': 0.005101267435545145, 'bear_atr_max_pct': 0.023906982918543453, 'bear_tp_mult': 1.829666192036328, 'bear_tsl_mult': 0.6986940687239587, 'bear_time_stop': 168, 'bear_use_sma': False, 'bear_use_ema': True, 'bear_use_atr': True, 'bear_use_adx': False, 'bear_use_spike': False, 'bear_rsi_required': True, 'sideways_strategy': 'mean_reversion', 'sideways_bb_std_mult': 1.1873316481062528, 'sideways_rsi_os': 34, 'sideways_rsi_ob': 52, 'sideways_adx_thresh': 33.985392533526316, 'sideways_atr_min_pct': 0.012457429277752896, 'sideways_atr_max_pct': 0.04111641504527476, 'sideways_tp_mult': 1.4424424609396977, 'sideways_tsl_mult': 0.5479514786506079, 'sideways_time_stop': 29, 'sideways_use_sma': True, 'sideways_use_ema': True, 'sideways_use_atr': False, 'sideways_use_adx': True, 'sideways_use_spike': True, 'sideways_rsi_required': False}.
[I 2025-09-01 14:32:13,907] Trial 237 finished with values: [-1000000000.0, 1000000000.0] and parameters: {'p_sma': 26, 'p_std': 5, 'p_atr': 14, 'p_adx': 7, 'rsi_period': 64, 'ema1': 28, 'ema2': 19, 'slip_atr_k': 0.03509337107362482, 'slip_spread_k': 0.4381163362234069, 'spread_hl_frac': 0.014563718975807365, 'bb_std_mult': 2.4946792152841826, 'rsi_os': 7, 'rsi_ob': 51, 'vol_spike': 0.06680905598928837, 'adx_thresh': 18.643211665584886, 'atr_min_pct': 0.007891077068915987, 'atr_max_pct': 0.1165240851836768, 'tp_mult': 2.4567362070834293, 'tsl_mult': 0.8436476239825039, 'strategy': 'breakout', 'time_stop': 83, 'use_sma': False, 'use_atr': False, 'use_adx': False, 'use_ema': False, 'use_spike': False, 'rsi_required': True, 'edge_k': 0.7565119938282664, 'edge_cap': 0.9269874093675471, 'bull_strategy': 'breakout', 'bull_bb_std_mult': 1.5038841037192912, 'bull_rsi_os': 21, 'bull_rsi_ob': 56, 'bull_adx_thresh': 14.83761163365947, 'bull_atr_min_pct': 0.006468095857511225, 'bull_atr_max_pct': 0.12691316785608486, 'bull_tp_mult': 1.0807121465633243, 'bull_tsl_mult': 0.8539431491988938, 'bull_time_stop': 21, 'bull_use_sma': True, 'bull_use_ema': False, 'bull_use_atr': False, 'bull_use_adx': True, 'bull_use_spike': False, 'bull_rsi_required': True, 'bear_strategy': 'mean_reversion', 'bear_bb_std_mult': 1.9540984341454113, 'bear_rsi_os': 51, 'bear_rsi_ob': 92, 'bear_adx_thresh': 30.004937853154786, 'bear_atr_min_pct': 0.027196102531116345, 'bear_atr_max_pct': 0.0649866892925347, 'bear_tp_mult': 1.424146258651341, 'bear_tsl_mult': 0.03985400586632282, 'bear_time_stop': 242, 'bear_use_sma': False, 'bear_use_ema': True, 'bear_use_atr': False, 'bear_use_adx': False, 'bear_use_spike': False, 'bear_rsi_required': True, 'sideways_strategy': 'mean_reversion', 'sideways_bb_std_mult': 3.37505474415084, 'sideways_rsi_os': 32, 'sideways_rsi_ob': 58, 'sideways_adx_thresh': 34.970995495167486, 'sideways_atr_min_pct': 0.012369681297887078, 'sideways_atr_max_pct': 0.029791485168627577, 'sideways_tp_mult': 2.639094227721169, 'sideways_tsl_mult': 0.7772504919198366, 'sideways_time_stop': 273, 'sideways_use_sma': True, 'sideways_use_ema': False, 'sideways_use_atr': False, 'sideways_use_adx': False, 'sideways_use_spike': True, 'sideways_rsi_required': False}.
[I 2025-09-01 14:32:13,908] Trial 235 finished with values: [-0.02309580562865199, 0.02314705270125295] and parameters: {'p_sma': 21, 'p_std': 12, 'p_atr': 14, 'p_adx': 22, 'rsi_period': 68, 'ema1': 11, 'ema2': 20, 'slip_atr_k': 0.10589328625931183, 'slip_spread_k': 0.44728746237006384, 'spread_hl_frac': 0.014019769318216819, 'bb_std_mult': 2.4901576510544654, 'rsi_os': 6, 'rsi_ob': 84, 'vol_spike': 0.07054534120999353, 'adx_thresh': 25.8089278589806, 'atr_min_pct': 0.007969198167020013, 'atr_max_pct': 0.060655593862716926, 'tp_mult': 1.1551237660149694, 'tsl_mult': 0.527703496146268, 'strategy': 'breakout', 'time_stop': 285, 'use_sma': False, 'use_atr': False, 'use_adx': True, 'use_ema': False, 'use_spike': False, 'rsi_required': True, 'edge_k': 1.9098638190231165, 'edge_cap': 0.6433151391950365, 'bull_strategy': 'breakout', 'bull_bb_std_mult': 1.5005011379556583, 'bull_rsi_os': 16, 'bull_rsi_ob': 55, 'bull_adx_thresh': 34.27295284020631, 'bull_atr_min_pct': 0.0020847403447046614, 'bull_atr_max_pct': 0.03714474891570438, 'bull_tp_mult': 1.0763411776722422, 'bull_tsl_mult': 0.7566939265551338, 'bull_time_stop': 23, 'bull_use_sma': False, 'bull_use_ema': False, 'bull_use_atr': False, 'bull_use_adx': True, 'bull_use_spike': False, 'bull_rsi_required': True, 'bear_strategy': 'mean_reversion', 'bear_bb_std_mult': 1.9524029820376336, 'bear_rsi_os': 53, 'bear_rsi_ob': 95, 'bear_adx_thresh': 5.698501163610579, 'bear_atr_min_pct': 0.014701461492508618, 'bear_atr_max_pct': 0.06398734626831701, 'bear_tp_mult': 1.8884968088307947, 'bear_tsl_mult': 0.11430877373904008, 'bear_time_stop': 117, 'bear_use_sma': False, 'bear_use_ema': True, 'bear_use_atr': False, 'bear_use_adx': False, 'bear_use_spike': False, 'bear_rsi_required': True, 'sideways_strategy': 'mean_reversion', 'sideways_bb_std_mult': 1.2639416570784698, 'sideways_rsi_os': 8, 'sideways_rsi_ob': 46, 'sideways_adx_thresh': 34.97089625207227, 'sideways_atr_min_pct': 0.012759658270757573, 'sideways_atr_max_pct': 0.041841444627044526, 'sideways_tp_mult': 2.6300342912747032, 'sideways_tsl_mult': 0.30568685349672764, 'sideways_time_stop': 291, 'sideways_use_sma': True, 'sideways_use_ema': False, 'sideways_use_atr': False, 'sideways_use_adx': False, 'sideways_use_spike': True, 'sideways_rsi_required': False}.
[I 2025-09-01 14:32:14,285] Trial 238 finished with values: [-0.02378176283724298, 0.023935882084558473] and parameters: {'p_sma': 36, 'p_std': 13, 'p_atr': 14, 'p_adx': 22, 'rsi_period': 64, 'ema1': 28, 'ema2': 30, 'slip_atr_k': 0.08457029091328469, 'slip_spread_k': 0.4442994994994264, 'spread_hl_frac': 0.01443603478669997, 'bb_std_mult': 2.5789320557957285, 'rsi_os': 6, 'rsi_ob': 77, 'vol_spike': 0.07352464381069976, 'adx_thresh': 25.789513425868343, 'atr_min_pct': 0.007916546289783765, 'atr_max_pct': 0.08374249859873939, 'tp_mult': 2.4320978593324276, 'tsl_mult': 0.5282677010343932, 'strategy': 'mean_reversion', 'time_stop': 232, 'use_sma': False, 'use_atr': True, 'use_adx': False, 'use_ema': False, 'use_spike': True, 'rsi_required': False, 'edge_k': 0.39781891356517196, 'edge_cap': 0.9229266827178177, 'bull_strategy': 'breakout', 'bull_bb_std_mult': 0.6556951812105782, 'bull_rsi_os': 17, 'bull_rsi_ob': 56, 'bull_adx_thresh': 31.10491623234207, 'bull_atr_min_pct': 0.0020570493986904114, 'bull_atr_max_pct': 0.09396046268039346, 'bull_tp_mult': 1.0843318621527738, 'bull_tsl_mult': 0.564883816901954, 'bull_time_stop': 263, 'bull_use_sma': True, 'bull_use_ema': False, 'bull_use_atr': True, 'bull_use_adx': True, 'bull_use_spike': False, 'bull_rsi_required': True, 'bear_strategy': 'mean_reversion', 'bear_bb_std_mult': 2.1418830516770373, 'bear_rsi_os': 28, 'bear_rsi_ob': 48, 'bear_adx_thresh': 5.785019241884367, 'bear_atr_min_pct': 0.027566523511344067, 'bear_atr_max_pct': 0.09115144916987543, 'bear_tp_mult': 2.139297807037039, 'bear_tsl_mult': 0.19870828947448738, 'bear_time_stop': 240, 'bear_use_sma': True, 'bear_use_ema': True, 'bear_use_atr': False, 'bear_use_adx': False, 'bear_use_spike': False, 'bear_rsi_required': False, 'sideways_strategy': 'mean_reversion', 'sideways_bb_std_mult': 1.2357987250689806, 'sideways_rsi_os': 32, 'sideways_rsi_ob': 77, 'sideways_adx_thresh': 28.902194196490917, 'sideways_atr_min_pct': 0.0264402178052634, 'sideways_atr_max_pct': 0.028802972897688163, 'sideways_tp_mult': 2.6314105058826485, 'sideways_tsl_mult': 0.0850793470729056, 'sideways_time_stop': 97, 'sideways_use_sma': True, 'sideways_use_ema': False, 'sideways_use_atr': False, 'sideways_use_adx': False, 'sideways_use_spike': True, 'sideways_rsi_required': False}.
[I 2025-09-01 14:32:14,639] Trial 236 finished with values: [-0.029191543524033525, 0.0292488182895596] and parameters: {'p_sma': 26, 'p_std': 12, 'p_atr': 14, 'p_adx': 22, 'rsi_period': 70, 'ema1': 15, 'ema2': 19, 'slip_atr_k': 0.03524889192557112, 'slip_spread_k': 0.4455695928471181, 'spread_hl_frac': 0.00810146925390182, 'bb_std_mult': 2.4706065777303534, 'rsi_os': 7, 'rsi_ob': 84, 'vol_spike': 0.014524869989708894, 'adx_thresh': 30.129295024687075, 'atr_min_pct': 0.011676332447128629, 'atr_max_pct': 0.05981119125017167, 'tp_mult': 2.4608495160714625, 'tsl_mult': 0.849129848869963, 'strategy': 'breakout', 'time_stop': 82, 'use_sma': False, 'use_atr': False, 'use_adx': False, 'use_ema': False, 'use_spike': False, 'rsi_required': True, 'edge_k': 0.4053110661951288, 'edge_cap': 0.35138684365411754, 'bull_strategy': 'breakout', 'bull_bb_std_mult': 2.510222823670346, 'bull_rsi_os': 48, 'bull_rsi_ob': 94, 'bull_adx_thresh': 34.279581522422596, 'bull_atr_min_pct': 0.001983002148843587, 'bull_atr_max_pct': 0.08922562409166446, 'bull_tp_mult': 1.0528186448547034, 'bull_tsl_mult': 0.9302240445666886, 'bull_time_stop': 23, 'bull_use_sma': True, 'bull_use_ema': False, 'bull_use_atr': False, 'bull_use_adx': True, 'bull_use_spike': False, 'bull_rsi_required': True, 'bear_strategy': 'mean_reversion', 'bear_bb_std_mult': 2.157243964634661, 'bear_rsi_os': 14, 'bear_rsi_ob': 45, 'bear_adx_thresh': 5.61800241998567, 'bear_atr_min_pct': 0.0050377673000185745, 'bear_atr_max_pct': 0.016347428545900038, 'bear_tp_mult': 1.4065541352247521, 'bear_tsl_mult': 0.8119253098081346, 'bear_time_stop': 240, 'bear_use_sma': False, 'bear_use_ema': True, 'bear_use_atr': False, 'bear_use_adx': False, 'bear_use_spike': False, 'bear_rsi_required': True, 'sideways_strategy': 'mean_reversion', 'sideways_bb_std_mult': 3.383862380340452, 'sideways_rsi_os': 32, 'sideways_rsi_ob': 77, 'sideways_adx_thresh': 33.91698980520142, 'sideways_atr_min_pct': 0.012545772935550342, 'sideways_atr_max_pct': 0.029254043811847562, 'sideways_tp_mult': 1.6563867187452102, 'sideways_tsl_mult': 0.8517570774499909, 'sideways_time_stop': 99, 'sideways_use_sma': True, 'sideways_use_ema': False, 'sideways_use_atr': False, 'sideways_use_adx': False, 'sideways_use_spike': True, 'sideways_rsi_required': False}.
[I 2025-09-01 14:32:52,213] Trial 239 finished with values: [-1000000000.0, 1000000000.0] and parameters: {'p_sma': 27, 'p_std': 50, 'p_atr': 14, 'p_adx': 22, 'rsi_period': 9, 'ema1': 30, 'ema2': 39, 'slip_atr_k': 0.10605484912188215, 'slip_spread_k': 0.9487819799448975, 'spread_hl_frac': 0.04067582627334449, 'bb_std_mult': 2.3415050689893038, 'rsi_os': 30, 'rsi_ob': 65, 'vol_spike': 0.023720570877906584, 'adx_thresh': 29.21559077291411, 'atr_min_pct': 0.006549203361399156, 'atr_max_pct': 0.14118238459107577, 'tp_mult': 1.943549689717609, 'tsl_mult': 0.40258995048480406, 'strategy': 'mean_reversion', 'time_stop': 231, 'use_sma': True, 'use_atr': False, 'use_adx': False, 'use_ema': False, 'use_spike': True, 'rsi_required': False, 'edge_k': 0.6619132876497529, 'edge_cap': 0.6338482185492185, 'bull_strategy': 'breakout', 'bull_bb_std_mult': 2.5308197866100435, 'bull_rsi_os': 19, 'bull_rsi_ob': 78, 'bull_adx_thresh': 8.950781967867243, 'bull_atr_min_pct': 0.009514110646090253, 'bull_atr_max_pct': 0.03542850697782214, 'bull_tp_mult': 1.128986419427781, 'bull_tsl_mult': 0.27726702268740605, 'bull_time_stop': 80, 'bull_use_sma': False, 'bull_use_ema': False, 'bull_use_atr': True, 'bull_use_adx': True, 'bull_use_spike': False, 'bull_rsi_required': True, 'bear_strategy': 'mean_reversion', 'bear_bb_std_mult': 3.402345336954835, 'bear_rsi_os': 55, 'bear_rsi_ob': 83, 'bear_adx_thresh': 10.059444221996324, 'bear_atr_min_pct': 0.024076692447496294, 'bear_atr_max_pct': 0.09385219259159205, 'bear_tp_mult': 2.1174282021394766, 'bear_tsl_mult': 0.8102855569555064, 'bear_time_stop': 291, 'bear_use_sma': False, 'bear_use_ema': True, 'bear_use_atr': False, 'bear_use_adx': False, 'bear_use_spike': False, 'bear_rsi_required': False, 'sideways_strategy': 'mean_reversion', 'sideways_bb_std_mult': 1.2710178141694206, 'sideways_rsi_os': 49, 'sideways_rsi_ob': 77, 'sideways_adx_thresh': 11.390887020243635, 'sideways_atr_min_pct': 0.018705385865760385, 'sideways_atr_max_pct': 0.0946065929155368, 'sideways_tp_mult': 2.674839374214179, 'sideways_tsl_mult': 0.8789815295636797, 'sideways_time_stop': 100, 'sideways_use_sma': True, 'sideways_use_ema': False, 'sideways_use_atr': False, 'sideways_use_adx': False, 'sideways_use_spike': True, 'sideways_rsi_required': False}.
[I 2025-09-01 14:32:52,833] Trial 240 finished with values: [-0.04993705693417083, 0.049734808767864055] and parameters: {'p_sma': 24, 'p_std': 12, 'p_atr': 14, 'p_adx': 22, 'rsi_period': 52, 'ema1': 30, 'ema2': 21, 'slip_atr_k': 0.02898713790706226, 'slip_spread_k': 0.45365133830135584, 'spread_hl_frac': 0.04080609105719603, 'bb_std_mult': 2.5704301122042867, 'rsi_os': 6, 'rsi_ob': 65, 'vol_spike': 0.05579366163910715, 'adx_thresh': 29.463577980199947, 'atr_min_pct': 0.006700869354983499, 'atr_max_pct': 0.05957735594317498, 'tp_mult': 1.2703132324081938, 'tsl_mult': 0.1259968245747926, 'strategy': 'mean_reversion', 'time_stop': 266, 'use_sma': True, 'use_atr': False, 'use_adx': False, 'use_ema': False, 'use_spike': True, 'rsi_required': False, 'edge_k': 0.4003174237077719, 'edge_cap': 0.3313933978904018, 'bull_strategy': 'breakout', 'bull_bb_std_mult': 3.367930699722277, 'bull_rsi_os': 19, 'bull_rsi_ob': 54, 'bull_adx_thresh': 8.637341230609731, 'bull_atr_min_pct': 0.001834942434462011, 'bull_atr_max_pct': 0.09746613041058763, 'bull_tp_mult': 1.2474165773164814, 'bull_tsl_mult': 0.7918166215104687, 'bull_time_stop': 240, 'bull_use_sma': False, 'bull_use_ema': False, 'bull_use_atr': True, 'bull_use_adx': True, 'bull_use_spike': False, 'bull_rsi_required': True, 'bear_strategy': 'mean_reversion', 'bear_bb_std_mult': 2.1007847776267123, 'bear_rsi_os': 28, 'bear_rsi_ob': 83, 'bear_adx_thresh': 15.883735010358674, 'bear_atr_min_pct': 0.01632266585854209, 'bear_atr_max_pct': 0.01045488667713846, 'bear_tp_mult': 2.887441258492153, 'bear_tsl_mult': 0.23538727359776085, 'bear_time_stop': 159, 'bear_use_sma': False, 'bear_use_ema': True, 'bear_use_atr': False, 'bear_use_adx': False, 'bear_use_spike': False, 'bear_rsi_required': False, 'sideways_strategy': 'mean_reversion', 'sideways_bb_std_mult': 1.255835701747012, 'sideways_rsi_os': 27, 'sideways_rsi_ob': 77, 'sideways_adx_thresh': 33.86721778661702, 'sideways_atr_min_pct': 0.018412972168760824, 'sideways_atr_max_pct': 0.06678983985572798, 'sideways_tp_mult': 2.6877344955295017, 'sideways_tsl_mult': 0.09255469553358137, 'sideways_time_stop': 86, 'sideways_use_sma': True, 'sideways_use_ema': False, 'sideways_use_atr': False, 'sideways_use_adx': False, 'sideways_use_spike': True, 'sideways_rsi_required': False}.
[I 2025-09-01 14:32:53,263] Trial 241 finished with values: [-0.07114768977518693, 0.07056854974923152] and parameters: {'p_sma': 55, 'p_std': 10, 'p_atr': 14, 'p_adx': 10, 'rsi_period': 53, 'ema1': 12, 'ema2': 39, 'slip_atr_k': 0.08608226689690979, 'slip_spread_k': 0.9737588430503263, 'spread_hl_frac': 0.036941526635981166, 'bb_std_mult': 1.7982465872270637, 'rsi_os': 6, 'rsi_ob': 85, 'vol_spike': 0.02564203657708789, 'adx_thresh': 10.015396001482088, 'atr_min_pct': 0.006560078043016743, 'atr_max_pct': 0.06114611660546434, 'tp_mult': 2.0929994666795473, 'tsl_mult': 0.46451206235174114, 'strategy': 'mean_reversion', 'time_stop': 84, 'use_sma': False, 'use_atr': True, 'use_adx': False, 'use_ema': False, 'use_spike': True, 'rsi_required': False, 'edge_k': 1.9196749996701805, 'edge_cap': 0.3720122985682336, 'bull_strategy': 'breakout', 'bull_bb_std_mult': 1.6135312684232528, 'bull_rsi_os': 19, 'bull_rsi_ob': 55, 'bull_adx_thresh': 34.262149531042084, 'bull_atr_min_pct': 0.023272981419600797, 'bull_atr_max_pct': 0.03015888826609571, 'bull_tp_mult': 1.2450438617496518, 'bull_tsl_mult': 0.7715330520430986, 'bull_time_stop': 248, 'bull_use_sma': True, 'bull_use_ema': True, 'bull_use_atr': True, 'bull_use_adx': True, 'bull_use_spike': False, 'bull_rsi_required': True, 'bear_strategy': 'breakout', 'bear_bb_std_mult': 2.9670896477401807, 'bear_rsi_os': 55, 'bear_rsi_ob': 79, 'bear_adx_thresh': 5.6209841734859545, 'bear_atr_min_pct': 0.003997503153994137, 'bear_atr_max_pct': 0.028045628894937284, 'bear_tp_mult': 2.9858226403490917, 'bear_tsl_mult': 0.6146556471062097, 'bear_time_stop': 117, 'bear_use_sma': True, 'bear_use_ema': True, 'bear_use_atr': False, 'bear_use_adx': False, 'bear_use_spike': True, 'bear_rsi_required': False, 'sideways_strategy': 'mean_reversion', 'sideways_bb_std_mult': 1.249516765894184, 'sideways_rsi_os': 9, 'sideways_rsi_ob': 77, 'sideways_adx_thresh': 11.315628539730314, 'sideways_atr_min_pct': 0.02368664728465562, 'sideways_atr_max_pct': 0.03356531524827593, 'sideways_tp_mult': 2.671497070747594, 'sideways_tsl_mult': 0.08629929127748792, 'sideways_time_stop': 86, 'sideways_use_sma': True, 'sideways_use_ema': False, 'sideways_use_atr': False, 'sideways_use_adx': True, 'sideways_use_spike': True, 'sideways_rsi_required': False}.
[I 2025-09-01 14:32:53,576] Trial 242 finished with values: [-1000000000.0, 1000000000.0] and parameters: {'p_sma': 51, 'p_std': 10, 'p_atr': 14, 'p_adx': 22, 'rsi_period': 46, 'ema1': 9, 'ema2': 30, 'slip_atr_k': 0.029006996821202145, 'slip_spread_k': 0.972952448674333, 'spread_hl_frac': 0.01883354670877926, 'bb_std_mult': 1.7998047539795854, 'rsi_os': 6, 'rsi_ob': 65, 'vol_spike': 0.11061824521282784, 'adx_thresh': 29.976099747645513, 'atr_min_pct': 0.014507757047888722, 'atr_max_pct': 0.05915646815748092, 'tp_mult': 1.9496217945200316, 'tsl_mult': 0.0003861728172671053, 'strategy': 'mean_reversion', 'time_stop': 85, 'use_sma': False, 'use_atr': True, 'use_adx': False, 'use_ema': False, 'use_spike': True, 'rsi_required': False, 'edge_k': 0.6481503223520673, 'edge_cap': 0.9194836942938347, 'bull_strategy': 'breakout', 'bull_bb_std_mult': 2.566457118362021, 'bull_rsi_os': 19, 'bull_rsi_ob': 94, 'bull_adx_thresh': 34.465494355337434, 'bull_atr_min_pct': 0.0040991655314543875, 'bull_atr_max_pct': 0.09741081675683008, 'bull_tp_mult': 1.238995683476409, 'bull_tsl_mult': 0.2970334799526676, 'bull_time_stop': 248, 'bull_use_sma': True, 'bull_use_ema': True, 'bull_use_atr': True, 'bull_use_adx': True, 'bull_use_spike': False, 'bull_rsi_required': True, 'bear_strategy': 'breakout', 'bear_bb_std_mult': 2.123812233518039, 'bear_rsi_os': 55, 'bear_rsi_ob': 79, 'bear_adx_thresh': 9.856932832058973, 'bear_atr_min_pct': 0.015890365119691822, 'bear_atr_max_pct': 0.09421751395371407, 'bear_tp_mult': 1.1143623221795764, 'bear_tsl_mult': 0.614333150275611, 'bear_time_stop': 116, 'bear_use_sma': True, 'bear_use_ema': True, 'bear_use_atr': False, 'bear_use_adx': False, 'bear_use_spike': True, 'bear_rsi_required': False, 'sideways_strategy': 'mean_reversion', 'sideways_bb_std_mult': 1.2374342236157372, 'sideways_rsi_os': 9, 'sideways_rsi_ob': 77, 'sideways_adx_thresh': 33.8456557770813, 'sideways_atr_min_pct': 0.022042808027922738, 'sideways_atr_max_pct': 0.09995406323649067, 'sideways_tp_mult': 1.6538101772600797, 'sideways_tsl_mult': 0.30784180160611996, 'sideways_time_stop': 86, 'sideways_use_sma': True, 'sideways_use_ema': False, 'sideways_use_atr': False, 'sideways_use_adx': True, 'sideways_use_spike': True, 'sideways_rsi_required': False}.
