[I 2025-09-01 14:05:46,627] Trial 73 finished with values: [-1000000000.0, 1000000000.0] and parameters: {'p_sma': 24, 'p_std': 6, 'p_atr': 14, 'p_adx': 26, 'rsi_period': 29, 'ema1': 29, 'ema2': 51, 'slip_atr_k': 0.01948347396105472, 'slip_spread_k': 0.4414532231223608, 'spread_hl_frac': 0.03852597099033679, 'bb_std_mult': 2.0845234276598927, 'rsi_os': 10, 'rsi_ob': 83, 'vol_spike': 0.12566043337604177, 'adx_thresh': 33.016043121366785, 'atr_min_pct': 0.015049696118881154, 'atr_max_pct': 0.09091042875000588, 'tp_mult': 2.2491225108196238, 'tsl_mult': 0.6514989536275811, 'strategy': 'mean_reversion', 'time_stop': 230, 'use_sma': False, 'use_atr': True, 'use_adx': True, 'use_ema': True, 'use_spike': True, 'rsi_required': False, 'edge_k': 0.44221971810846017, 'edge_cap': 0.9337757077829841, 'bull_strategy': 'mean_reversion', 'bull_bb_std_mult': 1.0188707108387876, 'bull_rsi_os': 15, 'bull_rsi_ob': 52, 'bull_adx_thresh': 16.03829893713324, 'bull_atr_min_pct': 0.008248501229450787, 'bull_atr_max_pct': 0.0303584084173288, 'bull_tp_mult': 1.212552900279196, 'bull_tsl_mult': 0.9266322528482416, 'bull_time_stop': 13, 'bull_use_sma': True, 'bull_use_ema': False, 'bull_use_atr': True, 'bull_use_adx': True, 'bull_use_spike': True, 'bull_rsi_required': False, 'bear_strategy': 'mean_reversion', 'bear_bb_std_mult': 1.6852612196566963, 'bear_rsi_os': 54, 'bear_rsi_ob': 84, 'bear_adx_thresh': 5.081061116647001, 'bear_atr_min_pct': 0.015034452595748603, 'bear_atr_max_pct': 0.025860651913557766, 'bear_tp_mult': 1.5454629874286538, 'bear_tsl_mult': 0.7124762839764148, 'bear_time_stop': 213, 'bear_use_sma': True, 'bear_use_ema': False, 'bear_use_atr': True, 'bear_use_adx': True, 'bear_use_spike': False, 'bear_rsi_required': False, 'sideways_strategy': 'mean_reversion', 'sideways_bb_std_mult': 2.6390767348283157, 'sideways_rsi_os': 53, 'sideways_rsi_ob': 71, 'sideways_adx_thresh': 34.16053983149526, 'sideways_atr_min_pct': 0.015917539911409814, 'sideways_atr_max_pct': 0.05487346710570744, 'sideways_tp_mult': 2.824292142633746, 'sideways_tsl_mult': 0.5783359226364893, 'sideways_time_stop': 96, 'sideways_use_sma': True, 'sideways_use_ema': False, 'sideways_use_atr': True, 'sideways_use_adx': True, 'sideways_use_spike': False, 'sideways_rsi_required': True}.
[I 2025-09-01 14:05:47,368] Trial 69 finished with values: [-1000000000.0, 1000000000.0] and parameters: {'p_sma': 34, 'p_std': 12, 'p_atr': 25, 'p_adx': 26, 'rsi_period': 59, 'ema1': 11, 'ema2': 39, 'slip_atr_k': 0.036423098984017334, 'slip_spread_k': 0.2780782590794286, 'spread_hl_frac': 0.03964254533222893, 'bb_std_mult': 2.47030597229658, 'rsi_os': 9, 'rsi_ob': 66, 'vol_spike': 0.12751955129680181, 'adx_thresh': 12.8400784421029, 'atr_min_pct': 0.0012377790238254738, 'atr_max_pct': 0.06523964440750875, 'tp_mult': 2.485685661636716, 'tsl_mult': 0.7396453048742229, 'strategy': 'breakout', 'time_stop': 260, 'use_sma': True, 'use_atr': False, 'use_adx': False, 'use_ema': True, 'use_spike': True, 'rsi_required': True, 'edge_k': 0.5020839096091061, 'edge_cap': 0.21643609267646846, 'bull_strategy': 'breakout', 'bull_bb_std_mult': 2.076691906094719, 'bull_rsi_os': 20, 'bull_rsi_ob': 67, 'bull_adx_thresh': 8.541549692834934, 'bull_atr_min_pct': 0.004666867924961146, 'bull_atr_max_pct': 0.033335980426335954, 'bull_tp_mult': 1.4371216561280014, 'bull_tsl_mult': 0.49011651082149, 'bull_time_stop': 33, 'bull_use_sma': True, 'bull_use_ema': True, 'bull_use_atr': False, 'bull_use_adx': True, 'bull_use_spike': False, 'bull_rsi_required': False, 'bear_strategy': 'breakout', 'bear_bb_std_mult': 3.436483179273173, 'bear_rsi_os': 53, 'bear_rsi_ob': 85, 'bear_adx_thresh': 5.076943845838436, 'bear_atr_min_pct': 0.00696993591776035, 'bear_atr_max_pct': 0.025950988577644732, 'bear_tp_mult': 2.437038911642031, 'bear_tsl_mult': 0.22948368295289157, 'bear_time_stop': 277, 'bear_use_sma': True, 'bear_use_ema': True, 'bear_use_atr': False, 'bear_use_adx': True, 'bear_use_spike': False, 'bear_rsi_required': True, 'sideways_strategy': 'mean_reversion', 'sideways_bb_std_mult': 2.4554632508316603, 'sideways_rsi_os': 27, 'sideways_rsi_ob': 78, 'sideways_adx_thresh': 29.699772536027062, 'sideways_atr_min_pct': 0.0190160604992661, 'sideways_atr_max_pct': 0.03458610230804332, 'sideways_tp_mult': 1.942426434422882, 'sideways_tsl_mult': 0.06674624892179054, 'sideways_time_stop': 82, 'sideways_use_sma': True, 'sideways_use_ema': True, 'sideways_use_atr': False, 'sideways_use_adx': True, 'sideways_use_spike': True, 'sideways_rsi_required': False}.
[I 2025-09-01 14:06:26,242] Trial 76 finished with values: [-0.011071660587767429, 0.018039688675298832] and parameters: {'p_sma': 19, 'p_std': 37, 'p_atr': 12, 'p_adx': 29, 'rsi_period': 66, 'ema1': 26, 'ema2': 48, 'slip_atr_k': 0.05280396733064281, 'slip_spread_k': 0.5482468417339679, 'spread_hl_frac': 0.0022745345447070277, 'bb_std_mult': 2.337883209869283, 'rsi_os': 25, 'rsi_ob': 90, 'vol_spike': 0.02723115115871705, 'adx_thresh': 25.994050586404914, 'atr_min_pct': 0.007606870393316562, 'atr_max_pct': 0.06521450009711387, 'tp_mult': 2.1626999096045534, 'tsl_mult': 0.9455712915300146, 'strategy': 'breakout', 'time_stop': 133, 'use_sma': False, 'use_atr': False, 'use_adx': False, 'use_ema': False, 'use_spike': False, 'rsi_required': True, 'edge_k': 0.48447844987115507, 'edge_cap': 0.8556418026892477, 'bull_strategy': 'breakout', 'bull_bb_std_mult': 1.4974024638190493, 'bull_rsi_os': 23, 'bull_rsi_ob': 45, 'bull_adx_thresh': 8.620640847730376, 'bull_atr_min_pct': 0.018717186430994737, 'bull_atr_max_pct': 0.11939869655919025, 'bull_tp_mult': 1.1772011883784312, 'bull_tsl_mult': 0.8484302687770345, 'bull_time_stop': 20, 'bull_use_sma': False, 'bull_use_ema': True, 'bull_use_atr': False, 'bull_use_adx': False, 'bull_use_spike': False, 'bull_rsi_required': True, 'bear_strategy': 'breakout', 'bear_bb_std_mult': 1.944503952888346, 'bear_rsi_os': 51, 'bear_rsi_ob': 74, 'bear_adx_thresh': 8.098942050680416, 'bear_atr_min_pct': 0.004694466883408198, 'bear_atr_max_pct': 0.034149024001492036, 'bear_tp_mult': 1.5061228377314484, 'bear_tsl_mult': 0.6693598738040599, 'bear_time_stop': 139, 'bear_use_sma': False, 'bear_use_ema': True, 'bear_use_atr': False, 'bear_use_adx': False, 'bear_use_spike': False, 'bear_rsi_required': True, 'sideways_strategy': 'mean_reversion', 'sideways_bb_std_mult': 0.9610691145377104, 'sideways_rsi_os': 36, 'sideways_rsi_ob': 78, 'sideways_adx_thresh': 17.290532154897377, 'sideways_atr_min_pct': 0.012012552899312908, 'sideways_atr_max_pct': 0.04521432694236713, 'sideways_tp_mult': 1.963276601827467, 'sideways_tsl_mult': 0.9687656360487085, 'sideways_time_stop': 17, 'sideways_use_sma': True, 'sideways_use_ema': True, 'sideways_use_atr': False, 'sideways_use_adx': True, 'sideways_use_spike': True, 'sideways_rsi_required': False}.
[I 2025-09-01 14:06:26,694] Trial 77 finished with values: [-1000000000.0, 1000000000.0] and parameters: {'p_sma': 16, 'p_std': 15, 'p_atr': 12, 'p_adx': 29, 'rsi_period': 65, 'ema1': 26, 'ema2': 43, 'slip_atr_k': 0.2199741154669011, 'slip_spread_k': 0.5590454866029073, 'spread_hl_frac': 0.046908230263832285, 'bb_std_mult': 2.400085022807369, 'rsi_os': 20, 'rsi_ob': 62, 'vol_spike': 0.23682476813995623, 'adx_thresh': 28.513052394843267, 'atr_min_pct': 0.007524782692170834, 'atr_max_pct': 0.0789779330496286, 'tp_mult': 2.1658608443852816, 'tsl_mult': 0.9738212872073737, 'strategy': 'breakout', 'time_stop': 133, 'use_sma': False, 'use_atr': False, 'use_adx': False, 'use_ema': False, 'use_spike': False, 'rsi_required': True, 'edge_k': 0.5970027238350197, 'edge_cap': 0.8509358152995194, 'bull_strategy': 'breakout', 'bull_bb_std_mult': 1.4707760437428228, 'bull_rsi_os': 23, 'bull_rsi_ob': 53, 'bull_adx_thresh': 26.923620892580534, 'bull_atr_min_pct': 0.01592391826072815, 'bull_atr_max_pct': 0.03836297853143084, 'bull_tp_mult': 1.1800567594075173, 'bull_tsl_mult': 0.8780591093246798, 'bull_time_stop': 40, 'bull_use_sma': False, 'bull_use_ema': True, 'bull_use_atr': False, 'bull_use_adx': False, 'bull_use_spike': False, 'bull_rsi_required': True, 'bear_strategy': 'breakout', 'bear_bb_std_mult': 2.153703147472156, 'bear_rsi_os': 50, 'bear_rsi_ob': 73, 'bear_adx_thresh': 7.335290036144903, 'bear_atr_min_pct': 0.02833302923878222, 'bear_atr_max_pct': 0.12326418636436856, 'bear_tp_mult': 1.977724921441389, 'bear_tsl_mult': 0.7705347504519398, 'bear_time_stop': 133, 'bear_use_sma': False, 'bear_use_ema': True, 'bear_use_atr': False, 'bear_use_adx': False, 'bear_use_spike': False, 'bear_rsi_required': True, 'sideways_strategy': 'mean_reversion', 'sideways_bb_std_mult': 0.6661212213356219, 'sideways_rsi_os': 35, 'sideways_rsi_ob': 65, 'sideways_adx_thresh': 32.656521804616084, 'sideways_atr_min_pct': 0.011804475088510477, 'sideways_atr_max_pct': 0.044985113222764966, 'sideways_tp_mult': 2.7039204215866524, 'sideways_tsl_mult': 0.9775559502685913, 'sideways_time_stop': 123, 'sideways_use_sma': True, 'sideways_use_ema': True, 'sideways_use_atr': False, 'sideways_use_adx': True, 'sideways_use_spike': True, 'sideways_rsi_required': False}.
[I 2025-09-01 14:06:26,841] Trial 75 finished with values: [-1000000000.0, 1000000000.0] and parameters: {'p_sma': 24, 'p_std': 6, 'p_atr': 13, 'p_adx': 27, 'rsi_period': 71, 'ema1': 26, 'ema2': 42, 'slip_atr_k': 0.05008546143004941, 'slip_spread_k': 0.565764333338342, 'spread_hl_frac': 0.0002017933989348318, 'bb_std_mult': 2.3597180885585236, 'rsi_os': 25, 'rsi_ob': 62, 'vol_spike': 0.2386632252482704, 'adx_thresh': 33.09636586177229, 'atr_min_pct': 0.008371996619851144, 'atr_max_pct': 0.06633130498516428, 'tp_mult': 1.982748561967199, 'tsl_mult': 0.6481737818307407, 'strategy': 'breakout', 'time_stop': 131, 'use_sma': False, 'use_atr': False, 'use_adx': False, 'use_ema': False, 'use_spike': False, 'rsi_required': True, 'edge_k': 0.4818282959184622, 'edge_cap': 0.8550039022368726, 'bull_strategy': 'breakout', 'bull_bb_std_mult': 1.4645260401770726, 'bull_rsi_os': 16, 'bull_rsi_ob': 45, 'bull_adx_thresh': 8.387987556774782, 'bull_atr_min_pct': 0.00816446823193155, 'bull_atr_max_pct': 0.08509500346091743, 'bull_tp_mult': 2.332471533313757, 'bull_tsl_mult': 0.8729200881637992, 'bull_time_stop': 19, 'bull_use_sma': False, 'bull_use_ema': True, 'bull_use_atr': False, 'bull_use_adx': True, 'bull_use_spike': True, 'bull_rsi_required': True, 'bear_strategy': 'breakout', 'bear_bb_std_mult': 1.9791573358244223, 'bear_rsi_os': 51, 'bear_rsi_ob': 47, 'bear_adx_thresh': 5.052317746292415, 'bear_atr_min_pct': 0.014694454880811853, 'bear_atr_max_pct': 0.033634611436824446, 'bear_tp_mult': 1.4946501494660562, 'bear_tsl_mult': 0.8265523372178061, 'bear_time_stop': 207, 'bear_use_sma': False, 'bear_use_ema': True, 'bear_use_atr': False, 'bear_use_adx': False, 'bear_use_spike': False, 'bear_rsi_required': True, 'sideways_strategy': 'mean_reversion', 'sideways_bb_std_mult': 0.6308251912656474, 'sideways_rsi_os': 34, 'sideways_rsi_ob': 78, 'sideways_adx_thresh': 34.67836558764388, 'sideways_atr_min_pct': 0.015206535436967858, 'sideways_atr_max_pct': 0.05600558202124983, 'sideways_tp_mult': 2.549533371897154, 'sideways_tsl_mult': 0.9660487416271148, 'sideways_time_stop': 122, 'sideways_use_sma': True, 'sideways_use_ema': True, 'sideways_use_atr': False, 'sideways_use_adx': True, 'sideways_use_spike': True, 'sideways_rsi_required': False}.
[I 2025-09-01 14:06:27,234] Trial 74 finished with values: [-1000000000.0, 1000000000.0] and parameters: {'p_sma': 24, 'p_std': 6, 'p_atr': 14, 'p_adx': 27, 'rsi_period': 65, 'ema1': 29, 'ema2': 48, 'slip_atr_k': 0.020323720382586362, 'slip_spread_k': 0.5518875432025334, 'spread_hl_frac': 0.04357784027824124, 'bb_std_mult': 2.3991604613417907, 'rsi_os': 12, 'rsi_ob': 90, 'vol_spike': 0.2393111535151587, 'adx_thresh': 31.44083773825436, 'atr_min_pct': 0.014693635722394504, 'atr_max_pct': 0.039130587590050815, 'tp_mult': 2.1512611110714146, 'tsl_mult': 0.6326535602728771, 'strategy': 'breakout', 'time_stop': 96, 'use_sma': False, 'use_atr': True, 'use_adx': False, 'use_ema': False, 'use_spike': True, 'rsi_required': False, 'edge_k': 0.3893693148211663, 'edge_cap': 0.9218942305788864, 'bull_strategy': 'breakout', 'bull_bb_std_mult': 1.4348389467633629, 'bull_rsi_os': 16, 'bull_rsi_ob': 53, 'bull_adx_thresh': 16.232110399288928, 'bull_atr_min_pct': 0.007870606676032638, 'bull_atr_max_pct': 0.02983626061341161, 'bull_tp_mult': 1.2384407262844472, 'bull_tsl_mult': 0.9056418590636962, 'bull_time_stop': 16, 'bull_use_sma': False, 'bull_use_ema': True, 'bull_use_atr': False, 'bull_use_adx': True, 'bull_use_spike': False, 'bull_rsi_required': True, 'bear_strategy': 'mean_reversion', 'bear_bb_std_mult': 1.7326731943577436, 'bear_rsi_os': 53, 'bear_rsi_ob': 72, 'bear_adx_thresh': 5.4980468837015, 'bear_atr_min_pct': 0.014205487169120908, 'bear_atr_max_pct': 0.12381994737061364, 'bear_tp_mult': 1.3230890645340716, 'bear_tsl_mult': 0.6970712689464408, 'bear_time_stop': 209, 'bear_use_sma': False, 'bear_use_ema': True, 'bear_use_atr': False, 'bear_use_adx': True, 'bear_use_spike': False, 'bear_rsi_required': False, 'sideways_strategy': 'mean_reversion', 'sideways_bb_std_mult': 0.7067395584215067, 'sideways_rsi_os': 42, 'sideways_rsi_ob': 71, 'sideways_adx_thresh': 17.017231276079837, 'sideways_atr_min_pct': 0.01578460776170576, 'sideways_atr_max_pct': 0.038298709329833855, 'sideways_tp_mult': 2.899357389448941, 'sideways_tsl_mult': 0.9683650830713183, 'sideways_time_stop': 93, 'sideways_use_sma': True, 'sideways_use_ema': True, 'sideways_use_atr': False, 'sideways_use_adx': True, 'sideways_use_spike': True, 'sideways_rsi_required': True}.
[I 2025-09-01 14:07:04,564] Trial 81 finished with values: [-0.09928723413705343, 0.09904718504791571] and parameters: {'p_sma': 20, 'p_std': 39, 'p_atr': 15, 'p_adx': 30, 'rsi_period': 19, 'ema1': 28, 'ema2': 37, 'slip_atr_k': 0.12261958984482164, 'slip_spread_k': 0.6358421383203174, 'spread_hl_frac': 0.04464436889540381, 'bb_std_mult': 1.959177122824774, 'rsi_os': 19, 'rsi_ob': 55, 'vol_spike': 0.02998997381865999, 'adx_thresh': 24.435518016334115, 'atr_min_pct': 0.010722591000929541, 'atr_max_pct': 0.055492137946671106, 'tp_mult': 2.408218805158096, 'tsl_mult': 0.5214476197916047, 'strategy': 'breakout', 'time_stop': 112, 'use_sma': False, 'use_atr': False, 'use_adx': False, 'use_ema': False, 'use_spike': False, 'rsi_required': True, 'edge_k': 0.19042287215324177, 'edge_cap': 0.9977916975052721, 'bull_strategy': 'breakout', 'bull_bb_std_mult': 1.5790565369910672, 'bull_rsi_os': 11, 'bull_rsi_ob': 49, 'bull_adx_thresh': 6.465513510999873, 'bull_atr_min_pct': 0.006409321812054678, 'bull_atr_max_pct': 0.12010772329676384, 'bull_tp_mult': 1.0719935998950343, 'bull_tsl_mult': 0.8299484477294997, 'bull_time_stop': 7, 'bull_use_sma': False, 'bull_use_ema': True, 'bull_use_atr': False, 'bull_use_adx': False, 'bull_use_spike': True, 'bull_rsi_required': True, 'bear_strategy': 'breakout', 'bear_bb_std_mult': 1.1148727712437776, 'bear_rsi_os': 55, 'bear_rsi_ob': 49, 'bear_adx_thresh': 7.89246815295846, 'bear_atr_min_pct': 0.0022205967304541325, 'bear_atr_max_pct': 0.086289513638266, 'bear_tp_mult': 1.7385292974888102, 'bear_tsl_mult': 0.6555825309685843, 'bear_time_stop': 244, 'bear_use_sma': False, 'bear_use_ema': True, 'bear_use_atr': False, 'bear_use_adx': False, 'bear_use_spike': False, 'bear_rsi_required': True, 'sideways_strategy': 'mean_reversion', 'sideways_bb_std_mult': 0.9967613058492495, 'sideways_rsi_os': 37, 'sideways_rsi_ob': 80, 'sideways_adx_thresh': 32.2347791936933, 'sideways_atr_min_pct': 0.02596967434415009, 'sideways_atr_max_pct': 0.14994077621355995, 'sideways_tp_mult': 1.7601086148595377, 'sideways_tsl_mult': 0.21993697841692905, 'sideways_time_stop': 15, 'sideways_use_sma': True, 'sideways_use_ema': True, 'sideways_use_atr': False, 'sideways_use_adx': False, 'sideways_use_spike': False, 'sideways_rsi_required': False}.
[I 2025-09-01 14:07:05,633] Trial 78 finished with values: [-1000000000.0, 1000000000.0] and parameters: {'p_sma': 21, 'p_std': 38, 'p_atr': 13, 'p_adx': 29, 'rsi_period': 71, 'ema1': 26, 'ema2': 47, 'slip_atr_k': 0.049858309574155796, 'slip_spread_k': 0.5423680719960284, 'spread_hl_frac': 0.04757076470079806, 'bb_std_mult': 1.9469464184174885, 'rsi_os': 17, 'rsi_ob': 62, 'vol_spike': 0.027596964024728325, 'adx_thresh': 25.994280353245074, 'atr_min_pct': 0.008016044480500764, 'atr_max_pct': 0.05551740744001803, 'tp_mult': 2.4252858607308894, 'tsl_mult': 0.528922758382397, 'strategy': 'breakout', 'time_stop': 130, 'use_sma': False, 'use_atr': False, 'use_adx': False, 'use_ema': False, 'use_spike': False, 'rsi_required': True, 'edge_k': 0.6053194717262828, 'edge_cap': 0.9973518865380746, 'bull_strategy': 'breakout', 'bull_bb_std_mult': 1.439846259439833, 'bull_rsi_os': 16, 'bull_rsi_ob': 45, 'bull_adx_thresh': 7.016331504966881, 'bull_atr_min_pct': 0.01871164328538172, 'bull_atr_max_pct': 0.010644749965212835, 'bull_tp_mult': 1.5965939549327632, 'bull_tsl_mult': 0.870357343706078, 'bull_time_stop': 41, 'bull_use_sma': False, 'bull_use_ema': True, 'bull_use_atr': False, 'bull_use_adx': False, 'bull_use_spike': True, 'bull_rsi_required': True, 'bear_strategy': 'breakout', 'bear_bb_std_mult': 2.148541960534528, 'bear_rsi_os': 52, 'bear_rsi_ob': 72, 'bear_adx_thresh': 8.010235433921757, 'bear_atr_min_pct': 0.028523670912336704, 'bear_atr_max_pct': 0.12632157535449637, 'bear_tp_mult': 1.5068361700539246, 'bear_tsl_mult': 0.7745968724848986, 'bear_time_stop': 132, 'bear_use_sma': False, 'bear_use_ema': True, 'bear_use_atr': False, 'bear_use_adx': False, 'bear_use_spike': False, 'bear_rsi_required': True, 'sideways_strategy': 'mean_reversion', 'sideways_bb_std_mult': 0.9328191155990582, 'sideways_rsi_os': 35, 'sideways_rsi_ob': 57, 'sideways_adx_thresh': 34.96685254924575, 'sideways_atr_min_pct': 0.015616231001555406, 'sideways_atr_max_pct': 0.04602161364185141, 'sideways_tp_mult': 2.7235773375676815, 'sideways_tsl_mult': 0.4322150985485725, 'sideways_time_stop': 124, 'sideways_use_sma': True, 'sideways_use_ema': True, 'sideways_use_atr': False, 'sideways_use_adx': True, 'sideways_use_spike': True, 'sideways_rsi_required': False}.
[I 2025-09-01 14:07:06,485] Trial 79 finished with values: [-1000000000.0, 1000000000.0] and parameters: {'p_sma': 21, 'p_std': 54, 'p_atr': 15, 'p_adx': 30, 'rsi_period': 81, 'ema1': 28, 'ema2': 47, 'slip_atr_k': 0.12237588757553144, 'slip_spread_k': 0.48516473363933826, 'spread_hl_frac': 0.043592853844131266, 'bb_std_mult': 1.140503892719587, 'rsi_os': 13, 'rsi_ob': 90, 'vol_spike': 0.024023947168393824, 'adx_thresh': 30.913930827167555, 'atr_min_pct': 0.01001614601462385, 'atr_max_pct': 0.055363382795523525, 'tp_mult': 2.4168817645354332, 'tsl_mult': 0.7013146413050039, 'strategy': 'breakout', 'time_stop': 109, 'use_sma': False, 'use_atr': True, 'use_adx': False, 'use_ema': False, 'use_spike': False, 'rsi_required': False, 'edge_k': 0.18997664933872072, 'edge_cap': 0.9100253542720875, 'bull_strategy': 'breakout', 'bull_bb_std_mult': 0.6841237777961644, 'bull_rsi_os': 18, 'bull_rsi_ob': 71, 'bull_adx_thresh': 28.30503241747046, 'bull_atr_min_pct': 0.02961106869749963, 'bull_atr_max_pct': 0.041773256950522246, 'bull_tp_mult': 2.1132872647759195, 'bull_tsl_mult': 0.821182504607007, 'bull_time_stop': 54, 'bull_use_sma': False, 'bull_use_ema': True, 'bull_use_atr': False, 'bull_use_adx': False, 'bull_use_spike': False, 'bull_rsi_required': True, 'bear_strategy': 'mean_reversion', 'bear_bb_std_mult': 2.1294695396339485, 'bear_rsi_os': 55, 'bear_rsi_ob': 49, 'bear_adx_thresh': 7.6615579329069305, 'bear_atr_min_pct': 0.009046938658366963, 'bear_atr_max_pct': 0.08250811522078025, 'bear_tp_mult': 1.2459298806931804, 'bear_tsl_mult': 0.6534210298239923, 'bear_time_stop': 247, 'bear_use_sma': False, 'bear_use_ema': True, 'bear_use_atr': False, 'bear_use_adx': False, 'bear_use_spike': False, 'bear_rsi_required': False, 'sideways_strategy': 'mean_reversion', 'sideways_bb_std_mult': 0.9115165899070803, 'sideways_rsi_os': 37, 'sideways_rsi_ob': 84, 'sideways_adx_thresh': 17.549356336176384, 'sideways_atr_min_pct': 0.028749632603413608, 'sideways_atr_max_pct': 0.03169071571522508, 'sideways_tp_mult': 2.724613581556611, 'sideways_tsl_mult': 0.4242574653081766, 'sideways_time_stop': 69, 'sideways_use_sma': True, 'sideways_use_ema': True, 'sideways_use_atr': False, 'sideways_use_adx': False, 'sideways_use_spike': True, 'sideways_rsi_required': True}.
