[I 2025-09-01 14:33:30,727] Trial 243 finished with values: [-1000000000.0, 1000000000.0] and parameters: {'p_sma': 51, 'p_std': 10, 'p_atr': 13, 'p_adx': 21, 'rsi_period': 45, 'ema1': 12, 'ema2': 22, 'slip_atr_k': 0.02821629588145412, 'slip_spread_k': 0.8766966802367235, 'spread_hl_frac': 0.041345456303823455, 'bb_std_mult': 2.5876158710148, 'rsi_os': 27, 'rsi_ob': 84, 'vol_spike': 0.014253216792886183, 'adx_thresh': 29.93343916792531, 'atr_min_pct': 0.011267151315909083, 'atr_max_pct': 0.08221577545340648, 'tp_mult': 2.6352558601088067, 'tsl_mult': 0.5361003886670535, 'strategy': 'mean_reversion', 'time_stop': 85, 'use_sma': False, 'use_atr': True, 'use_adx': False, 'use_ema': False, 'use_spike': True, 'rsi_required': False, 'edge_k': 1.9188134406039832, 'edge_cap': 0.36331185222055595, 'bull_strategy': 'breakout', 'bull_bb_std_mult': 1.6094349191256208, 'bull_rsi_os': 48, 'bull_rsi_ob': 54, 'bull_adx_thresh': 13.634469678355302, 'bull_atr_min_pct': 0.025760031661364827, 'bull_atr_max_pct': 0.030052726746776535, 'bull_tp_mult': 1.0574393782785279, 'bull_tsl_mult': 0.7639813307020084, 'bull_time_stop': 258, 'bull_use_sma': True, 'bull_use_ema': True, 'bull_use_atr': True, 'bull_use_adx': True, 'bull_use_spike': False, 'bull_rsi_required': True, 'bear_strategy': 'breakout', 'bear_bb_std_mult': 2.1289737763465006, 'bear_rsi_os': 25, 'bear_rsi_ob': 69, 'bear_adx_thresh': 15.599022549229652, 'bear_atr_min_pct': 0.016273388573584777, 'bear_atr_max_pct': 0.01642243071583081, 'bear_tp_mult': 1.8876715960823987, 'bear_tsl_mult': 0.6548502338955868, 'bear_time_stop': 214, 'bear_use_sma': True, 'bear_use_ema': True, 'bear_use_atr': False, 'bear_use_adx': False, 'bear_use_spike': True, 'bear_rsi_required': False, 'sideways_strategy': 'mean_reversion', 'sideways_bb_std_mult': 1.2569903161083666, 'sideways_rsi_os': 7, 'sideways_rsi_ob': 80, 'sideways_adx_thresh': 33.88143646499584, 'sideways_atr_min_pct': 0.026235521088155002, 'sideways_atr_max_pct': 0.10061973059814723, 'sideways_tp_mult': 2.6144446084743036, 'sideways_tsl_mult': 0.3124775825685915, 'sideways_time_stop': 85, 'sideways_use_sma': True, 'sideways_use_ema': False, 'sideways_use_atr': False, 'sideways_use_adx': True, 'sideways_use_spike': True, 'sideways_rsi_required': False}.
[I 2025-09-01 14:33:31,112] Trial 246 finished with values: [-1000000000.0, 1000000000.0] and parameters: {'p_sma': 46, 'p_std': 37, 'p_atr': 13, 'p_adx': 22, 'rsi_period': 38, 'ema1': 28, 'ema2': 51, 'slip_atr_k': 0.03632362385791812, 'slip_spread_k': 0.4983650572013393, 'spread_hl_frac': 0.00784497271287553, 'bb_std_mult': 2.530984947214821, 'rsi_os': 8, 'rsi_ob': 84, 'vol_spike': 0.01301696926901869, 'adx_thresh': 27.822988942590783, 'atr_min_pct': 0.007985232667207232, 'atr_max_pct': 0.08412604030842706, 'tp_mult': 1.825859531262368, 'tsl_mult': 0.5388593138526132, 'strategy': 'breakout', 'time_stop': 92, 'use_sma': False, 'use_atr': False, 'use_adx': False, 'use_ema': False, 'use_spike': False, 'rsi_required': True, 'edge_k': 0.536773158972942, 'edge_cap': 0.5344251568369827, 'bull_strategy': 'breakout', 'bull_bb_std_mult': 1.4675586963778302, 'bull_rsi_os': 47, 'bull_rsi_ob': 88, 'bull_adx_thresh': 31.327629878196888, 'bull_atr_min_pct': 0.024020379376940577, 'bull_atr_max_pct': 0.043144473340067845, 'bull_tp_mult': 1.0796534667249846, 'bull_tsl_mult': 0.9247671133718984, 'bull_time_stop': 259, 'bull_use_sma': False, 'bull_use_ema': True, 'bull_use_atr': False, 'bull_use_adx': True, 'bull_use_spike': True, 'bull_rsi_required': True, 'bear_strategy': 'breakout', 'bear_bb_std_mult': 2.7837431766595686, 'bear_rsi_os': 25, 'bear_rsi_ob': 69, 'bear_adx_thresh': 17.262885416236664, 'bear_atr_min_pct': 0.006538101573153172, 'bear_atr_max_pct': 0.016547343323967196, 'bear_tp_mult': 1.8991247706510104, 'bear_tsl_mult': 0.2061391465175822, 'bear_time_stop': 137, 'bear_use_sma': False, 'bear_use_ema': False, 'bear_use_atr': False, 'bear_use_adx': False, 'bear_use_spike': False, 'bear_rsi_required': True, 'sideways_strategy': 'breakout', 'sideways_bb_std_mult': 1.3333589402726345, 'sideways_rsi_os': 32, 'sideways_rsi_ob': 79, 'sideways_adx_thresh': 20.65950574385224, 'sideways_atr_min_pct': 0.017719207471386257, 'sideways_atr_max_pct': 0.0372100274186337, 'sideways_tp_mult': 2.621340685309314, 'sideways_tsl_mult': 0.5221584227280104, 'sideways_time_stop': 73, 'sideways_use_sma': False, 'sideways_use_ema': True, 'sideways_use_atr': True, 'sideways_use_adx': True, 'sideways_use_spike': False, 'sideways_rsi_required': True}.
[I 2025-09-01 14:33:31,655] Trial 244 finished with values: [-0.015449574504640462, 0.01987436779071692] and parameters: {'p_sma': 36, 'p_std': 10, 'p_atr': 13, 'p_adx': 22, 'rsi_period': 56, 'ema1': 8, 'ema2': 51, 'slip_atr_k': 0.08662303356803461, 'slip_spread_k': 0.4985039924827535, 'spread_hl_frac': 0.021260522545564008, 'bb_std_mult': 2.5326963688865543, 'rsi_os': 8, 'rsi_ob': 84, 'vol_spike': 0.1120543286766889, 'adx_thresh': 28.515119862389096, 'atr_min_pct': 0.001906300155952943, 'atr_max_pct': 0.08322252744044427, 'tp_mult': 2.3188033589065213, 'tsl_mult': 0.5519838733123504, 'strategy': 'breakout', 'time_stop': 88, 'use_sma': False, 'use_atr': True, 'use_adx': False, 'use_ema': False, 'use_spike': False, 'rsi_required': True, 'edge_k': 0.5308799781714935, 'edge_cap': 0.9153488255086499, 'bull_strategy': 'breakout', 'bull_bb_std_mult': 1.4314224136037643, 'bull_rsi_os': 17, 'bull_rsi_ob': 94, 'bull_adx_thresh': 34.36231037041186, 'bull_atr_min_pct': 0.003968290281053234, 'bull_atr_max_pct': 0.04272171837585841, 'bull_tp_mult': 1.0767218817401942, 'bull_tsl_mult': 0.7632639882312697, 'bull_time_stop': 248, 'bull_use_sma': True, 'bull_use_ema': True, 'bull_use_atr': False, 'bull_use_adx': True, 'bull_use_spike': True, 'bull_rsi_required': True, 'bear_strategy': 'breakout', 'bear_bb_std_mult': 2.927803027241074, 'bear_rsi_os': 53, 'bear_rsi_ob': 95, 'bear_adx_thresh': 5.438568850240855, 'bear_atr_min_pct': 0.006419381929539378, 'bear_atr_max_pct': 0.08984012176651465, 'bear_tp_mult': 1.6717556849098596, 'bear_tsl_mult': 0.6186441930243143, 'bear_time_stop': 43, 'bear_use_sma': True, 'bear_use_ema': True, 'bear_use_atr': False, 'bear_use_adx': False, 'bear_use_spike': True, 'bear_rsi_required': True, 'sideways_strategy': 'mean_reversion', 'sideways_bb_std_mult': 1.3474790088439266, 'sideways_rsi_os': 24, 'sideways_rsi_ob': 93, 'sideways_adx_thresh': 20.527217174603226, 'sideways_atr_min_pct': 0.026673924774519367, 'sideways_atr_max_pct': 0.03297500894332885, 'sideways_tp_mult': 2.6208615488971456, 'sideways_tsl_mult': 0.8936829774123811, 'sideways_time_stop': 78, 'sideways_use_sma': True, 'sideways_use_ema': True, 'sideways_use_atr': False, 'sideways_use_adx': True, 'sideways_use_spike': False, 'sideways_rsi_required': False}.
[I 2025-09-01 14:33:31,900] Trial 245 finished with values: [-1000000000.0, 1000000000.0] and parameters: {'p_sma': 24, 'p_std': 37, 'p_atr': 13, 'p_adx': 22, 'rsi_period': 44, 'ema1': 28, 'ema2': 50, 'slip_atr_k': 0.03545543976121815, 'slip_spread_k': 0.5023461481465427, 'spread_hl_frac': 0.042380840107564724, 'bb_std_mult': 2.5515344107368714, 'rsi_os': 27, 'rsi_ob': 84, 'vol_spike': 0.014361670500883453, 'adx_thresh': 28.4956057758999, 'atr_min_pct': 0.028292510554300328, 'atr_max_pct': 0.08387206841955684, 'tp_mult': 2.7854323919544806, 'tsl_mult': 0.5469259576736235, 'strategy': 'breakout', 'time_stop': 90, 'use_sma': False, 'use_atr': False, 'use_adx': False, 'use_ema': False, 'use_spike': False, 'rsi_required': True, 'edge_k': 0.4517200383634625, 'edge_cap': 0.9135138618445224, 'bull_strategy': 'breakout', 'bull_bb_std_mult': 1.4428980514415106, 'bull_rsi_os': 50, 'bull_rsi_ob': 87, 'bull_adx_thresh': 14.080565509273242, 'bull_atr_min_pct': 0.02393977274534131, 'bull_atr_max_pct': 0.09327819845335006, 'bull_tp_mult': 1.072156542488868, 'bull_tsl_mult': 0.9162252693253707, 'bull_time_stop': 254, 'bull_use_sma': False, 'bull_use_ema': True, 'bull_use_atr': False, 'bull_use_adx': True, 'bull_use_spike': True, 'bull_rsi_required': True, 'bear_strategy': 'breakout', 'bear_bb_std_mult': 2.147901457019524, 'bear_rsi_os': 25, 'bear_rsi_ob': 95, 'bear_adx_thresh': 5.495557525252632, 'bear_atr_min_pct': 0.006502420312985767, 'bear_atr_max_pct': 0.017171801803041065, 'bear_tp_mult': 1.671641361203524, 'bear_tsl_mult': 0.6464840567408752, 'bear_time_stop': 42, 'bear_use_sma': False, 'bear_use_ema': True, 'bear_use_atr': False, 'bear_use_adx': False, 'bear_use_spike': False, 'bear_rsi_required': True, 'sideways_strategy': 'breakout', 'sideways_bb_std_mult': 1.3488990573465605, 'sideways_rsi_os': 25, 'sideways_rsi_ob': 45, 'sideways_adx_thresh': 24.073248982762124, 'sideways_atr_min_pct': 0.006733697792085082, 'sideways_atr_max_pct': 0.1078012659856454, 'sideways_tp_mult': 1.6515018274377689, 'sideways_tsl_mult': 0.17670059907776736, 'sideways_time_stop': 78, 'sideways_use_sma': False, 'sideways_use_ema': True, 'sideways_use_atr': True, 'sideways_use_adx': True, 'sideways_use_spike': False, 'sideways_rsi_required': True}.
[I 2025-09-01 14:34:07,045] Trial 248 finished with values: [-0.015412506636057866, 0.0188858666412809] and parameters: {'p_sma': 58, 'p_std': 23, 'p_atr': 15, 'p_adx': 22, 'rsi_period': 18, 'ema1': 28, 'ema2': 41, 'slip_atr_k': 0.04130596217196855, 'slip_spread_k': 0.44417986299356527, 'spread_hl_frac': 0.03966457659099023, 'bb_std_mult': 1.6728370828576251, 'rsi_os': 48, 'rsi_ob': 77, 'vol_spike': 0.16541825065452034, 'adx_thresh': 28.58467810826725, 'atr_min_pct': 0.028278982791837468, 'atr_max_pct': 0.14714245923795172, 'tp_mult': 2.3279043301767857, 'tsl_mult': 0.6158252056919333, 'strategy': 'breakout', 'time_stop': 95, 'use_sma': False, 'use_atr': False, 'use_adx': False, 'use_ema': True, 'use_spike': False, 'rsi_required': True, 'edge_k': 1.2559859939267866, 'edge_cap': 0.972125855520844, 'bull_strategy': 'mean_reversion', 'bull_bb_std_mult': 0.7956545119077145, 'bull_rsi_os': 17, 'bull_rsi_ob': 55, 'bull_adx_thresh': 28.562141481489654, 'bull_atr_min_pct': 0.0027891432625234557, 'bull_atr_max_pct': 0.06413567301322708, 'bull_tp_mult': 1.6994730275584775, 'bull_tsl_mult': 0.8994852801971437, 'bull_time_stop': 25, 'bull_use_sma': False, 'bull_use_ema': True, 'bull_use_atr': False, 'bull_use_adx': True, 'bull_use_spike': False, 'bull_rsi_required': True, 'bear_strategy': 'breakout', 'bear_bb_std_mult': 2.031316782514719, 'bear_rsi_os': 53, 'bear_rsi_ob': 95, 'bear_adx_thresh': 5.487105840325641, 'bear_atr_min_pct': 0.005242020748118089, 'bear_atr_max_pct': 0.0899104719603738, 'bear_tp_mult': 1.675132889180347, 'bear_tsl_mult': 0.6391297159440833, 'bear_time_stop': 233, 'bear_use_sma': False, 'bear_use_ema': True, 'bear_use_atr': False, 'bear_use_adx': False, 'bear_use_spike': False, 'bear_rsi_required': True, 'sideways_strategy': 'mean_reversion', 'sideways_bb_std_mult': 1.3713710778174966, 'sideways_rsi_os': 24, 'sideways_rsi_ob': 89, 'sideways_adx_thresh': 5.436399032138496, 'sideways_atr_min_pct': 0.01058392929871256, 'sideways_atr_max_pct': 0.127013595007549, 'sideways_tp_mult': 2.3505603823932657, 'sideways_tsl_mult': 0.18097763262069638, 'sideways_time_stop': 292, 'sideways_use_sma': True, 'sideways_use_ema': True, 'sideways_use_atr': False, 'sideways_use_adx': True, 'sideways_use_spike': False, 'sideways_rsi_required': False}.
[I 2025-09-01 14:34:07,476] Trial 249 finished with values: [-1000000000.0, 1000000000.0] and parameters: {'p_sma': 24, 'p_std': 45, 'p_atr': 13, 'p_adx': 12, 'rsi_period': 57, 'ema1': 28, 'ema2': 40, 'slip_atr_k': 0.04229537885672506, 'slip_spread_k': 0.462429884631538, 'spread_hl_frac': 0.04212125446673235, 'bb_std_mult': 1.9762473191677747, 'rsi_os': 40, 'rsi_ob': 82, 'vol_spike': 0.0062827016878604924, 'adx_thresh': 28.328960534548983, 'atr_min_pct': 0.008020155254964832, 'atr_max_pct': 0.04184107334033776, 'tp_mult': 1.1564614187273445, 'tsl_mult': 0.597247686018844, 'strategy': 'breakout', 'time_stop': 96, 'use_sma': False, 'use_atr': False, 'use_adx': True, 'use_ema': True, 'use_spike': False, 'rsi_required': True, 'edge_k': 0.20428264923895179, 'edge_cap': 0.9739651198649351, 'bull_strategy': 'mean_reversion', 'bull_bb_std_mult': 2.7844239178347445, 'bull_rsi_os': 17, 'bull_rsi_ob': 56, 'bull_adx_thresh': 11.312322271783833, 'bull_atr_min_pct': 0.0029059374244235926, 'bull_atr_max_pct': 0.09216545349237112, 'bull_tp_mult': 2.289868334331759, 'bull_tsl_mult': 0.34431374293466716, 'bull_time_stop': 157, 'bull_use_sma': False, 'bull_use_ema': True, 'bull_use_atr': False, 'bull_use_adx': True, 'bull_use_spike': True, 'bull_rsi_required': True, 'bear_strategy': 'breakout', 'bear_bb_std_mult': 3.5531369845961045, 'bear_rsi_os': 52, 'bear_rsi_ob': 75, 'bear_adx_thresh': 5.636646083602711, 'bear_atr_min_pct': 0.007483955566366539, 'bear_atr_max_pct': 0.018956536324019745, 'bear_tp_mult': 2.5683100195616233, 'bear_tsl_mult': 0.7756376401990005, 'bear_time_stop': 231, 'bear_use_sma': False, 'bear_use_ema': True, 'bear_use_atr': False, 'bear_use_adx': False, 'bear_use_spike': False, 'bear_rsi_required': True, 'sideways_strategy': 'breakout', 'sideways_bb_std_mult': 1.3644272034220162, 'sideways_rsi_os': 25, 'sideways_rsi_ob': 89, 'sideways_adx_thresh': 34.495261346810935, 'sideways_atr_min_pct': 0.008127087911659534, 'sideways_atr_max_pct': 0.12686143183414578, 'sideways_tp_mult': 2.928513188709878, 'sideways_tsl_mult': 0.8826430907005469, 'sideways_time_stop': 79, 'sideways_use_sma': False, 'sideways_use_ema': True, 'sideways_use_atr': False, 'sideways_use_adx': True, 'sideways_use_spike': False, 'sideways_rsi_required': True}.
[I 2025-09-01 14:34:07,691] Trial 247 finished with values: [-1000000000.0, 1000000000.0] and parameters: {'p_sma': 24, 'p_std': 11, 'p_atr': 15, 'p_adx': 22, 'rsi_period': 74, 'ema1': 28, 'ema2': 41, 'slip_atr_k': 0.04109308291825243, 'slip_spread_k': 0.5010677567655837, 'spread_hl_frac': 0.04210104795224994, 'bb_std_mult': 2.5154764429854892, 'rsi_os': 8, 'rsi_ob': 77, 'vol_spike': 0.29327376110988135, 'adx_thresh': 27.787521489577546, 'atr_min_pct': 0.008075242279881517, 'atr_max_pct': 0.06684553046482969, 'tp_mult': 1.6709193149742232, 'tsl_mult': 0.6154708366295271, 'strategy': 'breakout', 'time_stop': 93, 'use_sma': False, 'use_atr': False, 'use_adx': False, 'use_ema': True, 'use_spike': False, 'rsi_required': True, 'edge_k': 0.535770992621505, 'edge_cap': 0.937729780709807, 'bull_strategy': 'mean_reversion', 'bull_bb_std_mult': 1.4489023889342627, 'bull_rsi_os': 17, 'bull_rsi_ob': 56, 'bull_adx_thresh': 10.871287943046472, 'bull_atr_min_pct': 0.005286156191086195, 'bull_atr_max_pct': 0.09374454450972858, 'bull_tp_mult': 1.0871431998344576, 'bull_tsl_mult': 0.9261429425486231, 'bull_time_stop': 266, 'bull_use_sma': False, 'bull_use_ema': True, 'bull_use_atr': False, 'bull_use_adx': True, 'bull_use_spike': True, 'bull_rsi_required': True, 'bear_strategy': 'breakout', 'bear_bb_std_mult': 3.5974224727465316, 'bear_rsi_os': 13, 'bear_rsi_ob': 95, 'bear_adx_thresh': 5.013118047763403, 'bear_atr_min_pct': 0.00645937102170581, 'bear_atr_max_pct': 0.13029398107967607, 'bear_tp_mult': 1.7361352811886746, 'bear_tsl_mult': 0.5612911421616971, 'bear_time_stop': 232, 'bear_use_sma': False, 'bear_use_ema': False, 'bear_use_atr': False, 'bear_use_adx': False, 'bear_use_spike': False, 'bear_rsi_required': True, 'sideways_strategy': 'breakout', 'sideways_bb_std_mult': 1.336419061555234, 'sideways_rsi_os': 32, 'sideways_rsi_ob': 92, 'sideways_adx_thresh': 33.30398728317535, 'sideways_atr_min_pct': 0.008150277417487157, 'sideways_atr_max_pct': 0.03741073456062574, 'sideways_tp_mult': 2.634590650528108, 'sideways_tsl_mult': 0.8426318333045494, 'sideways_time_stop': 74, 'sideways_use_sma': False, 'sideways_use_ema': True, 'sideways_use_atr': True, 'sideways_use_adx': True, 'sideways_use_spike': False, 'sideways_rsi_required': True}.
[I 2025-09-01 14:34:07,878] Trial 250 finished with values: [-0.02117524285117034, 0.02107062286077584] and parameters: {'p_sma': 35, 'p_std': 21, 'p_atr': 15, 'p_adx': 12, 'rsi_period': 19, 'ema1': 29, 'ema2': 40, 'slip_atr_k': 0.08007626988005034, 'slip_spread_k': 0.46154268786059166, 'spread_hl_frac': 0.021491511134152923, 'bb_std_mult': 1.9708148093005582, 'rsi_os': 48, 'rsi_ob': 57, 'vol_spike': 0.006375595942289518, 'adx_thresh': 27.12985571237734, 'atr_min_pct': 0.01910668741614998, 'atr_max_pct': 0.06670085866551302, 'tp_mult': 2.3099011053977945, 'tsl_mult': 0.5929099675059705, 'strategy': 'breakout', 'time_stop': 96, 'use_sma': False, 'use_atr': False, 'use_adx': True, 'use_ema': True, 'use_spike': False, 'rsi_required': True, 'edge_k': 0.519769316085331, 'edge_cap': 0.99877806045511, 'bull_strategy': 'mean_reversion', 'bull_bb_std_mult': 0.6812623992023985, 'bull_rsi_os': 54, 'bull_rsi_ob': 56, 'bull_adx_thresh': 10.988417094805222, 'bull_atr_min_pct': 0.0030417105594361827, 'bull_atr_max_pct': 0.036058579634109834, 'bull_tp_mult': 1.576748505955976, 'bull_tsl_mult': 0.8556239272387861, 'bull_time_stop': 25, 'bull_use_sma': False, 'bull_use_ema': False, 'bull_use_atr': False, 'bull_use_adx': True, 'bull_use_spike': False, 'bull_rsi_required': True, 'bear_strategy': 'breakout', 'bear_bb_std_mult': 3.0891176920109946, 'bear_rsi_os': 53, 'bear_rsi_ob': 54, 'bear_adx_thresh': 5.001714007261887, 'bear_atr_min_pct': 0.014850341053408597, 'bear_atr_max_pct': 0.06828302631157722, 'bear_tp_mult': 1.7371143615310922, 'bear_tsl_mult': 0.8854346327037346, 'bear_time_stop': 234, 'bear_use_sma': False, 'bear_use_ema': False, 'bear_use_atr': True, 'bear_use_adx': False, 'bear_use_spike': False, 'bear_rsi_required': True, 'sideways_strategy': 'mean_reversion', 'sideways_bb_std_mult': 1.1575663577150366, 'sideways_rsi_os': 33, 'sideways_rsi_ob': 78, 'sideways_adx_thresh': 28.910551110125596, 'sideways_atr_min_pct': 0.010735484105066159, 'sideways_atr_max_pct': 0.03478220035733923, 'sideways_tp_mult': 2.633995388407549, 'sideways_tsl_mult': 0.8632243789821625, 'sideways_time_stop': 94, 'sideways_use_sma': True, 'sideways_use_ema': True, 'sideways_use_atr': False, 'sideways_use_adx': True, 'sideways_use_spike': True, 'sideways_rsi_required': False}.
[I 2025-09-01 14:34:43,075] Trial 251 finished with values: [-0.030476035652864275, 0.030272018667664838] and parameters: {'p_sma': 19, 'p_std': 7, 'p_atr': 15, 'p_adx': 18, 'rsi_period': 70, 'ema1': 29, 'ema2': 41, 'slip_atr_k': 0.021023993432090635, 'slip_spread_k': 0.424333926960838, 'spread_hl_frac': 0.022798099741103525, 'bb_std_mult': 2.4526520950638484, 'rsi_os': 8, 'rsi_ob': 82, 'vol_spike': 0.006309915534572188, 'adx_thresh': 27.219054883338654, 'atr_min_pct': 0.020108100547486893, 'atr_max_pct': 0.06673232505694239, 'tp_mult': 2.3293468190296895, 'tsl_mult': 0.6090408950446942, 'strategy': 'breakout', 'time_stop': 197, 'use_sma': True, 'use_atr': False, 'use_adx': True, 'use_ema': True, 'use_spike': False, 'rsi_required': True, 'edge_k': 0.526384983339496, 'edge_cap': 0.9723406496152212, 'bull_strategy': 'mean_reversion', 'bull_bb_std_mult': 1.368193962314035, 'bull_rsi_os': 17, 'bull_rsi_ob': 56, 'bull_adx_thresh': 10.942663671005374, 'bull_atr_min_pct': 0.0027137853109845227, 'bull_atr_max_pct': 0.07717414508746888, 'bull_tp_mult': 2.1400192502955306, 'bull_tsl_mult': 0.566189522355504, 'bull_time_stop': 24, 'bull_use_sma': False, 'bull_use_ema': False, 'bull_use_atr': False, 'bull_use_adx': True, 'bull_use_spike': False, 'bull_rsi_required': True, 'bear_strategy': 'breakout', 'bear_bb_std_mult': 2.039704147671279, 'bear_rsi_os': 13, 'bear_rsi_ob': 77, 'bear_adx_thresh': 5.002614885730772, 'bear_atr_min_pct': 2.4729279304528534e-06, 'bear_atr_max_pct': 0.06814992612733298, 'bear_tp_mult': 1.7458524956159192, 'bear_tsl_mult': 0.7784229819406208, 'bear_time_stop': 239, 'bear_use_sma': False, 'bear_use_ema': False, 'bear_use_atr': True, 'bear_use_adx': False, 'bear_use_spike': False, 'bear_rsi_required': True, 'sideways_strategy': 'mean_reversion', 'sideways_bb_std_mult': 1.148740383942086, 'sideways_rsi_os': 33, 'sideways_rsi_ob': 62, 'sideways_adx_thresh': 28.9469775544539, 'sideways_atr_min_pct': 0.010705270222139067, 'sideways_atr_max_pct': 0.03537746324573422, 'sideways_tp_mult': 2.5629640641634013, 'sideways_tsl_mult': 0.8659606239074762, 'sideways_time_stop': 94, 'sideways_use_sma': True, 'sideways_use_ema': True, 'sideways_use_atr': False, 'sideways_use_adx': True, 'sideways_use_spike': False, 'sideways_rsi_required': False}.
