[I 2025-09-01 14:37:31,699] Trial 270 finished with values: [-1000000000.0, 1000000000.0] and parameters: {'p_sma': 23, 'p_std': 19, 'p_atr': 14, 'p_adx': 23, 'rsi_period': 64, 'ema1': 5, 'ema2': 48, 'slip_atr_k': 0.025935658866467464, 'slip_spread_k': 0.4000925372216951, 'spread_hl_frac': 0.04117429219604359, 'bb_std_mult': 3.032956952643884, 'rsi_os': 7, 'rsi_ob': 81, 'vol_spike': 0.01650423234488986, 'adx_thresh': 33.32739254638304, 'atr_min_pct': 0.0006573556150201079, 'atr_max_pct': 0.05067545040924459, 'tp_mult': 1.087029159276643, 'tsl_mult': 0.3363609572070716, 'strategy': 'breakout', 'time_stop': 82, 'use_sma': True, 'use_atr': False, 'use_adx': False, 'use_ema': False, 'use_spike': False, 'rsi_required': True, 'edge_k': 1.9928923866190003, 'edge_cap': 0.9627746741189186, 'bull_strategy': 'breakout', 'bull_bb_std_mult': 1.15785095278113, 'bull_rsi_os': 16, 'bull_rsi_ob': 55, 'bull_adx_thresh': 28.49758089885979, 'bull_atr_min_pct': 0.017084885773960015, 'bull_atr_max_pct': 0.046285880699190866, 'bull_tp_mult': 1.1008433034272826, 'bull_tsl_mult': 0.795885536049438, 'bull_time_stop': 22, 'bull_use_sma': False, 'bull_use_ema': False, 'bull_use_atr': False, 'bull_use_adx': True, 'bull_use_spike': False, 'bull_rsi_required': True, 'bear_strategy': 'breakout', 'bear_bb_std_mult': 1.2339242029454192, 'bear_rsi_os': 40, 'bear_rsi_ob': 46, 'bear_adx_thresh': 5.794816603848466, 'bear_atr_min_pct': 0.026692885699481014, 'bear_atr_max_pct': 0.07736807238175024, 'bear_tp_mult': 1.754070832711063, 'bear_tsl_mult': 0.677252369717896, 'bear_time_stop': 253, 'bear_use_sma': False, 'bear_use_ema': False, 'bear_use_atr': False, 'bear_use_adx': True, 'bear_use_spike': False, 'bear_rsi_required': True, 'sideways_strategy': 'mean_reversion', 'sideways_bb_std_mult': 2.9619010566254627, 'sideways_rsi_os': 47, 'sideways_rsi_ob': 76, 'sideways_adx_thresh': 33.533639170847025, 'sideways_atr_min_pct': 0.017110979673352195, 'sideways_atr_max_pct': 0.030551334755694604, 'sideways_tp_mult': 1.3229721100238625, 'sideways_tsl_mult': 0.8658656921971977, 'sideways_time_stop': 282, 'sideways_use_sma': True, 'sideways_use_ema': True, 'sideways_use_atr': False, 'sideways_use_adx': True, 'sideways_use_spike': True, 'sideways_rsi_required': False}.
[I 2025-09-01 14:38:07,351] Trial 271 finished with values: [-0.02457825366501898, 0.024505369890145803] and parameters: {'p_sma': 27, 'p_std': 31, 'p_atr': 26, 'p_adx': 12, 'rsi_period': 71, 'ema1': 26, 'ema2': 48, 'slip_atr_k': 0.20820865312752945, 'slip_spread_k': 0.5097924032142161, 'spread_hl_frac': 0.031206766090404583, 'bb_std_mult': 1.0262176816008093, 'rsi_os': 7, 'rsi_ob': 80, 'vol_spike': 0.2607082870075712, 'adx_thresh': 33.49576625069621, 'atr_min_pct': 0.011814336619649429, 'atr_max_pct': 0.03787637958564049, 'tp_mult': 2.454380479327241, 'tsl_mult': 0.062199429930554884, 'strategy': 'mean_reversion', 'time_stop': 81, 'use_sma': False, 'use_atr': False, 'use_adx': True, 'use_ema': False, 'use_spike': False, 'rsi_required': True, 'edge_k': 1.6368338721386595, 'edge_cap': 0.9237380202330394, 'bull_strategy': 'breakout', 'bull_bb_std_mult': 3.118733358191826, 'bull_rsi_os': 46, 'bull_rsi_ob': 91, 'bull_adx_thresh': 29.035066657381748, 'bull_atr_min_pct': 0.0013541090308463854, 'bull_atr_max_pct': 0.024738856965061964, 'bull_tp_mult': 1.4557579207254476, 'bull_tsl_mult': 0.7937084829931758, 'bull_time_stop': 49, 'bull_use_sma': False, 'bull_use_ema': True, 'bull_use_atr': True, 'bull_use_adx': True, 'bull_use_spike': False, 'bull_rsi_required': True, 'bear_strategy': 'breakout', 'bear_bb_std_mult': 1.2395065050574825, 'bear_rsi_os': 54, 'bear_rsi_ob': 65, 'bear_adx_thresh': 6.050026147254923, 'bear_atr_min_pct': 0.026640708335325853, 'bear_atr_max_pct': 0.05144024930357208, 'bear_tp_mult': 1.7133749236171298, 'bear_tsl_mult': 0.5299855831143636, 'bear_time_stop': 205, 'bear_use_sma': False, 'bear_use_ema': False, 'bear_use_atr': False, 'bear_use_adx': True, 'bear_use_spike': False, 'bear_rsi_required': True, 'sideways_strategy': 'mean_reversion', 'sideways_bb_std_mult': 1.3936792977193846, 'sideways_rsi_os': 50, 'sideways_rsi_ob': 78, 'sideways_adx_thresh': 33.557202573174784, 'sideways_atr_min_pct': 0.011478756726372623, 'sideways_atr_max_pct': 0.12113063032723548, 'sideways_tp_mult': 1.3223947219046852, 'sideways_tsl_mult': 0.43556209326686324, 'sideways_time_stop': 192, 'sideways_use_sma': True, 'sideways_use_ema': False, 'sideways_use_atr': False, 'sideways_use_adx': True, 'sideways_use_spike': True, 'sideways_rsi_required': False}.
[I 2025-09-01 14:38:07,730] Trial 274 finished with values: [-1000000000.0, 1000000000.0] and parameters: {'p_sma': 9, 'p_std': 32, 'p_atr': 14, 'p_adx': 25, 'rsi_period': 74, 'ema1': 8, 'ema2': 17, 'slip_atr_k': 0.05785552410964841, 'slip_spread_k': 0.4547191811311562, 'spread_hl_frac': 0.049609338717701366, 'bb_std_mult': 0.8234362369312036, 'rsi_os': 31, 'rsi_ob': 92, 'vol_spike': 0.06429885640468773, 'adx_thresh': 15.670930202877525, 'atr_min_pct': 0.009538672373520352, 'atr_max_pct': 0.05658130738354831, 'tp_mult': 2.4369256833083868, 'tsl_mult': 0.9408258333005082, 'strategy': 'mean_reversion', 'time_stop': 91, 'use_sma': False, 'use_atr': False, 'use_adx': False, 'use_ema': True, 'use_spike': True, 'rsi_required': True, 'edge_k': 0.48027414220999554, 'edge_cap': 0.9293870884874998, 'bull_strategy': 'mean_reversion', 'bull_bb_std_mult': 1.3138733236180138, 'bull_rsi_os': 40, 'bull_rsi_ob': 56, 'bull_adx_thresh': 34.04132524167437, 'bull_atr_min_pct': 0.024814590122205257, 'bull_atr_max_pct': 0.072848321565487, 'bull_tp_mult': 1.194025792780257, 'bull_tsl_mult': 0.908211783596113, 'bull_time_stop': 49, 'bull_use_sma': False, 'bull_use_ema': True, 'bull_use_atr': True, 'bull_use_adx': True, 'bull_use_spike': False, 'bull_rsi_required': False, 'bear_strategy': 'mean_reversion', 'bear_bb_std_mult': 1.0783920913593334, 'bear_rsi_os': 53, 'bear_rsi_ob': 89, 'bear_adx_thresh': 7.453294527183713, 'bear_atr_min_pct': 0.007663654261079314, 'bear_atr_max_pct': 0.12101318428289864, 'bear_tp_mult': 1.7092887773055723, 'bear_tsl_mult': 0.6375541410242449, 'bear_time_stop': 244, 'bear_use_sma': True, 'bear_use_ema': True, 'bear_use_atr': True, 'bear_use_adx': False, 'bear_use_spike': True, 'bear_rsi_required': True, 'sideways_strategy': 'mean_reversion', 'sideways_bb_std_mult': 1.4114353303323761, 'sideways_rsi_os': 34, 'sideways_rsi_ob': 84, 'sideways_adx_thresh': 5.072225262774889, 'sideways_atr_min_pct': 0.011318378230086582, 'sideways_atr_max_pct': 0.04060374748396621, 'sideways_tp_mult': 2.6617452951350207, 'sideways_tsl_mult': 0.5930726714962552, 'sideways_time_stop': 189, 'sideways_use_sma': True, 'sideways_use_ema': False, 'sideways_use_atr': True, 'sideways_use_adx': False, 'sideways_use_spike': True, 'sideways_rsi_required': False}.
[I 2025-09-01 14:38:07,735] Trial 272 finished with values: [-1000000000.0, 1000000000.0] and parameters: {'p_sma': 29, 'p_std': 30, 'p_atr': 26, 'p_adx': 28, 'rsi_period': 70, 'ema1': 13, 'ema2': 40, 'slip_atr_k': 0.20705423130307765, 'slip_spread_k': 0.4197717716528798, 'spread_hl_frac': 0.049512114829577875, 'bb_std_mult': 2.468124091472087, 'rsi_os': 42, 'rsi_ob': 59, 'vol_spike': 0.16527758506721865, 'adx_thresh': 27.476299497388826, 'atr_min_pct': 0.009487619578547851, 'atr_max_pct': 0.049808433427538656, 'tp_mult': 2.44536434554297, 'tsl_mult': 0.06152197036851331, 'strategy': 'mean_reversion', 'time_stop': 138, 'use_sma': True, 'use_atr': False, 'use_adx': False, 'use_ema': False, 'use_spike': False, 'rsi_required': True, 'edge_k': 0.46585505421646334, 'edge_cap': 0.4219272019044055, 'bull_strategy': 'breakout', 'bull_bb_std_mult': 1.1571314498197365, 'bull_rsi_os': 35, 'bull_rsi_ob': 55, 'bull_adx_thresh': 15.740815982502966, 'bull_atr_min_pct': 0.025246177896261986, 'bull_atr_max_pct': 0.04741698536164132, 'bull_tp_mult': 1.2020730781561666, 'bull_tsl_mult': 0.9063955646976493, 'bull_time_stop': 5, 'bull_use_sma': False, 'bull_use_ema': False, 'bull_use_atr': True, 'bull_use_adx': True, 'bull_use_spike': False, 'bull_rsi_required': False, 'bear_strategy': 'mean_reversion', 'bear_bb_std_mult': 0.6978387667701738, 'bear_rsi_os': 8, 'bear_rsi_ob': 51, 'bear_adx_thresh': 5.92608682784178, 'bear_atr_min_pct': 0.005635990902875713, 'bear_atr_max_pct': 0.06771059301694114, 'bear_tp_mult': 1.7034320214034684, 'bear_tsl_mult': 0.5750648652719813, 'bear_time_stop': 14, 'bear_use_sma': False, 'bear_use_ema': True, 'bear_use_atr': True, 'bear_use_adx': False, 'bear_use_spike': False, 'bear_rsi_required': True, 'sideways_strategy': 'mean_reversion', 'sideways_bb_std_mult': 1.3707615940818945, 'sideways_rsi_os': 17, 'sideways_rsi_ob': 78, 'sideways_adx_thresh': 33.75739624950417, 'sideways_atr_min_pct': 0.016619826427269908, 'sideways_atr_max_pct': 0.11926453307284438, 'sideways_tp_mult': 2.664734000689997, 'sideways_tsl_mult': 0.009471133420132838, 'sideways_time_stop': 187, 'sideways_use_sma': True, 'sideways_use_ema': False, 'sideways_use_atr': True, 'sideways_use_adx': False, 'sideways_use_spike': True, 'sideways_rsi_required': False}.
[I 2025-09-01 14:38:07,736] Trial 273 finished with values: [-1000000000.0, 1000000000.0] and parameters: {'p_sma': 6, 'p_std': 11, 'p_atr': 26, 'p_adx': 8, 'rsi_period': 33, 'ema1': 27, 'ema2': 40, 'slip_atr_k': 0.1766119279003709, 'slip_spread_k': 0.6812483775471776, 'spread_hl_frac': 0.035065130240396966, 'bb_std_mult': 2.056160786213517, 'rsi_os': 39, 'rsi_ob': 80, 'vol_spike': 0.16316441103478727, 'adx_thresh': 27.289855738787736, 'atr_min_pct': 0.024937607125089974, 'atr_max_pct': 0.11360472877531722, 'tp_mult': 2.0182650343324364, 'tsl_mult': 0.048693618043843145, 'strategy': 'mean_reversion', 'time_stop': 43, 'use_sma': True, 'use_atr': False, 'use_adx': False, 'use_ema': False, 'use_spike': False, 'rsi_required': True, 'edge_k': 0.06992961582050417, 'edge_cap': 0.9564317413716681, 'bull_strategy': 'breakout', 'bull_bb_std_mult': 1.4161656605775184, 'bull_rsi_os': 35, 'bull_rsi_ob': 55, 'bull_adx_thresh': 5.839273338101318, 'bull_atr_min_pct': 0.01721337317441098, 'bull_atr_max_pct': 0.04692077114967683, 'bull_tp_mult': 2.7327740176536937, 'bull_tsl_mult': 0.7482703789836425, 'bull_time_stop': 53, 'bull_use_sma': False, 'bull_use_ema': False, 'bull_use_atr': True, 'bull_use_adx': True, 'bull_use_spike': False, 'bull_rsi_required': False, 'bear_strategy': 'mean_reversion', 'bear_bb_std_mult': 2.2063793155862648, 'bear_rsi_os': 19, 'bear_rsi_ob': 89, 'bear_adx_thresh': 11.757360112634647, 'bear_atr_min_pct': 0.007012500423182491, 'bear_atr_max_pct': 0.06778848894610898, 'bear_tp_mult': 1.508444733971065, 'bear_tsl_mult': 0.5664903826591545, 'bear_time_stop': 180, 'bear_use_sma': False, 'bear_use_ema': True, 'bear_use_atr': True, 'bear_use_adx': False, 'bear_use_spike': False, 'bear_rsi_required': True, 'sideways_strategy': 'mean_reversion', 'sideways_bb_std_mult': 1.3893568502583995, 'sideways_rsi_os': 47, 'sideways_rsi_ob': 93, 'sideways_adx_thresh': 33.57734258793635, 'sideways_atr_min_pct': 0.016821834301558033, 'sideways_atr_max_pct': 0.03619196184523349, 'sideways_tp_mult': 2.655582426687714, 'sideways_tsl_mult': 0.42957698338964745, 'sideways_time_stop': 239, 'sideways_use_sma': True, 'sideways_use_ema': False, 'sideways_use_atr': True, 'sideways_use_adx': False, 'sideways_use_spike': True, 'sideways_rsi_required': False}.
[I 2025-09-01 14:38:52,246] Trial 278 finished with values: [-1000000000.0, 1000000000.0] and parameters: {'p_sma': 27, 'p_std': 9, 'p_atr': 14, 'p_adx': 12, 'rsi_period': 68, 'ema1': 11, 'ema2': 20, 'slip_atr_k': 0.03920207125391677, 'slip_spread_k': 0.612633535732694, 'spread_hl_frac': 0.008136559028507146, 'bb_std_mult': 1.0264070775619305, 'rsi_os': 9, 'rsi_ob': 84, 'vol_spike': 0.1796176387368012, 'adx_thresh': 25.778363387117203, 'atr_min_pct': 0.007830670015729247, 'atr_max_pct': 0.09779112373878901, 'tp_mult': 1.2301315332998257, 'tsl_mult': 0.6508188360468057, 'strategy': 'breakout', 'time_stop': 188, 'use_sma': False, 'use_atr': False, 'use_adx': True, 'use_ema': False, 'use_spike': False, 'rsi_required': True, 'edge_k': 0.5047700248123417, 'edge_cap': 0.9843515977600513, 'bull_strategy': 'breakout', 'bull_bb_std_mult': 2.67003727968945, 'bull_rsi_os': 14, 'bull_rsi_ob': 75, 'bull_adx_thresh': 34.88128583420886, 'bull_atr_min_pct': 0.007519237131251423, 'bull_atr_max_pct': 0.038847257437818354, 'bull_tp_mult': 2.5765679156947012, 'bull_tsl_mult': 0.8875537372352077, 'bull_time_stop': 32, 'bull_use_sma': True, 'bull_use_ema': True, 'bull_use_atr': False, 'bull_use_adx': True, 'bull_use_spike': False, 'bull_rsi_required': True, 'bear_strategy': 'breakout', 'bear_bb_std_mult': 1.990963740991101, 'bear_rsi_os': 12, 'bear_rsi_ob': 60, 'bear_adx_thresh': 5.057769934147752, 'bear_atr_min_pct': 0.02019523478676255, 'bear_atr_max_pct': 0.02231658730208346, 'bear_tp_mult': 1.5941922958800228, 'bear_tsl_mult': 0.6404571877998763, 'bear_time_stop': 263, 'bear_use_sma': False, 'bear_use_ema': False, 'bear_use_atr': False, 'bear_use_adx': False, 'bear_use_spike': True, 'bear_rsi_required': True, 'sideways_strategy': 'mean_reversion', 'sideways_bb_std_mult': 2.597878183440521, 'sideways_rsi_os': 30, 'sideways_rsi_ob': 77, 'sideways_adx_thresh': 13.476431447509785, 'sideways_atr_min_pct': 0.02288106119877862, 'sideways_atr_max_pct': 0.10393319615096738, 'sideways_tp_mult': 2.5771022556744785, 'sideways_tsl_mult': 0.9182570165050428, 'sideways_time_stop': 79, 'sideways_use_sma': True, 'sideways_use_ema': True, 'sideways_use_atr': False, 'sideways_use_adx': True, 'sideways_use_spike': False, 'sideways_rsi_required': False}.
[I 2025-09-01 14:38:52,736] Trial 275 finished with values: [-1000000000.0, 1000000000.0] and parameters: {'p_sma': 27, 'p_std': 51, 'p_atr': 14, 'p_adx': 12, 'rsi_period': 25, 'ema1': 28, 'ema2': 21, 'slip_atr_k': 0.06420461592356425, 'slip_spread_k': 0.498850714819382, 'spread_hl_frac': 0.03152351350458097, 'bb_std_mult': 2.525008610395834, 'rsi_os': 9, 'rsi_ob': 84, 'vol_spike': 0.028140366552515533, 'adx_thresh': 19.762644404127112, 'atr_min_pct': 0.02123364317192765, 'atr_max_pct': 0.04545147783046339, 'tp_mult': 2.336197244214046, 'tsl_mult': 0.5135523816992833, 'strategy': 'breakout', 'time_stop': 79, 'use_sma': False, 'use_atr': False, 'use_adx': True, 'use_ema': False, 'use_spike': False, 'rsi_required': True, 'edge_k': 1.5031312588588253, 'edge_cap': 0.920410231505658, 'bull_strategy': 'breakout', 'bull_bb_std_mult': 1.8110178214321235, 'bull_rsi_os': 27, 'bull_rsi_ob': 69, 'bull_adx_thresh': 34.82077765033634, 'bull_atr_min_pct': 0.007794832181164695, 'bull_atr_max_pct': 0.03868868190132796, 'bull_tp_mult': 2.6022895115187428, 'bull_tsl_mult': 0.8791747520320508, 'bull_time_stop': 240, 'bull_use_sma': True, 'bull_use_ema': True, 'bull_use_atr': False, 'bull_use_adx': True, 'bull_use_spike': False, 'bull_rsi_required': True, 'bear_strategy': 'breakout', 'bear_bb_std_mult': 1.988843988801162, 'bear_rsi_os': 12, 'bear_rsi_ob': 60, 'bear_adx_thresh': 5.04998178156928, 'bear_atr_min_pct': 0.004599975850655138, 'bear_atr_max_pct': 0.142096022666548, 'bear_tp_mult': 2.062421475580701, 'bear_tsl_mult': 0.2883848106640323, 'bear_time_stop': 247, 'bear_use_sma': False, 'bear_use_ema': False, 'bear_use_atr': False, 'bear_use_adx': False, 'bear_use_spike': True, 'bear_rsi_required': True, 'sideways_strategy': 'mean_reversion', 'sideways_bb_std_mult': 0.8007423735438775, 'sideways_rsi_os': 30, 'sideways_rsi_ob': 77, 'sideways_adx_thresh': 26.814993131296497, 'sideways_atr_min_pct': 0.019281968541555682, 'sideways_atr_max_pct': 0.03709081046064424, 'sideways_tp_mult': 2.593377773227357, 'sideways_tsl_mult': 0.918671081345515, 'sideways_time_stop': 79, 'sideways_use_sma': True, 'sideways_use_ema': True, 'sideways_use_atr': False, 'sideways_use_adx': True, 'sideways_use_spike': False, 'sideways_rsi_required': False}.
[I 2025-09-01 14:38:53,054] Trial 276 finished with values: [-0.060407928297797286, 0.06007911204346157] and parameters: {'p_sma': 27, 'p_std': 13, 'p_atr': 14, 'p_adx': 20, 'rsi_period': 36, 'ema1': 28, 'ema2': 20, 'slip_atr_k': 0.037375107964021416, 'slip_spread_k': 0.5011463255410471, 'spread_hl_frac': 0.015404639353184977, 'bb_std_mult': 2.7418508725082034, 'rsi_os': 23, 'rsi_ob': 84, 'vol_spike': 0.01506595264459869, 'adx_thresh': 26.57823306619064, 'atr_min_pct': 0.0191068373266184, 'atr_max_pct': 0.04349831238585264, 'tp_mult': 2.6917033678828357, 'tsl_mult': 0.6484266422404011, 'strategy': 'breakout', 'time_stop': 80, 'use_sma': False, 'use_atr': False, 'use_adx': True, 'use_ema': False, 'use_spike': False, 'rsi_required': True, 'edge_k': 1.517672213030135, 'edge_cap': 0.9431573442987057, 'bull_strategy': 'breakout', 'bull_bb_std_mult': 0.6366354208194149, 'bull_rsi_os': 44, 'bull_rsi_ob': 54, 'bull_adx_thresh': 26.851865204220374, 'bull_atr_min_pct': 0.02753193425119993, 'bull_atr_max_pct': 0.03910498014070494, 'bull_tp_mult': 1.908337845770309, 'bull_tsl_mult': 0.872971914539896, 'bull_time_stop': 142, 'bull_use_sma': True, 'bull_use_ema': True, 'bull_use_atr': False, 'bull_use_adx': True, 'bull_use_spike': False, 'bull_rsi_required': True, 'bear_strategy': 'breakout', 'bear_bb_std_mult': 2.2635152487026255, 'bear_rsi_os': 54, 'bear_rsi_ob': 47, 'bear_adx_thresh': 5.016673329909926, 'bear_atr_min_pct': 0.0034806265044470368, 'bear_atr_max_pct': 0.059982955485836625, 'bear_tp_mult': 1.595734860734613, 'bear_tsl_mult': 0.2944426852081913, 'bear_time_stop': 262, 'bear_use_sma': False, 'bear_use_ema': False, 'bear_use_atr': False, 'bear_use_adx': False, 'bear_use_spike': True, 'bear_rsi_required': True, 'sideways_strategy': 'mean_reversion', 'sideways_bb_std_mult': 1.0780081677943492, 'sideways_rsi_os': 30, 'sideways_rsi_ob': 77, 'sideways_adx_thresh': 26.697142097366836, 'sideways_atr_min_pct': 0.019016260928442764, 'sideways_atr_max_pct': 0.0357245788491123, 'sideways_tp_mult': 1.2583348688787885, 'sideways_tsl_mult': 0.4705015393989055, 'sideways_time_stop': 209, 'sideways_use_sma': True, 'sideways_use_ema': True, 'sideways_use_atr': False, 'sideways_use_adx': True, 'sideways_use_spike': False, 'sideways_rsi_required': False}.
[I 2025-09-01 14:38:53,374] Trial 277 finished with values: [-0.05224213473822381, 0.052072413972728104] and parameters: {'p_sma': 58, 'p_std': 13, 'p_atr': 14, 'p_adx': 20, 'rsi_period': 67, 'ema1': 28, 'ema2': 20, 'slip_atr_k': 0.1585846275534627, 'slip_spread_k': 0.49525402381582123, 'spread_hl_frac': 0.04384626180150292, 'bb_std_mult': 2.7447406327720345, 'rsi_os': 23, 'rsi_ob': 84, 'vol_spike': 0.027516685455337038, 'adx_thresh': 25.64665662822707, 'atr_min_pct': 0.007005835466560925, 'atr_max_pct': 0.061275907529014705, 'tp_mult': 2.347148887705654, 'tsl_mult': 0.2370681050192569, 'strategy': 'breakout', 'time_stop': 11, 'use_sma': False, 'use_atr': False, 'use_adx': True, 'use_ema': False, 'use_spike': False, 'rsi_required': True, 'edge_k': 1.869774536597351, 'edge_cap': 0.4824427310888088, 'bull_strategy': 'breakout', 'bull_bb_std_mult': 2.102288005423601, 'bull_rsi_os': 28, 'bull_rsi_ob': 54, 'bull_adx_thresh': 8.634605783916156, 'bull_atr_min_pct': 0.0014569340094085187, 'bull_atr_max_pct': 0.038122024694462166, 'bull_tp_mult': 2.4417987597188424, 'bull_tsl_mult': 0.8773772896950028, 'bull_time_stop': 33, 'bull_use_sma': True, 'bull_use_ema': True, 'bull_use_atr': False, 'bull_use_adx': True, 'bull_use_spike': False, 'bull_rsi_required': True, 'bear_strategy': 'breakout', 'bear_bb_std_mult': 1.981530996759118, 'bear_rsi_os': 54, 'bear_rsi_ob': 73, 'bear_adx_thresh': 5.269779436644624, 'bear_atr_min_pct': 0.02510585091646902, 'bear_atr_max_pct': 0.022019019890044178, 'bear_tp_mult': 1.585746977989613, 'bear_tsl_mult': 0.5245309461630754, 'bear_time_stop': 110, 'bear_use_sma': False, 'bear_use_ema': False, 'bear_use_atr': False, 'bear_use_adx': False, 'bear_use_spike': True, 'bear_rsi_required': True, 'sideways_strategy': 'mean_reversion', 'sideways_bb_std_mult': 2.587932249894063, 'sideways_rsi_os': 50, 'sideways_rsi_ob': 54, 'sideways_adx_thresh': 31.047372203369882, 'sideways_atr_min_pct': 0.01928704093382907, 'sideways_atr_max_pct': 0.03586569533953517, 'sideways_tp_mult': 1.1986963503362962, 'sideways_tsl_mult': 0.6420331715993466, 'sideways_time_stop': 248, 'sideways_use_sma': True, 'sideways_use_ema': True, 'sideways_use_atr': False, 'sideways_use_adx': True, 'sideways_use_spike': False, 'sideways_rsi_required': False}.
