[I 2025-09-01 14:03:10,108] Trial 53 finished with values: [-1000000000.0, 1000000000.0] and parameters: {'p_sma': 23, 'p_std': 8, 'p_atr': 25, 'p_adx': 19, 'rsi_period': 63, 'ema1': 18, 'ema2': 31, 'slip_atr_k': 0.22133547217908717, 'slip_spread_k': 0.6750419688719501, 'spread_hl_frac': 0.004045364105139209, 'bb_std_mult': 1.2756679599963114, 'rsi_os': 15, 'rsi_ob': 73, 'vol_spike': 0.1977833948837901, 'adx_thresh': 16.15115158765788, 'atr_min_pct': 0.013184564552681324, 'atr_max_pct': 0.1496486239719998, 'tp_mult': 2.84329603528821, 'tsl_mult': 0.6183760025146486, 'strategy': 'breakout', 'time_stop': 193, 'use_sma': True, 'use_atr': False, 'use_adx': True, 'use_ema': False, 'use_spike': True, 'rsi_required': False, 'edge_k': 1.4298022649745286, 'edge_cap': 0.6027063469999242, 'bull_strategy': 'breakout', 'bull_bb_std_mult': 2.862155426874825, 'bull_rsi_os': 47, 'bull_rsi_ob': 62, 'bull_adx_thresh': 18.110604844586508, 'bull_atr_min_pct': 0.013399918219402293, 'bull_atr_max_pct': 0.1381783190611946, 'bull_tp_mult': 1.1263523351670357, 'bull_tsl_mult': 0.966299108476336, 'bull_time_stop': 131, 'bull_use_sma': False, 'bull_use_ema': True, 'bull_use_atr': False, 'bull_use_adx': False, 'bull_use_spike': True, 'bull_rsi_required': True, 'bear_strategy': 'mean_reversion', 'bear_bb_std_mult': 1.6100350412775795, 'bear_rsi_os': 11, 'bear_rsi_ob': 67, 'bear_adx_thresh': 10.48326161809289, 'bear_atr_min_pct': 0.024537854922825272, 'bear_atr_max_pct': 0.015522480950711313, 'bear_tp_mult': 2.3113388751070554, 'bear_tsl_mult': 0.45359122563480525, 'bear_time_stop': 201, 'bear_use_sma': False, 'bear_use_ema': True, 'bear_use_atr': True, 'bear_use_adx': True, 'bear_use_spike': True, 'bear_rsi_required': False, 'sideways_strategy': 'breakout', 'sideways_bb_std_mult': 1.871734125698938, 'sideways_rsi_os': 11, 'sideways_rsi_ob': 49, 'sideways_adx_thresh': 33.38792726292652, 'sideways_atr_min_pct': 0.019973861302218957, 'sideways_atr_max_pct': 0.14601575570355013, 'sideways_tp_mult': 1.3563395313983666, 'sideways_tsl_mult': 0.393456727686184, 'sideways_time_stop': 55, 'sideways_use_sma': False, 'sideways_use_ema': True, 'sideways_use_atr': False, 'sideways_use_adx': True, 'sideways_use_spike': True, 'sideways_rsi_required': False}.
[I 2025-09-01 14:03:10,320] Trial 54 finished with values: [-0.026856995237288572, 0.0267252184658124] and parameters: {'p_sma': 23, 'p_std': 60, 'p_atr': 23, 'p_adx': 7, 'rsi_period': 83, 'ema1': 18, 'ema2': 20, 'slip_atr_k': 0.2338081976137469, 'slip_spread_k': 0.407035353368353, 'spread_hl_frac': 0.04559646069592054, 'bb_std_mult': 1.1958545180627942, 'rsi_os': 29, 'rsi_ob': 92, 'vol_spike': 0.02730530319979589, 'adx_thresh': 16.304197426901798, 'atr_min_pct': 0.029397190360320943, 'atr_max_pct': 0.14857860203433426, 'tp_mult': 1.382330461763281, 'tsl_mult': 0.5844609931905268, 'strategy': 'breakout', 'time_stop': 72, 'use_sma': True, 'use_atr': False, 'use_adx': False, 'use_ema': False, 'use_spike': True, 'rsi_required': False, 'edge_k': 1.0775425992585128, 'edge_cap': 0.5373901467974889, 'bull_strategy': 'breakout', 'bull_bb_std_mult': 1.5615070842316936, 'bull_rsi_os': 20, 'bull_rsi_ob': 86, 'bull_adx_thresh': 17.210088967060802, 'bull_atr_min_pct': 0.00173684540233645, 'bull_atr_max_pct': 0.1405343520928515, 'bull_tp_mult': 1.2593426548586975, 'bull_tsl_mult': 0.8290937839573442, 'bull_time_stop': 21, 'bull_use_sma': False, 'bull_use_ema': True, 'bull_use_atr': False, 'bull_use_adx': True, 'bull_use_spike': False, 'bull_rsi_required': True, 'bear_strategy': 'mean_reversion', 'bear_bb_std_mult': 2.0398751282985463, 'bear_rsi_os': 31, 'bear_rsi_ob': 51, 'bear_adx_thresh': 10.866990964856635, 'bear_atr_min_pct': 0.002245336545945515, 'bear_atr_max_pct': 0.014485765067841952, 'bear_tp_mult': 2.834300054039344, 'bear_tsl_mult': 0.45607226641723, 'bear_time_stop': 279, 'bear_use_sma': True, 'bear_use_ema': True, 'bear_use_atr': True, 'bear_use_adx': False, 'bear_use_spike': True, 'bear_rsi_required': False, 'sideways_strategy': 'breakout', 'sideways_bb_std_mult': 1.7062952663658344, 'sideways_rsi_os': 11, 'sideways_rsi_ob': 45, 'sideways_adx_thresh': 33.39418913128967, 'sideways_atr_min_pct': 0.020193237813942607, 'sideways_atr_max_pct': 0.03740128840594057, 'sideways_tp_mult': 1.387759278236512, 'sideways_tsl_mult': 0.9503828170245634, 'sideways_time_stop': 47, 'sideways_use_sma': False, 'sideways_use_ema': True, 'sideways_use_atr': False, 'sideways_use_adx': True, 'sideways_use_spike': True, 'sideways_rsi_required': False}.
[I 2025-09-01 14:03:48,343] Trial 57 finished with values: [-0.02250098939761591, 0.02357827005529902] and parameters: {'p_sma': 22, 'p_std': 60, 'p_atr': 11, 'p_adx': 19, 'rsi_period': 15, 'ema1': 5, 'ema2': 42, 'slip_atr_k': 0.22748926202841696, 'slip_spread_k': 0.24673946362591198, 'spread_hl_frac': 0.049609371992033455, 'bb_std_mult': 2.2494425185362794, 'rsi_os': 44, 'rsi_ob': 54, 'vol_spike': 0.24159237767294783, 'adx_thresh': 15.257156889504182, 'atr_min_pct': 0.0038519779452475594, 'atr_max_pct': 0.12639137118271737, 'tp_mult': 2.658144119165232, 'tsl_mult': 0.2979092424749583, 'strategy': 'breakout', 'time_stop': 105, 'use_sma': False, 'use_atr': False, 'use_adx': False, 'use_ema': False, 'use_spike': False, 'rsi_required': True, 'edge_k': 0.7043839067453401, 'edge_cap': 0.5218799281544404, 'bull_strategy': 'breakout', 'bull_bb_std_mult': 1.6548476890603263, 'bull_rsi_os': 47, 'bull_rsi_ob': 86, 'bull_adx_thresh': 23.72839970715804, 'bull_atr_min_pct': 0.0014574976112036071, 'bull_atr_max_pct': 0.04683079223483925, 'bull_tp_mult': 1.450200378575191, 'bull_tsl_mult': 0.37723194071917043, 'bull_time_stop': 57, 'bull_use_sma': False, 'bull_use_ema': True, 'bull_use_atr': False, 'bull_use_adx': True, 'bull_use_spike': False, 'bull_rsi_required': True, 'bear_strategy': 'breakout', 'bear_bb_std_mult': 1.2896076921307527, 'bear_rsi_os': 12, 'bear_rsi_ob': 47, 'bear_adx_thresh': 18.094163224342154, 'bear_atr_min_pct': 0.004176730054916724, 'bear_atr_max_pct': 0.1397126139449978, 'bear_tp_mult': 2.870221471854954, 'bear_tsl_mult': 0.358036222632919, 'bear_time_stop': 213, 'bear_use_sma': True, 'bear_use_ema': False, 'bear_use_atr': False, 'bear_use_adx': False, 'bear_use_spike': True, 'bear_rsi_required': True, 'sideways_strategy': 'breakout', 'sideways_bb_std_mult': 1.9260416963793803, 'sideways_rsi_os': 32, 'sideways_rsi_ob': 72, 'sideways_adx_thresh': 9.721862189581683, 'sideways_atr_min_pct': 0.021534935321185212, 'sideways_atr_max_pct': 0.09194822024364249, 'sideways_tp_mult': 2.318173990310851, 'sideways_tsl_mult': 0.9790091865805589, 'sideways_time_stop': 166, 'sideways_use_sma': False, 'sideways_use_ema': True, 'sideways_use_atr': False, 'sideways_use_adx': True, 'sideways_use_spike': False, 'sideways_rsi_required': False}.
[I 2025-09-01 14:03:48,346] Trial 59 finished with values: [-0.06302404825128483, 0.06298708130686004] and parameters: {'p_sma': 23, 'p_std': 57, 'p_atr': 22, 'p_adx': 15, 'rsi_period': 84, 'ema1': 20, 'ema2': 42, 'slip_atr_k': 0.23735375803509806, 'slip_spread_k': 0.23979458127284797, 'spread_hl_frac': 0.04037600693336754, 'bb_std_mult': 2.8016776836005914, 'rsi_os': 44, 'rsi_ob': 53, 'vol_spike': 0.23638136891170342, 'adx_thresh': 22.616600272670063, 'atr_min_pct': 0.0037324738721632588, 'atr_max_pct': 0.124848689617437, 'tp_mult': 2.1928179601009994, 'tsl_mult': 0.5669692482252269, 'strategy': 'breakout', 'time_stop': 104, 'use_sma': False, 'use_atr': True, 'use_adx': False, 'use_ema': False, 'use_spike': False, 'rsi_required': True, 'edge_k': 1.995636005557997, 'edge_cap': 0.5304971860239294, 'bull_strategy': 'breakout', 'bull_bb_std_mult': 3.226656228436758, 'bull_rsi_os': 52, 'bull_rsi_ob': 56, 'bull_adx_thresh': 13.724134839643783, 'bull_atr_min_pct': 0.0017812815338823142, 'bull_atr_max_pct': 0.10114331194601472, 'bull_tp_mult': 1.0158578820436013, 'bull_tsl_mult': 0.3744479811737649, 'bull_time_stop': 155, 'bull_use_sma': False, 'bull_use_ema': True, 'bull_use_atr': False, 'bull_use_adx': True, 'bull_use_spike': False, 'bull_rsi_required': True, 'bear_strategy': 'breakout', 'bear_bb_std_mult': 1.2205651982226113, 'bear_rsi_os': 49, 'bear_rsi_ob': 47, 'bear_adx_thresh': 8.320572802458488, 'bear_atr_min_pct': 0.004144899487812338, 'bear_atr_max_pct': 0.03801144004703677, 'bear_tp_mult': 2.8367340592911297, 'bear_tsl_mult': 0.3650786289221859, 'bear_time_stop': 224, 'bear_use_sma': True, 'bear_use_ema': False, 'bear_use_atr': False, 'bear_use_adx': False, 'bear_use_spike': True, 'bear_rsi_required': True, 'sideways_strategy': 'breakout', 'sideways_bb_std_mult': 1.1501396533378794, 'sideways_rsi_os': 20, 'sideways_rsi_ob': 72, 'sideways_adx_thresh': 11.626402713970782, 'sideways_atr_min_pct': 0.006895146747844168, 'sideways_atr_max_pct': 0.017007795885485465, 'sideways_tp_mult': 2.273536114700624, 'sideways_tsl_mult': 0.25772637202253945, 'sideways_time_stop': 194, 'sideways_use_sma': False, 'sideways_use_ema': True, 'sideways_use_atr': False, 'sideways_use_adx': True, 'sideways_use_spike': False, 'sideways_rsi_required': False}.
[I 2025-09-01 14:03:48,925] Trial 56 finished with values: [-0.03613977731442175, 0.035980124708585075] and parameters: {'p_sma': 44, 'p_std': 59, 'p_atr': 25, 'p_adx': 19, 'rsi_period': 66, 'ema1': 5, 'ema2': 42, 'slip_atr_k': 0.22344878330929555, 'slip_spread_k': 0.6642884608836441, 'spread_hl_frac': 0.041107791451909306, 'bb_std_mult': 2.2641567863278755, 'rsi_os': 44, 'rsi_ob': 45, 'vol_spike': 0.23590609641996096, 'adx_thresh': 27.83428121176216, 'atr_min_pct': 0.028876186077183164, 'atr_max_pct': 0.12510913174522006, 'tp_mult': 2.1861284471922087, 'tsl_mult': 0.2965594836674222, 'strategy': 'breakout', 'time_stop': 275, 'use_sma': True, 'use_atr': False, 'use_adx': False, 'use_ema': False, 'use_spike': False, 'rsi_required': True, 'edge_k': 0.7090213604679876, 'edge_cap': 0.6199809971544212, 'bull_strategy': 'breakout', 'bull_bb_std_mult': 2.8525091792998674, 'bull_rsi_os': 51, 'bull_rsi_ob': 83, 'bull_adx_thresh': 5.234185429814277, 'bull_atr_min_pct': 0.0012634152763358534, 'bull_atr_max_pct': 0.02167529030152142, 'bull_tp_mult': 1.4533192226704195, 'bull_tsl_mult': 0.8743608324599672, 'bull_time_stop': 22, 'bull_use_sma': False, 'bull_use_ema': True, 'bull_use_atr': False, 'bull_use_adx': True, 'bull_use_spike': False, 'bull_rsi_required': True, 'bear_strategy': 'breakout', 'bear_bb_std_mult': 2.0054394531054105, 'bear_rsi_os': 11, 'bear_rsi_ob': 67, 'bear_adx_thresh': 21.01385563626969, 'bear_atr_min_pct': 0.004516574125369793, 'bear_atr_max_pct': 0.01583900159001418, 'bear_tp_mult': 2.902122782209473, 'bear_tsl_mult': 0.47256446958845366, 'bear_time_stop': 285, 'bear_use_sma': False, 'bear_use_ema': True, 'bear_use_atr': False, 'bear_use_adx': False, 'bear_use_spike': True, 'bear_rsi_required': True, 'sideways_strategy': 'breakout', 'sideways_bb_std_mult': 1.8247010352494393, 'sideways_rsi_os': 32, 'sideways_rsi_ob': 49, 'sideways_adx_thresh': 29.012922960557677, 'sideways_atr_min_pct': 0.007367131220561308, 'sideways_atr_max_pct': 0.0934235013182555, 'sideways_tp_mult': 2.661857934751177, 'sideways_tsl_mult': 0.9653583185858489, 'sideways_time_stop': 194, 'sideways_use_sma': False, 'sideways_use_ema': True, 'sideways_use_atr': False, 'sideways_use_adx': True, 'sideways_use_spike': True, 'sideways_rsi_required': False}.
[I 2025-09-01 14:03:49,205] Trial 58 finished with values: [-0.09487916290565046, 0.0946782457514767] and parameters: {'p_sma': 32, 'p_std': 16, 'p_atr': 11, 'p_adx': 15, 'rsi_period': 15, 'ema1': 20, 'ema2': 42, 'slip_atr_k': 0.06683674696855385, 'slip_spread_k': 0.2359812826763855, 'spread_hl_frac': 0.04968949245712795, 'bb_std_mult': 2.249377313753587, 'rsi_os': 44, 'rsi_ob': 46, 'vol_spike': 0.06666794660545523, 'adx_thresh': 22.07791485854299, 'atr_min_pct': 0.004206153528155735, 'atr_max_pct': 0.12375568158282045, 'tp_mult': 1.5936941328848881, 'tsl_mult': 0.48742516042287165, 'strategy': 'breakout', 'time_stop': 104, 'use_sma': False, 'use_atr': True, 'use_adx': False, 'use_ema': False, 'use_spike': False, 'rsi_required': True, 'edge_k': 0.7179125249041957, 'edge_cap': 0.5185034302950084, 'bull_strategy': 'breakout', 'bull_bb_std_mult': 3.2030623490328076, 'bull_rsi_os': 25, 'bull_rsi_ob': 87, 'bull_adx_thresh': 14.263786752394175, 'bull_atr_min_pct': 0.001943625360903044, 'bull_atr_max_pct': 0.04554270078322582, 'bull_tp_mult': 1.0417159858958855, 'bull_tsl_mult': 0.36219348840024357, 'bull_time_stop': 60, 'bull_use_sma': False, 'bull_use_ema': True, 'bull_use_atr': False, 'bull_use_adx': True, 'bull_use_spike': False, 'bull_rsi_required': True, 'bear_strategy': 'breakout', 'bear_bb_std_mult': 2.3789979153645406, 'bear_rsi_os': 53, 'bear_rsi_ob': 47, 'bear_adx_thresh': 8.170440598129098, 'bear_atr_min_pct': 0.003855123253622906, 'bear_atr_max_pct': 0.13891887760081784, 'bear_tp_mult': 2.9077001625921692, 'bear_tsl_mult': 0.36717009049960825, 'bear_time_stop': 228, 'bear_use_sma': True, 'bear_use_ema': False, 'bear_use_atr': False, 'bear_use_adx': False, 'bear_use_spike': True, 'bear_rsi_required': True, 'sideways_strategy': 'breakout', 'sideways_bb_std_mult': 1.9052315766193595, 'sideways_rsi_os': 16, 'sideways_rsi_ob': 59, 'sideways_adx_thresh': 9.252012372363508, 'sideways_atr_min_pct': 0.006921785037780315, 'sideways_atr_max_pct': 0.0957797991009032, 'sideways_tp_mult': 2.325320126326136, 'sideways_tsl_mult': 0.9492191410839956, 'sideways_time_stop': 169, 'sideways_use_sma': False, 'sideways_use_ema': True, 'sideways_use_atr': False, 'sideways_use_adx': True, 'sideways_use_spike': False, 'sideways_rsi_required': False}.
[I 2025-09-01 14:04:29,678] Trial 63 finished with values: [-1000000000.0, 1000000000.0] and parameters: {'p_sma': 37, 'p_std': 41, 'p_atr': 20, 'p_adx': 12, 'rsi_period': 21, 'ema1': 15, 'ema2': 10, 'slip_atr_k': 0.07362206251502398, 'slip_spread_k': 0.40789339991099555, 'spread_hl_frac': 0.01773392827012714, 'bb_std_mult': 2.7234496926210507, 'rsi_os': 39, 'rsi_ob': 92, 'vol_spike': 0.024342766218700296, 'adx_thresh': 15.086789879622627, 'atr_min_pct': 0.02701017856198508, 'atr_max_pct': 0.0490059981574885, 'tp_mult': 2.459564494906088, 'tsl_mult': 0.5317933440291903, 'strategy': 'breakout', 'time_stop': 69, 'use_sma': False, 'use_atr': False, 'use_adx': False, 'use_ema': False, 'use_spike': False, 'rsi_required': True, 'edge_k': 0.9306756711032288, 'edge_cap': 0.6743723892203112, 'bull_strategy': 'mean_reversion', 'bull_bb_std_mult': 1.6854830407401347, 'bull_rsi_os': 33, 'bull_rsi_ob': 48, 'bull_adx_thresh': 14.793398394875531, 'bull_atr_min_pct': 0.006472565585073075, 'bull_atr_max_pct': 0.05006606361977847, 'bull_tp_mult': 1.15141558656242, 'bull_tsl_mult': 0.7219758407461251, 'bull_time_stop': 299, 'bull_use_sma': False, 'bull_use_ema': False, 'bull_use_atr': False, 'bull_use_adx': True, 'bull_use_spike': False, 'bull_rsi_required': True, 'bear_strategy': 'breakout', 'bear_bb_std_mult': 2.398048635433484, 'bear_rsi_os': 49, 'bear_rsi_ob': 50, 'bear_adx_thresh': 6.382211268231808, 'bear_atr_min_pct': 0.010599377289161209, 'bear_atr_max_pct': 0.048860864207423874, 'bear_tp_mult': 2.6387946405964664, 'bear_tsl_mult': 0.12016209831550956, 'bear_time_stop': 25, 'bear_use_sma': False, 'bear_use_ema': True, 'bear_use_atr': False, 'bear_use_adx': False, 'bear_use_spike': True, 'bear_rsi_required': True, 'sideways_strategy': 'breakout', 'sideways_bb_std_mult': 1.6795100181303515, 'sideways_rsi_os': 22, 'sideways_rsi_ob': 82, 'sideways_adx_thresh': 8.032290290145154, 'sideways_atr_min_pct': 0.021471551528959434, 'sideways_atr_max_pct': 0.13306651123555974, 'sideways_tp_mult': 2.4921268531544505, 'sideways_tsl_mult': 0.8049693335734442, 'sideways_time_stop': 33, 'sideways_use_sma': False, 'sideways_use_ema': True, 'sideways_use_atr': False, 'sideways_use_adx': False, 'sideways_use_spike': True, 'sideways_rsi_required': False}.
[I 2025-09-01 14:04:30,120] Trial 61 finished with values: [-1000000000.0, 1000000000.0] and parameters: {'p_sma': 31, 'p_std': 16, 'p_atr': 7, 'p_adx': 24, 'rsi_period': 15, 'ema1': 5, 'ema2': 35, 'slip_atr_k': 0.00020155179613405572, 'slip_spread_k': 0.4338868737127409, 'spread_hl_frac': 0.04946484017064827, 'bb_std_mult': 2.2652700523061355, 'rsi_os': 39, 'rsi_ob': 45, 'vol_spike': 0.06094473740502418, 'adx_thresh': 14.869612225489483, 'atr_min_pct': 0.026536924429163146, 'atr_max_pct': 0.1350581626608979, 'tp_mult': 2.6663854174443387, 'tsl_mult': 0.4703384156852821, 'strategy': 'breakout', 'time_stop': 66, 'use_sma': False, 'use_atr': False, 'use_adx': False, 'use_ema': False, 'use_spike': False, 'rsi_required': True, 'edge_k': 1.064675982701843, 'edge_cap': 0.4372768879027873, 'bull_strategy': 'breakout', 'bull_bb_std_mult': 1.6859257397537806, 'bull_rsi_os': 53, 'bull_rsi_ob': 48, 'bull_adx_thresh': 14.590460241320711, 'bull_atr_min_pct': 0.006435287780843212, 'bull_atr_max_pct': 0.046991127748983584, 'bull_tp_mult': 2.663192209599336, 'bull_tsl_mult': 0.7146843947678341, 'bull_time_stop': 87, 'bull_use_sma': False, 'bull_use_ema': True, 'bull_use_atr': False, 'bull_use_adx': True, 'bull_use_spike': False, 'bull_rsi_required': True, 'bear_strategy': 'breakout', 'bear_bb_std_mult': 2.390875987942465, 'bear_rsi_os': 15, 'bear_rsi_ob': 51, 'bear_adx_thresh': 5.996137864341973, 'bear_atr_min_pct': 0.0021885977845545416, 'bear_atr_max_pct': 0.05438440992467944, 'bear_tp_mult': 1.1335343176553248, 'bear_tsl_mult': 0.13571717928158714, 'bear_time_stop': 237, 'bear_use_sma': False, 'bear_use_ema': True, 'bear_use_atr': False, 'bear_use_adx': False, 'bear_use_spike': True, 'bear_rsi_required': True, 'sideways_strategy': 'breakout', 'sideways_bb_std_mult': 3.2418723116312904, 'sideways_rsi_os': 16, 'sideways_rsi_ob': 81, 'sideways_adx_thresh': 7.921111448325542, 'sideways_atr_min_pct': 0.02156581954345632, 'sideways_atr_max_pct': 0.1011621307283162, 'sideways_tp_mult': 2.325463302366116, 'sideways_tsl_mult': 0.8140430429427636, 'sideways_time_stop': 170, 'sideways_use_sma': False, 'sideways_use_ema': True, 'sideways_use_atr': False, 'sideways_use_adx': False, 'sideways_use_spike': True, 'sideways_rsi_required': False}.
[I 2025-09-01 14:04:30,477] Trial 62 finished with values: [-1000000000.0, 1000000000.0] and parameters: {'p_sma': 31, 'p_std': 34, 'p_atr': 10, 'p_adx': 24, 'rsi_period': 76, 'ema1': 16, 'ema2': 35, 'slip_atr_k': 0.06779530089452318, 'slip_spread_k': 0.4023451361259087, 'spread_hl_frac': 0.032254850844829284, 'bb_std_mult': 2.7609973100641834, 'rsi_os': 37, 'rsi_ob': 83, 'vol_spike': 0.06660451585780469, 'adx_thresh': 15.207872697835176, 'atr_min_pct': 0.026096796220536747, 'atr_max_pct': 0.1335329449215027, 'tp_mult': 2.6499751424678797, 'tsl_mult': 0.4942377698110307, 'strategy': 'breakout', 'time_stop': 68, 'use_sma': False, 'use_atr': True, 'use_adx': False, 'use_ema': False, 'use_spike': False, 'rsi_required': True, 'edge_k': 0.9381300317228264, 'edge_cap': 0.6652836570665396, 'bull_strategy': 'mean_reversion', 'bull_bb_std_mult': 1.634255277465222, 'bull_rsi_os': 38, 'bull_rsi_ob': 88, 'bull_adx_thresh': 14.474413686192687, 'bull_atr_min_pct': 0.022313873475196748, 'bull_atr_max_pct': 0.04588889606225386, 'bull_tp_mult': 1.150234965723651, 'bull_tsl_mult': 0.6860168093611263, 'bull_time_stop': 65, 'bull_use_sma': False, 'bull_use_ema': False, 'bull_use_atr': False, 'bull_use_adx': True, 'bull_use_spike': False, 'bull_rsi_required': True, 'bear_strategy': 'breakout', 'bear_bb_std_mult': 2.4247878023562777, 'bear_rsi_os': 35, 'bear_rsi_ob': 51, 'bear_adx_thresh': 6.316377309573765, 'bear_atr_min_pct': 0.009791442429442345, 'bear_atr_max_pct': 0.050260448953648416, 'bear_tp_mult': 1.10551332523521, 'bear_tsl_mult': 0.28487296476073704, 'bear_time_stop': 171, 'bear_use_sma': False, 'bear_use_ema': True, 'bear_use_atr': False, 'bear_use_adx': False, 'bear_use_spike': True, 'bear_rsi_required': True, 'sideways_strategy': 'breakout', 'sideways_bb_std_mult': 1.9161220981961624, 'sideways_rsi_os': 16, 'sideways_rsi_ob': 82, 'sideways_adx_thresh': 9.627481907117808, 'sideways_atr_min_pct': 0.021425055287293895, 'sideways_atr_max_pct': 0.13106013177339698, 'sideways_tp_mult': 2.3489724925711015, 'sideways_tsl_mult': 0.8005640506072412, 'sideways_time_stop': 38, 'sideways_use_sma': False, 'sideways_use_ema': True, 'sideways_use_atr': False, 'sideways_use_adx': False, 'sideways_use_spike': True, 'sideways_rsi_required': False}.
