[I 2025-09-01 14:01:51,903] Trial 44 finished with values: [-0.02110509140405359, 0.02274250393785011] and parameters: {'p_sma': 60, 'p_std': 48, 'p_atr': 20, 'p_adx': 19, 'rsi_period': 69, 'ema1': 22, 'ema2': 33, 'slip_atr_k': 0.07043474528194224, 'slip_spread_k': 0.5289802630961932, 'spread_hl_frac': 0.036189653131864036, 'bb_std_mult': 3.006792325887732, 'rsi_os': 53, 'rsi_ob': 48, 'vol_spike': 0.04615492936609233, 'adx_thresh': 30.79554012513502, 'atr_min_pct': 0.0063892690101546995, 'atr_max_pct': 0.12771670875932709, 'tp_mult': 2.3146345610183583, 'tsl_mult': 0.09544187163815204, 'strategy': 'breakout', 'time_stop': 236, 'use_sma': False, 'use_atr': True, 'use_adx': False, 'use_ema': False, 'use_spike': False, 'rsi_required': True, 'edge_k': 1.2797288485456249, 'edge_cap': 0.7269142064743208, 'bull_strategy': 'breakout', 'bull_bb_std_mult': 1.3425506514962122, 'bull_rsi_os': 35, 'bull_rsi_ob': 58, 'bull_adx_thresh': 11.408125953414256, 'bull_atr_min_pct': 0.001853071746473239, 'bull_atr_max_pct': 0.1068219457667173, 'bull_tp_mult': 1.4162492596528249, 'bull_tsl_mult': 0.17550860259178513, 'bull_time_stop': 232, 'bull_use_sma': True, 'bull_use_ema': False, 'bull_use_atr': False, 'bull_use_adx': True, 'bull_use_spike': False, 'bull_rsi_required': False, 'bear_strategy': 'breakout', 'bear_bb_std_mult': 1.8756204163768588, 'bear_rsi_os': 26, 'bear_rsi_ob': 61, 'bear_adx_thresh': 22.054554885720197, 'bear_atr_min_pct': 0.007940785926899925, 'bear_atr_max_pct': 0.1165370682955357, 'bear_tp_mult': 1.4437755686204246, 'bear_tsl_mult': 0.7083847853796837, 'bear_time_stop': 69, 'bear_use_sma': False, 'bear_use_ema': True, 'bear_use_atr': False, 'bear_use_adx': False, 'bear_use_spike': False, 'bear_rsi_required': True, 'sideways_strategy': 'breakout', 'sideways_bb_std_mult': 1.461821760523089, 'sideways_rsi_os': 6, 'sideways_rsi_ob': 50, 'sideways_adx_thresh': 29.326222390185958, 'sideways_atr_min_pct': 0.017195682426686242, 'sideways_atr_max_pct': 0.061434899502720075, 'sideways_tp_mult': 2.5909227225694953, 'sideways_tsl_mult': 0.8507269687884929, 'sideways_time_stop': 213, 'sideways_use_sma': False, 'sideways_use_ema': True, 'sideways_use_atr': False, 'sideways_use_adx': False, 'sideways_use_spike': True, 'sideways_rsi_required': False}.
[I 2025-09-01 14:01:52,151] Trial 46 finished with values: [-1000000000.0, 1000000000.0] and parameters: {'p_sma': 59, 'p_std': 46, 'p_atr': 28, 'p_adx': 21, 'rsi_period': 79, 'ema1': 21, 'ema2': 47, 'slip_atr_k': 0.026950773129765893, 'slip_spread_k': 0.5222498354738506, 'spread_hl_frac': 0.03686761601062453, 'bb_std_mult': 3.362121081916581, 'rsi_os': 47, 'rsi_ob': 50, 'vol_spike': 0.04905650545637909, 'adx_thresh': 30.471832297635725, 'atr_min_pct': 0.002598079643570021, 'atr_max_pct': 0.14239858309162975, 'tp_mult': 2.042479659223631, 'tsl_mult': 0.7384557752490508, 'strategy': 'mean_reversion', 'time_stop': 171, 'use_sma': False, 'use_atr': True, 'use_adx': False, 'use_ema': True, 'use_spike': False, 'rsi_required': True, 'edge_k': 1.2527777663793223, 'edge_cap': 0.82959002027385, 'bull_strategy': 'mean_reversion', 'bull_bb_std_mult': 1.1572763815469416, 'bull_rsi_os': 40, 'bull_rsi_ob': 58, 'bull_adx_thresh': 19.44472064291116, 'bull_atr_min_pct': 0.002081812907477211, 'bull_atr_max_pct': 0.05713758985769874, 'bull_tp_mult': 1.3724241783408504, 'bull_tsl_mult': 0.18470290069982628, 'bull_time_stop': 228, 'bull_use_sma': True, 'bull_use_ema': False, 'bull_use_atr': True, 'bull_use_adx': True, 'bull_use_spike': False, 'bull_rsi_required': False, 'bear_strategy': 'breakout', 'bear_bb_std_mult': 1.8614583177456867, 'bear_rsi_os': 43, 'bear_rsi_ob': 60, 'bear_adx_thresh': 22.316330321190726, 'bear_atr_min_pct': 0.008013796801432466, 'bear_atr_max_pct': 0.12278722328442204, 'bear_tp_mult': 1.4137810072609924, 'bear_tsl_mult': 0.9115465746055296, 'bear_time_stop': 90, 'bear_use_sma': False, 'bear_use_ema': True, 'bear_use_atr': False, 'bear_use_adx': False, 'bear_use_spike': False, 'bear_rsi_required': True, 'sideways_strategy': 'breakout', 'sideways_bb_std_mult': 3.5509634793394644, 'sideways_rsi_os': 5, 'sideways_rsi_ob': 76, 'sideways_adx_thresh': 5.006609456309269, 'sideways_atr_min_pct': 0.01660891242695659, 'sideways_atr_max_pct': 0.0600116889490318, 'sideways_tp_mult': 2.776319788539002, 'sideways_tsl_mult': 0.17063217107586576, 'sideways_time_stop': 213, 'sideways_use_sma': True, 'sideways_use_ema': True, 'sideways_use_atr': True, 'sideways_use_adx': False, 'sideways_use_spike': True, 'sideways_rsi_required': True}.
[I 2025-09-01 14:01:52,158] Trial 48 finished with values: [-1000000000.0, 1000000000.0] and parameters: {'p_sma': 35, 'p_std': 47, 'p_atr': 28, 'p_adx': 21, 'rsi_period': 78, 'ema1': 21, 'ema2': 57, 'slip_atr_k': 0.02899657096401055, 'slip_spread_k': 0.1897848854154007, 'spread_hl_frac': 0.03633939514265293, 'bb_std_mult': 3.009254217485295, 'rsi_os': 9, 'rsi_ob': 49, 'vol_spike': 0.0004776127888789349, 'adx_thresh': 25.36336641389905, 'atr_min_pct': 0.0061794122185243, 'atr_max_pct': 0.14120487365843387, 'tp_mult': 2.0871274824815935, 'tsl_mult': 0.42925759389046714, 'strategy': 'mean_reversion', 'time_stop': 145, 'use_sma': False, 'use_atr': False, 'use_adx': False, 'use_ema': True, 'use_spike': False, 'rsi_required': True, 'edge_k': 0.3318128082863162, 'edge_cap': 0.7344638533953491, 'bull_strategy': 'mean_reversion', 'bull_bb_std_mult': 1.159358279916649, 'bull_rsi_os': 39, 'bull_rsi_ob': 95, 'bull_adx_thresh': 11.713747559180296, 'bull_atr_min_pct': 0.00406007150412315, 'bull_atr_max_pct': 0.10736491917392291, 'bull_tp_mult': 2.0872372111457413, 'bull_tsl_mult': 0.22135138154566159, 'bull_time_stop': 242, 'bull_use_sma': False, 'bull_use_ema': False, 'bull_use_atr': True, 'bull_use_adx': True, 'bull_use_spike': False, 'bull_rsi_required': True, 'bear_strategy': 'breakout', 'bear_bb_std_mult': 2.6414400113958703, 'bear_rsi_os': 40, 'bear_rsi_ob': 48, 'bear_adx_thresh': 22.300004762738993, 'bear_atr_min_pct': 0.008673667289274538, 'bear_atr_max_pct': 0.1469006651253175, 'bear_tp_mult': 1.393937157899773, 'bear_tsl_mult': 0.5229355583437545, 'bear_time_stop': 110, 'bear_use_sma': False, 'bear_use_ema': True, 'bear_use_atr': False, 'bear_use_adx': False, 'bear_use_spike': True, 'bear_rsi_required': True, 'sideways_strategy': 'breakout', 'sideways_bb_std_mult': 3.473338808714855, 'sideways_rsi_os': 40, 'sideways_rsi_ob': 76, 'sideways_adx_thresh': 5.551047846552505, 'sideways_atr_min_pct': 0.009296438652387932, 'sideways_atr_max_pct': 0.03512872484384936, 'sideways_tp_mult': 2.7859465021718064, 'sideways_tsl_mult': 0.7896892070219981, 'sideways_time_stop': 110, 'sideways_use_sma': True, 'sideways_use_ema': False, 'sideways_use_atr': True, 'sideways_use_adx': True, 'sideways_use_spike': True, 'sideways_rsi_required': True}.
[I 2025-09-01 14:02:28,704] Trial 49 finished with values: [-1000000000.0, 1000000000.0] and parameters: {'p_sma': 29, 'p_std': 13, 'p_atr': 9, 'p_adx': 20, 'rsi_period': 57, 'ema1': 12, 'ema2': 24, 'slip_atr_k': 0.025155778563228082, 'slip_spread_k': 0.9235198607908368, 'spread_hl_frac': 0.03612250246645283, 'bb_std_mult': 3.3270802118318747, 'rsi_os': 47, 'rsi_ob': 51, 'vol_spike': 0.03731917939518711, 'adx_thresh': 25.021973313294417, 'atr_min_pct': 0.006220470102069119, 'atr_max_pct': 0.13325651458260976, 'tp_mult': 2.074597627845898, 'tsl_mult': 0.003909560693811709, 'strategy': 'mean_reversion', 'time_stop': 148, 'use_sma': False, 'use_atr': False, 'use_adx': False, 'use_ema': True, 'use_spike': False, 'rsi_required': True, 'edge_k': 0.25014895083904454, 'edge_cap': 0.7215269601340649, 'bull_strategy': 'mean_reversion', 'bull_bb_std_mult': 1.1420437935246703, 'bull_rsi_os': 40, 'bull_rsi_ob': 62, 'bull_adx_thresh': 11.120523915605135, 'bull_atr_min_pct': 0.003995478567015836, 'bull_atr_max_pct': 0.10886233537929484, 'bull_tp_mult': 1.4019532520586084, 'bull_tsl_mult': 0.5862545914466285, 'bull_time_stop': 110, 'bull_use_sma': True, 'bull_use_ema': True, 'bull_use_atr': True, 'bull_use_adx': False, 'bull_use_spike': False, 'bull_rsi_required': False, 'bear_strategy': 'breakout', 'bear_bb_std_mult': 2.651196912398871, 'bear_rsi_os': 46, 'bear_rsi_ob': 49, 'bear_adx_thresh': 22.958649072541874, 'bear_atr_min_pct': 0.019957953941751448, 'bear_atr_max_pct': 0.14807192809116018, 'bear_tp_mult': 2.1362073879706864, 'bear_tsl_mult': 0.8894731857632475, 'bear_time_stop': 124, 'bear_use_sma': False, 'bear_use_ema': True, 'bear_use_atr': False, 'bear_use_adx': False, 'bear_use_spike': False, 'bear_rsi_required': True, 'sideways_strategy': 'breakout', 'sideways_bb_std_mult': 1.4800801382229807, 'sideways_rsi_os': 39, 'sideways_rsi_ob': 76, 'sideways_adx_thresh': 26.45939313126867, 'sideways_atr_min_pct': 0.010741870069758566, 'sideways_atr_max_pct': 0.06115211892802323, 'sideways_tp_mult': 2.7830977926678235, 'sideways_tsl_mult': 0.6939262748967112, 'sideways_time_stop': 276, 'sideways_use_sma': False, 'sideways_use_ema': False, 'sideways_use_atr': True, 'sideways_use_adx': False, 'sideways_use_spike': True, 'sideways_rsi_required': True}.
[I 2025-09-01 14:02:29,169] Trial 47 finished with values: [-1000000000.0, 1000000000.0] and parameters: {'p_sma': 59, 'p_std': 52, 'p_atr': 28, 'p_adx': 18, 'rsi_period': 77, 'ema1': 22, 'ema2': 23, 'slip_atr_k': 0.026211836267072255, 'slip_spread_k': 0.5168054805336949, 'spread_hl_frac': 0.036336970182413934, 'bb_std_mult': 3.095098468538584, 'rsi_os': 47, 'rsi_ob': 67, 'vol_spike': 0.038263120656072805, 'adx_thresh': 29.380532481945764, 'atr_min_pct': 0.00235229201617688, 'atr_max_pct': 0.14065855495473364, 'tp_mult': 1.0202675162487451, 'tsl_mult': 0.08047600152044687, 'strategy': 'mean_reversion', 'time_stop': 168, 'use_sma': False, 'use_atr': True, 'use_adx': False, 'use_ema': True, 'use_spike': False, 'rsi_required': True, 'edge_k': 1.3299774213712054, 'edge_cap': 0.7365199384200019, 'bull_strategy': 'mean_reversion', 'bull_bb_std_mult': 1.7752180618172504, 'bull_rsi_os': 40, 'bull_rsi_ob': 57, 'bull_adx_thresh': 18.913305284989047, 'bull_atr_min_pct': 0.003961303965724012, 'bull_atr_max_pct': 0.059303857313009294, 'bull_tp_mult': 1.342594570489056, 'bull_tsl_mult': 0.1741333590509555, 'bull_time_stop': 238, 'bull_use_sma': True, 'bull_use_ema': False, 'bull_use_atr': True, 'bull_use_adx': True, 'bull_use_spike': False, 'bull_rsi_required': False, 'bear_strategy': 'breakout', 'bear_bb_std_mult': 1.8188607471538165, 'bear_rsi_os': 45, 'bear_rsi_ob': 61, 'bear_adx_thresh': 6.741086859193239, 'bear_atr_min_pct': 0.007777911845709692, 'bear_atr_max_pct': 0.11370378674846018, 'bear_tp_mult': 1.4417327209351525, 'bear_tsl_mult': 0.7361614342604144, 'bear_time_stop': 79, 'bear_use_sma': False, 'bear_use_ema': True, 'bear_use_atr': False, 'bear_use_adx': False, 'bear_use_spike': False, 'bear_rsi_required': True, 'sideways_strategy': 'breakout', 'sideways_bb_std_mult': 1.4786189811118389, 'sideways_rsi_os': 41, 'sideways_rsi_ob': 76, 'sideways_adx_thresh': 5.1360319704100785, 'sideways_atr_min_pct': 0.011215013040283535, 'sideways_atr_max_pct': 0.04904857339948965, 'sideways_tp_mult': 2.77409728219224, 'sideways_tsl_mult': 0.6966572426109688, 'sideways_time_stop': 279, 'sideways_use_sma': True, 'sideways_use_ema': True, 'sideways_use_atr': True, 'sideways_use_adx': False, 'sideways_use_spike': True, 'sideways_rsi_required': True}.
[I 2025-09-01 14:02:29,411] Trial 50 finished with values: [-1000000000.0, 1000000000.0] and parameters: {'p_sma': 35, 'p_std': 13, 'p_atr': 25, 'p_adx': 9, 'rsi_period': 63, 'ema1': 13, 'ema2': 25, 'slip_atr_k': 0.01021496788590931, 'slip_spread_k': 0.9897649715309342, 'spread_hl_frac': 0.004926295990048783, 'bb_std_mult': 1.7458766895252698, 'rsi_os': 15, 'rsi_ob': 91, 'vol_spike': 0.0012375814071003757, 'adx_thresh': 25.4741866161258, 'atr_min_pct': 0.0065355605041387405, 'atr_max_pct': 0.1147424289391336, 'tp_mult': 2.887254523017214, 'tsl_mult': 0.8603295924207048, 'strategy': 'breakout', 'time_stop': 194, 'use_sma': False, 'use_atr': False, 'use_adx': False, 'use_ema': True, 'use_spike': False, 'rsi_required': True, 'edge_k': 1.4199233357335774, 'edge_cap': 0.7057721936533875, 'bull_strategy': 'breakout', 'bull_bb_std_mult': 1.1427739750173367, 'bull_rsi_os': 47, 'bull_rsi_ob': 61, 'bull_adx_thresh': 11.786226180038463, 'bull_atr_min_pct': 0.0040240873524648975, 'bull_atr_max_pct': 0.10973190105179763, 'bull_tp_mult': 1.1168770420907899, 'bull_tsl_mult': 0.5891403743621781, 'bull_time_stop': 104, 'bull_use_sma': False, 'bull_use_ema': True, 'bull_use_atr': False, 'bull_use_adx': False, 'bull_use_spike': True, 'bull_rsi_required': True, 'bear_strategy': 'breakout', 'bear_bb_std_mult': 2.6537310358616057, 'bear_rsi_os': 41, 'bear_rsi_ob': 66, 'bear_adx_thresh': 25.634328092727046, 'bear_atr_min_pct': 0.02456935875612496, 'bear_atr_max_pct': 0.14440240263401832, 'bear_tp_mult': 2.331567369742082, 'bear_tsl_mult': 0.5158228481607022, 'bear_time_stop': 201, 'bear_use_sma': False, 'bear_use_ema': True, 'bear_use_atr': False, 'bear_use_adx': False, 'bear_use_spike': True, 'bear_rsi_required': True, 'sideways_strategy': 'breakout', 'sideways_bb_std_mult': 1.5323780605512256, 'sideways_rsi_os': 40, 'sideways_rsi_ob': 81, 'sideways_adx_thresh': 26.515289553284468, 'sideways_atr_min_pct': 0.010602035857595683, 'sideways_atr_max_pct': 0.14147704875150527, 'sideways_tp_mult': 2.969956716563277, 'sideways_tsl_mult': 0.7203658839648476, 'sideways_time_stop': 275, 'sideways_use_sma': False, 'sideways_use_ema': False, 'sideways_use_atr': True, 'sideways_use_adx': True, 'sideways_use_spike': True, 'sideways_rsi_required': True}.
[I 2025-09-01 14:02:29,714] Trial 51 finished with values: [-1000000000.0, 1000000000.0] and parameters: {'p_sma': 29, 'p_std': 13, 'p_atr': 8, 'p_adx': 7, 'rsi_period': 62, 'ema1': 23, 'ema2': 24, 'slip_atr_k': 0.012464320785462606, 'slip_spread_k': 0.9350133373624487, 'spread_hl_frac': 0.045534960997927726, 'bb_std_mult': 1.363947629377959, 'rsi_os': 15, 'rsi_ob': 73, 'vol_spike': 0.03600172777124837, 'adx_thresh': 16.481486683938634, 'atr_min_pct': 0.016546201788513668, 'atr_max_pct': 0.11465390964874696, 'tp_mult': 1.3570892960949341, 'tsl_mult': 0.614266448302163, 'strategy': 'breakout', 'time_stop': 72, 'use_sma': True, 'use_atr': False, 'use_adx': False, 'use_ema': True, 'use_spike': False, 'rsi_required': True, 'edge_k': 1.6415762505066016, 'edge_cap': 0.6275126043316521, 'bull_strategy': 'breakout', 'bull_bb_std_mult': 2.3684126202867475, 'bull_rsi_os': 21, 'bull_rsi_ob': 62, 'bull_adx_thresh': 17.901215118305828, 'bull_atr_min_pct': 0.025281516402777104, 'bull_atr_max_pct': 0.11603206702461885, 'bull_tp_mult': 1.2969125737172211, 'bull_tsl_mult': 0.9811015932126237, 'bull_time_stop': 103, 'bull_use_sma': False, 'bull_use_ema': True, 'bull_use_atr': False, 'bull_use_adx': False, 'bull_use_spike': True, 'bull_rsi_required': True, 'bear_strategy': 'breakout', 'bear_bb_std_mult': 1.5656109512221912, 'bear_rsi_os': 24, 'bear_rsi_ob': 95, 'bear_adx_thresh': 26.278539610167684, 'bear_atr_min_pct': 0.020778013418685744, 'bear_atr_max_pct': 0.011731064548987239, 'bear_tp_mult': 2.142531604358725, 'bear_tsl_mult': 0.4379614292696896, 'bear_time_stop': 199, 'bear_use_sma': False, 'bear_use_ema': True, 'bear_use_atr': False, 'bear_use_adx': False, 'bear_use_spike': False, 'bear_rsi_required': True, 'sideways_strategy': 'breakout', 'sideways_bb_std_mult': 1.4811466511646059, 'sideways_rsi_os': 11, 'sideways_rsi_ob': 86, 'sideways_adx_thresh': 26.72970440289447, 'sideways_atr_min_pct': 0.020030239006202395, 'sideways_atr_max_pct': 0.13978662681792242, 'sideways_tp_mult': 2.9290179470833726, 'sideways_tsl_mult': 0.7103626661678845, 'sideways_time_stop': 275, 'sideways_use_sma': False, 'sideways_use_ema': False, 'sideways_use_atr': False, 'sideways_use_adx': True, 'sideways_use_spike': True, 'sideways_rsi_required': False}.
[I 2025-09-01 14:03:09,188] Trial 55 finished with values: [-1000000000.0, 1000000000.0] and parameters: {'p_sma': 49, 'p_std': 7, 'p_atr': 23, 'p_adx': 25, 'rsi_period': 82, 'ema1': 18, 'ema2': 32, 'slip_atr_k': 0.05694285841582771, 'slip_spread_k': 0.4566860907338792, 'spread_hl_frac': 0.011846821160554391, 'bb_std_mult': 2.497847034362586, 'rsi_os': 28, 'rsi_ob': 78, 'vol_spike': 0.20301086581915886, 'adx_thresh': 32.78886408327865, 'atr_min_pct': 0.0013276966978270186, 'atr_max_pct': 0.14697422682388137, 'tp_mult': 2.743274225382839, 'tsl_mult': 0.20012983519919303, 'strategy': 'breakout', 'time_stop': 127, 'use_sma': False, 'use_atr': False, 'use_adx': True, 'use_ema': False, 'use_spike': True, 'rsi_required': False, 'edge_k': 1.0997091489916713, 'edge_cap': 0.5490424177352049, 'bull_strategy': 'breakout', 'bull_bb_std_mult': 1.538499061483213, 'bull_rsi_os': 43, 'bull_rsi_ob': 50, 'bull_adx_thresh': 16.696569653622497, 'bull_atr_min_pct': 0.01307887804156178, 'bull_atr_max_pct': 0.1356366538698749, 'bull_tp_mult': 1.257494338175102, 'bull_tsl_mult': 0.47082491383140884, 'bull_time_stop': 8, 'bull_use_sma': False, 'bull_use_ema': True, 'bull_use_atr': False, 'bull_use_adx': True, 'bull_use_spike': False, 'bull_rsi_required': True, 'bear_strategy': 'mean_reversion', 'bear_bb_std_mult': 2.0814942819037587, 'bear_rsi_os': 31, 'bear_rsi_ob': 52, 'bear_adx_thresh': 10.733064398256367, 'bear_atr_min_pct': 0.006091528250956497, 'bear_atr_max_pct': 0.033606492886441755, 'bear_tp_mult': 1.0117315219869507, 'bear_tsl_mult': 0.6164546820601827, 'bear_time_stop': 36, 'bear_use_sma': True, 'bear_use_ema': True, 'bear_use_atr': True, 'bear_use_adx': True, 'bear_use_spike': True, 'bear_rsi_required': False, 'sideways_strategy': 'breakout', 'sideways_bb_std_mult': 1.6924932016004328, 'sideways_rsi_os': 36, 'sideways_rsi_ob': 45, 'sideways_adx_thresh': 33.42390039842075, 'sideways_atr_min_pct': 0.01481702920164019, 'sideways_atr_max_pct': 0.036522729631449515, 'sideways_tp_mult': 1.3061345375364546, 'sideways_tsl_mult': 0.02024014528828394, 'sideways_time_stop': 59, 'sideways_use_sma': False, 'sideways_use_ema': True, 'sideways_use_atr': False, 'sideways_use_adx': True, 'sideways_use_spike': True, 'sideways_rsi_required': False}.
[I 2025-09-01 14:03:09,757] Trial 52 finished with values: [-1000000000.0, 1000000000.0] and parameters: {'p_sma': 49, 'p_std': 8, 'p_atr': 25, 'p_adx': 9, 'rsi_period': 64, 'ema1': 23, 'ema2': 32, 'slip_atr_k': 0.014500018885837844, 'slip_spread_k': 0.6713717271901634, 'spread_hl_frac': 0.04597191031450706, 'bb_std_mult': 1.7205799745602128, 'rsi_os': 30, 'rsi_ob': 73, 'vol_spike': 0.0326990188962307, 'adx_thresh': 27.747319396952175, 'atr_min_pct': 0.0166681302843184, 'atr_max_pct': 0.11416717022511845, 'tp_mult': 1.408160203552772, 'tsl_mult': 0.6148563178593398, 'strategy': 'breakout', 'time_stop': 188, 'use_sma': True, 'use_atr': False, 'use_adx': False, 'use_ema': False, 'use_spike': False, 'rsi_required': False, 'edge_k': 1.4602064331070008, 'edge_cap': 0.6179370969792125, 'bull_strategy': 'breakout', 'bull_bb_std_mult': 0.7054034441900208, 'bull_rsi_os': 43, 'bull_rsi_ob': 79, 'bull_adx_thresh': 17.446990538641735, 'bull_atr_min_pct': 0.012673522593093664, 'bull_atr_max_pct': 0.13698898551020894, 'bull_tp_mult': 1.2744610711573425, 'bull_tsl_mult': 0.8206475664189571, 'bull_time_stop': 131, 'bull_use_sma': False, 'bull_use_ema': True, 'bull_use_atr': False, 'bull_use_adx': False, 'bull_use_spike': True, 'bull_rsi_required': True, 'bear_strategy': 'mean_reversion', 'bear_bb_std_mult': 1.988311780094461, 'bear_rsi_os': 7, 'bear_rsi_ob': 67, 'bear_adx_thresh': 25.205030621704616, 'bear_atr_min_pct': 0.001929087434443054, 'bear_atr_max_pct': 0.01328928959170028, 'bear_tp_mult': 2.3537177420818907, 'bear_tsl_mult': 0.46228160372955174, 'bear_time_stop': 279, 'bear_use_sma': False, 'bear_use_ema': True, 'bear_use_atr': True, 'bear_use_adx': False, 'bear_use_spike': True, 'bear_rsi_required': False, 'sideways_strategy': 'breakout', 'sideways_bb_std_mult': 1.6852823439613984, 'sideways_rsi_os': 11, 'sideways_rsi_ob': 49, 'sideways_adx_thresh': 29.43564902153871, 'sideways_atr_min_pct': 0.014266118857766342, 'sideways_atr_max_pct': 0.1460058193719, 'sideways_tp_mult': 2.199110546054204, 'sideways_tsl_mult': 0.031663728350771914, 'sideways_time_stop': 282, 'sideways_use_sma': False, 'sideways_use_ema': True, 'sideways_use_atr': False, 'sideways_use_adx': True, 'sideways_use_spike': True, 'sideways_rsi_required': False}.
