[I 2025-09-01 14:27:31,178] Trial 204 finished with values: [-1000000000.0, 1000000000.0] and parameters: {'p_sma': 26, 'p_std': 41, 'p_atr': 14, 'p_adx': 22, 'rsi_period': 73, 'ema1': 10, 'ema2': 39, 'slip_atr_k': 0.03705495717811293, 'slip_spread_k': 0.28572327219525706, 'spread_hl_frac': 0.04028739973191802, 'bb_std_mult': 2.609267308246214, 'rsi_os': 38, 'rsi_ob': 83, 'vol_spike': 0.2709514710015137, 'adx_thresh': 23.54596277588777, 'atr_min_pct': 0.0076621007487214215, 'atr_max_pct': 0.07579157265801018, 'tp_mult': 2.3573212531114356, 'tsl_mult': 0.6146730449448491, 'strategy': 'breakout', 'time_stop': 74, 'use_sma': False, 'use_atr': False, 'use_adx': True, 'use_ema': True, 'use_spike': True, 'rsi_required': False, 'edge_k': 0.5250231880806934, 'edge_cap': 0.9308606214618929, 'bull_strategy': 'breakout', 'bull_bb_std_mult': 1.4900181217464468, 'bull_rsi_os': 20, 'bull_rsi_ob': 57, 'bull_adx_thresh': 22.999882887560542, 'bull_atr_min_pct': 0.010262744928484047, 'bull_atr_max_pct': 0.03766275053359519, 'bull_tp_mult': 1.125919615935243, 'bull_tsl_mult': 0.8282310726658799, 'bull_time_stop': 242, 'bull_use_sma': True, 'bull_use_ema': True, 'bull_use_atr': False, 'bull_use_adx': False, 'bull_use_spike': False, 'bull_rsi_required': False, 'bear_strategy': 'mean_reversion', 'bear_bb_std_mult': 1.3713553016401783, 'bear_rsi_os': 52, 'bear_rsi_ob': 45, 'bear_adx_thresh': 25.171110890234665, 'bear_atr_min_pct': 0.006197222437193764, 'bear_atr_max_pct': 0.07080623873629456, 'bear_tp_mult': 1.653929238900251, 'bear_tsl_mult': 0.09236123990466188, 'bear_time_stop': 243, 'bear_use_sma': False, 'bear_use_ema': False, 'bear_use_atr': True, 'bear_use_adx': True, 'bear_use_spike': False, 'bear_rsi_required': False, 'sideways_strategy': 'mean_reversion', 'sideways_bb_std_mult': 1.4550727632983695, 'sideways_rsi_os': 22, 'sideways_rsi_ob': 56, 'sideways_adx_thresh': 33.621030100788396, 'sideways_atr_min_pct': 0.0027930963261540206, 'sideways_atr_max_pct': 0.03688931061463676, 'sideways_tp_mult': 2.1880764396770993, 'sideways_tsl_mult': 0.7686938375227272, 'sideways_time_stop': 108, 'sideways_use_sma': True, 'sideways_use_ema': True, 'sideways_use_atr': False, 'sideways_use_adx': False, 'sideways_use_spike': True, 'sideways_rsi_required': True}.
[I 2025-09-01 14:27:31,805] Trial 211 finished with values: [-1000000000.0, 1000000000.0] and parameters: {'p_sma': 21, 'p_std': 10, 'p_atr': 15, 'p_adx': 23, 'rsi_period': 26, 'ema1': 13, 'ema2': 41, 'slip_atr_k': 0.1745170214896276, 'slip_spread_k': 0.011087205948979606, 'spread_hl_frac': 0.0050902104558440235, 'bb_std_mult': 1.4306249385010728, 'rsi_os': 22, 'rsi_ob': 47, 'vol_spike': 0.11972889333701442, 'adx_thresh': 25.776042194956077, 'atr_min_pct': 0.009494651201168314, 'atr_max_pct': 0.04719844069317641, 'tp_mult': 1.5795757959809213, 'tsl_mult': 0.96505689553402, 'strategy': 'mean_reversion', 'time_stop': 109, 'use_sma': True, 'use_atr': False, 'use_adx': False, 'use_ema': False, 'use_spike': False, 'rsi_required': True, 'edge_k': 0.4373634549741334, 'edge_cap': 0.07085660873580513, 'bull_strategy': 'breakout', 'bull_bb_std_mult': 3.0568481480067637, 'bull_rsi_os': 18, 'bull_rsi_ob': 55, 'bull_adx_thresh': 11.186413053840397, 'bull_atr_min_pct': 0.004786046931097826, 'bull_atr_max_pct': 0.07546282439232, 'bull_tp_mult': 1.1785814925204874, 'bull_tsl_mult': 0.931667868033421, 'bull_time_stop': 11, 'bull_use_sma': False, 'bull_use_ema': False, 'bull_use_atr': True, 'bull_use_adx': True, 'bull_use_spike': False, 'bull_rsi_required': True, 'bear_strategy': 'breakout', 'bear_bb_std_mult': 1.1768427466468836, 'bear_rsi_os': 55, 'bear_rsi_ob': 94, 'bear_adx_thresh': 6.732996584238673, 'bear_atr_min_pct': 0.006974910356807384, 'bear_atr_max_pct': 0.020948073336326357, 'bear_tp_mult': 1.745019253453601, 'bear_tsl_mult': 0.6436812684570972, 'bear_time_stop': 251, 'bear_use_sma': False, 'bear_use_ema': True, 'bear_use_atr': False, 'bear_use_adx': False, 'bear_use_spike': True, 'bear_rsi_required': True, 'sideways_strategy': 'mean_reversion', 'sideways_bb_std_mult': 2.4355835280841256, 'sideways_rsi_os': 39, 'sideways_rsi_ob': 91, 'sideways_adx_thresh': 32.474840490820654, 'sideways_atr_min_pct': 0.01731216227451237, 'sideways_atr_max_pct': 0.11370785700474394, 'sideways_tp_mult': 2.609049768976532, 'sideways_tsl_mult': 0.9528833867945862, 'sideways_time_stop': 70, 'sideways_use_sma': True, 'sideways_use_ema': True, 'sideways_use_atr': True, 'sideways_use_adx': True, 'sideways_use_spike': False, 'sideways_rsi_required': False}.
[I 2025-09-01 14:28:09,839] Trial 210 finished with values: [-1000000000.0, 1000000000.0] and parameters: {'p_sma': 15, 'p_std': 10, 'p_atr': 15, 'p_adx': 23, 'rsi_period': 73, 'ema1': 11, 'ema2': 40, 'slip_atr_k': 0.19614523456155528, 'slip_spread_k': 0.278796946889339, 'spread_hl_frac': 0.04308254420981135, 'bb_std_mult': 1.4222176941722477, 'rsi_os': 21, 'rsi_ob': 68, 'vol_spike': 0.12284375403350715, 'adx_thresh': 29.615320033250935, 'atr_min_pct': 0.0048269613770259776, 'atr_max_pct': 0.07499046244722418, 'tp_mult': 2.4435682908841905, 'tsl_mult': 0.8790290457198184, 'strategy': 'mean_reversion', 'time_stop': 109, 'use_sma': True, 'use_atr': False, 'use_adx': False, 'use_ema': False, 'use_spike': False, 'rsi_required': True, 'edge_k': 0.46148516316617705, 'edge_cap': 0.2577178196241624, 'bull_strategy': 'breakout', 'bull_bb_std_mult': 1.7926917578602015, 'bull_rsi_os': 19, 'bull_rsi_ob': 55, 'bull_adx_thresh': 11.2448597672703, 'bull_atr_min_pct': 0.00987951053924117, 'bull_atr_max_pct': 0.13194771906951375, 'bull_tp_mult': 2.39091613632401, 'bull_tsl_mult': 0.9342315550135781, 'bull_time_stop': 230, 'bull_use_sma': False, 'bull_use_ema': False, 'bull_use_atr': True, 'bull_use_adx': True, 'bull_use_spike': False, 'bull_rsi_required': True, 'bear_strategy': 'breakout', 'bear_bb_std_mult': 1.4083245830955362, 'bear_rsi_os': 52, 'bear_rsi_ob': 47, 'bear_adx_thresh': 17.922962305780715, 'bear_atr_min_pct': 0.0068391395423128415, 'bear_atr_max_pct': 0.06640785148663421, 'bear_tp_mult': 1.7410076999998614, 'bear_tsl_mult': 0.6438704870836118, 'bear_time_stop': 252, 'bear_use_sma': False, 'bear_use_ema': False, 'bear_use_atr': False, 'bear_use_adx': False, 'bear_use_spike': True, 'bear_rsi_required': True, 'sideways_strategy': 'mean_reversion', 'sideways_bb_std_mult': 1.8972869299502995, 'sideways_rsi_os': 35, 'sideways_rsi_ob': 77, 'sideways_adx_thresh': 32.96380875474912, 'sideways_atr_min_pct': 0.017381397652423396, 'sideways_atr_max_pct': 0.023515170381945623, 'sideways_tp_mult': 2.578475914391927, 'sideways_tsl_mult': 0.6231591897141018, 'sideways_time_stop': 68, 'sideways_use_sma': True, 'sideways_use_ema': True, 'sideways_use_atr': True, 'sideways_use_adx': True, 'sideways_use_spike': False, 'sideways_rsi_required': False}.
[I 2025-09-01 14:28:10,398] Trial 209 finished with values: [-1000000000.0, 1000000000.0] and parameters: {'p_sma': 26, 'p_std': 38, 'p_atr': 14, 'p_adx': 23, 'rsi_period': 72, 'ema1': 27, 'ema2': 37, 'slip_atr_k': 0.12955732107541343, 'slip_spread_k': 0.0012933759211629092, 'spread_hl_frac': 0.043482044797607866, 'bb_std_mult': 2.4727586435819893, 'rsi_os': 47, 'rsi_ob': 82, 'vol_spike': 0.08288465651237267, 'adx_thresh': 31.262982059299162, 'atr_min_pct': 0.005482316817434425, 'atr_max_pct': 0.07588613633739738, 'tp_mult': 1.5968910881717058, 'tsl_mult': 0.45432753725156544, 'strategy': 'mean_reversion', 'time_stop': 73, 'use_sma': False, 'use_atr': False, 'use_adx': False, 'use_ema': False, 'use_spike': False, 'rsi_required': True, 'edge_k': 0.48537230945199983, 'edge_cap': 0.9500879629216228, 'bull_strategy': 'breakout', 'bull_bb_std_mult': 0.5693266328977986, 'bull_rsi_os': 19, 'bull_rsi_ob': 56, 'bull_adx_thresh': 21.42615845612406, 'bull_atr_min_pct': 0.004480424397171404, 'bull_atr_max_pct': 0.10231300557957526, 'bull_tp_mult': 2.40815386894682, 'bull_tsl_mult': 0.8437415474240444, 'bull_time_stop': 227, 'bull_use_sma': False, 'bull_use_ema': True, 'bull_use_atr': True, 'bull_use_adx': True, 'bull_use_spike': False, 'bull_rsi_required': True, 'bear_strategy': 'breakout', 'bear_bb_std_mult': 1.1575686167278592, 'bear_rsi_os': 52, 'bear_rsi_ob': 45, 'bear_adx_thresh': 17.645248562911107, 'bear_atr_min_pct': 0.006982991106423021, 'bear_atr_max_pct': 0.020459738716777094, 'bear_tp_mult': 1.7482488270996883, 'bear_tsl_mult': 0.9724927264693968, 'bear_time_stop': 275, 'bear_use_sma': False, 'bear_use_ema': False, 'bear_use_atr': False, 'bear_use_adx': False, 'bear_use_spike': True, 'bear_rsi_required': True, 'sideways_strategy': 'mean_reversion', 'sideways_bb_std_mult': 1.675291122964481, 'sideways_rsi_os': 22, 'sideways_rsi_ob': 64, 'sideways_adx_thresh': 6.356904756280542, 'sideways_atr_min_pct': 0.0172345173755173, 'sideways_atr_max_pct': 0.12143400765840295, 'sideways_tp_mult': 2.606268134175929, 'sideways_tsl_mult': 0.6105664545976949, 'sideways_time_stop': 66, 'sideways_use_sma': True, 'sideways_use_ema': True, 'sideways_use_atr': True, 'sideways_use_adx': True, 'sideways_use_spike': True, 'sideways_rsi_required': False}.
[I 2025-09-01 14:28:10,749] Trial 208 finished with values: [-0.01315386188789014, 0.018627733768360216] and parameters: {'p_sma': 58, 'p_std': 41, 'p_atr': 14, 'p_adx': 23, 'rsi_period': 69, 'ema1': 8, 'ema2': 39, 'slip_atr_k': 0.047739026322025126, 'slip_spread_k': 0.006149987122553324, 'spread_hl_frac': 0.04318816125463061, 'bb_std_mult': 2.6277848639011774, 'rsi_os': 47, 'rsi_ob': 83, 'vol_spike': 0.12005816591153254, 'adx_thresh': 34.891249610405126, 'atr_min_pct': 0.025728883692271838, 'atr_max_pct': 0.03691316046430675, 'tp_mult': 1.6456395667562649, 'tsl_mult': 0.08819700936743907, 'strategy': 'mean_reversion', 'time_stop': 109, 'use_sma': False, 'use_atr': False, 'use_adx': False, 'use_ema': False, 'use_spike': False, 'rsi_required': True, 'edge_k': 0.4874796963067942, 'edge_cap': 0.9078057227256393, 'bull_strategy': 'breakout', 'bull_bb_std_mult': 2.0321360351202746, 'bull_rsi_os': 19, 'bull_rsi_ob': 54, 'bull_adx_thresh': 18.71724305852403, 'bull_atr_min_pct': 0.004591762724900962, 'bull_atr_max_pct': 0.032483223176227004, 'bull_tp_mult': 2.415134864535151, 'bull_tsl_mult': 0.8503659778909792, 'bull_time_stop': 128, 'bull_use_sma': False, 'bull_use_ema': True, 'bull_use_atr': True, 'bull_use_adx': True, 'bull_use_spike': False, 'bull_rsi_required': True, 'bear_strategy': 'breakout', 'bear_bb_std_mult': 1.382208878666757, 'bear_rsi_os': 52, 'bear_rsi_ob': 53, 'bear_adx_thresh': 5.616323380458082, 'bear_atr_min_pct': 0.005510551796474483, 'bear_atr_max_pct': 0.06504407659102672, 'bear_tp_mult': 1.0554140285631868, 'bear_tsl_mult': 0.1844633356819123, 'bear_time_stop': 101, 'bear_use_sma': False, 'bear_use_ema': True, 'bear_use_atr': False, 'bear_use_adx': False, 'bear_use_spike': False, 'bear_rsi_required': True, 'sideways_strategy': 'mean_reversion', 'sideways_bb_std_mult': 1.9115474436826392, 'sideways_rsi_os': 35, 'sideways_rsi_ob': 92, 'sideways_adx_thresh': 6.250171976568602, 'sideways_atr_min_pct': 0.017392957246492913, 'sideways_atr_max_pct': 0.11999383360373114, 'sideways_tp_mult': 2.585255664811052, 'sideways_tsl_mult': 0.9961322503135768, 'sideways_time_stop': 108, 'sideways_use_sma': True, 'sideways_use_ema': True, 'sideways_use_atr': True, 'sideways_use_adx': True, 'sideways_use_spike': True, 'sideways_rsi_required': False}.
[I 2025-09-01 14:28:10,913] Trial 212 finished with values: [-0.04077935342534689, 0.04029112987433181] and parameters: {'p_sma': 60, 'p_std': 47, 'p_atr': 13, 'p_adx': 21, 'rsi_period': 69, 'ema1': 27, 'ema2': 37, 'slip_atr_k': 0.12441065932216036, 'slip_spread_k': 0.6179894193599037, 'spread_hl_frac': 0.041316753783119185, 'bb_std_mult': 1.9079722527069292, 'rsi_os': 8, 'rsi_ob': 55, 'vol_spike': 0.012242219394958167, 'adx_thresh': 29.079266419381185, 'atr_min_pct': 0.02560512057437386, 'atr_max_pct': 0.07117419212792764, 'tp_mult': 2.8705105432752336, 'tsl_mult': 0.5394331419112623, 'strategy': 'mean_reversion', 'time_stop': 182, 'use_sma': False, 'use_atr': False, 'use_adx': False, 'use_ema': False, 'use_spike': False, 'rsi_required': True, 'edge_k': 0.6235928693391393, 'edge_cap': 0.24124917768925652, 'bull_strategy': 'breakout', 'bull_bb_std_mult': 3.517376165461136, 'bull_rsi_os': 39, 'bull_rsi_ob': 54, 'bull_adx_thresh': 10.340034780557003, 'bull_atr_min_pct': 0.027904886003378437, 'bull_atr_max_pct': 0.10172539016487364, 'bull_tp_mult': 2.614432421531383, 'bull_tsl_mult': 0.9139372548725282, 'bull_time_stop': 230, 'bull_use_sma': False, 'bull_use_ema': False, 'bull_use_atr': True, 'bull_use_adx': True, 'bull_use_spike': False, 'bull_rsi_required': True, 'bear_strategy': 'breakout', 'bear_bb_std_mult': 1.384344537545171, 'bear_rsi_os': 51, 'bear_rsi_ob': 90, 'bear_adx_thresh': 5.643529285350014, 'bear_atr_min_pct': 0.004757355930528994, 'bear_atr_max_pct': 0.017456033889085194, 'bear_tp_mult': 1.8116288177445026, 'bear_tsl_mult': 0.9711662040845987, 'bear_time_stop': 25, 'bear_use_sma': False, 'bear_use_ema': False, 'bear_use_atr': False, 'bear_use_adx': False, 'bear_use_spike': False, 'bear_rsi_required': True, 'sideways_strategy': 'mean_reversion', 'sideways_bb_std_mult': 1.9060246407488959, 'sideways_rsi_os': 29, 'sideways_rsi_ob': 77, 'sideways_adx_thresh': 34.01152896305052, 'sideways_atr_min_pct': 0.005831538433792735, 'sideways_atr_max_pct': 0.027332478564174582, 'sideways_tp_mult': 2.658675228711796, 'sideways_tsl_mult': 0.7372757333243171, 'sideways_time_stop': 187, 'sideways_use_sma': True, 'sideways_use_ema': False, 'sideways_use_atr': True, 'sideways_use_adx': True, 'sideways_use_spike': True, 'sideways_rsi_required': False}.
[I 2025-09-01 14:28:48,013] Trial 216 finished with values: [-1000000000.0, 1000000000.0] and parameters: {'p_sma': 52, 'p_std': 30, 'p_atr': 14, 'p_adx': 19, 'rsi_period': 62, 'ema1': 28, 'ema2': 32, 'slip_atr_k': 0.03248290600724698, 'slip_spread_k': 0.46442776212470377, 'spread_hl_frac': 0.04120799218788483, 'bb_std_mult': 2.5585582211156983, 'rsi_os': 7, 'rsi_ob': 83, 'vol_spike': 0.01624171943862074, 'adx_thresh': 28.43191835263857, 'atr_min_pct': 0.007027687163172316, 'atr_max_pct': 0.11036290801634066, 'tp_mult': 2.9968170399585294, 'tsl_mult': 0.3548816469534215, 'strategy': 'breakout', 'time_stop': 120, 'use_sma': False, 'use_atr': False, 'use_adx': True, 'use_ema': False, 'use_spike': False, 'rsi_required': True, 'edge_k': 0.5828489471207581, 'edge_cap': 0.975748533654034, 'bull_strategy': 'breakout', 'bull_bb_std_mult': 1.4144341746598175, 'bull_rsi_os': 46, 'bull_rsi_ob': 54, 'bull_adx_thresh': 33.88204225406972, 'bull_atr_min_pct': 0.013928770265013808, 'bull_atr_max_pct': 0.03360353110540215, 'bull_tp_mult': 1.2942119218944923, 'bull_tsl_mult': 0.8835429191869376, 'bull_time_stop': 24, 'bull_use_sma': False, 'bull_use_ema': True, 'bull_use_atr': False, 'bull_use_adx': True, 'bull_use_spike': True, 'bull_rsi_required': True, 'bear_strategy': 'breakout', 'bear_bb_std_mult': 2.1193512103450787, 'bear_rsi_os': 53, 'bear_rsi_ob': 74, 'bear_adx_thresh': 20.626507086631403, 'bear_atr_min_pct': 0.005543703986678363, 'bear_atr_max_pct': 0.12030098898754574, 'bear_tp_mult': 1.050186210497697, 'bear_tsl_mult': 0.602415440973008, 'bear_time_stop': 234, 'bear_use_sma': False, 'bear_use_ema': True, 'bear_use_atr': False, 'bear_use_adx': False, 'bear_use_spike': False, 'bear_rsi_required': True, 'sideways_strategy': 'breakout', 'sideways_bb_std_mult': 2.737876017887392, 'sideways_rsi_os': 31, 'sideways_rsi_ob': 79, 'sideways_adx_thresh': 34.98857497280382, 'sideways_atr_min_pct': 0.01843845644428715, 'sideways_atr_max_pct': 0.03341644992595362, 'sideways_tp_mult': 2.7234138475615017, 'sideways_tsl_mult': 0.7858803291447052, 'sideways_time_stop': 89, 'sideways_use_sma': False, 'sideways_use_ema': False, 'sideways_use_atr': False, 'sideways_use_adx': True, 'sideways_use_spike': True, 'sideways_rsi_required': False}.
[I 2025-09-01 14:28:48,732] Trial 215 finished with values: [-1000000000.0, 1000000000.0] and parameters: {'p_sma': 25, 'p_std': 14, 'p_atr': 13, 'p_adx': 21, 'rsi_period': 63, 'ema1': 29, 'ema2': 36, 'slip_atr_k': 0.03248050618473777, 'slip_spread_k': 0.45520057528164476, 'spread_hl_frac': 0.04134653761700979, 'bb_std_mult': 2.5423477838647623, 'rsi_os': 8, 'rsi_ob': 85, 'vol_spike': 0.013129385820370824, 'adx_thresh': 32.61104200507295, 'atr_min_pct': 0.0069723954298782104, 'atr_max_pct': 0.08722639973449228, 'tp_mult': 2.31603797885502, 'tsl_mult': 0.9282635201320046, 'strategy': 'breakout', 'time_stop': 151, 'use_sma': False, 'use_atr': False, 'use_adx': False, 'use_ema': False, 'use_spike': False, 'rsi_required': True, 'edge_k': 0.5861360995505518, 'edge_cap': 0.968253179183543, 'bull_strategy': 'breakout', 'bull_bb_std_mult': 1.3776469884686353, 'bull_rsi_os': 18, 'bull_rsi_ob': 54, 'bull_adx_thresh': 15.306022129391543, 'bull_atr_min_pct': 0.02031808157416209, 'bull_atr_max_pct': 0.06946144654439786, 'bull_tp_mult': 2.9958760293246987, 'bull_tsl_mult': 0.8928864857827224, 'bull_time_stop': 19, 'bull_use_sma': False, 'bull_use_ema': True, 'bull_use_atr': False, 'bull_use_adx': True, 'bull_use_spike': False, 'bull_rsi_required': True, 'bear_strategy': 'breakout', 'bear_bb_std_mult': 2.1313375761258015, 'bear_rsi_os': 54, 'bear_rsi_ob': 74, 'bear_adx_thresh': 5.653786174871512, 'bear_atr_min_pct': 0.020566639790454182, 'bear_atr_max_pct': 0.016803092055391114, 'bear_tp_mult': 1.805832421270415, 'bear_tsl_mult': 0.6086686237129205, 'bear_time_stop': 62, 'bear_use_sma': False, 'bear_use_ema': True, 'bear_use_atr': False, 'bear_use_adx': False, 'bear_use_spike': False, 'bear_rsi_required': True, 'sideways_strategy': 'mean_reversion', 'sideways_bb_std_mult': 1.3920379025179221, 'sideways_rsi_os': 32, 'sideways_rsi_ob': 77, 'sideways_adx_thresh': 34.38512771696249, 'sideways_atr_min_pct': 0.0015892606147566088, 'sideways_atr_max_pct': 0.1292647957986339, 'sideways_tp_mult': 2.6640189878237694, 'sideways_tsl_mult': 0.7363180875031496, 'sideways_time_stop': 78, 'sideways_use_sma': True, 'sideways_use_ema': False, 'sideways_use_atr': False, 'sideways_use_adx': True, 'sideways_use_spike': True, 'sideways_rsi_required': False}.
[I 2025-09-01 14:28:49,448] Trial 214 finished with values: [-0.02505682762033634, 0.02672455351692518] and parameters: {'p_sma': 17, 'p_std': 9, 'p_atr': 13, 'p_adx': 24, 'rsi_period': 67, 'ema1': 29, 'ema2': 41, 'slip_atr_k': 0.032722529586900084, 'slip_spread_k': 0.45187349319102044, 'spread_hl_frac': 0.03328760174418164, 'bb_std_mult': 1.6797734422267745, 'rsi_os': 8, 'rsi_ob': 72, 'vol_spike': 0.013289711150259913, 'adx_thresh': 26.382028772752438, 'atr_min_pct': 0.025357394849842885, 'atr_max_pct': 0.06693473811656571, 'tp_mult': 1.349064816599563, 'tsl_mult': 0.3743539766236651, 'strategy': 'breakout', 'time_stop': 98, 'use_sma': False, 'use_atr': False, 'use_adx': False, 'use_ema': False, 'use_spike': False, 'rsi_required': True, 'edge_k': 0.5937661972108822, 'edge_cap': 0.9695876306806513, 'bull_strategy': 'breakout', 'bull_bb_std_mult': 1.3848785363480955, 'bull_rsi_os': 18, 'bull_rsi_ob': 91, 'bull_adx_thresh': 33.936867777698446, 'bull_atr_min_pct': 0.0038518695701514156, 'bull_atr_max_pct': 0.06926159496324104, 'bull_tp_mult': 1.292527029801304, 'bull_tsl_mult': 0.8801799852863965, 'bull_time_stop': 21, 'bull_use_sma': False, 'bull_use_ema': True, 'bull_use_atr': False, 'bull_use_adx': True, 'bull_use_spike': False, 'bull_rsi_required': True, 'bear_strategy': 'breakout', 'bear_bb_std_mult': 1.4810360294114573, 'bear_rsi_os': 44, 'bear_rsi_ob': 90, 'bear_adx_thresh': 5.702776415076598, 'bear_atr_min_pct': 0.00474305862145129, 'bear_atr_max_pct': 0.015734844129968062, 'bear_tp_mult': 2.894462180040218, 'bear_tsl_mult': 0.6051189416370382, 'bear_time_stop': 22, 'bear_use_sma': False, 'bear_use_ema': True, 'bear_use_atr': False, 'bear_use_adx': False, 'bear_use_spike': False, 'bear_rsi_required': True, 'sideways_strategy': 'mean_reversion', 'sideways_bb_std_mult': 2.7400078890819457, 'sideways_rsi_os': 25, 'sideways_rsi_ob': 69, 'sideways_adx_thresh': 34.480911015916796, 'sideways_atr_min_pct': 0.001290167446319674, 'sideways_atr_max_pct': 0.12954012077246208, 'sideways_tp_mult': 1.3833523438048432, 'sideways_tsl_mult': 0.7792439653470857, 'sideways_time_stop': 27, 'sideways_use_sma': True, 'sideways_use_ema': False, 'sideways_use_atr': False, 'sideways_use_adx': True, 'sideways_use_spike': True, 'sideways_rsi_required': False}.
