[I 2025-09-01 15:06:03,408] Trial 452 finished with values: [-1000000000.0, 1000000000.0] and parameters: {'p_sma': 57, 'p_std': 57, 'p_atr': 11, 'p_adx': 14, 'rsi_period': 26, 'ema1': 5, 'ema2': 57, 'slip_atr_k': 0.02280967157368491, 'slip_spread_k': 0.7390274566101281, 'spread_hl_frac': 0.03193294832476187, 'bb_std_mult': 2.2516054340857994, 'rsi_os': 32, 'rsi_ob': 80, 'vol_spike': 0.07864986305110976, 'adx_thresh': 26.93287832491565, 'atr_min_pct': 0.017598217457096898, 'atr_max_pct': 0.12541850429532558, 'tp_mult': 1.9836420391232792, 'tsl_mult': 0.3365746561446548, 'strategy': 'mean_reversion', 'time_stop': 36, 'use_sma': True, 'use_atr': True, 'use_adx': False, 'use_ema': True, 'use_spike': False, 'rsi_required': True, 'edge_k': 1.3917301783434128, 'edge_cap': 0.5729131094577881, 'bull_strategy': 'mean_reversion', 'bull_bb_std_mult': 0.8202589239065843, 'bull_rsi_os': 22, 'bull_rsi_ob': 62, 'bull_adx_thresh': 6.076853498281836, 'bull_atr_min_pct': 0.015338585426386539, 'bull_atr_max_pct': 0.10157150547517393, 'bull_tp_mult': 1.3449922396471157, 'bull_tsl_mult': 0.3188469928860985, 'bull_time_stop': 117, 'bull_use_sma': False, 'bull_use_ema': True, 'bull_use_atr': True, 'bull_use_adx': False, 'bull_use_spike': False, 'bull_rsi_required': True, 'bear_strategy': 'breakout', 'bear_bb_std_mult': 1.39325211894841, 'bear_rsi_os': 28, 'bear_rsi_ob': 50, 'bear_adx_thresh': 9.427527695263574, 'bear_atr_min_pct': 0.005207091162902363, 'bear_atr_max_pct': 0.037441481933157494, 'bear_tp_mult': 1.677294366016192, 'bear_tsl_mult': 0.6740746721758708, 'bear_time_stop': 102, 'bear_use_sma': True, 'bear_use_ema': False, 'bear_use_atr': False, 'bear_use_adx': False, 'bear_use_spike': True, 'bear_rsi_required': True, 'sideways_strategy': 'mean_reversion', 'sideways_bb_std_mult': 1.1274385665477253, 'sideways_rsi_os': 25, 'sideways_rsi_ob': 65, 'sideways_adx_thresh': 32.727829338691585, 'sideways_atr_min_pct': 0.013011266684990998, 'sideways_atr_max_pct': 0.052614755557284856, 'sideways_tp_mult': 2.2536351561581194, 'sideways_tsl_mult': 0.7653906248258319, 'sideways_time_stop': 48, 'sideways_use_sma': True, 'sideways_use_ema': False, 'sideways_use_atr': True, 'sideways_use_adx': False, 'sideways_use_spike': False, 'sideways_rsi_required': True}.
[I 2025-09-01 15:06:03,851] Trial 451 finished with values: [-1000000000.0, 1000000000.0] and parameters: {'p_sma': 13, 'p_std': 26, 'p_atr': 13, 'p_adx': 14, 'rsi_period': 74, 'ema1': 9, 'ema2': 50, 'slip_atr_k': 0.02177806183740151, 'slip_spread_k': 0.34164051999112066, 'spread_hl_frac': 0.003555161108724874, 'bb_std_mult': 3.5539726584172127, 'rsi_os': 30, 'rsi_ob': 95, 'vol_spike': 0.07839152165229837, 'adx_thresh': 8.693882674948785, 'atr_min_pct': 0.017350983208485035, 'atr_max_pct': 0.11010519949422792, 'tp_mult': 1.830594697911726, 'tsl_mult': 0.4459827277995575, 'strategy': 'mean_reversion', 'time_stop': 36, 'use_sma': True, 'use_atr': True, 'use_adx': False, 'use_ema': True, 'use_spike': False, 'rsi_required': True, 'edge_k': 1.3464813253533061, 'edge_cap': 0.920278228335498, 'bull_strategy': 'mean_reversion', 'bull_bb_std_mult': 0.853588802737191, 'bull_rsi_os': 22, 'bull_rsi_ob': 62, 'bull_adx_thresh': 31.460869033417122, 'bull_atr_min_pct': 0.015565123403984159, 'bull_atr_max_pct': 0.03170548388982395, 'bull_tp_mult': 1.3422847009652386, 'bull_tsl_mult': 0.47352770513438364, 'bull_time_stop': 209, 'bull_use_sma': False, 'bull_use_ema': True, 'bull_use_atr': True, 'bull_use_adx': False, 'bull_use_spike': False, 'bull_rsi_required': True, 'bear_strategy': 'breakout', 'bear_bb_std_mult': 1.418152755304315, 'bear_rsi_os': 51, 'bear_rsi_ob': 50, 'bear_adx_thresh': 9.44850226503063, 'bear_atr_min_pct': 0.0053649544260978045, 'bear_atr_max_pct': 0.050419668732481424, 'bear_tp_mult': 1.693282871061471, 'bear_tsl_mult': 0.8260420942759132, 'bear_time_stop': 27, 'bear_use_sma': True, 'bear_use_ema': False, 'bear_use_atr': False, 'bear_use_adx': False, 'bear_use_spike': True, 'bear_rsi_required': True, 'sideways_strategy': 'mean_reversion', 'sideways_bb_std_mult': 1.1499157768618917, 'sideways_rsi_os': 12, 'sideways_rsi_ob': 80, 'sideways_adx_thresh': 31.965868073725964, 'sideways_atr_min_pct': 0.01278764120827782, 'sideways_atr_max_pct': 0.05399003459396973, 'sideways_tp_mult': 2.26270086033579, 'sideways_tsl_mult': 0.00019588083529858968, 'sideways_time_stop': 9, 'sideways_use_sma': True, 'sideways_use_ema': False, 'sideways_use_atr': True, 'sideways_use_adx': False, 'sideways_use_spike': False, 'sideways_rsi_required': True}.
[I 2025-09-01 15:06:04,356] Trial 449 finished with values: [-1000000000.0, 1000000000.0] and parameters: {'p_sma': 59, 'p_std': 24, 'p_atr': 13, 'p_adx': 13, 'rsi_period': 19, 'ema1': 5, 'ema2': 59, 'slip_atr_k': 0.01758895806826137, 'slip_spread_k': 0.9356601481965457, 'spread_hl_frac': 0.017937173117057503, 'bb_std_mult': 3.5392723106435318, 'rsi_os': 26, 'rsi_ob': 95, 'vol_spike': 0.14609259923889517, 'adx_thresh': 28.567530477862658, 'atr_min_pct': 0.017528552544093794, 'atr_max_pct': 0.07352302111664828, 'tp_mult': 1.8260646732318038, 'tsl_mult': 0.4490876355550121, 'strategy': 'breakout', 'time_stop': 149, 'use_sma': False, 'use_atr': True, 'use_adx': False, 'use_ema': True, 'use_spike': False, 'rsi_required': True, 'edge_k': 1.3323547809875054, 'edge_cap': 0.0674601145569323, 'bull_strategy': 'mean_reversion', 'bull_bb_std_mult': 0.8429167156043625, 'bull_rsi_os': 22, 'bull_rsi_ob': 74, 'bull_adx_thresh': 5.061963035065708, 'bull_atr_min_pct': 0.023490615822366216, 'bull_atr_max_pct': 0.051897213025054345, 'bull_tp_mult': 1.5277428848929933, 'bull_tsl_mult': 0.46356799713144065, 'bull_time_stop': 191, 'bull_use_sma': False, 'bull_use_ema': False, 'bull_use_atr': False, 'bull_use_adx': True, 'bull_use_spike': True, 'bull_rsi_required': False, 'bear_strategy': 'breakout', 'bear_bb_std_mult': 3.5475876477812562, 'bear_rsi_os': 12, 'bear_rsi_ob': 51, 'bear_adx_thresh': 11.283540007489169, 'bear_atr_min_pct': 0.025520840265241245, 'bear_atr_max_pct': 0.05068930145787612, 'bear_tp_mult': 1.694527316263432, 'bear_tsl_mult': 0.6715325256060142, 'bear_time_stop': 104, 'bear_use_sma': True, 'bear_use_ema': False, 'bear_use_atr': False, 'bear_use_adx': False, 'bear_use_spike': True, 'bear_rsi_required': True, 'sideways_strategy': 'mean_reversion', 'sideways_bb_std_mult': 1.1111696462434886, 'sideways_rsi_os': 21, 'sideways_rsi_ob': 94, 'sideways_adx_thresh': 31.090007024668353, 'sideways_atr_min_pct': 0.02600075006759943, 'sideways_atr_max_pct': 0.01658432854384019, 'sideways_tp_mult': 2.2706037894298916, 'sideways_tsl_mult': 0.7662968697804442, 'sideways_time_stop': 7, 'sideways_use_sma': True, 'sideways_use_ema': False, 'sideways_use_atr': True, 'sideways_use_adx': True, 'sideways_use_spike': False, 'sideways_rsi_required': True}.
[I 2025-09-01 15:06:04,651] Trial 453 finished with values: [-0.03299673263454328, 0.03438273795419292] and parameters: {'p_sma': 57, 'p_std': 49, 'p_atr': 11, 'p_adx': 14, 'rsi_period': 73, 'ema1': 26, 'ema2': 15, 'slip_atr_k': 0.18422028908349772, 'slip_spread_k': 0.3360802955934096, 'spread_hl_frac': 0.008772254371440476, 'bb_std_mult': 3.539695821963052, 'rsi_os': 32, 'rsi_ob': 95, 'vol_spike': 0.0715702515764842, 'adx_thresh': 27.541094858956438, 'atr_min_pct': 0.017124333479995972, 'atr_max_pct': 0.12557514838239964, 'tp_mult': 1.402611104224808, 'tsl_mult': 0.4835333742716388, 'strategy': 'breakout', 'time_stop': 146, 'use_sma': False, 'use_atr': True, 'use_adx': False, 'use_ema': True, 'use_spike': False, 'rsi_required': True, 'edge_k': 1.5052563052667303, 'edge_cap': 0.9157749887560552, 'bull_strategy': 'mean_reversion', 'bull_bb_std_mult': 0.6047894927967503, 'bull_rsi_os': 22, 'bull_rsi_ob': 76, 'bull_adx_thresh': 25.747368800051497, 'bull_atr_min_pct': 0.016084776323532488, 'bull_atr_max_pct': 0.0323696970890298, 'bull_tp_mult': 1.3825536445272377, 'bull_tsl_mult': 0.473931397899897, 'bull_time_stop': 144, 'bull_use_sma': False, 'bull_use_ema': True, 'bull_use_atr': False, 'bull_use_adx': True, 'bull_use_spike': False, 'bull_rsi_required': True, 'bear_strategy': 'breakout', 'bear_bb_std_mult': 1.4006810421211737, 'bear_rsi_os': 52, 'bear_rsi_ob': 50, 'bear_adx_thresh': 9.550364566607161, 'bear_atr_min_pct': 0.005354058435957605, 'bear_atr_max_pct': 0.044485313466455845, 'bear_tp_mult': 1.5530764034120628, 'bear_tsl_mult': 0.32893934485241916, 'bear_time_stop': 259, 'bear_use_sma': True, 'bear_use_ema': False, 'bear_use_atr': True, 'bear_use_adx': False, 'bear_use_spike': True, 'bear_rsi_required': True, 'sideways_strategy': 'mean_reversion', 'sideways_bb_std_mult': 2.241973934865622, 'sideways_rsi_os': 24, 'sideways_rsi_ob': 80, 'sideways_adx_thresh': 7.322919963272959, 'sideways_atr_min_pct': 0.013159284550722085, 'sideways_atr_max_pct': 0.07331859829502811, 'sideways_tp_mult': 1.5771490027724626, 'sideways_tsl_mult': 0.005035055678670297, 'sideways_time_stop': 254, 'sideways_use_sma': True, 'sideways_use_ema': False, 'sideways_use_atr': True, 'sideways_use_adx': True, 'sideways_use_spike': False, 'sideways_rsi_required': True}.
[I 2025-09-01 15:06:48,459] Trial 457 finished with values: [-0.010584817281848014, 0.016658827176240565] and parameters: {'p_sma': 32, 'p_std': 22, 'p_atr': 12, 'p_adx': 16, 'rsi_period': 39, 'ema1': 11, 'ema2': 57, 'slip_atr_k': 0.009740830199233675, 'slip_spread_k': 0.3713726684859694, 'spread_hl_frac': 0.011591434689552291, 'bb_std_mult': 2.111437855421583, 'rsi_os': 29, 'rsi_ob': 81, 'vol_spike': 0.06162724207119894, 'adx_thresh': 14.614556340692461, 'atr_min_pct': 0.01576380565293991, 'atr_max_pct': 0.06914780494026462, 'tp_mult': 2.9236079130040338, 'tsl_mult': 0.39035588007279814, 'strategy': 'breakout', 'time_stop': 157, 'use_sma': False, 'use_atr': True, 'use_adx': True, 'use_ema': True, 'use_spike': False, 'rsi_required': True, 'edge_k': 1.5012281216748935, 'edge_cap': 0.8531559546709463, 'bull_strategy': 'mean_reversion', 'bull_bb_std_mult': 1.081188629549021, 'bull_rsi_os': 26, 'bull_rsi_ob': 65, 'bull_adx_thresh': 6.689244113262964, 'bull_atr_min_pct': 0.018702456291998383, 'bull_atr_max_pct': 0.0359986782601539, 'bull_tp_mult': 1.420960147146855, 'bull_tsl_mult': 0.020780354164608064, 'bull_time_stop': 127, 'bull_use_sma': False, 'bull_use_ema': True, 'bull_use_atr': False, 'bull_use_adx': True, 'bull_use_spike': False, 'bull_rsi_required': True, 'bear_strategy': 'breakout', 'bear_bb_std_mult': 1.1986431505234738, 'bear_rsi_os': 50, 'bear_rsi_ob': 52, 'bear_adx_thresh': 28.23177439417347, 'bear_atr_min_pct': 0.004617733043565185, 'bear_atr_max_pct': 0.04095553444776893, 'bear_tp_mult': 1.6056248790315963, 'bear_tsl_mult': 0.7761566191695296, 'bear_time_stop': 17, 'bear_use_sma': True, 'bear_use_ema': False, 'bear_use_atr': True, 'bear_use_adx': False, 'bear_use_spike': True, 'bear_rsi_required': True, 'sideways_strategy': 'mean_reversion', 'sideways_bb_std_mult': 1.8938778891781725, 'sideways_rsi_os': 22, 'sideways_rsi_ob': 75, 'sideways_adx_thresh': 32.76353327897023, 'sideways_atr_min_pct': 0.00807054578010363, 'sideways_atr_max_pct': 0.04799213752246505, 'sideways_tp_mult': 2.312933943069436, 'sideways_tsl_mult': 0.7497628487335352, 'sideways_time_stop': 57, 'sideways_use_sma': True, 'sideways_use_ema': False, 'sideways_use_atr': True, 'sideways_use_adx': True, 'sideways_use_spike': False, 'sideways_rsi_required': True}.
[I 2025-09-01 15:06:49,309] Trial 455 finished with values: [-1000000000.0, 1000000000.0] and parameters: {'p_sma': 32, 'p_std': 50, 'p_atr': 12, 'p_adx': 14, 'rsi_period': 73, 'ema1': 26, 'ema2': 58, 'slip_atr_k': 0.09405839790715106, 'slip_spread_k': 0.17030300712207241, 'spread_hl_frac': 0.007982119772785096, 'bb_std_mult': 2.078010263610126, 'rsi_os': 32, 'rsi_ob': 81, 'vol_spike': 0.07005022946261612, 'adx_thresh': 9.96446159579645, 'atr_min_pct': 0.028608198928109212, 'atr_max_pct': 0.141367205578569, 'tp_mult': 1.916294382263793, 'tsl_mult': 0.46615017973738043, 'strategy': 'breakout', 'time_stop': 28, 'use_sma': False, 'use_atr': True, 'use_adx': True, 'use_ema': True, 'use_spike': False, 'rsi_required': True, 'edge_k': 1.4936140278832033, 'edge_cap': 0.20794104217460918, 'bull_strategy': 'mean_reversion', 'bull_bb_std_mult': 1.0517739424253554, 'bull_rsi_os': 29, 'bull_rsi_ob': 75, 'bull_adx_thresh': 6.717863458359394, 'bull_atr_min_pct': 0.01857490441892397, 'bull_atr_max_pct': 0.05209134306656536, 'bull_tp_mult': 1.391666662203508, 'bull_tsl_mult': 0.011314868359851092, 'bull_time_stop': 146, 'bull_use_sma': False, 'bull_use_ema': True, 'bull_use_atr': False, 'bull_use_adx': True, 'bull_use_spike': False, 'bull_rsi_required': True, 'bear_strategy': 'breakout', 'bear_bb_std_mult': 1.6087875350679706, 'bear_rsi_os': 20, 'bear_rsi_ob': 52, 'bear_adx_thresh': 12.696768090534842, 'bear_atr_min_pct': 0.003339069963890642, 'bear_atr_max_pct': 0.04424297627663366, 'bear_tp_mult': 2.21298774838378, 'bear_tsl_mult': 0.7801183433367933, 'bear_time_stop': 259, 'bear_use_sma': True, 'bear_use_ema': False, 'bear_use_atr': True, 'bear_use_adx': False, 'bear_use_spike': True, 'bear_rsi_required': True, 'sideways_strategy': 'mean_reversion', 'sideways_bb_std_mult': 2.4432480594990533, 'sideways_rsi_os': 22, 'sideways_rsi_ob': 48, 'sideways_adx_thresh': 7.222764537266118, 'sideways_atr_min_pct': 0.01389812481892845, 'sideways_atr_max_pct': 0.048018227275828745, 'sideways_tp_mult': 1.5687177360724198, 'sideways_tsl_mult': 0.7408489117121018, 'sideways_time_stop': 61, 'sideways_use_sma': True, 'sideways_use_ema': False, 'sideways_use_atr': True, 'sideways_use_adx': True, 'sideways_use_spike': False, 'sideways_rsi_required': True}.
[I 2025-09-01 15:06:49,737] Trial 456 finished with values: [-0.07492953888007359, 0.07430807714935181] and parameters: {'p_sma': 32, 'p_std': 59, 'p_atr': 12, 'p_adx': 14, 'rsi_period': 23, 'ema1': 11, 'ema2': 57, 'slip_atr_k': 0.17724974637832142, 'slip_spread_k': 0.17582237524275063, 'spread_hl_frac': 0.010131176497404262, 'bb_std_mult': 2.9155569384565982, 'rsi_os': 31, 'rsi_ob': 89, 'vol_spike': 0.11534768780734099, 'adx_thresh': 9.786089660292117, 'atr_min_pct': 0.019559300080146304, 'atr_max_pct': 0.06830032859532752, 'tp_mult': 1.9298795938598192, 'tsl_mult': 0.9028472438893836, 'strategy': 'breakout', 'time_stop': 29, 'use_sma': False, 'use_atr': True, 'use_adx': True, 'use_ema': True, 'use_spike': False, 'rsi_required': True, 'edge_k': 1.5012498788943835, 'edge_cap': 0.8516291217092501, 'bull_strategy': 'mean_reversion', 'bull_bb_std_mult': 1.054121041507006, 'bull_rsi_os': 26, 'bull_rsi_ob': 66, 'bull_adx_thresh': 6.772300349094465, 'bull_atr_min_pct': 0.016121439939048215, 'bull_atr_max_pct': 0.03486464005777761, 'bull_tp_mult': 1.3950442838245916, 'bull_tsl_mult': 0.01888523534737467, 'bull_time_stop': 146, 'bull_use_sma': False, 'bull_use_ema': True, 'bull_use_atr': False, 'bull_use_adx': True, 'bull_use_spike': False, 'bull_rsi_required': True, 'bear_strategy': 'breakout', 'bear_bb_std_mult': 0.7152582175823003, 'bear_rsi_os': 44, 'bear_rsi_ob': 93, 'bear_adx_thresh': 8.332317910819743, 'bear_atr_min_pct': 0.0033363300244884943, 'bear_atr_max_pct': 0.043546395080986074, 'bear_tp_mult': 1.5996474713773008, 'bear_tsl_mult': 0.3270483874746539, 'bear_time_stop': 258, 'bear_use_sma': True, 'bear_use_ema': False, 'bear_use_atr': True, 'bear_use_adx': False, 'bear_use_spike': True, 'bear_rsi_required': True, 'sideways_strategy': 'mean_reversion', 'sideways_bb_std_mult': 1.0523595667895, 'sideways_rsi_os': 22, 'sideways_rsi_ob': 76, 'sideways_adx_thresh': 14.455998166853405, 'sideways_atr_min_pct': 0.008408182438016543, 'sideways_atr_max_pct': 0.048261460949809105, 'sideways_tp_mult': 2.387526852146853, 'sideways_tsl_mult': 0.7350170924029406, 'sideways_time_stop': 56, 'sideways_use_sma': True, 'sideways_use_ema': False, 'sideways_use_atr': True, 'sideways_use_adx': True, 'sideways_use_spike': False, 'sideways_rsi_required': True}.
[I 2025-09-01 15:06:50,002] Trial 454 finished with values: [-1000000000.0, 1000000000.0] and parameters: {'p_sma': 60, 'p_std': 49, 'p_atr': 12, 'p_adx': 14, 'rsi_period': 39, 'ema1': 11, 'ema2': 13, 'slip_atr_k': 0.0674563890320546, 'slip_spread_k': 0.3660428656545811, 'spread_hl_frac': 0.0039191195695319325, 'bb_std_mult': 2.2893388083431265, 'rsi_os': 30, 'rsi_ob': 93, 'vol_spike': 0.0689361242986986, 'adx_thresh': 28.625678575475117, 'atr_min_pct': 0.017084741990478845, 'atr_max_pct': 0.06852442200561433, 'tp_mult': 2.8254862883091008, 'tsl_mult': 0.4686842819706754, 'strategy': 'breakout', 'time_stop': 28, 'use_sma': False, 'use_atr': True, 'use_adx': True, 'use_ema': True, 'use_spike': False, 'rsi_required': True, 'edge_k': 1.495877211123885, 'edge_cap': 0.8585018108230027, 'bull_strategy': 'mean_reversion', 'bull_bb_std_mult': 2.0575662895322386, 'bull_rsi_os': 26, 'bull_rsi_ob': 75, 'bull_adx_thresh': 6.499974764683295, 'bull_atr_min_pct': 0.016085247958389056, 'bull_atr_max_pct': 0.03208475727803449, 'bull_tp_mult': 2.8066331411428727, 'bull_tsl_mult': 0.9989494851261194, 'bull_time_stop': 146, 'bull_use_sma': False, 'bull_use_ema': True, 'bull_use_atr': False, 'bull_use_adx': True, 'bull_use_spike': False, 'bull_rsi_required': True, 'bear_strategy': 'breakout', 'bear_bb_std_mult': 1.627949304358957, 'bear_rsi_os': 20, 'bear_rsi_ob': 64, 'bear_adx_thresh': 9.502028265000009, 'bear_atr_min_pct': 0.003251933584414597, 'bear_atr_max_pct': 0.04501049092781429, 'bear_tp_mult': 1.5925052214644801, 'bear_tsl_mult': 0.7735842683760691, 'bear_time_stop': 257, 'bear_use_sma': True, 'bear_use_ema': False, 'bear_use_atr': True, 'bear_use_adx': False, 'bear_use_spike': True, 'bear_rsi_required': True, 'sideways_strategy': 'mean_reversion', 'sideways_bb_std_mult': 2.2142550503793257, 'sideways_rsi_os': 12, 'sideways_rsi_ob': 75, 'sideways_adx_thresh': 32.06545340669567, 'sideways_atr_min_pct': 0.014243829345864743, 'sideways_atr_max_pct': 0.09666510902008772, 'sideways_tp_mult': 2.2996575745156056, 'sideways_tsl_mult': 0.7396518929451847, 'sideways_time_stop': 59, 'sideways_use_sma': True, 'sideways_use_ema': False, 'sideways_use_atr': True, 'sideways_use_adx': True, 'sideways_use_spike': False, 'sideways_rsi_required': True}.
[I 2025-09-01 15:06:50,969] Trial 461 finished with values: [-1000000000.0, 1000000000.0] and parameters: {'p_sma': 30, 'p_std': 34, 'p_atr': 24, 'p_adx': 16, 'rsi_period': 70, 'ema1': 24, 'ema2': 31, 'slip_atr_k': 0.011787936677153223, 'slip_spread_k': 0.45691633723824615, 'spread_hl_frac': 0.006616333805040423, 'bb_std_mult': 1.5573462922327896, 'rsi_os': 42, 'rsi_ob': 49, 'vol_spike': 0.06305969792749956, 'adx_thresh': 21.516477521585575, 'atr_min_pct': 0.015365587673295726, 'atr_max_pct': 0.07748753575459458, 'tp_mult': 1.956739011169044, 'tsl_mult': 0.3905019623644163, 'strategy': 'mean_reversion', 'time_stop': 53, 'use_sma': True, 'use_atr': True, 'use_adx': False, 'use_ema': True, 'use_spike': True, 'rsi_required': True, 'edge_k': 1.1518045917500335, 'edge_cap': 0.5229725369124948, 'bull_strategy': 'mean_reversion', 'bull_bb_std_mult': 0.7296257767125891, 'bull_rsi_os': 27, 'bull_rsi_ob': 71, 'bull_adx_thresh': 7.615491617461716, 'bull_atr_min_pct': 0.020298692532106036, 'bull_atr_max_pct': 0.03660818313732878, 'bull_tp_mult': 1.4202454089030303, 'bull_tsl_mult': 0.13353218211629164, 'bull_time_stop': 130, 'bull_use_sma': False, 'bull_use_ema': False, 'bull_use_atr': True, 'bull_use_adx': True, 'bull_use_spike': False, 'bull_rsi_required': True, 'bear_strategy': 'mean_reversion', 'bear_bb_std_mult': 1.176653255619581, 'bear_rsi_os': 51, 'bear_rsi_ob': 58, 'bear_adx_thresh': 7.4587691093088235, 'bear_atr_min_pct': 0.029981874186738318, 'bear_atr_max_pct': 0.04710535685730858, 'bear_tp_mult': 1.6314848833183186, 'bear_tsl_mult': 0.7338705938548769, 'bear_time_stop': 266, 'bear_use_sma': True, 'bear_use_ema': False, 'bear_use_atr': False, 'bear_use_adx': False, 'bear_use_spike': True, 'bear_rsi_required': True, 'sideways_strategy': 'breakout', 'sideways_bb_std_mult': 1.9282218918304581, 'sideways_rsi_os': 23, 'sideways_rsi_ob': 77, 'sideways_adx_thresh': 26.359516176400966, 'sideways_atr_min_pct': 0.0008166133152602058, 'sideways_atr_max_pct': 0.058861163068111795, 'sideways_tp_mult': 2.4396455555180894, 'sideways_tsl_mult': 0.6978713451849233, 'sideways_time_stop': 23, 'sideways_use_sma': False, 'sideways_use_ema': False, 'sideways_use_atr': True, 'sideways_use_adx': True, 'sideways_use_spike': False, 'sideways_rsi_required': True}.
