[I 2025-09-01 14:23:31,015] Trial 180 finished with values: [-0.12121145460114402, 0.12107229933560934] and parameters: {'p_sma': 25, 'p_std': 52, 'p_atr': 16, 'p_adx': 23, 'rsi_period': 14, 'ema1': 27, 'ema2': 16, 'slip_atr_k': 0.01860718786976899, 'slip_spread_k': 0.9442378798294094, 'spread_hl_frac': 0.013094811532561411, 'bb_std_mult': 2.37691551344831, 'rsi_os': 20, 'rsi_ob': 85, 'vol_spike': 0.09363283136490134, 'adx_thresh': 16.491374404217733, 'atr_min_pct': 0.017517762969807685, 'atr_max_pct': 0.14964660598933932, 'tp_mult': 2.55969331090316, 'tsl_mult': 0.7145662460951587, 'strategy': 'breakout', 'time_stop': 290, 'use_sma': True, 'use_atr': True, 'use_adx': True, 'use_ema': True, 'use_spike': True, 'rsi_required': False, 'edge_k': 0.1743363869116611, 'edge_cap': 0.9987659665428894, 'bull_strategy': 'mean_reversion', 'bull_bb_std_mult': 2.3556711642407837, 'bull_rsi_os': 19, 'bull_rsi_ob': 55, 'bull_adx_thresh': 34.93636855003726, 'bull_atr_min_pct': 0.02876271414406377, 'bull_atr_max_pct': 0.03410302704686598, 'bull_tp_mult': 1.8818913643892192, 'bull_tsl_mult': 0.9247199051663288, 'bull_time_stop': 31, 'bull_use_sma': True, 'bull_use_ema': True, 'bull_use_atr': False, 'bull_use_adx': True, 'bull_use_spike': True, 'bull_rsi_required': True, 'bear_strategy': 'mean_reversion', 'bear_bb_std_mult': 2.1005494536835423, 'bear_rsi_os': 50, 'bear_rsi_ob': 86, 'bear_adx_thresh': 15.491488707071309, 'bear_atr_min_pct': 0.007278276871928085, 'bear_atr_max_pct': 0.02586479763186482, 'bear_tp_mult': 2.944826775904345, 'bear_tsl_mult': 0.5695743577911858, 'bear_time_stop': 253, 'bear_use_sma': True, 'bear_use_ema': True, 'bear_use_atr': True, 'bear_use_adx': False, 'bear_use_spike': True, 'bear_rsi_required': False, 'sideways_strategy': 'mean_reversion', 'sideways_bb_std_mult': 2.647278280397706, 'sideways_rsi_os': 33, 'sideways_rsi_ob': 57, 'sideways_adx_thresh': 33.28174526810196, 'sideways_atr_min_pct': 0.0007478628048209757, 'sideways_atr_max_pct': 0.03460750489010804, 'sideways_tp_mult': 2.6318611569423904, 'sideways_tsl_mult': 0.8312881017151033, 'sideways_time_stop': 88, 'sideways_use_sma': True, 'sideways_use_ema': False, 'sideways_use_atr': False, 'sideways_use_adx': False, 'sideways_use_spike': False, 'sideways_rsi_required': False}.
[I 2025-09-01 14:23:31,488] Trial 183 finished with values: [-1000000000.0, 1000000000.0] and parameters: {'p_sma': 18, 'p_std': 12, 'p_atr': 12, 'p_adx': 14, 'rsi_period': 65, 'ema1': 29, 'ema2': 14, 'slip_atr_k': 0.004037432744163658, 'slip_spread_k': 0.400879422479249, 'spread_hl_frac': 0.0061036496437715405, 'bb_std_mult': 3.1332900770851375, 'rsi_os': 7, 'rsi_ob': 82, 'vol_spike': 0.02888988834393144, 'adx_thresh': 26.776742499415587, 'atr_min_pct': 0.02444769369288728, 'atr_max_pct': 0.018995219298058072, 'tp_mult': 2.393400202089882, 'tsl_mult': 0.5800093079616842, 'strategy': 'breakout', 'time_stop': 87, 'use_sma': True, 'use_atr': False, 'use_adx': True, 'use_ema': False, 'use_spike': False, 'rsi_required': True, 'edge_k': 0.957481203434485, 'edge_cap': 0.18087978239644575, 'bull_strategy': 'breakout', 'bull_bb_std_mult': 2.9089007161619205, 'bull_rsi_os': 20, 'bull_rsi_ob': 49, 'bull_adx_thresh': 9.23334307520523, 'bull_atr_min_pct': 0.02383999264365559, 'bull_atr_max_pct': 0.07211267313639282, 'bull_tp_mult': 1.104173355717131, 'bull_tsl_mult': 0.8066029043460071, 'bull_time_stop': 149, 'bull_use_sma': False, 'bull_use_ema': False, 'bull_use_atr': False, 'bull_use_adx': False, 'bull_use_spike': False, 'bull_rsi_required': False, 'bear_strategy': 'breakout', 'bear_bb_std_mult': 2.0166974037505327, 'bear_rsi_os': 9, 'bear_rsi_ob': 86, 'bear_adx_thresh': 21.632122328049977, 'bear_atr_min_pct': 0.004795464810443352, 'bear_atr_max_pct': 0.03679676770947893, 'bear_tp_mult': 2.8214320046027495, 'bear_tsl_mult': 0.6382162218534637, 'bear_time_stop': 13, 'bear_use_sma': False, 'bear_use_ema': False, 'bear_use_atr': False, 'bear_use_adx': True, 'bear_use_spike': False, 'bear_rsi_required': True, 'sideways_strategy': 'mean_reversion', 'sideways_bb_std_mult': 3.3689605240256837, 'sideways_rsi_os': 31, 'sideways_rsi_ob': 76, 'sideways_adx_thresh': 32.71740104315047, 'sideways_atr_min_pct': 0.014790911643267162, 'sideways_atr_max_pct': 0.04470014808006713, 'sideways_tp_mult': 2.5186112565138896, 'sideways_tsl_mult': 0.9015564099595679, 'sideways_time_stop': 227, 'sideways_use_sma': True, 'sideways_use_ema': True, 'sideways_use_atr': False, 'sideways_use_adx': True, 'sideways_use_spike': True, 'sideways_rsi_required': False}.
[I 2025-09-01 14:24:08,664] Trial 181 finished with values: [-1000000000.0, 1000000000.0] and parameters: {'p_sma': 25, 'p_std': 12, 'p_atr': 13, 'p_adx': 23, 'rsi_period': 13, 'ema1': 29, 'ema2': 16, 'slip_atr_k': 0.024065575933182468, 'slip_spread_k': 0.507577413759743, 'spread_hl_frac': 0.022319995292123366, 'bb_std_mult': 2.4934308396560585, 'rsi_os': 20, 'rsi_ob': 82, 'vol_spike': 0.027524669962143804, 'adx_thresh': 24.9717101246141, 'atr_min_pct': 0.009312772851072529, 'atr_max_pct': 0.059045972499599295, 'tp_mult': 2.704580690470185, 'tsl_mult': 0.3311511844800923, 'strategy': 'breakout', 'time_stop': 36, 'use_sma': True, 'use_atr': True, 'use_adx': True, 'use_ema': True, 'use_spike': True, 'rsi_required': False, 'edge_k': 0.5631679859721093, 'edge_cap': 0.9552110586889344, 'bull_strategy': 'mean_reversion', 'bull_bb_std_mult': 2.842840225122602, 'bull_rsi_os': 20, 'bull_rsi_ob': 59, 'bull_adx_thresh': 13.128990723908766, 'bull_atr_min_pct': 0.0031073515297152417, 'bull_atr_max_pct': 0.03900371724049908, 'bull_tp_mult': 2.9345956043769026, 'bull_tsl_mult': 0.5361174516828339, 'bull_time_stop': 147, 'bull_use_sma': False, 'bull_use_ema': True, 'bull_use_atr': False, 'bull_use_adx': False, 'bull_use_spike': False, 'bull_rsi_required': False, 'bear_strategy': 'mean_reversion', 'bear_bb_std_mult': 2.099193294675202, 'bear_rsi_os': 14, 'bear_rsi_ob': 86, 'bear_adx_thresh': 5.016199313316126, 'bear_atr_min_pct': 0.015230130800621862, 'bear_atr_max_pct': 0.07283345849989874, 'bear_tp_mult': 1.641631713767786, 'bear_tsl_mult': 0.9396958120410106, 'bear_time_stop': 184, 'bear_use_sma': True, 'bear_use_ema': True, 'bear_use_atr': True, 'bear_use_adx': True, 'bear_use_spike': False, 'bear_rsi_required': False, 'sideways_strategy': 'mean_reversion', 'sideways_bb_std_mult': 2.6037406381156543, 'sideways_rsi_os': 32, 'sideways_rsi_ob': 75, 'sideways_adx_thresh': 7.16230830915975, 'sideways_atr_min_pct': 0.007522303284196072, 'sideways_atr_max_pct': 0.03704160510146929, 'sideways_tp_mult': 2.5149829716897294, 'sideways_tsl_mult': 0.13120287656094254, 'sideways_time_stop': 120, 'sideways_use_sma': True, 'sideways_use_ema': False, 'sideways_use_atr': False, 'sideways_use_adx': False, 'sideways_use_spike': False, 'sideways_rsi_required': False}.
[I 2025-09-01 14:24:10,784] Trial 182 finished with values: [-1000000000.0, 1000000000.0] and parameters: {'p_sma': 56, 'p_std': 44, 'p_atr': 13, 'p_adx': 14, 'rsi_period': 65, 'ema1': 29, 'ema2': 14, 'slip_atr_k': 0.005990391053362909, 'slip_spread_k': 0.5182104150536894, 'spread_hl_frac': 0.02750001690535557, 'bb_std_mult': 3.136098937117655, 'rsi_os': 7, 'rsi_ob': 74, 'vol_spike': 0.09313743867267767, 'adx_thresh': 25.2532836497691, 'atr_min_pct': 0.02431834889738882, 'atr_max_pct': 0.05973111385090272, 'tp_mult': 2.562793683768887, 'tsl_mult': 0.5324856708171698, 'strategy': 'breakout', 'time_stop': 114, 'use_sma': False, 'use_atr': False, 'use_adx': True, 'use_ema': False, 'use_spike': True, 'rsi_required': False, 'edge_k': 0.9525734392735796, 'edge_cap': 0.6886664799542578, 'bull_strategy': 'mean_reversion', 'bull_bb_std_mult': 0.746164688165242, 'bull_rsi_os': 20, 'bull_rsi_ob': 49, 'bull_adx_thresh': 6.073089618230343, 'bull_atr_min_pct': 0.0031207136777181878, 'bull_atr_max_pct': 0.07189592309407833, 'bull_tp_mult': 1.8704802802385385, 'bull_tsl_mult': 0.24814058578028741, 'bull_time_stop': 71, 'bull_use_sma': False, 'bull_use_ema': True, 'bull_use_atr': False, 'bull_use_adx': False, 'bull_use_spike': False, 'bull_rsi_required': False, 'bear_strategy': 'breakout', 'bear_bb_std_mult': 2.1060179215898835, 'bear_rsi_os': 49, 'bear_rsi_ob': 85, 'bear_adx_thresh': 5.022444519327703, 'bear_atr_min_pct': 0.0072751982867096734, 'bear_atr_max_pct': 0.06530187365219184, 'bear_tp_mult': 2.8300849150480625, 'bear_tsl_mult': 0.9352340650737032, 'bear_time_stop': 243, 'bear_use_sma': False, 'bear_use_ema': True, 'bear_use_atr': True, 'bear_use_adx': True, 'bear_use_spike': False, 'bear_rsi_required': False, 'sideways_strategy': 'mean_reversion', 'sideways_bb_std_mult': 3.2213594416308675, 'sideways_rsi_os': 32, 'sideways_rsi_ob': 75, 'sideways_adx_thresh': 33.23600842140255, 'sideways_atr_min_pct': 0.018145087822960235, 'sideways_atr_max_pct': 0.04629036090047526, 'sideways_tp_mult': 1.8229916001536697, 'sideways_tsl_mult': 0.5732508539350379, 'sideways_time_stop': 228, 'sideways_use_sma': True, 'sideways_use_ema': True, 'sideways_use_atr': False, 'sideways_use_adx': True, 'sideways_use_spike': True, 'sideways_rsi_required': False}.
[I 2025-09-01 14:24:11,730] Trial 185 finished with values: [-1000000000.0, 1000000000.0] and parameters: {'p_sma': 28, 'p_std': 7, 'p_atr': 28, 'p_adx': 13, 'rsi_period': 71, 'ema1': 29, 'ema2': 49, 'slip_atr_k': 0.1885422299591995, 'slip_spread_k': 0.4107553926459596, 'spread_hl_frac': 0.03949131153346858, 'bb_std_mult': 3.2039907743703093, 'rsi_os': 10, 'rsi_ob': 74, 'vol_spike': 0.022707493311075303, 'adx_thresh': 33.638015161065425, 'atr_min_pct': 0.00923796441544222, 'atr_max_pct': 0.05755063497679677, 'tp_mult': 1.4162570801680419, 'tsl_mult': 0.5326098091836639, 'strategy': 'breakout', 'time_stop': 85, 'use_sma': False, 'use_atr': False, 'use_adx': True, 'use_ema': False, 'use_spike': False, 'rsi_required': True, 'edge_k': 0.5690664806840464, 'edge_cap': 0.14548636869405102, 'bull_strategy': 'breakout', 'bull_bb_std_mult': 0.8708486301396965, 'bull_rsi_os': 22, 'bull_rsi_ob': 59, 'bull_adx_thresh': 9.91921246241354, 'bull_atr_min_pct': 0.005815232222461443, 'bull_atr_max_pct': 0.038995457139877766, 'bull_tp_mult': 1.7292697472929341, 'bull_tsl_mult': 0.860323250451398, 'bull_time_stop': 163, 'bull_use_sma': False, 'bull_use_ema': False, 'bull_use_atr': False, 'bull_use_adx': True, 'bull_use_spike': False, 'bull_rsi_required': True, 'bear_strategy': 'breakout', 'bear_bb_std_mult': 1.9732360288248298, 'bear_rsi_os': 49, 'bear_rsi_ob': 85, 'bear_adx_thresh': 6.4201597149824945, 'bear_atr_min_pct': 0.005209287184683398, 'bear_atr_max_pct': 0.0739202879876256, 'bear_tp_mult': 1.871584702386264, 'bear_tsl_mult': 0.6395748543170793, 'bear_time_stop': 65, 'bear_use_sma': False, 'bear_use_ema': True, 'bear_use_atr': False, 'bear_use_adx': False, 'bear_use_spike': False, 'bear_rsi_required': True, 'sideways_strategy': 'mean_reversion', 'sideways_bb_std_mult': 1.4103816550858994, 'sideways_rsi_os': 29, 'sideways_rsi_ob': 66, 'sideways_adx_thresh': 7.424557337300447, 'sideways_atr_min_pct': 0.01808702234197568, 'sideways_atr_max_pct': 0.03741942524686212, 'sideways_tp_mult': 1.8466702601889378, 'sideways_tsl_mult': 0.5194199394171846, 'sideways_time_stop': 118, 'sideways_use_sma': True, 'sideways_use_ema': True, 'sideways_use_atr': False, 'sideways_use_adx': True, 'sideways_use_spike': True, 'sideways_rsi_required': False}.
[I 2025-09-01 14:24:11,942] Trial 184 finished with values: [-0.035115946914346385, 0.034935230466685896] and parameters: {'p_sma': 28, 'p_std': 12, 'p_atr': 12, 'p_adx': 24, 'rsi_period': 71, 'ema1': 29, 'ema2': 25, 'slip_atr_k': 0.006463843642668129, 'slip_spread_k': 0.4697650034194588, 'spread_hl_frac': 0.005552776346821102, 'bb_std_mult': 3.183318844323951, 'rsi_os': 45, 'rsi_ob': 74, 'vol_spike': 0.020763781091942345, 'adx_thresh': 26.75176940573733, 'atr_min_pct': 0.00941308228374517, 'atr_max_pct': 0.09602881006096382, 'tp_mult': 2.3631222079530456, 'tsl_mult': 0.5823636342911338, 'strategy': 'breakout', 'time_stop': 114, 'use_sma': True, 'use_atr': False, 'use_adx': True, 'use_ema': False, 'use_spike': False, 'rsi_required': True, 'edge_k': 0.5618021402823415, 'edge_cap': 0.9509717547713687, 'bull_strategy': 'breakout', 'bull_bb_std_mult': 0.8724391653249919, 'bull_rsi_os': 20, 'bull_rsi_ob': 59, 'bull_adx_thresh': 9.7319878592083, 'bull_atr_min_pct': 0.0021460074377948096, 'bull_atr_max_pct': 0.03922663803105219, 'bull_tp_mult': 1.1099592455622813, 'bull_tsl_mult': 0.6566176384153803, 'bull_time_stop': 71, 'bull_use_sma': False, 'bull_use_ema': False, 'bull_use_atr': False, 'bull_use_adx': False, 'bull_use_spike': False, 'bull_rsi_required': False, 'bear_strategy': 'breakout', 'bear_bb_std_mult': 2.0125719740663066, 'bear_rsi_os': 10, 'bear_rsi_ob': 85, 'bear_adx_thresh': 6.162290241440457, 'bear_atr_min_pct': 0.0047910450754375285, 'bear_atr_max_pct': 0.0738978037933494, 'bear_tp_mult': 1.8433786221289128, 'bear_tsl_mult': 0.6365189712049861, 'bear_time_stop': 167, 'bear_use_sma': False, 'bear_use_ema': False, 'bear_use_atr': False, 'bear_use_adx': True, 'bear_use_spike': False, 'bear_rsi_required': True, 'sideways_strategy': 'mean_reversion', 'sideways_bb_std_mult': 1.4243062993430318, 'sideways_rsi_os': 31, 'sideways_rsi_ob': 76, 'sideways_adx_thresh': 7.494022475387171, 'sideways_atr_min_pct': 0.017111467357599674, 'sideways_atr_max_pct': 0.047247228054740624, 'sideways_tp_mult': 2.999091409047394, 'sideways_tsl_mult': 0.8037644032116238, 'sideways_time_stop': 118, 'sideways_use_sma': True, 'sideways_use_ema': True, 'sideways_use_atr': False, 'sideways_use_adx': True, 'sideways_use_spike': True, 'sideways_rsi_required': False}.
[I 2025-09-01 14:24:12,401] Trial 187 finished with values: [-1000000000.0, 1000000000.0] and parameters: {'p_sma': 28, 'p_std': 8, 'p_atr': 28, 'p_adx': 24, 'rsi_period': 68, 'ema1': 28, 'ema2': 53, 'slip_atr_k': 0.03818766066036502, 'slip_spread_k': 0.4119355622903782, 'spread_hl_frac': 0.041179692864311064, 'bb_std_mult': 1.0958074363489319, 'rsi_os': 10, 'rsi_ob': 49, 'vol_spike': 0.022590319819653665, 'adx_thresh': 29.269686097090194, 'atr_min_pct': 0.006195675296005737, 'atr_max_pct': 0.117527753243207, 'tp_mult': 1.7832605537107113, 'tsl_mult': 0.14747712655899975, 'strategy': 'mean_reversion', 'time_stop': 70, 'use_sma': False, 'use_atr': False, 'use_adx': False, 'use_ema': False, 'use_spike': False, 'rsi_required': True, 'edge_k': 0.8615302666312559, 'edge_cap': 0.33087506758377094, 'bull_strategy': 'breakout', 'bull_bb_std_mult': 0.855056366503375, 'bull_rsi_os': 22, 'bull_rsi_ob': 54, 'bull_adx_thresh': 9.458415432532584, 'bull_atr_min_pct': 0.007579326971121434, 'bull_atr_max_pct': 0.037208432759606745, 'bull_tp_mult': 1.346824014533028, 'bull_tsl_mult': 0.8608202760583561, 'bull_time_stop': 23, 'bull_use_sma': False, 'bull_use_ema': False, 'bull_use_atr': True, 'bull_use_adx': True, 'bull_use_spike': False, 'bull_rsi_required': True, 'bear_strategy': 'breakout', 'bear_bb_std_mult': 1.954721412209775, 'bear_rsi_os': 53, 'bear_rsi_ob': 88, 'bear_adx_thresh': 32.50300849996623, 'bear_atr_min_pct': 0.006562825519934919, 'bear_atr_max_pct': 0.012122410399397762, 'bear_tp_mult': 1.9294129542334086, 'bear_tsl_mult': 0.6355132196061606, 'bear_time_stop': 54, 'bear_use_sma': False, 'bear_use_ema': False, 'bear_use_atr': False, 'bear_use_adx': False, 'bear_use_spike': False, 'bear_rsi_required': True, 'sideways_strategy': 'breakout', 'sideways_bb_std_mult': 1.4236514297076535, 'sideways_rsi_os': 53, 'sideways_rsi_ob': 73, 'sideways_adx_thresh': 27.207598979800892, 'sideways_atr_min_pct': 0.0168653748033432, 'sideways_atr_max_pct': 0.038540167624952576, 'sideways_tp_mult': 2.5541178284760773, 'sideways_tsl_mult': 0.7991627286032544, 'sideways_time_stop': 166, 'sideways_use_sma': False, 'sideways_use_ema': True, 'sideways_use_atr': False, 'sideways_use_adx': True, 'sideways_use_spike': True, 'sideways_rsi_required': False}.
[I 2025-09-01 14:24:50,125] Trial 188 finished with values: [-1000000000.0, 1000000000.0] and parameters: {'p_sma': 23, 'p_std': 8, 'p_atr': 16, 'p_adx': 24, 'rsi_period': 72, 'ema1': 28, 'ema2': 25, 'slip_atr_k': 0.054239518971457804, 'slip_spread_k': 0.11873605314534319, 'spread_hl_frac': 0.031228519754339296, 'bb_std_mult': 2.5160614125871033, 'rsi_os': 45, 'rsi_ob': 80, 'vol_spike': 0.003601352680229153, 'adx_thresh': 26.86663893008873, 'atr_min_pct': 0.006958828369629965, 'atr_max_pct': 0.07859208610563968, 'tp_mult': 2.3598905869621594, 'tsl_mult': 0.5981909751928228, 'strategy': 'breakout', 'time_stop': 6, 'use_sma': False, 'use_atr': False, 'use_adx': False, 'use_ema': False, 'use_spike': False, 'rsi_required': True, 'edge_k': 1.5829235977101372, 'edge_cap': 0.7193917555997154, 'bull_strategy': 'breakout', 'bull_bb_std_mult': 1.5363023973562744, 'bull_rsi_os': 22, 'bull_rsi_ob': 53, 'bull_adx_thresh': 33.41358687624293, 'bull_atr_min_pct': 0.007264013938828749, 'bull_atr_max_pct': 0.03419824177504578, 'bull_tp_mult': 1.147449423973275, 'bull_tsl_mult': 0.6533776325697968, 'bull_time_stop': 25, 'bull_use_sma': True, 'bull_use_ema': True, 'bull_use_atr': False, 'bull_use_adx': True, 'bull_use_spike': False, 'bull_rsi_required': True, 'bear_strategy': 'breakout', 'bear_bb_std_mult': 1.872849560564157, 'bear_rsi_os': 53, 'bear_rsi_ob': 88, 'bear_adx_thresh': 32.89215778641912, 'bear_atr_min_pct': 0.011331056903423035, 'bear_atr_max_pct': 0.012165847746176923, 'bear_tp_mult': 1.97159496963938, 'bear_tsl_mult': 0.6033606453614206, 'bear_time_stop': 164, 'bear_use_sma': False, 'bear_use_ema': False, 'bear_use_atr': False, 'bear_use_adx': False, 'bear_use_spike': False, 'bear_rsi_required': True, 'sideways_strategy': 'breakout', 'sideways_bb_std_mult': 1.34905531017652, 'sideways_rsi_os': 7, 'sideways_rsi_ob': 80, 'sideways_adx_thresh': 27.191252639516346, 'sideways_atr_min_pct': 0.016952280598908645, 'sideways_atr_max_pct': 0.04235138555009718, 'sideways_tp_mult': 2.5485372457335567, 'sideways_tsl_mult': 0.9190068929658282, 'sideways_time_stop': 101, 'sideways_use_sma': False, 'sideways_use_ema': True, 'sideways_use_atr': True, 'sideways_use_adx': True, 'sideways_use_spike': True, 'sideways_rsi_required': False}.
[I 2025-09-01 14:24:51,502] Trial 189 finished with values: [-1000000000.0, 1000000000.0] and parameters: {'p_sma': 23, 'p_std': 50, 'p_atr': 16, 'p_adx': 24, 'rsi_period': 68, 'ema1': 28, 'ema2': 23, 'slip_atr_k': 0.04019777966984958, 'slip_spread_k': 0.4691798086579707, 'spread_hl_frac': 0.04177161680705071, 'bb_std_mult': 0.7712630851549058, 'rsi_os': 6, 'rsi_ob': 49, 'vol_spike': 0.24810347415510048, 'adx_thresh': 14.681245438900234, 'atr_min_pct': 0.006913946356697993, 'atr_max_pct': 0.0788943433120361, 'tp_mult': 2.3330917086058096, 'tsl_mult': 0.5659782350032864, 'strategy': 'breakout', 'time_stop': 143, 'use_sma': False, 'use_atr': False, 'use_adx': False, 'use_ema': False, 'use_spike': False, 'rsi_required': True, 'edge_k': 1.6369603782446118, 'edge_cap': 0.4128151670560093, 'bull_strategy': 'breakout', 'bull_bb_std_mult': 1.3381434395931542, 'bull_rsi_os': 22, 'bull_rsi_ob': 53, 'bull_adx_thresh': 11.737514669673445, 'bull_atr_min_pct': 0.006947296362047379, 'bull_atr_max_pct': 0.12590486983956845, 'bull_tp_mult': 1.36065341792467, 'bull_tsl_mult': 0.3017338865530139, 'bull_time_stop': 289, 'bull_use_sma': True, 'bull_use_ema': True, 'bull_use_atr': False, 'bull_use_adx': True, 'bull_use_spike': False, 'bull_rsi_required': True, 'bear_strategy': 'breakout', 'bear_bb_std_mult': 1.8400317343191435, 'bear_rsi_os': 53, 'bear_rsi_ob': 88, 'bear_adx_thresh': 6.110097161356904, 'bear_atr_min_pct': 0.011579069406668124, 'bear_atr_max_pct': 0.08154844576750221, 'bear_tp_mult': 1.5369997377023001, 'bear_tsl_mult': 0.6014004074774217, 'bear_time_stop': 114, 'bear_use_sma': False, 'bear_use_ema': False, 'bear_use_atr': False, 'bear_use_adx': False, 'bear_use_spike': False, 'bear_rsi_required': True, 'sideways_strategy': 'breakout', 'sideways_bb_std_mult': 1.3451825652602112, 'sideways_rsi_os': 18, 'sideways_rsi_ob': 80, 'sideways_adx_thresh': 32.00119167698681, 'sideways_atr_min_pct': 0.016869205460745156, 'sideways_atr_max_pct': 0.10516536901985074, 'sideways_tp_mult': 2.5634198210561645, 'sideways_tsl_mult': 0.9110249452623989, 'sideways_time_stop': 98, 'sideways_use_sma': False, 'sideways_use_ema': True, 'sideways_use_atr': True, 'sideways_use_adx': True, 'sideways_use_spike': True, 'sideways_rsi_required': False}.
