[I 2025-09-01 14:47:06,360] Trial 333 finished with values: [-1000000000.0, 1000000000.0] and parameters: {'p_sma': 25, 'p_std': 31, 'p_atr': 15, 'p_adx': 28, 'rsi_period': 68, 'ema1': 29, 'ema2': 21, 'slip_atr_k': 0.21234021429409436, 'slip_spread_k': 0.40611432940091474, 'spread_hl_frac': 0.01918192290195733, 'bb_std_mult': 1.4237015366623065, 'rsi_os': 8, 'rsi_ob': 94, 'vol_spike': 0.23947012659763062, 'adx_thresh': 24.87370726672563, 'atr_min_pct': 0.00660073440111049, 'atr_max_pct': 0.06611440666709695, 'tp_mult': 2.2910477010104255, 'tsl_mult': 0.6687886541032514, 'strategy': 'mean_reversion', 'time_stop': 92, 'use_sma': False, 'use_atr': False, 'use_adx': False, 'use_ema': False, 'use_spike': False, 'rsi_required': True, 'edge_k': 1.613031061878424, 'edge_cap': 0.49933177985883664, 'bull_strategy': 'breakout', 'bull_bb_std_mult': 0.5957035774067295, 'bull_rsi_os': 22, 'bull_rsi_ob': 90, 'bull_adx_thresh': 10.025485759738022, 'bull_atr_min_pct': 0.006289045709878956, 'bull_atr_max_pct': 0.07037586338415809, 'bull_tp_mult': 1.0777192672931684, 'bull_tsl_mult': 0.7038019953966658, 'bull_time_stop': 260, 'bull_use_sma': False, 'bull_use_ema': True, 'bull_use_atr': True, 'bull_use_adx': True, 'bull_use_spike': False, 'bull_rsi_required': True, 'bear_strategy': 'breakout', 'bear_bb_std_mult': 3.410638998380117, 'bear_rsi_os': 54, 'bear_rsi_ob': 89, 'bear_adx_thresh': 17.241737805653766, 'bear_atr_min_pct': 0.01921304867242653, 'bear_atr_max_pct': 0.06984701326190114, 'bear_tp_mult': 2.5447459951903597, 'bear_tsl_mult': 0.883827512542359, 'bear_time_stop': 266, 'bear_use_sma': False, 'bear_use_ema': False, 'bear_use_atr': False, 'bear_use_adx': False, 'bear_use_spike': False, 'bear_rsi_required': True, 'sideways_strategy': 'mean_reversion', 'sideways_bb_std_mult': 1.325373890925477, 'sideways_rsi_os': 29, 'sideways_rsi_ob': 46, 'sideways_adx_thresh': 17.146497822425374, 'sideways_atr_min_pct': 0.01217529660526879, 'sideways_atr_max_pct': 0.03556741099629001, 'sideways_tp_mult': 2.800915148111884, 'sideways_tsl_mult': 0.1135898989444698, 'sideways_time_stop': 290, 'sideways_use_sma': True, 'sideways_use_ema': True, 'sideways_use_atr': False, 'sideways_use_adx': True, 'sideways_use_spike': True, 'sideways_rsi_required': False}.
[I 2025-09-01 14:47:06,891] Trial 332 finished with values: [-1000000000.0, 1000000000.0] and parameters: {'p_sma': 25, 'p_std': 27, 'p_atr': 14, 'p_adx': 25, 'rsi_period': 68, 'ema1': 29, 'ema2': 40, 'slip_atr_k': 0.24646582184937638, 'slip_spread_k': 0.402372435781604, 'spread_hl_frac': 0.0087754612651909, 'bb_std_mult': 1.4763383382652062, 'rsi_os': 7, 'rsi_ob': 82, 'vol_spike': 0.2403331721952564, 'adx_thresh': 13.51417852493783, 'atr_min_pct': 0.006708281225461195, 'atr_max_pct': 0.07009979188562375, 'tp_mult': 1.340399706483518, 'tsl_mult': 0.6708223620766695, 'strategy': 'mean_reversion', 'time_stop': 78, 'use_sma': False, 'use_atr': False, 'use_adx': False, 'use_ema': False, 'use_spike': False, 'rsi_required': True, 'edge_k': 0.9164243173968669, 'edge_cap': 0.5070312801272698, 'bull_strategy': 'breakout', 'bull_bb_std_mult': 1.5849069089202055, 'bull_rsi_os': 18, 'bull_rsi_ob': 95, 'bull_adx_thresh': 34.54780795309189, 'bull_atr_min_pct': 0.022271493754353305, 'bull_atr_max_pct': 0.1482959871049847, 'bull_tp_mult': 1.428265643007072, 'bull_tsl_mult': 0.8279946326142821, 'bull_time_stop': 233, 'bull_use_sma': False, 'bull_use_ema': True, 'bull_use_atr': True, 'bull_use_adx': True, 'bull_use_spike': False, 'bull_rsi_required': True, 'bear_strategy': 'breakout', 'bear_bb_std_mult': 0.9624179105939281, 'bear_rsi_os': 55, 'bear_rsi_ob': 75, 'bear_adx_thresh': 30.453238033037575, 'bear_atr_min_pct': 0.004107366078920893, 'bear_atr_max_pct': 0.026827363890245485, 'bear_tp_mult': 1.7426310579076343, 'bear_tsl_mult': 0.5688650063740716, 'bear_time_stop': 266, 'bear_use_sma': False, 'bear_use_ema': False, 'bear_use_atr': False, 'bear_use_adx': False, 'bear_use_spike': False, 'bear_rsi_required': True, 'sideways_strategy': 'mean_reversion', 'sideways_bb_std_mult': 1.7515613057291148, 'sideways_rsi_os': 51, 'sideways_rsi_ob': 77, 'sideways_adx_thresh': 33.317793487933685, 'sideways_atr_min_pct': 0.029978088263977548, 'sideways_atr_max_pct': 0.035425638650885174, 'sideways_tp_mult': 2.4068977579250985, 'sideways_tsl_mult': 0.817469317257513, 'sideways_time_stop': 77, 'sideways_use_sma': True, 'sideways_use_ema': True, 'sideways_use_atr': False, 'sideways_use_adx': True, 'sideways_use_spike': True, 'sideways_rsi_required': False}.
[I 2025-09-01 14:47:42,653] Trial 336 finished with values: [-1000000000.0, 1000000000.0] and parameters: {'p_sma': 24, 'p_std': 9, 'p_atr': 13, 'p_adx': 13, 'rsi_period': 72, 'ema1': 12, 'ema2': 18, 'slip_atr_k': 0.007348496694388364, 'slip_spread_k': 0.5963781251497122, 'spread_hl_frac': 0.025687145069628516, 'bb_std_mult': 2.362363649963791, 'rsi_os': 7, 'rsi_ob': 78, 'vol_spike': 0.08384071957143131, 'adx_thresh': 24.68730965254465, 'atr_min_pct': 0.021026115910401117, 'atr_max_pct': 0.06778056318522152, 'tp_mult': 1.704477653908723, 'tsl_mult': 0.38346834788901785, 'strategy': 'mean_reversion', 'time_stop': 5, 'use_sma': False, 'use_atr': False, 'use_adx': False, 'use_ema': False, 'use_spike': False, 'rsi_required': True, 'edge_k': 0.5844514551275529, 'edge_cap': 0.5857644634130019, 'bull_strategy': 'breakout', 'bull_bb_std_mult': 1.5864656943942261, 'bull_rsi_os': 23, 'bull_rsi_ob': 90, 'bull_adx_thresh': 6.037569730934353, 'bull_atr_min_pct': 0.02448184635794886, 'bull_atr_max_pct': 0.03709655840496418, 'bull_tp_mult': 1.0770752615856032, 'bull_tsl_mult': 0.7907927101651947, 'bull_time_stop': 262, 'bull_use_sma': False, 'bull_use_ema': True, 'bull_use_atr': True, 'bull_use_adx': True, 'bull_use_spike': False, 'bull_rsi_required': True, 'bear_strategy': 'breakout', 'bear_bb_std_mult': 1.3536308671007118, 'bear_rsi_os': 22, 'bear_rsi_ob': 94, 'bear_adx_thresh': 6.507177381375563, 'bear_atr_min_pct': 0.0098606284129395, 'bear_atr_max_pct': 0.04740796842422983, 'bear_tp_mult': 2.5415263051662427, 'bear_tsl_mult': 0.6764639232856658, 'bear_time_stop': 248, 'bear_use_sma': False, 'bear_use_ema': False, 'bear_use_atr': False, 'bear_use_adx': False, 'bear_use_spike': False, 'bear_rsi_required': True, 'sideways_strategy': 'mean_reversion', 'sideways_bb_std_mult': 1.3273706111353094, 'sideways_rsi_os': 31, 'sideways_rsi_ob': 77, 'sideways_adx_thresh': 33.010112696520586, 'sideways_atr_min_pct': 0.01681700518682184, 'sideways_atr_max_pct': 0.04033427200531801, 'sideways_tp_mult': 2.7009623668522584, 'sideways_tsl_mult': 0.8143171516671239, 'sideways_time_stop': 166, 'sideways_use_sma': True, 'sideways_use_ema': False, 'sideways_use_atr': False, 'sideways_use_adx': True, 'sideways_use_spike': False, 'sideways_rsi_required': False}.
[I 2025-09-01 14:47:43,695] Trial 337 finished with values: [-0.0055736807883662864, 0.012202196599018039] and parameters: {'p_sma': 26, 'p_std': 27, 'p_atr': 12, 'p_adx': 13, 'rsi_period': 72, 'ema1': 26, 'ema2': 56, 'slip_atr_k': 0.0048259881767374335, 'slip_spread_k': 0.4366060870658379, 'spread_hl_frac': 0.008015398870989785, 'bb_std_mult': 2.344074415687092, 'rsi_os': 30, 'rsi_ob': 78, 'vol_spike': 0.08311584605981212, 'adx_thresh': 27.758197203915234, 'atr_min_pct': 0.016263568841630674, 'atr_max_pct': 0.06800434950438437, 'tp_mult': 2.350935993950606, 'tsl_mult': 0.43011816638492417, 'strategy': 'breakout', 'time_stop': 17, 'use_sma': False, 'use_atr': True, 'use_adx': False, 'use_ema': False, 'use_spike': False, 'rsi_required': True, 'edge_k': 1.6710164906538578, 'edge_cap': 0.9241719593177534, 'bull_strategy': 'breakout', 'bull_bb_std_mult': 1.020093651078051, 'bull_rsi_os': 23, 'bull_rsi_ob': 64, 'bull_adx_thresh': 5.880951610899837, 'bull_atr_min_pct': 0.011136507385462123, 'bull_atr_max_pct': 0.0367734394813118, 'bull_tp_mult': 1.4402109877759788, 'bull_tsl_mult': 0.8972610189786628, 'bull_time_stop': 138, 'bull_use_sma': False, 'bull_use_ema': True, 'bull_use_atr': False, 'bull_use_adx': True, 'bull_use_spike': False, 'bull_rsi_required': True, 'bear_strategy': 'breakout', 'bear_bb_std_mult': 1.4039812920905763, 'bear_rsi_os': 52, 'bear_rsi_ob': 48, 'bear_adx_thresh': 7.515641941319887, 'bear_atr_min_pct': 0.004997851359962597, 'bear_atr_max_pct': 0.04651733902722558, 'bear_tp_mult': 1.6775249327341786, 'bear_tsl_mult': 0.6749856166298344, 'bear_time_stop': 247, 'bear_use_sma': True, 'bear_use_ema': False, 'bear_use_atr': False, 'bear_use_adx': False, 'bear_use_spike': True, 'bear_rsi_required': True, 'sideways_strategy': 'mean_reversion', 'sideways_bb_std_mult': 1.258413768361254, 'sideways_rsi_os': 25, 'sideways_rsi_ob': 78, 'sideways_adx_thresh': 33.267778105266494, 'sideways_atr_min_pct': 0.012736015778918997, 'sideways_atr_max_pct': 0.039176093343467784, 'sideways_tp_mult': 2.277283667853556, 'sideways_tsl_mult': 0.8170687620359056, 'sideways_time_stop': 77, 'sideways_use_sma': True, 'sideways_use_ema': False, 'sideways_use_atr': False, 'sideways_use_adx': True, 'sideways_use_spike': False, 'sideways_rsi_required': False}.
[I 2025-09-01 14:47:44,003] Trial 338 finished with values: [-0.013491535458949544, 0.020296956655738583] and parameters: {'p_sma': 48, 'p_std': 12, 'p_atr': 13, 'p_adx': 14, 'rsi_period': 47, 'ema1': 5, 'ema2': 18, 'slip_atr_k': 0.0011920977840512996, 'slip_spread_k': 0.8113784783378303, 'spread_hl_frac': 0.00765635481677511, 'bb_std_mult': 2.358606950980901, 'rsi_os': 9, 'rsi_ob': 76, 'vol_spike': 0.0750202872473547, 'adx_thresh': 34.59016435956777, 'atr_min_pct': 0.029165813358395333, 'atr_max_pct': 0.06785280769930949, 'tp_mult': 2.388760434465455, 'tsl_mult': 0.3894076628272912, 'strategy': 'breakout', 'time_stop': 84, 'use_sma': False, 'use_atr': True, 'use_adx': False, 'use_ema': False, 'use_spike': False, 'rsi_required': True, 'edge_k': 0.7993078213444655, 'edge_cap': 0.9450419555044696, 'bull_strategy': 'breakout', 'bull_bb_std_mult': 1.4553200959977788, 'bull_rsi_os': 48, 'bull_rsi_ob': 57, 'bull_adx_thresh': 14.614473681120181, 'bull_atr_min_pct': 0.013559539721097757, 'bull_atr_max_pct': 0.03759069764888934, 'bull_tp_mult': 2.4671979690421, 'bull_tsl_mult': 0.9465173195521848, 'bull_time_stop': 84, 'bull_use_sma': False, 'bull_use_ema': True, 'bull_use_atr': False, 'bull_use_adx': True, 'bull_use_spike': False, 'bull_rsi_required': True, 'bear_strategy': 'breakout', 'bear_bb_std_mult': 2.785571709573751, 'bear_rsi_os': 52, 'bear_rsi_ob': 85, 'bear_adx_thresh': 15.261147721067989, 'bear_atr_min_pct': 0.004811607031397369, 'bear_atr_max_pct': 0.018029109835465035, 'bear_tp_mult': 1.8671850466506386, 'bear_tsl_mult': 0.6346232020051934, 'bear_time_stop': 247, 'bear_use_sma': True, 'bear_use_ema': True, 'bear_use_atr': False, 'bear_use_adx': False, 'bear_use_spike': True, 'bear_rsi_required': True, 'sideways_strategy': 'mean_reversion', 'sideways_bb_std_mult': 1.222031406687572, 'sideways_rsi_os': 32, 'sideways_rsi_ob': 78, 'sideways_adx_thresh': 32.312900935283565, 'sideways_atr_min_pct': 0.01274985122339687, 'sideways_atr_max_pct': 0.039024730105741666, 'sideways_tp_mult': 2.70039767926894, 'sideways_tsl_mult': 0.4572889708934857, 'sideways_time_stop': 62, 'sideways_use_sma': True, 'sideways_use_ema': False, 'sideways_use_atr': False, 'sideways_use_adx': True, 'sideways_use_spike': False, 'sideways_rsi_required': False}.
[I 2025-09-01 14:47:44,404] Trial 335 finished with values: [-1000000000.0, 1000000000.0] and parameters: {'p_sma': 15, 'p_std': 27, 'p_atr': 23, 'p_adx': 13, 'rsi_period': 72, 'ema1': 28, 'ema2': 53, 'slip_atr_k': 0.0011385368019903416, 'slip_spread_k': 0.5994840195266096, 'spread_hl_frac': 0.0034183247086574525, 'bb_std_mult': 1.4368552384300504, 'rsi_os': 7, 'rsi_ob': 78, 'vol_spike': 0.0806120186712161, 'adx_thresh': 25.018742290512606, 'atr_min_pct': 0.009111836564745941, 'atr_max_pct': 0.06668880996087331, 'tp_mult': 2.1108822546178607, 'tsl_mult': 0.6647242514471253, 'strategy': 'mean_reversion', 'time_stop': 91, 'use_sma': False, 'use_atr': False, 'use_adx': False, 'use_ema': False, 'use_spike': False, 'rsi_required': True, 'edge_k': 0.816876474814575, 'edge_cap': 0.9457364508924209, 'bull_strategy': 'breakout', 'bull_bb_std_mult': 1.4490255731960666, 'bull_rsi_os': 7, 'bull_rsi_ob': 57, 'bull_adx_thresh': 9.352978238523281, 'bull_atr_min_pct': 0.02677897764112408, 'bull_atr_max_pct': 0.07083032121345938, 'bull_tp_mult': 1.448602505036644, 'bull_tsl_mult': 0.8352239075799689, 'bull_time_stop': 100, 'bull_use_sma': False, 'bull_use_ema': True, 'bull_use_atr': True, 'bull_use_adx': True, 'bull_use_spike': False, 'bull_rsi_required': True, 'bear_strategy': 'breakout', 'bear_bb_std_mult': 1.3776479237264763, 'bear_rsi_os': 43, 'bear_rsi_ob': 94, 'bear_adx_thresh': 17.27836576428267, 'bear_atr_min_pct': 0.019785082227522417, 'bear_atr_max_pct': 0.017938212466801898, 'bear_tp_mult': 1.6236523388603046, 'bear_tsl_mult': 0.5764352100977206, 'bear_time_stop': 43, 'bear_use_sma': False, 'bear_use_ema': False, 'bear_use_atr': False, 'bear_use_adx': False, 'bear_use_spike': False, 'bear_rsi_required': True, 'sideways_strategy': 'mean_reversion', 'sideways_bb_std_mult': 1.330264237656024, 'sideways_rsi_os': 29, 'sideways_rsi_ob': 56, 'sideways_adx_thresh': 21.879725179548736, 'sideways_atr_min_pct': 0.012236246944265632, 'sideways_atr_max_pct': 0.03734478488171106, 'sideways_tp_mult': 2.5991308057506055, 'sideways_tsl_mult': 0.22373183545152148, 'sideways_time_stop': 167, 'sideways_use_sma': True, 'sideways_use_ema': False, 'sideways_use_atr': False, 'sideways_use_adx': True, 'sideways_use_spike': True, 'sideways_rsi_required': False}.
[I 2025-09-01 14:48:23,466] Trial 342 finished with values: [-0.053542375128392994, 0.05311785223465598] and parameters: {'p_sma': 29, 'p_std': 29, 'p_atr': 12, 'p_adx': 14, 'rsi_period': 41, 'ema1': 25, 'ema2': 56, 'slip_atr_k': 0.0054179805860133465, 'slip_spread_k': 0.408901791442097, 'spread_hl_frac': 0.007240540413231421, 'bb_std_mult': 2.2248584788812606, 'rsi_os': 30, 'rsi_ob': 76, 'vol_spike': 0.07231285294491445, 'adx_thresh': 28.6933720470282, 'atr_min_pct': 0.016151034007338774, 'atr_max_pct': 0.07202216495424352, 'tp_mult': 2.017330980801428, 'tsl_mult': 0.42195170446282515, 'strategy': 'breakout', 'time_stop': 17, 'use_sma': False, 'use_atr': True, 'use_adx': False, 'use_ema': False, 'use_spike': True, 'rsi_required': False, 'edge_k': 1.666263599188876, 'edge_cap': 0.8742203976116739, 'bull_strategy': 'breakout', 'bull_bb_std_mult': 0.9835842680396663, 'bull_rsi_os': 24, 'bull_rsi_ob': 65, 'bull_adx_thresh': 5.282514145591969, 'bull_atr_min_pct': 0.011214959309315313, 'bull_atr_max_pct': 0.03123940153461443, 'bull_tp_mult': 1.4952679081382638, 'bull_tsl_mult': 0.9601891999624848, 'bull_time_stop': 140, 'bull_use_sma': False, 'bull_use_ema': True, 'bull_use_atr': False, 'bull_use_adx': True, 'bull_use_spike': True, 'bull_rsi_required': False, 'bear_strategy': 'breakout', 'bear_bb_std_mult': 1.418767376893136, 'bear_rsi_os': 50, 'bear_rsi_ob': 50, 'bear_adx_thresh': 8.906049434558064, 'bear_atr_min_pct': 0.0031307707554885985, 'bear_atr_max_pct': 0.03936648093048227, 'bear_tp_mult': 1.6051195540927767, 'bear_tsl_mult': 0.7104172398447623, 'bear_time_stop': 250, 'bear_use_sma': True, 'bear_use_ema': False, 'bear_use_atr': False, 'bear_use_adx': False, 'bear_use_spike': True, 'bear_rsi_required': False, 'sideways_strategy': 'mean_reversion', 'sideways_bb_std_mult': 1.1166326953179553, 'sideways_rsi_os': 25, 'sideways_rsi_ob': 67, 'sideways_adx_thresh': 32.2162202064152, 'sideways_atr_min_pct': 0.012842730876086084, 'sideways_atr_max_pct': 0.046530450950859246, 'sideways_tp_mult': 2.173524429868896, 'sideways_tsl_mult': 0.7808182264812643, 'sideways_time_stop': 59, 'sideways_use_sma': True, 'sideways_use_ema': False, 'sideways_use_atr': True, 'sideways_use_adx': True, 'sideways_use_spike': False, 'sideways_rsi_required': False}.
[I 2025-09-01 14:48:23,932] Trial 341 finished with values: [-0.02024651262100574, 0.025091466807171434] and parameters: {'p_sma': 29, 'p_std': 27, 'p_atr': 12, 'p_adx': 13, 'rsi_period': 51, 'ema1': 25, 'ema2': 56, 'slip_atr_k': 0.004185349139100149, 'slip_spread_k': 0.3918376536752656, 'spread_hl_frac': 0.007709410642988021, 'bb_std_mult': 2.265823826741245, 'rsi_os': 31, 'rsi_ob': 78, 'vol_spike': 0.07729137228513176, 'adx_thresh': 28.826717565582367, 'atr_min_pct': 0.015855248240716876, 'atr_max_pct': 0.07284358669245009, 'tp_mult': 2.372948503561577, 'tsl_mult': 0.43186236112324106, 'strategy': 'breakout', 'time_stop': 18, 'use_sma': False, 'use_atr': True, 'use_adx': False, 'use_ema': False, 'use_spike': True, 'rsi_required': False, 'edge_k': 1.6729877929493535, 'edge_cap': 0.8779306981241729, 'bull_strategy': 'breakout', 'bull_bb_std_mult': 1.0442119794455251, 'bull_rsi_os': 24, 'bull_rsi_ob': 65, 'bull_adx_thresh': 5.495176326176832, 'bull_atr_min_pct': 0.011499387525412363, 'bull_atr_max_pct': 0.031042871723713727, 'bull_tp_mult': 1.4982024158452392, 'bull_tsl_mult': 0.9568950324163493, 'bull_time_stop': 141, 'bull_use_sma': False, 'bull_use_ema': True, 'bull_use_atr': False, 'bull_use_adx': True, 'bull_use_spike': True, 'bull_rsi_required': False, 'bear_strategy': 'breakout', 'bear_bb_std_mult': 1.396940843474608, 'bear_rsi_os': 49, 'bear_rsi_ob': 50, 'bear_adx_thresh': 8.687475352735419, 'bear_atr_min_pct': 0.004380928759722528, 'bear_atr_max_pct': 0.04546859357783288, 'bear_tp_mult': 1.5783951842725779, 'bear_tsl_mult': 0.7068267969916063, 'bear_time_stop': 258, 'bear_use_sma': True, 'bear_use_ema': False, 'bear_use_atr': False, 'bear_use_adx': False, 'bear_use_spike': True, 'bear_rsi_required': False, 'sideways_strategy': 'mean_reversion', 'sideways_bb_std_mult': 1.069587397719494, 'sideways_rsi_os': 25, 'sideways_rsi_ob': 78, 'sideways_adx_thresh': 31.869914232121857, 'sideways_atr_min_pct': 0.011748732791350112, 'sideways_atr_max_pct': 0.04559835603352554, 'sideways_tp_mult': 2.3194430669473527, 'sideways_tsl_mult': 0.7844757995145888, 'sideways_time_stop': 56, 'sideways_use_sma': True, 'sideways_use_ema': False, 'sideways_use_atr': True, 'sideways_use_adx': True, 'sideways_use_spike': False, 'sideways_rsi_required': False}.
[I 2025-09-01 14:48:24,390] Trial 339 finished with values: [-1000000000.0, 1000000000.0] and parameters: {'p_sma': 26, 'p_std': 8, 'p_atr': 12, 'p_adx': 14, 'rsi_period': 53, 'ema1': 26, 'ema2': 40, 'slip_atr_k': 0.00916763881314588, 'slip_spread_k': 0.6279509693760865, 'spread_hl_frac': 0.033038744867526414, 'bb_std_mult': 0.6908977439851225, 'rsi_os': 28, 'rsi_ob': 84, 'vol_spike': 0.08011597122227354, 'adx_thresh': 27.78910943450976, 'atr_min_pct': 0.02898178505069528, 'atr_max_pct': 0.06490527057954745, 'tp_mult': 2.342853824537876, 'tsl_mult': 0.4374241325931939, 'strategy': 'breakout', 'time_stop': 83, 'use_sma': False, 'use_atr': True, 'use_adx': False, 'use_ema': False, 'use_spike': False, 'rsi_required': False, 'edge_k': 0.3482411848611417, 'edge_cap': 0.946082940661163, 'bull_strategy': 'breakout', 'bull_bb_std_mult': 0.735230622420135, 'bull_rsi_os': 10, 'bull_rsi_ob': 57, 'bull_adx_thresh': 23.909040886786343, 'bull_atr_min_pct': 0.011198543564293964, 'bull_atr_max_pct': 0.11150937846476788, 'bull_tp_mult': 1.1367341499671375, 'bull_tsl_mult': 0.9435362322912014, 'bull_time_stop': 12, 'bull_use_sma': False, 'bull_use_ema': True, 'bull_use_atr': False, 'bull_use_adx': True, 'bull_use_spike': True, 'bull_rsi_required': False, 'bear_strategy': 'breakout', 'bear_bb_std_mult': 3.225340856817236, 'bear_rsi_os': 19, 'bear_rsi_ob': 85, 'bear_adx_thresh': 23.382294239268717, 'bear_atr_min_pct': 0.00462154942307099, 'bear_atr_max_pct': 0.01880623103456104, 'bear_tp_mult': 1.6887271007377271, 'bear_tsl_mult': 0.6367224734116939, 'bear_time_stop': 43, 'bear_use_sma': True, 'bear_use_ema': True, 'bear_use_atr': False, 'bear_use_adx': False, 'bear_use_spike': True, 'bear_rsi_required': False, 'sideways_strategy': 'mean_reversion', 'sideways_bb_std_mult': 1.2604537378782357, 'sideways_rsi_os': 25, 'sideways_rsi_ob': 75, 'sideways_adx_thresh': 31.685129827510625, 'sideways_atr_min_pct': 0.01690654079932769, 'sideways_atr_max_pct': 0.029598723295951482, 'sideways_tp_mult': 2.601644609314485, 'sideways_tsl_mult': 0.21575763463495878, 'sideways_time_stop': 97, 'sideways_use_sma': True, 'sideways_use_ema': False, 'sideways_use_atr': False, 'sideways_use_adx': True, 'sideways_use_spike': False, 'sideways_rsi_required': False}.
