[I 2025-09-01 14:17:47,467] Trial 144 finished with values: [-1000000000.0, 1000000000.0] and parameters: {'p_sma': 31, 'p_std': 36, 'p_atr': 23, 'p_adx': 29, 'rsi_period': 67, 'ema1': 7, 'ema2': 42, 'slip_atr_k': 0.15030359579451624, 'slip_spread_k': 0.652093842216241, 'spread_hl_frac': 0.042982393947305665, 'bb_std_mult': 3.2804406781690165, 'rsi_os': 16, 'rsi_ob': 88, 'vol_spike': 0.016180718478903226, 'adx_thresh': 22.11909793462568, 'atr_min_pct': 0.00022380752630719522, 'atr_max_pct': 0.026106011010637704, 'tp_mult': 2.428413892466216, 'tsl_mult': 0.2947724019319389, 'strategy': 'breakout', 'time_stop': 81, 'use_sma': False, 'use_atr': False, 'use_adx': False, 'use_ema': False, 'use_spike': False, 'rsi_required': True, 'edge_k': 0.8177309684030336, 'edge_cap': 0.2133311949868879, 'bull_strategy': 'breakout', 'bull_bb_std_mult': 1.6618442612728268, 'bull_rsi_os': 21, 'bull_rsi_ob': 55, 'bull_adx_thresh': 34.958720899892654, 'bull_atr_min_pct': 0.01947111277407817, 'bull_atr_max_pct': 0.07122128974008529, 'bull_tp_mult': 2.7469725252049093, 'bull_tsl_mult': 0.8946539790592102, 'bull_time_stop': 35, 'bull_use_sma': False, 'bull_use_ema': True, 'bull_use_atr': False, 'bull_use_adx': False, 'bull_use_spike': False, 'bull_rsi_required': True, 'bear_strategy': 'breakout', 'bear_bb_std_mult': 2.043168304285868, 'bear_rsi_os': 24, 'bear_rsi_ob': 64, 'bear_adx_thresh': 5.495387656372437, 'bear_atr_min_pct': 0.0013532178664322184, 'bear_atr_max_pct': 0.11726971329384357, 'bear_tp_mult': 1.709793634044774, 'bear_tsl_mult': 0.8541637133497687, 'bear_time_stop': 269, 'bear_use_sma': False, 'bear_use_ema': True, 'bear_use_atr': True, 'bear_use_adx': False, 'bear_use_spike': False, 'bear_rsi_required': True, 'sideways_strategy': 'mean_reversion', 'sideways_bb_std_mult': 2.140090090714163, 'sideways_rsi_os': 5, 'sideways_rsi_ob': 74, 'sideways_adx_thresh': 32.07795753295824, 'sideways_atr_min_pct': 0.0207432724905959, 'sideways_atr_max_pct': 0.03605397314802895, 'sideways_tp_mult': 2.6656593564971827, 'sideways_tsl_mult': 0.896213774834986, 'sideways_time_stop': 201, 'sideways_use_sma': True, 'sideways_use_ema': True, 'sideways_use_atr': False, 'sideways_use_adx': True, 'sideways_use_spike': True, 'sideways_rsi_required': False}.
[I 2025-09-01 14:18:22,834] Trial 147 finished with values: [-1000000000.0, 1000000000.0] and parameters: {'p_sma': 25, 'p_std': 22, 'p_atr': 27, 'p_adx': 15, 'rsi_period': 23, 'ema1': 29, 'ema2': 37, 'slip_atr_k': 0.022077441341660856, 'slip_spread_k': 0.6656220666241989, 'spread_hl_frac': 0.0418941076482575, 'bb_std_mult': 2.3818340180839255, 'rsi_os': 49, 'rsi_ob': 80, 'vol_spike': 0.24616928985601744, 'adx_thresh': 25.948926828688453, 'atr_min_pct': 0.020590457554681172, 'atr_max_pct': 0.05479669319812661, 'tp_mult': 2.4088453279547797, 'tsl_mult': 0.5070840517845532, 'strategy': 'mean_reversion', 'time_stop': 83, 'use_sma': False, 'use_atr': False, 'use_adx': False, 'use_ema': False, 'use_spike': True, 'rsi_required': False, 'edge_k': 0.7789483015746305, 'edge_cap': 0.6989697392818798, 'bull_strategy': 'mean_reversion', 'bull_bb_std_mult': 1.6348649128233448, 'bull_rsi_os': 21, 'bull_rsi_ob': 52, 'bull_adx_thresh': 11.544370353655498, 'bull_atr_min_pct': 0.006072971798172758, 'bull_atr_max_pct': 0.04391967237683338, 'bull_tp_mult': 1.9413007766612798, 'bull_tsl_mult': 0.6284746581762201, 'bull_time_stop': 36, 'bull_use_sma': False, 'bull_use_ema': False, 'bull_use_atr': True, 'bull_use_adx': True, 'bull_use_spike': False, 'bull_rsi_required': True, 'bear_strategy': 'mean_reversion', 'bear_bb_std_mult': 2.1751429780814693, 'bear_rsi_os': 23, 'bear_rsi_ob': 84, 'bear_adx_thresh': 12.99479386103835, 'bear_atr_min_pct': 0.0006943236761608202, 'bear_atr_max_pct': 0.04651174226509784, 'bear_tp_mult': 1.683909371588132, 'bear_tsl_mult': 0.5593743913078174, 'bear_time_stop': 126, 'bear_use_sma': False, 'bear_use_ema': True, 'bear_use_atr': False, 'bear_use_adx': True, 'bear_use_spike': False, 'bear_rsi_required': False, 'sideways_strategy': 'breakout', 'sideways_bb_std_mult': 2.8091715433299633, 'sideways_rsi_os': 21, 'sideways_rsi_ob': 87, 'sideways_adx_thresh': 33.108239251436856, 'sideways_atr_min_pct': 0.0035911508303956927, 'sideways_atr_max_pct': 0.0435832503554332, 'sideways_tp_mult': 2.714757310523873, 'sideways_tsl_mult': 0.8721429183040528, 'sideways_time_stop': 150, 'sideways_use_sma': False, 'sideways_use_ema': False, 'sideways_use_atr': False, 'sideways_use_adx': False, 'sideways_use_spike': False, 'sideways_rsi_required': False}.
[I 2025-09-01 14:18:23,545] Trial 148 finished with values: [-1000000000.0, 1000000000.0] and parameters: {'p_sma': 16, 'p_std': 22, 'p_atr': 9, 'p_adx': 15, 'rsi_period': 22, 'ema1': 30, 'ema2': 41, 'slip_atr_k': 0.021213787022671755, 'slip_spread_k': 0.32043160472591825, 'spread_hl_frac': 0.041938111192853, 'bb_std_mult': 2.6859943583037498, 'rsi_os': 49, 'rsi_ob': 79, 'vol_spike': 0.14003181550075142, 'adx_thresh': 8.22811357331055, 'atr_min_pct': 0.006049236468291298, 'atr_max_pct': 0.05541837085373085, 'tp_mult': 1.2969898366890846, 'tsl_mult': 0.5158525075781676, 'strategy': 'mean_reversion', 'time_stop': 101, 'use_sma': True, 'use_atr': False, 'use_adx': True, 'use_ema': False, 'use_spike': True, 'rsi_required': False, 'edge_k': 0.4717611109551442, 'edge_cap': 0.4899135532867137, 'bull_strategy': 'mean_reversion', 'bull_bb_std_mult': 2.2389357247019746, 'bull_rsi_os': 18, 'bull_rsi_ob': 57, 'bull_adx_thresh': 25.627505166025706, 'bull_atr_min_pct': 0.006666655944692098, 'bull_atr_max_pct': 0.04409425165601335, 'bull_tp_mult': 1.0378030169699481, 'bull_tsl_mult': 0.9466032628412722, 'bull_time_stop': 209, 'bull_use_sma': False, 'bull_use_ema': False, 'bull_use_atr': True, 'bull_use_adx': True, 'bull_use_spike': False, 'bull_rsi_required': True, 'bear_strategy': 'mean_reversion', 'bear_bb_std_mult': 2.1584006527546817, 'bear_rsi_os': 48, 'bear_rsi_ob': 55, 'bear_adx_thresh': 13.191819966032696, 'bear_atr_min_pct': 0.02995814436275834, 'bear_atr_max_pct': 0.12787938179514913, 'bear_tp_mult': 2.593976939705823, 'bear_tsl_mult': 0.6299181697947736, 'bear_time_stop': 194, 'bear_use_sma': False, 'bear_use_ema': True, 'bear_use_atr': False, 'bear_use_adx': True, 'bear_use_spike': False, 'bear_rsi_required': False, 'sideways_strategy': 'breakout', 'sideways_bb_std_mult': 1.393236905420288, 'sideways_rsi_os': 21, 'sideways_rsi_ob': 51, 'sideways_adx_thresh': 32.89098556606638, 'sideways_atr_min_pct': 0.004226209885163175, 'sideways_atr_max_pct': 0.07327324000307857, 'sideways_tp_mult': 1.8432407952330758, 'sideways_tsl_mult': 0.8663750422826366, 'sideways_time_stop': 126, 'sideways_use_sma': False, 'sideways_use_ema': False, 'sideways_use_atr': False, 'sideways_use_adx': False, 'sideways_use_spike': False, 'sideways_rsi_required': False}.
[I 2025-09-01 14:18:23,766] Trial 146 finished with values: [-1000000000.0, 1000000000.0] and parameters: {'p_sma': 30, 'p_std': 31, 'p_atr': 20, 'p_adx': 15, 'rsi_period': 76, 'ema1': 7, 'ema2': 42, 'slip_atr_k': 0.02822836150001621, 'slip_spread_k': 0.8951660459801101, 'spread_hl_frac': 0.043150135988118, 'bb_std_mult': 3.2742848027190448, 'rsi_os': 32, 'rsi_ob': 51, 'vol_spike': 0.017134895703480826, 'adx_thresh': 27.517716042723002, 'atr_min_pct': 0.020720854068453223, 'atr_max_pct': 0.053719581486997334, 'tp_mult': 2.4304583792592998, 'tsl_mult': 0.5104200532672386, 'strategy': 'breakout', 'time_stop': 215, 'use_sma': False, 'use_atr': False, 'use_adx': False, 'use_ema': False, 'use_spike': True, 'rsi_required': False, 'edge_k': 0.47699235208321444, 'edge_cap': 0.2785860448796965, 'bull_strategy': 'mean_reversion', 'bull_bb_std_mult': 1.653915859376195, 'bull_rsi_os': 21, 'bull_rsi_ob': 56, 'bull_adx_thresh': 17.40861069027071, 'bull_atr_min_pct': 0.006737632402786501, 'bull_atr_max_pct': 0.043985823944890534, 'bull_tp_mult': 1.1346062662560001, 'bull_tsl_mult': 0.8928651844014136, 'bull_time_stop': 203, 'bull_use_sma': False, 'bull_use_ema': False, 'bull_use_atr': False, 'bull_use_adx': False, 'bull_use_spike': False, 'bull_rsi_required': True, 'bear_strategy': 'mean_reversion', 'bear_bb_std_mult': 2.0350459651817814, 'bear_rsi_os': 48, 'bear_rsi_ob': 63, 'bear_adx_thresh': 12.814038307563715, 'bear_atr_min_pct': 0.019209366895060018, 'bear_atr_max_pct': 0.11896164479385829, 'bear_tp_mult': 1.811087203557274, 'bear_tsl_mult': 0.5393787201614363, 'bear_time_stop': 268, 'bear_use_sma': False, 'bear_use_ema': True, 'bear_use_atr': False, 'bear_use_adx': True, 'bear_use_spike': False, 'bear_rsi_required': False, 'sideways_strategy': 'breakout', 'sideways_bb_std_mult': 1.3574710051276253, 'sideways_rsi_os': 5, 'sideways_rsi_ob': 88, 'sideways_adx_thresh': 31.968343591315215, 'sideways_atr_min_pct': 0.016966694418872264, 'sideways_atr_max_pct': 0.0788675720517966, 'sideways_tp_mult': 2.713940281544218, 'sideways_tsl_mult': 0.9042564449026388, 'sideways_time_stop': 108, 'sideways_use_sma': False, 'sideways_use_ema': False, 'sideways_use_atr': False, 'sideways_use_adx': False, 'sideways_use_spike': False, 'sideways_rsi_required': False}.
[I 2025-09-01 14:18:24,211] Trial 145 finished with values: [-1000000000.0, 1000000000.0] and parameters: {'p_sma': 30, 'p_std': 7, 'p_atr': 9, 'p_adx': 15, 'rsi_period': 23, 'ema1': 26, 'ema2': 42, 'slip_atr_k': 0.14406358448731896, 'slip_spread_k': 0.8969816403737125, 'spread_hl_frac': 0.04292414705251775, 'bb_std_mult': 3.3160679023392725, 'rsi_os': 32, 'rsi_ob': 81, 'vol_spike': 0.08751176209143334, 'adx_thresh': 8.324472273625965, 'atr_min_pct': 0.00927031469471077, 'atr_max_pct': 0.028100218655024073, 'tp_mult': 2.419887808668445, 'tsl_mult': 0.307384907912332, 'strategy': 'breakout', 'time_stop': 221, 'use_sma': False, 'use_atr': False, 'use_adx': False, 'use_ema': False, 'use_spike': True, 'rsi_required': False, 'edge_k': 0.7882263254211915, 'edge_cap': 0.9191524697934849, 'bull_strategy': 'mean_reversion', 'bull_bb_std_mult': 1.6758877463430748, 'bull_rsi_os': 21, 'bull_rsi_ob': 56, 'bull_adx_thresh': 17.560563657430023, 'bull_atr_min_pct': 0.02429351491429, 'bull_atr_max_pct': 0.0303618757265465, 'bull_tp_mult': 1.946845344402022, 'bull_tsl_mult': 0.9050424300340295, 'bull_time_stop': 35, 'bull_use_sma': False, 'bull_use_ema': True, 'bull_use_atr': False, 'bull_use_adx': False, 'bull_use_spike': False, 'bull_rsi_required': True, 'bear_strategy': 'mean_reversion', 'bear_bb_std_mult': 2.1665006462023846, 'bear_rsi_os': 53, 'bear_rsi_ob': 56, 'bear_adx_thresh': 5.009718250943442, 'bear_atr_min_pct': 0.029888216077594808, 'bear_atr_max_pct': 0.12740815135514613, 'bear_tp_mult': 1.821033334196204, 'bear_tsl_mult': 0.562233582579723, 'bear_time_stop': 33, 'bear_use_sma': False, 'bear_use_ema': True, 'bear_use_atr': False, 'bear_use_adx': True, 'bear_use_spike': False, 'bear_rsi_required': False, 'sideways_strategy': 'breakout', 'sideways_bb_std_mult': 2.8232275845181802, 'sideways_rsi_os': 34, 'sideways_rsi_ob': 88, 'sideways_adx_thresh': 34.07899438505774, 'sideways_atr_min_pct': 0.02055044783061121, 'sideways_atr_max_pct': 0.03598908951983158, 'sideways_tp_mult': 2.539603629756248, 'sideways_tsl_mult': 0.8800056568619136, 'sideways_time_stop': 148, 'sideways_use_sma': False, 'sideways_use_ema': False, 'sideways_use_atr': False, 'sideways_use_adx': False, 'sideways_use_spike': True, 'sideways_rsi_required': False}.
[I 2025-09-01 14:19:00,104] Trial 149 finished with values: [-1000000000.0, 1000000000.0] and parameters: {'p_sma': 16, 'p_std': 9, 'p_atr': 9, 'p_adx': 26, 'rsi_period': 18, 'ema1': 30, 'ema2': 10, 'slip_atr_k': 0.2297776197046208, 'slip_spread_k': 0.3392836034993123, 'spread_hl_frac': 0.038829457747928384, 'bb_std_mult': 2.686011611855883, 'rsi_os': 11, 'rsi_ob': 81, 'vol_spike': 0.1000044411775754, 'adx_thresh': 27.570781904256897, 'atr_min_pct': 0.008295223976680805, 'atr_max_pct': 0.0858630645219688, 'tp_mult': 2.3127605136343323, 'tsl_mult': 0.07977644375987025, 'strategy': 'breakout', 'time_stop': 221, 'use_sma': True, 'use_atr': False, 'use_adx': True, 'use_ema': False, 'use_spike': True, 'rsi_required': False, 'edge_k': 0.41221068833258906, 'edge_cap': 0.496131533748685, 'bull_strategy': 'mean_reversion', 'bull_bb_std_mult': 1.3783921917706603, 'bull_rsi_os': 18, 'bull_rsi_ob': 57, 'bull_adx_thresh': 30.276275643911873, 'bull_atr_min_pct': 0.016629981119398098, 'bull_atr_max_pct': 0.032389026855202854, 'bull_tp_mult': 1.1399542126615847, 'bull_tsl_mult': 0.5079514142715473, 'bull_time_stop': 227, 'bull_use_sma': False, 'bull_use_ema': False, 'bull_use_atr': False, 'bull_use_adx': True, 'bull_use_spike': False, 'bull_rsi_required': True, 'bear_strategy': 'mean_reversion', 'bear_bb_std_mult': 1.1013930995118812, 'bear_rsi_os': 50, 'bear_rsi_ob': 93, 'bear_adx_thresh': 9.770089480122435, 'bear_atr_min_pct': 0.029640258085737378, 'bear_atr_max_pct': 0.05245098824495403, 'bear_tp_mult': 1.8032150125593773, 'bear_tsl_mult': 0.628967811845209, 'bear_time_stop': 85, 'bear_use_sma': False, 'bear_use_ema': True, 'bear_use_atr': False, 'bear_use_adx': True, 'bear_use_spike': False, 'bear_rsi_required': False, 'sideways_strategy': 'breakout', 'sideways_bb_std_mult': 1.3434265623726998, 'sideways_rsi_os': 30, 'sideways_rsi_ob': 79, 'sideways_adx_thresh': 33.04919815498672, 'sideways_atr_min_pct': 0.016909432668807137, 'sideways_atr_max_pct': 0.07894681400601837, 'sideways_tp_mult': 2.052469515095501, 'sideways_tsl_mult': 0.3619562881967534, 'sideways_time_stop': 92, 'sideways_use_sma': False, 'sideways_use_ema': False, 'sideways_use_atr': False, 'sideways_use_adx': False, 'sideways_use_spike': False, 'sideways_rsi_required': False}.
[I 2025-09-01 14:19:01,088] Trial 151 finished with values: [-1000000000.0, 1000000000.0] and parameters: {'p_sma': 8, 'p_std': 11, 'p_atr': 13, 'p_adx': 13, 'rsi_period': 73, 'ema1': 12, 'ema2': 31, 'slip_atr_k': 0.22890419064967887, 'slip_spread_k': 0.5147758791638474, 'spread_hl_frac': 0.04422578401004981, 'bb_std_mult': 1.270303753339772, 'rsi_os': 11, 'rsi_ob': 83, 'vol_spike': 0.10198941051490391, 'adx_thresh': 27.03394488926344, 'atr_min_pct': 0.00797488137419165, 'atr_max_pct': 0.08538426735942996, 'tp_mult': 1.9816851482224247, 'tsl_mult': 0.045050090600260106, 'strategy': 'breakout', 'time_stop': 64, 'use_sma': True, 'use_atr': False, 'use_adx': True, 'use_ema': False, 'use_spike': False, 'rsi_required': True, 'edge_k': 0.4372408860212409, 'edge_cap': 0.8906560601582443, 'bull_strategy': 'breakout', 'bull_bb_std_mult': 0.5006163369879706, 'bull_rsi_os': 15, 'bull_rsi_ob': 53, 'bull_adx_thresh': 7.631533943672875, 'bull_atr_min_pct': 0.0024105098080286925, 'bull_atr_max_pct': 0.031191982474248467, 'bull_tp_mult': 1.1767410932988924, 'bull_tsl_mult': 0.7306242854238043, 'bull_time_stop': 5, 'bull_use_sma': False, 'bull_use_ema': True, 'bull_use_atr': False, 'bull_use_adx': True, 'bull_use_spike': False, 'bull_rsi_required': True, 'bear_strategy': 'breakout', 'bear_bb_std_mult': 0.5903449362735087, 'bear_rsi_os': 36, 'bear_rsi_ob': 67, 'bear_adx_thresh': 6.235967992383075, 'bear_atr_min_pct': 0.02913038791956373, 'bear_atr_max_pct': 0.05433937611979091, 'bear_tp_mult': 1.6589831368057064, 'bear_tsl_mult': 0.6889234549724543, 'bear_time_stop': 178, 'bear_use_sma': False, 'bear_use_ema': False, 'bear_use_atr': False, 'bear_use_adx': False, 'bear_use_spike': True, 'bear_rsi_required': True, 'sideways_strategy': 'mean_reversion', 'sideways_bb_std_mult': 0.999109671671766, 'sideways_rsi_os': 30, 'sideways_rsi_ob': 78, 'sideways_adx_thresh': 22.450737809350137, 'sideways_atr_min_pct': 0.018924787951437885, 'sideways_atr_max_pct': 0.05299682026710636, 'sideways_tp_mult': 2.0238216322319937, 'sideways_tsl_mult': 0.8380883262047067, 'sideways_time_stop': 93, 'sideways_use_sma': True, 'sideways_use_ema': True, 'sideways_use_atr': False, 'sideways_use_adx': True, 'sideways_use_spike': True, 'sideways_rsi_required': False}.
[I 2025-09-01 14:19:01,410] Trial 150 finished with values: [-0.10451364047202638, 0.10386907622586089] and parameters: {'p_sma': 9, 'p_std': 11, 'p_atr': 13, 'p_adx': 13, 'rsi_period': 81, 'ema1': 16, 'ema2': 10, 'slip_atr_k': 0.20282820265273788, 'slip_spread_k': 0.33915476143804885, 'spread_hl_frac': 0.04515183794998857, 'bb_std_mult': 2.646806317508916, 'rsi_os': 11, 'rsi_ob': 83, 'vol_spike': 0.10074455279030975, 'adx_thresh': 31.439235192581336, 'atr_min_pct': 0.007897820479852286, 'atr_max_pct': 0.06411027881594553, 'tp_mult': 1.9803080512355193, 'tsl_mult': 0.6356708200456097, 'strategy': 'breakout', 'time_stop': 91, 'use_sma': True, 'use_atr': False, 'use_adx': True, 'use_ema': False, 'use_spike': False, 'rsi_required': True, 'edge_k': 0.43285150257397476, 'edge_cap': 0.8886668114734126, 'bull_strategy': 'breakout', 'bull_bb_std_mult': 1.392277173858397, 'bull_rsi_os': 15, 'bull_rsi_ob': 53, 'bull_adx_thresh': 7.521803630434785, 'bull_atr_min_pct': 0.0165562857805832, 'bull_atr_max_pct': 0.03012091009534218, 'bull_tp_mult': 1.1753197609874464, 'bull_tsl_mult': 0.7319268951912556, 'bull_time_stop': 217, 'bull_use_sma': False, 'bull_use_ema': True, 'bull_use_atr': False, 'bull_use_adx': True, 'bull_use_spike': False, 'bull_rsi_required': True, 'bear_strategy': 'breakout', 'bear_bb_std_mult': 1.0768154517234045, 'bear_rsi_os': 50, 'bear_rsi_ob': 80, 'bear_adx_thresh': 34.12766785435083, 'bear_atr_min_pct': 0.002602231652557803, 'bear_atr_max_pct': 0.01986623043816327, 'bear_tp_mult': 2.3054132567219554, 'bear_tsl_mult': 0.01570806259117985, 'bear_time_stop': 240, 'bear_use_sma': False, 'bear_use_ema': False, 'bear_use_atr': False, 'bear_use_adx': False, 'bear_use_spike': True, 'bear_rsi_required': True, 'sideways_strategy': 'mean_reversion', 'sideways_bb_std_mult': 1.5317992157164655, 'sideways_rsi_os': 30, 'sideways_rsi_ob': 78, 'sideways_adx_thresh': 33.75689826953721, 'sideways_atr_min_pct': 0.01315472671324336, 'sideways_atr_max_pct': 0.01841640406384421, 'sideways_tp_mult': 2.768504735880131, 'sideways_tsl_mult': 0.3704519662144996, 'sideways_time_stop': 92, 'sideways_use_sma': True, 'sideways_use_ema': True, 'sideways_use_atr': False, 'sideways_use_adx': True, 'sideways_use_spike': True, 'sideways_rsi_required': False}.
[I 2025-09-01 14:19:01,885] Trial 152 finished with values: [-1000000000.0, 1000000000.0] and parameters: {'p_sma': 20, 'p_std': 11, 'p_atr': 13, 'p_adx': 13, 'rsi_period': 70, 'ema1': 24, 'ema2': 18, 'slip_atr_k': 0.16683134383652495, 'slip_spread_k': 0.38464197203217254, 'spread_hl_frac': 0.04418177466140955, 'bb_std_mult': 2.014667404501443, 'rsi_os': 11, 'rsi_ob': 95, 'vol_spike': 0.09939519130482496, 'adx_thresh': 17.70999560014495, 'atr_min_pct': 0.007607069670823905, 'atr_max_pct': 0.08479112868039028, 'tp_mult': 2.3000981747248055, 'tsl_mult': 0.628875156240432, 'strategy': 'breakout', 'time_stop': 91, 'use_sma': True, 'use_atr': False, 'use_adx': True, 'use_ema': False, 'use_spike': False, 'rsi_required': True, 'edge_k': 0.41084984562849514, 'edge_cap': 0.8876116753074639, 'bull_strategy': 'breakout', 'bull_bb_std_mult': 1.3707113285602315, 'bull_rsi_os': 15, 'bull_rsi_ob': 53, 'bull_adx_thresh': 5.342713697747266, 'bull_atr_min_pct': 0.004081067468893661, 'bull_atr_max_pct': 0.1339617747973811, 'bull_tp_mult': 1.177630355516257, 'bull_tsl_mult': 0.7356046735339276, 'bull_time_stop': 14, 'bull_use_sma': False, 'bull_use_ema': True, 'bull_use_atr': False, 'bull_use_adx': True, 'bull_use_spike': False, 'bull_rsi_required': False, 'bear_strategy': 'breakout', 'bear_bb_std_mult': 1.9586621809909905, 'bear_rsi_os': 36, 'bear_rsi_ob': 93, 'bear_adx_thresh': 5.780145031079551, 'bear_atr_min_pct': 0.005431909398331967, 'bear_atr_max_pct': 0.020036818184668265, 'bear_tp_mult': 2.486929739835506, 'bear_tsl_mult': 0.014234046180589821, 'bear_time_stop': 83, 'bear_use_sma': False, 'bear_use_ema': False, 'bear_use_atr': False, 'bear_use_adx': False, 'bear_use_spike': True, 'bear_rsi_required': True, 'sideways_strategy': 'mean_reversion', 'sideways_bb_std_mult': 3.3087840147754073, 'sideways_rsi_os': 30, 'sideways_rsi_ob': 78, 'sideways_adx_thresh': 30.094739686980407, 'sideways_atr_min_pct': 0.013237879414952181, 'sideways_atr_max_pct': 0.020379746447023103, 'sideways_tp_mult': 2.5932186431168054, 'sideways_tsl_mult': 0.37294134383725674, 'sideways_time_stop': 300, 'sideways_use_sma': True, 'sideways_use_ema': True, 'sideways_use_atr': False, 'sideways_use_adx': True, 'sideways_use_spike': True, 'sideways_rsi_required': False}.
