[I 2025-09-01 13:56:45,638] Trial 11 finished with values: [-1000000000.0, 1000000000.0] and parameters: {'p_sma': 30, 'p_std': 26, 'p_atr': 13, 'p_adx': 20, 'rsi_period': 11, 'ema1': 16, 'ema2': 23, 'slip_atr_k': 0.1543538425437551, 'slip_spread_k': 0.9916155023282389, 'spread_hl_frac': 0.0022270983938483036, 'bb_std_mult': 1.3975052601445643, 'rsi_os': 18, 'rsi_ob': 91, 'vol_spike': 0.22134297704921366, 'adx_thresh': 26.26410131562102, 'atr_min_pct': 0.01679065933981164, 'atr_max_pct': 0.0111169382023629, 'tp_mult': 1.1766516419376072, 'tsl_mult': 0.4479772945693483, 'strategy': 'mean_reversion', 'time_stop': 134, 'use_sma': True, 'use_atr': True, 'use_adx': True, 'use_ema': True, 'use_spike': True, 'rsi_required': False, 'edge_k': 0.22121190940235835, 'edge_cap': 0.27865393522588977, 'bull_strategy': 'mean_reversion', 'bull_bb_std_mult': 2.2027800829028514, 'bull_rsi_os': 14, 'bull_rsi_ob': 71, 'bull_adx_thresh': 18.623303816672532, 'bull_atr_min_pct': 0.028204444624129958, 'bull_atr_max_pct': 0.12313251023101927, 'bull_tp_mult': 2.832200707745135, 'bull_tsl_mult': 0.44256699595879256, 'bull_time_stop': 205, 'bull_use_sma': True, 'bull_use_ema': False, 'bull_use_atr': False, 'bull_use_adx': False, 'bull_use_spike': True, 'bull_rsi_required': False, 'bear_strategy': 'mean_reversion', 'bear_bb_std_mult': 1.1532793875746812, 'bear_rsi_os': 49, 'bear_rsi_ob': 75, 'bear_adx_thresh': 9.35269132110018, 'bear_atr_min_pct': 0.02611868606765455, 'bear_atr_max_pct': 0.01115357192032459, 'bear_tp_mult': 2.233384049120875, 'bear_tsl_mult': 0.47060640826100286, 'bear_time_stop': 134, 'bear_use_sma': True, 'bear_use_ema': True, 'bear_use_atr': False, 'bear_use_adx': True, 'bear_use_spike': False, 'bear_rsi_required': False, 'sideways_strategy': 'mean_reversion', 'sideways_bb_std_mult': 2.3639390395627724, 'sideways_rsi_os': 29, 'sideways_rsi_ob': 79, 'sideways_adx_thresh': 18.819341938869496, 'sideways_atr_min_pct': 0.021501389797424712, 'sideways_atr_max_pct': 0.08279742818792817, 'sideways_tp_mult': 1.167772203429639, 'sideways_tsl_mult': 0.6203075075421535, 'sideways_time_stop': 162, 'sideways_use_sma': True, 'sideways_use_ema': False, 'sideways_use_atr': False, 'sideways_use_adx': False, 'sideways_use_spike': False, 'sideways_rsi_required': True}.
[I 2025-09-01 13:56:46,514] Trial 10 finished with values: [-1000000000.0, 1000000000.0] and parameters: {'p_sma': 58, 'p_std': 59, 'p_atr': 21, 'p_adx': 8, 'rsi_period': 47, 'ema1': 12, 'ema2': 33, 'slip_atr_k': 0.01733645598719541, 'slip_spread_k': 0.710257535214209, 'spread_hl_frac': 0.03080158376281718, 'bb_std_mult': 3.2529293443638925, 'rsi_os': 13, 'rsi_ob': 64, 'vol_spike': 0.2213639826219527, 'adx_thresh': 26.518880736704304, 'atr_min_pct': 0.013560881130608654, 'atr_max_pct': 0.06908619840024469, 'tp_mult': 1.2167198429552852, 'tsl_mult': 0.9059300025154182, 'strategy': 'breakout', 'time_stop': 139, 'use_sma': False, 'use_atr': False, 'use_adx': True, 'use_ema': True, 'use_spike': False, 'rsi_required': False, 'edge_k': 1.6817078218939996, 'edge_cap': 0.18505688325832828, 'bull_strategy': 'mean_reversion', 'bull_bb_std_mult': 2.2389881757509658, 'bull_rsi_os': 13, 'bull_rsi_ob': 81, 'bull_adx_thresh': 16.29603084172497, 'bull_atr_min_pct': 0.005746141883736633, 'bull_atr_max_pct': 0.11211325965221113, 'bull_tp_mult': 2.7889675640368776, 'bull_tsl_mult': 0.988274321635764, 'bull_time_stop': 237, 'bull_use_sma': False, 'bull_use_ema': True, 'bull_use_atr': False, 'bull_use_adx': False, 'bull_use_spike': True, 'bull_rsi_required': False, 'bear_strategy': 'breakout', 'bear_bb_std_mult': 2.02179863281063, 'bear_rsi_os': 9, 'bear_rsi_ob': 93, 'bear_adx_thresh': 7.540142746207991, 'bear_atr_min_pct': 0.014327302028764331, 'bear_atr_max_pct': 0.1461615918425047, 'bear_tp_mult': 1.4460156152080343, 'bear_tsl_mult': 0.3147898365760541, 'bear_time_stop': 210, 'bear_use_sma': True, 'bear_use_ema': True, 'bear_use_atr': True, 'bear_use_adx': False, 'bear_use_spike': False, 'bear_rsi_required': False, 'sideways_strategy': 'breakout', 'sideways_bb_std_mult': 3.153353088864517, 'sideways_rsi_os': 24, 'sideways_rsi_ob': 93, 'sideways_adx_thresh': 27.531110616600984, 'sideways_atr_min_pct': 0.008966292217303056, 'sideways_atr_max_pct': 0.07129042942574638, 'sideways_tp_mult': 1.7874288157165608, 'sideways_tsl_mult': 0.6919277631007738, 'sideways_time_stop': 26, 'sideways_use_sma': False, 'sideways_use_ema': False, 'sideways_use_atr': True, 'sideways_use_adx': True, 'sideways_use_spike': False, 'sideways_rsi_required': True}.
[I 2025-09-01 13:56:46,834] Trial 8 finished with values: [-1000000000.0, 1000000000.0] and parameters: {'p_sma': 47, 'p_std': 41, 'p_atr': 14, 'p_adx': 26, 'rsi_period': 64, 'ema1': 21, 'ema2': 46, 'slip_atr_k': 0.02124538770912804, 'slip_spread_k': 0.8358836529043475, 'spread_hl_frac': 0.007649587492605675, 'bb_std_mult': 2.2980060428793405, 'rsi_os': 39, 'rsi_ob': 48, 'vol_spike': 0.14732982123088065, 'adx_thresh': 15.730373525693427, 'atr_min_pct': 0.0146357647731954, 'atr_max_pct': 0.10464183453577862, 'tp_mult': 2.8703012735835634, 'tsl_mult': 0.9952684835073329, 'strategy': 'breakout', 'time_stop': 203, 'use_sma': False, 'use_atr': True, 'use_adx': False, 'use_ema': True, 'use_spike': True, 'rsi_required': False, 'edge_k': 0.07705297342492723, 'edge_cap': 0.2637027570507854, 'bull_strategy': 'breakout', 'bull_bb_std_mult': 0.6028649617125991, 'bull_rsi_os': 37, 'bull_rsi_ob': 84, 'bull_adx_thresh': 21.825878256737614, 'bull_atr_min_pct': 0.023395111751780696, 'bull_atr_max_pct': 0.05539411670666316, 'bull_tp_mult': 1.5615516243184342, 'bull_tsl_mult': 0.763851412013834, 'bull_time_stop': 114, 'bull_use_sma': False, 'bull_use_ema': True, 'bull_use_atr': False, 'bull_use_adx': True, 'bull_use_spike': False, 'bull_rsi_required': False, 'bear_strategy': 'mean_reversion', 'bear_bb_std_mult': 1.4179152443045746, 'bear_rsi_os': 15, 'bear_rsi_ob': 62, 'bear_adx_thresh': 25.916279467477718, 'bear_atr_min_pct': 0.020032746991573577, 'bear_atr_max_pct': 0.10670394327127955, 'bear_tp_mult': 1.1410475886692506, 'bear_tsl_mult': 0.5677439209466727, 'bear_time_stop': 181, 'bear_use_sma': False, 'bear_use_ema': False, 'bear_use_atr': True, 'bear_use_adx': False, 'bear_use_spike': True, 'bear_rsi_required': False, 'sideways_strategy': 'breakout', 'sideways_bb_std_mult': 3.3457235941763073, 'sideways_rsi_os': 37, 'sideways_rsi_ob': 75, 'sideways_adx_thresh': 6.264122099112565, 'sideways_atr_min_pct': 0.020580979308859795, 'sideways_atr_max_pct': 0.05269883517084511, 'sideways_tp_mult': 2.2213915040973182, 'sideways_tsl_mult': 0.1165368362293312, 'sideways_time_stop': 177, 'sideways_use_sma': False, 'sideways_use_ema': True, 'sideways_use_atr': True, 'sideways_use_adx': True, 'sideways_use_spike': True, 'sideways_rsi_required': False}.
[I 2025-09-01 13:57:25,889] Trial 13 finished with values: [-1000000000.0, 1000000000.0] and parameters: {'p_sma': 5, 'p_std': 9, 'p_atr': 30, 'p_adx': 21, 'rsi_period': 83, 'ema1': 30, 'ema2': 29, 'slip_atr_k': 0.006002206260950785, 'slip_spread_k': 0.004044360917072387, 'spread_hl_frac': 0.049608927992123075, 'bb_std_mult': 1.9191307757749911, 'rsi_os': 39, 'rsi_ob': 62, 'vol_spike': 0.11417270557019768, 'adx_thresh': 5.508944925775415, 'atr_min_pct': 0.000754231285899451, 'atr_max_pct': 0.043122916737572584, 'tp_mult': 2.2216443370486187, 'tsl_mult': 0.9326685384661733, 'strategy': 'breakout', 'time_stop': 293, 'use_sma': True, 'use_atr': False, 'use_adx': False, 'use_ema': False, 'use_spike': False, 'rsi_required': True, 'edge_k': 1.3264117347389957, 'edge_cap': 0.9797685495597129, 'bull_strategy': 'breakout', 'bull_bb_std_mult': 3.080237258021851, 'bull_rsi_os': 5, 'bull_rsi_ob': 46, 'bull_adx_thresh': 26.373665879962207, 'bull_atr_min_pct': 0.0007491477529343229, 'bull_atr_max_pct': 0.09631729209997689, 'bull_tp_mult': 1.773967563146174, 'bull_tsl_mult': 0.6625045772077518, 'bull_time_stop': 163, 'bull_use_sma': False, 'bull_use_ema': True, 'bull_use_atr': False, 'bull_use_adx': True, 'bull_use_spike': False, 'bull_rsi_required': True, 'bear_strategy': 'breakout', 'bear_bb_std_mult': 0.5063157287038116, 'bear_rsi_os': 55, 'bear_rsi_ob': 64, 'bear_adx_thresh': 33.362695087404305, 'bear_atr_min_pct': 0.011032152601588116, 'bear_atr_max_pct': 0.08013025198458959, 'bear_tp_mult': 1.546808573912386, 'bear_tsl_mult': 0.9685139349389088, 'bear_time_stop': 190, 'bear_use_sma': False, 'bear_use_ema': True, 'bear_use_atr': False, 'bear_use_adx': True, 'bear_use_spike': False, 'bear_rsi_required': True, 'sideways_strategy': 'breakout', 'sideways_bb_std_mult': 3.016405887322656, 'sideways_rsi_os': 55, 'sideways_rsi_ob': 60, 'sideways_adx_thresh': 34.9801134278439, 'sideways_atr_min_pct': 0.01701161356946162, 'sideways_atr_max_pct': 0.05397059886297445, 'sideways_tp_mult': 2.353328257359874, 'sideways_tsl_mult': 0.015903317537254158, 'sideways_time_stop': 295, 'sideways_use_sma': False, 'sideways_use_ema': True, 'sideways_use_atr': False, 'sideways_use_adx': True, 'sideways_use_spike': True, 'sideways_rsi_required': False}.
[I 2025-09-01 13:57:26,176] Trial 15 finished with values: [-1000000000.0, 1000000000.0] and parameters: {'p_sma': 8, 'p_std': 7, 'p_atr': 30, 'p_adx': 30, 'rsi_period': 78, 'ema1': 29, 'ema2': 24, 'slip_atr_k': 0.07680800409542865, 'slip_spread_k': 0.01053292556577723, 'spread_hl_frac': 0.0475637226059293, 'bb_std_mult': 1.6121540423965772, 'rsi_os': 5, 'rsi_ob': 64, 'vol_spike': 0.0035790616109389606, 'adx_thresh': 5.697756368545047, 'atr_min_pct': 0.00014935711297941502, 'atr_max_pct': 0.14523526086931787, 'tp_mult': 2.0697827012796073, 'tsl_mult': 0.2446045523461971, 'strategy': 'breakout', 'time_stop': 286, 'use_sma': True, 'use_atr': False, 'use_adx': False, 'use_ema': False, 'use_spike': False, 'rsi_required': True, 'edge_k': 1.2855789739856904, 'edge_cap': 0.9818548093869304, 'bull_strategy': 'breakout', 'bull_bb_std_mult': 3.3802380652115778, 'bull_rsi_os': 53, 'bull_rsi_ob': 46, 'bull_adx_thresh': 34.447825059831196, 'bull_atr_min_pct': 7.849558144744709e-06, 'bull_atr_max_pct': 0.0955548553960157, 'bull_tp_mult': 1.7783533151834459, 'bull_tsl_mult': 0.643747144244987, 'bull_time_stop': 170, 'bull_use_sma': False, 'bull_use_ema': True, 'bull_use_atr': False, 'bull_use_adx': True, 'bull_use_spike': False, 'bull_rsi_required': True, 'bear_strategy': 'breakout', 'bear_bb_std_mult': 3.5492099709206313, 'bear_rsi_os': 38, 'bear_rsi_ob': 86, 'bear_adx_thresh': 16.50515976728142, 'bear_atr_min_pct': 0.010174926436663215, 'bear_atr_max_pct': 0.016328035342895272, 'bear_tp_mult': 1.5642797486801951, 'bear_tsl_mult': 0.9923891064863107, 'bear_time_stop': 222, 'bear_use_sma': False, 'bear_use_ema': True, 'bear_use_atr': False, 'bear_use_adx': False, 'bear_use_spike': False, 'bear_rsi_required': True, 'sideways_strategy': 'breakout', 'sideways_bb_std_mult': 0.5568634665405889, 'sideways_rsi_os': 51, 'sideways_rsi_ob': 86, 'sideways_adx_thresh': 34.93191859210456, 'sideways_atr_min_pct': 0.015773246584184334, 'sideways_atr_max_pct': 0.011065549323157994, 'sideways_tp_mult': 2.2381702265727434, 'sideways_tsl_mult': 0.9519477256427694, 'sideways_time_stop': 299, 'sideways_use_sma': True, 'sideways_use_ema': True, 'sideways_use_atr': False, 'sideways_use_adx': True, 'sideways_use_spike': True, 'sideways_rsi_required': False}.
[I 2025-09-01 13:57:26,610] Trial 14 finished with values: [-0.03246651735119943, 0.032363125487705736] and parameters: {'p_sma': 6, 'p_std': 5, 'p_atr': 30, 'p_adx': 30, 'rsi_period': 84, 'ema1': 28, 'ema2': 49, 'slip_atr_k': 0.0794743476645667, 'slip_spread_k': 0.01621726600638862, 'spread_hl_frac': 0.048350789516472995, 'bb_std_mult': 2.2864846979576754, 'rsi_os': 40, 'rsi_ob': 95, 'vol_spike': 0.111117122839776, 'adx_thresh': 5.199847813030759, 'atr_min_pct': 0.0016359823976735636, 'atr_max_pct': 0.1448830786560188, 'tp_mult': 2.0453110813985282, 'tsl_mult': 0.8523673141886375, 'strategy': 'breakout', 'time_stop': 5, 'use_sma': False, 'use_atr': False, 'use_adx': False, 'use_ema': False, 'use_spike': False, 'rsi_required': True, 'edge_k': 1.2747879740030432, 'edge_cap': 0.9707420825605787, 'bull_strategy': 'breakout', 'bull_bb_std_mult': 0.5528776600678633, 'bull_rsi_os': 55, 'bull_rsi_ob': 47, 'bull_adx_thresh': 34.762782133575655, 'bull_atr_min_pct': 0.0008971670514273233, 'bull_atr_max_pct': 0.08741858656389913, 'bull_tp_mult': 1.7849642790785962, 'bull_tsl_mult': 0.6768545293646819, 'bull_time_stop': 169, 'bull_use_sma': False, 'bull_use_ema': True, 'bull_use_atr': False, 'bull_use_adx': True, 'bull_use_spike': False, 'bull_rsi_required': True, 'bear_strategy': 'breakout', 'bear_bb_std_mult': 0.6757158277650686, 'bear_rsi_os': 38, 'bear_rsi_ob': 64, 'bear_adx_thresh': 34.27518007224997, 'bear_atr_min_pct': 0.0002737536811279438, 'bear_atr_max_pct': 0.010473458367613625, 'bear_tp_mult': 1.6263831763000667, 'bear_tsl_mult': 0.9608450527817503, 'bear_time_stop': 202, 'bear_use_sma': False, 'bear_use_ema': True, 'bear_use_atr': False, 'bear_use_adx': False, 'bear_use_spike': True, 'bear_rsi_required': True, 'sideways_strategy': 'breakout', 'sideways_bb_std_mult': 0.5363162766119565, 'sideways_rsi_os': 54, 'sideways_rsi_ob': 77, 'sideways_adx_thresh': 34.597901840943116, 'sideways_atr_min_pct': 0.017647251472825483, 'sideways_atr_max_pct': 0.01565068128597462, 'sideways_tp_mult': 2.2873597796957847, 'sideways_tsl_mult': 0.9868760276332185, 'sideways_time_stop': 246, 'sideways_use_sma': False, 'sideways_use_ema': True, 'sideways_use_atr': False, 'sideways_use_adx': True, 'sideways_use_spike': True, 'sideways_rsi_required': False}.
[I 2025-09-01 13:57:26,842] Trial 12 finished with values: [-1000000000.0, 1000000000.0] and parameters: {'p_sma': 5, 'p_std': 9, 'p_atr': 27, 'p_adx': 29, 'rsi_period': 83, 'ema1': 30, 'ema2': 31, 'slip_atr_k': 0.006257093895735977, 'slip_spread_k': 0.10229361334484038, 'spread_hl_frac': 0.04734404703803914, 'bb_std_mult': 1.8850530439683328, 'rsi_os': 5, 'rsi_ob': 63, 'vol_spike': 0.11726938326633374, 'adx_thresh': 5.852192319174374, 'atr_min_pct': 0.00022623908795742567, 'atr_max_pct': 0.04520300202862874, 'tp_mult': 2.2032092159829526, 'tsl_mult': 0.9827022960819393, 'strategy': 'breakout', 'time_stop': 298, 'use_sma': True, 'use_atr': False, 'use_adx': False, 'use_ema': False, 'use_spike': False, 'rsi_required': True, 'edge_k': 1.4034230564067707, 'edge_cap': 0.06024759132151436, 'bull_strategy': 'breakout', 'bull_bb_std_mult': 3.0384891708618293, 'bull_rsi_os': 5, 'bull_rsi_ob': 45, 'bull_adx_thresh': 34.26587813468426, 'bull_atr_min_pct': 0.0011042801573388147, 'bull_atr_max_pct': 0.09533266960216917, 'bull_tp_mult': 1.8510006032238964, 'bull_tsl_mult': 0.6675360215669595, 'bull_time_stop': 157, 'bull_use_sma': False, 'bull_use_ema': True, 'bull_use_atr': False, 'bull_use_adx': True, 'bull_use_spike': False, 'bull_rsi_required': True, 'bear_strategy': 'breakout', 'bear_bb_std_mult': 0.5369260048907198, 'bear_rsi_os': 39, 'bear_rsi_ob': 64, 'bear_adx_thresh': 34.36648104499851, 'bear_atr_min_pct': 0.011213637216828257, 'bear_atr_max_pct': 0.08253351270885116, 'bear_tp_mult': 1.561863807456033, 'bear_tsl_mult': 0.9950713004945357, 'bear_time_stop': 211, 'bear_use_sma': False, 'bear_use_ema': True, 'bear_use_atr': False, 'bear_use_adx': True, 'bear_use_spike': False, 'bear_rsi_required': True, 'sideways_strategy': 'breakout', 'sideways_bb_std_mult': 3.009296106387868, 'sideways_rsi_os': 52, 'sideways_rsi_ob': 61, 'sideways_adx_thresh': 34.455977520646286, 'sideways_atr_min_pct': 0.029983644709295567, 'sideways_atr_max_pct': 0.055763052658495446, 'sideways_tp_mult': 2.3005362013753605, 'sideways_tsl_mult': 0.9329420021633636, 'sideways_time_stop': 300, 'sideways_use_sma': False, 'sideways_use_ema': True, 'sideways_use_atr': False, 'sideways_use_adx': True, 'sideways_use_spike': True, 'sideways_rsi_required': False}.
[I 2025-09-01 13:58:03,390] Trial 17 finished with values: [-1000000000.0, 1000000000.0] and parameters: {'p_sma': 56, 'p_std': 24, 'p_atr': 26, 'p_adx': 15, 'rsi_period': 61, 'ema1': 6, 'ema2': 50, 'slip_atr_k': 0.24718198588551837, 'slip_spread_k': 0.2989177992413996, 'spread_hl_frac': 0.03777014720866017, 'bb_std_mult': 1.0551174397168686, 'rsi_os': 34, 'rsi_ob': 93, 'vol_spike': 0.08218083395598763, 'adx_thresh': 9.895030227847014, 'atr_min_pct': 0.026624167306175145, 'atr_max_pct': 0.1472439352723992, 'tp_mult': 1.732692566129597, 'tsl_mult': 0.7950449826667566, 'strategy': 'mean_reversion', 'time_stop': 20, 'use_sma': False, 'use_atr': False, 'use_adx': False, 'use_ema': False, 'use_spike': True, 'rsi_required': True, 'edge_k': 0.536456032110959, 'edge_cap': 0.08493467654236891, 'bull_strategy': 'mean_reversion', 'bull_bb_std_mult': 2.7836539415692636, 'bull_rsi_os': 23, 'bull_rsi_ob': 56, 'bull_adx_thresh': 5.773623382169651, 'bull_atr_min_pct': 0.018127986180410057, 'bull_atr_max_pct': 0.1451991381243871, 'bull_tp_mult': 2.3047442274548113, 'bull_tsl_mult': 0.511593655352565, 'bull_time_stop': 5, 'bull_use_sma': True, 'bull_use_ema': False, 'bull_use_atr': True, 'bull_use_adx': True, 'bull_use_spike': False, 'bull_rsi_required': True, 'bear_strategy': 'mean_reversion', 'bear_bb_std_mult': 2.879620003021138, 'bear_rsi_os': 5, 'bear_rsi_ob': 70, 'bear_adx_thresh': 12.701025760791211, 'bear_atr_min_pct': 0.00030976746398342185, 'bear_atr_max_pct': 0.03797359795127743, 'bear_tp_mult': 2.9643382124714517, 'bear_tsl_mult': 0.7598109583002073, 'bear_time_stop': 9, 'bear_use_sma': True, 'bear_use_ema': False, 'bear_use_atr': False, 'bear_use_adx': False, 'bear_use_spike': True, 'bear_rsi_required': True, 'sideways_strategy': 'mean_reversion', 'sideways_bb_std_mult': 0.7769313309608341, 'sideways_rsi_os': 45, 'sideways_rsi_ob': 47, 'sideways_adx_thresh': 15.74035869756409, 'sideways_atr_min_pct': 0.02964492848857982, 'sideways_atr_max_pct': 0.1411047161779099, 'sideways_tp_mult': 1.8131020635865531, 'sideways_tsl_mult': 0.9986896998054151, 'sideways_time_stop': 5, 'sideways_use_sma': True, 'sideways_use_ema': True, 'sideways_use_atr': True, 'sideways_use_adx': False, 'sideways_use_spike': True, 'sideways_rsi_required': True}.
[I 2025-09-01 13:58:03,989] Trial 19 finished with values: [-1000000000.0, 1000000000.0] and parameters: {'p_sma': 13, 'p_std': 18, 'p_atr': 26, 'p_adx': 23, 'rsi_period': 60, 'ema1': 27, 'ema2': 49, 'slip_atr_k': 0.08232328052026248, 'slip_spread_k': 0.2785882260775832, 'spread_hl_frac': 0.038131111554470624, 'bb_std_mult': 2.3913325314397516, 'rsi_os': 38, 'rsi_ob': 95, 'vol_spike': 0.07234523036142565, 'adx_thresh': 10.018625978356066, 'atr_min_pct': 0.024386334769610864, 'atr_max_pct': 0.12172001569745518, 'tp_mult': 1.7481558518562266, 'tsl_mult': 0.7834350076801129, 'strategy': 'breakout', 'time_stop': 19, 'use_sma': False, 'use_atr': False, 'use_adx': False, 'use_ema': False, 'use_spike': False, 'rsi_required': True, 'edge_k': 0.5487185058418128, 'edge_cap': 0.8761300619087109, 'bull_strategy': 'breakout', 'bull_bb_std_mult': 0.5343588202164187, 'bull_rsi_os': 30, 'bull_rsi_ob': 54, 'bull_adx_thresh': 5.773020914628129, 'bull_atr_min_pct': 0.005097818288574951, 'bull_atr_max_pct': 0.07857414999551665, 'bull_tp_mult': 2.2210320912655517, 'bull_tsl_mult': 0.5332382297430288, 'bull_time_stop': 199, 'bull_use_sma': False, 'bull_use_ema': True, 'bull_use_atr': False, 'bull_use_adx': True, 'bull_use_spike': False, 'bull_rsi_required': True, 'bear_strategy': 'breakout', 'bear_bb_std_mult': 0.8784258091395896, 'bear_rsi_os': 33, 'bear_rsi_ob': 70, 'bear_adx_thresh': 29.73630524522877, 'bear_atr_min_pct': 0.0007726922023515631, 'bear_atr_max_pct': 0.037629640409213044, 'bear_tp_mult': 1.798062438110483, 'bear_tsl_mult': 0.8050588513255903, 'bear_time_stop': 251, 'bear_use_sma': False, 'bear_use_ema': True, 'bear_use_atr': False, 'bear_use_adx': False, 'bear_use_spike': True, 'bear_rsi_required': True, 'sideways_strategy': 'breakout', 'sideways_bb_std_mult': 1.029457209855103, 'sideways_rsi_os': 45, 'sideways_rsi_ob': 72, 'sideways_adx_thresh': 30.21588223022097, 'sideways_atr_min_pct': 0.01272450589357616, 'sideways_atr_max_pct': 0.011440037184697086, 'sideways_tp_mult': 1.909957630291676, 'sideways_tsl_mult': 0.837591379181907, 'sideways_time_stop': 229, 'sideways_use_sma': False, 'sideways_use_ema': True, 'sideways_use_atr': False, 'sideways_use_adx': True, 'sideways_use_spike': True, 'sideways_rsi_required': False}.
