[I 2025-09-01 14:42:38,060] Trial 307 finished with values: [-1000000000.0, 1000000000.0] and parameters: {'p_sma': 35, 'p_std': 12, 'p_atr': 13, 'p_adx': 11, 'rsi_period': 39, 'ema1': 29, 'ema2': 25, 'slip_atr_k': 0.032524785663641906, 'slip_spread_k': 0.09998518643293663, 'spread_hl_frac': 0.04257672724266621, 'bb_std_mult': 1.715725163072125, 'rsi_os': 55, 'rsi_ob': 85, 'vol_spike': 3.2974322981998636e-05, 'adx_thresh': 25.688620692650154, 'atr_min_pct': 0.008244488270140972, 'atr_max_pct': 0.08569060312336127, 'tp_mult': 2.2839624430502523, 'tsl_mult': 0.3934778702699988, 'strategy': 'mean_reversion', 'time_stop': 294, 'use_sma': False, 'use_atr': False, 'use_adx': False, 'use_ema': False, 'use_spike': False, 'rsi_required': True, 'edge_k': 0.6187514261232366, 'edge_cap': 0.9798807917711212, 'bull_strategy': 'breakout', 'bull_bb_std_mult': 1.4180242084416466, 'bull_rsi_os': 21, 'bull_rsi_ob': 60, 'bull_adx_thresh': 10.325825103278454, 'bull_atr_min_pct': 0.005027929449390087, 'bull_atr_max_pct': 0.0313305765562324, 'bull_tp_mult': 1.5223907818605973, 'bull_tsl_mult': 0.9836773554175096, 'bull_time_stop': 11, 'bull_use_sma': False, 'bull_use_ema': True, 'bull_use_atr': True, 'bull_use_adx': True, 'bull_use_spike': False, 'bull_rsi_required': True, 'bear_strategy': 'breakout', 'bear_bb_std_mult': 1.1559177695486769, 'bear_rsi_os': 37, 'bear_rsi_ob': 58, 'bear_adx_thresh': 6.913248268419286, 'bear_atr_min_pct': 0.00516076381306815, 'bear_atr_max_pct': 0.014721463677202912, 'bear_tp_mult': 1.6911456302062102, 'bear_tsl_mult': 0.6345836596968906, 'bear_time_stop': 250, 'bear_use_sma': False, 'bear_use_ema': True, 'bear_use_atr': False, 'bear_use_adx': False, 'bear_use_spike': False, 'bear_rsi_required': True, 'sideways_strategy': 'breakout', 'sideways_bb_std_mult': 1.4590721689060808, 'sideways_rsi_os': 32, 'sideways_rsi_ob': 82, 'sideways_adx_thresh': 33.960586617396515, 'sideways_atr_min_pct': 0.012777495400101516, 'sideways_atr_max_pct': 0.04586910469817992, 'sideways_tp_mult': 2.029123902639696, 'sideways_tsl_mult': 0.9091789683985281, 'sideways_time_stop': 12, 'sideways_use_sma': True, 'sideways_use_ema': False, 'sideways_use_atr': True, 'sideways_use_adx': True, 'sideways_use_spike': False, 'sideways_rsi_required': True}.
[I 2025-09-01 14:43:03,713] Trial 303 finished with values: [-1000000000.0, 1000000000.0] and parameters: {'p_sma': 35, 'p_std': 33, 'p_atr': 11, 'p_adx': 19, 'rsi_period': 61, 'ema1': 28, 'ema2': 55, 'slip_atr_k': 0.08414783282114299, 'slip_spread_k': 0.7778407356599244, 'spread_hl_frac': 0.04113049495828148, 'bb_std_mult': 1.6829912368212256, 'rsi_os': 9, 'rsi_ob': 79, 'vol_spike': 0.00012833366707046268, 'adx_thresh': 7.27349102249104, 'atr_min_pct': 0.01900921003672348, 'atr_max_pct': 0.058846607306599026, 'tp_mult': 2.37386897892094, 'tsl_mult': 0.43384265856529264, 'strategy': 'breakout', 'time_stop': 229, 'use_sma': False, 'use_atr': True, 'use_adx': False, 'use_ema': False, 'use_spike': True, 'rsi_required': True, 'edge_k': 0.6204587305386873, 'edge_cap': 0.9612987562421504, 'bull_strategy': 'breakout', 'bull_bb_std_mult': 0.5093125194117641, 'bull_rsi_os': 53, 'bull_rsi_ob': 55, 'bull_adx_thresh': 13.217180328357795, 'bull_atr_min_pct': 0.004551096989432002, 'bull_atr_max_pct': 0.1286681995590377, 'bull_tp_mult': 1.0450997526768488, 'bull_tsl_mult': 0.19960308598519866, 'bull_time_stop': 35, 'bull_use_sma': False, 'bull_use_ema': False, 'bull_use_atr': False, 'bull_use_adx': True, 'bull_use_spike': False, 'bull_rsi_required': True, 'bear_strategy': 'breakout', 'bear_bb_std_mult': 2.9284375187450076, 'bear_rsi_os': 14, 'bear_rsi_ob': 46, 'bear_adx_thresh': 23.907619196399956, 'bear_atr_min_pct': 0.008007426485944139, 'bear_atr_max_pct': 0.05588219723098725, 'bear_tp_mult': 1.7172367924466867, 'bear_tsl_mult': 0.05570376126201465, 'bear_time_stop': 240, 'bear_use_sma': True, 'bear_use_ema': True, 'bear_use_atr': False, 'bear_use_adx': False, 'bear_use_spike': False, 'bear_rsi_required': True, 'sideways_strategy': 'breakout', 'sideways_bb_std_mult': 1.2833750080453101, 'sideways_rsi_os': 12, 'sideways_rsi_ob': 78, 'sideways_adx_thresh': 7.823829613622721, 'sideways_atr_min_pct': 0.0066625104346948235, 'sideways_atr_max_pct': 0.042477677463266424, 'sideways_tp_mult': 2.65842766337378, 'sideways_tsl_mult': 0.919242668398006, 'sideways_time_stop': 90, 'sideways_use_sma': True, 'sideways_use_ema': True, 'sideways_use_atr': True, 'sideways_use_adx': True, 'sideways_use_spike': False, 'sideways_rsi_required': True}.
[I 2025-09-01 14:43:10,416] Trial 308 finished with values: [-1000000000.0, 1000000000.0] and parameters: {'p_sma': 29, 'p_std': 16, 'p_atr': 8, 'p_adx': 11, 'rsi_period': 67, 'ema1': 29, 'ema2': 40, 'slip_atr_k': 0.05358428622417806, 'slip_spread_k': 0.10571959125188646, 'spread_hl_frac': 0.04188591266269652, 'bb_std_mult': 0.5040670045903717, 'rsi_os': 6, 'rsi_ob': 75, 'vol_spike': 0.002989413584180506, 'adx_thresh': 28.961438189620456, 'atr_min_pct': 0.01905145141011863, 'atr_max_pct': 0.07401609652599475, 'tp_mult': 1.1226460281946882, 'tsl_mult': 0.13532323219299264, 'strategy': 'breakout', 'time_stop': 89, 'use_sma': True, 'use_atr': False, 'use_adx': False, 'use_ema': False, 'use_spike': False, 'rsi_required': True, 'edge_k': 0.6262288607097213, 'edge_cap': 0.9833383579044999, 'bull_strategy': 'breakout', 'bull_bb_std_mult': 1.4605791256640486, 'bull_rsi_os': 49, 'bull_rsi_ob': 60, 'bull_adx_thresh': 8.256623331886328, 'bull_atr_min_pct': 0.01985932555078199, 'bull_atr_max_pct': 0.04187724656666183, 'bull_tp_mult': 2.2563734963154696, 'bull_tsl_mult': 0.9616355609663374, 'bull_time_stop': 11, 'bull_use_sma': False, 'bull_use_ema': True, 'bull_use_atr': False, 'bull_use_adx': True, 'bull_use_spike': False, 'bull_rsi_required': True, 'bear_strategy': 'breakout', 'bear_bb_std_mult': 2.6028891973110566, 'bear_rsi_os': 37, 'bear_rsi_ob': 92, 'bear_adx_thresh': 5.0605975708044, 'bear_atr_min_pct': 0.00502361761622606, 'bear_atr_max_pct': 0.020072467661271833, 'bear_tp_mult': 1.683427773871384, 'bear_tsl_mult': 0.9878550394516596, 'bear_time_stop': 251, 'bear_use_sma': False, 'bear_use_ema': True, 'bear_use_atr': False, 'bear_use_adx': False, 'bear_use_spike': False, 'bear_rsi_required': True, 'sideways_strategy': 'breakout', 'sideways_bb_std_mult': 3.121047679540376, 'sideways_rsi_os': 32, 'sideways_rsi_ob': 77, 'sideways_adx_thresh': 34.306050937555064, 'sideways_atr_min_pct': 0.017574656681410863, 'sideways_atr_max_pct': 0.03874956822179795, 'sideways_tp_mult': 1.125196384153484, 'sideways_tsl_mult': 0.5733586276873556, 'sideways_time_stop': 71, 'sideways_use_sma': True, 'sideways_use_ema': True, 'sideways_use_atr': False, 'sideways_use_adx': True, 'sideways_use_spike': False, 'sideways_rsi_required': False}.
[I 2025-09-01 14:43:11,034] Trial 309 finished with values: [-0.06617781826531843, 0.06590597886373079] and parameters: {'p_sma': 25, 'p_std': 10, 'p_atr': 12, 'p_adx': 17, 'rsi_period': 31, 'ema1': 29, 'ema2': 40, 'slip_atr_k': 0.2026113690721541, 'slip_spread_k': 0.7895095669579357, 'spread_hl_frac': 0.045960774653975245, 'bb_std_mult': 1.6959167739554113, 'rsi_os': 22, 'rsi_ob': 80, 'vol_spike': 0.00482429099508559, 'adx_thresh': 15.165420124545397, 'atr_min_pct': 9.464463049755137e-05, 'atr_max_pct': 0.032533457054634375, 'tp_mult': 1.7749946734588196, 'tsl_mult': 0.1584464370512328, 'strategy': 'breakout', 'time_stop': 293, 'use_sma': False, 'use_atr': False, 'use_adx': False, 'use_ema': False, 'use_spike': False, 'rsi_required': True, 'edge_k': 0.6230891178270916, 'edge_cap': 0.9827458717039727, 'bull_strategy': 'breakout', 'bull_bb_std_mult': 0.9149813291630995, 'bull_rsi_os': 41, 'bull_rsi_ob': 60, 'bull_adx_thresh': 34.98986071983641, 'bull_atr_min_pct': 0.003071871945545107, 'bull_atr_max_pct': 0.04411686235753047, 'bull_tp_mult': 2.26046621917673, 'bull_tsl_mult': 0.8909443223952656, 'bull_time_stop': 22, 'bull_use_sma': False, 'bull_use_ema': True, 'bull_use_atr': False, 'bull_use_adx': True, 'bull_use_spike': False, 'bull_rsi_required': True, 'bear_strategy': 'breakout', 'bear_bb_std_mult': 3.296106389290487, 'bear_rsi_os': 37, 'bear_rsi_ob': 47, 'bear_adx_thresh': 5.025395565455207, 'bear_atr_min_pct': 0.004370590599576072, 'bear_atr_max_pct': 0.02159276504073983, 'bear_tp_mult': 1.8415136974263204, 'bear_tsl_mult': 0.737701461617433, 'bear_time_stop': 217, 'bear_use_sma': False, 'bear_use_ema': True, 'bear_use_atr': False, 'bear_use_adx': False, 'bear_use_spike': False, 'bear_rsi_required': True, 'sideways_strategy': 'mean_reversion', 'sideways_bb_std_mult': 1.121655351538359, 'sideways_rsi_os': 26, 'sideways_rsi_ob': 54, 'sideways_adx_thresh': 33.41707534678096, 'sideways_atr_min_pct': 0.014736840177905636, 'sideways_atr_max_pct': 0.10708959729786922, 'sideways_tp_mult': 2.6121709232417505, 'sideways_tsl_mult': 0.8599884887192643, 'sideways_time_stop': 72, 'sideways_use_sma': True, 'sideways_use_ema': True, 'sideways_use_atr': False, 'sideways_use_adx': True, 'sideways_use_spike': True, 'sideways_rsi_required': False}.
[I 2025-09-01 14:43:13,704] Trial 310 finished with values: [-0.041182841972173034, 0.041319869479896174] and parameters: {'p_sma': 25, 'p_std': 10, 'p_atr': 25, 'p_adx': 13, 'rsi_period': 22, 'ema1': 27, 'ema2': 38, 'slip_atr_k': 0.16282699939441153, 'slip_spread_k': 0.6595431594697919, 'spread_hl_frac': 0.046027439476315934, 'bb_std_mult': 1.9530388262099827, 'rsi_os': 24, 'rsi_ob': 80, 'vol_spike': 0.08842187168119803, 'adx_thresh': 26.492373514797702, 'atr_min_pct': 0.007501894901253797, 'atr_max_pct': 0.07450080625826984, 'tp_mult': 1.7666486970226971, 'tsl_mult': 0.790948538880532, 'strategy': 'breakout', 'time_stop': 87, 'use_sma': False, 'use_atr': False, 'use_adx': False, 'use_ema': False, 'use_spike': False, 'rsi_required': True, 'edge_k': 0.8357520321951746, 'edge_cap': 0.9301264929803045, 'bull_strategy': 'breakout', 'bull_bb_std_mult': 1.4749973530592015, 'bull_rsi_os': 20, 'bull_rsi_ob': 56, 'bull_adx_thresh': 8.230887019834556, 'bull_atr_min_pct': 0.021542569831037337, 'bull_atr_max_pct': 0.04308953385877897, 'bull_tp_mult': 2.777853434777721, 'bull_tsl_mult': 0.10156964805893653, 'bull_time_stop': 290, 'bull_use_sma': False, 'bull_use_ema': True, 'bull_use_atr': False, 'bull_use_adx': True, 'bull_use_spike': False, 'bull_rsi_required': True, 'bear_strategy': 'breakout', 'bear_bb_std_mult': 1.5615051913941813, 'bear_rsi_os': 50, 'bear_rsi_ob': 47, 'bear_adx_thresh': 5.011880122815851, 'bear_atr_min_pct': 0.004373589113792294, 'bear_atr_max_pct': 0.12743047102736815, 'bear_tp_mult': 1.7509740848745388, 'bear_tsl_mult': 0.5716098490558652, 'bear_time_stop': 220, 'bear_use_sma': False, 'bear_use_ema': True, 'bear_use_atr': False, 'bear_use_adx': False, 'bear_use_spike': False, 'bear_rsi_required': True, 'sideways_strategy': 'mean_reversion', 'sideways_bb_std_mult': 0.5537946167679673, 'sideways_rsi_os': 30, 'sideways_rsi_ob': 70, 'sideways_adx_thresh': 33.218096525983455, 'sideways_atr_min_pct': 0.007304116432781389, 'sideways_atr_max_pct': 0.05858323300665491, 'sideways_tp_mult': 2.6070467939248996, 'sideways_tsl_mult': 0.8547079108789185, 'sideways_time_stop': 70, 'sideways_use_sma': True, 'sideways_use_ema': True, 'sideways_use_atr': False, 'sideways_use_adx': True, 'sideways_use_spike': True, 'sideways_rsi_required': False}.
[I 2025-09-01 14:43:59,420] Trial 313 finished with values: [-1000000000.0, 1000000000.0] and parameters: {'p_sma': 26, 'p_std': 48, 'p_atr': 14, 'p_adx': 22, 'rsi_period': 72, 'ema1': 26, 'ema2': 39, 'slip_atr_k': 0.16443420739740774, 'slip_spread_k': 0.3748050589214219, 'spread_hl_frac': 0.001253992623999979, 'bb_std_mult': 2.440845170998294, 'rsi_os': 25, 'rsi_ob': 84, 'vol_spike': 0.014826147954025365, 'adx_thresh': 26.664410994313226, 'atr_min_pct': 0.013781599100668333, 'atr_max_pct': 0.06212034163498538, 'tp_mult': 2.417236227349683, 'tsl_mult': 0.4556675630759746, 'strategy': 'breakout', 'time_stop': 242, 'use_sma': False, 'use_atr': False, 'use_adx': True, 'use_ema': True, 'use_spike': False, 'rsi_required': False, 'edge_k': 0.5444366160514335, 'edge_cap': 0.1696560776571156, 'bull_strategy': 'mean_reversion', 'bull_bb_std_mult': 1.5048918467297145, 'bull_rsi_os': 20, 'bull_rsi_ob': 57, 'bull_adx_thresh': 11.802134383306882, 'bull_atr_min_pct': 0.02798980312677718, 'bull_atr_max_pct': 0.05007525689040808, 'bull_tp_mult': 2.9158598522964048, 'bull_tsl_mult': 0.2672662646159323, 'bull_time_stop': 75, 'bull_use_sma': False, 'bull_use_ema': True, 'bull_use_atr': False, 'bull_use_adx': True, 'bull_use_spike': True, 'bull_rsi_required': False, 'bear_strategy': 'breakout', 'bear_bb_std_mult': 1.561351190989327, 'bear_rsi_os': 9, 'bear_rsi_ob': 48, 'bear_adx_thresh': 6.038775742422909, 'bear_atr_min_pct': 0.006284676771093995, 'bear_atr_max_pct': 0.06427416802193828, 'bear_tp_mult': 1.561220498438086, 'bear_tsl_mult': 0.6170817357693011, 'bear_time_stop': 238, 'bear_use_sma': False, 'bear_use_ema': False, 'bear_use_atr': False, 'bear_use_adx': True, 'bear_use_spike': False, 'bear_rsi_required': False, 'sideways_strategy': 'mean_reversion', 'sideways_bb_std_mult': 0.8487798899215322, 'sideways_rsi_os': 16, 'sideways_rsi_ob': 76, 'sideways_adx_thresh': 25.396927301229315, 'sideways_atr_min_pct': 0.008924560749923684, 'sideways_atr_max_pct': 0.029910972222505307, 'sideways_tp_mult': 2.577085991165486, 'sideways_tsl_mult': 0.2544538336207003, 'sideways_time_stop': 79, 'sideways_use_sma': True, 'sideways_use_ema': True, 'sideways_use_atr': False, 'sideways_use_adx': True, 'sideways_use_spike': True, 'sideways_rsi_required': False}.
[I 2025-09-01 14:44:01,049] Trial 314 finished with values: [-0.03624487044945912, 0.03617151410723843] and parameters: {'p_sma': 50, 'p_std': 49, 'p_atr': 15, 'p_adx': 20, 'rsi_period': 72, 'ema1': 27, 'ema2': 34, 'slip_atr_k': 0.042712819191112236, 'slip_spread_k': 0.3743078772974364, 'spread_hl_frac': 0.02643946436178479, 'bb_std_mult': 2.4321326688235185, 'rsi_os': 7, 'rsi_ob': 84, 'vol_spike': 0.05937591132172003, 'adx_thresh': 8.265667982779158, 'atr_min_pct': 0.013452524834844999, 'atr_max_pct': 0.0823836315149698, 'tp_mult': 1.490730137370314, 'tsl_mult': 0.883570900540678, 'strategy': 'breakout', 'time_stop': 119, 'use_sma': True, 'use_atr': False, 'use_adx': True, 'use_ema': True, 'use_spike': False, 'rsi_required': False, 'edge_k': 0.5493922067809852, 'edge_cap': 0.20653345892416985, 'bull_strategy': 'mean_reversion', 'bull_bb_std_mult': 3.039767289844068, 'bull_rsi_os': 22, 'bull_rsi_ob': 54, 'bull_adx_thresh': 12.363314019682498, 'bull_atr_min_pct': 0.0016208860078435203, 'bull_atr_max_pct': 0.03690287372342182, 'bull_tp_mult': 1.0918329867781225, 'bull_tsl_mult': 0.8603940278504718, 'bull_time_stop': 25, 'bull_use_sma': True, 'bull_use_ema': False, 'bull_use_atr': False, 'bull_use_adx': False, 'bull_use_spike': True, 'bull_rsi_required': False, 'bear_strategy': 'mean_reversion', 'bear_bb_std_mult': 0.7680493014557708, 'bear_rsi_os': 34, 'bear_rsi_ob': 55, 'bear_adx_thresh': 6.0966662724880045, 'bear_atr_min_pct': 0.00648883827677923, 'bear_atr_max_pct': 0.06475633423317302, 'bear_tp_mult': 1.974999034690114, 'bear_tsl_mult': 0.2184040897378446, 'bear_time_stop': 176, 'bear_use_sma': False, 'bear_use_ema': False, 'bear_use_atr': True, 'bear_use_adx': True, 'bear_use_spike': False, 'bear_rsi_required': False, 'sideways_strategy': 'mean_reversion', 'sideways_bb_std_mult': 0.7472151546026886, 'sideways_rsi_os': 31, 'sideways_rsi_ob': 76, 'sideways_adx_thresh': 32.58519822031486, 'sideways_atr_min_pct': 0.01639201285810127, 'sideways_atr_max_pct': 0.1212612768750789, 'sideways_tp_mult': 2.5709357961912827, 'sideways_tsl_mult': 0.886826064066567, 'sideways_time_stop': 145, 'sideways_use_sma': False, 'sideways_use_ema': True, 'sideways_use_atr': False, 'sideways_use_adx': False, 'sideways_use_spike': True, 'sideways_rsi_required': False}.
[I 2025-09-01 14:44:01,675] Trial 312 finished with values: [-1000000000.0, 1000000000.0] and parameters: {'p_sma': 26, 'p_std': 10, 'p_atr': 15, 'p_adx': 20, 'rsi_period': 23, 'ema1': 8, 'ema2': 42, 'slip_atr_k': 0.014779494345456043, 'slip_spread_k': 0.38829669925927185, 'spread_hl_frac': 0.004365555287570787, 'bb_std_mult': 2.4222502736284133, 'rsi_os': 24, 'rsi_ob': 81, 'vol_spike': 0.05946665352134896, 'adx_thresh': 26.57998302397593, 'atr_min_pct': 0.007442595130040252, 'atr_max_pct': 0.0639644950514018, 'tp_mult': 1.5033182371351514, 'tsl_mult': 0.88750138356868, 'strategy': 'breakout', 'time_stop': 85, 'use_sma': False, 'use_atr': False, 'use_adx': True, 'use_ema': True, 'use_spike': False, 'rsi_required': True, 'edge_k': 0.5513995297431055, 'edge_cap': 0.9323473954313135, 'bull_strategy': 'mean_reversion', 'bull_bb_std_mult': 1.4946561350286203, 'bull_rsi_os': 20, 'bull_rsi_ob': 63, 'bull_adx_thresh': 19.90327762381883, 'bull_atr_min_pct': 0.023099021686785588, 'bull_atr_max_pct': 0.0734364810253364, 'bull_tp_mult': 2.7673747711782526, 'bull_tsl_mult': 0.8903562683168624, 'bull_time_stop': 24, 'bull_use_sma': False, 'bull_use_ema': True, 'bull_use_atr': False, 'bull_use_adx': True, 'bull_use_spike': False, 'bull_rsi_required': True, 'bear_strategy': 'breakout', 'bear_bb_std_mult': 0.7659345888163449, 'bear_rsi_os': 33, 'bear_rsi_ob': 77, 'bear_adx_thresh': 5.00235113118835, 'bear_atr_min_pct': 0.00632840923642174, 'bear_atr_max_pct': 0.021503715459393988, 'bear_tp_mult': 1.8472440957516112, 'bear_tsl_mult': 0.7279612751018802, 'bear_time_stop': 211, 'bear_use_sma': False, 'bear_use_ema': True, 'bear_use_atr': False, 'bear_use_adx': True, 'bear_use_spike': False, 'bear_rsi_required': True, 'sideways_strategy': 'mean_reversion', 'sideways_bb_std_mult': 0.865741507679824, 'sideways_rsi_os': 41, 'sideways_rsi_ob': 54, 'sideways_adx_thresh': 33.11714536108908, 'sideways_atr_min_pct': 0.015877325158911743, 'sideways_atr_max_pct': 0.1210436648848002, 'sideways_tp_mult': 2.4859307989640134, 'sideways_tsl_mult': 0.4127167461541137, 'sideways_time_stop': 74, 'sideways_use_sma': True, 'sideways_use_ema': True, 'sideways_use_atr': False, 'sideways_use_adx': True, 'sideways_use_spike': True, 'sideways_rsi_required': False}.
[I 2025-09-01 14:44:02,033] Trial 311 finished with values: [-1000000000.0, 1000000000.0] and parameters: {'p_sma': 55, 'p_std': 6, 'p_atr': 14, 'p_adx': 18, 'rsi_period': 14, 'ema1': 29, 'ema2': 38, 'slip_atr_k': 0.043449570564149144, 'slip_spread_k': 0.6574118048643104, 'spread_hl_frac': 0.04234880703299599, 'bb_std_mult': 2.440888239034493, 'rsi_os': 25, 'rsi_ob': 75, 'vol_spike': 0.061092733305335864, 'adx_thresh': 8.337389881304857, 'atr_min_pct': 0.007088867092297515, 'atr_max_pct': 0.1433761669932235, 'tp_mult': 2.317605285374053, 'tsl_mult': 0.45652357418095685, 'strategy': 'breakout', 'time_stop': 89, 'use_sma': True, 'use_atr': False, 'use_adx': False, 'use_ema': False, 'use_spike': False, 'rsi_required': True, 'edge_k': 0.16329538728190418, 'edge_cap': 0.9317577050716712, 'bull_strategy': 'breakout', 'bull_bb_std_mult': 0.9213915473008853, 'bull_rsi_os': 20, 'bull_rsi_ob': 57, 'bull_adx_thresh': 19.997529951335114, 'bull_atr_min_pct': 0.027996108529927358, 'bull_atr_max_pct': 0.041866769090629974, 'bull_tp_mult': 1.1047378335406937, 'bull_tsl_mult': 0.8963744271602929, 'bull_time_stop': 24, 'bull_use_sma': False, 'bull_use_ema': True, 'bull_use_atr': False, 'bull_use_adx': True, 'bull_use_spike': False, 'bull_rsi_required': True, 'bear_strategy': 'breakout', 'bear_bb_std_mult': 1.5821605942878807, 'bear_rsi_os': 49, 'bear_rsi_ob': 86, 'bear_adx_thresh': 5.586017569464915, 'bear_atr_min_pct': 0.00625571110215549, 'bear_atr_max_pct': 0.12706325519968453, 'bear_tp_mult': 1.538513871963594, 'bear_tsl_mult': 0.7387221932736647, 'bear_time_stop': 212, 'bear_use_sma': False, 'bear_use_ema': True, 'bear_use_atr': False, 'bear_use_adx': False, 'bear_use_spike': False, 'bear_rsi_required': True, 'sideways_strategy': 'mean_reversion', 'sideways_bb_std_mult': 0.5501552850280944, 'sideways_rsi_os': 30, 'sideways_rsi_ob': 76, 'sideways_adx_thresh': 25.218739579809263, 'sideways_atr_min_pct': 0.014716806971144653, 'sideways_atr_max_pct': 0.05711535460153615, 'sideways_tp_mult': 1.1263854941390545, 'sideways_tsl_mult': 0.25158158336943764, 'sideways_time_stop': 71, 'sideways_use_sma': True, 'sideways_use_ema': True, 'sideways_use_atr': False, 'sideways_use_adx': True, 'sideways_use_spike': True, 'sideways_rsi_required': False}.
