[I 2025-09-01 14:44:37,608] Trial 318 finished with values: [-1000000000.0, 1000000000.0] and parameters: {'p_sma': 22, 'p_std': 55, 'p_atr': 13, 'p_adx': 25, 'rsi_period': 70, 'ema1': 6, 'ema2': 22, 'slip_atr_k': 0.1544965056852724, 'slip_spread_k': 0.7477967490044177, 'spread_hl_frac': 0.047503679136044946, 'bb_std_mult': 1.165252230681077, 'rsi_os': 21, 'rsi_ob': 86, 'vol_spike': 0.03875338510853779, 'adx_thresh': 28.148075550313052, 'atr_min_pct': 0.008575535934336005, 'atr_max_pct': 0.07071924823623829, 'tp_mult': 1.6190930226402733, 'tsl_mult': 0.6277973388005339, 'strategy': 'mean_reversion', 'time_stop': 40, 'use_sma': False, 'use_atr': False, 'use_adx': False, 'use_ema': False, 'use_spike': False, 'rsi_required': True, 'edge_k': 0.7320342342891832, 'edge_cap': 0.8875410549682397, 'bull_strategy': 'breakout', 'bull_bb_std_mult': 3.5866104376700596, 'bull_rsi_os': 17, 'bull_rsi_ob': 54, 'bull_adx_thresh': 17.929413467661306, 'bull_atr_min_pct': 0.00386495535745735, 'bull_atr_max_pct': 0.06636104059511445, 'bull_tp_mult': 1.1387449501321196, 'bull_tsl_mult': 0.4863655218126513, 'bull_time_stop': 41, 'bull_use_sma': True, 'bull_use_ema': False, 'bull_use_atr': True, 'bull_use_adx': False, 'bull_use_spike': False, 'bull_rsi_required': True, 'bear_strategy': 'mean_reversion', 'bear_bb_std_mult': 0.5078939282249371, 'bear_rsi_os': 53, 'bear_rsi_ob': 72, 'bear_adx_thresh': 20.583809604206067, 'bear_atr_min_pct': 0.0036388765883123395, 'bear_atr_max_pct': 0.10908559298505893, 'bear_tp_mult': 1.7640055608700391, 'bear_tsl_mult': 0.6517302481420445, 'bear_time_stop': 256, 'bear_use_sma': False, 'bear_use_ema': True, 'bear_use_atr': True, 'bear_use_adx': False, 'bear_use_spike': True, 'bear_rsi_required': True, 'sideways_strategy': 'mean_reversion', 'sideways_bb_std_mult': 1.3901163259019067, 'sideways_rsi_os': 34, 'sideways_rsi_ob': 84, 'sideways_adx_thresh': 34.982712640208504, 'sideways_atr_min_pct': 0.023857278579314495, 'sideways_atr_max_pct': 0.03631317190104573, 'sideways_tp_mult': 2.751563644546837, 'sideways_tsl_mult': 0.8125744991647199, 'sideways_time_stop': 97, 'sideways_use_sma': False, 'sideways_use_ema': False, 'sideways_use_atr': False, 'sideways_use_adx': False, 'sideways_use_spike': True, 'sideways_rsi_required': False}.
[I 2025-09-01 14:44:38,395] Trial 317 finished with values: [-1000000000.0, 1000000000.0] and parameters: {'p_sma': 28, 'p_std': 8, 'p_atr': 13, 'p_adx': 8, 'rsi_period': 70, 'ema1': 21, 'ema2': 22, 'slip_atr_k': 0.04003644088122428, 'slip_spread_k': 0.7499305759123649, 'spread_hl_frac': 0.03874720081914167, 'bb_std_mult': 0.9537614683579878, 'rsi_os': 33, 'rsi_ob': 92, 'vol_spike': 0.010316522183637903, 'adx_thresh': 28.202673346176418, 'atr_min_pct': 0.02817502341922135, 'atr_max_pct': 0.0805488775888967, 'tp_mult': 1.891558171602638, 'tsl_mult': 0.5756397630258929, 'strategy': 'mean_reversion', 'time_stop': 77, 'use_sma': True, 'use_atr': False, 'use_adx': False, 'use_ema': False, 'use_spike': False, 'rsi_required': True, 'edge_k': 0.7326538315024939, 'edge_cap': 0.8469746580627899, 'bull_strategy': 'breakout', 'bull_bb_std_mult': 1.7381062106129483, 'bull_rsi_os': 17, 'bull_rsi_ob': 54, 'bull_adx_thresh': 18.47884398340368, 'bull_atr_min_pct': 0.007096444140744866, 'bull_atr_max_pct': 0.06333239270100688, 'bull_tp_mult': 2.972620871728547, 'bull_tsl_mult': 0.8407828970339286, 'bull_time_stop': 176, 'bull_use_sma': False, 'bull_use_ema': False, 'bull_use_atr': True, 'bull_use_adx': True, 'bull_use_spike': False, 'bull_rsi_required': True, 'bear_strategy': 'breakout', 'bear_bb_std_mult': 1.2875458781332143, 'bear_rsi_os': 53, 'bear_rsi_ob': 88, 'bear_adx_thresh': 5.619258043266212, 'bear_atr_min_pct': 0.007378941621376842, 'bear_atr_max_pct': 0.01763849228866365, 'bear_tp_mult': 1.138851082289717, 'bear_tsl_mult': 0.8144207358641866, 'bear_time_stop': 134, 'bear_use_sma': False, 'bear_use_ema': True, 'bear_use_atr': False, 'bear_use_adx': False, 'bear_use_spike': True, 'bear_rsi_required': True, 'sideways_strategy': 'mean_reversion', 'sideways_bb_std_mult': 1.3538975915133433, 'sideways_rsi_os': 28, 'sideways_rsi_ob': 60, 'sideways_adx_thresh': 33.77893506035301, 'sideways_atr_min_pct': 0.01084538281792828, 'sideways_atr_max_pct': 0.03682567740802636, 'sideways_tp_mult': 2.706977207672187, 'sideways_tsl_mult': 0.6591906795182008, 'sideways_time_stop': 297, 'sideways_use_sma': True, 'sideways_use_ema': False, 'sideways_use_atr': False, 'sideways_use_adx': True, 'sideways_use_spike': True, 'sideways_rsi_required': False}.
[I 2025-09-01 14:44:38,731] Trial 315 finished with values: [-1000000000.0, 1000000000.0] and parameters: {'p_sma': 22, 'p_std': 7, 'p_atr': 15, 'p_adx': 20, 'rsi_period': 70, 'ema1': 14, 'ema2': 42, 'slip_atr_k': 0.016199099293517157, 'slip_spread_k': 0.8766425177742496, 'spread_hl_frac': 0.030661640509734925, 'bb_std_mult': 0.9724538576973991, 'rsi_os': 7, 'rsi_ob': 81, 'vol_spike': 0.009013335042437426, 'adx_thresh': 9.295645181540714, 'atr_min_pct': 0.010953393280979438, 'atr_max_pct': 0.144423533932981, 'tp_mult': 1.4936230713498784, 'tsl_mult': 0.6323573527012694, 'strategy': 'breakout', 'time_stop': 120, 'use_sma': True, 'use_atr': False, 'use_adx': True, 'use_ema': False, 'use_spike': False, 'rsi_required': True, 'edge_k': 0.4725887654677741, 'edge_cap': 0.9333968693838255, 'bull_strategy': 'breakout', 'bull_bb_std_mult': 2.0214641882661346, 'bull_rsi_os': 17, 'bull_rsi_ob': 54, 'bull_adx_thresh': 12.483176127673158, 'bull_atr_min_pct': 0.029295845236708744, 'bull_atr_max_pct': 0.03614444328993058, 'bull_tp_mult': 1.0846791491093146, 'bull_tsl_mult': 0.85952905867501, 'bull_time_stop': 154, 'bull_use_sma': True, 'bull_use_ema': False, 'bull_use_atr': True, 'bull_use_adx': False, 'bull_use_spike': False, 'bull_rsi_required': True, 'bear_strategy': 'mean_reversion', 'bear_bb_std_mult': 2.13036746905493, 'bear_rsi_os': 33, 'bear_rsi_ob': 90, 'bear_adx_thresh': 33.708804495523125, 'bear_atr_min_pct': 0.005519591065887933, 'bear_atr_max_pct': 0.021362635696390738, 'bear_tp_mult': 1.9779139257615745, 'bear_tsl_mult': 0.6483449591952016, 'bear_time_stop': 143, 'bear_use_sma': False, 'bear_use_ema': True, 'bear_use_atr': True, 'bear_use_adx': False, 'bear_use_spike': True, 'bear_rsi_required': True, 'sideways_strategy': 'mean_reversion', 'sideways_bb_std_mult': 2.767381328598646, 'sideways_rsi_os': 43, 'sideways_rsi_ob': 79, 'sideways_adx_thresh': 32.74025010087675, 'sideways_atr_min_pct': 0.016269355837136172, 'sideways_atr_max_pct': 0.0330165176808487, 'sideways_tp_mult': 2.4890718102621703, 'sideways_tsl_mult': 0.41236387144508513, 'sideways_time_stop': 271, 'sideways_use_sma': False, 'sideways_use_ema': True, 'sideways_use_atr': False, 'sideways_use_adx': False, 'sideways_use_spike': True, 'sideways_rsi_required': False}.
[I 2025-09-01 14:44:38,881] Trial 316 finished with values: [-1000000000.0, 1000000000.0] and parameters: {'p_sma': 28, 'p_std': 55, 'p_atr': 14, 'p_adx': 8, 'rsi_period': 70, 'ema1': 13, 'ema2': 22, 'slip_atr_k': 0.18141666864368017, 'slip_spread_k': 0.46069539437427726, 'spread_hl_frac': 0.028236405660280982, 'bb_std_mult': 2.5459917092441784, 'rsi_os': 33, 'rsi_ob': 92, 'vol_spike': 0.010013425546838898, 'adx_thresh': 28.349470824303094, 'atr_min_pct': 0.008551026019395702, 'atr_max_pct': 0.06551666619898149, 'tp_mult': 2.2319780738046844, 'tsl_mult': 0.5843310243339522, 'strategy': 'mean_reversion', 'time_stop': 36, 'use_sma': False, 'use_atr': False, 'use_adx': False, 'use_ema': False, 'use_spike': False, 'rsi_required': True, 'edge_k': 0.7270473179887932, 'edge_cap': 0.9372896201965302, 'bull_strategy': 'breakout', 'bull_bb_std_mult': 2.4082781787767904, 'bull_rsi_os': 17, 'bull_rsi_ob': 84, 'bull_adx_thresh': 20.14662115732936, 'bull_atr_min_pct': 0.003839003266817888, 'bull_atr_max_pct': 0.07417480072439307, 'bull_tp_mult': 1.1340269287417069, 'bull_tsl_mult': 0.4944402408241448, 'bull_time_stop': 21, 'bull_use_sma': False, 'bull_use_ema': True, 'bull_use_atr': True, 'bull_use_adx': True, 'bull_use_spike': False, 'bull_rsi_required': True, 'bear_strategy': 'breakout', 'bear_bb_std_mult': 2.088400530180453, 'bear_rsi_os': 51, 'bear_rsi_ob': 77, 'bear_adx_thresh': 5.5191710420360005, 'bear_atr_min_pct': 0.01539553389808773, 'bear_atr_max_pct': 0.11123949646834853, 'bear_tp_mult': 1.9092042926182424, 'bear_tsl_mult': 0.8238079224879626, 'bear_time_stop': 133, 'bear_use_sma': False, 'bear_use_ema': True, 'bear_use_atr': False, 'bear_use_adx': False, 'bear_use_spike': True, 'bear_rsi_required': True, 'sideways_strategy': 'mean_reversion', 'sideways_bb_std_mult': 1.3960859510619843, 'sideways_rsi_os': 28, 'sideways_rsi_ob': 50, 'sideways_adx_thresh': 10.799139763995742, 'sideways_atr_min_pct': 0.015358521970174326, 'sideways_atr_max_pct': 0.03271687683697604, 'sideways_tp_mult': 1.3396618225936336, 'sideways_tsl_mult': 0.8745417528723878, 'sideways_time_stop': 269, 'sideways_use_sma': True, 'sideways_use_ema': False, 'sideways_use_atr': False, 'sideways_use_adx': True, 'sideways_use_spike': True, 'sideways_rsi_required': False}.
[I 2025-09-01 14:45:12,814] Trial 319 finished with values: [-1000000000.0, 1000000000.0] and parameters: {'p_sma': 39, 'p_std': 23, 'p_atr': 28, 'p_adx': 12, 'rsi_period': 75, 'ema1': 28, 'ema2': 41, 'slip_atr_k': 0.21934204311513283, 'slip_spread_k': 0.4519179158940858, 'spread_hl_frac': 0.03872209399723658, 'bb_std_mult': 0.9855531038594407, 'rsi_os': 33, 'rsi_ob': 55, 'vol_spike': 0.13884839643577843, 'adx_thresh': 20.322644786712278, 'atr_min_pct': 0.005537690582797711, 'atr_max_pct': 0.05571836903077105, 'tp_mult': 1.8959621385795689, 'tsl_mult': 0.5874979816718203, 'strategy': 'mean_reversion', 'time_stop': 112, 'use_sma': False, 'use_atr': True, 'use_adx': False, 'use_ema': False, 'use_spike': False, 'rsi_required': True, 'edge_k': 0.4558592099253702, 'edge_cap': 0.9509201721998407, 'bull_strategy': 'breakout', 'bull_bb_std_mult': 1.6157510684584708, 'bull_rsi_os': 19, 'bull_rsi_ob': 56, 'bull_adx_thresh': 33.23125215803146, 'bull_atr_min_pct': 0.007343233694477057, 'bull_atr_max_pct': 0.036434429451281405, 'bull_tp_mult': 1.6245896589889552, 'bull_tsl_mult': 0.3973976517057347, 'bull_time_stop': 59, 'bull_use_sma': False, 'bull_use_ema': True, 'bull_use_atr': True, 'bull_use_adx': True, 'bull_use_spike': False, 'bull_rsi_required': True, 'bear_strategy': 'breakout', 'bear_bb_std_mult': 2.123475098956723, 'bear_rsi_os': 47, 'bear_rsi_ob': 90, 'bear_adx_thresh': 5.57241810697579, 'bear_atr_min_pct': 0.007295455877793481, 'bear_atr_max_pct': 0.016443433502411203, 'bear_tp_mult': 2.2196654046762627, 'bear_tsl_mult': 0.42272054789776736, 'bear_time_stop': 22, 'bear_use_sma': True, 'bear_use_ema': False, 'bear_use_atr': False, 'bear_use_adx': False, 'bear_use_spike': True, 'bear_rsi_required': True, 'sideways_strategy': 'mean_reversion', 'sideways_bb_std_mult': 2.7007489903299637, 'sideways_rsi_os': 39, 'sideways_rsi_ob': 79, 'sideways_adx_thresh': 33.9777054174711, 'sideways_atr_min_pct': 0.022273866055287223, 'sideways_atr_max_pct': 0.03247959506030965, 'sideways_tp_mult': 2.7271444019031295, 'sideways_tsl_mult': 0.8783764938864933, 'sideways_time_stop': 34, 'sideways_use_sma': True, 'sideways_use_ema': False, 'sideways_use_atr': False, 'sideways_use_adx': True, 'sideways_use_spike': True, 'sideways_rsi_required': False}.
[I 2025-09-01 14:45:12,870] Trial 320 finished with values: [-1000000000.0, 1000000000.0] and parameters: {'p_sma': 23, 'p_std': 53, 'p_atr': 14, 'p_adx': 12, 'rsi_period': 75, 'ema1': 28, 'ema2': 42, 'slip_atr_k': 0.10371814643560388, 'slip_spread_k': 0.46032443030995834, 'spread_hl_frac': 0.0406425884076754, 'bb_std_mult': 2.1366441672812457, 'rsi_os': 9, 'rsi_ob': 55, 'vol_spike': 0.014515547528764619, 'adx_thresh': 27.442948101367538, 'atr_min_pct': 0.008033790381043092, 'atr_max_pct': 0.08954678615078103, 'tp_mult': 2.2532920268719048, 'tsl_mult': 0.5698511389004529, 'strategy': 'breakout', 'time_stop': 216, 'use_sma': False, 'use_atr': True, 'use_adx': False, 'use_ema': False, 'use_spike': True, 'rsi_required': True, 'edge_k': 0.4394659122934681, 'edge_cap': 0.7997924520867506, 'bull_strategy': 'breakout', 'bull_bb_std_mult': 3.345579468097665, 'bull_rsi_os': 19, 'bull_rsi_ob': 87, 'bull_adx_thresh': 32.56302232522253, 'bull_atr_min_pct': 0.029126298777142703, 'bull_atr_max_pct': 0.1238177199895779, 'bull_tp_mult': 1.7401483267277151, 'bull_tsl_mult': 0.8596141659884727, 'bull_time_stop': 18, 'bull_use_sma': False, 'bull_use_ema': True, 'bull_use_atr': False, 'bull_use_adx': True, 'bull_use_spike': False, 'bull_rsi_required': True, 'bear_strategy': 'breakout', 'bear_bb_std_mult': 2.099312340737371, 'bear_rsi_os': 17, 'bear_rsi_ob': 45, 'bear_adx_thresh': 6.281446602566012, 'bear_atr_min_pct': 0.005621215247668227, 'bear_atr_max_pct': 0.07272869088335933, 'bear_tp_mult': 1.922890607784548, 'bear_tsl_mult': 0.6103616027792527, 'bear_time_stop': 157, 'bear_use_sma': True, 'bear_use_ema': False, 'bear_use_atr': False, 'bear_use_adx': False, 'bear_use_spike': False, 'bear_rsi_required': True, 'sideways_strategy': 'mean_reversion', 'sideways_bb_std_mult': 1.514884239199454, 'sideways_rsi_os': 23, 'sideways_rsi_ob': 72, 'sideways_adx_thresh': 19.653352585981004, 'sideways_atr_min_pct': 0.0012168098854406055, 'sideways_atr_max_pct': 0.0323847364241931, 'sideways_tp_mult': 2.6363591910441535, 'sideways_tsl_mult': 0.8680633295895317, 'sideways_time_stop': 271, 'sideways_use_sma': True, 'sideways_use_ema': True, 'sideways_use_atr': False, 'sideways_use_adx': True, 'sideways_use_spike': False, 'sideways_rsi_required': False}.
[I 2025-09-01 14:45:13,099] Trial 321 finished with values: [-1000000000.0, 1000000000.0] and parameters: {'p_sma': 24, 'p_std': 42, 'p_atr': 16, 'p_adx': 22, 'rsi_period': 75, 'ema1': 28, 'ema2': 41, 'slip_atr_k': 0.17932680552818087, 'slip_spread_k': 0.46006000462673474, 'spread_hl_frac': 0.028685342109439082, 'bb_std_mult': 2.5386527433995565, 'rsi_os': 19, 'rsi_ob': 55, 'vol_spike': 0.29987094433460054, 'adx_thresh': 12.460059825001709, 'atr_min_pct': 0.00795844698108272, 'atr_max_pct': 0.07683571333355005, 'tp_mult': 2.4577716861231065, 'tsl_mult': 0.5895330019267552, 'strategy': 'mean_reversion', 'time_stop': 96, 'use_sma': False, 'use_atr': True, 'use_adx': False, 'use_ema': False, 'use_spike': True, 'rsi_required': False, 'edge_k': 0.4312366659978953, 'edge_cap': 0.9499521499263014, 'bull_strategy': 'breakout', 'bull_bb_std_mult': 1.2325624412373044, 'bull_rsi_os': 19, 'bull_rsi_ob': 76, 'bull_adx_thresh': 32.866962210029115, 'bull_atr_min_pct': 0.005385464026055878, 'bull_atr_max_pct': 0.034342077345224466, 'bull_tp_mult': 1.0597298996899822, 'bull_tsl_mult': 0.3946908260261053, 'bull_time_stop': 16, 'bull_use_sma': False, 'bull_use_ema': True, 'bull_use_atr': False, 'bull_use_adx': True, 'bull_use_spike': True, 'bull_rsi_required': False, 'bear_strategy': 'breakout', 'bear_bb_std_mult': 2.1187335856892693, 'bear_rsi_os': 51, 'bear_rsi_ob': 50, 'bear_adx_thresh': 6.2870669414955636, 'bear_atr_min_pct': 0.011172013771970081, 'bear_atr_max_pct': 0.1331731843129894, 'bear_tp_mult': 2.0867975642030876, 'bear_tsl_mult': 0.6185393859392053, 'bear_time_stop': 287, 'bear_use_sma': True, 'bear_use_ema': False, 'bear_use_atr': False, 'bear_use_adx': False, 'bear_use_spike': False, 'bear_rsi_required': False, 'sideways_strategy': 'mean_reversion', 'sideways_bb_std_mult': 1.502285579949021, 'sideways_rsi_os': 38, 'sideways_rsi_ob': 50, 'sideways_adx_thresh': 10.336891357040706, 'sideways_atr_min_pct': 0.017254063585481778, 'sideways_atr_max_pct': 0.12707177898289188, 'sideways_tp_mult': 1.8097557899699606, 'sideways_tsl_mult': 0.874435574542787, 'sideways_time_stop': 58, 'sideways_use_sma': True, 'sideways_use_ema': True, 'sideways_use_atr': False, 'sideways_use_adx': True, 'sideways_use_spike': False, 'sideways_rsi_required': False}.
[I 2025-09-01 14:45:13,262] Trial 322 finished with values: [-1000000000.0, 1000000000.0] and parameters: {'p_sma': 19, 'p_std': 23, 'p_atr': 13, 'p_adx': 12, 'rsi_period': 75, 'ema1': 18, 'ema2': 41, 'slip_atr_k': 0.026260675345466583, 'slip_spread_k': 0.42914184304875785, 'spread_hl_frac': 0.04471751919732077, 'bb_std_mult': 1.8477068838042001, 'rsi_os': 19, 'rsi_ob': 57, 'vol_spike': 0.018677278262975876, 'adx_thresh': 27.271390985116398, 'atr_min_pct': 0.008018215118185016, 'atr_max_pct': 0.05593513022969063, 'tp_mult': 2.5177110124398596, 'tsl_mult': 0.7612763120729829, 'strategy': 'breakout', 'time_stop': 196, 'use_sma': False, 'use_atr': True, 'use_adx': False, 'use_ema': False, 'use_spike': True, 'rsi_required': False, 'edge_k': 0.4210956820594281, 'edge_cap': 0.9050005723565606, 'bull_strategy': 'breakout', 'bull_bb_std_mult': 0.829115375253325, 'bull_rsi_os': 19, 'bull_rsi_ob': 52, 'bull_adx_thresh': 15.230904366868245, 'bull_atr_min_pct': 0.005490484477257277, 'bull_atr_max_pct': 0.0330175405735809, 'bull_tp_mult': 1.2452032465951808, 'bull_tsl_mult': 0.9158733644588932, 'bull_time_stop': 206, 'bull_use_sma': False, 'bull_use_ema': True, 'bull_use_atr': False, 'bull_use_adx': True, 'bull_use_spike': True, 'bull_rsi_required': False, 'bear_strategy': 'breakout', 'bear_bb_std_mult': 2.4136603938781573, 'bear_rsi_os': 17, 'bear_rsi_ob': 45, 'bear_adx_thresh': 19.767924090398182, 'bear_atr_min_pct': 0.02277540671902706, 'bear_atr_max_pct': 0.09162379355541846, 'bear_tp_mult': 1.045172100955278, 'bear_tsl_mult': 0.9478131343811369, 'bear_time_stop': 159, 'bear_use_sma': True, 'bear_use_ema': False, 'bear_use_atr': False, 'bear_use_adx': False, 'bear_use_spike': False, 'bear_rsi_required': False, 'sideways_strategy': 'breakout', 'sideways_bb_std_mult': 1.233112524284597, 'sideways_rsi_os': 8, 'sideways_rsi_ob': 87, 'sideways_adx_thresh': 19.492913868952726, 'sideways_atr_min_pct': 0.017164646508418525, 'sideways_atr_max_pct': 0.0393443717178299, 'sideways_tp_mult': 2.6452231362189735, 'sideways_tsl_mult': 0.7031304165368338, 'sideways_time_stop': 206, 'sideways_use_sma': True, 'sideways_use_ema': True, 'sideways_use_atr': False, 'sideways_use_adx': True, 'sideways_use_spike': False, 'sideways_rsi_required': False}.
[I 2025-09-01 14:45:51,103] Trial 323 finished with values: [-1000000000.0, 1000000000.0] and parameters: {'p_sma': 24, 'p_std': 13, 'p_atr': 12, 'p_adx': 21, 'rsi_period': 56, 'ema1': 30, 'ema2': 39, 'slip_atr_k': 0.03269710914397243, 'slip_spread_k': 0.49755983873947396, 'spread_hl_frac': 0.04203900129758794, 'bb_std_mult': 1.3242860751141823, 'rsi_os': 20, 'rsi_ob': 69, 'vol_spike': 0.030162818122295577, 'adx_thresh': 27.066083656242103, 'atr_min_pct': 0.0038608628932408524, 'atr_max_pct': 0.0753871315640418, 'tp_mult': 1.5573174275569421, 'tsl_mult': 0.7476930036831069, 'strategy': 'breakout', 'time_stop': 95, 'use_sma': False, 'use_atr': False, 'use_adx': True, 'use_ema': True, 'use_spike': True, 'rsi_required': False, 'edge_k': 0.21762353884331442, 'edge_cap': 0.9980151045790362, 'bull_strategy': 'mean_reversion', 'bull_bb_std_mult': 2.2041067050345418, 'bull_rsi_os': 15, 'bull_rsi_ob': 82, 'bull_adx_thresh': 26.596931284881265, 'bull_atr_min_pct': 0.005349866274757811, 'bull_atr_max_pct': 0.0342542730377568, 'bull_tp_mult': 1.2209620065505002, 'bull_tsl_mult': 0.9140249575999542, 'bull_time_stop': 15, 'bull_use_sma': False, 'bull_use_ema': True, 'bull_use_atr': False, 'bull_use_adx': True, 'bull_use_spike': True, 'bull_rsi_required': False, 'bear_strategy': 'breakout', 'bear_bb_std_mult': 1.9888511506543856, 'bear_rsi_os': 39, 'bear_rsi_ob': 81, 'bear_adx_thresh': 19.12043882207561, 'bear_atr_min_pct': 0.014294657732251553, 'bear_atr_max_pct': 0.09165822639898566, 'bear_tp_mult': 2.93044784763437, 'bear_tsl_mult': 0.6231156222156785, 'bear_time_stop': 121, 'bear_use_sma': False, 'bear_use_ema': True, 'bear_use_atr': False, 'bear_use_adx': False, 'bear_use_spike': False, 'bear_rsi_required': False, 'sideways_strategy': 'breakout', 'sideways_bb_std_mult': 2.4845112954561763, 'sideways_rsi_os': 31, 'sideways_rsi_ob': 74, 'sideways_adx_thresh': 32.03545809515907, 'sideways_atr_min_pct': 0.028125562750129576, 'sideways_atr_max_pct': 0.050350203134222886, 'sideways_tp_mult': 1.8001266894730223, 'sideways_tsl_mult': 0.8455966352159365, 'sideways_time_stop': 89, 'sideways_use_sma': True, 'sideways_use_ema': True, 'sideways_use_atr': True, 'sideways_use_adx': True, 'sideways_use_spike': False, 'sideways_rsi_required': True}.
