[I 2025-09-01 14:59:14,064] Trial 404 finished with values: [-1000000000.0, 1000000000.0] and parameters: {'p_sma': 30, 'p_std': 26, 'p_atr': 28, 'p_adx': 13, 'rsi_period': 44, 'ema1': 22, 'ema2': 59, 'slip_atr_k': 0.12624243556544765, 'slip_spread_k': 0.37628546833394977, 'spread_hl_frac': 0.008606981563272942, 'bb_std_mult': 2.2721025526405834, 'rsi_os': 31, 'rsi_ob': 77, 'vol_spike': 0.15599989501827538, 'adx_thresh': 27.318121499755062, 'atr_min_pct': 0.01665941220717585, 'atr_max_pct': 0.06261624872953073, 'tp_mult': 2.025945083513921, 'tsl_mult': 0.024783094866263067, 'strategy': 'breakout', 'time_stop': 30, 'use_sma': False, 'use_atr': True, 'use_adx': False, 'use_ema': True, 'use_spike': False, 'rsi_required': False, 'edge_k': 1.4467849077738235, 'edge_cap': 0.79304896359582, 'bull_strategy': 'mean_reversion', 'bull_bb_std_mult': 0.9644519190308763, 'bull_rsi_os': 23, 'bull_rsi_ob': 68, 'bull_adx_thresh': 6.7761660294014705, 'bull_atr_min_pct': 0.017870094885734808, 'bull_atr_max_pct': 0.042328425914824164, 'bull_tp_mult': 1.471813185791469, 'bull_tsl_mult': 0.03772677342091628, 'bull_time_stop': 124, 'bull_use_sma': False, 'bull_use_ema': True, 'bull_use_atr': False, 'bull_use_adx': True, 'bull_use_spike': False, 'bull_rsi_required': True, 'bear_strategy': 'breakout', 'bear_bb_std_mult': 2.675883570483136, 'bear_rsi_os': 50, 'bear_rsi_ob': 59, 'bear_adx_thresh': 9.456779912527855, 'bear_atr_min_pct': 0.027212288651059107, 'bear_atr_max_pct': 0.05388388449621705, 'bear_tp_mult': 1.6160875393853793, 'bear_tsl_mult': 0.38193490194598245, 'bear_time_stop': 271, 'bear_use_sma': True, 'bear_use_ema': False, 'bear_use_atr': False, 'bear_use_adx': True, 'bear_use_spike': True, 'bear_rsi_required': False, 'sideways_strategy': 'breakout', 'sideways_bb_std_mult': 1.1590454377622628, 'sideways_rsi_os': 23, 'sideways_rsi_ob': 49, 'sideways_adx_thresh': 15.432006958936213, 'sideways_atr_min_pct': 0.011009127916086131, 'sideways_atr_max_pct': 0.014564888710524582, 'sideways_tp_mult': 2.244522664110102, 'sideways_tsl_mult': 0.7450355217157363, 'sideways_time_stop': 73, 'sideways_use_sma': False, 'sideways_use_ema': False, 'sideways_use_atr': True, 'sideways_use_adx': True, 'sideways_use_spike': False, 'sideways_rsi_required': True}.
[I 2025-09-01 14:59:14,419] Trial 405 finished with values: [-1000000000.0, 1000000000.0] and parameters: {'p_sma': 32, 'p_std': 28, 'p_atr': 23, 'p_adx': 9, 'rsi_period': 50, 'ema1': 20, 'ema2': 32, 'slip_atr_k': 0.23740650246290132, 'slip_spread_k': 0.38980053377507956, 'spread_hl_frac': 0.020234423081103063, 'bb_std_mult': 2.3142427832253083, 'rsi_os': 32, 'rsi_ob': 79, 'vol_spike': 0.07610081736618945, 'adx_thresh': 27.354094785741786, 'atr_min_pct': 0.016864007395765202, 'atr_max_pct': 0.1402184843729813, 'tp_mult': 2.018406038793983, 'tsl_mult': 0.2143024460665603, 'strategy': 'breakout', 'time_stop': 17, 'use_sma': False, 'use_atr': True, 'use_adx': True, 'use_ema': True, 'use_spike': False, 'rsi_required': False, 'edge_k': 1.4044218869975393, 'edge_cap': 0.32460238785555684, 'bull_strategy': 'mean_reversion', 'bull_bb_std_mult': 0.9230077160618387, 'bull_rsi_os': 27, 'bull_rsi_ob': 67, 'bull_adx_thresh': 6.688106675428909, 'bull_atr_min_pct': 0.017844621682642798, 'bull_atr_max_pct': 0.03789050255000309, 'bull_tp_mult': 1.3628095145191605, 'bull_tsl_mult': 0.039826959537868384, 'bull_time_stop': 125, 'bull_use_sma': False, 'bull_use_ema': True, 'bull_use_atr': False, 'bull_use_adx': True, 'bull_use_spike': False, 'bull_rsi_required': True, 'bear_strategy': 'breakout', 'bear_bb_std_mult': 2.4838887242773304, 'bear_rsi_os': 48, 'bear_rsi_ob': 49, 'bear_adx_thresh': 10.724889219566725, 'bear_atr_min_pct': 0.02635046512114273, 'bear_atr_max_pct': 0.049772859929379756, 'bear_tp_mult': 2.1872435608547884, 'bear_tsl_mult': 0.40528014405672147, 'bear_time_stop': 268, 'bear_use_sma': True, 'bear_use_ema': False, 'bear_use_atr': False, 'bear_use_adx': False, 'bear_use_spike': True, 'bear_rsi_required': False, 'sideways_strategy': 'mean_reversion', 'sideways_bb_std_mult': 0.8139914239993109, 'sideways_rsi_os': 23, 'sideways_rsi_ob': 92, 'sideways_adx_thresh': 6.292837134933384, 'sideways_atr_min_pct': 0.01427042523694724, 'sideways_atr_max_pct': 0.045795786290238345, 'sideways_tp_mult': 2.2632746432704764, 'sideways_tsl_mult': 0.751646140588754, 'sideways_time_stop': 71, 'sideways_use_sma': True, 'sideways_use_ema': False, 'sideways_use_atr': True, 'sideways_use_adx': False, 'sideways_use_spike': False, 'sideways_rsi_required': True}.
[I 2025-09-01 14:59:14,437] Trial 406 finished with values: [-1000000000.0, 1000000000.0] and parameters: {'p_sma': 38, 'p_std': 33, 'p_atr': 28, 'p_adx': 9, 'rsi_period': 50, 'ema1': 26, 'ema2': 59, 'slip_atr_k': 0.16924979895099407, 'slip_spread_k': 0.9236351961241103, 'spread_hl_frac': 0.020259172809314545, 'bb_std_mult': 2.302611502353927, 'rsi_os': 32, 'rsi_ob': 79, 'vol_spike': 0.15743495534657992, 'adx_thresh': 27.188769162694875, 'atr_min_pct': 0.016972045488017274, 'atr_max_pct': 0.03417883536407834, 'tp_mult': 2.0201361304993295, 'tsl_mult': 0.47764095684869295, 'strategy': 'breakout', 'time_stop': 17, 'use_sma': False, 'use_atr': True, 'use_adx': True, 'use_ema': True, 'use_spike': False, 'rsi_required': False, 'edge_k': 1.4088851086662089, 'edge_cap': 0.9087510549747086, 'bull_strategy': 'mean_reversion', 'bull_bb_std_mult': 0.9617726415275691, 'bull_rsi_os': 41, 'bull_rsi_ob': 64, 'bull_adx_thresh': 6.799174334382719, 'bull_atr_min_pct': 0.017678445466319952, 'bull_atr_max_pct': 0.038429271991165616, 'bull_tp_mult': 1.36694572492323, 'bull_tsl_mult': 0.030223951483647156, 'bull_time_stop': 126, 'bull_use_sma': False, 'bull_use_ema': True, 'bull_use_atr': False, 'bull_use_adx': True, 'bull_use_spike': False, 'bull_rsi_required': True, 'bear_strategy': 'breakout', 'bear_bb_std_mult': 2.507425185551317, 'bear_rsi_os': 48, 'bear_rsi_ob': 80, 'bear_adx_thresh': 10.332195058915111, 'bear_atr_min_pct': 0.023143423195730744, 'bear_atr_max_pct': 0.04370744272408001, 'bear_tp_mult': 1.459322558061824, 'bear_tsl_mult': 0.39540515572674895, 'bear_time_stop': 266, 'bear_use_sma': True, 'bear_use_ema': False, 'bear_use_atr': False, 'bear_use_adx': False, 'bear_use_spike': True, 'bear_rsi_required': False, 'sideways_strategy': 'mean_reversion', 'sideways_bb_std_mult': 0.5022458380347989, 'sideways_rsi_os': 6, 'sideways_rsi_ob': 49, 'sideways_adx_thresh': 15.353927417138692, 'sideways_atr_min_pct': 0.014382784341144676, 'sideways_atr_max_pct': 0.04621928271934106, 'sideways_tp_mult': 2.2611650467458997, 'sideways_tsl_mult': 0.7429360788825441, 'sideways_time_stop': 198, 'sideways_use_sma': True, 'sideways_use_ema': False, 'sideways_use_atr': True, 'sideways_use_adx': False, 'sideways_use_spike': False, 'sideways_rsi_required': True}.
[I 2025-09-01 14:59:53,814] Trial 409 finished with values: [-1000000000.0, 1000000000.0] and parameters: {'p_sma': 34, 'p_std': 51, 'p_atr': 13, 'p_adx': 15, 'rsi_period': 70, 'ema1': 26, 'ema2': 57, 'slip_atr_k': 0.014150728788967091, 'slip_spread_k': 0.6429719827649089, 'spread_hl_frac': 0.006660186669122283, 'bb_std_mult': 2.1864413421343545, 'rsi_os': 30, 'rsi_ob': 70, 'vol_spike': 0.08413558551818179, 'adx_thresh': 28.258836120467937, 'atr_min_pct': 0.014026785699869013, 'atr_max_pct': 0.07086327890741113, 'tp_mult': 1.9110815531917908, 'tsl_mult': 0.4614625583611328, 'strategy': 'mean_reversion', 'time_stop': 39, 'use_sma': True, 'use_atr': True, 'use_adx': False, 'use_ema': True, 'use_spike': True, 'rsi_required': True, 'edge_k': 1.520129343191396, 'edge_cap': 0.9090712019373033, 'bull_strategy': 'mean_reversion', 'bull_bb_std_mult': 0.7465620852677771, 'bull_rsi_os': 41, 'bull_rsi_ob': 66, 'bull_adx_thresh': 5.686668933912974, 'bull_atr_min_pct': 0.01696947820930442, 'bull_atr_max_pct': 0.033095950548941266, 'bull_tp_mult': 1.4269154078537074, 'bull_tsl_mult': 0.09285798005728953, 'bull_time_stop': 93, 'bull_use_sma': False, 'bull_use_ema': True, 'bull_use_atr': True, 'bull_use_adx': False, 'bull_use_spike': False, 'bull_rsi_required': True, 'bear_strategy': 'mean_reversion', 'bear_bb_std_mult': 1.3567918122720717, 'bear_rsi_os': 52, 'bear_rsi_ob': 80, 'bear_adx_thresh': 8.625673479732097, 'bear_atr_min_pct': 0.015915017803199337, 'bear_atr_max_pct': 0.041404540144751235, 'bear_tp_mult': 1.5582600109499958, 'bear_tsl_mult': 0.7660788365735117, 'bear_time_stop': 253, 'bear_use_sma': True, 'bear_use_ema': False, 'bear_use_atr': False, 'bear_use_adx': False, 'bear_use_spike': True, 'bear_rsi_required': True, 'sideways_strategy': 'mean_reversion', 'sideways_bb_std_mult': 3.1649552158719185, 'sideways_rsi_os': 25, 'sideways_rsi_ob': 76, 'sideways_adx_thresh': 29.387313249096792, 'sideways_atr_min_pct': 0.012969317152179749, 'sideways_atr_max_pct': 0.05138952222477149, 'sideways_tp_mult': 1.8765226897652532, 'sideways_tsl_mult': 0.7250489563278254, 'sideways_time_stop': 15, 'sideways_use_sma': True, 'sideways_use_ema': False, 'sideways_use_atr': True, 'sideways_use_adx': True, 'sideways_use_spike': False, 'sideways_rsi_required': True}.
[I 2025-09-01 14:59:54,280] Trial 411 finished with values: [-1000000000.0, 1000000000.0] and parameters: {'p_sma': 45, 'p_std': 28, 'p_atr': 22, 'p_adx': 30, 'rsi_period': 73, 'ema1': 18, 'ema2': 57, 'slip_atr_k': 0.012638887248034275, 'slip_spread_k': 0.4343364142282512, 'spread_hl_frac': 0.0041566970478847005, 'bb_std_mult': 0.811632344652311, 'rsi_os': 30, 'rsi_ob': 62, 'vol_spike': 0.048122288898167914, 'adx_thresh': 28.198164859901546, 'atr_min_pct': 0.014414737629571987, 'atr_max_pct': 0.02784175144218319, 'tp_mult': 1.9469296941272036, 'tsl_mult': 0.3460987148200752, 'strategy': 'mean_reversion', 'time_stop': 26, 'use_sma': True, 'use_atr': True, 'use_adx': False, 'use_ema': True, 'use_spike': True, 'rsi_required': True, 'edge_k': 1.491908653052581, 'edge_cap': 0.834917617421779, 'bull_strategy': 'mean_reversion', 'bull_bb_std_mult': 0.7507368099922367, 'bull_rsi_os': 25, 'bull_rsi_ob': 66, 'bull_adx_thresh': 5.551465104486077, 'bull_atr_min_pct': 0.015573393987303381, 'bull_atr_max_pct': 0.032857927117257914, 'bull_tp_mult': 2.4187102256603596, 'bull_tsl_mult': 0.09519142123726405, 'bull_time_stop': 148, 'bull_use_sma': True, 'bull_use_ema': True, 'bull_use_atr': True, 'bull_use_adx': False, 'bull_use_spike': False, 'bull_rsi_required': True, 'bear_strategy': 'mean_reversion', 'bear_bb_std_mult': 0.8534135025090455, 'bear_rsi_os': 51, 'bear_rsi_ob': 52, 'bear_adx_thresh': 8.682977406445582, 'bear_atr_min_pct': 0.0037095339827897473, 'bear_atr_max_pct': 0.04499661614093258, 'bear_tp_mult': 1.5623236780793415, 'bear_tsl_mult': 0.7614892334319117, 'bear_time_stop': 253, 'bear_use_sma': True, 'bear_use_ema': False, 'bear_use_atr': False, 'bear_use_adx': False, 'bear_use_spike': True, 'bear_rsi_required': True, 'sideways_strategy': 'mean_reversion', 'sideways_bb_std_mult': 1.1539969029832664, 'sideways_rsi_os': 25, 'sideways_rsi_ob': 76, 'sideways_adx_thresh': 17.459294588251247, 'sideways_atr_min_pct': 0.0045709781872916855, 'sideways_atr_max_pct': 0.05215009259955714, 'sideways_tp_mult': 2.197986743026954, 'sideways_tsl_mult': 0.7257687303665915, 'sideways_time_stop': 17, 'sideways_use_sma': True, 'sideways_use_ema': False, 'sideways_use_atr': True, 'sideways_use_adx': True, 'sideways_use_spike': False, 'sideways_rsi_required': True}.
[I 2025-09-01 14:59:54,528] Trial 410 finished with values: [-1000000000.0, 1000000000.0] and parameters: {'p_sma': 32, 'p_std': 58, 'p_atr': 22, 'p_adx': 15, 'rsi_period': 24, 'ema1': 18, 'ema2': 57, 'slip_atr_k': 0.0012426967521865454, 'slip_spread_k': 0.4375595030754621, 'spread_hl_frac': 0.02378005368995257, 'bb_std_mult': 2.8371325322458087, 'rsi_os': 30, 'rsi_ob': 70, 'vol_spike': 0.04821714006410944, 'adx_thresh': 28.003159257522665, 'atr_min_pct': 0.015535583870780101, 'atr_max_pct': 0.06993896995856914, 'tp_mult': 1.9108087838115324, 'tsl_mult': 0.4562460064102435, 'strategy': 'mean_reversion', 'time_stop': 39, 'use_sma': True, 'use_atr': True, 'use_adx': False, 'use_ema': True, 'use_spike': True, 'rsi_required': True, 'edge_k': 1.4850215001527913, 'edge_cap': 0.8365637345145666, 'bull_strategy': 'mean_reversion', 'bull_bb_std_mult': 0.765205870832902, 'bull_rsi_os': 29, 'bull_rsi_ob': 66, 'bull_adx_thresh': 5.404177459962734, 'bull_atr_min_pct': 0.014109907602441782, 'bull_atr_max_pct': 0.0853063891253453, 'bull_tp_mult': 1.4267742434413178, 'bull_tsl_mult': 0.08595385174625095, 'bull_time_stop': 106, 'bull_use_sma': True, 'bull_use_ema': True, 'bull_use_atr': True, 'bull_use_adx': False, 'bull_use_spike': False, 'bull_rsi_required': True, 'bear_strategy': 'mean_reversion', 'bear_bb_std_mult': 1.5088954248074689, 'bear_rsi_os': 51, 'bear_rsi_ob': 52, 'bear_adx_thresh': 9.687006440660829, 'bear_atr_min_pct': 0.02963210292221388, 'bear_atr_max_pct': 0.04135398857687463, 'bear_tp_mult': 1.5530302334806245, 'bear_tsl_mult': 0.2796008515239631, 'bear_time_stop': 122, 'bear_use_sma': True, 'bear_use_ema': False, 'bear_use_atr': False, 'bear_use_adx': False, 'bear_use_spike': True, 'bear_rsi_required': True, 'sideways_strategy': 'mean_reversion', 'sideways_bb_std_mult': 1.1554240950880328, 'sideways_rsi_os': 10, 'sideways_rsi_ob': 77, 'sideways_adx_thresh': 8.992430666704449, 'sideways_atr_min_pct': 0.01322152012933487, 'sideways_atr_max_pct': 0.14135452805551352, 'sideways_tp_mult': 2.185763000239784, 'sideways_tsl_mult': 0.777985702240716, 'sideways_time_stop': 277, 'sideways_use_sma': True, 'sideways_use_ema': False, 'sideways_use_atr': True, 'sideways_use_adx': True, 'sideways_use_spike': False, 'sideways_rsi_required': True}.
[I 2025-09-01 14:59:54,745] Trial 408 finished with values: [-0.01904172079634392, 0.022940539265146317] and parameters: {'p_sma': 34, 'p_std': 28, 'p_atr': 26, 'p_adx': 15, 'rsi_period': 73, 'ema1': 20, 'ema2': 57, 'slip_atr_k': 0.01442879472915531, 'slip_spread_k': 0.9282918116279434, 'spread_hl_frac': 0.034912100702277904, 'bb_std_mult': 2.1968006712914803, 'rsi_os': 30, 'rsi_ob': 79, 'vol_spike': 0.21055826185988452, 'adx_thresh': 28.078506831707887, 'atr_min_pct': 0.017133136262073013, 'atr_max_pct': 0.07058216712410834, 'tp_mult': 1.9234723510217404, 'tsl_mult': 0.46073469043282483, 'strategy': 'mean_reversion', 'time_stop': 18, 'use_sma': True, 'use_atr': True, 'use_adx': False, 'use_ema': True, 'use_spike': False, 'rsi_required': True, 'edge_k': 1.504595746787273, 'edge_cap': 0.8345360226769002, 'bull_strategy': 'mean_reversion', 'bull_bb_std_mult': 2.982481569056504, 'bull_rsi_os': 25, 'bull_rsi_ob': 66, 'bull_adx_thresh': 5.732961755601924, 'bull_atr_min_pct': 0.015487116826550672, 'bull_atr_max_pct': 0.02772574627517197, 'bull_tp_mult': 1.6603941308297063, 'bull_tsl_mult': 0.08841088385610614, 'bull_time_stop': 133, 'bull_use_sma': False, 'bull_use_ema': True, 'bull_use_atr': True, 'bull_use_adx': False, 'bull_use_spike': False, 'bull_rsi_required': True, 'bear_strategy': 'breakout', 'bear_bb_std_mult': 1.3574170451028225, 'bear_rsi_os': 51, 'bear_rsi_ob': 71, 'bear_adx_thresh': 10.842217656937457, 'bear_atr_min_pct': 0.004135437710106839, 'bear_atr_max_pct': 0.04357779690220646, 'bear_tp_mult': 2.20559609466621, 'bear_tsl_mult': 0.2295707812781696, 'bear_time_stop': 5, 'bear_use_sma': True, 'bear_use_ema': False, 'bear_use_atr': False, 'bear_use_adx': False, 'bear_use_spike': True, 'bear_rsi_required': True, 'sideways_strategy': 'mean_reversion', 'sideways_bb_std_mult': 0.7879284657737813, 'sideways_rsi_os': 6, 'sideways_rsi_ob': 76, 'sideways_adx_thresh': 33.281888950067255, 'sideways_atr_min_pct': 0.01316385147790769, 'sideways_atr_max_pct': 0.07422821336639107, 'sideways_tp_mult': 2.1850853661892375, 'sideways_tsl_mult': 0.7240199762913266, 'sideways_time_stop': 64, 'sideways_use_sma': True, 'sideways_use_ema': False, 'sideways_use_atr': True, 'sideways_use_adx': False, 'sideways_use_spike': False, 'sideways_rsi_required': True}.
[I 2025-09-01 14:59:55,510] Trial 415 finished with values: [-1000000000.0, 1000000000.0] and parameters: {'p_sma': 42, 'p_std': 19, 'p_atr': 9, 'p_adx': 7, 'rsi_period': 71, 'ema1': 8, 'ema2': 27, 'slip_atr_k': 0.0631463743916319, 'slip_spread_k': 0.4149781197905084, 'spread_hl_frac': 0.005579840725277496, 'bb_std_mult': 2.0611067542184474, 'rsi_os': 29, 'rsi_ob': 78, 'vol_spike': 0.25228839912948203, 'adx_thresh': 31.749105043444764, 'atr_min_pct': 0.017378919805197086, 'atr_max_pct': 0.016972202660723065, 'tp_mult': 1.9334371510575006, 'tsl_mult': 0.39440816214485075, 'strategy': 'breakout', 'time_stop': 23, 'use_sma': False, 'use_atr': True, 'use_adx': False, 'use_ema': True, 'use_spike': False, 'rsi_required': True, 'edge_k': 1.5379579014115312, 'edge_cap': 0.8620906688039032, 'bull_strategy': 'mean_reversion', 'bull_bb_std_mult': 2.731704683516098, 'bull_rsi_os': 51, 'bull_rsi_ob': 74, 'bull_adx_thresh': 6.033569758869938, 'bull_atr_min_pct': 0.01915999857505684, 'bull_atr_max_pct': 0.054180757401842694, 'bull_tp_mult': 1.4559918279224844, 'bull_tsl_mult': 0.06377260108644278, 'bull_time_stop': 133, 'bull_use_sma': False, 'bull_use_ema': False, 'bull_use_atr': False, 'bull_use_adx': True, 'bull_use_spike': True, 'bull_rsi_required': False, 'bear_strategy': 'breakout', 'bear_bb_std_mult': 3.451249985642617, 'bear_rsi_os': 32, 'bear_rsi_ob': 70, 'bear_adx_thresh': 10.102663188423774, 'bear_atr_min_pct': 0.0054654059286517774, 'bear_atr_max_pct': 0.11399497149128794, 'bear_tp_mult': 2.1111297115456282, 'bear_tsl_mult': 0.8219495906198216, 'bear_time_stop': 193, 'bear_use_sma': True, 'bear_use_ema': False, 'bear_use_atr': True, 'bear_use_adx': True, 'bear_use_spike': True, 'bear_rsi_required': True, 'sideways_strategy': 'breakout', 'sideways_bb_std_mult': 1.9762979062413235, 'sideways_rsi_os': 15, 'sideways_rsi_ob': 81, 'sideways_adx_thresh': 18.191900377988965, 'sideways_atr_min_pct': 0.023977082423303795, 'sideways_atr_max_pct': 0.05678767092751933, 'sideways_tp_mult': 2.152214047243374, 'sideways_tsl_mult': 0.7664917311554592, 'sideways_time_stop': 300, 'sideways_use_sma': False, 'sideways_use_ema': False, 'sideways_use_atr': True, 'sideways_use_adx': True, 'sideways_use_spike': False, 'sideways_rsi_required': True}.
[I 2025-09-01 15:00:31,008] Trial 412 finished with values: [-0.042048417835518714, 0.041754255746811436] and parameters: {'p_sma': 32, 'p_std': 28, 'p_atr': 10, 'p_adx': 30, 'rsi_period': 72, 'ema1': 9, 'ema2': 52, 'slip_atr_k': 0.01290132272827503, 'slip_spread_k': 0.1611510500403059, 'spread_hl_frac': 0.03458969145789681, 'bb_std_mult': 2.0641225376554253, 'rsi_os': 29, 'rsi_ob': 78, 'vol_spike': 0.21120916135364565, 'adx_thresh': 33.9175707501966, 'atr_min_pct': 0.024755642303662496, 'atr_max_pct': 0.06634752156772267, 'tp_mult': 1.9342053735296862, 'tsl_mult': 0.17014196064191, 'strategy': 'breakout', 'time_stop': 25, 'use_sma': False, 'use_atr': True, 'use_adx': False, 'use_ema': True, 'use_spike': False, 'rsi_required': True, 'edge_k': 1.4815769638787533, 'edge_cap': 0.050271464015295864, 'bull_strategy': 'mean_reversion', 'bull_bb_std_mult': 1.0952106059596083, 'bull_rsi_os': 38, 'bull_rsi_ob': 66, 'bull_adx_thresh': 5.428199087285453, 'bull_atr_min_pct': 0.015325066356401709, 'bull_atr_max_pct': 0.028282083554048466, 'bull_tp_mult': 2.8988254608661803, 'bull_tsl_mult': 0.07896397637900883, 'bull_time_stop': 132, 'bull_use_sma': True, 'bull_use_ema': False, 'bull_use_atr': False, 'bull_use_adx': True, 'bull_use_spike': True, 'bull_rsi_required': False, 'bear_strategy': 'breakout', 'bear_bb_std_mult': 3.4585100759733525, 'bear_rsi_os': 51, 'bear_rsi_ob': 67, 'bear_adx_thresh': 9.618911232569166, 'bear_atr_min_pct': 0.003630983605659982, 'bear_atr_max_pct': 0.04524535321783299, 'bear_tp_mult': 1.600975721928101, 'bear_tsl_mult': 0.91018869046345, 'bear_time_stop': 111, 'bear_use_sma': True, 'bear_use_ema': False, 'bear_use_atr': True, 'bear_use_adx': False, 'bear_use_spike': True, 'bear_rsi_required': True, 'sideways_strategy': 'mean_reversion', 'sideways_bb_std_mult': 2.3945607777152147, 'sideways_rsi_os': 23, 'sideways_rsi_ob': 78, 'sideways_adx_thresh': 8.89191619023861, 'sideways_atr_min_pct': 0.010722819302299817, 'sideways_atr_max_pct': 0.05385733723576611, 'sideways_tp_mult': 2.2015357909386344, 'sideways_tsl_mult': 0.7821184142814442, 'sideways_time_stop': 62, 'sideways_use_sma': True, 'sideways_use_ema': False, 'sideways_use_atr': True, 'sideways_use_adx': True, 'sideways_use_spike': False, 'sideways_rsi_required': True}.
