[I 2025-09-01 14:40:48,954] Trial 288 finished with values: [-1000000000.0, 1000000000.0] and parameters: {'p_sma': 22, 'p_std': 43, 'p_atr': 15, 'p_adx': 14, 'rsi_period': 73, 'ema1': 29, 'ema2': 60, 'slip_atr_k': 0.047945092162503214, 'slip_spread_k': 0.5561192566895335, 'spread_hl_frac': 0.02433502655159917, 'bb_std_mult': 1.2524857197868928, 'rsi_os': 8, 'rsi_ob': 77, 'vol_spike': 0.15223397936276037, 'adx_thresh': 27.67819723199272, 'atr_min_pct': 0.008950674320344585, 'atr_max_pct': 0.0712020664574476, 'tp_mult': 1.810707915736177, 'tsl_mult': 0.5806812159732188, 'strategy': 'breakout', 'time_stop': 88, 'use_sma': False, 'use_atr': False, 'use_adx': True, 'use_ema': False, 'use_spike': False, 'rsi_required': True, 'edge_k': 0.43553217500011626, 'edge_cap': 0.941546928747266, 'bull_strategy': 'breakout', 'bull_bb_std_mult': 1.3222940995021706, 'bull_rsi_os': 51, 'bull_rsi_ob': 94, 'bull_adx_thresh': 14.69935858958864, 'bull_atr_min_pct': 0.015098544636662065, 'bull_atr_max_pct': 0.012902220256904962, 'bull_tp_mult': 1.2807016394134823, 'bull_tsl_mult': 0.42566427383274386, 'bull_time_stop': 265, 'bull_use_sma': False, 'bull_use_ema': False, 'bull_use_atr': False, 'bull_use_adx': False, 'bull_use_spike': True, 'bull_rsi_required': True, 'bear_strategy': 'mean_reversion', 'bear_bb_std_mult': 2.2323503410638446, 'bear_rsi_os': 45, 'bear_rsi_ob': 87, 'bear_adx_thresh': 21.2730728383049, 'bear_atr_min_pct': 0.006738468933524024, 'bear_atr_max_pct': 0.02023020699686775, 'bear_tp_mult': 1.4507156748847123, 'bear_tsl_mult': 0.5866717487204954, 'bear_time_stop': 203, 'bear_use_sma': False, 'bear_use_ema': False, 'bear_use_atr': True, 'bear_use_adx': False, 'bear_use_spike': False, 'bear_rsi_required': True, 'sideways_strategy': 'breakout', 'sideways_bb_std_mult': 1.4362329975231405, 'sideways_rsi_os': 33, 'sideways_rsi_ob': 73, 'sideways_adx_thresh': 32.59769146944208, 'sideways_atr_min_pct': 0.015226768622134994, 'sideways_atr_max_pct': 0.062223516855730396, 'sideways_tp_mult': 2.634296515007872, 'sideways_tsl_mult': 0.8770899113957391, 'sideways_time_stop': 77, 'sideways_use_sma': False, 'sideways_use_ema': True, 'sideways_use_atr': True, 'sideways_use_adx': False, 'sideways_use_spike': True, 'sideways_rsi_required': True}.
[I 2025-09-01 14:40:49,170] Trial 290 finished with values: [-1000000000.0, 1000000000.0] and parameters: {'p_sma': 26, 'p_std': 12, 'p_atr': 15, 'p_adx': 14, 'rsi_period': 7, 'ema1': 29, 'ema2': 60, 'slip_atr_k': 0.03839226149744755, 'slip_spread_k': 0.2684274768171292, 'spread_hl_frac': 0.016822496670430464, 'bb_std_mult': 1.2395596009821146, 'rsi_os': 8, 'rsi_ob': 77, 'vol_spike': 0.050552422403557576, 'adx_thresh': 14.400473867655858, 'atr_min_pct': 0.007981195939385396, 'atr_max_pct': 0.01021173633482185, 'tp_mult': 1.8221945717925927, 'tsl_mult': 0.5469893687911564, 'strategy': 'breakout', 'time_stop': 85, 'use_sma': False, 'use_atr': False, 'use_adx': True, 'use_ema': False, 'use_spike': False, 'rsi_required': True, 'edge_k': 0.43951803487285307, 'edge_cap': 0.8822850112573171, 'bull_strategy': 'breakout', 'bull_bb_std_mult': 1.9253940144283739, 'bull_rsi_os': 20, 'bull_rsi_ob': 52, 'bull_adx_thresh': 31.16354144290313, 'bull_atr_min_pct': 0.009234742313440805, 'bull_atr_max_pct': 0.05855087626215516, 'bull_tp_mult': 1.2837005365337353, 'bull_tsl_mult': 0.909041814586536, 'bull_time_stop': 198, 'bull_use_sma': False, 'bull_use_ema': False, 'bull_use_atr': False, 'bull_use_adx': False, 'bull_use_spike': False, 'bull_rsi_required': True, 'bear_strategy': 'breakout', 'bear_bb_std_mult': 1.3683896973520804, 'bear_rsi_os': 53, 'bear_rsi_ob': 45, 'bear_adx_thresh': 21.055620924658975, 'bear_atr_min_pct': 0.017357032833088544, 'bear_atr_max_pct': 0.12429224758957638, 'bear_tp_mult': 1.2810888624355705, 'bear_tsl_mult': 0.5905826744352973, 'bear_time_stop': 199, 'bear_use_sma': False, 'bear_use_ema': False, 'bear_use_atr': False, 'bear_use_adx': False, 'bear_use_spike': False, 'bear_rsi_required': True, 'sideways_strategy': 'mean_reversion', 'sideways_bb_std_mult': 2.4184121287051465, 'sideways_rsi_os': 33, 'sideways_rsi_ob': 48, 'sideways_adx_thresh': 9.36268471668498, 'sideways_atr_min_pct': 0.018195912972305654, 'sideways_atr_max_pct': 0.017975047843219433, 'sideways_tp_mult': 2.2358340094578892, 'sideways_tsl_mult': 0.8204238828850942, 'sideways_time_stop': 77, 'sideways_use_sma': True, 'sideways_use_ema': True, 'sideways_use_atr': True, 'sideways_use_adx': True, 'sideways_use_spike': True, 'sideways_rsi_required': True}.
[I 2025-09-01 14:40:49,295] Trial 287 finished with values: [-1000000000.0, 1000000000.0] and parameters: {'p_sma': 18, 'p_std': 10, 'p_atr': 15, 'p_adx': 21, 'rsi_period': 73, 'ema1': 29, 'ema2': 46, 'slip_atr_k': 0.03177386270856496, 'slip_spread_k': 0.4145125292530638, 'spread_hl_frac': 0.006078238029160462, 'bb_std_mult': 1.2441832246920215, 'rsi_os': 8, 'rsi_ob': 56, 'vol_spike': 0.01930635444283848, 'adx_thresh': 27.424127837533735, 'atr_min_pct': 0.00881538535092696, 'atr_max_pct': 0.03827656832847188, 'tp_mult': 2.405614268375255, 'tsl_mult': 0.7192974428346801, 'strategy': 'breakout', 'time_stop': 73, 'use_sma': True, 'use_atr': False, 'use_adx': False, 'use_ema': False, 'use_spike': False, 'rsi_required': True, 'edge_k': 0.5934753639879292, 'edge_cap': 0.2870970510606855, 'bull_strategy': 'breakout', 'bull_bb_std_mult': 1.3166319130473592, 'bull_rsi_os': 20, 'bull_rsi_ob': 67, 'bull_adx_thresh': 18.889187404346174, 'bull_atr_min_pct': 0.005613339728417618, 'bull_atr_max_pct': 0.132823037297078, 'bull_tp_mult': 2.6569902028290935, 'bull_tsl_mult': 0.9021568535715185, 'bull_time_stop': 300, 'bull_use_sma': False, 'bull_use_ema': False, 'bull_use_atr': False, 'bull_use_adx': True, 'bull_use_spike': False, 'bull_rsi_required': True, 'bear_strategy': 'breakout', 'bear_bb_std_mult': 2.0701023901239592, 'bear_rsi_os': 53, 'bear_rsi_ob': 91, 'bear_adx_thresh': 12.492453282571322, 'bear_atr_min_pct': 0.0068309364848463845, 'bear_atr_max_pct': 0.01037253611620639, 'bear_tp_mult': 2.618644143211629, 'bear_tsl_mult': 0.5848170896390871, 'bear_time_stop': 246, 'bear_use_sma': False, 'bear_use_ema': True, 'bear_use_atr': False, 'bear_use_adx': False, 'bear_use_spike': False, 'bear_rsi_required': True, 'sideways_strategy': 'mean_reversion', 'sideways_bb_std_mult': 1.1917117442885714, 'sideways_rsi_os': 55, 'sideways_rsi_ob': 48, 'sideways_adx_thresh': 34.28994016699514, 'sideways_atr_min_pct': 0.018088721606515087, 'sideways_atr_max_pct': 0.11104196973651013, 'sideways_tp_mult': 2.624538936191922, 'sideways_tsl_mult': 0.8754642708602259, 'sideways_time_stop': 95, 'sideways_use_sma': True, 'sideways_use_ema': True, 'sideways_use_atr': True, 'sideways_use_adx': True, 'sideways_use_spike': True, 'sideways_rsi_required': True}.
[I 2025-09-01 14:41:23,366] Trial 291 finished with values: [-1000000000.0, 1000000000.0] and parameters: {'p_sma': 26, 'p_std': 9, 'p_atr': 20, 'p_adx': 10, 'rsi_period': 65, 'ema1': 11, 'ema2': 40, 'slip_atr_k': 0.1937737623666615, 'slip_spread_k': 0.5206889734957996, 'spread_hl_frac': 0.006198781470190863, 'bb_std_mult': 2.483343755250941, 'rsi_os': 11, 'rsi_ob': 53, 'vol_spike': 0.003198244261691458, 'adx_thresh': 14.251942146356104, 'atr_min_pct': 0.008003650393194445, 'atr_max_pct': 0.01948063208722521, 'tp_mult': 2.217566895216517, 'tsl_mult': 0.35960369028186256, 'strategy': 'mean_reversion', 'time_stop': 178, 'use_sma': False, 'use_atr': False, 'use_adx': False, 'use_ema': False, 'use_spike': False, 'rsi_required': True, 'edge_k': 1.361306881717041, 'edge_cap': 0.27603929827797535, 'bull_strategy': 'breakout', 'bull_bb_std_mult': 1.9038447253745232, 'bull_rsi_os': 39, 'bull_rsi_ob': 67, 'bull_adx_thresh': 20.76089665841258, 'bull_atr_min_pct': 0.005948665451483336, 'bull_atr_max_pct': 0.07774327317448403, 'bull_tp_mult': 2.0742037461734624, 'bull_tsl_mult': 0.08396919740014114, 'bull_time_stop': 200, 'bull_use_sma': False, 'bull_use_ema': True, 'bull_use_atr': True, 'bull_use_adx': True, 'bull_use_spike': False, 'bull_rsi_required': True, 'bear_strategy': 'breakout', 'bear_bb_std_mult': 2.8542166399751263, 'bear_rsi_os': 53, 'bear_rsi_ob': 62, 'bear_adx_thresh': 5.790870651248337, 'bear_atr_min_pct': 0.005376796062715206, 'bear_atr_max_pct': 0.029700246668579976, 'bear_tp_mult': 1.7076354532784663, 'bear_tsl_mult': 0.6041997400124006, 'bear_time_stop': 235, 'bear_use_sma': False, 'bear_use_ema': True, 'bear_use_atr': False, 'bear_use_adx': False, 'bear_use_spike': False, 'bear_rsi_required': True, 'sideways_strategy': 'mean_reversion', 'sideways_bb_std_mult': 1.6617307702075386, 'sideways_rsi_os': 32, 'sideways_rsi_ob': 75, 'sideways_adx_thresh': 9.15551190544577, 'sideways_atr_min_pct': 0.016524440042618136, 'sideways_atr_max_pct': 0.0240165843369921, 'sideways_tp_mult': 2.5232487172107767, 'sideways_tsl_mult': 0.14813029833013425, 'sideways_time_stop': 174, 'sideways_use_sma': True, 'sideways_use_ema': False, 'sideways_use_atr': False, 'sideways_use_adx': True, 'sideways_use_spike': False, 'sideways_rsi_required': False}.
[I 2025-09-01 14:41:23,369] Trial 292 finished with values: [-1000000000.0, 1000000000.0] and parameters: {'p_sma': 24, 'p_std': 9, 'p_atr': 20, 'p_adx': 10, 'rsi_period': 71, 'ema1': 17, 'ema2': 36, 'slip_atr_k': 0.17118567230823029, 'slip_spread_k': 0.520712215514629, 'spread_hl_frac': 0.006381516906571905, 'bb_std_mult': 2.5169406745928744, 'rsi_os': 11, 'rsi_ob': 79, 'vol_spike': 0.2091631854199356, 'adx_thresh': 26.25865661646292, 'atr_min_pct': 0.0024752588049033845, 'atr_max_pct': 0.07605549638221451, 'tp_mult': 1.6729600001241405, 'tsl_mult': 0.32051423035472726, 'strategy': 'mean_reversion', 'time_stop': 210, 'use_sma': False, 'use_atr': False, 'use_adx': False, 'use_ema': False, 'use_spike': False, 'rsi_required': True, 'edge_k': 0.5109084590168191, 'edge_cap': 0.3467339599815076, 'bull_strategy': 'breakout', 'bull_bb_std_mult': 1.9409763624684175, 'bull_rsi_os': 39, 'bull_rsi_ob': 79, 'bull_adx_thresh': 16.54052691378394, 'bull_atr_min_pct': 0.006649536101167087, 'bull_atr_max_pct': 0.05960466091125842, 'bull_tp_mult': 1.1012982330178434, 'bull_tsl_mult': 0.9179891282754401, 'bull_time_stop': 66, 'bull_use_sma': False, 'bull_use_ema': True, 'bull_use_atr': True, 'bull_use_adx': True, 'bull_use_spike': False, 'bull_rsi_required': True, 'bear_strategy': 'breakout', 'bear_bb_std_mult': 0.5845742741253577, 'bear_rsi_os': 53, 'bear_rsi_ob': 62, 'bear_adx_thresh': 5.859218007397412, 'bear_atr_min_pct': 0.005505349583598664, 'bear_atr_max_pct': 0.029734407987741497, 'bear_tp_mult': 1.2866623866558373, 'bear_tsl_mult': 0.5998011221899253, 'bear_time_stop': 149, 'bear_use_sma': False, 'bear_use_ema': True, 'bear_use_atr': False, 'bear_use_adx': False, 'bear_use_spike': False, 'bear_rsi_required': True, 'sideways_strategy': 'mean_reversion', 'sideways_bb_std_mult': 1.836767568449245, 'sideways_rsi_os': 6, 'sideways_rsi_ob': 75, 'sideways_adx_thresh': 32.87201509799055, 'sideways_atr_min_pct': 0.01863089792517742, 'sideways_atr_max_pct': 0.13940928804906264, 'sideways_tp_mult': 2.5510359586400293, 'sideways_tsl_mult': 0.8210128300407504, 'sideways_time_stop': 83, 'sideways_use_sma': True, 'sideways_use_ema': False, 'sideways_use_atr': False, 'sideways_use_adx': True, 'sideways_use_spike': False, 'sideways_rsi_required': False}.
[I 2025-09-01 14:41:23,741] Trial 293 finished with values: [-1000000000.0, 1000000000.0] and parameters: {'p_sma': 17, 'p_std': 9, 'p_atr': 20, 'p_adx': 30, 'rsi_period': 71, 'ema1': 27, 'ema2': 36, 'slip_atr_k': 0.09166811345536141, 'slip_spread_k': 0.5231698576630378, 'spread_hl_frac': 0.0064400672887116265, 'bb_std_mult': 2.4756220128631976, 'rsi_os': 15, 'rsi_ob': 53, 'vol_spike': 0.020181263851307106, 'adx_thresh': 6.114901365951376, 'atr_min_pct': 0.009042403206926716, 'atr_max_pct': 0.07796552595165472, 'tp_mult': 1.670556051987291, 'tsl_mult': 0.5009003599015376, 'strategy': 'mean_reversion', 'time_stop': 91, 'use_sma': True, 'use_atr': False, 'use_adx': False, 'use_ema': False, 'use_spike': False, 'rsi_required': True, 'edge_k': 0.5116542514985495, 'edge_cap': 0.27678007635228485, 'bull_strategy': 'breakout', 'bull_bb_std_mult': 2.3045716790646598, 'bull_rsi_os': 22, 'bull_rsi_ob': 80, 'bull_adx_thresh': 20.702893525367244, 'bull_atr_min_pct': 0.006040113148786877, 'bull_atr_max_pct': 0.14510683741575542, 'bull_tp_mult': 1.0954907872990207, 'bull_tsl_mult': 0.3719102981808937, 'bull_time_stop': 20, 'bull_use_sma': False, 'bull_use_ema': True, 'bull_use_atr': True, 'bull_use_adx': True, 'bull_use_spike': False, 'bull_rsi_required': True, 'bear_strategy': 'breakout', 'bear_bb_std_mult': 2.0853345377794525, 'bear_rsi_os': 55, 'bear_rsi_ob': 47, 'bear_adx_thresh': 5.810943059475553, 'bear_atr_min_pct': 0.020880145406196857, 'bear_atr_max_pct': 0.019372475040131374, 'bear_tp_mult': 2.2661119160662886, 'bear_tsl_mult': 0.3554930884473467, 'bear_time_stop': 153, 'bear_use_sma': False, 'bear_use_ema': True, 'bear_use_atr': False, 'bear_use_adx': False, 'bear_use_spike': False, 'bear_rsi_required': True, 'sideways_strategy': 'mean_reversion', 'sideways_bb_std_mult': 1.856845443128908, 'sideways_rsi_os': 31, 'sideways_rsi_ob': 80, 'sideways_adx_thresh': 18.025569694097648, 'sideways_atr_min_pct': 0.016515036842679583, 'sideways_atr_max_pct': 0.03862886305385927, 'sideways_tp_mult': 2.6915078494749793, 'sideways_tsl_mult': 0.8544775613121665, 'sideways_time_stop': 133, 'sideways_use_sma': True, 'sideways_use_ema': False, 'sideways_use_atr': False, 'sideways_use_adx': True, 'sideways_use_spike': False, 'sideways_rsi_required': False}.
[I 2025-09-01 14:41:23,889] Trial 294 finished with values: [-0.20241899601875923, 0.20211550480843196] and parameters: {'p_sma': 24, 'p_std': 9, 'p_atr': 14, 'p_adx': 7, 'rsi_period': 71, 'ema1': 27, 'ema2': 37, 'slip_atr_k': 0.07167724776598806, 'slip_spread_k': 0.3493811936981801, 'spread_hl_frac': 0.01800909572508986, 'bb_std_mult': 2.483739584928087, 'rsi_os': 12, 'rsi_ob': 52, 'vol_spike': 0.0030335992305574842, 'adx_thresh': 18.08221394606951, 'atr_min_pct': 0.006198551576384791, 'atr_max_pct': 0.07960545143406043, 'tp_mult': 2.1641441220882163, 'tsl_mult': 0.49959722587722744, 'strategy': 'mean_reversion', 'time_stop': 172, 'use_sma': False, 'use_atr': False, 'use_adx': False, 'use_ema': False, 'use_spike': False, 'rsi_required': True, 'edge_k': 0.5252834489646435, 'edge_cap': 0.3472508107727487, 'bull_strategy': 'breakout', 'bull_bb_std_mult': 1.4037538110310592, 'bull_rsi_os': 39, 'bull_rsi_ob': 58, 'bull_adx_thresh': 22.248574864930088, 'bull_atr_min_pct': 0.00648986283388468, 'bull_atr_max_pct': 0.07740620808422145, 'bull_tp_mult': 1.0702778231519952, 'bull_tsl_mult': 0.3690212662830539, 'bull_time_stop': 22, 'bull_use_sma': True, 'bull_use_ema': True, 'bull_use_atr': True, 'bull_use_adx': True, 'bull_use_spike': False, 'bull_rsi_required': True, 'bear_strategy': 'breakout', 'bear_bb_std_mult': 2.192728045428139, 'bear_rsi_os': 55, 'bear_rsi_ob': 62, 'bear_adx_thresh': 27.901055626293065, 'bear_atr_min_pct': 0.00015279192797763852, 'bear_atr_max_pct': 0.018537297501877433, 'bear_tp_mult': 2.4639154027338233, 'bear_tsl_mult': 0.6065101694373468, 'bear_time_stop': 189, 'bear_use_sma': False, 'bear_use_ema': True, 'bear_use_atr': False, 'bear_use_adx': False, 'bear_use_spike': False, 'bear_rsi_required': True, 'sideways_strategy': 'mean_reversion', 'sideways_bb_std_mult': 1.788612669892023, 'sideways_rsi_os': 27, 'sideways_rsi_ob': 46, 'sideways_adx_thresh': 23.669797436831967, 'sideways_atr_min_pct': 0.02954458289147038, 'sideways_atr_max_pct': 0.02220199291584185, 'sideways_tp_mult': 2.532621058255803, 'sideways_tsl_mult': 0.19543561112333985, 'sideways_time_stop': 131, 'sideways_use_sma': True, 'sideways_use_ema': False, 'sideways_use_atr': False, 'sideways_use_adx': True, 'sideways_use_spike': False, 'sideways_rsi_required': False}.
[I 2025-09-01 14:41:58,582] Trial 295 finished with values: [-1000000000.0, 1000000000.0] and parameters: {'p_sma': 47, 'p_std': 15, 'p_atr': 14, 'p_adx': 24, 'rsi_period': 68, 'ema1': 7, 'ema2': 41, 'slip_atr_k': 0.03916835033394535, 'slip_spread_k': 0.4508705802836941, 'spread_hl_frac': 0.03610465652339412, 'bb_std_mult': 2.3909430591806, 'rsi_os': 6, 'rsi_ob': 86, 'vol_spike': 0.010711118082709041, 'adx_thresh': 18.26352010525851, 'atr_min_pct': 0.00634726930811943, 'atr_max_pct': 0.05286231341030838, 'tp_mult': 1.1986772220676976, 'tsl_mult': 0.024753012177688716, 'strategy': 'breakout', 'time_stop': 29, 'use_sma': True, 'use_atr': False, 'use_adx': False, 'use_ema': False, 'use_spike': False, 'rsi_required': True, 'edge_k': 0.49683433075546435, 'edge_cap': 0.4563476171293944, 'bull_strategy': 'breakout', 'bull_bb_std_mult': 1.6653304509456457, 'bull_rsi_os': 18, 'bull_rsi_ob': 65, 'bull_adx_thresh': 34.08098910197782, 'bull_atr_min_pct': 0.010011206929138945, 'bull_atr_max_pct': 0.1440430153322333, 'bull_tp_mult': 1.8342827927998167, 'bull_tsl_mult': 0.539763633247692, 'bull_time_stop': 252, 'bull_use_sma': True, 'bull_use_ema': True, 'bull_use_atr': False, 'bull_use_adx': True, 'bull_use_spike': False, 'bull_rsi_required': True, 'bear_strategy': 'breakout', 'bear_bb_std_mult': 2.183771342479388, 'bear_rsi_os': 23, 'bear_rsi_ob': 47, 'bear_adx_thresh': 29.507049984558805, 'bear_atr_min_pct': 0.004690818883250348, 'bear_atr_max_pct': 0.018396952983803515, 'bear_tp_mult': 2.858126860711077, 'bear_tsl_mult': 0.5527695112828859, 'bear_time_stop': 228, 'bear_use_sma': False, 'bear_use_ema': True, 'bear_use_atr': False, 'bear_use_adx': True, 'bear_use_spike': True, 'bear_rsi_required': True, 'sideways_strategy': 'mean_reversion', 'sideways_bb_std_mult': 2.2360311058567355, 'sideways_rsi_os': 31, 'sideways_rsi_ob': 80, 'sideways_adx_thresh': 29.74623537815608, 'sideways_atr_min_pct': 0.014053118540697063, 'sideways_atr_max_pct': 0.08332942386862163, 'sideways_tp_mult': 2.8804237530329893, 'sideways_tsl_mult': 0.8514970292061642, 'sideways_time_stop': 223, 'sideways_use_sma': True, 'sideways_use_ema': True, 'sideways_use_atr': False, 'sideways_use_adx': True, 'sideways_use_spike': True, 'sideways_rsi_required': False}.
[I 2025-09-01 14:41:58,903] Trial 297 finished with values: [-1000000000.0, 1000000000.0] and parameters: {'p_sma': 43, 'p_std': 57, 'p_atr': 14, 'p_adx': 24, 'rsi_period': 49, 'ema1': 14, 'ema2': 38, 'slip_atr_k': 0.06921087196992746, 'slip_spread_k': 0.03140122034438525, 'spread_hl_frac': 0.03738265830317701, 'bb_std_mult': 0.8814292466117801, 'rsi_os': 46, 'rsi_ob': 86, 'vol_spike': 0.011302339703679882, 'adx_thresh': 18.096190561278885, 'atr_min_pct': 0.006531648427182254, 'atr_max_pct': 0.05469877205726971, 'tp_mult': 1.1791493110705544, 'tsl_mult': 0.6065483948849321, 'strategy': 'breakout', 'time_stop': 271, 'use_sma': False, 'use_atr': False, 'use_adx': False, 'use_ema': False, 'use_spike': False, 'rsi_required': False, 'edge_k': 1.0889901835794809, 'edge_cap': 0.5644287422544148, 'bull_strategy': 'breakout', 'bull_bb_std_mult': 1.6481129960613492, 'bull_rsi_os': 18, 'bull_rsi_ob': 58, 'bull_adx_thresh': 33.829853170514305, 'bull_atr_min_pct': 0.0023070706074002434, 'bull_atr_max_pct': 0.08463302701187395, 'bull_tp_mult': 1.1658928243772095, 'bull_tsl_mult': 0.7745091572420904, 'bull_time_stop': 253, 'bull_use_sma': True, 'bull_use_ema': True, 'bull_use_atr': False, 'bull_use_adx': True, 'bull_use_spike': False, 'bull_rsi_required': False, 'bear_strategy': 'breakout', 'bear_bb_std_mult': 2.1820575079588553, 'bear_rsi_os': 31, 'bear_rsi_ob': 88, 'bear_adx_thresh': 27.714367308425842, 'bear_atr_min_pct': 0.005989242194518676, 'bear_atr_max_pct': 0.10161818054717106, 'bear_tp_mult': 1.6413694479099992, 'bear_tsl_mult': 0.17909620830449108, 'bear_time_stop': 192, 'bear_use_sma': False, 'bear_use_ema': True, 'bear_use_atr': False, 'bear_use_adx': True, 'bear_use_spike': True, 'bear_rsi_required': False, 'sideways_strategy': 'mean_reversion', 'sideways_bb_std_mult': 1.3584309515972772, 'sideways_rsi_os': 28, 'sideways_rsi_ob': 94, 'sideways_adx_thresh': 29.93358677961683, 'sideways_atr_min_pct': 0.02911957412813189, 'sideways_atr_max_pct': 0.02721799601048134, 'sideways_tp_mult': 2.732548952936601, 'sideways_tsl_mult': 0.18849911639263517, 'sideways_time_stop': 194, 'sideways_use_sma': True, 'sideways_use_ema': True, 'sideways_use_atr': False, 'sideways_use_adx': True, 'sideways_use_spike': True, 'sideways_rsi_required': False}.
