[I 2025-09-01 14:07:06,787] Trial 80 finished with values: [-1000000000.0, 1000000000.0] and parameters: {'p_sma': 21, 'p_std': 39, 'p_atr': 15, 'p_adx': 25, 'rsi_period': 74, 'ema1': 28, 'ema2': 12, 'slip_atr_k': 0.14749797154990407, 'slip_spread_k': 0.6290525203701485, 'spread_hl_frac': 0.04438139513648694, 'bb_std_mult': 1.9685633722419593, 'rsi_os': 17, 'rsi_ob': 90, 'vol_spike': 0.04569100951158271, 'adx_thresh': 26.065483002563507, 'atr_min_pct': 0.010653410309513448, 'atr_max_pct': 0.05712742403875186, 'tp_mult': 2.407699527959699, 'tsl_mult': 0.5230323627873696, 'strategy': 'breakout', 'time_stop': 96, 'use_sma': False, 'use_atr': True, 'use_adx': False, 'use_ema': False, 'use_spike': False, 'rsi_required': False, 'edge_k': 0.24285499751806838, 'edge_cap': 0.9082728026568914, 'bull_strategy': 'breakout', 'bull_bb_std_mult': 3.4574610948168827, 'bull_rsi_os': 22, 'bull_rsi_ob': 49, 'bull_adx_thresh': 6.476925414539961, 'bull_atr_min_pct': 0.002869523775666284, 'bull_atr_max_pct': 0.11877390595279903, 'bull_tp_mult': 2.1231856629957178, 'bull_tsl_mult': 0.8269530944298249, 'bull_time_stop': 5, 'bull_use_sma': False, 'bull_use_ema': True, 'bull_use_atr': False, 'bull_use_adx': False, 'bull_use_spike': False, 'bull_rsi_required': True, 'bear_strategy': 'mean_reversion', 'bear_bb_std_mult': 1.0290594065266354, 'bear_rsi_os': 55, 'bear_rsi_ob': 58, 'bear_adx_thresh': 8.484185790281987, 'bear_atr_min_pct': 0.0022107126846693244, 'bear_atr_max_pct': 0.08279191443969021, 'bear_tp_mult': 1.726842563117069, 'bear_tsl_mult': 0.6540083496075207, 'bear_time_stop': 244, 'bear_use_sma': False, 'bear_use_ema': True, 'bear_use_atr': False, 'bear_use_adx': False, 'bear_use_spike': False, 'bear_rsi_required': False, 'sideways_strategy': 'mean_reversion', 'sideways_bb_std_mult': 0.9617783492945001, 'sideways_rsi_os': 30, 'sideways_rsi_ob': 57, 'sideways_adx_thresh': 17.400668532870306, 'sideways_atr_min_pct': 0.01607277347693359, 'sideways_atr_max_pct': 0.06408860722689078, 'sideways_tp_mult': 2.727560498514394, 'sideways_tsl_mult': 0.9166467945661407, 'sideways_time_stop': 71, 'sideways_use_sma': True, 'sideways_use_ema': True, 'sideways_use_atr': False, 'sideways_use_adx': False, 'sideways_use_spike': True, 'sideways_rsi_required': True}.
[I 2025-09-01 14:07:43,576] Trial 84 finished with values: [-1000000000.0, 1000000000.0] and parameters: {'p_sma': 6, 'p_std': 33, 'p_atr': 17, 'p_adx': 8, 'rsi_period': 75, 'ema1': 27, 'ema2': 44, 'slip_atr_k': 0.05874060275955872, 'slip_spread_k': 0.46885139658351055, 'spread_hl_frac': 0.04141311464500251, 'bb_std_mult': 2.6536760724230195, 'rsi_os': 6, 'rsi_ob': 94, 'vol_spike': 0.01350824716203369, 'adx_thresh': 28.423193348799167, 'atr_min_pct': 0.007062279898857838, 'atr_max_pct': 0.06949656832898392, 'tp_mult': 2.3297362382563205, 'tsl_mult': 0.5928584750408152, 'strategy': 'breakout', 'time_stop': 121, 'use_sma': False, 'use_atr': False, 'use_adx': False, 'use_ema': False, 'use_spike': False, 'rsi_required': True, 'edge_k': 0.3318888051959591, 'edge_cap': 0.8133157871582537, 'bull_strategy': 'mean_reversion', 'bull_bb_std_mult': 2.964980862145352, 'bull_rsi_os': 22, 'bull_rsi_ob': 60, 'bull_adx_thresh': 10.990225522264371, 'bull_atr_min_pct': 0.009499918729483029, 'bull_atr_max_pct': 0.025708170332027092, 'bull_tp_mult': 1.0210855664092038, 'bull_tsl_mult': 0.9486712944428435, 'bull_time_stop': 24, 'bull_use_sma': False, 'bull_use_ema': True, 'bull_use_atr': False, 'bull_use_adx': True, 'bull_use_spike': False, 'bull_rsi_required': True, 'bear_strategy': 'breakout', 'bear_bb_std_mult': 1.891724290295202, 'bear_rsi_os': 47, 'bear_rsi_ob': 46, 'bear_adx_thresh': 6.825464348552807, 'bear_atr_min_pct': 0.006459193153060193, 'bear_atr_max_pct': 0.030574006493088016, 'bear_tp_mult': 1.6105813665253126, 'bear_tsl_mult': 0.4904343723638688, 'bear_time_stop': 260, 'bear_use_sma': False, 'bear_use_ema': False, 'bear_use_atr': True, 'bear_use_adx': False, 'bear_use_spike': False, 'bear_rsi_required': True, 'sideways_strategy': 'mean_reversion', 'sideways_bb_std_mult': 1.1580848674759765, 'sideways_rsi_os': 32, 'sideways_rsi_ob': 93, 'sideways_adx_thresh': 10.643002585365599, 'sideways_atr_min_pct': 0.014492814280325457, 'sideways_atr_max_pct': 0.05038580125378798, 'sideways_tp_mult': 1.3815893763969989, 'sideways_tsl_mult': 0.5055598692247906, 'sideways_time_stop': 111, 'sideways_use_sma': True, 'sideways_use_ema': False, 'sideways_use_atr': True, 'sideways_use_adx': True, 'sideways_use_spike': True, 'sideways_rsi_required': False}.
[I 2025-09-01 14:07:43,801] Trial 83 finished with values: [-1000000000.0, 1000000000.0] and parameters: {'p_sma': 22, 'p_std': 26, 'p_atr': 17, 'p_adx': 25, 'rsi_period': 75, 'ema1': 28, 'ema2': 20, 'slip_atr_k': 0.003226752255881399, 'slip_spread_k': 0.46495538978347256, 'spread_hl_frac': 0.022126295003918005, 'bb_std_mult': 1.1643498277917357, 'rsi_os': 7, 'rsi_ob': 94, 'vol_spike': 0.04304730482699458, 'adx_thresh': 26.64223827177325, 'atr_min_pct': 0.010009893959965767, 'atr_max_pct': 0.07028190050943951, 'tp_mult': 2.3276747058766025, 'tsl_mult': 0.5913575649461708, 'strategy': 'mean_reversion', 'time_stop': 59, 'use_sma': False, 'use_atr': True, 'use_adx': False, 'use_ema': False, 'use_spike': False, 'rsi_required': False, 'edge_k': 0.30098808941881544, 'edge_cap': 0.9057041907675931, 'bull_strategy': 'mean_reversion', 'bull_bb_std_mult': 0.8912889286262733, 'bull_rsi_os': 22, 'bull_rsi_ob': 72, 'bull_adx_thresh': 23.81823104575298, 'bull_atr_min_pct': 0.009905375293875637, 'bull_atr_max_pct': 0.041068667275228815, 'bull_tp_mult': 2.1128747886917267, 'bull_tsl_mult': 0.9608557146944349, 'bull_time_stop': 261, 'bull_use_sma': False, 'bull_use_ema': True, 'bull_use_atr': True, 'bull_use_adx': True, 'bull_use_spike': False, 'bull_rsi_required': True, 'bear_strategy': 'mean_reversion', 'bear_bb_std_mult': 1.4640945444375044, 'bear_rsi_os': 47, 'bear_rsi_ob': 46, 'bear_adx_thresh': 10.225269778121723, 'bear_atr_min_pct': 0.009149104562311123, 'bear_atr_max_pct': 0.0636041298033601, 'bear_tp_mult': 1.2241259017648856, 'bear_tsl_mult': 0.5506599545177744, 'bear_time_stop': 67, 'bear_use_sma': False, 'bear_use_ema': False, 'bear_use_atr': True, 'bear_use_adx': False, 'bear_use_spike': False, 'bear_rsi_required': False, 'sideways_strategy': 'mean_reversion', 'sideways_bb_std_mult': 1.1314729612014482, 'sideways_rsi_os': 30, 'sideways_rsi_ob': 62, 'sideways_adx_thresh': 33.22986575490561, 'sideways_atr_min_pct': 0.02843647316196259, 'sideways_atr_max_pct': 0.032273571727059594, 'sideways_tp_mult': 2.4786238040683854, 'sideways_tsl_mult': 0.9167555618497298, 'sideways_time_stop': 68, 'sideways_use_sma': True, 'sideways_use_ema': False, 'sideways_use_atr': True, 'sideways_use_adx': False, 'sideways_use_spike': True, 'sideways_rsi_required': True}.
[I 2025-09-01 14:07:44,153] Trial 85 finished with values: [-1000000000.0, 1000000000.0] and parameters: {'p_sma': 6, 'p_std': 32, 'p_atr': 12, 'p_adx': 8, 'rsi_period': 75, 'ema1': 30, 'ema2': 57, 'slip_atr_k': 0.06042788267152403, 'slip_spread_k': 0.46174198040830183, 'spread_hl_frac': 0.038014831167156586, 'bb_std_mult': 2.193308612663022, 'rsi_os': 5, 'rsi_ob': 69, 'vol_spike': 0.014420434390982766, 'adx_thresh': 28.43677076830547, 'atr_min_pct': 0.00676338999032004, 'atr_max_pct': 0.07633872968738707, 'tp_mult': 2.3398467150732354, 'tsl_mult': 0.5931355449053013, 'strategy': 'mean_reversion', 'time_stop': 61, 'use_sma': True, 'use_atr': False, 'use_adx': True, 'use_ema': False, 'use_spike': False, 'rsi_required': True, 'edge_k': 0.7425527338479245, 'edge_cap': 0.9562545010724485, 'bull_strategy': 'mean_reversion', 'bull_bb_std_mult': 1.2947582790158534, 'bull_rsi_os': 19, 'bull_rsi_ob': 59, 'bull_adx_thresh': 33.83605288747561, 'bull_atr_min_pct': 0.02446569964859177, 'bull_atr_max_pct': 0.07492825328080677, 'bull_tp_mult': 1.8656121568149677, 'bull_tsl_mult': 0.9606176296675262, 'bull_time_stop': 24, 'bull_use_sma': False, 'bull_use_ema': True, 'bull_use_atr': True, 'bull_use_adx': True, 'bull_use_spike': False, 'bull_rsi_required': True, 'bear_strategy': 'breakout', 'bear_bb_std_mult': 1.9241484234358854, 'bear_rsi_os': 47, 'bear_rsi_ob': 46, 'bear_adx_thresh': 21.1973833969265, 'bear_atr_min_pct': 0.0046744392415953035, 'bear_atr_max_pct': 0.06296446284313548, 'bear_tp_mult': 1.5949930448012752, 'bear_tsl_mult': 0.499021091639956, 'bear_time_stop': 60, 'bear_use_sma': False, 'bear_use_ema': False, 'bear_use_atr': True, 'bear_use_adx': False, 'bear_use_spike': False, 'bear_rsi_required': True, 'sideways_strategy': 'mean_reversion', 'sideways_bb_std_mult': 1.1546269926184825, 'sideways_rsi_os': 32, 'sideways_rsi_ob': 74, 'sideways_adx_thresh': 33.41257092086747, 'sideways_atr_min_pct': 0.01435482242298038, 'sideways_atr_max_pct': 0.015809780661339687, 'sideways_tp_mult': 1.426771412122088, 'sideways_tsl_mult': 0.5150919203001746, 'sideways_time_stop': 143, 'sideways_use_sma': True, 'sideways_use_ema': False, 'sideways_use_atr': True, 'sideways_use_adx': True, 'sideways_use_spike': True, 'sideways_rsi_required': False}.
[I 2025-09-01 14:07:44,378] Trial 82 finished with values: [-1000000000.0, 1000000000.0] and parameters: {'p_sma': 22, 'p_std': 9, 'p_atr': 12, 'p_adx': 8, 'rsi_period': 75, 'ema1': 27, 'ema2': 21, 'slip_atr_k': 0.060313631338683976, 'slip_spread_k': 0.4765451608983964, 'spread_hl_frac': 0.04753306681403661, 'bb_std_mult': 2.6831156162825884, 'rsi_os': 31, 'rsi_ob': 93, 'vol_spike': 0.04411397972194162, 'adx_thresh': 26.510899981642385, 'atr_min_pct': 0.007866905942216526, 'atr_max_pct': 0.07884401752651149, 'tp_mult': 1.6336508674758143, 'tsl_mult': 0.5986757075993397, 'strategy': 'breakout', 'time_stop': 119, 'use_sma': False, 'use_atr': False, 'use_adx': False, 'use_ema': False, 'use_spike': False, 'rsi_required': True, 'edge_k': 0.3141311325169005, 'edge_cap': 0.8845670415285986, 'bull_strategy': 'mean_reversion', 'bull_bb_std_mult': 1.3159291646050422, 'bull_rsi_os': 18, 'bull_rsi_ob': 60, 'bull_adx_thresh': 28.303037174054005, 'bull_atr_min_pct': 0.02990038360460858, 'bull_atr_max_pct': 0.07413358567256267, 'bull_tp_mult': 2.1016837924686547, 'bull_tsl_mult': 0.9457656660217276, 'bull_time_stop': 40, 'bull_use_sma': False, 'bull_use_ema': True, 'bull_use_atr': False, 'bull_use_adx': True, 'bull_use_spike': False, 'bull_rsi_required': True, 'bear_strategy': 'breakout', 'bear_bb_std_mult': 1.9275845242362948, 'bear_rsi_os': 18, 'bear_rsi_ob': 46, 'bear_adx_thresh': 17.741107485666397, 'bear_atr_min_pct': 0.009043595759978217, 'bear_atr_max_pct': 0.030202324171056193, 'bear_tp_mult': 1.6089725087744806, 'bear_tsl_mult': 0.5586559484275069, 'bear_time_stop': 258, 'bear_use_sma': False, 'bear_use_ema': False, 'bear_use_atr': True, 'bear_use_adx': False, 'bear_use_spike': False, 'bear_rsi_required': True, 'sideways_strategy': 'mean_reversion', 'sideways_bb_std_mult': 1.1724622921413326, 'sideways_rsi_os': 31, 'sideways_rsi_ob': 74, 'sideways_adx_thresh': 33.47932411268512, 'sideways_atr_min_pct': 0.029066625530749235, 'sideways_atr_max_pct': 0.031733738710692946, 'sideways_tp_mult': 2.730834405733717, 'sideways_tsl_mult': 0.9158834096155759, 'sideways_time_stop': 141, 'sideways_use_sma': True, 'sideways_use_ema': False, 'sideways_use_atr': True, 'sideways_use_adx': True, 'sideways_use_spike': True, 'sideways_rsi_required': True}.
[I 2025-09-01 14:08:20,712] Trial 86 finished with values: [-0.005188568499150059, 0.014446384827828118] and parameters: {'p_sma': 18, 'p_std': 9, 'p_atr': 12, 'p_adx': 13, 'rsi_period': 66, 'ema1': 30, 'ema2': 21, 'slip_atr_k': 0.0031160675323742004, 'slip_spread_k': 0.42062100941541436, 'spread_hl_frac': 0.00956253504642187, 'bb_std_mult': 1.561550630023193, 'rsi_os': 22, 'rsi_ob': 79, 'vol_spike': 0.0813916086320471, 'adx_thresh': 28.689559246890834, 'atr_min_pct': 0.0084291929002594, 'atr_max_pct': 0.07682505717695697, 'tp_mult': 1.6848002927934689, 'tsl_mult': 0.4320360900094917, 'strategy': 'mean_reversion', 'time_stop': 61, 'use_sma': True, 'use_atr': False, 'use_adx': True, 'use_ema': False, 'use_spike': False, 'rsi_required': True, 'edge_k': 0.7637235967353639, 'edge_cap': 0.9660983051756191, 'bull_strategy': 'breakout', 'bull_bb_std_mult': 1.337680488695409, 'bull_rsi_os': 19, 'bull_rsi_ob': 58, 'bull_adx_thresh': 34.89997027942097, 'bull_atr_min_pct': 0.024171026381549058, 'bull_atr_max_pct': 0.07550181720463377, 'bull_tp_mult': 1.2966345281965608, 'bull_tsl_mult': 0.7866025030949582, 'bull_time_stop': 250, 'bull_use_sma': False, 'bull_use_ema': False, 'bull_use_atr': True, 'bull_use_adx': True, 'bull_use_spike': False, 'bull_rsi_required': True, 'bear_strategy': 'breakout', 'bear_bb_std_mult': 1.3516525868237919, 'bear_rsi_os': 51, 'bear_rsi_ob': 88, 'bear_adx_thresh': 20.485015794319725, 'bear_atr_min_pct': 0.004673532487178323, 'bear_atr_max_pct': 0.06336156579305918, 'bear_tp_mult': 1.8582120213422288, 'bear_tsl_mult': 0.6024336662834876, 'bear_time_stop': 64, 'bear_use_sma': False, 'bear_use_ema': False, 'bear_use_atr': False, 'bear_use_adx': False, 'bear_use_spike': False, 'bear_rsi_required': True, 'sideways_strategy': 'mean_reversion', 'sideways_bb_std_mult': 1.2425770656054063, 'sideways_rsi_os': 28, 'sideways_rsi_ob': 74, 'sideways_adx_thresh': 33.36963632726634, 'sideways_atr_min_pct': 0.013093768243778624, 'sideways_atr_max_pct': 0.04076753706232469, 'sideways_tp_mult': 2.5875040842045838, 'sideways_tsl_mult': 0.8522848356456554, 'sideways_time_stop': 142, 'sideways_use_sma': True, 'sideways_use_ema': False, 'sideways_use_atr': False, 'sideways_use_adx': True, 'sideways_use_spike': False, 'sideways_rsi_required': False}.
[I 2025-09-01 14:08:21,785] Trial 89 finished with values: [-1000000000.0, 1000000000.0] and parameters: {'p_sma': 29, 'p_std': 49, 'p_atr': 10, 'p_adx': 10, 'rsi_period': 7, 'ema1': 25, 'ema2': 41, 'slip_atr_k': 0.15801632024447737, 'slip_spread_k': 0.1581763960406194, 'spread_hl_frac': 0.007577784029066854, 'bb_std_mult': 1.5130094281602489, 'rsi_os': 25, 'rsi_ob': 78, 'vol_spike': 0.08192999572600655, 'adx_thresh': 27.430458814446922, 'atr_min_pct': 0.02995465963156762, 'atr_max_pct': 0.061081279024579126, 'tp_mult': 2.237428285372317, 'tsl_mult': 0.43481876616470055, 'strategy': 'breakout', 'time_stop': 76, 'use_sma': True, 'use_atr': False, 'use_adx': True, 'use_ema': True, 'use_spike': True, 'rsi_required': True, 'edge_k': 0.6372452378410565, 'edge_cap': 0.8811119623658867, 'bull_strategy': 'breakout', 'bull_bb_std_mult': 1.5939656061982146, 'bull_rsi_os': 14, 'bull_rsi_ob': 47, 'bull_adx_thresh': 9.65103177516048, 'bull_atr_min_pct': 0.0034238793566682075, 'bull_atr_max_pct': 0.01806295146966122, 'bull_tp_mult': 1.3103584474282213, 'bull_tsl_mult': 0.7820754064594584, 'bull_time_stop': 56, 'bull_use_sma': True, 'bull_use_ema': False, 'bull_use_atr': False, 'bull_use_adx': True, 'bull_use_spike': True, 'bull_rsi_required': False, 'bear_strategy': 'breakout', 'bear_bb_std_mult': 3.3566497715678265, 'bear_rsi_os': 51, 'bear_rsi_ob': 87, 'bear_adx_thresh': 27.394129556205183, 'bear_atr_min_pct': 0.022804295890456964, 'bear_atr_max_pct': 0.014985293763619775, 'bear_tp_mult': 1.8523369715499753, 'bear_tsl_mult': 0.8638800421877582, 'bear_time_stop': 235, 'bear_use_sma': True, 'bear_use_ema': True, 'bear_use_atr': False, 'bear_use_adx': True, 'bear_use_spike': False, 'bear_rsi_required': True, 'sideways_strategy': 'mean_reversion', 'sideways_bb_std_mult': 1.2683737502556536, 'sideways_rsi_os': 27, 'sideways_rsi_ob': 91, 'sideways_adx_thresh': 12.997785681504801, 'sideways_atr_min_pct': 0.018198379600927003, 'sideways_atr_max_pct': 0.03981774639045373, 'sideways_tp_mult': 2.389814253126883, 'sideways_tsl_mult': 0.7746703301138766, 'sideways_time_stop': 45, 'sideways_use_sma': True, 'sideways_use_ema': True, 'sideways_use_atr': False, 'sideways_use_adx': True, 'sideways_use_spike': False, 'sideways_rsi_required': False}.
[I 2025-09-01 14:08:22,092] Trial 87 finished with values: [-1000000000.0, 1000000000.0] and parameters: {'p_sma': 17, 'p_std': 9, 'p_atr': 12, 'p_adx': 19, 'rsi_period': 41, 'ema1': 30, 'ema2': 41, 'slip_atr_k': 0.2104710681150831, 'slip_spread_k': 0.4289172016044163, 'spread_hl_frac': 0.01931809528444308, 'bb_std_mult': 2.1548995876208914, 'rsi_os': 26, 'rsi_ob': 78, 'vol_spike': 0.01901601261094822, 'adx_thresh': 28.866866544151932, 'atr_min_pct': 0.02847930212198011, 'atr_max_pct': 0.0776591707780847, 'tp_mult': 2.219179005368244, 'tsl_mult': 0.8391113461627638, 'strategy': 'breakout', 'time_stop': 178, 'use_sma': True, 'use_atr': False, 'use_adx': True, 'use_ema': False, 'use_spike': True, 'rsi_required': True, 'edge_k': 0.7482826707132147, 'edge_cap': 0.9493955022809544, 'bull_strategy': 'breakout', 'bull_bb_std_mult': 2.7374168197336535, 'bull_rsi_os': 19, 'bull_rsi_ob': 58, 'bull_adx_thresh': 33.97974986096064, 'bull_atr_min_pct': 0.0249302938628735, 'bull_atr_max_pct': 0.07354853962344501, 'bull_tp_mult': 1.9430972471123518, 'bull_tsl_mult': 0.9929689033240701, 'bull_time_stop': 54, 'bull_use_sma': True, 'bull_use_ema': False, 'bull_use_atr': False, 'bull_use_adx': True, 'bull_use_spike': False, 'bull_rsi_required': False, 'bear_strategy': 'breakout', 'bear_bb_std_mult': 1.9301855525492193, 'bear_rsi_os': 5, 'bear_rsi_ob': 50, 'bear_adx_thresh': 28.34858136534401, 'bear_atr_min_pct': 0.004828323285946704, 'bear_atr_max_pct': 0.014871287548574474, 'bear_tp_mult': 2.00017849422195, 'bear_tsl_mult': 0.923198234105618, 'bear_time_stop': 148, 'bear_use_sma': False, 'bear_use_ema': True, 'bear_use_atr': False, 'bear_use_adx': False, 'bear_use_spike': False, 'bear_rsi_required': True, 'sideways_strategy': 'mean_reversion', 'sideways_bb_std_mult': 1.0611391404386352, 'sideways_rsi_os': 28, 'sideways_rsi_ob': 75, 'sideways_adx_thresh': 13.268390487343044, 'sideways_atr_min_pct': 0.012575154721015183, 'sideways_atr_max_pct': 0.10563848061673334, 'sideways_tp_mult': 2.598995881711332, 'sideways_tsl_mult': 0.7726302549482663, 'sideways_time_stop': 44, 'sideways_use_sma': True, 'sideways_use_ema': True, 'sideways_use_atr': False, 'sideways_use_adx': True, 'sideways_use_spike': False, 'sideways_rsi_required': False}.
[I 2025-09-01 14:08:22,267] Trial 88 finished with values: [-1000000000.0, 1000000000.0] and parameters: {'p_sma': 57, 'p_std': 49, 'p_atr': 11, 'p_adx': 13, 'rsi_period': 7, 'ema1': 25, 'ema2': 39, 'slip_atr_k': 0.21359758683048488, 'slip_spread_k': 0.503386796052204, 'spread_hl_frac': 0.03435351804494266, 'bb_std_mult': 2.563368604904591, 'rsi_os': 22, 'rsi_ob': 78, 'vol_spike': 0.28209302580041634, 'adx_thresh': 5.086164355998877, 'atr_min_pct': 0.028525675720147553, 'atr_max_pct': 0.06117600895278531, 'tp_mult': 2.598621398275395, 'tsl_mult': 0.4229192350632796, 'strategy': 'breakout', 'time_stop': 176, 'use_sma': True, 'use_atr': False, 'use_adx': True, 'use_ema': True, 'use_spike': True, 'rsi_required': True, 'edge_k': 0.6440174294319524, 'edge_cap': 0.8771653569393822, 'bull_strategy': 'breakout', 'bull_bb_std_mult': 2.3034855915396077, 'bull_rsi_os': 14, 'bull_rsi_ob': 47, 'bull_adx_thresh': 11.857433991338466, 'bull_atr_min_pct': 0.005958981618284157, 'bull_atr_max_pct': 0.022017021353479844, 'bull_tp_mult': 1.2872326434527908, 'bull_tsl_mult': 0.7927761570878561, 'bull_time_stop': 53, 'bull_use_sma': True, 'bull_use_ema': False, 'bull_use_atr': False, 'bull_use_adx': True, 'bull_use_spike': True, 'bull_rsi_required': False, 'bear_strategy': 'breakout', 'bear_bb_std_mult': 3.445041173344866, 'bear_rsi_os': 5, 'bear_rsi_ob': 50, 'bear_adx_thresh': 27.53529022621739, 'bear_atr_min_pct': 0.007377648504418801, 'bear_atr_max_pct': 0.021239382346559126, 'bear_tp_mult': 1.8589351127432252, 'bear_tsl_mult': 0.5928039154292836, 'bear_time_stop': 290, 'bear_use_sma': True, 'bear_use_ema': True, 'bear_use_atr': False, 'bear_use_adx': True, 'bear_use_spike': False, 'bear_rsi_required': True, 'sideways_strategy': 'mean_reversion', 'sideways_bb_std_mult': 1.6187863671857996, 'sideways_rsi_os': 27, 'sideways_rsi_ob': 77, 'sideways_adx_thresh': 12.92908988802167, 'sideways_atr_min_pct': 0.012668425952217788, 'sideways_atr_max_pct': 0.0414402949314379, 'sideways_tp_mult': 2.6062655552980742, 'sideways_tsl_mult': 0.7728770320707782, 'sideways_time_stop': 48, 'sideways_use_sma': True, 'sideways_use_ema': True, 'sideways_use_atr': False, 'sideways_use_adx': True, 'sideways_use_spike': False, 'sideways_rsi_required': False}.
