[I 2025-09-01 14:45:51,874] Trial 324 finished with values: [-1000000000.0, 1000000000.0] and parameters: {'p_sma': 17, 'p_std': 42, 'p_atr': 29, 'p_adx': 21, 'rsi_period': 66, 'ema1': 30, 'ema2': 44, 'slip_atr_k': 0.027600983299613788, 'slip_spread_k': 0.42393723771904834, 'spread_hl_frac': 0.04276809022824764, 'bb_std_mult': 2.622115698795085, 'rsi_os': 10, 'rsi_ob': 59, 'vol_spike': 0.01857021095957577, 'adx_thresh': 27.13102989366812, 'atr_min_pct': 0.0012770745766254917, 'atr_max_pct': 0.07540108501893333, 'tp_mult': 2.313658337560183, 'tsl_mult': 0.5626131064881746, 'strategy': 'breakout', 'time_stop': 203, 'use_sma': False, 'use_atr': False, 'use_adx': True, 'use_ema': True, 'use_spike': True, 'rsi_required': False, 'edge_k': 0.49134978155445863, 'edge_cap': 0.8982059545608931, 'bull_strategy': 'mean_reversion', 'bull_bb_std_mult': 1.2100186623092866, 'bull_rsi_os': 34, 'bull_rsi_ob': 52, 'bull_adx_thresh': 10.869776139473863, 'bull_atr_min_pct': 0.008531358534863778, 'bull_atr_max_pct': 0.139097641871501, 'bull_tp_mult': 1.0117244935506826, 'bull_tsl_mult': 0.9142467877775929, 'bull_time_stop': 37, 'bull_use_sma': False, 'bull_use_ema': True, 'bull_use_atr': False, 'bull_use_adx': True, 'bull_use_spike': True, 'bull_rsi_required': False, 'bear_strategy': 'breakout', 'bear_bb_std_mult': 1.9959839377031823, 'bear_rsi_os': 7, 'bear_rsi_ob': 45, 'bear_adx_thresh': 25.790164449120887, 'bear_atr_min_pct': 0.02908430212451109, 'bear_atr_max_pct': 0.09668013432559433, 'bear_tp_mult': 1.0665056606083363, 'bear_tsl_mult': 0.024674070152542804, 'bear_time_stop': 232, 'bear_use_sma': False, 'bear_use_ema': True, 'bear_use_atr': False, 'bear_use_adx': False, 'bear_use_spike': False, 'bear_rsi_required': False, 'sideways_strategy': 'breakout', 'sideways_bb_std_mult': 3.5971002106455474, 'sideways_rsi_os': 21, 'sideways_rsi_ob': 74, 'sideways_adx_thresh': 34.44218619446998, 'sideways_atr_min_pct': 0.017213595231639983, 'sideways_atr_max_pct': 0.03835785989710514, 'sideways_tp_mult': 2.634618970308934, 'sideways_tsl_mult': 0.8939194737214224, 'sideways_time_stop': 90, 'sideways_use_sma': True, 'sideways_use_ema': True, 'sideways_use_atr': True, 'sideways_use_adx': True, 'sideways_use_spike': False, 'sideways_rsi_required': True}.
[I 2025-09-01 14:45:52,223] Trial 325 finished with values: [-1000000000.0, 1000000000.0] and parameters: {'p_sma': 27, 'p_std': 11, 'p_atr': 13, 'p_adx': 21, 'rsi_period': 43, 'ema1': 30, 'ema2': 37, 'slip_atr_k': 0.0328669010101801, 'slip_spread_k': 0.1470034459828194, 'spread_hl_frac': 0.0428652120503118, 'bb_std_mult': 3.111247473452554, 'rsi_os': 10, 'rsi_ob': 68, 'vol_spike': 0.02190736352227362, 'adx_thresh': 10.222973744532998, 'atr_min_pct': 0.0013693460983058882, 'atr_max_pct': 0.06058379646587585, 'tp_mult': 2.7829801190088617, 'tsl_mult': 0.555697304095659, 'strategy': 'breakout', 'time_stop': 142, 'use_sma': True, 'use_atr': False, 'use_adx': True, 'use_ema': True, 'use_spike': False, 'rsi_required': True, 'edge_k': 1.3233935721016739, 'edge_cap': 0.9978127689775473, 'bull_strategy': 'mean_reversion', 'bull_bb_std_mult': 1.3698432309115138, 'bull_rsi_os': 32, 'bull_rsi_ob': 82, 'bull_adx_thresh': 16.800802613555167, 'bull_atr_min_pct': 0.012559666623479505, 'bull_atr_max_pct': 0.03996519359760695, 'bull_tp_mult': 1.7945013178975016, 'bull_tsl_mult': 0.884709295581902, 'bull_time_stop': 5, 'bull_use_sma': False, 'bull_use_ema': False, 'bull_use_atr': False, 'bull_use_adx': False, 'bull_use_spike': False, 'bull_rsi_required': True, 'bear_strategy': 'mean_reversion', 'bear_bb_std_mult': 1.9922588678383635, 'bear_rsi_os': 39, 'bear_rsi_ob': 65, 'bear_adx_thresh': 16.389917280379624, 'bear_atr_min_pct': 0.025940745633907303, 'bear_atr_max_pct': 0.06131848498797018, 'bear_tp_mult': 1.6641992039328874, 'bear_tsl_mult': 0.7028024707516077, 'bear_time_stop': 95, 'bear_use_sma': False, 'bear_use_ema': True, 'bear_use_atr': True, 'bear_use_adx': True, 'bear_use_spike': False, 'bear_rsi_required': True, 'sideways_strategy': 'breakout', 'sideways_bb_std_mult': 3.0175944416361418, 'sideways_rsi_os': 49, 'sideways_rsi_ob': 74, 'sideways_adx_thresh': 12.784998473358431, 'sideways_atr_min_pct': 0.01856508731991335, 'sideways_atr_max_pct': 0.05026353423048647, 'sideways_tp_mult': 1.4665177379383323, 'sideways_tsl_mult': 0.8429688492135244, 'sideways_time_stop': 89, 'sideways_use_sma': False, 'sideways_use_ema': True, 'sideways_use_atr': True, 'sideways_use_adx': False, 'sideways_use_spike': True, 'sideways_rsi_required': True}.
[I 2025-09-01 14:45:52,540] Trial 326 finished with values: [-1000000000.0, 1000000000.0] and parameters: {'p_sma': 27, 'p_std': 11, 'p_atr': 12, 'p_adx': 15, 'rsi_period': 78, 'ema1': 30, 'ema2': 49, 'slip_atr_k': 0.03642459701301198, 'slip_spread_k': 0.5029033507367145, 'spread_hl_frac': 0.0428761954004272, 'bb_std_mult': 1.3318314385110288, 'rsi_os': 10, 'rsi_ob': 68, 'vol_spike': 0.19427564101974482, 'adx_thresh': 11.659916307997475, 'atr_min_pct': 0.009828485058584548, 'atr_max_pct': 0.047436061408311594, 'tp_mult': 2.78414571265275, 'tsl_mult': 0.2597533193195289, 'strategy': 'breakout', 'time_stop': 264, 'use_sma': True, 'use_atr': False, 'use_adx': True, 'use_ema': True, 'use_spike': False, 'rsi_required': True, 'edge_k': 0.5064639397318882, 'edge_cap': 0.9101265104812006, 'bull_strategy': 'mean_reversion', 'bull_bb_std_mult': 2.5944481898391616, 'bull_rsi_os': 32, 'bull_rsi_ob': 56, 'bull_adx_thresh': 27.026288168330364, 'bull_atr_min_pct': 0.018358666966194963, 'bull_atr_max_pct': 0.04001461412769487, 'bull_tp_mult': 1.0197410504460607, 'bull_tsl_mult': 0.6005699644105691, 'bull_time_stop': 126, 'bull_use_sma': False, 'bull_use_ema': False, 'bull_use_atr': False, 'bull_use_adx': False, 'bull_use_spike': False, 'bull_rsi_required': True, 'bear_strategy': 'mean_reversion', 'bear_bb_std_mult': 1.9126688408484438, 'bear_rsi_os': 26, 'bear_rsi_ob': 53, 'bear_adx_thresh': 18.60212433864137, 'bear_atr_min_pct': 0.00894747564589694, 'bear_atr_max_pct': 0.1384599330832433, 'bear_tp_mult': 1.7769260707495549, 'bear_tsl_mult': 0.5396588266393048, 'bear_time_stop': 94, 'bear_use_sma': False, 'bear_use_ema': True, 'bear_use_atr': True, 'bear_use_adx': True, 'bear_use_spike': False, 'bear_rsi_required': True, 'sideways_strategy': 'breakout', 'sideways_bb_std_mult': 2.2674777306357488, 'sideways_rsi_os': 32, 'sideways_rsi_ob': 92, 'sideways_adx_thresh': 34.47300931890727, 'sideways_atr_min_pct': 0.0020978808655989552, 'sideways_atr_max_pct': 0.14383132999214462, 'sideways_tp_mult': 1.4748148023066605, 'sideways_tsl_mult': 0.8481721906455022, 'sideways_time_stop': 87, 'sideways_use_sma': False, 'sideways_use_ema': True, 'sideways_use_atr': True, 'sideways_use_adx': False, 'sideways_use_spike': True, 'sideways_rsi_required': True}.
[I 2025-09-01 14:46:26,176] Trial 329 finished with values: [-1000000000.0, 1000000000.0] and parameters: {'p_sma': 20, 'p_std': 46, 'p_atr': 14, 'p_adx': 22, 'rsi_period': 64, 'ema1': 27, 'ema2': 24, 'slip_atr_k': 0.22645545045654883, 'slip_spread_k': 0.48666700011853703, 'spread_hl_frac': 0.04039171314646684, 'bb_std_mult': 1.5979452123385978, 'rsi_os': 5, 'rsi_ob': 72, 'vol_spike': 0.21885114674249448, 'adx_thresh': 26.088354374787635, 'atr_min_pct': 0.014574123572529504, 'atr_max_pct': 0.11494468588126905, 'tp_mult': 2.654794020168572, 'tsl_mult': 0.9488128749433868, 'strategy': 'breakout', 'time_stop': 69, 'use_sma': True, 'use_atr': False, 'use_adx': False, 'use_ema': False, 'use_spike': False, 'rsi_required': True, 'edge_k': 0.0998736897387158, 'edge_cap': 0.9659792397406365, 'bull_strategy': 'breakout', 'bull_bb_std_mult': 2.907574146389536, 'bull_rsi_os': 12, 'bull_rsi_ob': 50, 'bull_adx_thresh': 14.220217498498533, 'bull_atr_min_pct': 0.0029812035212252643, 'bull_atr_max_pct': 0.03987686509993183, 'bull_tp_mult': 1.159334036149884, 'bull_tsl_mult': 0.44691112162201235, 'bull_time_stop': 126, 'bull_use_sma': True, 'bull_use_ema': False, 'bull_use_atr': False, 'bull_use_adx': True, 'bull_use_spike': False, 'bull_rsi_required': True, 'bear_strategy': 'breakout', 'bear_bb_std_mult': 2.2660460214297546, 'bear_rsi_os': 27, 'bear_rsi_ob': 52, 'bear_adx_thresh': 27.033059543164512, 'bear_atr_min_pct': 0.008618000368575244, 'bear_atr_max_pct': 0.0132163641514528, 'bear_tp_mult': 2.8090806072869934, 'bear_tsl_mult': 0.25720181283577104, 'bear_time_stop': 243, 'bear_use_sma': False, 'bear_use_ema': True, 'bear_use_atr': False, 'bear_use_adx': True, 'bear_use_spike': False, 'bear_rsi_required': True, 'sideways_strategy': 'mean_reversion', 'sideways_bb_std_mult': 1.426524696201735, 'sideways_rsi_os': 18, 'sideways_rsi_ob': 91, 'sideways_adx_thresh': 12.09616933343813, 'sideways_atr_min_pct': 0.01791909626714709, 'sideways_atr_max_pct': 0.06770887578124098, 'sideways_tp_mult': 2.681332479624659, 'sideways_tsl_mult': 0.9021817416532631, 'sideways_time_stop': 218, 'sideways_use_sma': True, 'sideways_use_ema': False, 'sideways_use_atr': False, 'sideways_use_adx': True, 'sideways_use_spike': True, 'sideways_rsi_required': False}.
[I 2025-09-01 14:46:26,458] Trial 328 finished with values: [-0.032255816365214574, 0.03282588103457896] and parameters: {'p_sma': 31, 'p_std': 11, 'p_atr': 14, 'p_adx': 15, 'rsi_period': 63, 'ema1': 27, 'ema2': 37, 'slip_atr_k': 0.03720104077623569, 'slip_spread_k': 0.4935887744660999, 'spread_hl_frac': 0.04019983952637444, 'bb_std_mult': 3.243232621596463, 'rsi_os': 5, 'rsi_ob': 61, 'vol_spike': 0.26276963960984534, 'adx_thresh': 30.197742819734238, 'atr_min_pct': 0.009818772986944654, 'atr_max_pct': 0.061168179545835165, 'tp_mult': 2.420785582947861, 'tsl_mult': 0.5542174091025068, 'strategy': 'breakout', 'time_stop': 101, 'use_sma': True, 'use_atr': False, 'use_adx': False, 'use_ema': False, 'use_spike': False, 'rsi_required': True, 'edge_k': 1.3279647418312912, 'edge_cap': 0.8229661945563671, 'bull_strategy': 'breakout', 'bull_bb_std_mult': 2.479822624070012, 'bull_rsi_os': 21, 'bull_rsi_ob': 59, 'bull_adx_thresh': 17.024224162224776, 'bull_atr_min_pct': 0.003230963711610786, 'bull_atr_max_pct': 0.0404851016582015, 'bull_tp_mult': 1.9142455948276138, 'bull_tsl_mult': 0.6157249744904929, 'bull_time_stop': 124, 'bull_use_sma': True, 'bull_use_ema': False, 'bull_use_atr': False, 'bull_use_adx': False, 'bull_use_spike': False, 'bull_rsi_required': True, 'bear_strategy': 'mean_reversion', 'bear_bb_std_mult': 2.227815485310466, 'bear_rsi_os': 28, 'bear_rsi_ob': 46, 'bear_adx_thresh': 16.594264750793702, 'bear_atr_min_pct': 0.005183016392457196, 'bear_atr_max_pct': 0.012484611091676572, 'bear_tp_mult': 2.8061360350782865, 'bear_tsl_mult': 0.702333432077469, 'bear_time_stop': 247, 'bear_use_sma': False, 'bear_use_ema': True, 'bear_use_atr': True, 'bear_use_adx': True, 'bear_use_spike': False, 'bear_rsi_required': True, 'sideways_strategy': 'mean_reversion', 'sideways_bb_std_mult': 2.324295333264098, 'sideways_rsi_os': 49, 'sideways_rsi_ob': 81, 'sideways_adx_thresh': 11.975416925696418, 'sideways_atr_min_pct': 0.017976896570983482, 'sideways_atr_max_pct': 0.04576145251616603, 'sideways_tp_mult': 2.9193377815520387, 'sideways_tsl_mult': 0.9055351160025497, 'sideways_time_stop': 83, 'sideways_use_sma': False, 'sideways_use_ema': False, 'sideways_use_atr': False, 'sideways_use_adx': False, 'sideways_use_spike': True, 'sideways_rsi_required': False}.
[I 2025-09-01 14:46:26,888] Trial 330 finished with values: [-0.03716209781901303, 0.03728318786411087] and parameters: {'p_sma': 20, 'p_std': 21, 'p_atr': 14, 'p_adx': 23, 'rsi_period': 63, 'ema1': 27, 'ema2': 35, 'slip_atr_k': 0.006379352360103527, 'slip_spread_k': 0.8434647679493893, 'spread_hl_frac': 0.04016954301023598, 'bb_std_mult': 2.5118631573131274, 'rsi_os': 6, 'rsi_ob': 73, 'vol_spike': 0.10335658750697152, 'adx_thresh': 29.3283555281132, 'atr_min_pct': 0.006857069272316867, 'atr_max_pct': 0.06951174572828858, 'tp_mult': 2.416987572162008, 'tsl_mult': 0.09397787619462267, 'strategy': 'mean_reversion', 'time_stop': 82, 'use_sma': False, 'use_atr': False, 'use_adx': False, 'use_ema': False, 'use_spike': False, 'rsi_required': True, 'edge_k': 0.9182032314192532, 'edge_cap': 0.672381154083295, 'bull_strategy': 'breakout', 'bull_bb_std_mult': 3.4141018828720573, 'bull_rsi_os': 25, 'bull_rsi_ob': 55, 'bull_adx_thresh': 34.49919106519236, 'bull_atr_min_pct': 0.0018576798176782594, 'bull_atr_max_pct': 0.14857385015323463, 'bull_tp_mult': 1.3362161106063966, 'bull_tsl_mult': 0.8165633834063797, 'bull_time_stop': 233, 'bull_use_sma': True, 'bull_use_ema': True, 'bull_use_atr': True, 'bull_use_adx': True, 'bull_use_spike': False, 'bull_rsi_required': True, 'bear_strategy': 'breakout', 'bear_bb_std_mult': 1.7074345482835538, 'bear_rsi_os': 55, 'bear_rsi_ob': 46, 'bear_adx_thresh': 5.648119732438607, 'bear_atr_min_pct': 0.003923153552807208, 'bear_atr_max_pct': 0.026798517762436327, 'bear_tp_mult': 1.735129698088207, 'bear_tsl_mult': 0.2495981857375163, 'bear_time_stop': 79, 'bear_use_sma': False, 'bear_use_ema': True, 'bear_use_atr': False, 'bear_use_adx': False, 'bear_use_spike': False, 'bear_rsi_required': True, 'sideways_strategy': 'mean_reversion', 'sideways_bb_std_mult': 1.7478508690351686, 'sideways_rsi_os': 34, 'sideways_rsi_ob': 77, 'sideways_adx_thresh': 33.493078393423346, 'sideways_atr_min_pct': 0.017887636927237154, 'sideways_atr_max_pct': 0.08090497971002965, 'sideways_tp_mult': 2.400711859942586, 'sideways_tsl_mult': 0.9016423286735793, 'sideways_time_stop': 80, 'sideways_use_sma': True, 'sideways_use_ema': False, 'sideways_use_atr': False, 'sideways_use_adx': True, 'sideways_use_spike': True, 'sideways_rsi_required': False}.
[I 2025-09-01 14:46:27,176] Trial 327 finished with values: [-1000000000.0, 1000000000.0] and parameters: {'p_sma': 27, 'p_std': 21, 'p_atr': 29, 'p_adx': 21, 'rsi_period': 68, 'ema1': 10, 'ema2': 49, 'slip_atr_k': 0.11294669334781585, 'slip_spread_k': 0.8429292711411385, 'spread_hl_frac': 0.04275523020970694, 'bb_std_mult': 3.26848976833643, 'rsi_os': 10, 'rsi_ob': 63, 'vol_spike': 0.024176191412091378, 'adx_thresh': 13.523299998823129, 'atr_min_pct': 0.009974849130676002, 'atr_max_pct': 0.04696661796633472, 'tp_mult': 1.3261652715901429, 'tsl_mult': 0.554793714230284, 'strategy': 'breakout', 'time_stop': 71, 'use_sma': True, 'use_atr': False, 'use_adx': True, 'use_ema': False, 'use_spike': False, 'rsi_required': True, 'edge_k': 0.5049892908951809, 'edge_cap': 0.971950045157648, 'bull_strategy': 'breakout', 'bull_bb_std_mult': 3.4358332074561346, 'bull_rsi_os': 21, 'bull_rsi_ob': 78, 'bull_adx_thresh': 10.957042124818177, 'bull_atr_min_pct': 0.008351183844315997, 'bull_atr_max_pct': 0.03991842940341, 'bull_tp_mult': 1.0109342830021262, 'bull_tsl_mult': 0.6998540239655859, 'bull_time_stop': 275, 'bull_use_sma': True, 'bull_use_ema': False, 'bull_use_atr': False, 'bull_use_adx': False, 'bull_use_spike': False, 'bull_rsi_required': True, 'bear_strategy': 'mean_reversion', 'bear_bb_std_mult': 3.380699400902687, 'bear_rsi_os': 55, 'bear_rsi_ob': 46, 'bear_adx_thresh': 16.696327458404646, 'bear_atr_min_pct': 0.0037780111809727905, 'bear_atr_max_pct': 0.06013463633827595, 'bear_tp_mult': 2.428268946438823, 'bear_tsl_mult': 0.5359865265374315, 'bear_time_stop': 233, 'bear_use_sma': False, 'bear_use_ema': True, 'bear_use_atr': True, 'bear_use_adx': True, 'bear_use_spike': False, 'bear_rsi_required': True, 'sideways_strategy': 'mean_reversion', 'sideways_bb_std_mult': 1.4357579740465478, 'sideways_rsi_os': 53, 'sideways_rsi_ob': 80, 'sideways_adx_thresh': 34.41106277813323, 'sideways_atr_min_pct': 0.0186516094367893, 'sideways_atr_max_pct': 0.09734091807298163, 'sideways_tp_mult': 2.382931828252725, 'sideways_tsl_mult': 0.5336703701574244, 'sideways_time_stop': 20, 'sideways_use_sma': False, 'sideways_use_ema': True, 'sideways_use_atr': False, 'sideways_use_adx': False, 'sideways_use_spike': True, 'sideways_rsi_required': True}.
[I 2025-09-01 14:47:04,343] Trial 331 finished with values: [-0.020428114531102493, 0.020227801397164517] and parameters: {'p_sma': 25, 'p_std': 29, 'p_atr': 15, 'p_adx': 13, 'rsi_period': 68, 'ema1': 5, 'ema2': 56, 'slip_atr_k': 0.0051915688817128075, 'slip_spread_k': 0.4028360795077987, 'spread_hl_frac': 0.04034313971493652, 'bb_std_mult': 2.34192834184511, 'rsi_os': 28, 'rsi_ob': 94, 'vol_spike': 0.09451018056346115, 'adx_thresh': 17.26075453902921, 'atr_min_pct': 0.00682703987351539, 'atr_max_pct': 0.06761300237108604, 'tp_mult': 2.430096735239374, 'tsl_mult': 0.6167817698595444, 'strategy': 'mean_reversion', 'time_stop': 18, 'use_sma': False, 'use_atr': False, 'use_adx': False, 'use_ema': False, 'use_spike': False, 'rsi_required': True, 'edge_k': 0.6779762211330504, 'edge_cap': 0.6785008798493518, 'bull_strategy': 'breakout', 'bull_bb_std_mult': 1.4442358789630556, 'bull_rsi_os': 24, 'bull_rsi_ob': 59, 'bull_adx_thresh': 34.36653508560294, 'bull_atr_min_pct': 0.001903046467806382, 'bull_atr_max_pct': 0.0687588744530523, 'bull_tp_mult': 1.4212033149850303, 'bull_tsl_mult': 0.821710888074074, 'bull_time_stop': 98, 'bull_use_sma': True, 'bull_use_ema': True, 'bull_use_atr': True, 'bull_use_adx': True, 'bull_use_spike': False, 'bull_rsi_required': True, 'bear_strategy': 'breakout', 'bear_bb_std_mult': 2.1991601225534967, 'bear_rsi_os': 55, 'bear_rsi_ob': 46, 'bear_adx_thresh': 17.041312933816634, 'bear_atr_min_pct': 0.01967321533972393, 'bear_atr_max_pct': 0.04730787565306369, 'bear_tp_mult': 2.4288150538836386, 'bear_tsl_mult': 0.5901265656013178, 'bear_time_stop': 107, 'bear_use_sma': False, 'bear_use_ema': False, 'bear_use_atr': False, 'bear_use_adx': False, 'bear_use_spike': False, 'bear_rsi_required': True, 'sideways_strategy': 'mean_reversion', 'sideways_bb_std_mult': 1.3222125752653302, 'sideways_rsi_os': 53, 'sideways_rsi_ob': 78, 'sideways_adx_thresh': 33.53134599563475, 'sideways_atr_min_pct': 0.012286454554971508, 'sideways_atr_max_pct': 0.0650575135816655, 'sideways_tp_mult': 2.379554958094804, 'sideways_tsl_mult': 0.5340197156523414, 'sideways_time_stop': 19, 'sideways_use_sma': True, 'sideways_use_ema': False, 'sideways_use_atr': False, 'sideways_use_adx': True, 'sideways_use_spike': True, 'sideways_rsi_required': False}.
[I 2025-09-01 14:47:05,484] Trial 334 finished with values: [-1000000000.0, 1000000000.0] and parameters: {'p_sma': 15, 'p_std': 14, 'p_atr': 15, 'p_adx': 13, 'rsi_period': 73, 'ema1': 28, 'ema2': 45, 'slip_atr_k': 0.21059376276250874, 'slip_spread_k': 0.4048674504437447, 'spread_hl_frac': 0.010947500399643257, 'bb_std_mult': 1.447539532742994, 'rsi_os': 7, 'rsi_ob': 88, 'vol_spike': 0.09538908748172778, 'adx_thresh': 28.832013965944327, 'atr_min_pct': 0.012503801939087584, 'atr_max_pct': 0.06544459370896709, 'tp_mult': 2.289259517796954, 'tsl_mult': 0.6178626745477767, 'strategy': 'mean_reversion', 'time_stop': 152, 'use_sma': False, 'use_atr': False, 'use_adx': False, 'use_ema': False, 'use_spike': False, 'rsi_required': True, 'edge_k': 0.6826469653233069, 'edge_cap': 0.5329379045386626, 'bull_strategy': 'breakout', 'bull_bb_std_mult': 1.4298961737523515, 'bull_rsi_os': 18, 'bull_rsi_ob': 92, 'bull_adx_thresh': 7.212663362451548, 'bull_atr_min_pct': 0.022263088191794386, 'bull_atr_max_pct': 0.06879877206109607, 'bull_tp_mult': 2.004366937702488, 'bull_tsl_mult': 0.8820510430319762, 'bull_time_stop': 28, 'bull_use_sma': False, 'bull_use_ema': True, 'bull_use_atr': True, 'bull_use_adx': True, 'bull_use_spike': False, 'bull_rsi_required': True, 'bear_strategy': 'breakout', 'bear_bb_std_mult': 2.355114885288055, 'bear_rsi_os': 43, 'bear_rsi_ob': 75, 'bear_adx_thresh': 14.012150456011248, 'bear_atr_min_pct': 0.019809247969278646, 'bear_atr_max_pct': 0.10372779251366529, 'bear_tp_mult': 1.6302327272044586, 'bear_tsl_mult': 0.5898439866184911, 'bear_time_stop': 66, 'bear_use_sma': False, 'bear_use_ema': False, 'bear_use_atr': False, 'bear_use_adx': False, 'bear_use_spike': False, 'bear_rsi_required': True, 'sideways_strategy': 'mean_reversion', 'sideways_bb_std_mult': 2.8647965141697926, 'sideways_rsi_os': 29, 'sideways_rsi_ob': 56, 'sideways_adx_thresh': 20.287396204149584, 'sideways_atr_min_pct': 0.01642661501886482, 'sideways_atr_max_pct': 0.03568855796966692, 'sideways_tp_mult': 2.6031713473043765, 'sideways_tsl_mult': 0.03135826968481137, 'sideways_time_stop': 111, 'sideways_use_sma': True, 'sideways_use_ema': True, 'sideways_use_atr': False, 'sideways_use_adx': True, 'sideways_use_spike': True, 'sideways_rsi_required': False}.
