[I 2025-09-01 14:17:08,064] Trial 136 finished with values: [-1000000000.0, 1000000000.0] and parameters: {'p_sma': 47, 'p_std': 14, 'p_atr': 11, 'p_adx': 21, 'rsi_period': 28, 'ema1': 5, 'ema2': 40, 'slip_atr_k': 0.0729727167850713, 'slip_spread_k': 0.2007311027037763, 'spread_hl_frac': 0.041008197369999694, 'bb_std_mult': 1.0258226388023144, 'rsi_os': 10, 'rsi_ob': 77, 'vol_spike': 0.2916286620769293, 'adx_thresh': 27.469598725421978, 'atr_min_pct': 0.008959214713115215, 'atr_max_pct': 0.06179839908768335, 'tp_mult': 2.355479053455841, 'tsl_mult': 0.2676095680741256, 'strategy': 'breakout', 'time_stop': 270, 'use_sma': True, 'use_atr': False, 'use_adx': False, 'use_ema': False, 'use_spike': False, 'rsi_required': True, 'edge_k': 1.4656711530783872, 'edge_cap': 0.9688335104651049, 'bull_strategy': 'breakout', 'bull_bb_std_mult': 0.7988312655206942, 'bull_rsi_os': 19, 'bull_rsi_ob': 86, 'bull_adx_thresh': 27.27269141518378, 'bull_atr_min_pct': 0.010179360359789818, 'bull_atr_max_pct': 0.049103004694883816, 'bull_tp_mult': 2.716906506905641, 'bull_tsl_mult': 0.8471362057567074, 'bull_time_stop': 124, 'bull_use_sma': False, 'bull_use_ema': True, 'bull_use_atr': False, 'bull_use_adx': False, 'bull_use_spike': False, 'bull_rsi_required': True, 'bear_strategy': 'breakout', 'bear_bb_std_mult': 1.7609958173050093, 'bear_rsi_os': 43, 'bear_rsi_ob': 45, 'bear_adx_thresh': 17.026643606541718, 'bear_atr_min_pct': 0.01593202326138805, 'bear_atr_max_pct': 0.012802905996705968, 'bear_tp_mult': 1.8447395495872392, 'bear_tsl_mult': 0.10154018758095429, 'bear_time_stop': 93, 'bear_use_sma': False, 'bear_use_ema': True, 'bear_use_atr': False, 'bear_use_adx': False, 'bear_use_spike': False, 'bear_rsi_required': True, 'sideways_strategy': 'mean_reversion', 'sideways_bb_std_mult': 1.3094906350601103, 'sideways_rsi_os': 32, 'sideways_rsi_ob': 93, 'sideways_adx_thresh': 33.57900485235163, 'sideways_atr_min_pct': 0.010210214791625268, 'sideways_atr_max_pct': 0.09339791860333355, 'sideways_tp_mult': 2.3713409427916807, 'sideways_tsl_mult': 0.8232842735553683, 'sideways_time_stop': 70, 'sideways_use_sma': True, 'sideways_use_ema': True, 'sideways_use_atr': False, 'sideways_use_adx': True, 'sideways_use_spike': True, 'sideways_rsi_required': False}.
[I 2025-09-01 14:17:08,350] Trial 135 finished with values: [-1000000000.0, 1000000000.0] and parameters: {'p_sma': 45, 'p_std': 13, 'p_atr': 14, 'p_adx': 21, 'rsi_period': 28, 'ema1': 5, 'ema2': 55, 'slip_atr_k': 0.04572833748331066, 'slip_spread_k': 0.44857589793417585, 'spread_hl_frac': 0.041092608177722666, 'bb_std_mult': 1.0635039573242424, 'rsi_os': 9, 'rsi_ob': 85, 'vol_spike': 0.019823388896516636, 'adx_thresh': 26.48264642054692, 'atr_min_pct': 0.008914516361626108, 'atr_max_pct': 0.08038132570499722, 'tp_mult': 2.3287201852372283, 'tsl_mult': 0.8174282404569244, 'strategy': 'breakout', 'time_stop': 93, 'use_sma': True, 'use_atr': False, 'use_adx': False, 'use_ema': False, 'use_spike': False, 'rsi_required': True, 'edge_k': 0.7129495340837767, 'edge_cap': 0.4357685458795749, 'bull_strategy': 'breakout', 'bull_bb_std_mult': 2.9742341088183553, 'bull_rsi_os': 25, 'bull_rsi_ob': 84, 'bull_adx_thresh': 10.684363777464425, 'bull_atr_min_pct': 0.021739180189192346, 'bull_atr_max_pct': 0.07943083149975225, 'bull_tp_mult': 1.0836608727342762, 'bull_tsl_mult': 0.25459526338771155, 'bull_time_stop': 119, 'bull_use_sma': False, 'bull_use_ema': False, 'bull_use_atr': False, 'bull_use_adx': False, 'bull_use_spike': False, 'bull_rsi_required': True, 'bear_strategy': 'breakout', 'bear_bb_std_mult': 2.719262644126565, 'bear_rsi_os': 27, 'bear_rsi_ob': 46, 'bear_adx_thresh': 16.53667187874137, 'bear_atr_min_pct': 0.004311659189184901, 'bear_atr_max_pct': 0.06725985764737018, 'bear_tp_mult': 2.876839161580251, 'bear_tsl_mult': 0.6046406226976732, 'bear_time_stop': 142, 'bear_use_sma': False, 'bear_use_ema': True, 'bear_use_atr': False, 'bear_use_adx': False, 'bear_use_spike': False, 'bear_rsi_required': True, 'sideways_strategy': 'mean_reversion', 'sideways_bb_std_mult': 0.5038278193121135, 'sideways_rsi_os': 31, 'sideways_rsi_ob': 59, 'sideways_adx_thresh': 14.646332617693261, 'sideways_atr_min_pct': 0.0024761602523695036, 'sideways_atr_max_pct': 0.12918385340694255, 'sideways_tp_mult': 2.8435042062692886, 'sideways_tsl_mult': 0.8183367305897238, 'sideways_time_stop': 269, 'sideways_use_sma': True, 'sideways_use_ema': True, 'sideways_use_atr': False, 'sideways_use_adx': True, 'sideways_use_spike': True, 'sideways_rsi_required': False}.
[I 2025-09-01 14:17:08,604] Trial 137 finished with values: [-1000000000.0, 1000000000.0] and parameters: {'p_sma': 24, 'p_std': 13, 'p_atr': 11, 'p_adx': 19, 'rsi_period': 63, 'ema1': 28, 'ema2': 40, 'slip_atr_k': 0.24148852879864582, 'slip_spread_k': 0.4696453772043494, 'spread_hl_frac': 0.0009706219154073017, 'bb_std_mult': 2.4981162251678812, 'rsi_os': 5, 'rsi_ob': 54, 'vol_spike': 0.07623449757910425, 'adx_thresh': 28.72707120274359, 'atr_min_pct': 0.007328608292504879, 'atr_max_pct': 0.07922926686351842, 'tp_mult': 2.603535100476072, 'tsl_mult': 0.5594199789225395, 'strategy': 'breakout', 'time_stop': 228, 'use_sma': True, 'use_atr': False, 'use_adx': False, 'use_ema': False, 'use_spike': False, 'rsi_required': True, 'edge_k': 1.4946047729825511, 'edge_cap': 0.4334634945033584, 'bull_strategy': 'breakout', 'bull_bb_std_mult': 2.0658731575218914, 'bull_rsi_os': 50, 'bull_rsi_ob': 73, 'bull_adx_thresh': 10.433607470193463, 'bull_atr_min_pct': 0.02619979570297116, 'bull_atr_max_pct': 0.12392549040903839, 'bull_tp_mult': 2.172551064902938, 'bull_tsl_mult': 0.07906191835580778, 'bull_time_stop': 151, 'bull_use_sma': False, 'bull_use_ema': True, 'bull_use_atr': False, 'bull_use_adx': True, 'bull_use_spike': True, 'bull_rsi_required': True, 'bear_strategy': 'breakout', 'bear_bb_std_mult': 1.3343891901671467, 'bear_rsi_os': 27, 'bear_rsi_ob': 46, 'bear_adx_thresh': 8.535231266648314, 'bear_atr_min_pct': 0.010782965438210793, 'bear_atr_max_pct': 0.013818807707199676, 'bear_tp_mult': 1.644467205839418, 'bear_tsl_mult': 0.6052820816107759, 'bear_time_stop': 244, 'bear_use_sma': False, 'bear_use_ema': True, 'bear_use_atr': False, 'bear_use_adx': False, 'bear_use_spike': False, 'bear_rsi_required': True, 'sideways_strategy': 'mean_reversion', 'sideways_bb_std_mult': 1.2801926284495362, 'sideways_rsi_os': 32, 'sideways_rsi_ob': 94, 'sideways_adx_thresh': 33.63567973449828, 'sideways_atr_min_pct': 0.011410531379304372, 'sideways_atr_max_pct': 0.040917346713387696, 'sideways_tp_mult': 1.8879071210645137, 'sideways_tsl_mult': 0.8884254285411959, 'sideways_time_stop': 186, 'sideways_use_sma': True, 'sideways_use_ema': True, 'sideways_use_atr': False, 'sideways_use_adx': True, 'sideways_use_spike': True, 'sideways_rsi_required': False}.
[I 2025-09-01 14:17:08,858] Trial 138 finished with values: [-1000000000.0, 1000000000.0] and parameters: {'p_sma': 44, 'p_std': 13, 'p_atr': 11, 'p_adx': 19, 'rsi_period': 10, 'ema1': 9, 'ema2': 39, 'slip_atr_k': 0.0394892919096112, 'slip_spread_k': 0.4715463896827746, 'spread_hl_frac': 0.0005594332291710899, 'bb_std_mult': 2.112728007280148, 'rsi_os': 9, 'rsi_ob': 85, 'vol_spike': 0.2067258187608288, 'adx_thresh': 28.80549735889207, 'atr_min_pct': 0.007348547622707499, 'atr_max_pct': 0.11877203263357175, 'tp_mult': 2.253441362345353, 'tsl_mult': 0.8936121084704798, 'strategy': 'breakout', 'time_stop': 116, 'use_sma': True, 'use_atr': False, 'use_adx': False, 'use_ema': False, 'use_spike': False, 'rsi_required': True, 'edge_k': 1.1282446050509576, 'edge_cap': 0.11919484978089967, 'bull_strategy': 'breakout', 'bull_bb_std_mult': 2.1670905726869076, 'bull_rsi_os': 48, 'bull_rsi_ob': 74, 'bull_adx_thresh': 27.663558034069986, 'bull_atr_min_pct': 0.02185700074821223, 'bull_atr_max_pct': 0.07633468232404829, 'bull_tp_mult': 2.497708006843648, 'bull_tsl_mult': 0.8381226346285524, 'bull_time_stop': 20, 'bull_use_sma': False, 'bull_use_ema': True, 'bull_use_atr': False, 'bull_use_adx': True, 'bull_use_spike': True, 'bull_rsi_required': True, 'bear_strategy': 'breakout', 'bear_bb_std_mult': 0.8359603961300723, 'bear_rsi_os': 27, 'bear_rsi_ob': 46, 'bear_adx_thresh': 16.048953996302245, 'bear_atr_min_pct': 0.006404994470378264, 'bear_atr_max_pct': 0.07532612431111685, 'bear_tp_mult': 1.7483800649691403, 'bear_tsl_mult': 0.6045877998909467, 'bear_time_stop': 246, 'bear_use_sma': False, 'bear_use_ema': True, 'bear_use_atr': False, 'bear_use_adx': False, 'bear_use_spike': False, 'bear_rsi_required': True, 'sideways_strategy': 'mean_reversion', 'sideways_bb_std_mult': 1.2855843701381546, 'sideways_rsi_os': 32, 'sideways_rsi_ob': 59, 'sideways_adx_thresh': 12.310633211838976, 'sideways_atr_min_pct': 0.010162712137238829, 'sideways_atr_max_pct': 0.033349388355312676, 'sideways_tp_mult': 2.6184369106573864, 'sideways_tsl_mult': 0.9305878387205556, 'sideways_time_stop': 67, 'sideways_use_sma': True, 'sideways_use_ema': True, 'sideways_use_atr': True, 'sideways_use_adx': True, 'sideways_use_spike': True, 'sideways_rsi_required': True}.
[I 2025-09-01 14:17:09,303] Trial 141 finished with values: [-1000000000.0, 1000000000.0] and parameters: {'p_sma': 41, 'p_std': 58, 'p_atr': 17, 'p_adx': 18, 'rsi_period': 73, 'ema1': 14, 'ema2': 39, 'slip_atr_k': 0.04002535470956792, 'slip_spread_k': 0.14157004057286265, 'spread_hl_frac': 0.026502426934160248, 'bb_std_mult': 2.409211709024041, 'rsi_os': 17, 'rsi_ob': 46, 'vol_spike': 0.20480257498160723, 'adx_thresh': 32.18599147828233, 'atr_min_pct': 0.007055458521418425, 'atr_max_pct': 0.04014588692506555, 'tp_mult': 1.7450278028828734, 'tsl_mult': 0.4506616802886788, 'strategy': 'mean_reversion', 'time_stop': 245, 'use_sma': False, 'use_atr': True, 'use_adx': True, 'use_ema': True, 'use_spike': False, 'rsi_required': True, 'edge_k': 1.1304454999888107, 'edge_cap': 0.11561913669892154, 'bull_strategy': 'breakout', 'bull_bb_std_mult': 2.838541470356934, 'bull_rsi_os': 8, 'bull_rsi_ob': 64, 'bull_adx_thresh': 30.853393936339796, 'bull_atr_min_pct': 0.002687174838138864, 'bull_atr_max_pct': 0.07751143604442741, 'bull_tp_mult': 1.2543281021912533, 'bull_tsl_mult': 0.8077726237553373, 'bull_time_stop': 22, 'bull_use_sma': True, 'bull_use_ema': True, 'bull_use_atr': True, 'bull_use_adx': True, 'bull_use_spike': True, 'bull_rsi_required': False, 'bear_strategy': 'breakout', 'bear_bb_std_mult': 1.6446195957954366, 'bear_rsi_os': 52, 'bear_rsi_ob': 48, 'bear_adx_thresh': 6.695735658917093, 'bear_atr_min_pct': 0.006314276107701379, 'bear_atr_max_pct': 0.020983285253055945, 'bear_tp_mult': 1.77007277362639, 'bear_tsl_mult': 0.4791474588593935, 'bear_time_stop': 248, 'bear_use_sma': True, 'bear_use_ema': False, 'bear_use_atr': True, 'bear_use_adx': False, 'bear_use_spike': True, 'bear_rsi_required': True, 'sideways_strategy': 'mean_reversion', 'sideways_bb_std_mult': 1.4968592449575568, 'sideways_rsi_os': 24, 'sideways_rsi_ob': 66, 'sideways_adx_thresh': 34.995526964257564, 'sideways_atr_min_pct': 0.008486999523923282, 'sideways_atr_max_pct': 0.026999024920856332, 'sideways_tp_mult': 1.1408929111880024, 'sideways_tsl_mult': 0.7527918414677139, 'sideways_time_stop': 80, 'sideways_use_sma': True, 'sideways_use_ema': True, 'sideways_use_atr': True, 'sideways_use_adx': True, 'sideways_use_spike': True, 'sideways_rsi_required': True}.
[I 2025-09-01 14:17:09,304] Trial 142 finished with values: [-1000000000.0, 1000000000.0] and parameters: {'p_sma': 26, 'p_std': 10, 'p_atr': 16, 'p_adx': 30, 'rsi_period': 66, 'ema1': 15, 'ema2': 45, 'slip_atr_k': 0.1904564287868912, 'slip_spread_k': 0.16700969021617346, 'spread_hl_frac': 0.038018327594907905, 'bb_std_mult': 1.383175747948202, 'rsi_os': 55, 'rsi_ob': 83, 'vol_spike': 0.08787764626296865, 'adx_thresh': 25.53230645569151, 'atr_min_pct': 0.008549620949517108, 'atr_max_pct': 0.03210415808215924, 'tp_mult': 2.754224451794352, 'tsl_mult': 0.9960787196579537, 'strategy': 'mean_reversion', 'time_stop': 239, 'use_sma': False, 'use_atr': True, 'use_adx': True, 'use_ema': True, 'use_spike': False, 'rsi_required': True, 'edge_k': 1.6842030295651542, 'edge_cap': 0.9391641332278498, 'bull_strategy': 'breakout', 'bull_bb_std_mult': 1.7845738047718724, 'bull_rsi_os': 7, 'bull_rsi_ob': 47, 'bull_adx_thresh': 12.823429076704544, 'bull_atr_min_pct': 0.013857190796661164, 'bull_atr_max_pct': 0.0870260291510897, 'bull_tp_mult': 1.2693475347695005, 'bull_tsl_mult': 0.8086308214800221, 'bull_time_stop': 23, 'bull_use_sma': True, 'bull_use_ema': True, 'bull_use_atr': True, 'bull_use_adx': True, 'bull_use_spike': False, 'bull_rsi_required': False, 'bear_strategy': 'breakout', 'bear_bb_std_mult': 2.0402108793172387, 'bear_rsi_os': 55, 'bear_rsi_ob': 71, 'bear_adx_thresh': 6.470266622807886, 'bear_atr_min_pct': 0.007206000469507743, 'bear_atr_max_pct': 0.03007359514776896, 'bear_tp_mult': 1.5622965760964234, 'bear_tsl_mult': 0.9983722755984759, 'bear_time_stop': 229, 'bear_use_sma': True, 'bear_use_ema': False, 'bear_use_atr': True, 'bear_use_adx': False, 'bear_use_spike': True, 'bear_rsi_required': True, 'sideways_strategy': 'mean_reversion', 'sideways_bb_std_mult': 0.7374521792516178, 'sideways_rsi_os': 25, 'sideways_rsi_ob': 76, 'sideways_adx_thresh': 34.32146729433611, 'sideways_atr_min_pct': 0.00860218770822472, 'sideways_atr_max_pct': 0.025332394433330567, 'sideways_tp_mult': 1.1524889895504953, 'sideways_tsl_mult': 0.7572476038790523, 'sideways_time_stop': 84, 'sideways_use_sma': True, 'sideways_use_ema': False, 'sideways_use_atr': True, 'sideways_use_adx': True, 'sideways_use_spike': False, 'sideways_rsi_required': True}.
[I 2025-09-01 14:17:46,235] Trial 140 finished with values: [-1000000000.0, 1000000000.0] and parameters: {'p_sma': 24, 'p_std': 36, 'p_atr': 24, 'p_adx': 19, 'rsi_period': 63, 'ema1': 9, 'ema2': 39, 'slip_atr_k': 0.03980004204961252, 'slip_spread_k': 0.4316055180575131, 'spread_hl_frac': 0.03187987156968069, 'bb_std_mult': 2.798134743345125, 'rsi_os': 5, 'rsi_ob': 88, 'vol_spike': 0.2759994343421007, 'adx_thresh': 21.76461475550088, 'atr_min_pct': 0.007175018037902326, 'atr_max_pct': 0.03234880731860044, 'tp_mult': 2.7604463080585293, 'tsl_mult': 0.5827911696496112, 'strategy': 'breakout', 'time_stop': 124, 'use_sma': False, 'use_atr': True, 'use_adx': False, 'use_ema': True, 'use_spike': False, 'rsi_required': True, 'edge_k': 0.34040693090103624, 'edge_cap': 0.22003699295482132, 'bull_strategy': 'breakout', 'bull_bb_std_mult': 0.9461597869024867, 'bull_rsi_os': 8, 'bull_rsi_ob': 55, 'bull_adx_thresh': 13.213917748358195, 'bull_atr_min_pct': 0.0028322821748559754, 'bull_atr_max_pct': 0.08629494961313922, 'bull_tp_mult': 1.25534448252391, 'bull_tsl_mult': 0.06235761722154426, 'bull_time_stop': 21, 'bull_use_sma': True, 'bull_use_ema': True, 'bull_use_atr': False, 'bull_use_adx': True, 'bull_use_spike': True, 'bull_rsi_required': False, 'bear_strategy': 'breakout', 'bear_bb_std_mult': 0.8643559486767572, 'bear_rsi_os': 52, 'bear_rsi_ob': 70, 'bear_adx_thresh': 21.485144326051817, 'bear_atr_min_pct': 0.028062901619817636, 'bear_atr_max_pct': 0.013655157347286964, 'bear_tp_mult': 1.5816848553589538, 'bear_tsl_mult': 0.4277584859020245, 'bear_time_stop': 242, 'bear_use_sma': True, 'bear_use_ema': False, 'bear_use_atr': True, 'bear_use_adx': False, 'bear_use_spike': False, 'bear_rsi_required': True, 'sideways_strategy': 'mean_reversion', 'sideways_bb_std_mult': 2.1209371481228505, 'sideways_rsi_os': 26, 'sideways_rsi_ob': 75, 'sideways_adx_thresh': 34.977824433067696, 'sideways_atr_min_pct': 0.01121946726204175, 'sideways_atr_max_pct': 0.0330430801872736, 'sideways_tp_mult': 2.625586367829715, 'sideways_tsl_mult': 0.9239937126970212, 'sideways_time_stop': 206, 'sideways_use_sma': True, 'sideways_use_ema': True, 'sideways_use_atr': True, 'sideways_use_adx': True, 'sideways_use_spike': True, 'sideways_rsi_required': True}.
[I 2025-09-01 14:17:46,765] Trial 139 finished with values: [-1000000000.0, 1000000000.0] and parameters: {'p_sma': 43, 'p_std': 52, 'p_atr': 26, 'p_adx': 24, 'rsi_period': 67, 'ema1': 14, 'ema2': 39, 'slip_atr_k': 0.14781977062254975, 'slip_spread_k': 0.1536562607085168, 'spread_hl_frac': 0.008858001469507423, 'bb_std_mult': 2.7953534750418, 'rsi_os': 5, 'rsi_ob': 46, 'vol_spike': 0.2078755371247971, 'adx_thresh': 28.879945785390326, 'atr_min_pct': 0.007185974036154254, 'atr_max_pct': 0.05757048175634347, 'tp_mult': 2.594394584520146, 'tsl_mult': 0.29960788725750875, 'strategy': 'breakout', 'time_stop': 237, 'use_sma': False, 'use_atr': True, 'use_adx': False, 'use_ema': True, 'use_spike': False, 'rsi_required': True, 'edge_k': 1.6831977226650483, 'edge_cap': 0.919494751849954, 'bull_strategy': 'breakout', 'bull_bb_std_mult': 0.9412001667823, 'bull_rsi_os': 49, 'bull_rsi_ob': 73, 'bull_adx_thresh': 8.75646003268409, 'bull_atr_min_pct': 0.012011259369660457, 'bull_atr_max_pct': 0.023418703953644752, 'bull_tp_mult': 2.1645814312720084, 'bull_tsl_mult': 0.06499557079654861, 'bull_time_stop': 261, 'bull_use_sma': True, 'bull_use_ema': True, 'bull_use_atr': False, 'bull_use_adx': True, 'bull_use_spike': True, 'bull_rsi_required': False, 'bear_strategy': 'breakout', 'bear_bb_std_mult': 0.8446073868575158, 'bear_rsi_os': 52, 'bear_rsi_ob': 61, 'bear_adx_thresh': 7.022393128786057, 'bear_atr_min_pct': 0.010626064083835606, 'bear_atr_max_pct': 0.09506466378934808, 'bear_tp_mult': 1.7541303188493864, 'bear_tsl_mult': 0.9698564415168238, 'bear_time_stop': 246, 'bear_use_sma': True, 'bear_use_ema': False, 'bear_use_atr': True, 'bear_use_adx': False, 'bear_use_spike': False, 'bear_rsi_required': True, 'sideways_strategy': 'mean_reversion', 'sideways_bb_std_mult': 2.1020359465445586, 'sideways_rsi_os': 26, 'sideways_rsi_ob': 75, 'sideways_adx_thresh': 34.572026186029866, 'sideways_atr_min_pct': 0.011232303349920167, 'sideways_atr_max_pct': 0.026342441613131075, 'sideways_tp_mult': 2.546366234550979, 'sideways_tsl_mult': 0.75165783688077, 'sideways_time_stop': 180, 'sideways_use_sma': True, 'sideways_use_ema': True, 'sideways_use_atr': True, 'sideways_use_adx': True, 'sideways_use_spike': True, 'sideways_rsi_required': True}.
[I 2025-09-01 14:17:47,139] Trial 143 finished with values: [-1000000000.0, 1000000000.0] and parameters: {'p_sma': 30, 'p_std': 7, 'p_atr': 24, 'p_adx': 29, 'rsi_period': 67, 'ema1': 26, 'ema2': 42, 'slip_atr_k': 0.09604440183291331, 'slip_spread_k': 0.9085038284971714, 'spread_hl_frac': 0.04305437399604864, 'bb_std_mult': 2.3255131121266626, 'rsi_os': 31, 'rsi_ob': 88, 'vol_spike': 0.08701581287682231, 'adx_thresh': 21.74061961170692, 'atr_min_pct': 0.017764493291683642, 'atr_max_pct': 0.07354715266654263, 'tp_mult': 2.4407046072392435, 'tsl_mult': 0.5224021117144281, 'strategy': 'breakout', 'time_stop': 210, 'use_sma': False, 'use_atr': False, 'use_adx': False, 'use_ema': False, 'use_spike': False, 'rsi_required': True, 'edge_k': 0.5186575774642371, 'edge_cap': 0.3039754813484339, 'bull_strategy': 'breakout', 'bull_bb_std_mult': 0.9398329209258398, 'bull_rsi_os': 54, 'bull_rsi_ob': 55, 'bull_adx_thresh': 17.411645191415772, 'bull_atr_min_pct': 0.015398969780731542, 'bull_atr_max_pct': 0.03541456036652798, 'bull_tp_mult': 2.775287978850734, 'bull_tsl_mult': 0.9064901930980218, 'bull_time_stop': 203, 'bull_use_sma': False, 'bull_use_ema': True, 'bull_use_atr': False, 'bull_use_adx': False, 'bull_use_spike': False, 'bull_rsi_required': True, 'bear_strategy': 'breakout', 'bear_bb_std_mult': 2.0283974321233864, 'bear_rsi_os': 25, 'bear_rsi_ob': 62, 'bear_adx_thresh': 5.275840737069941, 'bear_atr_min_pct': 0.027584773982101733, 'bear_atr_max_pct': 0.09739080399822665, 'bear_tp_mult': 1.814827055160908, 'bear_tsl_mult': 0.5444623390756798, 'bear_time_stop': 33, 'bear_use_sma': False, 'bear_use_ema': True, 'bear_use_atr': True, 'bear_use_adx': False, 'bear_use_spike': False, 'bear_rsi_required': True, 'sideways_strategy': 'mean_reversion', 'sideways_bb_std_mult': 2.5467514878199227, 'sideways_rsi_os': 34, 'sideways_rsi_ob': 49, 'sideways_adx_thresh': 32.21759137030746, 'sideways_atr_min_pct': 0.029905599635517286, 'sideways_atr_max_pct': 0.03653065195183641, 'sideways_tp_mult': 2.5548631293118538, 'sideways_tsl_mult': 0.9081804894433908, 'sideways_time_stop': 132, 'sideways_use_sma': True, 'sideways_use_ema': True, 'sideways_use_atr': False, 'sideways_use_adx': True, 'sideways_use_spike': True, 'sideways_rsi_required': False}.
