[I 2025-09-01 14:30:09,343] Trial 226 finished with values: [-1000000000.0, 1000000000.0] and parameters: {'p_sma': 17, 'p_std': 9, 'p_atr': 23, 'p_adx': 13, 'rsi_period': 66, 'ema1': 29, 'ema2': 23, 'slip_atr_k': 0.006930804349045014, 'slip_spread_k': 0.42060441794162634, 'spread_hl_frac': 0.025609463610862117, 'bb_std_mult': 1.5560236772800744, 'rsi_os': 9, 'rsi_ob': 82, 'vol_spike': 0.03587170778424431, 'adx_thresh': 28.7036043708146, 'atr_min_pct': 0.022446647125388068, 'atr_max_pct': 0.03569654851561076, 'tp_mult': 1.4394479457701463, 'tsl_mult': 0.7836333175822381, 'strategy': 'breakout', 'time_stop': 98, 'use_sma': False, 'use_atr': False, 'use_adx': False, 'use_ema': True, 'use_spike': False, 'rsi_required': True, 'edge_k': 0.4997409319289894, 'edge_cap': 0.9885622962540601, 'bull_strategy': 'breakout', 'bull_bb_std_mult': 1.076944137166791, 'bull_rsi_os': 37, 'bull_rsi_ob': 55, 'bull_adx_thresh': 11.82603786345638, 'bull_atr_min_pct': 0.00756961264877807, 'bull_atr_max_pct': 0.03221776903351127, 'bull_tp_mult': 1.0105607408544532, 'bull_tsl_mult': 0.674466894079242, 'bull_time_stop': 10, 'bull_use_sma': False, 'bull_use_ema': False, 'bull_use_atr': False, 'bull_use_adx': True, 'bull_use_spike': True, 'bull_rsi_required': True, 'bear_strategy': 'breakout', 'bear_bb_std_mult': 3.29536289086054, 'bear_rsi_os': 50, 'bear_rsi_ob': 57, 'bear_adx_thresh': 5.0299041531102615, 'bear_atr_min_pct': 0.00586673990603729, 'bear_atr_max_pct': 0.06071141212981464, 'bear_tp_mult': 1.778098400223715, 'bear_tsl_mult': 0.5843007670828692, 'bear_time_stop': 57, 'bear_use_sma': False, 'bear_use_ema': False, 'bear_use_atr': False, 'bear_use_adx': False, 'bear_use_spike': False, 'bear_rsi_required': True, 'sideways_strategy': 'breakout', 'sideways_bb_std_mult': 0.6981363801769178, 'sideways_rsi_os': 29, 'sideways_rsi_ob': 69, 'sideways_adx_thresh': 34.50949696201775, 'sideways_atr_min_pct': 0.015174907916012644, 'sideways_atr_max_pct': 0.033274957641572886, 'sideways_tp_mult': 2.406533127925284, 'sideways_tsl_mult': 0.9713461901124134, 'sideways_time_stop': 16, 'sideways_use_sma': False, 'sideways_use_ema': True, 'sideways_use_atr': True, 'sideways_use_adx': True, 'sideways_use_spike': True, 'sideways_rsi_required': True}.
[I 2025-09-01 14:30:09,633] Trial 225 finished with values: [-1000000000.0, 1000000000.0] and parameters: {'p_sma': 18, 'p_std': 9, 'p_atr': 12, 'p_adx': 21, 'rsi_period': 72, 'ema1': 29, 'ema2': 58, 'slip_atr_k': 0.16477934466021396, 'slip_spread_k': 0.7071606062477709, 'spread_hl_frac': 0.010892806389610378, 'bb_std_mult': 1.1198114096676526, 'rsi_os': 9, 'rsi_ob': 83, 'vol_spike': 0.22444721729046424, 'adx_thresh': 13.72241805968262, 'atr_min_pct': 0.015273885819156919, 'atr_max_pct': 0.08136680273261578, 'tp_mult': 1.4419930951621565, 'tsl_mult': 0.03143475498384368, 'strategy': 'mean_reversion', 'time_stop': 64, 'use_sma': False, 'use_atr': False, 'use_adx': False, 'use_ema': True, 'use_spike': False, 'rsi_required': True, 'edge_k': 0.496467120122062, 'edge_cap': 0.963935521510961, 'bull_strategy': 'breakout', 'bull_bb_std_mult': 1.0793082221574317, 'bull_rsi_os': 37, 'bull_rsi_ob': 45, 'bull_adx_thresh': 12.466737832367127, 'bull_atr_min_pct': 0.019619940960239828, 'bull_atr_max_pct': 0.014996360952831814, 'bull_tp_mult': 1.1427900348939133, 'bull_tsl_mult': 0.9103756783092267, 'bull_time_stop': 10, 'bull_use_sma': False, 'bull_use_ema': False, 'bull_use_atr': True, 'bull_use_adx': True, 'bull_use_spike': False, 'bull_rsi_required': True, 'bear_strategy': 'breakout', 'bear_bb_std_mult': 2.0772181268737198, 'bear_rsi_os': 54, 'bear_rsi_ob': 57, 'bear_adx_thresh': 6.053937990656403, 'bear_atr_min_pct': 0.0058000895896220175, 'bear_atr_max_pct': 0.10315234696386044, 'bear_tp_mult': 1.771571475540155, 'bear_tsl_mult': 0.5904160156333995, 'bear_time_stop': 225, 'bear_use_sma': False, 'bear_use_ema': True, 'bear_use_atr': False, 'bear_use_adx': False, 'bear_use_spike': False, 'bear_rsi_required': True, 'sideways_strategy': 'mean_reversion', 'sideways_bb_std_mult': 1.3111439104168372, 'sideways_rsi_os': 29, 'sideways_rsi_ob': 71, 'sideways_adx_thresh': 20.03946076947178, 'sideways_atr_min_pct': 0.0167885195779715, 'sideways_atr_max_pct': 0.032777437560717465, 'sideways_tp_mult': 2.640816614980087, 'sideways_tsl_mult': 0.9425113510770695, 'sideways_time_stop': 163, 'sideways_use_sma': True, 'sideways_use_ema': True, 'sideways_use_atr': False, 'sideways_use_adx': True, 'sideways_use_spike': True, 'sideways_rsi_required': False}.
[I 2025-09-01 14:30:53,971] Trial 230 finished with values: [-1000000000.0, 1000000000.0] and parameters: {'p_sma': 15, 'p_std': 20, 'p_atr': 13, 'p_adx': 8, 'rsi_period': 84, 'ema1': 27, 'ema2': 38, 'slip_atr_k': 0.218728925739259, 'slip_spread_k': 0.393356816634501, 'spread_hl_frac': 0.028832228409504577, 'bb_std_mult': 2.644267807581508, 'rsi_os': 8, 'rsi_ob': 86, 'vol_spike': 0.008266023868088994, 'adx_thresh': 20.56689929095405, 'atr_min_pct': 0.0072418325400361114, 'atr_max_pct': 0.09291297480895971, 'tp_mult': 1.3270802364969756, 'tsl_mult': 0.5776682613638564, 'strategy': 'breakout', 'time_stop': 101, 'use_sma': True, 'use_atr': False, 'use_adx': False, 'use_ema': False, 'use_spike': False, 'rsi_required': True, 'edge_k': 0.44591526119576197, 'edge_cap': 0.9379864093629035, 'bull_strategy': 'breakout', 'bull_bb_std_mult': 1.4061835129433877, 'bull_rsi_os': 18, 'bull_rsi_ob': 56, 'bull_adx_thresh': 13.966399728784893, 'bull_atr_min_pct': 0.02992635676135312, 'bull_atr_max_pct': 0.11544812597998533, 'bull_tp_mult': 1.405843704843969, 'bull_tsl_mult': 0.48141494035268273, 'bull_time_stop': 89, 'bull_use_sma': False, 'bull_use_ema': True, 'bull_use_atr': False, 'bull_use_adx': False, 'bull_use_spike': True, 'bull_rsi_required': False, 'bear_strategy': 'breakout', 'bear_bb_std_mult': 0.7768075045772895, 'bear_rsi_os': 52, 'bear_rsi_ob': 46, 'bear_adx_thresh': 28.198571865311308, 'bear_atr_min_pct': 0.006515700997717276, 'bear_atr_max_pct': 0.014318079666548519, 'bear_tp_mult': 1.204216442884974, 'bear_tsl_mult': 0.3833711028534259, 'bear_time_stop': 249, 'bear_use_sma': False, 'bear_use_ema': False, 'bear_use_atr': True, 'bear_use_adx': True, 'bear_use_spike': False, 'bear_rsi_required': True, 'sideways_strategy': 'breakout', 'sideways_bb_std_mult': 1.485402626871669, 'sideways_rsi_os': 52, 'sideways_rsi_ob': 78, 'sideways_adx_thresh': 19.008063076624058, 'sideways_atr_min_pct': 0.017682073107287366, 'sideways_atr_max_pct': 0.07719865535069287, 'sideways_tp_mult': 1.9248046661298552, 'sideways_tsl_mult': 0.906970683068316, 'sideways_time_stop': 75, 'sideways_use_sma': False, 'sideways_use_ema': True, 'sideways_use_atr': True, 'sideways_use_adx': True, 'sideways_use_spike': False, 'sideways_rsi_required': True}.
[I 2025-09-01 14:30:54,302] Trial 227 finished with values: [-1000000000.0, 1000000000.0] and parameters: {'p_sma': 17, 'p_std': 11, 'p_atr': 21, 'p_adx': 24, 'rsi_period': 66, 'ema1': 6, 'ema2': 38, 'slip_atr_k': 0.04070246590414688, 'slip_spread_k': 0.8263008505368952, 'spread_hl_frac': 0.016275783460683445, 'bb_std_mult': 0.7020981228804912, 'rsi_os': 9, 'rsi_ob': 83, 'vol_spike': 0.22220453555693806, 'adx_thresh': 11.186697469946601, 'atr_min_pct': 0.007291876121413141, 'atr_max_pct': 0.06223195329700529, 'tp_mult': 2.3288891301989065, 'tsl_mult': 0.5705544192160819, 'strategy': 'breakout', 'time_stop': 102, 'use_sma': False, 'use_atr': False, 'use_adx': False, 'use_ema': True, 'use_spike': False, 'rsi_required': True, 'edge_k': 0.49211844657496634, 'edge_cap': 0.9823635299953765, 'bull_strategy': 'breakout', 'bull_bb_std_mult': 1.8854831348076888, 'bull_rsi_os': 18, 'bull_rsi_ob': 83, 'bull_adx_thresh': 30.192808997377156, 'bull_atr_min_pct': 0.014994101326558013, 'bull_atr_max_pct': 0.032818108609499914, 'bull_tp_mult': 2.336655219765714, 'bull_tsl_mult': 0.08918710854985157, 'bull_time_stop': 8, 'bull_use_sma': False, 'bull_use_ema': True, 'bull_use_atr': False, 'bull_use_adx': False, 'bull_use_spike': True, 'bull_rsi_required': False, 'bear_strategy': 'breakout', 'bear_bb_std_mult': 2.07439971964304, 'bear_rsi_os': 50, 'bear_rsi_ob': 46, 'bear_adx_thresh': 5.430474923549088, 'bear_atr_min_pct': 0.005641620250358634, 'bear_atr_max_pct': 0.023508040382364544, 'bear_tp_mult': 1.205883398023194, 'bear_tsl_mult': 0.630248648263419, 'bear_time_stop': 59, 'bear_use_sma': False, 'bear_use_ema': False, 'bear_use_atr': True, 'bear_use_adx': False, 'bear_use_spike': False, 'bear_rsi_required': True, 'sideways_strategy': 'breakout', 'sideways_bb_std_mult': 0.9399306480032468, 'sideways_rsi_os': 29, 'sideways_rsi_ob': 67, 'sideways_adx_thresh': 34.26915589571909, 'sideways_atr_min_pct': 0.016781685922005, 'sideways_atr_max_pct': 0.07603580512831147, 'sideways_tp_mult': 2.4777312976010593, 'sideways_tsl_mult': 0.9757992750428961, 'sideways_time_stop': 27, 'sideways_use_sma': False, 'sideways_use_ema': True, 'sideways_use_atr': True, 'sideways_use_adx': True, 'sideways_use_spike': True, 'sideways_rsi_required': True}.
[I 2025-09-01 14:30:55,009] Trial 228 finished with values: [-1000000000.0, 1000000000.0] and parameters: {'p_sma': 25, 'p_std': 11, 'p_atr': 21, 'p_adx': 13, 'rsi_period': 73, 'ema1': 29, 'ema2': 38, 'slip_atr_k': 0.15252944767077298, 'slip_spread_k': 0.6965818243077687, 'spread_hl_frac': 0.04266892589161201, 'bb_std_mult': 1.1204515962264918, 'rsi_os': 36, 'rsi_ob': 86, 'vol_spike': 0.03472399146409836, 'adx_thresh': 11.023227300887857, 'atr_min_pct': 0.015039583784689529, 'atr_max_pct': 0.09235095988687303, 'tp_mult': 2.26517408541443, 'tsl_mult': 0.5802890338091526, 'strategy': 'breakout', 'time_stop': 206, 'use_sma': False, 'use_atr': False, 'use_adx': False, 'use_ema': True, 'use_spike': False, 'rsi_required': True, 'edge_k': 1.0541222660502605, 'edge_cap': 0.9465303307987735, 'bull_strategy': 'breakout', 'bull_bb_std_mult': 1.7055627767194457, 'bull_rsi_os': 43, 'bull_rsi_ob': 53, 'bull_adx_thresh': 12.006319766164873, 'bull_atr_min_pct': 0.02956557220805783, 'bull_atr_max_pct': 0.11627141331126623, 'bull_tp_mult': 1.0378016877564518, 'bull_tsl_mult': 0.1270359877728009, 'bull_time_stop': 88, 'bull_use_sma': False, 'bull_use_ema': True, 'bull_use_atr': False, 'bull_use_adx': False, 'bull_use_spike': True, 'bull_rsi_required': False, 'bear_strategy': 'breakout', 'bear_bb_std_mult': 2.0762150967468913, 'bear_rsi_os': 50, 'bear_rsi_ob': 56, 'bear_adx_thresh': 14.676552872083594, 'bear_atr_min_pct': 0.005732003374758382, 'bear_atr_max_pct': 0.014478494344544072, 'bear_tp_mult': 1.2020030682407514, 'bear_tsl_mult': 0.6320942205030322, 'bear_time_stop': 54, 'bear_use_sma': False, 'bear_use_ema': False, 'bear_use_atr': True, 'bear_use_adx': False, 'bear_use_spike': False, 'bear_rsi_required': True, 'sideways_strategy': 'breakout', 'sideways_bb_std_mult': 0.946825833398667, 'sideways_rsi_os': 28, 'sideways_rsi_ob': 69, 'sideways_adx_thresh': 23.042674967773074, 'sideways_atr_min_pct': 0.016913244327162832, 'sideways_atr_max_pct': 0.039583296812020594, 'sideways_tp_mult': 2.576268932712533, 'sideways_tsl_mult': 0.1395487679718188, 'sideways_time_stop': 89, 'sideways_use_sma': False, 'sideways_use_ema': True, 'sideways_use_atr': True, 'sideways_use_adx': True, 'sideways_use_spike': True, 'sideways_rsi_required': True}.
[I 2025-09-01 14:30:55,238] Trial 229 finished with values: [-1000000000.0, 1000000000.0] and parameters: {'p_sma': 57, 'p_std': 34, 'p_atr': 21, 'p_adx': 24, 'rsi_period': 84, 'ema1': 27, 'ema2': 38, 'slip_atr_k': 0.0002382069182192098, 'slip_spread_k': 0.8196627523499589, 'spread_hl_frac': 0.03927228631481566, 'bb_std_mult': 0.6428188831730222, 'rsi_os': 10, 'rsi_ob': 86, 'vol_spike': 0.007539689034928482, 'adx_thresh': 31.782117372423432, 'atr_min_pct': 0.007312375521647636, 'atr_max_pct': 0.06344186487064393, 'tp_mult': 2.2781266321621945, 'tsl_mult': 0.5738808670166639, 'strategy': 'breakout', 'time_stop': 92, 'use_sma': False, 'use_atr': False, 'use_adx': False, 'use_ema': True, 'use_spike': False, 'rsi_required': True, 'edge_k': 1.4601501952412983, 'edge_cap': 0.9507712412024837, 'bull_strategy': 'breakout', 'bull_bb_std_mult': 1.2407209128162968, 'bull_rsi_os': 18, 'bull_rsi_ob': 53, 'bull_adx_thresh': 34.992011593863566, 'bull_atr_min_pct': 0.018995312169954138, 'bull_atr_max_pct': 0.03763548377285623, 'bull_tp_mult': 1.499642221333659, 'bull_tsl_mult': 0.12896014994432103, 'bull_time_stop': 17, 'bull_use_sma': False, 'bull_use_ema': True, 'bull_use_atr': False, 'bull_use_adx': False, 'bull_use_spike': False, 'bull_rsi_required': False, 'bear_strategy': 'breakout', 'bear_bb_std_mult': 2.615932730836398, 'bear_rsi_os': 21, 'bear_rsi_ob': 46, 'bear_adx_thresh': 6.296762675231411, 'bear_atr_min_pct': 0.017932089464899412, 'bear_atr_max_pct': 0.022586474416721646, 'bear_tp_mult': 1.7528482782378774, 'bear_tsl_mult': 0.6342900965675367, 'bear_time_stop': 248, 'bear_use_sma': False, 'bear_use_ema': False, 'bear_use_atr': True, 'bear_use_adx': True, 'bear_use_spike': False, 'bear_rsi_required': True, 'sideways_strategy': 'mean_reversion', 'sideways_bb_std_mult': 1.4766578038362044, 'sideways_rsi_os': 44, 'sideways_rsi_ob': 78, 'sideways_adx_thresh': 19.170535904101442, 'sideways_atr_min_pct': 0.016726744321794034, 'sideways_atr_max_pct': 0.06017282278991497, 'sideways_tp_mult': 2.587345059951835, 'sideways_tsl_mult': 0.5574875540883669, 'sideways_time_stop': 25, 'sideways_use_sma': True, 'sideways_use_ema': True, 'sideways_use_atr': False, 'sideways_use_adx': True, 'sideways_use_spike': True, 'sideways_rsi_required': False}.
[I 2025-09-01 14:31:34,808] Trial 234 finished with values: [-1000000000.0, 1000000000.0] and parameters: {'p_sma': 25, 'p_std': 14, 'p_atr': 14, 'p_adx': 25, 'rsi_period': 69, 'ema1': 23, 'ema2': 53, 'slip_atr_k': 0.09938014124149774, 'slip_spread_k': 0.47608991533953376, 'spread_hl_frac': 0.04148233142649695, 'bb_std_mult': 2.496387026486854, 'rsi_os': 23, 'rsi_ob': 79, 'vol_spike': 0.1993231298666564, 'adx_thresh': 25.335318242073786, 'atr_min_pct': 0.013620020291389989, 'atr_max_pct': 0.07179125598841066, 'tp_mult': 1.7253551058554222, 'tsl_mult': 0.07704692428279403, 'strategy': 'breakout', 'time_stop': 76, 'use_sma': True, 'use_atr': True, 'use_adx': True, 'use_ema': False, 'use_spike': False, 'rsi_required': True, 'edge_k': 1.3016940067270237, 'edge_cap': 0.45582416573518886, 'bull_strategy': 'mean_reversion', 'bull_bb_std_mult': 1.9930852242184394, 'bull_rsi_os': 19, 'bull_rsi_ob': 64, 'bull_adx_thresh': 10.524574040285167, 'bull_atr_min_pct': 0.00871039405753624, 'bull_atr_max_pct': 0.04059963987082554, 'bull_tp_mult': 2.690345971152377, 'bull_tsl_mult': 0.8884491376443824, 'bull_time_stop': 213, 'bull_use_sma': False, 'bull_use_ema': True, 'bull_use_atr': False, 'bull_use_adx': True, 'bull_use_spike': False, 'bull_rsi_required': True, 'bear_strategy': 'breakout', 'bear_bb_std_mult': 2.229161377567769, 'bear_rsi_os': 17, 'bear_rsi_ob': 84, 'bear_adx_thresh': 5.011551035806602, 'bear_atr_min_pct': 0.006570099547112137, 'bear_atr_max_pct': 0.1388993874071633, 'bear_tp_mult': 2.218323392442459, 'bear_tsl_mult': 0.6062253953862976, 'bear_time_stop': 171, 'bear_use_sma': True, 'bear_use_ema': True, 'bear_use_atr': False, 'bear_use_adx': True, 'bear_use_spike': False, 'bear_rsi_required': True, 'sideways_strategy': 'mean_reversion', 'sideways_bb_std_mult': 2.522070320647119, 'sideways_rsi_os': 31, 'sideways_rsi_ob': 80, 'sideways_adx_thresh': 12.513993496917287, 'sideways_atr_min_pct': 6.039362235971818e-05, 'sideways_atr_max_pct': 0.0815848322084514, 'sideways_tp_mult': 2.675558885562614, 'sideways_tsl_mult': 0.3506117868727599, 'sideways_time_stop': 126, 'sideways_use_sma': True, 'sideways_use_ema': True, 'sideways_use_atr': False, 'sideways_use_adx': True, 'sideways_use_spike': False, 'sideways_rsi_required': False}.
[I 2025-09-01 14:31:34,992] Trial 232 finished with values: [-1000000000.0, 1000000000.0] and parameters: {'p_sma': 25, 'p_std': 11, 'p_atr': 27, 'p_adx': 19, 'rsi_period': 73, 'ema1': 8, 'ema2': 41, 'slip_atr_k': 0.0001478379512834531, 'slip_spread_k': 0.643009051664203, 'spread_hl_frac': 0.04272874018383414, 'bb_std_mult': 2.1198966179639793, 'rsi_os': 51, 'rsi_ob': 87, 'vol_spike': 0.23295676128421094, 'adx_thresh': 26.523557180362978, 'atr_min_pct': 0.008725944037127085, 'atr_max_pct': 0.07248760067368155, 'tp_mult': 1.7333708275773752, 'tsl_mult': 0.6431336286057782, 'strategy': 'breakout', 'time_stop': 299, 'use_sma': False, 'use_atr': False, 'use_adx': True, 'use_ema': False, 'use_spike': False, 'rsi_required': True, 'edge_k': 0.139496754734595, 'edge_cap': 0.8811021529005392, 'bull_strategy': 'mean_reversion', 'bull_bb_std_mult': 1.7050925878237035, 'bull_rsi_os': 42, 'bull_rsi_ob': 53, 'bull_adx_thresh': 22.5772097010885, 'bull_atr_min_pct': 0.004366167298864928, 'bull_atr_max_pct': 0.04476032446791287, 'bull_tp_mult': 2.817512756283976, 'bull_tsl_mult': 0.8722862470219228, 'bull_time_stop': 17, 'bull_use_sma': False, 'bull_use_ema': True, 'bull_use_atr': False, 'bull_use_adx': True, 'bull_use_spike': False, 'bull_rsi_required': True, 'bear_strategy': 'breakout', 'bear_bb_std_mult': 2.1650893737510475, 'bear_rsi_os': 10, 'bear_rsi_ob': 45, 'bear_adx_thresh': 14.754992020348652, 'bear_atr_min_pct': 0.02903494422903768, 'bear_atr_max_pct': 0.021055268149642953, 'bear_tp_mult': 2.052837773288801, 'bear_tsl_mult': 0.6984754565158444, 'bear_time_stop': 248, 'bear_use_sma': False, 'bear_use_ema': True, 'bear_use_atr': False, 'bear_use_adx': False, 'bear_use_spike': False, 'bear_rsi_required': True, 'sideways_strategy': 'mean_reversion', 'sideways_bb_std_mult': 1.4380868468310577, 'sideways_rsi_os': 44, 'sideways_rsi_ob': 53, 'sideways_adx_thresh': 32.54963163001743, 'sideways_atr_min_pct': 0.019470226524876764, 'sideways_atr_max_pct': 0.03647190496536744, 'sideways_tp_mult': 2.591160916692193, 'sideways_tsl_mult': 0.8434213855096935, 'sideways_time_stop': 156, 'sideways_use_sma': True, 'sideways_use_ema': True, 'sideways_use_atr': False, 'sideways_use_adx': True, 'sideways_use_spike': False, 'sideways_rsi_required': False}.
[I 2025-09-01 14:31:35,353] Trial 233 finished with values: [-1000000000.0, 1000000000.0] and parameters: {'p_sma': 21, 'p_std': 53, 'p_atr': 27, 'p_adx': 19, 'rsi_period': 69, 'ema1': 27, 'ema2': 55, 'slip_atr_k': 0.09811932115281996, 'slip_spread_k': 0.18470388354763795, 'spread_hl_frac': 0.03894169298254735, 'bb_std_mult': 2.272463218408684, 'rsi_os': 51, 'rsi_ob': 84, 'vol_spike': 0.0001674737139719662, 'adx_thresh': 26.456849220087456, 'atr_min_pct': 0.01708605706057232, 'atr_max_pct': 0.029832614501521873, 'tp_mult': 1.7385378880865598, 'tsl_mult': 0.8073260562881373, 'strategy': 'breakout', 'time_stop': 90, 'use_sma': True, 'use_atr': False, 'use_adx': True, 'use_ema': False, 'use_spike': False, 'rsi_required': True, 'edge_k': 0.5636571911091581, 'edge_cap': 0.10752215954778627, 'bull_strategy': 'mean_reversion', 'bull_bb_std_mult': 1.2486281245281066, 'bull_rsi_os': 16, 'bull_rsi_ob': 55, 'bull_adx_thresh': 27.727817884382286, 'bull_atr_min_pct': 0.006003056318537672, 'bull_atr_max_pct': 0.03938428041882968, 'bull_tp_mult': 2.823541627588141, 'bull_tsl_mult': 0.8786664700777944, 'bull_time_stop': 212, 'bull_use_sma': False, 'bull_use_ema': True, 'bull_use_atr': False, 'bull_use_adx': True, 'bull_use_spike': False, 'bull_rsi_required': True, 'bear_strategy': 'breakout', 'bear_bb_std_mult': 2.22212743503839, 'bear_rsi_os': 53, 'bear_rsi_ob': 45, 'bear_adx_thresh': 6.85110060605598, 'bear_atr_min_pct': 0.01807549162539911, 'bear_atr_max_pct': 0.02082786529979551, 'bear_tp_mult': 1.2648417450725935, 'bear_tsl_mult': 0.11556183737495745, 'bear_time_stop': 246, 'bear_use_sma': False, 'bear_use_ema': True, 'bear_use_atr': False, 'bear_use_adx': True, 'bear_use_spike': False, 'bear_rsi_required': True, 'sideways_strategy': 'mean_reversion', 'sideways_bb_std_mult': 3.092128305234859, 'sideways_rsi_os': 34, 'sideways_rsi_ob': 52, 'sideways_adx_thresh': 32.50734001989365, 'sideways_atr_min_pct': 0.02478838252513936, 'sideways_atr_max_pct': 0.03971343840983276, 'sideways_tp_mult': 1.4439929931306605, 'sideways_tsl_mult': 0.6753133423014581, 'sideways_time_stop': 213, 'sideways_use_sma': True, 'sideways_use_ema': True, 'sideways_use_atr': False, 'sideways_use_adx': True, 'sideways_use_spike': False, 'sideways_rsi_required': False}.
