[I 2025-09-01 14:57:57,501] Trial 398 finished with values: [-1000000000.0, 1000000000.0] and parameters: {'p_sma': 31, 'p_std': 24, 'p_atr': 24, 'p_adx': 14, 'rsi_period': 55, 'ema1': 25, 'ema2': 59, 'slip_atr_k': 0.11935520832349733, 'slip_spread_k': 0.4052955040333984, 'spread_hl_frac': 0.007372774360358542, 'bb_std_mult': 2.137073846538216, 'rsi_os': 29, 'rsi_ob': 45, 'vol_spike': 0.08461906431739102, 'adx_thresh': 8.803390256730351, 'atr_min_pct': 0.01630324167604788, 'atr_max_pct': 0.0949428443883994, 'tp_mult': 1.9648065133447765, 'tsl_mult': 0.3777005371005013, 'strategy': 'breakout', 'time_stop': 32, 'use_sma': False, 'use_atr': True, 'use_adx': False, 'use_ema': True, 'use_spike': True, 'rsi_required': True, 'edge_k': 1.5075683863989993, 'edge_cap': 0.882190393282227, 'bull_strategy': 'mean_reversion', 'bull_bb_std_mult': 0.8905552181185332, 'bull_rsi_os': 26, 'bull_rsi_ob': 63, 'bull_adx_thresh': 6.240489503833626, 'bull_atr_min_pct': 0.015101041947943863, 'bull_atr_max_pct': 0.03105102932303299, 'bull_tp_mult': 2.3048189251580347, 'bull_tsl_mult': 0.06387535597760641, 'bull_time_stop': 143, 'bull_use_sma': False, 'bull_use_ema': True, 'bull_use_atr': False, 'bull_use_adx': False, 'bull_use_spike': True, 'bull_rsi_required': False, 'bear_strategy': 'mean_reversion', 'bear_bb_std_mult': 1.5714123136473486, 'bear_rsi_os': 52, 'bear_rsi_ob': 51, 'bear_adx_thresh': 8.127908481536096, 'bear_atr_min_pct': 0.005036618250876526, 'bear_atr_max_pct': 0.041190213692768866, 'bear_tp_mult': 2.2456116736848086, 'bear_tsl_mult': 0.7502082301639739, 'bear_time_stop': 247, 'bear_use_sma': True, 'bear_use_ema': False, 'bear_use_atr': True, 'bear_use_adx': False, 'bear_use_spike': True, 'bear_rsi_required': True, 'sideways_strategy': 'mean_reversion', 'sideways_bb_std_mult': 2.6630709774467016, 'sideways_rsi_os': 21, 'sideways_rsi_ob': 79, 'sideways_adx_thresh': 32.3659417354914, 'sideways_atr_min_pct': 0.028608478002178254, 'sideways_atr_max_pct': 0.051489295311774236, 'sideways_tp_mult': 2.309180344469897, 'sideways_tsl_mult': 0.7445912627089267, 'sideways_time_stop': 60, 'sideways_use_sma': True, 'sideways_use_ema': False, 'sideways_use_atr': True, 'sideways_use_adx': True, 'sideways_use_spike': False, 'sideways_rsi_required': True}.
[I 2025-09-01 14:57:57,821] Trial 399 finished with values: [-1000000000.0, 1000000000.0] and parameters: {'p_sma': 31, 'p_std': 24, 'p_atr': 12, 'p_adx': 14, 'rsi_period': 79, 'ema1': 25, 'ema2': 58, 'slip_atr_k': 0.139379445794024, 'slip_spread_k': 0.6871657432855709, 'spread_hl_frac': 0.027216074239053718, 'bb_std_mult': 2.1408939326398397, 'rsi_os': 29, 'rsi_ob': 81, 'vol_spike': 0.08160097902556615, 'adx_thresh': 29.212372300102032, 'atr_min_pct': 0.015786709391415774, 'atr_max_pct': 0.06361083004734244, 'tp_mult': 1.9794956497860765, 'tsl_mult': 0.3805440141477908, 'strategy': 'breakout', 'time_stop': 34, 'use_sma': False, 'use_atr': True, 'use_adx': False, 'use_ema': True, 'use_spike': True, 'rsi_required': True, 'edge_k': 1.5255437507787746, 'edge_cap': 0.8809852062806482, 'bull_strategy': 'mean_reversion', 'bull_bb_std_mult': 1.0084340532683183, 'bull_rsi_os': 26, 'bull_rsi_ob': 63, 'bull_adx_thresh': 5.9529685814963695, 'bull_atr_min_pct': 0.014950470206197634, 'bull_atr_max_pct': 0.03557735920861275, 'bull_tp_mult': 2.1914326852445813, 'bull_tsl_mult': 0.07860845349481492, 'bull_time_stop': 145, 'bull_use_sma': False, 'bull_use_ema': True, 'bull_use_atr': False, 'bull_use_adx': False, 'bull_use_spike': True, 'bull_rsi_required': False, 'bear_strategy': 'mean_reversion', 'bear_bb_std_mult': 1.583866063216114, 'bear_rsi_os': 52, 'bear_rsi_ob': 50, 'bear_adx_thresh': 8.192530953728603, 'bear_atr_min_pct': 0.020425468889088, 'bear_atr_max_pct': 0.0456092358485423, 'bear_tp_mult': 1.4295445039661314, 'bear_tsl_mult': 0.8460462094383405, 'bear_time_stop': 246, 'bear_use_sma': True, 'bear_use_ema': False, 'bear_use_atr': True, 'bear_use_adx': False, 'bear_use_spike': True, 'bear_rsi_required': True, 'sideways_strategy': 'breakout', 'sideways_bb_std_mult': 2.6451955672983543, 'sideways_rsi_os': 24, 'sideways_rsi_ob': 76, 'sideways_adx_thresh': 32.24892603749136, 'sideways_atr_min_pct': 0.025530753598793643, 'sideways_atr_max_pct': 0.05042357330098612, 'sideways_tp_mult': 2.210676993525363, 'sideways_tsl_mult': 0.7403509439727682, 'sideways_time_stop': 40, 'sideways_use_sma': False, 'sideways_use_ema': False, 'sideways_use_atr': True, 'sideways_use_adx': True, 'sideways_use_spike': False, 'sideways_rsi_required': True}.
[I 2025-09-01 14:57:58,053] Trial 396 finished with values: [-1000000000.0, 1000000000.0] and parameters: {'p_sma': 31, 'p_std': 22, 'p_atr': 10, 'p_adx': 14, 'rsi_period': 69, 'ema1': 19, 'ema2': 58, 'slip_atr_k': 0.0965235214442133, 'slip_spread_k': 0.40612863004747357, 'spread_hl_frac': 0.007649418735654076, 'bb_std_mult': 3.504643393999163, 'rsi_os': 30, 'rsi_ob': 81, 'vol_spike': 0.07064474120125482, 'adx_thresh': 28.851920810246682, 'atr_min_pct': 0.016287064745090146, 'atr_max_pct': 0.04134111603418151, 'tp_mult': 1.9679684178392511, 'tsl_mult': 0.3876269898464598, 'strategy': 'breakout', 'time_stop': 34, 'use_sma': False, 'use_atr': True, 'use_adx': False, 'use_ema': True, 'use_spike': False, 'rsi_required': True, 'edge_k': 1.5078249767754899, 'edge_cap': 0.8804976568946229, 'bull_strategy': 'mean_reversion', 'bull_bb_std_mult': 1.0381360766801935, 'bull_rsi_os': 9, 'bull_rsi_ob': 66, 'bull_adx_thresh': 6.31285750809361, 'bull_atr_min_pct': 0.015092571929753619, 'bull_atr_max_pct': 0.12197017024656609, 'bull_tp_mult': 2.47502748044339, 'bull_tsl_mult': 0.0666563968514671, 'bull_time_stop': 145, 'bull_use_sma': False, 'bull_use_ema': True, 'bull_use_atr': False, 'bull_use_adx': True, 'bull_use_spike': True, 'bull_rsi_required': False, 'bear_strategy': 'breakout', 'bear_bb_std_mult': 1.6071026512965318, 'bear_rsi_os': 41, 'bear_rsi_ob': 50, 'bear_adx_thresh': 8.10345708796931, 'bear_atr_min_pct': 0.005203433925552352, 'bear_atr_max_pct': 0.033948348753592414, 'bear_tp_mult': 2.488473359752352, 'bear_tsl_mult': 0.3077875130267068, 'bear_time_stop': 275, 'bear_use_sma': True, 'bear_use_ema': False, 'bear_use_atr': True, 'bear_use_adx': False, 'bear_use_spike': True, 'bear_rsi_required': True, 'sideways_strategy': 'mean_reversion', 'sideways_bb_std_mult': 1.0790086284570757, 'sideways_rsi_os': 24, 'sideways_rsi_ob': 79, 'sideways_adx_thresh': 32.95908162084954, 'sideways_atr_min_pct': 0.012416380874544431, 'sideways_atr_max_pct': 0.08741127122315702, 'sideways_tp_mult': 2.295223887660185, 'sideways_tsl_mult': 0.7700344029966731, 'sideways_time_stop': 241, 'sideways_use_sma': True, 'sideways_use_ema': False, 'sideways_use_atr': True, 'sideways_use_adx': True, 'sideways_use_spike': False, 'sideways_rsi_required': True}.
[I 2025-09-01 14:57:58,306] Trial 397 finished with values: [-1000000000.0, 1000000000.0] and parameters: {'p_sma': 31, 'p_std': 24, 'p_atr': 12, 'p_adx': 14, 'rsi_period': 74, 'ema1': 25, 'ema2': 58, 'slip_atr_k': 0.11743173950498671, 'slip_spread_k': 0.40280709149276583, 'spread_hl_frac': 0.010587981665413611, 'bb_std_mult': 2.161370700786565, 'rsi_os': 40, 'rsi_ob': 90, 'vol_spike': 0.18181165033208233, 'adx_thresh': 14.910888887369921, 'atr_min_pct': 0.016039616623214938, 'atr_max_pct': 0.06891466183720904, 'tp_mult': 1.9789931421069442, 'tsl_mult': 0.3795720144324885, 'strategy': 'breakout', 'time_stop': 35, 'use_sma': False, 'use_atr': True, 'use_adx': False, 'use_ema': True, 'use_spike': True, 'rsi_required': True, 'edge_k': 1.4978966011145451, 'edge_cap': 0.5598089268881963, 'bull_strategy': 'mean_reversion', 'bull_bb_std_mult': 1.0134980468712844, 'bull_rsi_os': 26, 'bull_rsi_ob': 63, 'bull_adx_thresh': 6.271762592177991, 'bull_atr_min_pct': 0.015007557063766042, 'bull_atr_max_pct': 0.03563214642447549, 'bull_tp_mult': 1.5488891773602615, 'bull_tsl_mult': 0.07382073110255284, 'bull_time_stop': 140, 'bull_use_sma': False, 'bull_use_ema': True, 'bull_use_atr': False, 'bull_use_adx': False, 'bull_use_spike': True, 'bull_rsi_required': False, 'bear_strategy': 'mean_reversion', 'bear_bb_std_mult': 1.5998510829550134, 'bear_rsi_os': 41, 'bear_rsi_ob': 51, 'bear_adx_thresh': 8.086807584739354, 'bear_atr_min_pct': 0.0052347916361259, 'bear_atr_max_pct': 0.0464452022615263, 'bear_tp_mult': 1.1054412178758253, 'bear_tsl_mult': 0.740219629737844, 'bear_time_stop': 143, 'bear_use_sma': True, 'bear_use_ema': False, 'bear_use_atr': True, 'bear_use_adx': False, 'bear_use_spike': True, 'bear_rsi_required': True, 'sideways_strategy': 'mean_reversion', 'sideways_bb_std_mult': 1.0619247635860019, 'sideways_rsi_os': 21, 'sideways_rsi_ob': 86, 'sideways_adx_thresh': 20.217922499995932, 'sideways_atr_min_pct': 0.012152528389445522, 'sideways_atr_max_pct': 0.05075519133980181, 'sideways_tp_mult': 2.2928324042587063, 'sideways_tsl_mult': 0.7681687798933116, 'sideways_time_stop': 60, 'sideways_use_sma': True, 'sideways_use_ema': False, 'sideways_use_atr': True, 'sideways_use_adx': True, 'sideways_use_spike': False, 'sideways_rsi_required': True}.
[I 2025-09-01 14:58:35,085] Trial 402 finished with values: [-0.04595106267097526, 0.04563666808972165] and parameters: {'p_sma': 36, 'p_std': 38, 'p_atr': 12, 'p_adx': 14, 'rsi_period': 74, 'ema1': 27, 'ema2': 56, 'slip_atr_k': 0.1484247992168731, 'slip_spread_k': 0.03427950525515666, 'spread_hl_frac': 0.010630767873360173, 'bb_std_mult': 2.267731428533297, 'rsi_os': 28, 'rsi_ob': 75, 'vol_spike': 0.06329660002043916, 'adx_thresh': 20.60824739540467, 'atr_min_pct': 0.018433336401627972, 'atr_max_pct': 0.07351926040868473, 'tp_mult': 2.0859377535666415, 'tsl_mult': 0.41543934844394165, 'strategy': 'mean_reversion', 'time_stop': 22, 'use_sma': True, 'use_atr': True, 'use_adx': False, 'use_ema': True, 'use_spike': False, 'rsi_required': True, 'edge_k': 1.439720283105024, 'edge_cap': 0.910899395574842, 'bull_strategy': 'mean_reversion', 'bull_bb_std_mult': 0.9096813356311435, 'bull_rsi_os': 24, 'bull_rsi_ob': 65, 'bull_adx_thresh': 7.799924950393261, 'bull_atr_min_pct': 0.016695560602817138, 'bull_atr_max_pct': 0.01005091191972618, 'bull_tp_mult': 1.3508990549079902, 'bull_tsl_mult': 0.09152186971505552, 'bull_time_stop': 137, 'bull_use_sma': False, 'bull_use_ema': False, 'bull_use_atr': True, 'bull_use_adx': True, 'bull_use_spike': False, 'bull_rsi_required': True, 'bear_strategy': 'breakout', 'bear_bb_std_mult': 1.3460471941038452, 'bear_rsi_os': 50, 'bear_rsi_ob': 54, 'bear_adx_thresh': 9.02946381916372, 'bear_atr_min_pct': 0.004307603753844817, 'bear_atr_max_pct': 0.047653594201776416, 'bear_tp_mult': 1.6507054017582166, 'bear_tsl_mult': 0.7343293251642244, 'bear_time_stop': 172, 'bear_use_sma': True, 'bear_use_ema': False, 'bear_use_atr': False, 'bear_use_adx': False, 'bear_use_spike': True, 'bear_rsi_required': True, 'sideways_strategy': 'mean_reversion', 'sideways_bb_std_mult': 0.9605043295787752, 'sideways_rsi_os': 22, 'sideways_rsi_ob': 86, 'sideways_adx_thresh': 31.712656738371383, 'sideways_atr_min_pct': 0.011689748901187336, 'sideways_atr_max_pct': 0.04830144493487272, 'sideways_tp_mult': 2.368873637304455, 'sideways_tsl_mult': 0.7758941594926222, 'sideways_time_stop': 211, 'sideways_use_sma': True, 'sideways_use_ema': False, 'sideways_use_atr': True, 'sideways_use_adx': True, 'sideways_use_spike': False, 'sideways_rsi_required': True}.
[I 2025-09-01 14:58:35,953] Trial 400 finished with values: [-1000000000.0, 1000000000.0] and parameters: {'p_sma': 31, 'p_std': 26, 'p_atr': 12, 'p_adx': 14, 'rsi_period': 74, 'ema1': 27, 'ema2': 58, 'slip_atr_k': 0.1893233282657807, 'slip_spread_k': 0.38207715719132584, 'spread_hl_frac': 0.008575136967415197, 'bb_std_mult': 3.432495294735258, 'rsi_os': 28, 'rsi_ob': 77, 'vol_spike': 0.062074453066291176, 'adx_thresh': 29.03747053349177, 'atr_min_pct': 0.01571440736956727, 'atr_max_pct': 0.06253504882484869, 'tp_mult': 1.843680687019303, 'tsl_mult': 0.41928349232437484, 'strategy': 'breakout', 'time_stop': 32, 'use_sma': False, 'use_atr': True, 'use_adx': False, 'use_ema': True, 'use_spike': False, 'rsi_required': True, 'edge_k': 1.4450107490835093, 'edge_cap': 0.787339435706004, 'bull_strategy': 'mean_reversion', 'bull_bb_std_mult': 1.02092737017445, 'bull_rsi_os': 24, 'bull_rsi_ob': 63, 'bull_adx_thresh': 5.919433606523494, 'bull_atr_min_pct': 0.016849486982008947, 'bull_atr_max_pct': 0.03537716756969181, 'bull_tp_mult': 2.6877706076871846, 'bull_tsl_mult': 0.07960835692427176, 'bull_time_stop': 137, 'bull_use_sma': False, 'bull_use_ema': True, 'bull_use_atr': False, 'bull_use_adx': True, 'bull_use_spike': False, 'bull_rsi_required': True, 'bear_strategy': 'breakout', 'bear_bb_std_mult': 2.802472952907586, 'bear_rsi_os': 18, 'bear_rsi_ob': 50, 'bear_adx_thresh': 9.051760329637942, 'bear_atr_min_pct': 0.00541372462623269, 'bear_atr_max_pct': 0.033350403858769154, 'bear_tp_mult': 1.6641731244156777, 'bear_tsl_mult': 0.7371214917901278, 'bear_time_stop': 260, 'bear_use_sma': True, 'bear_use_ema': False, 'bear_use_atr': False, 'bear_use_adx': False, 'bear_use_spike': True, 'bear_rsi_required': True, 'sideways_strategy': 'breakout', 'sideways_bb_std_mult': 0.8962939345564437, 'sideways_rsi_os': 24, 'sideways_rsi_ob': 86, 'sideways_adx_thresh': 30.476143882179745, 'sideways_atr_min_pct': 0.0004213289573290861, 'sideways_atr_max_pct': 0.04874811678566131, 'sideways_tp_mult': 2.2069290844473315, 'sideways_tsl_mult': 0.7722581890849632, 'sideways_time_stop': 54, 'sideways_use_sma': False, 'sideways_use_ema': False, 'sideways_use_atr': True, 'sideways_use_adx': True, 'sideways_use_spike': False, 'sideways_rsi_required': True}.
[I 2025-09-01 14:58:35,970] Trial 403 finished with values: [-1000000000.0, 1000000000.0] and parameters: {'p_sma': 30, 'p_std': 26, 'p_atr': 27, 'p_adx': 13, 'rsi_period': 40, 'ema1': 27, 'ema2': 56, 'slip_atr_k': 0.13324188501629539, 'slip_spread_k': 0.045411318960068614, 'spread_hl_frac': 0.005718492426793989, 'bb_std_mult': 2.2706318330230646, 'rsi_os': 28, 'rsi_ob': 75, 'vol_spike': 0.06251563561925508, 'adx_thresh': 29.70331334071855, 'atr_min_pct': 0.018148989009339516, 'atr_max_pct': 0.07322940468401322, 'tp_mult': 2.0881702028916043, 'tsl_mult': 0.42496245956525164, 'strategy': 'mean_reversion', 'time_stop': 24, 'use_sma': True, 'use_atr': True, 'use_adx': False, 'use_ema': True, 'use_spike': False, 'rsi_required': True, 'edge_k': 1.453211894097327, 'edge_cap': 0.2634826371806776, 'bull_strategy': 'mean_reversion', 'bull_bb_std_mult': 0.8908242710371953, 'bull_rsi_os': 24, 'bull_rsi_ob': 68, 'bull_adx_thresh': 7.806435639483958, 'bull_atr_min_pct': 0.016491633487014174, 'bull_atr_max_pct': 0.04259326171867643, 'bull_tp_mult': 2.6838693826031297, 'bull_tsl_mult': 0.04476427228041531, 'bull_time_stop': 135, 'bull_use_sma': False, 'bull_use_ema': False, 'bull_use_atr': True, 'bull_use_adx': True, 'bull_use_spike': False, 'bull_rsi_required': True, 'bear_strategy': 'breakout', 'bear_bb_std_mult': 2.7948211691915232, 'bear_rsi_os': 50, 'bear_rsi_ob': 54, 'bear_adx_thresh': 9.101252329852121, 'bear_atr_min_pct': 0.0047157888499757515, 'bear_atr_max_pct': 0.053753898316743334, 'bear_tp_mult': 1.6795556611601241, 'bear_tsl_mult': 0.7973942680012617, 'bear_time_stop': 174, 'bear_use_sma': True, 'bear_use_ema': False, 'bear_use_atr': False, 'bear_use_adx': True, 'bear_use_spike': True, 'bear_rsi_required': True, 'sideways_strategy': 'breakout', 'sideways_bb_std_mult': 0.9538166931645191, 'sideways_rsi_os': 22, 'sideways_rsi_ob': 77, 'sideways_adx_thresh': 14.056326801232961, 'sideways_atr_min_pct': 0.011370792548405815, 'sideways_atr_max_pct': 0.04729316003683447, 'sideways_tp_mult': 2.2502844562856277, 'sideways_tsl_mult': 0.7498144952740758, 'sideways_time_stop': 224, 'sideways_use_sma': False, 'sideways_use_ema': False, 'sideways_use_atr': True, 'sideways_use_adx': True, 'sideways_use_spike': False, 'sideways_rsi_required': True}.
[I 2025-09-01 14:58:36,201] Trial 401 finished with values: [-0.04314392152439761, 0.04260570346443924] and parameters: {'p_sma': 31, 'p_std': 26, 'p_atr': 12, 'p_adx': 14, 'rsi_period': 69, 'ema1': 26, 'ema2': 59, 'slip_atr_k': 0.19183229976651558, 'slip_spread_k': 0.3817201182611038, 'spread_hl_frac': 0.005019869487344585, 'bb_std_mult': 3.4690764553553564, 'rsi_os': 31, 'rsi_ob': 75, 'vol_spike': 0.06160586390805317, 'adx_thresh': 33.03599303112237, 'atr_min_pct': 0.017054437545021478, 'atr_max_pct': 0.04198621818699123, 'tp_mult': 2.0158953810633364, 'tsl_mult': 0.4089239428101741, 'strategy': 'breakout', 'time_stop': 28, 'use_sma': False, 'use_atr': True, 'use_adx': False, 'use_ema': True, 'use_spike': False, 'rsi_required': True, 'edge_k': 1.4426437946183854, 'edge_cap': 0.251842502776927, 'bull_strategy': 'mean_reversion', 'bull_bb_std_mult': 1.0205454090142556, 'bull_rsi_os': 24, 'bull_rsi_ob': 65, 'bull_adx_thresh': 7.798944492039208, 'bull_atr_min_pct': 0.01651380044514618, 'bull_atr_max_pct': 0.04495509189496047, 'bull_tp_mult': 2.6929239063121897, 'bull_tsl_mult': 0.03789912370896142, 'bull_time_stop': 136, 'bull_use_sma': False, 'bull_use_ema': False, 'bull_use_atr': False, 'bull_use_adx': True, 'bull_use_spike': False, 'bull_rsi_required': True, 'bear_strategy': 'breakout', 'bear_bb_std_mult': 2.495470201727865, 'bear_rsi_os': 50, 'bear_rsi_ob': 50, 'bear_adx_thresh': 9.244895633862408, 'bear_atr_min_pct': 0.004608158131852655, 'bear_atr_max_pct': 0.03562385320154023, 'bear_tp_mult': 1.095720496790939, 'bear_tsl_mult': 0.7339673399487416, 'bear_time_stop': 271, 'bear_use_sma': True, 'bear_use_ema': False, 'bear_use_atr': False, 'bear_use_adx': False, 'bear_use_spike': True, 'bear_rsi_required': True, 'sideways_strategy': 'mean_reversion', 'sideways_bb_std_mult': 3.260112349287306, 'sideways_rsi_os': 22, 'sideways_rsi_ob': 78, 'sideways_adx_thresh': 15.338778066018028, 'sideways_atr_min_pct': 0.011422080832378771, 'sideways_atr_max_pct': 0.04689002875012225, 'sideways_tp_mult': 2.2773434761967946, 'sideways_tsl_mult': 0.7665803243252727, 'sideways_time_stop': 73, 'sideways_use_sma': True, 'sideways_use_ema': False, 'sideways_use_atr': True, 'sideways_use_adx': True, 'sideways_use_spike': False, 'sideways_rsi_required': True}.
[I 2025-09-01 14:59:14,062] Trial 407 finished with values: [-1000000000.0, 1000000000.0] and parameters: {'p_sma': 59, 'p_std': 33, 'p_atr': 23, 'p_adx': 9, 'rsi_period': 44, 'ema1': 6, 'ema2': 59, 'slip_atr_k': 0.2361673631529377, 'slip_spread_k': 0.13126380368317758, 'spread_hl_frac': 0.019822979878189657, 'bb_std_mult': 1.9685818532811963, 'rsi_os': 33, 'rsi_ob': 77, 'vol_spike': 0.07575226067430518, 'adx_thresh': 12.444467909829815, 'atr_min_pct': 0.016704116027119062, 'atr_max_pct': 0.03406800496405068, 'tp_mult': 2.000003688694195, 'tsl_mult': 0.02103165030575116, 'strategy': 'breakout', 'time_stop': 18, 'use_sma': False, 'use_atr': True, 'use_adx': True, 'use_ema': True, 'use_spike': False, 'rsi_required': False, 'edge_k': 1.403262762010495, 'edge_cap': 0.8128184439078547, 'bull_strategy': 'mean_reversion', 'bull_bb_std_mult': 0.951747038281445, 'bull_rsi_os': 27, 'bull_rsi_ob': 67, 'bull_adx_thresh': 6.699366945853033, 'bull_atr_min_pct': 0.017776659129719763, 'bull_atr_max_pct': 0.0384673283032238, 'bull_tp_mult': 1.3559912594544152, 'bull_tsl_mult': 0.10568802936841457, 'bull_time_stop': 123, 'bull_use_sma': True, 'bull_use_ema': True, 'bull_use_atr': False, 'bull_use_adx': True, 'bull_use_spike': False, 'bull_rsi_required': True, 'bear_strategy': 'breakout', 'bear_bb_std_mult': 1.417021473624546, 'bear_rsi_os': 48, 'bear_rsi_ob': 59, 'bear_adx_thresh': 10.249579165913516, 'bear_atr_min_pct': 0.02316892224387042, 'bear_atr_max_pct': 0.049686721338325725, 'bear_tp_mult': 2.5919775445180364, 'bear_tsl_mult': 0.7000384352167388, 'bear_time_stop': 263, 'bear_use_sma': True, 'bear_use_ema': False, 'bear_use_atr': False, 'bear_use_adx': True, 'bear_use_spike': True, 'bear_rsi_required': False, 'sideways_strategy': 'mean_reversion', 'sideways_bb_std_mult': 1.1216786804537002, 'sideways_rsi_os': 25, 'sideways_rsi_ob': 57, 'sideways_adx_thresh': 33.315355121701344, 'sideways_atr_min_pct': 0.014012971505185927, 'sideways_atr_max_pct': 0.0461720259039954, 'sideways_tp_mult': 2.252815333026073, 'sideways_tsl_mult': 0.7425896308046698, 'sideways_time_stop': 74, 'sideways_use_sma': True, 'sideways_use_ema': False, 'sideways_use_atr': True, 'sideways_use_adx': False, 'sideways_use_spike': False, 'sideways_rsi_required': True}.
