[I 2025-09-01 14:36:12,816] Trial 261 finished with values: [-1000000000.0, 1000000000.0] and parameters: {'p_sma': 34, 'p_std': 21, 'p_atr': 13, 'p_adx': 18, 'rsi_period': 77, 'ema1': 20, 'ema2': 39, 'slip_atr_k': 0.03389274479536966, 'slip_spread_k': 0.4805579297492582, 'spread_hl_frac': 0.03967113351488551, 'bb_std_mult': 2.438826159595544, 'rsi_os': 22, 'rsi_ob': 48, 'vol_spike': 0.007161908806751279, 'adx_thresh': 26.281591117105307, 'atr_min_pct': 0.026948444340465172, 'atr_max_pct': 0.07681401021009282, 'tp_mult': 2.3638602084467926, 'tsl_mult': 0.5907084587209617, 'strategy': 'breakout', 'time_stop': 87, 'use_sma': False, 'use_atr': True, 'use_adx': False, 'use_ema': False, 'use_spike': False, 'rsi_required': True, 'edge_k': 0.7775407309914883, 'edge_cap': 0.9007320369328887, 'bull_strategy': 'breakout', 'bull_bb_std_mult': 1.4471257395524588, 'bull_rsi_os': 18, 'bull_rsi_ob': 58, 'bull_adx_thresh': 6.53359440060743, 'bull_atr_min_pct': 0.004744845451344939, 'bull_atr_max_pct': 0.035856543258118025, 'bull_tp_mult': 1.689462154552805, 'bull_tsl_mult': 0.45894264776327165, 'bull_time_stop': 40, 'bull_use_sma': True, 'bull_use_ema': True, 'bull_use_atr': False, 'bull_use_adx': False, 'bull_use_spike': False, 'bull_rsi_required': True, 'bear_strategy': 'mean_reversion', 'bear_bb_std_mult': 1.9346634428961866, 'bear_rsi_os': 15, 'bear_rsi_ob': 54, 'bear_adx_thresh': 23.12036526151805, 'bear_atr_min_pct': 0.004171852466605027, 'bear_atr_max_pct': 0.06243374359265355, 'bear_tp_mult': 1.6775930618044566, 'bear_tsl_mult': 0.6529004320081706, 'bear_time_stop': 90, 'bear_use_sma': False, 'bear_use_ema': True, 'bear_use_atr': False, 'bear_use_adx': False, 'bear_use_spike': False, 'bear_rsi_required': True, 'sideways_strategy': 'mean_reversion', 'sideways_bb_std_mult': 1.4901067987189136, 'sideways_rsi_os': 19, 'sideways_rsi_ob': 79, 'sideways_adx_thresh': 15.228864759580611, 'sideways_atr_min_pct': 0.009530693817699339, 'sideways_atr_max_pct': 0.043161515119370907, 'sideways_tp_mult': 2.7027742999173645, 'sideways_tsl_mult': 0.8901927072199988, 'sideways_time_stop': 69, 'sideways_use_sma': True, 'sideways_use_ema': False, 'sideways_use_atr': True, 'sideways_use_adx': False, 'sideways_use_spike': False, 'sideways_rsi_required': False}.
[I 2025-09-01 14:36:13,176] Trial 259 finished with values: [-1000000000.0, 1000000000.0] and parameters: {'p_sma': 25, 'p_std': 35, 'p_atr': 14, 'p_adx': 13, 'rsi_period': 77, 'ema1': 22, 'ema2': 11, 'slip_atr_k': 0.01666390140123841, 'slip_spread_k': 0.4402073052812835, 'spread_hl_frac': 0.022319441859995445, 'bb_std_mult': 2.6584298538704676, 'rsi_os': 48, 'rsi_ob': 78, 'vol_spike': 0.21478454162880226, 'adx_thresh': 26.56091441756395, 'atr_min_pct': 0.007461110128761636, 'atr_max_pct': 0.0699371786063564, 'tp_mult': 2.388436249261399, 'tsl_mult': 0.5969689627536282, 'strategy': 'mean_reversion', 'time_stop': 126, 'use_sma': False, 'use_atr': True, 'use_adx': False, 'use_ema': True, 'use_spike': False, 'rsi_required': True, 'edge_k': 1.2269636392595527, 'edge_cap': 0.7712717342745153, 'bull_strategy': 'mean_reversion', 'bull_bb_std_mult': 1.4865393979591452, 'bull_rsi_os': 20, 'bull_rsi_ob': 73, 'bull_adx_thresh': 6.677136037889046, 'bull_atr_min_pct': 0.01620354763295875, 'bull_atr_max_pct': 0.07742138877554722, 'bull_tp_mult': 1.0330124219975716, 'bull_tsl_mult': 0.8603128071226108, 'bull_time_stop': 186, 'bull_use_sma': True, 'bull_use_ema': True, 'bull_use_atr': True, 'bull_use_adx': False, 'bull_use_spike': False, 'bull_rsi_required': True, 'bear_strategy': 'breakout', 'bear_bb_std_mult': 1.934131982921863, 'bear_rsi_os': 52, 'bear_rsi_ob': 87, 'bear_adx_thresh': 34.83185541657428, 'bear_atr_min_pct': 0.005930868274691062, 'bear_atr_max_pct': 0.01974836297089568, 'bear_tp_mult': 1.6233213666071484, 'bear_tsl_mult': 0.6179692469724544, 'bear_time_stop': 241, 'bear_use_sma': True, 'bear_use_ema': True, 'bear_use_atr': False, 'bear_use_adx': False, 'bear_use_spike': True, 'bear_rsi_required': True, 'sideways_strategy': 'mean_reversion', 'sideways_bb_std_mult': 1.4846113752332324, 'sideways_rsi_os': 19, 'sideways_rsi_ob': 81, 'sideways_adx_thresh': 15.99323435747039, 'sideways_atr_min_pct': 0.027180713423175684, 'sideways_atr_max_pct': 0.034325283846536395, 'sideways_tp_mult': 2.719285074884951, 'sideways_tsl_mult': 0.8938025116760226, 'sideways_time_stop': 83, 'sideways_use_sma': True, 'sideways_use_ema': True, 'sideways_use_atr': False, 'sideways_use_adx': True, 'sideways_use_spike': False, 'sideways_rsi_required': False}.
[I 2025-09-01 14:36:50,154] Trial 263 finished with values: [-1000000000.0, 1000000000.0] and parameters: {'p_sma': 53, 'p_std': 13, 'p_atr': 28, 'p_adx': 9, 'rsi_period': 77, 'ema1': 19, 'ema2': 13, 'slip_atr_k': 0.03574747942047513, 'slip_spread_k': 0.47390488736261915, 'spread_hl_frac': 0.03943961925022314, 'bb_std_mult': 0.5683794905662873, 'rsi_os': 10, 'rsi_ob': 45, 'vol_spike': 0.008850316676341896, 'adx_thresh': 25.813909247519906, 'atr_min_pct': 0.008798784275172632, 'atr_max_pct': 0.13551701867385496, 'tp_mult': 2.363918872279141, 'tsl_mult': 0.8680592616159839, 'strategy': 'breakout', 'time_stop': 98, 'use_sma': False, 'use_atr': False, 'use_adx': False, 'use_ema': False, 'use_spike': True, 'rsi_required': True, 'edge_k': 0.7775478803353382, 'edge_cap': 0.8994423747218919, 'bull_strategy': 'breakout', 'bull_bb_std_mult': 0.6747566459025993, 'bull_rsi_os': 23, 'bull_rsi_ob': 72, 'bull_adx_thresh': 5.014560605107493, 'bull_atr_min_pct': 0.006027094810908008, 'bull_atr_max_pct': 0.08942076737747788, 'bull_tp_mult': 1.6972364849599142, 'bull_tsl_mult': 0.04759492387754288, 'bull_time_stop': 121, 'bull_use_sma': False, 'bull_use_ema': True, 'bull_use_atr': False, 'bull_use_adx': False, 'bull_use_spike': False, 'bull_rsi_required': True, 'bear_strategy': 'breakout', 'bear_bb_std_mult': 1.9329004826565934, 'bear_rsi_os': 51, 'bear_rsi_ob': 45, 'bear_adx_thresh': 9.028261487850008, 'bear_atr_min_pct': 0.007267899995898114, 'bear_atr_max_pct': 0.014458811578547451, 'bear_tp_mult': 1.9905233070731014, 'bear_tsl_mult': 0.602717603283599, 'bear_time_stop': 91, 'bear_use_sma': False, 'bear_use_ema': True, 'bear_use_atr': False, 'bear_use_adx': False, 'bear_use_spike': False, 'bear_rsi_required': True, 'sideways_strategy': 'mean_reversion', 'sideways_bb_std_mult': 1.513220518930192, 'sideways_rsi_os': 54, 'sideways_rsi_ob': 86, 'sideways_adx_thresh': 15.721189682091147, 'sideways_atr_min_pct': 0.01835522782617721, 'sideways_atr_max_pct': 0.03910291626014866, 'sideways_tp_mult': 2.3503455263961315, 'sideways_tsl_mult': 0.8823387822557481, 'sideways_time_stop': 73, 'sideways_use_sma': True, 'sideways_use_ema': False, 'sideways_use_atr': False, 'sideways_use_adx': True, 'sideways_use_spike': False, 'sideways_rsi_required': False}.
[I 2025-09-01 14:36:51,754] Trial 266 finished with values: [-1000000000.0, 1000000000.0] and parameters: {'p_sma': 16, 'p_std': 60, 'p_atr': 24, 'p_adx': 19, 'rsi_period': 72, 'ema1': 15, 'ema2': 31, 'slip_atr_k': 0.1439822044528792, 'slip_spread_k': 0.46551083120291453, 'spread_hl_frac': 0.00970609024956835, 'bb_std_mult': 0.58787140775833, 'rsi_os': 10, 'rsi_ob': 85, 'vol_spike': 0.020609699377361162, 'adx_thresh': 12.075758722976875, 'atr_min_pct': 0.005863061329471147, 'atr_max_pct': 0.014493572869762175, 'tp_mult': 1.0468216134637576, 'tsl_mult': 0.2685398648083507, 'strategy': 'breakout', 'time_stop': 96, 'use_sma': False, 'use_atr': False, 'use_adx': True, 'use_ema': False, 'use_spike': True, 'rsi_required': False, 'edge_k': 0.4000465658435453, 'edge_cap': 0.9288235232506806, 'bull_strategy': 'breakout', 'bull_bb_std_mult': 1.642264233973814, 'bull_rsi_os': 18, 'bull_rsi_ob': 60, 'bull_adx_thresh': 19.439114914171256, 'bull_atr_min_pct': 0.02190461570823445, 'bull_atr_max_pct': 0.08820247266804568, 'bull_tp_mult': 2.2058624685550248, 'bull_tsl_mult': 0.9525837792065072, 'bull_time_stop': 13, 'bull_use_sma': False, 'bull_use_ema': True, 'bull_use_atr': False, 'bull_use_adx': True, 'bull_use_spike': True, 'bull_rsi_required': True, 'bear_strategy': 'breakout', 'bear_bb_std_mult': 2.6945441530894656, 'bear_rsi_os': 51, 'bear_rsi_ob': 45, 'bear_adx_thresh': 20.18856578236427, 'bear_atr_min_pct': 0.00509136514475686, 'bear_atr_max_pct': 0.09858114652188087, 'bear_tp_mult': 1.7365966160229378, 'bear_tsl_mult': 0.6032004439470151, 'bear_time_stop': 42, 'bear_use_sma': False, 'bear_use_ema': True, 'bear_use_atr': False, 'bear_use_adx': False, 'bear_use_spike': False, 'bear_rsi_required': False, 'sideways_strategy': 'breakout', 'sideways_bb_std_mult': 1.3164336617755712, 'sideways_rsi_os': 32, 'sideways_rsi_ob': 74, 'sideways_adx_thresh': 5.603351641164853, 'sideways_atr_min_pct': 0.01819267830669554, 'sideways_atr_max_pct': 0.07265089784621943, 'sideways_tp_mult': 2.333727517198647, 'sideways_tsl_mult': 0.8388954826047279, 'sideways_time_stop': 73, 'sideways_use_sma': False, 'sideways_use_ema': True, 'sideways_use_atr': False, 'sideways_use_adx': True, 'sideways_use_spike': True, 'sideways_rsi_required': True}.
[I 2025-09-01 14:36:52,099] Trial 265 finished with values: [-1000000000.0, 1000000000.0] and parameters: {'p_sma': 16, 'p_std': 60, 'p_atr': 22, 'p_adx': 13, 'rsi_period': 72, 'ema1': 9, 'ema2': 15, 'slip_atr_k': 0.2349844092737023, 'slip_spread_k': 0.37755333803935, 'spread_hl_frac': 0.045065664235217025, 'bb_std_mult': 2.5992005974938435, 'rsi_os': 9, 'rsi_ob': 78, 'vol_spike': 0.019904614863040956, 'adx_thresh': 27.74309482311507, 'atr_min_pct': 0.0056729877219819265, 'atr_max_pct': 0.013454848124400676, 'tp_mult': 2.268624130109844, 'tsl_mult': 0.5673522508189923, 'strategy': 'breakout', 'time_stop': 147, 'use_sma': False, 'use_atr': False, 'use_adx': True, 'use_ema': False, 'use_spike': False, 'rsi_required': False, 'edge_k': 0.8805520514759776, 'edge_cap': 0.7779312066160522, 'bull_strategy': 'breakout', 'bull_bb_std_mult': 2.9219315839275035, 'bull_rsi_os': 20, 'bull_rsi_ob': 46, 'bull_adx_thresh': 16.571385037759192, 'bull_atr_min_pct': 0.014203040950248338, 'bull_atr_max_pct': 0.04162537021485719, 'bull_tp_mult': 1.318597590519957, 'bull_tsl_mult': 0.18235683919618445, 'bull_time_stop': 14, 'bull_use_sma': False, 'bull_use_ema': True, 'bull_use_atr': False, 'bull_use_adx': True, 'bull_use_spike': True, 'bull_rsi_required': True, 'bear_strategy': 'breakout', 'bear_bb_std_mult': 3.2432172109527855, 'bear_rsi_os': 51, 'bear_rsi_ob': 45, 'bear_adx_thresh': 20.15631566804498, 'bear_atr_min_pct': 0.01369251548760811, 'bear_atr_max_pct': 0.013752678340874736, 'bear_tp_mult': 2.3181594524100295, 'bear_tsl_mult': 0.6018001559806064, 'bear_time_stop': 240, 'bear_use_sma': False, 'bear_use_ema': True, 'bear_use_atr': False, 'bear_use_adx': False, 'bear_use_spike': False, 'bear_rsi_required': False, 'sideways_strategy': 'breakout', 'sideways_bb_std_mult': 1.3281071256611976, 'sideways_rsi_os': 32, 'sideways_rsi_ob': 72, 'sideways_adx_thresh': 34.797468741036745, 'sideways_atr_min_pct': 0.021154797756669893, 'sideways_atr_max_pct': 0.03870298950698494, 'sideways_tp_mult': 2.7863209240274878, 'sideways_tsl_mult': 0.8417285769330095, 'sideways_time_stop': 89, 'sideways_use_sma': False, 'sideways_use_ema': True, 'sideways_use_atr': False, 'sideways_use_adx': True, 'sideways_use_spike': True, 'sideways_rsi_required': True}.
[I 2025-09-01 14:36:52,242] Trial 264 finished with values: [-1000000000.0, 1000000000.0] and parameters: {'p_sma': 53, 'p_std': 10, 'p_atr': 13, 'p_adx': 25, 'rsi_period': 67, 'ema1': 20, 'ema2': 27, 'slip_atr_k': 0.04329568813086955, 'slip_spread_k': 0.4733273126688435, 'spread_hl_frac': 0.009669003317873652, 'bb_std_mult': 2.4266597495806086, 'rsi_os': 10, 'rsi_ob': 85, 'vol_spike': 0.07460972124649336, 'adx_thresh': 26.102805059059822, 'atr_min_pct': 0.008542366972386943, 'atr_max_pct': 0.13578901144061414, 'tp_mult': 2.3618078461439738, 'tsl_mult': 0.9186318685871946, 'strategy': 'breakout', 'time_stop': 98, 'use_sma': False, 'use_atr': False, 'use_adx': False, 'use_ema': False, 'use_spike': False, 'rsi_required': False, 'edge_k': 0.7673999996106763, 'edge_cap': 0.900875651459761, 'bull_strategy': 'breakout', 'bull_bb_std_mult': 2.3769933778618535, 'bull_rsi_os': 18, 'bull_rsi_ob': 73, 'bull_adx_thresh': 17.69170301225673, 'bull_atr_min_pct': 0.011513454522603108, 'bull_atr_max_pct': 0.12148391186842852, 'bull_tp_mult': 1.324839314327332, 'bull_tsl_mult': 0.860962098591656, 'bull_time_stop': 16, 'bull_use_sma': False, 'bull_use_ema': True, 'bull_use_atr': False, 'bull_use_adx': True, 'bull_use_spike': True, 'bull_rsi_required': True, 'bear_strategy': 'breakout', 'bear_bb_std_mult': 2.5111841810734874, 'bear_rsi_os': 51, 'bear_rsi_ob': 45, 'bear_adx_thresh': 22.16671457349776, 'bear_atr_min_pct': 0.02768247359440975, 'bear_atr_max_pct': 0.013090647185915044, 'bear_tp_mult': 2.3281998152304966, 'bear_tsl_mult': 0.43541726512394363, 'bear_time_stop': 240, 'bear_use_sma': False, 'bear_use_ema': True, 'bear_use_atr': False, 'bear_use_adx': False, 'bear_use_spike': False, 'bear_rsi_required': False, 'sideways_strategy': 'breakout', 'sideways_bb_std_mult': 1.5115138526158542, 'sideways_rsi_os': 32, 'sideways_rsi_ob': 79, 'sideways_adx_thresh': 34.891481637202205, 'sideways_atr_min_pct': 0.02121454729789648, 'sideways_atr_max_pct': 0.038018513458464014, 'sideways_tp_mult': 1.774989556026532, 'sideways_tsl_mult': 0.8771332145475794, 'sideways_time_stop': 72, 'sideways_use_sma': False, 'sideways_use_ema': True, 'sideways_use_atr': False, 'sideways_use_adx': True, 'sideways_use_spike': True, 'sideways_rsi_required': True}.
[I 2025-09-01 14:37:30,578] Trial 269 finished with values: [-1000000000.0, 1000000000.0] and parameters: {'p_sma': 23, 'p_std': 6, 'p_atr': 14, 'p_adx': 23, 'rsi_period': 42, 'ema1': 28, 'ema2': 42, 'slip_atr_k': 0.024135014657346937, 'slip_spread_k': 0.058112352141365564, 'spread_hl_frac': 0.041772614217881275, 'bb_std_mult': 2.3642518600483386, 'rsi_os': 5, 'rsi_ob': 81, 'vol_spike': 0.04406208424644974, 'adx_thresh': 22.3818574065106, 'atr_min_pct': 0.00674912966683962, 'atr_max_pct': 0.08011726798940222, 'tp_mult': 2.301283202108825, 'tsl_mult': 0.6233717774593214, 'strategy': 'breakout', 'time_stop': 256, 'use_sma': True, 'use_atr': False, 'use_adx': False, 'use_ema': False, 'use_spike': False, 'rsi_required': True, 'edge_k': 1.9883824628905131, 'edge_cap': 0.965786368192185, 'bull_strategy': 'breakout', 'bull_bb_std_mult': 1.56923740504958, 'bull_rsi_os': 16, 'bull_rsi_ob': 52, 'bull_adx_thresh': 32.46347992413955, 'bull_atr_min_pct': 0.008732606760134116, 'bull_atr_max_pct': 0.04448981164426787, 'bull_tp_mult': 1.101206100916019, 'bull_tsl_mult': 0.9401886789208623, 'bull_time_stop': 23, 'bull_use_sma': False, 'bull_use_ema': False, 'bull_use_atr': False, 'bull_use_adx': True, 'bull_use_spike': False, 'bull_rsi_required': True, 'bear_strategy': 'breakout', 'bear_bb_std_mult': 2.1231815256515456, 'bear_rsi_os': 42, 'bear_rsi_ob': 46, 'bear_adx_thresh': 5.733309518303493, 'bear_atr_min_pct': 0.012957887376875794, 'bear_atr_max_pct': 0.02461951057597738, 'bear_tp_mult': 1.7562855571810585, 'bear_tsl_mult': 0.6866188123227851, 'bear_time_stop': 252, 'bear_use_sma': False, 'bear_use_ema': False, 'bear_use_atr': False, 'bear_use_adx': True, 'bear_use_spike': False, 'bear_rsi_required': True, 'sideways_strategy': 'mean_reversion', 'sideways_bb_std_mult': 2.150141830974231, 'sideways_rsi_os': 24, 'sideways_rsi_ob': 76, 'sideways_adx_thresh': 33.50623657234549, 'sideways_atr_min_pct': 0.015561366213529472, 'sideways_atr_max_pct': 0.05269794858027967, 'sideways_tp_mult': 2.6074614909718, 'sideways_tsl_mult': 0.8652038844779659, 'sideways_time_stop': 283, 'sideways_use_sma': True, 'sideways_use_ema': True, 'sideways_use_atr': False, 'sideways_use_adx': True, 'sideways_use_spike': True, 'sideways_rsi_required': False}.
[I 2025-09-01 14:37:31,550] Trial 267 finished with values: [-1000000000.0, 1000000000.0] and parameters: {'p_sma': 15, 'p_std': 19, 'p_atr': 24, 'p_adx': 16, 'rsi_period': 72, 'ema1': 15, 'ema2': 31, 'slip_atr_k': 0.14300861473489151, 'slip_spread_k': 0.38738133632204497, 'spread_hl_frac': 0.009752928064215788, 'bb_std_mult': 3.0383756502146126, 'rsi_os': 5, 'rsi_ob': 85, 'vol_spike': 0.25893571634434726, 'adx_thresh': 28.044375257222896, 'atr_min_pct': 0.005937973195463311, 'atr_max_pct': 0.07410941510708456, 'tp_mult': 2.2460701768245226, 'tsl_mult': 0.562834167263434, 'strategy': 'breakout', 'time_stop': 245, 'use_sma': False, 'use_atr': False, 'use_adx': True, 'use_ema': False, 'use_spike': False, 'rsi_required': False, 'edge_k': 1.6336318873144664, 'edge_cap': 0.7123356428365041, 'bull_strategy': 'breakout', 'bull_bb_std_mult': 3.1076877902010995, 'bull_rsi_os': 18, 'bull_rsi_ob': 91, 'bull_adx_thresh': 18.06605058121849, 'bull_atr_min_pct': 0.012053363364793762, 'bull_atr_max_pct': 0.04217505698744506, 'bull_tp_mult': 1.4586986880312558, 'bull_tsl_mult': 0.9408052573404166, 'bull_time_stop': 14, 'bull_use_sma': False, 'bull_use_ema': True, 'bull_use_atr': False, 'bull_use_adx': True, 'bull_use_spike': True, 'bull_rsi_required': True, 'bear_strategy': 'breakout', 'bear_bb_std_mult': 2.357964908688521, 'bear_rsi_os': 41, 'bear_rsi_ob': 65, 'bear_adx_thresh': 20.2121032208166, 'bear_atr_min_pct': 0.004983505880022818, 'bear_atr_max_pct': 0.07853012872563395, 'bear_tp_mult': 1.7437718773858235, 'bear_tsl_mult': 0.4711730289252551, 'bear_time_stop': 253, 'bear_use_sma': False, 'bear_use_ema': True, 'bear_use_atr': False, 'bear_use_adx': True, 'bear_use_spike': False, 'bear_rsi_required': False, 'sideways_strategy': 'breakout', 'sideways_bb_std_mult': 1.3267254646162119, 'sideways_rsi_os': 24, 'sideways_rsi_ob': 74, 'sideways_adx_thresh': 30.153616269651252, 'sideways_atr_min_pct': 0.01704311571675343, 'sideways_atr_max_pct': 0.030823726873181433, 'sideways_tp_mult': 2.7713814301840216, 'sideways_tsl_mult': 0.854932683472669, 'sideways_time_stop': 91, 'sideways_use_sma': False, 'sideways_use_ema': True, 'sideways_use_atr': False, 'sideways_use_adx': True, 'sideways_use_spike': True, 'sideways_rsi_required': True}.
[I 2025-09-01 14:37:31,569] Trial 268 finished with values: [-1000000000.0, 1000000000.0] and parameters: {'p_sma': 38, 'p_std': 48, 'p_atr': 22, 'p_adx': 13, 'rsi_period': 70, 'ema1': 30, 'ema2': 41, 'slip_atr_k': 0.044855584452602064, 'slip_spread_k': 0.514158579371301, 'spread_hl_frac': 0.04142115734402878, 'bb_std_mult': 3.031926559947598, 'rsi_os': 7, 'rsi_ob': 95, 'vol_spike': 0.04382698703290964, 'adx_thresh': 27.879267574272994, 'atr_min_pct': 0.007958103927950473, 'atr_max_pct': 0.12885346001682046, 'tp_mult': 2.264121828650634, 'tsl_mult': 0.571534637123919, 'strategy': 'breakout', 'time_stop': 287, 'use_sma': False, 'use_atr': False, 'use_adx': True, 'use_ema': False, 'use_spike': False, 'rsi_required': False, 'edge_k': 0.8611558806426385, 'edge_cap': 0.6066530958791282, 'bull_strategy': 'breakout', 'bull_bb_std_mult': 1.574795265575202, 'bull_rsi_os': 20, 'bull_rsi_ob': 46, 'bull_adx_thresh': 28.834985191015093, 'bull_atr_min_pct': 0.014262271219592308, 'bull_atr_max_pct': 0.04085647296923143, 'bull_tp_mult': 1.4691985680950006, 'bull_tsl_mult': 0.856618020847387, 'bull_time_stop': 22, 'bull_use_sma': False, 'bull_use_ema': True, 'bull_use_atr': False, 'bull_use_adx': True, 'bull_use_spike': True, 'bull_rsi_required': True, 'bear_strategy': 'breakout', 'bear_bb_std_mult': 1.2263149496145258, 'bear_rsi_os': 54, 'bear_rsi_ob': 46, 'bear_adx_thresh': 21.917407686537835, 'bear_atr_min_pct': 0.01866527908552222, 'bear_atr_max_pct': 0.013362274370722252, 'bear_tp_mult': 1.7583020051662357, 'bear_tsl_mult': 0.002108675565049345, 'bear_time_stop': 254, 'bear_use_sma': False, 'bear_use_ema': False, 'bear_use_atr': False, 'bear_use_adx': True, 'bear_use_spike': False, 'bear_rsi_required': False, 'sideways_strategy': 'breakout', 'sideways_bb_std_mult': 1.3833505618578301, 'sideways_rsi_os': 32, 'sideways_rsi_ob': 71, 'sideways_adx_thresh': 34.90169328078009, 'sideways_atr_min_pct': 0.025608561408814165, 'sideways_atr_max_pct': 0.05262303681646932, 'sideways_tp_mult': 2.7828506394850705, 'sideways_tsl_mult': 0.870747970499711, 'sideways_time_stop': 280, 'sideways_use_sma': False, 'sideways_use_ema': True, 'sideways_use_atr': False, 'sideways_use_adx': True, 'sideways_use_spike': True, 'sideways_rsi_required': True}.
