[I 2025-09-01 15:07:36,743] Trial 460 finished with values: [-1000000000.0, 1000000000.0] and parameters: {'p_sma': 34, 'p_std': 31, 'p_atr': 10, 'p_adx': 16, 'rsi_period': 70, 'ema1': 24, 'ema2': 13, 'slip_atr_k': 0.06610662966875869, 'slip_spread_k': 0.4574429732560615, 'spread_hl_frac': 0.011784925464712666, 'bb_std_mult': 2.3483920281941226, 'rsi_os': 30, 'rsi_ob': 49, 'vol_spike': 0.06103805026096362, 'adx_thresh': 28.187029294661905, 'atr_min_pct': 0.025349499582472408, 'atr_max_pct': 0.029712435345324396, 'tp_mult': 1.94252158207513, 'tsl_mult': 0.3882254196634336, 'strategy': 'breakout', 'time_stop': 47, 'use_sma': False, 'use_atr': True, 'use_adx': False, 'use_ema': True, 'use_spike': True, 'rsi_required': True, 'edge_k': 1.2285673481111292, 'edge_cap': 0.4512896176656291, 'bull_strategy': 'mean_reversion', 'bull_bb_std_mult': 0.7164047028693189, 'bull_rsi_os': 33, 'bull_rsi_ob': 65, 'bull_adx_thresh': 6.335153498918289, 'bull_atr_min_pct': 0.027358133304044914, 'bull_atr_max_pct': 0.03938312296302049, 'bull_tp_mult': 2.8063542188540715, 'bull_tsl_mult': 0.13508242477695315, 'bull_time_stop': 91, 'bull_use_sma': False, 'bull_use_ema': False, 'bull_use_atr': False, 'bull_use_adx': True, 'bull_use_spike': False, 'bull_rsi_required': True, 'bear_strategy': 'mean_reversion', 'bear_bb_std_mult': 1.5353490660240208, 'bear_rsi_os': 47, 'bear_rsi_ob': 58, 'bear_adx_thresh': 30.85958595109901, 'bear_atr_min_pct': 0.012595954352450879, 'bear_atr_max_pct': 0.04103399890785918, 'bear_tp_mult': 2.0794277027531516, 'bear_tsl_mult': 0.7348953679139771, 'bear_time_stop': 51, 'bear_use_sma': True, 'bear_use_ema': False, 'bear_use_atr': False, 'bear_use_adx': False, 'bear_use_spike': True, 'bear_rsi_required': True, 'sideways_strategy': 'breakout', 'sideways_bb_std_mult': 0.9923122468619335, 'sideways_rsi_os': 25, 'sideways_rsi_ob': 77, 'sideways_adx_thresh': 32.70191977754834, 'sideways_atr_min_pct': 0.01449365952209212, 'sideways_atr_max_pct': 0.10577726969045227, 'sideways_tp_mult': 1.7597894740566682, 'sideways_tsl_mult': 0.7887951008908662, 'sideways_time_stop': 67, 'sideways_use_sma': False, 'sideways_use_ema': False, 'sideways_use_atr': True, 'sideways_use_adx': True, 'sideways_use_spike': False, 'sideways_rsi_required': True}.
[I 2025-09-01 15:07:37,412] Trial 459 finished with values: [-1000000000.0, 1000000000.0] and parameters: {'p_sma': 34, 'p_std': 31, 'p_atr': 10, 'p_adx': 11, 'rsi_period': 70, 'ema1': 24, 'ema2': 57, 'slip_atr_k': 0.10305816439996147, 'slip_spread_k': 0.40310856556353747, 'spread_hl_frac': 0.011407509993108383, 'bb_std_mult': 2.3019272761587493, 'rsi_os': 30, 'rsi_ob': 93, 'vol_spike': 0.05987850502323658, 'adx_thresh': 21.594482226142983, 'atr_min_pct': 0.015723178560221762, 'atr_max_pct': 0.06861088855510376, 'tp_mult': 2.985669955375474, 'tsl_mult': 0.3811547088391549, 'strategy': 'breakout', 'time_stop': 53, 'use_sma': False, 'use_atr': True, 'use_adx': True, 'use_ema': True, 'use_spike': True, 'rsi_required': True, 'edge_k': 1.0369823355344392, 'edge_cap': 0.15177221308322353, 'bull_strategy': 'mean_reversion', 'bull_bb_std_mult': 0.7298208661743011, 'bull_rsi_os': 26, 'bull_rsi_ob': 66, 'bull_adx_thresh': 7.363135798123162, 'bull_atr_min_pct': 0.020355677525855032, 'bull_atr_max_pct': 0.04091143604495148, 'bull_tp_mult': 1.4459932680778325, 'bull_tsl_mult': 0.13830673054097675, 'bull_time_stop': 131, 'bull_use_sma': False, 'bull_use_ema': True, 'bull_use_atr': False, 'bull_use_adx': True, 'bull_use_spike': False, 'bull_rsi_required': True, 'bear_strategy': 'mean_reversion', 'bear_bb_std_mult': 1.3266535593993836, 'bear_rsi_os': 42, 'bear_rsi_ob': 52, 'bear_adx_thresh': 8.188849744901802, 'bear_atr_min_pct': 0.004609160269244838, 'bear_atr_max_pct': 0.04167143420783595, 'bear_tp_mult': 1.6090250518338454, 'bear_tsl_mult': 0.0017235907036987075, 'bear_time_stop': 13, 'bear_use_sma': True, 'bear_use_ema': False, 'bear_use_atr': False, 'bear_use_adx': False, 'bear_use_spike': True, 'bear_rsi_required': True, 'sideways_strategy': 'breakout', 'sideways_bb_std_mult': 1.0092537786118596, 'sideways_rsi_os': 46, 'sideways_rsi_ob': 76, 'sideways_adx_thresh': 32.80068125885731, 'sideways_atr_min_pct': 0.008130754681660194, 'sideways_atr_max_pct': 0.05795967130509477, 'sideways_tp_mult': 2.3827496131325816, 'sideways_tsl_mult': 0.7004427476201305, 'sideways_time_stop': 56, 'sideways_use_sma': False, 'sideways_use_ema': False, 'sideways_use_atr': True, 'sideways_use_adx': True, 'sideways_use_spike': False, 'sideways_rsi_required': True}.
[I 2025-09-01 15:07:37,972] Trial 458 finished with values: [-1000000000.0, 1000000000.0] and parameters: {'p_sma': 5, 'p_std': 27, 'p_atr': 12, 'p_adx': 10, 'rsi_period': 23, 'ema1': 24, 'ema2': 32, 'slip_atr_k': 0.06742869996342564, 'slip_spread_k': 0.37626021623824, 'spread_hl_frac': 0.010161514165015723, 'bb_std_mult': 2.0659742427809236, 'rsi_os': 31, 'rsi_ob': 54, 'vol_spike': 0.06050970865942382, 'adx_thresh': 9.909230357070415, 'atr_min_pct': 0.0018245052125080447, 'atr_max_pct': 0.06823055543206506, 'tp_mult': 2.921351158054995, 'tsl_mult': 0.9060757329882452, 'strategy': 'breakout', 'time_stop': 49, 'use_sma': False, 'use_atr': True, 'use_adx': True, 'use_ema': True, 'use_spike': True, 'rsi_required': True, 'edge_k': 1.2376260580891274, 'edge_cap': 0.8432345367685901, 'bull_strategy': 'mean_reversion', 'bull_bb_std_mult': 0.689914917738302, 'bull_rsi_os': 52, 'bull_rsi_ob': 66, 'bull_adx_thresh': 6.656993215803777, 'bull_atr_min_pct': 0.020372417321655914, 'bull_atr_max_pct': 0.03438123117024674, 'bull_tp_mult': 2.8166548850399584, 'bull_tsl_mult': 0.13876716368877018, 'bull_time_stop': 129, 'bull_use_sma': False, 'bull_use_ema': True, 'bull_use_atr': False, 'bull_use_adx': True, 'bull_use_spike': False, 'bull_rsi_required': True, 'bear_strategy': 'mean_reversion', 'bear_bb_std_mult': 0.8025977250489087, 'bear_rsi_os': 48, 'bear_rsi_ob': 66, 'bear_adx_thresh': 30.785297360875006, 'bear_atr_min_pct': 0.010478442589842311, 'bear_atr_max_pct': 0.04242347150805883, 'bear_tp_mult': 1.5931804726772572, 'bear_tsl_mult': 0.7329188260403269, 'bear_time_stop': 255, 'bear_use_sma': True, 'bear_use_ema': False, 'bear_use_atr': False, 'bear_use_adx': False, 'bear_use_spike': True, 'bear_rsi_required': True, 'sideways_strategy': 'mean_reversion', 'sideways_bb_std_mult': 2.4323426972628464, 'sideways_rsi_os': 22, 'sideways_rsi_ob': 76, 'sideways_adx_thresh': 32.58933282491187, 'sideways_atr_min_pct': 0.007849201113967953, 'sideways_atr_max_pct': 0.0961492865298526, 'sideways_tp_mult': 2.3875828647896995, 'sideways_tsl_mult': 0.703766138216221, 'sideways_time_stop': 159, 'sideways_use_sma': True, 'sideways_use_ema': False, 'sideways_use_atr': True, 'sideways_use_adx': True, 'sideways_use_spike': False, 'sideways_rsi_required': True}.
[I 2025-09-01 15:07:38,465] Trial 462 finished with values: [-0.02978418539518113, 0.029740027668958204] and parameters: {'p_sma': 34, 'p_std': 27, 'p_atr': 19, 'p_adx': 29, 'rsi_period': 56, 'ema1': 23, 'ema2': 55, 'slip_atr_k': 0.008919427217215798, 'slip_spread_k': 0.40667984510160937, 'spread_hl_frac': 0.011658226090185722, 'bb_std_mult': 2.216654295128342, 'rsi_os': 29, 'rsi_ob': 54, 'vol_spike': 0.07359079686065616, 'adx_thresh': 27.99372621055445, 'atr_min_pct': 0.013984357380996465, 'atr_max_pct': 0.03069744843414101, 'tp_mult': 1.9982433822989876, 'tsl_mult': 0.4287194124409173, 'strategy': 'breakout', 'time_stop': 5, 'use_sma': False, 'use_atr': True, 'use_adx': False, 'use_ema': True, 'use_spike': True, 'rsi_required': True, 'edge_k': 1.824948242949235, 'edge_cap': 0.15384410090354061, 'bull_strategy': 'mean_reversion', 'bull_bb_std_mult': 0.6997053159702648, 'bull_rsi_os': 53, 'bull_rsi_ob': 65, 'bull_adx_thresh': 28.74972505559054, 'bull_atr_min_pct': 0.014584026908276275, 'bull_atr_max_pct': 0.040029495922307146, 'bull_tp_mult': 2.215769839685595, 'bull_tsl_mult': 0.16386477495942764, 'bull_time_stop': 122, 'bull_use_sma': False, 'bull_use_ema': True, 'bull_use_atr': False, 'bull_use_adx': False, 'bull_use_spike': False, 'bull_rsi_required': True, 'bear_strategy': 'mean_reversion', 'bear_bb_std_mult': 1.5430050220707878, 'bear_rsi_os': 42, 'bear_rsi_ob': 54, 'bear_adx_thresh': 15.450340477563882, 'bear_atr_min_pct': 0.0059709536509245115, 'bear_atr_max_pct': 0.1476035523846818, 'bear_tp_mult': 2.6741963622482463, 'bear_tsl_mult': 0.7353206468455865, 'bear_time_stop': 12, 'bear_use_sma': True, 'bear_use_ema': False, 'bear_use_atr': False, 'bear_use_adx': False, 'bear_use_spike': True, 'bear_rsi_required': True, 'sideways_strategy': 'mean_reversion', 'sideways_bb_std_mult': 1.012809956539768, 'sideways_rsi_os': 7, 'sideways_rsi_ob': 57, 'sideways_adx_thresh': 32.82891602535059, 'sideways_atr_min_pct': 0.0018028720327032954, 'sideways_atr_max_pct': 0.1127119597708083, 'sideways_tp_mult': 1.878447276882664, 'sideways_tsl_mult': 0.7891832273193161, 'sideways_time_stop': 68, 'sideways_use_sma': True, 'sideways_use_ema': False, 'sideways_use_atr': True, 'sideways_use_adx': False, 'sideways_use_spike': False, 'sideways_rsi_required': True}.
[I 2025-09-01 15:08:23,032] Trial 466 finished with values: [-1000000000.0, 1000000000.0] and parameters: {'p_sma': 41, 'p_std': 39, 'p_atr': 11, 'p_adx': 15, 'rsi_period': 67, 'ema1': 27, 'ema2': 45, 'slip_atr_k': 0.14314506534281574, 'slip_spread_k': 0.12185008280445003, 'spread_hl_frac': 0.005180574400205716, 'bb_std_mult': 1.1698825919788811, 'rsi_os': 28, 'rsi_ob': 51, 'vol_spike': 0.2170309816651791, 'adx_thresh': 26.597777518375295, 'atr_min_pct': 0.0005237488280980078, 'atr_max_pct': 0.06495040503181077, 'tp_mult': 2.10637888344629, 'tsl_mult': 0.7451911642029017, 'strategy': 'mean_reversion', 'time_stop': 65, 'use_sma': True, 'use_atr': True, 'use_adx': False, 'use_ema': True, 'use_spike': False, 'rsi_required': False, 'edge_k': 1.300689281000575, 'edge_cap': 0.8948843707390822, 'bull_strategy': 'mean_reversion', 'bull_bb_std_mult': 2.4557792229363797, 'bull_rsi_os': 38, 'bull_rsi_ob': 67, 'bull_adx_thresh': 5.736082114205978, 'bull_atr_min_pct': 0.016747354455437877, 'bull_atr_max_pct': 0.03689749650731276, 'bull_tp_mult': 2.7353923345926425, 'bull_tsl_mult': 0.034694658625622765, 'bull_time_stop': 280, 'bull_use_sma': True, 'bull_use_ema': True, 'bull_use_atr': True, 'bull_use_adx': False, 'bull_use_spike': True, 'bull_rsi_required': False, 'bear_strategy': 'breakout', 'bear_bb_std_mult': 1.4597957518743239, 'bear_rsi_os': 49, 'bear_rsi_ob': 51, 'bear_adx_thresh': 27.250306724265577, 'bear_atr_min_pct': 0.016927657753192688, 'bear_atr_max_pct': 0.1203165231095568, 'bear_tp_mult': 2.141762228115487, 'bear_tsl_mult': 0.6970744854861795, 'bear_time_stop': 244, 'bear_use_sma': True, 'bear_use_ema': False, 'bear_use_atr': False, 'bear_use_adx': True, 'bear_use_spike': True, 'bear_rsi_required': False, 'sideways_strategy': 'mean_reversion', 'sideways_bb_std_mult': 1.0934067897251858, 'sideways_rsi_os': 24, 'sideways_rsi_ob': 81, 'sideways_adx_thresh': 33.452446579746876, 'sideways_atr_min_pct': 0.01139548756122719, 'sideways_atr_max_pct': 0.12683673482862223, 'sideways_tp_mult': 1.5131751117023473, 'sideways_tsl_mult': 0.32218032246633554, 'sideways_time_stop': 129, 'sideways_use_sma': True, 'sideways_use_ema': False, 'sideways_use_atr': True, 'sideways_use_adx': False, 'sideways_use_spike': False, 'sideways_rsi_required': True}.
[I 2025-09-01 15:08:23,656] Trial 463 finished with values: [-0.040692550138416106, 0.041190351078819076] and parameters: {'p_sma': 41, 'p_std': 17, 'p_atr': 29, 'p_adx': 11, 'rsi_period': 56, 'ema1': 27, 'ema2': 55, 'slip_atr_k': 0.19927106395391767, 'slip_spread_k': 0.7653575355492941, 'spread_hl_frac': 0.005078278339354337, 'bb_std_mult': 3.385292359705394, 'rsi_os': 29, 'rsi_ob': 61, 'vol_spike': 0.10474904651271663, 'adx_thresh': 27.735701061319464, 'atr_min_pct': 0.016285049951816715, 'atr_max_pct': 0.061238266436199326, 'tp_mult': 2.9986136219465522, 'tsl_mult': 0.7337561899161338, 'strategy': 'breakout', 'time_stop': 7, 'use_sma': False, 'use_atr': True, 'use_adx': False, 'use_ema': True, 'use_spike': False, 'rsi_required': False, 'edge_k': 1.640624925264533, 'edge_cap': 0.43448806134778534, 'bull_strategy': 'mean_reversion', 'bull_bb_std_mult': 2.4101263211311172, 'bull_rsi_os': 53, 'bull_rsi_ob': 65, 'bull_adx_thresh': 23.355978300040373, 'bull_atr_min_pct': 0.01695807439812283, 'bull_atr_max_pct': 0.013270253153961048, 'bull_tp_mult': 2.4531202417638402, 'bull_tsl_mult': 0.1434427445311771, 'bull_time_stop': 125, 'bull_use_sma': True, 'bull_use_ema': True, 'bull_use_atr': False, 'bull_use_adx': False, 'bull_use_spike': True, 'bull_rsi_required': False, 'bear_strategy': 'breakout', 'bear_bb_std_mult': 1.3378824614933738, 'bear_rsi_os': 49, 'bear_rsi_ob': 54, 'bear_adx_thresh': 15.460545890164656, 'bear_atr_min_pct': 0.004599080441132385, 'bear_atr_max_pct': 0.13976353619272724, 'bear_tp_mult': 1.5469399237795975, 'bear_tsl_mult': 0.700882271946135, 'bear_time_stop': 196, 'bear_use_sma': True, 'bear_use_ema': False, 'bear_use_atr': False, 'bear_use_adx': False, 'bear_use_spike': True, 'bear_rsi_required': False, 'sideways_strategy': 'mean_reversion', 'sideways_bb_std_mult': 1.05830388376666, 'sideways_rsi_os': 24, 'sideways_rsi_ob': 57, 'sideways_adx_thresh': 33.47215922836211, 'sideways_atr_min_pct': 0.010614826299853648, 'sideways_atr_max_pct': 0.13046317548171188, 'sideways_tp_mult': 2.2161017577964617, 'sideways_tsl_mult': 0.11006659059314716, 'sideways_time_stop': 69, 'sideways_use_sma': True, 'sideways_use_ema': False, 'sideways_use_atr': True, 'sideways_use_adx': False, 'sideways_use_spike': False, 'sideways_rsi_required': True}.
[I 2025-09-01 15:08:24,332] Trial 464 finished with values: [-1000000000.0, 1000000000.0] and parameters: {'p_sma': 5, 'p_std': 39, 'p_atr': 11, 'p_adx': 27, 'rsi_period': 56, 'ema1': 27, 'ema2': 34, 'slip_atr_k': 0.198830980170698, 'slip_spread_k': 0.4205908492005505, 'spread_hl_frac': 0.027912138635439926, 'bb_std_mult': 2.2201366361548587, 'rsi_os': 29, 'rsi_ob': 67, 'vol_spike': 0.10703737492914518, 'adx_thresh': 27.692389369836288, 'atr_min_pct': 0.020601146283267008, 'atr_max_pct': 0.06175512568157352, 'tp_mult': 2.915606281297287, 'tsl_mult': 0.9314393057693645, 'strategy': 'breakout', 'time_stop': 7, 'use_sma': False, 'use_atr': True, 'use_adx': False, 'use_ema': True, 'use_spike': False, 'rsi_required': False, 'edge_k': 1.2477222663704133, 'edge_cap': 0.9053927099995979, 'bull_strategy': 'mean_reversion', 'bull_bb_std_mult': 1.109198543133344, 'bull_rsi_os': 52, 'bull_rsi_ob': 67, 'bull_adx_thresh': 6.298161156262045, 'bull_atr_min_pct': 0.014595963627864774, 'bull_atr_max_pct': 0.13600849057065922, 'bull_tp_mult': 1.4251129526262825, 'bull_tsl_mult': 0.1641419788020378, 'bull_time_stop': 119, 'bull_use_sma': True, 'bull_use_ema': True, 'bull_use_atr': False, 'bull_use_adx': False, 'bull_use_spike': True, 'bull_rsi_required': False, 'bear_strategy': 'breakout', 'bear_bb_std_mult': 1.765862946075758, 'bear_rsi_os': 52, 'bear_rsi_ob': 51, 'bear_adx_thresh': 28.280277731439796, 'bear_atr_min_pct': 0.005924013016323112, 'bear_atr_max_pct': 0.12095670376389904, 'bear_tp_mult': 2.6917238927321003, 'bear_tsl_mult': 0.6931341773838736, 'bear_time_stop': 244, 'bear_use_sma': True, 'bear_use_ema': False, 'bear_use_atr': False, 'bear_use_adx': False, 'bear_use_spike': True, 'bear_rsi_required': False, 'sideways_strategy': 'mean_reversion', 'sideways_bb_std_mult': 0.8298948535606958, 'sideways_rsi_os': 42, 'sideways_rsi_ob': 71, 'sideways_adx_thresh': 21.57267317826086, 'sideways_atr_min_pct': 0.01059418219036323, 'sideways_atr_max_pct': 0.12941864915683401, 'sideways_tp_mult': 2.0400808057771913, 'sideways_tsl_mult': 0.13328529573365588, 'sideways_time_stop': 67, 'sideways_use_sma': True, 'sideways_use_ema': False, 'sideways_use_atr': True, 'sideways_use_adx': False, 'sideways_use_spike': False, 'sideways_rsi_required': True}.
[I 2025-09-01 15:08:24,802] Trial 465 finished with values: [-1000000000.0, 1000000000.0] and parameters: {'p_sma': 30, 'p_std': 19, 'p_atr': 11, 'p_adx': 15, 'rsi_period': 16, 'ema1': 20, 'ema2': 55, 'slip_atr_k': 0.009854358731659147, 'slip_spread_k': 0.11303120024728897, 'spread_hl_frac': 0.0052113981844399545, 'bb_std_mult': 1.8384659038267344, 'rsi_os': 29, 'rsi_ob': 78, 'vol_spike': 0.10564710696985946, 'adx_thresh': 34.94084839358885, 'atr_min_pct': 0.02942286081243302, 'atr_max_pct': 0.12902135161521186, 'tp_mult': 2.1260972197835257, 'tsl_mult': 0.9365220481550032, 'strategy': 'mean_reversion', 'time_stop': 5, 'use_sma': True, 'use_atr': True, 'use_adx': False, 'use_ema': True, 'use_spike': False, 'rsi_required': False, 'edge_k': 1.6426091193070451, 'edge_cap': 0.8964882666534226, 'bull_strategy': 'mean_reversion', 'bull_bb_std_mult': 2.430332177833147, 'bull_rsi_os': 23, 'bull_rsi_ob': 64, 'bull_adx_thresh': 5.588402894610481, 'bull_atr_min_pct': 0.01684770136373867, 'bull_atr_max_pct': 0.05844345173760382, 'bull_tp_mult': 1.3047167169729625, 'bull_tsl_mult': 0.0007892240857673427, 'bull_time_stop': 292, 'bull_use_sma': True, 'bull_use_ema': True, 'bull_use_atr': True, 'bull_use_adx': False, 'bull_use_spike': True, 'bull_rsi_required': False, 'bear_strategy': 'breakout', 'bear_bb_std_mult': 1.4735333923710796, 'bear_rsi_os': 52, 'bear_rsi_ob': 76, 'bear_adx_thresh': 9.013106655500769, 'bear_atr_min_pct': 0.01696262882449291, 'bear_atr_max_pct': 0.14679757124665185, 'bear_tp_mult': 1.4110137988219824, 'bear_tsl_mult': 0.6866632928368168, 'bear_time_stop': 276, 'bear_use_sma': True, 'bear_use_ema': False, 'bear_use_atr': False, 'bear_use_adx': False, 'bear_use_spike': True, 'bear_rsi_required': False, 'sideways_strategy': 'mean_reversion', 'sideways_bb_std_mult': 3.55754843801593, 'sideways_rsi_os': 9, 'sideways_rsi_ob': 91, 'sideways_adx_thresh': 33.61732469771461, 'sideways_atr_min_pct': 0.010547204517114205, 'sideways_atr_max_pct': 0.11384657046254243, 'sideways_tp_mult': 2.032994165841757, 'sideways_tsl_mult': 0.786134386610648, 'sideways_time_stop': 68, 'sideways_use_sma': True, 'sideways_use_ema': False, 'sideways_use_atr': True, 'sideways_use_adx': False, 'sideways_use_spike': False, 'sideways_rsi_required': True}.
[I 2025-09-01 15:09:07,370] Trial 470 finished with values: [-1000000000.0, 1000000000.0] and parameters: {'p_sma': 9, 'p_std': 25, 'p_atr': 12, 'p_adx': 14, 'rsi_period': 72, 'ema1': 25, 'ema2': 17, 'slip_atr_k': 0.017696692402888188, 'slip_spread_k': 0.7089326887515426, 'spread_hl_frac': 0.008632940618638962, 'bb_std_mult': 0.8010739822472073, 'rsi_os': 47, 'rsi_ob': 78, 'vol_spike': 0.13646737762926187, 'adx_thresh': 27.11631858929782, 'atr_min_pct': 0.01649094243758265, 'atr_max_pct': 0.06575936119499047, 'tp_mult': 1.9696222477931875, 'tsl_mult': 0.41028483684154615, 'strategy': 'breakout', 'time_stop': 157, 'use_sma': False, 'use_atr': True, 'use_adx': False, 'use_ema': True, 'use_spike': False, 'rsi_required': True, 'edge_k': 1.1820855649274429, 'edge_cap': 0.8243851228626327, 'bull_strategy': 'mean_reversion', 'bull_bb_std_mult': 1.0469474234640925, 'bull_rsi_os': 6, 'bull_rsi_ob': 68, 'bull_adx_thresh': 24.90746755907829, 'bull_atr_min_pct': 0.025538059459594704, 'bull_atr_max_pct': 0.029703667409574645, 'bull_tp_mult': 2.042426805533922, 'bull_tsl_mult': 0.6453994832161685, 'bull_time_stop': 139, 'bull_use_sma': False, 'bull_use_ema': False, 'bull_use_atr': False, 'bull_use_adx': True, 'bull_use_spike': False, 'bull_rsi_required': True, 'bear_strategy': 'breakout', 'bear_bb_std_mult': 1.5175992164489949, 'bear_rsi_os': 50, 'bear_rsi_ob': 49, 'bear_adx_thresh': 8.786922723184961, 'bear_atr_min_pct': 0.019198203598475065, 'bear_atr_max_pct': 0.12578484660515077, 'bear_tp_mult': 1.638429246492922, 'bear_tsl_mult': 0.04748024188881833, 'bear_time_stop': 271, 'bear_use_sma': True, 'bear_use_ema': False, 'bear_use_atr': False, 'bear_use_adx': True, 'bear_use_spike': True, 'bear_rsi_required': True, 'sideways_strategy': 'breakout', 'sideways_bb_std_mult': 3.137258644321384, 'sideways_rsi_os': 23, 'sideways_rsi_ob': 78, 'sideways_adx_thresh': 19.47652987209718, 'sideways_atr_min_pct': 0.0038875655681431392, 'sideways_atr_max_pct': 0.14450682948845392, 'sideways_tp_mult': 2.3028275223144967, 'sideways_tsl_mult': 0.7653471865004398, 'sideways_time_stop': 140, 'sideways_use_sma': False, 'sideways_use_ema': False, 'sideways_use_atr': True, 'sideways_use_adx': True, 'sideways_use_spike': False, 'sideways_rsi_required': True}.
