[I 2025-09-01 15:11:52,126] Trial 487 finished with values: [-1000000000.0, 1000000000.0] and parameters: {'p_sma': 49, 'p_std': 27, 'p_atr': 23, 'p_adx': 14, 'rsi_period': 74, 'ema1': 26, 'ema2': 59, 'slip_atr_k': 0.020886400292204413, 'slip_spread_k': 0.37325818027178076, 'spread_hl_frac': 0.023635925371646757, 'bb_std_mult': 1.7572458262629804, 'rsi_os': 28, 'rsi_ob': 56, 'vol_spike': 0.18718016584504574, 'adx_thresh': 27.482562163306845, 'atr_min_pct': 0.018177490692555493, 'atr_max_pct': 0.024805742577026564, 'tp_mult': 2.003865017984483, 'tsl_mult': 0.04694588613347317, 'strategy': 'breakout', 'time_stop': 252, 'use_sma': True, 'use_atr': True, 'use_adx': False, 'use_ema': True, 'use_spike': False, 'rsi_required': True, 'edge_k': 1.3238754512015074, 'edge_cap': 0.8537007809268817, 'bull_strategy': 'mean_reversion', 'bull_bb_std_mult': 1.1930366571234632, 'bull_rsi_os': 24, 'bull_rsi_ob': 68, 'bull_adx_thresh': 5.854399682180646, 'bull_atr_min_pct': 0.017428030018110524, 'bull_atr_max_pct': 0.12303711098112277, 'bull_tp_mult': 1.991398115102324, 'bull_tsl_mult': 0.06728523488810495, 'bull_time_stop': 271, 'bull_use_sma': False, 'bull_use_ema': True, 'bull_use_atr': False, 'bull_use_adx': True, 'bull_use_spike': False, 'bull_rsi_required': True, 'bear_strategy': 'mean_reversion', 'bear_bb_std_mult': 1.6020991302888514, 'bear_rsi_os': 48, 'bear_rsi_ob': 73, 'bear_adx_thresh': 10.71909103544415, 'bear_atr_min_pct': 0.004243682064546506, 'bear_atr_max_pct': 0.057700391943918294, 'bear_tp_mult': 2.3334374332745065, 'bear_tsl_mult': 0.7400206849624898, 'bear_time_stop': 153, 'bear_use_sma': True, 'bear_use_ema': False, 'bear_use_atr': False, 'bear_use_adx': False, 'bear_use_spike': True, 'bear_rsi_required': True, 'sideways_strategy': 'mean_reversion', 'sideways_bb_std_mult': 2.9844930844553543, 'sideways_rsi_os': 22, 'sideways_rsi_ob': 80, 'sideways_adx_thresh': 5.916096214104785, 'sideways_atr_min_pct': 0.013169177385667951, 'sideways_atr_max_pct': 0.05080239757517745, 'sideways_tp_mult': 2.2750569782285237, 'sideways_tsl_mult': 0.08453580478520961, 'sideways_time_stop': 63, 'sideways_use_sma': True, 'sideways_use_ema': False, 'sideways_use_atr': True, 'sideways_use_adx': True, 'sideways_use_spike': False, 'sideways_rsi_required': True}.
[I 2025-09-01 15:11:52,500] Trial 485 finished with values: [-0.0647283151223299, 0.06460962747930318] and parameters: {'p_sma': 51, 'p_std': 26, 'p_atr': 11, 'p_adx': 14, 'rsi_period': 34, 'ema1': 9, 'ema2': 59, 'slip_atr_k': 0.020537652625059195, 'slip_spread_k': 0.8511212613585608, 'spread_hl_frac': 0.023123678051373605, 'bb_std_mult': 3.164404780601288, 'rsi_os': 27, 'rsi_ob': 76, 'vol_spike': 0.06690734197971461, 'adx_thresh': 18.499600808579107, 'atr_min_pct': 0.02704725749358809, 'atr_max_pct': 0.07898301751158135, 'tp_mult': 2.6750577633696464, 'tsl_mult': 0.3916656671348224, 'strategy': 'breakout', 'time_stop': 182, 'use_sma': False, 'use_atr': True, 'use_adx': False, 'use_ema': True, 'use_spike': False, 'rsi_required': True, 'edge_k': 0.24746030253095175, 'edge_cap': 0.8913628687286999, 'bull_strategy': 'mean_reversion', 'bull_bb_std_mult': 1.1850054344147842, 'bull_rsi_os': 11, 'bull_rsi_ob': 95, 'bull_adx_thresh': 5.928503673177181, 'bull_atr_min_pct': 0.021018778434758693, 'bull_atr_max_pct': 0.017376091036461164, 'bull_tp_mult': 1.3946803198864488, 'bull_tsl_mult': 0.07159032634249164, 'bull_time_stop': 270, 'bull_use_sma': False, 'bull_use_ema': True, 'bull_use_atr': False, 'bull_use_adx': True, 'bull_use_spike': False, 'bull_rsi_required': True, 'bear_strategy': 'mean_reversion', 'bear_bb_std_mult': 1.6121543563747331, 'bear_rsi_os': 18, 'bear_rsi_ob': 52, 'bear_adx_thresh': 9.76951847623747, 'bear_atr_min_pct': 0.0026810700208042084, 'bear_atr_max_pct': 0.12961481308381154, 'bear_tp_mult': 1.571174980223562, 'bear_tsl_mult': 0.7953924796320286, 'bear_time_stop': 254, 'bear_use_sma': True, 'bear_use_ema': False, 'bear_use_atr': False, 'bear_use_adx': False, 'bear_use_spike': True, 'bear_rsi_required': True, 'sideways_strategy': 'mean_reversion', 'sideways_bb_std_mult': 0.651249614636972, 'sideways_rsi_os': 39, 'sideways_rsi_ob': 80, 'sideways_adx_thresh': 18.08382631126241, 'sideways_atr_min_pct': 0.011745102698714571, 'sideways_atr_max_pct': 0.044333621885817354, 'sideways_tp_mult': 2.1722517094515688, 'sideways_tsl_mult': 0.7404838218282348, 'sideways_time_stop': 276, 'sideways_use_sma': True, 'sideways_use_ema': False, 'sideways_use_atr': True, 'sideways_use_adx': True, 'sideways_use_spike': False, 'sideways_rsi_required': True}.
[I 2025-09-01 15:11:53,003] Trial 488 finished with values: [-1000000000.0, 1000000000.0] and parameters: {'p_sma': 50, 'p_std': 27, 'p_atr': 11, 'p_adx': 14, 'rsi_period': 74, 'ema1': 26, 'ema2': 59, 'slip_atr_k': 0.00500867480810545, 'slip_spread_k': 0.36100947145987694, 'spread_hl_frac': 0.00931766271253769, 'bb_std_mult': 3.214540032153555, 'rsi_os': 28, 'rsi_ob': 81, 'vol_spike': 0.2758512262835449, 'adx_thresh': 27.367354141432465, 'atr_min_pct': 0.0182085348687216, 'atr_max_pct': 0.025206189945491723, 'tp_mult': 1.7809847164954524, 'tsl_mult': 0.4378280627947, 'strategy': 'mean_reversion', 'time_stop': 10, 'use_sma': True, 'use_atr': True, 'use_adx': True, 'use_ema': True, 'use_spike': True, 'rsi_required': True, 'edge_k': 1.3071326516686599, 'edge_cap': 0.4671362835262262, 'bull_strategy': 'mean_reversion', 'bull_bb_std_mult': 0.9137916977377837, 'bull_rsi_os': 37, 'bull_rsi_ob': 65, 'bull_adx_thresh': 8.851403638661258, 'bull_atr_min_pct': 0.023923844377888696, 'bull_atr_max_pct': 0.12129062358414948, 'bull_tp_mult': 1.401809791085282, 'bull_tsl_mult': 0.08560517384180677, 'bull_time_stop': 75, 'bull_use_sma': False, 'bull_use_ema': True, 'bull_use_atr': True, 'bull_use_adx': True, 'bull_use_spike': False, 'bull_rsi_required': True, 'bear_strategy': 'mean_reversion', 'bear_bb_std_mult': 1.5896042091812863, 'bear_rsi_os': 38, 'bear_rsi_ob': 71, 'bear_adx_thresh': 17.84180499261898, 'bear_atr_min_pct': 0.004285587804819647, 'bear_atr_max_pct': 0.10295453431526225, 'bear_tp_mult': 2.951513159642648, 'bear_tsl_mult': 0.9224347130058701, 'bear_time_stop': 262, 'bear_use_sma': True, 'bear_use_ema': False, 'bear_use_atr': False, 'bear_use_adx': False, 'bear_use_spike': True, 'bear_rsi_required': True, 'sideways_strategy': 'mean_reversion', 'sideways_bb_std_mult': 1.204309686906572, 'sideways_rsi_os': 24, 'sideways_rsi_ob': 80, 'sideways_adx_thresh': 33.71120931274219, 'sideways_atr_min_pct': 0.012978033796596452, 'sideways_atr_max_pct': 0.051501747615762185, 'sideways_tp_mult': 2.997037754997711, 'sideways_tsl_mult': 0.7333126475227869, 'sideways_time_stop': 175, 'sideways_use_sma': True, 'sideways_use_ema': False, 'sideways_use_atr': True, 'sideways_use_adx': True, 'sideways_use_spike': False, 'sideways_rsi_required': True}.
[I 2025-09-01 15:11:53,484] Trial 489 finished with values: [-0.025543103505899167, 0.030300868186488975] and parameters: {'p_sma': 31, 'p_std': 27, 'p_atr': 11, 'p_adx': 7, 'rsi_period': 74, 'ema1': 17, 'ema2': 58, 'slip_atr_k': 0.005765140672346666, 'slip_spread_k': 0.4611965604161214, 'spread_hl_frac': 0.007750807024603498, 'bb_std_mult': 1.9616776855327027, 'rsi_os': 28, 'rsi_ob': 78, 'vol_spike': 0.27595688592761136, 'adx_thresh': 27.17296990283785, 'atr_min_pct': 0.01808922025773964, 'atr_max_pct': 0.10795412174855115, 'tp_mult': 2.014992897476465, 'tsl_mult': 0.4364381679989764, 'strategy': 'mean_reversion', 'time_stop': 198, 'use_sma': True, 'use_atr': True, 'use_adx': True, 'use_ema': True, 'use_spike': True, 'rsi_required': True, 'edge_k': 0.24726706860282488, 'edge_cap': 0.8509362877048614, 'bull_strategy': 'mean_reversion', 'bull_bb_std_mult': 0.5600733979284442, 'bull_rsi_os': 31, 'bull_rsi_ob': 65, 'bull_adx_thresh': 26.41689124454221, 'bull_atr_min_pct': 0.016063744772759438, 'bull_atr_max_pct': 0.02498456980459445, 'bull_tp_mult': 1.3970860796169295, 'bull_tsl_mult': 0.0886124106644392, 'bull_time_stop': 141, 'bull_use_sma': False, 'bull_use_ema': True, 'bull_use_atr': True, 'bull_use_adx': True, 'bull_use_spike': False, 'bull_rsi_required': True, 'bear_strategy': 'breakout', 'bear_bb_std_mult': 1.0338417582824873, 'bear_rsi_os': 51, 'bear_rsi_ob': 52, 'bear_adx_thresh': 24.40207081086213, 'bear_atr_min_pct': 0.004268403221979069, 'bear_atr_max_pct': 0.057728498525573435, 'bear_tp_mult': 1.7158698565560544, 'bear_tsl_mult': 0.6774586281941918, 'bear_time_stop': 122, 'bear_use_sma': True, 'bear_use_ema': False, 'bear_use_atr': False, 'bear_use_adx': True, 'bear_use_spike': True, 'bear_rsi_required': True, 'sideways_strategy': 'breakout', 'sideways_bb_std_mult': 3.006279593030846, 'sideways_rsi_os': 39, 'sideways_rsi_ob': 80, 'sideways_adx_thresh': 5.947668245935716, 'sideways_atr_min_pct': 0.012781456309355817, 'sideways_atr_max_pct': 0.05127746139619832, 'sideways_tp_mult': 1.206271368198089, 'sideways_tsl_mult': 0.054812350269771326, 'sideways_time_stop': 175, 'sideways_use_sma': False, 'sideways_use_ema': False, 'sideways_use_atr': True, 'sideways_use_adx': True, 'sideways_use_spike': False, 'sideways_rsi_required': True}.
[I 2025-09-01 15:11:54,415] Trial 490 finished with values: [-1000000000.0, 1000000000.0] and parameters: {'p_sma': 31, 'p_std': 24, 'p_atr': 16, 'p_adx': 14, 'rsi_period': 72, 'ema1': 26, 'ema2': 58, 'slip_atr_k': 0.0030933844756404066, 'slip_spread_k': 0.9641983532102429, 'spread_hl_frac': 0.00953549220525474, 'bb_std_mult': 0.5261483635889366, 'rsi_os': 30, 'rsi_ob': 46, 'vol_spike': 0.0860015715841904, 'adx_thresh': 19.09125182552372, 'atr_min_pct': 0.017193042677148166, 'atr_max_pct': 0.03589218321495091, 'tp_mult': 1.95276872810924, 'tsl_mult': 0.43890583985023646, 'strategy': 'mean_reversion', 'time_stop': 202, 'use_sma': False, 'use_atr': True, 'use_adx': True, 'use_ema': True, 'use_spike': True, 'rsi_required': True, 'edge_k': 1.322526556277983, 'edge_cap': 0.9150864621555346, 'bull_strategy': 'mean_reversion', 'bull_bb_std_mult': 0.8629063665403995, 'bull_rsi_os': 40, 'bull_rsi_ob': 95, 'bull_adx_thresh': 5.593600540228199, 'bull_atr_min_pct': 0.01057496686654924, 'bull_atr_max_pct': 0.03649515138192322, 'bull_tp_mult': 1.429342269962331, 'bull_tsl_mult': 0.08718974176866981, 'bull_time_stop': 126, 'bull_use_sma': False, 'bull_use_ema': True, 'bull_use_atr': True, 'bull_use_adx': True, 'bull_use_spike': False, 'bull_rsi_required': True, 'bear_strategy': 'breakout', 'bear_bb_std_mult': 1.059665938954095, 'bear_rsi_os': 27, 'bear_rsi_ob': 48, 'bear_adx_thresh': 11.925465011765445, 'bear_atr_min_pct': 0.00431680361286709, 'bear_atr_max_pct': 0.04545228546383197, 'bear_tp_mult': 1.7054613346455068, 'bear_tsl_mult': 0.4559590866854418, 'bear_time_stop': 264, 'bear_use_sma': True, 'bear_use_ema': False, 'bear_use_atr': True, 'bear_use_adx': True, 'bear_use_spike': True, 'bear_rsi_required': True, 'sideways_strategy': 'breakout', 'sideways_bb_std_mult': 0.9780510230778987, 'sideways_rsi_os': 26, 'sideways_rsi_ob': 75, 'sideways_adx_thresh': 33.62974278661059, 'sideways_atr_min_pct': 0.01411622478477435, 'sideways_atr_max_pct': 0.08189317786313557, 'sideways_tp_mult': 2.1300852796817744, 'sideways_tsl_mult': 0.7347385119910078, 'sideways_time_stop': 275, 'sideways_use_sma': False, 'sideways_use_ema': False, 'sideways_use_atr': True, 'sideways_use_adx': True, 'sideways_use_spike': False, 'sideways_rsi_required': True}.
[I 2025-09-01 15:12:28,260] Trial 492 finished with values: [-0.01880892203362705, 0.023413454688864955] and parameters: {'p_sma': 11, 'p_std': 23, 'p_atr': 13, 'p_adx': 13, 'rsi_period': 8, 'ema1': 12, 'ema2': 58, 'slip_atr_k': 0.003514203719156745, 'slip_spread_k': 0.46268509389022106, 'spread_hl_frac': 0.007890395106502052, 'bb_std_mult': 1.9592579583347192, 'rsi_os': 44, 'rsi_ob': 78, 'vol_spike': 0.2927053723599218, 'adx_thresh': 30.358944821269763, 'atr_min_pct': 0.01734757451712964, 'atr_max_pct': 0.06934971838536842, 'tp_mult': 1.9527873856104851, 'tsl_mult': 0.843693756504458, 'strategy': 'mean_reversion', 'time_stop': 12, 'use_sma': False, 'use_atr': True, 'use_adx': True, 'use_ema': True, 'use_spike': True, 'rsi_required': True, 'edge_k': 1.1092758440661616, 'edge_cap': 0.2372801584796697, 'bull_strategy': 'mean_reversion', 'bull_bb_std_mult': 1.0233321863132636, 'bull_rsi_os': 49, 'bull_rsi_ob': 65, 'bull_adx_thresh': 7.680570821937023, 'bull_atr_min_pct': 0.010472314750672304, 'bull_atr_max_pct': 0.09498518536557667, 'bull_tp_mult': 2.289247249827729, 'bull_tsl_mult': 0.229711942313074, 'bull_time_stop': 141, 'bull_use_sma': False, 'bull_use_ema': True, 'bull_use_atr': True, 'bull_use_adx': True, 'bull_use_spike': False, 'bull_rsi_required': True, 'bear_strategy': 'breakout', 'bear_bb_std_mult': 1.0453025868727668, 'bear_rsi_os': 51, 'bear_rsi_ob': 78, 'bear_adx_thresh': 12.084634330101128, 'bear_atr_min_pct': 0.0038405470504787806, 'bear_atr_max_pct': 0.045008381502691056, 'bear_tp_mult': 1.718835703261835, 'bear_tsl_mult': 0.8933163089812369, 'bear_time_stop': 253, 'bear_use_sma': True, 'bear_use_ema': False, 'bear_use_atr': True, 'bear_use_adx': True, 'bear_use_spike': True, 'bear_rsi_required': True, 'sideways_strategy': 'breakout', 'sideways_bb_std_mult': 3.251093532630449, 'sideways_rsi_os': 44, 'sideways_rsi_ob': 75, 'sideways_adx_thresh': 32.51115738916805, 'sideways_atr_min_pct': 0.013905407642745164, 'sideways_atr_max_pct': 0.14181745075900792, 'sideways_tp_mult': 2.1101831643887765, 'sideways_tsl_mult': 0.8069581857605516, 'sideways_time_stop': 71, 'sideways_use_sma': False, 'sideways_use_ema': False, 'sideways_use_atr': True, 'sideways_use_adx': True, 'sideways_use_spike': False, 'sideways_rsi_required': True}.
[I 2025-09-01 15:12:28,719] Trial 493 finished with values: [-1000000000.0, 1000000000.0] and parameters: {'p_sma': 14, 'p_std': 24, 'p_atr': 8, 'p_adx': 13, 'rsi_period': 66, 'ema1': 27, 'ema2': 30, 'slip_atr_k': 0.21183126772384603, 'slip_spread_k': 0.6458704332746876, 'spread_hl_frac': 0.015022963874836922, 'bb_std_mult': 0.5062729344639336, 'rsi_os': 30, 'rsi_ob': 78, 'vol_spike': 0.0846984171843319, 'adx_thresh': 26.91170238914906, 'atr_min_pct': 0.023002706130260828, 'atr_max_pct': 0.07026089415614549, 'tp_mult': 1.0965107229748614, 'tsl_mult': 0.996446334390608, 'strategy': 'breakout', 'time_stop': 14, 'use_sma': False, 'use_atr': True, 'use_adx': False, 'use_ema': True, 'use_spike': False, 'rsi_required': False, 'edge_k': 1.1286479332654928, 'edge_cap': 0.24501281595514257, 'bull_strategy': 'mean_reversion', 'bull_bb_std_mult': 3.5888219689285474, 'bull_rsi_os': 22, 'bull_rsi_ob': 81, 'bull_adx_thresh': 7.957233113844096, 'bull_atr_min_pct': 0.01459236112759886, 'bull_atr_max_pct': 0.11535845330838526, 'bull_tp_mult': 1.2617055405698956, 'bull_tsl_mult': 0.19151941049024251, 'bull_time_stop': 123, 'bull_use_sma': True, 'bull_use_ema': True, 'bull_use_atr': False, 'bull_use_adx': True, 'bull_use_spike': True, 'bull_rsi_required': False, 'bear_strategy': 'breakout', 'bear_bb_std_mult': 2.8674808371760387, 'bear_rsi_os': 27, 'bear_rsi_ob': 63, 'bear_adx_thresh': 7.428736090226186, 'bear_atr_min_pct': 0.026132875903300587, 'bear_atr_max_pct': 0.04516983277913837, 'bear_tp_mult': 1.6232863385222018, 'bear_tsl_mult': 0.7086250445688237, 'bear_time_stop': 255, 'bear_use_sma': True, 'bear_use_ema': False, 'bear_use_atr': True, 'bear_use_adx': True, 'bear_use_spike': True, 'bear_rsi_required': False, 'sideways_strategy': 'breakout', 'sideways_bb_std_mult': 1.0103890503972974, 'sideways_rsi_os': 13, 'sideways_rsi_ob': 75, 'sideways_adx_thresh': 28.502838286291897, 'sideways_atr_min_pct': 0.02536272495655092, 'sideways_atr_max_pct': 0.012462144104959716, 'sideways_tp_mult': 1.057406372541898, 'sideways_tsl_mult': 0.19335305143577114, 'sideways_time_stop': 77, 'sideways_use_sma': False, 'sideways_use_ema': False, 'sideways_use_atr': True, 'sideways_use_adx': True, 'sideways_use_spike': False, 'sideways_rsi_required': True}.
[I 2025-09-01 15:12:28,737] Trial 491 finished with values: [-0.01003814300551753, 0.014614242402304075] and parameters: {'p_sma': 11, 'p_std': 24, 'p_atr': 13, 'p_adx': 13, 'rsi_period': 30, 'ema1': 21, 'ema2': 58, 'slip_atr_k': 0.004305965808132755, 'slip_spread_k': 0.46247937543791307, 'spread_hl_frac': 0.03247882378209684, 'bb_std_mult': 0.5398505106244105, 'rsi_os': 30, 'rsi_ob': 78, 'vol_spike': 0.22226233354489575, 'adx_thresh': 27.509747457853233, 'atr_min_pct': 0.01719252696229814, 'atr_max_pct': 0.07004029772774419, 'tp_mult': 1.7886904125046061, 'tsl_mult': 0.7925278569370091, 'strategy': 'mean_reversion', 'time_stop': 51, 'use_sma': True, 'use_atr': True, 'use_adx': True, 'use_ema': True, 'use_spike': True, 'rsi_required': True, 'edge_k': 1.9421861835380005, 'edge_cap': 0.2486122417167388, 'bull_strategy': 'mean_reversion', 'bull_bb_std_mult': 0.5508727013892665, 'bull_rsi_os': 42, 'bull_rsi_ob': 65, 'bull_adx_thresh': 5.554151072015206, 'bull_atr_min_pct': 0.010579673389464937, 'bull_atr_max_pct': 0.11451353823544722, 'bull_tp_mult': 1.2697447944681557, 'bull_tsl_mult': 0.19229230714196338, 'bull_time_stop': 142, 'bull_use_sma': False, 'bull_use_ema': True, 'bull_use_atr': True, 'bull_use_adx': True, 'bull_use_spike': False, 'bull_rsi_required': True, 'bear_strategy': 'breakout', 'bear_bb_std_mult': 1.4566944086952311, 'bear_rsi_os': 51, 'bear_rsi_ob': 48, 'bear_adx_thresh': 7.44966372491783, 'bear_atr_min_pct': 0.004264619111074525, 'bear_atr_max_pct': 0.044843453426187646, 'bear_tp_mult': 2.958320292761096, 'bear_tsl_mult': 0.10716439180441723, 'bear_time_stop': 261, 'bear_use_sma': True, 'bear_use_ema': False, 'bear_use_atr': True, 'bear_use_adx': True, 'bear_use_spike': True, 'bear_rsi_required': True, 'sideways_strategy': 'breakout', 'sideways_bb_std_mult': 0.9770510020042961, 'sideways_rsi_os': 26, 'sideways_rsi_ob': 77, 'sideways_adx_thresh': 33.76079224204339, 'sideways_atr_min_pct': 0.013927447006528567, 'sideways_atr_max_pct': 0.055703215187426776, 'sideways_tp_mult': 1.2327404486992488, 'sideways_tsl_mult': 0.3502618163739748, 'sideways_time_stop': 183, 'sideways_use_sma': False, 'sideways_use_ema': False, 'sideways_use_atr': True, 'sideways_use_adx': True, 'sideways_use_spike': False, 'sideways_rsi_required': True}.
[I 2025-09-01 15:12:28,935] Trial 494 finished with values: [-1000000000.0, 1000000000.0] and parameters: {'p_sma': 33, 'p_std': 28, 'p_atr': 13, 'p_adx': 13, 'rsi_period': 69, 'ema1': 25, 'ema2': 24, 'slip_atr_k': 0.1484995029663656, 'slip_spread_k': 0.4298778158995574, 'spread_hl_frac': 0.032249100348103965, 'bb_std_mult': 2.7959353272119456, 'rsi_os': 30, 'rsi_ob': 78, 'vol_spike': 0.07611628480347207, 'adx_thresh': 26.595839464333913, 'atr_min_pct': 0.016094577763692317, 'atr_max_pct': 0.06920711101653908, 'tp_mult': 1.8908943507580394, 'tsl_mult': 0.7716776163737373, 'strategy': 'breakout', 'time_stop': 265, 'use_sma': False, 'use_atr': True, 'use_adx': False, 'use_ema': True, 'use_spike': False, 'rsi_required': False, 'edge_k': 1.663832822459156, 'edge_cap': 0.9098302862021319, 'bull_strategy': 'mean_reversion', 'bull_bb_std_mult': 2.5596772881728858, 'bull_rsi_os': 22, 'bull_rsi_ob': 92, 'bull_adx_thresh': 7.772046530957727, 'bull_atr_min_pct': 0.014699383879196268, 'bull_atr_max_pct': 0.11610346754674321, 'bull_tp_mult': 2.236967139647932, 'bull_tsl_mult': 0.7201797341999738, 'bull_time_stop': 143, 'bull_use_sma': True, 'bull_use_ema': True, 'bull_use_atr': False, 'bull_use_adx': True, 'bull_use_spike': True, 'bull_rsi_required': False, 'bear_strategy': 'breakout', 'bear_bb_std_mult': 2.8572629412192394, 'bear_rsi_os': 9, 'bear_rsi_ob': 49, 'bear_adx_thresh': 13.435586297680018, 'bear_atr_min_pct': 0.021855139970832715, 'bear_atr_max_pct': 0.04960198639729724, 'bear_tp_mult': 1.3014141724739154, 'bear_tsl_mult': 0.11538184434371773, 'bear_time_stop': 61, 'bear_use_sma': True, 'bear_use_ema': False, 'bear_use_atr': True, 'bear_use_adx': False, 'bear_use_spike': True, 'bear_rsi_required': False, 'sideways_strategy': 'mean_reversion', 'sideways_bb_std_mult': 3.275120733210679, 'sideways_rsi_os': 23, 'sideways_rsi_ob': 77, 'sideways_adx_thresh': 28.647791638896663, 'sideways_atr_min_pct': 0.01351886516964964, 'sideways_atr_max_pct': 0.14199154486482807, 'sideways_tp_mult': 2.3317735055759155, 'sideways_tsl_mult': 0.7970825424834073, 'sideways_time_stop': 78, 'sideways_use_sma': True, 'sideways_use_ema': False, 'sideways_use_atr': True, 'sideways_use_adx': True, 'sideways_use_spike': False, 'sideways_rsi_required': True}.
