[I 2025-09-01 15:04:42,108] Trial 443 finished with values: [-1000000000.0, 1000000000.0] and parameters: {'p_sma': 29, 'p_std': 37, 'p_atr': 25, 'p_adx': 26, 'rsi_period': 71, 'ema1': 26, 'ema2': 26, 'slip_atr_k': 0.13729328702346152, 'slip_spread_k': 0.24410566084509194, 'spread_hl_frac': 0.029467613573829845, 'bb_std_mult': 3.102995201095619, 'rsi_os': 33, 'rsi_ob': 76, 'vol_spike': 0.16756535181305393, 'adx_thresh': 26.99259216881317, 'atr_min_pct': 0.014729524350547387, 'atr_max_pct': 0.06660773966174394, 'tp_mult': 1.8835850884093044, 'tsl_mult': 0.07612447602735534, 'strategy': 'breakout', 'time_stop': 213, 'use_sma': False, 'use_atr': True, 'use_adx': False, 'use_ema': True, 'use_spike': True, 'rsi_required': False, 'edge_k': 0.970963383004952, 'edge_cap': 0.486242318567372, 'bull_strategy': 'mean_reversion', 'bull_bb_std_mult': 2.1641481423339872, 'bull_rsi_os': 48, 'bull_rsi_ob': 64, 'bull_adx_thresh': 5.69037505879015, 'bull_atr_min_pct': 0.016454669568566737, 'bull_atr_max_pct': 0.03876763583390893, 'bull_tp_mult': 1.6465168345924597, 'bull_tsl_mult': 0.25668539844045085, 'bull_time_stop': 134, 'bull_use_sma': True, 'bull_use_ema': True, 'bull_use_atr': False, 'bull_use_adx': True, 'bull_use_spike': False, 'bull_rsi_required': True, 'bear_strategy': 'mean_reversion', 'bear_bb_std_mult': 1.4411627950179469, 'bear_rsi_os': 30, 'bear_rsi_ob': 83, 'bear_adx_thresh': 8.604993516675743, 'bear_atr_min_pct': 0.004950974324522291, 'bear_atr_max_pct': 0.04792955991923605, 'bear_tp_mult': 1.6456047039687516, 'bear_tsl_mult': 0.755401159637676, 'bear_time_stop': 286, 'bear_use_sma': True, 'bear_use_ema': False, 'bear_use_atr': False, 'bear_use_adx': False, 'bear_use_spike': True, 'bear_rsi_required': False, 'sideways_strategy': 'breakout', 'sideways_bb_std_mult': 1.1873457349397554, 'sideways_rsi_os': 38, 'sideways_rsi_ob': 88, 'sideways_adx_thresh': 12.827208886555944, 'sideways_atr_min_pct': 0.011925141685678353, 'sideways_atr_max_pct': 0.10011259058977748, 'sideways_tp_mult': 2.320976319155162, 'sideways_tsl_mult': 0.7467399163285892, 'sideways_time_stop': 60, 'sideways_use_sma': False, 'sideways_use_ema': False, 'sideways_use_atr': True, 'sideways_use_adx': True, 'sideways_use_spike': False, 'sideways_rsi_required': True}.
[I 2025-09-01 15:04:42,639] Trial 441 finished with values: [-1000000000.0, 1000000000.0] and parameters: {'p_sma': 29, 'p_std': 25, 'p_atr': 25, 'p_adx': 15, 'rsi_period': 71, 'ema1': 17, 'ema2': 58, 'slip_atr_k': 0.004881061066540801, 'slip_spread_k': 0.38391310577018684, 'spread_hl_frac': 0.005945233580972353, 'bb_std_mult': 0.8851216392840031, 'rsi_os': 16, 'rsi_ob': 77, 'vol_spike': 0.0916494755407826, 'adx_thresh': 12.929457640005563, 'atr_min_pct': 0.01574859554585404, 'atr_max_pct': 0.06777216957595573, 'tp_mult': 2.038140540830004, 'tsl_mult': 0.3607640909788531, 'strategy': 'breakout', 'time_stop': 285, 'use_sma': False, 'use_atr': True, 'use_adx': False, 'use_ema': True, 'use_spike': False, 'rsi_required': False, 'edge_k': 1.5090461088813691, 'edge_cap': 0.7639599283144698, 'bull_strategy': 'mean_reversion', 'bull_bb_std_mult': 3.059835372639715, 'bull_rsi_os': 47, 'bull_rsi_ob': 65, 'bull_adx_thresh': 5.440623092601978, 'bull_atr_min_pct': 0.01632492402690607, 'bull_atr_max_pct': 0.037420844010907145, 'bull_tp_mult': 1.643015674536879, 'bull_tsl_mult': 0.5255806557016443, 'bull_time_stop': 135, 'bull_use_sma': True, 'bull_use_ema': True, 'bull_use_atr': False, 'bull_use_adx': True, 'bull_use_spike': True, 'bull_rsi_required': False, 'bear_strategy': 'mean_reversion', 'bear_bb_std_mult': 1.4322176665819863, 'bear_rsi_os': 30, 'bear_rsi_ob': 82, 'bear_adx_thresh': 8.631807128519247, 'bear_atr_min_pct': 0.0008061105384220037, 'bear_atr_max_pct': 0.047529215439008676, 'bear_tp_mult': 1.0158529701582966, 'bear_tsl_mult': 0.748431185829826, 'bear_time_stop': 243, 'bear_use_sma': True, 'bear_use_ema': False, 'bear_use_atr': False, 'bear_use_adx': False, 'bear_use_spike': True, 'bear_rsi_required': False, 'sideways_strategy': 'breakout', 'sideways_bb_std_mult': 1.2101425808822714, 'sideways_rsi_os': 23, 'sideways_rsi_ob': 55, 'sideways_adx_thresh': 28.146015376160573, 'sideways_atr_min_pct': 0.006304196248560347, 'sideways_atr_max_pct': 0.04924950211843696, 'sideways_tp_mult': 2.326603984720864, 'sideways_tsl_mult': 0.510244024621416, 'sideways_time_stop': 287, 'sideways_use_sma': False, 'sideways_use_ema': False, 'sideways_use_atr': True, 'sideways_use_adx': True, 'sideways_use_spike': False, 'sideways_rsi_required': True}.
[I 2025-09-01 15:04:42,909] Trial 442 finished with values: [-1000000000.0, 1000000000.0] and parameters: {'p_sma': 34, 'p_std': 36, 'p_atr': 11, 'p_adx': 26, 'rsi_period': 32, 'ema1': 26, 'ema2': 26, 'slip_atr_k': 0.0113838008957284, 'slip_spread_k': 0.2185466158194313, 'spread_hl_frac': 0.035968662234027074, 'bb_std_mult': 2.1456615292856327, 'rsi_os': 30, 'rsi_ob': 77, 'vol_spike': 0.17688195478708263, 'adx_thresh': 30.51356292943943, 'atr_min_pct': 0.004412929828554069, 'atr_max_pct': 0.06683108425889539, 'tp_mult': 1.8765162888732378, 'tsl_mult': 0.3604402882413741, 'strategy': 'breakout', 'time_stop': 209, 'use_sma': False, 'use_atr': True, 'use_adx': False, 'use_ema': True, 'use_spike': False, 'rsi_required': False, 'edge_k': 1.5774156260636472, 'edge_cap': 0.7034119977260525, 'bull_strategy': 'mean_reversion', 'bull_bb_std_mult': 1.0065145681428542, 'bull_rsi_os': 50, 'bull_rsi_ob': 83, 'bull_adx_thresh': 27.322000335440688, 'bull_atr_min_pct': 0.012670134374965437, 'bull_atr_max_pct': 0.03746227527183953, 'bull_tp_mult': 1.787264208953271, 'bull_tsl_mult': 0.25619647554693026, 'bull_time_stop': 137, 'bull_use_sma': True, 'bull_use_ema': True, 'bull_use_atr': False, 'bull_use_adx': True, 'bull_use_spike': False, 'bull_rsi_required': True, 'bear_strategy': 'mean_reversion', 'bear_bb_std_mult': 3.308671738538478, 'bear_rsi_os': 50, 'bear_rsi_ob': 83, 'bear_adx_thresh': 33.260537315088634, 'bear_atr_min_pct': 0.0005831349709275076, 'bear_atr_max_pct': 0.09905861010259755, 'bear_tp_mult': 1.24818198173844, 'bear_tsl_mult': 0.7556053669888727, 'bear_time_stop': 287, 'bear_use_sma': True, 'bear_use_ema': False, 'bear_use_atr': True, 'bear_use_adx': False, 'bear_use_spike': True, 'bear_rsi_required': False, 'sideways_strategy': 'breakout', 'sideways_bb_std_mult': 3.444057248738458, 'sideways_rsi_os': 23, 'sideways_rsi_ob': 78, 'sideways_adx_thresh': 33.2697082912759, 'sideways_atr_min_pct': 0.011739851320967954, 'sideways_atr_max_pct': 0.04984974530946539, 'sideways_tp_mult': 1.162969479222058, 'sideways_tsl_mult': 0.7430597481591855, 'sideways_time_stop': 216, 'sideways_use_sma': False, 'sideways_use_ema': False, 'sideways_use_atr': True, 'sideways_use_adx': True, 'sideways_use_spike': False, 'sideways_rsi_required': True}.
[I 2025-09-01 15:04:43,356] Trial 444 finished with values: [-1000000000.0, 1000000000.0] and parameters: {'p_sma': 30, 'p_std': 28, 'p_atr': 21, 'p_adx': 26, 'rsi_period': 32, 'ema1': 26, 'ema2': 10, 'slip_atr_k': 0.0003431703830676855, 'slip_spread_k': 0.3914940792314969, 'spread_hl_frac': 0.005803096778253657, 'bb_std_mult': 2.9943545822464737, 'rsi_os': 28, 'rsi_ob': 79, 'vol_spike': 0.0909122796000321, 'adx_thresh': 28.928626566878915, 'atr_min_pct': 0.014816136217426248, 'atr_max_pct': 0.09570584157930821, 'tp_mult': 1.8902955122886667, 'tsl_mult': 0.3632723910192131, 'strategy': 'breakout', 'time_stop': 177, 'use_sma': False, 'use_atr': True, 'use_adx': False, 'use_ema': True, 'use_spike': True, 'rsi_required': False, 'edge_k': 1.5763752579587231, 'edge_cap': 0.7369973929289038, 'bull_strategy': 'mean_reversion', 'bull_bb_std_mult': 0.965670128429458, 'bull_rsi_os': 24, 'bull_rsi_ob': 64, 'bull_adx_thresh': 27.469989395464456, 'bull_atr_min_pct': 0.016536689541179577, 'bull_atr_max_pct': 0.08717648027070808, 'bull_tp_mult': 1.7880257238729989, 'bull_tsl_mult': 0.09935434354119381, 'bull_time_stop': 135, 'bull_use_sma': True, 'bull_use_ema': True, 'bull_use_atr': False, 'bull_use_adx': True, 'bull_use_spike': False, 'bull_rsi_required': True, 'bear_strategy': 'mean_reversion', 'bear_bb_std_mult': 1.1260993789056761, 'bear_rsi_os': 40, 'bear_rsi_ob': 53, 'bear_adx_thresh': 8.562575835250897, 'bear_atr_min_pct': 0.004046716894932049, 'bear_atr_max_pct': 0.10030707593847069, 'bear_tp_mult': 2.7846416534075407, 'bear_tsl_mult': 0.15866328683389141, 'bear_time_stop': 286, 'bear_use_sma': True, 'bear_use_ema': False, 'bear_use_atr': False, 'bear_use_adx': True, 'bear_use_spike': True, 'bear_rsi_required': False, 'sideways_strategy': 'breakout', 'sideways_bb_std_mult': 3.4458598004175585, 'sideways_rsi_os': 54, 'sideways_rsi_ob': 78, 'sideways_adx_thresh': 33.474878371612576, 'sideways_atr_min_pct': 0.011949777369683138, 'sideways_atr_max_pct': 0.04527897467466182, 'sideways_tp_mult': 1.1630437185625988, 'sideways_tsl_mult': 0.4610645772865213, 'sideways_time_stop': 60, 'sideways_use_sma': False, 'sideways_use_ema': False, 'sideways_use_atr': True, 'sideways_use_adx': True, 'sideways_use_spike': False, 'sideways_rsi_required': True}.
[I 2025-09-01 15:05:22,324] Trial 446 finished with values: [-1000000000.0, 1000000000.0] and parameters: {'p_sma': 7, 'p_std': 27, 'p_atr': 30, 'p_adx': 8, 'rsi_period': 60, 'ema1': 19, 'ema2': 10, 'slip_atr_k': 0.013126827752712992, 'slip_spread_k': 0.5713325419838123, 'spread_hl_frac': 0.0061475127317772655, 'bb_std_mult': 2.1714519106169923, 'rsi_os': 54, 'rsi_ob': 79, 'vol_spike': 0.2264861704966677, 'adx_thresh': 29.798300491204266, 'atr_min_pct': 0.02397035751339099, 'atr_max_pct': 0.07191308192527, 'tp_mult': 2.0335581904909215, 'tsl_mult': 0.14236562903775596, 'strategy': 'breakout', 'time_stop': 24, 'use_sma': False, 'use_atr': True, 'use_adx': False, 'use_ema': True, 'use_spike': True, 'rsi_required': True, 'edge_k': 1.570477974944364, 'edge_cap': 0.879415481892917, 'bull_strategy': 'mean_reversion', 'bull_bb_std_mult': 0.9785918044463452, 'bull_rsi_os': 24, 'bull_rsi_ob': 67, 'bull_adx_thresh': 6.761942710578923, 'bull_atr_min_pct': 0.017292426118213248, 'bull_atr_max_pct': 0.04400785556111771, 'bull_tp_mult': 1.7825687417785516, 'bull_tsl_mult': 0.10123192971589878, 'bull_time_stop': 140, 'bull_use_sma': False, 'bull_use_ema': False, 'bull_use_atr': False, 'bull_use_adx': True, 'bull_use_spike': False, 'bull_rsi_required': True, 'bear_strategy': 'breakout', 'bear_bb_std_mult': 1.4966260429334715, 'bear_rsi_os': 38, 'bear_rsi_ob': 68, 'bear_adx_thresh': 33.15735811180251, 'bear_atr_min_pct': 0.003986013270112781, 'bear_atr_max_pct': 0.09866908336949676, 'bear_tp_mult': 2.7744314819483074, 'bear_tsl_mult': 0.7216802261259951, 'bear_time_stop': 265, 'bear_use_sma': True, 'bear_use_ema': False, 'bear_use_atr': True, 'bear_use_adx': True, 'bear_use_spike': True, 'bear_rsi_required': True, 'sideways_strategy': 'mean_reversion', 'sideways_bb_std_mult': 0.9602187011260703, 'sideways_rsi_os': 21, 'sideways_rsi_ob': 82, 'sideways_adx_thresh': 33.39695910720152, 'sideways_atr_min_pct': 0.004926716821686154, 'sideways_atr_max_pct': 0.045695801422853656, 'sideways_tp_mult': 2.1682367829629032, 'sideways_tsl_mult': 0.8036274462518433, 'sideways_time_stop': 34, 'sideways_use_sma': True, 'sideways_use_ema': False, 'sideways_use_atr': True, 'sideways_use_adx': True, 'sideways_use_spike': False, 'sideways_rsi_required': True}.
[I 2025-09-01 15:05:23,049] Trial 447 finished with values: [-1000000000.0, 1000000000.0] and parameters: {'p_sma': 46, 'p_std': 28, 'p_atr': 30, 'p_adx': 8, 'rsi_period': 76, 'ema1': 22, 'ema2': 59, 'slip_atr_k': 1.5742398298356983e-05, 'slip_spread_k': 0.39834647260487527, 'spread_hl_frac': 0.009729103271073038, 'bb_std_mult': 2.012109954336003, 'rsi_os': 27, 'rsi_ob': 79, 'vol_spike': 0.14462191752546785, 'adx_thresh': 29.467417577635068, 'atr_min_pct': 0.017429752378894343, 'atr_max_pct': 0.09755808154607701, 'tp_mult': 2.0221769569085737, 'tsl_mult': 0.2489614958093544, 'strategy': 'breakout', 'time_stop': 22, 'use_sma': False, 'use_atr': True, 'use_adx': False, 'use_ema': True, 'use_spike': True, 'rsi_required': True, 'edge_k': 1.5082996857572788, 'edge_cap': 0.7362397270682217, 'bull_strategy': 'mean_reversion', 'bull_bb_std_mult': 2.259969783787265, 'bull_rsi_os': 24, 'bull_rsi_ob': 67, 'bull_adx_thresh': 5.033044424833477, 'bull_atr_min_pct': 0.01756488265351515, 'bull_atr_max_pct': 0.13975760444055238, 'bull_tp_mult': 1.3834265063746762, 'bull_tsl_mult': 0.09881625265555295, 'bull_time_stop': 126, 'bull_use_sma': False, 'bull_use_ema': False, 'bull_use_atr': False, 'bull_use_adx': True, 'bull_use_spike': False, 'bull_rsi_required': True, 'bear_strategy': 'breakout', 'bear_bb_std_mult': 1.4820492082109342, 'bear_rsi_os': 40, 'bear_rsi_ob': 53, 'bear_adx_thresh': 25.08880806653942, 'bear_atr_min_pct': 0.02801302648991559, 'bear_atr_max_pct': 0.05478807497073732, 'bear_tp_mult': 1.1554340734311113, 'bear_tsl_mult': 0.7269760078673795, 'bear_time_stop': 158, 'bear_use_sma': True, 'bear_use_ema': False, 'bear_use_atr': False, 'bear_use_adx': True, 'bear_use_spike': True, 'bear_rsi_required': True, 'sideways_strategy': 'mean_reversion', 'sideways_bb_std_mult': 0.9489701656779277, 'sideways_rsi_os': 21, 'sideways_rsi_ob': 76, 'sideways_adx_thresh': 10.097681986951855, 'sideways_atr_min_pct': 0.005109310453872544, 'sideways_atr_max_pct': 0.045426358527186635, 'sideways_tp_mult': 2.1412498635707857, 'sideways_tsl_mult': 0.45338482998052293, 'sideways_time_stop': 65, 'sideways_use_sma': True, 'sideways_use_ema': False, 'sideways_use_atr': True, 'sideways_use_adx': True, 'sideways_use_spike': False, 'sideways_rsi_required': True}.
[I 2025-09-01 15:05:24,221] Trial 445 finished with values: [-1000000000.0, 1000000000.0] and parameters: {'p_sma': 30, 'p_std': 24, 'p_atr': 21, 'p_adx': 13, 'rsi_period': 19, 'ema1': 19, 'ema2': 59, 'slip_atr_k': 0.015020060730339508, 'slip_spread_k': 0.2092371053924419, 'spread_hl_frac': 0.006015759135243034, 'bb_std_mult': 2.174071210267004, 'rsi_os': 28, 'rsi_ob': 71, 'vol_spike': 0.09217538044408544, 'adx_thresh': 29.578604610464566, 'atr_min_pct': 0.021971381464100742, 'atr_max_pct': 0.07289244289938664, 'tp_mult': 2.0434910655479834, 'tsl_mult': 0.37095084274001994, 'strategy': 'breakout', 'time_stop': 300, 'use_sma': False, 'use_atr': True, 'use_adx': False, 'use_ema': True, 'use_spike': False, 'rsi_required': False, 'edge_k': 0.13530378610199434, 'edge_cap': 0.8851482730382468, 'bull_strategy': 'mean_reversion', 'bull_bb_std_mult': 0.9255650509027501, 'bull_rsi_os': 24, 'bull_rsi_ob': 79, 'bull_adx_thresh': 5.04152249512259, 'bull_atr_min_pct': 0.017317559214794206, 'bull_atr_max_pct': 0.13899053500332745, 'bull_tp_mult': 1.890057592512481, 'bull_tsl_mult': 0.10102683690267653, 'bull_time_stop': 136, 'bull_use_sma': True, 'bull_use_ema': True, 'bull_use_atr': False, 'bull_use_adx': True, 'bull_use_spike': True, 'bull_rsi_required': False, 'bear_strategy': 'breakout', 'bear_bb_std_mult': 0.9010089900903968, 'bear_rsi_os': 5, 'bear_rsi_ob': 53, 'bear_adx_thresh': 11.376882339744544, 'bear_atr_min_pct': 0.004019562914360324, 'bear_atr_max_pct': 0.05406398888960116, 'bear_tp_mult': 2.7717686244269792, 'bear_tsl_mult': 0.1618503080756849, 'bear_time_stop': 208, 'bear_use_sma': True, 'bear_use_ema': False, 'bear_use_atr': False, 'bear_use_adx': True, 'bear_use_spike': True, 'bear_rsi_required': False, 'sideways_strategy': 'mean_reversion', 'sideways_bb_std_mult': 0.9265111235348746, 'sideways_rsi_os': 23, 'sideways_rsi_ob': 93, 'sideways_adx_thresh': 31.119902300843265, 'sideways_atr_min_pct': 0.011031034918387295, 'sideways_atr_max_pct': 0.04498278977575821, 'sideways_tp_mult': 2.1673014656289835, 'sideways_tsl_mult': 0.4615865615691601, 'sideways_time_stop': 66, 'sideways_use_sma': True, 'sideways_use_ema': False, 'sideways_use_atr': True, 'sideways_use_adx': True, 'sideways_use_spike': False, 'sideways_rsi_required': True}.
[I 2025-09-01 15:05:24,624] Trial 448 finished with values: [-1000000000.0, 1000000000.0] and parameters: {'p_sma': 46, 'p_std': 24, 'p_atr': 13, 'p_adx': 13, 'rsi_period': 78, 'ema1': 25, 'ema2': 59, 'slip_atr_k': 0.01656599552889582, 'slip_spread_k': 0.5710673646748123, 'spread_hl_frac': 0.017984608778054766, 'bb_std_mult': 2.004061055265702, 'rsi_os': 30, 'rsi_ob': 78, 'vol_spike': 0.14604033985350798, 'adx_thresh': 29.357629699973906, 'atr_min_pct': 0.02416985541877404, 'atr_max_pct': 0.0728674649737807, 'tp_mult': 2.012478509435075, 'tsl_mult': 0.38530889931883505, 'strategy': 'breakout', 'time_stop': 190, 'use_sma': False, 'use_atr': True, 'use_adx': False, 'use_ema': True, 'use_spike': False, 'rsi_required': True, 'edge_k': 0.15640469813145608, 'edge_cap': 0.8788109476801644, 'bull_strategy': 'mean_reversion', 'bull_bb_std_mult': 0.9262032909023474, 'bull_rsi_os': 24, 'bull_rsi_ob': 81, 'bull_adx_thresh': 5.076689105168416, 'bull_atr_min_pct': 0.017617439797274318, 'bull_atr_max_pct': 0.04466711843031826, 'bull_tp_mult': 1.5280742634959819, 'bull_tsl_mult': 0.06572956921257544, 'bull_time_stop': 193, 'bull_use_sma': False, 'bull_use_ema': False, 'bull_use_atr': False, 'bull_use_adx': True, 'bull_use_spike': False, 'bull_rsi_required': True, 'bear_strategy': 'breakout', 'bear_bb_std_mult': 1.498891901159881, 'bear_rsi_os': 16, 'bear_rsi_ob': 70, 'bear_adx_thresh': 30.164465074250593, 'bear_atr_min_pct': 0.004181370684406694, 'bear_atr_max_pct': 0.05669233156833371, 'bear_tp_mult': 2.459094816270534, 'bear_tsl_mult': 0.8281765164275694, 'bear_time_stop': 207, 'bear_use_sma': True, 'bear_use_ema': False, 'bear_use_atr': False, 'bear_use_adx': True, 'bear_use_spike': True, 'bear_rsi_required': True, 'sideways_strategy': 'mean_reversion', 'sideways_bb_std_mult': 0.9358822300394161, 'sideways_rsi_os': 21, 'sideways_rsi_ob': 52, 'sideways_adx_thresh': 31.824514615160126, 'sideways_atr_min_pct': 0.012699033940580542, 'sideways_atr_max_pct': 0.046086661596319134, 'sideways_tp_mult': 2.1786397014230268, 'sideways_tsl_mult': 0.8079042885787284, 'sideways_time_stop': 32, 'sideways_use_sma': True, 'sideways_use_ema': False, 'sideways_use_atr': True, 'sideways_use_adx': True, 'sideways_use_spike': False, 'sideways_rsi_required': True}.
[I 2025-09-01 15:05:25,678] Trial 450 finished with values: [-1000000000.0, 1000000000.0] and parameters: {'p_sma': 31, 'p_std': 57, 'p_atr': 13, 'p_adx': 13, 'rsi_period': 75, 'ema1': 27, 'ema2': 59, 'slip_atr_k': 0.05837722893371007, 'slip_spread_k': 0.4168455811555089, 'spread_hl_frac': 0.007235882704387886, 'bb_std_mult': 2.218831549496316, 'rsi_os': 55, 'rsi_ob': 74, 'vol_spike': 0.07791351974509804, 'adx_thresh': 26.745454316912653, 'atr_min_pct': 0.018048934461578573, 'atr_max_pct': 0.07275486349076454, 'tp_mult': 1.985925932944943, 'tsl_mult': 0.4513288843112514, 'strategy': 'mean_reversion', 'time_stop': 12, 'use_sma': True, 'use_atr': True, 'use_adx': False, 'use_ema': True, 'use_spike': False, 'rsi_required': True, 'edge_k': 1.3395351014349637, 'edge_cap': 0.9203364564855605, 'bull_strategy': 'mean_reversion', 'bull_bb_std_mult': 2.688977499067335, 'bull_rsi_os': 10, 'bull_rsi_ob': 49, 'bull_adx_thresh': 6.0160845309875635, 'bull_atr_min_pct': 0.015439244654946137, 'bull_atr_max_pct': 0.04094174471311689, 'bull_tp_mult': 1.3302017662966235, 'bull_tsl_mult': 0.21480829912129934, 'bull_time_stop': 193, 'bull_use_sma': False, 'bull_use_ema': True, 'bull_use_atr': True, 'bull_use_adx': False, 'bull_use_spike': True, 'bull_rsi_required': False, 'bear_strategy': 'breakout', 'bear_bb_std_mult': 0.9189645568486626, 'bear_rsi_os': 51, 'bear_rsi_ob': 51, 'bear_adx_thresh': 11.300485849793263, 'bear_atr_min_pct': 0.025542521876531325, 'bear_atr_max_pct': 0.05050204111489506, 'bear_tp_mult': 1.6817111114000212, 'bear_tsl_mult': 0.13591741216009967, 'bear_time_stop': 206, 'bear_use_sma': True, 'bear_use_ema': False, 'bear_use_atr': False, 'bear_use_adx': False, 'bear_use_spike': True, 'bear_rsi_required': True, 'sideways_strategy': 'mean_reversion', 'sideways_bb_std_mult': 1.1188643250182044, 'sideways_rsi_os': 24, 'sideways_rsi_ob': 94, 'sideways_adx_thresh': 31.375701618227687, 'sideways_atr_min_pct': 0.012801861571996228, 'sideways_atr_max_pct': 0.053647365706572275, 'sideways_tp_mult': 2.2464844754797313, 'sideways_tsl_mult': 0.7676189155629545, 'sideways_time_stop': 11, 'sideways_use_sma': True, 'sideways_use_ema': False, 'sideways_use_atr': True, 'sideways_use_adx': False, 'sideways_use_spike': False, 'sideways_rsi_required': True}.
