[I 2025-08-30 21:50:40,960] Trial 502 finished with values: [-1000000000.0, 1000000000.0] and parameters: {'p_sma': 33, 'p_std': 57, 'p_atr': 22, 'p_adx': 21, 'rsi_period': 66, 'ema1': 9, 'ema2': 54, 'slip_atr_k': 0.14154561914095493, 'slip_spread_k': 0.6922469715562323, 'spread_hl_frac': 0.03208119819373339, 'bb_std_mult': 0.6879555882230114, 'rsi_os': 5, 'rsi_ob': 67, 'vol_spike': 0.09807367904490275, 'adx_thresh': 27.111888546281, 'atr_min_pct': 0.011445224188016965, 'atr_max_pct': 0.02027229396760893, 'tp_mult': 1.5639936296567345, 'tsl_mult': 0.8934613699483438, 'strategy': 'mean_reversion', 'time_stop': 83, 'use_sma': True, 'use_atr': False, 'use_adx': False, 'use_ema': True, 'use_spike': False, 'rsi_required': True, 'edge_k': 1.656955181582699, 'edge_cap': 0.839771485619088, 'bull_strategy': 'mean_reversion', 'bull_bb_std_mult': 1.0734965270390622, 'bull_rsi_os': 5, 'bull_rsi_ob': 54, 'bull_adx_thresh': 15.218314865968123, 'bull_atr_min_pct': 0.02266995408316341, 'bull_atr_max_pct': 0.14569558632248159, 'bull_tp_mult': 1.5929906986150024, 'bull_tsl_mult': 0.3807478910986222, 'bull_time_stop': 240, 'bull_use_sma': True, 'bull_use_ema': False, 'bull_use_atr': True, 'bull_use_adx': False, 'bull_use_spike': False, 'bull_rsi_required': False, 'bear_strategy': 'mean_reversion', 'bear_bb_std_mult': 1.7351992589461136, 'bear_rsi_os': 7, 'bear_rsi_ob': 72, 'bear_adx_thresh': 26.35338943825039, 'bear_atr_min_pct': 0.007335262882121864, 'bear_atr_max_pct': 0.11431398421484994, 'bear_tp_mult': 1.504682278522929, 'bear_tsl_mult': 0.30234310777283707, 'bear_time_stop': 237, 'bear_use_sma': False, 'bear_use_ema': True, 'bear_use_atr': True, 'bear_use_adx': False, 'bear_use_spike': False, 'bear_rsi_required': False, 'sideways_strategy': 'breakout', 'sideways_bb_std_mult': 1.6153464215442757, 'sideways_rsi_os': 39, 'sideways_rsi_ob': 87, 'sideways_adx_thresh': 9.634688144302967, 'sideways_atr_min_pct': 0.02122024576936441, 'sideways_atr_max_pct': 0.11676735632441428, 'sideways_tp_mult': 1.2295984988629847, 'sideways_tsl_mult': 0.7545401067851785, 'sideways_time_stop': 199, 'sideways_use_sma': True, 'sideways_use_ema': False, 'sideways_use_atr': False, 'sideways_use_adx': True, 'sideways_use_spike': True, 'sideways_rsi_required': False}.
[I 2025-08-30 21:50:43,388] Trial 505 finished with values: [-1000000000.0, 1000000000.0] and parameters: {'p_sma': 32, 'p_std': 37, 'p_atr': 30, 'p_adx': 10, 'rsi_period': 73, 'ema1': 12, 'ema2': 51, 'slip_atr_k': 0.011227681722763502, 'slip_spread_k': 0.9935233366641726, 'spread_hl_frac': 0.03423604378730079, 'bb_std_mult': 3.5967460052354734, 'rsi_os': 5, 'rsi_ob': 67, 'vol_spike': 0.11040633306777498, 'adx_thresh': 12.524152033342787, 'atr_min_pct': 0.005328193382414897, 'atr_max_pct': 0.01629623619365328, 'tp_mult': 1.7743255962771356, 'tsl_mult': 0.5591458522320865, 'strategy': 'breakout', 'time_stop': 99, 'use_sma': True, 'use_atr': True, 'use_adx': True, 'use_ema': True, 'use_spike': True, 'rsi_required': True, 'edge_k': 0.9107548308599219, 'edge_cap': 0.7772317833791534, 'bull_strategy': 'breakout', 'bull_bb_std_mult': 1.8089993543197287, 'bull_rsi_os': 20, 'bull_rsi_ob': 87, 'bull_adx_thresh': 15.719010514568279, 'bull_atr_min_pct': 0.001555379788395542, 'bull_atr_max_pct': 0.0487219710156273, 'bull_tp_mult': 1.6054957720428233, 'bull_tsl_mult': 0.4587044221471534, 'bull_time_stop': 289, 'bull_use_sma': True, 'bull_use_ema': False, 'bull_use_atr': True, 'bull_use_adx': False, 'bull_use_spike': False, 'bull_rsi_required': False, 'bear_strategy': 'breakout', 'bear_bb_std_mult': 1.9366085168351401, 'bear_rsi_os': 5, 'bear_rsi_ob': 92, 'bear_adx_thresh': 27.208630629506974, 'bear_atr_min_pct': 0.009127183083993436, 'bear_atr_max_pct': 0.11758457242401629, 'bear_tp_mult': 1.8482034857636638, 'bear_tsl_mult': 0.40944487174098965, 'bear_time_stop': 242, 'bear_use_sma': False, 'bear_use_ema': True, 'bear_use_atr': True, 'bear_use_adx': True, 'bear_use_spike': True, 'bear_rsi_required': False, 'sideways_strategy': 'breakout', 'sideways_bb_std_mult': 2.5058236260889286, 'sideways_rsi_os': 19, 'sideways_rsi_ob': 73, 'sideways_adx_thresh': 9.637612543464313, 'sideways_atr_min_pct': 0.021633221172231723, 'sideways_atr_max_pct': 0.11542002428081681, 'sideways_tp_mult': 1.1597195845287673, 'sideways_tsl_mult': 0.7778019109127808, 'sideways_time_stop': 243, 'sideways_use_sma': True, 'sideways_use_ema': False, 'sideways_use_atr': False, 'sideways_use_adx': True, 'sideways_use_spike': False, 'sideways_rsi_required': False}.
[I 2025-08-30 21:50:44,531] Trial 506 finished with values: [-1000000000.0, 1000000000.0] and parameters: {'p_sma': 32, 'p_std': 40, 'p_atr': 22, 'p_adx': 10, 'rsi_period': 66, 'ema1': 11, 'ema2': 51, 'slip_atr_k': 0.23597496762923076, 'slip_spread_k': 0.2370142811506526, 'spread_hl_frac': 0.011042139326935353, 'bb_std_mult': 0.6695231743313694, 'rsi_os': 11, 'rsi_ob': 64, 'vol_spike': 0.029171873527823966, 'adx_thresh': 12.506943308896266, 'atr_min_pct': 0.01617863890098743, 'atr_max_pct': 0.021277083395430562, 'tp_mult': 1.496885185564699, 'tsl_mult': 0.5704540428021867, 'strategy': 'breakout', 'time_stop': 99, 'use_sma': True, 'use_atr': True, 'use_adx': True, 'use_ema': True, 'use_spike': True, 'rsi_required': True, 'edge_k': 0.5374693876375923, 'edge_cap': 0.7971492331040674, 'bull_strategy': 'breakout', 'bull_bb_std_mult': 1.073312259665566, 'bull_rsi_os': 20, 'bull_rsi_ob': 87, 'bull_adx_thresh': 21.731093577414068, 'bull_atr_min_pct': 0.002307712588437162, 'bull_atr_max_pct': 0.04794498669366707, 'bull_tp_mult': 1.4016700527763175, 'bull_tsl_mult': 0.19780521656699163, 'bull_time_stop': 49, 'bull_use_sma': True, 'bull_use_ema': False, 'bull_use_atr': False, 'bull_use_adx': False, 'bull_use_spike': False, 'bull_rsi_required': False, 'bear_strategy': 'breakout', 'bear_bb_std_mult': 1.8517286414289937, 'bear_rsi_os': 45, 'bear_rsi_ob': 73, 'bear_adx_thresh': 27.261081102641953, 'bear_atr_min_pct': 0.029995350721876413, 'bear_atr_max_pct': 0.11673650041067175, 'bear_tp_mult': 2.1170372337168484, 'bear_tsl_mult': 0.6096969858222434, 'bear_time_stop': 227, 'bear_use_sma': False, 'bear_use_ema': True, 'bear_use_atr': True, 'bear_use_adx': True, 'bear_use_spike': True, 'bear_rsi_required': False, 'sideways_strategy': 'mean_reversion', 'sideways_bb_std_mult': 1.7601160792189097, 'sideways_rsi_os': 22, 'sideways_rsi_ob': 90, 'sideways_adx_thresh': 27.990538545720586, 'sideways_atr_min_pct': 0.02192216714778437, 'sideways_atr_max_pct': 0.035810197398143874, 'sideways_tp_mult': 1.73729663697558, 'sideways_tsl_mult': 0.7702384568108664, 'sideways_time_stop': 257, 'sideways_use_sma': False, 'sideways_use_ema': False, 'sideways_use_atr': False, 'sideways_use_adx': True, 'sideways_use_spike': False, 'sideways_rsi_required': False}.
[I 2025-08-30 21:51:17,273] Trial 508 finished with values: [-1000000000.0, 1000000000.0] and parameters: {'p_sma': 32, 'p_std': 40, 'p_atr': 30, 'p_adx': 21, 'rsi_period': 50, 'ema1': 11, 'ema2': 52, 'slip_atr_k': 0.2354271678659064, 'slip_spread_k': 0.7226664081934902, 'spread_hl_frac': 0.03609276623566539, 'bb_std_mult': 2.468358361929096, 'rsi_os': 11, 'rsi_ob': 64, 'vol_spike': 0.0705961781155593, 'adx_thresh': 12.19650241189636, 'atr_min_pct': 0.01303885162523419, 'atr_max_pct': 0.02311409796195348, 'tp_mult': 1.439542079557047, 'tsl_mult': 0.38390362283396295, 'strategy': 'breakout', 'time_stop': 99, 'use_sma': True, 'use_atr': True, 'use_adx': True, 'use_ema': True, 'use_spike': True, 'rsi_required': False, 'edge_k': 1.9947624761518912, 'edge_cap': 0.7848339623533309, 'bull_strategy': 'breakout', 'bull_bb_std_mult': 1.8797771082138313, 'bull_rsi_os': 16, 'bull_rsi_ob': 88, 'bull_adx_thresh': 14.085338794972204, 'bull_atr_min_pct': 0.026576906515334772, 'bull_atr_max_pct': 0.04711437533395011, 'bull_tp_mult': 1.4333630731071063, 'bull_tsl_mult': 0.15144119615078933, 'bull_time_stop': 290, 'bull_use_sma': True, 'bull_use_ema': False, 'bull_use_atr': False, 'bull_use_adx': False, 'bull_use_spike': False, 'bull_rsi_required': True, 'bear_strategy': 'breakout', 'bear_bb_std_mult': 2.150940250849725, 'bear_rsi_os': 45, 'bear_rsi_ob': 92, 'bear_adx_thresh': 21.799415061899197, 'bear_atr_min_pct': 0.028725774088551377, 'bear_atr_max_pct': 0.11797127435908075, 'bear_tp_mult': 1.2355895843284403, 'bear_tsl_mult': 0.6106393535343396, 'bear_time_stop': 226, 'bear_use_sma': False, 'bear_use_ema': True, 'bear_use_atr': False, 'bear_use_adx': True, 'bear_use_spike': True, 'bear_rsi_required': True, 'sideways_strategy': 'mean_reversion', 'sideways_bb_std_mult': 1.0105717530425937, 'sideways_rsi_os': 50, 'sideways_rsi_ob': 73, 'sideways_adx_thresh': 5.8767051156831265, 'sideways_atr_min_pct': 0.021808772189852974, 'sideways_atr_max_pct': 0.03522213363163146, 'sideways_tp_mult': 1.741995081044525, 'sideways_tsl_mult': 0.8114126069361947, 'sideways_time_stop': 287, 'sideways_use_sma': False, 'sideways_use_ema': False, 'sideways_use_atr': False, 'sideways_use_adx': True, 'sideways_use_spike': False, 'sideways_rsi_required': False}.
[I 2025-08-30 21:51:17,428] Trial 507 finished with values: [-1000000000.0, 1000000000.0] and parameters: {'p_sma': 32, 'p_std': 36, 'p_atr': 21, 'p_adx': 21, 'rsi_period': 50, 'ema1': 11, 'ema2': 25, 'slip_atr_k': 0.026313807508714017, 'slip_spread_k': 0.6684528174411061, 'spread_hl_frac': 0.011077569472272794, 'bb_std_mult': 0.6754720483467824, 'rsi_os': 5, 'rsi_ob': 64, 'vol_spike': 0.033226875615416596, 'adx_thresh': 12.298385479703077, 'atr_min_pct': 0.016149445020474166, 'atr_max_pct': 0.025653655856345117, 'tp_mult': 2.2376749806018, 'tsl_mult': 0.3836757099030226, 'strategy': 'breakout', 'time_stop': 98, 'use_sma': True, 'use_atr': True, 'use_adx': True, 'use_ema': True, 'use_spike': True, 'rsi_required': True, 'edge_k': 0.9251179168375676, 'edge_cap': 0.7792110179493495, 'bull_strategy': 'breakout', 'bull_bb_std_mult': 2.1704094802262897, 'bull_rsi_os': 16, 'bull_rsi_ob': 56, 'bull_adx_thresh': 14.984628641096492, 'bull_atr_min_pct': 0.01798696491361324, 'bull_atr_max_pct': 0.13734931700621875, 'bull_tp_mult': 1.5815386138953342, 'bull_tsl_mult': 0.45632291007033526, 'bull_time_stop': 290, 'bull_use_sma': True, 'bull_use_ema': False, 'bull_use_atr': False, 'bull_use_adx': False, 'bull_use_spike': False, 'bull_rsi_required': True, 'bear_strategy': 'breakout', 'bear_bb_std_mult': 1.8269765324121185, 'bear_rsi_os': 44, 'bear_rsi_ob': 73, 'bear_adx_thresh': 27.29595963043971, 'bear_atr_min_pct': 0.028861894507609547, 'bear_atr_max_pct': 0.11852793258617886, 'bear_tp_mult': 1.1105839912390338, 'bear_tsl_mult': 0.08075584710604372, 'bear_time_stop': 229, 'bear_use_sma': False, 'bear_use_ema': True, 'bear_use_atr': False, 'bear_use_adx': True, 'bear_use_spike': True, 'bear_rsi_required': True, 'sideways_strategy': 'mean_reversion', 'sideways_bb_std_mult': 1.7777283087135693, 'sideways_rsi_os': 38, 'sideways_rsi_ob': 90, 'sideways_adx_thresh': 27.995479255384684, 'sideways_atr_min_pct': 0.02192356405060794, 'sideways_atr_max_pct': 0.03523665181568082, 'sideways_tp_mult': 1.7346491191059208, 'sideways_tsl_mult': 0.7670066880092562, 'sideways_time_stop': 198, 'sideways_use_sma': False, 'sideways_use_ema': False, 'sideways_use_atr': False, 'sideways_use_adx': True, 'sideways_use_spike': False, 'sideways_rsi_required': False}.
[I 2025-08-30 21:51:18,016] Trial 509 finished with values: [-1000000000.0, 1000000000.0] and parameters: {'p_sma': 6, 'p_std': 40, 'p_atr': 21, 'p_adx': 21, 'rsi_period': 71, 'ema1': 11, 'ema2': 25, 'slip_atr_k': 0.017807671573494763, 'slip_spread_k': 0.613682094833934, 'spread_hl_frac': 0.036046024414480356, 'bb_std_mult': 0.6400321846802344, 'rsi_os': 11, 'rsi_ob': 93, 'vol_spike': 0.2780196619116617, 'adx_thresh': 11.95549471570523, 'atr_min_pct': 0.012929224231396336, 'atr_max_pct': 0.02552437005446844, 'tp_mult': 2.292330553609813, 'tsl_mult': 0.9225238343734093, 'strategy': 'breakout', 'time_stop': 98, 'use_sma': True, 'use_atr': True, 'use_adx': True, 'use_ema': False, 'use_spike': True, 'rsi_required': False, 'edge_k': 0.8642454559226866, 'edge_cap': 0.8052357639269602, 'bull_strategy': 'breakout', 'bull_bb_std_mult': 2.1750922741494736, 'bull_rsi_os': 18, 'bull_rsi_ob': 88, 'bull_adx_thresh': 13.923827491234253, 'bull_atr_min_pct': 0.02625284109726276, 'bull_atr_max_pct': 0.055484407080296325, 'bull_tp_mult': 1.4953301439657296, 'bull_tsl_mult': 0.41807146418888147, 'bull_time_stop': 130, 'bull_use_sma': True, 'bull_use_ema': False, 'bull_use_atr': False, 'bull_use_adx': False, 'bull_use_spike': False, 'bull_rsi_required': True, 'bear_strategy': 'breakout', 'bear_bb_std_mult': 1.8581994387770744, 'bear_rsi_os': 10, 'bear_rsi_ob': 65, 'bear_adx_thresh': 28.8788559072308, 'bear_atr_min_pct': 0.02403963960946217, 'bear_atr_max_pct': 0.11952042988959159, 'bear_tp_mult': 1.6342874520247885, 'bear_tsl_mult': 0.9976144451088289, 'bear_time_stop': 225, 'bear_use_sma': False, 'bear_use_ema': True, 'bear_use_atr': False, 'bear_use_adx': True, 'bear_use_spike': True, 'bear_rsi_required': True, 'sideways_strategy': 'mean_reversion', 'sideways_bb_std_mult': 2.3967140628034724, 'sideways_rsi_os': 37, 'sideways_rsi_ob': 90, 'sideways_adx_thresh': 21.990440480694637, 'sideways_atr_min_pct': 0.020379872157501856, 'sideways_atr_max_pct': 0.03545805113131692, 'sideways_tp_mult': 1.7518322994894124, 'sideways_tsl_mult': 0.7929951926293797, 'sideways_time_stop': 257, 'sideways_use_sma': False, 'sideways_use_ema': False, 'sideways_use_atr': False, 'sideways_use_adx': True, 'sideways_use_spike': False, 'sideways_rsi_required': False}.
[I 2025-08-30 21:51:18,360] Trial 510 finished with values: [-1000000000.0, 1000000000.0] and parameters: {'p_sma': 34, 'p_std': 50, 'p_atr': 21, 'p_adx': 12, 'rsi_period': 7, 'ema1': 10, 'ema2': 55, 'slip_atr_k': 0.017923063104797042, 'slip_spread_k': 0.6693706830300523, 'spread_hl_frac': 0.040372974969250366, 'bb_std_mult': 0.9536517944665759, 'rsi_os': 12, 'rsi_ob': 65, 'vol_spike': 0.1512197039257546, 'adx_thresh': 5.016783774306964, 'atr_min_pct': 0.012937310946686946, 'atr_max_pct': 0.025839139702957464, 'tp_mult': 1.2488100049381354, 'tsl_mult': 0.4321952973615329, 'strategy': 'mean_reversion', 'time_stop': 89, 'use_sma': True, 'use_atr': True, 'use_adx': True, 'use_ema': False, 'use_spike': True, 'rsi_required': False, 'edge_k': 0.8076150738260062, 'edge_cap': 0.8054445213529795, 'bull_strategy': 'breakout', 'bull_bb_std_mult': 1.8996378280258757, 'bull_rsi_os': 18, 'bull_rsi_ob': 56, 'bull_adx_thresh': 13.666327439885535, 'bull_atr_min_pct': 0.020002938994726223, 'bull_atr_max_pct': 0.10085874501686622, 'bull_tp_mult': 1.503023462047833, 'bull_tsl_mult': 0.42217527244212183, 'bull_time_stop': 131, 'bull_use_sma': True, 'bull_use_ema': False, 'bull_use_atr': False, 'bull_use_adx': False, 'bull_use_spike': False, 'bull_rsi_required': True, 'bear_strategy': 'mean_reversion', 'bear_bb_std_mult': 2.1301181362218666, 'bear_rsi_os': 27, 'bear_rsi_ob': 45, 'bear_adx_thresh': 28.6048724986322, 'bear_atr_min_pct': 0.02403867365298779, 'bear_atr_max_pct': 0.12350555276780421, 'bear_tp_mult': 1.6400603995040801, 'bear_tsl_mult': 0.42385261571871324, 'bear_time_stop': 246, 'bear_use_sma': False, 'bear_use_ema': True, 'bear_use_atr': False, 'bear_use_adx': True, 'bear_use_spike': True, 'bear_rsi_required': True, 'sideways_strategy': 'mean_reversion', 'sideways_bb_std_mult': 3.264607253891443, 'sideways_rsi_os': 38, 'sideways_rsi_ob': 88, 'sideways_adx_thresh': 22.24466372546606, 'sideways_atr_min_pct': 0.02031359454443594, 'sideways_atr_max_pct': 0.0399543488644448, 'sideways_tp_mult': 1.816788449497463, 'sideways_tsl_mult': 0.8114570122229625, 'sideways_time_stop': 278, 'sideways_use_sma': False, 'sideways_use_ema': False, 'sideways_use_atr': False, 'sideways_use_adx': True, 'sideways_use_spike': False, 'sideways_rsi_required': False}.
[I 2025-08-30 21:51:19,093] Trial 513 finished with values: [-1000000000.0, 1000000000.0] and parameters: {'p_sma': 14, 'p_std': 38, 'p_atr': 20, 'p_adx': 26, 'rsi_period': 68, 'ema1': 10, 'ema2': 55, 'slip_atr_k': 0.22518738126022642, 'slip_spread_k': 0.6459005551851421, 'spread_hl_frac': 0.03329737539962853, 'bb_std_mult': 0.941877782746535, 'rsi_os': 13, 'rsi_ob': 68, 'vol_spike': 0.15095172593213715, 'adx_thresh': 10.953203746669297, 'atr_min_pct': 0.028169898756398914, 'atr_max_pct': 0.015822850698620685, 'tp_mult': 1.6491750724415106, 'tsl_mult': 0.8619636029342429, 'strategy': 'mean_reversion', 'time_stop': 91, 'use_sma': True, 'use_atr': False, 'use_adx': False, 'use_ema': False, 'use_spike': False, 'rsi_required': True, 'edge_k': 0.8112104219004995, 'edge_cap': 0.8662616804832596, 'bull_strategy': 'breakout', 'bull_bb_std_mult': 1.6284512244246223, 'bull_rsi_os': 38, 'bull_rsi_ob': 60, 'bull_adx_thresh': 15.096881967593047, 'bull_atr_min_pct': 0.0008033697116296785, 'bull_atr_max_pct': 0.120800605032365, 'bull_tp_mult': 1.2838020095019687, 'bull_tsl_mult': 0.6143708634072371, 'bull_time_stop': 295, 'bull_use_sma': False, 'bull_use_ema': True, 'bull_use_atr': False, 'bull_use_adx': False, 'bull_use_spike': False, 'bull_rsi_required': True, 'bear_strategy': 'mean_reversion', 'bear_bb_std_mult': 1.394670990606063, 'bear_rsi_os': 6, 'bear_rsi_ob': 59, 'bear_adx_thresh': 20.63773227785036, 'bear_atr_min_pct': 0.001198029369751625, 'bear_atr_max_pct': 0.12221011623206512, 'bear_tp_mult': 2.6473037983533274, 'bear_tsl_mult': 0.4283605561460743, 'bear_time_stop': 247, 'bear_use_sma': False, 'bear_use_ema': True, 'bear_use_atr': False, 'bear_use_adx': False, 'bear_use_spike': True, 'bear_rsi_required': True, 'sideways_strategy': 'breakout', 'sideways_bb_std_mult': 3.270428350615072, 'sideways_rsi_os': 38, 'sideways_rsi_ob': 75, 'sideways_adx_thresh': 26.99446307768634, 'sideways_atr_min_pct': 0.02020955110119187, 'sideways_atr_max_pct': 0.0427354175011305, 'sideways_tp_mult': 2.4331735764048616, 'sideways_tsl_mult': 0.8388101737764181, 'sideways_time_stop': 109, 'sideways_use_sma': False, 'sideways_use_ema': False, 'sideways_use_atr': False, 'sideways_use_adx': True, 'sideways_use_spike': True, 'sideways_rsi_required': False}.
[I 2025-08-30 21:51:19,827] Trial 515 finished with values: [-1000000000.0, 1000000000.0] and parameters: {'p_sma': 36, 'p_std': 36, 'p_atr': 21, 'p_adx': 22, 'rsi_period': 74, 'ema1': 14, 'ema2': 28, 'slip_atr_k': 0.20622899743093687, 'slip_spread_k': 0.16658850201059, 'spread_hl_frac': 0.03426291764050991, 'bb_std_mult': 0.7965580207948765, 'rsi_os': 12, 'rsi_ob': 49, 'vol_spike': 0.2862655247126931, 'adx_thresh': 11.575145168668326, 'atr_min_pct': 0.016923541006743186, 'atr_max_pct': 0.019388134773678727, 'tp_mult': 1.9271825415377715, 'tsl_mult': 0.9104792483532024, 'strategy': 'mean_reversion', 'time_stop': 93, 'use_sma': True, 'use_atr': True, 'use_adx': True, 'use_ema': True, 'use_spike': True, 'rsi_required': True, 'edge_k': 1.161659476836704, 'edge_cap': 0.7611916734131522, 'bull_strategy': 'breakout', 'bull_bb_std_mult': 1.7341684350187767, 'bull_rsi_os': 25, 'bull_rsi_ob': 86, 'bull_adx_thresh': 28.989247508421386, 'bull_atr_min_pct': 0.0033369990843786137, 'bull_atr_max_pct': 0.05135233030052781, 'bull_tp_mult': 1.443921524235638, 'bull_tsl_mult': 0.39306323677802735, 'bull_time_stop': 282, 'bull_use_sma': False, 'bull_use_ema': True, 'bull_use_atr': False, 'bull_use_adx': False, 'bull_use_spike': False, 'bull_rsi_required': True, 'bear_strategy': 'mean_reversion', 'bear_bb_std_mult': 1.9584786963615486, 'bear_rsi_os': 8, 'bear_rsi_ob': 75, 'bear_adx_thresh': 28.2046225644423, 'bear_atr_min_pct': 0.029179853790916064, 'bear_atr_max_pct': 0.12165696073070983, 'bear_tp_mult': 1.4595333069952658, 'bear_tsl_mult': 0.38778303917650164, 'bear_time_stop': 243, 'bear_use_sma': False, 'bear_use_ema': True, 'bear_use_atr': False, 'bear_use_adx': True, 'bear_use_spike': False, 'bear_rsi_required': True, 'sideways_strategy': 'breakout', 'sideways_bb_std_mult': 2.184410164907613, 'sideways_rsi_os': 36, 'sideways_rsi_ob': 52, 'sideways_adx_thresh': 29.751933437189322, 'sideways_atr_min_pct': 0.021252205616650977, 'sideways_atr_max_pct': 0.03799160400573639, 'sideways_tp_mult': 1.546799238949145, 'sideways_tsl_mult': 0.7288977504431962, 'sideways_time_stop': 268, 'sideways_use_sma': False, 'sideways_use_ema': False, 'sideways_use_atr': False, 'sideways_use_adx': True, 'sideways_use_spike': False, 'sideways_rsi_required': False}.
