[I 2025-08-30 22:00:50,200] Trial 591 finished with values: [-1000000000.0, 1000000000.0] and parameters: {'p_sma': 35, 'p_std': 34, 'p_atr': 25, 'p_adx': 22, 'rsi_period': 74, 'ema1': 15, 'ema2': 34, 'slip_atr_k': 0.026769281112456668, 'slip_spread_k': 0.6235116112621543, 'spread_hl_frac': 0.03389263491249217, 'bb_std_mult': 0.834935382428083, 'rsi_os': 10, 'rsi_ob': 84, 'vol_spike': 0.27813194495632515, 'adx_thresh': 25.303167747930537, 'atr_min_pct': 0.007054384971964249, 'atr_max_pct': 0.01322054272906499, 'tp_mult': 1.7896461118216156, 'tsl_mult': 0.12456613597339988, 'strategy': 'mean_reversion', 'time_stop': 90, 'use_sma': True, 'use_atr': False, 'use_adx': False, 'use_ema': True, 'use_spike': False, 'rsi_required': True, 'edge_k': 1.407500129756238, 'edge_cap': 0.824216001168656, 'bull_strategy': 'mean_reversion', 'bull_bb_std_mult': 1.5840328790214586, 'bull_rsi_os': 18, 'bull_rsi_ob': 87, 'bull_adx_thresh': 14.14995886488126, 'bull_atr_min_pct': 0.0020352790545035636, 'bull_atr_max_pct': 0.03890025515303075, 'bull_tp_mult': 1.321954794434906, 'bull_tsl_mult': 0.14963301833836223, 'bull_time_stop': 273, 'bull_use_sma': True, 'bull_use_ema': False, 'bull_use_atr': False, 'bull_use_adx': False, 'bull_use_spike': False, 'bull_rsi_required': True, 'bear_strategy': 'mean_reversion', 'bear_bb_std_mult': 1.337785543286838, 'bear_rsi_os': 44, 'bear_rsi_ob': 73, 'bear_adx_thresh': 27.003264767797226, 'bear_atr_min_pct': 0.005853650047935919, 'bear_atr_max_pct': 0.12105907588193338, 'bear_tp_mult': 2.1853782071544785, 'bear_tsl_mult': 0.012755112849912376, 'bear_time_stop': 237, 'bear_use_sma': False, 'bear_use_ema': True, 'bear_use_atr': False, 'bear_use_adx': True, 'bear_use_spike': False, 'bear_rsi_required': True, 'sideways_strategy': 'breakout', 'sideways_bb_std_mult': 1.0594096444790417, 'sideways_rsi_os': 27, 'sideways_rsi_ob': 90, 'sideways_adx_thresh': 18.48710719374135, 'sideways_atr_min_pct': 0.020614317447396172, 'sideways_atr_max_pct': 0.02993969614514757, 'sideways_tp_mult': 2.900782359170405, 'sideways_tsl_mult': 0.19188640930329892, 'sideways_time_stop': 249, 'sideways_use_sma': True, 'sideways_use_ema': False, 'sideways_use_atr': False, 'sideways_use_adx': True, 'sideways_use_spike': True, 'sideways_rsi_required': False}.
[I 2025-08-30 22:00:54,648] Trial 595 finished with values: [-1000000000.0, 1000000000.0] and parameters: {'p_sma': 36, 'p_std': 34, 'p_atr': 22, 'p_adx': 20, 'rsi_period': 76, 'ema1': 11, 'ema2': 10, 'slip_atr_k': 0.024671231685300294, 'slip_spread_k': 0.2682141818911188, 'spread_hl_frac': 0.032694635334138085, 'bb_std_mult': 3.1308339743332443, 'rsi_os': 10, 'rsi_ob': 66, 'vol_spike': 0.2840219078467775, 'adx_thresh': 34.12444801398702, 'atr_min_pct': 0.013185125617470388, 'atr_max_pct': 0.020978197141858893, 'tp_mult': 1.77659491916824, 'tsl_mult': 0.8622993398061323, 'strategy': 'mean_reversion', 'time_stop': 97, 'use_sma': True, 'use_atr': True, 'use_adx': True, 'use_ema': True, 'use_spike': True, 'rsi_required': False, 'edge_k': 1.349632059779546, 'edge_cap': 0.732330516215819, 'bull_strategy': 'breakout', 'bull_bb_std_mult': 1.550986950293491, 'bull_rsi_os': 54, 'bull_rsi_ob': 85, 'bull_adx_thresh': 13.971878627699219, 'bull_atr_min_pct': 0.006785492691570938, 'bull_atr_max_pct': 0.08512360990191038, 'bull_tp_mult': 1.512964668410875, 'bull_tsl_mult': 0.4133675291099318, 'bull_time_stop': 287, 'bull_use_sma': True, 'bull_use_ema': False, 'bull_use_atr': True, 'bull_use_adx': False, 'bull_use_spike': False, 'bull_rsi_required': False, 'bear_strategy': 'mean_reversion', 'bear_bb_std_mult': 1.9833803855193708, 'bear_rsi_os': 6, 'bear_rsi_ob': 91, 'bear_adx_thresh': 27.03467460052271, 'bear_atr_min_pct': 0.023355807992616544, 'bear_atr_max_pct': 0.12099115045355455, 'bear_tp_mult': 2.19405454722615, 'bear_tsl_mult': 0.3360162047023364, 'bear_time_stop': 243, 'bear_use_sma': False, 'bear_use_ema': True, 'bear_use_atr': True, 'bear_use_adx': True, 'bear_use_spike': True, 'bear_rsi_required': True, 'sideways_strategy': 'breakout', 'sideways_bb_std_mult': 1.60764358556431, 'sideways_rsi_os': 26, 'sideways_rsi_ob': 60, 'sideways_adx_thresh': 10.374123747551044, 'sideways_atr_min_pct': 0.021380939763738893, 'sideways_atr_max_pct': 0.05382813106201405, 'sideways_tp_mult': 2.9468941557706745, 'sideways_tsl_mult': 0.1995228858217888, 'sideways_time_stop': 193, 'sideways_use_sma': False, 'sideways_use_ema': False, 'sideways_use_atr': False, 'sideways_use_adx': True, 'sideways_use_spike': False, 'sideways_rsi_required': False}.
[I 2025-08-30 22:00:58,975] Trial 598 finished with values: [-1000000000.0, 1000000000.0] and parameters: {'p_sma': 33, 'p_std': 39, 'p_atr': 30, 'p_adx': 21, 'rsi_period': 7, 'ema1': 13, 'ema2': 52, 'slip_atr_k': 0.06955113729809706, 'slip_spread_k': 0.6455928770198542, 'spread_hl_frac': 0.03247693673026291, 'bb_std_mult': 0.8008953850708956, 'rsi_os': 21, 'rsi_ob': 88, 'vol_spike': 0.23061120814114044, 'adx_thresh': 8.528378717085998, 'atr_min_pct': 0.02811629102014273, 'atr_max_pct': 0.02123587755203856, 'tp_mult': 1.641812049163046, 'tsl_mult': 0.42986315780843753, 'strategy': 'breakout', 'time_stop': 72, 'use_sma': False, 'use_atr': True, 'use_adx': True, 'use_ema': True, 'use_spike': True, 'rsi_required': False, 'edge_k': 0.9861062000831536, 'edge_cap': 0.8744909423409133, 'bull_strategy': 'breakout', 'bull_bb_std_mult': 2.3068549960150078, 'bull_rsi_os': 44, 'bull_rsi_ob': 89, 'bull_adx_thresh': 8.596340539772173, 'bull_atr_min_pct': 0.00048071509891381404, 'bull_atr_max_pct': 0.14971727401405888, 'bull_tp_mult': 1.3702495193236506, 'bull_tsl_mult': 0.42247714005977727, 'bull_time_stop': 290, 'bull_use_sma': True, 'bull_use_ema': False, 'bull_use_atr': True, 'bull_use_adx': False, 'bull_use_spike': False, 'bull_rsi_required': False, 'bear_strategy': 'mean_reversion', 'bear_bb_std_mult': 1.0110887013518213, 'bear_rsi_os': 8, 'bear_rsi_ob': 91, 'bear_adx_thresh': 9.595593893629434, 'bear_atr_min_pct': 0.022460300706434237, 'bear_atr_max_pct': 0.1283609935129261, 'bear_tp_mult': 1.5522422960311901, 'bear_tsl_mult': 0.3420512528555362, 'bear_time_stop': 147, 'bear_use_sma': False, 'bear_use_ema': True, 'bear_use_atr': True, 'bear_use_adx': True, 'bear_use_spike': True, 'bear_rsi_required': False, 'sideways_strategy': 'breakout', 'sideways_bb_std_mult': 1.6069252930671398, 'sideways_rsi_os': 8, 'sideways_rsi_ob': 89, 'sideways_adx_thresh': 24.924217533080473, 'sideways_atr_min_pct': 0.02156395071086323, 'sideways_atr_max_pct': 0.04530975977380428, 'sideways_tp_mult': 1.7133675612987356, 'sideways_tsl_mult': 0.7880844892675977, 'sideways_time_stop': 262, 'sideways_use_sma': False, 'sideways_use_ema': False, 'sideways_use_atr': False, 'sideways_use_adx': True, 'sideways_use_spike': False, 'sideways_rsi_required': False}.
[I 2025-08-30 22:01:06,087] Trial 599 finished with values: [-1000000000.0, 1000000000.0] and parameters: {'p_sma': 33, 'p_std': 39, 'p_atr': 30, 'p_adx': 17, 'rsi_period': 32, 'ema1': 11, 'ema2': 29, 'slip_atr_k': 0.014663853468900135, 'slip_spread_k': 0.6519943419231042, 'spread_hl_frac': 0.0011301876398206803, 'bb_std_mult': 0.803823190154888, 'rsi_os': 22, 'rsi_ob': 76, 'vol_spike': 0.23010768604838133, 'adx_thresh': 8.824544000529638, 'atr_min_pct': 0.02814521002155005, 'atr_max_pct': 0.01899677781295826, 'tp_mult': 1.6587463456138896, 'tsl_mult': 0.4346692036466996, 'strategy': 'breakout', 'time_stop': 72, 'use_sma': False, 'use_atr': True, 'use_adx': True, 'use_ema': True, 'use_spike': True, 'rsi_required': True, 'edge_k': 0.9464861261231444, 'edge_cap': 0.8799734735056313, 'bull_strategy': 'breakout', 'bull_bb_std_mult': 1.833631633190455, 'bull_rsi_os': 27, 'bull_rsi_ob': 89, 'bull_adx_thresh': 16.207192842672615, 'bull_atr_min_pct': 0.017617328860616687, 'bull_atr_max_pct': 0.054051781716710996, 'bull_tp_mult': 1.3780858560967688, 'bull_tsl_mult': 0.49641155426923483, 'bull_time_stop': 62, 'bull_use_sma': True, 'bull_use_ema': False, 'bull_use_atr': True, 'bull_use_adx': False, 'bull_use_spike': False, 'bull_rsi_required': False, 'bear_strategy': 'mean_reversion', 'bear_bb_std_mult': 2.0267150237379368, 'bear_rsi_os': 9, 'bear_rsi_ob': 71, 'bear_adx_thresh': 9.532819021347436, 'bear_atr_min_pct': 0.02848370349064347, 'bear_atr_max_pct': 0.03761876704661656, 'bear_tp_mult': 1.5529832233932892, 'bear_tsl_mult': 0.424502163929278, 'bear_time_stop': 145, 'bear_use_sma': False, 'bear_use_ema': True, 'bear_use_atr': True, 'bear_use_adx': True, 'bear_use_spike': True, 'bear_rsi_required': False, 'sideways_strategy': 'breakout', 'sideways_bb_std_mult': 1.9223533426384223, 'sideways_rsi_os': 40, 'sideways_rsi_ob': 89, 'sideways_adx_thresh': 24.252075744085246, 'sideways_atr_min_pct': 0.021758185054226244, 'sideways_atr_max_pct': 0.0428173548970162, 'sideways_tp_mult': 1.1625058778800637, 'sideways_tsl_mult': 0.12265619630396152, 'sideways_time_stop': 152, 'sideways_use_sma': False, 'sideways_use_ema': False, 'sideways_use_atr': False, 'sideways_use_adx': True, 'sideways_use_spike': False, 'sideways_rsi_required': False}.
[I 2025-08-30 22:01:11,186] Trial 596 finished with values: [-1000000000.0, 1000000000.0] and parameters: {'p_sma': 16, 'p_std': 34, 'p_atr': 22, 'p_adx': 16, 'rsi_period': 32, 'ema1': 11, 'ema2': 54, 'slip_atr_k': 0.014055534734813737, 'slip_spread_k': 0.9216256813712367, 'spread_hl_frac': 0.03280706740846337, 'bb_std_mult': 0.8461482413498498, 'rsi_os': 21, 'rsi_ob': 94, 'vol_spike': 0.1414950660269335, 'adx_thresh': 11.582036351064508, 'atr_min_pct': 0.01323343512354428, 'atr_max_pct': 0.01786331499338869, 'tp_mult': 1.6310975264787644, 'tsl_mult': 0.9068738476421914, 'strategy': 'breakout', 'time_stop': 68, 'use_sma': True, 'use_atr': True, 'use_adx': True, 'use_ema': True, 'use_spike': True, 'rsi_required': False, 'edge_k': 0.9688489631878927, 'edge_cap': 0.7267433670304824, 'bull_strategy': 'breakout', 'bull_bb_std_mult': 1.5950304028027058, 'bull_rsi_os': 54, 'bull_rsi_ob': 85, 'bull_adx_thresh': 16.09164505162251, 'bull_atr_min_pct': 0.014626884866691465, 'bull_atr_max_pct': 0.054208723703429565, 'bull_tp_mult': 1.8884648536448099, 'bull_tsl_mult': 0.41542096752023805, 'bull_time_stop': 273, 'bull_use_sma': True, 'bull_use_ema': False, 'bull_use_atr': True, 'bull_use_adx': False, 'bull_use_spike': False, 'bull_rsi_required': False, 'bear_strategy': 'mean_reversion', 'bear_bb_std_mult': 1.9959044549047364, 'bear_rsi_os': 19, 'bear_rsi_ob': 85, 'bear_adx_thresh': 26.926768858579447, 'bear_atr_min_pct': 0.023225701644151962, 'bear_atr_max_pct': 0.1497866296491659, 'bear_tp_mult': 1.5553084290031853, 'bear_tsl_mult': 0.011428029555764607, 'bear_time_stop': 196, 'bear_use_sma': False, 'bear_use_ema': True, 'bear_use_atr': True, 'bear_use_adx': True, 'bear_use_spike': True, 'bear_rsi_required': False, 'sideways_strategy': 'breakout', 'sideways_bb_std_mult': 1.5973104493240997, 'sideways_rsi_os': 40, 'sideways_rsi_ob': 89, 'sideways_adx_thresh': 25.2281209968174, 'sideways_atr_min_pct': 0.021338026605474285, 'sideways_atr_max_pct': 0.04538811043570328, 'sideways_tp_mult': 2.909830595037985, 'sideways_tsl_mult': 0.20861207895804484, 'sideways_time_stop': 163, 'sideways_use_sma': False, 'sideways_use_ema': False, 'sideways_use_atr': False, 'sideways_use_adx': True, 'sideways_use_spike': False, 'sideways_rsi_required': False}.
[I 2025-08-30 22:01:12,306] Trial 597 finished with values: [-1000000000.0, 1000000000.0] and parameters: {'p_sma': 33, 'p_std': 51, 'p_atr': 30, 'p_adx': 21, 'rsi_period': 9, 'ema1': 11, 'ema2': 55, 'slip_atr_k': 0.014023087733493884, 'slip_spread_k': 0.2597423720844739, 'spread_hl_frac': 0.03763974097419533, 'bb_std_mult': 3.1402091985837033, 'rsi_os': 11, 'rsi_ob': 94, 'vol_spike': 0.2905335780881197, 'adx_thresh': 10.543155358729141, 'atr_min_pct': 0.007055514408676196, 'atr_max_pct': 0.021224042402522292, 'tp_mult': 1.6338138441809336, 'tsl_mult': 0.8999167417493167, 'strategy': 'breakout', 'time_stop': 88, 'use_sma': True, 'use_atr': True, 'use_adx': True, 'use_ema': True, 'use_spike': True, 'rsi_required': True, 'edge_k': 0.9770250404299037, 'edge_cap': 0.8585953051560904, 'bull_strategy': 'breakout', 'bull_bb_std_mult': 1.5777430815421418, 'bull_rsi_os': 15, 'bull_rsi_ob': 85, 'bull_adx_thresh': 16.08403206306466, 'bull_atr_min_pct': 0.006793494658522071, 'bull_atr_max_pct': 0.03331391205913853, 'bull_tp_mult': 1.8781780398217132, 'bull_tsl_mult': 0.41144523439368047, 'bull_time_stop': 300, 'bull_use_sma': True, 'bull_use_ema': False, 'bull_use_atr': True, 'bull_use_adx': False, 'bull_use_spike': False, 'bull_rsi_required': False, 'bear_strategy': 'mean_reversion', 'bear_bb_std_mult': 2.009202710811367, 'bear_rsi_os': 8, 'bear_rsi_ob': 91, 'bear_adx_thresh': 9.565960328676292, 'bear_atr_min_pct': 0.028605902184773453, 'bear_atr_max_pct': 0.03835197503501808, 'bear_tp_mult': 1.496058769711082, 'bear_tsl_mult': 0.3224067740069376, 'bear_time_stop': 159, 'bear_use_sma': False, 'bear_use_ema': True, 'bear_use_atr': True, 'bear_use_adx': True, 'bear_use_spike': True, 'bear_rsi_required': False, 'sideways_strategy': 'breakout', 'sideways_bb_std_mult': 1.985636273474177, 'sideways_rsi_os': 40, 'sideways_rsi_ob': 60, 'sideways_adx_thresh': 30.694957666128605, 'sideways_atr_min_pct': 0.021958040391870312, 'sideways_atr_max_pct': 0.05401082684331862, 'sideways_tp_mult': 2.949215823805054, 'sideways_tsl_mult': 0.12127592561906259, 'sideways_time_stop': 150, 'sideways_use_sma': False, 'sideways_use_ema': False, 'sideways_use_atr': False, 'sideways_use_adx': True, 'sideways_use_spike': False, 'sideways_rsi_required': False}.
[I 2025-08-30 22:01:45,076] Trial 600 finished with values: [-1000000000.0, 1000000000.0] and parameters: {'p_sma': 16, 'p_std': 41, 'p_atr': 21, 'p_adx': 21, 'rsi_period': 45, 'ema1': 11, 'ema2': 54, 'slip_atr_k': 0.1335671569999664, 'slip_spread_k': 0.08334520787262795, 'spread_hl_frac': 0.0010904411594628502, 'bb_std_mult': 0.866267598231102, 'rsi_os': 12, 'rsi_ob': 86, 'vol_spike': 0.11368722454765215, 'adx_thresh': 11.739786914324092, 'atr_min_pct': 0.014687885087115037, 'atr_max_pct': 0.01744019324446762, 'tp_mult': 1.6720962259218388, 'tsl_mult': 0.9081566908666329, 'strategy': 'breakout', 'time_stop': 86, 'use_sma': True, 'use_atr': True, 'use_adx': True, 'use_ema': True, 'use_spike': True, 'rsi_required': True, 'edge_k': 0.9498715552876121, 'edge_cap': 0.5046322343926183, 'bull_strategy': 'breakout', 'bull_bb_std_mult': 1.2266955545477132, 'bull_rsi_os': 27, 'bull_rsi_ob': 83, 'bull_adx_thresh': 16.217013925501984, 'bull_atr_min_pct': 0.012860617188909903, 'bull_atr_max_pct': 0.034386377210491224, 'bull_tp_mult': 1.387213959177772, 'bull_tsl_mult': 0.49701356295519566, 'bull_time_stop': 300, 'bull_use_sma': True, 'bull_use_ema': False, 'bull_use_atr': False, 'bull_use_adx': False, 'bull_use_spike': True, 'bull_rsi_required': True, 'bear_strategy': 'mean_reversion', 'bear_bb_std_mult': 2.033943699809408, 'bear_rsi_os': 19, 'bear_rsi_ob': 72, 'bear_adx_thresh': 26.55951586074901, 'bear_atr_min_pct': 0.02875654080280297, 'bear_atr_max_pct': 0.11712347109050915, 'bear_tp_mult': 2.602006025656335, 'bear_tsl_mult': 0.67824864200272, 'bear_time_stop': 21, 'bear_use_sma': False, 'bear_use_ema': True, 'bear_use_atr': False, 'bear_use_adx': True, 'bear_use_spike': True, 'bear_rsi_required': False, 'sideways_strategy': 'breakout', 'sideways_bb_std_mult': 1.968948301360354, 'sideways_rsi_os': 40, 'sideways_rsi_ob': 88, 'sideways_adx_thresh': 30.71332747373488, 'sideways_atr_min_pct': 0.021932419485092686, 'sideways_atr_max_pct': 0.04353248638841647, 'sideways_tp_mult': 1.9024936174976754, 'sideways_tsl_mult': 0.8210439034205123, 'sideways_time_stop': 149, 'sideways_use_sma': False, 'sideways_use_ema': True, 'sideways_use_atr': True, 'sideways_use_adx': True, 'sideways_use_spike': False, 'sideways_rsi_required': True}.
[I 2025-08-30 22:01:47,164] Trial 601 finished with values: [-1000000000.0, 1000000000.0] and parameters: {'p_sma': 34, 'p_std': 42, 'p_atr': 21, 'p_adx': 21, 'rsi_period': 71, 'ema1': 12, 'ema2': 54, 'slip_atr_k': 0.24996180547208074, 'slip_spread_k': 0.6803749446550446, 'spread_hl_frac': 0.03747980706678481, 'bb_std_mult': 0.8828703219557883, 'rsi_os': 12, 'rsi_ob': 86, 'vol_spike': 0.29092586574929397, 'adx_thresh': 10.778557057845394, 'atr_min_pct': 0.007946812731986361, 'atr_max_pct': 0.017254775141933385, 'tp_mult': 2.865424948878309, 'tsl_mult': 0.9056771553735875, 'strategy': 'mean_reversion', 'time_stop': 87, 'use_sma': True, 'use_atr': True, 'use_adx': True, 'use_ema': True, 'use_spike': True, 'rsi_required': True, 'edge_k': 1.6960354304087297, 'edge_cap': 0.25038749049091247, 'bull_strategy': 'breakout', 'bull_bb_std_mult': 1.237681694855223, 'bull_rsi_os': 26, 'bull_rsi_ob': 85, 'bull_adx_thresh': 15.451761110400065, 'bull_atr_min_pct': 0.025290056512601813, 'bull_atr_max_pct': 0.034296865316896984, 'bull_tp_mult': 1.8746567946839336, 'bull_tsl_mult': 0.9761408075027254, 'bull_time_stop': 300, 'bull_use_sma': True, 'bull_use_ema': False, 'bull_use_atr': False, 'bull_use_adx': False, 'bull_use_spike': True, 'bull_rsi_required': True, 'bear_strategy': 'mean_reversion', 'bear_bb_std_mult': 1.8615749716837087, 'bear_rsi_os': 19, 'bear_rsi_ob': 57, 'bear_adx_thresh': 27.536984195539052, 'bear_atr_min_pct': 0.0287858968911549, 'bear_atr_max_pct': 0.04338808378337088, 'bear_tp_mult': 2.2708104794712773, 'bear_tsl_mult': 0.681620188002241, 'bear_time_stop': 282, 'bear_use_sma': True, 'bear_use_ema': True, 'bear_use_atr': False, 'bear_use_adx': True, 'bear_use_spike': True, 'bear_rsi_required': True, 'sideways_strategy': 'breakout', 'sideways_bb_std_mult': 1.7419277739804973, 'sideways_rsi_os': 48, 'sideways_rsi_ob': 88, 'sideways_adx_thresh': 27.06008524090341, 'sideways_atr_min_pct': 0.02017582574170527, 'sideways_atr_max_pct': 0.08453167661558413, 'sideways_tp_mult': 1.903444840957045, 'sideways_tsl_mult': 0.8248626009333616, 'sideways_time_stop': 161, 'sideways_use_sma': False, 'sideways_use_ema': True, 'sideways_use_atr': True, 'sideways_use_adx': True, 'sideways_use_spike': False, 'sideways_rsi_required': True}.
[I 2025-08-30 22:01:48,866] Trial 602 finished with values: [-1000000000.0, 1000000000.0] and parameters: {'p_sma': 52, 'p_std': 35, 'p_atr': 21, 'p_adx': 10, 'rsi_period': 10, 'ema1': 12, 'ema2': 55, 'slip_atr_k': 0.03765808294148313, 'slip_spread_k': 0.686498667729625, 'spread_hl_frac': 0.03788162694025963, 'bb_std_mult': 0.9677480198131863, 'rsi_os': 12, 'rsi_ob': 64, 'vol_spike': 0.24597428961756207, 'adx_thresh': 10.773327851693084, 'atr_min_pct': 0.025392947592872653, 'atr_max_pct': 0.12244781386108022, 'tp_mult': 2.855976111390624, 'tsl_mult': 0.8924534309579071, 'strategy': 'mean_reversion', 'time_stop': 34, 'use_sma': True, 'use_atr': True, 'use_adx': True, 'use_ema': True, 'use_spike': True, 'rsi_required': True, 'edge_k': 1.0324159179419032, 'edge_cap': 0.49781312053487464, 'bull_strategy': 'breakout', 'bull_bb_std_mult': 2.063285753982031, 'bull_rsi_os': 24, 'bull_rsi_ob': 88, 'bull_adx_thresh': 15.330623757533074, 'bull_atr_min_pct': 0.0014158019797214916, 'bull_atr_max_pct': 0.034605949992590375, 'bull_tp_mult': 2.754663107259223, 'bull_tsl_mult': 0.3860752416277273, 'bull_time_stop': 188, 'bull_use_sma': True, 'bull_use_ema': False, 'bull_use_atr': False, 'bull_use_adx': False, 'bull_use_spike': True, 'bull_rsi_required': True, 'bear_strategy': 'mean_reversion', 'bear_bb_std_mult': 2.1167255394216453, 'bear_rsi_os': 5, 'bear_rsi_ob': 73, 'bear_adx_thresh': 27.562937180626058, 'bear_atr_min_pct': 0.02997389408264303, 'bear_atr_max_pct': 0.1006824222796615, 'bear_tp_mult': 2.5951867369642274, 'bear_tsl_mult': 0.5522161151307344, 'bear_time_stop': 19, 'bear_use_sma': True, 'bear_use_ema': False, 'bear_use_atr': False, 'bear_use_adx': True, 'bear_use_spike': True, 'bear_rsi_required': True, 'sideways_strategy': 'breakout', 'sideways_bb_std_mult': 3.19485220341583, 'sideways_rsi_os': 39, 'sideways_rsi_ob': 74, 'sideways_adx_thresh': 26.658942997367664, 'sideways_atr_min_pct': 0.0223816717330937, 'sideways_atr_max_pct': 0.08525153045511911, 'sideways_tp_mult': 1.9068191147634845, 'sideways_tsl_mult': 0.8298916039668006, 'sideways_time_stop': 111, 'sideways_use_sma': False, 'sideways_use_ema': True, 'sideways_use_atr': True, 'sideways_use_adx': True, 'sideways_use_spike': False, 'sideways_rsi_required': True}.
