[I 2025-08-30 21:21:04,998] Trial 270 finished with values: [-0.0335569480527691, 0.033458563121107066] and parameters: {'p_sma': 30, 'p_std': 23, 'p_atr': 30, 'p_adx': 29, 'rsi_period': 22, 'ema1': 25, 'ema2': 44, 'slip_atr_k': 0.031328385841445906, 'slip_spread_k': 0.5286172828850926, 'spread_hl_frac': 0.006613450209722551, 'bb_std_mult': 3.240766460648947, 'rsi_os': 10, 'rsi_ob': 79, 'vol_spike': 0.12499837651472698, 'adx_thresh': 27.464444119635907, 'atr_min_pct': 0.021464262635641964, 'atr_max_pct': 0.13193395413886247, 'tp_mult': 2.7405212146397386, 'tsl_mult': 0.2513359644580515, 'strategy': 'mean_reversion', 'time_stop': 51, 'use_sma': True, 'use_atr': True, 'use_adx': True, 'use_ema': True, 'use_spike': True, 'rsi_required': True, 'edge_k': 0.6387271003853774, 'edge_cap': 0.6530069320029646, 'bull_strategy': 'breakout', 'bull_bb_std_mult': 0.6340876304796754, 'bull_rsi_os': 17, 'bull_rsi_ob': 73, 'bull_adx_thresh': 8.330196716224451, 'bull_atr_min_pct': 0.0019793146989584916, 'bull_atr_max_pct': 0.09838776927739226, 'bull_tp_mult': 2.425815377657024, 'bull_tsl_mult': 0.3762192350620548, 'bull_time_stop': 15, 'bull_use_sma': True, 'bull_use_ema': False, 'bull_use_atr': False, 'bull_use_adx': True, 'bull_use_spike': True, 'bull_rsi_required': True, 'bear_strategy': 'mean_reversion', 'bear_bb_std_mult': 2.853042048150861, 'bear_rsi_os': 37, 'bear_rsi_ob': 53, 'bear_adx_thresh': 33.63124440117538, 'bear_atr_min_pct': 9.603975422749385e-05, 'bear_atr_max_pct': 0.06167797796136563, 'bear_tp_mult': 1.8241689104778058, 'bear_tsl_mult': 0.982274493398772, 'bear_time_stop': 97, 'bear_use_sma': False, 'bear_use_ema': True, 'bear_use_atr': False, 'bear_use_adx': True, 'bear_use_spike': True, 'bear_rsi_required': True, 'sideways_strategy': 'breakout', 'sideways_bb_std_mult': 1.708568334649962, 'sideways_rsi_os': 41, 'sideways_rsi_ob': 95, 'sideways_adx_thresh': 26.318218598443213, 'sideways_atr_min_pct': 0.012161800338168046, 'sideways_atr_max_pct': 0.11126696139326772, 'sideways_tp_mult': 1.746286854311599, 'sideways_tsl_mult': 0.4921377987085286, 'sideways_time_stop': 279, 'sideways_use_sma': False, 'sideways_use_ema': True, 'sideways_use_atr': True, 'sideways_use_adx': False, 'sideways_use_spike': False, 'sideways_rsi_required': True}.
[I 2025-08-30 21:21:05,505] Trial 273 finished with values: [-1000000000.0, 1000000000.0] and parameters: {'p_sma': 57, 'p_std': 24, 'p_atr': 15, 'p_adx': 29, 'rsi_period': 64, 'ema1': 10, 'ema2': 34, 'slip_atr_k': 0.11229584277222353, 'slip_spread_k': 0.5501125134287405, 'spread_hl_frac': 0.025233238851347917, 'bb_std_mult': 3.379490410541466, 'rsi_os': 10, 'rsi_ob': 48, 'vol_spike': 0.28565564704743157, 'adx_thresh': 30.393603578951925, 'atr_min_pct': 0.021521102644929718, 'atr_max_pct': 0.05847348705150695, 'tp_mult': 1.6179566164833887, 'tsl_mult': 0.960479592049565, 'strategy': 'mean_reversion', 'time_stop': 114, 'use_sma': True, 'use_atr': True, 'use_adx': True, 'use_ema': True, 'use_spike': True, 'rsi_required': True, 'edge_k': 1.3815626374748873, 'edge_cap': 0.1641262836553427, 'bull_strategy': 'breakout', 'bull_bb_std_mult': 1.3790322219044855, 'bull_rsi_os': 35, 'bull_rsi_ob': 80, 'bull_adx_thresh': 14.941865463611421, 'bull_atr_min_pct': 0.01140518190610219, 'bull_atr_max_pct': 0.05027160053223009, 'bull_tp_mult': 2.037372288362928, 'bull_tsl_mult': 0.3722699531148892, 'bull_time_stop': 163, 'bull_use_sma': True, 'bull_use_ema': False, 'bull_use_atr': False, 'bull_use_adx': True, 'bull_use_spike': True, 'bull_rsi_required': True, 'bear_strategy': 'mean_reversion', 'bear_bb_std_mult': 2.8587233757932897, 'bear_rsi_os': 39, 'bear_rsi_ob': 83, 'bear_adx_thresh': 33.869752230714916, 'bear_atr_min_pct': 0.016209633913980018, 'bear_atr_max_pct': 0.04895279759759061, 'bear_tp_mult': 1.8130102700303625, 'bear_tsl_mult': 0.45998252285356656, 'bear_time_stop': 105, 'bear_use_sma': True, 'bear_use_ema': True, 'bear_use_atr': False, 'bear_use_adx': True, 'bear_use_spike': True, 'bear_rsi_required': True, 'sideways_strategy': 'breakout', 'sideways_bb_std_mult': 1.6022170365416735, 'sideways_rsi_os': 33, 'sideways_rsi_ob': 90, 'sideways_adx_thresh': 25.32291396896786, 'sideways_atr_min_pct': 0.015966025025347528, 'sideways_atr_max_pct': 0.09461629583168077, 'sideways_tp_mult': 2.0880573603689925, 'sideways_tsl_mult': 0.4297613168782577, 'sideways_time_stop': 278, 'sideways_use_sma': False, 'sideways_use_ema': True, 'sideways_use_atr': True, 'sideways_use_adx': False, 'sideways_use_spike': False, 'sideways_rsi_required': True}.
[I 2025-08-30 21:21:41,661] Trial 272 finished with values: [-1000000000.0, 1000000000.0] and parameters: {'p_sma': 28, 'p_std': 35, 'p_atr': 10, 'p_adx': 29, 'rsi_period': 47, 'ema1': 28, 'ema2': 43, 'slip_atr_k': 0.031149547755875036, 'slip_spread_k': 0.5822686986821528, 'spread_hl_frac': 0.007055569584706999, 'bb_std_mult': 3.2474956221935045, 'rsi_os': 10, 'rsi_ob': 84, 'vol_spike': 0.060304580079579936, 'adx_thresh': 30.417182315988942, 'atr_min_pct': 0.021187960285750696, 'atr_max_pct': 0.09230175605322867, 'tp_mult': 1.1410740133178632, 'tsl_mult': 0.4534273541445756, 'strategy': 'mean_reversion', 'time_stop': 62, 'use_sma': True, 'use_atr': True, 'use_adx': True, 'use_ema': True, 'use_spike': True, 'rsi_required': True, 'edge_k': 0.6523366766198756, 'edge_cap': 0.9222658899453409, 'bull_strategy': 'breakout', 'bull_bb_std_mult': 1.9749661121366604, 'bull_rsi_os': 27, 'bull_rsi_ob': 71, 'bull_adx_thresh': 25.181621433581714, 'bull_atr_min_pct': 0.0009928815044672353, 'bull_atr_max_pct': 0.09914822192829446, 'bull_tp_mult': 2.4179924597470204, 'bull_tsl_mult': 0.3727458087754668, 'bull_time_stop': 14, 'bull_use_sma': True, 'bull_use_ema': False, 'bull_use_atr': False, 'bull_use_adx': True, 'bull_use_spike': True, 'bull_rsi_required': True, 'bear_strategy': 'mean_reversion', 'bear_bb_std_mult': 2.9647794912052086, 'bear_rsi_os': 39, 'bear_rsi_ob': 53, 'bear_adx_thresh': 15.422291660218082, 'bear_atr_min_pct': 0.01637104926227424, 'bear_atr_max_pct': 0.013236891458889604, 'bear_tp_mult': 1.1074589328826727, 'bear_tsl_mult': 0.7224832284096132, 'bear_time_stop': 71, 'bear_use_sma': False, 'bear_use_ema': True, 'bear_use_atr': False, 'bear_use_adx': True, 'bear_use_spike': True, 'bear_rsi_required': True, 'sideways_strategy': 'breakout', 'sideways_bb_std_mult': 1.5868995423766277, 'sideways_rsi_os': 33, 'sideways_rsi_ob': 95, 'sideways_adx_thresh': 26.31389331213707, 'sideways_atr_min_pct': 0.014229259238117966, 'sideways_atr_max_pct': 0.1107781460690557, 'sideways_tp_mult': 2.3098187015020497, 'sideways_tsl_mult': 0.5547311881813954, 'sideways_time_stop': 253, 'sideways_use_sma': False, 'sideways_use_ema': True, 'sideways_use_atr': True, 'sideways_use_adx': False, 'sideways_use_spike': False, 'sideways_rsi_required': True}.
[I 2025-08-30 21:21:42,141] Trial 271 finished with values: [-1000000000.0, 1000000000.0] and parameters: {'p_sma': 57, 'p_std': 35, 'p_atr': 15, 'p_adx': 26, 'rsi_period': 65, 'ema1': 25, 'ema2': 43, 'slip_atr_k': 0.03107242561615195, 'slip_spread_k': 0.5464453389251258, 'spread_hl_frac': 0.04320971471424476, 'bb_std_mult': 3.275618843268299, 'rsi_os': 7, 'rsi_ob': 83, 'vol_spike': 0.1928593851952508, 'adx_thresh': 30.340066270894738, 'atr_min_pct': 0.02146537912377698, 'atr_max_pct': 0.08670442914178629, 'tp_mult': 1.6202110015091862, 'tsl_mult': 0.2590463355726178, 'strategy': 'mean_reversion', 'time_stop': 124, 'use_sma': True, 'use_atr': True, 'use_adx': True, 'use_ema': True, 'use_spike': True, 'rsi_required': True, 'edge_k': 0.6507161340510845, 'edge_cap': 0.6584075742787194, 'bull_strategy': 'breakout', 'bull_bb_std_mult': 1.3411090300392758, 'bull_rsi_os': 20, 'bull_rsi_ob': 71, 'bull_adx_thresh': 24.945312437163274, 'bull_atr_min_pct': 0.005165808284563976, 'bull_atr_max_pct': 0.05149281610873827, 'bull_tp_mult': 2.4303562347911627, 'bull_tsl_mult': 0.37691932161208896, 'bull_time_stop': 176, 'bull_use_sma': True, 'bull_use_ema': False, 'bull_use_atr': False, 'bull_use_adx': True, 'bull_use_spike': True, 'bull_rsi_required': True, 'bear_strategy': 'mean_reversion', 'bear_bb_std_mult': 2.265040314275112, 'bear_rsi_os': 39, 'bear_rsi_ob': 84, 'bear_adx_thresh': 16.73864119481896, 'bear_atr_min_pct': 0.01527118063965637, 'bear_atr_max_pct': 0.01344010650645095, 'bear_tp_mult': 1.6673471076351403, 'bear_tsl_mult': 0.9808527498289796, 'bear_time_stop': 99, 'bear_use_sma': True, 'bear_use_ema': True, 'bear_use_atr': False, 'bear_use_adx': True, 'bear_use_spike': True, 'bear_rsi_required': True, 'sideways_strategy': 'breakout', 'sideways_bb_std_mult': 1.592578709109854, 'sideways_rsi_os': 41, 'sideways_rsi_ob': 95, 'sideways_adx_thresh': 26.330731271671365, 'sideways_atr_min_pct': 0.011750658714222654, 'sideways_atr_max_pct': 0.11155645400310293, 'sideways_tp_mult': 2.3549767047687107, 'sideways_tsl_mult': 0.832682454026184, 'sideways_time_stop': 248, 'sideways_use_sma': False, 'sideways_use_ema': True, 'sideways_use_atr': True, 'sideways_use_adx': False, 'sideways_use_spike': False, 'sideways_rsi_required': True}.
[I 2025-08-30 21:21:42,797] Trial 274 finished with values: [-1000000000.0, 1000000000.0] and parameters: {'p_sma': 57, 'p_std': 32, 'p_atr': 25, 'p_adx': 30, 'rsi_period': 19, 'ema1': 21, 'ema2': 43, 'slip_atr_k': 0.0847726929570673, 'slip_spread_k': 0.5517804244338305, 'spread_hl_frac': 0.04165029172214098, 'bb_std_mult': 1.7454386146918714, 'rsi_os': 5, 'rsi_ob': 95, 'vol_spike': 0.2928660559419305, 'adx_thresh': 30.03480453287668, 'atr_min_pct': 0.021118968135025038, 'atr_max_pct': 0.08161662294106123, 'tp_mult': 2.686908955998173, 'tsl_mult': 0.874064789549246, 'strategy': 'mean_reversion', 'time_stop': 62, 'use_sma': False, 'use_atr': True, 'use_adx': True, 'use_ema': True, 'use_spike': True, 'rsi_required': True, 'edge_k': 0.6621109812485202, 'edge_cap': 0.15770772176467213, 'bull_strategy': 'breakout', 'bull_bb_std_mult': 3.4901757739211003, 'bull_rsi_os': 27, 'bull_rsi_ob': 82, 'bull_adx_thresh': 23.056537053730654, 'bull_atr_min_pct': 0.01115143042324337, 'bull_atr_max_pct': 0.11782392160688693, 'bull_tp_mult': 2.0488617405818776, 'bull_tsl_mult': 0.4731287193003668, 'bull_time_stop': 293, 'bull_use_sma': True, 'bull_use_ema': False, 'bull_use_atr': False, 'bull_use_adx': True, 'bull_use_spike': True, 'bull_rsi_required': True, 'bear_strategy': 'mean_reversion', 'bear_bb_std_mult': 2.647813989615958, 'bear_rsi_os': 39, 'bear_rsi_ob': 83, 'bear_adx_thresh': 15.604421923428049, 'bear_atr_min_pct': 0.01634789048997499, 'bear_atr_max_pct': 0.012998472647887983, 'bear_tp_mult': 2.9086048011615384, 'bear_tsl_mult': 0.6461434823054283, 'bear_time_stop': 48, 'bear_use_sma': True, 'bear_use_ema': False, 'bear_use_atr': False, 'bear_use_adx': True, 'bear_use_spike': True, 'bear_rsi_required': True, 'sideways_strategy': 'breakout', 'sideways_bb_std_mult': 1.6270910629832802, 'sideways_rsi_os': 19, 'sideways_rsi_ob': 93, 'sideways_adx_thresh': 25.276419042737974, 'sideways_atr_min_pct': 0.014122792495285502, 'sideways_atr_max_pct': 0.09455865187261817, 'sideways_tp_mult': 1.6493280381671798, 'sideways_tsl_mult': 0.43432009089078044, 'sideways_time_stop': 244, 'sideways_use_sma': False, 'sideways_use_ema': True, 'sideways_use_atr': True, 'sideways_use_adx': False, 'sideways_use_spike': False, 'sideways_rsi_required': True}.
[I 2025-08-30 21:21:42,823] Trial 275 finished with values: [-1000000000.0, 1000000000.0] and parameters: {'p_sma': 28, 'p_std': 32, 'p_atr': 15, 'p_adx': 26, 'rsi_period': 47, 'ema1': 24, 'ema2': 43, 'slip_atr_k': 0.17765881875235162, 'slip_spread_k': 0.5538978250980274, 'spread_hl_frac': 0.005671603685447842, 'bb_std_mult': 1.7780697490169584, 'rsi_os': 5, 'rsi_ob': 60, 'vol_spike': 0.2092487149067212, 'adx_thresh': 29.256886260359778, 'atr_min_pct': 0.018147150873051524, 'atr_max_pct': 0.053578609578338446, 'tp_mult': 2.360102848160185, 'tsl_mult': 0.8886638216313458, 'strategy': 'mean_reversion', 'time_stop': 91, 'use_sma': False, 'use_atr': True, 'use_adx': True, 'use_ema': True, 'use_spike': True, 'rsi_required': True, 'edge_k': 1.7791212846742166, 'edge_cap': 0.60320455606871, 'bull_strategy': 'breakout', 'bull_bb_std_mult': 1.8985766650072218, 'bull_rsi_os': 18, 'bull_rsi_ob': 70, 'bull_adx_thresh': 23.34825710052469, 'bull_atr_min_pct': 0.016490145574341343, 'bull_atr_max_pct': 0.1179322673181927, 'bull_tp_mult': 2.230402404213662, 'bull_tsl_mult': 0.42951877368133085, 'bull_time_stop': 52, 'bull_use_sma': True, 'bull_use_ema': False, 'bull_use_atr': False, 'bull_use_adx': True, 'bull_use_spike': True, 'bull_rsi_required': True, 'bear_strategy': 'mean_reversion', 'bear_bb_std_mult': 1.2151823270318438, 'bear_rsi_os': 39, 'bear_rsi_ob': 80, 'bear_adx_thresh': 15.36538248798406, 'bear_atr_min_pct': 0.014217851141503092, 'bear_atr_max_pct': 0.012953264296828915, 'bear_tp_mult': 2.3975237133041754, 'bear_tsl_mult': 0.4498725151002823, 'bear_time_stop': 186, 'bear_use_sma': True, 'bear_use_ema': False, 'bear_use_atr': False, 'bear_use_adx': False, 'bear_use_spike': True, 'bear_rsi_required': True, 'sideways_strategy': 'breakout', 'sideways_bb_std_mult': 1.6414521969016092, 'sideways_rsi_os': 42, 'sideways_rsi_ob': 92, 'sideways_adx_thresh': 27.27537340114869, 'sideways_atr_min_pct': 0.014207321957722844, 'sideways_atr_max_pct': 0.09514994512913494, 'sideways_tp_mult': 2.416042861717002, 'sideways_tsl_mult': 0.40741975058366575, 'sideways_time_stop': 255, 'sideways_use_sma': False, 'sideways_use_ema': True, 'sideways_use_atr': False, 'sideways_use_adx': True, 'sideways_use_spike': False, 'sideways_rsi_required': True}.
[I 2025-08-30 21:22:18,974] Trial 276 finished with values: [-1000000000.0, 1000000000.0] and parameters: {'p_sma': 28, 'p_std': 52, 'p_atr': 25, 'p_adx': 30, 'rsi_period': 43, 'ema1': 21, 'ema2': 12, 'slip_atr_k': 0.020977208713614158, 'slip_spread_k': 0.5579511815844771, 'spread_hl_frac': 0.004070249542000297, 'bb_std_mult': 1.760574515295928, 'rsi_os': 7, 'rsi_ob': 94, 'vol_spike': 0.04668001715648254, 'adx_thresh': 28.862037097124073, 'atr_min_pct': 0.019931876351878566, 'atr_max_pct': 0.08143141302743663, 'tp_mult': 2.6850562780203755, 'tsl_mult': 0.891880335342797, 'strategy': 'breakout', 'time_stop': 93, 'use_sma': False, 'use_atr': False, 'use_adx': False, 'use_ema': False, 'use_spike': False, 'rsi_required': True, 'edge_k': 1.7739587872811629, 'edge_cap': 0.6099442943416178, 'bull_strategy': 'mean_reversion', 'bull_bb_std_mult': 1.8711231266799064, 'bull_rsi_os': 20, 'bull_rsi_ob': 70, 'bull_adx_thresh': 15.43579055484075, 'bull_atr_min_pct': 0.0009520803063790268, 'bull_atr_max_pct': 0.11923155586468562, 'bull_tp_mult': 2.2309629278458742, 'bull_tsl_mult': 0.47098072506295574, 'bull_time_stop': 80, 'bull_use_sma': True, 'bull_use_ema': False, 'bull_use_atr': True, 'bull_use_adx': True, 'bull_use_spike': False, 'bull_rsi_required': True, 'bear_strategy': 'breakout', 'bear_bb_std_mult': 1.5616808004870144, 'bear_rsi_os': 39, 'bear_rsi_ob': 50, 'bear_adx_thresh': 16.19426574707215, 'bear_atr_min_pct': 0.014184429922912963, 'bear_atr_max_pct': 0.10358563010891915, 'bear_tp_mult': 2.9174764801616653, 'bear_tsl_mult': 0.7763287202990715, 'bear_time_stop': 77, 'bear_use_sma': True, 'bear_use_ema': False, 'bear_use_atr': True, 'bear_use_adx': False, 'bear_use_spike': True, 'bear_rsi_required': False, 'sideways_strategy': 'mean_reversion', 'sideways_bb_std_mult': 1.8074780080881248, 'sideways_rsi_os': 40, 'sideways_rsi_ob': 92, 'sideways_adx_thresh': 27.234487162824966, 'sideways_atr_min_pct': 0.022350192585198388, 'sideways_atr_max_pct': 0.09062648908989097, 'sideways_tp_mult': 2.38597826239559, 'sideways_tsl_mult': 0.4017407180583763, 'sideways_time_stop': 258, 'sideways_use_sma': False, 'sideways_use_ema': False, 'sideways_use_atr': False, 'sideways_use_adx': True, 'sideways_use_spike': False, 'sideways_rsi_required': False}.
[I 2025-08-30 21:22:19,950] Trial 277 finished with values: [-1000000000.0, 1000000000.0] and parameters: {'p_sma': 17, 'p_std': 31, 'p_atr': 8, 'p_adx': 17, 'rsi_period': 51, 'ema1': 24, 'ema2': 22, 'slip_atr_k': 0.02225866887075574, 'slip_spread_k': 0.5156029158233144, 'spread_hl_frac': 0.04161509725692362, 'bb_std_mult': 1.5316821995505328, 'rsi_os': 9, 'rsi_ob': 80, 'vol_spike': 0.29225732115141406, 'adx_thresh': 28.75292946420188, 'atr_min_pct': 0.01950509326247805, 'atr_max_pct': 0.05274283269201522, 'tp_mult': 1.2132614885333457, 'tsl_mult': 0.872764495453154, 'strategy': 'breakout', 'time_stop': 91, 'use_sma': False, 'use_atr': False, 'use_adx': False, 'use_ema': False, 'use_spike': False, 'rsi_required': False, 'edge_k': 1.7711730385828268, 'edge_cap': 0.6067029397983698, 'bull_strategy': 'mean_reversion', 'bull_bb_std_mult': 3.357649867801659, 'bull_rsi_os': 18, 'bull_rsi_ob': 58, 'bull_adx_thresh': 24.06919291473773, 'bull_atr_min_pct': 0.0009419506337602214, 'bull_atr_max_pct': 0.05901958696870816, 'bull_tp_mult': 2.226466310783912, 'bull_tsl_mult': 0.472677395338887, 'bull_time_stop': 94, 'bull_use_sma': False, 'bull_use_ema': True, 'bull_use_atr': True, 'bull_use_adx': True, 'bull_use_spike': False, 'bull_rsi_required': False, 'bear_strategy': 'breakout', 'bear_bb_std_mult': 0.8290630326721125, 'bear_rsi_os': 40, 'bear_rsi_ob': 80, 'bear_adx_thresh': 16.199007210762858, 'bear_atr_min_pct': 0.014146134384330612, 'bear_atr_max_pct': 0.08014632704526597, 'bear_tp_mult': 2.9088567308743323, 'bear_tsl_mult': 0.446064020004365, 'bear_time_stop': 49, 'bear_use_sma': True, 'bear_use_ema': False, 'bear_use_atr': True, 'bear_use_adx': False, 'bear_use_spike': False, 'bear_rsi_required': False, 'sideways_strategy': 'mean_reversion', 'sideways_bb_std_mult': 1.7943915273265387, 'sideways_rsi_os': 40, 'sideways_rsi_ob': 92, 'sideways_adx_thresh': 27.147407712235367, 'sideways_atr_min_pct': 0.01531677336836561, 'sideways_atr_max_pct': 0.09490079264307637, 'sideways_tp_mult': 1.6477525963787039, 'sideways_tsl_mult': 0.4013909919037811, 'sideways_time_stop': 242, 'sideways_use_sma': True, 'sideways_use_ema': False, 'sideways_use_atr': False, 'sideways_use_adx': True, 'sideways_use_spike': True, 'sideways_rsi_required': False}.
[I 2025-08-30 21:22:20,206] Trial 278 finished with values: [-1000000000.0, 1000000000.0] and parameters: {'p_sma': 31, 'p_std': 36, 'p_atr': 14, 'p_adx': 30, 'rsi_period': 29, 'ema1': 15, 'ema2': 59, 'slip_atr_k': 0.04375917161141725, 'slip_spread_k': 0.6104128725193472, 'spread_hl_frac': 0.0043344723065999345, 'bb_std_mult': 1.5876704792729783, 'rsi_os': 9, 'rsi_ob': 80, 'vol_spike': 0.29406543343818914, 'adx_thresh': 28.678078293840954, 'atr_min_pct': 0.0198593684887011, 'atr_max_pct': 0.025525759329645688, 'tp_mult': 1.5668922431064423, 'tsl_mult': 0.15767153348717078, 'strategy': 'breakout', 'time_stop': 169, 'use_sma': False, 'use_atr': False, 'use_adx': False, 'use_ema': False, 'use_spike': False, 'rsi_required': False, 'edge_k': 0.7864923523914483, 'edge_cap': 0.27781274362844066, 'bull_strategy': 'mean_reversion', 'bull_bb_std_mult': 3.342372536374448, 'bull_rsi_os': 48, 'bull_rsi_ob': 70, 'bull_adx_thresh': 15.408352755563756, 'bull_atr_min_pct': 0.0009929265769204943, 'bull_atr_max_pct': 0.05870806929668956, 'bull_tp_mult': 2.0994781922104986, 'bull_tsl_mult': 0.507708183868068, 'bull_time_stop': 294, 'bull_use_sma': False, 'bull_use_ema': True, 'bull_use_atr': True, 'bull_use_adx': False, 'bull_use_spike': False, 'bull_rsi_required': False, 'bear_strategy': 'breakout', 'bear_bb_std_mult': 1.5784932575792727, 'bear_rsi_os': 37, 'bear_rsi_ob': 62, 'bear_adx_thresh': 23.99265923658606, 'bear_atr_min_pct': 0.008714682222581878, 'bear_atr_max_pct': 0.06601435463662879, 'bear_tp_mult': 1.5878463926235655, 'bear_tsl_mult': 0.4695512096959042, 'bear_time_stop': 147, 'bear_use_sma': True, 'bear_use_ema': False, 'bear_use_atr': True, 'bear_use_adx': False, 'bear_use_spike': False, 'bear_rsi_required': False, 'sideways_strategy': 'mean_reversion', 'sideways_bb_std_mult': 1.811446492844484, 'sideways_rsi_os': 40, 'sideways_rsi_ob': 88, 'sideways_adx_thresh': 27.339272190619422, 'sideways_atr_min_pct': 0.018893020976505998, 'sideways_atr_max_pct': 0.08956490546237222, 'sideways_tp_mult': 1.8223638027195352, 'sideways_tsl_mult': 0.47294818852370474, 'sideways_time_stop': 258, 'sideways_use_sma': True, 'sideways_use_ema': False, 'sideways_use_atr': False, 'sideways_use_adx': True, 'sideways_use_spike': True, 'sideways_rsi_required': False}.
