[I 2025-08-30 22:28:59,509] Trial 826 finished with values: [-1000000000.0, 1000000000.0] and parameters: {'p_sma': 34, 'p_std': 37, 'p_atr': 20, 'p_adx': 21, 'rsi_period': 74, 'ema1': 11, 'ema2': 34, 'slip_atr_k': 0.2283491514146972, 'slip_spread_k': 0.11408908055786987, 'spread_hl_frac': 0.012409233935497675, 'bb_std_mult': 2.5295827901077574, 'rsi_os': 34, 'rsi_ob': 66, 'vol_spike': 0.03616766721312287, 'adx_thresh': 18.74289272827727, 'atr_min_pct': 0.013307157283295215, 'atr_max_pct': 0.026415135095057284, 'tp_mult': 2.4624710356763226, 'tsl_mult': 0.8551779133789772, 'strategy': 'mean_reversion', 'time_stop': 145, 'use_sma': True, 'use_atr': False, 'use_adx': True, 'use_ema': False, 'use_spike': True, 'rsi_required': True, 'edge_k': 1.0612147869930921, 'edge_cap': 0.7831914613364658, 'bull_strategy': 'breakout', 'bull_bb_std_mult': 2.0055926609455086, 'bull_rsi_os': 17, 'bull_rsi_ob': 91, 'bull_adx_thresh': 22.42698686092078, 'bull_atr_min_pct': 0.0009357744132828595, 'bull_atr_max_pct': 0.08768602760279316, 'bull_tp_mult': 2.7188868688683128, 'bull_tsl_mult': 0.41688894805096977, 'bull_time_stop': 295, 'bull_use_sma': True, 'bull_use_ema': True, 'bull_use_atr': False, 'bull_use_adx': True, 'bull_use_spike': False, 'bull_rsi_required': True, 'bear_strategy': 'mean_reversion', 'bear_bb_std_mult': 2.03936413125464, 'bear_rsi_os': 7, 'bear_rsi_ob': 67, 'bear_adx_thresh': 26.664111152769284, 'bear_atr_min_pct': 0.0293560431378331, 'bear_atr_max_pct': 0.11831611029795162, 'bear_tp_mult': 1.1730513119196497, 'bear_tsl_mult': 0.45905597798570236, 'bear_time_stop': 160, 'bear_use_sma': False, 'bear_use_ema': True, 'bear_use_atr': True, 'bear_use_adx': True, 'bear_use_spike': True, 'bear_rsi_required': False, 'sideways_strategy': 'breakout', 'sideways_bb_std_mult': 2.2852068582792877, 'sideways_rsi_os': 38, 'sideways_rsi_ob': 71, 'sideways_adx_thresh': 24.026223372839848, 'sideways_atr_min_pct': 0.0025589438616494663, 'sideways_atr_max_pct': 0.11387068267905537, 'sideways_tp_mult': 2.6976758895872988, 'sideways_tsl_mult': 0.7512940182520893, 'sideways_time_stop': 80, 'sideways_use_sma': True, 'sideways_use_ema': False, 'sideways_use_atr': True, 'sideways_use_adx': True, 'sideways_use_spike': True, 'sideways_rsi_required': False}.
[I 2025-08-30 22:29:35,930] Trial 831 finished with values: [-1000000000.0, 1000000000.0] and parameters: {'p_sma': 33, 'p_std': 40, 'p_atr': 23, 'p_adx': 17, 'rsi_period': 78, 'ema1': 8, 'ema2': 28, 'slip_atr_k': 0.0015402802762459157, 'slip_spread_k': 0.7301691518451691, 'spread_hl_frac': 0.013917870236810915, 'bb_std_mult': 2.5913691449661216, 'rsi_os': 15, 'rsi_ob': 89, 'vol_spike': 0.03493775556085352, 'adx_thresh': 14.323791843664214, 'atr_min_pct': 0.015226163404164066, 'atr_max_pct': 0.07690882058570801, 'tp_mult': 1.4999229345882208, 'tsl_mult': 0.4453900966209254, 'strategy': 'mean_reversion', 'time_stop': 110, 'use_sma': True, 'use_atr': False, 'use_adx': True, 'use_ema': True, 'use_spike': True, 'rsi_required': True, 'edge_k': 1.2162058659184858, 'edge_cap': 0.1340666527361698, 'bull_strategy': 'breakout', 'bull_bb_std_mult': 2.159618365994331, 'bull_rsi_os': 45, 'bull_rsi_ob': 84, 'bull_adx_thresh': 16.74794925781631, 'bull_atr_min_pct': 0.003837299388158781, 'bull_atr_max_pct': 0.04104697643447213, 'bull_tp_mult': 2.1059967769826446, 'bull_tsl_mult': 0.5759277297259403, 'bull_time_stop': 281, 'bull_use_sma': True, 'bull_use_ema': False, 'bull_use_atr': False, 'bull_use_adx': True, 'bull_use_spike': True, 'bull_rsi_required': False, 'bear_strategy': 'breakout', 'bear_bb_std_mult': 1.6460703776769834, 'bear_rsi_os': 7, 'bear_rsi_ob': 64, 'bear_adx_thresh': 25.76269383841135, 'bear_atr_min_pct': 0.02738668231969601, 'bear_atr_max_pct': 0.1269110598611103, 'bear_tp_mult': 2.4501666751615314, 'bear_tsl_mult': 0.5740826485501296, 'bear_time_stop': 255, 'bear_use_sma': True, 'bear_use_ema': True, 'bear_use_atr': True, 'bear_use_adx': True, 'bear_use_spike': False, 'bear_rsi_required': False, 'sideways_strategy': 'mean_reversion', 'sideways_bb_std_mult': 2.4137465991191163, 'sideways_rsi_os': 35, 'sideways_rsi_ob': 49, 'sideways_adx_thresh': 25.075298775084477, 'sideways_atr_min_pct': 0.019510046163689482, 'sideways_atr_max_pct': 0.09033306543120938, 'sideways_tp_mult': 1.9555349658662722, 'sideways_tsl_mult': 0.9097598526400964, 'sideways_time_stop': 242, 'sideways_use_sma': False, 'sideways_use_ema': True, 'sideways_use_atr': False, 'sideways_use_adx': False, 'sideways_use_spike': True, 'sideways_rsi_required': True}.
[I 2025-08-30 22:29:36,084] Trial 830 finished with values: [-1000000000.0, 1000000000.0] and parameters: {'p_sma': 35, 'p_std': 40, 'p_atr': 19, 'p_adx': 7, 'rsi_period': 80, 'ema1': 8, 'ema2': 25, 'slip_atr_k': 0.0018185928447911849, 'slip_spread_k': 0.7123787310486177, 'spread_hl_frac': 0.012995511196658332, 'bb_std_mult': 2.544860495089128, 'rsi_os': 15, 'rsi_ob': 90, 'vol_spike': 0.04545841675981584, 'adx_thresh': 14.991396428673903, 'atr_min_pct': 0.014193903140989839, 'atr_max_pct': 0.07940598923714524, 'tp_mult': 1.5291395458471906, 'tsl_mult': 0.45273554654420844, 'strategy': 'mean_reversion', 'time_stop': 112, 'use_sma': True, 'use_atr': False, 'use_adx': True, 'use_ema': True, 'use_spike': True, 'rsi_required': True, 'edge_k': 1.2074649714706194, 'edge_cap': 0.12295155513912448, 'bull_strategy': 'breakout', 'bull_bb_std_mult': 2.1500709148911743, 'bull_rsi_os': 49, 'bull_rsi_ob': 84, 'bull_adx_thresh': 16.50226506322478, 'bull_atr_min_pct': 0.0026264335545237985, 'bull_atr_max_pct': 0.04307676625438935, 'bull_tp_mult': 2.097368302818109, 'bull_tsl_mult': 0.5707147139112421, 'bull_time_stop': 276, 'bull_use_sma': True, 'bull_use_ema': False, 'bull_use_atr': False, 'bull_use_adx': True, 'bull_use_spike': True, 'bull_rsi_required': True, 'bear_strategy': 'breakout', 'bear_bb_std_mult': 1.6109118712356674, 'bear_rsi_os': 7, 'bear_rsi_ob': 77, 'bear_adx_thresh': 25.52928403925267, 'bear_atr_min_pct': 0.028360415885171995, 'bear_atr_max_pct': 0.12567226834906328, 'bear_tp_mult': 2.4100359376473, 'bear_tsl_mult': 0.5755521274777214, 'bear_time_stop': 252, 'bear_use_sma': False, 'bear_use_ema': True, 'bear_use_atr': True, 'bear_use_adx': True, 'bear_use_spike': True, 'bear_rsi_required': False, 'sideways_strategy': 'mean_reversion', 'sideways_bb_std_mult': 2.5008883121088874, 'sideways_rsi_os': 35, 'sideways_rsi_ob': 49, 'sideways_adx_thresh': 25.694899227042903, 'sideways_atr_min_pct': 0.019623907165851585, 'sideways_atr_max_pct': 0.09028961849833071, 'sideways_tp_mult': 1.9645027819786574, 'sideways_tsl_mult': 0.8984447464651543, 'sideways_time_stop': 241, 'sideways_use_sma': False, 'sideways_use_ema': True, 'sideways_use_atr': True, 'sideways_use_adx': False, 'sideways_use_spike': True, 'sideways_rsi_required': True}.
[I 2025-08-30 22:29:36,434] Trial 829 finished with values: [-0.018174603170293402, 0.018067710558556528] and parameters: {'p_sma': 35, 'p_std': 36, 'p_atr': 22, 'p_adx': 23, 'rsi_period': 74, 'ema1': 11, 'ema2': 57, 'slip_atr_k': 0.1739918324049752, 'slip_spread_k': 0.19469044422141207, 'spread_hl_frac': 0.03323385584493578, 'bb_std_mult': 2.3175681299712645, 'rsi_os': 13, 'rsi_ob': 65, 'vol_spike': 0.005786520313657922, 'adx_thresh': 18.970958352595645, 'atr_min_pct': 0.01497134512788001, 'atr_max_pct': 0.027297009845235705, 'tp_mult': 1.6617982442390946, 'tsl_mult': 0.5264996021583582, 'strategy': 'mean_reversion', 'time_stop': 169, 'use_sma': True, 'use_atr': False, 'use_adx': True, 'use_ema': True, 'use_spike': True, 'rsi_required': True, 'edge_k': 1.004518354752604, 'edge_cap': 0.12879445784072374, 'bull_strategy': 'breakout', 'bull_bb_std_mult': 1.968747807650237, 'bull_rsi_os': 17, 'bull_rsi_ob': 91, 'bull_adx_thresh': 14.476805658177762, 'bull_atr_min_pct': 0.0011222038596778842, 'bull_atr_max_pct': 0.0680927605199166, 'bull_tp_mult': 2.722531670183547, 'bull_tsl_mult': 0.764970085910868, 'bull_time_stop': 179, 'bull_use_sma': True, 'bull_use_ema': False, 'bull_use_atr': False, 'bull_use_adx': True, 'bull_use_spike': True, 'bull_rsi_required': True, 'bear_strategy': 'breakout', 'bear_bb_std_mult': 0.945838603264507, 'bear_rsi_os': 7, 'bear_rsi_ob': 77, 'bear_adx_thresh': 9.283995300097622, 'bear_atr_min_pct': 0.02856376767963178, 'bear_atr_max_pct': 0.12989802632229364, 'bear_tp_mult': 1.4576906896971413, 'bear_tsl_mult': 0.8084926602205977, 'bear_time_stop': 243, 'bear_use_sma': False, 'bear_use_ema': True, 'bear_use_atr': True, 'bear_use_adx': True, 'bear_use_spike': True, 'bear_rsi_required': False, 'sideways_strategy': 'mean_reversion', 'sideways_bb_std_mult': 2.293066402151901, 'sideways_rsi_os': 41, 'sideways_rsi_ob': 90, 'sideways_adx_thresh': 26.783613862164085, 'sideways_atr_min_pct': 0.020931630540516635, 'sideways_atr_max_pct': 0.021397719814134776, 'sideways_tp_mult': 1.937034912084335, 'sideways_tsl_mult': 0.800063934178277, 'sideways_time_stop': 30, 'sideways_use_sma': False, 'sideways_use_ema': True, 'sideways_use_atr': False, 'sideways_use_adx': False, 'sideways_use_spike': True, 'sideways_rsi_required': True}.
[I 2025-08-30 22:29:36,589] Trial 832 finished with values: [-1000000000.0, 1000000000.0] and parameters: {'p_sma': 33, 'p_std': 40, 'p_atr': 23, 'p_adx': 22, 'rsi_period': 76, 'ema1': 7, 'ema2': 27, 'slip_atr_k': 0.004581867356775186, 'slip_spread_k': 0.7321090022680249, 'spread_hl_frac': 0.01394493998044853, 'bb_std_mult': 2.4643158758692167, 'rsi_os': 15, 'rsi_ob': 89, 'vol_spike': 0.024430401869603564, 'adx_thresh': 14.37087370432493, 'atr_min_pct': 0.015188628500668468, 'atr_max_pct': 0.0782932498361931, 'tp_mult': 1.5056753423596103, 'tsl_mult': 0.504991512291066, 'strategy': 'mean_reversion', 'time_stop': 113, 'use_sma': True, 'use_atr': True, 'use_adx': True, 'use_ema': True, 'use_spike': True, 'rsi_required': True, 'edge_k': 1.163413313380861, 'edge_cap': 0.13294522200927592, 'bull_strategy': 'breakout', 'bull_bb_std_mult': 2.1882681391583194, 'bull_rsi_os': 45, 'bull_rsi_ob': 83, 'bull_adx_thresh': 17.037647777505722, 'bull_atr_min_pct': 0.0037149698899181655, 'bull_atr_max_pct': 0.04016469573377946, 'bull_tp_mult': 2.099415850283693, 'bull_tsl_mult': 0.5752765240638744, 'bull_time_stop': 274, 'bull_use_sma': True, 'bull_use_ema': False, 'bull_use_atr': False, 'bull_use_adx': True, 'bull_use_spike': True, 'bull_rsi_required': False, 'bear_strategy': 'breakout', 'bear_bb_std_mult': 1.5520069815229454, 'bear_rsi_os': 10, 'bear_rsi_ob': 84, 'bear_adx_thresh': 25.748018232362185, 'bear_atr_min_pct': 0.02745708678172868, 'bear_atr_max_pct': 0.12789442066981274, 'bear_tp_mult': 2.4593183907722542, 'bear_tsl_mult': 0.5795375740523698, 'bear_time_stop': 254, 'bear_use_sma': True, 'bear_use_ema': True, 'bear_use_atr': False, 'bear_use_adx': True, 'bear_use_spike': False, 'bear_rsi_required': False, 'sideways_strategy': 'mean_reversion', 'sideways_bb_std_mult': 2.490416791477855, 'sideways_rsi_os': 35, 'sideways_rsi_ob': 49, 'sideways_adx_thresh': 25.322947282462895, 'sideways_atr_min_pct': 0.019098374261359404, 'sideways_atr_max_pct': 0.09136279905678434, 'sideways_tp_mult': 1.9701156298052627, 'sideways_tsl_mult': 0.9101718713844819, 'sideways_time_stop': 240, 'sideways_use_sma': False, 'sideways_use_ema': True, 'sideways_use_atr': False, 'sideways_use_adx': False, 'sideways_use_spike': True, 'sideways_rsi_required': True}.
[I 2025-08-30 22:30:10,877] Trial 836 finished with values: [-1000000000.0, 1000000000.0] and parameters: {'p_sma': 8, 'p_std': 39, 'p_atr': 23, 'p_adx': 24, 'rsi_period': 79, 'ema1': 8, 'ema2': 24, 'slip_atr_k': 0.0054917053619963924, 'slip_spread_k': 0.6871850478170819, 'spread_hl_frac': 0.00932282261328389, 'bb_std_mult': 2.404750283049629, 'rsi_os': 14, 'rsi_ob': 88, 'vol_spike': 0.049264604957118076, 'adx_thresh': 15.557228237435972, 'atr_min_pct': 0.014932158390643947, 'atr_max_pct': 0.07521659844207482, 'tp_mult': 1.5355823048284905, 'tsl_mult': 0.49662975581862817, 'strategy': 'mean_reversion', 'time_stop': 105, 'use_sma': True, 'use_atr': True, 'use_adx': True, 'use_ema': True, 'use_spike': True, 'rsi_required': True, 'edge_k': 1.1285194694938736, 'edge_cap': 0.14929559845369295, 'bull_strategy': 'mean_reversion', 'bull_bb_std_mult': 2.13512728909969, 'bull_rsi_os': 51, 'bull_rsi_ob': 84, 'bull_adx_thresh': 16.589495771135564, 'bull_atr_min_pct': 0.002267931786575722, 'bull_atr_max_pct': 0.04460705866585009, 'bull_tp_mult': 2.1473159024409463, 'bull_tsl_mult': 0.5435942144338466, 'bull_time_stop': 279, 'bull_use_sma': False, 'bull_use_ema': False, 'bull_use_atr': False, 'bull_use_adx': True, 'bull_use_spike': False, 'bull_rsi_required': True, 'bear_strategy': 'mean_reversion', 'bear_bb_std_mult': 1.6675151730642659, 'bear_rsi_os': 28, 'bear_rsi_ob': 74, 'bear_adx_thresh': 26.178976157491153, 'bear_atr_min_pct': 0.027768088337509565, 'bear_atr_max_pct': 0.1257088184176909, 'bear_tp_mult': 2.487041726431003, 'bear_tsl_mult': 0.5888259898763717, 'bear_time_stop': 260, 'bear_use_sma': False, 'bear_use_ema': True, 'bear_use_atr': False, 'bear_use_adx': False, 'bear_use_spike': True, 'bear_rsi_required': False, 'sideways_strategy': 'breakout', 'sideways_bb_std_mult': 2.6597293557157444, 'sideways_rsi_os': 36, 'sideways_rsi_ob': 50, 'sideways_adx_thresh': 26.138034689334827, 'sideways_atr_min_pct': 0.018934422810525958, 'sideways_atr_max_pct': 0.0869679277523806, 'sideways_tp_mult': 2.0080337033123206, 'sideways_tsl_mult': 0.9539870984065564, 'sideways_time_stop': 239, 'sideways_use_sma': False, 'sideways_use_ema': False, 'sideways_use_atr': False, 'sideways_use_adx': True, 'sideways_use_spike': True, 'sideways_rsi_required': False}.
[I 2025-08-30 22:30:11,462] Trial 835 finished with values: [-1000000000.0, 1000000000.0] and parameters: {'p_sma': 8, 'p_std': 40, 'p_atr': 19, 'p_adx': 21, 'rsi_period': 78, 'ema1': 8, 'ema2': 31, 'slip_atr_k': 0.005126200200987958, 'slip_spread_k': 0.7008188690191839, 'spread_hl_frac': 0.01046831734458267, 'bb_std_mult': 2.4309005433365676, 'rsi_os': 16, 'rsi_ob': 87, 'vol_spike': 0.05220485832646894, 'adx_thresh': 14.185630709705945, 'atr_min_pct': 0.015056414800451844, 'atr_max_pct': 0.07292881626201131, 'tp_mult': 1.535528061971597, 'tsl_mult': 0.32291440230167057, 'strategy': 'mean_reversion', 'time_stop': 110, 'use_sma': True, 'use_atr': True, 'use_adx': True, 'use_ema': True, 'use_spike': True, 'rsi_required': True, 'edge_k': 1.1382857431638018, 'edge_cap': 0.1508371570643541, 'bull_strategy': 'mean_reversion', 'bull_bb_std_mult': 2.1221270470090268, 'bull_rsi_os': 51, 'bull_rsi_ob': 84, 'bull_adx_thresh': 16.916047941116602, 'bull_atr_min_pct': 0.0019618792565506272, 'bull_atr_max_pct': 0.04309618435485212, 'bull_tp_mult': 2.066895274102406, 'bull_tsl_mult': 0.5930622238102847, 'bull_time_stop': 276, 'bull_use_sma': False, 'bull_use_ema': False, 'bull_use_atr': False, 'bull_use_adx': True, 'bull_use_spike': False, 'bull_rsi_required': True, 'bear_strategy': 'mean_reversion', 'bear_bb_std_mult': 1.6775215117170028, 'bear_rsi_os': 9, 'bear_rsi_ob': 89, 'bear_adx_thresh': 26.502680576154535, 'bear_atr_min_pct': 0.028086372677200377, 'bear_atr_max_pct': 0.12228789929234272, 'bear_tp_mult': 2.483243718187789, 'bear_tsl_mult': 0.5582528774013433, 'bear_time_stop': 259, 'bear_use_sma': False, 'bear_use_ema': True, 'bear_use_atr': False, 'bear_use_adx': False, 'bear_use_spike': True, 'bear_rsi_required': False, 'sideways_strategy': 'breakout', 'sideways_bb_std_mult': 2.642699569269814, 'sideways_rsi_os': 37, 'sideways_rsi_ob': 48, 'sideways_adx_thresh': 25.961901939444807, 'sideways_atr_min_pct': 0.018946215977383732, 'sideways_atr_max_pct': 0.08643662250553029, 'sideways_tp_mult': 1.9912496258883765, 'sideways_tsl_mult': 0.9495083692699935, 'sideways_time_stop': 239, 'sideways_use_sma': False, 'sideways_use_ema': False, 'sideways_use_atr': False, 'sideways_use_adx': True, 'sideways_use_spike': True, 'sideways_rsi_required': False}.
[I 2025-08-30 22:30:11,609] Trial 834 finished with values: [-1000000000.0, 1000000000.0] and parameters: {'p_sma': 33, 'p_std': 40, 'p_atr': 23, 'p_adx': 22, 'rsi_period': 78, 'ema1': 7, 'ema2': 29, 'slip_atr_k': 0.0042926653459571945, 'slip_spread_k': 0.7143651979323441, 'spread_hl_frac': 0.009493843062658151, 'bb_std_mult': 2.471268179119799, 'rsi_os': 15, 'rsi_ob': 89, 'vol_spike': 0.021730599835273166, 'adx_thresh': 13.854320613623607, 'atr_min_pct': 0.015072306351850312, 'atr_max_pct': 0.07253648280161094, 'tp_mult': 1.4915128759731737, 'tsl_mult': 0.2974346314880492, 'strategy': 'mean_reversion', 'time_stop': 104, 'use_sma': True, 'use_atr': True, 'use_adx': True, 'use_ema': True, 'use_spike': True, 'rsi_required': True, 'edge_k': 1.1906551618369372, 'edge_cap': 0.15092597833226276, 'bull_strategy': 'breakout', 'bull_bb_std_mult': 2.112639715663727, 'bull_rsi_os': 42, 'bull_rsi_ob': 84, 'bull_adx_thresh': 16.802958171175028, 'bull_atr_min_pct': 0.0022468375322596303, 'bull_atr_max_pct': 0.04192898854266573, 'bull_tp_mult': 2.127629748885286, 'bull_tsl_mult': 0.5920074454355952, 'bull_time_stop': 271, 'bull_use_sma': True, 'bull_use_ema': False, 'bull_use_atr': False, 'bull_use_adx': True, 'bull_use_spike': False, 'bull_rsi_required': False, 'bear_strategy': 'mean_reversion', 'bear_bb_std_mult': 1.6914671944752069, 'bear_rsi_os': 23, 'bear_rsi_ob': 73, 'bear_adx_thresh': 26.150907896030848, 'bear_atr_min_pct': 0.02793788304260204, 'bear_atr_max_pct': 0.12521279406720995, 'bear_tp_mult': 2.4744966240548503, 'bear_tsl_mult': 0.5855847031389009, 'bear_time_stop': 256, 'bear_use_sma': True, 'bear_use_ema': True, 'bear_use_atr': False, 'bear_use_adx': True, 'bear_use_spike': True, 'bear_rsi_required': False, 'sideways_strategy': 'breakout', 'sideways_bb_std_mult': 2.620948351049574, 'sideways_rsi_os': 36, 'sideways_rsi_ob': 48, 'sideways_adx_thresh': 25.594387134376056, 'sideways_atr_min_pct': 0.01892576238923805, 'sideways_atr_max_pct': 0.0864835973500141, 'sideways_tp_mult': 1.998664273931743, 'sideways_tsl_mult': 0.9221599033145693, 'sideways_time_stop': 238, 'sideways_use_sma': False, 'sideways_use_ema': False, 'sideways_use_atr': False, 'sideways_use_adx': True, 'sideways_use_spike': True, 'sideways_rsi_required': False}.
[I 2025-08-30 22:30:11,888] Trial 833 finished with values: [-1000000000.0, 1000000000.0] and parameters: {'p_sma': 22, 'p_std': 40, 'p_atr': 19, 'p_adx': 21, 'rsi_period': 77, 'ema1': 8, 'ema2': 26, 'slip_atr_k': 0.003554261538621922, 'slip_spread_k': 0.7224674020996904, 'spread_hl_frac': 0.009560228081582276, 'bb_std_mult': 2.485312684418764, 'rsi_os': 15, 'rsi_ob': 89, 'vol_spike': 0.044886238788155106, 'adx_thresh': 15.728830633988665, 'atr_min_pct': 0.015145192769244451, 'atr_max_pct': 0.07906159178466751, 'tp_mult': 1.5199636944711592, 'tsl_mult': 0.29792502778043073, 'strategy': 'mean_reversion', 'time_stop': 116, 'use_sma': True, 'use_atr': True, 'use_adx': True, 'use_ema': True, 'use_spike': True, 'rsi_required': True, 'edge_k': 1.14280784668534, 'edge_cap': 0.12721598593753486, 'bull_strategy': 'breakout', 'bull_bb_std_mult': 2.1655903616561725, 'bull_rsi_os': 46, 'bull_rsi_ob': 84, 'bull_adx_thresh': 16.864296155611054, 'bull_atr_min_pct': 0.0021648538013871203, 'bull_atr_max_pct': 0.041815735789599434, 'bull_tp_mult': 2.1161448949895503, 'bull_tsl_mult': 0.5886733167676336, 'bull_time_stop': 275, 'bull_use_sma': True, 'bull_use_ema': False, 'bull_use_atr': False, 'bull_use_adx': True, 'bull_use_spike': True, 'bull_rsi_required': True, 'bear_strategy': 'mean_reversion', 'bear_bb_std_mult': 1.65003723677044, 'bear_rsi_os': 10, 'bear_rsi_ob': 76, 'bear_adx_thresh': 25.20275572250757, 'bear_atr_min_pct': 0.027811846281567208, 'bear_atr_max_pct': 0.12621176655209312, 'bear_tp_mult': 2.3910439913774897, 'bear_tsl_mult': 0.5932240593572962, 'bear_time_stop': 261, 'bear_use_sma': False, 'bear_use_ema': True, 'bear_use_atr': False, 'bear_use_adx': True, 'bear_use_spike': True, 'bear_rsi_required': False, 'sideways_strategy': 'mean_reversion', 'sideways_bb_std_mult': 2.6901452197020004, 'sideways_rsi_os': 36, 'sideways_rsi_ob': 48, 'sideways_adx_thresh': 25.556769644133436, 'sideways_atr_min_pct': 0.01887658969357292, 'sideways_atr_max_pct': 0.09012232284897269, 'sideways_tp_mult': 1.9702485176072906, 'sideways_tsl_mult': 0.926801841863727, 'sideways_time_stop': 237, 'sideways_use_sma': False, 'sideways_use_ema': True, 'sideways_use_atr': False, 'sideways_use_adx': False, 'sideways_use_spike': True, 'sideways_rsi_required': True}.
