[I 2025-08-30 21:38:03,044] Trial 396 finished with values: [-1000000000.0, 1000000000.0] and parameters: {'p_sma': 56, 'p_std': 13, 'p_atr': 25, 'p_adx': 19, 'rsi_period': 65, 'ema1': 20, 'ema2': 55, 'slip_atr_k': 0.2263577149797214, 'slip_spread_k': 0.4650470391616338, 'spread_hl_frac': 0.029821337542049606, 'bb_std_mult': 1.5013854441923324, 'rsi_os': 12, 'rsi_ob': 67, 'vol_spike': 0.2793446958423173, 'adx_thresh': 14.387140923739704, 'atr_min_pct': 0.011452753168746941, 'atr_max_pct': 0.09989136274461419, 'tp_mult': 1.6536412116288004, 'tsl_mult': 0.26790915086618583, 'strategy': 'breakout', 'time_stop': 169, 'use_sma': True, 'use_atr': False, 'use_adx': True, 'use_ema': False, 'use_spike': True, 'rsi_required': True, 'edge_k': 1.2434520813083798, 'edge_cap': 0.6401729531003411, 'bull_strategy': 'breakout', 'bull_bb_std_mult': 2.2933871652722075, 'bull_rsi_os': 16, 'bull_rsi_ob': 90, 'bull_adx_thresh': 14.57090395817508, 'bull_atr_min_pct': 0.02438396657075633, 'bull_atr_max_pct': 0.14989995674669687, 'bull_tp_mult': 1.5394420937764635, 'bull_tsl_mult': 0.7356528174879192, 'bull_time_stop': 183, 'bull_use_sma': True, 'bull_use_ema': False, 'bull_use_atr': True, 'bull_use_adx': True, 'bull_use_spike': False, 'bull_rsi_required': True, 'bear_strategy': 'mean_reversion', 'bear_bb_std_mult': 0.7209457992547637, 'bear_rsi_os': 38, 'bear_rsi_ob': 71, 'bear_adx_thresh': 15.159512600538644, 'bear_atr_min_pct': 0.02791337463348344, 'bear_atr_max_pct': 0.09117957519101394, 'bear_tp_mult': 1.6086727923160529, 'bear_tsl_mult': 0.37727991883960654, 'bear_time_stop': 98, 'bear_use_sma': False, 'bear_use_ema': True, 'bear_use_atr': False, 'bear_use_adx': True, 'bear_use_spike': True, 'bear_rsi_required': True, 'sideways_strategy': 'breakout', 'sideways_bb_std_mult': 1.2899933788685387, 'sideways_rsi_os': 42, 'sideways_rsi_ob': 83, 'sideways_adx_thresh': 30.090158828772644, 'sideways_atr_min_pct': 0.02072795171376024, 'sideways_atr_max_pct': 0.14955474387616718, 'sideways_tp_mult': 1.6784855367426856, 'sideways_tsl_mult': 0.6809390634351494, 'sideways_time_stop': 257, 'sideways_use_sma': False, 'sideways_use_ema': False, 'sideways_use_atr': False, 'sideways_use_adx': True, 'sideways_use_spike': False, 'sideways_rsi_required': False}.
[I 2025-08-30 21:38:03,175] Trial 397 finished with values: [-1000000000.0, 1000000000.0] and parameters: {'p_sma': 56, 'p_std': 34, 'p_atr': 21, 'p_adx': 20, 'rsi_period': 70, 'ema1': 15, 'ema2': 51, 'slip_atr_k': 0.02463296162706631, 'slip_spread_k': 0.4878926453216566, 'spread_hl_frac': 0.03562940131825862, 'bb_std_mult': 2.8999565657290893, 'rsi_os': 51, 'rsi_ob': 74, 'vol_spike': 0.032027127528088645, 'adx_thresh': 14.41832399706298, 'atr_min_pct': 0.011602301623731609, 'atr_max_pct': 0.016642692554867042, 'tp_mult': 1.6358936848449304, 'tsl_mult': 0.533267990970587, 'strategy': 'breakout', 'time_stop': 37, 'use_sma': True, 'use_atr': False, 'use_adx': True, 'use_ema': False, 'use_spike': True, 'rsi_required': True, 'edge_k': 1.132129718456697, 'edge_cap': 0.8942807630871449, 'bull_strategy': 'breakout', 'bull_bb_std_mult': 2.3997381844933305, 'bull_rsi_os': 16, 'bull_rsi_ob': 92, 'bull_adx_thresh': 15.875224894176343, 'bull_atr_min_pct': 0.02661067955037661, 'bull_atr_max_pct': 0.050226774933480656, 'bull_tp_mult': 2.2626292521665947, 'bull_tsl_mult': 0.39129208578362873, 'bull_time_stop': 294, 'bull_use_sma': True, 'bull_use_ema': False, 'bull_use_atr': True, 'bull_use_adx': True, 'bull_use_spike': False, 'bull_rsi_required': True, 'bear_strategy': 'mean_reversion', 'bear_bb_std_mult': 1.515117500776241, 'bear_rsi_os': 38, 'bear_rsi_ob': 71, 'bear_adx_thresh': 15.12022061895758, 'bear_atr_min_pct': 0.029245181492965483, 'bear_atr_max_pct': 0.10358737376384065, 'bear_tp_mult': 1.5722949876725378, 'bear_tsl_mult': 0.9238697162368893, 'bear_time_stop': 205, 'bear_use_sma': False, 'bear_use_ema': True, 'bear_use_atr': False, 'bear_use_adx': True, 'bear_use_spike': True, 'bear_rsi_required': True, 'sideways_strategy': 'breakout', 'sideways_bb_std_mult': 1.0364053060682241, 'sideways_rsi_os': 16, 'sideways_rsi_ob': 88, 'sideways_adx_thresh': 12.765236872717445, 'sideways_atr_min_pct': 0.019222198728461024, 'sideways_atr_max_pct': 0.14972720389886587, 'sideways_tp_mult': 1.6824616456292871, 'sideways_tsl_mult': 0.7440477641740526, 'sideways_time_stop': 259, 'sideways_use_sma': False, 'sideways_use_ema': False, 'sideways_use_atr': False, 'sideways_use_adx': True, 'sideways_use_spike': False, 'sideways_rsi_required': False}.
[I 2025-08-30 21:38:36,771] Trial 399 finished with values: [-1000000000.0, 1000000000.0] and parameters: {'p_sma': 27, 'p_std': 40, 'p_atr': 21, 'p_adx': 21, 'rsi_period': 72, 'ema1': 20, 'ema2': 56, 'slip_atr_k': 0.10115467127857312, 'slip_spread_k': 0.29997160098883935, 'spread_hl_frac': 0.0356134447643973, 'bb_std_mult': 0.5766368257041883, 'rsi_os': 11, 'rsi_ob': 66, 'vol_spike': 0.04598106512437951, 'adx_thresh': 17.33990613464211, 'atr_min_pct': 0.014413281825196526, 'atr_max_pct': 0.1168330720574233, 'tp_mult': 1.2776005075179193, 'tsl_mult': 0.8854014092914274, 'strategy': 'mean_reversion', 'time_stop': 171, 'use_sma': True, 'use_atr': False, 'use_adx': True, 'use_ema': False, 'use_spike': True, 'rsi_required': True, 'edge_k': 1.3335799916693305, 'edge_cap': 0.3956052282465602, 'bull_strategy': 'breakout', 'bull_bb_std_mult': 2.948879516444139, 'bull_rsi_os': 17, 'bull_rsi_ob': 80, 'bull_adx_thresh': 33.43537460673859, 'bull_atr_min_pct': 0.004785912396011359, 'bull_atr_max_pct': 0.13977041742250534, 'bull_tp_mult': 1.9005791976937585, 'bull_tsl_mult': 0.3372359487103956, 'bull_time_stop': 294, 'bull_use_sma': False, 'bull_use_ema': False, 'bull_use_atr': False, 'bull_use_adx': True, 'bull_use_spike': False, 'bull_rsi_required': True, 'bear_strategy': 'mean_reversion', 'bear_bb_std_mult': 0.7090958396359939, 'bear_rsi_os': 35, 'bear_rsi_ob': 71, 'bear_adx_thresh': 14.261757892978926, 'bear_atr_min_pct': 0.029379204467981198, 'bear_atr_max_pct': 0.09072616562973962, 'bear_tp_mult': 1.7400424170029016, 'bear_tsl_mult': 0.39284698778385885, 'bear_time_stop': 100, 'bear_use_sma': False, 'bear_use_ema': True, 'bear_use_atr': False, 'bear_use_adx': True, 'bear_use_spike': True, 'bear_rsi_required': True, 'sideways_strategy': 'breakout', 'sideways_bb_std_mult': 1.6590037046640966, 'sideways_rsi_os': 40, 'sideways_rsi_ob': 84, 'sideways_adx_thresh': 7.9835909837267245, 'sideways_atr_min_pct': 0.019135458308410135, 'sideways_atr_max_pct': 0.14618128653520843, 'sideways_tp_mult': 1.2435862767899242, 'sideways_tsl_mult': 0.8899766963486635, 'sideways_time_stop': 184, 'sideways_use_sma': False, 'sideways_use_ema': False, 'sideways_use_atr': False, 'sideways_use_adx': True, 'sideways_use_spike': False, 'sideways_rsi_required': False}.
[I 2025-08-30 21:38:37,275] Trial 401 finished with values: [-1000000000.0, 1000000000.0] and parameters: {'p_sma': 27, 'p_std': 43, 'p_atr': 20, 'p_adx': 21, 'rsi_period': 73, 'ema1': 20, 'ema2': 48, 'slip_atr_k': 0.11175797180459375, 'slip_spread_k': 0.3650196893480158, 'spread_hl_frac': 0.03461784012965212, 'bb_std_mult': 2.3891531802835706, 'rsi_os': 11, 'rsi_ob': 64, 'vol_spike': 0.27020477633861484, 'adx_thresh': 20.722285598791697, 'atr_min_pct': 0.01503042605290346, 'atr_max_pct': 0.11773021926585374, 'tp_mult': 1.2695292219777428, 'tsl_mult': 0.05363481645999979, 'strategy': 'mean_reversion', 'time_stop': 188, 'use_sma': True, 'use_atr': True, 'use_adx': False, 'use_ema': True, 'use_spike': False, 'rsi_required': True, 'edge_k': 1.3260422203962774, 'edge_cap': 0.7491450873831068, 'bull_strategy': 'breakout', 'bull_bb_std_mult': 2.923755721241858, 'bull_rsi_os': 17, 'bull_rsi_ob': 83, 'bull_adx_thresh': 33.653929850550895, 'bull_atr_min_pct': 0.029430384004463177, 'bull_atr_max_pct': 0.04302531664015724, 'bull_tp_mult': 2.2050283606790306, 'bull_tsl_mult': 0.33263149620606997, 'bull_time_stop': 290, 'bull_use_sma': False, 'bull_use_ema': False, 'bull_use_atr': False, 'bull_use_adx': True, 'bull_use_spike': False, 'bull_rsi_required': False, 'bear_strategy': 'mean_reversion', 'bear_bb_std_mult': 2.872023560312474, 'bear_rsi_os': 37, 'bear_rsi_ob': 76, 'bear_adx_thresh': 14.067697109256027, 'bear_atr_min_pct': 0.02843523750065089, 'bear_atr_max_pct': 0.06420648537748641, 'bear_tp_mult': 1.7432721298653402, 'bear_tsl_mult': 0.4077966221237136, 'bear_time_stop': 53, 'bear_use_sma': False, 'bear_use_ema': True, 'bear_use_atr': False, 'bear_use_adx': True, 'bear_use_spike': True, 'bear_rsi_required': False, 'sideways_strategy': 'breakout', 'sideways_bb_std_mult': 1.6638621396732416, 'sideways_rsi_os': 40, 'sideways_rsi_ob': 60, 'sideways_adx_thresh': 10.055189023574092, 'sideways_atr_min_pct': 0.029961401984509597, 'sideways_atr_max_pct': 0.14569907496659612, 'sideways_tp_mult': 1.1256805100210787, 'sideways_tsl_mult': 0.899761755622047, 'sideways_time_stop': 272, 'sideways_use_sma': False, 'sideways_use_ema': False, 'sideways_use_atr': False, 'sideways_use_adx': True, 'sideways_use_spike': False, 'sideways_rsi_required': False}.
[I 2025-08-30 21:38:37,297] Trial 398 finished with values: [-1000000000.0, 1000000000.0] and parameters: {'p_sma': 27, 'p_std': 18, 'p_atr': 21, 'p_adx': 24, 'rsi_period': 65, 'ema1': 20, 'ema2': 48, 'slip_atr_k': 0.0029383926354993456, 'slip_spread_k': 0.16625105851122962, 'spread_hl_frac': 0.03493069455779302, 'bb_std_mult': 1.0661795503565012, 'rsi_os': 11, 'rsi_ob': 67, 'vol_spike': 0.254885599345744, 'adx_thresh': 20.989682176649193, 'atr_min_pct': 0.011275147337589242, 'atr_max_pct': 0.10050603387742071, 'tp_mult': 2.560341947337318, 'tsl_mult': 0.5115399779248205, 'strategy': 'breakout', 'time_stop': 168, 'use_sma': True, 'use_atr': False, 'use_adx': True, 'use_ema': True, 'use_spike': True, 'rsi_required': True, 'edge_k': 1.1224321149770513, 'edge_cap': 0.4076346304689261, 'bull_strategy': 'breakout', 'bull_bb_std_mult': 2.957745498061293, 'bull_rsi_os': 17, 'bull_rsi_ob': 79, 'bull_adx_thresh': 15.780183629940485, 'bull_atr_min_pct': 0.0043947755834843946, 'bull_atr_max_pct': 0.049909688812141285, 'bull_tp_mult': 2.109053674929399, 'bull_tsl_mult': 0.9290079918407912, 'bull_time_stop': 295, 'bull_use_sma': True, 'bull_use_ema': False, 'bull_use_atr': True, 'bull_use_adx': True, 'bull_use_spike': False, 'bull_rsi_required': True, 'bear_strategy': 'mean_reversion', 'bear_bb_std_mult': 2.808019188700174, 'bear_rsi_os': 38, 'bear_rsi_ob': 76, 'bear_adx_thresh': 14.46266984099759, 'bear_atr_min_pct': 0.02917572259259285, 'bear_atr_max_pct': 0.05335276103743063, 'bear_tp_mult': 1.719368301803113, 'bear_tsl_mult': 0.35651990382565035, 'bear_time_stop': 98, 'bear_use_sma': False, 'bear_use_ema': True, 'bear_use_atr': False, 'bear_use_adx': True, 'bear_use_spike': True, 'bear_rsi_required': True, 'sideways_strategy': 'breakout', 'sideways_bb_std_mult': 1.7489048103657912, 'sideways_rsi_os': 40, 'sideways_rsi_ob': 86, 'sideways_adx_thresh': 11.74589480742942, 'sideways_atr_min_pct': 0.019391225981265185, 'sideways_atr_max_pct': 0.14577546760177323, 'sideways_tp_mult': 1.6823356434339787, 'sideways_tsl_mult': 0.7444116754895869, 'sideways_time_stop': 259, 'sideways_use_sma': False, 'sideways_use_ema': False, 'sideways_use_atr': False, 'sideways_use_adx': True, 'sideways_use_spike': False, 'sideways_rsi_required': False}.
[I 2025-08-30 21:38:37,457] Trial 400 finished with values: [-1000000000.0, 1000000000.0] and parameters: {'p_sma': 27, 'p_std': 25, 'p_atr': 20, 'p_adx': 21, 'rsi_period': 73, 'ema1': 15, 'ema2': 48, 'slip_atr_k': 0.001367338947345892, 'slip_spread_k': 0.3038819737004711, 'spread_hl_frac': 0.03238377994947193, 'bb_std_mult': 2.5814457770380987, 'rsi_os': 9, 'rsi_ob': 64, 'vol_spike': 0.25098257457875384, 'adx_thresh': 17.14923364529196, 'atr_min_pct': 0.01528215453785782, 'atr_max_pct': 0.09610211365898143, 'tp_mult': 1.743040608549764, 'tsl_mult': 0.6690831836584059, 'strategy': 'mean_reversion', 'time_stop': 191, 'use_sma': True, 'use_atr': True, 'use_adx': True, 'use_ema': True, 'use_spike': True, 'rsi_required': True, 'edge_k': 1.330360949625596, 'edge_cap': 0.8812083894721464, 'bull_strategy': 'breakout', 'bull_bb_std_mult': 2.9329183249114914, 'bull_rsi_os': 17, 'bull_rsi_ob': 80, 'bull_adx_thresh': 15.784444973195567, 'bull_atr_min_pct': 0.02702938003961313, 'bull_atr_max_pct': 0.10423776870157417, 'bull_tp_mult': 2.2562570334471355, 'bull_tsl_mult': 0.39269230578810765, 'bull_time_stop': 277, 'bull_use_sma': False, 'bull_use_ema': False, 'bull_use_atr': False, 'bull_use_adx': True, 'bull_use_spike': False, 'bull_rsi_required': True, 'bear_strategy': 'mean_reversion', 'bear_bb_std_mult': 2.94482328937589, 'bear_rsi_os': 37, 'bear_rsi_ob': 78, 'bear_adx_thresh': 23.475116444124588, 'bear_atr_min_pct': 0.02929915607657283, 'bear_atr_max_pct': 0.010207702052300455, 'bear_tp_mult': 1.4557511346277594, 'bear_tsl_mult': 0.024511405539954234, 'bear_time_stop': 211, 'bear_use_sma': False, 'bear_use_ema': True, 'bear_use_atr': False, 'bear_use_adx': True, 'bear_use_spike': True, 'bear_rsi_required': True, 'sideways_strategy': 'breakout', 'sideways_bb_std_mult': 1.041490528981422, 'sideways_rsi_os': 40, 'sideways_rsi_ob': 87, 'sideways_adx_thresh': 12.007645201818509, 'sideways_atr_min_pct': 0.01940311888622701, 'sideways_atr_max_pct': 0.14580830623308588, 'sideways_tp_mult': 1.9840613027135416, 'sideways_tsl_mult': 0.7350864362189775, 'sideways_time_stop': 259, 'sideways_use_sma': False, 'sideways_use_ema': False, 'sideways_use_atr': False, 'sideways_use_adx': True, 'sideways_use_spike': False, 'sideways_rsi_required': False}.
[I 2025-08-30 21:38:38,229] Trial 405 finished with values: [-1000000000.0, 1000000000.0] and parameters: {'p_sma': 29, 'p_std': 51, 'p_atr': 22, 'p_adx': 25, 'rsi_period': 69, 'ema1': 23, 'ema2': 38, 'slip_atr_k': 0.08116751145333209, 'slip_spread_k': 0.986721603967992, 'spread_hl_frac': 0.027822306849650834, 'bb_std_mult': 1.458243321301755, 'rsi_os': 55, 'rsi_ob': 63, 'vol_spike': 0.28707350371317486, 'adx_thresh': 19.340644667908503, 'atr_min_pct': 0.010595027357017719, 'atr_max_pct': 0.14957611976769455, 'tp_mult': 2.8126025477459784, 'tsl_mult': 0.14275298060181907, 'strategy': 'mean_reversion', 'time_stop': 157, 'use_sma': True, 'use_atr': True, 'use_adx': False, 'use_ema': True, 'use_spike': False, 'rsi_required': False, 'edge_k': 1.5287125537159618, 'edge_cap': 0.4487026600715808, 'bull_strategy': 'breakout', 'bull_bb_std_mult': 2.078869099639176, 'bull_rsi_os': 15, 'bull_rsi_ob': 86, 'bull_adx_thresh': 8.980822364538804, 'bull_atr_min_pct': 0.0016950196805293805, 'bull_atr_max_pct': 0.04766194937030161, 'bull_tp_mult': 2.309266511529477, 'bull_tsl_mult': 0.356370125868672, 'bull_time_stop': 53, 'bull_use_sma': True, 'bull_use_ema': True, 'bull_use_atr': False, 'bull_use_adx': True, 'bull_use_spike': False, 'bull_rsi_required': False, 'bear_strategy': 'breakout', 'bear_bb_std_mult': 2.5986161467598605, 'bear_rsi_os': 36, 'bear_rsi_ob': 77, 'bear_adx_thresh': 13.13623916650483, 'bear_atr_min_pct': 0.02839893755031804, 'bear_atr_max_pct': 0.07754949932628129, 'bear_tp_mult': 1.6402301405363429, 'bear_tsl_mult': 0.33740545931724086, 'bear_time_stop': 90, 'bear_use_sma': False, 'bear_use_ema': True, 'bear_use_atr': True, 'bear_use_adx': False, 'bear_use_spike': False, 'bear_rsi_required': False, 'sideways_strategy': 'mean_reversion', 'sideways_bb_std_mult': 0.8387530665006167, 'sideways_rsi_os': 39, 'sideways_rsi_ob': 81, 'sideways_adx_thresh': 27.713031367678315, 'sideways_atr_min_pct': 0.022031416905539034, 'sideways_atr_max_pct': 0.142380811492283, 'sideways_tp_mult': 1.952005535913486, 'sideways_tsl_mult': 0.8287918907721008, 'sideways_time_stop': 290, 'sideways_use_sma': True, 'sideways_use_ema': False, 'sideways_use_atr': False, 'sideways_use_adx': True, 'sideways_use_spike': True, 'sideways_rsi_required': False}.
[I 2025-08-30 21:38:38,232] Trial 404 finished with values: [-1000000000.0, 1000000000.0] and parameters: {'p_sma': 29, 'p_std': 33, 'p_atr': 22, 'p_adx': 25, 'rsi_period': 68, 'ema1': 10, 'ema2': 53, 'slip_atr_k': 0.029638317564323023, 'slip_spread_k': 0.6960798560487108, 'spread_hl_frac': 0.03212102241427654, 'bb_std_mult': 0.8929876547124056, 'rsi_os': 55, 'rsi_ob': 61, 'vol_spike': 0.025078703682856557, 'adx_thresh': 17.193698700672858, 'atr_min_pct': 0.007321072664358146, 'atr_max_pct': 0.09517576780953699, 'tp_mult': 2.1264849765199014, 'tsl_mult': 0.8884645980446921, 'strategy': 'mean_reversion', 'time_stop': 289, 'use_sma': True, 'use_atr': True, 'use_adx': True, 'use_ema': True, 'use_spike': True, 'rsi_required': False, 'edge_k': 1.3934707790282728, 'edge_cap': 0.4835147547775207, 'bull_strategy': 'breakout', 'bull_bb_std_mult': 2.5639702720076687, 'bull_rsi_os': 48, 'bull_rsi_ob': 86, 'bull_adx_thresh': 8.541652104553796, 'bull_atr_min_pct': 0.02538418336574194, 'bull_atr_max_pct': 0.1038493341277886, 'bull_tp_mult': 1.7129066725280375, 'bull_tsl_mult': 0.35779168437585784, 'bull_time_stop': 278, 'bull_use_sma': True, 'bull_use_ema': True, 'bull_use_atr': False, 'bull_use_adx': True, 'bull_use_spike': False, 'bull_rsi_required': True, 'bear_strategy': 'breakout', 'bear_bb_std_mult': 2.4483312963983046, 'bear_rsi_os': 36, 'bear_rsi_ob': 79, 'bear_adx_thresh': 7.159621879752736, 'bear_atr_min_pct': 0.02846615930529114, 'bear_atr_max_pct': 0.07747028418455627, 'bear_tp_mult': 1.4516225257546052, 'bear_tsl_mult': 0.33380255048280616, 'bear_time_stop': 90, 'bear_use_sma': False, 'bear_use_ema': True, 'bear_use_atr': True, 'bear_use_adx': False, 'bear_use_spike': False, 'bear_rsi_required': True, 'sideways_strategy': 'mean_reversion', 'sideways_bb_std_mult': 1.8762482967893388, 'sideways_rsi_os': 54, 'sideways_rsi_ob': 81, 'sideways_adx_thresh': 27.63735479243676, 'sideways_atr_min_pct': 0.018036067947967714, 'sideways_atr_max_pct': 0.14430797953001354, 'sideways_tp_mult': 1.3605556281321731, 'sideways_tsl_mult': 0.8311603042792303, 'sideways_time_stop': 63, 'sideways_use_sma': True, 'sideways_use_ema': False, 'sideways_use_atr': False, 'sideways_use_adx': True, 'sideways_use_spike': True, 'sideways_rsi_required': False}.
[I 2025-08-30 21:39:08,679] Trial 402 finished with values: [-1000000000.0, 1000000000.0] and parameters: {'p_sma': 29, 'p_std': 20, 'p_atr': 20, 'p_adx': 24, 'rsi_period': 75, 'ema1': 25, 'ema2': 48, 'slip_atr_k': 0.11748181109669649, 'slip_spread_k': 0.3860281247974827, 'spread_hl_frac': 0.03459494833588561, 'bb_std_mult': 1.0736196334171324, 'rsi_os': 9, 'rsi_ob': 63, 'vol_spike': 0.2880976303438058, 'adx_thresh': 19.602104330774555, 'atr_min_pct': 0.010783612652767456, 'atr_max_pct': 0.14939616229781547, 'tp_mult': 1.7465450164823715, 'tsl_mult': 0.5114820192024989, 'strategy': 'mean_reversion', 'time_stop': 126, 'use_sma': True, 'use_atr': True, 'use_adx': False, 'use_ema': True, 'use_spike': False, 'rsi_required': False, 'edge_k': 1.4573457062105462, 'edge_cap': 0.4536619427047708, 'bull_strategy': 'breakout', 'bull_bb_std_mult': 2.1096821135572066, 'bull_rsi_os': 28, 'bull_rsi_ob': 86, 'bull_adx_thresh': 25.416381602251676, 'bull_atr_min_pct': 0.0015081614853616311, 'bull_atr_max_pct': 0.04265083607063897, 'bull_tp_mult': 2.9881733959530523, 'bull_tsl_mult': 0.35849571509619105, 'bull_time_stop': 277, 'bull_use_sma': True, 'bull_use_ema': True, 'bull_use_atr': False, 'bull_use_adx': True, 'bull_use_spike': False, 'bull_rsi_required': False, 'bear_strategy': 'mean_reversion', 'bear_bb_std_mult': 2.455690027841044, 'bear_rsi_os': 37, 'bear_rsi_ob': 82, 'bear_adx_thresh': 23.53889276143057, 'bear_atr_min_pct': 0.028449642389580285, 'bear_atr_max_pct': 0.06490775950601457, 'bear_tp_mult': 1.4502397165244392, 'bear_tsl_mult': 0.03140394130236185, 'bear_time_stop': 15, 'bear_use_sma': False, 'bear_use_ema': True, 'bear_use_atr': True, 'bear_use_adx': False, 'bear_use_spike': False, 'bear_rsi_required': False, 'sideways_strategy': 'breakout', 'sideways_bb_std_mult': 2.195817023652329, 'sideways_rsi_os': 39, 'sideways_rsi_ob': 61, 'sideways_adx_thresh': 10.285247766729789, 'sideways_atr_min_pct': 0.02192767206788307, 'sideways_atr_max_pct': 0.14478304929194796, 'sideways_tp_mult': 1.98357510296493, 'sideways_tsl_mult': 0.822623773719576, 'sideways_time_stop': 63, 'sideways_use_sma': True, 'sideways_use_ema': False, 'sideways_use_atr': False, 'sideways_use_adx': True, 'sideways_use_spike': True, 'sideways_rsi_required': False}.
