[I 2025-08-30 21:01:19,603] Trial 105 finished with values: [-0.015909163766967493, 0.015845558790798363] and parameters: {'p_sma': 28, 'p_std': 35, 'p_atr': 15, 'p_adx': 29, 'rsi_period': 18, 'ema1': 20, 'ema2': 43, 'slip_atr_k': 0.03497342608851569, 'slip_spread_k': 0.7798879602176378, 'spread_hl_frac': 0.005576997901516734, 'bb_std_mult': 1.6235850425629512, 'rsi_os': 45, 'rsi_ob': 78, 'vol_spike': 0.2805528404256599, 'adx_thresh': 23.146467153935863, 'atr_min_pct': 0.0002294783940600658, 'atr_max_pct': 0.09467867051625563, 'tp_mult': 1.6000264591925972, 'tsl_mult': 0.8370270999946791, 'strategy': 'mean_reversion', 'time_stop': 215, 'use_sma': False, 'use_atr': True, 'use_adx': True, 'use_ema': True, 'use_spike': True, 'rsi_required': True, 'edge_k': 0.6501652178320356, 'edge_cap': 0.6238510871584055, 'bull_strategy': 'breakout', 'bull_bb_std_mult': 3.537670687259207, 'bull_rsi_os': 17, 'bull_rsi_ob': 70, 'bull_adx_thresh': 13.879698373526374, 'bull_atr_min_pct': 0.0006285682001986037, 'bull_atr_max_pct': 0.05232829931813394, 'bull_tp_mult': 2.5737143203910913, 'bull_tsl_mult': 0.04100664201845, 'bull_time_stop': 299, 'bull_use_sma': True, 'bull_use_ema': False, 'bull_use_atr': False, 'bull_use_adx': True, 'bull_use_spike': True, 'bull_rsi_required': True, 'bear_strategy': 'mean_reversion', 'bear_bb_std_mult': 2.6933263875936384, 'bear_rsi_os': 49, 'bear_rsi_ob': 51, 'bear_adx_thresh': 16.726183864620783, 'bear_atr_min_pct': 0.01729431463841946, 'bear_atr_max_pct': 0.019139976005145824, 'bear_tp_mult': 2.994802961360202, 'bear_tsl_mult': 0.3294745088856633, 'bear_time_stop': 103, 'bear_use_sma': True, 'bear_use_ema': False, 'bear_use_atr': False, 'bear_use_adx': True, 'bear_use_spike': True, 'bear_rsi_required': True, 'sideways_strategy': 'breakout', 'sideways_bb_std_mult': 2.6983467688099307, 'sideways_rsi_os': 39, 'sideways_rsi_ob': 66, 'sideways_adx_thresh': 32.45424576062359, 'sideways_atr_min_pct': 0.00901358136320364, 'sideways_atr_max_pct': 0.010650567764973765, 'sideways_tp_mult': 2.6480517423253147, 'sideways_tsl_mult': 0.3103502115764154, 'sideways_time_stop': 136, 'sideways_use_sma': False, 'sideways_use_ema': True, 'sideways_use_atr': True, 'sideways_use_adx': False, 'sideways_use_spike': False, 'sideways_rsi_required': True}.
[I 2025-08-30 21:01:19,760] Trial 109 finished with values: [-0.02093727013591984, 0.02082418597083117] and parameters: {'p_sma': 53, 'p_std': 35, 'p_atr': 18, 'p_adx': 27, 'rsi_period': 12, 'ema1': 21, 'ema2': 44, 'slip_atr_k': 0.2287514726672531, 'slip_spread_k': 0.6901707605655213, 'spread_hl_frac': 0.008307493131518576, 'bb_std_mult': 1.617842094818113, 'rsi_os': 32, 'rsi_ob': 80, 'vol_spike': 0.019879948468104394, 'adx_thresh': 20.305453474250005, 'atr_min_pct': 0.002508966088851077, 'atr_max_pct': 0.07740286027655417, 'tp_mult': 1.6166082491269134, 'tsl_mult': 0.6244248013389785, 'strategy': 'mean_reversion', 'time_stop': 226, 'use_sma': False, 'use_atr': True, 'use_adx': True, 'use_ema': False, 'use_spike': True, 'rsi_required': True, 'edge_k': 1.350574762977244, 'edge_cap': 0.2733145368759734, 'bull_strategy': 'breakout', 'bull_bb_std_mult': 3.2225626203060225, 'bull_rsi_os': 10, 'bull_rsi_ob': 76, 'bull_adx_thresh': 10.917107433871392, 'bull_atr_min_pct': 0.000577477410257148, 'bull_atr_max_pct': 0.10602174378494023, 'bull_tp_mult': 2.688929299155717, 'bull_tsl_mult': 0.7097226776043237, 'bull_time_stop': 182, 'bull_use_sma': True, 'bull_use_ema': False, 'bull_use_atr': False, 'bull_use_adx': True, 'bull_use_spike': False, 'bull_rsi_required': True, 'bear_strategy': 'mean_reversion', 'bear_bb_std_mult': 2.812942603114542, 'bear_rsi_os': 48, 'bear_rsi_ob': 92, 'bear_adx_thresh': 14.004804532883659, 'bear_atr_min_pct': 0.0135142124199308, 'bear_atr_max_pct': 0.10411237137437603, 'bear_tp_mult': 1.4331753114205024, 'bear_tsl_mult': 0.579333281610396, 'bear_time_stop': 234, 'bear_use_sma': False, 'bear_use_ema': False, 'bear_use_atr': False, 'bear_use_adx': False, 'bear_use_spike': True, 'bear_rsi_required': True, 'sideways_strategy': 'breakout', 'sideways_bb_std_mult': 1.1884075903432052, 'sideways_rsi_os': 38, 'sideways_rsi_ob': 56, 'sideways_adx_thresh': 32.38287796680356, 'sideways_atr_min_pct': 0.007207012334489071, 'sideways_atr_max_pct': 0.14057158432503425, 'sideways_tp_mult': 2.460740212222754, 'sideways_tsl_mult': 0.40220848022204464, 'sideways_time_stop': 282, 'sideways_use_sma': False, 'sideways_use_ema': False, 'sideways_use_atr': True, 'sideways_use_adx': False, 'sideways_use_spike': False, 'sideways_rsi_required': False}.
[I 2025-08-30 21:01:53,546] Trial 111 finished with values: [-1000000000.0, 1000000000.0] and parameters: {'p_sma': 45, 'p_std': 35, 'p_atr': 13, 'p_adx': 25, 'rsi_period': 19, 'ema1': 6, 'ema2': 45, 'slip_atr_k': 0.03723628915271089, 'slip_spread_k': 0.9992860404732042, 'spread_hl_frac': 0.028133038829709425, 'bb_std_mult': 1.5876001568473335, 'rsi_os': 30, 'rsi_ob': 80, 'vol_spike': 0.2027750836945941, 'adx_thresh': 17.809308147738424, 'atr_min_pct': 0.0165238161313834, 'atr_max_pct': 0.14402371522680812, 'tp_mult': 2.32878151193144, 'tsl_mult': 0.9431307906000526, 'strategy': 'mean_reversion', 'time_stop': 229, 'use_sma': False, 'use_atr': True, 'use_adx': True, 'use_ema': False, 'use_spike': True, 'rsi_required': True, 'edge_k': 0.5389577785308032, 'edge_cap': 0.40093996621507677, 'bull_strategy': 'mean_reversion', 'bull_bb_std_mult': 3.368376334401843, 'bull_rsi_os': 11, 'bull_rsi_ob': 70, 'bull_adx_thresh': 10.62875704559854, 'bull_atr_min_pct': 0.027802758184003615, 'bull_atr_max_pct': 0.12478845879567928, 'bull_tp_mult': 2.698342353285651, 'bull_tsl_mult': 0.5826199240630184, 'bull_time_stop': 165, 'bull_use_sma': True, 'bull_use_ema': False, 'bull_use_atr': False, 'bull_use_adx': False, 'bull_use_spike': False, 'bull_rsi_required': True, 'bear_strategy': 'mean_reversion', 'bear_bb_std_mult': 1.5501001232397165, 'bear_rsi_os': 46, 'bear_rsi_ob': 51, 'bear_adx_thresh': 14.049499558269412, 'bear_atr_min_pct': 0.02096304677277767, 'bear_atr_max_pct': 0.14477214583990897, 'bear_tp_mult': 1.4650096931046632, 'bear_tsl_mult': 0.7417895994932022, 'bear_time_stop': 192, 'bear_use_sma': False, 'bear_use_ema': True, 'bear_use_atr': True, 'bear_use_adx': False, 'bear_use_spike': True, 'bear_rsi_required': True, 'sideways_strategy': 'breakout', 'sideways_bb_std_mult': 1.1260430056604651, 'sideways_rsi_os': 39, 'sideways_rsi_ob': 56, 'sideways_adx_thresh': 32.50770680445789, 'sideways_atr_min_pct': 0.007355753576049366, 'sideways_atr_max_pct': 0.1335261687184745, 'sideways_tp_mult': 2.458674631239228, 'sideways_tsl_mult': 0.4526385372113158, 'sideways_time_stop': 132, 'sideways_use_sma': False, 'sideways_use_ema': False, 'sideways_use_atr': True, 'sideways_use_adx': False, 'sideways_use_spike': False, 'sideways_rsi_required': False}.
[I 2025-08-30 21:01:53,845] Trial 110 finished with values: [-0.030912610554016284, 0.03085579425484354] and parameters: {'p_sma': 53, 'p_std': 15, 'p_atr': 18, 'p_adx': 25, 'rsi_period': 19, 'ema1': 6, 'ema2': 29, 'slip_atr_k': 0.014191713500006867, 'slip_spread_k': 0.19461995247073044, 'spread_hl_frac': 0.04135905396360476, 'bb_std_mult': 3.1303466837103824, 'rsi_os': 45, 'rsi_ob': 74, 'vol_spike': 0.20080712208215581, 'adx_thresh': 17.98717929151682, 'atr_min_pct': 0.012267920840313116, 'atr_max_pct': 0.07620525472979083, 'tp_mult': 1.5175920501383149, 'tsl_mult': 0.6820003733291344, 'strategy': 'mean_reversion', 'time_stop': 154, 'use_sma': False, 'use_atr': True, 'use_adx': True, 'use_ema': False, 'use_spike': True, 'rsi_required': True, 'edge_k': 0.7355406265790532, 'edge_cap': 0.623165761661685, 'bull_strategy': 'mean_reversion', 'bull_bb_std_mult': 3.3618953223691435, 'bull_rsi_os': 22, 'bull_rsi_ob': 70, 'bull_adx_thresh': 22.659933048637306, 'bull_atr_min_pct': 0.0005663637736754851, 'bull_atr_max_pct': 0.03583325441515365, 'bull_tp_mult': 1.01263214658574, 'bull_tsl_mult': 0.577144654708998, 'bull_time_stop': 295, 'bull_use_sma': True, 'bull_use_ema': False, 'bull_use_atr': False, 'bull_use_adx': False, 'bull_use_spike': False, 'bull_rsi_required': True, 'bear_strategy': 'mean_reversion', 'bear_bb_std_mult': 1.5947502449290256, 'bear_rsi_os': 23, 'bear_rsi_ob': 71, 'bear_adx_thresh': 14.291453603842879, 'bear_atr_min_pct': 0.013697888894101872, 'bear_atr_max_pct': 0.1397112069361297, 'bear_tp_mult': 1.38091003005756, 'bear_tsl_mult': 0.7432060236234808, 'bear_time_stop': 208, 'bear_use_sma': False, 'bear_use_ema': False, 'bear_use_atr': True, 'bear_use_adx': False, 'bear_use_spike': True, 'bear_rsi_required': True, 'sideways_strategy': 'breakout', 'sideways_bb_std_mult': 1.167143288934767, 'sideways_rsi_os': 39, 'sideways_rsi_ob': 56, 'sideways_adx_thresh': 31.365652359743336, 'sideways_atr_min_pct': 0.008520877526659752, 'sideways_atr_max_pct': 0.024751312468520553, 'sideways_tp_mult': 2.5356292501361115, 'sideways_tsl_mult': 0.40014297104248736, 'sideways_time_stop': 73, 'sideways_use_sma': False, 'sideways_use_ema': False, 'sideways_use_atr': True, 'sideways_use_adx': False, 'sideways_use_spike': False, 'sideways_rsi_required': False}.
[I 2025-08-30 21:01:54,566] Trial 113 finished with values: [-1000000000.0, 1000000000.0] and parameters: {'p_sma': 29, 'p_std': 7, 'p_atr': 18, 'p_adx': 30, 'rsi_period': 32, 'ema1': 23, 'ema2': 42, 'slip_atr_k': 0.04539484262091609, 'slip_spread_k': 0.8218722897821654, 'spread_hl_frac': 0.007549027207925348, 'bb_std_mult': 1.575374701232013, 'rsi_os': 45, 'rsi_ob': 77, 'vol_spike': 0.28100805855577965, 'adx_thresh': 25.209623327465394, 'atr_min_pct': 0.00018550032634486257, 'atr_max_pct': 0.07676729822652432, 'tp_mult': 1.525124454704445, 'tsl_mult': 0.5719879686064541, 'strategy': 'mean_reversion', 'time_stop': 227, 'use_sma': False, 'use_atr': True, 'use_adx': True, 'use_ema': True, 'use_spike': True, 'rsi_required': True, 'edge_k': 0.7188573585125726, 'edge_cap': 0.6631062434197342, 'bull_strategy': 'mean_reversion', 'bull_bb_std_mult': 3.37591540036333, 'bull_rsi_os': 21, 'bull_rsi_ob': 70, 'bull_adx_thresh': 17.12589746554832, 'bull_atr_min_pct': 0.02877775444263725, 'bull_atr_max_pct': 0.14985738272481236, 'bull_tp_mult': 1.3670895761023478, 'bull_tsl_mult': 0.04604641103372958, 'bull_time_stop': 290, 'bull_use_sma': True, 'bull_use_ema': False, 'bull_use_atr': False, 'bull_use_adx': False, 'bull_use_spike': True, 'bull_rsi_required': False, 'bear_strategy': 'mean_reversion', 'bear_bb_std_mult': 2.503953062183868, 'bear_rsi_os': 46, 'bear_rsi_ob': 74, 'bear_adx_thresh': 18.25851464788245, 'bear_atr_min_pct': 0.015282260364312343, 'bear_atr_max_pct': 0.027089545804605278, 'bear_tp_mult': 2.791837967634736, 'bear_tsl_mult': 0.2912991465861178, 'bear_time_stop': 145, 'bear_use_sma': False, 'bear_use_ema': False, 'bear_use_atr': True, 'bear_use_adx': True, 'bear_use_spike': True, 'bear_rsi_required': True, 'sideways_strategy': 'breakout', 'sideways_bb_std_mult': 2.370642688306481, 'sideways_rsi_os': 34, 'sideways_rsi_ob': 65, 'sideways_adx_thresh': 34.15481167504445, 'sideways_atr_min_pct': 0.009467295739782668, 'sideways_atr_max_pct': 0.010609718868042498, 'sideways_tp_mult': 2.7564892392254037, 'sideways_tsl_mult': 0.2722522088622104, 'sideways_time_stop': 135, 'sideways_use_sma': False, 'sideways_use_ema': True, 'sideways_use_atr': True, 'sideways_use_adx': True, 'sideways_use_spike': False, 'sideways_rsi_required': True}.
[I 2025-08-30 21:01:54,779] Trial 112 finished with values: [-1000000000.0, 1000000000.0] and parameters: {'p_sma': 29, 'p_std': 7, 'p_atr': 13, 'p_adx': 30, 'rsi_period': 32, 'ema1': 23, 'ema2': 42, 'slip_atr_k': 0.04075502103153892, 'slip_spread_k': 0.1998467708323497, 'spread_hl_frac': 0.007850510500657215, 'bb_std_mult': 1.5743093973310935, 'rsi_os': 49, 'rsi_ob': 77, 'vol_spike': 0.28105651459411496, 'adx_thresh': 25.613968999268963, 'atr_min_pct': 0.000518724761228993, 'atr_max_pct': 0.01863665990731845, 'tp_mult': 1.3995824657479812, 'tsl_mult': 0.5165867507742714, 'strategy': 'mean_reversion', 'time_stop': 155, 'use_sma': False, 'use_atr': True, 'use_adx': True, 'use_ema': True, 'use_spike': True, 'rsi_required': True, 'edge_k': 0.7253399209030919, 'edge_cap': 0.6343008964522884, 'bull_strategy': 'mean_reversion', 'bull_bb_std_mult': 3.5497396753315638, 'bull_rsi_os': 20, 'bull_rsi_ob': 71, 'bull_adx_thresh': 17.63807464633246, 'bull_atr_min_pct': 0.028983159496224344, 'bull_atr_max_pct': 0.14366128297628764, 'bull_tp_mult': 2.4841016756131733, 'bull_tsl_mult': 0.047537831398225455, 'bull_time_stop': 292, 'bull_use_sma': True, 'bull_use_ema': False, 'bull_use_atr': False, 'bull_use_adx': False, 'bull_use_spike': True, 'bull_rsi_required': True, 'bear_strategy': 'mean_reversion', 'bear_bb_std_mult': 2.673132624995827, 'bear_rsi_os': 46, 'bear_rsi_ob': 66, 'bear_adx_thresh': 16.66096783426794, 'bear_atr_min_pct': 0.016938386204634965, 'bear_atr_max_pct': 0.026419110354035318, 'bear_tp_mult': 2.9162128360556965, 'bear_tsl_mult': 0.3446547830041699, 'bear_time_stop': 128, 'bear_use_sma': False, 'bear_use_ema': True, 'bear_use_atr': True, 'bear_use_adx': True, 'bear_use_spike': True, 'bear_rsi_required': True, 'sideways_strategy': 'breakout', 'sideways_bb_std_mult': 2.032078725371672, 'sideways_rsi_os': 35, 'sideways_rsi_ob': 65, 'sideways_adx_thresh': 32.542113254609376, 'sideways_atr_min_pct': 0.009368457217418498, 'sideways_atr_max_pct': 0.011435246091301435, 'sideways_tp_mult': 2.7545614268150844, 'sideways_tsl_mult': 0.3009992224119174, 'sideways_time_stop': 164, 'sideways_use_sma': False, 'sideways_use_ema': True, 'sideways_use_atr': True, 'sideways_use_adx': True, 'sideways_use_spike': False, 'sideways_rsi_required': True}.
[I 2025-08-30 21:02:28,343] Trial 114 finished with values: [-1000000000.0, 1000000000.0] and parameters: {'p_sma': 29, 'p_std': 38, 'p_atr': 16, 'p_adx': 30, 'rsi_period': 35, 'ema1': 21, 'ema2': 41, 'slip_atr_k': 0.045595287838792756, 'slip_spread_k': 0.20715560615963946, 'spread_hl_frac': 0.005352474949926427, 'bb_std_mult': 1.4713267582225822, 'rsi_os': 46, 'rsi_ob': 77, 'vol_spike': 0.28225055595865545, 'adx_thresh': 25.82445693328899, 'atr_min_pct': 4.7828435827370914e-05, 'atr_max_pct': 0.11717846267201283, 'tp_mult': 1.4972790368382194, 'tsl_mult': 0.6911629761274942, 'strategy': 'mean_reversion', 'time_stop': 245, 'use_sma': False, 'use_atr': True, 'use_adx': True, 'use_ema': True, 'use_spike': True, 'rsi_required': True, 'edge_k': 0.7049023771493407, 'edge_cap': 0.6687671994312275, 'bull_strategy': 'breakout', 'bull_bb_std_mult': 3.5646213705582865, 'bull_rsi_os': 21, 'bull_rsi_ob': 68, 'bull_adx_thresh': 17.720499917954406, 'bull_atr_min_pct': 0.02948984856322797, 'bull_atr_max_pct': 0.11368101054695742, 'bull_tp_mult': 2.465556114796714, 'bull_tsl_mult': 0.07242673293985549, 'bull_time_stop': 299, 'bull_use_sma': True, 'bull_use_ema': False, 'bull_use_atr': False, 'bull_use_adx': True, 'bull_use_spike': True, 'bull_rsi_required': True, 'bear_strategy': 'mean_reversion', 'bear_bb_std_mult': 2.653195460229544, 'bear_rsi_os': 48, 'bear_rsi_ob': 68, 'bear_adx_thresh': 18.66460172719186, 'bear_atr_min_pct': 0.015268470631398627, 'bear_atr_max_pct': 0.026314992213805732, 'bear_tp_mult': 2.9126273627211217, 'bear_tsl_mult': 0.3429077644855767, 'bear_time_stop': 149, 'bear_use_sma': False, 'bear_use_ema': False, 'bear_use_atr': False, 'bear_use_adx': True, 'bear_use_spike': True, 'bear_rsi_required': True, 'sideways_strategy': 'breakout', 'sideways_bb_std_mult': 2.3233345408591406, 'sideways_rsi_os': 34, 'sideways_rsi_ob': 65, 'sideways_adx_thresh': 34.45767891116931, 'sideways_atr_min_pct': 0.009637430308337365, 'sideways_atr_max_pct': 0.012019802511521656, 'sideways_tp_mult': 2.7319889477152963, 'sideways_tsl_mult': 0.29350388149765233, 'sideways_time_stop': 130, 'sideways_use_sma': False, 'sideways_use_ema': True, 'sideways_use_atr': True, 'sideways_use_adx': True, 'sideways_use_spike': False, 'sideways_rsi_required': True}.
[I 2025-08-30 21:02:28,812] Trial 115 finished with values: [-1000000000.0, 1000000000.0] and parameters: {'p_sma': 29, 'p_std': 51, 'p_atr': 16, 'p_adx': 30, 'rsi_period': 47, 'ema1': 21, 'ema2': 43, 'slip_atr_k': 0.05877040401169402, 'slip_spread_k': 0.07027305029307829, 'spread_hl_frac': 0.005717719223471233, 'bb_std_mult': 1.4893539851351574, 'rsi_os': 49, 'rsi_ob': 77, 'vol_spike': 0.269820958238583, 'adx_thresh': 25.49684364648824, 'atr_min_pct': 0.00022573401615424299, 'atr_max_pct': 0.12606580872710987, 'tp_mult': 1.6165254098598567, 'tsl_mult': 0.6267543309392547, 'strategy': 'breakout', 'time_stop': 242, 'use_sma': False, 'use_atr': True, 'use_adx': False, 'use_ema': True, 'use_spike': False, 'rsi_required': False, 'edge_k': 0.819249407141488, 'edge_cap': 0.6727984334140312, 'bull_strategy': 'breakout', 'bull_bb_std_mult': 3.3986584790956442, 'bull_rsi_os': 21, 'bull_rsi_ob': 67, 'bull_adx_thresh': 19.177695996034636, 'bull_atr_min_pct': 0.0015570339552925996, 'bull_atr_max_pct': 0.07235145153575001, 'bull_tp_mult': 2.4978733729570695, 'bull_tsl_mult': 0.04337924505547548, 'bull_time_stop': 291, 'bull_use_sma': True, 'bull_use_ema': True, 'bull_use_atr': True, 'bull_use_adx': True, 'bull_use_spike': True, 'bull_rsi_required': False, 'bear_strategy': 'mean_reversion', 'bear_bb_std_mult': 2.510196138023556, 'bear_rsi_os': 48, 'bear_rsi_ob': 67, 'bear_adx_thresh': 16.801826929065214, 'bear_atr_min_pct': 0.01691157686776526, 'bear_atr_max_pct': 0.02483094556828721, 'bear_tp_mult': 2.9166405123015027, 'bear_tsl_mult': 0.36364830361471806, 'bear_time_stop': 126, 'bear_use_sma': True, 'bear_use_ema': False, 'bear_use_atr': False, 'bear_use_adx': True, 'bear_use_spike': False, 'bear_rsi_required': False, 'sideways_strategy': 'breakout', 'sideways_bb_std_mult': 2.3638067895371573, 'sideways_rsi_os': 34, 'sideways_rsi_ob': 65, 'sideways_adx_thresh': 34.33888857087592, 'sideways_atr_min_pct': 0.00962508077386934, 'sideways_atr_max_pct': 0.011556436421615739, 'sideways_tp_mult': 2.764881688316962, 'sideways_tsl_mult': 0.28884163084307607, 'sideways_time_stop': 129, 'sideways_use_sma': False, 'sideways_use_ema': True, 'sideways_use_atr': True, 'sideways_use_adx': True, 'sideways_use_spike': False, 'sideways_rsi_required': True}.
[I 2025-08-30 21:02:29,144] Trial 117 finished with values: [-1000000000.0, 1000000000.0] and parameters: {'p_sma': 25, 'p_std': 13, 'p_atr': 12, 'p_adx': 29, 'rsi_period': 41, 'ema1': 21, 'ema2': 43, 'slip_atr_k': 0.05733823654196124, 'slip_spread_k': 0.052671608709126405, 'spread_hl_frac': 0.00560161111053178, 'bb_std_mult': 1.4765608810130435, 'rsi_os': 40, 'rsi_ob': 72, 'vol_spike': 0.2354430722230167, 'adx_thresh': 23.997273851081463, 'atr_min_pct': 0.0014209247733802963, 'atr_max_pct': 0.0927402689144083, 'tp_mult': 1.6132887018193574, 'tsl_mult': 0.7065773665787369, 'strategy': 'breakout', 'time_stop': 243, 'use_sma': False, 'use_atr': False, 'use_adx': False, 'use_ema': True, 'use_spike': False, 'rsi_required': False, 'edge_k': 0.8253537780817296, 'edge_cap': 0.5539539513821019, 'bull_strategy': 'breakout', 'bull_bb_std_mult': 3.5637105300996876, 'bull_rsi_os': 13, 'bull_rsi_ob': 68, 'bull_adx_thresh': 19.01988143050319, 'bull_atr_min_pct': 0.001433880731239315, 'bull_atr_max_pct': 0.06618604227953184, 'bull_tp_mult': 2.363299940920702, 'bull_tsl_mult': 0.08822026522711338, 'bull_time_stop': 274, 'bull_use_sma': True, 'bull_use_ema': True, 'bull_use_atr': True, 'bull_use_adx': True, 'bull_use_spike': True, 'bull_rsi_required': True, 'bear_strategy': 'mean_reversion', 'bear_bb_std_mult': 2.8170705310382758, 'bear_rsi_os': 48, 'bear_rsi_ob': 68, 'bear_adx_thresh': 16.78156335921041, 'bear_atr_min_pct': 0.028768037763262172, 'bear_atr_max_pct': 0.014076306628554842, 'bear_tp_mult': 2.9468304568866106, 'bear_tsl_mult': 0.39034813720991446, 'bear_time_stop': 112, 'bear_use_sma': True, 'bear_use_ema': False, 'bear_use_atr': False, 'bear_use_adx': True, 'bear_use_spike': False, 'bear_rsi_required': False, 'sideways_strategy': 'breakout', 'sideways_bb_std_mult': 2.194093741978827, 'sideways_rsi_os': 6, 'sideways_rsi_ob': 89, 'sideways_adx_thresh': 32.7990223690018, 'sideways_atr_min_pct': 0.010640184746558493, 'sideways_atr_max_pct': 0.012832324644148102, 'sideways_tp_mult': 2.6113609662780197, 'sideways_tsl_mult': 0.2720519076714608, 'sideways_time_stop': 127, 'sideways_use_sma': True, 'sideways_use_ema': True, 'sideways_use_atr': True, 'sideways_use_adx': False, 'sideways_use_spike': True, 'sideways_rsi_required': True}.
