[I 2025-08-30 21:22:20,372] Trial 279 finished with values: [-1000000000.0, 1000000000.0] and parameters: {'p_sma': 31, 'p_std': 36, 'p_atr': 14, 'p_adx': 30, 'rsi_period': 43, 'ema1': 21, 'ema2': 12, 'slip_atr_k': 0.07757220777909611, 'slip_spread_k': 0.6029967595398654, 'spread_hl_frac': 0.003958229650848451, 'bb_std_mult': 2.1265340427428017, 'rsi_os': 9, 'rsi_ob': 80, 'vol_spike': 0.051095833719160835, 'adx_thresh': 31.164494175503965, 'atr_min_pct': 0.019730177154412425, 'atr_max_pct': 0.07487046625237062, 'tp_mult': 2.481819607241024, 'tsl_mult': 0.1581938049961985, 'strategy': 'breakout', 'time_stop': 135, 'use_sma': False, 'use_atr': False, 'use_adx': False, 'use_ema': False, 'use_spike': False, 'rsi_required': False, 'edge_k': 0.7413919493907126, 'edge_cap': 0.6230456684796495, 'bull_strategy': 'mean_reversion', 'bull_bb_std_mult': 3.1033763753217007, 'bull_rsi_os': 48, 'bull_rsi_ob': 70, 'bull_adx_thresh': 15.419306833708143, 'bull_atr_min_pct': 0.0008446785909546006, 'bull_atr_max_pct': 0.09206727023618595, 'bull_tp_mult': 2.1894178206051325, 'bull_tsl_mult': 0.4481902965950964, 'bull_time_stop': 90, 'bull_use_sma': False, 'bull_use_ema': True, 'bull_use_atr': True, 'bull_use_adx': False, 'bull_use_spike': False, 'bull_rsi_required': False, 'bear_strategy': 'breakout', 'bear_bb_std_mult': 1.8417253954712614, 'bear_rsi_os': 37, 'bear_rsi_ob': 78, 'bear_adx_thresh': 16.54828472678444, 'bear_atr_min_pct': 0.00870078142767297, 'bear_atr_max_pct': 0.07994437915849653, 'bear_tp_mult': 2.8641547029598016, 'bear_tsl_mult': 0.4199570072403533, 'bear_time_stop': 232, 'bear_use_sma': True, 'bear_use_ema': False, 'bear_use_atr': True, 'bear_use_adx': False, 'bear_use_spike': False, 'bear_rsi_required': False, 'sideways_strategy': 'mean_reversion', 'sideways_bb_std_mult': 1.438599950645579, 'sideways_rsi_os': 40, 'sideways_rsi_ob': 90, 'sideways_adx_thresh': 6.852752254671948, 'sideways_atr_min_pct': 0.015196241695069002, 'sideways_atr_max_pct': 0.06837063506528035, 'sideways_tp_mult': 2.2543433790100154, 'sideways_tsl_mult': 0.6045299416501239, 'sideways_time_stop': 239, 'sideways_use_sma': True, 'sideways_use_ema': False, 'sideways_use_atr': False, 'sideways_use_adx': True, 'sideways_use_spike': True, 'sideways_rsi_required': False}.
[I 2025-08-30 21:22:54,078] Trial 280 finished with values: [-1000000000.0, 1000000000.0] and parameters: {'p_sma': 31, 'p_std': 6, 'p_atr': 16, 'p_adx': 17, 'rsi_period': 15, 'ema1': 22, 'ema2': 25, 'slip_atr_k': 0.04054977920211635, 'slip_spread_k': 0.5818143616147795, 'spread_hl_frac': 0.0023661076896037505, 'bb_std_mult': 3.5884037940326152, 'rsi_os': 9, 'rsi_ob': 81, 'vol_spike': 0.2960340901561389, 'adx_thresh': 32.99382187051454, 'atr_min_pct': 0.019863540259543736, 'atr_max_pct': 0.07502265359782698, 'tp_mult': 1.7570082948066805, 'tsl_mult': 0.9757919876180778, 'strategy': 'breakout', 'time_stop': 180, 'use_sma': False, 'use_atr': False, 'use_adx': False, 'use_ema': False, 'use_spike': False, 'rsi_required': False, 'edge_k': 1.9051285198053933, 'edge_cap': 0.5811493785964743, 'bull_strategy': 'mean_reversion', 'bull_bb_std_mult': 2.8352571980958254, 'bull_rsi_os': 16, 'bull_rsi_ob': 92, 'bull_adx_thresh': 14.72126983291346, 'bull_atr_min_pct': 0.0008014973947715556, 'bull_atr_max_pct': 0.055046096915044994, 'bull_tp_mult': 2.111095752431893, 'bull_tsl_mult': 0.509372087202583, 'bull_time_stop': 275, 'bull_use_sma': False, 'bull_use_ema': True, 'bull_use_atr': True, 'bull_use_adx': False, 'bull_use_spike': False, 'bull_rsi_required': False, 'bear_strategy': 'breakout', 'bear_bb_std_mult': 2.507974617692072, 'bear_rsi_os': 37, 'bear_rsi_ob': 62, 'bear_adx_thresh': 23.971002047963182, 'bear_atr_min_pct': 0.015118488685307314, 'bear_atr_max_pct': 0.08152011510498533, 'bear_tp_mult': 1.9193991699745558, 'bear_tsl_mult': 0.4684103287749342, 'bear_time_stop': 219, 'bear_use_sma': True, 'bear_use_ema': False, 'bear_use_atr': True, 'bear_use_adx': True, 'bear_use_spike': False, 'bear_rsi_required': False, 'sideways_strategy': 'mean_reversion', 'sideways_bb_std_mult': 1.741422273144383, 'sideways_rsi_os': 43, 'sideways_rsi_ob': 88, 'sideways_adx_thresh': 11.38150369052835, 'sideways_atr_min_pct': 0.015604667526758025, 'sideways_atr_max_pct': 0.10066698764279383, 'sideways_tp_mult': 1.1946298336976753, 'sideways_tsl_mult': 0.6056661513399697, 'sideways_time_stop': 240, 'sideways_use_sma': True, 'sideways_use_ema': False, 'sideways_use_atr': True, 'sideways_use_adx': False, 'sideways_use_spike': True, 'sideways_rsi_required': False}.
[I 2025-08-30 21:22:54,284] Trial 282 finished with values: [-1000000000.0, 1000000000.0] and parameters: {'p_sma': 27, 'p_std': 34, 'p_atr': 16, 'p_adx': 21, 'rsi_period': 55, 'ema1': 23, 'ema2': 46, 'slip_atr_k': 0.03855885006489947, 'slip_spread_k': 0.5854714952836121, 'spread_hl_frac': 0.002472967521034477, 'bb_std_mult': 2.1174571513884044, 'rsi_os': 11, 'rsi_ob': 82, 'vol_spike': 0.2333373696083586, 'adx_thresh': 31.21973197527205, 'atr_min_pct': 0.020559597155460504, 'atr_max_pct': 0.11490396070761495, 'tp_mult': 1.649973126081516, 'tsl_mult': 0.4235158125726296, 'strategy': 'mean_reversion', 'time_stop': 134, 'use_sma': False, 'use_atr': True, 'use_adx': True, 'use_ema': True, 'use_spike': True, 'rsi_required': True, 'edge_k': 1.9011501078194888, 'edge_cap': 0.9789002001584172, 'bull_strategy': 'breakout', 'bull_bb_std_mult': 3.018199388083551, 'bull_rsi_os': 16, 'bull_rsi_ob': 92, 'bull_adx_thresh': 14.539165658037737, 'bull_atr_min_pct': 0.007283507671818674, 'bull_atr_max_pct': 0.09153116481500638, 'bull_tp_mult': 2.1642594113671745, 'bull_tsl_mult': 0.4481559074538634, 'bull_time_stop': 277, 'bull_use_sma': True, 'bull_use_ema': False, 'bull_use_atr': False, 'bull_use_adx': False, 'bull_use_spike': True, 'bull_rsi_required': True, 'bear_strategy': 'mean_reversion', 'bear_bb_std_mult': 2.488217030100416, 'bear_rsi_os': 38, 'bear_rsi_ob': 75, 'bear_adx_thresh': 12.649062807539838, 'bear_atr_min_pct': 0.004014495863771204, 'bear_atr_max_pct': 0.08441786570634663, 'bear_tp_mult': 2.319031913853844, 'bear_tsl_mult': 0.4142750227455256, 'bear_time_stop': 217, 'bear_use_sma': True, 'bear_use_ema': False, 'bear_use_atr': False, 'bear_use_adx': True, 'bear_use_spike': True, 'bear_rsi_required': True, 'sideways_strategy': 'breakout', 'sideways_bb_std_mult': 1.722034404697334, 'sideways_rsi_os': 43, 'sideways_rsi_ob': 85, 'sideways_adx_thresh': 28.899162839298867, 'sideways_atr_min_pct': 0.01696812372239078, 'sideways_atr_max_pct': 0.09781135111287034, 'sideways_tp_mult': 2.0126441517378764, 'sideways_tsl_mult': 0.4499032250703235, 'sideways_time_stop': 275, 'sideways_use_sma': False, 'sideways_use_ema': True, 'sideways_use_atr': True, 'sideways_use_adx': False, 'sideways_use_spike': False, 'sideways_rsi_required': True}.
[I 2025-08-30 21:22:54,450] Trial 283 finished with values: [-1000000000.0, 1000000000.0] and parameters: {'p_sma': 27, 'p_std': 6, 'p_atr': 15, 'p_adx': 21, 'rsi_period': 15, 'ema1': 22, 'ema2': 45, 'slip_atr_k': 0.04002164408224555, 'slip_spread_k': 0.4784677582151213, 'spread_hl_frac': 0.0024276059732137012, 'bb_std_mult': 1.601380049115855, 'rsi_os': 23, 'rsi_ob': 65, 'vol_spike': 0.28575070098834465, 'adx_thresh': 29.500324439799563, 'atr_min_pct': 0.020472942210884512, 'atr_max_pct': 0.09305881949434346, 'tp_mult': 2.9379502479827444, 'tsl_mult': 0.9368822667626686, 'strategy': 'mean_reversion', 'time_stop': 160, 'use_sma': False, 'use_atr': True, 'use_adx': True, 'use_ema': True, 'use_spike': True, 'rsi_required': True, 'edge_k': 1.576048769590948, 'edge_cap': 0.8527397745751484, 'bull_strategy': 'breakout', 'bull_bb_std_mult': 0.9408937567597693, 'bull_rsi_os': 16, 'bull_rsi_ob': 63, 'bull_adx_thresh': 18.397865049056215, 'bull_atr_min_pct': 0.029833603401832685, 'bull_atr_max_pct': 0.055102211228829384, 'bull_tp_mult': 2.361706228606754, 'bull_tsl_mult': 0.805651177905724, 'bull_time_stop': 277, 'bull_use_sma': True, 'bull_use_ema': False, 'bull_use_atr': False, 'bull_use_adx': True, 'bull_use_spike': True, 'bull_rsi_required': True, 'bear_strategy': 'mean_reversion', 'bear_bb_std_mult': 2.5221349457572884, 'bear_rsi_os': 11, 'bear_rsi_ob': 70, 'bear_adx_thresh': 17.603259585962107, 'bear_atr_min_pct': 0.015456446412108736, 'bear_atr_max_pct': 0.08532370471310942, 'bear_tp_mult': 1.2136868479636536, 'bear_tsl_mult': 0.7463972547977553, 'bear_time_stop': 138, 'bear_use_sma': False, 'bear_use_ema': False, 'bear_use_atr': False, 'bear_use_adx': True, 'bear_use_spike': True, 'bear_rsi_required': True, 'sideways_strategy': 'breakout', 'sideways_bb_std_mult': 1.7223348884004241, 'sideways_rsi_os': 8, 'sideways_rsi_ob': 93, 'sideways_adx_thresh': 29.21735142821314, 'sideways_atr_min_pct': 0.012733959647799588, 'sideways_atr_max_pct': 0.10024465940735586, 'sideways_tp_mult': 1.7112300269605942, 'sideways_tsl_mult': 0.4550776819763272, 'sideways_time_stop': 273, 'sideways_use_sma': False, 'sideways_use_ema': True, 'sideways_use_atr': True, 'sideways_use_adx': False, 'sideways_use_spike': False, 'sideways_rsi_required': True}.
[I 2025-08-30 21:22:54,714] Trial 281 finished with values: [-1000000000.0, 1000000000.0] and parameters: {'p_sma': 31, 'p_std': 7, 'p_atr': 14, 'p_adx': 30, 'rsi_period': 28, 'ema1': 22, 'ema2': 46, 'slip_atr_k': 0.07708524573912104, 'slip_spread_k': 0.6051865066822409, 'spread_hl_frac': 0.004694143010661543, 'bb_std_mult': 2.5879549640824235, 'rsi_os': 11, 'rsi_ob': 81, 'vol_spike': 0.2943895596854298, 'adx_thresh': 33.18423893798014, 'atr_min_pct': 0.02012577207618768, 'atr_max_pct': 0.0923374877307508, 'tp_mult': 1.265777092718054, 'tsl_mult': 0.9743477971584923, 'strategy': 'mean_reversion', 'time_stop': 169, 'use_sma': False, 'use_atr': True, 'use_adx': True, 'use_ema': True, 'use_spike': True, 'rsi_required': False, 'edge_k': 0.7365540715574561, 'edge_cap': 0.5805312443489383, 'bull_strategy': 'breakout', 'bull_bb_std_mult': 3.0160432342930075, 'bull_rsi_os': 16, 'bull_rsi_ob': 51, 'bull_adx_thresh': 14.687394423305236, 'bull_atr_min_pct': 0.0015080131944357274, 'bull_atr_max_pct': 0.0553923312351406, 'bull_tp_mult': 2.169825531889736, 'bull_tsl_mult': 0.44001843823030523, 'bull_time_stop': 294, 'bull_use_sma': False, 'bull_use_ema': True, 'bull_use_atr': False, 'bull_use_adx': False, 'bull_use_spike': True, 'bull_rsi_required': False, 'bear_strategy': 'mean_reversion', 'bear_bb_std_mult': 3.5991503631799864, 'bear_rsi_os': 37, 'bear_rsi_ob': 52, 'bear_adx_thresh': 24.059508613458487, 'bear_atr_min_pct': 0.01510315771155912, 'bear_atr_max_pct': 0.010036320320939906, 'bear_tp_mult': 2.3542188132033512, 'bear_tsl_mult': 0.4739007703437327, 'bear_time_stop': 137, 'bear_use_sma': True, 'bear_use_ema': False, 'bear_use_atr': False, 'bear_use_adx': True, 'bear_use_spike': False, 'bear_rsi_required': True, 'sideways_strategy': 'breakout', 'sideways_bb_std_mult': 1.41998362164904, 'sideways_rsi_os': 8, 'sideways_rsi_ob': 90, 'sideways_adx_thresh': 24.260132034608173, 'sideways_atr_min_pct': 0.01850929687810439, 'sideways_atr_max_pct': 0.08680372415849043, 'sideways_tp_mult': 2.2501620957870676, 'sideways_tsl_mult': 0.4600265166444404, 'sideways_time_stop': 272, 'sideways_use_sma': True, 'sideways_use_ema': True, 'sideways_use_atr': True, 'sideways_use_adx': False, 'sideways_use_spike': True, 'sideways_rsi_required': True}.
[I 2025-08-30 21:23:28,876] Trial 284 finished with values: [-1000000000.0, 1000000000.0] and parameters: {'p_sma': 27, 'p_std': 48, 'p_atr': 15, 'p_adx': 29, 'rsi_period': 18, 'ema1': 22, 'ema2': 46, 'slip_atr_k': 0.1283738656310351, 'slip_spread_k': 0.6293089417172272, 'spread_hl_frac': 0.03617154743494081, 'bb_std_mult': 2.010860269439472, 'rsi_os': 11, 'rsi_ob': 82, 'vol_spike': 0.019085575511352565, 'adx_thresh': 29.72312740965411, 'atr_min_pct': 0.020687976764530915, 'atr_max_pct': 0.09350784612186938, 'tp_mult': 1.6498170253158175, 'tsl_mult': 0.9473100105298966, 'strategy': 'mean_reversion', 'time_stop': 160, 'use_sma': False, 'use_atr': True, 'use_adx': True, 'use_ema': True, 'use_spike': True, 'rsi_required': True, 'edge_k': 0.4043606443489637, 'edge_cap': 0.6354170821710059, 'bull_strategy': 'breakout', 'bull_bb_std_mult': 3.0145914310752673, 'bull_rsi_os': 17, 'bull_rsi_ob': 69, 'bull_adx_thresh': 18.360470612960995, 'bull_atr_min_pct': 0.00984212730382357, 'bull_atr_max_pct': 0.12216357911449838, 'bull_tp_mult': 1.617571742700547, 'bull_tsl_mult': 0.41133600331244025, 'bull_time_stop': 296, 'bull_use_sma': True, 'bull_use_ema': False, 'bull_use_atr': False, 'bull_use_adx': True, 'bull_use_spike': True, 'bull_rsi_required': True, 'bear_strategy': 'mean_reversion', 'bear_bb_std_mult': 2.0093587946433544, 'bear_rsi_os': 13, 'bear_rsi_ob': 74, 'bear_adx_thresh': 24.692746301508883, 'bear_atr_min_pct': 0.028132477695005795, 'bear_atr_max_pct': 0.010058552803866923, 'bear_tp_mult': 2.2336827600137297, 'bear_tsl_mult': 0.41235961934053433, 'bear_time_stop': 242, 'bear_use_sma': False, 'bear_use_ema': False, 'bear_use_atr': False, 'bear_use_adx': True, 'bear_use_spike': True, 'bear_rsi_required': True, 'sideways_strategy': 'breakout', 'sideways_bb_std_mult': 1.7220531094514027, 'sideways_rsi_os': 45, 'sideways_rsi_ob': 85, 'sideways_adx_thresh': 28.43143998180598, 'sideways_atr_min_pct': 0.01268031779016409, 'sideways_atr_max_pct': 0.09802863208531709, 'sideways_tp_mult': 2.0822716234181526, 'sideways_tsl_mult': 0.45353604866823904, 'sideways_time_stop': 268, 'sideways_use_sma': False, 'sideways_use_ema': True, 'sideways_use_atr': True, 'sideways_use_adx': False, 'sideways_use_spike': False, 'sideways_rsi_required': True}.
[I 2025-08-30 21:23:29,322] Trial 287 finished with values: [-0.021351036512815336, 0.021261088465626833] and parameters: {'p_sma': 30, 'p_std': 16, 'p_atr': 24, 'p_adx': 29, 'rsi_period': 20, 'ema1': 26, 'ema2': 51, 'slip_atr_k': 0.12937262883535286, 'slip_spread_k': 0.5223029970890609, 'spread_hl_frac': 0.03574584855306736, 'bb_std_mult': 3.089973557736818, 'rsi_os': 13, 'rsi_ob': 79, 'vol_spike': 0.08469956556993036, 'adx_thresh': 30.6402763215413, 'atr_min_pct': 0.010247828134749008, 'atr_max_pct': 0.08783430497052219, 'tp_mult': 1.5933693099860546, 'tsl_mult': 0.5866156826624185, 'strategy': 'mean_reversion', 'time_stop': 145, 'use_sma': False, 'use_atr': True, 'use_adx': True, 'use_ema': True, 'use_spike': True, 'rsi_required': True, 'edge_k': 0.9765077114112869, 'edge_cap': 0.6303897972958645, 'bull_strategy': 'breakout', 'bull_bb_std_mult': 3.274604604255351, 'bull_rsi_os': 32, 'bull_rsi_ob': 83, 'bull_adx_thresh': 16.479491844421172, 'bull_atr_min_pct': 0.001495602374564408, 'bull_atr_max_pct': 0.014145928325478105, 'bull_tp_mult': 1.6228755023722317, 'bull_tsl_mult': 0.9507370234621806, 'bull_time_stop': 225, 'bull_use_sma': True, 'bull_use_ema': False, 'bull_use_atr': False, 'bull_use_adx': True, 'bull_use_spike': True, 'bull_rsi_required': True, 'bear_strategy': 'mean_reversion', 'bear_bb_std_mult': 2.7679140303285026, 'bear_rsi_os': 40, 'bear_rsi_ob': 60, 'bear_adx_thresh': 31.26324555156052, 'bear_atr_min_pct': 0.02213516584149812, 'bear_atr_max_pct': 0.0947963087769399, 'bear_tp_mult': 2.2334183330603254, 'bear_tsl_mult': 0.3892059834029573, 'bear_time_stop': 165, 'bear_use_sma': False, 'bear_use_ema': False, 'bear_use_atr': False, 'bear_use_adx': True, 'bear_use_spike': True, 'bear_rsi_required': True, 'sideways_strategy': 'breakout', 'sideways_bb_std_mult': 1.5572137789825407, 'sideways_rsi_os': 26, 'sideways_rsi_ob': 91, 'sideways_adx_thresh': 27.81960295152429, 'sideways_atr_min_pct': 0.013500306363817357, 'sideways_atr_max_pct': 0.032724479937439786, 'sideways_tp_mult': 2.0792152062594655, 'sideways_tsl_mult': 0.7171839356896748, 'sideways_time_stop': 265, 'sideways_use_sma': False, 'sideways_use_ema': True, 'sideways_use_atr': True, 'sideways_use_adx': False, 'sideways_use_spike': False, 'sideways_rsi_required': True}.
[I 2025-08-30 21:23:29,534] Trial 286 finished with values: [-1000000000.0, 1000000000.0] and parameters: {'p_sma': 30, 'p_std': 33, 'p_atr': 15, 'p_adx': 30, 'rsi_period': 21, 'ema1': 26, 'ema2': 51, 'slip_atr_k': 0.02832195440476801, 'slip_spread_k': 0.5243917799747962, 'spread_hl_frac': 0.03934249479317071, 'bb_std_mult': 1.5272283897281995, 'rsi_os': 12, 'rsi_ob': 79, 'vol_spike': 0.16621246636873416, 'adx_thresh': 5.236324301087604, 'atr_min_pct': 0.02095635693859477, 'atr_max_pct': 0.08765026772497343, 'tp_mult': 1.5892934322425682, 'tsl_mult': 0.5420166898615222, 'strategy': 'mean_reversion', 'time_stop': 144, 'use_sma': False, 'use_atr': True, 'use_adx': True, 'use_ema': True, 'use_spike': True, 'rsi_required': True, 'edge_k': 0.9293934734617275, 'edge_cap': 0.634027266283195, 'bull_strategy': 'breakout', 'bull_bb_std_mult': 3.2492805213995126, 'bull_rsi_os': 37, 'bull_rsi_ob': 85, 'bull_adx_thresh': 16.330427764379888, 'bull_atr_min_pct': 0.0015340662182639318, 'bull_atr_max_pct': 0.1233032321965751, 'bull_tp_mult': 2.2717425342848503, 'bull_tsl_mult': 0.4200864053750872, 'bull_time_stop': 295, 'bull_use_sma': True, 'bull_use_ema': False, 'bull_use_atr': False, 'bull_use_adx': True, 'bull_use_spike': True, 'bull_rsi_required': True, 'bear_strategy': 'mean_reversion', 'bear_bb_std_mult': 2.81038899152344, 'bear_rsi_os': 41, 'bear_rsi_ob': 52, 'bear_adx_thresh': 30.789643739131627, 'bear_atr_min_pct': 0.029235753174763866, 'bear_atr_max_pct': 0.01843710152468237, 'bear_tp_mult': 2.8407746156792117, 'bear_tsl_mult': 0.8214269490705701, 'bear_time_stop': 107, 'bear_use_sma': True, 'bear_use_ema': False, 'bear_use_atr': False, 'bear_use_adx': True, 'bear_use_spike': True, 'bear_rsi_required': True, 'sideways_strategy': 'breakout', 'sideways_bb_std_mult': 1.430633490156296, 'sideways_rsi_os': 45, 'sideways_rsi_ob': 91, 'sideways_adx_thresh': 21.117590235177804, 'sideways_atr_min_pct': 0.013531994259181338, 'sideways_atr_max_pct': 0.08593405787714872, 'sideways_tp_mult': 1.5198306239479291, 'sideways_tsl_mult': 0.4371056035921903, 'sideways_time_stop': 266, 'sideways_use_sma': False, 'sideways_use_ema': True, 'sideways_use_atr': True, 'sideways_use_adx': False, 'sideways_use_spike': False, 'sideways_rsi_required': True}.
[I 2025-08-30 21:23:29,644] Trial 285 finished with values: [-1000000000.0, 1000000000.0] and parameters: {'p_sma': 30, 'p_std': 16, 'p_atr': 15, 'p_adx': 29, 'rsi_period': 37, 'ema1': 22, 'ema2': 45, 'slip_atr_k': 0.027702687579019107, 'slip_spread_k': 0.5170965112861303, 'spread_hl_frac': 0.03556988886757527, 'bb_std_mult': 0.737839294505054, 'rsi_os': 23, 'rsi_ob': 64, 'vol_spike': 0.16199637849684206, 'adx_thresh': 5.66007519170547, 'atr_min_pct': 0.02075973384881947, 'atr_max_pct': 0.06514867915654894, 'tp_mult': 1.0792987285070972, 'tsl_mult': 0.32689514400651964, 'strategy': 'mean_reversion', 'time_stop': 102, 'use_sma': False, 'use_atr': True, 'use_adx': True, 'use_ema': True, 'use_spike': True, 'rsi_required': True, 'edge_k': 0.9243543858780632, 'edge_cap': 0.6282409459419829, 'bull_strategy': 'breakout', 'bull_bb_std_mult': 3.2455962769547266, 'bull_rsi_os': 14, 'bull_rsi_ob': 51, 'bull_adx_thresh': 16.40466836537259, 'bull_atr_min_pct': 0.009686002379198581, 'bull_atr_max_pct': 0.05419751307639171, 'bull_tp_mult': 1.929738784363297, 'bull_tsl_mult': 0.4199854135797349, 'bull_time_stop': 296, 'bull_use_sma': True, 'bull_use_ema': False, 'bull_use_atr': False, 'bull_use_adx': True, 'bull_use_spike': True, 'bull_rsi_required': True, 'bear_strategy': 'mean_reversion', 'bear_bb_std_mult': 2.771080681236304, 'bear_rsi_os': 41, 'bear_rsi_ob': 69, 'bear_adx_thresh': 17.67018849246703, 'bear_atr_min_pct': 0.0299936287495714, 'bear_atr_max_pct': 0.07068606280652431, 'bear_tp_mult': 2.8394819206034794, 'bear_tsl_mult': 0.4383062607261538, 'bear_time_stop': 139, 'bear_use_sma': False, 'bear_use_ema': False, 'bear_use_atr': False, 'bear_use_adx': True, 'bear_use_spike': True, 'bear_rsi_required': True, 'sideways_strategy': 'breakout', 'sideways_bb_std_mult': 1.3032496703168497, 'sideways_rsi_os': 20, 'sideways_rsi_ob': 90, 'sideways_adx_thresh': 23.956787242297736, 'sideways_atr_min_pct': 0.01341973978157966, 'sideways_atr_max_pct': 0.08741988029007344, 'sideways_tp_mult': 1.5305582275079817, 'sideways_tsl_mult': 0.46872243449193496, 'sideways_time_stop': 264, 'sideways_use_sma': False, 'sideways_use_ema': True, 'sideways_use_atr': True, 'sideways_use_adx': False, 'sideways_use_spike': False, 'sideways_rsi_required': True}.
