[I 2025-08-30 21:47:50,257] Trial 477 finished with values: [-1000000000.0, 1000000000.0] and parameters: {'p_sma': 34, 'p_std': 48, 'p_atr': 21, 'p_adx': 22, 'rsi_period': 49, 'ema1': 13, 'ema2': 53, 'slip_atr_k': 0.2136630571676439, 'slip_spread_k': 0.6340974809225054, 'spread_hl_frac': 0.03523777765853097, 'bb_std_mult': 0.8420190874036731, 'rsi_os': 36, 'rsi_ob': 65, 'vol_spike': 0.07882927144511924, 'adx_thresh': 10.594049088914291, 'atr_min_pct': 0.01500964809558006, 'atr_max_pct': 0.030795292715828405, 'tp_mult': 1.6533390306693052, 'tsl_mult': 0.9068279597614067, 'strategy': 'mean_reversion', 'time_stop': 69, 'use_sma': True, 'use_atr': True, 'use_adx': True, 'use_ema': True, 'use_spike': True, 'rsi_required': True, 'edge_k': 1.6413416494382083, 'edge_cap': 0.7696360165407721, 'bull_strategy': 'breakout', 'bull_bb_std_mult': 2.0831195408182093, 'bull_rsi_os': 45, 'bull_rsi_ob': 84, 'bull_adx_thresh': 17.148176866050676, 'bull_atr_min_pct': 0.017451571760102202, 'bull_atr_max_pct': 0.017987969035801576, 'bull_tp_mult': 1.5301906266274183, 'bull_tsl_mult': 0.5836398905052078, 'bull_time_stop': 230, 'bull_use_sma': False, 'bull_use_ema': False, 'bull_use_atr': False, 'bull_use_adx': False, 'bull_use_spike': False, 'bull_rsi_required': False, 'bear_strategy': 'mean_reversion', 'bear_bb_std_mult': 2.0221860586192046, 'bear_rsi_os': 7, 'bear_rsi_ob': 73, 'bear_adx_thresh': 29.376342194429643, 'bear_atr_min_pct': 0.029472290812669895, 'bear_atr_max_pct': 0.11280527351183667, 'bear_tp_mult': 1.2723933344031333, 'bear_tsl_mult': 0.2421615034832022, 'bear_time_stop': 225, 'bear_use_sma': False, 'bear_use_ema': True, 'bear_use_atr': False, 'bear_use_adx': True, 'bear_use_spike': True, 'bear_rsi_required': True, 'sideways_strategy': 'breakout', 'sideways_bb_std_mult': 1.6355240580326666, 'sideways_rsi_os': 30, 'sideways_rsi_ob': 47, 'sideways_adx_thresh': 26.67753586534027, 'sideways_atr_min_pct': 0.0222972967212436, 'sideways_atr_max_pct': 0.028393978962552607, 'sideways_tp_mult': 1.5924922632846812, 'sideways_tsl_mult': 0.15271552088418372, 'sideways_time_stop': 262, 'sideways_use_sma': False, 'sideways_use_ema': False, 'sideways_use_atr': False, 'sideways_use_adx': True, 'sideways_use_spike': False, 'sideways_rsi_required': False}.
[I 2025-08-30 21:47:52,508] Trial 478 finished with values: [-1000000000.0, 1000000000.0] and parameters: {'p_sma': 34, 'p_std': 22, 'p_atr': 21, 'p_adx': 22, 'rsi_period': 75, 'ema1': 13, 'ema2': 31, 'slip_atr_k': 0.1937119872811443, 'slip_spread_k': 0.6190491007824169, 'spread_hl_frac': 0.031402296592607605, 'bb_std_mult': 0.6512099240519184, 'rsi_os': 21, 'rsi_ob': 65, 'vol_spike': 0.27192203670412624, 'adx_thresh': 9.350973498780155, 'atr_min_pct': 0.013760284269949323, 'atr_max_pct': 0.029916721664935392, 'tp_mult': 1.6609767531506667, 'tsl_mult': 0.8975365414035995, 'strategy': 'mean_reversion', 'time_stop': 274, 'use_sma': True, 'use_atr': True, 'use_adx': True, 'use_ema': True, 'use_spike': True, 'rsi_required': True, 'edge_k': 0.8162344813408938, 'edge_cap': 0.7402741580187582, 'bull_strategy': 'breakout', 'bull_bb_std_mult': 2.0056762733653284, 'bull_rsi_os': 18, 'bull_rsi_ob': 49, 'bull_adx_thresh': 16.872321734563993, 'bull_atr_min_pct': 0.012263490993004538, 'bull_atr_max_pct': 0.017134378118709603, 'bull_tp_mult': 1.5433531114731884, 'bull_tsl_mult': 0.5821050020622444, 'bull_time_stop': 292, 'bull_use_sma': True, 'bull_use_ema': False, 'bull_use_atr': False, 'bull_use_adx': False, 'bull_use_spike': False, 'bull_rsi_required': True, 'bear_strategy': 'mean_reversion', 'bear_bb_std_mult': 2.038739612025403, 'bear_rsi_os': 7, 'bear_rsi_ob': 87, 'bear_adx_thresh': 29.545925538152115, 'bear_atr_min_pct': 0.004302483963756178, 'bear_atr_max_pct': 0.11171193591703987, 'bear_tp_mult': 1.4936983363952636, 'bear_tsl_mult': 0.4107792609685336, 'bear_time_stop': 224, 'bear_use_sma': False, 'bear_use_ema': True, 'bear_use_atr': False, 'bear_use_adx': True, 'bear_use_spike': True, 'bear_rsi_required': True, 'sideways_strategy': 'mean_reversion', 'sideways_bb_std_mult': 1.7543730614882276, 'sideways_rsi_os': 16, 'sideways_rsi_ob': 90, 'sideways_adx_thresh': 27.01964587410083, 'sideways_atr_min_pct': 0.005543168483928612, 'sideways_atr_max_pct': 0.030386647257112216, 'sideways_tp_mult': 1.336160555818461, 'sideways_tsl_mult': 0.6920225775879383, 'sideways_time_stop': 98, 'sideways_use_sma': False, 'sideways_use_ema': False, 'sideways_use_atr': False, 'sideways_use_adx': True, 'sideways_use_spike': False, 'sideways_rsi_required': False}.
[I 2025-08-30 21:47:52,643] Trial 479 finished with values: [-1000000000.0, 1000000000.0] and parameters: {'p_sma': 39, 'p_std': 48, 'p_atr': 21, 'p_adx': 22, 'rsi_period': 68, 'ema1': 11, 'ema2': 54, 'slip_atr_k': 0.033764947389064666, 'slip_spread_k': 0.6356199588046834, 'spread_hl_frac': 0.0441980408269794, 'bb_std_mult': 0.8463973760203328, 'rsi_os': 10, 'rsi_ob': 65, 'vol_spike': 0.23444611838768642, 'adx_thresh': 10.530512545147554, 'atr_min_pct': 0.014959373662770134, 'atr_max_pct': 0.030062751085525176, 'tp_mult': 1.608735291081747, 'tsl_mult': 0.5358109266816905, 'strategy': 'mean_reversion', 'time_stop': 68, 'use_sma': True, 'use_atr': True, 'use_adx': True, 'use_ema': True, 'use_spike': True, 'rsi_required': True, 'edge_k': 0.9067575315035161, 'edge_cap': 0.803396809742811, 'bull_strategy': 'breakout', 'bull_bb_std_mult': 1.9429605880881755, 'bull_rsi_os': 36, 'bull_rsi_ob': 62, 'bull_adx_thresh': 16.945254985215634, 'bull_atr_min_pct': 0.007519302500146775, 'bull_atr_max_pct': 0.029614007876614383, 'bull_tp_mult': 1.4842393336350883, 'bull_tsl_mult': 0.38034707868986356, 'bull_time_stop': 189, 'bull_use_sma': False, 'bull_use_ema': False, 'bull_use_atr': False, 'bull_use_adx': False, 'bull_use_spike': False, 'bull_rsi_required': True, 'bear_strategy': 'mean_reversion', 'bear_bb_std_mult': 1.8986908010012093, 'bear_rsi_os': 7, 'bear_rsi_ob': 90, 'bear_adx_thresh': 28.405887834091367, 'bear_atr_min_pct': 0.006788702383213004, 'bear_atr_max_pct': 0.11234021153475715, 'bear_tp_mult': 2.2923014982872574, 'bear_tsl_mult': 0.21126597067893493, 'bear_time_stop': 226, 'bear_use_sma': False, 'bear_use_ema': True, 'bear_use_atr': False, 'bear_use_adx': True, 'bear_use_spike': True, 'bear_rsi_required': True, 'sideways_strategy': 'mean_reversion', 'sideways_bb_std_mult': 2.0909759911165544, 'sideways_rsi_os': 16, 'sideways_rsi_ob': 47, 'sideways_adx_thresh': 26.81066579661872, 'sideways_atr_min_pct': 0.01728964191609213, 'sideways_atr_max_pct': 0.029348332480944282, 'sideways_tp_mult': 1.38728430745834, 'sideways_tsl_mult': 0.5945613302903606, 'sideways_time_stop': 264, 'sideways_use_sma': False, 'sideways_use_ema': False, 'sideways_use_atr': False, 'sideways_use_adx': True, 'sideways_use_spike': False, 'sideways_rsi_required': False}.
[I 2025-08-30 21:47:53,477] Trial 482 finished with values: [-1000000000.0, 1000000000.0] and parameters: {'p_sma': 33, 'p_std': 35, 'p_atr': 7, 'p_adx': 21, 'rsi_period': 38, 'ema1': 11, 'ema2': 55, 'slip_atr_k': 0.15732624249623636, 'slip_spread_k': 0.6781733286982873, 'spread_hl_frac': 0.044381756309595635, 'bb_std_mult': 0.7864545484333896, 'rsi_os': 52, 'rsi_ob': 46, 'vol_spike': 0.28277849669344735, 'adx_thresh': 12.109476755896772, 'atr_min_pct': 0.012926802722460759, 'atr_max_pct': 0.016312812824206893, 'tp_mult': 1.6131405242494494, 'tsl_mult': 0.1932902838844363, 'strategy': 'mean_reversion', 'time_stop': 83, 'use_sma': True, 'use_atr': False, 'use_adx': False, 'use_ema': True, 'use_spike': False, 'rsi_required': True, 'edge_k': 0.9060985496925612, 'edge_cap': 0.8363319534551237, 'bull_strategy': 'mean_reversion', 'bull_bb_std_mult': 1.7642487574166545, 'bull_rsi_os': 16, 'bull_rsi_ob': 62, 'bull_adx_thresh': 13.186622075985817, 'bull_atr_min_pct': 0.007520454861249347, 'bull_atr_max_pct': 0.0496607888119927, 'bull_tp_mult': 1.4699261731153694, 'bull_tsl_mult': 0.41718667970208667, 'bull_time_stop': 167, 'bull_use_sma': True, 'bull_use_ema': True, 'bull_use_atr': False, 'bull_use_adx': False, 'bull_use_spike': False, 'bull_rsi_required': True, 'bear_strategy': 'mean_reversion', 'bear_bb_std_mult': 1.8813027175428123, 'bear_rsi_os': 8, 'bear_rsi_ob': 95, 'bear_adx_thresh': 28.410856142654154, 'bear_atr_min_pct': 0.029966894883420962, 'bear_atr_max_pct': 0.11709780367619615, 'bear_tp_mult': 2.3096319441831272, 'bear_tsl_mult': 0.35291721764857453, 'bear_time_stop': 238, 'bear_use_sma': False, 'bear_use_ema': True, 'bear_use_atr': False, 'bear_use_adx': False, 'bear_use_spike': True, 'bear_rsi_required': False, 'sideways_strategy': 'mean_reversion', 'sideways_bb_std_mult': 1.5499691569886682, 'sideways_rsi_os': 38, 'sideways_rsi_ob': 48, 'sideways_adx_thresh': 30.38456039451339, 'sideways_atr_min_pct': 0.019250099668369616, 'sideways_atr_max_pct': 0.03785349750450394, 'sideways_tp_mult': 1.3913492614559932, 'sideways_tsl_mult': 0.7198109274392088, 'sideways_time_stop': 261, 'sideways_use_sma': False, 'sideways_use_ema': False, 'sideways_use_atr': False, 'sideways_use_adx': True, 'sideways_use_spike': True, 'sideways_rsi_required': False}.
[I 2025-08-30 21:48:23,254] Trial 480 finished with values: [-1000000000.0, 1000000000.0] and parameters: {'p_sma': 34, 'p_std': 26, 'p_atr': 29, 'p_adx': 17, 'rsi_period': 39, 'ema1': 11, 'ema2': 54, 'slip_atr_k': 0.07338615819415414, 'slip_spread_k': 0.619582088815079, 'spread_hl_frac': 0.03138442536847223, 'bb_std_mult': 0.7733304791165658, 'rsi_os': 10, 'rsi_ob': 69, 'vol_spike': 0.2819708009921508, 'adx_thresh': 9.587251540636235, 'atr_min_pct': 0.015248108941632964, 'atr_max_pct': 0.032945776281694955, 'tp_mult': 1.6314209298075033, 'tsl_mult': 0.5362912229379684, 'strategy': 'mean_reversion', 'time_stop': 71, 'use_sma': True, 'use_atr': True, 'use_adx': True, 'use_ema': True, 'use_spike': True, 'rsi_required': True, 'edge_k': 0.004025305430509607, 'edge_cap': 0.8080612616277214, 'bull_strategy': 'mean_reversion', 'bull_bb_std_mult': 1.7867010078054575, 'bull_rsi_os': 8, 'bull_rsi_ob': 84, 'bull_adx_thresh': 23.59342588427839, 'bull_atr_min_pct': 0.017066575195131117, 'bull_atr_max_pct': 0.04880334222927392, 'bull_tp_mult': 1.4498299705712463, 'bull_tsl_mult': 0.5782378163648745, 'bull_time_stop': 113, 'bull_use_sma': True, 'bull_use_ema': False, 'bull_use_atr': False, 'bull_use_adx': False, 'bull_use_spike': False, 'bull_rsi_required': True, 'bear_strategy': 'mean_reversion', 'bear_bb_std_mult': 1.9420249078603635, 'bear_rsi_os': 7, 'bear_rsi_ob': 94, 'bear_adx_thresh': 29.430281067958663, 'bear_atr_min_pct': 0.006692224673267031, 'bear_atr_max_pct': 0.11705380489207766, 'bear_tp_mult': 1.4966914496064705, 'bear_tsl_mult': 0.17359054920552075, 'bear_time_stop': 226, 'bear_use_sma': False, 'bear_use_ema': True, 'bear_use_atr': False, 'bear_use_adx': True, 'bear_use_spike': True, 'bear_rsi_required': True, 'sideways_strategy': 'mean_reversion', 'sideways_bb_std_mult': 1.6234660607076046, 'sideways_rsi_os': 20, 'sideways_rsi_ob': 90, 'sideways_adx_thresh': 14.605156337255877, 'sideways_atr_min_pct': 0.017330278977636532, 'sideways_atr_max_pct': 0.0377553399723941, 'sideways_tp_mult': 1.4022803892727005, 'sideways_tsl_mult': 0.6911320919165375, 'sideways_time_stop': 262, 'sideways_use_sma': False, 'sideways_use_ema': False, 'sideways_use_atr': False, 'sideways_use_adx': True, 'sideways_use_spike': False, 'sideways_rsi_required': False}.
[I 2025-08-30 21:48:24,856] Trial 481 finished with values: [-1000000000.0, 1000000000.0] and parameters: {'p_sma': 34, 'p_std': 21, 'p_atr': 22, 'p_adx': 21, 'rsi_period': 40, 'ema1': 11, 'ema2': 31, 'slip_atr_k': 0.03450588535262879, 'slip_spread_k': 0.1469020378127115, 'spread_hl_frac': 0.04497108668071506, 'bb_std_mult': 0.7746065080933819, 'rsi_os': 10, 'rsi_ob': 63, 'vol_spike': 0.2721550230936633, 'adx_thresh': 12.227642924080847, 'atr_min_pct': 0.013049466086003238, 'atr_max_pct': 0.02131131635918728, 'tp_mult': 1.615307540195056, 'tsl_mult': 0.0010785079358996419, 'strategy': 'mean_reversion', 'time_stop': 274, 'use_sma': True, 'use_atr': False, 'use_adx': False, 'use_ema': True, 'use_spike': False, 'rsi_required': True, 'edge_k': 0.8319337194834673, 'edge_cap': 0.8090287771745496, 'bull_strategy': 'mean_reversion', 'bull_bb_std_mult': 1.930970265841618, 'bull_rsi_os': 18, 'bull_rsi_ob': 61, 'bull_adx_thresh': 12.954485069718254, 'bull_atr_min_pct': 0.007113763669763852, 'bull_atr_max_pct': 0.049189176425404255, 'bull_tp_mult': 1.4770897130233478, 'bull_tsl_mult': 0.4123902751618842, 'bull_time_stop': 190, 'bull_use_sma': True, 'bull_use_ema': False, 'bull_use_atr': False, 'bull_use_adx': False, 'bull_use_spike': False, 'bull_rsi_required': True, 'bear_strategy': 'mean_reversion', 'bear_bb_std_mult': 1.917323258648473, 'bear_rsi_os': 8, 'bear_rsi_ob': 89, 'bear_adx_thresh': 28.371028529589495, 'bear_atr_min_pct': 0.029965035404872692, 'bear_atr_max_pct': 0.11569241049417044, 'bear_tp_mult': 2.5767880197882396, 'bear_tsl_mult': 0.1615122843615041, 'bear_time_stop': 236, 'bear_use_sma': False, 'bear_use_ema': True, 'bear_use_atr': False, 'bear_use_adx': False, 'bear_use_spike': True, 'bear_rsi_required': False, 'sideways_strategy': 'mean_reversion', 'sideways_bb_std_mult': 1.7704072181447785, 'sideways_rsi_os': 17, 'sideways_rsi_ob': 89, 'sideways_adx_thresh': 27.231589061317734, 'sideways_atr_min_pct': 0.027107132608341692, 'sideways_atr_max_pct': 0.04782736911037557, 'sideways_tp_mult': 1.3689477658840872, 'sideways_tsl_mult': 0.6846393990581392, 'sideways_time_stop': 19, 'sideways_use_sma': False, 'sideways_use_ema': False, 'sideways_use_atr': False, 'sideways_use_adx': True, 'sideways_use_spike': True, 'sideways_rsi_required': False}.
[I 2025-08-30 21:48:25,836] Trial 483 finished with values: [-1000000000.0, 1000000000.0] and parameters: {'p_sma': 33, 'p_std': 26, 'p_atr': 29, 'p_adx': 21, 'rsi_period': 40, 'ema1': 9, 'ema2': 56, 'slip_atr_k': 0.022448595856776155, 'slip_spread_k': 0.6863529388658675, 'spread_hl_frac': 0.03269170293216057, 'bb_std_mult': 0.7569723549595052, 'rsi_os': 38, 'rsi_ob': 69, 'vol_spike': 0.28318739912535607, 'adx_thresh': 12.258226054970184, 'atr_min_pct': 0.012629368880087805, 'atr_max_pct': 0.01689293377869444, 'tp_mult': 1.607891202749296, 'tsl_mult': 0.06326646602952918, 'strategy': 'mean_reversion', 'time_stop': 5, 'use_sma': True, 'use_atr': False, 'use_adx': False, 'use_ema': False, 'use_spike': False, 'rsi_required': True, 'edge_k': 0.04866312990788402, 'edge_cap': 0.8398829511161757, 'bull_strategy': 'mean_reversion', 'bull_bb_std_mult': 1.7472386192381513, 'bull_rsi_os': 18, 'bull_rsi_ob': 87, 'bull_adx_thresh': 12.657632040193825, 'bull_atr_min_pct': 0.003233262230775681, 'bull_atr_max_pct': 0.1075579300139054, 'bull_tp_mult': 1.4663120239959424, 'bull_tsl_mult': 0.4164381984506808, 'bull_time_stop': 294, 'bull_use_sma': True, 'bull_use_ema': True, 'bull_use_atr': False, 'bull_use_adx': False, 'bull_use_spike': False, 'bull_rsi_required': True, 'bear_strategy': 'mean_reversion', 'bear_bb_std_mult': 1.8840587801979714, 'bear_rsi_os': 8, 'bear_rsi_ob': 71, 'bear_adx_thresh': 25.283963141255697, 'bear_atr_min_pct': 0.029998391440476373, 'bear_atr_max_pct': 0.11729423819710341, 'bear_tp_mult': 1.5381207990842953, 'bear_tsl_mult': 0.5772184694145273, 'bear_time_stop': 240, 'bear_use_sma': False, 'bear_use_ema': True, 'bear_use_atr': False, 'bear_use_adx': False, 'bear_use_spike': True, 'bear_rsi_required': False, 'sideways_strategy': 'breakout', 'sideways_bb_std_mult': 1.5642324284482763, 'sideways_rsi_os': 55, 'sideways_rsi_ob': 89, 'sideways_adx_thresh': 25.977448024790128, 'sideways_atr_min_pct': 0.019214524325293456, 'sideways_atr_max_pct': 0.03711812541957929, 'sideways_tp_mult': 1.88294541649558, 'sideways_tsl_mult': 0.636781226663439, 'sideways_time_stop': 260, 'sideways_use_sma': False, 'sideways_use_ema': False, 'sideways_use_atr': False, 'sideways_use_adx': True, 'sideways_use_spike': True, 'sideways_rsi_required': False}.
[I 2025-08-30 21:48:26,833] Trial 484 finished with values: [-0.019781235671687547, 0.01971602238036757] and parameters: {'p_sma': 36, 'p_std': 39, 'p_atr': 27, 'p_adx': 21, 'rsi_period': 74, 'ema1': 9, 'ema2': 56, 'slip_atr_k': 0.07374989370860097, 'slip_spread_k': 0.6897586950901413, 'spread_hl_frac': 0.03255913481861124, 'bb_std_mult': 0.7760252122270153, 'rsi_os': 12, 'rsi_ob': 68, 'vol_spike': 0.2800680700507877, 'adx_thresh': 12.27059500744597, 'atr_min_pct': 0.012459463169562857, 'atr_max_pct': 0.02099091661673801, 'tp_mult': 1.7115949003412485, 'tsl_mult': 0.6353020749988655, 'strategy': 'mean_reversion', 'time_stop': 75, 'use_sma': True, 'use_atr': True, 'use_adx': False, 'use_ema': False, 'use_spike': False, 'rsi_required': True, 'edge_k': 0.012279241225599868, 'edge_cap': 0.8015601927158003, 'bull_strategy': 'mean_reversion', 'bull_bb_std_mult': 1.895509750979573, 'bull_rsi_os': 38, 'bull_rsi_ob': 87, 'bull_adx_thresh': 14.314427150283747, 'bull_atr_min_pct': 0.0005395215813779878, 'bull_atr_max_pct': 0.05315693696206955, 'bull_tp_mult': 1.4299100845518569, 'bull_tsl_mult': 0.40718936792492577, 'bull_time_stop': 218, 'bull_use_sma': True, 'bull_use_ema': False, 'bull_use_atr': False, 'bull_use_adx': False, 'bull_use_spike': False, 'bull_rsi_required': True, 'bear_strategy': 'mean_reversion', 'bear_bb_std_mult': 1.9358682837474497, 'bear_rsi_os': 6, 'bear_rsi_ob': 61, 'bear_adx_thresh': 25.22204951508951, 'bear_atr_min_pct': 0.003864941558292038, 'bear_atr_max_pct': 0.11726818314895934, 'bear_tp_mult': 2.5773706316314846, 'bear_tsl_mult': 0.11908095073931718, 'bear_time_stop': 243, 'bear_use_sma': False, 'bear_use_ema': True, 'bear_use_atr': False, 'bear_use_adx': True, 'bear_use_spike': True, 'bear_rsi_required': False, 'sideways_strategy': 'breakout', 'sideways_bb_std_mult': 1.8297842324469973, 'sideways_rsi_os': 11, 'sideways_rsi_ob': 89, 'sideways_adx_thresh': 27.43434006257657, 'sideways_atr_min_pct': 0.002339371648931358, 'sideways_atr_max_pct': 0.04448210971259871, 'sideways_tp_mult': 1.72598648267982, 'sideways_tsl_mult': 0.6260310001988025, 'sideways_time_stop': 19, 'sideways_use_sma': True, 'sideways_use_ema': False, 'sideways_use_atr': False, 'sideways_use_adx': True, 'sideways_use_spike': True, 'sideways_rsi_required': False}.
[I 2025-08-30 21:48:27,523] Trial 487 finished with values: [-1000000000.0, 1000000000.0] and parameters: {'p_sma': 36, 'p_std': 44, 'p_atr': 10, 'p_adx': 20, 'rsi_period': 70, 'ema1': 10, 'ema2': 53, 'slip_atr_k': 0.02868356326899882, 'slip_spread_k': 0.8533366096982027, 'spread_hl_frac': 0.03340262783995382, 'bb_std_mult': 0.9032266629695185, 'rsi_os': 12, 'rsi_ob': 51, 'vol_spike': 0.19037719102039088, 'adx_thresh': 11.361599545560365, 'atr_min_pct': 0.024222245407662726, 'atr_max_pct': 0.010379534045622765, 'tp_mult': 1.701574337257338, 'tsl_mult': 0.8684368657662215, 'strategy': 'breakout', 'time_stop': 100, 'use_sma': True, 'use_atr': True, 'use_adx': True, 'use_ema': False, 'use_spike': True, 'rsi_required': True, 'edge_k': 1.1094019396561254, 'edge_cap': 0.7847415107418357, 'bull_strategy': 'breakout', 'bull_bb_std_mult': 1.8467707549719554, 'bull_rsi_os': 26, 'bull_rsi_ob': 88, 'bull_adx_thresh': 14.36104387727733, 'bull_atr_min_pct': 0.0005362123365648481, 'bull_atr_max_pct': 0.05313330717391565, 'bull_tp_mult': 1.3084840423553046, 'bull_tsl_mult': 0.7568561982118068, 'bull_time_stop': 300, 'bull_use_sma': True, 'bull_use_ema': False, 'bull_use_atr': True, 'bull_use_adx': False, 'bull_use_spike': False, 'bull_rsi_required': True, 'bear_strategy': 'breakout', 'bear_bb_std_mult': 1.7938171390619029, 'bear_rsi_os': 6, 'bear_rsi_ob': 61, 'bear_adx_thresh': 27.196716788678437, 'bear_atr_min_pct': 0.02862656019616233, 'bear_atr_max_pct': 0.12044397746794337, 'bear_tp_mult': 1.620022091594784, 'bear_tsl_mult': 0.003306806840162879, 'bear_time_stop': 242, 'bear_use_sma': False, 'bear_use_ema': True, 'bear_use_atr': True, 'bear_use_adx': True, 'bear_use_spike': True, 'bear_rsi_required': True, 'sideways_strategy': 'breakout', 'sideways_bb_std_mult': 0.7228939693575145, 'sideways_rsi_os': 35, 'sideways_rsi_ob': 88, 'sideways_adx_thresh': 28.22709056714619, 'sideways_atr_min_pct': 0.002557665545970308, 'sideways_atr_max_pct': 0.044090347610559265, 'sideways_tp_mult': 1.0115295721498851, 'sideways_tsl_mult': 0.8758834579951211, 'sideways_time_stop': 269, 'sideways_use_sma': True, 'sideways_use_ema': False, 'sideways_use_atr': False, 'sideways_use_adx': True, 'sideways_use_spike': False, 'sideways_rsi_required': False}.
