[I 2025-08-30 21:31:46,671] Trial 351 finished with values: [-0.02264575883881459, 0.0225918874409529] and parameters: {'p_sma': 31, 'p_std': 10, 'p_atr': 15, 'p_adx': 29, 'rsi_period': 17, 'ema1': 21, 'ema2': 44, 'slip_atr_k': 0.038319650300926676, 'slip_spread_k': 0.023419643803759882, 'spread_hl_frac': 0.01443794246158652, 'bb_std_mult': 3.3416661578512357, 'rsi_os': 29, 'rsi_ob': 63, 'vol_spike': 0.28565454532356105, 'adx_thresh': 31.173277622176542, 'atr_min_pct': 0.009360571839830002, 'atr_max_pct': 0.08970463047141435, 'tp_mult': 1.7346069982440704, 'tsl_mult': 0.34136133724854445, 'strategy': 'breakout', 'time_stop': 299, 'use_sma': False, 'use_atr': True, 'use_adx': False, 'use_ema': True, 'use_spike': False, 'rsi_required': False, 'edge_k': 0.88811956857399, 'edge_cap': 0.131576981651098, 'bull_strategy': 'breakout', 'bull_bb_std_mult': 3.227721616584594, 'bull_rsi_os': 20, 'bull_rsi_ob': 70, 'bull_adx_thresh': 16.26855906703556, 'bull_atr_min_pct': 0.00060254234640359, 'bull_atr_max_pct': 0.052029479640608306, 'bull_tp_mult': 1.8003286059840868, 'bull_tsl_mult': 0.421289317969296, 'bull_time_stop': 290, 'bull_use_sma': False, 'bull_use_ema': False, 'bull_use_atr': True, 'bull_use_adx': True, 'bull_use_spike': True, 'bull_rsi_required': False, 'bear_strategy': 'breakout', 'bear_bb_std_mult': 2.1910954894382266, 'bear_rsi_os': 42, 'bear_rsi_ob': 56, 'bear_adx_thresh': 32.17482792446744, 'bear_atr_min_pct': 0.016167791025981586, 'bear_atr_max_pct': 0.01602024227151564, 'bear_tp_mult': 2.9552095913662946, 'bear_tsl_mult': 0.488323973501644, 'bear_time_stop': 236, 'bear_use_sma': True, 'bear_use_ema': False, 'bear_use_atr': True, 'bear_use_adx': False, 'bear_use_spike': False, 'bear_rsi_required': False, 'sideways_strategy': 'breakout', 'sideways_bb_std_mult': 1.6922940563950408, 'sideways_rsi_os': 39, 'sideways_rsi_ob': 94, 'sideways_adx_thresh': 26.09349639654321, 'sideways_atr_min_pct': 0.014547759319212305, 'sideways_atr_max_pct': 0.09650724915419047, 'sideways_tp_mult': 2.0726698148503346, 'sideways_tsl_mult': 0.6227761023999341, 'sideways_time_stop': 18, 'sideways_use_sma': True, 'sideways_use_ema': True, 'sideways_use_atr': True, 'sideways_use_adx': False, 'sideways_use_spike': True, 'sideways_rsi_required': True}.
[I 2025-08-30 21:32:20,531] Trial 352 finished with values: [-1000000000.0, 1000000000.0] and parameters: {'p_sma': 7, 'p_std': 10, 'p_atr': 15, 'p_adx': 29, 'rsi_period': 78, 'ema1': 21, 'ema2': 49, 'slip_atr_k': 0.03647203150283475, 'slip_spread_k': 0.9492092485777148, 'spread_hl_frac': 0.013564499658739605, 'bb_std_mult': 1.5056156681513648, 'rsi_os': 10, 'rsi_ob': 92, 'vol_spike': 0.22497948546386076, 'adx_thresh': 6.6778248663345074, 'atr_min_pct': 0.017025552716138096, 'atr_max_pct': 0.09640192862966859, 'tp_mult': 1.730079533647683, 'tsl_mult': 0.8861466309868032, 'strategy': 'breakout', 'time_stop': 89, 'use_sma': True, 'use_atr': True, 'use_adx': False, 'use_ema': True, 'use_spike': False, 'rsi_required': False, 'edge_k': 0.7599966257482713, 'edge_cap': 0.1331909067102311, 'bull_strategy': 'breakout', 'bull_bb_std_mult': 3.3370229031538505, 'bull_rsi_os': 28, 'bull_rsi_ob': 69, 'bull_adx_thresh': 23.975482420719267, 'bull_atr_min_pct': 0.002984922328967724, 'bull_atr_max_pct': 0.046862427154028746, 'bull_tp_mult': 2.7654534414924328, 'bull_tsl_mult': 0.4287983306028985, 'bull_time_stop': 290, 'bull_use_sma': False, 'bull_use_ema': False, 'bull_use_atr': True, 'bull_use_adx': True, 'bull_use_spike': False, 'bull_rsi_required': False, 'bear_strategy': 'breakout', 'bear_bb_std_mult': 2.6803582172158387, 'bear_rsi_os': 27, 'bear_rsi_ob': 49, 'bear_adx_thresh': 18.933471633100165, 'bear_atr_min_pct': 0.024444000841520395, 'bear_atr_max_pct': 0.015174996008882688, 'bear_tp_mult': 2.9613116844120295, 'bear_tsl_mult': 0.40010070787934376, 'bear_time_stop': 78, 'bear_use_sma': False, 'bear_use_ema': False, 'bear_use_atr': True, 'bear_use_adx': False, 'bear_use_spike': False, 'bear_rsi_required': False, 'sideways_strategy': 'breakout', 'sideways_bb_std_mult': 1.6595075677879598, 'sideways_rsi_os': 41, 'sideways_rsi_ob': 94, 'sideways_adx_thresh': 26.130724982235478, 'sideways_atr_min_pct': 0.014772698796461632, 'sideways_atr_max_pct': 0.11892658343720733, 'sideways_tp_mult': 2.0331634891550205, 'sideways_tsl_mult': 0.3880426601868655, 'sideways_time_stop': 36, 'sideways_use_sma': True, 'sideways_use_ema': False, 'sideways_use_atr': False, 'sideways_use_adx': False, 'sideways_use_spike': True, 'sideways_rsi_required': True}.
[I 2025-08-30 21:32:20,795] Trial 354 finished with values: [-0.01951047158261532, 0.019443740622413035] and parameters: {'p_sma': 31, 'p_std': 34, 'p_atr': 15, 'p_adx': 29, 'rsi_period': 74, 'ema1': 20, 'ema2': 43, 'slip_atr_k': 0.03806160183507701, 'slip_spread_k': 0.8848130925160753, 'spread_hl_frac': 0.026109968846258623, 'bb_std_mult': 2.920554001751804, 'rsi_os': 10, 'rsi_ob': 51, 'vol_spike': 0.1484466779446601, 'adx_thresh': 19.269982728210504, 'atr_min_pct': 0.01726174901786145, 'atr_max_pct': 0.09754932307141581, 'tp_mult': 1.7476221286323153, 'tsl_mult': 0.10295364274269209, 'strategy': 'mean_reversion', 'time_stop': 188, 'use_sma': True, 'use_atr': True, 'use_adx': True, 'use_ema': True, 'use_spike': True, 'rsi_required': True, 'edge_k': 0.6837974180190494, 'edge_cap': 0.6425088945681527, 'bull_strategy': 'breakout', 'bull_bb_std_mult': 0.5724230015347878, 'bull_rsi_os': 16, 'bull_rsi_ob': 69, 'bull_adx_thresh': 16.025284088307174, 'bull_atr_min_pct': 0.0006449786177340361, 'bull_atr_max_pct': 0.053274384724835075, 'bull_tp_mult': 2.2247774807212632, 'bull_tsl_mult': 0.4240347294962153, 'bull_time_stop': 295, 'bull_use_sma': False, 'bull_use_ema': False, 'bull_use_atr': False, 'bull_use_adx': True, 'bull_use_spike': False, 'bull_rsi_required': True, 'bear_strategy': 'mean_reversion', 'bear_bb_std_mult': 2.217823261249096, 'bear_rsi_os': 42, 'bear_rsi_ob': 72, 'bear_adx_thresh': 14.832103519078911, 'bear_atr_min_pct': 0.016823221710415254, 'bear_atr_max_pct': 0.015275130126035036, 'bear_tp_mult': 1.6021695798232858, 'bear_tsl_mult': 0.39719090708306437, 'bear_time_stop': 236, 'bear_use_sma': False, 'bear_use_ema': False, 'bear_use_atr': False, 'bear_use_adx': True, 'bear_use_spike': True, 'bear_rsi_required': True, 'sideways_strategy': 'breakout', 'sideways_bb_std_mult': 1.696272498373716, 'sideways_rsi_os': 39, 'sideways_rsi_ob': 58, 'sideways_adx_thresh': 27.611776441501195, 'sideways_atr_min_pct': 0.0031352385728943243, 'sideways_atr_max_pct': 0.06247113852627698, 'sideways_tp_mult': 2.036786265278116, 'sideways_tsl_mult': 0.3845137540396173, 'sideways_time_stop': 268, 'sideways_use_sma': False, 'sideways_use_ema': False, 'sideways_use_atr': False, 'sideways_use_adx': False, 'sideways_use_spike': False, 'sideways_rsi_required': False}.
[I 2025-08-30 21:32:21,144] Trial 353 finished with values: [-1000000000.0, 1000000000.0] and parameters: {'p_sma': 31, 'p_std': 39, 'p_atr': 15, 'p_adx': 29, 'rsi_period': 78, 'ema1': 21, 'ema2': 29, 'slip_atr_k': 0.03714641387696174, 'slip_spread_k': 0.12671905214522394, 'spread_hl_frac': 0.030043449900049236, 'bb_std_mult': 1.6554867743434971, 'rsi_os': 10, 'rsi_ob': 63, 'vol_spike': 0.2861355835205912, 'adx_thresh': 18.38297525847698, 'atr_min_pct': 0.009474392152730075, 'atr_max_pct': 0.09645134891923868, 'tp_mult': 1.723723900564211, 'tsl_mult': 0.8829613508175413, 'strategy': 'breakout', 'time_stop': 124, 'use_sma': True, 'use_atr': True, 'use_adx': True, 'use_ema': True, 'use_spike': True, 'rsi_required': False, 'edge_k': 0.8844110937896622, 'edge_cap': 0.12783567780561955, 'bull_strategy': 'breakout', 'bull_bb_std_mult': 3.2364938358303235, 'bull_rsi_os': 16, 'bull_rsi_ob': 95, 'bull_adx_thresh': 15.878638741551079, 'bull_atr_min_pct': 0.006593027395350679, 'bull_atr_max_pct': 0.046915206093103894, 'bull_tp_mult': 2.2427014192556936, 'bull_tsl_mult': 0.43033454659216974, 'bull_time_stop': 289, 'bull_use_sma': True, 'bull_use_ema': False, 'bull_use_atr': True, 'bull_use_adx': True, 'bull_use_spike': False, 'bull_rsi_required': True, 'bear_strategy': 'mean_reversion', 'bear_bb_std_mult': 2.227954441031889, 'bear_rsi_os': 55, 'bear_rsi_ob': 72, 'bear_adx_thresh': 14.927148030675504, 'bear_atr_min_pct': 0.017067206884517832, 'bear_atr_max_pct': 0.016150050534145765, 'bear_tp_mult': 2.8116840869190027, 'bear_tsl_mult': 0.39346304979105534, 'bear_time_stop': 101, 'bear_use_sma': False, 'bear_use_ema': False, 'bear_use_atr': False, 'bear_use_adx': False, 'bear_use_spike': False, 'bear_rsi_required': True, 'sideways_strategy': 'breakout', 'sideways_bb_std_mult': 1.702485791006845, 'sideways_rsi_os': 52, 'sideways_rsi_ob': 89, 'sideways_adx_thresh': 6.4727238030983205, 'sideways_atr_min_pct': 0.014561909389281258, 'sideways_atr_max_pct': 0.09507579472838597, 'sideways_tp_mult': 2.040149064274136, 'sideways_tsl_mult': 0.44537831853669235, 'sideways_time_stop': 259, 'sideways_use_sma': True, 'sideways_use_ema': False, 'sideways_use_atr': False, 'sideways_use_adx': False, 'sideways_use_spike': True, 'sideways_rsi_required': False}.
[I 2025-08-30 21:32:21,581] Trial 355 finished with values: [-0.015379464129552933, 0.015316463024011176] and parameters: {'p_sma': 29, 'p_std': 34, 'p_atr': 21, 'p_adx': 22, 'rsi_period': 74, 'ema1': 20, 'ema2': 50, 'slip_atr_k': 0.027338708607465942, 'slip_spread_k': 0.5829342274698843, 'spread_hl_frac': 0.03020352239949753, 'bb_std_mult': 1.5039571312786018, 'rsi_os': 10, 'rsi_ob': 66, 'vol_spike': 0.28991110304016676, 'adx_thresh': 16.26486725734049, 'atr_min_pct': 0.011712787664505394, 'atr_max_pct': 0.0970096592123054, 'tp_mult': 1.6608298338628442, 'tsl_mult': 0.8814371078999685, 'strategy': 'mean_reversion', 'time_stop': 125, 'use_sma': True, 'use_atr': True, 'use_adx': True, 'use_ema': True, 'use_spike': True, 'rsi_required': True, 'edge_k': 1.255924501438212, 'edge_cap': 0.6440908656889022, 'bull_strategy': 'breakout', 'bull_bb_std_mult': 2.808952521390216, 'bull_rsi_os': 16, 'bull_rsi_ob': 91, 'bull_adx_thresh': 14.792686340176926, 'bull_atr_min_pct': 0.0011900975149774517, 'bull_atr_max_pct': 0.04820258792388548, 'bull_tp_mult': 2.2514008893847803, 'bull_tsl_mult': 0.3649666705322909, 'bull_time_stop': 295, 'bull_use_sma': True, 'bull_use_ema': False, 'bull_use_atr': False, 'bull_use_adx': True, 'bull_use_spike': False, 'bull_rsi_required': True, 'bear_strategy': 'mean_reversion', 'bear_bb_std_mult': 2.6859409251320625, 'bear_rsi_os': 37, 'bear_rsi_ob': 76, 'bear_adx_thresh': 14.89127576713113, 'bear_atr_min_pct': 0.029066868443774922, 'bear_atr_max_pct': 0.012361334829170055, 'bear_tp_mult': 1.5936726186967682, 'bear_tsl_mult': 0.39706857952068947, 'bear_time_stop': 96, 'bear_use_sma': False, 'bear_use_ema': True, 'bear_use_atr': False, 'bear_use_adx': True, 'bear_use_spike': True, 'bear_rsi_required': True, 'sideways_strategy': 'breakout', 'sideways_bb_std_mult': 1.6886331166685644, 'sideways_rsi_os': 40, 'sideways_rsi_ob': 87, 'sideways_adx_thresh': 27.569802389014228, 'sideways_atr_min_pct': 0.020368646265622452, 'sideways_atr_max_pct': 0.1464148943707037, 'sideways_tp_mult': 2.013877688083863, 'sideways_tsl_mult': 0.811686040994323, 'sideways_time_stop': 262, 'sideways_use_sma': False, 'sideways_use_ema': False, 'sideways_use_atr': False, 'sideways_use_adx': True, 'sideways_use_spike': False, 'sideways_rsi_required': False}.
[I 2025-08-30 21:32:22,376] Trial 356 finished with values: [-1000000000.0, 1000000000.0] and parameters: {'p_sma': 30, 'p_std': 34, 'p_atr': 21, 'p_adx': 30, 'rsi_period': 63, 'ema1': 20, 'ema2': 26, 'slip_atr_k': 0.026720091990978204, 'slip_spread_k': 0.1270709438561416, 'spread_hl_frac': 0.005339595714619666, 'bb_std_mult': 1.9413487456066754, 'rsi_os': 10, 'rsi_ob': 46, 'vol_spike': 0.2902222441653521, 'adx_thresh': 18.32931704176135, 'atr_min_pct': 0.011878592753581847, 'atr_max_pct': 0.022874259365215706, 'tp_mult': 1.6597160324845697, 'tsl_mult': 0.928984544200943, 'strategy': 'mean_reversion', 'time_stop': 126, 'use_sma': True, 'use_atr': True, 'use_adx': True, 'use_ema': True, 'use_spike': True, 'rsi_required': True, 'edge_k': 0.6964052512125141, 'edge_cap': 0.604958936455556, 'bull_strategy': 'breakout', 'bull_bb_std_mult': 0.5547455699385642, 'bull_rsi_os': 10, 'bull_rsi_ob': 72, 'bull_adx_thresh': 14.842938133826113, 'bull_atr_min_pct': 0.0010452314486986613, 'bull_atr_max_pct': 0.05456885442084998, 'bull_tp_mult': 2.2412899094048795, 'bull_tsl_mult': 0.8499371491362637, 'bull_time_stop': 295, 'bull_use_sma': True, 'bull_use_ema': True, 'bull_use_atr': False, 'bull_use_adx': True, 'bull_use_spike': False, 'bull_rsi_required': True, 'bear_strategy': 'mean_reversion', 'bear_bb_std_mult': 1.362106284725812, 'bear_rsi_os': 54, 'bear_rsi_ob': 52, 'bear_adx_thresh': 14.803032417684395, 'bear_atr_min_pct': 0.028539331147090667, 'bear_atr_max_pct': 0.13901743532023153, 'bear_tp_mult': 2.7491364647510643, 'bear_tsl_mult': 0.43281883652379355, 'bear_time_stop': 96, 'bear_use_sma': False, 'bear_use_ema': True, 'bear_use_atr': False, 'bear_use_adx': True, 'bear_use_spike': True, 'bear_rsi_required': True, 'sideways_strategy': 'breakout', 'sideways_bb_std_mult': 1.6984348603208856, 'sideways_rsi_os': 39, 'sideways_rsi_ob': 87, 'sideways_adx_thresh': 27.61537523171805, 'sideways_atr_min_pct': 0.002816530533454313, 'sideways_atr_max_pct': 0.0621613715012269, 'sideways_tp_mult': 1.9487681786178888, 'sideways_tsl_mult': 0.00032236655278117254, 'sideways_time_stop': 266, 'sideways_use_sma': False, 'sideways_use_ema': False, 'sideways_use_atr': False, 'sideways_use_adx': True, 'sideways_use_spike': False, 'sideways_rsi_required': False}.
[I 2025-08-30 21:32:55,294] Trial 359 finished with values: [-1000000000.0, 1000000000.0] and parameters: {'p_sma': 29, 'p_std': 34, 'p_atr': 21, 'p_adx': 22, 'rsi_period': 74, 'ema1': 18, 'ema2': 52, 'slip_atr_k': 0.013176234244374703, 'slip_spread_k': 0.6744622129540232, 'spread_hl_frac': 0.029652579081121504, 'bb_std_mult': 1.3762706277560406, 'rsi_os': 7, 'rsi_ob': 66, 'vol_spike': 0.27979023377277895, 'adx_thresh': 15.874579235537587, 'atr_min_pct': 0.011532453105684563, 'atr_max_pct': 0.10344714241614335, 'tp_mult': 1.7933265329254588, 'tsl_mult': 0.7502946629542602, 'strategy': 'mean_reversion', 'time_stop': 140, 'use_sma': True, 'use_atr': False, 'use_adx': True, 'use_ema': False, 'use_spike': True, 'rsi_required': True, 'edge_k': 1.2849196140239543, 'edge_cap': 0.6626173100104311, 'bull_strategy': 'mean_reversion', 'bull_bb_std_mult': 2.7998487617329344, 'bull_rsi_os': 13, 'bull_rsi_ob': 93, 'bull_adx_thresh': 13.81335669519519, 'bull_atr_min_pct': 0.0034800877535909602, 'bull_atr_max_pct': 0.04360188700063509, 'bull_tp_mult': 2.220737632861329, 'bull_tsl_mult': 0.3395158440011902, 'bull_time_stop': 280, 'bull_use_sma': True, 'bull_use_ema': True, 'bull_use_atr': False, 'bull_use_adx': False, 'bull_use_spike': False, 'bull_rsi_required': True, 'bear_strategy': 'mean_reversion', 'bear_bb_std_mult': 3.396763579987806, 'bear_rsi_os': 35, 'bear_rsi_ob': 75, 'bear_adx_thresh': 13.868976550102953, 'bear_atr_min_pct': 0.029206729117712542, 'bear_atr_max_pct': 0.11258105655128792, 'bear_tp_mult': 1.600611030726595, 'bear_tsl_mult': 0.3550917273809721, 'bear_time_stop': 93, 'bear_use_sma': False, 'bear_use_ema': True, 'bear_use_atr': False, 'bear_use_adx': True, 'bear_use_spike': True, 'bear_rsi_required': True, 'sideways_strategy': 'breakout', 'sideways_bb_std_mult': 1.7496680149470598, 'sideways_rsi_os': 37, 'sideways_rsi_ob': 84, 'sideways_adx_thresh': 28.830641518276224, 'sideways_atr_min_pct': 0.020389856927756744, 'sideways_atr_max_pct': 0.14649840491304286, 'sideways_tp_mult': 1.890264425037126, 'sideways_tsl_mult': 0.8238176637998075, 'sideways_time_stop': 270, 'sideways_use_sma': False, 'sideways_use_ema': False, 'sideways_use_atr': False, 'sideways_use_adx': True, 'sideways_use_spike': False, 'sideways_rsi_required': False}.
[I 2025-08-30 21:32:55,547] Trial 357 finished with values: [-1000000000.0, 1000000000.0] and parameters: {'p_sma': 24, 'p_std': 39, 'p_atr': 14, 'p_adx': 27, 'rsi_period': 19, 'ema1': 5, 'ema2': 29, 'slip_atr_k': 0.029134229099271373, 'slip_spread_k': 0.8891236744470665, 'spread_hl_frac': 0.02434688059630176, 'bb_std_mult': 2.695593746007331, 'rsi_os': 10, 'rsi_ob': 80, 'vol_spike': 0.2997129956375556, 'adx_thresh': 32.09514587752949, 'atr_min_pct': 0.015955944227952896, 'atr_max_pct': 0.09397096016061487, 'tp_mult': 1.655272028554174, 'tsl_mult': 0.19739181822084007, 'strategy': 'mean_reversion', 'time_stop': 124, 'use_sma': True, 'use_atr': False, 'use_adx': True, 'use_ema': True, 'use_spike': True, 'rsi_required': True, 'edge_k': 0.8255076669988775, 'edge_cap': 0.5407031335690391, 'bull_strategy': 'breakout', 'bull_bb_std_mult': 2.7988232794756227, 'bull_rsi_os': 16, 'bull_rsi_ob': 87, 'bull_adx_thresh': 29.109908416125986, 'bull_atr_min_pct': 0.006663127463614808, 'bull_atr_max_pct': 0.10757808436376601, 'bull_tp_mult': 2.3418109117085386, 'bull_tsl_mult': 0.4097833730032792, 'bull_time_stop': 69, 'bull_use_sma': True, 'bull_use_ema': True, 'bull_use_atr': False, 'bull_use_adx': True, 'bull_use_spike': False, 'bull_rsi_required': True, 'bear_strategy': 'mean_reversion', 'bear_bb_std_mult': 1.0576332111925313, 'bear_rsi_os': 41, 'bear_rsi_ob': 63, 'bear_adx_thresh': 17.380350144771274, 'bear_atr_min_pct': 0.006289146209667293, 'bear_atr_max_pct': 0.012141335932780911, 'bear_tp_mult': 2.7835526022203028, 'bear_tsl_mult': 0.37381230844351593, 'bear_time_stop': 117, 'bear_use_sma': True, 'bear_use_ema': True, 'bear_use_atr': False, 'bear_use_adx': True, 'bear_use_spike': True, 'bear_rsi_required': True, 'sideways_strategy': 'breakout', 'sideways_bb_std_mult': 1.6754972856133652, 'sideways_rsi_os': 46, 'sideways_rsi_ob': 89, 'sideways_adx_thresh': 27.627348493261366, 'sideways_atr_min_pct': 0.0045082309017243916, 'sideways_atr_max_pct': 0.09533720655548492, 'sideways_tp_mult': 1.9830623994723613, 'sideways_tsl_mult': 0.8058408014219571, 'sideways_time_stop': 268, 'sideways_use_sma': False, 'sideways_use_ema': False, 'sideways_use_atr': True, 'sideways_use_adx': True, 'sideways_use_spike': False, 'sideways_rsi_required': False}.
[I 2025-08-30 21:32:56,477] Trial 358 finished with values: [-1000000000.0, 1000000000.0] and parameters: {'p_sma': 30, 'p_std': 34, 'p_atr': 21, 'p_adx': 15, 'rsi_period': 11, 'ema1': 6, 'ema2': 26, 'slip_atr_k': 0.05480088563965088, 'slip_spread_k': 0.8828695032950784, 'spread_hl_frac': 0.005527280401644499, 'bb_std_mult': 1.9958393656309479, 'rsi_os': 14, 'rsi_ob': 79, 'vol_spike': 0.14860924471528691, 'adx_thresh': 7.833011938243155, 'atr_min_pct': 0.01566158214751198, 'atr_max_pct': 0.034879137178128676, 'tp_mult': 2.518465025881321, 'tsl_mult': 0.9537145625014165, 'strategy': 'mean_reversion', 'time_stop': 8, 'use_sma': False, 'use_atr': False, 'use_adx': True, 'use_ema': False, 'use_spike': True, 'rsi_required': True, 'edge_k': 1.5692841424132489, 'edge_cap': 0.6040838245970408, 'bull_strategy': 'breakout', 'bull_bb_std_mult': 1.3196026267231615, 'bull_rsi_os': 17, 'bull_rsi_ob': 80, 'bull_adx_thresh': 30.375164538725365, 'bull_atr_min_pct': 0.001339240902090679, 'bull_atr_max_pct': 0.05532270297904027, 'bull_tp_mult': 2.3438424596838883, 'bull_tsl_mult': 0.39607530278327263, 'bull_time_stop': 69, 'bull_use_sma': True, 'bull_use_ema': True, 'bull_use_atr': False, 'bull_use_adx': True, 'bull_use_spike': True, 'bull_rsi_required': True, 'bear_strategy': 'mean_reversion', 'bear_bb_std_mult': 1.05898823395869, 'bear_rsi_os': 37, 'bear_rsi_ob': 52, 'bear_adx_thresh': 17.351311672014475, 'bear_atr_min_pct': 0.006170625752421133, 'bear_atr_max_pct': 0.08751806336513226, 'bear_tp_mult': 2.408440264314374, 'bear_tsl_mult': 0.4306553055427703, 'bear_time_stop': 96, 'bear_use_sma': True, 'bear_use_ema': True, 'bear_use_atr': False, 'bear_use_adx': True, 'bear_use_spike': True, 'bear_rsi_required': True, 'sideways_strategy': 'breakout', 'sideways_bb_std_mult': 1.5906859724512323, 'sideways_rsi_os': 37, 'sideways_rsi_ob': 73, 'sideways_adx_thresh': 10.865279756983284, 'sideways_atr_min_pct': 0.01798015065077796, 'sideways_atr_max_pct': 0.054879162794598216, 'sideways_tp_mult': 1.9950379054528942, 'sideways_tsl_mult': 0.4219441759660154, 'sideways_time_stop': 266, 'sideways_use_sma': False, 'sideways_use_ema': True, 'sideways_use_atr': True, 'sideways_use_adx': True, 'sideways_use_spike': False, 'sideways_rsi_required': False}.
