[I 2025-08-30 21:34:38,606] Trial 369 finished with values: [-1000000000.0, 1000000000.0] and parameters: {'p_sma': 29, 'p_std': 29, 'p_atr': 23, 'p_adx': 21, 'rsi_period': 71, 'ema1': 18, 'ema2': 57, 'slip_atr_k': 0.02258538643143055, 'slip_spread_k': 0.46459158016128593, 'spread_hl_frac': 0.027612997867036276, 'bb_std_mult': 1.4598892409265596, 'rsi_os': 12, 'rsi_ob': 70, 'vol_spike': 0.2127464355796191, 'adx_thresh': 12.586444633571652, 'atr_min_pct': 0.012704933626201646, 'atr_max_pct': 0.0982063988034146, 'tp_mult': 1.8293859027888553, 'tsl_mult': 0.7187031627001452, 'strategy': 'breakout', 'time_stop': 132, 'use_sma': True, 'use_atr': True, 'use_adx': False, 'use_ema': True, 'use_spike': False, 'rsi_required': False, 'edge_k': 1.1661970032733644, 'edge_cap': 0.6524979068381659, 'bull_strategy': 'breakout', 'bull_bb_std_mult': 2.4799970887874268, 'bull_rsi_os': 15, 'bull_rsi_ob': 86, 'bull_adx_thresh': 14.51556346498809, 'bull_atr_min_pct': 0.001918275334113868, 'bull_atr_max_pct': 0.04766595827402708, 'bull_tp_mult': 2.2413754189584876, 'bull_tsl_mult': 0.3746795803677745, 'bull_time_stop': 284, 'bull_use_sma': True, 'bull_use_ema': False, 'bull_use_atr': True, 'bull_use_adx': True, 'bull_use_spike': False, 'bull_rsi_required': False, 'bear_strategy': 'breakout', 'bear_bb_std_mult': 3.553511267510591, 'bear_rsi_os': 36, 'bear_rsi_ob': 74, 'bear_adx_thresh': 14.34662297087215, 'bear_atr_min_pct': 0.028643474567442807, 'bear_atr_max_pct': 0.013139601749031012, 'bear_tp_mult': 1.6867525604321292, 'bear_tsl_mult': 0.35678966050222916, 'bear_time_stop': 96, 'bear_use_sma': False, 'bear_use_ema': True, 'bear_use_atr': True, 'bear_use_adx': False, 'bear_use_spike': False, 'bear_rsi_required': False, 'sideways_strategy': 'mean_reversion', 'sideways_bb_std_mult': 1.1322750225992486, 'sideways_rsi_os': 38, 'sideways_rsi_ob': 87, 'sideways_adx_thresh': 28.049497737754493, 'sideways_atr_min_pct': 0.02260852894381128, 'sideways_atr_max_pct': 0.14827872919291896, 'sideways_tp_mult': 1.996707392232295, 'sideways_tsl_mult': 0.847031397986225, 'sideways_time_stop': 269, 'sideways_use_sma': True, 'sideways_use_ema': False, 'sideways_use_atr': False, 'sideways_use_adx': True, 'sideways_use_spike': True, 'sideways_rsi_required': False}.
[I 2025-08-30 21:34:38,607] Trial 371 finished with values: [-1000000000.0, 1000000000.0] and parameters: {'p_sma': 12, 'p_std': 33, 'p_atr': 19, 'p_adx': 24, 'rsi_period': 78, 'ema1': 18, 'ema2': 52, 'slip_atr_k': 0.02037327527705851, 'slip_spread_k': 0.6376289807014864, 'spread_hl_frac': 0.03464594131288229, 'bb_std_mult': 1.4788441467819378, 'rsi_os': 37, 'rsi_ob': 70, 'vol_spike': 0.19276194190139623, 'adx_thresh': 12.351393097664756, 'atr_min_pct': 0.008959196132222416, 'atr_max_pct': 0.09878776781280947, 'tp_mult': 1.6817878832765192, 'tsl_mult': 0.4175991787835243, 'strategy': 'mean_reversion', 'time_stop': 138, 'use_sma': True, 'use_atr': True, 'use_adx': False, 'use_ema': True, 'use_spike': False, 'rsi_required': False, 'edge_k': 1.3739089360397683, 'edge_cap': 0.6555525982270455, 'bull_strategy': 'mean_reversion', 'bull_bb_std_mult': 2.5849471923421334, 'bull_rsi_os': 15, 'bull_rsi_ob': 86, 'bull_adx_thresh': 21.19898084283745, 'bull_atr_min_pct': 0.023703390561841627, 'bull_atr_max_pct': 0.04219309628593601, 'bull_tp_mult': 2.231025685128697, 'bull_tsl_mult': 0.37047167407811116, 'bull_time_stop': 119, 'bull_use_sma': True, 'bull_use_ema': False, 'bull_use_atr': False, 'bull_use_adx': False, 'bull_use_spike': False, 'bull_rsi_required': False, 'bear_strategy': 'breakout', 'bear_bb_std_mult': 2.7229864121416485, 'bear_rsi_os': 35, 'bear_rsi_ob': 74, 'bear_adx_thresh': 13.671040922327816, 'bear_atr_min_pct': 0.02872314031769848, 'bear_atr_max_pct': 0.10701363644853286, 'bear_tp_mult': 1.4927283270170832, 'bear_tsl_mult': 0.35970896974281147, 'bear_time_stop': 103, 'bear_use_sma': False, 'bear_use_ema': True, 'bear_use_atr': True, 'bear_use_adx': True, 'bear_use_spike': False, 'bear_rsi_required': False, 'sideways_strategy': 'breakout', 'sideways_bb_std_mult': 2.3876818406558473, 'sideways_rsi_os': 38, 'sideways_rsi_ob': 83, 'sideways_adx_thresh': 27.9069006171773, 'sideways_atr_min_pct': 0.02247786961254639, 'sideways_atr_max_pct': 0.14934709167380775, 'sideways_tp_mult': 1.9911165252718754, 'sideways_tsl_mult': 0.6336053948361633, 'sideways_time_stop': 270, 'sideways_use_sma': True, 'sideways_use_ema': False, 'sideways_use_atr': False, 'sideways_use_adx': True, 'sideways_use_spike': True, 'sideways_rsi_required': False}.
[I 2025-08-30 21:34:38,773] Trial 372 finished with values: [-1000000000.0, 1000000000.0] and parameters: {'p_sma': 5, 'p_std': 58, 'p_atr': 22, 'p_adx': 20, 'rsi_period': 67, 'ema1': 18, 'ema2': 52, 'slip_atr_k': 0.020746089482424724, 'slip_spread_k': 0.6384809893169976, 'spread_hl_frac': 0.028574679534071397, 'bb_std_mult': 1.4577856306172565, 'rsi_os': 52, 'rsi_ob': 70, 'vol_spike': 0.28659207406254233, 'adx_thresh': 15.235828780224868, 'atr_min_pct': 0.008945716148816648, 'atr_max_pct': 0.09798700202129063, 'tp_mult': 1.6839164033936802, 'tsl_mult': 0.42869031973923194, 'strategy': 'breakout', 'time_stop': 160, 'use_sma': True, 'use_atr': True, 'use_adx': False, 'use_ema': True, 'use_spike': False, 'rsi_required': False, 'edge_k': 1.0966646993462885, 'edge_cap': 0.6551527080620976, 'bull_strategy': 'mean_reversion', 'bull_bb_std_mult': 2.5680832682973467, 'bull_rsi_os': 15, 'bull_rsi_ob': 94, 'bull_adx_thresh': 12.997569627675738, 'bull_atr_min_pct': 0.025956580388733334, 'bull_atr_max_pct': 0.040629024241908486, 'bull_tp_mult': 2.2214540885347143, 'bull_tsl_mult': 0.3721330811225349, 'bull_time_stop': 264, 'bull_use_sma': True, 'bull_use_ema': True, 'bull_use_atr': True, 'bull_use_adx': False, 'bull_use_spike': False, 'bull_rsi_required': True, 'bear_strategy': 'breakout', 'bear_bb_std_mult': 2.724759532364462, 'bear_rsi_os': 34, 'bear_rsi_ob': 78, 'bear_adx_thresh': 13.665186848632523, 'bear_atr_min_pct': 0.02863606183529128, 'bear_atr_max_pct': 0.04092139064012059, 'bear_tp_mult': 1.4884481728478094, 'bear_tsl_mult': 0.3837936029665957, 'bear_time_stop': 94, 'bear_use_sma': False, 'bear_use_ema': True, 'bear_use_atr': True, 'bear_use_adx': False, 'bear_use_spike': False, 'bear_rsi_required': False, 'sideways_strategy': 'breakout', 'sideways_bb_std_mult': 1.6936847903015324, 'sideways_rsi_os': 42, 'sideways_rsi_ob': 87, 'sideways_adx_thresh': 27.762946031301293, 'sideways_atr_min_pct': 0.023100702215160227, 'sideways_atr_max_pct': 0.13811865167494344, 'sideways_tp_mult': 2.0068951016485377, 'sideways_tsl_mult': 0.6516384014512018, 'sideways_time_stop': 264, 'sideways_use_sma': True, 'sideways_use_ema': False, 'sideways_use_atr': False, 'sideways_use_adx': True, 'sideways_use_spike': True, 'sideways_rsi_required': False}.
[I 2025-08-30 21:34:38,867] Trial 370 finished with values: [-1000000000.0, 1000000000.0] and parameters: {'p_sma': 17, 'p_std': 58, 'p_atr': 20, 'p_adx': 24, 'rsi_period': 73, 'ema1': 18, 'ema2': 52, 'slip_atr_k': 0.02005702100155897, 'slip_spread_k': 0.45850191405873175, 'spread_hl_frac': 0.029069076372707527, 'bb_std_mult': 1.4646375990705631, 'rsi_os': 12, 'rsi_ob': 70, 'vol_spike': 0.28571256948704155, 'adx_thresh': 17.665976611839486, 'atr_min_pct': 0.008961022916725453, 'atr_max_pct': 0.0982495541288952, 'tp_mult': 1.6972468150407451, 'tsl_mult': 0.1200271340485981, 'strategy': 'mean_reversion', 'time_stop': 155, 'use_sma': True, 'use_atr': True, 'use_adx': True, 'use_ema': True, 'use_spike': True, 'rsi_required': False, 'edge_k': 1.363787343740443, 'edge_cap': 0.6528308345639918, 'bull_strategy': 'mean_reversion', 'bull_bb_std_mult': 2.7321633192973986, 'bull_rsi_os': 15, 'bull_rsi_ob': 90, 'bull_adx_thresh': 13.139587174161944, 'bull_atr_min_pct': 0.023676098582331752, 'bull_atr_max_pct': 0.04332132205306144, 'bull_tp_mult': 2.2501291984532035, 'bull_tsl_mult': 0.3384698538169427, 'bull_time_stop': 119, 'bull_use_sma': True, 'bull_use_ema': False, 'bull_use_atr': False, 'bull_use_adx': False, 'bull_use_spike': False, 'bull_rsi_required': True, 'bear_strategy': 'breakout', 'bear_bb_std_mult': 3.533603259314237, 'bear_rsi_os': 34, 'bear_rsi_ob': 73, 'bear_adx_thresh': 14.418631606383556, 'bear_atr_min_pct': 0.029712789136693486, 'bear_atr_max_pct': 0.012660853632736668, 'bear_tp_mult': 1.579538291686857, 'bear_tsl_mult': 0.35363235768344004, 'bear_time_stop': 102, 'bear_use_sma': False, 'bear_use_ema': True, 'bear_use_atr': True, 'bear_use_adx': True, 'bear_use_spike': False, 'bear_rsi_required': True, 'sideways_strategy': 'breakout', 'sideways_bb_std_mult': 3.5996992495548654, 'sideways_rsi_os': 38, 'sideways_rsi_ob': 87, 'sideways_adx_thresh': 9.55095174134083, 'sideways_atr_min_pct': 0.02108933613974445, 'sideways_atr_max_pct': 0.14994672780517967, 'sideways_tp_mult': 1.8877070854838882, 'sideways_tsl_mult': 0.6185117831860368, 'sideways_time_stop': 264, 'sideways_use_sma': True, 'sideways_use_ema': False, 'sideways_use_atr': False, 'sideways_use_adx': True, 'sideways_use_spike': True, 'sideways_rsi_required': False}.
[I 2025-08-30 21:35:13,004] Trial 375 finished with values: [-1000000000.0, 1000000000.0] and parameters: {'p_sma': 51, 'p_std': 36, 'p_atr': 21, 'p_adx': 23, 'rsi_period': 81, 'ema1': 7, 'ema2': 50, 'slip_atr_k': 0.025171523436052733, 'slip_spread_k': 0.43780984773103254, 'spread_hl_frac': 0.029234854868769825, 'bb_std_mult': 1.4528472853597378, 'rsi_os': 21, 'rsi_ob': 62, 'vol_spike': 0.28435112932316414, 'adx_thresh': 16.83482222071576, 'atr_min_pct': 0.01164220813557842, 'atr_max_pct': 0.10331380681349332, 'tp_mult': 1.6928246713413864, 'tsl_mult': 0.8727456185157565, 'strategy': 'mean_reversion', 'time_stop': 177, 'use_sma': True, 'use_atr': True, 'use_adx': True, 'use_ema': False, 'use_spike': True, 'rsi_required': True, 'edge_k': 1.1170288894153473, 'edge_cap': 0.6442302925804423, 'bull_strategy': 'breakout', 'bull_bb_std_mult': 2.362839204184971, 'bull_rsi_os': 16, 'bull_rsi_ob': 95, 'bull_adx_thresh': 22.936100814364078, 'bull_atr_min_pct': 0.008204036858360266, 'bull_atr_max_pct': 0.04328716154865138, 'bull_tp_mult': 2.275733495852544, 'bull_tsl_mult': 0.33785149728704605, 'bull_time_stop': 288, 'bull_use_sma': True, 'bull_use_ema': False, 'bull_use_atr': False, 'bull_use_adx': True, 'bull_use_spike': False, 'bull_rsi_required': True, 'bear_strategy': 'mean_reversion', 'bear_bb_std_mult': 2.6031224152598145, 'bear_rsi_os': 37, 'bear_rsi_ob': 79, 'bear_adx_thresh': 14.667108588324872, 'bear_atr_min_pct': 0.029666342220480747, 'bear_atr_max_pct': 0.09815088927791986, 'bear_tp_mult': 1.5869626535837988, 'bear_tsl_mult': 0.38791256931956575, 'bear_time_stop': 91, 'bear_use_sma': False, 'bear_use_ema': True, 'bear_use_atr': False, 'bear_use_adx': True, 'bear_use_spike': True, 'bear_rsi_required': True, 'sideways_strategy': 'breakout', 'sideways_bb_std_mult': 2.0663157165980093, 'sideways_rsi_os': 34, 'sideways_rsi_ob': 84, 'sideways_adx_thresh': 27.280279065144267, 'sideways_atr_min_pct': 0.01850747322808828, 'sideways_atr_max_pct': 0.14638965603322007, 'sideways_tp_mult': 1.899106976561686, 'sideways_tsl_mult': 0.7340183162563498, 'sideways_time_stop': 77, 'sideways_use_sma': False, 'sideways_use_ema': False, 'sideways_use_atr': False, 'sideways_use_adx': True, 'sideways_use_spike': False, 'sideways_rsi_required': False}.
[I 2025-08-30 21:35:13,202] Trial 373 finished with values: [-1000000000.0, 1000000000.0] and parameters: {'p_sma': 17, 'p_std': 36, 'p_atr': 20, 'p_adx': 20, 'rsi_period': 67, 'ema1': 19, 'ema2': 50, 'slip_atr_k': 0.019176493644848216, 'slip_spread_k': 0.6309074023273756, 'spread_hl_frac': 0.028941213492379488, 'bb_std_mult': 1.4689116299341656, 'rsi_os': 22, 'rsi_ob': 64, 'vol_spike': 0.2852973837822829, 'adx_thresh': 15.465920364206667, 'atr_min_pct': 0.007396357731715158, 'atr_max_pct': 0.10505624619791065, 'tp_mult': 1.6891463500712125, 'tsl_mult': 0.8724111915745945, 'strategy': 'mean_reversion', 'time_stop': 163, 'use_sma': True, 'use_atr': True, 'use_adx': True, 'use_ema': False, 'use_spike': True, 'rsi_required': True, 'edge_k': 1.0778989364675033, 'edge_cap': 0.6480974581697146, 'bull_strategy': 'mean_reversion', 'bull_bb_std_mult': 2.6309136040063392, 'bull_rsi_os': 15, 'bull_rsi_ob': 93, 'bull_adx_thresh': 32.681711552649006, 'bull_atr_min_pct': 0.025893588122809834, 'bull_atr_max_pct': 0.044480253561737966, 'bull_tp_mult': 2.222644468966501, 'bull_tsl_mult': 0.34216085756880565, 'bull_time_stop': 288, 'bull_use_sma': True, 'bull_use_ema': True, 'bull_use_atr': False, 'bull_use_adx': False, 'bull_use_spike': False, 'bull_rsi_required': True, 'bear_strategy': 'mean_reversion', 'bear_bb_std_mult': 3.1284296205865987, 'bear_rsi_os': 34, 'bear_rsi_ob': 77, 'bear_adx_thresh': 13.561937208660181, 'bear_atr_min_pct': 0.0299777876081739, 'bear_atr_max_pct': 0.018004163203323948, 'bear_tp_mult': 1.471243622305669, 'bear_tsl_mult': 0.38507816308014015, 'bear_time_stop': 93, 'bear_use_sma': False, 'bear_use_ema': True, 'bear_use_atr': False, 'bear_use_adx': True, 'bear_use_spike': True, 'bear_rsi_required': True, 'sideways_strategy': 'breakout', 'sideways_bb_std_mult': 1.8942393775177766, 'sideways_rsi_os': 34, 'sideways_rsi_ob': 87, 'sideways_adx_thresh': 7.130806839769814, 'sideways_atr_min_pct': 0.018548924572826822, 'sideways_atr_max_pct': 0.14646731974576943, 'sideways_tp_mult': 2.012306086347863, 'sideways_tsl_mult': 0.6643758223789122, 'sideways_time_stop': 261, 'sideways_use_sma': False, 'sideways_use_ema': False, 'sideways_use_atr': False, 'sideways_use_adx': True, 'sideways_use_spike': False, 'sideways_rsi_required': False}.
[I 2025-08-30 21:35:13,496] Trial 374 finished with values: [-1000000000.0, 1000000000.0] and parameters: {'p_sma': 49, 'p_std': 36, 'p_atr': 20, 'p_adx': 20, 'rsi_period': 80, 'ema1': 18, 'ema2': 49, 'slip_atr_k': 0.024673232730383576, 'slip_spread_k': 0.6290074542169731, 'spread_hl_frac': 0.028412927203880046, 'bb_std_mult': 1.4917211029463764, 'rsi_os': 8, 'rsi_ob': 61, 'vol_spike': 0.28353305230974374, 'adx_thresh': 15.468323682292066, 'atr_min_pct': 0.009886522398677752, 'atr_max_pct': 0.10671546631251395, 'tp_mult': 1.6915480736752853, 'tsl_mult': 0.3867268211906749, 'strategy': 'mean_reversion', 'time_stop': 185, 'use_sma': True, 'use_atr': True, 'use_adx': True, 'use_ema': False, 'use_spike': True, 'rsi_required': True, 'edge_k': 1.1085761103063736, 'edge_cap': 0.6483049911418152, 'bull_strategy': 'mean_reversion', 'bull_bb_std_mult': 2.5396932775585164, 'bull_rsi_os': 15, 'bull_rsi_ob': 94, 'bull_adx_thresh': 13.299457974472325, 'bull_atr_min_pct': 0.001817438513225717, 'bull_atr_max_pct': 0.043324192990494774, 'bull_tp_mult': 2.160196393729839, 'bull_tsl_mult': 0.3453031247373268, 'bull_time_stop': 265, 'bull_use_sma': True, 'bull_use_ema': True, 'bull_use_atr': False, 'bull_use_adx': False, 'bull_use_spike': False, 'bull_rsi_required': True, 'bear_strategy': 'mean_reversion', 'bear_bb_std_mult': 3.1887587656807455, 'bear_rsi_os': 34, 'bear_rsi_ob': 78, 'bear_adx_thresh': 12.490331399107099, 'bear_atr_min_pct': 0.029342696483503752, 'bear_atr_max_pct': 0.059109576111907425, 'bear_tp_mult': 1.588715661672409, 'bear_tsl_mult': 0.31932083930184163, 'bear_time_stop': 93, 'bear_use_sma': False, 'bear_use_ema': True, 'bear_use_atr': False, 'bear_use_adx': True, 'bear_use_spike': True, 'bear_rsi_required': True, 'sideways_strategy': 'breakout', 'sideways_bb_std_mult': 1.9124579810994915, 'sideways_rsi_os': 21, 'sideways_rsi_ob': 87, 'sideways_adx_thresh': 27.402886132999356, 'sideways_atr_min_pct': 0.018733981634607457, 'sideways_atr_max_pct': 0.14648436171521514, 'sideways_tp_mult': 1.8996471692072783, 'sideways_tsl_mult': 0.663368345198937, 'sideways_time_stop': 261, 'sideways_use_sma': False, 'sideways_use_ema': False, 'sideways_use_atr': False, 'sideways_use_adx': True, 'sideways_use_spike': False, 'sideways_rsi_required': False}.
[I 2025-08-30 21:35:13,604] Trial 376 finished with values: [-1000000000.0, 1000000000.0] and parameters: {'p_sma': 32, 'p_std': 33, 'p_atr': 18, 'p_adx': 22, 'rsi_period': 80, 'ema1': 9, 'ema2': 49, 'slip_atr_k': 0.02365265571783948, 'slip_spread_k': 0.4788113127606766, 'spread_hl_frac': 0.03392761556904818, 'bb_std_mult': 1.4521274712871337, 'rsi_os': 8, 'rsi_ob': 64, 'vol_spike': 0.2894590686364955, 'adx_thresh': 14.083411101216768, 'atr_min_pct': 0.014268940012314685, 'atr_max_pct': 0.10619516457900903, 'tp_mult': 1.698206559909874, 'tsl_mult': 0.8726870782159382, 'strategy': 'mean_reversion', 'time_stop': 174, 'use_sma': True, 'use_atr': False, 'use_adx': True, 'use_ema': False, 'use_spike': True, 'rsi_required': True, 'edge_k': 1.4259447354159769, 'edge_cap': 0.6471526080631336, 'bull_strategy': 'breakout', 'bull_bb_std_mult': 2.3543800766749197, 'bull_rsi_os': 50, 'bull_rsi_ob': 81, 'bull_adx_thresh': 32.8130945699638, 'bull_atr_min_pct': 0.019387519781283388, 'bull_atr_max_pct': 0.0440818331509288, 'bull_tp_mult': 2.167454989219848, 'bull_tsl_mult': 0.34567695992249364, 'bull_time_stop': 246, 'bull_use_sma': True, 'bull_use_ema': True, 'bull_use_atr': False, 'bull_use_adx': True, 'bull_use_spike': False, 'bull_rsi_required': True, 'bear_strategy': 'mean_reversion', 'bear_bb_std_mult': 2.608578621296153, 'bear_rsi_os': 37, 'bear_rsi_ob': 79, 'bear_adx_thresh': 14.526343608507016, 'bear_atr_min_pct': 0.029843372725642702, 'bear_atr_max_pct': 0.01846925136736211, 'bear_tp_mult': 1.6569168819895128, 'bear_tsl_mult': 0.38536597970911035, 'bear_time_stop': 95, 'bear_use_sma': False, 'bear_use_ema': True, 'bear_use_atr': False, 'bear_use_adx': True, 'bear_use_spike': True, 'bear_rsi_required': True, 'sideways_strategy': 'breakout', 'sideways_bb_std_mult': 1.7206215899895667, 'sideways_rsi_os': 39, 'sideways_rsi_ob': 84, 'sideways_adx_thresh': 27.119900385543172, 'sideways_atr_min_pct': 0.01836499444593714, 'sideways_atr_max_pct': 0.1464287399958754, 'sideways_tp_mult': 1.9599721595568778, 'sideways_tsl_mult': 0.5896035868920961, 'sideways_time_stop': 76, 'sideways_use_sma': False, 'sideways_use_ema': False, 'sideways_use_atr': False, 'sideways_use_adx': True, 'sideways_use_spike': False, 'sideways_rsi_required': False}.
[I 2025-08-30 21:35:46,581] Trial 380 finished with values: [-1000000000.0, 1000000000.0] and parameters: {'p_sma': 33, 'p_std': 34, 'p_atr': 22, 'p_adx': 19, 'rsi_period': 69, 'ema1': 29, 'ema2': 55, 'slip_atr_k': 0.01491562442864703, 'slip_spread_k': 0.6143082538749314, 'spread_hl_frac': 0.030330542710099842, 'bb_std_mult': 1.3659828789641113, 'rsi_os': 9, 'rsi_ob': 66, 'vol_spike': 0.053340157983285605, 'adx_thresh': 20.15955925370031, 'atr_min_pct': 0.01358629218960273, 'atr_max_pct': 0.09724705133952341, 'tp_mult': 2.359948807262339, 'tsl_mult': 0.8278582669169544, 'strategy': 'breakout', 'time_stop': 140, 'use_sma': True, 'use_atr': False, 'use_adx': True, 'use_ema': True, 'use_spike': True, 'rsi_required': True, 'edge_k': 1.2964104797355915, 'edge_cap': 0.6838505147904835, 'bull_strategy': 'breakout', 'bull_bb_std_mult': 2.861192158500548, 'bull_rsi_os': 35, 'bull_rsi_ob': 84, 'bull_adx_thresh': 14.874125152153226, 'bull_atr_min_pct': 0.011780643416501996, 'bull_atr_max_pct': 0.04914604233452288, 'bull_tp_mult': 2.2991012309944865, 'bull_tsl_mult': 0.3750609389409635, 'bull_time_stop': 166, 'bull_use_sma': True, 'bull_use_ema': False, 'bull_use_atr': True, 'bull_use_adx': True, 'bull_use_spike': False, 'bull_rsi_required': True, 'bear_strategy': 'mean_reversion', 'bear_bb_std_mult': 2.3970315978656056, 'bear_rsi_os': 32, 'bear_rsi_ob': 75, 'bear_adx_thresh': 14.632873239842901, 'bear_atr_min_pct': 0.027821630385758352, 'bear_atr_max_pct': 0.01536097312782543, 'bear_tp_mult': 1.5254490803195853, 'bear_tsl_mult': 0.3620538831925448, 'bear_time_stop': 103, 'bear_use_sma': False, 'bear_use_ema': True, 'bear_use_atr': False, 'bear_use_adx': False, 'bear_use_spike': True, 'bear_rsi_required': True, 'sideways_strategy': 'breakout', 'sideways_bb_std_mult': 3.232211138994885, 'sideways_rsi_os': 9, 'sideways_rsi_ob': 82, 'sideways_adx_thresh': 29.770520011383326, 'sideways_atr_min_pct': 0.02029640544634608, 'sideways_atr_max_pct': 0.13924598551095058, 'sideways_tp_mult': 2.0360727561487564, 'sideways_tsl_mult': 0.9488285857615227, 'sideways_time_stop': 272, 'sideways_use_sma': False, 'sideways_use_ema': False, 'sideways_use_atr': False, 'sideways_use_adx': True, 'sideways_use_spike': False, 'sideways_rsi_required': False}.
