[I 2025-08-30 22:00:34,629] Trial 585 finished with values: [-1000000000.0, 1000000000.0] and parameters: {'p_sma': 32, 'p_std': 24, 'p_atr': 21, 'p_adx': 23, 'rsi_period': 72, 'ema1': 7, 'ema2': 39, 'slip_atr_k': 0.0346280901651113, 'slip_spread_k': 0.6746701707830303, 'spread_hl_frac': 0.04525271505083771, 'bb_std_mult': 0.7616632263582936, 'rsi_os': 14, 'rsi_ob': 65, 'vol_spike': 0.0886826354996751, 'adx_thresh': 10.82852579235008, 'atr_min_pct': 0.01411050610068669, 'atr_max_pct': 0.024061146905140995, 'tp_mult': 1.5696831121007682, 'tsl_mult': 0.26143675048397774, 'strategy': 'mean_reversion', 'time_stop': 91, 'use_sma': True, 'use_atr': True, 'use_adx': True, 'use_ema': False, 'use_spike': True, 'rsi_required': True, 'edge_k': 0.1840686880468878, 'edge_cap': 0.7963883999185832, 'bull_strategy': 'breakout', 'bull_bb_std_mult': 1.8526687306851484, 'bull_rsi_os': 16, 'bull_rsi_ob': 49, 'bull_adx_thresh': 31.33428060028735, 'bull_atr_min_pct': 0.0010791975616697526, 'bull_atr_max_pct': 0.05624866263460824, 'bull_tp_mult': 2.7146054102678026, 'bull_tsl_mult': 0.47427966172446606, 'bull_time_stop': 135, 'bull_use_sma': False, 'bull_use_ema': False, 'bull_use_atr': False, 'bull_use_adx': False, 'bull_use_spike': False, 'bull_rsi_required': True, 'bear_strategy': 'breakout', 'bear_bb_std_mult': 3.599784417262816, 'bear_rsi_os': 11, 'bear_rsi_ob': 74, 'bear_adx_thresh': 8.655570347630373, 'bear_atr_min_pct': 0.02941711699718254, 'bear_atr_max_pct': 0.06696850453190627, 'bear_tp_mult': 1.1154475245745763, 'bear_tsl_mult': 0.41081123257279106, 'bear_time_stop': 223, 'bear_use_sma': False, 'bear_use_ema': True, 'bear_use_atr': False, 'bear_use_adx': False, 'bear_use_spike': True, 'bear_rsi_required': True, 'sideways_strategy': 'breakout', 'sideways_bb_std_mult': 1.863327732556378, 'sideways_rsi_os': 41, 'sideways_rsi_ob': 91, 'sideways_adx_thresh': 6.37316742167166, 'sideways_atr_min_pct': 0.01946957286708206, 'sideways_atr_max_pct': 0.065600112229854, 'sideways_tp_mult': 1.7433741404751348, 'sideways_tsl_mult': 0.7392251252902333, 'sideways_time_stop': 266, 'sideways_use_sma': False, 'sideways_use_ema': False, 'sideways_use_atr': False, 'sideways_use_adx': True, 'sideways_use_spike': False, 'sideways_rsi_required': False}.
[I 2025-08-30 22:00:34,868] Trial 586 finished with values: [-1000000000.0, 1000000000.0] and parameters: {'p_sma': 32, 'p_std': 36, 'p_atr': 21, 'p_adx': 12, 'rsi_period': 59, 'ema1': 29, 'ema2': 52, 'slip_atr_k': 0.03291777075589416, 'slip_spread_k': 0.6555679121480451, 'spread_hl_frac': 0.035657358528584725, 'bb_std_mult': 0.7295983562152561, 'rsi_os': 11, 'rsi_ob': 69, 'vol_spike': 0.09299560107817169, 'adx_thresh': 12.145672850125042, 'atr_min_pct': 0.013838823261913557, 'atr_max_pct': 0.024280236833711128, 'tp_mult': 1.5700920927232513, 'tsl_mult': 0.7887088865163948, 'strategy': 'mean_reversion', 'time_stop': 81, 'use_sma': True, 'use_atr': True, 'use_adx': True, 'use_ema': False, 'use_spike': True, 'rsi_required': True, 'edge_k': 1.1639635864223252, 'edge_cap': 0.7998856289808609, 'bull_strategy': 'breakout', 'bull_bb_std_mult': 1.9525539887345762, 'bull_rsi_os': 16, 'bull_rsi_ob': 86, 'bull_adx_thresh': 22.082901362356314, 'bull_atr_min_pct': 0.0011260042188813773, 'bull_atr_max_pct': 0.05679289420371712, 'bull_tp_mult': 1.2157044889783164, 'bull_tsl_mult': 4.1128275558743876e-05, 'bull_time_stop': 146, 'bull_use_sma': False, 'bull_use_ema': True, 'bull_use_atr': False, 'bull_use_adx': False, 'bull_use_spike': False, 'bull_rsi_required': True, 'bear_strategy': 'breakout', 'bear_bb_std_mult': 1.9287500415608034, 'bear_rsi_os': 7, 'bear_rsi_ob': 74, 'bear_adx_thresh': 25.368324816375846, 'bear_atr_min_pct': 0.011698917028035903, 'bear_atr_max_pct': 0.11625235671416986, 'bear_tp_mult': 1.9102038226530798, 'bear_tsl_mult': 0.4006534068393703, 'bear_time_stop': 224, 'bear_use_sma': False, 'bear_use_ema': True, 'bear_use_atr': False, 'bear_use_adx': False, 'bear_use_spike': True, 'bear_rsi_required': True, 'sideways_strategy': 'mean_reversion', 'sideways_bb_std_mult': 1.858743713210993, 'sideways_rsi_os': 41, 'sideways_rsi_ob': 49, 'sideways_adx_thresh': 27.882763142839913, 'sideways_atr_min_pct': 0.022718571945702013, 'sideways_atr_max_pct': 0.03761391064187215, 'sideways_tp_mult': 1.759071658377912, 'sideways_tsl_mult': 0.7381515775774277, 'sideways_time_stop': 268, 'sideways_use_sma': False, 'sideways_use_ema': False, 'sideways_use_atr': False, 'sideways_use_adx': True, 'sideways_use_spike': False, 'sideways_rsi_required': False}.
[I 2025-08-30 22:00:35,401] Trial 587 finished with values: [-1000000000.0, 1000000000.0] and parameters: {'p_sma': 34, 'p_std': 36, 'p_atr': 21, 'p_adx': 22, 'rsi_period': 54, 'ema1': 29, 'ema2': 27, 'slip_atr_k': 0.08854766902768682, 'slip_spread_k': 0.6537979543940894, 'spread_hl_frac': 0.035647544616606686, 'bb_std_mult': 0.6806183583574664, 'rsi_os': 12, 'rsi_ob': 69, 'vol_spike': 0.20393203894617148, 'adx_thresh': 21.201793232866375, 'atr_min_pct': 0.013994403972861839, 'atr_max_pct': 0.07721738195444747, 'tp_mult': 1.5768873172756326, 'tsl_mult': 0.34768939703791246, 'strategy': 'mean_reversion', 'time_stop': 287, 'use_sma': True, 'use_atr': True, 'use_adx': False, 'use_ema': False, 'use_spike': False, 'rsi_required': True, 'edge_k': 0.5110833555352865, 'edge_cap': 0.8406216692531878, 'bull_strategy': 'breakout', 'bull_bb_std_mult': 1.9527726981980054, 'bull_rsi_os': 48, 'bull_rsi_ob': 49, 'bull_adx_thresh': 11.434565912870397, 'bull_atr_min_pct': 0.0010519085698240615, 'bull_atr_max_pct': 0.02588269558121628, 'bull_tp_mult': 1.4468900256978223, 'bull_tsl_mult': 0.20605241776989008, 'bull_time_stop': 256, 'bull_use_sma': False, 'bull_use_ema': True, 'bull_use_atr': False, 'bull_use_adx': False, 'bull_use_spike': False, 'bull_rsi_required': True, 'bear_strategy': 'breakout', 'bear_bb_std_mult': 3.5951753008487115, 'bear_rsi_os': 8, 'bear_rsi_ob': 74, 'bear_adx_thresh': 32.90107529310008, 'bear_atr_min_pct': 0.021049040164192467, 'bear_atr_max_pct': 0.11683619541655497, 'bear_tp_mult': 1.5779738221023274, 'bear_tsl_mult': 0.8099054530309908, 'bear_time_stop': 220, 'bear_use_sma': False, 'bear_use_ema': True, 'bear_use_atr': False, 'bear_use_adx': False, 'bear_use_spike': False, 'bear_rsi_required': True, 'sideways_strategy': 'mean_reversion', 'sideways_bb_std_mult': 1.8332294917036014, 'sideways_rsi_os': 32, 'sideways_rsi_ob': 87, 'sideways_adx_thresh': 27.635005738377462, 'sideways_atr_min_pct': 0.022690186011168498, 'sideways_atr_max_pct': 0.03710811140933924, 'sideways_tp_mult': 1.850760862741707, 'sideways_tsl_mult': 0.7963187040911355, 'sideways_time_stop': 270, 'sideways_use_sma': True, 'sideways_use_ema': False, 'sideways_use_atr': False, 'sideways_use_adx': True, 'sideways_use_spike': True, 'sideways_rsi_required': False}.
[I 2025-08-30 22:00:35,954] Trial 588 finished with values: [-1000000000.0, 1000000000.0] and parameters: {'p_sma': 35, 'p_std': 37, 'p_atr': 23, 'p_adx': 7, 'rsi_period': 72, 'ema1': 26, 'ema2': 35, 'slip_atr_k': 0.033508729873320875, 'slip_spread_k': 0.20140902415469875, 'spread_hl_frac': 0.018978432737913706, 'bb_std_mult': 0.7595918773853878, 'rsi_os': 14, 'rsi_ob': 53, 'vol_spike': 0.2731458613981891, 'adx_thresh': 25.175507950092985, 'atr_min_pct': 0.013947989877328176, 'atr_max_pct': 0.07088874997938886, 'tp_mult': 1.5470801532958642, 'tsl_mult': 0.4687956219900211, 'strategy': 'mean_reversion', 'time_stop': 91, 'use_sma': True, 'use_atr': False, 'use_adx': False, 'use_ema': False, 'use_spike': False, 'rsi_required': True, 'edge_k': 1.08308642946953, 'edge_cap': 0.8444305452302328, 'bull_strategy': 'breakout', 'bull_bb_std_mult': 1.9412205687048858, 'bull_rsi_os': 18, 'bull_rsi_ob': 87, 'bull_adx_thresh': 28.713355041499476, 'bull_atr_min_pct': 0.0010753100188741396, 'bull_atr_max_pct': 0.0406103794718687, 'bull_tp_mult': 1.1487349139538412, 'bull_tsl_mult': 0.14450224574794035, 'bull_time_stop': 295, 'bull_use_sma': False, 'bull_use_ema': True, 'bull_use_atr': False, 'bull_use_adx': False, 'bull_use_spike': False, 'bull_rsi_required': True, 'bear_strategy': 'breakout', 'bear_bb_std_mult': 2.1912101993603894, 'bear_rsi_os': 7, 'bear_rsi_ob': 74, 'bear_adx_thresh': 25.257394001918623, 'bear_atr_min_pct': 0.029348225801430712, 'bear_atr_max_pct': 0.11679826218741912, 'bear_tp_mult': 1.2570774022314808, 'bear_tsl_mult': 0.44261856282433437, 'bear_time_stop': 233, 'bear_use_sma': False, 'bear_use_ema': True, 'bear_use_atr': False, 'bear_use_adx': False, 'bear_use_spike': False, 'bear_rsi_required': True, 'sideways_strategy': 'mean_reversion', 'sideways_bb_std_mult': 1.1605313668228465, 'sideways_rsi_os': 38, 'sideways_rsi_ob': 91, 'sideways_adx_thresh': 18.59621323223517, 'sideways_atr_min_pct': 0.005061104140835403, 'sideways_atr_max_pct': 0.03431123073055916, 'sideways_tp_mult': 1.8486566938654376, 'sideways_tsl_mult': 0.24112260805921448, 'sideways_time_stop': 266, 'sideways_use_sma': True, 'sideways_use_ema': False, 'sideways_use_atr': False, 'sideways_use_adx': True, 'sideways_use_spike': True, 'sideways_rsi_required': False}.
[I 2025-08-30 22:00:36,815] Trial 589 finished with values: [-1000000000.0, 1000000000.0] and parameters: {'p_sma': 34, 'p_std': 37, 'p_atr': 23, 'p_adx': 22, 'rsi_period': 51, 'ema1': 12, 'ema2': 23, 'slip_atr_k': 0.10323809070759765, 'slip_spread_k': 0.1953435369626229, 'spread_hl_frac': 0.0356441592391444, 'bb_std_mult': 1.0025024590568576, 'rsi_os': 52, 'rsi_ob': 69, 'vol_spike': 0.2771901115180838, 'adx_thresh': 33.74030343795967, 'atr_min_pct': 0.011046009941330606, 'atr_max_pct': 0.02848801083671726, 'tp_mult': 2.6317317628795527, 'tsl_mult': 0.3391800909125804, 'strategy': 'mean_reversion', 'time_stop': 82, 'use_sma': True, 'use_atr': False, 'use_adx': False, 'use_ema': False, 'use_spike': False, 'rsi_required': True, 'edge_k': 1.090522300760491, 'edge_cap': 0.8314022949423606, 'bull_strategy': 'mean_reversion', 'bull_bb_std_mult': 1.9430444831344724, 'bull_rsi_os': 18, 'bull_rsi_ob': 87, 'bull_adx_thresh': 28.74912425953567, 'bull_atr_min_pct': 0.023876465424947042, 'bull_atr_max_pct': 0.06412106929981293, 'bull_tp_mult': 1.3130885385331825, 'bull_tsl_mult': 0.37617376102690553, 'bull_time_stop': 295, 'bull_use_sma': False, 'bull_use_ema': True, 'bull_use_atr': False, 'bull_use_adx': False, 'bull_use_spike': False, 'bull_rsi_required': True, 'bear_strategy': 'breakout', 'bear_bb_std_mult': 2.1793611899620102, 'bear_rsi_os': 7, 'bear_rsi_ob': 73, 'bear_adx_thresh': 32.7785680736901, 'bear_atr_min_pct': 0.020664078289567036, 'bear_atr_max_pct': 0.056639738152080524, 'bear_tp_mult': 1.380645518467385, 'bear_tsl_mult': 0.4484427145146342, 'bear_time_stop': 236, 'bear_use_sma': False, 'bear_use_ema': True, 'bear_use_atr': False, 'bear_use_adx': False, 'bear_use_spike': False, 'bear_rsi_required': True, 'sideways_strategy': 'mean_reversion', 'sideways_bb_std_mult': 2.8795110576056784, 'sideways_rsi_os': 38, 'sideways_rsi_ob': 72, 'sideways_adx_thresh': 27.636483348131495, 'sideways_atr_min_pct': 0.02077547725557244, 'sideways_atr_max_pct': 0.03523035053776407, 'sideways_tp_mult': 1.8436700893974949, 'sideways_tsl_mult': 0.7995997769261257, 'sideways_time_stop': 61, 'sideways_use_sma': True, 'sideways_use_ema': False, 'sideways_use_atr': False, 'sideways_use_adx': True, 'sideways_use_spike': True, 'sideways_rsi_required': False}.
[I 2025-08-30 22:00:36,844] Trial 590 finished with values: [-1000000000.0, 1000000000.0] and parameters: {'p_sma': 35, 'p_std': 54, 'p_atr': 20, 'p_adx': 22, 'rsi_period': 54, 'ema1': 26, 'ema2': 56, 'slip_atr_k': 0.042504181544122235, 'slip_spread_k': 0.6465147847188366, 'spread_hl_frac': 0.032920373635139014, 'bb_std_mult': 0.6733686149253925, 'rsi_os': 52, 'rsi_ob': 53, 'vol_spike': 0.2773770689533967, 'adx_thresh': 10.02458141590639, 'atr_min_pct': 0.01149286534512568, 'atr_max_pct': 0.012641036227170274, 'tp_mult': 2.6309700030592587, 'tsl_mult': 0.35089488703946065, 'strategy': 'mean_reversion', 'time_stop': 91, 'use_sma': True, 'use_atr': False, 'use_adx': False, 'use_ema': True, 'use_spike': False, 'rsi_required': True, 'edge_k': 0.43783949483716267, 'edge_cap': 0.8447661856870962, 'bull_strategy': 'mean_reversion', 'bull_bb_std_mult': 0.9850422040355276, 'bull_rsi_os': 18, 'bull_rsi_ob': 87, 'bull_adx_thresh': 10.378822260387546, 'bull_atr_min_pct': 3.2802797064038214e-05, 'bull_atr_max_pct': 0.025642778463467145, 'bull_tp_mult': 1.3190813083179556, 'bull_tsl_mult': 0.3727609852687912, 'bull_time_stop': 295, 'bull_use_sma': True, 'bull_use_ema': True, 'bull_use_atr': False, 'bull_use_adx': False, 'bull_use_spike': False, 'bull_rsi_required': True, 'bear_strategy': 'mean_reversion', 'bear_bb_std_mult': 2.1782163013403624, 'bear_rsi_os': 25, 'bear_rsi_ob': 71, 'bear_adx_thresh': 32.8929148214157, 'bear_atr_min_pct': 0.005506221424456597, 'bear_atr_max_pct': 0.05663093982045102, 'bear_tp_mult': 1.5802625936701473, 'bear_tsl_mult': 0.4467143748458123, 'bear_time_stop': 234, 'bear_use_sma': False, 'bear_use_ema': True, 'bear_use_atr': False, 'bear_use_adx': True, 'bear_use_spike': False, 'bear_rsi_required': True, 'sideways_strategy': 'mean_reversion', 'sideways_bb_std_mult': 1.7669647891913884, 'sideways_rsi_os': 38, 'sideways_rsi_ob': 87, 'sideways_adx_thresh': 18.716978727496482, 'sideways_atr_min_pct': 0.02076550885216668, 'sideways_atr_max_pct': 0.040164458714948094, 'sideways_tp_mult': 1.845173707630585, 'sideways_tsl_mult': 0.803337288257016, 'sideways_time_stop': 250, 'sideways_use_sma': True, 'sideways_use_ema': False, 'sideways_use_atr': False, 'sideways_use_adx': True, 'sideways_use_spike': True, 'sideways_rsi_required': False}.
[I 2025-08-30 22:00:36,896] Trial 592 finished with values: [-1000000000.0, 1000000000.0] and parameters: {'p_sma': 35, 'p_std': 54, 'p_atr': 20, 'p_adx': 27, 'rsi_period': 74, 'ema1': 15, 'ema2': 23, 'slip_atr_k': 0.027565978753891884, 'slip_spread_k': 0.6246453893527033, 'spread_hl_frac': 0.03423458163212382, 'bb_std_mult': 0.6401931615077217, 'rsi_os': 35, 'rsi_ob': 46, 'vol_spike': 0.27871980481553194, 'adx_thresh': 9.98160841576853, 'atr_min_pct': 0.011864330464616029, 'atr_max_pct': 0.029381323357364663, 'tp_mult': 2.9235045068097416, 'tsl_mult': 0.580925643847003, 'strategy': 'mean_reversion', 'time_stop': 82, 'use_sma': True, 'use_atr': False, 'use_adx': True, 'use_ema': True, 'use_spike': True, 'rsi_required': True, 'edge_k': 1.6444627481289187, 'edge_cap': 0.8226206062562287, 'bull_strategy': 'mean_reversion', 'bull_bb_std_mult': 0.9634420262743901, 'bull_rsi_os': 18, 'bull_rsi_ob': 59, 'bull_adx_thresh': 10.235752012334228, 'bull_atr_min_pct': 0.011909786572863852, 'bull_atr_max_pct': 0.07654426229850617, 'bull_tp_mult': 1.4272958289597595, 'bull_tsl_mult': 0.44042739570701717, 'bull_time_stop': 295, 'bull_use_sma': True, 'bull_use_ema': False, 'bull_use_atr': False, 'bull_use_adx': False, 'bull_use_spike': False, 'bull_rsi_required': True, 'bear_strategy': 'mean_reversion', 'bear_bb_std_mult': 1.8514850744328892, 'bear_rsi_os': 26, 'bear_rsi_ob': 76, 'bear_adx_thresh': 28.92009609082359, 'bear_atr_min_pct': 0.009537170943035082, 'bear_atr_max_pct': 0.12145216479892476, 'bear_tp_mult': 1.373507340109483, 'bear_tsl_mult': 0.3839019029669232, 'bear_time_stop': 243, 'bear_use_sma': False, 'bear_use_ema': True, 'bear_use_atr': False, 'bear_use_adx': True, 'bear_use_spike': True, 'bear_rsi_required': True, 'sideways_strategy': 'breakout', 'sideways_bb_std_mult': 2.052654099494894, 'sideways_rsi_os': 39, 'sideways_rsi_ob': 72, 'sideways_adx_thresh': 28.85749547675767, 'sideways_atr_min_pct': 0.02070906988899981, 'sideways_atr_max_pct': 0.03020111977910854, 'sideways_tp_mult': 1.2822585198345609, 'sideways_tsl_mult': 0.07270234980387696, 'sideways_time_stop': 248, 'sideways_use_sma': False, 'sideways_use_ema': False, 'sideways_use_atr': False, 'sideways_use_adx': True, 'sideways_use_spike': False, 'sideways_rsi_required': False}.
[I 2025-08-30 22:00:39,418] Trial 593 finished with values: [-1000000000.0, 1000000000.0] and parameters: {'p_sma': 55, 'p_std': 13, 'p_atr': 20, 'p_adx': 20, 'rsi_period': 74, 'ema1': 15, 'ema2': 56, 'slip_atr_k': 0.025142005814461563, 'slip_spread_k': 0.6244072920270481, 'spread_hl_frac': 0.04985429588735423, 'bb_std_mult': 0.6550899190587072, 'rsi_os': 10, 'rsi_ob': 46, 'vol_spike': 0.2841750872445177, 'adx_thresh': 6.491662990499394, 'atr_min_pct': 0.013253172784704323, 'atr_max_pct': 0.013039311680574405, 'tp_mult': 1.7702274103199316, 'tsl_mult': 0.8643632310169033, 'strategy': 'mean_reversion', 'time_stop': 96, 'use_sma': True, 'use_atr': True, 'use_adx': True, 'use_ema': True, 'use_spike': True, 'rsi_required': True, 'edge_k': 0.7881712305962935, 'edge_cap': 0.8158544366466391, 'bull_strategy': 'mean_reversion', 'bull_bb_std_mult': 1.8961529145920075, 'bull_rsi_os': 18, 'bull_rsi_ob': 47, 'bull_adx_thresh': 9.639500507135548, 'bull_atr_min_pct': 0.002083729373132107, 'bull_atr_max_pct': 0.04989083133687673, 'bull_tp_mult': 1.536076519322946, 'bull_tsl_mult': 0.6323586319833637, 'bull_time_stop': 288, 'bull_use_sma': True, 'bull_use_ema': False, 'bull_use_atr': False, 'bull_use_adx': False, 'bull_use_spike': False, 'bull_rsi_required': True, 'bear_strategy': 'mean_reversion', 'bear_bb_std_mult': 1.3591555879611747, 'bear_rsi_os': 25, 'bear_rsi_ob': 95, 'bear_adx_thresh': 22.195158651951775, 'bear_atr_min_pct': 0.018906977067019146, 'bear_atr_max_pct': 0.12259216580127032, 'bear_tp_mult': 1.6518450935695106, 'bear_tsl_mult': 0.38378081558422594, 'bear_time_stop': 241, 'bear_use_sma': False, 'bear_use_ema': True, 'bear_use_atr': False, 'bear_use_adx': True, 'bear_use_spike': True, 'bear_rsi_required': True, 'sideways_strategy': 'breakout', 'sideways_bb_std_mult': 1.7646239441141027, 'sideways_rsi_os': 25, 'sideways_rsi_ob': 90, 'sideways_adx_thresh': 10.696174488168792, 'sideways_atr_min_pct': 0.02043873055350532, 'sideways_atr_max_pct': 0.040213015165318174, 'sideways_tp_mult': 1.7952485221628622, 'sideways_tsl_mult': 0.8156192112700349, 'sideways_time_stop': 247, 'sideways_use_sma': False, 'sideways_use_ema': False, 'sideways_use_atr': False, 'sideways_use_adx': True, 'sideways_use_spike': False, 'sideways_rsi_required': False}.
[I 2025-08-30 22:00:40,092] Trial 594 finished with values: [-1000000000.0, 1000000000.0] and parameters: {'p_sma': 36, 'p_std': 34, 'p_atr': 22, 'p_adx': 20, 'rsi_period': 73, 'ema1': 15, 'ema2': 54, 'slip_atr_k': 0.027889089551071982, 'slip_spread_k': 0.6222809576005639, 'spread_hl_frac': 0.03403880228266089, 'bb_std_mult': 2.557125886114607, 'rsi_os': 33, 'rsi_ob': 46, 'vol_spike': 0.14264123594046943, 'adx_thresh': 10.074884483007633, 'atr_min_pct': 0.01328347872969587, 'atr_max_pct': 0.13825383527232107, 'tp_mult': 1.7813033824635967, 'tsl_mult': 0.8577830167413582, 'strategy': 'mean_reversion', 'time_stop': 97, 'use_sma': True, 'use_atr': True, 'use_adx': True, 'use_ema': True, 'use_spike': True, 'rsi_required': False, 'edge_k': 1.412387875271899, 'edge_cap': 0.8213830098011192, 'bull_strategy': 'breakout', 'bull_bb_std_mult': 1.895597525405046, 'bull_rsi_os': 51, 'bull_rsi_ob': 59, 'bull_adx_thresh': 14.01455274393884, 'bull_atr_min_pct': 0.0019978628000199908, 'bull_atr_max_pct': 0.12414112529888599, 'bull_tp_mult': 1.4328232676226407, 'bull_tsl_mult': 0.4121374499909559, 'bull_time_stop': 273, 'bull_use_sma': True, 'bull_use_ema': False, 'bull_use_atr': False, 'bull_use_adx': False, 'bull_use_spike': False, 'bull_rsi_required': True, 'bear_strategy': 'mean_reversion', 'bear_bb_std_mult': 0.6415386267510703, 'bear_rsi_os': 6, 'bear_rsi_ob': 86, 'bear_adx_thresh': 28.926771539995233, 'bear_atr_min_pct': 0.0299982000427486, 'bear_atr_max_pct': 0.12210539514492422, 'bear_tp_mult': 1.64441244344002, 'bear_tsl_mult': 0.01763564663353867, 'bear_time_stop': 245, 'bear_use_sma': False, 'bear_use_ema': True, 'bear_use_atr': False, 'bear_use_adx': True, 'bear_use_spike': True, 'bear_rsi_required': True, 'sideways_strategy': 'breakout', 'sideways_bb_std_mult': 1.0797642867141137, 'sideways_rsi_os': 22, 'sideways_rsi_ob': 69, 'sideways_adx_thresh': 25.622951174698628, 'sideways_atr_min_pct': 0.021258847296832594, 'sideways_atr_max_pct': 0.029152741402971777, 'sideways_tp_mult': 1.7890082465054629, 'sideways_tsl_mult': 0.7616638466740446, 'sideways_time_stop': 261, 'sideways_use_sma': False, 'sideways_use_ema': False, 'sideways_use_atr': False, 'sideways_use_adx': True, 'sideways_use_spike': False, 'sideways_rsi_required': False}.
