[I 2025-08-30 22:33:09,983] Trial 854 finished with values: [-1000000000.0, 1000000000.0] and parameters: {'p_sma': 34, 'p_std': 44, 'p_atr': 26, 'p_adx': 8, 'rsi_period': 78, 'ema1': 15, 'ema2': 19, 'slip_atr_k': 0.0004675308516220147, 'slip_spread_k': 0.7276334053747506, 'spread_hl_frac': 0.007814198141610964, 'bb_std_mult': 3.199880797047899, 'rsi_os': 16, 'rsi_ob': 85, 'vol_spike': 0.022065783799662994, 'adx_thresh': 5.649216179386904, 'atr_min_pct': 0.015129359019749588, 'atr_max_pct': 0.06922968903479261, 'tp_mult': 1.4141374371960567, 'tsl_mult': 0.36817094492821684, 'strategy': 'mean_reversion', 'time_stop': 118, 'use_sma': True, 'use_atr': False, 'use_adx': True, 'use_ema': True, 'use_spike': True, 'rsi_required': True, 'edge_k': 1.3173987145295663, 'edge_cap': 0.0739747615000024, 'bull_strategy': 'breakout', 'bull_bb_std_mult': 2.2236116514664945, 'bull_rsi_os': 40, 'bull_rsi_ob': 82, 'bull_adx_thresh': 18.839118713197884, 'bull_atr_min_pct': 0.021291906523886277, 'bull_atr_max_pct': 0.040464671191577886, 'bull_tp_mult': 2.1792911049987365, 'bull_tsl_mult': 0.6356643349464529, 'bull_time_stop': 270, 'bull_use_sma': True, 'bull_use_ema': False, 'bull_use_atr': False, 'bull_use_adx': True, 'bull_use_spike': True, 'bull_rsi_required': False, 'bear_strategy': 'breakout', 'bear_bb_std_mult': 1.6239881827823006, 'bear_rsi_os': 13, 'bear_rsi_ob': 77, 'bear_adx_thresh': 28.868496430409678, 'bear_atr_min_pct': 0.027616873437403204, 'bear_atr_max_pct': 0.1328855823840701, 'bear_tp_mult': 2.597004345135428, 'bear_tsl_mult': 0.5359170175382425, 'bear_time_stop': 270, 'bear_use_sma': True, 'bear_use_ema': True, 'bear_use_atr': True, 'bear_use_adx': True, 'bear_use_spike': True, 'bear_rsi_required': False, 'sideways_strategy': 'mean_reversion', 'sideways_bb_std_mult': 2.589243385431507, 'sideways_rsi_os': 32, 'sideways_rsi_ob': 54, 'sideways_adx_thresh': 24.6014437313626, 'sideways_atr_min_pct': 0.018672625319585637, 'sideways_atr_max_pct': 0.07930505827177611, 'sideways_tp_mult': 2.183880516621626, 'sideways_tsl_mult': 0.9068404893821765, 'sideways_time_stop': 233, 'sideways_use_sma': False, 'sideways_use_ema': True, 'sideways_use_atr': False, 'sideways_use_adx': False, 'sideways_use_spike': True, 'sideways_rsi_required': True}.
[I 2025-08-30 22:33:10,160] Trial 853 finished with values: [-1000000000.0, 1000000000.0] and parameters: {'p_sma': 34, 'p_std': 45, 'p_atr': 26, 'p_adx': 8, 'rsi_period': 79, 'ema1': 15, 'ema2': 19, 'slip_atr_k': 0.0012167396284784695, 'slip_spread_k': 0.7410221646012085, 'spread_hl_frac': 0.007403176604755379, 'bb_std_mult': 3.1439061164352786, 'rsi_os': 16, 'rsi_ob': 85, 'vol_spike': 0.020309131953158494, 'adx_thresh': 6.069836135032794, 'atr_min_pct': 0.01572041686134197, 'atr_max_pct': 0.06746932627969335, 'tp_mult': 1.425918878810718, 'tsl_mult': 0.363014092501902, 'strategy': 'mean_reversion', 'time_stop': 120, 'use_sma': True, 'use_atr': False, 'use_adx': True, 'use_ema': True, 'use_spike': True, 'rsi_required': True, 'edge_k': 1.3209224960302932, 'edge_cap': 0.07051425618718196, 'bull_strategy': 'breakout', 'bull_bb_std_mult': 2.235741594885409, 'bull_rsi_os': 40, 'bull_rsi_ob': 82, 'bull_adx_thresh': 20.119094667465426, 'bull_atr_min_pct': 0.0033834842352094517, 'bull_atr_max_pct': 0.04144851196092643, 'bull_tp_mult': 2.1742938626652295, 'bull_tsl_mult': 0.6348563206937227, 'bull_time_stop': 272, 'bull_use_sma': True, 'bull_use_ema': False, 'bull_use_atr': False, 'bull_use_adx': True, 'bull_use_spike': True, 'bull_rsi_required': False, 'bear_strategy': 'breakout', 'bear_bb_std_mult': 1.6540270373891235, 'bear_rsi_os': 12, 'bear_rsi_ob': 77, 'bear_adx_thresh': 29.170444742223513, 'bear_atr_min_pct': 0.02729135232757388, 'bear_atr_max_pct': 0.13084971400565854, 'bear_tp_mult': 2.5763375586789103, 'bear_tsl_mult': 0.5215441991265118, 'bear_time_stop': 270, 'bear_use_sma': True, 'bear_use_ema': True, 'bear_use_atr': True, 'bear_use_adx': True, 'bear_use_spike': True, 'bear_rsi_required': False, 'sideways_strategy': 'mean_reversion', 'sideways_bb_std_mult': 2.546712677457199, 'sideways_rsi_os': 35, 'sideways_rsi_ob': 54, 'sideways_adx_thresh': 25.33143939673239, 'sideways_atr_min_pct': 0.018473903888753064, 'sideways_atr_max_pct': 0.07927211228570198, 'sideways_tp_mult': 2.184688827644017, 'sideways_tsl_mult': 0.9217859991094924, 'sideways_time_stop': 230, 'sideways_use_sma': False, 'sideways_use_ema': True, 'sideways_use_atr': False, 'sideways_use_adx': False, 'sideways_use_spike': True, 'sideways_rsi_required': True}.
[I 2025-08-30 22:33:45,184] Trial 857 finished with values: [-1000000000.0, 1000000000.0] and parameters: {'p_sma': 34, 'p_std': 45, 'p_atr': 26, 'p_adx': 8, 'rsi_period': 80, 'ema1': 15, 'ema2': 19, 'slip_atr_k': 0.0003845509491306187, 'slip_spread_k': 0.7350713789184773, 'spread_hl_frac': 0.00748272415672999, 'bb_std_mult': 3.190714493310863, 'rsi_os': 15, 'rsi_ob': 83, 'vol_spike': 0.01943633950252957, 'adx_thresh': 5.412652783772096, 'atr_min_pct': 0.015571161164294564, 'atr_max_pct': 0.0669798336392518, 'tp_mult': 1.4638835615143626, 'tsl_mult': 0.3286821595349284, 'strategy': 'mean_reversion', 'time_stop': 120, 'use_sma': True, 'use_atr': False, 'use_adx': True, 'use_ema': True, 'use_spike': True, 'rsi_required': True, 'edge_k': 1.3220275735744371, 'edge_cap': 0.08181527156806902, 'bull_strategy': 'breakout', 'bull_bb_std_mult': 2.2427587604463244, 'bull_rsi_os': 40, 'bull_rsi_ob': 82, 'bull_adx_thresh': 19.461982200089462, 'bull_atr_min_pct': 0.01083347529557745, 'bull_atr_max_pct': 0.03893214290067778, 'bull_tp_mult': 2.1447279282078506, 'bull_tsl_mult': 0.643459162402596, 'bull_time_stop': 267, 'bull_use_sma': True, 'bull_use_ema': False, 'bull_use_atr': False, 'bull_use_adx': True, 'bull_use_spike': True, 'bull_rsi_required': False, 'bear_strategy': 'breakout', 'bear_bb_std_mult': 1.663112470442307, 'bear_rsi_os': 13, 'bear_rsi_ob': 77, 'bear_adx_thresh': 27.821282115399505, 'bear_atr_min_pct': 0.026731722415626755, 'bear_atr_max_pct': 0.13231929150032945, 'bear_tp_mult': 2.5463219684627942, 'bear_tsl_mult': 0.61610571318271, 'bear_time_stop': 270, 'bear_use_sma': True, 'bear_use_ema': True, 'bear_use_atr': True, 'bear_use_adx': True, 'bear_use_spike': True, 'bear_rsi_required': False, 'sideways_strategy': 'mean_reversion', 'sideways_bb_std_mult': 2.517524531180789, 'sideways_rsi_os': 32, 'sideways_rsi_ob': 55, 'sideways_adx_thresh': 25.39565728304883, 'sideways_atr_min_pct': 0.018410108181655848, 'sideways_atr_max_pct': 0.09224861045035916, 'sideways_tp_mult': 2.1894286195527934, 'sideways_tsl_mult': 0.9035726159104893, 'sideways_time_stop': 235, 'sideways_use_sma': False, 'sideways_use_ema': True, 'sideways_use_atr': False, 'sideways_use_adx': False, 'sideways_use_spike': True, 'sideways_rsi_required': True}.
[I 2025-08-30 22:33:45,361] Trial 860 finished with values: [-1000000000.0, 1000000000.0] and parameters: {'p_sma': 58, 'p_std': 43, 'p_atr': 25, 'p_adx': 8, 'rsi_period': 79, 'ema1': 14, 'ema2': 20, 'slip_atr_k': 0.004767655001413616, 'slip_spread_k': 0.7234143988067647, 'spread_hl_frac': 0.0028843819908764418, 'bb_std_mult': 3.0816845749683295, 'rsi_os': 17, 'rsi_ob': 83, 'vol_spike': 0.03303410606141942, 'adx_thresh': 6.318056845328893, 'atr_min_pct': 0.015449710395509872, 'atr_max_pct': 0.06513722810064212, 'tp_mult': 1.4626281625274538, 'tsl_mult': 0.3252152509871481, 'strategy': 'breakout', 'time_stop': 126, 'use_sma': False, 'use_atr': False, 'use_adx': False, 'use_ema': True, 'use_spike': False, 'rsi_required': True, 'edge_k': 1.2874360517484091, 'edge_cap': 0.0925876293239661, 'bull_strategy': 'mean_reversion', 'bull_bb_std_mult': 2.3159858391602386, 'bull_rsi_os': 38, 'bull_rsi_ob': 82, 'bull_adx_thresh': 19.630350491490397, 'bull_atr_min_pct': 0.028529426615499856, 'bull_atr_max_pct': 0.03736689389910416, 'bull_tp_mult': 2.1313269602367417, 'bull_tsl_mult': 0.6141799067758257, 'bull_time_stop': 278, 'bull_use_sma': False, 'bull_use_ema': False, 'bull_use_atr': True, 'bull_use_adx': True, 'bull_use_spike': True, 'bull_rsi_required': False, 'bear_strategy': 'breakout', 'bear_bb_std_mult': 1.5772697185211513, 'bear_rsi_os': 15, 'bear_rsi_ob': 77, 'bear_adx_thresh': 27.901190172578804, 'bear_atr_min_pct': 0.026704450152612257, 'bear_atr_max_pct': 0.1277907266889629, 'bear_tp_mult': 2.5340142569298565, 'bear_tsl_mult': 0.6010173710781205, 'bear_time_stop': 275, 'bear_use_sma': True, 'bear_use_ema': True, 'bear_use_atr': True, 'bear_use_adx': False, 'bear_use_spike': False, 'bear_rsi_required': False, 'sideways_strategy': 'mean_reversion', 'sideways_bb_std_mult': 2.4691898849557, 'sideways_rsi_os': 31, 'sideways_rsi_ob': 53, 'sideways_adx_thresh': 25.49431127049012, 'sideways_atr_min_pct': 0.019607962128526273, 'sideways_atr_max_pct': 0.09295005403533078, 'sideways_tp_mult': 2.255167552991349, 'sideways_tsl_mult': 0.8925355731885433, 'sideways_time_stop': 240, 'sideways_use_sma': False, 'sideways_use_ema': True, 'sideways_use_atr': False, 'sideways_use_adx': False, 'sideways_use_spike': True, 'sideways_rsi_required': True}.
[I 2025-08-30 22:33:45,817] Trial 859 finished with values: [-1000000000.0, 1000000000.0] and parameters: {'p_sma': 35, 'p_std': 43, 'p_atr': 27, 'p_adx': 8, 'rsi_period': 80, 'ema1': 14, 'ema2': 20, 'slip_atr_k': 0.005757576077125346, 'slip_spread_k': 0.7190167622708827, 'spread_hl_frac': 0.010234813311115446, 'bb_std_mult': 2.854354796699952, 'rsi_os': 15, 'rsi_ob': 83, 'vol_spike': 0.029306604425942157, 'adx_thresh': 6.285351939883297, 'atr_min_pct': 0.01643339091121297, 'atr_max_pct': 0.0655030349378276, 'tp_mult': 1.4069595291607127, 'tsl_mult': 0.32837810178454285, 'strategy': 'breakout', 'time_stop': 115, 'use_sma': False, 'use_atr': False, 'use_adx': False, 'use_ema': True, 'use_spike': False, 'rsi_required': True, 'edge_k': 1.2892597532939456, 'edge_cap': 0.08920650333743012, 'bull_strategy': 'mean_reversion', 'bull_bb_std_mult': 2.315039151703136, 'bull_rsi_os': 41, 'bull_rsi_ob': 82, 'bull_adx_thresh': 19.416448419948726, 'bull_atr_min_pct': 0.01105080350694642, 'bull_atr_max_pct': 0.03695152470412906, 'bull_tp_mult': 2.1240595316937974, 'bull_tsl_mult': 0.6518921834826836, 'bull_time_stop': 275, 'bull_use_sma': False, 'bull_use_ema': False, 'bull_use_atr': True, 'bull_use_adx': True, 'bull_use_spike': True, 'bull_rsi_required': False, 'bear_strategy': 'breakout', 'bear_bb_std_mult': 1.543832298815707, 'bear_rsi_os': 12, 'bear_rsi_ob': 77, 'bear_adx_thresh': 32.8801130204496, 'bear_atr_min_pct': 0.027182345390627066, 'bear_atr_max_pct': 0.133517084117688, 'bear_tp_mult': 2.5377384433501526, 'bear_tsl_mult': 0.606366482363561, 'bear_time_stop': 274, 'bear_use_sma': True, 'bear_use_ema': True, 'bear_use_atr': True, 'bear_use_adx': False, 'bear_use_spike': False, 'bear_rsi_required': False, 'sideways_strategy': 'mean_reversion', 'sideways_bb_std_mult': 2.4635991048176997, 'sideways_rsi_os': 32, 'sideways_rsi_ob': 52, 'sideways_adx_thresh': 25.182467909012296, 'sideways_atr_min_pct': 0.019135410233939158, 'sideways_atr_max_pct': 0.09184805131442458, 'sideways_tp_mult': 2.209875545717507, 'sideways_tsl_mult': 0.9009182475560078, 'sideways_time_stop': 240, 'sideways_use_sma': False, 'sideways_use_ema': True, 'sideways_use_atr': False, 'sideways_use_adx': False, 'sideways_use_spike': True, 'sideways_rsi_required': True}.
[I 2025-08-30 22:33:45,915] Trial 858 finished with values: [-1000000000.0, 1000000000.0] and parameters: {'p_sma': 34, 'p_std': 46, 'p_atr': 25, 'p_adx': 8, 'rsi_period': 78, 'ema1': 15, 'ema2': 19, 'slip_atr_k': 0.0038124676655119094, 'slip_spread_k': 0.7376115888279875, 'spread_hl_frac': 0.006985219965008478, 'bb_std_mult': 3.0896750266239517, 'rsi_os': 16, 'rsi_ob': 83, 'vol_spike': 0.027932834631671056, 'adx_thresh': 5.631932160863392, 'atr_min_pct': 0.015604918868301901, 'atr_max_pct': 0.06389884844188104, 'tp_mult': 1.4623064460233508, 'tsl_mult': 0.3292899112217871, 'strategy': 'breakout', 'time_stop': 117, 'use_sma': True, 'use_atr': False, 'use_adx': False, 'use_ema': True, 'use_spike': False, 'rsi_required': True, 'edge_k': 1.301541602362732, 'edge_cap': 0.06433546342312911, 'bull_strategy': 'breakout', 'bull_bb_std_mult': 2.204533961728946, 'bull_rsi_os': 38, 'bull_rsi_ob': 82, 'bull_adx_thresh': 19.417612914827636, 'bull_atr_min_pct': 0.002746286784647001, 'bull_atr_max_pct': 0.040281881196116164, 'bull_tp_mult': 2.139657858018463, 'bull_tsl_mult': 0.6460358530905639, 'bull_time_stop': 268, 'bull_use_sma': True, 'bull_use_ema': False, 'bull_use_atr': True, 'bull_use_adx': True, 'bull_use_spike': True, 'bull_rsi_required': False, 'bear_strategy': 'breakout', 'bear_bb_std_mult': 1.665922694487544, 'bear_rsi_os': 14, 'bear_rsi_ob': 77, 'bear_adx_thresh': 27.756503677747418, 'bear_atr_min_pct': 0.026876151796512617, 'bear_atr_max_pct': 0.13296657329303424, 'bear_tp_mult': 2.5564374651650685, 'bear_tsl_mult': 0.5961516526988133, 'bear_time_stop': 269, 'bear_use_sma': True, 'bear_use_ema': True, 'bear_use_atr': True, 'bear_use_adx': True, 'bear_use_spike': True, 'bear_rsi_required': False, 'sideways_strategy': 'mean_reversion', 'sideways_bb_std_mult': 2.5110770385207677, 'sideways_rsi_os': 34, 'sideways_rsi_ob': 56, 'sideways_adx_thresh': 25.563350763959264, 'sideways_atr_min_pct': 0.01840568705782703, 'sideways_atr_max_pct': 0.09215916191789648, 'sideways_tp_mult': 2.1843302517058016, 'sideways_tsl_mult': 0.902738086933291, 'sideways_time_stop': 238, 'sideways_use_sma': False, 'sideways_use_ema': True, 'sideways_use_atr': False, 'sideways_use_adx': False, 'sideways_use_spike': True, 'sideways_rsi_required': True}.
[I 2025-08-30 22:34:21,095] Trial 861 finished with values: [-1000000000.0, 1000000000.0] and parameters: {'p_sma': 57, 'p_std': 43, 'p_atr': 27, 'p_adx': 8, 'rsi_period': 79, 'ema1': 14, 'ema2': 20, 'slip_atr_k': 0.005398696500964134, 'slip_spread_k': 0.7037260261583906, 'spread_hl_frac': 0.0027645704945438608, 'bb_std_mult': 2.7871879164431013, 'rsi_os': 16, 'rsi_ob': 93, 'vol_spike': 0.026128296428615302, 'adx_thresh': 6.157935309996797, 'atr_min_pct': 0.016131003306863855, 'atr_max_pct': 0.06397013226277456, 'tp_mult': 1.4471030794835182, 'tsl_mult': 0.31488277515437885, 'strategy': 'breakout', 'time_stop': 113, 'use_sma': False, 'use_atr': False, 'use_adx': False, 'use_ema': False, 'use_spike': False, 'rsi_required': True, 'edge_k': 1.272100862327794, 'edge_cap': 0.06304617395512993, 'bull_strategy': 'mean_reversion', 'bull_bb_std_mult': 2.1663137894383957, 'bull_rsi_os': 38, 'bull_rsi_ob': 82, 'bull_adx_thresh': 11.17140656635133, 'bull_atr_min_pct': 0.0026376986278763117, 'bull_atr_max_pct': 0.03735001500644565, 'bull_tp_mult': 2.1219050746983084, 'bull_tsl_mult': 0.6129927057808593, 'bull_time_stop': 269, 'bull_use_sma': False, 'bull_use_ema': False, 'bull_use_atr': True, 'bull_use_adx': True, 'bull_use_spike': True, 'bull_rsi_required': False, 'bear_strategy': 'breakout', 'bear_bb_std_mult': 1.5432800797889685, 'bear_rsi_os': 14, 'bear_rsi_ob': 78, 'bear_adx_thresh': 27.84100198678285, 'bear_atr_min_pct': 0.027065319193602572, 'bear_atr_max_pct': 0.12856270881664814, 'bear_tp_mult': 2.532112413660941, 'bear_tsl_mult': 0.5844474534173753, 'bear_time_stop': 276, 'bear_use_sma': True, 'bear_use_ema': True, 'bear_use_atr': True, 'bear_use_adx': False, 'bear_use_spike': False, 'bear_rsi_required': False, 'sideways_strategy': 'mean_reversion', 'sideways_bb_std_mult': 2.467855761180393, 'sideways_rsi_os': 31, 'sideways_rsi_ob': 57, 'sideways_adx_thresh': 24.760436963298336, 'sideways_atr_min_pct': 0.019164079241934397, 'sideways_atr_max_pct': 0.08688347335845367, 'sideways_tp_mult': 2.1567143692550252, 'sideways_tsl_mult': 0.8976761529228954, 'sideways_time_stop': 240, 'sideways_use_sma': True, 'sideways_use_ema': True, 'sideways_use_atr': False, 'sideways_use_adx': False, 'sideways_use_spike': True, 'sideways_rsi_required': True}.
[I 2025-08-30 22:34:21,524] Trial 863 finished with values: [-1000000000.0, 1000000000.0] and parameters: {'p_sma': 46, 'p_std': 46, 'p_atr': 25, 'p_adx': 9, 'rsi_period': 77, 'ema1': 16, 'ema2': 18, 'slip_atr_k': 3.568520588235395e-05, 'slip_spread_k': 0.7653077304221916, 'spread_hl_frac': 0.001723295484854303, 'bb_std_mult': 3.3694571929233796, 'rsi_os': 16, 'rsi_ob': 94, 'vol_spike': 0.026848119538579913, 'adx_thresh': 5.742516467825219, 'atr_min_pct': 0.015141604135691909, 'atr_max_pct': 0.06331942368563548, 'tp_mult': 1.4562585378442197, 'tsl_mult': 0.24937667113107387, 'strategy': 'mean_reversion', 'time_stop': 113, 'use_sma': True, 'use_atr': False, 'use_adx': True, 'use_ema': False, 'use_spike': True, 'rsi_required': False, 'edge_k': 1.358095126403449, 'edge_cap': 0.051540551251003784, 'bull_strategy': 'breakout', 'bull_bb_std_mult': 2.135019876876237, 'bull_rsi_os': 39, 'bull_rsi_ob': 81, 'bull_adx_thresh': 11.123481902610102, 'bull_atr_min_pct': 0.001856255815285234, 'bull_atr_max_pct': 0.03935015930048834, 'bull_tp_mult': 2.1042575398483176, 'bull_tsl_mult': 0.6167668091702111, 'bull_time_stop': 273, 'bull_use_sma': True, 'bull_use_ema': True, 'bull_use_atr': False, 'bull_use_adx': True, 'bull_use_spike': True, 'bull_rsi_required': False, 'bear_strategy': 'breakout', 'bear_bb_std_mult': 1.7069088961958385, 'bear_rsi_os': 14, 'bear_rsi_ob': 76, 'bear_adx_thresh': 20.24221213001487, 'bear_atr_min_pct': 0.026804545853707635, 'bear_atr_max_pct': 0.12819770581056825, 'bear_tp_mult': 2.4744005681986705, 'bear_tsl_mult': 0.5794415367194155, 'bear_time_stop': 266, 'bear_use_sma': True, 'bear_use_ema': False, 'bear_use_atr': True, 'bear_use_adx': True, 'bear_use_spike': True, 'bear_rsi_required': False, 'sideways_strategy': 'mean_reversion', 'sideways_bb_std_mult': 2.60077010905816, 'sideways_rsi_os': 33, 'sideways_rsi_ob': 57, 'sideways_adx_thresh': 25.828965192741133, 'sideways_atr_min_pct': 0.01923329047929211, 'sideways_atr_max_pct': 0.0852016880313124, 'sideways_tp_mult': 2.1178374656390737, 'sideways_tsl_mult': 0.927575278067918, 'sideways_time_stop': 240, 'sideways_use_sma': True, 'sideways_use_ema': True, 'sideways_use_atr': False, 'sideways_use_adx': False, 'sideways_use_spike': True, 'sideways_rsi_required': True}.
[I 2025-08-30 22:34:21,796] Trial 862 finished with values: [-1000000000.0, 1000000000.0] and parameters: {'p_sma': 16, 'p_std': 42, 'p_atr': 27, 'p_adx': 7, 'rsi_period': 80, 'ema1': 16, 'ema2': 17, 'slip_atr_k': 0.004728087955883852, 'slip_spread_k': 0.7079283107086985, 'spread_hl_frac': 0.009166883172576705, 'bb_std_mult': 2.9467973267339542, 'rsi_os': 16, 'rsi_ob': 86, 'vol_spike': 0.028648440864121945, 'adx_thresh': 5.911993548441927, 'atr_min_pct': 0.016465225194856777, 'atr_max_pct': 0.0635961810076662, 'tp_mult': 1.4597502983881727, 'tsl_mult': 0.2061115509113537, 'strategy': 'breakout', 'time_stop': 112, 'use_sma': False, 'use_atr': False, 'use_adx': False, 'use_ema': False, 'use_spike': False, 'rsi_required': True, 'edge_k': 1.360809896327933, 'edge_cap': 0.06725705548606949, 'bull_strategy': 'breakout', 'bull_bb_std_mult': 2.2830495014663263, 'bull_rsi_os': 42, 'bull_rsi_ob': 81, 'bull_adx_thresh': 11.097274190127244, 'bull_atr_min_pct': 0.00197271797506804, 'bull_atr_max_pct': 0.040656138625353784, 'bull_tp_mult': 2.12277620013716, 'bull_tsl_mult': 0.6130246197990398, 'bull_time_stop': 273, 'bull_use_sma': True, 'bull_use_ema': True, 'bull_use_atr': True, 'bull_use_adx': True, 'bull_use_spike': True, 'bull_rsi_required': False, 'bear_strategy': 'breakout', 'bear_bb_std_mult': 1.5776451989092897, 'bear_rsi_os': 12, 'bear_rsi_ob': 76, 'bear_adx_thresh': 19.99352947230588, 'bear_atr_min_pct': 0.027189299947363747, 'bear_atr_max_pct': 0.12856485280013294, 'bear_tp_mult': 2.4917330410274463, 'bear_tsl_mult': 0.5792618579026851, 'bear_time_stop': 266, 'bear_use_sma': True, 'bear_use_ema': True, 'bear_use_atr': True, 'bear_use_adx': True, 'bear_use_spike': True, 'bear_rsi_required': False, 'sideways_strategy': 'mean_reversion', 'sideways_bb_std_mult': 2.6089221576638106, 'sideways_rsi_os': 33, 'sideways_rsi_ob': 57, 'sideways_adx_thresh': 25.085147465971584, 'sideways_atr_min_pct': 0.01921719547813728, 'sideways_atr_max_pct': 0.0859066037127091, 'sideways_tp_mult': 2.1058303375834226, 'sideways_tsl_mult': 0.9258791346420454, 'sideways_time_stop': 239, 'sideways_use_sma': True, 'sideways_use_ema': True, 'sideways_use_atr': False, 'sideways_use_adx': False, 'sideways_use_spike': True, 'sideways_rsi_required': True}.
