[I 2025-08-30 22:31:56,429] Trial 845 finished with values: [-1000000000.0, 1000000000.0] and parameters: {'p_sma': 34, 'p_std': 38, 'p_atr': 24, 'p_adx': 14, 'rsi_period': 76, 'ema1': 6, 'ema2': 33, 'slip_atr_k': 0.00832924812169, 'slip_spread_k': 0.6791590051190396, 'spread_hl_frac': 0.011419661771934616, 'bb_std_mult': 2.6273190777937665, 'rsi_os': 14, 'rsi_ob': 88, 'vol_spike': 0.027333095440489126, 'adx_thresh': 6.646428998748238, 'atr_min_pct': 0.014220569519890466, 'atr_max_pct': 0.0840822893746725, 'tp_mult': 1.5563225706450179, 'tsl_mult': 0.23217578585674079, 'strategy': 'mean_reversion', 'time_stop': 109, 'use_sma': True, 'use_atr': False, 'use_adx': True, 'use_ema': False, 'use_spike': True, 'rsi_required': True, 'edge_k': 1.2868661383094149, 'edge_cap': 0.09778636006633398, 'bull_strategy': 'breakout', 'bull_bb_std_mult': 2.096468212571179, 'bull_rsi_os': 53, 'bull_rsi_ob': 85, 'bull_adx_thresh': 16.2318761051062, 'bull_atr_min_pct': 0.014866355612544707, 'bull_atr_max_pct': 0.04427826180401705, 'bull_tp_mult': 2.0039508070154457, 'bull_tsl_mult': 0.6149541510069909, 'bull_time_stop': 284, 'bull_use_sma': True, 'bull_use_ema': False, 'bull_use_atr': False, 'bull_use_adx': True, 'bull_use_spike': False, 'bull_rsi_required': True, 'bear_strategy': 'breakout', 'bear_bb_std_mult': 1.6170684490417666, 'bear_rsi_os': 42, 'bear_rsi_ob': 75, 'bear_adx_thresh': 22.281030215099463, 'bear_atr_min_pct': 0.028475833386750072, 'bear_atr_max_pct': 0.12348066035695171, 'bear_tp_mult': 2.5265008034309333, 'bear_tsl_mult': 0.5601481883007065, 'bear_time_stop': 250, 'bear_use_sma': False, 'bear_use_ema': True, 'bear_use_atr': True, 'bear_use_adx': True, 'bear_use_spike': True, 'bear_rsi_required': False, 'sideways_strategy': 'breakout', 'sideways_bb_std_mult': 2.471066625190442, 'sideways_rsi_os': 37, 'sideways_rsi_ob': 51, 'sideways_adx_thresh': 26.813348868129097, 'sideways_atr_min_pct': 0.02014087705776089, 'sideways_atr_max_pct': 0.08909739008436027, 'sideways_tp_mult': 1.960018091158946, 'sideways_tsl_mult': 0.8836185785960092, 'sideways_time_stop': 245, 'sideways_use_sma': False, 'sideways_use_ema': False, 'sideways_use_atr': True, 'sideways_use_adx': True, 'sideways_use_spike': True, 'sideways_rsi_required': False}.
[I 2025-08-30 22:31:56,430] Trial 847 finished with values: [-1000000000.0, 1000000000.0] and parameters: {'p_sma': 32, 'p_std': 41, 'p_atr': 24, 'p_adx': 21, 'rsi_period': 76, 'ema1': 6, 'ema2': 28, 'slip_atr_k': 0.007058341464504218, 'slip_spread_k': 0.6803317895228537, 'spread_hl_frac': 0.008328987123454049, 'bb_std_mult': 2.3743186036548845, 'rsi_os': 14, 'rsi_ob': 92, 'vol_spike': 0.03150285749986763, 'adx_thresh': 17.92878080921896, 'atr_min_pct': 0.015088848875174955, 'atr_max_pct': 0.0741053029547686, 'tp_mult': 1.4378619031850928, 'tsl_mult': 0.3880770109430273, 'strategy': 'mean_reversion', 'time_stop': 107, 'use_sma': True, 'use_atr': False, 'use_adx': True, 'use_ema': True, 'use_spike': True, 'rsi_required': True, 'edge_k': 1.1103242802701627, 'edge_cap': 0.09119648846491696, 'bull_strategy': 'mean_reversion', 'bull_bb_std_mult': 2.089649257061914, 'bull_rsi_os': 53, 'bull_rsi_ob': 85, 'bull_adx_thresh': 16.056670215978848, 'bull_atr_min_pct': 0.001609834713904437, 'bull_atr_max_pct': 0.0460938331816867, 'bull_tp_mult': 2.150000558024641, 'bull_tsl_mult': 0.6101561195945954, 'bull_time_stop': 280, 'bull_use_sma': True, 'bull_use_ema': False, 'bull_use_atr': False, 'bull_use_adx': True, 'bull_use_spike': False, 'bull_rsi_required': False, 'bear_strategy': 'breakout', 'bear_bb_std_mult': 1.521714542592559, 'bear_rsi_os': 15, 'bear_rsi_ob': 93, 'bear_adx_thresh': 11.448182125055137, 'bear_atr_min_pct': 0.028494138495534057, 'bear_atr_max_pct': 0.12937278777435077, 'bear_tp_mult': 2.5118020494468776, 'bear_tsl_mult': 0.5658874932287273, 'bear_time_stop': 248, 'bear_use_sma': True, 'bear_use_ema': True, 'bear_use_atr': True, 'bear_use_adx': False, 'bear_use_spike': True, 'bear_rsi_required': False, 'sideways_strategy': 'breakout', 'sideways_bb_std_mult': 2.54488046186009, 'sideways_rsi_os': 34, 'sideways_rsi_ob': 51, 'sideways_adx_thresh': 26.363002345572166, 'sideways_atr_min_pct': 0.016931252786347408, 'sideways_atr_max_pct': 0.08962660668057666, 'sideways_tp_mult': 1.9523222843367996, 'sideways_tsl_mult': 0.8805800871701066, 'sideways_time_stop': 248, 'sideways_use_sma': False, 'sideways_use_ema': False, 'sideways_use_atr': False, 'sideways_use_adx': True, 'sideways_use_spike': True, 'sideways_rsi_required': False}.
[I 2025-08-30 22:31:56,779] Trial 848 finished with values: [-0.013818920218386488, 0.0137423634826308] and parameters: {'p_sma': 34, 'p_std': 41, 'p_atr': 25, 'p_adx': 8, 'rsi_period': 75, 'ema1': 14, 'ema2': 19, 'slip_atr_k': 0.0008322942107292083, 'slip_spread_k': 0.6825543297394352, 'spread_hl_frac': 0.007880442525260913, 'bb_std_mult': 2.864782003992904, 'rsi_os': 14, 'rsi_ob': 88, 'vol_spike': 0.026189693557886227, 'adx_thresh': 5.810052585635018, 'atr_min_pct': 0.014382426126947435, 'atr_max_pct': 0.07054636662971037, 'tp_mult': 1.4765586768020018, 'tsl_mult': 0.34181804356704326, 'strategy': 'mean_reversion', 'time_stop': 106, 'use_sma': True, 'use_atr': False, 'use_adx': True, 'use_ema': True, 'use_spike': True, 'rsi_required': True, 'edge_k': 1.2916715715029277, 'edge_cap': 0.09185200805632607, 'bull_strategy': 'breakout', 'bull_bb_std_mult': 2.102468343546939, 'bull_rsi_os': 41, 'bull_rsi_ob': 83, 'bull_adx_thresh': 15.942110394319103, 'bull_atr_min_pct': 0.001272783655834268, 'bull_atr_max_pct': 0.04474513410884969, 'bull_tp_mult': 2.1526778385777647, 'bull_tsl_mult': 0.6119773787190947, 'bull_time_stop': 285, 'bull_use_sma': True, 'bull_use_ema': False, 'bull_use_atr': False, 'bull_use_adx': True, 'bull_use_spike': True, 'bull_rsi_required': False, 'bear_strategy': 'breakout', 'bear_bb_std_mult': 1.6488480898029456, 'bear_rsi_os': 12, 'bear_rsi_ob': 75, 'bear_adx_thresh': 27.47096952554843, 'bear_atr_min_pct': 0.028437359862932145, 'bear_atr_max_pct': 0.122588057519332, 'bear_tp_mult': 2.5086461511340734, 'bear_tsl_mult': 0.5715010642478668, 'bear_time_stop': 267, 'bear_use_sma': True, 'bear_use_ema': True, 'bear_use_atr': True, 'bear_use_adx': True, 'bear_use_spike': True, 'bear_rsi_required': False, 'sideways_strategy': 'mean_reversion', 'sideways_bb_std_mult': 2.5499884274875972, 'sideways_rsi_os': 37, 'sideways_rsi_ob': 51, 'sideways_adx_thresh': 26.58159215856421, 'sideways_atr_min_pct': 0.02025003913423209, 'sideways_atr_max_pct': 0.08905281472831494, 'sideways_tp_mult': 2.0931609956591655, 'sideways_tsl_mult': 0.9050219434092466, 'sideways_time_stop': 247, 'sideways_use_sma': False, 'sideways_use_ema': True, 'sideways_use_atr': False, 'sideways_use_adx': False, 'sideways_use_spike': True, 'sideways_rsi_required': True}.
[I 2025-08-30 22:32:32,569] Trial 849 finished with values: [-1000000000.0, 1000000000.0] and parameters: {'p_sma': 31, 'p_std': 38, 'p_atr': 24, 'p_adx': 22, 'rsi_period': 75, 'ema1': 14, 'ema2': 18, 'slip_atr_k': 0.001071670671938735, 'slip_spread_k': 0.6767468051860425, 'spread_hl_frac': 0.00883353127340167, 'bb_std_mult': 2.898526288032189, 'rsi_os': 14, 'rsi_ob': 88, 'vol_spike': 0.0444533634664105, 'adx_thresh': 17.322045388196262, 'atr_min_pct': 0.014229834266654065, 'atr_max_pct': 0.07156952648636304, 'tp_mult': 1.555371680717896, 'tsl_mult': 0.4657934493710495, 'strategy': 'mean_reversion', 'time_stop': 114, 'use_sma': True, 'use_atr': False, 'use_adx': True, 'use_ema': True, 'use_spike': True, 'rsi_required': True, 'edge_k': 1.3034609518062985, 'edge_cap': 0.08970567707998178, 'bull_strategy': 'breakout', 'bull_bb_std_mult': 2.0668538865961046, 'bull_rsi_os': 42, 'bull_rsi_ob': 85, 'bull_adx_thresh': 15.836528218538861, 'bull_atr_min_pct': 0.0014765676903945855, 'bull_atr_max_pct': 0.04601867273063508, 'bull_tp_mult': 2.1469305571494384, 'bull_tsl_mult': 0.605879999900168, 'bull_time_stop': 285, 'bull_use_sma': True, 'bull_use_ema': False, 'bull_use_atr': False, 'bull_use_adx': True, 'bull_use_spike': True, 'bull_rsi_required': False, 'bear_strategy': 'breakout', 'bear_bb_std_mult': 1.5132188829505424, 'bear_rsi_os': 7, 'bear_rsi_ob': 75, 'bear_adx_thresh': 11.445906228452493, 'bear_atr_min_pct': 0.028485150945343315, 'bear_atr_max_pct': 0.12261279424368947, 'bear_tp_mult': 2.5009985909134183, 'bear_tsl_mult': 0.567940480960924, 'bear_time_stop': 267, 'bear_use_sma': True, 'bear_use_ema': True, 'bear_use_atr': True, 'bear_use_adx': True, 'bear_use_spike': True, 'bear_rsi_required': False, 'sideways_strategy': 'mean_reversion', 'sideways_bb_std_mult': 2.557292513343562, 'sideways_rsi_os': 37, 'sideways_rsi_ob': 47, 'sideways_adx_thresh': 25.577487500392785, 'sideways_atr_min_pct': 0.01951284115041275, 'sideways_atr_max_pct': 0.08888563893662646, 'sideways_tp_mult': 1.9825884122802329, 'sideways_tsl_mult': 0.8766018999890841, 'sideways_time_stop': 246, 'sideways_use_sma': False, 'sideways_use_ema': True, 'sideways_use_atr': False, 'sideways_use_adx': False, 'sideways_use_spike': True, 'sideways_rsi_required': True}.
[I 2025-08-30 22:32:32,867] Trial 851 finished with values: [-0.014580561234006417, 0.01450448942996287] and parameters: {'p_sma': 31, 'p_std': 39, 'p_atr': 26, 'p_adx': 8, 'rsi_period': 79, 'ema1': 5, 'ema2': 19, 'slip_atr_k': 0.0021666475884865068, 'slip_spread_k': 0.3348323640777021, 'spread_hl_frac': 0.013584305934119438, 'bb_std_mult': 2.307163906134022, 'rsi_os': 14, 'rsi_ob': 88, 'vol_spike': 0.04681478632744581, 'adx_thresh': 17.351401963799805, 'atr_min_pct': 0.014475588613833329, 'atr_max_pct': 0.07040637908786027, 'tp_mult': 1.4753508088665375, 'tsl_mult': 0.5992147518064493, 'strategy': 'mean_reversion', 'time_stop': 118, 'use_sma': True, 'use_atr': True, 'use_adx': True, 'use_ema': True, 'use_spike': True, 'rsi_required': True, 'edge_k': 1.1425005789566773, 'edge_cap': 0.1254568096658648, 'bull_strategy': 'breakout', 'bull_bb_std_mult': 2.09285255243424, 'bull_rsi_os': 44, 'bull_rsi_ob': 85, 'bull_adx_thresh': 15.751507074944382, 'bull_atr_min_pct': 0.0012094101006508554, 'bull_atr_max_pct': 0.03677849218372827, 'bull_tp_mult': 2.129192471375542, 'bull_tsl_mult': 0.5820698202362061, 'bull_time_stop': 268, 'bull_use_sma': True, 'bull_use_ema': False, 'bull_use_atr': False, 'bull_use_adx': True, 'bull_use_spike': True, 'bull_rsi_required': True, 'bear_strategy': 'mean_reversion', 'bear_bb_std_mult': 1.6422546050272564, 'bear_rsi_os': 54, 'bear_rsi_ob': 75, 'bear_adx_thresh': 19.902710619232224, 'bear_atr_min_pct': 0.02706580976130547, 'bear_atr_max_pct': 0.1325585743853858, 'bear_tp_mult': 2.461779994827807, 'bear_tsl_mult': 0.5325262655269488, 'bear_time_stop': 256, 'bear_use_sma': False, 'bear_use_ema': True, 'bear_use_atr': False, 'bear_use_adx': True, 'bear_use_spike': True, 'bear_rsi_required': False, 'sideways_strategy': 'mean_reversion', 'sideways_bb_std_mult': 2.2427074240270217, 'sideways_rsi_os': 37, 'sideways_rsi_ob': 48, 'sideways_adx_thresh': 21.400022888577332, 'sideways_atr_min_pct': 0.01946933295363116, 'sideways_atr_max_pct': 0.0796379410127026, 'sideways_tp_mult': 2.078279654284405, 'sideways_tsl_mult': 0.9042556572314174, 'sideways_time_stop': 249, 'sideways_use_sma': False, 'sideways_use_ema': True, 'sideways_use_atr': False, 'sideways_use_adx': False, 'sideways_use_spike': True, 'sideways_rsi_required': True}.
[I 2025-08-30 22:32:33,193] Trial 852 finished with values: [-1000000000.0, 1000000000.0] and parameters: {'p_sma': 31, 'p_std': 44, 'p_atr': 26, 'p_adx': 8, 'rsi_period': 78, 'ema1': 14, 'ema2': 19, 'slip_atr_k': 0.0008667900226734849, 'slip_spread_k': 0.7441619874243988, 'spread_hl_frac': 0.007911598284143973, 'bb_std_mult': 3.00953028340392, 'rsi_os': 16, 'rsi_ob': 86, 'vol_spike': 0.020981146244870616, 'adx_thresh': 5.517994983925929, 'atr_min_pct': 0.015667501464900743, 'atr_max_pct': 0.06991950455751704, 'tp_mult': 1.4140354336548486, 'tsl_mult': 0.3424701268689545, 'strategy': 'mean_reversion', 'time_stop': 116, 'use_sma': True, 'use_atr': False, 'use_adx': True, 'use_ema': True, 'use_spike': True, 'rsi_required': True, 'edge_k': 1.3203294604441498, 'edge_cap': 0.07238169209590331, 'bull_strategy': 'breakout', 'bull_bb_std_mult': 2.200355938165706, 'bull_rsi_os': 41, 'bull_rsi_ob': 82, 'bull_adx_thresh': 20.109222840309023, 'bull_atr_min_pct': 0.0026444474288601725, 'bull_atr_max_pct': 0.03851559160708113, 'bull_tp_mult': 2.1700531699502403, 'bull_tsl_mult': 0.6250696372664016, 'bull_time_stop': 270, 'bull_use_sma': True, 'bull_use_ema': False, 'bull_use_atr': False, 'bull_use_adx': True, 'bull_use_spike': True, 'bull_rsi_required': False, 'bear_strategy': 'breakout', 'bear_bb_std_mult': 1.631513766848498, 'bear_rsi_os': 12, 'bear_rsi_ob': 77, 'bear_adx_thresh': 29.137644417469797, 'bear_atr_min_pct': 0.02741972056711816, 'bear_atr_max_pct': 0.12843123769589754, 'bear_tp_mult': 2.575511538876541, 'bear_tsl_mult': 0.5401388482412539, 'bear_time_stop': 271, 'bear_use_sma': True, 'bear_use_ema': True, 'bear_use_atr': True, 'bear_use_adx': True, 'bear_use_spike': True, 'bear_rsi_required': False, 'sideways_strategy': 'mean_reversion', 'sideways_bb_std_mult': 2.558990726999963, 'sideways_rsi_os': 34, 'sideways_rsi_ob': 46, 'sideways_adx_thresh': 25.167584360123236, 'sideways_atr_min_pct': 0.01867785555026611, 'sideways_atr_max_pct': 0.07967265955709468, 'sideways_tp_mult': 2.1489859583578386, 'sideways_tsl_mult': 0.9047836829373316, 'sideways_time_stop': 230, 'sideways_use_sma': False, 'sideways_use_ema': True, 'sideways_use_atr': False, 'sideways_use_adx': False, 'sideways_use_spike': True, 'sideways_rsi_required': True}.
[I 2025-08-30 22:32:33,544] Trial 850 finished with values: [-0.022132898649584787, 0.0220571326115251] and parameters: {'p_sma': 31, 'p_std': 7, 'p_atr': 22, 'p_adx': 22, 'rsi_period': 76, 'ema1': 14, 'ema2': 18, 'slip_atr_k': 0.0011084232984083838, 'slip_spread_k': 0.3396184103683866, 'spread_hl_frac': 0.013580370837127022, 'bb_std_mult': 2.3020765317827596, 'rsi_os': 16, 'rsi_ob': 87, 'vol_spike': 0.04578649957513096, 'adx_thresh': 16.404106765905667, 'atr_min_pct': 0.01414814256702806, 'atr_max_pct': 0.07952641853686247, 'tp_mult': 1.5100031320681475, 'tsl_mult': 0.343967187048097, 'strategy': 'mean_reversion', 'time_stop': 118, 'use_sma': True, 'use_atr': True, 'use_adx': True, 'use_ema': True, 'use_spike': True, 'rsi_required': True, 'edge_k': 1.1651130170500223, 'edge_cap': 0.11764097909413435, 'bull_strategy': 'breakout', 'bull_bb_std_mult': 2.084394995829686, 'bull_rsi_os': 41, 'bull_rsi_ob': 85, 'bull_adx_thresh': 15.881867944429157, 'bull_atr_min_pct': 0.0011812677735986371, 'bull_atr_max_pct': 0.046272299579362346, 'bull_tp_mult': 2.1332027459392005, 'bull_tsl_mult': 0.5791929467215885, 'bull_time_stop': 286, 'bull_use_sma': True, 'bull_use_ema': False, 'bull_use_atr': False, 'bull_use_adx': True, 'bull_use_spike': True, 'bull_rsi_required': True, 'bear_strategy': 'mean_reversion', 'bear_bb_std_mult': 1.6398906048597892, 'bear_rsi_os': 12, 'bear_rsi_ob': 75, 'bear_adx_thresh': 27.633636190887014, 'bear_atr_min_pct': 0.02869674678598185, 'bear_atr_max_pct': 0.12236274465608693, 'bear_tp_mult': 2.452546231133738, 'bear_tsl_mult': 0.5900545540371419, 'bear_time_stop': 249, 'bear_use_sma': False, 'bear_use_ema': True, 'bear_use_atr': False, 'bear_use_adx': True, 'bear_use_spike': True, 'bear_rsi_required': False, 'sideways_strategy': 'mean_reversion', 'sideways_bb_std_mult': 2.1472563341445507, 'sideways_rsi_os': 37, 'sideways_rsi_ob': 47, 'sideways_adx_thresh': 25.752108176130932, 'sideways_atr_min_pct': 0.019529805705068126, 'sideways_atr_max_pct': 0.10317093673234579, 'sideways_tp_mult': 2.084584603740617, 'sideways_tsl_mult': 0.9995247848754761, 'sideways_time_stop': 249, 'sideways_use_sma': False, 'sideways_use_ema': True, 'sideways_use_atr': False, 'sideways_use_adx': False, 'sideways_use_spike': True, 'sideways_rsi_required': True}.
[I 2025-08-30 22:33:09,372] Trial 856 finished with values: [-1000000000.0, 1000000000.0] and parameters: {'p_sma': 49, 'p_std': 43, 'p_atr': 25, 'p_adx': 8, 'rsi_period': 78, 'ema1': 15, 'ema2': 19, 'slip_atr_k': 0.000287894014919138, 'slip_spread_k': 0.7276035884865256, 'spread_hl_frac': 0.008634344216908426, 'bb_std_mult': 3.002551838936207, 'rsi_os': 17, 'rsi_ob': 85, 'vol_spike': 0.02323039169084842, 'adx_thresh': 6.0924961287190005, 'atr_min_pct': 0.015431918832801777, 'atr_max_pct': 0.06844188931126549, 'tp_mult': 1.4629120369602364, 'tsl_mult': 0.36350140511330997, 'strategy': 'mean_reversion', 'time_stop': 121, 'use_sma': True, 'use_atr': False, 'use_adx': True, 'use_ema': True, 'use_spike': True, 'rsi_required': False, 'edge_k': 1.3349753622654008, 'edge_cap': 0.07656061963412825, 'bull_strategy': 'mean_reversion', 'bull_bb_std_mult': 2.2107978764763785, 'bull_rsi_os': 40, 'bull_rsi_ob': 81, 'bull_adx_thresh': 18.605532922231244, 'bull_atr_min_pct': 0.002243831085437787, 'bull_atr_max_pct': 0.037330639026817415, 'bull_tp_mult': 2.1832797146294696, 'bull_tsl_mult': 0.6259891788143938, 'bull_time_stop': 266, 'bull_use_sma': True, 'bull_use_ema': True, 'bull_use_atr': False, 'bull_use_adx': True, 'bull_use_spike': True, 'bull_rsi_required': False, 'bear_strategy': 'breakout', 'bear_bb_std_mult': 1.5598135532641706, 'bear_rsi_os': 13, 'bear_rsi_ob': 76, 'bear_adx_thresh': 28.80552800662352, 'bear_atr_min_pct': 0.026540546777290907, 'bear_atr_max_pct': 0.1347446131744581, 'bear_tp_mult': 2.500884079225969, 'bear_tsl_mult': 0.5337938018069975, 'bear_time_stop': 277, 'bear_use_sma': True, 'bear_use_ema': False, 'bear_use_atr': True, 'bear_use_adx': True, 'bear_use_spike': True, 'bear_rsi_required': False, 'sideways_strategy': 'mean_reversion', 'sideways_bb_std_mult': 2.5803154005255755, 'sideways_rsi_os': 30, 'sideways_rsi_ob': 53, 'sideways_adx_thresh': 24.599803580254434, 'sideways_atr_min_pct': 0.018823041536637376, 'sideways_atr_max_pct': 0.08486481716858103, 'sideways_tp_mult': 2.1140003623590733, 'sideways_tsl_mult': 0.9140049106477649, 'sideways_time_stop': 235, 'sideways_use_sma': False, 'sideways_use_ema': True, 'sideways_use_atr': False, 'sideways_use_adx': False, 'sideways_use_spike': True, 'sideways_rsi_required': True}.
[I 2025-08-30 22:33:09,764] Trial 855 finished with values: [-1000000000.0, 1000000000.0] and parameters: {'p_sma': 53, 'p_std': 44, 'p_atr': 26, 'p_adx': 8, 'rsi_period': 79, 'ema1': 15, 'ema2': 19, 'slip_atr_k': 9.126789800410675e-05, 'slip_spread_k': 0.7309144244421311, 'spread_hl_frac': 0.00801140395127341, 'bb_std_mult': 3.1791317404587547, 'rsi_os': 15, 'rsi_ob': 84, 'vol_spike': 0.022388336113628834, 'adx_thresh': 5.016583846543414, 'atr_min_pct': 0.0156468683501291, 'atr_max_pct': 0.06744887052223285, 'tp_mult': 1.416545934087169, 'tsl_mult': 0.3637182119449711, 'strategy': 'mean_reversion', 'time_stop': 119, 'use_sma': True, 'use_atr': False, 'use_adx': True, 'use_ema': True, 'use_spike': True, 'rsi_required': False, 'edge_k': 1.3300488947173088, 'edge_cap': 0.07979240247439641, 'bull_strategy': 'breakout', 'bull_bb_std_mult': 2.200712824815762, 'bull_rsi_os': 40, 'bull_rsi_ob': 81, 'bull_adx_thresh': 18.621452978633783, 'bull_atr_min_pct': 0.003349712607805949, 'bull_atr_max_pct': 0.03684275810748668, 'bull_tp_mult': 2.1642070006013063, 'bull_tsl_mult': 0.6378473677491582, 'bull_time_stop': 272, 'bull_use_sma': True, 'bull_use_ema': True, 'bull_use_atr': False, 'bull_use_adx': True, 'bull_use_spike': True, 'bull_rsi_required': False, 'bear_strategy': 'breakout', 'bear_bb_std_mult': 1.6370789899016225, 'bear_rsi_os': 13, 'bear_rsi_ob': 77, 'bear_adx_thresh': 27.663788904320317, 'bear_atr_min_pct': 0.02698412375899518, 'bear_atr_max_pct': 0.13076588024770197, 'bear_tp_mult': 2.499204199328439, 'bear_tsl_mult': 0.5234295100866635, 'bear_time_stop': 278, 'bear_use_sma': True, 'bear_use_ema': False, 'bear_use_atr': True, 'bear_use_adx': True, 'bear_use_spike': True, 'bear_rsi_required': False, 'sideways_strategy': 'mean_reversion', 'sideways_bb_std_mult': 2.5249183269162923, 'sideways_rsi_os': 32, 'sideways_rsi_ob': 54, 'sideways_adx_thresh': 24.53695656693374, 'sideways_atr_min_pct': 0.01918639593762063, 'sideways_atr_max_pct': 0.08294813106022542, 'sideways_tp_mult': 2.165795834646008, 'sideways_tsl_mult': 0.915639082515752, 'sideways_time_stop': 235, 'sideways_use_sma': False, 'sideways_use_ema': True, 'sideways_use_atr': False, 'sideways_use_adx': False, 'sideways_use_spike': True, 'sideways_rsi_required': True}.
