[I 2025-08-30 22:18:05,122] Trial 750 finished with values: [-1000000000.0, 1000000000.0] and parameters: {'p_sma': 60, 'p_std': 37, 'p_atr': 25, 'p_adx': 21, 'rsi_period': 78, 'ema1': 12, 'ema2': 54, 'slip_atr_k': 0.043976327647411745, 'slip_spread_k': 0.8052567287814716, 'spread_hl_frac': 0.02492710710954372, 'bb_std_mult': 0.593055684755807, 'rsi_os': 55, 'rsi_ob': 68, 'vol_spike': 0.10130086249163142, 'adx_thresh': 17.638393738851583, 'atr_min_pct': 0.022676596542107293, 'atr_max_pct': 0.023287560440707664, 'tp_mult': 2.0104642375254644, 'tsl_mult': 0.9252554293470889, 'strategy': 'mean_reversion', 'time_stop': 81, 'use_sma': True, 'use_atr': True, 'use_adx': True, 'use_ema': True, 'use_spike': True, 'rsi_required': True, 'edge_k': 1.3529522300011663, 'edge_cap': 0.9969611382381376, 'bull_strategy': 'breakout', 'bull_bb_std_mult': 1.838832214367233, 'bull_rsi_os': 18, 'bull_rsi_ob': 85, 'bull_adx_thresh': 14.319790214874326, 'bull_atr_min_pct': 0.02309285941813613, 'bull_atr_max_pct': 0.051126431346079346, 'bull_tp_mult': 1.4300816474307032, 'bull_tsl_mult': 0.013667386589329256, 'bull_time_stop': 293, 'bull_use_sma': True, 'bull_use_ema': False, 'bull_use_atr': False, 'bull_use_adx': False, 'bull_use_spike': False, 'bull_rsi_required': True, 'bear_strategy': 'mean_reversion', 'bear_bb_std_mult': 2.9379615831814574, 'bear_rsi_os': 6, 'bear_rsi_ob': 73, 'bear_adx_thresh': 18.063510890823434, 'bear_atr_min_pct': 0.024091140896898476, 'bear_atr_max_pct': 0.12562472271369324, 'bear_tp_mult': 1.5429515645012573, 'bear_tsl_mult': 0.37809947840048314, 'bear_time_stop': 147, 'bear_use_sma': False, 'bear_use_ema': True, 'bear_use_atr': False, 'bear_use_adx': True, 'bear_use_spike': True, 'bear_rsi_required': True, 'sideways_strategy': 'breakout', 'sideways_bb_std_mult': 1.4831043728546471, 'sideways_rsi_os': 6, 'sideways_rsi_ob': 75, 'sideways_adx_thresh': 28.11305673525743, 'sideways_atr_min_pct': 0.017191616619337928, 'sideways_atr_max_pct': 0.04772340783792175, 'sideways_tp_mult': 2.9162002367573674, 'sideways_tsl_mult': 0.7891660441705657, 'sideways_time_stop': 273, 'sideways_use_sma': False, 'sideways_use_ema': False, 'sideways_use_atr': False, 'sideways_use_adx': True, 'sideways_use_spike': False, 'sideways_rsi_required': False}.
[I 2025-08-30 22:18:32,653] Trial 747 finished with values: [-0.01865133816901965, 0.018574975815648462] and parameters: {'p_sma': 48, 'p_std': 53, 'p_atr': 25, 'p_adx': 7, 'rsi_period': 71, 'ema1': 24, 'ema2': 57, 'slip_atr_k': 0.1507185330648881, 'slip_spread_k': 0.30081444483603426, 'spread_hl_frac': 0.03369437585680359, 'bb_std_mult': 0.9977712139379509, 'rsi_os': 27, 'rsi_ob': 67, 'vol_spike': 0.28787514978341466, 'adx_thresh': 11.461656489568146, 'atr_min_pct': 0.012129429621176656, 'atr_max_pct': 0.026687720368301575, 'tp_mult': 1.7424785268319105, 'tsl_mult': 0.9215708963238266, 'strategy': 'breakout', 'time_stop': 86, 'use_sma': True, 'use_atr': True, 'use_adx': True, 'use_ema': True, 'use_spike': True, 'rsi_required': True, 'edge_k': 0.9185002802253284, 'edge_cap': 0.9960793894274955, 'bull_strategy': 'breakout', 'bull_bb_std_mult': 1.9531992191684573, 'bull_rsi_os': 18, 'bull_rsi_ob': 64, 'bull_adx_thresh': 14.02539777238775, 'bull_atr_min_pct': 0.022725309572511516, 'bull_atr_max_pct': 0.05428876942633433, 'bull_tp_mult': 1.3986971219486515, 'bull_tsl_mult': 0.7150173411575698, 'bull_time_stop': 201, 'bull_use_sma': True, 'bull_use_ema': False, 'bull_use_atr': True, 'bull_use_adx': False, 'bull_use_spike': False, 'bull_rsi_required': True, 'bear_strategy': 'mean_reversion', 'bear_bb_std_mult': 2.205202584210091, 'bear_rsi_os': 7, 'bear_rsi_ob': 71, 'bear_adx_thresh': 11.1389221637584, 'bear_atr_min_pct': 0.006554918641053372, 'bear_atr_max_pct': 0.06734541456203147, 'bear_tp_mult': 1.537599178498896, 'bear_tsl_mult': 0.13011475356279184, 'bear_time_stop': 149, 'bear_use_sma': False, 'bear_use_ema': False, 'bear_use_atr': True, 'bear_use_adx': True, 'bear_use_spike': True, 'bear_rsi_required': True, 'sideways_strategy': 'breakout', 'sideways_bb_std_mult': 1.8235057241131967, 'sideways_rsi_os': 39, 'sideways_rsi_ob': 93, 'sideways_adx_thresh': 28.23490261572754, 'sideways_atr_min_pct': 0.001279885495664804, 'sideways_atr_max_pct': 0.03757431505147428, 'sideways_tp_mult': 2.921624375859424, 'sideways_tsl_mult': 0.84079337219448, 'sideways_time_stop': 20, 'sideways_use_sma': False, 'sideways_use_ema': False, 'sideways_use_atr': False, 'sideways_use_adx': False, 'sideways_use_spike': False, 'sideways_rsi_required': False}.
[I 2025-08-30 22:18:34,190] Trial 748 finished with values: [-0.0631087433854598, 0.06302313074260008] and parameters: {'p_sma': 41, 'p_std': 44, 'p_atr': 22, 'p_adx': 24, 'rsi_period': 71, 'ema1': 29, 'ema2': 57, 'slip_atr_k': 0.024717128381543437, 'slip_spread_k': 0.30172158641209146, 'spread_hl_frac': 0.03037806538477322, 'bb_std_mult': 1.0007971510046487, 'rsi_os': 46, 'rsi_ob': 67, 'vol_spike': 0.28938079711957, 'adx_thresh': 12.605391253602605, 'atr_min_pct': 0.011821534693419043, 'atr_max_pct': 0.1348376930745952, 'tp_mult': 2.8251472544025718, 'tsl_mult': 0.929379507103175, 'strategy': 'breakout', 'time_stop': 88, 'use_sma': True, 'use_atr': True, 'use_adx': True, 'use_ema': True, 'use_spike': True, 'rsi_required': True, 'edge_k': 1.1663150558996418, 'edge_cap': 0.7924127679888006, 'bull_strategy': 'breakout', 'bull_bb_std_mult': 1.4198540317492125, 'bull_rsi_os': 38, 'bull_rsi_ob': 88, 'bull_adx_thresh': 32.0088900900612, 'bull_atr_min_pct': 0.0010225183683132142, 'bull_atr_max_pct': 0.050921151467607964, 'bull_tp_mult': 1.4304512561434148, 'bull_tsl_mult': 0.5562929278870905, 'bull_time_stop': 294, 'bull_use_sma': True, 'bull_use_ema': False, 'bull_use_atr': True, 'bull_use_adx': False, 'bull_use_spike': False, 'bull_rsi_required': True, 'bear_strategy': 'mean_reversion', 'bear_bb_std_mult': 1.0252838704681315, 'bear_rsi_os': 22, 'bear_rsi_ob': 73, 'bear_adx_thresh': 28.616242392578336, 'bear_atr_min_pct': 0.019148974343314737, 'bear_atr_max_pct': 0.0927869757945505, 'bear_tp_mult': 1.5442483664119904, 'bear_tsl_mult': 0.4086637816262933, 'bear_time_stop': 212, 'bear_use_sma': False, 'bear_use_ema': False, 'bear_use_atr': True, 'bear_use_adx': True, 'bear_use_spike': True, 'bear_rsi_required': True, 'sideways_strategy': 'breakout', 'sideways_bb_std_mult': 1.716944985342374, 'sideways_rsi_os': 55, 'sideways_rsi_ob': 93, 'sideways_adx_thresh': 28.214158743180608, 'sideways_atr_min_pct': 0.0010492219212253594, 'sideways_atr_max_pct': 0.11879929757581092, 'sideways_tp_mult': 1.0522549790341889, 'sideways_tsl_mult': 0.8414174406543677, 'sideways_time_stop': 202, 'sideways_use_sma': False, 'sideways_use_ema': False, 'sideways_use_atr': False, 'sideways_use_adx': False, 'sideways_use_spike': False, 'sideways_rsi_required': False}.
[I 2025-08-30 22:18:34,402] Trial 749 finished with values: [-1000000000.0, 1000000000.0] and parameters: {'p_sma': 54, 'p_std': 37, 'p_atr': 20, 'p_adx': 16, 'rsi_period': 53, 'ema1': 24, 'ema2': 57, 'slip_atr_k': 0.042192759685611286, 'slip_spread_k': 0.30957993021078434, 'spread_hl_frac': 0.02490577476050616, 'bb_std_mult': 0.5888860057329484, 'rsi_os': 27, 'rsi_ob': 68, 'vol_spike': 0.28891724630075744, 'adx_thresh': 18.298207232767684, 'atr_min_pct': 0.012096817253291165, 'atr_max_pct': 0.0655564537310911, 'tp_mult': 1.7324584963477982, 'tsl_mult': 0.827413057881171, 'strategy': 'breakout', 'time_stop': 84, 'use_sma': True, 'use_atr': True, 'use_adx': True, 'use_ema': True, 'use_spike': True, 'rsi_required': True, 'edge_k': 0.16952876639873327, 'edge_cap': 0.9911519536300037, 'bull_strategy': 'breakout', 'bull_bb_std_mult': 1.8197822809834998, 'bull_rsi_os': 18, 'bull_rsi_ob': 62, 'bull_adx_thresh': 34.147909500934034, 'bull_atr_min_pct': 0.0012132254769767845, 'bull_atr_max_pct': 0.05085055612448569, 'bull_tp_mult': 1.2903017002062769, 'bull_tsl_mult': 0.5518553679301728, 'bull_time_stop': 292, 'bull_use_sma': True, 'bull_use_ema': False, 'bull_use_atr': False, 'bull_use_adx': False, 'bull_use_spike': False, 'bull_rsi_required': True, 'bear_strategy': 'mean_reversion', 'bear_bb_std_mult': 2.2688585865890936, 'bear_rsi_os': 51, 'bear_rsi_ob': 71, 'bear_adx_thresh': 20.85420240384297, 'bear_atr_min_pct': 0.026930114667547175, 'bear_atr_max_pct': 0.06603241650269999, 'bear_tp_mult': 1.9921020487338026, 'bear_tsl_mult': 0.4161452115965666, 'bear_time_stop': 149, 'bear_use_sma': False, 'bear_use_ema': True, 'bear_use_atr': False, 'bear_use_adx': True, 'bear_use_spike': True, 'bear_rsi_required': True, 'sideways_strategy': 'breakout', 'sideways_bb_std_mult': 1.7151706456702662, 'sideways_rsi_os': 6, 'sideways_rsi_ob': 50, 'sideways_adx_thresh': 28.16569066537315, 'sideways_atr_min_pct': 0.02031475844161027, 'sideways_atr_max_pct': 0.04173559079365854, 'sideways_tp_mult': 1.793279504748796, 'sideways_tsl_mult': 0.8382080596048656, 'sideways_time_stop': 275, 'sideways_use_sma': False, 'sideways_use_ema': False, 'sideways_use_atr': False, 'sideways_use_adx': False, 'sideways_use_spike': False, 'sideways_rsi_required': False}.
[I 2025-08-30 22:18:39,593] Trial 751 finished with values: [-1000000000.0, 1000000000.0] and parameters: {'p_sma': 32, 'p_std': 36, 'p_atr': 29, 'p_adx': 16, 'rsi_period': 67, 'ema1': 28, 'ema2': 26, 'slip_atr_k': 0.15898741534155952, 'slip_spread_k': 0.2903871017395262, 'spread_hl_frac': 0.03357680865292378, 'bb_std_mult': 0.8064381654754521, 'rsi_os': 46, 'rsi_ob': 67, 'vol_spike': 0.2959792150510585, 'adx_thresh': 23.027873325677778, 'atr_min_pct': 0.005111499167291639, 'atr_max_pct': 0.016953847785183936, 'tp_mult': 1.7359420797981169, 'tsl_mult': 0.8269824386532256, 'strategy': 'mean_reversion', 'time_stop': 274, 'use_sma': True, 'use_atr': True, 'use_adx': True, 'use_ema': True, 'use_spike': True, 'rsi_required': True, 'edge_k': 0.8952899032143955, 'edge_cap': 0.8450632807194242, 'bull_strategy': 'breakout', 'bull_bb_std_mult': 2.185442265754971, 'bull_rsi_os': 28, 'bull_rsi_ob': 88, 'bull_adx_thresh': 25.16821552977903, 'bull_atr_min_pct': 0.0006172088546638369, 'bull_atr_max_pct': 0.05002775041291168, 'bull_tp_mult': 1.2720900704724696, 'bull_tsl_mult': 0.37002445733099465, 'bull_time_stop': 262, 'bull_use_sma': True, 'bull_use_ema': False, 'bull_use_atr': False, 'bull_use_adx': False, 'bull_use_spike': False, 'bull_rsi_required': True, 'bear_strategy': 'mean_reversion', 'bear_bb_std_mult': 2.2083444116142577, 'bear_rsi_os': 54, 'bear_rsi_ob': 73, 'bear_adx_thresh': 10.878534046349818, 'bear_atr_min_pct': 0.027268763544239943, 'bear_atr_max_pct': 0.1208857043210949, 'bear_tp_mult': 1.0585437701129607, 'bear_tsl_mult': 0.41940550622486905, 'bear_time_stop': 241, 'bear_use_sma': False, 'bear_use_ema': True, 'bear_use_atr': False, 'bear_use_adx': True, 'bear_use_spike': True, 'bear_rsi_required': True, 'sideways_strategy': 'breakout', 'sideways_bb_std_mult': 1.7116008622280132, 'sideways_rsi_os': 12, 'sideways_rsi_ob': 93, 'sideways_adx_thresh': 10.597720019092415, 'sideways_atr_min_pct': 0.020483152948469703, 'sideways_atr_max_pct': 0.04242624261059401, 'sideways_tp_mult': 1.8088288312933622, 'sideways_tsl_mult': 0.8114438054907224, 'sideways_time_stop': 201, 'sideways_use_sma': False, 'sideways_use_ema': False, 'sideways_use_atr': False, 'sideways_use_adx': True, 'sideways_use_spike': False, 'sideways_rsi_required': False}.
[I 2025-08-30 22:19:12,434] Trial 753 finished with values: [-0.01680000956678518, 0.01670384247394529] and parameters: {'p_sma': 32, 'p_std': 37, 'p_atr': 29, 'p_adx': 25, 'rsi_period': 67, 'ema1': 11, 'ema2': 52, 'slip_atr_k': 0.05212868522141452, 'slip_spread_k': 0.621344578190766, 'spread_hl_frac': 0.031847761547825246, 'bb_std_mult': 1.0883146539793587, 'rsi_os': 13, 'rsi_ob': 53, 'vol_spike': 0.2776830652412357, 'adx_thresh': 23.167636043094017, 'atr_min_pct': 0.012777535621006943, 'atr_max_pct': 0.0348431033792202, 'tp_mult': 2.435395068405598, 'tsl_mult': 0.8267959256581813, 'strategy': 'mean_reversion', 'time_stop': 285, 'use_sma': True, 'use_atr': True, 'use_adx': False, 'use_ema': True, 'use_spike': False, 'rsi_required': True, 'edge_k': 0.14550985976593656, 'edge_cap': 0.8406616942302255, 'bull_strategy': 'breakout', 'bull_bb_std_mult': 2.412625579095876, 'bull_rsi_os': 36, 'bull_rsi_ob': 94, 'bull_adx_thresh': 15.596239059727443, 'bull_atr_min_pct': 0.0005211501504576197, 'bull_atr_max_pct': 0.04053345631372887, 'bull_tp_mult': 1.5089028513755716, 'bull_tsl_mult': 0.7563740334761878, 'bull_time_stop': 32, 'bull_use_sma': True, 'bull_use_ema': False, 'bull_use_atr': False, 'bull_use_adx': False, 'bull_use_spike': False, 'bull_rsi_required': False, 'bear_strategy': 'mean_reversion', 'bear_bb_std_mult': 0.8589073809021046, 'bear_rsi_os': 51, 'bear_rsi_ob': 69, 'bear_adx_thresh': 26.36722174468038, 'bear_atr_min_pct': 0.0008204013225293558, 'bear_atr_max_pct': 0.09982970990218235, 'bear_tp_mult': 1.6265737449521267, 'bear_tsl_mult': 0.41179291777635096, 'bear_time_stop': 246, 'bear_use_sma': False, 'bear_use_ema': True, 'bear_use_atr': False, 'bear_use_adx': True, 'bear_use_spike': True, 'bear_rsi_required': False, 'sideways_strategy': 'breakout', 'sideways_bb_std_mult': 2.825791607918305, 'sideways_rsi_os': 12, 'sideways_rsi_ob': 77, 'sideways_adx_thresh': 27.19770775075896, 'sideways_atr_min_pct': 0.01821072340378694, 'sideways_atr_max_pct': 0.04095927726735558, 'sideways_tp_mult': 1.7957606951532454, 'sideways_tsl_mult': 0.9675004147384865, 'sideways_time_stop': 131, 'sideways_use_sma': True, 'sideways_use_ema': False, 'sideways_use_atr': False, 'sideways_use_adx': True, 'sideways_use_spike': True, 'sideways_rsi_required': False}.
[I 2025-08-30 22:19:13,486] Trial 752 finished with values: [-1000000000.0, 1000000000.0] and parameters: {'p_sma': 41, 'p_std': 37, 'p_atr': 20, 'p_adx': 19, 'rsi_period': 76, 'ema1': 28, 'ema2': 25, 'slip_atr_k': 0.007243683215909721, 'slip_spread_k': 0.9423478248927419, 'spread_hl_frac': 0.03367218667722423, 'bb_std_mult': 1.8857219258518552, 'rsi_os': 13, 'rsi_ob': 53, 'vol_spike': 0.2945077779895174, 'adx_thresh': 19.12756903180748, 'atr_min_pct': 0.006589487318107018, 'atr_max_pct': 0.13613467684383238, 'tp_mult': 2.4448074699850726, 'tsl_mult': 0.8320954395338925, 'strategy': 'mean_reversion', 'time_stop': 95, 'use_sma': True, 'use_atr': True, 'use_adx': False, 'use_ema': True, 'use_spike': False, 'rsi_required': True, 'edge_k': 0.16226570579988697, 'edge_cap': 0.8427672927059612, 'bull_strategy': 'breakout', 'bull_bb_std_mult': 2.0671755103832186, 'bull_rsi_os': 20, 'bull_rsi_ob': 85, 'bull_adx_thresh': 14.487547321249208, 'bull_atr_min_pct': 0.021041855840477318, 'bull_atr_max_pct': 0.04999581793150076, 'bull_tp_mult': 1.287822264773946, 'bull_tsl_mult': 0.11948438126016103, 'bull_time_stop': 33, 'bull_use_sma': True, 'bull_use_ema': False, 'bull_use_atr': False, 'bull_use_adx': False, 'bull_use_spike': False, 'bull_rsi_required': True, 'bear_strategy': 'mean_reversion', 'bear_bb_std_mult': 0.8789411072434758, 'bear_rsi_os': 5, 'bear_rsi_ob': 83, 'bear_adx_thresh': 28.52300401540036, 'bear_atr_min_pct': 0.02997057086581903, 'bear_atr_max_pct': 0.09961385263839835, 'bear_tp_mult': 1.2245269741662521, 'bear_tsl_mult': 0.4091622541298041, 'bear_time_stop': 64, 'bear_use_sma': False, 'bear_use_ema': True, 'bear_use_atr': False, 'bear_use_adx': True, 'bear_use_spike': True, 'bear_rsi_required': True, 'sideways_strategy': 'breakout', 'sideways_bb_std_mult': 1.716951411676382, 'sideways_rsi_os': 12, 'sideways_rsi_ob': 89, 'sideways_adx_thresh': 26.552085212495047, 'sideways_atr_min_pct': 0.029966651150577527, 'sideways_atr_max_pct': 0.04306612359659297, 'sideways_tp_mult': 1.7976020599692686, 'sideways_tsl_mult': 0.37918662845201045, 'sideways_time_stop': 268, 'sideways_use_sma': True, 'sideways_use_ema': False, 'sideways_use_atr': False, 'sideways_use_adx': True, 'sideways_use_spike': True, 'sideways_rsi_required': False}.
[I 2025-08-30 22:19:13,869] Trial 754 finished with values: [-0.016212827140700714, 0.016147783486875202] and parameters: {'p_sma': 32, 'p_std': 35, 'p_atr': 19, 'p_adx': 21, 'rsi_period': 26, 'ema1': 30, 'ema2': 51, 'slip_atr_k': 0.01189555049581834, 'slip_spread_k': 0.9267126524439959, 'spread_hl_frac': 0.03174714189853904, 'bb_std_mult': 1.8567793983646042, 'rsi_os': 13, 'rsi_ob': 53, 'vol_spike': 0.2786649983536489, 'adx_thresh': 23.617427814297734, 'atr_min_pct': 0.012838276420479236, 'atr_max_pct': 0.01719450628082288, 'tp_mult': 1.9266384130839582, 'tsl_mult': 0.9007485205156254, 'strategy': 'mean_reversion', 'time_stop': 99, 'use_sma': True, 'use_atr': False, 'use_adx': False, 'use_ema': True, 'use_spike': False, 'rsi_required': True, 'edge_k': 1.0629049891667828, 'edge_cap': 0.8451117527416019, 'bull_strategy': 'breakout', 'bull_bb_std_mult': 2.167490242724991, 'bull_rsi_os': 20, 'bull_rsi_ob': 88, 'bull_adx_thresh': 15.700140904535118, 'bull_atr_min_pct': 0.00045113276095375826, 'bull_atr_max_pct': 0.02453469347163563, 'bull_tp_mult': 1.4923878074166694, 'bull_tsl_mult': 0.5897143811466155, 'bull_time_stop': 47, 'bull_use_sma': True, 'bull_use_ema': False, 'bull_use_atr': False, 'bull_use_adx': False, 'bull_use_spike': False, 'bull_rsi_required': False, 'bear_strategy': 'mean_reversion', 'bear_bb_std_mult': 0.8787941475199892, 'bear_rsi_os': 27, 'bear_rsi_ob': 69, 'bear_adx_thresh': 25.857286345177243, 'bear_atr_min_pct': 0.02998235647365817, 'bear_atr_max_pct': 0.12126042275148412, 'bear_tp_mult': 1.2209602904530503, 'bear_tsl_mult': 0.45022019999459784, 'bear_time_stop': 163, 'bear_use_sma': False, 'bear_use_ema': True, 'bear_use_atr': False, 'bear_use_adx': True, 'bear_use_spike': True, 'bear_rsi_required': False, 'sideways_strategy': 'breakout', 'sideways_bb_std_mult': 1.8091279883118931, 'sideways_rsi_os': 54, 'sideways_rsi_ob': 91, 'sideways_adx_thresh': 10.546983308995182, 'sideways_atr_min_pct': 0.02248801735699609, 'sideways_atr_max_pct': 0.04339849231482431, 'sideways_tp_mult': 1.734952418488694, 'sideways_tsl_mult': 0.8059309009613113, 'sideways_time_stop': 267, 'sideways_use_sma': True, 'sideways_use_ema': False, 'sideways_use_atr': False, 'sideways_use_adx': True, 'sideways_use_spike': True, 'sideways_rsi_required': False}.
[I 2025-08-30 22:19:14,393] Trial 755 finished with values: [-1000000000.0, 1000000000.0] and parameters: {'p_sma': 38, 'p_std': 34, 'p_atr': 19, 'p_adx': 21, 'rsi_period': 81, 'ema1': 11, 'ema2': 51, 'slip_atr_k': 0.014478683464475825, 'slip_spread_k': 0.6134779317232094, 'spread_hl_frac': 0.03174816749841101, 'bb_std_mult': 0.6782096923190385, 'rsi_os': 13, 'rsi_ob': 63, 'vol_spike': 0.22508556145963776, 'adx_thresh': 10.596285251725673, 'atr_min_pct': 0.0064556113384686194, 'atr_max_pct': 0.023023960567722143, 'tp_mult': 1.541677966890989, 'tsl_mult': 0.857424013272684, 'strategy': 'mean_reversion', 'time_stop': 180, 'use_sma': True, 'use_atr': False, 'use_adx': False, 'use_ema': True, 'use_spike': False, 'rsi_required': True, 'edge_k': 1.0628945738900408, 'edge_cap': 0.768934767617332, 'bull_strategy': 'breakout', 'bull_bb_std_mult': 2.0940023626910875, 'bull_rsi_os': 36, 'bull_rsi_ob': 54, 'bull_adx_thresh': 15.800638085351748, 'bull_atr_min_pct': 0.0020890856961556727, 'bull_atr_max_pct': 0.03988703229180803, 'bull_tp_mult': 1.1320997340585475, 'bull_tsl_mult': 0.4049075363473112, 'bull_time_stop': 131, 'bull_use_sma': True, 'bull_use_ema': False, 'bull_use_atr': False, 'bull_use_adx': False, 'bull_use_spike': False, 'bull_rsi_required': False, 'bear_strategy': 'mean_reversion', 'bear_bb_std_mult': 0.8886148880579956, 'bear_rsi_os': 33, 'bear_rsi_ob': 69, 'bear_adx_thresh': 29.57859944660286, 'bear_atr_min_pct': 0.029982190162163472, 'bear_atr_max_pct': 0.11481999770042965, 'bear_tp_mult': 1.6335944959641024, 'bear_tsl_mult': 0.38190273326877483, 'bear_time_stop': 247, 'bear_use_sma': False, 'bear_use_ema': True, 'bear_use_atr': False, 'bear_use_adx': True, 'bear_use_spike': True, 'bear_rsi_required': False, 'sideways_strategy': 'breakout', 'sideways_bb_std_mult': 3.2284363259018667, 'sideways_rsi_os': 48, 'sideways_rsi_ob': 89, 'sideways_adx_thresh': 26.573723977352874, 'sideways_atr_min_pct': 0.02223658148150964, 'sideways_atr_max_pct': 0.03216529222113541, 'sideways_tp_mult': 1.7334103962075502, 'sideways_tsl_mult': 0.9684420137165757, 'sideways_time_stop': 252, 'sideways_use_sma': True, 'sideways_use_ema': False, 'sideways_use_atr': False, 'sideways_use_adx': True, 'sideways_use_spike': True, 'sideways_rsi_required': False}.
