[I 2025-08-30 22:16:43,948] Trial 730 finished with values: [-1000000000.0, 1000000000.0] and parameters: {'p_sma': 31, 'p_std': 39, 'p_atr': 21, 'p_adx': 13, 'rsi_period': 72, 'ema1': 12, 'ema2': 55, 'slip_atr_k': 0.02090719300021748, 'slip_spread_k': 0.6604676206808281, 'spread_hl_frac': 0.04864753426649475, 'bb_std_mult': 0.7804821805933009, 'rsi_os': 7, 'rsi_ob': 55, 'vol_spike': 0.17411097709892287, 'adx_thresh': 11.59271674448319, 'atr_min_pct': 0.012395940643341445, 'atr_max_pct': 0.04216287932618534, 'tp_mult': 1.583845421178423, 'tsl_mult': 0.9051728723238807, 'strategy': 'breakout', 'time_stop': 16, 'use_sma': True, 'use_atr': True, 'use_adx': True, 'use_ema': True, 'use_spike': True, 'rsi_required': True, 'edge_k': 1.0377905173426343, 'edge_cap': 0.4413602772285054, 'bull_strategy': 'breakout', 'bull_bb_std_mult': 1.1832586240998801, 'bull_rsi_os': 16, 'bull_rsi_ob': 82, 'bull_adx_thresh': 20.697659970112536, 'bull_atr_min_pct': 0.0030643849630215356, 'bull_atr_max_pct': 0.05064810172263067, 'bull_tp_mult': 2.047425199259335, 'bull_tsl_mult': 0.3896331534021792, 'bull_time_stop': 122, 'bull_use_sma': True, 'bull_use_ema': False, 'bull_use_atr': True, 'bull_use_adx': False, 'bull_use_spike': False, 'bull_rsi_required': True, 'bear_strategy': 'mean_reversion', 'bear_bb_std_mult': 3.103814661939697, 'bear_rsi_os': 7, 'bear_rsi_ob': 87, 'bear_adx_thresh': 23.725886327660014, 'bear_atr_min_pct': 0.028128996140325168, 'bear_atr_max_pct': 0.02479043093904694, 'bear_tp_mult': 1.6697145963774245, 'bear_tsl_mult': 0.3672462834045242, 'bear_time_stop': 241, 'bear_use_sma': False, 'bear_use_ema': True, 'bear_use_atr': True, 'bear_use_adx': True, 'bear_use_spike': True, 'bear_rsi_required': True, 'sideways_strategy': 'breakout', 'sideways_bb_std_mult': 1.6897450950335822, 'sideways_rsi_os': 37, 'sideways_rsi_ob': 86, 'sideways_adx_thresh': 29.02045431068639, 'sideways_atr_min_pct': 0.019775068184332084, 'sideways_atr_max_pct': 0.10723701745793596, 'sideways_tp_mult': 1.7707602264834736, 'sideways_tsl_mult': 0.0022627004393018235, 'sideways_time_stop': 256, 'sideways_use_sma': False, 'sideways_use_ema': False, 'sideways_use_atr': False, 'sideways_use_adx': False, 'sideways_use_spike': False, 'sideways_rsi_required': False}.
[I 2025-08-30 22:16:44,187] Trial 729 finished with values: [-1000000000.0, 1000000000.0] and parameters: {'p_sma': 31, 'p_std': 33, 'p_atr': 21, 'p_adx': 19, 'rsi_period': 72, 'ema1': 13, 'ema2': 55, 'slip_atr_k': 0.020598642418588636, 'slip_spread_k': 0.6158106549400706, 'spread_hl_frac': 0.028472906866288807, 'bb_std_mult': 0.818718675085502, 'rsi_os': 12, 'rsi_ob': 64, 'vol_spike': 0.18908876719621237, 'adx_thresh': 14.56958553728148, 'atr_min_pct': 0.004571901258226523, 'atr_max_pct': 0.04298709862123508, 'tp_mult': 2.721154533770572, 'tsl_mult': 0.15178173701289854, 'strategy': 'breakout', 'time_stop': 173, 'use_sma': True, 'use_atr': True, 'use_adx': True, 'use_ema': True, 'use_spike': True, 'rsi_required': True, 'edge_k': 1.0445696303013732, 'edge_cap': 0.790265094375698, 'bull_strategy': 'breakout', 'bull_bb_std_mult': 1.2093947656654058, 'bull_rsi_os': 42, 'bull_rsi_ob': 82, 'bull_adx_thresh': 32.905638278641185, 'bull_atr_min_pct': 0.029731230111851963, 'bull_atr_max_pct': 0.1295887489358318, 'bull_tp_mult': 1.392983324117635, 'bull_tsl_mult': 0.38944359058345335, 'bull_time_stop': 291, 'bull_use_sma': True, 'bull_use_ema': False, 'bull_use_atr': True, 'bull_use_adx': False, 'bull_use_spike': False, 'bull_rsi_required': True, 'bear_strategy': 'mean_reversion', 'bear_bb_std_mult': 1.9172087255293004, 'bear_rsi_os': 6, 'bear_rsi_ob': 72, 'bear_adx_thresh': 24.78482329929618, 'bear_atr_min_pct': 0.0278452274424765, 'bear_atr_max_pct': 0.11823710697458474, 'bear_tp_mult': 1.669550102589679, 'bear_tsl_mult': 0.36497654990210954, 'bear_time_stop': 31, 'bear_use_sma': False, 'bear_use_ema': True, 'bear_use_atr': True, 'bear_use_adx': True, 'bear_use_spike': True, 'bear_rsi_required': True, 'sideways_strategy': 'breakout', 'sideways_bb_std_mult': 2.515069226390008, 'sideways_rsi_os': 11, 'sideways_rsi_ob': 91, 'sideways_adx_thresh': 26.91675757443589, 'sideways_atr_min_pct': 0.02227511719574749, 'sideways_atr_max_pct': 0.03461157978017258, 'sideways_tp_mult': 1.771668150839857, 'sideways_tsl_mult': 0.15039637010588586, 'sideways_time_stop': 58, 'sideways_use_sma': False, 'sideways_use_ema': False, 'sideways_use_atr': False, 'sideways_use_adx': False, 'sideways_use_spike': False, 'sideways_rsi_required': False}.
[I 2025-08-30 22:16:45,500] Trial 733 finished with values: [-1000000000.0, 1000000000.0] and parameters: {'p_sma': 34, 'p_std': 35, 'p_atr': 22, 'p_adx': 12, 'rsi_period': 67, 'ema1': 12, 'ema2': 12, 'slip_atr_k': 0.009268894176852106, 'slip_spread_k': 0.2504469035886355, 'spread_hl_frac': 0.031027062132012655, 'bb_std_mult': 0.6177220643053878, 'rsi_os': 53, 'rsi_ob': 84, 'vol_spike': 0.27178879479754453, 'adx_thresh': 9.559328908481014, 'atr_min_pct': 0.014524429602376132, 'atr_max_pct': 0.01714517984590571, 'tp_mult': 1.3465358221912775, 'tsl_mult': 0.7521774311441067, 'strategy': 'mean_reversion', 'time_stop': 67, 'use_sma': True, 'use_atr': True, 'use_adx': True, 'use_ema': True, 'use_spike': True, 'rsi_required': True, 'edge_k': 1.445668544733875, 'edge_cap': 0.3970656415106639, 'bull_strategy': 'breakout', 'bull_bb_std_mult': 2.024052138638019, 'bull_rsi_os': 41, 'bull_rsi_ob': 75, 'bull_adx_thresh': 11.437818840485011, 'bull_atr_min_pct': 0.005430525135166543, 'bull_atr_max_pct': 0.08089910516882513, 'bull_tp_mult': 1.3430742023546556, 'bull_tsl_mult': 0.6742175255060747, 'bull_time_stop': 289, 'bull_use_sma': True, 'bull_use_ema': False, 'bull_use_atr': False, 'bull_use_adx': False, 'bull_use_spike': False, 'bull_rsi_required': True, 'bear_strategy': 'mean_reversion', 'bear_bb_std_mult': 1.9311836485696143, 'bear_rsi_os': 47, 'bear_rsi_ob': 71, 'bear_adx_thresh': 19.030469637442028, 'bear_atr_min_pct': 0.021926152822178108, 'bear_atr_max_pct': 0.11824307887226844, 'bear_tp_mult': 2.0998245488630136, 'bear_tsl_mult': 0.5606017617066967, 'bear_time_stop': 245, 'bear_use_sma': False, 'bear_use_ema': True, 'bear_use_atr': False, 'bear_use_adx': True, 'bear_use_spike': True, 'bear_rsi_required': True, 'sideways_strategy': 'breakout', 'sideways_bb_std_mult': 2.3965354275018216, 'sideways_rsi_os': 25, 'sideways_rsi_ob': 91, 'sideways_adx_thresh': 26.734761589215168, 'sideways_atr_min_pct': 0.021539857985801932, 'sideways_atr_max_pct': 0.056337346915276365, 'sideways_tp_mult': 1.7663791367122041, 'sideways_tsl_mult': 0.5867454702693478, 'sideways_time_stop': 279, 'sideways_use_sma': False, 'sideways_use_ema': False, 'sideways_use_atr': False, 'sideways_use_adx': True, 'sideways_use_spike': False, 'sideways_rsi_required': False}.
[I 2025-08-30 22:17:21,536] Trial 732 finished with values: [-1000000000.0, 1000000000.0] and parameters: {'p_sma': 34, 'p_std': 39, 'p_atr': 30, 'p_adx': 18, 'rsi_period': 47, 'ema1': 12, 'ema2': 60, 'slip_atr_k': 0.020918704046635914, 'slip_spread_k': 0.2558738583385974, 'spread_hl_frac': 0.0351324075945662, 'bb_std_mult': 3.4965099933173507, 'rsi_os': 7, 'rsi_ob': 69, 'vol_spike': 0.273610283216577, 'adx_thresh': 20.77783973246644, 'atr_min_pct': 0.014308265605392502, 'atr_max_pct': 0.04336517152551761, 'tp_mult': 1.5817274438441087, 'tsl_mult': 0.7435438570428252, 'strategy': 'mean_reversion', 'time_stop': 83, 'use_sma': True, 'use_atr': True, 'use_adx': True, 'use_ema': True, 'use_spike': True, 'rsi_required': True, 'edge_k': 1.4014346374063167, 'edge_cap': 0.19723086592624373, 'bull_strategy': 'breakout', 'bull_bb_std_mult': 1.8400784556064433, 'bull_rsi_os': 22, 'bull_rsi_ob': 66, 'bull_adx_thresh': 20.811853599894675, 'bull_atr_min_pct': 2.8666547025683106e-05, 'bull_atr_max_pct': 0.1057112113659118, 'bull_tp_mult': 2.693398556679152, 'bull_tsl_mult': 0.38276770493889906, 'bull_time_stop': 180, 'bull_use_sma': True, 'bull_use_ema': False, 'bull_use_atr': False, 'bull_use_adx': False, 'bull_use_spike': False, 'bull_rsi_required': True, 'bear_strategy': 'mean_reversion', 'bear_bb_std_mult': 1.915588309004711, 'bear_rsi_os': 20, 'bear_rsi_ob': 72, 'bear_adx_thresh': 28.136418356545818, 'bear_atr_min_pct': 0.028017329929166362, 'bear_atr_max_pct': 0.11709379251401594, 'bear_tp_mult': 1.5170651194301261, 'bear_tsl_mult': 0.6342458995749298, 'bear_time_stop': 249, 'bear_use_sma': False, 'bear_use_ema': True, 'bear_use_atr': False, 'bear_use_adx': True, 'bear_use_spike': True, 'bear_rsi_required': True, 'sideways_strategy': 'breakout', 'sideways_bb_std_mult': 3.375345688915348, 'sideways_rsi_os': 38, 'sideways_rsi_ob': 65, 'sideways_adx_thresh': 29.032734202376304, 'sideways_atr_min_pct': 0.020176332836962095, 'sideways_atr_max_pct': 0.0466599612903651, 'sideways_tp_mult': 1.7707453248892469, 'sideways_tsl_mult': 0.5958756766685318, 'sideways_time_stop': 256, 'sideways_use_sma': False, 'sideways_use_ema': False, 'sideways_use_atr': False, 'sideways_use_adx': True, 'sideways_use_spike': False, 'sideways_rsi_required': False}.
[I 2025-08-30 22:17:21,568] Trial 731 finished with values: [-1000000000.0, 1000000000.0] and parameters: {'p_sma': 11, 'p_std': 12, 'p_atr': 22, 'p_adx': 12, 'rsi_period': 14, 'ema1': 9, 'ema2': 20, 'slip_atr_k': 0.1248325724697596, 'slip_spread_k': 0.6085560920375246, 'spread_hl_frac': 0.03986763381409998, 'bb_std_mult': 1.978127457135859, 'rsi_os': 10, 'rsi_ob': 84, 'vol_spike': 0.2450443360449277, 'adx_thresh': 24.46381242403824, 'atr_min_pct': 0.012791842222519837, 'atr_max_pct': 0.017551965829098286, 'tp_mult': 2.7461177812719866, 'tsl_mult': 0.7087964603770716, 'strategy': 'mean_reversion', 'time_stop': 29, 'use_sma': True, 'use_atr': True, 'use_adx': True, 'use_ema': True, 'use_spike': True, 'rsi_required': True, 'edge_k': 0.8903941862122423, 'edge_cap': 0.888884422227182, 'bull_strategy': 'breakout', 'bull_bb_std_mult': 1.1912955232016085, 'bull_rsi_os': 40, 'bull_rsi_ob': 83, 'bull_adx_thresh': 20.738427513602314, 'bull_atr_min_pct': 0.005254986089441315, 'bull_atr_max_pct': 0.06931387213005108, 'bull_tp_mult': 2.0524673436509144, 'bull_tsl_mult': 0.9922141761308749, 'bull_time_stop': 290, 'bull_use_sma': True, 'bull_use_ema': False, 'bull_use_atr': False, 'bull_use_adx': False, 'bull_use_spike': False, 'bull_rsi_required': True, 'bear_strategy': 'mean_reversion', 'bear_bb_std_mult': 1.923005706281702, 'bear_rsi_os': 8, 'bear_rsi_ob': 72, 'bear_adx_thresh': 23.718901407228792, 'bear_atr_min_pct': 0.027783579385882707, 'bear_atr_max_pct': 0.11767532719150593, 'bear_tp_mult': 1.5221465000618497, 'bear_tsl_mult': 0.635885702611228, 'bear_time_stop': 249, 'bear_use_sma': False, 'bear_use_ema': True, 'bear_use_atr': False, 'bear_use_adx': True, 'bear_use_spike': True, 'bear_rsi_required': True, 'sideways_strategy': 'breakout', 'sideways_bb_std_mult': 1.3112819537047868, 'sideways_rsi_os': 38, 'sideways_rsi_ob': 86, 'sideways_adx_thresh': 28.943194585859388, 'sideways_atr_min_pct': 0.01993414912542759, 'sideways_atr_max_pct': 0.10951438633238142, 'sideways_tp_mult': 1.7575455887977978, 'sideways_tsl_mult': 0.8115808930782653, 'sideways_time_stop': 34, 'sideways_use_sma': False, 'sideways_use_ema': False, 'sideways_use_atr': False, 'sideways_use_adx': True, 'sideways_use_spike': False, 'sideways_rsi_required': False}.
[I 2025-08-30 22:17:22,266] Trial 735 finished with values: [-1000000000.0, 1000000000.0] and parameters: {'p_sma': 56, 'p_std': 55, 'p_atr': 19, 'p_adx': 28, 'rsi_period': 76, 'ema1': 9, 'ema2': 54, 'slip_atr_k': 0.016934106628392342, 'slip_spread_k': 0.11826614525684565, 'spread_hl_frac': 0.03978981587552781, 'bb_std_mult': 3.4833786782043816, 'rsi_os': 10, 'rsi_ob': 76, 'vol_spike': 0.2744096261927135, 'adx_thresh': 10.8254784451341, 'atr_min_pct': 0.012761071667571422, 'atr_max_pct': 0.030693360559967197, 'tp_mult': 1.7222931999819207, 'tsl_mult': 0.7757449754335319, 'strategy': 'mean_reversion', 'time_stop': 82, 'use_sma': True, 'use_atr': True, 'use_adx': True, 'use_ema': True, 'use_spike': True, 'rsi_required': True, 'edge_k': 1.396232280005955, 'edge_cap': 0.09808635450966441, 'bull_strategy': 'breakout', 'bull_bb_std_mult': 1.8435108063576704, 'bull_rsi_os': 24, 'bull_rsi_ob': 84, 'bull_adx_thresh': 16.66596119962576, 'bull_atr_min_pct': 0.015077324723666609, 'bull_atr_max_pct': 0.030175947612296035, 'bull_tp_mult': 1.2103706003180088, 'bull_tsl_mult': 0.41439425856745643, 'bull_time_stop': 300, 'bull_use_sma': True, 'bull_use_ema': False, 'bull_use_atr': False, 'bull_use_adx': False, 'bull_use_spike': False, 'bull_rsi_required': False, 'bear_strategy': 'mean_reversion', 'bear_bb_std_mult': 1.995339837894386, 'bear_rsi_os': 16, 'bear_rsi_ob': 74, 'bear_adx_thresh': 12.007995768138855, 'bear_atr_min_pct': 0.02997317025401214, 'bear_atr_max_pct': 0.032602465616939476, 'bear_tp_mult': 1.5236083350524585, 'bear_tsl_mult': 0.42620497107602195, 'bear_time_stop': 8, 'bear_use_sma': False, 'bear_use_ema': True, 'bear_use_atr': False, 'bear_use_adx': True, 'bear_use_spike': True, 'bear_rsi_required': False, 'sideways_strategy': 'breakout', 'sideways_bb_std_mult': 1.1068546403660735, 'sideways_rsi_os': 41, 'sideways_rsi_ob': 81, 'sideways_adx_thresh': 15.565870971213503, 'sideways_atr_min_pct': 0.01987599747471425, 'sideways_atr_max_pct': 0.07659815845423916, 'sideways_tp_mult': 1.7001436741268616, 'sideways_tsl_mult': 0.7833003944251413, 'sideways_time_stop': 36, 'sideways_use_sma': False, 'sideways_use_ema': False, 'sideways_use_atr': False, 'sideways_use_adx': True, 'sideways_use_spike': False, 'sideways_rsi_required': False}.
[I 2025-08-30 22:17:22,526] Trial 734 finished with values: [-1000000000.0, 1000000000.0] and parameters: {'p_sma': 34, 'p_std': 12, 'p_atr': 22, 'p_adx': 21, 'rsi_period': 69, 'ema1': 9, 'ema2': 20, 'slip_atr_k': 0.12344796786613242, 'slip_spread_k': 0.6352459699579531, 'spread_hl_frac': 0.031529209148770575, 'bb_std_mult': 3.3397270260075427, 'rsi_os': 43, 'rsi_ob': 84, 'vol_spike': 0.27252477527761576, 'adx_thresh': 11.007031154401336, 'atr_min_pct': 0.01430493949898718, 'atr_max_pct': 0.07359286140321934, 'tp_mult': 2.2955326605843878, 'tsl_mult': 0.7510248489949036, 'strategy': 'mean_reversion', 'time_stop': 44, 'use_sma': True, 'use_atr': True, 'use_adx': True, 'use_ema': True, 'use_spike': True, 'rsi_required': True, 'edge_k': 1.9746626229474313, 'edge_cap': 0.8229679369240106, 'bull_strategy': 'breakout', 'bull_bb_std_mult': 2.0103695752109125, 'bull_rsi_os': 32, 'bull_rsi_ob': 83, 'bull_adx_thresh': 13.652996672317755, 'bull_atr_min_pct': 0.011683954191739879, 'bull_atr_max_pct': 0.10553423203614612, 'bull_tp_mult': 1.20809718911948, 'bull_tsl_mult': 0.8179539370387714, 'bull_time_stop': 300, 'bull_use_sma': True, 'bull_use_ema': False, 'bull_use_atr': False, 'bull_use_adx': False, 'bull_use_spike': False, 'bull_rsi_required': False, 'bear_strategy': 'mean_reversion', 'bear_bb_std_mult': 1.2095259693279088, 'bear_rsi_os': 8, 'bear_rsi_ob': 67, 'bear_adx_thresh': 11.79275884068582, 'bear_atr_min_pct': 0.010696680581193021, 'bear_atr_max_pct': 0.03301172883699074, 'bear_tp_mult': 1.5137754558478318, 'bear_tsl_mult': 0.9688167257187197, 'bear_time_stop': 251, 'bear_use_sma': False, 'bear_use_ema': True, 'bear_use_atr': False, 'bear_use_adx': True, 'bear_use_spike': True, 'bear_rsi_required': False, 'sideways_strategy': 'breakout', 'sideways_bb_std_mult': 3.385687961748328, 'sideways_rsi_os': 14, 'sideways_rsi_ob': 64, 'sideways_adx_thresh': 25.260643241692055, 'sideways_atr_min_pct': 0.021529571081802215, 'sideways_atr_max_pct': 0.07609473821954543, 'sideways_tp_mult': 1.707673157935623, 'sideways_tsl_mult': 0.8136012535447837, 'sideways_time_stop': 291, 'sideways_use_sma': False, 'sideways_use_ema': False, 'sideways_use_atr': False, 'sideways_use_adx': True, 'sideways_use_spike': False, 'sideways_rsi_required': False}.
[I 2025-08-30 22:17:23,487] Trial 736 finished with values: [-1000000000.0, 1000000000.0] and parameters: {'p_sma': 32, 'p_std': 38, 'p_atr': 21, 'p_adx': 21, 'rsi_period': 69, 'ema1': 15, 'ema2': 53, 'slip_atr_k': 0.23568291204407854, 'slip_spread_k': 0.6335884208297975, 'spread_hl_frac': 0.03260932962070426, 'bb_std_mult': 3.1664690567887366, 'rsi_os': 50, 'rsi_ob': 67, 'vol_spike': 0.02984867917879179, 'adx_thresh': 27.249327872195167, 'atr_min_pct': 0.016006586033878632, 'atr_max_pct': 0.029634611598293434, 'tp_mult': 1.7049056489223333, 'tsl_mult': 0.8837324422246179, 'strategy': 'mean_reversion', 'time_stop': 46, 'use_sma': True, 'use_atr': True, 'use_adx': False, 'use_ema': True, 'use_spike': False, 'rsi_required': True, 'edge_k': 0.363697069491139, 'edge_cap': 0.11605268996112089, 'bull_strategy': 'breakout', 'bull_bb_std_mult': 1.9836927958636226, 'bull_rsi_os': 17, 'bull_rsi_ob': 85, 'bull_adx_thresh': 8.073653793329301, 'bull_atr_min_pct': 0.0016022166995076116, 'bull_atr_max_pct': 0.01576495287032563, 'bull_tp_mult': 1.703771139374177, 'bull_tsl_mult': 0.8274105038566975, 'bull_time_stop': 300, 'bull_use_sma': True, 'bull_use_ema': False, 'bull_use_atr': False, 'bull_use_adx': False, 'bull_use_spike': False, 'bull_rsi_required': False, 'bear_strategy': 'mean_reversion', 'bear_bb_std_mult': 2.001129457427414, 'bear_rsi_os': 8, 'bear_rsi_ob': 74, 'bear_adx_thresh': 26.854433867893572, 'bear_atr_min_pct': 0.02999625803240237, 'bear_atr_max_pct': 0.12332785374308135, 'bear_tp_mult': 2.381609358689717, 'bear_tsl_mult': 0.9764935461381188, 'bear_time_stop': 231, 'bear_use_sma': False, 'bear_use_ema': True, 'bear_use_atr': False, 'bear_use_adx': True, 'bear_use_spike': True, 'bear_rsi_required': False, 'sideways_strategy': 'breakout', 'sideways_bb_std_mult': 3.1262196568583844, 'sideways_rsi_os': 41, 'sideways_rsi_ob': 88, 'sideways_adx_thresh': 15.868008093897465, 'sideways_atr_min_pct': 0.02747748065988484, 'sideways_atr_max_pct': 0.07658464197499965, 'sideways_tp_mult': 2.294411643053997, 'sideways_tsl_mult': 0.7775505007696837, 'sideways_time_stop': 263, 'sideways_use_sma': True, 'sideways_use_ema': False, 'sideways_use_atr': False, 'sideways_use_adx': True, 'sideways_use_spike': True, 'sideways_rsi_required': False}.
[I 2025-08-30 22:17:23,488] Trial 737 finished with values: [-1000000000.0, 1000000000.0] and parameters: {'p_sma': 36, 'p_std': 38, 'p_atr': 21, 'p_adx': 10, 'rsi_period': 75, 'ema1': 15, 'ema2': 18, 'slip_atr_k': 0.17561618106817167, 'slip_spread_k': 0.6392742413805047, 'spread_hl_frac': 0.03247389914955686, 'bb_std_mult': 3.1304218315879453, 'rsi_os': 9, 'rsi_ob': 50, 'vol_spike': 0.25255515853844024, 'adx_thresh': 11.090390941117649, 'atr_min_pct': 0.013003533863127982, 'atr_max_pct': 0.037856427690420066, 'tp_mult': 2.982639792638383, 'tsl_mult': 0.8747763730020345, 'strategy': 'mean_reversion', 'time_stop': 100, 'use_sma': True, 'use_atr': True, 'use_adx': False, 'use_ema': True, 'use_spike': False, 'rsi_required': True, 'edge_k': 0.6203488654879489, 'edge_cap': 0.8266766593036156, 'bull_strategy': 'breakout', 'bull_bb_std_mult': 1.9885354539112092, 'bull_rsi_os': 13, 'bull_rsi_ob': 90, 'bull_adx_thresh': 6.849721590019001, 'bull_atr_min_pct': 1.1444918342255967e-05, 'bull_atr_max_pct': 0.11352446272811731, 'bull_tp_mult': 1.200826969703228, 'bull_tsl_mult': 0.4133340196563999, 'bull_time_stop': 300, 'bull_use_sma': True, 'bull_use_ema': False, 'bull_use_atr': False, 'bull_use_adx': False, 'bull_use_spike': False, 'bull_rsi_required': False, 'bear_strategy': 'mean_reversion', 'bear_bb_std_mult': 1.995992439293866, 'bear_rsi_os': 8, 'bear_rsi_ob': 74, 'bear_adx_thresh': 26.878456113672087, 'bear_atr_min_pct': 0.029414510372036733, 'bear_atr_max_pct': 0.05041304915577295, 'bear_tp_mult': 1.8531777990659632, 'bear_tsl_mult': 0.8918076992489632, 'bear_time_stop': 7, 'bear_use_sma': False, 'bear_use_ema': True, 'bear_use_atr': False, 'bear_use_adx': True, 'bear_use_spike': True, 'bear_rsi_required': False, 'sideways_strategy': 'breakout', 'sideways_bb_std_mult': 1.5537974993545154, 'sideways_rsi_os': 41, 'sideways_rsi_ob': 88, 'sideways_adx_thresh': 14.572446075640222, 'sideways_atr_min_pct': 0.004148131461426846, 'sideways_atr_max_pct': 0.044523146893225424, 'sideways_tp_mult': 2.998460210678096, 'sideways_tsl_mult': 0.7895792457289995, 'sideways_time_stop': 263, 'sideways_use_sma': True, 'sideways_use_ema': False, 'sideways_use_atr': False, 'sideways_use_adx': True, 'sideways_use_spike': True, 'sideways_rsi_required': False}.
