[I 2025-08-30 21:19:22,297] Trial 251 finished with values: [-1000000000.0, 1000000000.0] and parameters: {'p_sma': 31, 'p_std': 33, 'p_atr': 14, 'p_adx': 30, 'rsi_period': 82, 'ema1': 22, 'ema2': 15, 'slip_atr_k': 0.03629470053925634, 'slip_spread_k': 0.5451445268298518, 'spread_hl_frac': 0.027264578059965332, 'bb_std_mult': 2.2326243826762124, 'rsi_os': 8, 'rsi_ob': 80, 'vol_spike': 0.29982966179128884, 'adx_thresh': 29.131222499654655, 'atr_min_pct': 0.020964059295138903, 'atr_max_pct': 0.0895495255236068, 'tp_mult': 2.101146858758796, 'tsl_mult': 0.9005396910008804, 'strategy': 'mean_reversion', 'time_stop': 157, 'use_sma': True, 'use_atr': True, 'use_adx': True, 'use_ema': True, 'use_spike': True, 'rsi_required': True, 'edge_k': 0.7197223293385349, 'edge_cap': 0.6277736599826877, 'bull_strategy': 'breakout', 'bull_bb_std_mult': 3.412218327033045, 'bull_rsi_os': 18, 'bull_rsi_ob': 49, 'bull_adx_thresh': 15.183150597253169, 'bull_atr_min_pct': 0.017667099411777482, 'bull_atr_max_pct': 0.07761291162506771, 'bull_tp_mult': 2.3888080918996346, 'bull_tsl_mult': 0.3731725975620053, 'bull_time_stop': 295, 'bull_use_sma': True, 'bull_use_ema': False, 'bull_use_atr': False, 'bull_use_adx': True, 'bull_use_spike': True, 'bull_rsi_required': True, 'bear_strategy': 'mean_reversion', 'bear_bb_std_mult': 0.6810760597113512, 'bear_rsi_os': 40, 'bear_rsi_ob': 52, 'bear_adx_thresh': 14.717650217729037, 'bear_atr_min_pct': 0.01580287200634555, 'bear_atr_max_pct': 0.015520257574451591, 'bear_tp_mult': 2.87076664986259, 'bear_tsl_mult': 0.45972260985657065, 'bear_time_stop': 194, 'bear_use_sma': True, 'bear_use_ema': True, 'bear_use_atr': False, 'bear_use_adx': True, 'bear_use_spike': True, 'bear_rsi_required': True, 'sideways_strategy': 'breakout', 'sideways_bb_std_mult': 1.6787933344511252, 'sideways_rsi_os': 44, 'sideways_rsi_ob': 90, 'sideways_adx_thresh': 26.047395427242808, 'sideways_atr_min_pct': 0.013318062528914655, 'sideways_atr_max_pct': 0.0890668513719476, 'sideways_tp_mult': 2.285692449587196, 'sideways_tsl_mult': 0.5054901541059391, 'sideways_time_stop': 269, 'sideways_use_sma': False, 'sideways_use_ema': True, 'sideways_use_atr': True, 'sideways_use_adx': False, 'sideways_use_spike': False, 'sideways_rsi_required': True}.
[I 2025-08-30 21:19:22,461] Trial 252 finished with values: [-1000000000.0, 1000000000.0] and parameters: {'p_sma': 41, 'p_std': 34, 'p_atr': 14, 'p_adx': 30, 'rsi_period': 23, 'ema1': 22, 'ema2': 21, 'slip_atr_k': 0.24628307712904696, 'slip_spread_k': 0.5443392362850809, 'spread_hl_frac': 0.0009645173189797573, 'bb_std_mult': 0.6545621894473508, 'rsi_os': 8, 'rsi_ob': 82, 'vol_spike': 0.29993159015444765, 'adx_thresh': 29.166193990835936, 'atr_min_pct': 0.02082417568553303, 'atr_max_pct': 0.08923627829646123, 'tp_mult': 2.879684402680735, 'tsl_mult': 0.8965014107492681, 'strategy': 'mean_reversion', 'time_stop': 116, 'use_sma': True, 'use_atr': True, 'use_adx': True, 'use_ema': True, 'use_spike': True, 'rsi_required': True, 'edge_k': 0.6975387562590171, 'edge_cap': 0.6232524392714125, 'bull_strategy': 'breakout', 'bull_bb_std_mult': 2.4501724333425536, 'bull_rsi_os': 19, 'bull_rsi_ob': 48, 'bull_adx_thresh': 15.107365749103352, 'bull_atr_min_pct': 0.017616444218856112, 'bull_atr_max_pct': 0.06185574240381109, 'bull_tp_mult': 2.370671073445405, 'bull_tsl_mult': 0.46057026054908556, 'bull_time_stop': 295, 'bull_use_sma': True, 'bull_use_ema': False, 'bull_use_atr': False, 'bull_use_adx': True, 'bull_use_spike': True, 'bull_rsi_required': True, 'bear_strategy': 'mean_reversion', 'bear_bb_std_mult': 0.6582210921858382, 'bear_rsi_os': 40, 'bear_rsi_ob': 72, 'bear_adx_thresh': 14.679771711880463, 'bear_atr_min_pct': 0.014005726598833045, 'bear_atr_max_pct': 0.015819778432961992, 'bear_tp_mult': 2.8907955721750946, 'bear_tsl_mult': 0.4530164613507444, 'bear_time_stop': 75, 'bear_use_sma': True, 'bear_use_ema': True, 'bear_use_atr': False, 'bear_use_adx': True, 'bear_use_spike': True, 'bear_rsi_required': True, 'sideways_strategy': 'breakout', 'sideways_bb_std_mult': 1.700165664776189, 'sideways_rsi_os': 40, 'sideways_rsi_ob': 93, 'sideways_adx_thresh': 26.14192773295317, 'sideways_atr_min_pct': 0.013128053661819903, 'sideways_atr_max_pct': 0.10104164907702476, 'sideways_tp_mult': 2.16368209237506, 'sideways_tsl_mult': 0.48721409239737795, 'sideways_time_stop': 270, 'sideways_use_sma': False, 'sideways_use_ema': True, 'sideways_use_atr': True, 'sideways_use_adx': False, 'sideways_use_spike': False, 'sideways_rsi_required': True}.
[I 2025-08-30 21:19:23,065] Trial 256 finished with values: [-1000000000.0, 1000000000.0] and parameters: {'p_sma': 29, 'p_std': 57, 'p_atr': 15, 'p_adx': 30, 'rsi_period': 7, 'ema1': 24, 'ema2': 48, 'slip_atr_k': 0.22179768627794172, 'slip_spread_k': 0.5720290578808018, 'spread_hl_frac': 0.0009139124625268981, 'bb_std_mult': 1.1912869482875046, 'rsi_os': 10, 'rsi_ob': 45, 'vol_spike': 0.2870036265070688, 'adx_thresh': 30.68421854828786, 'atr_min_pct': 0.01913501513049873, 'atr_max_pct': 0.07128950254894277, 'tp_mult': 2.8618079540615007, 'tsl_mult': 0.9406619940972817, 'strategy': 'mean_reversion', 'time_stop': 137, 'use_sma': False, 'use_atr': True, 'use_adx': True, 'use_ema': True, 'use_spike': True, 'rsi_required': True, 'edge_k': 0.7095309731724129, 'edge_cap': 0.07459443499403279, 'bull_strategy': 'breakout', 'bull_bb_std_mult': 2.0932718303563465, 'bull_rsi_os': 19, 'bull_rsi_ob': 72, 'bull_adx_thresh': 34.262618418180246, 'bull_atr_min_pct': 0.015546781784536058, 'bull_atr_max_pct': 0.061526336199978965, 'bull_tp_mult': 2.1373893154474066, 'bull_tsl_mult': 0.41062984383173556, 'bull_time_stop': 70, 'bull_use_sma': True, 'bull_use_ema': False, 'bull_use_atr': False, 'bull_use_adx': True, 'bull_use_spike': True, 'bull_rsi_required': True, 'bear_strategy': 'mean_reversion', 'bear_bb_std_mult': 2.489471539773212, 'bear_rsi_os': 38, 'bear_rsi_ob': 71, 'bear_adx_thresh': 16.378622686385015, 'bear_atr_min_pct': 0.014998008476146733, 'bear_atr_max_pct': 0.011406063710326795, 'bear_tp_mult': 2.9000438685055054, 'bear_tsl_mult': 0.39475790631513197, 'bear_time_stop': 37, 'bear_use_sma': True, 'bear_use_ema': False, 'bear_use_atr': False, 'bear_use_adx': True, 'bear_use_spike': True, 'bear_rsi_required': True, 'sideways_strategy': 'breakout', 'sideways_bb_std_mult': 1.5580185627392604, 'sideways_rsi_os': 43, 'sideways_rsi_ob': 93, 'sideways_adx_thresh': 25.54452791834553, 'sideways_atr_min_pct': 0.01635924653021555, 'sideways_atr_max_pct': 0.09918913317906886, 'sideways_tp_mult': 1.7655340490076663, 'sideways_tsl_mult': 0.40731666895550167, 'sideways_time_stop': 241, 'sideways_use_sma': False, 'sideways_use_ema': True, 'sideways_use_atr': True, 'sideways_use_adx': False, 'sideways_use_spike': False, 'sideways_rsi_required': True}.
[I 2025-08-30 21:19:55,607] Trial 255 finished with values: [-1000000000.0, 1000000000.0] and parameters: {'p_sma': 29, 'p_std': 47, 'p_atr': 14, 'p_adx': 30, 'rsi_period': 20, 'ema1': 23, 'ema2': 19, 'slip_atr_k': 0.03940416749742074, 'slip_spread_k': 0.576451204878121, 'spread_hl_frac': 0.04750187256458395, 'bb_std_mult': 1.7241068214557915, 'rsi_os': 10, 'rsi_ob': 54, 'vol_spike': 0.2898528488066926, 'adx_thresh': 30.709261156915925, 'atr_min_pct': 0.02098383377297629, 'atr_max_pct': 0.0897582863790326, 'tp_mult': 2.5796931592870243, 'tsl_mult': 0.8925267006210705, 'strategy': 'mean_reversion', 'time_stop': 106, 'use_sma': True, 'use_atr': True, 'use_adx': True, 'use_ema': True, 'use_spike': True, 'rsi_required': True, 'edge_k': 0.7146505610716718, 'edge_cap': 0.5874189300690273, 'bull_strategy': 'breakout', 'bull_bb_std_mult': 2.5116596196905805, 'bull_rsi_os': 10, 'bull_rsi_ob': 47, 'bull_adx_thresh': 15.14043203067445, 'bull_atr_min_pct': 0.0028652367042559758, 'bull_atr_max_pct': 0.059912144158180115, 'bull_tp_mult': 2.406441312120233, 'bull_tsl_mult': 0.4149925060054046, 'bull_time_stop': 293, 'bull_use_sma': True, 'bull_use_ema': False, 'bull_use_atr': False, 'bull_use_adx': True, 'bull_use_spike': True, 'bull_rsi_required': True, 'bear_strategy': 'mean_reversion', 'bear_bb_std_mult': 2.7694761020673453, 'bear_rsi_os': 38, 'bear_rsi_ob': 51, 'bear_adx_thresh': 26.737855723640074, 'bear_atr_min_pct': 0.014861882764426926, 'bear_atr_max_pct': 0.015590683572761475, 'bear_tp_mult': 2.896992857550609, 'bear_tsl_mult': 0.39953680461177765, 'bear_time_stop': 135, 'bear_use_sma': True, 'bear_use_ema': False, 'bear_use_atr': False, 'bear_use_adx': True, 'bear_use_spike': True, 'bear_rsi_required': True, 'sideways_strategy': 'breakout', 'sideways_bb_std_mult': 1.6396533436153025, 'sideways_rsi_os': 11, 'sideways_rsi_ob': 89, 'sideways_adx_thresh': 25.77635046737074, 'sideways_atr_min_pct': 0.016355815740794668, 'sideways_atr_max_pct': 0.09909836182374776, 'sideways_tp_mult': 2.1291002996037935, 'sideways_tsl_mult': 0.47558562465373005, 'sideways_time_stop': 242, 'sideways_use_sma': False, 'sideways_use_ema': True, 'sideways_use_atr': True, 'sideways_use_adx': False, 'sideways_use_spike': False, 'sideways_rsi_required': True}.
[I 2025-08-30 21:19:55,874] Trial 257 finished with values: [-1000000000.0, 1000000000.0] and parameters: {'p_sma': 29, 'p_std': 30, 'p_atr': 15, 'p_adx': 30, 'rsi_period': 20, 'ema1': 23, 'ema2': 48, 'slip_atr_k': 0.1365389201526997, 'slip_spread_k': 0.5060893921583157, 'spread_hl_frac': 0.022487793258697833, 'bb_std_mult': 1.7139508603106524, 'rsi_os': 10, 'rsi_ob': 54, 'vol_spike': 0.28762954297922294, 'adx_thresh': 30.682105462371517, 'atr_min_pct': 0.01943126041395419, 'atr_max_pct': 0.07166125140443114, 'tp_mult': 2.3055794930336444, 'tsl_mult': 0.9349320761418662, 'strategy': 'mean_reversion', 'time_stop': 106, 'use_sma': False, 'use_atr': True, 'use_adx': True, 'use_ema': True, 'use_spike': True, 'rsi_required': True, 'edge_k': 0.32519333686325114, 'edge_cap': 0.5513230897561617, 'bull_strategy': 'breakout', 'bull_bb_std_mult': 2.1236103445980237, 'bull_rsi_os': 16, 'bull_rsi_ob': 46, 'bull_adx_thresh': 16.10502407261078, 'bull_atr_min_pct': 0.0013809669834368137, 'bull_atr_max_pct': 0.053085814999274374, 'bull_tp_mult': 2.1290452970680214, 'bull_tsl_mult': 0.41657926072955814, 'bull_time_stop': 152, 'bull_use_sma': True, 'bull_use_ema': False, 'bull_use_atr': False, 'bull_use_adx': True, 'bull_use_spike': True, 'bull_rsi_required': True, 'bear_strategy': 'mean_reversion', 'bear_bb_std_mult': 3.0977593129752403, 'bear_rsi_os': 38, 'bear_rsi_ob': 55, 'bear_adx_thresh': 22.781426435928186, 'bear_atr_min_pct': 0.015007094921496647, 'bear_atr_max_pct': 0.010270340494056292, 'bear_tp_mult': 1.2702383260893866, 'bear_tsl_mult': 0.4060680683497074, 'bear_time_stop': 105, 'bear_use_sma': True, 'bear_use_ema': False, 'bear_use_atr': False, 'bear_use_adx': True, 'bear_use_spike': True, 'bear_rsi_required': True, 'sideways_strategy': 'breakout', 'sideways_bb_std_mult': 1.5354404919209559, 'sideways_rsi_os': 25, 'sideways_rsi_ob': 91, 'sideways_adx_thresh': 28.825774780304528, 'sideways_atr_min_pct': 0.01643319602808977, 'sideways_atr_max_pct': 0.09798508018168582, 'sideways_tp_mult': 2.336048820005108, 'sideways_tsl_mult': 0.4547158775150612, 'sideways_time_stop': 256, 'sideways_use_sma': False, 'sideways_use_ema': True, 'sideways_use_atr': True, 'sideways_use_adx': False, 'sideways_use_spike': False, 'sideways_rsi_required': True}.
[I 2025-08-30 21:19:56,083] Trial 254 finished with values: [-1000000000.0, 1000000000.0] and parameters: {'p_sma': 29, 'p_std': 57, 'p_atr': 14, 'p_adx': 30, 'rsi_period': 82, 'ema1': 23, 'ema2': 47, 'slip_atr_k': 0.2491447875141215, 'slip_spread_k': 0.5626494704088779, 'spread_hl_frac': 0.031850978517181716, 'bb_std_mult': 0.6495555461455396, 'rsi_os': 8, 'rsi_ob': 80, 'vol_spike': 0.28870308928126903, 'adx_thresh': 29.64256410147316, 'atr_min_pct': 0.020990775031088524, 'atr_max_pct': 0.08977904694155646, 'tp_mult': 2.87208951369634, 'tsl_mult': 0.935712829355096, 'strategy': 'mean_reversion', 'time_stop': 130, 'use_sma': True, 'use_atr': True, 'use_adx': True, 'use_ema': True, 'use_spike': True, 'rsi_required': True, 'edge_k': 0.7077853014735438, 'edge_cap': 0.5922512792136341, 'bull_strategy': 'breakout', 'bull_bb_std_mult': 0.8792322326153745, 'bull_rsi_os': 18, 'bull_rsi_ob': 68, 'bull_adx_thresh': 17.02844058090175, 'bull_atr_min_pct': 0.017812290307728143, 'bull_atr_max_pct': 0.06281442948968717, 'bull_tp_mult': 2.3934754287421014, 'bull_tsl_mult': 0.4540523061950229, 'bull_time_stop': 103, 'bull_use_sma': True, 'bull_use_ema': False, 'bull_use_atr': False, 'bull_use_adx': True, 'bull_use_spike': True, 'bull_rsi_required': True, 'bear_strategy': 'mean_reversion', 'bear_bb_std_mult': 0.666660233856702, 'bear_rsi_os': 38, 'bear_rsi_ob': 55, 'bear_adx_thresh': 22.839904497322937, 'bear_atr_min_pct': 0.0144964085246927, 'bear_atr_max_pct': 0.010217497905094521, 'bear_tp_mult': 2.8922872218361495, 'bear_tsl_mult': 0.40237408552465076, 'bear_time_stop': 201, 'bear_use_sma': True, 'bear_use_ema': True, 'bear_use_atr': False, 'bear_use_adx': True, 'bear_use_spike': True, 'bear_rsi_required': True, 'sideways_strategy': 'breakout', 'sideways_bb_std_mult': 1.6229372590696358, 'sideways_rsi_os': 44, 'sideways_rsi_ob': 89, 'sideways_adx_thresh': 25.9348978833673, 'sideways_atr_min_pct': 0.013226758751722951, 'sideways_atr_max_pct': 0.09926219049467641, 'sideways_tp_mult': 2.167103938180219, 'sideways_tsl_mult': 0.5041422376929217, 'sideways_time_stop': 269, 'sideways_use_sma': False, 'sideways_use_ema': True, 'sideways_use_atr': True, 'sideways_use_adx': False, 'sideways_use_spike': False, 'sideways_rsi_required': True}.
[I 2025-08-30 21:19:56,681] Trial 258 finished with values: [-1000000000.0, 1000000000.0] and parameters: {'p_sma': 29, 'p_std': 18, 'p_atr': 15, 'p_adx': 30, 'rsi_period': 20, 'ema1': 23, 'ema2': 47, 'slip_atr_k': 0.16801018696510006, 'slip_spread_k': 0.506665100630919, 'spread_hl_frac': 0.004411251059029333, 'bb_std_mult': 1.0798007001963426, 'rsi_os': 11, 'rsi_ob': 80, 'vol_spike': 0.28713981064657035, 'adx_thresh': 30.61511532759636, 'atr_min_pct': 0.020472229905825052, 'atr_max_pct': 0.03657150865886809, 'tp_mult': 1.7119898910089806, 'tsl_mult': 0.9248234319875012, 'strategy': 'breakout', 'time_stop': 108, 'use_sma': False, 'use_atr': True, 'use_adx': False, 'use_ema': True, 'use_spike': False, 'rsi_required': False, 'edge_k': 1.178450764175045, 'edge_cap': 0.5846427549447482, 'bull_strategy': 'mean_reversion', 'bull_bb_std_mult': 1.718612629155348, 'bull_rsi_os': 13, 'bull_rsi_ob': 68, 'bull_adx_thresh': 20.294075289556122, 'bull_atr_min_pct': 0.002826258333780886, 'bull_atr_max_pct': 0.05314351767994449, 'bull_tp_mult': 2.2292599188525073, 'bull_tsl_mult': 0.40687032642440524, 'bull_time_stop': 148, 'bull_use_sma': True, 'bull_use_ema': True, 'bull_use_atr': True, 'bull_use_adx': True, 'bull_use_spike': True, 'bull_rsi_required': False, 'bear_strategy': 'breakout', 'bear_bb_std_mult': 2.7601894591698177, 'bear_rsi_os': 38, 'bear_rsi_ob': 55, 'bear_adx_thresh': 34.58544742993089, 'bear_atr_min_pct': 0.013192737388611415, 'bear_atr_max_pct': 0.010471060903888761, 'bear_tp_mult': 1.0276838277396458, 'bear_tsl_mult': 0.4794223993279585, 'bear_time_stop': 274, 'bear_use_sma': True, 'bear_use_ema': False, 'bear_use_atr': True, 'bear_use_adx': True, 'bear_use_spike': True, 'bear_rsi_required': False, 'sideways_strategy': 'mean_reversion', 'sideways_bb_std_mult': 1.6218278201987373, 'sideways_rsi_os': 31, 'sideways_rsi_ob': 89, 'sideways_adx_thresh': 27.037817101292646, 'sideways_atr_min_pct': 0.013853153537569895, 'sideways_atr_max_pct': 0.10499970155499087, 'sideways_tp_mult': 2.1230827354053483, 'sideways_tsl_mult': 0.45872096036726556, 'sideways_time_stop': 255, 'sideways_use_sma': False, 'sideways_use_ema': True, 'sideways_use_atr': True, 'sideways_use_adx': False, 'sideways_use_spike': False, 'sideways_rsi_required': True}.
[I 2025-08-30 21:19:57,193] Trial 259 finished with values: [-1000000000.0, 1000000000.0] and parameters: {'p_sma': 45, 'p_std': 21, 'p_atr': 15, 'p_adx': 30, 'rsi_period': 33, 'ema1': 17, 'ema2': 47, 'slip_atr_k': 0.0188990726417122, 'slip_spread_k': 0.4988627101908759, 'spread_hl_frac': 0.004467878694419968, 'bb_std_mult': 1.6577650359266694, 'rsi_os': 11, 'rsi_ob': 83, 'vol_spike': 0.16378435623316587, 'adx_thresh': 29.677763126559544, 'atr_min_pct': 0.020350677128205073, 'atr_max_pct': 0.014888705475792824, 'tp_mult': 1.717639174880552, 'tsl_mult': 0.9302600921522577, 'strategy': 'breakout', 'time_stop': 45, 'use_sma': False, 'use_atr': True, 'use_adx': False, 'use_ema': True, 'use_spike': False, 'rsi_required': False, 'edge_k': 0.33059123929861145, 'edge_cap': 0.6465492579326507, 'bull_strategy': 'mean_reversion', 'bull_bb_std_mult': 3.269061507486094, 'bull_rsi_os': 33, 'bull_rsi_ob': 68, 'bull_adx_thresh': 19.931311091746004, 'bull_atr_min_pct': 0.0012903865391339798, 'bull_atr_max_pct': 0.053780690370288105, 'bull_tp_mult': 2.208740389258381, 'bull_tsl_mult': 0.44433104205008406, 'bull_time_stop': 102, 'bull_use_sma': False, 'bull_use_ema': True, 'bull_use_atr': True, 'bull_use_adx': True, 'bull_use_spike': True, 'bull_rsi_required': False, 'bear_strategy': 'breakout', 'bear_bb_std_mult': 1.4901540652510816, 'bear_rsi_os': 39, 'bear_rsi_ob': 64, 'bear_adx_thresh': 16.108195373096567, 'bear_atr_min_pct': 0.01589289741285149, 'bear_atr_max_pct': 0.010223005126950752, 'bear_tp_mult': 2.8178049816280746, 'bear_tsl_mult': 0.4823893572028689, 'bear_time_stop': 89, 'bear_use_sma': True, 'bear_use_ema': False, 'bear_use_atr': True, 'bear_use_adx': True, 'bear_use_spike': False, 'bear_rsi_required': False, 'sideways_strategy': 'mean_reversion', 'sideways_bb_std_mult': 1.9085451750451612, 'sideways_rsi_os': 47, 'sideways_rsi_ob': 91, 'sideways_adx_thresh': 28.86732039885262, 'sideways_atr_min_pct': 0.015137928130104191, 'sideways_atr_max_pct': 0.09194707562952922, 'sideways_tp_mult': 2.035689885903217, 'sideways_tsl_mult': 0.45103437592034135, 'sideways_time_stop': 254, 'sideways_use_sma': True, 'sideways_use_ema': True, 'sideways_use_atr': True, 'sideways_use_adx': False, 'sideways_use_spike': True, 'sideways_rsi_required': True}.
[I 2025-08-30 21:19:57,240] Trial 262 finished with values: [-1000000000.0, 1000000000.0] and parameters: {'p_sma': 32, 'p_std': 34, 'p_atr': 15, 'p_adx': 14, 'rsi_period': 18, 'ema1': 30, 'ema2': 10, 'slip_atr_k': 0.20900833011867376, 'slip_spread_k': 0.5619840069233665, 'spread_hl_frac': 0.005947015424713643, 'bb_std_mult': 1.669208104087969, 'rsi_os': 14, 'rsi_ob': 52, 'vol_spike': 0.13693187677048774, 'adx_thresh': 28.350726460188433, 'atr_min_pct': 0.020340238927326032, 'atr_max_pct': 0.018759684466117477, 'tp_mult': 2.4290419291277825, 'tsl_mult': 0.8809606824883982, 'strategy': 'breakout', 'time_stop': 166, 'use_sma': False, 'use_atr': True, 'use_adx': False, 'use_ema': True, 'use_spike': False, 'rsi_required': False, 'edge_k': 0.8493023577572656, 'edge_cap': 0.6469258022991288, 'bull_strategy': 'mean_reversion', 'bull_bb_std_mult': 1.5934737337698517, 'bull_rsi_os': 21, 'bull_rsi_ob': 60, 'bull_adx_thresh': 15.774250010596859, 'bull_atr_min_pct': 0.00010003392731674089, 'bull_atr_max_pct': 0.05743615333161495, 'bull_tp_mult': 2.3429633288692924, 'bull_tsl_mult': 0.43411368812149825, 'bull_time_stop': 267, 'bull_use_sma': False, 'bull_use_ema': True, 'bull_use_atr': True, 'bull_use_adx': True, 'bull_use_spike': True, 'bull_rsi_required': False, 'bear_strategy': 'breakout', 'bear_bb_std_mult': 2.6277195338261654, 'bear_rsi_os': 41, 'bear_rsi_ob': 64, 'bear_adx_thresh': 32.20007283813327, 'bear_atr_min_pct': 0.016102581068548484, 'bear_atr_max_pct': 0.014779411127565773, 'bear_tp_mult': 2.822000583363992, 'bear_tsl_mult': 0.4354680468861404, 'bear_time_stop': 88, 'bear_use_sma': True, 'bear_use_ema': False, 'bear_use_atr': True, 'bear_use_adx': True, 'bear_use_spike': False, 'bear_rsi_required': False, 'sideways_strategy': 'mean_reversion', 'sideways_bb_std_mult': 1.764310130713171, 'sideways_rsi_os': 47, 'sideways_rsi_ob': 87, 'sideways_adx_thresh': 26.76577863299854, 'sideways_atr_min_pct': 0.014516167376935623, 'sideways_atr_max_pct': 0.09221748309548024, 'sideways_tp_mult': 2.230845863168088, 'sideways_tsl_mult': 0.4139575317019204, 'sideways_time_stop': 264, 'sideways_use_sma': True, 'sideways_use_ema': True, 'sideways_use_atr': True, 'sideways_use_adx': False, 'sideways_use_spike': True, 'sideways_rsi_required': True}.
