[I 2025-08-30 21:24:39,803] Trial 297 finished with values: [-1000000000.0, 1000000000.0] and parameters: {'p_sma': 29, 'p_std': 34, 'p_atr': 9, 'p_adx': 10, 'rsi_period': 41, 'ema1': 24, 'ema2': 36, 'slip_atr_k': 0.0911982669077774, 'slip_spread_k': 0.5659384712204261, 'spread_hl_frac': 0.007588634137413905, 'bb_std_mult': 1.8394154563043001, 'rsi_os': 32, 'rsi_ob': 81, 'vol_spike': 0.2896202063535484, 'adx_thresh': 34.955350143225125, 'atr_min_pct': 0.01946222893887257, 'atr_max_pct': 0.0844785890912328, 'tp_mult': 1.5541784396334557, 'tsl_mult': 0.132215384750119, 'strategy': 'breakout', 'time_stop': 111, 'use_sma': False, 'use_atr': False, 'use_adx': False, 'use_ema': False, 'use_spike': False, 'rsi_required': False, 'edge_k': 0.625431237868322, 'edge_cap': 0.5548003766420906, 'bull_strategy': 'mean_reversion', 'bull_bb_std_mult': 3.365449540462347, 'bull_rsi_os': 19, 'bull_rsi_ob': 77, 'bull_adx_thresh': 14.928049154320826, 'bull_atr_min_pct': 0.019668491150595314, 'bull_atr_max_pct': 0.08807231225265978, 'bull_tp_mult': 1.3907265390844876, 'bull_tsl_mult': 0.5026120827046646, 'bull_time_stop': 228, 'bull_use_sma': False, 'bull_use_ema': True, 'bull_use_atr': True, 'bull_use_adx': True, 'bull_use_spike': False, 'bull_rsi_required': False, 'bear_strategy': 'breakout', 'bear_bb_std_mult': 2.6649771561178355, 'bear_rsi_os': 38, 'bear_rsi_ob': 51, 'bear_adx_thresh': 16.466763818044917, 'bear_atr_min_pct': 0.011399582057276586, 'bear_atr_max_pct': 0.0156330274338858, 'bear_tp_mult': 1.7488889382482908, 'bear_tsl_mult': 0.00229221820783021, 'bear_time_stop': 278, 'bear_use_sma': False, 'bear_use_ema': False, 'bear_use_atr': True, 'bear_use_adx': False, 'bear_use_spike': False, 'bear_rsi_required': False, 'sideways_strategy': 'mean_reversion', 'sideways_bb_std_mult': 1.8673100208478552, 'sideways_rsi_os': 22, 'sideways_rsi_ob': 91, 'sideways_adx_thresh': 27.9698386679243, 'sideways_atr_min_pct': 0.01527462159041267, 'sideways_atr_max_pct': 0.138916602495496, 'sideways_tp_mult': 2.1055306183368723, 'sideways_tsl_mult': 0.8732664221714261, 'sideways_time_stop': 67, 'sideways_use_sma': True, 'sideways_use_ema': False, 'sideways_use_atr': False, 'sideways_use_adx': True, 'sideways_use_spike': True, 'sideways_rsi_required': False}.
[I 2025-08-30 21:24:40,465] Trial 301 finished with values: [-1000000000.0, 1000000000.0] and parameters: {'p_sma': 30, 'p_std': 35, 'p_atr': 16, 'p_adx': 30, 'rsi_period': 57, 'ema1': 23, 'ema2': 44, 'slip_atr_k': 0.09897601170737802, 'slip_spread_k': 0.538049855308711, 'spread_hl_frac': 0.000137162289786337, 'bb_std_mult': 1.2359261836134574, 'rsi_os': 10, 'rsi_ob': 47, 'vol_spike': 0.2904801667366861, 'adx_thresh': 29.433805130289848, 'atr_min_pct': 0.026165779131691026, 'atr_max_pct': 0.09474267380671188, 'tp_mult': 1.684726778153723, 'tsl_mult': 0.8798741687868513, 'strategy': 'mean_reversion', 'time_stop': 107, 'use_sma': False, 'use_atr': False, 'use_adx': True, 'use_ema': True, 'use_spike': True, 'rsi_required': False, 'edge_k': 0.7992961756941181, 'edge_cap': 0.3973045964459392, 'bull_strategy': 'breakout', 'bull_bb_std_mult': 3.3161246998355014, 'bull_rsi_os': 9, 'bull_rsi_ob': 71, 'bull_adx_thresh': 33.928237422210074, 'bull_atr_min_pct': 0.02637585988655828, 'bull_atr_max_pct': 0.049222768466424704, 'bull_tp_mult': 2.3489618503064924, 'bull_tsl_mult': 0.48889563904487177, 'bull_time_stop': 28, 'bull_use_sma': False, 'bull_use_ema': False, 'bull_use_atr': False, 'bull_use_adx': False, 'bull_use_spike': True, 'bull_rsi_required': True, 'bear_strategy': 'mean_reversion', 'bear_bb_std_mult': 2.907632318327301, 'bear_rsi_os': 21, 'bear_rsi_ob': 58, 'bear_adx_thresh': 27.04592190148027, 'bear_atr_min_pct': 0.015811835157446563, 'bear_atr_max_pct': 0.13636721714223624, 'bear_tp_mult': 2.151381591484853, 'bear_tsl_mult': 0.5308101847064999, 'bear_time_stop': 79, 'bear_use_sma': True, 'bear_use_ema': False, 'bear_use_atr': False, 'bear_use_adx': True, 'bear_use_spike': False, 'bear_rsi_required': True, 'sideways_strategy': 'breakout', 'sideways_bb_std_mult': 0.9726173708943104, 'sideways_rsi_os': 53, 'sideways_rsi_ob': 45, 'sideways_adx_thresh': 10.156979418164669, 'sideways_atr_min_pct': 0.02084836914207262, 'sideways_atr_max_pct': 0.10859053706664648, 'sideways_tp_mult': 2.029521120864337, 'sideways_tsl_mult': 0.4791628467666236, 'sideways_time_stop': 30, 'sideways_use_sma': True, 'sideways_use_ema': True, 'sideways_use_atr': True, 'sideways_use_adx': False, 'sideways_use_spike': True, 'sideways_rsi_required': True}.
[I 2025-08-30 21:25:12,794] Trial 298 finished with values: [-1000000000.0, 1000000000.0] and parameters: {'p_sma': 52, 'p_std': 35, 'p_atr': 14, 'p_adx': 18, 'rsi_period': 41, 'ema1': 11, 'ema2': 44, 'slip_atr_k': 0.0896147209420314, 'slip_spread_k': 0.5686789292041663, 'spread_hl_frac': 0.005211995320549069, 'bb_std_mult': 2.669418739034821, 'rsi_os': 10, 'rsi_ob': 47, 'vol_spike': 0.2906220753465265, 'adx_thresh': 32.273527202914366, 'atr_min_pct': 0.01303406887432336, 'atr_max_pct': 0.09563978233268186, 'tp_mult': 1.1874302975728839, 'tsl_mult': 0.6517151106651708, 'strategy': 'breakout', 'time_stop': 107, 'use_sma': False, 'use_atr': False, 'use_adx': False, 'use_ema': False, 'use_spike': False, 'rsi_required': False, 'edge_k': 0.6194744500768316, 'edge_cap': 0.559218300089208, 'bull_strategy': 'mean_reversion', 'bull_bb_std_mult': 3.389979007303057, 'bull_rsi_os': 17, 'bull_rsi_ob': 77, 'bull_adx_thresh': 9.257594183315097, 'bull_atr_min_pct': 0.01863013176567223, 'bull_atr_max_pct': 0.08852945005337548, 'bull_tp_mult': 1.1307502982951454, 'bull_tsl_mult': 0.5021563595010887, 'bull_time_stop': 26, 'bull_use_sma': False, 'bull_use_ema': True, 'bull_use_atr': True, 'bull_use_adx': True, 'bull_use_spike': False, 'bull_rsi_required': False, 'bear_strategy': 'breakout', 'bear_bb_std_mult': 2.668371282211942, 'bear_rsi_os': 24, 'bear_rsi_ob': 51, 'bear_adx_thresh': 27.272275221881785, 'bear_atr_min_pct': 0.015684623609376978, 'bear_atr_max_pct': 0.01440380412195577, 'bear_tp_mult': 2.932787302068344, 'bear_tsl_mult': 0.45320557557315516, 'bear_time_stop': 278, 'bear_use_sma': False, 'bear_use_ema': False, 'bear_use_atr': True, 'bear_use_adx': False, 'bear_use_spike': False, 'bear_rsi_required': False, 'sideways_strategy': 'mean_reversion', 'sideways_bb_std_mult': 2.2273280189698568, 'sideways_rsi_os': 41, 'sideways_rsi_ob': 91, 'sideways_adx_thresh': 26.46905581275584, 'sideways_atr_min_pct': 0.015228860354257332, 'sideways_atr_max_pct': 0.09223900635217408, 'sideways_tp_mult': 2.0067501633512363, 'sideways_tsl_mult': 0.07565541835559209, 'sideways_time_stop': 254, 'sideways_use_sma': True, 'sideways_use_ema': False, 'sideways_use_atr': True, 'sideways_use_adx': True, 'sideways_use_spike': True, 'sideways_rsi_required': False}.
[I 2025-08-30 21:25:13,398] Trial 299 finished with values: [-1000000000.0, 1000000000.0] and parameters: {'p_sma': 29, 'p_std': 35, 'p_atr': 16, 'p_adx': 25, 'rsi_period': 20, 'ema1': 10, 'ema2': 42, 'slip_atr_k': 0.1183902249502504, 'slip_spread_k': 0.5731384175136284, 'spread_hl_frac': 0.010192604898585545, 'bb_std_mult': 2.274533670314295, 'rsi_os': 12, 'rsi_ob': 91, 'vol_spike': 0.28871327852544837, 'adx_thresh': 17.215333683288296, 'atr_min_pct': 0.010939769091764959, 'atr_max_pct': 0.0954343514720788, 'tp_mult': 2.8325158511789645, 'tsl_mult': 0.5865457677995369, 'strategy': 'breakout', 'time_stop': 107, 'use_sma': False, 'use_atr': False, 'use_adx': False, 'use_ema': False, 'use_spike': False, 'rsi_required': False, 'edge_k': 0.6159842230395461, 'edge_cap': 0.5669249506878418, 'bull_strategy': 'mean_reversion', 'bull_bb_std_mult': 3.3194686752966143, 'bull_rsi_os': 17, 'bull_rsi_ob': 55, 'bull_adx_thresh': 9.104690451082668, 'bull_atr_min_pct': 0.023810235575202003, 'bull_atr_max_pct': 0.06307694325101551, 'bull_tp_mult': 2.3415828518571224, 'bull_tsl_mult': 0.4880344478107653, 'bull_time_stop': 290, 'bull_use_sma': False, 'bull_use_ema': True, 'bull_use_atr': True, 'bull_use_adx': False, 'bull_use_spike': False, 'bull_rsi_required': False, 'bear_strategy': 'breakout', 'bear_bb_std_mult': 2.620243722710054, 'bear_rsi_os': 38, 'bear_rsi_ob': 51, 'bear_adx_thresh': 16.27030757543826, 'bear_atr_min_pct': 0.011774194116717792, 'bear_atr_max_pct': 0.13613452832785608, 'bear_tp_mult': 2.9226193376389644, 'bear_tsl_mult': 0.5643228111506862, 'bear_time_stop': 93, 'bear_use_sma': False, 'bear_use_ema': False, 'bear_use_atr': True, 'bear_use_adx': False, 'bear_use_spike': False, 'bear_rsi_required': False, 'sideways_strategy': 'mean_reversion', 'sideways_bb_std_mult': 1.8475695470291762, 'sideways_rsi_os': 22, 'sideways_rsi_ob': 92, 'sideways_adx_thresh': 26.67654735832046, 'sideways_atr_min_pct': 0.025950658729161052, 'sideways_atr_max_pct': 0.03182218871955598, 'sideways_tp_mult': 2.029376416922514, 'sideways_tsl_mult': 0.8594039578945408, 'sideways_time_stop': 28, 'sideways_use_sma': True, 'sideways_use_ema': False, 'sideways_use_atr': True, 'sideways_use_adx': True, 'sideways_use_spike': True, 'sideways_rsi_required': False}.
[I 2025-08-30 21:25:13,648] Trial 300 finished with values: [-1000000000.0, 1000000000.0] and parameters: {'p_sma': 28, 'p_std': 42, 'p_atr': 9, 'p_adx': 8, 'rsi_period': 31, 'ema1': 23, 'ema2': 42, 'slip_atr_k': 0.0914024388574399, 'slip_spread_k': 0.4993878749258447, 'spread_hl_frac': 0.005180172854584996, 'bb_std_mult': 1.609594587919746, 'rsi_os': 10, 'rsi_ob': 81, 'vol_spike': 0.28894630698643226, 'adx_thresh': 29.421134911310574, 'atr_min_pct': 0.012965733063800161, 'atr_max_pct': 0.08846103013853943, 'tp_mult': 1.678776126647378, 'tsl_mult': 0.8861460280173638, 'strategy': 'breakout', 'time_stop': 108, 'use_sma': False, 'use_atr': False, 'use_adx': False, 'use_ema': False, 'use_spike': False, 'rsi_required': False, 'edge_k': 0.7343718121460474, 'edge_cap': 0.09470167723602319, 'bull_strategy': 'mean_reversion', 'bull_bb_std_mult': 2.3959446281674284, 'bull_rsi_os': 39, 'bull_rsi_ob': 54, 'bull_adx_thresh': 5.1336528652587585, 'bull_atr_min_pct': 0.0023762980421077346, 'bull_atr_max_pct': 0.049447127743551096, 'bull_tp_mult': 1.8413684461766744, 'bull_tsl_mult': 0.33798241400108603, 'bull_time_stop': 290, 'bull_use_sma': False, 'bull_use_ema': True, 'bull_use_atr': True, 'bull_use_adx': False, 'bull_use_spike': False, 'bull_rsi_required': False, 'bear_strategy': 'breakout', 'bear_bb_std_mult': 2.6867786679860064, 'bear_rsi_os': 33, 'bear_rsi_ob': 50, 'bear_adx_thresh': 15.055623910310612, 'bear_atr_min_pct': 0.0024295925384517202, 'bear_atr_max_pct': 0.013069565956140833, 'bear_tp_mult': 2.608970681466372, 'bear_tsl_mult': 0.5653671710910269, 'bear_time_stop': 71, 'bear_use_sma': True, 'bear_use_ema': False, 'bear_use_atr': True, 'bear_use_adx': False, 'bear_use_spike': False, 'bear_rsi_required': False, 'sideways_strategy': 'mean_reversion', 'sideways_bb_std_mult': 1.4847852204240028, 'sideways_rsi_os': 22, 'sideways_rsi_ob': 92, 'sideways_adx_thresh': 26.618887262805355, 'sideways_atr_min_pct': 0.015498920689282228, 'sideways_atr_max_pct': 0.10773690504151352, 'sideways_tp_mult': 2.040984934826875, 'sideways_tsl_mult': 0.8681370823705894, 'sideways_time_stop': 67, 'sideways_use_sma': True, 'sideways_use_ema': False, 'sideways_use_atr': True, 'sideways_use_adx': False, 'sideways_use_spike': True, 'sideways_rsi_required': False}.
[I 2025-08-30 21:25:14,359] Trial 302 finished with values: [-1000000000.0, 1000000000.0] and parameters: {'p_sma': 41, 'p_std': 32, 'p_atr': 28, 'p_adx': 29, 'rsi_period': 19, 'ema1': 13, 'ema2': 45, 'slip_atr_k': 0.23481208647052235, 'slip_spread_k': 0.49320432904197065, 'spread_hl_frac': 0.021441705968908244, 'bb_std_mult': 2.1880154143421717, 'rsi_os': 9, 'rsi_ob': 80, 'vol_spike': 0.08428233375687154, 'adx_thresh': 32.48582335447924, 'atr_min_pct': 0.02197416226938231, 'atr_max_pct': 0.08835397426441222, 'tp_mult': 1.5885709915204391, 'tsl_mult': 0.651085471850489, 'strategy': 'mean_reversion', 'time_stop': 104, 'use_sma': False, 'use_atr': True, 'use_adx': True, 'use_ema': True, 'use_spike': True, 'rsi_required': True, 'edge_k': 0.7295203475425927, 'edge_cap': 0.8357693243928237, 'bull_strategy': 'breakout', 'bull_bb_std_mult': 3.3862960684612897, 'bull_rsi_os': 17, 'bull_rsi_ob': 55, 'bull_adx_thresh': 15.64457877523624, 'bull_atr_min_pct': 0.018349955033979435, 'bull_atr_max_pct': 0.06527259831533104, 'bull_tp_mult': 1.5058662846613913, 'bull_tsl_mult': 0.5819919878989193, 'bull_time_stop': 289, 'bull_use_sma': True, 'bull_use_ema': False, 'bull_use_atr': False, 'bull_use_adx': True, 'bull_use_spike': True, 'bull_rsi_required': True, 'bear_strategy': 'mean_reversion', 'bear_bb_std_mult': 2.688547364248695, 'bear_rsi_os': 28, 'bear_rsi_ob': 53, 'bear_adx_thresh': 15.148415709224906, 'bear_atr_min_pct': 0.0074832481032368935, 'bear_atr_max_pct': 0.012766282602295113, 'bear_tp_mult': 1.3716537977740197, 'bear_tsl_mult': 0.45241743743144663, 'bear_time_stop': 177, 'bear_use_sma': True, 'bear_use_ema': False, 'bear_use_atr': False, 'bear_use_adx': True, 'bear_use_spike': True, 'bear_rsi_required': True, 'sideways_strategy': 'breakout', 'sideways_bb_std_mult': 3.0821330415843686, 'sideways_rsi_os': 49, 'sideways_rsi_ob': 92, 'sideways_adx_thresh': 25.823545635164532, 'sideways_atr_min_pct': 0.014005676206342865, 'sideways_atr_max_pct': 0.13273516200649738, 'sideways_tp_mult': 2.0068615250092345, 'sideways_tsl_mult': 0.07339661748963422, 'sideways_time_stop': 88, 'sideways_use_sma': False, 'sideways_use_ema': True, 'sideways_use_atr': True, 'sideways_use_adx': False, 'sideways_use_spike': False, 'sideways_rsi_required': True}.
[I 2025-08-30 21:25:49,271] Trial 305 finished with values: [-1000000000.0, 1000000000.0] and parameters: {'p_sma': 60, 'p_std': 33, 'p_atr': 15, 'p_adx': 20, 'rsi_period': 76, 'ema1': 16, 'ema2': 45, 'slip_atr_k': 0.1509344307804859, 'slip_spread_k': 0.5965685102124643, 'spread_hl_frac': 0.006494974407005604, 'bb_std_mult': 1.5486215377385704, 'rsi_os': 9, 'rsi_ob': 53, 'vol_spike': 0.13867276445918242, 'adx_thresh': 31.196523204038847, 'atr_min_pct': 0.022206292006928384, 'atr_max_pct': 0.08983350480352754, 'tp_mult': 1.628573015123187, 'tsl_mult': 0.9464844055814532, 'strategy': 'mean_reversion', 'time_stop': 116, 'use_sma': True, 'use_atr': True, 'use_adx': True, 'use_ema': True, 'use_spike': True, 'rsi_required': True, 'edge_k': 1.9703968467818473, 'edge_cap': 0.6501943072045713, 'bull_strategy': 'breakout', 'bull_bb_std_mult': 3.4688715158467374, 'bull_rsi_os': 22, 'bull_rsi_ob': 89, 'bull_adx_thresh': 30.942028099221545, 'bull_atr_min_pct': 0.022488154259577998, 'bull_atr_max_pct': 0.05720369743508674, 'bull_tp_mult': 2.3718953552514215, 'bull_tsl_mult': 0.9404628330805742, 'bull_time_stop': 242, 'bull_use_sma': True, 'bull_use_ema': False, 'bull_use_atr': False, 'bull_use_adx': True, 'bull_use_spike': True, 'bull_rsi_required': True, 'bear_strategy': 'mean_reversion', 'bear_bb_std_mult': 1.3339285524071371, 'bear_rsi_os': 28, 'bear_rsi_ob': 95, 'bear_adx_thresh': 14.33208914105817, 'bear_atr_min_pct': 0.007457822175736343, 'bear_atr_max_pct': 0.09647136382894772, 'bear_tp_mult': 1.3738398329079566, 'bear_tsl_mult': 0.42658165254953995, 'bear_time_stop': 65, 'bear_use_sma': True, 'bear_use_ema': True, 'bear_use_atr': False, 'bear_use_adx': True, 'bear_use_spike': True, 'bear_rsi_required': True, 'sideways_strategy': 'breakout', 'sideways_bb_std_mult': 3.4542172582890265, 'sideways_rsi_os': 55, 'sideways_rsi_ob': 52, 'sideways_adx_thresh': 25.839232735143504, 'sideways_atr_min_pct': 0.014110631310602988, 'sideways_atr_max_pct': 0.1354167968072374, 'sideways_tp_mult': 2.0585230954592784, 'sideways_tsl_mult': 0.3954826591412896, 'sideways_time_stop': 89, 'sideways_use_sma': False, 'sideways_use_ema': True, 'sideways_use_atr': True, 'sideways_use_adx': False, 'sideways_use_spike': False, 'sideways_rsi_required': True}.
[I 2025-08-30 21:25:49,575] Trial 306 finished with values: [-1000000000.0, 1000000000.0] and parameters: {'p_sma': 26, 'p_std': 33, 'p_atr': 21, 'p_adx': 30, 'rsi_period': 25, 'ema1': 16, 'ema2': 43, 'slip_atr_k': 0.1986672399633022, 'slip_spread_k': 0.09918889243456674, 'spread_hl_frac': 0.0035946244995210463, 'bb_std_mult': 0.8369578043861154, 'rsi_os': 12, 'rsi_ob': 82, 'vol_spike': 0.02896290212721457, 'adx_thresh': 29.955660148427334, 'atr_min_pct': 0.02025878298294301, 'atr_max_pct': 0.09168473821676734, 'tp_mult': 1.6306685037370015, 'tsl_mult': 0.9515677282777613, 'strategy': 'mean_reversion', 'time_stop': 116, 'use_sma': True, 'use_atr': True, 'use_adx': True, 'use_ema': True, 'use_spike': True, 'rsi_required': True, 'edge_k': 1.9762644009313803, 'edge_cap': 0.608090205842543, 'bull_strategy': 'breakout', 'bull_bb_std_mult': 3.458942036329305, 'bull_rsi_os': 54, 'bull_rsi_ob': 71, 'bull_adx_thresh': 31.078900951058944, 'bull_atr_min_pct': 0.004548651102874611, 'bull_atr_max_pct': 0.05837420644874355, 'bull_tp_mult': 2.457367197597547, 'bull_tsl_mult': 0.2847239146929028, 'bull_time_stop': 300, 'bull_use_sma': True, 'bull_use_ema': False, 'bull_use_atr': False, 'bull_use_adx': True, 'bull_use_spike': True, 'bull_rsi_required': True, 'bear_strategy': 'mean_reversion', 'bear_bb_std_mult': 2.40894133431214, 'bear_rsi_os': 42, 'bear_rsi_ob': 54, 'bear_adx_thresh': 14.449134993389519, 'bear_atr_min_pct': 0.014929137945497474, 'bear_atr_max_pct': 0.020628406151755825, 'bear_tp_mult': 2.884577635159611, 'bear_tsl_mult': 0.4215760417338408, 'bear_time_stop': 294, 'bear_use_sma': True, 'bear_use_ema': True, 'bear_use_atr': False, 'bear_use_adx': True, 'bear_use_spike': True, 'bear_rsi_required': True, 'sideways_strategy': 'breakout', 'sideways_bb_std_mult': 3.4211259888330123, 'sideways_rsi_os': 13, 'sideways_rsi_ob': 47, 'sideways_adx_thresh': 28.605187568545745, 'sideways_atr_min_pct': 0.014545357603855403, 'sideways_atr_max_pct': 0.09017860109220155, 'sideways_tp_mult': 2.0629050811748857, 'sideways_tsl_mult': 0.030134772775278873, 'sideways_time_stop': 185, 'sideways_use_sma': False, 'sideways_use_ema': True, 'sideways_use_atr': True, 'sideways_use_adx': False, 'sideways_use_spike': False, 'sideways_rsi_required': True}.
[I 2025-08-30 21:25:49,728] Trial 304 finished with values: [-1000000000.0, 1000000000.0] and parameters: {'p_sma': 28, 'p_std': 55, 'p_atr': 29, 'p_adx': 20, 'rsi_period': 25, 'ema1': 16, 'ema2': 53, 'slip_atr_k': 0.01817383693290213, 'slip_spread_k': 0.4911513874020989, 'spread_hl_frac': 0.006726555093432071, 'bb_std_mult': 1.606005514660912, 'rsi_os': 26, 'rsi_ob': 80, 'vol_spike': 0.27989963105502386, 'adx_thresh': 26.812966382896647, 'atr_min_pct': 0.022114179591301387, 'atr_max_pct': 0.0888234581737694, 'tp_mult': 1.635522252467614, 'tsl_mult': 0.3980561362908342, 'strategy': 'mean_reversion', 'time_stop': 114, 'use_sma': True, 'use_atr': True, 'use_adx': True, 'use_ema': True, 'use_spike': True, 'rsi_required': True, 'edge_k': 1.8251428132516003, 'edge_cap': 0.8257464365056949, 'bull_strategy': 'breakout', 'bull_bb_std_mult': 3.4480302774445977, 'bull_rsi_os': 22, 'bull_rsi_ob': 88, 'bull_adx_thresh': 21.660274365955832, 'bull_atr_min_pct': 0.0222146935184762, 'bull_atr_max_pct': 0.05838829347987244, 'bull_tp_mult': 2.4679678419770084, 'bull_tsl_mult': 0.95413921462634, 'bull_time_stop': 300, 'bull_use_sma': True, 'bull_use_ema': False, 'bull_use_atr': False, 'bull_use_adx': True, 'bull_use_spike': True, 'bull_rsi_required': True, 'bear_strategy': 'mean_reversion', 'bear_bb_std_mult': 2.717181922121662, 'bear_rsi_os': 33, 'bear_rsi_ob': 53, 'bear_adx_thresh': 21.3221765937767, 'bear_atr_min_pct': 0.0025270331373762386, 'bear_atr_max_pct': 0.012380812622766278, 'bear_tp_mult': 2.8694447001693244, 'bear_tsl_mult': 0.4258854680112567, 'bear_time_stop': 201, 'bear_use_sma': True, 'bear_use_ema': False, 'bear_use_atr': False, 'bear_use_adx': True, 'bear_use_spike': True, 'bear_rsi_required': True, 'sideways_strategy': 'breakout', 'sideways_bb_std_mult': 1.5872776008634981, 'sideways_rsi_os': 31, 'sideways_rsi_ob': 86, 'sideways_adx_thresh': 13.303820205697335, 'sideways_atr_min_pct': 0.014049141914916801, 'sideways_atr_max_pct': 0.08876075256885882, 'sideways_tp_mult': 2.0607976785518782, 'sideways_tsl_mult': 0.4418194325052431, 'sideways_time_stop': 193, 'sideways_use_sma': False, 'sideways_use_ema': True, 'sideways_use_atr': True, 'sideways_use_adx': False, 'sideways_use_spike': False, 'sideways_rsi_required': True}.
