[I 2025-08-30 21:05:25,097] Trial 145 finished with values: [-1000000000.0, 1000000000.0] and parameters: {'p_sma': 30, 'p_std': 54, 'p_atr': 12, 'p_adx': 29, 'rsi_period': 50, 'ema1': 19, 'ema2': 44, 'slip_atr_k': 0.04204199161778029, 'slip_spread_k': 0.8200721786828797, 'spread_hl_frac': 0.003603276026089238, 'bb_std_mult': 1.641735760344441, 'rsi_os': 41, 'rsi_ob': 73, 'vol_spike': 0.13091617989330118, 'adx_thresh': 24.49033393532199, 'atr_min_pct': 0.00743796249775503, 'atr_max_pct': 0.09096698932654526, 'tp_mult': 1.5421106421418467, 'tsl_mult': 0.8263037208449188, 'strategy': 'mean_reversion', 'time_stop': 233, 'use_sma': False, 'use_atr': True, 'use_adx': True, 'use_ema': True, 'use_spike': True, 'rsi_required': True, 'edge_k': 0.04349143846255876, 'edge_cap': 0.8334986302173186, 'bull_strategy': 'breakout', 'bull_bb_std_mult': 3.4211066637670067, 'bull_rsi_os': 19, 'bull_rsi_ob': 69, 'bull_adx_thresh': 12.763186303563076, 'bull_atr_min_pct': 0.01405264677510287, 'bull_atr_max_pct': 0.052645590438471355, 'bull_tp_mult': 2.568223563966403, 'bull_tsl_mult': 0.34340206250366323, 'bull_time_stop': 298, 'bull_use_sma': False, 'bull_use_ema': False, 'bull_use_atr': False, 'bull_use_adx': True, 'bull_use_spike': True, 'bull_rsi_required': False, 'bear_strategy': 'mean_reversion', 'bear_bb_std_mult': 2.7301141736376593, 'bear_rsi_os': 47, 'bear_rsi_ob': 50, 'bear_adx_thresh': 14.481762846514439, 'bear_atr_min_pct': 0.0178324052271809, 'bear_atr_max_pct': 0.01241880052180629, 'bear_tp_mult': 1.7381622073108067, 'bear_tsl_mult': 0.45205298374773345, 'bear_time_stop': 138, 'bear_use_sma': True, 'bear_use_ema': False, 'bear_use_atr': False, 'bear_use_adx': True, 'bear_use_spike': True, 'bear_rsi_required': True, 'sideways_strategy': 'breakout', 'sideways_bb_std_mult': 2.716536132224903, 'sideways_rsi_os': 41, 'sideways_rsi_ob': 73, 'sideways_adx_thresh': 34.99826198810434, 'sideways_atr_min_pct': 0.014426525682978853, 'sideways_atr_max_pct': 0.010437208046235123, 'sideways_tp_mult': 2.6571328630885467, 'sideways_tsl_mult': 0.6917322021313745, 'sideways_time_stop': 288, 'sideways_use_sma': False, 'sideways_use_ema': True, 'sideways_use_atr': True, 'sideways_use_adx': False, 'sideways_use_spike': False, 'sideways_rsi_required': True}.
[I 2025-08-30 21:05:25,185] Trial 144 finished with values: [-1000000000.0, 1000000000.0] and parameters: {'p_sma': 34, 'p_std': 13, 'p_atr': 12, 'p_adx': 29, 'rsi_period': 56, 'ema1': 27, 'ema2': 44, 'slip_atr_k': 0.04165160332257648, 'slip_spread_k': 0.8244729478830605, 'spread_hl_frac': 0.004344286778739812, 'bb_std_mult': 1.6232701750013654, 'rsi_os': 32, 'rsi_ob': 65, 'vol_spike': 0.195026750552519, 'adx_thresh': 24.412613769339416, 'atr_min_pct': 0.006973994665882438, 'atr_max_pct': 0.09130021028681355, 'tp_mult': 1.2250546085306273, 'tsl_mult': 0.8224502875809321, 'strategy': 'mean_reversion', 'time_stop': 234, 'use_sma': False, 'use_atr': True, 'use_adx': True, 'use_ema': True, 'use_spike': True, 'rsi_required': True, 'edge_k': 0.5865083800063027, 'edge_cap': 0.8205660799432332, 'bull_strategy': 'breakout', 'bull_bb_std_mult': 0.8223215110982398, 'bull_rsi_os': 19, 'bull_rsi_ob': 69, 'bull_adx_thresh': 12.8821165459055, 'bull_atr_min_pct': 0.002142944679534653, 'bull_atr_max_pct': 0.052830616283893114, 'bull_tp_mult': 2.541960151461862, 'bull_tsl_mult': 0.19266746591138253, 'bull_time_stop': 300, 'bull_use_sma': False, 'bull_use_ema': False, 'bull_use_atr': False, 'bull_use_adx': True, 'bull_use_spike': True, 'bull_rsi_required': False, 'bear_strategy': 'mean_reversion', 'bear_bb_std_mult': 2.4520719405468796, 'bear_rsi_os': 47, 'bear_rsi_ob': 52, 'bear_adx_thresh': 14.411013356431525, 'bear_atr_min_pct': 0.01792488270322738, 'bear_atr_max_pct': 0.010369602496426197, 'bear_tp_mult': 2.9575008747669784, 'bear_tsl_mult': 0.5817364510556271, 'bear_time_stop': 130, 'bear_use_sma': True, 'bear_use_ema': False, 'bear_use_atr': False, 'bear_use_adx': True, 'bear_use_spike': True, 'bear_rsi_required': True, 'sideways_strategy': 'breakout', 'sideways_bb_std_mult': 2.700679572921734, 'sideways_rsi_os': 41, 'sideways_rsi_ob': 62, 'sideways_adx_thresh': 30.23772322264178, 'sideways_atr_min_pct': 0.009924326135635674, 'sideways_atr_max_pct': 0.06151292303256729, 'sideways_tp_mult': 1.8716653759373831, 'sideways_tsl_mult': 0.7628527507602719, 'sideways_time_stop': 159, 'sideways_use_sma': False, 'sideways_use_ema': True, 'sideways_use_atr': True, 'sideways_use_adx': False, 'sideways_use_spike': False, 'sideways_rsi_required': True}.
[I 2025-08-30 21:05:59,167] Trial 147 finished with values: [-1000000000.0, 1000000000.0] and parameters: {'p_sma': 34, 'p_std': 58, 'p_atr': 12, 'p_adx': 29, 'rsi_period': 50, 'ema1': 19, 'ema2': 46, 'slip_atr_k': 0.04150652441955611, 'slip_spread_k': 0.8232023703202382, 'spread_hl_frac': 0.013484214635088095, 'bb_std_mult': 1.6730407429086864, 'rsi_os': 35, 'rsi_ob': 71, 'vol_spike': 0.11434537924530191, 'adx_thresh': 8.362420907752817, 'atr_min_pct': 0.027657283269857634, 'atr_max_pct': 0.09599447395528285, 'tp_mult': 1.772445304003733, 'tsl_mult': 0.8213667103228979, 'strategy': 'mean_reversion', 'time_stop': 132, 'use_sma': True, 'use_atr': True, 'use_adx': True, 'use_ema': True, 'use_spike': True, 'rsi_required': True, 'edge_k': 0.2841336315110288, 'edge_cap': 0.6925821196587078, 'bull_strategy': 'mean_reversion', 'bull_bb_std_mult': 3.408416359846874, 'bull_rsi_os': 52, 'bull_rsi_ob': 50, 'bull_adx_thresh': 29.996496842774917, 'bull_atr_min_pct': 0.01575204804180274, 'bull_atr_max_pct': 0.05183855262271221, 'bull_tp_mult': 2.549749436789175, 'bull_tsl_mult': 0.08465624137405509, 'bull_time_stop': 296, 'bull_use_sma': True, 'bull_use_ema': False, 'bull_use_atr': False, 'bull_use_adx': False, 'bull_use_spike': True, 'bull_rsi_required': True, 'bear_strategy': 'breakout', 'bear_bb_std_mult': 2.768011302098869, 'bear_rsi_os': 47, 'bear_rsi_ob': 50, 'bear_adx_thresh': 14.418875768394129, 'bear_atr_min_pct': 0.029634065676394556, 'bear_atr_max_pct': 0.010060324939981463, 'bear_tp_mult': 1.2760224859520268, 'bear_tsl_mult': 0.22675060201928054, 'bear_time_stop': 140, 'bear_use_sma': True, 'bear_use_ema': False, 'bear_use_atr': True, 'bear_use_adx': True, 'bear_use_spike': True, 'bear_rsi_required': True, 'sideways_strategy': 'breakout', 'sideways_bb_std_mult': 2.7231253232134462, 'sideways_rsi_os': 24, 'sideways_rsi_ob': 72, 'sideways_adx_thresh': 18.28754999011616, 'sideways_atr_min_pct': 0.02171403037385714, 'sideways_atr_max_pct': 0.12871223215866645, 'sideways_tp_mult': 2.6361661542463777, 'sideways_tsl_mult': 0.953875425882673, 'sideways_time_stop': 284, 'sideways_use_sma': False, 'sideways_use_ema': True, 'sideways_use_atr': True, 'sideways_use_adx': True, 'sideways_use_spike': False, 'sideways_rsi_required': True}.
[I 2025-08-30 21:05:59,432] Trial 149 finished with values: [-0.02152566839692993, 0.021483980374807154] and parameters: {'p_sma': 28, 'p_std': 37, 'p_atr': 9, 'p_adx': 14, 'rsi_period': 61, 'ema1': 20, 'ema2': 56, 'slip_atr_k': 0.22396346846397167, 'slip_spread_k': 0.7295878200778625, 'spread_hl_frac': 0.041144823297498946, 'bb_std_mult': 1.7663090549259834, 'rsi_os': 46, 'rsi_ob': 61, 'vol_spike': 0.11854366825183273, 'adx_thresh': 34.394011777022726, 'atr_min_pct': 0.02892769596416655, 'atr_max_pct': 0.03879753291160918, 'tp_mult': 1.7697112122548055, 'tsl_mult': 0.8655373921107995, 'strategy': 'mean_reversion', 'time_stop': 220, 'use_sma': True, 'use_atr': True, 'use_adx': True, 'use_ema': True, 'use_spike': True, 'rsi_required': True, 'edge_k': 0.4385655541251571, 'edge_cap': 0.9668445924062137, 'bull_strategy': 'mean_reversion', 'bull_bb_std_mult': 2.9231659283903997, 'bull_rsi_os': 55, 'bull_rsi_ob': 67, 'bull_adx_thresh': 14.86550064239415, 'bull_atr_min_pct': 0.0009253357075585424, 'bull_atr_max_pct': 0.04542980139886541, 'bull_tp_mult': 1.9809105834198732, 'bull_tsl_mult': 0.3608395139070699, 'bull_time_stop': 293, 'bull_use_sma': True, 'bull_use_ema': False, 'bull_use_atr': False, 'bull_use_adx': False, 'bull_use_spike': True, 'bull_rsi_required': True, 'bear_strategy': 'breakout', 'bear_bb_std_mult': 2.8549254402901822, 'bear_rsi_os': 17, 'bear_rsi_ob': 56, 'bear_adx_thresh': 15.77069204628669, 'bear_atr_min_pct': 0.017076688265506998, 'bear_atr_max_pct': 0.07174465399155171, 'bear_tp_mult': 2.8587381821450695, 'bear_tsl_mult': 0.22392900868298937, 'bear_time_stop': 20, 'bear_use_sma': False, 'bear_use_ema': True, 'bear_use_atr': True, 'bear_use_adx': True, 'bear_use_spike': True, 'bear_rsi_required': True, 'sideways_strategy': 'breakout', 'sideways_bb_std_mult': 2.598445125757701, 'sideways_rsi_os': 39, 'sideways_rsi_ob': 68, 'sideways_adx_thresh': 31.704391800293294, 'sideways_atr_min_pct': 0.021339254175857345, 'sideways_atr_max_pct': 0.07320706351896594, 'sideways_tp_mult': 1.080162540007862, 'sideways_tsl_mult': 0.9317284854831596, 'sideways_time_stop': 254, 'sideways_use_sma': False, 'sideways_use_ema': True, 'sideways_use_atr': False, 'sideways_use_adx': True, 'sideways_use_spike': False, 'sideways_rsi_required': True}.
[I 2025-08-30 21:05:59,456] Trial 146 finished with values: [-1000000000.0, 1000000000.0] and parameters: {'p_sma': 34, 'p_std': 38, 'p_atr': 12, 'p_adx': 15, 'rsi_period': 56, 'ema1': 19, 'ema2': 57, 'slip_atr_k': 0.04229505846871014, 'slip_spread_k': 0.6130582478690314, 'spread_hl_frac': 0.026567296563482577, 'bb_std_mult': 1.6711675908990105, 'rsi_os': 36, 'rsi_ob': 80, 'vol_spike': 0.12849742389889895, 'adx_thresh': 23.22933569770891, 'atr_min_pct': 0.005105581266682131, 'atr_max_pct': 0.03928498783169242, 'tp_mult': 1.6904549181763335, 'tsl_mult': 0.8304791332954119, 'strategy': 'mean_reversion', 'time_stop': 136, 'use_sma': False, 'use_atr': True, 'use_adx': True, 'use_ema': True, 'use_spike': True, 'rsi_required': True, 'edge_k': 0.02916953410251466, 'edge_cap': 0.6861917429396525, 'bull_strategy': 'breakout', 'bull_bb_std_mult': 3.4204967105115496, 'bull_rsi_os': 51, 'bull_rsi_ob': 69, 'bull_adx_thresh': 12.805979896446988, 'bull_atr_min_pct': 0.0021719053861161573, 'bull_atr_max_pct': 0.05918875168903645, 'bull_tp_mult': 2.5441901566461076, 'bull_tsl_mult': 0.40296051962780166, 'bull_time_stop': 299, 'bull_use_sma': True, 'bull_use_ema': False, 'bull_use_atr': False, 'bull_use_adx': True, 'bull_use_spike': True, 'bull_rsi_required': True, 'bear_strategy': 'breakout', 'bear_bb_std_mult': 2.72862586226565, 'bear_rsi_os': 54, 'bear_rsi_ob': 50, 'bear_adx_thresh': 14.75521053326924, 'bear_atr_min_pct': 0.01768883055529907, 'bear_atr_max_pct': 0.014359843150726664, 'bear_tp_mult': 1.7204916058386217, 'bear_tsl_mult': 0.661256631726649, 'bear_time_stop': 18, 'bear_use_sma': True, 'bear_use_ema': False, 'bear_use_atr': True, 'bear_use_adx': True, 'bear_use_spike': True, 'bear_rsi_required': True, 'sideways_strategy': 'breakout', 'sideways_bb_std_mult': 2.70600879554206, 'sideways_rsi_os': 23, 'sideways_rsi_ob': 61, 'sideways_adx_thresh': 34.47762377219944, 'sideways_atr_min_pct': 0.01218544013212497, 'sideways_atr_max_pct': 0.07252714325215559, 'sideways_tp_mult': 2.636780158677739, 'sideways_tsl_mult': 0.9631168248671589, 'sideways_time_stop': 285, 'sideways_use_sma': False, 'sideways_use_ema': True, 'sideways_use_atr': True, 'sideways_use_adx': True, 'sideways_use_spike': False, 'sideways_rsi_required': True}.
[I 2025-08-30 21:05:59,656] Trial 148 finished with values: [-0.025425808550712303, 0.02533407869140559] and parameters: {'p_sma': 26, 'p_std': 12, 'p_atr': 17, 'p_adx': 8, 'rsi_period': 61, 'ema1': 20, 'ema2': 56, 'slip_atr_k': 0.027868535001118366, 'slip_spread_k': 0.7225707576415932, 'spread_hl_frac': 0.006512047720090907, 'bb_std_mult': 0.6688742666514151, 'rsi_os': 36, 'rsi_ob': 68, 'vol_spike': 0.19590590427717783, 'adx_thresh': 22.999840848202215, 'atr_min_pct': 0.004930596355048068, 'atr_max_pct': 0.02134759891803832, 'tp_mult': 1.4220780674078892, 'tsl_mult': 0.7896078020262611, 'strategy': 'mean_reversion', 'time_stop': 237, 'use_sma': True, 'use_atr': True, 'use_adx': True, 'use_ema': True, 'use_spike': True, 'rsi_required': True, 'edge_k': 0.4205273849240586, 'edge_cap': 0.7288933613457617, 'bull_strategy': 'mean_reversion', 'bull_bb_std_mult': 3.46482516738623, 'bull_rsi_os': 45, 'bull_rsi_ob': 69, 'bull_adx_thresh': 34.269156063091515, 'bull_atr_min_pct': 0.0011449514461630839, 'bull_atr_max_pct': 0.051468446685889846, 'bull_tp_mult': 2.5409272310390305, 'bull_tsl_mult': 0.3594674605663885, 'bull_time_stop': 294, 'bull_use_sma': True, 'bull_use_ema': False, 'bull_use_atr': False, 'bull_use_adx': False, 'bull_use_spike': True, 'bull_rsi_required': True, 'bear_strategy': 'breakout', 'bear_bb_std_mult': 3.4072593616211684, 'bear_rsi_os': 47, 'bear_rsi_ob': 84, 'bear_adx_thresh': 5.8808542012082725, 'bear_atr_min_pct': 0.029712033612443463, 'bear_atr_max_pct': 0.06613667244768956, 'bear_tp_mult': 2.952689205626419, 'bear_tsl_mult': 0.3770013334743157, 'bear_time_stop': 211, 'bear_use_sma': True, 'bear_use_ema': False, 'bear_use_atr': True, 'bear_use_adx': True, 'bear_use_spike': True, 'bear_rsi_required': True, 'sideways_strategy': 'breakout', 'sideways_bb_std_mult': 2.619284341090243, 'sideways_rsi_os': 39, 'sideways_rsi_ob': 61, 'sideways_adx_thresh': 31.950252651651788, 'sideways_atr_min_pct': 0.009109946441698678, 'sideways_atr_max_pct': 0.1365199897031303, 'sideways_tp_mult': 2.6973665119141192, 'sideways_tsl_mult': 0.7654801600090128, 'sideways_time_stop': 106, 'sideways_use_sma': False, 'sideways_use_ema': True, 'sideways_use_atr': False, 'sideways_use_adx': True, 'sideways_use_spike': False, 'sideways_rsi_required': True}.
[I 2025-08-30 21:06:00,082] Trial 152 finished with values: [-1000000000.0, 1000000000.0] and parameters: {'p_sma': 21, 'p_std': 51, 'p_atr': 17, 'p_adx': 16, 'rsi_period': 61, 'ema1': 20, 'ema2': 30, 'slip_atr_k': 0.21999655926336298, 'slip_spread_k': 0.7237374269586828, 'spread_hl_frac': 0.016465384635804013, 'bb_std_mult': 0.6738482309358407, 'rsi_os': 18, 'rsi_ob': 85, 'vol_spike': 0.2851760426786511, 'adx_thresh': 13.792003991116482, 'atr_min_pct': 0.024275252257773557, 'atr_max_pct': 0.023030302736339, 'tp_mult': 2.280522365258303, 'tsl_mult': 0.41130977716978184, 'strategy': 'mean_reversion', 'time_stop': 118, 'use_sma': True, 'use_atr': True, 'use_adx': True, 'use_ema': True, 'use_spike': True, 'rsi_required': True, 'edge_k': 0.4513170165176229, 'edge_cap': 0.7208759894659353, 'bull_strategy': 'mean_reversion', 'bull_bb_std_mult': 3.499542268072434, 'bull_rsi_os': 44, 'bull_rsi_ob': 67, 'bull_adx_thresh': 32.751400856287226, 'bull_atr_min_pct': 0.01911329592778413, 'bull_atr_max_pct': 0.04671958870387275, 'bull_tp_mult': 1.712479150534191, 'bull_tsl_mult': 0.8226680623803352, 'bull_time_stop': 285, 'bull_use_sma': True, 'bull_use_ema': False, 'bull_use_atr': False, 'bull_use_adx': False, 'bull_use_spike': True, 'bull_rsi_required': True, 'bear_strategy': 'mean_reversion', 'bear_bb_std_mult': 3.3994211308236117, 'bear_rsi_os': 43, 'bear_rsi_ob': 85, 'bear_adx_thresh': 16.397930456829815, 'bear_atr_min_pct': 0.008341450888088384, 'bear_atr_max_pct': 0.07237445116182105, 'bear_tp_mult': 2.8608016524322775, 'bear_tsl_mult': 0.377384587278591, 'bear_time_stop': 206, 'bear_use_sma': False, 'bear_use_ema': True, 'bear_use_atr': False, 'bear_use_adx': True, 'bear_use_spike': True, 'bear_rsi_required': True, 'sideways_strategy': 'mean_reversion', 'sideways_bb_std_mult': 2.532959126444521, 'sideways_rsi_os': 10, 'sideways_rsi_ob': 65, 'sideways_adx_thresh': 31.6930300437114, 'sideways_atr_min_pct': 0.027505863299357405, 'sideways_atr_max_pct': 0.1355293076312882, 'sideways_tp_mult': 2.6944676340533538, 'sideways_tsl_mult': 0.11645188071728818, 'sideways_time_stop': 104, 'sideways_use_sma': False, 'sideways_use_ema': True, 'sideways_use_atr': False, 'sideways_use_adx': True, 'sideways_use_spike': False, 'sideways_rsi_required': True}.
[I 2025-08-30 21:06:00,086] Trial 153 finished with values: [-1000000000.0, 1000000000.0] and parameters: {'p_sma': 28, 'p_std': 35, 'p_atr': 30, 'p_adx': 16, 'rsi_period': 66, 'ema1': 21, 'ema2': 24, 'slip_atr_k': 0.22897165589105992, 'slip_spread_k': 0.3530137745231484, 'spread_hl_frac': 0.016125863226980813, 'bb_std_mult': 1.7938389464331015, 'rsi_os': 53, 'rsi_ob': 54, 'vol_spike': 0.25539488885947625, 'adx_thresh': 23.565145401542708, 'atr_min_pct': 0.028881005192322284, 'atr_max_pct': 0.13045886184925595, 'tp_mult': 2.3965303617902194, 'tsl_mult': 0.3434308525669748, 'strategy': 'mean_reversion', 'time_stop': 208, 'use_sma': False, 'use_atr': True, 'use_adx': True, 'use_ema': True, 'use_spike': True, 'rsi_required': True, 'edge_k': 0.520745253697206, 'edge_cap': 0.5735515201874855, 'bull_strategy': 'breakout', 'bull_bb_std_mult': 3.482368844312721, 'bull_rsi_os': 22, 'bull_rsi_ob': 73, 'bull_adx_thresh': 11.88650824582256, 'bull_atr_min_pct': 0.011982047113157434, 'bull_atr_max_pct': 0.04501772645986109, 'bull_tp_mult': 2.6202222469532286, 'bull_tsl_mult': 0.9476770029308006, 'bull_time_stop': 286, 'bull_use_sma': True, 'bull_use_ema': False, 'bull_use_atr': False, 'bull_use_adx': True, 'bull_use_spike': True, 'bull_rsi_required': True, 'bear_strategy': 'mean_reversion', 'bear_bb_std_mult': 1.9908099783671733, 'bear_rsi_os': 43, 'bear_rsi_ob': 56, 'bear_adx_thresh': 16.33174212002711, 'bear_atr_min_pct': 0.027689186095228906, 'bear_atr_max_pct': 0.10516872172464636, 'bear_tp_mult': 2.866866617981409, 'bear_tsl_mult': 0.3332753972679522, 'bear_time_stop': 99, 'bear_use_sma': False, 'bear_use_ema': True, 'bear_use_atr': False, 'bear_use_adx': True, 'bear_use_spike': True, 'bear_rsi_required': True, 'sideways_strategy': 'mean_reversion', 'sideways_bb_std_mult': 2.5591722582090743, 'sideways_rsi_os': 18, 'sideways_rsi_ob': 68, 'sideways_adx_thresh': 31.73017880994135, 'sideways_atr_min_pct': 0.00797119526012327, 'sideways_atr_max_pct': 0.017168897332349345, 'sideways_tp_mult': 1.101168829437714, 'sideways_tsl_mult': 0.9239573044039248, 'sideways_time_stop': 300, 'sideways_use_sma': False, 'sideways_use_ema': True, 'sideways_use_atr': False, 'sideways_use_adx': False, 'sideways_use_spike': False, 'sideways_rsi_required': True}.
[I 2025-08-30 21:06:00,702] Trial 154 finished with values: [-1000000000.0, 1000000000.0] and parameters: {'p_sma': 40, 'p_std': 35, 'p_atr': 9, 'p_adx': 30, 'rsi_period': 27, 'ema1': 21, 'ema2': 42, 'slip_atr_k': 0.14190014326690845, 'slip_spread_k': 0.7743352301517245, 'spread_hl_frac': 0.04063194535704341, 'bb_std_mult': 1.5532965114578112, 'rsi_os': 53, 'rsi_ob': 53, 'vol_spike': 0.14062686273821828, 'adx_thresh': 16.426196340325554, 'atr_min_pct': 0.0005305216910922292, 'atr_max_pct': 0.08756188637511413, 'tp_mult': 2.3969760171334094, 'tsl_mult': 0.8524947249766099, 'strategy': 'mean_reversion', 'time_stop': 206, 'use_sma': False, 'use_atr': True, 'use_adx': True, 'use_ema': True, 'use_spike': True, 'rsi_required': True, 'edge_k': 0.528222273360412, 'edge_cap': 0.9503696571147888, 'bull_strategy': 'breakout', 'bull_bb_std_mult': 1.0725886769206652, 'bull_rsi_os': 15, 'bull_rsi_ob': 95, 'bull_adx_thresh': 11.980557449274766, 'bull_atr_min_pct': 0.0011996421760011669, 'bull_atr_max_pct': 0.09803172425887366, 'bull_tp_mult': 1.355125113260463, 'bull_tsl_mult': 0.07060036833208655, 'bull_time_stop': 291, 'bull_use_sma': True, 'bull_use_ema': False, 'bull_use_atr': False, 'bull_use_adx': True, 'bull_use_spike': True, 'bull_rsi_required': True, 'bear_strategy': 'mean_reversion', 'bear_bb_std_mult': 3.5874628562691493, 'bear_rsi_os': 50, 'bear_rsi_ob': 53, 'bear_adx_thresh': 16.012693594598396, 'bear_atr_min_pct': 0.017071723025921796, 'bear_atr_max_pct': 0.10179465875077143, 'bear_tp_mult': 2.9321250293031476, 'bear_tsl_mult': 0.27336082329906064, 'bear_time_stop': 96, 'bear_use_sma': False, 'bear_use_ema': True, 'bear_use_atr': False, 'bear_use_adx': True, 'bear_use_spike': True, 'bear_rsi_required': True, 'sideways_strategy': 'breakout', 'sideways_bb_std_mult': 2.80231915141206, 'sideways_rsi_os': 18, 'sideways_rsi_ob': 68, 'sideways_adx_thresh': 25.21384523384839, 'sideways_atr_min_pct': 0.02635893902044191, 'sideways_atr_max_pct': 0.09811580163453348, 'sideways_tp_mult': 1.506396750419557, 'sideways_tsl_mult': 0.2218574830099609, 'sideways_time_stop': 254, 'sideways_use_sma': False, 'sideways_use_ema': True, 'sideways_use_atr': True, 'sideways_use_adx': False, 'sideways_use_spike': False, 'sideways_rsi_required': True}.
