[I 2025-08-30 20:53:55,045] Trial 54 finished with values: [-1000000000.0, 1000000000.0] and parameters: {'p_sma': 55, 'p_std': 53, 'p_atr': 30, 'p_adx': 23, 'rsi_period': 37, 'ema1': 14, 'ema2': 35, 'slip_atr_k': 0.04506420161484459, 'slip_spread_k': 0.13093167426063618, 'spread_hl_frac': 0.021293565472313286, 'bb_std_mult': 2.451582771370355, 'rsi_os': 20, 'rsi_ob': 76, 'vol_spike': 0.04933370496521354, 'adx_thresh': 5.8695614083982655, 'atr_min_pct': 0.015784484922641097, 'atr_max_pct': 0.10290654080544884, 'tp_mult': 1.6395727234984212, 'tsl_mult': 0.8146193787599516, 'strategy': 'mean_reversion', 'time_stop': 74, 'use_sma': True, 'use_atr': True, 'use_adx': True, 'use_ema': False, 'use_spike': True, 'rsi_required': True, 'edge_k': 1.0854317313783153, 'edge_cap': 0.7051336314990919, 'bull_strategy': 'breakout', 'bull_bb_std_mult': 1.6136215967976861, 'bull_rsi_os': 26, 'bull_rsi_ob': 94, 'bull_adx_thresh': 5.93628727967409, 'bull_atr_min_pct': 0.018594822391608156, 'bull_atr_max_pct': 0.07469607296855763, 'bull_tp_mult': 1.9350152506205354, 'bull_tsl_mult': 0.29731344370477597, 'bull_time_stop': 26, 'bull_use_sma': False, 'bull_use_ema': False, 'bull_use_atr': False, 'bull_use_adx': True, 'bull_use_spike': False, 'bull_rsi_required': False, 'bear_strategy': 'breakout', 'bear_bb_std_mult': 1.9943157705068082, 'bear_rsi_os': 32, 'bear_rsi_ob': 74, 'bear_adx_thresh': 20.90444012120595, 'bear_atr_min_pct': 0.014976281334623706, 'bear_atr_max_pct': 0.060991028846186957, 'bear_tp_mult': 2.1317163268548147, 'bear_tsl_mult': 0.020135653036252713, 'bear_time_stop': 218, 'bear_use_sma': True, 'bear_use_ema': False, 'bear_use_atr': False, 'bear_use_adx': True, 'bear_use_spike': True, 'bear_rsi_required': True, 'sideways_strategy': 'mean_reversion', 'sideways_bb_std_mult': 3.596880327428677, 'sideways_rsi_os': 15, 'sideways_rsi_ob': 61, 'sideways_adx_thresh': 25.89805399044839, 'sideways_atr_min_pct': 0.02034955785113063, 'sideways_atr_max_pct': 0.01895971819665853, 'sideways_tp_mult': 2.091024777341895, 'sideways_tsl_mult': 0.30624476281694035, 'sideways_time_stop': 23, 'sideways_use_sma': False, 'sideways_use_ema': False, 'sideways_use_atr': False, 'sideways_use_adx': False, 'sideways_use_spike': False, 'sideways_rsi_required': False}.
[I 2025-08-30 20:53:59,347] Trial 55 finished with values: [-1000000000.0, 1000000000.0] and parameters: {'p_sma': 55, 'p_std': 36, 'p_atr': 29, 'p_adx': 21, 'rsi_period': 15, 'ema1': 14, 'ema2': 35, 'slip_atr_k': 0.038555470039079734, 'slip_spread_k': 0.976866818634123, 'spread_hl_frac': 0.02089348342423777, 'bb_std_mult': 1.346648374172322, 'rsi_os': 19, 'rsi_ob': 51, 'vol_spike': 0.04758470366991775, 'adx_thresh': 5.821717447695704, 'atr_min_pct': 0.020133127182273707, 'atr_max_pct': 0.03496816005972038, 'tp_mult': 1.6428577252655276, 'tsl_mult': 0.5431832539352882, 'strategy': 'mean_reversion', 'time_stop': 79, 'use_sma': True, 'use_atr': True, 'use_adx': True, 'use_ema': False, 'use_spike': True, 'rsi_required': True, 'edge_k': 1.0881912326196188, 'edge_cap': 0.7252217518155223, 'bull_strategy': 'breakout', 'bull_bb_std_mult': 1.2975323071334661, 'bull_rsi_os': 26, 'bull_rsi_ob': 93, 'bull_adx_thresh': 6.828205848203815, 'bull_atr_min_pct': 0.012075186805437732, 'bull_atr_max_pct': 0.019609914257793137, 'bull_tp_mult': 1.9195554994140522, 'bull_tsl_mult': 0.3049366572069302, 'bull_time_stop': 33, 'bull_use_sma': False, 'bull_use_ema': False, 'bull_use_atr': False, 'bull_use_adx': True, 'bull_use_spike': False, 'bull_rsi_required': False, 'bear_strategy': 'mean_reversion', 'bear_bb_std_mult': 2.1434114663061785, 'bear_rsi_os': 42, 'bear_rsi_ob': 82, 'bear_adx_thresh': 20.819575429800064, 'bear_atr_min_pct': 0.014707959081045134, 'bear_atr_max_pct': 0.09360853006664657, 'bear_tp_mult': 1.923036704020751, 'bear_tsl_mult': 0.12173779992465117, 'bear_time_stop': 117, 'bear_use_sma': True, 'bear_use_ema': False, 'bear_use_atr': False, 'bear_use_adx': True, 'bear_use_spike': True, 'bear_rsi_required': True, 'sideways_strategy': 'mean_reversion', 'sideways_bb_std_mult': 3.5659349866985384, 'sideways_rsi_os': 14, 'sideways_rsi_ob': 62, 'sideways_adx_thresh': 13.184925462585984, 'sideways_atr_min_pct': 0.002247453597960126, 'sideways_atr_max_pct': 0.03562304989791709, 'sideways_tp_mult': 2.8755162607534683, 'sideways_tsl_mult': 0.012178672760275566, 'sideways_time_stop': 64, 'sideways_use_sma': False, 'sideways_use_ema': False, 'sideways_use_atr': False, 'sideways_use_adx': False, 'sideways_use_spike': False, 'sideways_rsi_required': False}.
[I 2025-08-30 20:54:28,325] Trial 56 finished with values: [-1000000000.0, 1000000000.0] and parameters: {'p_sma': 46, 'p_std': 41, 'p_atr': 29, 'p_adx': 21, 'rsi_period': 15, 'ema1': 10, 'ema2': 35, 'slip_atr_k': 0.04138001502977652, 'slip_spread_k': 0.5272503290617796, 'spread_hl_frac': 0.021582626637381752, 'bb_std_mult': 1.3975642276131617, 'rsi_os': 20, 'rsi_ob': 53, 'vol_spike': 0.04718312769029484, 'adx_thresh': 5.349215370696274, 'atr_min_pct': 0.016318686612473668, 'atr_max_pct': 0.03637599476137001, 'tp_mult': 1.6217970395401848, 'tsl_mult': 0.19651009412210982, 'strategy': 'mean_reversion', 'time_stop': 82, 'use_sma': True, 'use_atr': True, 'use_adx': True, 'use_ema': False, 'use_spike': True, 'rsi_required': True, 'edge_k': 0.93935588855638, 'edge_cap': 0.7179755158134882, 'bull_strategy': 'breakout', 'bull_bb_std_mult': 2.7005494870892583, 'bull_rsi_os': 49, 'bull_rsi_ob': 93, 'bull_adx_thresh': 6.571230118580862, 'bull_atr_min_pct': 0.0027104898309598295, 'bull_atr_max_pct': 0.020906754722539028, 'bull_tp_mult': 2.325499869082412, 'bull_tsl_mult': 0.3079340978899651, 'bull_time_stop': 221, 'bull_use_sma': False, 'bull_use_ema': False, 'bull_use_atr': False, 'bull_use_adx': True, 'bull_use_spike': False, 'bull_rsi_required': False, 'bear_strategy': 'breakout', 'bear_bb_std_mult': 1.3336690503594217, 'bear_rsi_os': 42, 'bear_rsi_ob': 81, 'bear_adx_thresh': 20.399357199155492, 'bear_atr_min_pct': 0.027152736541254077, 'bear_atr_max_pct': 0.0887203246556415, 'bear_tp_mult': 1.805298114378345, 'bear_tsl_mult': 0.015893633589838946, 'bear_time_stop': 118, 'bear_use_sma': True, 'bear_use_ema': False, 'bear_use_atr': False, 'bear_use_adx': True, 'bear_use_spike': True, 'bear_rsi_required': True, 'sideways_strategy': 'mean_reversion', 'sideways_bb_std_mult': 3.5712899343178006, 'sideways_rsi_os': 20, 'sideways_rsi_ob': 51, 'sideways_adx_thresh': 14.048814075978584, 'sideways_atr_min_pct': 0.016052427596965218, 'sideways_atr_max_pct': 0.022456208108102352, 'sideways_tp_mult': 2.0906180934269325, 'sideways_tsl_mult': 0.6703158822201589, 'sideways_time_stop': 173, 'sideways_use_sma': False, 'sideways_use_ema': False, 'sideways_use_atr': False, 'sideways_use_adx': False, 'sideways_use_spike': False, 'sideways_rsi_required': False}.
[I 2025-08-30 20:54:29,239] Trial 57 finished with values: [-1000000000.0, 1000000000.0] and parameters: {'p_sma': 46, 'p_std': 41, 'p_atr': 29, 'p_adx': 21, 'rsi_period': 19, 'ema1': 10, 'ema2': 35, 'slip_atr_k': 0.04614356721482059, 'slip_spread_k': 0.6433054538530772, 'spread_hl_frac': 0.00262226026817912, 'bb_std_mult': 3.4248093840892073, 'rsi_os': 19, 'rsi_ob': 52, 'vol_spike': 0.25531101240490667, 'adx_thresh': 10.724725607888173, 'atr_min_pct': 0.020514537028766777, 'atr_max_pct': 0.035397103658226556, 'tp_mult': 1.5836439272383895, 'tsl_mult': 0.33456686082086823, 'strategy': 'mean_reversion', 'time_stop': 87, 'use_sma': True, 'use_atr': False, 'use_adx': False, 'use_ema': False, 'use_spike': False, 'rsi_required': True, 'edge_k': 0.9907121422914781, 'edge_cap': 0.7006380435926927, 'bull_strategy': 'breakout', 'bull_bb_std_mult': 2.6766015220480326, 'bull_rsi_os': 30, 'bull_rsi_ob': 94, 'bull_adx_thresh': 5.326245971544532, 'bull_atr_min_pct': 0.023234130245332038, 'bull_atr_max_pct': 0.018910167673560956, 'bull_tp_mult': 2.005782437507916, 'bull_tsl_mult': 0.29753527878078184, 'bull_time_stop': 26, 'bull_use_sma': False, 'bull_use_ema': False, 'bull_use_atr': False, 'bull_use_adx': True, 'bull_use_spike': False, 'bull_rsi_required': False, 'bear_strategy': 'breakout', 'bear_bb_std_mult': 2.1066188853563568, 'bear_rsi_os': 42, 'bear_rsi_ob': 82, 'bear_adx_thresh': 20.489500375022867, 'bear_atr_min_pct': 0.011058387198086644, 'bear_atr_max_pct': 0.10800371034568071, 'bear_tp_mult': 1.3536227499330142, 'bear_tsl_mult': 0.023953196979062882, 'bear_time_stop': 118, 'bear_use_sma': True, 'bear_use_ema': False, 'bear_use_atr': False, 'bear_use_adx': True, 'bear_use_spike': True, 'bear_rsi_required': True, 'sideways_strategy': 'mean_reversion', 'sideways_bb_std_mult': 3.5801679465850285, 'sideways_rsi_os': 21, 'sideways_rsi_ob': 51, 'sideways_adx_thresh': 14.581157700084088, 'sideways_atr_min_pct': 0.0022628104410377086, 'sideways_atr_max_pct': 0.01878398137851159, 'sideways_tp_mult': 2.863320847401869, 'sideways_tsl_mult': 0.2356645231792047, 'sideways_time_stop': 24, 'sideways_use_sma': False, 'sideways_use_ema': True, 'sideways_use_atr': False, 'sideways_use_adx': False, 'sideways_use_spike': False, 'sideways_rsi_required': False}.
[I 2025-08-30 20:54:29,847] Trial 58 finished with values: [-0.06659530575020489, 0.06654882711864488] and parameters: {'p_sma': 46, 'p_std': 60, 'p_atr': 29, 'p_adx': 16, 'rsi_period': 16, 'ema1': 10, 'ema2': 54, 'slip_atr_k': 0.16791611099614204, 'slip_spread_k': 0.9728588641085382, 'spread_hl_frac': 0.01786370839516591, 'bb_std_mult': 2.7648944712094137, 'rsi_os': 27, 'rsi_ob': 52, 'vol_spike': 0.25419093535867615, 'adx_thresh': 10.843453129094001, 'atr_min_pct': 0.021027754526231086, 'atr_max_pct': 0.03564665989933986, 'tp_mult': 2.8280126488399038, 'tsl_mult': 0.0847769901354189, 'strategy': 'mean_reversion', 'time_stop': 86, 'use_sma': True, 'use_atr': False, 'use_adx': False, 'use_ema': False, 'use_spike': False, 'rsi_required': False, 'edge_k': 0.9429559789544647, 'edge_cap': 0.7402705035690912, 'bull_strategy': 'breakout', 'bull_bb_std_mult': 1.2743317036652722, 'bull_rsi_os': 50, 'bull_rsi_ob': 88, 'bull_adx_thresh': 33.66473847922516, 'bull_atr_min_pct': 0.0023990754523066813, 'bull_atr_max_pct': 0.021670002114865555, 'bull_tp_mult': 2.2734801677401597, 'bull_tsl_mult': 0.9203714320270022, 'bull_time_stop': 215, 'bull_use_sma': False, 'bull_use_ema': False, 'bull_use_atr': True, 'bull_use_adx': True, 'bull_use_spike': False, 'bull_rsi_required': True, 'bear_strategy': 'breakout', 'bear_bb_std_mult': 0.9362661355862272, 'bear_rsi_os': 43, 'bear_rsi_ob': 81, 'bear_adx_thresh': 26.376163216055026, 'bear_atr_min_pct': 0.00035787330532507933, 'bear_atr_max_pct': 0.09076479804195176, 'bear_tp_mult': 2.8597106263316197, 'bear_tsl_mult': 0.12450747899189994, 'bear_time_stop': 119, 'bear_use_sma': True, 'bear_use_ema': True, 'bear_use_atr': False, 'bear_use_adx': False, 'bear_use_spike': False, 'bear_rsi_required': True, 'sideways_strategy': 'mean_reversion', 'sideways_bb_std_mult': 2.4292798310325603, 'sideways_rsi_os': 13, 'sideways_rsi_ob': 52, 'sideways_adx_thresh': 13.744672792282678, 'sideways_atr_min_pct': 0.00016984189420352243, 'sideways_atr_max_pct': 0.07865028637145793, 'sideways_tp_mult': 2.999400305521903, 'sideways_tsl_mult': 0.0086754008683807, 'sideways_time_stop': 61, 'sideways_use_sma': True, 'sideways_use_ema': True, 'sideways_use_atr': False, 'sideways_use_adx': False, 'sideways_use_spike': False, 'sideways_rsi_required': False}.
[I 2025-08-30 20:54:32,057] Trial 59 finished with values: [-1000000000.0, 1000000000.0] and parameters: {'p_sma': 45, 'p_std': 41, 'p_atr': 9, 'p_adx': 27, 'rsi_period': 20, 'ema1': 11, 'ema2': 54, 'slip_atr_k': 0.1522631228945696, 'slip_spread_k': 0.5114234833288408, 'spread_hl_frac': 0.002528237227949204, 'bb_std_mult': 2.8412371473013005, 'rsi_os': 40, 'rsi_ob': 61, 'vol_spike': 0.2584584085684942, 'adx_thresh': 21.76916010906629, 'atr_min_pct': 0.016879644707131988, 'atr_max_pct': 0.14818437826355424, 'tp_mult': 2.8340980940166967, 'tsl_mult': 0.07222007857641083, 'strategy': 'mean_reversion', 'time_stop': 104, 'use_sma': True, 'use_atr': False, 'use_adx': False, 'use_ema': True, 'use_spike': False, 'rsi_required': False, 'edge_k': 0.9574421822570851, 'edge_cap': 0.7586242248634606, 'bull_strategy': 'breakout', 'bull_bb_std_mult': 2.128290329174066, 'bull_rsi_os': 30, 'bull_rsi_ob': 88, 'bull_adx_thresh': 19.95241786099645, 'bull_atr_min_pct': 0.0028504919428795662, 'bull_atr_max_pct': 0.04409990090067949, 'bull_tp_mult': 1.6577516679704318, 'bull_tsl_mult': 0.07082061417553404, 'bull_time_stop': 219, 'bull_use_sma': False, 'bull_use_ema': False, 'bull_use_atr': True, 'bull_use_adx': True, 'bull_use_spike': True, 'bull_rsi_required': True, 'bear_strategy': 'breakout', 'bear_bb_std_mult': 3.455413778893184, 'bear_rsi_os': 11, 'bear_rsi_ob': 52, 'bear_adx_thresh': 25.646509165749386, 'bear_atr_min_pct': 0.02798549450189628, 'bear_atr_max_pct': 0.08625801417578717, 'bear_tp_mult': 2.30726909264114, 'bear_tsl_mult': 0.16185657363189296, 'bear_time_stop': 135, 'bear_use_sma': True, 'bear_use_ema': True, 'bear_use_atr': False, 'bear_use_adx': False, 'bear_use_spike': False, 'bear_rsi_required': True, 'sideways_strategy': 'mean_reversion', 'sideways_bb_std_mult': 2.4863806605587375, 'sideways_rsi_os': 20, 'sideways_rsi_ob': 49, 'sideways_adx_thresh': 22.665819809680137, 'sideways_atr_min_pct': 0.025528935129312532, 'sideways_atr_max_pct': 0.07556277122945822, 'sideways_tp_mult': 2.0817213981021707, 'sideways_tsl_mult': 0.24054938459227349, 'sideways_time_stop': 190, 'sideways_use_sma': True, 'sideways_use_ema': True, 'sideways_use_atr': False, 'sideways_use_adx': False, 'sideways_use_spike': False, 'sideways_rsi_required': True}.
[I 2025-08-30 20:55:04,922] Trial 60 finished with values: [-1000000000.0, 1000000000.0] and parameters: {'p_sma': 5, 'p_std': 60, 'p_atr': 25, 'p_adx': 27, 'rsi_period': 21, 'ema1': 19, 'ema2': 54, 'slip_atr_k': 0.16747593615133932, 'slip_spread_k': 0.6453176515428863, 'spread_hl_frac': 0.027081963864698095, 'bb_std_mult': 3.4095019009920775, 'rsi_os': 15, 'rsi_ob': 56, 'vol_spike': 0.26792236507727635, 'adx_thresh': 10.389007577532578, 'atr_min_pct': 0.02095441886481156, 'atr_max_pct': 0.14828280433495206, 'tp_mult': 1.0361522871711344, 'tsl_mult': 0.07361980691728148, 'strategy': 'breakout', 'time_stop': 104, 'use_sma': True, 'use_atr': False, 'use_adx': False, 'use_ema': True, 'use_spike': False, 'rsi_required': False, 'edge_k': 0.2985583184505043, 'edge_cap': 0.7798363357101993, 'bull_strategy': 'breakout', 'bull_bb_std_mult': 2.1444316606124403, 'bull_rsi_os': 30, 'bull_rsi_ob': 79, 'bull_adx_thresh': 33.551745031413695, 'bull_atr_min_pct': 7.67658452217664e-05, 'bull_atr_max_pct': 0.132629668580308, 'bull_tp_mult': 1.6587968028288766, 'bull_tsl_mult': 0.9216587751472749, 'bull_time_stop': 241, 'bull_use_sma': False, 'bull_use_ema': True, 'bull_use_atr': True, 'bull_use_adx': True, 'bull_use_spike': True, 'bull_rsi_required': True, 'bear_strategy': 'breakout', 'bear_bb_std_mult': 0.9735776939532998, 'bear_rsi_os': 32, 'bear_rsi_ob': 52, 'bear_adx_thresh': 26.514695004203325, 'bear_atr_min_pct': 0.010876577968620313, 'bear_atr_max_pct': 0.10768282567990203, 'bear_tp_mult': 2.885758423737184, 'bear_tsl_mult': 0.15257158901186696, 'bear_time_stop': 136, 'bear_use_sma': True, 'bear_use_ema': True, 'bear_use_atr': False, 'bear_use_adx': False, 'bear_use_spike': False, 'bear_rsi_required': False, 'sideways_strategy': 'mean_reversion', 'sideways_bb_std_mult': 2.2601170934420645, 'sideways_rsi_os': 9, 'sideways_rsi_ob': 75, 'sideways_adx_thresh': 22.466214332200597, 'sideways_atr_min_pct': 0.022467358888712985, 'sideways_atr_max_pct': 0.07526893742951751, 'sideways_tp_mult': 1.0494194770394352, 'sideways_tsl_mult': 0.2506293384594599, 'sideways_time_stop': 187, 'sideways_use_sma': True, 'sideways_use_ema': True, 'sideways_use_atr': True, 'sideways_use_adx': False, 'sideways_use_spike': True, 'sideways_rsi_required': True}.
[I 2025-08-30 20:55:05,621] Trial 62 finished with values: [-1000000000.0, 1000000000.0] and parameters: {'p_sma': 9, 'p_std': 21, 'p_atr': 9, 'p_adx': 8, 'rsi_period': 48, 'ema1': 19, 'ema2': 48, 'slip_atr_k': 0.16763872328702864, 'slip_spread_k': 0.4776601398390308, 'spread_hl_frac': 0.018926562125475062, 'bb_std_mult': 3.1532964903394256, 'rsi_os': 15, 'rsi_ob': 46, 'vol_spike': 0.11936566635179005, 'adx_thresh': 22.424359177947558, 'atr_min_pct': 0.0034311887941590197, 'atr_max_pct': 0.1407797119593376, 'tp_mult': 2.8198176129652492, 'tsl_mult': 0.07094150728440063, 'strategy': 'breakout', 'time_stop': 66, 'use_sma': False, 'use_atr': False, 'use_adx': False, 'use_ema': True, 'use_spike': False, 'rsi_required': False, 'edge_k': 0.18244016313940026, 'edge_cap': 0.7678011674091999, 'bull_strategy': 'breakout', 'bull_bb_std_mult': 2.1594612831889886, 'bull_rsi_os': 10, 'bull_rsi_ob': 88, 'bull_adx_thresh': 29.30959783806375, 'bull_atr_min_pct': 5.6548935647955016e-05, 'bull_atr_max_pct': 0.05410376408486717, 'bull_tp_mult': 2.0258184235851235, 'bull_tsl_mult': 0.9080137914425096, 'bull_time_stop': 238, 'bull_use_sma': False, 'bull_use_ema': True, 'bull_use_atr': True, 'bull_use_adx': True, 'bull_use_spike': True, 'bull_rsi_required': True, 'bear_strategy': 'breakout', 'bear_bb_std_mult': 0.9241053722639592, 'bear_rsi_os': 13, 'bear_rsi_ob': 53, 'bear_adx_thresh': 25.49018229228497, 'bear_atr_min_pct': 0.0019155418606649714, 'bear_atr_max_pct': 0.03542088828668384, 'bear_tp_mult': 2.3787896614349164, 'bear_tsl_mult': 0.16359347449843467, 'bear_time_stop': 138, 'bear_use_sma': True, 'bear_use_ema': True, 'bear_use_atr': False, 'bear_use_adx': False, 'bear_use_spike': False, 'bear_rsi_required': False, 'sideways_strategy': 'breakout', 'sideways_bb_std_mult': 2.490844844791712, 'sideways_rsi_os': 30, 'sideways_rsi_ob': 48, 'sideways_adx_thresh': 23.425989680993318, 'sideways_atr_min_pct': 0.022316065663855408, 'sideways_atr_max_pct': 0.0807647852328025, 'sideways_tp_mult': 1.0322857200898543, 'sideways_tsl_mult': 0.8772808781360757, 'sideways_time_stop': 32, 'sideways_use_sma': True, 'sideways_use_ema': True, 'sideways_use_atr': True, 'sideways_use_adx': False, 'sideways_use_spike': True, 'sideways_rsi_required': True}.
[I 2025-08-30 20:55:05,757] Trial 61 finished with values: [-0.02245152801869732, 0.02237354263397008] and parameters: {'p_sma': 52, 'p_std': 30, 'p_atr': 25, 'p_adx': 9, 'rsi_period': 48, 'ema1': 19, 'ema2': 29, 'slip_atr_k': 0.17228383264613506, 'slip_spread_k': 0.5978316921265764, 'spread_hl_frac': 0.034908381687849405, 'bb_std_mult': 1.8095469870508163, 'rsi_os': 27, 'rsi_ob': 92, 'vol_spike': 0.22099485179785078, 'adx_thresh': 21.58879894476612, 'atr_min_pct': 0.009934409339558518, 'atr_max_pct': 0.05730598998959053, 'tp_mult': 2.7887276884960652, 'tsl_mult': 0.6554751539101473, 'strategy': 'breakout', 'time_stop': 108, 'use_sma': False, 'use_atr': False, 'use_adx': False, 'use_ema': True, 'use_spike': False, 'rsi_required': False, 'edge_k': 0.778805257679687, 'edge_cap': 0.9494273205836655, 'bull_strategy': 'breakout', 'bull_bb_std_mult': 2.221854031576685, 'bull_rsi_os': 33, 'bull_rsi_ob': 79, 'bull_adx_thresh': 19.61387407550922, 'bull_atr_min_pct': 2.599938711328291e-05, 'bull_atr_max_pct': 0.04426571460435155, 'bull_tp_mult': 1.677193829473241, 'bull_tsl_mult': 0.9272155006704167, 'bull_time_stop': 190, 'bull_use_sma': False, 'bull_use_ema': True, 'bull_use_atr': True, 'bull_use_adx': True, 'bull_use_spike': True, 'bull_rsi_required': True, 'bear_strategy': 'breakout', 'bear_bb_std_mult': 2.30642985589858, 'bear_rsi_os': 32, 'bear_rsi_ob': 66, 'bear_adx_thresh': 26.462244850089405, 'bear_atr_min_pct': 0.0257224624765515, 'bear_atr_max_pct': 0.046708294823051486, 'bear_tp_mult': 2.3137069746850485, 'bear_tsl_mult': 0.330097566724728, 'bear_time_stop': 138, 'bear_use_sma': True, 'bear_use_ema': True, 'bear_use_atr': False, 'bear_use_adx': False, 'bear_use_spike': False, 'bear_rsi_required': False, 'sideways_strategy': 'breakout', 'sideways_bb_std_mult': 2.1660536730535815, 'sideways_rsi_os': 8, 'sideways_rsi_ob': 48, 'sideways_adx_thresh': 22.74823501251627, 'sideways_atr_min_pct': 0.022317411906967177, 'sideways_atr_max_pct': 0.07931023102866966, 'sideways_tp_mult': 1.0106046904932895, 'sideways_tsl_mult': 0.25494873934208107, 'sideways_time_stop': 161, 'sideways_use_sma': True, 'sideways_use_ema': True, 'sideways_use_atr': True, 'sideways_use_adx': False, 'sideways_use_spike': True, 'sideways_rsi_required': True}.
