[I 2025-08-30 20:50:21,888] Trial 26 finished with values: [-1000000000.0, 1000000000.0] and parameters: {'p_sma': 42, 'p_std': 5, 'p_atr': 28, 'p_adx': 10, 'rsi_period': 7, 'ema1': 15, 'ema2': 51, 'slip_atr_k': 0.0659545058097894, 'slip_spread_k': 0.30057322768353373, 'spread_hl_frac': 0.025951951947367873, 'bb_std_mult': 2.5847773373885894, 'rsi_os': 37, 'rsi_ob': 70, 'vol_spike': 0.16023897489139052, 'adx_thresh': 19.162970851267815, 'atr_min_pct': 0.004988395321331133, 'atr_max_pct': 0.09456312258667585, 'tp_mult': 1.5360545480135408, 'tsl_mult': 0.30262427167298106, 'strategy': 'breakout', 'time_stop': 41, 'use_sma': False, 'use_atr': True, 'use_adx': False, 'use_ema': True, 'use_spike': False, 'rsi_required': False, 'edge_k': 1.3016543094656305, 'edge_cap': 0.8955082447799534, 'bull_strategy': 'breakout', 'bull_bb_std_mult': 1.7537562296768519, 'bull_rsi_os': 31, 'bull_rsi_ob': 82, 'bull_adx_thresh': 8.644991540096871, 'bull_atr_min_pct': 0.003817831154212109, 'bull_atr_max_pct': 0.058257968421699086, 'bull_tp_mult': 2.083888482658494, 'bull_tsl_mult': 0.2655232529944478, 'bull_time_stop': 299, 'bull_use_sma': False, 'bull_use_ema': True, 'bull_use_atr': True, 'bull_use_adx': True, 'bull_use_spike': True, 'bull_rsi_required': True, 'bear_strategy': 'breakout', 'bear_bb_std_mult': 2.905821074462917, 'bear_rsi_os': 16, 'bear_rsi_ob': 63, 'bear_adx_thresh': 18.909437922916347, 'bear_atr_min_pct': 0.005612149220427862, 'bear_atr_max_pct': 0.11374417558693728, 'bear_tp_mult': 2.7405728530462574, 'bear_tsl_mult': 0.7267974160478142, 'bear_time_stop': 246, 'bear_use_sma': True, 'bear_use_ema': True, 'bear_use_atr': False, 'bear_use_adx': False, 'bear_use_spike': False, 'bear_rsi_required': False, 'sideways_strategy': 'mean_reversion', 'sideways_bb_std_mult': 2.687902290753121, 'sideways_rsi_os': 12, 'sideways_rsi_ob': 56, 'sideways_adx_thresh': 26.207436879845055, 'sideways_atr_min_pct': 0.029279533365571726, 'sideways_atr_max_pct': 0.027605603775398162, 'sideways_tp_mult': 2.801349330799723, 'sideways_tsl_mult': 0.8528199695928813, 'sideways_time_stop': 106, 'sideways_use_sma': True, 'sideways_use_ema': True, 'sideways_use_atr': True, 'sideways_use_adx': False, 'sideways_use_spike': True, 'sideways_rsi_required': True}.
[I 2025-08-30 20:50:22,031] Trial 27 finished with values: [-1000000000.0, 1000000000.0] and parameters: {'p_sma': 52, 'p_std': 35, 'p_atr': 21, 'p_adx': 24, 'rsi_period': 24, 'ema1': 10, 'ema2': 51, 'slip_atr_k': 0.06819866189760479, 'slip_spread_k': 0.3203566413493839, 'spread_hl_frac': 0.019480975931556163, 'bb_std_mult': 2.5582638002357823, 'rsi_os': 37, 'rsi_ob': 84, 'vol_spike': 0.16330105026614986, 'adx_thresh': 19.939505408021716, 'atr_min_pct': 0.005527271995823757, 'atr_max_pct': 0.0848958321321171, 'tp_mult': 1.3605287458198039, 'tsl_mult': 0.47183420127574954, 'strategy': 'breakout', 'time_stop': 124, 'use_sma': False, 'use_atr': True, 'use_adx': False, 'use_ema': True, 'use_spike': False, 'rsi_required': False, 'edge_k': 1.3382124170420433, 'edge_cap': 0.9080874889967873, 'bull_strategy': 'breakout', 'bull_bb_std_mult': 1.813860713669001, 'bull_rsi_os': 19, 'bull_rsi_ob': 82, 'bull_adx_thresh': 8.272544056594977, 'bull_atr_min_pct': 0.004378538960543509, 'bull_atr_max_pct': 0.06370755102922421, 'bull_tp_mult': 1.9620125283928245, 'bull_tsl_mult': 0.5259142725592426, 'bull_time_stop': 97, 'bull_use_sma': False, 'bull_use_ema': True, 'bull_use_atr': True, 'bull_use_adx': True, 'bull_use_spike': True, 'bull_rsi_required': True, 'bear_strategy': 'breakout', 'bear_bb_std_mult': 2.980592040770328, 'bear_rsi_os': 16, 'bear_rsi_ob': 65, 'bear_adx_thresh': 19.189516039886435, 'bear_atr_min_pct': 0.005573588509329889, 'bear_atr_max_pct': 0.026801960621144975, 'bear_tp_mult': 2.758568908264037, 'bear_tsl_mult': 0.7260151766906152, 'bear_time_stop': 248, 'bear_use_sma': True, 'bear_use_ema': True, 'bear_use_atr': False, 'bear_use_adx': False, 'bear_use_spike': False, 'bear_rsi_required': False, 'sideways_strategy': 'mean_reversion', 'sideways_bb_std_mult': 3.27874608391855, 'sideways_rsi_os': 11, 'sideways_rsi_ob': 57, 'sideways_adx_thresh': 11.191558068656986, 'sideways_atr_min_pct': 0.02961177545404843, 'sideways_atr_max_pct': 0.059149987025929114, 'sideways_tp_mult': 1.2963309497221682, 'sideways_tsl_mult': 0.5105517686011739, 'sideways_time_stop': 109, 'sideways_use_sma': True, 'sideways_use_ema': True, 'sideways_use_atr': True, 'sideways_use_adx': False, 'sideways_use_spike': True, 'sideways_rsi_required': True}.
[I 2025-08-30 20:50:44,745] Trial 29 finished with values: [-1000000000.0, 1000000000.0] and parameters: {'p_sma': 49, 'p_std': 5, 'p_atr': 29, 'p_adx': 24, 'rsi_period': 24, 'ema1': 11, 'ema2': 51, 'slip_atr_k': 0.06416328602997919, 'slip_spread_k': 0.30378767070934415, 'spread_hl_frac': 0.01626912472218437, 'bb_std_mult': 2.620069852646477, 'rsi_os': 35, 'rsi_ob': 69, 'vol_spike': 0.08599284411135542, 'adx_thresh': 18.880080183335814, 'atr_min_pct': 0.0049872314430551914, 'atr_max_pct': 0.08480809308501998, 'tp_mult': 1.3997930609263076, 'tsl_mult': 0.004246887710972036, 'strategy': 'breakout', 'time_stop': 123, 'use_sma': False, 'use_atr': True, 'use_adx': False, 'use_ema': False, 'use_spike': False, 'rsi_required': False, 'edge_k': 1.434290393083924, 'edge_cap': 0.8843039224535163, 'bull_strategy': 'mean_reversion', 'bull_bb_std_mult': 1.8346143551275826, 'bull_rsi_os': 20, 'bull_rsi_ob': 81, 'bull_adx_thresh': 9.015494185536873, 'bull_atr_min_pct': 7.885895549046242e-05, 'bull_atr_max_pct': 0.08890883811724773, 'bull_tp_mult': 2.070680799704496, 'bull_tsl_mult': 0.40375785877983816, 'bull_time_stop': 203, 'bull_use_sma': True, 'bull_use_ema': True, 'bull_use_atr': True, 'bull_use_adx': True, 'bull_use_spike': True, 'bull_rsi_required': True, 'bear_strategy': 'breakout', 'bear_bb_std_mult': 3.03164462022028, 'bear_rsi_os': 15, 'bear_rsi_ob': 50, 'bear_adx_thresh': 19.27641198550046, 'bear_atr_min_pct': 0.0051431015871849055, 'bear_atr_max_pct': 0.027727445345642948, 'bear_tp_mult': 2.7080818193077794, 'bear_tsl_mult': 0.9777703235074964, 'bear_time_stop': 154, 'bear_use_sma': False, 'bear_use_ema': True, 'bear_use_atr': True, 'bear_use_adx': False, 'bear_use_spike': False, 'bear_rsi_required': False, 'sideways_strategy': 'breakout', 'sideways_bb_std_mult': 3.287943549023069, 'sideways_rsi_os': 10, 'sideways_rsi_ob': 57, 'sideways_adx_thresh': 9.77641763909526, 'sideways_atr_min_pct': 0.01461612235563641, 'sideways_atr_max_pct': 0.058831467408488686, 'sideways_tp_mult': 2.425530699181343, 'sideways_tsl_mult': 0.52355647798633, 'sideways_time_stop': 104, 'sideways_use_sma': True, 'sideways_use_ema': True, 'sideways_use_atr': True, 'sideways_use_adx': True, 'sideways_use_spike': True, 'sideways_rsi_required': True}.
[I 2025-08-30 20:50:55,169] Trial 32 finished with values: [-1000000000.0, 1000000000.0] and parameters: {'p_sma': 11, 'p_std': 35, 'p_atr': 7, 'p_adx': 29, 'rsi_period': 39, 'ema1': 8, 'ema2': 17, 'slip_atr_k': 0.13518730420787295, 'slip_spread_k': 0.4306611148256404, 'spread_hl_frac': 0.004956417326597889, 'bb_std_mult': 1.9790895079126987, 'rsi_os': 6, 'rsi_ob': 89, 'vol_spike': 0.07908061550389411, 'adx_thresh': 14.663980973706675, 'atr_min_pct': 0.017611446996590285, 'atr_max_pct': 0.1277753430010687, 'tp_mult': 2.1096296546453863, 'tsl_mult': 0.4408140389272326, 'strategy': 'mean_reversion', 'time_stop': 208, 'use_sma': True, 'use_atr': True, 'use_adx': True, 'use_ema': False, 'use_spike': True, 'rsi_required': True, 'edge_k': 1.5920355945479852, 'edge_cap': 0.6354841687685571, 'bull_strategy': 'mean_reversion', 'bull_bb_std_mult': 2.434952200680577, 'bull_rsi_os': 44, 'bull_rsi_ob': 91, 'bull_adx_thresh': 28.550301683334073, 'bull_atr_min_pct': 0.013109117915016602, 'bull_atr_max_pct': 0.025624454563682855, 'bull_tp_mult': 1.7967750394947208, 'bull_tsl_mult': 0.33992319289571477, 'bull_time_stop': 66, 'bull_use_sma': True, 'bull_use_ema': False, 'bull_use_atr': False, 'bull_use_adx': True, 'bull_use_spike': False, 'bull_rsi_required': True, 'bear_strategy': 'breakout', 'bear_bb_std_mult': 3.279735449909925, 'bear_rsi_os': 26, 'bear_rsi_ob': 75, 'bear_adx_thresh': 27.81109025147766, 'bear_atr_min_pct': 0.018212251320505527, 'bear_atr_max_pct': 0.08123671624389499, 'bear_tp_mult': 2.021100927095899, 'bear_tsl_mult': 0.9666440893263895, 'bear_time_stop': 153, 'bear_use_sma': False, 'bear_use_ema': False, 'bear_use_atr': True, 'bear_use_adx': False, 'bear_use_spike': True, 'bear_rsi_required': True, 'sideways_strategy': 'breakout', 'sideways_bb_std_mult': 1.942807896307139, 'sideways_rsi_os': 22, 'sideways_rsi_ob': 64, 'sideways_adx_thresh': 21.470357527834498, 'sideways_atr_min_pct': 0.004527320609240396, 'sideways_atr_max_pct': 0.1097699012217434, 'sideways_tp_mult': 2.1777387830520376, 'sideways_tsl_mult': 0.16637951213608715, 'sideways_time_stop': 8, 'sideways_use_sma': False, 'sideways_use_ema': False, 'sideways_use_atr': False, 'sideways_use_adx': True, 'sideways_use_spike': False, 'sideways_rsi_required': False}.
[I 2025-08-30 20:50:55,464] Trial 31 finished with values: [-1000000000.0, 1000000000.0] and parameters: {'p_sma': 48, 'p_std': 32, 'p_atr': 30, 'p_adx': 30, 'rsi_period': 39, 'ema1': 8, 'ema2': 12, 'slip_atr_k': 0.21219676962287345, 'slip_spread_k': 0.5460931204040615, 'spread_hl_frac': 0.005808358937754633, 'bb_std_mult': 1.8991245230470208, 'rsi_os': 5, 'rsi_ob': 88, 'vol_spike': 0.08992126160836758, 'adx_thresh': 14.40542975453867, 'atr_min_pct': 0.025606569887046387, 'atr_max_pct': 0.1322678782990338, 'tp_mult': 2.0992949589570187, 'tsl_mult': 0.44495261636201056, 'strategy': 'mean_reversion', 'time_stop': 189, 'use_sma': True, 'use_atr': True, 'use_adx': True, 'use_ema': False, 'use_spike': True, 'rsi_required': True, 'edge_k': 1.5354085712133674, 'edge_cap': 0.6009831233554658, 'bull_strategy': 'mean_reversion', 'bull_bb_std_mult': 2.37797685155341, 'bull_rsi_os': 41, 'bull_rsi_ob': 95, 'bull_adx_thresh': 30.6039996231682, 'bull_atr_min_pct': 0.014689726601094726, 'bull_atr_max_pct': 0.09939183890807762, 'bull_tp_mult': 2.748948055075249, 'bull_tsl_mult': 0.34340541237899186, 'bull_time_stop': 179, 'bull_use_sma': True, 'bull_use_ema': False, 'bull_use_atr': False, 'bull_use_adx': True, 'bull_use_spike': False, 'bull_rsi_required': True, 'bear_strategy': 'breakout', 'bear_bb_std_mult': 3.561504454233891, 'bear_rsi_os': 25, 'bear_rsi_ob': 73, 'bear_adx_thresh': 27.84750197188493, 'bear_atr_min_pct': 0.017498515282189143, 'bear_atr_max_pct': 0.12993700215842954, 'bear_tp_mult': 2.005314698770161, 'bear_tsl_mult': 0.9666531902522129, 'bear_time_stop': 163, 'bear_use_sma': False, 'bear_use_ema': False, 'bear_use_atr': True, 'bear_use_adx': False, 'bear_use_spike': True, 'bear_rsi_required': True, 'sideways_strategy': 'breakout', 'sideways_bb_std_mult': 1.9709716891721978, 'sideways_rsi_os': 22, 'sideways_rsi_ob': 73, 'sideways_adx_thresh': 21.152216808494813, 'sideways_atr_min_pct': 0.003935184659500587, 'sideways_atr_max_pct': 0.14713631665240062, 'sideways_tp_mult': 2.2526358792144228, 'sideways_tsl_mult': 0.16479236860544677, 'sideways_time_stop': 9, 'sideways_use_sma': False, 'sideways_use_ema': False, 'sideways_use_atr': False, 'sideways_use_adx': True, 'sideways_use_spike': False, 'sideways_rsi_required': False}.
[I 2025-08-30 20:50:56,580] Trial 30 finished with values: [-1000000000.0, 1000000000.0] and parameters: {'p_sma': 50, 'p_std': 33, 'p_atr': 29, 'p_adx': 30, 'rsi_period': 39, 'ema1': 8, 'ema2': 20, 'slip_atr_k': 0.21918166479799023, 'slip_spread_k': 0.32117603576704334, 'spread_hl_frac': 0.0499538382117721, 'bb_std_mult': 2.5553579873631653, 'rsi_os': 6, 'rsi_ob': 86, 'vol_spike': 0.08224243709887502, 'adx_thresh': 19.85963165202093, 'atr_min_pct': 0.006506679035536842, 'atr_max_pct': 0.09913384260337808, 'tp_mult': 1.2798038116922628, 'tsl_mult': 0.3231390751301879, 'strategy': 'breakout', 'time_stop': 197, 'use_sma': False, 'use_atr': True, 'use_adx': False, 'use_ema': False, 'use_spike': False, 'rsi_required': False, 'edge_k': 1.5560250631777897, 'edge_cap': 0.579403997320207, 'bull_strategy': 'mean_reversion', 'bull_bb_std_mult': 2.500632892228277, 'bull_rsi_os': 45, 'bull_rsi_ob': 90, 'bull_adx_thresh': 9.026331629863853, 'bull_atr_min_pct': 0.013712315879150096, 'bull_atr_max_pct': 0.02414184569854296, 'bull_tp_mult': 1.7502951056405351, 'bull_tsl_mult': 0.20624012874896874, 'bull_time_stop': 286, 'bull_use_sma': True, 'bull_use_ema': True, 'bull_use_atr': False, 'bull_use_adx': True, 'bull_use_spike': True, 'bull_rsi_required': True, 'bear_strategy': 'breakout', 'bear_bb_std_mult': 0.8329151483782348, 'bear_rsi_os': 5, 'bear_rsi_ob': 63, 'bear_adx_thresh': 18.569807779333367, 'bear_atr_min_pct': 0.01754295031334487, 'bear_atr_max_pct': 0.08810942117671831, 'bear_tp_mult': 2.7501084505710356, 'bear_tsl_mult': 0.062351841271175906, 'bear_time_stop': 151, 'bear_use_sma': False, 'bear_use_ema': True, 'bear_use_atr': True, 'bear_use_adx': False, 'bear_use_spike': True, 'bear_rsi_required': False, 'sideways_strategy': 'breakout', 'sideways_bb_std_mult': 3.334331646664095, 'sideways_rsi_os': 10, 'sideways_rsi_ob': 65, 'sideways_adx_thresh': 21.503946672947638, 'sideways_atr_min_pct': 0.027227382815298982, 'sideways_atr_max_pct': 0.08636816972971756, 'sideways_tp_mult': 2.1647048215131695, 'sideways_tsl_mult': 0.7239592650217372, 'sideways_time_stop': 7, 'sideways_use_sma': False, 'sideways_use_ema': True, 'sideways_use_atr': True, 'sideways_use_adx': True, 'sideways_use_spike': True, 'sideways_rsi_required': True}.
[I 2025-08-30 20:50:57,821] Trial 36 finished with values: [-1000000000.0, 1000000000.0] and parameters: {'p_sma': 18, 'p_std': 44, 'p_atr': 24, 'p_adx': 18, 'rsi_period': 71, 'ema1': 13, 'ema2': 56, 'slip_atr_k': 0.16324212501115262, 'slip_spread_k': 0.6595507036120338, 'spread_hl_frac': 0.02329913202532909, 'bb_std_mult': 1.1884426726807915, 'rsi_os': 21, 'rsi_ob': 50, 'vol_spike': 0.03355904984021577, 'adx_thresh': 8.117233200473686, 'atr_min_pct': 0.019071954366465714, 'atr_max_pct': 0.06521491998579435, 'tp_mult': 2.668617820645052, 'tsl_mult': 0.8612613287549875, 'strategy': 'mean_reversion', 'time_stop': 274, 'use_sma': True, 'use_atr': False, 'use_adx': True, 'use_ema': True, 'use_spike': True, 'rsi_required': True, 'edge_k': 1.1875901681130887, 'edge_cap': 0.8055482781264239, 'bull_strategy': 'breakout', 'bull_bb_std_mult': 1.4509258184984806, 'bull_rsi_os': 28, 'bull_rsi_ob': 90, 'bull_adx_thresh': 22.835803780534807, 'bull_atr_min_pct': 0.016939626910819072, 'bull_atr_max_pct': 0.14582890601213178, 'bull_tp_mult': 1.9318362755279763, 'bull_tsl_mult': 0.4514578247054775, 'bull_time_stop': 167, 'bull_use_sma': False, 'bull_use_ema': False, 'bull_use_atr': False, 'bull_use_adx': False, 'bull_use_spike': False, 'bull_rsi_required': False, 'bear_strategy': 'mean_reversion', 'bear_bb_std_mult': 2.201220924448644, 'bear_rsi_os': 38, 'bear_rsi_ob': 86, 'bear_adx_thresh': 5.339027565259663, 'bear_atr_min_pct': 0.008510075293972675, 'bear_atr_max_pct': 0.06891582888431642, 'bear_tp_mult': 1.708864294106073, 'bear_tsl_mult': 0.47956964982867806, 'bear_time_stop': 75, 'bear_use_sma': False, 'bear_use_ema': False, 'bear_use_atr': False, 'bear_use_adx': True, 'bear_use_spike': True, 'bear_rsi_required': True, 'sideways_strategy': 'mean_reversion', 'sideways_bb_std_mult': 1.2221530180185924, 'sideways_rsi_os': 17, 'sideways_rsi_ob': 95, 'sideways_adx_thresh': 24.296340439826995, 'sideways_atr_min_pct': 0.02157865911115208, 'sideways_atr_max_pct': 0.041768389525654925, 'sideways_tp_mult': 2.604526575126686, 'sideways_tsl_mult': 0.39893746423768456, 'sideways_time_stop': 35, 'sideways_use_sma': False, 'sideways_use_ema': False, 'sideways_use_atr': False, 'sideways_use_adx': False, 'sideways_use_spike': False, 'sideways_rsi_required': False}.
[I 2025-08-30 20:51:17,217] Trial 33 finished with values: [-1000000000.0, 1000000000.0] and parameters: {'p_sma': 16, 'p_std': 32, 'p_atr': 7, 'p_adx': 29, 'rsi_period': 40, 'ema1': 8, 'ema2': 19, 'slip_atr_k': 0.2130750355877058, 'slip_spread_k': 0.5333374460288586, 'spread_hl_frac': 0.049557377854353456, 'bb_std_mult': 1.9641369198902077, 'rsi_os': 5, 'rsi_ob': 95, 'vol_spike': 0.03612521906172572, 'adx_thresh': 14.807704560934136, 'atr_min_pct': 0.01717662470944581, 'atr_max_pct': 0.12981180310183188, 'tp_mult': 2.6148571033082244, 'tsl_mult': 0.6009046222675848, 'strategy': 'mean_reversion', 'time_stop': 217, 'use_sma': True, 'use_atr': True, 'use_adx': True, 'use_ema': False, 'use_spike': True, 'rsi_required': True, 'edge_k': 0.8320382751912019, 'edge_cap': 0.6422849576417894, 'bull_strategy': 'mean_reversion', 'bull_bb_std_mult': 2.261330556768823, 'bull_rsi_os': 46, 'bull_rsi_ob': 91, 'bull_adx_thresh': 23.554899054795303, 'bull_atr_min_pct': 0.015166355262999259, 'bull_atr_max_pct': 0.03283241570326285, 'bull_tp_mult': 1.7586604393458218, 'bull_tsl_mult': 0.20607065519083329, 'bull_time_stop': 63, 'bull_use_sma': True, 'bull_use_ema': False, 'bull_use_atr': False, 'bull_use_adx': False, 'bull_use_spike': False, 'bull_rsi_required': False, 'bear_strategy': 'mean_reversion', 'bear_bb_std_mult': 0.859686680363797, 'bear_rsi_os': 26, 'bear_rsi_ob': 75, 'bear_adx_thresh': 27.654442464788662, 'bear_atr_min_pct': 0.015896652528672228, 'bear_atr_max_pct': 0.13242483669845323, 'bear_tp_mult': 1.9863525845843666, 'bear_tsl_mult': 0.09975962614334268, 'bear_time_stop': 73, 'bear_use_sma': False, 'bear_use_ema': False, 'bear_use_atr': True, 'bear_use_adx': True, 'bear_use_spike': True, 'bear_rsi_required': True, 'sideways_strategy': 'breakout', 'sideways_bb_std_mult': 1.2782590754617953, 'sideways_rsi_os': 23, 'sideways_rsi_ob': 73, 'sideways_adx_thresh': 20.41511553361797, 'sideways_atr_min_pct': 0.005523628865835203, 'sideways_atr_max_pct': 0.0875558966573155, 'sideways_tp_mult': 2.181006994340765, 'sideways_tsl_mult': 0.14115803056072235, 'sideways_time_stop': 24, 'sideways_use_sma': False, 'sideways_use_ema': False, 'sideways_use_atr': False, 'sideways_use_adx': True, 'sideways_use_spike': False, 'sideways_rsi_required': False}.
[I 2025-08-30 20:51:32,896] Trial 34 finished with values: [-1000000000.0, 1000000000.0] and parameters: {'p_sma': 46, 'p_std': 44, 'p_atr': 24, 'p_adx': 19, 'rsi_period': 56, 'ema1': 12, 'ema2': 44, 'slip_atr_k': 0.21882731361786129, 'slip_spread_k': 0.4269658380647741, 'spread_hl_frac': 0.010288689805117174, 'bb_std_mult': 0.7689807871004581, 'rsi_os': 41, 'rsi_ob': 80, 'vol_spike': 0.03311381907763988, 'adx_thresh': 13.637941460078267, 'atr_min_pct': 0.02552183520429966, 'atr_max_pct': 0.06431489886462943, 'tp_mult': 2.6411854005344306, 'tsl_mult': 0.5971390619100755, 'strategy': 'mean_reversion', 'time_stop': 255, 'use_sma': True, 'use_atr': True, 'use_adx': True, 'use_ema': False, 'use_spike': True, 'rsi_required': True, 'edge_k': 0.8347838088180473, 'edge_cap': 0.5890312138934515, 'bull_strategy': 'mean_reversion', 'bull_bb_std_mult': 1.4807029343084648, 'bull_rsi_os': 28, 'bull_rsi_ob': 91, 'bull_adx_thresh': 30.80302928731127, 'bull_atr_min_pct': 0.015386040033432856, 'bull_atr_max_pct': 0.13841491617299895, 'bull_tp_mult': 1.855060766483514, 'bull_tsl_mult': 0.19175241925253617, 'bull_time_stop': 181, 'bull_use_sma': False, 'bull_use_ema': False, 'bull_use_atr': False, 'bull_use_adx': False, 'bull_use_spike': False, 'bull_rsi_required': True, 'bear_strategy': 'mean_reversion', 'bear_bb_std_mult': 0.8211258333472766, 'bear_rsi_os': 39, 'bear_rsi_ob': 76, 'bear_adx_thresh': 23.05835637918101, 'bear_atr_min_pct': 0.016772358296707885, 'bear_atr_max_pct': 0.1354252843215899, 'bear_tp_mult': 1.6372277261959183, 'bear_tsl_mult': 0.45839524821355127, 'bear_time_stop': 84, 'bear_use_sma': False, 'bear_use_ema': False, 'bear_use_atr': True, 'bear_use_adx': True, 'bear_use_spike': True, 'bear_rsi_required': True, 'sideways_strategy': 'mean_reversion', 'sideways_bb_std_mult': 1.5689271440220385, 'sideways_rsi_os': 27, 'sideways_rsi_ob': 73, 'sideways_adx_thresh': 24.40591128687445, 'sideways_atr_min_pct': 0.02575522984222365, 'sideways_atr_max_pct': 0.08653248227682366, 'sideways_tp_mult': 2.6135671357481933, 'sideways_tsl_mult': 0.3909386292952992, 'sideways_time_stop': 42, 'sideways_use_sma': False, 'sideways_use_ema': False, 'sideways_use_atr': False, 'sideways_use_adx': False, 'sideways_use_spike': False, 'sideways_rsi_required': False}.
