[I 2025-08-30 20:51:33,168] Trial 35 finished with values: [-1000000000.0, 1000000000.0] and parameters: {'p_sma': 17, 'p_std': 15, 'p_atr': 24, 'p_adx': 19, 'rsi_period': 53, 'ema1': 5, 'ema2': 56, 'slip_atr_k': 0.15777379193976693, 'slip_spread_k': 0.4599873344596174, 'spread_hl_frac': 0.010074297744226583, 'bb_std_mult': 1.276417529373326, 'rsi_os': 43, 'rsi_ob': 79, 'vol_spike': 0.030729439806191857, 'adx_thresh': 7.659842051371189, 'atr_min_pct': 0.01968576625793997, 'atr_max_pct': 0.06454471580044266, 'tp_mult': 2.5421251896336434, 'tsl_mult': 0.322991592548071, 'strategy': 'mean_reversion', 'time_stop': 270, 'use_sma': True, 'use_atr': True, 'use_adx': True, 'use_ema': False, 'use_spike': True, 'rsi_required': True, 'edge_k': 0.22633351389217482, 'edge_cap': 0.8018431979330052, 'bull_strategy': 'mean_reversion', 'bull_bb_std_mult': 1.4557119516196664, 'bull_rsi_os': 24, 'bull_rsi_ob': 90, 'bull_adx_thresh': 23.366593235195467, 'bull_atr_min_pct': 0.017033439198452023, 'bull_atr_max_pct': 0.14661008192936315, 'bull_tp_mult': 1.8188470022933516, 'bull_tsl_mult': 0.20467228918407665, 'bull_time_stop': 175, 'bull_use_sma': False, 'bull_use_ema': False, 'bull_use_atr': False, 'bull_use_adx': False, 'bull_use_spike': False, 'bull_rsi_required': False, 'bear_strategy': 'mean_reversion', 'bear_bb_std_mult': 0.8905816211678985, 'bear_rsi_os': 5, 'bear_rsi_ob': 85, 'bear_adx_thresh': 22.400022026324, 'bear_atr_min_pct': 0.009525355928184202, 'bear_atr_max_pct': 0.08321992928724832, 'bear_tp_mult': 1.7490939107587251, 'bear_tsl_mult': 0.4958349347901553, 'bear_time_stop': 76, 'bear_use_sma': False, 'bear_use_ema': False, 'bear_use_atr': True, 'bear_use_adx': True, 'bear_use_spike': True, 'bear_rsi_required': True, 'sideways_strategy': 'mean_reversion', 'sideways_bb_std_mult': 1.4313457714356774, 'sideways_rsi_os': 17, 'sideways_rsi_ob': 67, 'sideways_adx_thresh': 24.367633337087568, 'sideways_atr_min_pct': 0.026991726794591997, 'sideways_atr_max_pct': 0.04293820146418505, 'sideways_tp_mult': 2.6249665232582498, 'sideways_tsl_mult': 0.3780640745672568, 'sideways_time_stop': 36, 'sideways_use_sma': False, 'sideways_use_ema': True, 'sideways_use_atr': False, 'sideways_use_adx': False, 'sideways_use_spike': False, 'sideways_rsi_required': False}.
[I 2025-08-30 20:51:33,930] Trial 37 finished with values: [-1000000000.0, 1000000000.0] and parameters: {'p_sma': 30, 'p_std': 10, 'p_atr': 25, 'p_adx': 20, 'rsi_period': 55, 'ema1': 22, 'ema2': 42, 'slip_atr_k': 0.19037357826056298, 'slip_spread_k': 0.44002361906992027, 'spread_hl_frac': 0.011676009589474099, 'bb_std_mult': 0.5097561560137682, 'rsi_os': 43, 'rsi_ob': 80, 'vol_spike': 0.1115309161750826, 'adx_thresh': 7.028299679993339, 'atr_min_pct': 0.02680490571735991, 'atr_max_pct': 0.04333946279825698, 'tp_mult': 2.3077854470170687, 'tsl_mult': 0.6122436484934578, 'strategy': 'mean_reversion', 'time_stop': 77, 'use_sma': True, 'use_atr': True, 'use_adx': True, 'use_ema': False, 'use_spike': True, 'rsi_required': True, 'edge_k': 0.20727598423367777, 'edge_cap': 0.5144262195986915, 'bull_strategy': 'mean_reversion', 'bull_bb_std_mult': 1.4368825299244936, 'bull_rsi_os': 23, 'bull_rsi_ob': 51, 'bull_adx_thresh': 18.17312152607213, 'bull_atr_min_pct': 0.008564001489648764, 'bull_atr_max_pct': 0.04079695825476224, 'bull_tp_mult': 2.4745276994544287, 'bull_tsl_mult': 0.011324543149418331, 'bull_time_stop': 252, 'bull_use_sma': False, 'bull_use_ema': False, 'bull_use_atr': False, 'bull_use_adx': False, 'bull_use_spike': False, 'bull_rsi_required': False, 'bear_strategy': 'mean_reversion', 'bear_bb_std_mult': 0.5117810110485598, 'bear_rsi_os': 34, 'bear_rsi_ob': 83, 'bear_adx_thresh': 23.265491239764167, 'bear_atr_min_pct': 0.010134512337846385, 'bear_atr_max_pct': 0.05093528753776101, 'bear_tp_mult': 1.5455596845796604, 'bear_tsl_mult': 0.2592459805656099, 'bear_time_stop': 89, 'bear_use_sma': True, 'bear_use_ema': False, 'bear_use_atr': True, 'bear_use_adx': True, 'bear_use_spike': True, 'bear_rsi_required': True, 'sideways_strategy': 'mean_reversion', 'sideways_bb_std_mult': 3.00622319373993, 'sideways_rsi_os': 27, 'sideways_rsi_ob': 74, 'sideways_adx_thresh': 18.68084185473126, 'sideways_atr_min_pct': 0.026939222336070826, 'sideways_atr_max_pct': 0.050133445276793705, 'sideways_tp_mult': 2.727971910970705, 'sideways_tsl_mult': 0.4157617849234355, 'sideways_time_stop': 81, 'sideways_use_sma': False, 'sideways_use_ema': True, 'sideways_use_atr': False, 'sideways_use_adx': False, 'sideways_use_spike': False, 'sideways_rsi_required': False}.
[I 2025-08-30 20:51:55,645] Trial 38 finished with values: [-1000000000.0, 1000000000.0] and parameters: {'p_sma': 31, 'p_std': 17, 'p_atr': 16, 'p_adx': 21, 'rsi_period': 54, 'ema1': 5, 'ema2': 42, 'slip_atr_k': 0.19098067064013166, 'slip_spread_k': 0.4469996732180803, 'spread_hl_frac': 0.010513967324913382, 'bb_std_mult': 0.5782039068948646, 'rsi_os': 42, 'rsi_ob': 78, 'vol_spike': 0.10514600941325047, 'adx_thresh': 7.133230108280625, 'atr_min_pct': 0.029950577981241698, 'atr_max_pct': 0.03420993348761828, 'tp_mult': 1.793618508020309, 'tsl_mult': 0.37260738696678414, 'strategy': 'mean_reversion', 'time_stop': 168, 'use_sma': True, 'use_atr': False, 'use_adx': False, 'use_ema': False, 'use_spike': False, 'rsi_required': True, 'edge_k': 1.8323604452698847, 'edge_cap': 0.4961028671306448, 'bull_strategy': 'breakout', 'bull_bb_std_mult': 1.5336897104092935, 'bull_rsi_os': 23, 'bull_rsi_ob': 72, 'bull_adx_thresh': 18.634695828929466, 'bull_atr_min_pct': 0.008728456093306714, 'bull_atr_max_pct': 0.08520494595123602, 'bull_tp_mult': 2.46056948241613, 'bull_tsl_mult': 0.009905146888308625, 'bull_time_stop': 260, 'bull_use_sma': False, 'bull_use_ema': False, 'bull_use_atr': True, 'bull_use_adx': False, 'bull_use_spike': True, 'bull_rsi_required': False, 'bear_strategy': 'breakout', 'bear_bb_std_mult': 0.6173979267508888, 'bear_rsi_os': 40, 'bear_rsi_ob': 70, 'bear_adx_thresh': 23.41219655931969, 'bear_atr_min_pct': 0.010094118667441455, 'bear_atr_max_pct': 0.05463558554881798, 'bear_tp_mult': 1.6403193590568348, 'bear_tsl_mult': 0.2922208442225426, 'bear_time_stop': 88, 'bear_use_sma': True, 'bear_use_ema': False, 'bear_use_atr': False, 'bear_use_adx': True, 'bear_use_spike': True, 'bear_rsi_required': True, 'sideways_strategy': 'mean_reversion', 'sideways_bb_std_mult': 3.0845966920498475, 'sideways_rsi_os': 39, 'sideways_rsi_ob': 69, 'sideways_adx_thresh': 24.726569177886994, 'sideways_atr_min_pct': 0.02619151545394998, 'sideways_atr_max_pct': 0.04923655745808042, 'sideways_tp_mult': 2.74843492172506, 'sideways_tsl_mult': 0.43820207196287253, 'sideways_time_stop': 76, 'sideways_use_sma': False, 'sideways_use_ema': True, 'sideways_use_atr': False, 'sideways_use_adx': False, 'sideways_use_spike': False, 'sideways_rsi_required': False}.
[I 2025-08-30 20:52:08,642] Trial 39 finished with values: [-1000000000.0, 1000000000.0] and parameters: {'p_sma': 30, 'p_std': 14, 'p_atr': 16, 'p_adx': 22, 'rsi_period': 50, 'ema1': 21, 'ema2': 47, 'slip_atr_k': 0.19237348693374184, 'slip_spread_k': 0.23381313159688638, 'spread_hl_frac': 0.013022707437466457, 'bb_std_mult': 2.201037360076755, 'rsi_os': 47, 'rsi_ob': 79, 'vol_spike': 0.2937002573578112, 'adx_thresh': 6.742253390014191, 'atr_min_pct': 0.02981376514881121, 'atr_max_pct': 0.04220641228873446, 'tp_mult': 2.3647598855963143, 'tsl_mult': 0.3659426925977623, 'strategy': 'breakout', 'time_stop': 167, 'use_sma': True, 'use_atr': False, 'use_adx': False, 'use_ema': False, 'use_spike': False, 'rsi_required': False, 'edge_k': 1.9915114888570669, 'edge_cap': 0.9783937715022363, 'bull_strategy': 'breakout', 'bull_bb_std_mult': 3.59724759427435, 'bull_rsi_os': 24, 'bull_rsi_ob': 50, 'bull_adx_thresh': 18.146154454668636, 'bull_atr_min_pct': 0.024488481473836813, 'bull_atr_max_pct': 0.0874266483049009, 'bull_tp_mult': 2.404094324331586, 'bull_tsl_mult': 0.6079982396856307, 'bull_time_stop': 257, 'bull_use_sma': False, 'bull_use_ema': False, 'bull_use_atr': True, 'bull_use_adx': False, 'bull_use_spike': True, 'bull_rsi_required': False, 'bear_strategy': 'breakout', 'bear_bb_std_mult': 0.5819765643781669, 'bear_rsi_os': 34, 'bear_rsi_ob': 84, 'bear_adx_thresh': 7.79220640995857, 'bear_atr_min_pct': 0.024783445819372193, 'bear_atr_max_pct': 0.0516330094703117, 'bear_tp_mult': 1.8515200238661893, 'bear_tsl_mult': 0.272072308310103, 'bear_time_stop': 184, 'bear_use_sma': True, 'bear_use_ema': False, 'bear_use_atr': False, 'bear_use_adx': False, 'bear_use_spike': False, 'bear_rsi_required': False, 'sideways_strategy': 'mean_reversion', 'sideways_bb_std_mult': 3.0397142635791514, 'sideways_rsi_os': 41, 'sideways_rsi_ob': 67, 'sideways_adx_thresh': 18.281718137051165, 'sideways_atr_min_pct': 0.024618230384217524, 'sideways_atr_max_pct': 0.05010756500174377, 'sideways_tp_mult': 2.7402847247582613, 'sideways_tsl_mult': 0.4498465929208766, 'sideways_time_stop': 176, 'sideways_use_sma': True, 'sideways_use_ema': True, 'sideways_use_atr': False, 'sideways_use_adx': False, 'sideways_use_spike': False, 'sideways_rsi_required': False}.
[I 2025-08-30 20:52:08,950] Trial 40 finished with values: [-1000000000.0, 1000000000.0] and parameters: {'p_sma': 39, 'p_std': 39, 'p_atr': 16, 'p_adx': 22, 'rsi_period': 50, 'ema1': 21, 'ema2': 41, 'slip_atr_k': 0.18841135469654502, 'slip_spread_k': 0.22489493005999825, 'spread_hl_frac': 0.013246308260021294, 'bb_std_mult': 2.230274538784742, 'rsi_os': 47, 'rsi_ob': 73, 'vol_spike': 0.10330836073399469, 'adx_thresh': 17.4063769057044, 'atr_min_pct': 0.008400051037111804, 'atr_max_pct': 0.041500129592977116, 'tp_mult': 1.8153111255605596, 'tsl_mult': 0.3869423087345061, 'strategy': 'breakout', 'time_stop': 172, 'use_sma': True, 'use_atr': False, 'use_adx': False, 'use_ema': True, 'use_spike': False, 'rsi_required': False, 'edge_k': 1.8687656379192021, 'edge_cap': 0.5188431981351582, 'bull_strategy': 'breakout', 'bull_bb_std_mult': 3.3701947058711474, 'bull_rsi_os': 23, 'bull_rsi_ob': 51, 'bull_adx_thresh': 18.4879865294522, 'bull_atr_min_pct': 0.008861432018860159, 'bull_atr_max_pct': 0.0875258676172435, 'bull_tp_mult': 1.3123059674389168, 'bull_tsl_mult': 0.47033867220325176, 'bull_time_stop': 257, 'bull_use_sma': False, 'bull_use_ema': False, 'bull_use_atr': True, 'bull_use_adx': False, 'bull_use_spike': True, 'bull_rsi_required': True, 'bear_strategy': 'breakout', 'bear_bb_std_mult': 0.5058417755382649, 'bear_rsi_os': 34, 'bear_rsi_ob': 89, 'bear_adx_thresh': 34.929940968430934, 'bear_atr_min_pct': 0.011380773706601337, 'bear_atr_max_pct': 0.052139360661210124, 'bear_tp_mult': 2.164696942788099, 'bear_tsl_mult': 0.25423590154877884, 'bear_time_stop': 99, 'bear_use_sma': True, 'bear_use_ema': False, 'bear_use_atr': False, 'bear_use_adx': False, 'bear_use_spike': False, 'bear_rsi_required': False, 'sideways_strategy': 'breakout', 'sideways_bb_std_mult': 3.156646668749377, 'sideways_rsi_os': 19, 'sideways_rsi_ob': 83, 'sideways_adx_thresh': 27.8564289278928, 'sideways_atr_min_pct': 0.02447270745026934, 'sideways_atr_max_pct': 0.04853119538624384, 'sideways_tp_mult': 2.7818329415655216, 'sideways_tsl_mult': 0.45161140359077334, 'sideways_time_stop': 87, 'sideways_use_sma': True, 'sideways_use_ema': True, 'sideways_use_atr': False, 'sideways_use_adx': False, 'sideways_use_spike': False, 'sideways_rsi_required': False}.
[I 2025-08-30 20:52:10,175] Trial 41 finished with values: [-1000000000.0, 1000000000.0] and parameters: {'p_sma': 39, 'p_std': 40, 'p_atr': 16, 'p_adx': 22, 'rsi_period': 29, 'ema1': 13, 'ema2': 46, 'slip_atr_k': 0.13631392505589918, 'slip_spread_k': 0.26379956438600793, 'spread_hl_frac': 0.024521500701617335, 'bb_std_mult': 2.2679693969961723, 'rsi_os': 49, 'rsi_ob': 74, 'vol_spike': 0.23793518205778547, 'adx_thresh': 17.291283510041758, 'atr_min_pct': 0.007551296635061839, 'atr_max_pct': 0.075954482989242, 'tp_mult': 1.7673296881459633, 'tsl_mult': 0.36713346481770454, 'strategy': 'breakout', 'time_stop': 36, 'use_sma': True, 'use_atr': False, 'use_adx': False, 'use_ema': True, 'use_spike': False, 'rsi_required': False, 'edge_k': 1.9158252580218318, 'edge_cap': 0.3231307012789544, 'bull_strategy': 'breakout', 'bull_bb_std_mult': 3.480246810432088, 'bull_rsi_os': 29, 'bull_rsi_ob': 73, 'bull_adx_thresh': 25.255557291986495, 'bull_atr_min_pct': 0.0017626730877006223, 'bull_atr_max_pct': 0.1226347496038026, 'bull_tp_mult': 1.0476545251413323, 'bull_tsl_mult': 0.46383548812016845, 'bull_time_stop': 131, 'bull_use_sma': True, 'bull_use_ema': False, 'bull_use_atr': True, 'bull_use_adx': False, 'bull_use_spike': True, 'bull_rsi_required': True, 'bear_strategy': 'breakout', 'bear_bb_std_mult': 2.4858796802973235, 'bear_rsi_os': 34, 'bear_rsi_ob': 72, 'bear_adx_thresh': 9.793865471148687, 'bear_atr_min_pct': 0.02432627679418231, 'bear_atr_max_pct': 0.0706753641889292, 'bear_tp_mult': 1.0699733454451321, 'bear_tsl_mult': 0.2172911397116702, 'bear_time_stop': 24, 'bear_use_sma': True, 'bear_use_ema': True, 'bear_use_atr': False, 'bear_use_adx': False, 'bear_use_spike': False, 'bear_rsi_required': False, 'sideways_strategy': 'breakout', 'sideways_bb_std_mult': 3.0941874915024106, 'sideways_rsi_os': 42, 'sideways_rsi_ob': 86, 'sideways_adx_thresh': 15.870021066953079, 'sideways_atr_min_pct': 0.024136884608136035, 'sideways_atr_max_pct': 0.12672045435404658, 'sideways_tp_mult': 1.4723274806444926, 'sideways_tsl_mult': 0.4477263524502453, 'sideways_time_stop': 293, 'sideways_use_sma': True, 'sideways_use_ema': False, 'sideways_use_atr': False, 'sideways_use_adx': False, 'sideways_use_spike': True, 'sideways_rsi_required': False}.
[I 2025-08-30 20:52:29,697] Trial 42 finished with values: [-1000000000.0, 1000000000.0] and parameters: {'p_sma': 39, 'p_std': 26, 'p_atr': 19, 'p_adx': 16, 'rsi_period': 29, 'ema1': 24, 'ema2': 10, 'slip_atr_k': 0.23773939511918457, 'slip_spread_k': 0.27626198932071405, 'spread_hl_frac': 0.01487974008073745, 'bb_std_mult': 2.2212244974610713, 'rsi_os': 47, 'rsi_ob': 73, 'vol_spike': 0.19108238039786676, 'adx_thresh': 16.299147320368697, 'atr_min_pct': 0.008445525885502462, 'atr_max_pct': 0.07364917238503044, 'tp_mult': 1.9298890332627985, 'tsl_mult': 0.4082610688836292, 'strategy': 'breakout', 'time_stop': 36, 'use_sma': False, 'use_atr': False, 'use_adx': False, 'use_ema': True, 'use_spike': False, 'rsi_required': False, 'edge_k': 0.5440542490587144, 'edge_cap': 0.08609780699779696, 'bull_strategy': 'breakout', 'bull_bb_std_mult': 3.43993949549518, 'bull_rsi_os': 15, 'bull_rsi_ob': 61, 'bull_adx_thresh': 14.251584721128113, 'bull_atr_min_pct': 0.025407747063885096, 'bull_atr_max_pct': 0.028886431283647943, 'bull_tp_mult': 1.3151796276612098, 'bull_tsl_mult': 0.6026919780240172, 'bull_time_stop': 215, 'bull_use_sma': True, 'bull_use_ema': False, 'bull_use_atr': True, 'bull_use_adx': True, 'bull_use_spike': True, 'bull_rsi_required': True, 'bear_strategy': 'breakout', 'bear_bb_std_mult': 1.4743805889933461, 'bear_rsi_os': 35, 'bear_rsi_ob': 91, 'bear_adx_thresh': 7.720382890554609, 'bear_atr_min_pct': 0.029917648430528705, 'bear_atr_max_pct': 0.06996265234730517, 'bear_tp_mult': 2.2037622811828994, 'bear_tsl_mult': 0.22998751600775302, 'bear_time_stop': 187, 'bear_use_sma': True, 'bear_use_ema': True, 'bear_use_atr': False, 'bear_use_adx': False, 'bear_use_spike': False, 'bear_rsi_required': False, 'sideways_strategy': 'breakout', 'sideways_bb_std_mult': 2.8636560076269553, 'sideways_rsi_os': 36, 'sideways_rsi_ob': 45, 'sideways_adx_thresh': 27.79126894420008, 'sideways_atr_min_pct': 0.024235051654229418, 'sideways_atr_max_pct': 0.06911859829863222, 'sideways_tp_mult': 1.4781295121601157, 'sideways_tsl_mult': 0.21649598906983983, 'sideways_time_stop': 276, 'sideways_use_sma': True, 'sideways_use_ema': False, 'sideways_use_atr': False, 'sideways_use_adx': True, 'sideways_use_spike': True, 'sideways_rsi_required': True}.
[I 2025-08-30 20:52:42,750] Trial 44 finished with values: [-1000000000.0, 1000000000.0] and parameters: {'p_sma': 53, 'p_std': 26, 'p_atr': 28, 'p_adx': 16, 'rsi_period': 29, 'ema1': 13, 'ema2': 31, 'slip_atr_k': 0.23724905547132483, 'slip_spread_k': 0.36750565391465445, 'spread_hl_frac': 0.003317955096146012, 'bb_std_mult': 3.0598360740306494, 'rsi_os': 13, 'rsi_ob': 74, 'vol_spike': 0.24716038945295724, 'adx_thresh': 8.723260927000908, 'atr_min_pct': 0.002036426202645736, 'atr_max_pct': 0.022662705516224235, 'tp_mult': 1.1739344079891758, 'tsl_mult': 0.12854273351191314, 'strategy': 'breakout', 'time_stop': 142, 'use_sma': False, 'use_atr': True, 'use_adx': True, 'use_ema': True, 'use_spike': True, 'rsi_required': True, 'edge_k': 0.5478511284307248, 'edge_cap': 0.3379679459916398, 'bull_strategy': 'breakout', 'bull_bb_std_mult': 3.163499724418986, 'bull_rsi_os': 14, 'bull_rsi_ob': 67, 'bull_adx_thresh': 14.501799853342078, 'bull_atr_min_pct': 0.001729305612357753, 'bull_atr_max_pct': 0.10859697238496069, 'bull_tp_mult': 1.1956593435901959, 'bull_tsl_mult': 0.85520363410973, 'bull_time_stop': 128, 'bull_use_sma': True, 'bull_use_ema': False, 'bull_use_atr': False, 'bull_use_adx': True, 'bull_use_spike': False, 'bull_rsi_required': True, 'bear_strategy': 'breakout', 'bear_bb_std_mult': 2.4672492705185243, 'bear_rsi_os': 42, 'bear_rsi_ob': 72, 'bear_adx_thresh': 12.266070658082883, 'bear_atr_min_pct': 0.0076565825548777725, 'bear_atr_max_pct': 0.07381109910170987, 'bear_tp_mult': 1.1068323960356343, 'bear_tsl_mult': 0.20404555697921967, 'bear_time_stop': 107, 'bear_use_sma': True, 'bear_use_ema': True, 'bear_use_atr': False, 'bear_use_adx': False, 'bear_use_spike': True, 'bear_rsi_required': False, 'sideways_strategy': 'breakout', 'sideways_bb_std_mult': 3.4290560570267754, 'sideways_rsi_os': 8, 'sideways_rsi_ob': 46, 'sideways_adx_thresh': 16.714015409020984, 'sideways_atr_min_pct': 0.02142692636205242, 'sideways_atr_max_pct': 0.12797799194794898, 'sideways_tp_mult': 2.5004336134714507, 'sideways_tsl_mult': 0.10057248277615788, 'sideways_time_stop': 227, 'sideways_use_sma': False, 'sideways_use_ema': False, 'sideways_use_atr': True, 'sideways_use_adx': True, 'sideways_use_spike': True, 'sideways_rsi_required': True}.
[I 2025-08-30 20:52:43,260] Trial 43 finished with values: [-1000000000.0, 1000000000.0] and parameters: {'p_sma': 40, 'p_std': 24, 'p_atr': 18, 'p_adx': 11, 'rsi_period': 30, 'ema1': 26, 'ema2': 11, 'slip_atr_k': 0.23651130256381547, 'slip_spread_k': 0.3885411140617901, 'spread_hl_frac': 0.03921141934175753, 'bb_std_mult': 3.074122446799096, 'rsi_os': 24, 'rsi_ob': 72, 'vol_spike': 0.20314547640249805, 'adx_thresh': 9.58223683318764, 'atr_min_pct': 0.007381789509623566, 'atr_max_pct': 0.07722617489622284, 'tp_mult': 1.183460591526576, 'tsl_mult': 0.997259398977421, 'strategy': 'breakout', 'time_stop': 41, 'use_sma': False, 'use_atr': False, 'use_adx': True, 'use_ema': True, 'use_spike': True, 'rsi_required': False, 'edge_k': 0.5523118525929402, 'edge_cap': 0.05391464166212845, 'bull_strategy': 'breakout', 'bull_bb_std_mult': 2.8620505595946324, 'bull_rsi_os': 15, 'bull_rsi_ob': 65, 'bull_adx_thresh': 26.37818140773733, 'bull_atr_min_pct': 0.02581979668919277, 'bull_atr_max_pct': 0.11358258845641626, 'bull_tp_mult': 1.2525704490681644, 'bull_tsl_mult': 0.44663474238383905, 'bull_time_stop': 136, 'bull_use_sma': True, 'bull_use_ema': False, 'bull_use_atr': False, 'bull_use_adx': True, 'bull_use_spike': True, 'bull_rsi_required': True, 'bear_strategy': 'breakout', 'bear_bb_std_mult': 1.4592492429711656, 'bear_rsi_os': 48, 'bear_rsi_ob': 89, 'bear_adx_thresh': 11.848987637595922, 'bear_atr_min_pct': 0.012107025283160943, 'bear_atr_max_pct': 0.0110381011538883, 'bear_tp_mult': 1.0132206104510892, 'bear_tsl_mult': 0.20255344118825575, 'bear_time_stop': 104, 'bear_use_sma': True, 'bear_use_ema': True, 'bear_use_atr': False, 'bear_use_adx': False, 'bear_use_spike': False, 'bear_rsi_required': False, 'sideways_strategy': 'breakout', 'sideways_bb_std_mult': 3.4097878135028252, 'sideways_rsi_os': 19, 'sideways_rsi_ob': 84, 'sideways_adx_thresh': 28.075935675528786, 'sideways_atr_min_pct': 0.010840129877342, 'sideways_atr_max_pct': 0.1322348317120344, 'sideways_tp_mult': 2.512666858725454, 'sideways_tsl_mult': 0.09570444926409716, 'sideways_time_stop': 297, 'sideways_use_sma': True, 'sideways_use_ema': False, 'sideways_use_atr': True, 'sideways_use_adx': True, 'sideways_use_spike': True, 'sideways_rsi_required': True}.
