[I 2025-08-30 21:28:43,599] Trial 324 finished with values: [-0.016556119492291188, 0.016568167408352295] and parameters: {'p_sma': 12, 'p_std': 19, 'p_atr': 15, 'p_adx': 30, 'rsi_period': 14, 'ema1': 22, 'ema2': 57, 'slip_atr_k': 0.042660498520094514, 'slip_spread_k': 0.27936354439270916, 'spread_hl_frac': 0.0471733181284343, 'bb_std_mult': 1.6348968363686223, 'rsi_os': 10, 'rsi_ob': 52, 'vol_spike': 0.0947859404032503, 'adx_thresh': 31.809729470642587, 'atr_min_pct': 0.020202201652260027, 'atr_max_pct': 0.09177655534152328, 'tp_mult': 1.6941043926662713, 'tsl_mult': 0.19611604482916123, 'strategy': 'mean_reversion', 'time_stop': 106, 'use_sma': False, 'use_atr': True, 'use_adx': True, 'use_ema': True, 'use_spike': True, 'rsi_required': True, 'edge_k': 0.11307421999508593, 'edge_cap': 0.6435256226222243, 'bull_strategy': 'breakout', 'bull_bb_std_mult': 3.2966059358293434, 'bull_rsi_os': 40, 'bull_rsi_ob': 81, 'bull_adx_thresh': 15.177017746069021, 'bull_atr_min_pct': 0.00047479108954301104, 'bull_atr_max_pct': 0.06865028966083292, 'bull_tp_mult': 2.3406631015904757, 'bull_tsl_mult': 0.8291705854902872, 'bull_time_stop': 48, 'bull_use_sma': True, 'bull_use_ema': False, 'bull_use_atr': False, 'bull_use_adx': True, 'bull_use_spike': True, 'bull_rsi_required': True, 'bear_strategy': 'mean_reversion', 'bear_bb_std_mult': 2.730035955151287, 'bear_rsi_os': 19, 'bear_rsi_ob': 68, 'bear_adx_thresh': 15.214953284120362, 'bear_atr_min_pct': 0.02266006134939895, 'bear_atr_max_pct': 0.06399887622361439, 'bear_tp_mult': 2.517925916436943, 'bear_tsl_mult': 0.439395425594916, 'bear_time_stop': 236, 'bear_use_sma': True, 'bear_use_ema': True, 'bear_use_atr': False, 'bear_use_adx': True, 'bear_use_spike': True, 'bear_rsi_required': True, 'sideways_strategy': 'breakout', 'sideways_bb_std_mult': 0.6732533823555806, 'sideways_rsi_os': 38, 'sideways_rsi_ob': 72, 'sideways_adx_thresh': 18.12402008699985, 'sideways_atr_min_pct': 0.01974536383000986, 'sideways_atr_max_pct': 0.09752566452590594, 'sideways_tp_mult': 2.952066895036993, 'sideways_tsl_mult': 0.46031088763823996, 'sideways_time_stop': 208, 'sideways_use_sma': False, 'sideways_use_ema': True, 'sideways_use_atr': True, 'sideways_use_adx': False, 'sideways_use_spike': False, 'sideways_rsi_required': True}.
[I 2025-08-30 21:28:44,477] Trial 325 finished with values: [-1000000000.0, 1000000000.0] and parameters: {'p_sma': 29, 'p_std': 52, 'p_atr': 10, 'p_adx': 30, 'rsi_period': 14, 'ema1': 22, 'ema2': 45, 'slip_atr_k': 0.04200725672861863, 'slip_spread_k': 0.5122169441631478, 'spread_hl_frac': 0.00477814354080154, 'bb_std_mult': 1.6338327856293646, 'rsi_os': 6, 'rsi_ob': 88, 'vol_spike': 0.12797723935541552, 'adx_thresh': 7.4111022446828265, 'atr_min_pct': 0.020129469931508253, 'atr_max_pct': 0.09260805282211676, 'tp_mult': 1.7049029077090014, 'tsl_mult': 0.8683779503264308, 'strategy': 'mean_reversion', 'time_stop': 105, 'use_sma': False, 'use_atr': True, 'use_adx': True, 'use_ema': True, 'use_spike': True, 'rsi_required': True, 'edge_k': 0.8204480550236399, 'edge_cap': 0.9687347289436758, 'bull_strategy': 'breakout', 'bull_bb_std_mult': 3.4064202734106717, 'bull_rsi_os': 18, 'bull_rsi_ob': 81, 'bull_adx_thresh': 31.703561806132534, 'bull_atr_min_pct': 0.002503141924997747, 'bull_atr_max_pct': 0.049680773647808214, 'bull_tp_mult': 1.2137114752969012, 'bull_tsl_mult': 0.5542213435530311, 'bull_time_stop': 159, 'bull_use_sma': True, 'bull_use_ema': False, 'bull_use_atr': False, 'bull_use_adx': True, 'bull_use_spike': True, 'bull_rsi_required': True, 'bear_strategy': 'mean_reversion', 'bear_bb_std_mult': 2.7413220685628903, 'bear_rsi_os': 40, 'bear_rsi_ob': 91, 'bear_adx_thresh': 15.302800364528528, 'bear_atr_min_pct': 0.009553331340042954, 'bear_atr_max_pct': 0.12689027954889165, 'bear_tp_mult': 1.073819082774122, 'bear_tsl_mult': 0.44257467475892087, 'bear_time_stop': 109, 'bear_use_sma': True, 'bear_use_ema': True, 'bear_use_atr': False, 'bear_use_adx': True, 'bear_use_spike': True, 'bear_rsi_required': True, 'sideways_strategy': 'breakout', 'sideways_bb_std_mult': 1.4400968191171128, 'sideways_rsi_os': 38, 'sideways_rsi_ob': 93, 'sideways_adx_thresh': 27.63509321586468, 'sideways_atr_min_pct': 0.013646864581317008, 'sideways_atr_max_pct': 0.11415541925512476, 'sideways_tp_mult': 2.008705799477898, 'sideways_tsl_mult': 0.4571737523952581, 'sideways_time_stop': 171, 'sideways_use_sma': False, 'sideways_use_ema': True, 'sideways_use_atr': True, 'sideways_use_adx': False, 'sideways_use_spike': False, 'sideways_rsi_required': True}.
[I 2025-08-30 21:28:44,973] Trial 326 finished with values: [-0.06859814164619549, 0.06851407772190395] and parameters: {'p_sma': 29, 'p_std': 18, 'p_atr': 15, 'p_adx': 30, 'rsi_period': 13, 'ema1': 22, 'ema2': 45, 'slip_atr_k': 0.04342869222588566, 'slip_spread_k': 0.5629167963032123, 'spread_hl_frac': 0.004744581994699568, 'bb_std_mult': 1.623834362879683, 'rsi_os': 10, 'rsi_ob': 52, 'vol_spike': 0.09214854693649886, 'adx_thresh': 31.339350681221706, 'atr_min_pct': 0.003957202427592664, 'atr_max_pct': 0.09263477049200824, 'tp_mult': 1.0210793548528048, 'tsl_mult': 0.4618117262771902, 'strategy': 'mean_reversion', 'time_stop': 256, 'use_sma': False, 'use_atr': True, 'use_adx': True, 'use_ema': True, 'use_spike': True, 'rsi_required': True, 'edge_k': 0.5838712079877607, 'edge_cap': 0.6423711342226549, 'bull_strategy': 'breakout', 'bull_bb_std_mult': 3.407328395306914, 'bull_rsi_os': 40, 'bull_rsi_ob': 83, 'bull_adx_thresh': 16.996493760388706, 'bull_atr_min_pct': 0.0005131056508110936, 'bull_atr_max_pct': 0.06831217185350186, 'bull_tp_mult': 2.131532286115431, 'bull_tsl_mult': 0.5573481332215282, 'bull_time_stop': 155, 'bull_use_sma': True, 'bull_use_ema': False, 'bull_use_atr': False, 'bull_use_adx': True, 'bull_use_spike': True, 'bull_rsi_required': True, 'bear_strategy': 'mean_reversion', 'bear_bb_std_mult': 2.7619196498277003, 'bear_rsi_os': 37, 'bear_rsi_ob': 91, 'bear_adx_thresh': 15.387558846894326, 'bear_atr_min_pct': 0.01591834880144312, 'bear_atr_max_pct': 0.012178619979055613, 'bear_tp_mult': 1.144489646490774, 'bear_tsl_mult': 0.08869611794736881, 'bear_time_stop': 107, 'bear_use_sma': True, 'bear_use_ema': False, 'bear_use_atr': False, 'bear_use_adx': True, 'bear_use_spike': True, 'bear_rsi_required': True, 'sideways_strategy': 'breakout', 'sideways_bb_std_mult': 2.289537630484793, 'sideways_rsi_os': 38, 'sideways_rsi_ob': 95, 'sideways_adx_thresh': 27.597266456097323, 'sideways_atr_min_pct': 0.0009803879519143608, 'sideways_atr_max_pct': 0.09617963826319476, 'sideways_tp_mult': 1.3533737003916375, 'sideways_tsl_mult': 0.4783699330905115, 'sideways_time_stop': 179, 'sideways_use_sma': False, 'sideways_use_ema': True, 'sideways_use_atr': False, 'sideways_use_adx': False, 'sideways_use_spike': False, 'sideways_rsi_required': True}.
[I 2025-08-30 21:28:45,078] Trial 327 finished with values: [-1000000000.0, 1000000000.0] and parameters: {'p_sma': 6, 'p_std': 34, 'p_atr': 15, 'p_adx': 30, 'rsi_period': 54, 'ema1': 15, 'ema2': 45, 'slip_atr_k': 0.038418473404828415, 'slip_spread_k': 0.5556305567874334, 'spread_hl_frac': 0.026931476518205415, 'bb_std_mult': 1.3031003680736581, 'rsi_os': 31, 'rsi_ob': 69, 'vol_spike': 0.12727827947438708, 'adx_thresh': 31.755103115501967, 'atr_min_pct': 0.02913504680277841, 'atr_max_pct': 0.0913765606211917, 'tp_mult': 1.701692039130153, 'tsl_mult': 0.8641277575737477, 'strategy': 'mean_reversion', 'time_stop': 14, 'use_sma': False, 'use_atr': True, 'use_adx': True, 'use_ema': True, 'use_spike': True, 'rsi_required': True, 'edge_k': 0.5638207722872588, 'edge_cap': 0.6252377948285976, 'bull_strategy': 'breakout', 'bull_bb_std_mult': 2.1707413597370113, 'bull_rsi_os': 14, 'bull_rsi_ob': 78, 'bull_adx_thresh': 16.931748254997196, 'bull_atr_min_pct': 0.0004888370918103204, 'bull_atr_max_pct': 0.058216087525698845, 'bull_tp_mult': 2.1995520573927494, 'bull_tsl_mult': 0.3001587932669634, 'bull_time_stop': 290, 'bull_use_sma': True, 'bull_use_ema': False, 'bull_use_atr': False, 'bull_use_adx': True, 'bull_use_spike': True, 'bull_rsi_required': True, 'bear_strategy': 'mean_reversion', 'bear_bb_std_mult': 2.7368729302408994, 'bear_rsi_os': 37, 'bear_rsi_ob': 87, 'bear_adx_thresh': 16.07938636545863, 'bear_atr_min_pct': 0.015853164746955486, 'bear_atr_max_pct': 0.010078004096273444, 'bear_tp_mult': 1.0814172750363116, 'bear_tsl_mult': 0.43780685028349636, 'bear_time_stop': 94, 'bear_use_sma': True, 'bear_use_ema': False, 'bear_use_atr': False, 'bear_use_adx': True, 'bear_use_spike': True, 'bear_rsi_required': True, 'sideways_strategy': 'breakout', 'sideways_bb_std_mult': 1.0317345776619191, 'sideways_rsi_os': 37, 'sideways_rsi_ob': 95, 'sideways_adx_thresh': 11.790210629695915, 'sideways_atr_min_pct': 0.014445597306229982, 'sideways_atr_max_pct': 0.14151132646585074, 'sideways_tp_mult': 1.990772450694963, 'sideways_tsl_mult': 0.9998639898505537, 'sideways_time_stop': 270, 'sideways_use_sma': False, 'sideways_use_ema': True, 'sideways_use_atr': False, 'sideways_use_adx': False, 'sideways_use_spike': False, 'sideways_rsi_required': True}.
[I 2025-08-30 21:28:45,960] Trial 330 finished with values: [-1000000000.0, 1000000000.0] and parameters: {'p_sma': 16, 'p_std': 35, 'p_atr': 16, 'p_adx': 7, 'rsi_period': 33, 'ema1': 8, 'ema2': 44, 'slip_atr_k': 0.0349641050571653, 'slip_spread_k': 0.08205379888814862, 'spread_hl_frac': 0.048181637294048445, 'bb_std_mult': 1.7778489731172498, 'rsi_os': 11, 'rsi_ob': 45, 'vol_spike': 0.2876413800336229, 'adx_thresh': 29.9934456615814, 'atr_min_pct': 0.01940684277651032, 'atr_max_pct': 0.14706094949805415, 'tp_mult': 1.5307575270395852, 'tsl_mult': 0.8901101184481357, 'strategy': 'mean_reversion', 'time_stop': 294, 'use_sma': False, 'use_atr': True, 'use_adx': True, 'use_ema': True, 'use_spike': True, 'rsi_required': True, 'edge_k': 0.11124406894449168, 'edge_cap': 0.6183758982700244, 'bull_strategy': 'breakout', 'bull_bb_std_mult': 2.5878663861813394, 'bull_rsi_os': 14, 'bull_rsi_ob': 45, 'bull_adx_thresh': 33.537931801150606, 'bull_atr_min_pct': 0.003555112907794925, 'bull_atr_max_pct': 0.05657626287664161, 'bull_tp_mult': 2.2585956457705554, 'bull_tsl_mult': 0.8194127287515495, 'bull_time_stop': 292, 'bull_use_sma': True, 'bull_use_ema': False, 'bull_use_atr': False, 'bull_use_adx': True, 'bull_use_spike': True, 'bull_rsi_required': True, 'bear_strategy': 'mean_reversion', 'bear_bb_std_mult': 2.640802776458315, 'bear_rsi_os': 19, 'bear_rsi_ob': 49, 'bear_adx_thresh': 10.053961113087466, 'bear_atr_min_pct': 0.020958942140062, 'bear_atr_max_pct': 0.018552851289967927, 'bear_tp_mult': 2.061743178090806, 'bear_tsl_mult': 0.46992952744299377, 'bear_time_stop': 82, 'bear_use_sma': True, 'bear_use_ema': False, 'bear_use_atr': False, 'bear_use_adx': True, 'bear_use_spike': True, 'bear_rsi_required': True, 'sideways_strategy': 'breakout', 'sideways_bb_std_mult': 1.6020030882944902, 'sideways_rsi_os': 20, 'sideways_rsi_ob': 93, 'sideways_adx_thresh': 26.31862131684194, 'sideways_atr_min_pct': 0.02829092843045837, 'sideways_atr_max_pct': 0.0968787099404517, 'sideways_tp_mult': 2.0586831438406903, 'sideways_tsl_mult': 0.3928178957036744, 'sideways_time_stop': 251, 'sideways_use_sma': False, 'sideways_use_ema': True, 'sideways_use_atr': True, 'sideways_use_adx': False, 'sideways_use_spike': False, 'sideways_rsi_required': True}.
[I 2025-08-30 21:28:46,052] Trial 328 finished with values: [-1000000000.0, 1000000000.0] and parameters: {'p_sma': 54, 'p_std': 52, 'p_atr': 15, 'p_adx': 16, 'rsi_period': 80, 'ema1': 15, 'ema2': 45, 'slip_atr_k': 0.03846146774356048, 'slip_spread_k': 0.5555493278663256, 'spread_hl_frac': 0.046705940095371795, 'bb_std_mult': 1.8100496741023333, 'rsi_os': 10, 'rsi_ob': 49, 'vol_spike': 0.13062667526084826, 'adx_thresh': 31.528043961669766, 'atr_min_pct': 0.011480856900157379, 'atr_max_pct': 0.09146083724596776, 'tp_mult': 1.683347431513311, 'tsl_mult': 0.8673922849766245, 'strategy': 'mean_reversion', 'time_stop': 259, 'use_sma': False, 'use_atr': True, 'use_adx': True, 'use_ema': True, 'use_spike': True, 'rsi_required': True, 'edge_k': 0.5971700001992769, 'edge_cap': 0.6446310494205681, 'bull_strategy': 'breakout', 'bull_bb_std_mult': 2.532962368288135, 'bull_rsi_os': 14, 'bull_rsi_ob': 63, 'bull_adx_thresh': 14.144312116539547, 'bull_atr_min_pct': 0.0291986237569532, 'bull_atr_max_pct': 0.05671637590994669, 'bull_tp_mult': 2.131147313492556, 'bull_tsl_mult': 0.8247344534880823, 'bull_time_stop': 36, 'bull_use_sma': True, 'bull_use_ema': False, 'bull_use_atr': False, 'bull_use_adx': True, 'bull_use_spike': True, 'bull_rsi_required': True, 'bear_strategy': 'mean_reversion', 'bear_bb_std_mult': 2.3081661455698517, 'bear_rsi_os': 20, 'bear_rsi_ob': 68, 'bear_adx_thresh': 31.67572352274123, 'bear_atr_min_pct': 0.015905723038221357, 'bear_atr_max_pct': 0.12694807591419216, 'bear_tp_mult': 2.9043624921705646, 'bear_tsl_mult': 0.441329546120332, 'bear_time_stop': 108, 'bear_use_sma': True, 'bear_use_ema': False, 'bear_use_atr': False, 'bear_use_adx': True, 'bear_use_spike': True, 'bear_rsi_required': True, 'sideways_strategy': 'breakout', 'sideways_bb_std_mult': 1.4487300736701114, 'sideways_rsi_os': 38, 'sideways_rsi_ob': 93, 'sideways_adx_thresh': 27.63062469727472, 'sideways_atr_min_pct': 0.014335302295167536, 'sideways_atr_max_pct': 0.09641700567282091, 'sideways_tp_mult': 2.996747800282808, 'sideways_tsl_mult': 0.917823159160644, 'sideways_time_stop': 272, 'sideways_use_sma': False, 'sideways_use_ema': True, 'sideways_use_atr': True, 'sideways_use_adx': False, 'sideways_use_spike': False, 'sideways_rsi_required': True}.
[I 2025-08-30 21:29:16,710] Trial 331 finished with values: [-1000000000.0, 1000000000.0] and parameters: {'p_sma': 12, 'p_std': 34, 'p_atr': 16, 'p_adx': 14, 'rsi_period': 19, 'ema1': 21, 'ema2': 34, 'slip_atr_k': 0.03536672439773932, 'slip_spread_k': 0.2420706037083959, 'spread_hl_frac': 0.04685222832930395, 'bb_std_mult': 1.8000065566200485, 'rsi_os': 11, 'rsi_ob': 62, 'vol_spike': 0.28517646941602776, 'adx_thresh': 29.95284712978784, 'atr_min_pct': 0.019347682809952926, 'atr_max_pct': 0.11356514388458108, 'tp_mult': 2.142386303227623, 'tsl_mult': 0.21570951555500417, 'strategy': 'mean_reversion', 'time_stop': 107, 'use_sma': False, 'use_atr': False, 'use_adx': True, 'use_ema': True, 'use_spike': True, 'rsi_required': True, 'edge_k': 0.14540524560375212, 'edge_cap': 0.5970290755835787, 'bull_strategy': 'breakout', 'bull_bb_std_mult': 3.3812298259597333, 'bull_rsi_os': 52, 'bull_rsi_ob': 63, 'bull_adx_thresh': 15.02600592554826, 'bull_atr_min_pct': 0.007213283153072692, 'bull_atr_max_pct': 0.09612846453996009, 'bull_tp_mult': 2.2498140118663312, 'bull_tsl_mult': 0.3229952555761721, 'bull_time_stop': 40, 'bull_use_sma': True, 'bull_use_ema': False, 'bull_use_atr': False, 'bull_use_adx': True, 'bull_use_spike': True, 'bull_rsi_required': True, 'bear_strategy': 'mean_reversion', 'bear_bb_std_mult': 1.681558995808923, 'bear_rsi_os': 35, 'bear_rsi_ob': 60, 'bear_adx_thresh': 17.25793322937771, 'bear_atr_min_pct': 0.022545148295910027, 'bear_atr_max_pct': 0.04693234318508935, 'bear_tp_mult': 2.1994052232740526, 'bear_tsl_mult': 0.6870427405595014, 'bear_time_stop': 166, 'bear_use_sma': True, 'bear_use_ema': False, 'bear_use_atr': False, 'bear_use_adx': True, 'bear_use_spike': True, 'bear_rsi_required': True, 'sideways_strategy': 'breakout', 'sideways_bb_std_mult': 1.6707703282474364, 'sideways_rsi_os': 10, 'sideways_rsi_ob': 93, 'sideways_adx_thresh': 18.129192779324725, 'sideways_atr_min_pct': 0.014636469464323724, 'sideways_atr_max_pct': 0.09609661809011606, 'sideways_tp_mult': 2.0660105674486364, 'sideways_tsl_mult': 0.6758196646823533, 'sideways_time_stop': 237, 'sideways_use_sma': False, 'sideways_use_ema': True, 'sideways_use_atr': True, 'sideways_use_adx': False, 'sideways_use_spike': False, 'sideways_rsi_required': True}.
[I 2025-08-30 21:29:16,737] Trial 329 finished with values: [-0.016592769617282843, 0.016529149663114744] and parameters: {'p_sma': 30, 'p_std': 35, 'p_atr': 15, 'p_adx': 30, 'rsi_period': 66, 'ema1': 20, 'ema2': 26, 'slip_atr_k': 0.03625918522336832, 'slip_spread_k': 0.5578082885297799, 'spread_hl_frac': 0.0075554800231853615, 'bb_std_mult': 1.7024243030780968, 'rsi_os': 10, 'rsi_ob': 79, 'vol_spike': 0.09393948041859618, 'adx_thresh': 30.129127889565574, 'atr_min_pct': 0.019716982985606875, 'atr_max_pct': 0.14770802671138317, 'tp_mult': 1.537188597415498, 'tsl_mult': 0.887920842848535, 'strategy': 'mean_reversion', 'time_stop': 281, 'use_sma': False, 'use_atr': True, 'use_adx': True, 'use_ema': True, 'use_spike': True, 'rsi_required': True, 'edge_k': 0.5673623239022363, 'edge_cap': 0.6434566783083666, 'bull_strategy': 'breakout', 'bull_bb_std_mult': 1.1927022866519361, 'bull_rsi_os': 16, 'bull_rsi_ob': 63, 'bull_adx_thresh': 14.150398032632284, 'bull_atr_min_pct': 8.279187615681726e-05, 'bull_atr_max_pct': 0.056841520071062385, 'bull_tp_mult': 2.1473559552445844, 'bull_tsl_mult': 0.3555465228277401, 'bull_time_stop': 289, 'bull_use_sma': True, 'bull_use_ema': False, 'bull_use_atr': False, 'bull_use_adx': True, 'bull_use_spike': True, 'bull_rsi_required': True, 'bear_strategy': 'mean_reversion', 'bear_bb_std_mult': 2.455305487629721, 'bear_rsi_os': 37, 'bear_rsi_ob': 87, 'bear_adx_thresh': 13.281028011465663, 'bear_atr_min_pct': 0.01571157735928239, 'bear_atr_max_pct': 0.042211497025184154, 'bear_tp_mult': 2.0741270819783066, 'bear_tsl_mult': 0.4675419293059713, 'bear_time_stop': 182, 'bear_use_sma': True, 'bear_use_ema': False, 'bear_use_atr': False, 'bear_use_adx': True, 'bear_use_spike': True, 'bear_rsi_required': True, 'sideways_strategy': 'breakout', 'sideways_bb_std_mult': 0.6641946184708112, 'sideways_rsi_os': 10, 'sideways_rsi_ob': 95, 'sideways_adx_thresh': 24.91882034888058, 'sideways_atr_min_pct': 0.028134332017083916, 'sideways_atr_max_pct': 0.09646912391661157, 'sideways_tp_mult': 2.0598327004395767, 'sideways_tsl_mult': 0.9171681465388658, 'sideways_time_stop': 252, 'sideways_use_sma': False, 'sideways_use_ema': True, 'sideways_use_atr': False, 'sideways_use_adx': False, 'sideways_use_spike': False, 'sideways_rsi_required': True}.
[I 2025-08-30 21:29:19,381] Trial 332 finished with values: [-0.02077232347339819, 0.02069517688085671] and parameters: {'p_sma': 54, 'p_std': 30, 'p_atr': 20, 'p_adx': 16, 'rsi_period': 19, 'ema1': 21, 'ema2': 11, 'slip_atr_k': 0.13625007026015046, 'slip_spread_k': 0.6515206787121106, 'spread_hl_frac': 0.04684266180477662, 'bb_std_mult': 1.4751247192993047, 'rsi_os': 10, 'rsi_ob': 80, 'vol_spike': 0.2841660961248289, 'adx_thresh': 29.143915640574747, 'atr_min_pct': 0.009225463116864193, 'atr_max_pct': 0.09633223628085347, 'tp_mult': 1.6646223304742278, 'tsl_mult': 0.21036355453581296, 'strategy': 'mean_reversion', 'time_stop': 105, 'use_sma': False, 'use_atr': False, 'use_adx': True, 'use_ema': True, 'use_spike': True, 'rsi_required': False, 'edge_k': 0.9652967756305892, 'edge_cap': 0.6720272902448581, 'bull_strategy': 'breakout', 'bull_bb_std_mult': 1.1750286536067933, 'bull_rsi_os': 16, 'bull_rsi_ob': 58, 'bull_adx_thresh': 15.105641416438887, 'bull_atr_min_pct': 1.0251271277142752e-05, 'bull_atr_max_pct': 0.1267409985004745, 'bull_tp_mult': 1.2755231780199017, 'bull_tsl_mult': 0.31637750330964654, 'bull_time_stop': 235, 'bull_use_sma': True, 'bull_use_ema': False, 'bull_use_atr': False, 'bull_use_adx': True, 'bull_use_spike': True, 'bull_rsi_required': True, 'bear_strategy': 'mean_reversion', 'bear_bb_std_mult': 1.6878587471398827, 'bear_rsi_os': 39, 'bear_rsi_ob': 53, 'bear_adx_thresh': 17.233137776955957, 'bear_atr_min_pct': 0.014438095915827676, 'bear_atr_max_pct': 0.04627261588681333, 'bear_tp_mult': 2.5321550744141486, 'bear_tsl_mult': 0.6619020703917161, 'bear_time_stop': 61, 'bear_use_sma': True, 'bear_use_ema': False, 'bear_use_atr': False, 'bear_use_adx': False, 'bear_use_spike': False, 'bear_rsi_required': True, 'sideways_strategy': 'breakout', 'sideways_bb_std_mult': 1.2995890558716652, 'sideways_rsi_os': 40, 'sideways_rsi_ob': 84, 'sideways_adx_thresh': 18.174489243723354, 'sideways_atr_min_pct': 0.014771054770009447, 'sideways_atr_max_pct': 0.09502415196312995, 'sideways_tp_mult': 2.99003485033028, 'sideways_tsl_mult': 0.4911741278449909, 'sideways_time_stop': 205, 'sideways_use_sma': True, 'sideways_use_ema': True, 'sideways_use_atr': True, 'sideways_use_adx': False, 'sideways_use_spike': True, 'sideways_rsi_required': True}.
