[I 2025-08-30 21:30:29,403] Trial 344 finished with values: [-1000000000.0, 1000000000.0] and parameters: {'p_sma': 59, 'p_std': 22, 'p_atr': 26, 'p_adx': 30, 'rsi_period': 38, 'ema1': 12, 'ema2': 42, 'slip_atr_k': 0.12386182943108964, 'slip_spread_k': 0.525585373307824, 'spread_hl_frac': 0.005856930495019526, 'bb_std_mult': 1.353445746729757, 'rsi_os': 54, 'rsi_ob': 79, 'vol_spike': 0.2942437781505812, 'adx_thresh': 30.617687732290467, 'atr_min_pct': 0.01602621080352388, 'atr_max_pct': 0.0822513724616899, 'tp_mult': 1.5379820996954376, 'tsl_mult': 0.9051224283557426, 'strategy': 'mean_reversion', 'time_stop': 103, 'use_sma': False, 'use_atr': True, 'use_adx': True, 'use_ema': True, 'use_spike': True, 'rsi_required': True, 'edge_k': 0.042052030584413536, 'edge_cap': 0.3280254277964081, 'bull_strategy': 'breakout', 'bull_bb_std_mult': 0.753471620750729, 'bull_rsi_os': 26, 'bull_rsi_ob': 75, 'bull_adx_thresh': 14.248324512468262, 'bull_atr_min_pct': 0.01383341402065615, 'bull_atr_max_pct': 0.05599415474364815, 'bull_tp_mult': 2.304960631353504, 'bull_tsl_mult': 0.36231887865163387, 'bull_time_stop': 294, 'bull_use_sma': True, 'bull_use_ema': False, 'bull_use_atr': False, 'bull_use_adx': True, 'bull_use_spike': True, 'bull_rsi_required': True, 'bear_strategy': 'mean_reversion', 'bear_bb_std_mult': 0.9016849274000625, 'bear_rsi_os': 40, 'bear_rsi_ob': 51, 'bear_adx_thresh': 22.24580586498256, 'bear_atr_min_pct': 0.005383931690868043, 'bear_atr_max_pct': 0.10152223340150969, 'bear_tp_mult': 2.264091290851154, 'bear_tsl_mult': 0.5124440206350819, 'bear_time_stop': 128, 'bear_use_sma': True, 'bear_use_ema': True, 'bear_use_atr': False, 'bear_use_adx': True, 'bear_use_spike': True, 'bear_rsi_required': True, 'sideways_strategy': 'breakout', 'sideways_bb_std_mult': 1.5808882926204912, 'sideways_rsi_os': 35, 'sideways_rsi_ob': 86, 'sideways_adx_thresh': 28.388980504368362, 'sideways_atr_min_pct': 0.016640082743469696, 'sideways_atr_max_pct': 0.05150065021574169, 'sideways_tp_mult': 2.022681100308499, 'sideways_tsl_mult': 0.5095558088181295, 'sideways_time_stop': 261, 'sideways_use_sma': False, 'sideways_use_ema': True, 'sideways_use_atr': True, 'sideways_use_adx': False, 'sideways_use_spike': False, 'sideways_rsi_required': True}.
[I 2025-08-30 21:30:29,480] Trial 343 finished with values: [-1000000000.0, 1000000000.0] and parameters: {'p_sma': 59, 'p_std': 56, 'p_atr': 26, 'p_adx': 23, 'rsi_period': 45, 'ema1': 22, 'ema2': 31, 'slip_atr_k': 0.10818563432712061, 'slip_spread_k': 0.6157510603306188, 'spread_hl_frac': 0.006248102781707762, 'bb_std_mult': 2.8016984567361995, 'rsi_os': 54, 'rsi_ob': 79, 'vol_spike': 0.2928827317849551, 'adx_thresh': 26.157109995955583, 'atr_min_pct': 0.013478055869150704, 'atr_max_pct': 0.08263375871729303, 'tp_mult': 1.558698591062885, 'tsl_mult': 0.035875643414708835, 'strategy': 'mean_reversion', 'time_stop': 105, 'use_sma': False, 'use_atr': True, 'use_adx': True, 'use_ema': True, 'use_spike': True, 'rsi_required': True, 'edge_k': 0.6221385817882954, 'edge_cap': 0.6282802569137871, 'bull_strategy': 'breakout', 'bull_bb_std_mult': 1.7204106080163353, 'bull_rsi_os': 26, 'bull_rsi_ob': 67, 'bull_adx_thresh': 14.150171590951429, 'bull_atr_min_pct': 5.211140153087829e-05, 'bull_atr_max_pct': 0.020158189472583174, 'bull_tp_mult': 2.320430434083194, 'bull_tsl_mult': 0.35188043315310114, 'bull_time_stop': 142, 'bull_use_sma': True, 'bull_use_ema': False, 'bull_use_atr': False, 'bull_use_adx': True, 'bull_use_spike': True, 'bull_rsi_required': True, 'bear_strategy': 'mean_reversion', 'bear_bb_std_mult': 2.9049079132190174, 'bear_rsi_os': 44, 'bear_rsi_ob': 51, 'bear_adx_thresh': 16.661602171541173, 'bear_atr_min_pct': 0.015382173892775316, 'bear_atr_max_pct': 0.012900639553569154, 'bear_tp_mult': 2.8907682788596953, 'bear_tsl_mult': 0.4213627104446183, 'bear_time_stop': 131, 'bear_use_sma': True, 'bear_use_ema': True, 'bear_use_atr': False, 'bear_use_adx': True, 'bear_use_spike': True, 'bear_rsi_required': True, 'sideways_strategy': 'breakout', 'sideways_bb_std_mult': 0.6474020115499919, 'sideways_rsi_os': 5, 'sideways_rsi_ob': 91, 'sideways_adx_thresh': 26.861432114831192, 'sideways_atr_min_pct': 0.016776031622232977, 'sideways_atr_max_pct': 0.09883515611121631, 'sideways_tp_mult': 1.927502745601963, 'sideways_tsl_mult': 0.5000961266529034, 'sideways_time_stop': 206, 'sideways_use_sma': False, 'sideways_use_ema': True, 'sideways_use_atr': True, 'sideways_use_adx': False, 'sideways_use_spike': False, 'sideways_rsi_required': True}.
[I 2025-08-30 21:31:00,441] Trial 342 finished with values: [-1000000000.0, 1000000000.0] and parameters: {'p_sma': 28, 'p_std': 35, 'p_atr': 16, 'p_adx': 25, 'rsi_period': 66, 'ema1': 21, 'ema2': 22, 'slip_atr_k': 0.04727839917398596, 'slip_spread_k': 0.5255536779955684, 'spread_hl_frac': 0.006250887064790541, 'bb_std_mult': 2.7889857390128556, 'rsi_os': 19, 'rsi_ob': 60, 'vol_spike': 0.18334006244317147, 'adx_thresh': 30.507097877975493, 'atr_min_pct': 0.01482879449360928, 'atr_max_pct': 0.08293369696524176, 'tp_mult': 1.5349455053425538, 'tsl_mult': 0.9066115531806106, 'strategy': 'mean_reversion', 'time_stop': 104, 'use_sma': False, 'use_atr': False, 'use_adx': True, 'use_ema': False, 'use_spike': True, 'rsi_required': True, 'edge_k': 0.6284472159411142, 'edge_cap': 0.6217828310932408, 'bull_strategy': 'mean_reversion', 'bull_bb_std_mult': 0.7608352604691122, 'bull_rsi_os': 54, 'bull_rsi_ob': 75, 'bull_adx_thresh': 26.077983616197926, 'bull_atr_min_pct': 0.010718016003521506, 'bull_atr_max_pct': 0.02616446065842363, 'bull_tp_mult': 2.293250887480988, 'bull_tsl_mult': 0.47150042864675396, 'bull_time_stop': 236, 'bull_use_sma': True, 'bull_use_ema': False, 'bull_use_atr': False, 'bull_use_adx': False, 'bull_use_spike': True, 'bull_rsi_required': True, 'bear_strategy': 'mean_reversion', 'bear_bb_std_mult': 3.0123964954572027, 'bear_rsi_os': 11, 'bear_rsi_ob': 58, 'bear_adx_thresh': 16.58193862753013, 'bear_atr_min_pct': 0.015479958622992535, 'bear_atr_max_pct': 0.02189316180162903, 'bear_tp_mult': 2.886744548325943, 'bear_tsl_mult': 0.590748069259952, 'bear_time_stop': 191, 'bear_use_sma': True, 'bear_use_ema': False, 'bear_use_atr': False, 'bear_use_adx': True, 'bear_use_spike': True, 'bear_rsi_required': True, 'sideways_strategy': 'breakout', 'sideways_bb_std_mult': 0.6516085489714156, 'sideways_rsi_os': 43, 'sideways_rsi_ob': 51, 'sideways_adx_thresh': 28.41815311217172, 'sideways_atr_min_pct': 0.015631313599003244, 'sideways_atr_max_pct': 0.07429386406041369, 'sideways_tp_mult': 2.110633488477409, 'sideways_tsl_mult': 0.5251112795478748, 'sideways_time_stop': 206, 'sideways_use_sma': False, 'sideways_use_ema': True, 'sideways_use_atr': True, 'sideways_use_adx': False, 'sideways_use_spike': False, 'sideways_rsi_required': True}.
[I 2025-08-30 21:31:00,995] Trial 345 finished with values: [-1000000000.0, 1000000000.0] and parameters: {'p_sma': 34, 'p_std': 56, 'p_atr': 8, 'p_adx': 24, 'rsi_period': 45, 'ema1': 22, 'ema2': 41, 'slip_atr_k': 0.12445774009540564, 'slip_spread_k': 0.6264180138919602, 'spread_hl_frac': 0.006216379397226415, 'bb_std_mult': 2.7890429242650736, 'rsi_os': 19, 'rsi_ob': 83, 'vol_spike': 0.2938290418833067, 'adx_thresh': 30.4448591021072, 'atr_min_pct': 0.014809765349174941, 'atr_max_pct': 0.026261641396633825, 'tp_mult': 1.1147508597082432, 'tsl_mult': 0.9068411728583085, 'strategy': 'mean_reversion', 'time_stop': 106, 'use_sma': False, 'use_atr': True, 'use_adx': True, 'use_ema': True, 'use_spike': True, 'rsi_required': True, 'edge_k': 0.6431728385003863, 'edge_cap': 0.6204785199472996, 'bull_strategy': 'breakout', 'bull_bb_std_mult': 3.418892940587884, 'bull_rsi_os': 46, 'bull_rsi_ob': 67, 'bull_adx_thresh': 14.167050219159709, 'bull_atr_min_pct': 0.012689517821780362, 'bull_atr_max_pct': 0.05548568657053851, 'bull_tp_mult': 1.4364661622150248, 'bull_tsl_mult': 0.3882535524176764, 'bull_time_stop': 143, 'bull_use_sma': True, 'bull_use_ema': False, 'bull_use_atr': False, 'bull_use_adx': True, 'bull_use_spike': True, 'bull_rsi_required': True, 'bear_strategy': 'mean_reversion', 'bear_bb_std_mult': 2.999193178240704, 'bear_rsi_os': 40, 'bear_rsi_ob': 85, 'bear_adx_thresh': 16.821885904599757, 'bear_atr_min_pct': 0.013871916686239306, 'bear_atr_max_pct': 0.021775569015450774, 'bear_tp_mult': 2.889089439623793, 'bear_tsl_mult': 0.7328291503555853, 'bear_time_stop': 129, 'bear_use_sma': True, 'bear_use_ema': True, 'bear_use_atr': False, 'bear_use_adx': True, 'bear_use_spike': True, 'bear_rsi_required': True, 'sideways_strategy': 'breakout', 'sideways_bb_std_mult': 0.674940018628541, 'sideways_rsi_os': 43, 'sideways_rsi_ob': 91, 'sideways_adx_thresh': 28.402970876383804, 'sideways_atr_min_pct': 0.013956560432286672, 'sideways_atr_max_pct': 0.1003892382956957, 'sideways_tp_mult': 1.1892424862420978, 'sideways_tsl_mult': 0.49473874584799915, 'sideways_time_stop': 253, 'sideways_use_sma': False, 'sideways_use_ema': True, 'sideways_use_atr': True, 'sideways_use_adx': False, 'sideways_use_spike': False, 'sideways_rsi_required': True}.
[I 2025-08-30 21:31:03,104] Trial 346 finished with values: [-1000000000.0, 1000000000.0] and parameters: {'p_sma': 29, 'p_std': 19, 'p_atr': 14, 'p_adx': 26, 'rsi_period': 21, 'ema1': 22, 'ema2': 41, 'slip_atr_k': 0.016930651673583222, 'slip_spread_k': 0.5498156085259275, 'spread_hl_frac': 0.006146822121763618, 'bb_std_mult': 2.797759948540649, 'rsi_os': 11, 'rsi_ob': 83, 'vol_spike': 0.2994979516582039, 'adx_thresh': 30.356782517278372, 'atr_min_pct': 0.027003526601739974, 'atr_max_pct': 0.08982176133161508, 'tp_mult': 1.5852668374390966, 'tsl_mult': 0.23600775727847345, 'strategy': 'mean_reversion', 'time_stop': 110, 'use_sma': False, 'use_atr': True, 'use_adx': True, 'use_ema': True, 'use_spike': True, 'rsi_required': True, 'edge_k': 0.4499807697221867, 'edge_cap': 0.18587117418375254, 'bull_strategy': 'breakout', 'bull_bb_std_mult': 3.4249292077647313, 'bull_rsi_os': 46, 'bull_rsi_ob': 71, 'bull_adx_thresh': 15.519724108223102, 'bull_atr_min_pct': 0.021472685420387987, 'bull_atr_max_pct': 0.1342562258191604, 'bull_tp_mult': 2.203746049516757, 'bull_tsl_mult': 0.4446495288313022, 'bull_time_stop': 141, 'bull_use_sma': True, 'bull_use_ema': False, 'bull_use_atr': False, 'bull_use_adx': True, 'bull_use_spike': True, 'bull_rsi_required': True, 'bear_strategy': 'mean_reversion', 'bear_bb_std_mult': 1.2637142627175308, 'bear_rsi_os': 36, 'bear_rsi_ob': 54, 'bear_adx_thresh': 15.818616383554891, 'bear_atr_min_pct': 0.0153416996397828, 'bear_atr_max_pct': 0.020931672591801113, 'bear_tp_mult': 2.886665931320186, 'bear_tsl_mult': 0.16027208506130053, 'bear_time_stop': 193, 'bear_use_sma': True, 'bear_use_ema': False, 'bear_use_atr': False, 'bear_use_adx': True, 'bear_use_spike': True, 'bear_rsi_required': True, 'sideways_strategy': 'mean_reversion', 'sideways_bb_std_mult': 0.667180140292355, 'sideways_rsi_os': 54, 'sideways_rsi_ob': 92, 'sideways_adx_thresh': 27.081294829794302, 'sideways_atr_min_pct': 0.013814969509175119, 'sideways_atr_max_pct': 0.07417453663417968, 'sideways_tp_mult': 1.1901865812421506, 'sideways_tsl_mult': 0.47063457045774776, 'sideways_time_stop': 211, 'sideways_use_sma': False, 'sideways_use_ema': True, 'sideways_use_atr': True, 'sideways_use_adx': False, 'sideways_use_spike': False, 'sideways_rsi_required': True}.
[I 2025-08-30 21:31:03,713] Trial 347 finished with values: [-1000000000.0, 1000000000.0] and parameters: {'p_sma': 45, 'p_std': 47, 'p_atr': 11, 'p_adx': 30, 'rsi_period': 22, 'ema1': 22, 'ema2': 22, 'slip_atr_k': 0.1813946910383152, 'slip_spread_k': 0.5516634644883655, 'spread_hl_frac': 0.00945999789977686, 'bb_std_mult': 1.586478155820028, 'rsi_os': 11, 'rsi_ob': 83, 'vol_spike': 0.28417268821556696, 'adx_thresh': 30.214770082716292, 'atr_min_pct': 0.024650879819205433, 'atr_max_pct': 0.026253920980535916, 'tp_mult': 1.5960472421523373, 'tsl_mult': 0.6329359329581852, 'strategy': 'mean_reversion', 'time_stop': 112, 'use_sma': False, 'use_atr': True, 'use_adx': True, 'use_ema': True, 'use_spike': True, 'rsi_required': True, 'edge_k': 0.747434623641432, 'edge_cap': 0.6183955110810446, 'bull_strategy': 'breakout', 'bull_bb_std_mult': 3.428040259798172, 'bull_rsi_os': 42, 'bull_rsi_ob': 71, 'bull_adx_thresh': 15.422100372169934, 'bull_atr_min_pct': 0.0009346311011809658, 'bull_atr_max_pct': 0.0611470337006228, 'bull_tp_mult': 1.2744582752641938, 'bull_tsl_mult': 0.3876130371173141, 'bull_time_stop': 59, 'bull_use_sma': True, 'bull_use_ema': False, 'bull_use_atr': False, 'bull_use_adx': True, 'bull_use_spike': True, 'bull_rsi_required': True, 'bear_strategy': 'mean_reversion', 'bear_bb_std_mult': 2.040775614495717, 'bear_rsi_os': 38, 'bear_rsi_ob': 47, 'bear_adx_thresh': 15.830343222964654, 'bear_atr_min_pct': 0.012684875019932616, 'bear_atr_max_pct': 0.022460301262252222, 'bear_tp_mult': 2.9346051682777747, 'bear_tsl_mult': 0.7622600253998569, 'bear_time_stop': 70, 'bear_use_sma': True, 'bear_use_ema': False, 'bear_use_atr': False, 'bear_use_adx': True, 'bear_use_spike': True, 'bear_rsi_required': True, 'sideways_strategy': 'mean_reversion', 'sideways_bb_std_mult': 1.513714751766114, 'sideways_rsi_os': 32, 'sideways_rsi_ob': 51, 'sideways_adx_thresh': 13.642224430978025, 'sideways_atr_min_pct': 0.013940536266089565, 'sideways_atr_max_pct': 0.10079154809956983, 'sideways_tp_mult': 2.1989593591067216, 'sideways_tsl_mult': 0.4671171329415375, 'sideways_time_stop': 253, 'sideways_use_sma': False, 'sideways_use_ema': True, 'sideways_use_atr': True, 'sideways_use_adx': False, 'sideways_use_spike': False, 'sideways_rsi_required': True}.
[I 2025-08-30 21:31:44,286] Trial 348 finished with values: [-1000000000.0, 1000000000.0] and parameters: {'p_sma': 45, 'p_std': 47, 'p_atr': 14, 'p_adx': 26, 'rsi_period': 21, 'ema1': 22, 'ema2': 46, 'slip_atr_k': 0.018153819894242047, 'slip_spread_k': 0.5526390847025687, 'spread_hl_frac': 0.014926241294354513, 'bb_std_mult': 3.3502672752921514, 'rsi_os': 12, 'rsi_ob': 81, 'vol_spike': 0.014541201483718458, 'adx_thresh': 31.140819016746146, 'atr_min_pct': 0.02679736128548658, 'atr_max_pct': 0.08970437757276445, 'tp_mult': 1.6011271725267937, 'tsl_mult': 0.8868059883249316, 'strategy': 'mean_reversion', 'time_stop': 112, 'use_sma': False, 'use_atr': True, 'use_adx': False, 'use_ema': True, 'use_spike': False, 'rsi_required': True, 'edge_k': 0.7164608838861206, 'edge_cap': 0.5944134222298911, 'bull_strategy': 'breakout', 'bull_bb_std_mult': 3.410456114189529, 'bull_rsi_os': 42, 'bull_rsi_ob': 47, 'bull_adx_thresh': 5.756000633195713, 'bull_atr_min_pct': 0.00550430415719959, 'bull_atr_max_pct': 0.06111508843824326, 'bull_tp_mult': 1.8154541340941166, 'bull_tsl_mult': 0.3959966884444895, 'bull_time_stop': 47, 'bull_use_sma': True, 'bull_use_ema': False, 'bull_use_atr': False, 'bull_use_adx': True, 'bull_use_spike': True, 'bull_rsi_required': False, 'bear_strategy': 'breakout', 'bear_bb_std_mult': 2.5213697161420865, 'bear_rsi_os': 34, 'bear_rsi_ob': 54, 'bear_adx_thresh': 15.817780901618692, 'bear_atr_min_pct': 0.013629233496482887, 'bear_atr_max_pct': 0.016406552698714456, 'bear_tp_mult': 2.126729841717508, 'bear_tsl_mult': 0.48569057340638105, 'bear_time_stop': 181, 'bear_use_sma': True, 'bear_use_ema': False, 'bear_use_atr': True, 'bear_use_adx': True, 'bear_use_spike': True, 'bear_rsi_required': False, 'sideways_strategy': 'mean_reversion', 'sideways_bb_std_mult': 1.51899243638316, 'sideways_rsi_os': 39, 'sideways_rsi_ob': 92, 'sideways_adx_thresh': 25.916312730680815, 'sideways_atr_min_pct': 0.01403034015605641, 'sideways_atr_max_pct': 0.10069804869874732, 'sideways_tp_mult': 2.075908321477023, 'sideways_tsl_mult': 0.13464826590675555, 'sideways_time_stop': 253, 'sideways_use_sma': False, 'sideways_use_ema': True, 'sideways_use_atr': True, 'sideways_use_adx': False, 'sideways_use_spike': False, 'sideways_rsi_required': True}.
[I 2025-08-30 21:31:46,109] Trial 350 finished with values: [-1000000000.0, 1000000000.0] and parameters: {'p_sma': 36, 'p_std': 50, 'p_atr': 22, 'p_adx': 12, 'rsi_period': 17, 'ema1': 14, 'ema2': 44, 'slip_atr_k': 0.17909860341433687, 'slip_spread_k': 0.6043619069371066, 'spread_hl_frac': 0.009455751107021154, 'bb_std_mult': 1.5893581173467624, 'rsi_os': 29, 'rsi_ob': 55, 'vol_spike': 0.022166111749640977, 'adx_thresh': 8.96235400571938, 'atr_min_pct': 0.0264051021483264, 'atr_max_pct': 0.06949344610634203, 'tp_mult': 1.6038038360343587, 'tsl_mult': 0.5205145313178478, 'strategy': 'breakout', 'time_stop': 94, 'use_sma': False, 'use_atr': True, 'use_adx': False, 'use_ema': True, 'use_spike': False, 'rsi_required': False, 'edge_k': 0.7502591260485895, 'edge_cap': 0.2906472700473969, 'bull_strategy': 'breakout', 'bull_bb_std_mult': 3.354496456563213, 'bull_rsi_os': 20, 'bull_rsi_ob': 47, 'bull_adx_thresh': 23.720360066266586, 'bull_atr_min_pct': 0.004070675694131803, 'bull_atr_max_pct': 0.05980974585354568, 'bull_tp_mult': 2.3488763056651454, 'bull_tsl_mult': 0.9653826427686238, 'bull_time_stop': 48, 'bull_use_sma': False, 'bull_use_ema': False, 'bull_use_atr': True, 'bull_use_adx': True, 'bull_use_spike': True, 'bull_rsi_required': False, 'bear_strategy': 'breakout', 'bear_bb_std_mult': 2.521031902770116, 'bear_rsi_os': 29, 'bear_rsi_ob': 49, 'bear_adx_thresh': 19.011713238728813, 'bear_atr_min_pct': 0.016461422162948647, 'bear_atr_max_pct': 0.14424538566036443, 'bear_tp_mult': 2.953585140110631, 'bear_tsl_mult': 0.48448741060306183, 'bear_time_stop': 260, 'bear_use_sma': True, 'bear_use_ema': False, 'bear_use_atr': True, 'bear_use_adx': False, 'bear_use_spike': False, 'bear_rsi_required': False, 'sideways_strategy': 'mean_reversion', 'sideways_bb_std_mult': 1.5186075049314292, 'sideways_rsi_os': 32, 'sideways_rsi_ob': 94, 'sideways_adx_thresh': 26.090320897162435, 'sideways_atr_min_pct': 0.01593879928907148, 'sideways_atr_max_pct': 0.12725360073532904, 'sideways_tp_mult': 2.1717972019167586, 'sideways_tsl_mult': 0.12628556247553901, 'sideways_time_stop': 244, 'sideways_use_sma': True, 'sideways_use_ema': True, 'sideways_use_atr': True, 'sideways_use_adx': False, 'sideways_use_spike': True, 'sideways_rsi_required': True}.
[I 2025-08-30 21:31:46,429] Trial 349 finished with values: [-1000000000.0, 1000000000.0] and parameters: {'p_sma': 45, 'p_std': 43, 'p_atr': 15, 'p_adx': 30, 'rsi_period': 21, 'ema1': 21, 'ema2': 44, 'slip_atr_k': 0.181084515541233, 'slip_spread_k': 0.5576934460783286, 'spread_hl_frac': 0.00415254774808577, 'bb_std_mult': 2.9913817642228855, 'rsi_os': 12, 'rsi_ob': 85, 'vol_spike': 0.2842335937172141, 'adx_thresh': 6.7187576483229865, 'atr_min_pct': 0.025240439159897203, 'atr_max_pct': 0.08928130721118697, 'tp_mult': 1.597866388089403, 'tsl_mult': 0.3432985583986017, 'strategy': 'breakout', 'time_stop': 113, 'use_sma': False, 'use_atr': True, 'use_adx': False, 'use_ema': True, 'use_spike': False, 'rsi_required': False, 'edge_k': 0.752419868839846, 'edge_cap': 0.6534284131052689, 'bull_strategy': 'breakout', 'bull_bb_std_mult': 2.914570531912694, 'bull_rsi_os': 19, 'bull_rsi_ob': 71, 'bull_adx_thresh': 15.371822355433382, 'bull_atr_min_pct': 0.016703417126487638, 'bull_atr_max_pct': 0.1347566297039099, 'bull_tp_mult': 1.4945641924721609, 'bull_tsl_mult': 0.44055983455100006, 'bull_time_stop': 290, 'bull_use_sma': True, 'bull_use_ema': False, 'bull_use_atr': True, 'bull_use_adx': True, 'bull_use_spike': True, 'bull_rsi_required': False, 'bear_strategy': 'breakout', 'bear_bb_std_mult': 2.043351430463857, 'bear_rsi_os': 29, 'bear_rsi_ob': 47, 'bear_adx_thresh': 6.677202871677714, 'bear_atr_min_pct': 0.016125491238347348, 'bear_atr_max_pct': 0.1436552136103501, 'bear_tp_mult': 1.0172087190415682, 'bear_tsl_mult': 0.999661957674678, 'bear_time_stop': 79, 'bear_use_sma': True, 'bear_use_ema': False, 'bear_use_atr': True, 'bear_use_adx': False, 'bear_use_spike': False, 'bear_rsi_required': False, 'sideways_strategy': 'mean_reversion', 'sideways_bb_std_mult': 1.5300596858308328, 'sideways_rsi_os': 48, 'sideways_rsi_ob': 94, 'sideways_adx_thresh': 13.684142993856845, 'sideways_atr_min_pct': 0.014102702465662798, 'sideways_atr_max_pct': 0.09803620825402391, 'sideways_tp_mult': 2.188810897022693, 'sideways_tsl_mult': 0.4741345465329151, 'sideways_time_stop': 257, 'sideways_use_sma': True, 'sideways_use_ema': True, 'sideways_use_atr': True, 'sideways_use_adx': False, 'sideways_use_spike': True, 'sideways_rsi_required': True}.
