[I 2025-08-30 22:07:59,571] Trial 656 finished with values: [-1000000000.0, 1000000000.0] and parameters: {'p_sma': 13, 'p_std': 36, 'p_atr': 23, 'p_adx': 22, 'rsi_period': 73, 'ema1': 5, 'ema2': 53, 'slip_atr_k': 0.01678906939407864, 'slip_spread_k': 0.16843002340356922, 'spread_hl_frac': 0.04379670277574571, 'bb_std_mult': 0.969009002717514, 'rsi_os': 17, 'rsi_ob': 76, 'vol_spike': 0.2779641602923458, 'adx_thresh': 10.066026405902951, 'atr_min_pct': 0.012964582755554297, 'atr_max_pct': 0.023655304166548985, 'tp_mult': 1.6054206636022312, 'tsl_mult': 0.28475608497339155, 'strategy': 'mean_reversion', 'time_stop': 293, 'use_sma': True, 'use_atr': False, 'use_adx': True, 'use_ema': True, 'use_spike': True, 'rsi_required': True, 'edge_k': 0.9334127492936852, 'edge_cap': 0.8454937251569143, 'bull_strategy': 'breakout', 'bull_bb_std_mult': 1.9300154568892793, 'bull_rsi_os': 48, 'bull_rsi_ob': 88, 'bull_adx_thresh': 16.611156367349338, 'bull_atr_min_pct': 0.0012115804058144353, 'bull_atr_max_pct': 0.041695964057069226, 'bull_tp_mult': 1.993792876068878, 'bull_tsl_mult': 0.37971550100851736, 'bull_time_stop': 261, 'bull_use_sma': True, 'bull_use_ema': False, 'bull_use_atr': False, 'bull_use_adx': False, 'bull_use_spike': False, 'bull_rsi_required': True, 'bear_strategy': 'mean_reversion', 'bear_bb_std_mult': 2.0464168026339444, 'bear_rsi_os': 9, 'bear_rsi_ob': 73, 'bear_adx_thresh': 29.912937457745333, 'bear_atr_min_pct': 0.027701770858203547, 'bear_atr_max_pct': 0.04716396064451104, 'bear_tp_mult': 1.6356416758818786, 'bear_tsl_mult': 0.32353307494114325, 'bear_time_stop': 231, 'bear_use_sma': False, 'bear_use_ema': True, 'bear_use_atr': False, 'bear_use_adx': True, 'bear_use_spike': True, 'bear_rsi_required': True, 'sideways_strategy': 'breakout', 'sideways_bb_std_mult': 1.5588059108455679, 'sideways_rsi_os': 41, 'sideways_rsi_ob': 45, 'sideways_adx_thresh': 11.140289897303768, 'sideways_atr_min_pct': 0.019543045822171864, 'sideways_atr_max_pct': 0.0508917977623364, 'sideways_tp_mult': 1.4320873300418984, 'sideways_tsl_mult': 0.7484240462827045, 'sideways_time_stop': 285, 'sideways_use_sma': False, 'sideways_use_ema': False, 'sideways_use_atr': False, 'sideways_use_adx': True, 'sideways_use_spike': False, 'sideways_rsi_required': False}.
[I 2025-08-30 22:08:00,633] Trial 661 finished with values: [-1000000000.0, 1000000000.0] and parameters: {'p_sma': 35, 'p_std': 58, 'p_atr': 20, 'p_adx': 21, 'rsi_period': 78, 'ema1': 11, 'ema2': 56, 'slip_atr_k': 0.1048976842427044, 'slip_spread_k': 0.6644556272533717, 'spread_hl_frac': 0.03166733166233254, 'bb_std_mult': 1.2596401114849434, 'rsi_os': 12, 'rsi_ob': 45, 'vol_spike': 0.0861665279557879, 'adx_thresh': 7.99188074212312, 'atr_min_pct': 0.014740005982834273, 'atr_max_pct': 0.01626459510460606, 'tp_mult': 1.742919356121176, 'tsl_mult': 0.14085424313217165, 'strategy': 'mean_reversion', 'time_stop': 98, 'use_sma': True, 'use_atr': True, 'use_adx': True, 'use_ema': False, 'use_spike': True, 'rsi_required': True, 'edge_k': 1.743466414661856, 'edge_cap': 0.8043570264298144, 'bull_strategy': 'breakout', 'bull_bb_std_mult': 2.016964588773699, 'bull_rsi_os': 15, 'bull_rsi_ob': 87, 'bull_adx_thresh': 23.767135129642995, 'bull_atr_min_pct': 0.023109748132921576, 'bull_atr_max_pct': 0.11596334060976837, 'bull_tp_mult': 1.4755691654200143, 'bull_tsl_mult': 0.24376715839736063, 'bull_time_stop': 280, 'bull_use_sma': True, 'bull_use_ema': False, 'bull_use_atr': False, 'bull_use_adx': False, 'bull_use_spike': False, 'bull_rsi_required': True, 'bear_strategy': 'breakout', 'bear_bb_std_mult': 1.9152265292585706, 'bear_rsi_os': 7, 'bear_rsi_ob': 60, 'bear_adx_thresh': 27.1434039975158, 'bear_atr_min_pct': 0.02910203000412246, 'bear_atr_max_pct': 0.12006631971160904, 'bear_tp_mult': 1.4406162316804882, 'bear_tsl_mult': 0.8341505772372713, 'bear_time_stop': 141, 'bear_use_sma': False, 'bear_use_ema': True, 'bear_use_atr': False, 'bear_use_adx': False, 'bear_use_spike': False, 'bear_rsi_required': True, 'sideways_strategy': 'breakout', 'sideways_bb_std_mult': 1.7203154954762594, 'sideways_rsi_os': 39, 'sideways_rsi_ob': 89, 'sideways_adx_thresh': 24.9624948345859, 'sideways_atr_min_pct': 0.02286174064388152, 'sideways_atr_max_pct': 0.11174471217934737, 'sideways_tp_mult': 1.910620281128142, 'sideways_tsl_mult': 0.33338738223313424, 'sideways_time_stop': 24, 'sideways_use_sma': False, 'sideways_use_ema': False, 'sideways_use_atr': True, 'sideways_use_adx': True, 'sideways_use_spike': False, 'sideways_rsi_required': False}.
[I 2025-08-30 22:08:25,071] Trial 658 finished with values: [-1000000000.0, 1000000000.0] and parameters: {'p_sma': 55, 'p_std': 35, 'p_atr': 12, 'p_adx': 20, 'rsi_period': 73, 'ema1': 10, 'ema2': 56, 'slip_atr_k': 0.015377227972751427, 'slip_spread_k': 0.29594958619806855, 'spread_hl_frac': 0.03132344425974012, 'bb_std_mult': 0.7492183572537457, 'rsi_os': 9, 'rsi_ob': 69, 'vol_spike': 0.20566074506271334, 'adx_thresh': 9.970832634890547, 'atr_min_pct': 0.007793953653707323, 'atr_max_pct': 0.014881083025074227, 'tp_mult': 1.8329427875414082, 'tsl_mult': 0.9331715383429231, 'strategy': 'mean_reversion', 'time_stop': 108, 'use_sma': True, 'use_atr': False, 'use_adx': True, 'use_ema': True, 'use_spike': True, 'rsi_required': True, 'edge_k': 1.735418395868909, 'edge_cap': 0.8441881988224934, 'bull_strategy': 'breakout', 'bull_bb_std_mult': 2.338339946285817, 'bull_rsi_os': 15, 'bull_rsi_ob': 82, 'bull_adx_thresh': 6.601688881541396, 'bull_atr_min_pct': 0.01156912433096259, 'bull_atr_max_pct': 0.09930215544782692, 'bull_tp_mult': 1.4592416137126896, 'bull_tsl_mult': 0.3775546595616189, 'bull_time_stop': 148, 'bull_use_sma': True, 'bull_use_ema': False, 'bull_use_atr': False, 'bull_use_adx': False, 'bull_use_spike': False, 'bull_rsi_required': True, 'bear_strategy': 'mean_reversion', 'bear_bb_std_mult': 2.039167259382779, 'bear_rsi_os': 15, 'bear_rsi_ob': 72, 'bear_adx_thresh': 27.180957934572348, 'bear_atr_min_pct': 0.009092545057552769, 'bear_atr_max_pct': 0.09930083823360181, 'bear_tp_mult': 1.442259821768191, 'bear_tsl_mult': 0.3237794107296843, 'bear_time_stop': 231, 'bear_use_sma': False, 'bear_use_ema': True, 'bear_use_atr': False, 'bear_use_adx': False, 'bear_use_spike': True, 'bear_rsi_required': True, 'sideways_strategy': 'mean_reversion', 'sideways_bb_std_mult': 1.556967565597571, 'sideways_rsi_os': 54, 'sideways_rsi_ob': 56, 'sideways_adx_thresh': 24.91120293652374, 'sideways_atr_min_pct': 0.019832344948637032, 'sideways_atr_max_pct': 0.04520337088175609, 'sideways_tp_mult': 1.9135697492385457, 'sideways_tsl_mult': 0.33847850325583356, 'sideways_time_stop': 287, 'sideways_use_sma': False, 'sideways_use_ema': False, 'sideways_use_atr': True, 'sideways_use_adx': False, 'sideways_use_spike': False, 'sideways_rsi_required': False}.
[I 2025-08-30 22:08:27,403] Trial 659 finished with values: [-1000000000.0, 1000000000.0] and parameters: {'p_sma': 17, 'p_std': 58, 'p_atr': 21, 'p_adx': 21, 'rsi_period': 69, 'ema1': 11, 'ema2': 39, 'slip_atr_k': 0.1644443217384074, 'slip_spread_k': 0.6283167554790324, 'spread_hl_frac': 0.043780258821265836, 'bb_std_mult': 0.752614536647269, 'rsi_os': 17, 'rsi_ob': 69, 'vol_spike': 0.20779388891932415, 'adx_thresh': 10.145509268562378, 'atr_min_pct': 0.01494085466086429, 'atr_max_pct': 0.1376270140036528, 'tp_mult': 1.5991659840825152, 'tsl_mult': 0.9327758475432029, 'strategy': 'mean_reversion', 'time_stop': 252, 'use_sma': True, 'use_atr': False, 'use_adx': True, 'use_ema': True, 'use_spike': True, 'rsi_required': True, 'edge_k': 0.0004421175094587726, 'edge_cap': 0.81252422807987, 'bull_strategy': 'breakout', 'bull_bb_std_mult': 1.9227318723540128, 'bull_rsi_os': 22, 'bull_rsi_ob': 87, 'bull_adx_thresh': 11.069006025169829, 'bull_atr_min_pct': 0.0013054606285508715, 'bull_atr_max_pct': 0.029943145679933537, 'bull_tp_mult': 1.4752309012882785, 'bull_tsl_mult': 0.38673255409508844, 'bull_time_stop': 155, 'bull_use_sma': True, 'bull_use_ema': False, 'bull_use_atr': False, 'bull_use_adx': False, 'bull_use_spike': False, 'bull_rsi_required': True, 'bear_strategy': 'mean_reversion', 'bear_bb_std_mult': 2.0274462135810603, 'bear_rsi_os': 15, 'bear_rsi_ob': 73, 'bear_adx_thresh': 27.723212659596268, 'bear_atr_min_pct': 0.009155533618281888, 'bear_atr_max_pct': 0.03504110858940845, 'bear_tp_mult': 1.4401327872504646, 'bear_tsl_mult': 0.32935896336396114, 'bear_time_stop': 140, 'bear_use_sma': False, 'bear_use_ema': True, 'bear_use_atr': False, 'bear_use_adx': False, 'bear_use_spike': True, 'bear_rsi_required': True, 'sideways_strategy': 'mean_reversion', 'sideways_bb_std_mult': 3.30288408338943, 'sideways_rsi_os': 39, 'sideways_rsi_ob': 71, 'sideways_adx_thresh': 9.912058603935229, 'sideways_atr_min_pct': 0.023035450137976914, 'sideways_atr_max_pct': 0.08716347991637288, 'sideways_tp_mult': 1.9117721569930919, 'sideways_tsl_mult': 0.33750717103900907, 'sideways_time_stop': 272, 'sideways_use_sma': False, 'sideways_use_ema': False, 'sideways_use_atr': False, 'sideways_use_adx': False, 'sideways_use_spike': False, 'sideways_rsi_required': False}.
[I 2025-08-30 22:08:28,717] Trial 660 finished with values: [-1000000000.0, 1000000000.0] and parameters: {'p_sma': 44, 'p_std': 58, 'p_atr': 26, 'p_adx': 21, 'rsi_period': 73, 'ema1': 5, 'ema2': 57, 'slip_atr_k': 0.10492566063371372, 'slip_spread_k': 0.18538781928577408, 'spread_hl_frac': 0.035661125140162786, 'bb_std_mult': 1.2220072823787806, 'rsi_os': 19, 'rsi_ob': 59, 'vol_spike': 0.20418619754846695, 'adx_thresh': 9.94697166644353, 'atr_min_pct': 0.005155727207463358, 'atr_max_pct': 0.029488413046479478, 'tp_mult': 1.6037898722448145, 'tsl_mult': 0.2858263473583702, 'strategy': 'mean_reversion', 'time_stop': 76, 'use_sma': True, 'use_atr': False, 'use_adx': True, 'use_ema': True, 'use_spike': True, 'rsi_required': True, 'edge_k': 0.5942913282948384, 'edge_cap': 0.8143170499918263, 'bull_strategy': 'breakout', 'bull_bb_std_mult': 1.9221807552947543, 'bull_rsi_os': 21, 'bull_rsi_ob': 87, 'bull_adx_thresh': 14.896769040932112, 'bull_atr_min_pct': 0.0010418697853921532, 'bull_atr_max_pct': 0.048311453679860936, 'bull_tp_mult': 1.9999522586140068, 'bull_tsl_mult': 0.37954762236084494, 'bull_time_stop': 289, 'bull_use_sma': True, 'bull_use_ema': False, 'bull_use_atr': False, 'bull_use_adx': False, 'bull_use_spike': False, 'bull_rsi_required': True, 'bear_strategy': 'breakout', 'bear_bb_std_mult': 1.8919760717458198, 'bear_rsi_os': 5, 'bear_rsi_ob': 73, 'bear_adx_thresh': 27.066223200493564, 'bear_atr_min_pct': 0.02788794548857431, 'bear_atr_max_pct': 0.12114793529145036, 'bear_tp_mult': 1.545963855216501, 'bear_tsl_mult': 0.8394591938429264, 'bear_time_stop': 156, 'bear_use_sma': False, 'bear_use_ema': True, 'bear_use_atr': False, 'bear_use_adx': True, 'bear_use_spike': False, 'bear_rsi_required': True, 'sideways_strategy': 'breakout', 'sideways_bb_std_mult': 1.7017004723049598, 'sideways_rsi_os': 39, 'sideways_rsi_ob': 59, 'sideways_adx_thresh': 26.753373669332284, 'sideways_atr_min_pct': 0.021041286555565503, 'sideways_atr_max_pct': 0.04503585358618274, 'sideways_tp_mult': 1.4221646925176281, 'sideways_tsl_mult': 0.7397698156160829, 'sideways_time_stop': 238, 'sideways_use_sma': False, 'sideways_use_ema': False, 'sideways_use_atr': True, 'sideways_use_adx': True, 'sideways_use_spike': False, 'sideways_rsi_required': False}.
[I 2025-08-30 22:08:33,402] Trial 662 finished with values: [-1000000000.0, 1000000000.0] and parameters: {'p_sma': 34, 'p_std': 34, 'p_atr': 21, 'p_adx': 21, 'rsi_period': 82, 'ema1': 11, 'ema2': 22, 'slip_atr_k': 0.1636981906221991, 'slip_spread_k': 0.7483975467522248, 'spread_hl_frac': 0.03426476997830436, 'bb_std_mult': 0.7545845356463485, 'rsi_os': 10, 'rsi_ob': 66, 'vol_spike': 0.2615736744829218, 'adx_thresh': 13.669889538125432, 'atr_min_pct': 0.011745684321196402, 'atr_max_pct': 0.02903808610619036, 'tp_mult': 1.944982584479525, 'tsl_mult': 0.9296404105068141, 'strategy': 'mean_reversion', 'time_stop': 41, 'use_sma': True, 'use_atr': True, 'use_adx': True, 'use_ema': True, 'use_spike': True, 'rsi_required': True, 'edge_k': 1.289758251566014, 'edge_cap': 0.2919459953450029, 'bull_strategy': 'breakout', 'bull_bb_std_mult': 1.2780494057772738, 'bull_rsi_os': 21, 'bull_rsi_ob': 60, 'bull_adx_thresh': 24.75836293482804, 'bull_atr_min_pct': 0.0005491136763727229, 'bull_atr_max_pct': 0.04923853432067645, 'bull_tp_mult': 1.409341443440183, 'bull_tsl_mult': 0.3619587112549666, 'bull_time_stop': 295, 'bull_use_sma': True, 'bull_use_ema': False, 'bull_use_atr': False, 'bull_use_adx': False, 'bull_use_spike': False, 'bull_rsi_required': True, 'bear_strategy': 'mean_reversion', 'bear_bb_std_mult': 1.3934261542865491, 'bear_rsi_os': 30, 'bear_rsi_ob': 74, 'bear_adx_thresh': 24.290109528478688, 'bear_atr_min_pct': 0.02999907377116399, 'bear_atr_max_pct': 0.03537363919507309, 'bear_tp_mult': 1.5747197661905759, 'bear_tsl_mult': 0.624678731462833, 'bear_time_stop': 177, 'bear_use_sma': False, 'bear_use_ema': True, 'bear_use_atr': False, 'bear_use_adx': True, 'bear_use_spike': True, 'bear_rsi_required': True, 'sideways_strategy': 'mean_reversion', 'sideways_bb_std_mult': 2.172853105618912, 'sideways_rsi_os': 43, 'sideways_rsi_ob': 88, 'sideways_adx_thresh': 9.780796741763798, 'sideways_atr_min_pct': 0.021128847632168848, 'sideways_atr_max_pct': 0.05939349180231855, 'sideways_tp_mult': 1.7948820560906367, 'sideways_tsl_mult': 0.7789211146868313, 'sideways_time_stop': 265, 'sideways_use_sma': False, 'sideways_use_ema': False, 'sideways_use_atr': False, 'sideways_use_adx': False, 'sideways_use_spike': False, 'sideways_rsi_required': False}.
[I 2025-08-30 22:08:33,845] Trial 664 finished with values: [-1000000000.0, 1000000000.0] and parameters: {'p_sma': 31, 'p_std': 38, 'p_atr': 7, 'p_adx': 21, 'rsi_period': 76, 'ema1': 12, 'ema2': 54, 'slip_atr_k': 0.0052885123497105925, 'slip_spread_k': 0.6953473145509027, 'spread_hl_frac': 0.03574374298238145, 'bb_std_mult': 2.563439405276481, 'rsi_os': 50, 'rsi_ob': 66, 'vol_spike': 0.2878940980206536, 'adx_thresh': 11.000457272885942, 'atr_min_pct': 0.01169152219459142, 'atr_max_pct': 0.028254891248797476, 'tp_mult': 1.9647107157192576, 'tsl_mult': 0.8669773484501601, 'strategy': 'mean_reversion', 'time_stop': 91, 'use_sma': True, 'use_atr': True, 'use_adx': False, 'use_ema': True, 'use_spike': False, 'rsi_required': True, 'edge_k': 1.0753503270308278, 'edge_cap': 0.7616896134854924, 'bull_strategy': 'breakout', 'bull_bb_std_mult': 1.8011173911115195, 'bull_rsi_os': 11, 'bull_rsi_ob': 87, 'bull_adx_thresh': 28.18220940095354, 'bull_atr_min_pct': 0.000567654404883127, 'bull_atr_max_pct': 0.02338502544139484, 'bull_tp_mult': 1.4033629522995197, 'bull_tsl_mult': 0.5978001458722338, 'bull_time_stop': 44, 'bull_use_sma': True, 'bull_use_ema': False, 'bull_use_atr': False, 'bull_use_adx': False, 'bull_use_spike': False, 'bull_rsi_required': False, 'bear_strategy': 'breakout', 'bear_bb_std_mult': 1.4118984926771891, 'bear_rsi_os': 24, 'bear_rsi_ob': 74, 'bear_adx_thresh': 26.65213996025746, 'bear_atr_min_pct': 0.02999880150917606, 'bear_atr_max_pct': 0.11125966662554795, 'bear_tp_mult': 1.548402502136034, 'bear_tsl_mult': 0.5405659449106331, 'bear_time_stop': 153, 'bear_use_sma': True, 'bear_use_ema': True, 'bear_use_atr': False, 'bear_use_adx': True, 'bear_use_spike': False, 'bear_rsi_required': False, 'sideways_strategy': 'breakout', 'sideways_bb_std_mult': 2.5814887147170262, 'sideways_rsi_os': 43, 'sideways_rsi_ob': 48, 'sideways_adx_thresh': 26.717636731240752, 'sideways_atr_min_pct': 0.02105785518946897, 'sideways_atr_max_pct': 0.035616253221190934, 'sideways_tp_mult': 1.1742684596127217, 'sideways_tsl_mult': 0.06269035973241949, 'sideways_time_stop': 264, 'sideways_use_sma': True, 'sideways_use_ema': False, 'sideways_use_atr': False, 'sideways_use_adx': True, 'sideways_use_spike': True, 'sideways_rsi_required': False}.
[I 2025-08-30 22:09:02,792] Trial 663 finished with values: [-1000000000.0, 1000000000.0] and parameters: {'p_sma': 19, 'p_std': 38, 'p_atr': 21, 'p_adx': 21, 'rsi_period': 68, 'ema1': 30, 'ema2': 54, 'slip_atr_k': 0.004695343929849813, 'slip_spread_k': 0.6644565936442648, 'spread_hl_frac': 0.03574387128553903, 'bb_std_mult': 0.7609815357325328, 'rsi_os': 43, 'rsi_ob': 66, 'vol_spike': 0.2882397516036385, 'adx_thresh': 12.564964508242735, 'atr_min_pct': 0.01188392544805953, 'atr_max_pct': 0.02740794338716209, 'tp_mult': 1.6609967187397183, 'tsl_mult': 0.9097783952927271, 'strategy': 'mean_reversion', 'time_stop': 76, 'use_sma': True, 'use_atr': True, 'use_adx': False, 'use_ema': True, 'use_spike': False, 'rsi_required': True, 'edge_k': 1.5523451848214436, 'edge_cap': 0.2877741638158664, 'bull_strategy': 'breakout', 'bull_bb_std_mult': 1.3156064844427324, 'bull_rsi_os': 21, 'bull_rsi_ob': 87, 'bull_adx_thresh': 28.05557822595096, 'bull_atr_min_pct': 0.000461914635302766, 'bull_atr_max_pct': 0.048498651583180494, 'bull_tp_mult': 1.4062366803059614, 'bull_tsl_mult': 0.28860048263598687, 'bull_time_stop': 157, 'bull_use_sma': True, 'bull_use_ema': False, 'bull_use_atr': False, 'bull_use_adx': False, 'bull_use_spike': False, 'bull_rsi_required': True, 'bear_strategy': 'mean_reversion', 'bear_bb_std_mult': 1.895730534313459, 'bear_rsi_os': 11, 'bear_rsi_ob': 74, 'bear_adx_thresh': 24.40428427742483, 'bear_atr_min_pct': 0.029480803459917004, 'bear_atr_max_pct': 0.11178778335365158, 'bear_tp_mult': 1.5740225903154381, 'bear_tsl_mult': 0.4126376364657195, 'bear_time_stop': 154, 'bear_use_sma': False, 'bear_use_ema': True, 'bear_use_atr': False, 'bear_use_adx': True, 'bear_use_spike': False, 'bear_rsi_required': True, 'sideways_strategy': 'breakout', 'sideways_bb_std_mult': 0.8159205942138561, 'sideways_rsi_os': 39, 'sideways_rsi_ob': 91, 'sideways_adx_thresh': 26.665813060141044, 'sideways_atr_min_pct': 0.0210633619318625, 'sideways_atr_max_pct': 0.05958506032280248, 'sideways_tp_mult': 1.795116594723162, 'sideways_tsl_mult': 0.07825411011150163, 'sideways_time_stop': 264, 'sideways_use_sma': True, 'sideways_use_ema': False, 'sideways_use_atr': False, 'sideways_use_adx': True, 'sideways_use_spike': True, 'sideways_rsi_required': False}.
[I 2025-08-30 22:09:05,043] Trial 665 finished with values: [-1000000000.0, 1000000000.0] and parameters: {'p_sma': 42, 'p_std': 18, 'p_atr': 7, 'p_adx': 21, 'rsi_period': 82, 'ema1': 30, 'ema2': 54, 'slip_atr_k': 0.024340405649169623, 'slip_spread_k': 0.6894405701091597, 'spread_hl_frac': 0.03421223249966458, 'bb_std_mult': 2.1082713061922465, 'rsi_os': 11, 'rsi_ob': 66, 'vol_spike': 0.09668140698223925, 'adx_thresh': 10.852017463544932, 'atr_min_pct': 0.011981846129925245, 'atr_max_pct': 0.02607330910498047, 'tp_mult': 1.661406760236898, 'tsl_mult': 0.4588949634684828, 'strategy': 'mean_reversion', 'time_stop': 90, 'use_sma': True, 'use_atr': True, 'use_adx': False, 'use_ema': False, 'use_spike': False, 'rsi_required': True, 'edge_k': 0.7771562354862181, 'edge_cap': 0.8723265469345568, 'bull_strategy': 'breakout', 'bull_bb_std_mult': 1.7433684956105475, 'bull_rsi_os': 33, 'bull_rsi_ob': 85, 'bull_adx_thresh': 13.860506349926794, 'bull_atr_min_pct': 0.0006541015683996907, 'bull_atr_max_pct': 0.14059021627222473, 'bull_tp_mult': 1.3955660170177238, 'bull_tsl_mult': 0.4760194594582009, 'bull_time_stop': 186, 'bull_use_sma': False, 'bull_use_ema': True, 'bull_use_atr': False, 'bull_use_adx': False, 'bull_use_spike': False, 'bull_rsi_required': False, 'bear_strategy': 'mean_reversion', 'bear_bb_std_mult': 0.9735381145500221, 'bear_rsi_os': 24, 'bear_rsi_ob': 74, 'bear_adx_thresh': 10.603272800535088, 'bear_atr_min_pct': 0.029225622851925263, 'bear_atr_max_pct': 0.13719852583619704, 'bear_tp_mult': 2.223640410703311, 'bear_tsl_mult': 0.4103836399642561, 'bear_time_stop': 222, 'bear_use_sma': True, 'bear_use_ema': True, 'bear_use_atr': False, 'bear_use_adx': True, 'bear_use_spike': True, 'bear_rsi_required': False, 'sideways_strategy': 'breakout', 'sideways_bb_std_mult': 2.1924698953271147, 'sideways_rsi_os': 42, 'sideways_rsi_ob': 91, 'sideways_adx_thresh': 15.936923332053468, 'sideways_atr_min_pct': 0.022231482522525114, 'sideways_atr_max_pct': 0.019919606233188336, 'sideways_tp_mult': 1.2589198985049401, 'sideways_tsl_mult': 0.779338687153326, 'sideways_time_stop': 265, 'sideways_use_sma': True, 'sideways_use_ema': False, 'sideways_use_atr': False, 'sideways_use_adx': True, 'sideways_use_spike': True, 'sideways_rsi_required': False}.
