[I 2025-08-30 21:00:09,531] Trial 99 finished with values: [-1000000000.0, 1000000000.0] and parameters: {'p_sma': 50, 'p_std': 33, 'p_atr': 8, 'p_adx': 26, 'rsi_period': 69, 'ema1': 6, 'ema2': 52, 'slip_atr_k': 0.025782892054701113, 'slip_spread_k': 0.8073430190773456, 'spread_hl_frac': 0.003607129127152827, 'bb_std_mult': 0.9760693887000358, 'rsi_os': 29, 'rsi_ob': 68, 'vol_spike': 0.05442951658366916, 'adx_thresh': 19.82192784644799, 'atr_min_pct': 0.025166401692529677, 'atr_max_pct': 0.10017880903816412, 'tp_mult': 2.0612880532409656, 'tsl_mult': 0.9050559923621522, 'strategy': 'breakout', 'time_stop': 262, 'use_sma': False, 'use_atr': False, 'use_adx': False, 'use_ema': False, 'use_spike': False, 'rsi_required': False, 'edge_k': 0.509854888240183, 'edge_cap': 0.46127171306043546, 'bull_strategy': 'breakout', 'bull_bb_std_mult': 2.613918922010568, 'bull_rsi_os': 43, 'bull_rsi_ob': 62, 'bull_adx_thresh': 16.254337150055925, 'bull_atr_min_pct': 0.0232370905990762, 'bull_atr_max_pct': 0.04705858087622714, 'bull_tp_mult': 1.1137910681501038, 'bull_tsl_mult': 0.7522622160374851, 'bull_time_stop': 48, 'bull_use_sma': True, 'bull_use_ema': False, 'bull_use_atr': True, 'bull_use_adx': True, 'bull_use_spike': False, 'bull_rsi_required': False, 'bear_strategy': 'mean_reversion', 'bear_bb_std_mult': 3.3184685294253393, 'bear_rsi_os': 52, 'bear_rsi_ob': 58, 'bear_adx_thresh': 17.472137138991602, 'bear_atr_min_pct': 0.018398633407379458, 'bear_atr_max_pct': 0.13369509535774476, 'bear_tp_mult': 2.516793356503441, 'bear_tsl_mult': 0.5182687635750276, 'bear_time_stop': 89, 'bear_use_sma': True, 'bear_use_ema': True, 'bear_use_atr': False, 'bear_use_adx': False, 'bear_use_spike': False, 'bear_rsi_required': False, 'sideways_strategy': 'breakout', 'sideways_bb_std_mult': 2.8809300972848786, 'sideways_rsi_os': 35, 'sideways_rsi_ob': 63, 'sideways_adx_thresh': 15.370920473570454, 'sideways_atr_min_pct': 0.007837140991241644, 'sideways_atr_max_pct': 0.028603376829125754, 'sideways_tp_mult': 2.705884492548548, 'sideways_tsl_mult': 0.4674757476894425, 'sideways_time_stop': 223, 'sideways_use_sma': True, 'sideways_use_ema': False, 'sideways_use_atr': True, 'sideways_use_adx': True, 'sideways_use_spike': True, 'sideways_rsi_required': False}.
[I 2025-08-30 21:00:09,894] Trial 100 finished with values: [-1000000000.0, 1000000000.0] and parameters: {'p_sma': 54, 'p_std': 28, 'p_atr': 15, 'p_adx': 30, 'rsi_period': 68, 'ema1': 6, 'ema2': 52, 'slip_atr_k': 0.025599548439026787, 'slip_spread_k': 0.9206917399906753, 'spread_hl_frac': 0.003299090739678239, 'bb_std_mult': 1.0159180352485495, 'rsi_os': 28, 'rsi_ob': 64, 'vol_spike': 0.07497395346357928, 'adx_thresh': 19.751742387180727, 'atr_min_pct': 0.010641471855237082, 'atr_max_pct': 0.10348140291924256, 'tp_mult': 1.8716846284495172, 'tsl_mult': 0.9233205122864895, 'strategy': 'breakout', 'time_stop': 179, 'use_sma': False, 'use_atr': False, 'use_adx': False, 'use_ema': True, 'use_spike': False, 'rsi_required': False, 'edge_k': 1.4614026041687047, 'edge_cap': 0.32027488749480415, 'bull_strategy': 'breakout', 'bull_bb_std_mult': 2.7928033962851764, 'bull_rsi_os': 53, 'bull_rsi_ob': 64, 'bull_adx_thresh': 16.618634867667392, 'bull_atr_min_pct': 0.02307587234581645, 'bull_atr_max_pct': 0.046804665245079397, 'bull_tp_mult': 2.6755023272925644, 'bull_tsl_mult': 0.7542779823319234, 'bull_time_stop': 181, 'bull_use_sma': True, 'bull_use_ema': False, 'bull_use_atr': True, 'bull_use_adx': True, 'bull_use_spike': True, 'bull_rsi_required': False, 'bear_strategy': 'mean_reversion', 'bear_bb_std_mult': 3.2570496905780066, 'bear_rsi_os': 52, 'bear_rsi_ob': 64, 'bear_adx_thresh': 19.943946468247063, 'bear_atr_min_pct': 0.02358033092371114, 'bear_atr_max_pct': 0.14061616856021392, 'bear_tp_mult': 1.5822600119324362, 'bear_tsl_mult': 0.4270793107383609, 'bear_time_stop': 66, 'bear_use_sma': True, 'bear_use_ema': True, 'bear_use_atr': False, 'bear_use_adx': True, 'bear_use_spike': False, 'bear_rsi_required': False, 'sideways_strategy': 'breakout', 'sideways_bb_std_mult': 2.8396820991700342, 'sideways_rsi_os': 38, 'sideways_rsi_ob': 62, 'sideways_adx_thresh': 5.087153705714547, 'sideways_atr_min_pct': 0.0038230023595302682, 'sideways_atr_max_pct': 0.0271348318033096, 'sideways_tp_mult': 2.703795771827951, 'sideways_tsl_mult': 0.53757562932273, 'sideways_time_stop': 112, 'sideways_use_sma': True, 'sideways_use_ema': True, 'sideways_use_atr': True, 'sideways_use_adx': True, 'sideways_use_spike': True, 'sideways_rsi_required': True}.
[I 2025-08-30 21:00:43,546] Trial 104 finished with values: [-1000000000.0, 1000000000.0] and parameters: {'p_sma': 50, 'p_std': 31, 'p_atr': 10, 'p_adx': 29, 'rsi_period': 16, 'ema1': 8, 'ema2': 13, 'slip_atr_k': 0.24920420357583092, 'slip_spread_k': 0.8735669340739372, 'spread_hl_frac': 0.04826447125773079, 'bb_std_mult': 2.093959591282725, 'rsi_os': 26, 'rsi_ob': 78, 'vol_spike': 0.17776558115048974, 'adx_thresh': 22.28183355832564, 'atr_min_pct': 0.015107687784030753, 'atr_max_pct': 0.08456037905280242, 'tp_mult': 1.6883496450618674, 'tsl_mult': 0.9745437242734583, 'strategy': 'mean_reversion', 'time_stop': 285, 'use_sma': False, 'use_atr': True, 'use_adx': True, 'use_ema': False, 'use_spike': True, 'rsi_required': True, 'edge_k': 1.624337771462779, 'edge_cap': 0.3617021243513855, 'bull_strategy': 'breakout', 'bull_bb_std_mult': 2.431719887513788, 'bull_rsi_os': 9, 'bull_rsi_ob': 83, 'bull_adx_thresh': 12.150189325137376, 'bull_atr_min_pct': 0.014312958470466278, 'bull_atr_max_pct': 0.06328967347187595, 'bull_tp_mult': 1.424793438267774, 'bull_tsl_mult': 0.5488605072855111, 'bull_time_stop': 154, 'bull_use_sma': True, 'bull_use_ema': False, 'bull_use_atr': False, 'bull_use_adx': True, 'bull_use_spike': False, 'bull_rsi_required': True, 'bear_strategy': 'mean_reversion', 'bear_bb_std_mult': 1.9311025993800488, 'bear_rsi_os': 53, 'bear_rsi_ob': 53, 'bear_adx_thresh': 8.733372232031655, 'bear_atr_min_pct': 0.019447320313097434, 'bear_atr_max_pct': 0.14387949958016874, 'bear_tp_mult': 1.8267307564889643, 'bear_tsl_mult': 0.9452505766794559, 'bear_time_stop': 262, 'bear_use_sma': True, 'bear_use_ema': False, 'bear_use_atr': False, 'bear_use_adx': False, 'bear_use_spike': True, 'bear_rsi_required': True, 'sideways_strategy': 'breakout', 'sideways_bb_std_mult': 1.8682571057390378, 'sideways_rsi_os': 48, 'sideways_rsi_ob': 85, 'sideways_adx_thresh': 9.193069271240617, 'sideways_atr_min_pct': 0.010112218886872089, 'sideways_atr_max_pct': 0.12077196729933584, 'sideways_tp_mult': 2.8283235551502193, 'sideways_tsl_mult': 0.5109248520945056, 'sideways_time_stop': 195, 'sideways_use_sma': False, 'sideways_use_ema': False, 'sideways_use_atr': True, 'sideways_use_adx': False, 'sideways_use_spike': False, 'sideways_rsi_required': False}.
[I 2025-08-30 21:00:44,201] Trial 102 finished with values: [-1000000000.0, 1000000000.0] and parameters: {'p_sma': 54, 'p_std': 28, 'p_atr': 8, 'p_adx': 29, 'rsi_period': 16, 'ema1': 7, 'ema2': 20, 'slip_atr_k': 0.0726413904734957, 'slip_spread_k': 0.8795334068468257, 'spread_hl_frac': 0.005527492412473172, 'bb_std_mult': 0.942220182635328, 'rsi_os': 27, 'rsi_ob': 68, 'vol_spike': 0.01214843488107876, 'adx_thresh': 23.285447404431153, 'atr_min_pct': 0.013609001057745122, 'atr_max_pct': 0.08577328944768871, 'tp_mult': 1.8428072135458555, 'tsl_mult': 0.9755832469937118, 'strategy': 'breakout', 'time_stop': 177, 'use_sma': False, 'use_atr': False, 'use_adx': False, 'use_ema': True, 'use_spike': False, 'rsi_required': False, 'edge_k': 1.4612367031443385, 'edge_cap': 0.32377488337756144, 'bull_strategy': 'breakout', 'bull_bb_std_mult': 3.5113536667567864, 'bull_rsi_os': 47, 'bull_rsi_ob': 62, 'bull_adx_thresh': 15.403981329185282, 'bull_atr_min_pct': 0.017947272756927833, 'bull_atr_max_pct': 0.04622445193892975, 'bull_tp_mult': 1.4434671071581198, 'bull_tsl_mult': 0.6787321222158951, 'bull_time_stop': 207, 'bull_use_sma': True, 'bull_use_ema': False, 'bull_use_atr': True, 'bull_use_adx': True, 'bull_use_spike': True, 'bull_rsi_required': False, 'bear_strategy': 'mean_reversion', 'bear_bb_std_mult': 2.6852157549600983, 'bear_rsi_os': 52, 'bear_rsi_ob': 87, 'bear_adx_thresh': 8.789306875916186, 'bear_atr_min_pct': 0.022899196797290473, 'bear_atr_max_pct': 0.01777507850737549, 'bear_tp_mult': 2.4487844450743217, 'bear_tsl_mult': 0.9961778610845087, 'bear_time_stop': 66, 'bear_use_sma': True, 'bear_use_ema': False, 'bear_use_atr': False, 'bear_use_adx': True, 'bear_use_spike': False, 'bear_rsi_required': True, 'sideways_strategy': 'breakout', 'sideways_bb_std_mult': 1.902897308827164, 'sideways_rsi_os': 48, 'sideways_rsi_ob': 66, 'sideways_adx_thresh': 9.744901090225193, 'sideways_atr_min_pct': 0.00894878556384806, 'sideways_atr_max_pct': 0.018776670555572535, 'sideways_tp_mult': 2.0006909066524203, 'sideways_tsl_mult': 0.5460539366633502, 'sideways_time_stop': 198, 'sideways_use_sma': True, 'sideways_use_ema': True, 'sideways_use_atr': True, 'sideways_use_adx': False, 'sideways_use_spike': True, 'sideways_rsi_required': True}.
[I 2025-08-30 21:00:44,324] Trial 101 finished with values: [-0.01744875350541386, 0.017417391441836117] and parameters: {'p_sma': 50, 'p_std': 35, 'p_atr': 8, 'p_adx': 30, 'rsi_period': 68, 'ema1': 7, 'ema2': 15, 'slip_atr_k': 0.034253311595023664, 'slip_spread_k': 0.8743975005801721, 'spread_hl_frac': 0.007223247416411074, 'bb_std_mult': 0.9359884473510691, 'rsi_os': 29, 'rsi_ob': 69, 'vol_spike': 0.014546600114901427, 'adx_thresh': 23.003149455156837, 'atr_min_pct': 0.015352504629964216, 'atr_max_pct': 0.12006943796202754, 'tp_mult': 2.9888337952051063, 'tsl_mult': 0.5799002484712248, 'strategy': 'breakout', 'time_stop': 185, 'use_sma': False, 'use_atr': False, 'use_adx': False, 'use_ema': True, 'use_spike': False, 'rsi_required': False, 'edge_k': 1.3124943133425853, 'edge_cap': 0.316098855738674, 'bull_strategy': 'breakout', 'bull_bb_std_mult': 2.4589431167289235, 'bull_rsi_os': 17, 'bull_rsi_ob': 63, 'bull_adx_thresh': 13.971968031274018, 'bull_atr_min_pct': 0.0021996710406135904, 'bull_atr_max_pct': 0.06443337016114872, 'bull_tp_mult': 1.4147424142846345, 'bull_tsl_mult': 0.5526026418673414, 'bull_time_stop': 299, 'bull_use_sma': True, 'bull_use_ema': False, 'bull_use_atr': False, 'bull_use_adx': True, 'bull_use_spike': True, 'bull_rsi_required': False, 'bear_strategy': 'mean_reversion', 'bear_bb_std_mult': 2.690580822394604, 'bear_rsi_os': 52, 'bear_rsi_ob': 93, 'bear_adx_thresh': 16.821334947667566, 'bear_atr_min_pct': 0.028510497486266273, 'bear_atr_max_pct': 0.14035529298466973, 'bear_tp_mult': 2.452711412139195, 'bear_tsl_mult': 0.5666358185344991, 'bear_time_stop': 66, 'bear_use_sma': True, 'bear_use_ema': True, 'bear_use_atr': False, 'bear_use_adx': True, 'bear_use_spike': False, 'bear_rsi_required': False, 'sideways_strategy': 'breakout', 'sideways_bb_std_mult': 2.86108172182674, 'sideways_rsi_os': 39, 'sideways_rsi_ob': 66, 'sideways_adx_thresh': 15.86865530513191, 'sideways_atr_min_pct': 0.003223663715501316, 'sideways_atr_max_pct': 0.018024532001355995, 'sideways_tp_mult': 2.6695443491769244, 'sideways_tsl_mult': 0.30799622854509556, 'sideways_time_stop': 130, 'sideways_use_sma': True, 'sideways_use_ema': True, 'sideways_use_atr': True, 'sideways_use_adx': True, 'sideways_use_spike': True, 'sideways_rsi_required': True}.
[I 2025-08-30 21:00:44,686] Trial 103 finished with values: [-1000000000.0, 1000000000.0] and parameters: {'p_sma': 27, 'p_std': 28, 'p_atr': 15, 'p_adx': 29, 'rsi_period': 62, 'ema1': 7, 'ema2': 16, 'slip_atr_k': 0.07442316930125842, 'slip_spread_k': 0.8686281130250638, 'spread_hl_frac': 0.04781732592199893, 'bb_std_mult': 2.075115704388742, 'rsi_os': 27, 'rsi_ob': 63, 'vol_spike': 0.07337583134571143, 'adx_thresh': 23.430447523877667, 'atr_min_pct': 0.013578836867587468, 'atr_max_pct': 0.12119889588057786, 'tp_mult': 1.8398599201710524, 'tsl_mult': 0.8061192690486565, 'strategy': 'mean_reversion', 'time_stop': 133, 'use_sma': False, 'use_atr': True, 'use_adx': True, 'use_ema': True, 'use_spike': True, 'rsi_required': False, 'edge_k': 1.4871737549696211, 'edge_cap': 0.2172250682492245, 'bull_strategy': 'breakout', 'bull_bb_std_mult': 3.461191802958475, 'bull_rsi_os': 16, 'bull_rsi_ob': 48, 'bull_adx_thresh': 15.17188806417922, 'bull_atr_min_pct': 0.002665598974783693, 'bull_atr_max_pct': 0.06286511460132926, 'bull_tp_mult': 2.5715946895733888, 'bull_tsl_mult': 0.05236614316709898, 'bull_time_stop': 201, 'bull_use_sma': True, 'bull_use_ema': False, 'bull_use_atr': False, 'bull_use_adx': True, 'bull_use_spike': True, 'bull_rsi_required': True, 'bear_strategy': 'mean_reversion', 'bear_bb_std_mult': 2.4021001743284573, 'bear_rsi_os': 53, 'bear_rsi_ob': 87, 'bear_adx_thresh': 11.34665659987867, 'bear_atr_min_pct': 0.022855612719963374, 'bear_atr_max_pct': 0.1177544986248864, 'bear_tp_mult': 2.4385261259327518, 'bear_tsl_mult': 0.9968178161660604, 'bear_time_stop': 66, 'bear_use_sma': True, 'bear_use_ema': False, 'bear_use_atr': False, 'bear_use_adx': True, 'bear_use_spike': False, 'bear_rsi_required': True, 'sideways_strategy': 'breakout', 'sideways_bb_std_mult': 1.8424135912761481, 'sideways_rsi_os': 48, 'sideways_rsi_ob': 93, 'sideways_adx_thresh': 5.426728723200922, 'sideways_atr_min_pct': 0.010099927931831842, 'sideways_atr_max_pct': 0.01771932432176318, 'sideways_tp_mult': 2.030726550690845, 'sideways_tsl_mult': 0.541658005696876, 'sideways_time_stop': 181, 'sideways_use_sma': True, 'sideways_use_ema': True, 'sideways_use_atr': True, 'sideways_use_adx': False, 'sideways_use_spike': True, 'sideways_rsi_required': True}.
[I 2025-08-30 21:00:45,024] Trial 108 finished with values: [-1000000000.0, 1000000000.0] and parameters: {'p_sma': 13, 'p_std': 39, 'p_atr': 19, 'p_adx': 27, 'rsi_period': 82, 'ema1': 8, 'ema2': 48, 'slip_atr_k': 0.0063853829837462765, 'slip_spread_k': 0.722954264267626, 'spread_hl_frac': 0.006856757906413808, 'bb_std_mult': 3.2685984790651643, 'rsi_os': 55, 'rsi_ob': 89, 'vol_spike': 0.15641125965788252, 'adx_thresh': 16.91041104597314, 'atr_min_pct': 0.006220253974760264, 'atr_max_pct': 0.10740777687532516, 'tp_mult': 2.992653397596821, 'tsl_mult': 0.7229740938662703, 'strategy': 'mean_reversion', 'time_stop': 194, 'use_sma': False, 'use_atr': True, 'use_adx': True, 'use_ema': False, 'use_spike': True, 'rsi_required': True, 'edge_k': 0.6782188311721682, 'edge_cap': 0.13809363068602454, 'bull_strategy': 'breakout', 'bull_bb_std_mult': 2.5125653274678954, 'bull_rsi_os': 13, 'bull_rsi_ob': 45, 'bull_adx_thresh': 13.778604334854421, 'bull_atr_min_pct': 0.0017059546813266917, 'bull_atr_max_pct': 0.05103515752134325, 'bull_tp_mult': 1.5323441456318938, 'bull_tsl_mult': 0.6369724710852629, 'bull_time_stop': 198, 'bull_use_sma': True, 'bull_use_ema': True, 'bull_use_atr': False, 'bull_use_adx': True, 'bull_use_spike': False, 'bull_rsi_required': True, 'bear_strategy': 'mean_reversion', 'bear_bb_std_mult': 2.796539177397217, 'bear_rsi_os': 49, 'bear_rsi_ob': 70, 'bear_adx_thresh': 15.090946670301985, 'bear_atr_min_pct': 0.014410914414390817, 'bear_atr_max_pct': 0.02180554057229825, 'bear_tp_mult': 2.360503975685756, 'bear_tsl_mult': 0.6951302699995661, 'bear_time_stop': 299, 'bear_use_sma': True, 'bear_use_ema': False, 'bear_use_atr': False, 'bear_use_adx': False, 'bear_use_spike': True, 'bear_rsi_required': True, 'sideways_strategy': 'breakout', 'sideways_bb_std_mult': 2.6943702280933812, 'sideways_rsi_os': 41, 'sideways_rsi_ob': 60, 'sideways_adx_thresh': 27.43832650580552, 'sideways_atr_min_pct': 0.0064380120028593064, 'sideways_atr_max_pct': 0.010349472175108551, 'sideways_tp_mult': 2.658910615540336, 'sideways_tsl_mult': 0.584386926514914, 'sideways_time_stop': 208, 'sideways_use_sma': False, 'sideways_use_ema': False, 'sideways_use_atr': True, 'sideways_use_adx': False, 'sideways_use_spike': False, 'sideways_rsi_required': False}.
[I 2025-08-30 21:01:19,409] Trial 107 finished with values: [-1000000000.0, 1000000000.0] and parameters: {'p_sma': 26, 'p_std': 35, 'p_atr': 15, 'p_adx': 27, 'rsi_period': 84, 'ema1': 20, 'ema2': 44, 'slip_atr_k': 0.23025346994274198, 'slip_spread_k': 0.7248585936904828, 'spread_hl_frac': 0.007213144840915521, 'bb_std_mult': 1.1266249108377335, 'rsi_os': 32, 'rsi_ob': 89, 'vol_spike': 0.15617748301855716, 'adx_thresh': 23.07766132884982, 'atr_min_pct': 0.006066195746122629, 'atr_max_pct': 0.10859840098489236, 'tp_mult': 1.5853370925836505, 'tsl_mult': 0.8069725019191779, 'strategy': 'mean_reversion', 'time_stop': 189, 'use_sma': False, 'use_atr': True, 'use_adx': True, 'use_ema': False, 'use_spike': True, 'rsi_required': True, 'edge_k': 1.2883367868362763, 'edge_cap': 0.27533903599833776, 'bull_strategy': 'breakout', 'bull_bb_std_mult': 3.440142836837368, 'bull_rsi_os': 9, 'bull_rsi_ob': 76, 'bull_adx_thresh': 11.086896542366969, 'bull_atr_min_pct': 0.0022617799365905657, 'bull_atr_max_pct': 0.040660683405291796, 'bull_tp_mult': 2.5774674809845917, 'bull_tsl_mult': 0.6428224431472289, 'bull_time_stop': 197, 'bull_use_sma': True, 'bull_use_ema': True, 'bull_use_atr': False, 'bull_use_adx': True, 'bull_use_spike': False, 'bull_rsi_required': True, 'bear_strategy': 'mean_reversion', 'bear_bb_std_mult': 2.4283032179159716, 'bear_rsi_os': 49, 'bear_rsi_ob': 93, 'bear_adx_thresh': 15.295551753389775, 'bear_atr_min_pct': 0.015132926322058704, 'bear_atr_max_pct': 0.11327404334943841, 'bear_tp_mult': 2.4309826853533214, 'bear_tsl_mult': 0.5790554224616409, 'bear_time_stop': 236, 'bear_use_sma': True, 'bear_use_ema': False, 'bear_use_atr': False, 'bear_use_adx': False, 'bear_use_spike': True, 'bear_rsi_required': True, 'sideways_strategy': 'breakout', 'sideways_bb_std_mult': 2.7930650957798107, 'sideways_rsi_os': 41, 'sideways_rsi_ob': 60, 'sideways_adx_thresh': 26.521478714775046, 'sideways_atr_min_pct': 0.003020800504294029, 'sideways_atr_max_pct': 0.14159463612814208, 'sideways_tp_mult': 2.653715723313117, 'sideways_tsl_mult': 0.3212319953044478, 'sideways_time_stop': 212, 'sideways_use_sma': False, 'sideways_use_ema': False, 'sideways_use_atr': True, 'sideways_use_adx': False, 'sideways_use_spike': False, 'sideways_rsi_required': False}.
[I 2025-08-30 21:01:19,447] Trial 106 finished with values: [-0.022488727214033166, 0.02250018017819749] and parameters: {'p_sma': 19, 'p_std': 15, 'p_atr': 10, 'p_adx': 27, 'rsi_period': 83, 'ema1': 20, 'ema2': 47, 'slip_atr_k': 0.03307688004881997, 'slip_spread_k': 0.7779197839343677, 'spread_hl_frac': 0.00012022154715170957, 'bb_std_mult': 3.1211713593973727, 'rsi_os': 32, 'rsi_ob': 79, 'vol_spike': 0.20290400605747147, 'adx_thresh': 23.038713789495766, 'atr_min_pct': 0.0061090742556570085, 'atr_max_pct': 0.10661305064710523, 'tp_mult': 1.9532653015306605, 'tsl_mult': 0.8433610046208487, 'strategy': 'mean_reversion', 'time_stop': 212, 'use_sma': False, 'use_atr': True, 'use_adx': True, 'use_ema': False, 'use_spike': True, 'rsi_required': True, 'edge_k': 1.3205061358556383, 'edge_cap': 0.277380857368427, 'bull_strategy': 'breakout', 'bull_bb_std_mult': 3.211378602340571, 'bull_rsi_os': 17, 'bull_rsi_ob': 45, 'bull_adx_thresh': 13.898958717958271, 'bull_atr_min_pct': 0.0005659526343614551, 'bull_atr_max_pct': 0.12493513980381785, 'bull_tp_mult': 2.570466476692011, 'bull_tsl_mult': 0.7058032124387141, 'bull_time_stop': 183, 'bull_use_sma': True, 'bull_use_ema': False, 'bull_use_atr': False, 'bull_use_adx': True, 'bull_use_spike': False, 'bull_rsi_required': True, 'bear_strategy': 'mean_reversion', 'bear_bb_std_mult': 1.5539310006484284, 'bear_rsi_os': 50, 'bear_rsi_ob': 51, 'bear_adx_thresh': 15.244296111033396, 'bear_atr_min_pct': 0.02051879526459672, 'bear_atr_max_pct': 0.11556880502943676, 'bear_tp_mult': 2.9888519646786023, 'bear_tsl_mult': 0.7160133753373019, 'bear_time_stop': 199, 'bear_use_sma': True, 'bear_use_ema': False, 'bear_use_atr': False, 'bear_use_adx': False, 'bear_use_spike': True, 'bear_rsi_required': True, 'sideways_strategy': 'breakout', 'sideways_bb_std_mult': 1.1887079476693652, 'sideways_rsi_os': 39, 'sideways_rsi_ob': 48, 'sideways_adx_thresh': 27.514564623437078, 'sideways_atr_min_pct': 0.006854500335821486, 'sideways_atr_max_pct': 0.09163673856469275, 'sideways_tp_mult': 2.639768736460802, 'sideways_tsl_mult': 0.39507680664814954, 'sideways_time_stop': 208, 'sideways_use_sma': False, 'sideways_use_ema': False, 'sideways_use_atr': True, 'sideways_use_adx': False, 'sideways_use_spike': False, 'sideways_rsi_required': False}.
