[I 2025-08-30 21:39:08,964] Trial 403 finished with values: [-1000000000.0, 1000000000.0] and parameters: {'p_sma': 29, 'p_std': 33, 'p_atr': 22, 'p_adx': 25, 'rsi_period': 68, 'ema1': 23, 'ema2': 39, 'slip_atr_k': 0.17524040151159087, 'slip_spread_k': 0.2534254776084222, 'spread_hl_frac': 0.023893269557502386, 'bb_std_mult': 1.4491760791508455, 'rsi_os': 14, 'rsi_ob': 57, 'vol_spike': 0.2875020555180719, 'adx_thresh': 19.53173514312754, 'atr_min_pct': 0.010610713941486959, 'atr_max_pct': 0.1042626636523289, 'tp_mult': 2.28612914146193, 'tsl_mult': 0.6748305505324494, 'strategy': 'mean_reversion', 'time_stop': 157, 'use_sma': True, 'use_atr': True, 'use_adx': True, 'use_ema': True, 'use_spike': True, 'rsi_required': False, 'edge_k': 1.3819319908662238, 'edge_cap': 0.695210400062001, 'bull_strategy': 'breakout', 'bull_bb_std_mult': 2.6409426754296508, 'bull_rsi_os': 6, 'bull_rsi_ob': 86, 'bull_adx_thresh': 24.495689983607676, 'bull_atr_min_pct': 0.001212414680868179, 'bull_atr_max_pct': 0.032948351824127406, 'bull_tp_mult': 2.9896493666607946, 'bull_tsl_mult': 0.3916355081945326, 'bull_time_stop': 278, 'bull_use_sma': True, 'bull_use_ema': True, 'bull_use_atr': False, 'bull_use_adx': True, 'bull_use_spike': False, 'bull_rsi_required': True, 'bear_strategy': 'breakout', 'bear_bb_std_mult': 2.609906451030448, 'bear_rsi_os': 36, 'bear_rsi_ob': 79, 'bear_adx_thresh': 13.313575153888305, 'bear_atr_min_pct': 0.02843689595621179, 'bear_atr_max_pct': 0.08239887191627898, 'bear_tp_mult': 1.3424137683442914, 'bear_tsl_mult': 0.023537570638037852, 'bear_time_stop': 89, 'bear_use_sma': False, 'bear_use_ema': True, 'bear_use_atr': True, 'bear_use_adx': False, 'bear_use_spike': False, 'bear_rsi_required': True, 'sideways_strategy': 'mean_reversion', 'sideways_bb_std_mult': 1.1719813271974193, 'sideways_rsi_os': 54, 'sideways_rsi_ob': 75, 'sideways_adx_thresh': 27.593074169298607, 'sideways_atr_min_pct': 0.01820444787194794, 'sideways_atr_max_pct': 0.1439998281828998, 'sideways_tp_mult': 1.9856196936618153, 'sideways_tsl_mult': 0.9573200980176413, 'sideways_time_stop': 60, 'sideways_use_sma': True, 'sideways_use_ema': False, 'sideways_use_atr': False, 'sideways_use_adx': True, 'sideways_use_spike': True, 'sideways_rsi_required': False}.
[I 2025-08-30 21:39:12,085] Trial 406 finished with values: [-1000000000.0, 1000000000.0] and parameters: {'p_sma': 31, 'p_std': 55, 'p_atr': 23, 'p_adx': 22, 'rsi_period': 80, 'ema1': 8, 'ema2': 20, 'slip_atr_k': 0.14233884464596938, 'slip_spread_k': 0.3872634101389441, 'spread_hl_frac': 0.030684200194591095, 'bb_std_mult': 2.2830938619271257, 'rsi_os': 13, 'rsi_ob': 58, 'vol_spike': 0.2815871716800838, 'adx_thresh': 18.545493865772436, 'atr_min_pct': 0.009628490752387335, 'atr_max_pct': 0.14147349234483605, 'tp_mult': 1.795944998638629, 'tsl_mult': 0.02196227889795055, 'strategy': 'mean_reversion', 'time_stop': 28, 'use_sma': True, 'use_atr': True, 'use_adx': True, 'use_ema': True, 'use_spike': True, 'rsi_required': True, 'edge_k': 1.4906012322622793, 'edge_cap': 0.7038611052760011, 'bull_strategy': 'breakout', 'bull_bb_std_mult': 2.1362075149178477, 'bull_rsi_os': 25, 'bull_rsi_ob': 95, 'bull_adx_thresh': 34.327789737086256, 'bull_atr_min_pct': 0.009550319295325918, 'bull_atr_max_pct': 0.07429879751179158, 'bull_tp_mult': 2.9926958541007656, 'bull_tsl_mult': 0.37259811480416544, 'bull_time_stop': 284, 'bull_use_sma': True, 'bull_use_ema': False, 'bull_use_atr': False, 'bull_use_adx': False, 'bull_use_spike': False, 'bull_rsi_required': True, 'bear_strategy': 'mean_reversion', 'bear_bb_std_mult': 2.764102217655967, 'bear_rsi_os': 23, 'bear_rsi_ob': 82, 'bear_adx_thresh': 29.995290937205358, 'bear_atr_min_pct': 0.029442006090971272, 'bear_atr_max_pct': 0.012804579785324396, 'bear_tp_mult': 1.6997250707959755, 'bear_tsl_mult': 0.41528908422108946, 'bear_time_stop': 283, 'bear_use_sma': False, 'bear_use_ema': True, 'bear_use_atr': False, 'bear_use_adx': True, 'bear_use_spike': True, 'bear_rsi_required': True, 'sideways_strategy': 'breakout', 'sideways_bb_std_mult': 1.790490139627466, 'sideways_rsi_os': 41, 'sideways_rsi_ob': 52, 'sideways_adx_thresh': 28.756567753162088, 'sideways_atr_min_pct': 0.02165620189597042, 'sideways_atr_max_pct': 0.02652304262537296, 'sideways_tp_mult': 1.994376902790726, 'sideways_tsl_mult': 0.6134575305077916, 'sideways_time_stop': 266, 'sideways_use_sma': False, 'sideways_use_ema': False, 'sideways_use_atr': False, 'sideways_use_adx': True, 'sideways_use_spike': False, 'sideways_rsi_required': False}.
[I 2025-08-30 21:39:12,163] Trial 407 finished with values: [-1000000000.0, 1000000000.0] and parameters: {'p_sma': 35, 'p_std': 28, 'p_atr': 23, 'p_adx': 23, 'rsi_period': 79, 'ema1': 24, 'ema2': 51, 'slip_atr_k': 0.1727835617416409, 'slip_spread_k': 0.6340279911115381, 'spread_hl_frac': 0.031297901786536846, 'bb_std_mult': 1.332880614895367, 'rsi_os': 16, 'rsi_ob': 58, 'vol_spike': 0.15863215505601033, 'adx_thresh': 18.983722644063754, 'atr_min_pct': 0.009648878546408817, 'atr_max_pct': 0.14156598222131989, 'tp_mult': 1.3706835320516821, 'tsl_mult': 0.9923496351753198, 'strategy': 'mean_reversion', 'time_stop': 264, 'use_sma': True, 'use_atr': True, 'use_adx': True, 'use_ema': True, 'use_spike': True, 'rsi_required': True, 'edge_k': 1.488209955920339, 'edge_cap': 0.8509027519093912, 'bull_strategy': 'breakout', 'bull_bb_std_mult': 2.618910493012467, 'bull_rsi_os': 15, 'bull_rsi_ob': 91, 'bull_adx_thresh': 13.39931116027465, 'bull_atr_min_pct': 0.01715885731722582, 'bull_atr_max_pct': 0.04188004023924629, 'bull_tp_mult': 1.8588804144302193, 'bull_tsl_mult': 0.37114511140039436, 'bull_time_stop': 285, 'bull_use_sma': True, 'bull_use_ema': False, 'bull_use_atr': False, 'bull_use_adx': False, 'bull_use_spike': False, 'bull_rsi_required': True, 'bear_strategy': 'mean_reversion', 'bear_bb_std_mult': 2.7714155371788047, 'bear_rsi_os': 33, 'bear_rsi_ob': 81, 'bear_adx_thresh': 15.394939287432642, 'bear_atr_min_pct': 0.02885742324392506, 'bear_atr_max_pct': 0.0383758679708615, 'bear_tp_mult': 1.810556161954719, 'bear_tsl_mult': 0.4093370658731047, 'bear_time_stop': 229, 'bear_use_sma': False, 'bear_use_ema': True, 'bear_use_atr': False, 'bear_use_adx': True, 'bear_use_spike': True, 'bear_rsi_required': True, 'sideways_strategy': 'breakout', 'sideways_bb_std_mult': 3.507720144134029, 'sideways_rsi_os': 14, 'sideways_rsi_ob': 88, 'sideways_adx_thresh': 34.99616847032466, 'sideways_atr_min_pct': 0.022475456038703157, 'sideways_atr_max_pct': 0.14004750237743824, 'sideways_tp_mult': 2.0059458681150955, 'sideways_tsl_mult': 0.9521774236656768, 'sideways_time_stop': 265, 'sideways_use_sma': False, 'sideways_use_ema': False, 'sideways_use_atr': False, 'sideways_use_adx': True, 'sideways_use_spike': False, 'sideways_rsi_required': False}.
[I 2025-08-30 21:39:44,290] Trial 409 finished with values: [-1000000000.0, 1000000000.0] and parameters: {'p_sma': 54, 'p_std': 28, 'p_atr': 23, 'p_adx': 22, 'rsi_period': 79, 'ema1': 8, 'ema2': 20, 'slip_atr_k': 0.023874428196377334, 'slip_spread_k': 0.6361556249201069, 'spread_hl_frac': 0.031165914294033804, 'bb_std_mult': 2.057859535818057, 'rsi_os': 16, 'rsi_ob': 71, 'vol_spike': 0.2998530558659308, 'adx_thresh': 9.61457653276261, 'atr_min_pct': 0.0077818840343942194, 'atr_max_pct': 0.09975688639001459, 'tp_mult': 1.686557167690014, 'tsl_mult': 0.8667005679275075, 'strategy': 'mean_reversion', 'time_stop': 22, 'use_sma': True, 'use_atr': True, 'use_adx': True, 'use_ema': True, 'use_spike': True, 'rsi_required': True, 'edge_k': 1.2632437792403035, 'edge_cap': 0.3664349557326348, 'bull_strategy': 'mean_reversion', 'bull_bb_std_mult': 2.4940058979696746, 'bull_rsi_os': 9, 'bull_rsi_ob': 91, 'bull_adx_thresh': 13.193950139884945, 'bull_atr_min_pct': 0.00929319764994498, 'bull_atr_max_pct': 0.07496248386759329, 'bull_tp_mult': 1.0992731316531117, 'bull_tsl_mult': 0.3800543982282941, 'bull_time_stop': 62, 'bull_use_sma': True, 'bull_use_ema': False, 'bull_use_atr': False, 'bull_use_adx': False, 'bull_use_spike': False, 'bull_rsi_required': True, 'bear_strategy': 'mean_reversion', 'bear_bb_std_mult': 2.7709382011279344, 'bear_rsi_os': 33, 'bear_rsi_ob': 75, 'bear_adx_thresh': 14.493987515658098, 'bear_atr_min_pct': 0.029546369076494522, 'bear_atr_max_pct': 0.019359301696030545, 'bear_tp_mult': 1.7911053605480411, 'bear_tsl_mult': 0.411230895118309, 'bear_time_stop': 287, 'bear_use_sma': False, 'bear_use_ema': True, 'bear_use_atr': False, 'bear_use_adx': True, 'bear_use_spike': True, 'bear_rsi_required': True, 'sideways_strategy': 'breakout', 'sideways_bb_std_mult': 2.254780446794136, 'sideways_rsi_os': 51, 'sideways_rsi_ob': 45, 'sideways_adx_thresh': 24.522980246143632, 'sideways_atr_min_pct': 0.026055776294849908, 'sideways_atr_max_pct': 0.13908723734623418, 'sideways_tp_mult': 1.9001166899911843, 'sideways_tsl_mult': 0.6325828687098926, 'sideways_time_stop': 268, 'sideways_use_sma': False, 'sideways_use_ema': False, 'sideways_use_atr': False, 'sideways_use_adx': True, 'sideways_use_spike': False, 'sideways_rsi_required': False}.
[I 2025-08-30 21:39:44,644] Trial 408 finished with values: [-1000000000.0, 1000000000.0] and parameters: {'p_sma': 23, 'p_std': 46, 'p_atr': 23, 'p_adx': 17, 'rsi_period': 79, 'ema1': 19, 'ema2': 58, 'slip_atr_k': 0.021968174750919757, 'slip_spread_k': 0.6246993596804352, 'spread_hl_frac': 0.030701873636934815, 'bb_std_mult': 0.729890884818696, 'rsi_os': 15, 'rsi_ob': 69, 'vol_spike': 0.2793307881687732, 'adx_thresh': 15.736640397753646, 'atr_min_pct': 0.013251167425625106, 'atr_max_pct': 0.10435497214477629, 'tp_mult': 2.761474902908706, 'tsl_mult': 0.024487445604770064, 'strategy': 'mean_reversion', 'time_stop': 21, 'use_sma': True, 'use_atr': True, 'use_adx': True, 'use_ema': True, 'use_spike': True, 'rsi_required': True, 'edge_k': 1.2724689237170446, 'edge_cap': 0.6973357229435574, 'bull_strategy': 'mean_reversion', 'bull_bb_std_mult': 2.6069426270917244, 'bull_rsi_os': 25, 'bull_rsi_ob': 91, 'bull_adx_thresh': 24.58402932863568, 'bull_atr_min_pct': 0.0009164968464974047, 'bull_atr_max_pct': 0.03247297303390913, 'bull_tp_mult': 1.4611323666632126, 'bull_tsl_mult': 0.3827648929928894, 'bull_time_stop': 287, 'bull_use_sma': True, 'bull_use_ema': False, 'bull_use_atr': False, 'bull_use_adx': False, 'bull_use_spike': False, 'bull_rsi_required': True, 'bear_strategy': 'mean_reversion', 'bear_bb_std_mult': 1.8605204976742757, 'bear_rsi_os': 35, 'bear_rsi_ob': 74, 'bear_adx_thresh': 25.744252819789878, 'bear_atr_min_pct': 0.02959303622073524, 'bear_atr_max_pct': 0.019693277006450988, 'bear_tp_mult': 1.8019622222347782, 'bear_tsl_mult': 0.17835507558474134, 'bear_time_stop': 294, 'bear_use_sma': False, 'bear_use_ema': True, 'bear_use_atr': False, 'bear_use_adx': True, 'bear_use_spike': True, 'bear_rsi_required': True, 'sideways_strategy': 'breakout', 'sideways_bb_std_mult': 1.8114407057533415, 'sideways_rsi_os': 52, 'sideways_rsi_ob': 45, 'sideways_adx_thresh': 28.65116723678568, 'sideways_atr_min_pct': 0.026112883628481152, 'sideways_atr_max_pct': 0.14093719762092133, 'sideways_tp_mult': 2.0566105564289385, 'sideways_tsl_mult': 0.9984090124114953, 'sideways_time_stop': 266, 'sideways_use_sma': False, 'sideways_use_ema': False, 'sideways_use_atr': False, 'sideways_use_adx': True, 'sideways_use_spike': False, 'sideways_rsi_required': False}.
[I 2025-08-30 21:39:45,242] Trial 410 finished with values: [-1000000000.0, 1000000000.0] and parameters: {'p_sma': 43, 'p_std': 8, 'p_atr': 18, 'p_adx': 18, 'rsi_period': 79, 'ema1': 18, 'ema2': 52, 'slip_atr_k': 0.23841572702104144, 'slip_spread_k': 0.6283858441102562, 'spread_hl_frac': 0.030464581698525055, 'bb_std_mult': 1.5538151590301537, 'rsi_os': 18, 'rsi_ob': 68, 'vol_spike': 0.1430227595220295, 'adx_thresh': 9.40604917085183, 'atr_min_pct': 0.013927734650385538, 'atr_max_pct': 0.0994163608922155, 'tp_mult': 1.6732461793174027, 'tsl_mult': 0.990559655822548, 'strategy': 'mean_reversion', 'time_stop': 67, 'use_sma': True, 'use_atr': True, 'use_adx': True, 'use_ema': False, 'use_spike': True, 'rsi_required': True, 'edge_k': 1.2744333786398883, 'edge_cap': 0.6578334898903022, 'bull_strategy': 'mean_reversion', 'bull_bb_std_mult': 3.065698270316008, 'bull_rsi_os': 15, 'bull_rsi_ob': 76, 'bull_adx_thresh': 11.867252231329033, 'bull_atr_min_pct': 0.0029728099789343527, 'bull_atr_max_pct': 0.08318259810100374, 'bull_tp_mult': 2.186872015702362, 'bull_tsl_mult': 0.29517062521027143, 'bull_time_stop': 252, 'bull_use_sma': True, 'bull_use_ema': False, 'bull_use_atr': False, 'bull_use_adx': True, 'bull_use_spike': False, 'bull_rsi_required': True, 'bear_strategy': 'mean_reversion', 'bear_bb_std_mult': 2.6863186586544345, 'bear_rsi_os': 33, 'bear_rsi_ob': 74, 'bear_adx_thresh': 14.543055207260316, 'bear_atr_min_pct': 0.02767363090104225, 'bear_atr_max_pct': 0.019016091022411592, 'bear_tp_mult': 1.8054221200229008, 'bear_tsl_mult': 0.6538807349643266, 'bear_time_stop': 224, 'bear_use_sma': False, 'bear_use_ema': True, 'bear_use_atr': False, 'bear_use_adx': True, 'bear_use_spike': True, 'bear_rsi_required': True, 'sideways_strategy': 'breakout', 'sideways_bb_std_mult': 3.5209787857397608, 'sideways_rsi_os': 38, 'sideways_rsi_ob': 84, 'sideways_adx_thresh': 20.64417725815301, 'sideways_atr_min_pct': 0.025818700620179623, 'sideways_atr_max_pct': 0.13760189458128916, 'sideways_tp_mult': 2.0489854463114603, 'sideways_tsl_mult': 0.5787856818786266, 'sideways_time_stop': 266, 'sideways_use_sma': False, 'sideways_use_ema': False, 'sideways_use_atr': False, 'sideways_use_adx': True, 'sideways_use_spike': False, 'sideways_rsi_required': False}.
[I 2025-08-30 21:39:45,395] Trial 411 finished with values: [-1000000000.0, 1000000000.0] and parameters: {'p_sma': 10, 'p_std': 8, 'p_atr': 18, 'p_adx': 18, 'rsi_period': 77, 'ema1': 18, 'ema2': 58, 'slip_atr_k': 0.023374035361929793, 'slip_spread_k': 0.5978097932478608, 'spread_hl_frac': 0.02951258510321301, 'bb_std_mult': 3.509546141029838, 'rsi_os': 7, 'rsi_ob': 69, 'vol_spike': 0.21719251206324752, 'adx_thresh': 15.789454343547032, 'atr_min_pct': 0.013714962752486447, 'atr_max_pct': 0.09993277267541077, 'tp_mult': 1.6909103272559627, 'tsl_mult': 0.6235450036257152, 'strategy': 'mean_reversion', 'time_stop': 70, 'use_sma': True, 'use_atr': True, 'use_adx': True, 'use_ema': False, 'use_spike': True, 'rsi_required': True, 'edge_k': 1.2716260303712286, 'edge_cap': 0.37185093478011944, 'bull_strategy': 'mean_reversion', 'bull_bb_std_mult': 2.5083772720734223, 'bull_rsi_os': 15, 'bull_rsi_ob': 76, 'bull_adx_thresh': 6.262482419982817, 'bull_atr_min_pct': 0.02833088926227219, 'bull_atr_max_pct': 0.046955579162123486, 'bull_tp_mult': 2.2030970105381855, 'bull_tsl_mult': 0.33422849937771143, 'bull_time_stop': 63, 'bull_use_sma': False, 'bull_use_ema': False, 'bull_use_atr': False, 'bull_use_adx': True, 'bull_use_spike': False, 'bull_rsi_required': True, 'bear_strategy': 'mean_reversion', 'bear_bb_std_mult': 2.7032917625702426, 'bear_rsi_os': 19, 'bear_rsi_ob': 75, 'bear_adx_thresh': 14.337420430947832, 'bear_atr_min_pct': 0.029951147108085746, 'bear_atr_max_pct': 0.019536857501952252, 'bear_tp_mult': 1.5061328240490337, 'bear_tsl_mult': 0.5346401012725148, 'bear_time_stop': 72, 'bear_use_sma': False, 'bear_use_ema': True, 'bear_use_atr': False, 'bear_use_adx': True, 'bear_use_spike': True, 'bear_rsi_required': True, 'sideways_strategy': 'breakout', 'sideways_bb_std_mult': 1.6104528653443655, 'sideways_rsi_os': 41, 'sideways_rsi_ob': 84, 'sideways_adx_thresh': 24.2172170790738, 'sideways_atr_min_pct': 0.026241459438137032, 'sideways_atr_max_pct': 0.1368275680332628, 'sideways_tp_mult': 1.9094339712636905, 'sideways_tsl_mult': 0.646032349704775, 'sideways_time_stop': 251, 'sideways_use_sma': False, 'sideways_use_ema': False, 'sideways_use_atr': False, 'sideways_use_adx': True, 'sideways_use_spike': False, 'sideways_rsi_required': False}.
[I 2025-08-30 21:40:18,121] Trial 415 finished with values: [-1000000000.0, 1000000000.0] and parameters: {'p_sma': 30, 'p_std': 32, 'p_atr': 20, 'p_adx': 20, 'rsi_period': 63, 'ema1': 12, 'ema2': 55, 'slip_atr_k': 0.0313018924765479, 'slip_spread_k': 0.09395333487351837, 'spread_hl_frac': 0.022020589428956853, 'bb_std_mult': 0.9793080173546003, 'rsi_os': 20, 'rsi_ob': 67, 'vol_spike': 0.26571540711581043, 'adx_thresh': 12.449210388234158, 'atr_min_pct': 0.0064206898483497275, 'atr_max_pct': 0.028894880898258403, 'tp_mult': 2.6310268162711106, 'tsl_mult': 0.9065534100780968, 'strategy': 'breakout', 'time_stop': 245, 'use_sma': True, 'use_atr': False, 'use_adx': False, 'use_ema': True, 'use_spike': False, 'rsi_required': True, 'edge_k': 1.197078827749464, 'edge_cap': 0.6342403055274692, 'bull_strategy': 'breakout', 'bull_bb_std_mult': 2.8252128257098983, 'bull_rsi_os': 44, 'bull_rsi_ob': 84, 'bull_adx_thresh': 15.275035339871698, 'bull_atr_min_pct': 0.001935173721598897, 'bull_atr_max_pct': 0.04966700130472261, 'bull_tp_mult': 2.242260221548995, 'bull_tsl_mult': 0.30992286849882883, 'bull_time_stop': 300, 'bull_use_sma': False, 'bull_use_ema': False, 'bull_use_atr': True, 'bull_use_adx': True, 'bull_use_spike': False, 'bull_rsi_required': False, 'bear_strategy': 'breakout', 'bear_bb_std_mult': 2.639533346411481, 'bear_rsi_os': 12, 'bear_rsi_ob': 70, 'bear_adx_thresh': 9.70093443434428, 'bear_atr_min_pct': 0.028904434623537114, 'bear_atr_max_pct': 0.01304597596855944, 'bear_tp_mult': 1.5671309594905989, 'bear_tsl_mult': 0.36264906771329214, 'bear_time_stop': 110, 'bear_use_sma': False, 'bear_use_ema': True, 'bear_use_atr': False, 'bear_use_adx': True, 'bear_use_spike': True, 'bear_rsi_required': False, 'sideways_strategy': 'mean_reversion', 'sideways_bb_std_mult': 0.9582530334100756, 'sideways_rsi_os': 37, 'sideways_rsi_ob': 86, 'sideways_adx_thresh': 9.136563046149208, 'sideways_atr_min_pct': 0.02540973875015857, 'sideways_atr_max_pct': 0.14744326080988807, 'sideways_tp_mult': 1.9442735363243613, 'sideways_tsl_mult': 0.9174527052272893, 'sideways_time_stop': 106, 'sideways_use_sma': False, 'sideways_use_ema': False, 'sideways_use_atr': False, 'sideways_use_adx': True, 'sideways_use_spike': False, 'sideways_rsi_required': False}.
[I 2025-08-30 21:40:18,128] Trial 412 finished with values: [-1000000000.0, 1000000000.0] and parameters: {'p_sma': 31, 'p_std': 46, 'p_atr': 18, 'p_adx': 23, 'rsi_period': 75, 'ema1': 18, 'ema2': 37, 'slip_atr_k': 0.2168918714524099, 'slip_spread_k': 0.5957925659680972, 'spread_hl_frac': 0.0291925521441322, 'bb_std_mult': 1.5314431817062435, 'rsi_os': 7, 'rsi_ob': 68, 'vol_spike': 0.007948834973111829, 'adx_thresh': 15.599424859208792, 'atr_min_pct': 0.013953076851995476, 'atr_max_pct': 0.10458668373963355, 'tp_mult': 1.7212321753711786, 'tsl_mult': 0.22499576156472595, 'strategy': 'mean_reversion', 'time_stop': 137, 'use_sma': True, 'use_atr': True, 'use_adx': True, 'use_ema': False, 'use_spike': True, 'rsi_required': True, 'edge_k': 1.6166787310782391, 'edge_cap': 0.6704348604915934, 'bull_strategy': 'mean_reversion', 'bull_bb_std_mult': 2.8122140900265307, 'bull_rsi_os': 37, 'bull_rsi_ob': 76, 'bull_adx_thresh': 15.239473694893643, 'bull_atr_min_pct': 0.003129746696240848, 'bull_atr_max_pct': 0.04806178707468193, 'bull_tp_mult': 2.2050944046742025, 'bull_tsl_mult': 0.30997831826641126, 'bull_time_stop': 296, 'bull_use_sma': False, 'bull_use_ema': False, 'bull_use_atr': False, 'bull_use_adx': True, 'bull_use_spike': False, 'bull_rsi_required': False, 'bear_strategy': 'mean_reversion', 'bear_bb_std_mult': 2.6593240036734196, 'bear_rsi_os': 13, 'bear_rsi_ob': 76, 'bear_adx_thresh': 34.21438126970321, 'bear_atr_min_pct': 0.027269432900854526, 'bear_atr_max_pct': 0.013555772595485054, 'bear_tp_mult': 1.5055103184622938, 'bear_tsl_mult': 0.3617591421135116, 'bear_time_stop': 109, 'bear_use_sma': False, 'bear_use_ema': True, 'bear_use_atr': False, 'bear_use_adx': True, 'bear_use_spike': True, 'bear_rsi_required': True, 'sideways_strategy': 'breakout', 'sideways_bb_std_mult': 1.6214311620652238, 'sideways_rsi_os': 38, 'sideways_rsi_ob': 47, 'sideways_adx_thresh': 20.788183880928845, 'sideways_atr_min_pct': 0.025160724911362342, 'sideways_atr_max_pct': 0.14782241890702763, 'sideways_tp_mult': 2.882840526567734, 'sideways_tsl_mult': 0.9942857966887468, 'sideways_time_stop': 255, 'sideways_use_sma': False, 'sideways_use_ema': False, 'sideways_use_atr': False, 'sideways_use_adx': True, 'sideways_use_spike': False, 'sideways_rsi_required': False}.
