[I 2025-08-30 21:11:49,830] Trial 199 finished with values: [-1000000000.0, 1000000000.0] and parameters: {'p_sma': 15, 'p_std': 35, 'p_atr': 20, 'p_adx': 20, 'rsi_period': 18, 'ema1': 20, 'ema2': 17, 'slip_atr_k': 0.0270275847360201, 'slip_spread_k': 0.8142588062736255, 'spread_hl_frac': 0.022157545076818608, 'bb_std_mult': 1.1531453189653589, 'rsi_os': 40, 'rsi_ob': 71, 'vol_spike': 0.17494242971534135, 'adx_thresh': 13.368096382139646, 'atr_min_pct': 0.018571495155741358, 'atr_max_pct': 0.09669480626928316, 'tp_mult': 1.945068912327876, 'tsl_mult': 0.8845767791050065, 'strategy': 'breakout', 'time_stop': 5, 'use_sma': True, 'use_atr': False, 'use_adx': False, 'use_ema': False, 'use_spike': False, 'rsi_required': False, 'edge_k': 1.804306736943012, 'edge_cap': 0.5731669353073208, 'bull_strategy': 'breakout', 'bull_bb_std_mult': 3.302954463230153, 'bull_rsi_os': 17, 'bull_rsi_ob': 70, 'bull_adx_thresh': 12.203565427957027, 'bull_atr_min_pct': 0.006414250759805208, 'bull_atr_max_pct': 0.05062029963048943, 'bull_tp_mult': 2.081918255617176, 'bull_tsl_mult': 0.09621566249630273, 'bull_time_stop': 286, 'bull_use_sma': False, 'bull_use_ema': True, 'bull_use_atr': True, 'bull_use_adx': False, 'bull_use_spike': True, 'bull_rsi_required': False, 'bear_strategy': 'mean_reversion', 'bear_bb_std_mult': 2.7352458099767656, 'bear_rsi_os': 47, 'bear_rsi_ob': 48, 'bear_adx_thresh': 17.716609647270133, 'bear_atr_min_pct': 0.0051598795922518335, 'bear_atr_max_pct': 0.02512884117566158, 'bear_tp_mult': 2.9999762787863062, 'bear_tsl_mult': 0.32790606427889923, 'bear_time_stop': 13, 'bear_use_sma': False, 'bear_use_ema': False, 'bear_use_atr': False, 'bear_use_adx': True, 'bear_use_spike': False, 'bear_rsi_required': False, 'sideways_strategy': 'breakout', 'sideways_bb_std_mult': 1.537669521772996, 'sideways_rsi_os': 39, 'sideways_rsi_ob': 48, 'sideways_adx_thresh': 19.550777569151165, 'sideways_atr_min_pct': 0.008908965509220566, 'sideways_atr_max_pct': 0.022350489443324767, 'sideways_tp_mult': 2.1302795997758976, 'sideways_tsl_mult': 0.2678447926363928, 'sideways_time_stop': 232, 'sideways_use_sma': True, 'sideways_use_ema': True, 'sideways_use_atr': True, 'sideways_use_adx': False, 'sideways_use_spike': True, 'sideways_rsi_required': True}.
[I 2025-08-30 21:11:50,085] Trial 197 finished with values: [-1000000000.0, 1000000000.0] and parameters: {'p_sma': 38, 'p_std': 36, 'p_atr': 20, 'p_adx': 29, 'rsi_period': 18, 'ema1': 13, 'ema2': 50, 'slip_atr_k': 0.022259025882522022, 'slip_spread_k': 0.7994488748103716, 'spread_hl_frac': 0.04132454933110914, 'bb_std_mult': 2.0470199363180597, 'rsi_os': 20, 'rsi_ob': 75, 'vol_spike': 0.1759868740033576, 'adx_thresh': 24.229325960130865, 'atr_min_pct': 0.018887645224603615, 'atr_max_pct': 0.09602085167961921, 'tp_mult': 2.0256262434140413, 'tsl_mult': 0.35431978727091207, 'strategy': 'breakout', 'time_stop': 24, 'use_sma': True, 'use_atr': False, 'use_adx': False, 'use_ema': True, 'use_spike': False, 'rsi_required': False, 'edge_k': 1.5499228117439081, 'edge_cap': 0.8611062198087462, 'bull_strategy': 'breakout', 'bull_bb_std_mult': 3.49516971304326, 'bull_rsi_os': 17, 'bull_rsi_ob': 69, 'bull_adx_thresh': 12.808637853603692, 'bull_atr_min_pct': 0.0013029782148274499, 'bull_atr_max_pct': 0.05821068262070991, 'bull_tp_mult': 2.0698444135487035, 'bull_tsl_mult': 0.08387748349160085, 'bull_time_stop': 293, 'bull_use_sma': False, 'bull_use_ema': True, 'bull_use_atr': True, 'bull_use_adx': True, 'bull_use_spike': True, 'bull_rsi_required': False, 'bear_strategy': 'mean_reversion', 'bear_bb_std_mult': 1.1253791287745187, 'bear_rsi_os': 47, 'bear_rsi_ob': 49, 'bear_adx_thresh': 25.987243689182968, 'bear_atr_min_pct': 0.005066667242209397, 'bear_atr_max_pct': 0.03414514636136476, 'bear_tp_mult': 2.573016423401344, 'bear_tsl_mult': 0.04883754121467421, 'bear_time_stop': 19, 'bear_use_sma': True, 'bear_use_ema': False, 'bear_use_atr': False, 'bear_use_adx': True, 'bear_use_spike': False, 'bear_rsi_required': False, 'sideways_strategy': 'breakout', 'sideways_bb_std_mult': 2.5631603192680457, 'sideways_rsi_os': 39, 'sideways_rsi_ob': 68, 'sideways_adx_thresh': 5.871105675500967, 'sideways_atr_min_pct': 0.020870762659350242, 'sideways_atr_max_pct': 0.013060662819074932, 'sideways_tp_mult': 1.3136767339811974, 'sideways_tsl_mult': 0.07425126041864322, 'sideways_time_stop': 137, 'sideways_use_sma': True, 'sideways_use_ema': True, 'sideways_use_atr': True, 'sideways_use_adx': False, 'sideways_use_spike': True, 'sideways_rsi_required': True}.
[I 2025-08-30 21:12:22,901] Trial 203 finished with values: [-1000000000.0, 1000000000.0] and parameters: {'p_sma': 5, 'p_std': 37, 'p_atr': 26, 'p_adx': 30, 'rsi_period': 42, 'ema1': 10, 'ema2': 45, 'slip_atr_k': 0.22599228832602347, 'slip_spread_k': 0.7398997323400157, 'spread_hl_frac': 0.04265472499060392, 'bb_std_mult': 0.9052840549469268, 'rsi_os': 37, 'rsi_ob': 78, 'vol_spike': 0.18291005985256537, 'adx_thresh': 23.42377920443956, 'atr_min_pct': 0.00272298074808884, 'atr_max_pct': 0.09087807521109008, 'tp_mult': 1.8084998464493056, 'tsl_mult': 0.19580295400840142, 'strategy': 'mean_reversion', 'time_stop': 118, 'use_sma': False, 'use_atr': True, 'use_adx': True, 'use_ema': False, 'use_spike': True, 'rsi_required': True, 'edge_k': 0.6502225496391686, 'edge_cap': 0.6239171356238189, 'bull_strategy': 'mean_reversion', 'bull_bb_std_mult': 2.2789828663311256, 'bull_rsi_os': 14, 'bull_rsi_ob': 71, 'bull_adx_thresh': 24.009527339539282, 'bull_atr_min_pct': 0.010420910098265557, 'bull_atr_max_pct': 0.047096838146934286, 'bull_tp_mult': 2.2553522200188554, 'bull_tsl_mult': 0.16329133696104395, 'bull_time_stop': 184, 'bull_use_sma': True, 'bull_use_ema': False, 'bull_use_atr': False, 'bull_use_adx': True, 'bull_use_spike': False, 'bull_rsi_required': True, 'bear_strategy': 'breakout', 'bear_bb_std_mult': 3.5062196423087952, 'bear_rsi_os': 9, 'bear_rsi_ob': 92, 'bear_adx_thresh': 15.986834008183102, 'bear_atr_min_pct': 0.015515886314387184, 'bear_atr_max_pct': 0.08656726270468673, 'bear_tp_mult': 2.941954652888449, 'bear_tsl_mult': 0.13977177979784916, 'bear_time_stop': 256, 'bear_use_sma': False, 'bear_use_ema': False, 'bear_use_atr': True, 'bear_use_adx': False, 'bear_use_spike': True, 'bear_rsi_required': True, 'sideways_strategy': 'mean_reversion', 'sideways_bb_std_mult': 3.523066926273187, 'sideways_rsi_os': 37, 'sideways_rsi_ob': 75, 'sideways_adx_thresh': 32.863898910505036, 'sideways_atr_min_pct': 0.009910112064063448, 'sideways_atr_max_pct': 0.053823200802007566, 'sideways_tp_mult': 1.9855678155787295, 'sideways_tsl_mult': 0.3219883778810587, 'sideways_time_stop': 126, 'sideways_use_sma': False, 'sideways_use_ema': False, 'sideways_use_atr': False, 'sideways_use_adx': True, 'sideways_use_spike': False, 'sideways_rsi_required': False}.
[I 2025-08-30 21:12:23,979] Trial 202 finished with values: [-1000000000.0, 1000000000.0] and parameters: {'p_sma': 35, 'p_std': 39, 'p_atr': 26, 'p_adx': 30, 'rsi_period': 15, 'ema1': 15, 'ema2': 11, 'slip_atr_k': 0.22863707821593932, 'slip_spread_k': 0.9987936688696688, 'spread_hl_frac': 0.005615430247882714, 'bb_std_mult': 2.045307606862524, 'rsi_os': 46, 'rsi_ob': 78, 'vol_spike': 0.2890250907357345, 'adx_thresh': 9.342079226602833, 'atr_min_pct': 0.009478691078472603, 'atr_max_pct': 0.09129420398144794, 'tp_mult': 1.4779712463752823, 'tsl_mult': 0.18013526175093403, 'strategy': 'mean_reversion', 'time_stop': 82, 'use_sma': False, 'use_atr': True, 'use_adx': True, 'use_ema': False, 'use_spike': True, 'rsi_required': True, 'edge_k': 1.5137466621605986, 'edge_cap': 0.6573917548013495, 'bull_strategy': 'mean_reversion', 'bull_bb_std_mult': 2.028514755081562, 'bull_rsi_os': 14, 'bull_rsi_ob': 71, 'bull_adx_thresh': 30.194178016079228, 'bull_atr_min_pct': 4.796353900656577e-05, 'bull_atr_max_pct': 0.054817922837450586, 'bull_tp_mult': 2.6623018662309943, 'bull_tsl_mult': 0.3351404372035488, 'bull_time_stop': 184, 'bull_use_sma': True, 'bull_use_ema': False, 'bull_use_atr': False, 'bull_use_adx': True, 'bull_use_spike': False, 'bull_rsi_required': True, 'bear_strategy': 'breakout', 'bear_bb_std_mult': 2.81893374727031, 'bear_rsi_os': 48, 'bear_rsi_ob': 49, 'bear_adx_thresh': 15.967144980799127, 'bear_atr_min_pct': 0.016738751834413507, 'bear_atr_max_pct': 0.028455193469671954, 'bear_tp_mult': 2.942722863170336, 'bear_tsl_mult': 0.07549424296248713, 'bear_time_stop': 257, 'bear_use_sma': True, 'bear_use_ema': False, 'bear_use_atr': True, 'bear_use_adx': False, 'bear_use_spike': True, 'bear_rsi_required': True, 'sideways_strategy': 'mean_reversion', 'sideways_bb_std_mult': 1.8206691065996403, 'sideways_rsi_os': 37, 'sideways_rsi_ob': 68, 'sideways_adx_thresh': 29.612976658151094, 'sideways_atr_min_pct': 0.021466445245707982, 'sideways_atr_max_pct': 0.052841974444899326, 'sideways_tp_mult': 2.63917238818605, 'sideways_tsl_mult': 0.38802728967675587, 'sideways_time_stop': 125, 'sideways_use_sma': False, 'sideways_use_ema': False, 'sideways_use_atr': False, 'sideways_use_adx': True, 'sideways_use_spike': False, 'sideways_rsi_required': False}.
[I 2025-08-30 21:12:24,908] Trial 200 finished with values: [-1000000000.0, 1000000000.0] and parameters: {'p_sma': 5, 'p_std': 36, 'p_atr': 10, 'p_adx': 30, 'rsi_period': 18, 'ema1': 20, 'ema2': 34, 'slip_atr_k': 0.0218861889027059, 'slip_spread_k': 0.7361001678464933, 'spread_hl_frac': 0.0499430722140579, 'bb_std_mult': 2.763424954914793, 'rsi_os': 40, 'rsi_ob': 71, 'vol_spike': 0.2572978494293422, 'adx_thresh': 9.251765509524896, 'atr_min_pct': 0.01849890399236794, 'atr_max_pct': 0.09778925740485822, 'tp_mult': 1.7983960507384795, 'tsl_mult': 0.8832872241135785, 'strategy': 'breakout', 'time_stop': 211, 'use_sma': True, 'use_atr': True, 'use_adx': False, 'use_ema': False, 'use_spike': False, 'rsi_required': False, 'edge_k': 1.723542366983058, 'edge_cap': 0.11939168307562747, 'bull_strategy': 'mean_reversion', 'bull_bb_std_mult': 3.557873510186293, 'bull_rsi_os': 17, 'bull_rsi_ob': 82, 'bull_adx_thresh': 20.90214669230498, 'bull_atr_min_pct': 0.025648593826125398, 'bull_atr_max_pct': 0.018180465027532705, 'bull_tp_mult': 1.9825485566478627, 'bull_tsl_mult': 0.09079908340106217, 'bull_time_stop': 286, 'bull_use_sma': False, 'bull_use_ema': True, 'bull_use_atr': True, 'bull_use_adx': False, 'bull_use_spike': True, 'bull_rsi_required': False, 'bear_strategy': 'breakout', 'bear_bb_std_mult': 3.5144928355919682, 'bear_rsi_os': 9, 'bear_rsi_ob': 92, 'bear_adx_thresh': 17.858555927052322, 'bear_atr_min_pct': 0.028827749383221198, 'bear_atr_max_pct': 0.0253523175404138, 'bear_tp_mult': 2.9429209093588535, 'bear_tsl_mult': 0.16869090298731032, 'bear_time_stop': 274, 'bear_use_sma': False, 'bear_use_ema': False, 'bear_use_atr': True, 'bear_use_adx': True, 'bear_use_spike': False, 'bear_rsi_required': False, 'sideways_strategy': 'mean_reversion', 'sideways_bb_std_mult': 1.402800524928972, 'sideways_rsi_os': 39, 'sideways_rsi_ob': 68, 'sideways_adx_thresh': 14.162419033553325, 'sideways_atr_min_pct': 0.00031780590750966724, 'sideways_atr_max_pct': 0.12019305083389155, 'sideways_tp_mult': 2.8139769841510143, 'sideways_tsl_mult': 0.26737967666212203, 'sideways_time_stop': 190, 'sideways_use_sma': True, 'sideways_use_ema': True, 'sideways_use_atr': True, 'sideways_use_adx': False, 'sideways_use_spike': True, 'sideways_rsi_required': True}.
[I 2025-08-30 21:12:25,098] Trial 201 finished with values: [-1000000000.0, 1000000000.0] and parameters: {'p_sma': 15, 'p_std': 52, 'p_atr': 26, 'p_adx': 20, 'rsi_period': 18, 'ema1': 13, 'ema2': 45, 'slip_atr_k': 0.2164332577471155, 'slip_spread_k': 0.5979657760655426, 'spread_hl_frac': 0.005380575437651226, 'bb_std_mult': 1.6652558258437526, 'rsi_os': 12, 'rsi_ob': 71, 'vol_spike': 0.17768239515492135, 'adx_thresh': 13.422421958761372, 'atr_min_pct': 0.009432347195296488, 'atr_max_pct': 0.09086688070228413, 'tp_mult': 1.8006375269246226, 'tsl_mult': 0.18023738234266762, 'strategy': 'mean_reversion', 'time_stop': 21, 'use_sma': True, 'use_atr': True, 'use_adx': True, 'use_ema': False, 'use_spike': True, 'rsi_required': False, 'edge_k': 1.8563210039819316, 'edge_cap': 0.1179257137961765, 'bull_strategy': 'mean_reversion', 'bull_bb_std_mult': 3.539376673145495, 'bull_rsi_os': 10, 'bull_rsi_ob': 71, 'bull_adx_thresh': 12.234565579853609, 'bull_atr_min_pct': 0.025675596055694746, 'bull_atr_max_pct': 0.09062786669162617, 'bull_tp_mult': 1.2902624478497104, 'bull_tsl_mult': 0.4189754887484194, 'bull_time_stop': 287, 'bull_use_sma': False, 'bull_use_ema': True, 'bull_use_atr': False, 'bull_use_adx': False, 'bull_use_spike': True, 'bull_rsi_required': True, 'bear_strategy': 'breakout', 'bear_bb_std_mult': 0.5881139605320869, 'bear_rsi_os': 47, 'bear_rsi_ob': 49, 'bear_adx_thresh': 17.603578509868786, 'bear_atr_min_pct': 0.004852049262394966, 'bear_atr_max_pct': 0.025667702562853806, 'bear_tp_mult': 1.4261016766166965, 'bear_tsl_mult': 0.14006698368383408, 'bear_time_stop': 257, 'bear_use_sma': False, 'bear_use_ema': False, 'bear_use_atr': True, 'bear_use_adx': True, 'bear_use_spike': False, 'bear_rsi_required': True, 'sideways_strategy': 'mean_reversion', 'sideways_bb_std_mult': 3.5167000183116794, 'sideways_rsi_os': 37, 'sideways_rsi_ob': 68, 'sideways_adx_thresh': 32.92198823967754, 'sideways_atr_min_pct': 0.009818565642516479, 'sideways_atr_max_pct': 0.012766088374978045, 'sideways_tp_mult': 2.822785173388323, 'sideways_tsl_mult': 0.3846333054632155, 'sideways_time_stop': 126, 'sideways_use_sma': True, 'sideways_use_ema': True, 'sideways_use_atr': True, 'sideways_use_adx': False, 'sideways_use_spike': True, 'sideways_rsi_required': True}.
[I 2025-08-30 21:12:59,281] Trial 204 finished with values: [-1000000000.0, 1000000000.0] and parameters: {'p_sma': 28, 'p_std': 34, 'p_atr': 14, 'p_adx': 30, 'rsi_period': 38, 'ema1': 19, 'ema2': 44, 'slip_atr_k': 0.044126830859821456, 'slip_spread_k': 0.4303611535647287, 'spread_hl_frac': 0.00529880817169328, 'bb_std_mult': 1.6692476326284855, 'rsi_os': 45, 'rsi_ob': 73, 'vol_spike': 0.27675220256260535, 'adx_thresh': 23.58132435958596, 'atr_min_pct': 0.001103747175277525, 'atr_max_pct': 0.14515884857621592, 'tp_mult': 1.604446306867924, 'tsl_mult': 0.819100386187451, 'strategy': 'mean_reversion', 'time_stop': 102, 'use_sma': False, 'use_atr': True, 'use_adx': True, 'use_ema': True, 'use_spike': True, 'rsi_required': True, 'edge_k': 0.6929182575192138, 'edge_cap': 0.6531694349559729, 'bull_strategy': 'breakout', 'bull_bb_std_mult': 1.405293397358863, 'bull_rsi_os': 29, 'bull_rsi_ob': 71, 'bull_adx_thresh': 29.667791148993544, 'bull_atr_min_pct': 0.0005948890327921758, 'bull_atr_max_pct': 0.10162999844412784, 'bull_tp_mult': 1.9910844706223956, 'bull_tsl_mult': 0.2438110773220438, 'bull_time_stop': 290, 'bull_use_sma': True, 'bull_use_ema': False, 'bull_use_atr': False, 'bull_use_adx': True, 'bull_use_spike': True, 'bull_rsi_required': True, 'bear_strategy': 'mean_reversion', 'bear_bb_std_mult': 1.2819323920388923, 'bear_rsi_os': 51, 'bear_rsi_ob': 95, 'bear_adx_thresh': 16.928906854158402, 'bear_atr_min_pct': 0.0034553082187949342, 'bear_atr_max_pct': 0.010989648737310296, 'bear_tp_mult': 2.089054043921837, 'bear_tsl_mult': 0.27614725994705697, 'bear_time_stop': 110, 'bear_use_sma': True, 'bear_use_ema': False, 'bear_use_atr': False, 'bear_use_adx': True, 'bear_use_spike': True, 'bear_rsi_required': True, 'sideways_strategy': 'breakout', 'sideways_bb_std_mult': 0.7985982503115565, 'sideways_rsi_os': 53, 'sideways_rsi_ob': 65, 'sideways_adx_thresh': 31.77734394259807, 'sideways_atr_min_pct': 0.008129337200652278, 'sideways_atr_max_pct': 0.0102958908036314, 'sideways_tp_mult': 1.9219842378164378, 'sideways_tsl_mult': 0.11409725766161372, 'sideways_time_stop': 266, 'sideways_use_sma': False, 'sideways_use_ema': True, 'sideways_use_atr': True, 'sideways_use_adx': False, 'sideways_use_spike': False, 'sideways_rsi_required': True}.
[I 2025-08-30 21:12:59,339] Trial 206 finished with values: [-1000000000.0, 1000000000.0] and parameters: {'p_sma': 28, 'p_std': 34, 'p_atr': 12, 'p_adx': 24, 'rsi_period': 70, 'ema1': 14, 'ema2': 44, 'slip_atr_k': 0.1112904283290527, 'slip_spread_k': 0.5171593155255951, 'spread_hl_frac': 0.014294834526633665, 'bb_std_mult': 1.6435211050349205, 'rsi_os': 44, 'rsi_ob': 73, 'vol_spike': 0.0793518099701304, 'adx_thresh': 22.506208380090936, 'atr_min_pct': 7.417367238029678e-05, 'atr_max_pct': 0.14335603550106607, 'tp_mult': 1.5973908690821526, 'tsl_mult': 0.5995425488850694, 'strategy': 'mean_reversion', 'time_stop': 57, 'use_sma': False, 'use_atr': True, 'use_adx': True, 'use_ema': True, 'use_spike': True, 'rsi_required': True, 'edge_k': 0.7020393022117203, 'edge_cap': 0.8004587605887263, 'bull_strategy': 'breakout', 'bull_bb_std_mult': 3.5988472424510487, 'bull_rsi_os': 34, 'bull_rsi_ob': 72, 'bull_adx_thresh': 26.354577862071093, 'bull_atr_min_pct': 0.0007022481065670022, 'bull_atr_max_pct': 0.05138436140808568, 'bull_tp_mult': 2.576282626442553, 'bull_tsl_mult': 0.24916433037934732, 'bull_time_stop': 292, 'bull_use_sma': True, 'bull_use_ema': False, 'bull_use_atr': False, 'bull_use_adx': True, 'bull_use_spike': True, 'bull_rsi_required': True, 'bear_strategy': 'mean_reversion', 'bear_bb_std_mult': 2.5344432004255584, 'bear_rsi_os': 51, 'bear_rsi_ob': 52, 'bear_adx_thresh': 17.025778819034628, 'bear_atr_min_pct': 0.0036091872929412006, 'bear_atr_max_pct': 0.010476506588822727, 'bear_tp_mult': 1.3392140696962829, 'bear_tsl_mult': 0.41205873745489824, 'bear_time_stop': 111, 'bear_use_sma': True, 'bear_use_ema': False, 'bear_use_atr': False, 'bear_use_adx': True, 'bear_use_spike': True, 'bear_rsi_required': True, 'sideways_strategy': 'breakout', 'sideways_bb_std_mult': 2.691568028484198, 'sideways_rsi_os': 42, 'sideways_rsi_ob': 65, 'sideways_adx_thresh': 31.685731603437144, 'sideways_atr_min_pct': 0.007940821867400267, 'sideways_atr_max_pct': 0.012574433035278706, 'sideways_tp_mult': 1.684415781628347, 'sideways_tsl_mult': 0.9052234925648053, 'sideways_time_stop': 129, 'sideways_use_sma': False, 'sideways_use_ema': True, 'sideways_use_atr': True, 'sideways_use_adx': False, 'sideways_use_spike': False, 'sideways_rsi_required': True}.
[I 2025-08-30 21:12:59,538] Trial 205 finished with values: [-0.027906106004935816, 0.027845859612101946] and parameters: {'p_sma': 28, 'p_std': 5, 'p_atr': 25, 'p_adx': 24, 'rsi_period': 70, 'ema1': 19, 'ema2': 44, 'slip_atr_k': 0.04494749487500013, 'slip_spread_k': 0.7402069676739527, 'spread_hl_frac': 0.005270262388763276, 'bb_std_mult': 0.7794730803262966, 'rsi_os': 44, 'rsi_ob': 79, 'vol_spike': 0.08241373837509333, 'adx_thresh': 16.76690002273196, 'atr_min_pct': 0.02847509977834349, 'atr_max_pct': 0.14222427668338533, 'tp_mult': 1.5928343680221102, 'tsl_mult': 0.8153067569233091, 'strategy': 'mean_reversion', 'time_stop': 211, 'use_sma': False, 'use_atr': True, 'use_adx': True, 'use_ema': True, 'use_spike': True, 'rsi_required': True, 'edge_k': 0.6965458270092169, 'edge_cap': 0.12246026134853705, 'bull_strategy': 'breakout', 'bull_bb_std_mult': 3.5397834173122824, 'bull_rsi_os': 55, 'bull_rsi_ob': 81, 'bull_adx_thresh': 14.03559129338725, 'bull_atr_min_pct': 0.000664133303003103, 'bull_atr_max_pct': 0.14347947676579004, 'bull_tp_mult': 1.9776752926359558, 'bull_tsl_mult': 0.25643728895642726, 'bull_time_stop': 5, 'bull_use_sma': True, 'bull_use_ema': False, 'bull_use_atr': False, 'bull_use_adx': True, 'bull_use_spike': True, 'bull_rsi_required': True, 'bear_strategy': 'mean_reversion', 'bear_bb_std_mult': 1.3008139013739286, 'bear_rsi_os': 51, 'bear_rsi_ob': 52, 'bear_adx_thresh': 7.109965285134235, 'bear_atr_min_pct': 0.017072252660203856, 'bear_atr_max_pct': 0.010077689253921964, 'bear_tp_mult': 2.9531738225234534, 'bear_tsl_mult': 0.2800239572715858, 'bear_time_stop': 111, 'bear_use_sma': True, 'bear_use_ema': False, 'bear_use_atr': False, 'bear_use_adx': True, 'bear_use_spike': True, 'bear_rsi_required': True, 'sideways_strategy': 'breakout', 'sideways_bb_std_mult': 3.3578020034040543, 'sideways_rsi_os': 16, 'sideways_rsi_ob': 65, 'sideways_adx_thresh': 31.874241723723443, 'sideways_atr_min_pct': 0.008120821655440027, 'sideways_atr_max_pct': 0.03709617326826607, 'sideways_tp_mult': 2.837809296202298, 'sideways_tsl_mult': 0.8920085848706216, 'sideways_time_stop': 217, 'sideways_use_sma': False, 'sideways_use_ema': True, 'sideways_use_atr': True, 'sideways_use_adx': False, 'sideways_use_spike': False, 'sideways_rsi_required': True}.
