[I 2025-08-30 21:48:28,356] Trial 489 finished with values: [-1000000000.0, 1000000000.0] and parameters: {'p_sma': 35, 'p_std': 55, 'p_atr': 9, 'p_adx': 19, 'rsi_period': 74, 'ema1': 12, 'ema2': 55, 'slip_atr_k': 0.23125687852261548, 'slip_spread_k': 0.9302518373305686, 'spread_hl_frac': 0.04256197355813694, 'bb_std_mult': 0.6922036184389956, 'rsi_os': 15, 'rsi_ob': 67, 'vol_spike': 0.26500888503666403, 'adx_thresh': 10.328039188484286, 'atr_min_pct': 0.028687165271260112, 'atr_max_pct': 0.02081797624174925, 'tp_mult': 2.163795692283908, 'tsl_mult': 0.9720187381402967, 'strategy': 'mean_reversion', 'time_stop': 77, 'use_sma': True, 'use_atr': True, 'use_adx': True, 'use_ema': True, 'use_spike': True, 'rsi_required': False, 'edge_k': 0.4758417030864427, 'edge_cap': 0.8177521269952769, 'bull_strategy': 'breakout', 'bull_bb_std_mult': 1.9037293381452178, 'bull_rsi_os': 21, 'bull_rsi_ob': 87, 'bull_adx_thresh': 34.41104458975559, 'bull_atr_min_pct': 0.0019405753022946784, 'bull_atr_max_pct': 0.14812718742072026, 'bull_tp_mult': 1.4049239974306214, 'bull_tsl_mult': 0.39345057350123075, 'bull_time_stop': 217, 'bull_use_sma': True, 'bull_use_ema': False, 'bull_use_atr': True, 'bull_use_adx': False, 'bull_use_spike': False, 'bull_rsi_required': True, 'bear_strategy': 'mean_reversion', 'bear_bb_std_mult': 2.183354754801504, 'bear_rsi_os': 10, 'bear_rsi_ob': 75, 'bear_adx_thresh': 26.826350918205737, 'bear_atr_min_pct': 0.005350609135392396, 'bear_atr_max_pct': 0.11894342072797097, 'bear_tp_mult': 1.1431286305899953, 'bear_tsl_mult': 0.2756250497412279, 'bear_time_stop': 232, 'bear_use_sma': False, 'bear_use_ema': True, 'bear_use_atr': True, 'bear_use_adx': True, 'bear_use_spike': False, 'bear_rsi_required': True, 'sideways_strategy': 'breakout', 'sideways_bb_std_mult': 3.462616618614136, 'sideways_rsi_os': 38, 'sideways_rsi_ob': 91, 'sideways_adx_thresh': 16.480195077163838, 'sideways_atr_min_pct': 0.020738461313163793, 'sideways_atr_max_pct': 0.12335516603225244, 'sideways_tp_mult': 2.3766310235803516, 'sideways_tsl_mult': 0.8548515802121921, 'sideways_time_stop': 282, 'sideways_use_sma': True, 'sideways_use_ema': False, 'sideways_use_atr': False, 'sideways_use_adx': True, 'sideways_use_spike': False, 'sideways_rsi_required': False}.
[I 2025-08-30 21:48:57,270] Trial 485 finished with values: [-0.018523716318456396, 0.018474102863455043] and parameters: {'p_sma': 35, 'p_std': 11, 'p_atr': 20, 'p_adx': 20, 'rsi_period': 46, 'ema1': 10, 'ema2': 56, 'slip_atr_k': 0.020643532789780587, 'slip_spread_k': 0.15089783646046817, 'spread_hl_frac': 0.03283360189844668, 'bb_std_mult': 0.9063045114529557, 'rsi_os': 41, 'rsi_ob': 63, 'vol_spike': 0.24791730169380038, 'adx_thresh': 11.681078893192636, 'atr_min_pct': 0.012596452082745457, 'atr_max_pct': 0.020520671671069888, 'tp_mult': 2.138193034706329, 'tsl_mult': 0.971395097941, 'strategy': 'breakout', 'time_stop': 100, 'use_sma': True, 'use_atr': False, 'use_adx': False, 'use_ema': False, 'use_spike': False, 'rsi_required': True, 'edge_k': 0.05796487744866574, 'edge_cap': 0.8038165309978991, 'bull_strategy': 'breakout', 'bull_bb_std_mult': 1.8797871953174707, 'bull_rsi_os': 41, 'bull_rsi_ob': 87, 'bull_adx_thresh': 20.499140953710988, 'bull_atr_min_pct': 0.0005276577571543164, 'bull_atr_max_pct': 0.14572060046671878, 'bull_tp_mult': 1.3010953425607497, 'bull_tsl_mult': 0.7150987696200937, 'bull_time_stop': 290, 'bull_use_sma': True, 'bull_use_ema': True, 'bull_use_atr': True, 'bull_use_adx': False, 'bull_use_spike': False, 'bull_rsi_required': True, 'bear_strategy': 'breakout', 'bear_bb_std_mult': 1.752669568832909, 'bear_rsi_os': 8, 'bear_rsi_ob': 61, 'bear_adx_thresh': 25.80990439329541, 'bear_atr_min_pct': 0.028692801836034933, 'bear_atr_max_pct': 0.11551082627062718, 'bear_tp_mult': 1.1355595015935884, 'bear_tsl_mult': 0.817657201989072, 'bear_time_stop': 240, 'bear_use_sma': False, 'bear_use_ema': True, 'bear_use_atr': True, 'bear_use_adx': False, 'bear_use_spike': True, 'bear_rsi_required': False, 'sideways_strategy': 'breakout', 'sideways_bb_std_mult': 1.8077126408244746, 'sideways_rsi_os': 38, 'sideways_rsi_ob': 89, 'sideways_adx_thresh': 25.80472122874792, 'sideways_atr_min_pct': 0.02701116614129547, 'sideways_atr_max_pct': 0.12310496914999139, 'sideways_tp_mult': 2.8458213433115227, 'sideways_tsl_mult': 0.6503002202830261, 'sideways_time_stop': 270, 'sideways_use_sma': True, 'sideways_use_ema': False, 'sideways_use_atr': False, 'sideways_use_adx': True, 'sideways_use_spike': True, 'sideways_rsi_required': False}.
[I 2025-08-30 21:48:57,707] Trial 486 finished with values: [-1000000000.0, 1000000000.0] and parameters: {'p_sma': 36, 'p_std': 39, 'p_atr': 20, 'p_adx': 19, 'rsi_period': 70, 'ema1': 12, 'ema2': 56, 'slip_atr_k': 0.021012894207654127, 'slip_spread_k': 0.6573033486738087, 'spread_hl_frac': 0.042362107987987244, 'bb_std_mult': 0.901970706813894, 'rsi_os': 12, 'rsi_ob': 68, 'vol_spike': 0.28131539154315643, 'adx_thresh': 11.161413255569117, 'atr_min_pct': 0.012553658956183109, 'atr_max_pct': 0.03570923246023354, 'tp_mult': 1.3844496665343973, 'tsl_mult': 0.919248176316222, 'strategy': 'breakout', 'time_stop': 88, 'use_sma': True, 'use_atr': True, 'use_adx': True, 'use_ema': False, 'use_spike': True, 'rsi_required': True, 'edge_k': 0.4728084295167476, 'edge_cap': 0.7738182298781826, 'bull_strategy': 'breakout', 'bull_bb_std_mult': 1.8544522837818125, 'bull_rsi_os': 40, 'bull_rsi_ob': 87, 'bull_adx_thresh': 10.119241150314252, 'bull_atr_min_pct': 0.0009853195206705326, 'bull_atr_max_pct': 0.10765315807645509, 'bull_tp_mult': 1.3036149523025764, 'bull_tsl_mult': 0.746314396499538, 'bull_time_stop': 218, 'bull_use_sma': True, 'bull_use_ema': True, 'bull_use_atr': True, 'bull_use_adx': False, 'bull_use_spike': False, 'bull_rsi_required': True, 'bear_strategy': 'breakout', 'bear_bb_std_mult': 2.1780672959939023, 'bear_rsi_os': 6, 'bear_rsi_ob': 75, 'bear_adx_thresh': 25.250913820742625, 'bear_atr_min_pct': 0.028786221207548625, 'bear_atr_max_pct': 0.11866293506711496, 'bear_tp_mult': 2.373316558858085, 'bear_tsl_mult': 0.4080308956490566, 'bear_time_stop': 241, 'bear_use_sma': False, 'bear_use_ema': True, 'bear_use_atr': True, 'bear_use_adx': True, 'bear_use_spike': True, 'bear_rsi_required': True, 'sideways_strategy': 'breakout', 'sideways_bb_std_mult': 2.233823792064308, 'sideways_rsi_os': 38, 'sideways_rsi_ob': 89, 'sideways_adx_thresh': 25.9510558244907, 'sideways_atr_min_pct': 0.018580779796074063, 'sideways_atr_max_pct': 0.04500548943412387, 'sideways_tp_mult': 2.3930383560458983, 'sideways_tsl_mult': 0.6328649997822883, 'sideways_time_stop': 271, 'sideways_use_sma': True, 'sideways_use_ema': False, 'sideways_use_atr': False, 'sideways_use_adx': True, 'sideways_use_spike': False, 'sideways_rsi_required': False}.
[I 2025-08-30 21:48:58,234] Trial 488 finished with values: [-1000000000.0, 1000000000.0] and parameters: {'p_sma': 35, 'p_std': 39, 'p_atr': 20, 'p_adx': 20, 'rsi_period': 70, 'ema1': 10, 'ema2': 56, 'slip_atr_k': 0.021032755582743475, 'slip_spread_k': 0.6569096134782508, 'spread_hl_frac': 0.04268109628145149, 'bb_std_mult': 0.9129283811901336, 'rsi_os': 12, 'rsi_ob': 66, 'vol_spike': 0.19124598854096544, 'adx_thresh': 11.274206082482436, 'atr_min_pct': 0.012256622544010982, 'atr_max_pct': 0.0223218431306142, 'tp_mult': 1.7285280249322612, 'tsl_mult': 0.86050904979618, 'strategy': 'breakout', 'time_stop': 75, 'use_sma': True, 'use_atr': True, 'use_adx': True, 'use_ema': True, 'use_spike': True, 'rsi_required': False, 'edge_k': 1.1044656351832252, 'edge_cap': 0.784195691406856, 'bull_strategy': 'breakout', 'bull_bb_std_mult': 1.9016156270674374, 'bull_rsi_os': 16, 'bull_rsi_ob': 88, 'bull_adx_thresh': 34.16899723710737, 'bull_atr_min_pct': 0.0004932512054980018, 'bull_atr_max_pct': 0.025102174086954664, 'bull_tp_mult': 1.3248232125403714, 'bull_tsl_mult': 0.43739950564764585, 'bull_time_stop': 56, 'bull_use_sma': True, 'bull_use_ema': False, 'bull_use_atr': True, 'bull_use_adx': False, 'bull_use_spike': False, 'bull_rsi_required': True, 'bear_strategy': 'breakout', 'bear_bb_std_mult': 1.787544107772433, 'bear_rsi_os': 6, 'bear_rsi_ob': 75, 'bear_adx_thresh': 26.943093775361046, 'bear_atr_min_pct': 0.025967423526806845, 'bear_atr_max_pct': 0.11938841943487614, 'bear_tp_mult': 1.6010151946895526, 'bear_tsl_mult': 0.39695893724240067, 'bear_time_stop': 243, 'bear_use_sma': False, 'bear_use_ema': True, 'bear_use_atr': True, 'bear_use_adx': True, 'bear_use_spike': True, 'bear_rsi_required': True, 'sideways_strategy': 'breakout', 'sideways_bb_std_mult': 1.950874606236023, 'sideways_rsi_os': 35, 'sideways_rsi_ob': 78, 'sideways_adx_thresh': 28.174769399520127, 'sideways_atr_min_pct': 0.002270235647876503, 'sideways_atr_max_pct': 0.04462732210470047, 'sideways_tp_mult': 1.7159662621230223, 'sideways_tsl_mult': 0.720417399948557, 'sideways_time_stop': 270, 'sideways_use_sma': True, 'sideways_use_ema': False, 'sideways_use_atr': False, 'sideways_use_adx': True, 'sideways_use_spike': False, 'sideways_rsi_required': False}.
[I 2025-08-30 21:49:01,970] Trial 490 finished with values: [-0.019948190320956072, 0.019880482129843387] and parameters: {'p_sma': 34, 'p_std': 19, 'p_atr': 12, 'p_adx': 20, 'rsi_period': 62, 'ema1': 10, 'ema2': 56, 'slip_atr_k': 0.02324122413389298, 'slip_spread_k': 0.6480875295223225, 'spread_hl_frac': 0.03363734559372641, 'bb_std_mult': 0.6129605804303235, 'rsi_os': 12, 'rsi_ob': 67, 'vol_spike': 0.27464746896230363, 'adx_thresh': 11.333280730485194, 'atr_min_pct': 0.012189114538357663, 'atr_max_pct': 0.01972555666818104, 'tp_mult': 2.7881743395269707, 'tsl_mult': 0.8887256687416889, 'strategy': 'breakout', 'time_stop': 86, 'use_sma': True, 'use_atr': True, 'use_adx': True, 'use_ema': True, 'use_spike': True, 'rsi_required': True, 'edge_k': 0.3092237171673966, 'edge_cap': 0.7965618179161719, 'bull_strategy': 'breakout', 'bull_bb_std_mult': 1.8711489298305577, 'bull_rsi_os': 23, 'bull_rsi_ob': 88, 'bull_adx_thresh': 5.485177617000334, 'bull_atr_min_pct': 0.0011686269950590942, 'bull_atr_max_pct': 0.05160952460010502, 'bull_tp_mult': 1.2315493886825974, 'bull_tsl_mult': 0.438112998666233, 'bull_time_stop': 288, 'bull_use_sma': True, 'bull_use_ema': False, 'bull_use_atr': False, 'bull_use_adx': False, 'bull_use_spike': False, 'bull_rsi_required': True, 'bear_strategy': 'breakout', 'bear_bb_std_mult': 1.9818137025123896, 'bear_rsi_os': 6, 'bear_rsi_ob': 73, 'bear_adx_thresh': 25.996809731808074, 'bear_atr_min_pct': 0.028586979708018427, 'bear_atr_max_pct': 0.11519402595212183, 'bear_tp_mult': 1.361928499045862, 'bear_tsl_mult': 0.12037696031712525, 'bear_time_stop': 251, 'bear_use_sma': False, 'bear_use_ema': True, 'bear_use_atr': False, 'bear_use_adx': True, 'bear_use_spike': True, 'bear_rsi_required': True, 'sideways_strategy': 'breakout', 'sideways_bb_std_mult': 1.961813628968161, 'sideways_rsi_os': 38, 'sideways_rsi_ob': 87, 'sideways_adx_thresh': 28.65006782871397, 'sideways_atr_min_pct': 0.029456621811114997, 'sideways_atr_max_pct': 0.056800402936679456, 'sideways_tp_mult': 2.298593607854763, 'sideways_tsl_mult': 0.7173907039687594, 'sideways_time_stop': 274, 'sideways_use_sma': False, 'sideways_use_ema': False, 'sideways_use_atr': False, 'sideways_use_adx': True, 'sideways_use_spike': False, 'sideways_rsi_required': False}.
[I 2025-08-30 21:49:02,238] Trial 493 finished with values: [-1000000000.0, 1000000000.0] and parameters: {'p_sma': 33, 'p_std': 37, 'p_atr': 12, 'p_adx': 21, 'rsi_period': 46, 'ema1': 10, 'ema2': 54, 'slip_atr_k': 0.030016627915891717, 'slip_spread_k': 0.27717081595551124, 'spread_hl_frac': 0.016216346930580904, 'bb_std_mult': 0.8393041449641041, 'rsi_os': 13, 'rsi_ob': 66, 'vol_spike': 0.25041171757410535, 'adx_thresh': 33.63419482817146, 'atr_min_pct': 0.02745961068463031, 'atr_max_pct': 0.0195358432759224, 'tp_mult': 1.1580513836337647, 'tsl_mult': 0.8983943795275225, 'strategy': 'mean_reversion', 'time_stop': 84, 'use_sma': True, 'use_atr': False, 'use_adx': False, 'use_ema': True, 'use_spike': False, 'rsi_required': True, 'edge_k': 0.12474043123077105, 'edge_cap': 0.8028511018685031, 'bull_strategy': 'breakout', 'bull_bb_std_mult': 2.1325628357278403, 'bull_rsi_os': 11, 'bull_rsi_ob': 88, 'bull_adx_thresh': 7.390555547930136, 'bull_atr_min_pct': 0.018749725372053383, 'bull_atr_max_pct': 0.08320720622285424, 'bull_tp_mult': 1.2417658456341354, 'bull_tsl_mult': 0.37551874670059726, 'bull_time_stop': 289, 'bull_use_sma': False, 'bull_use_ema': False, 'bull_use_atr': False, 'bull_use_adx': False, 'bull_use_spike': False, 'bull_rsi_required': False, 'bear_strategy': 'mean_reversion', 'bear_bb_std_mult': 1.975554309912122, 'bear_rsi_os': 8, 'bear_rsi_ob': 84, 'bear_adx_thresh': 25.776445298086593, 'bear_atr_min_pct': 0.029250937775776305, 'bear_atr_max_pct': 0.12955920306554597, 'bear_tp_mult': 1.3540895978747685, 'bear_tsl_mult': 0.9161720988076634, 'bear_time_stop': 252, 'bear_use_sma': False, 'bear_use_ema': True, 'bear_use_atr': False, 'bear_use_adx': False, 'bear_use_spike': False, 'bear_rsi_required': False, 'sideways_strategy': 'breakout', 'sideways_bb_std_mult': 2.8892920077491677, 'sideways_rsi_os': 11, 'sideways_rsi_ob': 90, 'sideways_adx_thresh': 29.0423037069577, 'sideways_atr_min_pct': 0.006482309253998673, 'sideways_atr_max_pct': 0.04846260728375804, 'sideways_tp_mult': 2.8243153274163584, 'sideways_tsl_mult': 0.8347691902523053, 'sideways_time_stop': 256, 'sideways_use_sma': False, 'sideways_use_ema': False, 'sideways_use_atr': False, 'sideways_use_adx': True, 'sideways_use_spike': True, 'sideways_rsi_required': False}.
[I 2025-08-30 21:49:32,083] Trial 492 finished with values: [-0.017361011400031545, 0.017266761280025918] and parameters: {'p_sma': 33, 'p_std': 37, 'p_atr': 20, 'p_adx': 20, 'rsi_period': 62, 'ema1': 10, 'ema2': 54, 'slip_atr_k': 2.681715291175113e-05, 'slip_spread_k': 0.33824455500202893, 'spread_hl_frac': 0.03381894474971647, 'bb_std_mult': 0.858914520728321, 'rsi_os': 13, 'rsi_ob': 66, 'vol_spike': 0.2453099671114914, 'adx_thresh': 9.498134253216579, 'atr_min_pct': 0.012060171751169642, 'atr_max_pct': 0.020069746847727988, 'tp_mult': 1.7055257371434922, 'tsl_mult': 0.03979044845103269, 'strategy': 'mean_reversion', 'time_stop': 86, 'use_sma': True, 'use_atr': True, 'use_adx': True, 'use_ema': True, 'use_spike': True, 'rsi_required': False, 'edge_k': 0.31712798783228013, 'edge_cap': 0.8010899433003915, 'bull_strategy': 'breakout', 'bull_bb_std_mult': 1.067648537025844, 'bull_rsi_os': 11, 'bull_rsi_ob': 88, 'bull_adx_thresh': 5.670677906100002, 'bull_atr_min_pct': 0.0004229989746251016, 'bull_atr_max_pct': 0.0534899962839243, 'bull_tp_mult': 1.3393607032599903, 'bull_tsl_mult': 0.4477078188032099, 'bull_time_stop': 54, 'bull_use_sma': False, 'bull_use_ema': False, 'bull_use_atr': False, 'bull_use_adx': False, 'bull_use_spike': False, 'bull_rsi_required': True, 'bear_strategy': 'mean_reversion', 'bear_bb_std_mult': 2.0637227582793356, 'bear_rsi_os': 9, 'bear_rsi_ob': 73, 'bear_adx_thresh': 25.92022081783685, 'bear_atr_min_pct': 0.029329031253950623, 'bear_atr_max_pct': 0.1285192364459781, 'bear_tp_mult': 1.5730998213123208, 'bear_tsl_mult': 0.8265316117662103, 'bear_time_stop': 252, 'bear_use_sma': False, 'bear_use_ema': True, 'bear_use_atr': False, 'bear_use_adx': True, 'bear_use_spike': False, 'bear_rsi_required': True, 'sideways_strategy': 'breakout', 'sideways_bb_std_mult': 1.9405103509061636, 'sideways_rsi_os': 13, 'sideways_rsi_ob': 50, 'sideways_adx_thresh': 28.77419664852764, 'sideways_atr_min_pct': 0.021053404012496318, 'sideways_atr_max_pct': 0.042550645226818416, 'sideways_tp_mult': 1.5147430321189537, 'sideways_tsl_mult': 0.7271024720310204, 'sideways_time_stop': 256, 'sideways_use_sma': False, 'sideways_use_ema': False, 'sideways_use_atr': False, 'sideways_use_adx': True, 'sideways_use_spike': False, 'sideways_rsi_required': False}.
[I 2025-08-30 21:49:32,801] Trial 491 finished with values: [-0.020799138380492188, 0.02072145370024102] and parameters: {'p_sma': 34, 'p_std': 11, 'p_atr': 12, 'p_adx': 20, 'rsi_period': 70, 'ema1': 13, 'ema2': 56, 'slip_atr_k': 0.021914446147285303, 'slip_spread_k': 0.6571019055873611, 'spread_hl_frac': 0.03354247203647241, 'bb_std_mult': 0.8331514532627114, 'rsi_os': 13, 'rsi_ob': 66, 'vol_spike': 0.27943363559341056, 'adx_thresh': 11.250147695302827, 'atr_min_pct': 0.012322515863503096, 'atr_max_pct': 0.019871457393177146, 'tp_mult': 1.7227689340029024, 'tsl_mult': 0.91610900813235, 'strategy': 'breakout', 'time_stop': 86, 'use_sma': True, 'use_atr': True, 'use_adx': True, 'use_ema': True, 'use_spike': True, 'rsi_required': True, 'edge_k': 1.0932909414133647, 'edge_cap': 0.7955599673349025, 'bull_strategy': 'breakout', 'bull_bb_std_mult': 2.0536892520106718, 'bull_rsi_os': 16, 'bull_rsi_ob': 46, 'bull_adx_thresh': 7.203897743126197, 'bull_atr_min_pct': 0.0008724411056510604, 'bull_atr_max_pct': 0.08898807502327044, 'bull_tp_mult': 1.237963585701158, 'bull_tsl_mult': 0.4418925227354098, 'bull_time_stop': 288, 'bull_use_sma': False, 'bull_use_ema': True, 'bull_use_atr': False, 'bull_use_adx': False, 'bull_use_spike': False, 'bull_rsi_required': True, 'bear_strategy': 'breakout', 'bear_bb_std_mult': 2.176550460986251, 'bear_rsi_os': 9, 'bear_rsi_ob': 84, 'bear_adx_thresh': 25.714786007461754, 'bear_atr_min_pct': 0.02872838751227144, 'bear_atr_max_pct': 0.10893486348408107, 'bear_tp_mult': 1.5887613867240207, 'bear_tsl_mult': 0.9080191165625502, 'bear_time_stop': 250, 'bear_use_sma': False, 'bear_use_ema': True, 'bear_use_atr': False, 'bear_use_adx': True, 'bear_use_spike': True, 'bear_rsi_required': True, 'sideways_strategy': 'breakout', 'sideways_bb_std_mult': 1.8283535723476683, 'sideways_rsi_os': 48, 'sideways_rsi_ob': 89, 'sideways_adx_thresh': 28.833353461337257, 'sideways_atr_min_pct': 0.01857538306631658, 'sideways_atr_max_pct': 0.04383603430195398, 'sideways_tp_mult': 1.8822905387658817, 'sideways_tsl_mult': 0.7240127970637547, 'sideways_time_stop': 211, 'sideways_use_sma': False, 'sideways_use_ema': False, 'sideways_use_atr': False, 'sideways_use_adx': True, 'sideways_use_spike': False, 'sideways_rsi_required': False}.
[I 2025-08-30 21:49:35,052] Trial 494 finished with values: [-1000000000.0, 1000000000.0] and parameters: {'p_sma': 33, 'p_std': 37, 'p_atr': 27, 'p_adx': 14, 'rsi_period': 76, 'ema1': 13, 'ema2': 53, 'slip_atr_k': 0.12284590284156022, 'slip_spread_k': 0.3463670197652491, 'spread_hl_frac': 0.03395073057750265, 'bb_std_mult': 0.8039357943577232, 'rsi_os': 41, 'rsi_ob': 66, 'vol_spike': 0.247170511244859, 'adx_thresh': 9.834761232033834, 'atr_min_pct': 0.013303589725220763, 'atr_max_pct': 0.023015943331270643, 'tp_mult': 1.6938160848269528, 'tsl_mult': 0.7369280619185551, 'strategy': 'mean_reversion', 'time_stop': 91, 'use_sma': True, 'use_atr': False, 'use_adx': False, 'use_ema': True, 'use_spike': False, 'rsi_required': True, 'edge_k': 0.8665783078973968, 'edge_cap': 0.8195238095001749, 'bull_strategy': 'breakout', 'bull_bb_std_mult': 1.8141595354726663, 'bull_rsi_os': 17, 'bull_rsi_ob': 85, 'bull_adx_thresh': 14.597418647141554, 'bull_atr_min_pct': 0.0018638866905275706, 'bull_atr_max_pct': 0.0885337839917561, 'bull_tp_mult': 1.3477470848870226, 'bull_tsl_mult': 0.8881416732318497, 'bull_time_stop': 294, 'bull_use_sma': False, 'bull_use_ema': True, 'bull_use_atr': False, 'bull_use_adx': False, 'bull_use_spike': False, 'bull_rsi_required': False, 'bear_strategy': 'mean_reversion', 'bear_bb_std_mult': 2.0602140978001375, 'bear_rsi_os': 9, 'bear_rsi_ob': 71, 'bear_adx_thresh': 27.79480900854505, 'bear_atr_min_pct': 0.0037309511326217674, 'bear_atr_max_pct': 0.1266015277772516, 'bear_tp_mult': 1.5545182365217753, 'bear_tsl_mult': 0.8223752839037618, 'bear_time_stop': 232, 'bear_use_sma': False, 'bear_use_ema': True, 'bear_use_atr': False, 'bear_use_adx': False, 'bear_use_spike': False, 'bear_rsi_required': False, 'sideways_strategy': 'breakout', 'sideways_bb_std_mult': 1.8165370939785976, 'sideways_rsi_os': 11, 'sideways_rsi_ob': 89, 'sideways_adx_thresh': 27.465562270860335, 'sideways_atr_min_pct': 0.0210301889517223, 'sideways_atr_max_pct': 0.040765257171496906, 'sideways_tp_mult': 1.8989621391723444, 'sideways_tsl_mult': 0.9106368139880633, 'sideways_time_stop': 71, 'sideways_use_sma': False, 'sideways_use_ema': False, 'sideways_use_atr': False, 'sideways_use_adx': True, 'sideways_use_spike': True, 'sideways_rsi_required': False}.
