[I 2025-08-30 21:59:23,924] Trial 576 finished with values: [-0.017781590688271898, 0.01768025029793517] and parameters: {'p_sma': 46, 'p_std': 36, 'p_atr': 22, 'p_adx': 22, 'rsi_period': 74, 'ema1': 12, 'ema2': 51, 'slip_atr_k': 0.10411547401623732, 'slip_spread_k': 0.06555373292186795, 'spread_hl_frac': 0.03384157602922069, 'bb_std_mult': 1.043723375129619, 'rsi_os': 10, 'rsi_ob': 63, 'vol_spike': 0.2651507915131555, 'adx_thresh': 11.124737033943013, 'atr_min_pct': 0.014633996343138387, 'atr_max_pct': 0.019494912990833013, 'tp_mult': 1.7321458686924203, 'tsl_mult': 0.8895675014213092, 'strategy': 'breakout', 'time_stop': 94, 'use_sma': True, 'use_atr': True, 'use_adx': True, 'use_ema': True, 'use_spike': True, 'rsi_required': True, 'edge_k': 0.3090556461284787, 'edge_cap': 0.8084412202429465, 'bull_strategy': 'breakout', 'bull_bb_std_mult': 1.8952218626933226, 'bull_rsi_os': 19, 'bull_rsi_ob': 59, 'bull_adx_thresh': 14.18159325755491, 'bull_atr_min_pct': 0.0005489000861517164, 'bull_atr_max_pct': 0.1230557981457032, 'bull_tp_mult': 1.3106393839355015, 'bull_tsl_mult': 0.40670102677318615, 'bull_time_stop': 280, 'bull_use_sma': True, 'bull_use_ema': False, 'bull_use_atr': True, 'bull_use_adx': False, 'bull_use_spike': False, 'bull_rsi_required': False, 'bear_strategy': 'mean_reversion', 'bear_bb_std_mult': 1.7796909162784469, 'bear_rsi_os': 18, 'bear_rsi_ob': 90, 'bear_adx_thresh': 26.3496273646337, 'bear_atr_min_pct': 0.028946947441186047, 'bear_atr_max_pct': 0.059414513228804325, 'bear_tp_mult': 1.9087962584665727, 'bear_tsl_mult': 0.4204945237679802, 'bear_time_stop': 48, 'bear_use_sma': False, 'bear_use_ema': True, 'bear_use_atr': True, 'bear_use_adx': True, 'bear_use_spike': True, 'bear_rsi_required': False, 'sideways_strategy': 'breakout', 'sideways_bb_std_mult': 1.6927137123529574, 'sideways_rsi_os': 38, 'sideways_rsi_ob': 46, 'sideways_adx_thresh': 5.0164389616838765, 'sideways_atr_min_pct': 0.007216055722979471, 'sideways_atr_max_pct': 0.06420150238361544, 'sideways_tp_mult': 1.8818153020093984, 'sideways_tsl_mult': 0.7864122497683542, 'sideways_time_stop': 253, 'sideways_use_sma': False, 'sideways_use_ema': False, 'sideways_use_atr': False, 'sideways_use_adx': True, 'sideways_use_spike': False, 'sideways_rsi_required': False}.
[I 2025-08-30 21:59:24,391] Trial 575 finished with values: [-0.018944698166974194, 0.018844702225404842] and parameters: {'p_sma': 37, 'p_std': 36, 'p_atr': 22, 'p_adx': 22, 'rsi_period': 75, 'ema1': 9, 'ema2': 55, 'slip_atr_k': 0.08964028589267213, 'slip_spread_k': 0.03821127144730502, 'spread_hl_frac': 0.018955142084883244, 'bb_std_mult': 0.9982318707776018, 'rsi_os': 10, 'rsi_ob': 91, 'vol_spike': 0.26321659967992583, 'adx_thresh': 9.71220701593581, 'atr_min_pct': 0.014296362054404009, 'atr_max_pct': 0.11107506764622734, 'tp_mult': 1.6195667841505546, 'tsl_mult': 0.7845076879699217, 'strategy': 'breakout', 'time_stop': 76, 'use_sma': True, 'use_atr': True, 'use_adx': True, 'use_ema': True, 'use_spike': True, 'rsi_required': True, 'edge_k': 0.9752593991666325, 'edge_cap': 0.3563214207146822, 'bull_strategy': 'breakout', 'bull_bb_std_mult': 1.9202622763293622, 'bull_rsi_os': 18, 'bull_rsi_ob': 63, 'bull_adx_thresh': 10.317071663361016, 'bull_atr_min_pct': 0.0005670665308128352, 'bull_atr_max_pct': 0.04567776202758747, 'bull_tp_mult': 1.2775848764841145, 'bull_tsl_mult': 0.4053724594835594, 'bull_time_stop': 102, 'bull_use_sma': True, 'bull_use_ema': False, 'bull_use_atr': True, 'bull_use_adx': False, 'bull_use_spike': False, 'bull_rsi_required': False, 'bear_strategy': 'mean_reversion', 'bear_bb_std_mult': 1.9879151338550152, 'bear_rsi_os': 18, 'bear_rsi_ob': 91, 'bear_adx_thresh': 25.45240742722994, 'bear_atr_min_pct': 0.028906027367162034, 'bear_atr_max_pct': 0.0565434632539914, 'bear_tp_mult': 1.512494316024511, 'bear_tsl_mult': 0.4189363752378329, 'bear_time_stop': 221, 'bear_use_sma': False, 'bear_use_ema': True, 'bear_use_atr': True, 'bear_use_adx': True, 'bear_use_spike': True, 'bear_rsi_required': False, 'sideways_strategy': 'breakout', 'sideways_bb_std_mult': 1.6600423684800985, 'sideways_rsi_os': 38, 'sideways_rsi_ob': 91, 'sideways_adx_thresh': 27.934846607325483, 'sideways_atr_min_pct': 0.021998132770181197, 'sideways_atr_max_pct': 0.04547409707659207, 'sideways_tp_mult': 1.061425785407057, 'sideways_tsl_mult': 0.7887511638983343, 'sideways_time_stop': 272, 'sideways_use_sma': False, 'sideways_use_ema': False, 'sideways_use_atr': False, 'sideways_use_adx': True, 'sideways_use_spike': False, 'sideways_rsi_required': False}.
[I 2025-08-30 21:59:24,652] Trial 578 finished with values: [-1000000000.0, 1000000000.0] and parameters: {'p_sma': 37, 'p_std': 38, 'p_atr': 21, 'p_adx': 11, 'rsi_period': 68, 'ema1': 10, 'ema2': 55, 'slip_atr_k': 0.061515172064896956, 'slip_spread_k': 0.6409958322339575, 'spread_hl_frac': 0.034304365732234554, 'bb_std_mult': 2.1723146011658905, 'rsi_os': 8, 'rsi_ob': 67, 'vol_spike': 0.011963046173290748, 'adx_thresh': 32.53609136382908, 'atr_min_pct': 0.01264070000768655, 'atr_max_pct': 0.021320657430207803, 'tp_mult': 1.7115724101662146, 'tsl_mult': 0.8864771418668835, 'strategy': 'breakout', 'time_stop': 95, 'use_sma': True, 'use_atr': True, 'use_adx': True, 'use_ema': True, 'use_spike': True, 'rsi_required': False, 'edge_k': 1.886887492493364, 'edge_cap': 0.35303467025949997, 'bull_strategy': 'breakout', 'bull_bb_std_mult': 1.884494604348785, 'bull_rsi_os': 17, 'bull_rsi_ob': 87, 'bull_adx_thresh': 17.328527031439016, 'bull_atr_min_pct': 0.0026204759311116545, 'bull_atr_max_pct': 0.09102054410482763, 'bull_tp_mult': 1.9653186779946907, 'bull_tsl_mult': 0.7691558532211851, 'bull_time_stop': 233, 'bull_use_sma': True, 'bull_use_ema': False, 'bull_use_atr': True, 'bull_use_adx': False, 'bull_use_spike': False, 'bull_rsi_required': False, 'bear_strategy': 'mean_reversion', 'bear_bb_std_mult': 1.8212985824260735, 'bear_rsi_os': 5, 'bear_rsi_ob': 66, 'bear_adx_thresh': 28.172962928318107, 'bear_atr_min_pct': 0.028966819196401383, 'bear_atr_max_pct': 0.11009079079713799, 'bear_tp_mult': 1.6081973676557384, 'bear_tsl_mult': 0.4353521467680972, 'bear_time_stop': 249, 'bear_use_sma': False, 'bear_use_ema': True, 'bear_use_atr': True, 'bear_use_adx': True, 'bear_use_spike': True, 'bear_rsi_required': False, 'sideways_strategy': 'breakout', 'sideways_bb_std_mult': 1.6967594679785871, 'sideways_rsi_os': 36, 'sideways_rsi_ob': 88, 'sideways_adx_thresh': 27.257332841034618, 'sideways_atr_min_pct': 0.021936842208144684, 'sideways_atr_max_pct': 0.0504080294546296, 'sideways_tp_mult': 1.1091809724168205, 'sideways_tsl_mult': 0.812269448978216, 'sideways_time_stop': 204, 'sideways_use_sma': False, 'sideways_use_ema': False, 'sideways_use_atr': False, 'sideways_use_adx': True, 'sideways_use_spike': False, 'sideways_rsi_required': False}.
[I 2025-08-30 21:59:26,519] Trial 579 finished with values: [-1000000000.0, 1000000000.0] and parameters: {'p_sma': 37, 'p_std': 56, 'p_atr': 22, 'p_adx': 21, 'rsi_period': 68, 'ema1': 9, 'ema2': 38, 'slip_atr_k': 0.01854749253139222, 'slip_spread_k': 0.8470870376532191, 'spread_hl_frac': 0.0317252136517193, 'bb_std_mult': 0.9073075482253741, 'rsi_os': 8, 'rsi_ob': 57, 'vol_spike': 0.07259518155734623, 'adx_thresh': 11.261306523822475, 'atr_min_pct': 0.012642003582102407, 'atr_max_pct': 0.01941991842860712, 'tp_mult': 1.7094467308205177, 'tsl_mult': 0.8809784881787742, 'strategy': 'breakout', 'time_stop': 101, 'use_sma': True, 'use_atr': True, 'use_adx': True, 'use_ema': True, 'use_spike': True, 'rsi_required': False, 'edge_k': 0.974836894442391, 'edge_cap': 0.3459025164613001, 'bull_strategy': 'breakout', 'bull_bb_std_mult': 2.0292282964064863, 'bull_rsi_os': 19, 'bull_rsi_ob': 54, 'bull_adx_thresh': 25.37320484271788, 'bull_atr_min_pct': 0.0026635842611362334, 'bull_atr_max_pct': 0.09866617581750331, 'bull_tp_mult': 1.4060684069754104, 'bull_tsl_mult': 0.7622059313257954, 'bull_time_stop': 290, 'bull_use_sma': True, 'bull_use_ema': False, 'bull_use_atr': True, 'bull_use_adx': False, 'bull_use_spike': False, 'bull_rsi_required': False, 'bear_strategy': 'mean_reversion', 'bear_bb_std_mult': 1.9061907237743336, 'bear_rsi_os': 8, 'bear_rsi_ob': 72, 'bear_adx_thresh': 27.99383017685912, 'bear_atr_min_pct': 0.029134513595549937, 'bear_atr_max_pct': 0.13536141335901858, 'bear_tp_mult': 1.5295750160611152, 'bear_tsl_mult': 0.36035524964828924, 'bear_time_stop': 246, 'bear_use_sma': False, 'bear_use_ema': True, 'bear_use_atr': True, 'bear_use_adx': True, 'bear_use_spike': True, 'bear_rsi_required': False, 'sideways_strategy': 'breakout', 'sideways_bb_std_mult': 1.6600697449618487, 'sideways_rsi_os': 35, 'sideways_rsi_ob': 89, 'sideways_adx_thresh': 21.31177034682303, 'sideways_atr_min_pct': 0.022018974368039356, 'sideways_atr_max_pct': 0.04270929285281224, 'sideways_tp_mult': 1.8952281665538409, 'sideways_tsl_mult': 0.7744934449007539, 'sideways_time_stop': 45, 'sideways_use_sma': False, 'sideways_use_ema': False, 'sideways_use_atr': False, 'sideways_use_adx': True, 'sideways_use_spike': False, 'sideways_rsi_required': False}.
[I 2025-08-30 21:59:59,885] Trial 580 finished with values: [-1000000000.0, 1000000000.0] and parameters: {'p_sma': 37, 'p_std': 35, 'p_atr': 22, 'p_adx': 21, 'rsi_period': 68, 'ema1': 10, 'ema2': 55, 'slip_atr_k': 0.2150657879366304, 'slip_spread_k': 0.7323584836175402, 'spread_hl_frac': 0.03122847586344252, 'bb_std_mult': 0.8277658613627122, 'rsi_os': 8, 'rsi_ob': 67, 'vol_spike': 0.07129926474810235, 'adx_thresh': 11.33153416358981, 'atr_min_pct': 0.012765389680617696, 'atr_max_pct': 0.02167593552464767, 'tp_mult': 2.9981182862093165, 'tsl_mult': 0.9384591739658449, 'strategy': 'breakout', 'time_stop': 256, 'use_sma': True, 'use_atr': True, 'use_adx': True, 'use_ema': True, 'use_spike': True, 'rsi_required': False, 'edge_k': 0.09640688541054065, 'edge_cap': 0.7653258651330215, 'bull_strategy': 'breakout', 'bull_bb_std_mult': 0.6358548873434771, 'bull_rsi_os': 19, 'bull_rsi_ob': 65, 'bull_adx_thresh': 5.167132175576109, 'bull_atr_min_pct': 0.0026561331570781515, 'bull_atr_max_pct': 0.050151143754681694, 'bull_tp_mult': 2.82736613685834, 'bull_tsl_mult': 0.397340403426343, 'bull_time_stop': 102, 'bull_use_sma': True, 'bull_use_ema': False, 'bull_use_atr': True, 'bull_use_adx': False, 'bull_use_spike': False, 'bull_rsi_required': False, 'bear_strategy': 'mean_reversion', 'bear_bb_std_mult': 3.5005858580457287, 'bear_rsi_os': 13, 'bear_rsi_ob': 72, 'bear_adx_thresh': 28.170442103421156, 'bear_atr_min_pct': 0.0024072669871365755, 'bear_atr_max_pct': 0.11007491808390747, 'bear_tp_mult': 1.519293695363988, 'bear_tsl_mult': 0.3636482693058192, 'bear_time_stop': 250, 'bear_use_sma': False, 'bear_use_ema': True, 'bear_use_atr': True, 'bear_use_adx': True, 'bear_use_spike': True, 'bear_rsi_required': False, 'sideways_strategy': 'breakout', 'sideways_bb_std_mult': 1.6872235786127003, 'sideways_rsi_os': 40, 'sideways_rsi_ob': 89, 'sideways_adx_thresh': 29.677341583140755, 'sideways_atr_min_pct': 0.011679647391430407, 'sideways_atr_max_pct': 0.07565247552810289, 'sideways_tp_mult': 2.7774313371781902, 'sideways_tsl_mult': 0.7726150653815048, 'sideways_time_stop': 204, 'sideways_use_sma': False, 'sideways_use_ema': False, 'sideways_use_atr': False, 'sideways_use_adx': True, 'sideways_use_spike': False, 'sideways_rsi_required': False}.
[I 2025-08-30 22:00:00,113] Trial 582 finished with values: [-1000000000.0, 1000000000.0] and parameters: {'p_sma': 51, 'p_std': 52, 'p_atr': 17, 'p_adx': 21, 'rsi_period': 71, 'ema1': 28, 'ema2': 53, 'slip_atr_k': 0.019260698452385146, 'slip_spread_k': 0.106029241661591, 'spread_hl_frac': 0.031156098867289275, 'bb_std_mult': 0.9033793967716267, 'rsi_os': 10, 'rsi_ob': 57, 'vol_spike': 0.27422815711126314, 'adx_thresh': 11.312552221695606, 'atr_min_pct': 0.012821556062706869, 'atr_max_pct': 0.01838085351952584, 'tp_mult': 2.254935687806523, 'tsl_mult': 0.03585105260719651, 'strategy': 'mean_reversion', 'time_stop': 261, 'use_sma': True, 'use_atr': True, 'use_adx': True, 'use_ema': True, 'use_spike': True, 'rsi_required': True, 'edge_k': 0.8595054327717321, 'edge_cap': 0.7691567060446083, 'bull_strategy': 'breakout', 'bull_bb_std_mult': 2.1510100449566325, 'bull_rsi_os': 17, 'bull_rsi_ob': 90, 'bull_adx_thresh': 33.66309208393013, 'bull_atr_min_pct': 0.0016388188692271857, 'bull_atr_max_pct': 0.046377086036637656, 'bull_tp_mult': 1.2731583679137275, 'bull_tsl_mult': 0.39787964565377504, 'bull_time_stop': 159, 'bull_use_sma': True, 'bull_use_ema': False, 'bull_use_atr': False, 'bull_use_adx': False, 'bull_use_spike': False, 'bull_rsi_required': True, 'bear_strategy': 'mean_reversion', 'bear_bb_std_mult': 3.4611750762352074, 'bear_rsi_os': 31, 'bear_rsi_ob': 72, 'bear_adx_thresh': 28.164437036461635, 'bear_atr_min_pct': 0.001537276892349249, 'bear_atr_max_pct': 0.11425111914615174, 'bear_tp_mult': 1.5292395370863177, 'bear_tsl_mult': 0.36212813043307285, 'bear_time_stop': 237, 'bear_use_sma': False, 'bear_use_ema': True, 'bear_use_atr': False, 'bear_use_adx': True, 'bear_use_spike': True, 'bear_rsi_required': True, 'sideways_strategy': 'breakout', 'sideways_bb_std_mult': 1.672148554079546, 'sideways_rsi_os': 42, 'sideways_rsi_ob': 46, 'sideways_adx_thresh': 34.79242589686413, 'sideways_atr_min_pct': 0.006983374045991602, 'sideways_atr_max_pct': 0.04262509604146395, 'sideways_tp_mult': 1.8871361300911458, 'sideways_tsl_mult': 0.7754625374849554, 'sideways_time_stop': 257, 'sideways_use_sma': False, 'sideways_use_ema': False, 'sideways_use_atr': False, 'sideways_use_adx': True, 'sideways_use_spike': False, 'sideways_rsi_required': False}.
[I 2025-08-30 22:00:00,582] Trial 581 finished with values: [-1000000000.0, 1000000000.0] and parameters: {'p_sma': 37, 'p_std': 38, 'p_atr': 8, 'p_adx': 11, 'rsi_period': 29, 'ema1': 9, 'ema2': 55, 'slip_atr_k': 0.2159379216941179, 'slip_spread_k': 0.7357130374923517, 'spread_hl_frac': 0.04581202176047722, 'bb_std_mult': 0.9064900201125787, 'rsi_os': 8, 'rsi_ob': 67, 'vol_spike': 0.07027843375272794, 'adx_thresh': 11.10343613438502, 'atr_min_pct': 0.012667353909604042, 'atr_max_pct': 0.0187010910651728, 'tp_mult': 1.7175625548367537, 'tsl_mult': 0.9398060609861454, 'strategy': 'breakout', 'time_stop': 100, 'use_sma': True, 'use_atr': True, 'use_adx': True, 'use_ema': True, 'use_spike': True, 'rsi_required': False, 'edge_k': 1.8848428596734306, 'edge_cap': 0.7634035713319168, 'bull_strategy': 'breakout', 'bull_bb_std_mult': 2.0359959031017936, 'bull_rsi_os': 17, 'bull_rsi_ob': 84, 'bull_adx_thresh': 25.374935440592353, 'bull_atr_min_pct': 0.003480461924085413, 'bull_atr_max_pct': 0.09182348048917964, 'bull_tp_mult': 1.9600048225541944, 'bull_tsl_mult': 0.0786634289783657, 'bull_time_stop': 290, 'bull_use_sma': True, 'bull_use_ema': False, 'bull_use_atr': True, 'bull_use_adx': False, 'bull_use_spike': False, 'bull_rsi_required': False, 'bear_strategy': 'mean_reversion', 'bear_bb_std_mult': 3.4869623098529527, 'bear_rsi_os': 12, 'bear_rsi_ob': 72, 'bear_adx_thresh': 28.194672837677103, 'bear_atr_min_pct': 0.0289671596464698, 'bear_atr_max_pct': 0.11048957579224171, 'bear_tp_mult': 1.520046928087856, 'bear_tsl_mult': 0.36081725417488814, 'bear_time_stop': 250, 'bear_use_sma': False, 'bear_use_ema': True, 'bear_use_atr': True, 'bear_use_adx': True, 'bear_use_spike': True, 'bear_rsi_required': False, 'sideways_strategy': 'breakout', 'sideways_bb_std_mult': 1.6778376631311276, 'sideways_rsi_os': 35, 'sideways_rsi_ob': 46, 'sideways_adx_thresh': 26.931968347871386, 'sideways_atr_min_pct': 0.019431846174167385, 'sideways_atr_max_pct': 0.04983853500029521, 'sideways_tp_mult': 1.8821557100951434, 'sideways_tsl_mult': 0.7720373718801143, 'sideways_time_stop': 255, 'sideways_use_sma': False, 'sideways_use_ema': False, 'sideways_use_atr': False, 'sideways_use_adx': True, 'sideways_use_spike': False, 'sideways_rsi_required': False}.
[I 2025-08-30 22:00:00,713] Trial 583 finished with values: [-1000000000.0, 1000000000.0] and parameters: {'p_sma': 32, 'p_std': 35, 'p_atr': 8, 'p_adx': 21, 'rsi_period': 48, 'ema1': 7, 'ema2': 53, 'slip_atr_k': 0.21473678081733166, 'slip_spread_k': 0.6767933990873917, 'spread_hl_frac': 0.031291083228065106, 'bb_std_mult': 0.8268091122771462, 'rsi_os': 10, 'rsi_ob': 65, 'vol_spike': 0.2926319394351642, 'adx_thresh': 12.536904130739929, 'atr_min_pct': 0.027291052564668218, 'atr_max_pct': 0.11110422070089922, 'tp_mult': 2.383815989126272, 'tsl_mult': 0.26660385058547387, 'strategy': 'mean_reversion', 'time_stop': 79, 'use_sma': True, 'use_atr': True, 'use_adx': True, 'use_ema': True, 'use_spike': True, 'rsi_required': True, 'edge_k': 0.845857603505031, 'edge_cap': 0.7950922214161487, 'bull_strategy': 'breakout', 'bull_bb_std_mult': 1.114457457652014, 'bull_rsi_os': 16, 'bull_rsi_ob': 90, 'bull_adx_thresh': 22.04112051604462, 'bull_atr_min_pct': 0.0017171580709831754, 'bull_atr_max_pct': 0.04960768963204052, 'bull_tp_mult': 1.8071076428193271, 'bull_tsl_mult': 0.4011901508653868, 'bull_time_stop': 46, 'bull_use_sma': True, 'bull_use_ema': False, 'bull_use_atr': False, 'bull_use_adx': False, 'bull_use_spike': False, 'bull_rsi_required': True, 'bear_strategy': 'mean_reversion', 'bear_bb_std_mult': 2.3441409698351707, 'bear_rsi_os': 13, 'bear_rsi_ob': 74, 'bear_adx_thresh': 26.42013363966344, 'bear_atr_min_pct': 0.0299673315679037, 'bear_atr_max_pct': 0.11356506736071584, 'bear_tp_mult': 1.0943106392937623, 'bear_tsl_mult': 0.3633788218130152, 'bear_time_stop': 168, 'bear_use_sma': False, 'bear_use_ema': True, 'bear_use_atr': False, 'bear_use_adx': True, 'bear_use_spike': True, 'bear_rsi_required': True, 'sideways_strategy': 'breakout', 'sideways_bb_std_mult': 1.572890071850149, 'sideways_rsi_os': 41, 'sideways_rsi_ob': 49, 'sideways_adx_thresh': 13.059516454380493, 'sideways_atr_min_pct': 0.021392979105811786, 'sideways_atr_max_pct': 0.04699081571125285, 'sideways_tp_mult': 1.7564930793054994, 'sideways_tsl_mult': 0.7431808281311056, 'sideways_time_stop': 257, 'sideways_use_sma': False, 'sideways_use_ema': False, 'sideways_use_atr': False, 'sideways_use_adx': True, 'sideways_use_spike': False, 'sideways_rsi_required': False}.
[I 2025-08-30 22:00:01,731] Trial 584 finished with values: [-1000000000.0, 1000000000.0] and parameters: {'p_sma': 32, 'p_std': 36, 'p_atr': 21, 'p_adx': 20, 'rsi_period': 71, 'ema1': 29, 'ema2': 53, 'slip_atr_k': 0.020902936959880717, 'slip_spread_k': 0.6746216648568547, 'spread_hl_frac': 0.04347618361463679, 'bb_std_mult': 0.5059972473838841, 'rsi_os': 32, 'rsi_ob': 64, 'vol_spike': 0.29095284890838347, 'adx_thresh': 11.97957113146691, 'atr_min_pct': 0.027262190657757018, 'atr_max_pct': 0.024242235290467304, 'tp_mult': 2.2587790929366838, 'tsl_mult': 0.9120133520426714, 'strategy': 'mean_reversion', 'time_stop': 264, 'use_sma': True, 'use_atr': True, 'use_adx': True, 'use_ema': True, 'use_spike': True, 'rsi_required': True, 'edge_k': 0.8583029867411089, 'edge_cap': 0.7977326042877456, 'bull_strategy': 'breakout', 'bull_bb_std_mult': 1.1123422354709593, 'bull_rsi_os': 17, 'bull_rsi_ob': 89, 'bull_adx_thresh': 22.073844658745553, 'bull_atr_min_pct': 0.0035333480546350087, 'bull_atr_max_pct': 0.04659794027225193, 'bull_tp_mult': 1.2692876113459546, 'bull_tsl_mult': 0.08264642882755863, 'bull_time_stop': 242, 'bull_use_sma': True, 'bull_use_ema': False, 'bull_use_atr': False, 'bull_use_adx': False, 'bull_use_spike': False, 'bull_rsi_required': True, 'bear_strategy': 'mean_reversion', 'bear_bb_std_mult': 1.935324123613339, 'bear_rsi_os': 11, 'bear_rsi_ob': 74, 'bear_adx_thresh': 25.813653097243577, 'bear_atr_min_pct': 0.029456670321072433, 'bear_atr_max_pct': 0.11414777405487977, 'bear_tp_mult': 1.5823209788059456, 'bear_tsl_mult': 0.404671342886854, 'bear_time_stop': 222, 'bear_use_sma': False, 'bear_use_ema': True, 'bear_use_atr': False, 'bear_use_adx': True, 'bear_use_spike': True, 'bear_rsi_required': True, 'sideways_strategy': 'breakout', 'sideways_bb_std_mult': 2.5237883145103743, 'sideways_rsi_os': 53, 'sideways_rsi_ob': 50, 'sideways_adx_thresh': 26.855749262036593, 'sideways_atr_min_pct': 0.019377200004654108, 'sideways_atr_max_pct': 0.03757682555710156, 'sideways_tp_mult': 1.7440807632689541, 'sideways_tsl_mult': 0.7308771017357076, 'sideways_time_stop': 283, 'sideways_use_sma': False, 'sideways_use_ema': False, 'sideways_use_atr': False, 'sideways_use_adx': True, 'sideways_use_spike': False, 'sideways_rsi_required': False}.
