[I 2025-08-30 21:12:59,736] Trial 207 finished with values: [-0.05160942216684039, 0.05153773546944193] and parameters: {'p_sma': 30, 'p_std': 34, 'p_atr': 16, 'p_adx': 23, 'rsi_period': 40, 'ema1': 21, 'ema2': 44, 'slip_atr_k': 0.19431996835818885, 'slip_spread_k': 0.7835546701496728, 'spread_hl_frac': 0.0065983441367709166, 'bb_std_mult': 1.6774651535160443, 'rsi_os': 44, 'rsi_ob': 73, 'vol_spike': 0.27706298253101524, 'adx_thresh': 28.672836423713868, 'atr_min_pct': 0.001236499068704732, 'atr_max_pct': 0.145200342463999, 'tp_mult': 1.596439577917395, 'tsl_mult': 0.5497371221705024, 'strategy': 'mean_reversion', 'time_stop': 213, 'use_sma': False, 'use_atr': True, 'use_adx': True, 'use_ema': True, 'use_spike': True, 'rsi_required': True, 'edge_k': 0.6584282101908151, 'edge_cap': 0.2757845052077815, 'bull_strategy': 'breakout', 'bull_bb_std_mult': 0.6932197256076174, 'bull_rsi_os': 55, 'bull_rsi_ob': 72, 'bull_adx_thresh': 14.145474466360826, 'bull_atr_min_pct': 0.0006797627925881648, 'bull_atr_max_pct': 0.14289001387303424, 'bull_tp_mult': 2.582599526647427, 'bull_tsl_mult': 0.2495094304788879, 'bull_time_stop': 291, 'bull_use_sma': True, 'bull_use_ema': False, 'bull_use_atr': False, 'bull_use_adx': True, 'bull_use_spike': True, 'bull_rsi_required': True, 'bear_strategy': 'mean_reversion', 'bear_bb_std_mult': 2.529216306503812, 'bear_rsi_os': 51, 'bear_rsi_ob': 50, 'bear_adx_thresh': 7.357515664031743, 'bear_atr_min_pct': 0.0029695822172421584, 'bear_atr_max_pct': 0.010090185958479473, 'bear_tp_mult': 1.9480324742834771, 'bear_tsl_mult': 0.45766149825366864, 'bear_time_stop': 109, 'bear_use_sma': True, 'bear_use_ema': False, 'bear_use_atr': False, 'bear_use_adx': True, 'bear_use_spike': True, 'bear_rsi_required': True, 'sideways_strategy': 'breakout', 'sideways_bb_std_mult': 2.7112853171839206, 'sideways_rsi_os': 54, 'sideways_rsi_ob': 80, 'sideways_adx_thresh': 31.86042899065236, 'sideways_atr_min_pct': 0.01671553063970446, 'sideways_atr_max_pct': 0.010110955532410097, 'sideways_tp_mult': 1.4702008642661086, 'sideways_tsl_mult': 0.12554107934649467, 'sideways_time_stop': 215, 'sideways_use_sma': False, 'sideways_use_ema': True, 'sideways_use_atr': True, 'sideways_use_adx': False, 'sideways_use_spike': False, 'sideways_rsi_required': True}.
[I 2025-08-30 21:13:00,232] Trial 209 finished with values: [-1000000000.0, 1000000000.0] and parameters: {'p_sma': 29, 'p_std': 5, 'p_atr': 16, 'p_adx': 23, 'rsi_period': 20, 'ema1': 17, 'ema2': 42, 'slip_atr_k': 0.03015119798559099, 'slip_spread_k': 0.7828161878936166, 'spread_hl_frac': 0.00682701257001693, 'bb_std_mult': 0.7947437475362875, 'rsi_os': 44, 'rsi_ob': 77, 'vol_spike': 0.2769235410388885, 'adx_thresh': 16.565488397642373, 'atr_min_pct': 0.027339441405485065, 'atr_max_pct': 0.017133488006140507, 'tp_mult': 1.582792001007785, 'tsl_mult': 0.02163058280617597, 'strategy': 'mean_reversion', 'time_stop': 222, 'use_sma': False, 'use_atr': True, 'use_adx': True, 'use_ema': True, 'use_spike': True, 'rsi_required': True, 'edge_k': 0.6321795991956777, 'edge_cap': 0.49858734954068173, 'bull_strategy': 'breakout', 'bull_bb_std_mult': 2.9754801854385415, 'bull_rsi_os': 40, 'bull_rsi_ob': 68, 'bull_adx_thresh': 14.153047752795592, 'bull_atr_min_pct': 0.013558318722292932, 'bull_atr_max_pct': 0.0748762908020837, 'bull_tp_mult': 2.608783090707634, 'bull_tsl_mult': 0.059019689593373934, 'bull_time_stop': 257, 'bull_use_sma': True, 'bull_use_ema': False, 'bull_use_atr': False, 'bull_use_adx': True, 'bull_use_spike': True, 'bull_rsi_required': True, 'bear_strategy': 'mean_reversion', 'bear_bb_std_mult': 2.71102706452989, 'bear_rsi_os': 38, 'bear_rsi_ob': 76, 'bear_adx_thresh': 31.124882983975183, 'bear_atr_min_pct': 0.017037884384750138, 'bear_atr_max_pct': 0.0187748708250438, 'bear_tp_mult': 2.8313398512694423, 'bear_tsl_mult': 0.5081355098525848, 'bear_time_stop': 103, 'bear_use_sma': True, 'bear_use_ema': True, 'bear_use_atr': False, 'bear_use_adx': True, 'bear_use_spike': True, 'bear_rsi_required': True, 'sideways_strategy': 'breakout', 'sideways_bb_std_mult': 2.720731818191495, 'sideways_rsi_os': 21, 'sideways_rsi_ob': 80, 'sideways_adx_thresh': 31.061771451209182, 'sideways_atr_min_pct': 0.009312349901121763, 'sideways_atr_max_pct': 0.07790873289688702, 'sideways_tp_mult': 2.6617755918896533, 'sideways_tsl_mult': 0.300190400299316, 'sideways_time_stop': 133, 'sideways_use_sma': False, 'sideways_use_ema': True, 'sideways_use_atr': True, 'sideways_use_adx': False, 'sideways_use_spike': False, 'sideways_rsi_required': True}.
[I 2025-08-30 21:13:32,472] Trial 211 finished with values: [-1000000000.0, 1000000000.0] and parameters: {'p_sma': 26, 'p_std': 32, 'p_atr': 11, 'p_adx': 18, 'rsi_period': 16, 'ema1': 22, 'ema2': 42, 'slip_atr_k': 0.12496953158502885, 'slip_spread_k': 0.9588851601268069, 'spread_hl_frac': 0.0036481481686167654, 'bb_std_mult': 1.430630601055658, 'rsi_os': 46, 'rsi_ob': 81, 'vol_spike': 0.2998369462468142, 'adx_thresh': 19.26843121411269, 'atr_min_pct': 0.025911648267195685, 'atr_max_pct': 0.09376782757807112, 'tp_mult': 1.5357601368714762, 'tsl_mult': 0.14490895924773178, 'strategy': 'mean_reversion', 'time_stop': 224, 'use_sma': False, 'use_atr': True, 'use_adx': True, 'use_ema': True, 'use_spike': True, 'rsi_required': True, 'edge_k': 0.6182327418724205, 'edge_cap': 0.4693505416280798, 'bull_strategy': 'breakout', 'bull_bb_std_mult': 3.4675248648768044, 'bull_rsi_os': 40, 'bull_rsi_ob': 90, 'bull_adx_thresh': 15.38888945666788, 'bull_atr_min_pct': 0.012066243114299918, 'bull_atr_max_pct': 0.054890796892991825, 'bull_tp_mult': 2.647440284926782, 'bull_tsl_mult': 0.04410198895501399, 'bull_time_stop': 80, 'bull_use_sma': True, 'bull_use_ema': False, 'bull_use_atr': False, 'bull_use_adx': True, 'bull_use_spike': False, 'bull_rsi_required': True, 'bear_strategy': 'mean_reversion', 'bear_bb_std_mult': 2.7389331360433236, 'bear_rsi_os': 49, 'bear_rsi_ob': 75, 'bear_adx_thresh': 14.942895028124731, 'bear_atr_min_pct': 0.01899316682440935, 'bear_atr_max_pct': 0.1047533357187837, 'bear_tp_mult': 2.9210392130609386, 'bear_tsl_mult': 0.3865739137843814, 'bear_time_stop': 93, 'bear_use_sma': True, 'bear_use_ema': True, 'bear_use_atr': False, 'bear_use_adx': False, 'bear_use_spike': True, 'bear_rsi_required': True, 'sideways_strategy': 'breakout', 'sideways_bb_std_mult': 2.6108500828540664, 'sideways_rsi_os': 40, 'sideways_rsi_ob': 77, 'sideways_adx_thresh': 25.785082204771946, 'sideways_atr_min_pct': 0.0043117069293602504, 'sideways_atr_max_pct': 0.07775643385919248, 'sideways_tp_mult': 1.4483066247361105, 'sideways_tsl_mult': 0.30016701449654826, 'sideways_time_stop': 119, 'sideways_use_sma': False, 'sideways_use_ema': False, 'sideways_use_atr': False, 'sideways_use_adx': True, 'sideways_use_spike': False, 'sideways_rsi_required': False}.
[I 2025-08-30 21:13:32,840] Trial 210 finished with values: [-1000000000.0, 1000000000.0] and parameters: {'p_sma': 29, 'p_std': 46, 'p_atr': 23, 'p_adx': 17, 'rsi_period': 16, 'ema1': 21, 'ema2': 55, 'slip_atr_k': 0.19515578510187365, 'slip_spread_k': 0.7089750901872898, 'spread_hl_frac': 0.0248906642494959, 'bb_std_mult': 1.435823120074517, 'rsi_os': 46, 'rsi_ob': 77, 'vol_spike': 0.11529226084085425, 'adx_thresh': 23.68871330068452, 'atr_min_pct': 0.02716043482702772, 'atr_max_pct': 0.09322200677266555, 'tp_mult': 1.6288252147984061, 'tsl_mult': 0.8477211915022818, 'strategy': 'mean_reversion', 'time_stop': 219, 'use_sma': False, 'use_atr': True, 'use_adx': True, 'use_ema': True, 'use_spike': True, 'rsi_required': True, 'edge_k': 0.647787916505222, 'edge_cap': 0.9746105169390109, 'bull_strategy': 'breakout', 'bull_bb_std_mult': 0.721779225128715, 'bull_rsi_os': 19, 'bull_rsi_ob': 70, 'bull_adx_thresh': 14.384737992081211, 'bull_atr_min_pct': 0.01347360085648839, 'bull_atr_max_pct': 0.1113651987023018, 'bull_tp_mult': 2.6350400000687224, 'bull_tsl_mult': 0.5464678193778972, 'bull_time_stop': 134, 'bull_use_sma': True, 'bull_use_ema': False, 'bull_use_atr': False, 'bull_use_adx': True, 'bull_use_spike': True, 'bull_rsi_required': True, 'bear_strategy': 'mean_reversion', 'bear_bb_std_mult': 2.717329171602404, 'bear_rsi_os': 49, 'bear_rsi_ob': 50, 'bear_adx_thresh': 14.779445309738056, 'bear_atr_min_pct': 0.02245104337136956, 'bear_atr_max_pct': 0.014461907520060161, 'bear_tp_mult': 2.8247822417793285, 'bear_tsl_mult': 0.030556450325912476, 'bear_time_stop': 92, 'bear_use_sma': True, 'bear_use_ema': True, 'bear_use_atr': False, 'bear_use_adx': True, 'bear_use_spike': True, 'bear_rsi_required': True, 'sideways_strategy': 'breakout', 'sideways_bb_std_mult': 2.7571332638029067, 'sideways_rsi_os': 14, 'sideways_rsi_ob': 80, 'sideways_adx_thresh': 26.248631677565065, 'sideways_atr_min_pct': 0.01693608229333452, 'sideways_atr_max_pct': 0.07563917281233729, 'sideways_tp_mult': 1.4446557131274544, 'sideways_tsl_mult': 0.3202263644654841, 'sideways_time_stop': 37, 'sideways_use_sma': False, 'sideways_use_ema': True, 'sideways_use_atr': True, 'sideways_use_adx': False, 'sideways_use_spike': False, 'sideways_rsi_required': True}.
[I 2025-08-30 21:13:33,339] Trial 208 finished with values: [-1000000000.0, 1000000000.0] and parameters: {'p_sma': 30, 'p_std': 54, 'p_atr': 16, 'p_adx': 23, 'rsi_period': 20, 'ema1': 25, 'ema2': 43, 'slip_atr_k': 0.122399750931272, 'slip_spread_k': 0.8154268132074783, 'spread_hl_frac': 0.007080169763167703, 'bb_std_mult': 1.6219167079287795, 'rsi_os': 44, 'rsi_ob': 81, 'vol_spike': 0.07709944802507497, 'adx_thresh': 29.260996106743814, 'atr_min_pct': 0.028468608557088135, 'atr_max_pct': 0.09313442089319354, 'tp_mult': 1.5847301255770023, 'tsl_mult': 0.019103115717754915, 'strategy': 'mean_reversion', 'time_stop': 58, 'use_sma': False, 'use_atr': True, 'use_adx': True, 'use_ema': True, 'use_spike': True, 'rsi_required': True, 'edge_k': 0.6526234644734114, 'edge_cap': 0.6817378265528552, 'bull_strategy': 'breakout', 'bull_bb_std_mult': 3.474340091943607, 'bull_rsi_os': 18, 'bull_rsi_ob': 72, 'bull_adx_thresh': 22.527806211423105, 'bull_atr_min_pct': 0.011797672816248847, 'bull_atr_max_pct': 0.1113874429117581, 'bull_tp_mult': 2.581063340688325, 'bull_tsl_mult': 0.2425648810534865, 'bull_time_stop': 135, 'bull_use_sma': True, 'bull_use_ema': False, 'bull_use_atr': False, 'bull_use_adx': True, 'bull_use_spike': True, 'bull_rsi_required': True, 'bear_strategy': 'mean_reversion', 'bear_bb_std_mult': 2.4916572826361616, 'bear_rsi_os': 15, 'bear_rsi_ob': 52, 'bear_adx_thresh': 16.981289223222376, 'bear_atr_min_pct': 0.019030197648356104, 'bear_atr_max_pct': 0.07734434302237345, 'bear_tp_mult': 1.3230942332521298, 'bear_tsl_mult': 0.41591391068182937, 'bear_time_stop': 105, 'bear_use_sma': True, 'bear_use_ema': True, 'bear_use_atr': False, 'bear_use_adx': True, 'bear_use_spike': True, 'bear_rsi_required': True, 'sideways_strategy': 'breakout', 'sideways_bb_std_mult': 2.68185252340009, 'sideways_rsi_os': 40, 'sideways_rsi_ob': 65, 'sideways_adx_thresh': 31.951660687331074, 'sideways_atr_min_pct': 0.012733201964690037, 'sideways_atr_max_pct': 0.020673480073232747, 'sideways_tp_mult': 2.5724136685936503, 'sideways_tsl_mult': 0.6589460156666813, 'sideways_time_stop': 217, 'sideways_use_sma': False, 'sideways_use_ema': True, 'sideways_use_atr': True, 'sideways_use_adx': False, 'sideways_use_spike': False, 'sideways_rsi_required': True}.
[I 2025-08-30 21:13:34,003] Trial 212 finished with values: [-1000000000.0, 1000000000.0] and parameters: {'p_sma': 26, 'p_std': 26, 'p_atr': 22, 'p_adx': 28, 'rsi_period': 16, 'ema1': 21, 'ema2': 55, 'slip_atr_k': 0.14630056482848436, 'slip_spread_k': 0.2905286174672328, 'spread_hl_frac': 0.0031514933816084, 'bb_std_mult': 1.4060945652095225, 'rsi_os': 46, 'rsi_ob': 81, 'vol_spike': 0.29984503498314585, 'adx_thresh': 22.718209302356097, 'atr_min_pct': 8.553105278976195e-06, 'atr_max_pct': 0.01017663286422718, 'tp_mult': 1.6408497345571562, 'tsl_mult': 0.31487923222785064, 'strategy': 'mean_reversion', 'time_stop': 226, 'use_sma': False, 'use_atr': True, 'use_adx': True, 'use_ema': True, 'use_spike': True, 'rsi_required': True, 'edge_k': 0.6013470215427916, 'edge_cap': 0.4647318126602834, 'bull_strategy': 'breakout', 'bull_bb_std_mult': 3.2435948180306853, 'bull_rsi_os': 15, 'bull_rsi_ob': 90, 'bull_adx_thresh': 15.583934977255058, 'bull_atr_min_pct': 0.00144037098066971, 'bull_atr_max_pct': 0.03815423225806321, 'bull_tp_mult': 2.6511301533241207, 'bull_tsl_mult': 0.5434928492851769, 'bull_time_stop': 300, 'bull_use_sma': True, 'bull_use_ema': False, 'bull_use_atr': False, 'bull_use_adx': True, 'bull_use_spike': False, 'bull_rsi_required': True, 'bear_strategy': 'mean_reversion', 'bear_bb_std_mult': 3.169524695910237, 'bear_rsi_os': 22, 'bear_rsi_ob': 50, 'bear_adx_thresh': 18.49860824023406, 'bear_atr_min_pct': 0.019152833283356117, 'bear_atr_max_pct': 0.06909092279498506, 'bear_tp_mult': 2.959497625103128, 'bear_tsl_mult': 0.3016007575768512, 'bear_time_stop': 91, 'bear_use_sma': True, 'bear_use_ema': True, 'bear_use_atr': False, 'bear_use_adx': False, 'bear_use_spike': True, 'bear_rsi_required': True, 'sideways_strategy': 'breakout', 'sideways_bb_std_mult': 2.618999267176985, 'sideways_rsi_os': 12, 'sideways_rsi_ob': 74, 'sideways_adx_thresh': 24.80649223137314, 'sideways_atr_min_pct': 0.019928255495015326, 'sideways_atr_max_pct': 0.04246035634069776, 'sideways_tp_mult': 2.5840515695685626, 'sideways_tsl_mult': 0.3175414172747398, 'sideways_time_stop': 120, 'sideways_use_sma': False, 'sideways_use_ema': False, 'sideways_use_atr': False, 'sideways_use_adx': True, 'sideways_use_spike': False, 'sideways_rsi_required': False}.
[I 2025-08-30 21:14:07,633] Trial 215 finished with values: [-1000000000.0, 1000000000.0] and parameters: {'p_sma': 27, 'p_std': 16, 'p_atr': 14, 'p_adx': 29, 'rsi_period': 67, 'ema1': 16, 'ema2': 43, 'slip_atr_k': 0.14563292002619138, 'slip_spread_k': 0.8339536059697278, 'spread_hl_frac': 0.003886390091425254, 'bb_std_mult': 1.5746567697261362, 'rsi_os': 45, 'rsi_ob': 79, 'vol_spike': 0.28184844314911645, 'adx_thresh': 22.559043003198404, 'atr_min_pct': 0.00068451669325669, 'atr_max_pct': 0.08996465147785188, 'tp_mult': 1.6751541507838357, 'tsl_mult': 0.8461084379636504, 'strategy': 'mean_reversion', 'time_stop': 203, 'use_sma': True, 'use_atr': True, 'use_adx': True, 'use_ema': True, 'use_spike': True, 'rsi_required': True, 'edge_k': 0.5842682337782684, 'edge_cap': 0.5920811260469687, 'bull_strategy': 'breakout', 'bull_bb_std_mult': 1.0416836445800974, 'bull_rsi_os': 15, 'bull_rsi_ob': 66, 'bull_adx_thresh': 33.10320913996718, 'bull_atr_min_pct': 0.001431995195725443, 'bull_atr_max_pct': 0.061996680653670776, 'bull_tp_mult': 2.526471417485028, 'bull_tsl_mult': 0.012537519737000138, 'bull_time_stop': 216, 'bull_use_sma': True, 'bull_use_ema': False, 'bull_use_atr': False, 'bull_use_adx': False, 'bull_use_spike': False, 'bull_rsi_required': True, 'bear_strategy': 'mean_reversion', 'bear_bb_std_mult': 3.150122799113745, 'bear_rsi_os': 50, 'bear_rsi_ob': 54, 'bear_adx_thresh': 16.206575420134143, 'bear_atr_min_pct': 0.017689742628558113, 'bear_atr_max_pct': 0.1193213334682571, 'bear_tp_mult': 2.963562062225738, 'bear_tsl_mult': 0.29771941299765753, 'bear_time_stop': 120, 'bear_use_sma': False, 'bear_use_ema': False, 'bear_use_atr': False, 'bear_use_adx': False, 'bear_use_spike': True, 'bear_rsi_required': True, 'sideways_strategy': 'breakout', 'sideways_bb_std_mult': 0.6183951903239651, 'sideways_rsi_os': 38, 'sideways_rsi_ob': 95, 'sideways_adx_thresh': 10.650874660372743, 'sideways_atr_min_pct': 0.008813148028913656, 'sideways_atr_max_pct': 0.04919062948110062, 'sideways_tp_mult': 2.6021397891728437, 'sideways_tsl_mult': 0.28698227200267995, 'sideways_time_stop': 293, 'sideways_use_sma': False, 'sideways_use_ema': False, 'sideways_use_atr': False, 'sideways_use_adx': True, 'sideways_use_spike': False, 'sideways_rsi_required': False}.
[I 2025-08-30 21:14:08,187] Trial 214 finished with values: [-1000000000.0, 1000000000.0] and parameters: {'p_sma': 27, 'p_std': 54, 'p_atr': 19, 'p_adx': 25, 'rsi_period': 48, 'ema1': 16, 'ema2': 43, 'slip_atr_k': 0.2398746027838673, 'slip_spread_k': 0.8210695843860459, 'spread_hl_frac': 0.004232544824257422, 'bb_std_mult': 1.5933902172356296, 'rsi_os': 45, 'rsi_ob': 79, 'vol_spike': 0.2842756239539728, 'adx_thresh': 24.685432639946903, 'atr_min_pct': 4.006871060534953e-05, 'atr_max_pct': 0.02480708832521654, 'tp_mult': 1.6500213953103473, 'tsl_mult': 0.8446861760573664, 'strategy': 'mean_reversion', 'time_stop': 204, 'use_sma': True, 'use_atr': True, 'use_adx': True, 'use_ema': True, 'use_spike': True, 'rsi_required': True, 'edge_k': 0.5918775789973294, 'edge_cap': 0.5944625260952178, 'bull_strategy': 'breakout', 'bull_bb_std_mult': 3.2311509069814135, 'bull_rsi_os': 47, 'bull_rsi_ob': 66, 'bull_adx_thresh': 13.53270178496578, 'bull_atr_min_pct': 0.0009172661111876532, 'bull_atr_max_pct': 0.10637129707143503, 'bull_tp_mult': 2.5226881336049813, 'bull_tsl_mult': 0.012511690293257507, 'bull_time_stop': 64, 'bull_use_sma': True, 'bull_use_ema': False, 'bull_use_atr': False, 'bull_use_adx': True, 'bull_use_spike': False, 'bull_rsi_required': True, 'bear_strategy': 'mean_reversion', 'bear_bb_std_mult': 2.8475536264934407, 'bear_rsi_os': 16, 'bear_rsi_ob': 65, 'bear_adx_thresh': 16.32225595722575, 'bear_atr_min_pct': 0.017467538180765373, 'bear_atr_max_pct': 0.037776822859520845, 'bear_tp_mult': 2.1793867527024937, 'bear_tsl_mult': 0.9588266003295185, 'bear_time_stop': 88, 'bear_use_sma': False, 'bear_use_ema': False, 'bear_use_atr': False, 'bear_use_adx': False, 'bear_use_spike': True, 'bear_rsi_required': True, 'sideways_strategy': 'breakout', 'sideways_bb_std_mult': 1.0920143143962986, 'sideways_rsi_os': 40, 'sideways_rsi_ob': 64, 'sideways_adx_thresh': 32.22451838074255, 'sideways_atr_min_pct': 0.008603620600899076, 'sideways_atr_max_pct': 0.019443653561945072, 'sideways_tp_mult': 2.6233302208313556, 'sideways_tsl_mult': 0.002902098564910416, 'sideways_time_stop': 203, 'sideways_use_sma': False, 'sideways_use_ema': False, 'sideways_use_atr': False, 'sideways_use_adx': True, 'sideways_use_spike': False, 'sideways_rsi_required': False}.
[I 2025-08-30 21:14:08,347] Trial 216 finished with values: [-0.024097621334617347, 0.024111354532253316] and parameters: {'p_sma': 27, 'p_std': 12, 'p_atr': 29, 'p_adx': 9, 'rsi_period': 19, 'ema1': 27, 'ema2': 43, 'slip_atr_k': 0.031812203859001936, 'slip_spread_k': 0.7529832605057226, 'spread_hl_frac': 0.02930698831383457, 'bb_std_mult': 2.5101527318068046, 'rsi_os': 45, 'rsi_ob': 79, 'vol_spike': 0.28154106512461957, 'adx_thresh': 25.1382022956773, 'atr_min_pct': 0.0007340092516186056, 'atr_max_pct': 0.09888032298590152, 'tp_mult': 1.6890671970823765, 'tsl_mult': 0.845743842210133, 'strategy': 'mean_reversion', 'time_stop': 202, 'use_sma': True, 'use_atr': False, 'use_adx': True, 'use_ema': False, 'use_spike': True, 'rsi_required': True, 'edge_k': 0.7424820289806457, 'edge_cap': 0.5947627493463085, 'bull_strategy': 'breakout', 'bull_bb_std_mult': 1.0102934585106846, 'bull_rsi_os': 45, 'bull_rsi_ob': 66, 'bull_adx_thresh': 13.38276457069676, 'bull_atr_min_pct': 0.0008798473538853286, 'bull_atr_max_pct': 0.06606326598449687, 'bull_tp_mult': 2.5216923103269653, 'bull_tsl_mult': 0.031412530088592336, 'bull_time_stop': 65, 'bull_use_sma': True, 'bull_use_ema': False, 'bull_use_atr': False, 'bull_use_adx': False, 'bull_use_spike': False, 'bull_rsi_required': True, 'bear_strategy': 'mean_reversion', 'bear_bb_std_mult': 2.6565667571399683, 'bear_rsi_os': 50, 'bear_rsi_ob': 86, 'bear_adx_thresh': 16.36695633906018, 'bear_atr_min_pct': 0.017591430335635202, 'bear_atr_max_pct': 0.030430933682857583, 'bear_tp_mult': 2.0242149028012006, 'bear_tsl_mult': 0.9362010070934911, 'bear_time_stop': 118, 'bear_use_sma': False, 'bear_use_ema': False, 'bear_use_atr': False, 'bear_use_adx': False, 'bear_use_spike': True, 'bear_rsi_required': True, 'sideways_strategy': 'breakout', 'sideways_bb_std_mult': 1.0905949391969378, 'sideways_rsi_os': 38, 'sideways_rsi_ob': 67, 'sideways_adx_thresh': 22.976982483635133, 'sideways_atr_min_pct': 0.027667567893447452, 'sideways_atr_max_pct': 0.01266543036310994, 'sideways_tp_mult': 2.6356470174733384, 'sideways_tsl_mult': 0.7432098126648317, 'sideways_time_stop': 294, 'sideways_use_sma': False, 'sideways_use_ema': False, 'sideways_use_atr': False, 'sideways_use_adx': True, 'sideways_use_spike': False, 'sideways_rsi_required': False}.
