[I 2025-08-30 22:12:03,867] Trial 695 finished with values: [-1000000000.0, 1000000000.0] and parameters: {'p_sma': 31, 'p_std': 37, 'p_atr': 26, 'p_adx': 22, 'rsi_period': 73, 'ema1': 12, 'ema2': 51, 'slip_atr_k': 0.03172059736063243, 'slip_spread_k': 0.6689277938124224, 'spread_hl_frac': 0.03124815693559415, 'bb_std_mult': 0.755925468512858, 'rsi_os': 11, 'rsi_ob': 89, 'vol_spike': 0.29107250251813754, 'adx_thresh': 32.11506709512003, 'atr_min_pct': 0.02385169417093423, 'atr_max_pct': 0.016471420964980478, 'tp_mult': 1.800993898194808, 'tsl_mult': 0.923123334552143, 'strategy': 'mean_reversion', 'time_stop': 288, 'use_sma': True, 'use_atr': True, 'use_adx': True, 'use_ema': True, 'use_spike': True, 'rsi_required': True, 'edge_k': 0.9381760408284157, 'edge_cap': 0.42373665716523135, 'bull_strategy': 'breakout', 'bull_bb_std_mult': 1.7221881005047872, 'bull_rsi_os': 14, 'bull_rsi_ob': 88, 'bull_adx_thresh': 13.13890528615293, 'bull_atr_min_pct': 0.024049472910866784, 'bull_atr_max_pct': 0.05462293015411431, 'bull_tp_mult': 2.4898510993190985, 'bull_tsl_mult': 0.3924574787178708, 'bull_time_stop': 18, 'bull_use_sma': True, 'bull_use_ema': False, 'bull_use_atr': False, 'bull_use_adx': False, 'bull_use_spike': False, 'bull_rsi_required': True, 'bear_strategy': 'mean_reversion', 'bear_bb_std_mult': 2.0380249792842955, 'bear_rsi_os': 6, 'bear_rsi_ob': 74, 'bear_adx_thresh': 19.567186043828418, 'bear_atr_min_pct': 0.029974546830090976, 'bear_atr_max_pct': 0.11207977586691972, 'bear_tp_mult': 2.4679603822657543, 'bear_tsl_mult': 0.03714270066254921, 'bear_time_stop': 293, 'bear_use_sma': False, 'bear_use_ema': True, 'bear_use_atr': False, 'bear_use_adx': True, 'bear_use_spike': True, 'bear_rsi_required': True, 'sideways_strategy': 'breakout', 'sideways_bb_std_mult': 2.550443403931727, 'sideways_rsi_os': 39, 'sideways_rsi_ob': 85, 'sideways_adx_thresh': 31.17174693377916, 'sideways_atr_min_pct': 0.023401523576447363, 'sideways_atr_max_pct': 0.12469594587694141, 'sideways_tp_mult': 1.8519975571083327, 'sideways_tsl_mult': 0.805987084663792, 'sideways_time_stop': 281, 'sideways_use_sma': False, 'sideways_use_ema': False, 'sideways_use_atr': False, 'sideways_use_adx': True, 'sideways_use_spike': False, 'sideways_rsi_required': False}.
[I 2025-08-30 22:12:19,623] Trial 690 finished with values: [-1000000000.0, 1000000000.0] and parameters: {'p_sma': 34, 'p_std': 60, 'p_atr': 25, 'p_adx': 13, 'rsi_period': 73, 'ema1': 12, 'ema2': 29, 'slip_atr_k': 0.030262491521093695, 'slip_spread_k': 0.5958725122251589, 'spread_hl_frac': 0.0317541548873777, 'bb_std_mult': 0.790984711490901, 'rsi_os': 11, 'rsi_ob': 90, 'vol_spike': 0.2704974282802792, 'adx_thresh': 9.4454448281836, 'atr_min_pct': 0.011008490344546765, 'atr_max_pct': 0.1198463733693858, 'tp_mult': 2.0409053593231197, 'tsl_mult': 0.0914027960093381, 'strategy': 'mean_reversion', 'time_stop': 227, 'use_sma': True, 'use_atr': False, 'use_adx': True, 'use_ema': True, 'use_spike': True, 'rsi_required': True, 'edge_k': 1.037771048040473, 'edge_cap': 0.7970181724528471, 'bull_strategy': 'breakout', 'bull_bb_std_mult': 2.0905219906362826, 'bull_rsi_os': 16, 'bull_rsi_ob': 84, 'bull_adx_thresh': 13.033168783516299, 'bull_atr_min_pct': 0.02398739610739633, 'bull_atr_max_pct': 0.05515306935701968, 'bull_tp_mult': 1.4139021381397225, 'bull_tsl_mult': 0.42333746182454224, 'bull_time_stop': 212, 'bull_use_sma': True, 'bull_use_ema': False, 'bull_use_atr': False, 'bull_use_adx': False, 'bull_use_spike': False, 'bull_rsi_required': True, 'bear_strategy': 'breakout', 'bear_bb_std_mult': 2.009334830376393, 'bear_rsi_os': 7, 'bear_rsi_ob': 72, 'bear_adx_thresh': 34.2588576902001, 'bear_atr_min_pct': 0.028904441756375708, 'bear_atr_max_pct': 0.14741956419203933, 'bear_tp_mult': 2.467453291746403, 'bear_tsl_mult': 0.34927841412903493, 'bear_time_stop': 236, 'bear_use_sma': False, 'bear_use_ema': False, 'bear_use_atr': False, 'bear_use_adx': True, 'bear_use_spike': False, 'bear_rsi_required': True, 'sideways_strategy': 'breakout', 'sideways_bb_std_mult': 1.6535426728305578, 'sideways_rsi_os': 39, 'sideways_rsi_ob': 80, 'sideways_adx_thresh': 31.118917634760606, 'sideways_atr_min_pct': 0.02071417344749111, 'sideways_atr_max_pct': 0.02243108714187586, 'sideways_tp_mult': 1.6953930113314863, 'sideways_tsl_mult': 0.809570392704243, 'sideways_time_stop': 265, 'sideways_use_sma': False, 'sideways_use_ema': False, 'sideways_use_atr': True, 'sideways_use_adx': False, 'sideways_use_spike': False, 'sideways_rsi_required': False}.
[I 2025-08-30 22:12:21,535] Trial 693 finished with values: [-1000000000.0, 1000000000.0] and parameters: {'p_sma': 50, 'p_std': 37, 'p_atr': 20, 'p_adx': 22, 'rsi_period': 73, 'ema1': 25, 'ema2': 51, 'slip_atr_k': 0.030557614055946702, 'slip_spread_k': 0.09666207621050255, 'spread_hl_frac': 0.008826990955903107, 'bb_std_mult': 0.7577133393353536, 'rsi_os': 12, 'rsi_ob': 65, 'vol_spike': 0.009275805420687289, 'adx_thresh': 27.59438757623071, 'atr_min_pct': 0.010875999320450302, 'atr_max_pct': 0.01639363142634677, 'tp_mult': 1.3235868864810083, 'tsl_mult': 0.5894144118150728, 'strategy': 'mean_reversion', 'time_stop': 94, 'use_sma': True, 'use_atr': True, 'use_adx': True, 'use_ema': True, 'use_spike': True, 'rsi_required': True, 'edge_k': 1.0869956816276551, 'edge_cap': 0.7979426308700005, 'bull_strategy': 'breakout', 'bull_bb_std_mult': 0.785538917331134, 'bull_rsi_os': 14, 'bull_rsi_ob': 56, 'bull_adx_thresh': 13.341738320478528, 'bull_atr_min_pct': 0.018963518612658735, 'bull_atr_max_pct': 0.10939959556271796, 'bull_tp_mult': 1.427115747786889, 'bull_tsl_mult': 0.3929161878482869, 'bull_time_stop': 204, 'bull_use_sma': True, 'bull_use_ema': False, 'bull_use_atr': False, 'bull_use_adx': False, 'bull_use_spike': False, 'bull_rsi_required': True, 'bear_strategy': 'breakout', 'bear_bb_std_mult': 0.6558950510213026, 'bear_rsi_os': 54, 'bear_rsi_ob': 74, 'bear_adx_thresh': 33.43573978098745, 'bear_atr_min_pct': 0.02943366467422012, 'bear_atr_max_pct': 0.11255184331454766, 'bear_tp_mult': 1.4873275736694094, 'bear_tsl_mult': 0.3945554905718609, 'bear_time_stop': 207, 'bear_use_sma': False, 'bear_use_ema': True, 'bear_use_atr': False, 'bear_use_adx': False, 'bear_use_spike': True, 'bear_rsi_required': True, 'sideways_strategy': 'mean_reversion', 'sideways_bb_std_mult': 1.7304356393133946, 'sideways_rsi_os': 17, 'sideways_rsi_ob': 89, 'sideways_adx_thresh': 30.22916444316221, 'sideways_atr_min_pct': 0.020579156685448987, 'sideways_atr_max_pct': 0.13054728433769508, 'sideways_tp_mult': 1.849232747516895, 'sideways_tsl_mult': 0.8049086071188225, 'sideways_time_stop': 97, 'sideways_use_sma': False, 'sideways_use_ema': False, 'sideways_use_atr': True, 'sideways_use_adx': False, 'sideways_use_spike': False, 'sideways_rsi_required': False}.
[I 2025-08-30 22:12:35,782] Trial 699 finished with values: [-1000000000.0, 1000000000.0] and parameters: {'p_sma': 33, 'p_std': 41, 'p_atr': 22, 'p_adx': 20, 'rsi_period': 67, 'ema1': 11, 'ema2': 55, 'slip_atr_k': 0.02003003784093983, 'slip_spread_k': 0.6536687017870548, 'spread_hl_frac': 0.018649863791180336, 'bb_std_mult': 0.927807530773727, 'rsi_os': 20, 'rsi_ob': 58, 'vol_spike': 0.2827898203956364, 'adx_thresh': 17.7652822902018, 'atr_min_pct': 0.027642823274671307, 'atr_max_pct': 0.025512334567485882, 'tp_mult': 1.632556902095186, 'tsl_mult': 0.8791385626207566, 'strategy': 'mean_reversion', 'time_stop': 81, 'use_sma': False, 'use_atr': True, 'use_adx': True, 'use_ema': True, 'use_spike': True, 'rsi_required': True, 'edge_k': 0.5988536095765713, 'edge_cap': 0.8453933132234059, 'bull_strategy': 'mean_reversion', 'bull_bb_std_mult': 1.9292645651310705, 'bull_rsi_os': 16, 'bull_rsi_ob': 65, 'bull_adx_thresh': 13.955258946506751, 'bull_atr_min_pct': 6.061903936049624e-07, 'bull_atr_max_pct': 0.06182082344337633, 'bull_tp_mult': 1.3677687016784827, 'bull_tsl_mult': 0.7985976784209601, 'bull_time_stop': 295, 'bull_use_sma': False, 'bull_use_ema': False, 'bull_use_atr': False, 'bull_use_adx': False, 'bull_use_spike': False, 'bull_rsi_required': True, 'bear_strategy': 'mean_reversion', 'bear_bb_std_mult': 1.80619457547047, 'bear_rsi_os': 5, 'bear_rsi_ob': 69, 'bear_adx_thresh': 26.779600126817623, 'bear_atr_min_pct': 0.007289543823529738, 'bear_atr_max_pct': 0.11971186374281925, 'bear_tp_mult': 1.5669623983760756, 'bear_tsl_mult': 0.44141459017675394, 'bear_time_stop': 231, 'bear_use_sma': False, 'bear_use_ema': True, 'bear_use_atr': False, 'bear_use_adx': True, 'bear_use_spike': True, 'bear_rsi_required': True, 'sideways_strategy': 'breakout', 'sideways_bb_std_mult': 1.2274892809840616, 'sideways_rsi_os': 38, 'sideways_rsi_ob': 87, 'sideways_adx_thresh': 29.35106165280002, 'sideways_atr_min_pct': 0.01672347362676086, 'sideways_atr_max_pct': 0.04555210952271631, 'sideways_tp_mult': 1.8052546196553985, 'sideways_tsl_mult': 0.784284811548017, 'sideways_time_stop': 252, 'sideways_use_sma': False, 'sideways_use_ema': False, 'sideways_use_atr': False, 'sideways_use_adx': True, 'sideways_use_spike': False, 'sideways_rsi_required': False}.
[I 2025-08-30 22:12:37,296] Trial 696 finished with values: [-1000000000.0, 1000000000.0] and parameters: {'p_sma': 58, 'p_std': 39, 'p_atr': 12, 'p_adx': 7, 'rsi_period': 73, 'ema1': 12, 'ema2': 54, 'slip_atr_k': 0.028749153071938365, 'slip_spread_k': 0.330883323660267, 'spread_hl_frac': 0.037035571931457865, 'bb_std_mult': 0.9569596876671265, 'rsi_os': 11, 'rsi_ob': 62, 'vol_spike': 0.29077641050003356, 'adx_thresh': 25.89105324901437, 'atr_min_pct': 0.01378075910449068, 'atr_max_pct': 0.015977727302206604, 'tp_mult': 1.7053873105822546, 'tsl_mult': 0.9177192515016691, 'strategy': 'mean_reversion', 'time_stop': 201, 'use_sma': True, 'use_atr': True, 'use_adx': True, 'use_ema': True, 'use_spike': True, 'rsi_required': True, 'edge_k': 1.4754766512554551, 'edge_cap': 0.8417050710107082, 'bull_strategy': 'breakout', 'bull_bb_std_mult': 2.072431515616789, 'bull_rsi_os': 14, 'bull_rsi_ob': 60, 'bull_adx_thresh': 8.730690710316516, 'bull_atr_min_pct': 0.027233620659064116, 'bull_atr_max_pct': 0.060342353928012675, 'bull_tp_mult': 1.3774930173953146, 'bull_tsl_mult': 0.6422287871703469, 'bull_time_stop': 212, 'bull_use_sma': True, 'bull_use_ema': False, 'bull_use_atr': False, 'bull_use_adx': False, 'bull_use_spike': False, 'bull_rsi_required': True, 'bear_strategy': 'mean_reversion', 'bear_bb_std_mult': 2.0389255343015753, 'bear_rsi_os': 7, 'bear_rsi_ob': 62, 'bear_adx_thresh': 26.858711023455445, 'bear_atr_min_pct': 0.027937668351294884, 'bear_atr_max_pct': 0.11271532828827743, 'bear_tp_mult': 1.5827529414839097, 'bear_tsl_mult': 0.4390963563766307, 'bear_time_stop': 185, 'bear_use_sma': False, 'bear_use_ema': True, 'bear_use_atr': False, 'bear_use_adx': True, 'bear_use_spike': True, 'bear_rsi_required': True, 'sideways_strategy': 'breakout', 'sideways_bb_std_mult': 0.5644419808331469, 'sideways_rsi_os': 39, 'sideways_rsi_ob': 87, 'sideways_adx_thresh': 28.62815615404477, 'sideways_atr_min_pct': 0.02485895535714803, 'sideways_atr_max_pct': 0.133975021312609, 'sideways_tp_mult': 1.8048397679147417, 'sideways_tsl_mult': 0.7960082598416344, 'sideways_time_stop': 252, 'sideways_use_sma': False, 'sideways_use_ema': False, 'sideways_use_atr': False, 'sideways_use_adx': True, 'sideways_use_spike': False, 'sideways_rsi_required': False}.
[I 2025-08-30 22:12:38,219] Trial 697 finished with values: [-1000000000.0, 1000000000.0] and parameters: {'p_sma': 34, 'p_std': 29, 'p_atr': 12, 'p_adx': 21, 'rsi_period': 74, 'ema1': 11, 'ema2': 54, 'slip_atr_k': 0.22270680153774963, 'slip_spread_k': 0.32809002556448896, 'spread_hl_frac': 0.008653825525661959, 'bb_std_mult': 0.611600966846767, 'rsi_os': 10, 'rsi_ob': 90, 'vol_spike': 0.009622134374236313, 'adx_thresh': 25.860253928758247, 'atr_min_pct': 0.010926277923800215, 'atr_max_pct': 0.12513061918457027, 'tp_mult': 2.6750405374976474, 'tsl_mult': 0.859301433503989, 'strategy': 'mean_reversion', 'time_stop': 80, 'use_sma': True, 'use_atr': True, 'use_adx': True, 'use_ema': True, 'use_spike': True, 'rsi_required': True, 'edge_k': 0.775793040730911, 'edge_cap': 0.8471185992829836, 'bull_strategy': 'breakout', 'bull_bb_std_mult': 2.047135873886278, 'bull_rsi_os': 35, 'bull_rsi_ob': 81, 'bull_adx_thresh': 31.583437343465576, 'bull_atr_min_pct': 0.012572877870708252, 'bull_atr_max_pct': 0.1085788877805232, 'bull_tp_mult': 1.3828595097652672, 'bull_tsl_mult': 0.3546453949033749, 'bull_time_stop': 211, 'bull_use_sma': True, 'bull_use_ema': False, 'bull_use_atr': False, 'bull_use_adx': False, 'bull_use_spike': False, 'bull_rsi_required': True, 'bear_strategy': 'mean_reversion', 'bear_bb_std_mult': 1.831376488894815, 'bear_rsi_os': 52, 'bear_rsi_ob': 62, 'bear_adx_thresh': 26.667877881493943, 'bear_atr_min_pct': 0.005061758214943136, 'bear_atr_max_pct': 0.1202397921777591, 'bear_tp_mult': 1.918314230790875, 'bear_tsl_mult': 0.3990295927869905, 'bear_time_stop': 185, 'bear_use_sma': False, 'bear_use_ema': True, 'bear_use_atr': False, 'bear_use_adx': True, 'bear_use_spike': True, 'bear_rsi_required': True, 'sideways_strategy': 'breakout', 'sideways_bb_std_mult': 1.204697214312186, 'sideways_rsi_os': 22, 'sideways_rsi_ob': 90, 'sideways_adx_thresh': 19.12581524996265, 'sideways_atr_min_pct': 0.021693770617153555, 'sideways_atr_max_pct': 0.045445331451182534, 'sideways_tp_mult': 1.797649283504807, 'sideways_tsl_mult': 0.7929035751182918, 'sideways_time_stop': 251, 'sideways_use_sma': False, 'sideways_use_ema': False, 'sideways_use_atr': False, 'sideways_use_adx': True, 'sideways_use_spike': False, 'sideways_rsi_required': False}.
[I 2025-08-30 22:12:48,066] Trial 698 finished with values: [-1000000000.0, 1000000000.0] and parameters: {'p_sma': 33, 'p_std': 42, 'p_atr': 22, 'p_adx': 21, 'rsi_period': 65, 'ema1': 11, 'ema2': 36, 'slip_atr_k': 0.019873820197558324, 'slip_spread_k': 0.6434935769024578, 'spread_hl_frac': 0.033373981859517926, 'bb_std_mult': 0.9399583814093433, 'rsi_os': 10, 'rsi_ob': 87, 'vol_spike': 0.28353545234638583, 'adx_thresh': 10.257830288865312, 'atr_min_pct': 0.01401236058287934, 'atr_max_pct': 0.025874122105007818, 'tp_mult': 1.6415513277458054, 'tsl_mult': 0.8652443016488213, 'strategy': 'mean_reversion', 'time_stop': 60, 'use_sma': False, 'use_atr': True, 'use_adx': True, 'use_ema': True, 'use_spike': True, 'rsi_required': True, 'edge_k': 1.423837888496006, 'edge_cap': 0.7355326144020928, 'bull_strategy': 'breakout', 'bull_bb_std_mult': 1.9468503090135736, 'bull_rsi_os': 53, 'bull_rsi_ob': 65, 'bull_adx_thresh': 5.934097021181575, 'bull_atr_min_pct': 0.012644103296815937, 'bull_atr_max_pct': 0.06072138410205988, 'bull_tp_mult': 2.7534445321397456, 'bull_tsl_mult': 0.7410663531950057, 'bull_time_stop': 300, 'bull_use_sma': True, 'bull_use_ema': False, 'bull_use_atr': False, 'bull_use_adx': False, 'bull_use_spike': False, 'bull_rsi_required': True, 'bear_strategy': 'mean_reversion', 'bear_bb_std_mult': 1.8290232225219338, 'bear_rsi_os': 5, 'bear_rsi_ob': 62, 'bear_adx_thresh': 26.793405269458468, 'bear_atr_min_pct': 0.008362704087574708, 'bear_atr_max_pct': 0.12075030164436112, 'bear_tp_mult': 2.1451749035940084, 'bear_tsl_mult': 0.4442275509766876, 'bear_time_stop': 217, 'bear_use_sma': False, 'bear_use_ema': True, 'bear_use_atr': False, 'bear_use_adx': True, 'bear_use_spike': True, 'bear_rsi_required': True, 'sideways_strategy': 'breakout', 'sideways_bb_std_mult': 1.209834304144175, 'sideways_rsi_os': 38, 'sideways_rsi_ob': 87, 'sideways_adx_thresh': 7.581909955916812, 'sideways_atr_min_pct': 0.021820587090787154, 'sideways_atr_max_pct': 0.046371456311162185, 'sideways_tp_mult': 1.8035523208058595, 'sideways_tsl_mult': 0.787215618763744, 'sideways_time_stop': 253, 'sideways_use_sma': False, 'sideways_use_ema': False, 'sideways_use_atr': False, 'sideways_use_adx': True, 'sideways_use_spike': False, 'sideways_rsi_required': False}.
[I 2025-08-30 22:13:11,601] Trial 700 finished with values: [-1000000000.0, 1000000000.0] and parameters: {'p_sma': 58, 'p_std': 39, 'p_atr': 12, 'p_adx': 21, 'rsi_period': 71, 'ema1': 29, 'ema2': 54, 'slip_atr_k': 0.22383690814051224, 'slip_spread_k': 0.6462253124449502, 'spread_hl_frac': 0.033321525957757746, 'bb_std_mult': 0.9840011818976409, 'rsi_os': 42, 'rsi_ob': 67, 'vol_spike': 0.16156858166354465, 'adx_thresh': 28.214976852523257, 'atr_min_pct': 0.013983168907887436, 'atr_max_pct': 0.07624362647918675, 'tp_mult': 1.6944555978167655, 'tsl_mult': 0.4454019697257081, 'strategy': 'mean_reversion', 'time_stop': 60, 'use_sma': True, 'use_atr': True, 'use_adx': False, 'use_ema': True, 'use_spike': False, 'rsi_required': True, 'edge_k': 0.7751305649801371, 'edge_cap': 0.48705317821751737, 'bull_strategy': 'breakout', 'bull_bb_std_mult': 1.850123526090503, 'bull_rsi_os': 53, 'bull_rsi_ob': 48, 'bull_adx_thresh': 33.68623462583904, 'bull_atr_min_pct': 0.001659083086522782, 'bull_atr_max_pct': 0.04901626936603187, 'bull_tp_mult': 1.4607340401867208, 'bull_tsl_mult': 0.643224504418418, 'bull_time_stop': 284, 'bull_use_sma': True, 'bull_use_ema': False, 'bull_use_atr': False, 'bull_use_adx': False, 'bull_use_spike': False, 'bull_rsi_required': True, 'bear_strategy': 'mean_reversion', 'bear_bb_std_mult': 0.5130271181242341, 'bear_rsi_os': 8, 'bear_rsi_ob': 60, 'bear_adx_thresh': 25.498533842445305, 'bear_atr_min_pct': 0.028212040439846556, 'bear_atr_max_pct': 0.059403733383708475, 'bear_tp_mult': 2.25133355557064, 'bear_tsl_mult': 0.46501145275901967, 'bear_time_stop': 218, 'bear_use_sma': False, 'bear_use_ema': True, 'bear_use_atr': False, 'bear_use_adx': True, 'bear_use_spike': True, 'bear_rsi_required': True, 'sideways_strategy': 'breakout', 'sideways_bb_std_mult': 0.5691730968834485, 'sideways_rsi_os': 37, 'sideways_rsi_ob': 90, 'sideways_adx_thresh': 7.531395800626669, 'sideways_atr_min_pct': 0.021597350360726793, 'sideways_atr_max_pct': 0.0367304546173101, 'sideways_tp_mult': 1.8043548554377289, 'sideways_tsl_mult': 0.7400093510736389, 'sideways_time_stop': 64, 'sideways_use_sma': True, 'sideways_use_ema': False, 'sideways_use_atr': False, 'sideways_use_adx': True, 'sideways_use_spike': True, 'sideways_rsi_required': False}.
[I 2025-08-30 22:13:15,604] Trial 701 finished with values: [-1000000000.0, 1000000000.0] and parameters: {'p_sma': 45, 'p_std': 35, 'p_atr': 21, 'p_adx': 21, 'rsi_period': 71, 'ema1': 10, 'ema2': 36, 'slip_atr_k': 0.2214916502983027, 'slip_spread_k': 0.9965903302654953, 'spread_hl_frac': 0.04993556071548929, 'bb_std_mult': 0.854703595572022, 'rsi_os': 10, 'rsi_ob': 67, 'vol_spike': 0.16009193086967916, 'adx_thresh': 32.906807481115855, 'atr_min_pct': 0.01294557626183671, 'atr_max_pct': 0.12505047893259058, 'tp_mult': 2.5924279260118195, 'tsl_mult': 0.524726652845711, 'strategy': 'mean_reversion', 'time_stop': 88, 'use_sma': True, 'use_atr': True, 'use_adx': False, 'use_ema': True, 'use_spike': False, 'rsi_required': True, 'edge_k': 0.7749053045211818, 'edge_cap': 0.7390652956218682, 'bull_strategy': 'breakout', 'bull_bb_std_mult': 1.43565370223013, 'bull_rsi_os': 19, 'bull_rsi_ob': 87, 'bull_adx_thresh': 14.59407684602062, 'bull_atr_min_pct': 0.00819586067230739, 'bull_atr_max_pct': 0.04783253135923303, 'bull_tp_mult': 1.4715839836178124, 'bull_tsl_mult': 0.3569571177293411, 'bull_time_stop': 285, 'bull_use_sma': True, 'bull_use_ema': False, 'bull_use_atr': False, 'bull_use_adx': False, 'bull_use_spike': False, 'bull_rsi_required': False, 'bear_strategy': 'mean_reversion', 'bear_bb_std_mult': 3.431662997626114, 'bear_rsi_os': 13, 'bear_rsi_ob': 93, 'bear_adx_thresh': 26.03052167146659, 'bear_atr_min_pct': 0.0013228368767882106, 'bear_atr_max_pct': 0.11676116572021296, 'bear_tp_mult': 2.53776728235821, 'bear_tsl_mult': 0.37040617100745954, 'bear_time_stop': 218, 'bear_use_sma': True, 'bear_use_ema': True, 'bear_use_atr': False, 'bear_use_adx': True, 'bear_use_spike': True, 'bear_rsi_required': False, 'sideways_strategy': 'breakout', 'sideways_bb_std_mult': 2.2665221531490767, 'sideways_rsi_os': 37, 'sideways_rsi_ob': 89, 'sideways_adx_thresh': 7.495325919957139, 'sideways_atr_min_pct': 0.021741803811074812, 'sideways_atr_max_pct': 0.036816467748566076, 'sideways_tp_mult': 1.735635500237303, 'sideways_tsl_mult': 0.7392517570161682, 'sideways_time_stop': 175, 'sideways_use_sma': True, 'sideways_use_ema': False, 'sideways_use_atr': False, 'sideways_use_adx': True, 'sideways_use_spike': True, 'sideways_rsi_required': False}.
