[I 2025-08-30 21:02:29,243] Trial 116 finished with values: [-1000000000.0, 1000000000.0] and parameters: {'p_sma': 32, 'p_std': 34, 'p_atr': 16, 'p_adx': 30, 'rsi_period': 34, 'ema1': 20, 'ema2': 42, 'slip_atr_k': 0.06244428597814726, 'slip_spread_k': 0.33567757664428016, 'spread_hl_frac': 0.005374052187149699, 'bb_std_mult': 1.7397067181644363, 'rsi_os': 49, 'rsi_ob': 72, 'vol_spike': 0.2817009615430785, 'adx_thresh': 25.47329206624859, 'atr_min_pct': 0.0014159825813921162, 'atr_max_pct': 0.012781482949598688, 'tp_mult': 1.3977528822303849, 'tsl_mult': 0.6288687178934704, 'strategy': 'breakout', 'time_stop': 244, 'use_sma': False, 'use_atr': False, 'use_adx': False, 'use_ema': True, 'use_spike': False, 'rsi_required': False, 'edge_k': 1.767837451131919, 'edge_cap': 0.6170169981966983, 'bull_strategy': 'breakout', 'bull_bb_std_mult': 3.550821744838194, 'bull_rsi_os': 25, 'bull_rsi_ob': 67, 'bull_adx_thresh': 14.243230658353387, 'bull_atr_min_pct': 0.0015287825250898464, 'bull_atr_max_pct': 0.05319586344704426, 'bull_tp_mult': 2.4618625567886396, 'bull_tsl_mult': 0.11840641135483065, 'bull_time_stop': 280, 'bull_use_sma': True, 'bull_use_ema': True, 'bull_use_atr': True, 'bull_use_adx': True, 'bull_use_spike': True, 'bull_rsi_required': True, 'bear_strategy': 'mean_reversion', 'bear_bb_std_mult': 2.6698097703282846, 'bear_rsi_os': 48, 'bear_rsi_ob': 49, 'bear_adx_thresh': 16.473531054159047, 'bear_atr_min_pct': 0.01542918102881893, 'bear_atr_max_pct': 0.03698745141509978, 'bear_tp_mult': 2.904130472148254, 'bear_tsl_mult': 0.35623319978664547, 'bear_time_stop': 111, 'bear_use_sma': True, 'bear_use_ema': True, 'bear_use_atr': False, 'bear_use_adx': True, 'bear_use_spike': False, 'bear_rsi_required': False, 'sideways_strategy': 'breakout', 'sideways_bb_std_mult': 2.096775982088255, 'sideways_rsi_os': 38, 'sideways_rsi_ob': 67, 'sideways_adx_thresh': 32.49378847637813, 'sideways_atr_min_pct': 0.010660960559870557, 'sideways_atr_max_pct': 0.012738343372426363, 'sideways_tp_mult': 1.139350491948471, 'sideways_tsl_mult': 0.28985927831945624, 'sideways_time_stop': 118, 'sideways_use_sma': True, 'sideways_use_ema': True, 'sideways_use_atr': True, 'sideways_use_adx': False, 'sideways_use_spike': True, 'sideways_rsi_required': True}.
[I 2025-08-30 21:02:29,634] Trial 120 finished with values: [-1000000000.0, 1000000000.0] and parameters: {'p_sma': 32, 'p_std': 40, 'p_atr': 19, 'p_adx': 29, 'rsi_period': 24, 'ema1': 18, 'ema2': 40, 'slip_atr_k': 0.05135653662662604, 'slip_spread_k': 0.11240490605488224, 'spread_hl_frac': 0.03015849329110775, 'bb_std_mult': 1.7459574181368784, 'rsi_os': 53, 'rsi_ob': 84, 'vol_spike': 0.24100767252850833, 'adx_thresh': 31.73412882315926, 'atr_min_pct': 0.0027415380764229977, 'atr_max_pct': 0.08756065826196201, 'tp_mult': 1.5523818023784508, 'tsl_mult': 0.7921840405932024, 'strategy': 'mean_reversion', 'time_stop': 198, 'use_sma': False, 'use_atr': False, 'use_adx': True, 'use_ema': True, 'use_spike': True, 'rsi_required': True, 'edge_k': 1.932471541865806, 'edge_cap': 0.5358520733886719, 'bull_strategy': 'breakout', 'bull_bb_std_mult': 3.281485989106102, 'bull_rsi_os': 24, 'bull_rsi_ob': 72, 'bull_adx_thresh': 14.124184815170109, 'bull_atr_min_pct': 4.1545019415372125e-05, 'bull_atr_max_pct': 0.08077922212648778, 'bull_tp_mult': 1.7313372153894933, 'bull_tsl_mult': 0.025260663766680402, 'bull_time_stop': 282, 'bull_use_sma': True, 'bull_use_ema': False, 'bull_use_atr': False, 'bull_use_adx': True, 'bull_use_spike': True, 'bull_rsi_required': True, 'bear_strategy': 'mean_reversion', 'bear_bb_std_mult': 2.2575656504754655, 'bear_rsi_os': 14, 'bear_rsi_ob': 57, 'bear_adx_thresh': 17.202653517091644, 'bear_atr_min_pct': 0.018772160866496537, 'bear_atr_max_pct': 0.03471116961756024, 'bear_tp_mult': 2.994549826707194, 'bear_tsl_mult': 0.40559969762342757, 'bear_time_stop': 161, 'bear_use_sma': True, 'bear_use_ema': True, 'bear_use_atr': False, 'bear_use_adx': True, 'bear_use_spike': True, 'bear_rsi_required': True, 'sideways_strategy': 'breakout', 'sideways_bb_std_mult': 1.4846607897986217, 'sideways_rsi_os': 38, 'sideways_rsi_ob': 67, 'sideways_adx_thresh': 31.827344400781254, 'sideways_atr_min_pct': 0.011486992077010663, 'sideways_atr_max_pct': 0.016022659154159555, 'sideways_tp_mult': 1.2237912368523616, 'sideways_tsl_mult': 0.19571075757031375, 'sideways_time_stop': 116, 'sideways_use_sma': True, 'sideways_use_ema': True, 'sideways_use_atr': True, 'sideways_use_adx': False, 'sideways_use_spike': True, 'sideways_rsi_required': True}.
[I 2025-08-30 21:03:02,789] Trial 118 finished with values: [-1000000000.0, 1000000000.0] and parameters: {'p_sma': 32, 'p_std': 35, 'p_atr': 15, 'p_adx': 29, 'rsi_period': 46, 'ema1': 20, 'ema2': 43, 'slip_atr_k': 0.04971206352459641, 'slip_spread_k': 0.6862783302237614, 'spread_hl_frac': 0.005943523295294873, 'bb_std_mult': 1.7151350184480378, 'rsi_os': 50, 'rsi_ob': 72, 'vol_spike': 0.2356324733127089, 'adx_thresh': 22.585958226583593, 'atr_min_pct': 0.0013714762662017622, 'atr_max_pct': 0.1253673212989725, 'tp_mult': 1.609460146088847, 'tsl_mult': 0.6263104664184422, 'strategy': 'breakout', 'time_stop': 217, 'use_sma': False, 'use_atr': False, 'use_adx': False, 'use_ema': True, 'use_spike': False, 'rsi_required': False, 'edge_k': 0.6441574799268438, 'edge_cap': 0.6147290788638842, 'bull_strategy': 'breakout', 'bull_bb_std_mult': 3.5144672488195896, 'bull_rsi_os': 25, 'bull_rsi_ob': 68, 'bull_adx_thresh': 14.591780622363801, 'bull_atr_min_pct': 0.0019747554054190854, 'bull_atr_max_pct': 0.054455554265511616, 'bull_tp_mult': 2.3523029611705892, 'bull_tsl_mult': 0.18067849334950248, 'bull_time_stop': 282, 'bull_use_sma': True, 'bull_use_ema': True, 'bull_use_atr': True, 'bull_use_adx': True, 'bull_use_spike': True, 'bull_rsi_required': False, 'bear_strategy': 'mean_reversion', 'bear_bb_std_mult': 2.8184349270917304, 'bear_rsi_os': 13, 'bear_rsi_ob': 90, 'bear_adx_thresh': 16.734513106781968, 'bear_atr_min_pct': 0.018790009186230354, 'bear_atr_max_pct': 0.03717914907849357, 'bear_tp_mult': 2.9774171321186857, 'bear_tsl_mult': 0.4015861173987966, 'bear_time_stop': 112, 'bear_use_sma': True, 'bear_use_ema': False, 'bear_use_atr': False, 'bear_use_adx': True, 'bear_use_spike': False, 'bear_rsi_required': False, 'sideways_strategy': 'breakout', 'sideways_bb_std_mult': 2.4857886920232057, 'sideways_rsi_os': 38, 'sideways_rsi_ob': 67, 'sideways_adx_thresh': 32.78859389620936, 'sideways_atr_min_pct': 0.01107890896193615, 'sideways_atr_max_pct': 0.016141801632553895, 'sideways_tp_mult': 1.1467645659779027, 'sideways_tsl_mult': 0.2602950406307231, 'sideways_time_stop': 145, 'sideways_use_sma': True, 'sideways_use_ema': True, 'sideways_use_atr': True, 'sideways_use_adx': False, 'sideways_use_spike': True, 'sideways_rsi_required': True}.
[I 2025-08-30 21:03:02,946] Trial 121 finished with values: [-1000000000.0, 1000000000.0] and parameters: {'p_sma': 24, 'p_std': 42, 'p_atr': 11, 'p_adx': 29, 'rsi_period': 52, 'ema1': 18, 'ema2': 40, 'slip_atr_k': 0.05110714801925115, 'slip_spread_k': 0.7827188321966131, 'spread_hl_frac': 0.0024167771203397223, 'bb_std_mult': 1.8487069975651493, 'rsi_os': 42, 'rsi_ob': 75, 'vol_spike': 0.24335852578291875, 'adx_thresh': 32.1921386567693, 'atr_min_pct': 0.002850525955271964, 'atr_max_pct': 0.1356701575924096, 'tp_mult': 1.5637821637472187, 'tsl_mult': 0.463450055547191, 'strategy': 'mean_reversion', 'time_stop': 199, 'use_sma': False, 'use_atr': True, 'use_adx': True, 'use_ema': True, 'use_spike': True, 'rsi_required': True, 'edge_k': 0.6565781705882473, 'edge_cap': 0.5313821582208118, 'bull_strategy': 'breakout', 'bull_bb_std_mult': 3.18926995120624, 'bull_rsi_os': 25, 'bull_rsi_ob': 72, 'bull_adx_thresh': 14.541036843503676, 'bull_atr_min_pct': 0.02091922901288052, 'bull_atr_max_pct': 0.08190547762401745, 'bull_tp_mult': 2.751257957745132, 'bull_tsl_mult': 0.1537400114042249, 'bull_time_stop': 270, 'bull_use_sma': True, 'bull_use_ema': False, 'bull_use_atr': False, 'bull_use_adx': True, 'bull_use_spike': True, 'bull_rsi_required': True, 'bear_strategy': 'mean_reversion', 'bear_bb_std_mult': 2.2348765883428414, 'bear_rsi_os': 6, 'bear_rsi_ob': 47, 'bear_adx_thresh': 17.750688596536563, 'bear_atr_min_pct': 0.015893193386673596, 'bear_atr_max_pct': 0.03512368773323317, 'bear_tp_mult': 2.8034529648664814, 'bear_tsl_mult': 0.30181228406527366, 'bear_time_stop': 103, 'bear_use_sma': True, 'bear_use_ema': False, 'bear_use_atr': False, 'bear_use_adx': True, 'bear_use_spike': True, 'bear_rsi_required': True, 'sideways_strategy': 'breakout', 'sideways_bb_std_mult': 1.541627969693618, 'sideways_rsi_os': 38, 'sideways_rsi_ob': 70, 'sideways_adx_thresh': 31.803867196095197, 'sideways_atr_min_pct': 0.008337974490945262, 'sideways_atr_max_pct': 0.018479832245596434, 'sideways_tp_mult': 2.6932476622203088, 'sideways_tsl_mult': 0.20008800070546257, 'sideways_time_stop': 144, 'sideways_use_sma': False, 'sideways_use_ema': True, 'sideways_use_atr': True, 'sideways_use_adx': False, 'sideways_use_spike': False, 'sideways_rsi_required': True}.
[I 2025-08-30 21:03:03,040] Trial 122 finished with values: [-1000000000.0, 1000000000.0] and parameters: {'p_sma': 25, 'p_std': 43, 'p_atr': 15, 'p_adx': 29, 'rsi_period': 74, 'ema1': 22, 'ema2': 26, 'slip_atr_k': 0.10116617076077185, 'slip_spread_k': 0.7877743608739421, 'spread_hl_frac': 0.002460797778090892, 'bb_std_mult': 1.82742461258534, 'rsi_os': 43, 'rsi_ob': 75, 'vol_spike': 0.26435461510837843, 'adx_thresh': 22.681778884056666, 'atr_min_pct': 0.0025112998530455294, 'atr_max_pct': 0.13554879575291406, 'tp_mult': 1.358996642395426, 'tsl_mult': 0.4810681478550899, 'strategy': 'mean_reversion', 'time_stop': 162, 'use_sma': False, 'use_atr': True, 'use_adx': True, 'use_ema': True, 'use_spike': True, 'rsi_required': True, 'edge_k': 0.6239580881158727, 'edge_cap': 0.8728857603974824, 'bull_strategy': 'breakout', 'bull_bb_std_mult': 3.1824276606953745, 'bull_rsi_os': 48, 'bull_rsi_ob': 57, 'bull_adx_thresh': 14.768892986536732, 'bull_atr_min_pct': 0.01999248377356877, 'bull_atr_max_pct': 0.135856914404535, 'bull_tp_mult': 2.662613241624577, 'bull_tsl_mult': 0.1594791061935709, 'bull_time_stop': 268, 'bull_use_sma': True, 'bull_use_ema': False, 'bull_use_atr': False, 'bull_use_adx': True, 'bull_use_spike': True, 'bull_rsi_required': False, 'bear_strategy': 'mean_reversion', 'bear_bb_std_mult': 3.515819567675446, 'bear_rsi_os': 18, 'bear_rsi_ob': 47, 'bear_adx_thresh': 6.414059662372077, 'bear_atr_min_pct': 0.019633982548567734, 'bear_atr_max_pct': 0.030354718294450547, 'bear_tp_mult': 2.824981249855014, 'bear_tsl_mult': 0.44463778391194647, 'bear_time_stop': 100, 'bear_use_sma': True, 'bear_use_ema': False, 'bear_use_atr': False, 'bear_use_adx': True, 'bear_use_spike': True, 'bear_rsi_required': True, 'sideways_strategy': 'breakout', 'sideways_bb_std_mult': 2.4968775863296653, 'sideways_rsi_os': 36, 'sideways_rsi_ob': 70, 'sideways_adx_thresh': 17.13042547980807, 'sideways_atr_min_pct': 0.008034450186589517, 'sideways_atr_max_pct': 0.016722060720231018, 'sideways_tp_mult': 2.5912921517537884, 'sideways_tsl_mult': 0.3259554018764983, 'sideways_time_stop': 145, 'sideways_use_sma': False, 'sideways_use_ema': True, 'sideways_use_atr': True, 'sideways_use_adx': False, 'sideways_use_spike': False, 'sideways_rsi_required': True}.
[I 2025-08-30 21:03:03,185] Trial 119 finished with values: [-1000000000.0, 1000000000.0] and parameters: {'p_sma': 32, 'p_std': 34, 'p_atr': 15, 'p_adx': 29, 'rsi_period': 28, 'ema1': 20, 'ema2': 40, 'slip_atr_k': 0.04798611186473702, 'slip_spread_k': 0.7772054337259621, 'spread_hl_frac': 0.022532473534556778, 'bb_std_mult': 1.7208522324342983, 'rsi_os': 40, 'rsi_ob': 84, 'vol_spike': 0.24240106560189856, 'adx_thresh': 22.686858806099327, 'atr_min_pct': 0.002545746356106688, 'atr_max_pct': 0.09348552644963554, 'tp_mult': 1.233821114352678, 'tsl_mult': 0.4776788028888576, 'strategy': 'breakout', 'time_stop': 216, 'use_sma': False, 'use_atr': False, 'use_adx': False, 'use_ema': True, 'use_spike': False, 'rsi_required': False, 'edge_k': 1.7417018625550371, 'edge_cap': 0.5544892931460115, 'bull_strategy': 'breakout', 'bull_bb_std_mult': 3.50959256766509, 'bull_rsi_os': 25, 'bull_rsi_ob': 68, 'bull_adx_thresh': 14.405847465540273, 'bull_atr_min_pct': 0.020337778234850657, 'bull_atr_max_pct': 0.06512100242052316, 'bull_tp_mult': 2.6519055934029807, 'bull_tsl_mult': 0.16119673930634126, 'bull_time_stop': 279, 'bull_use_sma': True, 'bull_use_ema': True, 'bull_use_atr': True, 'bull_use_adx': True, 'bull_use_spike': True, 'bull_rsi_required': True, 'bear_strategy': 'mean_reversion', 'bear_bb_std_mult': 2.823749723947903, 'bear_rsi_os': 49, 'bear_rsi_ob': 91, 'bear_adx_thresh': 17.959131667922573, 'bear_atr_min_pct': 0.011852041388387618, 'bear_atr_max_pct': 0.03646738363423653, 'bear_tp_mult': 2.8149261293284784, 'bear_tsl_mult': 0.40322383902340675, 'bear_time_stop': 110, 'bear_use_sma': True, 'bear_use_ema': False, 'bear_use_atr': False, 'bear_use_adx': True, 'bear_use_spike': False, 'bear_rsi_required': False, 'sideways_strategy': 'breakout', 'sideways_bb_std_mult': 2.214092034409938, 'sideways_rsi_os': 38, 'sideways_rsi_ob': 67, 'sideways_adx_thresh': 32.82494304209717, 'sideways_atr_min_pct': 0.010423362018458197, 'sideways_atr_max_pct': 0.016804571210756153, 'sideways_tp_mult': 1.196945945741124, 'sideways_tsl_mult': 0.190356687212917, 'sideways_time_stop': 117, 'sideways_use_sma': True, 'sideways_use_ema': True, 'sideways_use_atr': True, 'sideways_use_adx': False, 'sideways_use_spike': True, 'sideways_rsi_required': True}.
[I 2025-08-30 21:03:35,845] Trial 125 finished with values: [-0.022980512267672726, 0.022990906758949808] and parameters: {'p_sma': 19, 'p_std': 12, 'p_atr': 12, 'p_adx': 28, 'rsi_period': 28, 'ema1': 19, 'ema2': 56, 'slip_atr_k': 0.039908989125414684, 'slip_spread_k': 0.8172340243801349, 'spread_hl_frac': 0.02595104087580612, 'bb_std_mult': 1.6423605750379897, 'rsi_os': 36, 'rsi_ob': 61, 'vol_spike': 0.21015055561782978, 'adx_thresh': 24.50039963489054, 'atr_min_pct': 0.004492726299823695, 'atr_max_pct': 0.09463963315093638, 'tp_mult': 1.2372863578565265, 'tsl_mult': 0.8298442908657725, 'strategy': 'mean_reversion', 'time_stop': 235, 'use_sma': False, 'use_atr': True, 'use_adx': True, 'use_ema': True, 'use_spike': True, 'rsi_required': True, 'edge_k': 0.26744125156579845, 'edge_cap': 0.5929576428889781, 'bull_strategy': 'breakout', 'bull_bb_std_mult': 1.0080882398037527, 'bull_rsi_os': 16, 'bull_rsi_ob': 69, 'bull_adx_thresh': 13.844486090725143, 'bull_atr_min_pct': 0.0007860081668819401, 'bull_atr_max_pct': 0.05147034182617836, 'bull_tp_mult': 2.5439225748080485, 'bull_tsl_mult': 0.34648829447211005, 'bull_time_stop': 300, 'bull_use_sma': True, 'bull_use_ema': False, 'bull_use_atr': False, 'bull_use_adx': True, 'bull_use_spike': True, 'bull_rsi_required': True, 'bear_strategy': 'mean_reversion', 'bear_bb_std_mult': 2.7186156480477224, 'bear_rsi_os': 10, 'bear_rsi_ob': 53, 'bear_adx_thresh': 14.67935197770041, 'bear_atr_min_pct': 0.017466408491471914, 'bear_atr_max_pct': 0.0100182979762031, 'bear_tp_mult': 2.9617764070020365, 'bear_tsl_mult': 0.47711583979069266, 'bear_time_stop': 140, 'bear_use_sma': True, 'bear_use_ema': False, 'bear_use_atr': False, 'bear_use_adx': True, 'bear_use_spike': True, 'bear_rsi_required': True, 'sideways_strategy': 'breakout', 'sideways_bb_std_mult': 2.6581392324506776, 'sideways_rsi_os': 24, 'sideways_rsi_ob': 63, 'sideways_adx_thresh': 34.770110729102214, 'sideways_atr_min_pct': 0.012080705179116153, 'sideways_atr_max_pct': 0.09708002569986945, 'sideways_tp_mult': 2.6234385983092157, 'sideways_tsl_mult': 0.22480802443182138, 'sideways_time_stop': 161, 'sideways_use_sma': False, 'sideways_use_ema': True, 'sideways_use_atr': True, 'sideways_use_adx': False, 'sideways_use_spike': False, 'sideways_rsi_required': True}.
[I 2025-08-30 21:03:36,102] Trial 124 finished with values: [-1000000000.0, 1000000000.0] and parameters: {'p_sma': 20, 'p_std': 38, 'p_atr': 17, 'p_adx': 28, 'rsi_period': 37, 'ema1': 19, 'ema2': 26, 'slip_atr_k': 0.032376871811484687, 'slip_spread_k': 0.7779195340326573, 'spread_hl_frac': 0.02544438519626076, 'bb_std_mult': 1.6583287834923017, 'rsi_os': 37, 'rsi_ob': 79, 'vol_spike': 0.20875421627311336, 'adx_thresh': 22.735474879293278, 'atr_min_pct': 0.004201222556102415, 'atr_max_pct': 0.09488732785003992, 'tp_mult': 1.659502423161235, 'tsl_mult': 0.8328532849089454, 'strategy': 'mean_reversion', 'time_stop': 209, 'use_sma': False, 'use_atr': True, 'use_adx': True, 'use_ema': True, 'use_spike': True, 'rsi_required': True, 'edge_k': 0.5988571100247082, 'edge_cap': 0.8772901257260239, 'bull_strategy': 'breakout', 'bull_bb_std_mult': 3.5996283817845898, 'bull_rsi_os': 16, 'bull_rsi_ob': 58, 'bull_adx_thresh': 22.09508369988113, 'bull_atr_min_pct': 0.0008649165751822539, 'bull_atr_max_pct': 0.13686325129207422, 'bull_tp_mult': 2.6224363837919125, 'bull_tsl_mult': 0.21991532967062072, 'bull_time_stop': 286, 'bull_use_sma': True, 'bull_use_ema': False, 'bull_use_atr': False, 'bull_use_adx': True, 'bull_use_spike': True, 'bull_rsi_required': True, 'bear_strategy': 'mean_reversion', 'bear_bb_std_mult': 1.1794423285161229, 'bear_rsi_os': 44, 'bear_rsi_ob': 52, 'bear_adx_thresh': 19.00639683666892, 'bear_atr_min_pct': 0.017686897189211622, 'bear_atr_max_pct': 0.016021307613134472, 'bear_tp_mult': 2.9611881193028506, 'bear_tsl_mult': 0.4690914378842197, 'bear_time_stop': 144, 'bear_use_sma': True, 'bear_use_ema': False, 'bear_use_atr': False, 'bear_use_adx': True, 'bear_use_spike': True, 'bear_rsi_required': True, 'sideways_strategy': 'breakout', 'sideways_bb_std_mult': 0.7288907246631946, 'sideways_rsi_os': 42, 'sideways_rsi_ob': 63, 'sideways_adx_thresh': 31.151176929680805, 'sideways_atr_min_pct': 0.01792069914667628, 'sideways_atr_max_pct': 0.1074902066030533, 'sideways_tp_mult': 2.6219727136327347, 'sideways_tsl_mult': 0.22890666937490411, 'sideways_time_stop': 158, 'sideways_use_sma': False, 'sideways_use_ema': True, 'sideways_use_atr': True, 'sideways_use_adx': False, 'sideways_use_spike': False, 'sideways_rsi_required': True}.
[I 2025-08-30 21:03:36,487] Trial 126 finished with values: [-1000000000.0, 1000000000.0] and parameters: {'p_sma': 19, 'p_std': 36, 'p_atr': 17, 'p_adx': 27, 'rsi_period': 81, 'ema1': 19, 'ema2': 45, 'slip_atr_k': 0.13123140621195067, 'slip_spread_k': 0.2477393291050724, 'spread_hl_frac': 0.010015648322953284, 'bb_std_mult': 1.6432468122760366, 'rsi_os': 36, 'rsi_ob': 61, 'vol_spike': 0.2136125328314883, 'adx_thresh': 12.589650638583764, 'atr_min_pct': 0.004202273208429445, 'atr_max_pct': 0.09843142496236852, 'tp_mult': 2.5762065221269177, 'tsl_mult': 0.5746008215105345, 'strategy': 'mean_reversion', 'time_stop': 234, 'use_sma': True, 'use_atr': True, 'use_adx': True, 'use_ema': True, 'use_spike': True, 'rsi_required': True, 'edge_k': 1.2303502376211841, 'edge_cap': 0.5841457813588878, 'bull_strategy': 'breakout', 'bull_bb_std_mult': 1.030364816763386, 'bull_rsi_os': 17, 'bull_rsi_ob': 69, 'bull_adx_thresh': 31.342293745063607, 'bull_atr_min_pct': 0.000802764819648596, 'bull_atr_max_pct': 0.06067777992232908, 'bull_tp_mult': 2.6037908680080912, 'bull_tsl_mult': 0.00012854052583843867, 'bull_time_stop': 299, 'bull_use_sma': True, 'bull_use_ema': False, 'bull_use_atr': False, 'bull_use_adx': True, 'bull_use_spike': True, 'bull_rsi_required': True, 'bear_strategy': 'mean_reversion', 'bear_bb_std_mult': 2.524323000840492, 'bear_rsi_os': 10, 'bear_rsi_ob': 52, 'bear_adx_thresh': 31.6655897697757, 'bear_atr_min_pct': 0.017404150365770244, 'bear_atr_max_pct': 0.01966592837902247, 'bear_tp_mult': 2.975702481999982, 'bear_tsl_mult': 0.319778316182286, 'bear_time_stop': 239, 'bear_use_sma': True, 'bear_use_ema': False, 'bear_use_atr': False, 'bear_use_adx': True, 'bear_use_spike': True, 'bear_rsi_required': True, 'sideways_strategy': 'breakout', 'sideways_bb_std_mult': 2.655670466245169, 'sideways_rsi_os': 42, 'sideways_rsi_ob': 63, 'sideways_adx_thresh': 31.010744120570237, 'sideways_atr_min_pct': 0.011973340380854375, 'sideways_atr_max_pct': 0.010320004701360344, 'sideways_tp_mult': 2.626081938209791, 'sideways_tsl_mult': 0.33007576492678725, 'sideways_time_stop': 155, 'sideways_use_sma': False, 'sideways_use_ema': True, 'sideways_use_atr': True, 'sideways_use_adx': False, 'sideways_use_spike': False, 'sideways_rsi_required': True}.
