[I 2025-08-30 22:23:19,887] Trial 783 finished with values: [-0.020463833950587595, 0.020401605983864403] and parameters: {'p_sma': 31, 'p_std': 29, 'p_atr': 11, 'p_adx': 13, 'rsi_period': 72, 'ema1': 12, 'ema2': 55, 'slip_atr_k': 0.019961608313390382, 'slip_spread_k': 0.6440304408210257, 'spread_hl_frac': 0.002212856979786435, 'bb_std_mult': 0.768091070387884, 'rsi_os': 11, 'rsi_ob': 67, 'vol_spike': 0.27210672061267377, 'adx_thresh': 10.681356865955939, 'atr_min_pct': 0.023600923915948886, 'atr_max_pct': 0.04620227627341218, 'tp_mult': 1.725833085130658, 'tsl_mult': 0.8912723237426629, 'strategy': 'breakout', 'time_stop': 285, 'use_sma': True, 'use_atr': True, 'use_adx': True, 'use_ema': True, 'use_spike': True, 'rsi_required': False, 'edge_k': 1.0631507653631314, 'edge_cap': 0.8182807086779729, 'bull_strategy': 'mean_reversion', 'bull_bb_std_mult': 0.7274239252360584, 'bull_rsi_os': 11, 'bull_rsi_ob': 86, 'bull_adx_thresh': 15.32551315575153, 'bull_atr_min_pct': 0.0005605111524404011, 'bull_atr_max_pct': 0.09304457733384942, 'bull_tp_mult': 1.3862006255300134, 'bull_tsl_mult': 0.4404490948505931, 'bull_time_stop': 300, 'bull_use_sma': True, 'bull_use_ema': False, 'bull_use_atr': True, 'bull_use_adx': True, 'bull_use_spike': True, 'bull_rsi_required': True, 'bear_strategy': 'mean_reversion', 'bear_bb_std_mult': 0.6524470880323312, 'bear_rsi_os': 19, 'bear_rsi_ob': 72, 'bear_adx_thresh': 26.75736993298397, 'bear_atr_min_pct': 0.026317813021343818, 'bear_atr_max_pct': 0.11222984680599649, 'bear_tp_mult': 2.512625190496551, 'bear_tsl_mult': 0.1784957472400116, 'bear_time_stop': 210, 'bear_use_sma': False, 'bear_use_ema': True, 'bear_use_atr': True, 'bear_use_adx': False, 'bear_use_spike': True, 'bear_rsi_required': True, 'sideways_strategy': 'mean_reversion', 'sideways_bb_std_mult': 0.8054341599762613, 'sideways_rsi_os': 18, 'sideways_rsi_ob': 89, 'sideways_adx_thresh': 27.704432576378, 'sideways_atr_min_pct': 0.026246341941731866, 'sideways_atr_max_pct': 0.1343970041652061, 'sideways_tp_mult': 1.742766615529869, 'sideways_tsl_mult': 0.8246650535849187, 'sideways_time_stop': 145, 'sideways_use_sma': False, 'sideways_use_ema': True, 'sideways_use_atr': False, 'sideways_use_adx': False, 'sideways_use_spike': False, 'sideways_rsi_required': True}.
[I 2025-08-30 22:23:20,009] Trial 784 finished with values: [-1000000000.0, 1000000000.0] and parameters: {'p_sma': 31, 'p_std': 29, 'p_atr': 9, 'p_adx': 10, 'rsi_period': 74, 'ema1': 12, 'ema2': 55, 'slip_atr_k': 0.018109494236566763, 'slip_spread_k': 0.09429429665153716, 'spread_hl_frac': 0.03535638782370969, 'bb_std_mult': 0.7604214459349096, 'rsi_os': 14, 'rsi_ob': 70, 'vol_spike': 0.27262009731056464, 'adx_thresh': 10.512216445868114, 'atr_min_pct': 0.0074180109398680714, 'atr_max_pct': 0.01836317412564978, 'tp_mult': 1.5754421119479098, 'tsl_mult': 0.8913004814061471, 'strategy': 'breakout', 'time_stop': 86, 'use_sma': True, 'use_atr': True, 'use_adx': True, 'use_ema': True, 'use_spike': True, 'rsi_required': False, 'edge_k': 0.9487174803822294, 'edge_cap': 0.8170117417328857, 'bull_strategy': 'breakout', 'bull_bb_std_mult': 1.9135367184321348, 'bull_rsi_os': 11, 'bull_rsi_ob': 90, 'bull_adx_thresh': 15.77057337300301, 'bull_atr_min_pct': 0.025359182101284253, 'bull_atr_max_pct': 0.057986671713475116, 'bull_tp_mult': 2.017757916414351, 'bull_tsl_mult': 0.7322143132690502, 'bull_time_stop': 300, 'bull_use_sma': True, 'bull_use_ema': False, 'bull_use_atr': True, 'bull_use_adx': False, 'bull_use_spike': True, 'bull_rsi_required': True, 'bear_strategy': 'breakout', 'bear_bb_std_mult': 2.1258355847561132, 'bear_rsi_os': 7, 'bear_rsi_ob': 70, 'bear_adx_thresh': 26.887130621582155, 'bear_atr_min_pct': 0.026382128939890056, 'bear_atr_max_pct': 0.08385103379091634, 'bear_tp_mult': 1.1018488963007407, 'bear_tsl_mult': 0.7020986011984418, 'bear_time_stop': 69, 'bear_use_sma': False, 'bear_use_ema': True, 'bear_use_atr': True, 'bear_use_adx': False, 'bear_use_spike': True, 'bear_rsi_required': True, 'sideways_strategy': 'mean_reversion', 'sideways_bb_std_mult': 2.441418901651316, 'sideways_rsi_os': 50, 'sideways_rsi_ob': 48, 'sideways_adx_thresh': 25.022486994613203, 'sideways_atr_min_pct': 0.019817331189356947, 'sideways_atr_max_pct': 0.03890508144123115, 'sideways_tp_mult': 1.4006196598468623, 'sideways_tsl_mult': 0.6551995350065947, 'sideways_time_stop': 261, 'sideways_use_sma': False, 'sideways_use_ema': True, 'sideways_use_atr': False, 'sideways_use_adx': False, 'sideways_use_spike': False, 'sideways_rsi_required': True}.
[I 2025-08-30 22:23:20,642] Trial 786 finished with values: [-1000000000.0, 1000000000.0] and parameters: {'p_sma': 55, 'p_std': 35, 'p_atr': 22, 'p_adx': 20, 'rsi_period': 72, 'ema1': 12, 'ema2': 33, 'slip_atr_k': 0.0184399246384334, 'slip_spread_k': 0.6677261845380732, 'spread_hl_frac': 0.02754288867933485, 'bb_std_mult': 0.7413140815453866, 'rsi_os': 28, 'rsi_ob': 67, 'vol_spike': 0.2874605144203165, 'adx_thresh': 10.969585146297108, 'atr_min_pct': 0.013285941398620268, 'atr_max_pct': 0.018596089778099546, 'tp_mult': 1.7366002124331708, 'tsl_mult': 0.9409945294607072, 'strategy': 'breakout', 'time_stop': 86, 'use_sma': True, 'use_atr': True, 'use_adx': True, 'use_ema': False, 'use_spike': True, 'rsi_required': True, 'edge_k': 0.9494884775430652, 'edge_cap': 0.8197690591299185, 'bull_strategy': 'breakout', 'bull_bb_std_mult': 2.2655185167403222, 'bull_rsi_os': 11, 'bull_rsi_ob': 90, 'bull_adx_thresh': 15.908752478761354, 'bull_atr_min_pct': 0.00041530305158712444, 'bull_atr_max_pct': 0.13546496545509432, 'bull_tp_mult': 1.4414092820461792, 'bull_tsl_mult': 0.38255892797634583, 'bull_time_stop': 87, 'bull_use_sma': True, 'bull_use_ema': True, 'bull_use_atr': True, 'bull_use_adx': False, 'bull_use_spike': False, 'bull_rsi_required': True, 'bear_strategy': 'breakout', 'bear_bb_std_mult': 3.5422629825974603, 'bear_rsi_os': 7, 'bear_rsi_ob': 75, 'bear_adx_thresh': 29.313780391354587, 'bear_atr_min_pct': 0.02894717160196663, 'bear_atr_max_pct': 0.11335129573762076, 'bear_tp_mult': 1.5836198618410853, 'bear_tsl_mult': 0.17828645093838918, 'bear_time_stop': 210, 'bear_use_sma': True, 'bear_use_ema': True, 'bear_use_atr': True, 'bear_use_adx': False, 'bear_use_spike': False, 'bear_rsi_required': True, 'sideways_strategy': 'breakout', 'sideways_bb_std_mult': 1.7334534461071804, 'sideways_rsi_os': 9, 'sideways_rsi_ob': 89, 'sideways_adx_thresh': 26.940698368468322, 'sideways_atr_min_pct': 0.0069349197464417395, 'sideways_atr_max_pct': 0.1108240950997531, 'sideways_tp_mult': 1.7420229540417396, 'sideways_tsl_mult': 0.11167295419252599, 'sideways_time_stop': 174, 'sideways_use_sma': False, 'sideways_use_ema': False, 'sideways_use_atr': False, 'sideways_use_adx': True, 'sideways_use_spike': False, 'sideways_rsi_required': False}.
[I 2025-08-30 22:23:20,738] Trial 785 finished with values: [-1000000000.0, 1000000000.0] and parameters: {'p_sma': 31, 'p_std': 43, 'p_atr': 22, 'p_adx': 15, 'rsi_period': 29, 'ema1': 6, 'ema2': 49, 'slip_atr_k': 0.21224996628176718, 'slip_spread_k': 0.09321155871566439, 'spread_hl_frac': 0.03510006846151219, 'bb_std_mult': 2.738925112585547, 'rsi_os': 54, 'rsi_ob': 91, 'vol_spike': 0.2888804017790768, 'adx_thresh': 10.851018708391498, 'atr_min_pct': 0.013219195674284204, 'atr_max_pct': 0.019443203229470515, 'tp_mult': 1.0761808187358577, 'tsl_mult': 0.4799656089852754, 'strategy': 'breakout', 'time_stop': 87, 'use_sma': True, 'use_atr': True, 'use_adx': True, 'use_ema': False, 'use_spike': True, 'rsi_required': False, 'edge_k': 1.0667132626209033, 'edge_cap': 0.8133476540048974, 'bull_strategy': 'breakout', 'bull_bb_std_mult': 2.265941013356777, 'bull_rsi_os': 15, 'bull_rsi_ob': 85, 'bull_adx_thresh': 29.917812881419064, 'bull_atr_min_pct': 0.0004980875328741922, 'bull_atr_max_pct': 0.05880664236839104, 'bull_tp_mult': 1.4413478614448922, 'bull_tsl_mult': 0.3832307417988611, 'bull_time_stop': 300, 'bull_use_sma': True, 'bull_use_ema': True, 'bull_use_atr': True, 'bull_use_adx': False, 'bull_use_spike': False, 'bull_rsi_required': True, 'bear_strategy': 'breakout', 'bear_bb_std_mult': 2.1336819617402973, 'bear_rsi_os': 7, 'bear_rsi_ob': 74, 'bear_adx_thresh': 26.941856746273668, 'bear_atr_min_pct': 0.02908890814640573, 'bear_atr_max_pct': 0.06976743129970499, 'bear_tp_mult': 1.5374419543674573, 'bear_tsl_mult': 0.315629728651334, 'bear_time_stop': 43, 'bear_use_sma': True, 'bear_use_ema': True, 'bear_use_atr': True, 'bear_use_adx': False, 'bear_use_spike': True, 'bear_rsi_required': True, 'sideways_strategy': 'breakout', 'sideways_bb_std_mult': 0.8123374794105471, 'sideways_rsi_os': 38, 'sideways_rsi_ob': 89, 'sideways_adx_thresh': 24.92848013967671, 'sideways_atr_min_pct': 0.0067857763252581315, 'sideways_atr_max_pct': 0.06174059756010286, 'sideways_tp_mult': 1.9247889912959535, 'sideways_tsl_mult': 0.8151115260010928, 'sideways_time_stop': 176, 'sideways_use_sma': False, 'sideways_use_ema': False, 'sideways_use_atr': False, 'sideways_use_adx': True, 'sideways_use_spike': False, 'sideways_rsi_required': False}.
[I 2025-08-30 22:23:21,795] Trial 788 finished with values: [-1000000000.0, 1000000000.0] and parameters: {'p_sma': 7, 'p_std': 35, 'p_atr': 22, 'p_adx': 20, 'rsi_period': 69, 'ema1': 11, 'ema2': 52, 'slip_atr_k': 0.029425108490984044, 'slip_spread_k': 0.601742170386999, 'spread_hl_frac': 0.045841214261516605, 'bb_std_mult': 0.9677738613983592, 'rsi_os': 8, 'rsi_ob': 65, 'vol_spike': 0.28597448076411797, 'adx_thresh': 10.960426992475206, 'atr_min_pct': 0.02933314819135823, 'atr_max_pct': 0.020322228885979076, 'tp_mult': 2.9472215067486136, 'tsl_mult': 0.9826015219600488, 'strategy': 'mean_reversion', 'time_stop': 165, 'use_sma': True, 'use_atr': True, 'use_adx': True, 'use_ema': False, 'use_spike': True, 'rsi_required': True, 'edge_k': 1.0096757698293037, 'edge_cap': 0.8006972025723758, 'bull_strategy': 'breakout', 'bull_bb_std_mult': 3.598995043124741, 'bull_rsi_os': 15, 'bull_rsi_ob': 75, 'bull_adx_thresh': 29.80997251894709, 'bull_atr_min_pct': 0.0014457063442516425, 'bull_atr_max_pct': 0.1330921862819276, 'bull_tp_mult': 2.6545680364894584, 'bull_tsl_mult': 0.387493753302362, 'bull_time_stop': 87, 'bull_use_sma': True, 'bull_use_ema': True, 'bull_use_atr': False, 'bull_use_adx': False, 'bull_use_spike': False, 'bull_rsi_required': True, 'bear_strategy': 'breakout', 'bear_bb_std_mult': 3.059996775449145, 'bear_rsi_os': 45, 'bear_rsi_ob': 75, 'bear_adx_thresh': 29.066679722387402, 'bear_atr_min_pct': 0.028888231378970723, 'bear_atr_max_pct': 0.04554267175612033, 'bear_tp_mult': 2.0487041764851677, 'bear_tsl_mult': 0.3887070811451534, 'bear_time_stop': 232, 'bear_use_sma': True, 'bear_use_ema': True, 'bear_use_atr': False, 'bear_use_adx': True, 'bear_use_spike': False, 'bear_rsi_required': True, 'sideways_strategy': 'breakout', 'sideways_bb_std_mult': 1.6929787899269653, 'sideways_rsi_os': 38, 'sideways_rsi_ob': 88, 'sideways_adx_thresh': 12.06438025980393, 'sideways_atr_min_pct': 0.001820518341969413, 'sideways_atr_max_pct': 0.11069631210802383, 'sideways_tp_mult': 1.6698123594399452, 'sideways_tsl_mult': 0.7032913485684931, 'sideways_time_stop': 245, 'sideways_use_sma': True, 'sideways_use_ema': False, 'sideways_use_atr': False, 'sideways_use_adx': True, 'sideways_use_spike': True, 'sideways_rsi_required': False}.
[I 2025-08-30 22:23:55,309] Trial 787 finished with values: [-1000000000.0, 1000000000.0] and parameters: {'p_sma': 24, 'p_std': 35, 'p_atr': 22, 'p_adx': 20, 'rsi_period': 68, 'ema1': 23, 'ema2': 50, 'slip_atr_k': 0.027592738746937445, 'slip_spread_k': 0.2728608770136756, 'spread_hl_frac': 0.02767852372195898, 'bb_std_mult': 0.5067894247153353, 'rsi_os': 12, 'rsi_ob': 91, 'vol_spike': 0.06573523164113501, 'adx_thresh': 17.165941256106425, 'atr_min_pct': 0.005780642476786517, 'atr_max_pct': 0.01926154592564457, 'tp_mult': 1.5052264149692345, 'tsl_mult': 0.27108553556024284, 'strategy': 'mean_reversion', 'time_stop': 258, 'use_sma': True, 'use_atr': True, 'use_adx': True, 'use_ema': False, 'use_spike': True, 'rsi_required': True, 'edge_k': 1.0053395023259148, 'edge_cap': 0.8797110737595156, 'bull_strategy': 'breakout', 'bull_bb_std_mult': 2.2947024187361356, 'bull_rsi_os': 30, 'bull_rsi_ob': 84, 'bull_adx_thresh': 5.458063592956552, 'bull_atr_min_pct': 0.0016222118320703412, 'bull_atr_max_pct': 0.045215564521734475, 'bull_tp_mult': 1.444196596680546, 'bull_tsl_mult': 0.394122596316839, 'bull_time_stop': 52, 'bull_use_sma': True, 'bull_use_ema': True, 'bull_use_atr': False, 'bull_use_adx': False, 'bull_use_spike': False, 'bull_rsi_required': True, 'bear_strategy': 'breakout', 'bear_bb_std_mult': 3.051015294339459, 'bear_rsi_os': 22, 'bear_rsi_ob': 75, 'bear_adx_thresh': 25.162567050186993, 'bear_atr_min_pct': 0.028984432872011724, 'bear_atr_max_pct': 0.06875782803777805, 'bear_tp_mult': 1.2722973149400203, 'bear_tsl_mult': 0.49303193065647827, 'bear_time_stop': 232, 'bear_use_sma': True, 'bear_use_ema': True, 'bear_use_atr': False, 'bear_use_adx': True, 'bear_use_spike': False, 'bear_rsi_required': True, 'sideways_strategy': 'breakout', 'sideways_bb_std_mult': 1.7530757097521286, 'sideways_rsi_os': 25, 'sideways_rsi_ob': 88, 'sideways_adx_thresh': 13.028044863875673, 'sideways_atr_min_pct': 0.020621837567755458, 'sideways_atr_max_pct': 0.0413111726624425, 'sideways_tp_mult': 1.7461087903895884, 'sideways_tsl_mult': 0.11270045186555588, 'sideways_time_stop': 246, 'sideways_use_sma': True, 'sideways_use_ema': False, 'sideways_use_atr': False, 'sideways_use_adx': True, 'sideways_use_spike': True, 'sideways_rsi_required': False}.
[I 2025-08-30 22:23:56,140] Trial 790 finished with values: [-1000000000.0, 1000000000.0] and parameters: {'p_sma': 33, 'p_std': 37, 'p_atr': 23, 'p_adx': 21, 'rsi_period': 68, 'ema1': 11, 'ema2': 52, 'slip_atr_k': 0.029209888610150794, 'slip_spread_k': 0.602521454540243, 'spread_hl_frac': 0.032479406753038585, 'bb_std_mult': 0.5241455530058108, 'rsi_os': 8, 'rsi_ob': 65, 'vol_spike': 0.06446556602308665, 'adx_thresh': 9.219152280517916, 'atr_min_pct': 0.012300673342610723, 'atr_max_pct': 0.03979902036242265, 'tp_mult': 1.8933218861987133, 'tsl_mult': 0.9840049649539041, 'strategy': 'mean_reversion', 'time_stop': 95, 'use_sma': True, 'use_atr': False, 'use_adx': False, 'use_ema': True, 'use_spike': False, 'rsi_required': True, 'edge_k': 1.0042638003270372, 'edge_cap': 0.8483277261762117, 'bull_strategy': 'breakout', 'bull_bb_std_mult': 2.0247014467444426, 'bull_rsi_os': 23, 'bull_rsi_ob': 87, 'bull_adx_thresh': 5.50143503113282, 'bull_atr_min_pct': 0.0017062359616097974, 'bull_atr_max_pct': 0.045698537968193904, 'bull_tp_mult': 1.3050569517405881, 'bull_tsl_mult': 0.42928072921654326, 'bull_time_stop': 257, 'bull_use_sma': True, 'bull_use_ema': False, 'bull_use_atr': False, 'bull_use_adx': False, 'bull_use_spike': False, 'bull_rsi_required': True, 'bear_strategy': 'mean_reversion', 'bear_bb_std_mult': 1.8651411603243535, 'bear_rsi_os': 45, 'bear_rsi_ob': 76, 'bear_adx_thresh': 25.15176214178203, 'bear_atr_min_pct': 0.02946605619971208, 'bear_atr_max_pct': 0.13242551879469078, 'bear_tp_mult': 2.7670963992708537, 'bear_tsl_mult': 0.5108343657887358, 'bear_time_stop': 190, 'bear_use_sma': False, 'bear_use_ema': True, 'bear_use_atr': False, 'bear_use_adx': True, 'bear_use_spike': False, 'bear_rsi_required': True, 'sideways_strategy': 'breakout', 'sideways_bb_std_mult': 3.5810145548612367, 'sideways_rsi_os': 54, 'sideways_rsi_ob': 74, 'sideways_adx_thresh': 11.75346314265035, 'sideways_atr_min_pct': 0.025221327848630865, 'sideways_atr_max_pct': 0.04192554586658707, 'sideways_tp_mult': 1.3083838518152235, 'sideways_tsl_mult': 0.7445734416758885, 'sideways_time_stop': 248, 'sideways_use_sma': True, 'sideways_use_ema': False, 'sideways_use_atr': True, 'sideways_use_adx': True, 'sideways_use_spike': True, 'sideways_rsi_required': False}.
[I 2025-08-30 22:23:56,146] Trial 789 finished with values: [-1000000000.0, 1000000000.0] and parameters: {'p_sma': 32, 'p_std': 37, 'p_atr': 21, 'p_adx': 21, 'rsi_period': 69, 'ema1': 11, 'ema2': 52, 'slip_atr_k': 0.02956386707189479, 'slip_spread_k': 0.13522396209980309, 'spread_hl_frac': 0.032231262224913716, 'bb_std_mult': 2.753621623767247, 'rsi_os': 8, 'rsi_ob': 65, 'vol_spike': 0.27904743307284907, 'adx_thresh': 8.291471276258301, 'atr_min_pct': 0.012252355753694735, 'atr_max_pct': 0.039559411321808347, 'tp_mult': 2.935872538569331, 'tsl_mult': 0.33488093048706535, 'strategy': 'mean_reversion', 'time_stop': 256, 'use_sma': True, 'use_atr': False, 'use_adx': False, 'use_ema': False, 'use_spike': False, 'rsi_required': True, 'edge_k': 0.9919073579670765, 'edge_cap': 0.5080001062591692, 'bull_strategy': 'breakout', 'bull_bb_std_mult': 2.020051845178034, 'bull_rsi_os': 29, 'bull_rsi_ob': 75, 'bull_adx_thresh': 33.36495821117764, 'bull_atr_min_pct': 0.0016491858291177003, 'bull_atr_max_pct': 0.13864037648250135, 'bull_tp_mult': 1.3142074044423955, 'bull_tsl_mult': 0.38388396065928326, 'bull_time_stop': 295, 'bull_use_sma': True, 'bull_use_ema': True, 'bull_use_atr': False, 'bull_use_adx': False, 'bull_use_spike': False, 'bull_rsi_required': True, 'bear_strategy': 'mean_reversion', 'bear_bb_std_mult': 1.8136524640805283, 'bear_rsi_os': 43, 'bear_rsi_ob': 74, 'bear_adx_thresh': 30.622549762799117, 'bear_atr_min_pct': 0.028939522575047352, 'bear_atr_max_pct': 0.11976973391893221, 'bear_tp_mult': 1.4571627408163457, 'bear_tsl_mult': 0.39935973482550247, 'bear_time_stop': 231, 'bear_use_sma': True, 'bear_use_ema': True, 'bear_use_atr': False, 'bear_use_adx': True, 'bear_use_spike': False, 'bear_rsi_required': True, 'sideways_strategy': 'breakout', 'sideways_bb_std_mult': 2.211246051263152, 'sideways_rsi_os': 38, 'sideways_rsi_ob': 88, 'sideways_adx_thresh': 8.22925572319649, 'sideways_atr_min_pct': 0.017989781132857867, 'sideways_atr_max_pct': 0.04196260520872004, 'sideways_tp_mult': 1.929785726499696, 'sideways_tsl_mult': 0.6937382725648874, 'sideways_time_stop': 245, 'sideways_use_sma': True, 'sideways_use_ema': False, 'sideways_use_atr': True, 'sideways_use_adx': True, 'sideways_use_spike': True, 'sideways_rsi_required': False}.
[I 2025-08-30 22:23:57,324] Trial 791 finished with values: [-1000000000.0, 1000000000.0] and parameters: {'p_sma': 33, 'p_std': 37, 'p_atr': 21, 'p_adx': 21, 'rsi_period': 75, 'ema1': 16, 'ema2': 54, 'slip_atr_k': 0.0347301361021838, 'slip_spread_k': 0.6896848392304054, 'spread_hl_frac': 0.032678181717614274, 'bb_std_mult': 2.032766649022324, 'rsi_os': 10, 'rsi_ob': 66, 'vol_spike': 0.2802250441354037, 'adx_thresh': 26.943456253346387, 'atr_min_pct': 0.012158532400953253, 'atr_max_pct': 0.02880838786499642, 'tp_mult': 2.7754656149985184, 'tsl_mult': 0.9201687222672782, 'strategy': 'mean_reversion', 'time_stop': 96, 'use_sma': True, 'use_atr': False, 'use_adx': False, 'use_ema': True, 'use_spike': False, 'rsi_required': True, 'edge_k': 1.0049217483504096, 'edge_cap': 0.8450705288881406, 'bull_strategy': 'breakout', 'bull_bb_std_mult': 2.9861932042122805, 'bull_rsi_os': 30, 'bull_rsi_ob': 83, 'bull_adx_thresh': 13.74709219811247, 'bull_atr_min_pct': 0.0017881162504832643, 'bull_atr_max_pct': 0.08345631223989802, 'bull_tp_mult': 1.351928402600588, 'bull_tsl_mult': 0.4319483746576769, 'bull_time_stop': 136, 'bull_use_sma': True, 'bull_use_ema': False, 'bull_use_atr': False, 'bull_use_adx': False, 'bull_use_spike': False, 'bull_rsi_required': False, 'bear_strategy': 'mean_reversion', 'bear_bb_std_mult': 1.8671946877177232, 'bear_rsi_os': 9, 'bear_rsi_ob': 78, 'bear_adx_thresh': 8.368384023051927, 'bear_atr_min_pct': 0.02945769770651455, 'bear_atr_max_pct': 0.11986880273383918, 'bear_tp_mult': 1.481554936945075, 'bear_tsl_mult': 0.4301231573352872, 'bear_time_stop': 233, 'bear_use_sma': False, 'bear_use_ema': True, 'bear_use_atr': False, 'bear_use_adx': True, 'bear_use_spike': True, 'bear_rsi_required': False, 'sideways_strategy': 'breakout', 'sideways_bb_std_mult': 1.7520776361709829, 'sideways_rsi_os': 41, 'sideways_rsi_ob': 74, 'sideways_adx_thresh': 27.099847799827504, 'sideways_atr_min_pct': 0.020598734503420126, 'sideways_atr_max_pct': 0.04202707988474466, 'sideways_tp_mult': 2.170680067682246, 'sideways_tsl_mult': 0.1408469909285638, 'sideways_time_stop': 258, 'sideways_use_sma': False, 'sideways_use_ema': False, 'sideways_use_atr': True, 'sideways_use_adx': True, 'sideways_use_spike': True, 'sideways_rsi_required': False}.
