[I 2025-08-30 22:30:45,093] Trial 838 finished with values: [-1000000000.0, 1000000000.0] and parameters: {'p_sma': 25, 'p_std': 39, 'p_atr': 19, 'p_adx': 21, 'rsi_period': 78, 'ema1': 6, 'ema2': 26, 'slip_atr_k': 0.004101164859515576, 'slip_spread_k': 0.7391884074459519, 'spread_hl_frac': 0.016296383563054795, 'bb_std_mult': 2.70500092288268, 'rsi_os': 15, 'rsi_ob': 88, 'vol_spike': 0.016875681567465283, 'adx_thresh': 13.659686591577719, 'atr_min_pct': 0.014614755588536598, 'atr_max_pct': 0.08242926789694596, 'tp_mult': 1.4957116120058516, 'tsl_mult': 0.294749985604591, 'strategy': 'breakout', 'time_stop': 112, 'use_sma': False, 'use_atr': True, 'use_adx': False, 'use_ema': True, 'use_spike': False, 'rsi_required': False, 'edge_k': 1.1706271934542951, 'edge_cap': 0.11313821896960309, 'bull_strategy': 'breakout', 'bull_bb_std_mult': 2.1888600918095498, 'bull_rsi_os': 48, 'bull_rsi_ob': 85, 'bull_adx_thresh': 16.475625221235276, 'bull_atr_min_pct': 0.00308155512629149, 'bull_atr_max_pct': 0.043104293925837894, 'bull_tp_mult': 2.1341476809611857, 'bull_tsl_mult': 0.5555858556425919, 'bull_time_stop': 279, 'bull_use_sma': True, 'bull_use_ema': True, 'bull_use_atr': True, 'bull_use_adx': True, 'bull_use_spike': False, 'bull_rsi_required': False, 'bear_strategy': 'mean_reversion', 'bear_bb_std_mult': 1.7032033041940706, 'bear_rsi_os': 6, 'bear_rsi_ob': 83, 'bear_adx_thresh': 24.95356949342793, 'bear_atr_min_pct': 0.027754994099686552, 'bear_atr_max_pct': 0.12475824432556956, 'bear_tp_mult': 2.421566191590223, 'bear_tsl_mult': 0.5917315772157746, 'bear_time_stop': 261, 'bear_use_sma': True, 'bear_use_ema': False, 'bear_use_atr': False, 'bear_use_adx': True, 'bear_use_spike': True, 'bear_rsi_required': False, 'sideways_strategy': 'breakout', 'sideways_bb_std_mult': 2.7439428492618796, 'sideways_rsi_os': 36, 'sideways_rsi_ob': 48, 'sideways_adx_thresh': 25.429545215937146, 'sideways_atr_min_pct': 0.019436533074438635, 'sideways_atr_max_pct': 0.08301070587263473, 'sideways_tp_mult': 1.969152084409758, 'sideways_tsl_mult': 0.9799125567408637, 'sideways_time_stop': 245, 'sideways_use_sma': False, 'sideways_use_ema': False, 'sideways_use_atr': False, 'sideways_use_adx': True, 'sideways_use_spike': True, 'sideways_rsi_required': False}.
[I 2025-08-30 22:30:46,286] Trial 837 finished with values: [-1000000000.0, 1000000000.0] and parameters: {'p_sma': 38, 'p_std': 40, 'p_atr': 19, 'p_adx': 25, 'rsi_period': 78, 'ema1': 8, 'ema2': 21, 'slip_atr_k': 0.004537347540946894, 'slip_spread_k': 0.7179590685467828, 'spread_hl_frac': 0.016665985759907156, 'bb_std_mult': 2.1574348978242366, 'rsi_os': 16, 'rsi_ob': 87, 'vol_spike': 0.03973375533871915, 'adx_thresh': 14.017090852566362, 'atr_min_pct': 0.014612754627609154, 'atr_max_pct': 0.07259282535852413, 'tp_mult': 1.497358886714338, 'tsl_mult': 0.28935733784062734, 'strategy': 'mean_reversion', 'time_stop': 120, 'use_sma': False, 'use_atr': True, 'use_adx': False, 'use_ema': True, 'use_spike': False, 'rsi_required': True, 'edge_k': 1.1488695253468397, 'edge_cap': 0.11360612366169062, 'bull_strategy': 'breakout', 'bull_bb_std_mult': 2.1829990695686243, 'bull_rsi_os': 46, 'bull_rsi_ob': 84, 'bull_adx_thresh': 16.565804255550376, 'bull_atr_min_pct': 0.005865211296975313, 'bull_atr_max_pct': 0.04014129995147978, 'bull_tp_mult': 2.067953755354113, 'bull_tsl_mult': 0.5887923141153812, 'bull_time_stop': 278, 'bull_use_sma': True, 'bull_use_ema': False, 'bull_use_atr': True, 'bull_use_adx': True, 'bull_use_spike': False, 'bull_rsi_required': True, 'bear_strategy': 'mean_reversion', 'bear_bb_std_mult': 1.6922472625020768, 'bear_rsi_os': 51, 'bear_rsi_ob': 49, 'bear_adx_thresh': 26.528629546073628, 'bear_atr_min_pct': 0.02798604034275566, 'bear_atr_max_pct': 0.12434394694020742, 'bear_tp_mult': 2.3976206356779692, 'bear_tsl_mult': 0.5688939439581856, 'bear_time_stop': 259, 'bear_use_sma': False, 'bear_use_ema': True, 'bear_use_atr': False, 'bear_use_adx': True, 'bear_use_spike': True, 'bear_rsi_required': False, 'sideways_strategy': 'breakout', 'sideways_bb_std_mult': 2.6171403111860294, 'sideways_rsi_os': 36, 'sideways_rsi_ob': 50, 'sideways_adx_thresh': 25.952205543352473, 'sideways_atr_min_pct': 0.019789069555044, 'sideways_atr_max_pct': 0.08629489335903688, 'sideways_tp_mult': 1.9757696142591121, 'sideways_tsl_mult': 0.9362343733522122, 'sideways_time_stop': 242, 'sideways_use_sma': False, 'sideways_use_ema': False, 'sideways_use_atr': False, 'sideways_use_adx': True, 'sideways_use_spike': True, 'sideways_rsi_required': False}.
[I 2025-08-30 22:30:46,607] Trial 839 finished with values: [-1000000000.0, 1000000000.0] and parameters: {'p_sma': 38, 'p_std': 39, 'p_atr': 19, 'p_adx': 27, 'rsi_period': 77, 'ema1': 8, 'ema2': 21, 'slip_atr_k': 0.00041250045024024407, 'slip_spread_k': 0.7514712840298978, 'spread_hl_frac': 0.017098487207247607, 'bb_std_mult': 2.6982791481988104, 'rsi_os': 15, 'rsi_ob': 90, 'vol_spike': 0.028550356334685813, 'adx_thresh': 16.0717479124764, 'atr_min_pct': 0.014527316264745719, 'atr_max_pct': 0.08191601760428964, 'tp_mult': 1.5484452886218614, 'tsl_mult': 0.3686582105228054, 'strategy': 'breakout', 'time_stop': 116, 'use_sma': False, 'use_atr': True, 'use_adx': False, 'use_ema': True, 'use_spike': False, 'rsi_required': False, 'edge_k': 1.2378997353846, 'edge_cap': 0.11063107274074582, 'bull_strategy': 'breakout', 'bull_bb_std_mult': 2.1595761003587493, 'bull_rsi_os': 43, 'bull_rsi_ob': 85, 'bull_adx_thresh': 17.64409491231295, 'bull_atr_min_pct': 0.017308474125517614, 'bull_atr_max_pct': 0.044529537790468914, 'bull_tp_mult': 2.038967038252721, 'bull_tsl_mult': 0.5570782757814186, 'bull_time_stop': 277, 'bull_use_sma': True, 'bull_use_ema': True, 'bull_use_atr': True, 'bull_use_adx': True, 'bull_use_spike': False, 'bull_rsi_required': True, 'bear_strategy': 'mean_reversion', 'bear_bb_std_mult': 1.606444038576197, 'bear_rsi_os': 6, 'bear_rsi_ob': 81, 'bear_adx_thresh': 26.552727832890973, 'bear_atr_min_pct': 0.027853402389347002, 'bear_atr_max_pct': 0.12526878820657183, 'bear_tp_mult': 2.3620536408078427, 'bear_tsl_mult': 0.5450330859170283, 'bear_time_stop': 260, 'bear_use_sma': False, 'bear_use_ema': False, 'bear_use_atr': False, 'bear_use_adx': True, 'bear_use_spike': False, 'bear_rsi_required': False, 'sideways_strategy': 'breakout', 'sideways_bb_std_mult': 2.7089503497371132, 'sideways_rsi_os': 36, 'sideways_rsi_ob': 50, 'sideways_adx_thresh': 26.24949366045896, 'sideways_atr_min_pct': 0.019816710946907047, 'sideways_atr_max_pct': 0.08254493618316723, 'sideways_tp_mult': 1.9431979912161956, 'sideways_tsl_mult': 0.9357266216649993, 'sideways_time_stop': 246, 'sideways_use_sma': False, 'sideways_use_ema': False, 'sideways_use_atr': False, 'sideways_use_adx': True, 'sideways_use_spike': True, 'sideways_rsi_required': False}.
[I 2025-08-30 22:30:46,737] Trial 840 finished with values: [-1000000000.0, 1000000000.0] and parameters: {'p_sma': 25, 'p_std': 39, 'p_atr': 22, 'p_adx': 10, 'rsi_period': 77, 'ema1': 8, 'ema2': 21, 'slip_atr_k': 0.0012614593370515433, 'slip_spread_k': 0.706835054047511, 'spread_hl_frac': 0.011268406318122294, 'bb_std_mult': 2.7009965556085516, 'rsi_os': 14, 'rsi_ob': 90, 'vol_spike': 0.012839828452831124, 'adx_thresh': 7.178595685984457, 'atr_min_pct': 0.014625195270452983, 'atr_max_pct': 0.0767336959181221, 'tp_mult': 1.5508675366423244, 'tsl_mult': 0.42374077445197544, 'strategy': 'breakout', 'time_stop': 110, 'use_sma': False, 'use_atr': True, 'use_adx': False, 'use_ema': True, 'use_spike': False, 'rsi_required': False, 'edge_k': 1.2192086052951623, 'edge_cap': 0.10415713139039945, 'bull_strategy': 'breakout', 'bull_bb_std_mult': 2.21738755710446, 'bull_rsi_os': 44, 'bull_rsi_ob': 85, 'bull_adx_thresh': 16.295464747601073, 'bull_atr_min_pct': 0.00288020367314484, 'bull_atr_max_pct': 0.042361169469983674, 'bull_tp_mult': 2.0510085142335632, 'bull_tsl_mult': 0.5534457257150419, 'bull_time_stop': 282, 'bull_use_sma': True, 'bull_use_ema': True, 'bull_use_atr': True, 'bull_use_adx': True, 'bull_use_spike': False, 'bull_rsi_required': True, 'bear_strategy': 'mean_reversion', 'bear_bb_std_mult': 1.5606091339267563, 'bear_rsi_os': 6, 'bear_rsi_ob': 73, 'bear_adx_thresh': 6.834471010815973, 'bear_atr_min_pct': 0.027019580172036328, 'bear_atr_max_pct': 0.12979143883441377, 'bear_tp_mult': 2.419502267896929, 'bear_tsl_mult': 0.5531718803742107, 'bear_time_stop': 258, 'bear_use_sma': False, 'bear_use_ema': False, 'bear_use_atr': False, 'bear_use_adx': True, 'bear_use_spike': False, 'bear_rsi_required': False, 'sideways_strategy': 'breakout', 'sideways_bb_std_mult': 2.391791550914029, 'sideways_rsi_os': 36, 'sideways_rsi_ob': 49, 'sideways_adx_thresh': 26.219250412729718, 'sideways_atr_min_pct': 0.019970407961297874, 'sideways_atr_max_pct': 0.08384002479485331, 'sideways_tp_mult': 1.9758387832642375, 'sideways_tsl_mult': 0.8941953141088732, 'sideways_time_stop': 243, 'sideways_use_sma': True, 'sideways_use_ema': False, 'sideways_use_atr': False, 'sideways_use_adx': True, 'sideways_use_spike': True, 'sideways_rsi_required': False}.
[I 2025-08-30 22:31:20,845] Trial 844 finished with values: [-1000000000.0, 1000000000.0] and parameters: {'p_sma': 36, 'p_std': 38, 'p_atr': 18, 'p_adx': 21, 'rsi_period': 76, 'ema1': 7, 'ema2': 31, 'slip_atr_k': 0.008415006330964403, 'slip_spread_k': 0.6823526454308463, 'spread_hl_frac': 0.014604442704825702, 'bb_std_mult': 2.3436055956144646, 'rsi_os': 15, 'rsi_ob': 91, 'vol_spike': 0.055623898582185666, 'adx_thresh': 14.894902481559207, 'atr_min_pct': 0.015611969780547786, 'atr_max_pct': 0.06876897131352938, 'tp_mult': 1.5577240918807336, 'tsl_mult': 0.2655350459944241, 'strategy': 'mean_reversion', 'time_stop': 112, 'use_sma': True, 'use_atr': True, 'use_adx': True, 'use_ema': False, 'use_spike': True, 'rsi_required': True, 'edge_k': 1.1217338917185764, 'edge_cap': 0.14202194313746042, 'bull_strategy': 'mean_reversion', 'bull_bb_std_mult': 2.1155887860785594, 'bull_rsi_os': 49, 'bull_rsi_ob': 82, 'bull_adx_thresh': 15.998200462786667, 'bull_atr_min_pct': 0.02347887895133046, 'bull_atr_max_pct': 0.045003634844488265, 'bull_tp_mult': 2.077651366087033, 'bull_tsl_mult': 0.5649336207716125, 'bull_time_stop': 281, 'bull_use_sma': False, 'bull_use_ema': False, 'bull_use_atr': False, 'bull_use_adx': True, 'bull_use_spike': False, 'bull_rsi_required': True, 'bear_strategy': 'mean_reversion', 'bear_bb_std_mult': 1.7304297894243974, 'bear_rsi_os': 8, 'bear_rsi_ob': 74, 'bear_adx_thresh': 26.946652072994166, 'bear_atr_min_pct': 0.02836149176055966, 'bear_atr_max_pct': 0.12423943149191026, 'bear_tp_mult': 2.5531830116559115, 'bear_tsl_mult': 0.6109293853492077, 'bear_time_stop': 251, 'bear_use_sma': False, 'bear_use_ema': True, 'bear_use_atr': False, 'bear_use_adx': False, 'bear_use_spike': True, 'bear_rsi_required': False, 'sideways_strategy': 'breakout', 'sideways_bb_std_mult': 2.3577165069605757, 'sideways_rsi_os': 35, 'sideways_rsi_ob': 47, 'sideways_adx_thresh': 26.474791371891435, 'sideways_atr_min_pct': 0.0199952900169143, 'sideways_atr_max_pct': 0.09297948773066086, 'sideways_tp_mult': 2.0394023667403203, 'sideways_tsl_mult': 0.9622394727524545, 'sideways_time_stop': 233, 'sideways_use_sma': True, 'sideways_use_ema': False, 'sideways_use_atr': True, 'sideways_use_adx': True, 'sideways_use_spike': True, 'sideways_rsi_required': False}.
[I 2025-08-30 22:31:21,280] Trial 841 finished with values: [-1000000000.0, 1000000000.0] and parameters: {'p_sma': 36, 'p_std': 38, 'p_atr': 18, 'p_adx': 27, 'rsi_period': 77, 'ema1': 8, 'ema2': 32, 'slip_atr_k': 0.007220535619716368, 'slip_spread_k': 0.7046188092222845, 'spread_hl_frac': 0.011785986065661478, 'bb_std_mult': 2.6669223633285926, 'rsi_os': 16, 'rsi_ob': 91, 'vol_spike': 0.039154390104835096, 'adx_thresh': 14.830331980121397, 'atr_min_pct': 0.01445727015420403, 'atr_max_pct': 0.08305863679837165, 'tp_mult': 1.5378093888530382, 'tsl_mult': 0.4231041476186363, 'strategy': 'breakout', 'time_stop': 108, 'use_sma': False, 'use_atr': True, 'use_adx': False, 'use_ema': False, 'use_spike': False, 'rsi_required': True, 'edge_k': 1.2181086317027918, 'edge_cap': 0.10624238321359135, 'bull_strategy': 'breakout', 'bull_bb_std_mult': 2.168364121873906, 'bull_rsi_os': 47, 'bull_rsi_ob': 85, 'bull_adx_thresh': 17.401911646630584, 'bull_atr_min_pct': 0.01933077096366275, 'bull_atr_max_pct': 0.03955044596764407, 'bull_tp_mult': 2.0485315074161994, 'bull_tsl_mult': 0.5443237754376816, 'bull_time_stop': 283, 'bull_use_sma': True, 'bull_use_ema': False, 'bull_use_atr': True, 'bull_use_adx': True, 'bull_use_spike': False, 'bull_rsi_required': True, 'bear_strategy': 'mean_reversion', 'bear_bb_std_mult': 1.595919990582807, 'bear_rsi_os': 8, 'bear_rsi_ob': 72, 'bear_adx_thresh': 26.663057336316307, 'bear_atr_min_pct': 0.028450676771679808, 'bear_atr_max_pct': 0.12482239609117204, 'bear_tp_mult': 2.3645090402472864, 'bear_tsl_mult': 0.5474630721808066, 'bear_time_stop': 252, 'bear_use_sma': False, 'bear_use_ema': True, 'bear_use_atr': False, 'bear_use_adx': True, 'bear_use_spike': False, 'bear_rsi_required': False, 'sideways_strategy': 'breakout', 'sideways_bb_std_mult': 2.3979332166056717, 'sideways_rsi_os': 36, 'sideways_rsi_ob': 50, 'sideways_adx_thresh': 26.26757811605358, 'sideways_atr_min_pct': 0.02015869724499886, 'sideways_atr_max_pct': 0.093331956176873, 'sideways_tp_mult': 1.9555278940027017, 'sideways_tsl_mult': 0.9654286619193978, 'sideways_time_stop': 248, 'sideways_use_sma': True, 'sideways_use_ema': False, 'sideways_use_atr': False, 'sideways_use_adx': True, 'sideways_use_spike': True, 'sideways_rsi_required': False}.
[I 2025-08-30 22:31:21,553] Trial 842 finished with values: [-1000000000.0, 1000000000.0] and parameters: {'p_sma': 36, 'p_std': 39, 'p_atr': 20, 'p_adx': 27, 'rsi_period': 76, 'ema1': 7, 'ema2': 32, 'slip_atr_k': 0.007427769315210976, 'slip_spread_k': 0.7075169287640989, 'spread_hl_frac': 0.011828871822439047, 'bb_std_mult': 2.6447858837636096, 'rsi_os': 14, 'rsi_ob': 90, 'vol_spike': 0.014087297542928378, 'adx_thresh': 6.765571454050005, 'atr_min_pct': 0.014235054866404888, 'atr_max_pct': 0.08204419302214655, 'tp_mult': 1.5477453470730427, 'tsl_mult': 0.43106375877137976, 'strategy': 'breakout', 'time_stop': 107, 'use_sma': True, 'use_atr': True, 'use_adx': True, 'use_ema': False, 'use_spike': True, 'rsi_required': False, 'edge_k': 1.2447513139364896, 'edge_cap': 0.1404592233138064, 'bull_strategy': 'breakout', 'bull_bb_std_mult': 2.226778266969542, 'bull_rsi_os': 47, 'bull_rsi_ob': 82, 'bull_adx_thresh': 16.5413025164617, 'bull_atr_min_pct': 0.01923003422920741, 'bull_atr_max_pct': 0.044712440429266774, 'bull_tp_mult': 2.05491418097639, 'bull_tsl_mult': 0.5648262364843488, 'bull_time_stop': 285, 'bull_use_sma': False, 'bull_use_ema': True, 'bull_use_atr': False, 'bull_use_adx': True, 'bull_use_spike': False, 'bull_rsi_required': True, 'bear_strategy': 'mean_reversion', 'bear_bb_std_mult': 1.7318866034656741, 'bear_rsi_os': 8, 'bear_rsi_ob': 72, 'bear_adx_thresh': 26.913609380786514, 'bear_atr_min_pct': 0.02813836966327177, 'bear_atr_max_pct': 0.12387036029290728, 'bear_tp_mult': 2.550393176615888, 'bear_tsl_mult': 0.5467211732872438, 'bear_time_stop': 252, 'bear_use_sma': False, 'bear_use_ema': False, 'bear_use_atr': False, 'bear_use_adx': True, 'bear_use_spike': False, 'bear_rsi_required': False, 'sideways_strategy': 'breakout', 'sideways_bb_std_mult': 2.340660846987745, 'sideways_rsi_os': 36, 'sideways_rsi_ob': 49, 'sideways_adx_thresh': 26.352334654473385, 'sideways_atr_min_pct': 0.019801360125753828, 'sideways_atr_max_pct': 0.0803601575107402, 'sideways_tp_mult': 2.003303231266387, 'sideways_tsl_mult': 0.8850052791982611, 'sideways_time_stop': 246, 'sideways_use_sma': True, 'sideways_use_ema': False, 'sideways_use_atr': True, 'sideways_use_adx': True, 'sideways_use_spike': True, 'sideways_rsi_required': False}.
[I 2025-08-30 22:31:21,755] Trial 843 finished with values: [-1000000000.0, 1000000000.0] and parameters: {'p_sma': 10, 'p_std': 41, 'p_atr': 18, 'p_adx': 14, 'rsi_period': 77, 'ema1': 7, 'ema2': 29, 'slip_atr_k': 0.007243012384541558, 'slip_spread_k': 0.6946823129310772, 'spread_hl_frac': 0.01535603041470705, 'bb_std_mult': 2.631380502063911, 'rsi_os': 15, 'rsi_ob': 92, 'vol_spike': 0.033118282059791226, 'adx_thresh': 14.883606394509194, 'atr_min_pct': 0.014181425488082808, 'atr_max_pct': 0.07642986339521342, 'tp_mult': 1.5631362259149653, 'tsl_mult': 0.2664812893324943, 'strategy': 'mean_reversion', 'time_stop': 108, 'use_sma': True, 'use_atr': True, 'use_adx': True, 'use_ema': False, 'use_spike': True, 'rsi_required': True, 'edge_k': 1.235289835004456, 'edge_cap': 0.14106671821197533, 'bull_strategy': 'mean_reversion', 'bull_bb_std_mult': 2.2397981372387457, 'bull_rsi_os': 50, 'bull_rsi_ob': 84, 'bull_adx_thresh': 16.085312292950164, 'bull_atr_min_pct': 0.012060479339043431, 'bull_atr_max_pct': 0.04535904393170489, 'bull_tp_mult': 2.0662825067813437, 'bull_tsl_mult': 0.5402013850364258, 'bull_time_stop': 285, 'bull_use_sma': False, 'bull_use_ema': False, 'bull_use_atr': False, 'bull_use_adx': True, 'bull_use_spike': False, 'bull_rsi_required': True, 'bear_strategy': 'mean_reversion', 'bear_bb_std_mult': 1.5893818454274669, 'bear_rsi_os': 8, 'bear_rsi_ob': 72, 'bear_adx_thresh': 26.99450745871394, 'bear_atr_min_pct': 0.027273230289210255, 'bear_atr_max_pct': 0.12869691405012126, 'bear_tp_mult': 2.5413348394379365, 'bear_tsl_mult': 0.6093708518872243, 'bear_time_stop': 251, 'bear_use_sma': False, 'bear_use_ema': True, 'bear_use_atr': False, 'bear_use_adx': False, 'bear_use_spike': False, 'bear_rsi_required': False, 'sideways_strategy': 'breakout', 'sideways_bb_std_mult': 2.379059551477498, 'sideways_rsi_os': 35, 'sideways_rsi_ob': 49, 'sideways_adx_thresh': 26.372998199746988, 'sideways_atr_min_pct': 0.018018887812425957, 'sideways_atr_max_pct': 0.09389887253116054, 'sideways_tp_mult': 2.021077451016013, 'sideways_tsl_mult': 0.9767681780430368, 'sideways_time_stop': 246, 'sideways_use_sma': True, 'sideways_use_ema': False, 'sideways_use_atr': True, 'sideways_use_adx': True, 'sideways_use_spike': True, 'sideways_rsi_required': False}.
[I 2025-08-30 22:31:56,074] Trial 846 finished with values: [-1000000000.0, 1000000000.0] and parameters: {'p_sma': 5, 'p_std': 41, 'p_atr': 20, 'p_adx': 14, 'rsi_period': 76, 'ema1': 14, 'ema2': 29, 'slip_atr_k': 0.007882495084420123, 'slip_spread_k': 0.6769571989273908, 'spread_hl_frac': 0.015181023158460705, 'bb_std_mult': 2.823297030304398, 'rsi_os': 14, 'rsi_ob': 92, 'vol_spike': 0.02751404190981917, 'adx_thresh': 5.766698026587681, 'atr_min_pct': 0.013864466875154946, 'atr_max_pct': 0.07420058213338944, 'tp_mult': 1.4462443439690242, 'tsl_mult': 0.3850736458043158, 'strategy': 'mean_reversion', 'time_stop': 108, 'use_sma': True, 'use_atr': False, 'use_adx': True, 'use_ema': True, 'use_spike': True, 'rsi_required': True, 'edge_k': 1.2751355474546, 'edge_cap': 0.16148391980359889, 'bull_strategy': 'breakout', 'bull_bb_std_mult': 2.0967149694671647, 'bull_rsi_os': 53, 'bull_rsi_ob': 83, 'bull_adx_thresh': 16.17892087874589, 'bull_atr_min_pct': 0.0015174087061814306, 'bull_atr_max_pct': 0.04436493227718163, 'bull_tp_mult': 1.9983131700948005, 'bull_tsl_mult': 0.6110547249415242, 'bull_time_stop': 285, 'bull_use_sma': False, 'bull_use_ema': False, 'bull_use_atr': False, 'bull_use_adx': True, 'bull_use_spike': False, 'bull_rsi_required': False, 'bear_strategy': 'breakout', 'bear_bb_std_mult': 1.7417097283953131, 'bear_rsi_os': 33, 'bear_rsi_ob': 93, 'bear_adx_thresh': 27.312567679882612, 'bear_atr_min_pct': 0.028194168637594445, 'bear_atr_max_pct': 0.12878713641230194, 'bear_tp_mult': 2.539164129168766, 'bear_tsl_mult': 0.5680179539797904, 'bear_time_stop': 249, 'bear_use_sma': True, 'bear_use_ema': True, 'bear_use_atr': True, 'bear_use_adx': False, 'bear_use_spike': True, 'bear_rsi_required': False, 'sideways_strategy': 'breakout', 'sideways_bb_std_mult': 2.487211234971398, 'sideways_rsi_os': 37, 'sideways_rsi_ob': 51, 'sideways_adx_thresh': 26.66489248074937, 'sideways_atr_min_pct': 0.01789552581049122, 'sideways_atr_max_pct': 0.08853176134571465, 'sideways_tp_mult': 2.016383605835842, 'sideways_tsl_mult': 0.9859312919038374, 'sideways_time_stop': 236, 'sideways_use_sma': False, 'sideways_use_ema': False, 'sideways_use_atr': True, 'sideways_use_adx': True, 'sideways_use_spike': True, 'sideways_rsi_required': False}.
