[I 2025-08-30 21:17:02,542] Trial 236 finished with values: [-0.017980647768114477, 0.017916162993035802] and parameters: {'p_sma': 29, 'p_std': 34, 'p_atr': 15, 'p_adx': 30, 'rsi_period': 54, 'ema1': 23, 'ema2': 44, 'slip_atr_k': 0.0416646925923669, 'slip_spread_k': 0.33997774871033587, 'spread_hl_frac': 0.02307979439249533, 'bb_std_mult': 1.6486167098454911, 'rsi_os': 8, 'rsi_ob': 80, 'vol_spike': 0.2907134320427651, 'adx_thresh': 5.475391069060082, 'atr_min_pct': 0.0006769008671501694, 'atr_max_pct': 0.12582484381051035, 'tp_mult': 1.634853068218267, 'tsl_mult': 0.7970882018371801, 'strategy': 'mean_reversion', 'time_stop': 198, 'use_sma': False, 'use_atr': True, 'use_adx': True, 'use_ema': True, 'use_spike': True, 'rsi_required': True, 'edge_k': 0.6256447772403333, 'edge_cap': 0.6456866527967475, 'bull_strategy': 'breakout', 'bull_bb_std_mult': 2.3837843197254007, 'bull_rsi_os': 17, 'bull_rsi_ob': 70, 'bull_adx_thresh': 12.666748649766232, 'bull_atr_min_pct': 0.000514907013293528, 'bull_atr_max_pct': 0.027312814831408204, 'bull_tp_mult': 2.5977115937798834, 'bull_tsl_mult': 0.6626689004335622, 'bull_time_stop': 300, 'bull_use_sma': True, 'bull_use_ema': False, 'bull_use_atr': False, 'bull_use_adx': True, 'bull_use_spike': True, 'bull_rsi_required': True, 'bear_strategy': 'mean_reversion', 'bear_bb_std_mult': 2.681976623177483, 'bear_rsi_os': 40, 'bear_rsi_ob': 80, 'bear_adx_thresh': 16.570270797473654, 'bear_atr_min_pct': 0.015984235987987584, 'bear_atr_max_pct': 0.11633885124225674, 'bear_tp_mult': 2.972204827501259, 'bear_tsl_mult': 0.4479550191627361, 'bear_time_stop': 231, 'bear_use_sma': True, 'bear_use_ema': False, 'bear_use_atr': False, 'bear_use_adx': True, 'bear_use_spike': True, 'bear_rsi_required': True, 'sideways_strategy': 'breakout', 'sideways_bb_std_mult': 2.845296590633814, 'sideways_rsi_os': 47, 'sideways_rsi_ob': 62, 'sideways_adx_thresh': 32.5701971422594, 'sideways_atr_min_pct': 0.01492785044649618, 'sideways_atr_max_pct': 0.067432219220459, 'sideways_tp_mult': 1.7722736915651007, 'sideways_tsl_mult': 0.2775707888962286, 'sideways_time_stop': 229, 'sideways_use_sma': False, 'sideways_use_ema': True, 'sideways_use_atr': True, 'sideways_use_adx': False, 'sideways_use_spike': False, 'sideways_rsi_required': True}.
[I 2025-08-30 21:17:03,211] Trial 235 finished with values: [-0.015662465598631714, 0.015599096721671025] and parameters: {'p_sma': 29, 'p_std': 34, 'p_atr': 15, 'p_adx': 30, 'rsi_period': 19, 'ema1': 21, 'ema2': 44, 'slip_atr_k': 0.034817804585027895, 'slip_spread_k': 0.5591796403375309, 'spread_hl_frac': 0.005211640776143102, 'bb_std_mult': 1.6312094955470364, 'rsi_os': 10, 'rsi_ob': 80, 'vol_spike': 0.29231505413935616, 'adx_thresh': 30.118467084541766, 'atr_min_pct': 0.020382894863230906, 'atr_max_pct': 0.09063521586426146, 'tp_mult': 1.6299097275498924, 'tsl_mult': 0.9018160106317351, 'strategy': 'mean_reversion', 'time_stop': 110, 'use_sma': False, 'use_atr': True, 'use_adx': True, 'use_ema': True, 'use_spike': True, 'rsi_required': True, 'edge_k': 0.6952064590496504, 'edge_cap': 0.6060582395665253, 'bull_strategy': 'breakout', 'bull_bb_std_mult': 3.3746781882078096, 'bull_rsi_os': 17, 'bull_rsi_ob': 70, 'bull_adx_thresh': 15.069099186411844, 'bull_atr_min_pct': 0.0006237110669888284, 'bull_atr_max_pct': 0.05520430941648763, 'bull_tp_mult': 2.3203023106067047, 'bull_tsl_mult': 0.40811701376708476, 'bull_time_stop': 299, 'bull_use_sma': True, 'bull_use_ema': False, 'bull_use_atr': False, 'bull_use_adx': True, 'bull_use_spike': True, 'bull_rsi_required': True, 'bear_strategy': 'mean_reversion', 'bear_bb_std_mult': 2.675265398048458, 'bear_rsi_os': 39, 'bear_rsi_ob': 52, 'bear_adx_thresh': 16.265966431225284, 'bear_atr_min_pct': 0.01589093687095078, 'bear_atr_max_pct': 0.013003733121560328, 'bear_tp_mult': 2.9091587535244177, 'bear_tsl_mult': 0.4401057140709863, 'bear_time_stop': 105, 'bear_use_sma': True, 'bear_use_ema': False, 'bear_use_atr': False, 'bear_use_adx': True, 'bear_use_spike': True, 'bear_rsi_required': True, 'sideways_strategy': 'breakout', 'sideways_bb_std_mult': 1.6235691669064658, 'sideways_rsi_os': 40, 'sideways_rsi_ob': 92, 'sideways_adx_thresh': 27.168602648582343, 'sideways_atr_min_pct': 0.014720259840960268, 'sideways_atr_max_pct': 0.09700073827449829, 'sideways_tp_mult': 2.0633727499795915, 'sideways_tsl_mult': 0.4498655913679074, 'sideways_time_stop': 257, 'sideways_use_sma': False, 'sideways_use_ema': True, 'sideways_use_atr': True, 'sideways_use_adx': False, 'sideways_use_spike': False, 'sideways_rsi_required': True}.
[I 2025-08-30 21:17:03,320] Trial 234 finished with values: [-1000000000.0, 1000000000.0] and parameters: {'p_sma': 9, 'p_std': 34, 'p_atr': 15, 'p_adx': 28, 'rsi_period': 35, 'ema1': 20, 'ema2': 44, 'slip_atr_k': 0.034780744270707514, 'slip_spread_k': 0.3721043308355494, 'spread_hl_frac': 0.04032632250358549, 'bb_std_mult': 1.6235678374269584, 'rsi_os': 44, 'rsi_ob': 80, 'vol_spike': 0.29195466215652416, 'adx_thresh': 8.333027261468608, 'atr_min_pct': 0.01232819335822185, 'atr_max_pct': 0.09165469188502946, 'tp_mult': 1.5620760590872507, 'tsl_mult': 0.4986180578469992, 'strategy': 'mean_reversion', 'time_stop': 111, 'use_sma': False, 'use_atr': True, 'use_adx': True, 'use_ema': True, 'use_spike': True, 'rsi_required': True, 'edge_k': 0.6853279931292839, 'edge_cap': 0.6006211039407624, 'bull_strategy': 'breakout', 'bull_bb_std_mult': 2.350704598316122, 'bull_rsi_os': 17, 'bull_rsi_ob': 70, 'bull_adx_thresh': 14.5587838384707, 'bull_atr_min_pct': 0.028699322866058287, 'bull_atr_max_pct': 0.05446425747701245, 'bull_tp_mult': 2.582966309973272, 'bull_tsl_mult': 0.1523221284738363, 'bull_time_stop': 300, 'bull_use_sma': True, 'bull_use_ema': False, 'bull_use_atr': False, 'bull_use_adx': True, 'bull_use_spike': True, 'bull_rsi_required': True, 'bear_strategy': 'mean_reversion', 'bear_bb_std_mult': 3.3511141714294226, 'bear_rsi_os': 41, 'bear_rsi_ob': 67, 'bear_adx_thresh': 16.650615176112566, 'bear_atr_min_pct': 0.01597436213248831, 'bear_atr_max_pct': 0.019638530776240424, 'bear_tp_mult': 2.921934971754299, 'bear_tsl_mult': 0.19913980140768228, 'bear_time_stop': 83, 'bear_use_sma': True, 'bear_use_ema': True, 'bear_use_atr': False, 'bear_use_adx': True, 'bear_use_spike': True, 'bear_rsi_required': True, 'sideways_strategy': 'breakout', 'sideways_bb_std_mult': 2.7648399398951096, 'sideways_rsi_os': 40, 'sideways_rsi_ob': 62, 'sideways_adx_thresh': 27.305340849024972, 'sideways_atr_min_pct': 0.014997799565258416, 'sideways_atr_max_pct': 0.09141917043511089, 'sideways_tp_mult': 2.076609687959362, 'sideways_tsl_mult': 0.7421911417110792, 'sideways_time_stop': 136, 'sideways_use_sma': False, 'sideways_use_ema': True, 'sideways_use_atr': True, 'sideways_use_adx': False, 'sideways_use_spike': False, 'sideways_rsi_required': True}.
[I 2025-08-30 21:17:04,220] Trial 237 finished with values: [-1000000000.0, 1000000000.0] and parameters: {'p_sma': 7, 'p_std': 34, 'p_atr': 15, 'p_adx': 11, 'rsi_period': 11, 'ema1': 14, 'ema2': 44, 'slip_atr_k': 0.04359201646732695, 'slip_spread_k': 0.3762277391403738, 'spread_hl_frac': 0.0052770306172582335, 'bb_std_mult': 1.6944771976994148, 'rsi_os': 45, 'rsi_ob': 80, 'vol_spike': 0.2620714642490255, 'adx_thresh': 17.981704936351264, 'atr_min_pct': 0.017343443400707554, 'atr_max_pct': 0.11868445842463393, 'tp_mult': 1.6337182230645626, 'tsl_mult': 0.0008818377221936347, 'strategy': 'mean_reversion', 'time_stop': 174, 'use_sma': False, 'use_atr': False, 'use_adx': True, 'use_ema': False, 'use_spike': True, 'rsi_required': True, 'edge_k': 1.6002742127329612, 'edge_cap': 0.6051552188208869, 'bull_strategy': 'breakout', 'bull_bb_std_mult': 2.909075587207533, 'bull_rsi_os': 17, 'bull_rsi_ob': 69, 'bull_adx_thresh': 12.476172264226445, 'bull_atr_min_pct': 0.023004880031270013, 'bull_atr_max_pct': 0.026722721578942905, 'bull_tp_mult': 2.6015801863063337, 'bull_tsl_mult': 0.2783061308272099, 'bull_time_stop': 195, 'bull_use_sma': True, 'bull_use_ema': False, 'bull_use_atr': False, 'bull_use_adx': True, 'bull_use_spike': True, 'bull_rsi_required': True, 'bear_strategy': 'mean_reversion', 'bear_bb_std_mult': 3.355054566997264, 'bear_rsi_os': 49, 'bear_rsi_ob': 52, 'bear_adx_thresh': 27.815498425290485, 'bear_atr_min_pct': 0.01724269135476992, 'bear_atr_max_pct': 0.026871938574017942, 'bear_tp_mult': 2.047431036648351, 'bear_tsl_mult': 0.19525435605099348, 'bear_time_stop': 300, 'bear_use_sma': True, 'bear_use_ema': False, 'bear_use_atr': False, 'bear_use_adx': True, 'bear_use_spike': True, 'bear_rsi_required': True, 'sideways_strategy': 'breakout', 'sideways_bb_std_mult': 2.026258784101603, 'sideways_rsi_os': 39, 'sideways_rsi_ob': 54, 'sideways_adx_thresh': 19.870384642112956, 'sideways_atr_min_pct': 0.024670806206270934, 'sideways_atr_max_pct': 0.012983446238552313, 'sideways_tp_mult': 2.6688571551211218, 'sideways_tsl_mult': 0.4420277647201447, 'sideways_time_stop': 140, 'sideways_use_sma': False, 'sideways_use_ema': True, 'sideways_use_atr': True, 'sideways_use_adx': False, 'sideways_use_spike': False, 'sideways_rsi_required': True}.
[I 2025-08-30 21:17:37,628] Trial 238 finished with values: [-1000000000.0, 1000000000.0] and parameters: {'p_sma': 7, 'p_std': 36, 'p_atr': 15, 'p_adx': 30, 'rsi_period': 17, 'ema1': 14, 'ema2': 44, 'slip_atr_k': 0.04367648605186186, 'slip_spread_k': 0.8049699290216543, 'spread_hl_frac': 0.004897823822884191, 'bb_std_mult': 1.6789643862973878, 'rsi_os': 48, 'rsi_ob': 80, 'vol_spike': 0.261836327847904, 'adx_thresh': 8.545952034318368, 'atr_min_pct': 0.001350373810821685, 'atr_max_pct': 0.09137748965928702, 'tp_mult': 1.0573136696343879, 'tsl_mult': 0.8017709054607963, 'strategy': 'breakout', 'time_stop': 69, 'use_sma': False, 'use_atr': True, 'use_adx': False, 'use_ema': True, 'use_spike': False, 'rsi_required': False, 'edge_k': 0.16239898031433664, 'edge_cap': 0.6120386296654574, 'bull_strategy': 'mean_reversion', 'bull_bb_std_mult': 2.2073125066712747, 'bull_rsi_os': 17, 'bull_rsi_ob': 69, 'bull_adx_thresh': 12.628061925797901, 'bull_atr_min_pct': 0.02866883174612519, 'bull_atr_max_pct': 0.060142494361571715, 'bull_tp_mult': 2.596869571394921, 'bull_tsl_mult': 0.6595265277490109, 'bull_time_stop': 123, 'bull_use_sma': True, 'bull_use_ema': True, 'bull_use_atr': True, 'bull_use_adx': True, 'bull_use_spike': True, 'bull_rsi_required': False, 'bear_strategy': 'breakout', 'bear_bb_std_mult': 2.7317666949173542, 'bear_rsi_os': 48, 'bear_rsi_ob': 80, 'bear_adx_thresh': 30.26067291333767, 'bear_atr_min_pct': 0.02369072351300045, 'bear_atr_max_pct': 0.027681755758994855, 'bear_tp_mult': 2.9640825726444304, 'bear_tsl_mult': 0.25729444376023086, 'bear_time_stop': 231, 'bear_use_sma': True, 'bear_use_ema': False, 'bear_use_atr': True, 'bear_use_adx': True, 'bear_use_spike': False, 'bear_rsi_required': False, 'sideways_strategy': 'mean_reversion', 'sideways_bb_std_mult': 2.335378581650721, 'sideways_rsi_os': 5, 'sideways_rsi_ob': 92, 'sideways_adx_thresh': 22.11975305429768, 'sideways_atr_min_pct': 0.008526837234412912, 'sideways_atr_max_pct': 0.09860672858175881, 'sideways_tp_mult': 2.684283577728442, 'sideways_tsl_mult': 0.2870943070457587, 'sideways_time_stop': 128, 'sideways_use_sma': False, 'sideways_use_ema': True, 'sideways_use_atr': True, 'sideways_use_adx': False, 'sideways_use_spike': False, 'sideways_rsi_required': True}.
[I 2025-08-30 21:17:38,511] Trial 240 finished with values: [-1000000000.0, 1000000000.0] and parameters: {'p_sma': 32, 'p_std': 31, 'p_atr': 15, 'p_adx': 30, 'rsi_period': 21, 'ema1': 23, 'ema2': 46, 'slip_atr_k': 0.04245840936100666, 'slip_spread_k': 0.5620448575128274, 'spread_hl_frac': 0.002632749860530981, 'bb_std_mult': 1.711480010207355, 'rsi_os': 9, 'rsi_ob': 81, 'vol_spike': 0.29503341473078365, 'adx_thresh': 30.267305597288797, 'atr_min_pct': 0.02181791889597198, 'atr_max_pct': 0.08770360888194675, 'tp_mult': 2.725538543475059, 'tsl_mult': 0.92159074768087, 'strategy': 'breakout', 'time_stop': 71, 'use_sma': False, 'use_atr': True, 'use_adx': False, 'use_ema': True, 'use_spike': False, 'rsi_required': False, 'edge_k': 0.8133941080928884, 'edge_cap': 0.6110301118993842, 'bull_strategy': 'mean_reversion', 'bull_bb_std_mult': 3.349769354093155, 'bull_rsi_os': 17, 'bull_rsi_ob': 69, 'bull_adx_thresh': 15.927304789973286, 'bull_atr_min_pct': 0.02294777610105006, 'bull_atr_max_pct': 0.05871332838880995, 'bull_tp_mult': 2.3124219397101835, 'bull_tsl_mult': 0.43775874543934207, 'bull_time_stop': 126, 'bull_use_sma': False, 'bull_use_ema': True, 'bull_use_atr': True, 'bull_use_adx': True, 'bull_use_spike': True, 'bull_rsi_required': False, 'bear_strategy': 'breakout', 'bear_bb_std_mult': 2.570252187495701, 'bear_rsi_os': 39, 'bear_rsi_ob': 54, 'bear_adx_thresh': 15.865954384640967, 'bear_atr_min_pct': 0.015110354301457114, 'bear_atr_max_pct': 0.013831511577739097, 'bear_tp_mult': 2.778557863949724, 'bear_tsl_mult': 0.4550888686689732, 'bear_time_stop': 134, 'bear_use_sma': True, 'bear_use_ema': False, 'bear_use_atr': True, 'bear_use_adx': True, 'bear_use_spike': False, 'bear_rsi_required': False, 'sideways_strategy': 'mean_reversion', 'sideways_bb_std_mult': 1.477027504638953, 'sideways_rsi_os': 43, 'sideways_rsi_ob': 92, 'sideways_adx_thresh': 28.25094965977214, 'sideways_atr_min_pct': 0.014057378386446532, 'sideways_atr_max_pct': 0.09687665207940088, 'sideways_tp_mult': 2.108174790825854, 'sideways_tsl_mult': 0.46282217733006775, 'sideways_time_stop': 258, 'sideways_use_sma': True, 'sideways_use_ema': True, 'sideways_use_atr': True, 'sideways_use_adx': False, 'sideways_use_spike': True, 'sideways_rsi_required': True}.
[I 2025-08-30 21:17:38,614] Trial 239 finished with values: [-1000000000.0, 1000000000.0] and parameters: {'p_sma': 32, 'p_std': 32, 'p_atr': 15, 'p_adx': 30, 'rsi_period': 21, 'ema1': 23, 'ema2': 45, 'slip_atr_k': 0.2336285111751102, 'slip_spread_k': 0.5827764157365204, 'spread_hl_frac': 0.0048721693188654375, 'bb_std_mult': 1.7607102917879272, 'rsi_os': 9, 'rsi_ob': 81, 'vol_spike': 0.2936372469033556, 'adx_thresh': 30.135297100544634, 'atr_min_pct': 0.02165512424258647, 'atr_max_pct': 0.0871533867460089, 'tp_mult': 1.6514413208360659, 'tsl_mult': 0.9239715115798764, 'strategy': 'breakout', 'time_stop': 68, 'use_sma': False, 'use_atr': True, 'use_adx': False, 'use_ema': True, 'use_spike': False, 'rsi_required': False, 'edge_k': 0.7980400678254589, 'edge_cap': 0.6061063792371638, 'bull_strategy': 'mean_reversion', 'bull_bb_std_mult': 3.356074092287856, 'bull_rsi_os': 17, 'bull_rsi_ob': 70, 'bull_adx_thresh': 15.966335734404218, 'bull_atr_min_pct': 0.006778465708770099, 'bull_atr_max_pct': 0.059889621549855845, 'bull_tp_mult': 2.316105024979657, 'bull_tsl_mult': 0.4289179816527377, 'bull_time_stop': 195, 'bull_use_sma': False, 'bull_use_ema': True, 'bull_use_atr': True, 'bull_use_adx': True, 'bull_use_spike': True, 'bull_rsi_required': False, 'bear_strategy': 'breakout', 'bear_bb_std_mult': 2.5728489743484175, 'bear_rsi_os': 39, 'bear_rsi_ob': 54, 'bear_adx_thresh': 13.910929697438295, 'bear_atr_min_pct': 0.014875187785962552, 'bear_atr_max_pct': 0.012991386569198675, 'bear_tp_mult': 2.8074906339739365, 'bear_tsl_mult': 0.46377258699118906, 'bear_time_stop': 300, 'bear_use_sma': True, 'bear_use_ema': False, 'bear_use_atr': True, 'bear_use_adx': True, 'bear_use_spike': False, 'bear_rsi_required': False, 'sideways_strategy': 'mean_reversion', 'sideways_bb_std_mult': 1.4694599070935506, 'sideways_rsi_os': 42, 'sideways_rsi_ob': 92, 'sideways_adx_thresh': 26.954014468977924, 'sideways_atr_min_pct': 0.014446321337978615, 'sideways_atr_max_pct': 0.09633920996854041, 'sideways_tp_mult': 2.0663484339152722, 'sideways_tsl_mult': 0.4451682571274012, 'sideways_time_stop': 257, 'sideways_use_sma': True, 'sideways_use_ema': True, 'sideways_use_atr': True, 'sideways_use_adx': False, 'sideways_use_spike': True, 'sideways_rsi_required': True}.
[I 2025-08-30 21:17:38,744] Trial 241 finished with values: [-1000000000.0, 1000000000.0] and parameters: {'p_sma': 31, 'p_std': 31, 'p_atr': 15, 'p_adx': 30, 'rsi_period': 22, 'ema1': 23, 'ema2': 46, 'slip_atr_k': 0.20176786025989857, 'slip_spread_k': 0.565501531054703, 'spread_hl_frac': 0.003304714917348351, 'bb_std_mult': 1.7964145252318502, 'rsi_os': 9, 'rsi_ob': 81, 'vol_spike': 0.29458032464687406, 'adx_thresh': 30.20726879142657, 'atr_min_pct': 0.021496430893282625, 'atr_max_pct': 0.08920189418760899, 'tp_mult': 1.6503667494198986, 'tsl_mult': 0.9546037509808581, 'strategy': 'breakout', 'time_stop': 98, 'use_sma': False, 'use_atr': True, 'use_adx': False, 'use_ema': True, 'use_spike': False, 'rsi_required': False, 'edge_k': 0.8199534113757937, 'edge_cap': 0.6133194868175473, 'bull_strategy': 'mean_reversion', 'bull_bb_std_mult': 3.354905128021456, 'bull_rsi_os': 17, 'bull_rsi_ob': 84, 'bull_adx_thresh': 15.823872060516507, 'bull_atr_min_pct': 0.0013499142257327062, 'bull_atr_max_pct': 0.059523903893087676, 'bull_tp_mult': 2.3397311152368823, 'bull_tsl_mult': 0.4254005550129687, 'bull_time_stop': 294, 'bull_use_sma': False, 'bull_use_ema': True, 'bull_use_atr': True, 'bull_use_adx': True, 'bull_use_spike': True, 'bull_rsi_required': False, 'bear_strategy': 'breakout', 'bear_bb_std_mult': 2.5540900467868775, 'bear_rsi_os': 39, 'bear_rsi_ob': 54, 'bear_adx_thresh': 13.908423440705867, 'bear_atr_min_pct': 0.014582124609373465, 'bear_atr_max_pct': 0.013081926880388214, 'bear_tp_mult': 2.79476144562337, 'bear_tsl_mult': 0.44917502418727434, 'bear_time_stop': 283, 'bear_use_sma': True, 'bear_use_ema': False, 'bear_use_atr': True, 'bear_use_adx': True, 'bear_use_spike': False, 'bear_rsi_required': False, 'sideways_strategy': 'mean_reversion', 'sideways_bb_std_mult': 1.4676294495220514, 'sideways_rsi_os': 42, 'sideways_rsi_ob': 92, 'sideways_adx_thresh': 28.15829405425635, 'sideways_atr_min_pct': 0.014480280165042516, 'sideways_atr_max_pct': 0.09649823843339612, 'sideways_tp_mult': 1.969311664135561, 'sideways_tsl_mult': 0.46044602466547013, 'sideways_time_stop': 259, 'sideways_use_sma': True, 'sideways_use_ema': True, 'sideways_use_atr': True, 'sideways_use_adx': False, 'sideways_use_spike': True, 'sideways_rsi_required': True}.
[I 2025-08-30 21:18:13,193] Trial 244 finished with values: [-1000000000.0, 1000000000.0] and parameters: {'p_sma': 30, 'p_std': 31, 'p_atr': 15, 'p_adx': 30, 'rsi_period': 25, 'ema1': 24, 'ema2': 46, 'slip_atr_k': 0.09387076232590977, 'slip_spread_k': 0.5344657136618879, 'spread_hl_frac': 0.003331444672233375, 'bb_std_mult': 1.9040847176722717, 'rsi_os': 11, 'rsi_ob': 83, 'vol_spike': 0.2914847364208638, 'adx_thresh': 29.51590778667678, 'atr_min_pct': 0.020654279181587645, 'atr_max_pct': 0.08929990572289621, 'tp_mult': 1.667262307081228, 'tsl_mult': 0.9536250658672842, 'strategy': 'mean_reversion', 'time_stop': 120, 'use_sma': False, 'use_atr': True, 'use_adx': True, 'use_ema': True, 'use_spike': True, 'rsi_required': True, 'edge_k': 0.7699335984357136, 'edge_cap': 0.5749984133764066, 'bull_strategy': 'breakout', 'bull_bb_std_mult': 3.286212445261974, 'bull_rsi_os': 16, 'bull_rsi_ob': 57, 'bull_adx_thresh': 15.314090101175854, 'bull_atr_min_pct': 0.02746855166052154, 'bull_atr_max_pct': 0.05638410218012727, 'bull_tp_mult': 2.207048621004116, 'bull_tsl_mult': 0.39152082319880926, 'bull_time_stop': 234, 'bull_use_sma': True, 'bull_use_ema': False, 'bull_use_atr': False, 'bull_use_adx': True, 'bull_use_spike': True, 'bull_rsi_required': True, 'bear_strategy': 'mean_reversion', 'bear_bb_std_mult': 2.632497244839604, 'bear_rsi_os': 38, 'bear_rsi_ob': 54, 'bear_adx_thresh': 15.345269892316582, 'bear_atr_min_pct': 0.015522218025314697, 'bear_atr_max_pct': 0.01351823503638124, 'bear_tp_mult': 2.8489830891388555, 'bear_tsl_mult': 0.4329267982108016, 'bear_time_stop': 126, 'bear_use_sma': True, 'bear_use_ema': False, 'bear_use_atr': False, 'bear_use_adx': True, 'bear_use_spike': True, 'bear_rsi_required': True, 'sideways_strategy': 'breakout', 'sideways_bb_std_mult': 1.5953741276844216, 'sideways_rsi_os': 42, 'sideways_rsi_ob': 90, 'sideways_adx_thresh': 26.63180532578429, 'sideways_atr_min_pct': 0.0136870530306374, 'sideways_atr_max_pct': 0.1008250200184668, 'sideways_tp_mult': 2.0148820595718733, 'sideways_tsl_mult': 0.48099344409607736, 'sideways_time_stop': 264, 'sideways_use_sma': False, 'sideways_use_ema': True, 'sideways_use_atr': True, 'sideways_use_adx': False, 'sideways_use_spike': False, 'sideways_rsi_required': True}.
