[I 2025-08-30 22:19:47,807] Trial 757 finished with values: [-1000000000.0, 1000000000.0] and parameters: {'p_sma': 51, 'p_std': 35, 'p_atr': 19, 'p_adx': 21, 'rsi_period': 80, 'ema1': 13, 'ema2': 51, 'slip_atr_k': 0.018296186676526764, 'slip_spread_k': 0.6246147783360134, 'spread_hl_frac': 0.03174856939150731, 'bb_std_mult': 1.1518017160717717, 'rsi_os': 9, 'rsi_ob': 69, 'vol_spike': 0.27744561157371805, 'adx_thresh': 23.729120192031463, 'atr_min_pct': 0.012981234068215807, 'atr_max_pct': 0.03497744919439736, 'tp_mult': 1.6916159879062853, 'tsl_mult': 0.0009772837998707207, 'strategy': 'mean_reversion', 'time_stop': 102, 'use_sma': True, 'use_atr': False, 'use_adx': False, 'use_ema': True, 'use_spike': False, 'rsi_required': True, 'edge_k': 0.8326770155428367, 'edge_cap': 0.3420065586298354, 'bull_strategy': 'breakout', 'bull_bb_std_mult': 1.7477973564812985, 'bull_rsi_os': 17, 'bull_rsi_ob': 94, 'bull_adx_thresh': 18.81301388447048, 'bull_atr_min_pct': 0.0268233331178605, 'bull_atr_max_pct': 0.03966884975968148, 'bull_tp_mult': 2.104577369308047, 'bull_tsl_mult': 0.3941164042786493, 'bull_time_stop': 44, 'bull_use_sma': True, 'bull_use_ema': False, 'bull_use_atr': False, 'bull_use_adx': False, 'bull_use_spike': False, 'bull_rsi_required': False, 'bear_strategy': 'mean_reversion', 'bear_bb_std_mult': 1.9722118166467604, 'bear_rsi_os': 6, 'bear_rsi_ob': 75, 'bear_adx_thresh': 29.662996477845812, 'bear_atr_min_pct': 0.029991431969038924, 'bear_atr_max_pct': 0.11525802655627478, 'bear_tp_mult': 1.6208031189178111, 'bear_tsl_mult': 0.22798914594455788, 'bear_time_stop': 243, 'bear_use_sma': False, 'bear_use_ema': True, 'bear_use_atr': False, 'bear_use_adx': True, 'bear_use_spike': True, 'bear_rsi_required': False, 'sideways_strategy': 'breakout', 'sideways_bb_std_mult': 0.6342735890203237, 'sideways_rsi_os': 52, 'sideways_rsi_ob': 88, 'sideways_adx_thresh': 27.16664106154209, 'sideways_atr_min_pct': 0.018434098870824846, 'sideways_atr_max_pct': 0.04923098322236503, 'sideways_tp_mult': 1.7309278572282603, 'sideways_tsl_mult': 0.27221986209825694, 'sideways_time_stop': 251, 'sideways_use_sma': False, 'sideways_use_ema': False, 'sideways_use_atr': False, 'sideways_use_adx': True, 'sideways_use_spike': False, 'sideways_rsi_required': False}.
[I 2025-08-30 22:19:48,120] Trial 758 finished with values: [-1000000000.0, 1000000000.0] and parameters: {'p_sma': 34, 'p_std': 27, 'p_atr': 19, 'p_adx': 21, 'rsi_period': 81, 'ema1': 11, 'ema2': 51, 'slip_atr_k': 0.017154589869796462, 'slip_spread_k': 0.6278055646615783, 'spread_hl_frac': 0.03144490223936221, 'bb_std_mult': 0.8273288428737628, 'rsi_os': 9, 'rsi_ob': 69, 'vol_spike': 0.23431487878784707, 'adx_thresh': 10.657260579257343, 'atr_min_pct': 0.008525317450619713, 'atr_max_pct': 0.0235622275127911, 'tp_mult': 1.5441036633792264, 'tsl_mult': 0.8998394676268034, 'strategy': 'mean_reversion', 'time_stop': 100, 'use_sma': True, 'use_atr': True, 'use_adx': True, 'use_ema': True, 'use_spike': True, 'rsi_required': True, 'edge_k': 1.0132965528254665, 'edge_cap': 0.758976967923005, 'bull_strategy': 'breakout', 'bull_bb_std_mult': 1.8915302041295472, 'bull_rsi_os': 17, 'bull_rsi_ob': 54, 'bull_adx_thresh': 15.65324785239714, 'bull_atr_min_pct': 0.026832054455751063, 'bull_atr_max_pct': 0.05377095403963594, 'bull_tp_mult': 1.4934721606126173, 'bull_tsl_mult': 0.6220470122989008, 'bull_time_stop': 44, 'bull_use_sma': True, 'bull_use_ema': False, 'bull_use_atr': False, 'bull_use_adx': False, 'bull_use_spike': False, 'bull_rsi_required': False, 'bear_strategy': 'breakout', 'bear_bb_std_mult': 1.9796894920506565, 'bear_rsi_os': 28, 'bear_rsi_ob': 80, 'bear_adx_thresh': 29.857161575503, 'bear_atr_min_pct': 0.029478001531613247, 'bear_atr_max_pct': 0.11520328552334513, 'bear_tp_mult': 1.6427724403841653, 'bear_tsl_mult': 0.26905282127414054, 'bear_time_stop': 245, 'bear_use_sma': False, 'bear_use_ema': True, 'bear_use_atr': False, 'bear_use_adx': True, 'bear_use_spike': True, 'bear_rsi_required': False, 'sideways_strategy': 'breakout', 'sideways_bb_std_mult': 2.8434329922394967, 'sideways_rsi_os': 37, 'sideways_rsi_ob': 88, 'sideways_adx_thresh': 27.49504657313995, 'sideways_atr_min_pct': 0.022453356230034482, 'sideways_atr_max_pct': 0.047424014390258104, 'sideways_tp_mult': 2.230038097045087, 'sideways_tsl_mult': 0.772035712317401, 'sideways_time_stop': 253, 'sideways_use_sma': False, 'sideways_use_ema': False, 'sideways_use_atr': False, 'sideways_use_adx': True, 'sideways_use_spike': False, 'sideways_rsi_required': False}.
[I 2025-08-30 22:19:48,423] Trial 759 finished with values: [-1000000000.0, 1000000000.0] and parameters: {'p_sma': 32, 'p_std': 27, 'p_atr': 21, 'p_adx': 21, 'rsi_period': 55, 'ema1': 11, 'ema2': 23, 'slip_atr_k': 0.07257796456064994, 'slip_spread_k': 0.00014843327947089424, 'spread_hl_frac': 0.0324277340268778, 'bb_std_mult': 3.4111501954454044, 'rsi_os': 24, 'rsi_ob': 65, 'vol_spike': 0.27622768275957116, 'adx_thresh': 25.17882687886864, 'atr_min_pct': 0.012941231269807148, 'atr_max_pct': 0.017739795671812997, 'tp_mult': 1.9267956377323985, 'tsl_mult': 0.8958819550237289, 'strategy': 'mean_reversion', 'time_stop': 199, 'use_sma': False, 'use_atr': True, 'use_adx': True, 'use_ema': False, 'use_spike': True, 'rsi_required': True, 'edge_k': 1.0035451026916566, 'edge_cap': 0.811102551755386, 'bull_strategy': 'breakout', 'bull_bb_std_mult': 2.3904341165200336, 'bull_rsi_os': 17, 'bull_rsi_ob': 87, 'bull_adx_thresh': 23.485052247052387, 'bull_atr_min_pct': 0.0006319870885521024, 'bull_atr_max_pct': 0.06609814713543273, 'bull_tp_mult': 1.4999356740494987, 'bull_tsl_mult': 0.37332078425674325, 'bull_time_stop': 294, 'bull_use_sma': True, 'bull_use_ema': True, 'bull_use_atr': False, 'bull_use_adx': False, 'bull_use_spike': False, 'bull_rsi_required': False, 'bear_strategy': 'breakout', 'bear_bb_std_mult': 1.9833024671521469, 'bear_rsi_os': 6, 'bear_rsi_ob': 72, 'bear_adx_thresh': 25.588224802346037, 'bear_atr_min_pct': 7.50987380226352e-05, 'bear_atr_max_pct': 0.12265750756334345, 'bear_tp_mult': 1.486779138698548, 'bear_tsl_mult': 0.925414500798238, 'bear_time_stop': 300, 'bear_use_sma': True, 'bear_use_ema': True, 'bear_use_atr': False, 'bear_use_adx': True, 'bear_use_spike': False, 'bear_rsi_required': False, 'sideways_strategy': 'breakout', 'sideways_bb_std_mult': 2.860484348736836, 'sideways_rsi_os': 53, 'sideways_rsi_ob': 91, 'sideways_adx_thresh': 27.432975682587983, 'sideways_atr_min_pct': 0.02254321528698446, 'sideways_atr_max_pct': 0.04888339361116219, 'sideways_tp_mult': 2.235896336503963, 'sideways_tsl_mult': 0.7731080991570078, 'sideways_time_stop': 86, 'sideways_use_sma': False, 'sideways_use_ema': False, 'sideways_use_atr': True, 'sideways_use_adx': True, 'sideways_use_spike': False, 'sideways_rsi_required': False}.
[I 2025-08-30 22:19:48,553] Trial 756 finished with values: [-1000000000.0, 1000000000.0] and parameters: {'p_sma': 57, 'p_std': 21, 'p_atr': 19, 'p_adx': 21, 'rsi_period': 76, 'ema1': 13, 'ema2': 51, 'slip_atr_k': 0.011623603260871824, 'slip_spread_k': 0.6182875929640065, 'spread_hl_frac': 0.0318598516016013, 'bb_std_mult': 2.960100670199165, 'rsi_os': 9, 'rsi_ob': 53, 'vol_spike': 0.25981732229421284, 'adx_thresh': 10.693031136722162, 'atr_min_pct': 0.012945726777166093, 'atr_max_pct': 0.023733083675970584, 'tp_mult': 1.6914172666756855, 'tsl_mult': 0.8584512662116782, 'strategy': 'mean_reversion', 'time_stop': 109, 'use_sma': True, 'use_atr': False, 'use_adx': False, 'use_ema': True, 'use_spike': False, 'rsi_required': True, 'edge_k': 0.8348602510399372, 'edge_cap': 0.3361816745462916, 'bull_strategy': 'breakout', 'bull_bb_std_mult': 2.0571176585537474, 'bull_rsi_os': 17, 'bull_rsi_ob': 54, 'bull_adx_thresh': 23.639169939754552, 'bull_atr_min_pct': 0.002003162823576903, 'bull_atr_max_pct': 0.04166761947493264, 'bull_tp_mult': 1.5098905550903106, 'bull_tsl_mult': 0.16962590935006977, 'bull_time_stop': 42, 'bull_use_sma': True, 'bull_use_ema': False, 'bull_use_atr': False, 'bull_use_adx': False, 'bull_use_spike': False, 'bull_rsi_required': False, 'bear_strategy': 'mean_reversion', 'bear_bb_std_mult': 1.9756401226173557, 'bear_rsi_os': 27, 'bear_rsi_ob': 80, 'bear_adx_thresh': 5.108097194143195, 'bear_atr_min_pct': 0.029432186023445505, 'bear_atr_max_pct': 0.09972807828742353, 'bear_tp_mult': 1.6266885091660968, 'bear_tsl_mult': 0.2700828407950633, 'bear_time_stop': 55, 'bear_use_sma': False, 'bear_use_ema': True, 'bear_use_atr': False, 'bear_use_adx': True, 'bear_use_spike': True, 'bear_rsi_required': False, 'sideways_strategy': 'breakout', 'sideways_bb_std_mult': 2.8494143934026646, 'sideways_rsi_os': 37, 'sideways_rsi_ob': 89, 'sideways_adx_thresh': 27.198786892452375, 'sideways_atr_min_pct': 0.02253682741070701, 'sideways_atr_max_pct': 0.030694323405424065, 'sideways_tp_mult': 1.7261277694979333, 'sideways_tsl_mult': 0.37708470038374614, 'sideways_time_stop': 253, 'sideways_use_sma': True, 'sideways_use_ema': False, 'sideways_use_atr': False, 'sideways_use_adx': True, 'sideways_use_spike': True, 'sideways_rsi_required': False}.
[I 2025-08-30 22:20:21,114] Trial 760 finished with values: [-1000000000.0, 1000000000.0] and parameters: {'p_sma': 32, 'p_std': 5, 'p_atr': 18, 'p_adx': 22, 'rsi_period': 60, 'ema1': 23, 'ema2': 53, 'slip_atr_k': 0.1862492491657406, 'slip_spread_k': 0.18361258826635413, 'spread_hl_frac': 0.03241726392281325, 'bb_std_mult': 3.4096747976977393, 'rsi_os': 12, 'rsi_ob': 65, 'vol_spike': 0.27852797207024194, 'adx_thresh': 8.665626058763682, 'atr_min_pct': 0.010339766220613077, 'atr_max_pct': 0.01772005406093066, 'tp_mult': 1.436711803934442, 'tsl_mult': 0.6638927353800705, 'strategy': 'mean_reversion', 'time_stop': 70, 'use_sma': False, 'use_atr': True, 'use_adx': True, 'use_ema': False, 'use_spike': True, 'rsi_required': True, 'edge_k': 1.027061888690345, 'edge_cap': 0.808098443863891, 'bull_strategy': 'mean_reversion', 'bull_bb_std_mult': 1.89885211469837, 'bull_rsi_os': 17, 'bull_rsi_ob': 57, 'bull_adx_thresh': 26.833003822273103, 'bull_atr_min_pct': 0.00297768898418844, 'bull_atr_max_pct': 0.05324861239736079, 'bull_tp_mult': 1.5114097369722075, 'bull_tsl_mult': 0.5867647454212501, 'bull_time_stop': 99, 'bull_use_sma': False, 'bull_use_ema': True, 'bull_use_atr': False, 'bull_use_adx': False, 'bull_use_spike': False, 'bull_rsi_required': True, 'bear_strategy': 'breakout', 'bear_bb_std_mult': 2.1483797167664767, 'bear_rsi_os': 30, 'bear_rsi_ob': 72, 'bear_adx_thresh': 25.677745506179484, 'bear_atr_min_pct': 0.02931924618240927, 'bear_atr_max_pct': 0.12267273080236873, 'bear_tp_mult': 2.312257457183058, 'bear_tsl_mult': 0.8007075730166693, 'bear_time_stop': 220, 'bear_use_sma': True, 'bear_use_ema': True, 'bear_use_atr': False, 'bear_use_adx': True, 'bear_use_spike': False, 'bear_rsi_required': True, 'sideways_strategy': 'breakout', 'sideways_bb_std_mult': 1.7748505093939586, 'sideways_rsi_os': 37, 'sideways_rsi_ob': 91, 'sideways_adx_thresh': 27.581458838964394, 'sideways_atr_min_pct': 0.0192126883098659, 'sideways_atr_max_pct': 0.08065349379486594, 'sideways_tp_mult': 2.2183192384657158, 'sideways_tsl_mult': 0.7999295476160073, 'sideways_time_stop': 257, 'sideways_use_sma': False, 'sideways_use_ema': False, 'sideways_use_atr': True, 'sideways_use_adx': True, 'sideways_use_spike': False, 'sideways_rsi_required': False}.
[I 2025-08-30 22:20:21,904] Trial 761 finished with values: [-1000000000.0, 1000000000.0] and parameters: {'p_sma': 20, 'p_std': 5, 'p_atr': 21, 'p_adx': 22, 'rsi_period': 72, 'ema1': 5, 'ema2': 23, 'slip_atr_k': 0.052939715977234, 'slip_spread_k': 0.7337298151656743, 'spread_hl_frac': 0.032979251627189864, 'bb_std_mult': 2.9400211377423853, 'rsi_os': 38, 'rsi_ob': 66, 'vol_spike': 0.2691564380012411, 'adx_thresh': 9.461884086111539, 'atr_min_pct': 0.010146464339979283, 'atr_max_pct': 0.017201916884448776, 'tp_mult': 1.6986043071577561, 'tsl_mult': 0.0375791912369996, 'strategy': 'mean_reversion', 'time_stop': 213, 'use_sma': False, 'use_atr': True, 'use_adx': True, 'use_ema': False, 'use_spike': True, 'rsi_required': True, 'edge_k': 1.002143374147385, 'edge_cap': 0.8084682950100557, 'bull_strategy': 'mean_reversion', 'bull_bb_std_mult': 2.4071699228292074, 'bull_rsi_os': 16, 'bull_rsi_ob': 87, 'bull_adx_thresh': 26.597085296453095, 'bull_atr_min_pct': 9.894881705584287e-06, 'bull_atr_max_pct': 0.10212522834968402, 'bull_tp_mult': 1.453617387203169, 'bull_tsl_mult': 0.36983342643467604, 'bull_time_stop': 295, 'bull_use_sma': False, 'bull_use_ema': True, 'bull_use_atr': False, 'bull_use_adx': True, 'bull_use_spike': False, 'bull_rsi_required': True, 'bear_strategy': 'mean_reversion', 'bear_bb_std_mult': 1.2959298338706655, 'bear_rsi_os': 8, 'bear_rsi_ob': 61, 'bear_adx_thresh': 5.205954681241963, 'bear_atr_min_pct': 0.007801870510479937, 'bear_atr_max_pct': 0.028276543830120217, 'bear_tp_mult': 1.4819312513924667, 'bear_tsl_mult': 0.4414209966451822, 'bear_time_stop': 222, 'bear_use_sma': True, 'bear_use_ema': True, 'bear_use_atr': False, 'bear_use_adx': True, 'bear_use_spike': False, 'bear_rsi_required': True, 'sideways_strategy': 'mean_reversion', 'sideways_bb_std_mult': 1.7986354447368331, 'sideways_rsi_os': 42, 'sideways_rsi_ob': 91, 'sideways_adx_thresh': 23.75366188892923, 'sideways_atr_min_pct': 0.020868313072701164, 'sideways_atr_max_pct': 0.04026684938817417, 'sideways_tp_mult': 2.594965904315043, 'sideways_tsl_mult': 0.8006620612799724, 'sideways_time_stop': 132, 'sideways_use_sma': False, 'sideways_use_ema': False, 'sideways_use_atr': True, 'sideways_use_adx': True, 'sideways_use_spike': False, 'sideways_rsi_required': False}.
[I 2025-08-30 22:20:22,416] Trial 763 finished with values: [-1000000000.0, 1000000000.0] and parameters: {'p_sma': 34, 'p_std': 17, 'p_atr': 22, 'p_adx': 22, 'rsi_period': 84, 'ema1': 16, 'ema2': 38, 'slip_atr_k': 0.02694441875290914, 'slip_spread_k': 0.6813138837890053, 'spread_hl_frac': 0.01444267936003208, 'bb_std_mult': 1.0859439441799452, 'rsi_os': 11, 'rsi_ob': 66, 'vol_spike': 0.14835927359948978, 'adx_thresh': 15.15169110484549, 'atr_min_pct': 0.010078135452607261, 'atr_max_pct': 0.06965901491663537, 'tp_mult': 1.5949881058406827, 'tsl_mult': 0.9409894259463143, 'strategy': 'mean_reversion', 'time_stop': 70, 'use_sma': False, 'use_atr': True, 'use_adx': True, 'use_ema': False, 'use_spike': True, 'rsi_required': False, 'edge_k': 0.990337049470366, 'edge_cap': 0.8002030496287414, 'bull_strategy': 'mean_reversion', 'bull_bb_std_mult': 2.5078156019936095, 'bull_rsi_os': 16, 'bull_rsi_ob': 89, 'bull_adx_thresh': 13.57343269826339, 'bull_atr_min_pct': 0.0032640692603842815, 'bull_atr_max_pct': 0.05777072215969594, 'bull_tp_mult': 1.4642655246597531, 'bull_tsl_mult': 0.42543999051632986, 'bull_time_stop': 274, 'bull_use_sma': False, 'bull_use_ema': True, 'bull_use_atr': False, 'bull_use_adx': True, 'bull_use_spike': True, 'bull_rsi_required': True, 'bear_strategy': 'mean_reversion', 'bear_bb_std_mult': 2.0299154056146533, 'bear_rsi_os': 30, 'bear_rsi_ob': 77, 'bear_adx_thresh': 26.43304640345263, 'bear_atr_min_pct': 0.021505647217944113, 'bear_atr_max_pct': 0.12064138976774776, 'bear_tp_mult': 2.27915505303719, 'bear_tsl_mult': 0.45485099181562505, 'bear_time_stop': 25, 'bear_use_sma': True, 'bear_use_ema': False, 'bear_use_atr': False, 'bear_use_adx': True, 'bear_use_spike': False, 'bear_rsi_required': True, 'sideways_strategy': 'mean_reversion', 'sideways_bb_std_mult': 1.80745079636101, 'sideways_rsi_os': 42, 'sideways_rsi_ob': 77, 'sideways_adx_thresh': 24.426602135159836, 'sideways_atr_min_pct': 0.019304835777918947, 'sideways_atr_max_pct': 0.03982378560691782, 'sideways_tp_mult': 2.5957640724435445, 'sideways_tsl_mult': 0.8030791281515275, 'sideways_time_stop': 165, 'sideways_use_sma': False, 'sideways_use_ema': True, 'sideways_use_atr': True, 'sideways_use_adx': True, 'sideways_use_spike': False, 'sideways_rsi_required': True}.
[I 2025-08-30 22:20:22,741] Trial 762 finished with values: [-1000000000.0, 1000000000.0] and parameters: {'p_sma': 5, 'p_std': 17, 'p_atr': 18, 'p_adx': 22, 'rsi_period': 59, 'ema1': 30, 'ema2': 54, 'slip_atr_k': 0.02746736419863926, 'slip_spread_k': 0.7382022386903087, 'spread_hl_frac': 0.03409017808462655, 'bb_std_mult': 1.2608910405645122, 'rsi_os': 12, 'rsi_ob': 66, 'vol_spike': 0.2996171108227734, 'adx_thresh': 21.52244663788257, 'atr_min_pct': 0.013620058670770001, 'atr_max_pct': 0.026737471185499462, 'tp_mult': 1.0117843248197973, 'tsl_mult': 0.6007344246769017, 'strategy': 'mean_reversion', 'time_stop': 71, 'use_sma': False, 'use_atr': True, 'use_adx': True, 'use_ema': True, 'use_spike': True, 'rsi_required': True, 'edge_k': 0.9987408034397207, 'edge_cap': 0.8067556504688655, 'bull_strategy': 'mean_reversion', 'bull_bb_std_mult': 2.503105950380903, 'bull_rsi_os': 16, 'bull_rsi_ob': 89, 'bull_adx_thresh': 13.299168564210929, 'bull_atr_min_pct': 0.014421760023155844, 'bull_atr_max_pct': 0.1434859109892388, 'bull_tp_mult': 1.4550086071162243, 'bull_tsl_mult': 0.419498310110214, 'bull_time_stop': 98, 'bull_use_sma': False, 'bull_use_ema': False, 'bull_use_atr': False, 'bull_use_adx': True, 'bull_use_spike': True, 'bull_rsi_required': True, 'bear_strategy': 'mean_reversion', 'bear_bb_std_mult': 2.1252934191870687, 'bear_rsi_os': 30, 'bear_rsi_ob': 72, 'bear_adx_thresh': 32.308589048221094, 'bear_atr_min_pct': 0.02151242512430809, 'bear_atr_max_pct': 0.12076016717933717, 'bear_tp_mult': 1.575199151186835, 'bear_tsl_mult': 0.45315757419965724, 'bear_time_stop': 25, 'bear_use_sma': False, 'bear_use_ema': True, 'bear_use_atr': False, 'bear_use_adx': True, 'bear_use_spike': True, 'bear_rsi_required': True, 'sideways_strategy': 'mean_reversion', 'sideways_bb_std_mult': 1.7697938182809194, 'sideways_rsi_os': 42, 'sideways_rsi_ob': 77, 'sideways_adx_thresh': 20.93022057569722, 'sideways_atr_min_pct': 0.011550085841194128, 'sideways_atr_max_pct': 0.04042859867308356, 'sideways_tp_mult': 1.6610410187076678, 'sideways_tsl_mult': 0.8027940034468758, 'sideways_time_stop': 283, 'sideways_use_sma': True, 'sideways_use_ema': True, 'sideways_use_atr': False, 'sideways_use_adx': True, 'sideways_use_spike': False, 'sideways_rsi_required': True}.
[I 2025-08-30 22:20:56,871] Trial 767 finished with values: [-0.020554585806714876, 0.020479808885138583] and parameters: {'p_sma': 33, 'p_std': 32, 'p_atr': 13, 'p_adx': 20, 'rsi_period': 69, 'ema1': 12, 'ema2': 53, 'slip_atr_k': 0.14602752736456864, 'slip_spread_k': 0.641380784622125, 'spread_hl_frac': 0.034250596231657326, 'bb_std_mult': 3.0644610908075576, 'rsi_os': 10, 'rsi_ob': 64, 'vol_spike': 0.2807477391616626, 'adx_thresh': 13.37347733407534, 'atr_min_pct': 0.01867011892076942, 'atr_max_pct': 0.051791603070427655, 'tp_mult': 2.165145116040762, 'tsl_mult': 0.5458473803443652, 'strategy': 'breakout', 'time_stop': 93, 'use_sma': True, 'use_atr': True, 'use_adx': True, 'use_ema': True, 'use_spike': True, 'rsi_required': False, 'edge_k': 0.979124351822727, 'edge_cap': 0.41381669598083093, 'bull_strategy': 'breakout', 'bull_bb_std_mult': 1.9575098540711824, 'bull_rsi_os': 19, 'bull_rsi_ob': 84, 'bull_adx_thresh': 14.395185379732451, 'bull_atr_min_pct': 0.0006204052578037786, 'bull_atr_max_pct': 0.04740438303559485, 'bull_tp_mult': 2.8393973310582052, 'bull_tsl_mult': 0.3794664651178357, 'bull_time_stop': 288, 'bull_use_sma': True, 'bull_use_ema': False, 'bull_use_atr': True, 'bull_use_adx': False, 'bull_use_spike': False, 'bull_rsi_required': True, 'bear_strategy': 'mean_reversion', 'bear_bb_std_mult': 1.8768868407822072, 'bear_rsi_os': 47, 'bear_rsi_ob': 92, 'bear_adx_thresh': 21.998270500858077, 'bear_atr_min_pct': 0.029017400560667466, 'bear_atr_max_pct': 0.08020218679410772, 'bear_tp_mult': 1.5336166442860966, 'bear_tsl_mult': 0.3787837527992273, 'bear_time_stop': 274, 'bear_use_sma': False, 'bear_use_ema': False, 'bear_use_atr': True, 'bear_use_adx': False, 'bear_use_spike': True, 'bear_rsi_required': True, 'sideways_strategy': 'breakout', 'sideways_bb_std_mult': 2.3308645708399576, 'sideways_rsi_os': 38, 'sideways_rsi_ob': 86, 'sideways_adx_thresh': 17.900298838321646, 'sideways_atr_min_pct': 0.021915453575199424, 'sideways_atr_max_pct': 0.10525360646010917, 'sideways_tp_mult': 1.8739194207314942, 'sideways_tsl_mult': 0.8801633722642991, 'sideways_time_stop': 260, 'sideways_use_sma': False, 'sideways_use_ema': False, 'sideways_use_atr': False, 'sideways_use_adx': False, 'sideways_use_spike': False, 'sideways_rsi_required': False}.
