[I 2025-08-30 20:48:41,042] Trial 10 finished with values: [-0.018976527724681946, 0.018874401609552654] and parameters: {'p_sma': 47, 'p_std': 41, 'p_atr': 28, 'p_adx': 20, 'rsi_period': 34, 'ema1': 13, 'ema2': 43, 'slip_atr_k': 0.1734706090541584, 'slip_spread_k': 0.45726960023913066, 'spread_hl_frac': 0.006977768045211302, 'bb_std_mult': 3.0946471288522135, 'rsi_os': 15, 'rsi_ob': 68, 'vol_spike': 0.03579693395415571, 'adx_thresh': 6.539393357664368, 'atr_min_pct': 0.014992105144565036, 'atr_max_pct': 0.05422832840171084, 'tp_mult': 1.4125413672937344, 'tsl_mult': 0.3108870315719342, 'strategy': 'mean_reversion', 'time_stop': 28, 'use_sma': True, 'use_atr': True, 'use_adx': True, 'use_ema': False, 'use_spike': True, 'rsi_required': True, 'edge_k': 0.81776165847034, 'edge_cap': 0.7939841912941973, 'bull_strategy': 'breakout', 'bull_bb_std_mult': 1.6623002225747041, 'bull_rsi_os': 29, 'bull_rsi_ob': 91, 'bull_adx_thresh': 8.999453693675072, 'bull_atr_min_pct': 0.00040580454889827867, 'bull_atr_max_pct': 0.04129729803419164, 'bull_tp_mult': 2.0711521394053407, 'bull_tsl_mult': 0.3242788951472476, 'bull_time_stop': 179, 'bull_use_sma': False, 'bull_use_ema': False, 'bull_use_atr': False, 'bull_use_adx': True, 'bull_use_spike': False, 'bull_rsi_required': True, 'bear_strategy': 'breakout', 'bear_bb_std_mult': 0.5366259625171435, 'bear_rsi_os': 35, 'bear_rsi_ob': 77, 'bear_adx_thresh': 24.281494623713897, 'bear_atr_min_pct': 0.009995594869614655, 'bear_atr_max_pct': 0.06441645323554321, 'bear_tp_mult': 2.009756079977476, 'bear_tsl_mult': 0.0958953705466351, 'bear_time_stop': 83, 'bear_use_sma': True, 'bear_use_ema': False, 'bear_use_atr': False, 'bear_use_adx': False, 'bear_use_spike': True, 'bear_rsi_required': True, 'sideways_strategy': 'mean_reversion', 'sideways_bb_std_mult': 3.4735972083533566, 'sideways_rsi_os': 15, 'sideways_rsi_ob': 55, 'sideways_adx_thresh': 25.914069051678556, 'sideways_atr_min_pct': 0.02453212307376925, 'sideways_atr_max_pct': 0.04499831420785886, 'sideways_tp_mult': 2.5299051736584603, 'sideways_tsl_mult': 0.3739654613636817, 'sideways_time_stop': 26, 'sideways_use_sma': False, 'sideways_use_ema': False, 'sideways_use_atr': False, 'sideways_use_adx': False, 'sideways_use_spike': False, 'sideways_rsi_required': False}.
[I 2025-08-30 20:48:41,600] Trial 13 finished with values: [-1000000000.0, 1000000000.0] and parameters: {'p_sma': 60, 'p_std': 59, 'p_atr': 14, 'p_adx': 17, 'rsi_period': 7, 'ema1': 6, 'ema2': 30, 'slip_atr_k': 0.15075290250425316, 'slip_spread_k': 0.9742349138661798, 'spread_hl_frac': 0.04296103831700752, 'bb_std_mult': 3.5956817482780528, 'rsi_os': 5, 'rsi_ob': 63, 'vol_spike': 0.0074143285547711435, 'adx_thresh': 33.50555407832773, 'atr_min_pct': 0.016105871653094718, 'atr_max_pct': 0.010456758352158854, 'tp_mult': 1.836408526875902, 'tsl_mult': 0.05680836626823432, 'strategy': 'mean_reversion', 'time_stop': 25, 'use_sma': False, 'use_atr': True, 'use_adx': True, 'use_ema': False, 'use_spike': True, 'rsi_required': False, 'edge_k': 0.8708479245274193, 'edge_cap': 0.9377914170217444, 'bull_strategy': 'breakout', 'bull_bb_std_mult': 1.6617403245461182, 'bull_rsi_os': 42, 'bull_rsi_ob': 94, 'bull_adx_thresh': 5.470053549073519, 'bull_atr_min_pct': 0.0008184081710288106, 'bull_atr_max_pct': 0.012417349332180375, 'bull_tp_mult': 2.389411301679966, 'bull_tsl_mult': 0.019313327883634546, 'bull_time_stop': 205, 'bull_use_sma': False, 'bull_use_ema': True, 'bull_use_atr': False, 'bull_use_adx': True, 'bull_use_spike': False, 'bull_rsi_required': True, 'bear_strategy': 'mean_reversion', 'bear_bb_std_mult': 3.1586071474805424, 'bear_rsi_os': 24, 'bear_rsi_ob': 60, 'bear_adx_thresh': 21.08526779389046, 'bear_atr_min_pct': 0.02025445807460255, 'bear_atr_max_pct': 0.14868603221941706, 'bear_tp_mult': 2.9477170232207963, 'bear_tsl_mult': 0.87238008865991, 'bear_time_stop': 181, 'bear_use_sma': True, 'bear_use_ema': True, 'bear_use_atr': False, 'bear_use_adx': False, 'bear_use_spike': True, 'bear_rsi_required': True, 'sideways_strategy': 'mean_reversion', 'sideways_bb_std_mult': 2.322173189931653, 'sideways_rsi_os': 55, 'sideways_rsi_ob': 47, 'sideways_adx_thresh': 34.88153070649949, 'sideways_atr_min_pct': 0.02954829943059939, 'sideways_atr_max_pct': 0.07702844346900944, 'sideways_tp_mult': 2.021829776248109, 'sideways_tsl_mult': 0.9076999096643923, 'sideways_time_stop': 17, 'sideways_use_sma': False, 'sideways_use_ema': False, 'sideways_use_atr': True, 'sideways_use_adx': False, 'sideways_use_spike': False, 'sideways_rsi_required': True}.
[I 2025-08-30 20:48:41,600] Trial 9 finished with values: [-1000000000.0, 1000000000.0] and parameters: {'p_sma': 40, 'p_std': 22, 'p_atr': 14, 'p_adx': 13, 'rsi_period': 40, 'ema1': 13, 'ema2': 34, 'slip_atr_k': 0.23667967490776098, 'slip_spread_k': 0.10552918518696042, 'spread_hl_frac': 0.013988820198310537, 'bb_std_mult': 1.0986984168360245, 'rsi_os': 25, 'rsi_ob': 73, 'vol_spike': 0.2753269770828596, 'adx_thresh': 31.60754362913967, 'atr_min_pct': 0.001573446125455521, 'atr_max_pct': 0.1469142759701963, 'tp_mult': 1.913145761147418, 'tsl_mult': 0.5661391300248434, 'strategy': 'mean_reversion', 'time_stop': 295, 'use_sma': False, 'use_atr': False, 'use_adx': False, 'use_ema': False, 'use_spike': True, 'rsi_required': True, 'edge_k': 1.401132109975663, 'edge_cap': 0.25229490868022825, 'bull_strategy': 'breakout', 'bull_bb_std_mult': 2.909699760247242, 'bull_rsi_os': 9, 'bull_rsi_ob': 83, 'bull_adx_thresh': 20.506701105138486, 'bull_atr_min_pct': 0.028376481898182305, 'bull_atr_max_pct': 0.0317451683365226, 'bull_tp_mult': 1.9941140135652045, 'bull_tsl_mult': 0.2391614390242035, 'bull_time_stop': 49, 'bull_use_sma': True, 'bull_use_ema': True, 'bull_use_atr': False, 'bull_use_adx': False, 'bull_use_spike': True, 'bull_rsi_required': True, 'bear_strategy': 'breakout', 'bear_bb_std_mult': 0.7838052237776229, 'bear_rsi_os': 9, 'bear_rsi_ob': 66, 'bear_adx_thresh': 15.454161390428679, 'bear_atr_min_pct': 0.006950989315664557, 'bear_atr_max_pct': 0.07426685991212278, 'bear_tp_mult': 1.7032878862985177, 'bear_tsl_mult': 0.8428592221962254, 'bear_time_stop': 200, 'bear_use_sma': False, 'bear_use_ema': False, 'bear_use_atr': True, 'bear_use_adx': False, 'bear_use_spike': False, 'bear_rsi_required': True, 'sideways_strategy': 'breakout', 'sideways_bb_std_mult': 2.940071937776872, 'sideways_rsi_os': 42, 'sideways_rsi_ob': 45, 'sideways_adx_thresh': 32.949415294539065, 'sideways_atr_min_pct': 0.020621445495250298, 'sideways_atr_max_pct': 0.04125543577290335, 'sideways_tp_mult': 2.0012328892054545, 'sideways_tsl_mult': 0.6319295553685698, 'sideways_time_stop': 31, 'sideways_use_sma': False, 'sideways_use_ema': True, 'sideways_use_atr': False, 'sideways_use_adx': True, 'sideways_use_spike': True, 'sideways_rsi_required': True}.
[I 2025-08-30 20:48:42,284] Trial 14 finished with values: [-1000000000.0, 1000000000.0] and parameters: {'p_sma': 55, 'p_std': 48, 'p_atr': 30, 'p_adx': 22, 'rsi_period': 17, 'ema1': 7, 'ema2': 42, 'slip_atr_k': 0.14760055125050855, 'slip_spread_k': 0.7273274344877462, 'spread_hl_frac': 0.03503528445847054, 'bb_std_mult': 2.930088680318149, 'rsi_os': 9, 'rsi_ob': 47, 'vol_spike': 0.0009704763692062815, 'adx_thresh': 23.246167169375965, 'atr_min_pct': 0.013834663539112176, 'atr_max_pct': 0.0314069605392577, 'tp_mult': 1.2301379983714584, 'tsl_mult': 0.10917235357586441, 'strategy': 'mean_reversion', 'time_stop': 13, 'use_sma': True, 'use_atr': True, 'use_adx': True, 'use_ema': False, 'use_spike': True, 'rsi_required': True, 'edge_k': 0.7245431758849692, 'edge_cap': 0.8384591462517089, 'bull_strategy': 'breakout', 'bull_bb_std_mult': 0.5264741291501414, 'bull_rsi_os': 38, 'bull_rsi_ob': 86, 'bull_adx_thresh': 6.663975294067664, 'bull_atr_min_pct': 0.006245955050132778, 'bull_atr_max_pct': 0.07109579828873004, 'bull_tp_mult': 2.9997232945467904, 'bull_tsl_mult': 0.9999214812069328, 'bull_time_stop': 150, 'bull_use_sma': False, 'bull_use_ema': True, 'bull_use_atr': False, 'bull_use_adx': True, 'bull_use_spike': False, 'bull_rsi_required': True, 'bear_strategy': 'breakout', 'bear_bb_std_mult': 1.149659832864757, 'bear_rsi_os': 19, 'bear_rsi_ob': 56, 'bear_adx_thresh': 21.753257234764625, 'bear_atr_min_pct': 0.0015461324724056306, 'bear_atr_max_pct': 0.04504994700362462, 'bear_tp_mult': 2.1178657628167086, 'bear_tsl_mult': 0.013213699715858451, 'bear_time_stop': 8, 'bear_use_sma': True, 'bear_use_ema': False, 'bear_use_atr': False, 'bear_use_adx': False, 'bear_use_spike': True, 'bear_rsi_required': True, 'sideways_strategy': 'mean_reversion', 'sideways_bb_std_mult': 2.285732430669203, 'sideways_rsi_os': 14, 'sideways_rsi_ob': 60, 'sideways_adx_thresh': 23.245171531332737, 'sideways_atr_min_pct': 0.0015991249701885202, 'sideways_atr_max_pct': 0.07177714832370974, 'sideways_tp_mult': 2.3054384318656433, 'sideways_tsl_mult': 0.6518906454465159, 'sideways_time_stop': 76, 'sideways_use_sma': False, 'sideways_use_ema': False, 'sideways_use_atr': False, 'sideways_use_adx': False, 'sideways_use_spike': False, 'sideways_rsi_required': False}.
[I 2025-08-30 20:48:42,304] Trial 15 finished with values: [-1000000000.0, 1000000000.0] and parameters: {'p_sma': 57, 'p_std': 42, 'p_atr': 30, 'p_adx': 21, 'rsi_period': 20, 'ema1': 30, 'ema2': 45, 'slip_atr_k': 0.15663286488167721, 'slip_spread_k': 0.7002602400218817, 'spread_hl_frac': 0.034302991890756966, 'bb_std_mult': 3.0302428745264103, 'rsi_os': 11, 'rsi_ob': 45, 'vol_spike': 0.0027744878566302172, 'adx_thresh': 23.105995131415938, 'atr_min_pct': 0.014100234293836012, 'atr_max_pct': 0.028665493958469564, 'tp_mult': 1.0870103039050478, 'tsl_mult': 0.1144432033922787, 'strategy': 'mean_reversion', 'time_stop': 7, 'use_sma': True, 'use_atr': True, 'use_adx': True, 'use_ema': False, 'use_spike': True, 'rsi_required': True, 'edge_k': 0.647234647459716, 'edge_cap': 0.8182878026832076, 'bull_strategy': 'breakout', 'bull_bb_std_mult': 0.742628063837605, 'bull_rsi_os': 37, 'bull_rsi_ob': 86, 'bull_adx_thresh': 5.83902699188279, 'bull_atr_min_pct': 0.0072476198925770525, 'bull_atr_max_pct': 0.07070691065878287, 'bull_tp_mult': 2.9882852297377007, 'bull_tsl_mult': 0.9814239384491293, 'bull_time_stop': 146, 'bull_use_sma': False, 'bull_use_ema': True, 'bull_use_atr': False, 'bull_use_adx': True, 'bull_use_spike': False, 'bull_rsi_required': True, 'bear_strategy': 'breakout', 'bear_bb_std_mult': 1.4993881627730485, 'bear_rsi_os': 20, 'bear_rsi_ob': 58, 'bear_adx_thresh': 22.639863642851306, 'bear_atr_min_pct': 0.0011316917338335016, 'bear_atr_max_pct': 0.045714076344124416, 'bear_tp_mult': 2.086573372998791, 'bear_tsl_mult': 0.01791063557828254, 'bear_time_stop': 15, 'bear_use_sma': True, 'bear_use_ema': False, 'bear_use_atr': False, 'bear_use_adx': False, 'bear_use_spike': True, 'bear_rsi_required': True, 'sideways_strategy': 'mean_reversion', 'sideways_bb_std_mult': 2.3778675428193385, 'sideways_rsi_os': 13, 'sideways_rsi_ob': 59, 'sideways_adx_thresh': 6.840617684764274, 'sideways_atr_min_pct': 0.0010028214215441495, 'sideways_atr_max_pct': 0.07285858452416673, 'sideways_tp_mult': 2.323644258557769, 'sideways_tsl_mult': 0.6237737069487634, 'sideways_time_stop': 82, 'sideways_use_sma': False, 'sideways_use_ema': False, 'sideways_use_atr': False, 'sideways_use_adx': False, 'sideways_use_spike': False, 'sideways_rsi_required': False}.
[I 2025-08-30 20:48:43,254] Trial 11 finished with values: [-1000000000.0, 1000000000.0] and parameters: {'p_sma': 6, 'p_std': 28, 'p_atr': 17, 'p_adx': 17, 'rsi_period': 59, 'ema1': 9, 'ema2': 60, 'slip_atr_k': 0.2034756130166551, 'slip_spread_k': 0.08896799824240853, 'spread_hl_frac': 0.04239050475122625, 'bb_std_mult': 1.4989376539631494, 'rsi_os': 10, 'rsi_ob': 93, 'vol_spike': 0.21508536340300544, 'adx_thresh': 7.932364264186274, 'atr_min_pct': 0.018103471464118195, 'atr_max_pct': 0.018338972698246827, 'tp_mult': 1.2797874835108223, 'tsl_mult': 0.28303801961228625, 'strategy': 'breakout', 'time_stop': 246, 'use_sma': False, 'use_atr': True, 'use_adx': True, 'use_ema': True, 'use_spike': False, 'rsi_required': False, 'edge_k': 1.393838106213434, 'edge_cap': 0.983571322231693, 'bull_strategy': 'breakout', 'bull_bb_std_mult': 0.5265988581286943, 'bull_rsi_os': 13, 'bull_rsi_ob': 94, 'bull_adx_thresh': 33.22656162828934, 'bull_atr_min_pct': 0.0052945819394897425, 'bull_atr_max_pct': 0.07726794097263695, 'bull_tp_mult': 1.8569086654159506, 'bull_tsl_mult': 0.8368684717179738, 'bull_time_stop': 229, 'bull_use_sma': True, 'bull_use_ema': False, 'bull_use_atr': True, 'bull_use_adx': False, 'bull_use_spike': False, 'bull_rsi_required': True, 'bear_strategy': 'breakout', 'bear_bb_std_mult': 1.0140983206986616, 'bear_rsi_os': 9, 'bear_rsi_ob': 67, 'bear_adx_thresh': 14.74502987599946, 'bear_atr_min_pct': 0.02795174421608102, 'bear_atr_max_pct': 0.03295800162284802, 'bear_tp_mult': 1.3617115628821443, 'bear_tsl_mult': 0.1549436797952437, 'bear_time_stop': 96, 'bear_use_sma': False, 'bear_use_ema': True, 'bear_use_atr': False, 'bear_use_adx': False, 'bear_use_spike': True, 'bear_rsi_required': True, 'sideways_strategy': 'breakout', 'sideways_bb_std_mult': 0.8646761292069872, 'sideways_rsi_os': 50, 'sideways_rsi_ob': 86, 'sideways_adx_thresh': 13.858052336159496, 'sideways_atr_min_pct': 0.026764162124672725, 'sideways_atr_max_pct': 0.12053181502716807, 'sideways_tp_mult': 2.6690949156337065, 'sideways_tsl_mult': 0.4850335160390805, 'sideways_time_stop': 238, 'sideways_use_sma': False, 'sideways_use_ema': False, 'sideways_use_atr': False, 'sideways_use_adx': True, 'sideways_use_spike': True, 'sideways_rsi_required': True}.
[I 2025-08-30 20:49:09,809] Trial 12 finished with values: [-1000000000.0, 1000000000.0] and parameters: {'p_sma': 52, 'p_std': 18, 'p_atr': 18, 'p_adx': 20, 'rsi_period': 45, 'ema1': 27, 'ema2': 38, 'slip_atr_k': 0.03482898346896279, 'slip_spread_k': 0.14882637347824368, 'spread_hl_frac': 0.007152838835685876, 'bb_std_mult': 2.93818035967946, 'rsi_os': 33, 'rsi_ob': 66, 'vol_spike': 0.024272369072632992, 'adx_thresh': 15.950010349766856, 'atr_min_pct': 0.029383628036479377, 'atr_max_pct': 0.04189592046117375, 'tp_mult': 2.0779154959575203, 'tsl_mult': 0.5466716613895554, 'strategy': 'breakout', 'time_stop': 17, 'use_sma': False, 'use_atr': True, 'use_adx': True, 'use_ema': False, 'use_spike': True, 'rsi_required': True, 'edge_k': 1.0655088243352975, 'edge_cap': 0.20874579799085916, 'bull_strategy': 'mean_reversion', 'bull_bb_std_mult': 2.520349313667919, 'bull_rsi_os': 8, 'bull_rsi_ob': 91, 'bull_adx_thresh': 21.76172190613672, 'bull_atr_min_pct': 0.018735537891723063, 'bull_atr_max_pct': 0.01991280950041903, 'bull_tp_mult': 2.23476054720724, 'bull_tsl_mult': 0.7107976996908366, 'bull_time_stop': 113, 'bull_use_sma': True, 'bull_use_ema': False, 'bull_use_atr': False, 'bull_use_adx': True, 'bull_use_spike': False, 'bull_rsi_required': True, 'bear_strategy': 'breakout', 'bear_bb_std_mult': 2.615517864202209, 'bear_rsi_os': 37, 'bear_rsi_ob': 78, 'bear_adx_thresh': 12.053378477120539, 'bear_atr_min_pct': 0.015899780677872316, 'bear_atr_max_pct': 0.14629511546277646, 'bear_tp_mult': 2.5520204288453967, 'bear_tsl_mult': 0.8938713408656837, 'bear_time_stop': 237, 'bear_use_sma': True, 'bear_use_ema': False, 'bear_use_atr': False, 'bear_use_adx': False, 'bear_use_spike': True, 'bear_rsi_required': False, 'sideways_strategy': 'mean_reversion', 'sideways_bb_std_mult': 2.9142797888035563, 'sideways_rsi_os': 49, 'sideways_rsi_ob': 68, 'sideways_adx_thresh': 32.138953481203764, 'sideways_atr_min_pct': 0.008897358299442834, 'sideways_atr_max_pct': 0.10310687762873925, 'sideways_tp_mult': 1.9699265384226317, 'sideways_tsl_mult': 0.03911535729725735, 'sideways_time_stop': 217, 'sideways_use_sma': True, 'sideways_use_ema': False, 'sideways_use_atr': True, 'sideways_use_adx': True, 'sideways_use_spike': True, 'sideways_rsi_required': False}.
[I 2025-08-30 20:49:13,591] Trial 16 finished with values: [-1000000000.0, 1000000000.0] and parameters: {'p_sma': 7, 'p_std': 41, 'p_atr': 26, 'p_adx': 19, 'rsi_period': 82, 'ema1': 30, 'ema2': 26, 'slip_atr_k': 0.17130582084273357, 'slip_spread_k': 0.7947638632158001, 'spread_hl_frac': 0.00030357539421439067, 'bb_std_mult': 1.69077858548511, 'rsi_os': 14, 'rsi_ob': 62, 'vol_spike': 0.05663831059384484, 'adx_thresh': 9.542590363201708, 'atr_min_pct': 0.014833486155912203, 'atr_max_pct': 0.0538326523122521, 'tp_mult': 2.947184349911242, 'tsl_mult': 0.21721973796668756, 'strategy': 'mean_reversion', 'time_stop': 91, 'use_sma': True, 'use_atr': True, 'use_adx': True, 'use_ema': False, 'use_spike': True, 'rsi_required': True, 'edge_k': 0.4415564968577488, 'edge_cap': 0.7708859442903699, 'bull_strategy': 'breakout', 'bull_bb_std_mult': 2.0863898072288976, 'bull_rsi_os': 55, 'bull_rsi_ob': 67, 'bull_adx_thresh': 13.363022226663546, 'bull_atr_min_pct': 0.021410887372266728, 'bull_atr_max_pct': 0.01476463992238343, 'bull_tp_mult': 1.6858274112931229, 'bull_tsl_mult': 0.13713211788104337, 'bull_time_stop': 5, 'bull_use_sma': False, 'bull_use_ema': False, 'bull_use_atr': False, 'bull_use_adx': True, 'bull_use_spike': False, 'bull_rsi_required': True, 'bear_strategy': 'breakout', 'bear_bb_std_mult': 1.2727081397009476, 'bear_rsi_os': 45, 'bear_rsi_ob': 91, 'bear_adx_thresh': 24.397358049520616, 'bear_atr_min_pct': 0.01401113725403246, 'bear_atr_max_pct': 0.04034175262056182, 'bear_tp_mult': 1.193732813177371, 'bear_tsl_mult': 0.1505711584346603, 'bear_time_stop': 110, 'bear_use_sma': True, 'bear_use_ema': False, 'bear_use_atr': False, 'bear_use_adx': False, 'bear_use_spike': True, 'bear_rsi_required': True, 'sideways_strategy': 'mean_reversion', 'sideways_bb_std_mult': 3.5784382745437506, 'sideways_rsi_os': 32, 'sideways_rsi_ob': 61, 'sideways_adx_thresh': 30.00565263068463, 'sideways_atr_min_pct': 0.018419384566458794, 'sideways_atr_max_pct': 0.011967976602042948, 'sideways_tp_mult': 1.6211291791037303, 'sideways_tsl_mult': 0.5931028943493338, 'sideways_time_stop': 66, 'sideways_use_sma': False, 'sideways_use_ema': False, 'sideways_use_atr': False, 'sideways_use_adx': False, 'sideways_use_spike': False, 'sideways_rsi_required': False}.
[I 2025-08-30 20:49:14,201] Trial 17 finished with values: [-1000000000.0, 1000000000.0] and parameters: {'p_sma': 36, 'p_std': 58, 'p_atr': 15, 'p_adx': 15, 'rsi_period': 64, 'ema1': 10, 'ema2': 24, 'slip_atr_k': 0.028257622345776293, 'slip_spread_k': 0.8979205582246131, 'spread_hl_frac': 0.0016898961853550956, 'bb_std_mult': 1.5663034554072595, 'rsi_os': 16, 'rsi_ob': 64, 'vol_spike': 0.0862416666016752, 'adx_thresh': 10.871584462072533, 'atr_min_pct': 0.021245036778617166, 'atr_max_pct': 0.05204849970333009, 'tp_mult': 2.968503109329918, 'tsl_mult': 0.7056937524429356, 'strategy': 'mean_reversion', 'time_stop': 95, 'use_sma': True, 'use_atr': True, 'use_adx': True, 'use_ema': False, 'use_spike': True, 'rsi_required': True, 'edge_k': 0.344200590198585, 'edge_cap': 0.7483850260407434, 'bull_strategy': 'breakout', 'bull_bb_std_mult': 2.2512131355491474, 'bull_rsi_os': 52, 'bull_rsi_ob': 46, 'bull_adx_thresh': 12.675966447140832, 'bull_atr_min_pct': 0.021721348482654924, 'bull_atr_max_pct': 0.012570734048607847, 'bull_tp_mult': 1.5387588431388046, 'bull_tsl_mult': 0.10631966618749344, 'bull_time_stop': 7, 'bull_use_sma': False, 'bull_use_ema': False, 'bull_use_atr': False, 'bull_use_adx': True, 'bull_use_spike': False, 'bull_rsi_required': True, 'bear_strategy': 'breakout', 'bear_bb_std_mult': 1.0995287248003436, 'bear_rsi_os': 44, 'bear_rsi_ob': 95, 'bear_adx_thresh': 25.870648834977004, 'bear_atr_min_pct': 0.013959428106633153, 'bear_atr_max_pct': 0.05346891829709919, 'bear_tp_mult': 1.2587059115355275, 'bear_tsl_mult': 0.16157511861150048, 'bear_time_stop': 125, 'bear_use_sma': True, 'bear_use_ema': False, 'bear_use_atr': False, 'bear_use_adx': False, 'bear_use_spike': True, 'bear_rsi_required': True, 'sideways_strategy': 'mean_reversion', 'sideways_bb_std_mult': 3.5913183229820302, 'sideways_rsi_os': 33, 'sideways_rsi_ob': 80, 'sideways_adx_thresh': 29.90707384511174, 'sideways_atr_min_pct': 0.019502107700767338, 'sideways_atr_max_pct': 0.010126686781209968, 'sideways_tp_mult': 1.7898786133317137, 'sideways_tsl_mult': 0.27932747990604223, 'sideways_time_stop': 136, 'sideways_use_sma': False, 'sideways_use_ema': False, 'sideways_use_atr': False, 'sideways_use_adx': False, 'sideways_use_spike': False, 'sideways_rsi_required': False}.
