[I 2025-08-30 21:58:12,919] Trial 567 finished with values: [-1000000000.0, 1000000000.0] and parameters: {'p_sma': 53, 'p_std': 35, 'p_atr': 29, 'p_adx': 21, 'rsi_period': 70, 'ema1': 25, 'ema2': 57, 'slip_atr_k': 0.07946123012904785, 'slip_spread_k': 0.7036773260932104, 'spread_hl_frac': 0.013034127888279363, 'bb_std_mult': 3.4601882276992164, 'rsi_os': 27, 'rsi_ob': 65, 'vol_spike': 0.19909468494319732, 'adx_thresh': 10.40238933215257, 'atr_min_pct': 0.012967979301664125, 'atr_max_pct': 0.06760817992616948, 'tp_mult': 2.696812417755868, 'tsl_mult': 0.8631335099762308, 'strategy': 'mean_reversion', 'time_stop': 85, 'use_sma': True, 'use_atr': False, 'use_adx': False, 'use_ema': False, 'use_spike': False, 'rsi_required': True, 'edge_k': 1.2556631582124618, 'edge_cap': 0.07535666524432222, 'bull_strategy': 'breakout', 'bull_bb_std_mult': 2.016973849650908, 'bull_rsi_os': 15, 'bull_rsi_ob': 46, 'bull_adx_thresh': 15.715090739638372, 'bull_atr_min_pct': 0.008929095364445454, 'bull_atr_max_pct': 0.036549028317408555, 'bull_tp_mult': 1.3785921118769584, 'bull_tsl_mult': 0.3897324190047483, 'bull_time_stop': 300, 'bull_use_sma': False, 'bull_use_ema': True, 'bull_use_atr': False, 'bull_use_adx': False, 'bull_use_spike': False, 'bull_rsi_required': True, 'bear_strategy': 'breakout', 'bear_bb_std_mult': 3.1049004290420488, 'bear_rsi_os': 28, 'bear_rsi_ob': 73, 'bear_adx_thresh': 21.071413232985083, 'bear_atr_min_pct': 0.02952507889560322, 'bear_atr_max_pct': 0.11920659263508823, 'bear_tp_mult': 2.518194056595086, 'bear_tsl_mult': 0.8941960032837885, 'bear_time_stop': 239, 'bear_use_sma': False, 'bear_use_ema': True, 'bear_use_atr': False, 'bear_use_adx': False, 'bear_use_spike': False, 'bear_rsi_required': True, 'sideways_strategy': 'mean_reversion', 'sideways_bb_std_mult': 0.7849025220604571, 'sideways_rsi_os': 28, 'sideways_rsi_ob': 61, 'sideways_adx_thresh': 16.20959408553773, 'sideways_atr_min_pct': 0.019918843990156795, 'sideways_atr_max_pct': 0.04085126370007139, 'sideways_tp_mult': 1.8197378654977274, 'sideways_tsl_mult': 0.8199632679450071, 'sideways_time_stop': 286, 'sideways_use_sma': True, 'sideways_use_ema': False, 'sideways_use_atr': False, 'sideways_use_adx': True, 'sideways_use_spike': True, 'sideways_rsi_required': False}.
[I 2025-08-30 21:58:14,191] Trial 568 finished with values: [-1000000000.0, 1000000000.0] and parameters: {'p_sma': 56, 'p_std': 43, 'p_atr': 20, 'p_adx': 18, 'rsi_period': 70, 'ema1': 11, 'ema2': 54, 'slip_atr_k': 0.054270677581297846, 'slip_spread_k': 0.6979250508378237, 'spread_hl_frac': 0.015779400539897168, 'bb_std_mult': 1.9464080024232981, 'rsi_os': 11, 'rsi_ob': 66, 'vol_spike': 0.28195055860588003, 'adx_thresh': 10.473430383022126, 'atr_min_pct': 0.003223860123471511, 'atr_max_pct': 0.025836052260273287, 'tp_mult': 2.6961421240378947, 'tsl_mult': 0.2274977618458302, 'strategy': 'mean_reversion', 'time_stop': 86, 'use_sma': True, 'use_atr': False, 'use_adx': False, 'use_ema': False, 'use_spike': False, 'rsi_required': True, 'edge_k': 1.2311925213315664, 'edge_cap': 0.1052638762005712, 'bull_strategy': 'breakout', 'bull_bb_std_mult': 1.3079018087509686, 'bull_rsi_os': 10, 'bull_rsi_ob': 86, 'bull_adx_thresh': 13.443385398100983, 'bull_atr_min_pct': 0.015490572281669212, 'bull_atr_max_pct': 0.021366036497181835, 'bull_tp_mult': 1.3760210356521358, 'bull_tsl_mult': 0.3799886963718991, 'bull_time_stop': 267, 'bull_use_sma': False, 'bull_use_ema': True, 'bull_use_atr': False, 'bull_use_adx': False, 'bull_use_spike': False, 'bull_rsi_required': True, 'bear_strategy': 'breakout', 'bear_bb_std_mult': 2.061492787711725, 'bear_rsi_os': 6, 'bear_rsi_ob': 75, 'bear_adx_thresh': 27.51074575402902, 'bear_atr_min_pct': 0.008399040079548304, 'bear_atr_max_pct': 0.11898730702801107, 'bear_tp_mult': 1.559442896537747, 'bear_tsl_mult': 0.8925438572889549, 'bear_time_stop': 179, 'bear_use_sma': False, 'bear_use_ema': True, 'bear_use_atr': False, 'bear_use_adx': False, 'bear_use_spike': False, 'bear_rsi_required': True, 'sideways_strategy': 'mean_reversion', 'sideways_bb_std_mult': 2.2967975298915575, 'sideways_rsi_os': 40, 'sideways_rsi_ob': 52, 'sideways_adx_thresh': 25.97849067641141, 'sideways_atr_min_pct': 0.029958564549139893, 'sideways_atr_max_pct': 0.10914481198221705, 'sideways_tp_mult': 1.8090885975237685, 'sideways_tsl_mult': 0.13938464119125854, 'sideways_time_stop': 212, 'sideways_use_sma': True, 'sideways_use_ema': False, 'sideways_use_atr': False, 'sideways_use_adx': True, 'sideways_use_spike': True, 'sideways_rsi_required': False}.
[I 2025-08-30 21:58:17,175] Trial 569 finished with values: [-1000000000.0, 1000000000.0] and parameters: {'p_sma': 19, 'p_std': 35, 'p_atr': 28, 'p_adx': 21, 'rsi_period': 70, 'ema1': 25, 'ema2': 54, 'slip_atr_k': 0.2286268407053215, 'slip_spread_k': 0.692543446610694, 'spread_hl_frac': 0.03230415331015594, 'bb_std_mult': 2.8561640976557197, 'rsi_os': 27, 'rsi_ob': 67, 'vol_spike': 0.0994512402964855, 'adx_thresh': 27.7213844086909, 'atr_min_pct': 0.01368454650909469, 'atr_max_pct': 0.06763699402855636, 'tp_mult': 1.6724842860969737, 'tsl_mult': 0.22419964290706157, 'strategy': 'mean_reversion', 'time_stop': 86, 'use_sma': True, 'use_atr': False, 'use_adx': False, 'use_ema': True, 'use_spike': False, 'rsi_required': True, 'edge_k': 1.3093540766830127, 'edge_cap': 0.0827796901230975, 'bull_strategy': 'mean_reversion', 'bull_bb_std_mult': 1.8604071401439803, 'bull_rsi_os': 46, 'bull_rsi_ob': 86, 'bull_adx_thresh': 13.537348749029098, 'bull_atr_min_pct': 0.008887082624958402, 'bull_atr_max_pct': 0.13568668169442316, 'bull_tp_mult': 1.3633820056807904, 'bull_tsl_mult': 0.603247941648558, 'bull_time_stop': 300, 'bull_use_sma': False, 'bull_use_ema': True, 'bull_use_atr': False, 'bull_use_adx': False, 'bull_use_spike': False, 'bull_rsi_required': True, 'bear_strategy': 'mean_reversion', 'bear_bb_std_mult': 2.0718299862189085, 'bear_rsi_os': 22, 'bear_rsi_ob': 87, 'bear_adx_thresh': 27.480247956742218, 'bear_atr_min_pct': 0.029493773792064824, 'bear_atr_max_pct': 0.11836762244961424, 'bear_tp_mult': 1.8534077185686937, 'bear_tsl_mult': 0.3632191622626158, 'bear_time_stop': 241, 'bear_use_sma': False, 'bear_use_ema': True, 'bear_use_atr': False, 'bear_use_adx': False, 'bear_use_spike': False, 'bear_rsi_required': True, 'sideways_strategy': 'mean_reversion', 'sideways_bb_std_mult': 1.422884792263086, 'sideways_rsi_os': 19, 'sideways_rsi_ob': 80, 'sideways_adx_thresh': 26.40570546547967, 'sideways_atr_min_pct': 0.020661003365807448, 'sideways_atr_max_pct': 0.041784926287941886, 'sideways_tp_mult': 1.8070137530329689, 'sideways_tsl_mult': 0.7900522496884587, 'sideways_time_stop': 27, 'sideways_use_sma': True, 'sideways_use_ema': False, 'sideways_use_atr': False, 'sideways_use_adx': True, 'sideways_use_spike': True, 'sideways_rsi_required': False}.
[I 2025-08-30 21:58:17,340] Trial 570 finished with values: [-1000000000.0, 1000000000.0] and parameters: {'p_sma': 18, 'p_std': 23, 'p_atr': 20, 'p_adx': 27, 'rsi_period': 26, 'ema1': 11, 'ema2': 54, 'slip_atr_k': 0.0545937003516324, 'slip_spread_k': 0.6070183239667589, 'spread_hl_frac': 0.02316926509610708, 'bb_std_mult': 0.7719729817754166, 'rsi_os': 13, 'rsi_ob': 66, 'vol_spike': 0.1367045202373243, 'adx_thresh': 8.69737538668348, 'atr_min_pct': 0.015559531179739015, 'atr_max_pct': 0.02614407709422444, 'tp_mult': 1.6677896398037022, 'tsl_mult': 0.9456269333379899, 'strategy': 'mean_reversion', 'time_stop': 235, 'use_sma': True, 'use_atr': False, 'use_adx': False, 'use_ema': True, 'use_spike': False, 'rsi_required': True, 'edge_k': 1.310333104022067, 'edge_cap': 0.8887609662084676, 'bull_strategy': 'mean_reversion', 'bull_bb_std_mult': 1.7697462219953672, 'bull_rsi_os': 21, 'bull_rsi_ob': 88, 'bull_adx_thresh': 14.587720948381554, 'bull_atr_min_pct': 0.005053329569230464, 'bull_atr_max_pct': 0.10461449988371967, 'bull_tp_mult': 2.931833425003112, 'bull_tsl_mult': 0.3544892434930466, 'bull_time_stop': 300, 'bull_use_sma': True, 'bull_use_ema': False, 'bull_use_atr': False, 'bull_use_adx': False, 'bull_use_spike': False, 'bull_rsi_required': True, 'bear_strategy': 'mean_reversion', 'bear_bb_std_mult': 2.0654381454231077, 'bear_rsi_os': 7, 'bear_rsi_ob': 75, 'bear_adx_thresh': 27.473488614020564, 'bear_atr_min_pct': 0.029443398914921946, 'bear_atr_max_pct': 0.07505739525075604, 'bear_tp_mult': 1.469347418879319, 'bear_tsl_mult': 0.20290960139606706, 'bear_time_stop': 229, 'bear_use_sma': False, 'bear_use_ema': True, 'bear_use_atr': False, 'bear_use_adx': True, 'bear_use_spike': False, 'bear_rsi_required': True, 'sideways_strategy': 'breakout', 'sideways_bb_std_mult': 2.2884287653252358, 'sideways_rsi_os': 40, 'sideways_rsi_ob': 90, 'sideways_adx_thresh': 26.3122244869379, 'sideways_atr_min_pct': 0.020747213384888188, 'sideways_atr_max_pct': 0.04063798503752342, 'sideways_tp_mult': 1.8128995394086447, 'sideways_tsl_mult': 0.14789893382306707, 'sideways_time_stop': 233, 'sideways_use_sma': True, 'sideways_use_ema': False, 'sideways_use_atr': False, 'sideways_use_adx': True, 'sideways_use_spike': True, 'sideways_rsi_required': False}.
[I 2025-08-30 21:58:50,777] Trial 571 finished with values: [-1000000000.0, 1000000000.0] and parameters: {'p_sma': 58, 'p_std': 6, 'p_atr': 20, 'p_adx': 20, 'rsi_period': 72, 'ema1': 11, 'ema2': 54, 'slip_atr_k': 0.15609782065923064, 'slip_spread_k': 0.6057505579422429, 'spread_hl_frac': 0.03298816140539697, 'bb_std_mult': 3.0844830496164, 'rsi_os': 13, 'rsi_ob': 66, 'vol_spike': 0.2828964877832472, 'adx_thresh': 9.589628861935857, 'atr_min_pct': 0.004825805129303791, 'atr_max_pct': 0.025953800859284233, 'tp_mult': 1.852958975878616, 'tsl_mult': 0.06886675109021939, 'strategy': 'mean_reversion', 'time_stop': 75, 'use_sma': True, 'use_atr': False, 'use_adx': False, 'use_ema': True, 'use_spike': False, 'rsi_required': True, 'edge_k': 0.9158792091760162, 'edge_cap': 0.9808382468690264, 'bull_strategy': 'mean_reversion', 'bull_bb_std_mult': 1.7752207743720332, 'bull_rsi_os': 21, 'bull_rsi_ob': 89, 'bull_adx_thresh': 14.801135528055518, 'bull_atr_min_pct': 0.01934659851392858, 'bull_atr_max_pct': 0.02029800528213907, 'bull_tp_mult': 1.473382264650467, 'bull_tsl_mult': 0.3542947433681268, 'bull_time_stop': 264, 'bull_use_sma': True, 'bull_use_ema': False, 'bull_use_atr': False, 'bull_use_adx': False, 'bull_use_spike': False, 'bull_rsi_required': True, 'bear_strategy': 'mean_reversion', 'bear_bb_std_mult': 2.0876733755975705, 'bear_rsi_os': 6, 'bear_rsi_ob': 75, 'bear_adx_thresh': 33.63509952990712, 'bear_atr_min_pct': 0.008714510205388338, 'bear_atr_max_pct': 0.12524792654958616, 'bear_tp_mult': 2.071963621662133, 'bear_tsl_mult': 0.6359803507868365, 'bear_time_stop': 230, 'bear_use_sma': False, 'bear_use_ema': True, 'bear_use_atr': False, 'bear_use_adx': True, 'bear_use_spike': False, 'bear_rsi_required': True, 'sideways_strategy': 'breakout', 'sideways_bb_std_mult': 1.808779207173204, 'sideways_rsi_os': 7, 'sideways_rsi_ob': 78, 'sideways_adx_thresh': 26.701299105849667, 'sideways_atr_min_pct': 0.026812819241514265, 'sideways_atr_max_pct': 0.10974852517625054, 'sideways_tp_mult': 1.8128164804803528, 'sideways_tsl_mult': 0.023027024577410016, 'sideways_time_stop': 234, 'sideways_use_sma': True, 'sideways_use_ema': False, 'sideways_use_atr': False, 'sideways_use_adx': True, 'sideways_use_spike': True, 'sideways_rsi_required': False}.
[I 2025-08-30 21:58:51,233] Trial 572 finished with values: [-1000000000.0, 1000000000.0] and parameters: {'p_sma': 11, 'p_std': 22, 'p_atr': 10, 'p_adx': 20, 'rsi_period': 34, 'ema1': 11, 'ema2': 22, 'slip_atr_k': 0.22805389700243367, 'slip_spread_k': 0.3162150581021203, 'spread_hl_frac': 0.032827699894894175, 'bb_std_mult': 2.8531876865590236, 'rsi_os': 19, 'rsi_ob': 90, 'vol_spike': 0.28431655247617255, 'adx_thresh': 5.469580128473792, 'atr_min_pct': 0.013690748095052597, 'atr_max_pct': 0.016002185978752657, 'tp_mult': 1.6606937498318661, 'tsl_mult': 0.6742658501303188, 'strategy': 'mean_reversion', 'time_stop': 19, 'use_sma': True, 'use_atr': True, 'use_adx': True, 'use_ema': True, 'use_spike': True, 'rsi_required': True, 'edge_k': 0.38760022413798734, 'edge_cap': 0.4297210709241256, 'bull_strategy': 'mean_reversion', 'bull_bb_std_mult': 1.7924458653234328, 'bull_rsi_os': 46, 'bull_rsi_ob': 88, 'bull_adx_thresh': 14.767393596867596, 'bull_atr_min_pct': 0.0006397383879869368, 'bull_atr_max_pct': 0.1343084735585292, 'bull_tp_mult': 1.7207798351183214, 'bull_tsl_mult': 0.6094006699013537, 'bull_time_stop': 295, 'bull_use_sma': True, 'bull_use_ema': False, 'bull_use_atr': False, 'bull_use_adx': False, 'bull_use_spike': False, 'bull_rsi_required': True, 'bear_strategy': 'mean_reversion', 'bear_bb_std_mult': 2.000593443068319, 'bear_rsi_os': 7, 'bear_rsi_ob': 70, 'bear_adx_thresh': 27.390203744385488, 'bear_atr_min_pct': 0.029949288051481, 'bear_atr_max_pct': 0.12539889325925696, 'bear_tp_mult': 1.4703442048842674, 'bear_tsl_mult': 0.20314653037666175, 'bear_time_stop': 229, 'bear_use_sma': False, 'bear_use_ema': True, 'bear_use_atr': False, 'bear_use_adx': True, 'bear_use_spike': True, 'bear_rsi_required': True, 'sideways_strategy': 'breakout', 'sideways_bb_std_mult': 1.5019326830607476, 'sideways_rsi_os': 38, 'sideways_rsi_ob': 91, 'sideways_adx_thresh': 28.016415495000178, 'sideways_atr_min_pct': 0.020821862276442952, 'sideways_atr_max_pct': 0.03856607985933808, 'sideways_tp_mult': 1.802501585774039, 'sideways_tsl_mult': 0.016296215682705062, 'sideways_time_stop': 274, 'sideways_use_sma': False, 'sideways_use_ema': False, 'sideways_use_atr': False, 'sideways_use_adx': True, 'sideways_use_spike': False, 'sideways_rsi_required': False}.
[I 2025-08-30 21:58:51,777] Trial 574 finished with values: [-0.02442176920253114, 0.02431954861954648] and parameters: {'p_sma': 46, 'p_std': 6, 'p_atr': 10, 'p_adx': 22, 'rsi_period': 75, 'ema1': 12, 'ema2': 19, 'slip_atr_k': 0.00803578195499692, 'slip_spread_k': 0.309580736672122, 'spread_hl_frac': 0.03362932675897488, 'bb_std_mult': 1.0412341773403777, 'rsi_os': 16, 'rsi_ob': 91, 'vol_spike': 0.1843349624969447, 'adx_thresh': 9.706197000857681, 'atr_min_pct': 0.014664769377021747, 'atr_max_pct': 0.015256791208142245, 'tp_mult': 1.829115524163743, 'tsl_mult': 0.6697594245633526, 'strategy': 'mean_reversion', 'time_stop': 77, 'use_sma': True, 'use_atr': True, 'use_adx': True, 'use_ema': True, 'use_spike': True, 'rsi_required': True, 'edge_k': 0.3018986122676798, 'edge_cap': 0.809166063256373, 'bull_strategy': 'breakout', 'bull_bb_std_mult': 1.9262212301733752, 'bull_rsi_os': 18, 'bull_rsi_ob': 63, 'bull_adx_thresh': 14.665502679482715, 'bull_atr_min_pct': 0.0006015052183771808, 'bull_atr_max_pct': 0.12284670392688762, 'bull_tp_mult': 1.4800441997295268, 'bull_tsl_mult': 0.8383883050638968, 'bull_time_stop': 279, 'bull_use_sma': True, 'bull_use_ema': False, 'bull_use_atr': False, 'bull_use_adx': False, 'bull_use_spike': False, 'bull_rsi_required': True, 'bear_strategy': 'mean_reversion', 'bear_bb_std_mult': 1.991214967214921, 'bear_rsi_os': 18, 'bear_rsi_ob': 70, 'bear_adx_thresh': 11.627450774535253, 'bear_atr_min_pct': 0.029992338276516452, 'bear_atr_max_pct': 0.11419724378977819, 'bear_tp_mult': 1.5059567380228764, 'bear_tsl_mult': 0.7475592901415061, 'bear_time_stop': 289, 'bear_use_sma': False, 'bear_use_ema': True, 'bear_use_atr': False, 'bear_use_adx': True, 'bear_use_spike': True, 'bear_rsi_required': True, 'sideways_strategy': 'breakout', 'sideways_bb_std_mult': 1.804901920812311, 'sideways_rsi_os': 39, 'sideways_rsi_ob': 89, 'sideways_adx_thresh': 28.073211537809783, 'sideways_atr_min_pct': 0.022215388443654806, 'sideways_atr_max_pct': 0.04422216670467593, 'sideways_tp_mult': 1.7194538602289642, 'sideways_tsl_mult': 0.7885683640151299, 'sideways_time_stop': 274, 'sideways_use_sma': False, 'sideways_use_ema': False, 'sideways_use_atr': False, 'sideways_use_adx': True, 'sideways_use_spike': False, 'sideways_rsi_required': False}.
[I 2025-08-30 21:58:52,499] Trial 573 finished with values: [-0.03293218144033905, 0.0328382420857188] and parameters: {'p_sma': 34, 'p_std': 36, 'p_atr': 22, 'p_adx': 22, 'rsi_period': 75, 'ema1': 12, 'ema2': 51, 'slip_atr_k': 0.008439811931424922, 'slip_spread_k': 0.6126465679601673, 'spread_hl_frac': 0.03378119300677398, 'bb_std_mult': 3.54730416398759, 'rsi_os': 13, 'rsi_ob': 64, 'vol_spike': 0.26447940604272224, 'adx_thresh': 9.73750883092593, 'atr_min_pct': 0.01485062767211579, 'atr_max_pct': 0.016200110815736003, 'tp_mult': 1.6218883371174873, 'tsl_mult': 0.18520356330541465, 'strategy': 'mean_reversion', 'time_stop': 76, 'use_sma': True, 'use_atr': True, 'use_adx': True, 'use_ema': True, 'use_spike': True, 'rsi_required': True, 'edge_k': 0.9151468028702167, 'edge_cap': 0.43313327111661026, 'bull_strategy': 'mean_reversion', 'bull_bb_std_mult': 1.79145236788472, 'bull_rsi_os': 29, 'bull_rsi_ob': 88, 'bull_adx_thresh': 14.714358435435939, 'bull_atr_min_pct': 0.0005576024183299961, 'bull_atr_max_pct': 0.04738387426999468, 'bull_tp_mult': 1.484873814017208, 'bull_tsl_mult': 0.36179092719456957, 'bull_time_stop': 281, 'bull_use_sma': True, 'bull_use_ema': False, 'bull_use_atr': False, 'bull_use_adx': False, 'bull_use_spike': False, 'bull_rsi_required': True, 'bear_strategy': 'mean_reversion', 'bear_bb_std_mult': 1.996217569531747, 'bear_rsi_os': 15, 'bear_rsi_ob': 60, 'bear_adx_thresh': 26.633607534845577, 'bear_atr_min_pct': 0.02995357008499519, 'bear_atr_max_pct': 0.05956701073279913, 'bear_tp_mult': 1.4611677823933067, 'bear_tsl_mult': 0.41609972456788563, 'bear_time_stop': 230, 'bear_use_sma': False, 'bear_use_ema': True, 'bear_use_atr': False, 'bear_use_adx': True, 'bear_use_spike': True, 'bear_rsi_required': True, 'sideways_strategy': 'breakout', 'sideways_bb_std_mult': 1.4902295665794383, 'sideways_rsi_os': 38, 'sideways_rsi_ob': 90, 'sideways_adx_thresh': 28.226434281724654, 'sideways_atr_min_pct': 5.0274619810292825e-06, 'sideways_atr_max_pct': 0.038225297434863074, 'sideways_tp_mult': 1.0526864068928208, 'sideways_tsl_mult': 0.789348973241946, 'sideways_time_stop': 275, 'sideways_use_sma': False, 'sideways_use_ema': False, 'sideways_use_atr': False, 'sideways_use_adx': True, 'sideways_use_spike': False, 'sideways_rsi_required': False}.
[I 2025-08-30 21:58:53,631] Trial 577 finished with values: [-1000000000.0, 1000000000.0] and parameters: {'p_sma': 23, 'p_std': 39, 'p_atr': 21, 'p_adx': 22, 'rsi_period': 75, 'ema1': 10, 'ema2': 51, 'slip_atr_k': 0.061702174728335765, 'slip_spread_k': 0.05749343303700016, 'spread_hl_frac': 0.011943991503216404, 'bb_std_mult': 0.5972269172064308, 'rsi_os': 11, 'rsi_ob': 63, 'vol_spike': 0.26539849326634307, 'adx_thresh': 11.325257342861219, 'atr_min_pct': 0.02448940987653659, 'atr_max_pct': 0.02080778511319573, 'tp_mult': 1.6166541084779098, 'tsl_mult': 0.8978102330047862, 'strategy': 'breakout', 'time_stop': 94, 'use_sma': True, 'use_atr': True, 'use_adx': True, 'use_ema': True, 'use_spike': True, 'rsi_required': True, 'edge_k': 1.9989067407981853, 'edge_cap': 0.3895250390443112, 'bull_strategy': 'breakout', 'bull_bb_std_mult': 1.8990670617701118, 'bull_rsi_os': 17, 'bull_rsi_ob': 87, 'bull_adx_thresh': 15.427401246839498, 'bull_atr_min_pct': 0.0015897521209860856, 'bull_atr_max_pct': 0.04426975972761138, 'bull_tp_mult': 1.4129199655639437, 'bull_tsl_mult': 0.4109232254554822, 'bull_time_stop': 283, 'bull_use_sma': True, 'bull_use_ema': False, 'bull_use_atr': True, 'bull_use_adx': False, 'bull_use_spike': False, 'bull_rsi_required': False, 'bear_strategy': 'mean_reversion', 'bear_bb_std_mult': 1.7925118072432753, 'bear_rsi_os': 5, 'bear_rsi_ob': 74, 'bear_adx_thresh': 26.255207421031574, 'bear_atr_min_pct': 0.028902784118986186, 'bear_atr_max_pct': 0.07913942757321524, 'bear_tp_mult': 1.6123626174592522, 'bear_tsl_mult': 0.416653629877788, 'bear_time_stop': 51, 'bear_use_sma': False, 'bear_use_ema': True, 'bear_use_atr': True, 'bear_use_adx': True, 'bear_use_spike': True, 'bear_rsi_required': False, 'sideways_strategy': 'breakout', 'sideways_bb_std_mult': 3.518882498358491, 'sideways_rsi_os': 37, 'sideways_rsi_ob': 88, 'sideways_adx_thresh': 27.31965659108142, 'sideways_atr_min_pct': 0.006160823517989076, 'sideways_atr_max_pct': 0.04548043215382583, 'sideways_tp_mult': 1.1003143267272857, 'sideways_tsl_mult': 0.8173379439679767, 'sideways_time_stop': 249, 'sideways_use_sma': False, 'sideways_use_ema': False, 'sideways_use_atr': False, 'sideways_use_adx': True, 'sideways_use_spike': False, 'sideways_rsi_required': False}.
