[I 2025-08-30 22:25:10,122] Trial 801 finished with values: [-1000000000.0, 1000000000.0] and parameters: {'p_sma': 45, 'p_std': 46, 'p_atr': 29, 'p_adx': 21, 'rsi_period': 7, 'ema1': 11, 'ema2': 53, 'slip_atr_k': 0.02325296941296097, 'slip_spread_k': 0.6279484732154824, 'spread_hl_frac': 0.031439862016944875, 'bb_std_mult': 1.8225053525112853, 'rsi_os': 19, 'rsi_ob': 66, 'vol_spike': 0.27715686847404475, 'adx_thresh': 12.772120707209558, 'atr_min_pct': 0.016091588899341855, 'atr_max_pct': 0.02245337992235287, 'tp_mult': 1.7098280264575003, 'tsl_mult': 0.9470710715150097, 'strategy': 'breakout', 'time_stop': 290, 'use_sma': True, 'use_atr': True, 'use_adx': True, 'use_ema': True, 'use_spike': True, 'rsi_required': False, 'edge_k': 0.9567858375043414, 'edge_cap': 0.7724343446551983, 'bull_strategy': 'mean_reversion', 'bull_bb_std_mult': 1.7899386418979757, 'bull_rsi_os': 36, 'bull_rsi_ob': 87, 'bull_adx_thresh': 17.13331784695496, 'bull_atr_min_pct': 0.02607259063159029, 'bull_atr_max_pct': 0.03162344025993372, 'bull_tp_mult': 1.4871523400024382, 'bull_tsl_mult': 0.4657471950182131, 'bull_time_stop': 266, 'bull_use_sma': False, 'bull_use_ema': False, 'bull_use_atr': True, 'bull_use_adx': False, 'bull_use_spike': False, 'bull_rsi_required': True, 'bear_strategy': 'mean_reversion', 'bear_bb_std_mult': 2.0086682018821254, 'bear_rsi_os': 14, 'bear_rsi_ob': 69, 'bear_adx_thresh': 18.497390040951895, 'bear_atr_min_pct': 0.029986399526413975, 'bear_atr_max_pct': 0.11370282530449405, 'bear_tp_mult': 1.961412056833003, 'bear_tsl_mult': 0.6119742061924294, 'bear_time_stop': 139, 'bear_use_sma': False, 'bear_use_ema': False, 'bear_use_atr': False, 'bear_use_adx': False, 'bear_use_spike': True, 'bear_rsi_required': True, 'sideways_strategy': 'breakout', 'sideways_bb_std_mult': 3.0125515449408597, 'sideways_rsi_os': 39, 'sideways_rsi_ob': 59, 'sideways_adx_thresh': 14.956101560193844, 'sideways_atr_min_pct': 0.005590257607983453, 'sideways_atr_max_pct': 0.12187165811933658, 'sideways_tp_mult': 1.892915261786336, 'sideways_tsl_mult': 0.2886803904089703, 'sideways_time_stop': 265, 'sideways_use_sma': False, 'sideways_use_ema': False, 'sideways_use_atr': False, 'sideways_use_adx': True, 'sideways_use_spike': False, 'sideways_rsi_required': False}.
[I 2025-08-30 22:25:11,307] Trial 804 finished with values: [-1000000000.0, 1000000000.0] and parameters: {'p_sma': 34, 'p_std': 36, 'p_atr': 17, 'p_adx': 19, 'rsi_period': 71, 'ema1': 12, 'ema2': 53, 'slip_atr_k': 0.24907869431005297, 'slip_spread_k': 0.21533249163387613, 'spread_hl_frac': 0.03121260422817321, 'bb_std_mult': 2.6673035670367424, 'rsi_os': 11, 'rsi_ob': 51, 'vol_spike': 0.13192330134177718, 'adx_thresh': 33.961247820613295, 'atr_min_pct': 0.017979654719245966, 'atr_max_pct': 0.015987108309530946, 'tp_mult': 1.7696260612231491, 'tsl_mult': 0.6538241068090793, 'strategy': 'breakout', 'time_stop': 103, 'use_sma': True, 'use_atr': False, 'use_adx': True, 'use_ema': False, 'use_spike': True, 'rsi_required': False, 'edge_k': 0.9816643057512409, 'edge_cap': 0.1981790498154602, 'bull_strategy': 'breakout', 'bull_bb_std_mult': 2.5956133380481763, 'bull_rsi_os': 31, 'bull_rsi_ob': 87, 'bull_adx_thresh': 17.390734595862583, 'bull_atr_min_pct': 0.00088726009384105, 'bull_atr_max_pct': 0.0752539683675537, 'bull_tp_mult': 2.99154862490407, 'bull_tsl_mult': 0.41355626580150107, 'bull_time_stop': 66, 'bull_use_sma': True, 'bull_use_ema': True, 'bull_use_atr': True, 'bull_use_adx': False, 'bull_use_spike': False, 'bull_rsi_required': True, 'bear_strategy': 'breakout', 'bear_bb_std_mult': 1.9277529008082082, 'bear_rsi_os': 7, 'bear_rsi_ob': 86, 'bear_adx_thresh': 28.65242510207163, 'bear_atr_min_pct': 0.027484489005531645, 'bear_atr_max_pct': 0.024065318172507365, 'bear_tp_mult': 1.524550800578201, 'bear_tsl_mult': 0.3866242878804436, 'bear_time_stop': 222, 'bear_use_sma': True, 'bear_use_ema': True, 'bear_use_atr': True, 'bear_use_adx': False, 'bear_use_spike': False, 'bear_rsi_required': True, 'sideways_strategy': 'breakout', 'sideways_bb_std_mult': 1.5963184050743273, 'sideways_rsi_os': 36, 'sideways_rsi_ob': 63, 'sideways_adx_thresh': 27.832819851751815, 'sideways_atr_min_pct': 0.008085453165897899, 'sideways_atr_max_pct': 0.05370314679297516, 'sideways_tp_mult': 1.8935072908156059, 'sideways_tsl_mult': 0.02146635444569528, 'sideways_time_stop': 264, 'sideways_use_sma': True, 'sideways_use_ema': False, 'sideways_use_atr': True, 'sideways_use_adx': True, 'sideways_use_spike': False, 'sideways_rsi_required': False}.
[I 2025-08-30 22:25:11,396] Trial 805 finished with values: [-1000000000.0, 1000000000.0] and parameters: {'p_sma': 51, 'p_std': 51, 'p_atr': 25, 'p_adx': 20, 'rsi_period': 31, 'ema1': 12, 'ema2': 59, 'slip_atr_k': 0.10753223226471333, 'slip_spread_k': 0.814202365604835, 'spread_hl_frac': 0.029977486614041385, 'bb_std_mult': 0.703350292688307, 'rsi_os': 14, 'rsi_ob': 86, 'vol_spike': 0.26391850832364294, 'adx_thresh': 11.33894477995098, 'atr_min_pct': 0.018187591093894367, 'atr_max_pct': 0.015285950298334773, 'tp_mult': 1.1538342169196776, 'tsl_mult': 0.07745140645691528, 'strategy': 'breakout', 'time_stop': 104, 'use_sma': True, 'use_atr': False, 'use_adx': False, 'use_ema': False, 'use_spike': False, 'rsi_required': True, 'edge_k': 1.026693660385928, 'edge_cap': 0.21167107920137368, 'bull_strategy': 'breakout', 'bull_bb_std_mult': 1.9598813422080632, 'bull_rsi_os': 25, 'bull_rsi_ob': 62, 'bull_adx_thresh': 14.36834617766531, 'bull_atr_min_pct': 0.0009141418878738655, 'bull_atr_max_pct': 0.05539847435181937, 'bull_tp_mult': 1.573664972659977, 'bull_tsl_mult': 0.31364735661351006, 'bull_time_stop': 294, 'bull_use_sma': True, 'bull_use_ema': True, 'bull_use_atr': False, 'bull_use_adx': False, 'bull_use_spike': False, 'bull_rsi_required': True, 'bear_strategy': 'breakout', 'bear_bb_std_mult': 0.7130526222257536, 'bear_rsi_os': 25, 'bear_rsi_ob': 73, 'bear_adx_thresh': 33.75539113223806, 'bear_atr_min_pct': 0.029993425555996083, 'bear_atr_max_pct': 0.12729616246493652, 'bear_tp_mult': 2.1942036407958434, 'bear_tsl_mult': 0.11545470320065315, 'bear_time_stop': 220, 'bear_use_sma': True, 'bear_use_ema': True, 'bear_use_atr': True, 'bear_use_adx': False, 'bear_use_spike': False, 'bear_rsi_required': True, 'sideways_strategy': 'breakout', 'sideways_bb_std_mult': 3.445743154422839, 'sideways_rsi_os': 23, 'sideways_rsi_ob': 63, 'sideways_adx_thresh': 28.622594542227855, 'sideways_atr_min_pct': 0.018568621835592155, 'sideways_atr_max_pct': 0.049137891309110636, 'sideways_tp_mult': 1.1845016137264963, 'sideways_tsl_mult': 0.23421618186471055, 'sideways_time_stop': 11, 'sideways_use_sma': True, 'sideways_use_ema': False, 'sideways_use_atr': True, 'sideways_use_adx': True, 'sideways_use_spike': False, 'sideways_rsi_required': False}.
[I 2025-08-30 22:25:39,765] Trial 802 finished with values: [-1000000000.0, 1000000000.0] and parameters: {'p_sma': 44, 'p_std': 52, 'p_atr': 13, 'p_adx': 21, 'rsi_period': 70, 'ema1': 11, 'ema2': 53, 'slip_atr_k': 0.2410036475606973, 'slip_spread_k': 0.633995271224225, 'spread_hl_frac': 0.031314592648176716, 'bb_std_mult': 0.7063314659677826, 'rsi_os': 14, 'rsi_ob': 55, 'vol_spike': 0.26624476654170326, 'adx_thresh': 11.42465136145259, 'atr_min_pct': 0.015946478067640466, 'atr_max_pct': 0.02525777547893884, 'tp_mult': 1.6809150888305926, 'tsl_mult': 0.7176767065184759, 'strategy': 'breakout', 'time_stop': 82, 'use_sma': True, 'use_atr': True, 'use_adx': True, 'use_ema': True, 'use_spike': True, 'rsi_required': False, 'edge_k': 0.9705879191616814, 'edge_cap': 0.7684117422220345, 'bull_strategy': 'breakout', 'bull_bb_std_mult': 1.9615619866946545, 'bull_rsi_os': 25, 'bull_rsi_ob': 87, 'bull_adx_thresh': 21.533531420489442, 'bull_atr_min_pct': 0.0010112048886892796, 'bull_atr_max_pct': 0.036563706523793905, 'bull_tp_mult': 1.4090129351237042, 'bull_tsl_mult': 0.46857760506680723, 'bull_time_stop': 275, 'bull_use_sma': True, 'bull_use_ema': False, 'bull_use_atr': True, 'bull_use_adx': True, 'bull_use_spike': False, 'bull_rsi_required': True, 'bear_strategy': 'mean_reversion', 'bear_bb_std_mult': 2.0038545003681922, 'bear_rsi_os': 25, 'bear_rsi_ob': 90, 'bear_adx_thresh': 28.109847134002585, 'bear_atr_min_pct': 0.0070291413358094, 'bear_atr_max_pct': 0.11341698451197413, 'bear_tp_mult': 1.5404422133204303, 'bear_tsl_mult': 0.40980737126683253, 'bear_time_stop': 13, 'bear_use_sma': False, 'bear_use_ema': True, 'bear_use_atr': False, 'bear_use_adx': False, 'bear_use_spike': True, 'bear_rsi_required': True, 'sideways_strategy': 'breakout', 'sideways_bb_std_mult': 2.9995733738370305, 'sideways_rsi_os': 24, 'sideways_rsi_ob': 90, 'sideways_adx_thresh': 32.881109145471115, 'sideways_atr_min_pct': 0.0006209403015678509, 'sideways_atr_max_pct': 0.04955580178187302, 'sideways_tp_mult': 1.8823798439188673, 'sideways_tsl_mult': 0.8653858280314288, 'sideways_time_stop': 272, 'sideways_use_sma': False, 'sideways_use_ema': False, 'sideways_use_atr': False, 'sideways_use_adx': True, 'sideways_use_spike': False, 'sideways_rsi_required': False}.
[I 2025-08-30 22:25:40,318] Trial 803 finished with values: [-1000000000.0, 1000000000.0] and parameters: {'p_sma': 52, 'p_std': 36, 'p_atr': 21, 'p_adx': 14, 'rsi_period': 7, 'ema1': 11, 'ema2': 53, 'slip_atr_k': 0.23749799983907094, 'slip_spread_k': 0.8220949675770632, 'spread_hl_frac': 0.029387331577839793, 'bb_std_mult': 0.7017222217841107, 'rsi_os': 11, 'rsi_ob': 66, 'vol_spike': 0.29085679909483414, 'adx_thresh': 11.229936410189437, 'atr_min_pct': 0.01574656370215346, 'atr_max_pct': 0.01580450655476438, 'tp_mult': 1.6779778408450174, 'tsl_mult': 0.6481115582234672, 'strategy': 'breakout', 'time_stop': 104, 'use_sma': True, 'use_atr': True, 'use_adx': True, 'use_ema': True, 'use_spike': True, 'rsi_required': True, 'edge_k': 1.0316014848300443, 'edge_cap': 0.7965623431616422, 'bull_strategy': 'breakout', 'bull_bb_std_mult': 1.967830105666705, 'bull_rsi_os': 16, 'bull_rsi_ob': 45, 'bull_adx_thresh': 14.2331694946124, 'bull_atr_min_pct': 0.026042743982388754, 'bull_atr_max_pct': 0.11517876777867676, 'bull_tp_mult': 1.4168906975024405, 'bull_tsl_mult': 0.32445823868482127, 'bull_time_stop': 294, 'bull_use_sma': True, 'bull_use_ema': False, 'bull_use_atr': False, 'bull_use_adx': False, 'bull_use_spike': False, 'bull_rsi_required': True, 'bear_strategy': 'breakout', 'bear_bb_std_mult': 1.9625682162818814, 'bear_rsi_os': 8, 'bear_rsi_ob': 73, 'bear_adx_thresh': 28.633291846360425, 'bear_atr_min_pct': 0.029490479625573777, 'bear_atr_max_pct': 0.11286260549495875, 'bear_tp_mult': 2.3424751792894107, 'bear_tsl_mult': 0.4099138646114474, 'bear_time_stop': 221, 'bear_use_sma': False, 'bear_use_ema': True, 'bear_use_atr': False, 'bear_use_adx': False, 'bear_use_spike': True, 'bear_rsi_required': True, 'sideways_strategy': 'breakout', 'sideways_bb_std_mult': 1.5950592710583216, 'sideways_rsi_os': 24, 'sideways_rsi_ob': 86, 'sideways_adx_thresh': 27.854720111134714, 'sideways_atr_min_pct': 0.018635875746361236, 'sideways_atr_max_pct': 0.05359162565470279, 'sideways_tp_mult': 1.8912544089210017, 'sideways_tsl_mult': 0.2562847094630202, 'sideways_time_stop': 43, 'sideways_use_sma': False, 'sideways_use_ema': False, 'sideways_use_atr': False, 'sideways_use_adx': True, 'sideways_use_spike': False, 'sideways_rsi_required': False}.
[I 2025-08-30 22:25:47,502] Trial 806 finished with values: [-1000000000.0, 1000000000.0] and parameters: {'p_sma': 37, 'p_std': 42, 'p_atr': 21, 'p_adx': 24, 'rsi_period': 52, 'ema1': 11, 'ema2': 58, 'slip_atr_k': 0.014827333989450435, 'slip_spread_k': 0.6392074275485713, 'spread_hl_frac': 0.033665173525146905, 'bb_std_mult': 2.8097039367193286, 'rsi_os': 45, 'rsi_ob': 54, 'vol_spike': 0.2914030545544203, 'adx_thresh': 11.259062741543088, 'atr_min_pct': 0.013152259384643806, 'atr_max_pct': 0.02990231734134592, 'tp_mult': 1.1434884701217263, 'tsl_mult': 0.07769082458657373, 'strategy': 'mean_reversion', 'time_stop': 82, 'use_sma': True, 'use_atr': True, 'use_adx': False, 'use_ema': True, 'use_spike': False, 'rsi_required': True, 'edge_k': 1.0242870636429258, 'edge_cap': 0.7934502842198226, 'bull_strategy': 'breakout', 'bull_bb_std_mult': 1.976941863533228, 'bull_rsi_os': 16, 'bull_rsi_ob': 85, 'bull_adx_thresh': 24.176783639688814, 'bull_atr_min_pct': 6.466692694883356e-05, 'bull_atr_max_pct': 0.055002889214734015, 'bull_tp_mult': 1.416622828208233, 'bull_tsl_mult': 0.14481217419413045, 'bull_time_stop': 295, 'bull_use_sma': True, 'bull_use_ema': False, 'bull_use_atr': False, 'bull_use_adx': False, 'bull_use_spike': False, 'bull_rsi_required': True, 'bear_strategy': 'mean_reversion', 'bear_bb_std_mult': 0.6927118412265327, 'bear_rsi_os': 13, 'bear_rsi_ob': 73, 'bear_adx_thresh': 26.142967216803974, 'bear_atr_min_pct': 0.0015114460408576225, 'bear_atr_max_pct': 0.10175488870512879, 'bear_tp_mult': 1.5499326237534732, 'bear_tsl_mult': 0.4487614909475006, 'bear_time_stop': 238, 'bear_use_sma': False, 'bear_use_ema': True, 'bear_use_atr': False, 'bear_use_adx': True, 'bear_use_spike': True, 'bear_rsi_required': False, 'sideways_strategy': 'breakout', 'sideways_bb_std_mult': 1.4915378807902753, 'sideways_rsi_os': 43, 'sideways_rsi_ob': 61, 'sideways_adx_thresh': 27.290001721574132, 'sideways_atr_min_pct': 0.0046601131393149385, 'sideways_atr_max_pct': 0.03732541664213512, 'sideways_tp_mult': 1.7934465320526114, 'sideways_tsl_mult': 0.7634006132984051, 'sideways_time_stop': 124, 'sideways_use_sma': False, 'sideways_use_ema': False, 'sideways_use_atr': False, 'sideways_use_adx': True, 'sideways_use_spike': True, 'sideways_rsi_required': False}.
[I 2025-08-30 22:25:48,253] Trial 807 finished with values: [-1000000000.0, 1000000000.0] and parameters: {'p_sma': 37, 'p_std': 36, 'p_atr': 13, 'p_adx': 22, 'rsi_period': 70, 'ema1': 5, 'ema2': 55, 'slip_atr_k': 0.012643131159593498, 'slip_spread_k': 0.030671074379927277, 'spread_hl_frac': 0.03317990265412708, 'bb_std_mult': 0.7972967823328185, 'rsi_os': 10, 'rsi_ob': 68, 'vol_spike': 0.28965421264741387, 'adx_thresh': 10.245792492577424, 'atr_min_pct': 0.026901737903429875, 'atr_max_pct': 0.12819041415881097, 'tp_mult': 2.3096589596112596, 'tsl_mult': 0.7241487042692253, 'strategy': 'mean_reversion', 'time_stop': 82, 'use_sma': True, 'use_atr': True, 'use_adx': True, 'use_ema': True, 'use_spike': True, 'rsi_required': True, 'edge_k': 1.0323068683874865, 'edge_cap': 0.2418841430149335, 'bull_strategy': 'breakout', 'bull_bb_std_mult': 0.8291257133558256, 'bull_rsi_os': 16, 'bull_rsi_ob': 84, 'bull_adx_thresh': 31.4939577875329, 'bull_atr_min_pct': 0.0027047687314397852, 'bull_atr_max_pct': 0.056517112025614984, 'bull_tp_mult': 1.4256216206176862, 'bull_tsl_mult': 0.5997883239258773, 'bull_time_stop': 295, 'bull_use_sma': True, 'bull_use_ema': False, 'bull_use_atr': False, 'bull_use_adx': False, 'bull_use_spike': False, 'bull_rsi_required': True, 'bear_strategy': 'mean_reversion', 'bear_bb_std_mult': 2.0762871411079735, 'bear_rsi_os': 11, 'bear_rsi_ob': 74, 'bear_adx_thresh': 26.286417067405203, 'bear_atr_min_pct': 0.028471158493434002, 'bear_atr_max_pct': 0.11666270609742749, 'bear_tp_mult': 1.7264770811788415, 'bear_tsl_mult': 0.5535225126144322, 'bear_time_stop': 238, 'bear_use_sma': False, 'bear_use_ema': True, 'bear_use_atr': False, 'bear_use_adx': True, 'bear_use_spike': True, 'bear_rsi_required': False, 'sideways_strategy': 'breakout', 'sideways_bb_std_mult': 1.821079682796979, 'sideways_rsi_os': 28, 'sideways_rsi_ob': 86, 'sideways_adx_thresh': 27.18813652463537, 'sideways_atr_min_pct': 0.02194650446896574, 'sideways_atr_max_pct': 0.03707517610075687, 'sideways_tp_mult': 1.7772612672032004, 'sideways_tsl_mult': 0.9828918515465049, 'sideways_time_stop': 43, 'sideways_use_sma': False, 'sideways_use_ema': False, 'sideways_use_atr': False, 'sideways_use_adx': True, 'sideways_use_spike': True, 'sideways_rsi_required': False}.
[I 2025-08-30 22:26:27,435] Trial 808 finished with values: [-1000000000.0, 1000000000.0] and parameters: {'p_sma': 34, 'p_std': 42, 'p_atr': 8, 'p_adx': 22, 'rsi_period': 74, 'ema1': 26, 'ema2': 55, 'slip_atr_k': 0.042106611877168944, 'slip_spread_k': 0.7122420987300712, 'spread_hl_frac': 0.038759486086600514, 'bb_std_mult': 0.8527810402653837, 'rsi_os': 9, 'rsi_ob': 69, 'vol_spike': 0.2908333702537874, 'adx_thresh': 10.142945412041813, 'atr_min_pct': 0.01322761955053936, 'atr_max_pct': 0.020309080134952032, 'tp_mult': 1.6059842397318729, 'tsl_mult': 0.9083205701301766, 'strategy': 'mean_reversion', 'time_stop': 279, 'use_sma': True, 'use_atr': True, 'use_adx': False, 'use_ema': True, 'use_spike': False, 'rsi_required': True, 'edge_k': 1.0150368882708023, 'edge_cap': 0.7957877546808488, 'bull_strategy': 'breakout', 'bull_bb_std_mult': 1.870808388650209, 'bull_rsi_os': 16, 'bull_rsi_ob': 85, 'bull_adx_thresh': 7.5324917093328345, 'bull_atr_min_pct': 0.0028566620359801818, 'bull_atr_max_pct': 0.06012662455352975, 'bull_tp_mult': 1.430748590248168, 'bull_tsl_mult': 0.24883313066386964, 'bull_time_stop': 300, 'bull_use_sma': True, 'bull_use_ema': False, 'bull_use_atr': False, 'bull_use_adx': False, 'bull_use_spike': False, 'bull_rsi_required': True, 'bear_strategy': 'mean_reversion', 'bear_bb_std_mult': 1.910325268910885, 'bear_rsi_os': 32, 'bear_rsi_ob': 74, 'bear_adx_thresh': 26.18697443421229, 'bear_atr_min_pct': 0.004623687542421623, 'bear_atr_max_pct': 0.11823631931933255, 'bear_tp_mult': 1.6485908507776226, 'bear_tsl_mult': 0.9049506159220017, 'bear_time_stop': 238, 'bear_use_sma': False, 'bear_use_ema': True, 'bear_use_atr': False, 'bear_use_adx': True, 'bear_use_spike': True, 'bear_rsi_required': False, 'sideways_strategy': 'breakout', 'sideways_bb_std_mult': 1.0780095604977586, 'sideways_rsi_os': 43, 'sideways_rsi_ob': 86, 'sideways_adx_thresh': 34.60391101622722, 'sideways_atr_min_pct': 0.02239890444879316, 'sideways_atr_max_pct': 0.07350261444432167, 'sideways_tp_mult': 1.7679896332303977, 'sideways_tsl_mult': 0.19875761019227012, 'sideways_time_stop': 123, 'sideways_use_sma': False, 'sideways_use_ema': False, 'sideways_use_atr': False, 'sideways_use_adx': True, 'sideways_use_spike': True, 'sideways_rsi_required': False}.
[I 2025-08-30 22:26:28,639] Trial 809 finished with values: [-1000000000.0, 1000000000.0] and parameters: {'p_sma': 37, 'p_std': 60, 'p_atr': 23, 'p_adx': 22, 'rsi_period': 76, 'ema1': 13, 'ema2': 10, 'slip_atr_k': 0.15486928468170938, 'slip_spread_k': 0.7938658141590891, 'spread_hl_frac': 0.038096894224302465, 'bb_std_mult': 0.8084789972189159, 'rsi_os': 9, 'rsi_ob': 77, 'vol_spike': 0.2883570708925285, 'adx_thresh': 10.14021224557141, 'atr_min_pct': 0.0020647574897697495, 'atr_max_pct': 0.03102868446944554, 'tp_mult': 2.2273069179199356, 'tsl_mult': 0.8968224705423884, 'strategy': 'mean_reversion', 'time_stop': 300, 'use_sma': True, 'use_atr': True, 'use_adx': False, 'use_ema': True, 'use_spike': False, 'rsi_required': True, 'edge_k': 1.009382096068863, 'edge_cap': 0.8331052618617105, 'bull_strategy': 'breakout', 'bull_bb_std_mult': 2.69534379382448, 'bull_rsi_os': 15, 'bull_rsi_ob': 93, 'bull_adx_thresh': 13.716980428256832, 'bull_atr_min_pct': 0.020553558687702127, 'bull_atr_max_pct': 0.056537083801122046, 'bull_tp_mult': 1.5207526557342768, 'bull_tsl_mult': 0.36981996524971217, 'bull_time_stop': 300, 'bull_use_sma': True, 'bull_use_ema': False, 'bull_use_atr': False, 'bull_use_adx': False, 'bull_use_spike': False, 'bull_rsi_required': False, 'bear_strategy': 'mean_reversion', 'bear_bb_std_mult': 2.0951937252509385, 'bear_rsi_os': 18, 'bear_rsi_ob': 74, 'bear_adx_thresh': 12.79613539294014, 'bear_atr_min_pct': 0.028642009131976755, 'bear_atr_max_pct': 0.11802144886438892, 'bear_tp_mult': 1.6580128575498962, 'bear_tsl_mult': 0.6656754562737979, 'bear_time_stop': 238, 'bear_use_sma': False, 'bear_use_ema': True, 'bear_use_atr': False, 'bear_use_adx': True, 'bear_use_spike': True, 'bear_rsi_required': False, 'sideways_strategy': 'breakout', 'sideways_bb_std_mult': 1.8189886160810793, 'sideways_rsi_os': 22, 'sideways_rsi_ob': 89, 'sideways_adx_thresh': 34.580305340929044, 'sideways_atr_min_pct': 0.022130669295313297, 'sideways_atr_max_pct': 0.07891350444078099, 'sideways_tp_mult': 2.8534457635623687, 'sideways_tsl_mult': 0.7503333788608022, 'sideways_time_stop': 88, 'sideways_use_sma': False, 'sideways_use_ema': False, 'sideways_use_atr': False, 'sideways_use_adx': True, 'sideways_use_spike': True, 'sideways_rsi_required': False}.
