[I 2025-08-30 22:07:14,566] Trial 650 finished with values: [-1000000000.0, 1000000000.0] and parameters: {'p_sma': 36, 'p_std': 43, 'p_atr': 21, 'p_adx': 18, 'rsi_period': 25, 'ema1': 13, 'ema2': 17, 'slip_atr_k': 0.1974268022074139, 'slip_spread_k': 0.07241620392172454, 'spread_hl_frac': 0.034076645905162614, 'bb_std_mult': 0.9691811154634196, 'rsi_os': 12, 'rsi_ob': 52, 'vol_spike': 0.28990266488856337, 'adx_thresh': 5.413447408600852, 'atr_min_pct': 0.024622720195724274, 'atr_max_pct': 0.01564990355131486, 'tp_mult': 1.5979053430807322, 'tsl_mult': 0.9115134079441708, 'strategy': 'mean_reversion', 'time_stop': 15, 'use_sma': True, 'use_atr': True, 'use_adx': True, 'use_ema': True, 'use_spike': True, 'rsi_required': True, 'edge_k': 0.8425400125766942, 'edge_cap': 0.5243531383246839, 'bull_strategy': 'mean_reversion', 'bull_bb_std_mult': 1.8705331953333997, 'bull_rsi_os': 17, 'bull_rsi_ob': 47, 'bull_adx_thresh': 5.04787416393096, 'bull_atr_min_pct': 0.0016337992919729693, 'bull_atr_max_pct': 0.13200106803939354, 'bull_tp_mult': 1.6377356118050819, 'bull_tsl_mult': 0.36355609667713246, 'bull_time_stop': 295, 'bull_use_sma': False, 'bull_use_ema': False, 'bull_use_atr': False, 'bull_use_adx': False, 'bull_use_spike': False, 'bull_rsi_required': True, 'bear_strategy': 'mean_reversion', 'bear_bb_std_mult': 2.225427718041992, 'bear_rsi_os': 8, 'bear_rsi_ob': 73, 'bear_adx_thresh': 11.921479108408109, 'bear_atr_min_pct': 0.006410665034199138, 'bear_atr_max_pct': 0.1168103264245874, 'bear_tp_mult': 1.4073609918450793, 'bear_tsl_mult': 0.780612724618399, 'bear_time_stop': 171, 'bear_use_sma': True, 'bear_use_ema': True, 'bear_use_atr': False, 'bear_use_adx': True, 'bear_use_spike': True, 'bear_rsi_required': True, 'sideways_strategy': 'breakout', 'sideways_bb_std_mult': 2.0941541876657657, 'sideways_rsi_os': 8, 'sideways_rsi_ob': 87, 'sideways_adx_thresh': 26.969017511496354, 'sideways_atr_min_pct': 0.029470294261633945, 'sideways_atr_max_pct': 0.04433208270872165, 'sideways_tp_mult': 1.7546986922802168, 'sideways_tsl_mult': 0.31598460848819343, 'sideways_time_stop': 249, 'sideways_use_sma': False, 'sideways_use_ema': False, 'sideways_use_atr': False, 'sideways_use_adx': False, 'sideways_use_spike': False, 'sideways_rsi_required': False}.
[I 2025-08-30 22:07:23,788] Trial 646 finished with values: [-1000000000.0, 1000000000.0] and parameters: {'p_sma': 34, 'p_std': 34, 'p_atr': 19, 'p_adx': 21, 'rsi_period': 51, 'ema1': 25, 'ema2': 31, 'slip_atr_k': 0.04288540716573587, 'slip_spread_k': 0.6574982453111629, 'spread_hl_frac': 0.04774561642291754, 'bb_std_mult': 0.8710062308376163, 'rsi_os': 11, 'rsi_ob': 85, 'vol_spike': 0.2686198134805109, 'adx_thresh': 6.955157431977327, 'atr_min_pct': 0.01396148843078788, 'atr_max_pct': 0.019559481288924263, 'tp_mult': 2.5001622010362237, 'tsl_mult': 0.40981569077836405, 'strategy': 'mean_reversion', 'time_stop': 65, 'use_sma': True, 'use_atr': True, 'use_adx': False, 'use_ema': False, 'use_spike': False, 'rsi_required': True, 'edge_k': 0.8878124139933075, 'edge_cap': 0.2260154731290938, 'bull_strategy': 'mean_reversion', 'bull_bb_std_mult': 0.6306914099063103, 'bull_rsi_os': 17, 'bull_rsi_ob': 86, 'bull_adx_thresh': 12.035690254406212, 'bull_atr_min_pct': 5.995240027441458e-06, 'bull_atr_max_pct': 0.014868898685252374, 'bull_tp_mult': 1.3851146013750906, 'bull_tsl_mult': 0.4252108544959598, 'bull_time_stop': 294, 'bull_use_sma': True, 'bull_use_ema': True, 'bull_use_atr': False, 'bull_use_adx': False, 'bull_use_spike': False, 'bull_rsi_required': True, 'bear_strategy': 'mean_reversion', 'bear_bb_std_mult': 2.2389503350452316, 'bear_rsi_os': 7, 'bear_rsi_ob': 76, 'bear_adx_thresh': 29.20566733686464, 'bear_atr_min_pct': 0.029029452672991663, 'bear_atr_max_pct': 0.10851761440155609, 'bear_tp_mult': 2.034982701439988, 'bear_tsl_mult': 0.35885471585674966, 'bear_time_stop': 227, 'bear_use_sma': False, 'bear_use_ema': True, 'bear_use_atr': False, 'bear_use_adx': False, 'bear_use_spike': True, 'bear_rsi_required': True, 'sideways_strategy': 'breakout', 'sideways_bb_std_mult': 2.9202077249262857, 'sideways_rsi_os': 53, 'sideways_rsi_ob': 90, 'sideways_adx_thresh': 34.18140775206563, 'sideways_atr_min_pct': 0.029392083360096116, 'sideways_atr_max_pct': 0.03428881494489499, 'sideways_tp_mult': 2.233886946992828, 'sideways_tsl_mult': 0.7960596565803982, 'sideways_time_stop': 35, 'sideways_use_sma': True, 'sideways_use_ema': False, 'sideways_use_atr': False, 'sideways_use_adx': True, 'sideways_use_spike': True, 'sideways_rsi_required': False}.
[I 2025-08-30 22:07:24,869] Trial 647 finished with values: [-1000000000.0, 1000000000.0] and parameters: {'p_sma': 59, 'p_std': 36, 'p_atr': 19, 'p_adx': 7, 'rsi_period': 25, 'ema1': 13, 'ema2': 28, 'slip_atr_k': 0.04960985708502427, 'slip_spread_k': 0.6547532575565175, 'spread_hl_frac': 0.03491909392233628, 'bb_std_mult': 0.7078213662253194, 'rsi_os': 10, 'rsi_ob': 65, 'vol_spike': 0.23723116333599148, 'adx_thresh': 7.126094854974914, 'atr_min_pct': 0.011613779870941756, 'atr_max_pct': 0.0205367230240904, 'tp_mult': 2.0110195651171767, 'tsl_mult': 0.889867223067391, 'strategy': 'mean_reversion', 'time_stop': 238, 'use_sma': True, 'use_atr': True, 'use_adx': False, 'use_ema': True, 'use_spike': False, 'rsi_required': True, 'edge_k': 1.380872898334455, 'edge_cap': 0.8288725836592399, 'bull_strategy': 'mean_reversion', 'bull_bb_std_mult': 0.6549944358236324, 'bull_rsi_os': 17, 'bull_rsi_ob': 56, 'bull_adx_thresh': 14.515749159506543, 'bull_atr_min_pct': 0.0016500471754647345, 'bull_atr_max_pct': 0.13196421388747567, 'bull_tp_mult': 1.3842471337976259, 'bull_tsl_mult': 0.41721379777772616, 'bull_time_stop': 295, 'bull_use_sma': True, 'bull_use_ema': True, 'bull_use_atr': False, 'bull_use_adx': False, 'bull_use_spike': False, 'bull_rsi_required': True, 'bear_strategy': 'mean_reversion', 'bear_bb_std_mult': 2.156807179573378, 'bear_rsi_os': 53, 'bear_rsi_ob': 76, 'bear_adx_thresh': 8.189793541775112, 'bear_atr_min_pct': 0.029975121545326534, 'bear_atr_max_pct': 0.11577433298191964, 'bear_tp_mult': 2.0154282252606954, 'bear_tsl_mult': 0.8722059198157135, 'bear_time_stop': 216, 'bear_use_sma': False, 'bear_use_ema': True, 'bear_use_atr': False, 'bear_use_adx': True, 'bear_use_spike': True, 'bear_rsi_required': True, 'sideways_strategy': 'breakout', 'sideways_bb_std_mult': 1.7646214413856163, 'sideways_rsi_os': 20, 'sideways_rsi_ob': 86, 'sideways_adx_thresh': 28.813265778565597, 'sideways_atr_min_pct': 0.010412050870316273, 'sideways_atr_max_pct': 0.07459837719679117, 'sideways_tp_mult': 2.417626880786816, 'sideways_tsl_mult': 0.7102217926709056, 'sideways_time_stop': 249, 'sideways_use_sma': True, 'sideways_use_ema': False, 'sideways_use_atr': False, 'sideways_use_adx': True, 'sideways_use_spike': True, 'sideways_rsi_required': False}.
[I 2025-08-30 22:07:25,043] Trial 652 finished with values: [-1000000000.0, 1000000000.0] and parameters: {'p_sma': 6, 'p_std': 53, 'p_atr': 17, 'p_adx': 15, 'rsi_period': 40, 'ema1': 11, 'ema2': 52, 'slip_atr_k': 0.02426228180549723, 'slip_spread_k': 0.6535015677082653, 'spread_hl_frac': 0.03326417981339284, 'bb_std_mult': 0.8721212126855978, 'rsi_os': 30, 'rsi_ob': 65, 'vol_spike': 0.21585782553264818, 'adx_thresh': 11.77275520333148, 'atr_min_pct': 0.026451164618076266, 'atr_max_pct': 0.019370464836385767, 'tp_mult': 1.7019925127699325, 'tsl_mult': 0.8686050509386377, 'strategy': 'breakout', 'time_stop': 85, 'use_sma': False, 'use_atr': True, 'use_adx': True, 'use_ema': True, 'use_spike': True, 'rsi_required': False, 'edge_k': 1.8452916055867643, 'edge_cap': 0.22969493704119842, 'bull_strategy': 'breakout', 'bull_bb_std_mult': 1.8365605001217564, 'bull_rsi_os': 20, 'bull_rsi_ob': 86, 'bull_adx_thresh': 14.440289762065797, 'bull_atr_min_pct': 0.029503292889074103, 'bull_atr_max_pct': 0.0524280009058315, 'bull_tp_mult': 2.799445520847264, 'bull_tsl_mult': 0.5127187651063693, 'bull_time_stop': 194, 'bull_use_sma': True, 'bull_use_ema': False, 'bull_use_atr': True, 'bull_use_adx': False, 'bull_use_spike': False, 'bull_rsi_required': False, 'bear_strategy': 'mean_reversion', 'bear_bb_std_mult': 1.9670103000049413, 'bear_rsi_os': 32, 'bear_rsi_ob': 84, 'bear_adx_thresh': 20.88635692056451, 'bear_atr_min_pct': 0.0019888774361162525, 'bear_atr_max_pct': 0.11144342456327835, 'bear_tp_mult': 2.504213256094285, 'bear_tsl_mult': 0.380927084453451, 'bear_time_stop': 245, 'bear_use_sma': False, 'bear_use_ema': False, 'bear_use_atr': True, 'bear_use_adx': True, 'bear_use_spike': True, 'bear_rsi_required': False, 'sideways_strategy': 'breakout', 'sideways_bb_std_mult': 1.459108648551793, 'sideways_rsi_os': 38, 'sideways_rsi_ob': 73, 'sideways_adx_thresh': 9.093014992457269, 'sideways_atr_min_pct': 0.006748776619564016, 'sideways_atr_max_pct': 0.03942766382394844, 'sideways_tp_mult': 2.7589433178781237, 'sideways_tsl_mult': 0.8010635179255623, 'sideways_time_stop': 42, 'sideways_use_sma': False, 'sideways_use_ema': False, 'sideways_use_atr': False, 'sideways_use_adx': True, 'sideways_use_spike': False, 'sideways_rsi_required': False}.
[I 2025-08-30 22:07:27,132] Trial 654 finished with values: [-1000000000.0, 1000000000.0] and parameters: {'p_sma': 6, 'p_std': 7, 'p_atr': 29, 'p_adx': 12, 'rsi_period': 72, 'ema1': 11, 'ema2': 60, 'slip_atr_k': 0.034789359804886774, 'slip_spread_k': 0.6125451211008575, 'spread_hl_frac': 0.01218261496297101, 'bb_std_mult': 3.536541339912877, 'rsi_os': 7, 'rsi_ob': 67, 'vol_spike': 0.27424579122520165, 'adx_thresh': 11.58812747811085, 'atr_min_pct': 0.02621763716758503, 'atr_max_pct': 0.024640619134262996, 'tp_mult': 1.4678777351348462, 'tsl_mult': 0.9508294914789028, 'strategy': 'breakout', 'time_stop': 86, 'use_sma': False, 'use_atr': True, 'use_adx': True, 'use_ema': True, 'use_spike': True, 'rsi_required': False, 'edge_k': 0.790310938770261, 'edge_cap': 0.787320671739392, 'bull_strategy': 'breakout', 'bull_bb_std_mult': 2.125876513458834, 'bull_rsi_os': 30, 'bull_rsi_ob': 87, 'bull_adx_thresh': 9.42204031813035, 'bull_atr_min_pct': 0.026321045903685274, 'bull_atr_max_pct': 0.08809995499731287, 'bull_tp_mult': 2.672096665033885, 'bull_tsl_mult': 0.4586327945473746, 'bull_time_stop': 135, 'bull_use_sma': False, 'bull_use_ema': False, 'bull_use_atr': True, 'bull_use_adx': False, 'bull_use_spike': True, 'bull_rsi_required': False, 'bear_strategy': 'mean_reversion', 'bear_bb_std_mult': 1.9599211234307268, 'bear_rsi_os': 6, 'bear_rsi_ob': 71, 'bear_adx_thresh': 26.188772711688866, 'bear_atr_min_pct': 0.002198641102213463, 'bear_atr_max_pct': 0.12057926437232007, 'bear_tp_mult': 2.287355018165013, 'bear_tsl_mult': 0.38070119897476656, 'bear_time_stop': 243, 'bear_use_sma': True, 'bear_use_ema': False, 'bear_use_atr': True, 'bear_use_adx': True, 'bear_use_spike': True, 'bear_rsi_required': False, 'sideways_strategy': 'mean_reversion', 'sideways_bb_std_mult': 1.8455090894121395, 'sideways_rsi_os': 38, 'sideways_rsi_ob': 73, 'sideways_adx_thresh': 13.26135251282117, 'sideways_atr_min_pct': 0.021079201794261666, 'sideways_atr_max_pct': 0.03940525812461316, 'sideways_tp_mult': 1.849384740355032, 'sideways_tsl_mult': 0.032112170515051164, 'sideways_time_stop': 209, 'sideways_use_sma': False, 'sideways_use_ema': True, 'sideways_use_atr': True, 'sideways_use_adx': True, 'sideways_use_spike': False, 'sideways_rsi_required': True}.
[I 2025-08-30 22:07:43,125] Trial 651 finished with values: [-1000000000.0, 1000000000.0] and parameters: {'p_sma': 36, 'p_std': 36, 'p_atr': 29, 'p_adx': 14, 'rsi_period': 34, 'ema1': 28, 'ema2': 17, 'slip_atr_k': 0.03379967741996507, 'slip_spread_k': 0.6101263649586632, 'spread_hl_frac': 0.0334237849093171, 'bb_std_mult': 0.9607026794237324, 'rsi_os': 11, 'rsi_ob': 65, 'vol_spike': 0.2537771148425505, 'adx_thresh': 6.776887049711938, 'atr_min_pct': 0.013039321199947652, 'atr_max_pct': 0.0236538759683875, 'tp_mult': 1.4628697254723524, 'tsl_mult': 0.7627294342582291, 'strategy': 'breakout', 'time_stop': 295, 'use_sma': False, 'use_atr': True, 'use_adx': True, 'use_ema': True, 'use_spike': True, 'rsi_required': False, 'edge_k': 0.8372155835970458, 'edge_cap': 0.22277018700139462, 'bull_strategy': 'breakout', 'bull_bb_std_mult': 1.8323927019484285, 'bull_rsi_os': 20, 'bull_rsi_ob': 86, 'bull_adx_thresh': 13.804529091059525, 'bull_atr_min_pct': 0.0017152513630262157, 'bull_atr_max_pct': 0.05282208393974242, 'bull_tp_mult': 1.3449389025322556, 'bull_tsl_mult': 0.9285889721067064, 'bull_time_stop': 239, 'bull_use_sma': False, 'bull_use_ema': False, 'bull_use_atr': True, 'bull_use_adx': False, 'bull_use_spike': False, 'bull_rsi_required': True, 'bear_strategy': 'mean_reversion', 'bear_bb_std_mult': 1.61735349361386, 'bear_rsi_os': 32, 'bear_rsi_ob': 73, 'bear_adx_thresh': 29.97061657991921, 'bear_atr_min_pct': 0.0020557314021633615, 'bear_atr_max_pct': 0.11578354070609867, 'bear_tp_mult': 1.8312115668859656, 'bear_tsl_mult': 0.37977439643781585, 'bear_time_stop': 244, 'bear_use_sma': True, 'bear_use_ema': False, 'bear_use_atr': True, 'bear_use_adx': True, 'bear_use_spike': True, 'bear_rsi_required': True, 'sideways_strategy': 'breakout', 'sideways_bb_std_mult': 1.8420370114466647, 'sideways_rsi_os': 41, 'sideways_rsi_ob': 45, 'sideways_adx_thresh': 8.64828754568651, 'sideways_atr_min_pct': 0.029285142471764718, 'sideways_atr_max_pct': 0.12634225899059287, 'sideways_tp_mult': 1.8541852797989038, 'sideways_tsl_mult': 0.277143988829634, 'sideways_time_stop': 244, 'sideways_use_sma': False, 'sideways_use_ema': False, 'sideways_use_atr': False, 'sideways_use_adx': True, 'sideways_use_spike': False, 'sideways_rsi_required': False}.
[I 2025-08-30 22:07:49,875] Trial 653 finished with values: [-1000000000.0, 1000000000.0] and parameters: {'p_sma': 33, 'p_std': 36, 'p_atr': 23, 'p_adx': 21, 'rsi_period': 84, 'ema1': 28, 'ema2': 53, 'slip_atr_k': 0.0739418877473898, 'slip_spread_k': 0.6100831344016635, 'spread_hl_frac': 0.033321721093102004, 'bb_std_mult': 1.9029154986437669, 'rsi_os': 30, 'rsi_ob': 65, 'vol_spike': 0.0153067090665219, 'adx_thresh': 11.5874377806531, 'atr_min_pct': 0.026556794773676774, 'atr_max_pct': 0.07928412813457389, 'tp_mult': 1.7042369612980677, 'tsl_mult': 0.10810337384769092, 'strategy': 'breakout', 'time_stop': 300, 'use_sma': False, 'use_atr': True, 'use_adx': True, 'use_ema': True, 'use_spike': True, 'rsi_required': False, 'edge_k': 0.9363615436716982, 'edge_cap': 0.7858019800365431, 'bull_strategy': 'breakout', 'bull_bb_std_mult': 2.2491398965252185, 'bull_rsi_os': 30, 'bull_rsi_ob': 66, 'bull_adx_thresh': 8.061593945659792, 'bull_atr_min_pct': 0.02923101270075138, 'bull_atr_max_pct': 0.08719099295195812, 'bull_tp_mult': 1.3375492880117086, 'bull_tsl_mult': 0.18609894450892367, 'bull_time_stop': 177, 'bull_use_sma': False, 'bull_use_ema': False, 'bull_use_atr': True, 'bull_use_adx': False, 'bull_use_spike': True, 'bull_rsi_required': False, 'bear_strategy': 'mean_reversion', 'bear_bb_std_mult': 1.9645606773163973, 'bear_rsi_os': 32, 'bear_rsi_ob': 71, 'bear_adx_thresh': 26.217192977719638, 'bear_atr_min_pct': 0.029970869167357837, 'bear_atr_max_pct': 0.14502208067198807, 'bear_tp_mult': 1.6346459772918625, 'bear_tsl_mult': 0.38142276253231294, 'bear_time_stop': 244, 'bear_use_sma': False, 'bear_use_ema': False, 'bear_use_atr': True, 'bear_use_adx': True, 'bear_use_spike': True, 'bear_rsi_required': False, 'sideways_strategy': 'breakout', 'sideways_bb_std_mult': 2.8403624291805136, 'sideways_rsi_os': 38, 'sideways_rsi_ob': 45, 'sideways_adx_thresh': 27.84760125158763, 'sideways_atr_min_pct': 0.010537457581265463, 'sideways_atr_max_pct': 0.03901017436909491, 'sideways_tp_mult': 1.8420508202129864, 'sideways_tsl_mult': 0.7039506959732718, 'sideways_time_stop': 210, 'sideways_use_sma': False, 'sideways_use_ema': True, 'sideways_use_atr': False, 'sideways_use_adx': True, 'sideways_use_spike': False, 'sideways_rsi_required': True}.
[I 2025-08-30 22:07:53,461] Trial 655 finished with values: [-0.015812685974643137, 0.015759596200709197] and parameters: {'p_sma': 17, 'p_std': 7, 'p_atr': 20, 'p_adx': 21, 'rsi_period': 73, 'ema1': 28, 'ema2': 53, 'slip_atr_k': 0.005368201953293874, 'slip_spread_k': 0.6147582344522164, 'spread_hl_frac': 0.0316402173459986, 'bb_std_mult': 1.2322996274476332, 'rsi_os': 8, 'rsi_ob': 69, 'vol_spike': 0.11024098175100555, 'adx_thresh': 24.55466266503633, 'atr_min_pct': 0.012979819796457633, 'atr_max_pct': 0.024765214526017466, 'tp_mult': 1.4578947122277208, 'tsl_mult': 0.45541674348597166, 'strategy': 'breakout', 'time_stop': 252, 'use_sma': False, 'use_atr': True, 'use_adx': True, 'use_ema': True, 'use_spike': True, 'rsi_required': False, 'edge_k': 0.9412687854113158, 'edge_cap': 0.7867277324256874, 'bull_strategy': 'breakout', 'bull_bb_std_mult': 1.4052072301235077, 'bull_rsi_os': 15, 'bull_rsi_ob': 87, 'bull_adx_thresh': 34.83001521433637, 'bull_atr_min_pct': 0.0005855094946942623, 'bull_atr_max_pct': 0.05284803833478632, 'bull_tp_mult': 1.469360318440435, 'bull_tsl_mult': 0.4747135735524621, 'bull_time_stop': 124, 'bull_use_sma': False, 'bull_use_ema': False, 'bull_use_atr': True, 'bull_use_adx': False, 'bull_use_spike': True, 'bull_rsi_required': True, 'bear_strategy': 'mean_reversion', 'bear_bb_std_mult': 0.9376480411164927, 'bear_rsi_os': 14, 'bear_rsi_ob': 71, 'bear_adx_thresh': 26.149227912393787, 'bear_atr_min_pct': 0.02947228651310707, 'bear_atr_max_pct': 0.12015608293053495, 'bear_tp_mult': 2.3387243509047337, 'bear_tsl_mult': 0.38240319429779146, 'bear_time_stop': 154, 'bear_use_sma': True, 'bear_use_ema': False, 'bear_use_atr': True, 'bear_use_adx': True, 'bear_use_spike': True, 'bear_rsi_required': True, 'sideways_strategy': 'mean_reversion', 'sideways_bb_std_mult': 1.6048349321160351, 'sideways_rsi_os': 37, 'sideways_rsi_ob': 71, 'sideways_adx_thresh': 13.577569002347929, 'sideways_atr_min_pct': 0.02113557541141657, 'sideways_atr_max_pct': 0.03948044392259223, 'sideways_tp_mult': 1.8462715066521214, 'sideways_tsl_mult': 0.7480061393810493, 'sideways_time_stop': 243, 'sideways_use_sma': False, 'sideways_use_ema': True, 'sideways_use_atr': True, 'sideways_use_adx': True, 'sideways_use_spike': False, 'sideways_rsi_required': True}.
[I 2025-08-30 22:07:56,405] Trial 657 finished with values: [-1000000000.0, 1000000000.0] and parameters: {'p_sma': 33, 'p_std': 35, 'p_atr': 23, 'p_adx': 22, 'rsi_period': 73, 'ema1': 27, 'ema2': 39, 'slip_atr_k': 0.01761474525416029, 'slip_spread_k': 0.6338418076095856, 'spread_hl_frac': 0.03130943034754429, 'bb_std_mult': 2.766805004505815, 'rsi_os': 53, 'rsi_ob': 69, 'vol_spike': 0.017591129547518153, 'adx_thresh': 24.373855092156084, 'atr_min_pct': 0.012974122433180805, 'atr_max_pct': 0.014019041667782683, 'tp_mult': 1.8251937022674032, 'tsl_mult': 0.24377929507752288, 'strategy': 'mean_reversion', 'time_stop': 254, 'use_sma': True, 'use_atr': False, 'use_adx': True, 'use_ema': True, 'use_spike': True, 'rsi_required': True, 'edge_k': 0.9872466085533154, 'edge_cap': 0.8455174262192644, 'bull_strategy': 'breakout', 'bull_bb_std_mult': 2.263038268059856, 'bull_rsi_os': 29, 'bull_rsi_ob': 88, 'bull_adx_thresh': 18.129443636256617, 'bull_atr_min_pct': 0.019369964272068003, 'bull_atr_max_pct': 0.0990268922844017, 'bull_tp_mult': 1.9207976293400264, 'bull_tsl_mult': 0.6261002202739874, 'bull_time_stop': 148, 'bull_use_sma': True, 'bull_use_ema': False, 'bull_use_atr': False, 'bull_use_adx': False, 'bull_use_spike': True, 'bull_rsi_required': True, 'bear_strategy': 'mean_reversion', 'bear_bb_std_mult': 2.03207507784641, 'bear_rsi_os': 14, 'bear_rsi_ob': 72, 'bear_adx_thresh': 27.740394634662767, 'bear_atr_min_pct': 0.02944549044780516, 'bear_atr_max_pct': 0.09500948589456469, 'bear_tp_mult': 1.7595846844355763, 'bear_tsl_mult': 0.3257883966144326, 'bear_time_stop': 230, 'bear_use_sma': False, 'bear_use_ema': True, 'bear_use_atr': False, 'bear_use_adx': False, 'bear_use_spike': True, 'bear_rsi_required': True, 'sideways_strategy': 'mean_reversion', 'sideways_bb_std_mult': 3.3261606513492405, 'sideways_rsi_os': 37, 'sideways_rsi_ob': 56, 'sideways_adx_thresh': 34.99801104095634, 'sideways_atr_min_pct': 0.019672401331200486, 'sideways_atr_max_pct': 0.0516480802398577, 'sideways_tp_mult': 2.988411191022924, 'sideways_tsl_mult': 0.753626071279154, 'sideways_time_stop': 272, 'sideways_use_sma': False, 'sideways_use_ema': True, 'sideways_use_atr': False, 'sideways_use_adx': False, 'sideways_use_spike': False, 'sideways_rsi_required': True}.
