[I 2025-08-30 22:26:29,834] Trial 811 finished with values: [-1000000000.0, 1000000000.0] and parameters: {'p_sma': 14, 'p_std': 9, 'p_atr': 8, 'p_adx': 22, 'rsi_period': 74, 'ema1': 29, 'ema2': 54, 'slip_atr_k': 0.1558997702703951, 'slip_spread_k': 0.7864188118125728, 'spread_hl_frac': 0.01508592567086603, 'bb_std_mult': 0.9986511392613506, 'rsi_os': 9, 'rsi_ob': 69, 'vol_spike': 0.23880567397640345, 'adx_thresh': 24.54752094076951, 'atr_min_pct': 0.02218745296556631, 'atr_max_pct': 0.14773139046258266, 'tp_mult': 1.7534796844996472, 'tsl_mult': 0.8997258279313085, 'strategy': 'mean_reversion', 'time_stop': 88, 'use_sma': True, 'use_atr': False, 'use_adx': True, 'use_ema': False, 'use_spike': True, 'rsi_required': True, 'edge_k': 0.9885961238249528, 'edge_cap': 0.8388376980755016, 'bull_strategy': 'breakout', 'bull_bb_std_mult': 1.8991303271702102, 'bull_rsi_os': 14, 'bull_rsi_ob': 90, 'bull_adx_thresh': 13.720362513214916, 'bull_atr_min_pct': 0.0031818456178729993, 'bull_atr_max_pct': 0.018480101225793688, 'bull_tp_mult': 1.5368319445166638, 'bull_tsl_mult': 0.40468255892081084, 'bull_time_stop': 284, 'bull_use_sma': True, 'bull_use_ema': True, 'bull_use_atr': False, 'bull_use_adx': False, 'bull_use_spike': True, 'bull_rsi_required': False, 'bear_strategy': 'mean_reversion', 'bear_bb_std_mult': 2.291954193915698, 'bear_rsi_os': 7, 'bear_rsi_ob': 88, 'bear_adx_thresh': 6.095548320223127, 'bear_atr_min_pct': 0.010933572771490959, 'bear_atr_max_pct': 0.10493764260296613, 'bear_tp_mult': 1.6474258943133624, 'bear_tsl_mult': 0.8306902450909788, 'bear_time_stop': 228, 'bear_use_sma': False, 'bear_use_ema': True, 'bear_use_atr': True, 'bear_use_adx': True, 'bear_use_spike': True, 'bear_rsi_required': True, 'sideways_strategy': 'mean_reversion', 'sideways_bb_std_mult': 1.659630631475215, 'sideways_rsi_os': 13, 'sideways_rsi_ob': 89, 'sideways_adx_thresh': 26.642750176079783, 'sideways_atr_min_pct': 0.02302219580167808, 'sideways_atr_max_pct': 0.04465448516534769, 'sideways_tp_mult': 1.360786729444838, 'sideways_tsl_mult': 0.7382406196226188, 'sideways_time_stop': 270, 'sideways_use_sma': True, 'sideways_use_ema': True, 'sideways_use_atr': True, 'sideways_use_adx': False, 'sideways_use_spike': False, 'sideways_rsi_required': True}.
[I 2025-08-30 22:26:30,122] Trial 810 finished with values: [-1000000000.0, 1000000000.0] and parameters: {'p_sma': 23, 'p_std': 60, 'p_atr': 22, 'p_adx': 20, 'rsi_period': 14, 'ema1': 13, 'ema2': 10, 'slip_atr_k': 0.041736345271335996, 'slip_spread_k': 0.6942112453437247, 'spread_hl_frac': 0.015444922425113777, 'bb_std_mult': 3.5499002592295428, 'rsi_os': 5, 'rsi_ob': 93, 'vol_spike': 0.24201684767127013, 'adx_thresh': 10.070236061177457, 'atr_min_pct': 0.023121586355149937, 'atr_max_pct': 0.06647992631206522, 'tp_mult': 2.0192433684239353, 'tsl_mult': 0.8595710369956238, 'strategy': 'mean_reversion', 'time_stop': 113, 'use_sma': True, 'use_atr': True, 'use_adx': True, 'use_ema': True, 'use_spike': True, 'rsi_required': True, 'edge_k': 1.0495050832954012, 'edge_cap': 0.8396146090586176, 'bull_strategy': 'breakout', 'bull_bb_std_mult': 1.8617201483337602, 'bull_rsi_os': 39, 'bull_rsi_ob': 93, 'bull_adx_thresh': 32.41634686220037, 'bull_atr_min_pct': 0.017857861317748382, 'bull_atr_max_pct': 0.01007002818655757, 'bull_tp_mult': 1.537366927189992, 'bull_tsl_mult': 0.40203418834665544, 'bull_time_stop': 282, 'bull_use_sma': True, 'bull_use_ema': False, 'bull_use_atr': False, 'bull_use_adx': False, 'bull_use_spike': True, 'bull_rsi_required': False, 'bear_strategy': 'mean_reversion', 'bear_bb_std_mult': 1.5562893643111286, 'bear_rsi_os': 32, 'bear_rsi_ob': 58, 'bear_adx_thresh': 27.223840917207152, 'bear_atr_min_pct': 0.028361001463800613, 'bear_atr_max_pct': 0.11665341081095723, 'bear_tp_mult': 1.7325627172635985, 'bear_tsl_mult': 0.6730829818540611, 'bear_time_stop': 228, 'bear_use_sma': False, 'bear_use_ema': True, 'bear_use_atr': False, 'bear_use_adx': True, 'bear_use_spike': True, 'bear_rsi_required': False, 'sideways_strategy': 'mean_reversion', 'sideways_bb_std_mult': 1.0658448994568281, 'sideways_rsi_os': 19, 'sideways_rsi_ob': 82, 'sideways_adx_thresh': 34.41218499763289, 'sideways_atr_min_pct': 0.02222327464237126, 'sideways_atr_max_pct': 0.044900151381005456, 'sideways_tp_mult': 2.9694391836278604, 'sideways_tsl_mult': 0.7989202597120099, 'sideways_time_stop': 92, 'sideways_use_sma': False, 'sideways_use_ema': True, 'sideways_use_atr': False, 'sideways_use_adx': False, 'sideways_use_spike': True, 'sideways_rsi_required': True}.
[I 2025-08-30 22:27:08,858] Trial 815 finished with values: [-1000000000.0, 1000000000.0] and parameters: {'p_sma': 42, 'p_std': 38, 'p_atr': 12, 'p_adx': 21, 'rsi_period': 72, 'ema1': 10, 'ema2': 52, 'slip_atr_k': 0.024287220861327244, 'slip_spread_k': 0.9548843448077845, 'spread_hl_frac': 0.04872309703443233, 'bb_std_mult': 0.9025222232286576, 'rsi_os': 12, 'rsi_ob': 62, 'vol_spike': 0.22055348135966313, 'adx_thresh': 8.70622250076131, 'atr_min_pct': 0.011730554104286143, 'atr_max_pct': 0.05027462725294798, 'tp_mult': 1.5386063150263287, 'tsl_mult': 0.5871609980696102, 'strategy': 'mean_reversion', 'time_stop': 97, 'use_sma': False, 'use_atr': False, 'use_adx': True, 'use_ema': False, 'use_spike': True, 'rsi_required': False, 'edge_k': 1.0811557273764392, 'edge_cap': 0.05137021706620315, 'bull_strategy': 'breakout', 'bull_bb_std_mult': 1.0641529655974968, 'bull_rsi_os': 13, 'bull_rsi_ob': 86, 'bull_adx_thresh': 16.151364212803884, 'bull_atr_min_pct': 0.004688456042558246, 'bull_atr_max_pct': 0.09610691715720818, 'bull_tp_mult': 1.3169385379450806, 'bull_tsl_mult': 0.6950167213686238, 'bull_time_stop': 20, 'bull_use_sma': True, 'bull_use_ema': True, 'bull_use_atr': True, 'bull_use_adx': True, 'bull_use_spike': False, 'bull_rsi_required': True, 'bear_strategy': 'breakout', 'bear_bb_std_mult': 1.4721861729065737, 'bear_rsi_os': 10, 'bear_rsi_ob': 76, 'bear_adx_thresh': 23.13741039346422, 'bear_atr_min_pct': 0.00974624706678551, 'bear_atr_max_pct': 0.12571990480605585, 'bear_tp_mult': 1.4904494232558827, 'bear_tsl_mult': 0.3695780426318407, 'bear_time_stop': 247, 'bear_use_sma': True, 'bear_use_ema': True, 'bear_use_atr': True, 'bear_use_adx': True, 'bear_use_spike': False, 'bear_rsi_required': True, 'sideways_strategy': 'breakout', 'sideways_bb_std_mult': 1.769400118068236, 'sideways_rsi_os': 37, 'sideways_rsi_ob': 76, 'sideways_adx_thresh': 9.970274973109895, 'sideways_atr_min_pct': 0.021069311071188406, 'sideways_atr_max_pct': 0.13734420990498056, 'sideways_tp_mult': 1.6293331615733204, 'sideways_tsl_mult': 0.7205168075323178, 'sideways_time_stop': 300, 'sideways_use_sma': True, 'sideways_use_ema': False, 'sideways_use_atr': True, 'sideways_use_adx': True, 'sideways_use_spike': False, 'sideways_rsi_required': False}.
[I 2025-08-30 22:27:09,635] Trial 813 finished with values: [-1000000000.0, 1000000000.0] and parameters: {'p_sma': 15, 'p_std': 38, 'p_atr': 22, 'p_adx': 20, 'rsi_period': 73, 'ema1': 9, 'ema2': 54, 'slip_atr_k': 0.024309983294258673, 'slip_spread_k': 0.6911459119656895, 'spread_hl_frac': 0.032092731994643485, 'bb_std_mult': 0.9665820408347015, 'rsi_os': 12, 'rsi_ob': 65, 'vol_spike': 0.21122558476511627, 'adx_thresh': 24.161623943461844, 'atr_min_pct': 0.01155531647612915, 'atr_max_pct': 0.05006110126162054, 'tp_mult': 2.037977157601966, 'tsl_mult': 0.858606468408147, 'strategy': 'mean_reversion', 'time_stop': 89, 'use_sma': True, 'use_atr': False, 'use_adx': True, 'use_ema': False, 'use_spike': True, 'rsi_required': True, 'edge_k': 1.0694078463931527, 'edge_cap': 0.8188118694106022, 'bull_strategy': 'breakout', 'bull_bb_std_mult': 2.072497908322667, 'bull_rsi_os': 14, 'bull_rsi_ob': 61, 'bull_adx_thresh': 16.182855905357524, 'bull_atr_min_pct': 0.004630892872671115, 'bull_atr_max_pct': 0.05257154752530969, 'bull_tp_mult': 2.8678525746267463, 'bull_tsl_mult': 0.20938937233432348, 'bull_time_stop': 283, 'bull_use_sma': True, 'bull_use_ema': True, 'bull_use_atr': False, 'bull_use_adx': True, 'bull_use_spike': True, 'bull_rsi_required': False, 'bear_strategy': 'mean_reversion', 'bear_bb_std_mult': 2.209208375630566, 'bear_rsi_os': 55, 'bear_rsi_ob': 48, 'bear_adx_thresh': 27.20954088478091, 'bear_atr_min_pct': 0.029511625530207947, 'bear_atr_max_pct': 0.0627737129260226, 'bear_tp_mult': 1.4956383153580228, 'bear_tsl_mult': 0.36935020440528055, 'bear_time_stop': 228, 'bear_use_sma': True, 'bear_use_ema': True, 'bear_use_atr': True, 'bear_use_adx': True, 'bear_use_spike': False, 'bear_rsi_required': True, 'sideways_strategy': 'mean_reversion', 'sideways_bb_std_mult': 1.6776990510181862, 'sideways_rsi_os': 16, 'sideways_rsi_ob': 53, 'sideways_adx_thresh': 26.357599606503435, 'sideways_atr_min_pct': 0.023196386485936048, 'sideways_atr_max_pct': 0.04459264261151778, 'sideways_tp_mult': 1.6467045648951413, 'sideways_tsl_mult': 0.7218063155090498, 'sideways_time_stop': 272, 'sideways_use_sma': True, 'sideways_use_ema': True, 'sideways_use_atr': True, 'sideways_use_adx': False, 'sideways_use_spike': False, 'sideways_rsi_required': True}.
[I 2025-08-30 22:27:09,661] Trial 814 finished with values: [-1000000000.0, 1000000000.0] and parameters: {'p_sma': 18, 'p_std': 38, 'p_atr': 12, 'p_adx': 20, 'rsi_period': 28, 'ema1': 9, 'ema2': 24, 'slip_atr_k': 0.02218766619049098, 'slip_spread_k': 0.6885023725516956, 'spread_hl_frac': 0.0320700213546184, 'bb_std_mult': 1.0912649572335096, 'rsi_os': 7, 'rsi_ob': 65, 'vol_spike': 0.2796260599701506, 'adx_thresh': 9.05121131539741, 'atr_min_pct': 0.008038100100109287, 'atr_max_pct': 0.022503714761298154, 'tp_mult': 2.021099168091514, 'tsl_mult': 0.20010734031182703, 'strategy': 'mean_reversion', 'time_stop': 250, 'use_sma': True, 'use_atr': True, 'use_adx': True, 'use_ema': True, 'use_spike': True, 'rsi_required': True, 'edge_k': 0.9274873277147275, 'edge_cap': 0.8666603413945551, 'bull_strategy': 'breakout', 'bull_bb_std_mult': 1.6550044169832425, 'bull_rsi_os': 13, 'bull_rsi_ob': 86, 'bull_adx_thresh': 15.922090501121927, 'bull_atr_min_pct': 0.0006513569021789941, 'bull_atr_max_pct': 0.12043877949116558, 'bull_tp_mult': 1.309297780216029, 'bull_tsl_mult': 0.0362985416163909, 'bull_time_stop': 289, 'bull_use_sma': True, 'bull_use_ema': False, 'bull_use_atr': False, 'bull_use_adx': True, 'bull_use_spike': True, 'bull_rsi_required': True, 'bear_strategy': 'breakout', 'bear_bb_std_mult': 1.461457625783345, 'bear_rsi_os': 16, 'bear_rsi_ob': 61, 'bear_adx_thresh': 26.88723438268398, 'bear_atr_min_pct': 0.029490893499777373, 'bear_atr_max_pct': 0.13838722441855864, 'bear_tp_mult': 1.501877876855993, 'bear_tsl_mult': 0.37079430936102026, 'bear_time_stop': 62, 'bear_use_sma': True, 'bear_use_ema': True, 'bear_use_atr': False, 'bear_use_adx': True, 'bear_use_spike': False, 'bear_rsi_required': True, 'sideways_strategy': 'mean_reversion', 'sideways_bb_std_mult': 1.760856068561809, 'sideways_rsi_os': 7, 'sideways_rsi_ob': 88, 'sideways_adx_thresh': 30.43232621014363, 'sideways_atr_min_pct': 0.020553617205311632, 'sideways_atr_max_pct': 0.033902584606140256, 'sideways_tp_mult': 1.6316633980668804, 'sideways_tsl_mult': 0.8066428044756389, 'sideways_time_stop': 57, 'sideways_use_sma': False, 'sideways_use_ema': True, 'sideways_use_atr': False, 'sideways_use_adx': False, 'sideways_use_spike': False, 'sideways_rsi_required': True}.
[I 2025-08-30 22:27:09,835] Trial 812 finished with values: [-1000000000.0, 1000000000.0] and parameters: {'p_sma': 21, 'p_std': 60, 'p_atr': 22, 'p_adx': 20, 'rsi_period': 72, 'ema1': 13, 'ema2': 17, 'slip_atr_k': 0.16589656745349107, 'slip_spread_k': 0.691348552868636, 'spread_hl_frac': 0.0376122221376592, 'bb_std_mult': 1.0074083794031108, 'rsi_os': 12, 'rsi_ob': 64, 'vol_spike': 0.08314050126495708, 'adx_thresh': 25.644468596991324, 'atr_min_pct': 0.011537353964861972, 'atr_max_pct': 0.06665302207474165, 'tp_mult': 2.026230592973549, 'tsl_mult': 0.3545323424564013, 'strategy': 'mean_reversion', 'time_stop': 92, 'use_sma': True, 'use_atr': False, 'use_adx': True, 'use_ema': False, 'use_spike': True, 'rsi_required': True, 'edge_k': 0.9909247653964175, 'edge_cap': 0.8289719707013697, 'bull_strategy': 'breakout', 'bull_bb_std_mult': 2.080085848549226, 'bull_rsi_os': 17, 'bull_rsi_ob': 89, 'bull_adx_thresh': 11.610406107891084, 'bull_atr_min_pct': 0.0020228369935375214, 'bull_atr_max_pct': 0.04692434346644587, 'bull_tp_mult': 1.7918883946324708, 'bull_tsl_mult': 0.035556875884061145, 'bull_time_stop': 17, 'bull_use_sma': True, 'bull_use_ema': True, 'bull_use_atr': False, 'bull_use_adx': False, 'bull_use_spike': True, 'bull_rsi_required': False, 'bear_strategy': 'mean_reversion', 'bear_bb_std_mult': 3.4584576101021622, 'bear_rsi_os': 48, 'bear_rsi_ob': 61, 'bear_adx_thresh': 31.849117948588187, 'bear_atr_min_pct': 0.0060458369539622275, 'bear_atr_max_pct': 0.06417206477237065, 'bear_tp_mult': 1.5037200539579012, 'bear_tsl_mult': 0.8782516834216348, 'bear_time_stop': 62, 'bear_use_sma': True, 'bear_use_ema': True, 'bear_use_atr': True, 'bear_use_adx': True, 'bear_use_spike': False, 'bear_rsi_required': True, 'sideways_strategy': 'mean_reversion', 'sideways_bb_std_mult': 1.6665846013018142, 'sideways_rsi_os': 37, 'sideways_rsi_ob': 89, 'sideways_adx_thresh': 20.228692274327404, 'sideways_atr_min_pct': 0.022913835378943963, 'sideways_atr_max_pct': 0.04435723300001542, 'sideways_tp_mult': 1.3571892026232781, 'sideways_tsl_mult': 0.7502537349514073, 'sideways_time_stop': 53, 'sideways_use_sma': True, 'sideways_use_ema': True, 'sideways_use_atr': True, 'sideways_use_adx': False, 'sideways_use_spike': False, 'sideways_rsi_required': True}.
[I 2025-08-30 22:27:11,150] Trial 816 finished with values: [-1000000000.0, 1000000000.0] and parameters: {'p_sma': 32, 'p_std': 33, 'p_atr': 7, 'p_adx': 20, 'rsi_period': 71, 'ema1': 9, 'ema2': 41, 'slip_atr_k': 0.2054610556301759, 'slip_spread_k': 0.6127424190041274, 'spread_hl_frac': 0.03208290803628539, 'bb_std_mult': 0.7810299901456881, 'rsi_os': 25, 'rsi_ob': 49, 'vol_spike': 0.2842120458423387, 'adx_thresh': 20.901851294599876, 'atr_min_pct': 0.012668357881692812, 'atr_max_pct': 0.022348000477354767, 'tp_mult': 1.6509518531849643, 'tsl_mult': 0.8781794474272087, 'strategy': 'mean_reversion', 'time_stop': 194, 'use_sma': True, 'use_atr': True, 'use_adx': True, 'use_ema': True, 'use_spike': True, 'rsi_required': True, 'edge_k': 0.9238706699891818, 'edge_cap': 0.17589853207040496, 'bull_strategy': 'mean_reversion', 'bull_bb_std_mult': 2.7874616812263797, 'bull_rsi_os': 18, 'bull_rsi_ob': 89, 'bull_adx_thresh': 10.662639753973766, 'bull_atr_min_pct': 0.010406275881357816, 'bull_atr_max_pct': 0.05260077074387243, 'bull_tp_mult': 1.7539506308763355, 'bull_tsl_mult': 0.03125995796739234, 'bull_time_stop': 221, 'bull_use_sma': False, 'bull_use_ema': False, 'bull_use_atr': False, 'bull_use_adx': False, 'bull_use_spike': False, 'bull_rsi_required': True, 'bear_strategy': 'mean_reversion', 'bear_bb_std_mult': 3.1326446409373645, 'bear_rsi_os': 5, 'bear_rsi_ob': 60, 'bear_adx_thresh': 21.351326133162797, 'bear_atr_min_pct': 0.02944964427795024, 'bear_atr_max_pct': 0.09648080288740775, 'bear_tp_mult': 1.816708944575282, 'bear_tsl_mult': 0.3920525458897119, 'bear_time_stop': 270, 'bear_use_sma': True, 'bear_use_ema': False, 'bear_use_atr': False, 'bear_use_adx': True, 'bear_use_spike': False, 'bear_rsi_required': True, 'sideways_strategy': 'breakout', 'sideways_bb_std_mult': 1.6848875119016973, 'sideways_rsi_os': 40, 'sideways_rsi_ob': 79, 'sideways_adx_thresh': 30.466556787043196, 'sideways_atr_min_pct': 0.003273786390981269, 'sideways_atr_max_pct': 0.03364241252026661, 'sideways_tp_mult': 1.8433013582188114, 'sideways_tsl_mult': 0.7805812427112206, 'sideways_time_stop': 262, 'sideways_use_sma': False, 'sideways_use_ema': False, 'sideways_use_atr': False, 'sideways_use_adx': True, 'sideways_use_spike': False, 'sideways_rsi_required': False}.
[I 2025-08-30 22:27:43,572] Trial 817 finished with values: [-1000000000.0, 1000000000.0] and parameters: {'p_sma': 32, 'p_std': 33, 'p_atr': 24, 'p_adx': 16, 'rsi_period': 71, 'ema1': 12, 'ema2': 41, 'slip_atr_k': 0.09715253591061931, 'slip_spread_k': 0.6557896598218784, 'spread_hl_frac': 0.010748319759666534, 'bb_std_mult': 0.7762592656392355, 'rsi_os': 24, 'rsi_ob': 63, 'vol_spike': 0.08310152696224164, 'adx_thresh': 10.791728170584477, 'atr_min_pct': 0.029927589558442096, 'atr_max_pct': 0.12331669724939959, 'tp_mult': 1.8417934697750797, 'tsl_mult': 0.9216306042477257, 'strategy': 'mean_reversion', 'time_stop': 73, 'use_sma': False, 'use_atr': True, 'use_adx': True, 'use_ema': True, 'use_spike': True, 'rsi_required': True, 'edge_k': 0.9757484575174619, 'edge_cap': 0.7553993484574579, 'bull_strategy': 'mean_reversion', 'bull_bb_std_mult': 1.7607185013522677, 'bull_rsi_os': 17, 'bull_rsi_ob': 57, 'bull_adx_thresh': 14.578443434835375, 'bull_atr_min_pct': 0.002066782906679714, 'bull_atr_max_pct': 0.04530965423133947, 'bull_tp_mult': 1.7527134783027765, 'bull_tsl_mult': 0.4440646233593144, 'bull_time_stop': 169, 'bull_use_sma': False, 'bull_use_ema': False, 'bull_use_atr': False, 'bull_use_adx': False, 'bull_use_spike': False, 'bull_rsi_required': True, 'bear_strategy': 'mean_reversion', 'bear_bb_std_mult': 1.9261032543770626, 'bear_rsi_os': 5, 'bear_rsi_ob': 72, 'bear_adx_thresh': 28.13314253697682, 'bear_atr_min_pct': 0.02898252205825491, 'bear_atr_max_pct': 0.12084511423702764, 'bear_tp_mult': 1.5444023795936832, 'bear_tsl_mult': 0.2878203353149098, 'bear_time_stop': 181, 'bear_use_sma': False, 'bear_use_ema': False, 'bear_use_atr': False, 'bear_use_adx': True, 'bear_use_spike': True, 'bear_rsi_required': True, 'sideways_strategy': 'breakout', 'sideways_bb_std_mult': 1.2938457421532987, 'sideways_rsi_os': 40, 'sideways_rsi_ob': 90, 'sideways_adx_thresh': 20.310129912007476, 'sideways_atr_min_pct': 0.020302872673994356, 'sideways_atr_max_pct': 0.03953120927283142, 'sideways_tp_mult': 1.8435033055339545, 'sideways_tsl_mult': 0.7760247390812699, 'sideways_time_stop': 233, 'sideways_use_sma': False, 'sideways_use_ema': False, 'sideways_use_atr': False, 'sideways_use_adx': True, 'sideways_use_spike': False, 'sideways_rsi_required': False}.
[I 2025-08-30 22:27:44,387] Trial 819 finished with values: [-1000000000.0, 1000000000.0] and parameters: {'p_sma': 47, 'p_std': 33, 'p_atr': 21, 'p_adx': 28, 'rsi_period': 70, 'ema1': 12, 'ema2': 41, 'slip_atr_k': 0.2068495852570053, 'slip_spread_k': 0.6130946345115249, 'spread_hl_frac': 0.02239895074720477, 'bb_std_mult': 0.7635538162723382, 'rsi_os': 35, 'rsi_ob': 49, 'vol_spike': 0.028569973936848528, 'adx_thresh': 21.166379639042095, 'atr_min_pct': 0.012676325551442321, 'atr_max_pct': 0.12340116295351616, 'tp_mult': 2.111825123661457, 'tsl_mult': 0.8809663625566613, 'strategy': 'breakout', 'time_stop': 75, 'use_sma': False, 'use_atr': True, 'use_adx': False, 'use_ema': True, 'use_spike': False, 'rsi_required': False, 'edge_k': 0.9260061421458592, 'edge_cap': 0.7416759433877725, 'bull_strategy': 'mean_reversion', 'bull_bb_std_mult': 1.8100824060247467, 'bull_rsi_os': 21, 'bull_rsi_ob': 88, 'bull_adx_thresh': 25.052150132643227, 'bull_atr_min_pct': 0.01646279223638021, 'bull_atr_max_pct': 0.05114477245137143, 'bull_tp_mult': 1.0652346647361672, 'bull_tsl_mult': 0.5170076928107753, 'bull_time_stop': 252, 'bull_use_sma': False, 'bull_use_ema': False, 'bull_use_atr': True, 'bull_use_adx': False, 'bull_use_spike': False, 'bull_rsi_required': True, 'bear_strategy': 'mean_reversion', 'bear_bb_std_mult': 1.9141803840047258, 'bear_rsi_os': 5, 'bear_rsi_ob': 72, 'bear_adx_thresh': 28.33194487901488, 'bear_atr_min_pct': 0.029100001876120697, 'bear_atr_max_pct': 0.14526387122682766, 'bear_tp_mult': 1.2310225400081363, 'bear_tsl_mult': 0.424186886550974, 'bear_time_stop': 245, 'bear_use_sma': False, 'bear_use_ema': False, 'bear_use_atr': False, 'bear_use_adx': True, 'bear_use_spike': True, 'bear_rsi_required': True, 'sideways_strategy': 'breakout', 'sideways_bb_std_mult': 3.165063879271761, 'sideways_rsi_os': 26, 'sideways_rsi_ob': 87, 'sideways_adx_thresh': 28.470134033162523, 'sideways_atr_min_pct': 0.020274444537720534, 'sideways_atr_max_pct': 0.04030473989890894, 'sideways_tp_mult': 1.740446077075337, 'sideways_tsl_mult': 0.7762150116094758, 'sideways_time_stop': 139, 'sideways_use_sma': False, 'sideways_use_ema': False, 'sideways_use_atr': False, 'sideways_use_adx': True, 'sideways_use_spike': False, 'sideways_rsi_required': False}.
