[I 2025-08-30 20:49:14,334] Trial 20 finished with values: [-1000000000.0, 1000000000.0] and parameters: {'p_sma': 35, 'p_std': 55, 'p_atr': 23, 'p_adx': 14, 'rsi_period': 33, 'ema1': 19, 'ema2': 49, 'slip_atr_k': 0.1099686637631705, 'slip_spread_k': 0.4222049058800636, 'spread_hl_frac': 0.016986761110208706, 'bb_std_mult': 1.7533389725368478, 'rsi_os': 55, 'rsi_ob': 55, 'vol_spike': 0.1240002380750431, 'adx_thresh': 11.772568625418083, 'atr_min_pct': 0.02179052428906038, 'atr_max_pct': 0.12064710606926402, 'tp_mult': 1.0359696083228624, 'tsl_mult': 0.7239244125752649, 'strategy': 'mean_reversion', 'time_stop': 144, 'use_sma': True, 'use_atr': False, 'use_adx': True, 'use_ema': False, 'use_spike': True, 'rsi_required': True, 'edge_k': 0.9955017072926863, 'edge_cap': 0.6688833273790353, 'bull_strategy': 'breakout', 'bull_bb_std_mult': 1.7403663350936078, 'bull_rsi_os': 46, 'bull_rsi_ob': 77, 'bull_adx_thresh': 11.850121617935422, 'bull_atr_min_pct': 0.010452408017263642, 'bull_atr_max_pct': 0.11943282234783986, 'bull_tp_mult': 1.4182455596594878, 'bull_tsl_mult': 0.170873842982811, 'bull_time_stop': 178, 'bull_use_sma': False, 'bull_use_ema': False, 'bull_use_atr': False, 'bull_use_adx': True, 'bull_use_spike': False, 'bull_rsi_required': False, 'bear_strategy': 'mean_reversion', 'bear_bb_std_mult': 0.9408387983761557, 'bear_rsi_os': 30, 'bear_rsi_ob': 95, 'bear_adx_thresh': 18.432519985844547, 'bear_atr_min_pct': 0.022028115909479097, 'bear_atr_max_pct': 0.05957903728782983, 'bear_tp_mult': 2.997701907352447, 'bear_tsl_mult': 0.36452738370911003, 'bear_time_stop': 131, 'bear_use_sma': True, 'bear_use_ema': False, 'bear_use_atr': False, 'bear_use_adx': True, 'bear_use_spike': True, 'bear_rsi_required': True, 'sideways_strategy': 'mean_reversion', 'sideways_bb_std_mult': 1.7638670359221529, 'sideways_rsi_os': 5, 'sideways_rsi_ob': 79, 'sideways_adx_thresh': 22.99009052546502, 'sideways_atr_min_pct': 0.017577566383012694, 'sideways_atr_max_pct': 0.059105685816597246, 'sideways_tp_mult': 2.308149215630504, 'sideways_tsl_mult': 0.3185826729159584, 'sideways_time_stop': 143, 'sideways_use_sma': False, 'sideways_use_ema': False, 'sideways_use_atr': False, 'sideways_use_adx': False, 'sideways_use_spike': False, 'sideways_rsi_required': False}.
[I 2025-08-30 20:49:14,662] Trial 21 finished with values: [-1000000000.0, 1000000000.0] and parameters: {'p_sma': 27, 'p_std': 38, 'p_atr': 11, 'p_adx': 7, 'rsi_period': 32, 'ema1': 18, 'ema2': 34, 'slip_atr_k': 0.12007182762636515, 'slip_spread_k': 0.49011494376648435, 'spread_hl_frac': 0.017310348858186917, 'bb_std_mult': 0.595678236221937, 'rsi_os': 53, 'rsi_ob': 51, 'vol_spike': 0.13773954025598642, 'adx_thresh': 5.115104555245772, 'atr_min_pct': 0.00981382627633143, 'atr_max_pct': 0.1155510579006476, 'tp_mult': 1.0922051929501324, 'tsl_mult': 0.7292522127850954, 'strategy': 'mean_reversion', 'time_stop': 160, 'use_sma': True, 'use_atr': False, 'use_adx': False, 'use_ema': True, 'use_spike': False, 'rsi_required': False, 'edge_k': 1.0134257042898558, 'edge_cap': 0.6851121318709363, 'bull_strategy': 'breakout', 'bull_bb_std_mult': 1.115531866985988, 'bull_rsi_os': 19, 'bull_rsi_ob': 78, 'bull_adx_thresh': 11.181109337107586, 'bull_atr_min_pct': 0.011146410292951442, 'bull_atr_max_pct': 0.052090813105754454, 'bull_tp_mult': 2.5918343672169386, 'bull_tsl_mult': 0.5365063141978315, 'bull_time_stop': 174, 'bull_use_sma': False, 'bull_use_ema': True, 'bull_use_atr': False, 'bull_use_adx': True, 'bull_use_spike': False, 'bull_rsi_required': False, 'bear_strategy': 'mean_reversion', 'bear_bb_std_mult': 0.5074690580137577, 'bear_rsi_os': 31, 'bear_rsi_ob': 48, 'bear_adx_thresh': 17.352248347635715, 'bear_atr_min_pct': 0.022069823990067263, 'bear_atr_max_pct': 0.09976925205139889, 'bear_tp_mult': 1.873470010286004, 'bear_tsl_mult': 0.3764986208860792, 'bear_time_stop': 47, 'bear_use_sma': True, 'bear_use_ema': True, 'bear_use_atr': False, 'bear_use_adx': True, 'bear_use_spike': True, 'bear_rsi_required': True, 'sideways_strategy': 'mean_reversion', 'sideways_bb_std_mult': 0.5101587347788077, 'sideways_rsi_os': 5, 'sideways_rsi_ob': 53, 'sideways_adx_thresh': 23.446367453378688, 'sideways_atr_min_pct': 0.016929290721408544, 'sideways_atr_max_pct': 0.059363609780157325, 'sideways_tp_mult': 1.0282633856737506, 'sideways_tsl_mult': 0.7908516826320069, 'sideways_time_stop': 174, 'sideways_use_sma': False, 'sideways_use_ema': True, 'sideways_use_atr': True, 'sideways_use_adx': False, 'sideways_use_spike': False, 'sideways_rsi_required': True}.
[I 2025-08-30 20:49:14,812] Trial 18 finished with values: [-1000000000.0, 1000000000.0] and parameters: {'p_sma': 36, 'p_std': 57, 'p_atr': 26, 'p_adx': 13, 'rsi_period': 84, 'ema1': 18, 'ema2': 27, 'slip_atr_k': 0.011157071906624072, 'slip_spread_k': 0.9062291080080331, 'spread_hl_frac': 0.0004953775607934412, 'bb_std_mult': 1.66866462562338, 'rsi_os': 17, 'rsi_ob': 63, 'vol_spike': 0.06441485411797075, 'adx_thresh': 11.793762446843381, 'atr_min_pct': 0.02230000389831935, 'atr_max_pct': 0.05334873940307457, 'tp_mult': 2.863061358948966, 'tsl_mult': 0.6950006102657993, 'strategy': 'mean_reversion', 'time_stop': 70, 'use_sma': True, 'use_atr': False, 'use_adx': True, 'use_ema': False, 'use_spike': True, 'rsi_required': True, 'edge_k': 0.4026627483909011, 'edge_cap': 0.7168144539389714, 'bull_strategy': 'breakout', 'bull_bb_std_mult': 2.1009632200906365, 'bull_rsi_os': 51, 'bull_rsi_ob': 45, 'bull_adx_thresh': 12.133137876718326, 'bull_atr_min_pct': 0.021399500091058832, 'bull_atr_max_pct': 0.014992268230144865, 'bull_tp_mult': 1.5892354083905647, 'bull_tsl_mult': 0.1007230123758569, 'bull_time_stop': 112, 'bull_use_sma': False, 'bull_use_ema': False, 'bull_use_atr': False, 'bull_use_adx': True, 'bull_use_spike': False, 'bull_rsi_required': False, 'bear_strategy': 'mean_reversion', 'bear_bb_std_mult': 1.2781735432816304, 'bear_rsi_os': 45, 'bear_rsi_ob': 94, 'bear_adx_thresh': 25.035249336759648, 'bear_atr_min_pct': 0.014010221082741782, 'bear_atr_max_pct': 0.058324989514361616, 'bear_tp_mult': 2.4601667762560218, 'bear_tsl_mult': 0.37807776120345593, 'bear_time_stop': 127, 'bear_use_sma': True, 'bear_use_ema': False, 'bear_use_atr': False, 'bear_use_adx': True, 'bear_use_spike': True, 'bear_rsi_required': True, 'sideways_strategy': 'mean_reversion', 'sideways_bb_std_mult': 3.4513944565372072, 'sideways_rsi_os': 5, 'sideways_rsi_ob': 63, 'sideways_adx_thresh': 30.065610654325667, 'sideways_atr_min_pct': 0.018423385055998182, 'sideways_atr_max_pct': 0.024078674116229968, 'sideways_tp_mult': 1.8221987135009339, 'sideways_tsl_mult': 0.27663205033235977, 'sideways_time_stop': 153, 'sideways_use_sma': False, 'sideways_use_ema': False, 'sideways_use_atr': True, 'sideways_use_adx': False, 'sideways_use_spike': False, 'sideways_rsi_required': False}.
[I 2025-08-30 20:49:40,725] Trial 19 finished with values: [-1000000000.0, 1000000000.0] and parameters: {'p_sma': 37, 'p_std': 55, 'p_atr': 26, 'p_adx': 14, 'rsi_period': 33, 'ema1': 18, 'ema2': 27, 'slip_atr_k': 0.1751580426180493, 'slip_spread_k': 0.8907774095899027, 'spread_hl_frac': 0.0001292628773210576, 'bb_std_mult': 1.5165406152242582, 'rsi_os': 16, 'rsi_ob': 59, 'vol_spike': 0.0610600012615735, 'adx_thresh': 11.052731963421488, 'atr_min_pct': 0.02257759391520286, 'atr_max_pct': 0.05395865244560542, 'tp_mult': 2.905017386170138, 'tsl_mult': 0.7758483151505845, 'strategy': 'mean_reversion', 'time_stop': 94, 'use_sma': True, 'use_atr': False, 'use_adx': True, 'use_ema': False, 'use_spike': True, 'rsi_required': True, 'edge_k': 0.40724772066115544, 'edge_cap': 0.7329567879633646, 'bull_strategy': 'breakout', 'bull_bb_std_mult': 2.013531041542718, 'bull_rsi_os': 53, 'bull_rsi_ob': 71, 'bull_adx_thresh': 12.787777071988025, 'bull_atr_min_pct': 0.02187820789489016, 'bull_atr_max_pct': 0.11847685525337318, 'bull_tp_mult': 1.570909096094521, 'bull_tsl_mult': 0.0960293536033375, 'bull_time_stop': 17, 'bull_use_sma': False, 'bull_use_ema': False, 'bull_use_atr': False, 'bull_use_adx': True, 'bull_use_spike': False, 'bull_rsi_required': False, 'bear_strategy': 'mean_reversion', 'bear_bb_std_mult': 1.2374032605857916, 'bear_rsi_os': 45, 'bear_rsi_ob': 95, 'bear_adx_thresh': 24.81731072814918, 'bear_atr_min_pct': 0.012154104350029366, 'bear_atr_max_pct': 0.06413447777865264, 'bear_tp_mult': 1.8983433481336252, 'bear_tsl_mult': 0.13537458222730517, 'bear_time_stop': 134, 'bear_use_sma': True, 'bear_use_ema': False, 'bear_use_atr': False, 'bear_use_adx': True, 'bear_use_spike': True, 'bear_rsi_required': True, 'sideways_strategy': 'mean_reversion', 'sideways_bb_std_mult': 3.5026040282505995, 'sideways_rsi_os': 30, 'sideways_rsi_ob': 78, 'sideways_adx_thresh': 29.53067999162909, 'sideways_atr_min_pct': 0.018925228785220967, 'sideways_atr_max_pct': 0.016285951087535517, 'sideways_tp_mult': 1.6638069996679872, 'sideways_tsl_mult': 0.2835162515329035, 'sideways_time_stop': 150, 'sideways_use_sma': False, 'sideways_use_ema': False, 'sideways_use_atr': False, 'sideways_use_adx': False, 'sideways_use_spike': False, 'sideways_rsi_required': False}.
[I 2025-08-30 20:49:46,405] Trial 24 finished with values: [-1000000000.0, 1000000000.0] and parameters: {'p_sma': 44, 'p_std': 50, 'p_atr': 23, 'p_adx': 25, 'rsi_period': 33, 'ema1': 15, 'ema2': 38, 'slip_atr_k': 0.18318525992348778, 'slip_spread_k': 0.6225118822122431, 'spread_hl_frac': 0.028793588801629164, 'bb_std_mult': 3.2932895932821404, 'rsi_os': 27, 'rsi_ob': 83, 'vol_spike': 0.044937091145890326, 'adx_thresh': 30.340167402569744, 'atr_min_pct': 0.011443274442873035, 'atr_max_pct': 0.06777788985031355, 'tp_mult': 1.5630560761886376, 'tsl_mult': 0.19792303105634512, 'strategy': 'mean_reversion', 'time_stop': 184, 'use_sma': True, 'use_atr': True, 'use_adx': True, 'use_ema': True, 'use_spike': True, 'rsi_required': True, 'edge_k': 0.07790937423347644, 'edge_cap': 0.4375311994998797, 'bull_strategy': 'breakout', 'bull_bb_std_mult': 1.1127410906903437, 'bull_rsi_os': 36, 'bull_rsi_ob': 87, 'bull_adx_thresh': 16.05515326332247, 'bull_atr_min_pct': 0.013463928047356048, 'bull_atr_max_pct': 0.038627710563263265, 'bull_tp_mult': 2.228371064323082, 'bull_tsl_mult': 0.32283809828247473, 'bull_time_stop': 225, 'bull_use_sma': False, 'bull_use_ema': False, 'bull_use_atr': True, 'bull_use_adx': True, 'bull_use_spike': False, 'bull_rsi_required': True, 'bear_strategy': 'breakout', 'bear_bb_std_mult': 1.7400373198608254, 'bear_rsi_os': 51, 'bear_rsi_ob': 80, 'bear_adx_thresh': 29.80112684139598, 'bear_atr_min_pct': 0.009023044366044832, 'bear_atr_max_pct': 0.10247737744492404, 'bear_tp_mult': 2.2598645628242355, 'bear_tsl_mult': 0.6159332187933226, 'bear_time_stop': 39, 'bear_use_sma': True, 'bear_use_ema': False, 'bear_use_atr': False, 'bear_use_adx': False, 'bear_use_spike': False, 'bear_rsi_required': True, 'sideways_strategy': 'mean_reversion', 'sideways_bb_std_mult': 2.556241064129914, 'sideways_rsi_os': 18, 'sideways_rsi_ob': 50, 'sideways_adx_thresh': 7.110657700658942, 'sideways_atr_min_pct': 0.02348319249889229, 'sideways_atr_max_pct': 0.09286312269398035, 'sideways_tp_mult': 2.9214165089499433, 'sideways_tsl_mult': 0.7689778447036447, 'sideways_time_stop': 48, 'sideways_use_sma': True, 'sideways_use_ema': False, 'sideways_use_atr': False, 'sideways_use_adx': False, 'sideways_use_spike': False, 'sideways_rsi_required': False}.
[I 2025-08-30 20:49:46,603] Trial 23 finished with values: [-1000000000.0, 1000000000.0] and parameters: {'p_sma': 42, 'p_std': 51, 'p_atr': 27, 'p_adx': 25, 'rsi_period': 13, 'ema1': 17, 'ema2': 39, 'slip_atr_k': 0.17617945189449558, 'slip_spread_k': 0.5934609678859127, 'spread_hl_frac': 0.029536934100377287, 'bb_std_mult': 3.2763102406160733, 'rsi_os': 19, 'rsi_ob': 70, 'vol_spike': 0.05706620189960336, 'adx_thresh': 21.174407942602336, 'atr_min_pct': 0.011338864016381673, 'atr_max_pct': 0.06606713262989689, 'tp_mult': 1.6726549801968078, 'tsl_mult': 0.20016551276444777, 'strategy': 'mean_reversion', 'time_stop': 55, 'use_sma': True, 'use_atr': True, 'use_adx': True, 'use_ema': False, 'use_spike': True, 'rsi_required': True, 'edge_k': 0.02119118905393802, 'edge_cap': 0.42279197221922415, 'bull_strategy': 'breakout', 'bull_bb_std_mult': 1.1135916235076797, 'bull_rsi_os': 33, 'bull_rsi_ob': 57, 'bull_adx_thresh': 16.629056286462585, 'bull_atr_min_pct': 0.0032223958790581157, 'bull_atr_max_pct': 0.05761979180423474, 'bull_tp_mult': 2.3122894593730803, 'bull_tsl_mult': 0.2630560431151954, 'bull_time_stop': 239, 'bull_use_sma': False, 'bull_use_ema': False, 'bull_use_atr': False, 'bull_use_adx': True, 'bull_use_spike': False, 'bull_rsi_required': True, 'bear_strategy': 'breakout', 'bear_bb_std_mult': 1.7221745700659201, 'bear_rsi_os': 55, 'bear_rsi_ob': 80, 'bear_adx_thresh': 29.63223434579634, 'bear_atr_min_pct': 0.006223518425138511, 'bear_atr_max_pct': 0.11880802621059376, 'bear_tp_mult': 2.312607946242364, 'bear_tsl_mult': 0.6462483524495142, 'bear_time_stop': 289, 'bear_use_sma': True, 'bear_use_ema': False, 'bear_use_atr': False, 'bear_use_adx': False, 'bear_use_spike': True, 'bear_rsi_required': True, 'sideways_strategy': 'mean_reversion', 'sideways_bb_std_mult': 2.6463020202180068, 'sideways_rsi_os': 26, 'sideways_rsi_ob': 48, 'sideways_adx_thresh': 27.04775440742437, 'sideways_atr_min_pct': 0.02272511686390783, 'sideways_atr_max_pct': 0.02627246089843132, 'sideways_tp_mult': 2.790359733802989, 'sideways_tsl_mult': 0.9913599600958902, 'sideways_time_stop': 57, 'sideways_use_sma': False, 'sideways_use_ema': False, 'sideways_use_atr': False, 'sideways_use_adx': False, 'sideways_use_spike': False, 'sideways_rsi_required': False}.
[I 2025-08-30 20:49:46,937] Trial 22 finished with values: [-1000000000.0, 1000000000.0] and parameters: {'p_sma': 28, 'p_std': 38, 'p_atr': 11, 'p_adx': 8, 'rsi_period': 9, 'ema1': 15, 'ema2': 37, 'slip_atr_k': 0.12545565989271693, 'slip_spread_k': 0.0021233289826830815, 'spread_hl_frac': 0.031121272451098393, 'bb_std_mult': 3.3728042789115653, 'rsi_os': 17, 'rsi_ob': 56, 'vol_spike': 0.15002171443491832, 'adx_thresh': 5.271475209959112, 'atr_min_pct': 0.010661708487669428, 'atr_max_pct': 0.1468887141148522, 'tp_mult': 1.6776269820798289, 'tsl_mult': 0.23841732245235892, 'strategy': 'mean_reversion', 'time_stop': 55, 'use_sma': True, 'use_atr': False, 'use_adx': False, 'use_ema': True, 'use_spike': False, 'rsi_required': False, 'edge_k': 0.0048960760041318885, 'edge_cap': 0.44053946299063407, 'bull_strategy': 'breakout', 'bull_bb_std_mult': 1.2229572254267977, 'bull_rsi_os': 32, 'bull_rsi_ob': 56, 'bull_adx_thresh': 15.699601398278507, 'bull_atr_min_pct': 0.0038677900774840004, 'bull_atr_max_pct': 0.04831411839213774, 'bull_tp_mult': 2.6267306499758702, 'bull_tsl_mult': 0.5407403780629569, 'bull_time_stop': 83, 'bull_use_sma': False, 'bull_use_ema': True, 'bull_use_atr': False, 'bull_use_adx': True, 'bull_use_spike': False, 'bull_rsi_required': False, 'bear_strategy': 'mean_reversion', 'bear_bb_std_mult': 1.7612800588560642, 'bear_rsi_os': 31, 'bear_rsi_ob': 81, 'bear_adx_thresh': 30.298390448081307, 'bear_atr_min_pct': 0.010580142670933773, 'bear_atr_max_pct': 0.09708547817836882, 'bear_tp_mult': 1.875823609148169, 'bear_tsl_mult': 0.6565892477136093, 'bear_time_stop': 51, 'bear_use_sma': True, 'bear_use_ema': True, 'bear_use_atr': False, 'bear_use_adx': True, 'bear_use_spike': True, 'bear_rsi_required': True, 'sideways_strategy': 'mean_reversion', 'sideways_bb_std_mult': 0.5079001556297567, 'sideways_rsi_os': 26, 'sideways_rsi_ob': 52, 'sideways_adx_thresh': 21.291099761192893, 'sideways_atr_min_pct': 0.02940457667801153, 'sideways_atr_max_pct': 0.030434281779295563, 'sideways_tp_mult': 1.2865450498650792, 'sideways_tsl_mult': 0.8052094014624405, 'sideways_time_stop': 53, 'sideways_use_sma': False, 'sideways_use_ema': True, 'sideways_use_atr': True, 'sideways_use_adx': False, 'sideways_use_spike': False, 'sideways_rsi_required': True}.
[I 2025-08-30 20:50:12,307] Trial 25 finished with values: [-1000000000.0, 1000000000.0] and parameters: {'p_sma': 44, 'p_std': 49, 'p_atr': 22, 'p_adx': 26, 'rsi_period': 7, 'ema1': 15, 'ema2': 38, 'slip_atr_k': 0.19496235485356017, 'slip_spread_k': 0.5726932107066375, 'spread_hl_frac': 0.03113221130125481, 'bb_std_mult': 3.2552841059944084, 'rsi_os': 28, 'rsi_ob': 83, 'vol_spike': 0.1636876644975865, 'adx_thresh': 27.92422458072643, 'atr_min_pct': 0.011235645394762076, 'atr_max_pct': 0.07265763409131465, 'tp_mult': 1.574262553757964, 'tsl_mult': 0.23853378881507956, 'strategy': 'mean_reversion', 'time_stop': 54, 'use_sma': True, 'use_atr': True, 'use_adx': True, 'use_ema': True, 'use_spike': True, 'rsi_required': True, 'edge_k': 0.06336312520378518, 'edge_cap': 0.8895594263414214, 'bull_strategy': 'breakout', 'bull_bb_std_mult': 1.2011274758765367, 'bull_rsi_os': 33, 'bull_rsi_ob': 87, 'bull_adx_thresh': 16.95574311848202, 'bull_atr_min_pct': 0.0040280482863378365, 'bull_atr_max_pct': 0.062084413932335714, 'bull_tp_mult': 2.2756669131230725, 'bull_tsl_mult': 0.2840179813864078, 'bull_time_stop': 89, 'bull_use_sma': False, 'bull_use_ema': False, 'bull_use_atr': True, 'bull_use_adx': True, 'bull_use_spike': False, 'bull_rsi_required': True, 'bear_strategy': 'breakout', 'bear_bb_std_mult': 1.7809798583203351, 'bear_rsi_os': 53, 'bear_rsi_ob': 79, 'bear_adx_thresh': 30.577171105678495, 'bear_atr_min_pct': 0.00575866695305668, 'bear_atr_max_pct': 0.10117617015902648, 'bear_tp_mult': 2.3139365781538683, 'bear_tsl_mult': 0.6630190788911863, 'bear_time_stop': 41, 'bear_use_sma': True, 'bear_use_ema': False, 'bear_use_atr': False, 'bear_use_adx': False, 'bear_use_spike': False, 'bear_rsi_required': True, 'sideways_strategy': 'mean_reversion', 'sideways_bb_std_mult': 2.677712183254629, 'sideways_rsi_os': 17, 'sideways_rsi_ob': 50, 'sideways_adx_thresh': 26.11427789205993, 'sideways_atr_min_pct': 0.022952156005975256, 'sideways_atr_max_pct': 0.02981198753091143, 'sideways_tp_mult': 2.947754496382344, 'sideways_tsl_mult': 0.991912203424009, 'sideways_time_stop': 51, 'sideways_use_sma': True, 'sideways_use_ema': False, 'sideways_use_atr': False, 'sideways_use_adx': False, 'sideways_use_spike': False, 'sideways_rsi_required': False}.
[I 2025-08-30 20:50:20,512] Trial 28 finished with values: [-1000000000.0, 1000000000.0] and parameters: {'p_sma': 49, 'p_std': 5, 'p_atr': 21, 'p_adx': 11, 'rsi_period': 23, 'ema1': 11, 'ema2': 51, 'slip_atr_k': 0.06236618123799853, 'slip_spread_k': 0.4942433600427052, 'spread_hl_frac': 0.02035383025821478, 'bb_std_mult': 2.5963166213501263, 'rsi_os': 36, 'rsi_ob': 69, 'vol_spike': 0.16362407188538824, 'adx_thresh': 26.42641722872226, 'atr_min_pct': 0.003640575738499451, 'atr_max_pct': 0.08914025043268525, 'tp_mult': 1.4258813229626122, 'tsl_mult': 0.00577631923548283, 'strategy': 'breakout', 'time_stop': 123, 'use_sma': False, 'use_atr': True, 'use_adx': True, 'use_ema': False, 'use_spike': True, 'rsi_required': True, 'edge_k': 1.3822811917708528, 'edge_cap': 0.9145692310137272, 'bull_strategy': 'breakout', 'bull_bb_std_mult': 1.8932652247787076, 'bull_rsi_os': 20, 'bull_rsi_ob': 82, 'bull_adx_thresh': 8.767988702003006, 'bull_atr_min_pct': 0.007988526892781725, 'bull_atr_max_pct': 0.06453435155264899, 'bull_tp_mult': 2.059287362838203, 'bull_tsl_mult': 0.38695402957270475, 'bull_time_stop': 203, 'bull_use_sma': False, 'bull_use_ema': False, 'bull_use_atr': True, 'bull_use_adx': True, 'bull_use_spike': True, 'bull_rsi_required': True, 'bear_strategy': 'breakout', 'bear_bb_std_mult': 2.7840886579071906, 'bear_rsi_os': 16, 'bear_rsi_ob': 46, 'bear_adx_thresh': 34.10539236986308, 'bear_atr_min_pct': 0.003991119858191693, 'bear_atr_max_pct': 0.032427548389401754, 'bear_tp_mult': 1.4592576099649555, 'bear_tsl_mult': 0.7858755754976925, 'bear_time_stop': 254, 'bear_use_sma': True, 'bear_use_ema': False, 'bear_use_atr': False, 'bear_use_adx': False, 'bear_use_spike': False, 'bear_rsi_required': False, 'sideways_strategy': 'mean_reversion', 'sideways_bb_std_mult': 3.228886358213671, 'sideways_rsi_os': 11, 'sideways_rsi_ob': 57, 'sideways_adx_thresh': 17.164399379033405, 'sideways_atr_min_pct': 0.015112984718149291, 'sideways_atr_max_pct': 0.0557214508016513, 'sideways_tp_mult': 2.414128497036524, 'sideways_tsl_mult': 0.5157825546747715, 'sideways_time_stop': 102, 'sideways_use_sma': True, 'sideways_use_ema': False, 'sideways_use_atr': False, 'sideways_use_adx': False, 'sideways_use_spike': True, 'sideways_rsi_required': False}.
