[I 2025-08-30 21:27:02,748] Trial 316 finished with values: [-1000000000.0, 1000000000.0] and parameters: {'p_sma': 33, 'p_std': 37, 'p_atr': 14, 'p_adx': 8, 'rsi_period': 18, 'ema1': 21, 'ema2': 16, 'slip_atr_k': 0.024131448618146395, 'slip_spread_k': 0.5900979304776331, 'spread_hl_frac': 0.04539641272856225, 'bb_std_mult': 1.7108717085325669, 'rsi_os': 8, 'rsi_ob': 86, 'vol_spike': 0.2938925616122519, 'adx_thresh': 11.172009759095276, 'atr_min_pct': 0.021082104855089295, 'atr_max_pct': 0.013630741585966, 'tp_mult': 2.4185762122569314, 'tsl_mult': 0.5549522252690712, 'strategy': 'breakout', 'time_stop': 101, 'use_sma': True, 'use_atr': False, 'use_adx': False, 'use_ema': True, 'use_spike': False, 'rsi_required': False, 'edge_k': 0.7006036370247084, 'edge_cap': 0.257935746981271, 'bull_strategy': 'mean_reversion', 'bull_bb_std_mult': 3.535483788640531, 'bull_rsi_os': 24, 'bull_rsi_ob': 61, 'bull_adx_thresh': 29.540087879830853, 'bull_atr_min_pct': 0.0006213532134629897, 'bull_atr_max_pct': 0.05529862083294449, 'bull_tp_mult': 2.3924390315824726, 'bull_tsl_mult': 0.7677989874627718, 'bull_time_stop': 284, 'bull_use_sma': True, 'bull_use_ema': True, 'bull_use_atr': True, 'bull_use_adx': False, 'bull_use_spike': True, 'bull_rsi_required': False, 'bear_strategy': 'breakout', 'bear_bb_std_mult': 2.5576001281447143, 'bear_rsi_os': 40, 'bear_rsi_ob': 50, 'bear_adx_thresh': 19.987590853747243, 'bear_atr_min_pct': 0.02336638500107266, 'bear_atr_max_pct': 0.014652921179571033, 'bear_tp_mult': 2.690205889001389, 'bear_tsl_mult': 0.9029356084269633, 'bear_time_stop': 208, 'bear_use_sma': False, 'bear_use_ema': False, 'bear_use_atr': True, 'bear_use_adx': False, 'bear_use_spike': False, 'bear_rsi_required': False, 'sideways_strategy': 'mean_reversion', 'sideways_bb_std_mult': 0.8598216775425782, 'sideways_rsi_os': 39, 'sideways_rsi_ob': 94, 'sideways_adx_thresh': 5.683341570384012, 'sideways_atr_min_pct': 0.026855914976209365, 'sideways_atr_max_pct': 0.10509508899429344, 'sideways_tp_mult': 2.0045431699300416, 'sideways_tsl_mult': 0.3882315202855707, 'sideways_time_stop': 265, 'sideways_use_sma': True, 'sideways_use_ema': True, 'sideways_use_atr': True, 'sideways_use_adx': True, 'sideways_use_spike': True, 'sideways_rsi_required': True}.
[I 2025-08-30 21:27:35,132] Trial 315 finished with values: [-1000000000.0, 1000000000.0] and parameters: {'p_sma': 32, 'p_std': 41, 'p_atr': 16, 'p_adx': 29, 'rsi_period': 18, 'ema1': 21, 'ema2': 16, 'slip_atr_k': 0.023492212695155956, 'slip_spread_k': 0.584704546220443, 'spread_hl_frac': 0.0285055592325745, 'bb_std_mult': 0.542404448145748, 'rsi_os': 28, 'rsi_ob': 81, 'vol_spike': 0.2949026042558626, 'adx_thresh': 11.269793063361071, 'atr_min_pct': 0.021412063263389403, 'atr_max_pct': 0.12951046318881743, 'tp_mult': 2.0016135324525584, 'tsl_mult': 0.5563280114558236, 'strategy': 'mean_reversion', 'time_stop': 98, 'use_sma': False, 'use_atr': True, 'use_adx': False, 'use_ema': True, 'use_spike': False, 'rsi_required': True, 'edge_k': 0.6689954203599504, 'edge_cap': 0.2313361251308459, 'bull_strategy': 'mean_reversion', 'bull_bb_std_mult': 3.204109863897505, 'bull_rsi_os': 15, 'bull_rsi_ob': 71, 'bull_adx_thresh': 15.783918304946273, 'bull_atr_min_pct': 0.00601171681718086, 'bull_atr_max_pct': 0.05354074616118413, 'bull_tp_mult': 2.3986289285353446, 'bull_tsl_mult': 0.9059243414942324, 'bull_time_stop': 294, 'bull_use_sma': True, 'bull_use_ema': False, 'bull_use_atr': False, 'bull_use_adx': False, 'bull_use_spike': True, 'bull_rsi_required': True, 'bear_strategy': 'breakout', 'bear_bb_std_mult': 2.5842396022259453, 'bear_rsi_os': 38, 'bear_rsi_ob': 50, 'bear_adx_thresh': 5.809780979492002, 'bear_atr_min_pct': 0.015819793581058325, 'bear_atr_max_pct': 0.016853407221727887, 'bear_tp_mult': 2.9169499617321852, 'bear_tsl_mult': 0.06277551675274617, 'bear_time_stop': 114, 'bear_use_sma': False, 'bear_use_ema': False, 'bear_use_atr': True, 'bear_use_adx': True, 'bear_use_spike': True, 'bear_rsi_required': False, 'sideways_strategy': 'breakout', 'sideways_bb_std_mult': 0.7506958706055338, 'sideways_rsi_os': 39, 'sideways_rsi_ob': 55, 'sideways_adx_thresh': 5.844568981542286, 'sideways_atr_min_pct': 0.014856573702177, 'sideways_atr_max_pct': 0.038398322923839594, 'sideways_tp_mult': 2.093473259640002, 'sideways_tsl_mult': 0.4709007717559733, 'sideways_time_stop': 265, 'sideways_use_sma': False, 'sideways_use_ema': True, 'sideways_use_atr': False, 'sideways_use_adx': True, 'sideways_use_spike': False, 'sideways_rsi_required': True}.
[I 2025-08-30 21:27:35,765] Trial 317 finished with values: [-1000000000.0, 1000000000.0] and parameters: {'p_sma': 32, 'p_std': 49, 'p_atr': 14, 'p_adx': 29, 'rsi_period': 69, 'ema1': 21, 'ema2': 47, 'slip_atr_k': 0.022834593086929006, 'slip_spread_k': 0.33942123597894347, 'spread_hl_frac': 0.028309622622871025, 'bb_std_mult': 1.4838283195266957, 'rsi_os': 11, 'rsi_ob': 81, 'vol_spike': 0.10299546299313417, 'adx_thresh': 29.63532947737198, 'atr_min_pct': 0.018793813066491756, 'atr_max_pct': 0.13559752564693586, 'tp_mult': 2.4125855787828283, 'tsl_mult': 0.9290470640933335, 'strategy': 'breakout', 'time_stop': 104, 'use_sma': True, 'use_atr': False, 'use_adx': False, 'use_ema': False, 'use_spike': False, 'rsi_required': False, 'edge_k': 1.3490178671863022, 'edge_cap': 0.9991826582728596, 'bull_strategy': 'mean_reversion', 'bull_bb_std_mult': 0.8386371720714096, 'bull_rsi_os': 24, 'bull_rsi_ob': 73, 'bull_adx_thresh': 15.819592237101546, 'bull_atr_min_pct': 0.0007386535369311233, 'bull_atr_max_pct': 0.034959346673935854, 'bull_tp_mult': 2.3792092946132595, 'bull_tsl_mult': 0.7672253384934216, 'bull_time_stop': 283, 'bull_use_sma': False, 'bull_use_ema': True, 'bull_use_atr': True, 'bull_use_adx': False, 'bull_use_spike': False, 'bull_rsi_required': False, 'bear_strategy': 'breakout', 'bear_bb_std_mult': 0.7764045508482587, 'bear_rsi_os': 36, 'bear_rsi_ob': 73, 'bear_adx_thresh': 16.003398995177314, 'bear_atr_min_pct': 0.010534060378804107, 'bear_atr_max_pct': 0.015579698638363565, 'bear_tp_mult': 2.8072815120712016, 'bear_tsl_mult': 0.7998353539801242, 'bear_time_stop': 114, 'bear_use_sma': False, 'bear_use_ema': False, 'bear_use_atr': True, 'bear_use_adx': False, 'bear_use_spike': False, 'bear_rsi_required': False, 'sideways_strategy': 'mean_reversion', 'sideways_bb_std_mult': 0.9084647560596131, 'sideways_rsi_os': 39, 'sideways_rsi_ob': 94, 'sideways_adx_thresh': 17.3777453256989, 'sideways_atr_min_pct': 0.015788640002670693, 'sideways_atr_max_pct': 0.12183934152029317, 'sideways_tp_mult': 2.0971407048997905, 'sideways_tsl_mult': 0.503141509275131, 'sideways_time_stop': 222, 'sideways_use_sma': True, 'sideways_use_ema': False, 'sideways_use_atr': True, 'sideways_use_adx': True, 'sideways_use_spike': True, 'sideways_rsi_required': False}.
[I 2025-08-30 21:27:35,889] Trial 318 finished with values: [-1000000000.0, 1000000000.0] and parameters: {'p_sma': 26, 'p_std': 41, 'p_atr': 19, 'p_adx': 29, 'rsi_period': 18, 'ema1': 21, 'ema2': 47, 'slip_atr_k': 0.02389082885132495, 'slip_spread_k': 0.5885976746611564, 'spread_hl_frac': 0.03339767498325254, 'bb_std_mult': 1.008916857865736, 'rsi_os': 11, 'rsi_ob': 81, 'vol_spike': 0.11189078681471817, 'adx_thresh': 28.736227031741727, 'atr_min_pct': 0.018879434907946788, 'atr_max_pct': 0.13584038235292908, 'tp_mult': 2.4072264298436004, 'tsl_mult': 0.9340167110919987, 'strategy': 'breakout', 'time_stop': 112, 'use_sma': True, 'use_atr': False, 'use_adx': False, 'use_ema': False, 'use_spike': False, 'rsi_required': False, 'edge_k': 0.6730083196448305, 'edge_cap': 0.23002980493102887, 'bull_strategy': 'mean_reversion', 'bull_bb_std_mult': 2.0081284176595253, 'bull_rsi_os': 15, 'bull_rsi_ob': 60, 'bull_adx_thresh': 15.862693402136292, 'bull_atr_min_pct': 0.0005696201807639954, 'bull_atr_max_pct': 0.0352987394043401, 'bull_tp_mult': 2.379132138557497, 'bull_tsl_mult': 0.8909792522553159, 'bull_time_stop': 188, 'bull_use_sma': False, 'bull_use_ema': True, 'bull_use_atr': True, 'bull_use_adx': False, 'bull_use_spike': False, 'bull_rsi_required': False, 'bear_strategy': 'breakout', 'bear_bb_std_mult': 0.7619546171712481, 'bear_rsi_os': 38, 'bear_rsi_ob': 50, 'bear_adx_thresh': 33.17463986310246, 'bear_atr_min_pct': 0.0012852721529432037, 'bear_atr_max_pct': 0.014875433708982033, 'bear_tp_mult': 2.800748623177054, 'bear_tsl_mult': 0.0689852189791969, 'bear_time_stop': 120, 'bear_use_sma': False, 'bear_use_ema': False, 'bear_use_atr': True, 'bear_use_adx': False, 'bear_use_spike': False, 'bear_rsi_required': False, 'sideways_strategy': 'mean_reversion', 'sideways_bb_std_mult': 3.341091792489018, 'sideways_rsi_os': 14, 'sideways_rsi_ob': 55, 'sideways_adx_thresh': 15.541298305000982, 'sideways_atr_min_pct': 0.015371064239691035, 'sideways_atr_max_pct': 0.10593222725706368, 'sideways_tp_mult': 2.0926753993496345, 'sideways_tsl_mult': 0.41810990948717114, 'sideways_time_stop': 99, 'sideways_use_sma': True, 'sideways_use_ema': False, 'sideways_use_atr': True, 'sideways_use_adx': True, 'sideways_use_spike': True, 'sideways_rsi_required': False}.
[I 2025-08-30 21:27:36,274] Trial 319 finished with values: [-1000000000.0, 1000000000.0] and parameters: {'p_sma': 27, 'p_std': 25, 'p_atr': 24, 'p_adx': 29, 'rsi_period': 20, 'ema1': 21, 'ema2': 47, 'slip_atr_k': 0.031673276261016535, 'slip_spread_k': 0.6157445396666766, 'spread_hl_frac': 0.0030967357632958672, 'bb_std_mult': 1.5463330775494117, 'rsi_os': 25, 'rsi_ob': 57, 'vol_spike': 0.19919636868863128, 'adx_thresh': 33.86369330132195, 'atr_min_pct': 0.018499217604444868, 'atr_max_pct': 0.07982950989216996, 'tp_mult': 1.595130436552418, 'tsl_mult': 0.496344564997982, 'strategy': 'breakout', 'time_stop': 113, 'use_sma': False, 'use_atr': True, 'use_adx': False, 'use_ema': False, 'use_spike': False, 'rsi_required': True, 'edge_k': 0.660402446004078, 'edge_cap': 0.7866641173729574, 'bull_strategy': 'mean_reversion', 'bull_bb_std_mult': 3.3444893971683296, 'bull_rsi_os': 15, 'bull_rsi_ob': 86, 'bull_adx_thresh': 15.454513227189864, 'bull_atr_min_pct': 0.002246624389384142, 'bull_atr_max_pct': 0.114445841504763, 'bull_tp_mult': 1.5783122684115825, 'bull_tsl_mult': 0.6850235356066179, 'bull_time_stop': 204, 'bull_use_sma': False, 'bull_use_ema': True, 'bull_use_atr': True, 'bull_use_adx': False, 'bull_use_spike': False, 'bull_rsi_required': False, 'bear_strategy': 'breakout', 'bear_bb_std_mult': 3.263216482748994, 'bear_rsi_os': 38, 'bear_rsi_ob': 77, 'bear_adx_thresh': 34.99215651162434, 'bear_atr_min_pct': 0.010382382045993765, 'bear_atr_max_pct': 0.014507734610726353, 'bear_tp_mult': 2.4446594260464583, 'bear_tsl_mult': 0.4462878133516022, 'bear_time_stop': 116, 'bear_use_sma': False, 'bear_use_ema': False, 'bear_use_atr': True, 'bear_use_adx': True, 'bear_use_spike': True, 'bear_rsi_required': False, 'sideways_strategy': 'breakout', 'sideways_bb_std_mult': 3.31162797162349, 'sideways_rsi_os': 15, 'sideways_rsi_ob': 82, 'sideways_adx_thresh': 28.46305165763864, 'sideways_atr_min_pct': 0.015413455516844806, 'sideways_atr_max_pct': 0.10065373827691103, 'sideways_tp_mult': 2.1054060961144296, 'sideways_tsl_mult': 0.4223110620166388, 'sideways_time_stop': 256, 'sideways_use_sma': False, 'sideways_use_ema': False, 'sideways_use_atr': True, 'sideways_use_adx': True, 'sideways_use_spike': False, 'sideways_rsi_required': False}.
[I 2025-08-30 21:28:10,292] Trial 320 finished with values: [-1000000000.0, 1000000000.0] and parameters: {'p_sma': 27, 'p_std': 32, 'p_atr': 19, 'p_adx': 29, 'rsi_period': 69, 'ema1': 21, 'ema2': 43, 'slip_atr_k': 0.031208012655632302, 'slip_spread_k': 0.18535559946956848, 'spread_hl_frac': 0.019805545242195674, 'bb_std_mult': 2.446318106065005, 'rsi_os': 25, 'rsi_ob': 82, 'vol_spike': 0.03557355042522051, 'adx_thresh': 28.523409687869773, 'atr_min_pct': 0.01751445021048788, 'atr_max_pct': 0.13594486356460228, 'tp_mult': 1.5953220147421663, 'tsl_mult': 0.9351090435328977, 'strategy': 'breakout', 'time_stop': 112, 'use_sma': True, 'use_atr': False, 'use_adx': True, 'use_ema': False, 'use_spike': True, 'rsi_required': False, 'edge_k': 0.7143041131125047, 'edge_cap': 0.5851309512561812, 'bull_strategy': 'breakout', 'bull_bb_std_mult': 3.3151265700278922, 'bull_rsi_os': 37, 'bull_rsi_ob': 73, 'bull_adx_thresh': 27.549741646952743, 'bull_atr_min_pct': 0.015421812683592358, 'bull_atr_max_pct': 0.0616479287756288, 'bull_tp_mult': 1.5784353282218517, 'bull_tsl_mult': 0.7294457097881966, 'bull_time_stop': 300, 'bull_use_sma': False, 'bull_use_ema': True, 'bull_use_atr': True, 'bull_use_adx': True, 'bull_use_spike': False, 'bull_rsi_required': False, 'bear_strategy': 'mean_reversion', 'bear_bb_std_mult': 3.2713400779230852, 'bear_rsi_os': 25, 'bear_rsi_ob': 55, 'bear_adx_thresh': 11.075744128998071, 'bear_atr_min_pct': 0.015220706904721925, 'bear_atr_max_pct': 0.01328330272374199, 'bear_tp_mult': 1.7083993787202014, 'bear_tsl_mult': 0.4064651177760133, 'bear_time_stop': 251, 'bear_use_sma': True, 'bear_use_ema': False, 'bear_use_atr': False, 'bear_use_adx': False, 'bear_use_spike': False, 'bear_rsi_required': True, 'sideways_strategy': 'mean_reversion', 'sideways_bb_std_mult': 1.7505936542704985, 'sideways_rsi_os': 40, 'sideways_rsi_ob': 82, 'sideways_adx_thresh': 12.692674093873205, 'sideways_atr_min_pct': 0.021844436382101644, 'sideways_atr_max_pct': 0.0993655251408424, 'sideways_tp_mult': 1.0784848422603057, 'sideways_tsl_mult': 0.4305889183357504, 'sideways_time_stop': 100, 'sideways_use_sma': True, 'sideways_use_ema': False, 'sideways_use_atr': True, 'sideways_use_adx': False, 'sideways_use_spike': True, 'sideways_rsi_required': False}.
[I 2025-08-30 21:28:10,296] Trial 322 finished with values: [-1000000000.0, 1000000000.0] and parameters: {'p_sma': 27, 'p_std': 14, 'p_atr': 23, 'p_adx': 30, 'rsi_period': 20, 'ema1': 20, 'ema2': 33, 'slip_atr_k': 0.03174277655915028, 'slip_spread_k': 0.18963406988703418, 'spread_hl_frac': 0.043657728886650066, 'bb_std_mult': 1.5464219324145807, 'rsi_os': 25, 'rsi_ob': 80, 'vol_spike': 0.2996004339931974, 'adx_thresh': 30.7193583534255, 'atr_min_pct': 0.019906300533179384, 'atr_max_pct': 0.050146923746363904, 'tp_mult': 1.5873010765783133, 'tsl_mult': 0.6842116012399277, 'strategy': 'mean_reversion', 'time_stop': 121, 'use_sma': False, 'use_atr': True, 'use_adx': True, 'use_ema': True, 'use_spike': True, 'rsi_required': True, 'edge_k': 0.37971557208525086, 'edge_cap': 0.42833997835373283, 'bull_strategy': 'breakout', 'bull_bb_std_mult': 1.10795122193466, 'bull_rsi_os': 17, 'bull_rsi_ob': 72, 'bull_adx_thresh': 27.322982238226345, 'bull_atr_min_pct': 0.01531099100073676, 'bull_atr_max_pct': 0.11322208198328934, 'bull_tp_mult': 2.0751212260296454, 'bull_tsl_mult': 0.5232414509409418, 'bull_time_stop': 300, 'bull_use_sma': True, 'bull_use_ema': False, 'bull_use_atr': False, 'bull_use_adx': True, 'bull_use_spike': True, 'bull_rsi_required': True, 'bear_strategy': 'mean_reversion', 'bear_bb_std_mult': 2.7978904392377015, 'bear_rsi_os': 41, 'bear_rsi_ob': 77, 'bear_adx_thresh': 11.772049567215646, 'bear_atr_min_pct': 0.015411948306838332, 'bear_atr_max_pct': 0.08903553824709172, 'bear_tp_mult': 2.940091954388859, 'bear_tsl_mult': 0.03746732752488613, 'bear_time_stop': 267, 'bear_use_sma': True, 'bear_use_ema': True, 'bear_use_atr': False, 'bear_use_adx': True, 'bear_use_spike': True, 'bear_rsi_required': True, 'sideways_strategy': 'breakout', 'sideways_bb_std_mult': 1.9445509012282192, 'sideways_rsi_os': 51, 'sideways_rsi_ob': 90, 'sideways_adx_thresh': 29.80373200784293, 'sideways_atr_min_pct': 0.0037558967478885687, 'sideways_atr_max_pct': 0.09947952287318902, 'sideways_tp_mult': 2.0422626986769803, 'sideways_tsl_mult': 0.4151690295061746, 'sideways_time_stop': 253, 'sideways_use_sma': False, 'sideways_use_ema': True, 'sideways_use_atr': True, 'sideways_use_adx': False, 'sideways_use_spike': False, 'sideways_rsi_required': True}.
[I 2025-08-30 21:28:10,685] Trial 321 finished with values: [-1000000000.0, 1000000000.0] and parameters: {'p_sma': 49, 'p_std': 14, 'p_atr': 19, 'p_adx': 30, 'rsi_period': 21, 'ema1': 22, 'ema2': 43, 'slip_atr_k': 0.24027543799620887, 'slip_spread_k': 0.187726297417262, 'spread_hl_frac': 0.03319184116711717, 'bb_std_mult': 1.5468188745404017, 'rsi_os': 6, 'rsi_ob': 82, 'vol_spike': 0.11173357904568829, 'adx_thresh': 28.509255495414454, 'atr_min_pct': 0.02019599836877188, 'atr_max_pct': 0.05606246788015932, 'tp_mult': 2.31732594949779, 'tsl_mult': 0.9297575429431502, 'strategy': 'mean_reversion', 'time_stop': 112, 'use_sma': False, 'use_atr': True, 'use_adx': True, 'use_ema': False, 'use_spike': True, 'rsi_required': True, 'edge_k': 1.063328682243256, 'edge_cap': 0.588907102426245, 'bull_strategy': 'breakout', 'bull_bb_std_mult': 3.3122831804332242, 'bull_rsi_os': 20, 'bull_rsi_ob': 67, 'bull_adx_thresh': 27.48306437956843, 'bull_atr_min_pct': 0.002407428863654186, 'bull_atr_max_pct': 0.04945720083365962, 'bull_tp_mult': 2.326047793590221, 'bull_tsl_mult': 0.5421957468224172, 'bull_time_stop': 201, 'bull_use_sma': False, 'bull_use_ema': False, 'bull_use_atr': False, 'bull_use_adx': True, 'bull_use_spike': False, 'bull_rsi_required': True, 'bear_strategy': 'mean_reversion', 'bear_bb_std_mult': 2.8491063399426295, 'bear_rsi_os': 23, 'bear_rsi_ob': 53, 'bear_adx_thresh': 5.032375602135835, 'bear_atr_min_pct': 0.00940742186480854, 'bear_atr_max_pct': 0.07559284020980446, 'bear_tp_mult': 1.4952123845861083, 'bear_tsl_mult': 0.40572398583957986, 'bear_time_stop': 124, 'bear_use_sma': True, 'bear_use_ema': True, 'bear_use_atr': False, 'bear_use_adx': True, 'bear_use_spike': True, 'bear_rsi_required': True, 'sideways_strategy': 'breakout', 'sideways_bb_std_mult': 1.7492569083655936, 'sideways_rsi_os': 40, 'sideways_rsi_ob': 72, 'sideways_adx_thresh': 8.486101455137288, 'sideways_atr_min_pct': 0.019584332271617693, 'sideways_atr_max_pct': 0.09855143491663075, 'sideways_tp_mult': 1.0960845631740486, 'sideways_tsl_mult': 0.4123680986707675, 'sideways_time_stop': 227, 'sideways_use_sma': False, 'sideways_use_ema': False, 'sideways_use_atr': True, 'sideways_use_adx': False, 'sideways_use_spike': False, 'sideways_rsi_required': False}.
[I 2025-08-30 21:28:10,854] Trial 323 finished with values: [-1000000000.0, 1000000000.0] and parameters: {'p_sma': 51, 'p_std': 32, 'p_atr': 15, 'p_adx': 30, 'rsi_period': 14, 'ema1': 22, 'ema2': 43, 'slip_atr_k': 0.04435007274409387, 'slip_spread_k': 0.5117054693026589, 'spread_hl_frac': 0.004822240038913302, 'bb_std_mult': 1.6266075674840963, 'rsi_os': 10, 'rsi_ob': 82, 'vol_spike': 0.11989474417026307, 'adx_thresh': 30.603227066449993, 'atr_min_pct': 0.02029437596804468, 'atr_max_pct': 0.1200119066745583, 'tp_mult': 1.4877810485694254, 'tsl_mult': 0.6998060397625794, 'strategy': 'mean_reversion', 'time_stop': 122, 'use_sma': False, 'use_atr': True, 'use_adx': True, 'use_ema': True, 'use_spike': True, 'rsi_required': True, 'edge_k': 0.23430983552103468, 'edge_cap': 0.43117749714632514, 'bull_strategy': 'breakout', 'bull_bb_std_mult': 1.424166465424732, 'bull_rsi_os': 18, 'bull_rsi_ob': 83, 'bull_adx_thresh': 14.945276301049004, 'bull_atr_min_pct': 0.01609616306001137, 'bull_atr_max_pct': 0.02970393432719999, 'bull_tp_mult': 2.3286605578911823, 'bull_tsl_mult': 0.5530024752284637, 'bull_time_stop': 155, 'bull_use_sma': True, 'bull_use_ema': False, 'bull_use_atr': False, 'bull_use_adx': True, 'bull_use_spike': True, 'bull_rsi_required': True, 'bear_strategy': 'mean_reversion', 'bear_bb_std_mult': 2.8152589489989457, 'bear_rsi_os': 41, 'bear_rsi_ob': 55, 'bear_adx_thresh': 15.437927682862352, 'bear_atr_min_pct': 0.016833905794086192, 'bear_atr_max_pct': 0.06817525341448805, 'bear_tp_mult': 2.944497289229583, 'bear_tsl_mult': 0.40684342642823984, 'bear_time_stop': 11, 'bear_use_sma': True, 'bear_use_ema': True, 'bear_use_atr': False, 'bear_use_adx': True, 'bear_use_spike': True, 'bear_rsi_required': True, 'sideways_strategy': 'breakout', 'sideways_bb_std_mult': 1.7530971374781732, 'sideways_rsi_os': 40, 'sideways_rsi_ob': 90, 'sideways_adx_thresh': 8.537656309891604, 'sideways_atr_min_pct': 0.013546824067896352, 'sideways_atr_max_pct': 0.09714138130665645, 'sideways_tp_mult': 2.035639975824972, 'sideways_tsl_mult': 0.45670876642175445, 'sideways_time_stop': 253, 'sideways_use_sma': False, 'sideways_use_ema': True, 'sideways_use_atr': True, 'sideways_use_adx': False, 'sideways_use_spike': False, 'sideways_rsi_required': True}.
