[I 2025-08-30 21:42:36,541] Trial 431 finished with values: [-0.016597474557757064, 0.01649932046997788] and parameters: {'p_sma': 38, 'p_std': 38, 'p_atr': 21, 'p_adx': 21, 'rsi_period': 72, 'ema1': 10, 'ema2': 55, 'slip_atr_k': 0.020837180414706138, 'slip_spread_k': 0.6589250464303806, 'spread_hl_frac': 0.03243152641213911, 'bb_std_mult': 0.769980923859207, 'rsi_os': 13, 'rsi_ob': 63, 'vol_spike': 0.272211022137302, 'adx_thresh': 10.58158627965704, 'atr_min_pct': 0.013780100035067402, 'atr_max_pct': 0.03877485136242634, 'tp_mult': 1.7916460565143173, 'tsl_mult': 0.9302547060644537, 'strategy': 'mean_reversion', 'time_stop': 48, 'use_sma': True, 'use_atr': True, 'use_adx': True, 'use_ema': False, 'use_spike': True, 'rsi_required': True, 'edge_k': 0.9580279782902624, 'edge_cap': 0.8350196353723106, 'bull_strategy': 'breakout', 'bull_bb_std_mult': 1.8588969878455368, 'bull_rsi_os': 19, 'bull_rsi_ob': 85, 'bull_adx_thresh': 13.873451423794492, 'bull_atr_min_pct': 0.0005829038141105628, 'bull_atr_max_pct': 0.053125618249361455, 'bull_tp_mult': 1.3576229397527837, 'bull_tsl_mult': 0.4176869822551884, 'bull_time_stop': 300, 'bull_use_sma': False, 'bull_use_ema': False, 'bull_use_atr': False, 'bull_use_adx': False, 'bull_use_spike': False, 'bull_rsi_required': True, 'bear_strategy': 'mean_reversion', 'bear_bb_std_mult': 1.972489523256927, 'bear_rsi_os': 6, 'bear_rsi_ob': 70, 'bear_adx_thresh': 27.603963762202074, 'bear_atr_min_pct': 0.0298806757485382, 'bear_atr_max_pct': 0.11727074387893219, 'bear_tp_mult': 1.5547699996116746, 'bear_tsl_mult': 0.3854914021059711, 'bear_time_stop': 261, 'bear_use_sma': False, 'bear_use_ema': True, 'bear_use_atr': False, 'bear_use_adx': True, 'bear_use_spike': True, 'bear_rsi_required': True, 'sideways_strategy': 'breakout', 'sideways_bb_std_mult': 1.8436045703117196, 'sideways_rsi_os': 37, 'sideways_rsi_ob': 90, 'sideways_adx_thresh': 26.274893198595638, 'sideways_atr_min_pct': 0.020927612952466014, 'sideways_atr_max_pct': 0.03848960330939906, 'sideways_tp_mult': 1.7922285695789086, 'sideways_tsl_mult': 0.7809198891737372, 'sideways_time_stop': 257, 'sideways_use_sma': False, 'sideways_use_ema': False, 'sideways_use_atr': False, 'sideways_use_adx': True, 'sideways_use_spike': False, 'sideways_rsi_required': False}.
[I 2025-08-30 21:42:36,805] Trial 433 finished with values: [-1000000000.0, 1000000000.0] and parameters: {'p_sma': 38, 'p_std': 37, 'p_atr': 21, 'p_adx': 21, 'rsi_period': 72, 'ema1': 10, 'ema2': 54, 'slip_atr_k': 0.08642105650680354, 'slip_spread_k': 0.6546948699917781, 'spread_hl_frac': 0.0322828015410153, 'bb_std_mult': 0.7098290936944823, 'rsi_os': 13, 'rsi_ob': 53, 'vol_spike': 0.2746109744734894, 'adx_thresh': 9.978208794563189, 'atr_min_pct': 0.01420579488054264, 'atr_max_pct': 0.019568518399647412, 'tp_mult': 1.084325137620071, 'tsl_mult': 0.9383992688522933, 'strategy': 'mean_reversion', 'time_stop': 78, 'use_sma': True, 'use_atr': False, 'use_adx': True, 'use_ema': False, 'use_spike': True, 'rsi_required': True, 'edge_k': 0.9551810253796009, 'edge_cap': 0.8400158608336694, 'bull_strategy': 'breakout', 'bull_bb_std_mult': 1.9671603720457775, 'bull_rsi_os': 18, 'bull_rsi_ob': 84, 'bull_adx_thresh': 13.679803291027586, 'bull_atr_min_pct': 0.011268803238015957, 'bull_atr_max_pct': 0.052981924754474004, 'bull_tp_mult': 1.4390959546762343, 'bull_tsl_mult': 0.4004979976572001, 'bull_time_stop': 300, 'bull_use_sma': False, 'bull_use_ema': False, 'bull_use_atr': False, 'bull_use_adx': False, 'bull_use_spike': False, 'bull_rsi_required': True, 'bear_strategy': 'mean_reversion', 'bear_bb_std_mult': 1.8332842974516745, 'bear_rsi_os': 8, 'bear_rsi_ob': 72, 'bear_adx_thresh': 26.76930550480417, 'bear_atr_min_pct': 0.029948916954068896, 'bear_atr_max_pct': 0.11226645917945646, 'bear_tp_mult': 1.5176712315489636, 'bear_tsl_mult': 0.39806854378784945, 'bear_time_stop': 246, 'bear_use_sma': False, 'bear_use_ema': True, 'bear_use_atr': False, 'bear_use_adx': True, 'bear_use_spike': True, 'bear_rsi_required': True, 'sideways_strategy': 'breakout', 'sideways_bb_std_mult': 1.8259026149249828, 'sideways_rsi_os': 35, 'sideways_rsi_ob': 89, 'sideways_adx_thresh': 26.11326834024416, 'sideways_atr_min_pct': 0.023473580183188878, 'sideways_atr_max_pct': 0.04539034943453173, 'sideways_tp_mult': 1.8397168329154772, 'sideways_tsl_mult': 0.7601768300353183, 'sideways_time_stop': 248, 'sideways_use_sma': False, 'sideways_use_ema': False, 'sideways_use_atr': False, 'sideways_use_adx': True, 'sideways_use_spike': False, 'sideways_rsi_required': False}.
[I 2025-08-30 21:42:37,687] Trial 437 finished with values: [-1000000000.0, 1000000000.0] and parameters: {'p_sma': 37, 'p_std': 38, 'p_atr': 21, 'p_adx': 20, 'rsi_period': 70, 'ema1': 12, 'ema2': 53, 'slip_atr_k': 0.18812305285788036, 'slip_spread_k': 0.6801660264639302, 'spread_hl_frac': 0.0325370318976921, 'bb_std_mult': 0.9057955409255168, 'rsi_os': 12, 'rsi_ob': 67, 'vol_spike': 0.27413642331436816, 'adx_thresh': 9.640567187095467, 'atr_min_pct': 0.012639680176010384, 'atr_max_pct': 0.010070926118764423, 'tp_mult': 1.0103845367979098, 'tsl_mult': 0.901501728204015, 'strategy': 'breakout', 'time_stop': 81, 'use_sma': True, 'use_atr': True, 'use_adx': False, 'use_ema': True, 'use_spike': False, 'rsi_required': False, 'edge_k': 0.9123658528844358, 'edge_cap': 0.8214632075040825, 'bull_strategy': 'breakout', 'bull_bb_std_mult': 1.7898237674161595, 'bull_rsi_os': 18, 'bull_rsi_ob': 88, 'bull_adx_thresh': 14.097239125787064, 'bull_atr_min_pct': 0.0013457437802095336, 'bull_atr_max_pct': 0.0510288294536792, 'bull_tp_mult': 1.4787083772215868, 'bull_tsl_mult': 0.41901909573917545, 'bull_time_stop': 300, 'bull_use_sma': True, 'bull_use_ema': True, 'bull_use_atr': True, 'bull_use_adx': False, 'bull_use_spike': False, 'bull_rsi_required': True, 'bear_strategy': 'breakout', 'bear_bb_std_mult': 2.0404091193040794, 'bear_rsi_os': 5, 'bear_rsi_ob': 72, 'bear_adx_thresh': 28.44161639821233, 'bear_atr_min_pct': 0.029960816820339135, 'bear_atr_max_pct': 0.12157013712435981, 'bear_tp_mult': 1.4712600244295633, 'bear_tsl_mult': 0.4135701771617712, 'bear_time_stop': 224, 'bear_use_sma': False, 'bear_use_ema': True, 'bear_use_atr': True, 'bear_use_adx': False, 'bear_use_spike': False, 'bear_rsi_required': False, 'sideways_strategy': 'breakout', 'sideways_bb_std_mult': 1.733689464578796, 'sideways_rsi_os': 37, 'sideways_rsi_ob': 88, 'sideways_adx_thresh': 26.769145241132154, 'sideways_atr_min_pct': 0.02227232194139086, 'sideways_atr_max_pct': 0.041096436688358905, 'sideways_tp_mult': 1.7556400597970832, 'sideways_tsl_mult': 0.7616549706681324, 'sideways_time_stop': 267, 'sideways_use_sma': True, 'sideways_use_ema': False, 'sideways_use_atr': False, 'sideways_use_adx': True, 'sideways_use_spike': True, 'sideways_rsi_required': False}.
[I 2025-08-30 21:43:09,143] Trial 435 finished with values: [-1000000000.0, 1000000000.0] and parameters: {'p_sma': 37, 'p_std': 37, 'p_atr': 21, 'p_adx': 20, 'rsi_period': 70, 'ema1': 10, 'ema2': 53, 'slip_atr_k': 0.24950780836883127, 'slip_spread_k': 0.6879780899707515, 'spread_hl_frac': 0.03261697264057579, 'bb_std_mult': 0.6706057214678008, 'rsi_os': 13, 'rsi_ob': 67, 'vol_spike': 0.27723003789176526, 'adx_thresh': 9.953883173267903, 'atr_min_pct': 0.014337224966058496, 'atr_max_pct': 0.01800597112207395, 'tp_mult': 2.8425049222958014, 'tsl_mult': 0.8997059027088115, 'strategy': 'breakout', 'time_stop': 79, 'use_sma': True, 'use_atr': True, 'use_adx': False, 'use_ema': True, 'use_spike': False, 'rsi_required': False, 'edge_k': 0.8906297069228151, 'edge_cap': 0.821641023580522, 'bull_strategy': 'breakout', 'bull_bb_std_mult': 1.9920786760330866, 'bull_rsi_os': 18, 'bull_rsi_ob': 88, 'bull_adx_thresh': 6.896559035926726, 'bull_atr_min_pct': 0.0016182423508183145, 'bull_atr_max_pct': 0.05058846113671667, 'bull_tp_mult': 1.440670017491414, 'bull_tsl_mult': 0.40494379232151073, 'bull_time_stop': 297, 'bull_use_sma': True, 'bull_use_ema': True, 'bull_use_atr': True, 'bull_use_adx': False, 'bull_use_spike': False, 'bull_rsi_required': True, 'bear_strategy': 'mean_reversion', 'bear_bb_std_mult': 1.997233354518869, 'bear_rsi_os': 8, 'bear_rsi_ob': 72, 'bear_adx_thresh': 28.595253049342563, 'bear_atr_min_pct': 0.029887621422201357, 'bear_atr_max_pct': 0.12148102958180898, 'bear_tp_mult': 1.4683248166103073, 'bear_tsl_mult': 0.4059829806257172, 'bear_time_stop': 246, 'bear_use_sma': False, 'bear_use_ema': True, 'bear_use_atr': True, 'bear_use_adx': True, 'bear_use_spike': False, 'bear_rsi_required': False, 'sideways_strategy': 'breakout', 'sideways_bb_std_mult': 1.718833442556703, 'sideways_rsi_os': 36, 'sideways_rsi_ob': 89, 'sideways_adx_thresh': 26.545081365998758, 'sideways_atr_min_pct': 0.020655858412215088, 'sideways_atr_max_pct': 0.043319291500653355, 'sideways_tp_mult': 1.7483034193793798, 'sideways_tsl_mult': 0.7592904924697825, 'sideways_time_stop': 114, 'sideways_use_sma': True, 'sideways_use_ema': False, 'sideways_use_atr': False, 'sideways_use_adx': True, 'sideways_use_spike': False, 'sideways_rsi_required': False}.
[I 2025-08-30 21:43:09,564] Trial 434 finished with values: [-1000000000.0, 1000000000.0] and parameters: {'p_sma': 38, 'p_std': 38, 'p_atr': 21, 'p_adx': 21, 'rsi_period': 71, 'ema1': 10, 'ema2': 53, 'slip_atr_k': 0.16213780569482103, 'slip_spread_k': 0.6798714814293664, 'spread_hl_frac': 0.03245082850637528, 'bb_std_mult': 0.6906573403092775, 'rsi_os': 13, 'rsi_ob': 71, 'vol_spike': 0.2767933739378869, 'adx_thresh': 10.122838367507565, 'atr_min_pct': 0.01417516376525086, 'atr_max_pct': 0.036258701732323526, 'tp_mult': 1.0960036947614973, 'tsl_mult': 0.938014883270607, 'strategy': 'mean_reversion', 'time_stop': 63, 'use_sma': True, 'use_atr': False, 'use_adx': True, 'use_ema': True, 'use_spike': True, 'rsi_required': True, 'edge_k': 0.8833105320621333, 'edge_cap': 0.8666015698562332, 'bull_strategy': 'breakout', 'bull_bb_std_mult': 1.98674567919743, 'bull_rsi_os': 18, 'bull_rsi_ob': 85, 'bull_adx_thresh': 13.597337743592346, 'bull_atr_min_pct': 0.01122406648733655, 'bull_atr_max_pct': 0.05232436134103722, 'bull_tp_mult': 1.453552006755663, 'bull_tsl_mult': 0.4168724305433376, 'bull_time_stop': 300, 'bull_use_sma': False, 'bull_use_ema': False, 'bull_use_atr': False, 'bull_use_adx': False, 'bull_use_spike': False, 'bull_rsi_required': True, 'bear_strategy': 'mean_reversion', 'bear_bb_std_mult': 2.268671934412063, 'bear_rsi_os': 6, 'bear_rsi_ob': 71, 'bear_adx_thresh': 28.170970818155652, 'bear_atr_min_pct': 0.029800682748822437, 'bear_atr_max_pct': 0.11250308595262089, 'bear_tp_mult': 1.4773695478574296, 'bear_tsl_mult': 0.409659677617111, 'bear_time_stop': 245, 'bear_use_sma': False, 'bear_use_ema': True, 'bear_use_atr': False, 'bear_use_adx': True, 'bear_use_spike': True, 'bear_rsi_required': True, 'sideways_strategy': 'breakout', 'sideways_bb_std_mult': 1.854328319802419, 'sideways_rsi_os': 36, 'sideways_rsi_ob': 90, 'sideways_adx_thresh': 26.411418248477275, 'sideways_atr_min_pct': 0.020703755508168598, 'sideways_atr_max_pct': 0.04661760632312435, 'sideways_tp_mult': 1.7690881994387317, 'sideways_tsl_mult': 0.7632447747253246, 'sideways_time_stop': 114, 'sideways_use_sma': False, 'sideways_use_ema': False, 'sideways_use_atr': False, 'sideways_use_adx': True, 'sideways_use_spike': False, 'sideways_rsi_required': False}.
[I 2025-08-30 21:43:09,821] Trial 436 finished with values: [-1000000000.0, 1000000000.0] and parameters: {'p_sma': 36, 'p_std': 37, 'p_atr': 21, 'p_adx': 20, 'rsi_period': 70, 'ema1': 10, 'ema2': 53, 'slip_atr_k': 0.1873001302300545, 'slip_spread_k': 0.6817983683457551, 'spread_hl_frac': 0.03216345256372409, 'bb_std_mult': 0.700459299232735, 'rsi_os': 12, 'rsi_ob': 67, 'vol_spike': 0.2737945506135641, 'adx_thresh': 9.602944938535217, 'atr_min_pct': 0.012746353936891436, 'atr_max_pct': 0.01737566174954457, 'tp_mult': 1.6727960950754146, 'tsl_mult': 0.8945285060113379, 'strategy': 'breakout', 'time_stop': 64, 'use_sma': True, 'use_atr': True, 'use_adx': False, 'use_ema': True, 'use_spike': False, 'rsi_required': False, 'edge_k': 0.8890890169184507, 'edge_cap': 0.83530935412138, 'bull_strategy': 'breakout', 'bull_bb_std_mult': 2.0071977980847446, 'bull_rsi_os': 18, 'bull_rsi_ob': 88, 'bull_adx_thresh': 13.724587484638445, 'bull_atr_min_pct': 0.01967376600317025, 'bull_atr_max_pct': 0.05228372536087445, 'bull_tp_mult': 1.4512577996142226, 'bull_tsl_mult': 0.4044568762822404, 'bull_time_stop': 300, 'bull_use_sma': True, 'bull_use_ema': True, 'bull_use_atr': True, 'bull_use_adx': False, 'bull_use_spike': False, 'bull_rsi_required': True, 'bear_strategy': 'mean_reversion', 'bear_bb_std_mult': 2.006381765052914, 'bear_rsi_os': 8, 'bear_rsi_ob': 72, 'bear_adx_thresh': 28.337156896686412, 'bear_atr_min_pct': 0.029897059149515844, 'bear_atr_max_pct': 0.12079187709290182, 'bear_tp_mult': 1.4709629828314048, 'bear_tsl_mult': 0.40313552366814104, 'bear_time_stop': 222, 'bear_use_sma': False, 'bear_use_ema': True, 'bear_use_atr': True, 'bear_use_adx': True, 'bear_use_spike': False, 'bear_rsi_required': False, 'sideways_strategy': 'breakout', 'sideways_bb_std_mult': 1.725424915417215, 'sideways_rsi_os': 36, 'sideways_rsi_ob': 89, 'sideways_adx_thresh': 26.72204640205981, 'sideways_atr_min_pct': 0.022134731077016974, 'sideways_atr_max_pct': 0.04318613516134457, 'sideways_tp_mult': 1.7610541121698897, 'sideways_tsl_mult': 0.7557054715591638, 'sideways_time_stop': 11, 'sideways_use_sma': True, 'sideways_use_ema': False, 'sideways_use_atr': False, 'sideways_use_adx': True, 'sideways_use_spike': False, 'sideways_rsi_required': False}.
[I 2025-08-30 21:43:11,156] Trial 438 finished with values: [-1000000000.0, 1000000000.0] and parameters: {'p_sma': 35, 'p_std': 40, 'p_atr': 21, 'p_adx': 20, 'rsi_period': 74, 'ema1': 11, 'ema2': 53, 'slip_atr_k': 0.20579948515817892, 'slip_spread_k': 0.6942471128381731, 'spread_hl_frac': 0.034387262908703385, 'bb_std_mult': 0.691164112995187, 'rsi_os': 13, 'rsi_ob': 64, 'vol_spike': 0.2604530825174095, 'adx_thresh': 11.457583785344598, 'atr_min_pct': 0.012900360932053814, 'atr_max_pct': 0.017106016606228083, 'tp_mult': 1.68693198047454, 'tsl_mult': 0.966584258025159, 'strategy': 'mean_reversion', 'time_stop': 62, 'use_sma': True, 'use_atr': True, 'use_adx': True, 'use_ema': True, 'use_spike': True, 'rsi_required': True, 'edge_k': 0.8663238002653596, 'edge_cap': 0.8111608564109434, 'bull_strategy': 'breakout', 'bull_bb_std_mult': 1.9758783947917398, 'bull_rsi_os': 20, 'bull_rsi_ob': 88, 'bull_adx_thresh': 14.692304667460657, 'bull_atr_min_pct': 0.00178631501494579, 'bull_atr_max_pct': 0.07924946130248953, 'bull_tp_mult': 1.3017434235180294, 'bull_tsl_mult': 0.4067608270484864, 'bull_time_stop': 300, 'bull_use_sma': True, 'bull_use_ema': False, 'bull_use_atr': False, 'bull_use_adx': False, 'bull_use_spike': False, 'bull_rsi_required': True, 'bear_strategy': 'mean_reversion', 'bear_bb_std_mult': 1.9735647054591978, 'bear_rsi_os': 8, 'bear_rsi_ob': 71, 'bear_adx_thresh': 28.07771188182357, 'bear_atr_min_pct': 0.02943096607914328, 'bear_atr_max_pct': 0.11575232470783806, 'bear_tp_mult': 1.5754754838301932, 'bear_tsl_mult': 0.3756952772233596, 'bear_time_stop': 222, 'bear_use_sma': False, 'bear_use_ema': True, 'bear_use_atr': False, 'bear_use_adx': True, 'bear_use_spike': True, 'bear_rsi_required': True, 'sideways_strategy': 'breakout', 'sideways_bb_std_mult': 1.8857023009639067, 'sideways_rsi_os': 38, 'sideways_rsi_ob': 89, 'sideways_adx_thresh': 17.767274396858113, 'sideways_atr_min_pct': 0.020743962262492845, 'sideways_atr_max_pct': 0.04869803045130199, 'sideways_tp_mult': 1.806689212054598, 'sideways_tsl_mult': 0.7747389932788314, 'sideways_time_stop': 178, 'sideways_use_sma': False, 'sideways_use_ema': False, 'sideways_use_atr': False, 'sideways_use_adx': True, 'sideways_use_spike': False, 'sideways_rsi_required': False}.
[I 2025-08-30 21:43:43,271] Trial 439 finished with values: [-0.020827067312964354, 0.0207141985467768] and parameters: {'p_sma': 35, 'p_std': 38, 'p_atr': 21, 'p_adx': 21, 'rsi_period': 74, 'ema1': 11, 'ema2': 59, 'slip_atr_k': 0.22087927463855192, 'slip_spread_k': 0.6526146038400501, 'spread_hl_frac': 0.03461172433086248, 'bb_std_mult': 0.74004874018329, 'rsi_os': 12, 'rsi_ob': 64, 'vol_spike': 0.26194976540899484, 'adx_thresh': 8.193354950744684, 'atr_min_pct': 0.012802226200566133, 'atr_max_pct': 0.02498657402735011, 'tp_mult': 1.6963192556872555, 'tsl_mult': 0.8885862829439509, 'strategy': 'mean_reversion', 'time_stop': 41, 'use_sma': True, 'use_atr': True, 'use_adx': True, 'use_ema': True, 'use_spike': True, 'rsi_required': True, 'edge_k': 0.8646642496464751, 'edge_cap': 0.808514784686292, 'bull_strategy': 'breakout', 'bull_bb_std_mult': 1.8443258741743693, 'bull_rsi_os': 18, 'bull_rsi_ob': 88, 'bull_adx_thresh': 14.58686530999554, 'bull_atr_min_pct': 0.0005545288442036639, 'bull_atr_max_pct': 0.12035122472238485, 'bull_tp_mult': 1.3197180167409306, 'bull_tsl_mult': 0.4402224295212152, 'bull_time_stop': 300, 'bull_use_sma': True, 'bull_use_ema': False, 'bull_use_atr': False, 'bull_use_adx': False, 'bull_use_spike': False, 'bull_rsi_required': False, 'bear_strategy': 'mean_reversion', 'bear_bb_std_mult': 1.9759596243739357, 'bear_rsi_os': 7, 'bear_rsi_ob': 71, 'bear_adx_thresh': 28.061580399070028, 'bear_atr_min_pct': 0.029359880325341876, 'bear_atr_max_pct': 0.11665903683699928, 'bear_tp_mult': 1.5655897655879982, 'bear_tsl_mult': 0.3673693732933069, 'bear_time_stop': 216, 'bear_use_sma': False, 'bear_use_ema': True, 'bear_use_atr': False, 'bear_use_adx': True, 'bear_use_spike': True, 'bear_rsi_required': True, 'sideways_strategy': 'breakout', 'sideways_bb_std_mult': 1.7324230268573844, 'sideways_rsi_os': 38, 'sideways_rsi_ob': 90, 'sideways_adx_thresh': 27.081737721139877, 'sideways_atr_min_pct': 0.02770449096950743, 'sideways_atr_max_pct': 0.04818306904625384, 'sideways_tp_mult': 1.8189177210132785, 'sideways_tsl_mult': 0.7796534542218144, 'sideways_time_stop': 195, 'sideways_use_sma': False, 'sideways_use_ema': False, 'sideways_use_atr': False, 'sideways_use_adx': True, 'sideways_use_spike': False, 'sideways_rsi_required': False}.
[I 2025-08-30 21:43:43,546] Trial 440 finished with values: [-1000000000.0, 1000000000.0] and parameters: {'p_sma': 36, 'p_std': 37, 'p_atr': 21, 'p_adx': 20, 'rsi_period': 74, 'ema1': 11, 'ema2': 56, 'slip_atr_k': 0.01567778203589984, 'slip_spread_k': 0.7054586005745909, 'spread_hl_frac': 0.034577804597337, 'bb_std_mult': 0.9247802137466148, 'rsi_os': 12, 'rsi_ob': 64, 'vol_spike': 0.27566691763418233, 'adx_thresh': 11.523321350033232, 'atr_min_pct': 0.012775532006230338, 'atr_max_pct': 0.014419490155820476, 'tp_mult': 1.685252342707563, 'tsl_mult': 0.8900921300414184, 'strategy': 'mean_reversion', 'time_stop': 64, 'use_sma': True, 'use_atr': True, 'use_adx': True, 'use_ema': True, 'use_spike': True, 'rsi_required': True, 'edge_k': 1.0566826150199753, 'edge_cap': 0.8084049587275874, 'bull_strategy': 'breakout', 'bull_bb_std_mult': 1.8430058599116912, 'bull_rsi_os': 20, 'bull_rsi_ob': 87, 'bull_adx_thresh': 14.612281231732608, 'bull_atr_min_pct': 0.019129483117505182, 'bull_atr_max_pct': 0.07933478280501566, 'bull_tp_mult': 1.378400979911076, 'bull_tsl_mult': 0.40319829450268885, 'bull_time_stop': 300, 'bull_use_sma': True, 'bull_use_ema': False, 'bull_use_atr': False, 'bull_use_adx': False, 'bull_use_spike': False, 'bull_rsi_required': False, 'bear_strategy': 'breakout', 'bear_bb_std_mult': 1.9292619640623991, 'bear_rsi_os': 7, 'bear_rsi_ob': 68, 'bear_adx_thresh': 27.153070531215306, 'bear_atr_min_pct': 0.029351516123265742, 'bear_atr_max_pct': 0.11694524285497444, 'bear_tp_mult': 1.5852452181483494, 'bear_tsl_mult': 0.3722312166674345, 'bear_time_stop': 219, 'bear_use_sma': False, 'bear_use_ema': True, 'bear_use_atr': False, 'bear_use_adx': True, 'bear_use_spike': True, 'bear_rsi_required': True, 'sideways_strategy': 'breakout', 'sideways_bb_std_mult': 1.7625058690380286, 'sideways_rsi_os': 38, 'sideways_rsi_ob': 88, 'sideways_adx_thresh': 14.116067629709653, 'sideways_atr_min_pct': 0.02763147960231086, 'sideways_atr_max_pct': 0.035076037180310965, 'sideways_tp_mult': 1.8239967319798847, 'sideways_tsl_mult': 0.7819617872852557, 'sideways_time_stop': 237, 'sideways_use_sma': False, 'sideways_use_ema': False, 'sideways_use_atr': False, 'sideways_use_adx': True, 'sideways_use_spike': True, 'sideways_rsi_required': False}.
