[I 2025-08-30 21:40:18,297] Trial 413 finished with values: [-1000000000.0, 1000000000.0] and parameters: {'p_sma': 30, 'p_std': 32, 'p_atr': 18, 'p_adx': 18, 'rsi_period': 70, 'ema1': 16, 'ema2': 33, 'slip_atr_k': 0.031101947891668896, 'slip_spread_k': 0.6003396364116141, 'spread_hl_frac': 0.029302024161687763, 'bb_std_mult': 1.5560323812781267, 'rsi_os': 7, 'rsi_ob': 65, 'vol_spike': 0.14211196192678166, 'adx_thresh': 13.669598441283508, 'atr_min_pct': 0.009061741850467358, 'atr_max_pct': 0.13279694921687563, 'tp_mult': 1.7186265692735618, 'tsl_mult': 0.23755127067843745, 'strategy': 'breakout', 'time_stop': 137, 'use_sma': True, 'use_atr': False, 'use_adx': False, 'use_ema': False, 'use_spike': False, 'rsi_required': True, 'edge_k': 1.212759538009915, 'edge_cap': 0.05862736705092725, 'bull_strategy': 'breakout', 'bull_bb_std_mult': 3.039231897002306, 'bull_rsi_os': 15, 'bull_rsi_ob': 94, 'bull_adx_thresh': 15.41595126384317, 'bull_atr_min_pct': 0.013127674508381605, 'bull_atr_max_pct': 0.04778003762831612, 'bull_tp_mult': 2.258901246596804, 'bull_tsl_mult': 0.3167748094396206, 'bull_time_stop': 237, 'bull_use_sma': False, 'bull_use_ema': False, 'bull_use_atr': True, 'bull_use_adx': True, 'bull_use_spike': False, 'bull_rsi_required': False, 'bear_strategy': 'mean_reversion', 'bear_bb_std_mult': 2.673972602961637, 'bear_rsi_os': 31, 'bear_rsi_ob': 76, 'bear_adx_thresh': 9.955702172834664, 'bear_atr_min_pct': 0.027609561840412418, 'bear_atr_max_pct': 0.10920579870873175, 'bear_tp_mult': 1.4971264120525447, 'bear_tsl_mult': 0.6501104311067233, 'bear_time_stop': 74, 'bear_use_sma': False, 'bear_use_ema': True, 'bear_use_atr': False, 'bear_use_adx': True, 'bear_use_spike': True, 'bear_rsi_required': False, 'sideways_strategy': 'breakout', 'sideways_bb_std_mult': 1.6217219547803097, 'sideways_rsi_os': 38, 'sideways_rsi_ob': 84, 'sideways_adx_thresh': 28.28250159507809, 'sideways_atr_min_pct': 0.02513985519474805, 'sideways_atr_max_pct': 0.14744223101219656, 'sideways_tp_mult': 1.5645939369056212, 'sideways_tsl_mult': 0.917541796757339, 'sideways_time_stop': 276, 'sideways_use_sma': False, 'sideways_use_ema': False, 'sideways_use_atr': False, 'sideways_use_adx': True, 'sideways_use_spike': False, 'sideways_rsi_required': False}.
[I 2025-08-30 21:40:18,482] Trial 414 finished with values: [-1000000000.0, 1000000000.0] and parameters: {'p_sma': 10, 'p_std': 34, 'p_atr': 18, 'p_adx': 20, 'rsi_period': 75, 'ema1': 19, 'ema2': 13, 'slip_atr_k': 0.03164317829017778, 'slip_spread_k': 0.5982740347628279, 'spread_hl_frac': 0.028226084363766463, 'bb_std_mult': 0.9907543557512963, 'rsi_os': 9, 'rsi_ob': 73, 'vol_spike': 0.2164152239253415, 'adx_thresh': 17.946983216554894, 'atr_min_pct': 0.008971872152326574, 'atr_max_pct': 0.1307957962536358, 'tp_mult': 1.7190511182732908, 'tsl_mult': 0.37251762290954393, 'strategy': 'breakout', 'time_stop': 72, 'use_sma': True, 'use_atr': False, 'use_adx': False, 'use_ema': False, 'use_spike': False, 'rsi_required': True, 'edge_k': 1.1916721665051435, 'edge_cap': 0.6341414593333614, 'bull_strategy': 'breakout', 'bull_bb_std_mult': 1.1768380259306077, 'bull_rsi_os': 51, 'bull_rsi_ob': 83, 'bull_adx_thresh': 15.325192134821863, 'bull_atr_min_pct': 0.0018864261560503806, 'bull_atr_max_pct': 0.047959651927251, 'bull_tp_mult': 2.261744151850084, 'bull_tsl_mult': 0.6292884631264098, 'bull_time_stop': 296, 'bull_use_sma': False, 'bull_use_ema': False, 'bull_use_atr': True, 'bull_use_adx': True, 'bull_use_spike': False, 'bull_rsi_required': False, 'bear_strategy': 'breakout', 'bear_bb_std_mult': 2.6505638147578967, 'bear_rsi_os': 38, 'bear_rsi_ob': 76, 'bear_adx_thresh': 11.00755653002498, 'bear_atr_min_pct': 0.028955581983544542, 'bear_atr_max_pct': 0.10900193990864515, 'bear_tp_mult': 1.500801157113358, 'bear_tsl_mult': 0.36173252001585876, 'bear_time_stop': 156, 'bear_use_sma': False, 'bear_use_ema': True, 'bear_use_atr': False, 'bear_use_adx': True, 'bear_use_spike': True, 'bear_rsi_required': False, 'sideways_strategy': 'mean_reversion', 'sideways_bb_std_mult': 2.444743573025114, 'sideways_rsi_os': 37, 'sideways_rsi_ob': 86, 'sideways_adx_thresh': 28.444964746932563, 'sideways_atr_min_pct': 0.025190096396826546, 'sideways_atr_max_pct': 0.14793667973365476, 'sideways_tp_mult': 1.938815191318129, 'sideways_tsl_mult': 0.1758205095095871, 'sideways_time_stop': 249, 'sideways_use_sma': False, 'sideways_use_ema': False, 'sideways_use_atr': False, 'sideways_use_adx': True, 'sideways_use_spike': False, 'sideways_rsi_required': False}.
[I 2025-08-30 21:40:52,737] Trial 418 finished with values: [-1000000000.0, 1000000000.0] and parameters: {'p_sma': 37, 'p_std': 34, 'p_atr': 19, 'p_adx': 24, 'rsi_period': 75, 'ema1': 6, 'ema2': 50, 'slip_atr_k': 0.011808383095034871, 'slip_spread_k': 0.41194949844126605, 'spread_hl_frac': 0.020697302306328567, 'bb_std_mult': 3.160137754948672, 'rsi_os': 34, 'rsi_ob': 61, 'vol_spike': 0.29487112462997384, 'adx_thresh': 19.93109236012599, 'atr_min_pct': 0.012073993768551967, 'atr_max_pct': 0.06351550301177146, 'tp_mult': 1.6229881395890322, 'tsl_mult': 0.36511786099818494, 'strategy': 'mean_reversion', 'time_stop': 145, 'use_sma': True, 'use_atr': True, 'use_adx': True, 'use_ema': True, 'use_spike': True, 'rsi_required': False, 'edge_k': 1.3568981441950552, 'edge_cap': 0.655588837011921, 'bull_strategy': 'breakout', 'bull_bb_std_mult': 2.4124659633229144, 'bull_rsi_os': 51, 'bull_rsi_ob': 89, 'bull_adx_thresh': 14.145410342738309, 'bull_atr_min_pct': 0.0225653033505255, 'bull_atr_max_pct': 0.044360417166503525, 'bull_tp_mult': 2.306389034974711, 'bull_tsl_mult': 0.34558349414154366, 'bull_time_stop': 291, 'bull_use_sma': True, 'bull_use_ema': True, 'bull_use_atr': False, 'bull_use_adx': True, 'bull_use_spike': False, 'bull_rsi_required': True, 'bear_strategy': 'breakout', 'bear_bb_std_mult': 2.8818419157986352, 'bear_rsi_os': 38, 'bear_rsi_ob': 77, 'bear_adx_thresh': 30.86812780225368, 'bear_atr_min_pct': 0.029090364845709378, 'bear_atr_max_pct': 0.01049812457831865, 'bear_tp_mult': 1.61842691777096, 'bear_tsl_mult': 0.08661250020226974, 'bear_time_stop': 96, 'bear_use_sma': False, 'bear_use_ema': True, 'bear_use_atr': True, 'bear_use_adx': False, 'bear_use_spike': False, 'bear_rsi_required': True, 'sideways_strategy': 'mean_reversion', 'sideways_bb_std_mult': 2.4662997363307735, 'sideways_rsi_os': 31, 'sideways_rsi_ob': 87, 'sideways_adx_thresh': 26.795889343442838, 'sideways_atr_min_pct': 0.019965921700058002, 'sideways_atr_max_pct': 0.1498805054248247, 'sideways_tp_mult': 2.024083849276525, 'sideways_tsl_mult': 0.04084052459006127, 'sideways_time_stop': 260, 'sideways_use_sma': True, 'sideways_use_ema': False, 'sideways_use_atr': False, 'sideways_use_adx': True, 'sideways_use_spike': True, 'sideways_rsi_required': False}.
[I 2025-08-30 21:40:53,037] Trial 419 finished with values: [-1000000000.0, 1000000000.0] and parameters: {'p_sma': 47, 'p_std': 34, 'p_atr': 29, 'p_adx': 24, 'rsi_period': 71, 'ema1': 5, 'ema2': 50, 'slip_atr_k': 0.018124703345216014, 'slip_spread_k': 0.4225284911121911, 'spread_hl_frac': 0.026476933004508468, 'bb_std_mult': 1.464727264851969, 'rsi_os': 10, 'rsi_ob': 61, 'vol_spike': 0.295020360575696, 'adx_thresh': 16.573635573084463, 'atr_min_pct': 0.005465849814238009, 'atr_max_pct': 0.09494323758815404, 'tp_mult': 1.6261829436700246, 'tsl_mult': 0.5720661949909722, 'strategy': 'mean_reversion', 'time_stop': 143, 'use_sma': True, 'use_atr': True, 'use_adx': True, 'use_ema': True, 'use_spike': True, 'rsi_required': False, 'edge_k': 1.1304488115914078, 'edge_cap': 0.2591652346642198, 'bull_strategy': 'breakout', 'bull_bb_std_mult': 2.3916216483255885, 'bull_rsi_os': 39, 'bull_rsi_ob': 89, 'bull_adx_thresh': 28.139101217684576, 'bull_atr_min_pct': 0.021293392871862406, 'bull_atr_max_pct': 0.14564529566486728, 'bull_tp_mult': 2.284636787640144, 'bull_tsl_mult': 0.3446374264869664, 'bull_time_stop': 131, 'bull_use_sma': True, 'bull_use_ema': True, 'bull_use_atr': False, 'bull_use_adx': True, 'bull_use_spike': False, 'bull_rsi_required': True, 'bear_strategy': 'mean_reversion', 'bear_bb_std_mult': 2.868802247965101, 'bear_rsi_os': 9, 'bear_rsi_ob': 77, 'bear_adx_thresh': 12.62788434112335, 'bear_atr_min_pct': 0.027996106298394538, 'bear_atr_max_pct': 0.06814464313469781, 'bear_tp_mult': 1.6384603664902746, 'bear_tsl_mult': 0.10571571408316388, 'bear_time_stop': 94, 'bear_use_sma': False, 'bear_use_ema': True, 'bear_use_atr': True, 'bear_use_adx': False, 'bear_use_spike': False, 'bear_rsi_required': True, 'sideways_strategy': 'breakout', 'sideways_bb_std_mult': 2.0319019105551255, 'sideways_rsi_os': 31, 'sideways_rsi_ob': 72, 'sideways_adx_thresh': 26.63555361845531, 'sideways_atr_min_pct': 0.01996498493185614, 'sideways_atr_max_pct': 0.13250686210135454, 'sideways_tp_mult': 1.4328489896034537, 'sideways_tsl_mult': 0.7104419981037542, 'sideways_time_stop': 34, 'sideways_use_sma': True, 'sideways_use_ema': False, 'sideways_use_atr': False, 'sideways_use_adx': True, 'sideways_use_spike': True, 'sideways_rsi_required': False}.
[I 2025-08-30 21:40:53,146] Trial 417 finished with values: [-1000000000.0, 1000000000.0] and parameters: {'p_sma': 28, 'p_std': 34, 'p_atr': 24, 'p_adx': 22, 'rsi_period': 70, 'ema1': 16, 'ema2': 10, 'slip_atr_k': 0.015246429472603832, 'slip_spread_k': 0.5100230720276211, 'spread_hl_frac': 0.02655478623292827, 'bb_std_mult': 2.6474938489674287, 'rsi_os': 41, 'rsi_ob': 65, 'vol_spike': 0.29548659981892295, 'adx_thresh': 13.444077178830723, 'atr_min_pct': 0.012362482917882951, 'atr_max_pct': 0.13276251382682402, 'tp_mult': 1.7217630708178702, 'tsl_mult': 0.3230084351433471, 'strategy': 'breakout', 'time_stop': 75, 'use_sma': True, 'use_atr': False, 'use_adx': False, 'use_ema': True, 'use_spike': False, 'rsi_required': False, 'edge_k': 1.083323355242074, 'edge_cap': 0.05160955289938962, 'bull_strategy': 'breakout', 'bull_bb_std_mult': 3.0184438743638444, 'bull_rsi_os': 16, 'bull_rsi_ob': 82, 'bull_adx_thresh': 28.171034056972033, 'bull_atr_min_pct': 0.018246589056803937, 'bull_atr_max_pct': 0.1103708723600351, 'bull_tp_mult': 2.283357477641689, 'bull_tsl_mult': 0.6334964805006985, 'bull_time_stop': 290, 'bull_use_sma': True, 'bull_use_ema': True, 'bull_use_atr': True, 'bull_use_adx': True, 'bull_use_spike': False, 'bull_rsi_required': True, 'bear_strategy': 'breakout', 'bear_bb_std_mult': 2.3526177770453773, 'bear_rsi_os': 38, 'bear_rsi_ob': 77, 'bear_adx_thresh': 12.698816564134765, 'bear_atr_min_pct': 0.028973981383584986, 'bear_atr_max_pct': 0.010539334467444254, 'bear_tp_mult': 1.6332264038286752, 'bear_tsl_mult': 0.8516368011615194, 'bear_time_stop': 100, 'bear_use_sma': False, 'bear_use_ema': True, 'bear_use_atr': True, 'bear_use_adx': False, 'bear_use_spike': False, 'bear_rsi_required': False, 'sideways_strategy': 'breakout', 'sideways_bb_std_mult': 2.97039580451212, 'sideways_rsi_os': 18, 'sideways_rsi_ob': 58, 'sideways_adx_thresh': 28.135375104510725, 'sideways_atr_min_pct': 0.019917148885342698, 'sideways_atr_max_pct': 0.14998422890080945, 'sideways_tp_mult': 2.0238160212678964, 'sideways_tsl_mult': 0.16998988066930498, 'sideways_time_stop': 274, 'sideways_use_sma': True, 'sideways_use_ema': False, 'sideways_use_atr': False, 'sideways_use_adx': True, 'sideways_use_spike': True, 'sideways_rsi_required': False}.
[I 2025-08-30 21:40:53,241] Trial 416 finished with values: [-1000000000.0, 1000000000.0] and parameters: {'p_sma': 28, 'p_std': 34, 'p_atr': 24, 'p_adx': 22, 'rsi_period': 70, 'ema1': 16, 'ema2': 13, 'slip_atr_k': 0.09703041650811534, 'slip_spread_k': 0.5045234991413403, 'spread_hl_frac': 0.02641685966224398, 'bb_std_mult': 1.4770974695406869, 'rsi_os': 34, 'rsi_ob': 65, 'vol_spike': 0.18661414827030845, 'adx_thresh': 13.39816599074164, 'atr_min_pct': 0.00889938137478245, 'atr_max_pct': 0.09524805999804968, 'tp_mult': 1.621358912959985, 'tsl_mult': 0.8526911158151778, 'strategy': 'breakout', 'time_stop': 123, 'use_sma': True, 'use_atr': False, 'use_adx': False, 'use_ema': True, 'use_spike': False, 'rsi_required': False, 'edge_k': 1.1564025753603748, 'edge_cap': 0.16577144655109016, 'bull_strategy': 'breakout', 'bull_bb_std_mult': 3.032756788495721, 'bull_rsi_os': 49, 'bull_rsi_ob': 82, 'bull_adx_thresh': 17.445638989225838, 'bull_atr_min_pct': 0.02116829009775763, 'bull_atr_max_pct': 0.027861598705346893, 'bull_tp_mult': 1.2468813755965482, 'bull_tsl_mult': 0.8621680223553219, 'bull_time_stop': 31, 'bull_use_sma': True, 'bull_use_ema': True, 'bull_use_atr': True, 'bull_use_adx': True, 'bull_use_spike': False, 'bull_rsi_required': True, 'bear_strategy': 'breakout', 'bear_bb_std_mult': 2.5408741670631496, 'bear_rsi_os': 38, 'bear_rsi_ob': 77, 'bear_adx_thresh': 12.480292077367457, 'bear_atr_min_pct': 0.027873964855448866, 'bear_atr_max_pct': 0.12432536992703161, 'bear_tp_mult': 1.626879223893967, 'bear_tsl_mult': 0.859585282399867, 'bear_time_stop': 96, 'bear_use_sma': False, 'bear_use_ema': True, 'bear_use_atr': True, 'bear_use_adx': False, 'bear_use_spike': False, 'bear_rsi_required': False, 'sideways_strategy': 'breakout', 'sideways_bb_std_mult': 2.9675475855127162, 'sideways_rsi_os': 42, 'sideways_rsi_ob': 72, 'sideways_adx_thresh': 28.06242216807647, 'sideways_atr_min_pct': 0.019956778471978735, 'sideways_atr_max_pct': 0.14179881684457707, 'sideways_tp_mult': 2.0711931735355615, 'sideways_tsl_mult': 0.1806796250023494, 'sideways_time_stop': 273, 'sideways_use_sma': True, 'sideways_use_ema': False, 'sideways_use_atr': False, 'sideways_use_adx': True, 'sideways_use_spike': True, 'sideways_rsi_required': False}.
[I 2025-08-30 21:40:54,135] Trial 421 finished with values: [-1000000000.0, 1000000000.0] and parameters: {'p_sma': 49, 'p_std': 36, 'p_atr': 21, 'p_adx': 21, 'rsi_period': 67, 'ema1': 9, 'ema2': 54, 'slip_atr_k': 0.07045487439665073, 'slip_spread_k': 0.6908034378741502, 'spread_hl_frac': 0.03348808966283168, 'bb_std_mult': 1.3598832737544837, 'rsi_os': 11, 'rsi_ob': 66, 'vol_spike': 0.28133139483280667, 'adx_thresh': 15.266840974227236, 'atr_min_pct': 0.029867366186105207, 'atr_max_pct': 0.020931144098180955, 'tp_mult': 2.042413621433945, 'tsl_mult': 0.7480589601001915, 'strategy': 'mean_reversion', 'time_stop': 89, 'use_sma': True, 'use_atr': True, 'use_adx': True, 'use_ema': True, 'use_spike': True, 'rsi_required': True, 'edge_k': 1.0196954496625568, 'edge_cap': 0.9081333162016774, 'bull_strategy': 'breakout', 'bull_bb_std_mult': 0.6612755166824067, 'bull_rsi_os': 17, 'bull_rsi_ob': 92, 'bull_adx_thresh': 14.37563067272484, 'bull_atr_min_pct': 0.00118915905648026, 'bull_atr_max_pct': 0.018558325158992493, 'bull_tp_mult': 2.7997442648576434, 'bull_tsl_mult': 0.3963089119731746, 'bull_time_stop': 300, 'bull_use_sma': True, 'bull_use_ema': False, 'bull_use_atr': False, 'bull_use_adx': False, 'bull_use_spike': False, 'bull_rsi_required': True, 'bear_strategy': 'mean_reversion', 'bear_bb_std_mult': 2.529942135471177, 'bear_rsi_os': 15, 'bear_rsi_ob': 79, 'bear_adx_thresh': 33.273531503806055, 'bear_atr_min_pct': 0.028142393489492035, 'bear_atr_max_pct': 0.014107325736894029, 'bear_tp_mult': 1.6878805894396887, 'bear_tsl_mult': 0.38539216942068005, 'bear_time_stop': 184, 'bear_use_sma': False, 'bear_use_ema': True, 'bear_use_atr': False, 'bear_use_adx': True, 'bear_use_spike': True, 'bear_rsi_required': True, 'sideways_strategy': 'breakout', 'sideways_bb_std_mult': 2.134915477093822, 'sideways_rsi_os': 39, 'sideways_rsi_ob': 89, 'sideways_adx_thresh': 19.245279740402015, 'sideways_atr_min_pct': 0.02442953780193572, 'sideways_atr_max_pct': 0.1421050529726852, 'sideways_tp_mult': 2.065797673141386, 'sideways_tsl_mult': 0.7751023026288403, 'sideways_time_stop': 168, 'sideways_use_sma': False, 'sideways_use_ema': False, 'sideways_use_atr': False, 'sideways_use_adx': True, 'sideways_use_spike': False, 'sideways_rsi_required': False}.
[I 2025-08-30 21:41:26,848] Trial 422 finished with values: [-1000000000.0, 1000000000.0] and parameters: {'p_sma': 32, 'p_std': 36, 'p_atr': 21, 'p_adx': 21, 'rsi_period': 81, 'ema1': 9, 'ema2': 54, 'slip_atr_k': 0.028290018382342255, 'slip_spread_k': 0.5070580671257574, 'spread_hl_frac': 0.037863427708991405, 'bb_std_mult': 1.3455079502334897, 'rsi_os': 11, 'rsi_ob': 59, 'vol_spike': 0.281842052864876, 'adx_thresh': 15.166432216083347, 'atr_min_pct': 0.0084342101877963, 'atr_max_pct': 0.09605491377885522, 'tp_mult': 1.147504632446235, 'tsl_mult': 0.8565812363383041, 'strategy': 'mean_reversion', 'time_stop': 90, 'use_sma': True, 'use_atr': True, 'use_adx': True, 'use_ema': True, 'use_spike': True, 'rsi_required': True, 'edge_k': 1.1453808601611644, 'edge_cap': 0.1705109219741493, 'bull_strategy': 'breakout', 'bull_bb_std_mult': 1.7930775806736037, 'bull_rsi_os': 17, 'bull_rsi_ob': 90, 'bull_adx_thresh': 20.053361340762873, 'bull_atr_min_pct': 0.0007700327043940127, 'bull_atr_max_pct': 0.05158346788829907, 'bull_tp_mult': 2.232514148908717, 'bull_tsl_mult': 0.874328978655209, 'bull_time_stop': 300, 'bull_use_sma': True, 'bull_use_ema': False, 'bull_use_atr': False, 'bull_use_adx': False, 'bull_use_spike': False, 'bull_rsi_required': True, 'bear_strategy': 'mean_reversion', 'bear_bb_std_mult': 2.5527607740449607, 'bear_rsi_os': 18, 'bear_rsi_ob': 73, 'bear_adx_thresh': 11.940068806530583, 'bear_atr_min_pct': 0.008086259458227107, 'bear_atr_max_pct': 0.11637186921845147, 'bear_tp_mult': 1.4017074727464935, 'bear_tsl_mult': 0.3956616357670796, 'bear_time_stop': 251, 'bear_use_sma': False, 'bear_use_ema': True, 'bear_use_atr': False, 'bear_use_adx': True, 'bear_use_spike': True, 'bear_rsi_required': True, 'sideways_strategy': 'breakout', 'sideways_bb_std_mult': 1.692447590653829, 'sideways_rsi_os': 46, 'sideways_rsi_ob': 89, 'sideways_adx_thresh': 27.38122274296125, 'sideways_atr_min_pct': 0.024338032297926325, 'sideways_atr_max_pct': 0.14272518409967372, 'sideways_tp_mult': 2.0620452778381364, 'sideways_tsl_mult': 0.8576792897256462, 'sideways_time_stop': 167, 'sideways_use_sma': False, 'sideways_use_ema': False, 'sideways_use_atr': False, 'sideways_use_adx': True, 'sideways_use_spike': False, 'sideways_rsi_required': False}.
[I 2025-08-30 21:41:27,213] Trial 420 finished with values: [-1000000000.0, 1000000000.0] and parameters: {'p_sma': 32, 'p_std': 35, 'p_atr': 24, 'p_adx': 21, 'rsi_period': 72, 'ema1': 20, 'ema2': 10, 'slip_atr_k': 0.02071865927001773, 'slip_spread_k': 0.49931711575547516, 'spread_hl_frac': 0.02633844550059574, 'bb_std_mult': 1.4650717510794862, 'rsi_os': 11, 'rsi_ob': 66, 'vol_spike': 0.283948507711862, 'adx_thresh': 16.775125496108913, 'atr_min_pct': 0.012465251566369932, 'atr_max_pct': 0.09460648760592323, 'tp_mult': 1.8826096449154435, 'tsl_mult': 0.8649745291901961, 'strategy': 'mean_reversion', 'time_stop': 89, 'use_sma': True, 'use_atr': True, 'use_adx': True, 'use_ema': True, 'use_spike': True, 'rsi_required': True, 'edge_k': 1.1422571513601036, 'edge_cap': 0.5073771390903349, 'bull_strategy': 'breakout', 'bull_bb_std_mult': 2.668677888809562, 'bull_rsi_os': 41, 'bull_rsi_ob': 92, 'bull_adx_thresh': 28.05541369018192, 'bull_atr_min_pct': 0.0009883311736342448, 'bull_atr_max_pct': 0.011114087983863152, 'bull_tp_mult': 2.14993008969059, 'bull_tsl_mult': 0.39957115634870366, 'bull_time_stop': 290, 'bull_use_sma': True, 'bull_use_ema': True, 'bull_use_atr': False, 'bull_use_adx': True, 'bull_use_spike': False, 'bull_rsi_required': True, 'bear_strategy': 'mean_reversion', 'bear_bb_std_mult': 2.549433409819732, 'bear_rsi_os': 9, 'bear_rsi_ob': 78, 'bear_adx_thresh': 6.146718843594057, 'bear_atr_min_pct': 0.027931970956991684, 'bear_atr_max_pct': 0.014723865584273736, 'bear_tp_mult': 1.691027669657739, 'bear_tsl_mult': 0.8549610060696907, 'bear_time_stop': 104, 'bear_use_sma': False, 'bear_use_ema': True, 'bear_use_atr': False, 'bear_use_adx': True, 'bear_use_spike': True, 'bear_rsi_required': True, 'sideways_strategy': 'breakout', 'sideways_bb_std_mult': 0.5072812869297323, 'sideways_rsi_os': 18, 'sideways_rsi_ob': 89, 'sideways_adx_thresh': 19.26264523710723, 'sideways_atr_min_pct': 0.021429616749050726, 'sideways_atr_max_pct': 0.13197852004976274, 'sideways_tp_mult': 1.8158950246621037, 'sideways_tsl_mult': 0.7660898787005824, 'sideways_time_stop': 272, 'sideways_use_sma': False, 'sideways_use_ema': False, 'sideways_use_atr': False, 'sideways_use_adx': True, 'sideways_use_spike': False, 'sideways_rsi_required': False}.
