[I 2025-08-30 21:19:57,822] Trial 263 finished with values: [-1000000000.0, 1000000000.0] and parameters: {'p_sma': 12, 'p_std': 34, 'p_atr': 27, 'p_adx': 14, 'rsi_period': 18, 'ema1': 30, 'ema2': 44, 'slip_atr_k': 0.21429343400526085, 'slip_spread_k': 0.5676487553930469, 'spread_hl_frac': 0.034110787288817716, 'bb_std_mult': 1.5519429222912962, 'rsi_os': 14, 'rsi_ob': 63, 'vol_spike': 0.2940554562419029, 'adx_thresh': 28.582588495969823, 'atr_min_pct': 0.022416625036495014, 'atr_max_pct': 0.020669993480543845, 'tp_mult': 1.6078170676884018, 'tsl_mult': 0.9661371847869883, 'strategy': 'mean_reversion', 'time_stop': 94, 'use_sma': False, 'use_atr': True, 'use_adx': True, 'use_ema': True, 'use_spike': True, 'rsi_required': True, 'edge_k': 0.8639959439149916, 'edge_cap': 0.5649278420406268, 'bull_strategy': 'breakout', 'bull_bb_std_mult': 1.814619000611144, 'bull_rsi_os': 8, 'bull_rsi_ob': 70, 'bull_adx_thresh': 30.52675545744288, 'bull_atr_min_pct': 0.00043937391091720317, 'bull_atr_max_pct': 0.022905401907190558, 'bull_tp_mult': 2.3327209020931408, 'bull_tsl_mult': 0.43260753338545505, 'bull_time_stop': 300, 'bull_use_sma': False, 'bull_use_ema': False, 'bull_use_atr': False, 'bull_use_adx': False, 'bull_use_spike': True, 'bull_rsi_required': True, 'bear_strategy': 'mean_reversion', 'bear_bb_std_mult': 2.6351099411563363, 'bear_rsi_os': 42, 'bear_rsi_ob': 53, 'bear_adx_thresh': 22.011664765792798, 'bear_atr_min_pct': 0.025371205319369768, 'bear_atr_max_pct': 0.1223023966658045, 'bear_tp_mult': 2.552731315137807, 'bear_tsl_mult': 0.44057062080472453, 'bear_time_stop': 122, 'bear_use_sma': True, 'bear_use_ema': False, 'bear_use_atr': False, 'bear_use_adx': True, 'bear_use_spike': False, 'bear_rsi_required': True, 'sideways_strategy': 'breakout', 'sideways_bb_std_mult': 1.7700923753669633, 'sideways_rsi_os': 7, 'sideways_rsi_ob': 87, 'sideways_adx_thresh': 26.83800652714287, 'sideways_atr_min_pct': 0.014742005473985426, 'sideways_atr_max_pct': 0.10576262224162455, 'sideways_tp_mult': 1.5799736625852177, 'sideways_tsl_mult': 0.40973837144079683, 'sideways_time_stop': 266, 'sideways_use_sma': True, 'sideways_use_ema': True, 'sideways_use_atr': True, 'sideways_use_adx': False, 'sideways_use_spike': True, 'sideways_rsi_required': True}.
[I 2025-08-30 21:19:58,949] Trial 265 finished with values: [-1000000000.0, 1000000000.0] and parameters: {'p_sma': 50, 'p_std': 32, 'p_atr': 21, 'p_adx': 30, 'rsi_period': 25, 'ema1': 18, 'ema2': 57, 'slip_atr_k': 0.039401528491284796, 'slip_spread_k': 0.6219710271835752, 'spread_hl_frac': 0.005184617655915598, 'bb_std_mult': 1.7936824539357101, 'rsi_os': 13, 'rsi_ob': 50, 'vol_spike': 0.2927719343334756, 'adx_thresh': 29.894963012316346, 'atr_min_pct': 0.01959351379562727, 'atr_max_pct': 0.04220040819164121, 'tp_mult': 1.6159256533391653, 'tsl_mult': 0.8846135425258876, 'strategy': 'mean_reversion', 'time_stop': 122, 'use_sma': False, 'use_atr': False, 'use_adx': True, 'use_ema': False, 'use_spike': True, 'rsi_required': True, 'edge_k': 1.476745739346224, 'edge_cap': 0.6119370727485907, 'bull_strategy': 'breakout', 'bull_bb_std_mult': 0.775653516335244, 'bull_rsi_os': 16, 'bull_rsi_ob': 56, 'bull_adx_thresh': 16.585460684813754, 'bull_atr_min_pct': 0.02160392375155034, 'bull_atr_max_pct': 0.05730457100093628, 'bull_tp_mult': 2.311593887938581, 'bull_tsl_mult': 0.3593274756117401, 'bull_time_stop': 252, 'bull_use_sma': True, 'bull_use_ema': False, 'bull_use_atr': False, 'bull_use_adx': True, 'bull_use_spike': False, 'bull_rsi_required': True, 'bear_strategy': 'mean_reversion', 'bear_bb_std_mult': 1.059755587717266, 'bear_rsi_os': 41, 'bear_rsi_ob': 90, 'bear_adx_thresh': 28.45267882404675, 'bear_atr_min_pct': 0.016248067693237608, 'bear_atr_max_pct': 0.11039083688276911, 'bear_tp_mult': 2.9051786579571335, 'bear_tsl_mult': 0.4198881585710361, 'bear_time_stop': 248, 'bear_use_sma': False, 'bear_use_ema': False, 'bear_use_atr': False, 'bear_use_adx': False, 'bear_use_spike': True, 'bear_rsi_required': True, 'sideways_strategy': 'breakout', 'sideways_bb_std_mult': 1.3655707701656108, 'sideways_rsi_os': 40, 'sideways_rsi_ob': 93, 'sideways_adx_thresh': 27.96372852815916, 'sideways_atr_min_pct': 0.013891080486489326, 'sideways_atr_max_pct': 0.0951127321693173, 'sideways_tp_mult': 1.915612424152493, 'sideways_tsl_mult': 0.47600609608546113, 'sideways_time_stop': 261, 'sideways_use_sma': False, 'sideways_use_ema': False, 'sideways_use_atr': False, 'sideways_use_adx': True, 'sideways_use_spike': False, 'sideways_rsi_required': False}.
[I 2025-08-30 21:20:24,012] Trial 260 finished with values: [-1000000000.0, 1000000000.0] and parameters: {'p_sma': 47, 'p_std': 20, 'p_atr': 27, 'p_adx': 30, 'rsi_period': 17, 'ema1': 17, 'ema2': 52, 'slip_atr_k': 0.04944994810342003, 'slip_spread_k': 0.5636495919071992, 'spread_hl_frac': 0.04486900124422761, 'bb_std_mult': 1.6553051548182147, 'rsi_os': 7, 'rsi_ob': 81, 'vol_spike': 0.04020097207307996, 'adx_thresh': 29.762132333385843, 'atr_min_pct': 0.020401186706627276, 'atr_max_pct': 0.04141051104066742, 'tp_mult': 1.7249413963173788, 'tsl_mult': 0.9277412206889794, 'strategy': 'breakout', 'time_stop': 141, 'use_sma': False, 'use_atr': True, 'use_adx': False, 'use_ema': True, 'use_spike': False, 'rsi_required': False, 'edge_k': 0.676609163132198, 'edge_cap': 0.5974911937361252, 'bull_strategy': 'mean_reversion', 'bull_bb_std_mult': 3.292300800878381, 'bull_rsi_os': 18, 'bull_rsi_ob': 68, 'bull_adx_thresh': 17.17915992700095, 'bull_atr_min_pct': 5.866724444006995e-05, 'bull_atr_max_pct': 0.14749506858062184, 'bull_tp_mult': 2.311084399242958, 'bull_tsl_mult': 0.35404072250121243, 'bull_time_stop': 300, 'bull_use_sma': False, 'bull_use_ema': True, 'bull_use_atr': True, 'bull_use_adx': True, 'bull_use_spike': True, 'bull_rsi_required': False, 'bear_strategy': 'breakout', 'bear_bb_std_mult': 0.5143958959156765, 'bear_rsi_os': 42, 'bear_rsi_ob': 94, 'bear_adx_thresh': 8.233331551475839, 'bear_atr_min_pct': 0.01595063207705947, 'bear_atr_max_pct': 0.10952433388560501, 'bear_tp_mult': 1.1556964999151158, 'bear_tsl_mult': 0.4784292231856869, 'bear_time_stop': 88, 'bear_use_sma': True, 'bear_use_ema': False, 'bear_use_atr': True, 'bear_use_adx': True, 'bear_use_spike': False, 'bear_rsi_required': False, 'sideways_strategy': 'mean_reversion', 'sideways_bb_std_mult': 1.3879486777178083, 'sideways_rsi_os': 39, 'sideways_rsi_ob': 89, 'sideways_adx_thresh': 26.934781446287005, 'sideways_atr_min_pct': 0.0149117646100403, 'sideways_atr_max_pct': 0.092315574022943, 'sideways_tp_mult': 2.0455978773438157, 'sideways_tsl_mult': 0.5294822011897822, 'sideways_time_stop': 264, 'sideways_use_sma': True, 'sideways_use_ema': True, 'sideways_use_atr': True, 'sideways_use_adx': False, 'sideways_use_spike': True, 'sideways_rsi_required': True}.
[I 2025-08-30 21:20:24,486] Trial 261 finished with values: [-1000000000.0, 1000000000.0] and parameters: {'p_sma': 32, 'p_std': 34, 'p_atr': 27, 'p_adx': 15, 'rsi_period': 17, 'ema1': 17, 'ema2': 30, 'slip_atr_k': 0.1674795272048511, 'slip_spread_k': 0.6192730949528877, 'spread_hl_frac': 0.004345131838515241, 'bb_std_mult': 1.6617483969931102, 'rsi_os': 11, 'rsi_ob': 62, 'vol_spike': 0.10752012643245851, 'adx_thresh': 29.932867840521862, 'atr_min_pct': 0.020365827646597726, 'atr_max_pct': 0.03789333717057341, 'tp_mult': 1.7055346655125512, 'tsl_mult': 0.919461420792551, 'strategy': 'breakout', 'time_stop': 43, 'use_sma': False, 'use_atr': True, 'use_adx': False, 'use_ema': True, 'use_spike': False, 'rsi_required': False, 'edge_k': 0.8488072863301679, 'edge_cap': 0.31336109599386824, 'bull_strategy': 'mean_reversion', 'bull_bb_std_mult': 1.4759103400551576, 'bull_rsi_os': 13, 'bull_rsi_ob': 69, 'bull_adx_thresh': 15.921842882195067, 'bull_atr_min_pct': 1.0365056695480694e-05, 'bull_atr_max_pct': 0.01681200770329369, 'bull_tp_mult': 2.34196814588181, 'bull_tsl_mult': 0.4135682564580603, 'bull_time_stop': 268, 'bull_use_sma': False, 'bull_use_ema': True, 'bull_use_atr': True, 'bull_use_adx': True, 'bull_use_spike': True, 'bull_rsi_required': False, 'bear_strategy': 'breakout', 'bear_bb_std_mult': 2.6241557621621108, 'bear_rsi_os': 42, 'bear_rsi_ob': 64, 'bear_adx_thresh': 8.484379857746646, 'bear_atr_min_pct': 0.025147402364930224, 'bear_atr_max_pct': 0.014867522606395171, 'bear_tp_mult': 2.8182056852795214, 'bear_tsl_mult': 0.43477329422015837, 'bear_time_stop': 122, 'bear_use_sma': True, 'bear_use_ema': False, 'bear_use_atr': True, 'bear_use_adx': True, 'bear_use_spike': False, 'bear_rsi_required': False, 'sideways_strategy': 'mean_reversion', 'sideways_bb_std_mult': 1.8901023886303847, 'sideways_rsi_os': 47, 'sideways_rsi_ob': 87, 'sideways_adx_thresh': 26.937271466757757, 'sideways_atr_min_pct': 0.014944472697477637, 'sideways_atr_max_pct': 0.1049206225094081, 'sideways_tp_mult': 2.2209290950134193, 'sideways_tsl_mult': 0.44515143633917814, 'sideways_time_stop': 262, 'sideways_use_sma': True, 'sideways_use_ema': True, 'sideways_use_atr': True, 'sideways_use_adx': False, 'sideways_use_spike': True, 'sideways_rsi_required': True}.
[I 2025-08-30 21:20:26,204] Trial 264 finished with values: [-1000000000.0, 1000000000.0] and parameters: {'p_sma': 47, 'p_std': 9, 'p_atr': 27, 'p_adx': 30, 'rsi_period': 77, 'ema1': 18, 'ema2': 28, 'slip_atr_k': 0.2145790311997519, 'slip_spread_k': 0.525142863743454, 'spread_hl_frac': 0.0055324453181382054, 'bb_std_mult': 1.575064946584455, 'rsi_os': 13, 'rsi_ob': 81, 'vol_spike': 0.29469120037893465, 'adx_thresh': 32.119697911670755, 'atr_min_pct': 0.02230329979980623, 'atr_max_pct': 0.12771038387989583, 'tp_mult': 2.2602847886194217, 'tsl_mult': 0.8891836212323959, 'strategy': 'mean_reversion', 'time_stop': 35, 'use_sma': False, 'use_atr': False, 'use_adx': True, 'use_ema': False, 'use_spike': True, 'rsi_required': True, 'edge_k': 1.4619653580706222, 'edge_cap': 0.5649099250687936, 'bull_strategy': 'breakout', 'bull_bb_std_mult': 3.29834709778951, 'bull_rsi_os': 15, 'bull_rsi_ob': 89, 'bull_adx_thresh': 28.39793348767949, 'bull_atr_min_pct': 0.012615832521081068, 'bull_atr_max_pct': 0.02162966530569814, 'bull_tp_mult': 2.282735481998955, 'bull_tsl_mult': 0.3498713517107365, 'bull_time_stop': 300, 'bull_use_sma': True, 'bull_use_ema': False, 'bull_use_atr': False, 'bull_use_adx': False, 'bull_use_spike': False, 'bull_rsi_required': True, 'bear_strategy': 'mean_reversion', 'bear_bb_std_mult': 2.4341098919579944, 'bear_rsi_os': 40, 'bear_rsi_ob': 53, 'bear_adx_thresh': 7.949575320519907, 'bear_atr_min_pct': 0.006887410171378084, 'bear_atr_max_pct': 0.11616138816265625, 'bear_tp_mult': 2.7448339538843944, 'bear_tsl_mult': 0.4336229844196053, 'bear_time_stop': 112, 'bear_use_sma': True, 'bear_use_ema': False, 'bear_use_atr': False, 'bear_use_adx': False, 'bear_use_spike': True, 'bear_rsi_required': True, 'sideways_strategy': 'breakout', 'sideways_bb_std_mult': 1.37454387054336, 'sideways_rsi_os': 39, 'sideways_rsi_ob': 93, 'sideways_adx_thresh': 28.11596783260402, 'sideways_atr_min_pct': 0.013796862881995083, 'sideways_atr_max_pct': 0.10614314216580549, 'sideways_tp_mult': 1.902414143075899, 'sideways_tsl_mult': 0.5284619472360349, 'sideways_time_stop': 262, 'sideways_use_sma': False, 'sideways_use_ema': False, 'sideways_use_atr': False, 'sideways_use_adx': True, 'sideways_use_spike': False, 'sideways_rsi_required': False}.
[I 2025-08-30 21:20:31,450] Trial 266 finished with values: [-1000000000.0, 1000000000.0] and parameters: {'p_sma': 47, 'p_std': 27, 'p_atr': 16, 'p_adx': 15, 'rsi_period': 72, 'ema1': 12, 'ema2': 44, 'slip_atr_k': 0.049487877553981874, 'slip_spread_k': 0.5816216436529805, 'spread_hl_frac': 0.04902838816969451, 'bb_std_mult': 3.037612147323729, 'rsi_os': 11, 'rsi_ob': 58, 'vol_spike': 0.28587699256267635, 'adx_thresh': 31.530154895992844, 'atr_min_pct': 0.019205922695432358, 'atr_max_pct': 0.06229212112089121, 'tp_mult': 1.671239951021539, 'tsl_mult': 0.9137752722488286, 'strategy': 'mean_reversion', 'time_stop': 77, 'use_sma': False, 'use_atr': True, 'use_adx': True, 'use_ema': True, 'use_spike': True, 'rsi_required': True, 'edge_k': 0.08106213089012626, 'edge_cap': 0.6014663156030153, 'bull_strategy': 'breakout', 'bull_bb_std_mult': 3.4500694253381994, 'bull_rsi_os': 50, 'bull_rsi_ob': 69, 'bull_adx_thresh': 28.428612624663714, 'bull_atr_min_pct': 0.0036945270644911394, 'bull_atr_max_pct': 0.13417727836292762, 'bull_tp_mult': 2.279630560752058, 'bull_tsl_mult': 0.3980114114085638, 'bull_time_stop': 289, 'bull_use_sma': True, 'bull_use_ema': False, 'bull_use_atr': False, 'bull_use_adx': True, 'bull_use_spike': True, 'bull_rsi_required': True, 'bear_strategy': 'mean_reversion', 'bear_bb_std_mult': 2.7096455593818134, 'bear_rsi_os': 35, 'bear_rsi_ob': 51, 'bear_adx_thresh': 7.931179511677634, 'bear_atr_min_pct': 0.02743139069023718, 'bear_atr_max_pct': 0.017457493984296222, 'bear_tp_mult': 1.432314508916766, 'bear_tsl_mult': 0.5017795928400824, 'bear_time_stop': 113, 'bear_use_sma': True, 'bear_use_ema': False, 'bear_use_atr': False, 'bear_use_adx': True, 'bear_use_spike': True, 'bear_rsi_required': True, 'sideways_strategy': 'breakout', 'sideways_bb_std_mult': 1.4945497136052261, 'sideways_rsi_os': 39, 'sideways_rsi_ob': 91, 'sideways_adx_thresh': 27.93093086366985, 'sideways_atr_min_pct': 0.015141839780317625, 'sideways_atr_max_pct': 0.10287399954882807, 'sideways_tp_mult': 1.9723876917401897, 'sideways_tsl_mult': 0.5296446551629017, 'sideways_time_stop': 233, 'sideways_use_sma': False, 'sideways_use_ema': True, 'sideways_use_atr': True, 'sideways_use_adx': False, 'sideways_use_spike': False, 'sideways_rsi_required': True}.
[I 2025-08-30 21:21:01,269] Trial 268 finished with values: [-0.07585276837103772, 0.07562938917520715] and parameters: {'p_sma': 43, 'p_std': 14, 'p_atr': 22, 'p_adx': 18, 'rsi_period': 22, 'ema1': 8, 'ema2': 44, 'slip_atr_k': 0.035920340110592114, 'slip_spread_k': 0.5301607643056215, 'spread_hl_frac': 0.014058818137090683, 'bb_std_mult': 1.3446335493008963, 'rsi_os': 9, 'rsi_ob': 79, 'vol_spike': 0.2857613918855802, 'adx_thresh': 32.01272341262477, 'atr_min_pct': 0.022069033436624533, 'atr_max_pct': 0.1266874195431667, 'tp_mult': 1.6728598350295651, 'tsl_mult': 0.8993414221702463, 'strategy': 'mean_reversion', 'time_stop': 52, 'use_sma': False, 'use_atr': False, 'use_adx': True, 'use_ema': False, 'use_spike': True, 'rsi_required': True, 'edge_k': 1.31792974527838, 'edge_cap': 0.5661418745177769, 'bull_strategy': 'breakout', 'bull_bb_std_mult': 3.4120011148107197, 'bull_rsi_os': 15, 'bull_rsi_ob': 72, 'bull_adx_thresh': 25.80132107637427, 'bull_atr_min_pct': 0.001897677828918573, 'bull_atr_max_pct': 0.08373125838998673, 'bull_tp_mult': 2.1669529744388143, 'bull_tsl_mult': 0.39034263958296067, 'bull_time_stop': 289, 'bull_use_sma': True, 'bull_use_ema': False, 'bull_use_atr': False, 'bull_use_adx': False, 'bull_use_spike': False, 'bull_rsi_required': True, 'bear_strategy': 'mean_reversion', 'bear_bb_std_mult': 2.707736043226835, 'bear_rsi_os': 35, 'bear_rsi_ob': 51, 'bear_adx_thresh': 11.431027924626028, 'bear_atr_min_pct': 0.00016055311781791072, 'bear_atr_max_pct': 0.01751994573806144, 'bear_tp_mult': 2.7173859565677057, 'bear_tsl_mult': 0.4182746512361041, 'bear_time_stop': 113, 'bear_use_sma': False, 'bear_use_ema': False, 'bear_use_atr': False, 'bear_use_adx': False, 'bear_use_spike': True, 'bear_rsi_required': True, 'sideways_strategy': 'breakout', 'sideways_bb_std_mult': 1.5141088375545735, 'sideways_rsi_os': 17, 'sideways_rsi_ob': 91, 'sideways_adx_thresh': 28.04541304959872, 'sideways_atr_min_pct': 0.017588455854405466, 'sideways_atr_max_pct': 0.09718891189237296, 'sideways_tp_mult': 1.9747114756669546, 'sideways_tsl_mult': 0.48849240814683526, 'sideways_time_stop': 233, 'sideways_use_sma': False, 'sideways_use_ema': False, 'sideways_use_atr': False, 'sideways_use_adx': True, 'sideways_use_spike': False, 'sideways_rsi_required': False}.
[I 2025-08-30 21:21:02,363] Trial 267 finished with values: [-1000000000.0, 1000000000.0] and parameters: {'p_sma': 30, 'p_std': 9, 'p_atr': 22, 'p_adx': 12, 'rsi_period': 73, 'ema1': 25, 'ema2': 30, 'slip_atr_k': 0.03516663972131568, 'slip_spread_k': 0.5363937970745868, 'spread_hl_frac': 0.023878970177638813, 'bb_std_mult': 1.4685924011708569, 'rsi_os': 11, 'rsi_ob': 57, 'vol_spike': 0.18713482998156467, 'adx_thresh': 31.58948430371861, 'atr_min_pct': 0.0188992533763987, 'atr_max_pct': 0.08615996885682091, 'tp_mult': 2.2738809938931754, 'tsl_mult': 0.9044141237154846, 'strategy': 'mean_reversion', 'time_stop': 77, 'use_sma': False, 'use_atr': True, 'use_adx': True, 'use_ema': True, 'use_spike': True, 'rsi_required': True, 'edge_k': 1.313481602094324e-05, 'edge_cap': 0.30949042562693685, 'bull_strategy': 'breakout', 'bull_bb_std_mult': 3.4183970193312123, 'bull_rsi_os': 15, 'bull_rsi_ob': 71, 'bull_adx_thresh': 8.417517608700937, 'bull_atr_min_pct': 0.014258608700115683, 'bull_atr_max_pct': 0.032263189315241664, 'bull_tp_mult': 2.2487587477641364, 'bull_tsl_mult': 0.4036837304854147, 'bull_time_stop': 289, 'bull_use_sma': True, 'bull_use_ema': False, 'bull_use_atr': False, 'bull_use_adx': False, 'bull_use_spike': True, 'bull_rsi_required': True, 'bear_strategy': 'mean_reversion', 'bear_bb_std_mult': 1.7249145200875553, 'bear_rsi_os': 36, 'bear_rsi_ob': 53, 'bear_adx_thresh': 16.919023530495036, 'bear_atr_min_pct': 0.015332882221530524, 'bear_atr_max_pct': 0.014040204174349008, 'bear_tp_mult': 2.104908492789363, 'bear_tsl_mult': 0.9771511876588133, 'bear_time_stop': 99, 'bear_use_sma': True, 'bear_use_ema': False, 'bear_use_atr': False, 'bear_use_adx': True, 'bear_use_spike': True, 'bear_rsi_required': True, 'sideways_strategy': 'breakout', 'sideways_bb_std_mult': 1.5032800278565976, 'sideways_rsi_os': 17, 'sideways_rsi_ob': 91, 'sideways_adx_thresh': 28.42072878820888, 'sideways_atr_min_pct': 0.012587211273600962, 'sideways_atr_max_pct': 0.09704860176577751, 'sideways_tp_mult': 1.7838868635100527, 'sideways_tsl_mult': 0.4926932233786625, 'sideways_time_stop': 252, 'sideways_use_sma': False, 'sideways_use_ema': True, 'sideways_use_atr': True, 'sideways_use_adx': False, 'sideways_use_spike': False, 'sideways_rsi_required': True}.
[I 2025-08-30 21:21:02,919] Trial 269 finished with values: [-1000000000.0, 1000000000.0] and parameters: {'p_sma': 43, 'p_std': 35, 'p_atr': 16, 'p_adx': 29, 'rsi_period': 72, 'ema1': 8, 'ema2': 44, 'slip_atr_k': 0.03429513382671717, 'slip_spread_k': 0.5828574925187828, 'spread_hl_frac': 0.006787518998967448, 'bb_std_mult': 0.9487961362410959, 'rsi_os': 10, 'rsi_ob': 83, 'vol_spike': 0.20299267529601817, 'adx_thresh': 31.62193534968521, 'atr_min_pct': 0.018857385738675365, 'atr_max_pct': 0.09221784285631503, 'tp_mult': 2.746924906992922, 'tsl_mult': 0.2187386331332748, 'strategy': 'mean_reversion', 'time_stop': 79, 'use_sma': True, 'use_atr': True, 'use_adx': True, 'use_ema': True, 'use_spike': True, 'rsi_required': True, 'edge_k': 0.08374741644882433, 'edge_cap': 0.9225532858662157, 'bull_strategy': 'breakout', 'bull_bb_std_mult': 3.4433764448686435, 'bull_rsi_os': 50, 'bull_rsi_ob': 72, 'bull_adx_thresh': 25.05419354684099, 'bull_atr_min_pct': 0.002205943055466705, 'bull_atr_max_pct': 0.0859677578649909, 'bull_tp_mult': 2.4249324302580635, 'bull_tsl_mult': 0.39729253340422516, 'bull_time_stop': 177, 'bull_use_sma': True, 'bull_use_ema': False, 'bull_use_atr': False, 'bull_use_adx': True, 'bull_use_spike': True, 'bull_rsi_required': True, 'bear_strategy': 'mean_reversion', 'bear_bb_std_mult': 2.700662382594016, 'bear_rsi_os': 36, 'bear_rsi_ob': 51, 'bear_adx_thresh': 17.0600249876398, 'bear_atr_min_pct': 0.027370825381988262, 'bear_atr_max_pct': 0.017562262280713094, 'bear_tp_mult': 1.6591212487074303, 'bear_tsl_mult': 0.5043488133815336, 'bear_time_stop': 98, 'bear_use_sma': False, 'bear_use_ema': True, 'bear_use_atr': False, 'bear_use_adx': True, 'bear_use_spike': True, 'bear_rsi_required': True, 'sideways_strategy': 'breakout', 'sideways_bb_std_mult': 1.5033798114192247, 'sideways_rsi_os': 16, 'sideways_rsi_ob': 95, 'sideways_adx_thresh': 27.547774709510037, 'sideways_atr_min_pct': 0.01750150990431638, 'sideways_atr_max_pct': 0.10181382603357958, 'sideways_tp_mult': 1.745751069546824, 'sideways_tsl_mult': 0.5507451966955189, 'sideways_time_stop': 253, 'sideways_use_sma': False, 'sideways_use_ema': True, 'sideways_use_atr': True, 'sideways_use_adx': False, 'sideways_use_spike': False, 'sideways_rsi_required': True}.
