[I 2025-08-30 22:36:06,053] Trial 876 finished with values: [-1000000000.0, 1000000000.0] and parameters: {'p_sma': 35, 'p_std': 42, 'p_atr': 29, 'p_adx': 9, 'rsi_period': 75, 'ema1': 14, 'ema2': 18, 'slip_atr_k': 0.005647029043030721, 'slip_spread_k': 0.6939561607296962, 'spread_hl_frac': 0.00840957293871482, 'bb_std_mult': 3.11299779893616, 'rsi_os': 14, 'rsi_ob': 92, 'vol_spike': 0.025065824974117, 'adx_thresh': 5.851059482639682, 'atr_min_pct': 0.01461880861593099, 'atr_max_pct': 0.06575355339715767, 'tp_mult': 1.4714836933353617, 'tsl_mult': 0.4572842094240766, 'strategy': 'mean_reversion', 'time_stop': 106, 'use_sma': False, 'use_atr': False, 'use_adx': True, 'use_ema': True, 'use_spike': True, 'rsi_required': True, 'edge_k': 1.3115610199089325, 'edge_cap': 0.08061803648678274, 'bull_strategy': 'breakout', 'bull_bb_std_mult': 2.2005206862038493, 'bull_rsi_os': 44, 'bull_rsi_ob': 80, 'bull_adx_thresh': 11.82618742928712, 'bull_atr_min_pct': 0.007708241130234689, 'bull_atr_max_pct': 0.035423755557693115, 'bull_tp_mult': 2.1010544581969754, 'bull_tsl_mult': 0.6215306053705989, 'bull_time_stop': 279, 'bull_use_sma': True, 'bull_use_ema': False, 'bull_use_atr': True, 'bull_use_adx': True, 'bull_use_spike': True, 'bull_rsi_required': False, 'bear_strategy': 'breakout', 'bear_bb_std_mult': 1.5158554755381606, 'bear_rsi_os': 13, 'bear_rsi_ob': 76, 'bear_adx_thresh': 27.17292301852222, 'bear_atr_min_pct': 0.02763668893109597, 'bear_atr_max_pct': 0.12985417562031054, 'bear_tp_mult': 2.571993250548641, 'bear_tsl_mult': 0.533916978448324, 'bear_time_stop': 284, 'bear_use_sma': True, 'bear_use_ema': True, 'bear_use_atr': True, 'bear_use_adx': True, 'bear_use_spike': True, 'bear_rsi_required': False, 'sideways_strategy': 'mean_reversion', 'sideways_bb_std_mult': 2.523799932652487, 'sideways_rsi_os': 31, 'sideways_rsi_ob': 46, 'sideways_adx_thresh': 24.367516820594687, 'sideways_atr_min_pct': 0.01992342641644922, 'sideways_atr_max_pct': 0.09914345242925189, 'sideways_tp_mult': 2.1352764607749624, 'sideways_tsl_mult': 0.8906715582618845, 'sideways_time_stop': 236, 'sideways_use_sma': False, 'sideways_use_ema': True, 'sideways_use_atr': False, 'sideways_use_adx': False, 'sideways_use_spike': True, 'sideways_rsi_required': True}.
[I 2025-08-30 22:36:06,783] Trial 873 finished with values: [-1000000000.0, 1000000000.0] and parameters: {'p_sma': 35, 'p_std': 42, 'p_atr': 26, 'p_adx': 9, 'rsi_period': 75, 'ema1': 17, 'ema2': 18, 'slip_atr_k': 0.005158462308960349, 'slip_spread_k': 0.7564747474443587, 'spread_hl_frac': 0.007995796452081566, 'bb_std_mult': 2.568383727506701, 'rsi_os': 14, 'rsi_ob': 91, 'vol_spike': 0.01952536086955528, 'adx_thresh': 6.4915177746904735, 'atr_min_pct': 0.015945896445027478, 'atr_max_pct': 0.06862392973194953, 'tp_mult': 1.4731643638342113, 'tsl_mult': 0.3863203456824988, 'strategy': 'mean_reversion', 'time_stop': 117, 'use_sma': False, 'use_atr': False, 'use_adx': True, 'use_ema': True, 'use_spike': True, 'rsi_required': True, 'edge_k': 1.3013321749914604, 'edge_cap': 0.08312366100532183, 'bull_strategy': 'mean_reversion', 'bull_bb_std_mult': 2.2444677039424037, 'bull_rsi_os': 43, 'bull_rsi_ob': 82, 'bull_adx_thresh': 11.64291742332208, 'bull_atr_min_pct': 0.0013599545779749362, 'bull_atr_max_pct': 0.037221178253884483, 'bull_tp_mult': 2.1304174876135904, 'bull_tsl_mult': 0.6329898137814829, 'bull_time_stop': 266, 'bull_use_sma': False, 'bull_use_ema': False, 'bull_use_atr': False, 'bull_use_adx': True, 'bull_use_spike': True, 'bull_rsi_required': False, 'bear_strategy': 'breakout', 'bear_bb_std_mult': 1.69907962524582, 'bear_rsi_os': 11, 'bear_rsi_ob': 78, 'bear_adx_thresh': 27.172848175238496, 'bear_atr_min_pct': 0.026209692945721917, 'bear_atr_max_pct': 0.1300827655870228, 'bear_tp_mult': 2.563835745089206, 'bear_tsl_mult': 0.5861788363891174, 'bear_time_stop': 279, 'bear_use_sma': True, 'bear_use_ema': True, 'bear_use_atr': True, 'bear_use_adx': True, 'bear_use_spike': True, 'bear_rsi_required': False, 'sideways_strategy': 'mean_reversion', 'sideways_bb_std_mult': 2.515521614939024, 'sideways_rsi_os': 45, 'sideways_rsi_ob': 52, 'sideways_adx_thresh': 26.2228023264202, 'sideways_atr_min_pct': 0.020018730718087352, 'sideways_atr_max_pct': 0.08898455072788719, 'sideways_tp_mult': 2.2832419846300334, 'sideways_tsl_mult': 0.8872951348718131, 'sideways_time_stop': 243, 'sideways_use_sma': False, 'sideways_use_ema': True, 'sideways_use_atr': False, 'sideways_use_adx': False, 'sideways_use_spike': True, 'sideways_rsi_required': True}.
[I 2025-08-30 22:36:06,931] Trial 875 finished with values: [-1000000000.0, 1000000000.0] and parameters: {'p_sma': 6, 'p_std': 43, 'p_atr': 26, 'p_adx': 9, 'rsi_period': 75, 'ema1': 14, 'ema2': 18, 'slip_atr_k': 0.00419205116211077, 'slip_spread_k': 0.7478526646053836, 'spread_hl_frac': 0.006856583684395323, 'bb_std_mult': 3.0373058336103353, 'rsi_os': 14, 'rsi_ob': 92, 'vol_spike': 0.010488499791080366, 'adx_thresh': 5.695448691500287, 'atr_min_pct': 0.014736350821916155, 'atr_max_pct': 0.060731027632381626, 'tp_mult': 1.4892215383825407, 'tsl_mult': 0.4617117682381866, 'strategy': 'mean_reversion', 'time_stop': 117, 'use_sma': False, 'use_atr': False, 'use_adx': True, 'use_ema': True, 'use_spike': True, 'rsi_required': True, 'edge_k': 1.309050447203556, 'edge_cap': 0.08019019215148909, 'bull_strategy': 'breakout', 'bull_bb_std_mult': 2.2218240534274853, 'bull_rsi_os': 43, 'bull_rsi_ob': 80, 'bull_adx_thresh': 9.826654894786325, 'bull_atr_min_pct': 0.0010919997969414384, 'bull_atr_max_pct': 0.040256227641602374, 'bull_tp_mult': 2.1332409682605338, 'bull_tsl_mult': 0.6254499008471903, 'bull_time_stop': 264, 'bull_use_sma': True, 'bull_use_ema': False, 'bull_use_atr': True, 'bull_use_adx': True, 'bull_use_spike': True, 'bull_rsi_required': False, 'bear_strategy': 'breakout', 'bear_bb_std_mult': 1.5273150556116855, 'bear_rsi_os': 11, 'bear_rsi_ob': 78, 'bear_adx_thresh': 9.746948281588251, 'bear_atr_min_pct': 0.027642705554345726, 'bear_atr_max_pct': 0.13133272656567985, 'bear_tp_mult': 2.5720208949458865, 'bear_tsl_mult': 0.5367533204520863, 'bear_time_stop': 277, 'bear_use_sma': True, 'bear_use_ema': True, 'bear_use_atr': True, 'bear_use_adx': True, 'bear_use_spike': True, 'bear_rsi_required': False, 'sideways_strategy': 'mean_reversion', 'sideways_bb_std_mult': 2.513727620226056, 'sideways_rsi_os': 44, 'sideways_rsi_ob': 59, 'sideways_adx_thresh': 26.01733425681551, 'sideways_atr_min_pct': 0.018643489491088364, 'sideways_atr_max_pct': 0.07732919547209569, 'sideways_tp_mult': 2.13751286289085, 'sideways_tsl_mult': 0.8937259503186046, 'sideways_time_stop': 243, 'sideways_use_sma': False, 'sideways_use_ema': True, 'sideways_use_atr': False, 'sideways_use_adx': False, 'sideways_use_spike': True, 'sideways_rsi_required': True}.
[I 2025-08-30 22:36:07,116] Trial 874 finished with values: [-1000000000.0, 1000000000.0] and parameters: {'p_sma': 6, 'p_std': 42, 'p_atr': 26, 'p_adx': 9, 'rsi_period': 79, 'ema1': 17, 'ema2': 19, 'slip_atr_k': 0.00568608416629056, 'slip_spread_k': 0.7223027631637375, 'spread_hl_frac': 0.008453380210714729, 'bb_std_mult': 3.4305491891298208, 'rsi_os': 14, 'rsi_ob': 93, 'vol_spike': 0.011347226687628467, 'adx_thresh': 6.281939158997974, 'atr_min_pct': 0.015840959823654376, 'atr_max_pct': 0.06905469645129664, 'tp_mult': 1.4714786274822527, 'tsl_mult': 0.4006778308438772, 'strategy': 'mean_reversion', 'time_stop': 107, 'use_sma': False, 'use_atr': False, 'use_adx': True, 'use_ema': True, 'use_spike': True, 'rsi_required': True, 'edge_k': 1.290939448059585, 'edge_cap': 0.07468895958310724, 'bull_strategy': 'mean_reversion', 'bull_bb_std_mult': 2.2493665229794444, 'bull_rsi_os': 43, 'bull_rsi_ob': 82, 'bull_adx_thresh': 10.19369501841629, 'bull_atr_min_pct': 0.009025659007115123, 'bull_atr_max_pct': 0.03774800835247486, 'bull_tp_mult': 2.1425735026468073, 'bull_tsl_mult': 0.6235734073006831, 'bull_time_stop': 267, 'bull_use_sma': False, 'bull_use_ema': False, 'bull_use_atr': False, 'bull_use_adx': True, 'bull_use_spike': True, 'bull_rsi_required': False, 'bear_strategy': 'breakout', 'bear_bb_std_mult': 1.6956754926682347, 'bear_rsi_os': 15, 'bear_rsi_ob': 78, 'bear_adx_thresh': 27.484554806160098, 'bear_atr_min_pct': 0.027456191486600272, 'bear_atr_max_pct': 0.12379880665787413, 'bear_tp_mult': 2.5208360346113743, 'bear_tsl_mult': 0.5243845155383301, 'bear_time_stop': 282, 'bear_use_sma': True, 'bear_use_ema': True, 'bear_use_atr': True, 'bear_use_adx': True, 'bear_use_spike': True, 'bear_rsi_required': False, 'sideways_strategy': 'mean_reversion', 'sideways_bb_std_mult': 2.5101054722883123, 'sideways_rsi_os': 44, 'sideways_rsi_ob': 52, 'sideways_adx_thresh': 25.814128983362686, 'sideways_atr_min_pct': 0.017417252503656173, 'sideways_atr_max_pct': 0.08233883738644598, 'sideways_tp_mult': 2.31411408919264, 'sideways_tsl_mult': 0.8952527505942007, 'sideways_time_stop': 244, 'sideways_use_sma': False, 'sideways_use_ema': True, 'sideways_use_atr': False, 'sideways_use_adx': False, 'sideways_use_spike': True, 'sideways_rsi_required': True}.
[I 2025-08-30 22:36:40,289] Trial 877 finished with values: [-1000000000.0, 1000000000.0] and parameters: {'p_sma': 6, 'p_std': 42, 'p_atr': 26, 'p_adx': 9, 'rsi_period': 75, 'ema1': 14, 'ema2': 19, 'slip_atr_k': 0.0036319351280639615, 'slip_spread_k': 0.6857186329023505, 'spread_hl_frac': 0.007306154133487883, 'bb_std_mult': 3.539166932840869, 'rsi_os': 17, 'rsi_ob': 93, 'vol_spike': 0.012077592564702463, 'adx_thresh': 6.26242102183621, 'atr_min_pct': 0.015058905018280078, 'atr_max_pct': 0.07600497072042123, 'tp_mult': 1.4939743496783524, 'tsl_mult': 0.3487471576786674, 'strategy': 'breakout', 'time_stop': 113, 'use_sma': False, 'use_atr': False, 'use_adx': False, 'use_ema': True, 'use_spike': False, 'rsi_required': True, 'edge_k': 1.2706009840350023, 'edge_cap': 0.07470351239175527, 'bull_strategy': 'breakout', 'bull_bb_std_mult': 2.1963817582485543, 'bull_rsi_os': 41, 'bull_rsi_ob': 82, 'bull_adx_thresh': 10.478038224188754, 'bull_atr_min_pct': 0.0010886671879698846, 'bull_atr_max_pct': 0.03830030571987304, 'bull_tp_mult': 2.125594295969922, 'bull_tsl_mult': 0.6327429887950254, 'bull_time_stop': 279, 'bull_use_sma': True, 'bull_use_ema': False, 'bull_use_atr': False, 'bull_use_adx': True, 'bull_use_spike': True, 'bull_rsi_required': False, 'bear_strategy': 'breakout', 'bear_bb_std_mult': 1.6762255852939958, 'bear_rsi_os': 16, 'bear_rsi_ob': 76, 'bear_adx_thresh': 10.097704539602017, 'bear_atr_min_pct': 0.02607719267514421, 'bear_atr_max_pct': 0.13020768768671423, 'bear_tp_mult': 2.5302921946196952, 'bear_tsl_mult': 0.5863191613743748, 'bear_time_stop': 274, 'bear_use_sma': True, 'bear_use_ema': True, 'bear_use_atr': True, 'bear_use_adx': True, 'bear_use_spike': True, 'bear_rsi_required': False, 'sideways_strategy': 'mean_reversion', 'sideways_bb_std_mult': 2.4450102446178663, 'sideways_rsi_os': 44, 'sideways_rsi_ob': 58, 'sideways_adx_thresh': 26.12528489671939, 'sideways_atr_min_pct': 0.019951869139326017, 'sideways_atr_max_pct': 0.0876720834671961, 'sideways_tp_mult': 2.310194389361509, 'sideways_tsl_mult': 0.896719617544776, 'sideways_time_stop': 242, 'sideways_use_sma': False, 'sideways_use_ema': True, 'sideways_use_atr': False, 'sideways_use_adx': False, 'sideways_use_spike': True, 'sideways_rsi_required': True}.
[I 2025-08-30 22:36:40,885] Trial 879 finished with values: [-1000000000.0, 1000000000.0] and parameters: {'p_sma': 54, 'p_std': 48, 'p_atr': 24, 'p_adx': 8, 'rsi_period': 82, 'ema1': 14, 'ema2': 21, 'slip_atr_k': 0.0007611797822595518, 'slip_spread_k': 0.7282233113918244, 'spread_hl_frac': 0.005931015670000826, 'bb_std_mult': 2.166383316700268, 'rsi_os': 17, 'rsi_ob': 89, 'vol_spike': 0.015017977912951785, 'adx_thresh': 6.271195994480005, 'atr_min_pct': 0.015391843103083447, 'atr_max_pct': 0.07409907677106539, 'tp_mult': 1.4890559075187104, 'tsl_mult': 0.16186214923204054, 'strategy': 'breakout', 'time_stop': 106, 'use_sma': True, 'use_atr': False, 'use_adx': False, 'use_ema': True, 'use_spike': False, 'rsi_required': True, 'edge_k': 1.2673961426129132, 'edge_cap': 0.06440814203628302, 'bull_strategy': 'breakout', 'bull_bb_std_mult': 2.0899332813400293, 'bull_rsi_os': 41, 'bull_rsi_ob': 82, 'bull_adx_thresh': 10.312112862245417, 'bull_atr_min_pct': 0.015508097809656264, 'bull_atr_max_pct': 0.041586573694354326, 'bull_tp_mult': 2.148753585500585, 'bull_tsl_mult': 0.6341009893921487, 'bull_time_stop': 269, 'bull_use_sma': True, 'bull_use_ema': False, 'bull_use_atr': False, 'bull_use_adx': True, 'bull_use_spike': True, 'bull_rsi_required': False, 'bear_strategy': 'breakout', 'bear_bb_std_mult': 1.650456713287618, 'bear_rsi_os': 15, 'bear_rsi_ob': 76, 'bear_adx_thresh': 28.271104519432043, 'bear_atr_min_pct': 0.027022677549245516, 'bear_atr_max_pct': 0.13560743200052555, 'bear_tp_mult': 2.4994558111276746, 'bear_tsl_mult': 0.5778062087081203, 'bear_time_stop': 273, 'bear_use_sma': True, 'bear_use_ema': False, 'bear_use_atr': True, 'bear_use_adx': False, 'bear_use_spike': False, 'bear_rsi_required': False, 'sideways_strategy': 'mean_reversion', 'sideways_bb_std_mult': 2.430008446820269, 'sideways_rsi_os': 34, 'sideways_rsi_ob': 58, 'sideways_adx_thresh': 26.409216258406854, 'sideways_atr_min_pct': 0.020069683779334282, 'sideways_atr_max_pct': 0.08346049932688865, 'sideways_tp_mult': 2.327996396829448, 'sideways_tsl_mult': 0.8712090760906601, 'sideways_time_stop': 235, 'sideways_use_sma': False, 'sideways_use_ema': True, 'sideways_use_atr': False, 'sideways_use_adx': False, 'sideways_use_spike': True, 'sideways_rsi_required': True}.
[I 2025-08-30 22:36:41,241] Trial 878 finished with values: [-1000000000.0, 1000000000.0] and parameters: {'p_sma': 32, 'p_std': 48, 'p_atr': 24, 'p_adx': 9, 'rsi_period': 75, 'ema1': 14, 'ema2': 19, 'slip_atr_k': 0.0004515686146358, 'slip_spread_k': 0.7282096288514202, 'spread_hl_frac': 0.006698920888116553, 'bb_std_mult': 3.0452607364947424, 'rsi_os': 14, 'rsi_ob': 94, 'vol_spike': 0.018224015721786377, 'adx_thresh': 5.620735809989747, 'atr_min_pct': 0.014813641417747204, 'atr_max_pct': 0.07526874927696238, 'tp_mult': 1.4896369533280176, 'tsl_mult': 0.1914210035039864, 'strategy': 'breakout', 'time_stop': 117, 'use_sma': True, 'use_atr': False, 'use_adx': False, 'use_ema': True, 'use_spike': False, 'rsi_required': True, 'edge_k': 1.2519556623216432, 'edge_cap': 0.07139470041117019, 'bull_strategy': 'breakout', 'bull_bb_std_mult': 2.100457383549852, 'bull_rsi_os': 41, 'bull_rsi_ob': 80, 'bull_adx_thresh': 10.659160826619797, 'bull_atr_min_pct': 0.015576635624511587, 'bull_atr_max_pct': 0.04217184307637069, 'bull_tp_mult': 2.148388245496044, 'bull_tsl_mult': 0.6377782900724933, 'bull_time_stop': 279, 'bull_use_sma': True, 'bull_use_ema': False, 'bull_use_atr': False, 'bull_use_adx': True, 'bull_use_spike': True, 'bull_rsi_required': False, 'bear_strategy': 'breakout', 'bear_bb_std_mult': 1.631750911190588, 'bear_rsi_os': 13, 'bear_rsi_ob': 76, 'bear_adx_thresh': 10.011672064925278, 'bear_atr_min_pct': 0.027780375040034864, 'bear_atr_max_pct': 0.12377065092448812, 'bear_tp_mult': 2.5161383855271278, 'bear_tsl_mult': 0.52428834659487, 'bear_time_stop': 272, 'bear_use_sma': True, 'bear_use_ema': False, 'bear_use_atr': True, 'bear_use_adx': False, 'bear_use_spike': False, 'bear_rsi_required': False, 'sideways_strategy': 'mean_reversion', 'sideways_bb_std_mult': 2.454085875845524, 'sideways_rsi_os': 33, 'sideways_rsi_ob': 58, 'sideways_adx_thresh': 25.969557598493328, 'sideways_atr_min_pct': 0.019037870033801446, 'sideways_atr_max_pct': 0.0761780258447185, 'sideways_tp_mult': 2.3238439619272797, 'sideways_tsl_mult': 0.8669234711132345, 'sideways_time_stop': 243, 'sideways_use_sma': False, 'sideways_use_ema': True, 'sideways_use_atr': False, 'sideways_use_adx': False, 'sideways_use_spike': True, 'sideways_rsi_required': True}.
[I 2025-08-30 22:36:41,314] Trial 880 finished with values: [-1000000000.0, 1000000000.0] and parameters: {'p_sma': 13, 'p_std': 41, 'p_atr': 27, 'p_adx': 8, 'rsi_period': 82, 'ema1': 14, 'ema2': 19, 'slip_atr_k': 0.0003715645802473684, 'slip_spread_k': 0.6927078993046986, 'spread_hl_frac': 0.0066286195132944075, 'bb_std_mult': 3.350582154920628, 'rsi_os': 17, 'rsi_ob': 94, 'vol_spike': 0.03124566361277087, 'adx_thresh': 5.702493092332066, 'atr_min_pct': 0.014815502456828037, 'atr_max_pct': 0.07576773261266902, 'tp_mult': 1.4341637991154468, 'tsl_mult': 0.48552374462079073, 'strategy': 'breakout', 'time_stop': 121, 'use_sma': True, 'use_atr': False, 'use_adx': False, 'use_ema': False, 'use_spike': False, 'rsi_required': True, 'edge_k': 1.2511594936826347, 'edge_cap': 0.12128877186969537, 'bull_strategy': 'breakout', 'bull_bb_std_mult': 2.0930030305407317, 'bull_rsi_os': 41, 'bull_rsi_ob': 82, 'bull_adx_thresh': 20.038566752808723, 'bull_atr_min_pct': 0.0026086980101838733, 'bull_atr_max_pct': 0.039193106661271924, 'bull_tp_mult': 2.213356758016842, 'bull_tsl_mult': 0.6363055135714999, 'bull_time_stop': 279, 'bull_use_sma': True, 'bull_use_ema': False, 'bull_use_atr': False, 'bull_use_adx': True, 'bull_use_spike': True, 'bull_rsi_required': False, 'bear_strategy': 'breakout', 'bear_bb_std_mult': 1.6113810301288196, 'bear_rsi_os': 14, 'bear_rsi_ob': 76, 'bear_adx_thresh': 29.666529348468984, 'bear_atr_min_pct': 0.02757963065018676, 'bear_atr_max_pct': 0.12424657057604975, 'bear_tp_mult': 2.523925739608631, 'bear_tsl_mult': 0.5969159400078506, 'bear_time_stop': 268, 'bear_use_sma': True, 'bear_use_ema': False, 'bear_use_atr': True, 'bear_use_adx': False, 'bear_use_spike': False, 'bear_rsi_required': False, 'sideways_strategy': 'mean_reversion', 'sideways_bb_std_mult': 2.447489781637444, 'sideways_rsi_os': 34, 'sideways_rsi_ob': 58, 'sideways_adx_thresh': 21.79214114279119, 'sideways_atr_min_pct': 0.01991725943337309, 'sideways_atr_max_pct': 0.09150856439950261, 'sideways_tp_mult': 2.096681919268418, 'sideways_tsl_mult': 0.8704817215867522, 'sideways_time_stop': 232, 'sideways_use_sma': True, 'sideways_use_ema': True, 'sideways_use_atr': False, 'sideways_use_adx': False, 'sideways_use_spike': True, 'sideways_rsi_required': True}.
