[I 2025-08-30 22:17:23,567] Trial 738 finished with values: [-1000000000.0, 1000000000.0] and parameters: {'p_sma': 36, 'p_std': 37, 'p_atr': 21, 'p_adx': 21, 'rsi_period': 69, 'ema1': 10, 'ema2': 49, 'slip_atr_k': 0.1952532340484208, 'slip_spread_k': 0.8921033493963015, 'spread_hl_frac': 0.03284018479068456, 'bb_std_mult': 3.327391404679167, 'rsi_os': 13, 'rsi_ob': 50, 'vol_spike': 0.21550331672411616, 'adx_thresh': 10.24470681287787, 'atr_min_pct': 0.017344959262015784, 'atr_max_pct': 0.02245073645300079, 'tp_mult': 2.5293284695717473, 'tsl_mult': 0.8847622977865146, 'strategy': 'mean_reversion', 'time_stop': 97, 'use_sma': True, 'use_atr': True, 'use_adx': False, 'use_ema': True, 'use_spike': False, 'rsi_required': True, 'edge_k': 1.9485973500259308, 'edge_cap': 0.8244149082000883, 'bull_strategy': 'breakout', 'bull_bb_std_mult': 2.015819839399896, 'bull_rsi_os': 50, 'bull_rsi_ob': 80, 'bull_adx_thresh': 21.678237538473372, 'bull_atr_min_pct': 0.001602633770560078, 'bull_atr_max_pct': 0.016009081647406304, 'bull_tp_mult': 1.7362384795783719, 'bull_tsl_mult': 0.06666920862189879, 'bull_time_stop': 300, 'bull_use_sma': True, 'bull_use_ema': False, 'bull_use_atr': False, 'bull_use_adx': False, 'bull_use_spike': False, 'bull_rsi_required': False, 'bear_strategy': 'mean_reversion', 'bear_bb_std_mult': 1.2203834966243, 'bear_rsi_os': 9, 'bear_rsi_ob': 76, 'bear_adx_thresh': 27.099228855971624, 'bear_atr_min_pct': 0.029343862719659664, 'bear_atr_max_pct': 0.05059410567438244, 'bear_tp_mult': 1.7330021136919207, 'bear_tsl_mult': 0.9687812166421819, 'bear_time_stop': 178, 'bear_use_sma': True, 'bear_use_ema': True, 'bear_use_atr': False, 'bear_use_adx': True, 'bear_use_spike': False, 'bear_rsi_required': False, 'sideways_strategy': 'breakout', 'sideways_bb_std_mult': 1.9547703175739302, 'sideways_rsi_os': 40, 'sideways_rsi_ob': 88, 'sideways_adx_thresh': 25.55131863490582, 'sideways_atr_min_pct': 0.006035282628882404, 'sideways_atr_max_pct': 0.04517906970413288, 'sideways_tp_mult': 1.81621745592734, 'sideways_tsl_mult': 0.7455130733549787, 'sideways_time_stop': 289, 'sideways_use_sma': True, 'sideways_use_ema': False, 'sideways_use_atr': False, 'sideways_use_adx': True, 'sideways_use_spike': True, 'sideways_rsi_required': False}.
[I 2025-08-30 22:17:23,580] Trial 739 finished with values: [-1000000000.0, 1000000000.0] and parameters: {'p_sma': 22, 'p_std': 35, 'p_atr': 23, 'p_adx': 20, 'rsi_period': 74, 'ema1': 10, 'ema2': 15, 'slip_atr_k': 0.03007275273019186, 'slip_spread_k': 0.6580463043097086, 'spread_hl_frac': 0.00045631054997836984, 'bb_std_mult': 0.9240965210514179, 'rsi_os': 50, 'rsi_ob': 92, 'vol_spike': 0.2166847449534804, 'adx_thresh': 16.336901966415898, 'atr_min_pct': 0.013918729583472286, 'atr_max_pct': 0.013845570280906258, 'tp_mult': 1.6694164278279748, 'tsl_mult': 0.8795312580131236, 'strategy': 'mean_reversion', 'time_stop': 95, 'use_sma': False, 'use_atr': True, 'use_adx': False, 'use_ema': False, 'use_spike': False, 'rsi_required': True, 'edge_k': 0.5159948911949148, 'edge_cap': 0.4641801095695443, 'bull_strategy': 'breakout', 'bull_bb_std_mult': 0.5482449182724556, 'bull_rsi_os': 50, 'bull_rsi_ob': 79, 'bull_adx_thresh': 6.77149623880258, 'bull_atr_min_pct': 0.002169036979532397, 'bull_atr_max_pct': 0.06397354744462252, 'bull_tp_mult': 1.7098172818624093, 'bull_tsl_mult': 0.3466869666320808, 'bull_time_stop': 296, 'bull_use_sma': True, 'bull_use_ema': True, 'bull_use_atr': False, 'bull_use_adx': False, 'bull_use_spike': False, 'bull_rsi_required': True, 'bear_strategy': 'breakout', 'bear_bb_std_mult': 1.4573913177854045, 'bear_rsi_os': 9, 'bear_rsi_ob': 74, 'bear_adx_thresh': 27.038119934742603, 'bear_atr_min_pct': 0.02944076522485732, 'bear_atr_max_pct': 0.04881183644933864, 'bear_tp_mult': 1.8496777021467556, 'bear_tsl_mult': 0.3395238783745571, 'bear_time_stop': 240, 'bear_use_sma': True, 'bear_use_ema': True, 'bear_use_atr': False, 'bear_use_adx': True, 'bear_use_spike': False, 'bear_rsi_required': True, 'sideways_strategy': 'breakout', 'sideways_bb_std_mult': 3.1020532656380633, 'sideways_rsi_os': 40, 'sideways_rsi_ob': 79, 'sideways_adx_thresh': 8.528175213444761, 'sideways_atr_min_pct': 0.019015229140117256, 'sideways_atr_max_pct': 0.04422074245441456, 'sideways_tp_mult': 1.0116680503297344, 'sideways_tsl_mult': 0.7470258838796586, 'sideways_time_stop': 248, 'sideways_use_sma': True, 'sideways_use_ema': False, 'sideways_use_atr': False, 'sideways_use_adx': True, 'sideways_use_spike': True, 'sideways_rsi_required': False}.
[I 2025-08-30 22:17:24,611] Trial 740 finished with values: [-1000000000.0, 1000000000.0] and parameters: {'p_sma': 36, 'p_std': 50, 'p_atr': 21, 'p_adx': 20, 'rsi_period': 74, 'ema1': 10, 'ema2': 55, 'slip_atr_k': 0.032667427347858616, 'slip_spread_k': 0.5878255876696413, 'spread_hl_frac': 0.0005210615895746458, 'bb_std_mult': 2.419190952203126, 'rsi_os': 15, 'rsi_ob': 71, 'vol_spike': 0.12432398991794819, 'adx_thresh': 9.94900241967407, 'atr_min_pct': 0.02573074578699706, 'atr_max_pct': 0.01040415308781294, 'tp_mult': 1.6508258980759065, 'tsl_mult': 0.8720875294234053, 'strategy': 'mean_reversion', 'time_stop': 236, 'use_sma': False, 'use_atr': True, 'use_adx': True, 'use_ema': False, 'use_spike': True, 'rsi_required': True, 'edge_k': 0.61979630955426, 'edge_cap': 0.5333601803899961, 'bull_strategy': 'mean_reversion', 'bull_bb_std_mult': 1.8859737071306455, 'bull_rsi_os': 7, 'bull_rsi_ob': 90, 'bull_adx_thresh': 14.967256146148241, 'bull_atr_min_pct': 0.008765514337784937, 'bull_atr_max_pct': 0.0580620681187647, 'bull_tp_mult': 1.077887000292407, 'bull_tsl_mult': 0.42260727662178754, 'bull_time_stop': 241, 'bull_use_sma': False, 'bull_use_ema': True, 'bull_use_atr': False, 'bull_use_adx': True, 'bull_use_spike': False, 'bull_rsi_required': True, 'bear_strategy': 'breakout', 'bear_bb_std_mult': 2.0824610981371423, 'bear_rsi_os': 9, 'bear_rsi_ob': 76, 'bear_adx_thresh': 27.172638867276174, 'bear_atr_min_pct': 0.02945623527287136, 'bear_atr_max_pct': 0.10713845933652705, 'bear_tp_mult': 1.6072880400537966, 'bear_tsl_mult': 0.1578908088662705, 'bear_time_stop': 239, 'bear_use_sma': True, 'bear_use_ema': True, 'bear_use_atr': False, 'bear_use_adx': False, 'bear_use_spike': False, 'bear_rsi_required': True, 'sideways_strategy': 'mean_reversion', 'sideways_bb_std_mult': 1.6118034244168158, 'sideways_rsi_os': 40, 'sideways_rsi_ob': 90, 'sideways_adx_thresh': 25.762481731579957, 'sideways_atr_min_pct': 0.0042352332065865375, 'sideways_atr_max_pct': 0.03992161481515466, 'sideways_tp_mult': 1.3627990249216755, 'sideways_tsl_mult': 0.7566635539361216, 'sideways_time_stop': 215, 'sideways_use_sma': False, 'sideways_use_ema': False, 'sideways_use_atr': False, 'sideways_use_adx': True, 'sideways_use_spike': False, 'sideways_rsi_required': False}.
[I 2025-08-30 22:17:24,740] Trial 743 finished with values: [-1000000000.0, 1000000000.0] and parameters: {'p_sma': 35, 'p_std': 24, 'p_atr': 7, 'p_adx': 22, 'rsi_period': 71, 'ema1': 7, 'ema2': 56, 'slip_atr_k': 0.03278633309576477, 'slip_spread_k': 0.6591303602058658, 'spread_hl_frac': 0.03506536819228372, 'bb_std_mult': 0.7109163349631875, 'rsi_os': 15, 'rsi_ob': 59, 'vol_spike': 0.09550449211180023, 'adx_thresh': 11.879056603664395, 'atr_min_pct': 0.021800644888645065, 'atr_max_pct': 0.019207276477908982, 'tp_mult': 1.6355727476956583, 'tsl_mult': 0.12074416192887222, 'strategy': 'mean_reversion', 'time_stop': 78, 'use_sma': False, 'use_atr': False, 'use_adx': True, 'use_ema': False, 'use_spike': True, 'rsi_required': False, 'edge_k': 1.1078840100271246, 'edge_cap': 0.9527006131817147, 'bull_strategy': 'mean_reversion', 'bull_bb_std_mult': 1.9044510951404379, 'bull_rsi_os': 48, 'bull_rsi_ob': 88, 'bull_adx_thresh': 15.050213934523324, 'bull_atr_min_pct': 0.00984632140584521, 'bull_atr_max_pct': 0.04658666447198172, 'bull_tp_mult': 1.3374139425454827, 'bull_tsl_mult': 0.4377066149216295, 'bull_time_stop': 243, 'bull_use_sma': False, 'bull_use_ema': True, 'bull_use_atr': False, 'bull_use_adx': True, 'bull_use_spike': True, 'bull_rsi_required': True, 'bear_strategy': 'breakout', 'bear_bb_std_mult': 2.0897762431344478, 'bear_rsi_os': 6, 'bear_rsi_ob': 66, 'bear_adx_thresh': 28.392379400646398, 'bear_atr_min_pct': 0.028628025788141203, 'bear_atr_max_pct': 0.11437131554598856, 'bear_tp_mult': 1.4639203276367174, 'bear_tsl_mult': 0.4741917242652848, 'bear_time_stop': 238, 'bear_use_sma': False, 'bear_use_ema': False, 'bear_use_atr': False, 'bear_use_adx': False, 'bear_use_spike': True, 'bear_rsi_required': True, 'sideways_strategy': 'mean_reversion', 'sideways_bb_std_mult': 1.6044076977839563, 'sideways_rsi_os': 44, 'sideways_rsi_ob': 90, 'sideways_adx_thresh': 12.520687438219323, 'sideways_atr_min_pct': 0.0027072046761582556, 'sideways_atr_max_pct': 0.019043498796266302, 'sideways_tp_mult': 1.8514166957242861, 'sideways_tsl_mult': 0.7612279825003538, 'sideways_time_stop': 268, 'sideways_use_sma': False, 'sideways_use_ema': True, 'sideways_use_atr': True, 'sideways_use_adx': True, 'sideways_use_spike': False, 'sideways_rsi_required': True}.
[I 2025-08-30 22:17:59,826] Trial 742 finished with values: [-1000000000.0, 1000000000.0] and parameters: {'p_sma': 35, 'p_std': 35, 'p_atr': 23, 'p_adx': 20, 'rsi_period': 73, 'ema1': 14, 'ema2': 55, 'slip_atr_k': 0.03264692582622339, 'slip_spread_k': 0.6613111617446104, 'spread_hl_frac': 0.03513712448976886, 'bb_std_mult': 0.9359255974487679, 'rsi_os': 48, 'rsi_ob': 65, 'vol_spike': 0.28228206653655663, 'adx_thresh': 9.775649670827535, 'atr_min_pct': 0.001723973881775493, 'atr_max_pct': 0.02012758034526843, 'tp_mult': 1.652609860556656, 'tsl_mult': 0.11626210529036829, 'strategy': 'mean_reversion', 'time_stop': 234, 'use_sma': False, 'use_atr': False, 'use_adx': True, 'use_ema': False, 'use_spike': True, 'rsi_required': False, 'edge_k': 1.102247929632921, 'edge_cap': 0.9570105250817627, 'bull_strategy': 'mean_reversion', 'bull_bb_std_mult': 0.9447252545052827, 'bull_rsi_os': 48, 'bull_rsi_ob': 77, 'bull_adx_thresh': 15.05420849014906, 'bull_atr_min_pct': 0.0024057069165625616, 'bull_atr_max_pct': 0.04667525707311574, 'bull_tp_mult': 2.9099819857425224, 'bull_tsl_mult': 0.44944695788691724, 'bull_time_stop': 243, 'bull_use_sma': False, 'bull_use_ema': True, 'bull_use_atr': False, 'bull_use_adx': True, 'bull_use_spike': True, 'bull_rsi_required': True, 'bear_strategy': 'breakout', 'bear_bb_std_mult': 3.22650537733443, 'bear_rsi_os': 7, 'bear_rsi_ob': 66, 'bear_adx_thresh': 34.49750806645582, 'bear_atr_min_pct': 0.028672239557395274, 'bear_atr_max_pct': 0.041601971488865394, 'bear_tp_mult': 1.4710376559602192, 'bear_tsl_mult': 0.47089735579765063, 'bear_time_stop': 231, 'bear_use_sma': True, 'bear_use_ema': True, 'bear_use_atr': False, 'bear_use_adx': False, 'bear_use_spike': False, 'bear_rsi_required': True, 'sideways_strategy': 'mean_reversion', 'sideways_bb_std_mult': 1.6307544710622224, 'sideways_rsi_os': 39, 'sideways_rsi_ob': 89, 'sideways_adx_thresh': 27.940152305979428, 'sideways_atr_min_pct': 0.023158319352153824, 'sideways_atr_max_pct': 0.04023319572765138, 'sideways_tp_mult': 1.8376417843534933, 'sideways_tsl_mult': 0.7554690473728638, 'sideways_time_stop': 214, 'sideways_use_sma': False, 'sideways_use_ema': True, 'sideways_use_atr': True, 'sideways_use_adx': True, 'sideways_use_spike': False, 'sideways_rsi_required': True}.
[I 2025-08-30 22:18:00,410] Trial 741 finished with values: [-1000000000.0, 1000000000.0] and parameters: {'p_sma': 35, 'p_std': 50, 'p_atr': 21, 'p_adx': 20, 'rsi_period': 73, 'ema1': 14, 'ema2': 15, 'slip_atr_k': 0.03135038168232401, 'slip_spread_k': 0.662605916048626, 'spread_hl_frac': 0.0004883751282358934, 'bb_std_mult': 0.8066832250860916, 'rsi_os': 15, 'rsi_ob': 65, 'vol_spike': 0.12587528101866718, 'adx_thresh': 10.158722029661558, 'atr_min_pct': 0.01369086869404778, 'atr_max_pct': 0.014126727223656446, 'tp_mult': 1.6612613541605115, 'tsl_mult': 0.2487089265570281, 'strategy': 'mean_reversion', 'time_stop': 238, 'use_sma': False, 'use_atr': True, 'use_adx': True, 'use_ema': False, 'use_spike': True, 'rsi_required': False, 'edge_k': 0.8048365536710802, 'edge_cap': 0.5381311843207802, 'bull_strategy': 'mean_reversion', 'bull_bb_std_mult': 0.9629484844720451, 'bull_rsi_os': 16, 'bull_rsi_ob': 80, 'bull_adx_thresh': 15.14925034903592, 'bull_atr_min_pct': 0.0016424838938485248, 'bull_atr_max_pct': 0.04624813238559079, 'bull_tp_mult': 2.903077832587808, 'bull_tsl_mult': 0.34777795709448406, 'bull_time_stop': 285, 'bull_use_sma': False, 'bull_use_ema': True, 'bull_use_atr': False, 'bull_use_adx': True, 'bull_use_spike': True, 'bull_rsi_required': True, 'bear_strategy': 'breakout', 'bear_bb_std_mult': 2.0753607869496413, 'bear_rsi_os': 9, 'bear_rsi_ob': 47, 'bear_adx_thresh': 27.83053534180966, 'bear_atr_min_pct': 0.028702305908629138, 'bear_atr_max_pct': 0.10629676083772163, 'bear_tp_mult': 1.5945424169473148, 'bear_tsl_mult': 0.33887646799046317, 'bear_time_stop': 175, 'bear_use_sma': True, 'bear_use_ema': True, 'bear_use_atr': False, 'bear_use_adx': False, 'bear_use_spike': False, 'bear_rsi_required': True, 'sideways_strategy': 'mean_reversion', 'sideways_bb_std_mult': 1.9572763307341179, 'sideways_rsi_os': 44, 'sideways_rsi_ob': 90, 'sideways_adx_thresh': 26.69659950073459, 'sideways_atr_min_pct': 0.010855266921224498, 'sideways_atr_max_pct': 0.018621499757030743, 'sideways_tp_mult': 2.827256600688356, 'sideways_tsl_mult': 0.7510790394154313, 'sideways_time_stop': 245, 'sideways_use_sma': False, 'sideways_use_ema': True, 'sideways_use_atr': False, 'sideways_use_adx': True, 'sideways_use_spike': False, 'sideways_rsi_required': True}.
[I 2025-08-30 22:18:02,828] Trial 745 finished with values: [-1000000000.0, 1000000000.0] and parameters: {'p_sma': 35, 'p_std': 54, 'p_atr': 27, 'p_adx': 27, 'rsi_period': 41, 'ema1': 14, 'ema2': 35, 'slip_atr_k': 0.02192067524456225, 'slip_spread_k': 0.6666875806277195, 'spread_hl_frac': 0.04321509089437743, 'bb_std_mult': 2.1159322109144854, 'rsi_os': 11, 'rsi_ob': 73, 'vol_spike': 0.28292375024930116, 'adx_thresh': 11.462899423151226, 'atr_min_pct': 0.013246706322529384, 'atr_max_pct': 0.10830401859943574, 'tp_mult': 2.902670024007802, 'tsl_mult': 0.24402757478969678, 'strategy': 'breakout', 'time_stop': 153, 'use_sma': True, 'use_atr': True, 'use_adx': True, 'use_ema': True, 'use_spike': True, 'rsi_required': False, 'edge_k': 1.6744253803327662, 'edge_cap': 0.2635193466994693, 'bull_strategy': 'breakout', 'bull_bb_std_mult': 1.0292044156519498, 'bull_rsi_os': 16, 'bull_rsi_ob': 77, 'bull_adx_thresh': 17.6871741519758, 'bull_atr_min_pct': 0.0166315516903526, 'bull_atr_max_pct': 0.05522400035951466, 'bull_tp_mult': 1.387146722017073, 'bull_tsl_mult': 0.46601378908681024, 'bull_time_stop': 285, 'bull_use_sma': True, 'bull_use_ema': False, 'bull_use_atr': True, 'bull_use_adx': False, 'bull_use_spike': True, 'bull_rsi_required': True, 'bear_strategy': 'mean_reversion', 'bear_bb_std_mult': 1.0892215453489063, 'bear_rsi_os': 14, 'bear_rsi_ob': 47, 'bear_adx_thresh': 27.77678676560038, 'bear_atr_min_pct': 0.0125536703034422, 'bear_atr_max_pct': 0.04086302526735777, 'bear_tp_mult': 1.1773433838787946, 'bear_tsl_mult': 0.13400091048561774, 'bear_time_stop': 196, 'bear_use_sma': False, 'bear_use_ema': True, 'bear_use_atr': True, 'bear_use_adx': True, 'bear_use_spike': True, 'bear_rsi_required': True, 'sideways_strategy': 'breakout', 'sideways_bb_std_mult': 1.8661207056763862, 'sideways_rsi_os': 39, 'sideways_rsi_ob': 87, 'sideways_adx_thresh': 30.186986953551283, 'sideways_atr_min_pct': 0.021449493249608705, 'sideways_atr_max_pct': 0.036985084886077595, 'sideways_tp_mult': 1.9304842481505207, 'sideways_tsl_mult': 0.09198189701694809, 'sideways_time_stop': 113, 'sideways_use_sma': False, 'sideways_use_ema': True, 'sideways_use_atr': True, 'sideways_use_adx': False, 'sideways_use_spike': False, 'sideways_rsi_required': True}.
[I 2025-08-30 22:18:03,057] Trial 744 finished with values: [-1000000000.0, 1000000000.0] and parameters: {'p_sma': 35, 'p_std': 44, 'p_atr': 22, 'p_adx': 22, 'rsi_period': 71, 'ema1': 11, 'ema2': 35, 'slip_atr_k': 0.022664490376621743, 'slip_spread_k': 0.661175962897931, 'spread_hl_frac': 0.034900118034487185, 'bb_std_mult': 0.7219905795943861, 'rsi_os': 11, 'rsi_ob': 58, 'vol_spike': 0.28290633306484075, 'adx_thresh': 11.63642754425715, 'atr_min_pct': 0.0034930550540595174, 'atr_max_pct': 0.019804521259071436, 'tp_mult': 1.6163357658537, 'tsl_mult': 0.9387959854810652, 'strategy': 'mean_reversion', 'time_stop': 88, 'use_sma': True, 'use_atr': False, 'use_adx': True, 'use_ema': True, 'use_spike': True, 'rsi_required': False, 'edge_k': 1.1844187281681544, 'edge_cap': 0.7940480079454406, 'bull_strategy': 'mean_reversion', 'bull_bb_std_mult': 1.932410420141839, 'bull_rsi_os': 16, 'bull_rsi_ob': 77, 'bull_adx_thresh': 10.901296399536607, 'bull_atr_min_pct': 0.01576012430769961, 'bull_atr_max_pct': 0.08513004360449754, 'bull_tp_mult': 1.3541232181114216, 'bull_tsl_mult': 0.45111187000817715, 'bull_time_stop': 285, 'bull_use_sma': False, 'bull_use_ema': False, 'bull_use_atr': True, 'bull_use_adx': True, 'bull_use_spike': True, 'bull_rsi_required': True, 'bear_strategy': 'mean_reversion', 'bear_bb_std_mult': 0.5990014945221895, 'bear_rsi_os': 7, 'bear_rsi_ob': 64, 'bear_adx_thresh': 27.87128051023246, 'bear_atr_min_pct': 0.02859498895179835, 'bear_atr_max_pct': 0.04077214092752454, 'bear_tp_mult': 1.5973826440518804, 'bear_tsl_mult': 0.5328700333511818, 'bear_time_stop': 230, 'bear_use_sma': False, 'bear_use_ema': False, 'bear_use_atr': True, 'bear_use_adx': False, 'bear_use_spike': True, 'bear_rsi_required': True, 'sideways_strategy': 'mean_reversion', 'sideways_bb_std_mult': 1.8408362857305556, 'sideways_rsi_os': 39, 'sideways_rsi_ob': 90, 'sideways_adx_thresh': 5.537403344951876, 'sideways_atr_min_pct': 0.023373249603763184, 'sideways_atr_max_pct': 0.03750718629073322, 'sideways_tp_mult': 1.8513185300586599, 'sideways_tsl_mult': 0.3553545601043172, 'sideways_time_stop': 20, 'sideways_use_sma': False, 'sideways_use_ema': True, 'sideways_use_atr': True, 'sideways_use_adx': True, 'sideways_use_spike': False, 'sideways_rsi_required': True}.
[I 2025-08-30 22:18:04,069] Trial 746 finished with values: [-1000000000.0, 1000000000.0] and parameters: {'p_sma': 17, 'p_std': 41, 'p_atr': 27, 'p_adx': 7, 'rsi_period': 71, 'ema1': 24, 'ema2': 53, 'slip_atr_k': 0.023852504758058484, 'slip_spread_k': 0.41465060080621496, 'spread_hl_frac': 0.030279089164315067, 'bb_std_mult': 2.0805220463913026, 'rsi_os': 39, 'rsi_ob': 67, 'vol_spike': 0.2889708871416734, 'adx_thresh': 6.35858187307687, 'atr_min_pct': 0.02715309657919573, 'atr_max_pct': 0.026398343724436883, 'tp_mult': 1.480298807746123, 'tsl_mult': 0.9015135476208395, 'strategy': 'breakout', 'time_stop': 86, 'use_sma': True, 'use_atr': True, 'use_adx': True, 'use_ema': True, 'use_spike': True, 'rsi_required': True, 'edge_k': 1.6766119669501949, 'edge_cap': 0.786911929550087, 'bull_strategy': 'breakout', 'bull_bb_std_mult': 1.381530263342285, 'bull_rsi_os': 45, 'bull_rsi_ob': 64, 'bull_adx_thresh': 19.835202988110012, 'bull_atr_min_pct': 0.001373081285578589, 'bull_atr_max_pct': 0.05471804362760442, 'bull_tp_mult': 1.3907267393323322, 'bull_tsl_mult': 0.2321363280239397, 'bull_time_stop': 22, 'bull_use_sma': True, 'bull_use_ema': False, 'bull_use_atr': True, 'bull_use_adx': False, 'bull_use_spike': False, 'bull_rsi_required': True, 'bear_strategy': 'mean_reversion', 'bear_bb_std_mult': 1.8648178922634342, 'bear_rsi_os': 7, 'bear_rsi_ob': 71, 'bear_adx_thresh': 27.888008097381395, 'bear_atr_min_pct': 0.028872552129482792, 'bear_atr_max_pct': 0.09334980720652472, 'bear_tp_mult': 2.1700667222796475, 'bear_tsl_mult': 0.43579873941547, 'bear_time_stop': 230, 'bear_use_sma': False, 'bear_use_ema': False, 'bear_use_atr': True, 'bear_use_adx': True, 'bear_use_spike': True, 'bear_rsi_required': True, 'sideways_strategy': 'breakout', 'sideways_bb_std_mult': 3.496289209705858, 'sideways_rsi_os': 39, 'sideways_rsi_ob': 87, 'sideways_adx_thresh': 19.972233232605557, 'sideways_atr_min_pct': 0.021390313752367454, 'sideways_atr_max_pct': 0.03740719585762305, 'sideways_tp_mult': 1.0613261998824672, 'sideways_tsl_mult': 0.8423289451654615, 'sideways_time_stop': 257, 'sideways_use_sma': False, 'sideways_use_ema': False, 'sideways_use_atr': False, 'sideways_use_adx': False, 'sideways_use_spike': False, 'sideways_rsi_required': False}.
