[I 2025-08-30 21:52:26,768] Trial 522 finished with values: [-1000000000.0, 1000000000.0] and parameters: {'p_sma': 18, 'p_std': 38, 'p_atr': 10, 'p_adx': 15, 'rsi_period': 73, 'ema1': 9, 'ema2': 52, 'slip_atr_k': 0.0324697320361448, 'slip_spread_k': 0.6946112208483272, 'spread_hl_frac': 0.03462690185300158, 'bb_std_mult': 0.8627249265410785, 'rsi_os': 20, 'rsi_ob': 55, 'vol_spike': 0.278759159522481, 'adx_thresh': 9.00138164876917, 'atr_min_pct': 0.006189570512658924, 'atr_max_pct': 0.015642719349828527, 'tp_mult': 1.7419596585039379, 'tsl_mult': 0.08794302913167895, 'strategy': 'mean_reversion', 'time_stop': 12, 'use_sma': True, 'use_atr': True, 'use_adx': True, 'use_ema': True, 'use_spike': True, 'rsi_required': True, 'edge_k': 1.5200120509604242, 'edge_cap': 0.8204812364643421, 'bull_strategy': 'mean_reversion', 'bull_bb_std_mult': 2.1031233970318772, 'bull_rsi_os': 22, 'bull_rsi_ob': 89, 'bull_adx_thresh': 34.870061654239294, 'bull_atr_min_pct': 0.01659503788200609, 'bull_atr_max_pct': 0.05432697424773722, 'bull_tp_mult': 1.6674069970683632, 'bull_tsl_mult': 0.373401388574281, 'bull_time_stop': 300, 'bull_use_sma': True, 'bull_use_ema': False, 'bull_use_atr': True, 'bull_use_adx': False, 'bull_use_spike': False, 'bull_rsi_required': False, 'bear_strategy': 'mean_reversion', 'bear_bb_std_mult': 3.064799033124923, 'bear_rsi_os': 7, 'bear_rsi_ob': 73, 'bear_adx_thresh': 28.16096563451951, 'bear_atr_min_pct': 0.004929737857400982, 'bear_atr_max_pct': 0.09367781902496872, 'bear_tp_mult': 2.2100483052182907, 'bear_tsl_mult': 0.3979781006650415, 'bear_time_stop': 240, 'bear_use_sma': False, 'bear_use_ema': True, 'bear_use_atr': True, 'bear_use_adx': True, 'bear_use_spike': True, 'bear_rsi_required': False, 'sideways_strategy': 'breakout', 'sideways_bb_std_mult': 1.7195422833932463, 'sideways_rsi_os': 45, 'sideways_rsi_ob': 49, 'sideways_adx_thresh': 7.664851573445208, 'sideways_atr_min_pct': 0.021637496774045355, 'sideways_atr_max_pct': 0.04240093823728574, 'sideways_tp_mult': 2.340856370777348, 'sideways_tsl_mult': 0.7649066520092906, 'sideways_time_stop': 164, 'sideways_use_sma': False, 'sideways_use_ema': False, 'sideways_use_atr': False, 'sideways_use_adx': True, 'sideways_use_spike': False, 'sideways_rsi_required': False}.
[I 2025-08-30 21:52:57,635] Trial 523 finished with values: [-1000000000.0, 1000000000.0] and parameters: {'p_sma': 12, 'p_std': 14, 'p_atr': 20, 'p_adx': 21, 'rsi_period': 53, 'ema1': 12, 'ema2': 14, 'slip_atr_k': 0.03702281585937668, 'slip_spread_k': 0.20679371681164577, 'spread_hl_frac': 0.039016109729518064, 'bb_std_mult': 0.8383716083808913, 'rsi_os': 29, 'rsi_ob': 67, 'vol_spike': 0.2707328918609102, 'adx_thresh': 9.228310712698104, 'atr_min_pct': 0.0061728347001035085, 'atr_max_pct': 0.016087554011706546, 'tp_mult': 1.7506771801989869, 'tsl_mult': 0.9014774327603496, 'strategy': 'mean_reversion', 'time_stop': 80, 'use_sma': True, 'use_atr': True, 'use_adx': True, 'use_ema': True, 'use_spike': True, 'rsi_required': False, 'edge_k': 1.6070915658521918, 'edge_cap': 0.2116963279364723, 'bull_strategy': 'breakout', 'bull_bb_std_mult': 2.025689127699818, 'bull_rsi_os': 19, 'bull_rsi_ob': 89, 'bull_adx_thresh': 30.65250464299783, 'bull_atr_min_pct': 0.002351794217664145, 'bull_atr_max_pct': 0.05445508988746403, 'bull_tp_mult': 1.65365817016795, 'bull_tsl_mult': 0.26020089902379695, 'bull_time_stop': 270, 'bull_use_sma': True, 'bull_use_ema': False, 'bull_use_atr': True, 'bull_use_adx': False, 'bull_use_spike': False, 'bull_rsi_required': False, 'bear_strategy': 'mean_reversion', 'bear_bb_std_mult': 2.0673391585789687, 'bear_rsi_os': 7, 'bear_rsi_ob': 74, 'bear_adx_thresh': 24.55538982956957, 'bear_atr_min_pct': 0.028328215901960378, 'bear_atr_max_pct': 0.03562973608136837, 'bear_tp_mult': 1.4747588275264873, 'bear_tsl_mult': 0.35429692701121135, 'bear_time_stop': 237, 'bear_use_sma': False, 'bear_use_ema': True, 'bear_use_atr': True, 'bear_use_adx': True, 'bear_use_spike': False, 'bear_rsi_required': True, 'sideways_strategy': 'breakout', 'sideways_bb_std_mult': 1.4600165636587255, 'sideways_rsi_os': 39, 'sideways_rsi_ob': 77, 'sideways_adx_thresh': 27.797308950592633, 'sideways_atr_min_pct': 0.02169273819860582, 'sideways_atr_max_pct': 0.0245690926909461, 'sideways_tp_mult': 1.498457570025592, 'sideways_tsl_mult': 0.7763063039707763, 'sideways_time_stop': 33, 'sideways_use_sma': False, 'sideways_use_ema': False, 'sideways_use_atr': False, 'sideways_use_adx': True, 'sideways_use_spike': False, 'sideways_rsi_required': False}.
[I 2025-08-30 21:52:58,794] Trial 524 finished with values: [-1000000000.0, 1000000000.0] and parameters: {'p_sma': 13, 'p_std': 38, 'p_atr': 21, 'p_adx': 8, 'rsi_period': 69, 'ema1': 11, 'ema2': 15, 'slip_atr_k': 0.06688981346959151, 'slip_spread_k': 0.6483241421871888, 'spread_hl_frac': 0.04599356764212814, 'bb_std_mult': 0.8961146603436556, 'rsi_os': 17, 'rsi_ob': 52, 'vol_spike': 0.26935634703995737, 'adx_thresh': 11.546427259195479, 'atr_min_pct': 0.014709559121030497, 'atr_max_pct': 0.016564562999243273, 'tp_mult': 1.194328540428956, 'tsl_mult': 0.899652637590906, 'strategy': 'breakout', 'time_stop': 295, 'use_sma': True, 'use_atr': True, 'use_adx': True, 'use_ema': True, 'use_spike': True, 'rsi_required': False, 'edge_k': 1.512437023119627, 'edge_cap': 0.7416695662626897, 'bull_strategy': 'breakout', 'bull_bb_std_mult': 0.5859074190702955, 'bull_rsi_os': 27, 'bull_rsi_ob': 52, 'bull_adx_thresh': 14.888888444242454, 'bull_atr_min_pct': 0.002013747147112839, 'bull_atr_max_pct': 0.050347252988722425, 'bull_tp_mult': 1.378467159208867, 'bull_tsl_mult': 0.273869920372268, 'bull_time_stop': 295, 'bull_use_sma': True, 'bull_use_ema': False, 'bull_use_atr': True, 'bull_use_adx': False, 'bull_use_spike': False, 'bull_rsi_required': False, 'bear_strategy': 'breakout', 'bear_bb_std_mult': 2.0653090684127537, 'bear_rsi_os': 23, 'bear_rsi_ob': 85, 'bear_adx_thresh': 30.12538951069147, 'bear_atr_min_pct': 0.004776703098696497, 'bear_atr_max_pct': 0.10634319814531322, 'bear_tp_mult': 1.4192020750265244, 'bear_tsl_mult': 0.3486160908924004, 'bear_time_stop': 222, 'bear_use_sma': False, 'bear_use_ema': True, 'bear_use_atr': True, 'bear_use_adx': True, 'bear_use_spike': True, 'bear_rsi_required': False, 'sideways_strategy': 'mean_reversion', 'sideways_bb_std_mult': 0.9332684626827275, 'sideways_rsi_os': 25, 'sideways_rsi_ob': 91, 'sideways_adx_thresh': 28.45147542779532, 'sideways_atr_min_pct': 0.022075148740758055, 'sideways_atr_max_pct': 0.06804948826448505, 'sideways_tp_mult': 1.5058093182077494, 'sideways_tsl_mult': 0.7590631326185108, 'sideways_time_stop': 252, 'sideways_use_sma': False, 'sideways_use_ema': False, 'sideways_use_atr': False, 'sideways_use_adx': True, 'sideways_use_spike': False, 'sideways_rsi_required': False}.
[I 2025-08-30 21:53:00,930] Trial 526 finished with values: [-1000000000.0, 1000000000.0] and parameters: {'p_sma': 33, 'p_std': 19, 'p_atr': 7, 'p_adx': 8, 'rsi_period': 76, 'ema1': 12, 'ema2': 15, 'slip_atr_k': 0.024020134416303268, 'slip_spread_k': 0.6430305803134356, 'spread_hl_frac': 0.03906170734705299, 'bb_std_mult': 0.8740987154467241, 'rsi_os': 14, 'rsi_ob': 64, 'vol_spike': 0.28790780367557955, 'adx_thresh': 6.051087010969644, 'atr_min_pct': 0.014501700458772753, 'atr_max_pct': 0.01833611211460668, 'tp_mult': 2.665264146874698, 'tsl_mult': 0.4506618829043526, 'strategy': 'breakout', 'time_stop': 292, 'use_sma': True, 'use_atr': True, 'use_adx': True, 'use_ema': True, 'use_spike': True, 'rsi_required': False, 'edge_k': 0.4236412065739742, 'edge_cap': 0.2090424017037048, 'bull_strategy': 'breakout', 'bull_bb_std_mult': 1.3825700025591536, 'bull_rsi_os': 17, 'bull_rsi_ob': 53, 'bull_adx_thresh': 10.754043856940168, 'bull_atr_min_pct': 0.004664560795295862, 'bull_atr_max_pct': 0.05029616084805414, 'bull_tp_mult': 2.851650658684957, 'bull_tsl_mult': 0.5207112910668822, 'bull_time_stop': 67, 'bull_use_sma': True, 'bull_use_ema': False, 'bull_use_atr': False, 'bull_use_adx': False, 'bull_use_spike': False, 'bull_rsi_required': True, 'bear_strategy': 'breakout', 'bear_bb_std_mult': 2.073323301070475, 'bear_rsi_os': 5, 'bear_rsi_ob': 70, 'bear_adx_thresh': 27.15530924641055, 'bear_atr_min_pct': 0.029373062051280804, 'bear_atr_max_pct': 0.10600460223734016, 'bear_tp_mult': 1.4003590549473088, 'bear_tsl_mult': 0.5194457090598734, 'bear_time_stop': 232, 'bear_use_sma': False, 'bear_use_ema': True, 'bear_use_atr': False, 'bear_use_adx': True, 'bear_use_spike': True, 'bear_rsi_required': True, 'sideways_strategy': 'mean_reversion', 'sideways_bb_std_mult': 0.9608749497453393, 'sideways_rsi_os': 34, 'sideways_rsi_ob': 57, 'sideways_adx_thresh': 28.54070900595459, 'sideways_atr_min_pct': 0.02019682021786254, 'sideways_atr_max_pct': 0.05210120151823128, 'sideways_tp_mult': 1.86211704812196, 'sideways_tsl_mult': 0.7305885987095434, 'sideways_time_stop': 250, 'sideways_use_sma': False, 'sideways_use_ema': False, 'sideways_use_atr': False, 'sideways_use_adx': True, 'sideways_use_spike': False, 'sideways_rsi_required': False}.
[I 2025-08-30 21:53:00,931] Trial 525 finished with values: [-1000000000.0, 1000000000.0] and parameters: {'p_sma': 12, 'p_std': 53, 'p_atr': 21, 'p_adx': 8, 'rsi_period': 71, 'ema1': 11, 'ema2': 34, 'slip_atr_k': 0.025047206968135793, 'slip_spread_k': 0.6355002266668729, 'spread_hl_frac': 0.03154071572226872, 'bb_std_mult': 0.888447603587416, 'rsi_os': 14, 'rsi_ob': 90, 'vol_spike': 0.2754191693049449, 'adx_thresh': 34.940061540508886, 'atr_min_pct': 0.013361357819349322, 'atr_max_pct': 0.017564267942646736, 'tp_mult': 1.0527250260866106, 'tsl_mult': 0.900356464482625, 'strategy': 'breakout', 'time_stop': 82, 'use_sma': True, 'use_atr': True, 'use_adx': True, 'use_ema': True, 'use_spike': True, 'rsi_required': False, 'edge_k': 1.8608297427530567, 'edge_cap': 0.7429379709755637, 'bull_strategy': 'breakout', 'bull_bb_std_mult': 1.2682866353108244, 'bull_rsi_os': 17, 'bull_rsi_ob': 85, 'bull_adx_thresh': 26.01834046312242, 'bull_atr_min_pct': 0.009956359232869388, 'bull_atr_max_pct': 0.05404702077934747, 'bull_tp_mult': 1.345135536115324, 'bull_tsl_mult': 0.905435791935604, 'bull_time_stop': 295, 'bull_use_sma': True, 'bull_use_ema': False, 'bull_use_atr': False, 'bull_use_adx': False, 'bull_use_spike': False, 'bull_rsi_required': True, 'bear_strategy': 'breakout', 'bear_bb_std_mult': 1.1880722341463987, 'bear_rsi_os': 8, 'bear_rsi_ob': 74, 'bear_adx_thresh': 30.094761194360032, 'bear_atr_min_pct': 0.0284593088399511, 'bear_atr_max_pct': 0.09347088824867228, 'bear_tp_mult': 1.4920809814560985, 'bear_tsl_mult': 0.3515735787869387, 'bear_time_stop': 214, 'bear_use_sma': False, 'bear_use_ema': True, 'bear_use_atr': False, 'bear_use_adx': True, 'bear_use_spike': True, 'bear_rsi_required': True, 'sideways_strategy': 'mean_reversion', 'sideways_bb_std_mult': 1.5031617585434005, 'sideways_rsi_os': 39, 'sideways_rsi_ob': 58, 'sideways_adx_thresh': 28.155329702835292, 'sideways_atr_min_pct': 0.020724161860323626, 'sideways_atr_max_pct': 0.02387048126115964, 'sideways_tp_mult': 1.5100312497806676, 'sideways_tsl_mult': 0.7604073312612365, 'sideways_time_stop': 249, 'sideways_use_sma': False, 'sideways_use_ema': False, 'sideways_use_atr': False, 'sideways_use_adx': True, 'sideways_use_spike': False, 'sideways_rsi_required': False}.
[I 2025-08-30 21:53:33,539] Trial 527 finished with values: [-1000000000.0, 1000000000.0] and parameters: {'p_sma': 60, 'p_std': 44, 'p_atr': 21, 'p_adx': 8, 'rsi_period': 69, 'ema1': 12, 'ema2': 57, 'slip_atr_k': 0.024258477705795513, 'slip_spread_k': 0.6368033027716682, 'spread_hl_frac': 0.03172615509389927, 'bb_std_mult': 2.3219233836178446, 'rsi_os': 10, 'rsi_ob': 93, 'vol_spike': 0.2849564983928804, 'adx_thresh': 34.99513242665602, 'atr_min_pct': 0.013500085615224608, 'atr_max_pct': 0.018329995285045662, 'tp_mult': 2.600536497009854, 'tsl_mult': 0.3509441592620376, 'strategy': 'breakout', 'time_stop': 84, 'use_sma': True, 'use_atr': False, 'use_adx': True, 'use_ema': True, 'use_spike': True, 'rsi_required': False, 'edge_k': 1.9342459178901275, 'edge_cap': 0.9368100858535248, 'bull_strategy': 'breakout', 'bull_bb_std_mult': 1.859361727372372, 'bull_rsi_os': 34, 'bull_rsi_ob': 85, 'bull_adx_thresh': 26.079393065736344, 'bull_atr_min_pct': 0.012836212716070425, 'bull_atr_max_pct': 0.04654350347980386, 'bull_tp_mult': 1.337468782305744, 'bull_tsl_mult': 0.5293360882931888, 'bull_time_stop': 295, 'bull_use_sma': True, 'bull_use_ema': False, 'bull_use_atr': False, 'bull_use_adx': False, 'bull_use_spike': False, 'bull_rsi_required': True, 'bear_strategy': 'breakout', 'bear_bb_std_mult': 2.0237695907561806, 'bear_rsi_os': 8, 'bear_rsi_ob': 70, 'bear_adx_thresh': 27.00439573827422, 'bear_atr_min_pct': 0.02947235482674257, 'bear_atr_max_pct': 0.10522464764664537, 'bear_tp_mult': 1.4104366354145006, 'bear_tsl_mult': 0.7120335410871561, 'bear_time_stop': 220, 'bear_use_sma': False, 'bear_use_ema': True, 'bear_use_atr': False, 'bear_use_adx': False, 'bear_use_spike': True, 'bear_rsi_required': True, 'sideways_strategy': 'mean_reversion', 'sideways_bb_std_mult': 1.7706469695994467, 'sideways_rsi_os': 34, 'sideways_rsi_ob': 58, 'sideways_adx_thresh': 18.799739590926563, 'sideways_atr_min_pct': 0.019868776518494793, 'sideways_atr_max_pct': 0.052371178702993605, 'sideways_tp_mult': 1.8625087077761064, 'sideways_tsl_mult': 0.7320115392041993, 'sideways_time_stop': 299, 'sideways_use_sma': False, 'sideways_use_ema': False, 'sideways_use_atr': False, 'sideways_use_adx': True, 'sideways_use_spike': False, 'sideways_rsi_required': False}.
[I 2025-08-30 21:53:34,213] Trial 528 finished with values: [-0.016230127694275676, 0.016166974325772528] and parameters: {'p_sma': 33, 'p_std': 35, 'p_atr': 21, 'p_adx': 22, 'rsi_period': 71, 'ema1': 12, 'ema2': 54, 'slip_atr_k': 0.02406282293768552, 'slip_spread_k': 0.6326528426305715, 'spread_hl_frac': 0.03151745264241313, 'bb_std_mult': 2.1222211718277824, 'rsi_os': 14, 'rsi_ob': 45, 'vol_spike': 0.2863454340047121, 'adx_thresh': 11.493663076901372, 'atr_min_pct': 0.013480029854561669, 'atr_max_pct': 0.019011046942490634, 'tp_mult': 1.8772877609829188, 'tsl_mult': 0.8583078378117409, 'strategy': 'breakout', 'time_stop': 247, 'use_sma': True, 'use_atr': False, 'use_adx': True, 'use_ema': True, 'use_spike': True, 'rsi_required': True, 'edge_k': 0.3612213159544907, 'edge_cap': 0.958968591822571, 'bull_strategy': 'breakout', 'bull_bb_std_mult': 1.2706859765345246, 'bull_rsi_os': 54, 'bull_rsi_ob': 85, 'bull_adx_thresh': 15.271408754811366, 'bull_atr_min_pct': 1.4910209380415707e-05, 'bull_atr_max_pct': 0.0462440703178246, 'bull_tp_mult': 2.8505104112648207, 'bull_tsl_mult': 0.3875533307089541, 'bull_time_stop': 287, 'bull_use_sma': True, 'bull_use_ema': False, 'bull_use_atr': False, 'bull_use_adx': False, 'bull_use_spike': False, 'bull_rsi_required': True, 'bear_strategy': 'breakout', 'bear_bb_std_mult': 2.0227127588875176, 'bear_rsi_os': 9, 'bear_rsi_ob': 75, 'bear_adx_thresh': 7.6149723473679565, 'bear_atr_min_pct': 0.029427049653703557, 'bear_atr_max_pct': 0.08633854929545291, 'bear_tp_mult': 1.5896152887022739, 'bear_tsl_mult': 0.8130908534220864, 'bear_time_stop': 197, 'bear_use_sma': False, 'bear_use_ema': True, 'bear_use_atr': False, 'bear_use_adx': False, 'bear_use_spike': True, 'bear_rsi_required': True, 'sideways_strategy': 'mean_reversion', 'sideways_bb_std_mult': 1.5704870360195222, 'sideways_rsi_os': 32, 'sideways_rsi_ob': 58, 'sideways_adx_thresh': 26.15002081262245, 'sideways_atr_min_pct': 0.019943939511050033, 'sideways_atr_max_pct': 0.07774159708637826, 'sideways_tp_mult': 1.8118837771848935, 'sideways_tsl_mult': 0.7297831956793728, 'sideways_time_stop': 264, 'sideways_use_sma': False, 'sideways_use_ema': False, 'sideways_use_atr': False, 'sideways_use_adx': True, 'sideways_use_spike': False, 'sideways_rsi_required': False}.
[I 2025-08-30 21:53:34,864] Trial 530 finished with values: [-1000000000.0, 1000000000.0] and parameters: {'p_sma': 35, 'p_std': 37, 'p_atr': 21, 'p_adx': 22, 'rsi_period': 44, 'ema1': 11, 'ema2': 54, 'slip_atr_k': 0.018225471283855266, 'slip_spread_k': 0.6567217106612854, 'spread_hl_frac': 0.03140104087160697, 'bb_std_mult': 2.1248348305848177, 'rsi_os': 11, 'rsi_ob': 92, 'vol_spike': 0.00027959287798517973, 'adx_thresh': 33.26288807090886, 'atr_min_pct': 0.023912873598724935, 'atr_max_pct': 0.024452739642321704, 'tp_mult': 2.115184934979365, 'tsl_mult': 0.8559933146635965, 'strategy': 'mean_reversion', 'time_stop': 97, 'use_sma': True, 'use_atr': False, 'use_adx': True, 'use_ema': True, 'use_spike': True, 'rsi_required': True, 'edge_k': 1.925298201478315, 'edge_cap': 0.9430766461651636, 'bull_strategy': 'breakout', 'bull_bb_std_mult': 0.9354535051274857, 'bull_rsi_os': 18, 'bull_rsi_ob': 87, 'bull_adx_thresh': 24.816322912418368, 'bull_atr_min_pct': 0.02503696090157289, 'bull_atr_max_pct': 0.04566704559671675, 'bull_tp_mult': 1.441644948997333, 'bull_tsl_mult': 0.8112815134783716, 'bull_time_stop': 285, 'bull_use_sma': False, 'bull_use_ema': True, 'bull_use_atr': False, 'bull_use_adx': False, 'bull_use_spike': False, 'bull_rsi_required': True, 'bear_strategy': 'mean_reversion', 'bear_bb_std_mult': 3.2266075761899975, 'bear_rsi_os': 10, 'bear_rsi_ob': 73, 'bear_adx_thresh': 26.623131084750383, 'bear_atr_min_pct': 0.029511193190942264, 'bear_atr_max_pct': 0.10125236728420176, 'bear_tp_mult': 1.5822521816902286, 'bear_tsl_mult': 0.7089392285229987, 'bear_time_stop': 253, 'bear_use_sma': False, 'bear_use_ema': True, 'bear_use_atr': False, 'bear_use_adx': False, 'bear_use_spike': False, 'bear_rsi_required': True, 'sideways_strategy': 'breakout', 'sideways_bb_std_mult': 1.7734733168344217, 'sideways_rsi_os': 38, 'sideways_rsi_ob': 90, 'sideways_adx_thresh': 26.13723698863756, 'sideways_atr_min_pct': 0.019847345214240624, 'sideways_atr_max_pct': 0.07718291428440291, 'sideways_tp_mult': 1.597377429374824, 'sideways_tsl_mult': 0.8224865630095151, 'sideways_time_stop': 265, 'sideways_use_sma': False, 'sideways_use_ema': False, 'sideways_use_atr': False, 'sideways_use_adx': True, 'sideways_use_spike': False, 'sideways_rsi_required': False}.
[I 2025-08-30 21:53:35,034] Trial 529 finished with values: [-1000000000.0, 1000000000.0] and parameters: {'p_sma': 35, 'p_std': 37, 'p_atr': 21, 'p_adx': 17, 'rsi_period': 71, 'ema1': 11, 'ema2': 54, 'slip_atr_k': 0.1014979646044925, 'slip_spread_k': 0.6668286143672104, 'spread_hl_frac': 0.03145517204383113, 'bb_std_mult': 2.3118769569261195, 'rsi_os': 11, 'rsi_ob': 66, 'vol_spike': 0.22252642178536197, 'adx_thresh': 33.190793974400506, 'atr_min_pct': 0.023757299634378545, 'atr_max_pct': 0.02724162609254034, 'tp_mult': 2.1470862301528784, 'tsl_mult': 0.8570090165072702, 'strategy': 'mean_reversion', 'time_stop': 86, 'use_sma': True, 'use_atr': False, 'use_adx': True, 'use_ema': True, 'use_spike': True, 'rsi_required': True, 'edge_k': 1.1341999024870821, 'edge_cap': 0.9373452373384582, 'bull_strategy': 'breakout', 'bull_bb_std_mult': 1.8315458967195477, 'bull_rsi_os': 18, 'bull_rsi_ob': 87, 'bull_adx_thresh': 31.588894508093187, 'bull_atr_min_pct': 0.0009059796283327092, 'bull_atr_max_pct': 0.04594968539098292, 'bull_tp_mult': 1.4545267266862907, 'bull_tsl_mult': 0.389209421997617, 'bull_time_stop': 286, 'bull_use_sma': False, 'bull_use_ema': True, 'bull_use_atr': False, 'bull_use_adx': False, 'bull_use_spike': False, 'bull_rsi_required': True, 'bear_strategy': 'mean_reversion', 'bear_bb_std_mult': 2.017226977686681, 'bear_rsi_os': 26, 'bear_rsi_ob': 73, 'bear_adx_thresh': 26.15530045747566, 'bear_atr_min_pct': 0.02999365503645448, 'bear_atr_max_pct': 0.08714427953247827, 'bear_tp_mult': 1.6025734133742713, 'bear_tsl_mult': 0.7076381042172327, 'bear_time_stop': 197, 'bear_use_sma': False, 'bear_use_ema': True, 'bear_use_atr': False, 'bear_use_adx': False, 'bear_use_spike': False, 'bear_rsi_required': True, 'sideways_strategy': 'breakout', 'sideways_bb_std_mult': 1.911765026031596, 'sideways_rsi_os': 38, 'sideways_rsi_ob': 79, 'sideways_adx_thresh': 26.083540512084518, 'sideways_atr_min_pct': 0.019889569167921804, 'sideways_atr_max_pct': 0.039451019699464296, 'sideways_tp_mult': 2.2118427572498844, 'sideways_tsl_mult': 0.8284490917390714, 'sideways_time_stop': 14, 'sideways_use_sma': False, 'sideways_use_ema': False, 'sideways_use_atr': False, 'sideways_use_adx': True, 'sideways_use_spike': False, 'sideways_rsi_required': False}.
