[I 2025-08-30 20:56:13,228] Trial 71 finished with values: [-0.060718836197128034, 0.060644319026720864] and parameters: {'p_sma': 42, 'p_std': 9, 'p_atr': 26, 'p_adx': 17, 'rsi_period': 26, 'ema1': 17, 'ema2': 39, 'slip_atr_k': 0.16002831817791643, 'slip_spread_k': 0.8644703003708082, 'spread_hl_frac': 0.009034400678521941, 'bb_std_mult': 3.2356494171625076, 'rsi_os': 11, 'rsi_ob': 86, 'vol_spike': 0.14292403176073154, 'adx_thresh': 30.432247467231385, 'atr_min_pct': 0.014655414715387073, 'atr_max_pct': 0.05535848735948682, 'tp_mult': 2.239640704658921, 'tsl_mult': 0.41685692484588727, 'strategy': 'mean_reversion', 'time_stop': 46, 'use_sma': True, 'use_atr': True, 'use_adx': True, 'use_ema': False, 'use_spike': True, 'rsi_required': True, 'edge_k': 0.7726612430327534, 'edge_cap': 0.37474088385752624, 'bull_strategy': 'breakout', 'bull_bb_std_mult': 1.314936436179208, 'bull_rsi_os': 33, 'bull_rsi_ob': 48, 'bull_adx_thresh': 32.198786776901926, 'bull_atr_min_pct': 0.0011033614813689353, 'bull_atr_max_pct': 0.02907616510994044, 'bull_tp_mult': 2.562205566411433, 'bull_tsl_mult': 0.5621600648751044, 'bull_time_stop': 211, 'bull_use_sma': False, 'bull_use_ema': False, 'bull_use_atr': False, 'bull_use_adx': True, 'bull_use_spike': False, 'bull_rsi_required': True, 'bear_strategy': 'mean_reversion', 'bear_bb_std_mult': 2.7681562565019826, 'bear_rsi_os': 27, 'bear_rsi_ob': 65, 'bear_adx_thresh': 24.23745850253067, 'bear_atr_min_pct': 0.0003350363175726803, 'bear_atr_max_pct': 0.05528984213082803, 'bear_tp_mult': 2.1591639488470378, 'bear_tsl_mult': 0.11563183993041937, 'bear_time_stop': 51, 'bear_use_sma': True, 'bear_use_ema': False, 'bear_use_atr': False, 'bear_use_adx': False, 'bear_use_spike': True, 'bear_rsi_required': True, 'sideways_strategy': 'mean_reversion', 'sideways_bb_std_mult': 3.195428925659249, 'sideways_rsi_os': 34, 'sideways_rsi_ob': 58, 'sideways_adx_thresh': 25.096350530601867, 'sideways_atr_min_pct': 0.012692049406996728, 'sideways_atr_max_pct': 0.06478690309666309, 'sideways_tp_mult': 2.2550523018262023, 'sideways_tsl_mult': 0.35431571263432515, 'sideways_time_stop': 262, 'sideways_use_sma': False, 'sideways_use_ema': False, 'sideways_use_atr': False, 'sideways_use_adx': False, 'sideways_use_spike': False, 'sideways_rsi_required': False}.
[I 2025-08-30 20:56:46,623] Trial 74 finished with values: [-1000000000.0, 1000000000.0] and parameters: {'p_sma': 35, 'p_std': 30, 'p_atr': 22, 'p_adx': 19, 'rsi_period': 11, 'ema1': 7, 'ema2': 37, 'slip_atr_k': 0.05600363002454046, 'slip_spread_k': 0.711169622985133, 'spread_hl_frac': 0.00592542224931444, 'bb_std_mult': 3.58282501627127, 'rsi_os': 34, 'rsi_ob': 92, 'vol_spike': 0.0016395101086710123, 'adx_thresh': 23.879432916544946, 'atr_min_pct': 0.01385817196692821, 'atr_max_pct': 0.060367163465578584, 'tp_mult': 2.0323008237903455, 'tsl_mult': 0.02855023062229753, 'strategy': 'mean_reversion', 'time_stop': 29, 'use_sma': False, 'use_atr': True, 'use_adx': True, 'use_ema': False, 'use_spike': True, 'rsi_required': True, 'edge_k': 0.8949477878145095, 'edge_cap': 0.2496497192464271, 'bull_strategy': 'mean_reversion', 'bull_bb_std_mult': 1.7788287857452314, 'bull_rsi_os': 41, 'bull_rsi_ob': 74, 'bull_adx_thresh': 9.364971877682478, 'bull_atr_min_pct': 0.0053041263687035566, 'bull_atr_max_pct': 0.04372282279427619, 'bull_tp_mult': 2.641132254499719, 'bull_tsl_mult': 0.6896585784843922, 'bull_time_stop': 139, 'bull_use_sma': True, 'bull_use_ema': False, 'bull_use_atr': False, 'bull_use_adx': False, 'bull_use_spike': False, 'bull_rsi_required': True, 'bear_strategy': 'mean_reversion', 'bear_bb_std_mult': 2.313164974892229, 'bear_rsi_os': 44, 'bear_rsi_ob': 48, 'bear_adx_thresh': 28.67827844466091, 'bear_atr_min_pct': 0.02116353763538478, 'bear_atr_max_pct': 0.14248418421016903, 'bear_tp_mult': 2.4116010364782166, 'bear_tsl_mult': 0.7972684146491853, 'bear_time_stop': 5, 'bear_use_sma': False, 'bear_use_ema': False, 'bear_use_atr': True, 'bear_use_adx': False, 'bear_use_spike': True, 'bear_rsi_required': True, 'sideways_strategy': 'breakout', 'sideways_bb_std_mult': 2.1789466391216563, 'sideways_rsi_os': 36, 'sideways_rsi_ob': 71, 'sideways_adx_thresh': 30.341357938698575, 'sideways_atr_min_pct': 0.013060158682449634, 'sideways_atr_max_pct': 0.03537635958985385, 'sideways_tp_mult': 1.5574596559227554, 'sideways_tsl_mult': 0.48561879168798394, 'sideways_time_stop': 15, 'sideways_use_sma': False, 'sideways_use_ema': False, 'sideways_use_atr': True, 'sideways_use_adx': True, 'sideways_use_spike': False, 'sideways_rsi_required': False}.
[I 2025-08-30 20:56:46,635] Trial 73 finished with values: [-1000000000.0, 1000000000.0] and parameters: {'p_sma': 35, 'p_std': 30, 'p_atr': 22, 'p_adx': 19, 'rsi_period': 13, 'ema1': 7, 'ema2': 37, 'slip_atr_k': 0.0245787509924762, 'slip_spread_k': 0.701567132591806, 'spread_hl_frac': 0.01141735853088263, 'bb_std_mult': 3.5910640331652055, 'rsi_os': 34, 'rsi_ob': 92, 'vol_spike': 0.0013629315480043589, 'adx_thresh': 24.90860592319906, 'atr_min_pct': 0.009892367720583179, 'atr_max_pct': 0.06101284302907724, 'tp_mult': 1.734413316541518, 'tsl_mult': 0.22874116647486714, 'strategy': 'mean_reversion', 'time_stop': 65, 'use_sma': False, 'use_atr': True, 'use_adx': True, 'use_ema': False, 'use_spike': True, 'rsi_required': True, 'edge_k': 0.88421486914842, 'edge_cap': 0.25998974305364997, 'bull_strategy': 'mean_reversion', 'bull_bb_std_mult': 1.7912567278574618, 'bull_rsi_os': 34, 'bull_rsi_ob': 75, 'bull_adx_thresh': 7.546674152004194, 'bull_atr_min_pct': 0.00344653865165354, 'bull_atr_max_pct': 0.04310333771748055, 'bull_tp_mult': 2.6415333248468897, 'bull_tsl_mult': 0.6633222466457958, 'bull_time_stop': 111, 'bull_use_sma': True, 'bull_use_ema': False, 'bull_use_atr': False, 'bull_use_adx': False, 'bull_use_spike': False, 'bull_rsi_required': True, 'bear_strategy': 'mean_reversion', 'bear_bb_std_mult': 2.315564777319998, 'bear_rsi_os': 40, 'bear_rsi_ob': 48, 'bear_adx_thresh': 28.638251110996702, 'bear_atr_min_pct': 0.022060946352451528, 'bear_atr_max_pct': 0.14995235362132278, 'bear_tp_mult': 2.4775157233847986, 'bear_tsl_mult': 0.7988122184832764, 'bear_time_stop': 9, 'bear_use_sma': False, 'bear_use_ema': False, 'bear_use_atr': True, 'bear_use_adx': False, 'bear_use_spike': True, 'bear_rsi_required': True, 'sideways_strategy': 'breakout', 'sideways_bb_std_mult': 3.3152431370195385, 'sideways_rsi_os': 37, 'sideways_rsi_ob': 64, 'sideways_adx_thresh': 30.457042347733413, 'sideways_atr_min_pct': 0.013667359532313733, 'sideways_atr_max_pct': 0.03330926295029193, 'sideways_tp_mult': 2.3570516331520324, 'sideways_tsl_mult': 0.6008489552990748, 'sideways_time_stop': 15, 'sideways_use_sma': False, 'sideways_use_ema': False, 'sideways_use_atr': True, 'sideways_use_adx': True, 'sideways_use_spike': False, 'sideways_rsi_required': False}.
[I 2025-08-30 20:56:46,817] Trial 75 finished with values: [-1000000000.0, 1000000000.0] and parameters: {'p_sma': 38, 'p_std': 29, 'p_atr': 22, 'p_adx': 12, 'rsi_period': 11, 'ema1': 7, 'ema2': 37, 'slip_atr_k': 0.019232097490466466, 'slip_spread_k': 0.7055411467891949, 'spread_hl_frac': 0.011775523175322473, 'bb_std_mult': 3.5436076745566067, 'rsi_os': 34, 'rsi_ob': 91, 'vol_spike': 0.022788367170196805, 'adx_thresh': 24.211528354107482, 'atr_min_pct': 0.011913499969813161, 'atr_max_pct': 0.061229605007652524, 'tp_mult': 1.8720762788331693, 'tsl_mult': 0.037046493206915915, 'strategy': 'mean_reversion', 'time_stop': 62, 'use_sma': False, 'use_atr': True, 'use_adx': True, 'use_ema': False, 'use_spike': True, 'rsi_required': True, 'edge_k': 0.8849187186536666, 'edge_cap': 0.25517956156833915, 'bull_strategy': 'mean_reversion', 'bull_bb_std_mult': 1.9609326763333992, 'bull_rsi_os': 41, 'bull_rsi_ob': 69, 'bull_adx_thresh': 7.67205162518856, 'bull_atr_min_pct': 0.0044532946504769666, 'bull_atr_max_pct': 0.043298511568804786, 'bull_tp_mult': 2.672839825315493, 'bull_tsl_mult': 0.6484469167721731, 'bull_time_stop': 119, 'bull_use_sma': True, 'bull_use_ema': False, 'bull_use_atr': False, 'bull_use_adx': False, 'bull_use_spike': False, 'bull_rsi_required': True, 'bear_strategy': 'mean_reversion', 'bear_bb_std_mult': 2.299827712430839, 'bear_rsi_os': 40, 'bear_rsi_ob': 48, 'bear_adx_thresh': 28.85032433862814, 'bear_atr_min_pct': 0.02151686828528985, 'bear_atr_max_pct': 0.1442772466585379, 'bear_tp_mult': 2.5065702848047966, 'bear_tsl_mult': 0.7958542058287401, 'bear_time_stop': 35, 'bear_use_sma': False, 'bear_use_ema': False, 'bear_use_atr': True, 'bear_use_adx': False, 'bear_use_spike': True, 'bear_rsi_required': True, 'sideways_strategy': 'breakout', 'sideways_bb_std_mult': 3.3387624140336003, 'sideways_rsi_os': 37, 'sideways_rsi_ob': 64, 'sideways_adx_thresh': 30.40340211997493, 'sideways_atr_min_pct': 0.013399851713235095, 'sideways_atr_max_pct': 0.03142457141429454, 'sideways_tp_mult': 1.8142851037923773, 'sideways_tsl_mult': 0.47837379299140875, 'sideways_time_stop': 11, 'sideways_use_sma': False, 'sideways_use_ema': False, 'sideways_use_atr': True, 'sideways_use_adx': True, 'sideways_use_spike': False, 'sideways_rsi_required': False}.
[I 2025-08-30 20:56:47,071] Trial 76 finished with values: [-1000000000.0, 1000000000.0] and parameters: {'p_sma': 36, 'p_std': 30, 'p_atr': 22, 'p_adx': 19, 'rsi_period': 12, 'ema1': 7, 'ema2': 37, 'slip_atr_k': 0.02781426812434283, 'slip_spread_k': 0.7111097177867712, 'spread_hl_frac': 0.011256581595378307, 'bb_std_mult': 3.3389485277424176, 'rsi_os': 34, 'rsi_ob': 91, 'vol_spike': 0.0002270630638496994, 'adx_thresh': 24.229233197845286, 'atr_min_pct': 0.013655287622878744, 'atr_max_pct': 0.07037014709336727, 'tp_mult': 1.7275772093786232, 'tsl_mult': 0.04429339779618127, 'strategy': 'mean_reversion', 'time_stop': 33, 'use_sma': False, 'use_atr': True, 'use_adx': True, 'use_ema': False, 'use_spike': True, 'rsi_required': True, 'edge_k': 0.8960310484974136, 'edge_cap': 0.2546026490090526, 'bull_strategy': 'mean_reversion', 'bull_bb_std_mult': 1.758943448721904, 'bull_rsi_os': 34, 'bull_rsi_ob': 75, 'bull_adx_thresh': 7.920411775694454, 'bull_atr_min_pct': 0.004410575527778109, 'bull_atr_max_pct': 0.043563855463131115, 'bull_tp_mult': 2.705451515504947, 'bull_tsl_mult': 0.6719568670444459, 'bull_time_stop': 119, 'bull_use_sma': True, 'bull_use_ema': False, 'bull_use_atr': False, 'bull_use_adx': False, 'bull_use_spike': False, 'bull_rsi_required': True, 'bear_strategy': 'mean_reversion', 'bear_bb_std_mult': 2.892595524770913, 'bear_rsi_os': 45, 'bear_rsi_ob': 48, 'bear_adx_thresh': 23.838926306697232, 'bear_atr_min_pct': 0.021906479014108877, 'bear_atr_max_pct': 0.14413103505751923, 'bear_tp_mult': 2.3867009202364295, 'bear_tsl_mult': 0.7986918386172154, 'bear_time_stop': 14, 'bear_use_sma': False, 'bear_use_ema': False, 'bear_use_atr': True, 'bear_use_adx': False, 'bear_use_spike': True, 'bear_rsi_required': True, 'sideways_strategy': 'breakout', 'sideways_bb_std_mult': 1.7413318136608735, 'sideways_rsi_os': 37, 'sideways_rsi_ob': 64, 'sideways_adx_thresh': 30.76012274193529, 'sideways_atr_min_pct': 0.01371385531650956, 'sideways_atr_max_pct': 0.03231469727769451, 'sideways_tp_mult': 1.5681755234160133, 'sideways_tsl_mult': 0.4955595882960748, 'sideways_time_stop': 14, 'sideways_use_sma': False, 'sideways_use_ema': False, 'sideways_use_atr': True, 'sideways_use_adx': True, 'sideways_use_spike': False, 'sideways_rsi_required': False}.
[I 2025-08-30 20:57:22,527] Trial 79 finished with values: [-0.020574792160144573, 0.02050024146819978] and parameters: {'p_sma': 40, 'p_std': 24, 'p_atr': 24, 'p_adx': 15, 'rsi_period': 18, 'ema1': 9, 'ema2': 43, 'slip_atr_k': 0.07483597170211627, 'slip_spread_k': 0.7355350962027669, 'spread_hl_frac': 0.03259096919641149, 'bb_std_mult': 3.3287026191091496, 'rsi_os': 7, 'rsi_ob': 95, 'vol_spike': 0.024205250317042203, 'adx_thresh': 26.49665819371086, 'atr_min_pct': 0.01794873634635991, 'atr_max_pct': 0.07005229207840961, 'tp_mult': 1.7111296961250926, 'tsl_mult': 0.10101625672224826, 'strategy': 'breakout', 'time_stop': 51, 'use_sma': False, 'use_atr': True, 'use_adx': True, 'use_ema': False, 'use_spike': True, 'rsi_required': True, 'edge_k': 0.7586704519820948, 'edge_cap': 0.4582525915385825, 'bull_strategy': 'breakout', 'bull_bb_std_mult': 0.6378651045759565, 'bull_rsi_os': 32, 'bull_rsi_ob': 80, 'bull_adx_thresh': 9.843307886623414, 'bull_atr_min_pct': 0.0011374850121188267, 'bull_atr_max_pct': 0.12994565148780238, 'bull_tp_mult': 2.527616139526821, 'bull_tsl_mult': 0.5008206193948417, 'bull_time_stop': 144, 'bull_use_sma': True, 'bull_use_ema': True, 'bull_use_atr': False, 'bull_use_adx': True, 'bull_use_spike': False, 'bull_rsi_required': False, 'bear_strategy': 'mean_reversion', 'bear_bb_std_mult': 2.59856859392773, 'bear_rsi_os': 8, 'bear_rsi_ob': 50, 'bear_adx_thresh': 23.68037181408757, 'bear_atr_min_pct': 0.023417907716430562, 'bear_atr_max_pct': 0.1249593052113962, 'bear_tp_mult': 2.312701557618015, 'bear_tsl_mult': 0.8890405489370735, 'bear_time_stop': 31, 'bear_use_sma': True, 'bear_use_ema': False, 'bear_use_atr': False, 'bear_use_adx': True, 'bear_use_spike': True, 'bear_rsi_required': False, 'sideways_strategy': 'breakout', 'sideways_bb_std_mult': 1.7666805150085703, 'sideways_rsi_os': 53, 'sideways_rsi_ob': 56, 'sideways_adx_thresh': 34.07651963692383, 'sideways_atr_min_pct': 0.007953183629480682, 'sideways_atr_max_pct': 0.03843057217584538, 'sideways_tp_mult': 1.3739479261755387, 'sideways_tsl_mult': 0.5162950563867997, 'sideways_time_stop': 25, 'sideways_use_sma': False, 'sideways_use_ema': False, 'sideways_use_atr': True, 'sideways_use_adx': False, 'sideways_use_spike': False, 'sideways_rsi_required': False}.
[I 2025-08-30 20:57:22,575] Trial 78 finished with values: [-1000000000.0, 1000000000.0] and parameters: {'p_sma': 38, 'p_std': 30, 'p_atr': 23, 'p_adx': 14, 'rsi_period': 10, 'ema1': 9, 'ema2': 43, 'slip_atr_k': 0.1208050553722949, 'slip_spread_k': 0.7396777815962058, 'spread_hl_frac': 0.012086654767878872, 'bb_std_mult': 1.7922864951442596, 'rsi_os': 7, 'rsi_ob': 95, 'vol_spike': 0.02389102433396076, 'adx_thresh': 27.411375165366547, 'atr_min_pct': 0.01206251359418348, 'atr_max_pct': 0.06904238067920072, 'tp_mult': 1.869410263646007, 'tsl_mult': 0.16480462846023666, 'strategy': 'mean_reversion', 'time_stop': 53, 'use_sma': False, 'use_atr': True, 'use_adx': True, 'use_ema': False, 'use_spike': True, 'rsi_required': True, 'edge_k': 0.6230899885103284, 'edge_cap': 0.47133206858255183, 'bull_strategy': 'breakout', 'bull_bb_std_mult': 0.6584296092986952, 'bull_rsi_os': 11, 'bull_rsi_ob': 69, 'bull_adx_thresh': 7.7804173437387565, 'bull_atr_min_pct': 0.004683944801340563, 'bull_atr_max_pct': 0.1313179001591882, 'bull_tp_mult': 2.730943383216843, 'bull_tsl_mult': 0.981181731122027, 'bull_time_stop': 120, 'bull_use_sma': True, 'bull_use_ema': True, 'bull_use_atr': False, 'bull_use_adx': True, 'bull_use_spike': False, 'bull_rsi_required': False, 'bear_strategy': 'mean_reversion', 'bear_bb_std_mult': 2.60083759702648, 'bear_rsi_os': 8, 'bear_rsi_ob': 50, 'bear_adx_thresh': 17.548749856802168, 'bear_atr_min_pct': 0.024107014086775486, 'bear_atr_max_pct': 0.1242443421332133, 'bear_tp_mult': 2.303349151540777, 'bear_tsl_mult': 0.9152817918375324, 'bear_time_stop': 42, 'bear_use_sma': True, 'bear_use_ema': False, 'bear_use_atr': False, 'bear_use_adx': True, 'bear_use_spike': True, 'bear_rsi_required': False, 'sideways_strategy': 'breakout', 'sideways_bb_std_mult': 1.670016033428511, 'sideways_rsi_os': 44, 'sideways_rsi_ob': 95, 'sideways_adx_thresh': 26.916582655015297, 'sideways_atr_min_pct': 0.008455025166945462, 'sideways_atr_max_pct': 0.04000736076192181, 'sideways_tp_mult': 1.7688804972605146, 'sideways_tsl_mult': 0.5348648665121366, 'sideways_time_stop': 28, 'sideways_use_sma': False, 'sideways_use_ema': False, 'sideways_use_atr': True, 'sideways_use_adx': False, 'sideways_use_spike': False, 'sideways_rsi_required': False}.
[I 2025-08-30 20:57:23,584] Trial 77 finished with values: [-0.019846550413767594, 0.01977229256828729] and parameters: {'p_sma': 48, 'p_std': 30, 'p_atr': 23, 'p_adx': 14, 'rsi_period': 13, 'ema1': 5, 'ema2': 43, 'slip_atr_k': 0.07587911778622086, 'slip_spread_k': 0.7397754197536446, 'spread_hl_frac': 0.03376434913389281, 'bb_std_mult': 3.4715131997955346, 'rsi_os': 7, 'rsi_ob': 95, 'vol_spike': 0.022126882650573727, 'adx_thresh': 26.7862434304858, 'atr_min_pct': 0.012019188631210495, 'atr_max_pct': 0.06997047797156519, 'tp_mult': 1.8597641804281193, 'tsl_mult': 0.16426118858569969, 'strategy': 'mean_reversion', 'time_stop': 291, 'use_sma': False, 'use_atr': True, 'use_adx': True, 'use_ema': False, 'use_spike': True, 'rsi_required': True, 'edge_k': 0.818369159890102, 'edge_cap': 0.4525865113034447, 'bull_strategy': 'breakout', 'bull_bb_std_mult': 2.3341603238290896, 'bull_rsi_os': 37, 'bull_rsi_ob': 70, 'bull_adx_thresh': 7.648341406335348, 'bull_atr_min_pct': 0.0008294529526298981, 'bull_atr_max_pct': 0.05972340743372254, 'bull_tp_mult': 2.6909592424259685, 'bull_tsl_mult': 0.976862099358818, 'bull_time_stop': 116, 'bull_use_sma': True, 'bull_use_ema': True, 'bull_use_atr': False, 'bull_use_adx': True, 'bull_use_spike': False, 'bull_rsi_required': False, 'bear_strategy': 'mean_reversion', 'bear_bb_std_mult': 2.6196104989821185, 'bear_rsi_os': 46, 'bear_rsi_ob': 50, 'bear_adx_thresh': 23.460808840828598, 'bear_atr_min_pct': 0.02512796240190989, 'bear_atr_max_pct': 0.12623589177817193, 'bear_tp_mult': 2.290566059428125, 'bear_tsl_mult': 0.8788189362508855, 'bear_time_stop': 36, 'bear_use_sma': True, 'bear_use_ema': False, 'bear_use_atr': False, 'bear_use_adx': True, 'bear_use_spike': True, 'bear_rsi_required': False, 'sideways_strategy': 'breakout', 'sideways_bb_std_mult': 2.750542482433531, 'sideways_rsi_os': 44, 'sideways_rsi_ob': 95, 'sideways_adx_thresh': 28.952181993092033, 'sideways_atr_min_pct': 0.009609205314510982, 'sideways_atr_max_pct': 0.038885800807305575, 'sideways_tp_mult': 1.7613586053491612, 'sideways_tsl_mult': 0.5351361974957369, 'sideways_time_stop': 6, 'sideways_use_sma': False, 'sideways_use_ema': False, 'sideways_use_atr': True, 'sideways_use_adx': False, 'sideways_use_spike': False, 'sideways_rsi_required': False}.
[I 2025-08-30 20:57:23,888] Trial 80 finished with values: [-1000000000.0, 1000000000.0] and parameters: {'p_sma': 44, 'p_std': 25, 'p_atr': 23, 'p_adx': 15, 'rsi_period': 9, 'ema1': 9, 'ema2': 43, 'slip_atr_k': 0.08253940421072653, 'slip_spread_k': 0.7409322630822353, 'spread_hl_frac': 0.034721591766006664, 'bb_std_mult': 2.954324454043353, 'rsi_os': 7, 'rsi_ob': 95, 'vol_spike': 0.0242199568632094, 'adx_thresh': 26.77031279898391, 'atr_min_pct': 0.016172652455960196, 'atr_max_pct': 0.08107054833803645, 'tp_mult': 1.989844175753001, 'tsl_mult': 0.10821531559504365, 'strategy': 'breakout', 'time_stop': 50, 'use_sma': False, 'use_atr': True, 'use_adx': True, 'use_ema': True, 'use_spike': True, 'rsi_required': True, 'edge_k': 0.785175171192167, 'edge_cap': 0.47984444846319435, 'bull_strategy': 'breakout', 'bull_bb_std_mult': 2.347792751007015, 'bull_rsi_os': 28, 'bull_rsi_ob': 71, 'bull_adx_thresh': 9.762605306230013, 'bull_atr_min_pct': 0.007118215040525094, 'bull_atr_max_pct': 0.03352492977668349, 'bull_tp_mult': 2.537143730527538, 'bull_tsl_mult': 0.5076537926450417, 'bull_time_stop': 143, 'bull_use_sma': True, 'bull_use_ema': True, 'bull_use_atr': False, 'bull_use_adx': True, 'bull_use_spike': False, 'bull_rsi_required': False, 'bear_strategy': 'mean_reversion', 'bear_bb_std_mult': 2.5524067774387644, 'bear_rsi_os': 8, 'bear_rsi_ob': 56, 'bear_adx_thresh': 22.44535065846395, 'bear_atr_min_pct': 0.024865628681609128, 'bear_atr_max_pct': 0.12444145850826342, 'bear_tp_mult': 2.2848118020587878, 'bear_tsl_mult': 0.9229075166625057, 'bear_time_stop': 35, 'bear_use_sma': True, 'bear_use_ema': False, 'bear_use_atr': False, 'bear_use_adx': True, 'bear_use_spike': True, 'bear_rsi_required': False, 'sideways_strategy': 'breakout', 'sideways_bb_std_mult': 2.7557315440971095, 'sideways_rsi_os': 51, 'sideways_rsi_ob': 55, 'sideways_adx_thresh': 33.49639665482652, 'sideways_atr_min_pct': 0.008972404248826454, 'sideways_atr_max_pct': 0.04068339668541429, 'sideways_tp_mult': 2.240213869245835, 'sideways_tsl_mult': 0.522228485746952, 'sideways_time_stop': 26, 'sideways_use_sma': False, 'sideways_use_ema': True, 'sideways_use_atr': True, 'sideways_use_adx': False, 'sideways_use_spike': True, 'sideways_rsi_required': True}.
