[I 2025-08-30 21:41:27,458] Trial 423 finished with values: [-0.015247664585800513, 0.01514891881139579] and parameters: {'p_sma': 34, 'p_std': 36, 'p_atr': 21, 'p_adx': 21, 'rsi_period': 72, 'ema1': 11, 'ema2': 54, 'slip_atr_k': 0.026514982902426085, 'slip_spread_k': 0.6533450283924479, 'spread_hl_frac': 0.03310486260616494, 'bb_std_mult': 0.8034966254626033, 'rsi_os': 11, 'rsi_ob': 66, 'vol_spike': 0.28305942527660805, 'adx_thresh': 10.78753259801923, 'atr_min_pct': 0.013045340658432776, 'atr_max_pct': 0.020973780233025645, 'tp_mult': 1.671094667193252, 'tsl_mult': 0.8953760689344887, 'strategy': 'mean_reversion', 'time_stop': 89, 'use_sma': True, 'use_atr': True, 'use_adx': True, 'use_ema': True, 'use_spike': True, 'rsi_required': True, 'edge_k': 1.00436380611013, 'edge_cap': 0.8064236977056405, 'bull_strategy': 'breakout', 'bull_bb_std_mult': 1.9153534904374776, 'bull_rsi_os': 17, 'bull_rsi_ob': 87, 'bull_adx_thresh': 14.728364122329538, 'bull_atr_min_pct': 0.0011095480512976594, 'bull_atr_max_pct': 0.051557776045297404, 'bull_tp_mult': 1.398275997281154, 'bull_tsl_mult': 0.3963608825562474, 'bull_time_stop': 300, 'bull_use_sma': True, 'bull_use_ema': False, 'bull_use_atr': False, 'bull_use_adx': False, 'bull_use_spike': False, 'bull_rsi_required': True, 'bear_strategy': 'mean_reversion', 'bear_bb_std_mult': 1.9841868692137405, 'bear_rsi_os': 7, 'bear_rsi_ob': 73, 'bear_adx_thresh': 27.479574051510596, 'bear_atr_min_pct': 0.029973373656990862, 'bear_atr_max_pct': 0.11673593650828343, 'bear_tp_mult': 1.548881800833826, 'bear_tsl_mult': 0.3933650143313858, 'bear_time_stop': 236, 'bear_use_sma': False, 'bear_use_ema': True, 'bear_use_atr': False, 'bear_use_adx': True, 'bear_use_spike': True, 'bear_rsi_required': True, 'sideways_strategy': 'breakout', 'sideways_bb_std_mult': 1.707781914368215, 'sideways_rsi_os': 39, 'sideways_rsi_ob': 89, 'sideways_adx_thresh': 27.284710716800088, 'sideways_atr_min_pct': 0.02103849430358869, 'sideways_atr_max_pct': 0.04125159476464885, 'sideways_tp_mult': 1.8099473646320874, 'sideways_tsl_mult': 0.780010255462378, 'sideways_time_stop': 262, 'sideways_use_sma': False, 'sideways_use_ema': False, 'sideways_use_atr': False, 'sideways_use_adx': True, 'sideways_use_spike': False, 'sideways_rsi_required': False}.
[I 2025-08-30 21:41:28,292] Trial 424 finished with values: [-1000000000.0, 1000000000.0] and parameters: {'p_sma': 32, 'p_std': 5, 'p_atr': 28, 'p_adx': 23, 'rsi_period': 72, 'ema1': 28, 'ema2': 56, 'slip_atr_k': 0.027828622855773637, 'slip_spread_k': 0.2095135971844022, 'spread_hl_frac': 0.038055326702557304, 'bb_std_mult': 1.182303429517191, 'rsi_os': 12, 'rsi_ob': 74, 'vol_spike': 0.28714121776386076, 'adx_thresh': 12.244379963111246, 'atr_min_pct': 0.01310710269164904, 'atr_max_pct': 0.09669129095419693, 'tp_mult': 1.7638377197454742, 'tsl_mult': 0.8950658419210892, 'strategy': 'mean_reversion', 'time_stop': 130, 'use_sma': True, 'use_atr': True, 'use_adx': True, 'use_ema': True, 'use_spike': True, 'rsi_required': True, 'edge_k': 1.4444759772576365, 'edge_cap': 0.086598496274779, 'bull_strategy': 'breakout', 'bull_bb_std_mult': 0.9779387482810828, 'bull_rsi_os': 47, 'bull_rsi_ob': 95, 'bull_adx_thresh': 16.695266863554746, 'bull_atr_min_pct': 0.016104575931050653, 'bull_atr_max_pct': 0.010656969070145211, 'bull_tp_mult': 2.1531910517641935, 'bull_tsl_mult': 0.40452478029589256, 'bull_time_stop': 289, 'bull_use_sma': True, 'bull_use_ema': False, 'bull_use_atr': False, 'bull_use_adx': True, 'bull_use_spike': False, 'bull_rsi_required': True, 'bear_strategy': 'mean_reversion', 'bear_bb_std_mult': 0.920930211939083, 'bear_rsi_os': 35, 'bear_rsi_ob': 73, 'bear_adx_thresh': 5.861795143283393, 'bear_atr_min_pct': 0.02949505411245116, 'bear_atr_max_pct': 0.014902986436300985, 'bear_tp_mult': 1.408384378915077, 'bear_tsl_mult': 0.8235673770999146, 'bear_time_stop': 252, 'bear_use_sma': False, 'bear_use_ema': True, 'bear_use_atr': False, 'bear_use_adx': True, 'bear_use_spike': True, 'bear_rsi_required': True, 'sideways_strategy': 'breakout', 'sideways_bb_std_mult': 2.355494391206282, 'sideways_rsi_os': 41, 'sideways_rsi_ob': 89, 'sideways_adx_thresh': 27.32839683374333, 'sideways_atr_min_pct': 0.021447680942742825, 'sideways_atr_max_pct': 0.040882281372024744, 'sideways_tp_mult': 1.7894861094068144, 'sideways_tsl_mult': 0.8627247647922824, 'sideways_time_stop': 262, 'sideways_use_sma': False, 'sideways_use_ema': False, 'sideways_use_atr': False, 'sideways_use_adx': True, 'sideways_use_spike': False, 'sideways_rsi_required': False}.
[I 2025-08-30 21:42:00,950] Trial 425 finished with values: [-0.0206045505628748, 0.020619143808130527] and parameters: {'p_sma': 26, 'p_std': 23, 'p_atr': 22, 'p_adx': 23, 'rsi_period': 72, 'ema1': 11, 'ema2': 57, 'slip_atr_k': 0.026490388475870884, 'slip_spread_k': 0.6493493513225815, 'spread_hl_frac': 0.028028109578847535, 'bb_std_mult': 2.5331185187633274, 'rsi_os': 12, 'rsi_ob': 71, 'vol_spike': 0.28907656846378066, 'adx_thresh': 10.637384857957814, 'atr_min_pct': 0.012933544752393755, 'atr_max_pct': 0.059477090658629626, 'tp_mult': 1.0884094939733207, 'tsl_mult': 0.8970926530115727, 'strategy': 'mean_reversion', 'time_stop': 178, 'use_sma': True, 'use_atr': True, 'use_adx': True, 'use_ema': True, 'use_spike': True, 'rsi_required': True, 'edge_k': 1.389909065925908, 'edge_cap': 0.8045464544124517, 'bull_strategy': 'breakout', 'bull_bb_std_mult': 2.696014423092037, 'bull_rsi_os': 47, 'bull_rsi_ob': 87, 'bull_adx_thresh': 7.8844938646722085, 'bull_atr_min_pct': 0.0010454510106348396, 'bull_atr_max_pct': 0.04452000805669004, 'bull_tp_mult': 1.3939077096187247, 'bull_tsl_mult': 0.3632391111475223, 'bull_time_stop': 285, 'bull_use_sma': True, 'bull_use_ema': False, 'bull_use_atr': False, 'bull_use_adx': True, 'bull_use_spike': False, 'bull_rsi_required': True, 'bear_strategy': 'mean_reversion', 'bear_bb_std_mult': 2.2920383940897735, 'bear_rsi_os': 7, 'bear_rsi_ob': 72, 'bear_adx_thresh': 15.382832042577071, 'bear_atr_min_pct': 0.029320854840844658, 'bear_atr_max_pct': 0.015262558618728378, 'bear_tp_mult': 1.5602282186513186, 'bear_tsl_mult': 0.3993886136789151, 'bear_time_stop': 174, 'bear_use_sma': False, 'bear_use_ema': True, 'bear_use_atr': False, 'bear_use_adx': True, 'bear_use_spike': True, 'bear_rsi_required': True, 'sideways_strategy': 'mean_reversion', 'sideways_bb_std_mult': 2.326224899683838, 'sideways_rsi_os': 41, 'sideways_rsi_ob': 70, 'sideways_adx_thresh': 15.54391477676872, 'sideways_atr_min_pct': 0.028065692589070303, 'sideways_atr_max_pct': 0.1453922604012298, 'sideways_tp_mult': 1.8518616023343843, 'sideways_tsl_mult': 0.7651886190559813, 'sideways_time_stop': 261, 'sideways_use_sma': False, 'sideways_use_ema': False, 'sideways_use_atr': False, 'sideways_use_adx': True, 'sideways_use_spike': False, 'sideways_rsi_required': False}.
[I 2025-08-30 21:42:01,276] Trial 427 finished with values: [-1000000000.0, 1000000000.0] and parameters: {'p_sma': 36, 'p_std': 38, 'p_atr': 22, 'p_adx': 20, 'rsi_period': 72, 'ema1': 11, 'ema2': 57, 'slip_atr_k': 0.01052302751146016, 'slip_spread_k': 0.6735125604846509, 'spread_hl_frac': 0.033370653793929214, 'bb_std_mult': 0.8024680850597574, 'rsi_os': 15, 'rsi_ob': 66, 'vol_spike': 0.26651952200977946, 'adx_thresh': 8.89504869081956, 'atr_min_pct': 0.013085042465119257, 'atr_max_pct': 0.042712833012595264, 'tp_mult': 1.7574755405754765, 'tsl_mult': 0.914380132174287, 'strategy': 'mean_reversion', 'time_stop': 54, 'use_sma': True, 'use_atr': True, 'use_adx': True, 'use_ema': True, 'use_spike': True, 'rsi_required': True, 'edge_k': 0.91619744784615, 'edge_cap': 0.7791547610633961, 'bull_strategy': 'mean_reversion', 'bull_bb_std_mult': 1.9301329789474013, 'bull_rsi_os': 18, 'bull_rsi_ob': 87, 'bull_adx_thresh': 12.897570712275204, 'bull_atr_min_pct': 0.016110474329447358, 'bull_atr_max_pct': 0.05311549349660528, 'bull_tp_mult': 1.3988915521094059, 'bull_tsl_mult': 0.4224836861742843, 'bull_time_stop': 300, 'bull_use_sma': True, 'bull_use_ema': False, 'bull_use_atr': False, 'bull_use_adx': False, 'bull_use_spike': False, 'bull_rsi_required': False, 'bear_strategy': 'mean_reversion', 'bear_bb_std_mult': 2.076133467938681, 'bear_rsi_os': 7, 'bear_rsi_ob': 69, 'bear_adx_thresh': 27.642649681734127, 'bear_atr_min_pct': 0.029747968198066504, 'bear_atr_max_pct': 0.11370885090428712, 'bear_tp_mult': 1.5605464460773408, 'bear_tsl_mult': 0.9652179891484042, 'bear_time_stop': 236, 'bear_use_sma': False, 'bear_use_ema': True, 'bear_use_atr': False, 'bear_use_adx': True, 'bear_use_spike': True, 'bear_rsi_required': True, 'sideways_strategy': 'mean_reversion', 'sideways_bb_std_mult': 1.9401276751599208, 'sideways_rsi_os': 36, 'sideways_rsi_ob': 89, 'sideways_adx_thresh': 25.456343130138677, 'sideways_atr_min_pct': 0.022453819518607133, 'sideways_atr_max_pct': 0.04055693412845, 'sideways_tp_mult': 1.7223611736998519, 'sideways_tsl_mult': 0.8008178418615657, 'sideways_time_stop': 216, 'sideways_use_sma': False, 'sideways_use_ema': False, 'sideways_use_atr': False, 'sideways_use_adx': True, 'sideways_use_spike': False, 'sideways_rsi_required': False}.
[I 2025-08-30 21:42:01,441] Trial 426 finished with values: [-1000000000.0, 1000000000.0] and parameters: {'p_sma': 52, 'p_std': 32, 'p_atr': 22, 'p_adx': 23, 'rsi_period': 77, 'ema1': 11, 'ema2': 52, 'slip_atr_k': 0.02687746129855706, 'slip_spread_k': 0.9598184375209977, 'spread_hl_frac': 0.033468705850325194, 'bb_std_mult': 1.5561364618338593, 'rsi_os': 26, 'rsi_ob': 56, 'vol_spike': 0.28956683491380114, 'adx_thresh': 25.78573662518756, 'atr_min_pct': 0.013123303802004355, 'atr_max_pct': 0.057841675631182865, 'tp_mult': 1.666222790658779, 'tsl_mult': 0.8876756776695085, 'strategy': 'mean_reversion', 'time_stop': 130, 'use_sma': True, 'use_atr': True, 'use_adx': True, 'use_ema': True, 'use_spike': True, 'rsi_required': True, 'edge_k': 0.2969948820194176, 'edge_cap': 0.7907496269769816, 'bull_strategy': 'mean_reversion', 'bull_bb_std_mult': 2.888697373052428, 'bull_rsi_os': 13, 'bull_rsi_ob': 87, 'bull_adx_thresh': 26.85696836596874, 'bull_atr_min_pct': 0.003981485684528285, 'bull_atr_max_pct': 0.10010024335932247, 'bull_tp_mult': 2.3229711854185973, 'bull_tsl_mult': 0.9016101544296011, 'bull_time_stop': 99, 'bull_use_sma': True, 'bull_use_ema': False, 'bull_use_atr': False, 'bull_use_adx': True, 'bull_use_spike': False, 'bull_rsi_required': True, 'bear_strategy': 'mean_reversion', 'bear_bb_std_mult': 2.7400128131381987, 'bear_rsi_os': 36, 'bear_rsi_ob': 73, 'bear_adx_thresh': 24.725639879596034, 'bear_atr_min_pct': 0.02997445708052774, 'bear_atr_max_pct': 0.06074803244443942, 'bear_tp_mult': 1.5453713470069115, 'bear_tsl_mult': 0.8820171854465642, 'bear_time_stop': 173, 'bear_use_sma': False, 'bear_use_ema': True, 'bear_use_atr': False, 'bear_use_adx': True, 'bear_use_spike': True, 'bear_rsi_required': True, 'sideways_strategy': 'mean_reversion', 'sideways_bb_std_mult': 1.940424184680375, 'sideways_rsi_os': 40, 'sideways_rsi_ob': 83, 'sideways_adx_thresh': 27.571525710318458, 'sideways_atr_min_pct': 0.006034299542717551, 'sideways_atr_max_pct': 0.14514237843725183, 'sideways_tp_mult': 1.9641304824825445, 'sideways_tsl_mult': 0.05800719913659119, 'sideways_time_stop': 261, 'sideways_use_sma': False, 'sideways_use_ema': False, 'sideways_use_atr': False, 'sideways_use_adx': True, 'sideways_use_spike': False, 'sideways_rsi_required': False}.
[I 2025-08-30 21:42:01,545] Trial 428 finished with values: [-1000000000.0, 1000000000.0] and parameters: {'p_sma': 39, 'p_std': 39, 'p_atr': 22, 'p_adx': 21, 'rsi_period': 73, 'ema1': 11, 'ema2': 57, 'slip_atr_k': 0.00973155304549557, 'slip_spread_k': 0.6643471095194536, 'spread_hl_frac': 0.03339631334358349, 'bb_std_mult': 0.7828868289978864, 'rsi_os': 17, 'rsi_ob': 66, 'vol_spike': 0.26809447189777613, 'adx_thresh': 5.945660442749588, 'atr_min_pct': 0.013190566532273278, 'atr_max_pct': 0.04034234413012169, 'tp_mult': 1.796733016870992, 'tsl_mult': 0.9130551514299211, 'strategy': 'mean_reversion', 'time_stop': 56, 'use_sma': True, 'use_atr': True, 'use_adx': True, 'use_ema': True, 'use_spike': True, 'rsi_required': True, 'edge_k': 0.9493855102686934, 'edge_cap': 0.7929122756854001, 'bull_strategy': 'mean_reversion', 'bull_bb_std_mult': 1.928602890906515, 'bull_rsi_os': 18, 'bull_rsi_ob': 87, 'bull_adx_thresh': 12.706975296023298, 'bull_atr_min_pct': 0.003867718574791173, 'bull_atr_max_pct': 0.0525421626548714, 'bull_tp_mult': 1.4102677207902012, 'bull_tsl_mult': 0.41937319261227085, 'bull_time_stop': 297, 'bull_use_sma': True, 'bull_use_ema': False, 'bull_use_atr': False, 'bull_use_adx': False, 'bull_use_spike': False, 'bull_rsi_required': False, 'bear_strategy': 'mean_reversion', 'bear_bb_std_mult': 1.9522085432447862, 'bear_rsi_os': 7, 'bear_rsi_ob': 69, 'bear_adx_thresh': 27.50240567324985, 'bear_atr_min_pct': 0.02998750666389263, 'bear_atr_max_pct': 0.11827953643607737, 'bear_tp_mult': 1.551920318188715, 'bear_tsl_mult': 0.596580055261796, 'bear_time_stop': 234, 'bear_use_sma': False, 'bear_use_ema': True, 'bear_use_atr': False, 'bear_use_adx': True, 'bear_use_spike': True, 'bear_rsi_required': True, 'sideways_strategy': 'mean_reversion', 'sideways_bb_std_mult': 1.768078101080483, 'sideways_rsi_os': 36, 'sideways_rsi_ob': 90, 'sideways_adx_thresh': 25.444405461922436, 'sideways_atr_min_pct': 0.02256134838341165, 'sideways_atr_max_pct': 0.03958146020429623, 'sideways_tp_mult': 1.7130577802994431, 'sideways_tsl_mult': 0.7986389304296597, 'sideways_time_stop': 216, 'sideways_use_sma': False, 'sideways_use_ema': False, 'sideways_use_atr': False, 'sideways_use_adx': True, 'sideways_use_spike': False, 'sideways_rsi_required': False}.
[I 2025-08-30 21:42:02,365] Trial 430 finished with values: [-1000000000.0, 1000000000.0] and parameters: {'p_sma': 39, 'p_std': 39, 'p_atr': 21, 'p_adx': 21, 'rsi_period': 72, 'ema1': 11, 'ema2': 56, 'slip_atr_k': 0.020744882289319547, 'slip_spread_k': 0.6561932034008942, 'spread_hl_frac': 0.03350196940641115, 'bb_std_mult': 0.8290567381135915, 'rsi_os': 13, 'rsi_ob': 51, 'vol_spike': 0.2703650066641719, 'adx_thresh': 10.830407247526198, 'atr_min_pct': 0.013422891104441979, 'atr_max_pct': 0.013032064454199785, 'tp_mult': 1.8036547947942676, 'tsl_mult': 0.9184161268142554, 'strategy': 'mean_reversion', 'time_stop': 47, 'use_sma': True, 'use_atr': True, 'use_adx': True, 'use_ema': False, 'use_spike': True, 'rsi_required': True, 'edge_k': 0.9964927659885139, 'edge_cap': 0.8097229255775433, 'bull_strategy': 'mean_reversion', 'bull_bb_std_mult': 1.8566491949957011, 'bull_rsi_os': 19, 'bull_rsi_ob': 87, 'bull_adx_thresh': 14.543088108599882, 'bull_atr_min_pct': 0.0007517030573968997, 'bull_atr_max_pct': 0.05281369019898064, 'bull_tp_mult': 1.3515588569424806, 'bull_tsl_mult': 0.4235743237927916, 'bull_time_stop': 298, 'bull_use_sma': False, 'bull_use_ema': False, 'bull_use_atr': False, 'bull_use_adx': False, 'bull_use_spike': False, 'bull_rsi_required': True, 'bear_strategy': 'mean_reversion', 'bear_bb_std_mult': 1.9859030549703818, 'bear_rsi_os': 6, 'bear_rsi_ob': 70, 'bear_adx_thresh': 27.665467150918587, 'bear_atr_min_pct': 0.029757247536488354, 'bear_atr_max_pct': 0.11808826579518772, 'bear_tp_mult': 1.5515923008080137, 'bear_tsl_mult': 0.3814603526648517, 'bear_time_stop': 262, 'bear_use_sma': False, 'bear_use_ema': True, 'bear_use_atr': False, 'bear_use_adx': True, 'bear_use_spike': True, 'bear_rsi_required': True, 'sideways_strategy': 'breakout', 'sideways_bb_std_mult': 3.366953399760013, 'sideways_rsi_os': 37, 'sideways_rsi_ob': 90, 'sideways_adx_thresh': 26.58477839237986, 'sideways_atr_min_pct': 0.021038180845364404, 'sideways_atr_max_pct': 0.03713279500452981, 'sideways_tp_mult': 1.793075519610446, 'sideways_tsl_mult': 0.7847099100705633, 'sideways_time_stop': 255, 'sideways_use_sma': False, 'sideways_use_ema': False, 'sideways_use_atr': False, 'sideways_use_adx': True, 'sideways_use_spike': False, 'sideways_rsi_required': False}.
[I 2025-08-30 21:42:35,958] Trial 429 finished with values: [-1000000000.0, 1000000000.0] and parameters: {'p_sma': 35, 'p_std': 38, 'p_atr': 21, 'p_adx': 21, 'rsi_period': 72, 'ema1': 11, 'ema2': 57, 'slip_atr_k': 0.010309503569737814, 'slip_spread_k': 0.6633795116940372, 'spread_hl_frac': 0.03341206101123455, 'bb_std_mult': 0.7802258897830663, 'rsi_os': 14, 'rsi_ob': 62, 'vol_spike': 0.2729816648973805, 'adx_thresh': 11.002022217298878, 'atr_min_pct': 0.013270191771279577, 'atr_max_pct': 0.038951901663585205, 'tp_mult': 1.8024457699639254, 'tsl_mult': 0.9186600319545593, 'strategy': 'mean_reversion', 'time_stop': 56, 'use_sma': True, 'use_atr': True, 'use_adx': True, 'use_ema': False, 'use_spike': True, 'rsi_required': True, 'edge_k': 0.9881960226486585, 'edge_cap': 0.7994959673620848, 'bull_strategy': 'mean_reversion', 'bull_bb_std_mult': 1.9336508771616951, 'bull_rsi_os': 18, 'bull_rsi_ob': 85, 'bull_adx_thresh': 26.63916518099908, 'bull_atr_min_pct': 0.012096395608824868, 'bull_atr_max_pct': 0.05263318607747929, 'bull_tp_mult': 1.412880734945207, 'bull_tsl_mult': 0.41082654574756605, 'bull_time_stop': 300, 'bull_use_sma': True, 'bull_use_ema': False, 'bull_use_atr': False, 'bull_use_adx': False, 'bull_use_spike': False, 'bull_rsi_required': True, 'bear_strategy': 'mean_reversion', 'bear_bb_std_mult': 2.1003942398988493, 'bear_rsi_os': 7, 'bear_rsi_ob': 70, 'bear_adx_thresh': 27.624004446519784, 'bear_atr_min_pct': 0.029910872403274058, 'bear_atr_max_pct': 0.11452142100242992, 'bear_tp_mult': 1.5619755290517308, 'bear_tsl_mult': 0.391075520098915, 'bear_time_stop': 238, 'bear_use_sma': False, 'bear_use_ema': True, 'bear_use_atr': False, 'bear_use_adx': True, 'bear_use_spike': True, 'bear_rsi_required': True, 'sideways_strategy': 'mean_reversion', 'sideways_bb_std_mult': 1.8128659466777963, 'sideways_rsi_os': 37, 'sideways_rsi_ob': 90, 'sideways_adx_thresh': 25.70449753490563, 'sideways_atr_min_pct': 0.023176868530508665, 'sideways_atr_max_pct': 0.038485311562780206, 'sideways_tp_mult': 1.8369337533922034, 'sideways_tsl_mult': 0.7962196485212727, 'sideways_time_stop': 221, 'sideways_use_sma': False, 'sideways_use_ema': False, 'sideways_use_atr': False, 'sideways_use_adx': True, 'sideways_use_spike': False, 'sideways_rsi_required': False}.
[I 2025-08-30 21:42:36,541] Trial 432 finished with values: [-1000000000.0, 1000000000.0] and parameters: {'p_sma': 34, 'p_std': 38, 'p_atr': 21, 'p_adx': 21, 'rsi_period': 72, 'ema1': 10, 'ema2': 55, 'slip_atr_k': 0.02044601221475828, 'slip_spread_k': 0.6513642910955108, 'spread_hl_frac': 0.0345906027790108, 'bb_std_mult': 0.8684684491947385, 'rsi_os': 14, 'rsi_ob': 62, 'vol_spike': 0.27182197949261544, 'adx_thresh': 10.749259537496647, 'atr_min_pct': 0.013784963079015345, 'atr_max_pct': 0.034785852990770944, 'tp_mult': 1.7633895866578468, 'tsl_mult': 0.93280175879826, 'strategy': 'mean_reversion', 'time_stop': 60, 'use_sma': True, 'use_atr': False, 'use_adx': True, 'use_ema': False, 'use_spike': True, 'rsi_required': True, 'edge_k': 1.0197205037298858, 'edge_cap': 0.763078846620007, 'bull_strategy': 'breakout', 'bull_bb_std_mult': 1.8736049930404806, 'bull_rsi_os': 19, 'bull_rsi_ob': 85, 'bull_adx_thresh': 22.250313519554577, 'bull_atr_min_pct': 0.01141234515245004, 'bull_atr_max_pct': 0.05322989648974182, 'bull_tp_mult': 1.3548509995788245, 'bull_tsl_mult': 0.407472950896891, 'bull_time_stop': 299, 'bull_use_sma': False, 'bull_use_ema': False, 'bull_use_atr': False, 'bull_use_adx': False, 'bull_use_spike': False, 'bull_rsi_required': True, 'bear_strategy': 'mean_reversion', 'bear_bb_std_mult': 2.249013398352548, 'bear_rsi_os': 6, 'bear_rsi_ob': 70, 'bear_adx_thresh': 26.84181346223832, 'bear_atr_min_pct': 0.029770207363868675, 'bear_atr_max_pct': 0.11158363811205589, 'bear_tp_mult': 1.5171097573663288, 'bear_tsl_mult': 0.3913443087858324, 'bear_time_stop': 241, 'bear_use_sma': False, 'bear_use_ema': True, 'bear_use_atr': False, 'bear_use_adx': True, 'bear_use_spike': True, 'bear_rsi_required': True, 'sideways_strategy': 'breakout', 'sideways_bb_std_mult': 1.8332907725634024, 'sideways_rsi_os': 35, 'sideways_rsi_ob': 90, 'sideways_adx_thresh': 26.13742234624598, 'sideways_atr_min_pct': 0.021030634372632764, 'sideways_atr_max_pct': 0.0458967634131508, 'sideways_tp_mult': 1.787302035144286, 'sideways_tsl_mult': 0.7847118106331136, 'sideways_time_stop': 255, 'sideways_use_sma': False, 'sideways_use_ema': False, 'sideways_use_atr': False, 'sideways_use_adx': True, 'sideways_use_spike': False, 'sideways_rsi_required': False}.
