[I 2025-08-30 21:10:37,134] Trial 186 finished with values: [-1000000000.0, 1000000000.0] and parameters: {'p_sma': 27, 'p_std': 49, 'p_atr': 15, 'p_adx': 29, 'rsi_period': 20, 'ema1': 9, 'ema2': 43, 'slip_atr_k': 0.03219324634795347, 'slip_spread_k': 0.25976305364690866, 'spread_hl_frac': 0.001890737566236412, 'bb_std_mult': 2.310901946479642, 'rsi_os': 42, 'rsi_ob': 82, 'vol_spike': 0.2832257825988457, 'adx_thresh': 25.11279760846093, 'atr_min_pct': 0.024040889187436243, 'atr_max_pct': 0.08425970368875951, 'tp_mult': 2.2085456385559796, 'tsl_mult': 0.8388105429553666, 'strategy': 'mean_reversion', 'time_stop': 215, 'use_sma': False, 'use_atr': True, 'use_adx': True, 'use_ema': True, 'use_spike': True, 'rsi_required': True, 'edge_k': 0.7020458570462685, 'edge_cap': 0.5906495925482035, 'bull_strategy': 'breakout', 'bull_bb_std_mult': 0.5133608438176389, 'bull_rsi_os': 36, 'bull_rsi_ob': 76, 'bull_adx_thresh': 13.91526932327942, 'bull_atr_min_pct': 0.00052851577460523, 'bull_atr_max_pct': 0.05012202286832852, 'bull_tp_mult': 1.623727369591014, 'bull_tsl_mult': 0.36403510319373467, 'bull_time_stop': 20, 'bull_use_sma': True, 'bull_use_ema': False, 'bull_use_atr': False, 'bull_use_adx': True, 'bull_use_spike': False, 'bull_rsi_required': True, 'bear_strategy': 'mean_reversion', 'bear_bb_std_mult': 2.6956652148346216, 'bear_rsi_os': 50, 'bear_rsi_ob': 53, 'bear_adx_thresh': 23.498304743135858, 'bear_atr_min_pct': 0.017485034201072055, 'bear_atr_max_pct': 0.0914366361045211, 'bear_tp_mult': 2.9729834533332453, 'bear_tsl_mult': 0.47076799195189745, 'bear_time_stop': 116, 'bear_use_sma': True, 'bear_use_ema': False, 'bear_use_atr': False, 'bear_use_adx': False, 'bear_use_spike': True, 'bear_rsi_required': True, 'sideways_strategy': 'breakout', 'sideways_bb_std_mult': 0.5220989587198064, 'sideways_rsi_os': 36, 'sideways_rsi_ob': 63, 'sideways_adx_thresh': 32.31717763858698, 'sideways_atr_min_pct': 0.006883561637909527, 'sideways_atr_max_pct': 0.010231793048209462, 'sideways_tp_mult': 1.8226243503689241, 'sideways_tsl_mult': 0.3053927314018107, 'sideways_time_stop': 160, 'sideways_use_sma': False, 'sideways_use_ema': False, 'sideways_use_atr': True, 'sideways_use_adx': False, 'sideways_use_spike': False, 'sideways_rsi_required': False}.
[I 2025-08-30 21:10:37,619] Trial 190 finished with values: [-1000000000.0, 1000000000.0] and parameters: {'p_sma': 20, 'p_std': 29, 'p_atr': 15, 'p_adx': 28, 'rsi_period': 44, 'ema1': 9, 'ema2': 42, 'slip_atr_k': 0.03047652042261842, 'slip_spread_k': 0.7656626420859755, 'spread_hl_frac': 0.01069462714266535, 'bb_std_mult': 1.7428724587175128, 'rsi_os': 6, 'rsi_ob': 82, 'vol_spike': 0.0633806737610057, 'adx_thresh': 34.03438983687904, 'atr_min_pct': 0.00805971988212669, 'atr_max_pct': 0.048915029331261774, 'tp_mult': 1.5600764343933031, 'tsl_mult': 0.2441950375266696, 'strategy': 'mean_reversion', 'time_stop': 163, 'use_sma': False, 'use_atr': True, 'use_adx': True, 'use_ema': False, 'use_spike': True, 'rsi_required': True, 'edge_k': 0.7882816054457751, 'edge_cap': 0.14202860062598827, 'bull_strategy': 'breakout', 'bull_bb_std_mult': 3.3906724405139728, 'bull_rsi_os': 36, 'bull_rsi_ob': 70, 'bull_adx_thresh': 13.680674303465299, 'bull_atr_min_pct': 0.007808134101502664, 'bull_atr_max_pct': 0.06395712857150682, 'bull_tp_mult': 2.5278908833617315, 'bull_tsl_mult': 0.14419722101372817, 'bull_time_stop': 300, 'bull_use_sma': True, 'bull_use_ema': False, 'bull_use_atr': False, 'bull_use_adx': True, 'bull_use_spike': False, 'bull_rsi_required': True, 'bear_strategy': 'mean_reversion', 'bear_bb_std_mult': 2.619579012378875, 'bear_rsi_os': 26, 'bear_rsi_ob': 52, 'bear_adx_thresh': 17.38468694020104, 'bear_atr_min_pct': 0.016967701677174204, 'bear_atr_max_pct': 0.0898076331868416, 'bear_tp_mult': 1.6682816025658398, 'bear_tsl_mult': 0.2633126994957924, 'bear_time_stop': 199, 'bear_use_sma': True, 'bear_use_ema': True, 'bear_use_atr': False, 'bear_use_adx': False, 'bear_use_spike': True, 'bear_rsi_required': True, 'sideways_strategy': 'breakout', 'sideways_bb_std_mult': 0.5390158508540659, 'sideways_rsi_os': 41, 'sideways_rsi_ob': 64, 'sideways_adx_thresh': 32.573644395450856, 'sideways_atr_min_pct': 0.006923967752192414, 'sideways_atr_max_pct': 0.014285395844577452, 'sideways_tp_mult': 2.20004495985701, 'sideways_tsl_mult': 0.9707438993118525, 'sideways_time_stop': 162, 'sideways_use_sma': False, 'sideways_use_ema': False, 'sideways_use_atr': False, 'sideways_use_adx': True, 'sideways_use_spike': False, 'sideways_rsi_required': False}.
[I 2025-08-30 21:10:38,038] Trial 192 finished with values: [-1000000000.0, 1000000000.0] and parameters: {'p_sma': 25, 'p_std': 56, 'p_atr': 15, 'p_adx': 28, 'rsi_period': 79, 'ema1': 26, 'ema2': 40, 'slip_atr_k': 0.044301844715436745, 'slip_spread_k': 0.7614681513937206, 'spread_hl_frac': 0.04707519735302954, 'bb_std_mult': 1.608043533961267, 'rsi_os': 50, 'rsi_ob': 88, 'vol_spike': 0.26888790736441476, 'adx_thresh': 21.32899383225218, 'atr_min_pct': 0.01137887759889064, 'atr_max_pct': 0.10683344055555659, 'tp_mult': 2.4658333078493886, 'tsl_mult': 0.8027405461980369, 'strategy': 'mean_reversion', 'time_stop': 201, 'use_sma': False, 'use_atr': True, 'use_adx': True, 'use_ema': True, 'use_spike': True, 'rsi_required': True, 'edge_k': 0.6042460139914373, 'edge_cap': 0.5190346989734589, 'bull_strategy': 'breakout', 'bull_bb_std_mult': 3.4268039253799603, 'bull_rsi_os': 31, 'bull_rsi_ob': 68, 'bull_adx_thresh': 14.906637130513575, 'bull_atr_min_pct': 0.002447253340660807, 'bull_atr_max_pct': 0.044918649464751916, 'bull_tp_mult': 1.0190501346522092, 'bull_tsl_mult': 0.3008393720204854, 'bull_time_stop': 300, 'bull_use_sma': True, 'bull_use_ema': False, 'bull_use_atr': False, 'bull_use_adx': True, 'bull_use_spike': True, 'bull_rsi_required': True, 'bear_strategy': 'mean_reversion', 'bear_bb_std_mult': 2.617663382087364, 'bear_rsi_os': 26, 'bear_rsi_ob': 51, 'bear_adx_thresh': 10.39712121442479, 'bear_atr_min_pct': 0.02685136597380189, 'bear_atr_max_pct': 0.12694273880381693, 'bear_tp_mult': 2.8883204670831106, 'bear_tsl_mult': 0.2374410038201501, 'bear_time_stop': 242, 'bear_use_sma': True, 'bear_use_ema': True, 'bear_use_atr': False, 'bear_use_adx': True, 'bear_use_spike': True, 'bear_rsi_required': True, 'sideways_strategy': 'breakout', 'sideways_bb_std_mult': 2.8325213696985405, 'sideways_rsi_os': 38, 'sideways_rsi_ob': 84, 'sideways_adx_thresh': 34.032062525382564, 'sideways_atr_min_pct': 0.00758920901307231, 'sideways_atr_max_pct': 0.09537978466594663, 'sideways_tp_mult': 2.9497312403706015, 'sideways_tsl_mult': 0.17196237805207404, 'sideways_time_stop': 148, 'sideways_use_sma': False, 'sideways_use_ema': True, 'sideways_use_atr': True, 'sideways_use_adx': False, 'sideways_use_spike': False, 'sideways_rsi_required': True}.
[I 2025-08-30 21:11:11,663] Trial 191 finished with values: [-1000000000.0, 1000000000.0] and parameters: {'p_sma': 20, 'p_std': 33, 'p_atr': 15, 'p_adx': 14, 'rsi_period': 73, 'ema1': 9, 'ema2': 53, 'slip_atr_k': 0.03520897265592301, 'slip_spread_k': 0.7696044726651037, 'spread_hl_frac': 0.008736003097575832, 'bb_std_mult': 1.5977208454245664, 'rsi_os': 14, 'rsi_ob': 56, 'vol_spike': 0.26915655911075426, 'adx_thresh': 34.26040030486848, 'atr_min_pct': 3.4428753268360424e-05, 'atr_max_pct': 0.07988769868147683, 'tp_mult': 1.5487037374891655, 'tsl_mult': 0.8058229478447774, 'strategy': 'mean_reversion', 'time_stop': 250, 'use_sma': False, 'use_atr': True, 'use_adx': True, 'use_ema': True, 'use_spike': True, 'rsi_required': True, 'edge_k': 0.9157193466677529, 'edge_cap': 0.9230892866030268, 'bull_strategy': 'breakout', 'bull_bb_std_mult': 3.382092179690463, 'bull_rsi_os': 36, 'bull_rsi_ob': 61, 'bull_adx_thresh': 14.855691583391623, 'bull_atr_min_pct': 0.0021451705547995328, 'bull_atr_max_pct': 0.13167695468312382, 'bull_tp_mult': 1.0682921661293505, 'bull_tsl_mult': 0.35775948850621353, 'bull_time_stop': 295, 'bull_use_sma': True, 'bull_use_ema': False, 'bull_use_atr': False, 'bull_use_adx': True, 'bull_use_spike': True, 'bull_rsi_required': True, 'bear_strategy': 'mean_reversion', 'bear_bb_std_mult': 2.615821335203399, 'bear_rsi_os': 49, 'bear_rsi_ob': 71, 'bear_adx_thresh': 10.805322728057112, 'bear_atr_min_pct': 0.011520935186884797, 'bear_atr_max_pct': 0.09130051283726741, 'bear_tp_mult': 2.8843276419936252, 'bear_tsl_mult': 0.2418214247754979, 'bear_time_stop': 143, 'bear_use_sma': True, 'bear_use_ema': True, 'bear_use_atr': False, 'bear_use_adx': True, 'bear_use_spike': True, 'bear_rsi_required': True, 'sideways_strategy': 'breakout', 'sideways_bb_std_mult': 2.8268742648969116, 'sideways_rsi_os': 9, 'sideways_rsi_ob': 66, 'sideways_adx_thresh': 16.431299821323357, 'sideways_atr_min_pct': 0.010144716766543032, 'sideways_atr_max_pct': 0.014972692640265243, 'sideways_tp_mult': 1.8056737243632037, 'sideways_tsl_mult': 0.025972106134170447, 'sideways_time_stop': 137, 'sideways_use_sma': False, 'sideways_use_ema': True, 'sideways_use_atr': True, 'sideways_use_adx': False, 'sideways_use_spike': False, 'sideways_rsi_required': True}.
[I 2025-08-30 21:11:11,871] Trial 193 finished with values: [-1000000000.0, 1000000000.0] and parameters: {'p_sma': 21, 'p_std': 29, 'p_atr': 30, 'p_adx': 28, 'rsi_period': 79, 'ema1': 19, 'ema2': 13, 'slip_atr_k': 0.15547535337673593, 'slip_spread_k': 0.7694982106606013, 'spread_hl_frac': 0.008711172604708894, 'bb_std_mult': 1.7418684403615312, 'rsi_os': 6, 'rsi_ob': 56, 'vol_spike': 0.1221094610052792, 'adx_thresh': 21.706299552879475, 'atr_min_pct': 0.029282769327892873, 'atr_max_pct': 0.0796676572732333, 'tp_mult': 1.5505998045164913, 'tsl_mult': 0.7872339807682014, 'strategy': 'mean_reversion', 'time_stop': 126, 'use_sma': False, 'use_atr': True, 'use_adx': True, 'use_ema': True, 'use_spike': True, 'rsi_required': True, 'edge_k': 1.2087611526856574, 'edge_cap': 0.5294990102497545, 'bull_strategy': 'breakout', 'bull_bb_std_mult': 3.3928868808625925, 'bull_rsi_os': 31, 'bull_rsi_ob': 78, 'bull_adx_thresh': 14.756378215286622, 'bull_atr_min_pct': 0.002318561359689733, 'bull_atr_max_pct': 0.13155677331081855, 'bull_tp_mult': 2.566639954245026, 'bull_tsl_mult': 0.7814137811654336, 'bull_time_stop': 300, 'bull_use_sma': True, 'bull_use_ema': False, 'bull_use_atr': False, 'bull_use_adx': True, 'bull_use_spike': True, 'bull_rsi_required': True, 'bear_strategy': 'mean_reversion', 'bear_bb_std_mult': 2.3826163772701783, 'bear_rsi_os': 26, 'bear_rsi_ob': 51, 'bear_adx_thresh': 10.372221243810294, 'bear_atr_min_pct': 0.026972946647895756, 'bear_atr_max_pct': 0.12679162663156043, 'bear_tp_mult': 2.878425271625441, 'bear_tsl_mult': 0.39612318091503507, 'bear_time_stop': 44, 'bear_use_sma': True, 'bear_use_ema': True, 'bear_use_atr': False, 'bear_use_adx': True, 'bear_use_spike': True, 'bear_rsi_required': True, 'sideways_strategy': 'breakout', 'sideways_bb_std_mult': 0.7172173241040507, 'sideways_rsi_os': 41, 'sideways_rsi_ob': 85, 'sideways_adx_thresh': 16.587402017437874, 'sideways_atr_min_pct': 0.007640496090639769, 'sideways_atr_max_pct': 0.015465490685174742, 'sideways_tp_mult': 2.4988963019043346, 'sideways_tsl_mult': 0.35824964582197927, 'sideways_time_stop': 148, 'sideways_use_sma': False, 'sideways_use_ema': True, 'sideways_use_atr': True, 'sideways_use_adx': False, 'sideways_use_spike': False, 'sideways_rsi_required': True}.
[I 2025-08-30 21:11:12,472] Trial 194 finished with values: [-1000000000.0, 1000000000.0] and parameters: {'p_sma': 22, 'p_std': 32, 'p_atr': 17, 'p_adx': 29, 'rsi_period': 17, 'ema1': 26, 'ema2': 53, 'slip_atr_k': 0.03949189704451595, 'slip_spread_k': 0.7940531549436451, 'spread_hl_frac': 0.008737481141341465, 'bb_std_mult': 0.7206037480108587, 'rsi_os': 49, 'rsi_ob': 93, 'vol_spike': 0.2923259245975073, 'adx_thresh': 21.362924415277472, 'atr_min_pct': 0.0005988877115853247, 'atr_max_pct': 0.0947103338868903, 'tp_mult': 2.0360184775510084, 'tsl_mult': 0.7879911560295485, 'strategy': 'mean_reversion', 'time_stop': 151, 'use_sma': False, 'use_atr': True, 'use_adx': True, 'use_ema': True, 'use_spike': True, 'rsi_required': True, 'edge_k': 0.6160915776434294, 'edge_cap': 0.5262299834142696, 'bull_strategy': 'breakout', 'bull_bb_std_mult': 3.436407132715828, 'bull_rsi_os': 19, 'bull_rsi_ob': 69, 'bull_adx_thresh': 14.745350490493738, 'bull_atr_min_pct': 0.024039928324089695, 'bull_atr_max_pct': 0.04539827653398096, 'bull_tp_mult': 2.9556079444723804, 'bull_tsl_mult': 0.29585610819408137, 'bull_time_stop': 295, 'bull_use_sma': True, 'bull_use_ema': False, 'bull_use_atr': False, 'bull_use_adx': True, 'bull_use_spike': True, 'bull_rsi_required': True, 'bear_strategy': 'mean_reversion', 'bear_bb_std_mult': 2.6280268230422568, 'bear_rsi_os': 48, 'bear_rsi_ob': 51, 'bear_adx_thresh': 10.302336632615939, 'bear_atr_min_pct': 0.018011280814542563, 'bear_atr_max_pct': 0.03301875141469633, 'bear_tp_mult': 2.880374935837678, 'bear_tsl_mult': 0.7152543027147016, 'bear_time_stop': 100, 'bear_use_sma': True, 'bear_use_ema': True, 'bear_use_atr': False, 'bear_use_adx': True, 'bear_use_spike': True, 'bear_rsi_required': True, 'sideways_strategy': 'breakout', 'sideways_bb_std_mult': 2.801333273359269, 'sideways_rsi_os': 45, 'sideways_rsi_ob': 66, 'sideways_adx_thresh': 16.659500779697872, 'sideways_atr_min_pct': 0.005101927964728772, 'sideways_atr_max_pct': 0.015570595812907541, 'sideways_tp_mult': 1.070036787369451, 'sideways_tsl_mult': 0.3581638160723155, 'sideways_time_stop': 136, 'sideways_use_sma': False, 'sideways_use_ema': True, 'sideways_use_atr': True, 'sideways_use_adx': False, 'sideways_use_spike': False, 'sideways_rsi_required': True}.
[I 2025-08-30 21:11:13,431] Trial 195 finished with values: [-1000000000.0, 1000000000.0] and parameters: {'p_sma': 18, 'p_std': 33, 'p_atr': 13, 'p_adx': 29, 'rsi_period': 84, 'ema1': 28, 'ema2': 29, 'slip_atr_k': 0.03546757579170078, 'slip_spread_k': 0.7865515463782792, 'spread_hl_frac': 0.00894827172347961, 'bb_std_mult': 1.496754728682619, 'rsi_os': 20, 'rsi_ob': 76, 'vol_spike': 0.08880630080801281, 'adx_thresh': 21.8273178314246, 'atr_min_pct': 0.0005231275378857616, 'atr_max_pct': 0.09467807113344348, 'tp_mult': 1.7493799753512687, 'tsl_mult': 0.7867983438798102, 'strategy': 'mean_reversion', 'time_stop': 257, 'use_sma': False, 'use_atr': False, 'use_adx': True, 'use_ema': True, 'use_spike': True, 'rsi_required': True, 'edge_k': 0.5598196621641152, 'edge_cap': 0.5308269101604486, 'bull_strategy': 'breakout', 'bull_bb_std_mult': 0.8897806808917124, 'bull_rsi_os': 16, 'bull_rsi_ob': 69, 'bull_adx_thresh': 14.399196819745557, 'bull_atr_min_pct': 0.001405011278816226, 'bull_atr_max_pct': 0.0575905759707455, 'bull_tp_mult': 1.1969231669616973, 'bull_tsl_mult': 0.10399033536463335, 'bull_time_stop': 295, 'bull_use_sma': True, 'bull_use_ema': False, 'bull_use_atr': False, 'bull_use_adx': True, 'bull_use_spike': True, 'bull_rsi_required': True, 'bear_strategy': 'mean_reversion', 'bear_bb_std_mult': 2.9141415883663, 'bear_rsi_os': 46, 'bear_rsi_ob': 82, 'bear_adx_thresh': 25.66122144773409, 'bear_atr_min_pct': 0.024204686367273957, 'bear_atr_max_pct': 0.017188970160266555, 'bear_tp_mult': 2.993468317306786, 'bear_tsl_mult': 0.8924343549614886, 'bear_time_stop': 97, 'bear_use_sma': True, 'bear_use_ema': False, 'bear_use_atr': False, 'bear_use_adx': True, 'bear_use_spike': True, 'bear_rsi_required': True, 'sideways_strategy': 'breakout', 'sideways_bb_std_mult': 2.5582235635165396, 'sideways_rsi_os': 9, 'sideways_rsi_ob': 66, 'sideways_adx_thresh': 16.662320747799008, 'sideways_atr_min_pct': 0.004975632082219806, 'sideways_atr_max_pct': 0.014806527411446113, 'sideways_tp_mult': 1.3299597552870428, 'sideways_tsl_mult': 0.2356924946251432, 'sideways_time_stop': 140, 'sideways_use_sma': False, 'sideways_use_ema': True, 'sideways_use_atr': True, 'sideways_use_adx': False, 'sideways_use_spike': False, 'sideways_rsi_required': True}.
[I 2025-08-30 21:11:48,505] Trial 196 finished with values: [-1000000000.0, 1000000000.0] and parameters: {'p_sma': 22, 'p_std': 35, 'p_atr': 20, 'p_adx': 29, 'rsi_period': 84, 'ema1': 20, 'ema2': 49, 'slip_atr_k': 0.036396603540163594, 'slip_spread_k': 0.7996207837323894, 'spread_hl_frac': 0.03858152335463773, 'bb_std_mult': 1.5192975662200756, 'rsi_os': 54, 'rsi_ob': 75, 'vol_spike': 0.2956740177469744, 'adx_thresh': 21.81451981543374, 'atr_min_pct': 0.0005382186295540629, 'atr_max_pct': 0.09502829418851634, 'tp_mult': 1.9550830341896077, 'tsl_mult': 0.38126463562373664, 'strategy': 'breakout', 'time_stop': 128, 'use_sma': False, 'use_atr': False, 'use_adx': False, 'use_ema': True, 'use_spike': False, 'rsi_required': True, 'edge_k': 0.3536650773492377, 'edge_cap': 0.7688351460705755, 'bull_strategy': 'breakout', 'bull_bb_std_mult': 3.3024002650164537, 'bull_rsi_os': 16, 'bull_rsi_ob': 69, 'bull_adx_thresh': 12.624129421145877, 'bull_atr_min_pct': 0.024109438294537065, 'bull_atr_max_pct': 0.04272702120663632, 'bull_tp_mult': 2.9514414441549484, 'bull_tsl_mult': 0.7769060888746316, 'bull_time_stop': 97, 'bull_use_sma': True, 'bull_use_ema': False, 'bull_use_atr': True, 'bull_use_adx': True, 'bull_use_spike': True, 'bull_rsi_required': False, 'bear_strategy': 'mean_reversion', 'bear_bb_std_mult': 1.9703519623088694, 'bear_rsi_os': 46, 'bear_rsi_ob': 82, 'bear_adx_thresh': 12.980560532120455, 'bear_atr_min_pct': 0.005738610810485632, 'bear_atr_max_pct': 0.03462582653207771, 'bear_tp_mult': 2.996159711407911, 'bear_tsl_mult': 0.32058411371624945, 'bear_time_stop': 97, 'bear_use_sma': True, 'bear_use_ema': False, 'bear_use_atr': False, 'bear_use_adx': True, 'bear_use_spike': True, 'bear_rsi_required': False, 'sideways_strategy': 'breakout', 'sideways_bb_std_mult': 2.5607879527302666, 'sideways_rsi_os': 46, 'sideways_rsi_ob': 66, 'sideways_adx_thresh': 20.88737144842146, 'sideways_atr_min_pct': 0.009145041314606, 'sideways_atr_max_pct': 0.14426153844874626, 'sideways_tp_mult': 2.693030906195933, 'sideways_tsl_mult': 0.23993107145505815, 'sideways_time_stop': 138, 'sideways_use_sma': False, 'sideways_use_ema': True, 'sideways_use_atr': True, 'sideways_use_adx': False, 'sideways_use_spike': False, 'sideways_rsi_required': True}.
[I 2025-08-30 21:11:49,626] Trial 198 finished with values: [-1000000000.0, 1000000000.0] and parameters: {'p_sma': 31, 'p_std': 37, 'p_atr': 21, 'p_adx': 29, 'rsi_period': 18, 'ema1': 20, 'ema2': 17, 'slip_atr_k': 0.023518471725985167, 'slip_spread_k': 0.5441573245639649, 'spread_hl_frac': 0.03833289029850634, 'bb_std_mult': 1.5148982483907583, 'rsi_os': 40, 'rsi_ob': 76, 'vol_spike': 0.25833168960068553, 'adx_thresh': 24.07244624803024, 'atr_min_pct': 0.0013403288619163666, 'atr_max_pct': 0.09687871838780804, 'tp_mult': 1.962167442401418, 'tsl_mult': 0.39622331927353194, 'strategy': 'breakout', 'time_stop': 210, 'use_sma': True, 'use_atr': False, 'use_adx': False, 'use_ema': True, 'use_spike': False, 'rsi_required': False, 'edge_k': 1.7258667090061708, 'edge_cap': 0.7650907370173985, 'bull_strategy': 'breakout', 'bull_bb_std_mult': 2.4478045962235657, 'bull_rsi_os': 16, 'bull_rsi_ob': 70, 'bull_adx_thresh': 13.018344030599742, 'bull_atr_min_pct': 0.0013178663984113814, 'bull_atr_max_pct': 0.059013594386671225, 'bull_tp_mult': 2.610459430720442, 'bull_tsl_mult': 0.09533931939173806, 'bull_time_stop': 31, 'bull_use_sma': False, 'bull_use_ema': True, 'bull_use_atr': True, 'bull_use_adx': False, 'bull_use_spike': True, 'bull_rsi_required': False, 'bear_strategy': 'mean_reversion', 'bear_bb_std_mult': 1.1194476664349202, 'bear_rsi_os': 46, 'bear_rsi_ob': 83, 'bear_adx_thresh': 33.74084886481699, 'bear_atr_min_pct': 0.028399310983762034, 'bear_atr_max_pct': 0.01824821759366542, 'bear_tp_mult': 2.9996482020183772, 'bear_tsl_mult': 0.8968323635919068, 'bear_time_stop': 132, 'bear_use_sma': True, 'bear_use_ema': False, 'bear_use_atr': False, 'bear_use_adx': True, 'bear_use_spike': False, 'bear_rsi_required': False, 'sideways_strategy': 'breakout', 'sideways_bb_std_mult': 0.91446216311792, 'sideways_rsi_os': 39, 'sideways_rsi_ob': 49, 'sideways_adx_thresh': 8.655988350177932, 'sideways_atr_min_pct': 0.008841420845140863, 'sideways_atr_max_pct': 0.12120920791510029, 'sideways_tp_mult': 2.6967209448100014, 'sideways_tsl_mult': 0.23704016306649806, 'sideways_time_stop': 136, 'sideways_use_sma': True, 'sideways_use_ema': True, 'sideways_use_atr': True, 'sideways_use_adx': False, 'sideways_use_spike': True, 'sideways_rsi_required': True}.
