[I 2025-08-30 22:27:44,410] Trial 818 finished with values: [-0.019132136382949638, 0.019083403517963664] and parameters: {'p_sma': 32, 'p_std': 19, 'p_atr': 7, 'p_adx': 13, 'rsi_period': 44, 'ema1': 12, 'ema2': 22, 'slip_atr_k': 0.0274939149183506, 'slip_spread_k': 0.6120305914452958, 'spread_hl_frac': 0.03431347258280533, 'bb_std_mult': 0.7928600132723509, 'rsi_os': 30, 'rsi_ob': 67, 'vol_spike': 0.2283754002904761, 'adx_thresh': 20.608542829045053, 'atr_min_pct': 0.012706787869273243, 'atr_max_pct': 0.10910352679344634, 'tp_mult': 2.714847068276724, 'tsl_mult': 0.877525807950833, 'strategy': 'breakout', 'time_stop': 74, 'use_sma': False, 'use_atr': True, 'use_adx': False, 'use_ema': True, 'use_spike': False, 'rsi_required': False, 'edge_k': 0.919486339391977, 'edge_cap': 0.17098759840651195, 'bull_strategy': 'mean_reversion', 'bull_bb_std_mult': 2.7960711146917374, 'bull_rsi_os': 18, 'bull_rsi_ob': 88, 'bull_adx_thresh': 24.92437541311746, 'bull_atr_min_pct': 0.001397582470724189, 'bull_atr_max_pct': 0.10102804679280565, 'bull_tp_mult': 1.063864732076252, 'bull_tsl_mult': 0.4477686774060485, 'bull_time_stop': 5, 'bull_use_sma': False, 'bull_use_ema': False, 'bull_use_atr': True, 'bull_use_adx': False, 'bull_use_spike': False, 'bull_rsi_required': True, 'bear_strategy': 'mean_reversion', 'bear_bb_std_mult': 1.9196023389697072, 'bear_rsi_os': 5, 'bear_rsi_ob': 70, 'bear_adx_thresh': 28.31415465708896, 'bear_atr_min_pct': 0.012245084278089383, 'bear_atr_max_pct': 0.07722841688830875, 'bear_tp_mult': 1.5747313568051524, 'bear_tsl_mult': 0.06622764880779264, 'bear_time_stop': 170, 'bear_use_sma': False, 'bear_use_ema': False, 'bear_use_atr': False, 'bear_use_adx': True, 'bear_use_spike': True, 'bear_rsi_required': True, 'sideways_strategy': 'breakout', 'sideways_bb_std_mult': 2.7821294623212216, 'sideways_rsi_os': 40, 'sideways_rsi_ob': 87, 'sideways_adx_thresh': 28.479275770553222, 'sideways_atr_min_pct': 0.011115606679942406, 'sideways_atr_max_pct': 0.03865186955090682, 'sideways_tp_mult': 1.8492509803083639, 'sideways_tsl_mult': 0.6238670157231112, 'sideways_time_stop': 262, 'sideways_use_sma': False, 'sideways_use_ema': False, 'sideways_use_atr': False, 'sideways_use_adx': True, 'sideways_use_spike': False, 'sideways_rsi_required': False}.
[I 2025-08-30 22:27:45,016] Trial 820 finished with values: [-0.023236482311782658, 0.023211206307865353] and parameters: {'p_sma': 60, 'p_std': 35, 'p_atr': 21, 'p_adx': 19, 'rsi_period': 77, 'ema1': 12, 'ema2': 22, 'slip_atr_k': 0.19212142425173157, 'slip_spread_k': 0.5849369911488718, 'spread_hl_frac': 0.03378085598929093, 'bb_std_mult': 0.857298487755422, 'rsi_os': 40, 'rsi_ob': 67, 'vol_spike': 0.2714114179221233, 'adx_thresh': 10.863741288324853, 'atr_min_pct': 0.01905065014397446, 'atr_max_pct': 0.14189109791623655, 'tp_mult': 1.3124574503681874, 'tsl_mult': 0.8894846406161561, 'strategy': 'breakout', 'time_stop': 77, 'use_sma': False, 'use_atr': True, 'use_adx': False, 'use_ema': True, 'use_spike': False, 'rsi_required': False, 'edge_k': 0.9690358809376389, 'edge_cap': 0.7412322772698163, 'bull_strategy': 'mean_reversion', 'bull_bb_std_mult': 1.8179432256469878, 'bull_rsi_os': 18, 'bull_rsi_ob': 83, 'bull_adx_thresh': 24.900407996708886, 'bull_atr_min_pct': 8.387422187619391e-05, 'bull_atr_max_pct': 0.045701756351849476, 'bull_tp_mult': 1.3691595989902956, 'bull_tsl_mult': 0.0009687117551740454, 'bull_time_stop': 5, 'bull_use_sma': False, 'bull_use_ema': False, 'bull_use_atr': True, 'bull_use_adx': False, 'bull_use_spike': False, 'bull_rsi_required': True, 'bear_strategy': 'mean_reversion', 'bear_bb_std_mult': 1.9277616867930187, 'bear_rsi_os': 8, 'bear_rsi_ob': 70, 'bear_adx_thresh': 28.24580028536528, 'bear_atr_min_pct': 0.020305905846029752, 'bear_atr_max_pct': 0.1104632985749315, 'bear_tp_mult': 1.568745128545534, 'bear_tsl_mult': 0.43463429907495116, 'bear_time_stop': 253, 'bear_use_sma': False, 'bear_use_ema': False, 'bear_use_atr': False, 'bear_use_adx': False, 'bear_use_spike': True, 'bear_rsi_required': True, 'sideways_strategy': 'breakout', 'sideways_bb_std_mult': 1.5434657457913892, 'sideways_rsi_os': 10, 'sideways_rsi_ob': 60, 'sideways_adx_thresh': 28.49032476893909, 'sideways_atr_min_pct': 0.020408027497881908, 'sideways_atr_max_pct': 0.039962740796968356, 'sideways_tp_mult': 2.8036197291154603, 'sideways_tsl_mult': 0.8300230293954193, 'sideways_time_stop': 231, 'sideways_use_sma': False, 'sideways_use_ema': False, 'sideways_use_atr': False, 'sideways_use_adx': True, 'sideways_use_spike': False, 'sideways_rsi_required': False}.
[I 2025-08-30 22:28:21,122] Trial 823 finished with values: [-1000000000.0, 1000000000.0] and parameters: {'p_sma': 34, 'p_std': 35, 'p_atr': 27, 'p_adx': 12, 'rsi_period': 76, 'ema1': 30, 'ema2': 50, 'slip_atr_k': 0.19294086961423113, 'slip_spread_k': 0.6490620020611677, 'spread_hl_frac': 0.03578459365552322, 'bb_std_mult': 0.8618917699072387, 'rsi_os': 11, 'rsi_ob': 71, 'vol_spike': 0.2683115338300746, 'adx_thresh': 16.68715324840342, 'atr_min_pct': 0.00268157464143998, 'atr_max_pct': 0.14165351572762125, 'tp_mult': 1.720163102173971, 'tsl_mult': 0.9233154353558464, 'strategy': 'mean_reversion', 'time_stop': 92, 'use_sma': True, 'use_atr': True, 'use_adx': True, 'use_ema': True, 'use_spike': True, 'rsi_required': True, 'edge_k': 1.0471397790252206, 'edge_cap': 0.9398831369184005, 'bull_strategy': 'breakout', 'bull_bb_std_mult': 1.9108672162433413, 'bull_rsi_os': 33, 'bull_rsi_ob': 79, 'bull_adx_thresh': 18.419333019327627, 'bull_atr_min_pct': 0.014099600246684376, 'bull_atr_max_pct': 0.047834307016862455, 'bull_tp_mult': 2.6141021464098735, 'bull_tsl_mult': 0.3761766211056862, 'bull_time_stop': 290, 'bull_use_sma': True, 'bull_use_ema': False, 'bull_use_atr': False, 'bull_use_adx': False, 'bull_use_spike': False, 'bull_rsi_required': True, 'bear_strategy': 'breakout', 'bear_bb_std_mult': 2.0679181356265914, 'bear_rsi_os': 8, 'bear_rsi_ob': 46, 'bear_adx_thresh': 7.7699093977368445, 'bear_atr_min_pct': 0.02041233344946353, 'bear_atr_max_pct': 0.03140051372032326, 'bear_tp_mult': 1.4189971273400523, 'bear_tsl_mult': 0.3458620926956735, 'bear_time_stop': 233, 'bear_use_sma': False, 'bear_use_ema': True, 'bear_use_atr': False, 'bear_use_adx': False, 'bear_use_spike': True, 'bear_rsi_required': True, 'sideways_strategy': 'breakout', 'sideways_bb_std_mult': 1.8639992944553072, 'sideways_rsi_os': 37, 'sideways_rsi_ob': 65, 'sideways_adx_thresh': 25.688589694900003, 'sideways_atr_min_pct': 0.021593279772909736, 'sideways_atr_max_pct': 0.040718670320556524, 'sideways_tp_mult': 1.7903954040936394, 'sideways_tsl_mult': 0.8274247211024962, 'sideways_time_stop': 281, 'sideways_use_sma': False, 'sideways_use_ema': False, 'sideways_use_atr': False, 'sideways_use_adx': True, 'sideways_use_spike': False, 'sideways_rsi_required': False}.
[I 2025-08-30 22:28:21,671] Trial 822 finished with values: [-1000000000.0, 1000000000.0] and parameters: {'p_sma': 60, 'p_std': 19, 'p_atr': 21, 'p_adx': 13, 'rsi_period': 76, 'ema1': 7, 'ema2': 12, 'slip_atr_k': 0.142173249331772, 'slip_spread_k': 0.6627381662456318, 'spread_hl_frac': 0.03406748518617349, 'bb_std_mult': 0.8535634783776953, 'rsi_os': 40, 'rsi_ob': 57, 'vol_spike': 0.27266557021511645, 'adx_thresh': 16.764664352303807, 'atr_min_pct': 0.0144029913597325, 'atr_max_pct': 0.13951610920226248, 'tp_mult': 2.552599109975401, 'tsl_mult': 0.9212264766706877, 'strategy': 'mean_reversion', 'time_stop': 98, 'use_sma': True, 'use_atr': True, 'use_adx': True, 'use_ema': True, 'use_spike': True, 'rsi_required': False, 'edge_k': 0.9800655932954017, 'edge_cap': 0.3916138339289522, 'bull_strategy': 'breakout', 'bull_bb_std_mult': 1.9136449434912117, 'bull_rsi_os': 19, 'bull_rsi_ob': 78, 'bull_adx_thresh': 15.407744838310359, 'bull_atr_min_pct': 0.022436017800653563, 'bull_atr_max_pct': 0.04842659033393617, 'bull_tp_mult': 1.2415001038577707, 'bull_tsl_mult': 0.9865591973227602, 'bull_time_stop': 31, 'bull_use_sma': True, 'bull_use_ema': False, 'bull_use_atr': False, 'bull_use_adx': False, 'bull_use_spike': False, 'bull_rsi_required': True, 'bear_strategy': 'breakout', 'bear_bb_std_mult': 2.4682106171925384, 'bear_rsi_os': 34, 'bear_rsi_ob': 46, 'bear_adx_thresh': 27.27742787262989, 'bear_atr_min_pct': 0.02282491286180932, 'bear_atr_max_pct': 0.11214025328794375, 'bear_tp_mult': 1.5645650113234046, 'bear_tsl_mult': 0.4270724527111409, 'bear_time_stop': 253, 'bear_use_sma': False, 'bear_use_ema': True, 'bear_use_atr': False, 'bear_use_adx': False, 'bear_use_spike': True, 'bear_rsi_required': True, 'sideways_strategy': 'breakout', 'sideways_bb_std_mult': 0.7429398551877751, 'sideways_rsi_os': 47, 'sideways_rsi_ob': 88, 'sideways_adx_thresh': 27.081114732204046, 'sideways_atr_min_pct': 0.021393252817046314, 'sideways_atr_max_pct': 0.05851317009504162, 'sideways_tp_mult': 1.7956378419708294, 'sideways_tsl_mult': 0.8355449872243356, 'sideways_time_stop': 281, 'sideways_use_sma': False, 'sideways_use_ema': False, 'sideways_use_atr': False, 'sideways_use_adx': True, 'sideways_use_spike': False, 'sideways_rsi_required': False}.
[I 2025-08-30 22:28:21,985] Trial 824 finished with values: [-0.016158943868471165, 0.01606562922004322] and parameters: {'p_sma': 34, 'p_std': 35, 'p_atr': 30, 'p_adx': 27, 'rsi_period': 73, 'ema1': 30, 'ema2': 28, 'slip_atr_k': 0.005438478406729959, 'slip_spread_k': 0.6541952304044005, 'spread_hl_frac': 0.03354335237541621, 'bb_std_mult': 2.551562923244277, 'rsi_os': 11, 'rsi_ob': 66, 'vol_spike': 0.2763741148195391, 'adx_thresh': 16.826781208397676, 'atr_min_pct': 0.009281544908975977, 'atr_max_pct': 0.03500999019321553, 'tp_mult': 1.7025940156256019, 'tsl_mult': 0.5390740391427022, 'strategy': 'mean_reversion', 'time_stop': 94, 'use_sma': True, 'use_atr': True, 'use_adx': True, 'use_ema': True, 'use_spike': True, 'rsi_required': True, 'edge_k': 1.0364384813927148, 'edge_cap': 0.3942894053935592, 'bull_strategy': 'breakout', 'bull_bb_std_mult': 1.9973299720184445, 'bull_rsi_os': 38, 'bull_rsi_ob': 87, 'bull_adx_thresh': 9.783885311316162, 'bull_atr_min_pct': 0.0011138422765902673, 'bull_atr_max_pct': 0.06720004398210584, 'bull_tp_mult': 2.1182496389441674, 'bull_tsl_mult': 0.37614885128487974, 'bull_time_stop': 30, 'bull_use_sma': True, 'bull_use_ema': False, 'bull_use_atr': False, 'bull_use_adx': True, 'bull_use_spike': False, 'bull_rsi_required': True, 'bear_strategy': 'breakout', 'bear_bb_std_mult': 2.9231995278395173, 'bear_rsi_os': 7, 'bear_rsi_ob': 84, 'bear_adx_thresh': 6.685379919412526, 'bear_atr_min_pct': 0.029986506721348546, 'bear_atr_max_pct': 0.1190451944786151, 'bear_tp_mult': 1.4307358897420341, 'bear_tsl_mult': 0.5849910349242009, 'bear_time_stop': 233, 'bear_use_sma': False, 'bear_use_ema': True, 'bear_use_atr': False, 'bear_use_adx': False, 'bear_use_spike': True, 'bear_rsi_required': True, 'sideways_strategy': 'breakout', 'sideways_bb_std_mult': 0.7301119458346821, 'sideways_rsi_os': 45, 'sideways_rsi_ob': 49, 'sideways_adx_thresh': 27.114793869027828, 'sideways_atr_min_pct': 0.021238761775770894, 'sideways_atr_max_pct': 0.10412869775429513, 'sideways_tp_mult': 2.5351698063558015, 'sideways_tsl_mult': 0.7969394395183801, 'sideways_time_stop': 250, 'sideways_use_sma': False, 'sideways_use_ema': False, 'sideways_use_atr': False, 'sideways_use_adx': True, 'sideways_use_spike': False, 'sideways_rsi_required': False}.
[I 2025-08-30 22:28:22,276] Trial 821 finished with values: [-1000000000.0, 1000000000.0] and parameters: {'p_sma': 48, 'p_std': 19, 'p_atr': 21, 'p_adx': 21, 'rsi_period': 77, 'ema1': 7, 'ema2': 22, 'slip_atr_k': 0.22729840800384263, 'slip_spread_k': 0.5866489436402491, 'spread_hl_frac': 0.012547865851175961, 'bb_std_mult': 0.8485308664060991, 'rsi_os': 33, 'rsi_ob': 67, 'vol_spike': 0.2783298127494599, 'adx_thresh': 22.6629202044547, 'atr_min_pct': 0.013523877426857641, 'atr_max_pct': 0.10991476601982497, 'tp_mult': 2.9965966604781076, 'tsl_mult': 0.8897018574361939, 'strategy': 'breakout', 'time_stop': 76, 'use_sma': True, 'use_atr': True, 'use_adx': False, 'use_ema': True, 'use_spike': False, 'rsi_required': False, 'edge_k': 0.9192640578800216, 'edge_cap': 0.10035833452688725, 'bull_strategy': 'breakout', 'bull_bb_std_mult': 2.026364131108744, 'bull_rsi_os': 35, 'bull_rsi_ob': 81, 'bull_adx_thresh': 18.24605628823038, 'bull_atr_min_pct': 0.016604386388792716, 'bull_atr_max_pct': 0.04899216676283261, 'bull_tp_mult': 1.4663274657714462, 'bull_tsl_mult': 0.37733185524176716, 'bull_time_stop': 203, 'bull_use_sma': True, 'bull_use_ema': False, 'bull_use_atr': True, 'bull_use_adx': False, 'bull_use_spike': False, 'bull_rsi_required': True, 'bear_strategy': 'mean_reversion', 'bear_bb_std_mult': 2.9370426057449475, 'bear_rsi_os': 8, 'bear_rsi_ob': 70, 'bear_adx_thresh': 12.29825820331244, 'bear_atr_min_pct': 0.0299762037665087, 'bear_atr_max_pct': 0.11494094760196313, 'bear_tp_mult': 2.443187087277802, 'bear_tsl_mult': 0.4310233411694853, 'bear_time_stop': 252, 'bear_use_sma': False, 'bear_use_ema': True, 'bear_use_atr': False, 'bear_use_adx': False, 'bear_use_spike': True, 'bear_rsi_required': True, 'sideways_strategy': 'breakout', 'sideways_bb_std_mult': 2.5619037305745156, 'sideways_rsi_os': 48, 'sideways_rsi_ob': 60, 'sideways_adx_thresh': 28.48666872631783, 'sideways_atr_min_pct': 0.009318080408533071, 'sideways_atr_max_pct': 0.103535296008098, 'sideways_tp_mult': 2.5261493028853366, 'sideways_tsl_mult': 0.5303412877737961, 'sideways_time_stop': 262, 'sideways_use_sma': False, 'sideways_use_ema': False, 'sideways_use_atr': False, 'sideways_use_adx': True, 'sideways_use_spike': False, 'sideways_rsi_required': False}.
[I 2025-08-30 22:28:58,774] Trial 827 finished with values: [-1000000000.0, 1000000000.0] and parameters: {'p_sma': 34, 'p_std': 37, 'p_atr': 20, 'p_adx': 19, 'rsi_period': 66, 'ema1': 10, 'ema2': 48, 'slip_atr_k': 0.22593337612515008, 'slip_spread_k': 0.6418464544975577, 'spread_hl_frac': 0.012133645419187359, 'bb_std_mult': 0.6133874323179493, 'rsi_os': 37, 'rsi_ob': 59, 'vol_spike': 0.2838164472720174, 'adx_thresh': 9.463792174566166, 'atr_min_pct': 0.013669133991291132, 'atr_max_pct': 0.07022925440460866, 'tp_mult': 1.610169886886688, 'tsl_mult': 0.4218160367727835, 'strategy': 'mean_reversion', 'time_stop': 85, 'use_sma': True, 'use_atr': True, 'use_adx': True, 'use_ema': False, 'use_spike': True, 'rsi_required': True, 'edge_k': 1.0372262861321386, 'edge_cap': 0.7846467719020291, 'bull_strategy': 'breakout', 'bull_bb_std_mult': 2.0335954844607516, 'bull_rsi_os': 47, 'bull_rsi_ob': 81, 'bull_adx_thresh': 22.610010912252193, 'bull_atr_min_pct': 0.024516645639974587, 'bull_atr_max_pct': 0.11055337361989082, 'bull_tp_mult': 1.4649802818705215, 'bull_tsl_mult': 0.4191187171400652, 'bull_time_stop': 202, 'bull_use_sma': True, 'bull_use_ema': True, 'bull_use_atr': False, 'bull_use_adx': True, 'bull_use_spike': False, 'bull_rsi_required': True, 'bear_strategy': 'mean_reversion', 'bear_bb_std_mult': 2.018607059686589, 'bear_rsi_os': 20, 'bear_rsi_ob': 73, 'bear_adx_thresh': 25.615782027494618, 'bear_atr_min_pct': 0.029976506757142314, 'bear_atr_max_pct': 0.11896416419155148, 'bear_tp_mult': 1.1755047740191022, 'bear_tsl_mult': 0.46978395084291724, 'bear_time_stop': 196, 'bear_use_sma': False, 'bear_use_ema': True, 'bear_use_atr': False, 'bear_use_adx': True, 'bear_use_spike': True, 'bear_rsi_required': True, 'sideways_strategy': 'breakout', 'sideways_bb_std_mult': 1.7365401390570647, 'sideways_rsi_os': 45, 'sideways_rsi_ob': 51, 'sideways_adx_thresh': 23.959354153403996, 'sideways_atr_min_pct': 0.028669472306205982, 'sideways_atr_max_pct': 0.042472461244916, 'sideways_tp_mult': 1.4329191539046418, 'sideways_tsl_mult': 0.40032957743204045, 'sideways_time_stop': 250, 'sideways_use_sma': True, 'sideways_use_ema': False, 'sideways_use_atr': True, 'sideways_use_adx': True, 'sideways_use_spike': True, 'sideways_rsi_required': False}.
[I 2025-08-30 22:28:59,072] Trial 825 finished with values: [-0.013999133936745567, 0.013903317678966744] and parameters: {'p_sma': 34, 'p_std': 37, 'p_atr': 21, 'p_adx': 21, 'rsi_period': 74, 'ema1': 10, 'ema2': 26, 'slip_atr_k': 0.006459024467709504, 'slip_spread_k': 0.662466051256678, 'spread_hl_frac': 0.012662185510976042, 'bb_std_mult': 2.5292611206760656, 'rsi_os': 13, 'rsi_ob': 89, 'vol_spike': 0.03618771907831199, 'adx_thresh': 12.041608167728794, 'atr_min_pct': 0.01359912374331565, 'atr_max_pct': 0.07707611320627783, 'tp_mult': 1.596618201996828, 'tsl_mult': 0.4302343159877316, 'strategy': 'mean_reversion', 'time_stop': 99, 'use_sma': True, 'use_atr': True, 'use_adx': True, 'use_ema': True, 'use_spike': True, 'rsi_required': True, 'edge_k': 1.0979123315373047, 'edge_cap': 0.12966114516193517, 'bull_strategy': 'breakout', 'bull_bb_std_mult': 2.0442196658512897, 'bull_rsi_os': 47, 'bull_rsi_ob': 86, 'bull_adx_thresh': 15.371481201942442, 'bull_atr_min_pct': 0.0011878094339114757, 'bull_atr_max_pct': 0.04912508043438507, 'bull_tp_mult': 2.1046659875989056, 'bull_tsl_mult': 0.5727685647022347, 'bull_time_stop': 295, 'bull_use_sma': True, 'bull_use_ema': False, 'bull_use_atr': False, 'bull_use_adx': True, 'bull_use_spike': False, 'bull_rsi_required': True, 'bear_strategy': 'mean_reversion', 'bear_bb_std_mult': 1.7391211617109998, 'bear_rsi_os': 7, 'bear_rsi_ob': 73, 'bear_adx_thresh': 27.296105618592144, 'bear_atr_min_pct': 0.029501244368639934, 'bear_atr_max_pct': 0.12026141353096662, 'bear_tp_mult': 2.4504984431789465, 'bear_tsl_mult': 0.5765447426225732, 'bear_time_stop': 243, 'bear_use_sma': False, 'bear_use_ema': True, 'bear_use_atr': False, 'bear_use_adx': True, 'bear_use_spike': True, 'bear_rsi_required': False, 'sideways_strategy': 'breakout', 'sideways_bb_std_mult': 2.491614231597926, 'sideways_rsi_os': 38, 'sideways_rsi_ob': 49, 'sideways_adx_thresh': 27.011656829481723, 'sideways_atr_min_pct': 0.02072740081632092, 'sideways_atr_max_pct': 0.09026728419020573, 'sideways_tp_mult': 1.944700777950448, 'sideways_tsl_mult': 0.9087738008720221, 'sideways_time_stop': 253, 'sideways_use_sma': False, 'sideways_use_ema': False, 'sideways_use_atr': False, 'sideways_use_adx': True, 'sideways_use_spike': True, 'sideways_rsi_required': False}.
[I 2025-08-30 22:28:59,397] Trial 828 finished with values: [-1000000000.0, 1000000000.0] and parameters: {'p_sma': 35, 'p_std': 36, 'p_atr': 17, 'p_adx': 19, 'rsi_period': 64, 'ema1': 15, 'ema2': 34, 'slip_atr_k': 0.01584562513633352, 'slip_spread_k': 0.18428827049556085, 'spread_hl_frac': 0.03312317301874646, 'bb_std_mult': 0.6469713491959106, 'rsi_os': 10, 'rsi_ob': 65, 'vol_spike': 0.07489086906138627, 'adx_thresh': 27.731214026781732, 'atr_min_pct': 0.013462835103432009, 'atr_max_pct': 0.026852065678065744, 'tp_mult': 1.6022528220230066, 'tsl_mult': 0.5350739828850103, 'strategy': 'mean_reversion', 'time_stop': 84, 'use_sma': True, 'use_atr': True, 'use_adx': True, 'use_ema': False, 'use_spike': True, 'rsi_required': True, 'edge_k': 1.0930553276339607, 'edge_cap': 0.781682741426791, 'bull_strategy': 'breakout', 'bull_bb_std_mult': 2.0126296933342367, 'bull_rsi_os': 49, 'bull_rsi_ob': 59, 'bull_adx_thresh': 14.36997021910376, 'bull_atr_min_pct': 0.01576959308078716, 'bull_atr_max_pct': 0.05386561613389886, 'bull_tp_mult': 2.703589810118844, 'bull_tsl_mult': 0.5680515775857321, 'bull_time_stop': 295, 'bull_use_sma': True, 'bull_use_ema': True, 'bull_use_atr': False, 'bull_use_adx': True, 'bull_use_spike': False, 'bull_rsi_required': True, 'bear_strategy': 'mean_reversion', 'bear_bb_std_mult': 0.5067748058377364, 'bear_rsi_os': 7, 'bear_rsi_ob': 67, 'bear_adx_thresh': 24.225151066099418, 'bear_atr_min_pct': 0.029999132804326055, 'bear_atr_max_pct': 0.11942018004009089, 'bear_tp_mult': 2.7320812035394684, 'bear_tsl_mult': 0.720725375854682, 'bear_time_stop': 244, 'bear_use_sma': False, 'bear_use_ema': True, 'bear_use_atr': False, 'bear_use_adx': True, 'bear_use_spike': True, 'bear_rsi_required': False, 'sideways_strategy': 'breakout', 'sideways_bb_std_mult': 1.7291402921313481, 'sideways_rsi_os': 41, 'sideways_rsi_ob': 49, 'sideways_adx_thresh': 24.01394701146014, 'sideways_atr_min_pct': 0.020672255330693633, 'sideways_atr_max_pct': 0.042169903115253, 'sideways_tp_mult': 1.9379361932963608, 'sideways_tsl_mult': 0.39967954574529796, 'sideways_time_stop': 254, 'sideways_use_sma': True, 'sideways_use_ema': False, 'sideways_use_atr': True, 'sideways_use_adx': True, 'sideways_use_spike': True, 'sideways_rsi_required': False}.
