[I 2025-08-30 22:21:34,836] Trial 774 finished with values: [-1000000000.0, 1000000000.0] and parameters: {'p_sma': 34, 'p_std': 40, 'p_atr': 26, 'p_adx': 11, 'rsi_period': 70, 'ema1': 11, 'ema2': 56, 'slip_atr_k': 0.20068736334445125, 'slip_spread_k': 0.9166866916563106, 'spread_hl_frac': 0.009760431306482948, 'bb_std_mult': 0.8119673305453589, 'rsi_os': 33, 'rsi_ob': 95, 'vol_spike': 0.051267343540176466, 'adx_thresh': 11.786491978073755, 'atr_min_pct': 0.014767609466618163, 'atr_max_pct': 0.013280347405632081, 'tp_mult': 1.6358840735171234, 'tsl_mult': 0.7922379500685686, 'strategy': 'mean_reversion', 'time_stop': 76, 'use_sma': True, 'use_atr': False, 'use_adx': False, 'use_ema': False, 'use_spike': False, 'rsi_required': True, 'edge_k': 1.0149812709133326, 'edge_cap': 0.7744780138542459, 'bull_strategy': 'breakout', 'bull_bb_std_mult': 1.7587711064162515, 'bull_rsi_os': 17, 'bull_rsi_ob': 88, 'bull_adx_thresh': 16.622690464468242, 'bull_atr_min_pct': 0.0024558770454073957, 'bull_atr_max_pct': 0.04805314058631657, 'bull_tp_mult': 1.4159543940397665, 'bull_tsl_mult': 0.4045520611592248, 'bull_time_stop': 300, 'bull_use_sma': True, 'bull_use_ema': True, 'bull_use_atr': False, 'bull_use_adx': False, 'bull_use_spike': False, 'bull_rsi_required': False, 'bear_strategy': 'mean_reversion', 'bear_bb_std_mult': 1.917719450863757, 'bear_rsi_os': 5, 'bear_rsi_ob': 59, 'bear_adx_thresh': 29.051253362549332, 'bear_atr_min_pct': 0.0283862674480735, 'bear_atr_max_pct': 0.11598404992562723, 'bear_tp_mult': 1.3917455895718178, 'bear_tsl_mult': 0.41236952677995836, 'bear_time_stop': 254, 'bear_use_sma': True, 'bear_use_ema': True, 'bear_use_atr': False, 'bear_use_adx': True, 'bear_use_spike': False, 'bear_rsi_required': False, 'sideways_strategy': 'breakout', 'sideways_bb_std_mult': 1.4018517238638983, 'sideways_rsi_os': 5, 'sideways_rsi_ob': 54, 'sideways_adx_thresh': 26.69928121757439, 'sideways_atr_min_pct': 0.02019678080861094, 'sideways_atr_max_pct': 0.12590463462348817, 'sideways_tp_mult': 1.781769767066576, 'sideways_tsl_mult': 0.30824759178221023, 'sideways_time_stop': 67, 'sideways_use_sma': True, 'sideways_use_ema': False, 'sideways_use_atr': True, 'sideways_use_adx': True, 'sideways_use_spike': False, 'sideways_rsi_required': False}.
[I 2025-08-30 22:22:07,301] Trial 776 finished with values: [-1000000000.0, 1000000000.0] and parameters: {'p_sma': 38, 'p_std': 14, 'p_atr': 20, 'p_adx': 17, 'rsi_period': 66, 'ema1': 12, 'ema2': 32, 'slip_atr_k': 0.17978351056085, 'slip_spread_k': 0.6482552898182953, 'spread_hl_frac': 0.03305152926775972, 'bb_std_mult': 0.8089213511086684, 'rsi_os': 13, 'rsi_ob': 88, 'vol_spike': 0.1802135702621011, 'adx_thresh': 14.020916089445471, 'atr_min_pct': 0.014828779222717841, 'atr_max_pct': 0.11256001334049148, 'tp_mult': 1.6871393166038042, 'tsl_mult': 0.3126553864964165, 'strategy': 'mean_reversion', 'time_stop': 77, 'use_sma': True, 'use_atr': True, 'use_adx': True, 'use_ema': False, 'use_spike': True, 'rsi_required': True, 'edge_k': 0.961371794710529, 'edge_cap': 0.9146710582152345, 'bull_strategy': 'breakout', 'bull_bb_std_mult': 2.040039124915262, 'bull_rsi_os': 27, 'bull_rsi_ob': 88, 'bull_adx_thresh': 16.684833703435157, 'bull_atr_min_pct': 0.01220654958041242, 'bull_atr_max_pct': 0.0495098788883539, 'bull_tp_mult': 1.8491721978071578, 'bull_tsl_mult': 0.8561136561617311, 'bull_time_stop': 290, 'bull_use_sma': True, 'bull_use_ema': True, 'bull_use_atr': False, 'bull_use_adx': False, 'bull_use_spike': False, 'bull_rsi_required': False, 'bear_strategy': 'mean_reversion', 'bear_bb_std_mult': 0.9789680355483656, 'bear_rsi_os': 8, 'bear_rsi_ob': 55, 'bear_adx_thresh': 7.409095629289537, 'bear_atr_min_pct': 0.02813379640546889, 'bear_atr_max_pct': 0.11720463848225182, 'bear_tp_mult': 1.5017660507154116, 'bear_tsl_mult': 0.423465210795932, 'bear_time_stop': 226, 'bear_use_sma': True, 'bear_use_ema': True, 'bear_use_atr': False, 'bear_use_adx': True, 'bear_use_spike': False, 'bear_rsi_required': False, 'sideways_strategy': 'breakout', 'sideways_bb_std_mult': 1.362667902645899, 'sideways_rsi_os': 5, 'sideways_rsi_ob': 54, 'sideways_adx_thresh': 26.863797009216395, 'sideways_atr_min_pct': 0.01012707828935138, 'sideways_atr_max_pct': 0.08486604929992482, 'sideways_tp_mult': 1.8469637890902177, 'sideways_tsl_mult': 0.5624899712386049, 'sideways_time_stop': 222, 'sideways_use_sma': False, 'sideways_use_ema': False, 'sideways_use_atr': True, 'sideways_use_adx': True, 'sideways_use_spike': False, 'sideways_rsi_required': False}.
[I 2025-08-30 22:22:07,616] Trial 773 finished with values: [-1000000000.0, 1000000000.0] and parameters: {'p_sma': 12, 'p_std': 33, 'p_atr': 20, 'p_adx': 9, 'rsi_period': 67, 'ema1': 11, 'ema2': 40, 'slip_atr_k': 0.09170752941462222, 'slip_spread_k': 0.7121910196762034, 'spread_hl_frac': 0.03331876742609481, 'bb_std_mult': 0.8322820318858586, 'rsi_os': 12, 'rsi_ob': 64, 'vol_spike': 0.09141241421149701, 'adx_thresh': 12.036471489914373, 'atr_min_pct': 0.012446617103938138, 'atr_max_pct': 0.013188362214971553, 'tp_mult': 2.6580323135140276, 'tsl_mult': 0.9138448047087543, 'strategy': 'mean_reversion', 'time_stop': 79, 'use_sma': True, 'use_atr': False, 'use_adx': False, 'use_ema': True, 'use_spike': False, 'rsi_required': True, 'edge_k': 1.0139576333639728, 'edge_cap': 0.918257557595481, 'bull_strategy': 'breakout', 'bull_bb_std_mult': 1.5251744254613144, 'bull_rsi_os': 17, 'bull_rsi_ob': 88, 'bull_adx_thresh': 14.658778904376458, 'bull_atr_min_pct': 0.002421297101312128, 'bull_atr_max_pct': 0.047662000844943875, 'bull_tp_mult': 1.9524567361132958, 'bull_tsl_mult': 0.3985858729829313, 'bull_time_stop': 293, 'bull_use_sma': True, 'bull_use_ema': False, 'bull_use_atr': False, 'bull_use_adx': False, 'bull_use_spike': False, 'bull_rsi_required': False, 'bear_strategy': 'breakout', 'bear_bb_std_mult': 1.9397611128293806, 'bear_rsi_os': 53, 'bear_rsi_ob': 68, 'bear_adx_thresh': 28.268374486911874, 'bear_atr_min_pct': 0.0282882910468215, 'bear_atr_max_pct': 0.07504675574989468, 'bear_tp_mult': 2.4056923125624095, 'bear_tsl_mult': 0.40728791732433517, 'bear_time_stop': 255, 'bear_use_sma': False, 'bear_use_ema': True, 'bear_use_atr': False, 'bear_use_adx': True, 'bear_use_spike': True, 'bear_rsi_required': False, 'sideways_strategy': 'breakout', 'sideways_bb_std_mult': 1.524304256086476, 'sideways_rsi_os': 36, 'sideways_rsi_ob': 80, 'sideways_adx_thresh': 22.095996586069127, 'sideways_atr_min_pct': 0.020253440870867372, 'sideways_atr_max_pct': 0.03483426753469259, 'sideways_tp_mult': 1.7965879495254378, 'sideways_tsl_mult': 0.3081051969263945, 'sideways_time_stop': 191, 'sideways_use_sma': True, 'sideways_use_ema': False, 'sideways_use_atr': False, 'sideways_use_adx': True, 'sideways_use_spike': True, 'sideways_rsi_required': False}.
[I 2025-08-30 22:22:10,371] Trial 777 finished with values: [-1000000000.0, 1000000000.0] and parameters: {'p_sma': 34, 'p_std': 36, 'p_atr': 10, 'p_adx': 18, 'rsi_period': 70, 'ema1': 26, 'ema2': 53, 'slip_atr_k': 0.09073571866146861, 'slip_spread_k': 0.44866101746931747, 'spread_hl_frac': 0.04196123755664252, 'bb_std_mult': 0.6659075795505331, 'rsi_os': 44, 'rsi_ob': 62, 'vol_spike': 0.16830266578398118, 'adx_thresh': 9.736306483326443, 'atr_min_pct': 0.012661990165136324, 'atr_max_pct': 0.1171754833376206, 'tp_mult': 1.378373211240266, 'tsl_mult': 0.8637839233926724, 'strategy': 'mean_reversion', 'time_stop': 99, 'use_sma': False, 'use_atr': True, 'use_adx': True, 'use_ema': True, 'use_spike': True, 'rsi_required': True, 'edge_k': 0.9910841111085702, 'edge_cap': 0.9160237411410648, 'bull_strategy': 'breakout', 'bull_bb_std_mult': 1.5213625010344272, 'bull_rsi_os': 9, 'bull_rsi_ob': 88, 'bull_adx_thresh': 14.837765866356989, 'bull_atr_min_pct': 0.01122862618742463, 'bull_atr_max_pct': 0.0521220083720874, 'bull_tp_mult': 1.9082165142780216, 'bull_tsl_mult': 0.09541705874786588, 'bull_time_stop': 291, 'bull_use_sma': True, 'bull_use_ema': False, 'bull_use_atr': False, 'bull_use_adx': False, 'bull_use_spike': False, 'bull_rsi_required': True, 'bear_strategy': 'mean_reversion', 'bear_bb_std_mult': 1.9507911742860236, 'bear_rsi_os': 6, 'bear_rsi_ob': 94, 'bear_adx_thresh': 26.0913169170331, 'bear_atr_min_pct': 0.010094417661771281, 'bear_atr_max_pct': 0.12463938947090585, 'bear_tp_mult': 1.6946763096983295, 'bear_tsl_mult': 0.359224171849014, 'bear_time_stop': 227, 'bear_use_sma': False, 'bear_use_ema': True, 'bear_use_atr': False, 'bear_use_adx': True, 'bear_use_spike': True, 'bear_rsi_required': True, 'sideways_strategy': 'breakout', 'sideways_bb_std_mult': 2.1104861929263548, 'sideways_rsi_os': 39, 'sideways_rsi_ob': 85, 'sideways_adx_thresh': 6.555795453128802, 'sideways_atr_min_pct': 0.009780395412000707, 'sideways_atr_max_pct': 0.08370895554413393, 'sideways_tp_mult': 1.2422714221900382, 'sideways_tsl_mult': 0.7707700334418593, 'sideways_time_stop': 275, 'sideways_use_sma': True, 'sideways_use_ema': False, 'sideways_use_atr': True, 'sideways_use_adx': True, 'sideways_use_spike': False, 'sideways_rsi_required': False}.
[I 2025-08-30 22:22:10,373] Trial 778 finished with values: [-1000000000.0, 1000000000.0] and parameters: {'p_sma': 36, 'p_std': 57, 'p_atr': 30, 'p_adx': 19, 'rsi_period': 50, 'ema1': 8, 'ema2': 11, 'slip_atr_k': 0.1193425008625716, 'slip_spread_k': 0.7096005094849593, 'spread_hl_frac': 0.042431436777880985, 'bb_std_mult': 0.6728985921014218, 'rsi_os': 31, 'rsi_ob': 87, 'vol_spike': 0.020306076211451835, 'adx_thresh': 12.431137830541166, 'atr_min_pct': 0.01416850087872919, 'atr_max_pct': 0.11589386457177203, 'tp_mult': 1.6708549464715996, 'tsl_mult': 0.8693399438930239, 'strategy': 'mean_reversion', 'time_stop': 79, 'use_sma': False, 'use_atr': True, 'use_adx': True, 'use_ema': True, 'use_spike': True, 'rsi_required': True, 'edge_k': 0.9547272889155975, 'edge_cap': 0.7559755736498162, 'bull_strategy': 'breakout', 'bull_bb_std_mult': 1.1130380081890607, 'bull_rsi_os': 27, 'bull_rsi_ob': 87, 'bull_adx_thresh': 9.014429038966, 'bull_atr_min_pct': 0.0010848430365056093, 'bull_atr_max_pct': 0.05266488248134351, 'bull_tp_mult': 1.6508467354862846, 'bull_tsl_mult': 0.36136223318140603, 'bull_time_stop': 281, 'bull_use_sma': False, 'bull_use_ema': False, 'bull_use_atr': False, 'bull_use_adx': False, 'bull_use_spike': False, 'bull_rsi_required': True, 'bear_strategy': 'mean_reversion', 'bear_bb_std_mult': 3.285282567068421, 'bear_rsi_os': 8, 'bear_rsi_ob': 63, 'bear_adx_thresh': 9.025976002449376, 'bear_atr_min_pct': 0.02994158650731297, 'bear_atr_max_pct': 0.14981832585650015, 'bear_tp_mult': 1.6827586477877148, 'bear_tsl_mult': 0.36242958759782196, 'bear_time_stop': 226, 'bear_use_sma': False, 'bear_use_ema': False, 'bear_use_atr': False, 'bear_use_adx': True, 'bear_use_spike': True, 'bear_rsi_required': True, 'sideways_strategy': 'breakout', 'sideways_bb_std_mult': 2.0976278836304045, 'sideways_rsi_os': 40, 'sideways_rsi_ob': 83, 'sideways_adx_thresh': 13.931715345266968, 'sideways_atr_min_pct': 0.02160615224204026, 'sideways_atr_max_pct': 0.045113455864791326, 'sideways_tp_mult': 1.8452497232750569, 'sideways_tsl_mult': 0.7655033962341468, 'sideways_time_stop': 191, 'sideways_use_sma': False, 'sideways_use_ema': False, 'sideways_use_atr': False, 'sideways_use_adx': True, 'sideways_use_spike': False, 'sideways_rsi_required': False}.
[I 2025-08-30 22:22:43,644] Trial 779 finished with values: [-1000000000.0, 1000000000.0] and parameters: {'p_sma': 36, 'p_std': 36, 'p_atr': 21, 'p_adx': 18, 'rsi_period': 24, 'ema1': 10, 'ema2': 53, 'slip_atr_k': 0.06581872057828381, 'slip_spread_k': 0.5820469890518112, 'spread_hl_frac': 0.030748056848037553, 'bb_std_mult': 2.2442711154871824, 'rsi_os': 11, 'rsi_ob': 65, 'vol_spike': 0.16934794400053926, 'adx_thresh': 9.719474612203108, 'atr_min_pct': 0.01407564793967671, 'atr_max_pct': 0.02338334890859634, 'tp_mult': 1.67368645891631, 'tsl_mult': 0.8682940684801834, 'strategy': 'mean_reversion', 'time_stop': 186, 'use_sma': False, 'use_atr': True, 'use_adx': True, 'use_ema': True, 'use_spike': True, 'rsi_required': True, 'edge_k': 0.9965703714395024, 'edge_cap': 0.7840516324077932, 'bull_strategy': 'mean_reversion', 'bull_bb_std_mult': 1.9070320987428666, 'bull_rsi_os': 44, 'bull_rsi_ob': 87, 'bull_adx_thresh': 14.79240396539986, 'bull_atr_min_pct': 0.0010594931523251316, 'bull_atr_max_pct': 0.05276791418906482, 'bull_tp_mult': 1.9732185755104916, 'bull_tsl_mult': 0.3569869019836086, 'bull_time_stop': 282, 'bull_use_sma': False, 'bull_use_ema': False, 'bull_use_atr': False, 'bull_use_adx': True, 'bull_use_spike': False, 'bull_rsi_required': True, 'bear_strategy': 'mean_reversion', 'bear_bb_std_mult': 1.9483827603527892, 'bear_rsi_os': 52, 'bear_rsi_ob': 63, 'bear_adx_thresh': 27.96443101621445, 'bear_atr_min_pct': 0.0299523652045195, 'bear_atr_max_pct': 0.10921060762743869, 'bear_tp_mult': 1.4487893040696616, 'bear_tsl_mult': 0.03661171359197757, 'bear_time_stop': 241, 'bear_use_sma': False, 'bear_use_ema': False, 'bear_use_atr': False, 'bear_use_adx': True, 'bear_use_spike': True, 'bear_rsi_required': True, 'sideways_strategy': 'breakout', 'sideways_bb_std_mult': 2.0955560481828117, 'sideways_rsi_os': 40, 'sideways_rsi_ob': 95, 'sideways_adx_thresh': 6.242167903558599, 'sideways_atr_min_pct': 0.028077439384662936, 'sideways_atr_max_pct': 0.07023803674545032, 'sideways_tp_mult': 2.275960927635771, 'sideways_tsl_mult': 0.7723450887284408, 'sideways_time_stop': 278, 'sideways_use_sma': False, 'sideways_use_ema': False, 'sideways_use_atr': False, 'sideways_use_adx': True, 'sideways_use_spike': False, 'sideways_rsi_required': False}.
[I 2025-08-30 22:22:44,611] Trial 780 finished with values: [-1000000000.0, 1000000000.0] and parameters: {'p_sma': 36, 'p_std': 34, 'p_atr': 21, 'p_adx': 18, 'rsi_period': 50, 'ema1': 12, 'ema2': 18, 'slip_atr_k': 0.032867749010301636, 'slip_spread_k': 0.8760267308872095, 'spread_hl_frac': 0.030733487467186574, 'bb_std_mult': 2.224318309603948, 'rsi_os': 11, 'rsi_ob': 68, 'vol_spike': 0.29469450273321435, 'adx_thresh': 20.043513634257913, 'atr_min_pct': 0.014142878624509112, 'atr_max_pct': 0.023974014327910076, 'tp_mult': 1.680976541309337, 'tsl_mult': 0.8793035008663926, 'strategy': 'mean_reversion', 'time_stop': 102, 'use_sma': False, 'use_atr': True, 'use_adx': True, 'use_ema': True, 'use_spike': True, 'rsi_required': True, 'edge_k': 0.988483629016385, 'edge_cap': 0.782999031347264, 'bull_strategy': 'mean_reversion', 'bull_bb_std_mult': 3.123269875697485, 'bull_rsi_os': 52, 'bull_rsi_ob': 86, 'bull_adx_thresh': 15.129609034065385, 'bull_atr_min_pct': 0.013152108703025113, 'bull_atr_max_pct': 0.05250587728849539, 'bull_tp_mult': 1.0191618554844295, 'bull_tsl_mult': 0.35848709630153164, 'bull_time_stop': 109, 'bull_use_sma': False, 'bull_use_ema': False, 'bull_use_atr': False, 'bull_use_adx': True, 'bull_use_spike': True, 'bull_rsi_required': True, 'bear_strategy': 'mean_reversion', 'bear_bb_std_mult': 2.4319035201027526, 'bear_rsi_os': 6, 'bear_rsi_ob': 71, 'bear_adx_thresh': 26.088937878111526, 'bear_atr_min_pct': 0.02998160855405991, 'bear_atr_max_pct': 0.10906971450186366, 'bear_tp_mult': 1.3348332324354806, 'bear_tsl_mult': 0.35701885546713935, 'bear_time_stop': 241, 'bear_use_sma': False, 'bear_use_ema': False, 'bear_use_atr': False, 'bear_use_adx': True, 'bear_use_spike': True, 'bear_rsi_required': True, 'sideways_strategy': 'mean_reversion', 'sideways_bb_std_mult': 1.5732773334458825, 'sideways_rsi_os': 40, 'sideways_rsi_ob': 55, 'sideways_adx_thresh': 31.544392446243105, 'sideways_atr_min_pct': 0.021650707712222227, 'sideways_atr_max_pct': 0.04608777284540769, 'sideways_tp_mult': 2.2823955035486443, 'sideways_tsl_mult': 0.7715201907218372, 'sideways_time_stop': 274, 'sideways_use_sma': False, 'sideways_use_ema': True, 'sideways_use_atr': False, 'sideways_use_adx': False, 'sideways_use_spike': False, 'sideways_rsi_required': True}.
[I 2025-08-30 22:22:46,259] Trial 781 finished with values: [-1000000000.0, 1000000000.0] and parameters: {'p_sma': 36, 'p_std': 29, 'p_atr': 11, 'p_adx': 8, 'rsi_period': 74, 'ema1': 10, 'ema2': 30, 'slip_atr_k': 0.06648830821329924, 'slip_spread_k': 0.6487533667091118, 'spread_hl_frac': 0.030708690801567382, 'bb_std_mult': 0.7422879787530622, 'rsi_os': 36, 'rsi_ob': 57, 'vol_spike': 0.27263799764673263, 'adx_thresh': 10.379363599601659, 'atr_min_pct': 0.014028209628442397, 'atr_max_pct': 0.13204046784517592, 'tp_mult': 1.5783667985268586, 'tsl_mult': 0.883026642608664, 'strategy': 'mean_reversion', 'time_stop': 18, 'use_sma': False, 'use_atr': True, 'use_adx': True, 'use_ema': True, 'use_spike': True, 'rsi_required': False, 'edge_k': 1.0550151317223628, 'edge_cap': 0.7478010920534719, 'bull_strategy': 'mean_reversion', 'bull_bb_std_mult': 1.9103202388956568, 'bull_rsi_os': 43, 'bull_rsi_ob': 86, 'bull_adx_thresh': 15.02277038360433, 'bull_atr_min_pct': 0.025129569335188166, 'bull_atr_max_pct': 0.05508728131137907, 'bull_tp_mult': 1.382438723781428, 'bull_tsl_mult': 0.3468019806072862, 'bull_time_stop': 152, 'bull_use_sma': False, 'bull_use_ema': False, 'bull_use_atr': False, 'bull_use_adx': True, 'bull_use_spike': True, 'bull_rsi_required': True, 'bear_strategy': 'mean_reversion', 'bear_bb_std_mult': 1.9952236310431357, 'bear_rsi_os': 17, 'bear_rsi_ob': 71, 'bear_adx_thresh': 34.87556675536962, 'bear_atr_min_pct': 0.026394857819869118, 'bear_atr_max_pct': 0.10840855818644313, 'bear_tp_mult': 2.512643004633863, 'bear_tsl_mult': 0.3774543300447109, 'bear_time_stop': 241, 'bear_use_sma': False, 'bear_use_ema': False, 'bear_use_atr': False, 'bear_use_adx': True, 'bear_use_spike': True, 'bear_rsi_required': True, 'sideways_strategy': 'mean_reversion', 'sideways_bb_std_mult': 1.5583226629735305, 'sideways_rsi_os': 18, 'sideways_rsi_ob': 68, 'sideways_adx_thresh': 27.672144684885268, 'sideways_atr_min_pct': 0.021455666817385977, 'sideways_atr_max_pct': 0.13304203274829438, 'sideways_tp_mult': 2.355254784478044, 'sideways_tsl_mult': 0.7867323610668149, 'sideways_time_stop': 261, 'sideways_use_sma': False, 'sideways_use_ema': True, 'sideways_use_atr': False, 'sideways_use_adx': False, 'sideways_use_spike': False, 'sideways_rsi_required': True}.
[I 2025-08-30 22:22:46,359] Trial 782 finished with values: [-1000000000.0, 1000000000.0] and parameters: {'p_sma': 34, 'p_std': 10, 'p_atr': 9, 'p_adx': 15, 'rsi_period': 72, 'ema1': 10, 'ema2': 30, 'slip_atr_k': 0.00015204233733275008, 'slip_spread_k': 0.6489462729222517, 'spread_hl_frac': 0.011384333309695412, 'bb_std_mult': 0.748927265621006, 'rsi_os': 11, 'rsi_ob': 70, 'vol_spike': 0.294278065856268, 'adx_thresh': 10.515805639564395, 'atr_min_pct': 0.013491565609925123, 'atr_max_pct': 0.07502906622611909, 'tp_mult': 1.592516504664861, 'tsl_mult': 0.478750523383046, 'strategy': 'mean_reversion', 'time_stop': 108, 'use_sma': True, 'use_atr': True, 'use_adx': True, 'use_ema': True, 'use_spike': True, 'rsi_required': False, 'edge_k': 1.0748832076539285, 'edge_cap': 0.7886640311612843, 'bull_strategy': 'mean_reversion', 'bull_bb_std_mult': 0.7004905779647688, 'bull_rsi_os': 52, 'bull_rsi_ob': 86, 'bull_adx_thresh': 14.907808446307419, 'bull_atr_min_pct': 0.01342209959052322, 'bull_atr_max_pct': 0.05569862907747064, 'bull_tp_mult': 2.0186177475092, 'bull_tsl_mult': 0.34172865359893295, 'bull_time_stop': 110, 'bull_use_sma': False, 'bull_use_ema': False, 'bull_use_atr': False, 'bull_use_adx': True, 'bull_use_spike': True, 'bull_rsi_required': True, 'bear_strategy': 'mean_reversion', 'bear_bb_std_mult': 2.143847900544722, 'bear_rsi_os': 9, 'bear_rsi_ob': 71, 'bear_adx_thresh': 26.895793808701907, 'bear_atr_min_pct': 0.011624321347332598, 'bear_atr_max_pct': 0.1089175236673567, 'bear_tp_mult': 1.5338420230300547, 'bear_tsl_mult': 0.435530219786167, 'bear_time_stop': 243, 'bear_use_sma': False, 'bear_use_ema': False, 'bear_use_atr': True, 'bear_use_adx': False, 'bear_use_spike': True, 'bear_rsi_required': True, 'sideways_strategy': 'mean_reversion', 'sideways_bb_std_mult': 1.9078160000518842, 'sideways_rsi_os': 50, 'sideways_rsi_ob': 95, 'sideways_adx_thresh': 25.12840055496737, 'sideways_atr_min_pct': 0.028010037894994073, 'sideways_atr_max_pct': 0.055794155274148466, 'sideways_tp_mult': 1.1356930772754747, 'sideways_tsl_mult': 0.5153923183666004, 'sideways_time_stop': 98, 'sideways_use_sma': False, 'sideways_use_ema': True, 'sideways_use_atr': False, 'sideways_use_adx': False, 'sideways_use_spike': False, 'sideways_rsi_required': True}.
