[I 2025-08-30 21:06:00,762] Trial 155 finished with values: [-1000000000.0, 1000000000.0] and parameters: {'p_sma': 40, 'p_std': 37, 'p_atr': 9, 'p_adx': 30, 'rsi_period': 27, 'ema1': 20, 'ema2': 42, 'slip_atr_k': 0.035554021160909374, 'slip_spread_k': 0.7793768229334402, 'spread_hl_frac': 0.006746763675979655, 'bb_std_mult': 1.5281556226959303, 'rsi_os': 51, 'rsi_ob': 78, 'vol_spike': 0.27898527417236846, 'adx_thresh': 28.958670421275222, 'atr_min_pct': 0.00062066533957152, 'atr_max_pct': 0.14006015520925064, 'tp_mult': 1.2705913046403663, 'tsl_mult': 0.8538357639674872, 'strategy': 'mean_reversion', 'time_stop': 218, 'use_sma': False, 'use_atr': True, 'use_adx': False, 'use_ema': True, 'use_spike': False, 'rsi_required': True, 'edge_k': 1.122037585116199, 'edge_cap': 0.9557259808172628, 'bull_strategy': 'breakout', 'bull_bb_std_mult': 2.9168450308511846, 'bull_rsi_os': 16, 'bull_rsi_ob': 55, 'bull_adx_thresh': 26.71985805180279, 'bull_atr_min_pct': 0.000734554521350601, 'bull_atr_max_pct': 0.09003656609677017, 'bull_tp_mult': 2.5021906507498564, 'bull_tsl_mult': 0.3182525082037521, 'bull_time_stop': 55, 'bull_use_sma': True, 'bull_use_ema': False, 'bull_use_atr': False, 'bull_use_adx': True, 'bull_use_spike': True, 'bull_rsi_required': True, 'bear_strategy': 'mean_reversion', 'bear_bb_std_mult': 2.58060738951408, 'bear_rsi_os': 51, 'bear_rsi_ob': 53, 'bear_adx_thresh': 17.080646438169516, 'bear_atr_min_pct': 0.01718982001393863, 'bear_atr_max_pct': 0.02472760022321902, 'bear_tp_mult': 2.9431975790269918, 'bear_tsl_mult': 0.24743979766379215, 'bear_time_stop': 269, 'bear_use_sma': True, 'bear_use_ema': False, 'bear_use_atr': False, 'bear_use_adx': True, 'bear_use_spike': True, 'bear_rsi_required': False, 'sideways_strategy': 'breakout', 'sideways_bb_std_mult': 2.6378177468472543, 'sideways_rsi_os': 39, 'sideways_rsi_ob': 80, 'sideways_adx_thresh': 9.020192636792023, 'sideways_atr_min_pct': 0.026456746935203546, 'sideways_atr_max_pct': 0.013589583036483137, 'sideways_tp_mult': 2.5802991363601557, 'sideways_tsl_mult': 0.2178729609936651, 'sideways_time_stop': 130, 'sideways_use_sma': False, 'sideways_use_ema': True, 'sideways_use_atr': True, 'sideways_use_adx': False, 'sideways_use_spike': False, 'sideways_rsi_required': True}.
[I 2025-08-30 21:06:34,996] Trial 151 finished with values: [-0.02263602271275411, 0.022530182054700566] and parameters: {'p_sma': 40, 'p_std': 37, 'p_atr': 17, 'p_adx': 10, 'rsi_period': 22, 'ema1': 20, 'ema2': 24, 'slip_atr_k': 0.22301862407929005, 'slip_spread_k': 0.7700993003584546, 'spread_hl_frac': 0.006366642572692428, 'bb_std_mult': 0.8684178550362915, 'rsi_os': 18, 'rsi_ob': 70, 'vol_spike': 0.14601147022069344, 'adx_thresh': 22.840492054137325, 'atr_min_pct': 0.0005673757455680603, 'atr_max_pct': 0.044703918852853367, 'tp_mult': 2.882759633204075, 'tsl_mult': 0.937842943558295, 'strategy': 'mean_reversion', 'time_stop': 206, 'use_sma': True, 'use_atr': True, 'use_adx': True, 'use_ema': True, 'use_spike': True, 'rsi_required': True, 'edge_k': 0.8025668865828621, 'edge_cap': 0.7280368337068496, 'bull_strategy': 'mean_reversion', 'bull_bb_std_mult': 2.0420440687867254, 'bull_rsi_os': 18, 'bull_rsi_ob': 73, 'bull_adx_thresh': 5.097903623582475, 'bull_atr_min_pct': 0.0013157198019749458, 'bull_atr_max_pct': 0.04578208514881498, 'bull_tp_mult': 2.4934382167701075, 'bull_tsl_mult': 0.02500142759186111, 'bull_time_stop': 284, 'bull_use_sma': True, 'bull_use_ema': False, 'bull_use_atr': False, 'bull_use_adx': False, 'bull_use_spike': True, 'bull_rsi_required': True, 'bear_strategy': 'mean_reversion', 'bear_bb_std_mult': 1.9913451233680777, 'bear_rsi_os': 43, 'bear_rsi_ob': 79, 'bear_adx_thresh': 21.357390478961907, 'bear_atr_min_pct': 0.008578953700118873, 'bear_atr_max_pct': 0.06639261295088701, 'bear_tp_mult': 2.864710475913407, 'bear_tsl_mult': 0.37821533992147677, 'bear_time_stop': 98, 'bear_use_sma': False, 'bear_use_ema': True, 'bear_use_atr': False, 'bear_use_adx': True, 'bear_use_spike': True, 'bear_rsi_required': True, 'sideways_strategy': 'mean_reversion', 'sideways_bb_std_mult': 2.795702092027122, 'sideways_rsi_os': 18, 'sideways_rsi_ob': 64, 'sideways_adx_thresh': 31.755632061370342, 'sideways_atr_min_pct': 0.008859441470062282, 'sideways_atr_max_pct': 0.10359963507844058, 'sideways_tp_mult': 1.5365276840000688, 'sideways_tsl_mult': 0.27635097705098566, 'sideways_time_stop': 103, 'sideways_use_sma': False, 'sideways_use_ema': True, 'sideways_use_atr': False, 'sideways_use_adx': True, 'sideways_use_spike': False, 'sideways_rsi_required': True}.
[I 2025-08-30 21:06:35,003] Trial 150 finished with values: [-1000000000.0, 1000000000.0] and parameters: {'p_sma': 37, 'p_std': 38, 'p_atr': 9, 'p_adx': 30, 'rsi_period': 65, 'ema1': 20, 'ema2': 42, 'slip_atr_k': 0.2100851569951459, 'slip_spread_k': 0.7189936725564281, 'spread_hl_frac': 0.026321694587194834, 'bb_std_mult': 2.346111795257714, 'rsi_os': 13, 'rsi_ob': 68, 'vol_spike': 0.21946937035294029, 'adx_thresh': 22.84062410027901, 'atr_min_pct': 0.005361696522589667, 'atr_max_pct': 0.03992808091001327, 'tp_mult': 1.6738301344190163, 'tsl_mult': 0.788641249668912, 'strategy': 'mean_reversion', 'time_stop': 98, 'use_sma': False, 'use_atr': True, 'use_adx': True, 'use_ema': True, 'use_spike': True, 'rsi_required': True, 'edge_k': 0.522574742276148, 'edge_cap': 0.9478035377618077, 'bull_strategy': 'mean_reversion', 'bull_bb_std_mult': 2.910622531083401, 'bull_rsi_os': 22, 'bull_rsi_ob': 56, 'bull_adx_thresh': 14.006382390686927, 'bull_atr_min_pct': 0.0011541461523205524, 'bull_atr_max_pct': 0.04488696323034763, 'bull_tp_mult': 1.349049025127565, 'bull_tsl_mult': 0.8216203594802893, 'bull_time_stop': 286, 'bull_use_sma': True, 'bull_use_ema': False, 'bull_use_atr': False, 'bull_use_adx': False, 'bull_use_spike': True, 'bull_rsi_required': True, 'bear_strategy': 'breakout', 'bear_bb_std_mult': 3.4252406101525645, 'bear_rsi_os': 43, 'bear_rsi_ob': 76, 'bear_adx_thresh': 6.097202553792158, 'bear_atr_min_pct': 0.017194368078739804, 'bear_atr_max_pct': 0.06529826409720751, 'bear_tp_mult': 2.8469176381807246, 'bear_tsl_mult': 0.3816307928681661, 'bear_time_stop': 213, 'bear_use_sma': False, 'bear_use_ema': True, 'bear_use_atr': True, 'bear_use_adx': True, 'bear_use_spike': True, 'bear_rsi_required': True, 'sideways_strategy': 'mean_reversion', 'sideways_bb_std_mult': 2.6221660189693656, 'sideways_rsi_os': 45, 'sideways_rsi_ob': 68, 'sideways_adx_thresh': 31.93143767923775, 'sideways_atr_min_pct': 0.02858774726686681, 'sideways_atr_max_pct': 0.071994373888734, 'sideways_tp_mult': 2.692321242863361, 'sideways_tsl_mult': 0.2782993701222841, 'sideways_time_stop': 252, 'sideways_use_sma': False, 'sideways_use_ema': True, 'sideways_use_atr': False, 'sideways_use_adx': True, 'sideways_use_spike': False, 'sideways_rsi_required': True}.
[I 2025-08-30 21:06:37,718] Trial 157 finished with values: [-1000000000.0, 1000000000.0] and parameters: {'p_sma': 36, 'p_std': 26, 'p_atr': 15, 'p_adx': 22, 'rsi_period': 16, 'ema1': 28, 'ema2': 43, 'slip_atr_k': 0.20703949476922734, 'slip_spread_k': 0.8028088868368726, 'spread_hl_frac': 0.004873444347202677, 'bb_std_mult': 1.7693565010021448, 'rsi_os': 46, 'rsi_ob': 76, 'vol_spike': 0.21930158642941724, 'adx_thresh': 6.578566896967864, 'atr_min_pct': 0.0023265929350450272, 'atr_max_pct': 0.03128646235299483, 'tp_mult': 1.511656122082998, 'tsl_mult': 0.8686244641043985, 'strategy': 'breakout', 'time_stop': 300, 'use_sma': False, 'use_atr': False, 'use_adx': True, 'use_ema': True, 'use_spike': True, 'rsi_required': False, 'edge_k': 0.6415799833413787, 'edge_cap': 0.1983956343031577, 'bull_strategy': 'breakout', 'bull_bb_std_mult': 2.831215308920368, 'bull_rsi_os': 18, 'bull_rsi_ob': 71, 'bull_adx_thresh': 13.944744838843656, 'bull_atr_min_pct': 5.5580602484933965e-05, 'bull_atr_max_pct': 0.07706749554261962, 'bull_tp_mult': 1.1471445361426025, 'bull_tsl_mult': 0.13728329042905058, 'bull_time_stop': 92, 'bull_use_sma': True, 'bull_use_ema': True, 'bull_use_atr': True, 'bull_use_adx': True, 'bull_use_spike': True, 'bull_rsi_required': True, 'bear_strategy': 'mean_reversion', 'bear_bb_std_mult': 2.846913383251769, 'bear_rsi_os': 30, 'bear_rsi_ob': 51, 'bear_adx_thresh': 18.027193090775473, 'bear_atr_min_pct': 0.015824732761982454, 'bear_atr_max_pct': 0.0535672814705224, 'bear_tp_mult': 1.5084525787349727, 'bear_tsl_mult': 0.30619932923302634, 'bear_time_stop': 115, 'bear_use_sma': True, 'bear_use_ema': False, 'bear_use_atr': False, 'bear_use_adx': True, 'bear_use_spike': False, 'bear_rsi_required': True, 'sideways_strategy': 'breakout', 'sideways_bb_std_mult': 2.9095854066074955, 'sideways_rsi_os': 36, 'sideways_rsi_ob': 64, 'sideways_adx_thresh': 33.29511662233461, 'sideways_atr_min_pct': 0.011204124482890274, 'sideways_atr_max_pct': 0.1032537180177718, 'sideways_tp_mult': 2.787210506574149, 'sideways_tsl_mult': 0.8689634661375853, 'sideways_time_stop': 122, 'sideways_use_sma': True, 'sideways_use_ema': True, 'sideways_use_atr': True, 'sideways_use_adx': False, 'sideways_use_spike': True, 'sideways_rsi_required': True}.
[I 2025-08-30 21:06:37,911] Trial 156 finished with values: [-1000000000.0, 1000000000.0] and parameters: {'p_sma': 31, 'p_std': 38, 'p_atr': 10, 'p_adx': 10, 'rsi_period': 22, 'ema1': 24, 'ema2': 43, 'slip_atr_k': 0.03441192989178578, 'slip_spread_k': 0.79590451354095, 'spread_hl_frac': 0.006730648931046233, 'bb_std_mult': 0.8686210943251109, 'rsi_os': 43, 'rsi_ob': 79, 'vol_spike': 0.2769891274705921, 'adx_thresh': 34.52944737743753, 'atr_min_pct': 0.02286253190352218, 'atr_max_pct': 0.0989071562433845, 'tp_mult': 1.2345853638206463, 'tsl_mult': 0.8714404456785314, 'strategy': 'breakout', 'time_stop': 216, 'use_sma': False, 'use_atr': True, 'use_adx': False, 'use_ema': True, 'use_spike': False, 'rsi_required': False, 'edge_k': 1.5330984487985995, 'edge_cap': 0.7779754756504911, 'bull_strategy': 'breakout', 'bull_bb_std_mult': 0.7134699698098084, 'bull_rsi_os': 54, 'bull_rsi_ob': 55, 'bull_adx_thresh': 14.752308173913153, 'bull_atr_min_pct': 0.0009402922447226397, 'bull_atr_max_pct': 0.056119037872461815, 'bull_tp_mult': 1.9627511857148938, 'bull_tsl_mult': 0.32069047685996255, 'bull_time_stop': 53, 'bull_use_sma': True, 'bull_use_ema': True, 'bull_use_atr': True, 'bull_use_adx': True, 'bull_use_spike': True, 'bull_rsi_required': True, 'bear_strategy': 'mean_reversion', 'bear_bb_std_mult': 1.2362921205588915, 'bear_rsi_os': 31, 'bear_rsi_ob': 51, 'bear_adx_thresh': 17.027850356933957, 'bear_atr_min_pct': 0.017116193713908996, 'bear_atr_max_pct': 0.022732773061799057, 'bear_tp_mult': 2.9585375654991206, 'bear_tsl_mult': 0.24863252261174984, 'bear_time_stop': 255, 'bear_use_sma': True, 'bear_use_ema': False, 'bear_use_atr': False, 'bear_use_adx': True, 'bear_use_spike': False, 'bear_rsi_required': False, 'sideways_strategy': 'breakout', 'sideways_bb_std_mult': 2.642095937608259, 'sideways_rsi_os': 39, 'sideways_rsi_ob': 64, 'sideways_adx_thresh': 23.654407699559453, 'sideways_atr_min_pct': 0.006492593410458693, 'sideways_atr_max_pct': 0.012659758202889088, 'sideways_tp_mult': 2.57165092416168, 'sideways_tsl_mult': 0.27820110399679315, 'sideways_time_stop': 132, 'sideways_use_sma': True, 'sideways_use_ema': True, 'sideways_use_atr': True, 'sideways_use_adx': False, 'sideways_use_spike': True, 'sideways_rsi_required': True}.
[I 2025-08-30 21:07:13,449] Trial 158 finished with values: [-1000000000.0, 1000000000.0] and parameters: {'p_sma': 31, 'p_std': 33, 'p_atr': 15, 'p_adx': 14, 'rsi_period': 16, 'ema1': 29, 'ema2': 39, 'slip_atr_k': 0.18755945744158395, 'slip_spread_k': 0.8038725104334347, 'spread_hl_frac': 0.005043077657020806, 'bb_std_mult': 1.8893607749435175, 'rsi_os': 30, 'rsi_ob': 90, 'vol_spike': 0.28693435783739213, 'adx_thresh': 32.848870031365095, 'atr_min_pct': 0.0014742579968748907, 'atr_max_pct': 0.07416715034468455, 'tp_mult': 2.5116013054128867, 'tsl_mult': 0.9359948691149019, 'strategy': 'breakout', 'time_stop': 221, 'use_sma': False, 'use_atr': False, 'use_adx': False, 'use_ema': True, 'use_spike': False, 'rsi_required': False, 'edge_k': 0.8078071384650415, 'edge_cap': 0.6084325794830433, 'bull_strategy': 'breakout', 'bull_bb_std_mult': 1.3752043019239588, 'bull_rsi_os': 12, 'bull_rsi_ob': 59, 'bull_adx_thresh': 11.004126240335363, 'bull_atr_min_pct': 0.00012280719829397115, 'bull_atr_max_pct': 0.12793563699961688, 'bull_tp_mult': 1.7756470673658464, 'bull_tsl_mult': 0.06224944424526058, 'bull_time_stop': 106, 'bull_use_sma': True, 'bull_use_ema': True, 'bull_use_atr': True, 'bull_use_adx': True, 'bull_use_spike': True, 'bull_rsi_required': False, 'bear_strategy': 'mean_reversion', 'bear_bb_std_mult': 2.869080976240894, 'bear_rsi_os': 17, 'bear_rsi_ob': 51, 'bear_adx_thresh': 17.91969956324904, 'bear_atr_min_pct': 0.02006112597821272, 'bear_atr_max_pct': 0.053588140673363316, 'bear_tp_mult': 1.5044912474324788, 'bear_tsl_mult': 0.0005684002424847234, 'bear_time_stop': 104, 'bear_use_sma': True, 'bear_use_ema': False, 'bear_use_atr': False, 'bear_use_adx': True, 'bear_use_spike': False, 'bear_rsi_required': False, 'sideways_strategy': 'breakout', 'sideways_bb_std_mult': 2.7847018167362405, 'sideways_rsi_os': 43, 'sideways_rsi_ob': 64, 'sideways_adx_thresh': 13.301693751639782, 'sideways_atr_min_pct': 0.01127093346036205, 'sideways_atr_max_pct': 0.10328432171579816, 'sideways_tp_mult': 2.782096995894408, 'sideways_tsl_mult': 0.3368946337331946, 'sideways_time_stop': 84, 'sideways_use_sma': True, 'sideways_use_ema': True, 'sideways_use_atr': True, 'sideways_use_adx': False, 'sideways_use_spike': True, 'sideways_rsi_required': True}.
[I 2025-08-30 21:07:13,833] Trial 160 finished with values: [-1000000000.0, 1000000000.0] and parameters: {'p_sma': 31, 'p_std': 33, 'p_atr': 15, 'p_adx': 10, 'rsi_period': 17, 'ema1': 22, 'ema2': 39, 'slip_atr_k': 0.18640729433371384, 'slip_spread_k': 0.8603936243362489, 'spread_hl_frac': 0.03722921306151522, 'bb_std_mult': 0.8465767223739207, 'rsi_os': 10, 'rsi_ob': 70, 'vol_spike': 0.28803665488638247, 'adx_thresh': 22.109810537622035, 'atr_min_pct': 0.0014538328829759933, 'atr_max_pct': 0.10035665767073058, 'tp_mult': 2.523170252900429, 'tsl_mult': 0.710855262600109, 'strategy': 'breakout', 'time_stop': 218, 'use_sma': True, 'use_atr': False, 'use_adx': False, 'use_ema': True, 'use_spike': False, 'rsi_required': False, 'edge_k': 0.6063810714866497, 'edge_cap': 0.611923537563398, 'bull_strategy': 'breakout', 'bull_bb_std_mult': 2.064184969625576, 'bull_rsi_os': 12, 'bull_rsi_ob': 59, 'bull_adx_thresh': 9.9836767515307, 'bull_atr_min_pct': 0.004097256628693093, 'bull_atr_max_pct': 0.1406253185467878, 'bull_tp_mult': 2.629880982946952, 'bull_tsl_mult': 0.09400208085483408, 'bull_time_stop': 25, 'bull_use_sma': False, 'bull_use_ema': True, 'bull_use_atr': True, 'bull_use_adx': True, 'bull_use_spike': True, 'bull_rsi_required': False, 'bear_strategy': 'mean_reversion', 'bear_bb_std_mult': 1.1985028228471442, 'bear_rsi_os': 15, 'bear_rsi_ob': 49, 'bear_adx_thresh': 8.229351731654845, 'bear_atr_min_pct': 0.014303349879138602, 'bear_atr_max_pct': 0.01704878985063248, 'bear_tp_mult': 1.9068689602012097, 'bear_tsl_mult': 0.26300085369097237, 'bear_time_stop': 248, 'bear_use_sma': True, 'bear_use_ema': False, 'bear_use_atr': False, 'bear_use_adx': True, 'bear_use_spike': False, 'bear_rsi_required': False, 'sideways_strategy': 'breakout', 'sideways_bb_std_mult': 2.805341192093133, 'sideways_rsi_os': 12, 'sideways_rsi_ob': 65, 'sideways_adx_thresh': 23.924809955724715, 'sideways_atr_min_pct': 0.008984231695585354, 'sideways_atr_max_pct': 0.024016586166844843, 'sideways_tp_mult': 2.4843517648753184, 'sideways_tsl_mult': 0.2946343965145997, 'sideways_time_stop': 150, 'sideways_use_sma': True, 'sideways_use_ema': True, 'sideways_use_atr': True, 'sideways_use_adx': False, 'sideways_use_spike': True, 'sideways_rsi_required': True}.
[I 2025-08-30 21:07:14,012] Trial 159 finished with values: [-1000000000.0, 1000000000.0] and parameters: {'p_sma': 31, 'p_std': 33, 'p_atr': 15, 'p_adx': 10, 'rsi_period': 16, 'ema1': 29, 'ema2': 12, 'slip_atr_k': 0.06214879875224137, 'slip_spread_k': 0.7968336648212762, 'spread_hl_frac': 0.004946188660091716, 'bb_std_mult': 1.7701557492327553, 'rsi_os': 46, 'rsi_ob': 83, 'vol_spike': 0.1467530647935093, 'adx_thresh': 32.60618777826606, 'atr_min_pct': 0.008864611896987621, 'atr_max_pct': 0.09796598986894596, 'tp_mult': 1.520008948896269, 'tsl_mult': 0.934852928987105, 'strategy': 'breakout', 'time_stop': 218, 'use_sma': False, 'use_atr': False, 'use_adx': False, 'use_ema': True, 'use_spike': False, 'rsi_required': False, 'edge_k': 0.6309541518482679, 'edge_cap': 0.5712857005006112, 'bull_strategy': 'breakout', 'bull_bb_std_mult': 3.035680562151115, 'bull_rsi_os': 18, 'bull_rsi_ob': 52, 'bull_adx_thresh': 11.176699481791388, 'bull_atr_min_pct': 0.024758525520272752, 'bull_atr_max_pct': 0.05624507127452429, 'bull_tp_mult': 1.1115609847151378, 'bull_tsl_mult': 0.06545444500651149, 'bull_time_stop': 106, 'bull_use_sma': True, 'bull_use_ema': True, 'bull_use_atr': True, 'bull_use_adx': True, 'bull_use_spike': True, 'bull_rsi_required': False, 'bear_strategy': 'mean_reversion', 'bear_bb_std_mult': 2.819790715189383, 'bear_rsi_os': 22, 'bear_rsi_ob': 51, 'bear_adx_thresh': 18.10440938164854, 'bear_atr_min_pct': 0.019983151844844387, 'bear_atr_max_pct': 0.052671738413522656, 'bear_tp_mult': 1.4897174702423488, 'bear_tsl_mult': 0.3099916235039457, 'bear_time_stop': 179, 'bear_use_sma': True, 'bear_use_ema': False, 'bear_use_atr': False, 'bear_use_adx': True, 'bear_use_spike': False, 'bear_rsi_required': False, 'sideways_strategy': 'breakout', 'sideways_bb_std_mult': 2.8029975581454836, 'sideways_rsi_os': 43, 'sideways_rsi_ob': 65, 'sideways_adx_thresh': 21.799293779599385, 'sideways_atr_min_pct': 0.008607598852572415, 'sideways_atr_max_pct': 0.10403396573476587, 'sideways_tp_mult': 2.7852035118146725, 'sideways_tsl_mult': 0.4001219728582135, 'sideways_time_stop': 148, 'sideways_use_sma': True, 'sideways_use_ema': True, 'sideways_use_atr': True, 'sideways_use_adx': False, 'sideways_use_spike': True, 'sideways_rsi_required': True}.
[I 2025-08-30 21:07:14,296] Trial 161 finished with values: [-1000000000.0, 1000000000.0] and parameters: {'p_sma': 28, 'p_std': 32, 'p_atr': 15, 'p_adx': 29, 'rsi_period': 19, 'ema1': 11, 'ema2': 45, 'slip_atr_k': 0.060176657528217645, 'slip_spread_k': 0.8587865353693048, 'spread_hl_frac': 0.020061283379040763, 'bb_std_mult': 0.5043345831190502, 'rsi_os': 30, 'rsi_ob': 90, 'vol_spike': 0.24637203001475297, 'adx_thresh': 21.95363688397634, 'atr_min_pct': 0.0012726660622292241, 'atr_max_pct': 0.04535364615459812, 'tp_mult': 1.602203815266485, 'tsl_mult': 0.7072113273106466, 'strategy': 'mean_reversion', 'time_stop': 195, 'use_sma': True, 'use_atr': False, 'use_adx': True, 'use_ema': True, 'use_spike': True, 'rsi_required': True, 'edge_k': 0.7431699457983902, 'edge_cap': 0.6138657563165061, 'bull_strategy': 'breakout', 'bull_bb_std_mult': 3.2294574235000835, 'bull_rsi_os': 13, 'bull_rsi_ob': 59, 'bull_adx_thresh': 11.246076133696647, 'bull_atr_min_pct': 0.010899763485946432, 'bull_atr_max_pct': 0.13970862693230704, 'bull_tp_mult': 2.6350344532765053, 'bull_tsl_mult': 0.8641861065157506, 'bull_time_stop': 262, 'bull_use_sma': False, 'bull_use_ema': False, 'bull_use_atr': False, 'bull_use_adx': True, 'bull_use_spike': True, 'bull_rsi_required': False, 'bear_strategy': 'mean_reversion', 'bear_bb_std_mult': 2.6710830063878404, 'bear_rsi_os': 48, 'bear_rsi_ob': 79, 'bear_adx_thresh': 15.715617906902366, 'bear_atr_min_pct': 0.014640569681774776, 'bear_atr_max_pct': 0.016687270260262357, 'bear_tp_mult': 1.4077518417679, 'bear_tsl_mult': 0.4436709329295286, 'bear_time_stop': 188, 'bear_use_sma': True, 'bear_use_ema': False, 'bear_use_atr': False, 'bear_use_adx': True, 'bear_use_spike': True, 'bear_rsi_required': True, 'sideways_strategy': 'breakout', 'sideways_bb_std_mult': 2.7571146682267704, 'sideways_rsi_os': 21, 'sideways_rsi_ob': 66, 'sideways_adx_thresh': 13.038712146351259, 'sideways_atr_min_pct': 0.024999487759220788, 'sideways_atr_max_pct': 0.12472636730598835, 'sideways_tp_mult': 2.7399495840009656, 'sideways_tsl_mult': 0.310753943643709, 'sideways_time_stop': 270, 'sideways_use_sma': False, 'sideways_use_ema': True, 'sideways_use_atr': True, 'sideways_use_adx': False, 'sideways_use_spike': False, 'sideways_rsi_required': True}.
