[I 2025-08-30 22:23:58,483] Trial 795 finished with values: [-1000000000.0, 1000000000.0] and parameters: {'p_sma': 40, 'p_std': 48, 'p_atr': 21, 'p_adx': 22, 'rsi_period': 72, 'ema1': 9, 'ema2': 47, 'slip_atr_k': 0.01142617305054422, 'slip_spread_k': 0.6205632046829507, 'spread_hl_frac': 0.023346506306030274, 'bb_std_mult': 0.855586917160146, 'rsi_os': 13, 'rsi_ob': 72, 'vol_spike': 0.25358268555258134, 'adx_thresh': 33.40474161696315, 'atr_min_pct': 0.01375962616201053, 'atr_max_pct': 0.010062988254456201, 'tp_mult': 1.6478964303698134, 'tsl_mult': 0.8437115016687101, 'strategy': 'mean_reversion', 'time_stop': 151, 'use_sma': True, 'use_atr': True, 'use_adx': True, 'use_ema': True, 'use_spike': True, 'rsi_required': True, 'edge_k': 0.9495329844207145, 'edge_cap': 0.3087608606258758, 'bull_strategy': 'breakout', 'bull_bb_std_mult': 1.343619316264719, 'bull_rsi_os': 16, 'bull_rsi_ob': 60, 'bull_adx_thresh': 14.327606481950866, 'bull_atr_min_pct': 0.009358416656143707, 'bull_atr_max_pct': 0.07121020340528607, 'bull_tp_mult': 2.5234179040759877, 'bull_tsl_mult': 0.9610038469039512, 'bull_time_stop': 235, 'bull_use_sma': True, 'bull_use_ema': False, 'bull_use_atr': False, 'bull_use_adx': False, 'bull_use_spike': False, 'bull_rsi_required': False, 'bear_strategy': 'mean_reversion', 'bear_bb_std_mult': 2.0757471102675566, 'bear_rsi_os': 8, 'bear_rsi_ob': 73, 'bear_adx_thresh': 20.43751676639853, 'bear_atr_min_pct': 0.01950350827937917, 'bear_atr_max_pct': 0.11598207348369081, 'bear_tp_mult': 2.627945552746956, 'bear_tsl_mult': 0.37410023126788605, 'bear_time_stop': 133, 'bear_use_sma': False, 'bear_use_ema': True, 'bear_use_atr': False, 'bear_use_adx': True, 'bear_use_spike': True, 'bear_rsi_required': False, 'sideways_strategy': 'breakout', 'sideways_bb_std_mult': 1.6943546669610834, 'sideways_rsi_os': 8, 'sideways_rsi_ob': 90, 'sideways_adx_thresh': 18.917659011269862, 'sideways_atr_min_pct': 0.027040120892039984, 'sideways_atr_max_pct': 0.03844774885627852, 'sideways_tp_mult': 1.8621197070252795, 'sideways_tsl_mult': 0.7879439586792302, 'sideways_time_stop': 264, 'sideways_use_sma': False, 'sideways_use_ema': False, 'sideways_use_atr': False, 'sideways_use_adx': True, 'sideways_use_spike': False, 'sideways_rsi_required': False}.
[I 2025-08-30 22:24:32,025] Trial 793 finished with values: [-0.01574853385371755, 0.015651373645952874] and parameters: {'p_sma': 34, 'p_std': 38, 'p_atr': 21, 'p_adx': 23, 'rsi_period': 39, 'ema1': 25, 'ema2': 54, 'slip_atr_k': 0.013605580713906995, 'slip_spread_k': 0.49033970738592386, 'spread_hl_frac': 0.03411398519680489, 'bb_std_mult': 0.8242833709079571, 'rsi_os': 10, 'rsi_ob': 67, 'vol_spike': 0.2820303766423222, 'adx_thresh': 33.555858969923435, 'atr_min_pct': 0.01591273961380511, 'atr_max_pct': 0.02855909038445397, 'tp_mult': 2.2210948885285577, 'tsl_mult': 0.9277297638553362, 'strategy': 'mean_reversion', 'time_stop': 92, 'use_sma': True, 'use_atr': True, 'use_adx': True, 'use_ema': True, 'use_spike': True, 'rsi_required': True, 'edge_k': 0.9479337609075706, 'edge_cap': 0.7665840584349528, 'bull_strategy': 'breakout', 'bull_bb_std_mult': 2.17618480567712, 'bull_rsi_os': 19, 'bull_rsi_ob': 73, 'bull_adx_thresh': 12.808049757542967, 'bull_atr_min_pct': 0.0010103606356166486, 'bull_atr_max_pct': 0.07134802972135838, 'bull_tp_mult': 1.5722103970919041, 'bull_tsl_mult': 0.1388201280940347, 'bull_time_stop': 286, 'bull_use_sma': True, 'bull_use_ema': False, 'bull_use_atr': False, 'bull_use_adx': False, 'bull_use_spike': False, 'bull_rsi_required': False, 'bear_strategy': 'mean_reversion', 'bear_bb_std_mult': 2.020193981045104, 'bear_rsi_os': 9, 'bear_rsi_ob': 78, 'bear_adx_thresh': 27.67932075546185, 'bear_atr_min_pct': 0.0235403014023109, 'bear_atr_max_pct': 0.11752310884890949, 'bear_tp_mult': 1.5879584182864028, 'bear_tsl_mult': 0.43556588990483963, 'bear_time_stop': 16, 'bear_use_sma': False, 'bear_use_ema': True, 'bear_use_atr': False, 'bear_use_adx': True, 'bear_use_spike': True, 'bear_rsi_required': False, 'sideways_strategy': 'breakout', 'sideways_bb_std_mult': 3.0148089160886773, 'sideways_rsi_os': 41, 'sideways_rsi_ob': 91, 'sideways_adx_thresh': 19.02555404770105, 'sideways_atr_min_pct': 0.021030435779735537, 'sideways_atr_max_pct': 0.04655045885753428, 'sideways_tp_mult': 1.8389135612450138, 'sideways_tsl_mult': 0.7897032026346283, 'sideways_time_stop': 90, 'sideways_use_sma': False, 'sideways_use_ema': False, 'sideways_use_atr': False, 'sideways_use_adx': True, 'sideways_use_spike': False, 'sideways_rsi_required': False}.
[I 2025-08-30 22:24:32,396] Trial 792 finished with values: [-1000000000.0, 1000000000.0] and parameters: {'p_sma': 33, 'p_std': 37, 'p_atr': 21, 'p_adx': 25, 'rsi_period': 57, 'ema1': 16, 'ema2': 54, 'slip_atr_k': 0.034711604200830234, 'slip_spread_k': 0.6840343595835192, 'spread_hl_frac': 0.032942223889600684, 'bb_std_mult': 0.8541397222058612, 'rsi_os': 9, 'rsi_ob': 68, 'vol_spike': 0.1549302081475569, 'adx_thresh': 7.529089455384199, 'atr_min_pct': 0.012112695588650928, 'atr_max_pct': 0.05515796881614386, 'tp_mult': 1.6437860729879, 'tsl_mult': 0.16491474131181327, 'strategy': 'mean_reversion', 'time_stop': 96, 'use_sma': True, 'use_atr': False, 'use_adx': False, 'use_ema': True, 'use_spike': False, 'rsi_required': True, 'edge_k': 1.0498433305352053, 'edge_cap': 0.26933251807449476, 'bull_strategy': 'breakout', 'bull_bb_std_mult': 0.5683947754580105, 'bull_rsi_os': 20, 'bull_rsi_ob': 56, 'bull_adx_thresh': 12.71892595732497, 'bull_atr_min_pct': 0.0017631424399255813, 'bull_atr_max_pct': 0.06356069743344508, 'bull_tp_mult': 1.364669134857515, 'bull_tsl_mult': 0.41931686870764645, 'bull_time_stop': 289, 'bull_use_sma': True, 'bull_use_ema': False, 'bull_use_atr': False, 'bull_use_adx': False, 'bull_use_spike': False, 'bull_rsi_required': False, 'bear_strategy': 'mean_reversion', 'bear_bb_std_mult': 1.8326535822634968, 'bear_rsi_os': 9, 'bear_rsi_ob': 78, 'bear_adx_thresh': 30.593351119648943, 'bear_atr_min_pct': 0.02359190575459511, 'bear_atr_max_pct': 0.11997375477593143, 'bear_tp_mult': 1.470639689154625, 'bear_tsl_mult': 0.23978952854386437, 'bear_time_stop': 248, 'bear_use_sma': False, 'bear_use_ema': True, 'bear_use_atr': False, 'bear_use_adx': True, 'bear_use_spike': True, 'bear_rsi_required': False, 'sideways_strategy': 'breakout', 'sideways_bb_std_mult': 2.223072173302257, 'sideways_rsi_os': 41, 'sideways_rsi_ob': 91, 'sideways_adx_thresh': 26.42445811122726, 'sideways_atr_min_pct': 0.01950051454181689, 'sideways_atr_max_pct': 0.04315759771474735, 'sideways_tp_mult': 2.4651914555343057, 'sideways_tsl_mult': 0.7892512957213034, 'sideways_time_stop': 256, 'sideways_use_sma': False, 'sideways_use_ema': False, 'sideways_use_atr': True, 'sideways_use_adx': True, 'sideways_use_spike': False, 'sideways_rsi_required': False}.
[I 2025-08-30 22:24:32,414] Trial 794 finished with values: [-1000000000.0, 1000000000.0] and parameters: {'p_sma': 39, 'p_std': 39, 'p_atr': 21, 'p_adx': 23, 'rsi_period': 75, 'ema1': 25, 'ema2': 54, 'slip_atr_k': 0.03466204451533811, 'slip_spread_k': 0.7630009570882536, 'spread_hl_frac': 0.016529029488324326, 'bb_std_mult': 1.9456992486632299, 'rsi_os': 13, 'rsi_ob': 67, 'vol_spike': 0.140922381855481, 'adx_thresh': 15.961137512981871, 'atr_min_pct': 0.012830322992833758, 'atr_max_pct': 0.0577399406508317, 'tp_mult': 1.6324321075132961, 'tsl_mult': 0.9176591445405426, 'strategy': 'mean_reversion', 'time_stop': 90, 'use_sma': True, 'use_atr': True, 'use_adx': True, 'use_ema': True, 'use_spike': True, 'rsi_required': True, 'edge_k': 1.0536284765732384, 'edge_cap': 0.301910925142181, 'bull_strategy': 'breakout', 'bull_bb_std_mult': 2.977583701814899, 'bull_rsi_os': 19, 'bull_rsi_ob': 73, 'bull_adx_thresh': 12.538017559836144, 'bull_atr_min_pct': 0.028733187627203137, 'bull_atr_max_pct': 0.12516089741764888, 'bull_tp_mult': 1.3641281062615926, 'bull_tsl_mult': 0.9581987448667477, 'bull_time_stop': 288, 'bull_use_sma': True, 'bull_use_ema': False, 'bull_use_atr': False, 'bull_use_adx': False, 'bull_use_spike': False, 'bull_rsi_required': False, 'bear_strategy': 'mean_reversion', 'bear_bb_std_mult': 3.4011662416058432, 'bear_rsi_os': 9, 'bear_rsi_ob': 78, 'bear_adx_thresh': 27.76138218896862, 'bear_atr_min_pct': 0.029970360502607762, 'bear_atr_max_pct': 0.11699753991223416, 'bear_tp_mult': 1.6023032668099586, 'bear_tsl_mult': 0.3362742684370091, 'bear_time_stop': 123, 'bear_use_sma': False, 'bear_use_ema': True, 'bear_use_atr': False, 'bear_use_adx': True, 'bear_use_spike': True, 'bear_rsi_required': False, 'sideways_strategy': 'breakout', 'sideways_bb_std_mult': 1.8691242928201317, 'sideways_rsi_os': 32, 'sideways_rsi_ob': 91, 'sideways_adx_thresh': 18.966222488635474, 'sideways_atr_min_pct': 0.019405216642080753, 'sideways_atr_max_pct': 0.0387307456451006, 'sideways_tp_mult': 2.4422033859845174, 'sideways_tsl_mult': 0.13690418373910063, 'sideways_time_stop': 256, 'sideways_use_sma': False, 'sideways_use_ema': False, 'sideways_use_atr': False, 'sideways_use_adx': True, 'sideways_use_spike': False, 'sideways_rsi_required': False}.
[I 2025-08-30 22:24:33,301] Trial 796 finished with values: [-1000000000.0, 1000000000.0] and parameters: {'p_sma': 17, 'p_std': 39, 'p_atr': 20, 'p_adx': 23, 'rsi_period': 40, 'ema1': 10, 'ema2': 54, 'slip_atr_k': 0.13352692535455088, 'slip_spread_k': 0.668495536028477, 'spread_hl_frac': 0.034452173277189926, 'bb_std_mult': 3.2658175402031766, 'rsi_os': 10, 'rsi_ob': 68, 'vol_spike': 0.2831262719909465, 'adx_thresh': 9.88922131833566, 'atr_min_pct': 0.027877740017507063, 'atr_max_pct': 0.05524092873016554, 'tp_mult': 1.9615652096722884, 'tsl_mult': 0.40264719537564425, 'strategy': 'mean_reversion', 'time_stop': 32, 'use_sma': False, 'use_atr': True, 'use_adx': True, 'use_ema': True, 'use_spike': True, 'rsi_required': True, 'edge_k': 1.0712694197473325, 'edge_cap': 0.2773423930932287, 'bull_strategy': 'breakout', 'bull_bb_std_mult': 1.8944668843596897, 'bull_rsi_os': 6, 'bull_rsi_ob': 66, 'bull_adx_thresh': 12.580015824926463, 'bull_atr_min_pct': 0.00840412383395122, 'bull_atr_max_pct': 0.04985917582428693, 'bull_tp_mult': 1.3901808192023286, 'bull_tsl_mult': 0.6653164738271339, 'bull_time_stop': 286, 'bull_use_sma': True, 'bull_use_ema': False, 'bull_use_atr': False, 'bull_use_adx': False, 'bull_use_spike': False, 'bull_rsi_required': True, 'bear_strategy': 'mean_reversion', 'bear_bb_std_mult': 1.3637113133956809, 'bear_rsi_os': 6, 'bear_rsi_ob': 72, 'bear_adx_thresh': 27.639118549143443, 'bear_atr_min_pct': 0.008104767694085153, 'bear_atr_max_pct': 0.037194248802218145, 'bear_tp_mult': 1.5990260352617747, 'bear_tsl_mult': 0.3364256289066811, 'bear_time_stop': 215, 'bear_use_sma': False, 'bear_use_ema': True, 'bear_use_atr': False, 'bear_use_adx': True, 'bear_use_spike': True, 'bear_rsi_required': True, 'sideways_strategy': 'breakout', 'sideways_bb_std_mult': 2.008550011656892, 'sideways_rsi_os': 46, 'sideways_rsi_ob': 92, 'sideways_adx_thresh': 29.232276179401776, 'sideways_atr_min_pct': 0.019533859146149784, 'sideways_atr_max_pct': 0.04632096673818635, 'sideways_tp_mult': 1.8197560499748118, 'sideways_tsl_mult': 0.07302756688570877, 'sideways_time_stop': 256, 'sideways_use_sma': False, 'sideways_use_ema': False, 'sideways_use_atr': False, 'sideways_use_adx': True, 'sideways_use_spike': False, 'sideways_rsi_required': False}.
[I 2025-08-30 22:24:34,416] Trial 798 finished with values: [-1000000000.0, 1000000000.0] and parameters: {'p_sma': 35, 'p_std': 34, 'p_atr': 20, 'p_adx': 21, 'rsi_period': 78, 'ema1': 10, 'ema2': 56, 'slip_atr_k': 0.21737287986751547, 'slip_spread_k': 0.6685531312948456, 'spread_hl_frac': 0.03390212287114441, 'bb_std_mult': 0.6335913483950721, 'rsi_os': 12, 'rsi_ob': 52, 'vol_spike': 0.11229538070706424, 'adx_thresh': 11.875908147208792, 'atr_min_pct': 0.02590283806919197, 'atr_max_pct': 0.024332873670838664, 'tp_mult': 1.2549837587496158, 'tsl_mult': 0.401733517745828, 'strategy': 'mean_reversion', 'time_stop': 221, 'use_sma': False, 'use_atr': True, 'use_adx': True, 'use_ema': True, 'use_spike': True, 'rsi_required': True, 'edge_k': 0.946348220409318, 'edge_cap': 0.47108690986034063, 'bull_strategy': 'mean_reversion', 'bull_bb_std_mult': 2.1584097705133924, 'bull_rsi_os': 54, 'bull_rsi_ob': 88, 'bull_adx_thresh': 19.41609101658721, 'bull_atr_min_pct': 0.008347837239310388, 'bull_atr_max_pct': 0.05085763457703782, 'bull_tp_mult': 1.2535628428082624, 'bull_tsl_mult': 0.7891326173103734, 'bull_time_stop': 160, 'bull_use_sma': False, 'bull_use_ema': False, 'bull_use_atr': False, 'bull_use_adx': True, 'bull_use_spike': True, 'bull_rsi_required': True, 'bear_strategy': 'mean_reversion', 'bear_bb_std_mult': 1.3859338816629523, 'bear_rsi_os': 6, 'bear_rsi_ob': 72, 'bear_adx_thresh': 27.70015947431173, 'bear_atr_min_pct': 0.008629055778472937, 'bear_atr_max_pct': 0.12328775347433586, 'bear_tp_mult': 2.136408781891777, 'bear_tsl_mult': 0.20481662781631443, 'bear_time_stop': 294, 'bear_use_sma': False, 'bear_use_ema': False, 'bear_use_atr': False, 'bear_use_adx': True, 'bear_use_spike': True, 'bear_rsi_required': True, 'sideways_strategy': 'mean_reversion', 'sideways_bb_std_mult': 1.6432438634351565, 'sideways_rsi_os': 39, 'sideways_rsi_ob': 56, 'sideways_adx_thresh': 29.340877125095872, 'sideways_atr_min_pct': 0.02123347687023535, 'sideways_atr_max_pct': 0.032759863293783824, 'sideways_tp_mult': 1.8228749305511567, 'sideways_tsl_mult': 0.9464829772326391, 'sideways_time_stop': 108, 'sideways_use_sma': False, 'sideways_use_ema': True, 'sideways_use_atr': False, 'sideways_use_adx': False, 'sideways_use_spike': False, 'sideways_rsi_required': True}.
[I 2025-08-30 22:25:08,284] Trial 797 finished with values: [-1000000000.0, 1000000000.0] and parameters: {'p_sma': 35, 'p_std': 39, 'p_atr': 20, 'p_adx': 23, 'rsi_period': 47, 'ema1': 25, 'ema2': 16, 'slip_atr_k': 0.13175077913105304, 'slip_spread_k': 0.6665268539131067, 'spread_hl_frac': 0.03437245190642141, 'bb_std_mult': 3.251344218577824, 'rsi_os': 10, 'rsi_ob': 67, 'vol_spike': 0.29987419350382205, 'adx_thresh': 12.704646612983733, 'atr_min_pct': 0.012896487323055551, 'atr_max_pct': 0.08061590083556198, 'tp_mult': 1.7174639777453058, 'tsl_mult': 0.14035089523060273, 'strategy': 'mean_reversion', 'time_stop': 64, 'use_sma': False, 'use_atr': True, 'use_adx': True, 'use_ema': True, 'use_spike': True, 'rsi_required': True, 'edge_k': 1.0661214728611736, 'edge_cap': 0.46784207199006383, 'bull_strategy': 'mean_reversion', 'bull_bb_std_mult': 2.8747509501297945, 'bull_rsi_os': 19, 'bull_rsi_ob': 73, 'bull_adx_thresh': 12.614346820676138, 'bull_atr_min_pct': 0.02185024644829595, 'bull_atr_max_pct': 0.049209513781088905, 'bull_tp_mult': 1.4832996743259, 'bull_tsl_mult': 0.7932158297726551, 'bull_time_stop': 192, 'bull_use_sma': False, 'bull_use_ema': False, 'bull_use_atr': False, 'bull_use_adx': False, 'bull_use_spike': False, 'bull_rsi_required': True, 'bear_strategy': 'mean_reversion', 'bear_bb_std_mult': 1.6679368650904205, 'bear_rsi_os': 6, 'bear_rsi_ob': 72, 'bear_adx_thresh': 27.56444659279753, 'bear_atr_min_pct': 0.018670516882345976, 'bear_atr_max_pct': 0.12196691199172471, 'bear_tp_mult': 1.6064060589432443, 'bear_tsl_mult': 0.24280403456303, 'bear_time_stop': 248, 'bear_use_sma': False, 'bear_use_ema': False, 'bear_use_atr': False, 'bear_use_adx': True, 'bear_use_spike': True, 'bear_rsi_required': True, 'sideways_strategy': 'breakout', 'sideways_bb_std_mult': 1.911058896812458, 'sideways_rsi_os': 39, 'sideways_rsi_ob': 92, 'sideways_adx_thresh': 26.280134055780202, 'sideways_atr_min_pct': 0.021297621393758837, 'sideways_atr_max_pct': 0.06706659099925155, 'sideways_tp_mult': 1.8182135093765976, 'sideways_tsl_mult': 0.7904114841488932, 'sideways_time_stop': 256, 'sideways_use_sma': False, 'sideways_use_ema': False, 'sideways_use_atr': False, 'sideways_use_adx': True, 'sideways_use_spike': False, 'sideways_rsi_required': False}.
[I 2025-08-30 22:25:08,848] Trial 800 finished with values: [-0.019387522651979405, 0.01935042612217955] and parameters: {'p_sma': 56, 'p_std': 31, 'p_atr': 20, 'p_adx': 21, 'rsi_period': 46, 'ema1': 11, 'ema2': 56, 'slip_atr_k': 0.022444998790002883, 'slip_spread_k': 0.48752676608831436, 'spread_hl_frac': 0.018150225378182214, 'bb_std_mult': 0.9298298834624779, 'rsi_os': 12, 'rsi_ob': 74, 'vol_spike': 0.2766524458158217, 'adx_thresh': 11.94878870150225, 'atr_min_pct': 0.004009026393502112, 'atr_max_pct': 0.061630124894974055, 'tp_mult': 1.7059643870902628, 'tsl_mult': 0.9348619123043741, 'strategy': 'mean_reversion', 'time_stop': 85, 'use_sma': False, 'use_atr': True, 'use_adx': True, 'use_ema': True, 'use_spike': True, 'rsi_required': False, 'edge_k': 0.9510965508484334, 'edge_cap': 0.7695356380971508, 'bull_strategy': 'mean_reversion', 'bull_bb_std_mult': 0.5031361739783897, 'bull_rsi_os': 17, 'bull_rsi_ob': 88, 'bull_adx_thresh': 19.097572589424445, 'bull_atr_min_pct': 0.0011504679616257184, 'bull_atr_max_pct': 0.02231201169387871, 'bull_tp_mult': 1.160902375027566, 'bull_tsl_mult': 0.4711050926857894, 'bull_time_stop': 295, 'bull_use_sma': False, 'bull_use_ema': False, 'bull_use_atr': True, 'bull_use_adx': True, 'bull_use_spike': True, 'bull_rsi_required': True, 'bear_strategy': 'mean_reversion', 'bear_bb_std_mult': 2.0076594299942743, 'bear_rsi_os': 6, 'bear_rsi_ob': 69, 'bear_adx_thresh': 19.250667780313194, 'bear_atr_min_pct': 0.007373580146063874, 'bear_atr_max_pct': 0.12288369033652122, 'bear_tp_mult': 2.138726478095116, 'bear_tsl_mult': 0.1975969942844058, 'bear_time_stop': 139, 'bear_use_sma': False, 'bear_use_ema': False, 'bear_use_atr': False, 'bear_use_adx': True, 'bear_use_spike': True, 'bear_rsi_required': True, 'sideways_strategy': 'mean_reversion', 'sideways_bb_std_mult': 3.0446662931767294, 'sideways_rsi_os': 39, 'sideways_rsi_ob': 90, 'sideways_adx_thresh': 22.96865297384015, 'sideways_atr_min_pct': 0.00562948319614715, 'sideways_atr_max_pct': 0.029145168748700642, 'sideways_tp_mult': 1.706178295561587, 'sideways_tsl_mult': 0.8198706059755406, 'sideways_time_stop': 156, 'sideways_use_sma': False, 'sideways_use_ema': True, 'sideways_use_atr': False, 'sideways_use_adx': False, 'sideways_use_spike': False, 'sideways_rsi_required': True}.
[I 2025-08-30 22:25:09,301] Trial 799 finished with values: [-1000000000.0, 1000000000.0] and parameters: {'p_sma': 35, 'p_std': 34, 'p_atr': 20, 'p_adx': 21, 'rsi_period': 40, 'ema1': 10, 'ema2': 56, 'slip_atr_k': 0.13260002692625497, 'slip_spread_k': 0.6300890931664531, 'spread_hl_frac': 0.029066666158855965, 'bb_std_mult': 0.663418569971299, 'rsi_os': 18, 'rsi_ob': 66, 'vol_spike': 0.11300428476806247, 'adx_thresh': 12.878424320607138, 'atr_min_pct': 0.015938523435414097, 'atr_max_pct': 0.025163673192098553, 'tp_mult': 2.4120491055866946, 'tsl_mult': 0.9464148778803118, 'strategy': 'mean_reversion', 'time_stop': 220, 'use_sma': False, 'use_atr': True, 'use_adx': True, 'use_ema': True, 'use_spike': True, 'rsi_required': True, 'edge_k': 0.9429271643073799, 'edge_cap': 0.07704570657677673, 'bull_strategy': 'mean_reversion', 'bull_bb_std_mult': 2.1351446668921104, 'bull_rsi_os': 7, 'bull_rsi_ob': 45, 'bull_adx_thresh': 21.475200018354982, 'bull_atr_min_pct': 0.021778974198034092, 'bull_atr_max_pct': 0.04895843181944333, 'bull_tp_mult': 1.4044437708624522, 'bull_tsl_mult': 0.7894571515926943, 'bull_time_stop': 191, 'bull_use_sma': False, 'bull_use_ema': False, 'bull_use_atr': False, 'bull_use_adx': True, 'bull_use_spike': True, 'bull_rsi_required': True, 'bear_strategy': 'mean_reversion', 'bear_bb_std_mult': 2.0025142326337595, 'bear_rsi_os': 6, 'bear_rsi_ob': 90, 'bear_adx_thresh': 27.580381188477674, 'bear_atr_min_pct': 0.008668598775988539, 'bear_atr_max_pct': 0.11398981791778424, 'bear_tp_mult': 2.096287079871813, 'bear_tsl_mult': 0.41146604506069645, 'bear_time_stop': 15, 'bear_use_sma': False, 'bear_use_ema': False, 'bear_use_atr': False, 'bear_use_adx': True, 'bear_use_spike': True, 'bear_rsi_required': True, 'sideways_strategy': 'mean_reversion', 'sideways_bb_std_mult': 2.0054444506056366, 'sideways_rsi_os': 39, 'sideways_rsi_ob': 70, 'sideways_adx_thresh': 32.9800330882116, 'sideways_atr_min_pct': 0.005779028362072121, 'sideways_atr_max_pct': 0.04690491006509047, 'sideways_tp_mult': 1.6898932283800578, 'sideways_tsl_mult': 0.16302612308846776, 'sideways_time_stop': 154, 'sideways_use_sma': False, 'sideways_use_ema': True, 'sideways_use_atr': False, 'sideways_use_adx': False, 'sideways_use_spike': False, 'sideways_rsi_required': True}.
