[I 2025-08-30 21:44:51,330] Trial 450 finished with values: [-1000000000.0, 1000000000.0] and parameters: {'p_sma': 37, 'p_std': 36, 'p_atr': 22, 'p_adx': 20, 'rsi_period': 69, 'ema1': 11, 'ema2': 58, 'slip_atr_k': 0.03201028442959859, 'slip_spread_k': 0.674344712401273, 'spread_hl_frac': 0.03521846471590373, 'bb_std_mult': 0.737557859612638, 'rsi_os': 28, 'rsi_ob': 87, 'vol_spike': 0.2772623673586884, 'adx_thresh': 11.105658115236688, 'atr_min_pct': 0.012951363627519197, 'atr_max_pct': 0.03350320555253404, 'tp_mult': 2.3288482311412464, 'tsl_mult': 0.40405244285922426, 'strategy': 'breakout', 'time_stop': 74, 'use_sma': True, 'use_atr': True, 'use_adx': False, 'use_ema': False, 'use_spike': False, 'rsi_required': False, 'edge_k': 0.9430704693574979, 'edge_cap': 0.836526732500087, 'bull_strategy': 'mean_reversion', 'bull_bb_std_mult': 1.7680792209892011, 'bull_rsi_os': 33, 'bull_rsi_ob': 89, 'bull_adx_thresh': 31.89849908597769, 'bull_atr_min_pct': 0.0017898573105058183, 'bull_atr_max_pct': 0.09127307458565247, 'bull_tp_mult': 1.5176964056883846, 'bull_tsl_mult': 0.388941563421266, 'bull_time_stop': 295, 'bull_use_sma': True, 'bull_use_ema': True, 'bull_use_atr': True, 'bull_use_adx': False, 'bull_use_spike': False, 'bull_rsi_required': True, 'bear_strategy': 'mean_reversion', 'bear_bb_std_mult': 2.0368184674421626, 'bear_rsi_os': 6, 'bear_rsi_ob': 72, 'bear_adx_thresh': 29.11269418810404, 'bear_atr_min_pct': 0.02986584998793777, 'bear_atr_max_pct': 0.11401793214405859, 'bear_tp_mult': 1.5907804835534145, 'bear_tsl_mult': 0.39826730784610254, 'bear_time_stop': 268, 'bear_use_sma': False, 'bear_use_ema': True, 'bear_use_atr': True, 'bear_use_adx': True, 'bear_use_spike': False, 'bear_rsi_required': False, 'sideways_strategy': 'breakout', 'sideways_bb_std_mult': 1.6726738974833284, 'sideways_rsi_os': 39, 'sideways_rsi_ob': 90, 'sideways_adx_thresh': 23.095343755727416, 'sideways_atr_min_pct': 0.02321343520872836, 'sideways_atr_max_pct': 0.042884657241848846, 'sideways_tp_mult': 1.7917277321663074, 'sideways_tsl_mult': 0.7339413034074815, 'sideways_time_stop': 256, 'sideways_use_sma': True, 'sideways_use_ema': False, 'sideways_use_atr': False, 'sideways_use_adx': True, 'sideways_use_spike': False, 'sideways_rsi_required': False}.
[I 2025-08-30 21:44:51,446] Trial 451 finished with values: [-1000000000.0, 1000000000.0] and parameters: {'p_sma': 33, 'p_std': 36, 'p_atr': 22, 'p_adx': 20, 'rsi_period': 57, 'ema1': 11, 'ema2': 58, 'slip_atr_k': 0.10683501744436395, 'slip_spread_k': 0.6719447532537325, 'spread_hl_frac': 0.035582320746827996, 'bb_std_mult': 0.7565771208303869, 'rsi_os': 27, 'rsi_ob': 87, 'vol_spike': 0.2788650276707, 'adx_thresh': 8.625402364890533, 'atr_min_pct': 0.012497164140992775, 'atr_max_pct': 0.03397580675563419, 'tp_mult': 2.6008503961616425, 'tsl_mult': 0.9440849522896707, 'strategy': 'breakout', 'time_stop': 70, 'use_sma': True, 'use_atr': True, 'use_adx': False, 'use_ema': False, 'use_spike': False, 'rsi_required': False, 'edge_k': 0.9607042910711214, 'edge_cap': 0.8321250128053093, 'bull_strategy': 'mean_reversion', 'bull_bb_std_mult': 2.0517012370967693, 'bull_rsi_os': 17, 'bull_rsi_ob': 89, 'bull_adx_thresh': 30.93491678228137, 'bull_atr_min_pct': 0.002588349316300788, 'bull_atr_max_pct': 0.02207183170096126, 'bull_tp_mult': 1.5057310503563057, 'bull_tsl_mult': 0.6985620764810624, 'bull_time_stop': 294, 'bull_use_sma': True, 'bull_use_ema': True, 'bull_use_atr': True, 'bull_use_adx': False, 'bull_use_spike': False, 'bull_rsi_required': True, 'bear_strategy': 'mean_reversion', 'bear_bb_std_mult': 2.034446487068777, 'bear_rsi_os': 6, 'bear_rsi_ob': 74, 'bear_adx_thresh': 28.838112306551707, 'bear_atr_min_pct': 0.02999462441851958, 'bear_atr_max_pct': 0.11359400827520293, 'bear_tp_mult': 1.5924032596343383, 'bear_tsl_mult': 0.39581370842334357, 'bear_time_stop': 208, 'bear_use_sma': False, 'bear_use_ema': True, 'bear_use_atr': True, 'bear_use_adx': True, 'bear_use_spike': False, 'bear_rsi_required': False, 'sideways_strategy': 'breakout', 'sideways_bb_std_mult': 3.040651463170304, 'sideways_rsi_os': 12, 'sideways_rsi_ob': 53, 'sideways_adx_thresh': 25.540623771024066, 'sideways_atr_min_pct': 0.0034329950188947064, 'sideways_atr_max_pct': 0.04346276836216045, 'sideways_tp_mult': 1.7244684171411107, 'sideways_tsl_mult': 0.7959619773353455, 'sideways_time_stop': 256, 'sideways_use_sma': True, 'sideways_use_ema': False, 'sideways_use_atr': False, 'sideways_use_adx': True, 'sideways_use_spike': False, 'sideways_rsi_required': False}.
[I 2025-08-30 21:45:26,555] Trial 454 finished with values: [-0.019300138203633965, 0.019203267357632992] and parameters: {'p_sma': 33, 'p_std': 36, 'p_atr': 21, 'p_adx': 22, 'rsi_period': 57, 'ema1': 11, 'ema2': 52, 'slip_atr_k': 0.030473266760536195, 'slip_spread_k': 0.6368563302705568, 'spread_hl_frac': 0.03264439468281393, 'bb_std_mult': 0.7824256673197655, 'rsi_os': 11, 'rsi_ob': 66, 'vol_spike': 0.12334715028968857, 'adx_thresh': 12.038791900188572, 'atr_min_pct': 0.013418261411967376, 'atr_max_pct': 0.014924199244752055, 'tp_mult': 1.986849854549596, 'tsl_mult': 0.8815810261049624, 'strategy': 'mean_reversion', 'time_stop': 71, 'use_sma': True, 'use_atr': True, 'use_adx': True, 'use_ema': True, 'use_spike': True, 'rsi_required': True, 'edge_k': 0.82539315449169, 'edge_cap': 0.8505588379539797, 'bull_strategy': 'mean_reversion', 'bull_bb_std_mult': 2.04094853077558, 'bull_rsi_os': 35, 'bull_rsi_ob': 88, 'bull_adx_thresh': 7.736100605744296, 'bull_atr_min_pct': 0.0010227089272889641, 'bull_atr_max_pct': 0.11667267949321533, 'bull_tp_mult': 1.4738014290625676, 'bull_tsl_mult': 0.4045076244267027, 'bull_time_stop': 24, 'bull_use_sma': True, 'bull_use_ema': False, 'bull_use_atr': False, 'bull_use_adx': False, 'bull_use_spike': False, 'bull_rsi_required': True, 'bear_strategy': 'mean_reversion', 'bear_bb_std_mult': 1.966013878089595, 'bear_rsi_os': 8, 'bear_rsi_ob': 69, 'bear_adx_thresh': 27.857030032478875, 'bear_atr_min_pct': 0.028878795112819277, 'bear_atr_max_pct': 0.12312377879298061, 'bear_tp_mult': 1.4868565929793307, 'bear_tsl_mult': 0.7298670046732841, 'bear_time_stop': 237, 'bear_use_sma': False, 'bear_use_ema': True, 'bear_use_atr': False, 'bear_use_adx': True, 'bear_use_spike': True, 'bear_rsi_required': True, 'sideways_strategy': 'breakout', 'sideways_bb_std_mult': 3.027996210492595, 'sideways_rsi_os': 39, 'sideways_rsi_ob': 89, 'sideways_adx_thresh': 20.149999803396113, 'sideways_atr_min_pct': 0.02045130496235118, 'sideways_atr_max_pct': 0.04477992610016829, 'sideways_tp_mult': 1.7222875672927622, 'sideways_tsl_mult': 0.7989920254251706, 'sideways_time_stop': 269, 'sideways_use_sma': False, 'sideways_use_ema': False, 'sideways_use_atr': False, 'sideways_use_adx': True, 'sideways_use_spike': False, 'sideways_rsi_required': False}.
[I 2025-08-30 21:45:26,884] Trial 453 finished with values: [-0.020382860702497396, 0.020287569904858496] and parameters: {'p_sma': 37, 'p_std': 36, 'p_atr': 21, 'p_adx': 22, 'rsi_period': 72, 'ema1': 11, 'ema2': 58, 'slip_atr_k': 0.10693877655886763, 'slip_spread_k': 0.6343319921973639, 'spread_hl_frac': 0.03253867357277788, 'bb_std_mult': 0.7806080052438715, 'rsi_os': 11, 'rsi_ob': 95, 'vol_spike': 0.13298355389667643, 'adx_thresh': 11.824240980672434, 'atr_min_pct': 0.012920278502960477, 'atr_max_pct': 0.013819419823529255, 'tp_mult': 2.5248604432430275, 'tsl_mult': 0.8769504704261849, 'strategy': 'mean_reversion', 'time_stop': 75, 'use_sma': True, 'use_atr': True, 'use_adx': True, 'use_ema': True, 'use_spike': True, 'rsi_required': True, 'edge_k': 0.21265286882996948, 'edge_cap': 0.8390019078045146, 'bull_strategy': 'mean_reversion', 'bull_bb_std_mult': 1.9454989858484693, 'bull_rsi_os': 8, 'bull_rsi_ob': 87, 'bull_adx_thresh': 12.2549936597272, 'bull_atr_min_pct': 0.001218037962453565, 'bull_atr_max_pct': 0.13171880979729758, 'bull_tp_mult': 1.416114470348212, 'bull_tsl_mult': 0.39020224885380883, 'bull_time_stop': 162, 'bull_use_sma': True, 'bull_use_ema': False, 'bull_use_atr': False, 'bull_use_adx': False, 'bull_use_spike': False, 'bull_rsi_required': True, 'bear_strategy': 'mean_reversion', 'bear_bb_std_mult': 1.8603376555669644, 'bear_rsi_os': 6, 'bear_rsi_ob': 69, 'bear_adx_thresh': 27.562291911424225, 'bear_atr_min_pct': 0.0017649437250407182, 'bear_atr_max_pct': 0.1220699287552783, 'bear_tp_mult': 2.334077037836242, 'bear_tsl_mult': 0.42207605519516583, 'bear_time_stop': 240, 'bear_use_sma': False, 'bear_use_ema': True, 'bear_use_atr': False, 'bear_use_adx': True, 'bear_use_spike': True, 'bear_rsi_required': True, 'sideways_strategy': 'breakout', 'sideways_bb_std_mult': 1.6754157421679872, 'sideways_rsi_os': 39, 'sideways_rsi_ob': 70, 'sideways_adx_thresh': 17.07307497104931, 'sideways_atr_min_pct': 0.023431600559759697, 'sideways_atr_max_pct': 0.04501291802322855, 'sideways_tp_mult': 1.746475018517234, 'sideways_tsl_mult': 0.7992175580248921, 'sideways_time_stop': 189, 'sideways_use_sma': False, 'sideways_use_ema': False, 'sideways_use_atr': False, 'sideways_use_adx': True, 'sideways_use_spike': False, 'sideways_rsi_required': False}.
[I 2025-08-30 21:45:26,904] Trial 452 finished with values: [-1000000000.0, 1000000000.0] and parameters: {'p_sma': 37, 'p_std': 36, 'p_atr': 21, 'p_adx': 22, 'rsi_period': 72, 'ema1': 11, 'ema2': 52, 'slip_atr_k': 0.03251201422615435, 'slip_spread_k': 0.6326389582069497, 'spread_hl_frac': 0.03298219290026013, 'bb_std_mult': 0.7604214374338649, 'rsi_os': 37, 'rsi_ob': 87, 'vol_spike': 0.13430838145579202, 'adx_thresh': 11.955352312742175, 'atr_min_pct': 0.01480830779767818, 'atr_max_pct': 0.015608475890945984, 'tp_mult': 2.4482686797642677, 'tsl_mult': 0.20719526357249357, 'strategy': 'mean_reversion', 'time_stop': 75, 'use_sma': True, 'use_atr': True, 'use_adx': True, 'use_ema': True, 'use_spike': True, 'rsi_required': True, 'edge_k': 0.8391309865385275, 'edge_cap': 0.846658746760505, 'bull_strategy': 'mean_reversion', 'bull_bb_std_mult': 2.047978074590297, 'bull_rsi_os': 17, 'bull_rsi_ob': 87, 'bull_adx_thresh': 8.190280379301903, 'bull_atr_min_pct': 0.02993570381522763, 'bull_atr_max_pct': 0.116345594775388, 'bull_tp_mult': 1.4759674782514156, 'bull_tsl_mult': 0.3870377031463892, 'bull_time_stop': 125, 'bull_use_sma': True, 'bull_use_ema': False, 'bull_use_atr': False, 'bull_use_adx': False, 'bull_use_spike': False, 'bull_rsi_required': True, 'bear_strategy': 'mean_reversion', 'bear_bb_std_mult': 1.9633842029235617, 'bear_rsi_os': 6, 'bear_rsi_ob': 70, 'bear_adx_thresh': 27.81218486507176, 'bear_atr_min_pct': 0.02998485041396155, 'bear_atr_max_pct': 0.12415980934552048, 'bear_tp_mult': 1.5962780202539228, 'bear_tsl_mult': 0.14561775060109994, 'bear_time_stop': 238, 'bear_use_sma': False, 'bear_use_ema': True, 'bear_use_atr': False, 'bear_use_adx': True, 'bear_use_spike': True, 'bear_rsi_required': True, 'sideways_strategy': 'breakout', 'sideways_bb_std_mult': 1.6758855458260387, 'sideways_rsi_os': 12, 'sideways_rsi_ob': 89, 'sideways_adx_thresh': 25.374161896999674, 'sideways_atr_min_pct': 0.022774729436615244, 'sideways_atr_max_pct': 0.04412768290689161, 'sideways_tp_mult': 1.7270994384892193, 'sideways_tsl_mult': 0.7956635976149438, 'sideways_time_stop': 296, 'sideways_use_sma': False, 'sideways_use_ema': False, 'sideways_use_atr': False, 'sideways_use_adx': True, 'sideways_use_spike': False, 'sideways_rsi_required': False}.
[I 2025-08-30 21:45:27,009] Trial 455 finished with values: [-1000000000.0, 1000000000.0] and parameters: {'p_sma': 38, 'p_std': 38, 'p_atr': 21, 'p_adx': 22, 'rsi_period': 72, 'ema1': 11, 'ema2': 52, 'slip_atr_k': 0.19868385287106244, 'slip_spread_k': 0.6362200752266476, 'spread_hl_frac': 0.032803662380231254, 'bb_std_mult': 0.8815852771239893, 'rsi_os': 11, 'rsi_ob': 66, 'vol_spike': 0.12275557994956447, 'adx_thresh': 11.949439522473698, 'atr_min_pct': 0.014590957302137197, 'atr_max_pct': 0.04784890269779325, 'tp_mult': 1.6349404976984916, 'tsl_mult': 0.8793616297325958, 'strategy': 'mean_reversion', 'time_stop': 81, 'use_sma': True, 'use_atr': False, 'use_adx': True, 'use_ema': True, 'use_spike': True, 'rsi_required': True, 'edge_k': 0.4059139153200827, 'edge_cap': 0.8564215868595748, 'bull_strategy': 'breakout', 'bull_bb_std_mult': 1.9365316659849787, 'bull_rsi_os': 35, 'bull_rsi_ob': 87, 'bull_adx_thresh': 29.408759364489892, 'bull_atr_min_pct': 0.000876062122645927, 'bull_atr_max_pct': 0.051773273111970844, 'bull_tp_mult': 1.419338716576993, 'bull_tsl_mult': 0.8280519091861495, 'bull_time_stop': 293, 'bull_use_sma': True, 'bull_use_ema': False, 'bull_use_atr': False, 'bull_use_adx': False, 'bull_use_spike': False, 'bull_rsi_required': True, 'bear_strategy': 'mean_reversion', 'bear_bb_std_mult': 1.8751917341329472, 'bear_rsi_os': 8, 'bear_rsi_ob': 70, 'bear_adx_thresh': 27.873998295773717, 'bear_atr_min_pct': 0.000773891464200217, 'bear_atr_max_pct': 0.12448731015891176, 'bear_tp_mult': 1.4534978105671266, 'bear_tsl_mult': 0.35595312199147194, 'bear_time_stop': 235, 'bear_use_sma': False, 'bear_use_ema': True, 'bear_use_atr': False, 'bear_use_adx': True, 'bear_use_spike': True, 'bear_rsi_required': True, 'sideways_strategy': 'breakout', 'sideways_bb_std_mult': 1.8020379482048767, 'sideways_rsi_os': 28, 'sideways_rsi_ob': 74, 'sideways_adx_thresh': 27.58956989890522, 'sideways_atr_min_pct': 0.020416773141536507, 'sideways_atr_max_pct': 0.0334312031736165, 'sideways_tp_mult': 1.7369554192963264, 'sideways_tsl_mult': 0.7920993031935836, 'sideways_time_stop': 270, 'sideways_use_sma': False, 'sideways_use_ema': False, 'sideways_use_atr': False, 'sideways_use_adx': True, 'sideways_use_spike': False, 'sideways_rsi_required': False}.
[I 2025-08-30 21:45:27,770] Trial 456 finished with values: [-1000000000.0, 1000000000.0] and parameters: {'p_sma': 34, 'p_std': 37, 'p_atr': 21, 'p_adx': 21, 'rsi_period': 67, 'ema1': 10, 'ema2': 54, 'slip_atr_k': 0.16792946648554505, 'slip_spread_k': 0.6867146383251951, 'spread_hl_frac': 0.031650821913834414, 'bb_std_mult': 0.8186294147251116, 'rsi_os': 11, 'rsi_ob': 67, 'vol_spike': 0.06157226045632079, 'adx_thresh': 11.27432162398624, 'atr_min_pct': 0.013437994533838883, 'atr_max_pct': 0.012963292246139154, 'tp_mult': 1.90649406775916, 'tsl_mult': 0.6920475505097293, 'strategy': 'mean_reversion', 'time_stop': 95, 'use_sma': True, 'use_atr': True, 'use_adx': True, 'use_ema': True, 'use_spike': True, 'rsi_required': True, 'edge_k': 1.0788872969042704, 'edge_cap': 0.7969396276217583, 'bull_strategy': 'breakout', 'bull_bb_std_mult': 1.9743120926281694, 'bull_rsi_os': 28, 'bull_rsi_ob': 88, 'bull_adx_thresh': 14.123613265650539, 'bull_atr_min_pct': 0.0015691950754257568, 'bull_atr_max_pct': 0.05013586166095638, 'bull_tp_mult': 1.3275066870717644, 'bull_tsl_mult': 0.4120485281382063, 'bull_time_stop': 24, 'bull_use_sma': True, 'bull_use_ema': False, 'bull_use_atr': False, 'bull_use_adx': False, 'bull_use_spike': False, 'bull_rsi_required': False, 'bear_strategy': 'breakout', 'bear_bb_std_mult': 1.8323638237143491, 'bear_rsi_os': 8, 'bear_rsi_ob': 73, 'bear_adx_thresh': 26.999216641865434, 'bear_atr_min_pct': 0.0018974431074103345, 'bear_atr_max_pct': 0.11030839684939564, 'bear_tp_mult': 1.5072715971683683, 'bear_tsl_mult': 0.41969196767967504, 'bear_time_stop': 239, 'bear_use_sma': False, 'bear_use_ema': True, 'bear_use_atr': False, 'bear_use_adx': True, 'bear_use_spike': True, 'bear_rsi_required': True, 'sideways_strategy': 'breakout', 'sideways_bb_std_mult': 1.8825304209309124, 'sideways_rsi_os': 39, 'sideways_rsi_ob': 79, 'sideways_adx_thresh': 26.20699936519208, 'sideways_atr_min_pct': 0.01971726507407792, 'sideways_atr_max_pct': 0.03616389202302535, 'sideways_tp_mult': 1.6183810820479394, 'sideways_tsl_mult': 0.5896838604407459, 'sideways_time_stop': 187, 'sideways_use_sma': False, 'sideways_use_ema': False, 'sideways_use_atr': False, 'sideways_use_adx': True, 'sideways_use_spike': False, 'sideways_rsi_required': False}.
[I 2025-08-30 21:45:27,794] Trial 458 finished with values: [-1000000000.0, 1000000000.0] and parameters: {'p_sma': 35, 'p_std': 37, 'p_atr': 21, 'p_adx': 21, 'rsi_period': 67, 'ema1': 10, 'ema2': 54, 'slip_atr_k': 0.02147000288657344, 'slip_spread_k': 0.6897212771348066, 'spread_hl_frac': 0.032010558445771296, 'bb_std_mult': 0.7939592353304071, 'rsi_os': 14, 'rsi_ob': 69, 'vol_spike': 0.06273915058376335, 'adx_thresh': 11.157178488027611, 'atr_min_pct': 0.013383501668193689, 'atr_max_pct': 0.012805484513911605, 'tp_mult': 1.9813929919131887, 'tsl_mult': 0.8789263031851251, 'strategy': 'mean_reversion', 'time_stop': 96, 'use_sma': True, 'use_atr': True, 'use_adx': True, 'use_ema': True, 'use_spike': True, 'rsi_required': True, 'edge_k': 1.8263411164240422, 'edge_cap': 0.7979582514695485, 'bull_strategy': 'breakout', 'bull_bb_std_mult': 1.945395528682979, 'bull_rsi_os': 28, 'bull_rsi_ob': 88, 'bull_adx_thresh': 21.148521925515848, 'bull_atr_min_pct': 0.023356914955308804, 'bull_atr_max_pct': 0.13234122682394714, 'bull_tp_mult': 1.328744763638508, 'bull_tsl_mult': 0.45195238494432893, 'bull_time_stop': 300, 'bull_use_sma': True, 'bull_use_ema': False, 'bull_use_atr': False, 'bull_use_adx': False, 'bull_use_spike': False, 'bull_rsi_required': False, 'bear_strategy': 'breakout', 'bear_bb_std_mult': 2.1332287757902213, 'bear_rsi_os': 10, 'bear_rsi_ob': 73, 'bear_adx_thresh': 26.916274612075835, 'bear_atr_min_pct': 0.020155979411066, 'bear_atr_max_pct': 0.12197348911544174, 'bear_tp_mult': 1.4887340110420295, 'bear_tsl_mult': 0.41891328089743923, 'bear_time_stop': 239, 'bear_use_sma': False, 'bear_use_ema': True, 'bear_use_atr': False, 'bear_use_adx': True, 'bear_use_spike': True, 'bear_rsi_required': True, 'sideways_strategy': 'breakout', 'sideways_bb_std_mult': 1.602677854688554, 'sideways_rsi_os': 25, 'sideways_rsi_ob': 89, 'sideways_adx_thresh': 17.093510874004163, 'sideways_atr_min_pct': 0.01970619839248937, 'sideways_atr_max_pct': 0.03786617413722712, 'sideways_tp_mult': 1.602669165305892, 'sideways_tsl_mult': 0.648104373130187, 'sideways_time_stop': 187, 'sideways_use_sma': False, 'sideways_use_ema': False, 'sideways_use_atr': False, 'sideways_use_adx': True, 'sideways_use_spike': False, 'sideways_rsi_required': False}.
[I 2025-08-30 21:45:27,811] Trial 457 finished with values: [-1000000000.0, 1000000000.0] and parameters: {'p_sma': 35, 'p_std': 37, 'p_atr': 21, 'p_adx': 21, 'rsi_period': 67, 'ema1': 10, 'ema2': 54, 'slip_atr_k': 0.17013728069019965, 'slip_spread_k': 0.6214736131938075, 'spread_hl_frac': 0.033821348638450204, 'bb_std_mult': 0.8103608793166723, 'rsi_os': 11, 'rsi_ob': 94, 'vol_spike': 0.267051608125109, 'adx_thresh': 11.08513947200398, 'atr_min_pct': 0.013200462289389384, 'atr_max_pct': 0.011576960844604306, 'tp_mult': 1.9630619956826192, 'tsl_mult': 0.6996380724510931, 'strategy': 'mean_reversion', 'time_stop': 97, 'use_sma': True, 'use_atr': True, 'use_adx': True, 'use_ema': True, 'use_spike': True, 'rsi_required': True, 'edge_k': 1.078287577359633, 'edge_cap': 0.7569095928226999, 'bull_strategy': 'breakout', 'bull_bb_std_mult': 1.9318413742503064, 'bull_rsi_os': 55, 'bull_rsi_ob': 88, 'bull_adx_thresh': 12.14417921360121, 'bull_atr_min_pct': 0.013577849238403905, 'bull_atr_max_pct': 0.05047880247449942, 'bull_tp_mult': 1.3153786999908736, 'bull_tsl_mult': 0.44748544803298873, 'bull_time_stop': 22, 'bull_use_sma': True, 'bull_use_ema': False, 'bull_use_atr': False, 'bull_use_adx': False, 'bull_use_spike': False, 'bull_rsi_required': False, 'bear_strategy': 'breakout', 'bear_bb_std_mult': 1.8227191929867184, 'bear_rsi_os': 10, 'bear_rsi_ob': 73, 'bear_adx_thresh': 27.340926731314564, 'bear_atr_min_pct': 0.028903254110124933, 'bear_atr_max_pct': 0.11071606426789425, 'bear_tp_mult': 2.3408730136047686, 'bear_tsl_mult': 0.42444761941250897, 'bear_time_stop': 238, 'bear_use_sma': False, 'bear_use_ema': True, 'bear_use_atr': False, 'bear_use_adx': True, 'bear_use_spike': True, 'bear_rsi_required': True, 'sideways_strategy': 'breakout', 'sideways_bb_std_mult': 1.8823832773254252, 'sideways_rsi_os': 49, 'sideways_rsi_ob': 89, 'sideways_adx_thresh': 26.35637261723494, 'sideways_atr_min_pct': 0.019681491497432986, 'sideways_atr_max_pct': 0.03601774370380293, 'sideways_tp_mult': 1.643205804716232, 'sideways_tsl_mult': 0.5526623322354268, 'sideways_time_stop': 278, 'sideways_use_sma': False, 'sideways_use_ema': False, 'sideways_use_atr': False, 'sideways_use_adx': True, 'sideways_use_spike': False, 'sideways_rsi_required': False}.
