[I 2025-08-30 21:53:35,830] Trial 534 finished with values: [-1000000000.0, 1000000000.0] and parameters: {'p_sma': 50, 'p_std': 35, 'p_atr': 9, 'p_adx': 14, 'rsi_period': 71, 'ema1': 10, 'ema2': 53, 'slip_atr_k': 0.08604789825334541, 'slip_spread_k': 0.6768536118570417, 'spread_hl_frac': 0.033702709647465065, 'bb_std_mult': 0.7248333480326028, 'rsi_os': 54, 'rsi_ob': 45, 'vol_spike': 0.28947095310177323, 'adx_thresh': 9.82732172289874, 'atr_min_pct': 0.01545250520311204, 'atr_max_pct': 0.12108401357015952, 'tp_mult': 1.6770114933165416, 'tsl_mult': 0.9654808210092106, 'strategy': 'mean_reversion', 'time_stop': 96, 'use_sma': True, 'use_atr': True, 'use_adx': False, 'use_ema': False, 'use_spike': False, 'rsi_required': True, 'edge_k': 0.8528382522163864, 'edge_cap': 0.7808300076340303, 'bull_strategy': 'mean_reversion', 'bull_bb_std_mult': 1.9697808017276677, 'bull_rsi_os': 54, 'bull_rsi_ob': 88, 'bull_adx_thresh': 15.292856893927532, 'bull_atr_min_pct': 0.028726188700376135, 'bull_atr_max_pct': 0.08071047011353231, 'bull_tp_mult': 1.9036000058615636, 'bull_tsl_mult': 0.3968250239939064, 'bull_time_stop': 17, 'bull_use_sma': True, 'bull_use_ema': False, 'bull_use_atr': False, 'bull_use_adx': False, 'bull_use_spike': False, 'bull_rsi_required': True, 'bear_strategy': 'mean_reversion', 'bear_bb_std_mult': 1.8827772616029217, 'bear_rsi_os': 11, 'bear_rsi_ob': 75, 'bear_adx_thresh': 22.960611070065376, 'bear_atr_min_pct': 0.02055444845275299, 'bear_atr_max_pct': 0.05462974345482545, 'bear_tp_mult': 1.5643759965046562, 'bear_tsl_mult': 0.18720315838761004, 'bear_time_stop': 227, 'bear_use_sma': False, 'bear_use_ema': True, 'bear_use_atr': False, 'bear_use_adx': True, 'bear_use_spike': True, 'bear_rsi_required': True, 'sideways_strategy': 'breakout', 'sideways_bb_std_mult': 2.934199587524304, 'sideways_rsi_os': 36, 'sideways_rsi_ob': 91, 'sideways_adx_thresh': 27.369963859241015, 'sideways_atr_min_pct': 0.02091487880665265, 'sideways_atr_max_pct': 0.03785212469578942, 'sideways_tp_mult': 1.8164433238113276, 'sideways_tsl_mult': 0.793616053086015, 'sideways_time_stop': 223, 'sideways_use_sma': True, 'sideways_use_ema': False, 'sideways_use_atr': False, 'sideways_use_adx': True, 'sideways_use_spike': True, 'sideways_rsi_required': False}.
[I 2025-08-30 21:53:36,742] Trial 535 finished with values: [-1000000000.0, 1000000000.0] and parameters: {'p_sma': 34, 'p_std': 25, 'p_atr': 20, 'p_adx': 21, 'rsi_period': 72, 'ema1': 10, 'ema2': 55, 'slip_atr_k': 0.029169812046020295, 'slip_spread_k': 0.25673311450528546, 'spread_hl_frac': 0.033819486363611005, 'bb_std_mult': 1.1104527821567645, 'rsi_os': 9, 'rsi_ob': 47, 'vol_spike': 0.282877093747709, 'adx_thresh': 10.838505377164953, 'atr_min_pct': 0.013856154894830037, 'atr_max_pct': 0.1381715070825989, 'tp_mult': 2.9485069738601837, 'tsl_mult': 0.16798649453609277, 'strategy': 'mean_reversion', 'time_stop': 249, 'use_sma': True, 'use_atr': True, 'use_adx': False, 'use_ema': True, 'use_spike': False, 'rsi_required': True, 'edge_k': 0.35158521511442464, 'edge_cap': 0.8296753707829463, 'bull_strategy': 'breakout', 'bull_bb_std_mult': 1.7838300331978394, 'bull_rsi_os': 21, 'bull_rsi_ob': 45, 'bull_adx_thresh': 8.99557863260345, 'bull_atr_min_pct': 0.0005707250576616505, 'bull_atr_max_pct': 0.0855861175618595, 'bull_tp_mult': 2.904696849248793, 'bull_tsl_mult': 0.12141268140547984, 'bull_time_stop': 300, 'bull_use_sma': True, 'bull_use_ema': False, 'bull_use_atr': False, 'bull_use_adx': False, 'bull_use_spike': False, 'bull_rsi_required': True, 'bear_strategy': 'mean_reversion', 'bear_bb_std_mult': 1.8299824343823061, 'bear_rsi_os': 9, 'bear_rsi_ob': 72, 'bear_adx_thresh': 28.184500167521136, 'bear_atr_min_pct': 0.028791093146952593, 'bear_atr_max_pct': 0.11251591073512089, 'bear_tp_mult': 1.4734420446064513, 'bear_tsl_mult': 0.3877577412217678, 'bear_time_stop': 227, 'bear_use_sma': False, 'bear_use_ema': True, 'bear_use_atr': False, 'bear_use_adx': True, 'bear_use_spike': True, 'bear_rsi_required': True, 'sideways_strategy': 'breakout', 'sideways_bb_std_mult': 1.5600609182423806, 'sideways_rsi_os': 40, 'sideways_rsi_ob': 50, 'sideways_adx_thresh': 27.02726318547501, 'sideways_atr_min_pct': 0.021165505001505, 'sideways_atr_max_pct': 0.04168241250447704, 'sideways_tp_mult': 1.8008455899364986, 'sideways_tsl_mult': 0.7905980882900746, 'sideways_time_stop': 272, 'sideways_use_sma': True, 'sideways_use_ema': False, 'sideways_use_atr': False, 'sideways_use_adx': True, 'sideways_use_spike': True, 'sideways_rsi_required': False}.
[I 2025-08-30 21:54:05,917] Trial 532 finished with values: [-1000000000.0, 1000000000.0] and parameters: {'p_sma': 35, 'p_std': 35, 'p_atr': 9, 'p_adx': 17, 'rsi_period': 71, 'ema1': 10, 'ema2': 54, 'slip_atr_k': 0.020197472088838594, 'slip_spread_k': 0.0022000313389360926, 'spread_hl_frac': 0.014868504722675783, 'bb_std_mult': 2.96797417386322, 'rsi_os': 9, 'rsi_ob': 54, 'vol_spike': 0.1785107999386292, 'adx_thresh': 11.628919970487688, 'atr_min_pct': 0.01188015256250365, 'atr_max_pct': 0.024060142712571116, 'tp_mult': 2.1189198320777978, 'tsl_mult': 0.9451632429375602, 'strategy': 'mean_reversion', 'time_stop': 96, 'use_sma': True, 'use_atr': False, 'use_adx': False, 'use_ema': False, 'use_spike': False, 'rsi_required': True, 'edge_k': 0.8804987059631317, 'edge_cap': 0.7806689870064242, 'bull_strategy': 'breakout', 'bull_bb_std_mult': 1.7961704019946367, 'bull_rsi_os': 15, 'bull_rsi_ob': 87, 'bull_adx_thresh': 15.335529288464356, 'bull_atr_min_pct': 0.000974708867071906, 'bull_atr_max_pct': 0.09444665365954619, 'bull_tp_mult': 1.4566488857699542, 'bull_tsl_mult': 0.39189916201141495, 'bull_time_stop': 285, 'bull_use_sma': False, 'bull_use_ema': True, 'bull_use_atr': False, 'bull_use_adx': False, 'bull_use_spike': False, 'bull_rsi_required': True, 'bear_strategy': 'mean_reversion', 'bear_bb_std_mult': 1.8586979208437877, 'bear_rsi_os': 10, 'bear_rsi_ob': 63, 'bear_adx_thresh': 22.658996269761776, 'bear_atr_min_pct': 7.980895766913215e-07, 'bear_atr_max_pct': 0.09762463270842799, 'bear_tp_mult': 1.6042343600084454, 'bear_tsl_mult': 0.5391695346380536, 'bear_time_stop': 254, 'bear_use_sma': False, 'bear_use_ema': True, 'bear_use_atr': False, 'bear_use_adx': False, 'bear_use_spike': False, 'bear_rsi_required': True, 'sideways_strategy': 'breakout', 'sideways_bb_std_mult': 1.5597874074420854, 'sideways_rsi_os': 6, 'sideways_rsi_ob': 91, 'sideways_adx_thresh': 14.141818909125764, 'sideways_atr_min_pct': 0.021120606064865217, 'sideways_atr_max_pct': 0.038311301984868824, 'sideways_tp_mult': 1.8113636270257232, 'sideways_tsl_mult': 0.7941076831936786, 'sideways_time_stop': 12, 'sideways_use_sma': True, 'sideways_use_ema': False, 'sideways_use_atr': False, 'sideways_use_adx': True, 'sideways_use_spike': True, 'sideways_rsi_required': False}.
[I 2025-08-30 21:54:06,306] Trial 531 finished with values: [-1000000000.0, 1000000000.0] and parameters: {'p_sma': 33, 'p_std': 35, 'p_atr': 20, 'p_adx': 22, 'rsi_period': 11, 'ema1': 11, 'ema2': 54, 'slip_atr_k': 0.0007742815434890679, 'slip_spread_k': 0.6684054961468555, 'spread_hl_frac': 0.037334792328387205, 'bb_std_mult': 2.2236336403377903, 'rsi_os': 11, 'rsi_ob': 54, 'vol_spike': 0.2882665170859124, 'adx_thresh': 11.544290772154538, 'atr_min_pct': 0.011870906862221224, 'atr_max_pct': 0.024564945853839, 'tp_mult': 1.8792548950116497, 'tsl_mult': 0.849130140829467, 'strategy': 'mean_reversion', 'time_stop': 95, 'use_sma': True, 'use_atr': False, 'use_adx': False, 'use_ema': False, 'use_spike': False, 'rsi_required': True, 'edge_k': 0.872346361972701, 'edge_cap': 0.7735585142319292, 'bull_strategy': 'breakout', 'bull_bb_std_mult': 1.8033176147354397, 'bull_rsi_os': 47, 'bull_rsi_ob': 87, 'bull_adx_thresh': 33.00969437861945, 'bull_atr_min_pct': 0.0007641188982105389, 'bull_atr_max_pct': 0.08142729390624252, 'bull_tp_mult': 2.0137541639765586, 'bull_tsl_mult': 0.12833409603115986, 'bull_time_stop': 122, 'bull_use_sma': False, 'bull_use_ema': True, 'bull_use_atr': False, 'bull_use_adx': False, 'bull_use_spike': False, 'bull_rsi_required': True, 'bear_strategy': 'mean_reversion', 'bear_bb_std_mult': 0.8180856949967585, 'bear_rsi_os': 10, 'bear_rsi_ob': 88, 'bear_adx_thresh': 26.127846812255356, 'bear_atr_min_pct': 0.005906048678232863, 'bear_atr_max_pct': 0.12834899498693075, 'bear_tp_mult': 1.5906572516057267, 'bear_tsl_mult': 0.3757094480359363, 'bear_time_stop': 255, 'bear_use_sma': False, 'bear_use_ema': True, 'bear_use_atr': False, 'bear_use_adx': False, 'bear_use_spike': False, 'bear_rsi_required': True, 'sideways_strategy': 'breakout', 'sideways_bb_std_mult': 1.5815769765651106, 'sideways_rsi_os': 37, 'sideways_rsi_ob': 90, 'sideways_adx_thresh': 26.28781715786782, 'sideways_atr_min_pct': 0.021137603920491053, 'sideways_atr_max_pct': 0.03859889645166397, 'sideways_tp_mult': 1.798609553914388, 'sideways_tsl_mult': 0.837796571223113, 'sideways_time_stop': 12, 'sideways_use_sma': True, 'sideways_use_ema': False, 'sideways_use_atr': False, 'sideways_use_adx': True, 'sideways_use_spike': True, 'sideways_rsi_required': False}.
[I 2025-08-30 21:54:06,831] Trial 533 finished with values: [-0.01762432340712272, 0.017510267174092983] and parameters: {'p_sma': 42, 'p_std': 37, 'p_atr': 9, 'p_adx': 21, 'rsi_period': 71, 'ema1': 10, 'ema2': 53, 'slip_atr_k': 0.029740768617882364, 'slip_spread_k': 0.9413472805549472, 'spread_hl_frac': 0.033582958550515955, 'bb_std_mult': 0.73764246920372, 'rsi_os': 18, 'rsi_ob': 65, 'vol_spike': 0.28923279573068156, 'adx_thresh': 26.27042489914782, 'atr_min_pct': 0.017692348775427677, 'atr_max_pct': 0.027130043115252175, 'tp_mult': 1.8794692378338695, 'tsl_mult': 0.8719555761787834, 'strategy': 'mean_reversion', 'time_stop': 87, 'use_sma': True, 'use_atr': True, 'use_adx': False, 'use_ema': False, 'use_spike': False, 'rsi_required': True, 'edge_k': 0.3691114742812931, 'edge_cap': 0.7627808121399807, 'bull_strategy': 'breakout', 'bull_bb_std_mult': 1.5261712228577826, 'bull_rsi_os': 20, 'bull_rsi_ob': 64, 'bull_adx_thresh': 13.027008243446122, 'bull_atr_min_pct': 0.0007607845569500139, 'bull_atr_max_pct': 0.05146306437000174, 'bull_tp_mult': 1.462565911095649, 'bull_tsl_mult': 0.2243711666093242, 'bull_time_stop': 289, 'bull_use_sma': True, 'bull_use_ema': False, 'bull_use_atr': False, 'bull_use_adx': False, 'bull_use_spike': False, 'bull_rsi_required': True, 'bear_strategy': 'mean_reversion', 'bear_bb_std_mult': 0.810326769900465, 'bear_rsi_os': 9, 'bear_rsi_ob': 75, 'bear_adx_thresh': 26.075986086044743, 'bear_atr_min_pct': 0.020502014546717493, 'bear_atr_max_pct': 0.11311215412098259, 'bear_tp_mult': 1.59882531057609, 'bear_tsl_mult': 0.3777171520339213, 'bear_time_stop': 227, 'bear_use_sma': False, 'bear_use_ema': True, 'bear_use_atr': False, 'bear_use_adx': True, 'bear_use_spike': True, 'bear_rsi_required': True, 'sideways_strategy': 'breakout', 'sideways_bb_std_mult': 1.9127005752654542, 'sideways_rsi_os': 48, 'sideways_rsi_ob': 91, 'sideways_adx_thresh': 27.102237922702418, 'sideways_atr_min_pct': 0.021070172859569004, 'sideways_atr_max_pct': 0.038652780232970356, 'sideways_tp_mult': 1.8164415351315863, 'sideways_tsl_mult': 0.7912799909811861, 'sideways_time_stop': 223, 'sideways_use_sma': True, 'sideways_use_ema': False, 'sideways_use_atr': False, 'sideways_use_adx': True, 'sideways_use_spike': True, 'sideways_rsi_required': False}.
[I 2025-08-30 21:54:10,577] Trial 536 finished with values: [-1000000000.0, 1000000000.0] and parameters: {'p_sma': 22, 'p_std': 47, 'p_atr': 28, 'p_adx': 13, 'rsi_period': 72, 'ema1': 28, 'ema2': 54, 'slip_atr_k': 0.09618384244120433, 'slip_spread_k': 0.9445354301510418, 'spread_hl_frac': 0.014401795403282562, 'bb_std_mult': 0.7965815134630805, 'rsi_os': 13, 'rsi_ob': 54, 'vol_spike': 0.24210217659871178, 'adx_thresh': 11.51942711868079, 'atr_min_pct': 0.006918857287734708, 'atr_max_pct': 0.02738344322107135, 'tp_mult': 2.824115261623254, 'tsl_mult': 0.9986048590799743, 'strategy': 'mean_reversion', 'time_stop': 79, 'use_sma': True, 'use_atr': True, 'use_adx': True, 'use_ema': False, 'use_spike': True, 'rsi_required': True, 'edge_k': 1.0194630947516252, 'edge_cap': 0.8977641514451247, 'bull_strategy': 'breakout', 'bull_bb_std_mult': 1.9145699560411562, 'bull_rsi_os': 15, 'bull_rsi_ob': 86, 'bull_adx_thresh': 13.304946742620848, 'bull_atr_min_pct': 0.02192684124550839, 'bull_atr_max_pct': 0.051338640173058024, 'bull_tp_mult': 1.3676115021616786, 'bull_tsl_mult': 0.4858074632275606, 'bull_time_stop': 290, 'bull_use_sma': True, 'bull_use_ema': False, 'bull_use_atr': False, 'bull_use_adx': False, 'bull_use_spike': False, 'bull_rsi_required': True, 'bear_strategy': 'mean_reversion', 'bear_bb_std_mult': 0.8000827209952355, 'bear_rsi_os': 6, 'bear_rsi_ob': 88, 'bear_adx_thresh': 26.015216509035092, 'bear_atr_min_pct': 0.029390535677118433, 'bear_atr_max_pct': 0.09694831428904332, 'bear_tp_mult': 2.030246900804557, 'bear_tsl_mult': 0.4094819487976769, 'bear_time_stop': 235, 'bear_use_sma': False, 'bear_use_ema': True, 'bear_use_atr': False, 'bear_use_adx': True, 'bear_use_spike': True, 'bear_rsi_required': True, 'sideways_strategy': 'breakout', 'sideways_bb_std_mult': 1.6377757005585636, 'sideways_rsi_os': 9, 'sideways_rsi_ob': 92, 'sideways_adx_thresh': 13.97080493153869, 'sideways_atr_min_pct': 0.021267905867983484, 'sideways_atr_max_pct': 0.03176665496912723, 'sideways_tp_mult': 1.809900227560948, 'sideways_tsl_mult': 0.7413370085921964, 'sideways_time_stop': 258, 'sideways_use_sma': False, 'sideways_use_ema': False, 'sideways_use_atr': False, 'sideways_use_adx': True, 'sideways_use_spike': False, 'sideways_rsi_required': False}.
[I 2025-08-30 21:54:11,056] Trial 538 finished with values: [-1000000000.0, 1000000000.0] and parameters: {'p_sma': 43, 'p_std': 59, 'p_atr': 19, 'p_adx': 21, 'rsi_period': 73, 'ema1': 13, 'ema2': 53, 'slip_atr_k': 0.040178232056127895, 'slip_spread_k': 0.7127983162823586, 'spread_hl_frac': 0.048992514476281564, 'bb_std_mult': 0.7939700421918536, 'rsi_os': 15, 'rsi_ob': 65, 'vol_spike': 0.21278587798432316, 'adx_thresh': 9.92779629212264, 'atr_min_pct': 0.026524054423018972, 'atr_max_pct': 0.020131370808676018, 'tp_mult': 1.8021935266181837, 'tsl_mult': 0.8701484519414027, 'strategy': 'mean_reversion', 'time_stop': 243, 'use_sma': True, 'use_atr': True, 'use_adx': True, 'use_ema': True, 'use_spike': True, 'rsi_required': True, 'edge_k': 1.6976131013794307, 'edge_cap': 0.14981871407507924, 'bull_strategy': 'mean_reversion', 'bull_bb_std_mult': 1.5274143538382812, 'bull_rsi_os': 32, 'bull_rsi_ob': 64, 'bull_adx_thresh': 13.290182136381295, 'bull_atr_min_pct': 0.001686227062681431, 'bull_atr_max_pct': 0.06991638553116447, 'bull_tp_mult': 1.5531997023499504, 'bull_tsl_mult': 0.43856536185272627, 'bull_time_stop': 291, 'bull_use_sma': True, 'bull_use_ema': False, 'bull_use_atr': False, 'bull_use_adx': False, 'bull_use_spike': False, 'bull_rsi_required': True, 'bear_strategy': 'mean_reversion', 'bear_bb_std_mult': 2.214506489630092, 'bear_rsi_os': 30, 'bear_rsi_ob': 74, 'bear_adx_thresh': 7.905415008839885, 'bear_atr_min_pct': 0.0029792280986352566, 'bear_atr_max_pct': 0.11367870442341661, 'bear_tp_mult': 1.18435474624139, 'bear_tsl_mult': 0.4328129615854585, 'bear_time_stop': 234, 'bear_use_sma': False, 'bear_use_ema': True, 'bear_use_atr': False, 'bear_use_adx': True, 'bear_use_spike': True, 'bear_rsi_required': False, 'sideways_strategy': 'breakout', 'sideways_bb_std_mult': 1.6596999289654946, 'sideways_rsi_os': 32, 'sideways_rsi_ob': 92, 'sideways_adx_thresh': 29.20180884470546, 'sideways_atr_min_pct': 0.022354955857277523, 'sideways_atr_max_pct': 0.032879121106435386, 'sideways_tp_mult': 1.8365276897593363, 'sideways_tsl_mult': 0.7524021676695491, 'sideways_time_stop': 258, 'sideways_use_sma': False, 'sideways_use_ema': False, 'sideways_use_atr': False, 'sideways_use_adx': True, 'sideways_use_spike': False, 'sideways_rsi_required': False}.
[I 2025-08-30 21:54:11,113] Trial 537 finished with values: [-1000000000.0, 1000000000.0] and parameters: {'p_sma': 16, 'p_std': 36, 'p_atr': 19, 'p_adx': 22, 'rsi_period': 73, 'ema1': 27, 'ema2': 53, 'slip_atr_k': 0.17885270631386846, 'slip_spread_k': 0.13790201335130636, 'spread_hl_frac': 0.036347050986942825, 'bb_std_mult': 0.7966873088851334, 'rsi_os': 13, 'rsi_ob': 64, 'vol_spike': 0.2763246346686853, 'adx_thresh': 11.592376163666785, 'atr_min_pct': 0.02615961593105019, 'atr_max_pct': 0.020481592347711547, 'tp_mult': 2.0363067375473265, 'tsl_mult': 0.8788254581100905, 'strategy': 'mean_reversion', 'time_stop': 241, 'use_sma': True, 'use_atr': True, 'use_adx': True, 'use_ema': True, 'use_spike': True, 'rsi_required': True, 'edge_k': 0.5130220962956749, 'edge_cap': 0.8562419716797731, 'bull_strategy': 'breakout', 'bull_bb_std_mult': 1.9092669904012858, 'bull_rsi_os': 11, 'bull_rsi_ob': 86, 'bull_adx_thresh': 12.897315743999895, 'bull_atr_min_pct': 0.002931911368297499, 'bull_atr_max_pct': 0.07067535311508195, 'bull_tp_mult': 1.1838241435370969, 'bull_tsl_mult': 0.10602047699488543, 'bull_time_stop': 300, 'bull_use_sma': True, 'bull_use_ema': False, 'bull_use_atr': False, 'bull_use_adx': False, 'bull_use_spike': False, 'bull_rsi_required': True, 'bear_strategy': 'mean_reversion', 'bear_bb_std_mult': 1.4593356117415728, 'bear_rsi_os': 8, 'bear_rsi_ob': 74, 'bear_adx_thresh': 26.05382459102359, 'bear_atr_min_pct': 0.029987642842439526, 'bear_atr_max_pct': 0.11909072194104757, 'bear_tp_mult': 1.5083367459631594, 'bear_tsl_mult': 0.4122448687525398, 'bear_time_stop': 234, 'bear_use_sma': False, 'bear_use_ema': True, 'bear_use_atr': False, 'bear_use_adx': True, 'bear_use_spike': True, 'bear_rsi_required': False, 'sideways_strategy': 'breakout', 'sideways_bb_std_mult': 1.6679985181020545, 'sideways_rsi_os': 14, 'sideways_rsi_ob': 92, 'sideways_adx_thresh': 27.160574036217685, 'sideways_atr_min_pct': 0.020643297818675417, 'sideways_atr_max_pct': 0.03245038879040888, 'sideways_tp_mult': 1.8273611750047671, 'sideways_tsl_mult': 0.7443289226173522, 'sideways_time_stop': 256, 'sideways_use_sma': False, 'sideways_use_ema': False, 'sideways_use_atr': False, 'sideways_use_adx': True, 'sideways_use_spike': False, 'sideways_rsi_required': False}.
[I 2025-08-30 21:54:38,399] Trial 539 finished with values: [-1000000000.0, 1000000000.0] and parameters: {'p_sma': 44, 'p_std': 59, 'p_atr': 19, 'p_adx': 21, 'rsi_period': 72, 'ema1': 13, 'ema2': 53, 'slip_atr_k': 0.029500318575497654, 'slip_spread_k': 0.9632055123127721, 'spread_hl_frac': 0.02084503179293953, 'bb_std_mult': 0.8014144515026406, 'rsi_os': 15, 'rsi_ob': 65, 'vol_spike': 0.2757709932153237, 'adx_thresh': 9.894493244892203, 'atr_min_pct': 0.012942521896667595, 'atr_max_pct': 0.020064639878296698, 'tp_mult': 2.4496637313269116, 'tsl_mult': 0.8687311408853936, 'strategy': 'mean_reversion', 'time_stop': 78, 'use_sma': True, 'use_atr': True, 'use_adx': True, 'use_ema': True, 'use_spike': True, 'rsi_required': True, 'edge_k': 1.016289486183215, 'edge_cap': 0.7967037202689187, 'bull_strategy': 'mean_reversion', 'bull_bb_std_mult': 1.9268789314182024, 'bull_rsi_os': 16, 'bull_rsi_ob': 86, 'bull_adx_thresh': 14.526314236130236, 'bull_atr_min_pct': 0.002939976223537214, 'bull_atr_max_pct': 0.051497398933534444, 'bull_tp_mult': 1.388261334597331, 'bull_tsl_mult': 0.36919042146190084, 'bull_time_stop': 290, 'bull_use_sma': True, 'bull_use_ema': False, 'bull_use_atr': False, 'bull_use_adx': False, 'bull_use_spike': False, 'bull_rsi_required': True, 'bear_strategy': 'mean_reversion', 'bear_bb_std_mult': 1.568359387198659, 'bear_rsi_os': 5, 'bear_rsi_ob': 74, 'bear_adx_thresh': 32.46122103065716, 'bear_atr_min_pct': 0.029345619436597026, 'bear_atr_max_pct': 0.11951929836745293, 'bear_tp_mult': 1.5174156875485807, 'bear_tsl_mult': 0.41308947479416763, 'bear_time_stop': 233, 'bear_use_sma': False, 'bear_use_ema': True, 'bear_use_atr': False, 'bear_use_adx': True, 'bear_use_spike': True, 'bear_rsi_required': False, 'sideways_strategy': 'breakout', 'sideways_bb_std_mult': 1.182003212608349, 'sideways_rsi_os': 14, 'sideways_rsi_ob': 88, 'sideways_adx_thresh': 27.18096869465749, 'sideways_atr_min_pct': 0.02054326018801285, 'sideways_atr_max_pct': 0.032835757821235864, 'sideways_tp_mult': 1.8306929782341939, 'sideways_tsl_mult': 0.7465857758430878, 'sideways_time_stop': 260, 'sideways_use_sma': False, 'sideways_use_ema': False, 'sideways_use_atr': False, 'sideways_use_adx': True, 'sideways_use_spike': False, 'sideways_rsi_required': False}.
