[I 2025-08-30 20:52:44,999] Trial 45 finished with values: [-1000000000.0, 1000000000.0] and parameters: {'p_sma': 21, 'p_std': 28, 'p_atr': 28, 'p_adx': 17, 'rsi_period': 44, 'ema1': 26, 'ema2': 31, 'slip_atr_k': 0.10696748513445595, 'slip_spread_k': 0.3716055973472438, 'spread_hl_frac': 0.0033547972433183686, 'bb_std_mult': 3.0345757093584824, 'rsi_os': 23, 'rsi_ob': 58, 'vol_spike': 0.1861216205387865, 'adx_thresh': 9.161752108322432, 'atr_min_pct': 0.0008776411877822396, 'atr_max_pct': 0.05968687462653959, 'tp_mult': 1.1773207957406595, 'tsl_mult': 0.14562193590079664, 'strategy': 'mean_reversion', 'time_stop': 145, 'use_sma': False, 'use_atr': True, 'use_adx': True, 'use_ema': False, 'use_spike': True, 'rsi_required': True, 'edge_k': 0.5742271642757448, 'edge_cap': 0.30469788204604265, 'bull_strategy': 'breakout', 'bull_bb_std_mult': 2.8700308367596774, 'bull_rsi_os': 15, 'bull_rsi_ob': 65, 'bull_adx_thresh': 14.289814493398941, 'bull_atr_min_pct': 0.024948917156661216, 'bull_atr_max_pct': 0.04787853598136357, 'bull_tp_mult': 2.1720681357249787, 'bull_tsl_mult': 0.8788449418607349, 'bull_time_stop': 198, 'bull_use_sma': True, 'bull_use_ema': True, 'bull_use_atr': False, 'bull_use_adx': True, 'bull_use_spike': False, 'bull_rsi_required': True, 'bear_strategy': 'breakout', 'bear_bb_std_mult': 0.6600920467289947, 'bear_rsi_os': 49, 'bear_rsi_ob': 68, 'bear_adx_thresh': 15.046364820680008, 'bear_atr_min_pct': 0.007901111786536668, 'bear_atr_max_pct': 0.011871542580016922, 'bear_tp_mult': 2.3918311255025353, 'bear_tsl_mult': 0.20247761763027586, 'bear_time_stop': 60, 'bear_use_sma': True, 'bear_use_ema': True, 'bear_use_atr': False, 'bear_use_adx': False, 'bear_use_spike': True, 'bear_rsi_required': True, 'sideways_strategy': 'breakout', 'sideways_bb_std_mult': 3.410536232056448, 'sideways_rsi_os': 8, 'sideways_rsi_ob': 45, 'sideways_adx_thresh': 5.129980103389185, 'sideways_atr_min_pct': 0.01158403523048942, 'sideways_atr_max_pct': 0.06700323477185266, 'sideways_tp_mult': 2.4901732885420675, 'sideways_tsl_mult': 0.08611982337438145, 'sideways_time_stop': 209, 'sideways_use_sma': False, 'sideways_use_ema': False, 'sideways_use_atr': True, 'sideways_use_adx': True, 'sideways_use_spike': True, 'sideways_rsi_required': True}.
[I 2025-08-30 20:53:02,090] Trial 46 finished with values: [-1000000000.0, 1000000000.0] and parameters: {'p_sma': 23, 'p_std': 46, 'p_atr': 28, 'p_adx': 18, 'rsi_period': 42, 'ema1': 27, 'ema2': 32, 'slip_atr_k': 0.10823362110012597, 'slip_spread_k': 0.39408921306429195, 'spread_hl_frac': 0.007817172032546097, 'bb_std_mult': 3.0709033585576804, 'rsi_os': 23, 'rsi_ob': 59, 'vol_spike': 0.013516444043769615, 'adx_thresh': 8.920174601035498, 'atr_min_pct': 0.001903444009863432, 'atr_max_pct': 0.027201456225086795, 'tp_mult': 1.1515110157103778, 'tsl_mult': 0.14063627165495896, 'strategy': 'mean_reversion', 'time_stop': 144, 'use_sma': False, 'use_atr': True, 'use_adx': True, 'use_ema': False, 'use_spike': True, 'rsi_required': True, 'edge_k': 1.695199278264253, 'edge_cap': 0.1524222223864366, 'bull_strategy': 'breakout', 'bull_bb_std_mult': 0.9410899366746701, 'bull_rsi_os': 5, 'bull_rsi_ob': 68, 'bull_adx_thresh': 21.37999741625453, 'bull_atr_min_pct': 0.006214464102147925, 'bull_atr_max_pct': 0.10894244073481954, 'bull_tp_mult': 2.137989399951376, 'bull_tsl_mult': 0.8514333340782441, 'bull_time_stop': 130, 'bull_use_sma': True, 'bull_use_ema': True, 'bull_use_atr': False, 'bull_use_adx': True, 'bull_use_spike': False, 'bull_rsi_required': True, 'bear_strategy': 'breakout', 'bear_bb_std_mult': 0.6518373693356608, 'bear_rsi_os': 29, 'bear_rsi_ob': 54, 'bear_adx_thresh': 13.613668981567695, 'bear_atr_min_pct': 0.007595320617743196, 'bear_atr_max_pct': 0.0763454676473564, 'bear_tp_mult': 1.786365118240059, 'bear_tsl_mult': 0.08900924619975392, 'bear_time_stop': 64, 'bear_use_sma': False, 'bear_use_ema': False, 'bear_use_atr': True, 'bear_use_adx': False, 'bear_use_spike': True, 'bear_rsi_required': True, 'sideways_strategy': 'mean_reversion', 'sideways_bb_std_mult': 3.4083123804426, 'sideways_rsi_os': 46, 'sideways_rsi_ob': 91, 'sideways_adx_thresh': 34.929713615968815, 'sideways_atr_min_pct': 0.011480836350006136, 'sideways_atr_max_pct': 0.14135202777959877, 'sideways_tp_mult': 2.5060913866511116, 'sideways_tsl_mult': 0.08635207022049246, 'sideways_time_stop': 233, 'sideways_use_sma': False, 'sideways_use_ema': False, 'sideways_use_atr': True, 'sideways_use_adx': True, 'sideways_use_spike': True, 'sideways_rsi_required': True}.
[I 2025-08-30 20:53:18,378] Trial 47 finished with values: [-1000000000.0, 1000000000.0] and parameters: {'p_sma': 23, 'p_std': 46, 'p_atr': 27, 'p_adx': 18, 'rsi_period': 43, 'ema1': 16, 'ema2': 59, 'slip_atr_k': 0.09578400891492489, 'slip_spread_k': 0.36105609281111645, 'spread_hl_frac': 0.03886397685744142, 'bb_std_mult': 2.8145083200003786, 'rsi_os': 25, 'rsi_ob': 59, 'vol_spike': 0.011326429248386255, 'adx_thresh': 9.795098765988444, 'atr_min_pct': 0.012786617312755311, 'atr_max_pct': 0.047387311548521376, 'tp_mult': 1.4609764929565259, 'tsl_mult': 0.9085767172997447, 'strategy': 'mean_reversion', 'time_stop': 109, 'use_sma': False, 'use_atr': True, 'use_adx': True, 'use_ema': False, 'use_spike': True, 'rsi_required': True, 'edge_k': 1.17678590753036, 'edge_cap': 0.8509682329760532, 'bull_strategy': 'mean_reversion', 'bull_bb_std_mult': 0.9176746645395981, 'bull_rsi_os': 36, 'bull_rsi_ob': 93, 'bull_adx_thresh': 27.05231812850663, 'bull_atr_min_pct': 0.028369869805734936, 'bull_atr_max_pct': 0.047379620016827606, 'bull_tp_mult': 2.192048747454221, 'bull_tsl_mult': 0.7821896880895435, 'bull_time_stop': 160, 'bull_use_sma': False, 'bull_use_ema': True, 'bull_use_atr': False, 'bull_use_adx': True, 'bull_use_spike': False, 'bull_rsi_required': True, 'bear_strategy': 'breakout', 'bear_bb_std_mult': 0.6883464185686281, 'bear_rsi_os': 48, 'bear_rsi_ob': 69, 'bear_adx_thresh': 14.430064710829033, 'bear_atr_min_pct': 0.0031560822223009512, 'bear_atr_max_pct': 0.018438505390108592, 'bear_tp_mult': 2.0876955114525164, 'bear_tsl_mult': 0.07573479389373626, 'bear_time_stop': 282, 'bear_use_sma': False, 'bear_use_ema': False, 'bear_use_atr': True, 'bear_use_adx': False, 'bear_use_spike': True, 'bear_rsi_required': True, 'sideways_strategy': 'mean_reversion', 'sideways_bb_std_mult': 0.8916963413199879, 'sideways_rsi_os': 15, 'sideways_rsi_ob': 55, 'sideways_adx_thresh': 31.867121763051763, 'sideways_atr_min_pct': 0.010649839669407168, 'sideways_atr_max_pct': 0.1477477013459835, 'sideways_tp_mult': 2.467740672112784, 'sideways_tsl_mult': 0.567483872155469, 'sideways_time_stop': 245, 'sideways_use_sma': False, 'sideways_use_ema': False, 'sideways_use_atr': True, 'sideways_use_adx': True, 'sideways_use_spike': False, 'sideways_rsi_required': False}.
[I 2025-08-30 20:53:19,260] Trial 48 finished with values: [-1000000000.0, 1000000000.0] and parameters: {'p_sma': 21, 'p_std': 47, 'p_atr': 27, 'p_adx': 18, 'rsi_period': 44, 'ema1': 28, 'ema2': 58, 'slip_atr_k': 0.0009926571556804348, 'slip_spread_k': 0.7793598920248961, 'spread_hl_frac': 0.006785660573787624, 'bb_std_mult': 2.80584597470534, 'rsi_os': 31, 'rsi_ob': 66, 'vol_spike': 0.013581280989090564, 'adx_thresh': 33.53752929534568, 'atr_min_pct': 0.013002571280157773, 'atr_max_pct': 0.05882484885791752, 'tp_mult': 1.5043671102529292, 'tsl_mult': 0.27072020724815327, 'strategy': 'mean_reversion', 'time_stop': 221, 'use_sma': True, 'use_atr': True, 'use_adx': True, 'use_ema': False, 'use_spike': True, 'rsi_required': True, 'edge_k': 1.1686615774504676, 'edge_cap': 0.7762010477084531, 'bull_strategy': 'mean_reversion', 'bull_bb_std_mult': 0.9269862697843532, 'bull_rsi_os': 35, 'bull_rsi_ob': 85, 'bull_adx_thresh': 10.486341280554226, 'bull_atr_min_pct': 0.005518689623593974, 'bull_atr_max_pct': 0.03869909572049683, 'bull_tp_mult': 2.1828471547279107, 'bull_tsl_mult': 0.8055214489808893, 'bull_time_stop': 191, 'bull_use_sma': False, 'bull_use_ema': True, 'bull_use_atr': False, 'bull_use_adx': True, 'bull_use_spike': False, 'bull_rsi_required': True, 'bear_strategy': 'breakout', 'bear_bb_std_mult': 0.7083875666700428, 'bear_rsi_os': 29, 'bear_rsi_ob': 69, 'bear_adx_thresh': 33.02734871568048, 'bear_atr_min_pct': 0.003267451132367266, 'bear_atr_max_pct': 0.07743662632213097, 'bear_tp_mult': 2.5783374719114116, 'bear_tsl_mult': 0.3362137242804728, 'bear_time_stop': 61, 'bear_use_sma': False, 'bear_use_ema': False, 'bear_use_atr': True, 'bear_use_adx': False, 'bear_use_spike': True, 'bear_rsi_required': True, 'sideways_strategy': 'mean_reversion', 'sideways_bb_std_mult': 0.8475580146433426, 'sideways_rsi_os': 47, 'sideways_rsi_ob': 91, 'sideways_adx_thresh': 31.486186304413863, 'sideways_atr_min_pct': 0.007929518278786015, 'sideways_atr_max_pct': 0.0992788376018001, 'sideways_tp_mult': 1.9581821819141507, 'sideways_tsl_mult': 0.344947200266792, 'sideways_time_stop': 207, 'sideways_use_sma': False, 'sideways_use_ema': False, 'sideways_use_atr': False, 'sideways_use_adx': False, 'sideways_use_spike': False, 'sideways_rsi_required': False}.
[I 2025-08-30 20:53:20,361] Trial 49 finished with values: [-1000000000.0, 1000000000.0] and parameters: {'p_sma': 59, 'p_std': 46, 'p_atr': 26, 'p_adx': 20, 'rsi_period': 66, 'ema1': 16, 'ema2': 59, 'slip_atr_k': 0.09454813852888057, 'slip_spread_k': 0.7700652153176096, 'spread_hl_frac': 0.007560904850999712, 'bb_std_mult': 0.9487026379098726, 'rsi_os': 9, 'rsi_ob': 66, 'vol_spike': 0.13130197881897898, 'adx_thresh': 33.446621409242795, 'atr_min_pct': 0.012932157527945052, 'atr_max_pct': 0.046275698835667595, 'tp_mult': 1.442160846736262, 'tsl_mult': 0.27391170479153915, 'strategy': 'mean_reversion', 'time_stop': 223, 'use_sma': True, 'use_atr': True, 'use_adx': True, 'use_ema': False, 'use_spike': True, 'rsi_required': True, 'edge_k': 1.692860568298132, 'edge_cap': 0.1743748679276152, 'bull_strategy': 'mean_reversion', 'bull_bb_std_mult': 0.7867836484044329, 'bull_rsi_os': 26, 'bull_rsi_ob': 85, 'bull_adx_thresh': 21.109465670235732, 'bull_atr_min_pct': 0.02945903612334092, 'bull_atr_max_pct': 0.03742615233686759, 'bull_tp_mult': 2.1510711467208363, 'bull_tsl_mult': 0.7097710990566121, 'bull_time_stop': 161, 'bull_use_sma': False, 'bull_use_ema': True, 'bull_use_atr': False, 'bull_use_adx': True, 'bull_use_spike': False, 'bull_rsi_required': True, 'bear_strategy': 'breakout', 'bear_bb_std_mult': 0.7184235740370608, 'bear_rsi_os': 29, 'bear_rsi_ob': 77, 'bear_adx_thresh': 31.971280311095292, 'bear_atr_min_pct': 0.019257090519740772, 'bear_atr_max_pct': 0.06367820972459541, 'bear_tp_mult': 2.0818672062537504, 'bear_tsl_mult': 0.07882615414262806, 'bear_time_stop': 289, 'bear_use_sma': False, 'bear_use_ema': False, 'bear_use_atr': True, 'bear_use_adx': False, 'bear_use_spike': True, 'bear_rsi_required': True, 'sideways_strategy': 'mean_reversion', 'sideways_bb_std_mult': 0.8636850646063214, 'sideways_rsi_os': 46, 'sideways_rsi_ob': 55, 'sideways_adx_thresh': 32.14129182799495, 'sideways_atr_min_pct': 0.028177536921432975, 'sideways_atr_max_pct': 0.10260580478922068, 'sideways_tp_mult': 1.900927491821744, 'sideways_tsl_mult': 0.5610212720772718, 'sideways_time_stop': 245, 'sideways_use_sma': False, 'sideways_use_ema': False, 'sideways_use_atr': False, 'sideways_use_adx': False, 'sideways_use_spike': False, 'sideways_rsi_required': False}.
[I 2025-08-30 20:53:21,961] Trial 52 finished with values: [-1000000000.0, 1000000000.0] and parameters: {'p_sma': 59, 'p_std': 43, 'p_atr': 12, 'p_adx': 20, 'rsi_period': 64, 'ema1': 12, 'ema2': 23, 'slip_atr_k': 0.14145101669096788, 'slip_spread_k': 0.02617723895096047, 'spread_hl_frac': 0.046416965475371524, 'bb_std_mult': 3.530288648770928, 'rsi_os': 9, 'rsi_ob': 66, 'vol_spike': 0.068780431386545, 'adx_thresh': 13.066089164272029, 'atr_min_pct': 0.015383727474238867, 'atr_max_pct': 0.011736320140977412, 'tp_mult': 1.331311873363468, 'tsl_mult': 0.49968561368434233, 'strategy': 'mean_reversion', 'time_stop': 21, 'use_sma': True, 'use_atr': True, 'use_adx': True, 'use_ema': False, 'use_spike': True, 'rsi_required': True, 'edge_k': 0.6785159605659111, 'edge_cap': 0.9981127180906455, 'bull_strategy': 'breakout', 'bull_bb_std_mult': 2.0022930362144638, 'bull_rsi_os': 39, 'bull_rsi_ob': 88, 'bull_adx_thresh': 34.85791990214004, 'bull_atr_min_pct': 0.0114496927623389, 'bull_atr_max_pct': 0.05308014563772025, 'bull_tp_mult': 2.8147215244613557, 'bull_tsl_mult': 0.3775946188991028, 'bull_time_stop': 146, 'bull_use_sma': False, 'bull_use_ema': False, 'bull_use_atr': False, 'bull_use_adx': False, 'bull_use_spike': False, 'bull_rsi_required': True, 'bear_strategy': 'mean_reversion', 'bear_bb_std_mult': 1.077651567720101, 'bear_rsi_os': 37, 'bear_rsi_ob': 78, 'bear_adx_thresh': 26.31221862660072, 'bear_atr_min_pct': 0.013206374025894009, 'bear_atr_max_pct': 0.04161500821558418, 'bear_tp_mult': 1.9664152953970642, 'bear_tsl_mult': 0.43033075069645, 'bear_time_stop': 28, 'bear_use_sma': True, 'bear_use_ema': False, 'bear_use_atr': False, 'bear_use_adx': False, 'bear_use_spike': True, 'bear_rsi_required': True, 'sideways_strategy': 'mean_reversion', 'sideways_bb_std_mult': 2.827394149744677, 'sideways_rsi_os': 55, 'sideways_rsi_ob': 59, 'sideways_adx_thresh': 33.26386855847399, 'sideways_atr_min_pct': 0.02816066789280331, 'sideways_atr_max_pct': 0.11433185789781526, 'sideways_tp_mult': 1.8871330359178022, 'sideways_tsl_mult': 0.20269911607042007, 'sideways_time_stop': 124, 'sideways_use_sma': False, 'sideways_use_ema': False, 'sideways_use_atr': False, 'sideways_use_adx': False, 'sideways_use_spike': False, 'sideways_rsi_required': False}.
[I 2025-08-30 20:53:28,235] Trial 50 finished with values: [-1000000000.0, 1000000000.0] and parameters: {'p_sma': 60, 'p_std': 53, 'p_atr': 12, 'p_adx': 23, 'rsi_period': 36, 'ema1': 16, 'ema2': 24, 'slip_atr_k': 0.08199244111087203, 'slip_spread_k': 0.8071992728810131, 'spread_hl_frac': 0.03802437118750226, 'bb_std_mult': 2.4120490443086826, 'rsi_os': 31, 'rsi_ob': 66, 'vol_spike': 0.017630075698909686, 'adx_thresh': 33.50337896293427, 'atr_min_pct': 0.012956478735019903, 'atr_max_pct': 0.04721219105605906, 'tp_mult': 1.473814964439176, 'tsl_mult': 0.25752787120455545, 'strategy': 'mean_reversion', 'time_stop': 230, 'use_sma': True, 'use_atr': True, 'use_adx': True, 'use_ema': False, 'use_spike': True, 'rsi_required': True, 'edge_k': 0.6866219083456144, 'edge_cap': 0.8584722707939689, 'bull_strategy': 'mean_reversion', 'bull_bb_std_mult': 1.6066842059364081, 'bull_rsi_os': 35, 'bull_rsi_ob': 85, 'bull_adx_thresh': 10.346988207521642, 'bull_atr_min_pct': 0.01960067621664166, 'bull_atr_max_pct': 0.037983631653022876, 'bull_tp_mult': 2.809241815405044, 'bull_tsl_mult': 0.7562037081302797, 'bull_time_stop': 163, 'bull_use_sma': False, 'bull_use_ema': False, 'bull_use_atr': False, 'bull_use_adx': True, 'bull_use_spike': False, 'bull_rsi_required': True, 'bear_strategy': 'breakout', 'bear_bb_std_mult': 1.0640835008882987, 'bear_rsi_os': 21, 'bear_rsi_ob': 78, 'bear_adx_thresh': 33.41717915292591, 'bear_atr_min_pct': 0.0038222421254240115, 'bear_atr_max_pct': 0.06351404346888856, 'bear_tp_mult': 2.5888829682776837, 'bear_tsl_mult': 0.5519310543831044, 'bear_time_stop': 222, 'bear_use_sma': False, 'bear_use_ema': False, 'bear_use_atr': True, 'bear_use_adx': False, 'bear_use_spike': True, 'bear_rsi_required': True, 'sideways_strategy': 'mean_reversion', 'sideways_bb_std_mult': 0.9879021836235216, 'sideways_rsi_os': 15, 'sideways_rsi_ob': 54, 'sideways_adx_thresh': 31.771138219007103, 'sideways_atr_min_pct': 0.020512164924017234, 'sideways_atr_max_pct': 0.09876610108139336, 'sideways_tp_mult': 1.9243770035491072, 'sideways_tsl_mult': 0.561725535272876, 'sideways_time_stop': 247, 'sideways_use_sma': False, 'sideways_use_ema': False, 'sideways_use_atr': False, 'sideways_use_adx': False, 'sideways_use_spike': False, 'sideways_rsi_required': False}.
[I 2025-08-30 20:53:53,156] Trial 51 finished with values: [-1000000000.0, 1000000000.0] and parameters: {'p_sma': 56, 'p_std': 36, 'p_atr': 12, 'p_adx': 20, 'rsi_period': 77, 'ema1': 14, 'ema2': 14, 'slip_atr_k': 0.20362170667592988, 'slip_spread_k': 0.1536848706078029, 'spread_hl_frac': 0.045690417169378744, 'bb_std_mult': 2.4100317501460577, 'rsi_os': 31, 'rsi_ob': 66, 'vol_spike': 0.06867753799080781, 'adx_thresh': 5.909645015252159, 'atr_min_pct': 0.023655067399899, 'atr_max_pct': 0.0580806900426835, 'tp_mult': 1.2908049332506302, 'tsl_mult': 0.26683658468940386, 'strategy': 'mean_reversion', 'time_stop': 6, 'use_sma': True, 'use_atr': True, 'use_adx': True, 'use_ema': False, 'use_spike': True, 'rsi_required': True, 'edge_k': 0.6795098604899774, 'edge_cap': 0.9955689364499588, 'bull_strategy': 'mean_reversion', 'bull_bb_std_mult': 1.9559479005358824, 'bull_rsi_os': 26, 'bull_rsi_ob': 84, 'bull_adx_thresh': 10.653130378210033, 'bull_atr_min_pct': 0.019443353971127373, 'bull_atr_max_pct': 0.03770704722280173, 'bull_tp_mult': 1.9037044075742082, 'bull_tsl_mult': 0.3777653291684596, 'bull_time_stop': 190, 'bull_use_sma': False, 'bull_use_ema': False, 'bull_use_atr': False, 'bull_use_adx': True, 'bull_use_spike': False, 'bull_rsi_required': True, 'bear_strategy': 'mean_reversion', 'bear_bb_std_mult': 1.0202919161446313, 'bear_rsi_os': 37, 'bear_rsi_ob': 77, 'bear_adx_thresh': 21.362427161703152, 'bear_atr_min_pct': 0.019301097451280252, 'bear_atr_max_pct': 0.06256238093804407, 'bear_tp_mult': 1.947490785229867, 'bear_tsl_mult': 0.5498578947353506, 'bear_time_stop': 206, 'bear_use_sma': True, 'bear_use_ema': False, 'bear_use_atr': False, 'bear_use_adx': False, 'bear_use_spike': True, 'bear_rsi_required': True, 'sideways_strategy': 'mean_reversion', 'sideways_bb_std_mult': 1.0593255533400452, 'sideways_rsi_os': 15, 'sideways_rsi_ob': 61, 'sideways_adx_thresh': 25.686545151819562, 'sideways_atr_min_pct': 0.020743319734553203, 'sideways_atr_max_pct': 0.03522110485171494, 'sideways_tp_mult': 1.9289930480302186, 'sideways_tsl_mult': 0.34021584992765697, 'sideways_time_stop': 123, 'sideways_use_sma': False, 'sideways_use_ema': False, 'sideways_use_atr': False, 'sideways_use_adx': False, 'sideways_use_spike': False, 'sideways_rsi_required': False}.
[I 2025-08-30 20:53:53,548] Trial 53 finished with values: [-1000000000.0, 1000000000.0] and parameters: {'p_sma': 55, 'p_std': 53, 'p_atr': 11, 'p_adx': 23, 'rsi_period': 36, 'ema1': 14, 'ema2': 23, 'slip_atr_k': 0.20503367606324918, 'slip_spread_k': 0.15847069315940693, 'spread_hl_frac': 0.021524087897766005, 'bb_std_mult': 2.459913466362024, 'rsi_os': 12, 'rsi_ob': 76, 'vol_spike': 0.044795795889266674, 'adx_thresh': 5.036138996247098, 'atr_min_pct': 0.027827685520090913, 'atr_max_pct': 0.10383681201405304, 'tp_mult': 1.3304474340301746, 'tsl_mult': 0.5334915173964718, 'strategy': 'mean_reversion', 'time_stop': 18, 'use_sma': True, 'use_atr': True, 'use_adx': True, 'use_ema': False, 'use_spike': True, 'rsi_required': True, 'edge_k': 0.7066609340925278, 'edge_cap': 0.9874757694411175, 'bull_strategy': 'breakout', 'bull_bb_std_mult': 1.5934796473106856, 'bull_rsi_os': 39, 'bull_rsi_ob': 93, 'bull_adx_thresh': 7.144037891864281, 'bull_atr_min_pct': 0.011038980790501213, 'bull_atr_max_pct': 0.07503502464975209, 'bull_tp_mult': 2.8945675245602076, 'bull_tsl_mult': 0.37294430762418235, 'bull_time_stop': 113, 'bull_use_sma': False, 'bull_use_ema': False, 'bull_use_atr': False, 'bull_use_adx': False, 'bull_use_spike': False, 'bull_rsi_required': False, 'bear_strategy': 'mean_reversion', 'bear_bb_std_mult': 1.089065831002007, 'bear_rsi_os': 22, 'bear_rsi_ob': 78, 'bear_adx_thresh': 16.869356334090718, 'bear_atr_min_pct': 0.012947252305514644, 'bear_atr_max_pct': 0.04222909715129657, 'bear_tp_mult': 1.9632415290441287, 'bear_tsl_mult': 0.42136038155738975, 'bear_time_stop': 24, 'bear_use_sma': True, 'bear_use_ema': False, 'bear_use_atr': False, 'bear_use_adx': True, 'bear_use_spike': True, 'bear_rsi_required': True, 'sideways_strategy': 'mean_reversion', 'sideways_bb_std_mult': 2.871153031107956, 'sideways_rsi_os': 24, 'sideways_rsi_ob': 61, 'sideways_adx_thresh': 28.932694872462417, 'sideways_atr_min_pct': 0.02010006255390383, 'sideways_atr_max_pct': 0.11358386212795124, 'sideways_tp_mult': 1.701251062628542, 'sideways_tsl_mult': 0.6901238682269027, 'sideways_time_stop': 124, 'sideways_use_sma': False, 'sideways_use_ema': False, 'sideways_use_atr': False, 'sideways_use_adx': False, 'sideways_use_spike': False, 'sideways_rsi_required': False}.
