[I 2025-08-30 21:55:56,751] Trial 549 finished with values: [-1000000000.0, 1000000000.0] and parameters: {'p_sma': 5, 'p_std': 49, 'p_atr': 25, 'p_adx': 15, 'rsi_period': 71, 'ema1': 5, 'ema2': 55, 'slip_atr_k': 0.01525533602952918, 'slip_spread_k': 0.6342496733764373, 'spread_hl_frac': 0.030478852539316773, 'bb_std_mult': 0.724897494197599, 'rsi_os': 12, 'rsi_ob': 86, 'vol_spike': 0.2886274883570309, 'adx_thresh': 26.02190705624426, 'atr_min_pct': 0.003839160983204283, 'atr_max_pct': 0.1266716245268042, 'tp_mult': 1.5159761980663322, 'tsl_mult': 0.9009685086047912, 'strategy': 'mean_reversion', 'time_stop': 300, 'use_sma': True, 'use_atr': False, 'use_adx': False, 'use_ema': False, 'use_spike': False, 'rsi_required': True, 'edge_k': 0.15446119141679637, 'edge_cap': 0.7619809849833484, 'bull_strategy': 'breakout', 'bull_bb_std_mult': 1.8755571244103042, 'bull_rsi_os': 19, 'bull_rsi_ob': 90, 'bull_adx_thresh': 24.274189501914194, 'bull_atr_min_pct': 0.0013428298045517918, 'bull_atr_max_pct': 0.04844275987445683, 'bull_tp_mult': 1.5187523294789844, 'bull_tsl_mult': 0.9542713674621093, 'bull_time_stop': 300, 'bull_use_sma': False, 'bull_use_ema': True, 'bull_use_atr': False, 'bull_use_adx': False, 'bull_use_spike': False, 'bull_rsi_required': True, 'bear_strategy': 'mean_reversion', 'bear_bb_std_mult': 1.778314595785194, 'bear_rsi_os': 7, 'bear_rsi_ob': 62, 'bear_adx_thresh': 28.62510680925853, 'bear_atr_min_pct': 0.029413413240844823, 'bear_atr_max_pct': 0.12533635449108269, 'bear_tp_mult': 1.3271576820178788, 'bear_tsl_mult': 0.22648771437906606, 'bear_time_stop': 188, 'bear_use_sma': False, 'bear_use_ema': True, 'bear_use_atr': False, 'bear_use_adx': False, 'bear_use_spike': False, 'bear_rsi_required': True, 'sideways_strategy': 'breakout', 'sideways_bb_std_mult': 1.8000877609506782, 'sideways_rsi_os': 30, 'sideways_rsi_ob': 90, 'sideways_adx_thresh': 25.454967126672614, 'sideways_atr_min_pct': 0.011115215684680116, 'sideways_atr_max_pct': 0.1128853043775804, 'sideways_tp_mult': 1.8472632056425975, 'sideways_tsl_mult': 0.7813337793182347, 'sideways_time_stop': 180, 'sideways_use_sma': True, 'sideways_use_ema': False, 'sideways_use_atr': False, 'sideways_use_adx': True, 'sideways_use_spike': True, 'sideways_rsi_required': False}.
[I 2025-08-30 21:55:56,751] Trial 550 finished with values: [-1000000000.0, 1000000000.0] and parameters: {'p_sma': 34, 'p_std': 38, 'p_atr': 20, 'p_adx': 20, 'rsi_period': 71, 'ema1': 6, 'ema2': 55, 'slip_atr_k': 0.013822828878696175, 'slip_spread_k': 0.6295689840527677, 'spread_hl_frac': 0.030215391534249552, 'bb_std_mult': 0.7248982620613064, 'rsi_os': 12, 'rsi_ob': 68, 'vol_spike': 0.2894046712268366, 'adx_thresh': 26.36719745994565, 'atr_min_pct': 0.013966170501512202, 'atr_max_pct': 0.12712538377680746, 'tp_mult': 2.556937588017471, 'tsl_mult': 0.8959906949576495, 'strategy': 'mean_reversion', 'time_stop': 280, 'use_sma': True, 'use_atr': False, 'use_adx': False, 'use_ema': False, 'use_spike': False, 'rsi_required': True, 'edge_k': 1.0643671204618983, 'edge_cap': 0.18756925507480127, 'bull_strategy': 'breakout', 'bull_bb_std_mult': 1.8673616013075562, 'bull_rsi_os': 20, 'bull_rsi_ob': 85, 'bull_adx_thresh': 15.052825964426466, 'bull_atr_min_pct': 0.0012738133337513262, 'bull_atr_max_pct': 0.04818963706153865, 'bull_tp_mult': 1.5320659445135947, 'bull_tsl_mult': 0.36273720770084916, 'bull_time_stop': 5, 'bull_use_sma': False, 'bull_use_ema': True, 'bull_use_atr': False, 'bull_use_adx': False, 'bull_use_spike': False, 'bull_rsi_required': True, 'bear_strategy': 'mean_reversion', 'bear_bb_std_mult': 2.0106849199140147, 'bear_rsi_os': 16, 'bear_rsi_ob': 93, 'bear_adx_thresh': 28.384743139127863, 'bear_atr_min_pct': 0.029977395427992323, 'bear_atr_max_pct': 0.11230094005654986, 'bear_tp_mult': 1.6691590557917568, 'bear_tsl_mult': 0.14359177051249894, 'bear_time_stop': 23, 'bear_use_sma': False, 'bear_use_ema': True, 'bear_use_atr': False, 'bear_use_adx': False, 'bear_use_spike': False, 'bear_rsi_required': True, 'sideways_strategy': 'breakout', 'sideways_bb_std_mult': 3.4189980278433607, 'sideways_rsi_os': 30, 'sideways_rsi_ob': 69, 'sideways_adx_thresh': 28.160468121043685, 'sideways_atr_min_pct': 0.0008133862974617195, 'sideways_atr_max_pct': 0.04683199091363742, 'sideways_tp_mult': 1.8663277433264716, 'sideways_tsl_mult': 0.7806234561991373, 'sideways_time_stop': 104, 'sideways_use_sma': True, 'sideways_use_ema': False, 'sideways_use_atr': False, 'sideways_use_adx': True, 'sideways_use_spike': True, 'sideways_rsi_required': False}.
[I 2025-08-30 21:56:31,001] Trial 554 finished with values: [-1000000000.0, 1000000000.0] and parameters: {'p_sma': 36, 'p_std': 36, 'p_atr': 22, 'p_adx': 22, 'rsi_period': 74, 'ema1': 11, 'ema2': 56, 'slip_atr_k': 0.02149714617383634, 'slip_spread_k': 0.2927406428103506, 'spread_hl_frac': 0.034105544940443225, 'bb_std_mult': 3.202668489957098, 'rsi_os': 40, 'rsi_ob': 65, 'vol_spike': 0.27836234735625265, 'adx_thresh': 10.238540798408321, 'atr_min_pct': 0.011191696254281739, 'atr_max_pct': 0.07385026681448482, 'tp_mult': 1.7077637833963017, 'tsl_mult': 0.7249797648673137, 'strategy': 'mean_reversion', 'time_stop': 89, 'use_sma': True, 'use_atr': True, 'use_adx': True, 'use_ema': True, 'use_spike': True, 'rsi_required': True, 'edge_k': 0.5521239603789388, 'edge_cap': 0.7920570684931698, 'bull_strategy': 'mean_reversion', 'bull_bb_std_mult': 1.4413668643902948, 'bull_rsi_os': 12, 'bull_rsi_ob': 85, 'bull_adx_thresh': 29.78685857704074, 'bull_atr_min_pct': 0.003876857765852061, 'bull_atr_max_pct': 0.059691019095861324, 'bull_tp_mult': 1.3923116305942538, 'bull_tsl_mult': 0.3825280604725438, 'bull_time_stop': 294, 'bull_use_sma': True, 'bull_use_ema': False, 'bull_use_atr': False, 'bull_use_adx': False, 'bull_use_spike': False, 'bull_rsi_required': True, 'bear_strategy': 'mean_reversion', 'bear_bb_std_mult': 2.0227100333385204, 'bear_rsi_os': 6, 'bear_rsi_ob': 46, 'bear_adx_thresh': 27.134985901468845, 'bear_atr_min_pct': 0.028839382655785218, 'bear_atr_max_pct': 0.05109321876392177, 'bear_tp_mult': 1.442450530285569, 'bear_tsl_mult': 0.37712784080560335, 'bear_time_stop': 228, 'bear_use_sma': False, 'bear_use_ema': True, 'bear_use_atr': False, 'bear_use_adx': True, 'bear_use_spike': True, 'bear_rsi_required': True, 'sideways_strategy': 'breakout', 'sideways_bb_std_mult': 1.8695941228530097, 'sideways_rsi_os': 52, 'sideways_rsi_ob': 87, 'sideways_adx_thresh': 26.54423711754333, 'sideways_atr_min_pct': 0.021888531436643918, 'sideways_atr_max_pct': 0.039981262929012315, 'sideways_tp_mult': 1.8105636182130407, 'sideways_tsl_mult': 0.7776714841059671, 'sideways_time_stop': 50, 'sideways_use_sma': False, 'sideways_use_ema': False, 'sideways_use_atr': False, 'sideways_use_adx': True, 'sideways_use_spike': False, 'sideways_rsi_required': False}.
[I 2025-08-30 21:56:31,014] Trial 553 finished with values: [-1000000000.0, 1000000000.0] and parameters: {'p_sma': 36, 'p_std': 36, 'p_atr': 26, 'p_adx': 19, 'rsi_period': 75, 'ema1': 11, 'ema2': 51, 'slip_atr_k': 0.021371449235341067, 'slip_spread_k': 0.37217991387579064, 'spread_hl_frac': 0.04108030983667199, 'bb_std_mult': 0.8756346481540855, 'rsi_os': 48, 'rsi_ob': 75, 'vol_spike': 0.15883459011375223, 'adx_thresh': 10.657375643646283, 'atr_min_pct': 0.011431177025303073, 'atr_max_pct': 0.02222881528107273, 'tp_mult': 1.7034996039181352, 'tsl_mult': 0.9443921124514507, 'strategy': 'mean_reversion', 'time_stop': 89, 'use_sma': True, 'use_atr': True, 'use_adx': True, 'use_ema': True, 'use_spike': True, 'rsi_required': True, 'edge_k': 0.9157927715429031, 'edge_cap': 0.7922635948264185, 'bull_strategy': 'mean_reversion', 'bull_bb_std_mult': 1.9316420911047492, 'bull_rsi_os': 22, 'bull_rsi_ob': 83, 'bull_adx_thresh': 13.90617847604919, 'bull_atr_min_pct': 0.023384128606920997, 'bull_atr_max_pct': 0.03140030112576096, 'bull_tp_mult': 1.4065833370174279, 'bull_tsl_mult': 0.38231862318282184, 'bull_time_stop': 295, 'bull_use_sma': True, 'bull_use_ema': False, 'bull_use_atr': False, 'bull_use_adx': False, 'bull_use_spike': False, 'bull_rsi_required': True, 'bear_strategy': 'mean_reversion', 'bear_bb_std_mult': 2.0175425515890817, 'bear_rsi_os': 6, 'bear_rsi_ob': 75, 'bear_adx_thresh': 26.794699011775627, 'bear_atr_min_pct': 0.029970470814578452, 'bear_atr_max_pct': 0.11507705744429943, 'bear_tp_mult': 1.9825784215722781, 'bear_tsl_mult': 0.8165718329687617, 'bear_time_stop': 228, 'bear_use_sma': False, 'bear_use_ema': True, 'bear_use_atr': False, 'bear_use_adx': True, 'bear_use_spike': True, 'bear_rsi_required': True, 'sideways_strategy': 'breakout', 'sideways_bb_std_mult': 3.1136786243981205, 'sideways_rsi_os': 17, 'sideways_rsi_ob': 87, 'sideways_adx_thresh': 26.738364070166373, 'sideways_atr_min_pct': 0.019736614578502627, 'sideways_atr_max_pct': 0.1297289346323147, 'sideways_tp_mult': 1.8055112559623554, 'sideways_tsl_mult': 0.7960151308695307, 'sideways_time_stop': 292, 'sideways_use_sma': False, 'sideways_use_ema': False, 'sideways_use_atr': False, 'sideways_use_adx': True, 'sideways_use_spike': False, 'sideways_rsi_required': False}.
[I 2025-08-30 21:56:31,345] Trial 552 finished with values: [-1000000000.0, 1000000000.0] and parameters: {'p_sma': 35, 'p_std': 49, 'p_atr': 26, 'p_adx': 19, 'rsi_period': 72, 'ema1': 6, 'ema2': 55, 'slip_atr_k': 0.013666499689052425, 'slip_spread_k': 0.6449970440007688, 'spread_hl_frac': 0.016602655662264786, 'bb_std_mult': 0.8497740171484274, 'rsi_os': 37, 'rsi_ob': 64, 'vol_spike': 0.28706075284500726, 'adx_thresh': 26.46266264496436, 'atr_min_pct': 0.01438027280386898, 'atr_max_pct': 0.12799274719203071, 'tp_mult': 2.5672631721684707, 'tsl_mult': 0.8915307699283755, 'strategy': 'mean_reversion', 'time_stop': 28, 'use_sma': True, 'use_atr': False, 'use_adx': False, 'use_ema': False, 'use_spike': False, 'rsi_required': True, 'edge_k': 1.1197583753764637, 'edge_cap': 0.7940529137571153, 'bull_strategy': 'mean_reversion', 'bull_bb_std_mult': 0.6990982831642003, 'bull_rsi_os': 20, 'bull_rsi_ob': 85, 'bull_adx_thresh': 15.09240598298425, 'bull_atr_min_pct': 0.001295162915564619, 'bull_atr_max_pct': 0.059454263925783166, 'bull_tp_mult': 1.3905967921030882, 'bull_tsl_mult': 0.18166306484329536, 'bull_time_stop': 294, 'bull_use_sma': False, 'bull_use_ema': False, 'bull_use_atr': False, 'bull_use_adx': False, 'bull_use_spike': False, 'bull_rsi_required': True, 'bear_strategy': 'mean_reversion', 'bear_bb_std_mult': 1.693014067791203, 'bear_rsi_os': 6, 'bear_rsi_ob': 46, 'bear_adx_thresh': 26.883624069108738, 'bear_atr_min_pct': 0.029191433546401923, 'bear_atr_max_pct': 0.11530559649670873, 'bear_tp_mult': 1.9799739470800892, 'bear_tsl_mult': 0.10080376070222952, 'bear_time_stop': 227, 'bear_use_sma': False, 'bear_use_ema': True, 'bear_use_atr': False, 'bear_use_adx': False, 'bear_use_spike': True, 'bear_rsi_required': True, 'sideways_strategy': 'breakout', 'sideways_bb_std_mult': 1.8464140688515578, 'sideways_rsi_os': 10, 'sideways_rsi_ob': 87, 'sideways_adx_thresh': 27.853211174824796, 'sideways_atr_min_pct': 0.0017010400942320744, 'sideways_atr_max_pct': 0.08342538380126938, 'sideways_tp_mult': 1.8246514366349442, 'sideways_tsl_mult': 0.7940567203131089, 'sideways_time_stop': 244, 'sideways_use_sma': False, 'sideways_use_ema': False, 'sideways_use_atr': False, 'sideways_use_adx': True, 'sideways_use_spike': True, 'sideways_rsi_required': False}.
[I 2025-08-30 21:56:31,357] Trial 551 finished with values: [-1000000000.0, 1000000000.0] and parameters: {'p_sma': 34, 'p_std': 38, 'p_atr': 22, 'p_adx': 19, 'rsi_period': 75, 'ema1': 11, 'ema2': 36, 'slip_atr_k': 0.020152704067216896, 'slip_spread_k': 0.22738537667204617, 'spread_hl_frac': 0.03432160819589718, 'bb_std_mult': 0.85324198945621, 'rsi_os': 12, 'rsi_ob': 56, 'vol_spike': 0.28981731717862974, 'adx_thresh': 9.178234031611568, 'atr_min_pct': 0.013979759155170314, 'atr_max_pct': 0.07440497728432369, 'tp_mult': 1.5121644273557036, 'tsl_mult': 0.7232519001110951, 'strategy': 'mean_reversion', 'time_stop': 89, 'use_sma': True, 'use_atr': False, 'use_adx': False, 'use_ema': False, 'use_spike': False, 'rsi_required': True, 'edge_k': 1.1163825761029633, 'edge_cap': 0.8296106299667512, 'bull_strategy': 'mean_reversion', 'bull_bb_std_mult': 1.8462232277635833, 'bull_rsi_os': 20, 'bull_rsi_ob': 58, 'bull_adx_thresh': 15.062416401549124, 'bull_atr_min_pct': 0.027270123258075783, 'bull_atr_max_pct': 0.05948396401742208, 'bull_tp_mult': 1.1066314061759541, 'bull_tsl_mult': 0.9438460675489231, 'bull_time_stop': 300, 'bull_use_sma': False, 'bull_use_ema': True, 'bull_use_atr': False, 'bull_use_adx': False, 'bull_use_spike': False, 'bull_rsi_required': True, 'bear_strategy': 'mean_reversion', 'bear_bb_std_mult': 1.6839405097254443, 'bear_rsi_os': 20, 'bear_rsi_ob': 58, 'bear_adx_thresh': 26.97018255132425, 'bear_atr_min_pct': 0.029996286704371624, 'bear_atr_max_pct': 0.11222802458004108, 'bear_tp_mult': 1.6769129034780088, 'bear_tsl_mult': 0.1458861309276699, 'bear_time_stop': 13, 'bear_use_sma': False, 'bear_use_ema': True, 'bear_use_atr': False, 'bear_use_adx': False, 'bear_use_spike': True, 'bear_rsi_required': True, 'sideways_strategy': 'breakout', 'sideways_bb_std_mult': 0.5894796036400198, 'sideways_rsi_os': 30, 'sideways_rsi_ob': 90, 'sideways_adx_thresh': 25.255164648126673, 'sideways_atr_min_pct': 0.02192021999454202, 'sideways_atr_max_pct': 0.1240113379401593, 'sideways_tp_mult': 1.8712741346694393, 'sideways_tsl_mult': 0.7825603108210568, 'sideways_time_stop': 244, 'sideways_use_sma': False, 'sideways_use_ema': False, 'sideways_use_atr': False, 'sideways_use_adx': True, 'sideways_use_spike': True, 'sideways_rsi_required': False}.
[I 2025-08-30 21:57:05,537] Trial 558 finished with values: [-1000000000.0, 1000000000.0] and parameters: {'p_sma': 33, 'p_std': 11, 'p_atr': 21, 'p_adx': 22, 'rsi_period': 72, 'ema1': 9, 'ema2': 56, 'slip_atr_k': 0.031705291107795484, 'slip_spread_k': 0.6826720361346104, 'spread_hl_frac': 0.03225736391932079, 'bb_std_mult': 0.6358272709491586, 'rsi_os': 30, 'rsi_ob': 48, 'vol_spike': 0.022037704090109966, 'adx_thresh': 11.897394129755806, 'atr_min_pct': 0.012504951092763842, 'atr_max_pct': 0.01951259228184754, 'tp_mult': 2.4944600362233276, 'tsl_mult': 0.8253840363996261, 'strategy': 'breakout', 'time_stop': 102, 'use_sma': True, 'use_atr': True, 'use_adx': True, 'use_ema': True, 'use_spike': True, 'rsi_required': True, 'edge_k': 1.7897565614067343, 'edge_cap': 0.8110387537138151, 'bull_strategy': 'breakout', 'bull_bb_std_mult': 0.8286996666347826, 'bull_rsi_os': 7, 'bull_rsi_ob': 77, 'bull_adx_thresh': 12.518035553310284, 'bull_atr_min_pct': 0.0020966384016737113, 'bull_atr_max_pct': 0.013492690131139212, 'bull_tp_mult': 1.353331104586317, 'bull_tsl_mult': 0.2246659446289973, 'bull_time_stop': 286, 'bull_use_sma': True, 'bull_use_ema': False, 'bull_use_atr': True, 'bull_use_adx': False, 'bull_use_spike': False, 'bull_rsi_required': False, 'bear_strategy': 'breakout', 'bear_bb_std_mult': 0.947734659056654, 'bear_rsi_os': 8, 'bear_rsi_ob': 71, 'bear_adx_thresh': 27.779350943529906, 'bear_atr_min_pct': 0.02654818139571661, 'bear_atr_max_pct': 0.04133615783036064, 'bear_tp_mult': 1.57136693975393, 'bear_tsl_mult': 0.4394468355286403, 'bear_time_stop': 243, 'bear_use_sma': False, 'bear_use_ema': True, 'bear_use_atr': True, 'bear_use_adx': True, 'bear_use_spike': True, 'bear_rsi_required': False, 'sideways_strategy': 'mean_reversion', 'sideways_bb_std_mult': 1.364358302501416, 'sideways_rsi_os': 41, 'sideways_rsi_ob': 88, 'sideways_adx_thresh': 9.052928248502546, 'sideways_atr_min_pct': 0.012237398292831526, 'sideways_atr_max_pct': 0.05728841709785946, 'sideways_tp_mult': 1.7876311190058654, 'sideways_tsl_mult': 0.762005320605891, 'sideways_time_stop': 121, 'sideways_use_sma': False, 'sideways_use_ema': False, 'sideways_use_atr': False, 'sideways_use_adx': True, 'sideways_use_spike': False, 'sideways_rsi_required': False}.
[I 2025-08-30 21:57:05,739] Trial 555 finished with values: [-0.01762551869295681, 0.017533128799008056] and parameters: {'p_sma': 33, 'p_std': 57, 'p_atr': 28, 'p_adx': 22, 'rsi_period': 73, 'ema1': 8, 'ema2': 55, 'slip_atr_k': 0.03174769366035023, 'slip_spread_k': 0.6523459051023993, 'spread_hl_frac': 0.03523954487038801, 'bb_std_mult': 2.4154587243180057, 'rsi_os': 50, 'rsi_ob': 64, 'vol_spike': 0.2820561387732063, 'adx_thresh': 9.645391319575106, 'atr_min_pct': 0.013709518833477789, 'atr_max_pct': 0.018189532225788913, 'tp_mult': 1.6153454408563455, 'tsl_mult': 0.8401071170118144, 'strategy': 'breakout', 'time_stop': 92, 'use_sma': True, 'use_atr': True, 'use_adx': True, 'use_ema': True, 'use_spike': True, 'rsi_required': True, 'edge_k': 1.4613878749858766, 'edge_cap': 0.7305407825962742, 'bull_strategy': 'breakout', 'bull_bb_std_mult': 1.7242988590935622, 'bull_rsi_os': 20, 'bull_rsi_ob': 77, 'bull_adx_thresh': 14.958259324941872, 'bull_atr_min_pct': 0.0024091500123120287, 'bull_atr_max_pct': 0.13535555462871152, 'bull_tp_mult': 1.3439309536565112, 'bull_tsl_mult': 0.18124349679052199, 'bull_time_stop': 81, 'bull_use_sma': True, 'bull_use_ema': False, 'bull_use_atr': True, 'bull_use_adx': False, 'bull_use_spike': False, 'bull_rsi_required': False, 'bear_strategy': 'mean_reversion', 'bear_bb_std_mult': 0.5558650473993803, 'bear_rsi_os': 8, 'bear_rsi_ob': 71, 'bear_adx_thresh': 29.34644903582982, 'bear_atr_min_pct': 0.024647098930144114, 'bear_atr_max_pct': 0.11684677885105106, 'bear_tp_mult': 1.5680638739630395, 'bear_tsl_mult': 0.9769283105631512, 'bear_time_stop': 264, 'bear_use_sma': False, 'bear_use_ema': True, 'bear_use_atr': True, 'bear_use_adx': True, 'bear_use_spike': True, 'bear_rsi_required': True, 'sideways_strategy': 'breakout', 'sideways_bb_std_mult': 1.710254375881819, 'sideways_rsi_os': 41, 'sideways_rsi_ob': 91, 'sideways_adx_thresh': 28.077873280645118, 'sideways_atr_min_pct': 0.0016211868520335897, 'sideways_atr_max_pct': 0.11907433095248039, 'sideways_tp_mult': 1.8401209150383477, 'sideways_tsl_mult': 0.7603989954397249, 'sideways_time_stop': 246, 'sideways_use_sma': False, 'sideways_use_ema': False, 'sideways_use_atr': False, 'sideways_use_adx': True, 'sideways_use_spike': False, 'sideways_rsi_required': False}.
[I 2025-08-30 21:57:05,769] Trial 557 finished with values: [-1000000000.0, 1000000000.0] and parameters: {'p_sma': 33, 'p_std': 11, 'p_atr': 21, 'p_adx': 22, 'rsi_period': 37, 'ema1': 10, 'ema2': 26, 'slip_atr_k': 0.02615607642697825, 'slip_spread_k': 0.6760877285155293, 'spread_hl_frac': 0.03562710849668074, 'bb_std_mult': 2.6123935279221424, 'rsi_os': 42, 'rsi_ob': 68, 'vol_spike': 0.2547480625449021, 'adx_thresh': 11.825969888278966, 'atr_min_pct': 0.012401164850254083, 'atr_max_pct': 0.06461105461064723, 'tp_mult': 1.28741867195088, 'tsl_mult': 0.914684870413894, 'strategy': 'breakout', 'time_stop': 95, 'use_sma': True, 'use_atr': True, 'use_adx': True, 'use_ema': True, 'use_spike': True, 'rsi_required': True, 'edge_k': 1.461517819106859, 'edge_cap': 0.7264547558414325, 'bull_strategy': 'breakout', 'bull_bb_std_mult': 0.8181239766572368, 'bull_rsi_os': 52, 'bull_rsi_ob': 74, 'bull_adx_thresh': 12.119256558242073, 'bull_atr_min_pct': 0.002346551408811513, 'bull_atr_max_pct': 0.11176129645503495, 'bull_tp_mult': 1.3366355535349506, 'bull_tsl_mult': 0.4160943798670558, 'bull_time_stop': 288, 'bull_use_sma': True, 'bull_use_ema': False, 'bull_use_atr': True, 'bull_use_adx': False, 'bull_use_spike': False, 'bull_rsi_required': False, 'bear_strategy': 'breakout', 'bear_bb_std_mult': 1.9471150168754814, 'bear_rsi_os': 8, 'bear_rsi_ob': 71, 'bear_adx_thresh': 30.780362280941244, 'bear_atr_min_pct': 0.02658264421558821, 'bear_atr_max_pct': 0.12017697644934934, 'bear_tp_mult': 2.390274197628581, 'bear_tsl_mult': 0.32943613254931836, 'bear_time_stop': 264, 'bear_use_sma': False, 'bear_use_ema': True, 'bear_use_atr': True, 'bear_use_adx': True, 'bear_use_spike': True, 'bear_rsi_required': False, 'sideways_strategy': 'mean_reversion', 'sideways_bb_std_mult': 1.6135725915389367, 'sideways_rsi_os': 47, 'sideways_rsi_ob': 55, 'sideways_adx_thresh': 27.594113619262703, 'sideways_atr_min_pct': 0.0212655393350128, 'sideways_atr_max_pct': 0.11987043006768347, 'sideways_tp_mult': 1.756959086676494, 'sideways_tsl_mult': 0.7641657582812877, 'sideways_time_stop': 120, 'sideways_use_sma': False, 'sideways_use_ema': False, 'sideways_use_atr': False, 'sideways_use_adx': True, 'sideways_use_spike': False, 'sideways_rsi_required': False}.
