[I 2025-08-30 22:14:35,065] Trial 709 finished with values: [-0.14316958663433177, 0.14313372831129417] and parameters: {'p_sma': 37, 'p_std': 38, 'p_atr': 22, 'p_adx': 21, 'rsi_period': 10, 'ema1': 10, 'ema2': 38, 'slip_atr_k': 0.09307537317422318, 'slip_spread_k': 0.677564295265014, 'spread_hl_frac': 0.03636135035635111, 'bb_std_mult': 0.6473614621119412, 'rsi_os': 40, 'rsi_ob': 66, 'vol_spike': 0.29748241140824794, 'adx_thresh': 11.070003906768786, 'atr_min_pct': 0.015179342068816078, 'atr_max_pct': 0.03323293088263949, 'tp_mult': 1.6349978939617513, 'tsl_mult': 0.009752208033510068, 'strategy': 'mean_reversion', 'time_stop': 96, 'use_sma': False, 'use_atr': True, 'use_adx': True, 'use_ema': True, 'use_spike': True, 'rsi_required': True, 'edge_k': 0.5523402931691636, 'edge_cap': 0.3662962684516362, 'bull_strategy': 'breakout', 'bull_bb_std_mult': 1.983757315419596, 'bull_rsi_os': 15, 'bull_rsi_ob': 86, 'bull_adx_thresh': 22.860252073911944, 'bull_atr_min_pct': 0.0014540349820615804, 'bull_atr_max_pct': 0.12232137342683615, 'bull_tp_mult': 1.2841469025684922, 'bull_tsl_mult': 0.15885224453817282, 'bull_time_stop': 255, 'bull_use_sma': True, 'bull_use_ema': False, 'bull_use_atr': False, 'bull_use_adx': False, 'bull_use_spike': False, 'bull_rsi_required': True, 'bear_strategy': 'breakout', 'bear_bb_std_mult': 3.344448959955114, 'bear_rsi_os': 12, 'bear_rsi_ob': 82, 'bear_adx_thresh': 28.824316394490197, 'bear_atr_min_pct': 0.018017028301950642, 'bear_atr_max_pct': 0.10590245325312453, 'bear_tp_mult': 1.6218076160527264, 'bear_tsl_mult': 0.41330514501660565, 'bear_time_stop': 229, 'bear_use_sma': False, 'bear_use_ema': True, 'bear_use_atr': False, 'bear_use_adx': True, 'bear_use_spike': True, 'bear_rsi_required': True, 'sideways_strategy': 'breakout', 'sideways_bb_std_mult': 0.8833048140346829, 'sideways_rsi_os': 40, 'sideways_rsi_ob': 47, 'sideways_adx_thresh': 26.20032132024315, 'sideways_atr_min_pct': 1.6364596424458047e-05, 'sideways_atr_max_pct': 0.04273883835746417, 'sideways_tp_mult': 1.9133010255287168, 'sideways_tsl_mult': 0.7678762473486179, 'sideways_time_stop': 261, 'sideways_use_sma': False, 'sideways_use_ema': False, 'sideways_use_atr': True, 'sideways_use_adx': False, 'sideways_use_spike': False, 'sideways_rsi_required': False}.
[I 2025-08-30 22:14:36,036] Trial 714 finished with values: [-1000000000.0, 1000000000.0] and parameters: {'p_sma': 37, 'p_std': 46, 'p_atr': 21, 'p_adx': 23, 'rsi_period': 75, 'ema1': 17, 'ema2': 54, 'slip_atr_k': 0.06841457674098522, 'slip_spread_k': 0.46520482033193133, 'spread_hl_frac': 0.03358343734356457, 'bb_std_mult': 0.6609818493881688, 'rsi_os': 13, 'rsi_ob': 47, 'vol_spike': 0.0009476203606224309, 'adx_thresh': 13.313843887656617, 'atr_min_pct': 0.013136500140866775, 'atr_max_pct': 0.025012669787747462, 'tp_mult': 1.8719863001794568, 'tsl_mult': 0.3753075970795952, 'strategy': 'mean_reversion', 'time_stop': 105, 'use_sma': True, 'use_atr': True, 'use_adx': True, 'use_ema': True, 'use_spike': True, 'rsi_required': True, 'edge_k': 1.1408211163422055, 'edge_cap': 0.809182875509056, 'bull_strategy': 'breakout', 'bull_bb_std_mult': 1.78729270784005, 'bull_rsi_os': 34, 'bull_rsi_ob': 86, 'bull_adx_thresh': 22.88708378260037, 'bull_atr_min_pct': 0.02590990833608245, 'bull_atr_max_pct': 0.04434255127588123, 'bull_tp_mult': 1.5496622137045697, 'bull_tsl_mult': 0.3795349777364966, 'bull_time_stop': 300, 'bull_use_sma': True, 'bull_use_ema': False, 'bull_use_atr': False, 'bull_use_adx': False, 'bull_use_spike': False, 'bull_rsi_required': True, 'bear_strategy': 'mean_reversion', 'bear_bb_std_mult': 1.9642219905774303, 'bear_rsi_os': 12, 'bear_rsi_ob': 70, 'bear_adx_thresh': 7.878835517902408, 'bear_atr_min_pct': 0.018184055258477872, 'bear_atr_max_pct': 0.07243605958197046, 'bear_tp_mult': 1.4872216759260857, 'bear_tsl_mult': 0.08956760911434575, 'bear_time_stop': 255, 'bear_use_sma': False, 'bear_use_ema': True, 'bear_use_atr': False, 'bear_use_adx': True, 'bear_use_spike': True, 'bear_rsi_required': True, 'sideways_strategy': 'breakout', 'sideways_bb_std_mult': 1.6529198137332826, 'sideways_rsi_os': 40, 'sideways_rsi_ob': 78, 'sideways_adx_thresh': 26.68162926287373, 'sideways_atr_min_pct': 0.019964933995558768, 'sideways_atr_max_pct': 0.04843281749235657, 'sideways_tp_mult': 2.721306407974362, 'sideways_tsl_mult': 0.8574387641058152, 'sideways_time_stop': 267, 'sideways_use_sma': False, 'sideways_use_ema': False, 'sideways_use_atr': False, 'sideways_use_adx': True, 'sideways_use_spike': False, 'sideways_rsi_required': False}.
[I 2025-08-30 22:14:36,057] Trial 712 finished with values: [-1000000000.0, 1000000000.0] and parameters: {'p_sma': 37, 'p_std': 34, 'p_atr': 9, 'p_adx': 23, 'rsi_period': 33, 'ema1': 17, 'ema2': 54, 'slip_atr_k': 0.05693850518660226, 'slip_spread_k': 0.6634049112602609, 'spread_hl_frac': 0.036691673603560904, 'bb_std_mult': 2.6158729791782696, 'rsi_os': 33, 'rsi_ob': 47, 'vol_spike': 0.15220483397591922, 'adx_thresh': 10.344437465498817, 'atr_min_pct': 0.018177990099418544, 'atr_max_pct': 0.024107723350445465, 'tp_mult': 1.6628456414547468, 'tsl_mult': 0.38903105377718644, 'strategy': 'mean_reversion', 'time_stop': 80, 'use_sma': True, 'use_atr': True, 'use_adx': True, 'use_ema': True, 'use_spike': True, 'rsi_required': True, 'edge_k': 1.336777776835032, 'edge_cap': 0.8146442645969176, 'bull_strategy': 'breakout', 'bull_bb_std_mult': 1.7990706490716422, 'bull_rsi_os': 34, 'bull_rsi_ob': 86, 'bull_adx_thresh': 12.495375062280068, 'bull_atr_min_pct': 0.0073794866000289235, 'bull_atr_max_pct': 0.012246808187192981, 'bull_tp_mult': 1.5481569476243309, 'bull_tsl_mult': 0.39515204699360323, 'bull_time_stop': 173, 'bull_use_sma': True, 'bull_use_ema': False, 'bull_use_atr': False, 'bull_use_adx': False, 'bull_use_spike': False, 'bull_rsi_required': True, 'bear_strategy': 'mean_reversion', 'bear_bb_std_mult': 1.9848191848256105, 'bear_rsi_os': 23, 'bear_rsi_ob': 70, 'bear_adx_thresh': 27.407605023618775, 'bear_atr_min_pct': 0.00269554349817404, 'bear_atr_max_pct': 0.08544128107770446, 'bear_tp_mult': 1.4988748269420022, 'bear_tsl_mult': 0.7318170976795111, 'bear_time_stop': 253, 'bear_use_sma': False, 'bear_use_ema': True, 'bear_use_atr': False, 'bear_use_adx': True, 'bear_use_spike': True, 'bear_rsi_required': True, 'sideways_strategy': 'breakout', 'sideways_bb_std_mult': 0.9342660794956454, 'sideways_rsi_os': 7, 'sideways_rsi_ob': 62, 'sideways_adx_thresh': 26.860418979219105, 'sideways_atr_min_pct': 0.024262461560112247, 'sideways_atr_max_pct': 0.0673993239088143, 'sideways_tp_mult': 2.723404972989899, 'sideways_tsl_mult': 0.854136297419191, 'sideways_time_stop': 231, 'sideways_use_sma': False, 'sideways_use_ema': False, 'sideways_use_atr': False, 'sideways_use_adx': True, 'sideways_use_spike': False, 'sideways_rsi_required': False}.
[I 2025-08-30 22:14:36,077] Trial 713 finished with values: [-1000000000.0, 1000000000.0] and parameters: {'p_sma': 37, 'p_std': 7, 'p_atr': 9, 'p_adx': 23, 'rsi_period': 34, 'ema1': 17, 'ema2': 50, 'slip_atr_k': 0.014646471973901763, 'slip_spread_k': 0.4722538767528646, 'spread_hl_frac': 0.03412258292816718, 'bb_std_mult': 2.6098145545871594, 'rsi_os': 13, 'rsi_ob': 47, 'vol_spike': 0.2855449887916683, 'adx_thresh': 10.336674037115127, 'atr_min_pct': 0.01320390752996313, 'atr_max_pct': 0.024103694401713435, 'tp_mult': 1.6656034633265608, 'tsl_mult': 0.8493275531328935, 'strategy': 'mean_reversion', 'time_stop': 160, 'use_sma': True, 'use_atr': True, 'use_adx': True, 'use_ema': True, 'use_spike': True, 'rsi_required': True, 'edge_k': 1.146195994077616, 'edge_cap': 0.3716583406860139, 'bull_strategy': 'breakout', 'bull_bb_std_mult': 1.7891114681573839, 'bull_rsi_os': 17, 'bull_rsi_ob': 86, 'bull_adx_thresh': 18.140244660847465, 'bull_atr_min_pct': 0.007422770105688128, 'bull_atr_max_pct': 0.0522628828092664, 'bull_tp_mult': 1.542415368034712, 'bull_tsl_mult': 0.196321922985135, 'bull_time_stop': 78, 'bull_use_sma': True, 'bull_use_ema': False, 'bull_use_atr': False, 'bull_use_adx': False, 'bull_use_spike': False, 'bull_rsi_required': True, 'bear_strategy': 'mean_reversion', 'bear_bb_std_mult': 2.1699508798067386, 'bear_rsi_os': 26, 'bear_rsi_ob': 74, 'bear_adx_thresh': 27.307301635289097, 'bear_atr_min_pct': 0.01809468276465888, 'bear_atr_max_pct': 0.07177649768436532, 'bear_tp_mult': 1.4825049367510117, 'bear_tsl_mult': 0.42455348772595863, 'bear_time_stop': 40, 'bear_use_sma': False, 'bear_use_ema': True, 'bear_use_atr': False, 'bear_use_adx': True, 'bear_use_spike': True, 'bear_rsi_required': True, 'sideways_strategy': 'breakout', 'sideways_bb_std_mult': 1.6536360429062944, 'sideways_rsi_os': 19, 'sideways_rsi_ob': 62, 'sideways_adx_thresh': 24.44899674768708, 'sideways_atr_min_pct': 0.028555325505114512, 'sideways_atr_max_pct': 0.12257402863096961, 'sideways_tp_mult': 1.9282689324381506, 'sideways_tsl_mult': 0.7641464446707642, 'sideways_time_stop': 266, 'sideways_use_sma': False, 'sideways_use_ema': False, 'sideways_use_atr': False, 'sideways_use_adx': True, 'sideways_use_spike': False, 'sideways_rsi_required': False}.
[I 2025-08-30 22:14:39,655] Trial 716 finished with values: [-1000000000.0, 1000000000.0] and parameters: {'p_sma': 35, 'p_std': 34, 'p_atr': 21, 'p_adx': 11, 'rsi_period': 33, 'ema1': 8, 'ema2': 58, 'slip_atr_k': 0.02223055982182864, 'slip_spread_k': 0.6512160687026204, 'spread_hl_frac': 0.035058362995066754, 'bb_std_mult': 0.7704628421155539, 'rsi_os': 11, 'rsi_ob': 65, 'vol_spike': 0.18447136576340048, 'adx_thresh': 10.136557002789196, 'atr_min_pct': 0.025100110899881144, 'atr_max_pct': 0.011403660191745005, 'tp_mult': 1.2675039709268234, 'tsl_mult': 0.8478701803932384, 'strategy': 'mean_reversion', 'time_stop': 82, 'use_sma': True, 'use_atr': False, 'use_adx': True, 'use_ema': True, 'use_spike': True, 'rsi_required': True, 'edge_k': 1.611798530537976, 'edge_cap': 0.8004702005067428, 'bull_strategy': 'breakout', 'bull_bb_std_mult': 1.8753917506869924, 'bull_rsi_os': 17, 'bull_rsi_ob': 63, 'bull_adx_thresh': 24.459420992445644, 'bull_atr_min_pct': 0.007251144638670923, 'bull_atr_max_pct': 0.13618271339220703, 'bull_tp_mult': 1.3706157385040458, 'bull_tsl_mult': 0.2662722186233082, 'bull_time_stop': 105, 'bull_use_sma': True, 'bull_use_ema': False, 'bull_use_atr': False, 'bull_use_adx': False, 'bull_use_spike': False, 'bull_rsi_required': True, 'bear_strategy': 'mean_reversion', 'bear_bb_std_mult': 0.7775597683643818, 'bear_rsi_os': 9, 'bear_rsi_ob': 74, 'bear_adx_thresh': 27.42481690069427, 'bear_atr_min_pct': 0.02941812590955001, 'bear_atr_max_pct': 0.08812314345089022, 'bear_tp_mult': 1.954487360207151, 'bear_tsl_mult': 0.7318366529037674, 'bear_time_stop': 244, 'bear_use_sma': False, 'bear_use_ema': False, 'bear_use_atr': False, 'bear_use_adx': True, 'bear_use_spike': True, 'bear_rsi_required': True, 'sideways_strategy': 'breakout', 'sideways_bb_std_mult': 1.025194594072834, 'sideways_rsi_os': 38, 'sideways_rsi_ob': 61, 'sideways_adx_thresh': 13.55309458027472, 'sideways_atr_min_pct': 0.02404950853234911, 'sideways_atr_max_pct': 0.027809799014606125, 'sideways_tp_mult': 1.8448654678335694, 'sideways_tsl_mult': 0.938340188894745, 'sideways_time_stop': 279, 'sideways_use_sma': False, 'sideways_use_ema': False, 'sideways_use_atr': False, 'sideways_use_adx': True, 'sideways_use_spike': False, 'sideways_rsi_required': False}.
[I 2025-08-30 22:14:41,082] Trial 717 finished with values: [-1000000000.0, 1000000000.0] and parameters: {'p_sma': 35, 'p_std': 8, 'p_atr': 21, 'p_adx': 22, 'rsi_period': 56, 'ema1': 6, 'ema2': 58, 'slip_atr_k': 0.016199211765106095, 'slip_spread_k': 0.7508071472573925, 'spread_hl_frac': 0.0446703321216305, 'bb_std_mult': 2.820469289819002, 'rsi_os': 31, 'rsi_ob': 49, 'vol_spike': 0.2862467822248989, 'adx_thresh': 9.783061697812734, 'atr_min_pct': 0.007519386638730779, 'atr_max_pct': 0.06232307189661879, 'tp_mult': 1.5111375543667864, 'tsl_mult': 0.8522596207302746, 'strategy': 'mean_reversion', 'time_stop': 88, 'use_sma': True, 'use_atr': False, 'use_adx': True, 'use_ema': True, 'use_spike': True, 'rsi_required': True, 'edge_k': 0.8318229288527184, 'edge_cap': 0.06712859248464248, 'bull_strategy': 'breakout', 'bull_bb_std_mult': 1.8677013961885922, 'bull_rsi_os': 17, 'bull_rsi_ob': 46, 'bull_adx_thresh': 13.733661307083821, 'bull_atr_min_pct': 0.010770127601779454, 'bull_atr_max_pct': 0.05216921040876043, 'bull_tp_mult': 1.359412891125157, 'bull_tsl_mult': 0.3010994722417184, 'bull_time_stop': 233, 'bull_use_sma': True, 'bull_use_ema': False, 'bull_use_atr': False, 'bull_use_adx': False, 'bull_use_spike': False, 'bull_rsi_required': True, 'bear_strategy': 'mean_reversion', 'bear_bb_std_mult': 2.168583038966934, 'bear_rsi_os': 9, 'bear_rsi_ob': 56, 'bear_adx_thresh': 27.3345157613055, 'bear_atr_min_pct': 0.01190998454264987, 'bear_atr_max_pct': 0.08919827104015646, 'bear_tp_mult': 2.761248843526875, 'bear_tsl_mult': 0.36038776898212127, 'bear_time_stop': 244, 'bear_use_sma': False, 'bear_use_ema': False, 'bear_use_atr': False, 'bear_use_adx': True, 'bear_use_spike': True, 'bear_rsi_required': True, 'sideways_strategy': 'breakout', 'sideways_bb_std_mult': 1.597124260032926, 'sideways_rsi_os': 46, 'sideways_rsi_ob': 59, 'sideways_adx_thresh': 11.291389712521397, 'sideways_atr_min_pct': 0.017692928177862242, 'sideways_atr_max_pct': 0.0252957402110345, 'sideways_tp_mult': 1.763915399312614, 'sideways_tsl_mult': 0.9990603762251247, 'sideways_time_stop': 143, 'sideways_use_sma': False, 'sideways_use_ema': False, 'sideways_use_atr': False, 'sideways_use_adx': True, 'sideways_use_spike': False, 'sideways_rsi_required': False}.
[I 2025-08-30 22:14:47,352] Trial 715 finished with values: [-1000000000.0, 1000000000.0] and parameters: {'p_sma': 35, 'p_std': 34, 'p_atr': 21, 'p_adx': 24, 'rsi_period': 34, 'ema1': 12, 'ema2': 54, 'slip_atr_k': 0.1324150880805719, 'slip_spread_k': 0.8431409359903284, 'spread_hl_frac': 0.03383570012684704, 'bb_std_mult': 0.7196610915513045, 'rsi_os': 11, 'rsi_ob': 65, 'vol_spike': 0.2851217476825821, 'adx_thresh': 13.929671820772658, 'atr_min_pct': 0.00997276124257177, 'atr_max_pct': 0.024702982720834404, 'tp_mult': 1.861589818288461, 'tsl_mult': 0.3731443853862972, 'strategy': 'mean_reversion', 'time_stop': 160, 'use_sma': True, 'use_atr': True, 'use_adx': True, 'use_ema': True, 'use_spike': True, 'rsi_required': True, 'edge_k': 0.9771834301622162, 'edge_cap': 0.8082889433972654, 'bull_strategy': 'breakout', 'bull_bb_std_mult': 1.7819506940465013, 'bull_rsi_os': 47, 'bull_rsi_ob': 87, 'bull_adx_thresh': 12.612622730284997, 'bull_atr_min_pct': 0.007077083438864849, 'bull_atr_max_pct': 0.04434179608774233, 'bull_tp_mult': 1.3634396628610927, 'bull_tsl_mult': 0.261658780437082, 'bull_time_stop': 173, 'bull_use_sma': True, 'bull_use_ema': False, 'bull_use_atr': False, 'bull_use_adx': False, 'bull_use_spike': False, 'bull_rsi_required': True, 'bear_strategy': 'mean_reversion', 'bear_bb_std_mult': 0.7722231216357403, 'bear_rsi_os': 26, 'bear_rsi_ob': 70, 'bear_adx_thresh': 27.543571253222222, 'bear_atr_min_pct': 0.002708924365548329, 'bear_atr_max_pct': 0.08785888611598228, 'bear_tp_mult': 1.7891811667434672, 'bear_tsl_mult': 0.09794290713151249, 'bear_time_stop': 134, 'bear_use_sma': False, 'bear_use_ema': True, 'bear_use_atr': False, 'bear_use_adx': True, 'bear_use_spike': True, 'bear_rsi_required': True, 'sideways_strategy': 'breakout', 'sideways_bb_std_mult': 1.5808172215675727, 'sideways_rsi_os': 41, 'sideways_rsi_ob': 68, 'sideways_adx_thresh': 27.056782235118483, 'sideways_atr_min_pct': 0.024274048669313805, 'sideways_atr_max_pct': 0.026615156884889184, 'sideways_tp_mult': 2.759216473876533, 'sideways_tsl_mult': 0.7685716062122252, 'sideways_time_stop': 266, 'sideways_use_sma': False, 'sideways_use_ema': False, 'sideways_use_atr': False, 'sideways_use_adx': True, 'sideways_use_spike': False, 'sideways_rsi_required': False}.
[I 2025-08-30 22:14:54,540] Trial 718 finished with values: [-0.01702305573132812, 0.016926248179955576] and parameters: {'p_sma': 35, 'p_std': 37, 'p_atr': 21, 'p_adx': 11, 'rsi_period': 37, 'ema1': 12, 'ema2': 52, 'slip_atr_k': 0.023927297149140755, 'slip_spread_k': 0.6340133444408858, 'spread_hl_frac': 0.012657107112180056, 'bb_std_mult': 0.7169298018704144, 'rsi_os': 11, 'rsi_ob': 65, 'vol_spike': 0.289058455438945, 'adx_thresh': 9.065375537673667, 'atr_min_pct': 0.010021607196577778, 'atr_max_pct': 0.01105283359741386, 'tp_mult': 2.3964226710416536, 'tsl_mult': 0.9611861590404075, 'strategy': 'mean_reversion', 'time_stop': 88, 'use_sma': True, 'use_atr': False, 'use_adx': True, 'use_ema': True, 'use_spike': True, 'rsi_required': True, 'edge_k': 1.6105453931325342, 'edge_cap': 0.5179800074162968, 'bull_strategy': 'breakout', 'bull_bb_std_mult': 1.8684988193500476, 'bull_rsi_os': 16, 'bull_rsi_ob': 46, 'bull_adx_thresh': 20.66530180239673, 'bull_atr_min_pct': 0.0004646078780613485, 'bull_atr_max_pct': 0.13743627464942143, 'bull_tp_mult': 1.3619107142950668, 'bull_tsl_mult': 0.8911971778168543, 'bull_time_stop': 234, 'bull_use_sma': True, 'bull_use_ema': False, 'bull_use_atr': False, 'bull_use_adx': False, 'bull_use_spike': False, 'bull_rsi_required': True, 'bear_strategy': 'mean_reversion', 'bear_bb_std_mult': 1.6620612806947952, 'bear_rsi_os': 9, 'bear_rsi_ob': 56, 'bear_adx_thresh': 27.838275147615214, 'bear_atr_min_pct': 0.01185494245640958, 'bear_atr_max_pct': 0.08831522407331693, 'bear_tp_mult': 1.5572755178789397, 'bear_tsl_mult': 0.3937677769034424, 'bear_time_stop': 245, 'bear_use_sma': False, 'bear_use_ema': False, 'bear_use_atr': False, 'bear_use_adx': True, 'bear_use_spike': True, 'bear_rsi_required': True, 'sideways_strategy': 'breakout', 'sideways_bb_std_mult': 2.9864211515803927, 'sideways_rsi_os': 38, 'sideways_rsi_ob': 50, 'sideways_adx_thresh': 21.748207179584846, 'sideways_atr_min_pct': 0.02207278002066246, 'sideways_atr_max_pct': 0.03910710963641829, 'sideways_tp_mult': 1.8419086545179402, 'sideways_tsl_mult': 0.037292302408512, 'sideways_time_stop': 238, 'sideways_use_sma': False, 'sideways_use_ema': False, 'sideways_use_atr': False, 'sideways_use_adx': True, 'sideways_use_spike': False, 'sideways_rsi_required': False}.
[I 2025-08-30 22:15:20,121] Trial 719 finished with values: [-1000000000.0, 1000000000.0] and parameters: {'p_sma': 13, 'p_std': 36, 'p_atr': 23, 'p_adx': 22, 'rsi_period': 68, 'ema1': 7, 'ema2': 52, 'slip_atr_k': 0.027731618737221644, 'slip_spread_k': 0.15678749492626348, 'spread_hl_frac': 0.044958591983973825, 'bb_std_mult': 0.7221051914680245, 'rsi_os': 11, 'rsi_ob': 93, 'vol_spike': 0.28071006961079886, 'adx_thresh': 8.96102861354456, 'atr_min_pct': 0.011631050817404192, 'atr_max_pct': 0.0161129393908358, 'tp_mult': 1.7951785403699247, 'tsl_mult': 0.9785884846203079, 'strategy': 'mean_reversion', 'time_stop': 90, 'use_sma': True, 'use_atr': True, 'use_adx': False, 'use_ema': True, 'use_spike': False, 'rsi_required': True, 'edge_k': 0.9880696050054089, 'edge_cap': 0.832939485035181, 'bull_strategy': 'breakout', 'bull_bb_std_mult': 1.941589841486449, 'bull_rsi_os': 5, 'bull_rsi_ob': 87, 'bull_adx_thresh': 25.89017044464794, 'bull_atr_min_pct': 0.000550558350789781, 'bull_atr_max_pct': 0.14980785329763507, 'bull_tp_mult': 1.4115161337845694, 'bull_tsl_mult': 0.36594141014747844, 'bull_time_stop': 269, 'bull_use_sma': True, 'bull_use_ema': False, 'bull_use_atr': False, 'bull_use_adx': False, 'bull_use_spike': False, 'bull_rsi_required': True, 'bear_strategy': 'mean_reversion', 'bear_bb_std_mult': 1.8745327650124601, 'bear_rsi_os': 44, 'bear_rsi_ob': 71, 'bear_adx_thresh': 26.133900730335426, 'bear_atr_min_pct': 0.003961799215809589, 'bear_atr_max_pct': 0.11399420200577728, 'bear_tp_mult': 1.568993262015715, 'bear_tsl_mult': 0.3482570535980592, 'bear_time_stop': 266, 'bear_use_sma': True, 'bear_use_ema': True, 'bear_use_atr': False, 'bear_use_adx': True, 'bear_use_spike': False, 'bear_rsi_required': True, 'sideways_strategy': 'breakout', 'sideways_bb_std_mult': 1.7377972480557442, 'sideways_rsi_os': 45, 'sideways_rsi_ob': 89, 'sideways_adx_thresh': 28.272048000855456, 'sideways_atr_min_pct': 0.0266484913291889, 'sideways_atr_max_pct': 0.051440026052985664, 'sideways_tp_mult': 1.1092458265480034, 'sideways_tsl_mult': 0.5469620142737291, 'sideways_time_stop': 76, 'sideways_use_sma': True, 'sideways_use_ema': False, 'sideways_use_atr': False, 'sideways_use_adx': True, 'sideways_use_spike': True, 'sideways_rsi_required': False}.
