[I 2025-08-30 22:04:09,603] Trial 618 finished with values: [-0.018985480799893595, 0.018927958260827264] and parameters: {'p_sma': 32, 'p_std': 10, 'p_atr': 21, 'p_adx': 20, 'rsi_period': 28, 'ema1': 24, 'ema2': 14, 'slip_atr_k': 0.023078336994823385, 'slip_spread_k': 0.7230104815567341, 'spread_hl_frac': 0.03178688429408806, 'bb_std_mult': 0.7846112840856162, 'rsi_os': 14, 'rsi_ob': 67, 'vol_spike': 0.2923988817962081, 'adx_thresh': 11.067418161088604, 'atr_min_pct': 0.011084420100961856, 'atr_max_pct': 0.021878447495338377, 'tp_mult': 1.9166563626330828, 'tsl_mult': 0.8743991623222921, 'strategy': 'breakout', 'time_stop': 23, 'use_sma': False, 'use_atr': False, 'use_adx': True, 'use_ema': True, 'use_spike': True, 'rsi_required': True, 'edge_k': 0.7995143682806951, 'edge_cap': 0.1518653751633467, 'bull_strategy': 'breakout', 'bull_bb_std_mult': 1.461543832173938, 'bull_rsi_os': 13, 'bull_rsi_ob': 83, 'bull_adx_thresh': 26.42195275263037, 'bull_atr_min_pct': 0.0010725725709003183, 'bull_atr_max_pct': 0.04853792785689321, 'bull_tp_mult': 1.193290874697012, 'bull_tsl_mult': 0.4488313412501679, 'bull_time_stop': 294, 'bull_use_sma': True, 'bull_use_ema': False, 'bull_use_atr': True, 'bull_use_adx': False, 'bull_use_spike': True, 'bull_rsi_required': False, 'bear_strategy': 'mean_reversion', 'bear_bb_std_mult': 1.8893751171086701, 'bear_rsi_os': 7, 'bear_rsi_ob': 72, 'bear_adx_thresh': 26.438399778720406, 'bear_atr_min_pct': 0.025906201843931678, 'bear_atr_max_pct': 0.049567102673883714, 'bear_tp_mult': 1.6649030176160182, 'bear_tsl_mult': 0.3781897909240347, 'bear_time_stop': 236, 'bear_use_sma': False, 'bear_use_ema': False, 'bear_use_atr': True, 'bear_use_adx': True, 'bear_use_spike': True, 'bear_rsi_required': False, 'sideways_strategy': 'breakout', 'sideways_bb_std_mult': 1.3945086427335256, 'sideways_rsi_os': 39, 'sideways_rsi_ob': 87, 'sideways_adx_thresh': 27.31614724498714, 'sideways_atr_min_pct': 0.007455909670677271, 'sideways_atr_max_pct': 0.0774331026373994, 'sideways_tp_mult': 2.794525198433214, 'sideways_tsl_mult': 0.7268377457465294, 'sideways_time_stop': 263, 'sideways_use_sma': False, 'sideways_use_ema': True, 'sideways_use_atr': True, 'sideways_use_adx': True, 'sideways_use_spike': False, 'sideways_rsi_required': True}.
[I 2025-08-30 22:04:42,238] Trial 624 finished with values: [-1000000000.0, 1000000000.0] and parameters: {'p_sma': 32, 'p_std': 29, 'p_atr': 17, 'p_adx': 22, 'rsi_period': 73, 'ema1': 12, 'ema2': 54, 'slip_atr_k': 0.20401853209334608, 'slip_spread_k': 0.5967623842004697, 'spread_hl_frac': 0.03355921188037944, 'bb_std_mult': 0.7848534147741899, 'rsi_os': 11, 'rsi_ob': 68, 'vol_spike': 0.28182107850884497, 'adx_thresh': 27.288908003503064, 'atr_min_pct': 0.005491608163724607, 'atr_max_pct': 0.056321676102086216, 'tp_mult': 1.8931606593018862, 'tsl_mult': 0.886343515358025, 'strategy': 'mean_reversion', 'time_stop': 232, 'use_sma': True, 'use_atr': True, 'use_adx': True, 'use_ema': True, 'use_spike': True, 'rsi_required': True, 'edge_k': 0.8061357750488449, 'edge_cap': 0.8566760779063011, 'bull_strategy': 'breakout', 'bull_bb_std_mult': 1.7537371611060502, 'bull_rsi_os': 23, 'bull_rsi_ob': 89, 'bull_adx_thresh': 14.974727079814963, 'bull_atr_min_pct': 0.0014639962245105566, 'bull_atr_max_pct': 0.042578095890844124, 'bull_tp_mult': 1.4404683260111992, 'bull_tsl_mult': 0.8809641718409013, 'bull_time_stop': 294, 'bull_use_sma': False, 'bull_use_ema': False, 'bull_use_atr': False, 'bull_use_adx': False, 'bull_use_spike': False, 'bull_rsi_required': True, 'bear_strategy': 'mean_reversion', 'bear_bb_std_mult': 0.7322807766834678, 'bear_rsi_os': 7, 'bear_rsi_ob': 67, 'bear_adx_thresh': 26.88850369984454, 'bear_atr_min_pct': 0.029464317104001818, 'bear_atr_max_pct': 0.12003799367832518, 'bear_tp_mult': 1.946420524207727, 'bear_tsl_mult': 0.9284337153783344, 'bear_time_stop': 275, 'bear_use_sma': False, 'bear_use_ema': True, 'bear_use_atr': False, 'bear_use_adx': True, 'bear_use_spike': False, 'bear_rsi_required': True, 'sideways_strategy': 'mean_reversion', 'sideways_bb_std_mult': 1.719839575398704, 'sideways_rsi_os': 36, 'sideways_rsi_ob': 48, 'sideways_adx_thresh': 20.69579929036107, 'sideways_atr_min_pct': 0.022844670063573408, 'sideways_atr_max_pct': 0.03774726130313675, 'sideways_tp_mult': 1.7528121901546916, 'sideways_tsl_mult': 0.35613523817448167, 'sideways_time_stop': 240, 'sideways_use_sma': False, 'sideways_use_ema': False, 'sideways_use_atr': False, 'sideways_use_adx': False, 'sideways_use_spike': False, 'sideways_rsi_required': False}.
[I 2025-08-30 22:04:43,332] Trial 623 finished with values: [-0.016911029978358028, 0.016839858618567714] and parameters: {'p_sma': 44, 'p_std': 26, 'p_atr': 21, 'p_adx': 22, 'rsi_period': 76, 'ema1': 12, 'ema2': 40, 'slip_atr_k': 0.031678132607028134, 'slip_spread_k': 0.6424504865962601, 'spread_hl_frac': 0.033716645897807575, 'bb_std_mult': 0.7869453927224377, 'rsi_os': 11, 'rsi_ob': 65, 'vol_spike': 0.06390280851094342, 'adx_thresh': 32.73475712573109, 'atr_min_pct': 0.005516246263951634, 'atr_max_pct': 0.05404357596034927, 'tp_mult': 1.0431721751143805, 'tsl_mult': 0.8771805468061015, 'strategy': 'mean_reversion', 'time_stop': 250, 'use_sma': True, 'use_atr': True, 'use_adx': True, 'use_ema': True, 'use_spike': True, 'rsi_required': True, 'edge_k': 1.537304115421152, 'edge_cap': 0.8631062565518701, 'bull_strategy': 'breakout', 'bull_bb_std_mult': 2.143370951327963, 'bull_rsi_os': 23, 'bull_rsi_ob': 82, 'bull_adx_thresh': 14.078428272191221, 'bull_atr_min_pct': 0.0014085052483404571, 'bull_atr_max_pct': 0.05793369196888312, 'bull_tp_mult': 1.4122229557695607, 'bull_tsl_mult': 0.570659864347233, 'bull_time_stop': 28, 'bull_use_sma': False, 'bull_use_ema': False, 'bull_use_atr': False, 'bull_use_adx': False, 'bull_use_spike': True, 'bull_rsi_required': True, 'bear_strategy': 'mean_reversion', 'bear_bb_std_mult': 2.0765378373787726, 'bear_rsi_os': 6, 'bear_rsi_ob': 71, 'bear_adx_thresh': 27.121658052097885, 'bear_atr_min_pct': 0.029996317237810773, 'bear_atr_max_pct': 0.12052356374206928, 'bear_tp_mult': 1.5312495299250437, 'bear_tsl_mult': 0.38006111215699384, 'bear_time_stop': 245, 'bear_use_sma': False, 'bear_use_ema': True, 'bear_use_atr': False, 'bear_use_adx': True, 'bear_use_spike': False, 'bear_rsi_required': True, 'sideways_strategy': 'breakout', 'sideways_bb_std_mult': 0.8828437589600793, 'sideways_rsi_os': 45, 'sideways_rsi_ob': 90, 'sideways_adx_thresh': 27.293880999212075, 'sideways_atr_min_pct': 0.020632953988755188, 'sideways_atr_max_pct': 0.11733850072001849, 'sideways_tp_mult': 1.7504090064603088, 'sideways_tsl_mult': 0.8073217946072534, 'sideways_time_stop': 264, 'sideways_use_sma': False, 'sideways_use_ema': True, 'sideways_use_atr': False, 'sideways_use_adx': False, 'sideways_use_spike': False, 'sideways_rsi_required': True}.
[I 2025-08-30 22:04:43,659] Trial 622 finished with values: [-1000000000.0, 1000000000.0] and parameters: {'p_sma': 32, 'p_std': 46, 'p_atr': 21, 'p_adx': 18, 'rsi_period': 74, 'ema1': 24, 'ema2': 52, 'slip_atr_k': 0.03032538187446785, 'slip_spread_k': 0.59507476751292, 'spread_hl_frac': 0.033829682572959985, 'bb_std_mult': 0.7007253571864682, 'rsi_os': 11, 'rsi_ob': 62, 'vol_spike': 0.29410235127971995, 'adx_thresh': 27.977491773998004, 'atr_min_pct': 0.011287988538370989, 'atr_max_pct': 0.055227180609850046, 'tp_mult': 2.325146625134367, 'tsl_mult': 0.8802295049621397, 'strategy': 'mean_reversion', 'time_stop': 25, 'use_sma': True, 'use_atr': True, 'use_adx': True, 'use_ema': True, 'use_spike': True, 'rsi_required': True, 'edge_k': 0.47011092235498275, 'edge_cap': 0.7493624695710374, 'bull_strategy': 'breakout', 'bull_bb_std_mult': 1.9651214891327549, 'bull_rsi_os': 23, 'bull_rsi_ob': 84, 'bull_adx_thresh': 14.950074414512462, 'bull_atr_min_pct': 0.0042702918524068385, 'bull_atr_max_pct': 0.0545478965641385, 'bull_tp_mult': 1.1941012032280303, 'bull_tsl_mult': 0.3710213875234313, 'bull_time_stop': 294, 'bull_use_sma': True, 'bull_use_ema': False, 'bull_use_atr': False, 'bull_use_adx': False, 'bull_use_spike': True, 'bull_rsi_required': True, 'bear_strategy': 'mean_reversion', 'bear_bb_std_mult': 1.9379109349616341, 'bear_rsi_os': 7, 'bear_rsi_ob': 70, 'bear_adx_thresh': 28.395581009912352, 'bear_atr_min_pct': 0.004498956991108893, 'bear_atr_max_pct': 0.029754666345675543, 'bear_tp_mult': 1.5629830080226539, 'bear_tsl_mult': 0.38888420860772216, 'bear_time_stop': 231, 'bear_use_sma': True, 'bear_use_ema': True, 'bear_use_atr': False, 'bear_use_adx': True, 'bear_use_spike': False, 'bear_rsi_required': True, 'sideways_strategy': 'breakout', 'sideways_bb_std_mult': 1.5617025271174199, 'sideways_rsi_os': 42, 'sideways_rsi_ob': 86, 'sideways_adx_thresh': 29.374783837725396, 'sideways_atr_min_pct': 0.020642461624263954, 'sideways_atr_max_pct': 0.07906930321334235, 'sideways_tp_mult': 2.3225805420564947, 'sideways_tsl_mult': 0.0036417686316462805, 'sideways_time_stop': 55, 'sideways_use_sma': False, 'sideways_use_ema': True, 'sideways_use_atr': True, 'sideways_use_adx': True, 'sideways_use_spike': False, 'sideways_rsi_required': True}.
[I 2025-08-30 22:04:43,880] Trial 625 finished with values: [-1000000000.0, 1000000000.0] and parameters: {'p_sma': 44, 'p_std': 25, 'p_atr': 23, 'p_adx': 23, 'rsi_period': 74, 'ema1': 12, 'ema2': 55, 'slip_atr_k': 0.00027310637816641004, 'slip_spread_k': 0.6298666667357198, 'spread_hl_frac': 0.02381141529830708, 'bb_std_mult': 3.273972606924116, 'rsi_os': 11, 'rsi_ob': 66, 'vol_spike': 0.02644970747932608, 'adx_thresh': 10.562321673918177, 'atr_min_pct': 0.013146235820228985, 'atr_max_pct': 0.13049078566709815, 'tp_mult': 1.7307115474631296, 'tsl_mult': 0.9370448806306706, 'strategy': 'mean_reversion', 'time_stop': 246, 'use_sma': True, 'use_atr': True, 'use_adx': False, 'use_ema': True, 'use_spike': False, 'rsi_required': True, 'edge_k': 1.1027833888334397, 'edge_cap': 0.764570465850279, 'bull_strategy': 'breakout', 'bull_bb_std_mult': 1.757304462501168, 'bull_rsi_os': 34, 'bull_rsi_ob': 81, 'bull_adx_thresh': 14.230021495174205, 'bull_atr_min_pct': 0.002223141939269534, 'bull_atr_max_pct': 0.05523196786952676, 'bull_tp_mult': 1.5018435234057934, 'bull_tsl_mult': 0.5614336462570811, 'bull_time_stop': 285, 'bull_use_sma': False, 'bull_use_ema': False, 'bull_use_atr': False, 'bull_use_adx': False, 'bull_use_spike': False, 'bull_rsi_required': True, 'bear_strategy': 'mean_reversion', 'bear_bb_std_mult': 0.722077899378808, 'bear_rsi_os': 16, 'bear_rsi_ob': 70, 'bear_adx_thresh': 21.845412374169648, 'bear_atr_min_pct': 0.004438688984341969, 'bear_atr_max_pct': 0.12041069477174174, 'bear_tp_mult': 1.529146039119778, 'bear_tsl_mult': 0.3433486611776997, 'bear_time_stop': 245, 'bear_use_sma': False, 'bear_use_ema': True, 'bear_use_atr': False, 'bear_use_adx': True, 'bear_use_spike': False, 'bear_rsi_required': True, 'sideways_strategy': 'mean_reversion', 'sideways_bb_std_mult': 3.5951833378951754, 'sideways_rsi_os': 46, 'sideways_rsi_ob': 90, 'sideways_adx_thresh': 14.864703383680393, 'sideways_atr_min_pct': 0.0013057094473245233, 'sideways_atr_max_pct': 0.11664437114756916, 'sideways_tp_mult': 1.7514185110886444, 'sideways_tsl_mult': 0.8007180579751375, 'sideways_time_stop': 102, 'sideways_use_sma': True, 'sideways_use_ema': False, 'sideways_use_atr': False, 'sideways_use_adx': False, 'sideways_use_spike': True, 'sideways_rsi_required': False}.
[I 2025-08-30 22:04:44,843] Trial 627 finished with values: [-1000000000.0, 1000000000.0] and parameters: {'p_sma': 54, 'p_std': 26, 'p_atr': 9, 'p_adx': 21, 'rsi_period': 12, 'ema1': 11, 'ema2': 40, 'slip_atr_k': 0.19111620250009254, 'slip_spread_k': 0.6657920664282689, 'spread_hl_frac': 0.024110670837498467, 'bb_std_mult': 0.8443216494785282, 'rsi_os': 54, 'rsi_ob': 62, 'vol_spike': 0.08005616827052509, 'adx_thresh': 10.350190569190099, 'atr_min_pct': 0.013482468197325792, 'atr_max_pct': 0.05398958934206878, 'tp_mult': 1.72277122015722, 'tsl_mult': 0.9490922776795271, 'strategy': 'mean_reversion', 'time_stop': 276, 'use_sma': True, 'use_atr': True, 'use_adx': False, 'use_ema': False, 'use_spike': False, 'rsi_required': True, 'edge_k': 1.9537212479604813, 'edge_cap': 0.7670616273986305, 'bull_strategy': 'breakout', 'bull_bb_std_mult': 2.1572119411270814, 'bull_rsi_os': 16, 'bull_rsi_ob': 91, 'bull_adx_thresh': 14.143218937927939, 'bull_atr_min_pct': 0.002405129144054265, 'bull_atr_max_pct': 0.053998906303846475, 'bull_tp_mult': 1.6910126979469016, 'bull_tsl_mult': 0.5414269733305169, 'bull_time_stop': 285, 'bull_use_sma': False, 'bull_use_ema': False, 'bull_use_atr': False, 'bull_use_adx': False, 'bull_use_spike': False, 'bull_rsi_required': True, 'bear_strategy': 'mean_reversion', 'bear_bb_std_mult': 2.071098581166351, 'bear_rsi_os': 55, 'bear_rsi_ob': 71, 'bear_adx_thresh': 21.54226114349334, 'bear_atr_min_pct': 0.028252953197948127, 'bear_atr_max_pct': 0.08069018532861404, 'bear_tp_mult': 1.518188740718572, 'bear_tsl_mult': 0.34900068004347284, 'bear_time_stop': 226, 'bear_use_sma': False, 'bear_use_ema': True, 'bear_use_atr': False, 'bear_use_adx': False, 'bear_use_spike': False, 'bear_rsi_required': True, 'sideways_strategy': 'breakout', 'sideways_bb_std_mult': 1.6077509618744847, 'sideways_rsi_os': 39, 'sideways_rsi_ob': 78, 'sideways_adx_thresh': 29.79026527433801, 'sideways_atr_min_pct': 0.02089650848434597, 'sideways_atr_max_pct': 0.11393944137998205, 'sideways_tp_mult': 2.3243709068241403, 'sideways_tsl_mult': 0.8060561656927344, 'sideways_time_stop': 295, 'sideways_use_sma': True, 'sideways_use_ema': False, 'sideways_use_atr': False, 'sideways_use_adx': False, 'sideways_use_spike': True, 'sideways_rsi_required': False}.
[I 2025-08-30 22:05:20,056] Trial 626 finished with values: [-1000000000.0, 1000000000.0] and parameters: {'p_sma': 36, 'p_std': 24, 'p_atr': 13, 'p_adx': 23, 'rsi_period': 69, 'ema1': 12, 'ema2': 55, 'slip_atr_k': 0.03357531550627732, 'slip_spread_k': 0.6313995328917439, 'spread_hl_frac': 0.04054996971774132, 'bb_std_mult': 3.254124733722383, 'rsi_os': 25, 'rsi_ob': 66, 'vol_spike': 0.2754817695705841, 'adx_thresh': 10.394092832642091, 'atr_min_pct': 0.013426730290270117, 'atr_max_pct': 0.14184120844693177, 'tp_mult': 1.3609500368911123, 'tsl_mult': 0.3048499177520416, 'strategy': 'mean_reversion', 'time_stop': 85, 'use_sma': True, 'use_atr': True, 'use_adx': False, 'use_ema': True, 'use_spike': False, 'rsi_required': True, 'edge_k': 1.1237815592284837, 'edge_cap': 0.7496830470069099, 'bull_strategy': 'breakout', 'bull_bb_std_mult': 2.146221999168311, 'bull_rsi_os': 16, 'bull_rsi_ob': 78, 'bull_adx_thresh': 14.043267629604362, 'bull_atr_min_pct': 0.0022851718587837615, 'bull_atr_max_pct': 0.05560857938890872, 'bull_tp_mult': 1.04626734252503, 'bull_tsl_mult': 0.22729685853074988, 'bull_time_stop': 285, 'bull_use_sma': True, 'bull_use_ema': False, 'bull_use_atr': False, 'bull_use_adx': False, 'bull_use_spike': False, 'bull_rsi_required': True, 'bear_strategy': 'breakout', 'bear_bb_std_mult': 1.96171540545031, 'bear_rsi_os': 10, 'bear_rsi_ob': 70, 'bear_adx_thresh': 28.65258239263556, 'bear_atr_min_pct': 0.006983922322879352, 'bear_atr_max_pct': 0.11127380939939094, 'bear_tp_mult': 2.739417235766769, 'bear_tsl_mult': 0.3866803542529199, 'bear_time_stop': 247, 'bear_use_sma': False, 'bear_use_ema': True, 'bear_use_atr': False, 'bear_use_adx': True, 'bear_use_spike': False, 'bear_rsi_required': True, 'sideways_strategy': 'breakout', 'sideways_bb_std_mult': 2.370469921318507, 'sideways_rsi_os': 34, 'sideways_rsi_ob': 90, 'sideways_adx_thresh': 29.692825676042695, 'sideways_atr_min_pct': 0.020812269047622362, 'sideways_atr_max_pct': 0.05752407762325441, 'sideways_tp_mult': 2.3003120379853126, 'sideways_tsl_mult': 0.8487362803348353, 'sideways_time_stop': 253, 'sideways_use_sma': True, 'sideways_use_ema': False, 'sideways_use_atr': False, 'sideways_use_adx': True, 'sideways_use_spike': True, 'sideways_rsi_required': False}.
[I 2025-08-30 22:05:20,451] Trial 628 finished with values: [-1000000000.0, 1000000000.0] and parameters: {'p_sma': 20, 'p_std': 35, 'p_atr': 9, 'p_adx': 21, 'rsi_period': 69, 'ema1': 11, 'ema2': 11, 'slip_atr_k': 0.024697730827419523, 'slip_spread_k': 0.6340085887461507, 'spread_hl_frac': 0.024203093804384894, 'bb_std_mult': 0.8303270537371413, 'rsi_os': 9, 'rsi_ob': 51, 'vol_spike': 0.057815237005905906, 'adx_thresh': 10.330998814614187, 'atr_min_pct': 0.013431459570283862, 'atr_max_pct': 0.019363248942217276, 'tp_mult': 2.4367064918090824, 'tsl_mult': 0.5217786758727313, 'strategy': 'mean_reversion', 'time_stop': 282, 'use_sma': True, 'use_atr': True, 'use_adx': False, 'use_ema': False, 'use_spike': False, 'rsi_required': True, 'edge_k': 1.1084650989812896, 'edge_cap': 0.9953325403171203, 'bull_strategy': 'mean_reversion', 'bull_bb_std_mult': 1.8919566530262424, 'bull_rsi_os': 16, 'bull_rsi_ob': 79, 'bull_adx_thresh': 14.125541662282096, 'bull_atr_min_pct': 0.002540274001701452, 'bull_atr_max_pct': 0.12588960113490621, 'bull_tp_mult': 1.5044160752685163, 'bull_tsl_mult': 0.7859279573363998, 'bull_time_stop': 284, 'bull_use_sma': False, 'bull_use_ema': False, 'bull_use_atr': False, 'bull_use_adx': False, 'bull_use_spike': False, 'bull_rsi_required': True, 'bear_strategy': 'mean_reversion', 'bear_bb_std_mult': 2.05907493093243, 'bear_rsi_os': 55, 'bear_rsi_ob': 70, 'bear_adx_thresh': 31.527741109231222, 'bear_atr_min_pct': 0.021948931835700368, 'bear_atr_max_pct': 0.10955301624835499, 'bear_tp_mult': 2.132231664744962, 'bear_tsl_mult': 0.23557452977224586, 'bear_time_stop': 270, 'bear_use_sma': False, 'bear_use_ema': True, 'bear_use_atr': False, 'bear_use_adx': False, 'bear_use_spike': True, 'bear_rsi_required': True, 'sideways_strategy': 'breakout', 'sideways_bb_std_mult': 1.9055492431245347, 'sideways_rsi_os': 37, 'sideways_rsi_ob': 90, 'sideways_adx_thresh': 19.595217957102175, 'sideways_atr_min_pct': 0.0014180576051322329, 'sideways_atr_max_pct': 0.11737303821899828, 'sideways_tp_mult': 2.4693139067663052, 'sideways_tsl_mult': 0.8074796144827197, 'sideways_time_stop': 253, 'sideways_use_sma': True, 'sideways_use_ema': False, 'sideways_use_atr': False, 'sideways_use_adx': False, 'sideways_use_spike': True, 'sideways_rsi_required': False}.
[I 2025-08-30 22:05:20,694] Trial 629 finished with values: [-1000000000.0, 1000000000.0] and parameters: {'p_sma': 36, 'p_std': 35, 'p_atr': 26, 'p_adx': 22, 'rsi_period': 36, 'ema1': 11, 'ema2': 53, 'slip_atr_k': 0.033545900287726374, 'slip_spread_k': 0.6663544342703943, 'spread_hl_frac': 0.030759977900678893, 'bb_std_mult': 0.8506527263179815, 'rsi_os': 9, 'rsi_ob': 65, 'vol_spike': 0.27410749638008625, 'adx_thresh': 10.471896107013745, 'atr_min_pct': 0.013676037471877163, 'atr_max_pct': 0.1418535588869005, 'tp_mult': 1.026994647270579, 'tsl_mult': 0.915515826126299, 'strategy': 'mean_reversion', 'time_stop': 79, 'use_sma': True, 'use_atr': True, 'use_adx': False, 'use_ema': False, 'use_spike': False, 'rsi_required': True, 'edge_k': 0.25983809831674887, 'edge_cap': 0.11133566856887789, 'bull_strategy': 'mean_reversion', 'bull_bb_std_mult': 1.8771817753544282, 'bull_rsi_os': 16, 'bull_rsi_ob': 89, 'bull_adx_thresh': 13.537472078576654, 'bull_atr_min_pct': 0.0029486045476758834, 'bull_atr_max_pct': 0.13829104465830472, 'bull_tp_mult': 1.6862982256765273, 'bull_tsl_mult': 0.8101617607363754, 'bull_time_stop': 300, 'bull_use_sma': True, 'bull_use_ema': False, 'bull_use_atr': False, 'bull_use_adx': False, 'bull_use_spike': False, 'bull_rsi_required': True, 'bear_strategy': 'mean_reversion', 'bear_bb_std_mult': 3.179693134598989, 'bear_rsi_os': 9, 'bear_rsi_ob': 93, 'bear_adx_thresh': 31.40888646092698, 'bear_atr_min_pct': 0.02949393660960178, 'bear_atr_max_pct': 0.0898818610582582, 'bear_tp_mult': 1.049672908448634, 'bear_tsl_mult': 0.42090386961126247, 'bear_time_stop': 65, 'bear_use_sma': False, 'bear_use_ema': True, 'bear_use_atr': False, 'bear_use_adx': False, 'bear_use_spike': True, 'bear_rsi_required': True, 'sideways_strategy': 'breakout', 'sideways_bb_std_mult': 1.8769147453191166, 'sideways_rsi_os': 10, 'sideways_rsi_ob': 88, 'sideways_adx_thresh': 19.73100301784876, 'sideways_atr_min_pct': 0.019751439771827983, 'sideways_atr_max_pct': 0.04271014855881107, 'sideways_tp_mult': 1.8649753376768587, 'sideways_tsl_mult': 0.8059249002213368, 'sideways_time_stop': 292, 'sideways_use_sma': True, 'sideways_use_ema': False, 'sideways_use_atr': False, 'sideways_use_adx': True, 'sideways_use_spike': True, 'sideways_rsi_required': False}.
