[I 2025-08-30 21:32:56,658] Trial 360 finished with values: [-1000000000.0, 1000000000.0] and parameters: {'p_sma': 29, 'p_std': 32, 'p_atr': 21, 'p_adx': 22, 'rsi_period': 74, 'ema1': 18, 'ema2': 50, 'slip_atr_k': 0.011921100534418694, 'slip_spread_k': 0.6642280983842648, 'spread_hl_frac': 0.032207123863087425, 'bb_std_mult': 1.3951061628595602, 'rsi_os': 35, 'rsi_ob': 65, 'vol_spike': 0.14936504985028123, 'adx_thresh': 16.059806845882164, 'atr_min_pct': 0.010941914635681754, 'atr_max_pct': 0.10183482291823197, 'tp_mult': 1.785560757364367, 'tsl_mult': 0.8500968010164771, 'strategy': 'mean_reversion', 'time_stop': 137, 'use_sma': True, 'use_atr': False, 'use_adx': True, 'use_ema': False, 'use_spike': True, 'rsi_required': True, 'edge_k': 1.2735461586752637, 'edge_cap': 0.6647487440120594, 'bull_strategy': 'mean_reversion', 'bull_bb_std_mult': 2.811896087763887, 'bull_rsi_os': 15, 'bull_rsi_ob': 91, 'bull_adx_thresh': 13.899108363908132, 'bull_atr_min_pct': 0.002849766360638194, 'bull_atr_max_pct': 0.044753543672802626, 'bull_tp_mult': 2.206062348248006, 'bull_tsl_mult': 0.351573479987293, 'bull_time_stop': 275, 'bull_use_sma': True, 'bull_use_ema': False, 'bull_use_atr': False, 'bull_use_adx': False, 'bull_use_spike': False, 'bull_rsi_required': True, 'bear_strategy': 'mean_reversion', 'bear_bb_std_mult': 1.0537413846878092, 'bear_rsi_os': 35, 'bear_rsi_ob': 75, 'bear_adx_thresh': 13.577277759211022, 'bear_atr_min_pct': 0.029212141750617024, 'bear_atr_max_pct': 0.010082696049406339, 'bear_tp_mult': 1.5537705123021137, 'bear_tsl_mult': 0.3718876070576981, 'bear_time_stop': 90, 'bear_use_sma': False, 'bear_use_ema': True, 'bear_use_atr': False, 'bear_use_adx': True, 'bear_use_spike': True, 'bear_rsi_required': True, 'sideways_strategy': 'breakout', 'sideways_bb_std_mult': 1.7854147994057785, 'sideways_rsi_os': 40, 'sideways_rsi_ob': 84, 'sideways_adx_thresh': 29.144636836148553, 'sideways_atr_min_pct': 0.020618328717702455, 'sideways_atr_max_pct': 0.1465610423117052, 'sideways_tp_mult': 1.9375577028337578, 'sideways_tsl_mult': 0.814260494127574, 'sideways_time_stop': 275, 'sideways_use_sma': False, 'sideways_use_ema': False, 'sideways_use_atr': False, 'sideways_use_adx': True, 'sideways_use_spike': False, 'sideways_rsi_required': False}.
[I 2025-08-30 21:33:30,114] Trial 361 finished with values: [-1000000000.0, 1000000000.0] and parameters: {'p_sma': 55, 'p_std': 32, 'p_atr': 21, 'p_adx': 23, 'rsi_period': 76, 'ema1': 17, 'ema2': 50, 'slip_atr_k': 0.009814004414700529, 'slip_spread_k': 0.6474930467384692, 'spread_hl_frac': 0.03137864050597757, 'bb_std_mult': 1.415585789681003, 'rsi_os': 8, 'rsi_ob': 65, 'vol_spike': 0.04180356882863419, 'adx_thresh': 13.730395637266929, 'atr_min_pct': 0.010960090122690915, 'atr_max_pct': 0.10385710141475778, 'tp_mult': 1.7069313461525035, 'tsl_mult': 0.8596305551366086, 'strategy': 'mean_reversion', 'time_stop': 146, 'use_sma': True, 'use_atr': False, 'use_adx': True, 'use_ema': True, 'use_spike': True, 'rsi_required': True, 'edge_k': 1.2472839977185406, 'edge_cap': 0.682928570644557, 'bull_strategy': 'breakout', 'bull_bb_std_mult': 2.6697613137691936, 'bull_rsi_os': 15, 'bull_rsi_ob': 91, 'bull_adx_thresh': 13.474043859918797, 'bull_atr_min_pct': 0.0030782686153249476, 'bull_atr_max_pct': 0.04557393688747805, 'bull_tp_mult': 2.2015226981676785, 'bull_tsl_mult': 0.35641719683956324, 'bull_time_stop': 281, 'bull_use_sma': True, 'bull_use_ema': False, 'bull_use_atr': False, 'bull_use_adx': True, 'bull_use_spike': False, 'bull_rsi_required': True, 'bear_strategy': 'mean_reversion', 'bear_bb_std_mult': 2.6931264363598935, 'bear_rsi_os': 36, 'bear_rsi_ob': 78, 'bear_adx_thresh': 14.019539898786368, 'bear_atr_min_pct': 0.029305889549290885, 'bear_atr_max_pct': 0.010113257603640177, 'bear_tp_mult': 1.5437783643867278, 'bear_tsl_mult': 0.3725136068282475, 'bear_time_stop': 89, 'bear_use_sma': False, 'bear_use_ema': True, 'bear_use_atr': False, 'bear_use_adx': True, 'bear_use_spike': True, 'bear_rsi_required': True, 'sideways_strategy': 'breakout', 'sideways_bb_std_mult': 1.8174707786167226, 'sideways_rsi_os': 42, 'sideways_rsi_ob': 85, 'sideways_adx_thresh': 27.99345378714022, 'sideways_atr_min_pct': 0.01931464167225384, 'sideways_atr_max_pct': 0.14382433336955658, 'sideways_tp_mult': 1.959002982526319, 'sideways_tsl_mult': 0.8044520783876742, 'sideways_time_stop': 274, 'sideways_use_sma': False, 'sideways_use_ema': False, 'sideways_use_atr': False, 'sideways_use_adx': True, 'sideways_use_spike': False, 'sideways_rsi_required': False}.
[I 2025-08-30 21:33:30,143] Trial 363 finished with values: [-1000000000.0, 1000000000.0] and parameters: {'p_sma': 15, 'p_std': 31, 'p_atr': 22, 'p_adx': 22, 'rsi_period': 75, 'ema1': 17, 'ema2': 54, 'slip_atr_k': 0.012350362680219353, 'slip_spread_k': 0.648060062305974, 'spread_hl_frac': 0.03202829758989927, 'bb_std_mult': 1.406460324103934, 'rsi_os': 9, 'rsi_ob': 65, 'vol_spike': 0.2802420393097789, 'adx_thresh': 16.43904735817915, 'atr_min_pct': 0.01083979721199097, 'atr_max_pct': 0.10184851367827649, 'tp_mult': 1.7767756183815584, 'tsl_mult': 0.8548232955671113, 'strategy': 'mean_reversion', 'time_stop': 147, 'use_sma': True, 'use_atr': True, 'use_adx': True, 'use_ema': True, 'use_spike': True, 'rsi_required': True, 'edge_k': 1.2241420286167999, 'edge_cap': 0.6856515076900781, 'bull_strategy': 'mean_reversion', 'bull_bb_std_mult': 2.6655598755241017, 'bull_rsi_os': 13, 'bull_rsi_ob': 91, 'bull_adx_thresh': 13.847098905348343, 'bull_atr_min_pct': 0.002744655126869057, 'bull_atr_max_pct': 0.04501396908689378, 'bull_tp_mult': 2.1930027534563052, 'bull_tsl_mult': 0.36545731786037994, 'bull_time_stop': 274, 'bull_use_sma': False, 'bull_use_ema': False, 'bull_use_atr': False, 'bull_use_adx': False, 'bull_use_spike': False, 'bull_rsi_required': True, 'bear_strategy': 'mean_reversion', 'bear_bb_std_mult': 1.895948577327632, 'bear_rsi_os': 34, 'bear_rsi_ob': 76, 'bear_adx_thresh': 13.053862172837695, 'bear_atr_min_pct': 0.029242228022938598, 'bear_atr_max_pct': 0.010194899460843745, 'bear_tp_mult': 1.5521191228783224, 'bear_tsl_mult': 0.36867130222963745, 'bear_time_stop': 91, 'bear_use_sma': False, 'bear_use_ema': True, 'bear_use_atr': False, 'bear_use_adx': True, 'bear_use_spike': True, 'bear_rsi_required': True, 'sideways_strategy': 'breakout', 'sideways_bb_std_mult': 1.827461407453217, 'sideways_rsi_os': 30, 'sideways_rsi_ob': 85, 'sideways_adx_thresh': 29.770224742703075, 'sideways_atr_min_pct': 0.01927151114756028, 'sideways_atr_max_pct': 0.14893525378393993, 'sideways_tp_mult': 1.956392583126231, 'sideways_tsl_mult': 0.7818738877130238, 'sideways_time_stop': 276, 'sideways_use_sma': False, 'sideways_use_ema': False, 'sideways_use_atr': False, 'sideways_use_adx': True, 'sideways_use_spike': False, 'sideways_rsi_required': False}.
[I 2025-08-30 21:33:30,277] Trial 362 finished with values: [-1000000000.0, 1000000000.0] and parameters: {'p_sma': 27, 'p_std': 32, 'p_atr': 20, 'p_adx': 22, 'rsi_period': 75, 'ema1': 17, 'ema2': 58, 'slip_atr_k': 0.013765522565144364, 'slip_spread_k': 0.6730057833495539, 'spread_hl_frac': 0.03094783062987756, 'bb_std_mult': 1.4079298642846318, 'rsi_os': 35, 'rsi_ob': 65, 'vol_spike': 0.2795325992024392, 'adx_thresh': 13.676820402056972, 'atr_min_pct': 0.0109956054267046, 'atr_max_pct': 0.10132680788571011, 'tp_mult': 1.7510243661542932, 'tsl_mult': 0.8524788792243682, 'strategy': 'mean_reversion', 'time_stop': 148, 'use_sma': True, 'use_atr': True, 'use_adx': True, 'use_ema': False, 'use_spike': True, 'rsi_required': True, 'edge_k': 1.2576234161561741, 'edge_cap': 0.6812873350367152, 'bull_strategy': 'breakout', 'bull_bb_std_mult': 2.6818344863661125, 'bull_rsi_os': 14, 'bull_rsi_ob': 91, 'bull_adx_thresh': 13.852672831907654, 'bull_atr_min_pct': 0.002843470136081717, 'bull_atr_max_pct': 0.03877560486414289, 'bull_tp_mult': 2.1713710442180263, 'bull_tsl_mult': 0.35027863500098405, 'bull_time_stop': 271, 'bull_use_sma': False, 'bull_use_ema': False, 'bull_use_atr': False, 'bull_use_adx': True, 'bull_use_spike': False, 'bull_rsi_required': True, 'bear_strategy': 'mean_reversion', 'bear_bb_std_mult': 2.700644487015385, 'bear_rsi_os': 36, 'bear_rsi_ob': 76, 'bear_adx_thresh': 13.032799534033664, 'bear_atr_min_pct': 0.029285398555748646, 'bear_atr_max_pct': 0.010610256092142882, 'bear_tp_mult': 1.5481630118182375, 'bear_tsl_mult': 0.3717021854803868, 'bear_time_stop': 89, 'bear_use_sma': False, 'bear_use_ema': True, 'bear_use_atr': False, 'bear_use_adx': True, 'bear_use_spike': True, 'bear_rsi_required': True, 'sideways_strategy': 'breakout', 'sideways_bb_std_mult': 1.8130828597794082, 'sideways_rsi_os': 19, 'sideways_rsi_ob': 85, 'sideways_adx_thresh': 28.80606801318107, 'sideways_atr_min_pct': 0.020108140258622068, 'sideways_atr_max_pct': 0.14337018359855916, 'sideways_tp_mult': 1.9349661743808144, 'sideways_tsl_mult': 0.8914910637758932, 'sideways_time_stop': 274, 'sideways_use_sma': False, 'sideways_use_ema': False, 'sideways_use_atr': False, 'sideways_use_adx': True, 'sideways_use_spike': False, 'sideways_rsi_required': False}.
[I 2025-08-30 21:33:30,425] Trial 364 finished with values: [-1000000000.0, 1000000000.0] and parameters: {'p_sma': 26, 'p_std': 37, 'p_atr': 22, 'p_adx': 23, 'rsi_period': 76, 'ema1': 19, 'ema2': 54, 'slip_atr_k': 0.016390364858424267, 'slip_spread_k': 0.6573412656800548, 'spread_hl_frac': 0.030972870868976682, 'bb_std_mult': 1.388195891063242, 'rsi_os': 9, 'rsi_ob': 68, 'vol_spike': 0.27401158617198373, 'adx_thresh': 19.791519017125907, 'atr_min_pct': 0.013491219587389353, 'atr_max_pct': 0.10115326925027548, 'tp_mult': 1.763074459362783, 'tsl_mult': 0.853776589046986, 'strategy': 'mean_reversion', 'time_stop': 150, 'use_sma': True, 'use_atr': True, 'use_adx': True, 'use_ema': True, 'use_spike': True, 'rsi_required': True, 'edge_k': 1.234744047151502, 'edge_cap': 0.6912039954306113, 'bull_strategy': 'breakout', 'bull_bb_std_mult': 2.864816463292698, 'bull_rsi_os': 13, 'bull_rsi_ob': 89, 'bull_adx_thresh': 14.478953294160169, 'bull_atr_min_pct': 0.002626493287547523, 'bull_atr_max_pct': 0.04601444304772233, 'bull_tp_mult': 2.263390443229291, 'bull_tsl_mult': 0.361822740168908, 'bull_time_stop': 279, 'bull_use_sma': False, 'bull_use_ema': False, 'bull_use_atr': False, 'bull_use_adx': True, 'bull_use_spike': False, 'bull_rsi_required': True, 'bear_strategy': 'mean_reversion', 'bear_bb_std_mult': 2.819548051872943, 'bear_rsi_os': 36, 'bear_rsi_ob': 76, 'bear_adx_thresh': 14.163472403966534, 'bear_atr_min_pct': 0.028086099380721086, 'bear_atr_max_pct': 0.1338672073162906, 'bear_tp_mult': 1.6342950487245933, 'bear_tsl_mult': 0.35057880644217154, 'bear_time_stop': 85, 'bear_use_sma': False, 'bear_use_ema': True, 'bear_use_atr': False, 'bear_use_adx': True, 'bear_use_spike': True, 'bear_rsi_required': True, 'sideways_strategy': 'breakout', 'sideways_bb_std_mult': 1.8464896694330484, 'sideways_rsi_os': 41, 'sideways_rsi_ob': 86, 'sideways_adx_thresh': 28.42383538029835, 'sideways_atr_min_pct': 0.019755188036042877, 'sideways_atr_max_pct': 0.14374237008163468, 'sideways_tp_mult': 1.950188554302315, 'sideways_tsl_mult': 0.8940659821312347, 'sideways_time_stop': 279, 'sideways_use_sma': False, 'sideways_use_ema': False, 'sideways_use_atr': False, 'sideways_use_adx': True, 'sideways_use_spike': False, 'sideways_rsi_required': False}.
[I 2025-08-30 21:34:02,600] Trial 365 finished with values: [-1000000000.0, 1000000000.0] and parameters: {'p_sma': 27, 'p_std': 35, 'p_atr': 20, 'p_adx': 21, 'rsi_period': 71, 'ema1': 19, 'ema2': 54, 'slip_atr_k': 0.02181396972315587, 'slip_spread_k': 0.6763699468973023, 'spread_hl_frac': 0.02605614278754519, 'bb_std_mult': 1.3095786248515213, 'rsi_os': 11, 'rsi_ob': 68, 'vol_spike': 0.27447928589617004, 'adx_thresh': 19.146648391478273, 'atr_min_pct': 0.012007578808623551, 'atr_max_pct': 0.09996709289517816, 'tp_mult': 1.7499910218380565, 'tsl_mult': 0.09860080916092878, 'strategy': 'mean_reversion', 'time_stop': 133, 'use_sma': True, 'use_atr': True, 'use_adx': True, 'use_ema': True, 'use_spike': True, 'rsi_required': True, 'edge_k': 1.3243940070644367, 'edge_cap': 0.6693903511841803, 'bull_strategy': 'breakout', 'bull_bb_std_mult': 2.954918050416865, 'bull_rsi_os': 13, 'bull_rsi_ob': 88, 'bull_adx_thresh': 14.474272894590511, 'bull_atr_min_pct': 0.0023205295747634105, 'bull_atr_max_pct': 0.04001044532657419, 'bull_tp_mult': 2.2608732314699993, 'bull_tsl_mult': 0.371335130157431, 'bull_time_stop': 281, 'bull_use_sma': False, 'bull_use_ema': False, 'bull_use_atr': False, 'bull_use_adx': True, 'bull_use_spike': False, 'bull_rsi_required': True, 'bear_strategy': 'mean_reversion', 'bear_bb_std_mult': 2.8232745467783498, 'bear_rsi_os': 36, 'bear_rsi_ob': 76, 'bear_adx_thresh': 14.382065472807264, 'bear_atr_min_pct': 0.028154004888986145, 'bear_atr_max_pct': 0.013672580290292165, 'bear_tp_mult': 1.6316527029531247, 'bear_tsl_mult': 0.3370484148363236, 'bear_time_stop': 85, 'bear_use_sma': False, 'bear_use_ema': True, 'bear_use_atr': False, 'bear_use_adx': True, 'bear_use_spike': True, 'bear_rsi_required': True, 'sideways_strategy': 'mean_reversion', 'sideways_bb_std_mult': 1.7915305811231212, 'sideways_rsi_os': 40, 'sideways_rsi_ob': 86, 'sideways_adx_thresh': 28.478930752779736, 'sideways_atr_min_pct': 0.021880791351534708, 'sideways_atr_max_pct': 0.14249092424320078, 'sideways_tp_mult': 1.934652491122963, 'sideways_tsl_mult': 0.7553532882626179, 'sideways_time_stop': 109, 'sideways_use_sma': False, 'sideways_use_ema': False, 'sideways_use_atr': False, 'sideways_use_adx': True, 'sideways_use_spike': False, 'sideways_rsi_required': False}.
[I 2025-08-30 21:34:03,137] Trial 368 finished with values: [-1000000000.0, 1000000000.0] and parameters: {'p_sma': 28, 'p_std': 35, 'p_atr': 23, 'p_adx': 21, 'rsi_period': 71, 'ema1': 18, 'ema2': 56, 'slip_atr_k': 0.02447016875375134, 'slip_spread_k': 0.6337262296965348, 'spread_hl_frac': 0.025784042750270575, 'bb_std_mult': 1.298172331962169, 'rsi_os': 33, 'rsi_ob': 67, 'vol_spike': 0.24737975294781628, 'adx_thresh': 19.35145141651533, 'atr_min_pct': 0.012823867041156699, 'atr_max_pct': 0.10007797858269558, 'tp_mult': 1.8488519185157484, 'tsl_mult': 0.48963153007801785, 'strategy': 'breakout', 'time_stop': 134, 'use_sma': True, 'use_atr': True, 'use_adx': False, 'use_ema': True, 'use_spike': False, 'rsi_required': True, 'edge_k': 1.3351973988427162, 'edge_cap': 0.6659365905766279, 'bull_strategy': 'breakout', 'bull_bb_std_mult': 2.941961795855211, 'bull_rsi_os': 14, 'bull_rsi_ob': 88, 'bull_adx_thresh': 21.944904942413864, 'bull_atr_min_pct': 0.0019663801815241995, 'bull_atr_max_pct': 0.047807436199957976, 'bull_tp_mult': 2.2714088281325306, 'bull_tsl_mult': 0.321227201554962, 'bull_time_stop': 283, 'bull_use_sma': True, 'bull_use_ema': False, 'bull_use_atr': True, 'bull_use_adx': True, 'bull_use_spike': False, 'bull_rsi_required': False, 'bear_strategy': 'mean_reversion', 'bear_bb_std_mult': 2.8982742627806015, 'bear_rsi_os': 35, 'bear_rsi_ob': 74, 'bear_adx_thresh': 14.25525113702051, 'bear_atr_min_pct': 0.02867325403392991, 'bear_atr_max_pct': 0.012806139735028288, 'bear_tp_mult': 1.6935544503654774, 'bear_tsl_mult': 0.3363315872647989, 'bear_time_stop': 97, 'bear_use_sma': False, 'bear_use_ema': True, 'bear_use_atr': False, 'bear_use_adx': False, 'bear_use_spike': True, 'bear_rsi_required': False, 'sideways_strategy': 'mean_reversion', 'sideways_bb_std_mult': 1.7514476037608677, 'sideways_rsi_os': 40, 'sideways_rsi_ob': 83, 'sideways_adx_thresh': 23.466456983549755, 'sideways_atr_min_pct': 0.02188865555683979, 'sideways_atr_max_pct': 0.14081020567256872, 'sideways_tp_mult': 1.9930649995623035, 'sideways_tsl_mult': 0.7006595768221062, 'sideways_time_stop': 300, 'sideways_use_sma': False, 'sideways_use_ema': False, 'sideways_use_atr': False, 'sideways_use_adx': True, 'sideways_use_spike': False, 'sideways_rsi_required': False}.
[I 2025-08-30 21:34:03,170] Trial 366 finished with values: [-1000000000.0, 1000000000.0] and parameters: {'p_sma': 39, 'p_std': 60, 'p_atr': 20, 'p_adx': 21, 'rsi_period': 71, 'ema1': 19, 'ema2': 58, 'slip_atr_k': 0.018048989776591015, 'slip_spread_k': 0.6983750344138392, 'spread_hl_frac': 0.025904031817865547, 'bb_std_mult': 1.340210885687357, 'rsi_os': 11, 'rsi_ob': 68, 'vol_spike': 0.27276960145509443, 'adx_thresh': 17.8633482088539, 'atr_min_pct': 0.012234428256892659, 'atr_max_pct': 0.10084340044357003, 'tp_mult': 1.7151121945719119, 'tsl_mult': 0.8478639795403007, 'strategy': 'mean_reversion', 'time_stop': 154, 'use_sma': True, 'use_atr': True, 'use_adx': True, 'use_ema': True, 'use_spike': True, 'rsi_required': True, 'edge_k': 1.1618555381537152, 'edge_cap': 0.6738429458369326, 'bull_strategy': 'breakout', 'bull_bb_std_mult': 2.7287570974790323, 'bull_rsi_os': 13, 'bull_rsi_ob': 88, 'bull_adx_thresh': 14.542030425325887, 'bull_atr_min_pct': 0.0022319872638837633, 'bull_atr_max_pct': 0.04704350213233777, 'bull_tp_mult': 2.269075315719265, 'bull_tsl_mult': 0.3404162704375219, 'bull_time_stop': 281, 'bull_use_sma': False, 'bull_use_ema': False, 'bull_use_atr': False, 'bull_use_adx': True, 'bull_use_spike': False, 'bull_rsi_required': True, 'bear_strategy': 'mean_reversion', 'bear_bb_std_mult': 2.8287086020279433, 'bear_rsi_os': 36, 'bear_rsi_ob': 76, 'bear_adx_thresh': 14.29303865157, 'bear_atr_min_pct': 0.028160405955773852, 'bear_atr_max_pct': 0.13253797707321668, 'bear_tp_mult': 1.6228646498129022, 'bear_tsl_mult': 0.35268245906273993, 'bear_time_stop': 83, 'bear_use_sma': False, 'bear_use_ema': True, 'bear_use_atr': False, 'bear_use_adx': True, 'bear_use_spike': True, 'bear_rsi_required': True, 'sideways_strategy': 'mean_reversion', 'sideways_bb_std_mult': 1.752740908239623, 'sideways_rsi_os': 40, 'sideways_rsi_ob': 86, 'sideways_adx_thresh': 28.59705705177591, 'sideways_atr_min_pct': 0.021158725963870452, 'sideways_atr_max_pct': 0.14404413608674727, 'sideways_tp_mult': 1.9187318759657275, 'sideways_tsl_mult': 0.8517406721651053, 'sideways_time_stop': 279, 'sideways_use_sma': False, 'sideways_use_ema': False, 'sideways_use_atr': False, 'sideways_use_adx': True, 'sideways_use_spike': False, 'sideways_rsi_required': False}.
[I 2025-08-30 21:34:03,252] Trial 367 finished with values: [-1000000000.0, 1000000000.0] and parameters: {'p_sma': 28, 'p_std': 8, 'p_atr': 23, 'p_adx': 21, 'rsi_period': 71, 'ema1': 19, 'ema2': 54, 'slip_atr_k': 0.020382499609876287, 'slip_spread_k': 0.6960278170929179, 'spread_hl_frac': 0.025822341441840358, 'bb_std_mult': 1.3203933989827576, 'rsi_os': 11, 'rsi_ob': 69, 'vol_spike': 0.27505213314636107, 'adx_thresh': 17.613295437209963, 'atr_min_pct': 0.012619616756559997, 'atr_max_pct': 0.09928267210557404, 'tp_mult': 1.8431291838531807, 'tsl_mult': 0.7217839910959564, 'strategy': 'mean_reversion', 'time_stop': 134, 'use_sma': True, 'use_atr': True, 'use_adx': True, 'use_ema': True, 'use_spike': True, 'rsi_required': True, 'edge_k': 1.3708704724688225, 'edge_cap': 0.670468173592171, 'bull_strategy': 'breakout', 'bull_bb_std_mult': 2.8729229925139133, 'bull_rsi_os': 14, 'bull_rsi_ob': 88, 'bull_adx_thresh': 32.04220662706615, 'bull_atr_min_pct': 0.0023581556176535097, 'bull_atr_max_pct': 0.046755406214507016, 'bull_tp_mult': 2.2558155463061995, 'bull_tsl_mult': 0.32973261834586975, 'bull_time_stop': 281, 'bull_use_sma': True, 'bull_use_ema': False, 'bull_use_atr': False, 'bull_use_adx': True, 'bull_use_spike': False, 'bull_rsi_required': False, 'bear_strategy': 'mean_reversion', 'bear_bb_std_mult': 2.785322992256775, 'bear_rsi_os': 36, 'bear_rsi_ob': 73, 'bear_adx_thresh': 14.310681534311595, 'bear_atr_min_pct': 0.028045472177452308, 'bear_atr_max_pct': 0.013727264965912214, 'bear_tp_mult': 1.6201334938351208, 'bear_tsl_mult': 0.3410146466574584, 'bear_time_stop': 100, 'bear_use_sma': False, 'bear_use_ema': True, 'bear_use_atr': False, 'bear_use_adx': True, 'bear_use_spike': True, 'bear_rsi_required': True, 'sideways_strategy': 'mean_reversion', 'sideways_bb_std_mult': 1.7660596363843672, 'sideways_rsi_os': 12, 'sideways_rsi_ob': 86, 'sideways_adx_thresh': 28.35065753378717, 'sideways_atr_min_pct': 0.021925765345530587, 'sideways_atr_max_pct': 0.14986023571622234, 'sideways_tp_mult': 1.9853739685538794, 'sideways_tsl_mult': 0.7522055582131404, 'sideways_time_stop': 292, 'sideways_use_sma': False, 'sideways_use_ema': False, 'sideways_use_atr': False, 'sideways_use_adx': True, 'sideways_use_spike': False, 'sideways_rsi_required': False}.
