[I 2025-08-30 20:59:02,977] Trial 90 finished with values: [-1000000000.0, 1000000000.0] and parameters: {'p_sma': 51, 'p_std': 39, 'p_atr': 14, 'p_adx': 26, 'rsi_period': 17, 'ema1': 5, 'ema2': 45, 'slip_atr_k': 0.01119136112796196, 'slip_spread_k': 0.7621193736959797, 'spread_hl_frac': 0.004325615402586572, 'bb_std_mult': 3.5311543871376556, 'rsi_os': 38, 'rsi_ob': 84, 'vol_spike': 0.04060211800061016, 'adx_thresh': 18.62249924929684, 'atr_min_pct': 0.023214287797956014, 'atr_max_pct': 0.08917559191765216, 'tp_mult': 1.8019100448873406, 'tsl_mult': 0.7647510079141998, 'strategy': 'mean_reversion', 'time_stop': 251, 'use_sma': False, 'use_atr': True, 'use_adx': True, 'use_ema': False, 'use_spike': True, 'rsi_required': True, 'edge_k': 0.46501322342226414, 'edge_cap': 0.29344041445046454, 'bull_strategy': 'mean_reversion', 'bull_bb_std_mult': 2.9818117614949853, 'bull_rsi_os': 8, 'bull_rsi_ob': 53, 'bull_adx_thresh': 15.019036919297497, 'bull_atr_min_pct': 0.0008406529860584577, 'bull_atr_max_pct': 0.05383944948335548, 'bull_tp_mult': 2.780272053420437, 'bull_tsl_mult': 0.610924283823832, 'bull_time_stop': 172, 'bull_use_sma': True, 'bull_use_ema': True, 'bull_use_atr': False, 'bull_use_adx': True, 'bull_use_spike': False, 'bull_rsi_required': True, 'bear_strategy': 'mean_reversion', 'bear_bb_std_mult': 2.879638849274271, 'bear_rsi_os': 55, 'bear_rsi_ob': 60, 'bear_adx_thresh': 15.941365589868846, 'bear_atr_min_pct': 0.020153375776222393, 'bear_atr_max_pct': 0.14605594631899124, 'bear_tp_mult': 2.3465833402207736, 'bear_tsl_mult': 0.5171377580727619, 'bear_time_stop': 74, 'bear_use_sma': False, 'bear_use_ema': False, 'bear_use_atr': True, 'bear_use_adx': False, 'bear_use_spike': True, 'bear_rsi_required': True, 'sideways_strategy': 'breakout', 'sideways_bb_std_mult': 2.962721563343006, 'sideways_rsi_os': 40, 'sideways_rsi_ob': 69, 'sideways_adx_thresh': 27.905403943638362, 'sideways_atr_min_pct': 0.00577167327877841, 'sideways_atr_max_pct': 0.014428212492629364, 'sideways_tp_mult': 2.5430942700806654, 'sideways_tsl_mult': 0.4263085526705647, 'sideways_time_stop': 95, 'sideways_use_sma': False, 'sideways_use_ema': False, 'sideways_use_atr': True, 'sideways_use_adx': False, 'sideways_use_spike': False, 'sideways_rsi_required': False}.
[I 2025-08-30 20:59:03,379] Trial 92 finished with values: [-1000000000.0, 1000000000.0] and parameters: {'p_sma': 51, 'p_std': 37, 'p_atr': 14, 'p_adx': 28, 'rsi_period': 22, 'ema1': 5, 'ema2': 50, 'slip_atr_k': 0.009588976747872421, 'slip_spread_k': 0.7462957329963243, 'spread_hl_frac': 0.000898259288084239, 'bb_std_mult': 3.5161613923996695, 'rsi_os': 22, 'rsi_ob': 71, 'vol_spike': 0.02949397447278846, 'adx_thresh': 18.581311814859756, 'atr_min_pct': 0.019465510302685788, 'atr_max_pct': 0.09275775624951077, 'tp_mult': 2.6989078585304282, 'tsl_mult': 0.7794306695179352, 'strategy': 'mean_reversion', 'time_stop': 253, 'use_sma': False, 'use_atr': True, 'use_adx': True, 'use_ema': False, 'use_spike': True, 'rsi_required': True, 'edge_k': 0.37494404903824347, 'edge_cap': 0.2972486840942623, 'bull_strategy': 'mean_reversion', 'bull_bb_std_mult': 3.0517223860771425, 'bull_rsi_os': 12, 'bull_rsi_ob': 54, 'bull_adx_thresh': 13.23723103273414, 'bull_atr_min_pct': 0.0033768374168365893, 'bull_atr_max_pct': 0.05615429192061218, 'bull_tp_mult': 2.791106810526994, 'bull_tsl_mult': 0.6156170152332884, 'bull_time_stop': 172, 'bull_use_sma': True, 'bull_use_ema': True, 'bull_use_atr': False, 'bull_use_adx': True, 'bull_use_spike': False, 'bull_rsi_required': True, 'bear_strategy': 'mean_reversion', 'bear_bb_std_mult': 2.9239089013939377, 'bear_rsi_os': 54, 'bear_rsi_ob': 61, 'bear_adx_thresh': 16.090775545905785, 'bear_atr_min_pct': 0.016434381010082513, 'bear_atr_max_pct': 0.14740054232841437, 'bear_tp_mult': 2.8003536116022727, 'bear_tsl_mult': 0.6088338469925872, 'bear_time_stop': 80, 'bear_use_sma': False, 'bear_use_ema': False, 'bear_use_atr': True, 'bear_use_adx': False, 'bear_use_spike': True, 'bear_rsi_required': True, 'sideways_strategy': 'breakout', 'sideways_bb_std_mult': 2.958334760773329, 'sideways_rsi_os': 40, 'sideways_rsi_ob': 68, 'sideways_adx_thresh': 31.060790196980633, 'sideways_atr_min_pct': 0.005641445206594388, 'sideways_atr_max_pct': 0.0140352368265171, 'sideways_tp_mult': 2.4429487432635963, 'sideways_tsl_mult': 0.7334131332340823, 'sideways_time_stop': 277, 'sideways_use_sma': False, 'sideways_use_ema': False, 'sideways_use_atr': True, 'sideways_use_adx': False, 'sideways_use_spike': False, 'sideways_rsi_required': False}.
[I 2025-08-30 20:59:03,795] Trial 91 finished with values: [-1000000000.0, 1000000000.0] and parameters: {'p_sma': 52, 'p_std': 36, 'p_atr': 14, 'p_adx': 28, 'rsi_period': 22, 'ema1': 5, 'ema2': 49, 'slip_atr_k': 0.01077062668177049, 'slip_spread_k': 0.7539947865322538, 'spread_hl_frac': 0.0013591959990659139, 'bb_std_mult': 3.506726410629479, 'rsi_os': 22, 'rsi_ob': 82, 'vol_spike': 0.03604663497545172, 'adx_thresh': 20.940194602885786, 'atr_min_pct': 0.014556229459663346, 'atr_max_pct': 0.09050867345135359, 'tp_mult': 2.6985969327633015, 'tsl_mult': 0.77109696759101, 'strategy': 'mean_reversion', 'time_stop': 239, 'use_sma': False, 'use_atr': True, 'use_adx': True, 'use_ema': False, 'use_spike': True, 'rsi_required': True, 'edge_k': 0.38918382804563845, 'edge_cap': 0.22108946279578423, 'bull_strategy': 'mean_reversion', 'bull_bb_std_mult': 3.0525794913694764, 'bull_rsi_os': 7, 'bull_rsi_ob': 72, 'bull_adx_thresh': 13.092431237509132, 'bull_atr_min_pct': 0.0006180007957570361, 'bull_atr_max_pct': 0.056247998515164335, 'bull_tp_mult': 2.5967751879163954, 'bull_tsl_mult': 0.629052748827701, 'bull_time_stop': 170, 'bull_use_sma': True, 'bull_use_ema': True, 'bull_use_atr': False, 'bull_use_adx': True, 'bull_use_spike': False, 'bull_rsi_required': True, 'bear_strategy': 'mean_reversion', 'bear_bb_std_mult': 2.867091358788022, 'bear_rsi_os': 55, 'bear_rsi_ob': 61, 'bear_adx_thresh': 15.99960206692326, 'bear_atr_min_pct': 0.01868185683988898, 'bear_atr_max_pct': 0.14679296517731785, 'bear_tp_mult': 2.34513813639042, 'bear_tsl_mult': 0.6083386183613895, 'bear_time_stop': 79, 'bear_use_sma': False, 'bear_use_ema': False, 'bear_use_atr': True, 'bear_use_adx': False, 'bear_use_spike': True, 'bear_rsi_required': True, 'sideways_strategy': 'breakout', 'sideways_bb_std_mult': 2.962872969959865, 'sideways_rsi_os': 40, 'sideways_rsi_ob': 68, 'sideways_adx_thresh': 12.491687179890494, 'sideways_atr_min_pct': 0.006016912617810174, 'sideways_atr_max_pct': 0.013739599226492209, 'sideways_tp_mult': 2.557138697251211, 'sideways_tsl_mult': 0.42859081335537175, 'sideways_time_stop': 155, 'sideways_use_sma': False, 'sideways_use_ema': False, 'sideways_use_atr': True, 'sideways_use_adx': False, 'sideways_use_spike': False, 'sideways_rsi_required': False}.
[I 2025-08-30 20:59:35,038] Trial 93 finished with values: [-1000000000.0, 1000000000.0] and parameters: {'p_sma': 48, 'p_std': 37, 'p_atr': 13, 'p_adx': 28, 'rsi_period': 21, 'ema1': 5, 'ema2': 44, 'slip_atr_k': 0.01608532584621374, 'slip_spread_k': 0.07474732461608458, 'spread_hl_frac': 0.0011976208506280657, 'bb_std_mult': 3.472090440058772, 'rsi_os': 22, 'rsi_ob': 82, 'vol_spike': 0.030159737702998072, 'adx_thresh': 18.596861283339347, 'atr_min_pct': 0.01930377972546517, 'atr_max_pct': 0.08875957030268977, 'tp_mult': 2.492436384303768, 'tsl_mult': 0.7484634672960528, 'strategy': 'mean_reversion', 'time_stop': 205, 'use_sma': False, 'use_atr': True, 'use_adx': True, 'use_ema': False, 'use_spike': True, 'rsi_required': True, 'edge_k': 0.6379034512738126, 'edge_cap': 0.299170641910774, 'bull_strategy': 'mean_reversion', 'bull_bb_std_mult': 2.9672803896899573, 'bull_rsi_os': 12, 'bull_rsi_ob': 73, 'bull_adx_thresh': 13.186703169427503, 'bull_atr_min_pct': 0.0031943880633911372, 'bull_atr_max_pct': 0.080780429421967, 'bull_tp_mult': 2.9156637907056613, 'bull_tsl_mult': 0.7926683669983872, 'bull_time_stop': 169, 'bull_use_sma': True, 'bull_use_ema': True, 'bull_use_atr': False, 'bull_use_adx': False, 'bull_use_spike': False, 'bull_rsi_required': True, 'bear_strategy': 'mean_reversion', 'bear_bb_std_mult': 3.0198746465259765, 'bear_rsi_os': 55, 'bear_rsi_ob': 55, 'bear_adx_thresh': 13.363369821081573, 'bear_atr_min_pct': 0.015994122932108615, 'bear_atr_max_pct': 0.14646996961487044, 'bear_tp_mult': 2.665999184821281, 'bear_tsl_mult': 0.6045550296762648, 'bear_time_stop': 171, 'bear_use_sma': False, 'bear_use_ema': False, 'bear_use_atr': True, 'bear_use_adx': False, 'bear_use_spike': True, 'bear_rsi_required': True, 'sideways_strategy': 'breakout', 'sideways_bb_std_mult': 2.5891636949348995, 'sideways_rsi_os': 44, 'sideways_rsi_ob': 68, 'sideways_adx_thresh': 11.968296203888158, 'sideways_atr_min_pct': 0.005013366972879622, 'sideways_atr_max_pct': 0.015263148617077758, 'sideways_tp_mult': 2.563542271328281, 'sideways_tsl_mult': 0.813133921934472, 'sideways_time_stop': 142, 'sideways_use_sma': False, 'sideways_use_ema': False, 'sideways_use_atr': True, 'sideways_use_adx': False, 'sideways_use_spike': False, 'sideways_rsi_required': False}.
[I 2025-08-30 20:59:35,974] Trial 96 finished with values: [-0.023420083681977455, 0.02335494716146162] and parameters: {'p_sma': 48, 'p_std': 32, 'p_atr': 10, 'p_adx': 29, 'rsi_period': 17, 'ema1': 29, 'ema2': 46, 'slip_atr_k': 0.032429406038682815, 'slip_spread_k': 0.7912355831012188, 'spread_hl_frac': 0.04261791431883802, 'bb_std_mult': 0.744801874978841, 'rsi_os': 24, 'rsi_ob': 78, 'vol_spike': 0.17946735153227672, 'adx_thresh': 22.009739050913556, 'atr_min_pct': 0.01580300945402035, 'atr_max_pct': 0.09598738783837588, 'tp_mult': 1.9471592068383958, 'tsl_mult': 0.8438081531314721, 'strategy': 'mean_reversion', 'time_stop': 210, 'use_sma': False, 'use_atr': False, 'use_adx': True, 'use_ema': False, 'use_spike': True, 'rsi_required': True, 'edge_k': 0.6288703255481566, 'edge_cap': 0.5525493299419668, 'bull_strategy': 'breakout', 'bull_bb_std_mult': 3.259392935502916, 'bull_rsi_os': 18, 'bull_rsi_ob': 83, 'bull_adx_thresh': 12.252054001051848, 'bull_atr_min_pct': 0.0006201376113822241, 'bull_atr_max_pct': 0.09354937927159102, 'bull_tp_mult': 2.9313037432419615, 'bull_tsl_mult': 0.435570920782974, 'bull_time_stop': 74, 'bull_use_sma': True, 'bull_use_ema': False, 'bull_use_atr': False, 'bull_use_adx': False, 'bull_use_spike': False, 'bull_rsi_required': True, 'bear_strategy': 'mean_reversion', 'bear_bb_std_mult': 3.107434895117069, 'bear_rsi_os': 50, 'bear_rsi_ob': 55, 'bear_adx_thresh': 13.377535134683926, 'bear_atr_min_pct': 0.017299931902624563, 'bear_atr_max_pct': 0.14968279067331863, 'bear_tp_mult': 2.6478485351955916, 'bear_tsl_mult': 0.717732081160101, 'bear_time_stop': 97, 'bear_use_sma': True, 'bear_use_ema': True, 'bear_use_atr': False, 'bear_use_adx': False, 'bear_use_spike': True, 'bear_rsi_required': True, 'sideways_strategy': 'breakout', 'sideways_bb_std_mult': 2.572696555370988, 'sideways_rsi_os': 45, 'sideways_rsi_ob': 72, 'sideways_adx_thresh': 19.62862231051915, 'sideways_atr_min_pct': 0.004399539747979362, 'sideways_atr_max_pct': 0.022062996029213536, 'sideways_tp_mult': 2.805351091505243, 'sideways_tsl_mult': 0.3812372212092286, 'sideways_time_stop': 138, 'sideways_use_sma': False, 'sideways_use_ema': False, 'sideways_use_atr': True, 'sideways_use_adx': False, 'sideways_use_spike': False, 'sideways_rsi_required': False}.
[I 2025-08-30 20:59:36,186] Trial 94 finished with values: [-1000000000.0, 1000000000.0] and parameters: {'p_sma': 48, 'p_std': 37, 'p_atr': 17, 'p_adx': 28, 'rsi_period': 72, 'ema1': 5, 'ema2': 46, 'slip_atr_k': 0.019155793752424856, 'slip_spread_k': 0.8452873782915209, 'spread_hl_frac': 0.0016297551723196448, 'bb_std_mult': 3.495729615915825, 'rsi_os': 24, 'rsi_ob': 81, 'vol_spike': 0.05789015869835743, 'adx_thresh': 21.128673545292628, 'atr_min_pct': 0.014392461293072822, 'atr_max_pct': 0.09607012753426225, 'tp_mult': 2.7198634827375696, 'tsl_mult': 0.8607881410982712, 'strategy': 'mean_reversion', 'time_stop': 296, 'use_sma': False, 'use_atr': True, 'use_adx': True, 'use_ema': False, 'use_spike': True, 'rsi_required': True, 'edge_k': 0.6066179600811566, 'edge_cap': 0.42421717720064855, 'bull_strategy': 'mean_reversion', 'bull_bb_std_mult': 3.2951640059493794, 'bull_rsi_os': 7, 'bull_rsi_ob': 65, 'bull_adx_thresh': 12.96435368888412, 'bull_atr_min_pct': 0.0035595483738482094, 'bull_atr_max_pct': 0.09318682086609598, 'bull_tp_mult': 2.6011640672896106, 'bull_tsl_mult': 0.433294046312213, 'bull_time_stop': 76, 'bull_use_sma': True, 'bull_use_ema': False, 'bull_use_atr': False, 'bull_use_adx': False, 'bull_use_spike': False, 'bull_rsi_required': True, 'bear_strategy': 'mean_reversion', 'bear_bb_std_mult': 3.013853770276367, 'bear_rsi_os': 50, 'bear_rsi_ob': 55, 'bear_adx_thresh': 13.19865671500183, 'bear_atr_min_pct': 0.016341920030853295, 'bear_atr_max_pct': 0.1499375159946195, 'bear_tp_mult': 2.680870039388749, 'bear_tsl_mult': 0.6190007850774233, 'bear_time_stop': 81, 'bear_use_sma': True, 'bear_use_ema': False, 'bear_use_atr': True, 'bear_use_adx': False, 'bear_use_spike': True, 'bear_rsi_required': True, 'sideways_strategy': 'breakout', 'sideways_bb_std_mult': 3.007362996961082, 'sideways_rsi_os': 43, 'sideways_rsi_ob': 71, 'sideways_adx_thresh': 11.83106293098808, 'sideways_atr_min_pct': 0.00471687617702456, 'sideways_atr_max_pct': 0.0212924155401551, 'sideways_tp_mult': 2.425340698238432, 'sideways_tsl_mult': 0.7434271312345065, 'sideways_time_stop': 273, 'sideways_use_sma': False, 'sideways_use_ema': False, 'sideways_use_atr': True, 'sideways_use_adx': False, 'sideways_use_spike': False, 'sideways_rsi_required': False}.
[I 2025-08-30 20:59:36,203] Trial 95 finished with values: [-1000000000.0, 1000000000.0] and parameters: {'p_sma': 48, 'p_std': 32, 'p_atr': 13, 'p_adx': 28, 'rsi_period': 59, 'ema1': 30, 'ema2': 46, 'slip_atr_k': 0.019433618339051485, 'slip_spread_k': 0.8010002927324469, 'spread_hl_frac': 0.03676302273040179, 'bb_std_mult': 3.472831413345831, 'rsi_os': 24, 'rsi_ob': 82, 'vol_spike': 0.054443215290348554, 'adx_thresh': 21.024316598390158, 'atr_min_pct': 0.025144046558582295, 'atr_max_pct': 0.09836251129703616, 'tp_mult': 1.732255750710228, 'tsl_mult': 0.8862397872645326, 'strategy': 'mean_reversion', 'time_stop': 262, 'use_sma': False, 'use_atr': True, 'use_adx': True, 'use_ema': False, 'use_spike': True, 'rsi_required': True, 'edge_k': 0.5780775887600288, 'edge_cap': 0.43129084836767395, 'bull_strategy': 'breakout', 'bull_bb_std_mult': 3.2949892855887915, 'bull_rsi_os': 6, 'bull_rsi_ob': 73, 'bull_adx_thresh': 12.630062040131408, 'bull_atr_min_pct': 0.015971139138665887, 'bull_atr_max_pct': 0.09342908214571027, 'bull_tp_mult': 2.862430720671735, 'bull_tsl_mult': 0.42839365814344527, 'bull_time_stop': 61, 'bull_use_sma': True, 'bull_use_ema': False, 'bull_use_atr': False, 'bull_use_adx': False, 'bull_use_spike': False, 'bull_rsi_required': True, 'bear_strategy': 'mean_reversion', 'bear_bb_std_mult': 3.0968300810453986, 'bear_rsi_os': 50, 'bear_rsi_ob': 63, 'bear_adx_thresh': 18.035549785643802, 'bear_atr_min_pct': 0.018176761224930726, 'bear_atr_max_pct': 0.13394283438471546, 'bear_tp_mult': 2.641082768359341, 'bear_tsl_mult': 0.6253611958989851, 'bear_time_stop': 174, 'bear_use_sma': True, 'bear_use_ema': False, 'bear_use_atr': False, 'bear_use_adx': False, 'bear_use_spike': True, 'bear_rsi_required': True, 'sideways_strategy': 'breakout', 'sideways_bb_std_mult': 2.6058407582157908, 'sideways_rsi_os': 44, 'sideways_rsi_ob': 76, 'sideways_adx_thresh': 29.585580345615394, 'sideways_atr_min_pct': 0.007730048392046844, 'sideways_atr_max_pct': 0.023661823602306536, 'sideways_tp_mult': 2.5832718035139193, 'sideways_tsl_mult': 0.38506600233920174, 'sideways_time_stop': 224, 'sideways_use_sma': False, 'sideways_use_ema': False, 'sideways_use_atr': True, 'sideways_use_adx': False, 'sideways_use_spike': False, 'sideways_rsi_required': False}.
[I 2025-08-30 21:00:08,501] Trial 98 finished with values: [-1000000000.0, 1000000000.0] and parameters: {'p_sma': 47, 'p_std': 33, 'p_atr': 17, 'p_adx': 26, 'rsi_period': 71, 'ema1': 23, 'ema2': 44, 'slip_atr_k': 0.02491837231817213, 'slip_spread_k': 0.8430957646984717, 'spread_hl_frac': 0.0034746905801522083, 'bb_std_mult': 3.4321587862144485, 'rsi_os': 28, 'rsi_ob': 75, 'vol_spike': 0.027709293980490754, 'adx_thresh': 19.488521918424787, 'atr_min_pct': 0.010534757630253412, 'atr_max_pct': 0.10498234867461846, 'tp_mult': 1.735219007483563, 'tsl_mult': 0.9172153214474075, 'strategy': 'breakout', 'time_stop': 264, 'use_sma': False, 'use_atr': True, 'use_adx': False, 'use_ema': False, 'use_spike': False, 'rsi_required': True, 'edge_k': 0.511904095320104, 'edge_cap': 0.4183340134314768, 'bull_strategy': 'breakout', 'bull_bb_std_mult': 2.599048962480202, 'bull_rsi_os': 6, 'bull_rsi_ob': 66, 'bull_adx_thresh': 15.922371484308005, 'bull_atr_min_pct': 0.023820984690905718, 'bull_atr_max_pct': 0.10095560954933118, 'bull_tp_mult': 1.160030167178929, 'bull_tsl_mult': 0.7422235441447012, 'bull_time_stop': 158, 'bull_use_sma': True, 'bull_use_ema': False, 'bull_use_atr': True, 'bull_use_adx': True, 'bull_use_spike': False, 'bull_rsi_required': False, 'bear_strategy': 'mean_reversion', 'bear_bb_std_mult': 3.3086952058909453, 'bear_rsi_os': 51, 'bear_rsi_ob': 64, 'bear_adx_thresh': 19.561457021696544, 'bear_atr_min_pct': 0.01819967610883166, 'bear_atr_max_pct': 0.13377144400233038, 'bear_tp_mult': 1.5665645838021272, 'bear_tsl_mult': 0.639752875551254, 'bear_time_stop': 56, 'bear_use_sma': True, 'bear_use_ema': False, 'bear_use_atr': False, 'bear_use_adx': False, 'bear_use_spike': True, 'bear_rsi_required': False, 'sideways_strategy': 'breakout', 'sideways_bb_std_mult': 3.055989990681542, 'sideways_rsi_os': 43, 'sideways_rsi_ob': 76, 'sideways_adx_thresh': 29.538190638597715, 'sideways_atr_min_pct': 0.007181494020473603, 'sideways_atr_max_pct': 0.028399740460608322, 'sideways_tp_mult': 2.9206752535567713, 'sideways_tsl_mult': 0.46414478176040186, 'sideways_time_stop': 219, 'sideways_use_sma': False, 'sideways_use_ema': False, 'sideways_use_atr': True, 'sideways_use_adx': True, 'sideways_use_spike': False, 'sideways_rsi_required': False}.
[I 2025-08-30 21:00:09,337] Trial 97 finished with values: [-1000000000.0, 1000000000.0] and parameters: {'p_sma': 49, 'p_std': 33, 'p_atr': 17, 'p_adx': 30, 'rsi_period': 58, 'ema1': 29, 'ema2': 47, 'slip_atr_k': 0.032045409627225886, 'slip_spread_k': 0.8340069740530518, 'spread_hl_frac': 0.043019122873577335, 'bb_std_mult': 3.4386597932445473, 'rsi_os': 25, 'rsi_ob': 76, 'vol_spike': 0.05394315600608578, 'adx_thresh': 21.990626530362917, 'atr_min_pct': 0.01568678126156277, 'atr_max_pct': 0.10111006597386885, 'tp_mult': 1.738076511573729, 'tsl_mult': 0.87703441577374, 'strategy': 'mean_reversion', 'time_stop': 265, 'use_sma': False, 'use_atr': False, 'use_adx': True, 'use_ema': False, 'use_spike': True, 'rsi_required': True, 'edge_k': 0.5822539689471329, 'edge_cap': 0.4172392724574425, 'bull_strategy': 'breakout', 'bull_bb_std_mult': 2.792887791583171, 'bull_rsi_os': 18, 'bull_rsi_ob': 65, 'bull_adx_thresh': 17.1860770764549, 'bull_atr_min_pct': 0.020876905207204557, 'bull_atr_max_pct': 0.09519712986506883, 'bull_tp_mult': 2.3621838220315983, 'bull_tsl_mult': 0.741458472783945, 'bull_time_stop': 158, 'bull_use_sma': True, 'bull_use_ema': False, 'bull_use_atr': False, 'bull_use_adx': True, 'bull_use_spike': False, 'bull_rsi_required': True, 'bear_strategy': 'mean_reversion', 'bear_bb_std_mult': 3.2735308839348205, 'bear_rsi_os': 51, 'bear_rsi_ob': 59, 'bear_adx_thresh': 19.81937176814911, 'bear_atr_min_pct': 0.017564505541820926, 'bear_atr_max_pct': 0.14004076012009062, 'bear_tp_mult': 2.5312136134491614, 'bear_tsl_mult': 0.6338781502949897, 'bear_time_stop': 93, 'bear_use_sma': True, 'bear_use_ema': True, 'bear_use_atr': False, 'bear_use_adx': False, 'bear_use_spike': True, 'bear_rsi_required': False, 'sideways_strategy': 'breakout', 'sideways_bb_std_mult': 2.847822055529099, 'sideways_rsi_os': 43, 'sideways_rsi_ob': 75, 'sideways_adx_thresh': 19.348753020027758, 'sideways_atr_min_pct': 0.003638223700632248, 'sideways_atr_max_pct': 0.02125104323775569, 'sideways_tp_mult': 2.8250063718141023, 'sideways_tsl_mult': 0.37494079068840164, 'sideways_time_stop': 112, 'sideways_use_sma': False, 'sideways_use_ema': False, 'sideways_use_atr': True, 'sideways_use_adx': True, 'sideways_use_spike': False, 'sideways_rsi_required': False}.
