[I 2025-08-30 22:06:29,399] Trial 639 finished with values: [-1000000000.0, 1000000000.0] and parameters: {'p_sma': 48, 'p_std': 40, 'p_atr': 24, 'p_adx': 21, 'rsi_period': 71, 'ema1': 12, 'ema2': 56, 'slip_atr_k': 0.019689723486364087, 'slip_spread_k': 0.9647988341173519, 'spread_hl_frac': 0.03243842805893516, 'bb_std_mult': 0.5888661513509508, 'rsi_os': 15, 'rsi_ob': 72, 'vol_spike': 0.2805963734974561, 'adx_thresh': 11.477154832999865, 'atr_min_pct': 0.0022886386400752124, 'atr_max_pct': 0.1467671278517661, 'tp_mult': 1.1694147745704861, 'tsl_mult': 0.8589397022039172, 'strategy': 'breakout', 'time_stop': 103, 'use_sma': False, 'use_atr': True, 'use_adx': True, 'use_ema': True, 'use_spike': True, 'rsi_required': True, 'edge_k': 1.1677656757119252, 'edge_cap': 0.8050437247945058, 'bull_strategy': 'breakout', 'bull_bb_std_mult': 1.982341430344188, 'bull_rsi_os': 18, 'bull_rsi_ob': 90, 'bull_adx_thresh': 15.446662818173074, 'bull_atr_min_pct': 0.0009782448546134124, 'bull_atr_max_pct': 0.10539455239253061, 'bull_tp_mult': 1.1134990357834287, 'bull_tsl_mult': 0.3906333521988545, 'bull_time_stop': 249, 'bull_use_sma': False, 'bull_use_ema': False, 'bull_use_atr': False, 'bull_use_adx': False, 'bull_use_spike': False, 'bull_rsi_required': True, 'bear_strategy': 'mean_reversion', 'bear_bb_std_mult': 2.0869959263713214, 'bear_rsi_os': 8, 'bear_rsi_ob': 81, 'bear_adx_thresh': 5.605997890512636, 'bear_atr_min_pct': 0.028516032208831626, 'bear_atr_max_pct': 0.113995831185749, 'bear_tp_mult': 1.5019466829130819, 'bear_tsl_mult': 0.39715398661358237, 'bear_time_stop': 251, 'bear_use_sma': False, 'bear_use_ema': True, 'bear_use_atr': False, 'bear_use_adx': True, 'bear_use_spike': True, 'bear_rsi_required': True, 'sideways_strategy': 'mean_reversion', 'sideways_bb_std_mult': 3.128248044543998, 'sideways_rsi_os': 39, 'sideways_rsi_ob': 89, 'sideways_adx_thresh': 27.264050539933287, 'sideways_atr_min_pct': 0.020296525376043647, 'sideways_atr_max_pct': 0.041517434710166064, 'sideways_tp_mult': 1.776937913813266, 'sideways_tsl_mult': 0.22935481447103712, 'sideways_time_stop': 83, 'sideways_use_sma': False, 'sideways_use_ema': False, 'sideways_use_atr': True, 'sideways_use_adx': False, 'sideways_use_spike': False, 'sideways_rsi_required': False}.
[I 2025-08-30 22:06:29,985] Trial 640 finished with values: [-0.018342938964281297, 0.018278562827860508] and parameters: {'p_sma': 40, 'p_std': 28, 'p_atr': 22, 'p_adx': 21, 'rsi_period': 48, 'ema1': 12, 'ema2': 19, 'slip_atr_k': 0.010849687530854454, 'slip_spread_k': 0.9478180360248794, 'spread_hl_frac': 0.032572437865441825, 'bb_std_mult': 1.0361941357004834, 'rsi_os': 40, 'rsi_ob': 63, 'vol_spike': 0.18815158287571165, 'adx_thresh': 13.011509502323925, 'atr_min_pct': 0.003283559342600056, 'atr_max_pct': 0.03111334381146811, 'tp_mult': 1.5247641022056573, 'tsl_mult': 0.7084463426887704, 'strategy': 'breakout', 'time_stop': 91, 'use_sma': False, 'use_atr': True, 'use_adx': True, 'use_ema': True, 'use_spike': True, 'rsi_required': True, 'edge_k': 0.3857439498049039, 'edge_cap': 0.8063306228406859, 'bull_strategy': 'breakout', 'bull_bb_std_mult': 1.6691140788390237, 'bull_rsi_os': 10, 'bull_rsi_ob': 88, 'bull_adx_thresh': 15.35228988877717, 'bull_atr_min_pct': 0.000858667649955579, 'bull_atr_max_pct': 0.09452636141673891, 'bull_tp_mult': 2.0758644556477375, 'bull_tsl_mult': 0.4665503731603451, 'bull_time_stop': 289, 'bull_use_sma': True, 'bull_use_ema': False, 'bull_use_atr': False, 'bull_use_adx': False, 'bull_use_spike': False, 'bull_rsi_required': True, 'bear_strategy': 'mean_reversion', 'bear_bb_std_mult': 1.863893107597797, 'bear_rsi_os': 46, 'bear_rsi_ob': 81, 'bear_adx_thresh': 5.551314700078608, 'bear_atr_min_pct': 0.007908494531667644, 'bear_atr_max_pct': 0.11373175035271538, 'bear_tp_mult': 1.6262166962119347, 'bear_tsl_mult': 0.45596888872103647, 'bear_time_stop': 251, 'bear_use_sma': False, 'bear_use_ema': True, 'bear_use_atr': False, 'bear_use_adx': True, 'bear_use_spike': False, 'bear_rsi_required': True, 'sideways_strategy': 'breakout', 'sideways_bb_std_mult': 3.4206699076497573, 'sideways_rsi_os': 40, 'sideways_rsi_ob': 89, 'sideways_adx_thresh': 22.773606486939975, 'sideways_atr_min_pct': 0.02039781034147621, 'sideways_atr_max_pct': 0.04267257065243396, 'sideways_tp_mult': 1.7848996435891735, 'sideways_tsl_mult': 0.8233035159963952, 'sideways_time_stop': 258, 'sideways_use_sma': False, 'sideways_use_ema': False, 'sideways_use_atr': False, 'sideways_use_adx': True, 'sideways_use_spike': False, 'sideways_rsi_required': False}.
[I 2025-08-30 22:07:04,055] Trial 642 finished with values: [-1000000000.0, 1000000000.0] and parameters: {'p_sma': 41, 'p_std': 40, 'p_atr': 22, 'p_adx': 9, 'rsi_period': 70, 'ema1': 12, 'ema2': 57, 'slip_atr_k': 0.017292222792229597, 'slip_spread_k': 0.8315914675882581, 'spread_hl_frac': 0.03208515145150126, 'bb_std_mult': 0.6317600276236608, 'rsi_os': 26, 'rsi_ob': 89, 'vol_spike': 0.15799399824149324, 'adx_thresh': 8.580247485189236, 'atr_min_pct': 0.01455075244172206, 'atr_max_pct': 0.02418492332606069, 'tp_mult': 1.161411200829141, 'tsl_mult': 0.20609472871934942, 'strategy': 'mean_reversion', 'time_stop': 89, 'use_sma': True, 'use_atr': True, 'use_adx': True, 'use_ema': False, 'use_spike': True, 'rsi_required': True, 'edge_k': 1.0480327720472362, 'edge_cap': 0.8565935664516557, 'bull_strategy': 'breakout', 'bull_bb_std_mult': 1.7769039404739286, 'bull_rsi_os': 14, 'bull_rsi_ob': 74, 'bull_adx_thresh': 22.67221666769323, 'bull_atr_min_pct': 0.01607495359256973, 'bull_atr_max_pct': 0.09481162647080371, 'bull_tp_mult': 1.0932189566820814, 'bull_tsl_mult': 0.10790982132518206, 'bull_time_stop': 37, 'bull_use_sma': False, 'bull_use_ema': False, 'bull_use_atr': False, 'bull_use_adx': False, 'bull_use_spike': False, 'bull_rsi_required': True, 'bear_strategy': 'breakout', 'bear_bb_std_mult': 1.8680618405018397, 'bear_rsi_os': 45, 'bear_rsi_ob': 68, 'bear_adx_thresh': 5.630591680507534, 'bear_atr_min_pct': 0.02858847764146078, 'bear_atr_max_pct': 0.12843547409876999, 'bear_tp_mult': 1.4784499890497436, 'bear_tsl_mult': 0.10067225827183779, 'bear_time_stop': 235, 'bear_use_sma': False, 'bear_use_ema': True, 'bear_use_atr': False, 'bear_use_adx': False, 'bear_use_spike': False, 'bear_rsi_required': True, 'sideways_strategy': 'breakout', 'sideways_bb_std_mult': 0.694304707368077, 'sideways_rsi_os': 33, 'sideways_rsi_ob': 51, 'sideways_adx_thresh': 22.515269467360802, 'sideways_atr_min_pct': 0.0204745906265417, 'sideways_atr_max_pct': 0.04205373712992968, 'sideways_tp_mult': 1.3271177922049922, 'sideways_tsl_mult': 0.8265304023811669, 'sideways_time_stop': 259, 'sideways_use_sma': False, 'sideways_use_ema': False, 'sideways_use_atr': False, 'sideways_use_adx': False, 'sideways_use_spike': False, 'sideways_rsi_required': False}.
[I 2025-08-30 22:07:04,935] Trial 641 finished with values: [-1000000000.0, 1000000000.0] and parameters: {'p_sma': 40, 'p_std': 40, 'p_atr': 22, 'p_adx': 19, 'rsi_period': 48, 'ema1': 12, 'ema2': 55, 'slip_atr_k': 0.15969913255095963, 'slip_spread_k': 0.683384782362729, 'spread_hl_frac': 0.03228795365690755, 'bb_std_mult': 0.8045907119896393, 'rsi_os': 11, 'rsi_ob': 63, 'vol_spike': 0.29826261521255226, 'adx_thresh': 13.12853359007457, 'atr_min_pct': 0.004483959541037627, 'atr_max_pct': 0.02388124301300381, 'tp_mult': 1.5244900995608661, 'tsl_mult': 0.8547491826037669, 'strategy': 'mean_reversion', 'time_stop': 93, 'use_sma': True, 'use_atr': True, 'use_adx': True, 'use_ema': True, 'use_spike': True, 'rsi_required': True, 'edge_k': 1.2901434953668633, 'edge_cap': 0.8573723664307221, 'bull_strategy': 'breakout', 'bull_bb_std_mult': 2.0278782685064805, 'bull_rsi_os': 18, 'bull_rsi_ob': 74, 'bull_adx_thresh': 15.715686481795439, 'bull_atr_min_pct': 0.018322211830081106, 'bull_atr_max_pct': 0.11963225125217453, 'bull_tp_mult': 2.074469924387, 'bull_tsl_mult': 0.7440558563890748, 'bull_time_stop': 290, 'bull_use_sma': True, 'bull_use_ema': False, 'bull_use_atr': False, 'bull_use_adx': False, 'bull_use_spike': False, 'bull_rsi_required': True, 'bear_strategy': 'breakout', 'bear_bb_std_mult': 2.092713447852854, 'bear_rsi_os': 46, 'bear_rsi_ob': 68, 'bear_adx_thresh': 23.237405053039176, 'bear_atr_min_pct': 0.019956148207757433, 'bear_atr_max_pct': 0.05325376628559225, 'bear_tp_mult': 1.4749814834575918, 'bear_tsl_mult': 0.4578761392209693, 'bear_time_stop': 234, 'bear_use_sma': False, 'bear_use_ema': True, 'bear_use_atr': False, 'bear_use_adx': True, 'bear_use_spike': False, 'bear_rsi_required': True, 'sideways_strategy': 'breakout', 'sideways_bb_std_mult': 1.5345833550724974, 'sideways_rsi_os': 40, 'sideways_rsi_ob': 89, 'sideways_adx_thresh': 21.968601866946784, 'sideways_atr_min_pct': 0.021108670600936828, 'sideways_atr_max_pct': 0.041704964828420774, 'sideways_tp_mult': 2.5305328696846643, 'sideways_tsl_mult': 0.10256109507014244, 'sideways_time_stop': 259, 'sideways_use_sma': False, 'sideways_use_ema': False, 'sideways_use_atr': False, 'sideways_use_adx': True, 'sideways_use_spike': False, 'sideways_rsi_required': False}.
[I 2025-08-30 22:07:05,940] Trial 644 finished with values: [-1000000000.0, 1000000000.0] and parameters: {'p_sma': 34, 'p_std': 37, 'p_atr': 22, 'p_adx': 16, 'rsi_period': 74, 'ema1': 11, 'ema2': 33, 'slip_atr_k': 0.04252601414267283, 'slip_spread_k': 0.6840821617529855, 'spread_hl_frac': 0.047788147863542026, 'bb_std_mult': 0.8141586066207019, 'rsi_os': 20, 'rsi_ob': 85, 'vol_spike': 0.29944492301361225, 'adx_thresh': 21.771469031702697, 'atr_min_pct': 0.010435380464475445, 'atr_max_pct': 0.118542418414421, 'tp_mult': 1.110751517547718, 'tsl_mult': 0.20122063056909872, 'strategy': 'mean_reversion', 'time_stop': 86, 'use_sma': True, 'use_atr': True, 'use_adx': False, 'use_ema': False, 'use_spike': False, 'rsi_required': True, 'edge_k': 0.8817259220851017, 'edge_cap': 0.7821546392012804, 'bull_strategy': 'breakout', 'bull_bb_std_mult': 1.771149494906062, 'bull_rsi_os': 14, 'bull_rsi_ob': 74, 'bull_adx_thresh': 11.836227400897677, 'bull_atr_min_pct': 0.018262231583596092, 'bull_atr_max_pct': 0.045105755867780095, 'bull_tp_mult': 1.2552142389346777, 'bull_tsl_mult': 0.43223824100529074, 'bull_time_stop': 36, 'bull_use_sma': True, 'bull_use_ema': False, 'bull_use_atr': False, 'bull_use_adx': False, 'bull_use_spike': False, 'bull_rsi_required': True, 'bear_strategy': 'breakout', 'bear_bb_std_mult': 2.018791477046128, 'bear_rsi_os': 5, 'bear_rsi_ob': 64, 'bear_adx_thresh': 29.04970526362473, 'bear_atr_min_pct': 0.019906928838837087, 'bear_atr_max_pct': 0.0701138141891784, 'bear_tp_mult': 2.5597542293290543, 'bear_tsl_mult': 0.3508654521502492, 'bear_time_stop': 237, 'bear_use_sma': False, 'bear_use_ema': True, 'bear_use_atr': False, 'bear_use_adx': False, 'bear_use_spike': False, 'bear_rsi_required': True, 'sideways_strategy': 'breakout', 'sideways_bb_std_mult': 0.6825561993081952, 'sideways_rsi_os': 33, 'sideways_rsi_ob': 79, 'sideways_adx_thresh': 23.89441701366166, 'sideways_atr_min_pct': 0.026410351706932567, 'sideways_atr_max_pct': 0.026573022538557894, 'sideways_tp_mult': 2.2516161782622683, 'sideways_tsl_mult': 0.7933084930559877, 'sideways_time_stop': 76, 'sideways_use_sma': True, 'sideways_use_ema': False, 'sideways_use_atr': False, 'sideways_use_adx': True, 'sideways_use_spike': True, 'sideways_rsi_required': False}.
[I 2025-08-30 22:07:05,972] Trial 643 finished with values: [-1000000000.0, 1000000000.0] and parameters: {'p_sma': 34, 'p_std': 37, 'p_atr': 22, 'p_adx': 16, 'rsi_period': 67, 'ema1': 11, 'ema2': 33, 'slip_atr_k': 0.040750374998829234, 'slip_spread_k': 0.6785202737896782, 'spread_hl_frac': 0.031923142622597954, 'bb_std_mult': 0.6383524466548678, 'rsi_os': 23, 'rsi_ob': 85, 'vol_spike': 0.29497168806550744, 'adx_thresh': 21.68133919631102, 'atr_min_pct': 0.010617061845978819, 'atr_max_pct': 0.07217759284687754, 'tp_mult': 1.7347913525420182, 'tsl_mult': 0.8906465958612687, 'strategy': 'mean_reversion', 'time_stop': 67, 'use_sma': True, 'use_atr': True, 'use_adx': False, 'use_ema': False, 'use_spike': False, 'rsi_required': True, 'edge_k': 1.03081867038937, 'edge_cap': 0.9570811467741189, 'bull_strategy': 'breakout', 'bull_bb_std_mult': 1.0205969702795241, 'bull_rsi_os': 14, 'bull_rsi_ob': 64, 'bull_adx_thresh': 15.642807515497683, 'bull_atr_min_pct': 0.016119368933449126, 'bull_atr_max_pct': 0.046505955867380974, 'bull_tp_mult': 1.3923016632071379, 'bull_tsl_mult': 0.424348480328653, 'bull_time_stop': 291, 'bull_use_sma': True, 'bull_use_ema': False, 'bull_use_atr': False, 'bull_use_adx': False, 'bull_use_spike': False, 'bull_rsi_required': True, 'bear_strategy': 'breakout', 'bear_bb_std_mult': 3.0547475544686744, 'bear_rsi_os': 46, 'bear_rsi_ob': 89, 'bear_adx_thresh': 29.00330311664646, 'bear_atr_min_pct': 0.02894426650575316, 'bear_atr_max_pct': 0.05273254183916648, 'bear_tp_mult': 1.5553120851593842, 'bear_tsl_mult': 0.7439014238118417, 'bear_time_stop': 236, 'bear_use_sma': False, 'bear_use_ema': True, 'bear_use_atr': False, 'bear_use_adx': False, 'bear_use_spike': False, 'bear_rsi_required': True, 'sideways_strategy': 'breakout', 'sideways_bb_std_mult': 0.6733555005689875, 'sideways_rsi_os': 20, 'sideways_rsi_ob': 51, 'sideways_adx_thresh': 28.998011482719498, 'sideways_atr_min_pct': 0.004593119896567641, 'sideways_atr_max_pct': 0.0729304409385084, 'sideways_tp_mult': 1.3353301490353418, 'sideways_tsl_mult': 0.8236413939565227, 'sideways_time_stop': 259, 'sideways_use_sma': True, 'sideways_use_ema': False, 'sideways_use_atr': False, 'sideways_use_adx': True, 'sideways_use_spike': True, 'sideways_rsi_required': False}.
[I 2025-08-30 22:07:07,064] Trial 645 finished with values: [-1000000000.0, 1000000000.0] and parameters: {'p_sma': 59, 'p_std': 37, 'p_atr': 20, 'p_adx': 19, 'rsi_period': 74, 'ema1': 11, 'ema2': 34, 'slip_atr_k': 0.04035054163225462, 'slip_spread_k': 0.6756816692903622, 'spread_hl_frac': 0.034865154584496016, 'bb_std_mult': 0.8253231194074235, 'rsi_os': 10, 'rsi_ob': 48, 'vol_spike': 0.2704479097574224, 'adx_thresh': 9.892586688625174, 'atr_min_pct': 0.022628864726675843, 'atr_max_pct': 0.020814518874854304, 'tp_mult': 1.7604574574085263, 'tsl_mult': 0.8907883735226865, 'strategy': 'mean_reversion', 'time_stop': 96, 'use_sma': True, 'use_atr': True, 'use_adx': False, 'use_ema': False, 'use_spike': False, 'rsi_required': True, 'edge_k': 0.11943322536818135, 'edge_cap': 0.7786820916090339, 'bull_strategy': 'breakout', 'bull_bb_std_mult': 2.0472759501171014, 'bull_rsi_os': 51, 'bull_rsi_ob': 84, 'bull_adx_thresh': 12.143771074159352, 'bull_atr_min_pct': 0.018263876618767588, 'bull_atr_max_pct': 0.044415318263334745, 'bull_tp_mult': 1.3072515344405171, 'bull_tsl_mult': 0.42307572900406404, 'bull_time_stop': 231, 'bull_use_sma': True, 'bull_use_ema': True, 'bull_use_atr': False, 'bull_use_adx': False, 'bull_use_spike': False, 'bull_rsi_required': True, 'bear_strategy': 'breakout', 'bear_bb_std_mult': 2.399149234265596, 'bear_rsi_os': 43, 'bear_rsi_ob': 89, 'bear_adx_thresh': 23.25131268186766, 'bear_atr_min_pct': 0.01986694028223939, 'bear_atr_max_pct': 0.10726159767503496, 'bear_tp_mult': 1.540888505483274, 'bear_tsl_mult': 0.8658778602780198, 'bear_time_stop': 218, 'bear_use_sma': False, 'bear_use_ema': True, 'bear_use_atr': False, 'bear_use_adx': True, 'bear_use_spike': True, 'bear_rsi_required': True, 'sideways_strategy': 'breakout', 'sideways_bb_std_mult': 1.7634846349766133, 'sideways_rsi_os': 6, 'sideways_rsi_ob': 82, 'sideways_adx_thresh': 28.227431375312463, 'sideways_atr_min_pct': 0.027366550245290243, 'sideways_atr_max_pct': 0.03408509991351092, 'sideways_tp_mult': 1.916972474641505, 'sideways_tsl_mult': 0.10272622740616294, 'sideways_time_stop': 278, 'sideways_use_sma': True, 'sideways_use_ema': False, 'sideways_use_atr': False, 'sideways_use_adx': True, 'sideways_use_spike': True, 'sideways_rsi_required': False}.
[I 2025-08-30 22:07:07,372] Trial 648 finished with values: [-1000000000.0, 1000000000.0] and parameters: {'p_sma': 32, 'p_std': 34, 'p_atr': 19, 'p_adx': 20, 'rsi_period': 51, 'ema1': 10, 'ema2': 55, 'slip_atr_k': 0.14095840397190515, 'slip_spread_k': 0.6446495373352581, 'spread_hl_frac': 0.034952246719149704, 'bb_std_mult': 2.161549218055742, 'rsi_os': 10, 'rsi_ob': 48, 'vol_spike': 0.26851486663790186, 'adx_thresh': 11.019056635457334, 'atr_min_pct': 0.013928851261498388, 'atr_max_pct': 0.021528401630693122, 'tp_mult': 2.4913612647350294, 'tsl_mult': 0.889319469363342, 'strategy': 'mean_reversion', 'time_stop': 97, 'use_sma': True, 'use_atr': False, 'use_adx': True, 'use_ema': True, 'use_spike': True, 'rsi_required': True, 'edge_k': 0.1171524118673215, 'edge_cap': 0.8255981942030146, 'bull_strategy': 'mean_reversion', 'bull_bb_std_mult': 0.6278141213737922, 'bull_rsi_os': 43, 'bull_rsi_ob': 62, 'bull_adx_thresh': 17.39870890644888, 'bull_atr_min_pct': 0.014007958979831685, 'bull_atr_max_pct': 0.04922669293383131, 'bull_tp_mult': 1.733521604851953, 'bull_tsl_mult': 0.41020430122553203, 'bull_time_stop': 300, 'bull_use_sma': True, 'bull_use_ema': True, 'bull_use_atr': False, 'bull_use_adx': False, 'bull_use_spike': False, 'bull_rsi_required': True, 'bear_strategy': 'mean_reversion', 'bear_bb_std_mult': 2.149258633349462, 'bear_rsi_os': 52, 'bear_rsi_ob': 76, 'bear_adx_thresh': 27.159153977779113, 'bear_atr_min_pct': 0.029995122367650718, 'bear_atr_max_pct': 0.10817886337980942, 'bear_tp_mult': 1.5299917580731694, 'bear_tsl_mult': 0.35880545978843, 'bear_time_stop': 227, 'bear_use_sma': False, 'bear_use_ema': True, 'bear_use_atr': False, 'bear_use_adx': True, 'bear_use_spike': True, 'bear_rsi_required': True, 'sideways_strategy': 'breakout', 'sideways_bb_std_mult': 1.7760403399475992, 'sideways_rsi_os': 36, 'sideways_rsi_ob': 90, 'sideways_adx_thresh': 34.158101864146815, 'sideways_atr_min_pct': 0.0279309187332097, 'sideways_atr_max_pct': 0.04792453238890242, 'sideways_tp_mult': 2.4001781837306857, 'sideways_tsl_mult': 0.7709813621028885, 'sideways_time_stop': 277, 'sideways_use_sma': False, 'sideways_use_ema': False, 'sideways_use_atr': False, 'sideways_use_adx': True, 'sideways_use_spike': False, 'sideways_rsi_required': False}.
[I 2025-08-30 22:07:11,248] Trial 649 finished with values: [-1000000000.0, 1000000000.0] and parameters: {'p_sma': 38, 'p_std': 44, 'p_atr': 19, 'p_adx': 25, 'rsi_period': 70, 'ema1': 10, 'ema2': 26, 'slip_atr_k': 0.02229462801211459, 'slip_spread_k': 0.640292997682911, 'spread_hl_frac': 0.033700299530072114, 'bb_std_mult': 0.7000697884594578, 'rsi_os': 12, 'rsi_ob': 50, 'vol_spike': 0.24017933454898033, 'adx_thresh': 10.852508751417728, 'atr_min_pct': 0.011914744066426387, 'atr_max_pct': 0.017433383393497245, 'tp_mult': 2.481132053663521, 'tsl_mult': 0.4137288785155785, 'strategy': 'mean_reversion', 'time_stop': 73, 'use_sma': True, 'use_atr': False, 'use_adx': True, 'use_ema': True, 'use_spike': True, 'rsi_required': True, 'edge_k': 1.4330865045672818, 'edge_cap': 0.8263718032219197, 'bull_strategy': 'mean_reversion', 'bull_bb_std_mult': 1.8848893949678296, 'bull_rsi_os': 17, 'bull_rsi_ob': 54, 'bull_adx_thresh': 14.484184974313616, 'bull_atr_min_pct': 0.013268423960973679, 'bull_atr_max_pct': 0.04981184464946308, 'bull_tp_mult': 1.5369130367687287, 'bull_tsl_mult': 0.4093463071822733, 'bull_time_stop': 300, 'bull_use_sma': True, 'bull_use_ema': True, 'bull_use_atr': False, 'bull_use_adx': False, 'bull_use_spike': False, 'bull_rsi_required': True, 'bear_strategy': 'mean_reversion', 'bear_bb_std_mult': 2.243524618781069, 'bear_rsi_os': 8, 'bear_rsi_ob': 76, 'bear_adx_thresh': 24.868649806420343, 'bear_atr_min_pct': 0.01851169286850933, 'bear_atr_max_pct': 0.07446572312262445, 'bear_tp_mult': 1.5769507382690906, 'bear_tsl_mult': 0.7698674917470731, 'bear_time_stop': 38, 'bear_use_sma': False, 'bear_use_ema': True, 'bear_use_atr': False, 'bear_use_adx': True, 'bear_use_spike': True, 'bear_rsi_required': True, 'sideways_strategy': 'breakout', 'sideways_bb_std_mult': 1.3031722283161917, 'sideways_rsi_os': 28, 'sideways_rsi_ob': 90, 'sideways_adx_thresh': 27.86721513922351, 'sideways_atr_min_pct': 0.02248890481988217, 'sideways_atr_max_pct': 0.04458598054149245, 'sideways_tp_mult': 1.741869134961483, 'sideways_tsl_mult': 0.7709665938523704, 'sideways_time_stop': 251, 'sideways_use_sma': False, 'sideways_use_ema': False, 'sideways_use_atr': False, 'sideways_use_adx': False, 'sideways_use_spike': False, 'sideways_rsi_required': False}.
