[I 2025-08-30 20:55:06,090] Trial 63 finished with values: [-0.05264125322630375, 0.05256804774776044] and parameters: {'p_sma': 42, 'p_std': 20, 'p_atr': 25, 'p_adx': 9, 'rsi_period': 26, 'ema1': 24, 'ema2': 40, 'slip_atr_k': 0.1643250453261668, 'slip_spread_k': 0.5765210598407207, 'spread_hl_frac': 0.009218516238123673, 'bb_std_mult': 3.1622477026824267, 'rsi_os': 15, 'rsi_ob': 48, 'vol_spike': 0.09664883550261819, 'adx_thresh': 28.146049410543807, 'atr_min_pct': 0.0032694872002329463, 'atr_max_pct': 0.13614620110166872, 'tp_mult': 1.0415256854715924, 'tsl_mult': 0.17915143164332772, 'strategy': 'breakout', 'time_stop': 61, 'use_sma': False, 'use_atr': True, 'use_adx': True, 'use_ema': True, 'use_spike': True, 'rsi_required': False, 'edge_k': 0.28997339915726494, 'edge_cap': 0.9399213821613356, 'bull_strategy': 'breakout', 'bull_bb_std_mult': 1.3332390076647658, 'bull_rsi_os': 32, 'bull_rsi_ob': 78, 'bull_adx_thresh': 29.137300782325486, 'bull_atr_min_pct': 3.12690316582645e-05, 'bull_atr_max_pct': 0.06697769961679367, 'bull_tp_mult': 2.0314645085772813, 'bull_tsl_mult': 0.9200469829118558, 'bull_time_stop': 236, 'bull_use_sma': True, 'bull_use_ema': True, 'bull_use_atr': True, 'bull_use_adx': True, 'bull_use_spike': True, 'bull_rsi_required': True, 'bear_strategy': 'breakout', 'bear_bb_std_mult': 2.6941077744614503, 'bear_rsi_os': 32, 'bear_rsi_ob': 66, 'bear_adx_thresh': 24.22510556062942, 'bear_atr_min_pct': 0.00020510341485369815, 'bear_atr_max_pct': 0.04811019057606303, 'bear_tp_mult': 2.863788702782468, 'bear_tsl_mult': 0.16409356337484607, 'bear_time_stop': 50, 'bear_use_sma': True, 'bear_use_ema': True, 'bear_use_atr': False, 'bear_use_adx': False, 'bear_use_spike': False, 'bear_rsi_required': False, 'sideways_strategy': 'breakout', 'sideways_bb_std_mult': 0.7160689733846517, 'sideways_rsi_os': 30, 'sideways_rsi_ob': 59, 'sideways_adx_thresh': 22.58306593263351, 'sideways_atr_min_pct': 0.022606637230827703, 'sideways_atr_max_pct': 0.06514659533664022, 'sideways_tp_mult': 1.1492695607977017, 'sideways_tsl_mult': 0.8958083342951905, 'sideways_time_stop': 43, 'sideways_use_sma': True, 'sideways_use_ema': False, 'sideways_use_atr': True, 'sideways_use_adx': False, 'sideways_use_spike': True, 'sideways_rsi_required': True}.
[I 2025-08-30 20:55:06,441] Trial 65 finished with values: [-1000000000.0, 1000000000.0] and parameters: {'p_sma': 33, 'p_std': 57, 'p_atr': 27, 'p_adx': 15, 'rsi_period': 78, 'ema1': 12, 'ema2': 45, 'slip_atr_k': 0.1794310361011985, 'slip_spread_k': 0.5756177787217032, 'spread_hl_frac': 0.014876661301889004, 'bb_std_mult': 2.9327047472639065, 'rsi_os': 29, 'rsi_ob': 48, 'vol_spike': 0.21943040574776546, 'adx_thresh': 25.176189199778392, 'atr_min_pct': 0.018497269294142155, 'atr_max_pct': 0.051930341344118856, 'tp_mult': 1.9262292483962349, 'tsl_mult': 0.65988436811688, 'strategy': 'mean_reversion', 'time_stop': 28, 'use_sma': True, 'use_atr': True, 'use_adx': True, 'use_ema': False, 'use_spike': True, 'rsi_required': True, 'edge_k': 0.4827679794448275, 'edge_cap': 0.8419649435535278, 'bull_strategy': 'breakout', 'bull_bb_std_mult': 1.6935381634164726, 'bull_rsi_os': 55, 'bull_rsi_ob': 75, 'bull_adx_thresh': 24.467043699295377, 'bull_atr_min_pct': 0.0013121439967984643, 'bull_atr_max_pct': 0.06778770136660707, 'bull_tp_mult': 2.3012612091217797, 'bull_tsl_mult': 0.1445893239288536, 'bull_time_stop': 188, 'bull_use_sma': True, 'bull_use_ema': False, 'bull_use_atr': False, 'bull_use_adx': False, 'bull_use_spike': False, 'bull_rsi_required': True, 'bear_strategy': 'breakout', 'bear_bb_std_mult': 0.7578007627884628, 'bear_rsi_os': 36, 'bear_rsi_ob': 58, 'bear_adx_thresh': 24.854132828180056, 'bear_atr_min_pct': 0.006958276262652134, 'bear_atr_max_pct': 0.047490556562032854, 'bear_tp_mult': 2.0485969144928413, 'bear_tsl_mult': 0.057276004292933815, 'bear_time_stop': 266, 'bear_use_sma': True, 'bear_use_ema': False, 'bear_use_atr': False, 'bear_use_adx': False, 'bear_use_spike': True, 'bear_rsi_required': True, 'sideways_strategy': 'mean_reversion', 'sideways_bb_std_mult': 0.6186415387572362, 'sideways_rsi_os': 13, 'sideways_rsi_ob': 53, 'sideways_adx_thresh': 10.839064788964928, 'sideways_atr_min_pct': 0.028208660894492844, 'sideways_atr_max_pct': 0.08083906325799661, 'sideways_tp_mult': 2.991850559580294, 'sideways_tsl_mult': 0.940037550798104, 'sideways_time_stop': 63, 'sideways_use_sma': False, 'sideways_use_ema': False, 'sideways_use_atr': False, 'sideways_use_adx': True, 'sideways_use_spike': False, 'sideways_rsi_required': False}.
[I 2025-08-30 20:55:37,399] Trial 64 finished with values: [-0.036882065104189454, 0.036810631814745136] and parameters: {'p_sma': 9, 'p_std': 19, 'p_atr': 27, 'p_adx': 9, 'rsi_period': 26, 'ema1': 12, 'ema2': 48, 'slip_atr_k': 0.17700772218343847, 'slip_spread_k': 0.47721447700397535, 'spread_hl_frac': 0.01908229274222281, 'bb_std_mult': 3.2049926577584023, 'rsi_os': 29, 'rsi_ob': 92, 'vol_spike': 0.22677011823916457, 'adx_thresh': 28.36333297811077, 'atr_min_pct': 0.00994045308784983, 'atr_max_pct': 0.051379844562139364, 'tp_mult': 2.442588930354691, 'tsl_mult': 0.6486267170736023, 'strategy': 'mean_reversion', 'time_stop': 64, 'use_sma': False, 'use_atr': True, 'use_adx': True, 'use_ema': False, 'use_spike': True, 'rsi_required': True, 'edge_k': 0.8576067456563341, 'edge_cap': 0.825197795240426, 'bull_strategy': 'breakout', 'bull_bb_std_mult': 1.304592839495297, 'bull_rsi_os': 32, 'bull_rsi_ob': 75, 'bull_adx_thresh': 29.11375782557557, 'bull_atr_min_pct': 0.0010909361451803654, 'bull_atr_max_pct': 0.02928349850784208, 'bull_tp_mult': 2.046817716774259, 'bull_tsl_mult': 0.2563404970868727, 'bull_time_stop': 188, 'bull_use_sma': True, 'bull_use_ema': True, 'bull_use_atr': False, 'bull_use_adx': True, 'bull_use_spike': False, 'bull_rsi_required': True, 'bear_strategy': 'breakout', 'bear_bb_std_mult': 0.7720491805228118, 'bear_rsi_os': 36, 'bear_rsi_ob': 61, 'bear_adx_thresh': 24.3133599129944, 'bear_atr_min_pct': 0.0008078062527452235, 'bear_atr_max_pct': 0.04716775649101626, 'bear_tp_mult': 2.0533619677564583, 'bear_tsl_mult': 0.9073966060848166, 'bear_time_stop': 48, 'bear_use_sma': True, 'bear_use_ema': False, 'bear_use_atr': False, 'bear_use_adx': False, 'bear_use_spike': True, 'bear_rsi_required': True, 'sideways_strategy': 'breakout', 'sideways_bb_std_mult': 3.263411387882103, 'sideways_rsi_os': 53, 'sideways_rsi_ob': 70, 'sideways_adx_thresh': 26.819838648578067, 'sideways_atr_min_pct': 0.013011143301717917, 'sideways_atr_max_pct': 0.08059228134912337, 'sideways_tp_mult': 2.354485104494935, 'sideways_tsl_mult': 0.9464273290818075, 'sideways_time_stop': 17, 'sideways_use_sma': False, 'sideways_use_ema': False, 'sideways_use_atr': True, 'sideways_use_adx': True, 'sideways_use_spike': False, 'sideways_rsi_required': False}.
[I 2025-08-30 20:55:37,435] Trial 66 finished with values: [-0.02702081559900993, 0.026942509462538358] and parameters: {'p_sma': 42, 'p_std': 9, 'p_atr': 27, 'p_adx': 9, 'rsi_period': 27, 'ema1': 12, 'ema2': 39, 'slip_atr_k': 0.17924754487248787, 'slip_spread_k': 0.5771510116651654, 'spread_hl_frac': 0.00917642681204358, 'bb_std_mult': 3.196206660082607, 'rsi_os': 34, 'rsi_ob': 91, 'vol_spike': 0.22004292026984246, 'adx_thresh': 24.80032327126886, 'atr_min_pct': 0.018571261156179106, 'atr_max_pct': 0.05182141820481146, 'tp_mult': 1.8976024938958467, 'tsl_mult': 0.6625636462292159, 'strategy': 'mean_reversion', 'time_stop': 29, 'use_sma': True, 'use_atr': True, 'use_adx': True, 'use_ema': False, 'use_spike': True, 'rsi_required': True, 'edge_k': 0.768039659648388, 'edge_cap': 0.9553544124223101, 'bull_strategy': 'breakout', 'bull_bb_std_mult': 1.740225049973515, 'bull_rsi_os': 33, 'bull_rsi_ob': 60, 'bull_adx_thresh': 19.83107271206667, 'bull_atr_min_pct': 0.0013004146426847485, 'bull_atr_max_pct': 0.0691413772940574, 'bull_tp_mult': 2.3022445693944, 'bull_tsl_mult': 0.13615200528033633, 'bull_time_stop': 189, 'bull_use_sma': True, 'bull_use_ema': False, 'bull_use_atr': False, 'bull_use_adx': False, 'bull_use_spike': False, 'bull_rsi_required': True, 'bear_strategy': 'breakout', 'bear_bb_std_mult': 0.5817402535015653, 'bear_rsi_os': 36, 'bear_rsi_ob': 57, 'bear_adx_thresh': 24.90058884383689, 'bear_atr_min_pct': 0.006567719471309734, 'bear_atr_max_pct': 0.14207883891669246, 'bear_tp_mult': 2.225300973266479, 'bear_tsl_mult': 0.05665705669926661, 'bear_time_stop': 94, 'bear_use_sma': True, 'bear_use_ema': False, 'bear_use_atr': False, 'bear_use_adx': False, 'bear_use_spike': True, 'bear_rsi_required': True, 'sideways_strategy': 'mean_reversion', 'sideways_bb_std_mult': 3.1937620691119246, 'sideways_rsi_os': 52, 'sideways_rsi_ob': 59, 'sideways_adx_thresh': 28.944999929061805, 'sideways_atr_min_pct': 0.013810829941631908, 'sideways_atr_max_pct': 0.0645244256826997, 'sideways_tp_mult': 2.9763153184710807, 'sideways_tsl_mult': 0.4803045949354045, 'sideways_time_stop': 65, 'sideways_use_sma': False, 'sideways_use_ema': False, 'sideways_use_atr': False, 'sideways_use_adx': True, 'sideways_use_spike': False, 'sideways_rsi_required': False}.
[I 2025-08-30 20:55:37,650] Trial 67 finished with values: [-0.01972643910466032, 0.01964667900536823] and parameters: {'p_sma': 51, 'p_std': 29, 'p_atr': 27, 'p_adx': 14, 'rsi_period': 10, 'ema1': 12, 'ema2': 44, 'slip_atr_k': 0.1785208843930848, 'slip_spread_k': 0.5670371418998545, 'spread_hl_frac': 0.008809430855432229, 'bb_std_mult': 2.9295993630634443, 'rsi_os': 17, 'rsi_ob': 91, 'vol_spike': 0.2243340725656005, 'adx_thresh': 30.698094598674782, 'atr_min_pct': 0.014251375988956372, 'atr_max_pct': 0.07036603784576338, 'tp_mult': 1.951113397769151, 'tsl_mult': 0.1817764274617965, 'strategy': 'mean_reversion', 'time_stop': 30, 'use_sma': True, 'use_atr': True, 'use_adx': True, 'use_ema': False, 'use_spike': True, 'rsi_required': True, 'edge_k': 0.7855740893198832, 'edge_cap': 0.9434180882493255, 'bull_strategy': 'breakout', 'bull_bb_std_mult': 1.696434899011996, 'bull_rsi_os': 33, 'bull_rsi_ob': 60, 'bull_adx_thresh': 19.50548471885959, 'bull_atr_min_pct': 0.0008360506168314588, 'bull_atr_max_pct': 0.03172927245993837, 'bull_tp_mult': 1.4818388894241905, 'bull_tsl_mult': 0.23903516936577124, 'bull_time_stop': 185, 'bull_use_sma': True, 'bull_use_ema': False, 'bull_use_atr': False, 'bull_use_adx': True, 'bull_use_spike': False, 'bull_rsi_required': True, 'bear_strategy': 'breakout', 'bear_bb_std_mult': 0.7985291895620288, 'bear_rsi_os': 36, 'bear_rsi_ob': 45, 'bear_adx_thresh': 23.95756200601844, 'bear_atr_min_pct': 0.009052429679312598, 'bear_atr_max_pct': 0.14549418461927954, 'bear_tp_mult': 2.0456089454597466, 'bear_tsl_mult': 0.11768474605057552, 'bear_time_stop': 268, 'bear_use_sma': True, 'bear_use_ema': False, 'bear_use_atr': False, 'bear_use_adx': False, 'bear_use_spike': True, 'bear_rsi_required': True, 'sideways_strategy': 'mean_reversion', 'sideways_bb_std_mult': 3.337857934666759, 'sideways_rsi_os': 13, 'sideways_rsi_ob': 52, 'sideways_adx_thresh': 10.407263254892104, 'sideways_atr_min_pct': 0.02348145611535299, 'sideways_atr_max_pct': 0.0652750398233422, 'sideways_tp_mult': 2.9831006101850797, 'sideways_tsl_mult': 0.48559329025490033, 'sideways_time_stop': 16, 'sideways_use_sma': False, 'sideways_use_ema': False, 'sideways_use_atr': False, 'sideways_use_adx': True, 'sideways_use_spike': False, 'sideways_rsi_required': False}.
[I 2025-08-30 20:55:38,183] Trial 68 finished with values: [-0.0228669421242379, 0.02279940725747998] and parameters: {'p_sma': 42, 'p_std': 30, 'p_atr': 26, 'p_adx': 12, 'rsi_period': 26, 'ema1': 24, 'ema2': 40, 'slip_atr_k': 0.14488111427916958, 'slip_spread_k': 0.8435651373269648, 'spread_hl_frac': 0.008865440133505074, 'bb_std_mult': 3.221504420150994, 'rsi_os': 11, 'rsi_ob': 90, 'vol_spike': 0.1456439519206125, 'adx_thresh': 28.81772617453318, 'atr_min_pct': 0.010318782279194166, 'atr_max_pct': 0.08213365451649542, 'tp_mult': 1.727615394320769, 'tsl_mult': 0.4158966145314175, 'strategy': 'mean_reversion', 'time_stop': 46, 'use_sma': False, 'use_atr': True, 'use_adx': True, 'use_ema': False, 'use_spike': True, 'rsi_required': True, 'edge_k': 0.76046546877499, 'edge_cap': 0.9443290163156319, 'bull_strategy': 'breakout', 'bull_bb_std_mult': 0.6603583695923982, 'bull_rsi_os': 33, 'bull_rsi_ob': 55, 'bull_adx_thresh': 15.112492510452501, 'bull_atr_min_pct': 0.0008557397176365085, 'bull_atr_max_pct': 0.031584482250720636, 'bull_tp_mult': 2.6291873022177437, 'bull_tsl_mult': 0.2436829543530028, 'bull_time_stop': 210, 'bull_use_sma': False, 'bull_use_ema': False, 'bull_use_atr': False, 'bull_use_adx': True, 'bull_use_spike': False, 'bull_rsi_required': True, 'bear_strategy': 'mean_reversion', 'bear_bb_std_mult': 0.5891500691704366, 'bear_rsi_os': 39, 'bear_rsi_ob': 71, 'bear_adx_thresh': 24.049838760440803, 'bear_atr_min_pct': 0.008959598382692398, 'bear_atr_max_pct': 0.1401284096435529, 'bear_tp_mult': 2.225335904402768, 'bear_tsl_mult': 0.12590168477081135, 'bear_time_stop': 7, 'bear_use_sma': True, 'bear_use_ema': False, 'bear_use_atr': False, 'bear_use_adx': False, 'bear_use_spike': True, 'bear_rsi_required': True, 'sideways_strategy': 'mean_reversion', 'sideways_bb_std_mult': 3.192860136879848, 'sideways_rsi_os': 12, 'sideways_rsi_ob': 59, 'sideways_adx_thresh': 28.94184591329457, 'sideways_atr_min_pct': 0.023735585548086656, 'sideways_atr_max_pct': 0.06733045446227778, 'sideways_tp_mult': 2.364834476022189, 'sideways_tsl_mult': 0.48445717755651313, 'sideways_time_stop': 15, 'sideways_use_sma': False, 'sideways_use_ema': False, 'sideways_use_atr': False, 'sideways_use_adx': False, 'sideways_use_spike': False, 'sideways_rsi_required': False}.
[I 2025-08-30 20:56:12,899] Trial 72 finished with values: [-0.017528366567987952, 0.017467776808965708] and parameters: {'p_sma': 42, 'p_std': 30, 'p_atr': 25, 'p_adx': 19, 'rsi_period': 11, 'ema1': 7, 'ema2': 40, 'slip_atr_k': 0.015942323696429297, 'slip_spread_k': 0.7003542781964662, 'spread_hl_frac': 0.008958821494205804, 'bb_std_mult': 3.2060120416335227, 'rsi_os': 17, 'rsi_ob': 86, 'vol_spike': 0.0018690108696565802, 'adx_thresh': 24.760569584855652, 'atr_min_pct': 0.014668907036174659, 'atr_max_pct': 0.05632393140802972, 'tp_mult': 1.7303175772436776, 'tsl_mult': 0.17314646569381958, 'strategy': 'mean_reversion', 'time_stop': 48, 'use_sma': False, 'use_atr': True, 'use_adx': True, 'use_ema': False, 'use_spike': True, 'rsi_required': True, 'edge_k': 0.7706119223574895, 'edge_cap': 0.3787907210207179, 'bull_strategy': 'breakout', 'bull_bb_std_mult': 1.8394909527197325, 'bull_rsi_os': 32, 'bull_rsi_ob': 80, 'bull_adx_thresh': 8.058048818764329, 'bull_atr_min_pct': 0.0012141315162351055, 'bull_atr_max_pct': 0.04306225177478276, 'bull_tp_mult': 2.550706042552836, 'bull_tsl_mult': 0.6733318175242585, 'bull_time_stop': 152, 'bull_use_sma': True, 'bull_use_ema': False, 'bull_use_atr': False, 'bull_use_adx': True, 'bull_use_spike': False, 'bull_rsi_required': True, 'bear_strategy': 'mean_reversion', 'bear_bb_std_mult': 2.6709071720674604, 'bear_rsi_os': 39, 'bear_rsi_ob': 45, 'bear_adx_thresh': 23.917710612466827, 'bear_atr_min_pct': 0.02132564806822596, 'bear_atr_max_pct': 0.14362663922830593, 'bear_tp_mult': 2.2311856519712157, 'bear_tsl_mult': 0.79249188745279, 'bear_time_stop': 49, 'bear_use_sma': True, 'bear_use_ema': False, 'bear_use_atr': False, 'bear_use_adx': False, 'bear_use_spike': True, 'bear_rsi_required': True, 'sideways_strategy': 'breakout', 'sideways_bb_std_mult': 3.334943256161462, 'sideways_rsi_os': 35, 'sideways_rsi_ob': 58, 'sideways_adx_thresh': 28.819368364149746, 'sideways_atr_min_pct': 0.012874345107448915, 'sideways_atr_max_pct': 0.03839748806028564, 'sideways_tp_mult': 2.342715602045088, 'sideways_tsl_mult': 0.4866100251522464, 'sideways_time_stop': 16, 'sideways_use_sma': False, 'sideways_use_ema': False, 'sideways_use_atr': True, 'sideways_use_adx': False, 'sideways_use_spike': False, 'sideways_rsi_required': False}.
[I 2025-08-30 20:56:13,040] Trial 69 finished with values: [-1000000000.0, 1000000000.0] and parameters: {'p_sma': 42, 'p_std': 10, 'p_atr': 26, 'p_adx': 13, 'rsi_period': 26, 'ema1': 6, 'ema2': 39, 'slip_atr_k': 0.016670388247018678, 'slip_spread_k': 0.8396614731827983, 'spread_hl_frac': 0.009029838680108811, 'bb_std_mult': 3.209619980610303, 'rsi_os': 11, 'rsi_ob': 92, 'vol_spike': 0.09174928099885557, 'adx_thresh': 34.96070756831764, 'atr_min_pct': 0.014544617150437722, 'atr_max_pct': 0.05665545071165124, 'tp_mult': 2.214656085763158, 'tsl_mult': 0.16864152789570175, 'strategy': 'mean_reversion', 'time_stop': 49, 'use_sma': False, 'use_atr': True, 'use_adx': True, 'use_ema': False, 'use_spike': True, 'rsi_required': True, 'edge_k': 0.7814830794443531, 'edge_cap': 0.37832758605198435, 'bull_strategy': 'breakout', 'bull_bb_std_mult': 1.8766842562758919, 'bull_rsi_os': 17, 'bull_rsi_ob': 60, 'bull_adx_thresh': 32.21030820213149, 'bull_atr_min_pct': 0.0024424717399448787, 'bull_atr_max_pct': 0.028244532974376076, 'bull_tp_mult': 2.1098817625062876, 'bull_tsl_mult': 0.24340903411019676, 'bull_time_stop': 153, 'bull_use_sma': False, 'bull_use_ema': False, 'bull_use_atr': False, 'bull_use_adx': True, 'bull_use_spike': False, 'bull_rsi_required': True, 'bear_strategy': 'mean_reversion', 'bear_bb_std_mult': 0.514928884552723, 'bear_rsi_os': 39, 'bear_rsi_ob': 45, 'bear_adx_thresh': 22.074485830575373, 'bear_atr_min_pct': 0.009516655349077646, 'bear_atr_max_pct': 0.14121530821148454, 'bear_tp_mult': 2.236779032533446, 'bear_tsl_mult': 0.11501344994677179, 'bear_time_stop': 52, 'bear_use_sma': True, 'bear_use_ema': False, 'bear_use_atr': False, 'bear_use_adx': False, 'bear_use_spike': True, 'bear_rsi_required': True, 'sideways_strategy': 'mean_reversion', 'sideways_bb_std_mult': 3.2052748027512865, 'sideways_rsi_os': 52, 'sideways_rsi_ob': 58, 'sideways_adx_thresh': 28.721487971324283, 'sideways_atr_min_pct': 0.025692800873902792, 'sideways_atr_max_pct': 0.06513999214831497, 'sideways_tp_mult': 2.378026837801783, 'sideways_tsl_mult': 0.34563415845055323, 'sideways_time_stop': 259, 'sideways_use_sma': False, 'sideways_use_ema': False, 'sideways_use_atr': False, 'sideways_use_adx': False, 'sideways_use_spike': False, 'sideways_rsi_required': False}.
[I 2025-08-30 20:56:13,228] Trial 70 finished with values: [-0.019747571125665275, 0.019671233996077023] and parameters: {'p_sma': 52, 'p_std': 30, 'p_atr': 26, 'p_adx': 13, 'rsi_period': 60, 'ema1': 29, 'ema2': 40, 'slip_atr_k': 0.12748720389837703, 'slip_spread_k': 0.8413359136727709, 'spread_hl_frac': 0.008294595459333597, 'bb_std_mult': 3.2239971725818903, 'rsi_os': 17, 'rsi_ob': 61, 'vol_spike': 0.09365216412351124, 'adx_thresh': 34.79344994236986, 'atr_min_pct': 0.014473977132629297, 'atr_max_pct': 0.05786145867377115, 'tp_mult': 2.1488229203441316, 'tsl_mult': 0.41082982018757735, 'strategy': 'mean_reversion', 'time_stop': 48, 'use_sma': False, 'use_atr': True, 'use_adx': True, 'use_ema': False, 'use_spike': True, 'rsi_required': True, 'edge_k': 0.7600922420375059, 'edge_cap': 0.9371876035623454, 'bull_strategy': 'breakout', 'bull_bb_std_mult': 1.8854594073756308, 'bull_rsi_os': 49, 'bull_rsi_ob': 59, 'bull_adx_thresh': 15.293673240754732, 'bull_atr_min_pct': 0.001081747571421042, 'bull_atr_max_pct': 0.02868596142687245, 'bull_tp_mult': 2.1082288958650937, 'bull_tsl_mult': 0.24325992570278981, 'bull_time_stop': 208, 'bull_use_sma': False, 'bull_use_ema': False, 'bull_use_atr': False, 'bull_use_adx': True, 'bull_use_spike': False, 'bull_rsi_required': True, 'bear_strategy': 'mean_reversion', 'bear_bb_std_mult': 2.649392592086678, 'bear_rsi_os': 39, 'bear_rsi_ob': 71, 'bear_adx_thresh': 22.155027566910398, 'bear_atr_min_pct': 0.008760070754130458, 'bear_atr_max_pct': 0.05677813153070346, 'bear_tp_mult': 2.2603691946526694, 'bear_tsl_mult': 0.7795635631475522, 'bear_time_stop': 52, 'bear_use_sma': True, 'bear_use_ema': False, 'bear_use_atr': False, 'bear_use_adx': False, 'bear_use_spike': True, 'bear_rsi_required': True, 'sideways_strategy': 'mean_reversion', 'sideways_bb_std_mult': 3.208699637505267, 'sideways_rsi_os': 52, 'sideways_rsi_ob': 59, 'sideways_adx_thresh': 26.927500950533513, 'sideways_atr_min_pct': 0.023288201108630495, 'sideways_atr_max_pct': 0.06695522419245817, 'sideways_tp_mult': 2.3731271048616653, 'sideways_tsl_mult': 0.48469941241180026, 'sideways_time_stop': 266, 'sideways_use_sma': False, 'sideways_use_ema': False, 'sideways_use_atr': False, 'sideways_use_adx': False, 'sideways_use_spike': False, 'sideways_rsi_required': False}.
