[I 2025-08-30 22:09:07,594] Trial 666 finished with values: [-1000000000.0, 1000000000.0] and parameters: {'p_sma': 32, 'p_std': 38, 'p_atr': 20, 'p_adx': 17, 'rsi_period': 64, 'ema1': 10, 'ema2': 54, 'slip_atr_k': 0.21055911521824724, 'slip_spread_k': 0.6990869425732809, 'spread_hl_frac': 0.03317329902576543, 'bb_std_mult': 3.3260676219352128, 'rsi_os': 13, 'rsi_ob': 67, 'vol_spike': 0.28775889290754003, 'adx_thresh': 12.470682288096562, 'atr_min_pct': 0.013555991343271288, 'atr_max_pct': 0.11289091649091693, 'tp_mult': 2.219272972861977, 'tsl_mult': 0.9078061267937984, 'strategy': 'mean_reversion', 'time_stop': 93, 'use_sma': True, 'use_atr': True, 'use_adx': False, 'use_ema': False, 'use_spike': False, 'rsi_required': True, 'edge_k': 1.0680841577775122, 'edge_cap': 0.7902641674219495, 'bull_strategy': 'mean_reversion', 'bull_bb_std_mult': 1.7188732220929304, 'bull_rsi_os': 20, 'bull_rsi_ob': 85, 'bull_adx_thresh': 27.944896320562453, 'bull_atr_min_pct': 0.0021232701836396035, 'bull_atr_max_pct': 0.140897672476965, 'bull_tp_mult': 1.3173292016108449, 'bull_tsl_mult': 0.4425618053081803, 'bull_time_stop': 123, 'bull_use_sma': False, 'bull_use_ema': True, 'bull_use_atr': False, 'bull_use_adx': False, 'bull_use_spike': True, 'bull_rsi_required': False, 'bear_strategy': 'mean_reversion', 'bear_bb_std_mult': 0.9215722649673661, 'bear_rsi_os': 11, 'bear_rsi_ob': 75, 'bear_adx_thresh': 28.69551555794164, 'bear_atr_min_pct': 0.02940452732064327, 'bear_atr_max_pct': 0.13593904075901536, 'bear_tp_mult': 1.5241498879908206, 'bear_tsl_mult': 0.15912598048901044, 'bear_time_stop': 223, 'bear_use_sma': True, 'bear_use_ema': True, 'bear_use_atr': False, 'bear_use_adx': True, 'bear_use_spike': True, 'bear_rsi_required': False, 'sideways_strategy': 'breakout', 'sideways_bb_std_mult': 1.6434956964554321, 'sideways_rsi_os': 52, 'sideways_rsi_ob': 91, 'sideways_adx_thresh': 21.261867241685678, 'sideways_atr_min_pct': 0.022249053968173005, 'sideways_atr_max_pct': 0.04112439555277018, 'sideways_tp_mult': 1.153850076579292, 'sideways_tsl_mult': 0.7820686303083106, 'sideways_time_stop': 255, 'sideways_use_sma': True, 'sideways_use_ema': True, 'sideways_use_atr': False, 'sideways_use_adx': True, 'sideways_use_spike': True, 'sideways_rsi_required': True}.
[I 2025-08-30 22:09:08,581] Trial 667 finished with values: [-1000000000.0, 1000000000.0] and parameters: {'p_sma': 19, 'p_std': 38, 'p_atr': 10, 'p_adx': 21, 'rsi_period': 68, 'ema1': 11, 'ema2': 24, 'slip_atr_k': 0.02374972084462323, 'slip_spread_k': 0.5911819053271039, 'spread_hl_frac': 0.01710813215216293, 'bb_std_mult': 0.8708899252392476, 'rsi_os': 11, 'rsi_ob': 67, 'vol_spike': 0.17851974912325658, 'adx_thresh': 8.97883025311786, 'atr_min_pct': 0.013482970435470438, 'atr_max_pct': 0.11413257997196552, 'tp_mult': 2.414619419589645, 'tsl_mult': 0.9105807556504182, 'strategy': 'breakout', 'time_stop': 56, 'use_sma': True, 'use_atr': True, 'use_adx': False, 'use_ema': False, 'use_spike': False, 'rsi_required': False, 'edge_k': 0.5002634982593361, 'edge_cap': 0.8736474105348708, 'bull_strategy': 'mean_reversion', 'bull_bb_std_mult': 1.3751906967788594, 'bull_rsi_os': 55, 'bull_rsi_ob': 85, 'bull_adx_thresh': 34.512877762409424, 'bull_atr_min_pct': 0.0019881534054645555, 'bull_atr_max_pct': 0.05301531085925251, 'bull_tp_mult': 1.3253376466318885, 'bull_tsl_mult': 0.4018641904198673, 'bull_time_stop': 73, 'bull_use_sma': False, 'bull_use_ema': True, 'bull_use_atr': True, 'bull_use_adx': False, 'bull_use_spike': True, 'bull_rsi_required': False, 'bear_strategy': 'mean_reversion', 'bear_bb_std_mult': 1.9528106055221834, 'bear_rsi_os': 11, 'bear_rsi_ob': 57, 'bear_adx_thresh': 28.56127819568961, 'bear_atr_min_pct': 0.028989893337174576, 'bear_atr_max_pct': 0.13449207764479865, 'bear_tp_mult': 1.4953897722712894, 'bear_tsl_mult': 0.1272037202037251, 'bear_time_stop': 51, 'bear_use_sma': True, 'bear_use_ema': True, 'bear_use_atr': True, 'bear_use_adx': True, 'bear_use_spike': True, 'bear_rsi_required': False, 'sideways_strategy': 'breakout', 'sideways_bb_std_mult': 0.501094889324539, 'sideways_rsi_os': 16, 'sideways_rsi_ob': 91, 'sideways_adx_thresh': 27.782127453759287, 'sideways_atr_min_pct': 0.022201935395933254, 'sideways_atr_max_pct': 0.10700709197481957, 'sideways_tp_mult': 1.0215208894793053, 'sideways_tsl_mult': 0.8162778791777284, 'sideways_time_stop': 256, 'sideways_use_sma': True, 'sideways_use_ema': True, 'sideways_use_atr': False, 'sideways_use_adx': True, 'sideways_use_spike': True, 'sideways_rsi_required': True}.
[I 2025-08-30 22:09:39,786] Trial 668 finished with values: [-1000000000.0, 1000000000.0] and parameters: {'p_sma': 52, 'p_std': 18, 'p_atr': 20, 'p_adx': 11, 'rsi_period': 70, 'ema1': 10, 'ema2': 21, 'slip_atr_k': 0.024858710506731038, 'slip_spread_k': 0.9343898435850586, 'spread_hl_frac': 0.014018182239655196, 'bb_std_mult': 0.8874681054447893, 'rsi_os': 13, 'rsi_ob': 67, 'vol_spike': 0.2787408156638402, 'adx_thresh': 10.822309771477379, 'atr_min_pct': 0.013633412779197357, 'atr_max_pct': 0.021630389362623965, 'tp_mult': 1.6772734352645537, 'tsl_mult': 0.8412690524278443, 'strategy': 'breakout', 'time_stop': 84, 'use_sma': False, 'use_atr': True, 'use_adx': True, 'use_ema': False, 'use_spike': True, 'rsi_required': False, 'edge_k': 1.2456268756938818, 'edge_cap': 0.871397662772095, 'bull_strategy': 'mean_reversion', 'bull_bb_std_mult': 1.6742108307824664, 'bull_rsi_os': 55, 'bull_rsi_ob': 88, 'bull_adx_thresh': 32.53380192581761, 'bull_atr_min_pct': 0.0020004940695672623, 'bull_atr_max_pct': 0.05253146322281935, 'bull_tp_mult': 1.3140745333126724, 'bull_tsl_mult': 0.4465256578960461, 'bull_time_stop': 300, 'bull_use_sma': False, 'bull_use_ema': True, 'bull_use_atr': True, 'bull_use_adx': False, 'bull_use_spike': True, 'bull_rsi_required': False, 'bear_strategy': 'mean_reversion', 'bear_bb_std_mult': 1.9809737233600626, 'bear_rsi_os': 8, 'bear_rsi_ob': 56, 'bear_adx_thresh': 28.351473410055256, 'bear_atr_min_pct': 0.02833493822315053, 'bear_atr_max_pct': 0.1186172213981232, 'bear_tp_mult': 1.1567421711073274, 'bear_tsl_mult': 0.26610052914488186, 'bear_time_stop': 47, 'bear_use_sma': True, 'bear_use_ema': False, 'bear_use_atr': True, 'bear_use_adx': True, 'bear_use_spike': True, 'bear_rsi_required': False, 'sideways_strategy': 'breakout', 'sideways_bb_std_mult': 1.6090392678135548, 'sideways_rsi_os': 37, 'sideways_rsi_ob': 87, 'sideways_adx_thresh': 12.685279866641107, 'sideways_atr_min_pct': 0.022028453144790287, 'sideways_atr_max_pct': 0.04121198057544886, 'sideways_tp_mult': 1.2691788553116279, 'sideways_tsl_mult': 0.8386125038127349, 'sideways_time_stop': 118, 'sideways_use_sma': False, 'sideways_use_ema': True, 'sideways_use_atr': False, 'sideways_use_adx': True, 'sideways_use_spike': False, 'sideways_rsi_required': True}.
[I 2025-08-30 22:09:40,653] Trial 669 finished with values: [-1000000000.0, 1000000000.0] and parameters: {'p_sma': 32, 'p_std': 33, 'p_atr': 27, 'p_adx': 21, 'rsi_period': 30, 'ema1': 10, 'ema2': 21, 'slip_atr_k': 0.025670014885829623, 'slip_spread_k': 0.648573311169044, 'spread_hl_frac': 0.021922550111819625, 'bb_std_mult': 3.420494329082703, 'rsi_os': 13, 'rsi_ob': 67, 'vol_spike': 0.10662023492422176, 'adx_thresh': 9.108678096013344, 'atr_min_pct': 0.013575770172446778, 'atr_max_pct': 0.020958019351368175, 'tp_mult': 1.6989740842081913, 'tsl_mult': 0.8413717363853047, 'strategy': 'breakout', 'time_stop': 84, 'use_sma': False, 'use_atr': True, 'use_adx': True, 'use_ema': False, 'use_spike': True, 'rsi_required': False, 'edge_k': 0.5338869227656162, 'edge_cap': 0.7939893480947207, 'bull_strategy': 'mean_reversion', 'bull_bb_std_mult': 0.5293923566493663, 'bull_rsi_os': 16, 'bull_rsi_ob': 88, 'bull_adx_thresh': 21.27167012203376, 'bull_atr_min_pct': 0.0020553431198942224, 'bull_atr_max_pct': 0.05321488609044521, 'bull_tp_mult': 1.3198114879304412, 'bull_tsl_mult': 0.44904640784182864, 'bull_time_stop': 294, 'bull_use_sma': False, 'bull_use_ema': True, 'bull_use_atr': True, 'bull_use_adx': False, 'bull_use_spike': True, 'bull_rsi_required': True, 'bear_strategy': 'mean_reversion', 'bear_bb_std_mult': 1.9945711321429322, 'bear_rsi_os': 8, 'bear_rsi_ob': 59, 'bear_adx_thresh': 28.508361168782734, 'bear_atr_min_pct': 0.028484597897082735, 'bear_atr_max_pct': 0.11810467066442992, 'bear_tp_mult': 1.5001021386745754, 'bear_tsl_mult': 0.4292544594270494, 'bear_time_stop': 241, 'bear_use_sma': False, 'bear_use_ema': False, 'bear_use_atr': True, 'bear_use_adx': True, 'bear_use_spike': True, 'bear_rsi_required': True, 'sideways_strategy': 'breakout', 'sideways_bb_std_mult': 1.608086944859625, 'sideways_rsi_os': 49, 'sideways_rsi_ob': 87, 'sideways_adx_thresh': 27.75069723563576, 'sideways_atr_min_pct': 0.025737430259090057, 'sideways_atr_max_pct': 0.04113106383233343, 'sideways_tp_mult': 2.493187624950241, 'sideways_tsl_mult': 0.8100343084051199, 'sideways_time_stop': 256, 'sideways_use_sma': False, 'sideways_use_ema': True, 'sideways_use_atr': False, 'sideways_use_adx': True, 'sideways_use_spike': False, 'sideways_rsi_required': True}.
[I 2025-08-30 22:09:42,127] Trial 671 finished with values: [-1000000000.0, 1000000000.0] and parameters: {'p_sma': 53, 'p_std': 33, 'p_atr': 24, 'p_adx': 20, 'rsi_period': 30, 'ema1': 7, 'ema2': 35, 'slip_atr_k': 0.23315466743873473, 'slip_spread_k': 0.646102348061573, 'spread_hl_frac': 0.029920726780158217, 'bb_std_mult': 0.8188102154098411, 'rsi_os': 15, 'rsi_ob': 64, 'vol_spike': 0.10729220326931077, 'adx_thresh': 26.6144651640197, 'atr_min_pct': 0.015807832844059136, 'atr_max_pct': 0.02229431222911287, 'tp_mult': 1.707421889744719, 'tsl_mult': 0.6857528969861382, 'strategy': 'breakout', 'time_stop': 85, 'use_sma': False, 'use_atr': True, 'use_adx': True, 'use_ema': True, 'use_spike': True, 'rsi_required': False, 'edge_k': 1.1407648174498486, 'edge_cap': 0.4510012997837884, 'bull_strategy': 'breakout', 'bull_bb_std_mult': 0.8828084348600613, 'bull_rsi_os': 39, 'bull_rsi_ob': 89, 'bull_adx_thresh': 12.680379086732362, 'bull_atr_min_pct': 0.0014124585031564914, 'bull_atr_max_pct': 0.05525646179887922, 'bull_tp_mult': 1.5147706120721085, 'bull_tsl_mult': 0.3327790993599733, 'bull_time_stop': 288, 'bull_use_sma': True, 'bull_use_ema': False, 'bull_use_atr': True, 'bull_use_adx': False, 'bull_use_spike': False, 'bull_rsi_required': True, 'bear_strategy': 'breakout', 'bear_bb_std_mult': 0.5902358450897824, 'bear_rsi_os': 8, 'bear_rsi_ob': 87, 'bear_adx_thresh': 11.32933001417617, 'bear_atr_min_pct': 0.028348643156101982, 'bear_atr_max_pct': 0.11855202544589594, 'bear_tp_mult': 1.148804007194745, 'bear_tsl_mult': 0.4434868935619073, 'bear_time_stop': 238, 'bear_use_sma': False, 'bear_use_ema': False, 'bear_use_atr': True, 'bear_use_adx': True, 'bear_use_spike': True, 'bear_rsi_required': True, 'sideways_strategy': 'breakout', 'sideways_bb_std_mult': 1.8085425541007494, 'sideways_rsi_os': 37, 'sideways_rsi_ob': 86, 'sideways_adx_thresh': 17.397804089787424, 'sideways_atr_min_pct': 0.025688698430691895, 'sideways_atr_max_pct': 0.04320093044591018, 'sideways_tp_mult': 2.854051985706825, 'sideways_tsl_mult': 0.8395060331886766, 'sideways_time_stop': 116, 'sideways_use_sma': False, 'sideways_use_ema': False, 'sideways_use_atr': True, 'sideways_use_adx': True, 'sideways_use_spike': False, 'sideways_rsi_required': False}.
[I 2025-08-30 22:09:42,128] Trial 670 finished with values: [-0.04746578540294355, 0.04740516119464849] and parameters: {'p_sma': 53, 'p_std': 33, 'p_atr': 21, 'p_adx': 21, 'rsi_period': 71, 'ema1': 11, 'ema2': 24, 'slip_atr_k': 0.02538730216853148, 'slip_spread_k': 0.6481639828557753, 'spread_hl_frac': 0.029555516838859496, 'bb_std_mult': 2.0136843011879075, 'rsi_os': 12, 'rsi_ob': 64, 'vol_spike': 0.2791553569939528, 'adx_thresh': 10.66171319332933, 'atr_min_pct': 0.01735275241319196, 'atr_max_pct': 0.022165262925214143, 'tp_mult': 1.6917835039888658, 'tsl_mult': 0.8398690008192684, 'strategy': 'breakout', 'time_stop': 82, 'use_sma': False, 'use_atr': True, 'use_adx': True, 'use_ema': True, 'use_spike': True, 'rsi_required': False, 'edge_k': 1.1388333142389122, 'edge_cap': 0.181256013287367, 'bull_strategy': 'mean_reversion', 'bull_bb_std_mult': 0.8794798903167826, 'bull_rsi_os': 45, 'bull_rsi_ob': 88, 'bull_adx_thresh': 15.10089682547927, 'bull_atr_min_pct': 0.0019837250465181313, 'bull_atr_max_pct': 0.06313947727557268, 'bull_tp_mult': 2.902961430342774, 'bull_tsl_mult': 0.4009856546379448, 'bull_time_stop': 288, 'bull_use_sma': True, 'bull_use_ema': False, 'bull_use_atr': True, 'bull_use_adx': False, 'bull_use_spike': True, 'bull_rsi_required': True, 'bear_strategy': 'mean_reversion', 'bear_bb_std_mult': 1.7992018939986514, 'bear_rsi_os': 8, 'bear_rsi_ob': 48, 'bear_adx_thresh': 25.718821309477086, 'bear_atr_min_pct': 0.00043255291220688045, 'bear_atr_max_pct': 0.06658013856594036, 'bear_tp_mult': 1.0115072992648266, 'bear_tsl_mult': 0.6586841789185568, 'bear_time_stop': 288, 'bear_use_sma': False, 'bear_use_ema': False, 'bear_use_atr': True, 'bear_use_adx': True, 'bear_use_spike': True, 'bear_rsi_required': True, 'sideways_strategy': 'breakout', 'sideways_bb_std_mult': 1.738796503182943, 'sideways_rsi_os': 35, 'sideways_rsi_ob': 86, 'sideways_adx_thresh': 27.815106936394635, 'sideways_atr_min_pct': 0.020379251455829604, 'sideways_atr_max_pct': 0.04808260043255937, 'sideways_tp_mult': 2.5008309213444404, 'sideways_tsl_mult': 0.1610690786891279, 'sideways_time_stop': 257, 'sideways_use_sma': False, 'sideways_use_ema': True, 'sideways_use_atr': False, 'sideways_use_adx': True, 'sideways_use_spike': False, 'sideways_rsi_required': True}.
[I 2025-08-30 22:10:15,650] Trial 672 finished with values: [-1000000000.0, 1000000000.0] and parameters: {'p_sma': 35, 'p_std': 13, 'p_atr': 21, 'p_adx': 20, 'rsi_period': 30, 'ema1': 26, 'ema2': 52, 'slip_atr_k': 0.03208950532871058, 'slip_spread_k': 0.2807060892712381, 'spread_hl_frac': 0.029414620928549604, 'bb_std_mult': 0.6800853771379904, 'rsi_os': 47, 'rsi_ob': 64, 'vol_spike': 0.27855007013592925, 'adx_thresh': 26.541194136506828, 'atr_min_pct': 0.012658046117810203, 'atr_max_pct': 0.01813006310759746, 'tp_mult': 1.5623996168174998, 'tsl_mult': 0.8677986645301446, 'strategy': 'mean_reversion', 'time_stop': 86, 'use_sma': False, 'use_atr': True, 'use_adx': True, 'use_ema': True, 'use_spike': True, 'rsi_required': True, 'edge_k': 1.152043138690059, 'edge_cap': 0.05270292625466988, 'bull_strategy': 'breakout', 'bull_bb_std_mult': 0.9016585497124945, 'bull_rsi_os': 8, 'bull_rsi_ob': 88, 'bull_adx_thresh': 30.914227677511306, 'bull_atr_min_pct': 0.017199197435169903, 'bull_atr_max_pct': 0.05363962553821519, 'bull_tp_mult': 1.3674271130918352, 'bull_tsl_mult': 0.3492587137535212, 'bull_time_stop': 288, 'bull_use_sma': True, 'bull_use_ema': False, 'bull_use_atr': False, 'bull_use_adx': False, 'bull_use_spike': False, 'bull_rsi_required': True, 'bear_strategy': 'breakout', 'bear_bb_std_mult': 1.8193694147251427, 'bear_rsi_os': 6, 'bear_rsi_ob': 86, 'bear_adx_thresh': 25.890764613237398, 'bear_atr_min_pct': 0.021290182558647654, 'bear_atr_max_pct': 0.025782716968431242, 'bear_tp_mult': 2.7015286273493135, 'bear_tsl_mult': 0.6609894120435662, 'bear_time_stop': 28, 'bear_use_sma': False, 'bear_use_ema': False, 'bear_use_atr': False, 'bear_use_adx': False, 'bear_use_spike': True, 'bear_rsi_required': True, 'sideways_strategy': 'breakout', 'sideways_bb_std_mult': 3.051127165983452, 'sideways_rsi_os': 40, 'sideways_rsi_ob': 69, 'sideways_adx_thresh': 28.862331981611913, 'sideways_atr_min_pct': 0.007891751313327238, 'sideways_atr_max_pct': 0.047916365569739626, 'sideways_tp_mult': 2.4938155681899703, 'sideways_tsl_mult': 0.8068670549410696, 'sideways_time_stop': 259, 'sideways_use_sma': False, 'sideways_use_ema': False, 'sideways_use_atr': True, 'sideways_use_adx': True, 'sideways_use_spike': False, 'sideways_rsi_required': False}.
[I 2025-08-30 22:10:16,034] Trial 674 finished with values: [-1000000000.0, 1000000000.0] and parameters: {'p_sma': 35, 'p_std': 13, 'p_atr': 22, 'p_adx': 22, 'rsi_period': 75, 'ema1': 6, 'ema2': 52, 'slip_atr_k': 0.06441245379324066, 'slip_spread_k': 0.015234407728841715, 'spread_hl_frac': 0.02514458319032409, 'bb_std_mult': 3.0676513982519475, 'rsi_os': 47, 'rsi_ob': 68, 'vol_spike': 0.22526537804644187, 'adx_thresh': 11.359625523293587, 'atr_min_pct': 0.012383834253620217, 'atr_max_pct': 0.10910815213428296, 'tp_mult': 1.5476545505271482, 'tsl_mult': 0.6518730242554857, 'strategy': 'mean_reversion', 'time_stop': 100, 'use_sma': True, 'use_atr': False, 'use_adx': True, 'use_ema': True, 'use_spike': True, 'rsi_required': True, 'edge_k': 0.3608919652030741, 'edge_cap': 0.7235570110983454, 'bull_strategy': 'breakout', 'bull_bb_std_mult': 1.9969529626822178, 'bull_rsi_os': 8, 'bull_rsi_ob': 58, 'bull_adx_thresh': 16.100564105869637, 'bull_atr_min_pct': 0.01484824345814598, 'bull_atr_max_pct': 0.07325948667091153, 'bull_tp_mult': 1.6053072126653043, 'bull_tsl_mult': 0.06019380798474183, 'bull_time_stop': 294, 'bull_use_sma': True, 'bull_use_ema': False, 'bull_use_atr': False, 'bull_use_adx': False, 'bull_use_spike': False, 'bull_rsi_required': True, 'bear_strategy': 'breakout', 'bear_bb_std_mult': 2.063461451450689, 'bear_rsi_os': 6, 'bear_rsi_ob': 72, 'bear_adx_thresh': 7.269977849750763, 'bear_atr_min_pct': 0.003321619136975488, 'bear_atr_max_pct': 0.11487789206271332, 'bear_tp_mult': 1.6105847491932146, 'bear_tsl_mult': 0.5140932956758557, 'bear_time_stop': 238, 'bear_use_sma': False, 'bear_use_ema': True, 'bear_use_atr': False, 'bear_use_adx': False, 'bear_use_spike': False, 'bear_rsi_required': True, 'sideways_strategy': 'mean_reversion', 'sideways_bb_std_mult': 1.6673116618315234, 'sideways_rsi_os': 26, 'sideways_rsi_ob': 89, 'sideways_adx_thresh': 25.59755148577557, 'sideways_atr_min_pct': 0.020296081801678505, 'sideways_atr_max_pct': 0.037642045463415624, 'sideways_tp_mult': 1.7421046669582556, 'sideways_tsl_mult': 0.7609803085079508, 'sideways_time_stop': 270, 'sideways_use_sma': False, 'sideways_use_ema': False, 'sideways_use_atr': True, 'sideways_use_adx': False, 'sideways_use_spike': False, 'sideways_rsi_required': False}.
[I 2025-08-30 22:10:16,584] Trial 675 finished with values: [-1000000000.0, 1000000000.0] and parameters: {'p_sma': 35, 'p_std': 48, 'p_atr': 28, 'p_adx': 26, 'rsi_period': 75, 'ema1': 16, 'ema2': 52, 'slip_atr_k': 0.15458697176510872, 'slip_spread_k': 0.007214418522820787, 'spread_hl_frac': 0.03234396643509468, 'bb_std_mult': 0.6489815310981542, 'rsi_os': 8, 'rsi_ob': 73, 'vol_spike': 0.273426597944747, 'adx_thresh': 11.49025168775062, 'atr_min_pct': 0.012504807075157217, 'atr_max_pct': 0.017715748914872948, 'tp_mult': 2.289543815689138, 'tsl_mult': 0.8748605339116017, 'strategy': 'mean_reversion', 'time_stop': 99, 'use_sma': True, 'use_atr': False, 'use_adx': True, 'use_ema': True, 'use_spike': True, 'rsi_required': True, 'edge_k': 0.43799597191050366, 'edge_cap': 0.3236696482822778, 'bull_strategy': 'breakout', 'bull_bb_std_mult': 2.1034760311914917, 'bull_rsi_os': 8, 'bull_rsi_ob': 58, 'bull_adx_thresh': 16.061763732435637, 'bull_atr_min_pct': 0.020527863458623275, 'bull_atr_max_pct': 0.07307189461989869, 'bull_tp_mult': 1.6125592425082091, 'bull_tsl_mult': 0.8650049150420103, 'bull_time_stop': 93, 'bull_use_sma': True, 'bull_use_ema': False, 'bull_use_atr': False, 'bull_use_adx': False, 'bull_use_spike': False, 'bull_rsi_required': True, 'bear_strategy': 'breakout', 'bear_bb_std_mult': 2.329304602670581, 'bear_rsi_os': 6, 'bear_rsi_ob': 72, 'bear_adx_thresh': 27.689650443390093, 'bear_atr_min_pct': 0.02377278867413294, 'bear_atr_max_pct': 0.11479785209121623, 'bear_tp_mult': 2.7151859809708836, 'bear_tsl_mult': 0.3983459831228459, 'bear_time_stop': 162, 'bear_use_sma': False, 'bear_use_ema': True, 'bear_use_atr': False, 'bear_use_adx': False, 'bear_use_spike': False, 'bear_rsi_required': True, 'sideways_strategy': 'mean_reversion', 'sideways_bb_std_mult': 1.1447976280188743, 'sideways_rsi_os': 41, 'sideways_rsi_ob': 69, 'sideways_adx_thresh': 25.642976678113843, 'sideways_atr_min_pct': 0.019074775500685204, 'sideways_atr_max_pct': 0.03749918267559883, 'sideways_tp_mult': 1.7020957381023902, 'sideways_tsl_mult': 0.7329753834714368, 'sideways_time_stop': 159, 'sideways_use_sma': False, 'sideways_use_ema': False, 'sideways_use_atr': True, 'sideways_use_adx': False, 'sideways_use_spike': False, 'sideways_rsi_required': False}.
