[I 2025-08-30 22:05:21,342] Trial 630 finished with values: [-1000000000.0, 1000000000.0] and parameters: {'p_sma': 22, 'p_std': 17, 'p_atr': 27, 'p_adx': 13, 'rsi_period': 61, 'ema1': 11, 'ema2': 11, 'slip_atr_k': 0.02451297354003605, 'slip_spread_k': 0.430441284153466, 'spread_hl_frac': 0.030705300942471467, 'bb_std_mult': 0.934278528365765, 'rsi_os': 48, 'rsi_ob': 65, 'vol_spike': 0.2749222978148537, 'adx_thresh': 9.47581263836824, 'atr_min_pct': 0.012812789105872954, 'atr_max_pct': 0.018679323370552784, 'tp_mult': 1.0407430740366819, 'tsl_mult': 0.3088426144217429, 'strategy': 'mean_reversion', 'time_stop': 81, 'use_sma': True, 'use_atr': False, 'use_adx': True, 'use_ema': True, 'use_spike': True, 'rsi_required': True, 'edge_k': 0.8961793337437602, 'edge_cap': 0.8326028885907273, 'bull_strategy': 'mean_reversion', 'bull_bb_std_mult': 1.8791561625933824, 'bull_rsi_os': 17, 'bull_rsi_ob': 85, 'bull_adx_thresh': 13.33609397091871, 'bull_atr_min_pct': 0.0031193074132198624, 'bull_atr_max_pct': 0.12739638417536325, 'bull_tp_mult': 1.3629581464802014, 'bull_tsl_mult': 0.339933461964137, 'bull_time_stop': 300, 'bull_use_sma': True, 'bull_use_ema': False, 'bull_use_atr': False, 'bull_use_adx': False, 'bull_use_spike': False, 'bull_rsi_required': True, 'bear_strategy': 'breakout', 'bear_bb_std_mult': 3.1626476546177025, 'bear_rsi_os': 10, 'bear_rsi_ob': 75, 'bear_adx_thresh': 31.299795189800108, 'bear_atr_min_pct': 0.029993848796862035, 'bear_atr_max_pct': 0.10411804407620735, 'bear_tp_mult': 2.0910705451035603, 'bear_tsl_mult': 0.6477563881316107, 'bear_time_stop': 191, 'bear_use_sma': False, 'bear_use_ema': True, 'bear_use_atr': False, 'bear_use_adx': True, 'bear_use_spike': True, 'bear_rsi_required': True, 'sideways_strategy': 'breakout', 'sideways_bb_std_mult': 1.7388942052264564, 'sideways_rsi_os': 10, 'sideways_rsi_ob': 88, 'sideways_adx_thresh': 26.085880561036646, 'sideways_atr_min_pct': 0.019736240878305368, 'sideways_atr_max_pct': 0.06409209993105795, 'sideways_tp_mult': 1.835779719327014, 'sideways_tsl_mult': 0.8497440794766008, 'sideways_time_stop': 170, 'sideways_use_sma': False, 'sideways_use_ema': False, 'sideways_use_atr': False, 'sideways_use_adx': True, 'sideways_use_spike': False, 'sideways_rsi_required': False}.
[I 2025-08-30 22:05:54,032] Trial 631 finished with values: [-1000000000.0, 1000000000.0] and parameters: {'p_sma': 57, 'p_std': 35, 'p_atr': 20, 'p_adx': 22, 'rsi_period': 76, 'ema1': 8, 'ema2': 25, 'slip_atr_k': 0.017343467357645408, 'slip_spread_k': 0.4410866221543728, 'spread_hl_frac': 0.030536106647065554, 'bb_std_mult': 0.9307024247023485, 'rsi_os': 37, 'rsi_ob': 60, 'vol_spike': 0.06574223533647588, 'adx_thresh': 9.334318828267005, 'atr_min_pct': 0.012641384020433463, 'atr_max_pct': 0.018660291358482545, 'tp_mult': 1.6898733384159177, 'tsl_mult': 0.9228896468672143, 'strategy': 'mean_reversion', 'time_stop': 79, 'use_sma': True, 'use_atr': False, 'use_adx': True, 'use_ema': False, 'use_spike': True, 'rsi_required': True, 'edge_k': 1.5093369348242027, 'edge_cap': 0.12404204525563411, 'bull_strategy': 'mean_reversion', 'bull_bb_std_mult': 1.9067839711834074, 'bull_rsi_os': 44, 'bull_rsi_ob': 80, 'bull_adx_thresh': 13.155719883278472, 'bull_atr_min_pct': 0.0009565256633781562, 'bull_atr_max_pct': 0.12749615019367183, 'bull_tp_mult': 1.3672068572348814, 'bull_tsl_mult': 0.0437089958205204, 'bull_time_stop': 27, 'bull_use_sma': True, 'bull_use_ema': True, 'bull_use_atr': False, 'bull_use_adx': False, 'bull_use_spike': False, 'bull_rsi_required': True, 'bear_strategy': 'mean_reversion', 'bear_bb_std_mult': 3.196074659514014, 'bear_rsi_os': 27, 'bear_rsi_ob': 94, 'bear_adx_thresh': 18.578517672206686, 'bear_atr_min_pct': 0.029539708325769895, 'bear_atr_max_pct': 0.0851831131388165, 'bear_tp_mult': 1.8787678087576336, 'bear_tsl_mult': 0.428560953399105, 'bear_time_stop': 271, 'bear_use_sma': False, 'bear_use_ema': True, 'bear_use_atr': False, 'bear_use_adx': False, 'bear_use_spike': True, 'bear_rsi_required': True, 'sideways_strategy': 'breakout', 'sideways_bb_std_mult': 1.707156780340317, 'sideways_rsi_os': 55, 'sideways_rsi_ob': 88, 'sideways_adx_thresh': 26.202359700652114, 'sideways_atr_min_pct': 0.02165112090190712, 'sideways_atr_max_pct': 0.13316193924561726, 'sideways_tp_mult': 1.8744652872339926, 'sideways_tsl_mult': 0.760383427134093, 'sideways_time_stop': 227, 'sideways_use_sma': False, 'sideways_use_ema': False, 'sideways_use_atr': False, 'sideways_use_adx': True, 'sideways_use_spike': False, 'sideways_rsi_required': False}.
[I 2025-08-30 22:05:54,070] Trial 632 finished with values: [-1000000000.0, 1000000000.0] and parameters: {'p_sma': 35, 'p_std': 37, 'p_atr': 25, 'p_adx': 22, 'rsi_period': 36, 'ema1': 10, 'ema2': 53, 'slip_atr_k': 0.11952139267541415, 'slip_spread_k': 0.419708576030166, 'spread_hl_frac': 0.030838664884750733, 'bb_std_mult': 0.9015265190992809, 'rsi_os': 42, 'rsi_ob': 92, 'vol_spike': 0.28751271573627163, 'adx_thresh': 6.044370922451664, 'atr_min_pct': 0.012333962857934012, 'atr_max_pct': 0.025853575646222073, 'tp_mult': 1.0470623134464367, 'tsl_mult': 0.9178963054255992, 'strategy': 'mean_reversion', 'time_stop': 79, 'use_sma': True, 'use_atr': False, 'use_adx': True, 'use_ema': True, 'use_spike': True, 'rsi_required': True, 'edge_k': 1.5161032145942386, 'edge_cap': 0.19355523755377935, 'bull_strategy': 'mean_reversion', 'bull_bb_std_mult': 0.8883764333105628, 'bull_rsi_os': 17, 'bull_rsi_ob': 89, 'bull_adx_thresh': 13.402299015861013, 'bull_atr_min_pct': 0.0016765853343282192, 'bull_atr_max_pct': 0.052730796654171685, 'bull_tp_mult': 2.9504523840959034, 'bull_tsl_mult': 0.3495282045636938, 'bull_time_stop': 300, 'bull_use_sma': True, 'bull_use_ema': True, 'bull_use_atr': False, 'bull_use_adx': False, 'bull_use_spike': False, 'bull_rsi_required': True, 'bear_strategy': 'mean_reversion', 'bear_bb_std_mult': 2.0458606646837887, 'bear_rsi_os': 9, 'bear_rsi_ob': 75, 'bear_adx_thresh': 27.15348665902109, 'bear_atr_min_pct': 0.029409542890241565, 'bear_atr_max_pct': 0.12464869143858896, 'bear_tp_mult': 1.8799302186213496, 'bear_tsl_mult': 0.423981013550935, 'bear_time_stop': 241, 'bear_use_sma': True, 'bear_use_ema': True, 'bear_use_atr': False, 'bear_use_adx': True, 'bear_use_spike': True, 'bear_rsi_required': True, 'sideways_strategy': 'breakout', 'sideways_bb_std_mult': 0.9830466341917625, 'sideways_rsi_os': 38, 'sideways_rsi_ob': 88, 'sideways_adx_thresh': 26.154540796885154, 'sideways_atr_min_pct': 0.005727314790764427, 'sideways_atr_max_pct': 0.04237853654577358, 'sideways_tp_mult': 1.869822491367969, 'sideways_tsl_mult': 0.17085747711385646, 'sideways_time_stop': 226, 'sideways_use_sma': False, 'sideways_use_ema': False, 'sideways_use_atr': False, 'sideways_use_adx': True, 'sideways_use_spike': False, 'sideways_rsi_required': False}.
[I 2025-08-30 22:05:54,574] Trial 633 finished with values: [-1000000000.0, 1000000000.0] and parameters: {'p_sma': 35, 'p_std': 50, 'p_atr': 11, 'p_adx': 22, 'rsi_period': 56, 'ema1': 10, 'ema2': 53, 'slip_atr_k': 0.08266303042100201, 'slip_spread_k': 0.44080330520183203, 'spread_hl_frac': 0.03473632288261157, 'bb_std_mult': 2.655130324189387, 'rsi_os': 35, 'rsi_ob': 67, 'vol_spike': 0.28628111368732645, 'adx_thresh': 9.379995293825152, 'atr_min_pct': 0.012701267016917147, 'atr_max_pct': 0.014808181477023605, 'tp_mult': 1.6813230188178607, 'tsl_mult': 0.6434555497195904, 'strategy': 'mean_reversion', 'time_stop': 166, 'use_sma': True, 'use_atr': False, 'use_adx': True, 'use_ema': True, 'use_spike': True, 'rsi_required': False, 'edge_k': 1.3450913189914422, 'edge_cap': 0.8322649482139389, 'bull_strategy': 'breakout', 'bull_bb_std_mult': 1.8384514301483472, 'bull_rsi_os': 6, 'bull_rsi_ob': 45, 'bull_adx_thresh': 14.855108122596317, 'bull_atr_min_pct': 0.0016449997256207096, 'bull_atr_max_pct': 0.10968354123802493, 'bull_tp_mult': 1.3611751290163425, 'bull_tsl_mult': 0.34087241863437434, 'bull_time_stop': 294, 'bull_use_sma': True, 'bull_use_ema': True, 'bull_use_atr': True, 'bull_use_adx': False, 'bull_use_spike': False, 'bull_rsi_required': False, 'bear_strategy': 'breakout', 'bear_bb_std_mult': 3.3871302600033477, 'bear_rsi_os': 6, 'bear_rsi_ob': 45, 'bear_adx_thresh': 18.721922785306738, 'bear_atr_min_pct': 0.029485353175771202, 'bear_atr_max_pct': 0.12520429144463197, 'bear_tp_mult': 1.5860041487042484, 'bear_tsl_mult': 0.43329852168482924, 'bear_time_stop': 192, 'bear_use_sma': True, 'bear_use_ema': True, 'bear_use_atr': False, 'bear_use_adx': True, 'bear_use_spike': True, 'bear_rsi_required': False, 'sideways_strategy': 'breakout', 'sideways_bb_std_mult': 1.7017111138410332, 'sideways_rsi_os': 13, 'sideways_rsi_ob': 53, 'sideways_adx_thresh': 26.415812888754676, 'sideways_atr_min_pct': 0.021616102901440733, 'sideways_atr_max_pct': 0.03755892817914438, 'sideways_tp_mult': 1.8129362456230493, 'sideways_tsl_mult': 0.7524142173094935, 'sideways_time_stop': 66, 'sideways_use_sma': False, 'sideways_use_ema': False, 'sideways_use_atr': False, 'sideways_use_adx': True, 'sideways_use_spike': False, 'sideways_rsi_required': False}.
[I 2025-08-30 22:05:54,883] Trial 634 finished with values: [-1000000000.0, 1000000000.0] and parameters: {'p_sma': 35, 'p_std': 21, 'p_atr': 20, 'p_adx': 27, 'rsi_period': 76, 'ema1': 10, 'ema2': 51, 'slip_atr_k': 0.1169521973917137, 'slip_spread_k': 0.7015338810480293, 'spread_hl_frac': 0.03639372269187328, 'bb_std_mult': 0.7578601879772159, 'rsi_os': 34, 'rsi_ob': 60, 'vol_spike': 0.0647728612694275, 'adx_thresh': 20.50482235839431, 'atr_min_pct': 0.012564748445223973, 'atr_max_pct': 0.02687062787838048, 'tp_mult': 1.668403020324678, 'tsl_mult': 0.8998181893387235, 'strategy': 'mean_reversion', 'time_stop': 197, 'use_sma': True, 'use_atr': False, 'use_adx': True, 'use_ema': True, 'use_spike': True, 'rsi_required': False, 'edge_k': 1.5149139203536326, 'edge_cap': 0.3826156593645768, 'bull_strategy': 'breakout', 'bull_bb_std_mult': 1.929756107513008, 'bull_rsi_os': 6, 'bull_rsi_ob': 86, 'bull_adx_thresh': 29.451094760206193, 'bull_atr_min_pct': 0.010311654770688943, 'bull_atr_max_pct': 0.058964930405339136, 'bull_tp_mult': 1.4267644060241094, 'bull_tsl_mult': 0.0374778536878998, 'bull_time_stop': 213, 'bull_use_sma': True, 'bull_use_ema': True, 'bull_use_atr': True, 'bull_use_adx': False, 'bull_use_spike': True, 'bull_rsi_required': False, 'bear_strategy': 'mean_reversion', 'bear_bb_std_mult': 1.1443027394599743, 'bear_rsi_os': 6, 'bear_rsi_ob': 45, 'bear_adx_thresh': 28.04408981030455, 'bear_atr_min_pct': 0.029288447276156662, 'bear_atr_max_pct': 0.12397229392807811, 'bear_tp_mult': 1.5963802992859908, 'bear_tsl_mult': 0.17851409993474882, 'bear_time_stop': 242, 'bear_use_sma': True, 'bear_use_ema': True, 'bear_use_atr': False, 'bear_use_adx': True, 'bear_use_spike': True, 'bear_rsi_required': False, 'sideways_strategy': 'breakout', 'sideways_bb_std_mult': 1.6963668272902879, 'sideways_rsi_os': 45, 'sideways_rsi_ob': 81, 'sideways_adx_thresh': 26.287591566518717, 'sideways_atr_min_pct': 0.02165949789045752, 'sideways_atr_max_pct': 0.037272170237315744, 'sideways_tp_mult': 1.8012530955803507, 'sideways_tsl_mult': 0.7459208608403325, 'sideways_time_stop': 266, 'sideways_use_sma': False, 'sideways_use_ema': True, 'sideways_use_atr': False, 'sideways_use_adx': True, 'sideways_use_spike': False, 'sideways_rsi_required': True}.
[I 2025-08-30 22:05:55,751] Trial 635 finished with values: [-1000000000.0, 1000000000.0] and parameters: {'p_sma': 24, 'p_std': 38, 'p_atr': 21, 'p_adx': 14, 'rsi_period': 71, 'ema1': 9, 'ema2': 54, 'slip_atr_k': 0.029230411968343816, 'slip_spread_k': 0.6512088013689641, 'spread_hl_frac': 0.03345785840528606, 'bb_std_mult': 2.6775786747041157, 'rsi_os': 35, 'rsi_ob': 68, 'vol_spike': 0.28562447130059276, 'adx_thresh': 12.124027544244191, 'atr_min_pct': 0.016537117845459914, 'atr_max_pct': 0.013514898733941808, 'tp_mult': 2.799011978602012, 'tsl_mult': 0.6055899814363488, 'strategy': 'mean_reversion', 'time_stop': 166, 'use_sma': True, 'use_atr': True, 'use_adx': True, 'use_ema': True, 'use_spike': True, 'rsi_required': False, 'edge_k': 1.3468700011131032, 'edge_cap': 0.7899042329149155, 'bull_strategy': 'breakout', 'bull_bb_std_mult': 1.8284121338296735, 'bull_rsi_os': 19, 'bull_rsi_ob': 91, 'bull_adx_thresh': 29.35885708693438, 'bull_atr_min_pct': 0.005717295698485997, 'bull_atr_max_pct': 0.058762916093031345, 'bull_tp_mult': 1.4317578579953116, 'bull_tsl_mult': 0.6790070326250639, 'bull_time_stop': 81, 'bull_use_sma': True, 'bull_use_ema': False, 'bull_use_atr': True, 'bull_use_adx': False, 'bull_use_spike': True, 'bull_rsi_required': False, 'bear_strategy': 'mean_reversion', 'bear_bb_std_mult': 1.1377100164746716, 'bear_rsi_os': 22, 'bear_rsi_ob': 45, 'bear_adx_thresh': 28.014622496430274, 'bear_atr_min_pct': 0.029955714047046927, 'bear_atr_max_pct': 0.11921445205431414, 'bear_tp_mult': 2.4266679627470893, 'bear_tsl_mult': 0.4043112159367367, 'bear_time_stop': 225, 'bear_use_sma': True, 'bear_use_ema': False, 'bear_use_atr': True, 'bear_use_adx': True, 'bear_use_spike': True, 'bear_rsi_required': False, 'sideways_strategy': 'mean_reversion', 'sideways_bb_std_mult': 1.6490533531275178, 'sideways_rsi_os': 24, 'sideways_rsi_ob': 92, 'sideways_adx_thresh': 7.996650041587722, 'sideways_atr_min_pct': 0.02167963260122096, 'sideways_atr_max_pct': 0.037667554159785094, 'sideways_tp_mult': 1.2329291066167998, 'sideways_tsl_mult': 0.7749475057056172, 'sideways_time_stop': 266, 'sideways_use_sma': False, 'sideways_use_ema': True, 'sideways_use_atr': True, 'sideways_use_adx': True, 'sideways_use_spike': False, 'sideways_rsi_required': True}.
[I 2025-08-30 22:05:55,840] Trial 638 finished with values: [-1000000000.0, 1000000000.0] and parameters: {'p_sma': 11, 'p_std': 39, 'p_atr': 21, 'p_adx': 10, 'rsi_period': 72, 'ema1': 14, 'ema2': 54, 'slip_atr_k': 0.029007935311353365, 'slip_spread_k': 0.11610743889011749, 'spread_hl_frac': 0.01543296651187408, 'bb_std_mult': 2.9483597856802604, 'rsi_os': 13, 'rsi_ob': 56, 'vol_spike': 0.2810293228133748, 'adx_thresh': 12.047680071579023, 'atr_min_pct': 0.015175913338102316, 'atr_max_pct': 0.01019612423994997, 'tp_mult': 1.6452753906620123, 'tsl_mult': 0.048576270914470754, 'strategy': 'breakout', 'time_stop': 103, 'use_sma': False, 'use_atr': True, 'use_adx': True, 'use_ema': True, 'use_spike': True, 'rsi_required': True, 'edge_k': 1.189231537130711, 'edge_cap': 0.9046256255512113, 'bull_strategy': 'breakout', 'bull_bb_std_mult': 1.9833898664281469, 'bull_rsi_os': 19, 'bull_rsi_ob': 52, 'bull_adx_thresh': 15.810063578168808, 'bull_atr_min_pct': 0.024428445999133797, 'bull_atr_max_pct': 0.010183997265722333, 'bull_tp_mult': 1.4569034439719495, 'bull_tsl_mult': 0.3907507433443322, 'bull_time_stop': 279, 'bull_use_sma': False, 'bull_use_ema': False, 'bull_use_atr': False, 'bull_use_adx': False, 'bull_use_spike': True, 'bull_rsi_required': True, 'bear_strategy': 'mean_reversion', 'bear_bb_std_mult': 1.8317615387987642, 'bear_rsi_os': 8, 'bear_rsi_ob': 74, 'bear_adx_thresh': 27.19345045484488, 'bear_atr_min_pct': 0.012245383127750545, 'bear_atr_max_pct': 0.11878544702289191, 'bear_tp_mult': 1.5068270288340093, 'bear_tsl_mult': 0.3045036274907217, 'bear_time_stop': 200, 'bear_use_sma': False, 'bear_use_ema': False, 'bear_use_atr': True, 'bear_use_adx': True, 'bear_use_spike': True, 'bear_rsi_required': True, 'sideways_strategy': 'mean_reversion', 'sideways_bb_std_mult': 1.6343282727165056, 'sideways_rsi_os': 24, 'sideways_rsi_ob': 92, 'sideways_adx_thresh': 27.22257576964911, 'sideways_atr_min_pct': 0.01901483902833575, 'sideways_atr_max_pct': 0.05037758294918482, 'sideways_tp_mult': 1.7216085802510612, 'sideways_tsl_mult': 0.7845573729381108, 'sideways_time_stop': 266, 'sideways_use_sma': False, 'sideways_use_ema': True, 'sideways_use_atr': True, 'sideways_use_adx': False, 'sideways_use_spike': False, 'sideways_rsi_required': True}.
[I 2025-08-30 22:06:25,598] Trial 637 finished with values: [-0.023660087338999825, 0.02357551160685639] and parameters: {'p_sma': 33, 'p_std': 14, 'p_atr': 21, 'p_adx': 10, 'rsi_period': 72, 'ema1': 9, 'ema2': 51, 'slip_atr_k': 0.028908326758365504, 'slip_spread_k': 0.7044242457303065, 'spread_hl_frac': 0.015347781223874896, 'bb_std_mult': 0.7570078255177157, 'rsi_os': 13, 'rsi_ob': 55, 'vol_spike': 0.2809333109144587, 'adx_thresh': 32.76761558877031, 'atr_min_pct': 0.0020229746674587223, 'atr_max_pct': 0.02855766873938441, 'tp_mult': 1.6330012749582385, 'tsl_mult': 0.8258383295937997, 'strategy': 'breakout', 'time_stop': 103, 'use_sma': False, 'use_atr': True, 'use_adx': True, 'use_ema': True, 'use_spike': True, 'rsi_required': False, 'edge_k': 1.187638291171652, 'edge_cap': 0.8019442748561569, 'bull_strategy': 'breakout', 'bull_bb_std_mult': 1.955427052045969, 'bull_rsi_os': 19, 'bull_rsi_ob': 52, 'bull_adx_thresh': 14.857145744935007, 'bull_atr_min_pct': 0.0008374675712895102, 'bull_atr_max_pct': 0.05826580275965662, 'bull_tp_mult': 1.4216018301330238, 'bull_tsl_mult': 0.39091620186250187, 'bull_time_stop': 248, 'bull_use_sma': True, 'bull_use_ema': False, 'bull_use_atr': True, 'bull_use_adx': False, 'bull_use_spike': True, 'bull_rsi_required': False, 'bear_strategy': 'mean_reversion', 'bear_bb_std_mult': 1.8278475037886548, 'bear_rsi_os': 6, 'bear_rsi_ob': 74, 'bear_adx_thresh': 28.09479352640989, 'bear_atr_min_pct': 0.02724498376514762, 'bear_atr_max_pct': 0.1136483362709292, 'bear_tp_mult': 1.6166085262937877, 'bear_tsl_mult': 0.4035485338574997, 'bear_time_stop': 251, 'bear_use_sma': False, 'bear_use_ema': False, 'bear_use_atr': True, 'bear_use_adx': True, 'bear_use_spike': True, 'bear_rsi_required': False, 'sideways_strategy': 'mean_reversion', 'sideways_bb_std_mult': 3.4620669383912817, 'sideways_rsi_os': 44, 'sideways_rsi_ob': 61, 'sideways_adx_thresh': 27.35391283093501, 'sideways_atr_min_pct': 0.02232436976438954, 'sideways_atr_max_pct': 0.12940080232002407, 'sideways_tp_mult': 1.7030763576897356, 'sideways_tsl_mult': 0.781448002832734, 'sideways_time_stop': 267, 'sideways_use_sma': False, 'sideways_use_ema': True, 'sideways_use_atr': True, 'sideways_use_adx': True, 'sideways_use_spike': False, 'sideways_rsi_required': True}.
[I 2025-08-30 22:06:26,375] Trial 636 finished with values: [-1000000000.0, 1000000000.0] and parameters: {'p_sma': 33, 'p_std': 39, 'p_atr': 21, 'p_adx': 21, 'rsi_period': 72, 'ema1': 14, 'ema2': 54, 'slip_atr_k': 0.02859950612346036, 'slip_spread_k': 0.9774932444384505, 'spread_hl_frac': 0.03658015879704165, 'bb_std_mult': 0.7729113624306884, 'rsi_os': 34, 'rsi_ob': 68, 'vol_spike': 0.28336806773928114, 'adx_thresh': 20.892034746317517, 'atr_min_pct': 0.016350517159736174, 'atr_max_pct': 0.14736691672186786, 'tp_mult': 1.6567730343769675, 'tsl_mult': 0.3680572282699197, 'strategy': 'mean_reversion', 'time_stop': 93, 'use_sma': True, 'use_atr': True, 'use_adx': True, 'use_ema': True, 'use_spike': True, 'rsi_required': False, 'edge_k': 1.2009482086380903, 'edge_cap': 0.3847887488597054, 'bull_strategy': 'breakout', 'bull_bb_std_mult': 1.9470824834508227, 'bull_rsi_os': 19, 'bull_rsi_ob': 45, 'bull_adx_thresh': 15.069690272338, 'bull_atr_min_pct': 0.010119118509071915, 'bull_atr_max_pct': 0.05829945091525778, 'bull_tp_mult': 1.4379287559478287, 'bull_tsl_mult': 0.38762517327999885, 'bull_time_stop': 86, 'bull_use_sma': True, 'bull_use_ema': False, 'bull_use_atr': True, 'bull_use_adx': False, 'bull_use_spike': True, 'bull_rsi_required': False, 'bear_strategy': 'mean_reversion', 'bear_bb_std_mult': 1.1516347087247216, 'bear_rsi_os': 6, 'bear_rsi_ob': 45, 'bear_adx_thresh': 33.92564392112075, 'bear_atr_min_pct': 0.02826669315965457, 'bear_atr_max_pct': 0.11854838413471613, 'bear_tp_mult': 2.4259591098725215, 'bear_tsl_mult': 0.40413063257691206, 'bear_time_stop': 251, 'bear_use_sma': True, 'bear_use_ema': False, 'bear_use_atr': True, 'bear_use_adx': True, 'bear_use_spike': True, 'bear_rsi_required': False, 'sideways_strategy': 'mean_reversion', 'sideways_bb_std_mult': 1.6469891520284707, 'sideways_rsi_os': 18, 'sideways_rsi_ob': 53, 'sideways_adx_thresh': 27.35906747061643, 'sideways_atr_min_pct': 0.021675822965313167, 'sideways_atr_max_pct': 0.03808837459516204, 'sideways_tp_mult': 1.8240956203260943, 'sideways_tsl_mult': 0.7495860113323509, 'sideways_time_stop': 86, 'sideways_use_sma': False, 'sideways_use_ema': True, 'sideways_use_atr': True, 'sideways_use_adx': True, 'sideways_use_spike': False, 'sideways_rsi_required': True}.
