[I 2025-08-30 22:20:57,257] Trial 764 finished with values: [-1000000000.0, 1000000000.0] and parameters: {'p_sma': 33, 'p_std': 17, 'p_atr': 22, 'p_adx': 22, 'rsi_period': 73, 'ema1': 10, 'ema2': 37, 'slip_atr_k': 0.027959866181190833, 'slip_spread_k': 0.6896615421487651, 'spread_hl_frac': 0.012833812272688951, 'bb_std_mult': 3.050080251339499, 'rsi_os': 10, 'rsi_ob': 66, 'vol_spike': 0.26717175498152124, 'adx_thresh': 21.58782453335404, 'atr_min_pct': 0.013686966052040419, 'atr_max_pct': 0.12119558354880511, 'tp_mult': 2.1777712459935037, 'tsl_mult': 0.5606114391894639, 'strategy': 'breakout', 'time_stop': 53, 'use_sma': True, 'use_atr': True, 'use_adx': True, 'use_ema': True, 'use_spike': True, 'rsi_required': False, 'edge_k': 0.9704010853833239, 'edge_cap': 0.8012099822349901, 'bull_strategy': 'mean_reversion', 'bull_bb_std_mult': 1.9451330577100738, 'bull_rsi_os': 16, 'bull_rsi_ob': 89, 'bull_adx_thresh': 13.001840956566577, 'bull_atr_min_pct': 0.003760833246015957, 'bull_atr_max_pct': 0.1423827034595106, 'bull_tp_mult': 1.3389625701246284, 'bull_tsl_mult': 0.7516509811435401, 'bull_time_stop': 288, 'bull_use_sma': False, 'bull_use_ema': False, 'bull_use_atr': True, 'bull_use_adx': True, 'bull_use_spike': True, 'bull_rsi_required': True, 'bear_strategy': 'mean_reversion', 'bear_bb_std_mult': 1.7778391265239821, 'bear_rsi_os': 8, 'bear_rsi_ob': 74, 'bear_adx_thresh': 26.561964581736234, 'bear_atr_min_pct': 0.0006728362213133422, 'bear_atr_max_pct': 0.11862813162398587, 'bear_tp_mult': 2.5694191795353336, 'bear_tsl_mult': 0.37789811536994283, 'bear_time_stop': 24, 'bear_use_sma': False, 'bear_use_ema': False, 'bear_use_atr': True, 'bear_use_adx': False, 'bear_use_spike': True, 'bear_rsi_required': True, 'sideways_strategy': 'mean_reversion', 'sideways_bb_std_mult': 1.806567316735615, 'sideways_rsi_os': 42, 'sideways_rsi_ob': 87, 'sideways_adx_thresh': 29.647518462562523, 'sideways_atr_min_pct': 0.008627062977368177, 'sideways_atr_max_pct': 0.04017051662793065, 'sideways_tp_mult': 1.8850243287936086, 'sideways_tsl_mult': 0.18146530140507794, 'sideways_time_stop': 260, 'sideways_use_sma': False, 'sideways_use_ema': True, 'sideways_use_atr': False, 'sideways_use_adx': True, 'sideways_use_spike': False, 'sideways_rsi_required': True}.
[I 2025-08-30 22:20:57,478] Trial 765 finished with values: [-1000000000.0, 1000000000.0] and parameters: {'p_sma': 15, 'p_std': 36, 'p_atr': 22, 'p_adx': 25, 'rsi_period': 84, 'ema1': 10, 'ema2': 38, 'slip_atr_k': 0.026348467524280283, 'slip_spread_k': 0.679002585584925, 'spread_hl_frac': 0.019826286259573236, 'bb_std_mult': 1.259058706380505, 'rsi_os': 20, 'rsi_ob': 66, 'vol_spike': 0.19503233798763192, 'adx_thresh': 15.106517624080624, 'atr_min_pct': 0.02463895886004563, 'atr_max_pct': 0.027341791756762872, 'tp_mult': 1.8134173516782917, 'tsl_mult': 0.22210139564120002, 'strategy': 'breakout', 'time_stop': 54, 'use_sma': True, 'use_atr': True, 'use_adx': True, 'use_ema': True, 'use_spike': True, 'rsi_required': False, 'edge_k': 0.9688317348963577, 'edge_cap': 0.8656785558508011, 'bull_strategy': 'breakout', 'bull_bb_std_mult': 1.9658527774649188, 'bull_rsi_os': 15, 'bull_rsi_ob': 89, 'bull_adx_thresh': 13.361469391003771, 'bull_atr_min_pct': 0.027572083708012722, 'bull_atr_max_pct': 0.05889011051621072, 'bull_tp_mult': 1.326346250724971, 'bull_tsl_mult': 0.4933269027962599, 'bull_time_stop': 185, 'bull_use_sma': True, 'bull_use_ema': False, 'bull_use_atr': True, 'bull_use_adx': True, 'bull_use_spike': True, 'bull_rsi_required': True, 'bear_strategy': 'mean_reversion', 'bear_bb_std_mult': 1.8747535891505311, 'bear_rsi_os': 10, 'bear_rsi_ob': 73, 'bear_adx_thresh': 26.570138810813514, 'bear_atr_min_pct': 0.020929596123326955, 'bear_atr_max_pct': 0.08128925655204783, 'bear_tp_mult': 1.5721378711111156, 'bear_tsl_mult': 0.3029867963613261, 'bear_time_stop': 203, 'bear_use_sma': False, 'bear_use_ema': False, 'bear_use_atr': True, 'bear_use_adx': False, 'bear_use_spike': True, 'bear_rsi_required': True, 'sideways_strategy': 'mean_reversion', 'sideways_bb_std_mult': 2.61273704039519, 'sideways_rsi_os': 21, 'sideways_rsi_ob': 87, 'sideways_adx_thresh': 25.968325766045535, 'sideways_atr_min_pct': 0.021878907168013224, 'sideways_atr_max_pct': 0.04438023493445542, 'sideways_tp_mult': 1.4577605449538735, 'sideways_tsl_mult': 0.817060825745129, 'sideways_time_stop': 27, 'sideways_use_sma': False, 'sideways_use_ema': True, 'sideways_use_atr': False, 'sideways_use_adx': False, 'sideways_use_spike': False, 'sideways_rsi_required': True}.
[I 2025-08-30 22:20:57,616] Trial 766 finished with values: [-0.017647200508630556, 0.017578684992736043] and parameters: {'p_sma': 33, 'p_std': 15, 'p_atr': 21, 'p_adx': 20, 'rsi_period': 73, 'ema1': 12, 'ema2': 59, 'slip_atr_k': 0.11398361711541448, 'slip_spread_k': 0.6387794387767008, 'spread_hl_frac': 0.03427713747246678, 'bb_std_mult': 0.7524992628959289, 'rsi_os': 10, 'rsi_ob': 45, 'vol_spike': 0.19464808512246537, 'adx_thresh': 22.138160111249405, 'atr_min_pct': 0.016733987720909477, 'atr_max_pct': 0.0265792899276844, 'tp_mult': 1.1972405928990422, 'tsl_mult': 0.5666611153764457, 'strategy': 'breakout', 'time_stop': 92, 'use_sma': True, 'use_atr': True, 'use_adx': True, 'use_ema': True, 'use_spike': True, 'rsi_required': False, 'edge_k': 0.9753779027058322, 'edge_cap': 0.16234606085344006, 'bull_strategy': 'breakout', 'bull_bb_std_mult': 1.971425724499399, 'bull_rsi_os': 19, 'bull_rsi_ob': 49, 'bull_adx_thresh': 28.970252193467925, 'bull_atr_min_pct': 0.0005375978109918311, 'bull_atr_max_pct': 0.025218204183017186, 'bull_tp_mult': 1.3385522401544332, 'bull_tsl_mult': 0.49066856362108446, 'bull_time_stop': 116, 'bull_use_sma': True, 'bull_use_ema': False, 'bull_use_atr': True, 'bull_use_adx': False, 'bull_use_spike': True, 'bull_rsi_required': True, 'bear_strategy': 'mean_reversion', 'bear_bb_std_mult': 1.8717964040866084, 'bear_rsi_os': 7, 'bear_rsi_ob': 73, 'bear_adx_thresh': 27.424666826266293, 'bear_atr_min_pct': 0.02902844986941348, 'bear_atr_max_pct': 0.11789007563419171, 'bear_tp_mult': 2.682962738977493, 'bear_tsl_mult': 0.3904322384998574, 'bear_time_stop': 162, 'bear_use_sma': False, 'bear_use_ema': True, 'bear_use_atr': True, 'bear_use_adx': False, 'bear_use_spike': True, 'bear_rsi_required': True, 'sideways_strategy': 'breakout', 'sideways_bb_std_mult': 2.7227327328746025, 'sideways_rsi_os': 34, 'sideways_rsi_ob': 72, 'sideways_adx_thresh': 17.996896929577286, 'sideways_atr_min_pct': 0.008599401677212262, 'sideways_atr_max_pct': 0.04375279855077717, 'sideways_tp_mult': 1.8786567815161175, 'sideways_tsl_mult': 0.21926061469446056, 'sideways_time_stop': 283, 'sideways_use_sma': True, 'sideways_use_ema': True, 'sideways_use_atr': False, 'sideways_use_adx': False, 'sideways_use_spike': False, 'sideways_rsi_required': True}.
[I 2025-08-30 22:20:59,024] Trial 769 finished with values: [-1000000000.0, 1000000000.0] and parameters: {'p_sma': 9, 'p_std': 38, 'p_atr': 21, 'p_adx': 21, 'rsi_period': 12, 'ema1': 6, 'ema2': 54, 'slip_atr_k': 0.023619996575788213, 'slip_spread_k': 0.9787445129663533, 'spread_hl_frac': 0.03611183371370706, 'bb_std_mult': 2.5160576440088716, 'rsi_os': 52, 'rsi_ob': 45, 'vol_spike': 0.19286656899156426, 'adx_thresh': 31.997325191069173, 'atr_min_pct': 0.011325549747714648, 'atr_max_pct': 0.03184327266543486, 'tp_mult': 1.7754931726001721, 'tsl_mult': 0.9011821697952189, 'strategy': 'mean_reversion', 'time_stop': 5, 'use_sma': True, 'use_atr': True, 'use_adx': True, 'use_ema': True, 'use_spike': True, 'rsi_required': True, 'edge_k': 1.0293294844199237, 'edge_cap': 0.8329348740172499, 'bull_strategy': 'breakout', 'bull_bb_std_mult': 1.8414139683352342, 'bull_rsi_os': 18, 'bull_rsi_ob': 85, 'bull_adx_thresh': 14.119329584793917, 'bull_atr_min_pct': 0.0014517409817656605, 'bull_atr_max_pct': 0.04301382417936182, 'bull_tp_mult': 1.3621227273047483, 'bull_tsl_mult': 0.9155917587221949, 'bull_time_stop': 117, 'bull_use_sma': True, 'bull_use_ema': False, 'bull_use_atr': False, 'bull_use_adx': False, 'bull_use_spike': False, 'bull_rsi_required': True, 'bear_strategy': 'breakout', 'bear_bb_std_mult': 2.0403936229842734, 'bear_rsi_os': 10, 'bear_rsi_ob': 73, 'bear_adx_thresh': 27.344393590261713, 'bear_atr_min_pct': 0.029443571920619034, 'bear_atr_max_pct': 0.11150920747887928, 'bear_tp_mult': 1.571481092622042, 'bear_tsl_mult': 0.3540449494128307, 'bear_time_stop': 236, 'bear_use_sma': False, 'bear_use_ema': True, 'bear_use_atr': False, 'bear_use_adx': True, 'bear_use_spike': True, 'bear_rsi_required': True, 'sideways_strategy': 'breakout', 'sideways_bb_std_mult': 0.985570735161126, 'sideways_rsi_os': 34, 'sideways_rsi_ob': 90, 'sideways_adx_thresh': 25.94350396476341, 'sideways_atr_min_pct': 0.01310594292071161, 'sideways_atr_max_pct': 0.03520123484965845, 'sideways_tp_mult': 1.821706647837423, 'sideways_tsl_mult': 0.7819978897405191, 'sideways_time_stop': 267, 'sideways_use_sma': False, 'sideways_use_ema': False, 'sideways_use_atr': False, 'sideways_use_adx': False, 'sideways_use_spike': True, 'sideways_rsi_required': False}.
[I 2025-08-30 22:21:31,426] Trial 768 finished with values: [-1000000000.0, 1000000000.0] and parameters: {'p_sma': 49, 'p_std': 35, 'p_atr': 21, 'p_adx': 28, 'rsi_period': 73, 'ema1': 10, 'ema2': 28, 'slip_atr_k': 0.03894052925216736, 'slip_spread_k': 0.6828892366973062, 'spread_hl_frac': 0.019580741034111233, 'bb_std_mult': 0.9005813960580358, 'rsi_os': 21, 'rsi_ob': 63, 'vol_spike': 0.19807543311410633, 'adx_thresh': 32.036315851221836, 'atr_min_pct': 0.016948240340259223, 'atr_max_pct': 0.02107839382296705, 'tp_mult': 1.8168294249252381, 'tsl_mult': 0.6897431464738437, 'strategy': 'breakout', 'time_stop': 91, 'use_sma': True, 'use_atr': True, 'use_adx': True, 'use_ema': True, 'use_spike': True, 'rsi_required': True, 'edge_k': 1.034124986609301, 'edge_cap': 0.8605131622931543, 'bull_strategy': 'breakout', 'bull_bb_std_mult': 1.841506050762622, 'bull_rsi_os': 18, 'bull_rsi_ob': 86, 'bull_adx_thresh': 13.829061896861743, 'bull_atr_min_pct': 0.027561586277330866, 'bull_atr_max_pct': 0.027817404396372807, 'bull_tp_mult': 2.7784977450227744, 'bull_tsl_mult': 0.28184227403123696, 'bull_time_stop': 74, 'bull_use_sma': True, 'bull_use_ema': False, 'bull_use_atr': True, 'bull_use_adx': False, 'bull_use_spike': False, 'bull_rsi_required': True, 'bear_strategy': 'mean_reversion', 'bear_bb_std_mult': 1.7871827652686774, 'bear_rsi_os': 7, 'bear_rsi_ob': 57, 'bear_adx_thresh': 27.40547527004064, 'bear_atr_min_pct': 0.0009279637049211305, 'bear_atr_max_pct': 0.13982632858676572, 'bear_tp_mult': 1.7764976804128485, 'bear_tsl_mult': 0.39401720394185863, 'bear_time_stop': 287, 'bear_use_sma': False, 'bear_use_ema': True, 'bear_use_atr': True, 'bear_use_adx': False, 'bear_use_spike': True, 'bear_rsi_required': True, 'sideways_strategy': 'breakout', 'sideways_bb_std_mult': 1.6380087755225583, 'sideways_rsi_os': 34, 'sideways_rsi_ob': 87, 'sideways_adx_thresh': 25.94633512254814, 'sideways_atr_min_pct': 0.020934630402931153, 'sideways_atr_max_pct': 0.04316163460237192, 'sideways_tp_mult': 1.9186539313301298, 'sideways_tsl_mult': 0.7340167036631681, 'sideways_time_stop': 268, 'sideways_use_sma': False, 'sideways_use_ema': False, 'sideways_use_atr': False, 'sideways_use_adx': True, 'sideways_use_spike': False, 'sideways_rsi_required': False}.
[I 2025-08-30 22:21:32,178] Trial 771 finished with values: [-1000000000.0, 1000000000.0] and parameters: {'p_sma': 36, 'p_std': 38, 'p_atr': 20, 'p_adx': 21, 'rsi_period': 26, 'ema1': 11, 'ema2': 54, 'slip_atr_k': 0.0591534838921242, 'slip_spread_k': 0.5977048002383992, 'spread_hl_frac': 0.03614177241181287, 'bb_std_mult': 0.8988981053273593, 'rsi_os': 49, 'rsi_ob': 63, 'vol_spike': 0.2843442482305002, 'adx_thresh': 32.32901129453887, 'atr_min_pct': 0.011388152487703146, 'atr_max_pct': 0.021012071830943963, 'tp_mult': 1.7694894190170491, 'tsl_mult': 0.9030309326883688, 'strategy': 'mean_reversion', 'time_stop': 207, 'use_sma': True, 'use_atr': False, 'use_adx': False, 'use_ema': True, 'use_spike': False, 'rsi_required': True, 'edge_k': 1.0380511149157567, 'edge_cap': 0.8327362911888604, 'bull_strategy': 'breakout', 'bull_bb_std_mult': 1.8350393409340402, 'bull_rsi_os': 18, 'bull_rsi_ob': 85, 'bull_adx_thresh': 14.067859167448606, 'bull_atr_min_pct': 0.0015383160842052362, 'bull_atr_max_pct': 0.043397832894695426, 'bull_tp_mult': 1.362957017451756, 'bull_tsl_mult': 0.4034790521901414, 'bull_time_stop': 296, 'bull_use_sma': True, 'bull_use_ema': False, 'bull_use_atr': False, 'bull_use_adx': False, 'bull_use_spike': False, 'bull_rsi_required': True, 'bear_strategy': 'breakout', 'bear_bb_std_mult': 2.0462791262001607, 'bear_rsi_os': 24, 'bear_rsi_ob': 74, 'bear_adx_thresh': 33.275353864763346, 'bear_atr_min_pct': 0.029406673600482436, 'bear_atr_max_pct': 0.11288585809492599, 'bear_tp_mult': 1.7713376740800366, 'bear_tsl_mult': 0.8553640670143093, 'bear_time_stop': 236, 'bear_use_sma': False, 'bear_use_ema': True, 'bear_use_atr': False, 'bear_use_adx': True, 'bear_use_spike': True, 'bear_rsi_required': True, 'sideways_strategy': 'breakout', 'sideways_bb_std_mult': 1.640238339743935, 'sideways_rsi_os': 40, 'sideways_rsi_ob': 66, 'sideways_adx_thresh': 28.70266101542511, 'sideways_atr_min_pct': 0.020942156771798164, 'sideways_atr_max_pct': 0.0358001164665512, 'sideways_tp_mult': 1.8187140419679884, 'sideways_tsl_mult': 0.9215604508569184, 'sideways_time_stop': 268, 'sideways_use_sma': False, 'sideways_use_ema': False, 'sideways_use_atr': False, 'sideways_use_adx': True, 'sideways_use_spike': True, 'sideways_rsi_required': False}.
[I 2025-08-30 22:21:32,340] Trial 770 finished with values: [-1000000000.0, 1000000000.0] and parameters: {'p_sma': 12, 'p_std': 33, 'p_atr': 8, 'p_adx': 27, 'rsi_period': 70, 'ema1': 11, 'ema2': 55, 'slip_atr_k': 0.05996583034891956, 'slip_spread_k': 0.9738026430064065, 'spread_hl_frac': 0.037035904764338996, 'bb_std_mult': 0.8992732522357257, 'rsi_os': 49, 'rsi_ob': 95, 'vol_spike': 0.28159599929189155, 'adx_thresh': 11.274849792931274, 'atr_min_pct': 0.01106748017900428, 'atr_max_pct': 0.020416570069047176, 'tp_mult': 1.6209790364259469, 'tsl_mult': 0.9085355897081892, 'strategy': 'mean_reversion', 'time_stop': 93, 'use_sma': True, 'use_atr': False, 'use_adx': True, 'use_ema': True, 'use_spike': True, 'rsi_required': True, 'edge_k': 1.0294732094910402, 'edge_cap': 0.8307914009413615, 'bull_strategy': 'breakout', 'bull_bb_std_mult': 1.8408716918149208, 'bull_rsi_os': 18, 'bull_rsi_ob': 48, 'bull_adx_thresh': 27.62295830261287, 'bull_atr_min_pct': 0.029931300965262038, 'bull_atr_max_pct': 0.02550112542672585, 'bull_tp_mult': 2.7556709649709763, 'bull_tsl_mult': 0.4066726135489479, 'bull_time_stop': 72, 'bull_use_sma': True, 'bull_use_ema': False, 'bull_use_atr': False, 'bull_use_adx': False, 'bull_use_spike': False, 'bull_rsi_required': True, 'bear_strategy': 'breakout', 'bear_bb_std_mult': 2.0444807247069576, 'bear_rsi_os': 42, 'bear_rsi_ob': 75, 'bear_adx_thresh': 27.335208903937396, 'bear_atr_min_pct': 0.02943246176920419, 'bear_atr_max_pct': 0.12797038017537496, 'bear_tp_mult': 2.227839058474047, 'bear_tsl_mult': 0.0021025311466795205, 'bear_time_stop': 237, 'bear_use_sma': False, 'bear_use_ema': True, 'bear_use_atr': False, 'bear_use_adx': True, 'bear_use_spike': True, 'bear_rsi_required': True, 'sideways_strategy': 'breakout', 'sideways_bb_std_mult': 1.6427959871945497, 'sideways_rsi_os': 36, 'sideways_rsi_ob': 90, 'sideways_adx_thresh': 9.410662135169222, 'sideways_atr_min_pct': 0.021007728732472374, 'sideways_atr_max_pct': 0.03559740946238135, 'sideways_tp_mult': 1.8085829451646682, 'sideways_tsl_mult': 0.7334268811646966, 'sideways_time_stop': 268, 'sideways_use_sma': True, 'sideways_use_ema': False, 'sideways_use_atr': False, 'sideways_use_adx': True, 'sideways_use_spike': True, 'sideways_rsi_required': False}.
[I 2025-08-30 22:21:33,400] Trial 772 finished with values: [-1000000000.0, 1000000000.0] and parameters: {'p_sma': 12, 'p_std': 40, 'p_atr': 26, 'p_adx': 9, 'rsi_period': 75, 'ema1': 11, 'ema2': 56, 'slip_atr_k': 0.03788360129183779, 'slip_spread_k': 0.3873720849504593, 'spread_hl_frac': 0.033240983546039674, 'bb_std_mult': 0.8961901657231961, 'rsi_os': 41, 'rsi_ob': 64, 'vol_spike': 0.09112364468205672, 'adx_thresh': 11.362857825272272, 'atr_min_pct': 0.01239522179909966, 'atr_max_pct': 0.014462448431972273, 'tp_mult': 1.6195488287103765, 'tsl_mult': 0.5128034422872235, 'strategy': 'mean_reversion', 'time_stop': 39, 'use_sma': True, 'use_atr': False, 'use_adx': False, 'use_ema': True, 'use_spike': False, 'rsi_required': True, 'edge_k': 1.0347582487923803, 'edge_cap': 0.716035118151291, 'bull_strategy': 'breakout', 'bull_bb_std_mult': 1.835879223759685, 'bull_rsi_os': 18, 'bull_rsi_ob': 47, 'bull_adx_thresh': 15.655318265874643, 'bull_atr_min_pct': 0.006166417322923773, 'bull_atr_max_pct': 0.07856709418985769, 'bull_tp_mult': 1.4124236614027175, 'bull_tsl_mult': 0.28987456926780114, 'bull_time_stop': 295, 'bull_use_sma': True, 'bull_use_ema': False, 'bull_use_atr': False, 'bull_use_adx': False, 'bull_use_spike': False, 'bull_rsi_required': False, 'bear_strategy': 'mean_reversion', 'bear_bb_std_mult': 2.055918668385354, 'bear_rsi_os': 5, 'bear_rsi_ob': 57, 'bear_adx_thresh': 28.27641096720544, 'bear_atr_min_pct': 0.0035624950229494554, 'bear_atr_max_pct': 0.11515058463260978, 'bear_tp_mult': 1.397249697558179, 'bear_tsl_mult': 0.4007297373266444, 'bear_time_stop': 234, 'bear_use_sma': False, 'bear_use_ema': True, 'bear_use_atr': False, 'bear_use_adx': True, 'bear_use_spike': True, 'bear_rsi_required': False, 'sideways_strategy': 'breakout', 'sideways_bb_std_mult': 1.6438468242714377, 'sideways_rsi_os': 38, 'sideways_rsi_ob': 88, 'sideways_adx_thresh': 28.70274398789235, 'sideways_atr_min_pct': 0.016424360442708865, 'sideways_atr_max_pct': 0.12762810290189675, 'sideways_tp_mult': 1.7839941635407275, 'sideways_tsl_mult': 0.7348212779274688, 'sideways_time_stop': 48, 'sideways_use_sma': False, 'sideways_use_ema': False, 'sideways_use_atr': False, 'sideways_use_adx': True, 'sideways_use_spike': True, 'sideways_rsi_required': False}.
[I 2025-08-30 22:21:34,731] Trial 775 finished with values: [-1000000000.0, 1000000000.0] and parameters: {'p_sma': 43, 'p_std': 25, 'p_atr': 24, 'p_adx': 11, 'rsi_period': 64, 'ema1': 11, 'ema2': 52, 'slip_atr_k': 0.23118303605746582, 'slip_spread_k': 0.3990440176206939, 'spread_hl_frac': 0.04700153960020105, 'bb_std_mult': 0.8154104645220618, 'rsi_os': 41, 'rsi_ob': 64, 'vol_spike': 0.039281438269291535, 'adx_thresh': 28.31976591035827, 'atr_min_pct': 0.014805131132387333, 'atr_max_pct': 0.014434535907904365, 'tp_mult': 2.6594772070530794, 'tsl_mult': 0.9571018424801943, 'strategy': 'mean_reversion', 'time_stop': 39, 'use_sma': True, 'use_atr': True, 'use_adx': False, 'use_ema': False, 'use_spike': False, 'rsi_required': True, 'edge_k': 0.9530803313650945, 'edge_cap': 0.7165825974214045, 'bull_strategy': 'breakout', 'bull_bb_std_mult': 1.7574377327196467, 'bull_rsi_os': 14, 'bull_rsi_ob': 95, 'bull_adx_thresh': 15.488564978165252, 'bull_atr_min_pct': 0.0021588406251921294, 'bull_atr_max_pct': 0.07869763930311463, 'bull_tp_mult': 1.410591891243712, 'bull_tsl_mult': 0.4335777555685021, 'bull_time_stop': 300, 'bull_use_sma': True, 'bull_use_ema': True, 'bull_use_atr': False, 'bull_use_adx': False, 'bull_use_spike': False, 'bull_rsi_required': False, 'bear_strategy': 'mean_reversion', 'bear_bb_std_mult': 2.3213054821453656, 'bear_rsi_os': 5, 'bear_rsi_ob': 55, 'bear_adx_thresh': 28.27614021119512, 'bear_atr_min_pct': 0.005358642374502384, 'bear_atr_max_pct': 0.05516790497091257, 'bear_tp_mult': 1.5015283030158495, 'bear_tsl_mult': 0.05617231861141314, 'bear_time_stop': 262, 'bear_use_sma': True, 'bear_use_ema': True, 'bear_use_atr': False, 'bear_use_adx': True, 'bear_use_spike': False, 'bear_rsi_required': False, 'sideways_strategy': 'breakout', 'sideways_bb_std_mult': 1.3785078471047965, 'sideways_rsi_os': 38, 'sideways_rsi_ob': 92, 'sideways_adx_thresh': 16.399382243233568, 'sideways_atr_min_pct': 0.0202439694461271, 'sideways_atr_max_pct': 0.1158291967001508, 'sideways_tp_mult': 1.7723383682143663, 'sideways_tsl_mult': 0.6081501711602567, 'sideways_time_stop': 223, 'sideways_use_sma': False, 'sideways_use_ema': False, 'sideways_use_atr': True, 'sideways_use_adx': True, 'sideways_use_spike': False, 'sideways_rsi_required': False}.
