[I 2025-08-30 21:07:14,673] Trial 163 finished with values: [-1000000000.0, 1000000000.0] and parameters: {'p_sma': 27, 'p_std': 36, 'p_atr': 16, 'p_adx': 29, 'rsi_period': 20, 'ema1': 23, 'ema2': 45, 'slip_atr_k': 0.05934164160267266, 'slip_spread_k': 0.13291742515815808, 'spread_hl_frac': 0.019845341306586314, 'bb_std_mult': 0.5123592792795166, 'rsi_os': 50, 'rsi_ob': 83, 'vol_spike': 0.14648957524226466, 'adx_thresh': 30.88618048970178, 'atr_min_pct': 0.0004500742715072887, 'atr_max_pct': 0.0447332992256296, 'tp_mult': 1.6117327370483354, 'tsl_mult': 0.5230685308303701, 'strategy': 'mean_reversion', 'time_stop': 197, 'use_sma': True, 'use_atr': True, 'use_adx': True, 'use_ema': True, 'use_spike': True, 'rsi_required': True, 'edge_k': 0.7316748299344145, 'edge_cap': 0.6372304907449435, 'bull_strategy': 'mean_reversion', 'bull_bb_std_mult': 3.051857521245283, 'bull_rsi_os': 20, 'bull_rsi_ob': 51, 'bull_adx_thresh': 17.484110109724444, 'bull_atr_min_pct': 0.0031551329045379824, 'bull_atr_max_pct': 0.06168524367485156, 'bull_tp_mult': 2.599171120322463, 'bull_tsl_mult': 0.038650811960711615, 'bull_time_stop': 292, 'bull_use_sma': False, 'bull_use_ema': False, 'bull_use_atr': False, 'bull_use_adx': False, 'bull_use_spike': True, 'bull_rsi_required': True, 'bear_strategy': 'breakout', 'bear_bb_std_mult': 2.663288069854346, 'bear_rsi_os': 48, 'bear_rsi_ob': 88, 'bear_adx_thresh': 30.495644376101254, 'bear_atr_min_pct': 0.010104477650022215, 'bear_atr_max_pct': 0.029010520326678044, 'bear_tp_mult': 2.8861478474264928, 'bear_tsl_mult': 0.4275263318977621, 'bear_time_stop': 74, 'bear_use_sma': True, 'bear_use_ema': False, 'bear_use_atr': True, 'bear_use_adx': True, 'bear_use_spike': True, 'bear_rsi_required': True, 'sideways_strategy': 'mean_reversion', 'sideways_bb_std_mult': 0.9710071243187046, 'sideways_rsi_os': 37, 'sideways_rsi_ob': 66, 'sideways_adx_thresh': 30.68367903702381, 'sideways_atr_min_pct': 0.01035300753995777, 'sideways_atr_max_pct': 0.0563005536030167, 'sideways_tp_mult': 2.727665017488118, 'sideways_tsl_mult': 0.40018028347809514, 'sideways_time_stop': 202, 'sideways_use_sma': False, 'sideways_use_ema': True, 'sideways_use_atr': True, 'sideways_use_adx': False, 'sideways_use_spike': False, 'sideways_rsi_required': True}.
[I 2025-08-30 21:07:14,694] Trial 165 finished with values: [-1000000000.0, 1000000000.0] and parameters: {'p_sma': 25, 'p_std': 36, 'p_atr': 14, 'p_adx': 29, 'rsi_period': 20, 'ema1': 15, 'ema2': 47, 'slip_atr_k': 0.020558771551109883, 'slip_spread_k': 0.7635451916671688, 'spread_hl_frac': 0.018180602349971237, 'bb_std_mult': 1.4455357047894557, 'rsi_os': 50, 'rsi_ob': 62, 'vol_spike': 0.10700573269675148, 'adx_thresh': 9.985015628633665, 'atr_min_pct': 0.000524282791280879, 'atr_max_pct': 0.09394653729610211, 'tp_mult': 1.9511141287120233, 'tsl_mult': 0.8058800765836757, 'strategy': 'mean_reversion', 'time_stop': 203, 'use_sma': False, 'use_atr': True, 'use_adx': True, 'use_ema': True, 'use_spike': True, 'rsi_required': True, 'edge_k': 0.7192558580771145, 'edge_cap': 0.6360137578323295, 'bull_strategy': 'mean_reversion', 'bull_bb_std_mult': 2.6069099141463785, 'bull_rsi_os': 16, 'bull_rsi_ob': 70, 'bull_adx_thresh': 23.38549470745625, 'bull_atr_min_pct': 0.02687730394860465, 'bull_atr_max_pct': 0.05027020424766093, 'bull_tp_mult': 2.5867121917452933, 'bull_tsl_mult': 0.9773784247429316, 'bull_time_stop': 291, 'bull_use_sma': True, 'bull_use_ema': False, 'bull_use_atr': False, 'bull_use_adx': False, 'bull_use_spike': True, 'bull_rsi_required': True, 'bear_strategy': 'breakout', 'bear_bb_std_mult': 3.2003792075243216, 'bear_rsi_os': 7, 'bear_rsi_ob': 48, 'bear_adx_thresh': 9.362252932079095, 'bear_atr_min_pct': 0.018380029420913907, 'bear_atr_max_pct': 0.06056499241784536, 'bear_tp_mult': 1.614643864263398, 'bear_tsl_mult': 0.3538433158732901, 'bear_time_stop': 73, 'bear_use_sma': True, 'bear_use_ema': False, 'bear_use_atr': True, 'bear_use_adx': True, 'bear_use_spike': True, 'bear_rsi_required': True, 'sideways_strategy': 'mean_reversion', 'sideways_bb_std_mult': 2.526305496125777, 'sideways_rsi_os': 37, 'sideways_rsi_ob': 67, 'sideways_adx_thresh': 30.777971536503863, 'sideways_atr_min_pct': 0.023838851122962055, 'sideways_atr_max_pct': 0.016439370543812143, 'sideways_tp_mult': 2.6084034333691934, 'sideways_tsl_mult': 0.6529566169698449, 'sideways_time_stop': 53, 'sideways_use_sma': False, 'sideways_use_ema': True, 'sideways_use_atr': True, 'sideways_use_adx': False, 'sideways_use_spike': False, 'sideways_rsi_required': True}.
[I 2025-08-30 21:07:46,266] Trial 162 finished with values: [-1000000000.0, 1000000000.0] and parameters: {'p_sma': 28, 'p_std': 32, 'p_atr': 16, 'p_adx': 23, 'rsi_period': 20, 'ema1': 22, 'ema2': 45, 'slip_atr_k': 0.06264018293855422, 'slip_spread_k': 0.859323860722668, 'spread_hl_frac': 0.03002987153493855, 'bb_std_mult': 1.4578519612046985, 'rsi_os': 8, 'rsi_ob': 70, 'vol_spike': 0.26613557761094014, 'adx_thresh': 22.191179360909167, 'atr_min_pct': 0.0004327111351963329, 'atr_max_pct': 0.10834751220949196, 'tp_mult': 2.8833236699081652, 'tsl_mult': 0.5197691048360737, 'strategy': 'mean_reversion', 'time_stop': 193, 'use_sma': True, 'use_atr': True, 'use_adx': True, 'use_ema': True, 'use_spike': True, 'rsi_required': True, 'edge_k': 0.6306242070545499, 'edge_cap': 0.6414302411392689, 'bull_strategy': 'mean_reversion', 'bull_bb_std_mult': 3.0704921848078395, 'bull_rsi_os': 18, 'bull_rsi_ob': 76, 'bull_adx_thresh': 8.564017294351636, 'bull_atr_min_pct': 0.02492659573671515, 'bull_atr_max_pct': 0.06094820276060546, 'bull_tp_mult': 2.6399102916608657, 'bull_tsl_mult': 0.01862976279442341, 'bull_time_stop': 85, 'bull_use_sma': False, 'bull_use_ema': False, 'bull_use_atr': False, 'bull_use_adx': False, 'bull_use_spike': True, 'bull_rsi_required': True, 'bear_strategy': 'breakout', 'bear_bb_std_mult': 2.65614587485647, 'bear_rsi_os': 38, 'bear_rsi_ob': 79, 'bear_adx_thresh': 7.097099037678046, 'bear_atr_min_pct': 0.010201598633089271, 'bear_atr_max_pct': 0.016489448295256604, 'bear_tp_mult': 1.3889252254345945, 'bear_tsl_mult': 0.4322223029298625, 'bear_time_stop': 179, 'bear_use_sma': True, 'bear_use_ema': False, 'bear_use_atr': True, 'bear_use_adx': True, 'bear_use_spike': True, 'bear_rsi_required': True, 'sideways_strategy': 'mean_reversion', 'sideways_bb_std_mult': 2.773534696464837, 'sideways_rsi_os': 16, 'sideways_rsi_ob': 66, 'sideways_adx_thresh': 21.843694271843965, 'sideways_atr_min_pct': 0.001774680978817866, 'sideways_atr_max_pct': 0.12516288325244568, 'sideways_tp_mult': 2.7279604164626545, 'sideways_tsl_mult': 0.3111668644232843, 'sideways_time_stop': 53, 'sideways_use_sma': False, 'sideways_use_ema': True, 'sideways_use_atr': True, 'sideways_use_adx': False, 'sideways_use_spike': False, 'sideways_rsi_required': True}.
[I 2025-08-30 21:07:46,502] Trial 164 finished with values: [-1000000000.0, 1000000000.0] and parameters: {'p_sma': 28, 'p_std': 36, 'p_atr': 14, 'p_adx': 29, 'rsi_period': 19, 'ema1': 16, 'ema2': 22, 'slip_atr_k': 0.030174853731789797, 'slip_spread_k': 0.7650858141257462, 'spread_hl_frac': 0.03291208335244284, 'bb_std_mult': 1.711643713757025, 'rsi_os': 39, 'rsi_ob': 61, 'vol_spike': 0.29588942107060906, 'adx_thresh': 30.87132093784468, 'atr_min_pct': 4.319705287533256e-05, 'atr_max_pct': 0.014612498390704484, 'tp_mult': 2.068727903051932, 'tsl_mult': 0.7998172340417997, 'strategy': 'mean_reversion', 'time_stop': 227, 'use_sma': True, 'use_atr': True, 'use_adx': True, 'use_ema': True, 'use_spike': True, 'rsi_required': True, 'edge_k': 0.7579658460753884, 'edge_cap': 0.5966667209405246, 'bull_strategy': 'mean_reversion', 'bull_bb_std_mult': 3.5962247233425857, 'bull_rsi_os': 16, 'bull_rsi_ob': 68, 'bull_adx_thresh': 13.26376566386967, 'bull_atr_min_pct': 0.02695287772439288, 'bull_atr_max_pct': 0.11015885948961107, 'bull_tp_mult': 2.586830000886037, 'bull_tsl_mult': 0.04152467722261221, 'bull_time_stop': 87, 'bull_use_sma': True, 'bull_use_ema': False, 'bull_use_atr': False, 'bull_use_adx': False, 'bull_use_spike': True, 'bull_rsi_required': True, 'bear_strategy': 'breakout', 'bear_bb_std_mult': 2.7080912817314013, 'bear_rsi_os': 48, 'bear_rsi_ob': 79, 'bear_adx_thresh': 16.097071129676735, 'bear_atr_min_pct': 0.018249053398642266, 'bear_atr_max_pct': 0.08357637854276928, 'bear_tp_mult': 1.3159664391081052, 'bear_tsl_mult': 0.4213243111961954, 'bear_time_stop': 188, 'bear_use_sma': True, 'bear_use_ema': False, 'bear_use_atr': True, 'bear_use_adx': True, 'bear_use_spike': True, 'bear_rsi_required': True, 'sideways_strategy': 'mean_reversion', 'sideways_bb_std_mult': 2.531223096647409, 'sideways_rsi_os': 31, 'sideways_rsi_ob': 91, 'sideways_adx_thresh': 32.32712569743579, 'sideways_atr_min_pct': 0.010380733862010867, 'sideways_atr_max_pct': 0.12521021801836346, 'sideways_tp_mult': 2.7447479379890645, 'sideways_tsl_mult': 0.3748949294020651, 'sideways_time_stop': 57, 'sideways_use_sma': False, 'sideways_use_ema': True, 'sideways_use_atr': True, 'sideways_use_adx': False, 'sideways_use_spike': False, 'sideways_rsi_required': True}.
[I 2025-08-30 21:07:47,864] Trial 167 finished with values: [-0.018962519616750773, 0.019027238739078658] and parameters: {'p_sma': 23, 'p_std': 37, 'p_atr': 13, 'p_adx': 28, 'rsi_period': 18, 'ema1': 18, 'ema2': 43, 'slip_atr_k': 0.028907956334373222, 'slip_spread_k': 0.4579367365067005, 'spread_hl_frac': 0.006179880726914813, 'bb_std_mult': 2.5303126174800368, 'rsi_os': 39, 'rsi_ob': 67, 'vol_spike': 0.18119323471405263, 'adx_thresh': 23.874893819876977, 'atr_min_pct': 7.214719852032374e-05, 'atr_max_pct': 0.10454893136238502, 'tp_mult': 1.8204415679856705, 'tsl_mult': 0.8991469367372698, 'strategy': 'mean_reversion', 'time_stop': 228, 'use_sma': False, 'use_atr': True, 'use_adx': True, 'use_ema': True, 'use_spike': True, 'rsi_required': True, 'edge_k': 0.5677061133238347, 'edge_cap': 0.5458394304283358, 'bull_strategy': 'breakout', 'bull_bb_std_mult': 3.5995854183513667, 'bull_rsi_os': 40, 'bull_rsi_ob': 67, 'bull_adx_thresh': 15.060231549533292, 'bull_atr_min_pct': 0.0005430551875718267, 'bull_atr_max_pct': 0.10974091094658847, 'bull_tp_mult': 2.5080399342228015, 'bull_tsl_mult': 0.02554328177327755, 'bull_time_stop': 280, 'bull_use_sma': True, 'bull_use_ema': False, 'bull_use_atr': False, 'bull_use_adx': True, 'bull_use_spike': True, 'bull_rsi_required': True, 'bear_strategy': 'mean_reversion', 'bear_bb_std_mult': 2.703813762733896, 'bear_rsi_os': 38, 'bear_rsi_ob': 46, 'bear_adx_thresh': 7.581985160896762, 'bear_atr_min_pct': 0.007009257685641701, 'bear_atr_max_pct': 0.03354333701881381, 'bear_tp_mult': 2.961883691204055, 'bear_tsl_mult': 0.21000727684149695, 'bear_time_stop': 294, 'bear_use_sma': False, 'bear_use_ema': True, 'bear_use_atr': False, 'bear_use_adx': True, 'bear_use_spike': True, 'bear_rsi_required': True, 'sideways_strategy': 'breakout', 'sideways_bb_std_mult': 2.677364330897006, 'sideways_rsi_os': 31, 'sideways_rsi_ob': 83, 'sideways_adx_thresh': 32.555588807050285, 'sideways_atr_min_pct': 0.002066980706666926, 'sideways_atr_max_pct': 0.013429326199105663, 'sideways_tp_mult': 2.665053242689141, 'sideways_tsl_mult': 0.366368582473811, 'sideways_time_stop': 127, 'sideways_use_sma': False, 'sideways_use_ema': True, 'sideways_use_atr': False, 'sideways_use_adx': True, 'sideways_use_spike': False, 'sideways_rsi_required': True}.
[I 2025-08-30 21:07:48,029] Trial 166 finished with values: [-0.016193480791577564, 0.016128045256384105] and parameters: {'p_sma': 25, 'p_std': 21, 'p_atr': 14, 'p_adx': 13, 'rsi_period': 20, 'ema1': 16, 'ema2': 47, 'slip_atr_k': 0.023564865771100417, 'slip_spread_k': 0.4554317403475324, 'spread_hl_frac': 0.01801885567055196, 'bb_std_mult': 1.4369645351478324, 'rsi_os': 40, 'rsi_ob': 67, 'vol_spike': 0.2653110809216009, 'adx_thresh': 21.24397236966355, 'atr_min_pct': 0.00010946186735299441, 'atr_max_pct': 0.0674396535006914, 'tp_mult': 2.869248581727493, 'tsl_mult': 0.8049861023125856, 'strategy': 'mean_reversion', 'time_stop': 226, 'use_sma': False, 'use_atr': True, 'use_adx': True, 'use_ema': True, 'use_spike': True, 'rsi_required': True, 'edge_k': 1.3173465108796278, 'edge_cap': 0.591992665585373, 'bull_strategy': 'breakout', 'bull_bb_std_mult': 1.556311486913451, 'bull_rsi_os': 16, 'bull_rsi_ob': 70, 'bull_adx_thresh': 5.004379119452597, 'bull_atr_min_pct': 0.001709755484884971, 'bull_atr_max_pct': 0.04903080949898356, 'bull_tp_mult': 2.493191984700858, 'bull_tsl_mult': 0.028018684666841216, 'bull_time_stop': 300, 'bull_use_sma': True, 'bull_use_ema': False, 'bull_use_atr': False, 'bull_use_adx': True, 'bull_use_spike': True, 'bull_rsi_required': True, 'bear_strategy': 'mean_reversion', 'bear_bb_std_mult': 2.566835774194857, 'bear_rsi_os': 50, 'bear_rsi_ob': 48, 'bear_adx_thresh': 7.480397111391584, 'bear_atr_min_pct': 0.018305010431364562, 'bear_atr_max_pct': 0.03263755046616555, 'bear_tp_mult': 1.61312241863542, 'bear_tsl_mult': 0.35097579855004357, 'bear_time_stop': 151, 'bear_use_sma': True, 'bear_use_ema': True, 'bear_use_atr': False, 'bear_use_adx': True, 'bear_use_spike': True, 'bear_rsi_required': True, 'sideways_strategy': 'breakout', 'sideways_bb_std_mult': 2.5677712309996723, 'sideways_rsi_os': 38, 'sideways_rsi_ob': 90, 'sideways_adx_thresh': 32.38882716622759, 'sideways_atr_min_pct': 0.009735579209563909, 'sideways_atr_max_pct': 0.01608799507228835, 'sideways_tp_mult': 2.6139385227671275, 'sideways_tsl_mult': 0.37584573178425823, 'sideways_time_stop': 53, 'sideways_use_sma': False, 'sideways_use_ema': True, 'sideways_use_atr': False, 'sideways_use_adx': True, 'sideways_use_spike': False, 'sideways_rsi_required': True}.
[I 2025-08-30 21:07:48,426] Trial 171 finished with values: [-1000000000.0, 1000000000.0] and parameters: {'p_sma': 23, 'p_std': 35, 'p_atr': 13, 'p_adx': 28, 'rsi_period': 15, 'ema1': 21, 'ema2': 48, 'slip_atr_k': 0.1035680994312201, 'slip_spread_k': 0.8895075831971956, 'spread_hl_frac': 0.04583984003878407, 'bb_std_mult': 1.5654073483503013, 'rsi_os': 43, 'rsi_ob': 46, 'vol_spike': 0.2741602243454167, 'adx_thresh': 23.998452773275748, 'atr_min_pct': 0.0009511924324460233, 'atr_max_pct': 0.10386938807363809, 'tp_mult': 1.0133883678631899, 'tsl_mult': 0.83678580564851, 'strategy': 'mean_reversion', 'time_stop': 227, 'use_sma': False, 'use_atr': True, 'use_adx': True, 'use_ema': True, 'use_spike': True, 'rsi_required': True, 'edge_k': 0.14238380900574255, 'edge_cap': 0.5132154097811432, 'bull_strategy': 'breakout', 'bull_bb_std_mult': 2.1871065206179363, 'bull_rsi_os': 17, 'bull_rsi_ob': 64, 'bull_adx_thresh': 16.805169046909718, 'bull_atr_min_pct': 0.0016788651008870083, 'bull_atr_max_pct': 0.04814136499421624, 'bull_tp_mult': 1.4785710384240824, 'bull_tsl_mult': 0.17532403988614526, 'bull_time_stop': 279, 'bull_use_sma': True, 'bull_use_ema': False, 'bull_use_atr': False, 'bull_use_adx': True, 'bull_use_spike': True, 'bull_rsi_required': True, 'bear_strategy': 'mean_reversion', 'bear_bb_std_mult': 1.7061221646808464, 'bear_rsi_os': 50, 'bear_rsi_ob': 46, 'bear_adx_thresh': 32.76831355618364, 'bear_atr_min_pct': 0.016418477691208924, 'bear_atr_max_pct': 0.0242251633078059, 'bear_tp_mult': 1.1760948621176621, 'bear_tsl_mult': 0.2158832322497859, 'bear_time_stop': 158, 'bear_use_sma': False, 'bear_use_ema': True, 'bear_use_atr': False, 'bear_use_adx': True, 'bear_use_spike': True, 'bear_rsi_required': True, 'sideways_strategy': 'breakout', 'sideways_bb_std_mult': 2.8849427824406124, 'sideways_rsi_os': 38, 'sideways_rsi_ob': 50, 'sideways_adx_thresh': 10.084774645697351, 'sideways_atr_min_pct': 0.009657899685154306, 'sideways_atr_max_pct': 0.0128791882307735, 'sideways_tp_mult': 2.050151081622104, 'sideways_tsl_mult': 0.996007162526878, 'sideways_time_stop': 182, 'sideways_use_sma': False, 'sideways_use_ema': True, 'sideways_use_atr': False, 'sideways_use_adx': True, 'sideways_use_spike': False, 'sideways_rsi_required': True}.
[I 2025-08-30 21:08:20,910] Trial 168 finished with values: [-1000000000.0, 1000000000.0] and parameters: {'p_sma': 23, 'p_std': 22, 'p_atr': 14, 'p_adx': 13, 'rsi_period': 18, 'ema1': 18, 'ema2': 21, 'slip_atr_k': 0.024482502063088177, 'slip_spread_k': 0.7472434217894052, 'spread_hl_frac': 0.04618193485723, 'bb_std_mult': 1.7009509714492914, 'rsi_os': 39, 'rsi_ob': 74, 'vol_spike': 0.29897685768676574, 'adx_thresh': 21.317022633882683, 'atr_min_pct': 6.25268928348841e-05, 'atr_max_pct': 0.10399401505489649, 'tp_mult': 1.8166360656273146, 'tsl_mult': 0.8944559716403135, 'strategy': 'mean_reversion', 'time_stop': 229, 'use_sma': False, 'use_atr': True, 'use_adx': True, 'use_ema': True, 'use_spike': True, 'rsi_required': True, 'edge_k': 0.5739972852885642, 'edge_cap': 0.5591788042165735, 'bull_strategy': 'breakout', 'bull_bb_std_mult': 2.732002830451689, 'bull_rsi_os': 15, 'bull_rsi_ob': 67, 'bull_adx_thresh': 15.163203110685673, 'bull_atr_min_pct': 0.0016612560355643402, 'bull_atr_max_pct': 0.08459808715638274, 'bull_tp_mult': 2.120868362788612, 'bull_tsl_mult': 0.8871731717819412, 'bull_time_stop': 280, 'bull_use_sma': True, 'bull_use_ema': False, 'bull_use_atr': False, 'bull_use_adx': True, 'bull_use_spike': True, 'bull_rsi_required': True, 'bear_strategy': 'mean_reversion', 'bear_bb_std_mult': 2.5780235738202175, 'bear_rsi_os': 50, 'bear_rsi_ob': 73, 'bear_adx_thresh': 21.717123134450762, 'bear_atr_min_pct': 0.018132695689625795, 'bear_atr_max_pct': 0.08335725365101809, 'bear_tp_mult': 2.9997997312008264, 'bear_tsl_mult': 0.4052383098779354, 'bear_time_stop': 154, 'bear_use_sma': False, 'bear_use_ema': True, 'bear_use_atr': False, 'bear_use_adx': True, 'bear_use_spike': True, 'bear_rsi_required': True, 'sideways_strategy': 'breakout', 'sideways_bb_std_mult': 2.885296723960324, 'sideways_rsi_os': 30, 'sideways_rsi_ob': 90, 'sideways_adx_thresh': 15.035076051978793, 'sideways_atr_min_pct': 0.009475654712916497, 'sideways_atr_max_pct': 0.06883837657526333, 'sideways_tp_mult': 2.384695714930282, 'sideways_tsl_mult': 0.36987750454450863, 'sideways_time_stop': 114, 'sideways_use_sma': False, 'sideways_use_ema': True, 'sideways_use_atr': False, 'sideways_use_adx': True, 'sideways_use_spike': False, 'sideways_rsi_required': True}.
[I 2025-08-30 21:08:21,427] Trial 169 finished with values: [-1000000000.0, 1000000000.0] and parameters: {'p_sma': 24, 'p_std': 21, 'p_atr': 13, 'p_adx': 28, 'rsi_period': 17, 'ema1': 18, 'ema2': 27, 'slip_atr_k': 0.027115034222121782, 'slip_spread_k': 0.9444144867520323, 'spread_hl_frac': 0.028063590194646375, 'bb_std_mult': 1.6910841731752428, 'rsi_os': 39, 'rsi_ob': 85, 'vol_spike': 0.09761238061940272, 'adx_thresh': 23.980720830560408, 'atr_min_pct': 0.0008423032436091, 'atr_max_pct': 0.06368186159359854, 'tp_mult': 1.7216645234976158, 'tsl_mult': 0.7617140068316808, 'strategy': 'mean_reversion', 'time_stop': 229, 'use_sma': False, 'use_atr': True, 'use_adx': True, 'use_ema': True, 'use_spike': True, 'rsi_required': True, 'edge_k': 0.09378309326780643, 'edge_cap': 0.5506411055002861, 'bull_strategy': 'breakout', 'bull_bb_std_mult': 1.5437731546830005, 'bull_rsi_os': 41, 'bull_rsi_ob': 89, 'bull_adx_thresh': 15.052710677612778, 'bull_atr_min_pct': 0.02998146073566707, 'bull_atr_max_pct': 0.048770480153847384, 'bull_tp_mult': 2.4985930281925617, 'bull_tsl_mult': 0.8870972084579904, 'bull_time_stop': 279, 'bull_use_sma': True, 'bull_use_ema': False, 'bull_use_atr': False, 'bull_use_adx': True, 'bull_use_spike': True, 'bull_rsi_required': True, 'bear_strategy': 'mean_reversion', 'bear_bb_std_mult': 2.5451319087485373, 'bear_rsi_os': 33, 'bear_rsi_ob': 46, 'bear_adx_thresh': 11.475668156822449, 'bear_atr_min_pct': 0.025598962325044758, 'bear_atr_max_pct': 0.1207803904327731, 'bear_tp_mult': 1.229485293238711, 'bear_tsl_mult': 0.21123179447992552, 'bear_time_stop': 151, 'bear_use_sma': False, 'bear_use_ema': True, 'bear_use_atr': False, 'bear_use_adx': True, 'bear_use_spike': True, 'bear_rsi_required': True, 'sideways_strategy': 'breakout', 'sideways_bb_std_mult': 2.6720320242793125, 'sideways_rsi_os': 29, 'sideways_rsi_ob': 83, 'sideways_adx_thresh': 15.02276540962437, 'sideways_atr_min_pct': 0.009429348234415219, 'sideways_atr_max_pct': 0.014335685206629, 'sideways_tp_mult': 2.2980276226534926, 'sideways_tsl_mult': 0.3409612256940381, 'sideways_time_stop': 71, 'sideways_use_sma': False, 'sideways_use_ema': True, 'sideways_use_atr': False, 'sideways_use_adx': True, 'sideways_use_spike': False, 'sideways_rsi_required': True}.
