[I 2025-08-30 21:15:52,398] Trial 226 finished with values: [-1000000000.0, 1000000000.0] and parameters: {'p_sma': 25, 'p_std': 60, 'p_atr': 8, 'p_adx': 13, 'rsi_period': 14, 'ema1': 19, 'ema2': 23, 'slip_atr_k': 0.028717649999917175, 'slip_spread_k': 0.21641330224015165, 'spread_hl_frac': 0.004558543896416134, 'bb_std_mult': 1.275178443881987, 'rsi_os': 47, 'rsi_ob': 76, 'vol_spike': 0.2803376894377184, 'adx_thresh': 14.135213353866973, 'atr_min_pct': 0.006638828966671053, 'atr_max_pct': 0.13938532838052387, 'tp_mult': 2.9997573138422466, 'tsl_mult': 0.8330460317916748, 'strategy': 'mean_reversion', 'time_stop': 208, 'use_sma': False, 'use_atr': True, 'use_adx': True, 'use_ema': True, 'use_spike': True, 'rsi_required': True, 'edge_k': 0.6454857668727816, 'edge_cap': 0.6328656657115918, 'bull_strategy': 'breakout', 'bull_bb_std_mult': 3.451849110982245, 'bull_rsi_os': 45, 'bull_rsi_ob': 65, 'bull_adx_thresh': 13.62664397122361, 'bull_atr_min_pct': 0.0017627468644945549, 'bull_atr_max_pct': 0.09575638889900269, 'bull_tp_mult': 2.5535791004350687, 'bull_tsl_mult': 0.058663881019917416, 'bull_time_stop': 42, 'bull_use_sma': True, 'bull_use_ema': False, 'bull_use_atr': False, 'bull_use_adx': True, 'bull_use_spike': False, 'bull_rsi_required': True, 'bear_strategy': 'mean_reversion', 'bear_bb_std_mult': 0.8971897867506959, 'bear_rsi_os': 49, 'bear_rsi_ob': 53, 'bear_adx_thresh': 9.51673444035624, 'bear_atr_min_pct': 0.01654422949201234, 'bear_atr_max_pct': 0.09894486040574993, 'bear_tp_mult': 1.5416453797668803, 'bear_tsl_mult': 0.945927996148528, 'bear_time_stop': 117, 'bear_use_sma': False, 'bear_use_ema': False, 'bear_use_atr': False, 'bear_use_adx': False, 'bear_use_spike': True, 'bear_rsi_required': True, 'sideways_strategy': 'breakout', 'sideways_bb_std_mult': 2.658069328268558, 'sideways_rsi_os': 38, 'sideways_rsi_ob': 67, 'sideways_adx_thresh': 33.87427324241958, 'sideways_atr_min_pct': 0.009389430197587565, 'sideways_atr_max_pct': 0.012299504040626118, 'sideways_tp_mult': 2.641816313697384, 'sideways_tsl_mult': 0.3724291908517183, 'sideways_time_stop': 278, 'sideways_use_sma': False, 'sideways_use_ema': False, 'sideways_use_atr': False, 'sideways_use_adx': True, 'sideways_use_spike': False, 'sideways_rsi_required': False}.
[I 2025-08-30 21:15:52,410] Trial 228 finished with values: [-0.02197775426749249, 0.02188443929611274] and parameters: {'p_sma': 25, 'p_std': 33, 'p_atr': 15, 'p_adx': 21, 'rsi_period': 19, 'ema1': 19, 'ema2': 32, 'slip_atr_k': 0.035499931694014594, 'slip_spread_k': 0.22000763294091735, 'spread_hl_frac': 0.0047003787685732665, 'bb_std_mult': 1.6658080705265106, 'rsi_os': 48, 'rsi_ob': 77, 'vol_spike': 0.2809309394243025, 'adx_thresh': 27.61646559276163, 'atr_min_pct': 0.020658679797271404, 'atr_max_pct': 0.09428971435937414, 'tp_mult': 2.9877255630736075, 'tsl_mult': 0.8337187427406734, 'strategy': 'mean_reversion', 'time_stop': 206, 'use_sma': True, 'use_atr': True, 'use_adx': True, 'use_ema': True, 'use_spike': True, 'rsi_required': True, 'edge_k': 0.6744474990872237, 'edge_cap': 0.4949503361985177, 'bull_strategy': 'breakout', 'bull_bb_std_mult': 2.4042091653288047, 'bull_rsi_os': 5, 'bull_rsi_ob': 64, 'bull_adx_thresh': 27.192325643425495, 'bull_atr_min_pct': 0.0009884276030325593, 'bull_atr_max_pct': 0.09481273789100723, 'bull_tp_mult': 2.5483024811927986, 'bull_tsl_mult': 0.03562387964706476, 'bull_time_stop': 300, 'bull_use_sma': True, 'bull_use_ema': False, 'bull_use_atr': False, 'bull_use_adx': True, 'bull_use_spike': False, 'bull_rsi_required': True, 'bear_strategy': 'mean_reversion', 'bear_bb_std_mult': 2.736275578423068, 'bear_rsi_os': 50, 'bear_rsi_ob': 53, 'bear_adx_thresh': 17.317319468456418, 'bear_atr_min_pct': 0.015937166403480557, 'bear_atr_max_pct': 0.028421573205403654, 'bear_tp_mult': 2.0300457334932736, 'bear_tsl_mult': 0.4450726120925424, 'bear_time_stop': 125, 'bear_use_sma': False, 'bear_use_ema': False, 'bear_use_atr': False, 'bear_use_adx': False, 'bear_use_spike': True, 'bear_rsi_required': True, 'sideways_strategy': 'breakout', 'sideways_bb_std_mult': 2.646879647578056, 'sideways_rsi_os': 25, 'sideways_rsi_ob': 67, 'sideways_adx_thresh': 33.83003039637139, 'sideways_atr_min_pct': 0.001415616501094315, 'sideways_atr_max_pct': 0.08999147631680232, 'sideways_tp_mult': 1.5824302009654623, 'sideways_tsl_mult': 0.15567820046674208, 'sideways_time_stop': 279, 'sideways_use_sma': False, 'sideways_use_ema': False, 'sideways_use_atr': False, 'sideways_use_adx': True, 'sideways_use_spike': False, 'sideways_rsi_required': False}.
[I 2025-08-30 21:15:52,808] Trial 227 finished with values: [-0.02486569657225668, 0.024799710948834014] and parameters: {'p_sma': 25, 'p_std': 11, 'p_atr': 15, 'p_adx': 22, 'rsi_period': 19, 'ema1': 19, 'ema2': 46, 'slip_atr_k': 0.0344437129411556, 'slip_spread_k': 0.7848466998596398, 'spread_hl_frac': 0.032953525793088995, 'bb_std_mult': 2.4186403786606183, 'rsi_os': 47, 'rsi_ob': 79, 'vol_spike': 0.28052326668173916, 'adx_thresh': 10.527370908741418, 'atr_min_pct': 0.0008657401504210638, 'atr_max_pct': 0.1223370504595588, 'tp_mult': 2.9995459939431983, 'tsl_mult': 0.8298545906853994, 'strategy': 'mean_reversion', 'time_stop': 207, 'use_sma': True, 'use_atr': True, 'use_adx': True, 'use_ema': True, 'use_spike': True, 'rsi_required': True, 'edge_k': 0.661510430951713, 'edge_cap': 0.5648182654046615, 'bull_strategy': 'breakout', 'bull_bb_std_mult': 2.572936433470959, 'bull_rsi_os': 46, 'bull_rsi_ob': 86, 'bull_adx_thresh': 13.479163515508597, 'bull_atr_min_pct': 0.0008491073291564758, 'bull_atr_max_pct': 0.047937582579143365, 'bull_tp_mult': 2.5615444617632614, 'bull_tsl_mult': 0.0004568439113258396, 'bull_time_stop': 45, 'bull_use_sma': True, 'bull_use_ema': False, 'bull_use_atr': False, 'bull_use_adx': True, 'bull_use_spike': False, 'bull_rsi_required': True, 'bear_strategy': 'mean_reversion', 'bear_bb_std_mult': 2.7576436358327223, 'bear_rsi_os': 50, 'bear_rsi_ob': 53, 'bear_adx_thresh': 17.323064180133183, 'bear_atr_min_pct': 0.026093805277197773, 'bear_atr_max_pct': 0.07378776969692626, 'bear_tp_mult': 2.700210310393295, 'bear_tsl_mult': 0.488519793154309, 'bear_time_stop': 217, 'bear_use_sma': False, 'bear_use_ema': False, 'bear_use_atr': False, 'bear_use_adx': True, 'bear_use_spike': True, 'bear_rsi_required': True, 'sideways_strategy': 'breakout', 'sideways_bb_std_mult': 2.661017494377196, 'sideways_rsi_os': 35, 'sideways_rsi_ob': 67, 'sideways_adx_thresh': 33.7048989655704, 'sideways_atr_min_pct': 0.025294527468440235, 'sideways_atr_max_pct': 0.010028820435849482, 'sideways_tp_mult': 2.6692576818951714, 'sideways_tsl_mult': 0.25650258439171547, 'sideways_time_stop': 47, 'sideways_use_sma': False, 'sideways_use_ema': False, 'sideways_use_atr': True, 'sideways_use_adx': False, 'sideways_use_spike': False, 'sideways_rsi_required': False}.
[I 2025-08-30 21:15:52,910] Trial 225 finished with values: [-1000000000.0, 1000000000.0] and parameters: {'p_sma': 30, 'p_std': 12, 'p_atr': 24, 'p_adx': 22, 'rsi_period': 17, 'ema1': 20, 'ema2': 32, 'slip_atr_k': 0.040166341858656335, 'slip_spread_k': 0.2207262406107735, 'spread_hl_frac': 0.004980025456488828, 'bb_std_mult': 2.375085073339698, 'rsi_os': 47, 'rsi_ob': 79, 'vol_spike': 0.27935710511601586, 'adx_thresh': 24.04721329212293, 'atr_min_pct': 0.006747674588435856, 'atr_max_pct': 0.13861828378067717, 'tp_mult': 1.5641726818137607, 'tsl_mult': 0.8293198162262573, 'strategy': 'mean_reversion', 'time_stop': 221, 'use_sma': False, 'use_atr': True, 'use_adx': True, 'use_ema': True, 'use_spike': True, 'rsi_required': True, 'edge_k': 1.1246452253764365, 'edge_cap': 0.6193861000837694, 'bull_strategy': 'breakout', 'bull_bb_std_mult': 3.4597177309507354, 'bull_rsi_os': 5, 'bull_rsi_ob': 53, 'bull_adx_thresh': 13.797769451844495, 'bull_atr_min_pct': 0.02019865553385939, 'bull_atr_max_pct': 0.04832132926372297, 'bull_tp_mult': 2.9989949092531685, 'bull_tsl_mult': 0.9993734727022483, 'bull_time_stop': 288, 'bull_use_sma': True, 'bull_use_ema': False, 'bull_use_atr': False, 'bull_use_adx': True, 'bull_use_spike': False, 'bull_rsi_required': True, 'bear_strategy': 'mean_reversion', 'bear_bb_std_mult': 1.4225069074439765, 'bear_rsi_os': 7, 'bear_rsi_ob': 53, 'bear_adx_thresh': 29.167746196860485, 'bear_atr_min_pct': 0.016448355849014232, 'bear_atr_max_pct': 0.01661077289814339, 'bear_tp_mult': 1.8803298819387082, 'bear_tsl_mult': 0.3427726072833139, 'bear_time_stop': 94, 'bear_use_sma': False, 'bear_use_ema': False, 'bear_use_atr': False, 'bear_use_adx': False, 'bear_use_spike': True, 'bear_rsi_required': True, 'sideways_strategy': 'breakout', 'sideways_bb_std_mult': 2.652676806468985, 'sideways_rsi_os': 23, 'sideways_rsi_ob': 67, 'sideways_adx_thresh': 32.80447347930402, 'sideways_atr_min_pct': 0.0017215144563720152, 'sideways_atr_max_pct': 0.010526115285978641, 'sideways_tp_mult': 2.6350244080776077, 'sideways_tsl_mult': 0.49834048875811354, 'sideways_time_stop': 133, 'sideways_use_sma': False, 'sideways_use_ema': False, 'sideways_use_atr': False, 'sideways_use_adx': True, 'sideways_use_spike': False, 'sideways_rsi_required': False}.
[I 2025-08-30 21:16:27,620] Trial 232 finished with values: [-1000000000.0, 1000000000.0] and parameters: {'p_sma': 26, 'p_std': 42, 'p_atr': 17, 'p_adx': 28, 'rsi_period': 45, 'ema1': 21, 'ema2': 45, 'slip_atr_k': 0.047527946587900494, 'slip_spread_k': 0.7713247431872347, 'spread_hl_frac': 0.015692665968387677, 'bb_std_mult': 1.5583989999145664, 'rsi_os': 17, 'rsi_ob': 77, 'vol_spike': 0.0693621628510865, 'adx_thresh': 22.27613322696805, 'atr_min_pct': 0.005794725518611744, 'atr_max_pct': 0.09358435113918753, 'tp_mult': 1.6137060169501474, 'tsl_mult': 0.860072866766757, 'strategy': 'mean_reversion', 'time_stop': 139, 'use_sma': True, 'use_atr': True, 'use_adx': True, 'use_ema': False, 'use_spike': True, 'rsi_required': True, 'edge_k': 0.2443786420320594, 'edge_cap': 0.7029267727157851, 'bull_strategy': 'breakout', 'bull_bb_std_mult': 2.6561188540298275, 'bull_rsi_os': 7, 'bull_rsi_ob': 79, 'bull_adx_thresh': 27.174481255855618, 'bull_atr_min_pct': 0.0018928289257837136, 'bull_atr_max_pct': 0.042413788702974936, 'bull_tp_mult': 1.8872401690147784, 'bull_tsl_mult': 0.33123454492419946, 'bull_time_stop': 58, 'bull_use_sma': True, 'bull_use_ema': False, 'bull_use_atr': False, 'bull_use_adx': True, 'bull_use_spike': True, 'bull_rsi_required': True, 'bear_strategy': 'mean_reversion', 'bear_bb_std_mult': 2.782907168401784, 'bear_rsi_os': 52, 'bear_rsi_ob': 48, 'bear_adx_thresh': 20.29431662670162, 'bear_atr_min_pct': 0.0184285876514477, 'bear_atr_max_pct': 0.017842374303764088, 'bear_tp_mult': 2.27103332693042, 'bear_tsl_mult': 0.3730938075176427, 'bear_time_stop': 125, 'bear_use_sma': True, 'bear_use_ema': True, 'bear_use_atr': False, 'bear_use_adx': True, 'bear_use_spike': True, 'bear_rsi_required': True, 'sideways_strategy': 'breakout', 'sideways_bb_std_mult': 2.7573566753574155, 'sideways_rsi_os': 50, 'sideways_rsi_ob': 66, 'sideways_adx_thresh': 30.84515024562919, 'sideways_atr_min_pct': 0.023639977416793276, 'sideways_atr_max_pct': 0.01347405468034757, 'sideways_tp_mult': 2.522882283369015, 'sideways_tsl_mult': 0.15050977544825977, 'sideways_time_stop': 244, 'sideways_use_sma': False, 'sideways_use_ema': True, 'sideways_use_atr': True, 'sideways_use_adx': False, 'sideways_use_spike': False, 'sideways_rsi_required': True}.
[I 2025-08-30 21:16:27,795] Trial 229 finished with values: [-0.022158920499211643, 0.022080653047498337] and parameters: {'p_sma': 26, 'p_std': 33, 'p_atr': 15, 'p_adx': 28, 'rsi_period': 19, 'ema1': 19, 'ema2': 45, 'slip_atr_k': 0.2012911741277765, 'slip_spread_k': 0.7800783980816667, 'spread_hl_frac': 0.04010154334823615, 'bb_std_mult': 1.8827104936329906, 'rsi_os': 16, 'rsi_ob': 79, 'vol_spike': 0.16344504136285876, 'adx_thresh': 23.93322973451332, 'atr_min_pct': 0.0011886545508540142, 'atr_max_pct': 0.09499596278775797, 'tp_mult': 2.664453253011981, 'tsl_mult': 0.8612101539730466, 'strategy': 'mean_reversion', 'time_stop': 229, 'use_sma': True, 'use_atr': True, 'use_adx': True, 'use_ema': True, 'use_spike': True, 'rsi_required': True, 'edge_k': 0.6765136375340494, 'edge_cap': 0.7016940501435165, 'bull_strategy': 'breakout', 'bull_bb_std_mult': 2.5031507561136483, 'bull_rsi_os': 17, 'bull_rsi_ob': 92, 'bull_adx_thresh': 7.016225246623259, 'bull_atr_min_pct': 0.0010338099316466905, 'bull_atr_max_pct': 0.042151671413603375, 'bull_tp_mult': 2.1709131458915363, 'bull_tsl_mult': 0.3251360662473943, 'bull_time_stop': 300, 'bull_use_sma': True, 'bull_use_ema': False, 'bull_use_atr': False, 'bull_use_adx': True, 'bull_use_spike': True, 'bull_rsi_required': True, 'bear_strategy': 'mean_reversion', 'bear_bb_std_mult': 2.7784993472149546, 'bear_rsi_os': 49, 'bear_rsi_ob': 69, 'bear_adx_thresh': 20.51733046300413, 'bear_atr_min_pct': 0.02554887101732272, 'bear_atr_max_pct': 0.018464649499566062, 'bear_tp_mult': 2.6164847027123237, 'bear_tsl_mult': 0.4455649331504906, 'bear_time_stop': 216, 'bear_use_sma': True, 'bear_use_ema': True, 'bear_use_atr': False, 'bear_use_adx': True, 'bear_use_spike': True, 'bear_rsi_required': True, 'sideways_strategy': 'breakout', 'sideways_bb_std_mult': 2.788694196794074, 'sideways_rsi_os': 50, 'sideways_rsi_ob': 67, 'sideways_adx_thresh': 22.16448949380949, 'sideways_atr_min_pct': 0.025517352569245713, 'sideways_atr_max_pct': 0.012477939824898511, 'sideways_tp_mult': 1.7672918623821168, 'sideways_tsl_mult': 0.8327831745572888, 'sideways_time_stop': 138, 'sideways_use_sma': False, 'sideways_use_ema': True, 'sideways_use_atr': True, 'sideways_use_adx': False, 'sideways_use_spike': False, 'sideways_rsi_required': True}.
[I 2025-08-30 21:16:27,979] Trial 231 finished with values: [-1000000000.0, 1000000000.0] and parameters: {'p_sma': 56, 'p_std': 44, 'p_atr': 17, 'p_adx': 28, 'rsi_period': 23, 'ema1': 20, 'ema2': 25, 'slip_atr_k': 0.16162184075590771, 'slip_spread_k': 0.05912596584332985, 'spread_hl_frac': 0.0074151318191815335, 'bb_std_mult': 1.5677755369887159, 'rsi_os': 44, 'rsi_ob': 77, 'vol_spike': 0.10036712812693988, 'adx_thresh': 6.384808368785318, 'atr_min_pct': 0.005763946647222256, 'atr_max_pct': 0.09499168693028434, 'tp_mult': 1.5789456837903977, 'tsl_mult': 0.8601386979003419, 'strategy': 'mean_reversion', 'time_stop': 145, 'use_sma': True, 'use_atr': True, 'use_adx': True, 'use_ema': True, 'use_spike': True, 'rsi_required': True, 'edge_k': 1.0710340068184974, 'edge_cap': 0.6922842739049091, 'bull_strategy': 'breakout', 'bull_bb_std_mult': 2.669002795376594, 'bull_rsi_os': 6, 'bull_rsi_ob': 92, 'bull_adx_thresh': 14.421362644962377, 'bull_atr_min_pct': 0.005745921721021919, 'bull_atr_max_pct': 0.04267187826251425, 'bull_tp_mult': 2.6196942274391573, 'bull_tsl_mult': 0.4416806098132163, 'bull_time_stop': 300, 'bull_use_sma': True, 'bull_use_ema': False, 'bull_use_atr': False, 'bull_use_adx': True, 'bull_use_spike': True, 'bull_rsi_required': True, 'bear_strategy': 'mean_reversion', 'bear_bb_std_mult': 2.205124809365336, 'bear_rsi_os': 52, 'bear_rsi_ob': 69, 'bear_adx_thresh': 20.78982657888909, 'bear_atr_min_pct': 0.01091257497755126, 'bear_atr_max_pct': 0.01861423148545816, 'bear_tp_mult': 2.937302755001098, 'bear_tsl_mult': 0.524809841157422, 'bear_time_stop': 81, 'bear_use_sma': True, 'bear_use_ema': True, 'bear_use_atr': False, 'bear_use_adx': True, 'bear_use_spike': True, 'bear_rsi_required': True, 'sideways_strategy': 'breakout', 'sideways_bb_std_mult': 2.7904373880143853, 'sideways_rsi_os': 50, 'sideways_rsi_ob': 64, 'sideways_adx_thresh': 30.957471153530154, 'sideways_atr_min_pct': 0.008683871758924284, 'sideways_atr_max_pct': 0.04649094136290145, 'sideways_tp_mult': 2.5421411670673995, 'sideways_tsl_mult': 0.20426780522061055, 'sideways_time_stop': 134, 'sideways_use_sma': False, 'sideways_use_ema': True, 'sideways_use_atr': True, 'sideways_use_adx': False, 'sideways_use_spike': False, 'sideways_rsi_required': True}.
[I 2025-08-30 21:16:28,087] Trial 230 finished with values: [-1000000000.0, 1000000000.0] and parameters: {'p_sma': 10, 'p_std': 44, 'p_atr': 15, 'p_adx': 21, 'rsi_period': 35, 'ema1': 19, 'ema2': 32, 'slip_atr_k': 0.034154634205533385, 'slip_spread_k': 0.777610804667143, 'spread_hl_frac': 0.015607191826150689, 'bb_std_mult': 1.559642735991098, 'rsi_os': 17, 'rsi_ob': 79, 'vol_spike': 0.29306800798446636, 'adx_thresh': 27.98032060623883, 'atr_min_pct': 0.012288734301344646, 'atr_max_pct': 0.09391469918339442, 'tp_mult': 1.5708366995479266, 'tsl_mult': 0.2819304655353333, 'strategy': 'mean_reversion', 'time_stop': 110, 'use_sma': True, 'use_atr': True, 'use_adx': True, 'use_ema': True, 'use_spike': True, 'rsi_required': True, 'edge_k': 0.6881936604656497, 'edge_cap': 0.20129725807997656, 'bull_strategy': 'breakout', 'bull_bb_std_mult': 3.5972119542229004, 'bull_rsi_os': 5, 'bull_rsi_ob': 79, 'bull_adx_thresh': 14.586633573590053, 'bull_atr_min_pct': 0.019978138672774554, 'bull_atr_max_pct': 0.04146274080383171, 'bull_tp_mult': 1.5505602618365502, 'bull_tsl_mult': 0.41075523633508293, 'bull_time_stop': 300, 'bull_use_sma': True, 'bull_use_ema': False, 'bull_use_atr': False, 'bull_use_adx': True, 'bull_use_spike': True, 'bull_rsi_required': True, 'bear_strategy': 'mean_reversion', 'bear_bb_std_mult': 0.7563648181588054, 'bear_rsi_os': 6, 'bear_rsi_ob': 48, 'bear_adx_thresh': 17.422273505434774, 'bear_atr_min_pct': 0.015031546309012302, 'bear_atr_max_pct': 0.01839041392765754, 'bear_tp_mult': 2.9215769718398703, 'bear_tsl_mult': 0.6751070449841003, 'bear_time_stop': 81, 'bear_use_sma': True, 'bear_use_ema': True, 'bear_use_atr': False, 'bear_use_adx': True, 'bear_use_spike': True, 'bear_rsi_required': True, 'sideways_strategy': 'breakout', 'sideways_bb_std_mult': 2.7670045327094965, 'sideways_rsi_os': 40, 'sideways_rsi_ob': 66, 'sideways_adx_thresh': 27.504555005530978, 'sideways_atr_min_pct': 0.023542981665002436, 'sideways_atr_max_pct': 0.04686257991991034, 'sideways_tp_mult': 2.41362428506315, 'sideways_tsl_mult': 0.9307666772251364, 'sideways_time_stop': 134, 'sideways_use_sma': False, 'sideways_use_ema': True, 'sideways_use_atr': True, 'sideways_use_adx': False, 'sideways_use_spike': False, 'sideways_rsi_required': True}.
[I 2025-08-30 21:16:28,639] Trial 233 finished with values: [-1000000000.0, 1000000000.0] and parameters: {'p_sma': 29, 'p_std': 33, 'p_atr': 12, 'p_adx': 7, 'rsi_period': 23, 'ema1': 29, 'ema2': 60, 'slip_atr_k': 0.03411725122501082, 'slip_spread_k': 0.3498131734926735, 'spread_hl_frac': 0.007561517110468423, 'bb_std_mult': 1.6259859934726963, 'rsi_os': 10, 'rsi_ob': 47, 'vol_spike': 0.09569109864327446, 'adx_thresh': 20.173433453628583, 'atr_min_pct': 0.02054256760374454, 'atr_max_pct': 0.028382878238234648, 'tp_mult': 2.6543432423123807, 'tsl_mult': 0.2792625934814028, 'strategy': 'mean_reversion', 'time_stop': 229, 'use_sma': False, 'use_atr': True, 'use_adx': True, 'use_ema': True, 'use_spike': True, 'rsi_required': True, 'edge_k': 0.6835337234934286, 'edge_cap': 0.19794779037419968, 'bull_strategy': 'breakout', 'bull_bb_std_mult': 3.097221332328658, 'bull_rsi_os': 16, 'bull_rsi_ob': 95, 'bull_adx_thresh': 14.459085340021165, 'bull_atr_min_pct': 0.0005654074951999893, 'bull_atr_max_pct': 0.05486540529159932, 'bull_tp_mult': 1.2421451172689104, 'bull_tsl_mult': 0.4073961818997952, 'bull_time_stop': 300, 'bull_use_sma': True, 'bull_use_ema': False, 'bull_use_atr': False, 'bull_use_adx': True, 'bull_use_spike': True, 'bull_rsi_required': True, 'bear_strategy': 'mean_reversion', 'bear_bb_std_mult': 0.9621870626489442, 'bear_rsi_os': 41, 'bear_rsi_ob': 67, 'bear_adx_thresh': 16.533708443244393, 'bear_atr_min_pct': 0.0016866392290321146, 'bear_atr_max_pct': 0.01960178985475368, 'bear_tp_mult': 2.633806648825174, 'bear_tsl_mult': 0.44208544563093755, 'bear_time_stop': 84, 'bear_use_sma': True, 'bear_use_ema': True, 'bear_use_atr': False, 'bear_use_adx': True, 'bear_use_spike': True, 'bear_rsi_required': True, 'sideways_strategy': 'breakout', 'sideways_bb_std_mult': 2.835480684204539, 'sideways_rsi_os': 40, 'sideways_rsi_ob': 86, 'sideways_adx_thresh': 32.54025369650872, 'sideways_atr_min_pct': 0.01511961959710518, 'sideways_atr_max_pct': 0.09124612278930767, 'sideways_tp_mult': 2.7112625438604274, 'sideways_tsl_mult': 0.20047460112566529, 'sideways_time_stop': 136, 'sideways_use_sma': False, 'sideways_use_ema': True, 'sideways_use_atr': True, 'sideways_use_adx': False, 'sideways_use_spike': False, 'sideways_rsi_required': True}.
