[I 2025-08-30 21:25:49,959] Trial 303 finished with values: [-0.13591824319957035, 0.13589279265013188] and parameters: {'p_sma': 28, 'p_std': 33, 'p_atr': 16, 'p_adx': 22, 'rsi_period': 19, 'ema1': 16, 'ema2': 42, 'slip_atr_k': 0.034737125818462146, 'slip_spread_k': 0.4889045116875777, 'spread_hl_frac': 0.01036275513797608, 'bb_std_mult': 2.1901626719367173, 'rsi_os': 9, 'rsi_ob': 80, 'vol_spike': 0.08477810870565676, 'adx_thresh': 31.0561174572692, 'atr_min_pct': 0.01662323100233982, 'atr_max_pct': 0.08831598203846645, 'tp_mult': 1.633035798173678, 'tsl_mult': 0.8932374009819718, 'strategy': 'mean_reversion', 'time_stop': 117, 'use_sma': False, 'use_atr': True, 'use_adx': True, 'use_ema': True, 'use_spike': True, 'rsi_required': True, 'edge_k': 0.7275552887303993, 'edge_cap': 0.6104191535864701, 'bull_strategy': 'breakout', 'bull_bb_std_mult': 3.453959936003733, 'bull_rsi_os': 22, 'bull_rsi_ob': 55, 'bull_adx_thresh': 26.666092805335808, 'bull_atr_min_pct': 0.02472360773330047, 'bull_atr_max_pct': 0.06374082163919453, 'bull_tp_mult': 1.3245005400234335, 'bull_tsl_mult': 0.3336560873715979, 'bull_time_stop': 290, 'bull_use_sma': True, 'bull_use_ema': False, 'bull_use_atr': False, 'bull_use_adx': False, 'bull_use_spike': True, 'bull_rsi_required': True, 'bear_strategy': 'mean_reversion', 'bear_bb_std_mult': 2.7172869727835214, 'bear_rsi_os': 43, 'bear_rsi_ob': 54, 'bear_adx_thresh': 21.250184250558483, 'bear_atr_min_pct': 0.002501144081261234, 'bear_atr_max_pct': 0.012233354034249867, 'bear_tp_mult': 2.6037634580380975, 'bear_tsl_mult': 0.4279806796509933, 'bear_time_stop': 172, 'bear_use_sma': True, 'bear_use_ema': False, 'bear_use_atr': False, 'bear_use_adx': True, 'bear_use_spike': True, 'bear_rsi_required': True, 'sideways_strategy': 'breakout', 'sideways_bb_std_mult': 3.4494696741597792, 'sideways_rsi_os': 41, 'sideways_rsi_ob': 92, 'sideways_adx_thresh': 25.770858762736946, 'sideways_atr_min_pct': 3.0007273900478984e-05, 'sideways_atr_max_pct': 0.030646999670391917, 'sideways_tp_mult': 2.065468783727722, 'sideways_tsl_mult': 0.7734112226253972, 'sideways_time_stop': 247, 'sideways_use_sma': False, 'sideways_use_ema': True, 'sideways_use_atr': True, 'sideways_use_adx': False, 'sideways_use_spike': False, 'sideways_rsi_required': True}.
[I 2025-08-30 21:26:25,314] Trial 310 finished with values: [-0.019309292920588805, 0.019322191129146047] and parameters: {'p_sma': 30, 'p_std': 27, 'p_atr': 14, 'p_adx': 13, 'rsi_period': 23, 'ema1': 26, 'ema2': 24, 'slip_atr_k': 0.00631027091819325, 'slip_spread_k': 0.5308949658106954, 'spread_hl_frac': 0.04693727772334219, 'bb_std_mult': 1.1373407812083531, 'rsi_os': 11, 'rsi_ob': 78, 'vol_spike': 0.2948840760644151, 'adx_thresh': 18.463848042438244, 'atr_min_pct': 0.014954776184180401, 'atr_max_pct': 0.11909368993442462, 'tp_mult': 1.7563881724677928, 'tsl_mult': 0.09420052829306075, 'strategy': 'mean_reversion', 'time_stop': 122, 'use_sma': False, 'use_atr': True, 'use_adx': True, 'use_ema': True, 'use_spike': True, 'rsi_required': True, 'edge_k': 0.763075270426616, 'edge_cap': 0.59221164853637, 'bull_strategy': 'breakout', 'bull_bb_std_mult': 3.304883317696234, 'bull_rsi_os': 25, 'bull_rsi_ob': 67, 'bull_adx_thresh': 14.185656531091492, 'bull_atr_min_pct': 0.0010945631226388893, 'bull_atr_max_pct': 0.07958959820058965, 'bull_tp_mult': 2.3242803168421733, 'bull_tsl_mult': 0.5485815737144629, 'bull_time_stop': 38, 'bull_use_sma': True, 'bull_use_ema': False, 'bull_use_atr': False, 'bull_use_adx': True, 'bull_use_spike': True, 'bull_rsi_required': True, 'bear_strategy': 'mean_reversion', 'bear_bb_std_mult': 2.1060760384238453, 'bear_rsi_os': 36, 'bear_rsi_ob': 73, 'bear_adx_thresh': 17.165474427861504, 'bear_atr_min_pct': 0.016165993788586377, 'bear_atr_max_pct': 0.01845294664435005, 'bear_tp_mult': 1.4742138720283129, 'bear_tsl_mult': 0.6221234243129188, 'bear_time_stop': 152, 'bear_use_sma': True, 'bear_use_ema': False, 'bear_use_atr': False, 'bear_use_adx': True, 'bear_use_spike': True, 'bear_rsi_required': True, 'sideways_strategy': 'breakout', 'sideways_bb_std_mult': 1.557230665058442, 'sideways_rsi_os': 51, 'sideways_rsi_ob': 89, 'sideways_adx_thresh': 8.254061523662722, 'sideways_atr_min_pct': 0.01602328799820616, 'sideways_atr_max_pct': 0.0399679064872777, 'sideways_tp_mult': 2.1435093690464675, 'sideways_tsl_mult': 0.48906643440012426, 'sideways_time_stop': 253, 'sideways_use_sma': False, 'sideways_use_ema': True, 'sideways_use_atr': False, 'sideways_use_adx': False, 'sideways_use_spike': False, 'sideways_rsi_required': True}.
[I 2025-08-30 21:26:25,514] Trial 308 finished with values: [-1000000000.0, 1000000000.0] and parameters: {'p_sma': 35, 'p_std': 27, 'p_atr': 14, 'p_adx': 30, 'rsi_period': 21, 'ema1': 26, 'ema2': 20, 'slip_atr_k': 0.00613039647683708, 'slip_spread_k': 0.9762946430797221, 'spread_hl_frac': 0.03192730341310714, 'bb_std_mult': 1.4047396539702857, 'rsi_os': 18, 'rsi_ob': 55, 'vol_spike': 0.2810127550917416, 'adx_thresh': 18.83143987776735, 'atr_min_pct': 0.015356195156357645, 'atr_max_pct': 0.12404649512532495, 'tp_mult': 1.7574497171630241, 'tsl_mult': 0.9004647908947218, 'strategy': 'mean_reversion', 'time_stop': 101, 'use_sma': False, 'use_atr': True, 'use_adx': True, 'use_ema': True, 'use_spike': True, 'rsi_required': True, 'edge_k': 0.7720645495870765, 'edge_cap': 0.37273942225520945, 'bull_strategy': 'breakout', 'bull_bb_std_mult': 1.5659265608918123, 'bull_rsi_os': 18, 'bull_rsi_ob': 68, 'bull_adx_thresh': 6.6235299211395695, 'bull_atr_min_pct': 0.01326101191563024, 'bull_atr_max_pct': 0.0816948457804469, 'bull_tp_mult': 2.304683251217794, 'bull_tsl_mult': 0.33454703307583145, 'bull_time_stop': 260, 'bull_use_sma': True, 'bull_use_ema': False, 'bull_use_atr': False, 'bull_use_adx': True, 'bull_use_spike': True, 'bull_rsi_required': True, 'bear_strategy': 'mean_reversion', 'bear_bb_std_mult': 0.583761979066745, 'bear_rsi_os': 39, 'bear_rsi_ob': 52, 'bear_adx_thresh': 17.126044705285103, 'bear_atr_min_pct': 0.01652013144353384, 'bear_atr_max_pct': 0.019412209264912057, 'bear_tp_mult': 2.8709324318305414, 'bear_tsl_mult': 0.8429208361748985, 'bear_time_stop': 30, 'bear_use_sma': True, 'bear_use_ema': False, 'bear_use_atr': False, 'bear_use_adx': True, 'bear_use_spike': True, 'bear_rsi_required': True, 'sideways_strategy': 'breakout', 'sideways_bb_std_mult': 2.1568134281433315, 'sideways_rsi_os': 41, 'sideways_rsi_ob': 78, 'sideways_adx_thresh': 27.26670435141948, 'sideways_atr_min_pct': 0.01620212113503627, 'sideways_atr_max_pct': 0.07108374831986228, 'sideways_tp_mult': 2.142206431827403, 'sideways_tsl_mult': 0.4413478409848752, 'sideways_time_stop': 245, 'sideways_use_sma': False, 'sideways_use_ema': True, 'sideways_use_atr': True, 'sideways_use_adx': False, 'sideways_use_spike': False, 'sideways_rsi_required': True}.
[I 2025-08-30 21:26:25,953] Trial 307 finished with values: [-1000000000.0, 1000000000.0] and parameters: {'p_sma': 18, 'p_std': 27, 'p_atr': 15, 'p_adx': 30, 'rsi_period': 23, 'ema1': 26, 'ema2': 53, 'slip_atr_k': 0.20427257902007956, 'slip_spread_k': 0.30765347656687086, 'spread_hl_frac': 0.004071702939379317, 'bb_std_mult': 3.177564121399781, 'rsi_os': 12, 'rsi_ob': 84, 'vol_spike': 0.28083783794658335, 'adx_thresh': 30.038997863912535, 'atr_min_pct': 0.02021456806312342, 'atr_max_pct': 0.12368612298530517, 'tp_mult': 1.6405325338949166, 'tsl_mult': 0.896069093443488, 'strategy': 'mean_reversion', 'time_stop': 121, 'use_sma': False, 'use_atr': True, 'use_adx': True, 'use_ema': True, 'use_spike': True, 'rsi_required': True, 'edge_k': 0.7658156523793092, 'edge_cap': 0.8137600762715366, 'bull_strategy': 'breakout', 'bull_bb_std_mult': 3.2917217225301667, 'bull_rsi_os': 44, 'bull_rsi_ob': 68, 'bull_adx_thresh': 7.589627014654303, 'bull_atr_min_pct': 0.025073364047898478, 'bull_atr_max_pct': 0.05894141646780812, 'bull_tp_mult': 2.2690947053749, 'bull_tsl_mult': 0.6163633195283266, 'bull_time_stop': 299, 'bull_use_sma': True, 'bull_use_ema': False, 'bull_use_atr': False, 'bull_use_adx': True, 'bull_use_spike': True, 'bull_rsi_required': True, 'bear_strategy': 'mean_reversion', 'bear_bb_std_mult': 0.9892594642264285, 'bear_rsi_os': 43, 'bear_rsi_ob': 54, 'bear_adx_thresh': 26.307754167604806, 'bear_atr_min_pct': 0.026400729381399077, 'bear_atr_max_pct': 0.057750264197098444, 'bear_tp_mult': 2.8859657586615404, 'bear_tsl_mult': 0.8523224614372988, 'bear_time_stop': 102, 'bear_use_sma': True, 'bear_use_ema': False, 'bear_use_atr': False, 'bear_use_adx': True, 'bear_use_spike': True, 'bear_rsi_required': True, 'sideways_strategy': 'breakout', 'sideways_bb_std_mult': 1.99074422506213, 'sideways_rsi_os': 6, 'sideways_rsi_ob': 49, 'sideways_adx_thresh': 14.472462311417413, 'sideways_atr_min_pct': 0.0023085231879208575, 'sideways_atr_max_pct': 0.09095094076490896, 'sideways_tp_mult': 2.149130106390387, 'sideways_tsl_mult': 0.7748045347103963, 'sideways_time_stop': 191, 'sideways_use_sma': False, 'sideways_use_ema': True, 'sideways_use_atr': True, 'sideways_use_adx': False, 'sideways_use_spike': False, 'sideways_rsi_required': True}.
[I 2025-08-30 21:26:26,031] Trial 309 finished with values: [-0.02647884592142713, 0.026375378202853156] and parameters: {'p_sma': 10, 'p_std': 36, 'p_atr': 14, 'p_adx': 19, 'rsi_period': 23, 'ema1': 21, 'ema2': 24, 'slip_atr_k': 0.15929016946486016, 'slip_spread_k': 0.5309633495007408, 'spread_hl_frac': 0.022894953839476907, 'bb_std_mult': 1.1392363514036452, 'rsi_os': 33, 'rsi_ob': 78, 'vol_spike': 0.23963943344087174, 'adx_thresh': 30.334294706393248, 'atr_min_pct': 0.016560783707379467, 'atr_max_pct': 0.12396221190356507, 'tp_mult': 1.869991033123722, 'tsl_mult': 0.9041571831522834, 'strategy': 'mean_reversion', 'time_stop': 122, 'use_sma': False, 'use_atr': True, 'use_adx': True, 'use_ema': True, 'use_spike': True, 'rsi_required': True, 'edge_k': 0.780720816761091, 'edge_cap': 0.6096071347151255, 'bull_strategy': 'breakout', 'bull_bb_std_mult': 2.7301856859617635, 'bull_rsi_os': 30, 'bull_rsi_ob': 68, 'bull_adx_thresh': 7.644059168143944, 'bull_atr_min_pct': 0.0012575404845639813, 'bull_atr_max_pct': 0.07330898041256108, 'bull_tp_mult': 1.3207648335936806, 'bull_tsl_mult': 0.6078979841506512, 'bull_time_stop': 295, 'bull_use_sma': True, 'bull_use_ema': False, 'bull_use_atr': False, 'bull_use_adx': True, 'bull_use_spike': True, 'bull_rsi_required': True, 'bear_strategy': 'mean_reversion', 'bear_bb_std_mult': 0.992427872184366, 'bear_rsi_os': 31, 'bear_rsi_ob': 56, 'bear_adx_thresh': 17.260468679912073, 'bear_atr_min_pct': 0.016214283360052185, 'bear_atr_max_pct': 0.020158881476776247, 'bear_tp_mult': 1.449198860544825, 'bear_tsl_mult': 0.4584836657325906, 'bear_time_stop': 85, 'bear_use_sma': True, 'bear_use_ema': False, 'bear_use_atr': False, 'bear_use_adx': True, 'bear_use_spike': True, 'bear_rsi_required': True, 'sideways_strategy': 'breakout', 'sideways_bb_std_mult': 1.7000406448263903, 'sideways_rsi_os': 41, 'sideways_rsi_ob': 89, 'sideways_adx_thresh': 14.588859720579151, 'sideways_atr_min_pct': 0.0022316768802817105, 'sideways_atr_max_pct': 0.09325178413582116, 'sideways_tp_mult': 2.1438731151753125, 'sideways_tsl_mult': 0.7089799621394278, 'sideways_time_stop': 286, 'sideways_use_sma': False, 'sideways_use_ema': True, 'sideways_use_atr': True, 'sideways_use_adx': False, 'sideways_use_spike': False, 'sideways_rsi_required': True}.
[I 2025-08-30 21:27:01,307] Trial 314 finished with values: [-1000000000.0, 1000000000.0] and parameters: {'p_sma': 30, 'p_std': 45, 'p_atr': 15, 'p_adx': 13, 'rsi_period': 16, 'ema1': 21, 'ema2': 44, 'slip_atr_k': 0.04055056047765651, 'slip_spread_k': 0.5431883634201915, 'spread_hl_frac': 0.005373537643793285, 'bb_std_mult': 1.6291437881764461, 'rsi_os': 15, 'rsi_ob': 78, 'vol_spike': 0.2955518051363138, 'adx_thresh': 15.453530078681514, 'atr_min_pct': 0.01414048120715457, 'atr_max_pct': 0.04622880755961763, 'tp_mult': 2.054353493907849, 'tsl_mult': 0.8700567435694359, 'strategy': 'mean_reversion', 'time_stop': 111, 'use_sma': False, 'use_atr': True, 'use_adx': True, 'use_ema': True, 'use_spike': True, 'rsi_required': True, 'edge_k': 1.5100026049699804, 'edge_cap': 0.8721439119382017, 'bull_strategy': 'breakout', 'bull_bb_std_mult': 3.146737122618479, 'bull_rsi_os': 34, 'bull_rsi_ob': 70, 'bull_adx_thresh': 14.43833000476143, 'bull_atr_min_pct': 0.008587698212283706, 'bull_atr_max_pct': 0.14600727647363337, 'bull_tp_mult': 1.07245826238832, 'bull_tsl_mult': 0.6412957033064677, 'bull_time_stop': 254, 'bull_use_sma': True, 'bull_use_ema': False, 'bull_use_atr': False, 'bull_use_adx': True, 'bull_use_spike': True, 'bull_rsi_required': True, 'bear_strategy': 'mean_reversion', 'bear_bb_std_mult': 2.138802451746243, 'bear_rsi_os': 39, 'bear_rsi_ob': 52, 'bear_adx_thresh': 28.253489127020316, 'bear_atr_min_pct': 0.014612289066515509, 'bear_atr_max_pct': 0.010030786172774399, 'bear_tp_mult': 1.9651195954879723, 'bear_tsl_mult': 0.6151390789260258, 'bear_time_stop': 287, 'bear_use_sma': True, 'bear_use_ema': True, 'bear_use_atr': False, 'bear_use_adx': True, 'bear_use_spike': True, 'bear_rsi_required': True, 'sideways_strategy': 'breakout', 'sideways_bb_std_mult': 1.5421333747908947, 'sideways_rsi_os': 42, 'sideways_rsi_ob': 74, 'sideways_adx_thresh': 27.040202787863176, 'sideways_atr_min_pct': 0.02298861950513397, 'sideways_atr_max_pct': 0.08447767482604743, 'sideways_tp_mult': 1.969722621376237, 'sideways_tsl_mult': 0.6425325691332149, 'sideways_time_stop': 59, 'sideways_use_sma': False, 'sideways_use_ema': True, 'sideways_use_atr': False, 'sideways_use_adx': False, 'sideways_use_spike': False, 'sideways_rsi_required': True}.
[I 2025-08-30 21:27:01,496] Trial 312 finished with values: [-1000000000.0, 1000000000.0] and parameters: {'p_sma': 9, 'p_std': 45, 'p_atr': 15, 'p_adx': 13, 'rsi_period': 16, 'ema1': 21, 'ema2': 23, 'slip_atr_k': 0.18589927262285752, 'slip_spread_k': 0.5387446431681674, 'spread_hl_frac': 0.005757876152230879, 'bb_std_mult': 2.3557647561928565, 'rsi_os': 15, 'rsi_ob': 78, 'vol_spike': 0.21942574036795479, 'adx_thresh': 10.098659719981574, 'atr_min_pct': 0.021204237622190956, 'atr_max_pct': 0.11091156678082784, 'tp_mult': 1.3003456940783304, 'tsl_mult': 0.8736269245680301, 'strategy': 'mean_reversion', 'time_stop': 97, 'use_sma': False, 'use_atr': True, 'use_adx': True, 'use_ema': True, 'use_spike': True, 'rsi_required': True, 'edge_k': 1.2024574787184148, 'edge_cap': 0.6612785245036098, 'bull_strategy': 'breakout', 'bull_bb_std_mult': 3.166821125257426, 'bull_rsi_os': 29, 'bull_rsi_ob': 70, 'bull_adx_thresh': 14.124106836128762, 'bull_atr_min_pct': 0.0013764746712117523, 'bull_atr_max_pct': 0.053238535040908, 'bull_tp_mult': 1.0638649447427662, 'bull_tsl_mult': 0.5942455444123662, 'bull_time_stop': 295, 'bull_use_sma': True, 'bull_use_ema': False, 'bull_use_atr': False, 'bull_use_adx': True, 'bull_use_spike': True, 'bull_rsi_required': True, 'bear_strategy': 'mean_reversion', 'bear_bb_std_mult': 2.1228730858564995, 'bear_rsi_os': 8, 'bear_rsi_ob': 81, 'bear_adx_thresh': 17.99512966954214, 'bear_atr_min_pct': 0.02631397113095953, 'bear_atr_max_pct': 0.017356862432073718, 'bear_tp_mult': 2.941309152469457, 'bear_tsl_mult': 0.6173113266847857, 'bear_time_stop': 153, 'bear_use_sma': True, 'bear_use_ema': False, 'bear_use_atr': False, 'bear_use_adx': True, 'bear_use_spike': True, 'bear_rsi_required': True, 'sideways_strategy': 'breakout', 'sideways_bb_std_mult': 0.7541423059275789, 'sideways_rsi_os': 42, 'sideways_rsi_ob': 49, 'sideways_adx_thresh': 5.046404333246585, 'sideways_atr_min_pct': 0.014818672694514694, 'sideways_atr_max_pct': 0.09304876318775654, 'sideways_tp_mult': 1.9755943630976578, 'sideways_tsl_mult': 0.47004063768982063, 'sideways_time_stop': 283, 'sideways_use_sma': False, 'sideways_use_ema': True, 'sideways_use_atr': False, 'sideways_use_adx': False, 'sideways_use_spike': False, 'sideways_rsi_required': True}.
[I 2025-08-30 21:27:01,780] Trial 313 finished with values: [-1000000000.0, 1000000000.0] and parameters: {'p_sma': 30, 'p_std': 36, 'p_atr': 30, 'p_adx': 13, 'rsi_period': 16, 'ema1': 21, 'ema2': 44, 'slip_atr_k': 0.0566964347859612, 'slip_spread_k': 0.5371135284170022, 'spread_hl_frac': 0.023235148516227083, 'bb_std_mult': 1.7330622008044978, 'rsi_os': 8, 'rsi_ob': 78, 'vol_spike': 0.24019749571534685, 'adx_thresh': 29.23452968733678, 'atr_min_pct': 0.020949543949674004, 'atr_max_pct': 0.04552180271308651, 'tp_mult': 1.99338355443589, 'tsl_mult': 0.08773630864990667, 'strategy': 'mean_reversion', 'time_stop': 99, 'use_sma': False, 'use_atr': True, 'use_adx': True, 'use_ema': True, 'use_spike': True, 'rsi_required': True, 'edge_k': 1.2012607723276196, 'edge_cap': 0.06894886043858656, 'bull_strategy': 'breakout', 'bull_bb_std_mult': 3.1578905911162956, 'bull_rsi_os': 34, 'bull_rsi_ob': 70, 'bull_adx_thresh': 20.84153841947419, 'bull_atr_min_pct': 0.0013067594243428636, 'bull_atr_max_pct': 0.05328770069545759, 'bull_tp_mult': 2.2182937899937833, 'bull_tsl_mult': 0.5983797159829368, 'bull_time_stop': 169, 'bull_use_sma': True, 'bull_use_ema': False, 'bull_use_atr': False, 'bull_use_adx': True, 'bull_use_spike': True, 'bull_rsi_required': True, 'bear_strategy': 'mean_reversion', 'bear_bb_std_mult': 2.5698876857209307, 'bear_rsi_os': 8, 'bear_rsi_ob': 52, 'bear_adx_thresh': 18.2094803342085, 'bear_atr_min_pct': 0.013414739077100904, 'bear_atr_max_pct': 0.1159139223415037, 'bear_tp_mult': 2.6744458262379345, 'bear_tsl_mult': 0.9114006355610196, 'bear_time_stop': 225, 'bear_use_sma': True, 'bear_use_ema': True, 'bear_use_atr': False, 'bear_use_adx': True, 'bear_use_spike': True, 'bear_rsi_required': True, 'sideways_strategy': 'breakout', 'sideways_bb_std_mult': 0.7756558581913793, 'sideways_rsi_os': 42, 'sideways_rsi_ob': 76, 'sideways_adx_thresh': 27.073183015126897, 'sideways_atr_min_pct': 0.02672504941342006, 'sideways_atr_max_pct': 0.09347998024516807, 'sideways_tp_mult': 1.9718459782431397, 'sideways_tsl_mult': 0.836938508976754, 'sideways_time_stop': 264, 'sideways_use_sma': False, 'sideways_use_ema': True, 'sideways_use_atr': False, 'sideways_use_adx': False, 'sideways_use_spike': False, 'sideways_rsi_required': True}.
[I 2025-08-30 21:27:01,982] Trial 311 finished with values: [-0.02436727486275303, 0.024291505696598086] and parameters: {'p_sma': 32, 'p_std': 27, 'p_atr': 14, 'p_adx': 13, 'rsi_period': 23, 'ema1': 21, 'ema2': 24, 'slip_atr_k': 0.19036433723766716, 'slip_spread_k': 0.971359198347075, 'spread_hl_frac': 0.022839992319092114, 'bb_std_mult': 1.141542094615807, 'rsi_os': 35, 'rsi_ob': 78, 'vol_spike': 0.2411030619368328, 'adx_thresh': 11.122724061977603, 'atr_min_pct': 0.02117871361382716, 'atr_max_pct': 0.09286297104376193, 'tp_mult': 1.7464206085903609, 'tsl_mult': 0.9208303816617286, 'strategy': 'mean_reversion', 'time_stop': 99, 'use_sma': False, 'use_atr': True, 'use_adx': True, 'use_ema': True, 'use_spike': True, 'rsi_required': True, 'edge_k': 1.421884422903544, 'edge_cap': 0.9977873719816535, 'bull_strategy': 'breakout', 'bull_bb_std_mult': 3.1536273431824244, 'bull_rsi_os': 18, 'bull_rsi_ob': 70, 'bull_adx_thresh': 14.450693387863405, 'bull_atr_min_pct': 0.0012304107004360255, 'bull_atr_max_pct': 0.05388764012266771, 'bull_tp_mult': 2.2852558865605173, 'bull_tsl_mult': 0.7653968899201182, 'bull_time_stop': 295, 'bull_use_sma': True, 'bull_use_ema': False, 'bull_use_atr': False, 'bull_use_adx': True, 'bull_use_spike': True, 'bull_rsi_required': True, 'bear_strategy': 'mean_reversion', 'bear_bb_std_mult': 2.573085818651992, 'bear_rsi_os': 14, 'bear_rsi_ob': 52, 'bear_adx_thresh': 26.30574386128431, 'bear_atr_min_pct': 0.01622100541323966, 'bear_atr_max_pct': 0.056341892909154395, 'bear_tp_mult': 1.9841470365431457, 'bear_tsl_mult': 0.46704516361845166, 'bear_time_stop': 104, 'bear_use_sma': True, 'bear_use_ema': False, 'bear_use_atr': False, 'bear_use_adx': True, 'bear_use_spike': True, 'bear_rsi_required': True, 'sideways_strategy': 'breakout', 'sideways_bb_std_mult': 1.5752636612631543, 'sideways_rsi_os': 42, 'sideways_rsi_ob': 89, 'sideways_adx_thresh': 27.31488289283421, 'sideways_atr_min_pct': 0.016091371273795455, 'sideways_atr_max_pct': 0.09195901921126036, 'sideways_tp_mult': 2.153615351440088, 'sideways_tsl_mult': 0.5013634053323854, 'sideways_time_stop': 284, 'sideways_use_sma': False, 'sideways_use_ema': True, 'sideways_use_atr': True, 'sideways_use_adx': False, 'sideways_use_spike': False, 'sideways_rsi_required': True}.
