[I 2025-08-30 21:29:19,514] Trial 333 finished with values: [-0.017722376284861285, 0.017738750433212488] and parameters: {'p_sma': 30, 'p_std': 30, 'p_atr': 21, 'p_adx': 22, 'rsi_period': 38, 'ema1': 20, 'ema2': 14, 'slip_atr_k': 0.04921592439262782, 'slip_spread_k': 0.02500460858975556, 'spread_hl_frac': 0.007824486023264497, 'bb_std_mult': 1.4770497783221561, 'rsi_os': 29, 'rsi_ob': 60, 'vol_spike': 0.28573334084135715, 'adx_thresh': 12.59038867396846, 'atr_min_pct': 0.027752576081023557, 'atr_max_pct': 0.08604368122964154, 'tp_mult': 1.6438805419460056, 'tsl_mult': 0.9122508994226207, 'strategy': 'mean_reversion', 'time_stop': 283, 'use_sma': True, 'use_atr': False, 'use_adx': True, 'use_ema': True, 'use_spike': True, 'rsi_required': False, 'edge_k': 0.7323629083117444, 'edge_cap': 0.5999896613609457, 'bull_strategy': 'breakout', 'bull_bb_std_mult': 1.1825714505250642, 'bull_rsi_os': 46, 'bull_rsi_ob': 71, 'bull_adx_thresh': 15.197015689454181, 'bull_atr_min_pct': 5.065184105098274e-05, 'bull_atr_max_pct': 0.06085587303932697, 'bull_tp_mult': 1.8103964660688767, 'bull_tsl_mult': 0.3455756964014441, 'bull_time_stop': 84, 'bull_use_sma': True, 'bull_use_ema': False, 'bull_use_atr': False, 'bull_use_adx': True, 'bull_use_spike': True, 'bull_rsi_required': True, 'bear_strategy': 'mean_reversion', 'bear_bb_std_mult': 1.6865560280702854, 'bear_rsi_os': 39, 'bear_rsi_ob': 53, 'bear_adx_thresh': 17.20243928086884, 'bear_atr_min_pct': 0.022685008572788136, 'bear_atr_max_pct': 0.06385580602551362, 'bear_tp_mult': 1.0105709594521923, 'bear_tsl_mult': 0.6823149115816587, 'bear_time_stop': 167, 'bear_use_sma': True, 'bear_use_ema': False, 'bear_use_atr': False, 'bear_use_adx': False, 'bear_use_spike': False, 'bear_rsi_required': True, 'sideways_strategy': 'mean_reversion', 'sideways_bb_std_mult': 1.6867966683314102, 'sideways_rsi_os': 49, 'sideways_rsi_ob': 84, 'sideways_adx_thresh': 26.690232124059694, 'sideways_atr_min_pct': 0.0151317601553429, 'sideways_atr_max_pct': 0.06416909730311447, 'sideways_tp_mult': 2.127010919133536, 'sideways_tsl_mult': 0.5400837608639522, 'sideways_time_stop': 238, 'sideways_use_sma': True, 'sideways_use_ema': True, 'sideways_use_atr': True, 'sideways_use_adx': False, 'sideways_use_spike': True, 'sideways_rsi_required': True}.
[I 2025-08-30 21:29:54,622] Trial 336 finished with values: [-1000000000.0, 1000000000.0] and parameters: {'p_sma': 30, 'p_std': 33, 'p_atr': 13, 'p_adx': 11, 'rsi_period': 21, 'ema1': 20, 'ema2': 49, 'slip_atr_k': 0.13360391809957092, 'slip_spread_k': 0.6444846094297276, 'spread_hl_frac': 0.0071547802957013275, 'bb_std_mult': 1.4593307615445452, 'rsi_os': 9, 'rsi_ob': 67, 'vol_spike': 0.1703433390227142, 'adx_thresh': 12.924716642123007, 'atr_min_pct': 0.004801904923898171, 'atr_max_pct': 0.09642408860477933, 'tp_mult': 1.6619298488034557, 'tsl_mult': 0.07147347459412484, 'strategy': 'mean_reversion', 'time_stop': 285, 'use_sma': True, 'use_atr': True, 'use_adx': True, 'use_ema': True, 'use_spike': True, 'rsi_required': False, 'edge_k': 1.8630574368767299, 'edge_cap': 0.672158650622097, 'bull_strategy': 'breakout', 'bull_bb_std_mult': 1.4840429474947703, 'bull_rsi_os': 16, 'bull_rsi_ob': 71, 'bull_adx_thresh': 15.404785129964553, 'bull_atr_min_pct': 0.028195391433635697, 'bull_atr_max_pct': 0.05172216805508338, 'bull_tp_mult': 2.0064358891634213, 'bull_tsl_mult': 0.9941345117640111, 'bull_time_stop': 9, 'bull_use_sma': True, 'bull_use_ema': False, 'bull_use_atr': False, 'bull_use_adx': True, 'bull_use_spike': True, 'bull_rsi_required': False, 'bear_strategy': 'breakout', 'bear_bb_std_mult': 1.1342655640796298, 'bear_rsi_os': 5, 'bear_rsi_ob': 53, 'bear_adx_thresh': 29.0936689269597, 'bear_atr_min_pct': 0.014798765315410354, 'bear_atr_max_pct': 0.010047882115211711, 'bear_tp_mult': 1.2394711346730714, 'bear_tsl_mult': 0.4951298513443547, 'bear_time_stop': 88, 'bear_use_sma': True, 'bear_use_ema': False, 'bear_use_atr': True, 'bear_use_adx': False, 'bear_use_spike': False, 'bear_rsi_required': True, 'sideways_strategy': 'mean_reversion', 'sideways_bb_std_mult': 1.667726517478776, 'sideways_rsi_os': 41, 'sideways_rsi_ob': 91, 'sideways_adx_thresh': 24.89274936947986, 'sideways_atr_min_pct': 0.014957108674370384, 'sideways_atr_max_pct': 0.10127139262906883, 'sideways_tp_mult': 2.9005468257011766, 'sideways_tsl_mult': 0.7244990907519828, 'sideways_time_stop': 41, 'sideways_use_sma': True, 'sideways_use_ema': True, 'sideways_use_atr': True, 'sideways_use_adx': False, 'sideways_use_spike': True, 'sideways_rsi_required': True}.
[I 2025-08-30 21:29:54,762] Trial 335 finished with values: [-1000000000.0, 1000000000.0] and parameters: {'p_sma': 38, 'p_std': 31, 'p_atr': 17, 'p_adx': 9, 'rsi_period': 49, 'ema1': 20, 'ema2': 57, 'slip_atr_k': 0.13756503557542296, 'slip_spread_k': 0.2812157695055217, 'spread_hl_frac': 0.007446492524041892, 'bb_std_mult': 1.7115601285462858, 'rsi_os': 9, 'rsi_ob': 89, 'vol_spike': 0.17222403476219952, 'adx_thresh': 14.614744759192511, 'atr_min_pct': 0.028113033382319234, 'atr_max_pct': 0.060718619196278675, 'tp_mult': 1.6709483307284287, 'tsl_mult': 0.9146458734774878, 'strategy': 'breakout', 'time_stop': 118, 'use_sma': True, 'use_atr': True, 'use_adx': False, 'use_ema': True, 'use_spike': False, 'rsi_required': False, 'edge_k': 1.7049602063414027, 'edge_cap': 0.6018466860110264, 'bull_strategy': 'breakout', 'bull_bb_std_mult': 3.5194611657632917, 'bull_rsi_os': 16, 'bull_rsi_ob': 50, 'bull_adx_thresh': 19.580379923271003, 'bull_atr_min_pct': 0.001956859366907363, 'bull_atr_max_pct': 0.10249026503807158, 'bull_tp_mult': 1.6580250048300287, 'bull_tsl_mult': 0.35165696923162526, 'bull_time_stop': 129, 'bull_use_sma': True, 'bull_use_ema': False, 'bull_use_atr': True, 'bull_use_adx': True, 'bull_use_spike': True, 'bull_rsi_required': False, 'bear_strategy': 'breakout', 'bear_bb_std_mult': 2.6181575522850133, 'bear_rsi_os': 6, 'bear_rsi_ob': 53, 'bear_adx_thresh': 16.232056860464898, 'bear_atr_min_pct': 0.014761458547875413, 'bear_atr_max_pct': 0.05157458699908131, 'bear_tp_mult': 2.8404660984332164, 'bear_tsl_mult': 0.6691137044309071, 'bear_time_stop': 87, 'bear_use_sma': True, 'bear_use_ema': False, 'bear_use_atr': True, 'bear_use_adx': False, 'bear_use_spike': False, 'bear_rsi_required': False, 'sideways_strategy': 'mean_reversion', 'sideways_bb_std_mult': 3.1553515893925184, 'sideways_rsi_os': 44, 'sideways_rsi_ob': 84, 'sideways_adx_thresh': 20.272324586817525, 'sideways_atr_min_pct': 0.024222938994214738, 'sideways_atr_max_pct': 0.06572552993687854, 'sideways_tp_mult': 2.933548282750222, 'sideways_tsl_mult': 0.4884340746744521, 'sideways_time_stop': 46, 'sideways_use_sma': True, 'sideways_use_ema': True, 'sideways_use_atr': True, 'sideways_use_adx': False, 'sideways_use_spike': True, 'sideways_rsi_required': True}.
[I 2025-08-30 21:29:55,047] Trial 334 finished with values: [-0.020975474280286455, 0.020904394553402237] and parameters: {'p_sma': 30, 'p_std': 31, 'p_atr': 13, 'p_adx': 11, 'rsi_period': 52, 'ema1': 20, 'ema2': 13, 'slip_atr_k': 0.13556469435075816, 'slip_spread_k': 0.5750636083001992, 'spread_hl_frac': 0.007306016508481385, 'bb_std_mult': 1.692080549064386, 'rsi_os': 9, 'rsi_ob': 89, 'vol_spike': 0.18187200501019476, 'adx_thresh': 12.798058389208084, 'atr_min_pct': 0.009300957930758484, 'atr_max_pct': 0.09697145701056348, 'tp_mult': 1.652110082939706, 'tsl_mult': 0.9091246866815029, 'strategy': 'breakout', 'time_stop': 283, 'use_sma': True, 'use_atr': True, 'use_adx': False, 'use_ema': True, 'use_spike': False, 'rsi_required': False, 'edge_k': 0.7220262028384407, 'edge_cap': 0.6796327519849295, 'bull_strategy': 'breakout', 'bull_bb_std_mult': 3.5267432511212324, 'bull_rsi_os': 16, 'bull_rsi_ob': 71, 'bull_adx_thresh': 15.231312541377443, 'bull_atr_min_pct': 0.0009902007667367877, 'bull_atr_max_pct': 0.1405318204810861, 'bull_tp_mult': 2.439029451403714, 'bull_tsl_mult': 0.46545162968367043, 'bull_time_stop': 289, 'bull_use_sma': True, 'bull_use_ema': False, 'bull_use_atr': True, 'bull_use_adx': True, 'bull_use_spike': True, 'bull_rsi_required': False, 'bear_strategy': 'breakout', 'bear_bb_std_mult': 2.6302118074932923, 'bear_rsi_os': 39, 'bear_rsi_ob': 53, 'bear_adx_thresh': 16.696933825150243, 'bear_atr_min_pct': 0.014790272589396893, 'bear_atr_max_pct': 0.012804380713380659, 'bear_tp_mult': 1.8921714306260546, 'bear_tsl_mult': 0.49524787548056526, 'bear_time_stop': 130, 'bear_use_sma': True, 'bear_use_ema': False, 'bear_use_atr': True, 'bear_use_adx': False, 'bear_use_spike': False, 'bear_rsi_required': False, 'sideways_strategy': 'mean_reversion', 'sideways_bb_std_mult': 1.3101126220777486, 'sideways_rsi_os': 41, 'sideways_rsi_ob': 51, 'sideways_adx_thresh': 24.974541637913628, 'sideways_atr_min_pct': 0.01501398349717435, 'sideways_atr_max_pct': 0.043276159827018455, 'sideways_tp_mult': 2.9236057103479887, 'sideways_tsl_mult': 0.5206513528117022, 'sideways_time_stop': 44, 'sideways_use_sma': True, 'sideways_use_ema': True, 'sideways_use_atr': True, 'sideways_use_adx': False, 'sideways_use_spike': True, 'sideways_rsi_required': True}.
[I 2025-08-30 21:29:55,313] Trial 337 finished with values: [-1000000000.0, 1000000000.0] and parameters: {'p_sma': 30, 'p_std': 30, 'p_atr': 13, 'p_adx': 30, 'rsi_period': 8, 'ema1': 20, 'ema2': 11, 'slip_atr_k': 0.13602980583267574, 'slip_spread_k': 0.27199192882065, 'spread_hl_frac': 0.008109356661964218, 'bb_std_mult': 1.4532010583861517, 'rsi_os': 9, 'rsi_ob': 80, 'vol_spike': 0.06335567647749932, 'adx_thresh': 14.691250682540751, 'atr_min_pct': 0.02069570634551948, 'atr_max_pct': 0.08654615513265396, 'tp_mult': 1.6431277441402672, 'tsl_mult': 0.30167353792456164, 'strategy': 'breakout', 'time_stop': 118, 'use_sma': True, 'use_atr': True, 'use_adx': False, 'use_ema': True, 'use_spike': False, 'rsi_required': False, 'edge_k': 0.7191507133252496, 'edge_cap': 0.5977627018682409, 'bull_strategy': 'breakout', 'bull_bb_std_mult': 1.483193116243468, 'bull_rsi_os': 21, 'bull_rsi_ob': 72, 'bull_adx_thresh': 34.9677636339347, 'bull_atr_min_pct': 1.3601775332003699e-05, 'bull_atr_max_pct': 0.050960315192094395, 'bull_tp_mult': 2.4291048787397207, 'bull_tsl_mult': 0.2722669939865937, 'bull_time_stop': 8, 'bull_use_sma': True, 'bull_use_ema': True, 'bull_use_atr': True, 'bull_use_adx': True, 'bull_use_spike': True, 'bull_rsi_required': False, 'bear_strategy': 'breakout', 'bear_bb_std_mult': 2.6343834877399552, 'bear_rsi_os': 39, 'bear_rsi_ob': 53, 'bear_adx_thresh': 29.139890532259216, 'bear_atr_min_pct': 0.01462970519104572, 'bear_atr_max_pct': 0.043146488212427433, 'bear_tp_mult': 1.8900688058118211, 'bear_tsl_mult': 0.6673515469836654, 'bear_time_stop': 41, 'bear_use_sma': True, 'bear_use_ema': False, 'bear_use_atr': True, 'bear_use_adx': False, 'bear_use_spike': False, 'bear_rsi_required': False, 'sideways_strategy': 'mean_reversion', 'sideways_bb_std_mult': 1.6347015831499025, 'sideways_rsi_os': 41, 'sideways_rsi_ob': 79, 'sideways_adx_thresh': 25.238645294392, 'sideways_atr_min_pct': 0.014930717890525042, 'sideways_atr_max_pct': 0.06537018062062779, 'sideways_tp_mult': 1.2727722204462144, 'sideways_tsl_mult': 0.5407519009033706, 'sideways_time_stop': 245, 'sideways_use_sma': True, 'sideways_use_ema': True, 'sideways_use_atr': True, 'sideways_use_adx': True, 'sideways_use_spike': True, 'sideways_rsi_required': True}.
[I 2025-08-30 21:30:28,258] Trial 341 finished with values: [-1000000000.0, 1000000000.0] and parameters: {'p_sma': 43, 'p_std': 36, 'p_atr': 20, 'p_adx': 29, 'rsi_period': 52, 'ema1': 29, 'ema2': 27, 'slip_atr_k': 0.029044960779775142, 'slip_spread_k': 0.5731991038802239, 'spread_hl_frac': 0.0033898185981506516, 'bb_std_mult': 3.446476788718779, 'rsi_os': 13, 'rsi_ob': 59, 'vol_spike': 0.2748891627526598, 'adx_thresh': 29.21602598122106, 'atr_min_pct': 0.023349256028076137, 'atr_max_pct': 0.07797023550578529, 'tp_mult': 2.2335758785103215, 'tsl_mult': 0.958447204002601, 'strategy': 'mean_reversion', 'time_stop': 30, 'use_sma': False, 'use_atr': False, 'use_adx': True, 'use_ema': False, 'use_spike': True, 'rsi_required': True, 'edge_k': 1.152962826930171, 'edge_cap': 0.5762079928036944, 'bull_strategy': 'mean_reversion', 'bull_bb_std_mult': 3.282493066362172, 'bull_rsi_os': 19, 'bull_rsi_ob': 69, 'bull_adx_thresh': 10.354852473917337, 'bull_atr_min_pct': 0.0017013500152377016, 'bull_atr_max_pct': 0.07911529258725816, 'bull_tp_mult': 2.4487199089132092, 'bull_tsl_mult': 0.460099954478388, 'bull_time_stop': 98, 'bull_use_sma': False, 'bull_use_ema': True, 'bull_use_atr': False, 'bull_use_adx': False, 'bull_use_spike': False, 'bull_rsi_required': True, 'bear_strategy': 'mean_reversion', 'bear_bb_std_mult': 2.466812145242517, 'bear_rsi_os': 39, 'bear_rsi_ob': 45, 'bear_adx_thresh': 13.406927053565965, 'bear_atr_min_pct': 0.016687978601370935, 'bear_atr_max_pct': 0.06265064336374962, 'bear_tp_mult': 2.531142513656948, 'bear_tsl_mult': 0.4635929591366237, 'bear_time_stop': 144, 'bear_use_sma': False, 'bear_use_ema': False, 'bear_use_atr': False, 'bear_use_adx': True, 'bear_use_spike': True, 'bear_rsi_required': True, 'sideways_strategy': 'breakout', 'sideways_bb_std_mult': 1.5806223592132718, 'sideways_rsi_os': 40, 'sideways_rsi_ob': 90, 'sideways_adx_thresh': 26.566816924776802, 'sideways_atr_min_pct': 0.013025242334683471, 'sideways_atr_max_pct': 0.09469324503739765, 'sideways_tp_mult': 1.1380537330417226, 'sideways_tsl_mult': 0.4409879277194177, 'sideways_time_stop': 261, 'sideways_use_sma': False, 'sideways_use_ema': False, 'sideways_use_atr': False, 'sideways_use_adx': False, 'sideways_use_spike': False, 'sideways_rsi_required': False}.
[I 2025-08-30 21:30:28,582] Trial 340 finished with values: [-1000000000.0, 1000000000.0] and parameters: {'p_sma': 31, 'p_std': 35, 'p_atr': 16, 'p_adx': 29, 'rsi_period': 17, 'ema1': 9, 'ema2': 60, 'slip_atr_k': 0.029405183854781254, 'slip_spread_k': 0.3882513512526239, 'spread_hl_frac': 0.0034511244586619347, 'bb_std_mult': 1.5769262655791072, 'rsi_os': 8, 'rsi_ob': 80, 'vol_spike': 0.18134038753080334, 'adx_thresh': 29.275303928757932, 'atr_min_pct': 0.023566512398045168, 'atr_max_pct': 0.08632999057688281, 'tp_mult': 1.408458006580784, 'tsl_mult': 0.3082450488855773, 'strategy': 'mean_reversion', 'time_stop': 107, 'use_sma': False, 'use_atr': False, 'use_adx': True, 'use_ema': False, 'use_spike': True, 'rsi_required': True, 'edge_k': 0.9722746491386967, 'edge_cap': 0.5727486813011059, 'bull_strategy': 'mean_reversion', 'bull_bb_std_mult': 3.283320446316795, 'bull_rsi_os': 21, 'bull_rsi_ob': 52, 'bull_adx_thresh': 14.74021731667759, 'bull_atr_min_pct': 0.001810281603590915, 'bull_atr_max_pct': 0.06080615330728482, 'bull_tp_mult': 2.4325086420207205, 'bull_tsl_mult': 0.4643492156959427, 'bull_time_stop': 287, 'bull_use_sma': False, 'bull_use_ema': True, 'bull_use_atr': False, 'bull_use_adx': False, 'bull_use_spike': True, 'bull_rsi_required': True, 'bear_strategy': 'mean_reversion', 'bear_bb_std_mult': 1.4684421768723133, 'bear_rsi_os': 39, 'bear_rsi_ob': 51, 'bear_adx_thresh': 25.267277741565255, 'bear_atr_min_pct': 0.01676448806160742, 'bear_atr_max_pct': 0.11966817012535366, 'bear_tp_mult': 1.8657227455853265, 'bear_tsl_mult': 0.4206199625692601, 'bear_time_stop': 100, 'bear_use_sma': True, 'bear_use_ema': False, 'bear_use_atr': False, 'bear_use_adx': True, 'bear_use_spike': True, 'bear_rsi_required': True, 'sideways_strategy': 'breakout', 'sideways_bb_std_mult': 1.6175895514244787, 'sideways_rsi_os': 40, 'sideways_rsi_ob': 88, 'sideways_adx_thresh': 29.27529907643224, 'sideways_atr_min_pct': 0.015322042410858563, 'sideways_atr_max_pct': 0.03571564305570438, 'sideways_tp_mult': 2.132364591785405, 'sideways_tsl_mult': 0.5298113400703196, 'sideways_time_stop': 11, 'sideways_use_sma': False, 'sideways_use_ema': True, 'sideways_use_atr': True, 'sideways_use_adx': True, 'sideways_use_spike': False, 'sideways_rsi_required': True}.
[I 2025-08-30 21:30:28,608] Trial 339 finished with values: [-1000000000.0, 1000000000.0] and parameters: {'p_sma': 28, 'p_std': 36, 'p_atr': 16, 'p_adx': 30, 'rsi_period': 52, 'ema1': 21, 'ema2': 14, 'slip_atr_k': 0.048170167889257265, 'slip_spread_k': 0.4449238567703045, 'spread_hl_frac': 0.003524267813333342, 'bb_std_mult': 1.6864715043004335, 'rsi_os': 8, 'rsi_ob': 80, 'vol_spike': 0.27605409111336404, 'adx_thresh': 29.41965674463034, 'atr_min_pct': 0.020598708965027523, 'atr_max_pct': 0.06696426820623784, 'tp_mult': 2.9612413007489877, 'tsl_mult': 0.9827348684237385, 'strategy': 'mean_reversion', 'time_stop': 127, 'use_sma': False, 'use_atr': False, 'use_adx': True, 'use_ema': False, 'use_spike': True, 'rsi_required': True, 'edge_k': 0.9714535656209804, 'edge_cap': 0.5728505072249005, 'bull_strategy': 'mean_reversion', 'bull_bb_std_mult': 3.27992026708947, 'bull_rsi_os': 12, 'bull_rsi_ob': 58, 'bull_adx_thresh': 26.102968940719336, 'bull_atr_min_pct': 0.0018539946567744233, 'bull_atr_max_pct': 0.13008814321230658, 'bull_tp_mult': 2.4390269767073107, 'bull_tsl_mult': 0.47584250799329064, 'bull_time_stop': 84, 'bull_use_sma': False, 'bull_use_ema': True, 'bull_use_atr': False, 'bull_use_adx': False, 'bull_use_spike': False, 'bull_rsi_required': True, 'bear_strategy': 'mean_reversion', 'bear_bb_std_mult': 1.8009603887515417, 'bear_rsi_os': 11, 'bear_rsi_ob': 52, 'bear_adx_thresh': 9.050713322542553, 'bear_atr_min_pct': 0.004408327972536753, 'bear_atr_max_pct': 0.11942591482008072, 'bear_tp_mult': 2.5348252359888015, 'bear_tsl_mult': 0.46422308757264036, 'bear_time_stop': 61, 'bear_use_sma': False, 'bear_use_ema': False, 'bear_use_atr': False, 'bear_use_adx': True, 'bear_use_spike': True, 'bear_rsi_required': True, 'sideways_strategy': 'breakout', 'sideways_bb_std_mult': 1.6324580615653383, 'sideways_rsi_os': 26, 'sideways_rsi_ob': 79, 'sideways_adx_thresh': 29.23773595194476, 'sideways_atr_min_pct': 0.005327324697666043, 'sideways_atr_max_pct': 0.09425055717225157, 'sideways_tp_mult': 2.1193378036695214, 'sideways_tsl_mult': 0.4393461743965333, 'sideways_time_stop': 198, 'sideways_use_sma': False, 'sideways_use_ema': False, 'sideways_use_atr': False, 'sideways_use_adx': True, 'sideways_use_spike': False, 'sideways_rsi_required': False}.
[I 2025-08-30 21:30:28,743] Trial 338 finished with values: [-1000000000.0, 1000000000.0] and parameters: {'p_sma': 28, 'p_std': 21, 'p_atr': 16, 'p_adx': 18, 'rsi_period': 8, 'ema1': 21, 'ema2': 27, 'slip_atr_k': 0.05030662849493407, 'slip_spread_k': 0.573180804548605, 'spread_hl_frac': 0.0015707329224118852, 'bb_std_mult': 1.704807259792408, 'rsi_os': 13, 'rsi_ob': 89, 'vol_spike': 0.27436216737503344, 'adx_thresh': 29.38219061555598, 'atr_min_pct': 0.027780111991677663, 'atr_max_pct': 0.08564204567414883, 'tp_mult': 1.5479063607859629, 'tsl_mult': 0.29671317280589515, 'strategy': 'breakout', 'time_stop': 118, 'use_sma': False, 'use_atr': False, 'use_adx': False, 'use_ema': False, 'use_spike': False, 'rsi_required': False, 'edge_k': 0.7262972100798952, 'edge_cap': 0.33405977936092157, 'bull_strategy': 'mean_reversion', 'bull_bb_std_mult': 3.5387185286646288, 'bull_rsi_os': 7, 'bull_rsi_ob': 69, 'bull_adx_thresh': 14.815303277082773, 'bull_atr_min_pct': 3.0897679999995005e-05, 'bull_atr_max_pct': 0.12633014896852052, 'bull_tp_mult': 2.4311546239229163, 'bull_tsl_mult': 0.35711679544515884, 'bull_time_stop': 107, 'bull_use_sma': True, 'bull_use_ema': True, 'bull_use_atr': True, 'bull_use_adx': False, 'bull_use_spike': False, 'bull_rsi_required': True, 'bear_strategy': 'mean_reversion', 'bear_bb_std_mult': 2.6524506959604968, 'bear_rsi_os': 39, 'bear_rsi_ob': 52, 'bear_adx_thresh': 16.449522556009747, 'bear_atr_min_pct': 0.016684383255199497, 'bear_atr_max_pct': 0.012685368036741808, 'bear_tp_mult': 2.840045396184094, 'bear_tsl_mult': 0.8819364044648065, 'bear_time_stop': 63, 'bear_use_sma': False, 'bear_use_ema': False, 'bear_use_atr': False, 'bear_use_adx': True, 'bear_use_spike': False, 'bear_rsi_required': False, 'sideways_strategy': 'breakout', 'sideways_bb_std_mult': 1.59740715742576, 'sideways_rsi_os': 26, 'sideways_rsi_ob': 89, 'sideways_adx_thresh': 26.6049789327411, 'sideways_atr_min_pct': 0.016786481052691225, 'sideways_atr_max_pct': 0.04370084605852722, 'sideways_tp_mult': 2.1266063156481656, 'sideways_tsl_mult': 0.9467229063067152, 'sideways_time_stop': 200, 'sideways_use_sma': True, 'sideways_use_ema': False, 'sideways_use_atr': False, 'sideways_use_adx': True, 'sideways_use_spike': True, 'sideways_rsi_required': False}.
