[I 2025-08-30 21:36:56,007] Trial 386 finished with values: [-1000000000.0, 1000000000.0] and parameters: {'p_sma': 8, 'p_std': 30, 'p_atr': 19, 'p_adx': 24, 'rsi_period': 68, 'ema1': 19, 'ema2': 37, 'slip_atr_k': 0.028496582300681538, 'slip_spread_k': 0.9280791014031168, 'spread_hl_frac': 0.031221074109588662, 'bb_std_mult': 1.5169754426271338, 'rsi_os': 24, 'rsi_ob': 60, 'vol_spike': 0.2055028716032909, 'adx_thresh': 16.303999681287088, 'atr_min_pct': 0.013342161966408216, 'atr_max_pct': 0.09661713643723152, 'tp_mult': 2.469620314016858, 'tsl_mult': 0.841718383221614, 'strategy': 'mean_reversion', 'time_stop': 129, 'use_sma': True, 'use_atr': True, 'use_adx': False, 'use_ema': True, 'use_spike': False, 'rsi_required': False, 'edge_k': 1.2931445820820744, 'edge_cap': 0.6658038998460165, 'bull_strategy': 'breakout', 'bull_bb_std_mult': 3.0746015472591215, 'bull_rsi_os': 8, 'bull_rsi_ob': 93, 'bull_adx_thresh': 14.175023901046616, 'bull_atr_min_pct': 0.002197404456811431, 'bull_atr_max_pct': 0.03790117326027552, 'bull_tp_mult': 2.224520548778558, 'bull_tsl_mult': 0.3575738264895625, 'bull_time_stop': 294, 'bull_use_sma': True, 'bull_use_ema': False, 'bull_use_atr': False, 'bull_use_adx': True, 'bull_use_spike': False, 'bull_rsi_required': False, 'bear_strategy': 'breakout', 'bear_bb_std_mult': 1.7502848286808923, 'bear_rsi_os': 37, 'bear_rsi_ob': 80, 'bear_adx_thresh': 13.636396671181739, 'bear_atr_min_pct': 0.029025333408123317, 'bear_atr_max_pct': 0.010075260806303594, 'bear_tp_mult': 1.6565049831553105, 'bear_tsl_mult': 0.6360500993489365, 'bear_time_stop': 271, 'bear_use_sma': False, 'bear_use_ema': True, 'bear_use_atr': True, 'bear_use_adx': False, 'bear_use_spike': False, 'bear_rsi_required': False, 'sideways_strategy': 'mean_reversion', 'sideways_bb_std_mult': 1.8538758194400566, 'sideways_rsi_os': 28, 'sideways_rsi_ob': 85, 'sideways_adx_thresh': 28.063712540278125, 'sideways_atr_min_pct': 0.01762524766445354, 'sideways_atr_max_pct': 0.14264762170387538, 'sideways_tp_mult': 2.0261838632315503, 'sideways_tsl_mult': 0.56429343504851, 'sideways_time_stop': 281, 'sideways_use_sma': True, 'sideways_use_ema': False, 'sideways_use_atr': False, 'sideways_use_adx': True, 'sideways_use_spike': True, 'sideways_rsi_required': False}.
[I 2025-08-30 21:36:56,110] Trial 385 finished with values: [-1000000000.0, 1000000000.0] and parameters: {'p_sma': 25, 'p_std': 31, 'p_atr': 19, 'p_adx': 22, 'rsi_period': 74, 'ema1': 17, 'ema2': 60, 'slip_atr_k': 0.01746881756190699, 'slip_spread_k': 0.6734453637743928, 'spread_hl_frac': 0.0328312220013257, 'bb_std_mult': 1.4222974310761052, 'rsi_os': 10, 'rsi_ob': 62, 'vol_spike': 0.29201888820916033, 'adx_thresh': 16.088565505760496, 'atr_min_pct': 0.0082238411527597, 'atr_max_pct': 0.09875422323372618, 'tp_mult': 2.2039783820112726, 'tsl_mult': 0.8384676959249137, 'strategy': 'mean_reversion', 'time_stop': 84, 'use_sma': True, 'use_atr': True, 'use_adx': False, 'use_ema': True, 'use_spike': False, 'rsi_required': False, 'edge_k': 1.1852116638777037, 'edge_cap': 0.6677367203905497, 'bull_strategy': 'breakout', 'bull_bb_std_mult': 2.7648826502243438, 'bull_rsi_os': 30, 'bull_rsi_ob': 82, 'bull_adx_thresh': 13.946223032880773, 'bull_atr_min_pct': 0.0023703725850667094, 'bull_atr_max_pct': 0.037688145360721355, 'bull_tp_mult': 1.011644684962853, 'bull_tsl_mult': 0.35623312561542214, 'bull_time_stop': 212, 'bull_use_sma': False, 'bull_use_ema': False, 'bull_use_atr': False, 'bull_use_adx': True, 'bull_use_spike': False, 'bull_rsi_required': False, 'bear_strategy': 'breakout', 'bear_bb_std_mult': 2.7331384011331736, 'bear_rsi_os': 36, 'bear_rsi_ob': 75, 'bear_adx_thresh': 13.847510506168396, 'bear_atr_min_pct': 0.028771106680575746, 'bear_atr_max_pct': 0.07395515750012674, 'bear_tp_mult': 1.6637008775189899, 'bear_tsl_mult': 0.31681920403653546, 'bear_time_stop': 84, 'bear_use_sma': False, 'bear_use_ema': True, 'bear_use_atr': True, 'bear_use_adx': False, 'bear_use_spike': False, 'bear_rsi_required': False, 'sideways_strategy': 'mean_reversion', 'sideways_bb_std_mult': 1.8027226597586143, 'sideways_rsi_os': 7, 'sideways_rsi_ob': 85, 'sideways_adx_thresh': 29.172587595426144, 'sideways_atr_min_pct': 0.017681064262945037, 'sideways_atr_max_pct': 0.14265547618325825, 'sideways_tp_mult': 2.030161970571938, 'sideways_tsl_mult': 0.8747187328381967, 'sideways_time_stop': 283, 'sideways_use_sma': True, 'sideways_use_ema': False, 'sideways_use_atr': False, 'sideways_use_adx': True, 'sideways_use_spike': True, 'sideways_rsi_required': False}.
[I 2025-08-30 21:36:56,815] Trial 392 finished with values: [-1000000000.0, 1000000000.0] and parameters: {'p_sma': 30, 'p_std': 35, 'p_atr': 24, 'p_adx': 21, 'rsi_period': 84, 'ema1': 13, 'ema2': 48, 'slip_atr_k': 0.194385436871005, 'slip_spread_k': 0.33072491007801363, 'spread_hl_frac': 0.024900937856859574, 'bb_std_mult': 1.26306448456261, 'rsi_os': 31, 'rsi_ob': 69, 'vol_spike': 0.10020697664271494, 'adx_thresh': 11.71235469752446, 'atr_min_pct': 0.014625078666961527, 'atr_max_pct': 0.010742503643767623, 'tp_mult': 1.3315175204013379, 'tsl_mult': 0.877896155352093, 'strategy': 'mean_reversion', 'time_stop': 250, 'use_sma': True, 'use_atr': True, 'use_adx': True, 'use_ema': False, 'use_spike': True, 'rsi_required': True, 'edge_k': 1.0416591313393613, 'edge_cap': 0.9345593145058553, 'bull_strategy': 'mean_reversion', 'bull_bb_std_mult': 2.7278793525281735, 'bull_rsi_os': 14, 'bull_rsi_ob': 87, 'bull_adx_thresh': 28.764606176049234, 'bull_atr_min_pct': 0.020490681471466737, 'bull_atr_max_pct': 0.04550522128356356, 'bull_tp_mult': 2.2862026827693165, 'bull_tsl_mult': 0.7986125880272059, 'bull_time_stop': 90, 'bull_use_sma': True, 'bull_use_ema': True, 'bull_use_atr': False, 'bull_use_adx': False, 'bull_use_spike': False, 'bull_rsi_required': True, 'bear_strategy': 'mean_reversion', 'bear_bb_std_mult': 0.530244461980306, 'bear_rsi_os': 25, 'bear_rsi_ob': 72, 'bear_adx_thresh': 14.806135266608202, 'bear_atr_min_pct': 0.02981420144966495, 'bear_atr_max_pct': 0.01498493800103251, 'bear_tp_mult': 1.528777916227134, 'bear_tsl_mult': 0.7893942377341945, 'bear_time_stop': 5, 'bear_use_sma': False, 'bear_use_ema': True, 'bear_use_atr': False, 'bear_use_adx': True, 'bear_use_spike': True, 'bear_rsi_required': True, 'sideways_strategy': 'breakout', 'sideways_bb_std_mult': 1.6551699066475467, 'sideways_rsi_os': 39, 'sideways_rsi_ob': 54, 'sideways_adx_thresh': 15.075780181771483, 'sideways_atr_min_pct': 0.01965293849234346, 'sideways_atr_max_pct': 0.13557370825451354, 'sideways_tp_mult': 1.28642606207818, 'sideways_tsl_mult': 0.6965699039049387, 'sideways_time_stop': 51, 'sideways_use_sma': False, 'sideways_use_ema': False, 'sideways_use_atr': False, 'sideways_use_adx': True, 'sideways_use_spike': False, 'sideways_rsi_required': False}.
[I 2025-08-30 21:37:27,595] Trial 390 finished with values: [-1000000000.0, 1000000000.0] and parameters: {'p_sma': 58, 'p_std': 35, 'p_atr': 23, 'p_adx': 22, 'rsi_period': 83, 'ema1': 30, 'ema2': 57, 'slip_atr_k': 0.15641704039047244, 'slip_spread_k': 0.7146589588745909, 'spread_hl_frac': 0.029760158420567905, 'bb_std_mult': 1.3819133245486426, 'rsi_os': 30, 'rsi_ob': 68, 'vol_spike': 0.2938763430760964, 'adx_thresh': 18.20767714384256, 'atr_min_pct': 0.012591489426101452, 'atr_max_pct': 0.09489645093148959, 'tp_mult': 1.053567335970258, 'tsl_mult': 0.8796727038689172, 'strategy': 'mean_reversion', 'time_stop': 150, 'use_sma': True, 'use_atr': True, 'use_adx': True, 'use_ema': True, 'use_spike': True, 'rsi_required': True, 'edge_k': 1.4805279729248695, 'edge_cap': 0.688700565072895, 'bull_strategy': 'mean_reversion', 'bull_bb_std_mult': 2.7566432993936707, 'bull_rsi_os': 14, 'bull_rsi_ob': 95, 'bull_adx_thresh': 15.140582505899097, 'bull_atr_min_pct': 0.007640926224574198, 'bull_atr_max_pct': 0.1425293426628677, 'bull_tp_mult': 1.0295461960791155, 'bull_tsl_mult': 0.31870209162785745, 'bull_time_stop': 271, 'bull_use_sma': True, 'bull_use_ema': True, 'bull_use_atr': False, 'bull_use_adx': False, 'bull_use_spike': False, 'bull_rsi_required': True, 'bear_strategy': 'mean_reversion', 'bear_bb_std_mult': 2.5453452030886887, 'bear_rsi_os': 25, 'bear_rsi_ob': 73, 'bear_adx_thresh': 13.028487949297272, 'bear_atr_min_pct': 0.029993966100758572, 'bear_atr_max_pct': 0.016122324950443096, 'bear_tp_mult': 1.5254496619218987, 'bear_tsl_mult': 0.7038642264623584, 'bear_time_stop': 106, 'bear_use_sma': False, 'bear_use_ema': True, 'bear_use_atr': False, 'bear_use_adx': True, 'bear_use_spike': True, 'bear_rsi_required': True, 'sideways_strategy': 'breakout', 'sideways_bb_std_mult': 1.9825157499741592, 'sideways_rsi_os': 7, 'sideways_rsi_ob': 77, 'sideways_adx_thresh': 27.197345489283542, 'sideways_atr_min_pct': 0.022960754466248984, 'sideways_atr_max_pct': 0.13526754215852213, 'sideways_tp_mult': 2.4631329329527367, 'sideways_tsl_mult': 0.7175050442560575, 'sideways_time_stop': 49, 'sideways_use_sma': False, 'sideways_use_ema': False, 'sideways_use_atr': False, 'sideways_use_adx': True, 'sideways_use_spike': False, 'sideways_rsi_required': False}.
[I 2025-08-30 21:37:28,418] Trial 389 finished with values: [-1000000000.0, 1000000000.0] and parameters: {'p_sma': 19, 'p_std': 35, 'p_atr': 19, 'p_adx': 22, 'rsi_period': 83, 'ema1': 14, 'ema2': 35, 'slip_atr_k': 0.029131300872889527, 'slip_spread_k': 0.5986563939431652, 'spread_hl_frac': 0.0314220712706626, 'bb_std_mult': 1.4174146826876586, 'rsi_os': 24, 'rsi_ob': 72, 'vol_spike': 0.290735993215686, 'adx_thresh': 11.74675436943808, 'atr_min_pct': 0.013198543814206192, 'atr_max_pct': 0.09746898753754311, 'tp_mult': 2.194597490489161, 'tsl_mult': 0.1775097874561552, 'strategy': 'mean_reversion', 'time_stop': 282, 'use_sma': True, 'use_atr': True, 'use_adx': True, 'use_ema': True, 'use_spike': True, 'rsi_required': True, 'edge_k': 1.0564703800008406, 'edge_cap': 0.21310525956402232, 'bull_strategy': 'mean_reversion', 'bull_bb_std_mult': 2.722146656176878, 'bull_rsi_os': 14, 'bull_rsi_ob': 93, 'bull_adx_thresh': 13.999966298195382, 'bull_atr_min_pct': 0.020550860991633287, 'bull_atr_max_pct': 0.04564412710866987, 'bull_tp_mult': 2.9330483483381595, 'bull_tsl_mult': 0.8000178979798659, 'bull_time_stop': 214, 'bull_use_sma': True, 'bull_use_ema': False, 'bull_use_atr': False, 'bull_use_adx': False, 'bull_use_spike': False, 'bull_rsi_required': True, 'bear_strategy': 'mean_reversion', 'bear_bb_std_mult': 2.5598384607205675, 'bear_rsi_os': 37, 'bear_rsi_ob': 75, 'bear_adx_thresh': 14.159354577124077, 'bear_atr_min_pct': 0.028295573698359652, 'bear_atr_max_pct': 0.01701757225075215, 'bear_tp_mult': 1.5340103493225654, 'bear_tsl_mult': 0.791543137152678, 'bear_time_stop': 243, 'bear_use_sma': False, 'bear_use_ema': True, 'bear_use_atr': False, 'bear_use_adx': True, 'bear_use_spike': True, 'bear_rsi_required': True, 'sideways_strategy': 'breakout', 'sideways_bb_std_mult': 1.6428234798264199, 'sideways_rsi_os': 6, 'sideways_rsi_ob': 85, 'sideways_adx_thresh': 21.70343267544753, 'sideways_atr_min_pct': 0.01739814263074942, 'sideways_atr_max_pct': 0.13603442616495787, 'sideways_tp_mult': 2.471603020565933, 'sideways_tsl_mult': 0.791770195547788, 'sideways_time_stop': 228, 'sideways_use_sma': False, 'sideways_use_ema': False, 'sideways_use_atr': False, 'sideways_use_adx': True, 'sideways_use_spike': False, 'sideways_rsi_required': False}.
[I 2025-08-30 21:37:28,541] Trial 391 finished with values: [-1000000000.0, 1000000000.0] and parameters: {'p_sma': 30, 'p_std': 37, 'p_atr': 24, 'p_adx': 22, 'rsi_period': 83, 'ema1': 13, 'ema2': 39, 'slip_atr_k': 0.1515288152021988, 'slip_spread_k': 0.05333290565589077, 'spread_hl_frac': 0.024908725588537666, 'bb_std_mult': 1.3798423378556197, 'rsi_os': 9, 'rsi_ob': 69, 'vol_spike': 0.29439539483712224, 'adx_thresh': 10.363110920731804, 'atr_min_pct': 0.012641221005659082, 'atr_max_pct': 0.09593645863642342, 'tp_mult': 2.199584227570563, 'tsl_mult': 0.4674958272900265, 'strategy': 'mean_reversion', 'time_stop': 17, 'use_sma': True, 'use_atr': True, 'use_adx': True, 'use_ema': True, 'use_spike': True, 'rsi_required': True, 'edge_k': 1.0323662167667862, 'edge_cap': 0.1013834594863327, 'bull_strategy': 'mean_reversion', 'bull_bb_std_mult': 2.749210233119712, 'bull_rsi_os': 14, 'bull_rsi_ob': 87, 'bull_adx_thresh': 14.940339613997974, 'bull_atr_min_pct': 0.020470420813477042, 'bull_atr_max_pct': 0.045061621968087974, 'bull_tp_mult': 2.2991459356835575, 'bull_tsl_mult': 0.6524396844464412, 'bull_time_stop': 294, 'bull_use_sma': True, 'bull_use_ema': True, 'bull_use_atr': False, 'bull_use_adx': False, 'bull_use_spike': False, 'bull_rsi_required': True, 'bear_strategy': 'mean_reversion', 'bear_bb_std_mult': 3.463544865353666, 'bear_rsi_os': 21, 'bear_rsi_ob': 73, 'bear_adx_thresh': 15.014038984860411, 'bear_atr_min_pct': 0.029965490765832527, 'bear_atr_max_pct': 0.01564148127868315, 'bear_tp_mult': 1.5164313706118604, 'bear_tsl_mult': 0.801253311363797, 'bear_time_stop': 107, 'bear_use_sma': False, 'bear_use_ema': True, 'bear_use_atr': False, 'bear_use_adx': True, 'bear_use_spike': True, 'bear_rsi_required': True, 'sideways_strategy': 'breakout', 'sideways_bb_std_mult': 3.110599126221385, 'sideways_rsi_os': 43, 'sideways_rsi_ob': 86, 'sideways_adx_thresh': 26.91148863235558, 'sideways_atr_min_pct': 0.022963333964938253, 'sideways_atr_max_pct': 0.14768776977798864, 'sideways_tp_mult': 1.4924133727288869, 'sideways_tsl_mult': 0.8712657050461466, 'sideways_time_stop': 227, 'sideways_use_sma': False, 'sideways_use_ema': False, 'sideways_use_atr': False, 'sideways_use_adx': True, 'sideways_use_spike': False, 'sideways_rsi_required': False}.
[I 2025-08-30 21:37:29,267] Trial 393 finished with values: [-0.04516671095607072, 0.04509594408850402] and parameters: {'p_sma': 58, 'p_std': 6, 'p_atr': 25, 'p_adx': 19, 'rsi_period': 77, 'ema1': 12, 'ema2': 55, 'slip_atr_k': 0.20997637399298763, 'slip_spread_k': 0.4635080120502558, 'spread_hl_frac': 0.03654687026153585, 'bb_std_mult': 1.5320421571609169, 'rsi_os': 6, 'rsi_ob': 72, 'vol_spike': 0.29459280015813827, 'adx_thresh': 10.29848533103069, 'atr_min_pct': 0.012358571455867162, 'atr_max_pct': 0.09599533181245545, 'tp_mult': 2.9074393241462193, 'tsl_mult': 0.44345750312651866, 'strategy': 'mean_reversion', 'time_stop': 151, 'use_sma': True, 'use_atr': True, 'use_adx': True, 'use_ema': True, 'use_spike': True, 'rsi_required': True, 'edge_k': 1.2397870372763957, 'edge_cap': 0.6348953416044836, 'bull_strategy': 'mean_reversion', 'bull_bb_std_mult': 2.254368367379299, 'bull_rsi_os': 44, 'bull_rsi_ob': 89, 'bull_adx_thresh': 14.806644090671435, 'bull_atr_min_pct': 0.0013459083759415477, 'bull_atr_max_pct': 0.045675274525169944, 'bull_tp_mult': 1.3656063806947065, 'bull_tsl_mult': 0.7246491075677535, 'bull_time_stop': 182, 'bull_use_sma': True, 'bull_use_ema': False, 'bull_use_atr': False, 'bull_use_adx': False, 'bull_use_spike': False, 'bull_rsi_required': True, 'bear_strategy': 'mean_reversion', 'bear_bb_std_mult': 3.3295767068655193, 'bear_rsi_os': 21, 'bear_rsi_ob': 74, 'bear_adx_thresh': 14.812565371262565, 'bear_atr_min_pct': 0.02696825772044844, 'bear_atr_max_pct': 0.14128164690340636, 'bear_tp_mult': 1.606761278459072, 'bear_tsl_mult': 0.38278464487135355, 'bear_time_stop': 105, 'bear_use_sma': False, 'bear_use_ema': True, 'bear_use_atr': False, 'bear_use_adx': True, 'bear_use_spike': True, 'bear_rsi_required': True, 'sideways_strategy': 'breakout', 'sideways_bb_std_mult': 3.0833556312261323, 'sideways_rsi_os': 24, 'sideways_rsi_ob': 77, 'sideways_adx_thresh': 26.99820335844455, 'sideways_atr_min_pct': 0.023125245755310428, 'sideways_atr_max_pct': 0.14766745530892877, 'sideways_tp_mult': 1.8483482548557, 'sideways_tsl_mult': 0.7952442973038707, 'sideways_time_stop': 23, 'sideways_use_sma': False, 'sideways_use_ema': False, 'sideways_use_atr': False, 'sideways_use_adx': True, 'sideways_use_spike': False, 'sideways_rsi_required': False}.
[I 2025-08-30 21:38:02,560] Trial 395 finished with values: [-1000000000.0, 1000000000.0] and parameters: {'p_sma': 41, 'p_std': 37, 'p_atr': 25, 'p_adx': 20, 'rsi_period': 77, 'ema1': 7, 'ema2': 51, 'slip_atr_k': 0.1506973195618496, 'slip_spread_k': 0.47629791903384244, 'spread_hl_frac': 0.03699356470702092, 'bb_std_mult': 1.5380097468998273, 'rsi_os': 6, 'rsi_ob': 59, 'vol_spike': 0.28034150233282523, 'adx_thresh': 14.682600910745622, 'atr_min_pct': 0.012186043188402357, 'atr_max_pct': 0.10960589830954587, 'tp_mult': 1.6493341117941147, 'tsl_mult': 0.4612459473932478, 'strategy': 'breakout', 'time_stop': 36, 'use_sma': True, 'use_atr': False, 'use_adx': True, 'use_ema': False, 'use_spike': True, 'rsi_required': True, 'edge_k': 1.2304554409008688, 'edge_cap': 0.640691409995032, 'bull_strategy': 'breakout', 'bull_bb_std_mult': 2.2277174850767887, 'bull_rsi_os': 16, 'bull_rsi_ob': 89, 'bull_adx_thresh': 29.90003458733843, 'bull_atr_min_pct': 0.010280477846532859, 'bull_atr_max_pct': 0.05036171513112495, 'bull_tp_mult': 1.1772614729308937, 'bull_tsl_mult': 0.7365216721217831, 'bull_time_stop': 180, 'bull_use_sma': True, 'bull_use_ema': False, 'bull_use_atr': True, 'bull_use_adx': True, 'bull_use_spike': False, 'bull_rsi_required': True, 'bear_strategy': 'mean_reversion', 'bear_bb_std_mult': 3.3286759871867373, 'bear_rsi_os': 30, 'bear_rsi_ob': 78, 'bear_adx_thresh': 15.211743753677155, 'bear_atr_min_pct': 0.027883277825903052, 'bear_atr_max_pct': 0.10309463138357851, 'bear_tp_mult': 1.5877839066723565, 'bear_tsl_mult': 0.12764524689837858, 'bear_time_stop': 89, 'bear_use_sma': False, 'bear_use_ema': True, 'bear_use_atr': False, 'bear_use_adx': True, 'bear_use_spike': True, 'bear_rsi_required': True, 'sideways_strategy': 'breakout', 'sideways_bb_std_mult': 1.733641252477275, 'sideways_rsi_os': 43, 'sideways_rsi_ob': 87, 'sideways_adx_thresh': 18.441000343153025, 'sideways_atr_min_pct': 0.020470493915553552, 'sideways_atr_max_pct': 0.1499186226273728, 'sideways_tp_mult': 1.9309603133536608, 'sideways_tsl_mult': 0.6841678701452684, 'sideways_time_stop': 24, 'sideways_use_sma': False, 'sideways_use_ema': False, 'sideways_use_atr': False, 'sideways_use_adx': True, 'sideways_use_spike': False, 'sideways_rsi_required': False}.
[I 2025-08-30 21:38:02,898] Trial 394 finished with values: [-0.028312298484113096, 0.028239615646102254] and parameters: {'p_sma': 28, 'p_std': 13, 'p_atr': 19, 'p_adx': 19, 'rsi_period': 66, 'ema1': 20, 'ema2': 35, 'slip_atr_k': 0.2320660713492549, 'slip_spread_k': 0.06826953003801889, 'spread_hl_frac': 0.03825776058939407, 'bb_std_mult': 1.524769467531987, 'rsi_os': 6, 'rsi_ob': 71, 'vol_spike': 0.0010573983565987377, 'adx_thresh': 14.523113099118241, 'atr_min_pct': 0.011356088096852821, 'atr_max_pct': 0.10004090757150691, 'tp_mult': 1.6508470889879847, 'tsl_mult': 0.8646259706290939, 'strategy': 'breakout', 'time_stop': 128, 'use_sma': True, 'use_atr': True, 'use_adx': True, 'use_ema': True, 'use_spike': True, 'rsi_required': True, 'edge_k': 1.2350509506360026, 'edge_cap': 0.6404693981689337, 'bull_strategy': 'breakout', 'bull_bb_std_mult': 2.219821891693541, 'bull_rsi_os': 40, 'bull_rsi_ob': 79, 'bull_adx_thresh': 14.556402137370135, 'bull_atr_min_pct': 0.0013459855346845814, 'bull_atr_max_pct': 0.05082639106113939, 'bull_tp_mult': 2.1118331629472538, 'bull_tsl_mult': 0.6746316223502261, 'bull_time_stop': 110, 'bull_use_sma': True, 'bull_use_ema': False, 'bull_use_atr': True, 'bull_use_adx': True, 'bull_use_spike': False, 'bull_rsi_required': True, 'bear_strategy': 'mean_reversion', 'bear_bb_std_mult': 3.336803971349073, 'bear_rsi_os': 14, 'bear_rsi_ob': 74, 'bear_adx_thresh': 15.145563541437792, 'bear_atr_min_pct': 0.02689503088844348, 'bear_atr_max_pct': 0.015104232329628209, 'bear_tp_mult': 1.5850616178824488, 'bear_tsl_mult': 0.37302766681589344, 'bear_time_stop': 25, 'bear_use_sma': False, 'bear_use_ema': True, 'bear_use_atr': False, 'bear_use_adx': True, 'bear_use_spike': True, 'bear_rsi_required': True, 'sideways_strategy': 'breakout', 'sideways_bb_std_mult': 1.7334153829865864, 'sideways_rsi_os': 42, 'sideways_rsi_ob': 57, 'sideways_adx_thresh': 26.777569355874316, 'sideways_atr_min_pct': 0.020594198552890873, 'sideways_atr_max_pct': 0.14832056025327542, 'sideways_tp_mult': 2.961548186436202, 'sideways_tsl_mult': 0.7697145608626291, 'sideways_time_stop': 229, 'sideways_use_sma': False, 'sideways_use_ema': False, 'sideways_use_atr': False, 'sideways_use_adx': True, 'sideways_use_spike': False, 'sideways_rsi_required': False}.
