[I 2025-08-30 20:57:57,316] Trial 84 finished with values: [-1000000000.0, 1000000000.0] and parameters: {'p_sma': 41, 'p_std': 32, 'p_atr': 24, 'p_adx': 18, 'rsi_period': 18, 'ema1': 6, 'ema2': 41, 'slip_atr_k': 0.0013025218630943192, 'slip_spread_k': 0.8189966112378817, 'spread_hl_frac': 0.032593921539243356, 'bb_std_mult': 3.380821783754609, 'rsi_os': 17, 'rsi_ob': 88, 'vol_spike': 0.007642660566906431, 'adx_thresh': 26.066004314260734, 'atr_min_pct': 0.017942197218711535, 'atr_max_pct': 0.12280954974650288, 'tp_mult': 1.692626830862943, 'tsl_mult': 0.21517690121163852, 'strategy': 'breakout', 'time_stop': 14, 'use_sma': False, 'use_atr': False, 'use_adx': False, 'use_ema': False, 'use_spike': False, 'rsi_required': False, 'edge_k': 0.7482928939204856, 'edge_cap': 0.38775257379714434, 'bull_strategy': 'breakout', 'bull_bb_std_mult': 1.9132530839829511, 'bull_rsi_os': 37, 'bull_rsi_ob': 80, 'bull_adx_thresh': 6.154992907238375, 'bull_atr_min_pct': 0.026880975595393493, 'bull_atr_max_pct': 0.05961122732098939, 'bull_tp_mult': 2.477917529323251, 'bull_tsl_mult': 0.73613159454274, 'bull_time_stop': 151, 'bull_use_sma': True, 'bull_use_ema': False, 'bull_use_atr': True, 'bull_use_adx': True, 'bull_use_spike': True, 'bull_rsi_required': True, 'bear_strategy': 'mean_reversion', 'bear_bb_std_mult': 3.1412742291261475, 'bear_rsi_os': 18, 'bear_rsi_ob': 45, 'bear_adx_thresh': 10.491594799839973, 'bear_atr_min_pct': 0.023147959400023888, 'bear_atr_max_pct': 0.1372805900907756, 'bear_tp_mult': 2.212287652350456, 'bear_tsl_mult': 0.8392059647059071, 'bear_time_stop': 81, 'bear_use_sma': True, 'bear_use_ema': True, 'bear_use_atr': False, 'bear_use_adx': False, 'bear_use_spike': False, 'bear_rsi_required': True, 'sideways_strategy': 'breakout', 'sideways_bb_std_mult': 3.492857212877826, 'sideways_rsi_os': 32, 'sideways_rsi_ob': 88, 'sideways_adx_thresh': 29.4821438909601, 'sideways_atr_min_pct': 0.015205149908408683, 'sideways_atr_max_pct': 0.044712545271757775, 'sideways_tp_mult': 1.375866832226746, 'sideways_tsl_mult': 0.4124764060926307, 'sideways_time_stop': 43, 'sideways_use_sma': True, 'sideways_use_ema': False, 'sideways_use_atr': True, 'sideways_use_adx': False, 'sideways_use_spike': True, 'sideways_rsi_required': False}.
[I 2025-08-30 20:57:58,182] Trial 82 finished with values: [-1000000000.0, 1000000000.0] and parameters: {'p_sma': 44, 'p_std': 24, 'p_atr': 24, 'p_adx': 17, 'rsi_period': 9, 'ema1': 6, 'ema2': 33, 'slip_atr_k': 0.00042339335237345094, 'slip_spread_k': 0.6736901610907658, 'spread_hl_frac': 0.034078437779375303, 'bb_std_mult': 2.9757708718669473, 'rsi_os': 52, 'rsi_ob': 86, 'vol_spike': 0.00826676839752849, 'adx_thresh': 26.234379026989945, 'atr_min_pct': 0.017682444158291538, 'atr_max_pct': 0.08223860496341556, 'tp_mult': 2.004536651004484, 'tsl_mult': 0.11232580310792145, 'strategy': 'breakout', 'time_stop': 43, 'use_sma': False, 'use_atr': True, 'use_adx': False, 'use_ema': True, 'use_spike': False, 'rsi_required': False, 'edge_k': 0.7618320945374593, 'edge_cap': 0.3846809662758236, 'bull_strategy': 'breakout', 'bull_bb_std_mult': 2.2373999819743338, 'bull_rsi_os': 38, 'bull_rsi_ob': 81, 'bull_adx_thresh': 9.249133452121326, 'bull_atr_min_pct': 0.00985122150009152, 'bull_atr_max_pct': 0.057585560544947886, 'bull_tp_mult': 2.5145922020502463, 'bull_tsl_mult': 0.5964280104783175, 'bull_time_stop': 144, 'bull_use_sma': True, 'bull_use_ema': False, 'bull_use_atr': True, 'bull_use_adx': True, 'bull_use_spike': True, 'bull_rsi_required': False, 'bear_strategy': 'mean_reversion', 'bear_bb_std_mult': 2.6049825647173557, 'bear_rsi_os': 47, 'bear_rsi_ob': 46, 'bear_adx_thresh': 22.54263055186106, 'bear_atr_min_pct': 0.026402990544827986, 'bear_atr_max_pct': 0.13696333912053102, 'bear_tp_mult': 2.2397188027345494, 'bear_tsl_mult': 0.7610308905235549, 'bear_time_stop': 32, 'bear_use_sma': True, 'bear_use_ema': False, 'bear_use_atr': False, 'bear_use_adx': True, 'bear_use_spike': False, 'bear_rsi_required': False, 'sideways_strategy': 'breakout', 'sideways_bb_std_mult': 1.4240213505663433, 'sideways_rsi_os': 50, 'sideways_rsi_ob': 55, 'sideways_adx_thresh': 33.91031090505365, 'sideways_atr_min_pct': 0.009679383427907862, 'sideways_atr_max_pct': 0.04573222350187884, 'sideways_tp_mult': 2.263983339634964, 'sideways_tsl_mult': 0.6312322111246473, 'sideways_time_stop': 41, 'sideways_use_sma': True, 'sideways_use_ema': True, 'sideways_use_atr': True, 'sideways_use_adx': False, 'sideways_use_spike': True, 'sideways_rsi_required': True}.
[I 2025-08-30 20:57:58,208] Trial 81 finished with values: [-1000000000.0, 1000000000.0] and parameters: {'p_sma': 44, 'p_std': 24, 'p_atr': 24, 'p_adx': 17, 'rsi_period': 8, 'ema1': 6, 'ema2': 41, 'slip_atr_k': 0.00227946956264034, 'slip_spread_k': 0.6141599374872602, 'spread_hl_frac': 0.015236951025356868, 'bb_std_mult': 2.9450914058723128, 'rsi_os': 17, 'rsi_ob': 88, 'vol_spike': 0.2997599463952575, 'adx_thresh': 27.03798423056628, 'atr_min_pct': 0.017996343262362297, 'atr_max_pct': 0.08025819469042465, 'tp_mult': 2.171600685935852, 'tsl_mult': 0.1174526381060601, 'strategy': 'breakout', 'time_stop': 12, 'use_sma': False, 'use_atr': True, 'use_adx': False, 'use_ema': True, 'use_spike': False, 'rsi_required': False, 'edge_k': 0.7711101981442211, 'edge_cap': 0.37707671602876613, 'bull_strategy': 'breakout', 'bull_bb_std_mult': 2.30623547711217, 'bull_rsi_os': 38, 'bull_rsi_ob': 79, 'bull_adx_thresh': 9.80586066519539, 'bull_atr_min_pct': 0.006990486729202437, 'bull_atr_max_pct': 0.06066374965251761, 'bull_tp_mult': 2.536725642644877, 'bull_tsl_mult': 0.5067128662198743, 'bull_time_stop': 144, 'bull_use_sma': True, 'bull_use_ema': False, 'bull_use_atr': True, 'bull_use_adx': True, 'bull_use_spike': True, 'bull_rsi_required': False, 'bear_strategy': 'mean_reversion', 'bear_bb_std_mult': 2.570029305129559, 'bear_rsi_os': 47, 'bear_rsi_ob': 45, 'bear_adx_thresh': 10.650663884780586, 'bear_atr_min_pct': 0.02317647857481204, 'bear_atr_max_pct': 0.13704891812712572, 'bear_tp_mult': 2.2001424955457902, 'bear_tsl_mult': 0.8447386557052665, 'bear_time_stop': 33, 'bear_use_sma': True, 'bear_use_ema': False, 'bear_use_atr': False, 'bear_use_adx': True, 'bear_use_spike': False, 'bear_rsi_required': False, 'sideways_strategy': 'breakout', 'sideways_bb_std_mult': 2.7349573380923347, 'sideways_rsi_os': 32, 'sideways_rsi_ob': 81, 'sideways_adx_thresh': 33.509375991591945, 'sideways_atr_min_pct': 0.017279046973499742, 'sideways_atr_max_pct': 0.04526158759576773, 'sideways_tp_mult': 1.3715995226091644, 'sideways_tsl_mult': 0.6278440106426731, 'sideways_time_stop': 5, 'sideways_use_sma': True, 'sideways_use_ema': True, 'sideways_use_atr': True, 'sideways_use_adx': False, 'sideways_use_spike': True, 'sideways_rsi_required': True}.
[I 2025-08-30 20:57:58,608] Trial 83 finished with values: [-1000000000.0, 1000000000.0] and parameters: {'p_sma': 44, 'p_std': 23, 'p_atr': 20, 'p_adx': 7, 'rsi_period': 9, 'ema1': 6, 'ema2': 33, 'slip_atr_k': 0.0005725801292755708, 'slip_spread_k': 0.6764326086875962, 'spread_hl_frac': 0.03385423197276763, 'bb_std_mult': 3.320274856764596, 'rsi_os': 52, 'rsi_ob': 86, 'vol_spike': 0.29406887836428486, 'adx_thresh': 29.693689444305235, 'atr_min_pct': 0.01676505634129856, 'atr_max_pct': 0.11531477688087298, 'tp_mult': 1.983149303509323, 'tsl_mult': 0.11306009490763819, 'strategy': 'breakout', 'time_stop': 11, 'use_sma': False, 'use_atr': False, 'use_adx': False, 'use_ema': True, 'use_spike': False, 'rsi_required': False, 'edge_k': 0.11690862536447422, 'edge_cap': 0.38774930443751, 'bull_strategy': 'breakout', 'bull_bb_std_mult': 2.3433229387276793, 'bull_rsi_os': 28, 'bull_rsi_ob': 80, 'bull_adx_thresh': 9.592610971472705, 'bull_atr_min_pct': 0.009718046018624617, 'bull_atr_max_pct': 0.05849376082285023, 'bull_tp_mult': 2.522061286986424, 'bull_tsl_mult': 0.5117883707950829, 'bull_time_stop': 144, 'bull_use_sma': True, 'bull_use_ema': False, 'bull_use_atr': True, 'bull_use_adx': True, 'bull_use_spike': True, 'bull_rsi_required': False, 'bear_strategy': 'mean_reversion', 'bear_bb_std_mult': 2.622145608552483, 'bear_rsi_os': 47, 'bear_rsi_ob': 45, 'bear_adx_thresh': 27.2551266135559, 'bear_atr_min_pct': 0.0250818813501216, 'bear_atr_max_pct': 0.12810519040380572, 'bear_tp_mult': 2.2937082740170185, 'bear_tsl_mult': 0.8398619864544299, 'bear_time_stop': 29, 'bear_use_sma': True, 'bear_use_ema': True, 'bear_use_atr': False, 'bear_use_adx': True, 'bear_use_spike': False, 'bear_rsi_required': False, 'sideways_strategy': 'breakout', 'sideways_bb_std_mult': 2.7643283072336082, 'sideways_rsi_os': 32, 'sideways_rsi_ob': 66, 'sideways_adx_thresh': 33.436030931648226, 'sideways_atr_min_pct': 0.015540945154537807, 'sideways_atr_max_pct': 0.03871325826827466, 'sideways_tp_mult': 2.248879700610048, 'sideways_tsl_mult': 0.6369018397484677, 'sideways_time_stop': 5, 'sideways_use_sma': True, 'sideways_use_ema': True, 'sideways_use_atr': True, 'sideways_use_adx': False, 'sideways_use_spike': True, 'sideways_rsi_required': True}.
[I 2025-08-30 20:58:30,382] Trial 88 finished with values: [-0.016620708548651275, 0.01655652758353428] and parameters: {'p_sma': 48, 'p_std': 33, 'p_atr': 14, 'p_adx': 28, 'rsi_period': 14, 'ema1': 5, 'ema2': 45, 'slip_atr_k': 0.011492719853706214, 'slip_spread_k': 0.7624433282655494, 'spread_hl_frac': 0.004798469299859679, 'bb_std_mult': 3.4761468173487575, 'rsi_os': 26, 'rsi_ob': 81, 'vol_spike': 0.01943732758325674, 'adx_thresh': 21.206777268400014, 'atr_min_pct': 0.015221324775662673, 'atr_max_pct': 0.0901051162465725, 'tp_mult': 1.7825383449193097, 'tsl_mult': 0.9471330647915104, 'strategy': 'mean_reversion', 'time_stop': 280, 'use_sma': False, 'use_atr': True, 'use_adx': True, 'use_ema': False, 'use_spike': True, 'rsi_required': True, 'edge_k': 0.6333402898235654, 'edge_cap': 0.3461926865086956, 'bull_strategy': 'breakout', 'bull_bb_std_mult': 3.136943552795464, 'bull_rsi_os': 6, 'bull_rsi_ob': 77, 'bull_adx_thresh': 11.417572222802683, 'bull_atr_min_pct': 0.000787190981608409, 'bull_atr_max_pct': 0.04989638087909545, 'bull_tp_mult': 2.5974116200130077, 'bull_tsl_mult': 0.6236453760605367, 'bull_time_stop': 168, 'bull_use_sma': True, 'bull_use_ema': False, 'bull_use_atr': False, 'bull_use_adx': True, 'bull_use_spike': False, 'bull_rsi_required': True, 'bear_strategy': 'mean_reversion', 'bear_bb_std_mult': 2.8394043732785237, 'bear_rsi_os': 51, 'bear_rsi_ob': 51, 'bear_adx_thresh': 16.071310930266286, 'bear_atr_min_pct': 0.01971358611289287, 'bear_atr_max_pct': 0.14794793956347407, 'bear_tp_mult': 2.3418000132570524, 'bear_tsl_mult': 0.6903478519959065, 'bear_time_stop': 70, 'bear_use_sma': True, 'bear_use_ema': False, 'bear_use_atr': False, 'bear_use_adx': False, 'bear_use_spike': True, 'bear_rsi_required': True, 'sideways_strategy': 'breakout', 'sideways_bb_std_mult': 2.95868038937273, 'sideways_rsi_os': 40, 'sideways_rsi_ob': 60, 'sideways_adx_thresh': 28.883756449291567, 'sideways_atr_min_pct': 0.006982669758693249, 'sideways_atr_max_pct': 0.02556951016103918, 'sideways_tp_mult': 2.561843774035437, 'sideways_tsl_mult': 0.4617202524933695, 'sideways_time_stop': 161, 'sideways_use_sma': False, 'sideways_use_ema': False, 'sideways_use_atr': True, 'sideways_use_adx': False, 'sideways_use_spike': False, 'sideways_rsi_required': False}.
[I 2025-08-30 20:58:30,836] Trial 87 finished with values: [-1000000000.0, 1000000000.0] and parameters: {'p_sma': 48, 'p_std': 34, 'p_atr': 20, 'p_adx': 20, 'rsi_period': 13, 'ema1': 5, 'ema2': 28, 'slip_atr_k': 0.052723110787546934, 'slip_spread_k': 0.9246833874002482, 'spread_hl_frac': 0.0063282682229519865, 'bb_std_mult': 3.320734477818109, 'rsi_os': 26, 'rsi_ob': 81, 'vol_spike': 0.017132452585883806, 'adx_thresh': 29.922971819683315, 'atr_min_pct': 0.015232627764796338, 'atr_max_pct': 0.10997716969637097, 'tp_mult': 1.8429217266794031, 'tsl_mult': 0.9620801721426766, 'strategy': 'mean_reversion', 'time_stop': 285, 'use_sma': False, 'use_atr': False, 'use_adx': True, 'use_ema': False, 'use_spike': True, 'rsi_required': True, 'edge_k': 0.13407602125050766, 'edge_cap': 0.33810173955001044, 'bull_strategy': 'breakout', 'bull_bb_std_mult': 3.110678003202823, 'bull_rsi_os': 31, 'bull_rsi_ob': 77, 'bull_adx_thresh': 11.52639341385867, 'bull_atr_min_pct': 0.0019227812008490496, 'bull_atr_max_pct': 0.04968640337569245, 'bull_tp_mult': 2.4233943058913288, 'bull_tsl_mult': 0.5662320927132832, 'bull_time_stop': 101, 'bull_use_sma': True, 'bull_use_ema': False, 'bull_use_atr': False, 'bull_use_adx': True, 'bull_use_spike': False, 'bull_rsi_required': True, 'bear_strategy': 'mean_reversion', 'bear_bb_std_mult': 2.724725556436706, 'bear_rsi_os': 52, 'bear_rsi_ob': 51, 'bear_adx_thresh': 27.209389869506946, 'bear_atr_min_pct': 0.025872181275779654, 'bear_atr_max_pct': 0.1294978492128177, 'bear_tp_mult': 2.6383918214539235, 'bear_tsl_mult': 0.6859000951919801, 'bear_time_stop': 58, 'bear_use_sma': True, 'bear_use_ema': True, 'bear_use_atr': False, 'bear_use_adx': False, 'bear_use_spike': True, 'bear_rsi_required': True, 'sideways_strategy': 'breakout', 'sideways_bb_std_mult': 2.0968742605705257, 'sideways_rsi_os': 39, 'sideways_rsi_ob': 77, 'sideways_adx_thresh': 28.926616938496604, 'sideways_atr_min_pct': 0.0070014352369896045, 'sideways_atr_max_pct': 0.05261355980150072, 'sideways_tp_mult': 2.162607903997214, 'sideways_tsl_mult': 0.470633509952887, 'sideways_time_stop': 164, 'sideways_use_sma': False, 'sideways_use_ema': False, 'sideways_use_atr': True, 'sideways_use_adx': False, 'sideways_use_spike': False, 'sideways_rsi_required': False}.
[I 2025-08-30 20:58:31,670] Trial 85 finished with values: [-1000000000.0, 1000000000.0] and parameters: {'p_sma': 14, 'p_std': 23, 'p_atr': 20, 'p_adx': 7, 'rsi_period': 7, 'ema1': 5, 'ema2': 33, 'slip_atr_k': 0.05356369949944205, 'slip_spread_k': 0.6605703028421139, 'spread_hl_frac': 0.004512426304838225, 'bb_std_mult': 3.3194509095453504, 'rsi_os': 26, 'rsi_ob': 85, 'vol_spike': 0.019153000482471517, 'adx_thresh': 29.515891839972976, 'atr_min_pct': 0.01718639358664393, 'atr_max_pct': 0.11235678028809218, 'tp_mult': 1.7904688958199673, 'tsl_mult': 0.12002511608248045, 'strategy': 'mean_reversion', 'time_stop': 38, 'use_sma': False, 'use_atr': True, 'use_adx': True, 'use_ema': True, 'use_spike': True, 'rsi_required': True, 'edge_k': 0.49122718914882724, 'edge_cap': 0.34714531464408604, 'bull_strategy': 'breakout', 'bull_bb_std_mult': 1.7176762545484143, 'bull_rsi_os': 5, 'bull_rsi_ob': 77, 'bull_adx_thresh': 11.449071923021677, 'bull_atr_min_pct': 0.009720126267840537, 'bull_atr_max_pct': 0.0505800101609615, 'bull_tp_mult': 2.4231932572790726, 'bull_tsl_mult': 0.5805917423476163, 'bull_time_stop': 278, 'bull_use_sma': True, 'bull_use_ema': False, 'bull_use_atr': False, 'bull_use_adx': True, 'bull_use_spike': True, 'bull_rsi_required': True, 'bear_strategy': 'mean_reversion', 'bear_bb_std_mult': 2.7600217530475737, 'bear_rsi_os': 47, 'bear_rsi_ob': 50, 'bear_adx_thresh': 27.15093167135699, 'bear_atr_min_pct': 0.020355540145045696, 'bear_atr_max_pct': 0.13810574946905263, 'bear_tp_mult': 1.2528898113901885, 'bear_tsl_mult': 0.754316087396995, 'bear_time_stop': 69, 'bear_use_sma': True, 'bear_use_ema': False, 'bear_use_atr': False, 'bear_use_adx': True, 'bear_use_spike': True, 'bear_rsi_required': True, 'sideways_strategy': 'breakout', 'sideways_bb_std_mult': 3.1208643993453307, 'sideways_rsi_os': 28, 'sideways_rsi_ob': 81, 'sideways_adx_thresh': 8.274468790551227, 'sideways_atr_min_pct': 0.012107801384743282, 'sideways_atr_max_pct': 0.0526945165018465, 'sideways_tp_mult': 2.679398595786016, 'sideways_tsl_mult': 0.6251030639783022, 'sideways_time_stop': 7, 'sideways_use_sma': False, 'sideways_use_ema': True, 'sideways_use_atr': True, 'sideways_use_adx': False, 'sideways_use_spike': False, 'sideways_rsi_required': True}.
[I 2025-08-30 20:58:31,828] Trial 86 finished with values: [-0.0180339138582174, 0.01792867663532112] and parameters: {'p_sma': 48, 'p_std': 34, 'p_atr': 14, 'p_adx': 28, 'rsi_period': 13, 'ema1': 5, 'ema2': 28, 'slip_atr_k': 0.056382031598283526, 'slip_spread_k': 0.6759821007481556, 'spread_hl_frac': 0.0047075430003407455, 'bb_std_mult': 2.10328273762985, 'rsi_os': 26, 'rsi_ob': 71, 'vol_spike': 0.01815895577735044, 'adx_thresh': 29.991197097625516, 'atr_min_pct': 0.015107743198854348, 'atr_max_pct': 0.10926609811014473, 'tp_mult': 1.7637388929538735, 'tsl_mult': 0.9485753040366884, 'strategy': 'mean_reversion', 'time_stop': 57, 'use_sma': False, 'use_atr': False, 'use_adx': True, 'use_ema': False, 'use_spike': True, 'rsi_required': True, 'edge_k': 0.6333583568623511, 'edge_cap': 0.3409097067349268, 'bull_strategy': 'breakout', 'bull_bb_std_mult': 2.0325426075542983, 'bull_rsi_os': 5, 'bull_rsi_ob': 55, 'bull_adx_thresh': 8.571421953842293, 'bull_atr_min_pct': 0.0009333951106249765, 'bull_atr_max_pct': 0.07996895512605227, 'bull_tp_mult': 2.403615671819652, 'bull_tsl_mult': 0.8051698126219189, 'bull_time_stop': 170, 'bull_use_sma': True, 'bull_use_ema': False, 'bull_use_atr': False, 'bull_use_adx': True, 'bull_use_spike': False, 'bull_rsi_required': True, 'bear_strategy': 'mean_reversion', 'bear_bb_std_mult': 2.7109172011025913, 'bear_rsi_os': 50, 'bear_rsi_ob': 50, 'bear_adx_thresh': 27.406555577908666, 'bear_atr_min_pct': 0.02045681326859674, 'bear_atr_max_pct': 0.13065035490076082, 'bear_tp_mult': 2.6613501211043356, 'bear_tsl_mult': 0.7075561872379355, 'bear_time_stop': 59, 'bear_use_sma': True, 'bear_use_ema': True, 'bear_use_atr': False, 'bear_use_adx': False, 'bear_use_spike': True, 'bear_rsi_required': True, 'sideways_strategy': 'breakout', 'sideways_bb_std_mult': 2.9664118894703333, 'sideways_rsi_os': 40, 'sideways_rsi_ob': 60, 'sideways_adx_thresh': 8.659493888689934, 'sideways_atr_min_pct': 0.006838582897832032, 'sideways_atr_max_pct': 0.054767287706661116, 'sideways_tp_mult': 2.5607256315771036, 'sideways_tsl_mult': 0.47526388871916075, 'sideways_time_stop': 278, 'sideways_use_sma': False, 'sideways_use_ema': False, 'sideways_use_atr': True, 'sideways_use_adx': False, 'sideways_use_spike': False, 'sideways_rsi_required': False}.
[I 2025-08-30 20:59:02,043] Trial 89 finished with values: [-1000000000.0, 1000000000.0] and parameters: {'p_sma': 51, 'p_std': 34, 'p_atr': 14, 'p_adx': 28, 'rsi_period': 14, 'ema1': 5, 'ema2': 49, 'slip_atr_k': 0.01010711490811963, 'slip_spread_k': 0.7600542921860609, 'spread_hl_frac': 0.0045930257998654045, 'bb_std_mult': 3.4918329651734754, 'rsi_os': 38, 'rsi_ob': 71, 'vol_spike': 0.03827198949217553, 'adx_thresh': 20.600713870017998, 'atr_min_pct': 0.028434865748836864, 'atr_max_pct': 0.09113772772052614, 'tp_mult': 1.773871463402272, 'tsl_mult': 0.9431557214153278, 'strategy': 'mean_reversion', 'time_stop': 279, 'use_sma': False, 'use_atr': True, 'use_adx': True, 'use_ema': False, 'use_spike': True, 'rsi_required': True, 'edge_k': 0.442888164332494, 'edge_cap': 0.3440974576040619, 'bull_strategy': 'breakout', 'bull_bb_std_mult': 3.0933012655744228, 'bull_rsi_os': 21, 'bull_rsi_ob': 54, 'bull_adx_thresh': 11.751801338369358, 'bull_atr_min_pct': 0.0019193605764757453, 'bull_atr_max_pct': 0.04934920471197421, 'bull_tp_mult': 2.4195654601637284, 'bull_tsl_mult': 0.6194100776322553, 'bull_time_stop': 174, 'bull_use_sma': True, 'bull_use_ema': False, 'bull_use_atr': False, 'bull_use_adx': True, 'bull_use_spike': False, 'bull_rsi_required': True, 'bear_strategy': 'mean_reversion', 'bear_bb_std_mult': 2.866131154722831, 'bear_rsi_os': 52, 'bear_rsi_ob': 61, 'bear_adx_thresh': 16.010268523975196, 'bear_atr_min_pct': 0.020120958522941913, 'bear_atr_max_pct': 0.14757974998920814, 'bear_tp_mult': 2.6080042609967697, 'bear_tsl_mult': 0.6796705859410346, 'bear_time_stop': 71, 'bear_use_sma': False, 'bear_use_ema': False, 'bear_use_atr': False, 'bear_use_adx': False, 'bear_use_spike': True, 'bear_rsi_required': True, 'sideways_strategy': 'breakout', 'sideways_bb_std_mult': 2.9477002461384747, 'sideways_rsi_os': 41, 'sideways_rsi_ob': 78, 'sideways_adx_thresh': 28.453871026356644, 'sideways_atr_min_pct': 0.006518200631329771, 'sideways_atr_max_pct': 0.02571589247840678, 'sideways_tp_mult': 2.657455972432807, 'sideways_tsl_mult': 0.41758192942125244, 'sideways_time_stop': 151, 'sideways_use_sma': False, 'sideways_use_ema': False, 'sideways_use_atr': True, 'sideways_use_adx': False, 'sideways_use_spike': False, 'sideways_rsi_required': False}.
