[I 2025-08-30 21:54:43,113] Trial 540 finished with values: [-0.025430033990967993, 0.025367587215921677] and parameters: {'p_sma': 42, 'p_std': 12, 'p_atr': 11, 'p_adx': 21, 'rsi_period': 73, 'ema1': 13, 'ema2': 53, 'slip_atr_k': 0.039835784993503015, 'slip_spread_k': 0.7204509605342828, 'spread_hl_frac': 0.0489950197815388, 'bb_std_mult': 0.9759594987793669, 'rsi_os': 12, 'rsi_ob': 65, 'vol_spike': 0.21079847795791587, 'adx_thresh': 10.193367182595779, 'atr_min_pct': 0.017857785592907512, 'atr_max_pct': 0.01984389910759349, 'tp_mult': 1.131609106563322, 'tsl_mult': 0.8701246995996699, 'strategy': 'mean_reversion', 'time_stop': 86, 'use_sma': True, 'use_atr': True, 'use_adx': True, 'use_ema': True, 'use_spike': True, 'rsi_required': True, 'edge_k': 0.9390221712603827, 'edge_cap': 0.8595133404291543, 'bull_strategy': 'mean_reversion', 'bull_bb_std_mult': 2.092522991239721, 'bull_rsi_os': 32, 'bull_rsi_ob': 88, 'bull_adx_thresh': 14.564245904750969, 'bull_atr_min_pct': 0.0018874816847237095, 'bull_atr_max_pct': 0.02788350768330808, 'bull_tp_mult': 1.7585195288093698, 'bull_tsl_mult': 0.4452848650471032, 'bull_time_stop': 93, 'bull_use_sma': True, 'bull_use_ema': False, 'bull_use_atr': True, 'bull_use_adx': False, 'bull_use_spike': False, 'bull_rsi_required': True, 'bear_strategy': 'mean_reversion', 'bear_bb_std_mult': 1.4494454209761198, 'bear_rsi_os': 5, 'bear_rsi_ob': 75, 'bear_adx_thresh': 27.593823384930094, 'bear_atr_min_pct': 0.02546804111461938, 'bear_atr_max_pct': 0.1187797772565832, 'bear_tp_mult': 1.5383207431858397, 'bear_tsl_mult': 0.4365984104227265, 'bear_time_stop': 29, 'bear_use_sma': False, 'bear_use_ema': True, 'bear_use_atr': False, 'bear_use_adx': True, 'bear_use_spike': True, 'bear_rsi_required': False, 'sideways_strategy': 'breakout', 'sideways_bb_std_mult': 0.5092072171690576, 'sideways_rsi_os': 39, 'sideways_rsi_ob': 88, 'sideways_adx_thresh': 29.31808871646971, 'sideways_atr_min_pct': 0.02227879822416327, 'sideways_atr_max_pct': 0.04482121176962881, 'sideways_tp_mult': 1.8424723112451804, 'sideways_tsl_mult': 0.052575707084952406, 'sideways_time_stop': 265, 'sideways_use_sma': False, 'sideways_use_ema': False, 'sideways_use_atr': False, 'sideways_use_adx': True, 'sideways_use_spike': False, 'sideways_rsi_required': False}.
[I 2025-08-30 21:54:44,734] Trial 541 finished with values: [-1000000000.0, 1000000000.0] and parameters: {'p_sma': 32, 'p_std': 41, 'p_atr': 21, 'p_adx': 21, 'rsi_period': 74, 'ema1': 27, 'ema2': 53, 'slip_atr_k': 0.028716534698955663, 'slip_spread_k': 0.12429987501501083, 'spread_hl_frac': 0.021499348089876812, 'bb_std_mult': 0.9770529040116618, 'rsi_os': 18, 'rsi_ob': 67, 'vol_spike': 0.2748399429331212, 'adx_thresh': 10.996794581914521, 'atr_min_pct': 0.017773209775999204, 'atr_max_pct': 0.11377415147846032, 'tp_mult': 1.6209618029005268, 'tsl_mult': 0.9327924322247337, 'strategy': 'breakout', 'time_stop': 268, 'use_sma': True, 'use_atr': True, 'use_adx': True, 'use_ema': True, 'use_spike': True, 'rsi_required': True, 'edge_k': 0.26941232782033275, 'edge_cap': 0.47914391596420763, 'bull_strategy': 'breakout', 'bull_bb_std_mult': 2.0916191693129305, 'bull_rsi_os': 16, 'bull_rsi_ob': 88, 'bull_adx_thresh': 14.497814880416943, 'bull_atr_min_pct': 0.002050557988255602, 'bull_atr_max_pct': 0.07498292491337154, 'bull_tp_mult': 1.3080496812103684, 'bull_tsl_mult': 0.6585613315988535, 'bull_time_stop': 206, 'bull_use_sma': True, 'bull_use_ema': False, 'bull_use_atr': True, 'bull_use_adx': False, 'bull_use_spike': False, 'bull_rsi_required': False, 'bear_strategy': 'breakout', 'bear_bb_std_mult': 1.5697913530035363, 'bear_rsi_os': 8, 'bear_rsi_ob': 71, 'bear_adx_thresh': 32.102752641495584, 'bear_atr_min_pct': 0.028868728659879717, 'bear_atr_max_pct': 0.0702779642705053, 'bear_tp_mult': 1.5128750354219702, 'bear_tsl_mult': 0.4076197216058756, 'bear_time_stop': 277, 'bear_use_sma': False, 'bear_use_ema': True, 'bear_use_atr': True, 'bear_use_adx': True, 'bear_use_spike': True, 'bear_rsi_required': False, 'sideways_strategy': 'breakout', 'sideways_bb_std_mult': 1.692710977827457, 'sideways_rsi_os': 39, 'sideways_rsi_ob': 88, 'sideways_adx_thresh': 30.360732248270867, 'sideways_atr_min_pct': 0.02053930367705575, 'sideways_atr_max_pct': 0.043594383450694774, 'sideways_tp_mult': 1.7755446870466585, 'sideways_tsl_mult': 0.715998477191262, 'sideways_time_stop': 268, 'sideways_use_sma': False, 'sideways_use_ema': False, 'sideways_use_atr': False, 'sideways_use_adx': True, 'sideways_use_spike': False, 'sideways_rsi_required': False}.
[I 2025-08-30 21:54:45,195] Trial 542 finished with values: [-0.01728964414648204, 0.017218408998029146] and parameters: {'p_sma': 33, 'p_std': 20, 'p_atr': 22, 'p_adx': 21, 'rsi_period': 71, 'ema1': 6, 'ema2': 55, 'slip_atr_k': 0.028845373117512337, 'slip_spread_k': 0.61076687924166, 'spread_hl_frac': 0.03303785434383277, 'bb_std_mult': 0.7103340007086872, 'rsi_os': 12, 'rsi_ob': 65, 'vol_spike': 0.1271617617735176, 'adx_thresh': 7.783243738971153, 'atr_min_pct': 0.013108510042323518, 'atr_max_pct': 0.022109381729136155, 'tp_mult': 1.6922982036817846, 'tsl_mult': 0.9370340112728979, 'strategy': 'breakout', 'time_stop': 266, 'use_sma': True, 'use_atr': True, 'use_adx': True, 'use_ema': True, 'use_spike': True, 'rsi_required': True, 'edge_k': 0.9477516456321547, 'edge_cap': 0.79279529550772, 'bull_strategy': 'breakout', 'bull_bb_std_mult': 1.955539307531837, 'bull_rsi_os': 17, 'bull_rsi_ob': 88, 'bull_adx_thresh': 14.532061517955663, 'bull_atr_min_pct': 0.0014782464653625056, 'bull_atr_max_pct': 0.0749716588894695, 'bull_tp_mult': 1.3184314545108027, 'bull_tsl_mult': 0.368063260114547, 'bull_time_stop': 294, 'bull_use_sma': True, 'bull_use_ema': False, 'bull_use_atr': True, 'bull_use_adx': False, 'bull_use_spike': False, 'bull_rsi_required': False, 'bear_strategy': 'breakout', 'bear_bb_std_mult': 1.5960300267909047, 'bear_rsi_os': 19, 'bear_rsi_ob': 72, 'bear_adx_thresh': 27.483844571195586, 'bear_atr_min_pct': 0.026524034149335823, 'bear_atr_max_pct': 0.0510581855947313, 'bear_tp_mult': 1.5303899276410817, 'bear_tsl_mult': 0.37176428869148526, 'bear_time_stop': 150, 'bear_use_sma': False, 'bear_use_ema': True, 'bear_use_atr': True, 'bear_use_adx': True, 'bear_use_spike': True, 'bear_rsi_required': True, 'sideways_strategy': 'mean_reversion', 'sideways_bb_std_mult': 1.7300227774949328, 'sideways_rsi_os': 40, 'sideways_rsi_ob': 88, 'sideways_adx_thresh': 30.488560092709, 'sideways_atr_min_pct': 0.012116635752215232, 'sideways_atr_max_pct': 0.042227155065215384, 'sideways_tp_mult': 1.773158498094649, 'sideways_tsl_mult': 0.7748866405318935, 'sideways_time_stop': 104, 'sideways_use_sma': False, 'sideways_use_ema': False, 'sideways_use_atr': False, 'sideways_use_adx': True, 'sideways_use_spike': False, 'sideways_rsi_required': False}.
[I 2025-08-30 21:55:19,888] Trial 543 finished with values: [-1000000000.0, 1000000000.0] and parameters: {'p_sma': 20, 'p_std': 55, 'p_atr': 11, 'p_adx': 21, 'rsi_period': 71, 'ema1': 12, 'ema2': 12, 'slip_atr_k': 0.036406041013700985, 'slip_spread_k': 0.8926695223219206, 'spread_hl_frac': 0.03307613473854924, 'bb_std_mult': 0.6296349575402634, 'rsi_os': 34, 'rsi_ob': 67, 'vol_spike': 0.08086796048667906, 'adx_thresh': 10.961371682782438, 'atr_min_pct': 0.01770685870520062, 'atr_max_pct': 0.05476629069759582, 'tp_mult': 1.6216565660090816, 'tsl_mult': 0.9257355111632926, 'strategy': 'breakout', 'time_stop': 194, 'use_sma': True, 'use_atr': True, 'use_adx': True, 'use_ema': True, 'use_spike': True, 'rsi_required': False, 'edge_k': 0.9615634358458635, 'edge_cap': 0.81789804000889, 'bull_strategy': 'breakout', 'bull_bb_std_mult': 2.0812946672994643, 'bull_rsi_os': 35, 'bull_rsi_ob': 88, 'bull_adx_thresh': 18.977945040948896, 'bull_atr_min_pct': 7.446686983163882e-05, 'bull_atr_max_pct': 0.05573416388191278, 'bull_tp_mult': 1.3064573819436702, 'bull_tsl_mult': 0.6658828901863337, 'bull_time_stop': 208, 'bull_use_sma': True, 'bull_use_ema': False, 'bull_use_atr': True, 'bull_use_adx': False, 'bull_use_spike': False, 'bull_rsi_required': False, 'bear_strategy': 'breakout', 'bear_bb_std_mult': 1.9261819088997558, 'bear_rsi_os': 14, 'bear_rsi_ob': 72, 'bear_adx_thresh': 27.4793596168139, 'bear_atr_min_pct': 0.02535127354934076, 'bear_atr_max_pct': 0.11641803675141792, 'bear_tp_mult': 1.5518303421281683, 'bear_tsl_mult': 0.36991321899951146, 'bear_time_stop': 239, 'bear_use_sma': False, 'bear_use_ema': True, 'bear_use_atr': True, 'bear_use_adx': True, 'bear_use_spike': True, 'bear_rsi_required': True, 'sideways_strategy': 'mean_reversion', 'sideways_bb_std_mult': 0.6944094233145699, 'sideways_rsi_os': 39, 'sideways_rsi_ob': 89, 'sideways_adx_thresh': 19.576220585701787, 'sideways_atr_min_pct': 0.004759853586772061, 'sideways_atr_max_pct': 0.04340440168139866, 'sideways_tp_mult': 1.775918117486632, 'sideways_tsl_mult': 0.7139234451534946, 'sideways_time_stop': 264, 'sideways_use_sma': False, 'sideways_use_ema': False, 'sideways_use_atr': False, 'sideways_use_adx': True, 'sideways_use_spike': False, 'sideways_rsi_required': False}.
[I 2025-08-30 21:55:20,644] Trial 545 finished with values: [-0.02375981630764068, 0.023689594402623373] and parameters: {'p_sma': 33, 'p_std': 20, 'p_atr': 22, 'p_adx': 21, 'rsi_period': 28, 'ema1': 12, 'ema2': 30, 'slip_atr_k': 0.15114624837944146, 'slip_spread_k': 0.6146092704009956, 'spread_hl_frac': 0.032964610766280454, 'bb_std_mult': 0.6969469616256984, 'rsi_os': 10, 'rsi_ob': 66, 'vol_spike': 0.28327508151590614, 'adx_thresh': 10.823016566954575, 'atr_min_pct': 0.013003122223458735, 'atr_max_pct': 0.023267735818806125, 'tp_mult': 1.6892510702243198, 'tsl_mult': 0.8964599011009737, 'strategy': 'breakout', 'time_stop': 183, 'use_sma': True, 'use_atr': True, 'use_adx': True, 'use_ema': True, 'use_spike': True, 'rsi_required': False, 'edge_k': 1.1996511987474343, 'edge_cap': 0.9639074004170722, 'bull_strategy': 'breakout', 'bull_bb_std_mult': 1.9817079654648497, 'bull_rsi_os': 17, 'bull_rsi_ob': 48, 'bull_adx_thresh': 15.61022857635847, 'bull_atr_min_pct': 5.2646513466210465e-05, 'bull_atr_max_pct': 0.05650325713053466, 'bull_tp_mult': 1.422079069357402, 'bull_tsl_mult': 0.4002463227807746, 'bull_time_stop': 225, 'bull_use_sma': True, 'bull_use_ema': False, 'bull_use_atr': False, 'bull_use_adx': False, 'bull_use_spike': False, 'bull_rsi_required': False, 'bear_strategy': 'breakout', 'bear_bb_std_mult': 3.4108498343361484, 'bear_rsi_os': 55, 'bear_rsi_ob': 73, 'bear_adx_thresh': 34.3886084047615, 'bear_atr_min_pct': 0.010270230737066274, 'bear_atr_max_pct': 0.139304347711796, 'bear_tp_mult': 1.0132625990947455, 'bear_tsl_mult': 0.37055578844292125, 'bear_time_stop': 38, 'bear_use_sma': False, 'bear_use_ema': True, 'bear_use_atr': True, 'bear_use_adx': True, 'bear_use_spike': True, 'bear_rsi_required': True, 'sideways_strategy': 'mean_reversion', 'sideways_bb_std_mult': 2.1403668004575294, 'sideways_rsi_os': 40, 'sideways_rsi_ob': 89, 'sideways_adx_thresh': 24.45976473746976, 'sideways_atr_min_pct': 0.028621790479819713, 'sideways_atr_max_pct': 0.049804700878325725, 'sideways_tp_mult': 1.7828442405369331, 'sideways_tsl_mult': 0.8093044702777993, 'sideways_time_stop': 88, 'sideways_use_sma': False, 'sideways_use_ema': False, 'sideways_use_atr': False, 'sideways_use_adx': True, 'sideways_use_spike': False, 'sideways_rsi_required': False}.
[I 2025-08-30 21:55:20,743] Trial 544 finished with values: [-0.021459245807549654, 0.021394642285157136] and parameters: {'p_sma': 32, 'p_std': 20, 'p_atr': 21, 'p_adx': 21, 'rsi_period': 70, 'ema1': 12, 'ema2': 12, 'slip_atr_k': 0.027248657376068085, 'slip_spread_k': 0.8965673827217862, 'spread_hl_frac': 0.03284402113691694, 'bb_std_mult': 3.290762941686269, 'rsi_os': 10, 'rsi_ob': 67, 'vol_spike': 0.28339617691047214, 'adx_thresh': 7.810436347023106, 'atr_min_pct': 0.013309831020929025, 'atr_max_pct': 0.023581991049275434, 'tp_mult': 1.6047649709139036, 'tsl_mult': 0.9244374890918013, 'strategy': 'breakout', 'time_stop': 196, 'use_sma': True, 'use_atr': True, 'use_adx': True, 'use_ema': True, 'use_spike': True, 'rsi_required': False, 'edge_k': 1.3170675451349254, 'edge_cap': 0.47641191724312665, 'bull_strategy': 'breakout', 'bull_bb_std_mult': 0.5035323005138141, 'bull_rsi_os': 17, 'bull_rsi_ob': 88, 'bull_adx_thresh': 16.4623507899723, 'bull_atr_min_pct': 4.69001439057043e-05, 'bull_atr_max_pct': 0.05602621896461851, 'bull_tp_mult': 1.8405599533497998, 'bull_tsl_mult': 0.646865775001124, 'bull_time_stop': 155, 'bull_use_sma': True, 'bull_use_ema': False, 'bull_use_atr': True, 'bull_use_adx': False, 'bull_use_spike': False, 'bull_rsi_required': False, 'bear_strategy': 'breakout', 'bear_bb_std_mult': 1.9546101604672137, 'bear_rsi_os': 24, 'bear_rsi_ob': 71, 'bear_adx_thresh': 31.56538285264158, 'bear_atr_min_pct': 0.0283973592817287, 'bear_atr_max_pct': 0.07240192477720497, 'bear_tp_mult': 2.2454521964595644, 'bear_tsl_mult': 0.876804773888864, 'bear_time_stop': 151, 'bear_use_sma': False, 'bear_use_ema': True, 'bear_use_atr': True, 'bear_use_adx': True, 'bear_use_spike': True, 'bear_rsi_required': True, 'sideways_strategy': 'mean_reversion', 'sideways_bb_std_mult': 1.745999785466882, 'sideways_rsi_os': 40, 'sideways_rsi_ob': 89, 'sideways_adx_thresh': 17.86457548708885, 'sideways_atr_min_pct': 0.028695491169062427, 'sideways_atr_max_pct': 0.042335070370974094, 'sideways_tp_mult': 1.7715434770621779, 'sideways_tsl_mult': 0.7741720852508596, 'sideways_time_stop': 276, 'sideways_use_sma': False, 'sideways_use_ema': False, 'sideways_use_atr': False, 'sideways_use_adx': True, 'sideways_use_spike': False, 'sideways_rsi_required': False}.
[I 2025-08-30 21:55:20,837] Trial 546 finished with values: [-0.018029093536006457, 0.017922250727310927] and parameters: {'p_sma': 33, 'p_std': 36, 'p_atr': 22, 'p_adx': 20, 'rsi_period': 71, 'ema1': 6, 'ema2': 30, 'slip_atr_k': 0.15119484980628034, 'slip_spread_k': 0.6187511916580508, 'spread_hl_frac': 0.03286206090505673, 'bb_std_mult': 0.6933575244365888, 'rsi_os': 10, 'rsi_ob': 66, 'vol_spike': 0.28284398553838186, 'adx_thresh': 10.873322840924565, 'atr_min_pct': 0.013254418677463433, 'atr_max_pct': 0.022694496379966185, 'tp_mult': 2.5564861289813487, 'tsl_mult': 0.5013056053161832, 'strategy': 'breakout', 'time_stop': 87, 'use_sma': True, 'use_atr': True, 'use_adx': True, 'use_ema': True, 'use_spike': True, 'rsi_required': False, 'edge_k': 0.15491291168070664, 'edge_cap': 0.8153099398118199, 'bull_strategy': 'breakout', 'bull_bb_std_mult': 1.9690163394157185, 'bull_rsi_os': 36, 'bull_rsi_ob': 88, 'bull_adx_thresh': 16.635917757682126, 'bull_atr_min_pct': 0.00018519108340192179, 'bull_atr_max_pct': 0.056187678696774164, 'bull_tp_mult': 1.8301057003494234, 'bull_tsl_mult': 0.40302443411294764, 'bull_time_stop': 5, 'bull_use_sma': True, 'bull_use_ema': True, 'bull_use_atr': False, 'bull_use_adx': False, 'bull_use_spike': False, 'bull_rsi_required': False, 'bear_strategy': 'breakout', 'bear_bb_std_mult': 1.9369942709235635, 'bear_rsi_os': 7, 'bear_rsi_ob': 73, 'bear_adx_thresh': 27.349464860400154, 'bear_atr_min_pct': 0.010227041278605176, 'bear_atr_max_pct': 0.11644577985569982, 'bear_tp_mult': 1.5631358009591527, 'bear_tsl_mult': 0.37404978431650027, 'bear_time_stop': 21, 'bear_use_sma': False, 'bear_use_ema': True, 'bear_use_atr': True, 'bear_use_adx': True, 'bear_use_spike': True, 'bear_rsi_required': True, 'sideways_strategy': 'mean_reversion', 'sideways_bb_std_mult': 1.7954318429011078, 'sideways_rsi_os': 40, 'sideways_rsi_ob': 89, 'sideways_adx_thresh': 18.18444559741846, 'sideways_atr_min_pct': 0.012072426732006196, 'sideways_atr_max_pct': 0.12017035907383497, 'sideways_tp_mult': 1.778714986025626, 'sideways_tsl_mult': 0.7784509901374491, 'sideways_time_stop': 274, 'sideways_use_sma': False, 'sideways_use_ema': False, 'sideways_use_atr': False, 'sideways_use_adx': True, 'sideways_use_spike': False, 'sideways_rsi_required': False}.
[I 2025-08-30 21:55:56,261] Trial 547 finished with values: [-1000000000.0, 1000000000.0] and parameters: {'p_sma': 5, 'p_std': 37, 'p_atr': 20, 'p_adx': 20, 'rsi_period': 70, 'ema1': 11, 'ema2': 30, 'slip_atr_k': 0.19111137592077235, 'slip_spread_k': 0.6169708574407707, 'spread_hl_frac': 0.030537944525932816, 'bb_std_mult': 0.7111710586403042, 'rsi_os': 10, 'rsi_ob': 66, 'vol_spike': 0.1236234343540022, 'adx_thresh': 25.684936892799914, 'atr_min_pct': 0.024904977090603055, 'atr_max_pct': 0.027195370329418544, 'tp_mult': 1.6738764459969466, 'tsl_mult': 0.505243694845346, 'strategy': 'mean_reversion', 'time_stop': 102, 'use_sma': True, 'use_atr': True, 'use_adx': True, 'use_ema': True, 'use_spike': True, 'rsi_required': False, 'edge_k': 1.0475157986103014, 'edge_cap': 0.7582339853666337, 'bull_strategy': 'breakout', 'bull_bb_std_mult': 1.9751615088005188, 'bull_rsi_os': 19, 'bull_rsi_ob': 90, 'bull_adx_thresh': 24.103049191330523, 'bull_atr_min_pct': 0.01079065311459658, 'bull_atr_max_pct': 0.04835670323648076, 'bull_tp_mult': 1.8378327051300098, 'bull_tsl_mult': 0.403744198841239, 'bull_time_stop': 31, 'bull_use_sma': True, 'bull_use_ema': True, 'bull_use_atr': False, 'bull_use_adx': False, 'bull_use_spike': False, 'bull_rsi_required': True, 'bear_strategy': 'mean_reversion', 'bear_bb_std_mult': 2.128119232997505, 'bear_rsi_os': 7, 'bear_rsi_ob': 73, 'bear_adx_thresh': 28.364737793665043, 'bear_atr_min_pct': 0.010274020831612841, 'bear_atr_max_pct': 0.1383044930877019, 'bear_tp_mult': 1.3211071344255088, 'bear_tsl_mult': 0.5852226557537654, 'bear_time_stop': 161, 'bear_use_sma': False, 'bear_use_ema': True, 'bear_use_atr': False, 'bear_use_adx': True, 'bear_use_spike': False, 'bear_rsi_required': True, 'sideways_strategy': 'mean_reversion', 'sideways_bb_std_mult': 2.134329525916786, 'sideways_rsi_os': 37, 'sideways_rsi_ob': 89, 'sideways_adx_thresh': 17.85873655784799, 'sideways_atr_min_pct': 0.0007464927022789759, 'sideways_atr_max_pct': 0.04865103392473498, 'sideways_tp_mult': 1.763327519275502, 'sideways_tsl_mult': 0.7725505649750877, 'sideways_time_stop': 272, 'sideways_use_sma': True, 'sideways_use_ema': False, 'sideways_use_atr': False, 'sideways_use_adx': True, 'sideways_use_spike': False, 'sideways_rsi_required': False}.
[I 2025-08-30 21:55:56,361] Trial 548 finished with values: [-0.0216979769904887, 0.02161712034248358] and parameters: {'p_sma': 34, 'p_std': 5, 'p_atr': 20, 'p_adx': 20, 'rsi_period': 70, 'ema1': 5, 'ema2': 36, 'slip_atr_k': 0.17441280379510485, 'slip_spread_k': 0.6303382669794336, 'spread_hl_frac': 0.030345616885332397, 'bb_std_mult': 0.7210801300692424, 'rsi_os': 12, 'rsi_ob': 66, 'vol_spike': 0.23616524100984587, 'adx_thresh': 8.170449294741214, 'atr_min_pct': 0.003941615294345063, 'atr_max_pct': 0.01485416706857316, 'tp_mult': 1.6789337938883862, 'tsl_mult': 0.9074622224129479, 'strategy': 'mean_reversion', 'time_stop': 85, 'use_sma': True, 'use_atr': False, 'use_adx': False, 'use_ema': True, 'use_spike': False, 'rsi_required': True, 'edge_k': 1.0613031119283307, 'edge_cap': 0.8332518716135205, 'bull_strategy': 'breakout', 'bull_bb_std_mult': 1.8473379292290346, 'bull_rsi_os': 18, 'bull_rsi_ob': 51, 'bull_adx_thresh': 16.41853828148904, 'bull_atr_min_pct': 0.010888984119110713, 'bull_atr_max_pct': 0.04883606243193064, 'bull_tp_mult': 1.4793931649557046, 'bull_tsl_mult': 0.36486774573878783, 'bull_time_stop': 300, 'bull_use_sma': True, 'bull_use_ema': True, 'bull_use_atr': False, 'bull_use_adx': False, 'bull_use_spike': False, 'bull_rsi_required': True, 'bear_strategy': 'mean_reversion', 'bear_bb_std_mult': 2.124541415952915, 'bear_rsi_os': 20, 'bear_rsi_ob': 58, 'bear_adx_thresh': 28.29981959711152, 'bear_atr_min_pct': 0.029434786374363357, 'bear_atr_max_pct': 0.11138854832958464, 'bear_tp_mult': 1.2933935384515, 'bear_tsl_mult': 0.38828494118864953, 'bear_time_stop': 11, 'bear_use_sma': False, 'bear_use_ema': True, 'bear_use_atr': False, 'bear_use_adx': True, 'bear_use_spike': False, 'bear_rsi_required': True, 'sideways_strategy': 'breakout', 'sideways_bb_std_mult': 1.7917661905683597, 'sideways_rsi_os': 37, 'sideways_rsi_ob': 90, 'sideways_adx_thresh': 11.49201800590577, 'sideways_atr_min_pct': 0.0004092548662953232, 'sideways_atr_max_pct': 0.04239920083285466, 'sideways_tp_mult': 1.8745535140130543, 'sideways_tsl_mult': 0.7774120469168043, 'sideways_time_stop': 278, 'sideways_use_sma': True, 'sideways_use_ema': False, 'sideways_use_atr': False, 'sideways_use_adx': True, 'sideways_use_spike': True, 'sideways_rsi_required': False}.
