[I 2025-08-30 21:45:28,822] Trial 460 finished with values: [-1000000000.0, 1000000000.0] and parameters: {'p_sma': 35, 'p_std': 36, 'p_atr': 30, 'p_adx': 22, 'rsi_period': 36, 'ema1': 12, 'ema2': 54, 'slip_atr_k': 0.02000025660841387, 'slip_spread_k': 0.6276253851322274, 'spread_hl_frac': 0.03206720949814978, 'bb_std_mult': 0.882978757453745, 'rsi_os': 14, 'rsi_ob': 66, 'vol_spike': 0.26891103105672914, 'adx_thresh': 10.225836655386296, 'atr_min_pct': 0.014117969021889843, 'atr_max_pct': 0.012236018885681354, 'tp_mult': 2.9609571898276292, 'tsl_mult': 0.8760663094576501, 'strategy': 'mean_reversion', 'time_stop': 84, 'use_sma': True, 'use_atr': True, 'use_adx': True, 'use_ema': True, 'use_spike': True, 'rsi_required': True, 'edge_k': 0.5157771263940479, 'edge_cap': 0.8094568012022616, 'bull_strategy': 'breakout', 'bull_bb_std_mult': 1.9372473680407036, 'bull_rsi_os': 37, 'bull_rsi_ob': 85, 'bull_adx_thresh': 21.324461909000835, 'bull_atr_min_pct': 0.02902659782928156, 'bull_atr_max_pct': 0.0551581422429612, 'bull_tp_mult': 1.444280076887916, 'bull_tsl_mult': 0.21101203859603013, 'bull_time_stop': 300, 'bull_use_sma': False, 'bull_use_ema': False, 'bull_use_atr': False, 'bull_use_adx': False, 'bull_use_spike': False, 'bull_rsi_required': True, 'bear_strategy': 'mean_reversion', 'bear_bb_std_mult': 2.176297413488114, 'bear_rsi_os': 7, 'bear_rsi_ob': 73, 'bear_adx_thresh': 25.545816857198957, 'bear_atr_min_pct': 0.01996908546664701, 'bear_atr_max_pct': 0.12151396926788138, 'bear_tp_mult': 1.4766440805502092, 'bear_tsl_mult': 0.4205373044854576, 'bear_time_stop': 231, 'bear_use_sma': False, 'bear_use_ema': True, 'bear_use_atr': False, 'bear_use_adx': True, 'bear_use_spike': True, 'bear_rsi_required': True, 'sideways_strategy': 'mean_reversion', 'sideways_bb_std_mult': 1.5888125290006017, 'sideways_rsi_os': 21, 'sideways_rsi_ob': 56, 'sideways_adx_thresh': 17.208117373881905, 'sideways_atr_min_pct': 0.022179186199459282, 'sideways_atr_max_pct': 0.0398751045098166, 'sideways_tp_mult': 1.6271093758151578, 'sideways_tsl_mult': 0.11016966468734662, 'sideways_time_stop': 246, 'sideways_use_sma': False, 'sideways_use_ema': False, 'sideways_use_atr': False, 'sideways_use_adx': True, 'sideways_use_spike': False, 'sideways_rsi_required': False}.
[I 2025-08-30 21:45:48,351] Trial 459 finished with values: [-0.0410379329803936, 0.04096598507376316] and parameters: {'p_sma': 35, 'p_std': 37, 'p_atr': 21, 'p_adx': 21, 'rsi_period': 66, 'ema1': 10, 'ema2': 54, 'slip_atr_k': 0.0615017120045116, 'slip_spread_k': 0.6900915249607189, 'spread_hl_frac': 0.031822352190212184, 'bb_std_mult': 0.8036926519359551, 'rsi_os': 11, 'rsi_ob': 69, 'vol_spike': 0.05897561178458145, 'adx_thresh': 11.210912772928893, 'atr_min_pct': 0.0030294907894442644, 'atr_max_pct': 0.013595794234844374, 'tp_mult': 1.4763433843043945, 'tsl_mult': 0.6994324465944437, 'strategy': 'mean_reversion', 'time_stop': 86, 'use_sma': True, 'use_atr': True, 'use_adx': True, 'use_ema': True, 'use_spike': True, 'rsi_required': True, 'edge_k': 0.3456314833474169, 'edge_cap': 0.7557217567609613, 'bull_strategy': 'breakout', 'bull_bb_std_mult': 1.9408949704219054, 'bull_rsi_os': 55, 'bull_rsi_ob': 88, 'bull_adx_thresh': 23.010974047720058, 'bull_atr_min_pct': 0.014150690130872317, 'bull_atr_max_pct': 0.12965413613031346, 'bull_tp_mult': 1.3304172748454952, 'bull_tsl_mult': 0.9214345858987394, 'bull_time_stop': 86, 'bull_use_sma': True, 'bull_use_ema': False, 'bull_use_atr': False, 'bull_use_adx': False, 'bull_use_spike': False, 'bull_rsi_required': False, 'bear_strategy': 'breakout', 'bear_bb_std_mult': 1.8242958712897148, 'bear_rsi_os': 8, 'bear_rsi_ob': 73, 'bear_adx_thresh': 27.071889270160792, 'bear_atr_min_pct': 0.028857703618123356, 'bear_atr_max_pct': 0.11106360753424356, 'bear_tp_mult': 1.1903030695375154, 'bear_tsl_mult': 0.42462793660362996, 'bear_time_stop': 240, 'bear_use_sma': False, 'bear_use_ema': True, 'bear_use_atr': False, 'bear_use_adx': True, 'bear_use_spike': True, 'bear_rsi_required': True, 'sideways_strategy': 'breakout', 'sideways_bb_std_mult': 1.8852886911165119, 'sideways_rsi_os': 49, 'sideways_rsi_ob': 89, 'sideways_adx_thresh': 26.474778060187276, 'sideways_atr_min_pct': 0.0014366225028438241, 'sideways_atr_max_pct': 0.03786210497832671, 'sideways_tp_mult': 1.5722636101819725, 'sideways_tsl_mult': 0.6717403315262831, 'sideways_time_stop': 188, 'sideways_use_sma': False, 'sideways_use_ema': False, 'sideways_use_atr': False, 'sideways_use_adx': True, 'sideways_use_spike': False, 'sideways_rsi_required': False}.
[I 2025-08-30 21:45:57,497] Trial 461 finished with values: [-1000000000.0, 1000000000.0] and parameters: {'p_sma': 34, 'p_std': 36, 'p_atr': 21, 'p_adx': 22, 'rsi_period': 65, 'ema1': 12, 'ema2': 54, 'slip_atr_k': 0.0327208828045253, 'slip_spread_k': 0.621647362528607, 'spread_hl_frac': 0.036437846034021344, 'bb_std_mult': 0.5806564224911279, 'rsi_os': 11, 'rsi_ob': 66, 'vol_spike': 0.264434778562519, 'adx_thresh': 10.058499931688711, 'atr_min_pct': 0.014397746981543138, 'atr_max_pct': 0.019196931213542715, 'tp_mult': 1.7656184704141122, 'tsl_mult': 0.9265563400371943, 'strategy': 'mean_reversion', 'time_stop': 84, 'use_sma': True, 'use_atr': True, 'use_adx': True, 'use_ema': True, 'use_spike': True, 'rsi_required': True, 'edge_k': 0.22638288230625792, 'edge_cap': 0.7612213062970336, 'bull_strategy': 'mean_reversion', 'bull_bb_std_mult': 1.6772324354189356, 'bull_rsi_os': 19, 'bull_rsi_ob': 85, 'bull_adx_thresh': 18.020874518758184, 'bull_atr_min_pct': 0.013518902879334589, 'bull_atr_max_pct': 0.055170100022667076, 'bull_tp_mult': 1.4410380705200165, 'bull_tsl_mult': 0.663479307751796, 'bull_time_stop': 42, 'bull_use_sma': False, 'bull_use_ema': False, 'bull_use_atr': False, 'bull_use_adx': False, 'bull_use_spike': False, 'bull_rsi_required': True, 'bear_strategy': 'mean_reversion', 'bear_bb_std_mult': 1.9825477270648553, 'bear_rsi_os': 7, 'bear_rsi_ob': 74, 'bear_adx_thresh': 25.861733122784827, 'bear_atr_min_pct': 0.02888690944769914, 'bear_atr_max_pct': 0.11957814469324082, 'bear_tp_mult': 2.467826715119518, 'bear_tsl_mult': 0.5536059213274699, 'bear_time_stop': 230, 'bear_use_sma': False, 'bear_use_ema': True, 'bear_use_atr': False, 'bear_use_adx': True, 'bear_use_spike': True, 'bear_rsi_required': True, 'sideways_strategy': 'mean_reversion', 'sideways_bb_std_mult': 1.808651278854342, 'sideways_rsi_os': 23, 'sideways_rsi_ob': 91, 'sideways_adx_thresh': 27.03953301527447, 'sideways_atr_min_pct': 0.0203011465083055, 'sideways_atr_max_pct': 0.04565943011492387, 'sideways_tp_mult': 1.6353471869674676, 'sideways_tsl_mult': 0.5523742980894404, 'sideways_time_stop': 247, 'sideways_use_sma': False, 'sideways_use_ema': False, 'sideways_use_atr': False, 'sideways_use_adx': True, 'sideways_use_spike': False, 'sideways_rsi_required': False}.
[I 2025-08-30 21:45:58,375] Trial 462 finished with values: [-1000000000.0, 1000000000.0] and parameters: {'p_sma': 36, 'p_std': 38, 'p_atr': 8, 'p_adx': 19, 'rsi_period': 76, 'ema1': 12, 'ema2': 54, 'slip_atr_k': 0.03198237864288593, 'slip_spread_k': 0.6483077676874079, 'spread_hl_frac': 0.03644628083624353, 'bb_std_mult': 0.5721881355800692, 'rsi_os': 11, 'rsi_ob': 66, 'vol_spike': 0.2810560791459915, 'adx_thresh': 10.242212788758568, 'atr_min_pct': 0.01424493317925701, 'atr_max_pct': 0.03757258535216544, 'tp_mult': 1.76030427503681, 'tsl_mult': 0.9305516531094583, 'strategy': 'mean_reversion', 'time_stop': 86, 'use_sma': True, 'use_atr': False, 'use_adx': True, 'use_ema': True, 'use_spike': True, 'rsi_required': True, 'edge_k': 0.21160909318957322, 'edge_cap': 0.8172867272902479, 'bull_strategy': 'mean_reversion', 'bull_bb_std_mult': 1.670238633925837, 'bull_rsi_os': 18, 'bull_rsi_ob': 85, 'bull_adx_thresh': 17.811645751223978, 'bull_atr_min_pct': 0.0005360706214960282, 'bull_atr_max_pct': 0.11187712641718098, 'bull_tp_mult': 1.4260008654923644, 'bull_tsl_mult': 0.9253415397341036, 'bull_time_stop': 87, 'bull_use_sma': False, 'bull_use_ema': False, 'bull_use_atr': False, 'bull_use_adx': False, 'bull_use_spike': False, 'bull_rsi_required': True, 'bear_strategy': 'mean_reversion', 'bear_bb_std_mult': 1.9657950320566655, 'bear_rsi_os': 6, 'bear_rsi_ob': 74, 'bear_adx_thresh': 25.954808669236535, 'bear_atr_min_pct': 0.009785463197523925, 'bear_atr_max_pct': 0.1185682609066704, 'bear_tp_mult': 1.6143010383975103, 'bear_tsl_mult': 0.5609793787110617, 'bear_time_stop': 243, 'bear_use_sma': False, 'bear_use_ema': True, 'bear_use_atr': False, 'bear_use_adx': False, 'bear_use_spike': True, 'bear_rsi_required': True, 'sideways_strategy': 'mean_reversion', 'sideways_bb_std_mult': 1.6972605415964905, 'sideways_rsi_os': 38, 'sideways_rsi_ob': 91, 'sideways_adx_thresh': 5.130934335234487, 'sideways_atr_min_pct': 0.02349353725768623, 'sideways_atr_max_pct': 0.04575705153114771, 'sideways_tp_mult': 1.6613716476807798, 'sideways_tsl_mult': 0.020601167384531993, 'sideways_time_stop': 244, 'sideways_use_sma': False, 'sideways_use_ema': False, 'sideways_use_atr': False, 'sideways_use_adx': True, 'sideways_use_spike': True, 'sideways_rsi_required': False}.
[I 2025-08-30 21:46:04,719] Trial 463 finished with values: [-1000000000.0, 1000000000.0] and parameters: {'p_sma': 34, 'p_std': 38, 'p_atr': 8, 'p_adx': 19, 'rsi_period': 64, 'ema1': 11, 'ema2': 53, 'slip_atr_k': 0.14734449601725347, 'slip_spread_k': 0.6555070531021627, 'spread_hl_frac': 0.032745903503232546, 'bb_std_mult': 0.9602681137663097, 'rsi_os': 11, 'rsi_ob': 64, 'vol_spike': 0.2573597232723718, 'adx_thresh': 10.061833362065126, 'atr_min_pct': 0.003478677739856285, 'atr_max_pct': 0.019664161284422547, 'tp_mult': 1.7253389747723562, 'tsl_mult': 0.1100153384358466, 'strategy': 'mean_reversion', 'time_stop': 90, 'use_sma': True, 'use_atr': False, 'use_adx': True, 'use_ema': True, 'use_spike': True, 'rsi_required': True, 'edge_k': 1.8820569735078754, 'edge_cap': 0.826556659917873, 'bull_strategy': 'mean_reversion', 'bull_bb_std_mult': 1.8224420530652445, 'bull_rsi_os': 31, 'bull_rsi_ob': 86, 'bull_adx_thresh': 17.849588377124388, 'bull_atr_min_pct': 0.00857045663708136, 'bull_atr_max_pct': 0.05572658178947755, 'bull_tp_mult': 1.4192380982815007, 'bull_tsl_mult': 0.3893124063992743, 'bull_time_stop': 162, 'bull_use_sma': True, 'bull_use_ema': True, 'bull_use_atr': False, 'bull_use_adx': False, 'bull_use_spike': False, 'bull_rsi_required': True, 'bear_strategy': 'mean_reversion', 'bear_bb_std_mult': 1.9509786046195832, 'bear_rsi_os': 8, 'bear_rsi_ob': 74, 'bear_adx_thresh': 27.830792225828745, 'bear_atr_min_pct': 0.028889792025024823, 'bear_atr_max_pct': 0.11865057487961046, 'bear_tp_mult': 2.48309387775088, 'bear_tsl_mult': 0.37724688643807225, 'bear_time_stop': 229, 'bear_use_sma': False, 'bear_use_ema': True, 'bear_use_atr': False, 'bear_use_adx': False, 'bear_use_spike': True, 'bear_rsi_required': True, 'sideways_strategy': 'mean_reversion', 'sideways_bb_std_mult': 1.6883447761728894, 'sideways_rsi_os': 27, 'sideways_rsi_ob': 60, 'sideways_adx_thresh': 27.238215833610848, 'sideways_atr_min_pct': 0.020391469123182144, 'sideways_atr_max_pct': 0.04591251347562867, 'sideways_tp_mult': 1.544828200884829, 'sideways_tsl_mult': 0.6707783858063652, 'sideways_time_stop': 268, 'sideways_use_sma': False, 'sideways_use_ema': False, 'sideways_use_atr': False, 'sideways_use_adx': True, 'sideways_use_spike': True, 'sideways_rsi_required': False}.
[I 2025-08-30 21:46:05,355] Trial 465 finished with values: [-1000000000.0, 1000000000.0] and parameters: {'p_sma': 33, 'p_std': 42, 'p_atr': 8, 'p_adx': 7, 'rsi_period': 76, 'ema1': 11, 'ema2': 53, 'slip_atr_k': 0.1153761814107736, 'slip_spread_k': 0.6593748735428265, 'spread_hl_frac': 0.04972054289511302, 'bb_std_mult': 0.9621876650542216, 'rsi_os': 13, 'rsi_ob': 48, 'vol_spike': 0.03944499569818731, 'adx_thresh': 9.779443880411387, 'atr_min_pct': 0.012595566078566735, 'atr_max_pct': 0.037491851771269624, 'tp_mult': 1.7251982990375312, 'tsl_mult': 0.9291678921050879, 'strategy': 'mean_reversion', 'time_stop': 89, 'use_sma': True, 'use_atr': False, 'use_adx': False, 'use_ema': False, 'use_spike': False, 'rsi_required': True, 'edge_k': 1.5414487436739592, 'edge_cap': 0.8225546082978754, 'bull_strategy': 'mean_reversion', 'bull_bb_std_mult': 1.8369027297128944, 'bull_rsi_os': 6, 'bull_rsi_ob': 87, 'bull_adx_thresh': 13.462827925085094, 'bull_atr_min_pct': 0.008438437100540583, 'bull_atr_max_pct': 0.049937802635192895, 'bull_tp_mult': 1.4044712171797382, 'bull_tsl_mult': 0.40264616641856515, 'bull_time_stop': 257, 'bull_use_sma': True, 'bull_use_ema': True, 'bull_use_atr': False, 'bull_use_adx': False, 'bull_use_spike': False, 'bull_rsi_required': True, 'bear_strategy': 'mean_reversion', 'bear_bb_std_mult': 1.9589069513565804, 'bear_rsi_os': 6, 'bear_rsi_ob': 73, 'bear_adx_thresh': 27.938909207438233, 'bear_atr_min_pct': 0.029987866238653734, 'bear_atr_max_pct': 0.1160540769959149, 'bear_tp_mult': 1.9262168207521144, 'bear_tsl_mult': 0.7220418522414436, 'bear_time_stop': 246, 'bear_use_sma': False, 'bear_use_ema': True, 'bear_use_atr': False, 'bear_use_adx': False, 'bear_use_spike': True, 'bear_rsi_required': False, 'sideways_strategy': 'breakout', 'sideways_bb_std_mult': 3.289250540253518, 'sideways_rsi_os': 5, 'sideways_rsi_ob': 88, 'sideways_adx_thresh': 27.810109113353498, 'sideways_atr_min_pct': 0.0181190219162829, 'sideways_atr_max_pct': 0.05108399726699699, 'sideways_tp_mult': 1.4849217978524396, 'sideways_tsl_mult': 0.7086991499581736, 'sideways_time_stop': 84, 'sideways_use_sma': False, 'sideways_use_ema': False, 'sideways_use_atr': False, 'sideways_use_adx': True, 'sideways_use_spike': True, 'sideways_rsi_required': False}.
[I 2025-08-30 21:46:19,935] Trial 464 finished with values: [-1000000000.0, 1000000000.0] and parameters: {'p_sma': 35, 'p_std': 42, 'p_atr': 20, 'p_adx': 7, 'rsi_period': 30, 'ema1': 11, 'ema2': 55, 'slip_atr_k': 0.029423872794159332, 'slip_spread_k': 0.6571821348128261, 'spread_hl_frac': 0.03299184528256134, 'bb_std_mult': 0.5722939586970942, 'rsi_os': 13, 'rsi_ob': 64, 'vol_spike': 0.03912927981980889, 'adx_thresh': 9.97187959106624, 'atr_min_pct': 0.012678678501431678, 'atr_max_pct': 0.05114566784850638, 'tp_mult': 1.7565480065032626, 'tsl_mult': 0.9355448983327774, 'strategy': 'mean_reversion', 'time_stop': 89, 'use_sma': True, 'use_atr': False, 'use_adx': True, 'use_ema': True, 'use_spike': True, 'rsi_required': True, 'edge_k': 0.25424330910031123, 'edge_cap': 0.8202674562489962, 'bull_strategy': 'mean_reversion', 'bull_bb_std_mult': 1.8293033909500789, 'bull_rsi_os': 7, 'bull_rsi_ob': 86, 'bull_adx_thresh': 13.946350380741688, 'bull_atr_min_pct': 0.0012860148950707112, 'bull_atr_max_pct': 0.09659254800984206, 'bull_tp_mult': 1.4195096892459276, 'bull_tsl_mult': 0.4040861866311409, 'bull_time_stop': 40, 'bull_use_sma': False, 'bull_use_ema': True, 'bull_use_atr': False, 'bull_use_adx': False, 'bull_use_spike': False, 'bull_rsi_required': True, 'bear_strategy': 'mean_reversion', 'bear_bb_std_mult': 1.9774765328815982, 'bear_rsi_os': 6, 'bear_rsi_ob': 74, 'bear_adx_thresh': 27.895553493746974, 'bear_atr_min_pct': 0.012082447025392792, 'bear_atr_max_pct': 0.11967239874450143, 'bear_tp_mult': 1.6190746965960927, 'bear_tsl_mult': 0.6923811193303522, 'bear_time_stop': 229, 'bear_use_sma': False, 'bear_use_ema': True, 'bear_use_atr': False, 'bear_use_adx': False, 'bear_use_spike': True, 'bear_rsi_required': True, 'sideways_strategy': 'mean_reversion', 'sideways_bb_std_mult': 1.6839024175379778, 'sideways_rsi_os': 27, 'sideways_rsi_ob': 91, 'sideways_adx_thresh': 20.236358761322006, 'sideways_atr_min_pct': 0.02376887682865013, 'sideways_atr_max_pct': 0.045807135390536005, 'sideways_tp_mult': 1.4695620515710344, 'sideways_tsl_mult': 0.8440300695716975, 'sideways_time_stop': 270, 'sideways_use_sma': False, 'sideways_use_ema': False, 'sideways_use_atr': False, 'sideways_use_adx': True, 'sideways_use_spike': True, 'sideways_rsi_required': False}.
[I 2025-08-30 21:46:31,197] Trial 466 finished with values: [-1000000000.0, 1000000000.0] and parameters: {'p_sma': 33, 'p_std': 40, 'p_atr': 20, 'p_adx': 20, 'rsi_period': 31, 'ema1': 11, 'ema2': 53, 'slip_atr_k': 0.07825283429685823, 'slip_spread_k': 0.6632116455587227, 'spread_hl_frac': 0.03308779092528147, 'bb_std_mult': 0.9353605118277261, 'rsi_os': 23, 'rsi_ob': 63, 'vol_spike': 0.20833694838945865, 'adx_thresh': 9.758523513982748, 'atr_min_pct': 0.012008268706107588, 'atr_max_pct': 0.05141436631872065, 'tp_mult': 2.5280684711794787, 'tsl_mult': 0.27648181537215033, 'strategy': 'breakout', 'time_stop': 92, 'use_sma': True, 'use_atr': False, 'use_adx': False, 'use_ema': False, 'use_spike': False, 'rsi_required': True, 'edge_k': 1.5854752179127223, 'edge_cap': 0.8212226904556329, 'bull_strategy': 'breakout', 'bull_bb_std_mult': 1.8032086138197194, 'bull_rsi_os': 31, 'bull_rsi_ob': 86, 'bull_adx_thresh': 14.008374165065248, 'bull_atr_min_pct': 0.027733107492674918, 'bull_atr_max_pct': 0.05008137217773123, 'bull_tp_mult': 1.4012900414922889, 'bull_tsl_mult': 0.4031373801407289, 'bull_time_stop': 207, 'bull_use_sma': True, 'bull_use_ema': True, 'bull_use_atr': True, 'bull_use_adx': False, 'bull_use_spike': False, 'bull_rsi_required': True, 'bear_strategy': 'mean_reversion', 'bear_bb_std_mult': 1.9485402999852213, 'bear_rsi_os': 8, 'bear_rsi_ob': 72, 'bear_adx_thresh': 29.62745491362299, 'bear_atr_min_pct': 0.012085333134243313, 'bear_atr_max_pct': 0.11463485293821665, 'bear_tp_mult': 1.9453778840808136, 'bear_tsl_mult': 0.9383133513330242, 'bear_time_stop': 233, 'bear_use_sma': False, 'bear_use_ema': True, 'bear_use_atr': True, 'bear_use_adx': False, 'bear_use_spike': True, 'bear_rsi_required': False, 'sideways_strategy': 'breakout', 'sideways_bb_std_mult': 1.2412234358773595, 'sideways_rsi_os': 47, 'sideways_rsi_ob': 88, 'sideways_adx_thresh': 27.742644609463614, 'sideways_atr_min_pct': 0.004283237302091758, 'sideways_atr_max_pct': 0.04086097293196994, 'sideways_tp_mult': 1.5479406422396345, 'sideways_tsl_mult': 0.609733011853992, 'sideways_time_stop': 267, 'sideways_use_sma': True, 'sideways_use_ema': False, 'sideways_use_atr': False, 'sideways_use_adx': True, 'sideways_use_spike': True, 'sideways_rsi_required': False}.
[I 2025-08-30 21:46:37,306] Trial 467 finished with values: [-1000000000.0, 1000000000.0] and parameters: {'p_sma': 33, 'p_std': 41, 'p_atr': 20, 'p_adx': 7, 'rsi_period': 30, 'ema1': 11, 'ema2': 55, 'slip_atr_k': 0.11470035105131993, 'slip_spread_k': 0.6680242964070792, 'spread_hl_frac': 0.017972794252125137, 'bb_std_mult': 0.8990344162616549, 'rsi_os': 23, 'rsi_ob': 70, 'vol_spike': 0.0405776175706266, 'adx_thresh': 11.429764086589516, 'atr_min_pct': 0.012863246598828707, 'atr_max_pct': 0.050091220413178886, 'tp_mult': 1.8378579865115665, 'tsl_mult': 0.8959594214014719, 'strategy': 'breakout', 'time_stop': 80, 'use_sma': True, 'use_atr': True, 'use_adx': False, 'use_ema': False, 'use_spike': False, 'rsi_required': True, 'edge_k': 1.5580078350739677, 'edge_cap': 0.7921245848791484, 'bull_strategy': 'breakout', 'bull_bb_std_mult': 2.0201085287178926, 'bull_rsi_os': 43, 'bull_rsi_ob': 86, 'bull_adx_thresh': 13.350683883556075, 'bull_atr_min_pct': 0.0013474690467287903, 'bull_atr_max_pct': 0.09740558179998995, 'bull_tp_mult': 1.281492786019042, 'bull_tsl_mult': 0.17059478846807158, 'bull_time_stop': 293, 'bull_use_sma': True, 'bull_use_ema': True, 'bull_use_atr': True, 'bull_use_adx': False, 'bull_use_spike': False, 'bull_rsi_required': True, 'bear_strategy': 'mean_reversion', 'bear_bb_std_mult': 1.881992885673277, 'bear_rsi_os': 6, 'bear_rsi_ob': 72, 'bear_adx_thresh': 28.062684531838475, 'bear_atr_min_pct': 0.0249426782296965, 'bear_atr_max_pct': 0.11564964757041696, 'bear_tp_mult': 1.554982592112985, 'bear_tsl_mult': 0.3337945802966072, 'bear_time_stop': 234, 'bear_use_sma': False, 'bear_use_ema': True, 'bear_use_atr': True, 'bear_use_adx': True, 'bear_use_spike': True, 'bear_rsi_required': False, 'sideways_strategy': 'breakout', 'sideways_bb_std_mult': 2.0113264616984545, 'sideways_rsi_os': 39, 'sideways_rsi_ob': 88, 'sideways_adx_thresh': 27.85291441331438, 'sideways_atr_min_pct': 0.018230926322647497, 'sideways_atr_max_pct': 0.03948292196008954, 'sideways_tp_mult': 1.4821278379829348, 'sideways_tsl_mult': 0.7033663464368162, 'sideways_time_stop': 281, 'sideways_use_sma': True, 'sideways_use_ema': False, 'sideways_use_atr': False, 'sideways_use_adx': True, 'sideways_use_spike': False, 'sideways_rsi_required': False}.
