[I 2025-08-30 22:02:58,141] Trial 610 finished with values: [-1000000000.0, 1000000000.0] and parameters: {'p_sma': 36, 'p_std': 37, 'p_atr': 20, 'p_adx': 21, 'rsi_period': 72, 'ema1': 13, 'ema2': 53, 'slip_atr_k': 0.09455850013811078, 'slip_spread_k': 0.8672850830248915, 'spread_hl_frac': 0.04198001536637745, 'bb_std_mult': 2.3691586478688302, 'rsi_os': 11, 'rsi_ob': 68, 'vol_spike': 0.174401608900978, 'adx_thresh': 10.112051432219065, 'atr_min_pct': 0.013635016995961024, 'atr_max_pct': 0.02757042229064591, 'tp_mult': 2.184995796274968, 'tsl_mult': 0.9282952732437338, 'strategy': 'mean_reversion', 'time_stop': 181, 'use_sma': True, 'use_atr': True, 'use_adx': True, 'use_ema': True, 'use_spike': True, 'rsi_required': False, 'edge_k': 1.2500739752494372, 'edge_cap': 0.8104125739262091, 'bull_strategy': 'mean_reversion', 'bull_bb_std_mult': 1.8406399700801475, 'bull_rsi_os': 19, 'bull_rsi_ob': 75, 'bull_adx_thresh': 19.65890938431651, 'bull_atr_min_pct': 0.022094623631280497, 'bull_atr_max_pct': 0.050843766015704235, 'bull_tp_mult': 1.7824270870900145, 'bull_tsl_mult': 0.349540569038957, 'bull_time_stop': 284, 'bull_use_sma': True, 'bull_use_ema': False, 'bull_use_atr': False, 'bull_use_adx': False, 'bull_use_spike': False, 'bull_rsi_required': True, 'bear_strategy': 'mean_reversion', 'bear_bb_std_mult': 1.6485105973274752, 'bear_rsi_os': 9, 'bear_rsi_ob': 76, 'bear_adx_thresh': 30.340705561095987, 'bear_atr_min_pct': 0.024498651177764938, 'bear_atr_max_pct': 0.11379146084058164, 'bear_tp_mult': 1.4809074289845197, 'bear_tsl_mult': 0.2826123728082345, 'bear_time_stop': 255, 'bear_use_sma': False, 'bear_use_ema': True, 'bear_use_atr': False, 'bear_use_adx': True, 'bear_use_spike': True, 'bear_rsi_required': True, 'sideways_strategy': 'breakout', 'sideways_bb_std_mult': 1.8067507254182549, 'sideways_rsi_os': 39, 'sideways_rsi_ob': 63, 'sideways_adx_thresh': 28.42030230299139, 'sideways_atr_min_pct': 0.0030441784880320365, 'sideways_atr_max_pct': 0.048866783396330424, 'sideways_tp_mult': 1.8307176883126184, 'sideways_tsl_mult': 0.7662883275144007, 'sideways_time_stop': 256, 'sideways_use_sma': False, 'sideways_use_ema': False, 'sideways_use_atr': False, 'sideways_use_adx': True, 'sideways_use_spike': False, 'sideways_rsi_required': False}.
[I 2025-08-30 22:03:00,101] Trial 613 finished with values: [-1000000000.0, 1000000000.0] and parameters: {'p_sma': 60, 'p_std': 37, 'p_atr': 20, 'p_adx': 21, 'rsi_period': 42, 'ema1': 11, 'ema2': 53, 'slip_atr_k': 0.1287847102057301, 'slip_spread_k': 0.8600883396357368, 'spread_hl_frac': 0.030076887952393792, 'bb_std_mult': 0.5729955752049514, 'rsi_os': 28, 'rsi_ob': 68, 'vol_spike': 0.1658932314687741, 'adx_thresh': 11.802727027746917, 'atr_min_pct': 0.014378453364333908, 'atr_max_pct': 0.04782333618732613, 'tp_mult': 1.6799573799549872, 'tsl_mult': 0.01552895472320115, 'strategy': 'mean_reversion', 'time_stop': 95, 'use_sma': True, 'use_atr': True, 'use_adx': False, 'use_ema': True, 'use_spike': False, 'rsi_required': False, 'edge_k': 1.591749535692636, 'edge_cap': 0.8104698574391918, 'bull_strategy': 'breakout', 'bull_bb_std_mult': 1.3620937614280701, 'bull_rsi_os': 19, 'bull_rsi_ob': 87, 'bull_adx_thresh': 33.216114381243806, 'bull_atr_min_pct': 2.808774097846564e-06, 'bull_atr_max_pct': 0.05169480060458008, 'bull_tp_mult': 1.339721939028709, 'bull_tsl_mult': 0.9067195892399238, 'bull_time_stop': 53, 'bull_use_sma': True, 'bull_use_ema': False, 'bull_use_atr': False, 'bull_use_adx': False, 'bull_use_spike': False, 'bull_rsi_required': True, 'bear_strategy': 'mean_reversion', 'bear_bb_std_mult': 3.278608370302229, 'bear_rsi_os': 31, 'bear_rsi_ob': 47, 'bear_adx_thresh': 10.371635097932394, 'bear_atr_min_pct': 0.029093442308026792, 'bear_atr_max_pct': 0.1157015367533103, 'bear_tp_mult': 1.6195181761428743, 'bear_tsl_mult': 0.286843549317934, 'bear_time_stop': 257, 'bear_use_sma': False, 'bear_use_ema': True, 'bear_use_atr': False, 'bear_use_adx': True, 'bear_use_spike': False, 'bear_rsi_required': True, 'sideways_strategy': 'breakout', 'sideways_bb_std_mult': 1.5139334197153438, 'sideways_rsi_os': 50, 'sideways_rsi_ob': 91, 'sideways_adx_thresh': 27.49517869306351, 'sideways_atr_min_pct': 0.021217945014330726, 'sideways_atr_max_pct': 0.03378036991398639, 'sideways_tp_mult': 1.8601345054842584, 'sideways_tsl_mult': 0.7497383649451894, 'sideways_time_stop': 180, 'sideways_use_sma': True, 'sideways_use_ema': False, 'sideways_use_atr': False, 'sideways_use_adx': True, 'sideways_use_spike': True, 'sideways_rsi_required': False}.
[I 2025-08-30 22:03:33,108] Trial 616 finished with values: [-0.01761153437628582, 0.017525143361767963] and parameters: {'p_sma': 20, 'p_std': 29, 'p_atr': 9, 'p_adx': 20, 'rsi_period': 76, 'ema1': 11, 'ema2': 20, 'slip_atr_k': 0.02264289382790214, 'slip_spread_k': 0.3692625051338986, 'spread_hl_frac': 0.030369597185112177, 'bb_std_mult': 2.2564691787091684, 'rsi_os': 26, 'rsi_ob': 67, 'vol_spike': 0.29590008691636194, 'adx_thresh': 11.498074062988096, 'atr_min_pct': 0.010997559506007696, 'atr_max_pct': 0.05427064654452966, 'tp_mult': 2.30772855274533, 'tsl_mult': 0.8373198971511798, 'strategy': 'breakout', 'time_stop': 6, 'use_sma': False, 'use_atr': False, 'use_adx': True, 'use_ema': True, 'use_spike': True, 'rsi_required': True, 'edge_k': 0.27183755877902194, 'edge_cap': 0.4573163054367551, 'bull_strategy': 'breakout', 'bull_bb_std_mult': 1.4731765020782412, 'bull_rsi_os': 19, 'bull_rsi_ob': 88, 'bull_adx_thresh': 30.37250815613674, 'bull_atr_min_pct': 4.1031348446070575e-05, 'bull_atr_max_pct': 0.07224957189478956, 'bull_tp_mult': 1.6943591610548123, 'bull_tsl_mult': 0.4357351623316953, 'bull_time_stop': 95, 'bull_use_sma': True, 'bull_use_ema': False, 'bull_use_atr': True, 'bull_use_adx': False, 'bull_use_spike': False, 'bull_rsi_required': False, 'bear_strategy': 'mean_reversion', 'bear_bb_std_mult': 1.9409572698830326, 'bear_rsi_os': 31, 'bear_rsi_ob': 71, 'bear_adx_thresh': 26.797781455201978, 'bear_atr_min_pct': 0.02999923905017282, 'bear_atr_max_pct': 0.029893456198383205, 'bear_tp_mult': 1.5236703892822052, 'bear_tsl_mult': 0.3803922871791444, 'bear_time_stop': 238, 'bear_use_sma': False, 'bear_use_ema': False, 'bear_use_atr': True, 'bear_use_adx': True, 'bear_use_spike': True, 'bear_rsi_required': False, 'sideways_strategy': 'breakout', 'sideways_bb_std_mult': 3.5926358672676124, 'sideways_rsi_os': 38, 'sideways_rsi_ob': 92, 'sideways_adx_thresh': 27.520891149897178, 'sideways_atr_min_pct': 0.0013021720113023435, 'sideways_atr_max_pct': 0.06869852295124416, 'sideways_tp_mult': 2.3175521611359904, 'sideways_tsl_mult': 0.7331013672725699, 'sideways_time_stop': 263, 'sideways_use_sma': False, 'sideways_use_ema': False, 'sideways_use_atr': False, 'sideways_use_adx': True, 'sideways_use_spike': False, 'sideways_rsi_required': False}.
[I 2025-08-30 22:03:33,434] Trial 614 finished with values: [-0.015714125181662153, 0.015616417960455835] and parameters: {'p_sma': 36, 'p_std': 46, 'p_atr': 22, 'p_adx': 14, 'rsi_period': 76, 'ema1': 11, 'ema2': 52, 'slip_atr_k': 0.020632494997795868, 'slip_spread_k': 0.712228841883993, 'spread_hl_frac': 0.030471099295730907, 'bb_std_mult': 1.0748438900137023, 'rsi_os': 11, 'rsi_ob': 68, 'vol_spike': 0.2960736936007535, 'adx_thresh': 11.119758015887909, 'atr_min_pct': 0.013660171099561488, 'atr_max_pct': 0.015708476570545974, 'tp_mult': 2.324403485379555, 'tsl_mult': 0.8763053371649245, 'strategy': 'breakout', 'time_stop': 190, 'use_sma': True, 'use_atr': False, 'use_adx': True, 'use_ema': True, 'use_spike': True, 'rsi_required': True, 'edge_k': 1.6219101665591316, 'edge_cap': 0.809823064190953, 'bull_strategy': 'breakout', 'bull_bb_std_mult': 1.8872974984524524, 'bull_rsi_os': 19, 'bull_rsi_ob': 75, 'bull_adx_thresh': 14.20486882762127, 'bull_atr_min_pct': 0.0007032231842305538, 'bull_atr_max_pct': 0.04732272307103269, 'bull_tp_mult': 1.4097562399058983, 'bull_tsl_mult': 0.34142986009224363, 'bull_time_stop': 284, 'bull_use_sma': True, 'bull_use_ema': False, 'bull_use_atr': True, 'bull_use_adx': False, 'bull_use_spike': False, 'bull_rsi_required': False, 'bear_strategy': 'mean_reversion', 'bear_bb_std_mult': 1.9354966750315492, 'bear_rsi_os': 8, 'bear_rsi_ob': 47, 'bear_adx_thresh': 21.546489682299892, 'bear_atr_min_pct': 0.029974197279620973, 'bear_atr_max_pct': 0.11655879143546462, 'bear_tp_mult': 1.1562164791394847, 'bear_tsl_mult': 0.2859556374288923, 'bear_time_stop': 256, 'bear_use_sma': False, 'bear_use_ema': True, 'bear_use_atr': True, 'bear_use_adx': True, 'bear_use_spike': True, 'bear_rsi_required': False, 'sideways_strategy': 'breakout', 'sideways_bb_std_mult': 1.5148076503634813, 'sideways_rsi_os': 39, 'sideways_rsi_ob': 87, 'sideways_adx_thresh': 27.592448095671067, 'sideways_atr_min_pct': 0.01938468512187443, 'sideways_atr_max_pct': 0.04337860117113297, 'sideways_tp_mult': 1.795070869017784, 'sideways_tsl_mult': 0.25543865583320324, 'sideways_time_stop': 261, 'sideways_use_sma': False, 'sideways_use_ema': False, 'sideways_use_atr': False, 'sideways_use_adx': True, 'sideways_use_spike': False, 'sideways_rsi_required': False}.
[I 2025-08-30 22:03:33,664] Trial 617 finished with values: [-1000000000.0, 1000000000.0] and parameters: {'p_sma': 8, 'p_std': 36, 'p_atr': 29, 'p_adx': 20, 'rsi_period': 27, 'ema1': 10, 'ema2': 14, 'slip_atr_k': 0.02082190097789148, 'slip_spread_k': 0.23002037306685535, 'spread_hl_frac': 0.03206386569403058, 'bb_std_mult': 2.2463635851700756, 'rsi_os': 13, 'rsi_ob': 67, 'vol_spike': 0.2869230694453394, 'adx_thresh': 11.10365989727961, 'atr_min_pct': 0.012862583215488083, 'atr_max_pct': 0.02281949308397708, 'tp_mult': 1.593681848583834, 'tsl_mult': 0.8428599200640894, 'strategy': 'breakout', 'time_stop': 271, 'use_sma': False, 'use_atr': False, 'use_adx': True, 'use_ema': True, 'use_spike': True, 'rsi_required': True, 'edge_k': 0.32791991828759837, 'edge_cap': 0.32332694692790276, 'bull_strategy': 'breakout', 'bull_bb_std_mult': 2.2108388624255544, 'bull_rsi_os': 15, 'bull_rsi_ob': 57, 'bull_adx_thresh': 26.56605015351949, 'bull_atr_min_pct': 0.00939893687374326, 'bull_atr_max_pct': 0.14589008689686708, 'bull_tp_mult': 2.0289761367011154, 'bull_tsl_mult': 0.4337152306995718, 'bull_time_stop': 97, 'bull_use_sma': True, 'bull_use_ema': False, 'bull_use_atr': True, 'bull_use_adx': False, 'bull_use_spike': False, 'bull_rsi_required': False, 'bear_strategy': 'mean_reversion', 'bear_bb_std_mult': 2.275760639419308, 'bear_rsi_os': 7, 'bear_rsi_ob': 71, 'bear_adx_thresh': 26.53630180882206, 'bear_atr_min_pct': 0.029981821950018972, 'bear_atr_max_pct': 0.1176697643648308, 'bear_tp_mult': 2.368473701475999, 'bear_tsl_mult': 0.9557755361397371, 'bear_time_stop': 238, 'bear_use_sma': False, 'bear_use_ema': False, 'bear_use_atr': True, 'bear_use_adx': True, 'bear_use_spike': True, 'bear_rsi_required': False, 'sideways_strategy': 'breakout', 'sideways_bb_std_mult': 1.6545981205009712, 'sideways_rsi_os': 39, 'sideways_rsi_ob': 57, 'sideways_adx_thresh': 27.68916953768576, 'sideways_atr_min_pct': 0.019441170625928966, 'sideways_atr_max_pct': 0.043396660619676036, 'sideways_tp_mult': 2.7994249681316417, 'sideways_tsl_mult': 0.7301356578621119, 'sideways_time_stop': 263, 'sideways_use_sma': False, 'sideways_use_ema': False, 'sideways_use_atr': False, 'sideways_use_adx': True, 'sideways_use_spike': False, 'sideways_rsi_required': False}.
[I 2025-08-30 22:03:33,877] Trial 615 finished with values: [-1000000000.0, 1000000000.0] and parameters: {'p_sma': 38, 'p_std': 10, 'p_atr': 22, 'p_adx': 20, 'rsi_period': 27, 'ema1': 11, 'ema2': 20, 'slip_atr_k': 0.12721335630212618, 'slip_spread_k': 0.718211462373699, 'spread_hl_frac': 0.029641924854149536, 'bb_std_mult': 1.1014321447686437, 'rsi_os': 13, 'rsi_ob': 67, 'vol_spike': 0.22034762577430067, 'adx_thresh': 11.325007748317123, 'atr_min_pct': 0.014286576758102153, 'atr_max_pct': 0.022301217131097544, 'tp_mult': 1.6042526047256978, 'tsl_mult': 0.8412669640463215, 'strategy': 'breakout', 'time_stop': 6, 'use_sma': False, 'use_atr': False, 'use_adx': True, 'use_ema': True, 'use_spike': True, 'rsi_required': True, 'edge_k': 1.6150871048366682, 'edge_cap': 0.8343034627623089, 'bull_strategy': 'breakout', 'bull_bb_std_mult': 1.4853476370340113, 'bull_rsi_os': 15, 'bull_rsi_ob': 88, 'bull_adx_thresh': 32.1282277342561, 'bull_atr_min_pct': 0.009415814090457789, 'bull_atr_max_pct': 0.047818652051186045, 'bull_tp_mult': 1.569312659294594, 'bull_tsl_mult': 0.4362002241395943, 'bull_time_stop': 291, 'bull_use_sma': True, 'bull_use_ema': False, 'bull_use_atr': True, 'bull_use_adx': False, 'bull_use_spike': False, 'bull_rsi_required': False, 'bear_strategy': 'mean_reversion', 'bear_bb_std_mult': 0.8740673918147679, 'bear_rsi_os': 31, 'bear_rsi_ob': 47, 'bear_adx_thresh': 26.66889602708831, 'bear_atr_min_pct': 0.029007623316958935, 'bear_atr_max_pct': 0.11709784182401704, 'bear_tp_mult': 1.6967833030609556, 'bear_tsl_mult': 0.5968796290281775, 'bear_time_stop': 260, 'bear_use_sma': False, 'bear_use_ema': False, 'bear_use_atr': True, 'bear_use_adx': True, 'bear_use_spike': True, 'bear_rsi_required': False, 'sideways_strategy': 'breakout', 'sideways_bb_std_mult': 2.988856646780632, 'sideways_rsi_os': 29, 'sideways_rsi_ob': 92, 'sideways_adx_thresh': 12.09315665436972, 'sideways_atr_min_pct': 0.02908296126645314, 'sideways_atr_max_pct': 0.03478127812292414, 'sideways_tp_mult': 1.876360187175633, 'sideways_tsl_mult': 0.7329529712036971, 'sideways_time_stop': 283, 'sideways_use_sma': False, 'sideways_use_ema': False, 'sideways_use_atr': False, 'sideways_use_adx': True, 'sideways_use_spike': False, 'sideways_rsi_required': False}.
[I 2025-08-30 22:04:08,937] Trial 621 finished with values: [-0.017078910421602478, 0.017013112988609143] and parameters: {'p_sma': 57, 'p_std': 21, 'p_atr': 9, 'p_adx': 9, 'rsi_period': 12, 'ema1': 11, 'ema2': 52, 'slip_atr_k': 0.028765896891537288, 'slip_spread_k': 0.3595796063175159, 'spread_hl_frac': 0.03374605394939886, 'bb_std_mult': 0.7058319055674005, 'rsi_os': 11, 'rsi_ob': 65, 'vol_spike': 0.2968369501300021, 'adx_thresh': 6.052653135573486, 'atr_min_pct': 0.005168364331978825, 'atr_max_pct': 0.12996555012969813, 'tp_mult': 1.73441255829949, 'tsl_mult': 0.8701356185947203, 'strategy': 'mean_reversion', 'time_stop': 191, 'use_sma': True, 'use_atr': True, 'use_adx': True, 'use_ema': True, 'use_spike': True, 'rsi_required': True, 'edge_k': 0.7888823353977157, 'edge_cap': 0.14875533681119657, 'bull_strategy': 'breakout', 'bull_bb_std_mult': 1.9881597021204092, 'bull_rsi_os': 13, 'bull_rsi_ob': 84, 'bull_adx_thresh': 14.244335036502484, 'bull_atr_min_pct': 0.0011831330673604625, 'bull_atr_max_pct': 0.05477786646115367, 'bull_tp_mult': 1.4016611976241289, 'bull_tsl_mult': 0.3787325586096648, 'bull_time_stop': 28, 'bull_use_sma': True, 'bull_use_ema': False, 'bull_use_atr': False, 'bull_use_adx': False, 'bull_use_spike': True, 'bull_rsi_required': True, 'bear_strategy': 'mean_reversion', 'bear_bb_std_mult': 1.9189182527501094, 'bear_rsi_os': 6, 'bear_rsi_ob': 72, 'bear_adx_thresh': 31.198776671674132, 'bear_atr_min_pct': 0.027167529495852438, 'bear_atr_max_pct': 0.08130232088739427, 'bear_tp_mult': 1.539742833868271, 'bear_tsl_mult': 0.38044570143073975, 'bear_time_stop': 270, 'bear_use_sma': True, 'bear_use_ema': True, 'bear_use_atr': False, 'bear_use_adx': True, 'bear_use_spike': False, 'bear_rsi_required': True, 'sideways_strategy': 'breakout', 'sideways_bb_std_mult': 1.7142642209974015, 'sideways_rsi_os': 44, 'sideways_rsi_ob': 86, 'sideways_adx_thresh': 20.691632226359, 'sideways_atr_min_pct': 0.020538327486170807, 'sideways_atr_max_pct': 0.0592808189396231, 'sideways_tp_mult': 2.4813592735403764, 'sideways_tsl_mult': 0.03646280446990935, 'sideways_time_stop': 54, 'sideways_use_sma': False, 'sideways_use_ema': True, 'sideways_use_atr': True, 'sideways_use_adx': False, 'sideways_use_spike': False, 'sideways_rsi_required': True}.
[I 2025-08-30 22:04:09,118] Trial 620 finished with values: [-1000000000.0, 1000000000.0] and parameters: {'p_sma': 50, 'p_std': 60, 'p_atr': 21, 'p_adx': 9, 'rsi_period': 58, 'ema1': 11, 'ema2': 52, 'slip_atr_k': 0.1715711374262225, 'slip_spread_k': 0.36000943439965644, 'spread_hl_frac': 0.03451850188220015, 'bb_std_mult': 0.7034326383483711, 'rsi_os': 39, 'rsi_ob': 65, 'vol_spike': 0.29183538227016537, 'adx_thresh': 12.622988421706173, 'atr_min_pct': 0.013750964440126898, 'atr_max_pct': 0.01640342722103839, 'tp_mult': 2.341450335793395, 'tsl_mult': 0.8770944013137455, 'strategy': 'mean_reversion', 'time_stop': 188, 'use_sma': False, 'use_atr': True, 'use_adx': True, 'use_ema': True, 'use_spike': True, 'rsi_required': True, 'edge_k': 1.7709948989117614, 'edge_cap': 0.2691338801413281, 'bull_strategy': 'breakout', 'bull_bb_std_mult': 1.996304986612415, 'bull_rsi_os': 13, 'bull_rsi_ob': 90, 'bull_adx_thresh': 30.48058549641867, 'bull_atr_min_pct': 0.004213287200724872, 'bull_atr_max_pct': 0.07255023689543157, 'bull_tp_mult': 1.3950642236912931, 'bull_tsl_mult': 0.3704427289701452, 'bull_time_stop': 295, 'bull_use_sma': True, 'bull_use_ema': False, 'bull_use_atr': False, 'bull_use_adx': False, 'bull_use_spike': True, 'bull_rsi_required': True, 'bear_strategy': 'mean_reversion', 'bear_bb_std_mult': 1.9324323649586845, 'bear_rsi_os': 8, 'bear_rsi_ob': 72, 'bear_adx_thresh': 28.46011901646908, 'bear_atr_min_pct': 0.027442977859430787, 'bear_atr_max_pct': 0.12405393854240009, 'bear_tp_mult': 1.6763284478286429, 'bear_tsl_mult': 0.5721976884346464, 'bear_time_stop': 230, 'bear_use_sma': True, 'bear_use_ema': False, 'bear_use_atr': False, 'bear_use_adx': True, 'bear_use_spike': True, 'bear_rsi_required': True, 'sideways_strategy': 'breakout', 'sideways_bb_std_mult': 0.6068430211233033, 'sideways_rsi_os': 42, 'sideways_rsi_ob': 87, 'sideways_adx_thresh': 16.660489297419588, 'sideways_atr_min_pct': 0.020671653558040872, 'sideways_atr_max_pct': 0.06967757610195403, 'sideways_tp_mult': 1.790529543070241, 'sideways_tsl_mult': 0.047376288533212074, 'sideways_time_stop': 261, 'sideways_use_sma': False, 'sideways_use_ema': True, 'sideways_use_atr': True, 'sideways_use_adx': True, 'sideways_use_spike': False, 'sideways_rsi_required': True}.
[I 2025-08-30 22:04:09,405] Trial 619 finished with values: [-1000000000.0, 1000000000.0] and parameters: {'p_sma': 46, 'p_std': 47, 'p_atr': 21, 'p_adx': 20, 'rsi_period': 77, 'ema1': 27, 'ema2': 50, 'slip_atr_k': 0.029426742714499958, 'slip_spread_k': 0.3906478036833213, 'spread_hl_frac': 0.020531164948378876, 'bb_std_mult': 1.109568537482667, 'rsi_os': 14, 'rsi_ob': 65, 'vol_spike': 0.2943223410962928, 'adx_thresh': 11.286618972002003, 'atr_min_pct': 0.011328338465914883, 'atr_max_pct': 0.015804366195752713, 'tp_mult': 2.3408861468846656, 'tsl_mult': 0.15925658060635856, 'strategy': 'mean_reversion', 'time_stop': 25, 'use_sma': False, 'use_atr': True, 'use_adx': True, 'use_ema': True, 'use_spike': True, 'rsi_required': True, 'edge_k': 1.0554909544884508, 'edge_cap': 0.4626445871392888, 'bull_strategy': 'breakout', 'bull_bb_std_mult': 1.9998301607540765, 'bull_rsi_os': 13, 'bull_rsi_ob': 84, 'bull_adx_thresh': 30.331821991178032, 'bull_atr_min_pct': 0.004472739783029452, 'bull_atr_max_pct': 0.047658240947036044, 'bull_tp_mult': 1.4021578812109239, 'bull_tsl_mult': 0.36974608828976324, 'bull_time_stop': 69, 'bull_use_sma': True, 'bull_use_ema': False, 'bull_use_atr': False, 'bull_use_adx': False, 'bull_use_spike': True, 'bull_rsi_required': True, 'bear_strategy': 'mean_reversion', 'bear_bb_std_mult': 1.9249102531405342, 'bear_rsi_os': 6, 'bear_rsi_ob': 72, 'bear_adx_thresh': 23.99420863506792, 'bear_atr_min_pct': 0.0009575438898010227, 'bear_atr_max_pct': 0.030065407068630347, 'bear_tp_mult': 1.6685690128288642, 'bear_tsl_mult': 0.3715950393230592, 'bear_time_stop': 233, 'bear_use_sma': True, 'bear_use_ema': False, 'bear_use_atr': False, 'bear_use_adx': True, 'bear_use_spike': True, 'bear_rsi_required': True, 'sideways_strategy': 'breakout', 'sideways_bb_std_mult': 0.8892581915020488, 'sideways_rsi_os': 41, 'sideways_rsi_ob': 87, 'sideways_adx_thresh': 11.963895167410092, 'sideways_atr_min_pct': 0.011963743080849852, 'sideways_atr_max_pct': 0.06872752136430714, 'sideways_tp_mult': 1.8036345951380783, 'sideways_tsl_mult': 0.25925379950723104, 'sideways_time_stop': 261, 'sideways_use_sma': False, 'sideways_use_ema': True, 'sideways_use_atr': True, 'sideways_use_adx': True, 'sideways_use_spike': False, 'sideways_rsi_required': True}.
