[I 2025-08-30 22:11:25,060] Trial 683 finished with values: [-1000000000.0, 1000000000.0] and parameters: {'p_sma': 39, 'p_std': 22, 'p_atr': 13, 'p_adx': 25, 'rsi_period': 77, 'ema1': 11, 'ema2': 55, 'slip_atr_k': 0.02066730700985947, 'slip_spread_k': 0.13923001370550198, 'spread_hl_frac': 0.034172113258128634, 'bb_std_mult': 0.9001010488539894, 'rsi_os': 29, 'rsi_ob': 65, 'vol_spike': 0.12006912362915081, 'adx_thresh': 10.504513035295272, 'atr_min_pct': 0.014459550551288542, 'atr_max_pct': 0.0480932618359738, 'tp_mult': 1.7565441696418285, 'tsl_mult': 0.7381890505685735, 'strategy': 'mean_reversion', 'time_stop': 267, 'use_sma': True, 'use_atr': True, 'use_adx': False, 'use_ema': False, 'use_spike': False, 'rsi_required': True, 'edge_k': 1.306616877187666, 'edge_cap': 0.14022800305363514, 'bull_strategy': 'breakout', 'bull_bb_std_mult': 1.9411174980338313, 'bull_rsi_os': 18, 'bull_rsi_ob': 87, 'bull_adx_thresh': 13.69382667883419, 'bull_atr_min_pct': 0.00493934002083966, 'bull_atr_max_pct': 0.050619529861944096, 'bull_tp_mult': 1.497994089128878, 'bull_tsl_mult': 0.3695634586802579, 'bull_time_stop': 165, 'bull_use_sma': True, 'bull_use_ema': True, 'bull_use_atr': False, 'bull_use_adx': False, 'bull_use_spike': False, 'bull_rsi_required': False, 'bear_strategy': 'mean_reversion', 'bear_bb_std_mult': 1.0549780545605354, 'bear_rsi_os': 9, 'bear_rsi_ob': 71, 'bear_adx_thresh': 26.834913842507117, 'bear_atr_min_pct': 0.02464894900741254, 'bear_atr_max_pct': 0.07680441250354571, 'bear_tp_mult': 1.5359978892205932, 'bear_tsl_mult': 0.41545653219435097, 'bear_time_stop': 233, 'bear_use_sma': True, 'bear_use_ema': True, 'bear_use_atr': False, 'bear_use_adx': True, 'bear_use_spike': True, 'bear_rsi_required': False, 'sideways_strategy': 'breakout', 'sideways_bb_std_mult': 1.7940215062178033, 'sideways_rsi_os': 36, 'sideways_rsi_ob': 90, 'sideways_adx_thresh': 23.415133964084013, 'sideways_atr_min_pct': 0.005342071734776894, 'sideways_atr_max_pct': 0.04494720491400139, 'sideways_tp_mult': 1.7791523567004184, 'sideways_tsl_mult': 0.2513586218377901, 'sideways_time_stop': 198, 'sideways_use_sma': True, 'sideways_use_ema': False, 'sideways_use_atr': False, 'sideways_use_adx': True, 'sideways_use_spike': True, 'sideways_rsi_required': False}.
[I 2025-08-30 22:11:26,029] Trial 685 finished with values: [-1000000000.0, 1000000000.0] and parameters: {'p_sma': 39, 'p_std': 27, 'p_atr': 11, 'p_adx': 20, 'rsi_period': 53, 'ema1': 11, 'ema2': 56, 'slip_atr_k': 0.1382267766205432, 'slip_spread_k': 0.6241248587479928, 'spread_hl_frac': 0.010577491033684548, 'bb_std_mult': 0.8264952204275715, 'rsi_os': 6, 'rsi_ob': 68, 'vol_spike': 0.04267772385731307, 'adx_thresh': 10.836090160928268, 'atr_min_pct': 0.023243278277792646, 'atr_max_pct': 0.012992739309070356, 'tp_mult': 1.7376199483181267, 'tsl_mult': 0.6266187591156875, 'strategy': 'breakout', 'time_stop': 33, 'use_sma': True, 'use_atr': True, 'use_adx': False, 'use_ema': False, 'use_spike': False, 'rsi_required': False, 'edge_k': 0.8928153304563782, 'edge_cap': 0.8127310368257233, 'bull_strategy': 'mean_reversion', 'bull_bb_std_mult': 1.8051475662940848, 'bull_rsi_os': 18, 'bull_rsi_ob': 89, 'bull_adx_thresh': 15.140753891034128, 'bull_atr_min_pct': 0.0010008712060857216, 'bull_atr_max_pct': 0.057091383623517636, 'bull_tp_mult': 1.020112990554955, 'bull_tsl_mult': 0.21353046506982476, 'bull_time_stop': 296, 'bull_use_sma': False, 'bull_use_ema': True, 'bull_use_atr': True, 'bull_use_adx': False, 'bull_use_spike': True, 'bull_rsi_required': False, 'bear_strategy': 'mean_reversion', 'bear_bb_std_mult': 1.900552495335728, 'bear_rsi_os': 5, 'bear_rsi_ob': 65, 'bear_adx_thresh': 8.593300782185093, 'bear_atr_min_pct': 0.022458508307390258, 'bear_atr_max_pct': 0.07859625878511803, 'bear_tp_mult': 1.2584143146147786, 'bear_tsl_mult': 0.4153535978441385, 'bear_time_stop': 225, 'bear_use_sma': True, 'bear_use_ema': True, 'bear_use_atr': True, 'bear_use_adx': True, 'bear_use_spike': True, 'bear_rsi_required': False, 'sideways_strategy': 'breakout', 'sideways_bb_std_mult': 2.3563332201897023, 'sideways_rsi_os': 31, 'sideways_rsi_ob': 75, 'sideways_adx_thresh': 27.382351076045705, 'sideways_atr_min_pct': 0.021440595363455148, 'sideways_atr_max_pct': 0.03921988948822714, 'sideways_tp_mult': 1.7785159924919978, 'sideways_tsl_mult': 0.7711102418052664, 'sideways_time_stop': 245, 'sideways_use_sma': True, 'sideways_use_ema': True, 'sideways_use_atr': False, 'sideways_use_adx': True, 'sideways_use_spike': True, 'sideways_rsi_required': True}.
[I 2025-08-30 22:11:59,265] Trial 687 finished with values: [-1000000000.0, 1000000000.0] and parameters: {'p_sma': 36, 'p_std': 15, 'p_atr': 18, 'p_adx': 8, 'rsi_period': 77, 'ema1': 10, 'ema2': 53, 'slip_atr_k': 0.010573208523895313, 'slip_spread_k': 0.6283066233277164, 'spread_hl_frac': 0.03492383375774701, 'bb_std_mult': 0.7125211819807612, 'rsi_os': 14, 'rsi_ob': 68, 'vol_spike': 0.1450476134532011, 'adx_thresh': 11.498255177772108, 'atr_min_pct': 0.029921925437728956, 'atr_max_pct': 0.06491667725126418, 'tp_mult': 1.650702377051548, 'tsl_mult': 0.805370649181188, 'strategy': 'breakout', 'time_stop': 90, 'use_sma': False, 'use_atr': False, 'use_adx': True, 'use_ema': False, 'use_spike': True, 'rsi_required': False, 'edge_k': 1.6449448524196613, 'edge_cap': 0.8164104198698242, 'bull_strategy': 'breakout', 'bull_bb_std_mult': 1.1475713851631286, 'bull_rsi_os': 33, 'bull_rsi_ob': 78, 'bull_adx_thresh': 14.618286274950615, 'bull_atr_min_pct': 0.0024369800947479665, 'bull_atr_max_pct': 0.05035789562650651, 'bull_tp_mult': 1.5008511829551137, 'bull_tsl_mult': 0.6947149196981152, 'bull_time_stop': 277, 'bull_use_sma': True, 'bull_use_ema': True, 'bull_use_atr': True, 'bull_use_adx': False, 'bull_use_spike': True, 'bull_rsi_required': True, 'bear_strategy': 'mean_reversion', 'bear_bb_std_mult': 1.8897285843184572, 'bear_rsi_os': 10, 'bear_rsi_ob': 71, 'bear_adx_thresh': 27.548875995756983, 'bear_atr_min_pct': 0.02883919496654162, 'bear_atr_max_pct': 0.11733385697660025, 'bear_tp_mult': 1.2960298948631817, 'bear_tsl_mult': 0.7942304511296369, 'bear_time_stop': 247, 'bear_use_sma': False, 'bear_use_ema': False, 'bear_use_atr': True, 'bear_use_adx': True, 'bear_use_spike': False, 'bear_rsi_required': True, 'sideways_strategy': 'breakout', 'sideways_bb_std_mult': 1.5121079769534993, 'sideways_rsi_os': 31, 'sideways_rsi_ob': 90, 'sideways_adx_thresh': 27.153224715733874, 'sideways_atr_min_pct': 0.020102399355052838, 'sideways_atr_max_pct': 0.04038818378425196, 'sideways_tp_mult': 1.7669465045798116, 'sideways_tsl_mult': 0.7525287338454167, 'sideways_time_stop': 47, 'sideways_use_sma': False, 'sideways_use_ema': True, 'sideways_use_atr': False, 'sideways_use_adx': True, 'sideways_use_spike': False, 'sideways_rsi_required': True}.
[I 2025-08-30 22:11:59,719] Trial 686 finished with values: [-1000000000.0, 1000000000.0] and parameters: {'p_sma': 34, 'p_std': 56, 'p_atr': 11, 'p_adx': 12, 'rsi_period': 39, 'ema1': 11, 'ema2': 56, 'slip_atr_k': 0.24471357255206005, 'slip_spread_k': 0.6300133453791614, 'spread_hl_frac': 0.034171370888061846, 'bb_std_mult': 0.8154131885548661, 'rsi_os': 32, 'rsi_ob': 68, 'vol_spike': 0.2644017318905672, 'adx_thresh': 11.239703670286358, 'atr_min_pct': 0.002888356776254014, 'atr_max_pct': 0.0521679156338505, 'tp_mult': 1.6715034209129047, 'tsl_mult': 0.07916964455810366, 'strategy': 'breakout', 'time_stop': 268, 'use_sma': True, 'use_atr': False, 'use_adx': True, 'use_ema': False, 'use_spike': True, 'rsi_required': False, 'edge_k': 1.004544501411352, 'edge_cap': 0.8181901172404701, 'bull_strategy': 'mean_reversion', 'bull_bb_std_mult': 1.9787933079256077, 'bull_rsi_os': 24, 'bull_rsi_ob': 90, 'bull_adx_thresh': 15.37109026870889, 'bull_atr_min_pct': 0.028714885217064664, 'bull_atr_max_pct': 0.05075579964119442, 'bull_tp_mult': 1.1538969910615962, 'bull_tsl_mult': 0.09764188185972117, 'bull_time_stop': 163, 'bull_use_sma': False, 'bull_use_ema': True, 'bull_use_atr': True, 'bull_use_adx': False, 'bull_use_spike': True, 'bull_rsi_required': False, 'bear_strategy': 'mean_reversion', 'bear_bb_std_mult': 1.3054935162307717, 'bear_rsi_os': 17, 'bear_rsi_ob': 71, 'bear_adx_thresh': 27.235414492998764, 'bear_atr_min_pct': 0.028855302974284226, 'bear_atr_max_pct': 0.14732623328866953, 'bear_tp_mult': 1.6468505289333846, 'bear_tsl_mult': 0.4264938929207867, 'bear_time_stop': 281, 'bear_use_sma': True, 'bear_use_ema': False, 'bear_use_atr': True, 'bear_use_adx': True, 'bear_use_spike': False, 'bear_rsi_required': False, 'sideways_strategy': 'breakout', 'sideways_bb_std_mult': 1.577448320680115, 'sideways_rsi_os': 41, 'sideways_rsi_ob': 92, 'sideways_adx_thresh': 27.079156373651358, 'sideways_atr_min_pct': 0.021292338511702927, 'sideways_atr_max_pct': 0.03940338293273503, 'sideways_tp_mult': 1.7474068104584999, 'sideways_tsl_mult': 0.760206260509593, 'sideways_time_stop': 243, 'sideways_use_sma': False, 'sideways_use_ema': True, 'sideways_use_atr': False, 'sideways_use_adx': True, 'sideways_use_spike': False, 'sideways_rsi_required': True}.
[I 2025-08-30 22:11:59,963] Trial 688 finished with values: [-1000000000.0, 1000000000.0] and parameters: {'p_sma': 8, 'p_std': 36, 'p_atr': 18, 'p_adx': 8, 'rsi_period': 12, 'ema1': 9, 'ema2': 53, 'slip_atr_k': 0.0118533821819844, 'slip_spread_k': 0.6268710392704108, 'spread_hl_frac': 0.03445550005609562, 'bb_std_mult': 0.5594290235223641, 'rsi_os': 14, 'rsi_ob': 68, 'vol_spike': 0.2694115255374595, 'adx_thresh': 11.268868897715288, 'atr_min_pct': 0.013176647330714627, 'atr_max_pct': 0.1293959537376166, 'tp_mult': 1.6807685869911144, 'tsl_mult': 0.9998351901390313, 'strategy': 'breakout', 'time_stop': 279, 'use_sma': False, 'use_atr': False, 'use_adx': True, 'use_ema': True, 'use_spike': True, 'rsi_required': False, 'edge_k': 0.8319155430646115, 'edge_cap': 0.8284213253854021, 'bull_strategy': 'mean_reversion', 'bull_bb_std_mult': 2.0674773505007873, 'bull_rsi_os': 25, 'bull_rsi_ob': 83, 'bull_adx_thresh': 14.689061391785632, 'bull_atr_min_pct': 0.0027602273161141996, 'bull_atr_max_pct': 0.07668248195694574, 'bull_tp_mult': 1.7894929240674133, 'bull_tsl_mult': 0.4278126670691078, 'bull_time_stop': 279, 'bull_use_sma': False, 'bull_use_ema': False, 'bull_use_atr': True, 'bull_use_adx': False, 'bull_use_spike': True, 'bull_rsi_required': True, 'bear_strategy': 'mean_reversion', 'bear_bb_std_mult': 1.881118369211408, 'bear_rsi_os': 7, 'bear_rsi_ob': 90, 'bear_adx_thresh': 27.904372881384674, 'bear_atr_min_pct': 0.009716806350610703, 'bear_atr_max_pct': 0.09164482932979294, 'bear_tp_mult': 2.3213614792321593, 'bear_tsl_mult': 0.3459037805604992, 'bear_time_stop': 281, 'bear_use_sma': False, 'bear_use_ema': False, 'bear_use_atr': True, 'bear_use_adx': True, 'bear_use_spike': False, 'bear_rsi_required': True, 'sideways_strategy': 'breakout', 'sideways_bb_std_mult': 1.5218623514766603, 'sideways_rsi_os': 31, 'sideways_rsi_ob': 92, 'sideways_adx_thresh': 27.17666026094772, 'sideways_atr_min_pct': 0.020196229573955296, 'sideways_atr_max_pct': 0.023435300255869367, 'sideways_tp_mult': 1.7979172745617746, 'sideways_tsl_mult': 0.7725919841317143, 'sideways_time_stop': 17, 'sideways_use_sma': False, 'sideways_use_ema': True, 'sideways_use_atr': False, 'sideways_use_adx': True, 'sideways_use_spike': False, 'sideways_rsi_required': True}.
[I 2025-08-30 22:12:01,718] Trial 689 finished with values: [-1000000000.0, 1000000000.0] and parameters: {'p_sma': 15, 'p_std': 35, 'p_atr': 21, 'p_adx': 21, 'rsi_period': 69, 'ema1': 10, 'ema2': 53, 'slip_atr_k': 0.1694187845664447, 'slip_spread_k': 0.21346884285172635, 'spread_hl_frac': 0.03449766238215886, 'bb_std_mult': 0.6864022144788252, 'rsi_os': 14, 'rsi_ob': 68, 'vol_spike': 0.2655333561800117, 'adx_thresh': 33.635013495246305, 'atr_min_pct': 0.013091331519004854, 'atr_max_pct': 0.13012104574664504, 'tp_mult': 1.6629774103726438, 'tsl_mult': 0.8170218006223955, 'strategy': 'breakout', 'time_stop': 184, 'use_sma': False, 'use_atr': False, 'use_adx': True, 'use_ema': True, 'use_spike': True, 'rsi_required': False, 'edge_k': 1.0215862428707516, 'edge_cap': 0.8228695275206053, 'bull_strategy': 'breakout', 'bull_bb_std_mult': 1.0574406930605995, 'bull_rsi_os': 15, 'bull_rsi_ob': 84, 'bull_adx_thresh': 7.332410602304584, 'bull_atr_min_pct': 0.002540110948976, 'bull_atr_max_pct': 0.051156952538653336, 'bull_tp_mult': 1.766503447238295, 'bull_tsl_mult': 0.4237516923896845, 'bull_time_stop': 279, 'bull_use_sma': True, 'bull_use_ema': False, 'bull_use_atr': True, 'bull_use_adx': False, 'bull_use_spike': True, 'bull_rsi_required': True, 'bear_strategy': 'mean_reversion', 'bear_bb_std_mult': 2.004418590389825, 'bear_rsi_os': 21, 'bear_rsi_ob': 75, 'bear_adx_thresh': 27.41814907376047, 'bear_atr_min_pct': 0.029004797145444225, 'bear_atr_max_pct': 0.12675781241516848, 'bear_tp_mult': 1.651053847603636, 'bear_tsl_mult': 0.914191657060009, 'bear_time_stop': 248, 'bear_use_sma': False, 'bear_use_ema': False, 'bear_use_atr': True, 'bear_use_adx': True, 'bear_use_spike': False, 'bear_rsi_required': True, 'sideways_strategy': 'breakout', 'sideways_bb_std_mult': 2.0153960563055424, 'sideways_rsi_os': 41, 'sideways_rsi_ob': 92, 'sideways_adx_thresh': 28.32258598642101, 'sideways_atr_min_pct': 0.020094186704184117, 'sideways_atr_max_pct': 0.03623645744685036, 'sideways_tp_mult': 1.690015234211684, 'sideways_tsl_mult': 0.5668625217745948, 'sideways_time_stop': 53, 'sideways_use_sma': False, 'sideways_use_ema': True, 'sideways_use_atr': True, 'sideways_use_adx': False, 'sideways_use_spike': False, 'sideways_rsi_required': True}.
[I 2025-08-30 22:12:02,270] Trial 692 finished with values: [-1000000000.0, 1000000000.0] and parameters: {'p_sma': 50, 'p_std': 34, 'p_atr': 21, 'p_adx': 15, 'rsi_period': 69, 'ema1': 10, 'ema2': 16, 'slip_atr_k': 0.1706643197508728, 'slip_spread_k': 0.23885838380803825, 'spread_hl_frac': 0.032547246569558014, 'bb_std_mult': 0.7090216356047712, 'rsi_os': 51, 'rsi_ob': 88, 'vol_spike': 0.19629300284154255, 'adx_thresh': 9.640853232274132, 'atr_min_pct': 0.00833336114264063, 'atr_max_pct': 0.023408401925743137, 'tp_mult': 1.5922329644646698, 'tsl_mult': 0.8178504263983658, 'strategy': 'mean_reversion', 'time_stop': 225, 'use_sma': True, 'use_atr': True, 'use_adx': True, 'use_ema': True, 'use_spike': True, 'rsi_required': True, 'edge_k': 1.3811821376753786, 'edge_cap': 0.7967413220038436, 'bull_strategy': 'breakout', 'bull_bb_std_mult': 2.454279595908825, 'bull_rsi_os': 16, 'bull_rsi_ob': 84, 'bull_adx_thresh': 16.922829445228928, 'bull_atr_min_pct': 0.006217692531946106, 'bull_atr_max_pct': 0.042553769769289526, 'bull_tp_mult': 1.421460258127206, 'bull_tsl_mult': 0.3300951328409495, 'bull_time_stop': 300, 'bull_use_sma': True, 'bull_use_ema': False, 'bull_use_atr': False, 'bull_use_adx': False, 'bull_use_spike': False, 'bull_rsi_required': True, 'bear_strategy': 'breakout', 'bear_bb_std_mult': 1.967990228689604, 'bear_rsi_os': 7, 'bear_rsi_ob': 75, 'bear_adx_thresh': 28.055690186846462, 'bear_atr_min_pct': 0.029364337519185862, 'bear_atr_max_pct': 0.12673186629023692, 'bear_tp_mult': 1.3847442388397897, 'bear_tsl_mult': 0.3624331122886266, 'bear_time_stop': 246, 'bear_use_sma': False, 'bear_use_ema': True, 'bear_use_atr': False, 'bear_use_adx': False, 'bear_use_spike': True, 'bear_rsi_required': True, 'sideways_strategy': 'mean_reversion', 'sideways_bb_std_mult': 3.1954668087463522, 'sideways_rsi_os': 17, 'sideways_rsi_ob': 89, 'sideways_adx_thresh': 26.37504463694917, 'sideways_atr_min_pct': 0.006371603551167381, 'sideways_atr_max_pct': 0.12998798888386714, 'sideways_tp_mult': 1.678411410251888, 'sideways_tsl_mult': 0.3681710808650789, 'sideways_time_stop': 260, 'sideways_use_sma': False, 'sideways_use_ema': False, 'sideways_use_atr': True, 'sideways_use_adx': False, 'sideways_use_spike': False, 'sideways_rsi_required': False}.
[I 2025-08-30 22:12:02,408] Trial 691 finished with values: [-1000000000.0, 1000000000.0] and parameters: {'p_sma': 24, 'p_std': 34, 'p_atr': 21, 'p_adx': 15, 'rsi_period': 70, 'ema1': 24, 'ema2': 57, 'slip_atr_k': 0.0369367802466494, 'slip_spread_k': 0.22502059790994983, 'spread_hl_frac': 0.03212359362960791, 'bb_std_mult': 0.767862884081794, 'rsi_os': 12, 'rsi_ob': 65, 'vol_spike': 0.2737405461899389, 'adx_thresh': 8.455769275672612, 'atr_min_pct': 0.022130856682129475, 'atr_max_pct': 0.01928398532988094, 'tp_mult': 1.5999871854497896, 'tsl_mult': 0.18171542168319937, 'strategy': 'mean_reversion', 'time_stop': 226, 'use_sma': True, 'use_atr': True, 'use_adx': True, 'use_ema': True, 'use_spike': True, 'rsi_required': True, 'edge_k': 1.0773491334938592, 'edge_cap': 0.7967545817379232, 'bull_strategy': 'breakout', 'bull_bb_std_mult': 1.9629594274975015, 'bull_rsi_os': 31, 'bull_rsi_ob': 85, 'bull_adx_thresh': 17.192620592310348, 'bull_atr_min_pct': 0.018958842991415058, 'bull_atr_max_pct': 0.042736575054538775, 'bull_tp_mult': 1.4134764589125728, 'bull_tsl_mult': 0.1325973412009731, 'bull_time_stop': 51, 'bull_use_sma': True, 'bull_use_ema': False, 'bull_use_atr': False, 'bull_use_adx': False, 'bull_use_spike': False, 'bull_rsi_required': True, 'bear_strategy': 'breakout', 'bear_bb_std_mult': 2.0052584817206465, 'bear_rsi_os': 21, 'bear_rsi_ob': 75, 'bear_adx_thresh': 32.02633377464828, 'bear_atr_min_pct': 0.027201435988465417, 'bear_atr_max_pct': 0.10318376620835151, 'bear_tp_mult': 1.3802550140187169, 'bear_tsl_mult': 0.25043022044373775, 'bear_time_stop': 59, 'bear_use_sma': False, 'bear_use_ema': True, 'bear_use_atr': False, 'bear_use_adx': False, 'bear_use_spike': True, 'bear_rsi_required': True, 'sideways_strategy': 'mean_reversion', 'sideways_bb_std_mult': 2.068780053929926, 'sideways_rsi_os': 12, 'sideways_rsi_ob': 54, 'sideways_adx_thresh': 26.42878868527164, 'sideways_atr_min_pct': 0.020637962106943485, 'sideways_atr_max_pct': 0.05496168759337018, 'sideways_tp_mult': 2.3513940728425067, 'sideways_tsl_mult': 0.2204949354164386, 'sideways_time_stop': 5, 'sideways_use_sma': False, 'sideways_use_ema': False, 'sideways_use_atr': True, 'sideways_use_adx': False, 'sideways_use_spike': False, 'sideways_rsi_required': False}.
[I 2025-08-30 22:12:03,225] Trial 694 finished with values: [-1000000000.0, 1000000000.0] and parameters: {'p_sma': 23, 'p_std': 37, 'p_atr': 20, 'p_adx': 17, 'rsi_period': 60, 'ema1': 12, 'ema2': 29, 'slip_atr_k': 0.031701113315598606, 'slip_spread_k': 0.684094415060926, 'spread_hl_frac': 0.03172607705356927, 'bb_std_mult': 2.50198670787146, 'rsi_os': 12, 'rsi_ob': 65, 'vol_spike': 0.024007344119585522, 'adx_thresh': 8.138978600583902, 'atr_min_pct': 0.024125545020812877, 'atr_max_pct': 0.01997863995894878, 'tp_mult': 2.8918168767926926, 'tsl_mult': 0.17941224961785934, 'strategy': 'mean_reversion', 'time_stop': 93, 'use_sma': True, 'use_atr': True, 'use_adx': True, 'use_ema': True, 'use_spike': True, 'rsi_required': True, 'edge_k': 1.108610303618288, 'edge_cap': 0.9176368993296917, 'bull_strategy': 'breakout', 'bull_bb_std_mult': 0.8023842065751787, 'bull_rsi_os': 49, 'bull_rsi_ob': 55, 'bull_adx_thresh': 13.489377028707123, 'bull_atr_min_pct': 0.02368492960216779, 'bull_atr_max_pct': 0.11179221228276087, 'bull_tp_mult': 2.484986860797132, 'bull_tsl_mult': 0.3919894615592489, 'bull_time_stop': 294, 'bull_use_sma': True, 'bull_use_ema': False, 'bull_use_atr': False, 'bull_use_adx': False, 'bull_use_spike': False, 'bull_rsi_required': True, 'bear_strategy': 'breakout', 'bear_bb_std_mult': 2.97164962837772, 'bear_rsi_os': 6, 'bear_rsi_ob': 74, 'bear_adx_thresh': 19.675746049523177, 'bear_atr_min_pct': 0.029995170034658784, 'bear_atr_max_pct': 0.10336471452778243, 'bear_tp_mult': 1.5023003274117874, 'bear_tsl_mult': 0.39022285008606894, 'bear_time_stop': 201, 'bear_use_sma': False, 'bear_use_ema': True, 'bear_use_atr': False, 'bear_use_adx': True, 'bear_use_spike': True, 'bear_rsi_required': True, 'sideways_strategy': 'breakout', 'sideways_bb_std_mult': 1.7351704747450192, 'sideways_rsi_os': 9, 'sideways_rsi_ob': 85, 'sideways_adx_thresh': 28.087840110703105, 'sideways_atr_min_pct': 0.020741926935581485, 'sideways_atr_max_pct': 0.04163453902453317, 'sideways_tp_mult': 1.8493380220404518, 'sideways_tsl_mult': 0.8019757238201373, 'sideways_time_stop': 300, 'sideways_use_sma': False, 'sideways_use_ema': False, 'sideways_use_atr': False, 'sideways_use_adx': True, 'sideways_use_spike': False, 'sideways_rsi_required': False}.
