[I 2025-08-30 21:57:05,927] Trial 556 finished with values: [-1000000000.0, 1000000000.0] and parameters: {'p_sma': 33, 'p_std': 39, 'p_atr': 21, 'p_adx': 26, 'rsi_period': 72, 'ema1': 10, 'ema2': 55, 'slip_atr_k': 0.24599104164187013, 'slip_spread_k': 0.40051632119406944, 'spread_hl_frac': 5.76286031184238e-05, 'bb_std_mult': 0.8229922289062143, 'rsi_os': 24, 'rsi_ob': 64, 'vol_spike': 0.26946094921220437, 'adx_thresh': 9.280966536631716, 'atr_min_pct': 0.012493454241340888, 'atr_max_pct': 0.018123262290174275, 'tp_mult': 1.2990281683039147, 'tsl_mult': 0.6170001804753213, 'strategy': 'breakout', 'time_stop': 80, 'use_sma': True, 'use_atr': True, 'use_adx': True, 'use_ema': True, 'use_spike': True, 'rsi_required': True, 'edge_k': 1.1296785779957208, 'edge_cap': 0.812621131011392, 'bull_strategy': 'breakout', 'bull_bb_std_mult': 1.6902155279307798, 'bull_rsi_os': 14, 'bull_rsi_ob': 77, 'bull_adx_thresh': 27.24042890817244, 'bull_atr_min_pct': 0.001546015129332343, 'bull_atr_max_pct': 0.05179771015840869, 'bull_tp_mult': 1.3411279189518408, 'bull_tsl_mult': 0.054158733502487955, 'bull_time_stop': 75, 'bull_use_sma': True, 'bull_use_ema': False, 'bull_use_atr': True, 'bull_use_adx': False, 'bull_use_spike': False, 'bull_rsi_required': False, 'bear_strategy': 'mean_reversion', 'bear_bb_std_mult': 0.5659890516031842, 'bear_rsi_os': 9, 'bear_rsi_ob': 65, 'bear_adx_thresh': 5.256907208729713, 'bear_atr_min_pct': 0.026761585554628365, 'bear_atr_max_pct': 0.11594142520115068, 'bear_tp_mult': 2.6599715717215857, 'bear_tsl_mult': 0.9770868031215614, 'bear_time_stop': 242, 'bear_use_sma': False, 'bear_use_ema': True, 'bear_use_atr': True, 'bear_use_adx': True, 'bear_use_spike': True, 'bear_rsi_required': True, 'sideways_strategy': 'breakout', 'sideways_bb_std_mult': 1.7515452393840758, 'sideways_rsi_os': 38, 'sideways_rsi_ob': 91, 'sideways_adx_thresh': 14.896849619631563, 'sideways_atr_min_pct': 0.004072135344945287, 'sideways_atr_max_pct': 0.036126310400182, 'sideways_tp_mult': 1.8257638872689503, 'sideways_tsl_mult': 0.7988051755009076, 'sideways_time_stop': 242, 'sideways_use_sma': False, 'sideways_use_ema': False, 'sideways_use_atr': False, 'sideways_use_adx': True, 'sideways_use_spike': False, 'sideways_rsi_required': False}.
[I 2025-08-30 21:57:06,952] Trial 561 finished with values: [-1000000000.0, 1000000000.0] and parameters: {'p_sma': 48, 'p_std': 35, 'p_atr': 21, 'p_adx': 20, 'rsi_period': 73, 'ema1': 10, 'ema2': 32, 'slip_atr_k': 0.03490851739324092, 'slip_spread_k': 0.43776258679602154, 'spread_hl_frac': 0.03495867399950414, 'bb_std_mult': 2.0626781252201303, 'rsi_os': 55, 'rsi_ob': 63, 'vol_spike': 0.05179432746110531, 'adx_thresh': 11.230835659747926, 'atr_min_pct': 0.002482993528352186, 'atr_max_pct': 0.018264836222898845, 'tp_mult': 2.76279627511635, 'tsl_mult': 0.755862726149074, 'strategy': 'mean_reversion', 'time_stop': 82, 'use_sma': True, 'use_atr': True, 'use_adx': True, 'use_ema': True, 'use_spike': True, 'rsi_required': False, 'edge_k': 1.0023750078253317, 'edge_cap': 0.4104187086875314, 'bull_strategy': 'breakout', 'bull_bb_std_mult': 1.6781619547889213, 'bull_rsi_os': 14, 'bull_rsi_ob': 87, 'bull_adx_thresh': 23.140674552825086, 'bull_atr_min_pct': 0.029368453540210504, 'bull_atr_max_pct': 0.05203553066232462, 'bull_tp_mult': 2.0570173512199768, 'bull_tsl_mult': 0.458061673009482, 'bull_time_stop': 116, 'bull_use_sma': True, 'bull_use_ema': False, 'bull_use_atr': False, 'bull_use_adx': False, 'bull_use_spike': False, 'bull_rsi_required': True, 'bear_strategy': 'mean_reversion', 'bear_bb_std_mult': 0.5184039570902677, 'bear_rsi_os': 9, 'bear_rsi_ob': 83, 'bear_adx_thresh': 19.332284155292193, 'bear_atr_min_pct': 0.029269789815943074, 'bear_atr_max_pct': 0.145606569893457, 'bear_tp_mult': 2.692431096048459, 'bear_tsl_mult': 0.9781581435216817, 'bear_time_stop': 221, 'bear_use_sma': False, 'bear_use_ema': True, 'bear_use_atr': False, 'bear_use_adx': True, 'bear_use_spike': True, 'bear_rsi_required': True, 'sideways_strategy': 'breakout', 'sideways_bb_std_mult': 1.7067527262669562, 'sideways_rsi_os': 5, 'sideways_rsi_ob': 76, 'sideways_adx_thresh': 28.7025070892849, 'sideways_atr_min_pct': 0.003989283069947386, 'sideways_atr_max_pct': 0.040623597740588324, 'sideways_tp_mult': 1.831588084843244, 'sideways_tsl_mult': 0.8054956906303591, 'sideways_time_stop': 39, 'sideways_use_sma': False, 'sideways_use_ema': False, 'sideways_use_atr': False, 'sideways_use_adx': True, 'sideways_use_spike': False, 'sideways_rsi_required': False}.
[I 2025-08-30 21:57:07,620] Trial 563 finished with values: [-1000000000.0, 1000000000.0] and parameters: {'p_sma': 38, 'p_std': 37, 'p_atr': 22, 'p_adx': 20, 'rsi_period': 69, 'ema1': 12, 'ema2': 21, 'slip_atr_k': 0.11027266896783182, 'slip_spread_k': 0.6620017705996454, 'spread_hl_frac': 0.033770185556695566, 'bb_std_mult': 0.9271179056778747, 'rsi_os': 51, 'rsi_ob': 67, 'vol_spike': 0.2800125281796817, 'adx_thresh': 12.95895683377146, 'atr_min_pct': 0.011786712547027574, 'atr_max_pct': 0.02812973989505449, 'tp_mult': 1.5825217937647462, 'tsl_mult': 0.8384474728923057, 'strategy': 'mean_reversion', 'time_stop': 102, 'use_sma': True, 'use_atr': True, 'use_adx': True, 'use_ema': True, 'use_spike': True, 'rsi_required': False, 'edge_k': 1.3728687590457795, 'edge_cap': 0.8228570272468462, 'bull_strategy': 'breakout', 'bull_bb_std_mult': 1.954015538193579, 'bull_rsi_os': 41, 'bull_rsi_ob': 86, 'bull_adx_thresh': 14.161459111460648, 'bull_atr_min_pct': 0.018555605118129016, 'bull_atr_max_pct': 0.14011295554638248, 'bull_tp_mult': 1.4378026137455104, 'bull_tsl_mult': 0.42766652497816704, 'bull_time_stop': 171, 'bull_use_sma': True, 'bull_use_ema': False, 'bull_use_atr': False, 'bull_use_adx': False, 'bull_use_spike': False, 'bull_rsi_required': True, 'bear_strategy': 'mean_reversion', 'bear_bb_std_mult': 1.236776731077598, 'bear_rsi_os': 7, 'bear_rsi_ob': 94, 'bear_adx_thresh': 10.893368184703835, 'bear_atr_min_pct': 0.021743044607782966, 'bear_atr_max_pct': 0.08339516875357096, 'bear_tp_mult': 1.6277005173441077, 'bear_tsl_mult': 0.07249347020961183, 'bear_time_stop': 248, 'bear_use_sma': False, 'bear_use_ema': True, 'bear_use_atr': False, 'bear_use_adx': True, 'bear_use_spike': False, 'bear_rsi_required': True, 'sideways_strategy': 'breakout', 'sideways_bb_std_mult': 1.9296557025780634, 'sideways_rsi_os': 41, 'sideways_rsi_ob': 88, 'sideways_adx_thresh': 23.509652051662492, 'sideways_atr_min_pct': 0.022590376881523752, 'sideways_atr_max_pct': 0.03660638468418623, 'sideways_tp_mult': 1.7693755021436888, 'sideways_tsl_mult': 0.807805230361084, 'sideways_time_stop': 264, 'sideways_use_sma': True, 'sideways_use_ema': False, 'sideways_use_atr': False, 'sideways_use_adx': True, 'sideways_use_spike': False, 'sideways_rsi_required': False}.
[I 2025-08-30 21:57:38,436] Trial 559 finished with values: [-1000000000.0, 1000000000.0] and parameters: {'p_sma': 32, 'p_std': 37, 'p_atr': 21, 'p_adx': 14, 'rsi_period': 73, 'ema1': 10, 'ema2': 16, 'slip_atr_k': 0.024835765598085365, 'slip_spread_k': 0.6624540817349608, 'spread_hl_frac': 0.034972870363608306, 'bb_std_mult': 0.9333939102550726, 'rsi_os': 50, 'rsi_ob': 68, 'vol_spike': 0.04548978391853546, 'adx_thresh': 9.563394329474992, 'atr_min_pct': 0.01205399320283139, 'atr_max_pct': 0.06350290692327429, 'tp_mult': 1.3018905870878785, 'tsl_mult': 0.9165215837471752, 'strategy': 'breakout', 'time_stop': 94, 'use_sma': True, 'use_atr': True, 'use_adx': True, 'use_ema': True, 'use_spike': True, 'rsi_required': False, 'edge_k': 1.4588091714477294, 'edge_cap': 0.5200149301165278, 'bull_strategy': 'breakout', 'bull_bb_std_mult': 1.1922673161870363, 'bull_rsi_os': 42, 'bull_rsi_ob': 87, 'bull_adx_thresh': 27.430838254108203, 'bull_atr_min_pct': 0.014116158039341815, 'bull_atr_max_pct': 0.05189319244096477, 'bull_tp_mult': 1.3343862663827086, 'bull_tsl_mult': 0.42397272083803816, 'bull_time_stop': 117, 'bull_use_sma': True, 'bull_use_ema': False, 'bull_use_atr': True, 'bull_use_adx': False, 'bull_use_spike': False, 'bull_rsi_required': False, 'bear_strategy': 'mean_reversion', 'bear_bb_std_mult': 1.2329082008037715, 'bear_rsi_os': 9, 'bear_rsi_ob': 64, 'bear_adx_thresh': 6.827254313151965, 'bear_atr_min_pct': 0.02481077593314981, 'bear_atr_max_pct': 0.13271245330945133, 'bear_tp_mult': 2.654225927090382, 'bear_tsl_mult': 0.33752737851971026, 'bear_time_stop': 300, 'bear_use_sma': False, 'bear_use_ema': True, 'bear_use_atr': True, 'bear_use_adx': True, 'bear_use_spike': True, 'bear_rsi_required': False, 'sideways_strategy': 'breakout', 'sideways_bb_std_mult': 1.7346465679326837, 'sideways_rsi_os': 36, 'sideways_rsi_ob': 76, 'sideways_adx_thresh': 22.824505950478546, 'sideways_atr_min_pct': 0.021406797467230967, 'sideways_atr_max_pct': 0.03612863937959698, 'sideways_tp_mult': 1.7565603324219, 'sideways_tsl_mult': 0.7565183578815263, 'sideways_time_stop': 254, 'sideways_use_sma': False, 'sideways_use_ema': False, 'sideways_use_atr': False, 'sideways_use_adx': True, 'sideways_use_spike': False, 'sideways_rsi_required': False}.
[I 2025-08-30 21:57:38,832] Trial 562 finished with values: [-1000000000.0, 1000000000.0] and parameters: {'p_sma': 9, 'p_std': 15, 'p_atr': 22, 'p_adx': 12, 'rsi_period': 74, 'ema1': 12, 'ema2': 52, 'slip_atr_k': 0.16522468884823277, 'slip_spread_k': 0.6538154948471318, 'spread_hl_frac': 0.03347850338721, 'bb_std_mult': 2.417736468018311, 'rsi_os': 9, 'rsi_ob': 88, 'vol_spike': 0.04891479337216445, 'adx_thresh': 11.093601830402589, 'atr_min_pct': 0.013281107096763459, 'atr_max_pct': 0.14500414457666613, 'tp_mult': 1.7934446713142553, 'tsl_mult': 0.8355892663406663, 'strategy': 'mean_reversion', 'time_stop': 101, 'use_sma': True, 'use_atr': True, 'use_adx': True, 'use_ema': True, 'use_spike': True, 'rsi_required': False, 'edge_k': 0.9950548055782055, 'edge_cap': 0.8389438993681896, 'bull_strategy': 'breakout', 'bull_bb_std_mult': 1.966523672241972, 'bull_rsi_os': 36, 'bull_rsi_ob': 61, 'bull_adx_thresh': 23.433696561059996, 'bull_atr_min_pct': 0.008011687108427139, 'bull_atr_max_pct': 0.05340114051042154, 'bull_tp_mult': 1.4357326280121432, 'bull_tsl_mult': 0.42979469866268905, 'bull_time_stop': 82, 'bull_use_sma': True, 'bull_use_ema': False, 'bull_use_atr': False, 'bull_use_adx': False, 'bull_use_spike': False, 'bull_rsi_required': True, 'bear_strategy': 'mean_reversion', 'bear_bb_std_mult': 1.2540185149637497, 'bear_rsi_os': 7, 'bear_rsi_ob': 83, 'bear_adx_thresh': 7.395690425317229, 'bear_atr_min_pct': 0.02817228968637301, 'bear_atr_max_pct': 0.04739890623327789, 'bear_tp_mult': 2.444667755411878, 'bear_tsl_mult': 0.3963394453027587, 'bear_time_stop': 217, 'bear_use_sma': False, 'bear_use_ema': True, 'bear_use_atr': False, 'bear_use_adx': True, 'bear_use_spike': True, 'bear_rsi_required': True, 'sideways_strategy': 'breakout', 'sideways_bb_std_mult': 1.716806234147668, 'sideways_rsi_os': 5, 'sideways_rsi_ob': 86, 'sideways_adx_thresh': 28.69095439926035, 'sideways_atr_min_pct': 0.021511376780090966, 'sideways_atr_max_pct': 0.07191816296914472, 'sideways_tp_mult': 1.7754034673854657, 'sideways_tsl_mult': 0.7578213177169233, 'sideways_time_stop': 263, 'sideways_use_sma': False, 'sideways_use_ema': False, 'sideways_use_atr': False, 'sideways_use_adx': True, 'sideways_use_spike': False, 'sideways_rsi_required': False}.
[I 2025-08-30 21:57:38,984] Trial 560 finished with values: [-1000000000.0, 1000000000.0] and parameters: {'p_sma': 9, 'p_std': 37, 'p_atr': 7, 'p_adx': 20, 'rsi_period': 73, 'ema1': 8, 'ema2': 16, 'slip_atr_k': 0.11107997477762575, 'slip_spread_k': 0.6675134374617407, 'spread_hl_frac': 0.03575171825730242, 'bb_std_mult': 2.0555498640207674, 'rsi_os': 9, 'rsi_ob': 68, 'vol_spike': 0.053288516448203885, 'adx_thresh': 12.93943498148286, 'atr_min_pct': 0.011971054484357146, 'atr_max_pct': 0.14543032821849725, 'tp_mult': 2.7485793264819667, 'tsl_mult': 0.918195665685475, 'strategy': 'breakout', 'time_stop': 93, 'use_sma': True, 'use_atr': True, 'use_adx': True, 'use_ema': True, 'use_spike': True, 'rsi_required': False, 'edge_k': 1.4604628191458637, 'edge_cap': 0.41011854810496495, 'bull_strategy': 'breakout', 'bull_bb_std_mult': 1.7309471074144005, 'bull_rsi_os': 42, 'bull_rsi_ob': 61, 'bull_adx_thresh': 27.116200989051453, 'bull_atr_min_pct': 0.02100075905373218, 'bull_atr_max_pct': 0.05137431047248537, 'bull_tp_mult': 2.7862045370837007, 'bull_tsl_mult': 0.4616504108094003, 'bull_time_stop': 292, 'bull_use_sma': True, 'bull_use_ema': False, 'bull_use_atr': True, 'bull_use_adx': False, 'bull_use_spike': False, 'bull_rsi_required': False, 'bear_strategy': 'mean_reversion', 'bear_bb_std_mult': 1.9132230113770987, 'bear_rsi_os': 9, 'bear_rsi_ob': 72, 'bear_adx_thresh': 29.417124932056193, 'bear_atr_min_pct': 0.028336392298281284, 'bear_atr_max_pct': 0.1320450461155992, 'bear_tp_mult': 1.6152400653406638, 'bear_tsl_mult': 0.3903521944891802, 'bear_time_stop': 264, 'bear_use_sma': False, 'bear_use_ema': True, 'bear_use_atr': True, 'bear_use_adx': True, 'bear_use_spike': True, 'bear_rsi_required': False, 'sideways_strategy': 'breakout', 'sideways_bb_std_mult': 1.7444881735199127, 'sideways_rsi_os': 47, 'sideways_rsi_ob': 76, 'sideways_adx_thresh': 27.63771291810209, 'sideways_atr_min_pct': 0.021417414008444557, 'sideways_atr_max_pct': 0.12031865354792964, 'sideways_tp_mult': 1.7736917413127529, 'sideways_tsl_mult': 0.7632971631567258, 'sideways_time_stop': 263, 'sideways_use_sma': False, 'sideways_use_ema': False, 'sideways_use_atr': False, 'sideways_use_adx': True, 'sideways_use_spike': False, 'sideways_rsi_required': False}.
[I 2025-08-30 21:57:41,161] Trial 564 finished with values: [-1000000000.0, 1000000000.0] and parameters: {'p_sma': 7, 'p_std': 58, 'p_atr': 23, 'p_adx': 21, 'rsi_period': 73, 'ema1': 8, 'ema2': 57, 'slip_atr_k': 0.02514107518108219, 'slip_spread_k': 0.6581214221564002, 'spread_hl_frac': 0.03167080576810199, 'bb_std_mult': 3.478935126675543, 'rsi_os': 9, 'rsi_ob': 65, 'vol_spike': 0.2721674850408786, 'adx_thresh': 10.519486850604698, 'atr_min_pct': 0.013205854054714989, 'atr_max_pct': 0.022352979348228066, 'tp_mult': 1.6392181908236199, 'tsl_mult': 0.8560566953937341, 'strategy': 'mean_reversion', 'time_stop': 92, 'use_sma': True, 'use_atr': True, 'use_adx': True, 'use_ema': False, 'use_spike': True, 'rsi_required': True, 'edge_k': 1.1821625640855498, 'edge_cap': 0.27773804534276303, 'bull_strategy': 'breakout', 'bull_bb_std_mult': 1.9782682312527702, 'bull_rsi_os': 39, 'bull_rsi_ob': 87, 'bull_adx_thresh': 6.613109856353393, 'bull_atr_min_pct': 0.008002960748118787, 'bull_atr_max_pct': 0.054182735845391364, 'bull_tp_mult': 1.429449731166287, 'bull_tsl_mult': 0.43607164587495223, 'bull_time_stop': 57, 'bull_use_sma': True, 'bull_use_ema': False, 'bull_use_atr': False, 'bull_use_adx': False, 'bull_use_spike': False, 'bull_rsi_required': True, 'bear_strategy': 'breakout', 'bear_bb_std_mult': 1.1070661873395662, 'bear_rsi_os': 5, 'bear_rsi_ob': 73, 'bear_adx_thresh': 29.616663569246782, 'bear_atr_min_pct': 0.028311840539933852, 'bear_atr_max_pct': 0.033060949096897614, 'bear_tp_mult': 2.4889122815605274, 'bear_tsl_mult': 0.38985770940728315, 'bear_time_stop': 296, 'bear_use_sma': False, 'bear_use_ema': True, 'bear_use_atr': False, 'bear_use_adx': True, 'bear_use_spike': True, 'bear_rsi_required': False, 'sideways_strategy': 'breakout', 'sideways_bb_std_mult': 0.776272076582567, 'sideways_rsi_os': 44, 'sideways_rsi_ob': 86, 'sideways_adx_thresh': 27.082602012274876, 'sideways_atr_min_pct': 0.020068188654973958, 'sideways_atr_max_pct': 0.07987574133520647, 'sideways_tp_mult': 1.8637543052268546, 'sideways_tsl_mult': 0.7584624521449462, 'sideways_time_stop': 255, 'sideways_use_sma': False, 'sideways_use_ema': False, 'sideways_use_atr': False, 'sideways_use_adx': True, 'sideways_use_spike': False, 'sideways_rsi_required': False}.
[I 2025-08-30 21:57:41,826] Trial 565 finished with values: [-1000000000.0, 1000000000.0] and parameters: {'p_sma': 35, 'p_std': 18, 'p_atr': 20, 'p_adx': 18, 'rsi_period': 42, 'ema1': 14, 'ema2': 57, 'slip_atr_k': 0.19713197815026057, 'slip_spread_k': 0.7077368036012296, 'spread_hl_frac': 0.03694935857726428, 'bb_std_mult': 1.9351262099410107, 'rsi_os': 38, 'rsi_ob': 65, 'vol_spike': 0.19556175658261482, 'adx_thresh': 10.440723210167638, 'atr_min_pct': 0.02960690508716169, 'atr_max_pct': 0.022833622698020504, 'tp_mult': 1.4624496239782043, 'tsl_mult': 0.884579058325949, 'strategy': 'mean_reversion', 'time_stop': 85, 'use_sma': True, 'use_atr': True, 'use_adx': True, 'use_ema': False, 'use_spike': True, 'rsi_required': True, 'edge_k': 1.208941552080805, 'edge_cap': 0.7788467240286913, 'bull_strategy': 'breakout', 'bull_bb_std_mult': 1.9900226407274082, 'bull_rsi_os': 15, 'bull_rsi_ob': 61, 'bull_adx_thresh': 15.648251795091083, 'bull_atr_min_pct': 0.015608466349928322, 'bull_atr_max_pct': 0.054366395930806145, 'bull_tp_mult': 1.0628417069008982, 'bull_tsl_mult': 0.8710527888689507, 'bull_time_stop': 292, 'bull_use_sma': False, 'bull_use_ema': True, 'bull_use_atr': False, 'bull_use_adx': False, 'bull_use_spike': False, 'bull_rsi_required': True, 'bear_strategy': 'breakout', 'bear_bb_std_mult': 1.8802250284792488, 'bear_rsi_os': 29, 'bear_rsi_ob': 73, 'bear_adx_thresh': 29.317804518086113, 'bear_atr_min_pct': 0.02805042585359713, 'bear_atr_max_pct': 0.11929839289180144, 'bear_tp_mult': 1.5519345141961647, 'bear_tsl_mult': 0.2635256352408576, 'bear_time_stop': 214, 'bear_use_sma': False, 'bear_use_ema': True, 'bear_use_atr': False, 'bear_use_adx': False, 'bear_use_spike': True, 'bear_rsi_required': True, 'sideways_strategy': 'mean_reversion', 'sideways_bb_std_mult': 1.6358035167389717, 'sideways_rsi_os': 21, 'sideways_rsi_ob': 71, 'sideways_adx_thresh': 5.619378230584381, 'sideways_atr_min_pct': 0.019973454905716084, 'sideways_atr_max_pct': 0.027137223224544812, 'sideways_tp_mult': 1.85697232467833, 'sideways_tsl_mult': 0.7557464257523822, 'sideways_time_stop': 260, 'sideways_use_sma': False, 'sideways_use_ema': False, 'sideways_use_atr': False, 'sideways_use_adx': True, 'sideways_use_spike': False, 'sideways_rsi_required': False}.
[I 2025-08-30 21:57:41,839] Trial 566 finished with values: [-1000000000.0, 1000000000.0] and parameters: {'p_sma': 35, 'p_std': 28, 'p_atr': 7, 'p_adx': 21, 'rsi_period': 70, 'ema1': 11, 'ema2': 57, 'slip_atr_k': 0.0317483884028467, 'slip_spread_k': 0.70174530793438, 'spread_hl_frac': 0.03184368251982868, 'bb_std_mult': 1.9920499818653232, 'rsi_os': 11, 'rsi_ob': 50, 'vol_spike': 0.2792793298871981, 'adx_thresh': 10.468099614864148, 'atr_min_pct': 0.029761283473213967, 'atr_max_pct': 0.0675909588356878, 'tp_mult': 1.4005975472983438, 'tsl_mult': 0.9700727361274786, 'strategy': 'mean_reversion', 'time_stop': 87, 'use_sma': True, 'use_atr': True, 'use_adx': True, 'use_ema': False, 'use_spike': True, 'rsi_required': True, 'edge_k': 1.5700990927675216, 'edge_cap': 0.08669705647897763, 'bull_strategy': 'breakout', 'bull_bb_std_mult': 1.9065147801151034, 'bull_rsi_os': 39, 'bull_rsi_ob': 86, 'bull_adx_thresh': 13.742110522339214, 'bull_atr_min_pct': 0.020842611516989747, 'bull_atr_max_pct': 0.12886562265277815, 'bull_tp_mult': 1.3827552676366182, 'bull_tsl_mult': 0.385793358123667, 'bull_time_stop': 179, 'bull_use_sma': False, 'bull_use_ema': True, 'bull_use_atr': False, 'bull_use_adx': False, 'bull_use_spike': False, 'bull_rsi_required': True, 'bear_strategy': 'breakout', 'bear_bb_std_mult': 3.130503924366033, 'bear_rsi_os': 28, 'bear_rsi_ob': 89, 'bear_adx_thresh': 29.35320108171714, 'bear_atr_min_pct': 0.028795043114984088, 'bear_atr_max_pct': 0.11745571592941821, 'bear_tp_mult': 1.5578672390184434, 'bear_tsl_mult': 0.382758260471634, 'bear_time_stop': 239, 'bear_use_sma': False, 'bear_use_ema': True, 'bear_use_atr': False, 'bear_use_adx': False, 'bear_use_spike': True, 'bear_rsi_required': True, 'sideways_strategy': 'mean_reversion', 'sideways_bb_std_mult': 1.6136849764249712, 'sideways_rsi_os': 20, 'sideways_rsi_ob': 53, 'sideways_adx_thresh': 25.95194206464993, 'sideways_atr_min_pct': 0.02018211775822795, 'sideways_atr_max_pct': 0.04705080181703521, 'sideways_tp_mult': 1.8685963775556065, 'sideways_tsl_mult': 0.7705367555633191, 'sideways_time_stop': 29, 'sideways_use_sma': False, 'sideways_use_ema': False, 'sideways_use_atr': False, 'sideways_use_adx': True, 'sideways_use_spike': False, 'sideways_rsi_required': False}.
