[I 2025-08-30 21:23:30,269] Trial 289 finished with values: [-1000000000.0, 1000000000.0] and parameters: {'p_sma': 55, 'p_std': 16, 'p_atr': 7, 'p_adx': 11, 'rsi_period': 21, 'ema1': 7, 'ema2': 28, 'slip_atr_k': 0.05324216617144541, 'slip_spread_k': 0.9145417677730345, 'spread_hl_frac': 0.03968020270534631, 'bb_std_mult': 1.4848759004572738, 'rsi_os': 13, 'rsi_ob': 50, 'vol_spike': 0.2842010412686094, 'adx_thresh': 30.771101278772246, 'atr_min_pct': 0.010381200380971452, 'atr_max_pct': 0.08767342039896113, 'tp_mult': 1.61109872379778, 'tsl_mult': 0.9213962260114451, 'strategy': 'mean_reversion', 'time_stop': 98, 'use_sma': True, 'use_atr': True, 'use_adx': True, 'use_ema': True, 'use_spike': True, 'rsi_required': True, 'edge_k': 0.9204342532913996, 'edge_cap': 0.6303259706529284, 'bull_strategy': 'breakout', 'bull_bb_std_mult': 3.2400809307098704, 'bull_rsi_os': 14, 'bull_rsi_ob': 85, 'bull_adx_thresh': 16.37690513421623, 'bull_atr_min_pct': 0.0016184383797891305, 'bull_atr_max_pct': 0.10823821922472777, 'bull_tp_mult': 1.929550584114283, 'bull_tsl_mult': 0.3214592729065332, 'bull_time_stop': 300, 'bull_use_sma': True, 'bull_use_ema': False, 'bull_use_atr': False, 'bull_use_adx': True, 'bull_use_spike': True, 'bull_rsi_required': True, 'bear_strategy': 'mean_reversion', 'bear_bb_std_mult': 3.4701001626575305, 'bear_rsi_os': 41, 'bear_rsi_ob': 66, 'bear_adx_thresh': 6.639976105658505, 'bear_atr_min_pct': 0.013051413372938662, 'bear_atr_max_pct': 0.04465142024422311, 'bear_tp_mult': 2.8482528373088254, 'bear_tsl_mult': 0.4400657462714164, 'bear_time_stop': 160, 'bear_use_sma': True, 'bear_use_ema': False, 'bear_use_atr': False, 'bear_use_adx': True, 'bear_use_spike': True, 'bear_rsi_required': True, 'sideways_strategy': 'breakout', 'sideways_bb_std_mult': 1.5499173054301023, 'sideways_rsi_os': 26, 'sideways_rsi_ob': 94, 'sideways_adx_thresh': 9.362923053134645, 'sideways_atr_min_pct': 0.014538924053567288, 'sideways_atr_max_pct': 0.10327743550256653, 'sideways_tp_mult': 2.066465608552797, 'sideways_tsl_mult': 0.5108915402991475, 'sideways_time_stop': 250, 'sideways_use_sma': False, 'sideways_use_ema': True, 'sideways_use_atr': True, 'sideways_use_adx': False, 'sideways_use_spike': False, 'sideways_rsi_required': True}.
[I 2025-08-30 21:23:30,277] Trial 290 finished with values: [-1000000000.0, 1000000000.0] and parameters: {'p_sma': 28, 'p_std': 16, 'p_atr': 7, 'p_adx': 29, 'rsi_period': 19, 'ema1': 18, 'ema2': 42, 'slip_atr_k': 0.04762662773350891, 'slip_spread_k': 0.5735053946105296, 'spread_hl_frac': 0.006175306220013608, 'bb_std_mult': 2.9275478375860984, 'rsi_os': 21, 'rsi_ob': 50, 'vol_spike': 0.2843217037006494, 'adx_thresh': 30.605018788107518, 'atr_min_pct': 0.023249466726727452, 'atr_max_pct': 0.09087876099583017, 'tp_mult': 2.5478400643326884, 'tsl_mult': 0.9084415799976973, 'strategy': 'mean_reversion', 'time_stop': 117, 'use_sma': True, 'use_atr': True, 'use_adx': True, 'use_ema': True, 'use_spike': True, 'rsi_required': True, 'edge_k': 1.0001804041647997, 'edge_cap': 0.5975205618134672, 'bull_strategy': 'breakout', 'bull_bb_std_mult': 3.499584974220326, 'bull_rsi_os': 19, 'bull_rsi_ob': 73, 'bull_adx_thresh': 16.121873583366618, 'bull_atr_min_pct': 0.0004704447242688562, 'bull_atr_max_pct': 0.0519682154611046, 'bull_tp_mult': 1.7741072613028404, 'bull_tsl_mult': 0.5634485552989589, 'bull_time_stop': 285, 'bull_use_sma': True, 'bull_use_ema': False, 'bull_use_atr': False, 'bull_use_adx': True, 'bull_use_spike': True, 'bull_rsi_required': True, 'bear_strategy': 'mean_reversion', 'bear_bb_std_mult': 2.775121164850361, 'bear_rsi_os': 18, 'bear_rsi_ob': 60, 'bear_adx_thresh': 15.683732063717324, 'bear_atr_min_pct': 0.0165635528149112, 'bear_atr_max_pct': 0.09400465974275216, 'bear_tp_mult': 2.776740484295938, 'bear_tsl_mult': 0.3861387594868095, 'bear_time_stop': 118, 'bear_use_sma': True, 'bear_use_ema': True, 'bear_use_atr': False, 'bear_use_adx': True, 'bear_use_spike': True, 'bear_rsi_required': True, 'sideways_strategy': 'breakout', 'sideways_bb_std_mult': 1.53971469322188, 'sideways_rsi_os': 24, 'sideways_rsi_ob': 88, 'sideways_adx_thresh': 26.537632370204783, 'sideways_atr_min_pct': 0.014704185599050025, 'sideways_atr_max_pct': 0.10283054927216995, 'sideways_tp_mult': 2.0654714997838184, 'sideways_tsl_mult': 0.5127756249371304, 'sideways_time_stop': 248, 'sideways_use_sma': False, 'sideways_use_ema': True, 'sideways_use_atr': True, 'sideways_use_adx': False, 'sideways_use_spike': False, 'sideways_rsi_required': True}.
[I 2025-08-30 21:24:02,444] Trial 288 finished with values: [-1000000000.0, 1000000000.0] and parameters: {'p_sma': 39, 'p_std': 30, 'p_atr': 24, 'p_adx': 30, 'rsi_period': 61, 'ema1': 18, 'ema2': 51, 'slip_atr_k': 0.027188052515135668, 'slip_spread_k': 0.41105051696085493, 'spread_hl_frac': 0.005507145530234871, 'bb_std_mult': 2.841717334265436, 'rsi_os': 13, 'rsi_ob': 90, 'vol_spike': 0.008871093454898171, 'adx_thresh': 30.607076129952418, 'atr_min_pct': 0.010231297500027797, 'atr_max_pct': 0.03084897250981526, 'tp_mult': 2.6158806784961657, 'tsl_mult': 0.6119073616386824, 'strategy': 'mean_reversion', 'time_stop': 103, 'use_sma': True, 'use_atr': True, 'use_adx': True, 'use_ema': True, 'use_spike': True, 'rsi_required': True, 'edge_k': 1.1081770764003922, 'edge_cap': 0.6248460987744655, 'bull_strategy': 'breakout', 'bull_bb_std_mult': 3.5050123363197994, 'bull_rsi_os': 42, 'bull_rsi_ob': 72, 'bull_adx_thresh': 16.526390362561106, 'bull_atr_min_pct': 0.001645546326059657, 'bull_atr_max_pct': 0.1379870569091217, 'bull_tp_mult': 1.746582681670668, 'bull_tsl_mult': 0.8682034126539167, 'bull_time_stop': 286, 'bull_use_sma': True, 'bull_use_ema': False, 'bull_use_atr': False, 'bull_use_adx': True, 'bull_use_spike': True, 'bull_rsi_required': True, 'bear_strategy': 'mean_reversion', 'bear_bb_std_mult': 2.7686654929479055, 'bear_rsi_os': 40, 'bear_rsi_ob': 66, 'bear_adx_thresh': 15.895020700140448, 'bear_atr_min_pct': 0.022118641714953938, 'bear_atr_max_pct': 0.07173193439179552, 'bear_tp_mult': 2.849855329289714, 'bear_tsl_mult': 0.38595257232468305, 'bear_time_stop': 108, 'bear_use_sma': True, 'bear_use_ema': True, 'bear_use_atr': False, 'bear_use_adx': True, 'bear_use_spike': True, 'bear_rsi_required': True, 'sideways_strategy': 'breakout', 'sideways_bb_std_mult': 1.5639030937780307, 'sideways_rsi_os': 29, 'sideways_rsi_ob': 94, 'sideways_adx_thresh': 20.987112850537734, 'sideways_atr_min_pct': 0.013631337233510349, 'sideways_atr_max_pct': 0.10301927356861351, 'sideways_tp_mult': 2.1783519949121644, 'sideways_tsl_mult': 0.4273251905259921, 'sideways_time_stop': 249, 'sideways_use_sma': False, 'sideways_use_ema': True, 'sideways_use_atr': True, 'sideways_use_adx': False, 'sideways_use_spike': False, 'sideways_rsi_required': True}.
[I 2025-08-30 21:24:02,967] Trial 291 finished with values: [-0.02110611102832083, 0.021118221072943918] and parameters: {'p_sma': 28, 'p_std': 30, 'p_atr': 16, 'p_adx': 30, 'rsi_period': 20, 'ema1': 18, 'ema2': 18, 'slip_atr_k': 0.0995190560629042, 'slip_spread_k': 0.5673782251483186, 'spread_hl_frac': 0.005465616256996162, 'bb_std_mult': 2.8968802263624216, 'rsi_os': 13, 'rsi_ob': 79, 'vol_spike': 0.284540113961927, 'adx_thresh': 30.517320020255706, 'atr_min_pct': 0.018069988968087692, 'atr_max_pct': 0.030676166091081827, 'tp_mult': 1.5479609685442948, 'tsl_mult': 0.5899825307125248, 'strategy': 'mean_reversion', 'time_stop': 115, 'use_sma': True, 'use_atr': True, 'use_adx': True, 'use_ema': True, 'use_spike': True, 'rsi_required': True, 'edge_k': 1.1084128000420268, 'edge_cap': 0.5420532407288137, 'bull_strategy': 'breakout', 'bull_bb_std_mult': 3.518061679062858, 'bull_rsi_os': 19, 'bull_rsi_ob': 55, 'bull_adx_thresh': 5.535871791186919, 'bull_atr_min_pct': 0.00044784378127662165, 'bull_atr_max_pct': 0.05016693627511063, 'bull_tp_mult': 1.397817132826379, 'bull_tsl_mult': 0.5661625887251683, 'bull_time_stop': 220, 'bull_use_sma': True, 'bull_use_ema': False, 'bull_use_atr': False, 'bull_use_adx': True, 'bull_use_spike': True, 'bull_rsi_required': True, 'bear_strategy': 'mean_reversion', 'bear_bb_std_mult': 1.9117977247687605, 'bear_rsi_os': 40, 'bear_rsi_ob': 51, 'bear_adx_thresh': 15.87422217278351, 'bear_atr_min_pct': 0.022276498081774853, 'bear_atr_max_pct': 0.04359448966628174, 'bear_tp_mult': 1.7420325775815235, 'bear_tsl_mult': 0.8475413103837525, 'bear_time_stop': 165, 'bear_use_sma': True, 'bear_use_ema': True, 'bear_use_atr': False, 'bear_use_adx': True, 'bear_use_spike': True, 'bear_rsi_required': True, 'sideways_strategy': 'breakout', 'sideways_bb_std_mult': 1.8561540909378575, 'sideways_rsi_os': 39, 'sideways_rsi_ob': 45, 'sideways_adx_thresh': 26.150599718560848, 'sideways_atr_min_pct': 0.014705151443365814, 'sideways_atr_max_pct': 0.03181544002456989, 'sideways_tp_mult': 2.0537318298439042, 'sideways_tsl_mult': 0.07680728017847166, 'sideways_time_stop': 30, 'sideways_use_sma': False, 'sideways_use_ema': True, 'sideways_use_atr': True, 'sideways_use_adx': False, 'sideways_use_spike': False, 'sideways_rsi_required': True}.
[I 2025-08-30 21:24:05,902] Trial 292 finished with values: [-1000000000.0, 1000000000.0] and parameters: {'p_sma': 14, 'p_std': 59, 'p_atr': 16, 'p_adx': 30, 'rsi_period': 61, 'ema1': 28, 'ema2': 18, 'slip_atr_k': 0.045372047878093714, 'slip_spread_k': 0.41042007025632166, 'spread_hl_frac': 0.012727341078225485, 'bb_std_mult': 3.082400028102723, 'rsi_os': 21, 'rsi_ob': 79, 'vol_spike': 0.29957561146326006, 'adx_thresh': 30.315683163455837, 'atr_min_pct': 0.008194110851364313, 'atr_max_pct': 0.09109416812710697, 'tp_mult': 1.6818082159203258, 'tsl_mult': 0.9104653361778305, 'strategy': 'mean_reversion', 'time_stop': 117, 'use_sma': True, 'use_atr': True, 'use_adx': True, 'use_ema': True, 'use_spike': True, 'rsi_required': True, 'edge_k': 0.6882287961593065, 'edge_cap': 0.5904352467939082, 'bull_strategy': 'breakout', 'bull_bb_std_mult': 2.2674073640019454, 'bull_rsi_os': 17, 'bull_rsi_ob': 94, 'bull_adx_thresh': 17.653416412136142, 'bull_atr_min_pct': 5.954223478820916e-06, 'bull_atr_max_pct': 0.051175868996122406, 'bull_tp_mult': 1.7598225715699338, 'bull_tsl_mult': 0.30696735780703155, 'bull_time_stop': 283, 'bull_use_sma': True, 'bull_use_ema': False, 'bull_use_atr': False, 'bull_use_adx': True, 'bull_use_spike': True, 'bull_rsi_required': True, 'bear_strategy': 'mean_reversion', 'bear_bb_std_mult': 1.9200446892668384, 'bear_rsi_os': 17, 'bear_rsi_ob': 93, 'bear_adx_thresh': 15.817814023667868, 'bear_atr_min_pct': 0.01683760808253178, 'bear_atr_max_pct': 0.10712538099432346, 'bear_tp_mult': 2.7687544978097587, 'bear_tsl_mult': 0.3871405654761771, 'bear_time_stop': 121, 'bear_use_sma': True, 'bear_use_ema': True, 'bear_use_atr': False, 'bear_use_adx': True, 'bear_use_spike': True, 'bear_rsi_required': True, 'sideways_strategy': 'breakout', 'sideways_bb_std_mult': 1.6450467113924385, 'sideways_rsi_os': 28, 'sideways_rsi_ob': 88, 'sideways_adx_thresh': 18.846093368620824, 'sideways_atr_min_pct': 0.014812708704532074, 'sideways_atr_max_pct': 0.11586907935572294, 'sideways_tp_mult': 2.0335936853087158, 'sideways_tsl_mult': 0.09611502979722142, 'sideways_time_stop': 257, 'sideways_use_sma': False, 'sideways_use_ema': True, 'sideways_use_atr': True, 'sideways_use_adx': False, 'sideways_use_spike': False, 'sideways_rsi_required': True}.
[I 2025-08-30 21:24:06,060] Trial 293 finished with values: [-1000000000.0, 1000000000.0] and parameters: {'p_sma': 14, 'p_std': 29, 'p_atr': 23, 'p_adx': 30, 'rsi_period': 10, 'ema1': 21, 'ema2': 18, 'slip_atr_k': 0.06527791892433338, 'slip_spread_k': 0.14906019189961522, 'spread_hl_frac': 0.017054075471168623, 'bb_std_mult': 1.7009718309462214, 'rsi_os': 8, 'rsi_ob': 79, 'vol_spike': 0.003655134279618416, 'adx_thresh': 29.861157560875686, 'atr_min_pct': 0.007806908816732695, 'atr_max_pct': 0.03248138315061563, 'tp_mult': 2.6041673872302837, 'tsl_mult': 0.6107692505428459, 'strategy': 'mean_reversion', 'time_stop': 269, 'use_sma': False, 'use_atr': True, 'use_adx': True, 'use_ema': True, 'use_spike': True, 'rsi_required': True, 'edge_k': 0.6818757806147293, 'edge_cap': 0.5810649634400288, 'bull_strategy': 'breakout', 'bull_bb_std_mult': 1.651260252116083, 'bull_rsi_os': 11, 'bull_rsi_ob': 69, 'bull_adx_thresh': 17.79109166630555, 'bull_atr_min_pct': 0.027576844335215404, 'bull_atr_max_pct': 0.014206686830512127, 'bull_tp_mult': 2.2934766324424363, 'bull_tsl_mult': 0.5302160031384543, 'bull_time_stop': 139, 'bull_use_sma': True, 'bull_use_ema': False, 'bull_use_atr': False, 'bull_use_adx': True, 'bull_use_spike': True, 'bull_rsi_required': True, 'bear_strategy': 'mean_reversion', 'bear_bb_std_mult': 2.5810734028069917, 'bear_rsi_os': 40, 'bear_rsi_ob': 90, 'bear_adx_thresh': 16.889954074316375, 'bear_atr_min_pct': 0.021629063458268042, 'bear_atr_max_pct': 0.016351668336385322, 'bear_tp_mult': 1.3013656339924022, 'bear_tsl_mult': 0.39711378661643976, 'bear_time_stop': 20, 'bear_use_sma': True, 'bear_use_ema': True, 'bear_use_atr': False, 'bear_use_adx': True, 'bear_use_spike': True, 'bear_rsi_required': True, 'sideways_strategy': 'breakout', 'sideways_bb_std_mult': 1.652149102723045, 'sideways_rsi_os': 29, 'sideways_rsi_ob': 93, 'sideways_adx_thresh': 18.775542703410014, 'sideways_atr_min_pct': 0.029568758307537607, 'sideways_atr_max_pct': 0.14515435114125716, 'sideways_tp_mult': 2.1116235118591584, 'sideways_tsl_mult': 0.684648490913097, 'sideways_time_stop': 260, 'sideways_use_sma': False, 'sideways_use_ema': True, 'sideways_use_atr': True, 'sideways_use_adx': False, 'sideways_use_spike': False, 'sideways_rsi_required': True}.
[I 2025-08-30 21:24:38,432] Trial 294 finished with values: [-1000000000.0, 1000000000.0] and parameters: {'p_sma': 33, 'p_std': 59, 'p_atr': 15, 'p_adx': 16, 'rsi_period': 17, 'ema1': 21, 'ema2': 18, 'slip_atr_k': 0.06680862260721239, 'slip_spread_k': 0.1480064537702942, 'spread_hl_frac': 0.011427711790909609, 'bb_std_mult': 1.6873337132027861, 'rsi_os': 16, 'rsi_ob': 79, 'vol_spike': 0.29926808909843183, 'adx_thresh': 27.839442529597555, 'atr_min_pct': 0.01812349458401378, 'atr_max_pct': 0.08503805122967613, 'tp_mult': 1.5493296820876126, 'tsl_mult': 0.3557249931937194, 'strategy': 'mean_reversion', 'time_stop': 126, 'use_sma': False, 'use_atr': True, 'use_adx': True, 'use_ema': True, 'use_spike': True, 'rsi_required': True, 'edge_k': 0.683799131943848, 'edge_cap': 0.5407002358092826, 'bull_strategy': 'breakout', 'bull_bb_std_mult': 2.2992025022653957, 'bull_rsi_os': 32, 'bull_rsi_ob': 94, 'bull_adx_thresh': 32.7137537884543, 'bull_atr_min_pct': 0.00036010118845136913, 'bull_atr_max_pct': 0.012690336331470112, 'bull_tp_mult': 1.7039903299962609, 'bull_tsl_mult': 0.30063055517370507, 'bull_time_stop': 229, 'bull_use_sma': True, 'bull_use_ema': False, 'bull_use_atr': False, 'bull_use_adx': True, 'bull_use_spike': True, 'bull_rsi_required': True, 'bear_strategy': 'mean_reversion', 'bear_bb_std_mult': 3.0390618295305716, 'bear_rsi_os': 38, 'bear_rsi_ob': 86, 'bear_adx_thresh': 30.10446790650009, 'bear_atr_min_pct': 0.024383637468746007, 'bear_atr_max_pct': 0.016788523058031822, 'bear_tp_mult': 2.8985576481499034, 'bear_tsl_mult': 0.49865534472575995, 'bear_time_stop': 132, 'bear_use_sma': True, 'bear_use_ema': False, 'bear_use_atr': False, 'bear_use_adx': True, 'bear_use_spike': True, 'bear_rsi_required': True, 'sideways_strategy': 'breakout', 'sideways_bb_std_mult': 1.6421270905274037, 'sideways_rsi_os': 39, 'sideways_rsi_ob': 59, 'sideways_adx_thresh': 27.931437769987664, 'sideways_atr_min_pct': 0.01596509190578546, 'sideways_atr_max_pct': 0.08113826485642184, 'sideways_tp_mult': 2.1008485106825514, 'sideways_tsl_mult': 0.4203937537786362, 'sideways_time_stop': 258, 'sideways_use_sma': False, 'sideways_use_ema': True, 'sideways_use_atr': False, 'sideways_use_adx': False, 'sideways_use_spike': False, 'sideways_rsi_required': True}.
[I 2025-08-30 21:24:38,731] Trial 295 finished with values: [-1000000000.0, 1000000000.0] and parameters: {'p_sma': 37, 'p_std': 34, 'p_atr': 14, 'p_adx': 24, 'rsi_period': 17, 'ema1': 11, 'ema2': 18, 'slip_atr_k': 0.06666360709273327, 'slip_spread_k': 0.5590009619859543, 'spread_hl_frac': 0.007929164744693563, 'bb_std_mult': 1.8649486708517844, 'rsi_os': 7, 'rsi_ob': 79, 'vol_spike': 0.2901580826451899, 'adx_thresh': 28.141471348692416, 'atr_min_pct': 0.019144966995214858, 'atr_max_pct': 0.08461819856930344, 'tp_mult': 1.5579888967148445, 'tsl_mult': 0.912704894950858, 'strategy': 'mean_reversion', 'time_stop': 112, 'use_sma': False, 'use_atr': True, 'use_adx': True, 'use_ema': True, 'use_spike': True, 'rsi_required': True, 'edge_k': 0.1960518817205963, 'edge_cap': 0.5449912384246153, 'bull_strategy': 'breakout', 'bull_bb_std_mult': 3.3867943852728972, 'bull_rsi_os': 32, 'bull_rsi_ob': 69, 'bull_adx_thresh': 22.393519537699007, 'bull_atr_min_pct': 3.724751048153347e-05, 'bull_atr_max_pct': 0.014507582165854419, 'bull_tp_mult': 1.1361563668208268, 'bull_tsl_mult': 0.5238068648464008, 'bull_time_stop': 221, 'bull_use_sma': True, 'bull_use_ema': False, 'bull_use_atr': False, 'bull_use_adx': True, 'bull_use_spike': True, 'bull_rsi_required': True, 'bear_strategy': 'mean_reversion', 'bear_bb_std_mult': 2.6083340657854355, 'bear_rsi_os': 40, 'bear_rsi_ob': 93, 'bear_adx_thresh': 16.74421086296538, 'bear_atr_min_pct': 0.006115988421429323, 'bear_atr_max_pct': 0.015878783274834184, 'bear_tp_mult': 1.2961726640929236, 'bear_tsl_mult': 0.48587862194432185, 'bear_time_stop': 129, 'bear_use_sma': False, 'bear_use_ema': False, 'bear_use_atr': False, 'bear_use_adx': True, 'bear_use_spike': True, 'bear_rsi_required': True, 'sideways_strategy': 'breakout', 'sideways_bb_std_mult': 1.651194948624251, 'sideways_rsi_os': 11, 'sideways_rsi_ob': 59, 'sideways_adx_thresh': 27.765996292051877, 'sideways_atr_min_pct': 0.01486015318528616, 'sideways_atr_max_pct': 0.08102308623295106, 'sideways_tp_mult': 2.0980439650718212, 'sideways_tsl_mult': 0.9725061970117368, 'sideways_time_stop': 258, 'sideways_use_sma': False, 'sideways_use_ema': True, 'sideways_use_atr': False, 'sideways_use_adx': True, 'sideways_use_spike': False, 'sideways_rsi_required': True}.
[I 2025-08-30 21:24:39,338] Trial 296 finished with values: [-1000000000.0, 1000000000.0] and parameters: {'p_sma': 29, 'p_std': 34, 'p_atr': 15, 'p_adx': 10, 'rsi_period': 41, 'ema1': 21, 'ema2': 36, 'slip_atr_k': 0.03626422899241, 'slip_spread_k': 0.03723029023145635, 'spread_hl_frac': 0.016908958988936986, 'bb_std_mult': 1.6742981621650044, 'rsi_os': 7, 'rsi_ob': 93, 'vol_spike': 0.07045627258971436, 'adx_thresh': 17.283254575783165, 'atr_min_pct': 0.01920603397122361, 'atr_max_pct': 0.08478048628526005, 'tp_mult': 2.7969415525539114, 'tsl_mult': 0.3690973484880943, 'strategy': 'breakout', 'time_stop': 110, 'use_sma': False, 'use_atr': True, 'use_adx': False, 'use_ema': False, 'use_spike': False, 'rsi_required': True, 'edge_k': 0.678613254920595, 'edge_cap': 0.5689986703327787, 'bull_strategy': 'mean_reversion', 'bull_bb_std_mult': 0.5051099548345488, 'bull_rsi_os': 19, 'bull_rsi_ob': 69, 'bull_adx_thresh': 14.960210901143384, 'bull_atr_min_pct': 0.02734745964727271, 'bull_atr_max_pct': 0.061125151432353836, 'bull_tp_mult': 1.1621684676878232, 'bull_tsl_mult': 0.49169818736011756, 'bull_time_stop': 221, 'bull_use_sma': True, 'bull_use_ema': True, 'bull_use_atr': True, 'bull_use_adx': True, 'bull_use_spike': False, 'bull_rsi_required': False, 'bear_strategy': 'breakout', 'bear_bb_std_mult': 2.658337378035049, 'bear_rsi_os': 40, 'bear_rsi_ob': 51, 'bear_adx_thresh': 16.604982440644193, 'bear_atr_min_pct': 0.01133347308479363, 'bear_atr_max_pct': 0.12430612285333303, 'bear_tp_mult': 2.9243131962264415, 'bear_tsl_mult': 0.4876351890919932, 'bear_time_stop': 92, 'bear_use_sma': False, 'bear_use_ema': False, 'bear_use_atr': True, 'bear_use_adx': False, 'bear_use_spike': True, 'bear_rsi_required': False, 'sideways_strategy': 'mean_reversion', 'sideways_bb_std_mult': 1.8649732627844482, 'sideways_rsi_os': 39, 'sideways_rsi_ob': 59, 'sideways_adx_thresh': 27.882020467677762, 'sideways_atr_min_pct': 0.014307093728711215, 'sideways_atr_max_pct': 0.08086579604460713, 'sideways_tp_mult': 2.1081328909047365, 'sideways_tsl_mult': 0.9758857340142366, 'sideways_time_stop': 260, 'sideways_use_sma': False, 'sideways_use_ema': False, 'sideways_use_atr': False, 'sideways_use_adx': True, 'sideways_use_spike': False, 'sideways_rsi_required': False}.
