[I 2025-08-30 21:09:29,095] Trial 179 finished with values: [-1000000000.0, 1000000000.0] and parameters: {'p_sma': 33, 'p_std': 19, 'p_atr': 23, 'p_adx': 8, 'rsi_period': 15, 'ema1': 19, 'ema2': 36, 'slip_atr_k': 0.04665852966477174, 'slip_spread_k': 0.6693119083072178, 'spread_hl_frac': 0.0074611916797842764, 'bb_std_mult': 2.6203120043870625, 'rsi_os': 47, 'rsi_ob': 78, 'vol_spike': 0.2888505905159811, 'adx_thresh': 22.915783194612352, 'atr_min_pct': 0.0013199103633989833, 'atr_max_pct': 0.09281900578429539, 'tp_mult': 1.3632383296502166, 'tsl_mult': 0.9002117627044288, 'strategy': 'breakout', 'time_stop': 92, 'use_sma': False, 'use_atr': False, 'use_adx': False, 'use_ema': True, 'use_spike': False, 'rsi_required': False, 'edge_k': 0.6667279330163075, 'edge_cap': 0.23219449385976842, 'bull_strategy': 'mean_reversion', 'bull_bb_std_mult': 3.160261700849759, 'bull_rsi_os': 18, 'bull_rsi_ob': 71, 'bull_adx_thresh': 10.129482114636515, 'bull_atr_min_pct': 0.02234648293449822, 'bull_atr_max_pct': 0.07145466589398325, 'bull_tp_mult': 2.692808934437372, 'bull_tsl_mult': 0.21500586201922176, 'bull_time_stop': 225, 'bull_use_sma': False, 'bull_use_ema': True, 'bull_use_atr': True, 'bull_use_adx': True, 'bull_use_spike': True, 'bull_rsi_required': False, 'bear_strategy': 'breakout', 'bear_bb_std_mult': 1.7784236612413282, 'bear_rsi_os': 12, 'bear_rsi_ob': 59, 'bear_adx_thresh': 19.445508861690584, 'bear_atr_min_pct': 0.01623972514558448, 'bear_atr_max_pct': 0.0199786853790729, 'bear_tp_mult': 2.957241351949674, 'bear_tsl_mult': 0.36383402185001956, 'bear_time_stop': 55, 'bear_use_sma': True, 'bear_use_ema': False, 'bear_use_atr': True, 'bear_use_adx': True, 'bear_use_spike': False, 'bear_rsi_required': False, 'sideways_strategy': 'mean_reversion', 'sideways_bb_std_mult': 2.7325041668166734, 'sideways_rsi_os': 38, 'sideways_rsi_ob': 69, 'sideways_adx_thresh': 33.47912428944284, 'sideways_atr_min_pct': 0.0031021747580718944, 'sideways_atr_max_pct': 0.0175398216956944, 'sideways_tp_mult': 2.665404122406856, 'sideways_tsl_mult': 0.7972821284563412, 'sideways_time_stop': 130, 'sideways_use_sma': True, 'sideways_use_ema': True, 'sideways_use_atr': True, 'sideways_use_adx': False, 'sideways_use_spike': True, 'sideways_rsi_required': True}.
[I 2025-08-30 21:09:29,620] Trial 184 finished with values: [-1000000000.0, 1000000000.0] and parameters: {'p_sma': 58, 'p_std': 35, 'p_atr': 28, 'p_adx': 28, 'rsi_period': 63, 'ema1': 21, 'ema2': 46, 'slip_atr_k': 0.038496480746260935, 'slip_spread_k': 0.7787241518869666, 'spread_hl_frac': 0.004871805956877217, 'bb_std_mult': 1.630538851215008, 'rsi_os': 43, 'rsi_ob': 49, 'vol_spike': 0.2603675260782114, 'adx_thresh': 7.274457611626676, 'atr_min_pct': 0.0006417299922178942, 'atr_max_pct': 0.06789054949142473, 'tp_mult': 1.4401008219395508, 'tsl_mult': 0.8291599623452042, 'strategy': 'mean_reversion', 'time_stop': 219, 'use_sma': False, 'use_atr': True, 'use_adx': True, 'use_ema': True, 'use_spike': True, 'rsi_required': True, 'edge_k': 0.48454315029571227, 'edge_cap': 0.44221917456003085, 'bull_strategy': 'breakout', 'bull_bb_std_mult': 3.2124304692994348, 'bull_rsi_os': 16, 'bull_rsi_ob': 68, 'bull_adx_thresh': 14.267460458188964, 'bull_atr_min_pct': 0.0005824403210220284, 'bull_atr_max_pct': 0.05291398645564554, 'bull_tp_mult': 2.207352837764976, 'bull_tsl_mult': 0.39195267509141274, 'bull_time_stop': 300, 'bull_use_sma': True, 'bull_use_ema': False, 'bull_use_atr': False, 'bull_use_adx': False, 'bull_use_spike': True, 'bull_rsi_required': True, 'bear_strategy': 'mean_reversion', 'bear_bb_std_mult': 1.522777018719808, 'bear_rsi_os': 53, 'bear_rsi_ob': 49, 'bear_adx_thresh': 17.33231270081187, 'bear_atr_min_pct': 0.00900459450595966, 'bear_atr_max_pct': 0.02304630666370537, 'bear_tp_mult': 2.9950538263349458, 'bear_tsl_mult': 0.8695987923435792, 'bear_time_stop': 231, 'bear_use_sma': True, 'bear_use_ema': False, 'bear_use_atr': False, 'bear_use_adx': True, 'bear_use_spike': True, 'bear_rsi_required': True, 'sideways_strategy': 'breakout', 'sideways_bb_std_mult': 2.4525472802456267, 'sideways_rsi_os': 25, 'sideways_rsi_ob': 65, 'sideways_adx_thresh': 31.434226185305356, 'sideways_atr_min_pct': 0.018346417179829305, 'sideways_atr_max_pct': 0.01270319701447649, 'sideways_tp_mult': 2.6191524216700097, 'sideways_tsl_mult': 0.23894814748823193, 'sideways_time_stop': 120, 'sideways_use_sma': False, 'sideways_use_ema': True, 'sideways_use_atr': True, 'sideways_use_adx': False, 'sideways_use_spike': False, 'sideways_rsi_required': True}.
[I 2025-08-30 21:10:02,435] Trial 182 finished with values: [-1000000000.0, 1000000000.0] and parameters: {'p_sma': 29, 'p_std': 59, 'p_atr': 18, 'p_adx': 29, 'rsi_period': 63, 'ema1': 21, 'ema2': 47, 'slip_atr_k': 0.17252473559246057, 'slip_spread_k': 0.3182139926262409, 'spread_hl_frac': 0.007683068551798842, 'bb_std_mult': 1.7987056332839186, 'rsi_os': 47, 'rsi_ob': 65, 'vol_spike': 0.27002479453003797, 'adx_thresh': 23.052303245235745, 'atr_min_pct': 0.0013033998938155322, 'atr_max_pct': 0.09971240984936124, 'tp_mult': 1.4355073953605042, 'tsl_mult': 0.8198387574342112, 'strategy': 'mean_reversion', 'time_stop': 289, 'use_sma': True, 'use_atr': True, 'use_adx': True, 'use_ema': True, 'use_spike': True, 'rsi_required': True, 'edge_k': 0.48711337773829544, 'edge_cap': 0.2373474160701487, 'bull_strategy': 'mean_reversion', 'bull_bb_std_mult': 3.288555617358052, 'bull_rsi_os': 18, 'bull_rsi_ob': 71, 'bull_adx_thresh': 31.35161526026524, 'bull_atr_min_pct': 0.018176189950399737, 'bull_atr_max_pct': 0.06928790982727583, 'bull_tp_mult': 2.4596395399045057, 'bull_tsl_mult': 0.21545011094353542, 'bull_time_stop': 125, 'bull_use_sma': True, 'bull_use_ema': False, 'bull_use_atr': False, 'bull_use_adx': False, 'bull_use_spike': True, 'bull_rsi_required': True, 'bear_strategy': 'breakout', 'bear_bb_std_mult': 3.0642949634900183, 'bear_rsi_os': 20, 'bear_rsi_ob': 62, 'bear_adx_thresh': 15.21118359613581, 'bear_atr_min_pct': 0.018587671705161242, 'bear_atr_max_pct': 0.02839923943710146, 'bear_tp_mult': 1.7719554001883187, 'bear_tsl_mult': 0.3681691407579544, 'bear_time_stop': 124, 'bear_use_sma': True, 'bear_use_ema': False, 'bear_use_atr': True, 'bear_use_adx': True, 'bear_use_spike': True, 'bear_rsi_required': True, 'sideways_strategy': 'mean_reversion', 'sideways_bb_std_mult': 1.219694490310195, 'sideways_rsi_os': 49, 'sideways_rsi_ob': 65, 'sideways_adx_thresh': 31.39716419250594, 'sideways_atr_min_pct': 0.01790266606085546, 'sideways_atr_max_pct': 0.08394058431890747, 'sideways_tp_mult': 2.6654139718899015, 'sideways_tsl_mult': 0.6056780889437661, 'sideways_time_stop': 131, 'sideways_use_sma': False, 'sideways_use_ema': True, 'sideways_use_atr': True, 'sideways_use_adx': False, 'sideways_use_spike': False, 'sideways_rsi_required': True}.
[I 2025-08-30 21:10:02,730] Trial 183 finished with values: [-0.034417540138144576, 0.03434920022816288] and parameters: {'p_sma': 29, 'p_std': 19, 'p_atr': 28, 'p_adx': 21, 'rsi_period': 20, 'ema1': 21, 'ema2': 46, 'slip_atr_k': 0.17307206017259727, 'slip_spread_k': 0.23701524000738278, 'spread_hl_frac': 0.0018346010357413556, 'bb_std_mult': 2.87385096925965, 'rsi_os': 48, 'rsi_ob': 78, 'vol_spike': 0.2933892864237312, 'adx_thresh': 7.606284153701084, 'atr_min_pct': 0.023838694536818257, 'atr_max_pct': 0.06764237477955785, 'tp_mult': 1.349058926025859, 'tsl_mult': 0.9080641536875892, 'strategy': 'mean_reversion', 'time_stop': 92, 'use_sma': False, 'use_atr': True, 'use_adx': True, 'use_ema': True, 'use_spike': True, 'rsi_required': True, 'edge_k': 0.4837880504529344, 'edge_cap': 0.45047684677206684, 'bull_strategy': 'mean_reversion', 'bull_bb_std_mult': 3.1592514105766907, 'bull_rsi_os': 27, 'bull_rsi_ob': 84, 'bull_adx_thresh': 12.555288110738733, 'bull_atr_min_pct': 1.3552862796970488e-05, 'bull_atr_max_pct': 0.05338503742618296, 'bull_tp_mult': 2.5882935190444925, 'bull_tsl_mult': 0.3835931555557089, 'bull_time_stop': 287, 'bull_use_sma': True, 'bull_use_ema': False, 'bull_use_atr': False, 'bull_use_adx': False, 'bull_use_spike': True, 'bull_rsi_required': True, 'bear_strategy': 'breakout', 'bear_bb_std_mult': 2.1587379771810693, 'bear_rsi_os': 5, 'bear_rsi_ob': 46, 'bear_adx_thresh': 27.993603730752127, 'bear_atr_min_pct': 0.01766547091856894, 'bear_atr_max_pct': 0.022074659386445053, 'bear_tp_mult': 2.1430785095063003, 'bear_tsl_mult': 0.8700182693632686, 'bear_time_stop': 119, 'bear_use_sma': True, 'bear_use_ema': False, 'bear_use_atr': True, 'bear_use_adx': True, 'bear_use_spike': True, 'bear_rsi_required': True, 'sideways_strategy': 'mean_reversion', 'sideways_bb_std_mult': 2.871613156619333, 'sideways_rsi_os': 36, 'sideways_rsi_ob': 78, 'sideways_adx_thresh': 31.42128354841509, 'sideways_atr_min_pct': 0.010852982476796478, 'sideways_atr_max_pct': 0.08448295138909646, 'sideways_tp_mult': 1.5318685148612317, 'sideways_tsl_mult': 0.31488547538411055, 'sideways_time_stop': 154, 'sideways_use_sma': False, 'sideways_use_ema': True, 'sideways_use_atr': True, 'sideways_use_adx': False, 'sideways_use_spike': False, 'sideways_rsi_required': True}.
[I 2025-08-30 21:10:03,224] Trial 181 finished with values: [-1000000000.0, 1000000000.0] and parameters: {'p_sma': 29, 'p_std': 50, 'p_atr': 28, 'p_adx': 8, 'rsi_period': 52, 'ema1': 21, 'ema2': 36, 'slip_atr_k': 0.13933518207225765, 'slip_spread_k': 0.32028352061155196, 'spread_hl_frac': 0.03565234653432463, 'bb_std_mult': 1.8334332037373466, 'rsi_os': 42, 'rsi_ob': 80, 'vol_spike': 0.28230053157583657, 'adx_thresh': 22.977270321439498, 'atr_min_pct': 0.020036322241726398, 'atr_max_pct': 0.10142423653081997, 'tp_mult': 1.6883977541278814, 'tsl_mult': 0.4386791914777112, 'strategy': 'mean_reversion', 'time_stop': 214, 'use_sma': True, 'use_atr': False, 'use_adx': True, 'use_ema': True, 'use_spike': True, 'rsi_required': False, 'edge_k': 0.4840222070438166, 'edge_cap': 0.7162367809767266, 'bull_strategy': 'mean_reversion', 'bull_bb_std_mult': 3.1827136690424496, 'bull_rsi_os': 27, 'bull_rsi_ob': 73, 'bull_adx_thresh': 19.23277817300024, 'bull_atr_min_pct': 0.028004753860500418, 'bull_atr_max_pct': 0.07071470178598394, 'bull_tp_mult': 2.769295262810984, 'bull_tsl_mult': 0.45592987229621584, 'bull_time_stop': 300, 'bull_use_sma': False, 'bull_use_ema': False, 'bull_use_atr': False, 'bull_use_adx': False, 'bull_use_spike': True, 'bull_rsi_required': True, 'bear_strategy': 'breakout', 'bear_bb_std_mult': 1.0199422117038879, 'bear_rsi_os': 41, 'bear_rsi_ob': 62, 'bear_adx_thresh': 15.630115043695119, 'bear_atr_min_pct': 0.01596258296940874, 'bear_atr_max_pct': 0.023421335193763874, 'bear_tp_mult': 1.7821500248726232, 'bear_tsl_mult': 0.8214194295359385, 'bear_time_stop': 58, 'bear_use_sma': True, 'bear_use_ema': False, 'bear_use_atr': True, 'bear_use_adx': True, 'bear_use_spike': False, 'bear_rsi_required': True, 'sideways_strategy': 'mean_reversion', 'sideways_bb_std_mult': 2.4753609746115353, 'sideways_rsi_os': 36, 'sideways_rsi_ob': 69, 'sideways_adx_thresh': 33.03499352762803, 'sideways_atr_min_pct': 0.028923851931093057, 'sideways_atr_max_pct': 0.1306701816315192, 'sideways_tp_mult': 2.6009941106649883, 'sideways_tsl_mult': 0.8121369292097284, 'sideways_time_stop': 133, 'sideways_use_sma': True, 'sideways_use_ema': True, 'sideways_use_atr': True, 'sideways_use_adx': False, 'sideways_use_spike': True, 'sideways_rsi_required': True}.
[I 2025-08-30 21:10:03,547] Trial 185 finished with values: [-0.02380156373539033, 0.023743701854659478] and parameters: {'p_sma': 29, 'p_std': 11, 'p_atr': 11, 'p_adx': 7, 'rsi_period': 39, 'ema1': 13, 'ema2': 55, 'slip_atr_k': 0.03248108218118346, 'slip_spread_k': 0.26355285845913656, 'spread_hl_frac': 0.002127529025377175, 'bb_std_mult': 1.6662718355249, 'rsi_os': 44, 'rsi_ob': 73, 'vol_spike': 0.28151809222871077, 'adx_thresh': 23.79737430450426, 'atr_min_pct': 0.02424686554953892, 'atr_max_pct': 0.14483385062004112, 'tp_mult': 1.579454959483647, 'tsl_mult': 0.0025375792894753446, 'strategy': 'mean_reversion', 'time_stop': 215, 'use_sma': True, 'use_atr': True, 'use_adx': True, 'use_ema': True, 'use_spike': True, 'rsi_required': True, 'edge_k': 0.6955549517468415, 'edge_cap': 0.596232051636195, 'bull_strategy': 'breakout', 'bull_bb_std_mult': 1.013199227726478, 'bull_rsi_os': 15, 'bull_rsi_ob': 64, 'bull_adx_thresh': 13.914851139625172, 'bull_atr_min_pct': 0.0006856796382260805, 'bull_atr_max_pct': 0.1017313398302345, 'bull_tp_mult': 2.5693382349240803, 'bull_tsl_mult': 0.24169981348075437, 'bull_time_stop': 290, 'bull_use_sma': True, 'bull_use_ema': False, 'bull_use_atr': False, 'bull_use_adx': True, 'bull_use_spike': True, 'bull_rsi_required': True, 'bear_strategy': 'mean_reversion', 'bear_bb_std_mult': 2.1491973366631, 'bear_rsi_os': 41, 'bear_rsi_ob': 53, 'bear_adx_thresh': 15.072200182327455, 'bear_atr_min_pct': 0.017485968490216733, 'bear_atr_max_pct': 0.01277734297788585, 'bear_tp_mult': 2.006737573600469, 'bear_tsl_mult': 0.4700334727972204, 'bear_time_stop': 122, 'bear_use_sma': True, 'bear_use_ema': False, 'bear_use_atr': False, 'bear_use_adx': True, 'bear_use_spike': True, 'bear_rsi_required': True, 'sideways_strategy': 'breakout', 'sideways_bb_std_mult': 0.5995774786538819, 'sideways_rsi_os': 52, 'sideways_rsi_ob': 81, 'sideways_adx_thresh': 32.15517604428651, 'sideways_atr_min_pct': 0.017043944269829185, 'sideways_atr_max_pct': 0.12986223206294567, 'sideways_tp_mult': 1.4514387346499533, 'sideways_tsl_mult': 0.9003286312678886, 'sideways_time_stop': 157, 'sideways_use_sma': False, 'sideways_use_ema': True, 'sideways_use_atr': True, 'sideways_use_adx': False, 'sideways_use_spike': False, 'sideways_rsi_required': True}.
[I 2025-08-30 21:10:03,997] Trial 189 finished with values: [-1000000000.0, 1000000000.0] and parameters: {'p_sma': 27, 'p_std': 35, 'p_atr': 14, 'p_adx': 11, 'rsi_period': 13, 'ema1': 30, 'ema2': 43, 'slip_atr_k': 0.038466453594641056, 'slip_spread_k': 0.8289788571144849, 'spread_hl_frac': 0.004179353896580721, 'bb_std_mult': 1.5027128786919661, 'rsi_os': 52, 'rsi_ob': 85, 'vol_spike': 0.2638645845778851, 'adx_thresh': 26.479545088568443, 'atr_min_pct': 0.02573682639114979, 'atr_max_pct': 0.08422265957069365, 'tp_mult': 1.1454552579868478, 'tsl_mult': 0.8365779539847458, 'strategy': 'mean_reversion', 'time_stop': 222, 'use_sma': False, 'use_atr': True, 'use_adx': True, 'use_ema': False, 'use_spike': True, 'rsi_required': True, 'edge_k': 0.8464316314294865, 'edge_cap': 0.6638168172931875, 'bull_strategy': 'breakout', 'bull_bb_std_mult': 3.5999033658008606, 'bull_rsi_os': 17, 'bull_rsi_ob': 76, 'bull_adx_thresh': 13.338730668238105, 'bull_atr_min_pct': 0.004914665356568999, 'bull_atr_max_pct': 0.14977953243625408, 'bull_tp_mult': 2.545362786241999, 'bull_tsl_mult': 0.13458022608464618, 'bull_time_stop': 20, 'bull_use_sma': True, 'bull_use_ema': False, 'bull_use_atr': False, 'bull_use_adx': True, 'bull_use_spike': False, 'bull_rsi_required': True, 'bear_strategy': 'mean_reversion', 'bear_bb_std_mult': 2.6980192191406216, 'bear_rsi_os': 48, 'bear_rsi_ob': 50, 'bear_adx_thresh': 23.222887278237597, 'bear_atr_min_pct': 0.017834263180803833, 'bear_atr_max_pct': 0.09917647517787802, 'bear_tp_mult': 2.9667951425110153, 'bear_tsl_mult': 0.7716465320796059, 'bear_time_stop': 78, 'bear_use_sma': False, 'bear_use_ema': False, 'bear_use_atr': False, 'bear_use_adx': False, 'bear_use_spike': True, 'bear_rsi_required': True, 'sideways_strategy': 'breakout', 'sideways_bb_std_mult': 2.6548023512191317, 'sideways_rsi_os': 39, 'sideways_rsi_ob': 63, 'sideways_adx_thresh': 34.40790411295241, 'sideways_atr_min_pct': 0.009038210748107883, 'sideways_atr_max_pct': 0.011691949737700356, 'sideways_tp_mult': 2.6195992146128924, 'sideways_tsl_mult': 0.710737564613271, 'sideways_time_stop': 177, 'sideways_use_sma': False, 'sideways_use_ema': False, 'sideways_use_atr': False, 'sideways_use_adx': True, 'sideways_use_spike': False, 'sideways_rsi_required': False}.
[I 2025-08-30 21:10:36,498] Trial 188 finished with values: [-0.024745640316143014, 0.024693804343545987] and parameters: {'p_sma': 27, 'p_std': 11, 'p_atr': 14, 'p_adx': 9, 'rsi_period': 68, 'ema1': 27, 'ema2': 43, 'slip_atr_k': 0.03016301589510299, 'slip_spread_k': 0.8294784993993349, 'spread_hl_frac': 0.004192035492336588, 'bb_std_mult': 1.6616775678774238, 'rsi_os': 44, 'rsi_ob': 82, 'vol_spike': 0.2804126047737164, 'adx_thresh': 24.95644459997964, 'atr_min_pct': 0.0008028162911283813, 'atr_max_pct': 0.0849881818178487, 'tp_mult': 2.2193604346569167, 'tsl_mult': 0.8384991213820367, 'strategy': 'mean_reversion', 'time_stop': 204, 'use_sma': False, 'use_atr': True, 'use_adx': True, 'use_ema': False, 'use_spike': True, 'rsi_required': True, 'edge_k': 0.7856412812340919, 'edge_cap': 0.5938617294626785, 'bull_strategy': 'breakout', 'bull_bb_std_mult': 0.9942570522507646, 'bull_rsi_os': 47, 'bull_rsi_ob': 67, 'bull_adx_thresh': 13.636674607472745, 'bull_atr_min_pct': 0.0008449426659542726, 'bull_atr_max_pct': 0.06396525067124877, 'bull_tp_mult': 2.531296825231549, 'bull_tsl_mult': 0.1343133301611978, 'bull_time_stop': 288, 'bull_use_sma': True, 'bull_use_ema': False, 'bull_use_atr': False, 'bull_use_adx': True, 'bull_use_spike': False, 'bull_rsi_required': True, 'bear_strategy': 'mean_reversion', 'bear_bb_std_mult': 2.488506300404082, 'bear_rsi_os': 50, 'bear_rsi_ob': 53, 'bear_adx_thresh': 32.68596171343641, 'bear_atr_min_pct': 0.017448854045839308, 'bear_atr_max_pct': 0.09968164715824678, 'bear_tp_mult': 2.0126844459102973, 'bear_tsl_mult': 0.9517082121651049, 'bear_time_stop': 92, 'bear_use_sma': False, 'bear_use_ema': False, 'bear_use_atr': False, 'bear_use_adx': False, 'bear_use_spike': True, 'bear_rsi_required': True, 'sideways_strategy': 'breakout', 'sideways_bb_std_mult': 2.661385261552112, 'sideways_rsi_os': 41, 'sideways_rsi_ob': 64, 'sideways_adx_thresh': 32.28228427744578, 'sideways_atr_min_pct': 0.007057623147444661, 'sideways_atr_max_pct': 0.010781071624457118, 'sideways_tp_mult': 2.611618142452117, 'sideways_tsl_mult': 0.37308376761307704, 'sideways_time_stop': 162, 'sideways_use_sma': False, 'sideways_use_ema': False, 'sideways_use_atr': False, 'sideways_use_adx': True, 'sideways_use_spike': False, 'sideways_rsi_required': False}.
[I 2025-08-30 21:10:37,127] Trial 187 finished with values: [-1000000000.0, 1000000000.0] and parameters: {'p_sma': 20, 'p_std': 50, 'p_atr': 11, 'p_adx': 7, 'rsi_period': 13, 'ema1': 20, 'ema2': 42, 'slip_atr_k': 0.03274166253053082, 'slip_spread_k': 0.09215840939933062, 'spread_hl_frac': 0.035143507736361, 'bb_std_mult': 2.2707565264606417, 'rsi_os': 42, 'rsi_ob': 59, 'vol_spike': 0.2813746605892081, 'adx_thresh': 23.908391289855334, 'atr_min_pct': 0.0007829090727508706, 'atr_max_pct': 0.0491978144724481, 'tp_mult': 2.3439847287773583, 'tsl_mult': 0.837414159284743, 'strategy': 'mean_reversion', 'time_stop': 216, 'use_sma': False, 'use_atr': True, 'use_adx': True, 'use_ema': False, 'use_spike': True, 'rsi_required': True, 'edge_k': 0.26637505852057697, 'edge_cap': 0.14500087323731625, 'bull_strategy': 'breakout', 'bull_bb_std_mult': 1.6475950713514953, 'bull_rsi_os': 15, 'bull_rsi_ob': 64, 'bull_adx_thresh': 13.557654028656259, 'bull_atr_min_pct': 0.007898020973553441, 'bull_atr_max_pct': 0.030870535186798942, 'bull_tp_mult': 2.540981823356722, 'bull_tsl_mult': 0.4552162512165108, 'bull_time_stop': 290, 'bull_use_sma': True, 'bull_use_ema': False, 'bull_use_atr': False, 'bull_use_adx': True, 'bull_use_spike': False, 'bull_rsi_required': True, 'bear_strategy': 'mean_reversion', 'bear_bb_std_mult': 2.6964725600676904, 'bear_rsi_os': 50, 'bear_rsi_ob': 53, 'bear_adx_thresh': 13.742530088241411, 'bear_atr_min_pct': 0.017173796017169975, 'bear_atr_max_pct': 0.012574541228279588, 'bear_tp_mult': 1.8493811211123843, 'bear_tsl_mult': 0.4761470224847233, 'bear_time_stop': 140, 'bear_use_sma': False, 'bear_use_ema': False, 'bear_use_atr': False, 'bear_use_adx': False, 'bear_use_spike': True, 'bear_rsi_required': True, 'sideways_strategy': 'breakout', 'sideways_bb_std_mult': 2.6533363704203583, 'sideways_rsi_os': 51, 'sideways_rsi_ob': 63, 'sideways_adx_thresh': 32.32007073032457, 'sideways_atr_min_pct': 0.028918755490227654, 'sideways_atr_max_pct': 0.01025514383361023, 'sideways_tp_mult': 2.5912960865700296, 'sideways_tsl_mult': 0.8506242130827546, 'sideways_time_stop': 158, 'sideways_use_sma': False, 'sideways_use_ema': False, 'sideways_use_atr': False, 'sideways_use_adx': True, 'sideways_use_spike': False, 'sideways_rsi_required': False}.
