[I 2025-08-30 22:13:16,293] Trial 702 finished with values: [-1000000000.0, 1000000000.0] and parameters: {'p_sma': 36, 'p_std': 36, 'p_atr': 21, 'p_adx': 20, 'rsi_period': 65, 'ema1': 13, 'ema2': 53, 'slip_atr_k': 0.047601770200563026, 'slip_spread_k': 0.6433911541286532, 'spread_hl_frac': 0.049985877096824186, 'bb_std_mult': 0.8500634689988668, 'rsi_os': 8, 'rsi_ob': 67, 'vol_spike': 0.03439158171286806, 'adx_thresh': 9.963367188720607, 'atr_min_pct': 0.014094467522143703, 'atr_max_pct': 0.0226166857149179, 'tp_mult': 2.5951273444414604, 'tsl_mult': 0.8996517834133362, 'strategy': 'mean_reversion', 'time_stop': 89, 'use_sma': False, 'use_atr': True, 'use_adx': False, 'use_ema': False, 'use_spike': False, 'rsi_required': True, 'edge_k': 1.916100519844639, 'edge_cap': 0.4904428209255035, 'bull_strategy': 'breakout', 'bull_bb_std_mult': 1.5116790015333632, 'bull_rsi_os': 19, 'bull_rsi_ob': 90, 'bull_adx_thresh': 14.352514101968087, 'bull_atr_min_pct': 0.019810509266524265, 'bull_atr_max_pct': 0.04831897735673103, 'bull_tp_mult': 2.8609227355659126, 'bull_tsl_mult': 0.8449829958870926, 'bull_time_stop': 283, 'bull_use_sma': True, 'bull_use_ema': True, 'bull_use_atr': False, 'bull_use_adx': False, 'bull_use_spike': False, 'bull_rsi_required': False, 'bear_strategy': 'mean_reversion', 'bear_bb_std_mult': 3.532435303318598, 'bear_rsi_os': 8, 'bear_rsi_ob': 73, 'bear_adx_thresh': 29.562200588921176, 'bear_atr_min_pct': 0.029986419244504042, 'bear_atr_max_pct': 0.11646005969049615, 'bear_tp_mult': 1.4566086174144064, 'bear_tsl_mult': 0.3808373335896592, 'bear_time_stop': 69, 'bear_use_sma': True, 'bear_use_ema': True, 'bear_use_atr': False, 'bear_use_adx': False, 'bear_use_spike': True, 'bear_rsi_required': False, 'sideways_strategy': 'breakout', 'sideways_bb_std_mult': 1.606185720794274, 'sideways_rsi_os': 42, 'sideways_rsi_ob': 57, 'sideways_adx_thresh': 7.4824822702424285, 'sideways_atr_min_pct': 0.019271097096083503, 'sideways_atr_max_pct': 0.08160630928355485, 'sideways_tp_mult': 1.7314601640695888, 'sideways_tsl_mult': 0.7466786633868926, 'sideways_time_stop': 268, 'sideways_use_sma': True, 'sideways_use_ema': False, 'sideways_use_atr': False, 'sideways_use_adx': True, 'sideways_use_spike': True, 'sideways_rsi_required': False}.
[I 2025-08-30 22:13:23,423] Trial 703 finished with values: [-1000000000.0, 1000000000.0] and parameters: {'p_sma': 36, 'p_std': 19, 'p_atr': 17, 'p_adx': 22, 'rsi_period': 70, 'ema1': 27, 'ema2': 19, 'slip_atr_k': 0.07865944047531016, 'slip_spread_k': 0.7016730011824863, 'spread_hl_frac': 0.0411132750318684, 'bb_std_mult': 2.89776084347774, 'rsi_os': 8, 'rsi_ob': 67, 'vol_spike': 0.27706090981119347, 'adx_thresh': 12.245268950861961, 'atr_min_pct': 0.012745594510370791, 'atr_max_pct': 0.021277903356296483, 'tp_mult': 1.563172439160645, 'tsl_mult': 0.4464026757477203, 'strategy': 'mean_reversion', 'time_stop': 87, 'use_sma': True, 'use_atr': True, 'use_adx': False, 'use_ema': False, 'use_spike': False, 'rsi_required': True, 'edge_k': 1.8028194495006673, 'edge_cap': 0.7488363302178893, 'bull_strategy': 'mean_reversion', 'bull_bb_std_mult': 1.8836007994612158, 'bull_rsi_os': 19, 'bull_rsi_ob': 89, 'bull_adx_thresh': 14.197824042895752, 'bull_atr_min_pct': 0.019984105405368782, 'bull_atr_max_pct': 0.04872123539172141, 'bull_tp_mult': 1.4551162999599097, 'bull_tsl_mult': 0.5251003543187789, 'bull_time_stop': 28, 'bull_use_sma': False, 'bull_use_ema': True, 'bull_use_atr': False, 'bull_use_adx': False, 'bull_use_spike': True, 'bull_rsi_required': False, 'bear_strategy': 'mean_reversion', 'bear_bb_std_mult': 1.9470389441291966, 'bear_rsi_os': 8, 'bear_rsi_ob': 58, 'bear_adx_thresh': 25.522829559314683, 'bear_atr_min_pct': 0.029993872298127427, 'bear_atr_max_pct': 0.11619225761089068, 'bear_tp_mult': 1.5228524330348918, 'bear_tsl_mult': 0.37986997552069685, 'bear_time_stop': 235, 'bear_use_sma': True, 'bear_use_ema': True, 'bear_use_atr': False, 'bear_use_adx': False, 'bear_use_spike': True, 'bear_rsi_required': False, 'sideways_strategy': 'mean_reversion', 'sideways_bb_std_mult': 1.447502005973797, 'sideways_rsi_os': 42, 'sideways_rsi_ob': 57, 'sideways_adx_thresh': 27.685575540215495, 'sideways_atr_min_pct': 0.009818325166643693, 'sideways_atr_max_pct': 0.035744545795540414, 'sideways_tp_mult': 1.7386911052720777, 'sideways_tsl_mult': 0.8280402918039292, 'sideways_time_stop': 272, 'sideways_use_sma': True, 'sideways_use_ema': True, 'sideways_use_atr': False, 'sideways_use_adx': True, 'sideways_use_spike': True, 'sideways_rsi_required': True}.
[I 2025-08-30 22:13:57,535] Trial 706 finished with values: [-1000000000.0, 1000000000.0] and parameters: {'p_sma': 32, 'p_std': 47, 'p_atr': 20, 'p_adx': 22, 'rsi_period': 72, 'ema1': 27, 'ema2': 10, 'slip_atr_k': 0.07836863900642442, 'slip_spread_k': 0.0642128947748033, 'spread_hl_frac': 0.04085622817536003, 'bb_std_mult': 2.873249689996845, 'rsi_os': 12, 'rsi_ob': 52, 'vol_spike': 0.07746601610959161, 'adx_thresh': 11.982608914392356, 'atr_min_pct': 0.0057393708579562205, 'atr_max_pct': 0.14961144009581073, 'tp_mult': 2.088961281211777, 'tsl_mult': 0.937606092479781, 'strategy': 'breakout', 'time_stop': 244, 'use_sma': True, 'use_atr': False, 'use_adx': True, 'use_ema': False, 'use_spike': True, 'rsi_required': False, 'edge_k': 0.8660966815110263, 'edge_cap': 0.7718265554419935, 'bull_strategy': 'mean_reversion', 'bull_bb_std_mult': 0.703344135567554, 'bull_rsi_os': 20, 'bull_rsi_ob': 89, 'bull_adx_thresh': 16.46775535411294, 'bull_atr_min_pct': 0.0007372733488602167, 'bull_atr_max_pct': 0.054176411388798584, 'bull_tp_mult': 1.3227207688236158, 'bull_tsl_mult': 0.46113259607157725, 'bull_time_stop': 294, 'bull_use_sma': False, 'bull_use_ema': True, 'bull_use_atr': True, 'bull_use_adx': False, 'bull_use_spike': True, 'bull_rsi_required': True, 'bear_strategy': 'mean_reversion', 'bear_bb_std_mult': 3.0214185253886936, 'bear_rsi_os': 43, 'bear_rsi_ob': 85, 'bear_adx_thresh': 27.949129709261438, 'bear_atr_min_pct': 0.029273735789504443, 'bear_atr_max_pct': 0.123031421102195, 'bear_tp_mult': 2.6387135328945175, 'bear_tsl_mult': 0.5775723063973328, 'bear_time_stop': 242, 'bear_use_sma': False, 'bear_use_ema': False, 'bear_use_atr': True, 'bear_use_adx': False, 'bear_use_spike': False, 'bear_rsi_required': True, 'sideways_strategy': 'mean_reversion', 'sideways_bb_std_mult': 1.6717573383653324, 'sideways_rsi_os': 29, 'sideways_rsi_ob': 70, 'sideways_adx_thresh': 33.54847941371558, 'sideways_atr_min_pct': 0.022946707426843474, 'sideways_atr_max_pct': 0.041395347029751915, 'sideways_tp_mult': 1.8919190650298838, 'sideways_tsl_mult': 0.1319110528977394, 'sideways_time_stop': 272, 'sideways_use_sma': False, 'sideways_use_ema': True, 'sideways_use_atr': False, 'sideways_use_adx': True, 'sideways_use_spike': False, 'sideways_rsi_required': True}.
[I 2025-08-30 22:13:57,843] Trial 705 finished with values: [-1000000000.0, 1000000000.0] and parameters: {'p_sma': 21, 'p_std': 36, 'p_atr': 20, 'p_adx': 20, 'rsi_period': 70, 'ema1': 9, 'ema2': 40, 'slip_atr_k': 0.02555224708134292, 'slip_spread_k': 0.6092750640193557, 'spread_hl_frac': 0.011463582495054534, 'bb_std_mult': 2.7248364042460604, 'rsi_os': 8, 'rsi_ob': 63, 'vol_spike': 0.07788695835856363, 'adx_thresh': 12.14722394118811, 'atr_min_pct': 0.0121542471660534, 'atr_max_pct': 0.02114464384469878, 'tp_mult': 1.5634964555354238, 'tsl_mult': 0.908008150842312, 'strategy': 'breakout', 'time_stop': 69, 'use_sma': True, 'use_atr': False, 'use_adx': True, 'use_ema': False, 'use_spike': True, 'rsi_required': False, 'edge_k': 1.2155493399591384, 'edge_cap': 0.7781412427907433, 'bull_strategy': 'mean_reversion', 'bull_bb_std_mult': 1.6282776998826634, 'bull_rsi_os': 20, 'bull_rsi_ob': 89, 'bull_adx_thresh': 15.56326397338105, 'bull_atr_min_pct': 0.01996177006642965, 'bull_atr_max_pct': 0.11777222987808432, 'bull_tp_mult': 1.9345969176633544, 'bull_tsl_mult': 0.939672802642424, 'bull_time_stop': 294, 'bull_use_sma': False, 'bull_use_ema': True, 'bull_use_atr': True, 'bull_use_adx': False, 'bull_use_spike': True, 'bull_rsi_required': False, 'bear_strategy': 'mean_reversion', 'bear_bb_std_mult': 1.9388022717180284, 'bear_rsi_os': 10, 'bear_rsi_ob': 95, 'bear_adx_thresh': 28.131278003057368, 'bear_atr_min_pct': 0.02942454524328378, 'bear_atr_max_pct': 0.11633294272280686, 'bear_tp_mult': 1.5289785379865286, 'bear_tsl_mult': 0.6963278100562024, 'bear_time_stop': 240, 'bear_use_sma': True, 'bear_use_ema': False, 'bear_use_atr': True, 'bear_use_adx': False, 'bear_use_spike': False, 'bear_rsi_required': False, 'sideways_strategy': 'mean_reversion', 'sideways_bb_std_mult': 1.4380906981818644, 'sideways_rsi_os': 27, 'sideways_rsi_ob': 58, 'sideways_adx_thresh': 27.75634719916348, 'sideways_atr_min_pct': 0.022720032331558844, 'sideways_atr_max_pct': 0.04173688146271952, 'sideways_tp_mult': 2.557482332384375, 'sideways_tsl_mult': 0.8274477967874047, 'sideways_time_stop': 272, 'sideways_use_sma': False, 'sideways_use_ema': True, 'sideways_use_atr': False, 'sideways_use_adx': True, 'sideways_use_spike': False, 'sideways_rsi_required': True}.
[I 2025-08-30 22:13:58,195] Trial 704 finished with values: [-1000000000.0, 1000000000.0] and parameters: {'p_sma': 45, 'p_std': 45, 'p_atr': 17, 'p_adx': 20, 'rsi_period': 71, 'ema1': 27, 'ema2': 53, 'slip_atr_k': 0.04691559035089292, 'slip_spread_k': 0.6772468500750024, 'spread_hl_frac': 0.03255526639859831, 'bb_std_mult': 2.199819447350515, 'rsi_os': 28, 'rsi_ob': 66, 'vol_spike': 0.2770867567369108, 'adx_thresh': 12.010668449938361, 'atr_min_pct': 0.01302023630506534, 'atr_max_pct': 0.0710030813838391, 'tp_mult': 2.5954361255141785, 'tsl_mult': 0.021145188465731712, 'strategy': 'breakout', 'time_stop': 11, 'use_sma': True, 'use_atr': True, 'use_adx': False, 'use_ema': False, 'use_spike': False, 'rsi_required': False, 'edge_k': 0.8654287495177932, 'edge_cap': 0.77886419918747, 'bull_strategy': 'mean_reversion', 'bull_bb_std_mult': 2.201310377403078, 'bull_rsi_os': 19, 'bull_rsi_ob': 89, 'bull_adx_thresh': 14.736542635794029, 'bull_atr_min_pct': 0.0005684377673712263, 'bull_atr_max_pct': 0.04750035146384268, 'bull_tp_mult': 1.3358048312813797, 'bull_tsl_mult': 0.5267126330640326, 'bull_time_stop': 290, 'bull_use_sma': False, 'bull_use_ema': True, 'bull_use_atr': True, 'bull_use_adx': False, 'bull_use_spike': True, 'bull_rsi_required': False, 'bear_strategy': 'mean_reversion', 'bear_bb_std_mult': 1.930095230424669, 'bear_rsi_os': 10, 'bear_rsi_ob': 92, 'bear_adx_thresh': 20.357242719685395, 'bear_atr_min_pct': 0.029406655101700867, 'bear_atr_max_pct': 0.11638917862035925, 'bear_tp_mult': 2.0552348062037975, 'bear_tsl_mult': 0.2181938797481459, 'bear_time_stop': 237, 'bear_use_sma': True, 'bear_use_ema': True, 'bear_use_atr': True, 'bear_use_adx': False, 'bear_use_spike': True, 'bear_rsi_required': False, 'sideways_strategy': 'mean_reversion', 'sideways_bb_std_mult': 1.8667334102634747, 'sideways_rsi_os': 40, 'sideways_rsi_ob': 88, 'sideways_adx_thresh': 33.601803760881936, 'sideways_atr_min_pct': 0.019557162059048748, 'sideways_atr_max_pct': 0.04228763592749245, 'sideways_tp_mult': 2.5557710183628926, 'sideways_tsl_mult': 0.29904039901814716, 'sideways_time_stop': 274, 'sideways_use_sma': True, 'sideways_use_ema': True, 'sideways_use_atr': False, 'sideways_use_adx': True, 'sideways_use_spike': True, 'sideways_rsi_required': True}.
[I 2025-08-30 22:13:59,149] Trial 707 finished with values: [-1000000000.0, 1000000000.0] and parameters: {'p_sma': 32, 'p_std': 20, 'p_atr': 10, 'p_adx': 20, 'rsi_period': 8, 'ema1': 10, 'ema2': 56, 'slip_atr_k': 0.03688439343767447, 'slip_spread_k': 0.6766811105595499, 'spread_hl_frac': 0.030617644833935715, 'bb_std_mult': 1.179336888089292, 'rsi_os': 16, 'rsi_ob': 72, 'vol_spike': 0.2585599431332753, 'adx_thresh': 22.320451333309187, 'atr_min_pct': 0.015315303351421273, 'atr_max_pct': 0.11667817011171738, 'tp_mult': 2.075430892666863, 'tsl_mult': 0.935188899508675, 'strategy': 'breakout', 'time_stop': 246, 'use_sma': True, 'use_atr': False, 'use_adx': True, 'use_ema': True, 'use_spike': True, 'rsi_required': False, 'edge_k': 1.2551445720672783, 'edge_cap': 0.8976963630996857, 'bull_strategy': 'mean_reversion', 'bull_bb_std_mult': 1.623667769557749, 'bull_rsi_os': 17, 'bull_rsi_ob': 88, 'bull_adx_thresh': 15.555665116911875, 'bull_atr_min_pct': 0.024777123524261483, 'bull_atr_max_pct': 0.05259531221383172, 'bull_tp_mult': 1.291665614654699, 'bull_tsl_mult': 0.4071958547443398, 'bull_time_stop': 292, 'bull_use_sma': False, 'bull_use_ema': False, 'bull_use_atr': True, 'bull_use_adx': False, 'bull_use_spike': True, 'bull_rsi_required': True, 'bear_strategy': 'mean_reversion', 'bear_bb_std_mult': 2.0827851985320214, 'bear_rsi_os': 7, 'bear_rsi_ob': 95, 'bear_adx_thresh': 28.706297735043428, 'bear_atr_min_pct': 0.029363039099371338, 'bear_atr_max_pct': 0.10905255624281393, 'bear_tp_mult': 1.0758793390970687, 'bear_tsl_mult': 0.41252285539622124, 'bear_time_stop': 229, 'bear_use_sma': False, 'bear_use_ema': False, 'bear_use_atr': True, 'bear_use_adx': True, 'bear_use_spike': False, 'bear_rsi_required': True, 'sideways_strategy': 'mean_reversion', 'sideways_bb_std_mult': 1.8693852146426075, 'sideways_rsi_os': 29, 'sideways_rsi_ob': 88, 'sideways_adx_thresh': 26.147590852408385, 'sideways_atr_min_pct': 0.001997037067120835, 'sideways_atr_max_pct': 0.04234671396692501, 'sideways_tp_mult': 1.8838334830475818, 'sideways_tsl_mult': 0.7000105457800788, 'sideways_time_stop': 262, 'sideways_use_sma': False, 'sideways_use_ema': True, 'sideways_use_atr': False, 'sideways_use_adx': False, 'sideways_use_spike': False, 'sideways_rsi_required': True}.
[I 2025-08-30 22:14:34,700] Trial 711 finished with values: [-1000000000.0, 1000000000.0] and parameters: {'p_sma': 34, 'p_std': 26, 'p_atr': 22, 'p_adx': 21, 'rsi_period': 78, 'ema1': 11, 'ema2': 55, 'slip_atr_k': 0.1899265780542412, 'slip_spread_k': 0.6088641916783739, 'spread_hl_frac': 0.02101355239479214, 'bb_std_mult': 0.8000723719275509, 'rsi_os': 26, 'rsi_ob': 70, 'vol_spike': 0.1354786550574807, 'adx_thresh': 18.722657572187995, 'atr_min_pct': 0.012336580196845002, 'atr_max_pct': 0.019185498865916785, 'tp_mult': 1.7127755389592154, 'tsl_mult': 0.891282944156754, 'strategy': 'mean_reversion', 'time_stop': 96, 'use_sma': False, 'use_atr': True, 'use_adx': True, 'use_ema': True, 'use_spike': True, 'rsi_required': True, 'edge_k': 0.9585784562873514, 'edge_cap': 0.25436940040255906, 'bull_strategy': 'breakout', 'bull_bb_std_mult': 2.008176510288865, 'bull_rsi_os': 16, 'bull_rsi_ob': 51, 'bull_adx_thresh': 15.019128611980655, 'bull_atr_min_pct': 0.0017766957866575009, 'bull_atr_max_pct': 0.0552436718415092, 'bull_tp_mult': 2.9741129259053, 'bull_tsl_mult': 0.43639003789953346, 'bull_time_stop': 220, 'bull_use_sma': True, 'bull_use_ema': False, 'bull_use_atr': False, 'bull_use_adx': False, 'bull_use_spike': False, 'bull_rsi_required': True, 'bear_strategy': 'breakout', 'bear_bb_std_mult': 3.3495889207264886, 'bear_rsi_os': 6, 'bear_rsi_ob': 72, 'bear_adx_thresh': 28.88850054932926, 'bear_atr_min_pct': 0.028646296555350198, 'bear_atr_max_pct': 0.0450300969419495, 'bear_tp_mult': 1.6069700908526787, 'bear_tsl_mult': 0.1862796054378596, 'bear_time_stop': 169, 'bear_use_sma': False, 'bear_use_ema': True, 'bear_use_atr': False, 'bear_use_adx': True, 'bear_use_spike': True, 'bear_rsi_required': True, 'sideways_strategy': 'breakout', 'sideways_bb_std_mult': 1.7265479973208666, 'sideways_rsi_os': 50, 'sideways_rsi_ob': 91, 'sideways_adx_thresh': 20.58547331774035, 'sideways_atr_min_pct': 0.021061504978956314, 'sideways_atr_max_pct': 0.038292601979536045, 'sideways_tp_mult': 2.8720520486652372, 'sideways_tsl_mult': 0.7719520539690078, 'sideways_time_stop': 261, 'sideways_use_sma': False, 'sideways_use_ema': False, 'sideways_use_atr': True, 'sideways_use_adx': False, 'sideways_use_spike': False, 'sideways_rsi_required': False}.
[I 2025-08-30 22:14:34,726] Trial 710 finished with values: [-1000000000.0, 1000000000.0] and parameters: {'p_sma': 31, 'p_std': 38, 'p_atr': 10, 'p_adx': 21, 'rsi_period': 10, 'ema1': 10, 'ema2': 32, 'slip_atr_k': 0.11228972701984793, 'slip_spread_k': 0.5867593529576836, 'spread_hl_frac': 0.0358885950360738, 'bb_std_mult': 3.0053946475653315, 'rsi_os': 25, 'rsi_ob': 64, 'vol_spike': 0.136018636631522, 'adx_thresh': 11.03977261869941, 'atr_min_pct': 0.015426180572687246, 'atr_max_pct': 0.01886876611333343, 'tp_mult': 1.6256290320452174, 'tsl_mult': 0.8814518527640709, 'strategy': 'mean_reversion', 'time_stop': 97, 'use_sma': False, 'use_atr': True, 'use_adx': True, 'use_ema': True, 'use_spike': True, 'rsi_required': True, 'edge_k': 0.4767580073234229, 'edge_cap': 0.8280918155830078, 'bull_strategy': 'breakout', 'bull_bb_std_mult': 2.542035173440668, 'bull_rsi_os': 43, 'bull_rsi_ob': 51, 'bull_adx_thresh': 15.206527730802385, 'bull_atr_min_pct': 0.0016161956733744206, 'bull_atr_max_pct': 0.057571524067060335, 'bull_tp_mult': 2.952060154184953, 'bull_tsl_mult': 0.4821158011459149, 'bull_time_stop': 295, 'bull_use_sma': True, 'bull_use_ema': False, 'bull_use_atr': False, 'bull_use_adx': False, 'bull_use_spike': False, 'bull_rsi_required': True, 'bear_strategy': 'breakout', 'bear_bb_std_mult': 2.1094155068126117, 'bear_rsi_os': 6, 'bear_rsi_ob': 72, 'bear_adx_thresh': 29.08997190030646, 'bear_atr_min_pct': 0.028973521249066478, 'bear_atr_max_pct': 0.12257760649608944, 'bear_tp_mult': 1.6076841618719657, 'bear_tsl_mult': 0.5981283909936531, 'bear_time_stop': 229, 'bear_use_sma': False, 'bear_use_ema': True, 'bear_use_atr': False, 'bear_use_adx': True, 'bear_use_spike': True, 'bear_rsi_required': True, 'sideways_strategy': 'breakout', 'sideways_bb_std_mult': 0.8715061985204202, 'sideways_rsi_os': 39, 'sideways_rsi_ob': 47, 'sideways_adx_thresh': 26.250423027893845, 'sideways_atr_min_pct': 0.02114352364337038, 'sideways_atr_max_pct': 0.03889473010180952, 'sideways_tp_mult': 1.8832518146195485, 'sideways_tsl_mult': 0.1883401576209997, 'sideways_time_stop': 260, 'sideways_use_sma': False, 'sideways_use_ema': False, 'sideways_use_atr': True, 'sideways_use_adx': False, 'sideways_use_spike': False, 'sideways_rsi_required': False}.
[I 2025-08-30 22:14:34,856] Trial 708 finished with values: [-1000000000.0, 1000000000.0] and parameters: {'p_sma': 34, 'p_std': 35, 'p_atr': 21, 'p_adx': 20, 'rsi_period': 8, 'ema1': 10, 'ema2': 57, 'slip_atr_k': 0.20152622090573324, 'slip_spread_k': 0.6764308372102597, 'spread_hl_frac': 0.021350757894393394, 'bb_std_mult': 3.5964627654185124, 'rsi_os': 36, 'rsi_ob': 56, 'vol_spike': 0.2999467146888954, 'adx_thresh': 10.782443565739767, 'atr_min_pct': 0.003994275055075552, 'atr_max_pct': 0.019095978166711516, 'tp_mult': 2.7929967275057415, 'tsl_mult': 0.911502001273863, 'strategy': 'breakout', 'time_stop': 73, 'use_sma': True, 'use_atr': True, 'use_adx': True, 'use_ema': True, 'use_spike': True, 'rsi_required': False, 'edge_k': 1.1966963346105315, 'edge_cap': 0.7753081371551716, 'bull_strategy': 'breakout', 'bull_bb_std_mult': 1.9892523091435, 'bull_rsi_os': 46, 'bull_rsi_ob': 93, 'bull_adx_thresh': 15.401867047168249, 'bull_atr_min_pct': 0.0019105680750233804, 'bull_atr_max_pct': 0.11853884536709539, 'bull_tp_mult': 1.2319613796853428, 'bull_tsl_mult': 0.4370481506313918, 'bull_time_stop': 291, 'bull_use_sma': True, 'bull_use_ema': False, 'bull_use_atr': True, 'bull_use_adx': False, 'bull_use_spike': False, 'bull_rsi_required': True, 'bear_strategy': 'mean_reversion', 'bear_bb_std_mult': 2.0776789844510493, 'bear_rsi_os': 10, 'bear_rsi_ob': 82, 'bear_adx_thresh': 28.559371580979082, 'bear_atr_min_pct': 0.028766861167429623, 'bear_atr_max_pct': 0.11016808509305731, 'bear_tp_mult': 1.5624666101030886, 'bear_tsl_mult': 0.5993899254929239, 'bear_time_stop': 15, 'bear_use_sma': False, 'bear_use_ema': True, 'bear_use_atr': True, 'bear_use_adx': True, 'bear_use_spike': False, 'bear_rsi_required': True, 'sideways_strategy': 'breakout', 'sideways_bb_std_mult': 1.8475552205319685, 'sideways_rsi_os': 27, 'sideways_rsi_ob': 82, 'sideways_adx_thresh': 25.981840361711036, 'sideways_atr_min_pct': 0.007541199168388888, 'sideways_atr_max_pct': 0.04368646589735072, 'sideways_tp_mult': 1.880382970426756, 'sideways_tsl_mult': 0.7026092445153977, 'sideways_time_stop': 260, 'sideways_use_sma': False, 'sideways_use_ema': False, 'sideways_use_atr': True, 'sideways_use_adx': False, 'sideways_use_spike': False, 'sideways_rsi_required': False}.
