[I 2025-08-30 21:43:43,954] Trial 441 finished with values: [-1000000000.0, 1000000000.0] and parameters: {'p_sma': 35, 'p_std': 37, 'p_atr': 20, 'p_adx': 21, 'rsi_period': 74, 'ema1': 11, 'ema2': 59, 'slip_atr_k': 0.01580774746925588, 'slip_spread_k': 0.6525978306419058, 'spread_hl_frac': 0.03472966025606815, 'bb_std_mult': 0.8638777559283326, 'rsi_os': 13, 'rsi_ob': 65, 'vol_spike': 0.26720873141669255, 'adx_thresh': 8.28075497011417, 'atr_min_pct': 0.013662856253384962, 'atr_max_pct': 0.02364038488415106, 'tp_mult': 1.7118122631567658, 'tsl_mult': 0.9580018813085492, 'strategy': 'mean_reversion', 'time_stop': 73, 'use_sma': True, 'use_atr': True, 'use_adx': True, 'use_ema': True, 'use_spike': True, 'rsi_required': True, 'edge_k': 0.949727870769955, 'edge_cap': 0.805107763568341, 'bull_strategy': 'breakout', 'bull_bb_std_mult': 1.8327396011674428, 'bull_rsi_os': 20, 'bull_rsi_ob': 87, 'bull_adx_thresh': 14.860805694298495, 'bull_atr_min_pct': 0.00534025889360123, 'bull_atr_max_pct': 0.12584898183664806, 'bull_tp_mult': 1.3176533176826226, 'bull_tsl_mult': 0.43722185838569644, 'bull_time_stop': 173, 'bull_use_sma': True, 'bull_use_ema': False, 'bull_use_atr': False, 'bull_use_adx': False, 'bull_use_spike': False, 'bull_rsi_required': False, 'bear_strategy': 'breakout', 'bear_bb_std_mult': 1.9189751380397737, 'bear_rsi_os': 7, 'bear_rsi_ob': 71, 'bear_adx_thresh': 27.034150944158892, 'bear_atr_min_pct': 0.029373829594435297, 'bear_atr_max_pct': 0.11683177881706162, 'bear_tp_mult': 1.5815625687085104, 'bear_tsl_mult': 0.3741729538474787, 'bear_time_stop': 214, 'bear_use_sma': False, 'bear_use_ema': True, 'bear_use_atr': False, 'bear_use_adx': False, 'bear_use_spike': True, 'bear_rsi_required': True, 'sideways_strategy': 'breakout', 'sideways_bb_std_mult': 1.7463808362269777, 'sideways_rsi_os': 38, 'sideways_rsi_ob': 88, 'sideways_adx_thresh': 27.163735281960847, 'sideways_atr_min_pct': 0.02404940774232748, 'sideways_atr_max_pct': 0.04868763240461645, 'sideways_tp_mult': 1.8229462037410875, 'sideways_tsl_mult': 0.7795664909896014, 'sideways_time_stop': 238, 'sideways_use_sma': False, 'sideways_use_ema': False, 'sideways_use_atr': False, 'sideways_use_adx': True, 'sideways_use_spike': True, 'sideways_rsi_required': False}.
[I 2025-08-30 21:43:44,204] Trial 442 finished with values: [-0.020807332977282877, 0.020695625487568425] and parameters: {'p_sma': 34, 'p_std': 37, 'p_atr': 20, 'p_adx': 21, 'rsi_period': 74, 'ema1': 11, 'ema2': 59, 'slip_atr_k': 0.2197809997643118, 'slip_spread_k': 0.7101997411887678, 'spread_hl_frac': 0.034111763036876366, 'bb_std_mult': 0.8308201380189308, 'rsi_os': 12, 'rsi_ob': 65, 'vol_spike': 0.2703964256305481, 'adx_thresh': 11.7763298563748, 'atr_min_pct': 0.013509712029088563, 'atr_max_pct': 0.027058959528342405, 'tp_mult': 1.4258985222414433, 'tsl_mult': 0.8924710213192274, 'strategy': 'mean_reversion', 'time_stop': 41, 'use_sma': True, 'use_atr': True, 'use_adx': True, 'use_ema': True, 'use_spike': True, 'rsi_required': True, 'edge_k': 1.0676946537649652, 'edge_cap': 0.7801855875030181, 'bull_strategy': 'breakout', 'bull_bb_std_mult': 1.8798223296752696, 'bull_rsi_os': 19, 'bull_rsi_ob': 87, 'bull_adx_thresh': 14.729967184269919, 'bull_atr_min_pct': 0.0005683118861252415, 'bull_atr_max_pct': 0.12326235667653954, 'bull_tp_mult': 1.3786740050806356, 'bull_tsl_mult': 0.4444138662086712, 'bull_time_stop': 295, 'bull_use_sma': True, 'bull_use_ema': False, 'bull_use_atr': False, 'bull_use_adx': False, 'bull_use_spike': False, 'bull_rsi_required': False, 'bear_strategy': 'breakout', 'bear_bb_std_mult': 1.9210905868304158, 'bear_rsi_os': 7, 'bear_rsi_ob': 71, 'bear_adx_thresh': 27.357258518136298, 'bear_atr_min_pct': 0.029422522065336253, 'bear_atr_max_pct': 0.11745833932282683, 'bear_tp_mult': 1.5876803891703417, 'bear_tsl_mult': 0.3782662490025234, 'bear_time_stop': 230, 'bear_use_sma': False, 'bear_use_ema': True, 'bear_use_atr': False, 'bear_use_adx': False, 'bear_use_spike': True, 'bear_rsi_required': True, 'sideways_strategy': 'breakout', 'sideways_bb_std_mult': 1.7425994413739276, 'sideways_rsi_os': 38, 'sideways_rsi_ob': 88, 'sideways_adx_thresh': 11.260300714034246, 'sideways_atr_min_pct': 0.021723482295770757, 'sideways_atr_max_pct': 0.035288563504089474, 'sideways_tp_mult': 1.847483454377167, 'sideways_tsl_mult': 0.7840784116787799, 'sideways_time_stop': 262, 'sideways_use_sma': False, 'sideways_use_ema': False, 'sideways_use_atr': False, 'sideways_use_adx': True, 'sideways_use_spike': True, 'sideways_rsi_required': False}.
[I 2025-08-30 21:43:45,347] Trial 446 finished with values: [-1000000000.0, 1000000000.0] and parameters: {'p_sma': 34, 'p_std': 40, 'p_atr': 20, 'p_adx': 22, 'rsi_period': 71, 'ema1': 12, 'ema2': 55, 'slip_atr_k': 0.024422337661107914, 'slip_spread_k': 0.6424895030035902, 'spread_hl_frac': 0.03335652320187615, 'bb_std_mult': 0.775436314008744, 'rsi_os': 50, 'rsi_ob': 68, 'vol_spike': 0.197464550704626, 'adx_thresh': 10.595214637701677, 'atr_min_pct': 0.01218475428883641, 'atr_max_pct': 0.030621962388672784, 'tp_mult': 2.7237100482163394, 'tsl_mult': 0.07899477628157897, 'strategy': 'mean_reversion', 'time_stop': 87, 'use_sma': True, 'use_atr': False, 'use_adx': True, 'use_ema': False, 'use_spike': True, 'rsi_required': True, 'edge_k': 1.0020498171592005, 'edge_cap': 0.7717920601113986, 'bull_strategy': 'mean_reversion', 'bull_bb_std_mult': 2.042469573568719, 'bull_rsi_os': 17, 'bull_rsi_ob': 85, 'bull_adx_thresh': 19.443639064566124, 'bull_atr_min_pct': 0.0011715405531517477, 'bull_atr_max_pct': 0.08678069545531909, 'bull_tp_mult': 1.3989429706163745, 'bull_tsl_mult': 0.39292779396528515, 'bull_time_stop': 200, 'bull_use_sma': False, 'bull_use_ema': False, 'bull_use_atr': False, 'bull_use_adx': False, 'bull_use_spike': False, 'bull_rsi_required': True, 'bear_strategy': 'mean_reversion', 'bear_bb_std_mult': 2.096971625443785, 'bear_rsi_os': 5, 'bear_rsi_ob': 65, 'bear_adx_thresh': 26.26418102789732, 'bear_atr_min_pct': 0.02374671889872812, 'bear_atr_max_pct': 0.11972979172351775, 'bear_tp_mult': 1.516619239581179, 'bear_tsl_mult': 0.7570541991130001, 'bear_time_stop': 260, 'bear_use_sma': False, 'bear_use_ema': True, 'bear_use_atr': False, 'bear_use_adx': True, 'bear_use_spike': True, 'bear_rsi_required': True, 'sideways_strategy': 'mean_reversion', 'sideways_bb_std_mult': 1.6708447814854241, 'sideways_rsi_os': 33, 'sideways_rsi_ob': 90, 'sideways_adx_thresh': 22.57712630765733, 'sideways_atr_min_pct': 0.028907690403951587, 'sideways_atr_max_pct': 0.03904888581530682, 'sideways_tp_mult': 1.8645399803554092, 'sideways_tsl_mult': 0.8124225228962112, 'sideways_time_stop': 288, 'sideways_use_sma': False, 'sideways_use_ema': False, 'sideways_use_atr': False, 'sideways_use_adx': True, 'sideways_use_spike': False, 'sideways_rsi_required': False}.
[I 2025-08-30 21:44:17,305] Trial 443 finished with values: [-1000000000.0, 1000000000.0] and parameters: {'p_sma': 36, 'p_std': 37, 'p_atr': 20, 'p_adx': 21, 'rsi_period': 73, 'ema1': 12, 'ema2': 56, 'slip_atr_k': 0.01581973766927977, 'slip_spread_k': 0.7108459822915624, 'spread_hl_frac': 0.03386883089791292, 'bb_std_mult': 0.9294150823356241, 'rsi_os': 12, 'rsi_ob': 65, 'vol_spike': 0.2772411013050843, 'adx_thresh': 10.647665000559606, 'atr_min_pct': 0.013835238482805472, 'atr_max_pct': 0.023699653088473837, 'tp_mult': 2.2586470211967202, 'tsl_mult': 0.9182310091786376, 'strategy': 'mean_reversion', 'time_stop': 49, 'use_sma': True, 'use_atr': True, 'use_adx': True, 'use_ema': True, 'use_spike': True, 'rsi_required': True, 'edge_k': 1.010291379210718, 'edge_cap': 0.7770082614860712, 'bull_strategy': 'breakout', 'bull_bb_std_mult': 1.9011587574082622, 'bull_rsi_os': 21, 'bull_rsi_ob': 87, 'bull_adx_thresh': 9.498063875431127, 'bull_atr_min_pct': 0.005776771398108192, 'bull_atr_max_pct': 0.1371653128047314, 'bull_tp_mult': 1.3697868359495642, 'bull_tsl_mult': 0.4253179044414389, 'bull_time_stop': 147, 'bull_use_sma': True, 'bull_use_ema': False, 'bull_use_atr': False, 'bull_use_adx': False, 'bull_use_spike': False, 'bull_rsi_required': False, 'bear_strategy': 'breakout', 'bear_bb_std_mult': 1.9069424773377497, 'bear_rsi_os': 5, 'bear_rsi_ob': 68, 'bear_adx_thresh': 27.24697791479109, 'bear_atr_min_pct': 0.02925345878456585, 'bear_atr_max_pct': 0.11780867395927176, 'bear_tp_mult': 1.527411702670167, 'bear_tsl_mult': 0.3555043823235994, 'bear_time_stop': 257, 'bear_use_sma': False, 'bear_use_ema': True, 'bear_use_atr': False, 'bear_use_adx': False, 'bear_use_spike': True, 'bear_rsi_required': True, 'sideways_strategy': 'breakout', 'sideways_bb_std_mult': 1.7732254938846064, 'sideways_rsi_os': 38, 'sideways_rsi_ob': 88, 'sideways_adx_thresh': 6.301437945305688, 'sideways_atr_min_pct': 0.018848225427898713, 'sideways_atr_max_pct': 0.03634930534186786, 'sideways_tp_mult': 1.8508894610168358, 'sideways_tsl_mult': 0.775048748101044, 'sideways_time_stop': 55, 'sideways_use_sma': False, 'sideways_use_ema': False, 'sideways_use_atr': False, 'sideways_use_adx': True, 'sideways_use_spike': True, 'sideways_rsi_required': False}.
[I 2025-08-30 21:44:17,471] Trial 444 finished with values: [-1000000000.0, 1000000000.0] and parameters: {'p_sma': 34, 'p_std': 37, 'p_atr': 20, 'p_adx': 21, 'rsi_period': 73, 'ema1': 12, 'ema2': 55, 'slip_atr_k': 0.022939902278320226, 'slip_spread_k': 0.6477139639389485, 'spread_hl_frac': 0.032933245630761845, 'bb_std_mult': 0.8356210319208274, 'rsi_os': 14, 'rsi_ob': 68, 'vol_spike': 0.22452381737527147, 'adx_thresh': 10.510138387604345, 'atr_min_pct': 0.013756462448166567, 'atr_max_pct': 0.02160150346622322, 'tp_mult': 2.7154149137441594, 'tsl_mult': 0.9194494500245345, 'strategy': 'mean_reversion', 'time_stop': 51, 'use_sma': True, 'use_atr': False, 'use_adx': True, 'use_ema': True, 'use_spike': True, 'rsi_required': True, 'edge_k': 1.0015512150658683, 'edge_cap': 0.7738414119635787, 'bull_strategy': 'breakout', 'bull_bb_std_mult': 1.88090649101764, 'bull_rsi_os': 19, 'bull_rsi_ob': 86, 'bull_adx_thresh': 19.23804703080209, 'bull_atr_min_pct': 0.005553120809490022, 'bull_atr_max_pct': 0.06947032579791518, 'bull_tp_mult': 1.362938335155097, 'bull_tsl_mult': 0.39019273832804774, 'bull_time_stop': 150, 'bull_use_sma': True, 'bull_use_ema': False, 'bull_use_atr': False, 'bull_use_adx': False, 'bull_use_spike': False, 'bull_rsi_required': True, 'bear_strategy': 'breakout', 'bear_bb_std_mult': 1.9041038720039416, 'bear_rsi_os': 10, 'bear_rsi_ob': 68, 'bear_adx_thresh': 26.437547654922966, 'bear_atr_min_pct': 0.029243856704767264, 'bear_atr_max_pct': 0.11761320245805724, 'bear_tp_mult': 1.5239248517002635, 'bear_tsl_mult': 0.7588398137672117, 'bear_time_stop': 258, 'bear_use_sma': False, 'bear_use_ema': True, 'bear_use_atr': False, 'bear_use_adx': False, 'bear_use_spike': True, 'bear_rsi_required': True, 'sideways_strategy': 'mean_reversion', 'sideways_bb_std_mult': 1.663774357568437, 'sideways_rsi_os': 37, 'sideways_rsi_ob': 88, 'sideways_adx_thresh': 27.210650405647822, 'sideways_atr_min_pct': 0.021512651956953545, 'sideways_atr_max_pct': 0.03890589017230171, 'sideways_tp_mult': 1.8499577536447989, 'sideways_tsl_mult': 0.8124136404005563, 'sideways_time_stop': 56, 'sideways_use_sma': False, 'sideways_use_ema': False, 'sideways_use_atr': False, 'sideways_use_adx': True, 'sideways_use_spike': True, 'sideways_rsi_required': False}.
[I 2025-08-30 21:44:17,977] Trial 445 finished with values: [-1000000000.0, 1000000000.0] and parameters: {'p_sma': 34, 'p_std': 39, 'p_atr': 20, 'p_adx': 21, 'rsi_period': 71, 'ema1': 12, 'ema2': 55, 'slip_atr_k': 0.023773142438272027, 'slip_spread_k': 0.6406075257146426, 'spread_hl_frac': 0.03371340641084391, 'bb_std_mult': 0.8278011925251012, 'rsi_os': 12, 'rsi_ob': 68, 'vol_spike': 0.26989827848427356, 'adx_thresh': 10.67224325439295, 'atr_min_pct': 0.01207701498477809, 'atr_max_pct': 0.02893849205917666, 'tp_mult': 2.9196843377594104, 'tsl_mult': 0.9099168623403964, 'strategy': 'mean_reversion', 'time_stop': 48, 'use_sma': True, 'use_atr': False, 'use_adx': True, 'use_ema': True, 'use_spike': True, 'rsi_required': True, 'edge_k': 1.0047269333770574, 'edge_cap': 0.7838675254605757, 'bull_strategy': 'breakout', 'bull_bb_std_mult': 1.8966518101463448, 'bull_rsi_os': 23, 'bull_rsi_ob': 86, 'bull_adx_thresh': 16.221970165150623, 'bull_atr_min_pct': 0.002275234423634303, 'bull_atr_max_pct': 0.054470141747086726, 'bull_tp_mult': 1.376745931179207, 'bull_tsl_mult': 0.42736140937061007, 'bull_time_stop': 151, 'bull_use_sma': False, 'bull_use_ema': False, 'bull_use_atr': False, 'bull_use_adx': False, 'bull_use_spike': False, 'bull_rsi_required': True, 'bear_strategy': 'mean_reversion', 'bear_bb_std_mult': 2.0930868855003295, 'bear_rsi_os': 5, 'bear_rsi_ob': 73, 'bear_adx_thresh': 26.280755285496987, 'bear_atr_min_pct': 0.02928612345954747, 'bear_atr_max_pct': 0.11931712947799497, 'bear_tp_mult': 1.5346283815158008, 'bear_tsl_mult': 0.05184525258459455, 'bear_time_stop': 229, 'bear_use_sma': False, 'bear_use_ema': True, 'bear_use_atr': False, 'bear_use_adx': False, 'bear_use_spike': True, 'bear_rsi_required': True, 'sideways_strategy': 'mean_reversion', 'sideways_bb_std_mult': 2.307322298841613, 'sideways_rsi_os': 37, 'sideways_rsi_ob': 88, 'sideways_adx_thresh': 15.976817886765009, 'sideways_atr_min_pct': 0.021270798975018476, 'sideways_atr_max_pct': 0.039245497477031654, 'sideways_tp_mult': 1.8592153355872403, 'sideways_tsl_mult': 0.812972812663986, 'sideways_time_stop': 263, 'sideways_use_sma': False, 'sideways_use_ema': False, 'sideways_use_atr': False, 'sideways_use_adx': True, 'sideways_use_spike': False, 'sideways_rsi_required': False}.
[I 2025-08-30 21:44:19,304] Trial 447 finished with values: [-1000000000.0, 1000000000.0] and parameters: {'p_sma': 40, 'p_std': 39, 'p_atr': 21, 'p_adx': 21, 'rsi_period': 69, 'ema1': 12, 'ema2': 55, 'slip_atr_k': 0.24200336217782845, 'slip_spread_k': 0.6632036301625402, 'spread_hl_frac': 0.03184472595755575, 'bb_std_mult': 0.9474025303989801, 'rsi_os': 53, 'rsi_ob': 68, 'vol_spike': 0.2764256883193804, 'adx_thresh': 9.090381155849823, 'atr_min_pct': 0.013536137280327137, 'atr_max_pct': 0.022101163342869986, 'tp_mult': 1.7274148329144872, 'tsl_mult': 0.9094159934093001, 'strategy': 'breakout', 'time_stop': 47, 'use_sma': True, 'use_atr': True, 'use_adx': False, 'use_ema': True, 'use_spike': False, 'rsi_required': False, 'edge_k': 1.6798665766978824, 'edge_cap': 0.789025056330616, 'bull_strategy': 'breakout', 'bull_bb_std_mult': 1.751431272012335, 'bull_rsi_os': 53, 'bull_rsi_ob': 86, 'bull_adx_thresh': 16.160122257308632, 'bull_atr_min_pct': 0.021807753921035167, 'bull_atr_max_pct': 0.09366608104867695, 'bull_tp_mult': 1.356665877997548, 'bull_tsl_mult': 0.9676380728841376, 'bull_time_stop': 294, 'bull_use_sma': True, 'bull_use_ema': False, 'bull_use_atr': True, 'bull_use_adx': False, 'bull_use_spike': False, 'bull_rsi_required': True, 'bear_strategy': 'mean_reversion', 'bear_bb_std_mult': 2.0574832924721553, 'bear_rsi_os': 9, 'bear_rsi_ob': 67, 'bear_adx_thresh': 26.444071666883154, 'bear_atr_min_pct': 0.02990510125324422, 'bear_atr_max_pct': 0.11418244835309946, 'bear_tp_mult': 1.5302157182969078, 'bear_tsl_mult': 0.349915435103768, 'bear_time_stop': 254, 'bear_use_sma': False, 'bear_use_ema': True, 'bear_use_atr': True, 'bear_use_adx': True, 'bear_use_spike': False, 'bear_rsi_required': False, 'sideways_strategy': 'breakout', 'sideways_bb_std_mult': 3.1637650164035094, 'sideways_rsi_os': 37, 'sideways_rsi_ob': 90, 'sideways_adx_thresh': 15.638525437507596, 'sideways_atr_min_pct': 0.018948872543073383, 'sideways_atr_max_pct': 0.04174627062718704, 'sideways_tp_mult': 1.7867176255003987, 'sideways_tsl_mult': 0.8117217194083567, 'sideways_time_stop': 71, 'sideways_use_sma': False, 'sideways_use_ema': False, 'sideways_use_atr': False, 'sideways_use_adx': True, 'sideways_use_spike': False, 'sideways_rsi_required': False}.
[I 2025-08-30 21:44:50,828] Trial 449 finished with values: [-1000000000.0, 1000000000.0] and parameters: {'p_sma': 41, 'p_std': 36, 'p_atr': 22, 'p_adx': 20, 'rsi_period': 69, 'ema1': 10, 'ema2': 54, 'slip_atr_k': 0.02796940211680728, 'slip_spread_k': 0.6675049062073236, 'spread_hl_frac': 0.03155605003477938, 'bb_std_mult': 0.6356290349672198, 'rsi_os': 39, 'rsi_ob': 63, 'vol_spike': 0.2785940128941464, 'adx_thresh': 8.791123182130532, 'atr_min_pct': 0.012221352060381795, 'atr_max_pct': 0.03191597656375699, 'tp_mult': 1.2225033442656883, 'tsl_mult': 0.9098028377443602, 'strategy': 'breakout', 'time_stop': 86, 'use_sma': True, 'use_atr': True, 'use_adx': False, 'use_ema': False, 'use_spike': False, 'rsi_required': False, 'edge_k': 0.9373421374176184, 'edge_cap': 0.8300894363914533, 'bull_strategy': 'breakout', 'bull_bb_std_mult': 1.7916419867786266, 'bull_rsi_os': 17, 'bull_rsi_ob': 86, 'bull_adx_thresh': 16.171401932425997, 'bull_atr_min_pct': 0.002373073409360529, 'bull_atr_max_pct': 0.0228768093806861, 'bull_tp_mult': 1.4229390419911114, 'bull_tsl_mult': 0.4205044032527367, 'bull_time_stop': 294, 'bull_use_sma': False, 'bull_use_ema': True, 'bull_use_atr': True, 'bull_use_adx': False, 'bull_use_spike': False, 'bull_rsi_required': True, 'bear_strategy': 'mean_reversion', 'bear_bb_std_mult': 2.024130219251809, 'bear_rsi_os': 9, 'bear_rsi_ob': 67, 'bear_adx_thresh': 28.816054089999515, 'bear_atr_min_pct': 0.003063607843379279, 'bear_atr_max_pct': 0.1137114598500583, 'bear_tp_mult': 1.534037836601189, 'bear_tsl_mult': 0.38890892229945634, 'bear_time_stop': 204, 'bear_use_sma': False, 'bear_use_ema': True, 'bear_use_atr': True, 'bear_use_adx': True, 'bear_use_spike': False, 'bear_rsi_required': False, 'sideways_strategy': 'breakout', 'sideways_bb_std_mult': 3.178708814599215, 'sideways_rsi_os': 39, 'sideways_rsi_ob': 90, 'sideways_adx_thresh': 15.414966892334714, 'sideways_atr_min_pct': 0.0035288504400319953, 'sideways_atr_max_pct': 0.04169225994879627, 'sideways_tp_mult': 1.7928689161392402, 'sideways_tsl_mult': 0.7419614912669236, 'sideways_time_stop': 256, 'sideways_use_sma': True, 'sideways_use_ema': False, 'sideways_use_atr': False, 'sideways_use_adx': True, 'sideways_use_spike': False, 'sideways_rsi_required': False}.
[I 2025-08-30 21:44:50,981] Trial 448 finished with values: [-0.03992415074631117, 0.03988317234644592] and parameters: {'p_sma': 40, 'p_std': 39, 'p_atr': 22, 'p_adx': 20, 'rsi_period': 69, 'ema1': 10, 'ema2': 54, 'slip_atr_k': 0.24331668644877968, 'slip_spread_k': 0.6719004041660339, 'spread_hl_frac': 0.03573781635714404, 'bb_std_mult': 0.6284220172460366, 'rsi_os': 28, 'rsi_ob': 63, 'vol_spike': 0.10645788324376926, 'adx_thresh': 8.937475748385673, 'atr_min_pct': 0.01211703750837179, 'atr_max_pct': 0.028094840277063556, 'tp_mult': 2.3320335742357665, 'tsl_mult': 0.40743843498321236, 'strategy': 'breakout', 'time_stop': 93, 'use_sma': True, 'use_atr': True, 'use_adx': False, 'use_ema': False, 'use_spike': False, 'rsi_required': False, 'edge_k': 0.9422361826085597, 'edge_cap': 0.8239633709209363, 'bull_strategy': 'breakout', 'bull_bb_std_mult': 1.7358208382940468, 'bull_rsi_os': 53, 'bull_rsi_ob': 89, 'bull_adx_thresh': 16.00583595061746, 'bull_atr_min_pct': 0.0024809714339755424, 'bull_atr_max_pct': 0.05492838947738029, 'bull_tp_mult': 1.5058379984273575, 'bull_tsl_mult': 0.9777627415614537, 'bull_time_stop': 294, 'bull_use_sma': False, 'bull_use_ema': True, 'bull_use_atr': True, 'bull_use_adx': False, 'bull_use_spike': False, 'bull_rsi_required': True, 'bear_strategy': 'mean_reversion', 'bear_bb_std_mult': 2.029022502192838, 'bear_rsi_os': 9, 'bear_rsi_ob': 72, 'bear_adx_thresh': 28.773658383302084, 'bear_atr_min_pct': 0.029997268181879255, 'bear_atr_max_pct': 0.11502081772839355, 'bear_tp_mult': 1.5278916768747275, 'bear_tsl_mult': 0.3990866999503299, 'bear_time_stop': 205, 'bear_use_sma': False, 'bear_use_ema': True, 'bear_use_atr': True, 'bear_use_adx': True, 'bear_use_spike': False, 'bear_rsi_required': False, 'sideways_strategy': 'breakout', 'sideways_bb_std_mult': 0.9045004822508551, 'sideways_rsi_os': 39, 'sideways_rsi_ob': 90, 'sideways_adx_thresh': 23.41101310096258, 'sideways_atr_min_pct': 0.000593832039948573, 'sideways_atr_max_pct': 0.042952357688017466, 'sideways_tp_mult': 1.7792932851060232, 'sideways_tsl_mult': 0.7378456790127381, 'sideways_time_stop': 257, 'sideways_use_sma': True, 'sideways_use_ema': False, 'sideways_use_atr': False, 'sideways_use_adx': True, 'sideways_use_spike': False, 'sideways_rsi_required': False}.
