[I 2025-08-30 22:01:48,890] Trial 603 finished with values: [-1000000000.0, 1000000000.0] and parameters: {'p_sma': 42, 'p_std': 45, 'p_atr': 28, 'p_adx': 19, 'rsi_period': 45, 'ema1': 12, 'ema2': 54, 'slip_atr_k': 0.030039793219046384, 'slip_spread_k': 0.3377113485652238, 'spread_hl_frac': 0.017252855114174306, 'bb_std_mult': 0.7447940236151633, 'rsi_os': 12, 'rsi_ob': 64, 'vol_spike': 0.12901895814261088, 'adx_thresh': 10.991649287467684, 'atr_min_pct': 0.012148225915259677, 'atr_max_pct': 0.12247541914323098, 'tp_mult': 2.852196813359097, 'tsl_mult': 0.4951642823118881, 'strategy': 'mean_reversion', 'time_stop': 103, 'use_sma': True, 'use_atr': True, 'use_adx': True, 'use_ema': False, 'use_spike': True, 'rsi_required': True, 'edge_k': 1.683833440296591, 'edge_cap': 0.23879070727110424, 'bull_strategy': 'breakout', 'bull_bb_std_mult': 2.0846484203489997, 'bull_rsi_os': 16, 'bull_rsi_ob': 88, 'bull_adx_thresh': 18.599829508946637, 'bull_atr_min_pct': 0.025445583390295262, 'bull_atr_max_pct': 0.11406662718557342, 'bull_tp_mult': 1.4106886961106428, 'bull_tsl_mult': 0.44927540091258, 'bull_time_stop': 300, 'bull_use_sma': True, 'bull_use_ema': False, 'bull_use_atr': False, 'bull_use_adx': False, 'bull_use_spike': True, 'bull_rsi_required': True, 'bear_strategy': 'mean_reversion', 'bear_bb_std_mult': 1.891903149079699, 'bear_rsi_os': 5, 'bear_rsi_ob': 73, 'bear_adx_thresh': 27.640599911590773, 'bear_atr_min_pct': 0.0294359800578348, 'bear_atr_max_pct': 0.10808703744530483, 'bear_tp_mult': 2.6038358364367573, 'bear_tsl_mult': 0.8388840292045716, 'bear_time_stop': 5, 'bear_use_sma': True, 'bear_use_ema': False, 'bear_use_atr': False, 'bear_use_adx': True, 'bear_use_spike': True, 'bear_rsi_required': True, 'sideways_strategy': 'breakout', 'sideways_bb_std_mult': 1.718316726155383, 'sideways_rsi_os': 48, 'sideways_rsi_ob': 88, 'sideways_adx_thresh': 26.803682227881406, 'sideways_atr_min_pct': 0.028162836736650432, 'sideways_atr_max_pct': 0.08248761945399613, 'sideways_tp_mult': 1.7787366335529462, 'sideways_tsl_mult': 0.8313435519257646, 'sideways_time_stop': 6, 'sideways_use_sma': False, 'sideways_use_ema': True, 'sideways_use_atr': True, 'sideways_use_adx': False, 'sideways_use_spike': False, 'sideways_rsi_required': True}.
[I 2025-08-30 22:01:50,406] Trial 607 finished with values: [-1000000000.0, 1000000000.0] and parameters: {'p_sma': 21, 'p_std': 16, 'p_atr': 12, 'p_adx': 26, 'rsi_period': 69, 'ema1': 14, 'ema2': 37, 'slip_atr_k': 0.020625968239184965, 'slip_spread_k': 0.6474541288334912, 'spread_hl_frac': 0.009915940003294085, 'bb_std_mult': 2.453129415421767, 'rsi_os': 24, 'rsi_ob': 49, 'vol_spike': 0.27211879801627825, 'adx_thresh': 9.210942417935962, 'atr_min_pct': 0.02330358166920654, 'atr_max_pct': 0.06064243447882815, 'tp_mult': 1.717660465570966, 'tsl_mult': 0.9755024721953269, 'strategy': 'mean_reversion', 'time_stop': 81, 'use_sma': False, 'use_atr': False, 'use_adx': False, 'use_ema': False, 'use_spike': False, 'rsi_required': True, 'edge_k': 1.1580266180968959, 'edge_cap': 0.7759585331071257, 'bull_strategy': 'breakout', 'bull_bb_std_mult': 1.7206732950013983, 'bull_rsi_os': 16, 'bull_rsi_ob': 86, 'bull_adx_thresh': 13.119244960141984, 'bull_atr_min_pct': 0.026946427417641687, 'bull_atr_max_pct': 0.04472986514404281, 'bull_tp_mult': 1.4738013844922644, 'bull_tsl_mult': 0.3639785037298352, 'bull_time_stop': 126, 'bull_use_sma': False, 'bull_use_ema': True, 'bull_use_atr': False, 'bull_use_adx': False, 'bull_use_spike': False, 'bull_rsi_required': True, 'bear_strategy': 'breakout', 'bear_bb_std_mult': 1.9663746797872272, 'bear_rsi_os': 6, 'bear_rsi_ob': 69, 'bear_adx_thresh': 34.996743140695834, 'bear_atr_min_pct': 0.027706341417424504, 'bear_atr_max_pct': 0.0870693621744875, 'bear_tp_mult': 1.4331550423334471, 'bear_tsl_mult': 0.3980033781739951, 'bear_time_stop': 210, 'bear_use_sma': False, 'bear_use_ema': True, 'bear_use_atr': False, 'bear_use_adx': False, 'bear_use_spike': False, 'bear_rsi_required': True, 'sideways_strategy': 'mean_reversion', 'sideways_bb_std_mult': 1.6561421737807465, 'sideways_rsi_os': 37, 'sideways_rsi_ob': 55, 'sideways_adx_thresh': 5.03072682935748, 'sideways_atr_min_pct': 0.020023927463840834, 'sideways_atr_max_pct': 0.03994628892112782, 'sideways_tp_mult': 1.8360432388664771, 'sideways_tsl_mult': 0.7874201875695955, 'sideways_time_stop': 93, 'sideways_use_sma': True, 'sideways_use_ema': False, 'sideways_use_atr': False, 'sideways_use_adx': False, 'sideways_use_spike': True, 'sideways_rsi_required': False}.
[I 2025-08-30 22:02:21,935] Trial 605 finished with values: [-1000000000.0, 1000000000.0] and parameters: {'p_sma': 49, 'p_std': 35, 'p_atr': 21, 'p_adx': 19, 'rsi_period': 70, 'ema1': 10, 'ema2': 53, 'slip_atr_k': 0.0379071723440912, 'slip_spread_k': 0.6430399801000636, 'spread_hl_frac': 0.034870038688864735, 'bb_std_mult': 0.7493225763784362, 'rsi_os': 49, 'rsi_ob': 64, 'vol_spike': 0.26904196424652704, 'adx_thresh': 12.636080499624578, 'atr_min_pct': 0.025489968273622928, 'atr_max_pct': 0.11535668677570998, 'tp_mult': 1.2277629420413505, 'tsl_mult': 0.4954052019859574, 'strategy': 'mean_reversion', 'time_stop': 103, 'use_sma': False, 'use_atr': True, 'use_adx': True, 'use_ema': False, 'use_spike': True, 'rsi_required': True, 'edge_k': 1.021620228198829, 'edge_cap': 0.9184111430974357, 'bull_strategy': 'breakout', 'bull_bb_std_mult': 2.078434309926762, 'bull_rsi_os': 9, 'bull_rsi_ob': 50, 'bull_adx_thresh': 12.870177429769392, 'bull_atr_min_pct': 0.001487003451844291, 'bull_atr_max_pct': 0.061370854625731226, 'bull_tp_mult': 1.457854137729757, 'bull_tsl_mult': 0.38186727128187087, 'bull_time_stop': 292, 'bull_use_sma': False, 'bull_use_ema': True, 'bull_use_atr': False, 'bull_use_adx': False, 'bull_use_spike': False, 'bull_rsi_required': True, 'bear_strategy': 'breakout', 'bear_bb_std_mult': 2.122885693270442, 'bear_rsi_os': 5, 'bear_rsi_ob': 82, 'bear_adx_thresh': 27.724363491788683, 'bear_atr_min_pct': 0.029379228149236335, 'bear_atr_max_pct': 0.062014386268571295, 'bear_tp_mult': 1.4512879938968593, 'bear_tsl_mult': 0.04855117271299331, 'bear_time_stop': 211, 'bear_use_sma': True, 'bear_use_ema': False, 'bear_use_atr': False, 'bear_use_adx': False, 'bear_use_spike': True, 'bear_rsi_required': True, 'sideways_strategy': 'mean_reversion', 'sideways_bb_std_mult': 3.3563371304983347, 'sideways_rsi_os': 37, 'sideways_rsi_ob': 80, 'sideways_adx_thresh': 26.633764028163508, 'sideways_atr_min_pct': 0.022430992354164046, 'sideways_atr_max_pct': 0.04051599983971856, 'sideways_tp_mult': 1.7794318671857583, 'sideways_tsl_mult': 0.7568792386819542, 'sideways_time_stop': 92, 'sideways_use_sma': False, 'sideways_use_ema': False, 'sideways_use_atr': False, 'sideways_use_adx': False, 'sideways_use_spike': False, 'sideways_rsi_required': False}.
[I 2025-08-30 22:02:23,063] Trial 606 finished with values: [-1000000000.0, 1000000000.0] and parameters: {'p_sma': 34, 'p_std': 38, 'p_atr': 21, 'p_adx': 23, 'rsi_period': 69, 'ema1': 10, 'ema2': 37, 'slip_atr_k': 0.14566468188452966, 'slip_spread_k': 0.04167291205388701, 'spread_hl_frac': 0.010034104685717932, 'bb_std_mult': 2.467528437053233, 'rsi_os': 9, 'rsi_ob': 66, 'vol_spike': 0.2676875591569166, 'adx_thresh': 9.278770745764252, 'atr_min_pct': 0.012212434544645986, 'atr_max_pct': 0.06120916901725885, 'tp_mult': 1.1999266209582624, 'tsl_mult': 0.8805424852161479, 'strategy': 'mean_reversion', 'time_stop': 81, 'use_sma': False, 'use_atr': False, 'use_adx': False, 'use_ema': False, 'use_spike': False, 'rsi_required': True, 'edge_k': 0.8992175140471105, 'edge_cap': 0.7899926790233351, 'bull_strategy': 'breakout', 'bull_bb_std_mult': 2.0079832114293703, 'bull_rsi_os': 17, 'bull_rsi_ob': 50, 'bull_adx_thresh': 20.913754605344877, 'bull_atr_min_pct': 0.0005101307002190499, 'bull_atr_max_pct': 0.061835801749732855, 'bull_tp_mult': 1.4573876445038456, 'bull_tsl_mult': 0.28530769815770674, 'bull_time_stop': 201, 'bull_use_sma': False, 'bull_use_ema': True, 'bull_use_atr': False, 'bull_use_adx': False, 'bull_use_spike': False, 'bull_rsi_required': True, 'bear_strategy': 'breakout', 'bear_bb_std_mult': 2.9831679759523135, 'bear_rsi_os': 10, 'bear_rsi_ob': 69, 'bear_adx_thresh': 28.674945808031815, 'bear_atr_min_pct': 0.0031503877469646717, 'bear_atr_max_pct': 0.06351192412882711, 'bear_tp_mult': 1.212265653930412, 'bear_tsl_mult': 0.4030516022758617, 'bear_time_stop': 183, 'bear_use_sma': False, 'bear_use_ema': True, 'bear_use_atr': False, 'bear_use_adx': False, 'bear_use_spike': False, 'bear_rsi_required': True, 'sideways_strategy': 'mean_reversion', 'sideways_bb_std_mult': 2.4493263080207845, 'sideways_rsi_os': 43, 'sideways_rsi_ob': 86, 'sideways_adx_thresh': 7.391465808340067, 'sideways_atr_min_pct': 0.020115261328494644, 'sideways_atr_max_pct': 0.040130553604328316, 'sideways_tp_mult': 1.7086590913173223, 'sideways_tsl_mult': 0.7879381852329752, 'sideways_time_stop': 279, 'sideways_use_sma': True, 'sideways_use_ema': False, 'sideways_use_atr': False, 'sideways_use_adx': False, 'sideways_use_spike': True, 'sideways_rsi_required': False}.
[I 2025-08-30 22:02:23,508] Trial 604 finished with values: [-1000000000.0, 1000000000.0] and parameters: {'p_sma': 34, 'p_std': 16, 'p_atr': 21, 'p_adx': 26, 'rsi_period': 71, 'ema1': 12, 'ema2': 52, 'slip_atr_k': 0.03784782960459959, 'slip_spread_k': 0.6844886405898306, 'spread_hl_frac': 0.013566615036444173, 'bb_std_mult': 1.1898397741438709, 'rsi_os': 12, 'rsi_ob': 64, 'vol_spike': 0.12985309432779776, 'adx_thresh': 10.709731181981581, 'atr_min_pct': 0.012014198956603194, 'atr_max_pct': 0.13389130721106957, 'tp_mult': 1.726553128891174, 'tsl_mult': 0.9712571257656377, 'strategy': 'mean_reversion', 'time_stop': 36, 'use_sma': True, 'use_atr': True, 'use_adx': True, 'use_ema': False, 'use_spike': True, 'rsi_required': True, 'edge_k': 1.2582547123243684, 'edge_cap': 0.7803310343127065, 'bull_strategy': 'breakout', 'bull_bb_std_mult': 2.0436173223339695, 'bull_rsi_os': 17, 'bull_rsi_ob': 50, 'bull_adx_thresh': 15.400687686403746, 'bull_atr_min_pct': 0.027859499313640422, 'bull_atr_max_pct': 0.0673454938780399, 'bull_tp_mult': 2.86918812395199, 'bull_tsl_mult': 0.9731121776578222, 'bull_time_stop': 109, 'bull_use_sma': False, 'bull_use_ema': True, 'bull_use_atr': False, 'bull_use_adx': False, 'bull_use_spike': True, 'bull_rsi_required': True, 'bear_strategy': 'breakout', 'bear_bb_std_mult': 2.1161333611999056, 'bear_rsi_os': 17, 'bear_rsi_ob': 76, 'bear_adx_thresh': 27.64358587005943, 'bear_atr_min_pct': 0.029961992534324654, 'bear_atr_max_pct': 0.04360475802482265, 'bear_tp_mult': 1.4316753073051258, 'bear_tsl_mult': 0.4017016313927093, 'bear_time_stop': 44, 'bear_use_sma': True, 'bear_use_ema': False, 'bear_use_atr': False, 'bear_use_adx': False, 'bear_use_spike': True, 'bear_rsi_required': True, 'sideways_strategy': 'mean_reversion', 'sideways_bb_std_mult': 2.228339401119799, 'sideways_rsi_os': 37, 'sideways_rsi_ob': 55, 'sideways_adx_thresh': 26.89259710156205, 'sideways_atr_min_pct': 0.02023464861086713, 'sideways_atr_max_pct': 0.04034799199675138, 'sideways_tp_mult': 1.7683653064413338, 'sideways_tsl_mult': 0.7829650512932228, 'sideways_time_stop': 255, 'sideways_use_sma': False, 'sideways_use_ema': True, 'sideways_use_atr': True, 'sideways_use_adx': False, 'sideways_use_spike': False, 'sideways_rsi_required': True}.
[I 2025-08-30 22:02:24,948] Trial 608 finished with values: [-1000000000.0, 1000000000.0] and parameters: {'p_sma': 34, 'p_std': 36, 'p_atr': 20, 'p_adx': 13, 'rsi_period': 62, 'ema1': 10, 'ema2': 32, 'slip_atr_k': 0.18257349951165663, 'slip_spread_k': 0.04126016830097562, 'spread_hl_frac': 0.022139587032757303, 'bb_std_mult': 3.385629388776273, 'rsi_os': 9, 'rsi_ob': 66, 'vol_spike': 0.2849256996863931, 'adx_thresh': 9.804348538433075, 'atr_min_pct': 0.012101339055564608, 'atr_max_pct': 0.024326110311746606, 'tp_mult': 1.2375299887154663, 'tsl_mult': 0.5500034911272306, 'strategy': 'mean_reversion', 'time_stop': 176, 'use_sma': True, 'use_atr': True, 'use_adx': True, 'use_ema': True, 'use_spike': True, 'rsi_required': True, 'edge_k': 0.5703670461979902, 'edge_cap': 0.7899691248428131, 'bull_strategy': 'mean_reversion', 'bull_bb_std_mult': 0.7665210026070253, 'bull_rsi_os': 50, 'bull_rsi_ob': 86, 'bull_adx_thresh': 5.80564593721169, 'bull_atr_min_pct': 0.02805464546863929, 'bull_atr_max_pct': 0.05081039797963719, 'bull_tp_mult': 1.348387166937193, 'bull_tsl_mult': 0.3943324917908828, 'bull_time_stop': 140, 'bull_use_sma': False, 'bull_use_ema': True, 'bull_use_atr': False, 'bull_use_adx': False, 'bull_use_spike': False, 'bull_rsi_required': True, 'bear_strategy': 'breakout', 'bear_bb_std_mult': 1.5098997524791709, 'bear_rsi_os': 21, 'bear_rsi_ob': 75, 'bear_adx_thresh': 20.19649976749005, 'bear_atr_min_pct': 0.011082051585034652, 'bear_atr_max_pct': 0.0621995473139343, 'bear_tp_mult': 1.4874753981382391, 'bear_tsl_mult': 0.058787836117521974, 'bear_time_stop': 56, 'bear_use_sma': False, 'bear_use_ema': True, 'bear_use_atr': False, 'bear_use_adx': False, 'bear_use_spike': True, 'bear_rsi_required': True, 'sideways_strategy': 'mean_reversion', 'sideways_bb_std_mult': 2.468363264180412, 'sideways_rsi_os': 23, 'sideways_rsi_ob': 90, 'sideways_adx_thresh': 28.492129546022237, 'sideways_atr_min_pct': 0.010980233914831647, 'sideways_atr_max_pct': 0.04634154232909843, 'sideways_tp_mult': 1.7279480802406737, 'sideways_tsl_mult': 0.7603554782612066, 'sideways_time_stop': 256, 'sideways_use_sma': False, 'sideways_use_ema': False, 'sideways_use_atr': False, 'sideways_use_adx': True, 'sideways_use_spike': False, 'sideways_rsi_required': False}.
[I 2025-08-30 22:02:25,729] Trial 612 finished with values: [-1000000000.0, 1000000000.0] and parameters: {'p_sma': 14, 'p_std': 57, 'p_atr': 22, 'p_adx': 15, 'rsi_period': 72, 'ema1': 11, 'ema2': 56, 'slip_atr_k': 0.23948543327588057, 'slip_spread_k': 0.6056424495330701, 'spread_hl_frac': 0.03969361396563719, 'bb_std_mult': 3.0128747707621866, 'rsi_os': 18, 'rsi_ob': 74, 'vol_spike': 0.03360468325397635, 'adx_thresh': 7.742503311433076, 'atr_min_pct': 0.028961005445026028, 'atr_max_pct': 0.02713031459430287, 'tp_mult': 2.1735641800047465, 'tsl_mult': 0.39501348257003277, 'strategy': 'mean_reversion', 'time_stop': 90, 'use_sma': True, 'use_atr': True, 'use_adx': True, 'use_ema': True, 'use_spike': True, 'rsi_required': False, 'edge_k': 1.8171897896998956, 'edge_cap': 0.7482627755172677, 'bull_strategy': 'mean_reversion', 'bull_bb_std_mult': 1.823145200999188, 'bull_rsi_os': 31, 'bull_rsi_ob': 53, 'bull_adx_thresh': 14.445699046631148, 'bull_atr_min_pct': 0.02176154840821579, 'bull_atr_max_pct': 0.05695506353145131, 'bull_tp_mult': 1.415764247259355, 'bull_tsl_mult': 0.8303813312506142, 'bull_time_stop': 167, 'bull_use_sma': True, 'bull_use_ema': False, 'bull_use_atr': False, 'bull_use_adx': False, 'bull_use_spike': False, 'bull_rsi_required': True, 'bear_strategy': 'mean_reversion', 'bear_bb_std_mult': 1.756559535561366, 'bear_rsi_os': 9, 'bear_rsi_ob': 62, 'bear_adx_thresh': 6.21479496330967, 'bear_atr_min_pct': 0.0293993563900647, 'bear_atr_max_pct': 0.112408482560319, 'bear_tp_mult': 1.5885994014134526, 'bear_tsl_mult': 0.4251525955102397, 'bear_time_stop': 230, 'bear_use_sma': False, 'bear_use_ema': True, 'bear_use_atr': False, 'bear_use_adx': True, 'bear_use_spike': True, 'bear_rsi_required': True, 'sideways_strategy': 'breakout', 'sideways_bb_std_mult': 1.7583045100479806, 'sideways_rsi_os': 15, 'sideways_rsi_ob': 70, 'sideways_adx_thresh': 25.852515379703146, 'sideways_atr_min_pct': 0.021082413916290635, 'sideways_atr_max_pct': 0.021702095155602445, 'sideways_tp_mult': 1.823613267932155, 'sideways_tsl_mult': 0.8031910847138375, 'sideways_time_stop': 270, 'sideways_use_sma': False, 'sideways_use_ema': False, 'sideways_use_atr': False, 'sideways_use_adx': True, 'sideways_use_spike': False, 'sideways_rsi_required': False}.
[I 2025-08-30 22:02:57,947] Trial 611 finished with values: [-1000000000.0, 1000000000.0] and parameters: {'p_sma': 14, 'p_std': 8, 'p_atr': 19, 'p_adx': 21, 'rsi_period': 42, 'ema1': 13, 'ema2': 56, 'slip_atr_k': 0.04476100297178161, 'slip_spread_k': 0.8682522727923373, 'spread_hl_frac': 0.04739909878297955, 'bb_std_mult': 2.3648821838001886, 'rsi_os': 16, 'rsi_ob': 66, 'vol_spike': 0.10357857659009607, 'adx_thresh': 11.872254453021206, 'atr_min_pct': 0.015534135234378472, 'atr_max_pct': 0.02479436493637067, 'tp_mult': 1.6883544556187746, 'tsl_mult': 0.5498895516103021, 'strategy': 'mean_reversion', 'time_stop': 94, 'use_sma': True, 'use_atr': True, 'use_adx': True, 'use_ema': True, 'use_spike': True, 'rsi_required': False, 'edge_k': 1.2168451697097606, 'edge_cap': 0.8087685335235828, 'bull_strategy': 'mean_reversion', 'bull_bb_std_mult': 1.8309503757784766, 'bull_rsi_os': 15, 'bull_rsi_ob': 86, 'bull_adx_thresh': 16.969649316544356, 'bull_atr_min_pct': 0.022232589682233832, 'bull_atr_max_pct': 0.050658358587359266, 'bull_tp_mult': 1.2981947869822856, 'bull_tsl_mult': 0.16946747017710845, 'bull_time_stop': 14, 'bull_use_sma': True, 'bull_use_ema': False, 'bull_use_atr': False, 'bull_use_adx': False, 'bull_use_spike': False, 'bull_rsi_required': True, 'bear_strategy': 'mean_reversion', 'bear_bb_std_mult': 3.274010431130864, 'bear_rsi_os': 7, 'bear_rsi_ob': 66, 'bear_adx_thresh': 26.093364695037025, 'bear_atr_min_pct': 0.013483838001943403, 'bear_atr_max_pct': 0.14189863171374975, 'bear_tp_mult': 1.6122690775254918, 'bear_tsl_mult': 0.3758483076474315, 'bear_time_stop': 33, 'bear_use_sma': False, 'bear_use_ema': True, 'bear_use_atr': False, 'bear_use_adx': True, 'bear_use_spike': True, 'bear_rsi_required': True, 'sideways_strategy': 'breakout', 'sideways_bb_std_mult': 1.2525372244591528, 'sideways_rsi_os': 18, 'sideways_rsi_ob': 63, 'sideways_adx_thresh': 28.364290023085744, 'sideways_atr_min_pct': 0.0028533029503489283, 'sideways_atr_max_pct': 0.046778578331394496, 'sideways_tp_mult': 1.825558002017015, 'sideways_tsl_mult': 0.7659780277653898, 'sideways_time_stop': 271, 'sideways_use_sma': False, 'sideways_use_ema': False, 'sideways_use_atr': False, 'sideways_use_adx': True, 'sideways_use_spike': False, 'sideways_rsi_required': False}.
[I 2025-08-30 22:02:58,048] Trial 609 finished with values: [-1000000000.0, 1000000000.0] and parameters: {'p_sma': 34, 'p_std': 38, 'p_atr': 19, 'p_adx': 25, 'rsi_period': 38, 'ema1': 30, 'ema2': 51, 'slip_atr_k': 0.22180639679111624, 'slip_spread_k': 0.6647318043745045, 'spread_hl_frac': 0.041878118284198046, 'bb_std_mult': 2.3602794755349064, 'rsi_os': 31, 'rsi_ob': 74, 'vol_spike': 0.25835142314814585, 'adx_thresh': 10.22038492653817, 'atr_min_pct': 0.01223932522640478, 'atr_max_pct': 0.13426083771975178, 'tp_mult': 2.0643173574961247, 'tsl_mult': 0.9268474565818907, 'strategy': 'mean_reversion', 'time_stop': 176, 'use_sma': True, 'use_atr': True, 'use_adx': False, 'use_ema': True, 'use_spike': False, 'rsi_required': False, 'edge_k': 0.5634431535904983, 'edge_cap': 0.7804624453636817, 'bull_strategy': 'mean_reversion', 'bull_bb_std_mult': 0.7347232115712092, 'bull_rsi_os': 17, 'bull_rsi_ob': 65, 'bull_adx_thresh': 19.63182667553215, 'bull_atr_min_pct': 0.028284496996609076, 'bull_atr_max_pct': 0.05109913982840608, 'bull_tp_mult': 1.3478470761363044, 'bull_tsl_mult': 0.9095602194057405, 'bull_time_stop': 225, 'bull_use_sma': True, 'bull_use_ema': False, 'bull_use_atr': False, 'bull_use_adx': False, 'bull_use_spike': False, 'bull_rsi_required': True, 'bear_strategy': 'mean_reversion', 'bear_bb_std_mult': 1.7671974374361579, 'bear_rsi_os': 23, 'bear_rsi_ob': 75, 'bear_adx_thresh': 19.84236440381854, 'bear_atr_min_pct': 0.010893768210104508, 'bear_atr_max_pct': 0.11255423129296531, 'bear_tp_mult': 1.2048761268188017, 'bear_tsl_mult': 0.522998128806252, 'bear_time_stop': 233, 'bear_use_sma': False, 'bear_use_ema': True, 'bear_use_atr': False, 'bear_use_adx': True, 'bear_use_spike': False, 'bear_rsi_required': True, 'sideways_strategy': 'breakout', 'sideways_bb_std_mult': 1.792582524035626, 'sideways_rsi_os': 13, 'sideways_rsi_ob': 91, 'sideways_adx_thresh': 28.252152343923964, 'sideways_atr_min_pct': 0.02109677002027224, 'sideways_atr_max_pct': 0.04723153392373777, 'sideways_tp_mult': 1.7050988335292763, 'sideways_tsl_mult': 0.7713124259308972, 'sideways_time_stop': 219, 'sideways_use_sma': True, 'sideways_use_ema': False, 'sideways_use_atr': False, 'sideways_use_adx': True, 'sideways_use_spike': True, 'sideways_rsi_required': False}.
