[I 2025-08-30 21:49:35,462] Trial 495 finished with values: [-1000000000.0, 1000000000.0] and parameters: {'p_sma': 34, 'p_std': 35, 'p_atr': 22, 'p_adx': 21, 'rsi_period': 75, 'ema1': 13, 'ema2': 53, 'slip_atr_k': 0.05774344920621641, 'slip_spread_k': 0.35264988658063, 'spread_hl_frac': 0.048288133470871825, 'bb_std_mult': 0.8177824653242428, 'rsi_os': 41, 'rsi_ob': 66, 'vol_spike': 0.11780986927438176, 'adx_thresh': 9.497928421059626, 'atr_min_pct': 0.013283186002417407, 'atr_max_pct': 0.023497406187030744, 'tp_mult': 1.6927711876693583, 'tsl_mult': 0.9490469892956135, 'strategy': 'mean_reversion', 'time_stop': 92, 'use_sma': True, 'use_atr': True, 'use_adx': True, 'use_ema': True, 'use_spike': True, 'rsi_required': True, 'edge_k': 1.0473198260181678, 'edge_cap': 0.8781428671597223, 'bull_strategy': 'breakout', 'bull_bb_std_mult': 1.7044519071350017, 'bull_rsi_os': 52, 'bull_rsi_ob': 85, 'bull_adx_thresh': 14.414759555412395, 'bull_atr_min_pct': 0.001960893365290977, 'bull_atr_max_pct': 0.05345224716417261, 'bull_tp_mult': 1.388194857637327, 'bull_tsl_mult': 0.6883068725316489, 'bull_time_stop': 300, 'bull_use_sma': False, 'bull_use_ema': True, 'bull_use_atr': False, 'bull_use_adx': False, 'bull_use_spike': False, 'bull_rsi_required': True, 'bear_strategy': 'mean_reversion', 'bear_bb_std_mult': 2.065165609052773, 'bear_rsi_os': 11, 'bear_rsi_ob': 73, 'bear_adx_thresh': 27.9262029466487, 'bear_atr_min_pct': 0.029395465133080244, 'bear_atr_max_pct': 0.12664823629439495, 'bear_tp_mult': 1.5744494036003531, 'bear_tsl_mult': 0.36800246513228774, 'bear_time_stop': 231, 'bear_use_sma': False, 'bear_use_ema': True, 'bear_use_atr': False, 'bear_use_adx': True, 'bear_use_spike': True, 'bear_rsi_required': True, 'sideways_strategy': 'breakout', 'sideways_bb_std_mult': 1.7297865812982773, 'sideways_rsi_os': 40, 'sideways_rsi_ob': 89, 'sideways_adx_thresh': 27.469974870978113, 'sideways_atr_min_pct': 0.02099963930952042, 'sideways_atr_max_pct': 0.040126011148987936, 'sideways_tp_mult': 1.896037111504454, 'sideways_tsl_mult': 0.8731340317814986, 'sideways_time_stop': 93, 'sideways_use_sma': False, 'sideways_use_ema': False, 'sideways_use_atr': False, 'sideways_use_adx': True, 'sideways_use_spike': False, 'sideways_rsi_required': False}.
[I 2025-08-30 21:49:36,104] Trial 498 finished with values: [-1000000000.0, 1000000000.0] and parameters: {'p_sma': 35, 'p_std': 60, 'p_atr': 21, 'p_adx': 11, 'rsi_period': 35, 'ema1': 11, 'ema2': 17, 'slip_atr_k': 0.005996385554591668, 'slip_spread_k': 0.04238343388825189, 'spread_hl_frac': 0.030824008645382726, 'bb_std_mult': 0.7369360015339385, 'rsi_os': 51, 'rsi_ob': 66, 'vol_spike': 0.28567372090448256, 'adx_thresh': 10.10325033064547, 'atr_min_pct': 0.014034775411261895, 'atr_max_pct': 0.023172443544173846, 'tp_mult': 2.3835653243495094, 'tsl_mult': 0.13972113269205766, 'strategy': 'mean_reversion', 'time_stop': 93, 'use_sma': True, 'use_atr': True, 'use_adx': True, 'use_ema': False, 'use_spike': True, 'rsi_required': False, 'edge_k': 0.972800424158546, 'edge_cap': 0.7526155681004717, 'bull_strategy': 'breakout', 'bull_bb_std_mult': 1.5810297684093702, 'bull_rsi_os': 19, 'bull_rsi_ob': 59, 'bull_adx_thresh': 20.37295839762, 'bull_atr_min_pct': 0.0027420174769139626, 'bull_atr_max_pct': 0.05283953156699318, 'bull_tp_mult': 1.4317677090543486, 'bull_tsl_mult': 0.405067127502935, 'bull_time_stop': 294, 'bull_use_sma': True, 'bull_use_ema': False, 'bull_use_atr': False, 'bull_use_adx': False, 'bull_use_spike': False, 'bull_rsi_required': True, 'bear_strategy': 'mean_reversion', 'bear_bb_std_mult': 2.060879749040997, 'bear_rsi_os': 7, 'bear_rsi_ob': 73, 'bear_adx_thresh': 28.82182746402417, 'bear_atr_min_pct': 0.02944572012558764, 'bear_atr_max_pct': 0.10576529703968143, 'bear_tp_mult': 1.5501128156172321, 'bear_tsl_mult': 0.36542127342822, 'bear_time_stop': 221, 'bear_use_sma': False, 'bear_use_ema': True, 'bear_use_atr': False, 'bear_use_adx': True, 'bear_use_spike': True, 'bear_rsi_required': True, 'sideways_strategy': 'mean_reversion', 'sideways_bb_std_mult': 1.7062020721585884, 'sideways_rsi_os': 40, 'sideways_rsi_ob': 56, 'sideways_adx_thresh': 27.469423751050407, 'sideways_atr_min_pct': 0.020559593272416778, 'sideways_atr_max_pct': 0.03592349504925332, 'sideways_tp_mult': 1.3076067739315533, 'sideways_tsl_mult': 0.8164718951881499, 'sideways_time_stop': 263, 'sideways_use_sma': False, 'sideways_use_ema': False, 'sideways_use_atr': False, 'sideways_use_adx': True, 'sideways_use_spike': False, 'sideways_rsi_required': False}.
[I 2025-08-30 21:49:36,302] Trial 499 finished with values: [-1000000000.0, 1000000000.0] and parameters: {'p_sma': 35, 'p_std': 35, 'p_atr': 20, 'p_adx': 11, 'rsi_period': 9, 'ema1': 11, 'ema2': 17, 'slip_atr_k': 0.035184570864293774, 'slip_spread_k': 0.1024942315308297, 'spread_hl_frac': 0.01285446017748064, 'bb_std_mult': 0.7500707320269192, 'rsi_os': 53, 'rsi_ob': 65, 'vol_spike': 0.22925358192558565, 'adx_thresh': 10.319103360226261, 'atr_min_pct': 0.014309214435276872, 'atr_max_pct': 0.018117931963778106, 'tp_mult': 2.0055629556085717, 'tsl_mult': 0.6380350035624671, 'strategy': 'mean_reversion', 'time_stop': 95, 'use_sma': True, 'use_atr': True, 'use_adx': True, 'use_ema': False, 'use_spike': True, 'rsi_required': False, 'edge_k': 0.9710108136115952, 'edge_cap': 0.7660274195940916, 'bull_strategy': 'breakout', 'bull_bb_std_mult': 0.8774366079628995, 'bull_rsi_os': 41, 'bull_rsi_ob': 86, 'bull_adx_thresh': 20.017236363418206, 'bull_atr_min_pct': 0.006347842409604251, 'bull_atr_max_pct': 0.07735463402057277, 'bull_tp_mult': 1.4316328076310747, 'bull_tsl_mult': 0.39760951782828163, 'bull_time_stop': 295, 'bull_use_sma': True, 'bull_use_ema': False, 'bull_use_atr': False, 'bull_use_adx': False, 'bull_use_spike': False, 'bull_rsi_required': True, 'bear_strategy': 'mean_reversion', 'bear_bb_std_mult': 1.9385940651375788, 'bear_rsi_os': 7, 'bear_rsi_ob': 73, 'bear_adx_thresh': 28.526817531652977, 'bear_atr_min_pct': 0.010736554275572609, 'bear_atr_max_pct': 0.11480279128130864, 'bear_tp_mult': 1.9982857788766228, 'bear_tsl_mult': 0.3908156972930088, 'bear_time_stop': 218, 'bear_use_sma': False, 'bear_use_ema': True, 'bear_use_atr': False, 'bear_use_adx': True, 'bear_use_spike': True, 'bear_rsi_required': True, 'sideways_strategy': 'mean_reversion', 'sideways_bb_std_mult': 1.7194381720321426, 'sideways_rsi_os': 23, 'sideways_rsi_ob': 91, 'sideways_adx_thresh': 23.95257546060293, 'sideways_atr_min_pct': 0.020825223081473398, 'sideways_atr_max_pct': 0.07029531968419116, 'sideways_tp_mult': 1.5176265600147414, 'sideways_tsl_mult': 0.830990457288267, 'sideways_time_stop': 265, 'sideways_use_sma': False, 'sideways_use_ema': False, 'sideways_use_atr': False, 'sideways_use_adx': True, 'sideways_use_spike': False, 'sideways_rsi_required': False}.
[I 2025-08-30 21:50:04,332] Trial 496 finished with values: [-1000000000.0, 1000000000.0] and parameters: {'p_sma': 34, 'p_std': 51, 'p_atr': 27, 'p_adx': 16, 'rsi_period': 75, 'ema1': 12, 'ema2': 53, 'slip_atr_k': 0.11995873604197793, 'slip_spread_k': 0.3251310529473816, 'spread_hl_frac': 0.030891171211235535, 'bb_std_mult': 0.815596383119496, 'rsi_os': 10, 'rsi_ob': 66, 'vol_spike': 0.11710465169072753, 'adx_thresh': 9.364915405910656, 'atr_min_pct': 0.014192435799547785, 'atr_max_pct': 0.023959449399258106, 'tp_mult': 1.6959517130553345, 'tsl_mult': 0.3205511823190201, 'strategy': 'mean_reversion', 'time_stop': 91, 'use_sma': True, 'use_atr': True, 'use_adx': True, 'use_ema': True, 'use_spike': True, 'rsi_required': True, 'edge_k': 1.0396956063936806, 'edge_cap': 0.8176610551642225, 'bull_strategy': 'breakout', 'bull_bb_std_mult': 2.0630871959583263, 'bull_rsi_os': 19, 'bull_rsi_ob': 90, 'bull_adx_thresh': 14.561976863602151, 'bull_atr_min_pct': 0.006260054055611405, 'bull_atr_max_pct': 0.05371092011740606, 'bull_tp_mult': 1.3552026798213552, 'bull_tsl_mult': 0.8471814156653539, 'bull_time_stop': 300, 'bull_use_sma': False, 'bull_use_ema': True, 'bull_use_atr': False, 'bull_use_adx': False, 'bull_use_spike': False, 'bull_rsi_required': True, 'bear_strategy': 'mean_reversion', 'bear_bb_std_mult': 2.0576962732287303, 'bear_rsi_os': 9, 'bear_rsi_ob': 71, 'bear_adx_thresh': 27.85271652403859, 'bear_atr_min_pct': 0.0037994830447524754, 'bear_atr_max_pct': 0.10944026117012602, 'bear_tp_mult': 1.5784818117253017, 'bear_tsl_mult': 0.7338563479443678, 'bear_time_stop': 220, 'bear_use_sma': False, 'bear_use_ema': True, 'bear_use_atr': False, 'bear_use_adx': True, 'bear_use_spike': True, 'bear_rsi_required': True, 'sideways_strategy': 'breakout', 'sideways_bb_std_mult': 1.8208326438440532, 'sideways_rsi_os': 33, 'sideways_rsi_ob': 88, 'sideways_adx_thresh': 27.561474751158457, 'sideways_atr_min_pct': 0.0210487780506954, 'sideways_atr_max_pct': 0.04149677193296252, 'sideways_tp_mult': 1.9031552227248434, 'sideways_tsl_mult': 0.7462735224964049, 'sideways_time_stop': 70, 'sideways_use_sma': False, 'sideways_use_ema': False, 'sideways_use_atr': False, 'sideways_use_adx': True, 'sideways_use_spike': False, 'sideways_rsi_required': False}.
[I 2025-08-30 21:50:05,319] Trial 497 finished with values: [-1000000000.0, 1000000000.0] and parameters: {'p_sma': 35, 'p_std': 35, 'p_atr': 27, 'p_adx': 16, 'rsi_period': 35, 'ema1': 11, 'ema2': 53, 'slip_atr_k': 0.12282109828131721, 'slip_spread_k': 0.6928464355161219, 'spread_hl_frac': 0.03080715540599422, 'bb_std_mult': 0.726599045917501, 'rsi_os': 19, 'rsi_ob': 66, 'vol_spike': 0.08820138554300878, 'adx_thresh': 9.611305240966889, 'atr_min_pct': 0.014031302528388849, 'atr_max_pct': 0.022070907561641276, 'tp_mult': 1.6966448762372057, 'tsl_mult': 0.12872441259963446, 'strategy': 'mean_reversion', 'time_stop': 90, 'use_sma': True, 'use_atr': False, 'use_adx': False, 'use_ema': False, 'use_spike': False, 'rsi_required': False, 'edge_k': 0.9800360558213114, 'edge_cap': 0.8206360390199346, 'bull_strategy': 'breakout', 'bull_bb_std_mult': 2.041021592018271, 'bull_rsi_os': 33, 'bull_rsi_ob': 85, 'bull_adx_thresh': 20.37430626697979, 'bull_atr_min_pct': 0.022883124045695487, 'bull_atr_max_pct': 0.1146804707434538, 'bull_tp_mult': 1.3493190276898954, 'bull_tsl_mult': 0.6888034575428468, 'bull_time_stop': 300, 'bull_use_sma': True, 'bull_use_ema': False, 'bull_use_atr': False, 'bull_use_adx': False, 'bull_use_spike': False, 'bull_rsi_required': True, 'bear_strategy': 'mean_reversion', 'bear_bb_std_mult': 2.044619340052099, 'bear_rsi_os': 7, 'bear_rsi_ob': 71, 'bear_adx_thresh': 27.882565524997954, 'bear_atr_min_pct': 0.029412998272199124, 'bear_atr_max_pct': 0.115312110764321, 'bear_tp_mult': 1.5496685587667742, 'bear_tsl_mult': 0.36854293080614015, 'bear_time_stop': 230, 'bear_use_sma': False, 'bear_use_ema': True, 'bear_use_atr': False, 'bear_use_adx': False, 'bear_use_spike': False, 'bear_rsi_required': True, 'sideways_strategy': 'breakout', 'sideways_bb_std_mult': 1.7174570961175852, 'sideways_rsi_os': 40, 'sideways_rsi_ob': 91, 'sideways_adx_thresh': 6.838294386119715, 'sideways_atr_min_pct': 0.02100446854940579, 'sideways_atr_max_pct': 0.04014209926995397, 'sideways_tp_mult': 1.2073643227125537, 'sideways_tsl_mult': 0.8228792631467605, 'sideways_time_stop': 71, 'sideways_use_sma': False, 'sideways_use_ema': False, 'sideways_use_atr': False, 'sideways_use_adx': True, 'sideways_use_spike': True, 'sideways_rsi_required': False}.
[I 2025-08-30 21:50:09,118] Trial 500 finished with values: [-1000000000.0, 1000000000.0] and parameters: {'p_sma': 35, 'p_std': 35, 'p_atr': 20, 'p_adx': 21, 'rsi_period': 77, 'ema1': 12, 'ema2': 54, 'slip_atr_k': 0.03080328388713962, 'slip_spread_k': 0.6772162451739601, 'spread_hl_frac': 0.03227510453466155, 'bb_std_mult': 0.7352559985310659, 'rsi_os': 10, 'rsi_ob': 65, 'vol_spike': 0.27464981078820505, 'adx_thresh': 10.37055851278581, 'atr_min_pct': 0.011696201927306313, 'atr_max_pct': 0.01841951124723461, 'tp_mult': 1.5798131192327438, 'tsl_mult': 0.3255804925228188, 'strategy': 'mean_reversion', 'time_stop': 83, 'use_sma': True, 'use_atr': True, 'use_adx': True, 'use_ema': True, 'use_spike': True, 'rsi_required': True, 'edge_k': 1.8124696759469956, 'edge_cap': 0.8300617791901975, 'bull_strategy': 'mean_reversion', 'bull_bb_std_mult': 1.9737434840487533, 'bull_rsi_os': 5, 'bull_rsi_ob': 50, 'bull_adx_thresh': 32.347083260774035, 'bull_atr_min_pct': 0.00010396253225028983, 'bull_atr_max_pct': 0.03581926390108139, 'bull_tp_mult': 1.3440370972909716, 'bull_tsl_mult': 0.0791324718985767, 'bull_time_stop': 174, 'bull_use_sma': True, 'bull_use_ema': False, 'bull_use_atr': False, 'bull_use_adx': False, 'bull_use_spike': False, 'bull_rsi_required': True, 'bear_strategy': 'mean_reversion', 'bear_bb_std_mult': 1.7328757187948445, 'bear_rsi_os': 7, 'bear_rsi_ob': 72, 'bear_adx_thresh': 26.482280194781936, 'bear_atr_min_pct': 0.00811667985485853, 'bear_atr_max_pct': 0.11462240936908569, 'bear_tp_mult': 2.4202692943114856, 'bear_tsl_mult': 0.2924875950951869, 'bear_time_stop': 235, 'bear_use_sma': False, 'bear_use_ema': True, 'bear_use_atr': False, 'bear_use_adx': True, 'bear_use_spike': True, 'bear_rsi_required': True, 'sideways_strategy': 'breakout', 'sideways_bb_std_mult': 1.3462240158159147, 'sideways_rsi_os': 8, 'sideways_rsi_ob': 87, 'sideways_adx_thresh': 6.927204786738933, 'sideways_atr_min_pct': 0.021073300821025636, 'sideways_atr_max_pct': 0.053902485017585086, 'sideways_tp_mult': 1.629878843096053, 'sideways_tsl_mult': 0.7400087091205678, 'sideways_time_stop': 251, 'sideways_use_sma': False, 'sideways_use_ema': False, 'sideways_use_atr': False, 'sideways_use_adx': True, 'sideways_use_spike': False, 'sideways_rsi_required': False}.
[I 2025-08-30 21:50:10,379] Trial 501 finished with values: [-0.03831588849515433, 0.03824904976132383] and parameters: {'p_sma': 33, 'p_std': 15, 'p_atr': 21, 'p_adx': 16, 'rsi_period': 68, 'ema1': 9, 'ema2': 54, 'slip_atr_k': 0.14150711510183026, 'slip_spread_k': 0.8722942968964862, 'spread_hl_frac': 0.0322424154349316, 'bb_std_mult': 0.8570426176940876, 'rsi_os': 10, 'rsi_ob': 67, 'vol_spike': 0.049534072466751775, 'adx_thresh': 10.727509037947923, 'atr_min_pct': 0.013508531185077248, 'atr_max_pct': 0.02046321552333969, 'tp_mult': 1.5698618091999461, 'tsl_mult': 0.04410963904205112, 'strategy': 'mean_reversion', 'time_stop': 83, 'use_sma': True, 'use_atr': False, 'use_adx': False, 'use_ema': True, 'use_spike': False, 'rsi_required': True, 'edge_k': 1.0190712288076857, 'edge_cap': 0.8312583218986497, 'bull_strategy': 'mean_reversion', 'bull_bb_std_mult': 1.9801909357645553, 'bull_rsi_os': 17, 'bull_rsi_ob': 90, 'bull_adx_thresh': 11.566878460379368, 'bull_atr_min_pct': 0.00018023993088147976, 'bull_atr_max_pct': 0.14313239043707704, 'bull_tp_mult': 1.3448527681208, 'bull_tsl_mult': 0.8517834030587983, 'bull_time_stop': 248, 'bull_use_sma': True, 'bull_use_ema': False, 'bull_use_atr': True, 'bull_use_adx': False, 'bull_use_spike': False, 'bull_rsi_required': True, 'bear_strategy': 'mean_reversion', 'bear_bb_std_mult': 1.9978947769584139, 'bear_rsi_os': 8, 'bear_rsi_ob': 71, 'bear_adx_thresh': 26.75831903384258, 'bear_atr_min_pct': 0.007648698998382242, 'bear_atr_max_pct': 0.11294173390660688, 'bear_tp_mult': 1.5108594289191293, 'bear_tsl_mult': 0.3134653783266279, 'bear_time_stop': 235, 'bear_use_sma': False, 'bear_use_ema': True, 'bear_use_atr': False, 'bear_use_adx': False, 'bear_use_spike': False, 'bear_rsi_required': True, 'sideways_strategy': 'breakout', 'sideways_bb_std_mult': 1.6399778056073318, 'sideways_rsi_os': 13, 'sideways_rsi_ob': 87, 'sideways_adx_thresh': 26.352862574111455, 'sideways_atr_min_pct': 0.02109738487671433, 'sideways_atr_max_pct': 0.04265965492725475, 'sideways_tp_mult': 2.863765307734476, 'sideways_tsl_mult': 0.7452480316432755, 'sideways_time_stop': 234, 'sideways_use_sma': True, 'sideways_use_ema': False, 'sideways_use_atr': False, 'sideways_use_adx': True, 'sideways_use_spike': True, 'sideways_rsi_required': False}.
[I 2025-08-30 21:50:11,079] Trial 504 finished with values: [-1000000000.0, 1000000000.0] and parameters: {'p_sma': 33, 'p_std': 38, 'p_atr': 26, 'p_adx': 22, 'rsi_period': 73, 'ema1': 10, 'ema2': 55, 'slip_atr_k': 0.011599768481737521, 'slip_spread_k': 0.6239552512052927, 'spread_hl_frac': 0.032300776050940394, 'bb_std_mult': 0.8659600054842947, 'rsi_os': 14, 'rsi_ob': 67, 'vol_spike': 0.20103106066389828, 'adx_thresh': 34.52975961793145, 'atr_min_pct': 0.029275463858049217, 'atr_max_pct': 0.017310406695216593, 'tp_mult': 1.7722259389963249, 'tsl_mult': 0.2944498233335234, 'strategy': 'mean_reversion', 'time_stop': 83, 'use_sma': True, 'use_atr': True, 'use_adx': True, 'use_ema': True, 'use_spike': True, 'rsi_required': True, 'edge_k': 0.3829635182383917, 'edge_cap': 0.8484192892857259, 'bull_strategy': 'mean_reversion', 'bull_bb_std_mult': 1.8291864769178074, 'bull_rsi_os': 24, 'bull_rsi_ob': 90, 'bull_adx_thresh': 15.68420268148779, 'bull_atr_min_pct': 0.0015256794046222964, 'bull_atr_max_pct': 0.14327767554431836, 'bull_tp_mult': 1.9544565993139582, 'bull_tsl_mult': 0.37438087991525293, 'bull_time_stop': 251, 'bull_use_sma': True, 'bull_use_ema': False, 'bull_use_atr': True, 'bull_use_adx': False, 'bull_use_spike': False, 'bull_rsi_required': False, 'bear_strategy': 'mean_reversion', 'bear_bb_std_mult': 1.9839128037975433, 'bear_rsi_os': 5, 'bear_rsi_ob': 74, 'bear_adx_thresh': 26.823713764263044, 'bear_atr_min_pct': 0.02999464423351926, 'bear_atr_max_pct': 0.11146666164267408, 'bear_tp_mult': 1.5084859951211456, 'bear_tsl_mult': 0.40667201263869945, 'bear_time_stop': 237, 'bear_use_sma': False, 'bear_use_ema': True, 'bear_use_atr': True, 'bear_use_adx': True, 'bear_use_spike': False, 'bear_rsi_required': False, 'sideways_strategy': 'breakout', 'sideways_bb_std_mult': 1.6271729598055462, 'sideways_rsi_os': 39, 'sideways_rsi_ob': 71, 'sideways_adx_thresh': 25.540229292406575, 'sideways_atr_min_pct': 0.02019956323722252, 'sideways_atr_max_pct': 0.04912918753479257, 'sideways_tp_mult': 1.4499127193572632, 'sideways_tsl_mult': 0.7535099173073454, 'sideways_time_stop': 241, 'sideways_use_sma': True, 'sideways_use_ema': False, 'sideways_use_atr': False, 'sideways_use_adx': True, 'sideways_use_spike': False, 'sideways_rsi_required': False}.
[I 2025-08-30 21:50:40,735] Trial 503 finished with values: [-0.019948917474234995, 0.01985161743765829] and parameters: {'p_sma': 33, 'p_std': 37, 'p_atr': 22, 'p_adx': 10, 'rsi_period': 66, 'ema1': 12, 'ema2': 54, 'slip_atr_k': 0.02644057694515593, 'slip_spread_k': 0.9930196197886063, 'spread_hl_frac': 0.032086943301461425, 'bb_std_mult': 0.8674206806585414, 'rsi_os': 10, 'rsi_ob': 65, 'vol_spike': 0.10561498288899342, 'adx_thresh': 27.008106564599544, 'atr_min_pct': 0.011459376050961857, 'atr_max_pct': 0.017595737822441008, 'tp_mult': 1.5838066740785561, 'tsl_mult': 0.29117135130386984, 'strategy': 'mean_reversion', 'time_stop': 86, 'use_sma': True, 'use_atr': True, 'use_adx': True, 'use_ema': True, 'use_spike': True, 'rsi_required': True, 'edge_k': 1.1406243804013332, 'edge_cap': 0.844021183805053, 'bull_strategy': 'mean_reversion', 'bull_bb_std_mult': 1.9557108814442221, 'bull_rsi_os': 9, 'bull_rsi_ob': 48, 'bull_adx_thresh': 18.557412134371425, 'bull_atr_min_pct': 0.00018806769239833277, 'bull_atr_max_pct': 0.04912695787105721, 'bull_tp_mult': 1.3997534354972703, 'bull_tsl_mult': 0.37448499371150074, 'bull_time_stop': 35, 'bull_use_sma': True, 'bull_use_ema': False, 'bull_use_atr': True, 'bull_use_adx': False, 'bull_use_spike': False, 'bull_rsi_required': False, 'bear_strategy': 'mean_reversion', 'bear_bb_std_mult': 1.9163202753664752, 'bear_rsi_os': 8, 'bear_rsi_ob': 63, 'bear_adx_thresh': 26.63830817260501, 'bear_atr_min_pct': 0.029932204111904042, 'bear_atr_max_pct': 0.11270784212432623, 'bear_tp_mult': 2.113831213326655, 'bear_tsl_mult': 0.3214862314857131, 'bear_time_stop': 237, 'bear_use_sma': False, 'bear_use_ema': True, 'bear_use_atr': True, 'bear_use_adx': True, 'bear_use_spike': True, 'bear_rsi_required': False, 'sideways_strategy': 'breakout', 'sideways_bb_std_mult': 1.635674590594004, 'sideways_rsi_os': 39, 'sideways_rsi_ob': 87, 'sideways_adx_thresh': 25.630530123681314, 'sideways_atr_min_pct': 0.020313463293156885, 'sideways_atr_max_pct': 0.0477698395221666, 'sideways_tp_mult': 1.63139910294163, 'sideways_tsl_mult': 0.7483890248354137, 'sideways_time_stop': 251, 'sideways_use_sma': True, 'sideways_use_ema': False, 'sideways_use_atr': False, 'sideways_use_adx': True, 'sideways_use_spike': False, 'sideways_rsi_required': False}.
