[I 2025-08-30 21:18:13,342] Trial 245 finished with values: [-0.017404848601793255, 0.017338160902826732] and parameters: {'p_sma': 29, 'p_std': 32, 'p_atr': 15, 'p_adx': 30, 'rsi_period': 20, 'ema1': 24, 'ema2': 47, 'slip_atr_k': 0.09249082802689361, 'slip_spread_k': 0.5311851617402187, 'spread_hl_frac': 0.0027747213884155198, 'bb_std_mult': 1.6450506542127388, 'rsi_os': 11, 'rsi_ob': 82, 'vol_spike': 0.28935250600065926, 'adx_thresh': 31.068902406064943, 'atr_min_pct': 0.019677023879784466, 'atr_max_pct': 0.08634416023042096, 'tp_mult': 1.6703330319171663, 'tsl_mult': 0.9111695911552765, 'strategy': 'mean_reversion', 'time_stop': 150, 'use_sma': False, 'use_atr': True, 'use_adx': True, 'use_ema': True, 'use_spike': True, 'rsi_required': True, 'edge_k': 0.7556597148600879, 'edge_cap': 0.5855239009768199, 'bull_strategy': 'breakout', 'bull_bb_std_mult': 2.1157809085481882, 'bull_rsi_os': 19, 'bull_rsi_ob': 71, 'bull_adx_thresh': 15.224257920140714, 'bull_atr_min_pct': 0.0004559453551403191, 'bull_atr_max_pct': 0.057160604897595155, 'bull_tp_mult': 2.187843198468158, 'bull_tsl_mult': 0.3905793321104757, 'bull_time_stop': 232, 'bull_use_sma': True, 'bull_use_ema': False, 'bull_use_atr': False, 'bull_use_adx': False, 'bull_use_spike': True, 'bull_rsi_required': True, 'bear_strategy': 'mean_reversion', 'bear_bb_std_mult': 2.6702522271407583, 'bear_rsi_os': 38, 'bear_rsi_ob': 55, 'bear_adx_thresh': 14.940146429631694, 'bear_atr_min_pct': 0.015513283933483191, 'bear_atr_max_pct': 0.014340282299519636, 'bear_tp_mult': 2.839494950281668, 'bear_tsl_mult': 0.43549222921812974, 'bear_time_stop': 125, 'bear_use_sma': True, 'bear_use_ema': False, 'bear_use_atr': False, 'bear_use_adx': True, 'bear_use_spike': True, 'bear_rsi_required': True, 'sideways_strategy': 'breakout', 'sideways_bb_std_mult': 1.6088969269885331, 'sideways_rsi_os': 41, 'sideways_rsi_ob': 89, 'sideways_adx_thresh': 26.55131860662969, 'sideways_atr_min_pct': 0.013231589959866764, 'sideways_atr_max_pct': 0.09484737247572768, 'sideways_tp_mult': 2.285951294344935, 'sideways_tsl_mult': 0.49750944964191474, 'sideways_time_stop': 248, 'sideways_use_sma': False, 'sideways_use_ema': True, 'sideways_use_atr': True, 'sideways_use_adx': False, 'sideways_use_spike': False, 'sideways_rsi_required': True}.
[I 2025-08-30 21:18:13,474] Trial 242 finished with values: [-1000000000.0, 1000000000.0] and parameters: {'p_sma': 13, 'p_std': 31, 'p_atr': 15, 'p_adx': 30, 'rsi_period': 21, 'ema1': 23, 'ema2': 46, 'slip_atr_k': 0.025059250100440272, 'slip_spread_k': 0.5564750260703953, 'spread_hl_frac': 0.0030911436646600793, 'bb_std_mult': 1.8961207327331242, 'rsi_os': 9, 'rsi_ob': 81, 'vol_spike': 0.29766193850568956, 'adx_thresh': 30.14904833946103, 'atr_min_pct': 0.02157874600559211, 'atr_max_pct': 0.08709692592462695, 'tp_mult': 1.6614212411738816, 'tsl_mult': 0.9261518257085162, 'strategy': 'breakout', 'time_stop': 85, 'use_sma': False, 'use_atr': True, 'use_adx': False, 'use_ema': True, 'use_spike': False, 'rsi_required': False, 'edge_k': 0.7697057913461085, 'edge_cap': 0.5792696280092773, 'bull_strategy': 'mean_reversion', 'bull_bb_std_mult': 3.3392362707371417, 'bull_rsi_os': 16, 'bull_rsi_ob': 84, 'bull_adx_thresh': 15.788473182784426, 'bull_atr_min_pct': 0.0012574906988802874, 'bull_atr_max_pct': 0.057324291609293095, 'bull_tp_mult': 2.3029326435252067, 'bull_tsl_mult': 0.4295200249973304, 'bull_time_stop': 116, 'bull_use_sma': False, 'bull_use_ema': True, 'bull_use_atr': True, 'bull_use_adx': True, 'bull_use_spike': True, 'bull_rsi_required': False, 'bear_strategy': 'breakout', 'bear_bb_std_mult': 2.5720834437054143, 'bear_rsi_os': 39, 'bear_rsi_ob': 54, 'bear_adx_thresh': 13.8037539950447, 'bear_atr_min_pct': 0.015385526728891794, 'bear_atr_max_pct': 0.014660736536725904, 'bear_tp_mult': 2.787013577139137, 'bear_tsl_mult': 0.44222130712774144, 'bear_time_stop': 128, 'bear_use_sma': True, 'bear_use_ema': False, 'bear_use_atr': True, 'bear_use_adx': True, 'bear_use_spike': False, 'bear_rsi_required': False, 'sideways_strategy': 'mean_reversion', 'sideways_bb_std_mult': 1.6119694957392559, 'sideways_rsi_os': 42, 'sideways_rsi_ob': 92, 'sideways_adx_thresh': 28.233612575353014, 'sideways_atr_min_pct': 0.01419282511417464, 'sideways_atr_max_pct': 0.09566111372100296, 'sideways_tp_mult': 2.0131224583099994, 'sideways_tsl_mult': 0.46577209498479893, 'sideways_time_stop': 258, 'sideways_use_sma': True, 'sideways_use_ema': True, 'sideways_use_atr': True, 'sideways_use_adx': False, 'sideways_use_spike': True, 'sideways_rsi_required': True}.
[I 2025-08-30 21:18:13,651] Trial 243 finished with values: [-1000000000.0, 1000000000.0] and parameters: {'p_sma': 31, 'p_std': 32, 'p_atr': 15, 'p_adx': 30, 'rsi_period': 21, 'ema1': 24, 'ema2': 45, 'slip_atr_k': 0.15523136738322177, 'slip_spread_k': 0.5949143190756141, 'spread_hl_frac': 0.0031911065122280664, 'bb_std_mult': 2.746767780220075, 'rsi_os': 10, 'rsi_ob': 81, 'vol_spike': 0.29256255307276857, 'adx_thresh': 30.004594982786234, 'atr_min_pct': 0.019506170214790397, 'atr_max_pct': 0.08629680224548872, 'tp_mult': 1.6569741079408669, 'tsl_mult': 0.9491195537049752, 'strategy': 'mean_reversion', 'time_stop': 100, 'use_sma': False, 'use_atr': True, 'use_adx': True, 'use_ema': True, 'use_spike': True, 'rsi_required': True, 'edge_k': 0.7720044323165365, 'edge_cap': 0.5754293258582663, 'bull_strategy': 'breakout', 'bull_bb_std_mult': 3.3564742065861313, 'bull_rsi_os': 23, 'bull_rsi_ob': 70, 'bull_adx_thresh': 15.365598682109058, 'bull_atr_min_pct': 0.0011051973820026127, 'bull_atr_max_pct': 0.055061928616340405, 'bull_tp_mult': 2.1866579561476236, 'bull_tsl_mult': 0.38882607553622667, 'bull_time_stop': 114, 'bull_use_sma': False, 'bull_use_ema': False, 'bull_use_atr': False, 'bull_use_adx': True, 'bull_use_spike': True, 'bull_rsi_required': True, 'bear_strategy': 'mean_reversion', 'bear_bb_std_mult': 2.6263669766518696, 'bear_rsi_os': 39, 'bear_rsi_ob': 54, 'bear_adx_thresh': 25.07416426690691, 'bear_atr_min_pct': 0.014664148573644026, 'bear_atr_max_pct': 0.013067185237288396, 'bear_tp_mult': 2.8381984281395165, 'bear_tsl_mult': 0.4358135616108173, 'bear_time_stop': 127, 'bear_use_sma': True, 'bear_use_ema': False, 'bear_use_atr': False, 'bear_use_adx': True, 'bear_use_spike': True, 'bear_rsi_required': True, 'sideways_strategy': 'breakout', 'sideways_bb_std_mult': 1.5856174437189414, 'sideways_rsi_os': 42, 'sideways_rsi_ob': 89, 'sideways_adx_thresh': 26.70171443130361, 'sideways_atr_min_pct': 0.014687644067778777, 'sideways_atr_max_pct': 0.09450201109078682, 'sideways_tp_mult': 1.9364114971718955, 'sideways_tsl_mult': 0.44116380150839557, 'sideways_time_stop': 262, 'sideways_use_sma': True, 'sideways_use_ema': True, 'sideways_use_atr': True, 'sideways_use_adx': False, 'sideways_use_spike': True, 'sideways_rsi_required': True}.
[I 2025-08-30 21:18:46,110] Trial 249 finished with values: [-1000000000.0, 1000000000.0] and parameters: {'p_sma': 29, 'p_std': 33, 'p_atr': 16, 'p_adx': 30, 'rsi_period': 19, 'ema1': 22, 'ema2': 45, 'slip_atr_k': 0.1036941536516474, 'slip_spread_k': 0.524706692872118, 'spread_hl_frac': 0.018514146071791967, 'bb_std_mult': 1.5060522939177658, 'rsi_os': 12, 'rsi_ob': 80, 'vol_spike': 0.2907505015830237, 'adx_thresh': 31.046310922027395, 'atr_min_pct': 0.020210211439576273, 'atr_max_pct': 0.08401215286462609, 'tp_mult': 1.7323007628075133, 'tsl_mult': 0.9142236666726508, 'strategy': 'mean_reversion', 'time_stop': 78, 'use_sma': False, 'use_atr': False, 'use_adx': True, 'use_ema': False, 'use_spike': True, 'rsi_required': True, 'edge_k': 1.6696323490946559, 'edge_cap': 0.637633751445742, 'bull_strategy': 'breakout', 'bull_bb_std_mult': 3.2538979099147514, 'bull_rsi_os': 53, 'bull_rsi_ob': 71, 'bull_adx_thresh': 16.488114951952056, 'bull_atr_min_pct': 0.00036096165148632753, 'bull_atr_max_pct': 0.056988720482727274, 'bull_tp_mult': 2.270861558536206, 'bull_tsl_mult': 0.4086200486665969, 'bull_time_stop': 291, 'bull_use_sma': True, 'bull_use_ema': False, 'bull_use_atr': False, 'bull_use_adx': False, 'bull_use_spike': False, 'bull_rsi_required': True, 'bear_strategy': 'mean_reversion', 'bear_bb_std_mult': 2.6972922616432013, 'bear_rsi_os': 37, 'bear_rsi_ob': 52, 'bear_adx_thresh': 5.439852631415196, 'bear_atr_min_pct': 0.0154846956294763, 'bear_atr_max_pct': 0.011343647953584909, 'bear_tp_mult': 2.8624046628216804, 'bear_tsl_mult': 0.4192328532389276, 'bear_time_stop': 66, 'bear_use_sma': False, 'bear_use_ema': False, 'bear_use_atr': False, 'bear_use_adx': False, 'bear_use_spike': True, 'bear_rsi_required': True, 'sideways_strategy': 'breakout', 'sideways_bb_std_mult': 1.7593475572884507, 'sideways_rsi_os': 41, 'sideways_rsi_ob': 94, 'sideways_adx_thresh': 27.58456142956876, 'sideways_atr_min_pct': 0.015915431580550077, 'sideways_atr_max_pct': 0.09900143666888436, 'sideways_tp_mult': 1.8612236831692952, 'sideways_tsl_mult': 0.5172449601724337, 'sideways_time_stop': 249, 'sideways_use_sma': False, 'sideways_use_ema': False, 'sideways_use_atr': False, 'sideways_use_adx': True, 'sideways_use_spike': False, 'sideways_rsi_required': False}.
[I 2025-08-30 21:18:46,376] Trial 248 finished with values: [-1000000000.0, 1000000000.0] and parameters: {'p_sma': 29, 'p_std': 33, 'p_atr': 16, 'p_adx': 30, 'rsi_period': 19, 'ema1': 22, 'ema2': 45, 'slip_atr_k': 0.026761936313052515, 'slip_spread_k': 0.593823085196213, 'spread_hl_frac': 0.006015535976911264, 'bb_std_mult': 1.6132159592862167, 'rsi_os': 12, 'rsi_ob': 82, 'vol_spike': 0.28897295526741557, 'adx_thresh': 31.109906595000922, 'atr_min_pct': 0.019873806253195445, 'atr_max_pct': 0.08380492133586681, 'tp_mult': 1.6182477028395965, 'tsl_mult': 0.9048720305039841, 'strategy': 'mean_reversion', 'time_stop': 148, 'use_sma': False, 'use_atr': False, 'use_adx': True, 'use_ema': False, 'use_spike': True, 'rsi_required': True, 'edge_k': 0.7606495039522672, 'edge_cap': 0.6364320713861148, 'bull_strategy': 'breakout', 'bull_bb_std_mult': 3.1877907715786478, 'bull_rsi_os': 23, 'bull_rsi_ob': 71, 'bull_adx_thresh': 15.450108429272877, 'bull_atr_min_pct': 0.008478683066843826, 'bull_atr_max_pct': 0.05591586039901095, 'bull_tp_mult': 2.2464874304767255, 'bull_tsl_mult': 0.39147377052921295, 'bull_time_stop': 283, 'bull_use_sma': True, 'bull_use_ema': False, 'bull_use_atr': False, 'bull_use_adx': False, 'bull_use_spike': False, 'bull_rsi_required': True, 'bear_strategy': 'mean_reversion', 'bear_bb_std_mult': 2.686605466532583, 'bear_rsi_os': 37, 'bear_rsi_ob': 52, 'bear_adx_thresh': 15.958700255513504, 'bear_atr_min_pct': 0.015893812960849775, 'bear_atr_max_pct': 0.01248614036973891, 'bear_tp_mult': 2.847720613542794, 'bear_tsl_mult': 0.4254190083319829, 'bear_time_stop': 265, 'bear_use_sma': False, 'bear_use_ema': False, 'bear_use_atr': False, 'bear_use_adx': False, 'bear_use_spike': True, 'bear_rsi_required': True, 'sideways_strategy': 'breakout', 'sideways_bb_std_mult': 1.6880328972852385, 'sideways_rsi_os': 41, 'sideways_rsi_ob': 94, 'sideways_adx_thresh': 27.436668314050607, 'sideways_atr_min_pct': 0.015464269622465556, 'sideways_atr_max_pct': 0.10106533356568179, 'sideways_tp_mult': 1.9464582935986483, 'sideways_tsl_mult': 0.4287465466904185, 'sideways_time_stop': 247, 'sideways_use_sma': False, 'sideways_use_ema': False, 'sideways_use_atr': False, 'sideways_use_adx': True, 'sideways_use_spike': False, 'sideways_rsi_required': False}.
[I 2025-08-30 21:18:46,522] Trial 246 finished with values: [-1000000000.0, 1000000000.0] and parameters: {'p_sma': 31, 'p_std': 33, 'p_atr': 16, 'p_adx': 30, 'rsi_period': 20, 'ema1': 25, 'ema2': 45, 'slip_atr_k': 0.02548664031822236, 'slip_spread_k': 0.6031571437901093, 'spread_hl_frac': 0.02070997723231518, 'bb_std_mult': 1.631692748040347, 'rsi_os': 12, 'rsi_ob': 80, 'vol_spike': 0.29923379927216615, 'adx_thresh': 31.640037414055058, 'atr_min_pct': 0.019767688626116064, 'atr_max_pct': 0.08627575482602397, 'tp_mult': 1.6212288502091523, 'tsl_mult': 0.9076795179184263, 'strategy': 'mean_reversion', 'time_stop': 86, 'use_sma': False, 'use_atr': False, 'use_adx': True, 'use_ema': False, 'use_spike': True, 'rsi_required': True, 'edge_k': 0.7605017531669518, 'edge_cap': 0.5849083209268797, 'bull_strategy': 'breakout', 'bull_bb_std_mult': 3.400364205127152, 'bull_rsi_os': 53, 'bull_rsi_ob': 71, 'bull_adx_thresh': 16.516079093966233, 'bull_atr_min_pct': 0.0005082622258915622, 'bull_atr_max_pct': 0.0568215534710548, 'bull_tp_mult': 2.159516199619139, 'bull_tsl_mult': 0.37319258650501597, 'bull_time_stop': 112, 'bull_use_sma': True, 'bull_use_ema': False, 'bull_use_atr': False, 'bull_use_adx': False, 'bull_use_spike': False, 'bull_rsi_required': True, 'bear_strategy': 'mean_reversion', 'bear_bb_std_mult': 1.9267169155502475, 'bear_rsi_os': 40, 'bear_rsi_ob': 52, 'bear_adx_thresh': 15.783086158132118, 'bear_atr_min_pct': 0.015573303834589505, 'bear_atr_max_pct': 0.01267803650959799, 'bear_tp_mult': 2.852301031051205, 'bear_tsl_mult': 0.4674989613974399, 'bear_time_stop': 112, 'bear_use_sma': False, 'bear_use_ema': False, 'bear_use_atr': False, 'bear_use_adx': False, 'bear_use_spike': True, 'bear_rsi_required': True, 'sideways_strategy': 'breakout', 'sideways_bb_std_mult': 1.80860778267666, 'sideways_rsi_os': 41, 'sideways_rsi_ob': 94, 'sideways_adx_thresh': 27.64044872703633, 'sideways_atr_min_pct': 0.015634582683377318, 'sideways_atr_max_pct': 0.09409187443978578, 'sideways_tp_mult': 1.8707265478748274, 'sideways_tsl_mult': 0.4224409352655608, 'sideways_time_stop': 248, 'sideways_use_sma': False, 'sideways_use_ema': False, 'sideways_use_atr': False, 'sideways_use_adx': True, 'sideways_use_spike': False, 'sideways_rsi_required': False}.
[I 2025-08-30 21:18:46,611] Trial 247 finished with values: [-1000000000.0, 1000000000.0] and parameters: {'p_sma': 60, 'p_std': 33, 'p_atr': 16, 'p_adx': 30, 'rsi_period': 19, 'ema1': 22, 'ema2': 45, 'slip_atr_k': 0.10652063774803072, 'slip_spread_k': 0.5937166276593173, 'spread_hl_frac': 0.01882235985729192, 'bb_std_mult': 1.506500947578185, 'rsi_os': 12, 'rsi_ob': 82, 'vol_spike': 0.28925416479792604, 'adx_thresh': 30.976330376083546, 'atr_min_pct': 0.01995836562856425, 'atr_max_pct': 0.08261828970215118, 'tp_mult': 2.107008862697131, 'tsl_mult': 0.9084873454355127, 'strategy': 'mean_reversion', 'time_stop': 153, 'use_sma': False, 'use_atr': False, 'use_adx': True, 'use_ema': False, 'use_spike': True, 'rsi_required': True, 'edge_k': 1.6674429902975245, 'edge_cap': 0.6290517504914387, 'bull_strategy': 'breakout', 'bull_bb_std_mult': 3.146019829974306, 'bull_rsi_os': 19, 'bull_rsi_ob': 70, 'bull_adx_thresh': 15.081857357886724, 'bull_atr_min_pct': 0.0004962384847079486, 'bull_atr_max_pct': 0.05490280169475418, 'bull_tp_mult': 2.2660409669214836, 'bull_tsl_mult': 0.3924042856753464, 'bull_time_stop': 284, 'bull_use_sma': True, 'bull_use_ema': False, 'bull_use_atr': False, 'bull_use_adx': False, 'bull_use_spike': False, 'bull_rsi_required': True, 'bear_strategy': 'mean_reversion', 'bear_bb_std_mult': 2.69388992252064, 'bear_rsi_os': 37, 'bear_rsi_ob': 52, 'bear_adx_thresh': 15.936506494482717, 'bear_atr_min_pct': 0.015699480978230707, 'bear_atr_max_pct': 0.011916134612131627, 'bear_tp_mult': 2.8579059239470608, 'bear_tsl_mult': 0.4235531102207185, 'bear_time_stop': 26, 'bear_use_sma': False, 'bear_use_ema': False, 'bear_use_atr': False, 'bear_use_adx': False, 'bear_use_spike': True, 'bear_rsi_required': True, 'sideways_strategy': 'breakout', 'sideways_bb_std_mult': 1.696351834911847, 'sideways_rsi_os': 41, 'sideways_rsi_ob': 94, 'sideways_adx_thresh': 27.558687289396328, 'sideways_atr_min_pct': 0.015731370138682574, 'sideways_atr_max_pct': 0.09378623216183223, 'sideways_tp_mult': 1.8440472279774829, 'sideways_tsl_mult': 0.4342099485950162, 'sideways_time_stop': 250, 'sideways_use_sma': False, 'sideways_use_ema': False, 'sideways_use_atr': False, 'sideways_use_adx': True, 'sideways_use_spike': False, 'sideways_rsi_required': False}.
[I 2025-08-30 21:19:21,506] Trial 250 finished with values: [-1000000000.0, 1000000000.0] and parameters: {'p_sma': 53, 'p_std': 33, 'p_atr': 16, 'p_adx': 30, 'rsi_period': 54, 'ema1': 22, 'ema2': 15, 'slip_atr_k': 0.02721341544587954, 'slip_spread_k': 0.5378544933368792, 'spread_hl_frac': 0.037323496967538776, 'bb_std_mult': 1.6005730168212209, 'rsi_os': 8, 'rsi_ob': 82, 'vol_spike': 0.29976042267015823, 'adx_thresh': 29.021242010034726, 'atr_min_pct': 0.01990797478645068, 'atr_max_pct': 0.0895905547112417, 'tp_mult': 2.1675458230862468, 'tsl_mult': 0.9124258346512308, 'strategy': 'mean_reversion', 'time_stop': 154, 'use_sma': False, 'use_atr': False, 'use_adx': True, 'use_ema': False, 'use_spike': True, 'rsi_required': True, 'edge_k': 0.7476685733804043, 'edge_cap': 0.6194212061055028, 'bull_strategy': 'breakout', 'bull_bb_std_mult': 3.199742028504028, 'bull_rsi_os': 38, 'bull_rsi_ob': 49, 'bull_adx_thresh': 15.094460766767167, 'bull_atr_min_pct': 0.0019273145728290178, 'bull_atr_max_pct': 0.0774324512004274, 'bull_tp_mult': 2.3747819093670253, 'bull_tsl_mult': 0.3785780509787227, 'bull_time_stop': 282, 'bull_use_sma': True, 'bull_use_ema': False, 'bull_use_atr': False, 'bull_use_adx': False, 'bull_use_spike': False, 'bull_rsi_required': True, 'bear_strategy': 'mean_reversion', 'bear_bb_std_mult': 3.225696357568128, 'bear_rsi_os': 40, 'bear_rsi_ob': 52, 'bear_adx_thresh': 14.76100109946167, 'bear_atr_min_pct': 0.01571998407731959, 'bear_atr_max_pct': 0.01563651979377794, 'bear_tp_mult': 2.880118259077708, 'bear_tsl_mult': 0.46081530188538683, 'bear_time_stop': 170, 'bear_use_sma': False, 'bear_use_ema': True, 'bear_use_atr': False, 'bear_use_adx': False, 'bear_use_spike': True, 'bear_rsi_required': True, 'sideways_strategy': 'breakout', 'sideways_bb_std_mult': 1.678921032759239, 'sideways_rsi_os': 41, 'sideways_rsi_ob': 94, 'sideways_adx_thresh': 27.074545266031436, 'sideways_atr_min_pct': 0.015547242302618745, 'sideways_atr_max_pct': 0.10153472137118905, 'sideways_tp_mult': 2.275553577727746, 'sideways_tsl_mult': 0.42687581346237774, 'sideways_time_stop': 250, 'sideways_use_sma': False, 'sideways_use_ema': False, 'sideways_use_atr': False, 'sideways_use_adx': True, 'sideways_use_spike': False, 'sideways_rsi_required': False}.
[I 2025-08-30 21:19:21,954] Trial 253 finished with values: [-1000000000.0, 1000000000.0] and parameters: {'p_sma': 53, 'p_std': 25, 'p_atr': 14, 'p_adx': 30, 'rsi_period': 23, 'ema1': 22, 'ema2': 14, 'slip_atr_k': 0.24396414665241184, 'slip_spread_k': 0.5432415481366473, 'spread_hl_frac': 0.03728802524041178, 'bb_std_mult': 0.6282664901047041, 'rsi_os': 8, 'rsi_ob': 80, 'vol_spike': 0.29873116595536214, 'adx_thresh': 29.283454365186966, 'atr_min_pct': 0.020808106418108745, 'atr_max_pct': 0.09085069094622565, 'tp_mult': 2.1819426995176694, 'tsl_mult': 0.8962596589963778, 'strategy': 'mean_reversion', 'time_stop': 129, 'use_sma': True, 'use_atr': True, 'use_adx': True, 'use_ema': True, 'use_spike': True, 'rsi_required': True, 'edge_k': 0.7156810926664551, 'edge_cap': 0.6153281741000112, 'bull_strategy': 'breakout', 'bull_bb_std_mult': 3.2087582342382874, 'bull_rsi_os': 29, 'bull_rsi_ob': 68, 'bull_adx_thresh': 7.114237784689465, 'bull_atr_min_pct': 0.01036811355694811, 'bull_atr_max_pct': 0.053051164834548095, 'bull_tp_mult': 2.3850668990451998, 'bull_tsl_mult': 0.46612010075198623, 'bull_time_stop': 34, 'bull_use_sma': True, 'bull_use_ema': False, 'bull_use_atr': False, 'bull_use_adx': True, 'bull_use_spike': True, 'bull_rsi_required': True, 'bear_strategy': 'mean_reversion', 'bear_bb_std_mult': 2.3467899295869588, 'bear_rsi_os': 40, 'bear_rsi_ob': 77, 'bear_adx_thresh': 15.15210262204861, 'bear_atr_min_pct': 0.013957108897447437, 'bear_atr_max_pct': 0.01581150194538548, 'bear_tp_mult': 2.8820077363751873, 'bear_tsl_mult': 0.449667005545553, 'bear_time_stop': 7, 'bear_use_sma': True, 'bear_use_ema': True, 'bear_use_atr': False, 'bear_use_adx': True, 'bear_use_spike': True, 'bear_rsi_required': True, 'sideways_strategy': 'breakout', 'sideways_bb_std_mult': 1.5420660920653337, 'sideways_rsi_os': 40, 'sideways_rsi_ob': 91, 'sideways_adx_thresh': 26.49741830885035, 'sideways_atr_min_pct': 0.01330996161981234, 'sideways_atr_max_pct': 0.08846083893810185, 'sideways_tp_mult': 2.1933491509900938, 'sideways_tsl_mult': 0.48731612121602463, 'sideways_time_stop': 270, 'sideways_use_sma': False, 'sideways_use_ema': True, 'sideways_use_atr': True, 'sideways_use_adx': False, 'sideways_use_spike': False, 'sideways_rsi_required': True}.
