[I 2025-08-30 21:46:37,664] Trial 468 finished with values: [-1000000000.0, 1000000000.0] and parameters: {'p_sma': 33, 'p_std': 17, 'p_atr': 11, 'p_adx': 20, 'rsi_period': 32, 'ema1': 11, 'ema2': 55, 'slip_atr_k': 0.026689688448388506, 'slip_spread_k': 0.6400623931824685, 'spread_hl_frac': 0.01792779639618709, 'bb_std_mult': 0.8818035799471262, 'rsi_os': 49, 'rsi_ob': 70, 'vol_spike': 0.2794629350185789, 'adx_thresh': 11.719219724096812, 'atr_min_pct': 0.011810271972823186, 'atr_max_pct': 0.04363195194982453, 'tp_mult': 1.825975363663019, 'tsl_mult': 0.2604004544757509, 'strategy': 'breakout', 'time_stop': 79, 'use_sma': True, 'use_atr': True, 'use_adx': True, 'use_ema': False, 'use_spike': True, 'rsi_required': True, 'edge_k': 0.8470057106932409, 'edge_cap': 0.7893796904374244, 'bull_strategy': 'breakout', 'bull_bb_std_mult': 2.020533338102565, 'bull_rsi_os': 43, 'bull_rsi_ob': 86, 'bull_adx_thresh': 14.21128928007174, 'bull_atr_min_pct': 0.02803956012195339, 'bull_atr_max_pct': 0.05287835368369924, 'bull_tp_mult': 1.4707387052605136, 'bull_tsl_mult': 0.4258308559122006, 'bull_time_stop': 138, 'bull_use_sma': True, 'bull_use_ema': False, 'bull_use_atr': True, 'bull_use_adx': False, 'bull_use_spike': False, 'bull_rsi_required': True, 'bear_strategy': 'mean_reversion', 'bear_bb_std_mult': 1.8751261596490747, 'bear_rsi_os': 5, 'bear_rsi_ob': 72, 'bear_adx_thresh': 28.375486335228803, 'bear_atr_min_pct': 0.02110101234258606, 'bear_atr_max_pct': 0.1075611748505029, 'bear_tp_mult': 2.164010403271541, 'bear_tsl_mult': 0.3467310100517523, 'bear_time_stop': 234, 'bear_use_sma': False, 'bear_use_ema': True, 'bear_use_atr': True, 'bear_use_adx': True, 'bear_use_spike': True, 'bear_rsi_required': True, 'sideways_strategy': 'breakout', 'sideways_bb_std_mult': 3.377762089777776, 'sideways_rsi_os': 39, 'sideways_rsi_ob': 50, 'sideways_adx_thresh': 20.187212501994637, 'sideways_atr_min_pct': 0.01146150036987537, 'sideways_atr_max_pct': 0.04102143910707366, 'sideways_tp_mult': 1.7082751001681409, 'sideways_tsl_mult': 0.8442223696587376, 'sideways_time_stop': 273, 'sideways_use_sma': True, 'sideways_use_ema': False, 'sideways_use_atr': False, 'sideways_use_adx': True, 'sideways_use_spike': False, 'sideways_rsi_required': False}.
[I 2025-08-30 21:46:50,421] Trial 469 finished with values: [-1000000000.0, 1000000000.0] and parameters: {'p_sma': 33, 'p_std': 53, 'p_atr': 11, 'p_adx': 9, 'rsi_period': 33, 'ema1': 11, 'ema2': 55, 'slip_atr_k': 0.12801733469852816, 'slip_spread_k': 0.7099029674954199, 'spread_hl_frac': 0.03398520670038975, 'bb_std_mult': 0.7291649966679112, 'rsi_os': 30, 'rsi_ob': 95, 'vol_spike': 0.014185921452500999, 'adx_thresh': 11.597402823404096, 'atr_min_pct': 0.004305393339525553, 'atr_max_pct': 0.044903118803804515, 'tp_mult': 1.6261935157854706, 'tsl_mult': 0.8757716340713598, 'strategy': 'breakout', 'time_stop': 78, 'use_sma': True, 'use_atr': True, 'use_adx': False, 'use_ema': False, 'use_spike': False, 'rsi_required': False, 'edge_k': 1.7313479864848973, 'edge_cap': 0.7904917135648407, 'bull_strategy': 'breakout', 'bull_bb_std_mult': 1.884786322655555, 'bull_rsi_os': 17, 'bull_rsi_ob': 86, 'bull_adx_thresh': 15.514311512507177, 'bull_atr_min_pct': 0.0149909639542735, 'bull_atr_max_pct': 0.05220654655249068, 'bull_tp_mult': 1.359405250077763, 'bull_tsl_mult': 0.38289028398073843, 'bull_time_stop': 14, 'bull_use_sma': True, 'bull_use_ema': False, 'bull_use_atr': True, 'bull_use_adx': False, 'bull_use_spike': False, 'bull_rsi_required': True, 'bear_strategy': 'mean_reversion', 'bear_bb_std_mult': 2.1047722858796276, 'bear_rsi_os': 5, 'bear_rsi_ob': 72, 'bear_adx_thresh': 26.706151106642725, 'bear_atr_min_pct': 0.02146892635027956, 'bear_atr_max_pct': 0.11455875722339234, 'bear_tp_mult': 1.5614263230165697, 'bear_tsl_mult': 0.9379542228782158, 'bear_time_stop': 235, 'bear_use_sma': False, 'bear_use_ema': True, 'bear_use_atr': True, 'bear_use_adx': True, 'bear_use_spike': False, 'bear_rsi_required': False, 'sideways_strategy': 'breakout', 'sideways_bb_std_mult': 1.2452648322585378, 'sideways_rsi_os': 39, 'sideways_rsi_ob': 58, 'sideways_adx_thresh': 13.085281866561033, 'sideways_atr_min_pct': 0.02158804953442934, 'sideways_atr_max_pct': 0.04023342807505006, 'sideways_tp_mult': 1.5284670755616816, 'sideways_tsl_mult': 0.6171869310837435, 'sideways_time_stop': 276, 'sideways_use_sma': True, 'sideways_use_ema': False, 'sideways_use_atr': False, 'sideways_use_adx': True, 'sideways_use_spike': False, 'sideways_rsi_required': False}.
[I 2025-08-30 21:47:05,652] Trial 470 finished with values: [-0.02150179296566823, 0.021423996173240444] and parameters: {'p_sma': 36, 'p_std': 17, 'p_atr': 22, 'p_adx': 8, 'rsi_period': 43, 'ema1': 12, 'ema2': 56, 'slip_atr_k': 0.025986967702747183, 'slip_spread_k': 0.677734451357392, 'spread_hl_frac': 0.018079746056721704, 'bb_std_mult': 0.724401668265241, 'rsi_os': 49, 'rsi_ob': 70, 'vol_spike': 0.28068150926995467, 'adx_thresh': 11.653847280517574, 'atr_min_pct': 0.01180993181891635, 'atr_max_pct': 0.04158999368573248, 'tp_mult': 2.09499468284644, 'tsl_mult': 0.4803086467111133, 'strategy': 'breakout', 'time_stop': 74, 'use_sma': True, 'use_atr': True, 'use_adx': True, 'use_ema': True, 'use_spike': True, 'rsi_required': False, 'edge_k': 1.7524534958168605, 'edge_cap': 0.7904190144166873, 'bull_strategy': 'breakout', 'bull_bb_std_mult': 1.8997695342323377, 'bull_rsi_os': 17, 'bull_rsi_ob': 52, 'bull_adx_thresh': 25.611857110396453, 'bull_atr_min_pct': 0.0004941575740910801, 'bull_atr_max_pct': 0.07190894170582632, 'bull_tp_mult': 1.2689077654593106, 'bull_tsl_mult': 0.9997052595213207, 'bull_time_stop': 293, 'bull_use_sma': True, 'bull_use_ema': False, 'bull_use_atr': True, 'bull_use_adx': False, 'bull_use_spike': False, 'bull_rsi_required': True, 'bear_strategy': 'mean_reversion', 'bear_bb_std_mult': 2.1096546519095334, 'bear_rsi_os': 5, 'bear_rsi_ob': 72, 'bear_adx_thresh': 27.44404941170266, 'bear_atr_min_pct': 0.022856516073493746, 'bear_atr_max_pct': 0.1240370050823999, 'bear_tp_mult': 2.16455020812613, 'bear_tsl_mult': 0.3331145117500089, 'bear_time_stop': 234, 'bear_use_sma': False, 'bear_use_ema': True, 'bear_use_atr': True, 'bear_use_adx': True, 'bear_use_spike': False, 'bear_rsi_required': True, 'sideways_strategy': 'breakout', 'sideways_bb_std_mult': 2.0382484403863868, 'sideways_rsi_os': 39, 'sideways_rsi_ob': 74, 'sideways_adx_thresh': 10.556730572555383, 'sideways_atr_min_pct': 0.0214608794526619, 'sideways_atr_max_pct': 0.04159303649400977, 'sideways_tp_mult': 1.687020453003764, 'sideways_tsl_mult': 0.9349597879668025, 'sideways_time_stop': 155, 'sideways_use_sma': True, 'sideways_use_ema': False, 'sideways_use_atr': False, 'sideways_use_adx': True, 'sideways_use_spike': False, 'sideways_rsi_required': False}.
[I 2025-08-30 21:47:12,615] Trial 471 finished with values: [-1000000000.0, 1000000000.0] and parameters: {'p_sma': 36, 'p_std': 36, 'p_atr': 22, 'p_adx': 9, 'rsi_period': 55, 'ema1': 12, 'ema2': 56, 'slip_atr_k': 0.02550988227301863, 'slip_spread_k': 0.7052039707837559, 'spread_hl_frac': 0.03414232597101037, 'bb_std_mult': 0.7007176875908248, 'rsi_os': 12, 'rsi_ob': 67, 'vol_spike': 0.01707979499022666, 'adx_thresh': 10.75500887344742, 'atr_min_pct': 0.004591870067836247, 'atr_max_pct': 0.04424583794514545, 'tp_mult': 2.657919687358761, 'tsl_mult': 0.8757032592400712, 'strategy': 'mean_reversion', 'time_stop': 81, 'use_sma': True, 'use_atr': True, 'use_adx': True, 'use_ema': True, 'use_spike': True, 'rsi_required': False, 'edge_k': 0.17493369460977182, 'edge_cap': 0.8427119832898065, 'bull_strategy': 'breakout', 'bull_bb_std_mult': 1.8894896088755042, 'bull_rsi_os': 17, 'bull_rsi_ob': 89, 'bull_adx_thresh': 15.573499131172602, 'bull_atr_min_pct': 0.01515362448196761, 'bull_atr_max_pct': 0.06745462981010775, 'bull_tp_mult': 1.47062226584776, 'bull_tsl_mult': 0.4313589671286004, 'bull_time_stop': 293, 'bull_use_sma': True, 'bull_use_ema': False, 'bull_use_atr': False, 'bull_use_adx': False, 'bull_use_spike': False, 'bull_rsi_required': True, 'bear_strategy': 'mean_reversion', 'bear_bb_std_mult': 2.1000229622994406, 'bear_rsi_os': 5, 'bear_rsi_ob': 72, 'bear_adx_thresh': 26.770198801039605, 'bear_atr_min_pct': 0.029291951907105825, 'bear_atr_max_pct': 0.10757975475557392, 'bear_tp_mult': 1.5651732778555814, 'bear_tsl_mult': 0.38297190335980985, 'bear_time_stop': 247, 'bear_use_sma': False, 'bear_use_ema': True, 'bear_use_atr': False, 'bear_use_adx': True, 'bear_use_spike': False, 'bear_rsi_required': True, 'sideways_strategy': 'breakout', 'sideways_bb_std_mult': 1.099922508866654, 'sideways_rsi_os': 37, 'sideways_rsi_ob': 54, 'sideways_adx_thresh': 24.76035418470446, 'sideways_atr_min_pct': 0.021529914195221628, 'sideways_atr_max_pct': 0.04216687838475045, 'sideways_tp_mult': 1.6978905414218497, 'sideways_tsl_mult': 0.8912785380603527, 'sideways_time_stop': 155, 'sideways_use_sma': False, 'sideways_use_ema': False, 'sideways_use_atr': False, 'sideways_use_adx': True, 'sideways_use_spike': False, 'sideways_rsi_required': False}.
[I 2025-08-30 21:47:12,835] Trial 472 finished with values: [-1000000000.0, 1000000000.0] and parameters: {'p_sma': 37, 'p_std': 36, 'p_atr': 28, 'p_adx': 9, 'rsi_period': 68, 'ema1': 12, 'ema2': 52, 'slip_atr_k': 0.015423164979372156, 'slip_spread_k': 0.7110191295565037, 'spread_hl_frac': 0.011996757546936335, 'bb_std_mult': 1.033421609054658, 'rsi_os': 32, 'rsi_ob': 67, 'vol_spike': 0.1752267054695415, 'adx_thresh': 11.022320834456178, 'atr_min_pct': 0.01341395053845979, 'atr_max_pct': 0.026458432958320458, 'tp_mult': 2.078638017596312, 'tsl_mult': 0.15791040136202417, 'strategy': 'mean_reversion', 'time_stop': 97, 'use_sma': True, 'use_atr': True, 'use_adx': True, 'use_ema': True, 'use_spike': True, 'rsi_required': False, 'edge_k': 1.7321611056352095, 'edge_cap': 0.8528016405375752, 'bull_strategy': 'breakout', 'bull_bb_std_mult': 1.8851305736123523, 'bull_rsi_os': 17, 'bull_rsi_ob': 89, 'bull_adx_thresh': 15.542757987368201, 'bull_atr_min_pct': 0.010306725498648354, 'bull_atr_max_pct': 0.05652525071390931, 'bull_tp_mult': 1.358949986556609, 'bull_tsl_mult': 0.9993136807141836, 'bull_time_stop': 74, 'bull_use_sma': True, 'bull_use_ema': False, 'bull_use_atr': False, 'bull_use_adx': False, 'bull_use_spike': False, 'bull_rsi_required': True, 'bear_strategy': 'mean_reversion', 'bear_bb_std_mult': 2.1097699126236797, 'bear_rsi_os': 9, 'bear_rsi_ob': 74, 'bear_adx_thresh': 27.486008533694932, 'bear_atr_min_pct': 0.022907531046747566, 'bear_atr_max_pct': 0.12188229656520659, 'bear_tp_mult': 1.4950045331757464, 'bear_tsl_mult': 0.37093274658788983, 'bear_time_stop': 246, 'bear_use_sma': False, 'bear_use_ema': True, 'bear_use_atr': False, 'bear_use_adx': True, 'bear_use_spike': False, 'bear_rsi_required': True, 'sideways_strategy': 'breakout', 'sideways_bb_std_mult': 0.5808569718167513, 'sideways_rsi_os': 53, 'sideways_rsi_ob': 54, 'sideways_adx_thresh': 12.337496877517443, 'sideways_atr_min_pct': 0.021635593203942205, 'sideways_atr_max_pct': 0.04208150061382673, 'sideways_tp_mult': 1.6585653982690036, 'sideways_tsl_mult': 0.8851860423352851, 'sideways_time_stop': 252, 'sideways_use_sma': False, 'sideways_use_ema': False, 'sideways_use_atr': False, 'sideways_use_adx': True, 'sideways_use_spike': False, 'sideways_rsi_required': False}.
[I 2025-08-30 21:47:14,711] Trial 474 finished with values: [-1000000000.0, 1000000000.0] and parameters: {'p_sma': 37, 'p_std': 36, 'p_atr': 21, 'p_adx': 21, 'rsi_period': 55, 'ema1': 10, 'ema2': 52, 'slip_atr_k': 0.01522958171077426, 'slip_spread_k': 0.02039482911530266, 'spread_hl_frac': 0.03497141695151429, 'bb_std_mult': 1.0225634514135418, 'rsi_os': 31, 'rsi_ob': 65, 'vol_spike': 0.1705387917182182, 'adx_thresh': 10.7025621933851, 'atr_min_pct': 0.025801297872789834, 'atr_max_pct': 0.025469153882216523, 'tp_mult': 1.3188827519713007, 'tsl_mult': 0.5960643618430547, 'strategy': 'mean_reversion', 'time_stop': 96, 'use_sma': True, 'use_atr': True, 'use_adx': True, 'use_ema': True, 'use_spike': True, 'rsi_required': True, 'edge_k': 1.9482639237726067, 'edge_cap': 0.8562271799062827, 'bull_strategy': 'breakout', 'bull_bb_std_mult': 1.983689059156162, 'bull_rsi_os': 19, 'bull_rsi_ob': 89, 'bull_adx_thresh': 15.043193214869227, 'bull_atr_min_pct': 0.024344871485553338, 'bull_atr_max_pct': 0.0570727353995869, 'bull_tp_mult': 1.376556432472958, 'bull_tsl_mult': 0.7854907604767218, 'bull_time_stop': 95, 'bull_use_sma': True, 'bull_use_ema': False, 'bull_use_atr': False, 'bull_use_adx': False, 'bull_use_spike': False, 'bull_rsi_required': False, 'bear_strategy': 'breakout', 'bear_bb_std_mult': 2.01636620986524, 'bear_rsi_os': 9, 'bear_rsi_ob': 74, 'bear_adx_thresh': 26.491348715811704, 'bear_atr_min_pct': 0.029296613431337604, 'bear_atr_max_pct': 0.1220672181282464, 'bear_tp_mult': 1.4424232188214294, 'bear_tsl_mult': 0.38540038009602723, 'bear_time_stop': 246, 'bear_use_sma': False, 'bear_use_ema': True, 'bear_use_atr': False, 'bear_use_adx': True, 'bear_use_spike': True, 'bear_rsi_required': True, 'sideways_strategy': 'breakout', 'sideways_bb_std_mult': 1.117194897644258, 'sideways_rsi_os': 37, 'sideways_rsi_ob': 76, 'sideways_adx_thresh': 12.473955872620806, 'sideways_atr_min_pct': 0.022811938790112795, 'sideways_atr_max_pct': 0.05050183804815656, 'sideways_tp_mult': 1.6640514516560487, 'sideways_tsl_mult': 0.8994264863993519, 'sideways_time_stop': 40, 'sideways_use_sma': False, 'sideways_use_ema': False, 'sideways_use_atr': False, 'sideways_use_adx': True, 'sideways_use_spike': False, 'sideways_rsi_required': False}.
[I 2025-08-30 21:47:19,434] Trial 475 finished with values: [-1000000000.0, 1000000000.0] and parameters: {'p_sma': 37, 'p_std': 38, 'p_atr': 21, 'p_adx': 22, 'rsi_period': 27, 'ema1': 10, 'ema2': 53, 'slip_atr_k': 0.0931587785863, 'slip_spread_k': 0.730320168289585, 'spread_hl_frac': 0.03505298866502559, 'bb_std_mult': 1.0116858283739707, 'rsi_os': 36, 'rsi_ob': 91, 'vol_spike': 0.15516697929582013, 'adx_thresh': 10.82293749453085, 'atr_min_pct': 0.025445963684855757, 'atr_max_pct': 0.023787083800451737, 'tp_mult': 1.6702946128520986, 'tsl_mult': 0.9564164644935049, 'strategy': 'mean_reversion', 'time_stop': 96, 'use_sma': True, 'use_atr': True, 'use_adx': True, 'use_ema': True, 'use_spike': True, 'rsi_required': True, 'edge_k': 1.0404492511534698, 'edge_cap': 0.8614727201799728, 'bull_strategy': 'breakout', 'bull_bb_std_mult': 2.0923969680966428, 'bull_rsi_os': 19, 'bull_rsi_ob': 57, 'bull_adx_thresh': 15.004657527190291, 'bull_atr_min_pct': 0.024655319513969855, 'bull_atr_max_pct': 0.0577535819699261, 'bull_tp_mult': 1.3647901246941743, 'bull_tsl_mult': 0.7898948183994332, 'bull_time_stop': 300, 'bull_use_sma': False, 'bull_use_ema': False, 'bull_use_atr': False, 'bull_use_adx': False, 'bull_use_spike': False, 'bull_rsi_required': False, 'bear_strategy': 'breakout', 'bear_bb_std_mult': 2.003510305852924, 'bear_rsi_os': 10, 'bear_rsi_ob': 74, 'bear_adx_thresh': 27.428534357735437, 'bear_atr_min_pct': 0.029992587249622168, 'bear_atr_max_pct': 0.1209445339728024, 'bear_tp_mult': 1.4342097893693355, 'bear_tsl_mult': 0.38214355812952194, 'bear_time_stop': 241, 'bear_use_sma': False, 'bear_use_ema': True, 'bear_use_atr': False, 'bear_use_adx': True, 'bear_use_spike': True, 'bear_rsi_required': True, 'sideways_strategy': 'breakout', 'sideways_bb_std_mult': 1.782212155466764, 'sideways_rsi_os': 37, 'sideways_rsi_ob': 87, 'sideways_adx_thresh': 8.14712427454241, 'sideways_atr_min_pct': 0.02444539116327059, 'sideways_atr_max_pct': 0.03372099999910116, 'sideways_tp_mult': 1.5961813416862571, 'sideways_tsl_mult': 0.208782111554781, 'sideways_time_stop': 251, 'sideways_use_sma': False, 'sideways_use_ema': False, 'sideways_use_atr': False, 'sideways_use_adx': True, 'sideways_use_spike': False, 'sideways_rsi_required': False}.
[I 2025-08-30 21:47:19,908] Trial 473 finished with values: [-1000000000.0, 1000000000.0] and parameters: {'p_sma': 36, 'p_std': 36, 'p_atr': 22, 'p_adx': 12, 'rsi_period': 60, 'ema1': 12, 'ema2': 52, 'slip_atr_k': 0.016923722138777096, 'slip_spread_k': 0.02137396317364343, 'spread_hl_frac': 0.03433547215452015, 'bb_std_mult': 0.6709856184065339, 'rsi_os': 32, 'rsi_ob': 67, 'vol_spike': 0.16779964412118087, 'adx_thresh': 10.8591429375312, 'atr_min_pct': 0.013686969769984932, 'atr_max_pct': 0.026393517121204583, 'tp_mult': 1.6657365829511575, 'tsl_mult': 0.48368594561725087, 'strategy': 'mean_reversion', 'time_stop': 93, 'use_sma': True, 'use_atr': True, 'use_adx': True, 'use_ema': True, 'use_spike': True, 'rsi_required': False, 'edge_k': 1.0410676959124632, 'edge_cap': 0.7680293405516381, 'bull_strategy': 'breakout', 'bull_bb_std_mult': 1.9992717744594932, 'bull_rsi_os': 49, 'bull_rsi_ob': 89, 'bull_adx_thresh': 14.869698252627309, 'bull_atr_min_pct': 0.012403875063246564, 'bull_atr_max_pct': 0.018006736952050115, 'bull_tp_mult': 1.3774852543765022, 'bull_tsl_mult': 0.2340328228676098, 'bull_time_stop': 79, 'bull_use_sma': True, 'bull_use_ema': False, 'bull_use_atr': False, 'bull_use_adx': False, 'bull_use_spike': False, 'bull_rsi_required': False, 'bear_strategy': 'mean_reversion', 'bear_bb_std_mult': 2.0893895794626642, 'bear_rsi_os': 9, 'bear_rsi_ob': 74, 'bear_adx_thresh': 27.409404774827678, 'bear_atr_min_pct': 0.02920444655473312, 'bear_atr_max_pct': 0.1245226403136693, 'bear_tp_mult': 1.4338434826881634, 'bear_tsl_mult': 0.38041208979470653, 'bear_time_stop': 247, 'bear_use_sma': False, 'bear_use_ema': True, 'bear_use_atr': False, 'bear_use_adx': True, 'bear_use_spike': False, 'bear_rsi_required': True, 'sideways_strategy': 'breakout', 'sideways_bb_std_mult': 0.8476383964117133, 'sideways_rsi_os': 37, 'sideways_rsi_ob': 87, 'sideways_adx_thresh': 8.733748775944562, 'sideways_atr_min_pct': 0.022635687088425317, 'sideways_atr_max_pct': 0.03350251431806768, 'sideways_tp_mult': 1.6823496457643718, 'sideways_tsl_mult': 0.22255080719129272, 'sideways_time_stop': 252, 'sideways_use_sma': False, 'sideways_use_ema': False, 'sideways_use_atr': False, 'sideways_use_adx': True, 'sideways_use_spike': False, 'sideways_rsi_required': False}.
[I 2025-08-30 21:47:48,163] Trial 476 finished with values: [-1000000000.0, 1000000000.0] and parameters: {'p_sma': 38, 'p_std': 38, 'p_atr': 21, 'p_adx': 15, 'rsi_period': 59, 'ema1': 10, 'ema2': 52, 'slip_atr_k': 0.08341316419402647, 'slip_spread_k': 0.6373221818822793, 'spread_hl_frac': 0.03520843620302314, 'bb_std_mult': 0.8481335209638091, 'rsi_os': 36, 'rsi_ob': 65, 'vol_spike': 0.272808078126852, 'adx_thresh': 10.53793969336914, 'atr_min_pct': 0.013779889828270272, 'atr_max_pct': 0.02926821145515021, 'tp_mult': 1.6649389283356884, 'tsl_mult': 0.6023865907541489, 'strategy': 'mean_reversion', 'time_stop': 93, 'use_sma': True, 'use_atr': True, 'use_adx': True, 'use_ema': True, 'use_spike': True, 'rsi_required': True, 'edge_k': 0.436530385398196, 'edge_cap': 0.7410825107661891, 'bull_strategy': 'breakout', 'bull_bb_std_mult': 1.9872616687454634, 'bull_rsi_os': 49, 'bull_rsi_ob': 57, 'bull_adx_thresh': 30.181245738186554, 'bull_atr_min_pct': 0.001869276919531072, 'bull_atr_max_pct': 0.016759508880201293, 'bull_tp_mult': 1.3916778424088996, 'bull_tsl_mult': 0.3785890445911755, 'bull_time_stop': 103, 'bull_use_sma': False, 'bull_use_ema': False, 'bull_use_atr': False, 'bull_use_adx': False, 'bull_use_spike': False, 'bull_rsi_required': False, 'bear_strategy': 'breakout', 'bear_bb_std_mult': 2.032065130193339, 'bear_rsi_os': 7, 'bear_rsi_ob': 74, 'bear_adx_thresh': 26.516522274791257, 'bear_atr_min_pct': 0.029282285652223284, 'bear_atr_max_pct': 0.11201894031592323, 'bear_tp_mult': 2.073907750495794, 'bear_tsl_mult': 0.2520274107577776, 'bear_time_stop': 227, 'bear_use_sma': False, 'bear_use_ema': True, 'bear_use_atr': False, 'bear_use_adx': True, 'bear_use_spike': True, 'bear_rsi_required': True, 'sideways_strategy': 'breakout', 'sideways_bb_std_mult': 0.8440318911895588, 'sideways_rsi_os': 36, 'sideways_rsi_ob': 62, 'sideways_adx_thresh': 26.73079622342808, 'sideways_atr_min_pct': 0.005560679510254227, 'sideways_atr_max_pct': 0.032991514605152227, 'sideways_tp_mult': 1.5921655883155732, 'sideways_tsl_mult': 0.575686696954724, 'sideways_time_stop': 100, 'sideways_use_sma': False, 'sideways_use_ema': False, 'sideways_use_atr': False, 'sideways_use_adx': True, 'sideways_use_spike': False, 'sideways_rsi_required': False}.
