[I 2025-08-30 21:14:08,539] Trial 213 finished with values: [-1000000000.0, 1000000000.0] and parameters: {'p_sma': 28, 'p_std': 54, 'p_atr': 29, 'p_adx': 25, 'rsi_period': 75, 'ema1': 16, 'ema2': 55, 'slip_atr_k': 0.1443747141908721, 'slip_spread_k': 0.17982200497059592, 'spread_hl_frac': 0.03070799031707017, 'bb_std_mult': 2.4963732110309165, 'rsi_os': 46, 'rsi_ob': 60, 'vol_spike': 0.1162478669976734, 'adx_thresh': 22.7611702550849, 'atr_min_pct': 8.140286560951224e-06, 'atr_max_pct': 0.1323913378971242, 'tp_mult': 1.6365643244753723, 'tsl_mult': 0.8487703591994996, 'strategy': 'mean_reversion', 'time_stop': 239, 'use_sma': True, 'use_atr': True, 'use_adx': True, 'use_ema': True, 'use_spike': True, 'rsi_required': True, 'edge_k': 1.9901130570739383, 'edge_cap': 0.7310807242109307, 'bull_strategy': 'breakout', 'bull_bb_std_mult': 3.254853086184275, 'bull_rsi_os': 15, 'bull_rsi_ob': 70, 'bull_adx_thresh': 28.901523117274994, 'bull_atr_min_pct': 0.01628073118913721, 'bull_atr_max_pct': 0.04742226611200226, 'bull_tp_mult': 1.6723920077568222, 'bull_tsl_mult': 0.9448431175338498, 'bull_time_stop': 133, 'bull_use_sma': True, 'bull_use_ema': False, 'bull_use_atr': False, 'bull_use_adx': True, 'bull_use_spike': True, 'bull_rsi_required': True, 'bear_strategy': 'mean_reversion', 'bear_bb_std_mult': 2.8052967446561166, 'bear_rsi_os': 22, 'bear_rsi_ob': 50, 'bear_adx_thresh': 18.309228894152703, 'bear_atr_min_pct': 0.017817497805636285, 'bear_atr_max_pct': 0.07693690454547744, 'bear_tp_mult': 1.0792211502982796, 'bear_tsl_mult': 0.30588829876036516, 'bear_time_stop': 102, 'bear_use_sma': True, 'bear_use_ema': False, 'bear_use_atr': False, 'bear_use_adx': True, 'bear_use_spike': True, 'bear_rsi_required': True, 'sideways_strategy': 'breakout', 'sideways_bb_std_mult': 2.7657781684347387, 'sideways_rsi_os': 13, 'sideways_rsi_ob': 95, 'sideways_adx_thresh': 24.90365548727724, 'sideways_atr_min_pct': 0.012554421716729979, 'sideways_atr_max_pct': 0.062486954921129635, 'sideways_tp_mult': 2.571416570027264, 'sideways_tsl_mult': 0.6616134645442545, 'sideways_time_stop': 149, 'sideways_use_sma': False, 'sideways_use_ema': True, 'sideways_use_atr': True, 'sideways_use_adx': False, 'sideways_use_spike': False, 'sideways_rsi_required': True}.
[I 2025-08-30 21:14:42,027] Trial 217 finished with values: [-1000000000.0, 1000000000.0] and parameters: {'p_sma': 27, 'p_std': 36, 'p_atr': 18, 'p_adx': 29, 'rsi_period': 49, 'ema1': 27, 'ema2': 41, 'slip_atr_k': 0.032459213994295064, 'slip_spread_k': 0.7569361355707485, 'spread_hl_frac': 0.004131579039719343, 'bb_std_mult': 3.0020437775463917, 'rsi_os': 43, 'rsi_ob': 77, 'vol_spike': 0.28647193099147583, 'adx_thresh': 24.94731063360036, 'atr_min_pct': 0.0007968741087442076, 'atr_max_pct': 0.03256178978115408, 'tp_mult': 1.517069655219028, 'tsl_mult': 0.09564833830597252, 'strategy': 'breakout', 'time_stop': 203, 'use_sma': False, 'use_atr': False, 'use_adx': False, 'use_ema': False, 'use_spike': False, 'rsi_required': True, 'edge_k': 0.7365313485551926, 'edge_cap': 0.17893828538830886, 'bull_strategy': 'mean_reversion', 'bull_bb_std_mult': 3.342332800536797, 'bull_rsi_os': 52, 'bull_rsi_ob': 67, 'bull_adx_thresh': 13.385383002419168, 'bull_atr_min_pct': 0.0009507463954540835, 'bull_atr_max_pct': 0.1048625744622825, 'bull_tp_mult': 1.4077543498273248, 'bull_tsl_mult': 0.024338307865451856, 'bull_time_stop': 294, 'bull_use_sma': True, 'bull_use_ema': True, 'bull_use_atr': True, 'bull_use_adx': True, 'bull_use_spike': True, 'bull_rsi_required': False, 'bear_strategy': 'breakout', 'bear_bb_std_mult': 2.6561193453933165, 'bear_rsi_os': 50, 'bear_rsi_ob': 88, 'bear_adx_thresh': 32.636117459662174, 'bear_atr_min_pct': 0.01744023867899188, 'bear_atr_max_pct': 0.021698219418375006, 'bear_tp_mult': 1.19943615114552, 'bear_tsl_mult': 0.22167409975702485, 'bear_time_stop': 98, 'bear_use_sma': False, 'bear_use_ema': False, 'bear_use_atr': True, 'bear_use_adx': True, 'bear_use_spike': True, 'bear_rsi_required': False, 'sideways_strategy': 'mean_reversion', 'sideways_bb_std_mult': 2.9292001035725335, 'sideways_rsi_os': 41, 'sideways_rsi_ob': 57, 'sideways_adx_thresh': 32.41475193631377, 'sideways_atr_min_pct': 0.010131983274041738, 'sideways_atr_max_pct': 0.012339856510824315, 'sideways_tp_mult': 2.730141428439631, 'sideways_tsl_mult': 0.5719603344667311, 'sideways_time_stop': 80, 'sideways_use_sma': False, 'sideways_use_ema': True, 'sideways_use_atr': True, 'sideways_use_adx': False, 'sideways_use_spike': False, 'sideways_rsi_required': True}.
[I 2025-08-30 21:14:42,628] Trial 218 finished with values: [-1000000000.0, 1000000000.0] and parameters: {'p_sma': 28, 'p_std': 35, 'p_atr': 13, 'p_adx': 9, 'rsi_period': 19, 'ema1': 24, 'ema2': 41, 'slip_atr_k': 0.03097650249377113, 'slip_spread_k': 0.003536524718439793, 'spread_hl_frac': 0.030859166510441655, 'bb_std_mult': 2.517446976731807, 'rsi_os': 43, 'rsi_ob': 78, 'vol_spike': 0.15396146112231146, 'adx_thresh': 23.35270436866524, 'atr_min_pct': 0.02991595415909402, 'atr_max_pct': 0.1496730766821856, 'tp_mult': 1.5070321159301914, 'tsl_mult': 0.6459756635393049, 'strategy': 'breakout', 'time_stop': 236, 'use_sma': False, 'use_atr': False, 'use_adx': False, 'use_ema': False, 'use_spike': False, 'rsi_required': False, 'edge_k': 0.7180992722746207, 'edge_cap': 0.40920882312033047, 'bull_strategy': 'mean_reversion', 'bull_bb_std_mult': 3.3197981607782756, 'bull_rsi_os': 19, 'bull_rsi_ob': 67, 'bull_adx_thresh': 6.198027143106337, 'bull_atr_min_pct': 6.5219673135420925e-06, 'bull_atr_max_pct': 0.06665003594183043, 'bull_tp_mult': 2.8831608332336587, 'bull_tsl_mult': 0.06475323149430107, 'bull_time_stop': 295, 'bull_use_sma': False, 'bull_use_ema': True, 'bull_use_atr': True, 'bull_use_adx': True, 'bull_use_spike': True, 'bull_rsi_required': False, 'bear_strategy': 'breakout', 'bear_bb_std_mult': 2.666444072618486, 'bear_rsi_os': 28, 'bear_rsi_ob': 89, 'bear_adx_thresh': 16.95594742957021, 'bear_atr_min_pct': 0.009447526981024742, 'bear_atr_max_pct': 0.030954701966144756, 'bear_tp_mult': 1.6186593223648742, 'bear_tsl_mult': 0.5927267062682541, 'bear_time_stop': 101, 'bear_use_sma': True, 'bear_use_ema': False, 'bear_use_atr': True, 'bear_use_adx': True, 'bear_use_spike': False, 'bear_rsi_required': False, 'sideways_strategy': 'mean_reversion', 'sideways_bb_std_mult': 1.2026611044294233, 'sideways_rsi_os': 27, 'sideways_rsi_ob': 57, 'sideways_adx_thresh': 23.03977013385526, 'sideways_atr_min_pct': 0.010438243187891919, 'sideways_atr_max_pct': 0.060309815562510374, 'sideways_tp_mult': 2.6933230725052573, 'sideways_tsl_mult': 0.5818141318879234, 'sideways_time_stop': 142, 'sideways_use_sma': True, 'sideways_use_ema': True, 'sideways_use_atr': True, 'sideways_use_adx': False, 'sideways_use_spike': True, 'sideways_rsi_required': True}.
[I 2025-08-30 21:14:42,817] Trial 220 finished with values: [-1000000000.0, 1000000000.0] and parameters: {'p_sma': 28, 'p_std': 35, 'p_atr': 13, 'p_adx': 29, 'rsi_period': 21, 'ema1': 20, 'ema2': 41, 'slip_atr_k': 0.13218702797163326, 'slip_spread_k': 0.7554841403211083, 'spread_hl_frac': 0.012459957580912152, 'bb_std_mult': 1.7304332226516186, 'rsi_os': 43, 'rsi_ob': 78, 'vol_spike': 0.154787864542253, 'adx_thresh': 23.24911685404106, 'atr_min_pct': 0.024969517713671466, 'atr_max_pct': 0.09742650479720691, 'tp_mult': 1.5233602740460894, 'tsl_mult': 0.8789177714091488, 'strategy': 'breakout', 'time_stop': 216, 'use_sma': False, 'use_atr': False, 'use_adx': False, 'use_ema': False, 'use_spike': False, 'rsi_required': False, 'edge_k': 0.7378509120132704, 'edge_cap': 0.8979064258550413, 'bull_strategy': 'mean_reversion', 'bull_bb_std_mult': 1.9379763683497306, 'bull_rsi_os': 43, 'bull_rsi_ob': 62, 'bull_adx_thresh': 31.571744129896413, 'bull_atr_min_pct': 4.22076121302156e-05, 'bull_atr_max_pct': 0.010451031524586082, 'bull_tp_mult': 1.4577745719413744, 'bull_tsl_mult': 0.1914930560822562, 'bull_time_stop': 295, 'bull_use_sma': False, 'bull_use_ema': True, 'bull_use_atr': True, 'bull_use_adx': False, 'bull_use_spike': True, 'bull_rsi_required': False, 'bear_strategy': 'breakout', 'bear_bb_std_mult': 1.6414826128161162, 'bear_rsi_os': 30, 'bear_rsi_ob': 88, 'bear_adx_thresh': 15.538953384696493, 'bear_atr_min_pct': 0.01651426316577282, 'bear_atr_max_pct': 0.022128328840709463, 'bear_tp_mult': 2.497435512564, 'bear_tsl_mult': 0.10581397778250429, 'bear_time_stop': 115, 'bear_use_sma': True, 'bear_use_ema': False, 'bear_use_atr': True, 'bear_use_adx': True, 'bear_use_spike': False, 'bear_rsi_required': False, 'sideways_strategy': 'mean_reversion', 'sideways_bb_std_mult': 1.2250217912933066, 'sideways_rsi_os': 27, 'sideways_rsi_ob': 82, 'sideways_adx_thresh': 12.30935289297215, 'sideways_atr_min_pct': 0.027468710419245604, 'sideways_atr_max_pct': 0.05790444370120093, 'sideways_tp_mult': 2.3285465648264836, 'sideways_tsl_mult': 0.5767582623924703, 'sideways_time_stop': 79, 'sideways_use_sma': True, 'sideways_use_ema': True, 'sideways_use_atr': True, 'sideways_use_adx': False, 'sideways_use_spike': True, 'sideways_rsi_required': True}.
[I 2025-08-30 21:14:43,035] Trial 219 finished with values: [-1000000000.0, 1000000000.0] and parameters: {'p_sma': 28, 'p_std': 35, 'p_atr': 17, 'p_adx': 29, 'rsi_period': 59, 'ema1': 11, 'ema2': 42, 'slip_atr_k': 0.03862116691054911, 'slip_spread_k': 0.7511883433215717, 'spread_hl_frac': 0.029239081946290348, 'bb_std_mult': 1.7217444635911994, 'rsi_os': 43, 'rsi_ob': 78, 'vol_spike': 0.2699450377703881, 'adx_thresh': 23.408849985982677, 'atr_min_pct': 0.02269780363695717, 'atr_max_pct': 0.09857351767625336, 'tp_mult': 1.5056326043658745, 'tsl_mult': 0.869722822306574, 'strategy': 'breakout', 'time_stop': 238, 'use_sma': False, 'use_atr': False, 'use_adx': False, 'use_ema': True, 'use_spike': False, 'rsi_required': False, 'edge_k': 0.7375466247379466, 'edge_cap': 0.7362673781436598, 'bull_strategy': 'mean_reversion', 'bull_bb_std_mult': 0.5914647354256362, 'bull_rsi_os': 51, 'bull_rsi_ob': 45, 'bull_adx_thresh': 34.90492368916735, 'bull_atr_min_pct': 5.8564109942173845e-05, 'bull_atr_max_pct': 0.12806754550260896, 'bull_tp_mult': 2.884917108549531, 'bull_tsl_mult': 0.6936098324743596, 'bull_time_stop': 296, 'bull_use_sma': False, 'bull_use_ema': True, 'bull_use_atr': True, 'bull_use_adx': False, 'bull_use_spike': True, 'bull_rsi_required': False, 'bear_strategy': 'breakout', 'bear_bb_std_mult': 1.6362392721229855, 'bear_rsi_os': 48, 'bear_rsi_ob': 88, 'bear_adx_thresh': 15.546129793680763, 'bear_atr_min_pct': 0.018167333344888546, 'bear_atr_max_pct': 0.02082271911019425, 'bear_tp_mult': 2.4762009017738222, 'bear_tsl_mult': 0.22213519810589222, 'bear_time_stop': 100, 'bear_use_sma': True, 'bear_use_ema': False, 'bear_use_atr': True, 'bear_use_adx': True, 'bear_use_spike': False, 'bear_rsi_required': False, 'sideways_strategy': 'mean_reversion', 'sideways_bb_std_mult': 3.0152618455659836, 'sideways_rsi_os': 19, 'sideways_rsi_ob': 66, 'sideways_adx_thresh': 7.655225910587937, 'sideways_atr_min_pct': 0.010548971382809642, 'sideways_atr_max_pct': 0.05864727388755066, 'sideways_tp_mult': 2.7332517156249896, 'sideways_tsl_mult': 0.33821371957691865, 'sideways_time_stop': 90, 'sideways_use_sma': True, 'sideways_use_ema': True, 'sideways_use_atr': True, 'sideways_use_adx': False, 'sideways_use_spike': True, 'sideways_rsi_required': True}.
[I 2025-08-30 21:15:18,985] Trial 223 finished with values: [-1000000000.0, 1000000000.0] and parameters: {'p_sma': 59, 'p_std': 38, 'p_atr': 14, 'p_adx': 16, 'rsi_period': 59, 'ema1': 12, 'ema2': 43, 'slip_atr_k': 0.18237946682808684, 'slip_spread_k': 0.47888702781723713, 'spread_hl_frac': 0.005960185054102389, 'bb_std_mult': 2.877311582841847, 'rsi_os': 45, 'rsi_ob': 77, 'vol_spike': 0.26543671247432077, 'adx_thresh': 31.438855413154357, 'atr_min_pct': 0.0017111030299501798, 'atr_max_pct': 0.10012435333237739, 'tp_mult': 1.7087311296073464, 'tsl_mult': 0.8228568635709719, 'strategy': 'mean_reversion', 'time_stop': 210, 'use_sma': False, 'use_atr': True, 'use_adx': True, 'use_ema': True, 'use_spike': True, 'rsi_required': True, 'edge_k': 1.2481508728227495, 'edge_cap': 0.354066044713131, 'bull_strategy': 'breakout', 'bull_bb_std_mult': 1.2385208835219315, 'bull_rsi_os': 18, 'bull_rsi_ob': 75, 'bull_adx_thresh': 13.143209097301591, 'bull_atr_min_pct': 0.019003314531710558, 'bull_atr_max_pct': 0.05199066325638042, 'bull_tp_mult': 2.8194261960603453, 'bull_tsl_mult': 0.11550589386632096, 'bull_time_stop': 210, 'bull_use_sma': True, 'bull_use_ema': False, 'bull_use_atr': False, 'bull_use_adx': False, 'bull_use_spike': True, 'bull_rsi_required': True, 'bear_strategy': 'mean_reversion', 'bear_bb_std_mult': 2.58171439402239, 'bear_rsi_os': 36, 'bear_rsi_ob': 51, 'bear_adx_thresh': 16.442918076965345, 'bear_atr_min_pct': 0.007814935772540473, 'bear_atr_max_pct': 0.13102388963219735, 'bear_tp_mult': 2.9962321058084225, 'bear_tsl_mult': 0.6980413418920116, 'bear_time_stop': 107, 'bear_use_sma': True, 'bear_use_ema': False, 'bear_use_atr': False, 'bear_use_adx': True, 'bear_use_spike': True, 'bear_rsi_required': True, 'sideways_strategy': 'breakout', 'sideways_bb_std_mult': 3.0022009673604098, 'sideways_rsi_os': 38, 'sideways_rsi_ob': 88, 'sideways_adx_thresh': 33.14637693451077, 'sideways_atr_min_pct': 0.006100150113877477, 'sideways_atr_max_pct': 0.015439858270457504, 'sideways_tp_mult': 2.6523791599137936, 'sideways_tsl_mult': 0.4196823254775118, 'sideways_time_stop': 144, 'sideways_use_sma': False, 'sideways_use_ema': True, 'sideways_use_atr': True, 'sideways_use_adx': False, 'sideways_use_spike': False, 'sideways_rsi_required': True}.
[I 2025-08-30 21:15:19,307] Trial 222 finished with values: [-1000000000.0, 1000000000.0] and parameters: {'p_sma': 30, 'p_std': 37, 'p_atr': 7, 'p_adx': 19, 'rsi_period': 59, 'ema1': 20, 'ema2': 58, 'slip_atr_k': 0.03905107162609562, 'slip_spread_k': 0.7914025298194447, 'spread_hl_frac': 0.006080277384432684, 'bb_std_mult': 0.5824420219911612, 'rsi_os': 45, 'rsi_ob': 78, 'vol_spike': 0.2700098263621349, 'adx_thresh': 12.096670561244974, 'atr_min_pct': 0.022955755746935015, 'atr_max_pct': 0.05534630412562388, 'tp_mult': 1.6898688474822143, 'tsl_mult': 0.05303027034498853, 'strategy': 'mean_reversion', 'time_stop': 219, 'use_sma': False, 'use_atr': True, 'use_adx': True, 'use_ema': True, 'use_spike': True, 'rsi_required': False, 'edge_k': 1.2978401232206123, 'edge_cap': 0.35776677963925807, 'bull_strategy': 'breakout', 'bull_bb_std_mult': 2.766245520483192, 'bull_rsi_os': 18, 'bull_rsi_ob': 53, 'bull_adx_thresh': 32.25880892318695, 'bull_atr_min_pct': 0.02073862071300598, 'bull_atr_max_pct': 0.12840926540086117, 'bull_tp_mult': 2.4774670811635824, 'bull_tsl_mult': 0.8430969850017472, 'bull_time_stop': 211, 'bull_use_sma': False, 'bull_use_ema': False, 'bull_use_atr': False, 'bull_use_adx': False, 'bull_use_spike': True, 'bull_rsi_required': True, 'bear_strategy': 'mean_reversion', 'bear_bb_std_mult': 2.590917864119109, 'bear_rsi_os': 35, 'bear_rsi_ob': 51, 'bear_adx_thresh': 15.499181548731327, 'bear_atr_min_pct': 0.01240362486890376, 'bear_atr_max_pct': 0.13129027302830015, 'bear_tp_mult': 2.9654183481867236, 'bear_tsl_mult': 0.11454272918404351, 'bear_time_stop': 106, 'bear_use_sma': True, 'bear_use_ema': False, 'bear_use_atr': False, 'bear_use_adx': True, 'bear_use_spike': False, 'bear_rsi_required': True, 'sideways_strategy': 'breakout', 'sideways_bb_std_mult': 3.250237080087728, 'sideways_rsi_os': 23, 'sideways_rsi_ob': 70, 'sideways_adx_thresh': 17.70154691791029, 'sideways_atr_min_pct': 0.009460250808429969, 'sideways_atr_max_pct': 0.01619100485074246, 'sideways_tp_mult': 2.21381873151737, 'sideways_tsl_mult': 0.18269979864853686, 'sideways_time_stop': 21, 'sideways_use_sma': True, 'sideways_use_ema': True, 'sideways_use_atr': True, 'sideways_use_adx': False, 'sideways_use_spike': True, 'sideways_rsi_required': True}.
[I 2025-08-30 21:15:19,514] Trial 224 finished with values: [-1000000000.0, 1000000000.0] and parameters: {'p_sma': 30, 'p_std': 12, 'p_atr': 14, 'p_adx': 19, 'rsi_period': 17, 'ema1': 20, 'ema2': 43, 'slip_atr_k': 0.028315793313838426, 'slip_spread_k': 0.11572582064800196, 'spread_hl_frac': 0.006304443853461641, 'bb_std_mult': 1.021338592136348, 'rsi_os': 45, 'rsi_ob': 79, 'vol_spike': 0.27676466430542374, 'adx_thresh': 11.93619649230662, 'atr_min_pct': 0.006739078306360042, 'atr_max_pct': 0.08888790765049254, 'tp_mult': 1.6941603730038521, 'tsl_mult': 0.8203652346520603, 'strategy': 'mean_reversion', 'time_stop': 219, 'use_sma': False, 'use_atr': True, 'use_adx': True, 'use_ema': True, 'use_spike': True, 'rsi_required': True, 'edge_k': 1.2721823948684348, 'edge_cap': 0.6292745713276597, 'bull_strategy': 'breakout', 'bull_bb_std_mult': 1.2492085936561867, 'bull_rsi_os': 18, 'bull_rsi_ob': 74, 'bull_adx_thresh': 21.435060437470458, 'bull_atr_min_pct': 0.021079146076247467, 'bull_atr_max_pct': 0.051997514904768505, 'bull_tp_mult': 2.8212021892752315, 'bull_tsl_mult': 0.1263098494593562, 'bull_time_stop': 242, 'bull_use_sma': True, 'bull_use_ema': False, 'bull_use_atr': False, 'bull_use_adx': True, 'bull_use_spike': True, 'bull_rsi_required': True, 'bear_strategy': 'mean_reversion', 'bear_bb_std_mult': 1.4258885810574067, 'bear_rsi_os': 49, 'bear_rsi_ob': 51, 'bear_adx_thresh': 9.239375956306136, 'bear_atr_min_pct': 0.012280762943126163, 'bear_atr_max_pct': 0.015650255915623953, 'bear_tp_mult': 2.998511646590672, 'bear_tsl_mult': 0.9317432922044964, 'bear_time_stop': 94, 'bear_use_sma': True, 'bear_use_ema': False, 'bear_use_atr': False, 'bear_use_adx': False, 'bear_use_spike': True, 'bear_rsi_required': True, 'sideways_strategy': 'breakout', 'sideways_bb_std_mult': 2.6652833024520297, 'sideways_rsi_os': 38, 'sideways_rsi_ob': 51, 'sideways_adx_thresh': 32.96385484547096, 'sideways_atr_min_pct': 0.009317556000970607, 'sideways_atr_max_pct': 0.010359829259558286, 'sideways_tp_mult': 2.6255594783711023, 'sideways_tsl_mult': 0.37104719884633014, 'sideways_time_stop': 145, 'sideways_use_sma': False, 'sideways_use_ema': True, 'sideways_use_atr': False, 'sideways_use_adx': True, 'sideways_use_spike': False, 'sideways_rsi_required': True}.
[I 2025-08-30 21:15:19,647] Trial 221 finished with values: [-1000000000.0, 1000000000.0] and parameters: {'p_sma': 30, 'p_std': 38, 'p_atr': 13, 'p_adx': 13, 'rsi_period': 30, 'ema1': 11, 'ema2': 41, 'slip_atr_k': 0.038976086869266624, 'slip_spread_k': 0.0026246633072630754, 'spread_hl_frac': 0.01744548572126425, 'bb_std_mult': 3.118812307857728, 'rsi_os': 46, 'rsi_ob': 78, 'vol_spike': 0.15402270353832587, 'adx_thresh': 15.861839605528111, 'atr_min_pct': 0.0248350135394245, 'atr_max_pct': 0.09820656178156414, 'tp_mult': 1.7101852763538694, 'tsl_mult': 0.05694159441323621, 'strategy': 'breakout', 'time_stop': 216, 'use_sma': False, 'use_atr': False, 'use_adx': False, 'use_ema': True, 'use_spike': False, 'rsi_required': False, 'edge_k': 0.5479498639161022, 'edge_cap': 0.8920299942309834, 'bull_strategy': 'mean_reversion', 'bull_bb_std_mult': 1.256204272854438, 'bull_rsi_os': 43, 'bull_rsi_ob': 53, 'bull_adx_thresh': 6.073131965067146, 'bull_atr_min_pct': 0.01892498282894358, 'bull_atr_max_pct': 0.05125434566949702, 'bull_tp_mult': 2.9043198084073167, 'bull_tsl_mult': 0.18544171345302352, 'bull_time_stop': 206, 'bull_use_sma': False, 'bull_use_ema': True, 'bull_use_atr': True, 'bull_use_adx': False, 'bull_use_spike': True, 'bull_rsi_required': False, 'bear_strategy': 'breakout', 'bear_bb_std_mult': 2.6583014111053496, 'bear_rsi_os': 48, 'bear_rsi_ob': 85, 'bear_adx_thresh': 12.136809227435373, 'bear_atr_min_pct': 0.01658128128588587, 'bear_atr_max_pct': 0.014937091562798821, 'bear_tp_mult': 1.54263795189452, 'bear_tsl_mult': 0.48732677205665786, 'bear_time_stop': 116, 'bear_use_sma': True, 'bear_use_ema': False, 'bear_use_atr': True, 'bear_use_adx': True, 'bear_use_spike': False, 'bear_rsi_required': False, 'sideways_strategy': 'mean_reversion', 'sideways_bb_std_mult': 1.2380681177518666, 'sideways_rsi_os': 38, 'sideways_rsi_ob': 46, 'sideways_adx_thresh': 7.685440420246664, 'sideways_atr_min_pct': 0.010731207071648907, 'sideways_atr_max_pct': 0.01693742017368858, 'sideways_tp_mult': 2.691291763643961, 'sideways_tsl_mult': 0.3440129211523227, 'sideways_time_stop': 146, 'sideways_use_sma': True, 'sideways_use_ema': True, 'sideways_use_atr': True, 'sideways_use_adx': False, 'sideways_use_spike': True, 'sideways_rsi_required': True}.
