[I 2025-08-30 22:34:21,932] Trial 864 finished with values: [-1000000000.0, 1000000000.0] and parameters: {'p_sma': 32, 'p_std': 47, 'p_atr': 27, 'p_adx': 9, 'rsi_period': 77, 'ema1': 16, 'ema2': 17, 'slip_atr_k': 0.0055837336300142955, 'slip_spread_k': 0.7147639910889227, 'spread_hl_frac': 0.010573572237773677, 'bb_std_mult': 2.791308292186017, 'rsi_os': 16, 'rsi_ob': 86, 'vol_spike': 0.028117859899463266, 'adx_thresh': 5.885975761212084, 'atr_min_pct': 0.015267761855291433, 'atr_max_pct': 0.07081082558563122, 'tp_mult': 1.455845105625665, 'tsl_mult': 0.25283264493327595, 'strategy': 'mean_reversion', 'time_stop': 112, 'use_sma': True, 'use_atr': False, 'use_adx': True, 'use_ema': False, 'use_spike': True, 'rsi_required': False, 'edge_k': 1.2775652967210536, 'edge_cap': 0.05451373726008545, 'bull_strategy': 'breakout', 'bull_bb_std_mult': 2.144710682201976, 'bull_rsi_os': 42, 'bull_rsi_ob': 81, 'bull_adx_thresh': 17.93646686574105, 'bull_atr_min_pct': 0.018574937122926936, 'bull_atr_max_pct': 0.040872021679372546, 'bull_tp_mult': 2.093554231441304, 'bull_tsl_mult': 0.6173943688474792, 'bull_time_stop': 276, 'bull_use_sma': True, 'bull_use_ema': True, 'bull_use_atr': False, 'bull_use_adx': True, 'bull_use_spike': True, 'bull_rsi_required': False, 'bear_strategy': 'breakout', 'bear_bb_std_mult': 1.5839491334580034, 'bear_rsi_os': 14, 'bear_rsi_ob': 76, 'bear_adx_thresh': 18.022277511426882, 'bear_atr_min_pct': 0.026985590375296478, 'bear_atr_max_pct': 0.12783460616251233, 'bear_tp_mult': 2.4804592323033514, 'bear_tsl_mult': 0.5646354499202091, 'bear_time_stop': 266, 'bear_use_sma': True, 'bear_use_ema': False, 'bear_use_atr': True, 'bear_use_adx': True, 'bear_use_spike': True, 'bear_rsi_required': False, 'sideways_strategy': 'mean_reversion', 'sideways_bb_std_mult': 2.6211805743479233, 'sideways_rsi_os': 33, 'sideways_rsi_ob': 57, 'sideways_adx_thresh': 24.823135541591206, 'sideways_atr_min_pct': 0.019824741257607435, 'sideways_atr_max_pct': 0.08593976577153217, 'sideways_tp_mult': 2.1105489815374776, 'sideways_tsl_mult': 0.8846991616291487, 'sideways_time_stop': 240, 'sideways_use_sma': True, 'sideways_use_ema': True, 'sideways_use_atr': True, 'sideways_use_adx': False, 'sideways_use_spike': True, 'sideways_rsi_required': True}.
[I 2025-08-30 22:34:56,128] Trial 868 finished with values: [-1000000000.0, 1000000000.0] and parameters: {'p_sma': 33, 'p_std': 42, 'p_atr': 24, 'p_adx': 7, 'rsi_period': 76, 'ema1': 14, 'ema2': 18, 'slip_atr_k': 0.00681233813140785, 'slip_spread_k': 0.7133347302756129, 'spread_hl_frac': 0.00658029695484294, 'bb_std_mult': 3.2867811607717687, 'rsi_os': 14, 'rsi_ob': 94, 'vol_spike': 0.015878403769205397, 'adx_thresh': 5.028413366218781, 'atr_min_pct': 0.014925954621347721, 'atr_max_pct': 0.0702464585456163, 'tp_mult': 1.3736450769659982, 'tsl_mult': 0.28173031755679356, 'strategy': 'mean_reversion', 'time_stop': 124, 'use_sma': True, 'use_atr': False, 'use_adx': True, 'use_ema': True, 'use_spike': True, 'rsi_required': True, 'edge_k': 1.364169132539192, 'edge_cap': 0.09075999491931176, 'bull_strategy': 'breakout', 'bull_bb_std_mult': 2.1485882210066887, 'bull_rsi_os': 41, 'bull_rsi_ob': 83, 'bull_adx_thresh': 20.504499105886055, 'bull_atr_min_pct': 0.00968299645190396, 'bull_atr_max_pct': 0.041838801568208, 'bull_tp_mult': 2.1973011171030508, 'bull_tsl_mult': 0.5969158349673798, 'bull_time_stop': 263, 'bull_use_sma': True, 'bull_use_ema': False, 'bull_use_atr': False, 'bull_use_adx': True, 'bull_use_spike': True, 'bull_rsi_required': False, 'bear_strategy': 'breakout', 'bear_bb_std_mult': 1.4960604344987751, 'bear_rsi_os': 12, 'bear_rsi_ob': 76, 'bear_adx_thresh': 28.57839482765668, 'bear_atr_min_pct': 0.027530247526119975, 'bear_atr_max_pct': 0.1260466682498064, 'bear_tp_mult': 2.6096578943923476, 'bear_tsl_mult': 0.5464572005937619, 'bear_time_stop': 281, 'bear_use_sma': True, 'bear_use_ema': True, 'bear_use_atr': True, 'bear_use_adx': True, 'bear_use_spike': True, 'bear_rsi_required': False, 'sideways_strategy': 'mean_reversion', 'sideways_bb_std_mult': 2.555665298685654, 'sideways_rsi_os': 33, 'sideways_rsi_ob': 45, 'sideways_adx_thresh': 26.204002598680777, 'sideways_atr_min_pct': 0.019878490225782523, 'sideways_atr_max_pct': 0.0959617550426274, 'sideways_tp_mult': 2.2303138345277893, 'sideways_tsl_mult': 0.9428422300625253, 'sideways_time_stop': 233, 'sideways_use_sma': False, 'sideways_use_ema': True, 'sideways_use_atr': True, 'sideways_use_adx': False, 'sideways_use_spike': True, 'sideways_rsi_required': True}.
[I 2025-08-30 22:34:56,672] Trial 867 finished with values: [-1000000000.0, 1000000000.0] and parameters: {'p_sma': 33, 'p_std': 47, 'p_atr': 24, 'p_adx': 7, 'rsi_period': 76, 'ema1': 14, 'ema2': 18, 'slip_atr_k': 0.0007348139732543328, 'slip_spread_k': 0.7111242648042579, 'spread_hl_frac': 0.010279090500143943, 'bb_std_mult': 2.959806870445012, 'rsi_os': 17, 'rsi_ob': 86, 'vol_spike': 0.01605308870852412, 'adx_thresh': 5.082892869469371, 'atr_min_pct': 0.014844934189273677, 'atr_max_pct': 0.07158962399248768, 'tp_mult': 1.3810700936510956, 'tsl_mult': 0.2770078120336403, 'strategy': 'mean_reversion', 'time_stop': 123, 'use_sma': True, 'use_atr': False, 'use_adx': True, 'use_ema': True, 'use_spike': True, 'rsi_required': False, 'edge_k': 1.3567840554890807, 'edge_cap': 0.09610503690962895, 'bull_strategy': 'breakout', 'bull_bb_std_mult': 2.13349567148702, 'bull_rsi_os': 43, 'bull_rsi_ob': 83, 'bull_adx_thresh': 20.88409743832718, 'bull_atr_min_pct': 0.006721906966514377, 'bull_atr_max_pct': 0.042091549084495, 'bull_tp_mult': 2.197146720088851, 'bull_tsl_mult': 0.5996235368141991, 'bull_time_stop': 275, 'bull_use_sma': True, 'bull_use_ema': False, 'bull_use_atr': False, 'bull_use_adx': True, 'bull_use_spike': True, 'bull_rsi_required': False, 'bear_strategy': 'breakout', 'bear_bb_std_mult': 1.699627385198591, 'bear_rsi_os': 14, 'bear_rsi_ob': 76, 'bear_adx_thresh': 30.206201044359602, 'bear_atr_min_pct': 0.026430041152490875, 'bear_atr_max_pct': 0.12736301209054385, 'bear_tp_mult': 2.6012970828507633, 'bear_tsl_mult': 0.5555985708145545, 'bear_time_stop': 266, 'bear_use_sma': True, 'bear_use_ema': False, 'bear_use_atr': True, 'bear_use_adx': True, 'bear_use_spike': True, 'bear_rsi_required': False, 'sideways_strategy': 'mean_reversion', 'sideways_bb_std_mult': 2.573671929049241, 'sideways_rsi_os': 33, 'sideways_rsi_ob': 45, 'sideways_adx_thresh': 25.779862695005445, 'sideways_atr_min_pct': 0.019704972491342877, 'sideways_atr_max_pct': 0.09628136930614044, 'sideways_tp_mult': 2.2986525659209773, 'sideways_tsl_mult': 0.8785193810699855, 'sideways_time_stop': 228, 'sideways_use_sma': False, 'sideways_use_ema': True, 'sideways_use_atr': True, 'sideways_use_adx': False, 'sideways_use_spike': True, 'sideways_rsi_required': True}.
[I 2025-08-30 22:34:57,225] Trial 865 finished with values: [-1000000000.0, 1000000000.0] and parameters: {'p_sma': 16, 'p_std': 47, 'p_atr': 25, 'p_adx': 7, 'rsi_period': 77, 'ema1': 16, 'ema2': 18, 'slip_atr_k': 0.007159755130801803, 'slip_spread_k': 0.7101972647535102, 'spread_hl_frac': 0.0018932679186051474, 'bb_std_mult': 2.9756791414695907, 'rsi_os': 17, 'rsi_ob': 95, 'vol_spike': 0.034512944081067476, 'adx_thresh': 5.080027278491615, 'atr_min_pct': 0.016413360395006488, 'atr_max_pct': 0.07032972554296552, 'tp_mult': 1.469754121904897, 'tsl_mult': 0.18107287193408841, 'strategy': 'mean_reversion', 'time_stop': 113, 'use_sma': True, 'use_atr': False, 'use_adx': True, 'use_ema': False, 'use_spike': True, 'rsi_required': False, 'edge_k': 1.36875318712181, 'edge_cap': 0.09654304436415377, 'bull_strategy': 'breakout', 'bull_bb_std_mult': 2.143381410158815, 'bull_rsi_os': 42, 'bull_rsi_ob': 81, 'bull_adx_thresh': 17.781617641998487, 'bull_atr_min_pct': 0.0022418244248136503, 'bull_atr_max_pct': 0.04081520160906657, 'bull_tp_mult': 2.0996609075100467, 'bull_tsl_mult': 0.6041116329618024, 'bull_time_stop': 275, 'bull_use_sma': True, 'bull_use_ema': True, 'bull_use_atr': False, 'bull_use_adx': True, 'bull_use_spike': True, 'bull_rsi_required': False, 'bear_strategy': 'breakout', 'bear_bb_std_mult': 1.6207943515300804, 'bear_rsi_os': 15, 'bear_rsi_ob': 77, 'bear_adx_thresh': 20.808820014784065, 'bear_atr_min_pct': 0.026448544549412003, 'bear_atr_max_pct': 0.12674211507800737, 'bear_tp_mult': 2.479015927529681, 'bear_tsl_mult': 0.5650650262483453, 'bear_time_stop': 266, 'bear_use_sma': True, 'bear_use_ema': False, 'bear_use_atr': True, 'bear_use_adx': True, 'bear_use_spike': True, 'bear_rsi_required': False, 'sideways_strategy': 'mean_reversion', 'sideways_bb_std_mult': 2.6157026540071056, 'sideways_rsi_os': 30, 'sideways_rsi_ob': 45, 'sideways_adx_thresh': 26.029950910922253, 'sideways_atr_min_pct': 0.019444919402586747, 'sideways_atr_max_pct': 0.0966568798688246, 'sideways_tp_mult': 2.2550556858099555, 'sideways_tsl_mult': 0.9278252812072472, 'sideways_time_stop': 241, 'sideways_use_sma': True, 'sideways_use_ema': True, 'sideways_use_atr': True, 'sideways_use_adx': False, 'sideways_use_spike': True, 'sideways_rsi_required': True}.
[I 2025-08-30 22:34:57,240] Trial 866 finished with values: [-1000000000.0, 1000000000.0] and parameters: {'p_sma': 39, 'p_std': 44, 'p_atr': 25, 'p_adx': 7, 'rsi_period': 76, 'ema1': 16, 'ema2': 17, 'slip_atr_k': 0.000210205435930612, 'slip_spread_k': 0.707758680535161, 'spread_hl_frac': 0.009335240879203356, 'bb_std_mult': 3.301096007930959, 'rsi_os': 15, 'rsi_ob': 86, 'vol_spike': 0.03418148099592454, 'adx_thresh': 5.20676008306019, 'atr_min_pct': 0.014498308441287295, 'atr_max_pct': 0.07131615846554253, 'tp_mult': 1.3870741925396282, 'tsl_mult': 0.2258341654517686, 'strategy': 'mean_reversion', 'time_stop': 110, 'use_sma': True, 'use_atr': False, 'use_adx': True, 'use_ema': True, 'use_spike': True, 'rsi_required': False, 'edge_k': 1.3552042179288164, 'edge_cap': 0.09056131292475711, 'bull_strategy': 'breakout', 'bull_bb_std_mult': 2.127729078116147, 'bull_rsi_os': 42, 'bull_rsi_ob': 83, 'bull_adx_thresh': 18.125353380473324, 'bull_atr_min_pct': 0.006694012891659133, 'bull_atr_max_pct': 0.041118199276390315, 'bull_tp_mult': 2.1921470763928173, 'bull_tsl_mult': 0.5975057617576454, 'bull_time_stop': 275, 'bull_use_sma': True, 'bull_use_ema': True, 'bull_use_atr': False, 'bull_use_adx': True, 'bull_use_spike': True, 'bull_rsi_required': False, 'bear_strategy': 'breakout', 'bear_bb_std_mult': 1.601657826411076, 'bear_rsi_os': 12, 'bear_rsi_ob': 76, 'bear_adx_thresh': 18.213476332299212, 'bear_atr_min_pct': 0.025770542910686485, 'bear_atr_max_pct': 0.12658697145779035, 'bear_tp_mult': 2.4920838585194613, 'bear_tsl_mult': 0.5616228380617319, 'bear_time_stop': 266, 'bear_use_sma': True, 'bear_use_ema': True, 'bear_use_atr': True, 'bear_use_adx': True, 'bear_use_spike': True, 'bear_rsi_required': False, 'sideways_strategy': 'mean_reversion', 'sideways_bb_std_mult': 2.593824683609008, 'sideways_rsi_os': 33, 'sideways_rsi_ob': 45, 'sideways_adx_thresh': 25.97064465236974, 'sideways_atr_min_pct': 0.019390743533648634, 'sideways_atr_max_pct': 0.09809079363192919, 'sideways_tp_mult': 2.2481000476410036, 'sideways_tsl_mult': 0.932797400641384, 'sideways_time_stop': 228, 'sideways_use_sma': False, 'sideways_use_ema': True, 'sideways_use_atr': True, 'sideways_use_adx': False, 'sideways_use_spike': True, 'sideways_rsi_required': True}.
[I 2025-08-30 22:35:31,814] Trial 869 finished with values: [-1000000000.0, 1000000000.0] and parameters: {'p_sma': 37, 'p_std': 45, 'p_atr': 25, 'p_adx': 8, 'rsi_period': 77, 'ema1': 15, 'ema2': 20, 'slip_atr_k': 3.0231539149002057e-05, 'slip_spread_k': 0.706303226515836, 'spread_hl_frac': 0.010088565333099188, 'bb_std_mult': 2.9038299407970563, 'rsi_os': 15, 'rsi_ob': 84, 'vol_spike': 0.035489944980436144, 'adx_thresh': 6.60674847712535, 'atr_min_pct': 0.01490540593488424, 'atr_max_pct': 0.07247027304399152, 'tp_mult': 1.4112032771526837, 'tsl_mult': 0.4036678967595294, 'strategy': 'mean_reversion', 'time_stop': 108, 'use_sma': True, 'use_atr': False, 'use_adx': True, 'use_ema': True, 'use_spike': True, 'rsi_required': True, 'edge_k': 1.3438302393111305, 'edge_cap': 0.10367741645654521, 'bull_strategy': 'breakout', 'bull_bb_std_mult': 2.1165110697697482, 'bull_rsi_os': 39, 'bull_rsi_ob': 83, 'bull_adx_thresh': 21.17071653803928, 'bull_atr_min_pct': 0.001972943916719667, 'bull_atr_max_pct': 0.04272286373964499, 'bull_tp_mult': 2.1916019258535853, 'bull_tsl_mult': 0.594891259441328, 'bull_time_stop': 274, 'bull_use_sma': True, 'bull_use_ema': False, 'bull_use_atr': False, 'bull_use_adx': True, 'bull_use_spike': True, 'bull_rsi_required': False, 'bear_strategy': 'breakout', 'bear_bb_std_mult': 1.7345017219261374, 'bear_rsi_os': 16, 'bear_rsi_ob': 76, 'bear_adx_thresh': 34.334064619727, 'bear_atr_min_pct': 0.02743472619176128, 'bear_atr_max_pct': 0.12647416157591246, 'bear_tp_mult': 2.452386071294192, 'bear_tsl_mult': 0.6234424429981132, 'bear_time_stop': 265, 'bear_use_sma': True, 'bear_use_ema': True, 'bear_use_atr': True, 'bear_use_adx': True, 'bear_use_spike': True, 'bear_rsi_required': False, 'sideways_strategy': 'mean_reversion', 'sideways_bb_std_mult': 2.650794011924882, 'sideways_rsi_os': 29, 'sideways_rsi_ob': 52, 'sideways_adx_thresh': 25.50179606331731, 'sideways_atr_min_pct': 0.019471284474148354, 'sideways_atr_max_pct': 0.08981687916527312, 'sideways_tp_mult': 2.1413704982315984, 'sideways_tsl_mult': 0.8732239352733878, 'sideways_time_stop': 228, 'sideways_use_sma': False, 'sideways_use_ema': True, 'sideways_use_atr': False, 'sideways_use_adx': False, 'sideways_use_spike': True, 'sideways_rsi_required': True}.
[I 2025-08-30 22:35:31,825] Trial 871 finished with values: [-1000000000.0, 1000000000.0] and parameters: {'p_sma': 36, 'p_std': 44, 'p_atr': 28, 'p_adx': 8, 'rsi_period': 75, 'ema1': 15, 'ema2': 20, 'slip_atr_k': 0.00878249351974671, 'slip_spread_k': 0.6985822240773691, 'spread_hl_frac': 0.004115187340790846, 'bb_std_mult': 2.8686055005916984, 'rsi_os': 15, 'rsi_ob': 87, 'vol_spike': 0.021922764943338443, 'adx_thresh': 6.621622417172239, 'atr_min_pct': 0.015096054947285525, 'atr_max_pct': 0.07523177809969069, 'tp_mult': 1.4135780129656337, 'tsl_mult': 0.21898475302428544, 'strategy': 'mean_reversion', 'time_stop': 109, 'use_sma': True, 'use_atr': False, 'use_adx': True, 'use_ema': True, 'use_spike': True, 'rsi_required': True, 'edge_k': 1.2716196274182199, 'edge_cap': 0.10999184923059957, 'bull_strategy': 'mean_reversion', 'bull_bb_std_mult': 2.1209640146281226, 'bull_rsi_os': 39, 'bull_rsi_ob': 83, 'bull_adx_thresh': 18.18140360132641, 'bull_atr_min_pct': 0.0014092979291937878, 'bull_atr_max_pct': 0.035126215870229, 'bull_tp_mult': 2.175399432892926, 'bull_tsl_mult': 0.6552566643695505, 'bull_time_stop': 280, 'bull_use_sma': False, 'bull_use_ema': False, 'bull_use_atr': False, 'bull_use_adx': True, 'bull_use_spike': True, 'bull_rsi_required': False, 'bear_strategy': 'breakout', 'bear_bb_std_mult': 1.7333329762353866, 'bear_rsi_os': 12, 'bear_rsi_ob': 79, 'bear_adx_thresh': 18.833959706019623, 'bear_atr_min_pct': 0.027479914597882224, 'bear_atr_max_pct': 0.1262873492275785, 'bear_tp_mult': 2.455900941272473, 'bear_tsl_mult': 0.6270265265964333, 'bear_time_stop': 273, 'bear_use_sma': True, 'bear_use_ema': True, 'bear_use_atr': True, 'bear_use_adx': False, 'bear_use_spike': False, 'bear_rsi_required': False, 'sideways_strategy': 'mean_reversion', 'sideways_bb_std_mult': 2.6704572284430115, 'sideways_rsi_os': 30, 'sideways_rsi_ob': 55, 'sideways_adx_thresh': 25.012596096106833, 'sideways_atr_min_pct': 0.017880061992882505, 'sideways_atr_max_pct': 0.08206918919671283, 'sideways_tp_mult': 2.373879943779661, 'sideways_tsl_mult': 0.9133150714303236, 'sideways_time_stop': 228, 'sideways_use_sma': False, 'sideways_use_ema': True, 'sideways_use_atr': False, 'sideways_use_adx': False, 'sideways_use_spike': True, 'sideways_rsi_required': True}.
[I 2025-08-30 22:35:32,154] Trial 870 finished with values: [-1000000000.0, 1000000000.0] and parameters: {'p_sma': 39, 'p_std': 45, 'p_atr': 28, 'p_adx': 8, 'rsi_period': 76, 'ema1': 15, 'ema2': 20, 'slip_atr_k': 0.009158940289014195, 'slip_spread_k': 0.698973669960971, 'spread_hl_frac': 0.002397714754477697, 'bb_std_mult': 3.4507836734601414, 'rsi_os': 15, 'rsi_ob': 84, 'vol_spike': 0.036683765510408535, 'adx_thresh': 6.593068461399944, 'atr_min_pct': 0.01607097651510946, 'atr_max_pct': 0.0694388414369162, 'tp_mult': 1.4865274943298923, 'tsl_mult': 0.23057667751133878, 'strategy': 'mean_reversion', 'time_stop': 108, 'use_sma': True, 'use_atr': False, 'use_adx': True, 'use_ema': True, 'use_spike': True, 'rsi_required': True, 'edge_k': 1.3007778855533851, 'edge_cap': 0.10637406739641585, 'bull_strategy': 'breakout', 'bull_bb_std_mult': 2.1619796778066154, 'bull_rsi_os': 39, 'bull_rsi_ob': 83, 'bull_adx_thresh': 9.756072777912067, 'bull_atr_min_pct': 0.001994195388853862, 'bull_atr_max_pct': 0.04303367238336059, 'bull_tp_mult': 2.172091004588962, 'bull_tsl_mult': 0.6544220911216703, 'bull_time_stop': 276, 'bull_use_sma': False, 'bull_use_ema': False, 'bull_use_atr': False, 'bull_use_adx': True, 'bull_use_spike': True, 'bull_rsi_required': False, 'bear_strategy': 'breakout', 'bear_bb_std_mult': 1.646979706115921, 'bear_rsi_os': 15, 'bear_rsi_ob': 79, 'bear_adx_thresh': 34.07386455930115, 'bear_atr_min_pct': 0.025660543248963878, 'bear_atr_max_pct': 0.13109569335843357, 'bear_tp_mult': 2.4403335479772714, 'bear_tsl_mult': 0.6242195819930471, 'bear_time_stop': 272, 'bear_use_sma': True, 'bear_use_ema': True, 'bear_use_atr': True, 'bear_use_adx': True, 'bear_use_spike': True, 'bear_rsi_required': False, 'sideways_strategy': 'mean_reversion', 'sideways_bb_std_mult': 2.671396861176749, 'sideways_rsi_os': 28, 'sideways_rsi_ob': 56, 'sideways_adx_thresh': 25.829229843566303, 'sideways_atr_min_pct': 0.01929575954547449, 'sideways_atr_max_pct': 0.08184893092523085, 'sideways_tp_mult': 2.3663233475423833, 'sideways_tsl_mult': 0.9277131175239517, 'sideways_time_stop': 243, 'sideways_use_sma': False, 'sideways_use_ema': True, 'sideways_use_atr': False, 'sideways_use_adx': False, 'sideways_use_spike': True, 'sideways_rsi_required': True}.
[I 2025-08-30 22:35:32,154] Trial 872 finished with values: [-1000000000.0, 1000000000.0] and parameters: {'p_sma': 37, 'p_std': 45, 'p_atr': 26, 'p_adx': 8, 'rsi_period': 79, 'ema1': 15, 'ema2': 20, 'slip_atr_k': 0.008610380336865012, 'slip_spread_k': 0.6967881776835724, 'spread_hl_frac': 0.004127022312989143, 'bb_std_mult': 2.8505915633130186, 'rsi_os': 14, 'rsi_ob': 84, 'vol_spike': 0.02219218852479718, 'adx_thresh': 7.188776178283051, 'atr_min_pct': 0.015389637113817002, 'atr_max_pct': 0.07231242534806553, 'tp_mult': 1.419524143103208, 'tsl_mult': 0.4073939378790792, 'strategy': 'mean_reversion', 'time_stop': 106, 'use_sma': True, 'use_atr': False, 'use_adx': True, 'use_ema': True, 'use_spike': True, 'rsi_required': True, 'edge_k': 1.2683877911472365, 'edge_cap': 0.1134333657953682, 'bull_strategy': 'mean_reversion', 'bull_bb_std_mult': 2.2508095878018435, 'bull_rsi_os': 39, 'bull_rsi_ob': 83, 'bull_adx_thresh': 9.388062970307828, 'bull_atr_min_pct': 0.0014631436225407703, 'bull_atr_max_pct': 0.04314891271692638, 'bull_tp_mult': 2.1768793490851013, 'bull_tsl_mult': 0.6587975894183231, 'bull_time_stop': 278, 'bull_use_sma': False, 'bull_use_ema': False, 'bull_use_atr': False, 'bull_use_adx': True, 'bull_use_spike': True, 'bull_rsi_required': False, 'bear_strategy': 'breakout', 'bear_bb_std_mult': 1.702565693622869, 'bear_rsi_os': 13, 'bear_rsi_ob': 79, 'bear_adx_thresh': 31.307225541361536, 'bear_atr_min_pct': 0.027328019282766992, 'bear_atr_max_pct': 0.1250978079326639, 'bear_tp_mult': 2.446049702119854, 'bear_tsl_mult': 0.6199127340426437, 'bear_time_stop': 277, 'bear_use_sma': True, 'bear_use_ema': True, 'bear_use_atr': True, 'bear_use_adx': False, 'bear_use_spike': False, 'bear_rsi_required': False, 'sideways_strategy': 'mean_reversion', 'sideways_bb_std_mult': 2.6753761343169162, 'sideways_rsi_os': 45, 'sideways_rsi_ob': 52, 'sideways_adx_thresh': 25.575350142988068, 'sideways_atr_min_pct': 0.01731356606859847, 'sideways_atr_max_pct': 0.0889147768658167, 'sideways_tp_mult': 2.383855257601461, 'sideways_tsl_mult': 0.9132857373278108, 'sideways_time_stop': 244, 'sideways_use_sma': False, 'sideways_use_ema': True, 'sideways_use_atr': False, 'sideways_use_adx': False, 'sideways_use_spike': True, 'sideways_rsi_required': True}.
