[I 2025-08-30 21:35:46,720] Trial 377 finished with values: [-1000000000.0, 1000000000.0] and parameters: {'p_sma': 31, 'p_std': 24, 'p_atr': 22, 'p_adx': 20, 'rsi_period': 81, 'ema1': 19, 'ema2': 49, 'slip_atr_k': 0.02546617084406429, 'slip_spread_k': 0.6203868296868266, 'spread_hl_frac': 0.03411806050139979, 'bb_std_mult': 1.4949568795469046, 'rsi_os': 8, 'rsi_ob': 64, 'vol_spike': 0.074135706838383, 'adx_thresh': 14.961562103343846, 'atr_min_pct': 0.009831719306044635, 'atr_max_pct': 0.10684845298197711, 'tp_mult': 2.078988665102142, 'tsl_mult': 0.7767287629420163, 'strategy': 'mean_reversion', 'time_stop': 162, 'use_sma': True, 'use_atr': False, 'use_adx': True, 'use_ema': False, 'use_spike': True, 'rsi_required': True, 'edge_k': 1.4208092425609866, 'edge_cap': 0.7079994429661856, 'bull_strategy': 'breakout', 'bull_bb_std_mult': 2.6308204684122733, 'bull_rsi_os': 12, 'bull_rsi_ob': 81, 'bull_adx_thresh': 15.27350455544389, 'bull_atr_min_pct': 0.009074294786703348, 'bull_atr_max_pct': 0.04842399165152922, 'bull_tp_mult': 2.182481288265237, 'bull_tsl_mult': 0.3126470531370216, 'bull_time_stop': 288, 'bull_use_sma': True, 'bull_use_ema': True, 'bull_use_atr': False, 'bull_use_adx': True, 'bull_use_spike': False, 'bull_rsi_required': True, 'bear_strategy': 'mean_reversion', 'bear_bb_std_mult': 2.646825554501596, 'bear_rsi_os': 37, 'bear_rsi_ob': 77, 'bear_adx_thresh': 12.410373194392175, 'bear_atr_min_pct': 0.027463184880972484, 'bear_atr_max_pct': 0.14849064572259427, 'bear_tp_mult': 1.468744343245583, 'bear_tsl_mult': 0.38999380512693754, 'bear_time_stop': 76, 'bear_use_sma': False, 'bear_use_ema': True, 'bear_use_atr': False, 'bear_use_adx': True, 'bear_use_spike': True, 'bear_rsi_required': True, 'sideways_strategy': 'breakout', 'sideways_bb_std_mult': 3.222766935736671, 'sideways_rsi_os': 10, 'sideways_rsi_ob': 83, 'sideways_adx_thresh': 7.222685497585676, 'sideways_atr_min_pct': 0.01889538219950419, 'sideways_atr_max_pct': 0.14635587236027806, 'sideways_tp_mult': 1.6092491407121239, 'sideways_tsl_mult': 0.9318716459875883, 'sideways_time_stop': 261, 'sideways_use_sma': False, 'sideways_use_ema': False, 'sideways_use_atr': False, 'sideways_use_adx': True, 'sideways_use_spike': False, 'sideways_rsi_required': False}.
[I 2025-08-30 21:35:46,909] Trial 379 finished with values: [-1000000000.0, 1000000000.0] and parameters: {'p_sma': 33, 'p_std': 33, 'p_atr': 22, 'p_adx': 22, 'rsi_period': 69, 'ema1': 27, 'ema2': 56, 'slip_atr_k': 0.007411566744546554, 'slip_spread_k': 0.6024949448639912, 'spread_hl_frac': 0.033907681160041746, 'bb_std_mult': 1.3679601584918946, 'rsi_os': 27, 'rsi_ob': 67, 'vol_spike': 0.0558107447944597, 'adx_thresh': 20.417919468979832, 'atr_min_pct': 0.013869343519687344, 'atr_max_pct': 0.09775627828326895, 'tp_mult': 1.1872838422207628, 'tsl_mult': 0.7684234772671907, 'strategy': 'breakout', 'time_stop': 140, 'use_sma': True, 'use_atr': False, 'use_adx': True, 'use_ema': True, 'use_spike': True, 'rsi_required': True, 'edge_k': 1.4226123532857315, 'edge_cap': 0.6946496406120091, 'bull_strategy': 'breakout', 'bull_bb_std_mult': 2.8573066595846486, 'bull_rsi_os': 11, 'bull_rsi_ob': 84, 'bull_adx_thresh': 15.10373239001197, 'bull_atr_min_pct': 0.0015592430394485886, 'bull_atr_max_pct': 0.04920214270094889, 'bull_tp_mult': 2.1711258979604358, 'bull_tsl_mult': 0.375290444893951, 'bull_time_stop': 20, 'bull_use_sma': True, 'bull_use_ema': False, 'bull_use_atr': True, 'bull_use_adx': True, 'bull_use_spike': False, 'bull_rsi_required': True, 'bear_strategy': 'mean_reversion', 'bear_bb_std_mult': 2.6585379959810185, 'bear_rsi_os': 32, 'bear_rsi_ob': 75, 'bear_adx_thresh': 14.847919970470464, 'bear_atr_min_pct': 0.027683111579363973, 'bear_atr_max_pct': 0.12200902696557359, 'bear_tp_mult': 1.7260055938261478, 'bear_tsl_mult': 0.36998857265123836, 'bear_time_stop': 78, 'bear_use_sma': False, 'bear_use_ema': True, 'bear_use_atr': False, 'bear_use_adx': True, 'bear_use_spike': True, 'bear_rsi_required': True, 'sideways_strategy': 'breakout', 'sideways_bb_std_mult': 0.5552602320273565, 'sideways_rsi_os': 49, 'sideways_rsi_ob': 81, 'sideways_adx_thresh': 16.05442816049618, 'sideways_atr_min_pct': 0.02012454196117569, 'sideways_atr_max_pct': 0.13934965358099735, 'sideways_tp_mult': 1.967680351672336, 'sideways_tsl_mult': 0.5959402000980331, 'sideways_time_stop': 269, 'sideways_use_sma': False, 'sideways_use_ema': False, 'sideways_use_atr': False, 'sideways_use_adx': True, 'sideways_use_spike': False, 'sideways_rsi_required': False}.
[I 2025-08-30 21:35:47,003] Trial 378 finished with values: [-1000000000.0, 1000000000.0] and parameters: {'p_sma': 21, 'p_std': 33, 'p_atr': 18, 'p_adx': 23, 'rsi_period': 79, 'ema1': 27, 'ema2': 49, 'slip_atr_k': 0.026390818416400213, 'slip_spread_k': 0.6135046588947568, 'spread_hl_frac': 0.03021120805870371, 'bb_std_mult': 1.5125354879270199, 'rsi_os': 8, 'rsi_ob': 66, 'vol_spike': 0.07619953392628315, 'adx_thresh': 14.05915646141366, 'atr_min_pct': 0.0097683532695237, 'atr_max_pct': 0.10757859040811432, 'tp_mult': 2.369217786956882, 'tsl_mult': 0.7728638185193055, 'strategy': 'mean_reversion', 'time_stop': 141, 'use_sma': True, 'use_atr': False, 'use_adx': True, 'use_ema': True, 'use_spike': True, 'rsi_required': True, 'edge_k': 1.4159274806075914, 'edge_cap': 0.7152597380066517, 'bull_strategy': 'breakout', 'bull_bb_std_mult': 2.8716553348778926, 'bull_rsi_os': 16, 'bull_rsi_ob': 90, 'bull_adx_thresh': 11.510716376080742, 'bull_atr_min_pct': 0.0018048228336283484, 'bull_atr_max_pct': 0.048103870213951176, 'bull_tp_mult': 2.158206081188504, 'bull_tsl_mult': 0.3065540762136628, 'bull_time_stop': 244, 'bull_use_sma': True, 'bull_use_ema': False, 'bull_use_atr': False, 'bull_use_adx': True, 'bull_use_spike': False, 'bull_rsi_required': True, 'bear_strategy': 'mean_reversion', 'bear_bb_std_mult': 2.6768371764201215, 'bear_rsi_os': 37, 'bear_rsi_ob': 78, 'bear_adx_thresh': 14.745158421969998, 'bear_atr_min_pct': 0.028897777682540628, 'bear_atr_max_pct': 0.14864257435902625, 'bear_tp_mult': 1.7199931234725905, 'bear_tsl_mult': 0.370876418086988, 'bear_time_stop': 102, 'bear_use_sma': False, 'bear_use_ema': True, 'bear_use_atr': False, 'bear_use_adx': True, 'bear_use_spike': True, 'bear_rsi_required': True, 'sideways_strategy': 'breakout', 'sideways_bb_std_mult': 1.6991988926928179, 'sideways_rsi_os': 9, 'sideways_rsi_ob': 82, 'sideways_adx_thresh': 22.534704016000408, 'sideways_atr_min_pct': 0.02472089965640903, 'sideways_atr_max_pct': 0.1391792368313108, 'sideways_tp_mult': 1.405391645523562, 'sideways_tsl_mult': 0.9352320012745687, 'sideways_time_stop': 5, 'sideways_use_sma': False, 'sideways_use_ema': False, 'sideways_use_atr': False, 'sideways_use_adx': True, 'sideways_use_spike': False, 'sideways_rsi_required': False}.
[I 2025-08-30 21:36:21,233] Trial 381 finished with values: [-1000000000.0, 1000000000.0] and parameters: {'p_sma': 31, 'p_std': 53, 'p_atr': 22, 'p_adx': 23, 'rsi_period': 76, 'ema1': 17, 'ema2': 59, 'slip_atr_k': 0.026207784457854266, 'slip_spread_k': 0.6544483785630064, 'spread_hl_frac': 0.02684445321758299, 'bb_std_mult': 1.5149084695393384, 'rsi_os': 10, 'rsi_ob': 72, 'vol_spike': 0.09346343899337438, 'adx_thresh': 13.106480056207463, 'atr_min_pct': 0.014018883293938434, 'atr_max_pct': 0.10160795490550721, 'tp_mult': 1.6509538487866278, 'tsl_mult': 0.813129798589433, 'strategy': 'mean_reversion', 'time_stop': 269, 'use_sma': True, 'use_atr': True, 'use_adx': True, 'use_ema': True, 'use_spike': True, 'rsi_required': True, 'edge_k': 1.2123377360389689, 'edge_cap': 0.677795311290452, 'bull_strategy': 'breakout', 'bull_bb_std_mult': 2.462023816429351, 'bull_rsi_os': 12, 'bull_rsi_ob': 85, 'bull_adx_thresh': 20.50682019827255, 'bull_atr_min_pct': 0.014629024355952277, 'bull_atr_max_pct': 0.04851601805409164, 'bull_tp_mult': 2.191356674581616, 'bull_tsl_mult': 0.3880638468973061, 'bull_time_stop': 286, 'bull_use_sma': False, 'bull_use_ema': False, 'bull_use_atr': False, 'bull_use_adx': True, 'bull_use_spike': False, 'bull_rsi_required': True, 'bear_strategy': 'mean_reversion', 'bear_bb_std_mult': 1.1647588414232968, 'bear_rsi_os': 37, 'bear_rsi_ob': 77, 'bear_adx_thresh': 15.169458500990132, 'bear_atr_min_pct': 0.02739325061300083, 'bear_atr_max_pct': 0.012791184057417335, 'bear_tp_mult': 1.4212653431478142, 'bear_tsl_mult': 0.39995327787375173, 'bear_time_stop': 77, 'bear_use_sma': False, 'bear_use_ema': True, 'bear_use_atr': False, 'bear_use_adx': True, 'bear_use_spike': True, 'bear_rsi_required': True, 'sideways_strategy': 'breakout', 'sideways_bb_std_mult': 1.6978470906879848, 'sideways_rsi_os': 41, 'sideways_rsi_ob': 88, 'sideways_adx_thresh': 19.60091805364338, 'sideways_atr_min_pct': 0.02476486685203239, 'sideways_atr_max_pct': 0.14002404132991328, 'sideways_tp_mult': 1.9647486538113308, 'sideways_tsl_mult': 0.9831807527173915, 'sideways_time_stop': 268, 'sideways_use_sma': False, 'sideways_use_ema': False, 'sideways_use_atr': False, 'sideways_use_adx': True, 'sideways_use_spike': False, 'sideways_rsi_required': False}.
[I 2025-08-30 21:36:21,392] Trial 382 finished with values: [-1000000000.0, 1000000000.0] and parameters: {'p_sma': 21, 'p_std': 34, 'p_atr': 21, 'p_adx': 23, 'rsi_period': 76, 'ema1': 17, 'ema2': 51, 'slip_atr_k': 0.006259886667677447, 'slip_spread_k': 0.42611745011644486, 'spread_hl_frac': 0.02726655886173661, 'bb_std_mult': 1.4251197042373402, 'rsi_os': 10, 'rsi_ob': 58, 'vol_spike': 0.09111770176432656, 'adx_thresh': 17.001817604059713, 'atr_min_pct': 0.01147437608355513, 'atr_max_pct': 0.10194710905854465, 'tp_mult': 1.9179912350604595, 'tsl_mult': 0.8076336247326615, 'strategy': 'mean_reversion', 'time_stop': 143, 'use_sma': True, 'use_atr': True, 'use_adx': True, 'use_ema': True, 'use_spike': True, 'rsi_required': True, 'edge_k': 1.1836719226109425, 'edge_cap': 0.6768573447244193, 'bull_strategy': 'breakout', 'bull_bb_std_mult': 2.7777971440187295, 'bull_rsi_os': 16, 'bull_rsi_ob': 82, 'bull_adx_thresh': 10.730125934467473, 'bull_atr_min_pct': 0.014456416184920976, 'bull_atr_max_pct': 0.04904603548792412, 'bull_tp_mult': 2.293798753225105, 'bull_tsl_mult': 0.38264366258467974, 'bull_time_stop': 286, 'bull_use_sma': False, 'bull_use_ema': False, 'bull_use_atr': False, 'bull_use_adx': True, 'bull_use_spike': False, 'bull_rsi_required': False, 'bear_strategy': 'mean_reversion', 'bear_bb_std_mult': 2.6756828700732784, 'bear_rsi_os': 35, 'bear_rsi_ob': 72, 'bear_adx_thresh': 15.048386548733193, 'bear_atr_min_pct': 0.02880304130750115, 'bear_atr_max_pct': 0.129918440656934, 'bear_tp_mult': 1.7727365204619594, 'bear_tsl_mult': 0.4030310640634597, 'bear_time_stop': 84, 'bear_use_sma': False, 'bear_use_ema': True, 'bear_use_atr': False, 'bear_use_adx': True, 'bear_use_spike': True, 'bear_rsi_required': True, 'sideways_strategy': 'breakout', 'sideways_bb_std_mult': 1.710302835352585, 'sideways_rsi_os': 44, 'sideways_rsi_ob': 88, 'sideways_adx_thresh': 29.284816077944143, 'sideways_atr_min_pct': 0.023764753547786448, 'sideways_atr_max_pct': 0.14024369045691096, 'sideways_tp_mult': 1.989526508175572, 'sideways_tsl_mult': 0.978312121913639, 'sideways_time_stop': 264, 'sideways_use_sma': False, 'sideways_use_ema': False, 'sideways_use_atr': False, 'sideways_use_adx': True, 'sideways_use_spike': False, 'sideways_rsi_required': False}.
[I 2025-08-30 21:36:21,779] Trial 383 finished with values: [-1000000000.0, 1000000000.0] and parameters: {'p_sma': 8, 'p_std': 38, 'p_atr': 23, 'p_adx': 23, 'rsi_period': 74, 'ema1': 28, 'ema2': 59, 'slip_atr_k': 0.028168885524716556, 'slip_spread_k': 0.6586529100049962, 'spread_hl_frac': 0.02742981952309176, 'bb_std_mult': 1.514493067364448, 'rsi_os': 10, 'rsi_ob': 66, 'vol_spike': 0.06763989064558874, 'adx_thresh': 13.036205678559426, 'atr_min_pct': 0.008498377399706918, 'atr_max_pct': 0.10251032507482626, 'tp_mult': 1.6472043795903708, 'tsl_mult': 0.8082064816200549, 'strategy': 'mean_reversion', 'time_stop': 130, 'use_sma': True, 'use_atr': True, 'use_adx': False, 'use_ema': True, 'use_spike': False, 'rsi_required': True, 'edge_k': 1.175980970053022, 'edge_cap': 0.6658634308310927, 'bull_strategy': 'breakout', 'bull_bb_std_mult': 2.452772847179016, 'bull_rsi_os': 16, 'bull_rsi_ob': 85, 'bull_adx_thresh': 11.049036944422028, 'bull_atr_min_pct': 0.0014356743230843653, 'bull_atr_max_pct': 0.04651464881932994, 'bull_tp_mult': 2.851910973512476, 'bull_tsl_mult': 0.3179681160767721, 'bull_time_stop': 78, 'bull_use_sma': False, 'bull_use_ema': False, 'bull_use_atr': False, 'bull_use_adx': True, 'bull_use_spike': False, 'bull_rsi_required': False, 'bear_strategy': 'mean_reversion', 'bear_bb_std_mult': 0.8622069518540123, 'bear_rsi_os': 35, 'bear_rsi_ob': 77, 'bear_adx_thresh': 14.977818249273826, 'bear_atr_min_pct': 0.028869146207218855, 'bear_atr_max_pct': 0.012057882961862833, 'bear_tp_mult': 1.4096507047459306, 'bear_tsl_mult': 0.31641116233621885, 'bear_time_stop': 84, 'bear_use_sma': False, 'bear_use_ema': True, 'bear_use_atr': False, 'bear_use_adx': False, 'bear_use_spike': True, 'bear_rsi_required': False, 'sideways_strategy': 'breakout', 'sideways_bb_std_mult': 1.7127099797406047, 'sideways_rsi_os': 41, 'sideways_rsi_ob': 88, 'sideways_adx_thresh': 29.1817469084283, 'sideways_atr_min_pct': 0.023945052090221297, 'sideways_atr_max_pct': 0.14258658625081666, 'sideways_tp_mult': 1.0451371364851416, 'sideways_tsl_mult': 0.9749855597342036, 'sideways_time_stop': 174, 'sideways_use_sma': False, 'sideways_use_ema': False, 'sideways_use_atr': False, 'sideways_use_adx': True, 'sideways_use_spike': False, 'sideways_rsi_required': False}.
[I 2025-08-30 21:36:22,113] Trial 384 finished with values: [-1000000000.0, 1000000000.0] and parameters: {'p_sma': 25, 'p_std': 31, 'p_atr': 21, 'p_adx': 23, 'rsi_period': 73, 'ema1': 17, 'ema2': 60, 'slip_atr_k': 0.16502970520956492, 'slip_spread_k': 0.6618221712323658, 'spread_hl_frac': 0.027168092728331227, 'bb_std_mult': 1.2257185502412238, 'rsi_os': 10, 'rsi_ob': 63, 'vol_spike': 0.13787195989673912, 'adx_thresh': 13.029819254079058, 'atr_min_pct': 0.011886157153085181, 'atr_max_pct': 0.10197455687952733, 'tp_mult': 2.4836287619521737, 'tsl_mult': 0.8062203746025163, 'strategy': 'mean_reversion', 'time_stop': 132, 'use_sma': True, 'use_atr': True, 'use_adx': False, 'use_ema': True, 'use_spike': False, 'rsi_required': False, 'edge_k': 1.1712998828056618, 'edge_cap': 0.6441346799831847, 'bull_strategy': 'breakout', 'bull_bb_std_mult': 2.9853761184913377, 'bull_rsi_os': 30, 'bull_rsi_ob': 78, 'bull_adx_thresh': 18.656514422252613, 'bull_atr_min_pct': 0.0021503945560570124, 'bull_atr_max_pct': 0.040074114353363006, 'bull_tp_mult': 2.2897909097716513, 'bull_tsl_mult': 0.3811335974501735, 'bull_time_stop': 286, 'bull_use_sma': False, 'bull_use_ema': False, 'bull_use_atr': False, 'bull_use_adx': True, 'bull_use_spike': False, 'bull_rsi_required': False, 'bear_strategy': 'breakout', 'bear_bb_std_mult': 2.740810132143355, 'bear_rsi_os': 36, 'bear_rsi_ob': 80, 'bear_adx_thresh': 13.814644643960804, 'bear_atr_min_pct': 0.028869522646832367, 'bear_atr_max_pct': 0.012508110396397073, 'bear_tp_mult': 1.7672190051649594, 'bear_tsl_mult': 0.40310104793408014, 'bear_time_stop': 84, 'bear_use_sma': False, 'bear_use_ema': True, 'bear_use_atr': True, 'bear_use_adx': False, 'bear_use_spike': False, 'bear_rsi_required': False, 'sideways_strategy': 'mean_reversion', 'sideways_bb_std_mult': 1.772652041048838, 'sideways_rsi_os': 41, 'sideways_rsi_ob': 88, 'sideways_adx_thresh': 28.06287723642205, 'sideways_atr_min_pct': 0.02370552424074579, 'sideways_atr_max_pct': 0.14215825197783544, 'sideways_tp_mult': 2.0172815683322445, 'sideways_tsl_mult': 0.9714399645753556, 'sideways_time_stop': 93, 'sideways_use_sma': True, 'sideways_use_ema': False, 'sideways_use_atr': False, 'sideways_use_adx': True, 'sideways_use_spike': True, 'sideways_rsi_required': False}.
[I 2025-08-30 21:36:55,655] Trial 387 finished with values: [-1000000000.0, 1000000000.0] and parameters: {'p_sma': 25, 'p_std': 31, 'p_atr': 21, 'p_adx': 24, 'rsi_period': 73, 'ema1': 19, 'ema2': 53, 'slip_atr_k': 0.017579386810242292, 'slip_spread_k': 0.9069974166578526, 'spread_hl_frac': 0.03257590039859789, 'bb_std_mult': 1.4199829743454637, 'rsi_os': 12, 'rsi_ob': 62, 'vol_spike': 0.23241082913582056, 'adx_thresh': 16.320163095678158, 'atr_min_pct': 0.010426539212744336, 'atr_max_pct': 0.09813825408055554, 'tp_mult': 1.7151310796990697, 'tsl_mult': 0.8410862795669227, 'strategy': 'breakout', 'time_stop': 85, 'use_sma': True, 'use_atr': True, 'use_adx': False, 'use_ema': True, 'use_spike': False, 'rsi_required': False, 'edge_k': 1.3012785629374963, 'edge_cap': 0.6411945528234504, 'bull_strategy': 'breakout', 'bull_bb_std_mult': 3.0249657051188215, 'bull_rsi_os': 30, 'bull_rsi_ob': 78, 'bull_adx_thresh': 9.919756606257952, 'bull_atr_min_pct': 0.002399211616764733, 'bull_atr_max_pct': 0.04051430691210094, 'bull_tp_mult': 2.2237608058391123, 'bull_tsl_mult': 0.3665918834288867, 'bull_time_stop': 193, 'bull_use_sma': True, 'bull_use_ema': False, 'bull_use_atr': True, 'bull_use_adx': True, 'bull_use_spike': False, 'bull_rsi_required': True, 'bear_strategy': 'breakout', 'bear_bb_std_mult': 1.6228833955264168, 'bear_rsi_os': 36, 'bear_rsi_ob': 80, 'bear_adx_thresh': 13.87367250414736, 'bear_atr_min_pct': 0.029413748092897735, 'bear_atr_max_pct': 0.049534172565839224, 'bear_tp_mult': 1.659089111132092, 'bear_tsl_mult': 0.6303922179439718, 'bear_time_stop': 34, 'bear_use_sma': False, 'bear_use_ema': True, 'bear_use_atr': True, 'bear_use_adx': False, 'bear_use_spike': False, 'bear_rsi_required': False, 'sideways_strategy': 'mean_reversion', 'sideways_bb_std_mult': 1.792359575141084, 'sideways_rsi_os': 36, 'sideways_rsi_ob': 86, 'sideways_adx_thresh': 17.100577752496385, 'sideways_atr_min_pct': 0.021317608622720752, 'sideways_atr_max_pct': 0.14342461896463973, 'sideways_tp_mult': 2.033808405163853, 'sideways_tsl_mult': 0.9124065444815889, 'sideways_time_stop': 275, 'sideways_use_sma': True, 'sideways_use_ema': False, 'sideways_use_atr': False, 'sideways_use_adx': True, 'sideways_use_spike': True, 'sideways_rsi_required': False}.
[I 2025-08-30 21:36:55,988] Trial 388 finished with values: [-1000000000.0, 1000000000.0] and parameters: {'p_sma': 29, 'p_std': 49, 'p_atr': 20, 'p_adx': 25, 'rsi_period': 78, 'ema1': 19, 'ema2': 53, 'slip_atr_k': 0.01771928595361572, 'slip_spread_k': 0.6832785269077, 'spread_hl_frac': 0.0329504443256979, 'bb_std_mult': 1.4267310123232486, 'rsi_os': 38, 'rsi_ob': 60, 'vol_spike': 0.2908470112754004, 'adx_thresh': 18.710191255568123, 'atr_min_pct': 0.010256011343177569, 'atr_max_pct': 0.09798957523019716, 'tp_mult': 1.7365548892014862, 'tsl_mult': 0.8483462302833505, 'strategy': 'breakout', 'time_stop': 82, 'use_sma': True, 'use_atr': True, 'use_adx': True, 'use_ema': True, 'use_spike': True, 'rsi_required': False, 'edge_k': 1.2869648329473475, 'edge_cap': 0.6641477129248992, 'bull_strategy': 'breakout', 'bull_bb_std_mult': 3.08308126364579, 'bull_rsi_os': 38, 'bull_rsi_ob': 93, 'bull_adx_thresh': 13.89240988014768, 'bull_atr_min_pct': 0.0033563796283420256, 'bull_atr_max_pct': 0.046930594048587154, 'bull_tp_mult': 2.2298257675674633, 'bull_tsl_mult': 0.3621205995103321, 'bull_time_stop': 293, 'bull_use_sma': True, 'bull_use_ema': False, 'bull_use_atr': True, 'bull_use_adx': True, 'bull_use_spike': False, 'bull_rsi_required': True, 'bear_strategy': 'breakout', 'bear_bb_std_mult': 1.7729891913981883, 'bear_rsi_os': 16, 'bear_rsi_ob': 81, 'bear_adx_thresh': 13.26997554447707, 'bear_atr_min_pct': 0.02830598284921783, 'bear_atr_max_pct': 0.017021891095815436, 'bear_tp_mult': 1.6721617343799402, 'bear_tsl_mult': 0.3404932363810012, 'bear_time_stop': 98, 'bear_use_sma': False, 'bear_use_ema': True, 'bear_use_atr': True, 'bear_use_adx': True, 'bear_use_spike': False, 'bear_rsi_required': True, 'sideways_strategy': 'mean_reversion', 'sideways_bb_std_mult': 1.6412838378224714, 'sideways_rsi_os': 15, 'sideways_rsi_ob': 85, 'sideways_adx_thresh': 21.6240446541924, 'sideways_atr_min_pct': 0.02109334838031608, 'sideways_atr_max_pct': 0.14461398259670674, 'sideways_tp_mult': 2.0470016849772437, 'sideways_tsl_mult': 0.5635314445073342, 'sideways_time_stop': 84, 'sideways_use_sma': True, 'sideways_use_ema': False, 'sideways_use_atr': False, 'sideways_use_adx': True, 'sideways_use_spike': True, 'sideways_rsi_required': False}.
