[I 2025-08-30 21:08:21,734] Trial 170 finished with values: [-1000000000.0, 1000000000.0] and parameters: {'p_sma': 23, 'p_std': 22, 'p_atr': 13, 'p_adx': 28, 'rsi_period': 17, 'ema1': 18, 'ema2': 27, 'slip_atr_k': 0.014413528247503363, 'slip_spread_k': 0.741551193066944, 'spread_hl_frac': 0.027927581955312905, 'bb_std_mult': 1.5473695358100126, 'rsi_os': 42, 'rsi_ob': 58, 'vol_spike': 0.2506532993271227, 'adx_thresh': 27.463677968968867, 'atr_min_pct': 0.0010502670829692854, 'atr_max_pct': 0.10434709006245141, 'tp_mult': 1.763977796901178, 'tsl_mult': 0.7650349627419897, 'strategy': 'mean_reversion', 'time_stop': 208, 'use_sma': False, 'use_atr': True, 'use_adx': True, 'use_ema': True, 'use_spike': True, 'rsi_required': True, 'edge_k': 0.5726088753794862, 'edge_cap': 0.5485226080204997, 'bull_strategy': 'breakout', 'bull_bb_std_mult': 3.5180977144210868, 'bull_rsi_os': 42, 'bull_rsi_ob': 87, 'bull_adx_thresh': 16.878911273309104, 'bull_atr_min_pct': 0.0016331724571689275, 'bull_atr_max_pct': 0.08523009597520068, 'bull_tp_mult': 2.493727216708088, 'bull_tsl_mult': 0.17684272437159532, 'bull_time_stop': 282, 'bull_use_sma': True, 'bull_use_ema': False, 'bull_use_atr': False, 'bull_use_adx': True, 'bull_use_spike': True, 'bull_rsi_required': True, 'bear_strategy': 'mean_reversion', 'bear_bb_std_mult': 2.5780908359230907, 'bear_rsi_os': 52, 'bear_rsi_ob': 59, 'bear_adx_thresh': 21.351250952827186, 'bear_atr_min_pct': 0.021438954816805248, 'bear_atr_max_pct': 0.11076942921129768, 'bear_tp_mult': 2.999418014659784, 'bear_tsl_mult': 0.1841348190966318, 'bear_time_stop': 292, 'bear_use_sma': False, 'bear_use_ema': True, 'bear_use_atr': False, 'bear_use_adx': True, 'bear_use_spike': True, 'bear_rsi_required': True, 'sideways_strategy': 'breakout', 'sideways_bb_std_mult': 0.8009923193626756, 'sideways_rsi_os': 29, 'sideways_rsi_ob': 69, 'sideways_adx_thresh': 6.470452211119417, 'sideways_atr_min_pct': 0.009629713634837358, 'sideways_atr_max_pct': 0.14929672426815344, 'sideways_tp_mult': 2.143579030792692, 'sideways_tsl_mult': 0.3396271332202043, 'sideways_time_stop': 126, 'sideways_use_sma': False, 'sideways_use_ema': True, 'sideways_use_atr': False, 'sideways_use_adx': True, 'sideways_use_spike': False, 'sideways_rsi_required': True}.
[I 2025-08-30 21:08:22,281] Trial 172 finished with values: [-1000000000.0, 1000000000.0] and parameters: {'p_sma': 24, 'p_std': 37, 'p_atr': 25, 'p_adx': 27, 'rsi_period': 18, 'ema1': 20, 'ema2': 50, 'slip_atr_k': 0.015533466525523277, 'slip_spread_k': 0.4540585525985052, 'spread_hl_frac': 0.003518047062494255, 'bb_std_mult': 1.078533377405371, 'rsi_os': 45, 'rsi_ob': 74, 'vol_spike': 0.27531438166184286, 'adx_thresh': 23.46370968743049, 'atr_min_pct': 0.021338427277221825, 'atr_max_pct': 0.08693019051654038, 'tp_mult': 1.9013699610151356, 'tsl_mult': 0.8104742325941109, 'strategy': 'mean_reversion', 'time_stop': 72, 'use_sma': False, 'use_atr': True, 'use_adx': True, 'use_ema': True, 'use_spike': True, 'rsi_required': True, 'edge_k': 1.3966289692162575, 'edge_cap': 0.550182429846489, 'bull_strategy': 'breakout', 'bull_bb_std_mult': 3.521063132703631, 'bull_rsi_os': 49, 'bull_rsi_ob': 46, 'bull_adx_thresh': 18.1054223294693, 'bull_atr_min_pct': 0.01492014792980662, 'bull_atr_max_pct': 0.05742728342351539, 'bull_tp_mult': 2.498046293360929, 'bull_tsl_mult': 0.024019231057800457, 'bull_time_stop': 282, 'bull_use_sma': True, 'bull_use_ema': False, 'bull_use_atr': False, 'bull_use_adx': True, 'bull_use_spike': True, 'bull_rsi_required': True, 'bear_strategy': 'mean_reversion', 'bear_bb_std_mult': 2.920394268360663, 'bear_rsi_os': 33, 'bear_rsi_ob': 73, 'bear_adx_thresh': 16.450006535025224, 'bear_atr_min_pct': 0.01557044182930323, 'bear_atr_max_pct': 0.11291406791924637, 'bear_tp_mult': 2.905071855210966, 'bear_tsl_mult': 0.29218928088004853, 'bear_time_stop': 147, 'bear_use_sma': False, 'bear_use_ema': True, 'bear_use_atr': False, 'bear_use_adx': True, 'bear_use_spike': True, 'bear_rsi_required': True, 'sideways_strategy': 'breakout', 'sideways_bb_std_mult': 2.5923457727682946, 'sideways_rsi_os': 33, 'sideways_rsi_ob': 90, 'sideways_adx_thresh': 32.59513520721571, 'sideways_atr_min_pct': 0.008210461700241495, 'sideways_atr_max_pct': 0.010005368407702069, 'sideways_tp_mult': 2.5442865688451617, 'sideways_tsl_mult': 0.3354951052646247, 'sideways_time_stop': 112, 'sideways_use_sma': False, 'sideways_use_ema': True, 'sideways_use_atr': False, 'sideways_use_adx': True, 'sideways_use_spike': False, 'sideways_rsi_required': True}.
[I 2025-08-30 21:08:54,157] Trial 174 finished with values: [-1000000000.0, 1000000000.0] and parameters: {'p_sma': 26, 'p_std': 37, 'p_atr': 8, 'p_adx': 30, 'rsi_period': 77, 'ema1': 20, 'ema2': 38, 'slip_atr_k': 0.013401523293931211, 'slip_spread_k': 0.4574666425999304, 'spread_hl_frac': 0.00312160362854142, 'bb_std_mult': 2.516764715542685, 'rsi_os': 45, 'rsi_ob': 67, 'vol_spike': 0.2753774412965324, 'adx_thresh': 15.140604427970013, 'atr_min_pct': 0.0022012325888182954, 'atr_max_pct': 0.08796975998738249, 'tp_mult': 1.9034240775094822, 'tsl_mult': 0.8649452158921607, 'strategy': 'mean_reversion', 'time_stop': 207, 'use_sma': False, 'use_atr': True, 'use_adx': True, 'use_ema': True, 'use_spike': True, 'rsi_required': True, 'edge_k': 1.9352645914249806, 'edge_cap': 0.7458196228957148, 'bull_strategy': 'breakout', 'bull_bb_std_mult': 3.517808350046327, 'bull_rsi_os': 49, 'bull_rsi_ob': 49, 'bull_adx_thresh': 16.263166668727685, 'bull_atr_min_pct': 0.01476291075546301, 'bull_atr_max_pct': 0.024692012425987016, 'bull_tp_mult': 2.673958614469937, 'bull_tsl_mult': 0.031068904695167154, 'bull_time_stop': 300, 'bull_use_sma': True, 'bull_use_ema': False, 'bull_use_atr': False, 'bull_use_adx': True, 'bull_use_spike': True, 'bull_rsi_required': True, 'bear_strategy': 'mean_reversion', 'bear_bb_std_mult': 2.7491034273702666, 'bear_rsi_os': 49, 'bear_rsi_ob': 57, 'bear_adx_thresh': 16.61292291920119, 'bear_atr_min_pct': 0.007031957555806337, 'bear_atr_max_pct': 0.031934150951879216, 'bear_tp_mult': 1.0381155742766497, 'bear_tsl_mult': 0.292040398529905, 'bear_time_stop': 291, 'bear_use_sma': True, 'bear_use_ema': False, 'bear_use_atr': False, 'bear_use_adx': True, 'bear_use_spike': True, 'bear_rsi_required': True, 'sideways_strategy': 'breakout', 'sideways_bb_std_mult': 2.588130116173349, 'sideways_rsi_os': 40, 'sideways_rsi_ob': 67, 'sideways_adx_thresh': 32.70293485842616, 'sideways_atr_min_pct': 0.008342299127489352, 'sideways_atr_max_pct': 0.14897286739238222, 'sideways_tp_mult': 2.5525001365207443, 'sideways_tsl_mult': 0.26636104290641904, 'sideways_time_stop': 125, 'sideways_use_sma': False, 'sideways_use_ema': True, 'sideways_use_atr': True, 'sideways_use_adx': False, 'sideways_use_spike': False, 'sideways_rsi_required': True}.
[I 2025-08-30 21:08:54,521] Trial 173 finished with values: [-1000000000.0, 1000000000.0] and parameters: {'p_sma': 26, 'p_std': 7, 'p_atr': 17, 'p_adx': 27, 'rsi_period': 22, 'ema1': 20, 'ema2': 25, 'slip_atr_k': 0.005908769499259774, 'slip_spread_k': 0.03976381613416735, 'spread_hl_frac': 0.048802261293409144, 'bb_std_mult': 1.5608043595454875, 'rsi_os': 46, 'rsi_ob': 67, 'vol_spike': 0.27449859695399664, 'adx_thresh': 23.43492833179029, 'atr_min_pct': 0.0019216338220736926, 'atr_max_pct': 0.08902563007737982, 'tp_mult': 2.627880037711614, 'tsl_mult': 0.7668748764255704, 'strategy': 'mean_reversion', 'time_stop': 209, 'use_sma': False, 'use_atr': True, 'use_adx': True, 'use_ema': True, 'use_spike': True, 'rsi_required': True, 'edge_k': 1.4222651910351978, 'edge_cap': 0.6753852784867033, 'bull_strategy': 'breakout', 'bull_bb_std_mult': 1.5270951673463062, 'bull_rsi_os': 39, 'bull_rsi_ob': 87, 'bull_adx_thresh': 15.849772580487548, 'bull_atr_min_pct': 0.014848121371329724, 'bull_atr_max_pct': 0.05544600083300267, 'bull_tp_mult': 2.3857139294222547, 'bull_tsl_mult': 0.7146682779935234, 'bull_time_stop': 72, 'bull_use_sma': True, 'bull_use_ema': False, 'bull_use_atr': False, 'bull_use_adx': True, 'bull_use_spike': True, 'bull_rsi_required': True, 'bear_strategy': 'mean_reversion', 'bear_bb_std_mult': 1.4162507150577834, 'bear_rsi_os': 51, 'bear_rsi_ob': 55, 'bear_adx_thresh': 16.68398811209618, 'bear_atr_min_pct': 0.006288769583684815, 'bear_atr_max_pct': 0.11410953139114832, 'bear_tp_mult': 2.913885582200927, 'bear_tsl_mult': 0.1966288226987362, 'bear_time_stop': 107, 'bear_use_sma': True, 'bear_use_ema': True, 'bear_use_atr': False, 'bear_use_adx': True, 'bear_use_spike': True, 'bear_rsi_required': True, 'sideways_strategy': 'breakout', 'sideways_bb_std_mult': 1.0369635297931965, 'sideways_rsi_os': 40, 'sideways_rsi_ob': 67, 'sideways_adx_thresh': 18.961718604266807, 'sideways_atr_min_pct': 0.008263277646044124, 'sideways_atr_max_pct': 0.08822508858367553, 'sideways_tp_mult': 1.01002520260608, 'sideways_tsl_mult': 0.338470475547048, 'sideways_time_stop': 72, 'sideways_use_sma': False, 'sideways_use_ema': True, 'sideways_use_atr': True, 'sideways_use_adx': False, 'sideways_use_spike': False, 'sideways_rsi_required': True}.
[I 2025-08-30 21:08:54,821] Trial 175 finished with values: [-0.06302101174321018, 0.06295500426193666] and parameters: {'p_sma': 30, 'p_std': 8, 'p_atr': 16, 'p_adx': 30, 'rsi_period': 22, 'ema1': 20, 'ema2': 38, 'slip_atr_k': 0.052907355576678486, 'slip_spread_k': 0.4565980228234097, 'spread_hl_frac': 0.005939356404852531, 'bb_std_mult': 1.5868137465450236, 'rsi_os': 45, 'rsi_ob': 67, 'vol_spike': 0.27549408033770634, 'adx_thresh': 14.970779220378263, 'atr_min_pct': 0.0018274702166707227, 'atr_max_pct': 0.08712471013944728, 'tp_mult': 1.6395754400477567, 'tsl_mult': 0.8654040842582105, 'strategy': 'mean_reversion', 'time_stop': 274, 'use_sma': False, 'use_atr': True, 'use_adx': True, 'use_ema': True, 'use_spike': True, 'rsi_required': True, 'edge_k': 0.20044350877394745, 'edge_cap': 0.4782648478218545, 'bull_strategy': 'breakout', 'bull_bb_std_mult': 1.1531640389383677, 'bull_rsi_os': 17, 'bull_rsi_ob': 66, 'bull_adx_thresh': 25.373752828099754, 'bull_atr_min_pct': 0.009128193043872869, 'bull_atr_max_pct': 0.02450759220078013, 'bull_tp_mult': 1.8150456967138566, 'bull_tsl_mult': 0.5276378827234257, 'bull_time_stop': 294, 'bull_use_sma': True, 'bull_use_ema': False, 'bull_use_atr': False, 'bull_use_adx': True, 'bull_use_spike': True, 'bull_rsi_required': True, 'bear_strategy': 'mean_reversion', 'bear_bb_std_mult': 2.7752817744089158, 'bear_rsi_os': 49, 'bear_rsi_ob': 55, 'bear_adx_thresh': 16.494100229300468, 'bear_atr_min_pct': 0.0010561697539405845, 'bear_atr_max_pct': 0.014459020498985784, 'bear_tp_mult': 2.9103796317111525, 'bear_tsl_mult': 0.5195946328698261, 'bear_time_stop': 107, 'bear_use_sma': True, 'bear_use_ema': False, 'bear_use_atr': False, 'bear_use_adx': True, 'bear_use_spike': True, 'bear_rsi_required': True, 'sideways_strategy': 'breakout', 'sideways_bb_std_mult': 2.589038971771347, 'sideways_rsi_os': 40, 'sideways_rsi_ob': 67, 'sideways_adx_thresh': 11.31765652697697, 'sideways_atr_min_pct': 0.008325521768964608, 'sideways_atr_max_pct': 0.14002650543567513, 'sideways_tp_mult': 2.5505321477068805, 'sideways_tsl_mult': 0.26639253498339893, 'sideways_time_stop': 142, 'sideways_use_sma': False, 'sideways_use_ema': True, 'sideways_use_atr': True, 'sideways_use_adx': False, 'sideways_use_spike': False, 'sideways_rsi_required': True}.
[I 2025-08-30 21:08:54,989] Trial 176 finished with values: [-0.026346675142961073, 0.026267468734768012] and parameters: {'p_sma': 26, 'p_std': 15, 'p_atr': 16, 'p_adx': 30, 'rsi_period': 22, 'ema1': 20, 'ema2': 38, 'slip_atr_k': 0.05045528543426395, 'slip_spread_k': 0.6403642905729788, 'spread_hl_frac': 0.006039681173521232, 'bb_std_mult': 2.6247043223151514, 'rsi_os': 44, 'rsi_ob': 51, 'vol_spike': 0.2857900165466878, 'adx_thresh': 22.4250312641189, 'atr_min_pct': 0.001945661215595532, 'atr_max_pct': 0.09323796916871159, 'tp_mult': 1.6467513445822473, 'tsl_mult': 0.8588681956127493, 'strategy': 'breakout', 'time_stop': 276, 'use_sma': False, 'use_atr': True, 'use_adx': False, 'use_ema': True, 'use_spike': False, 'rsi_required': True, 'edge_k': 1.9153479687224815, 'edge_cap': 0.7484865615985115, 'bull_strategy': 'breakout', 'bull_bb_std_mult': 1.1447366816244129, 'bull_rsi_os': 20, 'bull_rsi_ob': 92, 'bull_adx_thresh': 16.247385677628102, 'bull_atr_min_pct': 0.0004040014075903972, 'bull_atr_max_pct': 0.12062342821229993, 'bull_tp_mult': 2.693946609559137, 'bull_tsl_mult': 0.7090603362896879, 'bull_time_stop': 294, 'bull_use_sma': True, 'bull_use_ema': True, 'bull_use_atr': True, 'bull_use_adx': True, 'bull_use_spike': True, 'bull_rsi_required': False, 'bear_strategy': 'mean_reversion', 'bear_bb_std_mult': 2.7685152458924875, 'bear_rsi_os': 49, 'bear_rsi_ob': 57, 'bear_adx_thresh': 16.94932048036041, 'bear_atr_min_pct': 0.016754573769278944, 'bear_atr_max_pct': 0.03263484095563264, 'bear_tp_mult': 2.929603066539094, 'bear_tsl_mult': 0.3369687149377227, 'bear_time_stop': 85, 'bear_use_sma': True, 'bear_use_ema': False, 'bear_use_atr': False, 'bear_use_adx': True, 'bear_use_spike': True, 'bear_rsi_required': False, 'sideways_strategy': 'breakout', 'sideways_bb_std_mult': 2.7408498825123124, 'sideways_rsi_os': 39, 'sideways_rsi_ob': 67, 'sideways_adx_thresh': 17.69297351145644, 'sideways_atr_min_pct': 0.00299057042892582, 'sideways_atr_max_pct': 0.017741588733179377, 'sideways_tp_mult': 2.6734700280636474, 'sideways_tsl_mult': 0.29568991754667395, 'sideways_time_stop': 141, 'sideways_use_sma': False, 'sideways_use_ema': True, 'sideways_use_atr': True, 'sideways_use_adx': False, 'sideways_use_spike': False, 'sideways_rsi_required': True}.
[I 2025-08-30 21:09:28,107] Trial 177 finished with values: [-0.04688518330892655, 0.04681445113540807] and parameters: {'p_sma': 33, 'p_std': 34, 'p_atr': 17, 'p_adx': 26, 'rsi_period': 22, 'ema1': 19, 'ema2': 31, 'slip_atr_k': 0.0774136346322353, 'slip_spread_k': 0.6421369990278943, 'spread_hl_frac': 0.006423741600392892, 'bb_std_mult': 2.6842366304115215, 'rsi_os': 47, 'rsi_ob': 76, 'vol_spike': 0.2897979229166603, 'adx_thresh': 22.362601882716334, 'atr_min_pct': 0.00883980932129394, 'atr_max_pct': 0.09666852049954128, 'tp_mult': 2.934461302519331, 'tsl_mult': 0.8502295899516732, 'strategy': 'breakout', 'time_stop': 277, 'use_sma': False, 'use_atr': False, 'use_adx': False, 'use_ema': True, 'use_spike': False, 'rsi_required': False, 'edge_k': 1.3412941061565227, 'edge_cap': 0.6742540934505911, 'bull_strategy': 'breakout', 'bull_bb_std_mult': 1.1379138788373853, 'bull_rsi_os': 20, 'bull_rsi_ob': 70, 'bull_adx_thresh': 5.104840365527007, 'bull_atr_min_pct': 0.021968625858881544, 'bull_atr_max_pct': 0.03531826428798275, 'bull_tp_mult': 2.694711143867686, 'bull_tsl_mult': 0.4866021954976945, 'bull_time_stop': 74, 'bull_use_sma': False, 'bull_use_ema': True, 'bull_use_atr': True, 'bull_use_adx': True, 'bull_use_spike': True, 'bull_rsi_required': False, 'bear_strategy': 'mean_reversion', 'bear_bb_std_mult': 0.8311713414557473, 'bear_rsi_os': 51, 'bear_rsi_ob': 59, 'bear_adx_thresh': 19.254377349760567, 'bear_atr_min_pct': 0.0009603173689058143, 'bear_atr_max_pct': 0.019657701490167497, 'bear_tp_mult': 2.922597595472764, 'bear_tsl_mult': 0.3400434925241245, 'bear_time_stop': 84, 'bear_use_sma': True, 'bear_use_ema': False, 'bear_use_atr': False, 'bear_use_adx': True, 'bear_use_spike': False, 'bear_rsi_required': False, 'sideways_strategy': 'breakout', 'sideways_bb_std_mult': 2.7269465374554276, 'sideways_rsi_os': 38, 'sideways_rsi_ob': 67, 'sideways_adx_thresh': 33.47906263922886, 'sideways_atr_min_pct': 0.016077272197822227, 'sideways_atr_max_pct': 0.11228706008683731, 'sideways_tp_mult': 1.255044022769882, 'sideways_tsl_mult': 0.2902873826610903, 'sideways_time_stop': 143, 'sideways_use_sma': True, 'sideways_use_ema': True, 'sideways_use_atr': True, 'sideways_use_adx': False, 'sideways_use_spike': True, 'sideways_rsi_required': True}.
[I 2025-08-30 21:09:28,469] Trial 178 finished with values: [-1000000000.0, 1000000000.0] and parameters: {'p_sma': 30, 'p_std': 45, 'p_atr': 16, 'p_adx': 29, 'rsi_period': 15, 'ema1': 19, 'ema2': 40, 'slip_atr_k': 0.09744730946581609, 'slip_spread_k': 0.6567967561525595, 'spread_hl_frac': 0.005839449996702517, 'bb_std_mult': 2.141869920253985, 'rsi_os': 41, 'rsi_ob': 80, 'vol_spike': 0.2853948541229492, 'adx_thresh': 22.254246324871808, 'atr_min_pct': 7.722115292974288e-05, 'atr_max_pct': 0.09582354021321893, 'tp_mult': 1.6538193717086447, 'tsl_mult': 0.8745851950192134, 'strategy': 'breakout', 'time_stop': 172, 'use_sma': False, 'use_atr': False, 'use_adx': False, 'use_ema': True, 'use_spike': False, 'rsi_required': False, 'edge_k': 0.6581109652537572, 'edge_cap': 0.7034902565404051, 'bull_strategy': 'breakout', 'bull_bb_std_mult': 3.367908533658862, 'bull_rsi_os': 20, 'bull_rsi_ob': 73, 'bull_adx_thresh': 19.23367738988093, 'bull_atr_min_pct': 0.009108730945086827, 'bull_atr_max_pct': 0.12270892467799245, 'bull_tp_mult': 1.8741991483434963, 'bull_tsl_mult': 0.4883047762623373, 'bull_time_stop': 293, 'bull_use_sma': False, 'bull_use_ema': True, 'bull_use_atr': True, 'bull_use_adx': True, 'bull_use_spike': True, 'bull_rsi_required': False, 'bear_strategy': 'mean_reversion', 'bear_bb_std_mult': 2.797562678556566, 'bear_rsi_os': 12, 'bear_rsi_ob': 56, 'bear_adx_thresh': 19.386508872357332, 'bear_atr_min_pct': 0.01623954879599784, 'bear_atr_max_pct': 0.013891502945911155, 'bear_tp_mult': 2.95667996783569, 'bear_tsl_mult': 0.8229720946326716, 'bear_time_stop': 58, 'bear_use_sma': True, 'bear_use_ema': False, 'bear_use_atr': False, 'bear_use_adx': True, 'bear_use_spike': False, 'bear_rsi_required': False, 'sideways_strategy': 'breakout', 'sideways_bb_std_mult': 2.7163112994115948, 'sideways_rsi_os': 55, 'sideways_rsi_ob': 53, 'sideways_adx_thresh': 33.61898788531197, 'sideways_atr_min_pct': 0.01576910714330383, 'sideways_atr_max_pct': 0.01811175037108251, 'sideways_tp_mult': 1.2518531311059418, 'sideways_tsl_mult': 0.28793737616534637, 'sideways_time_stop': 142, 'sideways_use_sma': True, 'sideways_use_ema': True, 'sideways_use_atr': True, 'sideways_use_adx': False, 'sideways_use_spike': True, 'sideways_rsi_required': True}.
[I 2025-08-30 21:09:28,938] Trial 180 finished with values: [-1000000000.0, 1000000000.0] and parameters: {'p_sma': 33, 'p_std': 34, 'p_atr': 18, 'p_adx': 29, 'rsi_period': 53, 'ema1': 19, 'ema2': 40, 'slip_atr_k': 0.08143711760628572, 'slip_spread_k': 0.4969436288835524, 'spread_hl_frac': 0.0072368892807507836, 'bb_std_mult': 1.8324377839668875, 'rsi_os': 47, 'rsi_ob': 80, 'vol_spike': 0.26818392688452264, 'adx_thresh': 22.96609109363972, 'atr_min_pct': 4.818887781723774e-05, 'atr_max_pct': 0.10054782617079161, 'tp_mult': 2.570082646187065, 'tsl_mult': 0.43529968908539224, 'strategy': 'breakout', 'time_stop': 289, 'use_sma': True, 'use_atr': False, 'use_adx': False, 'use_ema': True, 'use_spike': False, 'rsi_required': False, 'edge_k': 0.9754528246768727, 'edge_cap': 0.7068814022950516, 'bull_strategy': 'mean_reversion', 'bull_bb_std_mult': 1.8443986817694207, 'bull_rsi_os': 18, 'bull_rsi_ob': 73, 'bull_adx_thresh': 19.07805430525425, 'bull_atr_min_pct': 0.0008569407288554805, 'bull_atr_max_pct': 0.07105309195113968, 'bull_tp_mult': 2.451277804978109, 'bull_tsl_mult': 0.21094891065346572, 'bull_time_stop': 225, 'bull_use_sma': False, 'bull_use_ema': True, 'bull_use_atr': True, 'bull_use_adx': False, 'bull_use_spike': True, 'bull_rsi_required': False, 'bear_strategy': 'breakout', 'bear_bb_std_mult': 1.7974462664645243, 'bear_rsi_os': 19, 'bear_rsi_ob': 56, 'bear_adx_thresh': 15.545124280755202, 'bear_atr_min_pct': 0.01853528848740596, 'bear_atr_max_pct': 0.0278094861219191, 'bear_tp_mult': 2.9663786207771943, 'bear_tsl_mult': 0.3571519892372878, 'bear_time_stop': 58, 'bear_use_sma': True, 'bear_use_ema': False, 'bear_use_atr': True, 'bear_use_adx': True, 'bear_use_spike': False, 'bear_rsi_required': False, 'sideways_strategy': 'mean_reversion', 'sideways_bb_std_mult': 2.6612049902650488, 'sideways_rsi_os': 42, 'sideways_rsi_ob': 53, 'sideways_adx_thresh': 33.326961714331254, 'sideways_atr_min_pct': 0.008914046314145939, 'sideways_atr_max_pct': 0.013843311563974862, 'sideways_tp_mult': 2.6570896856562074, 'sideways_tsl_mult': 0.7885253078145719, 'sideways_time_stop': 132, 'sideways_use_sma': True, 'sideways_use_ema': True, 'sideways_use_atr': True, 'sideways_use_adx': False, 'sideways_use_spike': True, 'sideways_rsi_required': True}.
