[I 2025-08-30 21:51:48,365] Trial 511 finished with values: [-1000000000.0, 1000000000.0] and parameters: {'p_sma': 15, 'p_std': 36, 'p_atr': 21, 'p_adx': 22, 'rsi_period': 68, 'ema1': 11, 'ema2': 28, 'slip_atr_k': 0.02815396045911555, 'slip_spread_k': 0.17014090619101613, 'spread_hl_frac': 0.03325773497393898, 'bb_std_mult': 0.9368260172939799, 'rsi_os': 39, 'rsi_ob': 68, 'vol_spike': 0.2851356073774212, 'adx_thresh': 7.175049067618527, 'atr_min_pct': 0.01694369373055381, 'atr_max_pct': 0.02430488378282317, 'tp_mult': 1.6520813712599354, 'tsl_mult': 0.925266570751448, 'strategy': 'mean_reversion', 'time_stop': 92, 'use_sma': True, 'use_atr': True, 'use_adx': True, 'use_ema': False, 'use_spike': True, 'rsi_required': True, 'edge_k': 0.8105711158190869, 'edge_cap': 0.8094287379753765, 'bull_strategy': 'breakout', 'bull_bb_std_mult': 1.92251058157397, 'bull_rsi_os': 38, 'bull_rsi_ob': 86, 'bull_adx_thresh': 13.731449904286004, 'bull_atr_min_pct': 0.01999451241771348, 'bull_atr_max_pct': 0.10185834776627627, 'bull_tp_mult': 1.2824922649402, 'bull_tsl_mult': 0.4180685530283872, 'bull_time_stop': 197, 'bull_use_sma': False, 'bull_use_ema': True, 'bull_use_atr': False, 'bull_use_adx': False, 'bull_use_spike': False, 'bull_rsi_required': True, 'bear_strategy': 'mean_reversion', 'bear_bb_std_mult': 1.9723732905958655, 'bear_rsi_os': 9, 'bear_rsi_ob': 57, 'bear_adx_thresh': 29.0222421786483, 'bear_atr_min_pct': 0.0005333443165167137, 'bear_atr_max_pct': 0.12158963538531661, 'bear_tp_mult': 1.6436742056384723, 'bear_tsl_mult': 0.7767289902594938, 'bear_time_stop': 246, 'bear_use_sma': False, 'bear_use_ema': True, 'bear_use_atr': False, 'bear_use_adx': True, 'bear_use_spike': True, 'bear_rsi_required': True, 'sideways_strategy': 'breakout', 'sideways_bb_std_mult': 2.4134214290128386, 'sideways_rsi_os': 24, 'sideways_rsi_ob': 75, 'sideways_adx_thresh': 26.88478985634868, 'sideways_atr_min_pct': 0.020293069624284697, 'sideways_atr_max_pct': 0.12717867365731106, 'sideways_tp_mult': 1.5601570789827908, 'sideways_tsl_mult': 0.8062369336569803, 'sideways_time_stop': 174, 'sideways_use_sma': False, 'sideways_use_ema': False, 'sideways_use_atr': False, 'sideways_use_adx': True, 'sideways_use_spike': False, 'sideways_rsi_required': False}.
[I 2025-08-30 21:51:49,045] Trial 514 finished with values: [-0.021519753003584108, 0.021409266787712704] and parameters: {'p_sma': 35, 'p_std': 36, 'p_atr': 20, 'p_adx': 20, 'rsi_period': 77, 'ema1': 10, 'ema2': 33, 'slip_atr_k': 0.20913756875754225, 'slip_spread_k': 0.6421595092491688, 'spread_hl_frac': 0.032940696175957754, 'bb_std_mult': 0.7610566169164406, 'rsi_os': 22, 'rsi_ob': 68, 'vol_spike': 0.005914145259725806, 'adx_thresh': 7.1431675762016145, 'atr_min_pct': 0.01241335007986944, 'atr_max_pct': 0.018918203512772323, 'tp_mult': 1.6499853418715642, 'tsl_mult': 0.6601006557944558, 'strategy': 'mean_reversion', 'time_stop': 89, 'use_sma': True, 'use_atr': False, 'use_adx': False, 'use_ema': True, 'use_spike': False, 'rsi_required': True, 'edge_k': 1.1686661356892278, 'edge_cap': 0.8743133856440379, 'bull_strategy': 'breakout', 'bull_bb_std_mult': 1.7538586578834974, 'bull_rsi_os': 45, 'bull_rsi_ob': 86, 'bull_adx_thresh': 6.149398320317406, 'bull_atr_min_pct': 0.0009935632575568832, 'bull_atr_max_pct': 0.06539832246046273, 'bull_tp_mult': 1.284650841365034, 'bull_tsl_mult': 0.4081116009664474, 'bull_time_stop': 283, 'bull_use_sma': False, 'bull_use_ema': True, 'bull_use_atr': False, 'bull_use_adx': False, 'bull_use_spike': False, 'bull_rsi_required': True, 'bear_strategy': 'mean_reversion', 'bear_bb_std_mult': 1.9887192598612617, 'bear_rsi_os': 6, 'bear_rsi_ob': 75, 'bear_adx_thresh': 19.98245346792243, 'bear_atr_min_pct': 0.012943418933404062, 'bear_atr_max_pct': 0.12276350315708676, 'bear_tp_mult': 1.0566569673150783, 'bear_tsl_mult': 0.3474342787093109, 'bear_time_stop': 250, 'bear_use_sma': False, 'bear_use_ema': True, 'bear_use_atr': False, 'bear_use_adx': False, 'bear_use_spike': True, 'bear_rsi_required': True, 'sideways_strategy': 'breakout', 'sideways_bb_std_mult': 3.577524468688752, 'sideways_rsi_os': 15, 'sideways_rsi_ob': 88, 'sideways_adx_thresh': 24.851555331289514, 'sideways_atr_min_pct': 0.021336820603034677, 'sideways_atr_max_pct': 0.12751852997768107, 'sideways_tp_mult': 2.505429016904528, 'sideways_tsl_mult': 0.8454567286895646, 'sideways_time_stop': 268, 'sideways_use_sma': False, 'sideways_use_ema': False, 'sideways_use_atr': False, 'sideways_use_adx': True, 'sideways_use_spike': True, 'sideways_rsi_required': False}.
[I 2025-08-30 21:51:49,218] Trial 512 finished with values: [-1000000000.0, 1000000000.0] and parameters: {'p_sma': 34, 'p_std': 45, 'p_atr': 21, 'p_adx': 22, 'rsi_period': 71, 'ema1': 10, 'ema2': 23, 'slip_atr_k': 0.20168441030464185, 'slip_spread_k': 0.6164326035963476, 'spread_hl_frac': 0.03320813275948246, 'bb_std_mult': 0.7669560802468163, 'rsi_os': 22, 'rsi_ob': 65, 'vol_spike': 0.006681266399250485, 'adx_thresh': 10.973797120019867, 'atr_min_pct': 0.012517641059386768, 'atr_max_pct': 0.0254471230670313, 'tp_mult': 1.6450549846434677, 'tsl_mult': 0.9206498033725291, 'strategy': 'mean_reversion', 'time_stop': 90, 'use_sma': True, 'use_atr': False, 'use_adx': False, 'use_ema': False, 'use_spike': False, 'rsi_required': False, 'edge_k': 0.8164624631377325, 'edge_cap': 0.34288385870809246, 'bull_strategy': 'breakout', 'bull_bb_std_mult': 1.6455122404755271, 'bull_rsi_os': 18, 'bull_rsi_ob': 65, 'bull_adx_thresh': 13.674674823334646, 'bull_atr_min_pct': 0.02558051730984956, 'bull_atr_max_pct': 0.11916890305817786, 'bull_tp_mult': 1.500290771569948, 'bull_tsl_mult': 0.4232385484668363, 'bull_time_stop': 260, 'bull_use_sma': False, 'bull_use_ema': True, 'bull_use_atr': False, 'bull_use_adx': False, 'bull_use_spike': False, 'bull_rsi_required': True, 'bear_strategy': 'mean_reversion', 'bear_bb_std_mult': 1.997924422793948, 'bear_rsi_os': 12, 'bear_rsi_ob': 59, 'bear_adx_thresh': 28.942732847054224, 'bear_atr_min_pct': 0.012699832133991167, 'bear_atr_max_pct': 0.12191673145625101, 'bear_tp_mult': 1.6512022049243398, 'bear_tsl_mult': 0.42852969552746667, 'bear_time_stop': 248, 'bear_use_sma': False, 'bear_use_ema': True, 'bear_use_atr': False, 'bear_use_adx': False, 'bear_use_spike': True, 'bear_rsi_required': True, 'sideways_strategy': 'breakout', 'sideways_bb_std_mult': 3.2639778845504743, 'sideways_rsi_os': 51, 'sideways_rsi_ob': 88, 'sideways_adx_thresh': 21.251415082741726, 'sideways_atr_min_pct': 0.02081812404548593, 'sideways_atr_max_pct': 0.03906708983357807, 'sideways_tp_mult': 2.4389702632985357, 'sideways_tsl_mult': 0.8043315775700004, 'sideways_time_stop': 278, 'sideways_use_sma': False, 'sideways_use_ema': False, 'sideways_use_atr': False, 'sideways_use_adx': True, 'sideways_use_spike': True, 'sideways_rsi_required': False}.
[I 2025-08-30 21:51:52,475] Trial 516 finished with values: [-1000000000.0, 1000000000.0] and parameters: {'p_sma': 34, 'p_std': 35, 'p_atr': 20, 'p_adx': 20, 'rsi_period': 63, 'ema1': 12, 'ema2': 55, 'slip_atr_k': 0.16115034969080042, 'slip_spread_k': 0.07820784680837362, 'spread_hl_frac': 0.01947294733588991, 'bb_std_mult': 2.717652951943358, 'rsi_os': 25, 'rsi_ob': 66, 'vol_spike': 0.2577029103323033, 'adx_thresh': 10.217516998840585, 'atr_min_pct': 0.012246771737768074, 'atr_max_pct': 0.02181700431632042, 'tp_mult': 1.6462157199330427, 'tsl_mult': 0.8823112144106271, 'strategy': 'mean_reversion', 'time_stop': 89, 'use_sma': True, 'use_atr': False, 'use_adx': False, 'use_ema': True, 'use_spike': False, 'rsi_required': True, 'edge_k': 1.2138699337318624, 'edge_cap': 0.2446744133658934, 'bull_strategy': 'breakout', 'bull_bb_std_mult': 1.9420689880970268, 'bull_rsi_os': 17, 'bull_rsi_ob': 84, 'bull_adx_thresh': 16.426078179786472, 'bull_atr_min_pct': 0.001225261544862792, 'bull_atr_max_pct': 0.06488504600333274, 'bull_tp_mult': 1.3835500376506953, 'bull_tsl_mult': 0.7067114336089937, 'bull_time_stop': 197, 'bull_use_sma': True, 'bull_use_ema': False, 'bull_use_atr': False, 'bull_use_adx': False, 'bull_use_spike': False, 'bull_rsi_required': True, 'bear_strategy': 'mean_reversion', 'bear_bb_std_mult': 1.2940458406094222, 'bear_rsi_os': 53, 'bear_rsi_ob': 74, 'bear_adx_thresh': 8.87245104096821, 'bear_atr_min_pct': 0.01280227390374655, 'bear_atr_max_pct': 0.11009100631286209, 'bear_tp_mult': 1.5977281814202382, 'bear_tsl_mult': 0.7778359905564758, 'bear_time_stop': 233, 'bear_use_sma': False, 'bear_use_ema': True, 'bear_use_atr': False, 'bear_use_adx': False, 'bear_use_spike': True, 'bear_rsi_required': True, 'sideways_strategy': 'breakout', 'sideways_bb_std_mult': 1.5702509703245462, 'sideways_rsi_os': 40, 'sideways_rsi_ob': 60, 'sideways_adx_thresh': 34.361940927449965, 'sideways_atr_min_pct': 0.020994480895389536, 'sideways_atr_max_pct': 0.04446123622915789, 'sideways_tp_mult': 2.267617075251157, 'sideways_tsl_mult': 0.8206318049229581, 'sideways_time_stop': 173, 'sideways_use_sma': False, 'sideways_use_ema': False, 'sideways_use_atr': False, 'sideways_use_adx': True, 'sideways_use_spike': True, 'sideways_rsi_required': False}.
[I 2025-08-30 21:51:52,926] Trial 519 finished with values: [-1000000000.0, 1000000000.0] and parameters: {'p_sma': 36, 'p_std': 7, 'p_atr': 22, 'p_adx': 20, 'rsi_period': 57, 'ema1': 29, 'ema2': 21, 'slip_atr_k': 0.18434146044536281, 'slip_spread_k': 0.9112831393256253, 'spread_hl_frac': 0.019754239063809874, 'bb_std_mult': 2.729707285054966, 'rsi_os': 9, 'rsi_ob': 66, 'vol_spike': 0.26235230943385207, 'adx_thresh': 10.18336330593535, 'atr_min_pct': 0.02274114416592694, 'atr_max_pct': 0.02182468175191242, 'tp_mult': 2.8803936251068167, 'tsl_mult': 0.8776276401441742, 'strategy': 'mean_reversion', 'time_stop': 80, 'use_sma': True, 'use_atr': True, 'use_adx': True, 'use_ema': True, 'use_spike': True, 'rsi_required': True, 'edge_k': 1.0763215756307563, 'edge_cap': 0.2945065456277094, 'bull_strategy': 'mean_reversion', 'bull_bb_std_mult': 1.991785563740433, 'bull_rsi_os': 29, 'bull_rsi_ob': 84, 'bull_adx_thresh': 22.493908198212544, 'bull_atr_min_pct': 0.0015878365528628454, 'bull_atr_max_pct': 0.05734691613516558, 'bull_tp_mult': 1.3944552094038942, 'bull_tsl_mult': 0.7217573684768976, 'bull_time_stop': 295, 'bull_use_sma': True, 'bull_use_ema': False, 'bull_use_atr': False, 'bull_use_adx': False, 'bull_use_spike': False, 'bull_rsi_required': True, 'bear_strategy': 'mean_reversion', 'bear_bb_std_mult': 1.9129497791853602, 'bear_rsi_os': 53, 'bear_rsi_ob': 72, 'bear_adx_thresh': 27.700822126629863, 'bear_atr_min_pct': 0.011191653783078265, 'bear_atr_max_pct': 0.10882818808413072, 'bear_tp_mult': 2.7185669959954293, 'bear_tsl_mult': 0.04656481654374073, 'bear_time_stop': 232, 'bear_use_sma': False, 'bear_use_ema': True, 'bear_use_atr': False, 'bear_use_adx': True, 'bear_use_spike': False, 'bear_rsi_required': True, 'sideways_strategy': 'breakout', 'sideways_bb_std_mult': 1.8606703021729407, 'sideways_rsi_os': 40, 'sideways_rsi_ob': 62, 'sideways_adx_thresh': 26.506339256885454, 'sideways_atr_min_pct': 0.022118014408682524, 'sideways_atr_max_pct': 0.0603318038214869, 'sideways_tp_mult': 1.7809047136928535, 'sideways_tsl_mult': 0.09245731462152279, 'sideways_time_stop': 261, 'sideways_use_sma': True, 'sideways_use_ema': False, 'sideways_use_atr': False, 'sideways_use_adx': True, 'sideways_use_spike': False, 'sideways_rsi_required': False}.
[I 2025-08-30 21:51:52,939] Trial 518 finished with values: [-1000000000.0, 1000000000.0] and parameters: {'p_sma': 34, 'p_std': 9, 'p_atr': 22, 'p_adx': 20, 'rsi_period': 47, 'ema1': 30, 'ema2': 19, 'slip_atr_k': 0.13111212404314637, 'slip_spread_k': 0.6142678998181472, 'spread_hl_frac': 0.03513446523485036, 'bb_std_mult': 3.029035904288401, 'rsi_os': 26, 'rsi_ob': 66, 'vol_spike': 0.2629755785050972, 'adx_thresh': 10.597039314477104, 'atr_min_pct': 0.022908292642837745, 'atr_max_pct': 0.02182111697578608, 'tp_mult': 1.3465925580952722, 'tsl_mult': 0.8837393216982318, 'strategy': 'mean_reversion', 'time_stop': 253, 'use_sma': True, 'use_atr': True, 'use_adx': True, 'use_ema': True, 'use_spike': True, 'rsi_required': True, 'edge_k': 0.07388671647234413, 'edge_cap': 0.31091488267843387, 'bull_strategy': 'breakout', 'bull_bb_std_mult': 1.8343121119268677, 'bull_rsi_os': 16, 'bull_rsi_ob': 84, 'bull_adx_thresh': 15.848842234744394, 'bull_atr_min_pct': 0.0015878471622562396, 'bull_atr_max_pct': 0.05810438422085912, 'bull_tp_mult': 2.737879675658097, 'bull_tsl_mult': 0.7141249808197783, 'bull_time_stop': 108, 'bull_use_sma': True, 'bull_use_ema': False, 'bull_use_atr': False, 'bull_use_adx': False, 'bull_use_spike': False, 'bull_rsi_required': True, 'bear_strategy': 'mean_reversion', 'bear_bb_std_mult': 0.6232408397837743, 'bear_rsi_os': 54, 'bear_rsi_ob': 72, 'bear_adx_thresh': 27.62189350419277, 'bear_atr_min_pct': 0.019620021690007483, 'bear_atr_max_pct': 0.10952616987916813, 'bear_tp_mult': 1.5316033480065672, 'bear_tsl_mult': 0.6799054865250191, 'bear_time_stop': 44, 'bear_use_sma': False, 'bear_use_ema': True, 'bear_use_atr': False, 'bear_use_adx': True, 'bear_use_spike': True, 'bear_rsi_required': True, 'sideways_strategy': 'breakout', 'sideways_bb_std_mult': 1.6770771678140164, 'sideways_rsi_os': 46, 'sideways_rsi_ob': 62, 'sideways_adx_thresh': 26.683917386659044, 'sideways_atr_min_pct': 0.020686233368516, 'sideways_atr_max_pct': 0.04653048567634128, 'sideways_tp_mult': 1.6713545157104652, 'sideways_tsl_mult': 0.784382952138624, 'sideways_time_stop': 260, 'sideways_use_sma': False, 'sideways_use_ema': False, 'sideways_use_atr': False, 'sideways_use_adx': True, 'sideways_use_spike': False, 'sideways_rsi_required': False}.
[I 2025-08-30 21:52:21,527] Trial 517 finished with values: [-0.017632222558379596, 0.01757059101943892] and parameters: {'p_sma': 35, 'p_std': 24, 'p_atr': 20, 'p_adx': 20, 'rsi_period': 77, 'ema1': 12, 'ema2': 55, 'slip_atr_k': 0.03498923620126184, 'slip_spread_k': 0.07433030313303296, 'spread_hl_frac': 0.021526057919395925, 'bb_std_mult': 0.7648715299601746, 'rsi_os': 16, 'rsi_ob': 66, 'vol_spike': 0.2607007890173592, 'adx_thresh': 10.338807032579535, 'atr_min_pct': 0.012228586660594959, 'atr_max_pct': 0.021543210545142178, 'tp_mult': 2.126560222219088, 'tsl_mult': 0.8836013616544459, 'strategy': 'mean_reversion', 'time_stop': 81, 'use_sma': True, 'use_atr': False, 'use_adx': False, 'use_ema': True, 'use_spike': False, 'rsi_required': True, 'edge_k': 0.06927215726102876, 'edge_cap': 0.29610272058759207, 'bull_strategy': 'breakout', 'bull_bb_std_mult': 1.2772605340363241, 'bull_rsi_os': 17, 'bull_rsi_ob': 52, 'bull_adx_thresh': 16.343100043216445, 'bull_atr_min_pct': 0.0011233881602906973, 'bull_atr_max_pct': 0.056499720493127285, 'bull_tp_mult': 1.3838677487654896, 'bull_tsl_mult': 0.7078101192832862, 'bull_time_stop': 11, 'bull_use_sma': True, 'bull_use_ema': False, 'bull_use_atr': False, 'bull_use_adx': False, 'bull_use_spike': False, 'bull_rsi_required': True, 'bear_strategy': 'mean_reversion', 'bear_bb_std_mult': 1.1951521205250768, 'bear_rsi_os': 11, 'bear_rsi_ob': 85, 'bear_adx_thresh': 22.75688836425729, 'bear_atr_min_pct': 0.012866661873157895, 'bear_atr_max_pct': 0.10955555131307655, 'bear_tp_mult': 1.6068574651224998, 'bear_tsl_mult': 0.3422993452410846, 'bear_time_stop': 232, 'bear_use_sma': False, 'bear_use_ema': True, 'bear_use_atr': False, 'bear_use_adx': False, 'bear_use_spike': True, 'bear_rsi_required': True, 'sideways_strategy': 'breakout', 'sideways_bb_std_mult': 1.554122022386977, 'sideways_rsi_os': 40, 'sideways_rsi_ob': 89, 'sideways_adx_thresh': 11.205763521441575, 'sideways_atr_min_pct': 0.021416720733342907, 'sideways_atr_max_pct': 0.06012439961062084, 'sideways_tp_mult': 2.7758681460800836, 'sideways_tsl_mult': 0.7880451006914462, 'sideways_time_stop': 264, 'sideways_use_sma': False, 'sideways_use_ema': False, 'sideways_use_atr': False, 'sideways_use_adx': True, 'sideways_use_spike': True, 'sideways_rsi_required': False}.
[I 2025-08-30 21:52:23,628] Trial 520 finished with values: [-1000000000.0, 1000000000.0] and parameters: {'p_sma': 36, 'p_std': 9, 'p_atr': 22, 'p_adx': 19, 'rsi_period': 73, 'ema1': 7, 'ema2': 52, 'slip_atr_k': 0.03430586784392136, 'slip_spread_k': 0.6692867350747473, 'spread_hl_frac': 0.03485083845395863, 'bb_std_mult': 0.5143833143120811, 'rsi_os': 33, 'rsi_ob': 85, 'vol_spike': 0.16228300088660547, 'adx_thresh': 10.372110388836363, 'atr_min_pct': 0.013617052407284322, 'atr_max_pct': 0.021572934627390364, 'tp_mult': 1.7431008345038208, 'tsl_mult': 0.9513603848962507, 'strategy': 'mean_reversion', 'time_stop': 260, 'use_sma': True, 'use_atr': True, 'use_adx': True, 'use_ema': True, 'use_spike': True, 'rsi_required': True, 'edge_k': 1.0905210640020906, 'edge_cap': 0.30627362222722687, 'bull_strategy': 'mean_reversion', 'bull_bb_std_mult': 2.0232359385293806, 'bull_rsi_os': 50, 'bull_rsi_ob': 89, 'bull_adx_thresh': 15.943352376150589, 'bull_atr_min_pct': 0.0025452142424245375, 'bull_atr_max_pct': 0.057436688330129645, 'bull_tp_mult': 1.4090573434392306, 'bull_tsl_mult': 0.36299569226339723, 'bull_time_stop': 8, 'bull_use_sma': True, 'bull_use_ema': False, 'bull_use_atr': True, 'bull_use_adx': False, 'bull_use_spike': False, 'bull_rsi_required': False, 'bear_strategy': 'mean_reversion', 'bear_bb_std_mult': 1.9014975021771914, 'bear_rsi_os': 17, 'bear_rsi_ob': 72, 'bear_adx_thresh': 27.600053402100496, 'bear_atr_min_pct': 0.0194757628693059, 'bear_atr_max_pct': 0.11588655841489348, 'bear_tp_mult': 1.535707727181608, 'bear_tsl_mult': 0.39569380255880904, 'bear_time_stop': 240, 'bear_use_sma': False, 'bear_use_ema': True, 'bear_use_atr': True, 'bear_use_adx': True, 'bear_use_spike': False, 'bear_rsi_required': True, 'sideways_strategy': 'breakout', 'sideways_bb_std_mult': 1.695337231700752, 'sideways_rsi_os': 29, 'sideways_rsi_ob': 89, 'sideways_adx_thresh': 13.561663307999781, 'sideways_atr_min_pct': 0.021643339613410494, 'sideways_atr_max_pct': 0.061722139225381, 'sideways_tp_mult': 1.651250441776846, 'sideways_tsl_mult': 0.09761743913595966, 'sideways_time_stop': 79, 'sideways_use_sma': True, 'sideways_use_ema': False, 'sideways_use_atr': False, 'sideways_use_adx': True, 'sideways_use_spike': False, 'sideways_rsi_required': False}.
[I 2025-08-30 21:52:26,697] Trial 521 finished with values: [-1000000000.0, 1000000000.0] and parameters: {'p_sma': 46, 'p_std': 23, 'p_atr': 22, 'p_adx': 27, 'rsi_period': 73, 'ema1': 30, 'ema2': 52, 'slip_atr_k': 0.033301572991777315, 'slip_spread_k': 0.6941068826080243, 'spread_hl_frac': 0.03469975044593614, 'bb_std_mult': 3.397422076624095, 'rsi_os': 29, 'rsi_ob': 67, 'vol_spike': 0.2684766840195045, 'adx_thresh': 10.900936771889288, 'atr_min_pct': 0.006019314757887596, 'atr_max_pct': 0.0147624461101897, 'tp_mult': 1.7418332308728726, 'tsl_mult': 0.24593201270949733, 'strategy': 'mean_reversion', 'time_stop': 12, 'use_sma': True, 'use_atr': True, 'use_adx': True, 'use_ema': True, 'use_spike': True, 'rsi_required': True, 'edge_k': 0.06362233723607169, 'edge_cap': 0.8086972700465487, 'bull_strategy': 'breakout', 'bull_bb_std_mult': 2.034813404976413, 'bull_rsi_os': 16, 'bull_rsi_ob': 89, 'bull_adx_thresh': 14.387813437453111, 'bull_atr_min_pct': 0.016651388362706066, 'bull_atr_max_pct': 0.05123151352391545, 'bull_tp_mult': 1.6556253586504508, 'bull_tsl_mult': 0.2618026199502432, 'bull_time_stop': 300, 'bull_use_sma': True, 'bull_use_ema': False, 'bull_use_atr': True, 'bull_use_adx': False, 'bull_use_spike': False, 'bull_rsi_required': False, 'bear_strategy': 'mean_reversion', 'bear_bb_std_mult': 2.1366629112268343, 'bear_rsi_os': 7, 'bear_rsi_ob': 86, 'bear_adx_thresh': 24.668003183818815, 'bear_atr_min_pct': 0.02940849138252628, 'bear_atr_max_pct': 0.11547794877712304, 'bear_tp_mult': 1.5377764056488197, 'bear_tsl_mult': 0.9588571768182019, 'bear_time_stop': 242, 'bear_use_sma': False, 'bear_use_ema': True, 'bear_use_atr': True, 'bear_use_adx': True, 'bear_use_spike': True, 'bear_rsi_required': False, 'sideways_strategy': 'breakout', 'sideways_bb_std_mult': 3.048811180684086, 'sideways_rsi_os': 55, 'sideways_rsi_ob': 46, 'sideways_adx_thresh': 10.928480566667703, 'sideways_atr_min_pct': 0.021674829837494913, 'sideways_atr_max_pct': 0.047044763349161446, 'sideways_tp_mult': 1.6709060645236882, 'sideways_tsl_mult': 0.7832408756658096, 'sideways_time_stop': 81, 'sideways_use_sma': False, 'sideways_use_ema': False, 'sideways_use_atr': False, 'sideways_use_adx': True, 'sideways_use_spike': False, 'sideways_rsi_required': False}.
