[I 2025-08-30 22:10:16,776] Trial 673 finished with values: [-1000000000.0, 1000000000.0] and parameters: {'p_sma': 35, 'p_std': 35, 'p_atr': 21, 'p_adx': 20, 'rsi_period': 75, 'ema1': 26, 'ema2': 52, 'slip_atr_k': 0.18436506242154965, 'slip_spread_k': 0.3733873736385888, 'spread_hl_frac': 0.029679936051191964, 'bb_std_mult': 0.8053645745825334, 'rsi_os': 38, 'rsi_ob': 64, 'vol_spike': 0.2797006586247093, 'adx_thresh': 20.118747229745455, 'atr_min_pct': 0.012546789614665144, 'atr_max_pct': 0.01870220275564841, 'tp_mult': 2.953614380267001, 'tsl_mult': 0.8760525265755837, 'strategy': 'mean_reversion', 'time_stop': 99, 'use_sma': True, 'use_atr': True, 'use_adx': True, 'use_ema': True, 'use_spike': True, 'rsi_required': True, 'edge_k': 1.0069469683338, 'edge_cap': 0.17042621870636004, 'bull_strategy': 'breakout', 'bull_bb_std_mult': 2.0355111908293133, 'bull_rsi_os': 12, 'bull_rsi_ob': 89, 'bull_adx_thresh': 31.017097317861936, 'bull_atr_min_pct': 0.01702934756344263, 'bull_atr_max_pct': 0.08308043848509841, 'bull_tp_mult': 1.5656057796092933, 'bull_tsl_mult': 0.35230024234316326, 'bull_time_stop': 288, 'bull_use_sma': True, 'bull_use_ema': False, 'bull_use_atr': False, 'bull_use_adx': False, 'bull_use_spike': False, 'bull_rsi_required': True, 'bear_strategy': 'breakout', 'bear_bb_std_mult': 2.084412191824695, 'bear_rsi_os': 7, 'bear_rsi_ob': 72, 'bear_adx_thresh': 22.577940577693475, 'bear_atr_min_pct': 0.013197373112555665, 'bear_atr_max_pct': 0.11422295795604083, 'bear_tp_mult': 1.597057653780928, 'bear_tsl_mult': 0.39618714380819564, 'bear_time_stop': 239, 'bear_use_sma': False, 'bear_use_ema': True, 'bear_use_atr': False, 'bear_use_adx': False, 'bear_use_spike': True, 'bear_rsi_required': True, 'sideways_strategy': 'mean_reversion', 'sideways_bb_std_mult': 1.9030889707711602, 'sideways_rsi_os': 40, 'sideways_rsi_ob': 77, 'sideways_adx_thresh': 17.30321033455042, 'sideways_atr_min_pct': 0.02047232479861831, 'sideways_atr_max_pct': 0.04836907179634735, 'sideways_tp_mult': 1.715026927392166, 'sideways_tsl_mult': 0.7595454891179977, 'sideways_time_stop': 270, 'sideways_use_sma': False, 'sideways_use_ema': False, 'sideways_use_atr': True, 'sideways_use_adx': True, 'sideways_use_spike': False, 'sideways_rsi_required': False}.
[I 2025-08-30 22:10:17,592] Trial 679 finished with values: [-1000000000.0, 1000000000.0] and parameters: {'p_sma': 47, 'p_std': 37, 'p_atr': 20, 'p_adx': 21, 'rsi_period': 71, 'ema1': 12, 'ema2': 13, 'slip_atr_k': 0.17802223661810063, 'slip_spread_k': 0.6696833767728179, 'spread_hl_frac': 0.03857118128429302, 'bb_std_mult': 3.204873198781887, 'rsi_os': 55, 'rsi_ob': 95, 'vol_spike': 0.29371703886568784, 'adx_thresh': 12.037963073482697, 'atr_min_pct': 0.028573869698466516, 'atr_max_pct': 0.07764953754491363, 'tp_mult': 1.6293371593625974, 'tsl_mult': 0.9493912888561858, 'strategy': 'mean_reversion', 'time_stop': 93, 'use_sma': True, 'use_atr': True, 'use_adx': True, 'use_ema': True, 'use_spike': True, 'rsi_required': True, 'edge_k': 0.2428785911977489, 'edge_cap': 0.8182493759804328, 'bull_strategy': 'breakout', 'bull_bb_std_mult': 1.8702662475357523, 'bull_rsi_os': 40, 'bull_rsi_ob': 86, 'bull_adx_thresh': 14.384868014028354, 'bull_atr_min_pct': 2.6234805674697293e-05, 'bull_atr_max_pct': 0.04553233181303028, 'bull_tp_mult': 2.7162940516642955, 'bull_tsl_mult': 0.405529707616908, 'bull_time_stop': 12, 'bull_use_sma': True, 'bull_use_ema': False, 'bull_use_atr': False, 'bull_use_adx': False, 'bull_use_spike': False, 'bull_rsi_required': True, 'bear_strategy': 'mean_reversion', 'bear_bb_std_mult': 0.8446661247037988, 'bear_rsi_os': 5, 'bear_rsi_ob': 63, 'bear_adx_thresh': 6.68426745590352, 'bear_atr_min_pct': 0.026142853925061656, 'bear_atr_max_pct': 0.039922435014734844, 'bear_tp_mult': 1.7150782145151269, 'bear_tsl_mult': 0.3717685032782433, 'bear_time_stop': 259, 'bear_use_sma': False, 'bear_use_ema': True, 'bear_use_atr': False, 'bear_use_adx': True, 'bear_use_spike': True, 'bear_rsi_required': True, 'sideways_strategy': 'breakout', 'sideways_bb_std_mult': 1.718571268094737, 'sideways_rsi_os': 51, 'sideways_rsi_ob': 89, 'sideways_adx_thresh': 27.239267008583123, 'sideways_atr_min_pct': 0.021285533817611973, 'sideways_atr_max_pct': 0.03325048706908758, 'sideways_tp_mult': 1.8191545577572843, 'sideways_tsl_mult': 0.5363218431542017, 'sideways_time_stop': 108, 'sideways_use_sma': False, 'sideways_use_ema': False, 'sideways_use_atr': False, 'sideways_use_adx': True, 'sideways_use_spike': False, 'sideways_rsi_required': False}.
[I 2025-08-30 22:10:47,186] Trial 676 finished with values: [-1000000000.0, 1000000000.0] and parameters: {'p_sma': 37, 'p_std': 5, 'p_atr': 22, 'p_adx': 22, 'rsi_period': 75, 'ema1': 12, 'ema2': 50, 'slip_atr_k': 0.09962311711623323, 'slip_spread_k': 0.9105497611196656, 'spread_hl_frac': 0.038716180774218546, 'bb_std_mult': 1.050263048037783, 'rsi_os': 9, 'rsi_ob': 70, 'vol_spike': 0.16828701786504927, 'adx_thresh': 34.37295945093617, 'atr_min_pct': 0.018466393586349585, 'atr_max_pct': 0.04035206142161898, 'tp_mult': 1.6305331925085793, 'tsl_mult': 0.9560481044031179, 'strategy': 'mean_reversion', 'time_stop': 100, 'use_sma': True, 'use_atr': False, 'use_adx': True, 'use_ema': True, 'use_spike': True, 'rsi_required': True, 'edge_k': 0.24234301359050314, 'edge_cap': 0.7215768028007552, 'bull_strategy': 'breakout', 'bull_bb_std_mult': 2.0076884842431393, 'bull_rsi_os': 12, 'bull_rsi_ob': 86, 'bull_adx_thresh': 15.886930944469077, 'bull_atr_min_pct': 0.0033696618814245205, 'bull_atr_max_pct': 0.04681744495934098, 'bull_tp_mult': 1.6061033727856247, 'bull_tsl_mult': 0.4060161613741197, 'bull_time_stop': 300, 'bull_use_sma': True, 'bull_use_ema': False, 'bull_use_atr': False, 'bull_use_adx': False, 'bull_use_spike': False, 'bull_rsi_required': True, 'bear_strategy': 'mean_reversion', 'bear_bb_std_mult': 1.7089549514787525, 'bear_rsi_os': 29, 'bear_rsi_ob': 72, 'bear_adx_thresh': 27.82181483806438, 'bear_atr_min_pct': 0.013342591152718642, 'bear_atr_max_pct': 0.12339346202107615, 'bear_tp_mult': 1.6021374115756235, 'bear_tsl_mult': 0.5054017698741492, 'bear_time_stop': 239, 'bear_use_sma': False, 'bear_use_ema': True, 'bear_use_atr': False, 'bear_use_adx': False, 'bear_use_spike': False, 'bear_rsi_required': True, 'sideways_strategy': 'mean_reversion', 'sideways_bb_std_mult': 1.6874248868197235, 'sideways_rsi_os': 21, 'sideways_rsi_ob': 89, 'sideways_adx_thresh': 25.53790235178671, 'sideways_atr_min_pct': 0.011435322304374598, 'sideways_atr_max_pct': 0.030924800803458972, 'sideways_tp_mult': 1.8282313654627529, 'sideways_tsl_mult': 0.7283456630170353, 'sideways_time_stop': 127, 'sideways_use_sma': False, 'sideways_use_ema': False, 'sideways_use_atr': False, 'sideways_use_adx': False, 'sideways_use_spike': False, 'sideways_rsi_required': False}.
[I 2025-08-30 22:10:47,988] Trial 678 finished with values: [-1000000000.0, 1000000000.0] and parameters: {'p_sma': 33, 'p_std': 37, 'p_atr': 20, 'p_adx': 27, 'rsi_period': 71, 'ema1': 12, 'ema2': 13, 'slip_atr_k': 0.031700143779708076, 'slip_spread_k': 0.40247350169134993, 'spread_hl_frac': 0.033144408907581545, 'bb_std_mult': 2.2603580545673743, 'rsi_os': 9, 'rsi_ob': 75, 'vol_spike': 0.2942511622251668, 'adx_thresh': 12.260886031814161, 'atr_min_pct': 0.028853622783054117, 'atr_max_pct': 0.03221739047745492, 'tp_mult': 1.420041510660805, 'tsl_mult': 0.8938468475588296, 'strategy': 'mean_reversion', 'time_stop': 107, 'use_sma': True, 'use_atr': True, 'use_adx': True, 'use_ema': True, 'use_spike': True, 'rsi_required': True, 'edge_k': 0.19103272371716784, 'edge_cap': 0.7733934132222984, 'bull_strategy': 'breakout', 'bull_bb_std_mult': 1.8813476622633432, 'bull_rsi_os': 28, 'bull_rsi_ob': 86, 'bull_adx_thresh': 14.248049721261655, 'bull_atr_min_pct': 0.0028783063572507097, 'bull_atr_max_pct': 0.04602499239803264, 'bull_tp_mult': 1.4374403021512172, 'bull_tsl_mult': 0.40630321417420223, 'bull_time_stop': 59, 'bull_use_sma': True, 'bull_use_ema': False, 'bull_use_atr': False, 'bull_use_adx': False, 'bull_use_spike': False, 'bull_rsi_required': True, 'bear_strategy': 'mean_reversion', 'bear_bb_std_mult': 2.1143919839566836, 'bear_rsi_os': 7, 'bear_rsi_ob': 73, 'bear_adx_thresh': 22.502397334199078, 'bear_atr_min_pct': 0.019088483393624366, 'bear_atr_max_pct': 0.08209240517935783, 'bear_tp_mult': 1.700908224427041, 'bear_tsl_mult': 0.3660100232602761, 'bear_time_stop': 257, 'bear_use_sma': False, 'bear_use_ema': True, 'bear_use_atr': False, 'bear_use_adx': True, 'bear_use_spike': True, 'bear_rsi_required': True, 'sideways_strategy': 'breakout', 'sideways_bb_std_mult': 1.3609187512876826, 'sideways_rsi_os': 40, 'sideways_rsi_ob': 64, 'sideways_adx_thresh': 6.663800880125514, 'sideways_atr_min_pct': 0.012778118016752146, 'sideways_atr_max_pct': 0.03504109160292047, 'sideways_tp_mult': 1.828286810546403, 'sideways_tsl_mult': 0.8622232893908969, 'sideways_time_stop': 104, 'sideways_use_sma': False, 'sideways_use_ema': False, 'sideways_use_atr': False, 'sideways_use_adx': True, 'sideways_use_spike': False, 'sideways_rsi_required': False}.
[I 2025-08-30 22:10:48,442] Trial 677 finished with values: [-1000000000.0, 1000000000.0] and parameters: {'p_sma': 47, 'p_std': 51, 'p_atr': 21, 'p_adx': 21, 'rsi_period': 72, 'ema1': 16, 'ema2': 58, 'slip_atr_k': 0.03595151050417042, 'slip_spread_k': 0.6698959340899432, 'spread_hl_frac': 0.0317889331378431, 'bb_std_mult': 1.8552660813286423, 'rsi_os': 9, 'rsi_ob': 66, 'vol_spike': 0.28365952074360246, 'adx_thresh': 34.374014181989935, 'atr_min_pct': 0.029038327246322118, 'atr_max_pct': 0.05851674398685312, 'tp_mult': 1.3923917054680466, 'tsl_mult': 0.8976181558009421, 'strategy': 'mean_reversion', 'time_stop': 192, 'use_sma': True, 'use_atr': True, 'use_adx': True, 'use_ema': True, 'use_spike': True, 'rsi_required': True, 'edge_k': 0.41608468228568984, 'edge_cap': 0.3228089042351764, 'bull_strategy': 'breakout', 'bull_bb_std_mult': 1.8713705355426957, 'bull_rsi_os': 37, 'bull_rsi_ob': 86, 'bull_adx_thresh': 18.92440187101092, 'bull_atr_min_pct': 0.0012214448964482252, 'bull_atr_max_pct': 0.10277391795775777, 'bull_tp_mult': 1.266301892249337, 'bull_tsl_mult': 0.0201110898332984, 'bull_time_stop': 91, 'bull_use_sma': True, 'bull_use_ema': False, 'bull_use_atr': False, 'bull_use_adx': False, 'bull_use_spike': False, 'bull_rsi_required': True, 'bear_strategy': 'mean_reversion', 'bear_bb_std_mult': 1.5226973101192107, 'bear_rsi_os': 29, 'bear_rsi_ob': 73, 'bear_adx_thresh': 6.471226679883216, 'bear_atr_min_pct': 0.02996664597728082, 'bear_atr_max_pct': 0.14172800709680158, 'bear_tp_mult': 1.5898544652743065, 'bear_tsl_mult': 0.3874939614327943, 'bear_time_stop': 260, 'bear_use_sma': False, 'bear_use_ema': True, 'bear_use_atr': False, 'bear_use_adx': True, 'bear_use_spike': True, 'bear_rsi_required': True, 'sideways_strategy': 'mean_reversion', 'sideways_bb_std_mult': 1.9308052621595808, 'sideways_rsi_os': 40, 'sideways_rsi_ob': 88, 'sideways_adx_thresh': 5.977054690325513, 'sideways_atr_min_pct': 0.01888393408168382, 'sideways_atr_max_pct': 0.032022556243074526, 'sideways_tp_mult': 1.8217590526732101, 'sideways_tsl_mult': 0.7216249273990977, 'sideways_time_stop': 181, 'sideways_use_sma': False, 'sideways_use_ema': False, 'sideways_use_atr': False, 'sideways_use_adx': False, 'sideways_use_spike': False, 'sideways_rsi_required': False}.
[I 2025-08-30 22:10:50,228] Trial 680 finished with values: [-0.018963715575279982, 0.018849809890389497] and parameters: {'p_sma': 38, 'p_std': 36, 'p_atr': 13, 'p_adx': 22, 'rsi_period': 43, 'ema1': 11, 'ema2': 55, 'slip_atr_k': 0.09915773239311225, 'slip_spread_k': 0.8150557278537169, 'spread_hl_frac': 0.0332496754106796, 'bb_std_mult': 1.0402132882235784, 'rsi_os': 9, 'rsi_ob': 66, 'vol_spike': 0.11760711613415004, 'adx_thresh': 24.79527242650071, 'atr_min_pct': 0.014583242405450857, 'atr_max_pct': 0.047928199574080024, 'tp_mult': 1.7641008865597674, 'tsl_mult': 0.5694746522219466, 'strategy': 'mean_reversion', 'time_stop': 108, 'use_sma': True, 'use_atr': True, 'use_adx': True, 'use_ema': True, 'use_spike': True, 'rsi_required': True, 'edge_k': 1.305090386347273, 'edge_cap': 0.7612127022628213, 'bull_strategy': 'breakout', 'bull_bb_std_mult': 1.9214333706871185, 'bull_rsi_os': 37, 'bull_rsi_ob': 86, 'bull_adx_thresh': 13.876006996513606, 'bull_atr_min_pct': 0.0011800330481146267, 'bull_atr_max_pct': 0.0392515746753502, 'bull_tp_mult': 1.251726002596499, 'bull_tsl_mult': 0.9575274069157356, 'bull_time_stop': 300, 'bull_use_sma': True, 'bull_use_ema': False, 'bull_use_atr': False, 'bull_use_adx': False, 'bull_use_spike': False, 'bull_rsi_required': True, 'bear_strategy': 'mean_reversion', 'bear_bb_std_mult': 2.1200841806853745, 'bear_rsi_os': 29, 'bear_rsi_ob': 73, 'bear_adx_thresh': 30.562008803517458, 'bear_atr_min_pct': 0.0295729996308665, 'bear_atr_max_pct': 0.12275619295005243, 'bear_tp_mult': 1.53933326199478, 'bear_tsl_mult': 0.9994638968618739, 'bear_time_stop': 234, 'bear_use_sma': False, 'bear_use_ema': True, 'bear_use_atr': False, 'bear_use_adx': True, 'bear_use_spike': True, 'bear_rsi_required': True, 'sideways_strategy': 'breakout', 'sideways_bb_std_mult': 3.538221643834083, 'sideways_rsi_os': 32, 'sideways_rsi_ob': 88, 'sideways_adx_thresh': 14.18270897006607, 'sideways_atr_min_pct': 0.005094031832574231, 'sideways_atr_max_pct': 0.03164562869981759, 'sideways_tp_mult': 1.8717451868714827, 'sideways_tsl_mult': 0.24656833696217823, 'sideways_time_stop': 277, 'sideways_use_sma': False, 'sideways_use_ema': False, 'sideways_use_atr': False, 'sideways_use_adx': True, 'sideways_use_spike': False, 'sideways_rsi_required': False}.
[I 2025-08-30 22:11:23,846] Trial 681 finished with values: [-1000000000.0, 1000000000.0] and parameters: {'p_sma': 33, 'p_std': 52, 'p_atr': 8, 'p_adx': 21, 'rsi_period': 43, 'ema1': 8, 'ema2': 27, 'slip_atr_k': 0.14575682217272745, 'slip_spread_k': 0.7232626789684142, 'spread_hl_frac': 0.03294829232368706, 'bb_std_mult': 0.9122282901076546, 'rsi_os': 10, 'rsi_ob': 66, 'vol_spike': 0.2848395652178625, 'adx_thresh': 9.641368926582457, 'atr_min_pct': 0.014116849499658033, 'atr_max_pct': 0.025178541971947355, 'tp_mult': 1.7405219388989293, 'tsl_mult': 0.8956013424779007, 'strategy': 'mean_reversion', 'time_stop': 191, 'use_sma': True, 'use_atr': True, 'use_adx': False, 'use_ema': True, 'use_spike': False, 'rsi_required': True, 'edge_k': 1.2282354731325351, 'edge_cap': 0.7726640769195773, 'bull_strategy': 'breakout', 'bull_bb_std_mult': 1.8950676364324206, 'bull_rsi_os': 52, 'bull_rsi_ob': 87, 'bull_adx_thresh': 34.96478293774881, 'bull_atr_min_pct': 0.021474905554804646, 'bull_atr_max_pct': 0.05049812755513663, 'bull_tp_mult': 1.4531663943740702, 'bull_tsl_mult': 0.3701553084507854, 'bull_time_stop': 59, 'bull_use_sma': True, 'bull_use_ema': False, 'bull_use_atr': False, 'bull_use_adx': False, 'bull_use_spike': False, 'bull_rsi_required': True, 'bear_strategy': 'mean_reversion', 'bear_bb_std_mult': 2.133435089189904, 'bear_rsi_os': 9, 'bear_rsi_ob': 73, 'bear_adx_thresh': 26.513627424956685, 'bear_atr_min_pct': 0.02949125543487092, 'bear_atr_max_pct': 0.13036091595991334, 'bear_tp_mult': 1.4727631351581727, 'bear_tsl_mult': 0.9481836829060917, 'bear_time_stop': 213, 'bear_use_sma': False, 'bear_use_ema': True, 'bear_use_atr': False, 'bear_use_adx': True, 'bear_use_spike': True, 'bear_rsi_required': True, 'sideways_strategy': 'breakout', 'sideways_bb_std_mult': 1.8037020835682047, 'sideways_rsi_os': 38, 'sideways_rsi_ob': 88, 'sideways_adx_thresh': 28.473394622998118, 'sideways_atr_min_pct': 0.00342400213613501, 'sideways_atr_max_pct': 0.043950243561861814, 'sideways_tp_mult': 1.8764632148839788, 'sideways_tsl_mult': 0.7906796607051888, 'sideways_time_stop': 168, 'sideways_use_sma': True, 'sideways_use_ema': False, 'sideways_use_atr': False, 'sideways_use_adx': True, 'sideways_use_spike': True, 'sideways_rsi_required': False}.
[I 2025-08-30 22:11:24,629] Trial 682 finished with values: [-1000000000.0, 1000000000.0] and parameters: {'p_sma': 10, 'p_std': 35, 'p_atr': 8, 'p_adx': 21, 'rsi_period': 44, 'ema1': 11, 'ema2': 55, 'slip_atr_k': 0.1382669182686294, 'slip_spread_k': 0.7243308882992823, 'spread_hl_frac': 0.01999307855800928, 'bb_std_mult': 0.877745304352957, 'rsi_os': 6, 'rsi_ob': 93, 'vol_spike': 0.044473030729983584, 'adx_thresh': 10.610243786343437, 'atr_min_pct': 0.006597188758573036, 'atr_max_pct': 0.058655880774185334, 'tp_mult': 1.747397834781266, 'tsl_mult': 0.6213638013684015, 'strategy': 'mean_reversion', 'time_stop': 77, 'use_sma': True, 'use_atr': True, 'use_adx': False, 'use_ema': True, 'use_spike': False, 'rsi_required': True, 'edge_k': 0.9198724448158722, 'edge_cap': 0.14273037533809696, 'bull_strategy': 'breakout', 'bull_bb_std_mult': 1.7995660610570652, 'bull_rsi_os': 18, 'bull_rsi_ob': 87, 'bull_adx_thresh': 15.04977126090889, 'bull_atr_min_pct': 0.0011192036107845432, 'bull_atr_max_pct': 0.056928950021428386, 'bull_tp_mult': 1.366679895132542, 'bull_tsl_mult': 0.5748735361060744, 'bull_time_stop': 112, 'bull_use_sma': True, 'bull_use_ema': False, 'bull_use_atr': False, 'bull_use_adx': False, 'bull_use_spike': False, 'bull_rsi_required': False, 'bear_strategy': 'mean_reversion', 'bear_bb_std_mult': 1.5179595004994582, 'bear_rsi_os': 9, 'bear_rsi_ob': 73, 'bear_adx_thresh': 26.560451459743437, 'bear_atr_min_pct': 0.0299912582211483, 'bear_atr_max_pct': 0.14306814380778013, 'bear_tp_mult': 1.5327476255426415, 'bear_tsl_mult': 0.9498318117693292, 'bear_time_stop': 227, 'bear_use_sma': True, 'bear_use_ema': True, 'bear_use_atr': False, 'bear_use_adx': True, 'bear_use_spike': True, 'bear_rsi_required': False, 'sideways_strategy': 'breakout', 'sideways_bb_std_mult': 1.7941696990588412, 'sideways_rsi_os': 38, 'sideways_rsi_ob': 88, 'sideways_adx_thresh': 23.27795464872011, 'sideways_atr_min_pct': 0.003696463785061513, 'sideways_atr_max_pct': 0.06373775066857486, 'sideways_tp_mult': 1.8796552178511985, 'sideways_tsl_mult': 0.7919901437389981, 'sideways_time_stop': 194, 'sideways_use_sma': True, 'sideways_use_ema': False, 'sideways_use_atr': False, 'sideways_use_adx': True, 'sideways_use_spike': True, 'sideways_rsi_required': False}.
[I 2025-08-30 22:11:24,794] Trial 684 finished with values: [-1000000000.0, 1000000000.0] and parameters: {'p_sma': 10, 'p_std': 56, 'p_atr': 22, 'p_adx': 9, 'rsi_period': 58, 'ema1': 11, 'ema2': 55, 'slip_atr_k': 0.24286037408166647, 'slip_spread_k': 0.717312472773999, 'spread_hl_frac': 0.04624098574552115, 'bb_std_mult': 0.8470892508344353, 'rsi_os': 11, 'rsi_ob': 63, 'vol_spike': 0.2866738797402235, 'adx_thresh': 10.342505234076324, 'atr_min_pct': 0.0027650344252417216, 'atr_max_pct': 0.01287001596597248, 'tp_mult': 1.7312519647772513, 'tsl_mult': 0.6215502011245944, 'strategy': 'mean_reversion', 'time_stop': 73, 'use_sma': True, 'use_atr': True, 'use_adx': False, 'use_ema': False, 'use_spike': False, 'rsi_required': True, 'edge_k': 0.3069255771745647, 'edge_cap': 0.9741232506542052, 'bull_strategy': 'mean_reversion', 'bull_bb_std_mult': 1.8213431030833207, 'bull_rsi_os': 18, 'bull_rsi_ob': 76, 'bull_adx_thresh': 15.428563372510833, 'bull_atr_min_pct': 0.0006912726246480134, 'bull_atr_max_pct': 0.06749521557893313, 'bull_tp_mult': 1.3549199468713338, 'bull_tsl_mult': 0.3761965438677374, 'bull_time_stop': 294, 'bull_use_sma': False, 'bull_use_ema': True, 'bull_use_atr': False, 'bull_use_adx': False, 'bull_use_spike': False, 'bull_rsi_required': False, 'bear_strategy': 'mean_reversion', 'bear_bb_std_mult': 1.9338629703286518, 'bear_rsi_os': 27, 'bear_rsi_ob': 65, 'bear_adx_thresh': 8.953996068178798, 'bear_atr_min_pct': 0.01147806691372827, 'bear_atr_max_pct': 0.13057270281943362, 'bear_tp_mult': 2.3582905316494642, 'bear_tsl_mult': 0.07504476127324555, 'bear_time_stop': 224, 'bear_use_sma': True, 'bear_use_ema': True, 'bear_use_atr': False, 'bear_use_adx': True, 'bear_use_spike': True, 'bear_rsi_required': False, 'sideways_strategy': 'breakout', 'sideways_bb_std_mult': 1.8177769491200704, 'sideways_rsi_os': 36, 'sideways_rsi_ob': 90, 'sideways_adx_thresh': 15.185346244561782, 'sideways_atr_min_pct': 0.021634010970385635, 'sideways_atr_max_pct': 0.04434252059500094, 'sideways_tp_mult': 1.764512117184893, 'sideways_tsl_mult': 0.9589383143484991, 'sideways_time_stop': 220, 'sideways_use_sma': True, 'sideways_use_ema': False, 'sideways_use_atr': False, 'sideways_use_adx': True, 'sideways_use_spike': True, 'sideways_rsi_required': False}.
