[I 2025-08-30 21:04:12,215] Trial 135 finished with values: [-1000000000.0, 1000000000.0] and parameters: {'p_sma': 11, 'p_std': 31, 'p_atr': 14, 'p_adx': 12, 'rsi_period': 14, 'ema1': 20, 'ema2': 58, 'slip_atr_k': 0.030785928208363265, 'slip_spread_k': 0.2877934625636267, 'spread_hl_frac': 0.008495418235192505, 'bb_std_mult': 1.5054784834164674, 'rsi_os': 39, 'rsi_ob': 83, 'vol_spike': 0.22917705309845582, 'adx_thresh': 14.280231235644607, 'atr_min_pct': 1.4205935374314073e-05, 'atr_max_pct': 0.08258771252180538, 'tp_mult': 1.3295550367615694, 'tsl_mult': 0.29826055253712536, 'strategy': 'breakout', 'time_stop': 223, 'use_sma': False, 'use_atr': True, 'use_adx': False, 'use_ema': True, 'use_spike': False, 'rsi_required': True, 'edge_k': 0.5485756240935279, 'edge_cap': 0.6974441349470947, 'bull_strategy': 'breakout', 'bull_bb_std_mult': 3.3195306286330504, 'bull_rsi_os': 15, 'bull_rsi_ob': 66, 'bull_adx_thresh': 24.719799779725697, 'bull_atr_min_pct': 0.0012129454651779385, 'bull_atr_max_pct': 0.05503686934099314, 'bull_tp_mult': 2.730002646277647, 'bull_tsl_mult': 0.24052032281903332, 'bull_time_stop': 38, 'bull_use_sma': True, 'bull_use_ema': True, 'bull_use_atr': True, 'bull_use_adx': True, 'bull_use_spike': True, 'bull_rsi_required': True, 'bear_strategy': 'mean_reversion', 'bear_bb_std_mult': 1.6488250285661448, 'bear_rsi_os': 45, 'bear_rsi_ob': 54, 'bear_adx_thresh': 17.42581294786352, 'bear_atr_min_pct': 0.020679301922147505, 'bear_atr_max_pct': 0.039792985256928426, 'bear_tp_mult': 2.7456285618691405, 'bear_tsl_mult': 0.5459789263971004, 'bear_time_stop': 176, 'bear_use_sma': True, 'bear_use_ema': False, 'bear_use_atr': False, 'bear_use_adx': True, 'bear_use_spike': True, 'bear_rsi_required': False, 'sideways_strategy': 'mean_reversion', 'sideways_bb_std_mult': 1.7638997833958827, 'sideways_rsi_os': 39, 'sideways_rsi_ob': 83, 'sideways_adx_thresh': 33.219056492736264, 'sideways_atr_min_pct': 0.000785687090005982, 'sideways_atr_max_pct': 0.01420705590656788, 'sideways_tp_mult': 2.870678642235049, 'sideways_tsl_mult': 0.2523889625560418, 'sideways_time_stop': 135, 'sideways_use_sma': False, 'sideways_use_ema': True, 'sideways_use_atr': True, 'sideways_use_adx': False, 'sideways_use_spike': False, 'sideways_rsi_required': True}.
[I 2025-08-30 21:04:12,802] Trial 137 finished with values: [-1000000000.0, 1000000000.0] and parameters: {'p_sma': 13, 'p_std': 39, 'p_atr': 14, 'p_adx': 12, 'rsi_period': 21, 'ema1': 25, 'ema2': 10, 'slip_atr_k': 0.1489129138202178, 'slip_spread_k': 0.755186243622974, 'spread_hl_frac': 0.04461806175764221, 'bb_std_mult': 2.7035259385655306, 'rsi_os': 44, 'rsi_ob': 87, 'vol_spike': 0.18872402835685226, 'adx_thresh': 20.384498943011586, 'atr_min_pct': 6.203506032608945e-05, 'atr_max_pct': 0.11128611073730527, 'tp_mult': 1.3803302169051856, 'tsl_mult': 0.883408158181698, 'strategy': 'breakout', 'time_stop': 192, 'use_sma': False, 'use_atr': False, 'use_adx': False, 'use_ema': True, 'use_spike': False, 'rsi_required': False, 'edge_k': 1.6374274655595518, 'edge_cap': 0.6473161015983783, 'bull_strategy': 'breakout', 'bull_bb_std_mult': 3.3215240651912405, 'bull_rsi_os': 15, 'bull_rsi_ob': 70, 'bull_adx_thresh': 15.630058333722626, 'bull_atr_min_pct': 0.0078405603672053, 'bull_atr_max_pct': 0.04124605490182054, 'bull_tp_mult': 2.514551975825079, 'bull_tsl_mult': 0.2604820754267435, 'bull_time_stop': 42, 'bull_use_sma': True, 'bull_use_ema': True, 'bull_use_atr': True, 'bull_use_adx': True, 'bull_use_spike': True, 'bull_rsi_required': True, 'bear_strategy': 'mean_reversion', 'bear_bb_std_mult': 2.5879042315199765, 'bear_rsi_os': 49, 'bear_rsi_ob': 54, 'bear_adx_thresh': 34.91093415679005, 'bear_atr_min_pct': 0.012591822599180243, 'bear_atr_max_pct': 0.03905075092825788, 'bear_tp_mult': 2.7337773062631054, 'bear_tsl_mult': 0.5505923863747842, 'bear_time_stop': 91, 'bear_use_sma': True, 'bear_use_ema': False, 'bear_use_atr': False, 'bear_use_adx': True, 'bear_use_spike': False, 'bear_rsi_required': False, 'sideways_strategy': 'breakout', 'sideways_bb_std_mult': 2.092586944339739, 'sideways_rsi_os': 7, 'sideways_rsi_ob': 93, 'sideways_adx_thresh': 20.369114784616222, 'sideways_atr_min_pct': 0.016561027124351237, 'sideways_atr_max_pct': 0.013366879651977161, 'sideways_tp_mult': 2.658709324168923, 'sideways_tsl_mult': 0.2507861028577464, 'sideways_time_stop': 149, 'sideways_use_sma': True, 'sideways_use_ema': True, 'sideways_use_atr': True, 'sideways_use_adx': False, 'sideways_use_spike': True, 'sideways_rsi_required': True}.
[I 2025-08-30 21:04:12,898] Trial 136 finished with values: [-1000000000.0, 1000000000.0] and parameters: {'p_sma': 11, 'p_std': 48, 'p_atr': 14, 'p_adx': 11, 'rsi_period': 12, 'ema1': 21, 'ema2': 60, 'slip_atr_k': 0.19845923666221002, 'slip_spread_k': 0.5497429982932918, 'spread_hl_frac': 0.03182656398392916, 'bb_std_mult': 1.2109478031441256, 'rsi_os': 44, 'rsi_ob': 81, 'vol_spike': 0.27361905339917114, 'adx_thresh': 20.695294363845434, 'atr_min_pct': 0.001904714707407888, 'atr_max_pct': 0.08409166443114709, 'tp_mult': 1.308535024085138, 'tsl_mult': 0.8468632929784372, 'strategy': 'breakout', 'time_stop': 204, 'use_sma': False, 'use_atr': False, 'use_adx': False, 'use_ema': True, 'use_spike': False, 'rsi_required': False, 'edge_k': 1.6400806093878637, 'edge_cap': 0.054186045846782604, 'bull_strategy': 'breakout', 'bull_bb_std_mult': 0.5885411607817481, 'bull_rsi_os': 17, 'bull_rsi_ob': 66, 'bull_adx_thresh': 15.46505692828056, 'bull_atr_min_pct': 0.00047321887613848497, 'bull_atr_max_pct': 0.04880363324274146, 'bull_tp_mult': 2.7264253949208275, 'bull_tsl_mult': 0.2756992156399919, 'bull_time_stop': 9, 'bull_use_sma': True, 'bull_use_ema': True, 'bull_use_atr': True, 'bull_use_adx': True, 'bull_use_spike': True, 'bull_rsi_required': True, 'bear_strategy': 'mean_reversion', 'bear_bb_std_mult': 2.074772073156842, 'bear_rsi_os': 46, 'bear_rsi_ob': 53, 'bear_adx_thresh': 17.51811126416592, 'bear_atr_min_pct': 0.020680714425495336, 'bear_atr_max_pct': 0.03977787432786899, 'bear_tp_mult': 2.9313049589916553, 'bear_tsl_mult': 0.5532914328464766, 'bear_time_stop': 88, 'bear_use_sma': True, 'bear_use_ema': False, 'bear_use_atr': False, 'bear_use_adx': True, 'bear_use_spike': False, 'bear_rsi_required': False, 'sideways_strategy': 'breakout', 'sideways_bb_std_mult': 2.1231692061622454, 'sideways_rsi_os': 6, 'sideways_rsi_ob': 66, 'sideways_adx_thresh': 32.94963379743567, 'sideways_atr_min_pct': 0.0075804698619720045, 'sideways_atr_max_pct': 0.015070272942149172, 'sideways_tp_mult': 1.41210147264843, 'sideways_tsl_mult': 0.056590738117039796, 'sideways_time_stop': 151, 'sideways_use_sma': True, 'sideways_use_ema': True, 'sideways_use_atr': True, 'sideways_use_adx': False, 'sideways_use_spike': True, 'sideways_rsi_required': True}.
[I 2025-08-30 21:04:48,045] Trial 138 finished with values: [-1000000000.0, 1000000000.0] and parameters: {'p_sma': 11, 'p_std': 48, 'p_atr': 19, 'p_adx': 28, 'rsi_period': 21, 'ema1': 18, 'ema2': 41, 'slip_atr_k': 0.0726530367327983, 'slip_spread_k': 0.8997374767990789, 'spread_hl_frac': 0.04411065294285445, 'bb_std_mult': 1.526319028337807, 'rsi_os': 45, 'rsi_ob': 87, 'vol_spike': 0.2521581671018976, 'adx_thresh': 23.30093002273816, 'atr_min_pct': 0.02668061135722962, 'atr_max_pct': 0.11785576449027949, 'tp_mult': 2.771255008357339, 'tsl_mult': 0.8542810589167611, 'strategy': 'breakout', 'time_stop': 202, 'use_sma': False, 'use_atr': False, 'use_adx': False, 'use_ema': True, 'use_spike': False, 'rsi_required': False, 'edge_k': 1.626239527103899, 'edge_cap': 0.6553118541852921, 'bull_strategy': 'breakout', 'bull_bb_std_mult': 3.322627865753727, 'bull_rsi_os': 16, 'bull_rsi_ob': 47, 'bull_adx_thresh': 13.741249866971334, 'bull_atr_min_pct': 0.00036205630679230177, 'bull_atr_max_pct': 0.0409468346888584, 'bull_tp_mult': 2.717052639695021, 'bull_tsl_mult': 0.266445977199703, 'bull_time_stop': 274, 'bull_use_sma': True, 'bull_use_ema': True, 'bull_use_atr': True, 'bull_use_adx': True, 'bull_use_spike': True, 'bull_rsi_required': True, 'bear_strategy': 'mean_reversion', 'bear_bb_std_mult': 2.0710893533464314, 'bear_rsi_os': 49, 'bear_rsi_ob': 54, 'bear_adx_thresh': 17.433837413366742, 'bear_atr_min_pct': 0.01659005503408674, 'bear_atr_max_pct': 0.04366152089557445, 'bear_tp_mult': 2.7573807347271213, 'bear_tsl_mult': 0.1406076282001471, 'bear_time_stop': 86, 'bear_use_sma': True, 'bear_use_ema': False, 'bear_use_atr': False, 'bear_use_adx': True, 'bear_use_spike': False, 'bear_rsi_required': False, 'sideways_strategy': 'breakout', 'sideways_bb_std_mult': 2.1225330014550186, 'sideways_rsi_os': 54, 'sideways_rsi_ob': 93, 'sideways_adx_thresh': 33.114306341949394, 'sideways_atr_min_pct': 0.023229152802547597, 'sideways_atr_max_pct': 0.014976895201033876, 'sideways_tp_mult': 1.398881583861566, 'sideways_tsl_mult': 0.3059466277420186, 'sideways_time_stop': 237, 'sideways_use_sma': True, 'sideways_use_ema': True, 'sideways_use_atr': True, 'sideways_use_adx': False, 'sideways_use_spike': True, 'sideways_rsi_required': True}.
[I 2025-08-30 21:04:48,529] Trial 141 finished with values: [-1000000000.0, 1000000000.0] and parameters: {'p_sma': 57, 'p_std': 34, 'p_atr': 16, 'p_adx': 28, 'rsi_period': 18, 'ema1': 19, 'ema2': 41, 'slip_atr_k': 0.0724056475007125, 'slip_spread_k': 0.8070698900450906, 'spread_hl_frac': 0.024148104723954095, 'bb_std_mult': 2.1692537002846954, 'rsi_os': 48, 'rsi_ob': 94, 'vol_spike': 0.1693943575985531, 'adx_thresh': 11.483616271859567, 'atr_min_pct': 0.0036034421391672915, 'atr_max_pct': 0.0786381986193874, 'tp_mult': 2.7774560633604004, 'tsl_mult': 0.9912100571765006, 'strategy': 'mean_reversion', 'time_stop': 183, 'use_sma': False, 'use_atr': True, 'use_adx': True, 'use_ema': True, 'use_spike': True, 'rsi_required': True, 'edge_k': 0.6649679755449186, 'edge_cap': 0.51079509515529, 'bull_strategy': 'breakout', 'bull_bb_std_mult': 2.993518706959047, 'bull_rsi_os': 17, 'bull_rsi_ob': 72, 'bull_adx_thresh': 13.552892431384496, 'bull_atr_min_pct': 0.017131930293572812, 'bull_atr_max_pct': 0.11747995188075218, 'bull_tp_mult': 2.4422363933741114, 'bull_tsl_mult': 0.482827624230182, 'bull_time_stop': 273, 'bull_use_sma': True, 'bull_use_ema': False, 'bull_use_atr': False, 'bull_use_adx': True, 'bull_use_spike': True, 'bull_rsi_required': True, 'bear_strategy': 'mean_reversion', 'bear_bb_std_mult': 2.762409953747418, 'bear_rsi_os': 24, 'bear_rsi_ob': 94, 'bear_adx_thresh': 29.484312120643153, 'bear_atr_min_pct': 0.016441671661937444, 'bear_atr_max_pct': 0.0449154771684548, 'bear_tp_mult': 2.99796549804791, 'bear_tsl_mult': 0.09623420058697568, 'bear_time_stop': 166, 'bear_use_sma': True, 'bear_use_ema': False, 'bear_use_atr': False, 'bear_use_adx': True, 'bear_use_spike': True, 'bear_rsi_required': True, 'sideways_strategy': 'breakout', 'sideways_bb_std_mult': 3.1372929201417423, 'sideways_rsi_os': 28, 'sideways_rsi_ob': 46, 'sideways_adx_thresh': 16.06502598601015, 'sideways_atr_min_pct': 0.0068701867132357035, 'sideways_atr_max_pct': 0.11775299427168232, 'sideways_tp_mult': 2.7137940542419465, 'sideways_tsl_mult': 0.3164113638694136, 'sideways_time_stop': 238, 'sideways_use_sma': False, 'sideways_use_ema': True, 'sideways_use_atr': True, 'sideways_use_adx': False, 'sideways_use_spike': False, 'sideways_rsi_required': True}.
[I 2025-08-30 21:04:48,870] Trial 139 finished with values: [-1000000000.0, 1000000000.0] and parameters: {'p_sma': 34, 'p_std': 40, 'p_atr': 20, 'p_adx': 28, 'rsi_period': 12, 'ema1': 25, 'ema2': 41, 'slip_atr_k': 0.07049914347239913, 'slip_spread_k': 0.7477811421258201, 'spread_hl_frac': 0.04391535321713035, 'bb_std_mult': 1.326722745862517, 'rsi_os': 48, 'rsi_ob': 87, 'vol_spike': 0.2984592634716475, 'adx_thresh': 24.662103034887053, 'atr_min_pct': 0.003705581730976803, 'atr_max_pct': 0.0863902556801893, 'tp_mult': 2.7893540847189353, 'tsl_mult': 0.6702013679494497, 'strategy': 'breakout', 'time_stop': 186, 'use_sma': False, 'use_atr': False, 'use_adx': False, 'use_ema': True, 'use_spike': False, 'rsi_required': False, 'edge_k': 0.693938118269571, 'edge_cap': 0.0756666999462196, 'bull_strategy': 'breakout', 'bull_bb_std_mult': 1.2054568581555356, 'bull_rsi_os': 17, 'bull_rsi_ob': 72, 'bull_adx_thresh': 13.467797661986639, 'bull_atr_min_pct': 0.01746626091157717, 'bull_atr_max_pct': 0.04034120910655491, 'bull_tp_mult': 1.5134768266742569, 'bull_tsl_mult': 0.26814249269400464, 'bull_time_stop': 13, 'bull_use_sma': True, 'bull_use_ema': True, 'bull_use_atr': True, 'bull_use_adx': True, 'bull_use_spike': True, 'bull_rsi_required': True, 'bear_strategy': 'mean_reversion', 'bear_bb_std_mult': 2.0725145466647574, 'bear_rsi_os': 49, 'bear_rsi_ob': 93, 'bear_adx_thresh': 18.54883731045181, 'bear_atr_min_pct': 0.01905722362771362, 'bear_atr_max_pct': 0.0957787217477137, 'bear_tp_mult': 2.9994187320863572, 'bear_tsl_mult': 0.4923653703575672, 'bear_time_stop': 164, 'bear_use_sma': True, 'bear_use_ema': False, 'bear_use_atr': False, 'bear_use_adx': True, 'bear_use_spike': False, 'bear_rsi_required': False, 'sideways_strategy': 'breakout', 'sideways_bb_std_mult': 0.5970183311058803, 'sideways_rsi_os': 7, 'sideways_rsi_ob': 94, 'sideways_adx_thresh': 7.326138103584107, 'sideways_atr_min_pct': 0.007494921110983858, 'sideways_atr_max_pct': 0.08348891617171045, 'sideways_tp_mult': 1.3846190308457784, 'sideways_tsl_mult': 0.05242595288244939, 'sideways_time_stop': 168, 'sideways_use_sma': True, 'sideways_use_ema': True, 'sideways_use_atr': True, 'sideways_use_adx': False, 'sideways_use_spike': True, 'sideways_rsi_required': True}.
[I 2025-08-30 21:04:48,998] Trial 140 finished with values: [-1000000000.0, 1000000000.0] and parameters: {'p_sma': 8, 'p_std': 34, 'p_atr': 19, 'p_adx': 28, 'rsi_period': 18, 'ema1': 21, 'ema2': 41, 'slip_atr_k': 0.06861734476521586, 'slip_spread_k': 0.16899231761281047, 'spread_hl_frac': 0.023589270217208663, 'bb_std_mult': 1.60951494160504, 'rsi_os': 33, 'rsi_ob': 94, 'vol_spike': 0.2710258407739731, 'adx_thresh': 24.623197746258136, 'atr_min_pct': 0.02654000859611505, 'atr_max_pct': 0.11523374232503912, 'tp_mult': 1.1005033481280333, 'tsl_mult': 0.9987430319594961, 'strategy': 'mean_reversion', 'time_stop': 183, 'use_sma': False, 'use_atr': False, 'use_adx': True, 'use_ema': True, 'use_spike': True, 'rsi_required': False, 'edge_k': 0.68460315454083, 'edge_cap': 0.10990447366937134, 'bull_strategy': 'breakout', 'bull_bb_std_mult': 3.1207411035334918, 'bull_rsi_os': 17, 'bull_rsi_ob': 72, 'bull_adx_thresh': 13.569046059489393, 'bull_atr_min_pct': 0.016923828361687314, 'bull_atr_max_pct': 0.11513086852927298, 'bull_tp_mult': 2.422358611333975, 'bull_tsl_mult': 0.28334308252151275, 'bull_time_stop': 275, 'bull_use_sma': True, 'bull_use_ema': False, 'bull_use_atr': False, 'bull_use_adx': True, 'bull_use_spike': True, 'bull_rsi_required': True, 'bear_strategy': 'mean_reversion', 'bear_bb_std_mult': 2.632113364446226, 'bear_rsi_os': 51, 'bear_rsi_ob': 52, 'bear_adx_thresh': 18.471085303035704, 'bear_atr_min_pct': 0.01654432265438125, 'bear_atr_max_pct': 0.049555805203807035, 'bear_tp_mult': 2.937857854542399, 'bear_tsl_mult': 0.5726763274632307, 'bear_time_stop': 132, 'bear_use_sma': True, 'bear_use_ema': False, 'bear_use_atr': False, 'bear_use_adx': True, 'bear_use_spike': False, 'bear_rsi_required': True, 'sideways_strategy': 'breakout', 'sideways_bb_std_mult': 1.990035404422622, 'sideways_rsi_os': 26, 'sideways_rsi_ob': 87, 'sideways_adx_thresh': 7.813405280882552, 'sideways_atr_min_pct': 0.0074480388034382965, 'sideways_atr_max_pct': 0.11710217000649442, 'sideways_tp_mult': 1.8609259706980759, 'sideways_tsl_mult': 0.04541342617305294, 'sideways_time_stop': 172, 'sideways_use_sma': True, 'sideways_use_ema': True, 'sideways_use_atr': True, 'sideways_use_adx': False, 'sideways_use_spike': True, 'sideways_rsi_required': True}.
[I 2025-08-30 21:05:24,429] Trial 142 finished with values: [-1000000000.0, 1000000000.0] and parameters: {'p_sma': 8, 'p_std': 34, 'p_atr': 16, 'p_adx': 30, 'rsi_period': 19, 'ema1': 18, 'ema2': 44, 'slip_atr_k': 0.24380738198267168, 'slip_spread_k': 0.6919039517988437, 'spread_hl_frac': 0.004268603193995478, 'bb_std_mult': 1.617459879163146, 'rsi_os': 48, 'rsi_ob': 64, 'vol_spike': 0.1693793241150759, 'adx_thresh': 11.45347951373964, 'atr_min_pct': 0.022005704936006724, 'atr_max_pct': 0.0782059502213659, 'tp_mult': 1.5695541604522467, 'tsl_mult': 0.9966368154741679, 'strategy': 'mean_reversion', 'time_stop': 232, 'use_sma': False, 'use_atr': True, 'use_adx': True, 'use_ema': True, 'use_spike': True, 'rsi_required': True, 'edge_k': 0.6845962131565559, 'edge_cap': 0.18015325087396616, 'bull_strategy': 'breakout', 'bull_bb_std_mult': 0.8297129849049061, 'bull_rsi_os': 19, 'bull_rsi_ob': 72, 'bull_adx_thresh': 20.537171788469557, 'bull_atr_min_pct': 0.01705634520368462, 'bull_atr_max_pct': 0.11560319721712495, 'bull_tp_mult': 2.8463180998504036, 'bull_tsl_mult': 0.19480356269511118, 'bull_time_stop': 231, 'bull_use_sma': False, 'bull_use_ema': False, 'bull_use_atr': False, 'bull_use_adx': True, 'bull_use_spike': True, 'bull_rsi_required': False, 'bear_strategy': 'mean_reversion', 'bear_bb_std_mult': 2.43879845461116, 'bear_rsi_os': 24, 'bear_rsi_ob': 52, 'bear_adx_thresh': 29.578396654641658, 'bear_atr_min_pct': 0.018997540406524894, 'bear_atr_max_pct': 0.09469887130213189, 'bear_tp_mult': 2.9937659148237974, 'bear_tsl_mult': 0.8676899308139974, 'bear_time_stop': 129, 'bear_use_sma': True, 'bear_use_ema': False, 'bear_use_atr': False, 'bear_use_adx': True, 'bear_use_spike': True, 'bear_rsi_required': True, 'sideways_strategy': 'breakout', 'sideways_bb_std_mult': 2.2704514719711106, 'sideways_rsi_os': 35, 'sideways_rsi_ob': 47, 'sideways_adx_thresh': 15.73097899709646, 'sideways_atr_min_pct': 0.014389659703331033, 'sideways_atr_max_pct': 0.010069247499045603, 'sideways_tp_mult': 1.3099929834773834, 'sideways_tsl_mult': 0.16391771355679002, 'sideways_time_stop': 167, 'sideways_use_sma': False, 'sideways_use_ema': True, 'sideways_use_atr': True, 'sideways_use_adx': False, 'sideways_use_spike': False, 'sideways_rsi_required': True}.
[I 2025-08-30 21:05:24,981] Trial 143 finished with values: [-1000000000.0, 1000000000.0] and parameters: {'p_sma': 6, 'p_std': 40, 'p_atr': 18, 'p_adx': 15, 'rsi_period': 57, 'ema1': 26, 'ema2': 44, 'slip_atr_k': 0.021828561312547307, 'slip_spread_k': 0.6892142299514479, 'spread_hl_frac': 0.03972547215093885, 'bb_std_mult': 1.337825022531925, 'rsi_os': 41, 'rsi_ob': 73, 'vol_spike': 0.13314766433495925, 'adx_thresh': 24.576095274824308, 'atr_min_pct': 0.003278792665588985, 'atr_max_pct': 0.09108252209481829, 'tp_mult': 1.1140971663180008, 'tsl_mult': 0.6746939193643953, 'strategy': 'mean_reversion', 'time_stop': 112, 'use_sma': False, 'use_atr': True, 'use_adx': True, 'use_ema': True, 'use_spike': True, 'rsi_required': True, 'edge_k': 0.5857420766645168, 'edge_cap': 0.09835901773529765, 'bull_strategy': 'breakout', 'bull_bb_std_mult': 3.114746312995249, 'bull_rsi_os': 20, 'bull_rsi_ob': 71, 'bull_adx_thresh': 16.24574718422424, 'bull_atr_min_pct': 0.002047078262128405, 'bull_atr_max_pct': 0.05912060365847196, 'bull_tp_mult': 2.964910096779095, 'bull_tsl_mult': 0.19019936791174408, 'bull_time_stop': 300, 'bull_use_sma': False, 'bull_use_ema': False, 'bull_use_atr': False, 'bull_use_adx': True, 'bull_use_spike': True, 'bull_rsi_required': False, 'bear_strategy': 'mean_reversion', 'bear_bb_std_mult': 2.634825882435226, 'bear_rsi_os': 54, 'bear_rsi_ob': 52, 'bear_adx_thresh': 18.82821657564733, 'bear_atr_min_pct': 0.019436746723331615, 'bear_atr_max_pct': 0.07929892016431976, 'bear_tp_mult': 1.695460007615229, 'bear_tsl_mult': 0.4974055908223337, 'bear_time_stop': 42, 'bear_use_sma': True, 'bear_use_ema': False, 'bear_use_atr': False, 'bear_use_adx': True, 'bear_use_spike': True, 'bear_rsi_required': True, 'sideways_strategy': 'breakout', 'sideways_bb_std_mult': 1.9593820383157925, 'sideways_rsi_os': 41, 'sideways_rsi_ob': 87, 'sideways_adx_thresh': 30.160320009168665, 'sideways_atr_min_pct': 0.010068271351803477, 'sideways_atr_max_pct': 0.010046359993254662, 'sideways_tp_mult': 2.529467339737675, 'sideways_tsl_mult': 0.6965155866407526, 'sideways_time_stop': 125, 'sideways_use_sma': False, 'sideways_use_ema': True, 'sideways_use_atr': True, 'sideways_use_adx': False, 'sideways_use_spike': False, 'sideways_rsi_required': True}.
