[I 2025-08-30 22:15:22,094] Trial 720 finished with values: [-1000000000.0, 1000000000.0] and parameters: {'p_sma': 18, 'p_std': 49, 'p_atr': 28, 'p_adx': 17, 'rsi_period': 62, 'ema1': 13, 'ema2': 55, 'slip_atr_k': 0.026270251970705552, 'slip_spread_k': 0.8410180036650468, 'spread_hl_frac': 0.013413630822932345, 'bb_std_mult': 0.7104826509954768, 'rsi_os': 10, 'rsi_ob': 66, 'vol_spike': 0.2797211226753699, 'adx_thresh': 11.528684327241843, 'atr_min_pct': 0.01184988326765531, 'atr_max_pct': 0.1395608250749001, 'tp_mult': 1.1154336106988127, 'tsl_mult': 0.3275519683673943, 'strategy': 'mean_reversion', 'time_stop': 91, 'use_sma': True, 'use_atr': True, 'use_adx': False, 'use_ema': True, 'use_spike': False, 'rsi_required': True, 'edge_k': 0.049773280218823546, 'edge_cap': 0.8337011501477164, 'bull_strategy': 'breakout', 'bull_bb_std_mult': 3.104062705285597, 'bull_rsi_os': 26, 'bull_rsi_ob': 87, 'bull_adx_thresh': 25.81254777624009, 'bull_atr_min_pct': 0.000504796791123032, 'bull_atr_max_pct': 0.03757961197172576, 'bull_tp_mult': 2.8121328161035786, 'bull_tsl_mult': 0.3248910307093844, 'bull_time_stop': 300, 'bull_use_sma': True, 'bull_use_ema': False, 'bull_use_atr': False, 'bull_use_adx': False, 'bull_use_spike': False, 'bull_rsi_required': False, 'bear_strategy': 'breakout', 'bear_bb_std_mult': 1.6114158390048066, 'bear_rsi_os': 44, 'bear_rsi_ob': 48, 'bear_adx_thresh': 26.08609866654735, 'bear_atr_min_pct': 0.0058203335202964435, 'bear_atr_max_pct': 0.11920733694820536, 'bear_tp_mult': 1.5678370254051097, 'bear_tsl_mult': 0.3909260051864361, 'bear_time_stop': 234, 'bear_use_sma': True, 'bear_use_ema': True, 'bear_use_atr': False, 'bear_use_adx': True, 'bear_use_spike': False, 'bear_rsi_required': False, 'sideways_strategy': 'breakout', 'sideways_bb_std_mult': 1.7593083897504997, 'sideways_rsi_os': 35, 'sideways_rsi_ob': 93, 'sideways_adx_thresh': 21.64796175994466, 'sideways_atr_min_pct': 0.022290354144453756, 'sideways_atr_max_pct': 0.052031843020091756, 'sideways_tp_mult': 2.3780786906884304, 'sideways_tsl_mult': 0.7206668105847245, 'sideways_time_stop': 76, 'sideways_use_sma': True, 'sideways_use_ema': False, 'sideways_use_atr': False, 'sideways_use_adx': True, 'sideways_use_spike': True, 'sideways_rsi_required': False}.
[I 2025-08-30 22:15:25,019] Trial 721 finished with values: [-1000000000.0, 1000000000.0] and parameters: {'p_sma': 43, 'p_std': 36, 'p_atr': 28, 'p_adx': 21, 'rsi_period': 74, 'ema1': 11, 'ema2': 52, 'slip_atr_k': 0.02812244028165421, 'slip_spread_k': 0.15509174273106874, 'spread_hl_frac': 0.022822742488792243, 'bb_std_mult': 0.8849480801536881, 'rsi_os': 23, 'rsi_ob': 75, 'vol_spike': 0.27622416542302514, 'adx_thresh': 9.023959856885387, 'atr_min_pct': 0.01150339654630982, 'atr_max_pct': 0.0279770880802004, 'tp_mult': 1.7795998843914593, 'tsl_mult': 0.9622050854996682, 'strategy': 'mean_reversion', 'time_stop': 90, 'use_sma': False, 'use_atr': True, 'use_adx': False, 'use_ema': False, 'use_spike': False, 'rsi_required': True, 'edge_k': 0.9281567639499347, 'edge_cap': 0.5152524906669603, 'bull_strategy': 'breakout', 'bull_bb_std_mult': 1.9366240002901658, 'bull_rsi_os': 15, 'bull_rsi_ob': 85, 'bull_adx_thresh': 16.094180219258554, 'bull_atr_min_pct': 0.003751029870974375, 'bull_atr_max_pct': 0.14785421330423337, 'bull_tp_mult': 1.451270730872567, 'bull_tsl_mult': 0.7767062467775108, 'bull_time_stop': 194, 'bull_use_sma': False, 'bull_use_ema': True, 'bull_use_atr': False, 'bull_use_adx': False, 'bull_use_spike': False, 'bull_rsi_required': False, 'bear_strategy': 'breakout', 'bear_bb_std_mult': 1.8571225288534887, 'bear_rsi_os': 7, 'bear_rsi_ob': 84, 'bear_adx_thresh': 26.292677337102006, 'bear_atr_min_pct': 0.02997464338329389, 'bear_atr_max_pct': 0.11387902498427084, 'bear_tp_mult': 1.5613854174563944, 'bear_tsl_mult': 0.3054351891269318, 'bear_time_stop': 235, 'bear_use_sma': True, 'bear_use_ema': True, 'bear_use_atr': False, 'bear_use_adx': False, 'bear_use_spike': False, 'bear_rsi_required': False, 'sideways_strategy': 'mean_reversion', 'sideways_bb_std_mult': 1.76104541212528, 'sideways_rsi_os': 35, 'sideways_rsi_ob': 74, 'sideways_adx_thresh': 28.210462172129866, 'sideways_atr_min_pct': 0.012473645362959605, 'sideways_atr_max_pct': 0.051255208176069614, 'sideways_tp_mult': 1.1033607358291726, 'sideways_tsl_mult': 0.7200952019224744, 'sideways_time_stop': 237, 'sideways_use_sma': True, 'sideways_use_ema': False, 'sideways_use_atr': False, 'sideways_use_adx': True, 'sideways_use_spike': True, 'sideways_rsi_required': False}.
[I 2025-08-30 22:15:28,517] Trial 722 finished with values: [-1000000000.0, 1000000000.0] and parameters: {'p_sma': 33, 'p_std': 36, 'p_atr': 24, 'p_adx': 21, 'rsi_period': 62, 'ema1': 11, 'ema2': 52, 'slip_atr_k': 0.026643446842720606, 'slip_spread_k': 0.6288310011725581, 'spread_hl_frac': 0.03108873117054808, 'bb_std_mult': 0.5329651670149518, 'rsi_os': 23, 'rsi_ob': 75, 'vol_spike': 0.11224704027905769, 'adx_thresh': 9.085883797615685, 'atr_min_pct': 0.01170134298385196, 'atr_max_pct': 0.014808379142199457, 'tp_mult': 1.7871428591107206, 'tsl_mult': 0.47371306544997055, 'strategy': 'mean_reversion', 'time_stop': 86, 'use_sma': False, 'use_atr': True, 'use_adx': False, 'use_ema': False, 'use_spike': False, 'rsi_required': True, 'edge_k': 0.05132458658819361, 'edge_cap': 0.7595846249075033, 'bull_strategy': 'mean_reversion', 'bull_bb_std_mult': 2.1277531406569086, 'bull_rsi_os': 5, 'bull_rsi_ob': 91, 'bull_adx_thresh': 15.882306880233998, 'bull_atr_min_pct': 0.0009219945008170099, 'bull_atr_max_pct': 0.1469165073314701, 'bull_tp_mult': 1.412078719927486, 'bull_tsl_mult': 0.3671621739144451, 'bull_time_stop': 300, 'bull_use_sma': False, 'bull_use_ema': True, 'bull_use_atr': False, 'bull_use_adx': True, 'bull_use_spike': True, 'bull_rsi_required': True, 'bear_strategy': 'breakout', 'bear_bb_std_mult': 1.6016217112591322, 'bear_rsi_os': 44, 'bear_rsi_ob': 73, 'bear_adx_thresh': 27.962462511277742, 'bear_atr_min_pct': 0.023015494971196357, 'bear_atr_max_pct': 0.113988161316696, 'bear_tp_mult': 1.565145767815273, 'bear_tsl_mult': 0.3889662198699044, 'bear_time_stop': 236, 'bear_use_sma': True, 'bear_use_ema': True, 'bear_use_atr': False, 'bear_use_adx': False, 'bear_use_spike': False, 'bear_rsi_required': True, 'sideways_strategy': 'mean_reversion', 'sideways_bb_std_mult': 1.7551291675164318, 'sideways_rsi_os': 39, 'sideways_rsi_ob': 89, 'sideways_adx_thresh': 28.282532760028108, 'sideways_atr_min_pct': 0.012399792714867082, 'sideways_atr_max_pct': 0.03943704579114025, 'sideways_tp_mult': 1.302040857914052, 'sideways_tsl_mult': 0.824804150711605, 'sideways_time_stop': 239, 'sideways_use_sma': True, 'sideways_use_ema': True, 'sideways_use_atr': False, 'sideways_use_adx': True, 'sideways_use_spike': True, 'sideways_rsi_required': True}.
[I 2025-08-30 22:16:02,210] Trial 723 finished with values: [-1000000000.0, 1000000000.0] and parameters: {'p_sma': 33, 'p_std': 37, 'p_atr': 28, 'p_adx': 26, 'rsi_period': 49, 'ema1': 11, 'ema2': 27, 'slip_atr_k': 0.0367190562870255, 'slip_spread_k': 0.3606925017219378, 'spread_hl_frac': 0.03234359677019996, 'bb_std_mult': 0.866371960800571, 'rsi_os': 37, 'rsi_ob': 66, 'vol_spike': 0.05818341579301585, 'adx_thresh': 5.031587596438374, 'atr_min_pct': 0.01338797170285339, 'atr_max_pct': 0.026919358427657532, 'tp_mult': 1.0981832177494195, 'tsl_mult': 0.9586844317710481, 'strategy': 'mean_reversion', 'time_stop': 105, 'use_sma': False, 'use_atr': True, 'use_adx': False, 'use_ema': False, 'use_spike': False, 'rsi_required': False, 'edge_k': 1.2757100169671856, 'edge_cap': 0.858074401477777, 'bull_strategy': 'mean_reversion', 'bull_bb_std_mult': 1.9220378576819168, 'bull_rsi_os': 15, 'bull_rsi_ob': 91, 'bull_adx_thresh': 14.702737634361252, 'bull_atr_min_pct': 0.000978805844761468, 'bull_atr_max_pct': 0.056699927753399555, 'bull_tp_mult': 1.4428261846761736, 'bull_tsl_mult': 0.3239676740407902, 'bull_time_stop': 66, 'bull_use_sma': False, 'bull_use_ema': True, 'bull_use_atr': False, 'bull_use_adx': True, 'bull_use_spike': True, 'bull_rsi_required': False, 'bear_strategy': 'breakout', 'bear_bb_std_mult': 2.033791119232339, 'bear_rsi_os': 8, 'bear_rsi_ob': 88, 'bear_adx_thresh': 10.216387910108637, 'bear_atr_min_pct': 0.025481970609006227, 'bear_atr_max_pct': 0.11959702539157867, 'bear_tp_mult': 1.5594679247751642, 'bear_tsl_mult': 0.39685085657057384, 'bear_time_stop': 235, 'bear_use_sma': True, 'bear_use_ema': True, 'bear_use_atr': False, 'bear_use_adx': False, 'bear_use_spike': False, 'bear_rsi_required': False, 'sideways_strategy': 'mean_reversion', 'sideways_bb_std_mult': 1.7737834671633024, 'sideways_rsi_os': 15, 'sideways_rsi_ob': 50, 'sideways_adx_thresh': 27.568936223253647, 'sideways_atr_min_pct': 0.02065115304806234, 'sideways_atr_max_pct': 0.08802233049302369, 'sideways_tp_mult': 2.43894439384566, 'sideways_tsl_mult': 0.7207249377919279, 'sideways_time_stop': 155, 'sideways_use_sma': True, 'sideways_use_ema': True, 'sideways_use_atr': True, 'sideways_use_adx': True, 'sideways_use_spike': True, 'sideways_rsi_required': True}.
[I 2025-08-30 22:16:02,496] Trial 724 finished with values: [-1000000000.0, 1000000000.0] and parameters: {'p_sma': 33, 'p_std': 23, 'p_atr': 20, 'p_adx': 26, 'rsi_period': 37, 'ema1': 11, 'ema2': 56, 'slip_atr_k': 0.20763907489864997, 'slip_spread_k': 0.35434341157675087, 'spread_hl_frac': 0.032639534589580944, 'bb_std_mult': 0.8820398009224204, 'rsi_os': 22, 'rsi_ob': 66, 'vol_spike': 0.29176313961413075, 'adx_thresh': 19.686193261993814, 'atr_min_pct': 0.013509461629392015, 'atr_max_pct': 0.14355525075997527, 'tp_mult': 2.37479002534603, 'tsl_mult': 0.05924409362512317, 'strategy': 'mean_reversion', 'time_stop': 75, 'use_sma': False, 'use_atr': False, 'use_adx': True, 'use_ema': False, 'use_spike': True, 'rsi_required': False, 'edge_k': 1.2469847032749852, 'edge_cap': 0.786066386622691, 'bull_strategy': 'mean_reversion', 'bull_bb_std_mult': 2.1274063937611487, 'bull_rsi_os': 15, 'bull_rsi_ob': 91, 'bull_adx_thresh': 16.10966695386122, 'bull_atr_min_pct': 0.0011749485213837858, 'bull_atr_max_pct': 0.09019747252881335, 'bull_tp_mult': 1.4463173385562547, 'bull_tsl_mult': 0.41830605049399905, 'bull_time_stop': 140, 'bull_use_sma': False, 'bull_use_ema': True, 'bull_use_atr': False, 'bull_use_adx': True, 'bull_use_spike': True, 'bull_rsi_required': True, 'bear_strategy': 'breakout', 'bear_bb_std_mult': 2.0466134196900825, 'bear_rsi_os': 7, 'bear_rsi_ob': 75, 'bear_adx_thresh': 10.164969766783733, 'bear_atr_min_pct': 0.020516749080167394, 'bear_atr_max_pct': 0.09642215331793408, 'bear_tp_mult': 1.427812421205003, 'bear_tsl_mult': 0.3996774203177639, 'bear_time_stop': 224, 'bear_use_sma': False, 'bear_use_ema': False, 'bear_use_atr': False, 'bear_use_adx': False, 'bear_use_spike': True, 'bear_rsi_required': True, 'sideways_strategy': 'mean_reversion', 'sideways_bb_std_mult': 2.988181101184907, 'sideways_rsi_os': 39, 'sideways_rsi_ob': 89, 'sideways_adx_thresh': 16.73522074890738, 'sideways_atr_min_pct': 0.020662852376409007, 'sideways_atr_max_pct': 0.08802617863816825, 'sideways_tp_mult': 1.8428755196752036, 'sideways_tsl_mult': 0.6680856920435657, 'sideways_time_stop': 238, 'sideways_use_sma': False, 'sideways_use_ema': True, 'sideways_use_atr': True, 'sideways_use_adx': True, 'sideways_use_spike': False, 'sideways_rsi_required': True}.
[I 2025-08-30 22:16:03,141] Trial 725 finished with values: [-1000000000.0, 1000000000.0] and parameters: {'p_sma': 33, 'p_std': 22, 'p_atr': 20, 'p_adx': 14, 'rsi_period': 37, 'ema1': 11, 'ema2': 53, 'slip_atr_k': 0.036636491628662414, 'slip_spread_k': 0.6964858014314137, 'spread_hl_frac': 0.0017265627644780027, 'bb_std_mult': 0.8705681836548109, 'rsi_os': 5, 'rsi_ob': 61, 'vol_spike': 0.2925863558676344, 'adx_thresh': 12.827759593179472, 'atr_min_pct': 0.013557616747548558, 'atr_max_pct': 0.02189633776671145, 'tp_mult': 2.2348548138556446, 'tsl_mult': 0.8715135544759994, 'strategy': 'mean_reversion', 'time_stop': 260, 'use_sma': False, 'use_atr': False, 'use_adx': True, 'use_ema': False, 'use_spike': True, 'rsi_required': False, 'edge_k': 0.7440052091459106, 'edge_cap': 0.7529065626902898, 'bull_strategy': 'mean_reversion', 'bull_bb_std_mult': 1.7108125735387194, 'bull_rsi_os': 18, 'bull_rsi_ob': 53, 'bull_adx_thresh': 14.63276619100086, 'bull_atr_min_pct': 0.0011880708759868831, 'bull_atr_max_pct': 0.02019369611920767, 'bull_tp_mult': 1.4887450176282968, 'bull_tsl_mult': 0.8957638173761646, 'bull_time_stop': 142, 'bull_use_sma': False, 'bull_use_ema': True, 'bull_use_atr': False, 'bull_use_adx': True, 'bull_use_spike': True, 'bull_rsi_required': True, 'bear_strategy': 'mean_reversion', 'bear_bb_std_mult': 2.395843928928185, 'bear_rsi_os': 5, 'bear_rsi_ob': 73, 'bear_adx_thresh': 28.0479677021861, 'bear_atr_min_pct': 0.025540498218646724, 'bear_atr_max_pct': 0.1111164916273821, 'bear_tp_mult': 1.4275420503505016, 'bear_tsl_mult': 0.39751835903794763, 'bear_time_stop': 224, 'bear_use_sma': False, 'bear_use_ema': False, 'bear_use_atr': False, 'bear_use_adx': False, 'bear_use_spike': True, 'bear_rsi_required': True, 'sideways_strategy': 'mean_reversion', 'sideways_bb_std_mult': 0.7441599197730393, 'sideways_rsi_os': 15, 'sideways_rsi_ob': 90, 'sideways_adx_thresh': 27.58006229501873, 'sideways_atr_min_pct': 0.020878549479574324, 'sideways_atr_max_pct': 0.039298546041190714, 'sideways_tp_mult': 2.193131289620127, 'sideways_tsl_mult': 0.7555421161042631, 'sideways_time_stop': 123, 'sideways_use_sma': False, 'sideways_use_ema': True, 'sideways_use_atr': True, 'sideways_use_adx': True, 'sideways_use_spike': False, 'sideways_rsi_required': True}.
[I 2025-08-30 22:16:03,977] Trial 726 finished with values: [-1000000000.0, 1000000000.0] and parameters: {'p_sma': 33, 'p_std': 23, 'p_atr': 20, 'p_adx': 26, 'rsi_period': 37, 'ema1': 11, 'ema2': 56, 'slip_atr_k': 0.037006413489011375, 'slip_spread_k': 0.7034312340926615, 'spread_hl_frac': 0.016219137047394847, 'bb_std_mult': 0.8399858153858824, 'rsi_os': 12, 'rsi_ob': 64, 'vol_spike': 0.05894809853403035, 'adx_thresh': 10.709754711406331, 'atr_min_pct': 0.013550074931129868, 'atr_max_pct': 0.02117636277846482, 'tp_mult': 2.3811374360943462, 'tsl_mult': 0.9225667615256194, 'strategy': 'breakout', 'time_stop': 104, 'use_sma': True, 'use_atr': False, 'use_adx': True, 'use_ema': True, 'use_spike': True, 'rsi_required': False, 'edge_k': 1.2699209710796833, 'edge_cap': 0.8591650918495487, 'bull_strategy': 'mean_reversion', 'bull_bb_std_mult': 1.7037077993798584, 'bull_rsi_os': 18, 'bull_rsi_ob': 92, 'bull_adx_thresh': 29.988661597656257, 'bull_atr_min_pct': 0.01769981803298026, 'bull_atr_max_pct': 0.09680558030004854, 'bull_tp_mult': 1.487003530462951, 'bull_tsl_mult': 0.8839796402374571, 'bull_time_stop': 226, 'bull_use_sma': True, 'bull_use_ema': False, 'bull_use_atr': True, 'bull_use_adx': True, 'bull_use_spike': True, 'bull_rsi_required': True, 'bear_strategy': 'mean_reversion', 'bear_bb_std_mult': 1.720055338867771, 'bear_rsi_os': 5, 'bear_rsi_ob': 75, 'bear_adx_thresh': 30.762121885000845, 'bear_atr_min_pct': 0.025159189431041527, 'bear_atr_max_pct': 0.1207037301262262, 'bear_tp_mult': 1.334325207517216, 'bear_tsl_mult': 0.761340211259284, 'bear_time_stop': 223, 'bear_use_sma': False, 'bear_use_ema': False, 'bear_use_atr': True, 'bear_use_adx': True, 'bear_use_spike': True, 'bear_rsi_required': True, 'sideways_strategy': 'breakout', 'sideways_bb_std_mult': 2.9381941484496408, 'sideways_rsi_os': 36, 'sideways_rsi_ob': 52, 'sideways_adx_thresh': 27.437555687348944, 'sideways_atr_min_pct': 0.02090854186505356, 'sideways_atr_max_pct': 0.0343320402378092, 'sideways_tp_mult': 1.8329358974468337, 'sideways_tsl_mult': 0.0388243327872797, 'sideways_time_stop': 185, 'sideways_use_sma': False, 'sideways_use_ema': True, 'sideways_use_atr': True, 'sideways_use_adx': False, 'sideways_use_spike': False, 'sideways_rsi_required': True}.
[I 2025-08-30 22:16:43,511] Trial 728 finished with values: [-1000000000.0, 1000000000.0] and parameters: {'p_sma': 7, 'p_std': 33, 'p_atr': 20, 'p_adx': 14, 'rsi_period': 72, 'ema1': 25, 'ema2': 53, 'slip_atr_k': 0.08492673458777675, 'slip_spread_k': 0.6946142465615686, 'spread_hl_frac': 0.01758804527735082, 'bb_std_mult': 0.7871294396316401, 'rsi_os': 18, 'rsi_ob': 61, 'vol_spike': 0.08521241152791004, 'adx_thresh': 7.5876745223672515, 'atr_min_pct': 0.012386285022226108, 'atr_max_pct': 0.02176988939495011, 'tp_mult': 1.6966418405811474, 'tsl_mult': 0.9147445792395721, 'strategy': 'breakout', 'time_stop': 174, 'use_sma': True, 'use_atr': False, 'use_adx': True, 'use_ema': True, 'use_spike': True, 'rsi_required': True, 'edge_k': 1.5709748377738588, 'edge_cap': 0.4454403568351989, 'bull_strategy': 'breakout', 'bull_bb_std_mult': 2.328947123503857, 'bull_rsi_os': 18, 'bull_rsi_ob': 53, 'bull_adx_thresh': 14.093299162311798, 'bull_atr_min_pct': 0.0024927183483616795, 'bull_atr_max_pct': 0.0527609435781864, 'bull_tp_mult': 1.3992570331460996, 'bull_tsl_mult': 0.3913381265707379, 'bull_time_stop': 126, 'bull_use_sma': True, 'bull_use_ema': False, 'bull_use_atr': True, 'bull_use_adx': False, 'bull_use_spike': False, 'bull_rsi_required': True, 'bear_strategy': 'mean_reversion', 'bear_bb_std_mult': 2.368583158755476, 'bear_rsi_os': 5, 'bear_rsi_ob': 73, 'bear_adx_thresh': 21.324317940887646, 'bear_atr_min_pct': 0.014022909669967661, 'bear_atr_max_pct': 0.11151105473795297, 'bear_tp_mult': 1.6436535724198318, 'bear_tsl_mult': 0.3655669581080586, 'bear_time_stop': 34, 'bear_use_sma': False, 'bear_use_ema': False, 'bear_use_atr': True, 'bear_use_adx': True, 'bear_use_spike': True, 'bear_rsi_required': True, 'sideways_strategy': 'breakout', 'sideways_bb_std_mult': 1.682954341885386, 'sideways_rsi_os': 37, 'sideways_rsi_ob': 71, 'sideways_adx_thresh': 27.42946989953009, 'sideways_atr_min_pct': 0.022123661168945968, 'sideways_atr_max_pct': 0.1134767607228361, 'sideways_tp_mult': 1.2057653378554396, 'sideways_tsl_mult': 0.04723354620763265, 'sideways_time_stop': 186, 'sideways_use_sma': False, 'sideways_use_ema': False, 'sideways_use_atr': False, 'sideways_use_adx': False, 'sideways_use_spike': False, 'sideways_rsi_required': False}.
[I 2025-08-30 22:16:43,675] Trial 727 finished with values: [-1000000000.0, 1000000000.0] and parameters: {'p_sma': 31, 'p_std': 9, 'p_atr': 20, 'p_adx': 9, 'rsi_period': 37, 'ema1': 11, 'ema2': 31, 'slip_atr_k': 0.08476726703983734, 'slip_spread_k': 0.7020962970597376, 'spread_hl_frac': 0.02850609816957432, 'bb_std_mult': 2.3105747480566974, 'rsi_os': 12, 'rsi_ob': 61, 'vol_spike': 0.29039710448106487, 'adx_thresh': 5.9315842830353365, 'atr_min_pct': 0.012540813875483664, 'atr_max_pct': 0.08020042853964413, 'tp_mult': 1.611145950784506, 'tsl_mult': 0.05652079266385146, 'strategy': 'breakout', 'time_stop': 75, 'use_sma': True, 'use_atr': False, 'use_adx': True, 'use_ema': True, 'use_spike': True, 'rsi_required': False, 'edge_k': 1.8605059945630602, 'edge_cap': 0.7797677046463386, 'bull_strategy': 'breakout', 'bull_bb_std_mult': 1.6943220500068665, 'bull_rsi_os': 10, 'bull_rsi_ob': 92, 'bull_adx_thresh': 9.66323150434568, 'bull_atr_min_pct': 0.013764523390214976, 'bull_atr_max_pct': 0.09093630244268158, 'bull_tp_mult': 2.639640095337224, 'bull_tsl_mult': 0.8826185486871919, 'bull_time_stop': 225, 'bull_use_sma': True, 'bull_use_ema': False, 'bull_use_atr': True, 'bull_use_adx': False, 'bull_use_spike': False, 'bull_rsi_required': True, 'bear_strategy': 'mean_reversion', 'bear_bb_std_mult': 1.7190314275483627, 'bear_rsi_os': 6, 'bear_rsi_ob': 75, 'bear_adx_thresh': 24.825354445080507, 'bear_atr_min_pct': 0.014047542082369014, 'bear_atr_max_pct': 0.11120532585946633, 'bear_tp_mult': 1.4295823582548053, 'bear_tsl_mult': 0.7566859561484359, 'bear_time_stop': 225, 'bear_use_sma': False, 'bear_use_ema': False, 'bear_use_atr': True, 'bear_use_adx': True, 'bear_use_spike': True, 'bear_rsi_required': True, 'sideways_strategy': 'breakout', 'sideways_bb_std_mult': 1.677366862590578, 'sideways_rsi_os': 23, 'sideways_rsi_ob': 52, 'sideways_adx_thresh': 27.411121234604433, 'sideways_atr_min_pct': 0.02110634955621961, 'sideways_atr_max_pct': 0.07166842248005063, 'sideways_tp_mult': 1.8215505086821218, 'sideways_tsl_mult': 0.6786556294866362, 'sideways_time_stop': 247, 'sideways_use_sma': False, 'sideways_use_ema': False, 'sideways_use_atr': True, 'sideways_use_adx': False, 'sideways_use_spike': False, 'sideways_rsi_required': False}.
