[I 2025-08-30 21:03:36,502] Trial 123 finished with values: [-1000000000.0, 1000000000.0] and parameters: {'p_sma': 24, 'p_std': 43, 'p_atr': 11, 'p_adx': 28, 'rsi_period': 75, 'ema1': 19, 'ema2': 38, 'slip_atr_k': 0.12789138256219768, 'slip_spread_k': 0.7943198978450957, 'spread_hl_frac': 0.0024268499877290782, 'bb_std_mult': 1.8360686254616705, 'rsi_os': 42, 'rsi_ob': 75, 'vol_spike': 0.21059430423308328, 'adx_thresh': 12.373141060955922, 'atr_min_pct': 0.0025224321257294006, 'atr_max_pct': 0.028791652418434524, 'tp_mult': 2.915312307120833, 'tsl_mult': 0.4798068593138996, 'strategy': 'mean_reversion', 'time_stop': 201, 'use_sma': False, 'use_atr': True, 'use_adx': True, 'use_ema': True, 'use_spike': True, 'rsi_required': True, 'edge_k': 1.2615583148209304, 'edge_cap': 0.5830756660673869, 'bull_strategy': 'breakout', 'bull_bb_std_mult': 3.1710102083371927, 'bull_rsi_os': 16, 'bull_rsi_ob': 69, 'bull_adx_thresh': 12.420608693651705, 'bull_atr_min_pct': 0.006066225665969675, 'bull_atr_max_pct': 0.13545685346536265, 'bull_tp_mult': 2.6708528869453465, 'bull_tsl_mult': 0.15794164894010004, 'bull_time_stop': 264, 'bull_use_sma': True, 'bull_use_ema': False, 'bull_use_atr': False, 'bull_use_adx': True, 'bull_use_spike': True, 'bull_rsi_required': True, 'bear_strategy': 'mean_reversion', 'bear_bb_std_mult': 2.724092980094115, 'bear_rsi_os': 10, 'bear_rsi_ob': 47, 'bear_adx_thresh': 5.108980927627195, 'bear_atr_min_pct': 0.015884716705539658, 'bear_atr_max_pct': 0.021102475589366634, 'bear_tp_mult': 2.838149151956214, 'bear_tsl_mult': 0.24789222377622333, 'bear_time_stop': 104, 'bear_use_sma': True, 'bear_use_ema': False, 'bear_use_atr': False, 'bear_use_adx': True, 'bear_use_spike': True, 'bear_rsi_required': True, 'sideways_strategy': 'breakout', 'sideways_bb_std_mult': 1.3540566589224259, 'sideways_rsi_os': 36, 'sideways_rsi_ob': 63, 'sideways_adx_thresh': 31.05540122452773, 'sideways_atr_min_pct': 0.008339955871244094, 'sideways_atr_max_pct': 0.1076133603020022, 'sideways_tp_mult': 2.589542040274416, 'sideways_tsl_mult': 0.32163143769282415, 'sideways_time_stop': 144, 'sideways_use_sma': False, 'sideways_use_ema': True, 'sideways_use_atr': True, 'sideways_use_adx': False, 'sideways_use_spike': False, 'sideways_rsi_required': True}.
[I 2025-08-30 21:03:36,906] Trial 127 finished with values: [-1000000000.0, 1000000000.0] and parameters: {'p_sma': 19, 'p_std': 17, 'p_atr': 10, 'p_adx': 27, 'rsi_period': 31, 'ema1': 22, 'ema2': 44, 'slip_atr_k': 0.08920184088060601, 'slip_spread_k': 0.7610951919144028, 'spread_hl_frac': 0.03633689746067838, 'bb_std_mult': 1.9792965335982102, 'rsi_os': 51, 'rsi_ob': 79, 'vol_spike': 0.2496113209257944, 'adx_thresh': 12.894148398224859, 'atr_min_pct': 0.0008478788127266742, 'atr_max_pct': 0.10592543592480425, 'tp_mult': 1.6543221699822321, 'tsl_mult': 0.5763397297845907, 'strategy': 'mean_reversion', 'time_stop': 211, 'use_sma': True, 'use_atr': True, 'use_adx': True, 'use_ema': True, 'use_spike': True, 'rsi_required': True, 'edge_k': 1.3616380650233082, 'edge_cap': 0.49089724125768686, 'bull_strategy': 'mean_reversion', 'bull_bb_std_mult': 3.5906784102951934, 'bull_rsi_os': 18, 'bull_rsi_ob': 71, 'bull_adx_thresh': 21.993222494489828, 'bull_atr_min_pct': 0.022328889661784115, 'bull_atr_max_pct': 0.10568625618392001, 'bull_tp_mult': 2.609266256396764, 'bull_tsl_mult': 0.0026046487536189947, 'bull_time_stop': 287, 'bull_use_sma': True, 'bull_use_ema': False, 'bull_use_atr': False, 'bull_use_adx': False, 'bull_use_spike': True, 'bull_rsi_required': True, 'bear_strategy': 'mean_reversion', 'bear_bb_std_mult': 2.5386626188794397, 'bear_rsi_os': 50, 'bear_rsi_ob': 51, 'bear_adx_thresh': 31.656172959227113, 'bear_atr_min_pct': 0.01351376612091357, 'bear_atr_max_pct': 0.01959326128331201, 'bear_tp_mult': 2.952953509843836, 'bear_tsl_mult': 0.3228239579005224, 'bear_time_stop': 157, 'bear_use_sma': True, 'bear_use_ema': False, 'bear_use_atr': True, 'bear_use_adx': True, 'bear_use_spike': True, 'bear_rsi_required': True, 'sideways_strategy': 'breakout', 'sideways_bb_std_mult': 1.297414456987939, 'sideways_rsi_os': 42, 'sideways_rsi_ob': 63, 'sideways_adx_thresh': 31.174496050914872, 'sideways_atr_min_pct': 0.008783818574357446, 'sideways_atr_max_pct': 0.10810338698535886, 'sideways_tp_mult': 1.7255457402630705, 'sideways_tsl_mult': 0.32605960193377914, 'sideways_time_stop': 97, 'sideways_use_sma': False, 'sideways_use_ema': True, 'sideways_use_atr': True, 'sideways_use_adx': False, 'sideways_use_spike': False, 'sideways_rsi_required': True}.
[I 2025-08-30 21:03:36,918] Trial 128 finished with values: [-1000000000.0, 1000000000.0] and parameters: {'p_sma': 16, 'p_std': 36, 'p_atr': 21, 'p_adx': 27, 'rsi_period': 80, 'ema1': 22, 'ema2': 21, 'slip_atr_k': 0.08580821343258219, 'slip_spread_k': 0.7343508503869439, 'spread_hl_frac': 0.009678629987088502, 'bb_std_mult': 1.9867463601861377, 'rsi_os': 55, 'rsi_ob': 69, 'vol_spike': 0.2618751085955572, 'adx_thresh': 21.745981618839085, 'atr_min_pct': 0.001941557153739922, 'atr_max_pct': 0.09821443756590854, 'tp_mult': 1.4782577523803613, 'tsl_mult': 0.5691369165224647, 'strategy': 'mean_reversion', 'time_stop': 213, 'use_sma': True, 'use_atr': True, 'use_adx': True, 'use_ema': True, 'use_spike': True, 'rsi_required': True, 'edge_k': 0.3445924382575183, 'edge_cap': 0.7955538245358337, 'bull_strategy': 'mean_reversion', 'bull_bb_std_mult': 3.455499382390869, 'bull_rsi_os': 18, 'bull_rsi_ob': 71, 'bull_adx_thresh': 25.93369312677972, 'bull_atr_min_pct': 0.012600327020502407, 'bull_atr_max_pct': 0.10523201722233558, 'bull_tp_mult': 1.2748905096519885, 'bull_tsl_mult': 0.003012448213610408, 'bull_time_stop': 294, 'bull_use_sma': False, 'bull_use_ema': False, 'bull_use_atr': False, 'bull_use_adx': False, 'bull_use_spike': True, 'bull_rsi_required': True, 'bear_strategy': 'breakout', 'bear_bb_std_mult': 2.972943317355703, 'bear_rsi_os': 51, 'bear_rsi_ob': 51, 'bear_adx_thresh': 31.258404502486897, 'bear_atr_min_pct': 0.002511360961713161, 'bear_atr_max_pct': 0.021574006270805336, 'bear_tp_mult': 2.9990133320725025, 'bear_tsl_mult': 0.3181073697527286, 'bear_time_stop': 276, 'bear_use_sma': True, 'bear_use_ema': True, 'bear_use_atr': True, 'bear_use_adx': True, 'bear_use_spike': True, 'bear_rsi_required': True, 'sideways_strategy': 'breakout', 'sideways_bb_std_mult': 1.332996203573508, 'sideways_rsi_os': 40, 'sideways_rsi_ob': 69, 'sideways_adx_thresh': 33.78331304769583, 'sideways_atr_min_pct': 0.008757973895357405, 'sideways_atr_max_pct': 0.09308992299715045, 'sideways_tp_mult': 1.7426924543496494, 'sideways_tsl_mult': 0.35761071758138846, 'sideways_time_stop': 95, 'sideways_use_sma': False, 'sideways_use_ema': True, 'sideways_use_atr': True, 'sideways_use_adx': False, 'sideways_use_spike': False, 'sideways_rsi_required': True}.
[I 2025-08-30 21:03:36,945] Trial 129 finished with values: [-1000000000.0, 1000000000.0] and parameters: {'p_sma': 16, 'p_std': 56, 'p_atr': 18, 'p_adx': 24, 'rsi_period': 24, 'ema1': 22, 'ema2': 18, 'slip_atr_k': 0.03670517257037896, 'slip_spread_k': 0.00972282790035428, 'spread_hl_frac': 0.0067684043052804455, 'bb_std_mult': 1.389197375887921, 'rsi_os': 51, 'rsi_ob': 69, 'vol_spike': 0.2613755640004323, 'adx_thresh': 21.60108799040792, 'atr_min_pct': 0.000983384872904178, 'atr_max_pct': 0.07263497246363802, 'tp_mult': 1.4419819299840126, 'tsl_mult': 0.742800647206611, 'strategy': 'mean_reversion', 'time_stop': 212, 'use_sma': True, 'use_atr': True, 'use_adx': True, 'use_ema': True, 'use_spike': True, 'rsi_required': True, 'edge_k': 1.041596637981176, 'edge_cap': 0.4507647790583277, 'bull_strategy': 'mean_reversion', 'bull_bb_std_mult': 3.4353334333102583, 'bull_rsi_os': 19, 'bull_rsi_ob': 74, 'bull_adx_thresh': 28.093103828726452, 'bull_atr_min_pct': 0.0026810789148201193, 'bull_atr_max_pct': 0.013696579931161662, 'bull_tp_mult': 2.56011609552692, 'bull_tsl_mult': 0.11463054135727523, 'bull_time_stop': 286, 'bull_use_sma': False, 'bull_use_ema': False, 'bull_use_atr': False, 'bull_use_adx': False, 'bull_use_spike': True, 'bull_rsi_required': True, 'bear_strategy': 'breakout', 'bear_bb_std_mult': 2.9552755633873, 'bear_rsi_os': 50, 'bear_rsi_ob': 50, 'bear_adx_thresh': 15.20550824222243, 'bear_atr_min_pct': 0.013736504967700116, 'bear_atr_max_pct': 0.031009040118644575, 'bear_tp_mult': 2.8671523205076235, 'bear_tsl_mult': 0.2765705989182461, 'bear_time_stop': 122, 'bear_use_sma': True, 'bear_use_ema': True, 'bear_use_atr': True, 'bear_use_adx': True, 'bear_use_spike': True, 'bear_rsi_required': True, 'sideways_strategy': 'breakout', 'sideways_bb_std_mult': 1.6357381606522605, 'sideways_rsi_os': 40, 'sideways_rsi_ob': 71, 'sideways_adx_thresh': 6.209039715006941, 'sideways_atr_min_pct': 0.029987133207921762, 'sideways_atr_max_pct': 0.144663211231265, 'sideways_tp_mult': 2.5127924187270008, 'sideways_tsl_mult': 0.3543496414235403, 'sideways_time_stop': 96, 'sideways_use_sma': False, 'sideways_use_ema': True, 'sideways_use_atr': False, 'sideways_use_adx': True, 'sideways_use_spike': False, 'sideways_rsi_required': True}.
[I 2025-08-30 21:03:36,946] Trial 130 finished with values: [-1000000000.0, 1000000000.0] and parameters: {'p_sma': 22, 'p_std': 17, 'p_atr': 21, 'p_adx': 24, 'rsi_period': 24, 'ema1': 17, 'ema2': 19, 'slip_atr_k': 0.08878233963144767, 'slip_spread_k': 0.40915987041869584, 'spread_hl_frac': 0.004265933258202327, 'bb_std_mult': 1.9481640240586255, 'rsi_os': 54, 'rsi_ob': 55, 'vol_spike': 0.2894457938198066, 'adx_thresh': 23.89997962912169, 'atr_min_pct': 0.0009925691518438697, 'atr_max_pct': 0.10615132672538172, 'tp_mult': 1.4637379241327513, 'tsl_mult': 0.7341232206696454, 'strategy': 'mean_reversion', 'time_stop': 212, 'use_sma': True, 'use_atr': True, 'use_adx': True, 'use_ema': True, 'use_spike': True, 'rsi_required': True, 'edge_k': 1.027640315629541, 'edge_cap': 0.4960637837782429, 'bull_strategy': 'mean_reversion', 'bull_bb_std_mult': 3.25458091557672, 'bull_rsi_os': 19, 'bull_rsi_ob': 74, 'bull_adx_thresh': 27.84198315529308, 'bull_atr_min_pct': 0.0027596032374071723, 'bull_atr_max_pct': 0.056680439828046617, 'bull_tp_mult': 2.2406498718083347, 'bull_tsl_mult': 0.11863177742210934, 'bull_time_stop': 289, 'bull_use_sma': False, 'bull_use_ema': False, 'bull_use_atr': False, 'bull_use_adx': False, 'bull_use_spike': True, 'bull_rsi_required': False, 'bear_strategy': 'breakout', 'bear_bb_std_mult': 1.864636309536673, 'bear_rsi_os': 20, 'bear_rsi_ob': 50, 'bear_adx_thresh': 15.807994151360433, 'bear_atr_min_pct': 0.0024890959771599244, 'bear_atr_max_pct': 0.030548623819651392, 'bear_tp_mult': 2.891357530633223, 'bear_tsl_mult': 0.1762927873223136, 'bear_time_stop': 121, 'bear_use_sma': False, 'bear_use_ema': True, 'bear_use_atr': True, 'bear_use_adx': True, 'bear_use_spike': True, 'bear_rsi_required': True, 'sideways_strategy': 'mean_reversion', 'sideways_bb_std_mult': 1.6728713489272282, 'sideways_rsi_os': 40, 'sideways_rsi_ob': 71, 'sideways_adx_thresh': 33.87059412059452, 'sideways_atr_min_pct': 0.018834078294423674, 'sideways_atr_max_pct': 0.09226743651017763, 'sideways_tp_mult': 1.695726764244244, 'sideways_tsl_mult': 0.35799171209405756, 'sideways_time_stop': 120, 'sideways_use_sma': False, 'sideways_use_ema': True, 'sideways_use_atr': False, 'sideways_use_adx': True, 'sideways_use_spike': False, 'sideways_rsi_required': True}.
[I 2025-08-30 21:03:37,303] Trial 132 finished with values: [-1000000000.0, 1000000000.0] and parameters: {'p_sma': 22, 'p_std': 37, 'p_atr': 13, 'p_adx': 10, 'rsi_period': 24, 'ema1': 17, 'ema2': 18, 'slip_atr_k': 0.1173490152374992, 'slip_spread_k': 0.4020651873171399, 'spread_hl_frac': 0.008163040998013255, 'bb_std_mult': 1.392011612310871, 'rsi_os': 47, 'rsi_ob': 49, 'vol_spike': 0.29207872724643974, 'adx_thresh': 23.673380546394796, 'atr_min_pct': 0.0009064509971275826, 'atr_max_pct': 0.10219673033224477, 'tp_mult': 2.14623012084315, 'tsl_mult': 0.7318770732336102, 'strategy': 'mean_reversion', 'time_stop': 223, 'use_sma': False, 'use_atr': True, 'use_adx': True, 'use_ema': True, 'use_spike': True, 'rsi_required': True, 'edge_k': 1.029743924311376, 'edge_cap': 0.9108523605634917, 'bull_strategy': 'breakout', 'bull_bb_std_mult': 3.2456295002074196, 'bull_rsi_os': 14, 'bull_rsi_ob': 74, 'bull_adx_thresh': 27.826702484864622, 'bull_atr_min_pct': 0.02620787552714308, 'bull_atr_max_pct': 0.010573150669911796, 'bull_tp_mult': 1.617497103013032, 'bull_tsl_mult': 0.10713011290419379, 'bull_time_stop': 248, 'bull_use_sma': False, 'bull_use_ema': False, 'bull_use_atr': False, 'bull_use_adx': True, 'bull_use_spike': True, 'bull_rsi_required': False, 'bear_strategy': 'breakout', 'bear_bb_std_mult': 1.3631489317800483, 'bear_rsi_os': 28, 'bear_rsi_ob': 49, 'bear_adx_thresh': 15.450148654056242, 'bear_atr_min_pct': 0.004687265814145015, 'bear_atr_max_pct': 0.05820161246700249, 'bear_tp_mult': 1.1429913460519086, 'bear_tsl_mult': 0.19203296257583297, 'bear_time_stop': 225, 'bear_use_sma': False, 'bear_use_ema': True, 'bear_use_atr': False, 'bear_use_adx': True, 'bear_use_spike': True, 'bear_rsi_required': True, 'sideways_strategy': 'mean_reversion', 'sideways_bb_std_mult': 2.424947770777757, 'sideways_rsi_os': 37, 'sideways_rsi_ob': 71, 'sideways_adx_thresh': 32.069668042588766, 'sideways_atr_min_pct': 0.019572163143175735, 'sideways_atr_max_pct': 0.02125532484730422, 'sideways_tp_mult': 1.6393801491563038, 'sideways_tsl_mult': 0.13919262571778251, 'sideways_time_stop': 140, 'sideways_use_sma': False, 'sideways_use_ema': True, 'sideways_use_atr': False, 'sideways_use_adx': True, 'sideways_use_spike': False, 'sideways_rsi_required': True}.
[I 2025-08-30 21:03:37,318] Trial 131 finished with values: [-1000000000.0, 1000000000.0] and parameters: {'p_sma': 17, 'p_std': 36, 'p_atr': 7, 'p_adx': 30, 'rsi_period': 24, 'ema1': 20, 'ema2': 15, 'slip_atr_k': 0.036254700511609776, 'slip_spread_k': 0.935478318072069, 'spread_hl_frac': 0.00012864498996027762, 'bb_std_mult': 1.9359970908010262, 'rsi_os': 55, 'rsi_ob': 57, 'vol_spike': 0.22619957874285598, 'adx_thresh': 21.589177155947432, 'atr_min_pct': 0.000926419469471906, 'atr_max_pct': 0.1014614265244369, 'tp_mult': 1.4672864148181337, 'tsl_mult': 0.7370176294398676, 'strategy': 'mean_reversion', 'time_stop': 214, 'use_sma': True, 'use_atr': True, 'use_adx': True, 'use_ema': True, 'use_spike': True, 'rsi_required': True, 'edge_k': 1.0282609482205267, 'edge_cap': 0.7970798207218894, 'bull_strategy': 'mean_reversion', 'bull_bb_std_mult': 3.242005241833842, 'bull_rsi_os': 14, 'bull_rsi_ob': 74, 'bull_adx_thresh': 27.7598412173484, 'bull_atr_min_pct': 0.01288792614577793, 'bull_atr_max_pct': 0.016079117441709312, 'bull_tp_mult': 1.2320339457312874, 'bull_tsl_mult': 0.12412545631457272, 'bull_time_stop': 294, 'bull_use_sma': False, 'bull_use_ema': False, 'bull_use_atr': False, 'bull_use_adx': False, 'bull_use_spike': True, 'bull_rsi_required': False, 'bear_strategy': 'breakout', 'bear_bb_std_mult': 1.8494510925322518, 'bear_rsi_os': 45, 'bear_rsi_ob': 49, 'bear_adx_thresh': 15.303419143602149, 'bear_atr_min_pct': 0.0020903178632719413, 'bear_atr_max_pct': 0.05630347543201401, 'bear_tp_mult': 2.8833506259017305, 'bear_tsl_mult': 0.2824041151483747, 'bear_time_stop': 284, 'bear_use_sma': False, 'bear_use_ema': True, 'bear_use_atr': True, 'bear_use_adx': True, 'bear_use_spike': True, 'bear_rsi_required': True, 'sideways_strategy': 'mean_reversion', 'sideways_bb_std_mult': 1.6871604585524669, 'sideways_rsi_os': 40, 'sideways_rsi_ob': 69, 'sideways_adx_thresh': 33.77190317717479, 'sideways_atr_min_pct': 0.01928560161549618, 'sideways_atr_max_pct': 0.019105940598355516, 'sideways_tp_mult': 2.8643759740381802, 'sideways_tsl_mult': 0.3582974607445289, 'sideways_time_stop': 138, 'sideways_use_sma': False, 'sideways_use_ema': True, 'sideways_use_atr': False, 'sideways_use_adx': True, 'sideways_use_spike': False, 'sideways_rsi_required': True}.
[I 2025-08-30 21:03:37,378] Trial 133 finished with values: [-1000000000.0, 1000000000.0] and parameters: {'p_sma': 27, 'p_std': 31, 'p_atr': 7, 'p_adx': 12, 'rsi_period': 14, 'ema1': 21, 'ema2': 47, 'slip_atr_k': 0.11497617447911677, 'slip_spread_k': 0.8444025587236119, 'spread_hl_frac': 0.008123665418549413, 'bb_std_mult': 1.2576017305681892, 'rsi_os': 38, 'rsi_ob': 45, 'vol_spike': 0.22672067404919516, 'adx_thresh': 15.639926742452666, 'atr_min_pct': 0.001763435802622225, 'atr_max_pct': 0.08212997696189644, 'tp_mult': 2.4377432172275784, 'tsl_mult': 0.2990789265771322, 'strategy': 'mean_reversion', 'time_stop': 224, 'use_sma': False, 'use_atr': True, 'use_adx': True, 'use_ema': True, 'use_spike': True, 'rsi_required': True, 'edge_k': 1.835905307744885, 'edge_cap': 0.050929619541425386, 'bull_strategy': 'breakout', 'bull_bb_std_mult': 0.5955069092718908, 'bull_rsi_os': 14, 'bull_rsi_ob': 63, 'bull_adx_thresh': 24.439571286361055, 'bull_atr_min_pct': 0.026209842263371703, 'bull_atr_max_pct': 0.04906987812460427, 'bull_tp_mult': 1.574349948300277, 'bull_tsl_mult': 0.22214036560537503, 'bull_time_stop': 248, 'bull_use_sma': True, 'bull_use_ema': False, 'bull_use_atr': False, 'bull_use_adx': True, 'bull_use_spike': True, 'bull_rsi_required': True, 'bear_strategy': 'mean_reversion', 'bear_bb_std_mult': 2.3585063246072124, 'bear_rsi_os': 27, 'bear_rsi_ob': 54, 'bear_adx_thresh': 12.574939833044898, 'bear_atr_min_pct': 0.014364200017213157, 'bear_atr_max_pct': 0.057461660107108015, 'bear_tp_mult': 1.1082443206914716, 'bear_tsl_mult': 0.23551138033044955, 'bear_time_stop': 226, 'bear_use_sma': False, 'bear_use_ema': False, 'bear_use_atr': False, 'bear_use_adx': True, 'bear_use_spike': True, 'bear_rsi_required': True, 'sideways_strategy': 'mean_reversion', 'sideways_bb_std_mult': 1.7533490653353276, 'sideways_rsi_os': 37, 'sideways_rsi_ob': 66, 'sideways_adx_thresh': 32.364523117000644, 'sideways_atr_min_pct': 0.0008732899129584009, 'sideways_atr_max_pct': 0.02004582767740844, 'sideways_tp_mult': 1.5998216803620537, 'sideways_tsl_mult': 0.8338123634784464, 'sideways_time_stop': 136, 'sideways_use_sma': False, 'sideways_use_ema': True, 'sideways_use_atr': False, 'sideways_use_adx': False, 'sideways_use_spike': False, 'sideways_rsi_required': True}.
[I 2025-08-30 21:04:10,149] Trial 134 finished with values: [-0.030813437489286333, 0.030743806305264784] and parameters: {'p_sma': 37, 'p_std': 31, 'p_atr': 13, 'p_adx': 12, 'rsi_period': 14, 'ema1': 20, 'ema2': 15, 'slip_atr_k': 0.11661171066368645, 'slip_spread_k': 0.8460590756800207, 'spread_hl_frac': 0.008293347195782827, 'bb_std_mult': 1.4285081630285745, 'rsi_os': 38, 'rsi_ob': 81, 'vol_spike': 0.22911810601382002, 'adx_thresh': 20.54077513811272, 'atr_min_pct': 0.0017451825838086783, 'atr_max_pct': 0.11157527195807515, 'tp_mult': 2.13839781583889, 'tsl_mult': 0.8911316560412332, 'strategy': 'mean_reversion', 'time_stop': 223, 'use_sma': False, 'use_atr': True, 'use_adx': True, 'use_ema': True, 'use_spike': True, 'rsi_required': True, 'edge_k': 1.1464758172054887, 'edge_cap': 0.7493959851173141, 'bull_strategy': 'breakout', 'bull_bb_std_mult': 3.3452739684489696, 'bull_rsi_os': 14, 'bull_rsi_ob': 70, 'bull_adx_thresh': 15.594284781432592, 'bull_atr_min_pct': 7.312526570669542e-06, 'bull_atr_max_pct': 0.1256422189854154, 'bull_tp_mult': 1.8540320742503156, 'bull_tsl_mult': 0.22578181198356706, 'bull_time_stop': 246, 'bull_use_sma': True, 'bull_use_ema': False, 'bull_use_atr': False, 'bull_use_adx': True, 'bull_use_spike': True, 'bull_rsi_required': True, 'bear_strategy': 'mean_reversion', 'bear_bb_std_mult': 1.3543158548138559, 'bear_rsi_os': 46, 'bear_rsi_ob': 49, 'bear_adx_thresh': 34.30310492241971, 'bear_atr_min_pct': 0.004336935045994583, 'bear_atr_max_pct': 0.041185137144554164, 'bear_tp_mult': 2.917930949007685, 'bear_tsl_mult': 0.5405873490798371, 'bear_time_stop': 196, 'bear_use_sma': False, 'bear_use_ema': False, 'bear_use_atr': False, 'bear_use_adx': True, 'bear_use_spike': True, 'bear_rsi_required': True, 'sideways_strategy': 'mean_reversion', 'sideways_bb_std_mult': 2.4094548701353347, 'sideways_rsi_os': 37, 'sideways_rsi_ob': 66, 'sideways_adx_thresh': 20.443393576156616, 'sideways_atr_min_pct': 0.009237968418854, 'sideways_atr_max_pct': 0.020801925457075092, 'sideways_tp_mult': 1.6320524229363524, 'sideways_tsl_mult': 0.2547670417622094, 'sideways_time_stop': 138, 'sideways_use_sma': False, 'sideways_use_ema': True, 'sideways_use_atr': False, 'sideways_use_adx': False, 'sideways_use_spike': False, 'sideways_rsi_required': True}.
