[I 2025-09-01 10:11:26,103] Trial 414 finished with values: [-0.0253138249295769, 0.025774264865668375] and parameters: {'p_sma': 60, 'p_std': 48, 'p_atr': 23, 'p_adx': 30, 'rsi_period': 43, 'ema1': 8, 'ema2': 10, 'slip_atr_k': 0.21717201866091881, 'slip_spread_k': 0.6561964920087767, 'spread_hl_frac': 0.005621489458023353, 'bb_std_mult': 1.0019493381451263, 'rsi_os': 55, 'rsi_ob': 56, 'vol_spike': 0.15760344799741483, 'adx_thresh': 10.706995278019235, 'atr_min_pct': 0.019765997536060852, 'atr_max_pct': 0.06141297818930917, 'tp_mult': 1.780111387796594, 'tsl_mult': 0.9027349795773854, 'strategy': 'breakout', 'time_stop': 151, 'use_sma': True, 'use_atr': True, 'use_adx': True, 'use_ema': False, 'use_spike': False, 'rsi_required': False, 'edge_k': 0.5621426738803987, 'edge_cap': 0.8307210355229515, 'bull_strategy': 'breakout', 'bull_bb_std_mult': 3.378873017800055, 'bull_rsi_os': 42, 'bull_rsi_ob': 53, 'bull_adx_thresh': 5.625313328378258, 'bull_atr_min_pct': 0.006126059273844726, 'bull_atr_max_pct': 0.05226055425550103, 'bull_tp_mult': 1.6063813414483956, 'bull_tsl_mult': 0.33648082460644063, 'bull_time_stop': 137, 'bull_use_sma': True, 'bull_use_ema': False, 'bull_use_atr': True, 'bull_use_adx': False, 'bull_use_spike': True, 'bull_rsi_required': True, 'bear_strategy': 'breakout', 'bear_bb_std_mult': 1.5681019515575045, 'bear_rsi_os': 35, 'bear_rsi_ob': 45, 'bear_adx_thresh': 30.10012467437441, 'bear_atr_min_pct': 0.028516562173423486, 'bear_atr_max_pct': 0.08722190921003492, 'bear_tp_mult': 1.420249253327265, 'bear_tsl_mult': 0.7964873492238721, 'bear_time_stop': 5, 'bear_use_sma': False, 'bear_use_ema': True, 'bear_use_atr': False, 'bear_use_adx': True, 'bear_use_spike': True, 'bear_rsi_required': False, 'sideways_strategy': 'breakout', 'sideways_bb_std_mult': 2.650572839624713, 'sideways_rsi_os': 40, 'sideways_rsi_ob': 58, 'sideways_adx_thresh': 8.664153533437947, 'sideways_atr_min_pct': 0.0025928174197373637, 'sideways_atr_max_pct': 0.08446920060255497, 'sideways_tp_mult': 1.3470665351551785, 'sideways_tsl_mult': 0.9584842866388785, 'sideways_time_stop': 215, 'sideways_use_sma': True, 'sideways_use_ema': False, 'sideways_use_atr': True, 'sideways_use_adx': False, 'sideways_use_spike': True, 'sideways_rsi_required': False}.
[I 2025-09-01 10:11:26,773] Trial 417 finished with values: [-1000000000.0, 1000000000.0] and parameters: {'p_sma': 49, 'p_std': 44, 'p_atr': 29, 'p_adx': 13, 'rsi_period': 43, 'ema1': 8, 'ema2': 23, 'slip_atr_k': 0.08942519577469568, 'slip_spread_k': 0.5887509632899595, 'spread_hl_frac': 0.008868386988937403, 'bb_std_mult': 2.7173071269148807, 'rsi_os': 5, 'rsi_ob': 92, 'vol_spike': 0.08635722319537471, 'adx_thresh': 11.266871785206, 'atr_min_pct': 0.019040744727231076, 'atr_max_pct': 0.010082086098112147, 'tp_mult': 2.9929105044563524, 'tsl_mult': 0.7511889121993685, 'strategy': 'breakout', 'time_stop': 200, 'use_sma': True, 'use_atr': True, 'use_adx': False, 'use_ema': False, 'use_spike': True, 'rsi_required': False, 'edge_k': 0.5607389444001762, 'edge_cap': 0.7758702967745318, 'bull_strategy': 'mean_reversion', 'bull_bb_std_mult': 3.5384914921182267, 'bull_rsi_os': 46, 'bull_rsi_ob': 53, 'bull_adx_thresh': 27.525702821505334, 'bull_atr_min_pct': 0.004813420096806561, 'bull_atr_max_pct': 0.061104515010197105, 'bull_tp_mult': 1.4052293122174904, 'bull_tsl_mult': 0.9093367220407865, 'bull_time_stop': 126, 'bull_use_sma': False, 'bull_use_ema': True, 'bull_use_atr': True, 'bull_use_adx': False, 'bull_use_spike': True, 'bull_rsi_required': False, 'bear_strategy': 'mean_reversion', 'bear_bb_std_mult': 2.5085719375655, 'bear_rsi_os': 35, 'bear_rsi_ob': 48, 'bear_adx_thresh': 6.943535000107072, 'bear_atr_min_pct': 0.0291851103700052, 'bear_atr_max_pct': 0.12590006144068286, 'bear_tp_mult': 1.8919510457452802, 'bear_tsl_mult': 0.9733176348314807, 'bear_time_stop': 188, 'bear_use_sma': False, 'bear_use_ema': True, 'bear_use_atr': True, 'bear_use_adx': True, 'bear_use_spike': True, 'bear_rsi_required': True, 'sideways_strategy': 'mean_reversion', 'sideways_bb_std_mult': 2.651957543506136, 'sideways_rsi_os': 32, 'sideways_rsi_ob': 62, 'sideways_adx_thresh': 32.38569401737639, 'sideways_atr_min_pct': 0.0013424852387306113, 'sideways_atr_max_pct': 0.12170556649304659, 'sideways_tp_mult': 1.2876581835844372, 'sideways_tsl_mult': 0.05966192482027327, 'sideways_time_stop': 231, 'sideways_use_sma': True, 'sideways_use_ema': False, 'sideways_use_atr': False, 'sideways_use_adx': False, 'sideways_use_spike': True, 'sideways_rsi_required': False}.
[I 2025-09-01 10:12:06,330] Trial 418 finished with values: [-1000000000.0, 1000000000.0] and parameters: {'p_sma': 17, 'p_std': 44, 'p_atr': 29, 'p_adx': 11, 'rsi_period': 44, 'ema1': 9, 'ema2': 23, 'slip_atr_k': 0.09360011400199511, 'slip_spread_k': 0.5836829498116336, 'spread_hl_frac': 0.008423787121938532, 'bb_std_mult': 2.912281751309024, 'rsi_os': 5, 'rsi_ob': 71, 'vol_spike': 0.23994825470604192, 'adx_thresh': 15.215202262512268, 'atr_min_pct': 0.0008833691282251355, 'atr_max_pct': 0.06641264566031096, 'tp_mult': 2.403451067992477, 'tsl_mult': 0.9450158681474434, 'strategy': 'breakout', 'time_stop': 165, 'use_sma': True, 'use_atr': True, 'use_adx': False, 'use_ema': False, 'use_spike': True, 'rsi_required': False, 'edge_k': 1.0124500923491857, 'edge_cap': 0.4607124565721177, 'bull_strategy': 'mean_reversion', 'bull_bb_std_mult': 3.5447578301437246, 'bull_rsi_os': 46, 'bull_rsi_ob': 78, 'bull_adx_thresh': 27.644501094891726, 'bull_atr_min_pct': 0.029857178124927615, 'bull_atr_max_pct': 0.0747858545285546, 'bull_tp_mult': 1.4574650149836215, 'bull_tsl_mult': 0.9103384177460456, 'bull_time_stop': 127, 'bull_use_sma': False, 'bull_use_ema': True, 'bull_use_atr': True, 'bull_use_adx': False, 'bull_use_spike': True, 'bull_rsi_required': False, 'bear_strategy': 'mean_reversion', 'bear_bb_std_mult': 1.4920607476428203, 'bear_rsi_os': 42, 'bear_rsi_ob': 72, 'bear_adx_thresh': 7.0635976975118595, 'bear_atr_min_pct': 0.02792891944876614, 'bear_atr_max_pct': 0.11754956839146524, 'bear_tp_mult': 2.7932510614610115, 'bear_tsl_mult': 0.5898080720162235, 'bear_time_stop': 10, 'bear_use_sma': False, 'bear_use_ema': True, 'bear_use_atr': True, 'bear_use_adx': True, 'bear_use_spike': True, 'bear_rsi_required': True, 'sideways_strategy': 'mean_reversion', 'sideways_bb_std_mult': 2.400321381502054, 'sideways_rsi_os': 29, 'sideways_rsi_ob': 52, 'sideways_adx_thresh': 32.18691629135005, 'sideways_atr_min_pct': 0.0246159464010279, 'sideways_atr_max_pct': 0.02184529723294855, 'sideways_tp_mult': 1.3009041712570717, 'sideways_tsl_mult': 0.998766459142313, 'sideways_time_stop': 18, 'sideways_use_sma': True, 'sideways_use_ema': False, 'sideways_use_atr': False, 'sideways_use_adx': False, 'sideways_use_spike': True, 'sideways_rsi_required': False}.
[I 2025-09-01 10:12:07,038] Trial 419 finished with values: [-1000000000.0, 1000000000.0] and parameters: {'p_sma': 9, 'p_std': 45, 'p_atr': 24, 'p_adx': 11, 'rsi_period': 75, 'ema1': 9, 'ema2': 28, 'slip_atr_k': 0.005407039585038385, 'slip_spread_k': 0.5712521151485895, 'spread_hl_frac': 0.007498352040591002, 'bb_std_mult': 2.3902306376071185, 'rsi_os': 7, 'rsi_ob': 55, 'vol_spike': 0.242937351841353, 'adx_thresh': 25.153872441456468, 'atr_min_pct': 0.01831323010037985, 'atr_max_pct': 0.06672382544549366, 'tp_mult': 2.3910774828505272, 'tsl_mult': 0.8511495412234452, 'strategy': 'breakout', 'time_stop': 163, 'use_sma': True, 'use_atr': True, 'use_adx': False, 'use_ema': True, 'use_spike': True, 'rsi_required': False, 'edge_k': 0.6227415154944032, 'edge_cap': 0.8021112513894664, 'bull_strategy': 'mean_reversion', 'bull_bb_std_mult': 1.8534810067106027, 'bull_rsi_os': 39, 'bull_rsi_ob': 78, 'bull_adx_thresh': 10.286389515682517, 'bull_atr_min_pct': 0.003247646524464586, 'bull_atr_max_pct': 0.06943914318887594, 'bull_tp_mult': 1.7336667659774607, 'bull_tsl_mult': 0.3119049537188192, 'bull_time_stop': 152, 'bull_use_sma': False, 'bull_use_ema': False, 'bull_use_atr': True, 'bull_use_adx': False, 'bull_use_spike': True, 'bull_rsi_required': False, 'bear_strategy': 'mean_reversion', 'bear_bb_std_mult': 1.0440575727149306, 'bear_rsi_os': 42, 'bear_rsi_ob': 76, 'bear_adx_thresh': 31.925308110808565, 'bear_atr_min_pct': 0.0010379367777273493, 'bear_atr_max_pct': 0.12398228701428628, 'bear_tp_mult': 2.8213157523794377, 'bear_tsl_mult': 0.8734225773950761, 'bear_time_stop': 5, 'bear_use_sma': True, 'bear_use_ema': True, 'bear_use_atr': True, 'bear_use_adx': True, 'bear_use_spike': True, 'bear_rsi_required': False, 'sideways_strategy': 'mean_reversion', 'sideways_bb_std_mult': 2.393761532631112, 'sideways_rsi_os': 18, 'sideways_rsi_ob': 60, 'sideways_adx_thresh': 12.189583098412147, 'sideways_atr_min_pct': 0.024783976695665733, 'sideways_atr_max_pct': 0.03358051204127748, 'sideways_tp_mult': 2.5688840033373244, 'sideways_tsl_mult': 0.9297095325272781, 'sideways_time_stop': 140, 'sideways_use_sma': True, 'sideways_use_ema': False, 'sideways_use_atr': False, 'sideways_use_adx': False, 'sideways_use_spike': True, 'sideways_rsi_required': False}.
[I 2025-09-01 10:12:07,461] Trial 415 finished with values: [-1000000000.0, 1000000000.0] and parameters: {'p_sma': 56, 'p_std': 44, 'p_atr': 18, 'p_adx': 11, 'rsi_period': 43, 'ema1': 8, 'ema2': 11, 'slip_atr_k': 0.01102342277860948, 'slip_spread_k': 0.3198938316406488, 'spread_hl_frac': 0.04784590615520532, 'bb_std_mult': 2.733271870291438, 'rsi_os': 5, 'rsi_ob': 92, 'vol_spike': 0.08581353001073154, 'adx_thresh': 26.959860699823672, 'atr_min_pct': 0.000979029012947434, 'atr_max_pct': 0.048250343545213556, 'tp_mult': 2.417122229709708, 'tsl_mult': 0.339437969865863, 'strategy': 'breakout', 'time_stop': 130, 'use_sma': True, 'use_atr': True, 'use_adx': False, 'use_ema': False, 'use_spike': True, 'rsi_required': False, 'edge_k': 0.5645420106815328, 'edge_cap': 0.7962707468489663, 'bull_strategy': 'mean_reversion', 'bull_bb_std_mult': 1.8466951445081121, 'bull_rsi_os': 39, 'bull_rsi_ob': 65, 'bull_adx_thresh': 10.432765190984398, 'bull_atr_min_pct': 0.029921080059143155, 'bull_atr_max_pct': 0.07568378619748224, 'bull_tp_mult': 1.4075217863012734, 'bull_tsl_mult': 0.32428143113895946, 'bull_time_stop': 145, 'bull_use_sma': False, 'bull_use_ema': False, 'bull_use_atr': True, 'bull_use_adx': False, 'bull_use_spike': True, 'bull_rsi_required': False, 'bear_strategy': 'mean_reversion', 'bear_bb_std_mult': 1.5089085172925156, 'bear_rsi_os': 45, 'bear_rsi_ob': 72, 'bear_adx_thresh': 20.791613190798564, 'bear_atr_min_pct': 0.0009456554903591562, 'bear_atr_max_pct': 0.0782734178942761, 'bear_tp_mult': 1.0123043640625182, 'bear_tsl_mult': 0.7926631770491132, 'bear_time_stop': 9, 'bear_use_sma': False, 'bear_use_ema': True, 'bear_use_atr': True, 'bear_use_adx': True, 'bear_use_spike': True, 'bear_rsi_required': False, 'sideways_strategy': 'mean_reversion', 'sideways_bb_std_mult': 2.650299161324866, 'sideways_rsi_os': 51, 'sideways_rsi_ob': 62, 'sideways_adx_thresh': 32.371654721859706, 'sideways_atr_min_pct': 0.015362298949791398, 'sideways_atr_max_pct': 0.1134915474512295, 'sideways_tp_mult': 2.5702751641146766, 'sideways_tsl_mult': 0.9069118398425802, 'sideways_time_stop': 215, 'sideways_use_sma': True, 'sideways_use_ema': False, 'sideways_use_atr': False, 'sideways_use_adx': False, 'sideways_use_spike': True, 'sideways_rsi_required': False}.
[I 2025-09-01 10:12:07,727] Trial 416 finished with values: [-0.009922180690716376, 0.010310313412258229] and parameters: {'p_sma': 59, 'p_std': 48, 'p_atr': 18, 'p_adx': 11, 'rsi_period': 44, 'ema1': 8, 'ema2': 23, 'slip_atr_k': 0.01339243780101922, 'slip_spread_k': 0.5782944903945844, 'spread_hl_frac': 0.008456486031529525, 'bb_std_mult': 2.569569374175313, 'rsi_os': 55, 'rsi_ob': 55, 'vol_spike': 0.1993900408945031, 'adx_thresh': 12.484224721977773, 'atr_min_pct': 0.0008787677849411424, 'atr_max_pct': 0.06654090575263995, 'tp_mult': 2.407218257890737, 'tsl_mult': 0.8811482850757959, 'strategy': 'breakout', 'time_stop': 187, 'use_sma': True, 'use_atr': True, 'use_adx': False, 'use_ema': False, 'use_spike': True, 'rsi_required': False, 'edge_k': 0.5630686444554548, 'edge_cap': 0.7912225337925252, 'bull_strategy': 'mean_reversion', 'bull_bb_std_mult': 1.726872536748219, 'bull_rsi_os': 46, 'bull_rsi_ob': 78, 'bull_adx_thresh': 29.28552070654133, 'bull_atr_min_pct': 0.001967485959465021, 'bull_atr_max_pct': 0.06133317451880459, 'bull_tp_mult': 1.7347635566996713, 'bull_tsl_mult': 0.9101362741140102, 'bull_time_stop': 153, 'bull_use_sma': False, 'bull_use_ema': False, 'bull_use_atr': True, 'bull_use_adx': False, 'bull_use_spike': True, 'bull_rsi_required': False, 'bear_strategy': 'mean_reversion', 'bear_bb_std_mult': 1.525088265641222, 'bear_rsi_os': 42, 'bear_rsi_ob': 72, 'bear_adx_thresh': 32.292216339416626, 'bear_atr_min_pct': 0.02906605205769191, 'bear_atr_max_pct': 0.06747516585680656, 'bear_tp_mult': 2.5748914114564103, 'bear_tsl_mult': 0.7908434321211528, 'bear_time_stop': 5, 'bear_use_sma': False, 'bear_use_ema': True, 'bear_use_atr': True, 'bear_use_adx': True, 'bear_use_spike': True, 'bear_rsi_required': False, 'sideways_strategy': 'mean_reversion', 'sideways_bb_std_mult': 2.657260235337574, 'sideways_rsi_os': 18, 'sideways_rsi_ob': 62, 'sideways_adx_thresh': 32.31997195353204, 'sideways_atr_min_pct': 0.01709073329701815, 'sideways_atr_max_pct': 0.06891970228735605, 'sideways_tp_mult': 1.2883034130367488, 'sideways_tsl_mult': 0.9289339799530526, 'sideways_time_stop': 21, 'sideways_use_sma': True, 'sideways_use_ema': False, 'sideways_use_atr': False, 'sideways_use_adx': False, 'sideways_use_spike': True, 'sideways_rsi_required': False}.
[I 2025-09-01 10:12:46,790] Trial 420 finished with values: [-1000000000.0, 1000000000.0] and parameters: {'p_sma': 56, 'p_std': 45, 'p_atr': 24, 'p_adx': 21, 'rsi_period': 69, 'ema1': 6, 'ema2': 29, 'slip_atr_k': 0.006844414904762046, 'slip_spread_k': 0.7109649416832755, 'spread_hl_frac': 0.003919859310483232, 'bb_std_mult': 2.7222068605915366, 'rsi_os': 14, 'rsi_ob': 55, 'vol_spike': 0.039257438692227795, 'adx_thresh': 25.27370781291966, 'atr_min_pct': 0.001686752791675867, 'atr_max_pct': 0.07276198293403396, 'tp_mult': 1.8449186011729322, 'tsl_mult': 0.8479558650588275, 'strategy': 'breakout', 'time_stop': 119, 'use_sma': True, 'use_atr': True, 'use_adx': False, 'use_ema': True, 'use_spike': True, 'rsi_required': False, 'edge_k': 0.6250980831480074, 'edge_cap': 0.2308988779257392, 'bull_strategy': 'mean_reversion', 'bull_bb_std_mult': 1.7540288898320373, 'bull_rsi_os': 39, 'bull_rsi_ob': 77, 'bull_adx_thresh': 29.31885635173629, 'bull_atr_min_pct': 0.0028217795870790797, 'bull_atr_max_pct': 0.11307782559442067, 'bull_tp_mult': 1.7263749639836923, 'bull_tsl_mult': 0.9654214866259297, 'bull_time_stop': 144, 'bull_use_sma': True, 'bull_use_ema': False, 'bull_use_atr': True, 'bull_use_adx': False, 'bull_use_spike': True, 'bull_rsi_required': False, 'bear_strategy': 'breakout', 'bear_bb_std_mult': 1.184717881717066, 'bear_rsi_os': 44, 'bear_rsi_ob': 76, 'bear_adx_thresh': 33.34997866185195, 'bear_atr_min_pct': 0.014240448643152447, 'bear_atr_max_pct': 0.12450168763427866, 'bear_tp_mult': 2.2681044636401366, 'bear_tsl_mult': 0.8624117877061399, 'bear_time_stop': 5, 'bear_use_sma': True, 'bear_use_ema': False, 'bear_use_atr': True, 'bear_use_adx': True, 'bear_use_spike': True, 'bear_rsi_required': False, 'sideways_strategy': 'mean_reversion', 'sideways_bb_std_mult': 0.5916474061383736, 'sideways_rsi_os': 13, 'sideways_rsi_ob': 50, 'sideways_adx_thresh': 30.953453011601866, 'sideways_atr_min_pct': 0.016958599096480526, 'sideways_atr_max_pct': 0.06784544848092496, 'sideways_tp_mult': 1.4211406502492299, 'sideways_tsl_mult': 0.9095309036010965, 'sideways_time_stop': 138, 'sideways_use_sma': True, 'sideways_use_ema': False, 'sideways_use_atr': False, 'sideways_use_adx': False, 'sideways_use_spike': False, 'sideways_rsi_required': False}.
[I 2025-09-01 10:12:47,513] Trial 422 finished with values: [-0.01752021863361297, 0.017499184824904455] and parameters: {'p_sma': 30, 'p_std': 23, 'p_atr': 12, 'p_adx': 21, 'rsi_period': 46, 'ema1': 7, 'ema2': 11, 'slip_atr_k': 0.16290305227506555, 'slip_spread_k': 0.5469430583854926, 'spread_hl_frac': 0.023672081397033595, 'bb_std_mult': 2.568020396469219, 'rsi_os': 45, 'rsi_ob': 53, 'vol_spike': 0.17519704876700293, 'adx_thresh': 12.643775183688076, 'atr_min_pct': 0.018909105437952267, 'atr_max_pct': 0.12398640441758838, 'tp_mult': 1.5225403979944416, 'tsl_mult': 0.8314498170122337, 'strategy': 'breakout', 'time_stop': 138, 'use_sma': False, 'use_atr': False, 'use_adx': False, 'use_ema': False, 'use_spike': True, 'rsi_required': True, 'edge_k': 0.7635840631777622, 'edge_cap': 0.8614404315086773, 'bull_strategy': 'mean_reversion', 'bull_bb_std_mult': 3.598834445693645, 'bull_rsi_os': 38, 'bull_rsi_ob': 80, 'bull_adx_thresh': 29.514650280173527, 'bull_atr_min_pct': 0.0022431557481616374, 'bull_atr_max_pct': 0.1134817271334764, 'bull_tp_mult': 2.9550783784292305, 'bull_tsl_mult': 0.18542828478271656, 'bull_time_stop': 133, 'bull_use_sma': True, 'bull_use_ema': False, 'bull_use_atr': False, 'bull_use_adx': True, 'bull_use_spike': False, 'bull_rsi_required': False, 'bear_strategy': 'breakout', 'bear_bb_std_mult': 2.371019808553308, 'bear_rsi_os': 44, 'bear_rsi_ob': 73, 'bear_adx_thresh': 27.021287355632126, 'bear_atr_min_pct': 0.014423793364704248, 'bear_atr_max_pct': 0.05961260621475072, 'bear_tp_mult': 2.586942783514597, 'bear_tsl_mult': 0.8193174800647248, 'bear_time_stop': 18, 'bear_use_sma': False, 'bear_use_ema': False, 'bear_use_atr': True, 'bear_use_adx': False, 'bear_use_spike': False, 'bear_rsi_required': False, 'sideways_strategy': 'mean_reversion', 'sideways_bb_std_mult': 1.286639180515249, 'sideways_rsi_os': 23, 'sideways_rsi_ob': 81, 'sideways_adx_thresh': 30.861055862875013, 'sideways_atr_min_pct': 0.029245926417700324, 'sideways_atr_max_pct': 0.06484466827404457, 'sideways_tp_mult': 1.4279304843452314, 'sideways_tsl_mult': 0.2721535116899353, 'sideways_time_stop': 30, 'sideways_use_sma': False, 'sideways_use_ema': True, 'sideways_use_atr': False, 'sideways_use_adx': False, 'sideways_use_spike': False, 'sideways_rsi_required': True}.
[I 2025-09-01 10:12:47,906] Trial 423 finished with values: [-1000000000.0, 1000000000.0] and parameters: {'p_sma': 57, 'p_std': 45, 'p_atr': 30, 'p_adx': 12, 'rsi_period': 47, 'ema1': 7, 'ema2': 20, 'slip_atr_k': 0.0002610094570591366, 'slip_spread_k': 0.7180714050962871, 'spread_hl_frac': 0.0037672676652838796, 'bb_std_mult': 1.5414596606464297, 'rsi_os': 45, 'rsi_ob': 58, 'vol_spike': 0.11378195839376756, 'adx_thresh': 14.592187671108078, 'atr_min_pct': 0.01891582365544117, 'atr_max_pct': 0.07310435616083452, 'tp_mult': 2.5133109873383113, 'tsl_mult': 0.8309555522683745, 'strategy': 'mean_reversion', 'time_stop': 71, 'use_sma': False, 'use_atr': False, 'use_adx': False, 'use_ema': True, 'use_spike': True, 'rsi_required': True, 'edge_k': 1.5493366213370878, 'edge_cap': 0.22811619080432616, 'bull_strategy': 'mean_reversion', 'bull_bb_std_mult': 0.5651742557504609, 'bull_rsi_os': 38, 'bull_rsi_ob': 61, 'bull_adx_thresh': 26.750187730137956, 'bull_atr_min_pct': 0.02074816187487457, 'bull_atr_max_pct': 0.08221693436364069, 'bull_tp_mult': 1.5518915594181957, 'bull_tsl_mult': 0.7076964104180608, 'bull_time_stop': 138, 'bull_use_sma': True, 'bull_use_ema': False, 'bull_use_atr': False, 'bull_use_adx': True, 'bull_use_spike': False, 'bull_rsi_required': False, 'bear_strategy': 'breakout', 'bear_bb_std_mult': 1.3858404541001554, 'bear_rsi_os': 11, 'bear_rsi_ob': 71, 'bear_adx_thresh': 33.39172460341587, 'bear_atr_min_pct': 0.029440244625932352, 'bear_atr_max_pct': 0.07200990583875215, 'bear_tp_mult': 2.25299169569488, 'bear_tsl_mult': 0.8169204627766301, 'bear_time_stop': 128, 'bear_use_sma': True, 'bear_use_ema': False, 'bear_use_atr': True, 'bear_use_adx': False, 'bear_use_spike': False, 'bear_rsi_required': False, 'sideways_strategy': 'mean_reversion', 'sideways_bb_std_mult': 2.475479362285017, 'sideways_rsi_os': 28, 'sideways_rsi_ob': 59, 'sideways_adx_thresh': 6.154627052996894, 'sideways_atr_min_pct': 0.019982815043398012, 'sideways_atr_max_pct': 0.08024774982492233, 'sideways_tp_mult': 1.4419692982261334, 'sideways_tsl_mult': 0.2743769582148653, 'sideways_time_stop': 224, 'sideways_use_sma': False, 'sideways_use_ema': True, 'sideways_use_atr': False, 'sideways_use_adx': False, 'sideways_use_spike': False, 'sideways_rsi_required': True}.
