[I 2025-09-01 10:01:12,951] Trial 351 finished with values: [-0.18163414343929796, 0.18156101567110655] and parameters: {'p_sma': 53, 'p_std': 49, 'p_atr': 28, 'p_adx': 12, 'rsi_period': 44, 'ema1': 18, 'ema2': 52, 'slip_atr_k': 0.11378487913692573, 'slip_spread_k': 0.5588742776906732, 'spread_hl_frac': 0.010184287311709082, 'bb_std_mult': 1.7881262380500083, 'rsi_os': 11, 'rsi_ob': 84, 'vol_spike': 0.1907335330498462, 'adx_thresh': 13.314936714264796, 'atr_min_pct': 0.019360783289625788, 'atr_max_pct': 0.06752150547651001, 'tp_mult': 2.6185165188461967, 'tsl_mult': 0.1200565385967175, 'strategy': 'breakout', 'time_stop': 156, 'use_sma': True, 'use_atr': True, 'use_adx': False, 'use_ema': False, 'use_spike': True, 'rsi_required': False, 'edge_k': 0.5709667878277382, 'edge_cap': 0.846698454979581, 'bull_strategy': 'mean_reversion', 'bull_bb_std_mult': 3.291093899524313, 'bull_rsi_os': 39, 'bull_rsi_ob': 82, 'bull_adx_thresh': 27.73441147046853, 'bull_atr_min_pct': 0.002671584797925852, 'bull_atr_max_pct': 0.07997026802349495, 'bull_tp_mult': 1.6317820911841272, 'bull_tsl_mult': 0.9222578879413027, 'bull_time_stop': 119, 'bull_use_sma': True, 'bull_use_ema': False, 'bull_use_atr': True, 'bull_use_adx': False, 'bull_use_spike': True, 'bull_rsi_required': False, 'bear_strategy': 'mean_reversion', 'bear_bb_std_mult': 2.76261725062703, 'bear_rsi_os': 37, 'bear_rsi_ob': 78, 'bear_adx_thresh': 32.978504665189995, 'bear_atr_min_pct': 0.024349875549147297, 'bear_atr_max_pct': 0.11913846173802335, 'bear_tp_mult': 2.2265765659471564, 'bear_tsl_mult': 0.37828280051367225, 'bear_time_stop': 5, 'bear_use_sma': False, 'bear_use_ema': True, 'bear_use_atr': True, 'bear_use_adx': True, 'bear_use_spike': True, 'bear_rsi_required': False, 'sideways_strategy': 'mean_reversion', 'sideways_bb_std_mult': 3.5502378099842202, 'sideways_rsi_os': 47, 'sideways_rsi_ob': 84, 'sideways_adx_thresh': 33.147627845146566, 'sideways_atr_min_pct': 0.0008304694968544804, 'sideways_atr_max_pct': 0.07684662372104732, 'sideways_tp_mult': 2.1041453280855946, 'sideways_tsl_mult': 0.9031525953097577, 'sideways_time_stop': 222, 'sideways_use_sma': True, 'sideways_use_ema': False, 'sideways_use_atr': False, 'sideways_use_adx': False, 'sideways_use_spike': True, 'sideways_rsi_required': False}.
[I 2025-09-01 10:01:13,329] Trial 353 finished with values: [-0.03541394768285777, 0.03538225899336247] and parameters: {'p_sma': 60, 'p_std': 46, 'p_atr': 28, 'p_adx': 24, 'rsi_period': 36, 'ema1': 18, 'ema2': 11, 'slip_atr_k': 0.007044736769850638, 'slip_spread_k': 0.518040173920884, 'spread_hl_frac': 0.010142797342321565, 'bb_std_mult': 2.6606825314083467, 'rsi_os': 10, 'rsi_ob': 56, 'vol_spike': 0.18982054623034555, 'adx_thresh': 13.560164742377983, 'atr_min_pct': 0.002139775098544546, 'atr_max_pct': 0.11500226599859467, 'tp_mult': 1.4717880067525955, 'tsl_mult': 0.3204324113761182, 'strategy': 'mean_reversion', 'time_stop': 118, 'use_sma': True, 'use_atr': False, 'use_adx': False, 'use_ema': False, 'use_spike': True, 'rsi_required': False, 'edge_k': 1.2255242551059313, 'edge_cap': 0.24361760041969005, 'bull_strategy': 'mean_reversion', 'bull_bb_std_mult': 3.277689979377622, 'bull_rsi_os': 41, 'bull_rsi_ob': 81, 'bull_adx_thresh': 27.73775527831298, 'bull_atr_min_pct': 0.017725042057210854, 'bull_atr_max_pct': 0.13958152586603592, 'bull_tp_mult': 1.4566240096440346, 'bull_tsl_mult': 0.9291495094819283, 'bull_time_stop': 163, 'bull_use_sma': False, 'bull_use_ema': False, 'bull_use_atr': True, 'bull_use_adx': True, 'bull_use_spike': True, 'bull_rsi_required': False, 'bear_strategy': 'mean_reversion', 'bear_bb_std_mult': 2.72739000690619, 'bear_rsi_os': 45, 'bear_rsi_ob': 70, 'bear_adx_thresh': 33.39126268412609, 'bear_atr_min_pct': 0.024364164318149105, 'bear_atr_max_pct': 0.01694400466058478, 'bear_tp_mult': 2.3017584410426952, 'bear_tsl_mult': 0.8778653832672124, 'bear_time_stop': 10, 'bear_use_sma': True, 'bear_use_ema': True, 'bear_use_atr': True, 'bear_use_adx': True, 'bear_use_spike': False, 'bear_rsi_required': False, 'sideways_strategy': 'mean_reversion', 'sideways_bb_std_mult': 3.521765649245542, 'sideways_rsi_os': 33, 'sideways_rsi_ob': 57, 'sideways_adx_thresh': 18.698558719361046, 'sideways_atr_min_pct': 0.0006399140151538904, 'sideways_atr_max_pct': 0.02278269333309465, 'sideways_tp_mult': 1.5423409666617485, 'sideways_tsl_mult': 0.9034150581699996, 'sideways_time_stop': 222, 'sideways_use_sma': True, 'sideways_use_ema': False, 'sideways_use_atr': False, 'sideways_use_adx': False, 'sideways_use_spike': True, 'sideways_rsi_required': False}.
[I 2025-09-01 10:01:13,335] Trial 352 finished with values: [-1000000000.0, 0.3092121646602366] and parameters: {'p_sma': 60, 'p_std': 7, 'p_atr': 28, 'p_adx': 9, 'rsi_period': 42, 'ema1': 8, 'ema2': 29, 'slip_atr_k': 0.05560774656093649, 'slip_spread_k': 0.5081125007179254, 'spread_hl_frac': 0.010745469805982682, 'bb_std_mult': 2.589504636006142, 'rsi_os': 7, 'rsi_ob': 56, 'vol_spike': 0.18952848012938478, 'adx_thresh': 14.87947926179529, 'atr_min_pct': 0.02012531353852198, 'atr_max_pct': 0.0673763097307519, 'tp_mult': 1.4873003730930248, 'tsl_mult': 0.9335542669334789, 'strategy': 'breakout', 'time_stop': 157, 'use_sma': True, 'use_atr': False, 'use_adx': False, 'use_ema': False, 'use_spike': True, 'rsi_required': False, 'edge_k': 0.5618713193723546, 'edge_cap': 0.8498331282535122, 'bull_strategy': 'mean_reversion', 'bull_bb_std_mult': 3.2872397721294258, 'bull_rsi_os': 42, 'bull_rsi_ob': 81, 'bull_adx_thresh': 26.355927067949917, 'bull_atr_min_pct': 0.003202482379015317, 'bull_atr_max_pct': 0.13952158382991406, 'bull_tp_mult': 1.6163933767488279, 'bull_tsl_mult': 0.13207313271952814, 'bull_time_stop': 117, 'bull_use_sma': True, 'bull_use_ema': False, 'bull_use_atr': True, 'bull_use_adx': True, 'bull_use_spike': True, 'bull_rsi_required': False, 'bear_strategy': 'mean_reversion', 'bear_bb_std_mult': 1.5165459737453348, 'bear_rsi_os': 42, 'bear_rsi_ob': 67, 'bear_adx_thresh': 33.18059590722483, 'bear_atr_min_pct': 0.024666938902872595, 'bear_atr_max_pct': 0.1281125488805068, 'bear_tp_mult': 2.9549478542148346, 'bear_tsl_mult': 0.881400079194576, 'bear_time_stop': 5, 'bear_use_sma': False, 'bear_use_ema': True, 'bear_use_atr': True, 'bear_use_adx': True, 'bear_use_spike': True, 'bear_rsi_required': False, 'sideways_strategy': 'mean_reversion', 'sideways_bb_std_mult': 2.5017615382483767, 'sideways_rsi_os': 47, 'sideways_rsi_ob': 62, 'sideways_adx_thresh': 6.849344714308712, 'sideways_atr_min_pct': 0.0006315998382429027, 'sideways_atr_max_pct': 0.05294317914717804, 'sideways_tp_mult': 1.324231098379042, 'sideways_tsl_mult': 0.9010869837086586, 'sideways_time_stop': 221, 'sideways_use_sma': True, 'sideways_use_ema': False, 'sideways_use_atr': False, 'sideways_use_adx': False, 'sideways_use_spike': True, 'sideways_rsi_required': False}.
[I 2025-09-01 10:01:14,185] Trial 355 finished with values: [-1000000000.0, 1000000000.0] and parameters: {'p_sma': 60, 'p_std': 42, 'p_atr': 28, 'p_adx': 11, 'rsi_period': 42, 'ema1': 8, 'ema2': 30, 'slip_atr_k': 0.021510848939174976, 'slip_spread_k': 0.561547793851749, 'spread_hl_frac': 0.008217628245260003, 'bb_std_mult': 2.6743573464848214, 'rsi_os': 34, 'rsi_ob': 46, 'vol_spike': 0.2019227667658551, 'adx_thresh': 24.2632304359308, 'atr_min_pct': 0.020005036938401687, 'atr_max_pct': 0.03840216853868325, 'tp_mult': 1.4489396641288583, 'tsl_mult': 0.8637350007197363, 'strategy': 'mean_reversion', 'time_stop': 147, 'use_sma': True, 'use_atr': False, 'use_adx': True, 'use_ema': False, 'use_spike': True, 'rsi_required': False, 'edge_k': 0.705994751659522, 'edge_cap': 0.40446181579334517, 'bull_strategy': 'mean_reversion', 'bull_bb_std_mult': 1.2264757691697472, 'bull_rsi_os': 40, 'bull_rsi_ob': 80, 'bull_adx_thresh': 28.74791705543628, 'bull_atr_min_pct': 0.004455747096336999, 'bull_atr_max_pct': 0.045795318500108026, 'bull_tp_mult': 1.3522383986619717, 'bull_tsl_mult': 0.4360731212573048, 'bull_time_stop': 147, 'bull_use_sma': False, 'bull_use_ema': False, 'bull_use_atr': True, 'bull_use_adx': True, 'bull_use_spike': True, 'bull_rsi_required': True, 'bear_strategy': 'breakout', 'bear_bb_std_mult': 1.524227908233651, 'bear_rsi_os': 35, 'bear_rsi_ob': 94, 'bear_adx_thresh': 33.68717198082703, 'bear_atr_min_pct': 0.027648579628200637, 'bear_atr_max_pct': 0.020400826056640245, 'bear_tp_mult': 2.3097802524073443, 'bear_tsl_mult': 0.8699483385476234, 'bear_time_stop': 10, 'bear_use_sma': True, 'bear_use_ema': True, 'bear_use_atr': True, 'bear_use_adx': True, 'bear_use_spike': False, 'bear_rsi_required': False, 'sideways_strategy': 'mean_reversion', 'sideways_bb_std_mult': 1.2120043493405563, 'sideways_rsi_os': 33, 'sideways_rsi_ob': 62, 'sideways_adx_thresh': 5.102702299221198, 'sideways_atr_min_pct': 0.0039386461955919425, 'sideways_atr_max_pct': 0.1207769888584248, 'sideways_tp_mult': 1.5494189590614014, 'sideways_tsl_mult': 0.922283683995549, 'sideways_time_stop': 233, 'sideways_use_sma': True, 'sideways_use_ema': False, 'sideways_use_atr': True, 'sideways_use_adx': False, 'sideways_use_spike': True, 'sideways_rsi_required': False}.
[I 2025-09-01 10:01:14,191] Trial 357 finished with values: [-1000000000.0, 1000000000.0] and parameters: {'p_sma': 58, 'p_std': 42, 'p_atr': 28, 'p_adx': 22, 'rsi_period': 49, 'ema1': 7, 'ema2': 57, 'slip_atr_k': 0.1612679047716032, 'slip_spread_k': 0.5633176672018361, 'spread_hl_frac': 0.044181852719664044, 'bb_std_mult': 2.6786642957082196, 'rsi_os': 54, 'rsi_ob': 56, 'vol_spike': 0.20177081011149361, 'adx_thresh': 34.52100179068978, 'atr_min_pct': 0.025450551071191534, 'atr_max_pct': 0.060315068514290006, 'tp_mult': 1.897105691466316, 'tsl_mult': 0.8653881451760237, 'strategy': 'mean_reversion', 'time_stop': 39, 'use_sma': True, 'use_atr': True, 'use_adx': True, 'use_ema': False, 'use_spike': False, 'rsi_required': False, 'edge_k': 1.3208175997857163, 'edge_cap': 0.5437830669458688, 'bull_strategy': 'breakout', 'bull_bb_std_mult': 1.5999480599777811, 'bull_rsi_os': 36, 'bull_rsi_ob': 80, 'bull_adx_thresh': 30.168928538955846, 'bull_atr_min_pct': 0.004235507511023446, 'bull_atr_max_pct': 0.04544854049946865, 'bull_tp_mult': 1.5233991058166743, 'bull_tsl_mult': 0.8698927696433335, 'bull_time_stop': 148, 'bull_use_sma': False, 'bull_use_ema': True, 'bull_use_atr': True, 'bull_use_adx': False, 'bull_use_spike': True, 'bull_rsi_required': True, 'bear_strategy': 'breakout', 'bear_bb_std_mult': 1.2545103180599213, 'bear_rsi_os': 52, 'bear_rsi_ob': 92, 'bear_adx_thresh': 34.525514050357415, 'bear_atr_min_pct': 0.02780898900225998, 'bear_atr_max_pct': 0.02074556249141421, 'bear_tp_mult': 1.1711701261046166, 'bear_tsl_mult': 0.49673705545237307, 'bear_time_stop': 55, 'bear_use_sma': True, 'bear_use_ema': True, 'bear_use_atr': False, 'bear_use_adx': True, 'bear_use_spike': False, 'bear_rsi_required': False, 'sideways_strategy': 'mean_reversion', 'sideways_bb_std_mult': 3.2647238094168487, 'sideways_rsi_os': 32, 'sideways_rsi_ob': 67, 'sideways_adx_thresh': 29.25885687031498, 'sideways_atr_min_pct': 0.004093979407844187, 'sideways_atr_max_pct': 0.0808723392142711, 'sideways_tp_mult': 1.4452438218782844, 'sideways_tsl_mult': 0.6255355602716777, 'sideways_time_stop': 232, 'sideways_use_sma': False, 'sideways_use_ema': False, 'sideways_use_atr': True, 'sideways_use_adx': False, 'sideways_use_spike': True, 'sideways_rsi_required': False}.
[I 2025-09-01 10:01:52,036] Trial 359 finished with values: [-0.00855709567167684, 0.009159184847474433] and parameters: {'p_sma': 5, 'p_std': 44, 'p_atr': 29, 'p_adx': 10, 'rsi_period': 51, 'ema1': 9, 'ema2': 23, 'slip_atr_k': 0.015654739654849696, 'slip_spread_k': 0.8178802068094627, 'spread_hl_frac': 0.029124439825571783, 'bb_std_mult': 2.8637651928487067, 'rsi_os': 8, 'rsi_ob': 64, 'vol_spike': 0.0014561716284227366, 'adx_thresh': 28.75409821357311, 'atr_min_pct': 0.021714697339348554, 'atr_max_pct': 0.07570967592346219, 'tp_mult': 2.1154170573946467, 'tsl_mult': 0.36965196970540437, 'strategy': 'breakout', 'time_stop': 170, 'use_sma': True, 'use_atr': True, 'use_adx': False, 'use_ema': True, 'use_spike': True, 'rsi_required': True, 'edge_k': 0.6032880620855217, 'edge_cap': 0.8029438318980744, 'bull_strategy': 'mean_reversion', 'bull_bb_std_mult': 2.5724422493407326, 'bull_rsi_os': 38, 'bull_rsi_ob': 78, 'bull_adx_thresh': 11.05090335295062, 'bull_atr_min_pct': 0.004059046309967659, 'bull_atr_max_pct': 0.020869374575302843, 'bull_tp_mult': 1.914404480622013, 'bull_tsl_mult': 0.9040315928341925, 'bull_time_stop': 139, 'bull_use_sma': True, 'bull_use_ema': False, 'bull_use_atr': False, 'bull_use_adx': False, 'bull_use_spike': True, 'bull_rsi_required': False, 'bear_strategy': 'breakout', 'bear_bb_std_mult': 3.146939441556118, 'bear_rsi_os': 44, 'bear_rsi_ob': 70, 'bear_adx_thresh': 21.027314127139853, 'bear_atr_min_pct': 0.011555871971286807, 'bear_atr_max_pct': 0.08465983618428066, 'bear_tp_mult': 2.882138827307055, 'bear_tsl_mult': 0.8152907363344265, 'bear_time_stop': 164, 'bear_use_sma': False, 'bear_use_ema': False, 'bear_use_atr': True, 'bear_use_adx': True, 'bear_use_spike': True, 'bear_rsi_required': True, 'sideways_strategy': 'breakout', 'sideways_bb_std_mult': 2.420914789707412, 'sideways_rsi_os': 18, 'sideways_rsi_ob': 46, 'sideways_adx_thresh': 9.15245762956275, 'sideways_atr_min_pct': 0.0016373433607167402, 'sideways_atr_max_pct': 0.08725348686184632, 'sideways_tp_mult': 1.3897748767738907, 'sideways_tsl_mult': 0.729098051784647, 'sideways_time_stop': 56, 'sideways_use_sma': True, 'sideways_use_ema': False, 'sideways_use_atr': False, 'sideways_use_adx': True, 'sideways_use_spike': True, 'sideways_rsi_required': True}.
[I 2025-09-01 10:01:52,945] Trial 356 finished with values: [-1000000000.0, 1000000000.0] and parameters: {'p_sma': 58, 'p_std': 42, 'p_atr': 28, 'p_adx': 22, 'rsi_period': 51, 'ema1': 7, 'ema2': 57, 'slip_atr_k': 0.18838064735353635, 'slip_spread_k': 0.5604856046407937, 'spread_hl_frac': 0.008087809783700847, 'bb_std_mult': 2.6836139522696487, 'rsi_os': 38, 'rsi_ob': 56, 'vol_spike': 0.20360103316104577, 'adx_thresh': 34.98592799303329, 'atr_min_pct': 0.024955520159411746, 'atr_max_pct': 0.06396408735481136, 'tp_mult': 1.5600297174974822, 'tsl_mult': 0.8737425626112081, 'strategy': 'mean_reversion', 'time_stop': 149, 'use_sma': True, 'use_atr': True, 'use_adx': True, 'use_ema': False, 'use_spike': False, 'rsi_required': False, 'edge_k': 0.7135437365788216, 'edge_cap': 0.5395847911641645, 'bull_strategy': 'breakout', 'bull_bb_std_mult': 1.2716372492909032, 'bull_rsi_os': 36, 'bull_rsi_ob': 80, 'bull_adx_thresh': 29.091016423567755, 'bull_atr_min_pct': 0.004342360626939439, 'bull_atr_max_pct': 0.10974840357166127, 'bull_tp_mult': 1.510581899626704, 'bull_tsl_mult': 0.02769519548560534, 'bull_time_stop': 146, 'bull_use_sma': False, 'bull_use_ema': True, 'bull_use_atr': True, 'bull_use_adx': False, 'bull_use_spike': True, 'bull_rsi_required': True, 'bear_strategy': 'breakout', 'bear_bb_std_mult': 1.422178465398526, 'bear_rsi_os': 49, 'bear_rsi_ob': 73, 'bear_adx_thresh': 8.797604260770177, 'bear_atr_min_pct': 0.011793624639117754, 'bear_atr_max_pct': 0.08875835516346933, 'bear_tp_mult': 1.2102987463861838, 'bear_tsl_mult': 0.7569050889999086, 'bear_time_stop': 19, 'bear_use_sma': True, 'bear_use_ema': True, 'bear_use_atr': False, 'bear_use_adx': True, 'bear_use_spike': False, 'bear_rsi_required': False, 'sideways_strategy': 'mean_reversion', 'sideways_bb_std_mult': 2.3102222430725616, 'sideways_rsi_os': 33, 'sideways_rsi_ob': 68, 'sideways_adx_thresh': 31.882406331493613, 'sideways_atr_min_pct': 0.015855096977104462, 'sideways_atr_max_pct': 0.08111667979896402, 'sideways_tp_mult': 1.433888674499261, 'sideways_tsl_mult': 0.5065054236071725, 'sideways_time_stop': 26, 'sideways_use_sma': False, 'sideways_use_ema': False, 'sideways_use_atr': True, 'sideways_use_adx': False, 'sideways_use_spike': True, 'sideways_rsi_required': False}.
[I 2025-09-01 10:01:53,181] Trial 354 finished with values: [-0.0887243612894858, 0.08897197012915833] and parameters: {'p_sma': 60, 'p_std': 42, 'p_atr': 28, 'p_adx': 9, 'rsi_period': 42, 'ema1': 8, 'ema2': 10, 'slip_atr_k': 0.055123558193224786, 'slip_spread_k': 0.023424223599351646, 'spread_hl_frac': 0.013726309725642795, 'bb_std_mult': 2.3639117824741196, 'rsi_os': 34, 'rsi_ob': 56, 'vol_spike': 0.048570107611892954, 'adx_thresh': 24.34443728116987, 'atr_min_pct': 0.001036313767914675, 'atr_max_pct': 0.1137604148948479, 'tp_mult': 1.4565407572650155, 'tsl_mult': 0.8666918657821266, 'strategy': 'mean_reversion', 'time_stop': 256, 'use_sma': True, 'use_atr': False, 'use_adx': True, 'use_ema': False, 'use_spike': True, 'rsi_required': False, 'edge_k': 0.5781989491482427, 'edge_cap': 0.4018809154245846, 'bull_strategy': 'mean_reversion', 'bull_bb_std_mult': 2.584278206700588, 'bull_rsi_os': 36, 'bull_rsi_ob': 80, 'bull_adx_thresh': 28.804040119734605, 'bull_atr_min_pct': 0.004386678523373425, 'bull_atr_max_pct': 0.08594693081202213, 'bull_tp_mult': 1.931075635888251, 'bull_tsl_mult': 0.43766892818162756, 'bull_time_stop': 140, 'bull_use_sma': False, 'bull_use_ema': False, 'bull_use_atr': True, 'bull_use_adx': True, 'bull_use_spike': True, 'bull_rsi_required': True, 'bear_strategy': 'breakout', 'bear_bb_std_mult': 1.4404067323991385, 'bear_rsi_os': 48, 'bear_rsi_ob': 47, 'bear_adx_thresh': 33.641572234953216, 'bear_atr_min_pct': 0.0299545686475227, 'bear_atr_max_pct': 0.12789609061823992, 'bear_tp_mult': 2.3082496282443725, 'bear_tsl_mult': 0.5003754290409443, 'bear_time_stop': 165, 'bear_use_sma': True, 'bear_use_ema': True, 'bear_use_atr': True, 'bear_use_adx': True, 'bear_use_spike': False, 'bear_rsi_required': False, 'sideways_strategy': 'mean_reversion', 'sideways_bb_std_mult': 2.4503215806721714, 'sideways_rsi_os': 49, 'sideways_rsi_ob': 57, 'sideways_adx_thresh': 32.00331319093773, 'sideways_atr_min_pct': 0.001543235332550224, 'sideways_atr_max_pct': 0.05301294385408756, 'sideways_tp_mult': 1.4473166636505566, 'sideways_tsl_mult': 0.5501620570866368, 'sideways_time_stop': 165, 'sideways_use_sma': True, 'sideways_use_ema': False, 'sideways_use_atr': True, 'sideways_use_adx': False, 'sideways_use_spike': True, 'sideways_rsi_required': False}.
[I 2025-09-01 10:01:53,329] Trial 358 finished with values: [-1000000000.0, 1000000000.0] and parameters: {'p_sma': 58, 'p_std': 53, 'p_atr': 28, 'p_adx': 10, 'rsi_period': 51, 'ema1': 7, 'ema2': 10, 'slip_atr_k': 0.2351942353517648, 'slip_spread_k': 0.8521216313504729, 'spread_hl_frac': 0.007846151344422314, 'bb_std_mult': 2.750712947499157, 'rsi_os': 29, 'rsi_ob': 81, 'vol_spike': 0.21263591847928692, 'adx_thresh': 11.935618057148083, 'atr_min_pct': 0.009196412240581535, 'atr_max_pct': 0.06024468228421275, 'tp_mult': 2.0774511363882358, 'tsl_mult': 0.7562272908292387, 'strategy': 'breakout', 'time_stop': 36, 'use_sma': True, 'use_atr': True, 'use_adx': True, 'use_ema': False, 'use_spike': False, 'rsi_required': True, 'edge_k': 0.8633532610790003, 'edge_cap': 0.5351520295527064, 'bull_strategy': 'breakout', 'bull_bb_std_mult': 1.6831111123575457, 'bull_rsi_os': 34, 'bull_rsi_ob': 79, 'bull_adx_thresh': 6.338123794095692, 'bull_atr_min_pct': 0.003984035558114294, 'bull_atr_max_pct': 0.11076449483197752, 'bull_tp_mult': 1.5358179081346994, 'bull_tsl_mult': 0.9989417747684017, 'bull_time_stop': 140, 'bull_use_sma': True, 'bull_use_ema': True, 'bull_use_atr': False, 'bull_use_adx': False, 'bull_use_spike': True, 'bull_rsi_required': True, 'bear_strategy': 'breakout', 'bear_bb_std_mult': 1.4375673507246098, 'bear_rsi_os': 48, 'bear_rsi_ob': 46, 'bear_adx_thresh': 25.06517570624257, 'bear_atr_min_pct': 0.02997526979703068, 'bear_atr_max_pct': 0.14166792565831768, 'bear_tp_mult': 1.359285134224557, 'bear_tsl_mult': 0.8184645076082956, 'bear_time_stop': 272, 'bear_use_sma': False, 'bear_use_ema': True, 'bear_use_atr': False, 'bear_use_adx': True, 'bear_use_spike': True, 'bear_rsi_required': True, 'sideways_strategy': 'mean_reversion', 'sideways_bb_std_mult': 2.42873554107623, 'sideways_rsi_os': 30, 'sideways_rsi_ob': 60, 'sideways_adx_thresh': 31.895363022463894, 'sideways_atr_min_pct': 0.009141338269217356, 'sideways_atr_max_pct': 0.08727510238890543, 'sideways_tp_mult': 1.4488789595502936, 'sideways_tsl_mult': 0.6383277806082244, 'sideways_time_stop': 166, 'sideways_use_sma': False, 'sideways_use_ema': False, 'sideways_use_atr': True, 'sideways_use_adx': False, 'sideways_use_spike': True, 'sideways_rsi_required': True}.
