[I 2025-09-01 09:08:03,221] Trial 27 finished with values: [-1000000000.0, 1000000000.0] and parameters: {'p_sma': 33, 'p_std': 35, 'p_atr': 17, 'p_adx': 18, 'rsi_period': 16, 'ema1': 18, 'ema2': 55, 'slip_atr_k': 0.21722058332360997, 'slip_spread_k': 0.39534216734044675, 'spread_hl_frac': 0.032746734056949035, 'bb_std_mult': 3.5848904912223274, 'rsi_os': 20, 'rsi_ob': 71, 'vol_spike': 0.11878403010859728, 'adx_thresh': 8.829469596469387, 'atr_min_pct': 0.025035206047834498, 'atr_max_pct': 0.014247699190443802, 'tp_mult': 1.7622068213727544, 'tsl_mult': 0.8621666293792154, 'strategy': 'mean_reversion', 'time_stop': 66, 'use_sma': False, 'use_atr': True, 'use_adx': True, 'use_ema': False, 'use_spike': True, 'rsi_required': True, 'edge_k': 1.1147587348626962, 'edge_cap': 0.9258255320656283, 'bull_strategy': 'breakout', 'bull_bb_std_mult': 2.616493121156601, 'bull_rsi_os': 55, 'bull_rsi_ob': 69, 'bull_adx_thresh': 11.362124626968829, 'bull_atr_min_pct': 0.007828645047391294, 'bull_atr_max_pct': 0.09210576649731766, 'bull_tp_mult': 1.2596289429208967, 'bull_tsl_mult': 0.8285475565241455, 'bull_time_stop': 95, 'bull_use_sma': True, 'bull_use_ema': True, 'bull_use_atr': False, 'bull_use_adx': True, 'bull_use_spike': False, 'bull_rsi_required': True, 'bear_strategy': 'breakout', 'bear_bb_std_mult': 3.221100584718524, 'bear_rsi_os': 55, 'bear_rsi_ob': 66, 'bear_adx_thresh': 19.282447371486814, 'bear_atr_min_pct': 0.01725508662456936, 'bear_atr_max_pct': 0.14966315796618512, 'bear_tp_mult': 2.581664014713112, 'bear_tsl_mult': 0.4839617763212562, 'bear_time_stop': 47, 'bear_use_sma': True, 'bear_use_ema': True, 'bear_use_atr': False, 'bear_use_adx': False, 'bear_use_spike': False, 'bear_rsi_required': True, 'sideways_strategy': 'mean_reversion', 'sideways_bb_std_mult': 0.512757959665173, 'sideways_rsi_os': 36, 'sideways_rsi_ob': 61, 'sideways_adx_thresh': 26.794237883244115, 'sideways_atr_min_pct': 0.01950212991201902, 'sideways_atr_max_pct': 0.058712990719640964, 'sideways_tp_mult': 1.2150558996010041, 'sideways_tsl_mult': 0.7077770899472287, 'sideways_time_stop': 264, 'sideways_use_sma': True, 'sideways_use_ema': True, 'sideways_use_atr': True, 'sideways_use_adx': False, 'sideways_use_spike': False, 'sideways_rsi_required': True}.
[I 2025-09-01 09:08:43,034] Trial 30 finished with values: [-1000000000.0, 1000000000.0] and parameters: {'p_sma': 56, 'p_std': 35, 'p_atr': 16, 'p_adx': 9, 'rsi_period': 42, 'ema1': 18, 'ema2': 40, 'slip_atr_k': 0.11931174405804995, 'slip_spread_k': 0.3678117941929686, 'spread_hl_frac': 0.03135302685173819, 'bb_std_mult': 2.232994268125474, 'rsi_os': 29, 'rsi_ob': 70, 'vol_spike': 0.16286868057967516, 'adx_thresh': 8.761308058083944, 'atr_min_pct': 0.02592817682906311, 'atr_max_pct': 0.13131361716026893, 'tp_mult': 2.228739354008031, 'tsl_mult': 0.8848845062447627, 'strategy': 'mean_reversion', 'time_stop': 5, 'use_sma': False, 'use_atr': True, 'use_adx': True, 'use_ema': False, 'use_spike': False, 'rsi_required': False, 'edge_k': 0.3058623406582517, 'edge_cap': 0.9047366262618182, 'bull_strategy': 'breakout', 'bull_bb_std_mult': 2.6556652437531096, 'bull_rsi_os': 20, 'bull_rsi_ob': 50, 'bull_adx_thresh': 25.9877623331193, 'bull_atr_min_pct': 0.007730198067830822, 'bull_atr_max_pct': 0.0879868358841905, 'bull_tp_mult': 1.1606078779471316, 'bull_tsl_mult': 0.8531515143268873, 'bull_time_stop': 88, 'bull_use_sma': False, 'bull_use_ema': True, 'bull_use_atr': False, 'bull_use_adx': False, 'bull_use_spike': True, 'bull_rsi_required': False, 'bear_strategy': 'breakout', 'bear_bb_std_mult': 3.253534677789626, 'bear_rsi_os': 23, 'bear_rsi_ob': 78, 'bear_adx_thresh': 20.061649603635104, 'bear_atr_min_pct': 0.016931218090607533, 'bear_atr_max_pct': 0.1455669134063682, 'bear_tp_mult': 2.138802343043846, 'bear_tsl_mult': 0.4717473563187712, 'bear_time_stop': 107, 'bear_use_sma': False, 'bear_use_ema': False, 'bear_use_atr': False, 'bear_use_adx': True, 'bear_use_spike': True, 'bear_rsi_required': True, 'sideways_strategy': 'mean_reversion', 'sideways_bb_std_mult': 1.1225853997717392, 'sideways_rsi_os': 17, 'sideways_rsi_ob': 62, 'sideways_adx_thresh': 27.504448156582228, 'sideways_atr_min_pct': 0.01916331321267163, 'sideways_atr_max_pct': 0.06550918445670048, 'sideways_tp_mult': 1.2014511614581016, 'sideways_tsl_mult': 0.7713082608296697, 'sideways_time_stop': 271, 'sideways_use_sma': False, 'sideways_use_ema': False, 'sideways_use_atr': True, 'sideways_use_adx': True, 'sideways_use_spike': False, 'sideways_rsi_required': True}.
[I 2025-09-01 09:08:43,039] Trial 31 finished with values: [-0.011439650871443163, 0.011838145014936356] and parameters: {'p_sma': 57, 'p_std': 46, 'p_atr': 17, 'p_adx': 9, 'rsi_period': 40, 'ema1': 22, 'ema2': 42, 'slip_atr_k': 0.16905287583102113, 'slip_spread_k': 0.23679186283693918, 'spread_hl_frac': 0.030285063971261447, 'bb_std_mult': 2.231003809880172, 'rsi_os': 27, 'rsi_ob': 68, 'vol_spike': 0.1716338614317574, 'adx_thresh': 8.97566807792725, 'atr_min_pct': 0.014026808920294754, 'atr_max_pct': 0.07614338065692047, 'tp_mult': 2.3223323392643116, 'tsl_mult': 0.8903853524174301, 'strategy': 'mean_reversion', 'time_stop': 120, 'use_sma': False, 'use_atr': True, 'use_adx': True, 'use_ema': False, 'use_spike': False, 'rsi_required': False, 'edge_k': 0.24680950821011094, 'edge_cap': 0.6350772203295334, 'bull_strategy': 'breakout', 'bull_bb_std_mult': 1.562962684003458, 'bull_rsi_os': 20, 'bull_rsi_ob': 51, 'bull_adx_thresh': 28.379705392682165, 'bull_atr_min_pct': 0.0036702347588268075, 'bull_atr_max_pct': 0.052701534412383046, 'bull_tp_mult': 1.1318495178577985, 'bull_tsl_mult': 0.6016470364095078, 'bull_time_stop': 220, 'bull_use_sma': False, 'bull_use_ema': True, 'bull_use_atr': False, 'bull_use_adx': False, 'bull_use_spike': True, 'bull_rsi_required': False, 'bear_strategy': 'breakout', 'bear_bb_std_mult': 2.017738363681791, 'bear_rsi_os': 33, 'bear_rsi_ob': 88, 'bear_adx_thresh': 20.49714248849699, 'bear_atr_min_pct': 0.023601014173662865, 'bear_atr_max_pct': 0.06727141282595017, 'bear_tp_mult': 2.1385273277990735, 'bear_tsl_mult': 0.24253097238506666, 'bear_time_stop': 100, 'bear_use_sma': False, 'bear_use_ema': False, 'bear_use_atr': False, 'bear_use_adx': True, 'bear_use_spike': True, 'bear_rsi_required': True, 'sideways_strategy': 'mean_reversion', 'sideways_bb_std_mult': 1.125425138702679, 'sideways_rsi_os': 16, 'sideways_rsi_ob': 86, 'sideways_adx_thresh': 26.97680850527273, 'sideways_atr_min_pct': 0.012501021173632075, 'sideways_atr_max_pct': 0.08229286912758349, 'sideways_tp_mult': 1.7163245408427363, 'sideways_tsl_mult': 0.9948790950091959, 'sideways_time_stop': 264, 'sideways_use_sma': False, 'sideways_use_ema': False, 'sideways_use_atr': True, 'sideways_use_adx': True, 'sideways_use_spike': False, 'sideways_rsi_required': True}.
[I 2025-09-01 09:08:43,611] Trial 28 finished with values: [-1000000000.0, 1000000000.0] and parameters: {'p_sma': 57, 'p_std': 26, 'p_atr': 17, 'p_adx': 20, 'rsi_period': 14, 'ema1': 16, 'ema2': 40, 'slip_atr_k': 0.17002050228603488, 'slip_spread_k': 0.37802042455118284, 'spread_hl_frac': 0.03137975323140277, 'bb_std_mult': 2.9292772591419727, 'rsi_os': 19, 'rsi_ob': 70, 'vol_spike': 0.11242370517166966, 'adx_thresh': 8.822419245155922, 'atr_min_pct': 0.025325284105037323, 'atr_max_pct': 0.1280296469005438, 'tp_mult': 2.245629214767085, 'tsl_mult': 0.8597473313891671, 'strategy': 'mean_reversion', 'time_stop': 117, 'use_sma': False, 'use_atr': True, 'use_adx': True, 'use_ema': False, 'use_spike': True, 'rsi_required': False, 'edge_k': 1.1998785964870649, 'edge_cap': 0.9975523672875833, 'bull_strategy': 'breakout', 'bull_bb_std_mult': 1.556677048556076, 'bull_rsi_os': 10, 'bull_rsi_ob': 81, 'bull_adx_thresh': 27.38569629767526, 'bull_atr_min_pct': 0.007974087329157942, 'bull_atr_max_pct': 0.053922699703856145, 'bull_tp_mult': 1.2388230260966089, 'bull_tsl_mult': 0.15891345052745387, 'bull_time_stop': 96, 'bull_use_sma': False, 'bull_use_ema': True, 'bull_use_atr': False, 'bull_use_adx': False, 'bull_use_spike': True, 'bull_rsi_required': True, 'bear_strategy': 'breakout', 'bear_bb_std_mult': 2.0273852560138748, 'bear_rsi_os': 41, 'bear_rsi_ob': 88, 'bear_adx_thresh': 18.586644012925937, 'bear_atr_min_pct': 0.012736906697439281, 'bear_atr_max_pct': 0.1481978121640149, 'bear_tp_mult': 1.7227646812985111, 'bear_tsl_mult': 0.48666551289327603, 'bear_time_stop': 40, 'bear_use_sma': False, 'bear_use_ema': True, 'bear_use_atr': False, 'bear_use_adx': True, 'bear_use_spike': False, 'bear_rsi_required': True, 'sideways_strategy': 'mean_reversion', 'sideways_bb_std_mult': 1.17017291806529, 'sideways_rsi_os': 25, 'sideways_rsi_ob': 64, 'sideways_adx_thresh': 27.225514021339066, 'sideways_atr_min_pct': 0.019418656718806156, 'sideways_atr_max_pct': 0.06818502941198679, 'sideways_tp_mult': 1.6679071838574622, 'sideways_tsl_mult': 0.7358167510774898, 'sideways_time_stop': 263, 'sideways_use_sma': True, 'sideways_use_ema': False, 'sideways_use_atr': True, 'sideways_use_adx': False, 'sideways_use_spike': False, 'sideways_rsi_required': True}.
[I 2025-09-01 09:08:43,864] Trial 29 finished with values: [-1000000000.0, 1000000000.0] and parameters: {'p_sma': 35, 'p_std': 36, 'p_atr': 17, 'p_adx': 20, 'rsi_period': 14, 'ema1': 17, 'ema2': 40, 'slip_atr_k': 0.10717338925227549, 'slip_spread_k': 0.590266074850486, 'spread_hl_frac': 0.0319467899102401, 'bb_std_mult': 2.252396028072271, 'rsi_os': 19, 'rsi_ob': 70, 'vol_spike': 0.11291200674970925, 'adx_thresh': 19.262457404546673, 'atr_min_pct': 0.0259170790158183, 'atr_max_pct': 0.07466072922685849, 'tp_mult': 2.255408443956493, 'tsl_mult': 0.8899973644995981, 'strategy': 'mean_reversion', 'time_stop': 116, 'use_sma': False, 'use_atr': True, 'use_adx': True, 'use_ema': False, 'use_spike': True, 'rsi_required': False, 'edge_k': 1.1149045399092334, 'edge_cap': 0.4350147465666726, 'bull_strategy': 'breakout', 'bull_bb_std_mult': 2.6170707854049797, 'bull_rsi_os': 20, 'bull_rsi_ob': 51, 'bull_adx_thresh': 25.916844215914356, 'bull_atr_min_pct': 0.009340905015809808, 'bull_atr_max_pct': 0.09049609393492752, 'bull_tp_mult': 1.1577242738372244, 'bull_tsl_mult': 0.7590933173590413, 'bull_time_stop': 88, 'bull_use_sma': False, 'bull_use_ema': True, 'bull_use_atr': False, 'bull_use_adx': False, 'bull_use_spike': True, 'bull_rsi_required': True, 'bear_strategy': 'breakout', 'bear_bb_std_mult': 3.286605265775231, 'bear_rsi_os': 33, 'bear_rsi_ob': 78, 'bear_adx_thresh': 20.428956154535275, 'bear_atr_min_pct': 0.024263639826315082, 'bear_atr_max_pct': 0.09054147752307008, 'bear_tp_mult': 1.6713041035150613, 'bear_tsl_mult': 0.49325471149796546, 'bear_time_stop': 109, 'bear_use_sma': False, 'bear_use_ema': True, 'bear_use_atr': False, 'bear_use_adx': True, 'bear_use_spike': False, 'bear_rsi_required': True, 'sideways_strategy': 'mean_reversion', 'sideways_bb_std_mult': 0.99473407331161, 'sideways_rsi_os': 16, 'sideways_rsi_ob': 61, 'sideways_adx_thresh': 27.139405781595126, 'sideways_atr_min_pct': 0.01892121569069619, 'sideways_atr_max_pct': 0.07931791743756572, 'sideways_tp_mult': 1.1609404407344188, 'sideways_tsl_mult': 0.7110897096906904, 'sideways_time_stop': 262, 'sideways_use_sma': True, 'sideways_use_ema': False, 'sideways_use_atr': True, 'sideways_use_adx': False, 'sideways_use_spike': False, 'sideways_rsi_required': True}.
[I 2025-09-01 09:09:23,019] Trial 32 finished with values: [-1000000000.0, 1000000000.0] and parameters: {'p_sma': 11, 'p_std': 48, 'p_atr': 10, 'p_adx': 20, 'rsi_period': 50, 'ema1': 24, 'ema2': 38, 'slip_atr_k': 0.04063539333307793, 'slip_spread_k': 0.24556591964413643, 'spread_hl_frac': 0.036165896005262904, 'bb_std_mult': 3.210443166904427, 'rsi_os': 34, 'rsi_ob': 76, 'vol_spike': 0.19879028437712917, 'adx_thresh': 17.39781311461461, 'atr_min_pct': 0.01336534195666734, 'atr_max_pct': 0.07297608750578156, 'tp_mult': 2.6602600343929077, 'tsl_mult': 0.011593685045705404, 'strategy': 'breakout', 'time_stop': 228, 'use_sma': False, 'use_atr': True, 'use_adx': True, 'use_ema': True, 'use_spike': False, 'rsi_required': False, 'edge_k': 0.2674638713772896, 'edge_cap': 0.6344740488309509, 'bull_strategy': 'breakout', 'bull_bb_std_mult': 1.5175629896600458, 'bull_rsi_os': 21, 'bull_rsi_ob': 58, 'bull_adx_thresh': 26.935829169204975, 'bull_atr_min_pct': 0.013741280723603637, 'bull_atr_max_pct': 0.05682836056487341, 'bull_tp_mult': 1.1339576864460317, 'bull_tsl_mult': 0.6539357067678062, 'bull_time_stop': 219, 'bull_use_sma': False, 'bull_use_ema': True, 'bull_use_atr': False, 'bull_use_adx': False, 'bull_use_spike': True, 'bull_rsi_required': False, 'bear_strategy': 'breakout', 'bear_bb_std_mult': 1.7372545091222036, 'bear_rsi_os': 17, 'bear_rsi_ob': 90, 'bear_adx_thresh': 16.742598542335344, 'bear_atr_min_pct': 0.02410843740477926, 'bear_atr_max_pct': 0.011230857205335829, 'bear_tp_mult': 1.658720165629864, 'bear_tsl_mult': 0.187001157703232, 'bear_time_stop': 143, 'bear_use_sma': False, 'bear_use_ema': False, 'bear_use_atr': True, 'bear_use_adx': True, 'bear_use_spike': True, 'bear_rsi_required': True, 'sideways_strategy': 'breakout', 'sideways_bb_std_mult': 1.091849658511832, 'sideways_rsi_os': 15, 'sideways_rsi_ob': 68, 'sideways_adx_thresh': 22.07856026623932, 'sideways_atr_min_pct': 0.012161656436389614, 'sideways_atr_max_pct': 0.08218498991098155, 'sideways_tp_mult': 1.9458326989583574, 'sideways_tsl_mult': 0.9861944279840561, 'sideways_time_stop': 10, 'sideways_use_sma': False, 'sideways_use_ema': False, 'sideways_use_atr': True, 'sideways_use_adx': True, 'sideways_use_spike': False, 'sideways_rsi_required': True}.
[I 2025-09-01 09:09:23,755] Trial 34 finished with values: [-1000000000.0, 1000000000.0] and parameters: {'p_sma': 60, 'p_std': 47, 'p_atr': 14, 'p_adx': 9, 'rsi_period': 49, 'ema1': 22, 'ema2': 39, 'slip_atr_k': 0.03913623703356081, 'slip_spread_k': 0.215033826031017, 'spread_hl_frac': 0.03856824225962294, 'bb_std_mult': 2.2696445331087713, 'rsi_os': 34, 'rsi_ob': 75, 'vol_spike': 0.20381089379571815, 'adx_thresh': 17.950444857041465, 'atr_min_pct': 0.013402544638318067, 'atr_max_pct': 0.07249662475112378, 'tp_mult': 2.5376785349148108, 'tsl_mult': 0.6571145778676581, 'strategy': 'breakout', 'time_stop': 220, 'use_sma': False, 'use_atr': True, 'use_adx': True, 'use_ema': False, 'use_spike': False, 'rsi_required': False, 'edge_k': 0.2048513950659116, 'edge_cap': 0.6189846740257724, 'bull_strategy': 'breakout', 'bull_bb_std_mult': 1.4108220645370748, 'bull_rsi_os': 21, 'bull_rsi_ob': 59, 'bull_adx_thresh': 23.888922320008298, 'bull_atr_min_pct': 0.02929923882834272, 'bull_atr_max_pct': 0.04583260379127189, 'bull_tp_mult': 1.0760531801890811, 'bull_tsl_mult': 0.6375954710770196, 'bull_time_stop': 224, 'bull_use_sma': False, 'bull_use_ema': True, 'bull_use_atr': False, 'bull_use_adx': False, 'bull_use_spike': True, 'bull_rsi_required': False, 'bear_strategy': 'breakout', 'bear_bb_std_mult': 1.674172944264509, 'bear_rsi_os': 18, 'bear_rsi_ob': 88, 'bear_adx_thresh': 21.473946466001994, 'bear_atr_min_pct': 0.02492256991279405, 'bear_atr_max_pct': 0.010982528168031913, 'bear_tp_mult': 2.1390504519538287, 'bear_tsl_mult': 0.17364588612721527, 'bear_time_stop': 148, 'bear_use_sma': False, 'bear_use_ema': False, 'bear_use_atr': False, 'bear_use_adx': True, 'bear_use_spike': True, 'bear_rsi_required': True, 'sideways_strategy': 'mean_reversion', 'sideways_bb_std_mult': 0.846778175881441, 'sideways_rsi_os': 14, 'sideways_rsi_ob': 80, 'sideways_adx_thresh': 22.393736653161223, 'sideways_atr_min_pct': 0.012189501628166002, 'sideways_atr_max_pct': 0.08226748793169117, 'sideways_tp_mult': 1.9025794498805504, 'sideways_tsl_mult': 0.9905194781216182, 'sideways_time_stop': 15, 'sideways_use_sma': False, 'sideways_use_ema': False, 'sideways_use_atr': True, 'sideways_use_adx': True, 'sideways_use_spike': False, 'sideways_rsi_required': True}.
[I 2025-09-01 09:09:24,158] Trial 33 finished with values: [-1000000000.0, 1000000000.0] and parameters: {'p_sma': 58, 'p_std': 46, 'p_atr': 10, 'p_adx': 19, 'rsi_period': 47, 'ema1': 24, 'ema2': 15, 'slip_atr_k': 0.049000729466158396, 'slip_spread_k': 0.24026620404195934, 'spread_hl_frac': 0.03697131849003519, 'bb_std_mult': 3.15397708515164, 'rsi_os': 34, 'rsi_ob': 76, 'vol_spike': 0.19500576522791302, 'adx_thresh': 17.100717879232377, 'atr_min_pct': 0.012644540123797147, 'atr_max_pct': 0.07478402426182536, 'tp_mult': 2.630894124934067, 'tsl_mult': 0.018932124460597832, 'strategy': 'breakout', 'time_stop': 209, 'use_sma': False, 'use_atr': True, 'use_adx': True, 'use_ema': True, 'use_spike': False, 'rsi_required': False, 'edge_k': 0.24355731159776206, 'edge_cap': 0.6175498453539172, 'bull_strategy': 'breakout', 'bull_bb_std_mult': 1.5210908545472124, 'bull_rsi_os': 22, 'bull_rsi_ob': 59, 'bull_adx_thresh': 26.585908420903422, 'bull_atr_min_pct': 0.028538497140837303, 'bull_atr_max_pct': 0.04855143414762984, 'bull_tp_mult': 1.1128762711622537, 'bull_tsl_mult': 0.5729434974276719, 'bull_time_stop': 222, 'bull_use_sma': False, 'bull_use_ema': True, 'bull_use_atr': False, 'bull_use_adx': False, 'bull_use_spike': True, 'bull_rsi_required': False, 'bear_strategy': 'breakout', 'bear_bb_std_mult': 1.775498741391269, 'bear_rsi_os': 17, 'bear_rsi_ob': 87, 'bear_adx_thresh': 17.1056073303517, 'bear_atr_min_pct': 0.024061675514784976, 'bear_atr_max_pct': 0.01025666871217705, 'bear_tp_mult': 1.7338851486681948, 'bear_tsl_mult': 0.17438282053577475, 'bear_time_stop': 142, 'bear_use_sma': False, 'bear_use_ema': False, 'bear_use_atr': True, 'bear_use_adx': True, 'bear_use_spike': True, 'bear_rsi_required': True, 'sideways_strategy': 'breakout', 'sideways_bb_std_mult': 1.088016716860523, 'sideways_rsi_os': 13, 'sideways_rsi_ob': 80, 'sideways_adx_thresh': 21.78489578571629, 'sideways_atr_min_pct': 0.01215179482144792, 'sideways_atr_max_pct': 0.10552741105500846, 'sideways_tp_mult': 1.8987938242133116, 'sideways_tsl_mult': 0.9923470985893946, 'sideways_time_stop': 218, 'sideways_use_sma': False, 'sideways_use_ema': False, 'sideways_use_atr': True, 'sideways_use_adx': True, 'sideways_use_spike': False, 'sideways_rsi_required': True}.
[I 2025-09-01 09:09:24,483] Trial 35 finished with values: [-1000000000.0, 1000000000.0] and parameters: {'p_sma': 60, 'p_std': 48, 'p_atr': 14, 'p_adx': 9, 'rsi_period': 49, 'ema1': 22, 'ema2': 15, 'slip_atr_k': 0.035134168260619936, 'slip_spread_k': 0.249034507755941, 'spread_hl_frac': 0.03778899218831255, 'bb_std_mult': 3.4754660948315816, 'rsi_os': 27, 'rsi_ob': 76, 'vol_spike': 0.19917139188316443, 'adx_thresh': 16.786472013412762, 'atr_min_pct': 0.01353684557284712, 'atr_max_pct': 0.07553882240982902, 'tp_mult': 2.6198651001137945, 'tsl_mult': 0.7138033525831763, 'strategy': 'breakout', 'time_stop': 216, 'use_sma': False, 'use_atr': True, 'use_adx': True, 'use_ema': True, 'use_spike': False, 'rsi_required': True, 'edge_k': 0.22990279829091978, 'edge_cap': 0.626737722224644, 'bull_strategy': 'breakout', 'bull_bb_std_mult': 1.5240610253724853, 'bull_rsi_os': 37, 'bull_rsi_ob': 58, 'bull_adx_thresh': 22.857793561853875, 'bull_atr_min_pct': 0.02922177297470232, 'bull_atr_max_pct': 0.1019117408450942, 'bull_tp_mult': 2.621759753362123, 'bull_tsl_mult': 0.5607115077029112, 'bull_time_stop': 216, 'bull_use_sma': True, 'bull_use_ema': True, 'bull_use_atr': False, 'bull_use_adx': False, 'bull_use_spike': True, 'bull_rsi_required': False, 'bear_strategy': 'breakout', 'bear_bb_std_mult': 1.5612573285602283, 'bear_rsi_os': 16, 'bear_rsi_ob': 90, 'bear_adx_thresh': 22.52396651446855, 'bear_atr_min_pct': 0.024038804434371598, 'bear_atr_max_pct': 0.06139909446921623, 'bear_tp_mult': 2.1572655785830945, 'bear_tsl_mult': 0.16085796549474435, 'bear_time_stop': 144, 'bear_use_sma': False, 'bear_use_ema': False, 'bear_use_atr': False, 'bear_use_adx': True, 'bear_use_spike': True, 'bear_rsi_required': True, 'sideways_strategy': 'breakout', 'sideways_bb_std_mult': 0.5314557315430954, 'sideways_rsi_os': 12, 'sideways_rsi_ob': 70, 'sideways_adx_thresh': 22.278271204166515, 'sideways_atr_min_pct': 0.011377798858064779, 'sideways_atr_max_pct': 0.08316345114068, 'sideways_tp_mult': 1.9240521892966502, 'sideways_tsl_mult': 0.9752029510691225, 'sideways_time_stop': 47, 'sideways_use_sma': False, 'sideways_use_ema': False, 'sideways_use_atr': True, 'sideways_use_adx': True, 'sideways_use_spike': False, 'sideways_rsi_required': True}.
