[I 2025-09-01 10:01:54,058] Trial 361 finished with values: [-1000000000.0, 1000000000.0] and parameters: {'p_sma': 30, 'p_std': 56, 'p_atr': 28, 'p_adx': 13, 'rsi_period': 46, 'ema1': 7, 'ema2': 10, 'slip_atr_k': 0.008121759175316963, 'slip_spread_k': 0.7510489150895318, 'spread_hl_frac': 0.013944543076708305, 'bb_std_mult': 2.5469098036733766, 'rsi_os': 27, 'rsi_ob': 67, 'vol_spike': 0.045485021860083644, 'adx_thresh': 8.530763945637812, 'atr_min_pct': 0.014433484297755471, 'atr_max_pct': 0.012931674400992896, 'tp_mult': 2.0591629999414907, 'tsl_mult': 0.7903606626859863, 'strategy': 'breakout', 'time_stop': 130, 'use_sma': True, 'use_atr': True, 'use_adx': False, 'use_ema': False, 'use_spike': True, 'rsi_required': False, 'edge_k': 0.7671395880706011, 'edge_cap': 0.1605671448448282, 'bull_strategy': 'mean_reversion', 'bull_bb_std_mult': 3.507461337272544, 'bull_rsi_os': 22, 'bull_rsi_ob': 60, 'bull_adx_thresh': 28.140922427387327, 'bull_atr_min_pct': 0.014218484468765268, 'bull_atr_max_pct': 0.08610333245066924, 'bull_tp_mult': 2.900880203775129, 'bull_tsl_mult': 0.9554706515597685, 'bull_time_stop': 128, 'bull_use_sma': True, 'bull_use_ema': False, 'bull_use_atr': True, 'bull_use_adx': False, 'bull_use_spike': True, 'bull_rsi_required': False, 'bear_strategy': 'breakout', 'bear_bb_std_mult': 2.9063289957036784, 'bear_rsi_os': 13, 'bear_rsi_ob': 73, 'bear_adx_thresh': 34.003042639831776, 'bear_atr_min_pct': 0.029809057564000204, 'bear_atr_max_pct': 0.12643277919111098, 'bear_tp_mult': 1.3642292656491866, 'bear_tsl_mult': 0.8352893214433128, 'bear_time_stop': 27, 'bear_use_sma': False, 'bear_use_ema': True, 'bear_use_atr': True, 'bear_use_adx': True, 'bear_use_spike': True, 'bear_rsi_required': False, 'sideways_strategy': 'mean_reversion', 'sideways_bb_std_mult': 1.31541792928598, 'sideways_rsi_os': 28, 'sideways_rsi_ob': 66, 'sideways_adx_thresh': 32.48415892348625, 'sideways_atr_min_pct': 0.008522993414124581, 'sideways_atr_max_pct': 0.09044668664777422, 'sideways_tp_mult': 2.4536706095204686, 'sideways_tsl_mult': 0.543421183312704, 'sideways_time_stop': 158, 'sideways_use_sma': True, 'sideways_use_ema': False, 'sideways_use_atr': False, 'sideways_use_adx': False, 'sideways_use_spike': True, 'sideways_rsi_required': False}.
[I 2025-09-01 10:02:32,935] Trial 360 finished with values: [-1000000000.0, 1000000000.0] and parameters: {'p_sma': 58, 'p_std': 55, 'p_atr': 28, 'p_adx': 13, 'rsi_period': 46, 'ema1': 7, 'ema2': 10, 'slip_atr_k': 0.007080347863613402, 'slip_spread_k': 0.7553991241025284, 'spread_hl_frac': 0.007813307066172592, 'bb_std_mult': 0.7823198653647567, 'rsi_os': 38, 'rsi_ob': 55, 'vol_spike': 0.04332782193996626, 'adx_thresh': 12.195225882261806, 'atr_min_pct': 0.01800033117268232, 'atr_max_pct': 0.05063236747982067, 'tp_mult': 2.060872582958794, 'tsl_mult': 0.7915983685819622, 'strategy': 'breakout', 'time_stop': 151, 'use_sma': True, 'use_atr': True, 'use_adx': False, 'use_ema': False, 'use_spike': True, 'rsi_required': False, 'edge_k': 0.7765851496440179, 'edge_cap': 0.5133692565860841, 'bull_strategy': 'mean_reversion', 'bull_bb_std_mult': 3.50846794565787, 'bull_rsi_os': 22, 'bull_rsi_ob': 60, 'bull_adx_thresh': 6.184887298653274, 'bull_atr_min_pct': 0.022257997834568187, 'bull_atr_max_pct': 0.10200003877236519, 'bull_tp_mult': 1.5203632244491183, 'bull_tsl_mult': 0.6485683859192549, 'bull_time_stop': 96, 'bull_use_sma': True, 'bull_use_ema': False, 'bull_use_atr': True, 'bull_use_adx': False, 'bull_use_spike': True, 'bull_rsi_required': False, 'bear_strategy': 'breakout', 'bear_bb_std_mult': 1.1277023123749252, 'bear_rsi_os': 48, 'bear_rsi_ob': 90, 'bear_adx_thresh': 18.85843295077591, 'bear_atr_min_pct': 0.0005301054979409362, 'bear_atr_max_pct': 0.09304158062111405, 'bear_tp_mult': 1.2297780849820097, 'bear_tsl_mult': 0.70221399149576, 'bear_time_stop': 270, 'bear_use_sma': False, 'bear_use_ema': True, 'bear_use_atr': True, 'bear_use_adx': True, 'bear_use_spike': True, 'bear_rsi_required': False, 'sideways_strategy': 'mean_reversion', 'sideways_bb_std_mult': 1.79545802656948, 'sideways_rsi_os': 40, 'sideways_rsi_ob': 50, 'sideways_adx_thresh': 31.59282385962751, 'sideways_atr_min_pct': 0.029898314984912182, 'sideways_atr_max_pct': 0.09029193252108376, 'sideways_tp_mult': 1.994601640743873, 'sideways_tsl_mult': 0.04116199168582013, 'sideways_time_stop': 164, 'sideways_use_sma': True, 'sideways_use_ema': False, 'sideways_use_atr': False, 'sideways_use_adx': False, 'sideways_use_spike': True, 'sideways_rsi_required': False}.
[I 2025-09-01 10:02:35,742] Trial 362 finished with values: [-1000000000.0, 1000000000.0] and parameters: {'p_sma': 56, 'p_std': 47, 'p_atr': 17, 'p_adx': 13, 'rsi_period': 46, 'ema1': 9, 'ema2': 12, 'slip_atr_k': 0.006053076489466405, 'slip_spread_k': 0.7500893709019903, 'spread_hl_frac': 0.031130232046569534, 'bb_std_mult': 0.5034610329188929, 'rsi_os': 9, 'rsi_ob': 74, 'vol_spike': 0.06094362649051295, 'adx_thresh': 12.229763344004452, 'atr_min_pct': 0.01784867887771352, 'atr_max_pct': 0.06544032007492614, 'tp_mult': 2.602848361090031, 'tsl_mult': 0.8161352785350705, 'strategy': 'breakout', 'time_stop': 207, 'use_sma': False, 'use_atr': True, 'use_adx': False, 'use_ema': True, 'use_spike': True, 'rsi_required': False, 'edge_k': 1.7322421947598823, 'edge_cap': 0.6193868062027775, 'bull_strategy': 'mean_reversion', 'bull_bb_std_mult': 3.5205592371128187, 'bull_rsi_os': 18, 'bull_rsi_ob': 63, 'bull_adx_thresh': 28.290839682418902, 'bull_atr_min_pct': 0.01690623649621011, 'bull_atr_max_pct': 0.07823001494798124, 'bull_tp_mult': 1.578779517728615, 'bull_tsl_mult': 0.41284419148435, 'bull_time_stop': 131, 'bull_use_sma': True, 'bull_use_ema': False, 'bull_use_atr': True, 'bull_use_adx': False, 'bull_use_spike': False, 'bull_rsi_required': False, 'bear_strategy': 'breakout', 'bear_bb_std_mult': 0.963691387222174, 'bear_rsi_os': 45, 'bear_rsi_ob': 83, 'bear_adx_thresh': 34.336692075320194, 'bear_atr_min_pct': 0.028967195887705223, 'bear_atr_max_pct': 0.1311241434579302, 'bear_tp_mult': 2.7510182310948834, 'bear_tsl_mult': 0.8385204977057387, 'bear_time_stop': 15, 'bear_use_sma': False, 'bear_use_ema': False, 'bear_use_atr': True, 'bear_use_adx': False, 'bear_use_spike': True, 'bear_rsi_required': False, 'sideways_strategy': 'breakout', 'sideways_bb_std_mult': 1.8176823615666715, 'sideways_rsi_os': 28, 'sideways_rsi_ob': 59, 'sideways_adx_thresh': 31.304814088771266, 'sideways_atr_min_pct': 0.014181392558991838, 'sideways_atr_max_pct': 0.1255992879999806, 'sideways_tp_mult': 1.2660364657323142, 'sideways_tsl_mult': 0.9444816429747394, 'sideways_time_stop': 213, 'sideways_use_sma': True, 'sideways_use_ema': True, 'sideways_use_atr': False, 'sideways_use_adx': True, 'sideways_use_spike': False, 'sideways_rsi_required': False}.
[I 2025-09-01 10:02:36,363] Trial 364 finished with values: [-1000000000.0, 1000000000.0] and parameters: {'p_sma': 17, 'p_std': 47, 'p_atr': 29, 'p_adx': 26, 'rsi_period': 57, 'ema1': 9, 'ema2': 27, 'slip_atr_k': 0.17844844058407283, 'slip_spread_k': 0.5949603178717499, 'spread_hl_frac': 0.030452960740946194, 'bb_std_mult': 1.9875644434401816, 'rsi_os': 9, 'rsi_ob': 55, 'vol_spike': 0.06276198335442237, 'adx_thresh': 12.580100063520126, 'atr_min_pct': 0.017869676750227364, 'atr_max_pct': 0.0988852792084905, 'tp_mult': 2.5405701002109993, 'tsl_mult': 0.9936827906301687, 'strategy': 'breakout', 'time_stop': 209, 'use_sma': False, 'use_atr': True, 'use_adx': False, 'use_ema': True, 'use_spike': True, 'rsi_required': False, 'edge_k': 0.6554140766296299, 'edge_cap': 0.8207535397925072, 'bull_strategy': 'mean_reversion', 'bull_bb_std_mult': 0.5085496340428144, 'bull_rsi_os': 18, 'bull_rsi_ob': 90, 'bull_adx_thresh': 27.411319639373673, 'bull_atr_min_pct': 0.005693847006748683, 'bull_atr_max_pct': 0.07840273810894806, 'bull_tp_mult': 2.1081342567609713, 'bull_tsl_mult': 0.9380602423390296, 'bull_time_stop': 132, 'bull_use_sma': True, 'bull_use_ema': False, 'bull_use_atr': True, 'bull_use_adx': False, 'bull_use_spike': False, 'bull_rsi_required': False, 'bear_strategy': 'breakout', 'bear_bb_std_mult': 1.1264785273870657, 'bear_rsi_os': 22, 'bear_rsi_ob': 80, 'bear_adx_thresh': 23.980106618083195, 'bear_atr_min_pct': 0.006755914930593335, 'bear_atr_max_pct': 0.1309865188924189, 'bear_tp_mult': 2.7651843150550297, 'bear_tsl_mult': 0.6979598936021846, 'bear_time_stop': 14, 'bear_use_sma': False, 'bear_use_ema': False, 'bear_use_atr': True, 'bear_use_adx': False, 'bear_use_spike': True, 'bear_rsi_required': False, 'sideways_strategy': 'breakout', 'sideways_bb_std_mult': 2.5389310641325786, 'sideways_rsi_os': 53, 'sideways_rsi_ob': 59, 'sideways_adx_thresh': 28.440993401598732, 'sideways_atr_min_pct': 0.02989477012120844, 'sideways_atr_max_pct': 0.14928503340622737, 'sideways_tp_mult': 1.2546207620040248, 'sideways_tsl_mult': 0.9471046223210867, 'sideways_time_stop': 212, 'sideways_use_sma': True, 'sideways_use_ema': True, 'sideways_use_atr': False, 'sideways_use_adx': True, 'sideways_use_spike': False, 'sideways_rsi_required': False}.
[I 2025-09-01 10:02:37,152] Trial 363 finished with values: [-1000000000.0, 1000000000.0] and parameters: {'p_sma': 59, 'p_std': 55, 'p_atr': 12, 'p_adx': 18, 'rsi_period': 46, 'ema1': 14, 'ema2': 12, 'slip_atr_k': 0.007786437693147754, 'slip_spread_k': 0.7569920249541074, 'spread_hl_frac': 0.005984423189377008, 'bb_std_mult': 2.55658585042192, 'rsi_os': 18, 'rsi_ob': 49, 'vol_spike': 0.07067372170731928, 'adx_thresh': 8.293881409242418, 'atr_min_pct': 0.029909357614723936, 'atr_max_pct': 0.12730464601933789, 'tp_mult': 2.538926876078714, 'tsl_mult': 0.7863823624533268, 'strategy': 'breakout', 'time_stop': 67, 'use_sma': False, 'use_atr': True, 'use_adx': False, 'use_ema': True, 'use_spike': True, 'rsi_required': False, 'edge_k': 0.644853091411101, 'edge_cap': 0.6182876862303472, 'bull_strategy': 'mean_reversion', 'bull_bb_std_mult': 2.7829098541309882, 'bull_rsi_os': 39, 'bull_rsi_ob': 63, 'bull_adx_thresh': 28.18846155979726, 'bull_atr_min_pct': 0.005693611572555374, 'bull_atr_max_pct': 0.07714424182349501, 'bull_tp_mult': 1.5787640700453132, 'bull_tsl_mult': 0.9648391127690904, 'bull_time_stop': 128, 'bull_use_sma': True, 'bull_use_ema': False, 'bull_use_atr': True, 'bull_use_adx': False, 'bull_use_spike': False, 'bull_rsi_required': False, 'bear_strategy': 'breakout', 'bear_bb_std_mult': 1.3136154270779985, 'bear_rsi_os': 45, 'bear_rsi_ob': 73, 'bear_adx_thresh': 23.87467771374741, 'bear_atr_min_pct': 0.023288475165434225, 'bear_atr_max_pct': 0.1306624555577974, 'bear_tp_mult': 1.2667099212018789, 'bear_tsl_mult': 0.6975394059129635, 'bear_time_stop': 16, 'bear_use_sma': False, 'bear_use_ema': False, 'bear_use_atr': True, 'bear_use_adx': False, 'bear_use_spike': True, 'bear_rsi_required': False, 'sideways_strategy': 'breakout', 'sideways_bb_std_mult': 2.5975833369370913, 'sideways_rsi_os': 53, 'sideways_rsi_ob': 59, 'sideways_adx_thresh': 31.16959267153744, 'sideways_atr_min_pct': 0.014185095602705767, 'sideways_atr_max_pct': 0.09101628669542144, 'sideways_tp_mult': 1.0152478794744972, 'sideways_tsl_mult': 0.9501994769319799, 'sideways_time_stop': 215, 'sideways_use_sma': True, 'sideways_use_ema': True, 'sideways_use_atr': False, 'sideways_use_adx': True, 'sideways_use_spike': False, 'sideways_rsi_required': False}.
[I 2025-09-01 10:03:15,702] Trial 365 finished with values: [-1000000000.0, 1000000000.0] and parameters: {'p_sma': 56, 'p_std': 47, 'p_atr': 17, 'p_adx': 12, 'rsi_period': 38, 'ema1': 27, 'ema2': 37, 'slip_atr_k': 0.012021192561220913, 'slip_spread_k': 0.33380005938996093, 'spread_hl_frac': 0.030990205608965763, 'bb_std_mult': 1.9869784675813134, 'rsi_os': 18, 'rsi_ob': 59, 'vol_spike': 0.05800416397864701, 'adx_thresh': 17.868807393001326, 'atr_min_pct': 0.019549418860415956, 'atr_max_pct': 0.06525790562999603, 'tp_mult': 2.5375179151211773, 'tsl_mult': 0.9979656222930409, 'strategy': 'breakout', 'time_stop': 141, 'use_sma': False, 'use_atr': True, 'use_adx': False, 'use_ema': True, 'use_spike': True, 'rsi_required': True, 'edge_k': 0.632723619999773, 'edge_cap': 0.980340843405212, 'bull_strategy': 'mean_reversion', 'bull_bb_std_mult': 2.27508837899609, 'bull_rsi_os': 39, 'bull_rsi_ob': 50, 'bull_adx_thresh': 27.40253705651324, 'bull_atr_min_pct': 0.005584975415668345, 'bull_atr_max_pct': 0.07589961770281674, 'bull_tp_mult': 1.4684254314939895, 'bull_tsl_mult': 0.22949952557386466, 'bull_time_stop': 285, 'bull_use_sma': True, 'bull_use_ema': False, 'bull_use_atr': False, 'bull_use_adx': False, 'bull_use_spike': False, 'bull_rsi_required': False, 'bear_strategy': 'mean_reversion', 'bear_bb_std_mult': 1.6113762978553734, 'bear_rsi_os': 44, 'bear_rsi_ob': 48, 'bear_adx_thresh': 23.853996541358523, 'bear_atr_min_pct': 0.02905103546997756, 'bear_atr_max_pct': 0.061727406098374, 'bear_tp_mult': 2.6360600413483395, 'bear_tsl_mult': 0.19459275246976937, 'bear_time_stop': 16, 'bear_use_sma': False, 'bear_use_ema': False, 'bear_use_atr': True, 'bear_use_adx': False, 'bear_use_spike': True, 'bear_rsi_required': True, 'sideways_strategy': 'breakout', 'sideways_bb_std_mult': 0.6780516137368107, 'sideways_rsi_os': 9, 'sideways_rsi_ob': 59, 'sideways_adx_thresh': 28.520094847478735, 'sideways_atr_min_pct': 0.014675168266772103, 'sideways_atr_max_pct': 0.08603553983477344, 'sideways_tp_mult': 1.2468870890771717, 'sideways_tsl_mult': 0.4328418540637341, 'sideways_time_stop': 190, 'sideways_use_sma': True, 'sideways_use_ema': True, 'sideways_use_atr': False, 'sideways_use_adx': True, 'sideways_use_spike': False, 'sideways_rsi_required': True}.
[I 2025-09-01 10:03:15,864] Trial 367 finished with values: [-1000000000.0, 1000000000.0] and parameters: {'p_sma': 44, 'p_std': 44, 'p_atr': 16, 'p_adx': 15, 'rsi_period': 39, 'ema1': 8, 'ema2': 12, 'slip_atr_k': 2.0718987374650222e-05, 'slip_spread_k': 0.6260889640829557, 'spread_hl_frac': 0.027591992521940223, 'bb_std_mult': 2.5985433598648267, 'rsi_os': 18, 'rsi_ob': 60, 'vol_spike': 0.034669857861670234, 'adx_thresh': 11.013665306114495, 'atr_min_pct': 0.019640616216785825, 'atr_max_pct': 0.06996263917615944, 'tp_mult': 2.522007157194968, 'tsl_mult': 0.1665727082757527, 'strategy': 'breakout', 'time_stop': 139, 'use_sma': True, 'use_atr': False, 'use_adx': False, 'use_ema': False, 'use_spike': True, 'rsi_required': True, 'edge_k': 0.5191743669225587, 'edge_cap': 0.8604326187905116, 'bull_strategy': 'mean_reversion', 'bull_bb_std_mult': 2.772232259638648, 'bull_rsi_os': 38, 'bull_rsi_ob': 50, 'bull_adx_thresh': 32.63942725981256, 'bull_atr_min_pct': 0.027694251051572912, 'bull_atr_max_pct': 0.07541676205906588, 'bull_tp_mult': 1.4486057172399427, 'bull_tsl_mult': 0.9104306545692982, 'bull_time_stop': 12, 'bull_use_sma': True, 'bull_use_ema': False, 'bull_use_atr': False, 'bull_use_adx': True, 'bull_use_spike': True, 'bull_rsi_required': False, 'bear_strategy': 'mean_reversion', 'bear_bb_std_mult': 2.0197474018546466, 'bear_rsi_os': 43, 'bear_rsi_ob': 85, 'bear_adx_thresh': 34.987651173072905, 'bear_atr_min_pct': 0.028354792448369224, 'bear_atr_max_pct': 0.1200939684821663, 'bear_tp_mult': 2.8654937087348435, 'bear_tsl_mult': 0.999047818156777, 'bear_time_stop': 21, 'bear_use_sma': False, 'bear_use_ema': True, 'bear_use_atr': True, 'bear_use_adx': True, 'bear_use_spike': True, 'bear_rsi_required': True, 'sideways_strategy': 'mean_reversion', 'sideways_bb_std_mult': 0.6679229762241012, 'sideways_rsi_os': 9, 'sideways_rsi_ob': 60, 'sideways_adx_thresh': 20.36688650772382, 'sideways_atr_min_pct': 0.00274579825134276, 'sideways_atr_max_pct': 0.1419202273063162, 'sideways_tp_mult': 1.333208619808726, 'sideways_tsl_mult': 0.9993573307958264, 'sideways_time_stop': 228, 'sideways_use_sma': True, 'sideways_use_ema': False, 'sideways_use_atr': False, 'sideways_use_adx': False, 'sideways_use_spike': True, 'sideways_rsi_required': True}.
[I 2025-09-01 10:03:16,329] Trial 366 finished with values: [-1000000000.0, 1000000000.0] and parameters: {'p_sma': 59, 'p_std': 44, 'p_atr': 29, 'p_adx': 30, 'rsi_period': 38, 'ema1': 11, 'ema2': 27, 'slip_atr_k': 0.013157518283573755, 'slip_spread_k': 0.36115435307037, 'spread_hl_frac': 0.005758661776530839, 'bb_std_mult': 2.0550233588110998, 'rsi_os': 18, 'rsi_ob': 51, 'vol_spike': 0.0736161156659653, 'adx_thresh': 33.211294261973855, 'atr_min_pct': 0.01969338567100187, 'atr_max_pct': 0.12192525362359935, 'tp_mult': 2.5398567958248166, 'tsl_mult': 0.6416953100302262, 'strategy': 'breakout', 'time_stop': 142, 'use_sma': False, 'use_atr': True, 'use_adx': False, 'use_ema': True, 'use_spike': True, 'rsi_required': True, 'edge_k': 0.6488539842838621, 'edge_cap': 0.8254023972818673, 'bull_strategy': 'mean_reversion', 'bull_bb_std_mult': 2.8004752235720143, 'bull_rsi_os': 38, 'bull_rsi_ob': 50, 'bull_adx_thresh': 27.272547406413132, 'bull_atr_min_pct': 0.005980311849247772, 'bull_atr_max_pct': 0.07650389886771343, 'bull_tp_mult': 1.5846674315258622, 'bull_tsl_mult': 0.9351898393544705, 'bull_time_stop': 279, 'bull_use_sma': True, 'bull_use_ema': False, 'bull_use_atr': False, 'bull_use_adx': False, 'bull_use_spike': False, 'bull_rsi_required': False, 'bear_strategy': 'mean_reversion', 'bear_bb_std_mult': 1.3225117562090265, 'bear_rsi_os': 43, 'bear_rsi_ob': 85, 'bear_adx_thresh': 34.54266524833894, 'bear_atr_min_pct': 0.028119784849617004, 'bear_atr_max_pct': 0.12216318017963818, 'bear_tp_mult': 1.7833953609740325, 'bear_tsl_mult': 0.7704496729150473, 'bear_time_stop': 205, 'bear_use_sma': False, 'bear_use_ema': False, 'bear_use_atr': True, 'bear_use_adx': False, 'bear_use_spike': True, 'bear_rsi_required': True, 'sideways_strategy': 'mean_reversion', 'sideways_bb_std_mult': 2.614502581805919, 'sideways_rsi_os': 31, 'sideways_rsi_ob': 60, 'sideways_adx_thresh': 33.13910389725835, 'sideways_atr_min_pct': 0.0028358709396353477, 'sideways_atr_max_pct': 0.06643351472476265, 'sideways_tp_mult': 1.338157106374217, 'sideways_tsl_mult': 0.9797181411860908, 'sideways_time_stop': 227, 'sideways_use_sma': True, 'sideways_use_ema': True, 'sideways_use_atr': False, 'sideways_use_adx': False, 'sideways_use_spike': False, 'sideways_rsi_required': True}.
[I 2025-09-01 10:03:16,575] Trial 368 finished with values: [-0.0184055572341566, 0.018641689156528307] and parameters: {'p_sma': 45, 'p_std': 45, 'p_atr': 16, 'p_adx': 12, 'rsi_period': 22, 'ema1': 26, 'ema2': 26, 'slip_atr_k': 0.014297261826277425, 'slip_spread_k': 0.9355688587596689, 'spread_hl_frac': 0.02737899290001073, 'bb_std_mult': 3.5228281273696203, 'rsi_os': 7, 'rsi_ob': 59, 'vol_spike': 0.1962469908566587, 'adx_thresh': 10.200353241039297, 'atr_min_pct': 0.019716143635642756, 'atr_max_pct': 0.06961426078669897, 'tp_mult': 1.9659957940008046, 'tsl_mult': 0.2344197564664549, 'strategy': 'breakout', 'time_stop': 237, 'use_sma': True, 'use_atr': False, 'use_adx': False, 'use_ema': False, 'use_spike': False, 'rsi_required': True, 'edge_k': 1.4205625791822625, 'edge_cap': 0.8602809797617129, 'bull_strategy': 'mean_reversion', 'bull_bb_std_mult': 2.281797746274887, 'bull_rsi_os': 28, 'bull_rsi_ob': 50, 'bull_adx_thresh': 29.583465480892645, 'bull_atr_min_pct': 0.006779137231479063, 'bull_atr_max_pct': 0.07424726165128205, 'bull_tp_mult': 1.4587362389631253, 'bull_tsl_mult': 0.8825498254141073, 'bull_time_stop': 279, 'bull_use_sma': True, 'bull_use_ema': False, 'bull_use_atr': False, 'bull_use_adx': True, 'bull_use_spike': True, 'bull_rsi_required': False, 'bear_strategy': 'mean_reversion', 'bear_bb_std_mult': 1.757430934117143, 'bear_rsi_os': 43, 'bear_rsi_ob': 61, 'bear_adx_thresh': 5.365120719766493, 'bear_atr_min_pct': 0.009067539834828412, 'bear_atr_max_pct': 0.06283602093646289, 'bear_tp_mult': 2.6467837242034964, 'bear_tsl_mult': 0.02764018627756004, 'bear_time_stop': 212, 'bear_use_sma': False, 'bear_use_ema': True, 'bear_use_atr': True, 'bear_use_adx': True, 'bear_use_spike': True, 'bear_rsi_required': True, 'sideways_strategy': 'mean_reversion', 'sideways_bb_std_mult': 2.6611283434531368, 'sideways_rsi_os': 30, 'sideways_rsi_ob': 60, 'sideways_adx_thresh': 34.552361850250435, 'sideways_atr_min_pct': 0.0026810234830003583, 'sideways_atr_max_pct': 0.04096943307293539, 'sideways_tp_mult': 1.343660396685037, 'sideways_tsl_mult': 0.23695974006545306, 'sideways_time_stop': 192, 'sideways_use_sma': True, 'sideways_use_ema': False, 'sideways_use_atr': False, 'sideways_use_adx': False, 'sideways_use_spike': True, 'sideways_rsi_required': True}.
