[I 2025-09-01 09:59:42,772] Trial 343 finished with values: [-1000000000.0, 1000000000.0] and parameters: {'p_sma': 23, 'p_std': 19, 'p_atr': 14, 'p_adx': 11, 'rsi_period': 43, 'ema1': 7, 'ema2': 48, 'slip_atr_k': 0.009748717525129654, 'slip_spread_k': 0.16035143374040817, 'spread_hl_frac': 0.04639314903644718, 'bb_std_mult': 2.482501610479437, 'rsi_os': 46, 'rsi_ob': 58, 'vol_spike': 0.21915188626996043, 'adx_thresh': 11.417963572643043, 'atr_min_pct': 0.019088739753235964, 'atr_max_pct': 0.07118878106293379, 'tp_mult': 2.968690222875237, 'tsl_mult': 0.8409487701472754, 'strategy': 'breakout', 'time_stop': 183, 'use_sma': True, 'use_atr': True, 'use_adx': False, 'use_ema': False, 'use_spike': False, 'rsi_required': True, 'edge_k': 1.8685543831131266, 'edge_cap': 0.8877821565097122, 'bull_strategy': 'breakout', 'bull_bb_std_mult': 0.7108209763558981, 'bull_rsi_os': 20, 'bull_rsi_ob': 65, 'bull_adx_thresh': 7.932201496464591, 'bull_atr_min_pct': 0.005280327402451094, 'bull_atr_max_pct': 0.07120749682068842, 'bull_tp_mult': 1.5284262245894942, 'bull_tsl_mult': 0.8473341950799327, 'bull_time_stop': 141, 'bull_use_sma': True, 'bull_use_ema': True, 'bull_use_atr': False, 'bull_use_adx': False, 'bull_use_spike': True, 'bull_rsi_required': False, 'bear_strategy': 'breakout', 'bear_bb_std_mult': 1.0598593501699187, 'bear_rsi_os': 44, 'bear_rsi_ob': 74, 'bear_adx_thresh': 32.392659365178524, 'bear_atr_min_pct': 0.029628726379163892, 'bear_atr_max_pct': 0.12442496307569705, 'bear_tp_mult': 2.8120849001710284, 'bear_tsl_mult': 0.4736173377126464, 'bear_time_stop': 100, 'bear_use_sma': False, 'bear_use_ema': True, 'bear_use_atr': False, 'bear_use_adx': True, 'bear_use_spike': True, 'bear_rsi_required': True, 'sideways_strategy': 'mean_reversion', 'sideways_bb_std_mult': 2.5891216095030463, 'sideways_rsi_os': 31, 'sideways_rsi_ob': 93, 'sideways_adx_thresh': 31.718280682691525, 'sideways_atr_min_pct': 0.021909704165381943, 'sideways_atr_max_pct': 0.09398841339068546, 'sideways_tp_mult': 1.3664297950441961, 'sideways_tsl_mult': 0.12229046761911139, 'sideways_time_stop': 131, 'sideways_use_sma': False, 'sideways_use_ema': False, 'sideways_use_atr': False, 'sideways_use_adx': False, 'sideways_use_spike': True, 'sideways_rsi_required': True}.
[I 2025-09-01 09:59:43,386] Trial 342 finished with values: [-1000000000.0, 1000000000.0] and parameters: {'p_sma': 23, 'p_std': 45, 'p_atr': 14, 'p_adx': 11, 'rsi_period': 43, 'ema1': 7, 'ema2': 12, 'slip_atr_k': 0.16964274412943492, 'slip_spread_k': 0.16127468808772094, 'spread_hl_frac': 0.0066197676676823785, 'bb_std_mult': 2.467265507982188, 'rsi_os': 50, 'rsi_ob': 58, 'vol_spike': 0.25498320270915986, 'adx_thresh': 10.707495454878613, 'atr_min_pct': 0.019169989743154654, 'atr_max_pct': 0.07140575064130923, 'tp_mult': 2.4879544852929616, 'tsl_mult': 0.8462390638113891, 'strategy': 'breakout', 'time_stop': 176, 'use_sma': True, 'use_atr': True, 'use_adx': False, 'use_ema': False, 'use_spike': False, 'rsi_required': True, 'edge_k': 0.5211696644681004, 'edge_cap': 0.8892183369214939, 'bull_strategy': 'breakout', 'bull_bb_std_mult': 2.9587433671815355, 'bull_rsi_os': 16, 'bull_rsi_ob': 47, 'bull_adx_thresh': 7.8547243886280445, 'bull_atr_min_pct': 0.005039366555920106, 'bull_atr_max_pct': 0.07264547424854532, 'bull_tp_mult': 2.6526419396383147, 'bull_tsl_mult': 0.8971425977635057, 'bull_time_stop': 46, 'bull_use_sma': True, 'bull_use_ema': True, 'bull_use_atr': False, 'bull_use_adx': False, 'bull_use_spike': True, 'bull_rsi_required': False, 'bear_strategy': 'breakout', 'bear_bb_std_mult': 1.5428410129684036, 'bear_rsi_os': 9, 'bear_rsi_ob': 74, 'bear_adx_thresh': 31.951553269937957, 'bear_atr_min_pct': 0.027428510911303473, 'bear_atr_max_pct': 0.123528580487161, 'bear_tp_mult': 2.811701266067551, 'bear_tsl_mult': 0.4539548551975785, 'bear_time_stop': 14, 'bear_use_sma': False, 'bear_use_ema': True, 'bear_use_atr': False, 'bear_use_adx': True, 'bear_use_spike': True, 'bear_rsi_required': True, 'sideways_strategy': 'mean_reversion', 'sideways_bb_std_mult': 2.5695740217981506, 'sideways_rsi_os': 31, 'sideways_rsi_ob': 59, 'sideways_adx_thresh': 5.722593287858496, 'sideways_atr_min_pct': 0.0217811988460399, 'sideways_atr_max_pct': 0.09413073531043638, 'sideways_tp_mult': 2.9921172983766264, 'sideways_tsl_mult': 0.17316162739324364, 'sideways_time_stop': 125, 'sideways_use_sma': False, 'sideways_use_ema': False, 'sideways_use_atr': False, 'sideways_use_adx': False, 'sideways_use_spike': True, 'sideways_rsi_required': True}.
[I 2025-09-01 09:59:43,800] Trial 345 finished with values: [-1000000000.0, 1000000000.0] and parameters: {'p_sma': 55, 'p_std': 45, 'p_atr': 18, 'p_adx': 11, 'rsi_period': 40, 'ema1': 8, 'ema2': 50, 'slip_atr_k': 0.0943842164257726, 'slip_spread_k': 0.6153706524866025, 'spread_hl_frac': 0.004189215438349849, 'bb_std_mult': 3.2425938594099293, 'rsi_os': 22, 'rsi_ob': 58, 'vol_spike': 0.21998059344590695, 'adx_thresh': 11.55008767854979, 'atr_min_pct': 0.02650881362158379, 'atr_max_pct': 0.07116232059039351, 'tp_mult': 2.512216184691446, 'tsl_mult': 0.842673956727557, 'strategy': 'breakout', 'time_stop': 162, 'use_sma': False, 'use_atr': True, 'use_adx': False, 'use_ema': False, 'use_spike': False, 'rsi_required': True, 'edge_k': 0.6407896001232661, 'edge_cap': 0.9096702840778446, 'bull_strategy': 'breakout', 'bull_bb_std_mult': 3.477797981701684, 'bull_rsi_os': 13, 'bull_rsi_ob': 62, 'bull_adx_thresh': 7.037197980353527, 'bull_atr_min_pct': 0.003952321419646081, 'bull_atr_max_pct': 0.07912232058975592, 'bull_tp_mult': 2.226137783789989, 'bull_tsl_mult': 0.8912723839844122, 'bull_time_stop': 142, 'bull_use_sma': True, 'bull_use_ema': True, 'bull_use_atr': False, 'bull_use_adx': False, 'bull_use_spike': False, 'bull_rsi_required': False, 'bear_strategy': 'breakout', 'bear_bb_std_mult': 3.5353266452712453, 'bear_rsi_os': 34, 'bear_rsi_ob': 88, 'bear_adx_thresh': 31.867583013352068, 'bear_atr_min_pct': 0.013031218775542605, 'bear_atr_max_pct': 0.12406186681360633, 'bear_tp_mult': 2.721677408738563, 'bear_tsl_mult': 0.8400125749764628, 'bear_time_stop': 78, 'bear_use_sma': False, 'bear_use_ema': True, 'bear_use_atr': False, 'bear_use_adx': False, 'bear_use_spike': True, 'bear_rsi_required': True, 'sideways_strategy': 'mean_reversion', 'sideways_bb_std_mult': 2.5598053518289583, 'sideways_rsi_os': 6, 'sideways_rsi_ob': 59, 'sideways_adx_thresh': 27.791455877316444, 'sideways_atr_min_pct': 0.023587082789467688, 'sideways_atr_max_pct': 0.09380536954724993, 'sideways_tp_mult': 1.3599149002684083, 'sideways_tsl_mult': 0.12001478630547047, 'sideways_time_stop': 238, 'sideways_use_sma': False, 'sideways_use_ema': True, 'sideways_use_atr': False, 'sideways_use_adx': False, 'sideways_use_spike': True, 'sideways_rsi_required': True}.
[I 2025-09-01 09:59:44,131] Trial 344 finished with values: [-0.015956095195606035, 0.015808328781677317] and parameters: {'p_sma': 55, 'p_std': 32, 'p_atr': 26, 'p_adx': 11, 'rsi_period': 40, 'ema1': 8, 'ema2': 17, 'slip_atr_k': 0.16979218908491508, 'slip_spread_k': 0.6071548966093843, 'spread_hl_frac': 0.04711596380777913, 'bb_std_mult': 0.9403697316055226, 'rsi_os': 46, 'rsi_ob': 58, 'vol_spike': 0.20831086556785947, 'adx_thresh': 11.541207576951159, 'atr_min_pct': 0.015131029586658927, 'atr_max_pct': 0.07107911487771867, 'tp_mult': 2.5106741233320027, 'tsl_mult': 0.8391654161149439, 'strategy': 'breakout', 'time_stop': 108, 'use_sma': False, 'use_atr': True, 'use_adx': False, 'use_ema': False, 'use_spike': False, 'rsi_required': True, 'edge_k': 0.6677456674824811, 'edge_cap': 0.8139192161189017, 'bull_strategy': 'breakout', 'bull_bb_std_mult': 3.4536008313324156, 'bull_rsi_os': 38, 'bull_rsi_ob': 78, 'bull_adx_thresh': 22.298069823140306, 'bull_atr_min_pct': 0.0037532590732456943, 'bull_atr_max_pct': 0.13473647069311664, 'bull_tp_mult': 2.012909673546494, 'bull_tsl_mult': 0.3407817199079597, 'bull_time_stop': 215, 'bull_use_sma': True, 'bull_use_ema': True, 'bull_use_atr': False, 'bull_use_adx': False, 'bull_use_spike': False, 'bull_rsi_required': False, 'bear_strategy': 'breakout', 'bear_bb_std_mult': 1.540538534102137, 'bear_rsi_os': 9, 'bear_rsi_ob': 56, 'bear_adx_thresh': 32.25526468829037, 'bear_atr_min_pct': 0.005146462984490067, 'bear_atr_max_pct': 0.0334588840079719, 'bear_tp_mult': 1.5126431937569569, 'bear_tsl_mult': 0.920857195191322, 'bear_time_stop': 14, 'bear_use_sma': False, 'bear_use_ema': True, 'bear_use_atr': False, 'bear_use_adx': False, 'bear_use_spike': True, 'bear_rsi_required': True, 'sideways_strategy': 'mean_reversion', 'sideways_bb_std_mult': 2.5737321931747283, 'sideways_rsi_os': 43, 'sideways_rsi_ob': 93, 'sideways_adx_thresh': 27.641124072640068, 'sideways_atr_min_pct': 0.0051184967114871, 'sideways_atr_max_pct': 0.09280753952827112, 'sideways_tp_mult': 1.3554455919807202, 'sideways_tsl_mult': 0.4753315410684643, 'sideways_time_stop': 202, 'sideways_use_sma': False, 'sideways_use_ema': True, 'sideways_use_atr': False, 'sideways_use_adx': False, 'sideways_use_spike': True, 'sideways_rsi_required': True}.
[I 2025-09-01 10:00:24,492] Trial 349 finished with values: [-0.07261823219172836, 0.07269580678014657] and parameters: {'p_sma': 32, 'p_std': 5, 'p_atr': 27, 'p_adx': 10, 'rsi_period': 46, 'ema1': 8, 'ema2': 14, 'slip_atr_k': 0.02835359689872261, 'slip_spread_k': 0.39345758042952694, 'spread_hl_frac': 0.004597422850631203, 'bb_std_mult': 2.954459695243338, 'rsi_os': 5, 'rsi_ob': 76, 'vol_spike': 0.010057782363849466, 'adx_thresh': 31.548675480686825, 'atr_min_pct': 0.007265190540388812, 'atr_max_pct': 0.07965824069237222, 'tp_mult': 1.249150017104819, 'tsl_mult': 0.8081476377517038, 'strategy': 'breakout', 'time_stop': 277, 'use_sma': True, 'use_atr': False, 'use_adx': False, 'use_ema': True, 'use_spike': True, 'rsi_required': False, 'edge_k': 1.350670682650138, 'edge_cap': 0.8511197773406327, 'bull_strategy': 'mean_reversion', 'bull_bb_std_mult': 2.4814876320642103, 'bull_rsi_os': 47, 'bull_rsi_ob': 79, 'bull_adx_thresh': 25.26119706573526, 'bull_atr_min_pct': 0.0006000232637123678, 'bull_atr_max_pct': 0.07657714458653656, 'bull_tp_mult': 2.984785395777141, 'bull_tsl_mult': 0.11250319811833503, 'bull_time_stop': 126, 'bull_use_sma': True, 'bull_use_ema': False, 'bull_use_atr': True, 'bull_use_adx': True, 'bull_use_spike': True, 'bull_rsi_required': False, 'bear_strategy': 'breakout', 'bear_bb_std_mult': 3.4163700671186596, 'bear_rsi_os': 43, 'bear_rsi_ob': 72, 'bear_adx_thresh': 34.2812399098679, 'bear_atr_min_pct': 0.021638478320144757, 'bear_atr_max_pct': 0.12694629829238205, 'bear_tp_mult': 2.873491883995555, 'bear_tsl_mult': 0.8535075535971773, 'bear_time_stop': 31, 'bear_use_sma': False, 'bear_use_ema': False, 'bear_use_atr': True, 'bear_use_adx': True, 'bear_use_spike': True, 'bear_rsi_required': False, 'sideways_strategy': 'breakout', 'sideways_bb_std_mult': 2.4566271558080217, 'sideways_rsi_os': 24, 'sideways_rsi_ob': 89, 'sideways_adx_thresh': 30.6933226448157, 'sideways_atr_min_pct': 0.0021910781378244627, 'sideways_atr_max_pct': 0.08805128046376211, 'sideways_tp_mult': 2.4900337862771424, 'sideways_tsl_mult': 0.6648506522475776, 'sideways_time_stop': 64, 'sideways_use_sma': True, 'sideways_use_ema': False, 'sideways_use_atr': False, 'sideways_use_adx': True, 'sideways_use_spike': False, 'sideways_rsi_required': False}.
[I 2025-09-01 10:00:27,148] Trial 348 finished with values: [-1000000000.0, 1000000000.0] and parameters: {'p_sma': 58, 'p_std': 51, 'p_atr': 27, 'p_adx': 7, 'rsi_period': 49, 'ema1': 26, 'ema2': 17, 'slip_atr_k': 0.01707377447273075, 'slip_spread_k': 0.6347112155507943, 'spread_hl_frac': 0.024441308249385625, 'bb_std_mult': 1.4977426945502148, 'rsi_os': 5, 'rsi_ob': 62, 'vol_spike': 0.20524957730226226, 'adx_thresh': 12.05692887319802, 'atr_min_pct': 0.028459598318403966, 'atr_max_pct': 0.07929774495414252, 'tp_mult': 2.444848432325171, 'tsl_mult': 0.8194908284868775, 'strategy': 'breakout', 'time_stop': 5, 'use_sma': False, 'use_atr': True, 'use_adx': False, 'use_ema': True, 'use_spike': True, 'rsi_required': False, 'edge_k': 0.6437846205947084, 'edge_cap': 0.8145713597259268, 'bull_strategy': 'mean_reversion', 'bull_bb_std_mult': 3.4026275371214236, 'bull_rsi_os': 46, 'bull_rsi_ob': 78, 'bull_adx_thresh': 26.834420806467392, 'bull_atr_min_pct': 0.01914610996561024, 'bull_atr_max_pct': 0.1163521923807924, 'bull_tp_mult': 1.6547545600564653, 'bull_tsl_mult': 0.9541039174842714, 'bull_time_stop': 213, 'bull_use_sma': True, 'bull_use_ema': False, 'bull_use_atr': True, 'bull_use_adx': False, 'bull_use_spike': False, 'bull_rsi_required': False, 'bear_strategy': 'breakout', 'bear_bb_std_mult': 1.446418941007775, 'bear_rsi_os': 11, 'bear_rsi_ob': 72, 'bear_adx_thresh': 34.32283144449395, 'bear_atr_min_pct': 0.005094299257107943, 'bear_atr_max_pct': 0.1334022339661666, 'bear_tp_mult': 1.4990631746715724, 'bear_tsl_mult': 0.2865927980658072, 'bear_time_stop': 15, 'bear_use_sma': False, 'bear_use_ema': False, 'bear_use_atr': True, 'bear_use_adx': False, 'bear_use_spike': True, 'bear_rsi_required': False, 'sideways_strategy': 'breakout', 'sideways_bb_std_mult': 1.522489392331701, 'sideways_rsi_os': 37, 'sideways_rsi_ob': 76, 'sideways_adx_thresh': 30.56349968144937, 'sideways_atr_min_pct': 0.0024295517809782303, 'sideways_atr_max_pct': 0.03451240393050536, 'sideways_tp_mult': 1.396577545822183, 'sideways_tsl_mult': 0.9677182430335433, 'sideways_time_stop': 199, 'sideways_use_sma': True, 'sideways_use_ema': True, 'sideways_use_atr': False, 'sideways_use_adx': True, 'sideways_use_spike': False, 'sideways_rsi_required': False}.
[I 2025-09-01 10:00:27,819] Trial 346 finished with values: [-0.0020093069251244655, 0.0025662702151489102] and parameters: {'p_sma': 58, 'p_std': 45, 'p_atr': 16, 'p_adx': 10, 'rsi_period': 49, 'ema1': 8, 'ema2': 57, 'slip_atr_k': 0.019356923071463833, 'slip_spread_k': 0.6284686704161495, 'spread_hl_frac': 0.0038655824007349984, 'bb_std_mult': 2.6715360394298964, 'rsi_os': 22, 'rsi_ob': 76, 'vol_spike': 0.17159972163728057, 'adx_thresh': 11.72026906697769, 'atr_min_pct': 0.02648734872544361, 'atr_max_pct': 0.06837520769396786, 'tp_mult': 2.5242415351761864, 'tsl_mult': 0.8126152582472057, 'strategy': 'breakout', 'time_stop': 108, 'use_sma': False, 'use_atr': True, 'use_adx': False, 'use_ema': False, 'use_spike': False, 'rsi_required': False, 'edge_k': 0.6522748488466453, 'edge_cap': 0.8150573295400798, 'bull_strategy': 'breakout', 'bull_bb_std_mult': 3.4225374719421775, 'bull_rsi_os': 47, 'bull_rsi_ob': 78, 'bull_adx_thresh': 27.806313181632937, 'bull_atr_min_pct': 0.004019123469501602, 'bull_atr_max_pct': 0.13380153284509846, 'bull_tp_mult': 2.6527360956899306, 'bull_tsl_mult': 0.888923929802081, 'bull_time_stop': 124, 'bull_use_sma': True, 'bull_use_ema': True, 'bull_use_atr': True, 'bull_use_adx': False, 'bull_use_spike': False, 'bull_rsi_required': False, 'bear_strategy': 'breakout', 'bear_bb_std_mult': 1.5300444924685332, 'bear_rsi_os': 42, 'bear_rsi_ob': 56, 'bear_adx_thresh': 34.423744003334654, 'bear_atr_min_pct': 0.02492175210328061, 'bear_atr_max_pct': 0.12429963013023593, 'bear_tp_mult': 1.1678173477461027, 'bear_tsl_mult': 0.3647533259415846, 'bear_time_stop': 15, 'bear_use_sma': False, 'bear_use_ema': True, 'bear_use_atr': False, 'bear_use_adx': False, 'bear_use_spike': True, 'bear_rsi_required': False, 'sideways_strategy': 'mean_reversion', 'sideways_bb_std_mult': 2.5402779871213705, 'sideways_rsi_os': 33, 'sideways_rsi_ob': 59, 'sideways_adx_thresh': 5.71693986462804, 'sideways_atr_min_pct': 0.015704479615442208, 'sideways_atr_max_pct': 0.09266891024259043, 'sideways_tp_mult': 1.3515446867730372, 'sideways_tsl_mult': 0.5134479661364463, 'sideways_time_stop': 238, 'sideways_use_sma': False, 'sideways_use_ema': True, 'sideways_use_atr': False, 'sideways_use_adx': False, 'sideways_use_spike': True, 'sideways_rsi_required': False}.
[I 2025-09-01 10:00:28,778] Trial 347 finished with values: [-0.006836774539663915, 0.007218376402702759] and parameters: {'p_sma': 55, 'p_std': 49, 'p_atr': 27, 'p_adx': 12, 'rsi_period': 14, 'ema1': 15, 'ema2': 52, 'slip_atr_k': 0.027581628291748164, 'slip_spread_k': 0.39333596092136663, 'spread_hl_frac': 0.049775868487703746, 'bb_std_mult': 0.651068716659932, 'rsi_os': 24, 'rsi_ob': 84, 'vol_spike': 0.1712141035287033, 'adx_thresh': 31.55511573354432, 'atr_min_pct': 0.019796533156596966, 'atr_max_pct': 0.06776076406082077, 'tp_mult': 1.2318369646250906, 'tsl_mult': 0.8043927583128601, 'strategy': 'breakout', 'time_stop': 109, 'use_sma': False, 'use_atr': True, 'use_adx': False, 'use_ema': False, 'use_spike': True, 'rsi_required': False, 'edge_k': 0.6720021327238839, 'edge_cap': 0.8477686920507264, 'bull_strategy': 'mean_reversion', 'bull_bb_std_mult': 3.4419000319030966, 'bull_rsi_os': 39, 'bull_rsi_ob': 92, 'bull_adx_thresh': 25.266620512022254, 'bull_atr_min_pct': 0.002576764136232364, 'bull_atr_max_pct': 0.1356162683400114, 'bull_tp_mult': 1.6416042683815262, 'bull_tsl_mult': 0.13370426664163532, 'bull_time_stop': 130, 'bull_use_sma': True, 'bull_use_ema': False, 'bull_use_atr': True, 'bull_use_adx': False, 'bull_use_spike': False, 'bull_rsi_required': False, 'bear_strategy': 'breakout', 'bear_bb_std_mult': 1.4777732944984971, 'bear_rsi_os': 42, 'bear_rsi_ob': 72, 'bear_adx_thresh': 33.10905837664557, 'bear_atr_min_pct': 0.0214534608631581, 'bear_atr_max_pct': 0.13404439672074256, 'bear_tp_mult': 2.118326553032543, 'bear_tsl_mult': 0.374242345090454, 'bear_time_stop': 125, 'bear_use_sma': False, 'bear_use_ema': True, 'bear_use_atr': True, 'bear_use_adx': False, 'bear_use_spike': True, 'bear_rsi_required': False, 'sideways_strategy': 'mean_reversion', 'sideways_bb_std_mult': 2.4874885690182005, 'sideways_rsi_os': 47, 'sideways_rsi_ob': 76, 'sideways_adx_thresh': 27.527786459175978, 'sideways_atr_min_pct': 0.02340712117694646, 'sideways_atr_max_pct': 0.07626331295092062, 'sideways_tp_mult': 1.2344521685437833, 'sideways_tsl_mult': 0.9730501267669381, 'sideways_time_stop': 238, 'sideways_use_sma': True, 'sideways_use_ema': True, 'sideways_use_atr': False, 'sideways_use_adx': False, 'sideways_use_spike': False, 'sideways_rsi_required': False}.
[I 2025-09-01 10:01:12,947] Trial 350 finished with values: [-0.02215495359987485, 0.022087059341086717] and parameters: {'p_sma': 14, 'p_std': 49, 'p_atr': 16, 'p_adx': 12, 'rsi_period': 29, 'ema1': 12, 'ema2': 35, 'slip_atr_k': 0.11386109349730116, 'slip_spread_k': 0.5073782600819793, 'spread_hl_frac': 0.010385462829863966, 'bb_std_mult': 2.6081153124218948, 'rsi_os': 11, 'rsi_ob': 91, 'vol_spike': 0.17245844145266373, 'adx_thresh': 13.297687898469887, 'atr_min_pct': 0.028525930464951103, 'atr_max_pct': 0.0671143437364308, 'tp_mult': 2.457312151585776, 'tsl_mult': 0.31582257318838475, 'strategy': 'breakout', 'time_stop': 158, 'use_sma': True, 'use_atr': True, 'use_adx': False, 'use_ema': False, 'use_spike': True, 'rsi_required': False, 'edge_k': 1.5399441366930637, 'edge_cap': 0.8387400627281225, 'bull_strategy': 'mean_reversion', 'bull_bb_std_mult': 3.412613113426163, 'bull_rsi_os': 41, 'bull_rsi_ob': 82, 'bull_adx_thresh': 26.799449958047152, 'bull_atr_min_pct': 0.002541409822928195, 'bull_atr_max_pct': 0.08006537581397744, 'bull_tp_mult': 1.6468095629304174, 'bull_tsl_mult': 0.9578973269437087, 'bull_time_stop': 119, 'bull_use_sma': True, 'bull_use_ema': False, 'bull_use_atr': True, 'bull_use_adx': False, 'bull_use_spike': True, 'bull_rsi_required': False, 'bear_strategy': 'mean_reversion', 'bear_bb_std_mult': 2.7225220605039793, 'bear_rsi_os': 42, 'bear_rsi_ob': 67, 'bear_adx_thresh': 33.20676699689, 'bear_atr_min_pct': 0.029402451991868934, 'bear_atr_max_pct': 0.016695888716466087, 'bear_tp_mult': 2.9584253471754, 'bear_tsl_mult': 0.3171760807254421, 'bear_time_stop': 5, 'bear_use_sma': False, 'bear_use_ema': True, 'bear_use_atr': True, 'bear_use_adx': True, 'bear_use_spike': True, 'bear_rsi_required': False, 'sideways_strategy': 'mean_reversion', 'sideways_bb_std_mult': 2.5132873601651067, 'sideways_rsi_os': 29, 'sideways_rsi_ob': 76, 'sideways_adx_thresh': 18.852430107632987, 'sideways_atr_min_pct': 0.0009521262503244688, 'sideways_atr_max_pct': 0.0905532893408034, 'sideways_tp_mult': 2.542594404109519, 'sideways_tsl_mult': 0.9628615162241726, 'sideways_time_stop': 223, 'sideways_use_sma': True, 'sideways_use_ema': False, 'sideways_use_atr': False, 'sideways_use_adx': False, 'sideways_use_spike': False, 'sideways_rsi_required': False}.
