[I 2025-09-01 09:24:48,959] Trial 144 finished with values: [-1000000000.0, 1000000000.0] and parameters: {'p_sma': 58, 'p_std': 17, 'p_atr': 28, 'p_adx': 12, 'rsi_period': 46, 'ema1': 18, 'ema2': 29, 'slip_atr_k': 0.1427601833240789, 'slip_spread_k': 0.19364164998658073, 'spread_hl_frac': 0.016464383923084313, 'bb_std_mult': 2.7311259825998966, 'rsi_os': 42, 'rsi_ob': 74, 'vol_spike': 0.13143240159269284, 'adx_thresh': 8.575171470537592, 'atr_min_pct': 0.012179100656702836, 'atr_max_pct': 0.07695256893131631, 'tp_mult': 2.439624025908292, 'tsl_mult': 0.001719856191522151, 'strategy': 'mean_reversion', 'time_stop': 269, 'use_sma': True, 'use_atr': False, 'use_adx': True, 'use_ema': False, 'use_spike': True, 'rsi_required': False, 'edge_k': 0.7339209216982144, 'edge_cap': 0.7656080814645976, 'bull_strategy': 'mean_reversion', 'bull_bb_std_mult': 1.9003308112306316, 'bull_rsi_os': 35, 'bull_rsi_ob': 67, 'bull_adx_thresh': 17.668440448341375, 'bull_atr_min_pct': 0.006443020404359709, 'bull_atr_max_pct': 0.026817109115481977, 'bull_tp_mult': 1.9496993739830506, 'bull_tsl_mult': 0.5381638097339535, 'bull_time_stop': 273, 'bull_use_sma': False, 'bull_use_ema': False, 'bull_use_atr': True, 'bull_use_adx': False, 'bull_use_spike': True, 'bull_rsi_required': True, 'bear_strategy': 'breakout', 'bear_bb_std_mult': 1.633164153271549, 'bear_rsi_os': 27, 'bear_rsi_ob': 49, 'bear_adx_thresh': 27.752296572573254, 'bear_atr_min_pct': 0.007878623070198425, 'bear_atr_max_pct': 0.10631587216075727, 'bear_tp_mult': 1.2492065033724498, 'bear_tsl_mult': 0.8110414956489269, 'bear_time_stop': 233, 'bear_use_sma': False, 'bear_use_ema': False, 'bear_use_atr': False, 'bear_use_adx': True, 'bear_use_spike': False, 'bear_rsi_required': False, 'sideways_strategy': 'mean_reversion', 'sideways_bb_std_mult': 3.43951778102642, 'sideways_rsi_os': 25, 'sideways_rsi_ob': 54, 'sideways_adx_thresh': 11.89811904435523, 'sideways_atr_min_pct': 0.02084334658188669, 'sideways_atr_max_pct': 0.03884820249913589, 'sideways_tp_mult': 1.4254007709155774, 'sideways_tsl_mult': 0.09562301683513597, 'sideways_time_stop': 148, 'sideways_use_sma': True, 'sideways_use_ema': False, 'sideways_use_atr': False, 'sideways_use_adx': False, 'sideways_use_spike': False, 'sideways_rsi_required': False}.
[I 2025-09-01 09:24:49,514] Trial 146 finished with values: [-1000000000.0, 1000000000.0] and parameters: {'p_sma': 58, 'p_std': 39, 'p_atr': 28, 'p_adx': 26, 'rsi_period': 46, 'ema1': 23, 'ema2': 13, 'slip_atr_k': 0.1890887137939674, 'slip_spread_k': 0.9314824997165136, 'spread_hl_frac': 0.016377163351193973, 'bb_std_mult': 2.586637726837451, 'rsi_os': 42, 'rsi_ob': 58, 'vol_spike': 0.13555316154546285, 'adx_thresh': 33.985069687608934, 'atr_min_pct': 0.013762633757523261, 'atr_max_pct': 0.02588358491251235, 'tp_mult': 1.2189522598165334, 'tsl_mult': 0.8720756243513275, 'strategy': 'mean_reversion', 'time_stop': 271, 'use_sma': True, 'use_atr': False, 'use_adx': False, 'use_ema': False, 'use_spike': True, 'rsi_required': False, 'edge_k': 0.6241867779370808, 'edge_cap': 0.33314844097503016, 'bull_strategy': 'mean_reversion', 'bull_bb_std_mult': 1.8616130375283437, 'bull_rsi_os': 32, 'bull_rsi_ob': 67, 'bull_adx_thresh': 27.244927806622208, 'bull_atr_min_pct': 0.008047835527039424, 'bull_atr_max_pct': 0.030760677791566594, 'bull_tp_mult': 2.3430016606524693, 'bull_tsl_mult': 0.5361449655649775, 'bull_time_stop': 59, 'bull_use_sma': False, 'bull_use_ema': False, 'bull_use_atr': True, 'bull_use_adx': False, 'bull_use_spike': True, 'bull_rsi_required': True, 'bear_strategy': 'breakout', 'bear_bb_std_mult': 1.228272158497074, 'bear_rsi_os': 35, 'bear_rsi_ob': 53, 'bear_adx_thresh': 20.54240538807003, 'bear_atr_min_pct': 0.00814971437625802, 'bear_atr_max_pct': 0.10692677788294852, 'bear_tp_mult': 2.9133611191751574, 'bear_tsl_mult': 0.8278137097391982, 'bear_time_stop': 235, 'bear_use_sma': False, 'bear_use_ema': False, 'bear_use_atr': True, 'bear_use_adx': True, 'bear_use_spike': False, 'bear_rsi_required': False, 'sideways_strategy': 'mean_reversion', 'sideways_bb_std_mult': 0.8497362713582866, 'sideways_rsi_os': 20, 'sideways_rsi_ob': 56, 'sideways_adx_thresh': 26.53066943065913, 'sideways_atr_min_pct': 0.0011822329252701284, 'sideways_atr_max_pct': 0.03830993530756521, 'sideways_tp_mult': 1.4304040124635578, 'sideways_tsl_mult': 0.9758269094092679, 'sideways_time_stop': 66, 'sideways_use_sma': True, 'sideways_use_ema': False, 'sideways_use_atr': False, 'sideways_use_adx': False, 'sideways_use_spike': False, 'sideways_rsi_required': False}.
[I 2025-09-01 09:24:49,782] Trial 147 finished with values: [-0.03264755125771224, 0.03317638722502999] and parameters: {'p_sma': 58, 'p_std': 39, 'p_atr': 28, 'p_adx': 17, 'rsi_period': 46, 'ema1': 23, 'ema2': 53, 'slip_atr_k': 0.14223087054670636, 'slip_spread_k': 0.19723788824629945, 'spread_hl_frac': 0.0160840165069932, 'bb_std_mult': 3.0910862681975733, 'rsi_os': 42, 'rsi_ob': 56, 'vol_spike': 0.13701142830298424, 'adx_thresh': 8.778178519637544, 'atr_min_pct': 0.013543165623087943, 'atr_max_pct': 0.07742933138079411, 'tp_mult': 2.6679835780530268, 'tsl_mult': 0.48621539483327836, 'strategy': 'mean_reversion', 'time_stop': 270, 'use_sma': True, 'use_atr': True, 'use_adx': True, 'use_ema': False, 'use_spike': True, 'rsi_required': False, 'edge_k': 1.3865408420120966, 'edge_cap': 0.9765918219538524, 'bull_strategy': 'mean_reversion', 'bull_bb_std_mult': 3.283365458031404, 'bull_rsi_os': 32, 'bull_rsi_ob': 84, 'bull_adx_thresh': 26.83287659621526, 'bull_atr_min_pct': 0.0018725006954110439, 'bull_atr_max_pct': 0.1274396872225706, 'bull_tp_mult': 2.444022462722024, 'bull_tsl_mult': 0.5407151224241238, 'bull_time_stop': 272, 'bull_use_sma': False, 'bull_use_ema': False, 'bull_use_atr': True, 'bull_use_adx': True, 'bull_use_spike': True, 'bull_rsi_required': True, 'bear_strategy': 'breakout', 'bear_bb_std_mult': 2.5765058959414358, 'bear_rsi_os': 26, 'bear_rsi_ob': 52, 'bear_adx_thresh': 28.101228275550444, 'bear_atr_min_pct': 0.002969562430544295, 'bear_atr_max_pct': 0.10941578964615256, 'bear_tp_mult': 1.9694411230969324, 'bear_tsl_mult': 0.8278610664036867, 'bear_time_stop': 230, 'bear_use_sma': False, 'bear_use_ema': False, 'bear_use_atr': True, 'bear_use_adx': True, 'bear_use_spike': False, 'bear_rsi_required': False, 'sideways_strategy': 'mean_reversion', 'sideways_bb_std_mult': 0.849378955359952, 'sideways_rsi_os': 20, 'sideways_rsi_ob': 56, 'sideways_adx_thresh': 26.603145311728895, 'sideways_atr_min_pct': 0.0011507354732340923, 'sideways_atr_max_pct': 0.10115519024260375, 'sideways_tp_mult': 1.2254006449587505, 'sideways_tsl_mult': 0.027663984200646363, 'sideways_time_stop': 106, 'sideways_use_sma': True, 'sideways_use_ema': False, 'sideways_use_atr': False, 'sideways_use_adx': False, 'sideways_use_spike': False, 'sideways_rsi_required': False}.
[I 2025-09-01 09:24:50,031] Trial 145 finished with values: [-0.01990225905160714, 0.020168745694796774] and parameters: {'p_sma': 58, 'p_std': 37, 'p_atr': 28, 'p_adx': 17, 'rsi_period': 46, 'ema1': 23, 'ema2': 13, 'slip_atr_k': 0.1893341152806896, 'slip_spread_k': 0.20136212625752103, 'spread_hl_frac': 0.018328976916144518, 'bb_std_mult': 1.8623120789105414, 'rsi_os': 42, 'rsi_ob': 58, 'vol_spike': 0.25836460978358605, 'adx_thresh': 29.938100140484693, 'atr_min_pct': 0.013809186618762678, 'atr_max_pct': 0.09002058140968279, 'tp_mult': 1.0774791300434365, 'tsl_mult': 0.515273991501993, 'strategy': 'mean_reversion', 'time_stop': 223, 'use_sma': True, 'use_atr': False, 'use_adx': False, 'use_ema': False, 'use_spike': True, 'rsi_required': False, 'edge_k': 0.7137734962916953, 'edge_cap': 0.9919804047936699, 'bull_strategy': 'mean_reversion', 'bull_bb_std_mult': 3.247930337069069, 'bull_rsi_os': 32, 'bull_rsi_ob': 78, 'bull_adx_thresh': 17.521471010314002, 'bull_atr_min_pct': 0.0019751567445869464, 'bull_atr_max_pct': 0.02747729949909901, 'bull_tp_mult': 2.4561249108017043, 'bull_tsl_mult': 0.5378971239941174, 'bull_time_stop': 56, 'bull_use_sma': False, 'bull_use_ema': False, 'bull_use_atr': True, 'bull_use_adx': False, 'bull_use_spike': True, 'bull_rsi_required': True, 'bear_strategy': 'breakout', 'bear_bb_std_mult': 1.5885194562838887, 'bear_rsi_os': 26, 'bear_rsi_ob': 52, 'bear_adx_thresh': 27.44046894021387, 'bear_atr_min_pct': 0.008409674417637934, 'bear_atr_max_pct': 0.10965389050320139, 'bear_tp_mult': 2.291262496781091, 'bear_tsl_mult': 0.7193198424063959, 'bear_time_stop': 83, 'bear_use_sma': False, 'bear_use_ema': False, 'bear_use_atr': True, 'bear_use_adx': True, 'bear_use_spike': False, 'bear_rsi_required': False, 'sideways_strategy': 'mean_reversion', 'sideways_bb_std_mult': 2.024231214557598, 'sideways_rsi_os': 20, 'sideways_rsi_ob': 73, 'sideways_adx_thresh': 15.98608389879143, 'sideways_atr_min_pct': 0.001289841373440099, 'sideways_atr_max_pct': 0.1288899134387877, 'sideways_tp_mult': 1.4241565997710282, 'sideways_tsl_mult': 0.7452881634238104, 'sideways_time_stop': 221, 'sideways_use_sma': True, 'sideways_use_ema': False, 'sideways_use_atr': False, 'sideways_use_adx': False, 'sideways_use_spike': False, 'sideways_rsi_required': False}.
[I 2025-09-01 09:25:30,704] Trial 150 finished with values: [-0.05201748617915403, 0.05197632067023286] and parameters: {'p_sma': 45, 'p_std': 42, 'p_atr': 9, 'p_adx': 20, 'rsi_period': 37, 'ema1': 24, 'ema2': 16, 'slip_atr_k': 0.019467424734551167, 'slip_spread_k': 0.2617343967664675, 'spread_hl_frac': 0.019530394080748918, 'bb_std_mult': 2.668324796377942, 'rsi_os': 26, 'rsi_ob': 59, 'vol_spike': 0.14387266923405534, 'adx_thresh': 30.465002684738963, 'atr_min_pct': 0.008375996153650467, 'atr_max_pct': 0.08116334363790409, 'tp_mult': 1.0587410440761804, 'tsl_mult': 0.07129341541072287, 'strategy': 'mean_reversion', 'time_stop': 161, 'use_sma': True, 'use_atr': True, 'use_adx': False, 'use_ema': False, 'use_spike': True, 'rsi_required': False, 'edge_k': 0.45040163635529284, 'edge_cap': 0.30504192338922465, 'bull_strategy': 'mean_reversion', 'bull_bb_std_mult': 2.2161949014210496, 'bull_rsi_os': 29, 'bull_rsi_ob': 50, 'bull_adx_thresh': 16.33137596588315, 'bull_atr_min_pct': 0.001106988624866833, 'bull_atr_max_pct': 0.08847133821184909, 'bull_tp_mult': 2.297962156843439, 'bull_tsl_mult': 0.002796762147765308, 'bull_time_stop': 83, 'bull_use_sma': False, 'bull_use_ema': False, 'bull_use_atr': True, 'bull_use_adx': False, 'bull_use_spike': True, 'bull_rsi_required': False, 'bear_strategy': 'breakout', 'bear_bb_std_mult': 1.3958785235815647, 'bear_rsi_os': 24, 'bear_rsi_ob': 52, 'bear_adx_thresh': 23.657412851376247, 'bear_atr_min_pct': 0.029020211884907214, 'bear_atr_max_pct': 0.07743171326855, 'bear_tp_mult': 2.877139012358559, 'bear_tsl_mult': 0.06319507940246422, 'bear_time_stop': 243, 'bear_use_sma': False, 'bear_use_ema': False, 'bear_use_atr': True, 'bear_use_adx': True, 'bear_use_spike': False, 'bear_rsi_required': False, 'sideways_strategy': 'mean_reversion', 'sideways_bb_std_mult': 2.0393599626756176, 'sideways_rsi_os': 35, 'sideways_rsi_ob': 62, 'sideways_adx_thresh': 20.218802581929044, 'sideways_atr_min_pct': 0.0013686719126107549, 'sideways_atr_max_pct': 0.0812425069645651, 'sideways_tp_mult': 1.2766137857849797, 'sideways_tsl_mult': 0.5850686897546479, 'sideways_time_stop': 219, 'sideways_use_sma': True, 'sideways_use_ema': False, 'sideways_use_atr': False, 'sideways_use_adx': False, 'sideways_use_spike': False, 'sideways_rsi_required': False}.
[I 2025-09-01 09:25:31,779] Trial 149 finished with values: [-0.1815712758441428, 0.18150290301927788] and parameters: {'p_sma': 54, 'p_std': 41, 'p_atr': 14, 'p_adx': 17, 'rsi_period': 21, 'ema1': 24, 'ema2': 12, 'slip_atr_k': 0.039352766098723735, 'slip_spread_k': 0.2574248107016257, 'spread_hl_frac': 0.01835937386131143, 'bb_std_mult': 3.0881209733771433, 'rsi_os': 32, 'rsi_ob': 56, 'vol_spike': 0.2578062551365786, 'adx_thresh': 29.85201238654054, 'atr_min_pct': 0.012620024762797891, 'atr_max_pct': 0.019520062230165967, 'tp_mult': 2.0448595189093415, 'tsl_mult': 0.5191354620096176, 'strategy': 'mean_reversion', 'time_stop': 156, 'use_sma': True, 'use_atr': True, 'use_adx': False, 'use_ema': False, 'use_spike': True, 'rsi_required': False, 'edge_k': 1.019999508395568, 'edge_cap': 0.9184213273968622, 'bull_strategy': 'mean_reversion', 'bull_bb_std_mult': 2.2214729628807532, 'bull_rsi_os': 29, 'bull_rsi_ob': 55, 'bull_adx_thresh': 15.200473935340291, 'bull_atr_min_pct': 0.00540072681673818, 'bull_atr_max_pct': 0.11664349265824504, 'bull_tp_mult': 2.460469136620202, 'bull_tsl_mult': 0.7946583823392088, 'bull_time_stop': 83, 'bull_use_sma': False, 'bull_use_ema': False, 'bull_use_atr': True, 'bull_use_adx': True, 'bull_use_spike': True, 'bull_rsi_required': False, 'bear_strategy': 'breakout', 'bear_bb_std_mult': 1.3817761727525297, 'bear_rsi_os': 24, 'bear_rsi_ob': 52, 'bear_adx_thresh': 23.55014289224784, 'bear_atr_min_pct': 0.0035473302075328932, 'bear_atr_max_pct': 0.11201883873153867, 'bear_tp_mult': 2.8748458988548755, 'bear_tsl_mult': 0.8448801250480855, 'bear_time_stop': 84, 'bear_use_sma': False, 'bear_use_ema': False, 'bear_use_atr': True, 'bear_use_adx': True, 'bear_use_spike': False, 'bear_rsi_required': False, 'sideways_strategy': 'mean_reversion', 'sideways_bb_std_mult': 1.2635331055726993, 'sideways_rsi_os': 36, 'sideways_rsi_ob': 45, 'sideways_adx_thresh': 15.720379291265536, 'sideways_atr_min_pct': 0.00043232518800245486, 'sideways_atr_max_pct': 0.08030575196917329, 'sideways_tp_mult': 1.2577467173515282, 'sideways_tsl_mult': 0.3388399955260152, 'sideways_time_stop': 212, 'sideways_use_sma': True, 'sideways_use_ema': False, 'sideways_use_atr': False, 'sideways_use_adx': False, 'sideways_use_spike': False, 'sideways_rsi_required': False}.
[I 2025-09-01 09:25:31,779] Trial 151 finished with values: [-0.13426772741872106, 0.13421056951162713] and parameters: {'p_sma': 54, 'p_std': 42, 'p_atr': 9, 'p_adx': 9, 'rsi_period': 37, 'ema1': 24, 'ema2': 16, 'slip_atr_k': 0.03174053808150555, 'slip_spread_k': 0.2538616860432184, 'spread_hl_frac': 0.037178629920510714, 'bb_std_mult': 2.651199151499095, 'rsi_os': 26, 'rsi_ob': 66, 'vol_spike': 0.14245984805210593, 'adx_thresh': 23.188813984764618, 'atr_min_pct': 0.01055109451665192, 'atr_max_pct': 0.01843433906110813, 'tp_mult': 1.6689999512489724, 'tsl_mult': 0.14957879367813132, 'strategy': 'mean_reversion', 'time_stop': 161, 'use_sma': True, 'use_atr': True, 'use_adx': False, 'use_ema': False, 'use_spike': True, 'rsi_required': False, 'edge_k': 1.0411732843640504, 'edge_cap': 0.9263370291007625, 'bull_strategy': 'mean_reversion', 'bull_bb_std_mult': 2.016856500064429, 'bull_rsi_os': 29, 'bull_rsi_ob': 48, 'bull_adx_thresh': 15.440943215148724, 'bull_atr_min_pct': 0.0008669906815646318, 'bull_atr_max_pct': 0.07344526961448701, 'bull_tp_mult': 2.2956682825474357, 'bull_tsl_mult': 0.34067967920636977, 'bull_time_stop': 256, 'bull_use_sma': False, 'bull_use_ema': False, 'bull_use_atr': True, 'bull_use_adx': True, 'bull_use_spike': True, 'bull_rsi_required': False, 'bear_strategy': 'mean_reversion', 'bear_bb_std_mult': 1.4040304559322192, 'bear_rsi_os': 22, 'bear_rsi_ob': 51, 'bear_adx_thresh': 16.577362022221635, 'bear_atr_min_pct': 0.028270081694347072, 'bear_atr_max_pct': 0.07719405114411176, 'bear_tp_mult': 2.0887577149543954, 'bear_tsl_mult': 0.7914915410133136, 'bear_time_stop': 153, 'bear_use_sma': True, 'bear_use_ema': False, 'bear_use_atr': False, 'bear_use_adx': True, 'bear_use_spike': False, 'bear_rsi_required': False, 'sideways_strategy': 'breakout', 'sideways_bb_std_mult': 2.062687508492056, 'sideways_rsi_os': 28, 'sideways_rsi_ob': 62, 'sideways_adx_thresh': 24.596761331578403, 'sideways_atr_min_pct': 0.00029193580485981, 'sideways_atr_max_pct': 0.07943584966266819, 'sideways_tp_mult': 1.2659229264390621, 'sideways_tsl_mult': 0.586088181154639, 'sideways_time_stop': 198, 'sideways_use_sma': False, 'sideways_use_ema': False, 'sideways_use_atr': False, 'sideways_use_adx': True, 'sideways_use_spike': False, 'sideways_rsi_required': False}.
[I 2025-09-01 09:25:31,789] Trial 148 finished with values: [-0.1879355205699862, 0.18790442564169985] and parameters: {'p_sma': 54, 'p_std': 41, 'p_atr': 9, 'p_adx': 10, 'rsi_period': 21, 'ema1': 23, 'ema2': 13, 'slip_atr_k': 0.030154920260272083, 'slip_spread_k': 0.7721014059282154, 'spread_hl_frac': 0.01833487649410682, 'bb_std_mult': 1.8627623830959004, 'rsi_os': 42, 'rsi_ob': 56, 'vol_spike': 0.1364297301187299, 'adx_thresh': 22.771950927876574, 'atr_min_pct': 0.013710750180445213, 'atr_max_pct': 0.017990706065653454, 'tp_mult': 1.3577598999739786, 'tsl_mult': 0.833821064686397, 'strategy': 'mean_reversion', 'time_stop': 155, 'use_sma': True, 'use_atr': True, 'use_adx': False, 'use_ema': False, 'use_spike': True, 'rsi_required': False, 'edge_k': 0.6387110081296054, 'edge_cap': 0.3348064962623801, 'bull_strategy': 'mean_reversion', 'bull_bb_std_mult': 2.0300354005458416, 'bull_rsi_os': 32, 'bull_rsi_ob': 82, 'bull_adx_thresh': 27.144040926496828, 'bull_atr_min_pct': 0.0009988752689818682, 'bull_atr_max_pct': 0.12777604228696354, 'bull_tp_mult': 2.4517120420940524, 'bull_tsl_mult': 0.806001546113743, 'bull_time_stop': 137, 'bull_use_sma': False, 'bull_use_ema': False, 'bull_use_atr': True, 'bull_use_adx': True, 'bull_use_spike': True, 'bull_rsi_required': False, 'bear_strategy': 'breakout', 'bear_bb_std_mult': 1.243986696849052, 'bear_rsi_os': 24, 'bear_rsi_ob': 52, 'bear_adx_thresh': 5.091049896792258, 'bear_atr_min_pct': 0.028999556983799947, 'bear_atr_max_pct': 0.10995325841831478, 'bear_tp_mult': 1.7625382284784015, 'bear_tsl_mult': 0.06598710209811914, 'bear_time_stop': 151, 'bear_use_sma': False, 'bear_use_ema': False, 'bear_use_atr': True, 'bear_use_adx': True, 'bear_use_spike': False, 'bear_rsi_required': False, 'sideways_strategy': 'mean_reversion', 'sideways_bb_std_mult': 1.5321857223117186, 'sideways_rsi_os': 51, 'sideways_rsi_ob': 57, 'sideways_adx_thresh': 26.938867351436468, 'sideways_atr_min_pct': 0.0011827074601198394, 'sideways_atr_max_pct': 0.12860647911070355, 'sideways_tp_mult': 1.487802240029551, 'sideways_tsl_mult': 0.34021304048775947, 'sideways_time_stop': 221, 'sideways_use_sma': True, 'sideways_use_ema': False, 'sideways_use_atr': False, 'sideways_use_adx': False, 'sideways_use_spike': False, 'sideways_rsi_required': False}.
[I 2025-09-01 09:25:32,365] Trial 152 finished with values: [-1000000000.0, 1000000000.0] and parameters: {'p_sma': 60, 'p_std': 48, 'p_atr': 27, 'p_adx': 9, 'rsi_period': 21, 'ema1': 14, 'ema2': 15, 'slip_atr_k': 0.03860612036036419, 'slip_spread_k': 0.7652822080772943, 'spread_hl_frac': 0.017935626890328106, 'bb_std_mult': 2.557669426147066, 'rsi_os': 38, 'rsi_ob': 45, 'vol_spike': 0.2801094312073503, 'adx_thresh': 23.436860617039, 'atr_min_pct': 0.007148312017667354, 'atr_max_pct': 0.01788679997480186, 'tp_mult': 2.638892237971061, 'tsl_mult': 0.6187776122545268, 'strategy': 'mean_reversion', 'time_stop': 44, 'use_sma': True, 'use_atr': True, 'use_adx': False, 'use_ema': False, 'use_spike': True, 'rsi_required': False, 'edge_k': 0.513084692862871, 'edge_cap': 0.8140321331240098, 'bull_strategy': 'mean_reversion', 'bull_bb_std_mult': 1.9751108759219893, 'bull_rsi_os': 30, 'bull_rsi_ob': 81, 'bull_adx_thresh': 15.100073714263607, 'bull_atr_min_pct': 0.0054812992377422836, 'bull_atr_max_pct': 0.0353610253770199, 'bull_tp_mult': 2.9963226675123686, 'bull_tsl_mult': 0.3306145205540063, 'bull_time_stop': 192, 'bull_use_sma': False, 'bull_use_ema': False, 'bull_use_atr': False, 'bull_use_adx': True, 'bull_use_spike': False, 'bull_rsi_required': False, 'bear_strategy': 'mean_reversion', 'bear_bb_std_mult': 1.2115519811866107, 'bear_rsi_os': 24, 'bear_rsi_ob': 51, 'bear_adx_thresh': 5.024066079000599, 'bear_atr_min_pct': 0.014341803103792964, 'bear_atr_max_pct': 0.1499967527582369, 'bear_tp_mult': 1.7809635312358598, 'bear_tsl_mult': 0.20715875818772278, 'bear_time_stop': 252, 'bear_use_sma': True, 'bear_use_ema': False, 'bear_use_atr': False, 'bear_use_adx': False, 'bear_use_spike': False, 'bear_rsi_required': True, 'sideways_strategy': 'breakout', 'sideways_bb_std_mult': 1.2438356382603821, 'sideways_rsi_os': 11, 'sideways_rsi_ob': 52, 'sideways_adx_thresh': 24.4704491004525, 'sideways_atr_min_pct': 0.00037132192352289073, 'sideways_atr_max_pct': 0.07559977821355872, 'sideways_tp_mult': 1.4905378607380448, 'sideways_tsl_mult': 0.8248028918743826, 'sideways_time_stop': 212, 'sideways_use_sma': False, 'sideways_use_ema': True, 'sideways_use_atr': True, 'sideways_use_adx': True, 'sideways_use_spike': False, 'sideways_rsi_required': True}.
