[I 2025-09-01 09:35:23,181] Trial 207 finished with values: [-1000000000.0, 1000000000.0] and parameters: {'p_sma': 46, 'p_std': 46, 'p_atr': 19, 'p_adx': 11, 'rsi_period': 63, 'ema1': 8, 'ema2': 20, 'slip_atr_k': 0.23130269913047227, 'slip_spread_k': 0.5489565197701919, 'spread_hl_frac': 0.008304834727415413, 'bb_std_mult': 2.11830241756068, 'rsi_os': 6, 'rsi_ob': 69, 'vol_spike': 0.18895391065541195, 'adx_thresh': 10.685384383761907, 'atr_min_pct': 0.019331788951667955, 'atr_max_pct': 0.0669925418878914, 'tp_mult': 1.8648134701611003, 'tsl_mult': 0.8366959229785963, 'strategy': 'breakout', 'time_stop': 165, 'use_sma': False, 'use_atr': True, 'use_adx': True, 'use_ema': True, 'use_spike': True, 'rsi_required': False, 'edge_k': 1.911864876082993, 'edge_cap': 0.7897010953841228, 'bull_strategy': 'mean_reversion', 'bull_bb_std_mult': 3.4439940039430423, 'bull_rsi_os': 39, 'bull_rsi_ob': 79, 'bull_adx_thresh': 27.715923459360667, 'bull_atr_min_pct': 0.029491976385206415, 'bull_atr_max_pct': 0.07991833595368215, 'bull_tp_mult': 1.5621287334269978, 'bull_tsl_mult': 0.9520918443409951, 'bull_time_stop': 145, 'bull_use_sma': True, 'bull_use_ema': False, 'bull_use_atr': True, 'bull_use_adx': False, 'bull_use_spike': True, 'bull_rsi_required': False, 'bear_strategy': 'breakout', 'bear_bb_std_mult': 1.6869048973291774, 'bear_rsi_os': 44, 'bear_rsi_ob': 74, 'bear_adx_thresh': 31.50514678630542, 'bear_atr_min_pct': 0.002461748370090623, 'bear_atr_max_pct': 0.12790109937163863, 'bear_tp_mult': 2.804420831967281, 'bear_tsl_mult': 0.5505677449666149, 'bear_time_stop': 18, 'bear_use_sma': False, 'bear_use_ema': True, 'bear_use_atr': True, 'bear_use_adx': True, 'bear_use_spike': True, 'bear_rsi_required': False, 'sideways_strategy': 'breakout', 'sideways_bb_std_mult': 2.414233242489643, 'sideways_rsi_os': 30, 'sideways_rsi_ob': 59, 'sideways_adx_thresh': 34.08172299727064, 'sideways_atr_min_pct': 0.022263676855595868, 'sideways_atr_max_pct': 0.08404498083608368, 'sideways_tp_mult': 2.9685430486836824, 'sideways_tsl_mult': 0.9603899946358075, 'sideways_time_stop': 221, 'sideways_use_sma': False, 'sideways_use_ema': False, 'sideways_use_atr': False, 'sideways_use_adx': True, 'sideways_use_spike': True, 'sideways_rsi_required': False}.
[I 2025-09-01 09:35:23,186] Trial 206 finished with values: [-1000000000.0, 1000000000.0] and parameters: {'p_sma': 60, 'p_std': 46, 'p_atr': 19, 'p_adx': 11, 'rsi_period': 43, 'ema1': 8, 'ema2': 41, 'slip_atr_k': 0.16221505315456952, 'slip_spread_k': 0.6039636226368936, 'spread_hl_frac': 0.008607808945987172, 'bb_std_mult': 0.8384957694997481, 'rsi_os': 6, 'rsi_ob': 56, 'vol_spike': 0.190047241288425, 'adx_thresh': 12.263339367918869, 'atr_min_pct': 0.020530409358944127, 'atr_max_pct': 0.06998884613361624, 'tp_mult': 1.7871966240865707, 'tsl_mult': 0.8681963074047486, 'strategy': 'breakout', 'time_stop': 136, 'use_sma': False, 'use_atr': True, 'use_adx': False, 'use_ema': False, 'use_spike': True, 'rsi_required': False, 'edge_k': 1.3501976627323482, 'edge_cap': 0.8951261906720352, 'bull_strategy': 'mean_reversion', 'bull_bb_std_mult': 3.4367835808552245, 'bull_rsi_os': 38, 'bull_rsi_ob': 79, 'bull_adx_thresh': 29.293636725685865, 'bull_atr_min_pct': 0.005829855926911658, 'bull_atr_max_pct': 0.0798014823819185, 'bull_tp_mult': 1.563946506354501, 'bull_tsl_mult': 0.9518977184348132, 'bull_time_stop': 146, 'bull_use_sma': True, 'bull_use_ema': False, 'bull_use_atr': True, 'bull_use_adx': False, 'bull_use_spike': True, 'bull_rsi_required': False, 'bear_strategy': 'breakout', 'bear_bb_std_mult': 1.5939269077539284, 'bear_rsi_os': 44, 'bear_rsi_ob': 69, 'bear_adx_thresh': 33.7790669505372, 'bear_atr_min_pct': 0.0021569139733840868, 'bear_atr_max_pct': 0.140780333060736, 'bear_tp_mult': 1.5301036930985321, 'bear_tsl_mult': 0.7582289930954063, 'bear_time_stop': 29, 'bear_use_sma': False, 'bear_use_ema': True, 'bear_use_atr': True, 'bear_use_adx': True, 'bear_use_spike': True, 'bear_rsi_required': False, 'sideways_strategy': 'breakout', 'sideways_bb_std_mult': 2.412869077403822, 'sideways_rsi_os': 30, 'sideways_rsi_ob': 59, 'sideways_adx_thresh': 32.300143329637685, 'sideways_atr_min_pct': 0.011989359430034919, 'sideways_atr_max_pct': 0.08519971420994857, 'sideways_tp_mult': 2.981642285300031, 'sideways_tsl_mult': 0.9592244391472615, 'sideways_time_stop': 167, 'sideways_use_sma': True, 'sideways_use_ema': False, 'sideways_use_atr': False, 'sideways_use_adx': False, 'sideways_use_spike': True, 'sideways_rsi_required': False}.
[I 2025-09-01 09:35:23,621] Trial 208 finished with values: [-1000000000.0, 1000000000.0] and parameters: {'p_sma': 13, 'p_std': 44, 'p_atr': 29, 'p_adx': 21, 'rsi_period': 64, 'ema1': 8, 'ema2': 29, 'slip_atr_k': 0.23131708514259647, 'slip_spread_k': 0.5455278113422877, 'spread_hl_frac': 0.008604155208334935, 'bb_std_mult': 3.376337627928242, 'rsi_os': 11, 'rsi_ob': 73, 'vol_spike': 0.18694306054082555, 'adx_thresh': 12.268044202491252, 'atr_min_pct': 0.020113086476165234, 'atr_max_pct': 0.06632027616067696, 'tp_mult': 2.4586942813659225, 'tsl_mult': 0.8324192821105755, 'strategy': 'breakout', 'time_stop': 218, 'use_sma': False, 'use_atr': True, 'use_adx': True, 'use_ema': True, 'use_spike': True, 'rsi_required': False, 'edge_k': 1.4542175367486343, 'edge_cap': 0.7773744647457425, 'bull_strategy': 'mean_reversion', 'bull_bb_std_mult': 3.434993191064828, 'bull_rsi_os': 37, 'bull_rsi_ob': 79, 'bull_adx_thresh': 27.642691999174687, 'bull_atr_min_pct': 0.021401623108287634, 'bull_atr_max_pct': 0.07564660520313296, 'bull_tp_mult': 1.5600486152478497, 'bull_tsl_mult': 0.9193471788000774, 'bull_time_stop': 134, 'bull_use_sma': True, 'bull_use_ema': False, 'bull_use_atr': True, 'bull_use_adx': False, 'bull_use_spike': True, 'bull_rsi_required': False, 'bear_strategy': 'mean_reversion', 'bear_bb_std_mult': 1.6894523995144477, 'bear_rsi_os': 44, 'bear_rsi_ob': 70, 'bear_adx_thresh': 34.196761461114164, 'bear_atr_min_pct': 0.002572760174739463, 'bear_atr_max_pct': 0.13451263284554116, 'bear_tp_mult': 2.800300799703212, 'bear_tsl_mult': 0.28126222912414656, 'bear_time_stop': 29, 'bear_use_sma': False, 'bear_use_ema': True, 'bear_use_atr': True, 'bear_use_adx': True, 'bear_use_spike': True, 'bear_rsi_required': False, 'sideways_strategy': 'breakout', 'sideways_bb_std_mult': 2.70110202964926, 'sideways_rsi_os': 54, 'sideways_rsi_ob': 59, 'sideways_adx_thresh': 31.712714613927528, 'sideways_atr_min_pct': 0.02073103791556461, 'sideways_atr_max_pct': 0.08327443297110572, 'sideways_tp_mult': 2.9455659564740406, 'sideways_tsl_mult': 0.9777891132792228, 'sideways_time_stop': 220, 'sideways_use_sma': False, 'sideways_use_ema': False, 'sideways_use_atr': False, 'sideways_use_adx': True, 'sideways_use_spike': True, 'sideways_rsi_required': False}.
[I 2025-09-01 09:36:16,375] Trial 211 finished with values: [-1000000000.0, 1000000000.0] and parameters: {'p_sma': 13, 'p_std': 44, 'p_atr': 29, 'p_adx': 26, 'rsi_period': 9, 'ema1': 9, 'ema2': 58, 'slip_atr_k': 0.007444743065177534, 'slip_spread_k': 0.5298105718258737, 'spread_hl_frac': 0.007104477465880234, 'bb_std_mult': 2.57484308751387, 'rsi_os': 10, 'rsi_ob': 77, 'vol_spike': 0.2225240623118768, 'adx_thresh': 21.963094136087197, 'atr_min_pct': 0.01737755229698849, 'atr_max_pct': 0.055620726684033645, 'tp_mult': 2.460449638127882, 'tsl_mult': 0.8452395160633884, 'strategy': 'breakout', 'time_stop': 149, 'use_sma': True, 'use_atr': False, 'use_adx': False, 'use_ema': False, 'use_spike': False, 'rsi_required': False, 'edge_k': 0.620419499776615, 'edge_cap': 0.8703004618749269, 'bull_strategy': 'breakout', 'bull_bb_std_mult': 3.33310598731195, 'bull_rsi_os': 11, 'bull_rsi_ob': 76, 'bull_adx_thresh': 28.449245903054805, 'bull_atr_min_pct': 0.02115094743542229, 'bull_atr_max_pct': 0.07085391523872478, 'bull_tp_mult': 1.4860100730042314, 'bull_tsl_mult': 0.9226641820504173, 'bull_time_stop': 127, 'bull_use_sma': True, 'bull_use_ema': True, 'bull_use_atr': False, 'bull_use_adx': True, 'bull_use_spike': False, 'bull_rsi_required': False, 'bear_strategy': 'mean_reversion', 'bear_bb_std_mult': 2.232118028956433, 'bear_rsi_os': 41, 'bear_rsi_ob': 76, 'bear_adx_thresh': 32.02175517164616, 'bear_atr_min_pct': 0.027997007233533832, 'bear_atr_max_pct': 0.11957926226716073, 'bear_tp_mult': 2.5335387879625335, 'bear_tsl_mult': 0.3532867494400611, 'bear_time_stop': 5, 'bear_use_sma': True, 'bear_use_ema': True, 'bear_use_atr': False, 'bear_use_adx': True, 'bear_use_spike': True, 'bear_rsi_required': True, 'sideways_strategy': 'mean_reversion', 'sideways_bb_std_mult': 2.703462054024758, 'sideways_rsi_os': 33, 'sideways_rsi_ob': 59, 'sideways_adx_thresh': 31.832649174377696, 'sideways_atr_min_pct': 0.01910105354654843, 'sideways_atr_max_pct': 0.05122909233679462, 'sideways_tp_mult': 2.1976627897892858, 'sideways_tsl_mult': 0.9870034339191659, 'sideways_time_stop': 68, 'sideways_use_sma': True, 'sideways_use_ema': False, 'sideways_use_atr': True, 'sideways_use_adx': False, 'sideways_use_spike': True, 'sideways_rsi_required': True}.
[I 2025-09-01 09:36:16,818] Trial 210 finished with values: [-1000000000.0, 1000000000.0] and parameters: {'p_sma': 58, 'p_std': 44, 'p_atr': 29, 'p_adx': 12, 'rsi_period': 33, 'ema1': 9, 'ema2': 59, 'slip_atr_k': 0.009797908375811544, 'slip_spread_k': 0.5303806901410971, 'spread_hl_frac': 0.006649396053146945, 'bb_std_mult': 2.5685020135815915, 'rsi_os': 10, 'rsi_ob': 78, 'vol_spike': 0.2204193078471515, 'adx_thresh': 16.756395976896368, 'atr_min_pct': 0.017366833913997154, 'atr_max_pct': 0.05965653869489024, 'tp_mult': 2.4516352925811855, 'tsl_mult': 0.8528311452220535, 'strategy': 'breakout', 'time_stop': 152, 'use_sma': True, 'use_atr': False, 'use_adx': False, 'use_ema': False, 'use_spike': False, 'rsi_required': False, 'edge_k': 0.6690353572629277, 'edge_cap': 0.8585069716370549, 'bull_strategy': 'breakout', 'bull_bb_std_mult': 3.327065143091795, 'bull_rsi_os': 7, 'bull_rsi_ob': 76, 'bull_adx_thresh': 28.532773725126983, 'bull_atr_min_pct': 0.020699499415599756, 'bull_atr_max_pct': 0.07084577863749918, 'bull_tp_mult': 1.4798416104645826, 'bull_tsl_mult': 0.9244847503883854, 'bull_time_stop': 132, 'bull_use_sma': True, 'bull_use_ema': True, 'bull_use_atr': False, 'bull_use_adx': True, 'bull_use_spike': False, 'bull_rsi_required': False, 'bear_strategy': 'mean_reversion', 'bear_bb_std_mult': 1.4883393059187466, 'bear_rsi_os': 46, 'bear_rsi_ob': 75, 'bear_adx_thresh': 34.97559619056963, 'bear_atr_min_pct': 0.02788918556225992, 'bear_atr_max_pct': 0.12324575715716973, 'bear_tp_mult': 1.1402867995495196, 'bear_tsl_mult': 0.8483453080531878, 'bear_time_stop': 5, 'bear_use_sma': True, 'bear_use_ema': True, 'bear_use_atr': False, 'bear_use_adx': True, 'bear_use_spike': True, 'bear_rsi_required': True, 'sideways_strategy': 'mean_reversion', 'sideways_bb_std_mult': 2.6921124703594064, 'sideways_rsi_os': 33, 'sideways_rsi_ob': 83, 'sideways_adx_thresh': 31.63061567053153, 'sideways_atr_min_pct': 0.004128720343582131, 'sideways_atr_max_pct': 0.08930648693695599, 'sideways_tp_mult': 1.402455828738513, 'sideways_tsl_mult': 0.9888183556911313, 'sideways_time_stop': 219, 'sideways_use_sma': True, 'sideways_use_ema': False, 'sideways_use_atr': True, 'sideways_use_adx': False, 'sideways_use_spike': True, 'sideways_rsi_required': True}.
[I 2025-09-01 09:36:17,399] Trial 212 finished with values: [-1000000000.0, 1000000000.0] and parameters: {'p_sma': 58, 'p_std': 44, 'p_atr': 28, 'p_adx': 12, 'rsi_period': 58, 'ema1': 9, 'ema2': 60, 'slip_atr_k': 0.007849556751368284, 'slip_spread_k': 0.663354443396849, 'spread_hl_frac': 0.005827852229000994, 'bb_std_mult': 2.5708935109727027, 'rsi_os': 8, 'rsi_ob': 54, 'vol_spike': 0.2180925201171192, 'adx_thresh': 33.72888081137981, 'atr_min_pct': 0.018653536261679694, 'atr_max_pct': 0.055743682144432996, 'tp_mult': 1.6535233266971492, 'tsl_mult': 0.7969928849081521, 'strategy': 'breakout', 'time_stop': 149, 'use_sma': True, 'use_atr': False, 'use_adx': False, 'use_ema': False, 'use_spike': False, 'rsi_required': False, 'edge_k': 0.6663787744257108, 'edge_cap': 0.8636761033508631, 'bull_strategy': 'breakout', 'bull_bb_std_mult': 3.3345912997914824, 'bull_rsi_os': 11, 'bull_rsi_ob': 76, 'bull_adx_thresh': 28.527023831351194, 'bull_atr_min_pct': 0.004662770669842089, 'bull_atr_max_pct': 0.07099276461162017, 'bull_tp_mult': 1.4736519945314923, 'bull_tsl_mult': 0.9270696700952616, 'bull_time_stop': 127, 'bull_use_sma': True, 'bull_use_ema': True, 'bull_use_atr': False, 'bull_use_adx': True, 'bull_use_spike': False, 'bull_rsi_required': False, 'bear_strategy': 'breakout', 'bear_bb_std_mult': 1.7950475871725462, 'bear_rsi_os': 43, 'bear_rsi_ob': 72, 'bear_adx_thresh': 34.88014137292377, 'bear_atr_min_pct': 0.02796640683009688, 'bear_atr_max_pct': 0.1232284883362538, 'bear_tp_mult': 2.693665437100167, 'bear_tsl_mult': 0.8410864677634108, 'bear_time_stop': 5, 'bear_use_sma': True, 'bear_use_ema': True, 'bear_use_atr': False, 'bear_use_adx': False, 'bear_use_spike': True, 'bear_rsi_required': True, 'sideways_strategy': 'mean_reversion', 'sideways_bb_std_mult': 2.5702155950734924, 'sideways_rsi_os': 33, 'sideways_rsi_ob': 81, 'sideways_adx_thresh': 31.183718228173152, 'sideways_atr_min_pct': 0.004195564018589127, 'sideways_atr_max_pct': 0.10389405262635974, 'sideways_tp_mult': 1.2455680984411637, 'sideways_tsl_mult': 0.12950279771390466, 'sideways_time_stop': 121, 'sideways_use_sma': True, 'sideways_use_ema': True, 'sideways_use_atr': True, 'sideways_use_adx': False, 'sideways_use_spike': True, 'sideways_rsi_required': True}.
[I 2025-09-01 09:36:17,719] Trial 213 finished with values: [-1000000000.0, 1000000000.0] and parameters: {'p_sma': 58, 'p_std': 44, 'p_atr': 28, 'p_adx': 12, 'rsi_period': 43, 'ema1': 9, 'ema2': 45, 'slip_atr_k': 0.00867259490159907, 'slip_spread_k': 0.5780202614110025, 'spread_hl_frac': 0.006707715237995704, 'bb_std_mult': 2.5714246555767297, 'rsi_os': 9, 'rsi_ob': 78, 'vol_spike': 0.20941470651796262, 'adx_thresh': 19.774024987003173, 'atr_min_pct': 0.01744591934007032, 'atr_max_pct': 0.05395895842908592, 'tp_mult': 2.694131615248622, 'tsl_mult': 0.8488878603363109, 'strategy': 'breakout', 'time_stop': 149, 'use_sma': True, 'use_atr': False, 'use_adx': False, 'use_ema': False, 'use_spike': False, 'rsi_required': False, 'edge_k': 0.6633080340527983, 'edge_cap': 0.8666070998457115, 'bull_strategy': 'breakout', 'bull_bb_std_mult': 3.2955510214021273, 'bull_rsi_os': 7, 'bull_rsi_ob': 77, 'bull_adx_thresh': 28.45763566512832, 'bull_atr_min_pct': 0.023195058048241124, 'bull_atr_max_pct': 0.07077073592180971, 'bull_tp_mult': 1.4733279498518799, 'bull_tsl_mult': 0.7518027041102517, 'bull_time_stop': 115, 'bull_use_sma': True, 'bull_use_ema': True, 'bull_use_atr': False, 'bull_use_adx': True, 'bull_use_spike': False, 'bull_rsi_required': False, 'bear_strategy': 'breakout', 'bear_bb_std_mult': 1.5054698466917886, 'bear_rsi_os': 41, 'bear_rsi_ob': 72, 'bear_adx_thresh': 33.28040653039037, 'bear_atr_min_pct': 0.028133143829545494, 'bear_atr_max_pct': 0.0266688720935815, 'bear_tp_mult': 1.8552096444339057, 'bear_tsl_mult': 0.8425979151108546, 'bear_time_stop': 5, 'bear_use_sma': True, 'bear_use_ema': True, 'bear_use_atr': False, 'bear_use_adx': False, 'bear_use_spike': True, 'bear_rsi_required': True, 'sideways_strategy': 'mean_reversion', 'sideways_bb_std_mult': 2.568816530446448, 'sideways_rsi_os': 33, 'sideways_rsi_ob': 84, 'sideways_adx_thresh': 31.120655904529492, 'sideways_atr_min_pct': 0.004105917597712687, 'sideways_atr_max_pct': 0.0510786037606525, 'sideways_tp_mult': 1.398352112950362, 'sideways_tsl_mult': 0.1323846037904406, 'sideways_time_stop': 109, 'sideways_use_sma': True, 'sideways_use_ema': True, 'sideways_use_atr': True, 'sideways_use_adx': False, 'sideways_use_spike': True, 'sideways_rsi_required': True}.
[I 2025-09-01 09:36:58,735] Trial 216 finished with values: [-1000000000.0, 1000000000.0] and parameters: {'p_sma': 6, 'p_std': 49, 'p_atr': 28, 'p_adx': 11, 'rsi_period': 42, 'ema1': 15, 'ema2': 10, 'slip_atr_k': 0.11106434048178081, 'slip_spread_k': 0.5763914593419865, 'spread_hl_frac': 0.005770976419804591, 'bb_std_mult': 3.5123085091126542, 'rsi_os': 9, 'rsi_ob': 62, 'vol_spike': 0.2063650275214667, 'adx_thresh': 17.694362519999544, 'atr_min_pct': 0.02837071330654825, 'atr_max_pct': 0.07520652914260614, 'tp_mult': 2.847178420364725, 'tsl_mult': 0.7629070302803346, 'strategy': 'breakout', 'time_stop': 71, 'use_sma': True, 'use_atr': True, 'use_adx': False, 'use_ema': False, 'use_spike': True, 'rsi_required': True, 'edge_k': 0.5908206583891147, 'edge_cap': 0.8268500767115928, 'bull_strategy': 'mean_reversion', 'bull_bb_std_mult': 3.513738322994239, 'bull_rsi_os': 36, 'bull_rsi_ob': 81, 'bull_adx_thresh': 26.61569241267923, 'bull_atr_min_pct': 0.02349494792462799, 'bull_atr_max_pct': 0.08354171366295465, 'bull_tp_mult': 1.5196832932902116, 'bull_tsl_mult': 0.9957205707092689, 'bull_time_stop': 140, 'bull_use_sma': True, 'bull_use_ema': False, 'bull_use_atr': True, 'bull_use_adx': False, 'bull_use_spike': True, 'bull_rsi_required': True, 'bear_strategy': 'breakout', 'bear_bb_std_mult': 1.419665324163845, 'bear_rsi_os': 45, 'bear_rsi_ob': 72, 'bear_adx_thresh': 33.37989302610196, 'bear_atr_min_pct': 0.013621577212953316, 'bear_atr_max_pct': 0.03140661217489547, 'bear_tp_mult': 2.274908549639769, 'bear_tsl_mult': 0.43580400801264085, 'bear_time_stop': 21, 'bear_use_sma': False, 'bear_use_ema': True, 'bear_use_atr': True, 'bear_use_adx': True, 'bear_use_spike': True, 'bear_rsi_required': False, 'sideways_strategy': 'mean_reversion', 'sideways_bb_std_mult': 1.6195374715473567, 'sideways_rsi_os': 13, 'sideways_rsi_ob': 76, 'sideways_adx_thresh': 30.33543779901535, 'sideways_atr_min_pct': 0.023971238381985574, 'sideways_atr_max_pct': 0.07302841198749013, 'sideways_tp_mult': 1.3234229993428557, 'sideways_tsl_mult': 0.5225832919160769, 'sideways_time_stop': 60, 'sideways_use_sma': True, 'sideways_use_ema': False, 'sideways_use_atr': False, 'sideways_use_adx': False, 'sideways_use_spike': True, 'sideways_rsi_required': False}.
[I 2025-09-01 09:36:59,781] Trial 214 finished with values: [-1000000000.0, 1000000000.0] and parameters: {'p_sma': 5, 'p_std': 46, 'p_atr': 28, 'p_adx': 12, 'rsi_period': 44, 'ema1': 9, 'ema2': 10, 'slip_atr_k': 0.010394739353787201, 'slip_spread_k': 0.578901116350485, 'spread_hl_frac': 0.0060183708582597015, 'bb_std_mult': 3.526465466442311, 'rsi_os': 9, 'rsi_ob': 55, 'vol_spike': 0.20860859461509187, 'adx_thresh': 5.693383393855131, 'atr_min_pct': 0.018862762798601607, 'atr_max_pct': 0.09787848232949851, 'tp_mult': 2.5545004295843365, 'tsl_mult': 0.8549488376419452, 'strategy': 'breakout', 'time_stop': 188, 'use_sma': True, 'use_atr': False, 'use_adx': False, 'use_ema': False, 'use_spike': False, 'rsi_required': False, 'edge_k': 0.6006572088788119, 'edge_cap': 0.8581451869701902, 'bull_strategy': 'breakout', 'bull_bb_std_mult': 3.2851709556590247, 'bull_rsi_os': 36, 'bull_rsi_ob': 77, 'bull_adx_thresh': 28.326047082182086, 'bull_atr_min_pct': 0.02361875158402393, 'bull_atr_max_pct': 0.08328852495528595, 'bull_tp_mult': 1.5005525085071287, 'bull_tsl_mult': 0.9018003240654888, 'bull_time_stop': 137, 'bull_use_sma': True, 'bull_use_ema': True, 'bull_use_atr': True, 'bull_use_adx': True, 'bull_use_spike': True, 'bull_rsi_required': True, 'bear_strategy': 'breakout', 'bear_bb_std_mult': 1.5094121950852475, 'bear_rsi_os': 46, 'bear_rsi_ob': 72, 'bear_adx_thresh': 33.18960785292372, 'bear_atr_min_pct': 0.010560327670679779, 'bear_atr_max_pct': 0.12320047614716706, 'bear_tp_mult': 2.858756954988942, 'bear_tsl_mult': 0.8294328966845758, 'bear_time_stop': 21, 'bear_use_sma': False, 'bear_use_ema': True, 'bear_use_atr': True, 'bear_use_adx': False, 'bear_use_spike': True, 'bear_rsi_required': False, 'sideways_strategy': 'mean_reversion', 'sideways_bb_std_mult': 2.5727329800427037, 'sideways_rsi_os': 32, 'sideways_rsi_ob': 83, 'sideways_adx_thresh': 31.279122659239462, 'sideways_atr_min_pct': 0.0026662480070379, 'sideways_atr_max_pct': 0.08972126596514986, 'sideways_tp_mult': 1.3012211766954174, 'sideways_tsl_mult': 0.522179439859926, 'sideways_time_stop': 229, 'sideways_use_sma': True, 'sideways_use_ema': True, 'sideways_use_atr': False, 'sideways_use_adx': False, 'sideways_use_spike': True, 'sideways_rsi_required': False}.
