[I 2025-09-01 09:49:39,121] Trial 287 finished with values: [-0.0033132757005726043, 0.006393614808305425] and parameters: {'p_sma': 58, 'p_std': 17, 'p_atr': 12, 'p_adx': 10, 'rsi_period': 40, 'ema1': 9, 'ema2': 12, 'slip_atr_k': 0.006349873343844717, 'slip_spread_k': 0.13851653323516366, 'spread_hl_frac': 0.004460477652681861, 'bb_std_mult': 1.0587105721655954, 'rsi_os': 7, 'rsi_ob': 61, 'vol_spike': 0.20617553276326162, 'adx_thresh': 25.36348888481689, 'atr_min_pct': 0.027021362850556854, 'atr_max_pct': 0.06067872209510486, 'tp_mult': 2.7804158659760425, 'tsl_mult': 0.7865176190991768, 'strategy': 'breakout', 'time_stop': 157, 'use_sma': False, 'use_atr': True, 'use_adx': False, 'use_ema': False, 'use_spike': True, 'rsi_required': False, 'edge_k': 0.5926303920267405, 'edge_cap': 0.7983396077238026, 'bull_strategy': 'mean_reversion', 'bull_bb_std_mult': 3.2856143130740545, 'bull_rsi_os': 26, 'bull_rsi_ob': 77, 'bull_adx_thresh': 9.718673254906506, 'bull_atr_min_pct': 0.0037319253870762683, 'bull_atr_max_pct': 0.12493911794644494, 'bull_tp_mult': 1.608562853767202, 'bull_tsl_mult': 0.286610759724773, 'bull_time_stop': 86, 'bull_use_sma': True, 'bull_use_ema': False, 'bull_use_atr': True, 'bull_use_adx': False, 'bull_use_spike': True, 'bull_rsi_required': False, 'bear_strategy': 'breakout', 'bear_bb_std_mult': 1.336967132591925, 'bear_rsi_os': 18, 'bear_rsi_ob': 72, 'bear_adx_thresh': 34.2115606084046, 'bear_atr_min_pct': 0.005626245852725385, 'bear_atr_max_pct': 0.1264923302353171, 'bear_tp_mult': 2.835935291424851, 'bear_tsl_mult': 0.819373561469728, 'bear_time_stop': 15, 'bear_use_sma': False, 'bear_use_ema': True, 'bear_use_atr': False, 'bear_use_adx': True, 'bear_use_spike': True, 'bear_rsi_required': False, 'sideways_strategy': 'mean_reversion', 'sideways_bb_std_mult': 1.457824627738093, 'sideways_rsi_os': 44, 'sideways_rsi_ob': 62, 'sideways_adx_thresh': 31.09698770682045, 'sideways_atr_min_pct': 0.013653091050032403, 'sideways_atr_max_pct': 0.12233795331752727, 'sideways_tp_mult': 1.4280002220637065, 'sideways_tsl_mult': 0.9432206242636775, 'sideways_time_stop': 227, 'sideways_use_sma': True, 'sideways_use_ema': False, 'sideways_use_atr': True, 'sideways_use_adx': False, 'sideways_use_spike': True, 'sideways_rsi_required': False}.
[I 2025-09-01 09:49:39,131] Trial 286 finished with values: [-0.03938306729130414, 0.039371164377088104] and parameters: {'p_sma': 58, 'p_std': 17, 'p_atr': 12, 'p_adx': 23, 'rsi_period': 50, 'ema1': 6, 'ema2': 12, 'slip_atr_k': 0.2251443898336582, 'slip_spread_k': 0.5078903183015941, 'spread_hl_frac': 0.04795265031125542, 'bb_std_mult': 2.211926184789294, 'rsi_os': 8, 'rsi_ob': 82, 'vol_spike': 0.2066336666998663, 'adx_thresh': 10.101353388642202, 'atr_min_pct': 0.019779539726431677, 'atr_max_pct': 0.061098202875651285, 'tp_mult': 2.257758875081491, 'tsl_mult': 0.7892135517840805, 'strategy': 'breakout', 'time_stop': 291, 'use_sma': True, 'use_atr': False, 'use_adx': False, 'use_ema': False, 'use_spike': False, 'rsi_required': False, 'edge_k': 0.672988796650308, 'edge_cap': 0.8486228306666266, 'bull_strategy': 'breakout', 'bull_bb_std_mult': 3.2531816298236347, 'bull_rsi_os': 23, 'bull_rsi_ob': 77, 'bull_adx_thresh': 28.438775690420055, 'bull_atr_min_pct': 0.0035404426493560836, 'bull_atr_max_pct': 0.08056865515318491, 'bull_tp_mult': 1.5456125139961054, 'bull_tsl_mult': 0.911378123667365, 'bull_time_stop': 147, 'bull_use_sma': True, 'bull_use_ema': True, 'bull_use_atr': True, 'bull_use_adx': False, 'bull_use_spike': True, 'bull_rsi_required': False, 'bear_strategy': 'mean_reversion', 'bear_bb_std_mult': 2.0130923096224076, 'bear_rsi_os': 42, 'bear_rsi_ob': 67, 'bear_adx_thresh': 34.110068214478915, 'bear_atr_min_pct': 0.028443089029417563, 'bear_atr_max_pct': 0.14369106102339824, 'bear_tp_mult': 1.1335010278115414, 'bear_tsl_mult': 0.8226799214833478, 'bear_time_stop': 5, 'bear_use_sma': False, 'bear_use_ema': True, 'bear_use_atr': True, 'bear_use_adx': True, 'bear_use_spike': True, 'bear_rsi_required': True, 'sideways_strategy': 'mean_reversion', 'sideways_bb_std_mult': 2.582460218376101, 'sideways_rsi_os': 34, 'sideways_rsi_ob': 93, 'sideways_adx_thresh': 29.812097411057135, 'sideways_atr_min_pct': 0.00346915500629503, 'sideways_atr_max_pct': 0.06041264800793818, 'sideways_tp_mult': 2.7015802818545267, 'sideways_tsl_mult': 0.3500158020847174, 'sideways_time_stop': 272, 'sideways_use_sma': True, 'sideways_use_ema': False, 'sideways_use_atr': True, 'sideways_use_adx': False, 'sideways_use_spike': True, 'sideways_rsi_required': True}.
[I 2025-09-01 09:50:20,057] Trial 293 finished with values: [-0.00511738759197744, 0.006202571647915402] and parameters: {'p_sma': 60, 'p_std': 43, 'p_atr': 27, 'p_adx': 13, 'rsi_period': 55, 'ema1': 9, 'ema2': 10, 'slip_atr_k': 0.0127973967671556, 'slip_spread_k': 0.13420738153599304, 'spread_hl_frac': 0.008528990280223636, 'bb_std_mult': 1.9542288226456197, 'rsi_os': 7, 'rsi_ob': 61, 'vol_spike': 0.10269168574343249, 'adx_thresh': 25.683705483946433, 'atr_min_pct': 0.00021065697238889687, 'atr_max_pct': 0.07427349676403022, 'tp_mult': 2.5225552798682322, 'tsl_mult': 0.1858615326629917, 'strategy': 'breakout', 'time_stop': 143, 'use_sma': True, 'use_atr': True, 'use_adx': False, 'use_ema': False, 'use_spike': True, 'rsi_required': False, 'edge_k': 1.3091793987050826, 'edge_cap': 0.5251909445511828, 'bull_strategy': 'mean_reversion', 'bull_bb_std_mult': 3.3593964408653174, 'bull_rsi_os': 40, 'bull_rsi_ob': 79, 'bull_adx_thresh': 27.66841869439162, 'bull_atr_min_pct': 0.02903105750745641, 'bull_atr_max_pct': 0.10697541166551552, 'bull_tp_mult': 1.446846570622216, 'bull_tsl_mult': 0.24300377943119655, 'bull_time_stop': 124, 'bull_use_sma': True, 'bull_use_ema': False, 'bull_use_atr': True, 'bull_use_adx': True, 'bull_use_spike': True, 'bull_rsi_required': False, 'bear_strategy': 'breakout', 'bear_bb_std_mult': 3.5179411879619775, 'bear_rsi_os': 48, 'bear_rsi_ob': 58, 'bear_adx_thresh': 32.17825734659548, 'bear_atr_min_pct': 0.02716356825259227, 'bear_atr_max_pct': 0.12393434696315644, 'bear_tp_mult': 2.849022094183879, 'bear_tsl_mult': 0.8599080530574474, 'bear_time_stop': 14, 'bear_use_sma': False, 'bear_use_ema': True, 'bear_use_atr': True, 'bear_use_adx': True, 'bear_use_spike': True, 'bear_rsi_required': False, 'sideways_strategy': 'breakout', 'sideways_bb_std_mult': 1.8963557664174062, 'sideways_rsi_os': 32, 'sideways_rsi_ob': 61, 'sideways_adx_thresh': 31.172359295788997, 'sideways_atr_min_pct': 0.0026842081103043954, 'sideways_atr_max_pct': 0.14911876777144445, 'sideways_tp_mult': 1.672619127801202, 'sideways_tsl_mult': 0.5950851549318595, 'sideways_time_stop': 218, 'sideways_use_sma': True, 'sideways_use_ema': False, 'sideways_use_atr': False, 'sideways_use_adx': True, 'sideways_use_spike': True, 'sideways_rsi_required': False}.
[I 2025-09-01 09:50:20,069] Trial 291 finished with values: [-1000000000.0, 1000000000.0] and parameters: {'p_sma': 43, 'p_std': 43, 'p_atr': 27, 'p_adx': 10, 'rsi_period': 36, 'ema1': 9, 'ema2': 53, 'slip_atr_k': 0.2122510214704457, 'slip_spread_k': 0.13055935282724584, 'spread_hl_frac': 0.024688739958509915, 'bb_std_mult': 2.6815319848469232, 'rsi_os': 7, 'rsi_ob': 61, 'vol_spike': 0.19076703320748012, 'adx_thresh': 23.85080910859648, 'atr_min_pct': 0.023930745105003016, 'atr_max_pct': 0.0648926544053737, 'tp_mult': 2.517508278067532, 'tsl_mult': 0.06887989229090086, 'strategy': 'breakout', 'time_stop': 144, 'use_sma': True, 'use_atr': True, 'use_adx': False, 'use_ema': False, 'use_spike': True, 'rsi_required': False, 'edge_k': 0.617406973663618, 'edge_cap': 0.5275693988854064, 'bull_strategy': 'mean_reversion', 'bull_bb_std_mult': 3.033082888326916, 'bull_rsi_os': 40, 'bull_rsi_ob': 79, 'bull_adx_thresh': 7.468228877717477, 'bull_atr_min_pct': 0.0048471328201050165, 'bull_atr_max_pct': 0.0728949505860943, 'bull_tp_mult': 2.855049402846954, 'bull_tsl_mult': 0.2783430994083447, 'bull_time_stop': 126, 'bull_use_sma': True, 'bull_use_ema': False, 'bull_use_atr': True, 'bull_use_adx': True, 'bull_use_spike': True, 'bull_rsi_required': False, 'bear_strategy': 'breakout', 'bear_bb_std_mult': 3.0915466849499547, 'bear_rsi_os': 44, 'bear_rsi_ob': 57, 'bear_adx_thresh': 32.105614463854806, 'bear_atr_min_pct': 0.013626947097086435, 'bear_atr_max_pct': 0.1310232015217312, 'bear_tp_mult': 2.8262250781403027, 'bear_tsl_mult': 0.7911289696514642, 'bear_time_stop': 104, 'bear_use_sma': False, 'bear_use_ema': True, 'bear_use_atr': True, 'bear_use_adx': True, 'bear_use_spike': True, 'bear_rsi_required': False, 'sideways_strategy': 'breakout', 'sideways_bb_std_mult': 0.9222515470699351, 'sideways_rsi_os': 32, 'sideways_rsi_ob': 61, 'sideways_adx_thresh': 31.2427149109055, 'sideways_atr_min_pct': 0.013717499640809634, 'sideways_atr_max_pct': 0.07496684259310828, 'sideways_tp_mult': 1.327598041533725, 'sideways_tsl_mult': 0.6855063868774889, 'sideways_time_stop': 215, 'sideways_use_sma': True, 'sideways_use_ema': False, 'sideways_use_atr': False, 'sideways_use_adx': True, 'sideways_use_spike': True, 'sideways_rsi_required': False}.
[I 2025-09-01 09:50:20,329] Trial 292 finished with values: [-0.0070364906881806855, 0.008143296923404545] and parameters: {'p_sma': 60, 'p_std': 43, 'p_atr': 27, 'p_adx': 13, 'rsi_period': 43, 'ema1': 9, 'ema2': 53, 'slip_atr_k': 0.01196824664866771, 'slip_spread_k': 0.445211233493013, 'spread_hl_frac': 0.008272867375210892, 'bb_std_mult': 1.9511798413898669, 'rsi_os': 7, 'rsi_ob': 54, 'vol_spike': 0.09935742018715807, 'adx_thresh': 33.06353402494603, 'atr_min_pct': 0.02137964809433908, 'atr_max_pct': 0.0746840518770646, 'tp_mult': 2.7657704529940084, 'tsl_mult': 0.8250832103295304, 'strategy': 'breakout', 'time_stop': 274, 'use_sma': True, 'use_atr': True, 'use_adx': False, 'use_ema': False, 'use_spike': True, 'rsi_required': False, 'edge_k': 0.6548270767282675, 'edge_cap': 0.4974307898822582, 'bull_strategy': 'mean_reversion', 'bull_bb_std_mult': 3.3512759068719404, 'bull_rsi_os': 39, 'bull_rsi_ob': 49, 'bull_adx_thresh': 5.880561414173371, 'bull_atr_min_pct': 0.004222581930645053, 'bull_atr_max_pct': 0.10834076988742597, 'bull_tp_mult': 1.4650686271174007, 'bull_tsl_mult': 0.8385205675161759, 'bull_time_stop': 300, 'bull_use_sma': True, 'bull_use_ema': False, 'bull_use_atr': True, 'bull_use_adx': True, 'bull_use_spike': True, 'bull_rsi_required': False, 'bear_strategy': 'breakout', 'bear_bb_std_mult': 1.296063119199662, 'bear_rsi_os': 44, 'bear_rsi_ob': 57, 'bear_adx_thresh': 26.743391312843876, 'bear_atr_min_pct': 0.016253055700173144, 'bear_atr_max_pct': 0.018079958413496, 'bear_tp_mult': 1.333451186539726, 'bear_tsl_mult': 0.41625748664679707, 'bear_time_stop': 34, 'bear_use_sma': False, 'bear_use_ema': True, 'bear_use_atr': True, 'bear_use_adx': True, 'bear_use_spike': True, 'bear_rsi_required': False, 'sideways_strategy': 'breakout', 'sideways_bb_std_mult': 0.905114783978564, 'sideways_rsi_os': 52, 'sideways_rsi_ob': 61, 'sideways_adx_thresh': 31.51109623379823, 'sideways_atr_min_pct': 0.002576251748522396, 'sideways_atr_max_pct': 0.1483179525630143, 'sideways_tp_mult': 1.3508537837367394, 'sideways_tsl_mult': 0.9995774727539253, 'sideways_time_stop': 218, 'sideways_use_sma': True, 'sideways_use_ema': False, 'sideways_use_atr': False, 'sideways_use_adx': True, 'sideways_use_spike': True, 'sideways_rsi_required': False}.
[I 2025-09-01 09:50:20,936] Trial 290 finished with values: [-0.028542090452151725, 0.02898649330651021] and parameters: {'p_sma': 60, 'p_std': 46, 'p_atr': 12, 'p_adx': 10, 'rsi_period': 40, 'ema1': 6, 'ema2': 54, 'slip_atr_k': 0.21293610323305917, 'slip_spread_k': 0.12972959446159021, 'spread_hl_frac': 0.008211598012048998, 'bb_std_mult': 2.668324001838861, 'rsi_os': 7, 'rsi_ob': 61, 'vol_spike': 0.19086350528869817, 'adx_thresh': 23.46936533637351, 'atr_min_pct': 0.02701426753621889, 'atr_max_pct': 0.06518513886035736, 'tp_mult': 2.6659240066241505, 'tsl_mult': 0.297961824087618, 'strategy': 'breakout', 'time_stop': 143, 'use_sma': True, 'use_atr': True, 'use_adx': False, 'use_ema': False, 'use_spike': True, 'rsi_required': False, 'edge_k': 0.6113036815664064, 'edge_cap': 0.8414545923985669, 'bull_strategy': 'mean_reversion', 'bull_bb_std_mult': 3.352189299586234, 'bull_rsi_os': 39, 'bull_rsi_ob': 79, 'bull_adx_thresh': 27.586718042432576, 'bull_atr_min_pct': 0.00339889283058222, 'bull_atr_max_pct': 0.07825262679614645, 'bull_tp_mult': 1.4746295008615067, 'bull_tsl_mult': 0.9020642180424838, 'bull_time_stop': 188, 'bull_use_sma': True, 'bull_use_ema': False, 'bull_use_atr': True, 'bull_use_adx': False, 'bull_use_spike': True, 'bull_rsi_required': False, 'bear_strategy': 'breakout', 'bear_bb_std_mult': 1.2912478638679121, 'bear_rsi_os': 44, 'bear_rsi_ob': 72, 'bear_adx_thresh': 34.29460936929098, 'bear_atr_min_pct': 0.02706698287593636, 'bear_atr_max_pct': 0.12423389741368618, 'bear_tp_mult': 2.8298548475273373, 'bear_tsl_mult': 0.2223335849936151, 'bear_time_stop': 110, 'bear_use_sma': False, 'bear_use_ema': True, 'bear_use_atr': False, 'bear_use_adx': True, 'bear_use_spike': True, 'bear_rsi_required': False, 'sideways_strategy': 'mean_reversion', 'sideways_bb_std_mult': 2.529851071030688, 'sideways_rsi_os': 32, 'sideways_rsi_ob': 61, 'sideways_adx_thresh': 31.199610730194173, 'sideways_atr_min_pct': 0.002648931932661141, 'sideways_atr_max_pct': 0.12265356162831229, 'sideways_tp_mult': 1.3381387837685288, 'sideways_tsl_mult': 0.9626189298009922, 'sideways_time_stop': 217, 'sideways_use_sma': True, 'sideways_use_ema': False, 'sideways_use_atr': True, 'sideways_use_adx': False, 'sideways_use_spike': True, 'sideways_rsi_required': True}.
[I 2025-09-01 09:51:02,360] Trial 294 finished with values: [-1000000000.0, 1000000000.0] and parameters: {'p_sma': 56, 'p_std': 45, 'p_atr': 30, 'p_adx': 13, 'rsi_period': 43, 'ema1': 7, 'ema2': 10, 'slip_atr_k': 0.12130800011114497, 'slip_spread_k': 0.5888917015766314, 'spread_hl_frac': 0.037853367756962214, 'bb_std_mult': 2.584377314285423, 'rsi_os': 7, 'rsi_ob': 54, 'vol_spike': 0.09809791987708633, 'adx_thresh': 12.449362764995273, 'atr_min_pct': 0.008622042338589195, 'atr_max_pct': 0.07405643208851741, 'tp_mult': 2.6514737786852627, 'tsl_mult': 0.8429044169027302, 'strategy': 'breakout', 'time_stop': 134, 'use_sma': False, 'use_atr': True, 'use_adx': False, 'use_ema': False, 'use_spike': True, 'rsi_required': True, 'edge_k': 0.5823762299004255, 'edge_cap': 0.49567620889569836, 'bull_strategy': 'mean_reversion', 'bull_bb_std_mult': 3.3598013462298923, 'bull_rsi_os': 14, 'bull_rsi_ob': 81, 'bull_adx_thresh': 27.555324936089942, 'bull_atr_min_pct': 0.004188154535527553, 'bull_atr_max_pct': 0.04951080642481418, 'bull_tp_mult': 2.967408897727578, 'bull_tsl_mult': 0.9616964109221867, 'bull_time_stop': 105, 'bull_use_sma': True, 'bull_use_ema': False, 'bull_use_atr': False, 'bull_use_adx': False, 'bull_use_spike': False, 'bull_rsi_required': False, 'bear_strategy': 'breakout', 'bear_bb_std_mult': 0.8324212544823038, 'bear_rsi_os': 43, 'bear_rsi_ob': 70, 'bear_adx_thresh': 20.391939166987036, 'bear_atr_min_pct': 0.02925786037576532, 'bear_atr_max_pct': 0.12510541941685202, 'bear_tp_mult': 1.9687315030446257, 'bear_tsl_mult': 0.23036244684133605, 'bear_time_stop': 154, 'bear_use_sma': False, 'bear_use_ema': True, 'bear_use_atr': True, 'bear_use_adx': False, 'bear_use_spike': True, 'bear_rsi_required': False, 'sideways_strategy': 'breakout', 'sideways_bb_std_mult': 2.340884783910155, 'sideways_rsi_os': 28, 'sideways_rsi_ob': 58, 'sideways_adx_thresh': 7.924204446261676, 'sideways_atr_min_pct': 0.004466479609151246, 'sideways_atr_max_pct': 0.09362360258293165, 'sideways_tp_mult': 1.3631811950180412, 'sideways_tsl_mult': 0.6525095547132874, 'sideways_time_stop': 22, 'sideways_use_sma': True, 'sideways_use_ema': True, 'sideways_use_atr': False, 'sideways_use_adx': False, 'sideways_use_spike': True, 'sideways_rsi_required': True}.
[I 2025-09-01 09:51:02,371] Trial 295 finished with values: [-1000000000.0, 1000000000.0] and parameters: {'p_sma': 56, 'p_std': 46, 'p_atr': 25, 'p_adx': 9, 'rsi_period': 44, 'ema1': 7, 'ema2': 59, 'slip_atr_k': 0.12302241329712159, 'slip_spread_k': 0.40760963492947366, 'spread_hl_frac': 0.04607047900237609, 'bb_std_mult': 2.590513505128181, 'rsi_os': 9, 'rsi_ob': 85, 'vol_spike': 0.20208130669705104, 'adx_thresh': 25.81441384246191, 'atr_min_pct': 0.008555099189155781, 'atr_max_pct': 0.0524714541372269, 'tp_mult': 2.6542207448619584, 'tsl_mult': 0.1792791913685593, 'strategy': 'breakout', 'time_stop': 162, 'use_sma': False, 'use_atr': False, 'use_adx': False, 'use_ema': False, 'use_spike': True, 'rsi_required': True, 'edge_k': 0.7800570882910243, 'edge_cap': 0.8412906372791831, 'bull_strategy': 'mean_reversion', 'bull_bb_std_mult': 0.532111427191841, 'bull_rsi_os': 37, 'bull_rsi_ob': 81, 'bull_adx_thresh': 27.570461429580334, 'bull_atr_min_pct': 0.02579802142366608, 'bull_atr_max_pct': 0.0502089692023156, 'bull_tp_mult': 1.3443261364806944, 'bull_tsl_mult': 0.9504766498505642, 'bull_time_stop': 139, 'bull_use_sma': True, 'bull_use_ema': False, 'bull_use_atr': False, 'bull_use_adx': False, 'bull_use_spike': False, 'bull_rsi_required': False, 'bear_strategy': 'breakout', 'bear_bb_std_mult': 1.5941855245704517, 'bear_rsi_os': 43, 'bear_rsi_ob': 70, 'bear_adx_thresh': 11.504685265957434, 'bear_atr_min_pct': 0.023795674651343537, 'bear_atr_max_pct': 0.12420176824084762, 'bear_tp_mult': 2.8044823485215833, 'bear_tsl_mult': 0.22887408305467138, 'bear_time_stop': 14, 'bear_use_sma': True, 'bear_use_ema': True, 'bear_use_atr': True, 'bear_use_adx': False, 'bear_use_spike': True, 'bear_rsi_required': False, 'sideways_strategy': 'mean_reversion', 'sideways_bb_std_mult': 0.7057476156134845, 'sideways_rsi_os': 5, 'sideways_rsi_ob': 64, 'sideways_adx_thresh': 17.171919675021154, 'sideways_atr_min_pct': 0.02039743151117452, 'sideways_atr_max_pct': 0.06444866041520311, 'sideways_tp_mult': 1.3790175215153462, 'sideways_tsl_mult': 0.7101521119339795, 'sideways_time_stop': 30, 'sideways_use_sma': True, 'sideways_use_ema': True, 'sideways_use_atr': False, 'sideways_use_adx': False, 'sideways_use_spike': True, 'sideways_rsi_required': True}.
[I 2025-09-01 09:51:02,532] Trial 296 finished with values: [-1000000000.0, 1000000000.0] and parameters: {'p_sma': 22, 'p_std': 58, 'p_atr': 13, 'p_adx': 25, 'rsi_period': 44, 'ema1': 7, 'ema2': 59, 'slip_atr_k': 0.004325810199702859, 'slip_spread_k': 0.583839444299424, 'spread_hl_frac': 0.037724178333621836, 'bb_std_mult': 1.8091146117487005, 'rsi_os': 9, 'rsi_ob': 45, 'vol_spike': 0.19981587866996037, 'adx_thresh': 12.298793266511682, 'atr_min_pct': 0.02055988517685023, 'atr_max_pct': 0.11045210351684415, 'tp_mult': 2.6576768955664525, 'tsl_mult': 0.19006770900304576, 'strategy': 'breakout', 'time_stop': 133, 'use_sma': False, 'use_atr': False, 'use_adx': False, 'use_ema': False, 'use_spike': True, 'rsi_required': True, 'edge_k': 1.289454401842253, 'edge_cap': 0.8455009645615464, 'bull_strategy': 'mean_reversion', 'bull_bb_std_mult': 0.9421879812252496, 'bull_rsi_os': 38, 'bull_rsi_ob': 81, 'bull_adx_thresh': 13.180645630170332, 'bull_atr_min_pct': 0.01735122724500349, 'bull_atr_max_pct': 0.08348419868902318, 'bull_tp_mult': 1.1523343773760506, 'bull_tsl_mult': 0.6640296099762361, 'bull_time_stop': 54, 'bull_use_sma': True, 'bull_use_ema': False, 'bull_use_atr': False, 'bull_use_adx': False, 'bull_use_spike': False, 'bull_rsi_required': False, 'bear_strategy': 'breakout', 'bear_bb_std_mult': 0.8195498837457971, 'bear_rsi_os': 34, 'bear_rsi_ob': 70, 'bear_adx_thresh': 11.737122692442183, 'bear_atr_min_pct': 0.01745179634952921, 'bear_atr_max_pct': 0.12387975471926008, 'bear_tp_mult': 2.6142587481824706, 'bear_tsl_mult': 0.8629392102202984, 'bear_time_stop': 13, 'bear_use_sma': True, 'bear_use_ema': True, 'bear_use_atr': True, 'bear_use_adx': False, 'bear_use_spike': True, 'bear_rsi_required': False, 'sideways_strategy': 'mean_reversion', 'sideways_bb_std_mult': 2.5214501212546865, 'sideways_rsi_os': 28, 'sideways_rsi_ob': 58, 'sideways_adx_thresh': 32.42679064946555, 'sideways_atr_min_pct': 0.015055208370521886, 'sideways_atr_max_pct': 0.08972390488228564, 'sideways_tp_mult': 1.293360629637526, 'sideways_tsl_mult': 0.9191226424150918, 'sideways_time_stop': 227, 'sideways_use_sma': True, 'sideways_use_ema': True, 'sideways_use_atr': False, 'sideways_use_adx': False, 'sideways_use_spike': True, 'sideways_rsi_required': True}.
