[I 2025-09-01 09:44:45,364] Trial 261 finished with values: [-1000000000.0, 1000000000.0] and parameters: {'p_sma': 11, 'p_std': 47, 'p_atr': 27, 'p_adx': 11, 'rsi_period': 32, 'ema1': 8, 'ema2': 11, 'slip_atr_k': 0.004701925257351102, 'slip_spread_k': 0.5378572910863285, 'spread_hl_frac': 0.007261573321392988, 'bb_std_mult': 2.4566716555648522, 'rsi_os': 13, 'rsi_ob': 56, 'vol_spike': 0.2956976443840662, 'adx_thresh': 5.0056885158048985, 'atr_min_pct': 0.02099990775360539, 'atr_max_pct': 0.12114248657730323, 'tp_mult': 1.4961062609073785, 'tsl_mult': 0.5765549678529047, 'strategy': 'breakout', 'time_stop': 139, 'use_sma': True, 'use_atr': True, 'use_adx': False, 'use_ema': False, 'use_spike': False, 'rsi_required': False, 'edge_k': 1.5011066423367991, 'edge_cap': 0.7220040168885058, 'bull_strategy': 'breakout', 'bull_bb_std_mult': 3.5413913792751575, 'bull_rsi_os': 53, 'bull_rsi_ob': 81, 'bull_adx_thresh': 26.75702303039578, 'bull_atr_min_pct': 0.004866464343130665, 'bull_atr_max_pct': 0.012250212630921561, 'bull_tp_mult': 1.54567423845465, 'bull_tsl_mult': 0.9250201866333891, 'bull_time_stop': 129, 'bull_use_sma': True, 'bull_use_ema': True, 'bull_use_atr': False, 'bull_use_adx': False, 'bull_use_spike': True, 'bull_rsi_required': False, 'bear_strategy': 'breakout', 'bear_bb_std_mult': 2.121446201664196, 'bear_rsi_os': 50, 'bear_rsi_ob': 73, 'bear_adx_thresh': 7.285602301582696, 'bear_atr_min_pct': 0.009504865783333847, 'bear_atr_max_pct': 0.05369619791289946, 'bear_tp_mult': 2.919833427986895, 'bear_tsl_mult': 0.6695196574751938, 'bear_time_stop': 24, 'bear_use_sma': False, 'bear_use_ema': True, 'bear_use_atr': True, 'bear_use_adx': False, 'bear_use_spike': True, 'bear_rsi_required': False, 'sideways_strategy': 'mean_reversion', 'sideways_bb_std_mult': 2.7800050324075007, 'sideways_rsi_os': 42, 'sideways_rsi_ob': 61, 'sideways_adx_thresh': 31.596783849074544, 'sideways_atr_min_pct': 0.0015268359981564662, 'sideways_atr_max_pct': 0.08477969088168448, 'sideways_tp_mult': 2.4300981790634575, 'sideways_tsl_mult': 0.6297765804571404, 'sideways_time_stop': 210, 'sideways_use_sma': True, 'sideways_use_ema': True, 'sideways_use_atr': False, 'sideways_use_adx': False, 'sideways_use_spike': True, 'sideways_rsi_required': False}.
[I 2025-09-01 09:45:29,373] Trial 264 finished with values: [-1000000000.0, 1000000000.0] and parameters: {'p_sma': 14, 'p_std': 51, 'p_atr': 27, 'p_adx': 7, 'rsi_period': 26, 'ema1': 7, 'ema2': 50, 'slip_atr_k': 0.008146563934564284, 'slip_spread_k': 0.5432696906270433, 'spread_hl_frac': 0.007403062925258206, 'bb_std_mult': 2.549260145201227, 'rsi_os': 8, 'rsi_ob': 90, 'vol_spike': 0.25368423666917916, 'adx_thresh': 10.241571328662719, 'atr_min_pct': 0.003097802849305574, 'atr_max_pct': 0.12061807487214937, 'tp_mult': 2.4489557268046003, 'tsl_mult': 0.8682485067390735, 'strategy': 'breakout', 'time_stop': 160, 'use_sma': True, 'use_atr': True, 'use_adx': False, 'use_ema': True, 'use_spike': False, 'rsi_required': True, 'edge_k': 0.5918968942713734, 'edge_cap': 0.6533820028479488, 'bull_strategy': 'breakout', 'bull_bb_std_mult': 3.3273744760471224, 'bull_rsi_os': 36, 'bull_rsi_ob': 78, 'bull_adx_thresh': 34.41049852195164, 'bull_atr_min_pct': 0.003718928948781007, 'bull_atr_max_pct': 0.1159419196262319, 'bull_tp_mult': 1.5758691293459306, 'bull_tsl_mult': 0.871621419012716, 'bull_time_stop': 115, 'bull_use_sma': True, 'bull_use_ema': True, 'bull_use_atr': True, 'bull_use_adx': False, 'bull_use_spike': True, 'bull_rsi_required': False, 'bear_strategy': 'breakout', 'bear_bb_std_mult': 3.5732491877803625, 'bear_rsi_os': 11, 'bear_rsi_ob': 82, 'bear_adx_thresh': 34.02697054226683, 'bear_atr_min_pct': 0.01279883681858247, 'bear_atr_max_pct': 0.13346585349823356, 'bear_tp_mult': 2.2342694058853034, 'bear_tsl_mult': 0.9101088338373545, 'bear_time_stop': 201, 'bear_use_sma': True, 'bear_use_ema': True, 'bear_use_atr': False, 'bear_use_adx': True, 'bear_use_spike': True, 'bear_rsi_required': False, 'sideways_strategy': 'mean_reversion', 'sideways_bb_std_mult': 2.3702826368399132, 'sideways_rsi_os': 42, 'sideways_rsi_ob': 79, 'sideways_adx_thresh': 28.37159197982436, 'sideways_atr_min_pct': 0.004090191543132667, 'sideways_atr_max_pct': 0.0850610590666048, 'sideways_tp_mult': 1.4461774561638627, 'sideways_tsl_mult': 0.3138757752802111, 'sideways_time_stop': 210, 'sideways_use_sma': True, 'sideways_use_ema': False, 'sideways_use_atr': False, 'sideways_use_adx': False, 'sideways_use_spike': True, 'sideways_rsi_required': False}.
[I 2025-09-01 09:45:30,046] Trial 263 finished with values: [-1000000000.0, 1000000000.0] and parameters: {'p_sma': 11, 'p_std': 43, 'p_atr': 11, 'p_adx': 11, 'rsi_period': 48, 'ema1': 11, 'ema2': 41, 'slip_atr_k': 0.011945014387970528, 'slip_spread_k': 0.5406064111133156, 'spread_hl_frac': 0.007223262741888724, 'bb_std_mult': 2.563782720240715, 'rsi_os': 8, 'rsi_ob': 55, 'vol_spike': 0.06540094920514469, 'adx_thresh': 6.591982269395679, 'atr_min_pct': 0.019132433939534167, 'atr_max_pct': 0.108252492557463, 'tp_mult': 1.8070332592233145, 'tsl_mult': 0.02764329076273042, 'strategy': 'breakout', 'time_stop': 139, 'use_sma': True, 'use_atr': True, 'use_adx': False, 'use_ema': True, 'use_spike': False, 'rsi_required': True, 'edge_k': 0.7545320718993038, 'edge_cap': 0.860034137675955, 'bull_strategy': 'breakout', 'bull_bb_std_mult': 3.2962885549555723, 'bull_rsi_os': 9, 'bull_rsi_ob': 80, 'bull_adx_thresh': 6.738857550244859, 'bull_atr_min_pct': 0.003734762028164221, 'bull_atr_max_pct': 0.013384944652401684, 'bull_tp_mult': 1.5749709002095365, 'bull_tsl_mult': 0.7172085250733675, 'bull_time_stop': 113, 'bull_use_sma': True, 'bull_use_ema': True, 'bull_use_atr': True, 'bull_use_adx': False, 'bull_use_spike': True, 'bull_rsi_required': False, 'bear_strategy': 'breakout', 'bear_bb_std_mult': 1.4903082265662146, 'bear_rsi_os': 41, 'bear_rsi_ob': 67, 'bear_adx_thresh': 28.62122464448812, 'bear_atr_min_pct': 0.00858343685479504, 'bear_atr_max_pct': 0.08605303995305372, 'bear_tp_mult': 2.9258337626610764, 'bear_tsl_mult': 0.8875169125242852, 'bear_time_stop': 201, 'bear_use_sma': True, 'bear_use_ema': True, 'bear_use_atr': False, 'bear_use_adx': False, 'bear_use_spike': True, 'bear_rsi_required': False, 'sideways_strategy': 'mean_reversion', 'sideways_bb_std_mult': 1.0272005490472988, 'sideways_rsi_os': 6, 'sideways_rsi_ob': 61, 'sideways_adx_thresh': 19.46300552360156, 'sideways_atr_min_pct': 0.0016166733650727898, 'sideways_atr_max_pct': 0.09634394809892699, 'sideways_tp_mult': 2.7686171223436045, 'sideways_tsl_mult': 0.14894819421680916, 'sideways_time_stop': 212, 'sideways_use_sma': True, 'sideways_use_ema': True, 'sideways_use_atr': False, 'sideways_use_adx': False, 'sideways_use_spike': True, 'sideways_rsi_required': False}.
[I 2025-09-01 09:45:30,864] Trial 262 finished with values: [-1000000000.0, 1000000000.0] and parameters: {'p_sma': 44, 'p_std': 27, 'p_atr': 26, 'p_adx': 30, 'rsi_period': 44, 'ema1': 8, 'ema2': 50, 'slip_atr_k': 0.007588132313521637, 'slip_spread_k': 0.5392282079328463, 'spread_hl_frac': 0.026884180457418642, 'bb_std_mult': 2.592878931236749, 'rsi_os': 32, 'rsi_ob': 69, 'vol_spike': 0.19283380758849078, 'adx_thresh': 6.340961683051352, 'atr_min_pct': 0.0027086081502385242, 'atr_max_pct': 0.06314581726561189, 'tp_mult': 1.7361267113545928, 'tsl_mult': 0.8587297709073348, 'strategy': 'breakout', 'time_stop': 139, 'use_sma': True, 'use_atr': True, 'use_adx': False, 'use_ema': True, 'use_spike': False, 'rsi_required': True, 'edge_k': 0.10957036674387732, 'edge_cap': 0.5509999087816992, 'bull_strategy': 'breakout', 'bull_bb_std_mult': 3.074514966815965, 'bull_rsi_os': 40, 'bull_rsi_ob': 80, 'bull_adx_thresh': 21.195136837840824, 'bull_atr_min_pct': 0.02635971174905833, 'bull_atr_max_pct': 0.1301905347472459, 'bull_tp_mult': 1.5750977764232141, 'bull_tsl_mult': 0.9259475464854238, 'bull_time_stop': 129, 'bull_use_sma': True, 'bull_use_ema': True, 'bull_use_atr': True, 'bull_use_adx': False, 'bull_use_spike': True, 'bull_rsi_required': False, 'bear_strategy': 'breakout', 'bear_bb_std_mult': 1.472444488616477, 'bear_rsi_os': 41, 'bear_rsi_ob': 74, 'bear_adx_thresh': 28.57823267651088, 'bear_atr_min_pct': 0.008530120693555802, 'bear_atr_max_pct': 0.08582028961233948, 'bear_tp_mult': 2.9224729110071572, 'bear_tsl_mult': 0.8286230458498779, 'bear_time_stop': 200, 'bear_use_sma': True, 'bear_use_ema': True, 'bear_use_atr': False, 'bear_use_adx': False, 'bear_use_spike': True, 'bear_rsi_required': False, 'sideways_strategy': 'mean_reversion', 'sideways_bb_std_mult': 1.07993596138389, 'sideways_rsi_os': 29, 'sideways_rsi_ob': 75, 'sideways_adx_thresh': 31.659741751141752, 'sideways_atr_min_pct': 0.0012126874377560671, 'sideways_atr_max_pct': 0.09527679421789696, 'sideways_tp_mult': 1.4490244873569262, 'sideways_tsl_mult': 0.5687983939031043, 'sideways_time_stop': 209, 'sideways_use_sma': True, 'sideways_use_ema': True, 'sideways_use_atr': False, 'sideways_use_adx': False, 'sideways_use_spike': True, 'sideways_rsi_required': False}.
[I 2025-09-01 09:45:30,874] Trial 265 finished with values: [-0.0014001342666996042, 0.002346721296706175] and parameters: {'p_sma': 14, 'p_std': 56, 'p_atr': 9, 'p_adx': 12, 'rsi_period': 42, 'ema1': 13, 'ema2': 13, 'slip_atr_k': 0.012570865542752867, 'slip_spread_k': 0.5972492997358165, 'spread_hl_frac': 0.0064861056278223556, 'bb_std_mult': 2.5286567192813463, 'rsi_os': 11, 'rsi_ob': 55, 'vol_spike': 0.18663452349130086, 'adx_thresh': 11.908573539869694, 'atr_min_pct': 0.019022086871827777, 'atr_max_pct': 0.11371736336970242, 'tp_mult': 2.4535020837174977, 'tsl_mult': 0.8559219646907426, 'strategy': 'breakout', 'time_stop': 17, 'use_sma': True, 'use_atr': True, 'use_adx': False, 'use_ema': True, 'use_spike': True, 'rsi_required': True, 'edge_k': 0.6019380931953718, 'edge_cap': 0.8698646503078705, 'bull_strategy': 'mean_reversion', 'bull_bb_std_mult': 3.3172968904136373, 'bull_rsi_os': 44, 'bull_rsi_ob': 78, 'bull_adx_thresh': 31.45908119288573, 'bull_atr_min_pct': 0.016172818669722266, 'bull_atr_max_pct': 0.06094518668610814, 'bull_tp_mult': 1.5879525226260274, 'bull_tsl_mult': 0.9530603108439382, 'bull_time_stop': 115, 'bull_use_sma': True, 'bull_use_ema': False, 'bull_use_atr': True, 'bull_use_adx': False, 'bull_use_spike': True, 'bull_rsi_required': False, 'bear_strategy': 'breakout', 'bear_bb_std_mult': 2.1967995276806906, 'bear_rsi_os': 10, 'bear_rsi_ob': 67, 'bear_adx_thresh': 33.90959090121139, 'bear_atr_min_pct': 0.012690689420224669, 'bear_atr_max_pct': 0.13345579933829377, 'bear_tp_mult': 2.8483597111249415, 'bear_tsl_mult': 0.776428859097365, 'bear_time_stop': 119, 'bear_use_sma': True, 'bear_use_ema': True, 'bear_use_atr': False, 'bear_use_adx': True, 'bear_use_spike': True, 'bear_rsi_required': False, 'sideways_strategy': 'mean_reversion', 'sideways_bb_std_mult': 3.194113598626198, 'sideways_rsi_os': 48, 'sideways_rsi_ob': 62, 'sideways_adx_thresh': 30.588196569143776, 'sideways_atr_min_pct': 0.004589206887036859, 'sideways_atr_max_pct': 0.09096036985885031, 'sideways_tp_mult': 1.4515860953014315, 'sideways_tsl_mult': 0.41132566301250617, 'sideways_time_stop': 100, 'sideways_use_sma': True, 'sideways_use_ema': False, 'sideways_use_atr': False, 'sideways_use_adx': True, 'sideways_use_spike': True, 'sideways_rsi_required': False}.
[I 2025-09-01 09:46:10,147] Trial 266 finished with values: [-0.0003806370507604129, 0.0013421867266710558] and parameters: {'p_sma': 26, 'p_std': 43, 'p_atr': 28, 'p_adx': 30, 'rsi_period': 44, 'ema1': 13, 'ema2': 40, 'slip_atr_k': 0.013986038821537213, 'slip_spread_k': 0.5971380210945428, 'spread_hl_frac': 0.02689993953725962, 'bb_std_mult': 0.9696916712302717, 'rsi_os': 9, 'rsi_ob': 55, 'vol_spike': 0.27981006847225154, 'adx_thresh': 31.65478137791563, 'atr_min_pct': 0.01928143131356165, 'atr_max_pct': 0.0631069093052282, 'tp_mult': 1.7320197620382576, 'tsl_mult': 0.8484685653981785, 'strategy': 'breakout', 'time_stop': 292, 'use_sma': True, 'use_atr': True, 'use_adx': False, 'use_ema': True, 'use_spike': True, 'rsi_required': False, 'edge_k': 0.13096789669719644, 'edge_cap': 0.9660486811747022, 'bull_strategy': 'mean_reversion', 'bull_bb_std_mult': 2.313366525781955, 'bull_rsi_os': 10, 'bull_rsi_ob': 83, 'bull_adx_thresh': 25.636305734076142, 'bull_atr_min_pct': 0.026550738413304034, 'bull_atr_max_pct': 0.06463476834202547, 'bull_tp_mult': 1.487165820918458, 'bull_tsl_mult': 0.8175121054044701, 'bull_time_stop': 155, 'bull_use_sma': True, 'bull_use_ema': False, 'bull_use_atr': True, 'bull_use_adx': False, 'bull_use_spike': True, 'bull_rsi_required': False, 'bear_strategy': 'breakout', 'bear_bb_std_mult': 1.494761229353941, 'bear_rsi_os': 41, 'bear_rsi_ob': 71, 'bear_adx_thresh': 31.684204362522387, 'bear_atr_min_pct': 0.010500664709785447, 'bear_atr_max_pct': 0.08604214912797242, 'bear_tp_mult': 2.8537490624439408, 'bear_tsl_mult': 0.8314122906674524, 'bear_time_stop': 121, 'bear_use_sma': True, 'bear_use_ema': True, 'bear_use_atr': False, 'bear_use_adx': True, 'bear_use_spike': True, 'bear_rsi_required': False, 'sideways_strategy': 'mean_reversion', 'sideways_bb_std_mult': 2.6607911520092102, 'sideways_rsi_os': 29, 'sideways_rsi_ob': 75, 'sideways_adx_thresh': 5.352462901400264, 'sideways_atr_min_pct': 0.0015443659145985922, 'sideways_atr_max_pct': 0.08987917451359333, 'sideways_tp_mult': 1.7646455657715636, 'sideways_tsl_mult': 0.4262029377043085, 'sideways_time_stop': 143, 'sideways_use_sma': True, 'sideways_use_ema': False, 'sideways_use_atr': False, 'sideways_use_adx': True, 'sideways_use_spike': True, 'sideways_rsi_required': False}.
[I 2025-09-01 09:46:10,882] Trial 269 finished with values: [-0.0689857653904441, 0.06909429358713966] and parameters: {'p_sma': 57, 'p_std': 48, 'p_atr': 9, 'p_adx': 12, 'rsi_period': 41, 'ema1': 14, 'ema2': 46, 'slip_atr_k': 0.2023829510801753, 'slip_spread_k': 0.5940413454383222, 'spread_hl_frac': 0.0061607161644120206, 'bb_std_mult': 2.753407348285389, 'rsi_os': 11, 'rsi_ob': 65, 'vol_spike': 0.05186955374240236, 'adx_thresh': 32.04760455301064, 'atr_min_pct': 0.02576495475582356, 'atr_max_pct': 0.11366950271546561, 'tp_mult': 2.5528585871792924, 'tsl_mult': 0.7081668389692451, 'strategy': 'breakout', 'time_stop': 150, 'use_sma': True, 'use_atr': True, 'use_adx': True, 'use_ema': False, 'use_spike': True, 'rsi_required': False, 'edge_k': 0.14737813103148711, 'edge_cap': 0.9650025815008832, 'bull_strategy': 'mean_reversion', 'bull_bb_std_mult': 0.8011054937237467, 'bull_rsi_os': 41, 'bull_rsi_ob': 78, 'bull_adx_thresh': 21.895755548791712, 'bull_atr_min_pct': 0.011713843389538748, 'bull_atr_max_pct': 0.05965849517432068, 'bull_tp_mult': 1.4971748061600443, 'bull_tsl_mult': 0.8196478614682399, 'bull_time_stop': 26, 'bull_use_sma': True, 'bull_use_ema': False, 'bull_use_atr': True, 'bull_use_adx': True, 'bull_use_spike': False, 'bull_rsi_required': False, 'bear_strategy': 'breakout', 'bear_bb_std_mult': 2.2181206070380606, 'bear_rsi_os': 39, 'bear_rsi_ob': 64, 'bear_adx_thresh': 9.778416632366305, 'bear_atr_min_pct': 0.02763747422308846, 'bear_atr_max_pct': 0.1268384871314845, 'bear_tp_mult': 2.8545250539304057, 'bear_tsl_mult': 0.7818421055926753, 'bear_time_stop': 11, 'bear_use_sma': False, 'bear_use_ema': True, 'bear_use_atr': True, 'bear_use_adx': True, 'bear_use_spike': True, 'bear_rsi_required': False, 'sideways_strategy': 'breakout', 'sideways_bb_std_mult': 2.496339073685841, 'sideways_rsi_os': 32, 'sideways_rsi_ob': 49, 'sideways_adx_thresh': 5.344012379835238, 'sideways_atr_min_pct': 0.002438314233816919, 'sideways_atr_max_pct': 0.09064141595311655, 'sideways_tp_mult': 1.380702175941081, 'sideways_tsl_mult': 0.4105364793635009, 'sideways_time_stop': 221, 'sideways_use_sma': False, 'sideways_use_ema': False, 'sideways_use_atr': False, 'sideways_use_adx': True, 'sideways_use_spike': True, 'sideways_rsi_required': False}.
[I 2025-09-01 09:46:11,518] Trial 267 finished with values: [-1000000000.0, 1000000000.0] and parameters: {'p_sma': 57, 'p_std': 48, 'p_atr': 26, 'p_adx': 12, 'rsi_period': 66, 'ema1': 7, 'ema2': 13, 'slip_atr_k': 0.11436060619611511, 'slip_spread_k': 0.6032195711759327, 'spread_hl_frac': 0.011430026823889525, 'bb_std_mult': 0.9730877783185667, 'rsi_os': 16, 'rsi_ob': 68, 'vol_spike': 0.27825999683093416, 'adx_thresh': 11.889690048573687, 'atr_min_pct': 0.02592042430367191, 'atr_max_pct': 0.06354346981387013, 'tp_mult': 2.597840555170756, 'tsl_mult': 0.09736390823862312, 'strategy': 'breakout', 'time_stop': 56, 'use_sma': True, 'use_atr': True, 'use_adx': False, 'use_ema': False, 'use_spike': True, 'rsi_required': False, 'edge_k': 0.6382496114420011, 'edge_cap': 0.8350413466545804, 'bull_strategy': 'mean_reversion', 'bull_bb_std_mult': 3.448797734878095, 'bull_rsi_os': 41, 'bull_rsi_ob': 85, 'bull_adx_thresh': 27.751912100561412, 'bull_atr_min_pct': 0.01185335073548164, 'bull_atr_max_pct': 0.0651123693375808, 'bull_tp_mult': 1.6293686170685417, 'bull_tsl_mult': 0.9458811519873734, 'bull_time_stop': 122, 'bull_use_sma': True, 'bull_use_ema': False, 'bull_use_atr': True, 'bull_use_adx': False, 'bull_use_spike': True, 'bull_rsi_required': False, 'bear_strategy': 'breakout', 'bear_bb_std_mult': 1.5405467504532149, 'bear_rsi_os': 43, 'bear_rsi_ob': 69, 'bear_adx_thresh': 31.633174147468637, 'bear_atr_min_pct': 0.020284955862699627, 'bear_atr_max_pct': 0.13129985276091105, 'bear_tp_mult': 2.847994810641683, 'bear_tsl_mult': 0.7753685426059985, 'bear_time_stop': 119, 'bear_use_sma': False, 'bear_use_ema': True, 'bear_use_atr': True, 'bear_use_adx': True, 'bear_use_spike': True, 'bear_rsi_required': False, 'sideways_strategy': 'breakout', 'sideways_bb_std_mult': 0.5802094931169328, 'sideways_rsi_os': 13, 'sideways_rsi_ob': 73, 'sideways_adx_thresh': 32.12892905091542, 'sideways_atr_min_pct': 0.024222821372171938, 'sideways_atr_max_pct': 0.08124766624217208, 'sideways_tp_mult': 1.3810276704543163, 'sideways_tsl_mult': 0.188145089431002, 'sideways_time_stop': 221, 'sideways_use_sma': True, 'sideways_use_ema': False, 'sideways_use_atr': False, 'sideways_use_adx': True, 'sideways_use_spike': True, 'sideways_rsi_required': False}.
[I 2025-09-01 09:46:11,778] Trial 268 finished with values: [-1000000000.0, 1000000000.0] and parameters: {'p_sma': 26, 'p_std': 48, 'p_atr': 17, 'p_adx': 12, 'rsi_period': 57, 'ema1': 8, 'ema2': 47, 'slip_atr_k': 0.1346114665366221, 'slip_spread_k': 0.5905398673245107, 'spread_hl_frac': 0.00826758973914233, 'bb_std_mult': 2.752934624744394, 'rsi_os': 11, 'rsi_ob': 52, 'vol_spike': 0.2658497544292124, 'adx_thresh': 12.006645118417872, 'atr_min_pct': 0.027666732370084456, 'atr_max_pct': 0.149765374537217, 'tp_mult': 2.593809982284935, 'tsl_mult': 0.8004234332220049, 'strategy': 'breakout', 'time_stop': 151, 'use_sma': True, 'use_atr': True, 'use_adx': True, 'use_ema': False, 'use_spike': True, 'rsi_required': False, 'edge_k': 0.6174725684081716, 'edge_cap': 0.8979073500726054, 'bull_strategy': 'mean_reversion', 'bull_bb_std_mult': 0.5896693102818351, 'bull_rsi_os': 47, 'bull_rsi_ob': 78, 'bull_adx_thresh': 25.848762181233475, 'bull_atr_min_pct': 0.01843663734814791, 'bull_atr_max_pct': 0.07274175595034692, 'bull_tp_mult': 1.6358234062675516, 'bull_tsl_mult': 0.949392460678498, 'bull_time_stop': 156, 'bull_use_sma': True, 'bull_use_ema': False, 'bull_use_atr': True, 'bull_use_adx': True, 'bull_use_spike': False, 'bull_rsi_required': False, 'bear_strategy': 'breakout', 'bear_bb_std_mult': 2.6974808231454923, 'bear_rsi_os': 39, 'bear_rsi_ob': 89, 'bear_adx_thresh': 33.95577572561534, 'bear_atr_min_pct': 0.0017512996326296635, 'bear_atr_max_pct': 0.14747936701959252, 'bear_tp_mult': 2.465777720712825, 'bear_tsl_mult': 0.38898178620341617, 'bear_time_stop': 12, 'bear_use_sma': False, 'bear_use_ema': True, 'bear_use_atr': True, 'bear_use_adx': True, 'bear_use_spike': True, 'bear_rsi_required': False, 'sideways_strategy': 'breakout', 'sideways_bb_std_mult': 0.5859773746388244, 'sideways_rsi_os': 19, 'sideways_rsi_ob': 58, 'sideways_adx_thresh': 32.134175759054905, 'sideways_atr_min_pct': 0.014340814141415163, 'sideways_atr_max_pct': 0.13988025626265688, 'sideways_tp_mult': 1.3907479518272052, 'sideways_tsl_mult': 0.4280119158174378, 'sideways_time_stop': 179, 'sideways_use_sma': False, 'sideways_use_ema': False, 'sideways_use_atr': False, 'sideways_use_adx': True, 'sideways_use_spike': True, 'sideways_rsi_required': False}.
