[I 2025-09-01 09:31:50,237] Trial 187 finished with values: [-0.03754316991947437, 0.03797859109449976] and parameters: {'p_sma': 43, 'p_std': 48, 'p_atr': 13, 'p_adx': 11, 'rsi_period': 12, 'ema1': 9, 'ema2': 11, 'slip_atr_k': 0.005234042413053292, 'slip_spread_k': 0.564100745691078, 'spread_hl_frac': 0.0057938623200037105, 'bb_std_mult': 1.5731785017628122, 'rsi_os': 7, 'rsi_ob': 75, 'vol_spike': 0.19819017078297282, 'adx_thresh': 12.751232356841806, 'atr_min_pct': 0.01772870800497356, 'atr_max_pct': 0.06904820991324219, 'tp_mult': 1.1116119089363063, 'tsl_mult': 0.7800256861130149, 'strategy': 'breakout', 'time_stop': 154, 'use_sma': True, 'use_atr': False, 'use_adx': False, 'use_ema': False, 'use_spike': True, 'rsi_required': False, 'edge_k': 0.6264149234802797, 'edge_cap': 0.8261485251684362, 'bull_strategy': 'mean_reversion', 'bull_bb_std_mult': 3.5343693056833763, 'bull_rsi_os': 38, 'bull_rsi_ob': 80, 'bull_adx_thresh': 28.153396913185343, 'bull_atr_min_pct': 0.004348648227665143, 'bull_atr_max_pct': 0.07239797114335601, 'bull_tp_mult': 1.5937114241869141, 'bull_tsl_mult': 0.9664099616473032, 'bull_time_stop': 156, 'bull_use_sma': True, 'bull_use_ema': False, 'bull_use_atr': True, 'bull_use_adx': True, 'bull_use_spike': True, 'bull_rsi_required': False, 'bear_strategy': 'breakout', 'bear_bb_std_mult': 3.0712345625118513, 'bear_rsi_os': 42, 'bear_rsi_ob': 71, 'bear_adx_thresh': 34.753886598887696, 'bear_atr_min_pct': 0.0010023156128862124, 'bear_atr_max_pct': 0.12527175947446154, 'bear_tp_mult': 2.8332577798632776, 'bear_tsl_mult': 0.18819884677132825, 'bear_time_stop': 11, 'bear_use_sma': True, 'bear_use_ema': True, 'bear_use_atr': True, 'bear_use_adx': True, 'bear_use_spike': True, 'bear_rsi_required': False, 'sideways_strategy': 'mean_reversion', 'sideways_bb_std_mult': 2.8337684808157353, 'sideways_rsi_os': 31, 'sideways_rsi_ob': 61, 'sideways_adx_thresh': 32.96484885641706, 'sideways_atr_min_pct': 0.00347816026207263, 'sideways_atr_max_pct': 0.1128871796253587, 'sideways_tp_mult': 1.7858699161410967, 'sideways_tsl_mult': 0.9416420997317921, 'sideways_time_stop': 222, 'sideways_use_sma': True, 'sideways_use_ema': False, 'sideways_use_atr': False, 'sideways_use_adx': False, 'sideways_use_spike': True, 'sideways_rsi_required': False}.
[I 2025-09-01 09:32:31,247] Trial 190 finished with values: [-1000000000.0, 1000000000.0] and parameters: {'p_sma': 58, 'p_std': 49, 'p_atr': 13, 'p_adx': 11, 'rsi_period': 47, 'ema1': 7, 'ema2': 54, 'slip_atr_k': 0.011380073146453232, 'slip_spread_k': 0.5200725726211084, 'spread_hl_frac': 0.005616007370719581, 'bb_std_mult': 2.6327521366311233, 'rsi_os': 9, 'rsi_ob': 55, 'vol_spike': 0.20614183739644598, 'adx_thresh': 13.692745862241399, 'atr_min_pct': 0.018956780526224456, 'atr_max_pct': 0.07020255778583624, 'tp_mult': 1.1705714867367818, 'tsl_mult': 0.8567393695488046, 'strategy': 'breakout', 'time_stop': 157, 'use_sma': True, 'use_atr': True, 'use_adx': False, 'use_ema': False, 'use_spike': True, 'rsi_required': False, 'edge_k': 1.6048567598262267, 'edge_cap': 0.8327621826087243, 'bull_strategy': 'mean_reversion', 'bull_bb_std_mult': 3.4522325860763057, 'bull_rsi_os': 41, 'bull_rsi_ob': 80, 'bull_adx_thresh': 28.083253048270155, 'bull_atr_min_pct': 0.00527917070635785, 'bull_atr_max_pct': 0.08537332475645487, 'bull_tp_mult': 1.4184654060144997, 'bull_tsl_mult': 0.9721514913684906, 'bull_time_stop': 145, 'bull_use_sma': True, 'bull_use_ema': False, 'bull_use_atr': True, 'bull_use_adx': False, 'bull_use_spike': True, 'bull_rsi_required': False, 'bear_strategy': 'breakout', 'bear_bb_std_mult': 1.4222957555652394, 'bear_rsi_os': 45, 'bear_rsi_ob': 69, 'bear_adx_thresh': 34.928913933910245, 'bear_atr_min_pct': 0.027343255705397175, 'bear_atr_max_pct': 0.12749377286777291, 'bear_tp_mult': 2.8351363483375374, 'bear_tsl_mult': 0.8174863775611041, 'bear_time_stop': 22, 'bear_use_sma': False, 'bear_use_ema': True, 'bear_use_atr': True, 'bear_use_adx': True, 'bear_use_spike': True, 'bear_rsi_required': False, 'sideways_strategy': 'mean_reversion', 'sideways_bb_std_mult': 2.7042375732690465, 'sideways_rsi_os': 30, 'sideways_rsi_ob': 61, 'sideways_adx_thresh': 30.872709190492362, 'sideways_atr_min_pct': 0.014277903053533655, 'sideways_atr_max_pct': 0.11217464100020637, 'sideways_tp_mult': 1.1293309007588221, 'sideways_tsl_mult': 0.9432260471860354, 'sideways_time_stop': 257, 'sideways_use_sma': True, 'sideways_use_ema': False, 'sideways_use_atr': False, 'sideways_use_adx': False, 'sideways_use_spike': True, 'sideways_rsi_required': False}.
[I 2025-09-01 09:32:31,510] Trial 191 finished with values: [-0.007116778062647988, 0.007696958810651989] and parameters: {'p_sma': 58, 'p_std': 49, 'p_atr': 13, 'p_adx': 11, 'rsi_period': 42, 'ema1': 9, 'ema2': 32, 'slip_atr_k': 0.012946218218503742, 'slip_spread_k': 0.5171420885117848, 'spread_hl_frac': 0.0072839586270835146, 'bb_std_mult': 2.6240462394025945, 'rsi_os': 9, 'rsi_ob': 83, 'vol_spike': 0.21052747064162156, 'adx_thresh': 32.229446140202484, 'atr_min_pct': 0.018867572769102045, 'atr_max_pct': 0.058377684382194456, 'tp_mult': 1.6426140298025855, 'tsl_mult': 0.7322962184404314, 'strategy': 'breakout', 'time_stop': 260, 'use_sma': True, 'use_atr': True, 'use_adx': False, 'use_ema': False, 'use_spike': True, 'rsi_required': False, 'edge_k': 1.6016331018525687, 'edge_cap': 0.8666443801534517, 'bull_strategy': 'mean_reversion', 'bull_bb_std_mult': 3.4282254969344375, 'bull_rsi_os': 41, 'bull_rsi_ob': 78, 'bull_adx_thresh': 29.219985886994152, 'bull_atr_min_pct': 0.0028254494528724594, 'bull_atr_max_pct': 0.08442264906631149, 'bull_tp_mult': 1.5865968283814298, 'bull_tsl_mult': 0.941450879427247, 'bull_time_stop': 123, 'bull_use_sma': True, 'bull_use_ema': False, 'bull_use_atr': True, 'bull_use_adx': False, 'bull_use_spike': True, 'bull_rsi_required': False, 'bear_strategy': 'breakout', 'bear_bb_std_mult': 3.0409943543878084, 'bear_rsi_os': 43, 'bear_rsi_ob': 74, 'bear_adx_thresh': 33.4783682610958, 'bear_atr_min_pct': 0.029361486653035195, 'bear_atr_max_pct': 0.13179828123167883, 'bear_tp_mult': 2.7883253463696924, 'bear_tsl_mult': 0.8896282184829674, 'bear_time_stop': 5, 'bear_use_sma': False, 'bear_use_ema': True, 'bear_use_atr': True, 'bear_use_adx': True, 'bear_use_spike': True, 'bear_rsi_required': False, 'sideways_strategy': 'mean_reversion', 'sideways_bb_std_mult': 2.691380553390895, 'sideways_rsi_os': 30, 'sideways_rsi_ob': 62, 'sideways_adx_thresh': 30.71089018919529, 'sideways_atr_min_pct': 0.022645736232167035, 'sideways_atr_max_pct': 0.019889923946985306, 'sideways_tp_mult': 1.3320658562780776, 'sideways_tsl_mult': 0.9203045581339971, 'sideways_time_stop': 34, 'sideways_use_sma': True, 'sideways_use_ema': False, 'sideways_use_atr': False, 'sideways_use_adx': False, 'sideways_use_spike': True, 'sideways_rsi_required': False}.
[I 2025-09-01 09:32:31,741] Trial 192 finished with values: [-0.00868846892953501, 0.008932757813279289] and parameters: {'p_sma': 58, 'p_std': 44, 'p_atr': 28, 'p_adx': 11, 'rsi_period': 47, 'ema1': 7, 'ema2': 12, 'slip_atr_k': 0.011027608293652694, 'slip_spread_k': 0.5213271331557624, 'spread_hl_frac': 0.006581698773035177, 'bb_std_mult': 2.6207121378569145, 'rsi_os': 9, 'rsi_ob': 54, 'vol_spike': 0.21427714195049127, 'adx_thresh': 13.764265557339591, 'atr_min_pct': 0.02009916896952853, 'atr_max_pct': 0.0570153031530201, 'tp_mult': 1.52128363887331, 'tsl_mult': 0.8199812893362571, 'strategy': 'breakout', 'time_stop': 259, 'use_sma': False, 'use_atr': True, 'use_adx': False, 'use_ema': False, 'use_spike': False, 'rsi_required': False, 'edge_k': 1.6259129324163069, 'edge_cap': 0.868782307669568, 'bull_strategy': 'breakout', 'bull_bb_std_mult': 3.416642100601806, 'bull_rsi_os': 37, 'bull_rsi_ob': 78, 'bull_adx_thresh': 28.24437427647688, 'bull_atr_min_pct': 0.005288511686766495, 'bull_atr_max_pct': 0.08519835738669915, 'bull_tp_mult': 1.4443127554103583, 'bull_tsl_mult': 0.9340468626840913, 'bull_time_stop': 132, 'bull_use_sma': True, 'bull_use_ema': True, 'bull_use_atr': True, 'bull_use_adx': False, 'bull_use_spike': True, 'bull_rsi_required': False, 'bear_strategy': 'breakout', 'bear_bb_std_mult': 2.0983695665215816, 'bear_rsi_os': 46, 'bear_rsi_ob': 69, 'bear_adx_thresh': 33.361134962187265, 'bear_atr_min_pct': 0.010568551487313728, 'bear_atr_max_pct': 0.13173595911836108, 'bear_tp_mult': 2.8502403080375487, 'bear_tsl_mult': 0.8051715709042981, 'bear_time_stop': 24, 'bear_use_sma': False, 'bear_use_ema': True, 'bear_use_atr': True, 'bear_use_adx': True, 'bear_use_spike': True, 'bear_rsi_required': False, 'sideways_strategy': 'mean_reversion', 'sideways_bb_std_mult': 2.7981329158293176, 'sideways_rsi_os': 46, 'sideways_rsi_ob': 62, 'sideways_adx_thresh': 30.81873107104663, 'sideways_atr_min_pct': 0.0037990129549744065, 'sideways_atr_max_pct': 0.07248183082100532, 'sideways_tp_mult': 1.7213743718706502, 'sideways_tsl_mult': 0.9777677632366373, 'sideways_time_stop': 89, 'sideways_use_sma': True, 'sideways_use_ema': False, 'sideways_use_atr': False, 'sideways_use_adx': False, 'sideways_use_spike': True, 'sideways_rsi_required': False}.
[I 2025-09-01 09:32:31,912] Trial 193 finished with values: [-1000000000.0, 1000000000.0] and parameters: {'p_sma': 58, 'p_std': 44, 'p_atr': 28, 'p_adx': 11, 'rsi_period': 42, 'ema1': 7, 'ema2': 31, 'slip_atr_k': 0.009203564725376673, 'slip_spread_k': 0.507777821589484, 'spread_hl_frac': 0.008356757611269272, 'bb_std_mult': 2.6210847613909967, 'rsi_os': 10, 'rsi_ob': 54, 'vol_spike': 0.20845208511645513, 'adx_thresh': 13.784109450139077, 'atr_min_pct': 0.01903586555476906, 'atr_max_pct': 0.058697609546701425, 'tp_mult': 1.982479257602681, 'tsl_mult': 0.7258436396770915, 'strategy': 'breakout', 'time_stop': 297, 'use_sma': False, 'use_atr': True, 'use_adx': False, 'use_ema': False, 'use_spike': False, 'rsi_required': True, 'edge_k': 0.7372085348021996, 'edge_cap': 0.8676655347560628, 'bull_strategy': 'breakout', 'bull_bb_std_mult': 3.4230117600043606, 'bull_rsi_os': 41, 'bull_rsi_ob': 78, 'bull_adx_thresh': 28.374188183391183, 'bull_atr_min_pct': 0.00518829869029697, 'bull_atr_max_pct': 0.07922819246793418, 'bull_tp_mult': 1.4605404159503317, 'bull_tsl_mult': 0.9380945584306873, 'bull_time_stop': 133, 'bull_use_sma': True, 'bull_use_ema': True, 'bull_use_atr': True, 'bull_use_adx': False, 'bull_use_spike': True, 'bull_rsi_required': False, 'bear_strategy': 'breakout', 'bear_bb_std_mult': 1.4968234772018654, 'bear_rsi_os': 45, 'bear_rsi_ob': 74, 'bear_adx_thresh': 33.29597769922152, 'bear_atr_min_pct': 0.02433609149522143, 'bear_atr_max_pct': 0.12108041073704372, 'bear_tp_mult': 2.439550401460624, 'bear_tsl_mult': 0.8030881400134295, 'bear_time_stop': 23, 'bear_use_sma': False, 'bear_use_ema': True, 'bear_use_atr': True, 'bear_use_adx': True, 'bear_use_spike': True, 'bear_rsi_required': False, 'sideways_strategy': 'mean_reversion', 'sideways_bb_std_mult': 2.6519688747365064, 'sideways_rsi_os': 41, 'sideways_rsi_ob': 64, 'sideways_adx_thresh': 30.919838126985802, 'sideways_atr_min_pct': 0.0058018600107039, 'sideways_atr_max_pct': 0.08131189740807733, 'sideways_tp_mult': 1.7121617069808974, 'sideways_tsl_mult': 0.9141765575022438, 'sideways_time_stop': 260, 'sideways_use_sma': True, 'sideways_use_ema': False, 'sideways_use_atr': False, 'sideways_use_adx': False, 'sideways_use_spike': True, 'sideways_rsi_required': False}.
[I 2025-09-01 09:33:12,935] Trial 195 finished with values: [-1000000000.0, 1000000000.0] and parameters: {'p_sma': 60, 'p_std': 44, 'p_atr': 28, 'p_adx': 11, 'rsi_period': 42, 'ema1': 8, 'ema2': 31, 'slip_atr_k': 0.014447080068348217, 'slip_spread_k': 0.5984352134385289, 'spread_hl_frac': 0.006827346722492336, 'bb_std_mult': 2.638387855442664, 'rsi_os': 10, 'rsi_ob': 54, 'vol_spike': 0.18407963869119148, 'adx_thresh': 21.1209258754828, 'atr_min_pct': 0.01992896129882742, 'atr_max_pct': 0.05740856455283019, 'tp_mult': 2.469130149733999, 'tsl_mult': 0.7386885927517677, 'strategy': 'breakout', 'time_stop': 142, 'use_sma': False, 'use_atr': True, 'use_adx': True, 'use_ema': False, 'use_spike': False, 'rsi_required': True, 'edge_k': 1.4113099295272555, 'edge_cap': 0.8717068863578586, 'bull_strategy': 'breakout', 'bull_bb_std_mult': 3.323066897467576, 'bull_rsi_os': 40, 'bull_rsi_ob': 82, 'bull_adx_thresh': 29.45489416317551, 'bull_atr_min_pct': 0.005099411375573299, 'bull_atr_max_pct': 0.07890850424441183, 'bull_tp_mult': 1.5045628002788742, 'bull_tsl_mult': 0.9351345231362586, 'bull_time_stop': 133, 'bull_use_sma': True, 'bull_use_ema': True, 'bull_use_atr': True, 'bull_use_adx': False, 'bull_use_spike': True, 'bull_rsi_required': False, 'bear_strategy': 'breakout', 'bear_bb_std_mult': 2.6932251062672847, 'bear_rsi_os': 45, 'bear_rsi_ob': 74, 'bear_adx_thresh': 33.445245754608614, 'bear_atr_min_pct': 0.012682322662446201, 'bear_atr_max_pct': 0.12049604437002373, 'bear_tp_mult': 2.4288278361061373, 'bear_tsl_mult': 0.4053086322250429, 'bear_time_stop': 5, 'bear_use_sma': False, 'bear_use_ema': True, 'bear_use_atr': True, 'bear_use_adx': True, 'bear_use_spike': True, 'bear_rsi_required': False, 'sideways_strategy': 'mean_reversion', 'sideways_bb_std_mult': 2.6254085799710545, 'sideways_rsi_os': 41, 'sideways_rsi_ob': 64, 'sideways_adx_thresh': 31.48462369180598, 'sideways_atr_min_pct': 0.010953426406046237, 'sideways_atr_max_pct': 0.1338084819035741, 'sideways_tp_mult': 1.3317592182387537, 'sideways_tsl_mult': 0.9756160850827945, 'sideways_time_stop': 211, 'sideways_use_sma': False, 'sideways_use_ema': False, 'sideways_use_atr': False, 'sideways_use_adx': True, 'sideways_use_spike': True, 'sideways_rsi_required': False}.
[I 2025-09-01 09:33:12,946] Trial 197 finished with values: [-0.0067589782638664, 0.008629059527786495] and parameters: {'p_sma': 60, 'p_std': 43, 'p_atr': 7, 'p_adx': 24, 'rsi_period': 70, 'ema1': 8, 'ema2': 10, 'slip_atr_k': 0.014515793021106768, 'slip_spread_k': 0.6041245796418898, 'spread_hl_frac': 0.006942422282551227, 'bb_std_mult': 2.487363963058955, 'rsi_os': 9, 'rsi_ob': 77, 'vol_spike': 0.21307263347228395, 'adx_thresh': 10.657803567747612, 'atr_min_pct': 0.02002585873013387, 'atr_max_pct': 0.06451187007542575, 'tp_mult': 2.6163490088069272, 'tsl_mult': 0.8208097503942564, 'strategy': 'breakout', 'time_stop': 222, 'use_sma': True, 'use_atr': True, 'use_adx': True, 'use_ema': True, 'use_spike': False, 'rsi_required': False, 'edge_k': 0.18954605678721237, 'edge_cap': 0.8846926716849244, 'bull_strategy': 'breakout', 'bull_bb_std_mult': 3.2542040856895427, 'bull_rsi_os': 40, 'bull_rsi_ob': 78, 'bull_adx_thresh': 29.41078433168266, 'bull_atr_min_pct': 0.0030465106227321424, 'bull_atr_max_pct': 0.07677586347697019, 'bull_tp_mult': 1.5073466525747188, 'bull_tsl_mult': 0.9282398776638523, 'bull_time_stop': 143, 'bull_use_sma': True, 'bull_use_ema': True, 'bull_use_atr': True, 'bull_use_adx': False, 'bull_use_spike': True, 'bull_rsi_required': True, 'bear_strategy': 'breakout', 'bear_bb_std_mult': 1.6873065999864174, 'bear_rsi_os': 46, 'bear_rsi_ob': 73, 'bear_adx_thresh': 32.80069888938199, 'bear_atr_min_pct': 0.028061989293391647, 'bear_atr_max_pct': 0.13421851690480685, 'bear_tp_mult': 2.8611146384999993, 'bear_tsl_mult': 0.4062718635825536, 'bear_time_stop': 6, 'bear_use_sma': False, 'bear_use_ema': True, 'bear_use_atr': False, 'bear_use_adx': True, 'bear_use_spike': True, 'bear_rsi_required': False, 'sideways_strategy': 'mean_reversion', 'sideways_bb_std_mult': 2.5211903444258335, 'sideways_rsi_os': 30, 'sideways_rsi_ob': 62, 'sideways_adx_thresh': 31.746130572450376, 'sideways_atr_min_pct': 0.010992567918345648, 'sideways_atr_max_pct': 0.018712825233612493, 'sideways_tp_mult': 1.3371321881574758, 'sideways_tsl_mult': 0.9702856756794656, 'sideways_time_stop': 80, 'sideways_use_sma': False, 'sideways_use_ema': False, 'sideways_use_atr': False, 'sideways_use_adx': True, 'sideways_use_spike': True, 'sideways_rsi_required': False}.
[I 2025-09-01 09:33:13,677] Trial 194 finished with values: [-0.0027017502221802214, 0.0034415434242780103] and parameters: {'p_sma': 34, 'p_std': 44, 'p_atr': 28, 'p_adx': 11, 'rsi_period': 79, 'ema1': 7, 'ema2': 32, 'slip_atr_k': 0.013902614538450604, 'slip_spread_k': 0.6055914884529325, 'spread_hl_frac': 0.006737681603533445, 'bb_std_mult': 2.621872428369919, 'rsi_os': 10, 'rsi_ob': 92, 'vol_spike': 0.21422529517031927, 'adx_thresh': 10.621359377501298, 'atr_min_pct': 0.02004200463690702, 'atr_max_pct': 0.05780011462498248, 'tp_mult': 2.621113399149101, 'tsl_mult': 0.8053934422991201, 'strategy': 'breakout', 'time_stop': 241, 'use_sma': False, 'use_atr': True, 'use_adx': False, 'use_ema': False, 'use_spike': False, 'rsi_required': True, 'edge_k': 0.14843876023392932, 'edge_cap': 0.8618164080720156, 'bull_strategy': 'breakout', 'bull_bb_std_mult': 3.322417096510062, 'bull_rsi_os': 37, 'bull_rsi_ob': 78, 'bull_adx_thresh': 29.514343869100554, 'bull_atr_min_pct': 0.002911862608899347, 'bull_atr_max_pct': 0.07682848344247034, 'bull_tp_mult': 1.4592858190879257, 'bull_tsl_mult': 0.9300024425482187, 'bull_time_stop': 131, 'bull_use_sma': True, 'bull_use_ema': True, 'bull_use_atr': True, 'bull_use_adx': False, 'bull_use_spike': True, 'bull_rsi_required': True, 'bear_strategy': 'breakout', 'bear_bb_std_mult': 1.4843411566223033, 'bear_rsi_os': 46, 'bear_rsi_ob': 74, 'bear_adx_thresh': 33.42158316473859, 'bear_atr_min_pct': 0.028367658539514673, 'bear_atr_max_pct': 0.12129949374907949, 'bear_tp_mult': 2.4031370153523786, 'bear_tsl_mult': 0.7951415728291863, 'bear_time_stop': 5, 'bear_use_sma': False, 'bear_use_ema': True, 'bear_use_atr': True, 'bear_use_adx': True, 'bear_use_spike': True, 'bear_rsi_required': False, 'sideways_strategy': 'mean_reversion', 'sideways_bb_std_mult': 2.5992146212964364, 'sideways_rsi_os': 47, 'sideways_rsi_ob': 62, 'sideways_adx_thresh': 31.57134109314303, 'sideways_atr_min_pct': 0.01080879495018279, 'sideways_atr_max_pct': 0.08235791138293433, 'sideways_tp_mult': 1.3431259591501439, 'sideways_tsl_mult': 0.9785023260647558, 'sideways_time_stop': 90, 'sideways_use_sma': True, 'sideways_use_ema': False, 'sideways_use_atr': False, 'sideways_use_adx': False, 'sideways_use_spike': True, 'sideways_rsi_required': False}.
[I 2025-09-01 09:33:14,075] Trial 196 finished with values: [-0.019421942193793673, 0.01927577876421339] and parameters: {'p_sma': 59, 'p_std': 43, 'p_atr': 16, 'p_adx': 11, 'rsi_period': 79, 'ema1': 8, 'ema2': 10, 'slip_atr_k': 0.07454241990042715, 'slip_spread_k': 0.5924767793073903, 'spread_hl_frac': 0.006780925726511226, 'bb_std_mult': 1.4667253223557744, 'rsi_os': 9, 'rsi_ob': 57, 'vol_spike': 0.21354342008459895, 'adx_thresh': 11.605133157413762, 'atr_min_pct': 0.02008630191691913, 'atr_max_pct': 0.06479726552707343, 'tp_mult': 2.6083840288303533, 'tsl_mult': 0.8176243922834594, 'strategy': 'breakout', 'time_stop': 262, 'use_sma': True, 'use_atr': True, 'use_adx': True, 'use_ema': True, 'use_spike': False, 'rsi_required': False, 'edge_k': 0.6049877023637203, 'edge_cap': 0.8556170834256633, 'bull_strategy': 'breakout', 'bull_bb_std_mult': 3.346111653930447, 'bull_rsi_os': 40, 'bull_rsi_ob': 76, 'bull_adx_thresh': 26.798825195594596, 'bull_atr_min_pct': 0.0026757797717770863, 'bull_atr_max_pct': 0.08298109374516066, 'bull_tp_mult': 1.5180981907011228, 'bull_tsl_mult': 0.9301603525001763, 'bull_time_stop': 121, 'bull_use_sma': True, 'bull_use_ema': True, 'bull_use_atr': True, 'bull_use_adx': False, 'bull_use_spike': True, 'bull_rsi_required': True, 'bear_strategy': 'breakout', 'bear_bb_std_mult': 1.494906723469912, 'bear_rsi_os': 46, 'bear_rsi_ob': 73, 'bear_adx_thresh': 33.91896447586061, 'bear_atr_min_pct': 0.02818455708252409, 'bear_atr_max_pct': 0.13287755606430385, 'bear_tp_mult': 2.7870712768533856, 'bear_tsl_mult': 0.8320769635638561, 'bear_time_stop': 6, 'bear_use_sma': False, 'bear_use_ema': True, 'bear_use_atr': False, 'bear_use_adx': True, 'bear_use_spike': True, 'bear_rsi_required': False, 'sideways_strategy': 'mean_reversion', 'sideways_bb_std_mult': 2.5671307636549607, 'sideways_rsi_os': 30, 'sideways_rsi_ob': 60, 'sideways_adx_thresh': 31.536164951149495, 'sideways_atr_min_pct': 0.01068439453938242, 'sideways_atr_max_pct': 0.13219069452518736, 'sideways_tp_mult': 2.319254332931873, 'sideways_tsl_mult': 0.9726696734266024, 'sideways_time_stop': 211, 'sideways_use_sma': False, 'sideways_use_ema': False, 'sideways_use_atr': False, 'sideways_use_adx': True, 'sideways_use_spike': True, 'sideways_rsi_required': False}.
