[I 2025-09-01 09:33:55,843] Trial 199 finished with values: [-0.00466177031483872, 0.0049450238134617535] and parameters: {'p_sma': 34, 'p_std': 43, 'p_atr': 16, 'p_adx': 11, 'rsi_period': 79, 'ema1': 10, 'ema2': 20, 'slip_atr_k': 0.01455893679114196, 'slip_spread_k': 0.6276801010531906, 'spread_hl_frac': 0.0035936941551949105, 'bb_std_mult': 0.9656625255600522, 'rsi_os': 6, 'rsi_ob': 83, 'vol_spike': 0.21185927778614258, 'adx_thresh': 10.799052085173727, 'atr_min_pct': 0.019925178080051426, 'atr_max_pct': 0.06437965982113904, 'tp_mult': 1.6248865865132807, 'tsl_mult': 0.8060878046063045, 'strategy': 'breakout', 'time_stop': 204, 'use_sma': True, 'use_atr': True, 'use_adx': False, 'use_ema': True, 'use_spike': True, 'rsi_required': False, 'edge_k': 0.5941770203284751, 'edge_cap': 0.8576651196427365, 'bull_strategy': 'mean_reversion', 'bull_bb_std_mult': 3.500517661524211, 'bull_rsi_os': 37, 'bull_rsi_ob': 78, 'bull_adx_thresh': 26.82443435406057, 'bull_atr_min_pct': 0.002998645742918008, 'bull_atr_max_pct': 0.07612633484029364, 'bull_tp_mult': 1.6449891416571016, 'bull_tsl_mult': 0.926422157196528, 'bull_time_stop': 123, 'bull_use_sma': True, 'bull_use_ema': False, 'bull_use_atr': True, 'bull_use_adx': False, 'bull_use_spike': False, 'bull_rsi_required': True, 'bear_strategy': 'mean_reversion', 'bear_bb_std_mult': 1.503432889595717, 'bear_rsi_os': 46, 'bear_rsi_ob': 69, 'bear_adx_thresh': 32.75016365448757, 'bear_atr_min_pct': 0.02816411648302424, 'bear_atr_max_pct': 0.131885330665303, 'bear_tp_mult': 2.1796209662115467, 'bear_tsl_mult': 0.7634596191186538, 'bear_time_stop': 5, 'bear_use_sma': False, 'bear_use_ema': True, 'bear_use_atr': False, 'bear_use_adx': False, 'bear_use_spike': True, 'bear_rsi_required': False, 'sideways_strategy': 'mean_reversion', 'sideways_bb_std_mult': 2.527337105169481, 'sideways_rsi_os': 30, 'sideways_rsi_ob': 62, 'sideways_adx_thresh': 32.15871988391844, 'sideways_atr_min_pct': 0.0026117678285266354, 'sideways_atr_max_pct': 0.08832816109692887, 'sideways_tp_mult': 2.9552335347390346, 'sideways_tsl_mult': 0.9190797204307704, 'sideways_time_stop': 220, 'sideways_use_sma': True, 'sideways_use_ema': True, 'sideways_use_atr': False, 'sideways_use_adx': False, 'sideways_use_spike': True, 'sideways_rsi_required': False}.
[I 2025-09-01 09:33:56,344] Trial 198 finished with values: [-1000000000.0, 1000000000.0] and parameters: {'p_sma': 59, 'p_std': 43, 'p_atr': 7, 'p_adx': 24, 'rsi_period': 44, 'ema1': 10, 'ema2': 10, 'slip_atr_k': 0.0002122105337187992, 'slip_spread_k': 0.6380788908870966, 'spread_hl_frac': 0.006905581435723691, 'bb_std_mult': 2.4809684556854577, 'rsi_os': 9, 'rsi_ob': 84, 'vol_spike': 0.21218904211257647, 'adx_thresh': 11.496519276911563, 'atr_min_pct': 0.017143221560731902, 'atr_max_pct': 0.06437161844388069, 'tp_mult': 2.6262066296444173, 'tsl_mult': 0.8163514939032648, 'strategy': 'breakout', 'time_stop': 262, 'use_sma': True, 'use_atr': True, 'use_adx': False, 'use_ema': True, 'use_spike': True, 'rsi_required': False, 'edge_k': 0.6092201397181919, 'edge_cap': 0.8462484997898116, 'bull_strategy': 'mean_reversion', 'bull_bb_std_mult': 3.2341347245744103, 'bull_rsi_os': 37, 'bull_rsi_ob': 78, 'bull_adx_thresh': 27.09939572723692, 'bull_atr_min_pct': 0.0028391678678088283, 'bull_atr_max_pct': 0.0764566288692823, 'bull_tp_mult': 1.550289070694926, 'bull_tsl_mult': 0.9201045378925314, 'bull_time_stop': 118, 'bull_use_sma': True, 'bull_use_ema': False, 'bull_use_atr': True, 'bull_use_adx': False, 'bull_use_spike': False, 'bull_rsi_required': True, 'bear_strategy': 'mean_reversion', 'bear_bb_std_mult': 2.0943000290022735, 'bear_rsi_os': 46, 'bear_rsi_ob': 73, 'bear_adx_thresh': 32.68152849607873, 'bear_atr_min_pct': 0.017723036510661365, 'bear_atr_max_pct': 0.1314552314361147, 'bear_tp_mult': 2.8653958508976447, 'bear_tsl_mult': 0.8860203392577728, 'bear_time_stop': 5, 'bear_use_sma': False, 'bear_use_ema': True, 'bear_use_atr': False, 'bear_use_adx': False, 'bear_use_spike': True, 'bear_rsi_required': False, 'sideways_strategy': 'mean_reversion', 'sideways_bb_std_mult': 2.5155834645807174, 'sideways_rsi_os': 7, 'sideways_rsi_ob': 62, 'sideways_adx_thresh': 32.42770127156596, 'sideways_atr_min_pct': 0.02315186450712963, 'sideways_atr_max_pct': 0.018537221439293997, 'sideways_tp_mult': 1.3448504949262128, 'sideways_tsl_mult': 0.9185456566640287, 'sideways_time_stop': 160, 'sideways_use_sma': True, 'sideways_use_ema': True, 'sideways_use_atr': False, 'sideways_use_adx': False, 'sideways_use_spike': True, 'sideways_rsi_required': False}.
[I 2025-09-01 09:33:56,884] Trial 201 finished with values: [-1000000000.0, 1000000000.0] and parameters: {'p_sma': 35, 'p_std': 45, 'p_atr': 7, 'p_adx': 18, 'rsi_period': 70, 'ema1': 10, 'ema2': 49, 'slip_atr_k': 0.20233011887541036, 'slip_spread_k': 0.6333888535530618, 'spread_hl_frac': 0.0030269398983062794, 'bb_std_mult': 2.786459984206819, 'rsi_os': 6, 'rsi_ob': 58, 'vol_spike': 0.19081957951646428, 'adx_thresh': 10.747986706204799, 'atr_min_pct': 0.01975408060915595, 'atr_max_pct': 0.062145843065942334, 'tp_mult': 1.6115615309171556, 'tsl_mult': 0.8129313196549796, 'strategy': 'breakout', 'time_stop': 239, 'use_sma': True, 'use_atr': True, 'use_adx': False, 'use_ema': False, 'use_spike': True, 'rsi_required': False, 'edge_k': 0.17172241135720734, 'edge_cap': 0.8826056104548705, 'bull_strategy': 'mean_reversion', 'bull_bb_std_mult': 3.2330666353525794, 'bull_rsi_os': 39, 'bull_rsi_ob': 78, 'bull_adx_thresh': 27.222055564562567, 'bull_atr_min_pct': 0.016733231958337463, 'bull_atr_max_pct': 0.07616009060862462, 'bull_tp_mult': 1.4430216436031913, 'bull_tsl_mult': 0.950495045309064, 'bull_time_stop': 142, 'bull_use_sma': True, 'bull_use_ema': False, 'bull_use_atr': True, 'bull_use_adx': False, 'bull_use_spike': False, 'bull_rsi_required': True, 'bear_strategy': 'breakout', 'bear_bb_std_mult': 0.5931054384811021, 'bear_rsi_os': 40, 'bear_rsi_ob': 69, 'bear_adx_thresh': 32.80951298575482, 'bear_atr_min_pct': 0.009167877344907665, 'bear_atr_max_pct': 0.13142744836260362, 'bear_tp_mult': 1.3079786394438666, 'bear_tsl_mult': 0.7828192844416395, 'bear_time_stop': 13, 'bear_use_sma': False, 'bear_use_ema': True, 'bear_use_atr': False, 'bear_use_adx': False, 'bear_use_spike': True, 'bear_rsi_required': False, 'sideways_strategy': 'mean_reversion', 'sideways_bb_std_mult': 2.5069559662590954, 'sideways_rsi_os': 8, 'sideways_rsi_ob': 62, 'sideways_adx_thresh': 32.24080902392519, 'sideways_atr_min_pct': 0.01585906162286903, 'sideways_atr_max_pct': 0.019866307336765976, 'sideways_tp_mult': 1.3585982364317628, 'sideways_tsl_mult': 0.9556908264868212, 'sideways_time_stop': 77, 'sideways_use_sma': True, 'sideways_use_ema': True, 'sideways_use_atr': False, 'sideways_use_adx': False, 'sideways_use_spike': True, 'sideways_rsi_required': False}.
[I 2025-09-01 09:33:56,885] Trial 200 finished with values: [-0.008434718440893496, 0.00807291046210967] and parameters: {'p_sma': 46, 'p_std': 45, 'p_atr': 7, 'p_adx': 21, 'rsi_period': 71, 'ema1': 10, 'ema2': 10, 'slip_atr_k': 0.07519534014378197, 'slip_spread_k': 0.6453395256675984, 'spread_hl_frac': 0.006831937850234917, 'bb_std_mult': 2.100971051323313, 'rsi_os': 6, 'rsi_ob': 91, 'vol_spike': 0.21687252338468005, 'adx_thresh': 11.734770728880868, 'atr_min_pct': 0.020061460138792293, 'atr_max_pct': 0.06379912817067908, 'tp_mult': 2.6264861995778825, 'tsl_mult': 0.8186511260313531, 'strategy': 'breakout', 'time_stop': 220, 'use_sma': True, 'use_atr': True, 'use_adx': False, 'use_ema': True, 'use_spike': True, 'rsi_required': False, 'edge_k': 0.6022737322856272, 'edge_cap': 0.8512566832855368, 'bull_strategy': 'mean_reversion', 'bull_bb_std_mult': 3.3272362454229563, 'bull_rsi_os': 39, 'bull_rsi_ob': 76, 'bull_adx_thresh': 27.025972138167802, 'bull_atr_min_pct': 0.0028774158512068805, 'bull_atr_max_pct': 0.07588240615342974, 'bull_tp_mult': 1.5635442957553707, 'bull_tsl_mult': 0.9506420023806416, 'bull_time_stop': 120, 'bull_use_sma': True, 'bull_use_ema': False, 'bull_use_atr': True, 'bull_use_adx': False, 'bull_use_spike': False, 'bull_rsi_required': True, 'bear_strategy': 'breakout', 'bear_bb_std_mult': 0.6037677754182798, 'bear_rsi_os': 46, 'bear_rsi_ob': 69, 'bear_adx_thresh': 33.920001184840615, 'bear_atr_min_pct': 0.0021163390367621576, 'bear_atr_max_pct': 0.134014087134231, 'bear_tp_mult': 2.8581542505934716, 'bear_tsl_mult': 0.7635406189713538, 'bear_time_stop': 10, 'bear_use_sma': False, 'bear_use_ema': True, 'bear_use_atr': False, 'bear_use_adx': False, 'bear_use_spike': True, 'bear_rsi_required': False, 'sideways_strategy': 'mean_reversion', 'sideways_bb_std_mult': 2.5300038083457057, 'sideways_rsi_os': 46, 'sideways_rsi_ob': 62, 'sideways_adx_thresh': 31.9980808330092, 'sideways_atr_min_pct': 0.022348326079598576, 'sideways_atr_max_pct': 0.01786534619418579, 'sideways_tp_mult': 1.3583600714731705, 'sideways_tsl_mult': 0.9761023234668478, 'sideways_time_stop': 84, 'sideways_use_sma': True, 'sideways_use_ema': True, 'sideways_use_atr': False, 'sideways_use_adx': False, 'sideways_use_spike': True, 'sideways_rsi_required': False}.
[I 2025-09-01 09:34:38,219] Trial 205 finished with values: [-1000000000.0, 1000000000.0] and parameters: {'p_sma': 33, 'p_std': 45, 'p_atr': 23, 'p_adx': 19, 'rsi_period': 59, 'ema1': 7, 'ema2': 38, 'slip_atr_k': 0.015442121876529918, 'slip_spread_k': 0.5798183636594357, 'spread_hl_frac': 0.01045015416074009, 'bb_std_mult': 2.7112420190798447, 'rsi_os': 8, 'rsi_ob': 92, 'vol_spike': 0.17884643502868117, 'adx_thresh': 32.72164381943036, 'atr_min_pct': 0.01902202483639671, 'atr_max_pct': 0.07247323984055727, 'tp_mult': 2.507383890523835, 'tsl_mult': 0.8849647094120803, 'strategy': 'breakout', 'time_stop': 197, 'use_sma': True, 'use_atr': True, 'use_adx': False, 'use_ema': False, 'use_spike': True, 'rsi_required': True, 'edge_k': 0.6761312420540014, 'edge_cap': 0.8434773102229085, 'bull_strategy': 'mean_reversion', 'bull_bb_std_mult': 3.5148966034464286, 'bull_rsi_os': 37, 'bull_rsi_ob': 82, 'bull_adx_thresh': 29.06486480257552, 'bull_atr_min_pct': 0.02803013834735061, 'bull_atr_max_pct': 0.08619655673043426, 'bull_tp_mult': 1.6554629141981303, 'bull_tsl_mult': 0.8844818120292812, 'bull_time_stop': 124, 'bull_use_sma': True, 'bull_use_ema': False, 'bull_use_atr': False, 'bull_use_adx': False, 'bull_use_spike': True, 'bull_rsi_required': False, 'bear_strategy': 'breakout', 'bear_bb_std_mult': 1.3358741621577799, 'bear_rsi_os': 43, 'bear_rsi_ob': 75, 'bear_adx_thresh': 33.91602306539934, 'bear_atr_min_pct': 0.029275838693036554, 'bear_atr_max_pct': 0.12851558581367542, 'bear_tp_mult': 2.195427336240235, 'bear_tsl_mult': 0.7978904861166366, 'bear_time_stop': 11, 'bear_use_sma': False, 'bear_use_ema': True, 'bear_use_atr': True, 'bear_use_adx': True, 'bear_use_spike': True, 'bear_rsi_required': True, 'sideways_strategy': 'mean_reversion', 'sideways_bb_std_mult': 2.6122293925844637, 'sideways_rsi_os': 46, 'sideways_rsi_ob': 60, 'sideways_adx_thresh': 30.59935770440444, 'sideways_atr_min_pct': 0.029139770563433767, 'sideways_atr_max_pct': 0.08815433609954598, 'sideways_tp_mult': 1.240598426981936, 'sideways_tsl_mult': 0.9225229617692166, 'sideways_time_stop': 86, 'sideways_use_sma': True, 'sideways_use_ema': False, 'sideways_use_atr': True, 'sideways_use_adx': False, 'sideways_use_spike': True, 'sideways_rsi_required': True}.
[I 2025-09-01 09:34:38,725] Trial 204 finished with values: [-1000000000.0, 1000000000.0] and parameters: {'p_sma': 57, 'p_std': 46, 'p_atr': 23, 'p_adx': 19, 'rsi_period': 45, 'ema1': 7, 'ema2': 23, 'slip_atr_k': 0.016522375569988174, 'slip_spread_k': 0.5863366047610908, 'spread_hl_frac': 0.0036797628399571802, 'bb_std_mult': 0.9966248247506384, 'rsi_os': 8, 'rsi_ob': 56, 'vol_spike': 0.2046451193541046, 'adx_thresh': 12.228582729462698, 'atr_min_pct': 0.02046971192345306, 'atr_max_pct': 0.07222296862176592, 'tp_mult': 2.511249785496024, 'tsl_mult': 0.8665093672372413, 'strategy': 'breakout', 'time_stop': 135, 'use_sma': True, 'use_atr': True, 'use_adx': False, 'use_ema': False, 'use_spike': True, 'rsi_required': True, 'edge_k': 1.324657342089284, 'edge_cap': 0.846987641633622, 'bull_strategy': 'mean_reversion', 'bull_bb_std_mult': 3.523052712805512, 'bull_rsi_os': 38, 'bull_rsi_ob': 82, 'bull_adx_thresh': 29.244599269816753, 'bull_atr_min_pct': 0.005933092460729613, 'bull_atr_max_pct': 0.0873443935919514, 'bull_tp_mult': 1.6397090993542007, 'bull_tsl_mult': 0.889005779380005, 'bull_time_stop': 163, 'bull_use_sma': True, 'bull_use_ema': False, 'bull_use_atr': False, 'bull_use_adx': False, 'bull_use_spike': True, 'bull_rsi_required': False, 'bear_strategy': 'breakout', 'bear_bb_std_mult': 1.36825325873798, 'bear_rsi_os': 43, 'bear_rsi_ob': 72, 'bear_adx_thresh': 33.78506119762105, 'bear_atr_min_pct': 0.02948472582761239, 'bear_atr_max_pct': 0.12237368592162244, 'bear_tp_mult': 2.8509154474017824, 'bear_tsl_mult': 0.7639129137710642, 'bear_time_stop': 11, 'bear_use_sma': False, 'bear_use_ema': True, 'bear_use_atr': True, 'bear_use_adx': True, 'bear_use_spike': True, 'bear_rsi_required': True, 'sideways_strategy': 'mean_reversion', 'sideways_bb_std_mult': 2.614406686677096, 'sideways_rsi_os': 46, 'sideways_rsi_ob': 70, 'sideways_adx_thresh': 29.529375642962282, 'sideways_atr_min_pct': 0.011869519627249516, 'sideways_atr_max_pct': 0.08818088256147442, 'sideways_tp_mult': 2.5734774639558715, 'sideways_tsl_mult': 0.922984464141654, 'sideways_time_stop': 169, 'sideways_use_sma': True, 'sideways_use_ema': False, 'sideways_use_atr': True, 'sideways_use_adx': False, 'sideways_use_spike': True, 'sideways_rsi_required': True}.
[I 2025-09-01 09:34:39,047] Trial 203 finished with values: [-1000000000.0, 1000000000.0] and parameters: {'p_sma': 33, 'p_std': 45, 'p_atr': 23, 'p_adx': 14, 'rsi_period': 70, 'ema1': 7, 'ema2': 39, 'slip_atr_k': 0.015447621234858959, 'slip_spread_k': 0.6273635692881001, 'spread_hl_frac': 0.01036935332928707, 'bb_std_mult': 2.1315694527538667, 'rsi_os': 6, 'rsi_ob': 58, 'vol_spike': 0.19165302307657495, 'adx_thresh': 10.948406866676242, 'atr_min_pct': 0.0193153258456754, 'atr_max_pct': 0.07165845434918161, 'tp_mult': 1.520384572747792, 'tsl_mult': 0.8777593703526956, 'strategy': 'breakout', 'time_stop': 165, 'use_sma': True, 'use_atr': True, 'use_adx': False, 'use_ema': False, 'use_spike': True, 'rsi_required': True, 'edge_k': 0.800162822899033, 'edge_cap': 0.8871956911331595, 'bull_strategy': 'mean_reversion', 'bull_bb_std_mult': 3.5088438577781664, 'bull_rsi_os': 39, 'bull_rsi_ob': 82, 'bull_adx_thresh': 25.259837934188525, 'bull_atr_min_pct': 0.003219041854602908, 'bull_atr_max_pct': 0.08684127635077335, 'bull_tp_mult': 1.662332966255498, 'bull_tsl_mult': 0.9539075419870825, 'bull_time_stop': 143, 'bull_use_sma': True, 'bull_use_ema': False, 'bull_use_atr': True, 'bull_use_adx': False, 'bull_use_spike': True, 'bull_rsi_required': False, 'bear_strategy': 'breakout', 'bear_bb_std_mult': 0.6282441512668537, 'bear_rsi_os': 40, 'bear_rsi_ob': 69, 'bear_adx_thresh': 33.84714212961892, 'bear_atr_min_pct': 0.029101342352800107, 'bear_atr_max_pct': 0.14090201765962512, 'bear_tp_mult': 1.2742833948413115, 'bear_tsl_mult': 0.7640340293270956, 'bear_time_stop': 13, 'bear_use_sma': False, 'bear_use_ema': True, 'bear_use_atr': True, 'bear_use_adx': True, 'bear_use_spike': True, 'bear_rsi_required': False, 'sideways_strategy': 'mean_reversion', 'sideways_bb_std_mult': 2.618679225869198, 'sideways_rsi_os': 9, 'sideways_rsi_ob': 62, 'sideways_adx_thresh': 29.70578262722999, 'sideways_atr_min_pct': 0.02893119463934779, 'sideways_atr_max_pct': 0.0873981701022443, 'sideways_tp_mult': 1.0162271387962447, 'sideways_tsl_mult': 0.9621970156015742, 'sideways_time_stop': 50, 'sideways_use_sma': True, 'sideways_use_ema': False, 'sideways_use_atr': False, 'sideways_use_adx': False, 'sideways_use_spike': True, 'sideways_rsi_required': False}.
[I 2025-09-01 09:34:39,545] Trial 202 finished with values: [-1000000000.0, 1000000000.0] and parameters: {'p_sma': 33, 'p_std': 45, 'p_atr': 7, 'p_adx': 20, 'rsi_period': 71, 'ema1': 10, 'ema2': 20, 'slip_atr_k': 0.00010585437440573629, 'slip_spread_k': 0.6361330259728755, 'spread_hl_frac': 0.0034116385631258335, 'bb_std_mult': 2.4786661353344446, 'rsi_os': 11, 'rsi_ob': 58, 'vol_spike': 0.19031299845678215, 'adx_thresh': 32.1847290446205, 'atr_min_pct': 0.019645338459409554, 'atr_max_pct': 0.06286354721585898, 'tp_mult': 2.5102245696402004, 'tsl_mult': 0.8168456106070527, 'strategy': 'breakout', 'time_stop': 165, 'use_sma': True, 'use_atr': True, 'use_adx': False, 'use_ema': True, 'use_spike': True, 'rsi_required': False, 'edge_k': 0.20059782262555237, 'edge_cap': 0.8887821526244892, 'bull_strategy': 'mean_reversion', 'bull_bb_std_mult': 3.209583274441793, 'bull_rsi_os': 37, 'bull_rsi_ob': 78, 'bull_adx_thresh': 27.23864915554658, 'bull_atr_min_pct': 0.01671188172286796, 'bull_atr_max_pct': 0.07588884035438961, 'bull_tp_mult': 1.6391628839521262, 'bull_tsl_mult': 0.8824162718695426, 'bull_time_stop': 143, 'bull_use_sma': True, 'bull_use_ema': False, 'bull_use_atr': True, 'bull_use_adx': False, 'bull_use_spike': False, 'bull_rsi_required': True, 'bear_strategy': 'breakout', 'bear_bb_std_mult': 2.059542128996382, 'bear_rsi_os': 40, 'bear_rsi_ob': 70, 'bear_adx_thresh': 32.842932392862814, 'bear_atr_min_pct': 0.017774323689252806, 'bear_atr_max_pct': 0.13116008993374523, 'bear_tp_mult': 1.2953823919995129, 'bear_tsl_mult': 0.7631938127515148, 'bear_time_stop': 11, 'bear_use_sma': False, 'bear_use_ema': True, 'bear_use_atr': True, 'bear_use_adx': False, 'bear_use_spike': True, 'bear_rsi_required': False, 'sideways_strategy': 'mean_reversion', 'sideways_bb_std_mult': 2.531372929338418, 'sideways_rsi_os': 47, 'sideways_rsi_ob': 62, 'sideways_adx_thresh': 32.31238888255076, 'sideways_atr_min_pct': 0.023154378855534823, 'sideways_atr_max_pct': 0.019005955456244096, 'sideways_tp_mult': 1.36437598774504, 'sideways_tsl_mult': 0.9188954408000412, 'sideways_time_stop': 161, 'sideways_use_sma': True, 'sideways_use_ema': True, 'sideways_use_atr': False, 'sideways_use_adx': False, 'sideways_use_spike': True, 'sideways_rsi_required': False}.
[I 2025-09-01 09:35:23,157] Trial 209 finished with values: [-0.013074910129086681, 0.013680442096841104] and parameters: {'p_sma': 46, 'p_std': 43, 'p_atr': 19, 'p_adx': 21, 'rsi_period': 66, 'ema1': 8, 'ema2': 12, 'slip_atr_k': 0.23239917967491425, 'slip_spread_k': 0.5504883757972834, 'spread_hl_frac': 0.008396091870012525, 'bb_std_mult': 2.9097466583150897, 'rsi_os': 5, 'rsi_ob': 55, 'vol_spike': 0.20141184898455128, 'adx_thresh': 12.363717187033052, 'atr_min_pct': 0.020135880315724067, 'atr_max_pct': 0.06671941079235201, 'tp_mult': 1.7292918209015369, 'tsl_mult': 0.7909069250958949, 'strategy': 'breakout', 'time_stop': 141, 'use_sma': False, 'use_atr': True, 'use_adx': True, 'use_ema': False, 'use_spike': True, 'rsi_required': False, 'edge_k': 0.5623595635146319, 'edge_cap': 0.7911459962659159, 'bull_strategy': 'mean_reversion', 'bull_bb_std_mult': 3.4341853761709675, 'bull_rsi_os': 42, 'bull_rsi_ob': 79, 'bull_adx_thresh': 27.634678308395383, 'bull_atr_min_pct': 0.02974261564484628, 'bull_atr_max_pct': 0.07968720173224188, 'bull_tp_mult': 1.5787935870695353, 'bull_tsl_mult': 0.8328983028608214, 'bull_time_stop': 135, 'bull_use_sma': True, 'bull_use_ema': False, 'bull_use_atr': True, 'bull_use_adx': False, 'bull_use_spike': True, 'bull_rsi_required': False, 'bear_strategy': 'mean_reversion', 'bear_bb_std_mult': 1.5870607355829247, 'bear_rsi_os': 49, 'bear_rsi_ob': 73, 'bear_adx_thresh': 34.18675218027685, 'bear_atr_min_pct': 0.02858269303466182, 'bear_atr_max_pct': 0.1350485697261338, 'bear_tp_mult': 2.8085247852152206, 'bear_tsl_mult': 0.5536248865365975, 'bear_time_stop': 29, 'bear_use_sma': False, 'bear_use_ema': True, 'bear_use_atr': True, 'bear_use_adx': True, 'bear_use_spike': True, 'bear_rsi_required': False, 'sideways_strategy': 'breakout', 'sideways_bb_std_mult': 2.8013956839035434, 'sideways_rsi_os': 30, 'sideways_rsi_ob': 60, 'sideways_adx_thresh': 34.259833935340225, 'sideways_atr_min_pct': 0.0025875272019441967, 'sideways_atr_max_pct': 0.08329179848674163, 'sideways_tp_mult': 1.3126769813280046, 'sideways_tsl_mult': 0.9750321070695384, 'sideways_time_stop': 232, 'sideways_use_sma': False, 'sideways_use_ema': False, 'sideways_use_atr': False, 'sideways_use_adx': True, 'sideways_use_spike': True, 'sideways_rsi_required': False}.
