[I 2025-09-01 10:20:38,960] Trial 466 finished with values: [-0.02527804946861889, 0.025334127240783082] and parameters: {'p_sma': 58, 'p_std': 5, 'p_atr': 21, 'p_adx': 11, 'rsi_period': 15, 'ema1': 8, 'ema2': 11, 'slip_atr_k': 0.0009196450721166705, 'slip_spread_k': 0.883847086714447, 'spread_hl_frac': 0.04276187138270754, 'bb_std_mult': 2.898327722936998, 'rsi_os': 9, 'rsi_ob': 56, 'vol_spike': 0.1414377421365919, 'adx_thresh': 12.255656495965257, 'atr_min_pct': 0.0203421292902925, 'atr_max_pct': 0.06759428421232781, 'tp_mult': 2.7005248783651354, 'tsl_mult': 0.9749884275278049, 'strategy': 'breakout', 'time_stop': 143, 'use_sma': False, 'use_atr': True, 'use_adx': False, 'use_ema': False, 'use_spike': True, 'rsi_required': False, 'edge_k': 0.6036952062008745, 'edge_cap': 0.8668487895357123, 'bull_strategy': 'mean_reversion', 'bull_bb_std_mult': 2.9350614221772764, 'bull_rsi_os': 38, 'bull_rsi_ob': 80, 'bull_adx_thresh': 31.743641825527426, 'bull_atr_min_pct': 0.007853205163317105, 'bull_atr_max_pct': 0.08529277962187023, 'bull_tp_mult': 2.9965651857540863, 'bull_tsl_mult': 0.9478759511744881, 'bull_time_stop': 206, 'bull_use_sma': False, 'bull_use_ema': False, 'bull_use_atr': True, 'bull_use_adx': False, 'bull_use_spike': True, 'bull_rsi_required': False, 'bear_strategy': 'breakout', 'bear_bb_std_mult': 1.618239929392081, 'bear_rsi_os': 43, 'bear_rsi_ob': 53, 'bear_adx_thresh': 12.599093398658262, 'bear_atr_min_pct': 0.028328388482683615, 'bear_atr_max_pct': 0.08223892083884841, 'bear_tp_mult': 1.1121619911696157, 'bear_tsl_mult': 0.9539183574278629, 'bear_time_stop': 159, 'bear_use_sma': False, 'bear_use_ema': True, 'bear_use_atr': True, 'bear_use_adx': True, 'bear_use_spike': True, 'bear_rsi_required': False, 'sideways_strategy': 'breakout', 'sideways_bb_std_mult': 2.61956910966036, 'sideways_rsi_os': 43, 'sideways_rsi_ob': 59, 'sideways_adx_thresh': 33.42749980992626, 'sideways_atr_min_pct': 0.0026376916050783305, 'sideways_atr_max_pct': 0.025367551699193684, 'sideways_tp_mult': 2.8637959656927197, 'sideways_tsl_mult': 0.9294594126762805, 'sideways_time_stop': 219, 'sideways_use_sma': False, 'sideways_use_ema': False, 'sideways_use_atr': False, 'sideways_use_adx': False, 'sideways_use_spike': True, 'sideways_rsi_required': False}.
[I 2025-09-01 10:20:39,286] Trial 467 finished with values: [-0.022514177988203876, 0.023090588261047124] and parameters: {'p_sma': 58, 'p_std': 5, 'p_atr': 21, 'p_adx': 7, 'rsi_period': 46, 'ema1': 8, 'ema2': 11, 'slip_atr_k': 0.007344961339653756, 'slip_spread_k': 0.5653353747980131, 'spread_hl_frac': 0.0077810514921703685, 'bb_std_mult': 2.7840194975183374, 'rsi_os': 9, 'rsi_ob': 56, 'vol_spike': 0.19163395382218595, 'adx_thresh': 12.239350305426786, 'atr_min_pct': 0.022567598327016512, 'atr_max_pct': 0.04475748136297651, 'tp_mult': 2.3620233007863805, 'tsl_mult': 0.021214477333778403, 'strategy': 'breakout', 'time_stop': 143, 'use_sma': False, 'use_atr': True, 'use_adx': False, 'use_ema': False, 'use_spike': True, 'rsi_required': False, 'edge_k': 1.2581500110569732, 'edge_cap': 0.4504414398976086, 'bull_strategy': 'mean_reversion', 'bull_bb_std_mult': 3.3907568128374934, 'bull_rsi_os': 29, 'bull_rsi_ob': 80, 'bull_adx_thresh': 14.067770551259379, 'bull_atr_min_pct': 0.003858223477338256, 'bull_atr_max_pct': 0.08185804720206517, 'bull_tp_mult': 1.6217432788820745, 'bull_tsl_mult': 0.9515609596903972, 'bull_time_stop': 210, 'bull_use_sma': False, 'bull_use_ema': False, 'bull_use_atr': True, 'bull_use_adx': False, 'bull_use_spike': True, 'bull_rsi_required': False, 'bear_strategy': 'breakout', 'bear_bb_std_mult': 3.23058601862113, 'bear_rsi_os': 49, 'bear_rsi_ob': 79, 'bear_adx_thresh': 7.5863016842427164, 'bear_atr_min_pct': 0.006385619277636591, 'bear_atr_max_pct': 0.07488762244747013, 'bear_tp_mult': 2.780550065916336, 'bear_tsl_mult': 0.756436928313878, 'bear_time_stop': 5, 'bear_use_sma': False, 'bear_use_ema': True, 'bear_use_atr': True, 'bear_use_adx': True, 'bear_use_spike': True, 'bear_rsi_required': False, 'sideways_strategy': 'breakout', 'sideways_bb_std_mult': 2.3628393582716214, 'sideways_rsi_os': 11, 'sideways_rsi_ob': 56, 'sideways_adx_thresh': 12.467078433410798, 'sideways_atr_min_pct': 0.0026876580951372543, 'sideways_atr_max_pct': 0.1353309793776094, 'sideways_tp_mult': 1.4169970960811993, 'sideways_tsl_mult': 0.7088053325714572, 'sideways_time_stop': 218, 'sideways_use_sma': False, 'sideways_use_ema': False, 'sideways_use_atr': False, 'sideways_use_adx': False, 'sideways_use_spike': True, 'sideways_rsi_required': False}.
[I 2025-09-01 10:21:19,920] Trial 473 finished with values: [-1000000000.0, 1000000000.0] and parameters: {'p_sma': 37, 'p_std': 47, 'p_atr': 19, 'p_adx': 27, 'rsi_period': 71, 'ema1': 27, 'ema2': 12, 'slip_atr_k': 0.14835794090485266, 'slip_spread_k': 0.6184214991821056, 'spread_hl_frac': 0.0175921807230984, 'bb_std_mult': 2.69304748271613, 'rsi_os': 11, 'rsi_ob': 53, 'vol_spike': 0.051756528580309685, 'adx_thresh': 12.835283386166996, 'atr_min_pct': 0.02157045457117742, 'atr_max_pct': 0.058363432285823524, 'tp_mult': 2.510999529696931, 'tsl_mult': 0.832893743878983, 'strategy': 'mean_reversion', 'time_stop': 75, 'use_sma': True, 'use_atr': True, 'use_adx': False, 'use_ema': True, 'use_spike': False, 'rsi_required': False, 'edge_k': 1.898366179451545, 'edge_cap': 0.6092289999893583, 'bull_strategy': 'breakout', 'bull_bb_std_mult': 3.3920738207246126, 'bull_rsi_os': 40, 'bull_rsi_ob': 70, 'bull_adx_thresh': 27.783351799537833, 'bull_atr_min_pct': 0.027347522522670947, 'bull_atr_max_pct': 0.14765566088083737, 'bull_tp_mult': 1.2295831341952768, 'bull_tsl_mult': 0.272180043806819, 'bull_time_stop': 131, 'bull_use_sma': True, 'bull_use_ema': False, 'bull_use_atr': True, 'bull_use_adx': False, 'bull_use_spike': True, 'bull_rsi_required': False, 'bear_strategy': 'breakout', 'bear_bb_std_mult': 1.5338671744913106, 'bear_rsi_os': 55, 'bear_rsi_ob': 66, 'bear_adx_thresh': 30.51176596150065, 'bear_atr_min_pct': 0.025031046918563664, 'bear_atr_max_pct': 0.06746171587098045, 'bear_tp_mult': 2.387515843348187, 'bear_tsl_mult': 0.8713503095054134, 'bear_time_stop': 14, 'bear_use_sma': False, 'bear_use_ema': False, 'bear_use_atr': False, 'bear_use_adx': True, 'bear_use_spike': True, 'bear_rsi_required': False, 'sideways_strategy': 'mean_reversion', 'sideways_bb_std_mult': 2.5834812108185483, 'sideways_rsi_os': 36, 'sideways_rsi_ob': 63, 'sideways_adx_thresh': 27.07580100529831, 'sideways_atr_min_pct': 0.007745215655538947, 'sideways_atr_max_pct': 0.08408496852711886, 'sideways_tp_mult': 1.3066127205702278, 'sideways_tsl_mult': 0.9608851390250313, 'sideways_time_stop': 12, 'sideways_use_sma': True, 'sideways_use_ema': False, 'sideways_use_atr': False, 'sideways_use_adx': True, 'sideways_use_spike': False, 'sideways_rsi_required': False}.
[I 2025-09-01 10:21:20,672] Trial 470 finished with values: [-0.046981494800921064, 0.04666780034061423] and parameters: {'p_sma': 35, 'p_std': 38, 'p_atr': 27, 'p_adx': 12, 'rsi_period': 32, 'ema1': 15, 'ema2': 11, 'slip_atr_k': 0.2094662129038783, 'slip_spread_k': 0.5625952576791452, 'spread_hl_frac': 0.038780796885179464, 'bb_std_mult': 2.5464298702281765, 'rsi_os': 10, 'rsi_ob': 64, 'vol_spike': 0.19115946628333255, 'adx_thresh': 10.558213335395491, 'atr_min_pct': 0.019995952454003672, 'atr_max_pct': 0.10669111482320678, 'tp_mult': 2.4978064434951017, 'tsl_mult': 0.8772468987549651, 'strategy': 'breakout', 'time_stop': 145, 'use_sma': True, 'use_atr': True, 'use_adx': False, 'use_ema': False, 'use_spike': True, 'rsi_required': False, 'edge_k': 0.6672083046788729, 'edge_cap': 0.6016163966166371, 'bull_strategy': 'mean_reversion', 'bull_bb_std_mult': 3.1797404456779144, 'bull_rsi_os': 38, 'bull_rsi_ob': 80, 'bull_adx_thresh': 15.570728917105784, 'bull_atr_min_pct': 0.027572699729369148, 'bull_atr_max_pct': 0.02654596492651147, 'bull_tp_mult': 1.6136189198850115, 'bull_tsl_mult': 0.9456164866703057, 'bull_time_stop': 226, 'bull_use_sma': True, 'bull_use_ema': False, 'bull_use_atr': True, 'bull_use_adx': False, 'bull_use_spike': True, 'bull_rsi_required': False, 'bear_strategy': 'breakout', 'bear_bb_std_mult': 2.872440187220381, 'bear_rsi_os': 31, 'bear_rsi_ob': 46, 'bear_adx_thresh': 17.773755935864116, 'bear_atr_min_pct': 0.0047013445864261694, 'bear_atr_max_pct': 0.10422882129429972, 'bear_tp_mult': 2.4066768267910277, 'bear_tsl_mult': 0.7526204616042159, 'bear_time_stop': 156, 'bear_use_sma': False, 'bear_use_ema': False, 'bear_use_atr': True, 'bear_use_adx': True, 'bear_use_spike': True, 'bear_rsi_required': False, 'sideways_strategy': 'mean_reversion', 'sideways_bb_std_mult': 2.624043687894509, 'sideways_rsi_os': 31, 'sideways_rsi_ob': 63, 'sideways_adx_thresh': 29.314038767238998, 'sideways_atr_min_pct': 0.002041857469970251, 'sideways_atr_max_pct': 0.1020558649170099, 'sideways_tp_mult': 1.4177882272255213, 'sideways_tsl_mult': 0.779128680891255, 'sideways_time_stop': 217, 'sideways_use_sma': True, 'sideways_use_ema': False, 'sideways_use_atr': False, 'sideways_use_adx': True, 'sideways_use_spike': True, 'sideways_rsi_required': False}.
[I 2025-09-01 10:21:21,890] Trial 471 finished with values: [-0.03577975483407281, 0.03554460448779907] and parameters: {'p_sma': 59, 'p_std': 5, 'p_atr': 23, 'p_adx': 12, 'rsi_period': 20, 'ema1': 8, 'ema2': 11, 'slip_atr_k': 0.14778397729565207, 'slip_spread_k': 0.5563914655411791, 'spread_hl_frac': 0.04335329161768889, 'bb_std_mult': 2.8651701267081155, 'rsi_os': 10, 'rsi_ob': 53, 'vol_spike': 0.11904399751736977, 'adx_thresh': 8.809811312383205, 'atr_min_pct': 0.022549285789575924, 'atr_max_pct': 0.0588988655089482, 'tp_mult': 2.4977361926724067, 'tsl_mult': 0.8778592131808095, 'strategy': 'breakout', 'time_stop': 105, 'use_sma': True, 'use_atr': True, 'use_adx': False, 'use_ema': False, 'use_spike': True, 'rsi_required': False, 'edge_k': 0.6822397254413232, 'edge_cap': 0.8795313890222791, 'bull_strategy': 'mean_reversion', 'bull_bb_std_mult': 2.7094362979605853, 'bull_rsi_os': 37, 'bull_rsi_ob': 71, 'bull_adx_thresh': 27.047086817852904, 'bull_atr_min_pct': 0.007406763994288954, 'bull_atr_max_pct': 0.14968166292875817, 'bull_tp_mult': 1.5614283411156313, 'bull_tsl_mult': 0.9185567281881372, 'bull_time_stop': 100, 'bull_use_sma': False, 'bull_use_ema': False, 'bull_use_atr': True, 'bull_use_adx': False, 'bull_use_spike': True, 'bull_rsi_required': False, 'bear_strategy': 'breakout', 'bear_bb_std_mult': 1.5129088263940713, 'bear_rsi_os': 31, 'bear_rsi_ob': 47, 'bear_adx_thresh': 16.928512690226988, 'bear_atr_min_pct': 0.015423980854788574, 'bear_atr_max_pct': 0.08487206284945761, 'bear_tp_mult': 1.4772345571334482, 'bear_tsl_mult': 0.7937883808362316, 'bear_time_stop': 41, 'bear_use_sma': False, 'bear_use_ema': False, 'bear_use_atr': True, 'bear_use_adx': True, 'bear_use_spike': True, 'bear_rsi_required': False, 'sideways_strategy': 'mean_reversion', 'sideways_bb_std_mult': 1.548822771387508, 'sideways_rsi_os': 33, 'sideways_rsi_ob': 75, 'sideways_adx_thresh': 26.934458383107355, 'sideways_atr_min_pct': 0.0027305900173112607, 'sideways_atr_max_pct': 0.05046705805888546, 'sideways_tp_mult': 1.4143494068948235, 'sideways_tsl_mult': 0.7772449430830921, 'sideways_time_stop': 218, 'sideways_use_sma': True, 'sideways_use_ema': False, 'sideways_use_atr': False, 'sideways_use_adx': True, 'sideways_use_spike': True, 'sideways_rsi_required': False}.
[I 2025-09-01 10:21:22,162] Trial 472 finished with values: [-0.06665633835672014, 0.06667212754241272] and parameters: {'p_sma': 39, 'p_std': 27, 'p_atr': 12, 'p_adx': 12, 'rsi_period': 20, 'ema1': 19, 'ema2': 11, 'slip_atr_k': 0.21171432417541097, 'slip_spread_k': 0.3386775355677628, 'spread_hl_frac': 0.008573925843262673, 'bb_std_mult': 2.658261671443013, 'rsi_os': 10, 'rsi_ob': 54, 'vol_spike': 0.11816405239962213, 'adx_thresh': 20.27411666752608, 'atr_min_pct': 0.018809794133153104, 'atr_max_pct': 0.07006062507120234, 'tp_mult': 2.619818861587132, 'tsl_mult': 0.8819096962316966, 'strategy': 'mean_reversion', 'time_stop': 76, 'use_sma': True, 'use_atr': True, 'use_adx': False, 'use_ema': False, 'use_spike': False, 'rsi_required': False, 'edge_k': 1.198868468125255, 'edge_cap': 0.11873082517430411, 'bull_strategy': 'breakout', 'bull_bb_std_mult': 3.1747515783281908, 'bull_rsi_os': 29, 'bull_rsi_ob': 81, 'bull_adx_thresh': 13.835456657593992, 'bull_atr_min_pct': 0.0012554215015526345, 'bull_atr_max_pct': 0.07857163223704608, 'bull_tp_mult': 1.9514316934045326, 'bull_tsl_mult': 0.48701087461461157, 'bull_time_stop': 133, 'bull_use_sma': True, 'bull_use_ema': False, 'bull_use_atr': True, 'bull_use_adx': False, 'bull_use_spike': True, 'bull_rsi_required': False, 'bear_strategy': 'breakout', 'bear_bb_std_mult': 1.5304234783132578, 'bear_rsi_os': 31, 'bear_rsi_ob': 68, 'bear_adx_thresh': 27.290066556399637, 'bear_atr_min_pct': 0.0046848557918237384, 'bear_atr_max_pct': 0.1297490810031101, 'bear_tp_mult': 1.9634564811261455, 'bear_tsl_mult': 0.8771131803589407, 'bear_time_stop': 5, 'bear_use_sma': False, 'bear_use_ema': False, 'bear_use_atr': True, 'bear_use_adx': True, 'bear_use_spike': True, 'bear_rsi_required': False, 'sideways_strategy': 'mean_reversion', 'sideways_bb_std_mult': 2.5564548138623615, 'sideways_rsi_os': 36, 'sideways_rsi_ob': 61, 'sideways_adx_thresh': 32.59827636348007, 'sideways_atr_min_pct': 0.025457422643879637, 'sideways_atr_max_pct': 0.07584257711685544, 'sideways_tp_mult': 1.4221024679685348, 'sideways_tsl_mult': 0.9721915296934054, 'sideways_time_stop': 232, 'sideways_use_sma': True, 'sideways_use_ema': False, 'sideways_use_atr': False, 'sideways_use_adx': True, 'sideways_use_spike': True, 'sideways_rsi_required': False}.
[I 2025-09-01 10:22:04,031] Trial 474 finished with values: [-0.014942121276086406, 0.015552741083090604] and parameters: {'p_sma': 60, 'p_std': 36, 'p_atr': 11, 'p_adx': 24, 'rsi_period': 33, 'ema1': 19, 'ema2': 50, 'slip_atr_k': 0.052328135217781555, 'slip_spread_k': 0.10340239154452924, 'spread_hl_frac': 0.008768353694775433, 'bb_std_mult': 1.164309130939774, 'rsi_os': 28, 'rsi_ob': 68, 'vol_spike': 0.28807446353343275, 'adx_thresh': 27.414684953133587, 'atr_min_pct': 0.00950296049343986, 'atr_max_pct': 0.07571978867903163, 'tp_mult': 2.6315713788718527, 'tsl_mult': 0.5882498062765167, 'strategy': 'breakout', 'time_stop': 147, 'use_sma': True, 'use_atr': False, 'use_adx': False, 'use_ema': False, 'use_spike': True, 'rsi_required': True, 'edge_k': 0.6817594310363837, 'edge_cap': 0.10161472075438033, 'bull_strategy': 'mean_reversion', 'bull_bb_std_mult': 3.181298685980585, 'bull_rsi_os': 39, 'bull_rsi_ob': 73, 'bull_adx_thresh': 15.683044993267458, 'bull_atr_min_pct': 0.0023061038462366228, 'bull_atr_max_pct': 0.01510121371387571, 'bull_tp_mult': 2.926987800653526, 'bull_tsl_mult': 0.5214124949470305, 'bull_time_stop': 223, 'bull_use_sma': True, 'bull_use_ema': False, 'bull_use_atr': False, 'bull_use_adx': False, 'bull_use_spike': False, 'bull_rsi_required': False, 'bear_strategy': 'breakout', 'bear_bb_std_mult': 0.6661632484860962, 'bear_rsi_os': 39, 'bear_rsi_ob': 94, 'bear_adx_thresh': 17.136489776541314, 'bear_atr_min_pct': 0.029509744966686405, 'bear_atr_max_pct': 0.06371615992541177, 'bear_tp_mult': 1.9266490880863365, 'bear_tsl_mult': 0.7884624286573574, 'bear_time_stop': 5, 'bear_use_sma': False, 'bear_use_ema': False, 'bear_use_atr': True, 'bear_use_adx': True, 'bear_use_spike': True, 'bear_rsi_required': False, 'sideways_strategy': 'mean_reversion', 'sideways_bb_std_mult': 0.6293551208166162, 'sideways_rsi_os': 48, 'sideways_rsi_ob': 61, 'sideways_adx_thresh': 29.768648577465832, 'sideways_atr_min_pct': 0.02370251190247347, 'sideways_atr_max_pct': 0.09217350359543139, 'sideways_tp_mult': 1.355351940906238, 'sideways_tsl_mult': 0.9114544147339623, 'sideways_time_stop': 234, 'sideways_use_sma': True, 'sideways_use_ema': False, 'sideways_use_atr': True, 'sideways_use_adx': True, 'sideways_use_spike': True, 'sideways_rsi_required': True}.
[I 2025-09-01 10:22:04,473] Trial 475 finished with values: [-1000000000.0, 1000000000.0] and parameters: {'p_sma': 59, 'p_std': 43, 'p_atr': 11, 'p_adx': 10, 'rsi_period': 39, 'ema1': 22, 'ema2': 53, 'slip_atr_k': 0.012888507731447289, 'slip_spread_k': 0.09780356123474104, 'spread_hl_frac': 0.004425585610728245, 'bb_std_mult': 2.642873689901235, 'rsi_os': 24, 'rsi_ob': 54, 'vol_spike': 0.0946582528532662, 'adx_thresh': 22.60808203409518, 'atr_min_pct': 0.018834912520534857, 'atr_max_pct': 0.06180784920492874, 'tp_mult': 2.6298519119318065, 'tsl_mult': 0.8238030082271756, 'strategy': 'mean_reversion', 'time_stop': 94, 'use_sma': True, 'use_atr': False, 'use_adx': False, 'use_ema': False, 'use_spike': False, 'rsi_required': True, 'edge_k': 0.7244344001247314, 'edge_cap': 0.1197714251605605, 'bull_strategy': 'mean_reversion', 'bull_bb_std_mult': 2.704242578171966, 'bull_rsi_os': 50, 'bull_rsi_ob': 85, 'bull_adx_thresh': 27.122798559032056, 'bull_atr_min_pct': 0.005252794554190575, 'bull_atr_max_pct': 0.015024240312582565, 'bull_tp_mult': 2.3512133960698756, 'bull_tsl_mult': 0.08032436790189496, 'bull_time_stop': 253, 'bull_use_sma': True, 'bull_use_ema': False, 'bull_use_atr': False, 'bull_use_adx': True, 'bull_use_spike': False, 'bull_rsi_required': False, 'bear_strategy': 'breakout', 'bear_bb_std_mult': 1.4326630961933637, 'bear_rsi_os': 42, 'bear_rsi_ob': 72, 'bear_adx_thresh': 16.758165517492976, 'bear_atr_min_pct': 0.013440090980518554, 'bear_atr_max_pct': 0.058638665759948715, 'bear_tp_mult': 2.827598941302184, 'bear_tsl_mult': 0.7967091002111966, 'bear_time_stop': 21, 'bear_use_sma': False, 'bear_use_ema': True, 'bear_use_atr': True, 'bear_use_adx': True, 'bear_use_spike': False, 'bear_rsi_required': False, 'sideways_strategy': 'mean_reversion', 'sideways_bb_std_mult': 2.4415479204635653, 'sideways_rsi_os': 30, 'sideways_rsi_ob': 61, 'sideways_adx_thresh': 32.824437925516044, 'sideways_atr_min_pct': 0.02373220623436815, 'sideways_atr_max_pct': 0.09224734457551372, 'sideways_tp_mult': 2.0728346989402575, 'sideways_tsl_mult': 0.9028888501958124, 'sideways_time_stop': 241, 'sideways_use_sma': True, 'sideways_use_ema': False, 'sideways_use_atr': True, 'sideways_use_adx': False, 'sideways_use_spike': True, 'sideways_rsi_required': True}.
[I 2025-09-01 10:22:04,678] Trial 476 finished with values: [-1000000000.0, 1000000000.0] and parameters: {'p_sma': 44, 'p_std': 27, 'p_atr': 28, 'p_adx': 17, 'rsi_period': 27, 'ema1': 19, 'ema2': 56, 'slip_atr_k': 0.013076350381943339, 'slip_spread_k': 0.5872663181887569, 'spread_hl_frac': 0.0022085616745540528, 'bb_std_mult': 2.1853308538817604, 'rsi_os': 7, 'rsi_ob': 77, 'vol_spike': 0.06827308077280071, 'adx_thresh': 22.604228821646636, 'atr_min_pct': 0.01861980083548031, 'atr_max_pct': 0.07524380481864715, 'tp_mult': 2.6493952701674783, 'tsl_mult': 0.8192613755249905, 'strategy': 'mean_reversion', 'time_stop': 203, 'use_sma': True, 'use_atr': False, 'use_adx': False, 'use_ema': False, 'use_spike': False, 'rsi_required': True, 'edge_k': 0.7253510237594581, 'edge_cap': 0.6573126301425991, 'bull_strategy': 'breakout', 'bull_bb_std_mult': 2.1670332776937853, 'bull_rsi_os': 44, 'bull_rsi_ob': 77, 'bull_adx_thresh': 32.39579271882006, 'bull_atr_min_pct': 0.02557013228952118, 'bull_atr_max_pct': 0.07918474107350985, 'bull_tp_mult': 2.345906210299697, 'bull_tsl_mult': 0.5259450755824098, 'bull_time_stop': 124, 'bull_use_sma': True, 'bull_use_ema': True, 'bull_use_atr': False, 'bull_use_adx': True, 'bull_use_spike': False, 'bull_rsi_required': False, 'bear_strategy': 'mean_reversion', 'bear_bb_std_mult': 1.421464746863045, 'bear_rsi_os': 39, 'bear_rsi_ob': 73, 'bear_adx_thresh': 34.9764791688966, 'bear_atr_min_pct': 0.012232881261154814, 'bear_atr_max_pct': 0.12114463965761288, 'bear_tp_mult': 2.8321864363581266, 'bear_tsl_mult': 0.14708828236683807, 'bear_time_stop': 210, 'bear_use_sma': True, 'bear_use_ema': True, 'bear_use_atr': True, 'bear_use_adx': True, 'bear_use_spike': False, 'bear_rsi_required': False, 'sideways_strategy': 'mean_reversion', 'sideways_bb_std_mult': 2.440915218522557, 'sideways_rsi_os': 30, 'sideways_rsi_ob': 61, 'sideways_adx_thresh': 32.45545055529095, 'sideways_atr_min_pct': 0.0037732188009470874, 'sideways_atr_max_pct': 0.09187288955799658, 'sideways_tp_mult': 1.3536070336746904, 'sideways_tsl_mult': 0.9080553829773245, 'sideways_time_stop': 200, 'sideways_use_sma': True, 'sideways_use_ema': False, 'sideways_use_atr': True, 'sideways_use_adx': False, 'sideways_use_spike': True, 'sideways_rsi_required': True}.
