[I 2025-09-01 10:12:48,080] Trial 421 finished with values: [-1000000000.0, 1000000000.0] and parameters: {'p_sma': 58, 'p_std': 43, 'p_atr': 27, 'p_adx': 21, 'rsi_period': 46, 'ema1': 7, 'ema2': 20, 'slip_atr_k': 0.010393092017164526, 'slip_spread_k': 0.6144751732446113, 'spread_hl_frac': 0.04895767444603488, 'bb_std_mult': 1.5346142182531786, 'rsi_os': 9, 'rsi_ob': 58, 'vol_spike': 0.21156522177901585, 'adx_thresh': 12.766668682498269, 'atr_min_pct': 0.020933494140885394, 'atr_max_pct': 0.0501682299991132, 'tp_mult': 2.67594820534209, 'tsl_mult': 0.8310211543787274, 'strategy': 'breakout', 'time_stop': 136, 'use_sma': False, 'use_atr': False, 'use_adx': False, 'use_ema': False, 'use_spike': True, 'rsi_required': True, 'edge_k': 0.7495224860148637, 'edge_cap': 0.856487859874906, 'bull_strategy': 'mean_reversion', 'bull_bb_std_mult': 3.5935685542384688, 'bull_rsi_os': 39, 'bull_rsi_ob': 58, 'bull_adx_thresh': 29.48500771871418, 'bull_atr_min_pct': 0.009153388874789748, 'bull_atr_max_pct': 0.08124327253345873, 'bull_tp_mult': 1.5190956211885507, 'bull_tsl_mult': 0.7037231364339628, 'bull_time_stop': 95, 'bull_use_sma': True, 'bull_use_ema': False, 'bull_use_atr': False, 'bull_use_adx': True, 'bull_use_spike': True, 'bull_rsi_required': False, 'bear_strategy': 'breakout', 'bear_bb_std_mult': 1.5127862017849132, 'bear_rsi_os': 45, 'bear_rsi_ob': 72, 'bear_adx_thresh': 33.33187708031305, 'bear_atr_min_pct': 0.029259515251818347, 'bear_atr_max_pct': 0.04861962588370329, 'bear_tp_mult': 2.551937902343827, 'bear_tsl_mult': 0.8160202518452544, 'bear_time_stop': 114, 'bear_use_sma': False, 'bear_use_ema': False, 'bear_use_atr': True, 'bear_use_adx': False, 'bear_use_spike': True, 'bear_rsi_required': False, 'sideways_strategy': 'mean_reversion', 'sideways_bb_std_mult': 2.4693794679435097, 'sideways_rsi_os': 10, 'sideways_rsi_ob': 56, 'sideways_adx_thresh': 6.440296740680795, 'sideways_atr_min_pct': 0.0032328591476434897, 'sideways_atr_max_pct': 0.067974510540672, 'sideways_tp_mult': 2.0107572237551494, 'sideways_tsl_mult': 0.9060044009048733, 'sideways_time_stop': 197, 'sideways_use_sma': True, 'sideways_use_ema': True, 'sideways_use_atr': False, 'sideways_use_adx': False, 'sideways_use_spike': False, 'sideways_rsi_required': True}.
[I 2025-09-01 10:12:48,668] Trial 424 finished with values: [-1000000000.0, 1000000000.0] and parameters: {'p_sma': 30, 'p_std': 14, 'p_atr': 26, 'p_adx': 23, 'rsi_period': 46, 'ema1': 7, 'ema2': 42, 'slip_atr_k': 0.16415658303634925, 'slip_spread_k': 0.6101165291481085, 'spread_hl_frac': 0.029012582267253305, 'bb_std_mult': 1.39358218361857, 'rsi_os': 31, 'rsi_ob': 58, 'vol_spike': 0.17608398059309954, 'adx_thresh': 20.824801870400087, 'atr_min_pct': 0.021029700713264952, 'atr_max_pct': 0.01565999055102467, 'tp_mult': 2.5135457342635568, 'tsl_mult': 0.8329173530487155, 'strategy': 'mean_reversion', 'time_stop': 139, 'use_sma': False, 'use_atr': False, 'use_adx': False, 'use_ema': False, 'use_spike': False, 'rsi_required': True, 'edge_k': 0.7174184299990087, 'edge_cap': 0.9815680334708562, 'bull_strategy': 'breakout', 'bull_bb_std_mult': 3.45882252746529, 'bull_rsi_os': 38, 'bull_rsi_ob': 80, 'bull_adx_thresh': 26.857509251452328, 'bull_atr_min_pct': 0.0053308715509158364, 'bull_atr_max_pct': 0.08084219086486118, 'bull_tp_mult': 1.5590482853680128, 'bull_tsl_mult': 0.9302415410967594, 'bull_time_stop': 236, 'bull_use_sma': True, 'bull_use_ema': True, 'bull_use_atr': False, 'bull_use_adx': True, 'bull_use_spike': False, 'bull_rsi_required': False, 'bear_strategy': 'breakout', 'bear_bb_std_mult': 2.3751784042840263, 'bear_rsi_os': 45, 'bear_rsi_ob': 73, 'bear_adx_thresh': 34.9346779424186, 'bear_atr_min_pct': 0.029481251006706982, 'bear_atr_max_pct': 0.1273138627177978, 'bear_tp_mult': 2.9812608100041555, 'bear_tsl_mult': 0.8241131101102382, 'bear_time_stop': 50, 'bear_use_sma': False, 'bear_use_ema': False, 'bear_use_atr': False, 'bear_use_adx': False, 'bear_use_spike': False, 'bear_rsi_required': True, 'sideways_strategy': 'breakout', 'sideways_bb_std_mult': 2.4586972288679894, 'sideways_rsi_os': 32, 'sideways_rsi_ob': 70, 'sideways_adx_thresh': 31.401929250182903, 'sideways_atr_min_pct': 0.018092794442967148, 'sideways_atr_max_pct': 0.09524477125829577, 'sideways_tp_mult': 1.3504348948629952, 'sideways_tsl_mult': 0.9438305182248778, 'sideways_time_stop': 122, 'sideways_use_sma': False, 'sideways_use_ema': True, 'sideways_use_atr': False, 'sideways_use_adx': False, 'sideways_use_spike': False, 'sideways_rsi_required': True}.
[I 2025-09-01 10:12:48,721] Trial 426 finished with values: [-1000000000.0, 1000000000.0] and parameters: {'p_sma': 34, 'p_std': 14, 'p_atr': 27, 'p_adx': 17, 'rsi_period': 53, 'ema1': 7, 'ema2': 11, 'slip_atr_k': 0.1512731216574129, 'slip_spread_k': 0.6128269552517953, 'spread_hl_frac': 0.02610962764254846, 'bb_std_mult': 2.6604098259945856, 'rsi_os': 9, 'rsi_ob': 58, 'vol_spike': 0.21297842474082285, 'adx_thresh': 5.12308893105385, 'atr_min_pct': 0.020979200825481614, 'atr_max_pct': 0.015582469217505265, 'tp_mult': 2.578827135654731, 'tsl_mult': 0.7864558543073863, 'strategy': 'mean_reversion', 'time_stop': 144, 'use_sma': True, 'use_atr': True, 'use_adx': True, 'use_ema': False, 'use_spike': False, 'rsi_required': False, 'edge_k': 1.3686942315875306, 'edge_cap': 0.42520994223062125, 'bull_strategy': 'breakout', 'bull_bb_std_mult': 3.5002093554022204, 'bull_rsi_os': 36, 'bull_rsi_ob': 79, 'bull_adx_thresh': 28.562650827212135, 'bull_atr_min_pct': 4.494583879976685e-05, 'bull_atr_max_pct': 0.08776726788275725, 'bull_tp_mult': 2.8792972935021823, 'bull_tsl_mult': 0.9276855901760807, 'bull_time_stop': 234, 'bull_use_sma': True, 'bull_use_ema': True, 'bull_use_atr': True, 'bull_use_adx': False, 'bull_use_spike': True, 'bull_rsi_required': True, 'bear_strategy': 'breakout', 'bear_bb_std_mult': 1.443548372551604, 'bear_rsi_os': 46, 'bear_rsi_ob': 70, 'bear_adx_thresh': 34.90379903282003, 'bear_atr_min_pct': 0.017376682633301596, 'bear_atr_max_pct': 0.12742866453131255, 'bear_tp_mult': 2.0977520475669715, 'bear_tsl_mult': 0.8328484133458277, 'bear_time_stop': 206, 'bear_use_sma': False, 'bear_use_ema': True, 'bear_use_atr': False, 'bear_use_adx': True, 'bear_use_spike': True, 'bear_rsi_required': True, 'sideways_strategy': 'breakout', 'sideways_bb_std_mult': 2.4705238565153804, 'sideways_rsi_os': 32, 'sideways_rsi_ob': 94, 'sideways_adx_thresh': 31.451252697049195, 'sideways_atr_min_pct': 0.003433071969021602, 'sideways_atr_max_pct': 0.10031000176280784, 'sideways_tp_mult': 1.6935104062071102, 'sideways_tsl_mult': 0.9428778680301712, 'sideways_time_stop': 124, 'sideways_use_sma': True, 'sideways_use_ema': False, 'sideways_use_atr': True, 'sideways_use_adx': True, 'sideways_use_spike': True, 'sideways_rsi_required': False}.
[I 2025-09-01 10:13:28,501] Trial 427 finished with values: [-0.027834702910139453, 0.02816996136325149] and parameters: {'p_sma': 58, 'p_std': 30, 'p_atr': 28, 'p_adx': 10, 'rsi_period': 40, 'ema1': 28, 'ema2': 51, 'slip_atr_k': 0.019555698373812776, 'slip_spread_k': 0.4992582704077956, 'spread_hl_frac': 0.04143208775017278, 'bb_std_mult': 1.427563250869397, 'rsi_os': 7, 'rsi_ob': 94, 'vol_spike': 0.1992007211474543, 'adx_thresh': 11.560680648786791, 'atr_min_pct': 0.021742636317649205, 'atr_max_pct': 0.04186819084068847, 'tp_mult': 2.5703010172324463, 'tsl_mult': 0.7875966276938898, 'strategy': 'mean_reversion', 'time_stop': 144, 'use_sma': True, 'use_atr': True, 'use_adx': True, 'use_ema': False, 'use_spike': False, 'rsi_required': False, 'edge_k': 0.1798017818059484, 'edge_cap': 0.896365873030514, 'bull_strategy': 'breakout', 'bull_bb_std_mult': 3.49038921979718, 'bull_rsi_os': 21, 'bull_rsi_ob': 79, 'bull_adx_thresh': 28.592499615155376, 'bull_atr_min_pct': 0.005263684157385797, 'bull_atr_max_pct': 0.08803726541748172, 'bull_tp_mult': 1.6286304109759493, 'bull_tsl_mult': 0.22380612539992428, 'bull_time_stop': 240, 'bull_use_sma': True, 'bull_use_ema': True, 'bull_use_atr': True, 'bull_use_adx': False, 'bull_use_spike': True, 'bull_rsi_required': True, 'bear_strategy': 'breakout', 'bear_bb_std_mult': 1.4479625401287446, 'bear_rsi_os': 38, 'bear_rsi_ob': 69, 'bear_adx_thresh': 34.191978289341385, 'bear_atr_min_pct': 0.028748666000102414, 'bear_atr_max_pct': 0.13938557111139782, 'bear_tp_mult': 2.9581698857501157, 'bear_tsl_mult': 0.09140131167813226, 'bear_time_stop': 87, 'bear_use_sma': False, 'bear_use_ema': True, 'bear_use_atr': False, 'bear_use_adx': True, 'bear_use_spike': True, 'bear_rsi_required': True, 'sideways_strategy': 'breakout', 'sideways_bb_std_mult': 0.7294258322948932, 'sideways_rsi_os': 31, 'sideways_rsi_ob': 61, 'sideways_adx_thresh': 31.55967038312901, 'sideways_atr_min_pct': 0.0017717045141899302, 'sideways_atr_max_pct': 0.0169496198622318, 'sideways_tp_mult': 1.6934995532900672, 'sideways_tsl_mult': 0.9421805942346548, 'sideways_time_stop': 244, 'sideways_use_sma': True, 'sideways_use_ema': False, 'sideways_use_atr': True, 'sideways_use_adx': True, 'sideways_use_spike': True, 'sideways_rsi_required': False}.
[I 2025-09-01 10:13:29,058] Trial 425 finished with values: [-0.008761171926303546, 0.008987903689394275] and parameters: {'p_sma': 58, 'p_std': 46, 'p_atr': 14, 'p_adx': 19, 'rsi_period': 48, 'ema1': 7, 'ema2': 11, 'slip_atr_k': 0.15588254653512812, 'slip_spread_k': 0.5371899415642015, 'spread_hl_frac': 0.005913381538242595, 'bb_std_mult': 1.3857511928823145, 'rsi_os': 9, 'rsi_ob': 58, 'vol_spike': 0.21093363357162456, 'adx_thresh': 11.758648321334817, 'atr_min_pct': 0.02375836663329208, 'atr_max_pct': 0.039443477167059905, 'tp_mult': 2.5709548554255415, 'tsl_mult': 0.7943457323588041, 'strategy': 'mean_reversion', 'time_stop': 145, 'use_sma': False, 'use_atr': False, 'use_adx': False, 'use_ema': False, 'use_spike': False, 'rsi_required': True, 'edge_k': 0.6977133156379483, 'edge_cap': 0.8427006345208516, 'bull_strategy': 'breakout', 'bull_bb_std_mult': 3.4960628670267577, 'bull_rsi_os': 12, 'bull_rsi_ob': 79, 'bull_adx_thresh': 26.842720120414242, 'bull_atr_min_pct': 0.005030240107158885, 'bull_atr_max_pct': 0.08100984197999073, 'bull_tp_mult': 2.8675131480385456, 'bull_tsl_mult': 0.8860275439775842, 'bull_time_stop': 137, 'bull_use_sma': True, 'bull_use_ema': True, 'bull_use_atr': False, 'bull_use_adx': True, 'bull_use_spike': False, 'bull_rsi_required': False, 'bear_strategy': 'breakout', 'bear_bb_std_mult': 1.3941028342568875, 'bear_rsi_os': 11, 'bear_rsi_ob': 69, 'bear_adx_thresh': 34.30036129428918, 'bear_atr_min_pct': 0.02375899674445775, 'bear_atr_max_pct': 0.12797314495277035, 'bear_tp_mult': 2.965766057351733, 'bear_tsl_mult': 0.47459661738234277, 'bear_time_stop': 124, 'bear_use_sma': False, 'bear_use_ema': True, 'bear_use_atr': False, 'bear_use_adx': False, 'bear_use_spike': True, 'bear_rsi_required': True, 'sideways_strategy': 'breakout', 'sideways_bb_std_mult': 3.4273393016307065, 'sideways_rsi_os': 32, 'sideways_rsi_ob': 69, 'sideways_adx_thresh': 5.935487327051311, 'sideways_atr_min_pct': 0.0031313773664970734, 'sideways_atr_max_pct': 0.09641914977708721, 'sideways_tp_mult': 1.7157375032278168, 'sideways_tsl_mult': 0.9362683767893986, 'sideways_time_stop': 227, 'sideways_use_sma': True, 'sideways_use_ema': True, 'sideways_use_atr': True, 'sideways_use_adx': False, 'sideways_use_spike': True, 'sideways_rsi_required': True}.
[I 2025-09-01 10:13:30,488] Trial 428 finished with values: [-0.049795365762160926, 0.0496999167545442] and parameters: {'p_sma': 58, 'p_std': 47, 'p_atr': 14, 'p_adx': 12, 'rsi_period': 40, 'ema1': 8, 'ema2': 13, 'slip_atr_k': 0.1171962685567711, 'slip_spread_k': 0.5027035681840125, 'spread_hl_frac': 0.04435112875408162, 'bb_std_mult': 2.6362688096523543, 'rsi_os': 10, 'rsi_ob': 54, 'vol_spike': 0.19743774322370644, 'adx_thresh': 11.440710203357526, 'atr_min_pct': 0.01422973163582089, 'atr_max_pct': 0.09622419884485667, 'tp_mult': 2.0009124358092474, 'tsl_mult': 0.7884334602626795, 'strategy': 'breakout', 'time_stop': 146, 'use_sma': True, 'use_atr': True, 'use_adx': True, 'use_ema': False, 'use_spike': False, 'rsi_required': False, 'edge_k': 0.6579032426112046, 'edge_cap': 0.9016369278130039, 'bull_strategy': 'breakout', 'bull_bb_std_mult': 2.9997339494205866, 'bull_rsi_os': 36, 'bull_rsi_ob': 79, 'bull_adx_thresh': 28.625386992950787, 'bull_atr_min_pct': 2.9066097186301876e-05, 'bull_atr_max_pct': 0.08702510082617952, 'bull_tp_mult': 1.6284709998099285, 'bull_tsl_mult': 0.8862338780890545, 'bull_time_stop': 14, 'bull_use_sma': True, 'bull_use_ema': True, 'bull_use_atr': True, 'bull_use_adx': False, 'bull_use_spike': True, 'bull_rsi_required': True, 'bear_strategy': 'breakout', 'bear_bb_std_mult': 2.938121230415303, 'bear_rsi_os': 18, 'bear_rsi_ob': 82, 'bear_adx_thresh': 34.16208839572599, 'bear_atr_min_pct': 0.01709807679041678, 'bear_atr_max_pct': 0.128153517437048, 'bear_tp_mult': 2.8632307376577213, 'bear_tsl_mult': 0.04234614358254285, 'bear_time_stop': 87, 'bear_use_sma': False, 'bear_use_ema': True, 'bear_use_atr': False, 'bear_use_adx': True, 'bear_use_spike': True, 'bear_rsi_required': True, 'sideways_strategy': 'breakout', 'sideways_bb_std_mult': 0.736339943872039, 'sideways_rsi_os': 29, 'sideways_rsi_ob': 60, 'sideways_adx_thresh': 14.012508746502512, 'sideways_atr_min_pct': 0.003796499538575613, 'sideways_atr_max_pct': 0.08730722444502721, 'sideways_tp_mult': 1.7287713794323283, 'sideways_tsl_mult': 0.9839758818866692, 'sideways_time_stop': 231, 'sideways_use_sma': True, 'sideways_use_ema': False, 'sideways_use_atr': True, 'sideways_use_adx': True, 'sideways_use_spike': True, 'sideways_rsi_required': False}.
[I 2025-09-01 10:13:30,746] Trial 429 finished with values: [-0.0047751359762922, 0.005717504106875748] and parameters: {'p_sma': 26, 'p_std': 57, 'p_atr': 21, 'p_adx': 14, 'rsi_period': 40, 'ema1': 29, 'ema2': 13, 'slip_atr_k': 0.11913029805837166, 'slip_spread_k': 0.009121534666773623, 'spread_hl_frac': 0.006261058929825323, 'bb_std_mult': 2.6439423257133567, 'rsi_os': 11, 'rsi_ob': 49, 'vol_spike': 0.006204421809241356, 'adx_thresh': 34.02843895503179, 'atr_min_pct': 0.014096627452001059, 'atr_max_pct': 0.041519828462615455, 'tp_mult': 1.998937629156134, 'tsl_mult': 0.8653159289407961, 'strategy': 'breakout', 'time_stop': 255, 'use_sma': True, 'use_atr': True, 'use_adx': True, 'use_ema': False, 'use_spike': True, 'rsi_required': False, 'edge_k': 1.3027959840708447, 'edge_cap': 0.8396670123944227, 'bull_strategy': 'mean_reversion', 'bull_bb_std_mult': 3.350487577984907, 'bull_rsi_os': 36, 'bull_rsi_ob': 82, 'bull_adx_thresh': 22.79902654458617, 'bull_atr_min_pct': 0.004549930398297937, 'bull_atr_max_pct': 0.0740998226859001, 'bull_tp_mult': 1.6106225440271262, 'bull_tsl_mult': 0.09435869080755149, 'bull_time_stop': 35, 'bull_use_sma': True, 'bull_use_ema': False, 'bull_use_atr': True, 'bull_use_adx': False, 'bull_use_spike': True, 'bull_rsi_required': True, 'bear_strategy': 'breakout', 'bear_bb_std_mult': 3.44550372991669, 'bear_rsi_os': 43, 'bear_rsi_ob': 79, 'bear_adx_thresh': 33.8877713824979, 'bear_atr_min_pct': 0.02870320622715987, 'bear_atr_max_pct': 0.12279065524610977, 'bear_tp_mult': 2.86671982913449, 'bear_tsl_mult': 0.7706042696522477, 'bear_time_stop': 169, 'bear_use_sma': False, 'bear_use_ema': True, 'bear_use_atr': True, 'bear_use_adx': True, 'bear_use_spike': True, 'bear_rsi_required': False, 'sideways_strategy': 'mean_reversion', 'sideways_bb_std_mult': 2.3120892770063484, 'sideways_rsi_os': 29, 'sideways_rsi_ob': 67, 'sideways_adx_thresh': 13.580421847422109, 'sideways_atr_min_pct': 0.0019173623671882105, 'sideways_atr_max_pct': 0.028865084952913365, 'sideways_tp_mult': 1.3247301645838347, 'sideways_tsl_mult': 0.9709190948583173, 'sideways_time_stop': 246, 'sideways_use_sma': True, 'sideways_use_ema': False, 'sideways_use_atr': True, 'sideways_use_adx': True, 'sideways_use_spike': True, 'sideways_rsi_required': False}.
[I 2025-09-01 10:14:10,423] Trial 431 finished with values: [-1000000000.0, 1000000000.0] and parameters: {'p_sma': 41, 'p_std': 42, 'p_atr': 21, 'p_adx': 29, 'rsi_period': 19, 'ema1': 11, 'ema2': 46, 'slip_atr_k': 0.005855208893063318, 'slip_spread_k': 0.006549380653016357, 'spread_hl_frac': 0.04524816892897936, 'bb_std_mult': 1.2250841421409566, 'rsi_os': 35, 'rsi_ob': 62, 'vol_spike': 0.1865886851328705, 'adx_thresh': 34.20210577587477, 'atr_min_pct': 0.019431039689724254, 'atr_max_pct': 0.1435734310678662, 'tp_mult': 2.017673092883521, 'tsl_mult': 0.8690209314438764, 'strategy': 'breakout', 'time_stop': 156, 'use_sma': True, 'use_atr': True, 'use_adx': False, 'use_ema': True, 'use_spike': True, 'rsi_required': False, 'edge_k': 0.6548342673874382, 'edge_cap': 0.8721196732572329, 'bull_strategy': 'mean_reversion', 'bull_bb_std_mult': 0.9208027146072053, 'bull_rsi_os': 35, 'bull_rsi_ob': 82, 'bull_adx_thresh': 28.065934666901327, 'bull_atr_min_pct': 0.0037556180839405868, 'bull_atr_max_pct': 0.09323364737602173, 'bull_tp_mult': 1.4713319456905931, 'bull_tsl_mult': 0.9673622773490361, 'bull_time_stop': 15, 'bull_use_sma': True, 'bull_use_ema': False, 'bull_use_atr': True, 'bull_use_adx': False, 'bull_use_spike': True, 'bull_rsi_required': False, 'bear_strategy': 'breakout', 'bear_bb_std_mult': 1.2853420174058474, 'bear_rsi_os': 17, 'bear_rsi_ob': 82, 'bear_adx_thresh': 33.9190897306231, 'bear_atr_min_pct': 0.028493361065127374, 'bear_atr_max_pct': 0.13569634703403768, 'bear_tp_mult': 2.8511289025957347, 'bear_tsl_mult': 0.7683551160381876, 'bear_time_stop': 218, 'bear_use_sma': True, 'bear_use_ema': True, 'bear_use_atr': True, 'bear_use_adx': True, 'bear_use_spike': True, 'bear_rsi_required': False, 'sideways_strategy': 'mean_reversion', 'sideways_bb_std_mult': 1.7398166708420784, 'sideways_rsi_os': 29, 'sideways_rsi_ob': 64, 'sideways_adx_thresh': 33.025355524240275, 'sideways_atr_min_pct': 0.0045245267246444894, 'sideways_atr_max_pct': 0.03815579015972323, 'sideways_tp_mult': 2.266042468977984, 'sideways_tsl_mult': 0.9767933280307525, 'sideways_time_stop': 231, 'sideways_use_sma': True, 'sideways_use_ema': False, 'sideways_use_atr': False, 'sideways_use_adx': False, 'sideways_use_spike': True, 'sideways_rsi_required': False}.
[I 2025-09-01 10:14:11,898] Trial 433 finished with values: [-0.017548380734231928, 0.017851212983942866] and parameters: {'p_sma': 43, 'p_std': 42, 'p_atr': 28, 'p_adx': 11, 'rsi_period': 65, 'ema1': 17, 'ema2': 38, 'slip_atr_k': 0.005910432503936412, 'slip_spread_k': 0.46986221770964676, 'spread_hl_frac': 0.0017187082357272704, 'bb_std_mult': 3.28183236330531, 'rsi_os': 47, 'rsi_ob': 56, 'vol_spike': 0.18555540830566092, 'adx_thresh': 13.309298810896987, 'atr_min_pct': 0.018451240698750628, 'atr_max_pct': 0.07118239125739037, 'tp_mult': 1.2023171870211509, 'tsl_mult': 0.8444533899870607, 'strategy': 'breakout', 'time_stop': 160, 'use_sma': True, 'use_atr': True, 'use_adx': False, 'use_ema': True, 'use_spike': True, 'rsi_required': False, 'edge_k': 1.0771036117077135, 'edge_cap': 0.8755793161543056, 'bull_strategy': 'mean_reversion', 'bull_bb_std_mult': 3.3889506020818265, 'bull_rsi_os': 37, 'bull_rsi_ob': 92, 'bull_adx_thresh': 11.19860326846538, 'bull_atr_min_pct': 0.004426692321194309, 'bull_atr_max_pct': 0.07176473204067133, 'bull_tp_mult': 1.4836641617930166, 'bull_tsl_mult': 0.10376976736891586, 'bull_time_stop': 159, 'bull_use_sma': False, 'bull_use_ema': False, 'bull_use_atr': True, 'bull_use_adx': False, 'bull_use_spike': True, 'bull_rsi_required': False, 'bear_strategy': 'breakout', 'bear_bb_std_mult': 0.7829163116021833, 'bear_rsi_os': 43, 'bear_rsi_ob': 56, 'bear_adx_thresh': 14.294121468848429, 'bear_atr_min_pct': 0.022337039174326927, 'bear_atr_max_pct': 0.1327347102240545, 'bear_tp_mult': 2.3619561875085893, 'bear_tsl_mult': 0.9083443122747407, 'bear_time_stop': 13, 'bear_use_sma': True, 'bear_use_ema': True, 'bear_use_atr': True, 'bear_use_adx': True, 'bear_use_spike': True, 'bear_rsi_required': False, 'sideways_strategy': 'mean_reversion', 'sideways_bb_std_mult': 2.5727579815939006, 'sideways_rsi_os': 42, 'sideways_rsi_ob': 59, 'sideways_adx_thresh': 30.256994215853315, 'sideways_atr_min_pct': 0.0023991054424412203, 'sideways_atr_max_pct': 0.029492929754784764, 'sideways_tp_mult': 1.2525925523127965, 'sideways_tsl_mult': 0.18027221204453925, 'sideways_time_stop': 91, 'sideways_use_sma': True, 'sideways_use_ema': False, 'sideways_use_atr': False, 'sideways_use_adx': False, 'sideways_use_spike': True, 'sideways_rsi_required': False}.
