[I 2025-09-01 09:48:14,856] Trial 280 finished with values: [-1000000000.0, 1000000000.0] and parameters: {'p_sma': 18, 'p_std': 45, 'p_atr': 10, 'p_adx': 11, 'rsi_period': 80, 'ema1': 17, 'ema2': 40, 'slip_atr_k': 0.18536224507503088, 'slip_spread_k': 0.4954203137583551, 'spread_hl_frac': 0.042730989778341694, 'bb_std_mult': 0.5854377365723891, 'rsi_os': 34, 'rsi_ob': 58, 'vol_spike': 0.1973420927982321, 'adx_thresh': 12.978834233079745, 'atr_min_pct': 0.020518357741647838, 'atr_max_pct': 0.12482257558455566, 'tp_mult': 2.4571269394791053, 'tsl_mult': 0.8914329405386463, 'strategy': 'breakout', 'time_stop': 127, 'use_sma': True, 'use_atr': True, 'use_adx': False, 'use_ema': True, 'use_spike': True, 'rsi_required': False, 'edge_k': 0.8193884164077252, 'edge_cap': 0.6133042308528434, 'bull_strategy': 'mean_reversion', 'bull_bb_std_mult': 3.5224918683738804, 'bull_rsi_os': 36, 'bull_rsi_ob': 91, 'bull_adx_thresh': 30.669800418082676, 'bull_atr_min_pct': 0.02484750241899106, 'bull_atr_max_pct': 0.09616745973477885, 'bull_tp_mult': 1.6859253027568755, 'bull_tsl_mult': 0.8584774782126359, 'bull_time_stop': 99, 'bull_use_sma': True, 'bull_use_ema': False, 'bull_use_atr': True, 'bull_use_adx': False, 'bull_use_spike': False, 'bull_rsi_required': False, 'bear_strategy': 'breakout', 'bear_bb_std_mult': 1.4835114919815255, 'bear_rsi_os': 21, 'bear_rsi_ob': 78, 'bear_adx_thresh': 33.55339752936445, 'bear_atr_min_pct': 0.02942596517664608, 'bear_atr_max_pct': 0.04252406120244293, 'bear_tp_mult': 2.8826309045501772, 'bear_tsl_mult': 0.8182076000147858, 'bear_time_stop': 11, 'bear_use_sma': False, 'bear_use_ema': True, 'bear_use_atr': True, 'bear_use_adx': False, 'bear_use_spike': True, 'bear_rsi_required': False, 'sideways_strategy': 'mean_reversion', 'sideways_bb_std_mult': 2.4102483046307843, 'sideways_rsi_os': 30, 'sideways_rsi_ob': 95, 'sideways_adx_thresh': 9.408148066396265, 'sideways_atr_min_pct': 0.007300569573331329, 'sideways_atr_max_pct': 0.08571894350346636, 'sideways_tp_mult': 1.4117809831497694, 'sideways_tsl_mult': 0.925876232876686, 'sideways_time_stop': 111, 'sideways_use_sma': False, 'sideways_use_ema': True, 'sideways_use_atr': False, 'sideways_use_adx': False, 'sideways_use_spike': True, 'sideways_rsi_required': False}.
[I 2025-09-01 09:48:15,836] Trial 281 finished with values: [-1000000000.0, 1000000000.0] and parameters: {'p_sma': 38, 'p_std': 45, 'p_atr': 27, 'p_adx': 11, 'rsi_period': 75, 'ema1': 20, 'ema2': 13, 'slip_atr_k': 0.018773995028167952, 'slip_spread_k': 0.8615322274609224, 'spread_hl_frac': 0.004262035118067701, 'bb_std_mult': 2.8334564523685524, 'rsi_os': 28, 'rsi_ob': 76, 'vol_spike': 0.1991448440121096, 'adx_thresh': 12.927878524505648, 'atr_min_pct': 0.016629690291399823, 'atr_max_pct': 0.1355078301025255, 'tp_mult': 2.452686133388374, 'tsl_mult': 0.8021642377230193, 'strategy': 'breakout', 'time_stop': 131, 'use_sma': True, 'use_atr': True, 'use_adx': True, 'use_ema': True, 'use_spike': True, 'rsi_required': False, 'edge_k': 0.8269621590292644, 'edge_cap': 0.8708434658963933, 'bull_strategy': 'mean_reversion', 'bull_bb_std_mult': 2.3420365917580814, 'bull_rsi_os': 36, 'bull_rsi_ob': 77, 'bull_adx_thresh': 26.84567706158695, 'bull_atr_min_pct': 0.016293763837255913, 'bull_atr_max_pct': 0.14437918895817944, 'bull_tp_mult': 1.5970073393950694, 'bull_tsl_mult': 0.8674338094994823, 'bull_time_stop': 130, 'bull_use_sma': True, 'bull_use_ema': False, 'bull_use_atr': True, 'bull_use_adx': False, 'bull_use_spike': False, 'bull_rsi_required': True, 'bear_strategy': 'breakout', 'bear_bb_std_mult': 1.4714759086441815, 'bear_rsi_os': 42, 'bear_rsi_ob': 72, 'bear_adx_thresh': 33.53135288580364, 'bear_atr_min_pct': 0.0293385320813258, 'bear_atr_max_pct': 0.09052859098369581, 'bear_tp_mult': 2.894757983309232, 'bear_tsl_mult': 0.5765967424582337, 'bear_time_stop': 72, 'bear_use_sma': False, 'bear_use_ema': True, 'bear_use_atr': True, 'bear_use_adx': False, 'bear_use_spike': True, 'bear_rsi_required': False, 'sideways_strategy': 'mean_reversion', 'sideways_bb_std_mult': 2.4651537836095634, 'sideways_rsi_os': 30, 'sideways_rsi_ob': 45, 'sideways_adx_thresh': 16.306070580714014, 'sideways_atr_min_pct': 0.019581980160502065, 'sideways_atr_max_pct': 0.014803291240415128, 'sideways_tp_mult': 2.090033209639537, 'sideways_tsl_mult': 0.898346587472781, 'sideways_time_stop': 104, 'sideways_use_sma': False, 'sideways_use_ema': True, 'sideways_use_atr': False, 'sideways_use_adx': False, 'sideways_use_spike': True, 'sideways_rsi_required': False}.
[I 2025-09-01 09:48:16,753] Trial 279 finished with values: [-0.030679757173860178, 0.03071231715763393] and parameters: {'p_sma': 55, 'p_std': 45, 'p_atr': 10, 'p_adx': 20, 'rsi_period': 75, 'ema1': 20, 'ema2': 10, 'slip_atr_k': 0.10519246802915255, 'slip_spread_k': 0.8638078195877874, 'spread_hl_frac': 0.02800696482148124, 'bb_std_mult': 0.8170261251702291, 'rsi_os': 35, 'rsi_ob': 58, 'vol_spike': 0.19763652749178595, 'adx_thresh': 12.876873754926997, 'atr_min_pct': 0.0013150921965147198, 'atr_max_pct': 0.13424199824422348, 'tp_mult': 2.4562719767375976, 'tsl_mult': 0.13084572383487314, 'strategy': 'breakout', 'time_stop': 172, 'use_sma': True, 'use_atr': True, 'use_adx': False, 'use_ema': True, 'use_spike': True, 'rsi_required': False, 'edge_k': 0.5616960820801684, 'edge_cap': 0.878028802361616, 'bull_strategy': 'mean_reversion', 'bull_bb_std_mult': 2.3095925315131844, 'bull_rsi_os': 18, 'bull_rsi_ob': 79, 'bull_adx_thresh': 26.466758429672797, 'bull_atr_min_pct': 0.016158181514270516, 'bull_atr_max_pct': 0.07813659786360255, 'bull_tp_mult': 1.9534761675010315, 'bull_tsl_mult': 0.9141828935751152, 'bull_time_stop': 10, 'bull_use_sma': True, 'bull_use_ema': False, 'bull_use_atr': True, 'bull_use_adx': False, 'bull_use_spike': False, 'bull_rsi_required': False, 'bear_strategy': 'breakout', 'bear_bb_std_mult': 1.4525710269652583, 'bear_rsi_os': 21, 'bear_rsi_ob': 46, 'bear_adx_thresh': 33.612210426944436, 'bear_atr_min_pct': 0.0001429004768506107, 'bear_atr_max_pct': 0.11895937923622324, 'bear_tp_mult': 2.8938714653886097, 'bear_tsl_mult': 0.3340440023089785, 'bear_time_stop': 72, 'bear_use_sma': False, 'bear_use_ema': True, 'bear_use_atr': True, 'bear_use_adx': False, 'bear_use_spike': True, 'bear_rsi_required': False, 'sideways_strategy': 'mean_reversion', 'sideways_bb_std_mult': 2.425435089381759, 'sideways_rsi_os': 48, 'sideways_rsi_ob': 46, 'sideways_adx_thresh': 17.953167807782613, 'sideways_atr_min_pct': 0.007122662272814299, 'sideways_atr_max_pct': 0.13422805389063686, 'sideways_tp_mult': 2.5019547055852356, 'sideways_tsl_mult': 0.06694850243026546, 'sideways_time_stop': 62, 'sideways_use_sma': False, 'sideways_use_ema': True, 'sideways_use_atr': False, 'sideways_use_adx': False, 'sideways_use_spike': True, 'sideways_rsi_required': False}.
[I 2025-09-01 09:48:56,168] Trial 284 finished with values: [-1000000000.0, 1000000000.0] and parameters: {'p_sma': 59, 'p_std': 44, 'p_atr': 20, 'p_adx': 16, 'rsi_period': 38, 'ema1': 16, 'ema2': 11, 'slip_atr_k': 0.005386223466897173, 'slip_spread_k': 0.08899062357442511, 'spread_hl_frac': 0.0024930455737317662, 'bb_std_mult': 2.5260455119789436, 'rsi_os': 10, 'rsi_ob': 56, 'vol_spike': 0.007084061189930352, 'adx_thresh': 11.746861706198592, 'atr_min_pct': 0.018969377335438617, 'atr_max_pct': 0.06978054658449642, 'tp_mult': 1.2183122702592182, 'tsl_mult': 0.8470358258578007, 'strategy': 'breakout', 'time_stop': 150, 'use_sma': True, 'use_atr': True, 'use_adx': True, 'use_ema': False, 'use_spike': False, 'rsi_required': False, 'edge_k': 0.5014308952760331, 'edge_cap': 0.8476027334046374, 'bull_strategy': 'breakout', 'bull_bb_std_mult': 3.4373475454769977, 'bull_rsi_os': 38, 'bull_rsi_ob': 79, 'bull_adx_thresh': 28.030882514758375, 'bull_atr_min_pct': 0.004288893345051798, 'bull_atr_max_pct': 0.05654787691838789, 'bull_tp_mult': 1.7785658937809865, 'bull_tsl_mult': 0.09358614185993075, 'bull_time_stop': 138, 'bull_use_sma': True, 'bull_use_ema': True, 'bull_use_atr': True, 'bull_use_adx': True, 'bull_use_spike': True, 'bull_rsi_required': True, 'bear_strategy': 'breakout', 'bear_bb_std_mult': 1.7594577551908905, 'bear_rsi_os': 45, 'bear_rsi_ob': 74, 'bear_adx_thresh': 21.39233652655337, 'bear_atr_min_pct': 0.028219639875180526, 'bear_atr_max_pct': 0.1164924164686675, 'bear_tp_mult': 2.515103472360048, 'bear_tsl_mult': 0.7985766756874397, 'bear_time_stop': 5, 'bear_use_sma': False, 'bear_use_ema': True, 'bear_use_atr': True, 'bear_use_adx': True, 'bear_use_spike': True, 'bear_rsi_required': False, 'sideways_strategy': 'breakout', 'sideways_bb_std_mult': 2.706005213782232, 'sideways_rsi_os': 48, 'sideways_rsi_ob': 81, 'sideways_adx_thresh': 18.01322537471454, 'sideways_atr_min_pct': 0.0022811845762839103, 'sideways_atr_max_pct': 0.08448135601688884, 'sideways_tp_mult': 1.596269347695383, 'sideways_tsl_mult': 0.9810729966455634, 'sideways_time_stop': 154, 'sideways_use_sma': True, 'sideways_use_ema': False, 'sideways_use_atr': False, 'sideways_use_adx': True, 'sideways_use_spike': True, 'sideways_rsi_required': False}.
[I 2025-09-01 09:48:56,670] Trial 285 finished with values: [-1000000000.0, 1000000000.0] and parameters: {'p_sma': 59, 'p_std': 29, 'p_atr': 18, 'p_adx': 23, 'rsi_period': 50, 'ema1': 15, 'ema2': 11, 'slip_atr_k': 0.22494120491216718, 'slip_spread_k': 0.5538345056280259, 'spread_hl_frac': 0.007036233339552657, 'bb_std_mult': 2.506057896818822, 'rsi_os': 8, 'rsi_ob': 56, 'vol_spike': 0.07414838799849266, 'adx_thresh': 10.269163452225682, 'atr_min_pct': 0.01919872253988488, 'atr_max_pct': 0.07091138508703437, 'tp_mult': 2.533710449167412, 'tsl_mult': 0.15709724652180984, 'strategy': 'breakout', 'time_stop': 85, 'use_sma': True, 'use_atr': False, 'use_adx': True, 'use_ema': False, 'use_spike': False, 'rsi_required': False, 'edge_k': 0.6785439245029177, 'edge_cap': 0.11377944006794988, 'bull_strategy': 'breakout', 'bull_bb_std_mult': 3.430891111119087, 'bull_rsi_os': 38, 'bull_rsi_ob': 72, 'bull_adx_thresh': 28.866702684134715, 'bull_atr_min_pct': 0.028071483200555837, 'bull_atr_max_pct': 0.08168396881275507, 'bull_tp_mult': 1.5399019807979633, 'bull_tsl_mult': 0.6922268133779294, 'bull_time_stop': 147, 'bull_use_sma': True, 'bull_use_ema': True, 'bull_use_atr': True, 'bull_use_adx': True, 'bull_use_spike': True, 'bull_rsi_required': True, 'bear_strategy': 'mean_reversion', 'bear_bb_std_mult': 1.6438783658995804, 'bear_rsi_os': 42, 'bear_rsi_ob': 70, 'bear_adx_thresh': 34.05419858822175, 'bear_atr_min_pct': 0.028421847461126165, 'bear_atr_max_pct': 0.022300633264360332, 'bear_tp_mult': 2.9296398893577926, 'bear_tsl_mult': 0.29595790267009137, 'bear_time_stop': 6, 'bear_use_sma': False, 'bear_use_ema': True, 'bear_use_atr': True, 'bear_use_adx': True, 'bear_use_spike': True, 'bear_rsi_required': True, 'sideways_strategy': 'breakout', 'sideways_bb_std_mult': 2.5787896623033184, 'sideways_rsi_os': 34, 'sideways_rsi_ob': 65, 'sideways_adx_thresh': 7.156097430136958, 'sideways_atr_min_pct': 0.021091487338764075, 'sideways_atr_max_pct': 0.06029755615243054, 'sideways_tp_mult': 1.3592912066472345, 'sideways_tsl_mult': 0.228186408289473, 'sideways_time_stop': 249, 'sideways_use_sma': True, 'sideways_use_ema': False, 'sideways_use_atr': False, 'sideways_use_adx': True, 'sideways_use_spike': True, 'sideways_rsi_required': True}.
[I 2025-09-01 09:48:57,171] Trial 282 finished with values: [-1000000000.0, 1000000000.0] and parameters: {'p_sma': 55, 'p_std': 29, 'p_atr': 27, 'p_adx': 16, 'rsi_period': 19, 'ema1': 17, 'ema2': 13, 'slip_atr_k': 0.020564584947564045, 'slip_spread_k': 0.5093778395439232, 'spread_hl_frac': 0.004664440751943332, 'bb_std_mult': 2.9052145195341397, 'rsi_os': 10, 'rsi_ob': 82, 'vol_spike': 0.20737361211761784, 'adx_thresh': 12.814182672557587, 'atr_min_pct': 0.019092874241036326, 'atr_max_pct': 0.0698186476438112, 'tp_mult': 2.4531926822481744, 'tsl_mult': 0.6767845074204577, 'strategy': 'breakout', 'time_stop': 294, 'use_sma': True, 'use_atr': True, 'use_adx': True, 'use_ema': False, 'use_spike': False, 'rsi_required': False, 'edge_k': 0.5813628459484006, 'edge_cap': 0.863589115517683, 'bull_strategy': 'breakout', 'bull_bb_std_mult': 3.2513701598570703, 'bull_rsi_os': 27, 'bull_rsi_ob': 77, 'bull_adx_thresh': 9.783206826783427, 'bull_atr_min_pct': 0.016183450599755123, 'bull_atr_max_pct': 0.14577916866165078, 'bull_tp_mult': 1.9618910303188442, 'bull_tsl_mult': 0.6934171117761176, 'bull_time_stop': 88, 'bull_use_sma': True, 'bull_use_ema': True, 'bull_use_atr': True, 'bull_use_adx': False, 'bull_use_spike': False, 'bull_rsi_required': True, 'bear_strategy': 'breakout', 'bear_bb_std_mult': 1.4189361250740045, 'bear_rsi_os': 42, 'bear_rsi_ob': 74, 'bear_adx_thresh': 21.340269002244355, 'bear_atr_min_pct': 0.02843629886601496, 'bear_atr_max_pct': 0.03256968738055741, 'bear_tp_mult': 1.2424448867472, 'bear_tsl_mult': 0.5777721670331903, 'bear_time_stop': 10, 'bear_use_sma': False, 'bear_use_ema': True, 'bear_use_atr': True, 'bear_use_adx': False, 'bear_use_spike': True, 'bear_rsi_required': False, 'sideways_strategy': 'mean_reversion', 'sideways_bb_std_mult': 3.5975436144293687, 'sideways_rsi_os': 12, 'sideways_rsi_ob': 88, 'sideways_adx_thresh': 27.62036037953164, 'sideways_atr_min_pct': 0.00721508275104739, 'sideways_atr_max_pct': 0.08400678679507559, 'sideways_tp_mult': 1.4305398808884937, 'sideways_tsl_mult': 0.8946580370489206, 'sideways_time_stop': 229, 'sideways_use_sma': False, 'sideways_use_ema': True, 'sideways_use_atr': False, 'sideways_use_adx': False, 'sideways_use_spike': True, 'sideways_rsi_required': False}.
[I 2025-09-01 09:48:57,521] Trial 283 finished with values: [-0.00559631403913996, 0.006407952586642124] and parameters: {'p_sma': 59, 'p_std': 44, 'p_atr': 27, 'p_adx': 16, 'rsi_period': 36, 'ema1': 11, 'ema2': 11, 'slip_atr_k': 0.017934497840233328, 'slip_spread_k': 0.7580990306028328, 'spread_hl_frac': 0.024379530127722124, 'bb_std_mult': 1.9293176522605675, 'rsi_os': 10, 'rsi_ob': 61, 'vol_spike': 0.2058351640191859, 'adx_thresh': 17.479817186848855, 'atr_min_pct': 0.0056418932845050205, 'atr_max_pct': 0.07093048680159067, 'tp_mult': 2.8058084524674993, 'tsl_mult': 0.6792688498029881, 'strategy': 'breakout', 'time_stop': 157, 'use_sma': True, 'use_atr': True, 'use_adx': True, 'use_ema': False, 'use_spike': False, 'rsi_required': False, 'edge_k': 0.5527290917559421, 'edge_cap': 0.8785227420151502, 'bull_strategy': 'breakout', 'bull_bb_std_mult': 3.245174389508942, 'bull_rsi_os': 27, 'bull_rsi_ob': 77, 'bull_adx_thresh': 10.380408022925733, 'bull_atr_min_pct': 0.02822856867004607, 'bull_atr_max_pct': 0.14485664850558394, 'bull_tp_mult': 1.607202706195172, 'bull_tsl_mult': 0.9096966764915931, 'bull_time_stop': 9, 'bull_use_sma': True, 'bull_use_ema': True, 'bull_use_atr': True, 'bull_use_adx': True, 'bull_use_spike': False, 'bull_rsi_required': True, 'bear_strategy': 'breakout', 'bear_bb_std_mult': 1.7695853925446692, 'bear_rsi_os': 42, 'bear_rsi_ob': 72, 'bear_adx_thresh': 20.82631929368261, 'bear_atr_min_pct': 0.005611394963482603, 'bear_atr_max_pct': 0.119807241423035, 'bear_tp_mult': 1.2374770152692243, 'bear_tsl_mult': 0.23095047118114653, 'bear_time_stop': 9, 'bear_use_sma': False, 'bear_use_ema': True, 'bear_use_atr': True, 'bear_use_adx': False, 'bear_use_spike': True, 'bear_rsi_required': False, 'sideways_strategy': 'breakout', 'sideways_bb_std_mult': 2.5764314850541683, 'sideways_rsi_os': 8, 'sideways_rsi_ob': 62, 'sideways_adx_thresh': 31.33381278560341, 'sideways_atr_min_pct': 0.0024416427519680537, 'sideways_atr_max_pct': 0.061465621630566, 'sideways_tp_mult': 1.9992453331493378, 'sideways_tsl_mult': 0.8901122013671343, 'sideways_time_stop': 224, 'sideways_use_sma': True, 'sideways_use_ema': True, 'sideways_use_atr': False, 'sideways_use_adx': False, 'sideways_use_spike': True, 'sideways_rsi_required': False}.
[I 2025-09-01 09:49:37,856] Trial 289 finished with values: [-0.016587269002594218, 0.01660891001745167] and parameters: {'p_sma': 58, 'p_std': 31, 'p_atr': 16, 'p_adx': 10, 'rsi_period': 30, 'ema1': 29, 'ema2': 12, 'slip_atr_k': 0.007117609279262394, 'slip_spread_k': 0.6172869560710716, 'spread_hl_frac': 0.03948973565569815, 'bb_std_mult': 2.207143565635151, 'rsi_os': 23, 'rsi_ob': 94, 'vol_spike': 0.08565860241688061, 'adx_thresh': 8.009569468748461, 'atr_min_pct': 0.019921442788444717, 'atr_max_pct': 0.06075195197083404, 'tp_mult': 2.004354968803219, 'tsl_mult': 0.24867358795199956, 'strategy': 'breakout', 'time_stop': 158, 'use_sma': False, 'use_atr': True, 'use_adx': False, 'use_ema': False, 'use_spike': True, 'rsi_required': False, 'edge_k': 1.7063889212958632, 'edge_cap': 0.8096087296654583, 'bull_strategy': 'mean_reversion', 'bull_bb_std_mult': 3.594909615167384, 'bull_rsi_os': 10, 'bull_rsi_ob': 78, 'bull_adx_thresh': 5.193286553207431, 'bull_atr_min_pct': 0.02042750058667952, 'bull_atr_max_pct': 0.12569508135417823, 'bull_tp_mult': 1.6065452378005625, 'bull_tsl_mult': 0.42528245418040656, 'bull_time_stop': 136, 'bull_use_sma': True, 'bull_use_ema': False, 'bull_use_atr': True, 'bull_use_adx': False, 'bull_use_spike': True, 'bull_rsi_required': False, 'bear_strategy': 'mean_reversion', 'bear_bb_std_mult': 1.5616623519401698, 'bear_rsi_os': 45, 'bear_rsi_ob': 72, 'bear_adx_thresh': 24.875497572980613, 'bear_atr_min_pct': 0.028925779681626813, 'bear_atr_max_pct': 0.12781214463683352, 'bear_tp_mult': 1.6849201030936611, 'bear_tsl_mult': 0.8292652434693409, 'bear_time_stop': 16, 'bear_use_sma': False, 'bear_use_ema': True, 'bear_use_atr': True, 'bear_use_adx': True, 'bear_use_spike': True, 'bear_rsi_required': True, 'sideways_strategy': 'mean_reversion', 'sideways_bb_std_mult': 2.5771363320299545, 'sideways_rsi_os': 37, 'sideways_rsi_ob': 62, 'sideways_adx_thresh': 18.960517204924532, 'sideways_atr_min_pct': 0.003425658976782973, 'sideways_atr_max_pct': 0.08717990957367296, 'sideways_tp_mult': 2.569429910917453, 'sideways_tsl_mult': 0.9424442335890763, 'sideways_time_stop': 223, 'sideways_use_sma': True, 'sideways_use_ema': False, 'sideways_use_atr': True, 'sideways_use_adx': False, 'sideways_use_spike': True, 'sideways_rsi_required': False}.
[I 2025-09-01 09:49:38,814] Trial 288 finished with values: [-0.024150506341009903, 0.024468484345095465] and parameters: {'p_sma': 58, 'p_std': 47, 'p_atr': 22, 'p_adx': 27, 'rsi_period': 40, 'ema1': 10, 'ema2': 12, 'slip_atr_k': 0.05191251805966708, 'slip_spread_k': 0.7630959004170695, 'spread_hl_frac': 0.03959077712189765, 'bb_std_mult': 1.4371465559223768, 'rsi_os': 52, 'rsi_ob': 53, 'vol_spike': 0.1909077977573009, 'adx_thresh': 22.964647311196952, 'atr_min_pct': 0.027234404141869215, 'atr_max_pct': 0.06118561737888727, 'tp_mult': 2.0160948821151847, 'tsl_mult': 0.7869091685347817, 'strategy': 'breakout', 'time_stop': 156, 'use_sma': False, 'use_atr': True, 'use_adx': False, 'use_ema': False, 'use_spike': True, 'rsi_required': False, 'edge_k': 0.2281156662718996, 'edge_cap': 0.8048429787977932, 'bull_strategy': 'mean_reversion', 'bull_bb_std_mult': 0.679260240891193, 'bull_rsi_os': 23, 'bull_rsi_ob': 78, 'bull_adx_thresh': 5.037474554004573, 'bull_atr_min_pct': 0.0035219003021820347, 'bull_atr_max_pct': 0.12458904222890078, 'bull_tp_mult': 1.014187901971865, 'bull_tsl_mult': 0.9013085532721679, 'bull_time_stop': 188, 'bull_use_sma': True, 'bull_use_ema': False, 'bull_use_atr': True, 'bull_use_adx': False, 'bull_use_spike': True, 'bull_rsi_required': False, 'bear_strategy': 'breakout', 'bear_bb_std_mult': 1.346275632565383, 'bear_rsi_os': 18, 'bear_rsi_ob': 95, 'bear_adx_thresh': 34.99503342971595, 'bear_atr_min_pct': 0.028928998350279213, 'bear_atr_max_pct': 0.12688063037676292, 'bear_tp_mult': 1.1240590502328054, 'bear_tsl_mult': 0.8222909346673462, 'bear_time_stop': 111, 'bear_use_sma': False, 'bear_use_ema': True, 'bear_use_atr': False, 'bear_use_adx': True, 'bear_use_spike': True, 'bear_rsi_required': False, 'sideways_strategy': 'mean_reversion', 'sideways_bb_std_mult': 1.4800660804571195, 'sideways_rsi_os': 44, 'sideways_rsi_ob': 90, 'sideways_adx_thresh': 10.348665828466068, 'sideways_atr_min_pct': 0.0033656385911712966, 'sideways_atr_max_pct': 0.08728723526554868, 'sideways_tp_mult': 2.7048789759108254, 'sideways_tsl_mult': 0.9447928095334928, 'sideways_time_stop': 192, 'sideways_use_sma': True, 'sideways_use_ema': False, 'sideways_use_atr': True, 'sideways_use_adx': False, 'sideways_use_spike': True, 'sideways_rsi_required': False}.
