[I 2025-09-01 10:27:11,262] Trial 506 finished with values: [-1000000000.0, 1000000000.0] and parameters: {'p_sma': 58, 'p_std': 49, 'p_atr': 23, 'p_adx': 28, 'rsi_period': 35, 'ema1': 20, 'ema2': 10, 'slip_atr_k': 0.00021387318959907586, 'slip_spread_k': 0.597612651148539, 'spread_hl_frac': 0.014736609827619452, 'bb_std_mult': 2.0322198438821086, 'rsi_os': 5, 'rsi_ob': 59, 'vol_spike': 0.21479122806444742, 'adx_thresh': 18.913437861571825, 'atr_min_pct': 0.020768060452492337, 'atr_max_pct': 0.055872416890258014, 'tp_mult': 1.578910471343443, 'tsl_mult': 0.743246649050285, 'strategy': 'breakout', 'time_stop': 190, 'use_sma': False, 'use_atr': True, 'use_adx': True, 'use_ema': True, 'use_spike': True, 'rsi_required': False, 'edge_k': 0.5340812216817801, 'edge_cap': 0.16988276869650548, 'bull_strategy': 'mean_reversion', 'bull_bb_std_mult': 3.3470223085243767, 'bull_rsi_os': 35, 'bull_rsi_ob': 87, 'bull_adx_thresh': 28.26114204099551, 'bull_atr_min_pct': 0.004782688129356639, 'bull_atr_max_pct': 0.08987173203656648, 'bull_tp_mult': 1.785298700033195, 'bull_tsl_mult': 0.72377124870959, 'bull_time_stop': 138, 'bull_use_sma': False, 'bull_use_ema': False, 'bull_use_atr': True, 'bull_use_adx': True, 'bull_use_spike': True, 'bull_rsi_required': True, 'bear_strategy': 'mean_reversion', 'bear_bb_std_mult': 1.6519333693817426, 'bear_rsi_os': 43, 'bear_rsi_ob': 74, 'bear_adx_thresh': 32.90608048763383, 'bear_atr_min_pct': 0.008774189018394878, 'bear_atr_max_pct': 0.11771007651545386, 'bear_tp_mult': 2.088816893101682, 'bear_tsl_mult': 0.7998541252337096, 'bear_time_stop': 8, 'bear_use_sma': True, 'bear_use_ema': True, 'bear_use_atr': False, 'bear_use_adx': False, 'bear_use_spike': True, 'bear_rsi_required': True, 'sideways_strategy': 'breakout', 'sideways_bb_std_mult': 2.601687750686493, 'sideways_rsi_os': 27, 'sideways_rsi_ob': 94, 'sideways_adx_thresh': 32.86690241824069, 'sideways_atr_min_pct': 0.0016467119604047854, 'sideways_atr_max_pct': 0.010116618543378253, 'sideways_tp_mult': 2.678877385462268, 'sideways_tsl_mult': 0.9272840624325239, 'sideways_time_stop': 213, 'sideways_use_sma': False, 'sideways_use_ema': True, 'sideways_use_atr': True, 'sideways_use_adx': False, 'sideways_use_spike': True, 'sideways_rsi_required': False}.
[I 2025-09-01 10:27:12,012] Trial 505 finished with values: [-0.026795671518192288, 0.027038452843745866] and parameters: {'p_sma': 19, 'p_std': 31, 'p_atr': 28, 'p_adx': 16, 'rsi_period': 53, 'ema1': 18, 'ema2': 44, 'slip_atr_k': 0.22460416548670625, 'slip_spread_k': 0.5752876549890947, 'spread_hl_frac': 0.008135183769953045, 'bb_std_mult': 0.655784002845148, 'rsi_os': 8, 'rsi_ob': 71, 'vol_spike': 0.21490562657917037, 'adx_thresh': 5.463158905309412, 'atr_min_pct': 0.019047501508877192, 'atr_max_pct': 0.053089877356477806, 'tp_mult': 2.5950852739405024, 'tsl_mult': 0.727567361845196, 'strategy': 'breakout', 'time_stop': 143, 'use_sma': False, 'use_atr': True, 'use_adx': False, 'use_ema': True, 'use_spike': True, 'rsi_required': False, 'edge_k': 1.0120372278401686, 'edge_cap': 0.8756647698187625, 'bull_strategy': 'mean_reversion', 'bull_bb_std_mult': 3.4199263939770783, 'bull_rsi_os': 35, 'bull_rsi_ob': 80, 'bull_adx_thresh': 28.112614857650186, 'bull_atr_min_pct': 0.016392857228729366, 'bull_atr_max_pct': 0.07969914363449082, 'bull_tp_mult': 1.4828173780065002, 'bull_tsl_mult': 0.7250825771409072, 'bull_time_stop': 143, 'bull_use_sma': False, 'bull_use_ema': True, 'bull_use_atr': True, 'bull_use_adx': True, 'bull_use_spike': True, 'bull_rsi_required': False, 'bear_strategy': 'mean_reversion', 'bear_bb_std_mult': 1.945390558202039, 'bear_rsi_os': 40, 'bear_rsi_ob': 57, 'bear_adx_thresh': 10.256693314967993, 'bear_atr_min_pct': 0.029313610166931837, 'bear_atr_max_pct': 0.12741901871439296, 'bear_tp_mult': 1.3730797609789742, 'bear_tsl_mult': 0.8008762467006705, 'bear_time_stop': 222, 'bear_use_sma': True, 'bear_use_ema': True, 'bear_use_atr': False, 'bear_use_adx': False, 'bear_use_spike': True, 'bear_rsi_required': True, 'sideways_strategy': 'breakout', 'sideways_bb_std_mult': 2.1978607732963664, 'sideways_rsi_os': 34, 'sideways_rsi_ob': 50, 'sideways_adx_thresh': 30.228127362958553, 'sideways_atr_min_pct': 0.0020459489333775195, 'sideways_atr_max_pct': 0.010070836382390536, 'sideways_tp_mult': 2.533160361636316, 'sideways_tsl_mult': 0.9757364934380793, 'sideways_time_stop': 206, 'sideways_use_sma': False, 'sideways_use_ema': True, 'sideways_use_atr': True, 'sideways_use_adx': False, 'sideways_use_spike': False, 'sideways_rsi_required': False}.
[I 2025-09-01 10:27:12,674] Trial 504 finished with values: [-1000000000.0, 1000000000.0] and parameters: {'p_sma': 19, 'p_std': 31, 'p_atr': 28, 'p_adx': 22, 'rsi_period': 62, 'ema1': 9, 'ema2': 51, 'slip_atr_k': 0.010290259278397907, 'slip_spread_k': 0.6779364720507692, 'spread_hl_frac': 0.0164573530098363, 'bb_std_mult': 2.8105641498207126, 'rsi_os': 9, 'rsi_ob': 59, 'vol_spike': 0.16557424573805188, 'adx_thresh': 19.426279273470247, 'atr_min_pct': 0.018864651288901996, 'atr_max_pct': 0.05309440519656887, 'tp_mult': 2.5070562129284575, 'tsl_mult': 0.8242713605062225, 'strategy': 'breakout', 'time_stop': 211, 'use_sma': False, 'use_atr': True, 'use_adx': False, 'use_ema': True, 'use_spike': True, 'rsi_required': False, 'edge_k': 1.8970368265862987, 'edge_cap': 0.8723485756780737, 'bull_strategy': 'breakout', 'bull_bb_std_mult': 3.436439876969009, 'bull_rsi_os': 39, 'bull_rsi_ob': 88, 'bull_adx_thresh': 10.979405786268819, 'bull_atr_min_pct': 0.020517506716489612, 'bull_atr_max_pct': 0.08051263293680799, 'bull_tp_mult': 1.0929551292812048, 'bull_tsl_mult': 0.7224361941264275, 'bull_time_stop': 70, 'bull_use_sma': False, 'bull_use_ema': True, 'bull_use_atr': True, 'bull_use_adx': True, 'bull_use_spike': True, 'bull_rsi_required': False, 'bear_strategy': 'mean_reversion', 'bear_bb_std_mult': 1.3060268318735035, 'bear_rsi_os': 21, 'bear_rsi_ob': 67, 'bear_adx_thresh': 33.06644539021677, 'bear_atr_min_pct': 0.029204573007011743, 'bear_atr_max_pct': 0.12572973710261298, 'bear_tp_mult': 2.821425357172936, 'bear_tsl_mult': 0.7104380413966492, 'bear_time_stop': 10, 'bear_use_sma': True, 'bear_use_ema': True, 'bear_use_atr': False, 'bear_use_adx': False, 'bear_use_spike': False, 'bear_rsi_required': True, 'sideways_strategy': 'mean_reversion', 'sideways_bb_std_mult': 2.5818238789984487, 'sideways_rsi_os': 27, 'sideways_rsi_ob': 58, 'sideways_adx_thresh': 32.803623717147445, 'sideways_atr_min_pct': 0.0055110388253148315, 'sideways_atr_max_pct': 0.08892543775817527, 'sideways_tp_mult': 1.3454354233227526, 'sideways_tsl_mult': 0.999821628709182, 'sideways_time_stop': 214, 'sideways_use_sma': False, 'sideways_use_ema': True, 'sideways_use_atr': True, 'sideways_use_adx': False, 'sideways_use_spike': True, 'sideways_rsi_required': False}.
[I 2025-09-01 10:27:13,828] Trial 508 finished with values: [-1000000000.0, 1000000000.0] and parameters: {'p_sma': 60, 'p_std': 46, 'p_atr': 25, 'p_adx': 11, 'rsi_period': 43, 'ema1': 18, 'ema2': 11, 'slip_atr_k': 0.004371081996580797, 'slip_spread_k': 0.604612128701872, 'spread_hl_frac': 0.020645794663489418, 'bb_std_mult': 2.6355978389466954, 'rsi_os': 9, 'rsi_ob': 56, 'vol_spike': 0.20710207142521642, 'adx_thresh': 13.987936708472255, 'atr_min_pct': 0.01843884457607403, 'atr_max_pct': 0.013437907040607641, 'tp_mult': 2.5059798238253914, 'tsl_mult': 0.8281007500137473, 'strategy': 'breakout', 'time_stop': 174, 'use_sma': True, 'use_atr': True, 'use_adx': False, 'use_ema': False, 'use_spike': True, 'rsi_required': False, 'edge_k': 1.6371893785618539, 'edge_cap': 0.9022280039411061, 'bull_strategy': 'mean_reversion', 'bull_bb_std_mult': 3.3981156601935023, 'bull_rsi_os': 22, 'bull_rsi_ob': 82, 'bull_adx_thresh': 18.25781602470475, 'bull_atr_min_pct': 0.005715272815094898, 'bull_atr_max_pct': 0.04921587163989925, 'bull_tp_mult': 1.6414916572405698, 'bull_tsl_mult': 0.9399731871717869, 'bull_time_stop': 153, 'bull_use_sma': True, 'bull_use_ema': False, 'bull_use_atr': True, 'bull_use_adx': False, 'bull_use_spike': True, 'bull_rsi_required': False, 'bear_strategy': 'breakout', 'bear_bb_std_mult': 1.512865017656391, 'bear_rsi_os': 41, 'bear_rsi_ob': 67, 'bear_adx_thresh': 10.332282105736649, 'bear_atr_min_pct': 0.02174270945865466, 'bear_atr_max_pct': 0.12802141841871253, 'bear_tp_mult': 2.8890673325998812, 'bear_tsl_mult': 0.7881388311837907, 'bear_time_stop': 229, 'bear_use_sma': False, 'bear_use_ema': True, 'bear_use_atr': True, 'bear_use_adx': True, 'bear_use_spike': True, 'bear_rsi_required': False, 'sideways_strategy': 'breakout', 'sideways_bb_std_mult': 2.21826199759881, 'sideways_rsi_os': 14, 'sideways_rsi_ob': 59, 'sideways_adx_thresh': 14.325362014551846, 'sideways_atr_min_pct': 0.002208928010787676, 'sideways_atr_max_pct': 0.11862198365364367, 'sideways_tp_mult': 1.3252233344220898, 'sideways_tsl_mult': 0.9809167155254915, 'sideways_time_stop': 150, 'sideways_use_sma': True, 'sideways_use_ema': False, 'sideways_use_atr': False, 'sideways_use_adx': False, 'sideways_use_spike': True, 'sideways_rsi_required': False}.
[I 2025-09-01 10:27:14,344] Trial 511 finished with values: [-1000000000.0, 1000000000.0] and parameters: {'p_sma': 9, 'p_std': 45, 'p_atr': 27, 'p_adx': 11, 'rsi_period': 48, 'ema1': 9, 'ema2': 16, 'slip_atr_k': 0.23579682928574697, 'slip_spread_k': 0.29883020679938543, 'spread_hl_frac': 0.005478344468348119, 'bb_std_mult': 2.7128577558513687, 'rsi_os': 53, 'rsi_ob': 54, 'vol_spike': 0.2358842928382981, 'adx_thresh': 11.654059886423978, 'atr_min_pct': 0.02058810691928086, 'atr_max_pct': 0.06439474826471013, 'tp_mult': 2.4720770309355435, 'tsl_mult': 0.8650122293998519, 'strategy': 'mean_reversion', 'time_stop': 149, 'use_sma': True, 'use_atr': True, 'use_adx': True, 'use_ema': False, 'use_spike': False, 'rsi_required': False, 'edge_k': 0.6113190239357673, 'edge_cap': 0.21015663822262876, 'bull_strategy': 'mean_reversion', 'bull_bb_std_mult': 3.2862089767159057, 'bull_rsi_os': 38, 'bull_rsi_ob': 77, 'bull_adx_thresh': 29.222878329920537, 'bull_atr_min_pct': 0.026068885538724506, 'bull_atr_max_pct': 0.08625114027079293, 'bull_tp_mult': 1.9835205525804893, 'bull_tsl_mult': 0.9181981052908726, 'bull_time_stop': 133, 'bull_use_sma': True, 'bull_use_ema': False, 'bull_use_atr': True, 'bull_use_adx': False, 'bull_use_spike': True, 'bull_rsi_required': True, 'bear_strategy': 'breakout', 'bear_bb_std_mult': 0.8676633832796514, 'bear_rsi_os': 26, 'bear_rsi_ob': 71, 'bear_adx_thresh': 15.115091874128737, 'bear_atr_min_pct': 0.003072808520814794, 'bear_atr_max_pct': 0.018617930905965765, 'bear_tp_mult': 2.940851487612325, 'bear_tsl_mult': 0.8645690106721581, 'bear_time_stop': 274, 'bear_use_sma': False, 'bear_use_ema': True, 'bear_use_atr': True, 'bear_use_adx': True, 'bear_use_spike': True, 'bear_rsi_required': False, 'sideways_strategy': 'mean_reversion', 'sideways_bb_std_mult': 2.869376161052879, 'sideways_rsi_os': 30, 'sideways_rsi_ob': 80, 'sideways_adx_thresh': 20.058817419906553, 'sideways_atr_min_pct': 0.003333393348787749, 'sideways_atr_max_pct': 0.07955976516324817, 'sideways_tp_mult': 2.4460217977248115, 'sideways_tsl_mult': 0.94675770838409, 'sideways_time_stop': 223, 'sideways_use_sma': True, 'sideways_use_ema': False, 'sideways_use_atr': False, 'sideways_use_adx': False, 'sideways_use_spike': True, 'sideways_rsi_required': False}.
[I 2025-09-01 10:27:56,520] Trial 509 finished with values: [-0.01951179883017362, 0.01950987704103601] and parameters: {'p_sma': 29, 'p_std': 46, 'p_atr': 27, 'p_adx': 11, 'rsi_period': 43, 'ema1': 9, 'ema2': 11, 'slip_atr_k': 0.05796089754768695, 'slip_spread_k': 0.6063015540292908, 'spread_hl_frac': 0.005470913135536167, 'bb_std_mult': 2.6201721086546486, 'rsi_os': 9, 'rsi_ob': 56, 'vol_spike': 0.1973838595354627, 'adx_thresh': 19.715117297409464, 'atr_min_pct': 0.007217244684211671, 'atr_max_pct': 0.13480940439758937, 'tp_mult': 2.5053398863770084, 'tsl_mult': 0.08022099058681054, 'strategy': 'breakout', 'time_stop': 175, 'use_sma': True, 'use_atr': True, 'use_adx': False, 'use_ema': False, 'use_spike': True, 'rsi_required': False, 'edge_k': 0.03446972099905932, 'edge_cap': 0.8996260712973553, 'bull_strategy': 'mean_reversion', 'bull_bb_std_mult': 2.326800954513122, 'bull_rsi_os': 38, 'bull_rsi_ob': 85, 'bull_adx_thresh': 16.067086737698926, 'bull_atr_min_pct': 0.0007406418179204269, 'bull_atr_max_pct': 0.11801626045296384, 'bull_tp_mult': 1.6213867626007072, 'bull_tsl_mult': 0.29371872891012796, 'bull_time_stop': 155, 'bull_use_sma': True, 'bull_use_ema': False, 'bull_use_atr': True, 'bull_use_adx': False, 'bull_use_spike': True, 'bull_rsi_required': False, 'bear_strategy': 'breakout', 'bear_bb_std_mult': 2.13844718217386, 'bear_rsi_os': 41, 'bear_rsi_ob': 71, 'bear_adx_thresh': 29.76701026577676, 'bear_atr_min_pct': 0.003218185362188349, 'bear_atr_max_pct': 0.01824060868908433, 'bear_tp_mult': 1.8731990163007153, 'bear_tsl_mult': 0.6593363437223382, 'bear_time_stop': 274, 'bear_use_sma': False, 'bear_use_ema': True, 'bear_use_atr': True, 'bear_use_adx': True, 'bear_use_spike': True, 'bear_rsi_required': False, 'sideways_strategy': 'mean_reversion', 'sideways_bb_std_mult': 2.780581049817346, 'sideways_rsi_os': 14, 'sideways_rsi_ob': 71, 'sideways_adx_thresh': 32.736818324344384, 'sideways_atr_min_pct': 0.015489266724171476, 'sideways_atr_max_pct': 0.11161955815806254, 'sideways_tp_mult': 1.9762546490159898, 'sideways_tsl_mult': 0.37636732352222335, 'sideways_time_stop': 223, 'sideways_use_sma': True, 'sideways_use_ema': False, 'sideways_use_atr': False, 'sideways_use_adx': False, 'sideways_use_spike': True, 'sideways_rsi_required': False}.
[I 2025-09-01 10:27:57,197] Trial 510 finished with values: [-1000000000.0, 1000000000.0] and parameters: {'p_sma': 29, 'p_std': 46, 'p_atr': 27, 'p_adx': 11, 'rsi_period': 42, 'ema1': 9, 'ema2': 11, 'slip_atr_k': 0.07367378140993391, 'slip_spread_k': 0.15391212510142654, 'spread_hl_frac': 0.0056877636150143174, 'bb_std_mult': 2.7057504167063153, 'rsi_os': 31, 'rsi_ob': 56, 'vol_spike': 0.2997455715939494, 'adx_thresh': 11.34496637540049, 'atr_min_pct': 0.018494355475880644, 'atr_max_pct': 0.1262182301590699, 'tp_mult': 1.1556237242478722, 'tsl_mult': 0.8331152639096769, 'strategy': 'breakout', 'time_stop': 153, 'use_sma': True, 'use_atr': True, 'use_adx': True, 'use_ema': False, 'use_spike': True, 'rsi_required': False, 'edge_k': 0.8489654140687313, 'edge_cap': 0.6318333536444678, 'bull_strategy': 'mean_reversion', 'bull_bb_std_mult': 0.5022250754166246, 'bull_rsi_os': 22, 'bull_rsi_ob': 81, 'bull_adx_thresh': 18.51551510783968, 'bull_atr_min_pct': 0.006236967849373392, 'bull_atr_max_pct': 0.0865218835090135, 'bull_tp_mult': 1.1480501518774546, 'bull_tsl_mult': 0.9360730866940371, 'bull_time_stop': 154, 'bull_use_sma': True, 'bull_use_ema': False, 'bull_use_atr': True, 'bull_use_adx': False, 'bull_use_spike': True, 'bull_rsi_required': True, 'bear_strategy': 'breakout', 'bear_bb_std_mult': 1.5269618788335668, 'bear_rsi_os': 26, 'bear_rsi_ob': 71, 'bear_adx_thresh': 29.93703658181536, 'bear_atr_min_pct': 0.003353258592325251, 'bear_atr_max_pct': 0.09756262014881904, 'bear_tp_mult': 1.8743806775848981, 'bear_tsl_mult': 0.46742260584311396, 'bear_time_stop': 275, 'bear_use_sma': False, 'bear_use_ema': True, 'bear_use_atr': True, 'bear_use_adx': True, 'bear_use_spike': True, 'bear_rsi_required': False, 'sideways_strategy': 'mean_reversion', 'sideways_bb_std_mult': 2.870053253054831, 'sideways_rsi_os': 30, 'sideways_rsi_ob': 71, 'sideways_adx_thresh': 25.16218636873438, 'sideways_atr_min_pct': 0.015365607279083293, 'sideways_atr_max_pct': 0.09432484333800047, 'sideways_tp_mult': 2.4405201376449503, 'sideways_tsl_mult': 0.3843993206484716, 'sideways_time_stop': 6, 'sideways_use_sma': True, 'sideways_use_ema': False, 'sideways_use_atr': False, 'sideways_use_adx': False, 'sideways_use_spike': True, 'sideways_rsi_required': False}.
[I 2025-09-01 10:27:57,661] Trial 507 finished with values: [-0.025239957535673985, 0.025469079078245336] and parameters: {'p_sma': 20, 'p_std': 46, 'p_atr': 27, 'p_adx': 11, 'rsi_period': 43, 'ema1': 5, 'ema2': 45, 'slip_atr_k': 0.13947863786515513, 'slip_spread_k': 0.6019015597198839, 'spread_hl_frac': 0.021116276966021495, 'bb_std_mult': 0.6562022852673159, 'rsi_os': 5, 'rsi_ob': 59, 'vol_spike': 0.23520905549164756, 'adx_thresh': 8.919857478273428, 'atr_min_pct': 0.005236837767375678, 'atr_max_pct': 0.11455774079860384, 'tp_mult': 2.596153805196443, 'tsl_mult': 0.8293253963496945, 'strategy': 'breakout', 'time_stop': 174, 'use_sma': False, 'use_atr': True, 'use_adx': True, 'use_ema': False, 'use_spike': True, 'rsi_required': False, 'edge_k': 1.8928031188979118, 'edge_cap': 0.8586982194691257, 'bull_strategy': 'mean_reversion', 'bull_bb_std_mult': 3.351988619946066, 'bull_rsi_os': 35, 'bull_rsi_ob': 86, 'bull_adx_thresh': 16.070230351690768, 'bull_atr_min_pct': 0.005744846342093658, 'bull_atr_max_pct': 0.08686442971798036, 'bull_tp_mult': 1.795977075861715, 'bull_tsl_mult': 0.9438560071651805, 'bull_time_stop': 155, 'bull_use_sma': False, 'bull_use_ema': False, 'bull_use_atr': True, 'bull_use_adx': False, 'bull_use_spike': True, 'bull_rsi_required': True, 'bear_strategy': 'breakout', 'bear_bb_std_mult': 1.5085076124043202, 'bear_rsi_os': 50, 'bear_rsi_ob': 67, 'bear_adx_thresh': 19.09378532173311, 'bear_atr_min_pct': 0.0031770828995130295, 'bear_atr_max_pct': 0.0472105296955845, 'bear_tp_mult': 2.1078105299214007, 'bear_tsl_mult': 0.6738293834352762, 'bear_time_stop': 221, 'bear_use_sma': False, 'bear_use_ema': True, 'bear_use_atr': True, 'bear_use_adx': True, 'bear_use_spike': True, 'bear_rsi_required': True, 'sideways_strategy': 'breakout', 'sideways_bb_std_mult': 2.493714262320068, 'sideways_rsi_os': 30, 'sideways_rsi_ob': 59, 'sideways_adx_thresh': 33.06668783268197, 'sideways_atr_min_pct': 0.0016008028380756145, 'sideways_atr_max_pct': 0.0794287098096337, 'sideways_tp_mult': 1.346109683428289, 'sideways_tsl_mult': 0.8082194714242796, 'sideways_time_stop': 214, 'sideways_use_sma': False, 'sideways_use_ema': False, 'sideways_use_atr': True, 'sideways_use_adx': False, 'sideways_use_spike': True, 'sideways_rsi_required': False}.
[I 2025-09-01 10:27:58,426] Trial 512 finished with values: [-0.01718004456863853, 0.017849063347692273] and parameters: {'p_sma': 54, 'p_std': 47, 'p_atr': 7, 'p_adx': 27, 'rsi_period': 38, 'ema1': 6, 'ema2': 10, 'slip_atr_k': 0.2416969663859007, 'slip_spread_k': 0.49422541131564834, 'spread_hl_frac': 0.007625187972338993, 'bb_std_mult': 2.5856198913407282, 'rsi_os': 31, 'rsi_ob': 55, 'vol_spike': 0.2813662804735579, 'adx_thresh': 10.388389123399113, 'atr_min_pct': 0.02180222396044793, 'atr_max_pct': 0.13652496421302543, 'tp_mult': 1.2694318959463933, 'tsl_mult': 0.8356692522360473, 'strategy': 'breakout', 'time_stop': 57, 'use_sma': True, 'use_atr': True, 'use_adx': False, 'use_ema': False, 'use_spike': True, 'rsi_required': False, 'edge_k': 0.8473253426000531, 'edge_cap': 0.8530370314604894, 'bull_strategy': 'mean_reversion', 'bull_bb_std_mult': 0.700921959505528, 'bull_rsi_os': 38, 'bull_rsi_ob': 61, 'bull_adx_thresh': 5.090919463092117, 'bull_atr_min_pct': 0.006328132484848742, 'bull_atr_max_pct': 0.10576114314443337, 'bull_tp_mult': 2.5194217176128655, 'bull_tsl_mult': 0.7617671247374663, 'bull_time_stop': 128, 'bull_use_sma': True, 'bull_use_ema': False, 'bull_use_atr': True, 'bull_use_adx': False, 'bull_use_spike': True, 'bull_rsi_required': False, 'bear_strategy': 'breakout', 'bear_bb_std_mult': 1.5192984918991548, 'bear_rsi_os': 46, 'bear_rsi_ob': 72, 'bear_adx_thresh': 33.743486267836545, 'bear_atr_min_pct': 0.027851906903939898, 'bear_atr_max_pct': 0.1256470442377648, 'bear_tp_mult': 1.8744633236277826, 'bear_tsl_mult': 0.47154467288579716, 'bear_time_stop': 74, 'bear_use_sma': False, 'bear_use_ema': True, 'bear_use_atr': True, 'bear_use_adx': True, 'bear_use_spike': True, 'bear_rsi_required': False, 'sideways_strategy': 'mean_reversion', 'sideways_bb_std_mult': 2.491219061698669, 'sideways_rsi_os': 30, 'sideways_rsi_ob': 56, 'sideways_adx_thresh': 25.38194733504428, 'sideways_atr_min_pct': 0.0039170616945981545, 'sideways_atr_max_pct': 0.04697889742870012, 'sideways_tp_mult': 1.39037544714634, 'sideways_tsl_mult': 0.9239491598361965, 'sideways_time_stop': 229, 'sideways_use_sma': True, 'sideways_use_ema': False, 'sideways_use_atr': False, 'sideways_use_adx': False, 'sideways_use_spike': True, 'sideways_rsi_required': False}.
