[I 2025-09-01 09:16:51,017] Trial 90 finished with values: [-1000000000.0, 1000000000.0] and parameters: {'p_sma': 57, 'p_std': 32, 'p_atr': 25, 'p_adx': 15, 'rsi_period': 41, 'ema1': 19, 'ema2': 17, 'slip_atr_k': 0.09176231892823915, 'slip_spread_k': 0.05546769656562378, 'spread_hl_frac': 0.020212612129341976, 'bb_std_mult': 2.5091031860637085, 'rsi_os': 42, 'rsi_ob': 55, 'vol_spike': 0.021951367103113323, 'adx_thresh': 32.28734552057241, 'atr_min_pct': 0.011595013487031198, 'atr_max_pct': 0.03307876420736841, 'tp_mult': 2.657808588368324, 'tsl_mult': 0.36429562872147525, 'strategy': 'mean_reversion', 'time_stop': 145, 'use_sma': True, 'use_atr': True, 'use_adx': False, 'use_ema': False, 'use_spike': True, 'rsi_required': False, 'edge_k': 0.855571514312539, 'edge_cap': 0.3809237423605427, 'bull_strategy': 'mean_reversion', 'bull_bb_std_mult': 2.5250912754092645, 'bull_rsi_os': 6, 'bull_rsi_ob': 76, 'bull_adx_thresh': 21.938161198479243, 'bull_atr_min_pct': 0.010072698015578935, 'bull_atr_max_pct': 0.1377570743149774, 'bull_tp_mult': 2.050093789745889, 'bull_tsl_mult': 0.46275260358502446, 'bull_time_stop': 75, 'bull_use_sma': False, 'bull_use_ema': False, 'bull_use_atr': True, 'bull_use_adx': False, 'bull_use_spike': True, 'bull_rsi_required': False, 'bear_strategy': 'breakout', 'bear_bb_std_mult': 1.3517741061660662, 'bear_rsi_os': 25, 'bear_rsi_ob': 66, 'bear_adx_thresh': 14.99027032223833, 'bear_atr_min_pct': 0.0075217208528728, 'bear_atr_max_pct': 0.12034502876990794, 'bear_tp_mult': 2.4843004087361606, 'bear_tsl_mult': 0.7269967075651412, 'bear_time_stop': 258, 'bear_use_sma': False, 'bear_use_ema': False, 'bear_use_atr': True, 'bear_use_adx': True, 'bear_use_spike': False, 'bear_rsi_required': False, 'sideways_strategy': 'mean_reversion', 'sideways_bb_std_mult': 2.073803321313398, 'sideways_rsi_os': 29, 'sideways_rsi_ob': 74, 'sideways_adx_thresh': 20.213872817137393, 'sideways_atr_min_pct': 0.0038302844399978114, 'sideways_atr_max_pct': 0.04747390257897414, 'sideways_tp_mult': 1.173137072055931, 'sideways_tsl_mult': 0.8044160156127396, 'sideways_time_stop': 177, 'sideways_use_sma': True, 'sideways_use_ema': False, 'sideways_use_atr': False, 'sideways_use_adx': False, 'sideways_use_spike': False, 'sideways_rsi_required': False}.
[I 2025-09-01 09:16:51,478] Trial 91 finished with values: [-1000000000.0, 1000000000.0] and parameters: {'p_sma': 15, 'p_std': 32, 'p_atr': 7, 'p_adx': 10, 'rsi_period': 62, 'ema1': 19, 'ema2': 26, 'slip_atr_k': 0.04345435247697285, 'slip_spread_k': 0.057109816652824164, 'spread_hl_frac': 0.013709155073177378, 'bb_std_mult': 3.1734058005065933, 'rsi_os': 53, 'rsi_ob': 55, 'vol_spike': 0.016682495715631768, 'adx_thresh': 18.157786000283345, 'atr_min_pct': 0.011601761292780984, 'atr_max_pct': 0.04344947979418593, 'tp_mult': 1.771428722399704, 'tsl_mult': 0.36677897251385544, 'strategy': 'mean_reversion', 'time_stop': 95, 'use_sma': True, 'use_atr': True, 'use_adx': False, 'use_ema': False, 'use_spike': True, 'rsi_required': False, 'edge_k': 0.8711704123859583, 'edge_cap': 0.17596563406786997, 'bull_strategy': 'mean_reversion', 'bull_bb_std_mult': 2.5360817069114043, 'bull_rsi_os': 52, 'bull_rsi_ob': 76, 'bull_adx_thresh': 17.48292408273255, 'bull_atr_min_pct': 0.0013616209403250492, 'bull_atr_max_pct': 0.07022759492861559, 'bull_tp_mult': 2.0060361473179964, 'bull_tsl_mult': 0.3499488922676469, 'bull_time_stop': 161, 'bull_use_sma': False, 'bull_use_ema': False, 'bull_use_atr': True, 'bull_use_adx': False, 'bull_use_spike': True, 'bull_rsi_required': False, 'bear_strategy': 'breakout', 'bear_bb_std_mult': 1.3656475475560912, 'bear_rsi_os': 25, 'bear_rsi_ob': 55, 'bear_adx_thresh': 17.143393579871333, 'bear_atr_min_pct': 0.003790708697536319, 'bear_atr_max_pct': 0.043093350997660734, 'bear_tp_mult': 2.9542518098255726, 'bear_tsl_mult': 0.7110470860504395, 'bear_time_stop': 262, 'bear_use_sma': False, 'bear_use_ema': False, 'bear_use_atr': True, 'bear_use_adx': True, 'bear_use_spike': False, 'bear_rsi_required': False, 'sideways_strategy': 'mean_reversion', 'sideways_bb_std_mult': 2.1166068184397457, 'sideways_rsi_os': 29, 'sideways_rsi_ob': 57, 'sideways_adx_thresh': 22.89837254943541, 'sideways_atr_min_pct': 0.0038489771301726157, 'sideways_atr_max_pct': 0.06943607814509843, 'sideways_tp_mult': 1.1743133830096044, 'sideways_tsl_mult': 0.8083648091197321, 'sideways_time_stop': 178, 'sideways_use_sma': True, 'sideways_use_ema': False, 'sideways_use_atr': False, 'sideways_use_adx': False, 'sideways_use_spike': False, 'sideways_rsi_required': False}.
[I 2025-09-01 09:17:29,951] Trial 93 finished with values: [-1000000000.0, 1000000000.0] and parameters: {'p_sma': 15, 'p_std': 24, 'p_atr': 22, 'p_adx': 10, 'rsi_period': 60, 'ema1': 19, 'ema2': 18, 'slip_atr_k': 0.02247679696998682, 'slip_spread_k': 0.0018859044456516205, 'spread_hl_frac': 0.025385162067363624, 'bb_std_mult': 3.1670193677437477, 'rsi_os': 42, 'rsi_ob': 57, 'vol_spike': 0.015424326600491617, 'adx_thresh': 7.801789981875064, 'atr_min_pct': 0.011792280340204178, 'atr_max_pct': 0.13748626981693185, 'tp_mult': 2.782220805303312, 'tsl_mult': 0.43318838313360825, 'strategy': 'mean_reversion', 'time_stop': 95, 'use_sma': True, 'use_atr': False, 'use_adx': False, 'use_ema': False, 'use_spike': True, 'rsi_required': False, 'edge_k': 0.8524455296950093, 'edge_cap': 0.08193772656711851, 'bull_strategy': 'mean_reversion', 'bull_bb_std_mult': 1.469036843761775, 'bull_rsi_os': 6, 'bull_rsi_ob': 81, 'bull_adx_thresh': 22.071768788721645, 'bull_atr_min_pct': 0.01487556326661928, 'bull_atr_max_pct': 0.13804209097446796, 'bull_tp_mult': 2.9247701344860055, 'bull_tsl_mult': 0.4599190352635112, 'bull_time_stop': 78, 'bull_use_sma': False, 'bull_use_ema': False, 'bull_use_atr': True, 'bull_use_adx': False, 'bull_use_spike': True, 'bull_rsi_required': False, 'bear_strategy': 'breakout', 'bear_bb_std_mult': 1.35494252819727, 'bear_rsi_os': 19, 'bear_rsi_ob': 49, 'bear_adx_thresh': 15.72321633461406, 'bear_atr_min_pct': 0.024932547039819425, 'bear_atr_max_pct': 0.09097141354498323, 'bear_tp_mult': 2.7662227871284806, 'bear_tsl_mult': 0.7299710783985798, 'bear_time_stop': 237, 'bear_use_sma': False, 'bear_use_ema': False, 'bear_use_atr': True, 'bear_use_adx': True, 'bear_use_spike': False, 'bear_rsi_required': False, 'sideways_strategy': 'mean_reversion', 'sideways_bb_std_mult': 2.3888134872232913, 'sideways_rsi_os': 22, 'sideways_rsi_ob': 57, 'sideways_adx_thresh': 25.204848579963826, 'sideways_atr_min_pct': 0.003732227501085911, 'sideways_atr_max_pct': 0.08879566301380341, 'sideways_tp_mult': 1.9787994909893485, 'sideways_tsl_mult': 0.7873739606233525, 'sideways_time_stop': 172, 'sideways_use_sma': True, 'sideways_use_ema': False, 'sideways_use_atr': False, 'sideways_use_adx': False, 'sideways_use_spike': False, 'sideways_rsi_required': False}.
[I 2025-09-01 09:17:30,202] Trial 94 finished with values: [-0.00987637782204387, 0.011058879840453395] and parameters: {'p_sma': 20, 'p_std': 25, 'p_atr': 22, 'p_adx': 10, 'rsi_period': 39, 'ema1': 23, 'ema2': 11, 'slip_atr_k': 0.021455248241995118, 'slip_spread_k': 0.18162145774081467, 'spread_hl_frac': 0.008646612030698105, 'bb_std_mult': 2.7304940135654294, 'rsi_os': 12, 'rsi_ob': 89, 'vol_spike': 0.15637201518924781, 'adx_thresh': 18.109684846445962, 'atr_min_pct': 0.006913261355277491, 'atr_max_pct': 0.04320044648359463, 'tp_mult': 1.0142637511531443, 'tsl_mult': 0.42957089053361913, 'strategy': 'mean_reversion', 'time_stop': 135, 'use_sma': True, 'use_atr': False, 'use_adx': False, 'use_ema': False, 'use_spike': True, 'rsi_required': True, 'edge_k': 1.1857601833579665, 'edge_cap': 0.47533776394286925, 'bull_strategy': 'mean_reversion', 'bull_bb_std_mult': 1.5988369391832455, 'bull_rsi_os': 52, 'bull_rsi_ob': 81, 'bull_adx_thresh': 6.267522674050188, 'bull_atr_min_pct': 0.029930054715175826, 'bull_atr_max_pct': 0.11222760869885084, 'bull_tp_mult': 2.2624121824746597, 'bull_tsl_mult': 0.40242130609692506, 'bull_time_stop': 20, 'bull_use_sma': False, 'bull_use_ema': False, 'bull_use_atr': True, 'bull_use_adx': False, 'bull_use_spike': True, 'bull_rsi_required': False, 'bear_strategy': 'breakout', 'bear_bb_std_mult': 1.7052046963115333, 'bear_rsi_os': 28, 'bear_rsi_ob': 47, 'bear_adx_thresh': 15.503714896484206, 'bear_atr_min_pct': 0.003468572131718301, 'bear_atr_max_pct': 0.11271825484315148, 'bear_tp_mult': 2.9920183311955935, 'bear_tsl_mult': 0.7838699658251287, 'bear_time_stop': 257, 'bear_use_sma': False, 'bear_use_ema': False, 'bear_use_atr': True, 'bear_use_adx': True, 'bear_use_spike': False, 'bear_rsi_required': False, 'sideways_strategy': 'mean_reversion', 'sideways_bb_std_mult': 3.3528286696959624, 'sideways_rsi_os': 22, 'sideways_rsi_ob': 57, 'sideways_adx_thresh': 23.015625076084042, 'sideways_atr_min_pct': 0.0025960317725758474, 'sideways_atr_max_pct': 0.09139980584892442, 'sideways_tp_mult': 1.475589760019133, 'sideways_tsl_mult': 0.7784992583140455, 'sideways_time_stop': 195, 'sideways_use_sma': True, 'sideways_use_ema': False, 'sideways_use_atr': False, 'sideways_use_adx': False, 'sideways_use_spike': False, 'sideways_rsi_required': False}.
[I 2025-09-01 09:17:31,101] Trial 92 finished with values: [-0.023326714352666533, 0.023665151145201627] and parameters: {'p_sma': 57, 'p_std': 30, 'p_atr': 22, 'p_adx': 15, 'rsi_period': 60, 'ema1': 27, 'ema2': 18, 'slip_atr_k': 0.041380189656099756, 'slip_spread_k': 0.35414238656606795, 'spread_hl_frac': 0.012825974492044666, 'bb_std_mult': 3.151665181038311, 'rsi_os': 12, 'rsi_ob': 89, 'vol_spike': 0.15465980569859497, 'adx_thresh': 18.29281474383739, 'atr_min_pct': 0.023508808759081613, 'atr_max_pct': 0.04336763881656542, 'tp_mult': 2.672378524421491, 'tsl_mult': 0.35638969709414803, 'strategy': 'mean_reversion', 'time_stop': 144, 'use_sma': True, 'use_atr': True, 'use_adx': False, 'use_ema': False, 'use_spike': True, 'rsi_required': False, 'edge_k': 0.8462839866821759, 'edge_cap': 0.5341541332958164, 'bull_strategy': 'mean_reversion', 'bull_bb_std_mult': 1.589199492601184, 'bull_rsi_os': 15, 'bull_rsi_ob': 86, 'bull_adx_thresh': 6.229051943492291, 'bull_atr_min_pct': 0.0015310377512115295, 'bull_atr_max_pct': 0.11522278961896351, 'bull_tp_mult': 2.0498335039044977, 'bull_tsl_mult': 0.8992641370024279, 'bull_time_stop': 271, 'bull_use_sma': False, 'bull_use_ema': False, 'bull_use_atr': True, 'bull_use_adx': False, 'bull_use_spike': True, 'bull_rsi_required': False, 'bear_strategy': 'breakout', 'bear_bb_std_mult': 1.3999300987051901, 'bear_rsi_os': 8, 'bear_rsi_ob': 47, 'bear_adx_thresh': 15.441204364012034, 'bear_atr_min_pct': 0.003619974832728778, 'bear_atr_max_pct': 0.043208604331972655, 'bear_tp_mult': 2.9340024425768725, 'bear_tsl_mult': 0.9570139309562167, 'bear_time_stop': 256, 'bear_use_sma': False, 'bear_use_ema': False, 'bear_use_atr': True, 'bear_use_adx': True, 'bear_use_spike': False, 'bear_rsi_required': False, 'sideways_strategy': 'mean_reversion', 'sideways_bb_std_mult': 2.4036862015402107, 'sideways_rsi_os': 29, 'sideways_rsi_ob': 60, 'sideways_adx_thresh': 22.860281385724466, 'sideways_atr_min_pct': 0.004134699490636516, 'sideways_atr_max_pct': 0.0704308264143007, 'sideways_tp_mult': 1.1739817920807119, 'sideways_tsl_mult': 0.7855589806071441, 'sideways_time_stop': 60, 'sideways_use_sma': True, 'sideways_use_ema': False, 'sideways_use_atr': False, 'sideways_use_adx': False, 'sideways_use_spike': False, 'sideways_rsi_required': False}.
[I 2025-09-01 09:17:31,798] Trial 95 finished with values: [-1000000000.0, 1000000000.0] and parameters: {'p_sma': 21, 'p_std': 58, 'p_atr': 8, 'p_adx': 12, 'rsi_period': 39, 'ema1': 12, 'ema2': 11, 'slip_atr_k': 0.020873231897651154, 'slip_spread_k': 0.49327102297077646, 'spread_hl_frac': 0.039476810611900115, 'bb_std_mult': 2.6199105602961703, 'rsi_os': 38, 'rsi_ob': 59, 'vol_spike': 0.15734716987949807, 'adx_thresh': 22.59205641517307, 'atr_min_pct': 0.007412979191626971, 'atr_max_pct': 0.13920463223282298, 'tp_mult': 2.426353403457614, 'tsl_mult': 0.43965540403084796, 'strategy': 'mean_reversion', 'time_stop': 126, 'use_sma': True, 'use_atr': False, 'use_adx': False, 'use_ema': False, 'use_spike': True, 'rsi_required': True, 'edge_k': 0.9294648041791999, 'edge_cap': 0.08830432745417921, 'bull_strategy': 'mean_reversion', 'bull_bb_std_mult': 2.027177699989164, 'bull_rsi_os': 15, 'bull_rsi_ob': 86, 'bull_adx_thresh': 18.40058482687689, 'bull_atr_min_pct': 0.020239924253816054, 'bull_atr_max_pct': 0.05587307628021021, 'bull_tp_mult': 2.9475642693732436, 'bull_tsl_mult': 0.570415930370531, 'bull_time_stop': 40, 'bull_use_sma': False, 'bull_use_ema': False, 'bull_use_atr': True, 'bull_use_adx': False, 'bull_use_spike': True, 'bull_rsi_required': False, 'bear_strategy': 'breakout', 'bear_bb_std_mult': 1.6916871311261013, 'bear_rsi_os': 7, 'bear_rsi_ob': 50, 'bear_adx_thresh': 13.987787545810372, 'bear_atr_min_pct': 0.013302792844911435, 'bear_atr_max_pct': 0.11187694480621707, 'bear_tp_mult': 2.992799503513496, 'bear_tsl_mult': 0.9748545326253392, 'bear_time_stop': 236, 'bear_use_sma': False, 'bear_use_ema': True, 'bear_use_atr': True, 'bear_use_adx': True, 'bear_use_spike': False, 'bear_rsi_required': False, 'sideways_strategy': 'mean_reversion', 'sideways_bb_std_mult': 1.9622494812502418, 'sideways_rsi_os': 22, 'sideways_rsi_ob': 60, 'sideways_adx_thresh': 25.226219710134966, 'sideways_atr_min_pct': 0.002545884210826584, 'sideways_atr_max_pct': 0.0900137344651837, 'sideways_tp_mult': 1.3919720663107287, 'sideways_tsl_mult': 0.869334195171707, 'sideways_time_stop': 200, 'sideways_use_sma': True, 'sideways_use_ema': False, 'sideways_use_atr': False, 'sideways_use_adx': False, 'sideways_use_spike': False, 'sideways_rsi_required': False}.
[I 2025-09-01 09:18:08,189] Trial 96 finished with values: [-1000000000.0, 1000000000.0] and parameters: {'p_sma': 59, 'p_std': 58, 'p_atr': 22, 'p_adx': 12, 'rsi_period': 37, 'ema1': 23, 'ema2': 11, 'slip_atr_k': 0.03356985914189237, 'slip_spread_k': 0.12023286870947741, 'spread_hl_frac': 7.918190254384283e-05, 'bb_std_mult': 2.7277312828422215, 'rsi_os': 46, 'rsi_ob': 89, 'vol_spike': 0.15486138022112472, 'adx_thresh': 9.139384195964764, 'atr_min_pct': 0.012762372643190864, 'atr_max_pct': 0.029916747131262147, 'tp_mult': 2.4223963543723057, 'tsl_mult': 0.47334254865321657, 'strategy': 'mean_reversion', 'time_stop': 135, 'use_sma': True, 'use_atr': True, 'use_adx': False, 'use_ema': False, 'use_spike': True, 'rsi_required': True, 'edge_k': 0.9276290199870341, 'edge_cap': 0.531872512470873, 'bull_strategy': 'mean_reversion', 'bull_bb_std_mult': 1.5925397353250048, 'bull_rsi_os': 12, 'bull_rsi_ob': 87, 'bull_adx_thresh': 5.947188157126199, 'bull_atr_min_pct': 0.0209712800924529, 'bull_atr_max_pct': 0.11283585379330463, 'bull_tp_mult': 2.592805906557376, 'bull_tsl_mult': 0.8927674124020348, 'bull_time_stop': 232, 'bull_use_sma': False, 'bull_use_ema': False, 'bull_use_atr': True, 'bull_use_adx': True, 'bull_use_spike': True, 'bull_rsi_required': False, 'bear_strategy': 'mean_reversion', 'bear_bb_std_mult': 1.720673791285572, 'bear_rsi_os': 27, 'bear_rsi_ob': 54, 'bear_adx_thresh': 31.53039583014634, 'bear_atr_min_pct': 0.01608296265718611, 'bear_atr_max_pct': 0.11289359735527951, 'bear_tp_mult': 2.998278230782491, 'bear_tsl_mult': 0.9967192446331979, 'bear_time_stop': 255, 'bear_use_sma': False, 'bear_use_ema': True, 'bear_use_atr': True, 'bear_use_adx': True, 'bear_use_spike': False, 'bear_rsi_required': False, 'sideways_strategy': 'breakout', 'sideways_bb_std_mult': 1.9757632458369248, 'sideways_rsi_os': 31, 'sideways_rsi_ob': 54, 'sideways_adx_thresh': 23.061929862847364, 'sideways_atr_min_pct': 0.016442074888657635, 'sideways_atr_max_pct': 0.081567597509772, 'sideways_tp_mult': 1.4026011947553896, 'sideways_tsl_mult': 0.8692298304052221, 'sideways_time_stop': 193, 'sideways_use_sma': True, 'sideways_use_ema': False, 'sideways_use_atr': False, 'sideways_use_adx': False, 'sideways_use_spike': False, 'sideways_rsi_required': False}.
[I 2025-09-01 09:18:08,946] Trial 97 finished with values: [-0.025822548103127896, 0.026301752743490513] and parameters: {'p_sma': 53, 'p_std': 34, 'p_atr': 13, 'p_adx': 17, 'rsi_period': 39, 'ema1': 23, 'ema2': 11, 'slip_atr_k': 0.0013286354620347489, 'slip_spread_k': 0.5042247584245039, 'spread_hl_frac': 0.04038749439130908, 'bb_std_mult': 2.6467497554498722, 'rsi_os': 46, 'rsi_ob': 62, 'vol_spike': 0.28856228884822616, 'adx_thresh': 22.553765172733677, 'atr_min_pct': 0.009003132807852164, 'atr_max_pct': 0.14287855131986787, 'tp_mult': 2.5059617139531625, 'tsl_mult': 0.4348874080824295, 'strategy': 'mean_reversion', 'time_stop': 135, 'use_sma': True, 'use_atr': True, 'use_adx': False, 'use_ema': False, 'use_spike': True, 'rsi_required': True, 'edge_k': 0.7652187506270561, 'edge_cap': 0.5197208740921055, 'bull_strategy': 'mean_reversion', 'bull_bb_std_mult': 2.041050453799085, 'bull_rsi_os': 13, 'bull_rsi_ob': 86, 'bull_adx_thresh': 13.372398381168747, 'bull_atr_min_pct': 0.021287625661797357, 'bull_atr_max_pct': 0.010682081776527269, 'bull_tp_mult': 2.599826891253404, 'bull_tsl_mult': 0.5134921909682674, 'bull_time_stop': 17, 'bull_use_sma': False, 'bull_use_ema': False, 'bull_use_atr': True, 'bull_use_adx': True, 'bull_use_spike': True, 'bull_rsi_required': False, 'bear_strategy': 'mean_reversion', 'bear_bb_std_mult': 1.7164214467948293, 'bear_rsi_os': 48, 'bear_rsi_ob': 54, 'bear_adx_thresh': 13.717651496025237, 'bear_atr_min_pct': 0.015357078306345077, 'bear_atr_max_pct': 0.11192644480113935, 'bear_tp_mult': 2.9969692988875436, 'bear_tsl_mult': 0.9635860021739906, 'bear_time_stop': 253, 'bear_use_sma': False, 'bear_use_ema': True, 'bear_use_atr': True, 'bear_use_adx': True, 'bear_use_spike': False, 'bear_rsi_required': False, 'sideways_strategy': 'breakout', 'sideways_bb_std_mult': 1.9591734579622422, 'sideways_rsi_os': 24, 'sideways_rsi_ob': 54, 'sideways_adx_thresh': 22.936288066612036, 'sideways_atr_min_pct': 0.002666373901343856, 'sideways_atr_max_pct': 0.09135808355806624, 'sideways_tp_mult': 1.3900366780925257, 'sideways_tsl_mult': 0.8682335279745299, 'sideways_time_stop': 198, 'sideways_use_sma': True, 'sideways_use_ema': False, 'sideways_use_atr': False, 'sideways_use_adx': False, 'sideways_use_spike': False, 'sideways_rsi_required': False}.
[I 2025-09-01 09:18:09,593] Trial 98 finished with values: [-0.043429964155811795, 0.04343498699622432] and parameters: {'p_sma': 53, 'p_std': 36, 'p_atr': 8, 'p_adx': 12, 'rsi_period': 39, 'ema1': 23, 'ema2': 11, 'slip_atr_k': 0.031825016371436705, 'slip_spread_k': 0.4015842608036979, 'spread_hl_frac': 0.024808799765027447, 'bb_std_mult': 2.6178346359129416, 'rsi_os': 43, 'rsi_ob': 59, 'vol_spike': 0.1686984121834808, 'adx_thresh': 9.335644378924812, 'atr_min_pct': 0.009208642788680197, 'atr_max_pct': 0.011050364736268624, 'tp_mult': 2.418779405960571, 'tsl_mult': 0.43532967579264836, 'strategy': 'mean_reversion', 'time_stop': 135, 'use_sma': True, 'use_atr': False, 'use_adx': False, 'use_ema': True, 'use_spike': True, 'rsi_required': True, 'edge_k': 1.4544858264960747, 'edge_cap': 0.4941830326184761, 'bull_strategy': 'mean_reversion', 'bull_bb_std_mult': 2.379918925631946, 'bull_rsi_os': 12, 'bull_rsi_ob': 93, 'bull_adx_thresh': 18.70106354043734, 'bull_atr_min_pct': 0.007524549420963262, 'bull_atr_max_pct': 0.05535457083417954, 'bull_tp_mult': 1.9121275182126116, 'bull_tsl_mult': 0.4053113342871471, 'bull_time_stop': 16, 'bull_use_sma': False, 'bull_use_ema': False, 'bull_use_atr': True, 'bull_use_adx': True, 'bull_use_spike': True, 'bull_rsi_required': False, 'bear_strategy': 'mean_reversion', 'bear_bb_std_mult': 1.7083600296588461, 'bear_rsi_os': 31, 'bear_rsi_ob': 58, 'bear_adx_thresh': 14.130884382291473, 'bear_atr_min_pct': 0.001440192760861261, 'bear_atr_max_pct': 0.11185535141481338, 'bear_tp_mult': 1.6028421366366983, 'bear_tsl_mult': 0.9898658267387931, 'bear_time_stop': 239, 'bear_use_sma': False, 'bear_use_ema': True, 'bear_use_atr': True, 'bear_use_adx': True, 'bear_use_spike': False, 'bear_rsi_required': False, 'sideways_strategy': 'breakout', 'sideways_bb_std_mult': 2.2902041764094228, 'sideways_rsi_os': 22, 'sideways_rsi_ob': 54, 'sideways_adx_thresh': 27.941956064347018, 'sideways_atr_min_pct': 0.002404521234253808, 'sideways_atr_max_pct': 0.08200261266644668, 'sideways_tp_mult': 2.63457937909772, 'sideways_tsl_mult': 0.8764323877972413, 'sideways_time_stop': 233, 'sideways_use_sma': True, 'sideways_use_ema': False, 'sideways_use_atr': False, 'sideways_use_adx': False, 'sideways_use_spike': False, 'sideways_rsi_required': False}.
