[I 2025-09-01 09:51:02,765] Trial 297 finished with values: [-1000000000.0, 1000000000.0] and parameters: {'p_sma': 56, 'p_std': 59, 'p_atr': 17, 'p_adx': 9, 'rsi_period': 44, 'ema1': 7, 'ema2': 10, 'slip_atr_k': 0.12063237096228159, 'slip_spread_k': 0.7797851089726224, 'spread_hl_frac': 0.005911177949338604, 'bb_std_mult': 2.5860091591131047, 'rsi_os': 9, 'rsi_ob': 67, 'vol_spike': 0.20063473619580774, 'adx_thresh': 25.633005507757638, 'atr_min_pct': 0.020486788221838942, 'atr_max_pct': 0.0679016058926024, 'tp_mult': 2.557787002625606, 'tsl_mult': 0.8506790368839515, 'strategy': 'breakout', 'time_stop': 162, 'use_sma': False, 'use_atr': False, 'use_adx': False, 'use_ema': False, 'use_spike': True, 'rsi_required': True, 'edge_k': 0.5445585785585837, 'edge_cap': 0.8400979792129656, 'bull_strategy': 'mean_reversion', 'bull_bb_std_mult': 1.6437208072774965, 'bull_rsi_os': 14, 'bull_rsi_ob': 76, 'bull_adx_thresh': 27.111002425425838, 'bull_atr_min_pct': 0.014501593260296554, 'bull_atr_max_pct': 0.0485233948447843, 'bull_tp_mult': 2.120109913833207, 'bull_tsl_mult': 0.256625005569981, 'bull_time_stop': 135, 'bull_use_sma': True, 'bull_use_ema': False, 'bull_use_atr': False, 'bull_use_adx': False, 'bull_use_spike': False, 'bull_rsi_required': False, 'bear_strategy': 'breakout', 'bear_bb_std_mult': 1.5473903309044108, 'bear_rsi_os': 48, 'bear_rsi_ob': 70, 'bear_adx_thresh': 20.255731833803843, 'bear_atr_min_pct': 0.006926498451975035, 'bear_atr_max_pct': 0.12392984271899632, 'bear_tp_mult': 1.9712544572738493, 'bear_tsl_mult': 0.15072891434685626, 'bear_time_stop': 153, 'bear_use_sma': True, 'bear_use_ema': True, 'bear_use_atr': True, 'bear_use_adx': False, 'bear_use_spike': True, 'bear_rsi_required': False, 'sideways_strategy': 'mean_reversion', 'sideways_bb_std_mult': 3.467141798133662, 'sideways_rsi_os': 39, 'sideways_rsi_ob': 86, 'sideways_adx_thresh': 32.32886369271776, 'sideways_atr_min_pct': 0.015417644476219591, 'sideways_atr_max_pct': 0.12704408659806965, 'sideways_tp_mult': 1.676957586203765, 'sideways_tsl_mult': 0.91202593256157, 'sideways_time_stop': 230, 'sideways_use_sma': True, 'sideways_use_ema': True, 'sideways_use_atr': False, 'sideways_use_adx': False, 'sideways_use_spike': True, 'sideways_rsi_required': False}.
[I 2025-09-01 09:51:43,725] Trial 300 finished with values: [-1000000000.0, 1000000000.0] and parameters: {'p_sma': 59, 'p_std': 47, 'p_atr': 28, 'p_adx': 12, 'rsi_period': 48, 'ema1': 9, 'ema2': 10, 'slip_atr_k': 0.009829900271400363, 'slip_spread_k': 0.5570047354331846, 'spread_hl_frac': 0.010097822244847258, 'bb_std_mult': 1.0622388175278181, 'rsi_os': 32, 'rsi_ob': 70, 'vol_spike': 0.20565646379251257, 'adx_thresh': 17.28401328216042, 'atr_min_pct': 0.017694387916609485, 'atr_max_pct': 0.1046320637276687, 'tp_mult': 2.8149849301589365, 'tsl_mult': 0.8576060462771232, 'strategy': 'breakout', 'time_stop': 149, 'use_sma': True, 'use_atr': True, 'use_adx': False, 'use_ema': True, 'use_spike': True, 'rsi_required': False, 'edge_k': 0.5387412893364927, 'edge_cap': 0.8732534659933807, 'bull_strategy': 'mean_reversion', 'bull_bb_std_mult': 3.5297404291810737, 'bull_rsi_os': 8, 'bull_rsi_ob': 76, 'bull_adx_thresh': 32.43504038234783, 'bull_atr_min_pct': 0.004992596443958021, 'bull_atr_max_pct': 0.08735115612180938, 'bull_tp_mult': 1.6129300532382387, 'bull_tsl_mult': 0.9337698146100293, 'bull_time_stop': 170, 'bull_use_sma': True, 'bull_use_ema': False, 'bull_use_atr': True, 'bull_use_adx': True, 'bull_use_spike': True, 'bull_rsi_required': False, 'bear_strategy': 'mean_reversion', 'bear_bb_std_mult': 1.5422809809192704, 'bear_rsi_os': 45, 'bear_rsi_ob': 72, 'bear_adx_thresh': 33.49746479091945, 'bear_atr_min_pct': 0.027666177525925893, 'bear_atr_max_pct': 0.048524119727076515, 'bear_tp_mult': 2.3875950013604847, 'bear_tsl_mult': 0.1960252571900567, 'bear_time_stop': 10, 'bear_use_sma': False, 'bear_use_ema': True, 'bear_use_atr': True, 'bear_use_adx': True, 'bear_use_spike': True, 'bear_rsi_required': True, 'sideways_strategy': 'mean_reversion', 'sideways_bb_std_mult': 1.8491370839734822, 'sideways_rsi_os': 8, 'sideways_rsi_ob': 75, 'sideways_adx_thresh': 34.26537401408731, 'sideways_atr_min_pct': 0.0015220899393487738, 'sideways_atr_max_pct': 0.03257767909276615, 'sideways_tp_mult': 1.4510907986149693, 'sideways_tsl_mult': 0.9107076881335495, 'sideways_time_stop': 239, 'sideways_use_sma': True, 'sideways_use_ema': False, 'sideways_use_atr': False, 'sideways_use_adx': False, 'sideways_use_spike': True, 'sideways_rsi_required': False}.
[I 2025-09-01 09:51:44,610] Trial 298 finished with values: [-1000000000.0, 1000000000.0] and parameters: {'p_sma': 50, 'p_std': 47, 'p_atr': 18, 'p_adx': 12, 'rsi_period': 42, 'ema1': 9, 'ema2': 11, 'slip_atr_k': 0.17416484078040537, 'slip_spread_k': 0.5541651950221863, 'spread_hl_frac': 0.00607540744215484, 'bb_std_mult': 0.7178427524928954, 'rsi_os': 18, 'rsi_ob': 70, 'vol_spike': 0.2867693013928577, 'adx_thresh': 17.413682937702323, 'atr_min_pct': 0.018191388598154366, 'atr_max_pct': 0.047076549793155335, 'tp_mult': 1.6041922519493028, 'tsl_mult': 0.868672256899759, 'strategy': 'breakout', 'time_stop': 28, 'use_sma': True, 'use_atr': True, 'use_adx': False, 'use_ema': True, 'use_spike': True, 'rsi_required': False, 'edge_k': 1.9543575296370959, 'edge_cap': 0.8766336417148217, 'bull_strategy': 'mean_reversion', 'bull_bb_std_mult': 1.538956488980919, 'bull_rsi_os': 37, 'bull_rsi_ob': 76, 'bull_adx_thresh': 28.797144063844627, 'bull_atr_min_pct': 0.01085740278811409, 'bull_atr_max_pct': 0.10452714426622711, 'bull_tp_mult': 1.5974277097885834, 'bull_tsl_mult': 0.23822685808075045, 'bull_time_stop': 132, 'bull_use_sma': True, 'bull_use_ema': False, 'bull_use_atr': True, 'bull_use_adx': True, 'bull_use_spike': True, 'bull_rsi_required': False, 'bear_strategy': 'mean_reversion', 'bear_bb_std_mult': 1.5289281205957086, 'bear_rsi_os': 37, 'bear_rsi_ob': 72, 'bear_adx_thresh': 31.056341360545915, 'bear_atr_min_pct': 0.004134966412832406, 'bear_atr_max_pct': 0.12956293302045688, 'bear_tp_mult': 2.3976069488273537, 'bear_tsl_mult': 0.03934996976685551, 'bear_time_stop': 85, 'bear_use_sma': False, 'bear_use_ema': True, 'bear_use_atr': True, 'bear_use_adx': True, 'bear_use_spike': True, 'bear_rsi_required': True, 'sideways_strategy': 'mean_reversion', 'sideways_bb_std_mult': 3.421015611173634, 'sideways_rsi_os': 40, 'sideways_rsi_ob': 59, 'sideways_adx_thresh': 33.858963693828976, 'sideways_atr_min_pct': 0.006177749373130082, 'sideways_atr_max_pct': 0.04179468807441015, 'sideways_tp_mult': 2.422910726683598, 'sideways_tsl_mult': 0.909806305850672, 'sideways_time_stop': 291, 'sideways_use_sma': True, 'sideways_use_ema': False, 'sideways_use_atr': False, 'sideways_use_adx': False, 'sideways_use_spike': True, 'sideways_rsi_required': False}.
[I 2025-09-01 09:51:45,213] Trial 301 finished with values: [-0.01352477782776218, 0.013521092702750691] and parameters: {'p_sma': 50, 'p_std': 8, 'p_atr': 11, 'p_adx': 12, 'rsi_period': 34, 'ema1': 11, 'ema2': 11, 'slip_atr_k': 0.02256827991039794, 'slip_spread_k': 0.548956191478697, 'spread_hl_frac': 0.006045130388859415, 'bb_std_mult': 1.0481313397719283, 'rsi_os': 32, 'rsi_ob': 58, 'vol_spike': 0.22623835159938294, 'adx_thresh': 11.679435301353752, 'atr_min_pct': 0.018035104138000295, 'atr_max_pct': 0.10588311555017499, 'tp_mult': 2.3819313506825956, 'tsl_mult': 0.8669972093004147, 'strategy': 'breakout', 'time_stop': 63, 'use_sma': True, 'use_atr': True, 'use_adx': False, 'use_ema': True, 'use_spike': False, 'rsi_required': False, 'edge_k': 1.3831553500078981, 'edge_cap': 0.6334600522512155, 'bull_strategy': 'breakout', 'bull_bb_std_mult': 3.480539066219226, 'bull_rsi_os': 37, 'bull_rsi_ob': 83, 'bull_adx_thresh': 28.673279207145313, 'bull_atr_min_pct': 0.010640863238058145, 'bull_atr_max_pct': 0.08665142491269012, 'bull_tp_mult': 1.577770532701402, 'bull_tsl_mult': 0.38431307894692457, 'bull_time_stop': 158, 'bull_use_sma': False, 'bull_use_ema': True, 'bull_use_atr': True, 'bull_use_adx': True, 'bull_use_spike': True, 'bull_rsi_required': False, 'bear_strategy': 'mean_reversion', 'bear_bb_std_mult': 1.4021721783937622, 'bear_rsi_os': 10, 'bear_rsi_ob': 72, 'bear_adx_thresh': 23.308268120573874, 'bear_atr_min_pct': 0.029285592625492074, 'bear_atr_max_pct': 0.07988064552283712, 'bear_tp_mult': 2.7514068223921715, 'bear_tsl_mult': 0.8092639572356652, 'bear_time_stop': 5, 'bear_use_sma': False, 'bear_use_ema': True, 'bear_use_atr': False, 'bear_use_adx': True, 'bear_use_spike': True, 'bear_rsi_required': True, 'sideways_strategy': 'mean_reversion', 'sideways_bb_std_mult': 2.6202696369643994, 'sideways_rsi_os': 31, 'sideways_rsi_ob': 91, 'sideways_adx_thresh': 34.22993321985171, 'sideways_atr_min_pct': 0.002266770421999057, 'sideways_atr_max_pct': 0.04529353336651191, 'sideways_tp_mult': 1.9422919817066622, 'sideways_tsl_mult': 0.5354683029771994, 'sideways_time_stop': 240, 'sideways_use_sma': False, 'sideways_use_ema': False, 'sideways_use_atr': False, 'sideways_use_adx': False, 'sideways_use_spike': True, 'sideways_rsi_required': False}.
[I 2025-09-01 09:51:45,225] Trial 299 finished with values: [-0.08744823985411532, 0.08743880965205364] and parameters: {'p_sma': 50, 'p_std': 47, 'p_atr': 28, 'p_adx': 12, 'rsi_period': 48, 'ema1': 9, 'ema2': 11, 'slip_atr_k': 0.1808425176702281, 'slip_spread_k': 0.6948338379145705, 'spread_hl_frac': 0.010125305006386818, 'bb_std_mult': 0.732843102297364, 'rsi_os': 31, 'rsi_ob': 80, 'vol_spike': 0.17970095036690614, 'adx_thresh': 20.7033954671713, 'atr_min_pct': 4.383150151243166e-05, 'atr_max_pct': 0.10560446998346651, 'tp_mult': 2.556802374764337, 'tsl_mult': 0.7302608089006386, 'strategy': 'breakout', 'time_stop': 284, 'use_sma': True, 'use_atr': True, 'use_adx': False, 'use_ema': True, 'use_spike': True, 'rsi_required': False, 'edge_k': 0.5082961270350012, 'edge_cap': 0.8698879988838912, 'bull_strategy': 'mean_reversion', 'bull_bb_std_mult': 3.5293712572070106, 'bull_rsi_os': 37, 'bull_rsi_ob': 50, 'bull_adx_thresh': 28.204892562980096, 'bull_atr_min_pct': 0.004991334517921209, 'bull_atr_max_pct': 0.07680521787396122, 'bull_tp_mult': 2.912256175251592, 'bull_tsl_mult': 0.2561105888981472, 'bull_time_stop': 168, 'bull_use_sma': True, 'bull_use_ema': False, 'bull_use_atr': True, 'bull_use_adx': True, 'bull_use_spike': True, 'bull_rsi_required': False, 'bear_strategy': 'mean_reversion', 'bear_bb_std_mult': 1.5406904737121736, 'bear_rsi_os': 47, 'bear_rsi_ob': 76, 'bear_adx_thresh': 23.029507203453015, 'bear_atr_min_pct': 0.02773550756403723, 'bear_atr_max_pct': 0.07989915518186891, 'bear_tp_mult': 2.9419546829406675, 'bear_tsl_mult': 0.15865828663246762, 'bear_time_stop': 5, 'bear_use_sma': False, 'bear_use_ema': True, 'bear_use_atr': True, 'bear_use_adx': True, 'bear_use_spike': True, 'bear_rsi_required': True, 'sideways_strategy': 'mean_reversion', 'sideways_bb_std_mult': 2.690357002699867, 'sideways_rsi_os': 55, 'sideways_rsi_ob': 71, 'sideways_adx_thresh': 29.078968706974855, 'sideways_atr_min_pct': 0.0017220246625846425, 'sideways_atr_max_pct': 0.11835005085074965, 'sideways_tp_mult': 2.15962411259052, 'sideways_tsl_mult': 0.9323771711601048, 'sideways_time_stop': 229, 'sideways_use_sma': True, 'sideways_use_ema': False, 'sideways_use_atr': False, 'sideways_use_adx': False, 'sideways_use_spike': True, 'sideways_rsi_required': False}.
[I 2025-09-01 09:52:24,537] Trial 304 finished with values: [-1000000000.0, 1000000000.0] and parameters: {'p_sma': 58, 'p_std': 44, 'p_atr': 29, 'p_adx': 26, 'rsi_period': 46, 'ema1': 14, 'ema2': 45, 'slip_atr_k': 0.16503923268895762, 'slip_spread_k': 0.017433270663905653, 'spread_hl_frac': 0.004740253727631739, 'bb_std_mult': 3.2922735318174414, 'rsi_os': 12, 'rsi_ob': 57, 'vol_spike': 0.1767887666023917, 'adx_thresh': 20.584963551552388, 'atr_min_pct': 0.0019026550420653092, 'atr_max_pct': 0.13074554866762655, 'tp_mult': 2.4917508347285513, 'tsl_mult': 0.7365228304564146, 'strategy': 'mean_reversion', 'time_stop': 140, 'use_sma': True, 'use_atr': True, 'use_adx': True, 'use_ema': False, 'use_spike': True, 'rsi_required': False, 'edge_k': 0.6473419208677196, 'edge_cap': 0.7995320571643414, 'bull_strategy': 'mean_reversion', 'bull_bb_std_mult': 1.0738393023241861, 'bull_rsi_os': 42, 'bull_rsi_ob': 85, 'bull_adx_thresh': 25.644716442797154, 'bull_atr_min_pct': 0.02160375052130567, 'bull_atr_max_pct': 0.07689294449817553, 'bull_tp_mult': 2.1767050931888527, 'bull_tsl_mult': 0.8804605597415629, 'bull_time_stop': 180, 'bull_use_sma': True, 'bull_use_ema': False, 'bull_use_atr': True, 'bull_use_adx': False, 'bull_use_spike': True, 'bull_rsi_required': True, 'bear_strategy': 'breakout', 'bear_bb_std_mult': 2.8597806921731164, 'bear_rsi_os': 47, 'bear_rsi_ob': 75, 'bear_adx_thresh': 33.851636429806966, 'bear_atr_min_pct': 0.005495192784611632, 'bear_atr_max_pct': 0.059897887251147405, 'bear_tp_mult': 1.0863217860463354, 'bear_tsl_mult': 0.8442351562418972, 'bear_time_stop': 58, 'bear_use_sma': False, 'bear_use_ema': False, 'bear_use_atr': True, 'bear_use_adx': True, 'bear_use_spike': True, 'bear_rsi_required': False, 'sideways_strategy': 'breakout', 'sideways_bb_std_mult': 2.6821944362119075, 'sideways_rsi_os': 30, 'sideways_rsi_ob': 70, 'sideways_adx_thresh': 32.173836602389365, 'sideways_atr_min_pct': 0.005487261352505775, 'sideways_atr_max_pct': 0.11515280279933907, 'sideways_tp_mult': 2.146184831278597, 'sideways_tsl_mult': 0.4646558205723698, 'sideways_time_stop': 49, 'sideways_use_sma': True, 'sideways_use_ema': False, 'sideways_use_atr': True, 'sideways_use_adx': True, 'sideways_use_spike': False, 'sideways_rsi_required': False}.
[I 2025-09-01 09:52:25,654] Trial 305 finished with values: [-1000000000.0, 1000000000.0] and parameters: {'p_sma': 6, 'p_std': 41, 'p_atr': 29, 'p_adx': 17, 'rsi_period': 54, 'ema1': 28, 'ema2': 25, 'slip_atr_k': 0.0060401550749598805, 'slip_spread_k': 0.9425806434273434, 'spread_hl_frac': 0.008966018048253165, 'bb_std_mult': 0.5263658017803554, 'rsi_os': 6, 'rsi_ob': 57, 'vol_spike': 0.032082288043453214, 'adx_thresh': 30.36277568243794, 'atr_min_pct': 0.005649332381667, 'atr_max_pct': 0.09727278993901489, 'tp_mult': 1.8621491859950352, 'tsl_mult': 0.8095856753990438, 'strategy': 'mean_reversion', 'time_stop': 140, 'use_sma': True, 'use_atr': True, 'use_adx': True, 'use_ema': False, 'use_spike': False, 'rsi_required': False, 'edge_k': 0.6548097383782077, 'edge_cap': 0.936828104276433, 'bull_strategy': 'breakout', 'bull_bb_std_mult': 1.392845132736218, 'bull_rsi_os': 11, 'bull_rsi_ob': 79, 'bull_adx_thresh': 26.225137940991118, 'bull_atr_min_pct': 0.003982376598234499, 'bull_atr_max_pct': 0.10091989267190542, 'bull_tp_mult': 1.5472934317160911, 'bull_tsl_mult': 0.8936182373915552, 'bull_time_stop': 122, 'bull_use_sma': False, 'bull_use_ema': True, 'bull_use_atr': True, 'bull_use_adx': False, 'bull_use_spike': True, 'bull_rsi_required': True, 'bear_strategy': 'breakout', 'bear_bb_std_mult': 1.429899898362247, 'bear_rsi_os': 45, 'bear_rsi_ob': 74, 'bear_adx_thresh': 34.95118580004173, 'bear_atr_min_pct': 0.018495692848723863, 'bear_atr_max_pct': 0.11982826365515767, 'bear_tp_mult': 1.0801341816429804, 'bear_tsl_mult': 0.8469613749703312, 'bear_time_stop': 16, 'bear_use_sma': False, 'bear_use_ema': False, 'bear_use_atr': False, 'bear_use_adx': True, 'bear_use_spike': True, 'bear_rsi_required': False, 'sideways_strategy': 'breakout', 'sideways_bb_std_mult': 3.314607171014984, 'sideways_rsi_os': 30, 'sideways_rsi_ob': 60, 'sideways_adx_thresh': 8.623965829782476, 'sideways_atr_min_pct': 0.011644210835320233, 'sideways_atr_max_pct': 0.08247003011596062, 'sideways_tp_mult': 2.0076340947642515, 'sideways_tsl_mult': 0.8852008085548391, 'sideways_time_stop': 224, 'sideways_use_sma': False, 'sideways_use_ema': False, 'sideways_use_atr': True, 'sideways_use_adx': True, 'sideways_use_spike': False, 'sideways_rsi_required': False}.
[I 2025-09-01 09:52:25,663] Trial 303 finished with values: [-1000000000.0, 1000000000.0] and parameters: {'p_sma': 58, 'p_std': 55, 'p_atr': 11, 'p_adx': 30, 'rsi_period': 46, 'ema1': 28, 'ema2': 27, 'slip_atr_k': 0.022741671806410322, 'slip_spread_k': 0.8220057039436768, 'spread_hl_frac': 0.008877040104385022, 'bb_std_mult': 1.7063866766285174, 'rsi_os': 11, 'rsi_ob': 79, 'vol_spike': 0.1778960365880106, 'adx_thresh': 11.494183628820425, 'atr_min_pct': 0.006402760785265374, 'atr_max_pct': 0.08138199978886183, 'tp_mult': 2.486432037882182, 'tsl_mult': 0.8101224037710932, 'strategy': 'mean_reversion', 'time_stop': 75, 'use_sma': True, 'use_atr': True, 'use_adx': True, 'use_ema': False, 'use_spike': False, 'rsi_required': False, 'edge_k': 0.6475131580259031, 'edge_cap': 0.5938660218000774, 'bull_strategy': 'breakout', 'bull_bb_std_mult': 3.4728009488419436, 'bull_rsi_os': 17, 'bull_rsi_ob': 80, 'bull_adx_thresh': 28.074766836612344, 'bull_atr_min_pct': 0.0272343008678737, 'bull_atr_max_pct': 0.09165282067979831, 'bull_tp_mult': 1.6673600267127597, 'bull_tsl_mult': 0.9350578050477503, 'bull_time_stop': 158, 'bull_use_sma': False, 'bull_use_ema': True, 'bull_use_atr': True, 'bull_use_adx': False, 'bull_use_spike': True, 'bull_rsi_required': True, 'bear_strategy': 'breakout', 'bear_bb_std_mult': 1.4127108691403045, 'bear_rsi_os': 45, 'bear_rsi_ob': 75, 'bear_adx_thresh': 19.353402091060993, 'bear_atr_min_pct': 0.011441730562860773, 'bear_atr_max_pct': 0.127742869822036, 'bear_tp_mult': 2.9085415705654905, 'bear_tsl_mult': 0.8461036867676636, 'bear_time_stop': 172, 'bear_use_sma': False, 'bear_use_ema': True, 'bear_use_atr': False, 'bear_use_adx': True, 'bear_use_spike': True, 'bear_rsi_required': False, 'sideways_strategy': 'breakout', 'sideways_bb_std_mult': 2.3771049724361473, 'sideways_rsi_os': 31, 'sideways_rsi_ob': 60, 'sideways_adx_thresh': 31.98839120710839, 'sideways_atr_min_pct': 0.008177728641004394, 'sideways_atr_max_pct': 0.08300541058530181, 'sideways_tp_mult': 2.2861903889282544, 'sideways_tsl_mult': 0.5911712992959132, 'sideways_time_stop': 223, 'sideways_use_sma': False, 'sideways_use_ema': False, 'sideways_use_atr': True, 'sideways_use_adx': True, 'sideways_use_spike': False, 'sideways_rsi_required': False}.
[I 2025-09-01 09:52:26,282] Trial 302 finished with values: [-1000000000.0, 1000000000.0] and parameters: {'p_sma': 58, 'p_std': 9, 'p_atr': 28, 'p_adx': 17, 'rsi_period': 46, 'ema1': 26, 'ema2': 11, 'slip_atr_k': 0.022757037446235542, 'slip_spread_k': 0.5344877508400178, 'spread_hl_frac': 0.006087154498920699, 'bb_std_mult': 2.798518812033877, 'rsi_os': 11, 'rsi_ob': 58, 'vol_spike': 0.1792805091171563, 'adx_thresh': 14.54220570621169, 'atr_min_pct': 0.006576211912358007, 'atr_max_pct': 0.047317506322344265, 'tp_mult': 2.8922453551294938, 'tsl_mult': 0.7345250174722607, 'strategy': 'mean_reversion', 'time_stop': 75, 'use_sma': True, 'use_atr': True, 'use_adx': True, 'use_ema': False, 'use_spike': False, 'rsi_required': False, 'edge_k': 1.1613070206300227, 'edge_cap': 0.922849580604272, 'bull_strategy': 'breakout', 'bull_bb_std_mult': 1.383707170847798, 'bull_rsi_os': 37, 'bull_rsi_ob': 85, 'bull_adx_thresh': 26.056534999038373, 'bull_atr_min_pct': 0.0195163002659287, 'bull_atr_max_pct': 0.07415911845796526, 'bull_tp_mult': 1.5510243737933582, 'bull_tsl_mult': 0.3811354020225336, 'bull_time_stop': 129, 'bull_use_sma': False, 'bull_use_ema': True, 'bull_use_atr': True, 'bull_use_adx': False, 'bull_use_spike': True, 'bull_rsi_required': True, 'bear_strategy': 'mean_reversion', 'bear_bb_std_mult': 1.4208149877349094, 'bear_rsi_os': 47, 'bear_rsi_ob': 63, 'bear_adx_thresh': 22.919200281107003, 'bear_atr_min_pct': 0.005831348714814883, 'bear_atr_max_pct': 0.11972920520496598, 'bear_tp_mult': 2.276571081789762, 'bear_tsl_mult': 0.5367410796634832, 'bear_time_stop': 24, 'bear_use_sma': False, 'bear_use_ema': True, 'bear_use_atr': False, 'bear_use_adx': True, 'bear_use_spike': True, 'bear_rsi_required': True, 'sideways_strategy': 'mean_reversion', 'sideways_bb_std_mult': 1.6804019955061895, 'sideways_rsi_os': 31, 'sideways_rsi_ob': 71, 'sideways_adx_thresh': 32.12278891213933, 'sideways_atr_min_pct': 0.006125250101058823, 'sideways_atr_max_pct': 0.05491068455556579, 'sideways_tp_mult': 1.40622747350285, 'sideways_tsl_mult': 0.32200761814545253, 'sideways_time_stop': 50, 'sideways_use_sma': False, 'sideways_use_ema': False, 'sideways_use_atr': True, 'sideways_use_adx': False, 'sideways_use_spike': True, 'sideways_rsi_required': False}.
