[I 2025-09-01 09:42:00,916] Trial 243 finished with values: [-0.060204728113597006, 0.060157450072307786] and parameters: {'p_sma': 58, 'p_std': 13, 'p_atr': 20, 'p_adx': 12, 'rsi_period': 19, 'ema1': 8, 'ema2': 36, 'slip_atr_k': 0.09765313462563846, 'slip_spread_k': 0.5479047054466855, 'spread_hl_frac': 0.049663104086488774, 'bb_std_mult': 0.9072281855711353, 'rsi_os': 10, 'rsi_ob': 56, 'vol_spike': 0.04739279325101943, 'adx_thresh': 28.05245272818488, 'atr_min_pct': 0.00611857435136901, 'atr_max_pct': 0.0630724294991496, 'tp_mult': 1.1849163631080222, 'tsl_mult': 0.8108107707281503, 'strategy': 'breakout', 'time_stop': 153, 'use_sma': True, 'use_atr': True, 'use_adx': False, 'use_ema': False, 'use_spike': True, 'rsi_required': False, 'edge_k': 1.0892295884992336, 'edge_cap': 0.9313647038105856, 'bull_strategy': 'mean_reversion', 'bull_bb_std_mult': 3.5531278580763366, 'bull_rsi_os': 39, 'bull_rsi_ob': 75, 'bull_adx_thresh': 11.615883344958803, 'bull_atr_min_pct': 0.004062688900987821, 'bull_atr_max_pct': 0.08483200258086651, 'bull_tp_mult': 1.5650529665278017, 'bull_tsl_mult': 0.14011460289209915, 'bull_time_stop': 144, 'bull_use_sma': True, 'bull_use_ema': False, 'bull_use_atr': True, 'bull_use_adx': False, 'bull_use_spike': True, 'bull_rsi_required': False, 'bear_strategy': 'mean_reversion', 'bear_bb_std_mult': 2.3351306412103265, 'bear_rsi_os': 36, 'bear_rsi_ob': 72, 'bear_adx_thresh': 25.29640972054864, 'bear_atr_min_pct': 0.018962444219252927, 'bear_atr_max_pct': 0.12210323197676863, 'bear_tp_mult': 2.008007857117199, 'bear_tsl_mult': 0.8543368207321029, 'bear_time_stop': 276, 'bear_use_sma': False, 'bear_use_ema': True, 'bear_use_atr': True, 'bear_use_adx': True, 'bear_use_spike': True, 'bear_rsi_required': False, 'sideways_strategy': 'mean_reversion', 'sideways_bb_std_mult': 3.2737442001049155, 'sideways_rsi_os': 32, 'sideways_rsi_ob': 58, 'sideways_adx_thresh': 10.776713592266011, 'sideways_atr_min_pct': 0.0019060562745743942, 'sideways_atr_max_pct': 0.1271196120156702, 'sideways_tp_mult': 1.397277362634401, 'sideways_tsl_mult': 0.9700854033333797, 'sideways_time_stop': 235, 'sideways_use_sma': True, 'sideways_use_ema': False, 'sideways_use_atr': False, 'sideways_use_adx': False, 'sideways_use_spike': True, 'sideways_rsi_required': False}.
[I 2025-09-01 09:42:01,208] Trial 244 finished with values: [-0.004786715317137036, 0.00485428557404214] and parameters: {'p_sma': 60, 'p_std': 14, 'p_atr': 28, 'p_adx': 12, 'rsi_period': 19, 'ema1': 8, 'ema2': 10, 'slip_atr_k': 0.011142318181462352, 'slip_spread_k': 0.5435922485166147, 'spread_hl_frac': 0.007952144182124872, 'bb_std_mult': 3.2313999917711023, 'rsi_os': 10, 'rsi_ob': 56, 'vol_spike': 0.19159130942293692, 'adx_thresh': 21.010099004942433, 'atr_min_pct': 0.01965776116425398, 'atr_max_pct': 0.07262229468361524, 'tp_mult': 2.4906807266052464, 'tsl_mult': 0.13360504695003378, 'strategy': 'breakout', 'time_stop': 140, 'use_sma': True, 'use_atr': True, 'use_adx': False, 'use_ema': False, 'use_spike': True, 'rsi_required': False, 'edge_k': 1.6249829899685913, 'edge_cap': 0.5879422363014578, 'bull_strategy': 'mean_reversion', 'bull_bb_std_mult': 3.533677278723799, 'bull_rsi_os': 39, 'bull_rsi_ob': 79, 'bull_adx_thresh': 28.906351238805428, 'bull_atr_min_pct': 0.003990035481892741, 'bull_atr_max_pct': 0.08413831921384178, 'bull_tp_mult': 1.300090719165584, 'bull_tsl_mult': 0.9201720292819214, 'bull_time_stop': 142, 'bull_use_sma': True, 'bull_use_ema': False, 'bull_use_atr': True, 'bull_use_adx': False, 'bull_use_spike': False, 'bull_rsi_required': False, 'bear_strategy': 'mean_reversion', 'bear_bb_std_mult': 1.4581679060633939, 'bear_rsi_os': 44, 'bear_rsi_ob': 72, 'bear_adx_thresh': 6.0501372563247955, 'bear_atr_min_pct': 0.005673672305911813, 'bear_atr_max_pct': 0.12962260840714754, 'bear_tp_mult': 2.8236333397697684, 'bear_tsl_mult': 0.8607350305464637, 'bear_time_stop': 281, 'bear_use_sma': False, 'bear_use_ema': True, 'bear_use_atr': True, 'bear_use_adx': True, 'bear_use_spike': True, 'bear_rsi_required': False, 'sideways_strategy': 'mean_reversion', 'sideways_bb_std_mult': 2.979701325368804, 'sideways_rsi_os': 40, 'sideways_rsi_ob': 59, 'sideways_adx_thresh': 30.885557470433817, 'sideways_atr_min_pct': 0.013627204951472115, 'sideways_atr_max_pct': 0.08839405438472234, 'sideways_tp_mult': 1.3789228413867156, 'sideways_tsl_mult': 0.10424760964582386, 'sideways_time_stop': 226, 'sideways_use_sma': True, 'sideways_use_ema': False, 'sideways_use_atr': False, 'sideways_use_adx': False, 'sideways_use_spike': True, 'sideways_rsi_required': False}.
[I 2025-09-01 09:42:01,533] Trial 242 finished with values: [-0.004966865274078525, 0.005300438009735812] and parameters: {'p_sma': 58, 'p_std': 14, 'p_atr': 20, 'p_adx': 12, 'rsi_period': 54, 'ema1': 8, 'ema2': 10, 'slip_atr_k': 0.010526470304557117, 'slip_spread_k': 0.5887065038323074, 'spread_hl_frac': 0.0049488910864384445, 'bb_std_mult': 2.7095165250419844, 'rsi_os': 23, 'rsi_ob': 55, 'vol_spike': 0.04198309184685678, 'adx_thresh': 24.06161893619877, 'atr_min_pct': 0.005986504937368841, 'atr_max_pct': 0.06895600774276794, 'tp_mult': 2.52766386227021, 'tsl_mult': 0.8169707026768366, 'strategy': 'breakout', 'time_stop': 154, 'use_sma': True, 'use_atr': True, 'use_adx': False, 'use_ema': False, 'use_spike': True, 'rsi_required': False, 'edge_k': 0.6356052597730825, 'edge_cap': 0.69031541642494, 'bull_strategy': 'mean_reversion', 'bull_bb_std_mult': 2.720820624988082, 'bull_rsi_os': 47, 'bull_rsi_ob': 95, 'bull_adx_thresh': 27.82284769968175, 'bull_atr_min_pct': 0.004039585496043416, 'bull_atr_max_pct': 0.08484948828571129, 'bull_tp_mult': 1.0237024351043384, 'bull_tsl_mult': 0.14416034480053136, 'bull_time_stop': 142, 'bull_use_sma': True, 'bull_use_ema': False, 'bull_use_atr': True, 'bull_use_adx': False, 'bull_use_spike': True, 'bull_rsi_required': False, 'bear_strategy': 'breakout', 'bear_bb_std_mult': 0.7170477258430992, 'bear_rsi_os': 36, 'bear_rsi_ob': 75, 'bear_adx_thresh': 11.381214287040153, 'bear_atr_min_pct': 0.0069743040686676225, 'bear_atr_max_pct': 0.12178631353393408, 'bear_tp_mult': 2.1503808346983586, 'bear_tsl_mult': 0.8618598168379832, 'bear_time_stop': 5, 'bear_use_sma': False, 'bear_use_ema': True, 'bear_use_atr': True, 'bear_use_adx': True, 'bear_use_spike': True, 'bear_rsi_required': False, 'sideways_strategy': 'mean_reversion', 'sideways_bb_std_mult': 1.3256317066244865, 'sideways_rsi_os': 30, 'sideways_rsi_ob': 62, 'sideways_adx_thresh': 30.812433286153592, 'sideways_atr_min_pct': 0.0017824104230340185, 'sideways_atr_max_pct': 0.08669596704648984, 'sideways_tp_mult': 1.3017380616598166, 'sideways_tsl_mult': 0.9282270394158951, 'sideways_time_stop': 216, 'sideways_use_sma': True, 'sideways_use_ema': False, 'sideways_use_atr': False, 'sideways_use_adx': False, 'sideways_use_spike': True, 'sideways_rsi_required': False}.
[I 2025-09-01 09:42:39,581] Trial 247 finished with values: [-1000000000.0, 1000000000.0] and parameters: {'p_sma': 29, 'p_std': 43, 'p_atr': 24, 'p_adx': 12, 'rsi_period': 45, 'ema1': 26, 'ema2': 10, 'slip_atr_k': 0.19448024820651122, 'slip_spread_k': 0.5849317040691021, 'spread_hl_frac': 0.04731339022792635, 'bb_std_mult': 2.5247648892748202, 'rsi_os': 8, 'rsi_ob': 58, 'vol_spike': 0.025667641505858832, 'adx_thresh': 21.109069601833934, 'atr_min_pct': 0.020208695233468285, 'atr_max_pct': 0.07305152506805933, 'tp_mult': 1.4209445771849436, 'tsl_mult': 0.8492343096659486, 'strategy': 'breakout', 'time_stop': 195, 'use_sma': True, 'use_atr': True, 'use_adx': False, 'use_ema': True, 'use_spike': True, 'rsi_required': True, 'edge_k': 0.6469648879019344, 'edge_cap': 0.5743180434636004, 'bull_strategy': 'mean_reversion', 'bull_bb_std_mult': 3.461559521045536, 'bull_rsi_os': 37, 'bull_rsi_ob': 88, 'bull_adx_thresh': 27.420491534927635, 'bull_atr_min_pct': 0.013981852223676754, 'bull_atr_max_pct': 0.07621487644941985, 'bull_tp_mult': 1.0363927304000415, 'bull_tsl_mult': 0.35766038788132865, 'bull_time_stop': 185, 'bull_use_sma': True, 'bull_use_ema': False, 'bull_use_atr': False, 'bull_use_adx': False, 'bull_use_spike': True, 'bull_rsi_required': False, 'bear_strategy': 'breakout', 'bear_bb_std_mult': 1.436603531777544, 'bear_rsi_os': 12, 'bear_rsi_ob': 75, 'bear_adx_thresh': 34.4397086727124, 'bear_atr_min_pct': 0.029339721069675057, 'bear_atr_max_pct': 0.13297064154911808, 'bear_tp_mult': 2.8641833760516118, 'bear_tsl_mult': 0.212246669786385, 'bear_time_stop': 5, 'bear_use_sma': True, 'bear_use_ema': True, 'bear_use_atr': False, 'bear_use_adx': True, 'bear_use_spike': True, 'bear_rsi_required': False, 'sideways_strategy': 'mean_reversion', 'sideways_bb_std_mult': 1.409244344396634, 'sideways_rsi_os': 29, 'sideways_rsi_ob': 62, 'sideways_adx_thresh': 31.182787007388107, 'sideways_atr_min_pct': 0.002988693348952669, 'sideways_atr_max_pct': 0.10805569453987046, 'sideways_tp_mult': 1.3314520426205287, 'sideways_tsl_mult': 0.9305659209488865, 'sideways_time_stop': 43, 'sideways_use_sma': True, 'sideways_use_ema': False, 'sideways_use_atr': False, 'sideways_use_adx': True, 'sideways_use_spike': True, 'sideways_rsi_required': False}.
[I 2025-09-01 09:42:40,197] Trial 246 finished with values: [-0.01987294453372801, 0.019722915694919567] and parameters: {'p_sma': 58, 'p_std': 28, 'p_atr': 28, 'p_adx': 18, 'rsi_period': 16, 'ema1': 20, 'ema2': 10, 'slip_atr_k': 0.19287160182027346, 'slip_spread_k': 0.5661224217059143, 'spread_hl_frac': 0.007703957814795481, 'bb_std_mult': 2.719015798853689, 'rsi_os': 8, 'rsi_ob': 63, 'vol_spike': 0.2039614223258535, 'adx_thresh': 12.893907932559106, 'atr_min_pct': 0.019920121054789252, 'atr_max_pct': 0.07171648881366682, 'tp_mult': 2.492268835687689, 'tsl_mult': 0.13727016227006905, 'strategy': 'breakout', 'time_stop': 13, 'use_sma': True, 'use_atr': True, 'use_adx': False, 'use_ema': True, 'use_spike': True, 'rsi_required': True, 'edge_k': 1.624862735120938, 'edge_cap': 0.6829247081051808, 'bull_strategy': 'mean_reversion', 'bull_bb_std_mult': 3.4518058457774656, 'bull_rsi_os': 37, 'bull_rsi_ob': 88, 'bull_adx_thresh': 27.675032073248612, 'bull_atr_min_pct': 0.019602412587546133, 'bull_atr_max_pct': 0.0757784872075658, 'bull_tp_mult': 2.8054917518907825, 'bull_tsl_mult': 0.9174433852448657, 'bull_time_stop': 37, 'bull_use_sma': True, 'bull_use_ema': False, 'bull_use_atr': True, 'bull_use_adx': False, 'bull_use_spike': True, 'bull_rsi_required': False, 'bear_strategy': 'breakout', 'bear_bb_std_mult': 3.3179971438141775, 'bear_rsi_os': 44, 'bear_rsi_ob': 75, 'bear_adx_thresh': 34.38822580307662, 'bear_atr_min_pct': 0.01962450070973974, 'bear_atr_max_pct': 0.12870420089972348, 'bear_tp_mult': 2.8839386351854515, 'bear_tsl_mult': 0.8599706237649641, 'bear_time_stop': 282, 'bear_use_sma': False, 'bear_use_ema': True, 'bear_use_atr': False, 'bear_use_adx': True, 'bear_use_spike': True, 'bear_rsi_required': False, 'sideways_strategy': 'mean_reversion', 'sideways_bb_std_mult': 1.3142692257251878, 'sideways_rsi_os': 29, 'sideways_rsi_ob': 60, 'sideways_adx_thresh': 6.317882694954005, 'sideways_atr_min_pct': 0.003048413334579231, 'sideways_atr_max_pct': 0.10809334258366954, 'sideways_tp_mult': 1.3865717089369731, 'sideways_tsl_mult': 0.9715881920142316, 'sideways_time_stop': 236, 'sideways_use_sma': True, 'sideways_use_ema': False, 'sideways_use_atr': False, 'sideways_use_adx': True, 'sideways_use_spike': True, 'sideways_rsi_required': False}.
[I 2025-09-01 09:42:40,559] Trial 248 finished with values: [-1000000000.0, 1000000000.0] and parameters: {'p_sma': 58, 'p_std': 11, 'p_atr': 24, 'p_adx': 18, 'rsi_period': 46, 'ema1': 9, 'ema2': 10, 'slip_atr_k': 0.013658201027312005, 'slip_spread_k': 0.5700944006042488, 'spread_hl_frac': 0.008184298350543327, 'bb_std_mult': 1.127318550980298, 'rsi_os': 51, 'rsi_ob': 54, 'vol_spike': 0.20242008403074957, 'adx_thresh': 12.587847798404642, 'atr_min_pct': 0.02029047515000566, 'atr_max_pct': 0.07179258905496326, 'tp_mult': 2.4937790853713024, 'tsl_mult': 0.8557494767976443, 'strategy': 'breakout', 'time_stop': 144, 'use_sma': True, 'use_atr': True, 'use_adx': False, 'use_ema': True, 'use_spike': True, 'rsi_required': True, 'edge_k': 0.6496806000809585, 'edge_cap': 0.5818265024116206, 'bull_strategy': 'mean_reversion', 'bull_bb_std_mult': 1.4980151246032163, 'bull_rsi_os': 37, 'bull_rsi_ob': 79, 'bull_adx_thresh': 27.47898022423596, 'bull_atr_min_pct': 0.013753443816464936, 'bull_atr_max_pct': 0.07534878591980487, 'bull_tp_mult': 1.3046521673465805, 'bull_tsl_mult': 0.2159930055976541, 'bull_time_stop': 151, 'bull_use_sma': True, 'bull_use_ema': False, 'bull_use_atr': False, 'bull_use_adx': False, 'bull_use_spike': True, 'bull_rsi_required': False, 'bear_strategy': 'breakout', 'bear_bb_std_mult': 1.4264976160071323, 'bear_rsi_os': 34, 'bear_rsi_ob': 91, 'bear_adx_thresh': 5.758248179504035, 'bear_atr_min_pct': 0.02933477955501047, 'bear_atr_max_pct': 0.12944866680882963, 'bear_tp_mult': 2.88388514729601, 'bear_tsl_mult': 0.8092656175551428, 'bear_time_stop': 16, 'bear_use_sma': True, 'bear_use_ema': True, 'bear_use_atr': False, 'bear_use_adx': True, 'bear_use_spike': True, 'bear_rsi_required': False, 'sideways_strategy': 'mean_reversion', 'sideways_bb_std_mult': 2.5373859373115675, 'sideways_rsi_os': 28, 'sideways_rsi_ob': 60, 'sideways_adx_thresh': 30.979272970707985, 'sideways_atr_min_pct': 0.0029349162470478137, 'sideways_atr_max_pct': 0.03629022434165373, 'sideways_tp_mult': 2.609883461368968, 'sideways_tsl_mult': 0.9375332469617128, 'sideways_time_stop': 43, 'sideways_use_sma': True, 'sideways_use_ema': False, 'sideways_use_atr': False, 'sideways_use_adx': True, 'sideways_use_spike': True, 'sideways_rsi_required': False}.
[I 2025-09-01 09:42:40,993] Trial 249 finished with values: [-0.01753538420401568, 0.01749681144637496] and parameters: {'p_sma': 59, 'p_std': 11, 'p_atr': 28, 'p_adx': 18, 'rsi_period': 46, 'ema1': 9, 'ema2': 10, 'slip_atr_k': 0.0610076006930529, 'slip_spread_k': 0.5901749105895596, 'spread_hl_frac': 0.031459586486659176, 'bb_std_mult': 2.7128184939586273, 'rsi_os': 51, 'rsi_ob': 63, 'vol_spike': 0.025429726788033985, 'adx_thresh': 12.771231619653708, 'atr_min_pct': 0.020103933451014452, 'atr_max_pct': 0.0719065616057199, 'tp_mult': 2.4910009456820434, 'tsl_mult': 0.6371075466196099, 'strategy': 'breakout', 'time_stop': 101, 'use_sma': True, 'use_atr': True, 'use_adx': False, 'use_ema': True, 'use_spike': True, 'rsi_required': True, 'edge_k': 0.6608602770738846, 'edge_cap': 0.6876767086065754, 'bull_strategy': 'mean_reversion', 'bull_bb_std_mult': 3.475063520794885, 'bull_rsi_os': 37, 'bull_rsi_ob': 79, 'bull_adx_thresh': 28.02938679845921, 'bull_atr_min_pct': 0.0029399047304892872, 'bull_atr_max_pct': 0.0752166755731351, 'bull_tp_mult': 2.7252966930909017, 'bull_tsl_mult': 0.9106183276386738, 'bull_time_stop': 146, 'bull_use_sma': True, 'bull_use_ema': False, 'bull_use_atr': False, 'bull_use_adx': True, 'bull_use_spike': True, 'bull_rsi_required': False, 'bear_strategy': 'breakout', 'bear_bb_std_mult': 1.4471127830597699, 'bear_rsi_os': 43, 'bear_rsi_ob': 75, 'bear_adx_thresh': 34.40493133232737, 'bear_atr_min_pct': 0.029522539224837725, 'bear_atr_max_pct': 0.1292484885627025, 'bear_tp_mult': 1.8046028221768318, 'bear_tsl_mult': 0.3167543999889607, 'bear_time_stop': 300, 'bear_use_sma': True, 'bear_use_ema': True, 'bear_use_atr': False, 'bear_use_adx': True, 'bear_use_spike': True, 'bear_rsi_required': False, 'sideways_strategy': 'breakout', 'sideways_bb_std_mult': 1.3399611565574987, 'sideways_rsi_os': 28, 'sideways_rsi_ob': 62, 'sideways_adx_thresh': 8.359531775431993, 'sideways_atr_min_pct': 0.0029787431645660824, 'sideways_atr_max_pct': 0.02959801137760562, 'sideways_tp_mult': 2.620132646903039, 'sideways_tsl_mult': 0.9359328014864994, 'sideways_time_stop': 231, 'sideways_use_sma': True, 'sideways_use_ema': False, 'sideways_use_atr': False, 'sideways_use_adx': True, 'sideways_use_spike': True, 'sideways_rsi_required': False}.
[I 2025-09-01 09:43:18,928] Trial 250 finished with values: [-1000000000.0, 1000000000.0] and parameters: {'p_sma': 59, 'p_std': 44, 'p_atr': 28, 'p_adx': 11, 'rsi_period': 46, 'ema1': 9, 'ema2': 10, 'slip_atr_k': 0.00856410756827188, 'slip_spread_k': 0.38163068147620804, 'spread_hl_frac': 0.00801901185848841, 'bb_std_mult': 2.706139056290152, 'rsi_os': 9, 'rsi_ob': 54, 'vol_spike': 0.23980201260165018, 'adx_thresh': 27.07438659634729, 'atr_min_pct': 0.019162154867316424, 'atr_max_pct': 0.10061330595058429, 'tp_mult': 2.4897017168118594, 'tsl_mult': 0.9950685939158861, 'strategy': 'breakout', 'time_stop': 131, 'use_sma': False, 'use_atr': True, 'use_adx': True, 'use_ema': False, 'use_spike': True, 'rsi_required': False, 'edge_k': 0.607853928338754, 'edge_cap': 0.1866327112035127, 'bull_strategy': 'mean_reversion', 'bull_bb_std_mult': 3.3935072724271724, 'bull_rsi_os': 36, 'bull_rsi_ob': 79, 'bull_adx_thresh': 28.222498138725346, 'bull_atr_min_pct': 0.003173985353850506, 'bull_atr_max_pct': 0.08236937382197777, 'bull_tp_mult': 2.7101561825257003, 'bull_tsl_mult': 0.21073850405915334, 'bull_time_stop': 94, 'bull_use_sma': True, 'bull_use_ema': False, 'bull_use_atr': True, 'bull_use_adx': True, 'bull_use_spike': False, 'bull_rsi_required': False, 'bear_strategy': 'breakout', 'bear_bb_std_mult': 3.357224245284514, 'bear_rsi_os': 42, 'bear_rsi_ob': 91, 'bear_adx_thresh': 34.96574738580862, 'bear_atr_min_pct': 0.028208936822969086, 'bear_atr_max_pct': 0.12869160424416534, 'bear_tp_mult': 2.8246657576217586, 'bear_tsl_mult': 0.8017827200658825, 'bear_time_stop': 16, 'bear_use_sma': False, 'bear_use_ema': True, 'bear_use_atr': True, 'bear_use_adx': True, 'bear_use_spike': True, 'bear_rsi_required': False, 'sideways_strategy': 'breakout', 'sideways_bb_std_mult': 2.5406905211585906, 'sideways_rsi_os': 28, 'sideways_rsi_ob': 89, 'sideways_adx_thresh': 6.394125760175232, 'sideways_atr_min_pct': 0.0051915557777241685, 'sideways_atr_max_pct': 0.05776571889488921, 'sideways_tp_mult': 2.6064479355687973, 'sideways_tsl_mult': 0.46152633424187106, 'sideways_time_stop': 229, 'sideways_use_sma': False, 'sideways_use_ema': False, 'sideways_use_atr': False, 'sideways_use_adx': True, 'sideways_use_spike': True, 'sideways_rsi_required': False}.
[I 2025-09-01 09:43:19,904] Trial 251 finished with values: [-0.009448133405953962, 0.009210614526301735] and parameters: {'p_sma': 59, 'p_std': 16, 'p_atr': 28, 'p_adx': 20, 'rsi_period': 61, 'ema1': 9, 'ema2': 12, 'slip_atr_k': 0.06671821415022836, 'slip_spread_k': 0.8118898908437109, 'spread_hl_frac': 0.038876056999983, 'bb_std_mult': 2.6801243767964023, 'rsi_os': 19, 'rsi_ob': 55, 'vol_spike': 0.24159520358271472, 'adx_thresh': 24.156982051669043, 'atr_min_pct': 0.01917036095052998, 'atr_max_pct': 0.06588661812077323, 'tp_mult': 1.956045409775577, 'tsl_mult': 0.8370152865276601, 'strategy': 'breakout', 'time_stop': 133, 'use_sma': False, 'use_atr': False, 'use_adx': True, 'use_ema': False, 'use_spike': True, 'rsi_required': False, 'edge_k': 1.2533144172151247, 'edge_cap': 0.8760962257857735, 'bull_strategy': 'mean_reversion', 'bull_bb_std_mult': 3.4055558094859104, 'bull_rsi_os': 38, 'bull_rsi_ob': 79, 'bull_adx_thresh': 28.476318431527773, 'bull_atr_min_pct': 0.0029844545223336565, 'bull_atr_max_pct': 0.08194965614595909, 'bull_tp_mult': 1.8996508379600234, 'bull_tsl_mult': 0.6617545748607805, 'bull_time_stop': 148, 'bull_use_sma': True, 'bull_use_ema': False, 'bull_use_atr': True, 'bull_use_adx': True, 'bull_use_spike': False, 'bull_rsi_required': True, 'bear_strategy': 'mean_reversion', 'bear_bb_std_mult': 1.640785765260419, 'bear_rsi_os': 43, 'bear_rsi_ob': 91, 'bear_adx_thresh': 5.875638124940739, 'bear_atr_min_pct': 0.02807722998091572, 'bear_atr_max_pct': 0.1249097832500569, 'bear_tp_mult': 2.83010863735731, 'bear_tsl_mult': 0.8029319447011706, 'bear_time_stop': 15, 'bear_use_sma': True, 'bear_use_ema': True, 'bear_use_atr': True, 'bear_use_adx': True, 'bear_use_spike': True, 'bear_rsi_required': True, 'sideways_strategy': 'breakout', 'sideways_bb_std_mult': 2.5367579475034283, 'sideways_rsi_os': 40, 'sideways_rsi_ob': 94, 'sideways_adx_thresh': 33.6028024617076, 'sideways_atr_min_pct': 0.007982319850409049, 'sideways_atr_max_pct': 0.06903902309290445, 'sideways_tp_mult': 2.336891022042572, 'sideways_tsl_mult': 0.3847168254953757, 'sideways_time_stop': 227, 'sideways_use_sma': False, 'sideways_use_ema': False, 'sideways_use_atr': False, 'sideways_use_adx': False, 'sideways_use_spike': True, 'sideways_rsi_required': False}.
