[I 2025-09-01 09:40:35,605] Trial 237 finished with values: [-1000000000.0, 1000000000.0] and parameters: {'p_sma': 59, 'p_std': 46, 'p_atr': 16, 'p_adx': 25, 'rsi_period': 45, 'ema1': 7, 'ema2': 12, 'slip_atr_k': 0.00603617628184622, 'slip_spread_k': 0.7216546809242639, 'spread_hl_frac': 0.03633566819656468, 'bb_std_mult': 1.6449652086861657, 'rsi_os': 5, 'rsi_ob': 93, 'vol_spike': 0.06100554805979898, 'adx_thresh': 10.889293588301632, 'atr_min_pct': 0.0018450308238851226, 'atr_max_pct': 0.06059327566158654, 'tp_mult': 2.4183385530684327, 'tsl_mult': 0.853782412176998, 'strategy': 'breakout', 'time_stop': 145, 'use_sma': True, 'use_atr': True, 'use_adx': False, 'use_ema': False, 'use_spike': True, 'rsi_required': False, 'edge_k': 0.5879522133838322, 'edge_cap': 0.838683615155278, 'bull_strategy': 'mean_reversion', 'bull_bb_std_mult': 1.0977491286033567, 'bull_rsi_os': 5, 'bull_rsi_ob': 93, 'bull_adx_thresh': 27.184045465501143, 'bull_atr_min_pct': 0.006033121295138583, 'bull_atr_max_pct': 0.08089465407428298, 'bull_tp_mult': 1.8144733342028356, 'bull_tsl_mult': 0.8660643494737515, 'bull_time_stop': 133, 'bull_use_sma': True, 'bull_use_ema': False, 'bull_use_atr': True, 'bull_use_adx': False, 'bull_use_spike': True, 'bull_rsi_required': False, 'bear_strategy': 'breakout', 'bear_bb_std_mult': 1.3233768282800027, 'bear_rsi_os': 45, 'bear_rsi_ob': 71, 'bear_adx_thresh': 19.793882709370276, 'bear_atr_min_pct': 0.02997033236816821, 'bear_atr_max_pct': 0.1267662019399493, 'bear_tp_mult': 1.0519119906597398, 'bear_tsl_mult': 0.7817776929016595, 'bear_time_stop': 17, 'bear_use_sma': False, 'bear_use_ema': True, 'bear_use_atr': True, 'bear_use_adx': True, 'bear_use_spike': True, 'bear_rsi_required': False, 'sideways_strategy': 'mean_reversion', 'sideways_bb_std_mult': 2.6498624949863743, 'sideways_rsi_os': 29, 'sideways_rsi_ob': 47, 'sideways_adx_thresh': 18.603264514580967, 'sideways_atr_min_pct': 0.0027564351637317432, 'sideways_atr_max_pct': 0.1434576761783586, 'sideways_tp_mult': 1.733564758781747, 'sideways_tsl_mult': 0.29505692422504026, 'sideways_time_stop': 234, 'sideways_use_sma': True, 'sideways_use_ema': False, 'sideways_use_atr': False, 'sideways_use_adx': False, 'sideways_use_spike': True, 'sideways_rsi_required': False}.
[I 2025-09-01 09:40:36,537] Trial 235 finished with values: [-0.00953183090573928, 0.009566016865179657] and parameters: {'p_sma': 41, 'p_std': 13, 'p_atr': 15, 'p_adx': 24, 'rsi_period': 41, 'ema1': 7, 'ema2': 36, 'slip_atr_k': 0.07721400827832323, 'slip_spread_k': 0.5637734124236112, 'spread_hl_frac': 0.03633457334968587, 'bb_std_mult': 1.1058742465589741, 'rsi_os': 5, 'rsi_ob': 56, 'vol_spike': 0.20341039641528175, 'adx_thresh': 10.872746078813973, 'atr_min_pct': 0.02177135704894608, 'atr_max_pct': 0.08417759714523645, 'tp_mult': 1.2932286795030143, 'tsl_mult': 0.8608794060191967, 'strategy': 'breakout', 'time_stop': 144, 'use_sma': True, 'use_atr': True, 'use_adx': False, 'use_ema': False, 'use_spike': False, 'rsi_required': False, 'edge_k': 1.9938511141597686, 'edge_cap': 0.7494924777817921, 'bull_strategy': 'breakout', 'bull_bb_std_mult': 2.820834892520381, 'bull_rsi_os': 5, 'bull_rsi_ob': 95, 'bull_adx_thresh': 27.23876308663016, 'bull_atr_min_pct': 0.003951994370006966, 'bull_atr_max_pct': 0.11917762234826054, 'bull_tp_mult': 2.806010541729658, 'bull_tsl_mult': 0.9659837563032101, 'bull_time_stop': 134, 'bull_use_sma': True, 'bull_use_ema': True, 'bull_use_atr': True, 'bull_use_adx': False, 'bull_use_spike': True, 'bull_rsi_required': False, 'bear_strategy': 'breakout', 'bear_bb_std_mult': 0.7104645988498994, 'bear_rsi_os': 47, 'bear_rsi_ob': 72, 'bear_adx_thresh': 8.277238046490847, 'bear_atr_min_pct': 0.019141602712858637, 'bear_atr_max_pct': 0.06527371738478287, 'bear_tp_mult': 2.888988500085986, 'bear_tsl_mult': 0.8569995437185358, 'bear_time_stop': 279, 'bear_use_sma': False, 'bear_use_ema': True, 'bear_use_atr': True, 'bear_use_adx': False, 'bear_use_spike': True, 'bear_rsi_required': False, 'sideways_strategy': 'mean_reversion', 'sideways_bb_std_mult': 2.430753405750564, 'sideways_rsi_os': 51, 'sideways_rsi_ob': 47, 'sideways_adx_thresh': 13.62314947488301, 'sideways_atr_min_pct': 0.01640357556275295, 'sideways_atr_max_pct': 0.14402136726842193, 'sideways_tp_mult': 1.2943068858454465, 'sideways_tsl_mult': 0.49801143024296274, 'sideways_time_stop': 216, 'sideways_use_sma': True, 'sideways_use_ema': True, 'sideways_use_atr': False, 'sideways_use_adx': False, 'sideways_use_spike': True, 'sideways_rsi_required': False}.
[I 2025-09-01 09:40:36,827] Trial 234 finished with values: [-0.0034210839042838614, 0.003542375432544321] and parameters: {'p_sma': 58, 'p_std': 43, 'p_atr': 28, 'p_adx': 25, 'rsi_period': 41, 'ema1': 7, 'ema2': 25, 'slip_atr_k': 0.0034377072921436902, 'slip_spread_k': 0.7236422430231169, 'spread_hl_frac': 0.0065897068005909346, 'bb_std_mult': 2.728898049850405, 'rsi_os': 10, 'rsi_ob': 87, 'vol_spike': 0.08632541753501667, 'adx_thresh': 10.914995546108361, 'atr_min_pct': 0.004007112931643759, 'atr_max_pct': 0.07152929887857555, 'tp_mult': 2.421530278693995, 'tsl_mult': 0.8082504313264934, 'strategy': 'breakout', 'time_stop': 83, 'use_sma': True, 'use_atr': True, 'use_adx': False, 'use_ema': False, 'use_spike': False, 'rsi_required': False, 'edge_k': 0.5709502931961555, 'edge_cap': 0.7377648444059091, 'bull_strategy': 'breakout', 'bull_bb_std_mult': 3.3571332993950973, 'bull_rsi_os': 44, 'bull_rsi_ob': 94, 'bull_adx_thresh': 29.101712009282597, 'bull_atr_min_pct': 0.0031608370576438325, 'bull_atr_max_pct': 0.07869409105515913, 'bull_tp_mult': 1.4448613211997756, 'bull_tsl_mult': 0.868614640679923, 'bull_time_stop': 133, 'bull_use_sma': True, 'bull_use_ema': True, 'bull_use_atr': True, 'bull_use_adx': False, 'bull_use_spike': True, 'bull_rsi_required': False, 'bear_strategy': 'breakout', 'bear_bb_std_mult': 1.5250176229152888, 'bear_rsi_os': 48, 'bear_rsi_ob': 72, 'bear_adx_thresh': 9.332760964982837, 'bear_atr_min_pct': 0.028597101882995503, 'bear_atr_max_pct': 0.12694461069556892, 'bear_tp_mult': 2.8327600378929234, 'bear_tsl_mult': 0.18102308995320754, 'bear_time_stop': 278, 'bear_use_sma': False, 'bear_use_ema': True, 'bear_use_atr': True, 'bear_use_adx': False, 'bear_use_spike': True, 'bear_rsi_required': False, 'sideways_strategy': 'mean_reversion', 'sideways_bb_std_mult': 1.3282179500506621, 'sideways_rsi_os': 52, 'sideways_rsi_ob': 61, 'sideways_adx_thresh': 10.645727692796651, 'sideways_atr_min_pct': 0.010042795797497964, 'sideways_atr_max_pct': 0.1434608483259323, 'sideways_tp_mult': 1.2702269989972557, 'sideways_tsl_mult': 0.3053643978194195, 'sideways_time_stop': 235, 'sideways_use_sma': True, 'sideways_use_ema': True, 'sideways_use_atr': False, 'sideways_use_adx': False, 'sideways_use_spike': True, 'sideways_rsi_required': False}.
[I 2025-09-01 09:40:37,123] Trial 236 finished with values: [-1000000000.0, 1000000000.0] and parameters: {'p_sma': 59, 'p_std': 54, 'p_atr': 15, 'p_adx': 10, 'rsi_period': 45, 'ema1': 7, 'ema2': 43, 'slip_atr_k': 0.0032809797381145303, 'slip_spread_k': 0.7373378582579384, 'spread_hl_frac': 0.0066429673738210284, 'bb_std_mult': 2.610391555712157, 'rsi_os': 5, 'rsi_ob': 93, 'vol_spike': 0.20114849286006684, 'adx_thresh': 25.506633709439985, 'atr_min_pct': 0.00421326570631609, 'atr_max_pct': 0.08421312987897793, 'tp_mult': 2.5338338171414847, 'tsl_mult': 0.23883640086627445, 'strategy': 'breakout', 'time_stop': 145, 'use_sma': True, 'use_atr': True, 'use_adx': False, 'use_ema': False, 'use_spike': False, 'rsi_required': False, 'edge_k': 0.5811036812335685, 'edge_cap': 0.7515611526859027, 'bull_strategy': 'breakout', 'bull_bb_std_mult': 3.371001594715108, 'bull_rsi_os': 5, 'bull_rsi_ob': 78, 'bull_adx_thresh': 27.17721929704267, 'bull_atr_min_pct': 0.02445762127621214, 'bull_atr_max_pct': 0.07996558240895936, 'bull_tp_mult': 1.1067986822648133, 'bull_tsl_mult': 0.9638884910914605, 'bull_time_stop': 133, 'bull_use_sma': True, 'bull_use_ema': True, 'bull_use_atr': True, 'bull_use_adx': False, 'bull_use_spike': True, 'bull_rsi_required': False, 'bear_strategy': 'breakout', 'bear_bb_std_mult': 2.7702162481716153, 'bear_rsi_os': 45, 'bear_rsi_ob': 84, 'bear_adx_thresh': 33.71855671026367, 'bear_atr_min_pct': 0.028664502665953096, 'bear_atr_max_pct': 0.12587681831526823, 'bear_tp_mult': 2.338821930739388, 'bear_tsl_mult': 0.17665105118315783, 'bear_time_stop': 106, 'bear_use_sma': False, 'bear_use_ema': True, 'bear_use_atr': True, 'bear_use_adx': False, 'bear_use_spike': True, 'bear_rsi_required': False, 'sideways_strategy': 'mean_reversion', 'sideways_bb_std_mult': 2.6306866612165365, 'sideways_rsi_os': 38, 'sideways_rsi_ob': 61, 'sideways_adx_thresh': 32.1497451076824, 'sideways_atr_min_pct': 0.0027602893032757916, 'sideways_atr_max_pct': 0.14303565906439603, 'sideways_tp_mult': 1.631624849523259, 'sideways_tsl_mult': 0.9522900556346875, 'sideways_time_stop': 278, 'sideways_use_sma': True, 'sideways_use_ema': True, 'sideways_use_atr': False, 'sideways_use_adx': False, 'sideways_use_spike': True, 'sideways_rsi_required': False}.
[I 2025-09-01 09:41:19,211] Trial 241 finished with values: [-0.006021815002074993, 0.00630961125558144] and parameters: {'p_sma': 58, 'p_std': 45, 'p_atr': 24, 'p_adx': 18, 'rsi_period': 43, 'ema1': 8, 'ema2': 13, 'slip_atr_k': 0.00010109558731104945, 'slip_spread_k': 0.9681017329123867, 'spread_hl_frac': 0.02884066552749289, 'bb_std_mult': 2.716692196986482, 'rsi_os': 10, 'rsi_ob': 55, 'vol_spike': 0.052063400996364986, 'adx_thresh': 11.769392184376658, 'atr_min_pct': 0.019313753357974053, 'atr_max_pct': 0.06826734714018583, 'tp_mult': 1.9459183800785291, 'tsl_mult': 0.6837273979890651, 'strategy': 'breakout', 'time_stop': 154, 'use_sma': True, 'use_atr': True, 'use_adx': False, 'use_ema': False, 'use_spike': True, 'rsi_required': False, 'edge_k': 0.6191860690710351, 'edge_cap': 0.8375291918594856, 'bull_strategy': 'mean_reversion', 'bull_bb_std_mult': 2.8130740287328835, 'bull_rsi_os': 39, 'bull_rsi_ob': 75, 'bull_adx_thresh': 28.100536671325322, 'bull_atr_min_pct': 0.0037662235717515263, 'bull_atr_max_pct': 0.08458615498221526, 'bull_tp_mult': 1.5242862149128327, 'bull_tsl_mult': 0.9234747061954448, 'bull_time_stop': 142, 'bull_use_sma': True, 'bull_use_ema': False, 'bull_use_atr': True, 'bull_use_adx': False, 'bull_use_spike': True, 'bull_rsi_required': False, 'bear_strategy': 'breakout', 'bear_bb_std_mult': 1.6294933613460187, 'bear_rsi_os': 46, 'bear_rsi_ob': 65, 'bear_adx_thresh': 5.872503381371439, 'bear_atr_min_pct': 0.029353608221795117, 'bear_atr_max_pct': 0.12195257963912072, 'bear_tp_mult': 2.826771875086459, 'bear_tsl_mult': 0.22184405728224343, 'bear_time_stop': 276, 'bear_use_sma': False, 'bear_use_ema': True, 'bear_use_atr': True, 'bear_use_adx': True, 'bear_use_spike': True, 'bear_rsi_required': False, 'sideways_strategy': 'mean_reversion', 'sideways_bb_std_mult': 1.3188758874793622, 'sideways_rsi_os': 30, 'sideways_rsi_ob': 72, 'sideways_adx_thresh': 10.548110949692994, 'sideways_atr_min_pct': 0.0017394976085093018, 'sideways_atr_max_pct': 0.08660040657760502, 'sideways_tp_mult': 1.304160570049911, 'sideways_tsl_mult': 0.8914976861298052, 'sideways_time_stop': 213, 'sideways_use_sma': True, 'sideways_use_ema': False, 'sideways_use_atr': False, 'sideways_use_adx': False, 'sideways_use_spike': True, 'sideways_rsi_required': False}.
[I 2025-09-01 09:41:19,784] Trial 240 finished with values: [-1000000000.0, 1000000000.0] and parameters: {'p_sma': 48, 'p_std': 45, 'p_atr': 15, 'p_adx': 24, 'rsi_period': 43, 'ema1': 17, 'ema2': 43, 'slip_atr_k': 0.07589888500057293, 'slip_spread_k': 0.585490207421223, 'spread_hl_frac': 0.029308630274410517, 'bb_std_mult': 1.2507952007751042, 'rsi_os': 35, 'rsi_ob': 55, 'vol_spike': 0.20128503476378717, 'adx_thresh': 11.844560679642576, 'atr_min_pct': 0.0038749094825286344, 'atr_max_pct': 0.0676308044149033, 'tp_mult': 2.5298231271243186, 'tsl_mult': 0.6759182355949088, 'strategy': 'breakout', 'time_stop': 154, 'use_sma': True, 'use_atr': True, 'use_adx': False, 'use_ema': False, 'use_spike': False, 'rsi_required': False, 'edge_k': 0.623362148233919, 'edge_cap': 0.7553667928698118, 'bull_strategy': 'breakout', 'bull_bb_std_mult': 0.9895273799704014, 'bull_rsi_os': 19, 'bull_rsi_ob': 95, 'bull_adx_thresh': 27.990767782544843, 'bull_atr_min_pct': 0.0175914607365634, 'bull_atr_max_pct': 0.07827523047827552, 'bull_tp_mult': 1.5059415910998737, 'bull_tsl_mult': 0.9680353664287914, 'bull_time_stop': 133, 'bull_use_sma': True, 'bull_use_ema': True, 'bull_use_atr': True, 'bull_use_adx': False, 'bull_use_spike': True, 'bull_rsi_required': False, 'bear_strategy': 'breakout', 'bear_bb_std_mult': 2.8080809877138737, 'bear_rsi_os': 48, 'bear_rsi_ob': 71, 'bear_adx_thresh': 33.69151590804444, 'bear_atr_min_pct': 0.007205896799980907, 'bear_atr_max_pct': 0.06419053294747938, 'bear_tp_mult': 2.388255637835308, 'bear_tsl_mult': 0.37169158369470556, 'bear_time_stop': 90, 'bear_use_sma': False, 'bear_use_ema': True, 'bear_use_atr': True, 'bear_use_adx': False, 'bear_use_spike': True, 'bear_rsi_required': False, 'sideways_strategy': 'mean_reversion', 'sideways_bb_std_mult': 1.5298335453346186, 'sideways_rsi_os': 30, 'sideways_rsi_ob': 61, 'sideways_adx_thresh': 31.85685176222091, 'sideways_atr_min_pct': 0.026125567849341166, 'sideways_atr_max_pct': 0.08680059007589387, 'sideways_tp_mult': 1.3042049580697372, 'sideways_tsl_mult': 0.49241540860221333, 'sideways_time_stop': 215, 'sideways_use_sma': True, 'sideways_use_ema': True, 'sideways_use_atr': False, 'sideways_use_adx': False, 'sideways_use_spike': True, 'sideways_rsi_required': False}.
[I 2025-09-01 09:41:21,117] Trial 238 finished with values: [-1000000000.0, 1000000000.0] and parameters: {'p_sma': 58, 'p_std': 53, 'p_atr': 28, 'p_adx': 11, 'rsi_period': 54, 'ema1': 15, 'ema2': 44, 'slip_atr_k': 0.0035658567989970682, 'slip_spread_k': 0.6687137212457889, 'spread_hl_frac': 0.006622492141366409, 'bb_std_mult': 2.5900993412915505, 'rsi_os': 23, 'rsi_ob': 87, 'vol_spike': 0.03898800512285158, 'adx_thresh': 11.858568329629113, 'atr_min_pct': 0.004505161269311728, 'atr_max_pct': 0.06828373828350352, 'tp_mult': 2.5331603770899487, 'tsl_mult': 0.8139377540772801, 'strategy': 'breakout', 'time_stop': 154, 'use_sma': True, 'use_atr': True, 'use_adx': False, 'use_ema': False, 'use_spike': False, 'rsi_required': False, 'edge_k': 1.9944631985691497, 'edge_cap': 0.8353587552699919, 'bull_strategy': 'breakout', 'bull_bb_std_mult': 2.803179982158965, 'bull_rsi_os': 39, 'bull_rsi_ob': 78, 'bull_adx_thresh': 11.475111938673464, 'bull_atr_min_pct': 0.0040528760738633976, 'bull_atr_max_pct': 0.07936901716551273, 'bull_tp_mult': 1.5140214151277276, 'bull_tsl_mult': 0.9794003111490588, 'bull_time_stop': 132, 'bull_use_sma': True, 'bull_use_ema': True, 'bull_use_atr': True, 'bull_use_adx': False, 'bull_use_spike': True, 'bull_rsi_required': False, 'bear_strategy': 'breakout', 'bear_bb_std_mult': 0.7317160664430344, 'bear_rsi_os': 36, 'bear_rsi_ob': 72, 'bear_adx_thresh': 11.314244249349054, 'bear_atr_min_pct': 0.02846556089858327, 'bear_atr_max_pct': 0.01890625201869378, 'bear_tp_mult': 1.941082450388833, 'bear_tsl_mult': 0.1663477342768318, 'bear_time_stop': 5, 'bear_use_sma': False, 'bear_use_ema': True, 'bear_use_atr': True, 'bear_use_adx': False, 'bear_use_spike': True, 'bear_rsi_required': False, 'sideways_strategy': 'mean_reversion', 'sideways_bb_std_mult': 2.4263237695302613, 'sideways_rsi_os': 30, 'sideways_rsi_ob': 61, 'sideways_adx_thresh': 16.65398389032221, 'sideways_atr_min_pct': 0.001842056014311799, 'sideways_atr_max_pct': 0.08578878170745567, 'sideways_tp_mult': 1.305598387722108, 'sideways_tsl_mult': 0.8898736241727467, 'sideways_time_stop': 216, 'sideways_use_sma': True, 'sideways_use_ema': True, 'sideways_use_atr': False, 'sideways_use_adx': False, 'sideways_use_spike': True, 'sideways_rsi_required': False}.
[I 2025-09-01 09:41:21,478] Trial 239 finished with values: [-1000000000.0, 1000000000.0] and parameters: {'p_sma': 41, 'p_std': 45, 'p_atr': 25, 'p_adx': 11, 'rsi_period': 43, 'ema1': 8, 'ema2': 43, 'slip_atr_k': 0.09752269091141363, 'slip_spread_k': 0.6723061805287196, 'spread_hl_frac': 0.006417460231085798, 'bb_std_mult': 2.6207674798918545, 'rsi_os': 10, 'rsi_ob': 55, 'vol_spike': 0.042196784519030625, 'adx_thresh': 11.8252106867386, 'atr_min_pct': 0.0195798058130774, 'atr_max_pct': 0.08071357374465413, 'tp_mult': 2.533510655043476, 'tsl_mult': 0.8105095500856113, 'strategy': 'breakout', 'time_stop': 154, 'use_sma': True, 'use_atr': True, 'use_adx': False, 'use_ema': False, 'use_spike': True, 'rsi_required': False, 'edge_k': 0.6306902014014952, 'edge_cap': 0.8376840587864844, 'bull_strategy': 'mean_reversion', 'bull_bb_std_mult': 2.975893670613559, 'bull_rsi_os': 39, 'bull_rsi_ob': 95, 'bull_adx_thresh': 28.069619285522563, 'bull_atr_min_pct': 0.004129792695648418, 'bull_atr_max_pct': 0.07850398597039417, 'bull_tp_mult': 1.1135579505592825, 'bull_tsl_mult': 0.9726225782528908, 'bull_time_stop': 142, 'bull_use_sma': True, 'bull_use_ema': False, 'bull_use_atr': True, 'bull_use_adx': False, 'bull_use_spike': True, 'bull_rsi_required': False, 'bear_strategy': 'breakout', 'bear_bb_std_mult': 2.3330672424186756, 'bear_rsi_os': 46, 'bear_rsi_ob': 65, 'bear_adx_thresh': 33.60444819176993, 'bear_atr_min_pct': 0.027493882566101184, 'bear_atr_max_pct': 0.12210972633126377, 'bear_tp_mult': 2.3294291715299997, 'bear_tsl_mult': 0.8432994936037286, 'bear_time_stop': 58, 'bear_use_sma': False, 'bear_use_ema': True, 'bear_use_atr': True, 'bear_use_adx': False, 'bear_use_spike': True, 'bear_rsi_required': False, 'sideways_strategy': 'mean_reversion', 'sideways_bb_std_mult': 2.423848167396902, 'sideways_rsi_os': 30, 'sideways_rsi_ob': 58, 'sideways_adx_thresh': 31.8754893101389, 'sideways_atr_min_pct': 0.013406803141498195, 'sideways_atr_max_pct': 0.0861209845316348, 'sideways_tp_mult': 1.8281060855625155, 'sideways_tsl_mult': 0.889504510375134, 'sideways_time_stop': 218, 'sideways_use_sma': True, 'sideways_use_ema': True, 'sideways_use_atr': False, 'sideways_use_adx': False, 'sideways_use_spike': True, 'sideways_rsi_required': False}.
[I 2025-09-01 09:42:00,585] Trial 245 finished with values: [-1000000000.0, 1000000000.0] and parameters: {'p_sma': 60, 'p_std': 13, 'p_atr': 29, 'p_adx': 27, 'rsi_period': 41, 'ema1': 8, 'ema2': 37, 'slip_atr_k': 0.010240360926673148, 'slip_spread_k': 0.5459178210910612, 'spread_hl_frac': 0.005052484332435932, 'bb_std_mult': 0.6736752968146249, 'rsi_os': 8, 'rsi_ob': 56, 'vol_spike': 0.19240619302183806, 'adx_thresh': 11.109138899988116, 'atr_min_pct': 0.019370040203182285, 'atr_max_pct': 0.062472338747591276, 'tp_mult': 2.4748947043047633, 'tsl_mult': 0.8642257307823396, 'strategy': 'breakout', 'time_stop': 140, 'use_sma': False, 'use_atr': True, 'use_adx': False, 'use_ema': False, 'use_spike': True, 'rsi_required': False, 'edge_k': 0.5591270463988344, 'edge_cap': 0.8557487517278575, 'bull_strategy': 'mean_reversion', 'bull_bb_std_mult': 3.5351165239437905, 'bull_rsi_os': 25, 'bull_rsi_ob': 81, 'bull_adx_thresh': 28.869299179513458, 'bull_atr_min_pct': 0.004718176524151279, 'bull_atr_max_pct': 0.0848324942642285, 'bull_tp_mult': 1.5530983466748154, 'bull_tsl_mult': 0.1392403048438035, 'bull_time_stop': 142, 'bull_use_sma': True, 'bull_use_ema': False, 'bull_use_atr': True, 'bull_use_adx': False, 'bull_use_spike': False, 'bull_rsi_required': False, 'bear_strategy': 'mean_reversion', 'bear_bb_std_mult': 2.8988979386097755, 'bear_rsi_os': 44, 'bear_rsi_ob': 72, 'bear_adx_thresh': 27.083918736807714, 'bear_atr_min_pct': 0.005932336066149398, 'bear_atr_max_pct': 0.1305360068274274, 'bear_tp_mult': 2.827352944718542, 'bear_tsl_mult': 0.8080221205985495, 'bear_time_stop': 168, 'bear_use_sma': False, 'bear_use_ema': True, 'bear_use_atr': True, 'bear_use_adx': True, 'bear_use_spike': True, 'bear_rsi_required': False, 'sideways_strategy': 'breakout', 'sideways_bb_std_mult': 3.5262114997373297, 'sideways_rsi_os': 32, 'sideways_rsi_ob': 59, 'sideways_adx_thresh': 32.756239318761075, 'sideways_atr_min_pct': 0.0037144884212062168, 'sideways_atr_max_pct': 0.08956476155797283, 'sideways_tp_mult': 1.4122089237980506, 'sideways_tsl_mult': 0.9309512347780543, 'sideways_time_stop': 224, 'sideways_use_sma': True, 'sideways_use_ema': False, 'sideways_use_atr': False, 'sideways_use_adx': False, 'sideways_use_spike': True, 'sideways_rsi_required': False}.
