[I 2025-09-01 10:39:51,797] Trial 576 finished with values: [-1000000000.0, 1000000000.0] and parameters: {'p_sma': 7, 'p_std': 43, 'p_atr': 28, 'p_adx': 21, 'rsi_period': 46, 'ema1': 16, 'ema2': 57, 'slip_atr_k': 0.07905344133836877, 'slip_spread_k': 0.5796335747775938, 'spread_hl_frac': 0.005395056984745655, 'bb_std_mult': 3.1307052085505855, 'rsi_os': 47, 'rsi_ob': 51, 'vol_spike': 0.18374861852648094, 'adx_thresh': 16.425676960225395, 'atr_min_pct': 0.020457312094389998, 'atr_max_pct': 0.06431137256232008, 'tp_mult': 2.3553002478462544, 'tsl_mult': 0.8655264566641263, 'strategy': 'mean_reversion', 'time_stop': 146, 'use_sma': True, 'use_atr': True, 'use_adx': True, 'use_ema': False, 'use_spike': False, 'rsi_required': False, 'edge_k': 0.4895494199822321, 'edge_cap': 0.2934059949481667, 'bull_strategy': 'mean_reversion', 'bull_bb_std_mult': 3.4716643734172483, 'bull_rsi_os': 28, 'bull_rsi_ob': 77, 'bull_adx_thresh': 24.819095296859558, 'bull_atr_min_pct': 0.01718995307643443, 'bull_atr_max_pct': 0.06847357622018925, 'bull_tp_mult': 1.557520070903864, 'bull_tsl_mult': 0.9440084516803736, 'bull_time_stop': 232, 'bull_use_sma': False, 'bull_use_ema': False, 'bull_use_atr': True, 'bull_use_adx': True, 'bull_use_spike': True, 'bull_rsi_required': False, 'bear_strategy': 'mean_reversion', 'bear_bb_std_mult': 1.523214901120652, 'bear_rsi_os': 52, 'bear_rsi_ob': 74, 'bear_adx_thresh': 25.539404508471286, 'bear_atr_min_pct': 0.028167192919082335, 'bear_atr_max_pct': 0.12323672686755062, 'bear_tp_mult': 2.8964015279019066, 'bear_tsl_mult': 0.829049695023331, 'bear_time_stop': 5, 'bear_use_sma': False, 'bear_use_ema': True, 'bear_use_atr': True, 'bear_use_adx': True, 'bear_use_spike': True, 'bear_rsi_required': True, 'sideways_strategy': 'mean_reversion', 'sideways_bb_std_mult': 2.645172136672263, 'sideways_rsi_os': 41, 'sideways_rsi_ob': 85, 'sideways_adx_thresh': 31.905829221784966, 'sideways_atr_min_pct': 0.0018438877156539495, 'sideways_atr_max_pct': 0.08017381800424252, 'sideways_tp_mult': 1.3444639739506217, 'sideways_tsl_mult': 0.8845727644534223, 'sideways_time_stop': 229, 'sideways_use_sma': True, 'sideways_use_ema': False, 'sideways_use_atr': False, 'sideways_use_adx': True, 'sideways_use_spike': True, 'sideways_rsi_required': False}.
[I 2025-09-01 10:39:52,814] Trial 577 finished with values: [-0.05476634408071335, 0.05465340773919975] and parameters: {'p_sma': 57, 'p_std': 43, 'p_atr': 28, 'p_adx': 21, 'rsi_period': 11, 'ema1': 16, 'ema2': 14, 'slip_atr_k': 0.016365489032814012, 'slip_spread_k': 0.5806331663725934, 'spread_hl_frac': 0.007558091734064239, 'bb_std_mult': 2.6826973922018857, 'rsi_os': 43, 'rsi_ob': 56, 'vol_spike': 0.18262642814508884, 'adx_thresh': 9.391551090056115, 'atr_min_pct': 0.013821513156517203, 'atr_max_pct': 0.06315233034189928, 'tp_mult': 1.4963843686587988, 'tsl_mult': 0.8693115596286048, 'strategy': 'mean_reversion', 'time_stop': 70, 'use_sma': True, 'use_atr': True, 'use_adx': True, 'use_ema': False, 'use_spike': False, 'rsi_required': False, 'edge_k': 0.46981852514826317, 'edge_cap': 0.4843740156452758, 'bull_strategy': 'mean_reversion', 'bull_bb_std_mult': 2.0646733427410835, 'bull_rsi_os': 35, 'bull_rsi_ob': 77, 'bull_adx_thresh': 29.531129943450786, 'bull_atr_min_pct': 0.02518969874110931, 'bull_atr_max_pct': 0.03979815748125098, 'bull_tp_mult': 1.5453065493382183, 'bull_tsl_mult': 0.9631731695394894, 'bull_time_stop': 269, 'bull_use_sma': False, 'bull_use_ema': False, 'bull_use_atr': True, 'bull_use_adx': True, 'bull_use_spike': True, 'bull_rsi_required': False, 'bear_strategy': 'mean_reversion', 'bear_bb_std_mult': 1.5371582607642231, 'bear_rsi_os': 45, 'bear_rsi_ob': 74, 'bear_adx_thresh': 24.931158913210027, 'bear_atr_min_pct': 0.02999591232946571, 'bear_atr_max_pct': 0.12274193648825027, 'bear_tp_mult': 2.9188737189445524, 'bear_tsl_mult': 0.8192076910266332, 'bear_time_stop': 162, 'bear_use_sma': False, 'bear_use_ema': True, 'bear_use_atr': True, 'bear_use_adx': True, 'bear_use_spike': True, 'bear_rsi_required': True, 'sideways_strategy': 'mean_reversion', 'sideways_bb_std_mult': 2.6664862489334715, 'sideways_rsi_os': 50, 'sideways_rsi_ob': 58, 'sideways_adx_thresh': 22.17855631531317, 'sideways_atr_min_pct': 0.0018284263820245504, 'sideways_atr_max_pct': 0.07921441307805593, 'sideways_tp_mult': 1.3437994100438662, 'sideways_tsl_mult': 0.8226112037534533, 'sideways_time_stop': 137, 'sideways_use_sma': True, 'sideways_use_ema': False, 'sideways_use_atr': False, 'sideways_use_adx': True, 'sideways_use_spike': True, 'sideways_rsi_required': False}.
[I 2025-09-01 10:39:53,057] Trial 579 finished with values: [-0.015251870424178193, 0.015638431623681153] and parameters: {'p_sma': 40, 'p_std': 36, 'p_atr': 9, 'p_adx': 11, 'rsi_period': 46, 'ema1': 22, 'ema2': 50, 'slip_atr_k': 0.02289195708347385, 'slip_spread_k': 0.1915104894350183, 'spread_hl_frac': 0.00776941985529679, 'bb_std_mult': 2.3937289407661697, 'rsi_os': 47, 'rsi_ob': 56, 'vol_spike': 0.1845254125231124, 'adx_thresh': 29.367853512013134, 'atr_min_pct': 0.001596836812284303, 'atr_max_pct': 0.06301181389025075, 'tp_mult': 2.5102250735177396, 'tsl_mult': 0.8637896659727333, 'strategy': 'mean_reversion', 'time_stop': 296, 'use_sma': True, 'use_atr': True, 'use_adx': False, 'use_ema': False, 'use_spike': False, 'rsi_required': False, 'edge_k': 0.6557890936844719, 'edge_cap': 0.3033074083620819, 'bull_strategy': 'mean_reversion', 'bull_bb_std_mult': 2.332045347567392, 'bull_rsi_os': 29, 'bull_rsi_ob': 77, 'bull_adx_thresh': 29.732331610318532, 'bull_atr_min_pct': 0.009350689689581988, 'bull_atr_max_pct': 0.07927986354610976, 'bull_tp_mult': 1.1392498655713488, 'bull_tsl_mult': 0.9741826040982224, 'bull_time_stop': 153, 'bull_use_sma': True, 'bull_use_ema': False, 'bull_use_atr': True, 'bull_use_adx': True, 'bull_use_spike': True, 'bull_rsi_required': True, 'bear_strategy': 'mean_reversion', 'bear_bb_std_mult': 1.7579628658782065, 'bear_rsi_os': 51, 'bear_rsi_ob': 92, 'bear_adx_thresh': 25.72237171465002, 'bear_atr_min_pct': 0.015200555970881697, 'bear_atr_max_pct': 0.12309574602618858, 'bear_tp_mult': 2.9265760919039305, 'bear_tsl_mult': 0.8293958983786578, 'bear_time_stop': 259, 'bear_use_sma': False, 'bear_use_ema': True, 'bear_use_atr': True, 'bear_use_adx': True, 'bear_use_spike': True, 'bear_rsi_required': False, 'sideways_strategy': 'breakout', 'sideways_bb_std_mult': 0.7667175275465075, 'sideways_rsi_os': 52, 'sideways_rsi_ob': 60, 'sideways_adx_thresh': 31.95410649610449, 'sideways_atr_min_pct': 0.0031398486964160344, 'sideways_atr_max_pct': 0.1457091284807723, 'sideways_tp_mult': 1.2991538007054464, 'sideways_tsl_mult': 0.9711257019069048, 'sideways_time_stop': 84, 'sideways_use_sma': True, 'sideways_use_ema': False, 'sideways_use_atr': True, 'sideways_use_adx': True, 'sideways_use_spike': True, 'sideways_rsi_required': False}.
[I 2025-09-01 10:39:53,330] Trial 578 finished with values: [-1000000000.0, 1000000000.0] and parameters: {'p_sma': 57, 'p_std': 28, 'p_atr': 28, 'p_adx': 11, 'rsi_period': 42, 'ema1': 17, 'ema2': 46, 'slip_atr_k': 0.020850124098023826, 'slip_spread_k': 0.8060954758823033, 'spread_hl_frac': 0.0227230066807642, 'bb_std_mult': 1.5615265609463598, 'rsi_os': 8, 'rsi_ob': 59, 'vol_spike': 0.18346939585764035, 'adx_thresh': 16.479315452637245, 'atr_min_pct': 0.015597422960832165, 'atr_max_pct': 0.06207285268470002, 'tp_mult': 2.5070145866044293, 'tsl_mult': 0.8686544294713346, 'strategy': 'mean_reversion', 'time_stop': 148, 'use_sma': True, 'use_atr': True, 'use_adx': False, 'use_ema': False, 'use_spike': False, 'rsi_required': False, 'edge_k': 0.48575469341745436, 'edge_cap': 0.2965694436412385, 'bull_strategy': 'mean_reversion', 'bull_bb_std_mult': 2.253289257928423, 'bull_rsi_os': 12, 'bull_rsi_ob': 77, 'bull_adx_thresh': 29.574616923287177, 'bull_atr_min_pct': 0.00922318431872501, 'bull_atr_max_pct': 0.03926433626767713, 'bull_tp_mult': 1.6789435322734532, 'bull_tsl_mult': 0.9713981762447186, 'bull_time_stop': 176, 'bull_use_sma': True, 'bull_use_ema': False, 'bull_use_atr': True, 'bull_use_adx': True, 'bull_use_spike': True, 'bull_rsi_required': True, 'bear_strategy': 'mean_reversion', 'bear_bb_std_mult': 1.7523233319706153, 'bear_rsi_os': 53, 'bear_rsi_ob': 58, 'bear_adx_thresh': 25.711921231626444, 'bear_atr_min_pct': 0.029288647895928516, 'bear_atr_max_pct': 0.12283949745112326, 'bear_tp_mult': 2.904832743626739, 'bear_tsl_mult': 0.8320173725053389, 'bear_time_stop': 16, 'bear_use_sma': False, 'bear_use_ema': True, 'bear_use_atr': True, 'bear_use_adx': True, 'bear_use_spike': True, 'bear_rsi_required': False, 'sideways_strategy': 'mean_reversion', 'sideways_bb_std_mult': 2.656551458612628, 'sideways_rsi_os': 30, 'sideways_rsi_ob': 64, 'sideways_adx_thresh': 22.289996326417718, 'sideways_atr_min_pct': 0.0028171149151852573, 'sideways_atr_max_pct': 0.05863340146169426, 'sideways_tp_mult': 2.830933757758214, 'sideways_tsl_mult': 0.8221787226901482, 'sideways_time_stop': 254, 'sideways_use_sma': True, 'sideways_use_ema': False, 'sideways_use_atr': True, 'sideways_use_adx': True, 'sideways_use_spike': True, 'sideways_rsi_required': False}.
[I 2025-09-01 10:39:54,383] Trial 581 finished with values: [-1000000000.0, 1000000000.0] and parameters: {'p_sma': 58, 'p_std': 46, 'p_atr': 11, 'p_adx': 11, 'rsi_period': 45, 'ema1': 17, 'ema2': 46, 'slip_atr_k': 0.05972873544764226, 'slip_spread_k': 0.6543399683638149, 'spread_hl_frac': 0.00881995472704418, 'bb_std_mult': 2.47417769457937, 'rsi_os': 34, 'rsi_ob': 59, 'vol_spike': 0.19798796862975537, 'adx_thresh': 11.969479658159255, 'atr_min_pct': 0.019064634924546773, 'atr_max_pct': 0.012720987538325443, 'tp_mult': 2.5095513777871203, 'tsl_mult': 0.3160516969887141, 'strategy': 'breakout', 'time_stop': 59, 'use_sma': True, 'use_atr': True, 'use_adx': False, 'use_ema': False, 'use_spike': True, 'rsi_required': False, 'edge_k': 0.7041034665391334, 'edge_cap': 0.7442418031110432, 'bull_strategy': 'mean_reversion', 'bull_bb_std_mult': 2.353563406655543, 'bull_rsi_os': 37, 'bull_rsi_ob': 80, 'bull_adx_thresh': 25.71179576813653, 'bull_atr_min_pct': 0.004559051532169907, 'bull_atr_max_pct': 0.05917331759724274, 'bull_tp_mult': 1.8311678466309096, 'bull_tsl_mult': 0.9812816884279066, 'bull_time_stop': 151, 'bull_use_sma': True, 'bull_use_ema': False, 'bull_use_atr': True, 'bull_use_adx': False, 'bull_use_spike': False, 'bull_rsi_required': True, 'bear_strategy': 'breakout', 'bear_bb_std_mult': 1.3248297111169942, 'bear_rsi_os': 53, 'bear_rsi_ob': 55, 'bear_adx_thresh': 9.80214833675127, 'bear_atr_min_pct': 0.01495233436014976, 'bear_atr_max_pct': 0.0725595588137486, 'bear_tp_mult': 2.7878313897837677, 'bear_tsl_mult': 0.3191812744360636, 'bear_time_stop': 97, 'bear_use_sma': True, 'bear_use_ema': True, 'bear_use_atr': True, 'bear_use_adx': True, 'bear_use_spike': True, 'bear_rsi_required': False, 'sideways_strategy': 'breakout', 'sideways_bb_std_mult': 2.544783097275469, 'sideways_rsi_os': 31, 'sideways_rsi_ob': 60, 'sideways_adx_thresh': 31.164686204575386, 'sideways_atr_min_pct': 0.002827500193696968, 'sideways_atr_max_pct': 0.08922977312128623, 'sideways_tp_mult': 2.2335764156496967, 'sideways_tsl_mult': 0.5179645936592033, 'sideways_time_stop': 242, 'sideways_use_sma': True, 'sideways_use_ema': False, 'sideways_use_atr': True, 'sideways_use_adx': False, 'sideways_use_spike': False, 'sideways_rsi_required': False}.
[I 2025-09-01 10:39:54,383] Trial 582 finished with values: [-1000000000.0, 1000000000.0] and parameters: {'p_sma': 31, 'p_std': 46, 'p_atr': 28, 'p_adx': 11, 'rsi_period': 42, 'ema1': 8, 'ema2': 12, 'slip_atr_k': 0.16805739712212886, 'slip_spread_k': 0.6588549112383325, 'spread_hl_frac': 0.008921007300681787, 'bb_std_mult': 2.4887140065625712, 'rsi_os': 10, 'rsi_ob': 57, 'vol_spike': 0.1902525015932624, 'adx_thresh': 11.834047167716198, 'atr_min_pct': 0.01914642237329298, 'atr_max_pct': 0.012418290809498966, 'tp_mult': 2.6028398363776266, 'tsl_mult': 0.45772578858206914, 'strategy': 'breakout', 'time_stop': 151, 'use_sma': True, 'use_atr': True, 'use_adx': False, 'use_ema': False, 'use_spike': True, 'rsi_required': False, 'edge_k': 0.5760508127443277, 'edge_cap': 0.8445899406683229, 'bull_strategy': 'mean_reversion', 'bull_bb_std_mult': 1.4188358564146346, 'bull_rsi_os': 24, 'bull_rsi_ob': 90, 'bull_adx_thresh': 11.898776412910724, 'bull_atr_min_pct': 0.0038825392409315256, 'bull_atr_max_pct': 0.08807209932572373, 'bull_tp_mult': 1.845581730557065, 'bull_tsl_mult': 0.23494524199316535, 'bull_time_stop': 56, 'bull_use_sma': True, 'bull_use_ema': False, 'bull_use_atr': True, 'bull_use_adx': False, 'bull_use_spike': False, 'bull_rsi_required': True, 'bear_strategy': 'breakout', 'bear_bb_std_mult': 1.3448714461800941, 'bear_rsi_os': 53, 'bear_rsi_ob': 70, 'bear_adx_thresh': 31.510053875035464, 'bear_atr_min_pct': 0.02924488481502469, 'bear_atr_max_pct': 0.11928386065451034, 'bear_tp_mult': 2.757064828138165, 'bear_tsl_mult': 0.7888627571403031, 'bear_time_stop': 267, 'bear_use_sma': True, 'bear_use_ema': True, 'bear_use_atr': True, 'bear_use_adx': True, 'bear_use_spike': True, 'bear_rsi_required': False, 'sideways_strategy': 'mean_reversion', 'sideways_bb_std_mult': 0.6970023320914029, 'sideways_rsi_os': 31, 'sideways_rsi_ob': 91, 'sideways_adx_thresh': 33.53899565663011, 'sideways_atr_min_pct': 0.002805938432284491, 'sideways_atr_max_pct': 0.058529851721176446, 'sideways_tp_mult': 1.96175876894578, 'sideways_tsl_mult': 0.9411764430523112, 'sideways_time_stop': 257, 'sideways_use_sma': True, 'sideways_use_ema': False, 'sideways_use_atr': True, 'sideways_use_adx': False, 'sideways_use_spike': False, 'sideways_rsi_required': False}.
[I 2025-09-01 10:40:35,144] Trial 583 finished with values: [-1000000000.0, 1000000000.0] and parameters: {'p_sma': 9, 'p_std': 46, 'p_atr': 23, 'p_adx': 11, 'rsi_period': 45, 'ema1': 8, 'ema2': 12, 'slip_atr_k': 0.009792794050960337, 'slip_spread_k': 0.0860325841290045, 'spread_hl_frac': 0.008963000176500788, 'bb_std_mult': 2.522462385260771, 'rsi_os': 10, 'rsi_ob': 54, 'vol_spike': 0.191415848093443, 'adx_thresh': 11.848987926947455, 'atr_min_pct': 0.019276269633978858, 'atr_max_pct': 0.06671283089368639, 'tp_mult': 1.2591011768061362, 'tsl_mult': 0.4671929263931916, 'strategy': 'breakout', 'time_stop': 141, 'use_sma': True, 'use_atr': True, 'use_adx': False, 'use_ema': False, 'use_spike': True, 'rsi_required': False, 'edge_k': 0.5974112983818156, 'edge_cap': 0.7277006244153835, 'bull_strategy': 'mean_reversion', 'bull_bb_std_mult': 3.489284707289978, 'bull_rsi_os': 21, 'bull_rsi_ob': 82, 'bull_adx_thresh': 26.034342149133863, 'bull_atr_min_pct': 0.0016919473349105586, 'bull_atr_max_pct': 0.1192491918868168, 'bull_tp_mult': 1.343372118679184, 'bull_tsl_mult': 0.12656443891368963, 'bull_time_stop': 124, 'bull_use_sma': True, 'bull_use_ema': False, 'bull_use_atr': True, 'bull_use_adx': False, 'bull_use_spike': False, 'bull_rsi_required': False, 'bear_strategy': 'breakout', 'bear_bb_std_mult': 1.3861871816277314, 'bear_rsi_os': 8, 'bear_rsi_ob': 46, 'bear_adx_thresh': 9.623113981370723, 'bear_atr_min_pct': 0.008355131000913214, 'bear_atr_max_pct': 0.11760989913166103, 'bear_tp_mult': 2.7330254488469787, 'bear_tsl_mult': 0.17014272411491, 'bear_time_stop': 5, 'bear_use_sma': True, 'bear_use_ema': True, 'bear_use_atr': True, 'bear_use_adx': True, 'bear_use_spike': True, 'bear_rsi_required': False, 'sideways_strategy': 'breakout', 'sideways_bb_std_mult': 2.551214445841894, 'sideways_rsi_os': 31, 'sideways_rsi_ob': 69, 'sideways_adx_thresh': 20.54300659043035, 'sideways_atr_min_pct': 0.01696247669019868, 'sideways_atr_max_pct': 0.08965298879369525, 'sideways_tp_mult': 2.245074064541325, 'sideways_tsl_mult': 0.9021200162899045, 'sideways_time_stop': 238, 'sideways_use_sma': True, 'sideways_use_ema': False, 'sideways_use_atr': False, 'sideways_use_adx': False, 'sideways_use_spike': False, 'sideways_rsi_required': False}.
[I 2025-09-01 10:40:36,847] Trial 580 finished with values: [-0.022060253125468665, 0.022690891786344897] and parameters: {'p_sma': 58, 'p_std': 30, 'p_atr': 28, 'p_adx': 11, 'rsi_period': 32, 'ema1': 17, 'ema2': 13, 'slip_atr_k': 0.06927473522184852, 'slip_spread_k': 0.8029276845590447, 'spread_hl_frac': 0.008049020978560096, 'bb_std_mult': 1.2163232713885845, 'rsi_os': 26, 'rsi_ob': 56, 'vol_spike': 0.19156216530427286, 'adx_thresh': 12.097619431640096, 'atr_min_pct': 0.015541656125331009, 'atr_max_pct': 0.06231409632604086, 'tp_mult': 2.5073506944320876, 'tsl_mult': 0.8283649090619322, 'strategy': 'mean_reversion', 'time_stop': 28, 'use_sma': True, 'use_atr': True, 'use_adx': False, 'use_ema': False, 'use_spike': False, 'rsi_required': False, 'edge_k': 1.5325970038360226, 'edge_cap': 0.4414492117657891, 'bull_strategy': 'mean_reversion', 'bull_bb_std_mult': 2.2913574273747255, 'bull_rsi_os': 37, 'bull_rsi_ob': 78, 'bull_adx_thresh': 29.506022131736458, 'bull_atr_min_pct': 0.0020949567721887732, 'bull_atr_max_pct': 0.12028482509343605, 'bull_tp_mult': 1.65790141682592, 'bull_tsl_mult': 0.9578339513025549, 'bull_time_stop': 179, 'bull_use_sma': True, 'bull_use_ema': False, 'bull_use_atr': True, 'bull_use_adx': False, 'bull_use_spike': True, 'bull_rsi_required': True, 'bear_strategy': 'breakout', 'bear_bb_std_mult': 1.3627648485010917, 'bear_rsi_os': 45, 'bear_rsi_ob': 46, 'bear_adx_thresh': 31.288788492328283, 'bear_atr_min_pct': 0.015290022840303959, 'bear_atr_max_pct': 0.11767063634193746, 'bear_tp_mult': 2.9401094698992334, 'bear_tsl_mult': 0.17407799981624072, 'bear_time_stop': 268, 'bear_use_sma': False, 'bear_use_ema': True, 'bear_use_atr': True, 'bear_use_adx': True, 'bear_use_spike': True, 'bear_rsi_required': False, 'sideways_strategy': 'breakout', 'sideways_bb_std_mult': 2.535875067020363, 'sideways_rsi_os': 15, 'sideways_rsi_ob': 64, 'sideways_adx_thresh': 31.14204737757305, 'sideways_atr_min_pct': 0.0026805741489453246, 'sideways_atr_max_pct': 0.09092974862588044, 'sideways_tp_mult': 2.257039485673584, 'sideways_tsl_mult': 0.4262523182272554, 'sideways_time_stop': 82, 'sideways_use_sma': True, 'sideways_use_ema': False, 'sideways_use_atr': True, 'sideways_use_adx': True, 'sideways_use_spike': False, 'sideways_rsi_required': False}.
[I 2025-09-01 10:40:39,593] Trial 585 finished with values: [-1000000000.0, 1000000000.0] and parameters: {'p_sma': 10, 'p_std': 44, 'p_atr': 26, 'p_adx': 13, 'rsi_period': 55, 'ema1': 9, 'ema2': 25, 'slip_atr_k': 0.159365442556267, 'slip_spread_k': 0.08526308037211272, 'spread_hl_frac': 0.005044605816855256, 'bb_std_mult': 1.190705135144786, 'rsi_os': 55, 'rsi_ob': 52, 'vol_spike': 0.08555785149218359, 'adx_thresh': 20.388140324595994, 'atr_min_pct': 0.003383865640516551, 'atr_max_pct': 0.06542236991434465, 'tp_mult': 1.8659466126216842, 'tsl_mult': 0.5737058784455581, 'strategy': 'breakout', 'time_stop': 139, 'use_sma': True, 'use_atr': True, 'use_adx': False, 'use_ema': False, 'use_spike': True, 'rsi_required': False, 'edge_k': 0.2938208161365391, 'edge_cap': 0.8522798616254877, 'bull_strategy': 'mean_reversion', 'bull_bb_std_mult': 3.488395767702624, 'bull_rsi_os': 54, 'bull_rsi_ob': 82, 'bull_adx_thresh': 26.471986898538276, 'bull_atr_min_pct': 0.005185756593698569, 'bull_atr_max_pct': 0.0940248891824427, 'bull_tp_mult': 1.9768175910470724, 'bull_tsl_mult': 0.12276159549897298, 'bull_time_stop': 189, 'bull_use_sma': True, 'bull_use_ema': False, 'bull_use_atr': True, 'bull_use_adx': False, 'bull_use_spike': True, 'bull_rsi_required': False, 'bear_strategy': 'breakout', 'bear_bb_std_mult': 1.4064507306322376, 'bear_rsi_os': 43, 'bear_rsi_ob': 52, 'bear_adx_thresh': 21.607358633675425, 'bear_atr_min_pct': 0.027427307057236408, 'bear_atr_max_pct': 0.0840650030952219, 'bear_tp_mult': 2.801578377183976, 'bear_tsl_mult': 0.42022172164263927, 'bear_time_stop': 141, 'bear_use_sma': False, 'bear_use_ema': False, 'bear_use_atr': True, 'bear_use_adx': True, 'bear_use_spike': True, 'bear_rsi_required': False, 'sideways_strategy': 'mean_reversion', 'sideways_bb_std_mult': 1.6814602007578037, 'sideways_rsi_os': 30, 'sideways_rsi_ob': 69, 'sideways_adx_thresh': 31.41127925375763, 'sideways_atr_min_pct': 0.006114993630393879, 'sideways_atr_max_pct': 0.09101075332660512, 'sideways_tp_mult': 1.2420106647355498, 'sideways_tsl_mult': 0.9058735523262996, 'sideways_time_stop': 167, 'sideways_use_sma': True, 'sideways_use_ema': False, 'sideways_use_atr': False, 'sideways_use_adx': False, 'sideways_use_spike': True, 'sideways_rsi_required': False}.
