[I 2025-09-01 10:36:00,897] Trial 554 finished with values: [-1000000000.0, 1000000000.0] and parameters: {'p_sma': 17, 'p_std': 49, 'p_atr': 27, 'p_adx': 11, 'rsi_period': 23, 'ema1': 9, 'ema2': 48, 'slip_atr_k': 0.08829416672470414, 'slip_spread_k': 0.5689437876970672, 'spread_hl_frac': 0.03083689079468893, 'bb_std_mult': 2.650500803686055, 'rsi_os': 6, 'rsi_ob': 73, 'vol_spike': 0.037849284967862745, 'adx_thresh': 30.491571379418886, 'atr_min_pct': 0.0111026100005167, 'atr_max_pct': 0.096632679529946, 'tp_mult': 2.5276336037966374, 'tsl_mult': 0.8538997132364309, 'strategy': 'breakout', 'time_stop': 180, 'use_sma': False, 'use_atr': True, 'use_adx': False, 'use_ema': False, 'use_spike': True, 'rsi_required': False, 'edge_k': 0.7256041908430416, 'edge_cap': 0.8930383503029766, 'bull_strategy': 'breakout', 'bull_bb_std_mult': 1.589445128809401, 'bull_rsi_os': 41, 'bull_rsi_ob': 65, 'bull_adx_thresh': 20.532167068815788, 'bull_atr_min_pct': 0.005040283913528147, 'bull_atr_max_pct': 0.10153009752423042, 'bull_tp_mult': 1.5246403966471611, 'bull_tsl_mult': 0.8747167092298651, 'bull_time_stop': 165, 'bull_use_sma': True, 'bull_use_ema': True, 'bull_use_atr': True, 'bull_use_adx': False, 'bull_use_spike': True, 'bull_rsi_required': False, 'bear_strategy': 'breakout', 'bear_bb_std_mult': 2.438882370160853, 'bear_rsi_os': 41, 'bear_rsi_ob': 70, 'bear_adx_thresh': 14.662730647938615, 'bear_atr_min_pct': 0.027913561445353355, 'bear_atr_max_pct': 0.06625294087834357, 'bear_tp_mult': 1.5443524312759067, 'bear_tsl_mult': 0.7118725919873683, 'bear_time_stop': 18, 'bear_use_sma': False, 'bear_use_ema': True, 'bear_use_atr': True, 'bear_use_adx': False, 'bear_use_spike': False, 'bear_rsi_required': False, 'sideways_strategy': 'mean_reversion', 'sideways_bb_std_mult': 2.725367085160063, 'sideways_rsi_os': 35, 'sideways_rsi_ob': 75, 'sideways_adx_thresh': 31.547555913013756, 'sideways_atr_min_pct': 0.0024293262773673477, 'sideways_atr_max_pct': 0.08362490589640308, 'sideways_tp_mult': 1.4638796026134582, 'sideways_tsl_mult': 0.9976250200550401, 'sideways_time_stop': 235, 'sideways_use_sma': False, 'sideways_use_ema': True, 'sideways_use_atr': False, 'sideways_use_adx': False, 'sideways_use_spike': True, 'sideways_rsi_required': False}.
[I 2025-09-01 10:36:02,061] Trial 561 finished with values: [-1000000000.0, 1000000000.0] and parameters: {'p_sma': 56, 'p_std': 49, 'p_atr': 27, 'p_adx': 15, 'rsi_period': 45, 'ema1': 8, 'ema2': 43, 'slip_atr_k': 0.0119645668887799, 'slip_spread_k': 0.5612312621893537, 'spread_hl_frac': 0.009626649686296975, 'bb_std_mult': 2.248912651267717, 'rsi_os': 50, 'rsi_ob': 56, 'vol_spike': 0.19415406500605492, 'adx_thresh': 10.523975893080774, 'atr_min_pct': 0.012589619228714287, 'atr_max_pct': 0.11187021395084173, 'tp_mult': 2.547143852326178, 'tsl_mult': 0.8168073498671551, 'strategy': 'mean_reversion', 'time_stop': 166, 'use_sma': True, 'use_atr': True, 'use_adx': False, 'use_ema': False, 'use_spike': False, 'rsi_required': False, 'edge_k': 0.5358186415650669, 'edge_cap': 0.8266441054375417, 'bull_strategy': 'mean_reversion', 'bull_bb_std_mult': 3.598188251070622, 'bull_rsi_os': 50, 'bull_rsi_ob': 89, 'bull_adx_thresh': 28.06925284377736, 'bull_atr_min_pct': 0.006593269118684075, 'bull_atr_max_pct': 0.08076986858504578, 'bull_tp_mult': 2.618821083717709, 'bull_tsl_mult': 0.8506283055494126, 'bull_time_stop': 258, 'bull_use_sma': True, 'bull_use_ema': False, 'bull_use_atr': True, 'bull_use_adx': False, 'bull_use_spike': True, 'bull_rsi_required': False, 'bear_strategy': 'breakout', 'bear_bb_std_mult': 0.9465099320327959, 'bear_rsi_os': 45, 'bear_rsi_ob': 72, 'bear_adx_thresh': 34.18497160495537, 'bear_atr_min_pct': 0.029973646681021884, 'bear_atr_max_pct': 0.03344885139837794, 'bear_tp_mult': 1.9927576309059147, 'bear_tsl_mult': 0.797917434604068, 'bear_time_stop': 12, 'bear_use_sma': True, 'bear_use_ema': False, 'bear_use_atr': True, 'bear_use_adx': True, 'bear_use_spike': True, 'bear_rsi_required': False, 'sideways_strategy': 'breakout', 'sideways_bb_std_mult': 2.4783635399450126, 'sideways_rsi_os': 27, 'sideways_rsi_ob': 93, 'sideways_adx_thresh': 31.991433772972183, 'sideways_atr_min_pct': 0.0022379293438601253, 'sideways_atr_max_pct': 0.13304837946383094, 'sideways_tp_mult': 1.3754739765499646, 'sideways_tsl_mult': 0.9504115639946558, 'sideways_time_stop': 109, 'sideways_use_sma': True, 'sideways_use_ema': False, 'sideways_use_atr': False, 'sideways_use_adx': False, 'sideways_use_spike': False, 'sideways_rsi_required': False}.
[I 2025-09-01 10:36:41,202] Trial 562 finished with values: [-0.014868341347062608, 0.015189530468623735] and parameters: {'p_sma': 56, 'p_std': 45, 'p_atr': 27, 'p_adx': 9, 'rsi_period': 44, 'ema1': 8, 'ema2': 27, 'slip_atr_k': 0.11727173335088603, 'slip_spread_k': 0.5896156980817976, 'spread_hl_frac': 0.009760098342915715, 'bb_std_mult': 2.2650517950387425, 'rsi_os': 8, 'rsi_ob': 56, 'vol_spike': 0.26678919287968594, 'adx_thresh': 10.505711387643261, 'atr_min_pct': 0.029877033055927378, 'atr_max_pct': 0.12439144003556031, 'tp_mult': 2.5586485649103134, 'tsl_mult': 0.811792522609776, 'strategy': 'mean_reversion', 'time_stop': 243, 'use_sma': True, 'use_atr': True, 'use_adx': True, 'use_ema': False, 'use_spike': False, 'rsi_required': False, 'edge_k': 0.5404340761654943, 'edge_cap': 0.8253196431058134, 'bull_strategy': 'mean_reversion', 'bull_bb_std_mult': 2.6481424017496473, 'bull_rsi_os': 47, 'bull_rsi_ob': 81, 'bull_adx_thresh': 28.070683777302392, 'bull_atr_min_pct': 0.0027412501190295494, 'bull_atr_max_pct': 0.046135182173885715, 'bull_tp_mult': 1.5682661932273794, 'bull_tsl_mult': 0.8084097289134572, 'bull_time_stop': 138, 'bull_use_sma': False, 'bull_use_ema': False, 'bull_use_atr': True, 'bull_use_adx': True, 'bull_use_spike': True, 'bull_rsi_required': False, 'bear_strategy': 'breakout', 'bear_bb_std_mult': 0.8164722997793357, 'bear_rsi_os': 46, 'bear_rsi_ob': 72, 'bear_adx_thresh': 34.94747282388177, 'bear_atr_min_pct': 0.017106571546759805, 'bear_atr_max_pct': 0.05547765761864188, 'bear_tp_mult': 2.420764742145855, 'bear_tsl_mult': 0.38168640553096356, 'bear_time_stop': 11, 'bear_use_sma': True, 'bear_use_ema': False, 'bear_use_atr': True, 'bear_use_adx': True, 'bear_use_spike': True, 'bear_rsi_required': True, 'sideways_strategy': 'breakout', 'sideways_bb_std_mult': 1.976075578504989, 'sideways_rsi_os': 37, 'sideways_rsi_ob': 61, 'sideways_adx_thresh': 17.303915492176536, 'sideways_atr_min_pct': 0.003106795206593365, 'sideways_atr_max_pct': 0.11990264403943257, 'sideways_tp_mult': 1.396227985145737, 'sideways_tsl_mult': 0.07190911205978573, 'sideways_time_stop': 145, 'sideways_use_sma': True, 'sideways_use_ema': False, 'sideways_use_atr': False, 'sideways_use_adx': False, 'sideways_use_spike': False, 'sideways_rsi_required': False}.
[I 2025-09-01 10:36:42,900] Trial 560 finished with values: [-1000000000.0, 1000000000.0] and parameters: {'p_sma': 56, 'p_std': 45, 'p_atr': 27, 'p_adx': 27, 'rsi_period': 44, 'ema1': 8, 'ema2': 26, 'slip_atr_k': 0.01922821509566606, 'slip_spread_k': 0.9403865613533808, 'spread_hl_frac': 0.0312067013392487, 'bb_std_mult': 2.7899989676596704, 'rsi_os': 7, 'rsi_ob': 56, 'vol_spike': 0.19445929528086608, 'adx_thresh': 31.134806802259387, 'atr_min_pct': 0.019916820447669712, 'atr_max_pct': 0.0696742580414827, 'tp_mult': 2.5628250707236218, 'tsl_mult': 0.8140929588793273, 'strategy': 'mean_reversion', 'time_stop': 126, 'use_sma': True, 'use_atr': True, 'use_adx': False, 'use_ema': False, 'use_spike': False, 'rsi_required': False, 'edge_k': 0.5498919699503159, 'edge_cap': 0.8189968698650665, 'bull_strategy': 'mean_reversion', 'bull_bb_std_mult': 3.486358845285906, 'bull_rsi_os': 48, 'bull_rsi_ob': 81, 'bull_adx_thresh': 27.022801986023712, 'bull_atr_min_pct': 0.011795929630899314, 'bull_atr_max_pct': 0.04678293420918157, 'bull_tp_mult': 1.617761760718013, 'bull_tsl_mult': 0.8652038488485672, 'bull_time_stop': 140, 'bull_use_sma': True, 'bull_use_ema': False, 'bull_use_atr': True, 'bull_use_adx': False, 'bull_use_spike': True, 'bull_rsi_required': True, 'bear_strategy': 'breakout', 'bear_bb_std_mult': 0.8163888912955659, 'bear_rsi_os': 55, 'bear_rsi_ob': 49, 'bear_adx_thresh': 8.281081658697689, 'bear_atr_min_pct': 0.009835241005881588, 'bear_atr_max_pct': 0.12519904174293273, 'bear_tp_mult': 2.232046125187224, 'bear_tsl_mult': 0.6954012445481904, 'bear_time_stop': 5, 'bear_use_sma': False, 'bear_use_ema': True, 'bear_use_atr': True, 'bear_use_adx': True, 'bear_use_spike': True, 'bear_rsi_required': False, 'sideways_strategy': 'breakout', 'sideways_bb_std_mult': 1.0637876174090963, 'sideways_rsi_os': 46, 'sideways_rsi_ob': 57, 'sideways_adx_thresh': 17.269694700873593, 'sideways_atr_min_pct': 0.011251324766537191, 'sideways_atr_max_pct': 0.10289369190262015, 'sideways_tp_mult': 1.392642040710456, 'sideways_tsl_mult': 0.9577907316649362, 'sideways_time_stop': 225, 'sideways_use_sma': True, 'sideways_use_ema': False, 'sideways_use_atr': False, 'sideways_use_adx': False, 'sideways_use_spike': True, 'sideways_rsi_required': False}.
[I 2025-09-01 10:36:44,375] Trial 559 finished with values: [-0.03895073285213513, 0.039009599855829975] and parameters: {'p_sma': 56, 'p_std': 45, 'p_atr': 27, 'p_adx': 15, 'rsi_period': 44, 'ema1': 8, 'ema2': 11, 'slip_atr_k': 0.21496212648851346, 'slip_spread_k': 0.5635088378083559, 'spread_hl_frac': 0.01778505685047709, 'bb_std_mult': 1.4563196972682786, 'rsi_os': 7, 'rsi_ob': 62, 'vol_spike': 0.19329261071345671, 'adx_thresh': 31.07998433971242, 'atr_min_pct': 0.01995834175146509, 'atr_max_pct': 0.03915112850060028, 'tp_mult': 2.537322275401372, 'tsl_mult': 0.8114690765298965, 'strategy': 'mean_reversion', 'time_stop': 149, 'use_sma': True, 'use_atr': True, 'use_adx': False, 'use_ema': False, 'use_spike': False, 'rsi_required': False, 'edge_k': 0.5274085536692998, 'edge_cap': 0.8136103377911362, 'bull_strategy': 'mean_reversion', 'bull_bb_std_mult': 3.4870234312854738, 'bull_rsi_os': 5, 'bull_rsi_ob': 74, 'bull_adx_thresh': 23.371961489510145, 'bull_atr_min_pct': 0.011614498313754528, 'bull_atr_max_pct': 0.08009148518474331, 'bull_tp_mult': 1.6043413620386016, 'bull_tsl_mult': 0.3847768589409274, 'bull_time_stop': 100, 'bull_use_sma': True, 'bull_use_ema': False, 'bull_use_atr': True, 'bull_use_adx': False, 'bull_use_spike': True, 'bull_rsi_required': True, 'bear_strategy': 'breakout', 'bear_bb_std_mult': 1.4809620729944601, 'bear_rsi_os': 45, 'bear_rsi_ob': 49, 'bear_adx_thresh': 33.49769677235635, 'bear_atr_min_pct': 0.02756874064662526, 'bear_atr_max_pct': 0.1250235155809471, 'bear_tp_mult': 2.4380647265438173, 'bear_tsl_mult': 0.6896754155952273, 'bear_time_stop': 22, 'bear_use_sma': False, 'bear_use_ema': True, 'bear_use_atr': True, 'bear_use_adx': True, 'bear_use_spike': True, 'bear_rsi_required': False, 'sideways_strategy': 'breakout', 'sideways_bb_std_mult': 1.0447050195783125, 'sideways_rsi_os': 27, 'sideways_rsi_ob': 57, 'sideways_adx_thresh': 12.784067029733095, 'sideways_atr_min_pct': 0.0021688363779104897, 'sideways_atr_max_pct': 0.10650312798573018, 'sideways_tp_mult': 1.3835158437597848, 'sideways_tsl_mult': 0.9602854675430381, 'sideways_time_stop': 40, 'sideways_use_sma': True, 'sideways_use_ema': False, 'sideways_use_atr': False, 'sideways_use_adx': False, 'sideways_use_spike': True, 'sideways_rsi_required': False}.
[I 2025-09-01 10:36:45,117] Trial 563 finished with values: [-1000000000.0, 1000000000.0] and parameters: {'p_sma': 57, 'p_std': 45, 'p_atr': 29, 'p_adx': 9, 'rsi_period': 43, 'ema1': 8, 'ema2': 11, 'slip_atr_k': 0.12865572067038203, 'slip_spread_k': 0.17296813814684925, 'spread_hl_frac': 0.04685529051264836, 'bb_std_mult': 1.0306147412909634, 'rsi_os': 8, 'rsi_ob': 84, 'vol_spike': 0.2456919577639033, 'adx_thresh': 31.19707464868516, 'atr_min_pct': 0.007691896065427157, 'atr_max_pct': 0.039436317283276734, 'tp_mult': 2.1872571858269336, 'tsl_mult': 0.7941745218732155, 'strategy': 'mean_reversion', 'time_stop': 6, 'use_sma': True, 'use_atr': True, 'use_adx': True, 'use_ema': False, 'use_spike': False, 'rsi_required': False, 'edge_k': 0.6470209024279387, 'edge_cap': 0.8490208207759121, 'bull_strategy': 'mean_reversion', 'bull_bb_std_mult': 1.012021055733791, 'bull_rsi_os': 37, 'bull_rsi_ob': 81, 'bull_adx_thresh': 7.426009395223785, 'bull_atr_min_pct': 0.02202602557898128, 'bull_atr_max_pct': 0.07720200231712293, 'bull_tp_mult': 2.9230428622762665, 'bull_tsl_mult': 0.9120504154241873, 'bull_time_stop': 139, 'bull_use_sma': False, 'bull_use_ema': False, 'bull_use_atr': True, 'bull_use_adx': True, 'bull_use_spike': True, 'bull_rsi_required': True, 'bear_strategy': 'breakout', 'bear_bb_std_mult': 1.4803512962836263, 'bear_rsi_os': 46, 'bear_rsi_ob': 71, 'bear_adx_thresh': 34.65686964177171, 'bear_atr_min_pct': 0.017094505482826237, 'bear_atr_max_pct': 0.1292643671164027, 'bear_tp_mult': 1.7846001685409487, 'bear_tsl_mult': 0.36871850445750365, 'bear_time_stop': 5, 'bear_use_sma': False, 'bear_use_ema': True, 'bear_use_atr': True, 'bear_use_adx': True, 'bear_use_spike': True, 'bear_rsi_required': True, 'sideways_strategy': 'mean_reversion', 'sideways_bb_std_mult': 2.41954877997315, 'sideways_rsi_os': 33, 'sideways_rsi_ob': 61, 'sideways_adx_thresh': 30.21188138737349, 'sideways_atr_min_pct': 0.003227632236140786, 'sideways_atr_max_pct': 0.09292999013914977, 'sideways_tp_mult': 1.4107125388373225, 'sideways_tsl_mult': 0.2559797251619471, 'sideways_time_stop': 226, 'sideways_use_sma': True, 'sideways_use_ema': False, 'sideways_use_atr': False, 'sideways_use_adx': False, 'sideways_use_spike': True, 'sideways_rsi_required': False}.
[I 2025-09-01 10:37:30,826] Trial 566 finished with values: [-1000000000.0, 1000000000.0] and parameters: {'p_sma': 59, 'p_std': 41, 'p_atr': 22, 'p_adx': 20, 'rsi_period': 26, 'ema1': 10, 'ema2': 13, 'slip_atr_k': 0.012482176419565857, 'slip_spread_k': 0.5182684243492115, 'spread_hl_frac': 0.006721325785258772, 'bb_std_mult': 2.0895486399868552, 'rsi_os': 21, 'rsi_ob': 68, 'vol_spike': 0.20110255128511292, 'adx_thresh': 11.507906667039245, 'atr_min_pct': 0.02085122224962759, 'atr_max_pct': 0.1167232349511419, 'tp_mult': 2.6105967906525853, 'tsl_mult': 0.09613983065316917, 'strategy': 'breakout', 'time_stop': 219, 'use_sma': True, 'use_atr': True, 'use_adx': True, 'use_ema': False, 'use_spike': True, 'rsi_required': False, 'edge_k': 0.6167081607129665, 'edge_cap': 0.6528559657733919, 'bull_strategy': 'mean_reversion', 'bull_bb_std_mult': 3.4127413200657806, 'bull_rsi_os': 38, 'bull_rsi_ob': 87, 'bull_adx_thresh': 29.11208817957961, 'bull_atr_min_pct': 0.022040155254265767, 'bull_atr_max_pct': 0.14624944961305086, 'bull_tp_mult': 1.224552019269626, 'bull_tsl_mult': 0.9515123188231227, 'bull_time_stop': 201, 'bull_use_sma': False, 'bull_use_ema': False, 'bull_use_atr': True, 'bull_use_adx': True, 'bull_use_spike': False, 'bull_rsi_required': False, 'bear_strategy': 'mean_reversion', 'bear_bb_std_mult': 1.4355931647917048, 'bear_rsi_os': 43, 'bear_rsi_ob': 95, 'bear_adx_thresh': 23.487712090817908, 'bear_atr_min_pct': 0.02474861816541588, 'bear_atr_max_pct': 0.08028433288153458, 'bear_tp_mult': 2.5445477250436928, 'bear_tsl_mult': 0.8492501033061483, 'bear_time_stop': 252, 'bear_use_sma': False, 'bear_use_ema': True, 'bear_use_atr': True, 'bear_use_adx': True, 'bear_use_spike': True, 'bear_rsi_required': True, 'sideways_strategy': 'mean_reversion', 'sideways_bb_std_mult': 2.594790043585721, 'sideways_rsi_os': 22, 'sideways_rsi_ob': 54, 'sideways_adx_thresh': 28.062359713711114, 'sideways_atr_min_pct': 0.004176375811718737, 'sideways_atr_max_pct': 0.0893750663808852, 'sideways_tp_mult': 2.125792074374106, 'sideways_tsl_mult': 0.12009717009558152, 'sideways_time_stop': 200, 'sideways_use_sma': True, 'sideways_use_ema': False, 'sideways_use_atr': True, 'sideways_use_adx': True, 'sideways_use_spike': True, 'sideways_rsi_required': False}.
[I 2025-09-01 10:37:32,229] Trial 565 finished with values: [-1000000000.0, 1000000000.0] and parameters: {'p_sma': 59, 'p_std': 41, 'p_atr': 29, 'p_adx': 25, 'rsi_period': 37, 'ema1': 8, 'ema2': 11, 'slip_atr_k': 0.04138644245602657, 'slip_spread_k': 0.5354314949305811, 'spread_hl_frac': 0.01787170780393575, 'bb_std_mult': 2.5516202118269176, 'rsi_os': 9, 'rsi_ob': 48, 'vol_spike': 0.012508662123033504, 'adx_thresh': 11.412237863797433, 'atr_min_pct': 0.022907583396841454, 'atr_max_pct': 0.10108576808794599, 'tp_mult': 2.6579687662804323, 'tsl_mult': 0.9816154396390878, 'strategy': 'breakout', 'time_stop': 217, 'use_sma': True, 'use_atr': True, 'use_adx': False, 'use_ema': False, 'use_spike': True, 'rsi_required': False, 'edge_k': 0.6184897902830442, 'edge_cap': 0.6556770306070383, 'bull_strategy': 'mean_reversion', 'bull_bb_std_mult': 3.4159906632484662, 'bull_rsi_os': 37, 'bull_rsi_ob': 80, 'bull_adx_thresh': 28.863203025948422, 'bull_atr_min_pct': 0.018882720810958504, 'bull_atr_max_pct': 0.05071176714393864, 'bull_tp_mult': 1.5819030497954814, 'bull_tsl_mult': 0.43030985470835237, 'bull_time_stop': 215, 'bull_use_sma': True, 'bull_use_ema': False, 'bull_use_atr': True, 'bull_use_adx': True, 'bull_use_spike': True, 'bull_rsi_required': False, 'bear_strategy': 'mean_reversion', 'bear_bb_std_mult': 1.4735501188885258, 'bear_rsi_os': 43, 'bear_rsi_ob': 71, 'bear_adx_thresh': 33.50692293783822, 'bear_atr_min_pct': 0.028840831067035017, 'bear_atr_max_pct': 0.1293905197185162, 'bear_tp_mult': 1.7877134773501215, 'bear_tsl_mult': 0.848174219070655, 'bear_time_stop': 26, 'bear_use_sma': False, 'bear_use_ema': True, 'bear_use_atr': True, 'bear_use_adx': True, 'bear_use_spike': True, 'bear_rsi_required': False, 'sideways_strategy': 'mean_reversion', 'sideways_bb_std_mult': 2.606627584169161, 'sideways_rsi_os': 31, 'sideways_rsi_ob': 89, 'sideways_adx_thresh': 12.600344587799576, 'sideways_atr_min_pct': 0.0036459552594483276, 'sideways_atr_max_pct': 0.04899544070157672, 'sideways_tp_mult': 1.2695490544504957, 'sideways_tsl_mult': 0.9358921342990912, 'sideways_time_stop': 48, 'sideways_use_sma': True, 'sideways_use_ema': False, 'sideways_use_atr': False, 'sideways_use_adx': True, 'sideways_use_spike': True, 'sideways_rsi_required': False}.
[I 2025-09-01 10:37:33,801] Trial 564 finished with values: [-1000000000.0, 1000000000.0] and parameters: {'p_sma': 59, 'p_std': 45, 'p_atr': 29, 'p_adx': 26, 'rsi_period': 82, 'ema1': 14, 'ema2': 11, 'slip_atr_k': 0.21521607926259648, 'slip_spread_k': 0.26368427523592813, 'spread_hl_frac': 0.03561286591424748, 'bb_std_mult': 1.8816028467566854, 'rsi_os': 21, 'rsi_ob': 81, 'vol_spike': 0.19735220863890712, 'adx_thresh': 11.416596193941796, 'atr_min_pct': 0.01989440543493054, 'atr_max_pct': 0.06930469282098542, 'tp_mult': 2.7511262742426714, 'tsl_mult': 0.09616525086654643, 'strategy': 'breakout', 'time_stop': 98, 'use_sma': True, 'use_atr': True, 'use_adx': False, 'use_ema': False, 'use_spike': True, 'rsi_required': False, 'edge_k': 0.6226341565659783, 'edge_cap': 0.8758001176644843, 'bull_strategy': 'mean_reversion', 'bull_bb_std_mult': 1.7986140153519603, 'bull_rsi_os': 23, 'bull_rsi_ob': 74, 'bull_adx_thresh': 27.121866774855885, 'bull_atr_min_pct': 0.005763685639591495, 'bull_atr_max_pct': 0.05214134226310577, 'bull_tp_mult': 1.2305557573877737, 'bull_tsl_mult': 0.3824541151518631, 'bull_time_stop': 102, 'bull_use_sma': True, 'bull_use_ema': False, 'bull_use_atr': True, 'bull_use_adx': False, 'bull_use_spike': True, 'bull_rsi_required': True, 'bear_strategy': 'breakout', 'bear_bb_std_mult': 3.4811852487621264, 'bear_rsi_os': 28, 'bear_rsi_ob': 78, 'bear_adx_thresh': 33.994817083878736, 'bear_atr_min_pct': 0.0024522312084887515, 'bear_atr_max_pct': 0.1294489248659202, 'bear_tp_mult': 2.8416583782680616, 'bear_tsl_mult': 0.7483013205764955, 'bear_time_stop': 82, 'bear_use_sma': False, 'bear_use_ema': True, 'bear_use_atr': True, 'bear_use_adx': True, 'bear_use_spike': True, 'bear_rsi_required': False, 'sideways_strategy': 'mean_reversion', 'sideways_bb_std_mult': 0.6136893314934386, 'sideways_rsi_os': 32, 'sideways_rsi_ob': 62, 'sideways_adx_thresh': 12.562159459780954, 'sideways_atr_min_pct': 0.0039606256782472715, 'sideways_atr_max_pct': 0.09291318167486641, 'sideways_tp_mult': 2.7331132208396194, 'sideways_tsl_mult': 0.9572460539768112, 'sideways_time_stop': 223, 'sideways_use_sma': True, 'sideways_use_ema': False, 'sideways_use_atr': False, 'sideways_use_adx': False, 'sideways_use_spike': True, 'sideways_rsi_required': False}.
