[I 2025-09-01 10:05:25,484] Trial 380 finished with values: [-1000000000.0, 1000000000.0] and parameters: {'p_sma': 28, 'p_std': 46, 'p_atr': 25, 'p_adx': 10, 'rsi_period': 48, 'ema1': 20, 'ema2': 10, 'slip_atr_k': 0.01097769180473816, 'slip_spread_k': 0.45106152109759684, 'spread_hl_frac': 0.04302060695816329, 'bb_std_mult': 2.5137553461162563, 'rsi_os': 8, 'rsi_ob': 87, 'vol_spike': 0.20952810028911698, 'adx_thresh': 11.920285076095732, 'atr_min_pct': 0.020137697528259516, 'atr_max_pct': 0.06254247707259646, 'tp_mult': 2.5958104725417495, 'tsl_mult': 0.14712064156904697, 'strategy': 'breakout', 'time_stop': 165, 'use_sma': True, 'use_atr': False, 'use_adx': False, 'use_ema': False, 'use_spike': True, 'rsi_required': False, 'edge_k': 0.5905969831374713, 'edge_cap': 0.7905507173898124, 'bull_strategy': 'mean_reversion', 'bull_bb_std_mult': 1.5376834469718403, 'bull_rsi_os': 40, 'bull_rsi_ob': 76, 'bull_adx_thresh': 31.957843194149433, 'bull_atr_min_pct': 0.021073665799499798, 'bull_atr_max_pct': 0.12691270216087397, 'bull_tp_mult': 2.165287313484038, 'bull_tsl_mult': 0.9502910283976009, 'bull_time_stop': 40, 'bull_use_sma': True, 'bull_use_ema': False, 'bull_use_atr': True, 'bull_use_adx': True, 'bull_use_spike': True, 'bull_rsi_required': False, 'bear_strategy': 'breakout', 'bear_bb_std_mult': 1.4648120519613594, 'bear_rsi_os': 7, 'bear_rsi_ob': 95, 'bear_adx_thresh': 25.65505572319201, 'bear_atr_min_pct': 0.028773767906219612, 'bear_atr_max_pct': 0.02652517055997928, 'bear_tp_mult': 2.919039838341153, 'bear_tsl_mult': 0.42288637185256883, 'bear_time_stop': 158, 'bear_use_sma': False, 'bear_use_ema': True, 'bear_use_atr': True, 'bear_use_adx': True, 'bear_use_spike': True, 'bear_rsi_required': False, 'sideways_strategy': 'breakout', 'sideways_bb_std_mult': 1.082732434228421, 'sideways_rsi_os': 32, 'sideways_rsi_ob': 58, 'sideways_adx_thresh': 32.07117841774568, 'sideways_atr_min_pct': 0.012111776043457131, 'sideways_atr_max_pct': 0.04606104773732216, 'sideways_tp_mult': 1.3053865333478998, 'sideways_tsl_mult': 0.9154338326097907, 'sideways_time_stop': 220, 'sideways_use_sma': True, 'sideways_use_ema': False, 'sideways_use_atr': False, 'sideways_use_adx': True, 'sideways_use_spike': True, 'sideways_rsi_required': False}.
[I 2025-09-01 10:05:26,144] Trial 377 finished with values: [-0.011001652146539476, 0.010745640040305636] and parameters: {'p_sma': 48, 'p_std': 16, 'p_atr': 13, 'p_adx': 11, 'rsi_period': 44, 'ema1': 25, 'ema2': 10, 'slip_atr_k': 0.06768531538062383, 'slip_spread_k': 0.4367976281475282, 'spread_hl_frac': 0.007190853776100045, 'bb_std_mult': 3.084466250518845, 'rsi_os': 8, 'rsi_ob': 53, 'vol_spike': 0.20698395624309768, 'adx_thresh': 32.61686937504999, 'atr_min_pct': 0.0026456803884120812, 'atr_max_pct': 0.13105948960379843, 'tp_mult': 1.0158553433418915, 'tsl_mult': 0.879636855437521, 'strategy': 'breakout', 'time_stop': 133, 'use_sma': True, 'use_atr': True, 'use_adx': True, 'use_ema': False, 'use_spike': True, 'rsi_required': False, 'edge_k': 0.22156867839528238, 'edge_cap': 0.7003006051461719, 'bull_strategy': 'mean_reversion', 'bull_bb_std_mult': 3.379147669495426, 'bull_rsi_os': 10, 'bull_rsi_ob': 75, 'bull_adx_thresh': 8.751861843298324, 'bull_atr_min_pct': 0.003792131896515954, 'bull_atr_max_pct': 0.08378115508759494, 'bull_tp_mult': 1.9890943420191927, 'bull_tsl_mult': 0.9724157670637823, 'bull_time_stop': 146, 'bull_use_sma': False, 'bull_use_ema': False, 'bull_use_atr': True, 'bull_use_adx': False, 'bull_use_spike': True, 'bull_rsi_required': True, 'bear_strategy': 'breakout', 'bear_bb_std_mult': 3.3476710225475452, 'bear_rsi_os': 7, 'bear_rsi_ob': 71, 'bear_adx_thresh': 33.85568308962576, 'bear_atr_min_pct': 0.029098229742527865, 'bear_atr_max_pct': 0.11437585254784322, 'bear_tp_mult': 2.789065827404369, 'bear_tsl_mult': 0.8036690581295984, 'bear_time_stop': 5, 'bear_use_sma': False, 'bear_use_ema': True, 'bear_use_atr': True, 'bear_use_adx': True, 'bear_use_spike': True, 'bear_rsi_required': False, 'sideways_strategy': 'mean_reversion', 'sideways_bb_std_mult': 3.0252568756037226, 'sideways_rsi_os': 29, 'sideways_rsi_ob': 62, 'sideways_adx_thresh': 17.61680361936465, 'sideways_atr_min_pct': 0.013192327340660982, 'sideways_atr_max_pct': 0.08206861511070773, 'sideways_tp_mult': 1.0813191696904778, 'sideways_tsl_mult': 0.9210024096051234, 'sideways_time_stop': 249, 'sideways_use_sma': True, 'sideways_use_ema': False, 'sideways_use_atr': True, 'sideways_use_adx': False, 'sideways_use_spike': True, 'sideways_rsi_required': False}.
[I 2025-09-01 10:05:26,505] Trial 378 finished with values: [-0.05859313354534934, 0.05850674876901372] and parameters: {'p_sma': 48, 'p_std': 33, 'p_atr': 13, 'p_adx': 27, 'rsi_period': 34, 'ema1': 9, 'ema2': 41, 'slip_atr_k': 0.10059809149422975, 'slip_spread_k': 0.44370479506308735, 'spread_hl_frac': 0.02291305753309595, 'bb_std_mult': 3.111048240653353, 'rsi_os': 8, 'rsi_ob': 47, 'vol_spike': 0.02197462649846818, 'adx_thresh': 13.966893765383464, 'atr_min_pct': 0.0029296201940892386, 'atr_max_pct': 0.13132644411613195, 'tp_mult': 2.569475671356136, 'tsl_mult': 0.14728373033787662, 'strategy': 'breakout', 'time_stop': 162, 'use_sma': True, 'use_atr': True, 'use_adx': False, 'use_ema': False, 'use_spike': True, 'rsi_required': False, 'edge_k': 1.826542054698608, 'edge_cap': 0.6989088595045985, 'bull_strategy': 'mean_reversion', 'bull_bb_std_mult': 3.4541835966115544, 'bull_rsi_os': 15, 'bull_rsi_ob': 76, 'bull_adx_thresh': 12.887758957812022, 'bull_atr_min_pct': 0.023648662167634504, 'bull_atr_max_pct': 0.06923702917236721, 'bull_tp_mult': 1.3944105347975144, 'bull_tsl_mult': 0.6798806607137177, 'bull_time_stop': 42, 'bull_use_sma': True, 'bull_use_ema': False, 'bull_use_atr': True, 'bull_use_adx': False, 'bull_use_spike': True, 'bull_rsi_required': False, 'bear_strategy': 'breakout', 'bear_bb_std_mult': 0.5668232482902205, 'bear_rsi_os': 5, 'bear_rsi_ob': 75, 'bear_adx_thresh': 21.92140851277586, 'bear_atr_min_pct': 0.029013180655178824, 'bear_atr_max_pct': 0.0502868822314263, 'bear_tp_mult': 2.78854732009947, 'bear_tsl_mult': 0.24941205540805755, 'bear_time_stop': 5, 'bear_use_sma': False, 'bear_use_ema': True, 'bear_use_atr': True, 'bear_use_adx': True, 'bear_use_spike': True, 'bear_rsi_required': False, 'sideways_strategy': 'breakout', 'sideways_bb_std_mult': 2.3470625066032778, 'sideways_rsi_os': 32, 'sideways_rsi_ob': 58, 'sideways_adx_thresh': 7.929025658713115, 'sideways_atr_min_pct': 0.002028672128953117, 'sideways_atr_max_pct': 0.08201391555919044, 'sideways_tp_mult': 1.303236006210971, 'sideways_tsl_mult': 0.9624455268624396, 'sideways_time_stop': 220, 'sideways_use_sma': True, 'sideways_use_ema': False, 'sideways_use_atr': False, 'sideways_use_adx': True, 'sideways_use_spike': True, 'sideways_rsi_required': False}.
[I 2025-09-01 10:06:08,461] Trial 381 finished with values: [-1000000000.0, 1000000000.0] and parameters: {'p_sma': 39, 'p_std': 60, 'p_atr': 11, 'p_adx': 10, 'rsi_period': 67, 'ema1': 19, 'ema2': 10, 'slip_atr_k': 0.00952247731385894, 'slip_spread_k': 0.5512232340480704, 'spread_hl_frac': 0.04047773043966547, 'bb_std_mult': 1.6459925606091792, 'rsi_os': 12, 'rsi_ob': 55, 'vol_spike': 0.2900210609183711, 'adx_thresh': 13.995776926885775, 'atr_min_pct': 0.002627513232275962, 'atr_max_pct': 0.07611412398886853, 'tp_mult': 1.3942715994327204, 'tsl_mult': 0.5693463099193049, 'strategy': 'breakout', 'time_stop': 159, 'use_sma': True, 'use_atr': True, 'use_adx': False, 'use_ema': False, 'use_spike': True, 'rsi_required': True, 'edge_k': 0.09533813030614213, 'edge_cap': 0.7874827460105863, 'bull_strategy': 'mean_reversion', 'bull_bb_std_mult': 3.0781457501061857, 'bull_rsi_os': 10, 'bull_rsi_ob': 79, 'bull_adx_thresh': 28.98238678561124, 'bull_atr_min_pct': 0.023182407606483622, 'bull_atr_max_pct': 0.12702111021432128, 'bull_tp_mult': 1.7754988398445126, 'bull_tsl_mult': 0.6764015051601212, 'bull_time_stop': 103, 'bull_use_sma': True, 'bull_use_ema': False, 'bull_use_atr': False, 'bull_use_adx': False, 'bull_use_spike': True, 'bull_rsi_required': False, 'bear_strategy': 'mean_reversion', 'bear_bb_std_mult': 1.5030471156508225, 'bear_rsi_os': 42, 'bear_rsi_ob': 72, 'bear_adx_thresh': 32.60262415922354, 'bear_atr_min_pct': 0.028746363051706178, 'bear_atr_max_pct': 0.023178419510217617, 'bear_tp_mult': 2.440199094938964, 'bear_tsl_mult': 0.2566344426934086, 'bear_time_stop': 5, 'bear_use_sma': False, 'bear_use_ema': True, 'bear_use_atr': True, 'bear_use_adx': True, 'bear_use_spike': True, 'bear_rsi_required': True, 'sideways_strategy': 'mean_reversion', 'sideways_bb_std_mult': 1.0680536940355898, 'sideways_rsi_os': 31, 'sideways_rsi_ob': 58, 'sideways_adx_thresh': 33.83077378203387, 'sideways_atr_min_pct': 0.0286210047028528, 'sideways_atr_max_pct': 0.11593292164261412, 'sideways_tp_mult': 1.6726948516990239, 'sideways_tsl_mult': 0.9534985386361257, 'sideways_time_stop': 250, 'sideways_use_sma': True, 'sideways_use_ema': False, 'sideways_use_atr': False, 'sideways_use_adx': False, 'sideways_use_spike': True, 'sideways_rsi_required': True}.
[I 2025-09-01 10:06:09,650] Trial 383 finished with values: [-1000000000.0, 1000000000.0] and parameters: {'p_sma': 51, 'p_std': 33, 'p_atr': 28, 'p_adx': 12, 'rsi_period': 7, 'ema1': 9, 'ema2': 34, 'slip_atr_k': 0.10031866067668607, 'slip_spread_k': 0.5503840265500567, 'spread_hl_frac': 0.006160446893026961, 'bb_std_mult': 2.6133415424042785, 'rsi_os': 30, 'rsi_ob': 55, 'vol_spike': 0.1883837510936753, 'adx_thresh': 13.974722277398055, 'atr_min_pct': 0.024289545257109933, 'atr_max_pct': 0.07680845635911067, 'tp_mult': 2.57784769077888, 'tsl_mult': 0.847697066433099, 'strategy': 'breakout', 'time_stop': 29, 'use_sma': False, 'use_atr': True, 'use_adx': False, 'use_ema': True, 'use_spike': True, 'rsi_required': True, 'edge_k': 1.9361419550301067, 'edge_cap': 0.9093479403157793, 'bull_strategy': 'mean_reversion', 'bull_bb_std_mult': 3.1119287593206133, 'bull_rsi_os': 37, 'bull_rsi_ob': 79, 'bull_adx_thresh': 28.62422876959555, 'bull_atr_min_pct': 0.01001317620814723, 'bull_atr_max_pct': 0.08884308100612522, 'bull_tp_mult': 1.7647271722039668, 'bull_tsl_mult': 0.9289803836137431, 'bull_time_stop': 76, 'bull_use_sma': True, 'bull_use_ema': False, 'bull_use_atr': False, 'bull_use_adx': False, 'bull_use_spike': False, 'bull_rsi_required': False, 'bear_strategy': 'mean_reversion', 'bear_bb_std_mult': 1.3769451109460826, 'bear_rsi_os': 15, 'bear_rsi_ob': 72, 'bear_adx_thresh': 32.69608616296516, 'bear_atr_min_pct': 0.028613664006074558, 'bear_atr_max_pct': 0.0309476229935405, 'bear_tp_mult': 2.894463520217399, 'bear_tsl_mult': 0.7456961459502787, 'bear_time_stop': 21, 'bear_use_sma': False, 'bear_use_ema': False, 'bear_use_atr': True, 'bear_use_adx': False, 'bear_use_spike': True, 'bear_rsi_required': True, 'sideways_strategy': 'mean_reversion', 'sideways_bb_std_mult': 2.3604629880604646, 'sideways_rsi_os': 31, 'sideways_rsi_ob': 65, 'sideways_adx_thresh': 33.80624782306018, 'sideways_atr_min_pct': 0.003367950830331844, 'sideways_atr_max_pct': 0.0888201308802706, 'sideways_tp_mult': 1.8520285343575837, 'sideways_tsl_mult': 0.9583181362038817, 'sideways_time_stop': 107, 'sideways_use_sma': True, 'sideways_use_ema': True, 'sideways_use_atr': False, 'sideways_use_adx': False, 'sideways_use_spike': False, 'sideways_rsi_required': True}.
[I 2025-09-01 10:06:10,560] Trial 384 finished with values: [-1000000000.0, 1000000000.0] and parameters: {'p_sma': 59, 'p_std': 28, 'p_atr': 23, 'p_adx': 12, 'rsi_period': 42, 'ema1': 9, 'ema2': 33, 'slip_atr_k': 0.02504276852516417, 'slip_spread_k': 0.05156609412285024, 'spread_hl_frac': 0.038411841467147365, 'bb_std_mult': 2.6212597107402464, 'rsi_os': 22, 'rsi_ob': 79, 'vol_spike': 0.18725773011565064, 'adx_thresh': 12.515859365081509, 'atr_min_pct': 0.005742563248814558, 'atr_max_pct': 0.06539440464780265, 'tp_mult': 2.1701597022344, 'tsl_mult': 0.8544580095939972, 'strategy': 'breakout', 'time_stop': 154, 'use_sma': False, 'use_atr': True, 'use_adx': False, 'use_ema': True, 'use_spike': False, 'rsi_required': True, 'edge_k': 0.5420826402061198, 'edge_cap': 0.8662962833721635, 'bull_strategy': 'breakout', 'bull_bb_std_mult': 3.1156884063801016, 'bull_rsi_os': 37, 'bull_rsi_ob': 57, 'bull_adx_thresh': 28.458969866672543, 'bull_atr_min_pct': 0.014780815540515357, 'bull_atr_max_pct': 0.07967965407372797, 'bull_tp_mult': 1.5896217258836502, 'bull_tsl_mult': 0.8290756399464915, 'bull_time_stop': 123, 'bull_use_sma': True, 'bull_use_ema': True, 'bull_use_atr': False, 'bull_use_adx': False, 'bull_use_spike': False, 'bull_rsi_required': False, 'bear_strategy': 'mean_reversion', 'bear_bb_std_mult': 2.4240589315627163, 'bear_rsi_os': 47, 'bear_rsi_ob': 72, 'bear_adx_thresh': 28.30051346518178, 'bear_atr_min_pct': 0.011027025953837396, 'bear_atr_max_pct': 0.12904728314563277, 'bear_tp_mult': 2.879369517208975, 'bear_tsl_mult': 0.6120007481720269, 'bear_time_stop': 24, 'bear_use_sma': False, 'bear_use_ema': False, 'bear_use_atr': False, 'bear_use_adx': False, 'bear_use_spike': True, 'bear_rsi_required': True, 'sideways_strategy': 'mean_reversion', 'sideways_bb_std_mult': 0.5280355110871355, 'sideways_rsi_os': 44, 'sideways_rsi_ob': 64, 'sideways_adx_thresh': 31.387522407846063, 'sideways_atr_min_pct': 0.0035392231911460644, 'sideways_atr_max_pct': 0.08904907275802541, 'sideways_tp_mult': 1.3721244507902433, 'sideways_tsl_mult': 0.019785849162224034, 'sideways_time_stop': 227, 'sideways_use_sma': False, 'sideways_use_ema': True, 'sideways_use_atr': False, 'sideways_use_adx': False, 'sideways_use_spike': False, 'sideways_rsi_required': True}.
[I 2025-09-01 10:06:10,561] Trial 382 finished with values: [-1000000000.0, 1000000000.0] and parameters: {'p_sma': 59, 'p_std': 28, 'p_atr': 11, 'p_adx': 15, 'rsi_period': 67, 'ema1': 19, 'ema2': 12, 'slip_atr_k': 0.10183259404920138, 'slip_spread_k': 0.5516218602356175, 'spread_hl_frac': 0.006285699829501803, 'bb_std_mult': 1.6071197103995774, 'rsi_os': 7, 'rsi_ob': 56, 'vol_spike': 0.1887325561965069, 'adx_thresh': 13.943514215357222, 'atr_min_pct': 0.0046733848762962864, 'atr_max_pct': 0.07673119327307898, 'tp_mult': 2.574914657395714, 'tsl_mult': 0.8437499791314957, 'strategy': 'breakout', 'time_stop': 156, 'use_sma': False, 'use_atr': True, 'use_adx': False, 'use_ema': True, 'use_spike': True, 'rsi_required': True, 'edge_k': 0.5364561659350011, 'edge_cap': 0.8701469688235277, 'bull_strategy': 'mean_reversion', 'bull_bb_std_mult': 3.0477535900056796, 'bull_rsi_os': 6, 'bull_rsi_ob': 79, 'bull_adx_thresh': 33.772107328211526, 'bull_atr_min_pct': 0.01020959606741922, 'bull_atr_max_pct': 0.08061987902954006, 'bull_tp_mult': 1.1707097282923706, 'bull_tsl_mult': 0.9309405125471827, 'bull_time_stop': 124, 'bull_use_sma': True, 'bull_use_ema': False, 'bull_use_atr': False, 'bull_use_adx': False, 'bull_use_spike': False, 'bull_rsi_required': False, 'bear_strategy': 'mean_reversion', 'bear_bb_std_mult': 3.3650640938718546, 'bear_rsi_os': 42, 'bear_rsi_ob': 71, 'bear_adx_thresh': 32.62761568088765, 'bear_atr_min_pct': 0.00759939956635775, 'bear_atr_max_pct': 0.12926083929467072, 'bear_tp_mult': 2.5239453335599236, 'bear_tsl_mult': 0.10915545722713627, 'bear_time_stop': 195, 'bear_use_sma': False, 'bear_use_ema': True, 'bear_use_atr': True, 'bear_use_adx': False, 'bear_use_spike': True, 'bear_rsi_required': True, 'sideways_strategy': 'mean_reversion', 'sideways_bb_std_mult': 0.5133644551353072, 'sideways_rsi_os': 31, 'sideways_rsi_ob': 63, 'sideways_adx_thresh': 31.22810917226992, 'sideways_atr_min_pct': 0.0033918948601492282, 'sideways_atr_max_pct': 0.10514348432507509, 'sideways_tp_mult': 2.6615417242089894, 'sideways_tsl_mult': 0.016191950391517718, 'sideways_time_stop': 176, 'sideways_use_sma': True, 'sideways_use_ema': True, 'sideways_use_atr': False, 'sideways_use_adx': False, 'sideways_use_spike': False, 'sideways_rsi_required': True}.
[I 2025-09-01 10:06:58,984] Trial 386 finished with values: [-1000000000.0, 1000000000.0] and parameters: {'p_sma': 12, 'p_std': 48, 'p_atr': 28, 'p_adx': 14, 'rsi_period': 77, 'ema1': 28, 'ema2': 25, 'slip_atr_k': 0.19686328273065848, 'slip_spread_k': 0.6788371497904822, 'spread_hl_frac': 0.003996107192539412, 'bb_std_mult': 2.6872732257410115, 'rsi_os': 48, 'rsi_ob': 78, 'vol_spike': 0.2146994548159612, 'adx_thresh': 12.439635628300788, 'atr_min_pct': 0.021367667766948827, 'atr_max_pct': 0.14202877841987757, 'tp_mult': 2.9199261488677375, 'tsl_mult': 0.6750741260321222, 'strategy': 'breakout', 'time_stop': 147, 'use_sma': False, 'use_atr': True, 'use_adx': False, 'use_ema': True, 'use_spike': False, 'rsi_required': False, 'edge_k': 0.5387542977321158, 'edge_cap': 0.8683069858089234, 'bull_strategy': 'breakout', 'bull_bb_std_mult': 3.5494460828801118, 'bull_rsi_os': 6, 'bull_rsi_ob': 54, 'bull_adx_thresh': 23.314694437003038, 'bull_atr_min_pct': 0.025026459143467312, 'bull_atr_max_pct': 0.13168353609162003, 'bull_tp_mult': 1.6004604826362367, 'bull_tsl_mult': 0.8162038875233921, 'bull_time_stop': 180, 'bull_use_sma': True, 'bull_use_ema': True, 'bull_use_atr': True, 'bull_use_adx': False, 'bull_use_spike': False, 'bull_rsi_required': False, 'bear_strategy': 'breakout', 'bear_bb_std_mult': 1.6595610401560512, 'bear_rsi_os': 17, 'bear_rsi_ob': 71, 'bear_adx_thresh': 28.175423112837926, 'bear_atr_min_pct': 0.013556167219297349, 'bear_atr_max_pct': 0.12863918669873942, 'bear_tp_mult': 1.3178097638058555, 'bear_tsl_mult': 0.8294796861765987, 'bear_time_stop': 14, 'bear_use_sma': False, 'bear_use_ema': True, 'bear_use_atr': False, 'bear_use_adx': False, 'bear_use_spike': True, 'bear_rsi_required': False, 'sideways_strategy': 'mean_reversion', 'sideways_bb_std_mult': 2.731477843956922, 'sideways_rsi_os': 25, 'sideways_rsi_ob': 56, 'sideways_adx_thresh': 31.40283797059925, 'sideways_atr_min_pct': 0.003214744763118357, 'sideways_atr_max_pct': 0.08565942102769573, 'sideways_tp_mult': 1.942168727701584, 'sideways_tsl_mult': 0.9828025975991873, 'sideways_time_stop': 294, 'sideways_use_sma': False, 'sideways_use_ema': True, 'sideways_use_atr': False, 'sideways_use_adx': False, 'sideways_use_spike': False, 'sideways_rsi_required': False}.
[I 2025-09-01 10:06:59,005] Trial 388 finished with values: [-1000000000.0, 1000000000.0] and parameters: {'p_sma': 42, 'p_std': 44, 'p_atr': 28, 'p_adx': 20, 'rsi_period': 45, 'ema1': 7, 'ema2': 25, 'slip_atr_k': 0.12989586946402457, 'slip_spread_k': 0.10893662530997467, 'spread_hl_frac': 0.0029317266190412054, 'bb_std_mult': 2.2998002827330994, 'rsi_os': 48, 'rsi_ob': 57, 'vol_spike': 0.17856519065287513, 'adx_thresh': 11.451560443947551, 'atr_min_pct': 0.021186274496219168, 'atr_max_pct': 0.06875314253272889, 'tp_mult': 1.0965493400529522, 'tsl_mult': 0.5363647474308026, 'strategy': 'breakout', 'time_stop': 147, 'use_sma': True, 'use_atr': False, 'use_adx': False, 'use_ema': False, 'use_spike': False, 'rsi_required': False, 'edge_k': 0.6128085568136218, 'edge_cap': 0.19714093798009769, 'bull_strategy': 'breakout', 'bull_bb_std_mult': 3.2259724350380035, 'bull_rsi_os': 35, 'bull_rsi_ob': 55, 'bull_adx_thresh': 27.61634537733008, 'bull_atr_min_pct': 0.024756394917188212, 'bull_atr_max_pct': 0.11890945446599036, 'bull_tp_mult': 1.4994665418676092, 'bull_tsl_mult': 0.7996443113018408, 'bull_time_stop': 136, 'bull_use_sma': False, 'bull_use_ema': True, 'bull_use_atr': True, 'bull_use_adx': True, 'bull_use_spike': True, 'bull_rsi_required': False, 'bear_strategy': 'breakout', 'bear_bb_std_mult': 1.49720087643098, 'bear_rsi_os': 44, 'bear_rsi_ob': 74, 'bear_adx_thresh': 18.21105205674097, 'bear_atr_min_pct': 0.027739540818862225, 'bear_atr_max_pct': 0.05681546816175694, 'bear_tp_mult': 1.9993524248077088, 'bear_tsl_mult': 0.8199258199460354, 'bear_time_stop': 97, 'bear_use_sma': True, 'bear_use_ema': True, 'bear_use_atr': False, 'bear_use_adx': True, 'bear_use_spike': True, 'bear_rsi_required': False, 'sideways_strategy': 'mean_reversion', 'sideways_bb_std_mult': 2.74901419376099, 'sideways_rsi_os': 25, 'sideways_rsi_ob': 88, 'sideways_adx_thresh': 32.44174279722964, 'sideways_atr_min_pct': 3.755027798060459e-05, 'sideways_atr_max_pct': 0.08536592757469451, 'sideways_tp_mult': 2.874158176687592, 'sideways_tsl_mult': 0.8842124288630862, 'sideways_time_stop': 231, 'sideways_use_sma': False, 'sideways_use_ema': False, 'sideways_use_atr': False, 'sideways_use_adx': False, 'sideways_use_spike': True, 'sideways_rsi_required': False}.
