[I 2025-09-01 09:26:12,241] Trial 156 finished with values: [-0.035725441877471176, 0.03572567184725542] and parameters: {'p_sma': 56, 'p_std': 25, 'p_atr': 26, 'p_adx': 10, 'rsi_period': 48, 'ema1': 5, 'ema2': 11, 'slip_atr_k': 0.00663224623650123, 'slip_spread_k': 0.8791227461291149, 'spread_hl_frac': 0.027802110896504886, 'bb_std_mult': 2.854284455671227, 'rsi_os': 28, 'rsi_ob': 53, 'vol_spike': 0.030985926974342937, 'adx_thresh': 11.262435870955787, 'atr_min_pct': 0.011791760316483022, 'atr_max_pct': 0.02346290340017078, 'tp_mult': 2.3730948442453847, 'tsl_mult': 0.399768704178171, 'strategy': 'breakout', 'time_stop': 131, 'use_sma': True, 'use_atr': True, 'use_adx': True, 'use_ema': False, 'use_spike': True, 'rsi_required': False, 'edge_k': 1.7820991838378886, 'edge_cap': 0.2678224136191189, 'bull_strategy': 'mean_reversion', 'bull_bb_std_mult': 2.875185996424375, 'bull_rsi_os': 34, 'bull_rsi_ob': 58, 'bull_adx_thresh': 10.607723446120756, 'bull_atr_min_pct': 0.003949483377198352, 'bull_atr_max_pct': 0.04337404679531455, 'bull_tp_mult': 2.3976476838260057, 'bull_tsl_mult': 0.5759630013460812, 'bull_time_stop': 282, 'bull_use_sma': True, 'bull_use_ema': False, 'bull_use_atr': True, 'bull_use_adx': False, 'bull_use_spike': True, 'bull_rsi_required': False, 'bear_strategy': 'mean_reversion', 'bear_bb_std_mult': 0.5270352334281871, 'bear_rsi_os': 38, 'bear_rsi_ob': 54, 'bear_adx_thresh': 34.177610250418226, 'bear_atr_min_pct': 0.022013013629167473, 'bear_atr_max_pct': 0.10411521145403625, 'bear_tp_mult': 2.968073975266858, 'bear_tsl_mult': 0.8597389245632796, 'bear_time_stop': 15, 'bear_use_sma': False, 'bear_use_ema': True, 'bear_use_atr': False, 'bear_use_adx': True, 'bear_use_spike': True, 'bear_rsi_required': False, 'sideways_strategy': 'breakout', 'sideways_bb_std_mult': 1.0407667704767392, 'sideways_rsi_os': 27, 'sideways_rsi_ob': 55, 'sideways_adx_thresh': 12.8866633262082, 'sideways_atr_min_pct': 0.0021858047604850863, 'sideways_atr_max_pct': 0.011798446930277262, 'sideways_tp_mult': 2.129611036299453, 'sideways_tsl_mult': 0.7994811566457085, 'sideways_time_stop': 237, 'sideways_use_sma': False, 'sideways_use_ema': False, 'sideways_use_atr': False, 'sideways_use_adx': True, 'sideways_use_spike': True, 'sideways_rsi_required': False}.
[I 2025-09-01 09:26:12,924] Trial 154 finished with values: [-0.024408349408654995, 0.024219952921949575] and parameters: {'p_sma': 56, 'p_std': 25, 'p_atr': 27, 'p_adx': 16, 'rsi_period': 84, 'ema1': 14, 'ema2': 15, 'slip_atr_k': 0.006481217916555114, 'slip_spread_k': 0.9982789738921696, 'spread_hl_frac': 0.012807286611904336, 'bb_std_mult': 2.8421826927748315, 'rsi_os': 28, 'rsi_ob': 69, 'vol_spike': 0.09870971173484802, 'adx_thresh': 11.635951256558995, 'atr_min_pct': 0.011642099271347604, 'atr_max_pct': 0.03381490180009072, 'tp_mult': 2.5438376536389247, 'tsl_mult': 0.4110449267771127, 'strategy': 'breakout', 'time_stop': 132, 'use_sma': True, 'use_atr': True, 'use_adx': True, 'use_ema': False, 'use_spike': True, 'rsi_required': False, 'edge_k': 0.5550552973498605, 'edge_cap': 0.4183096238673768, 'bull_strategy': 'mean_reversion', 'bull_bb_std_mult': 2.131318756560317, 'bull_rsi_os': 34, 'bull_rsi_ob': 45, 'bull_adx_thresh': 18.883791803446563, 'bull_atr_min_pct': 0.0027643838517259108, 'bull_atr_max_pct': 0.044025306194146144, 'bull_tp_mult': 1.615482785589456, 'bull_tsl_mult': 0.5111354813825457, 'bull_time_stop': 236, 'bull_use_sma': True, 'bull_use_ema': False, 'bull_use_atr': False, 'bull_use_adx': False, 'bull_use_spike': False, 'bull_rsi_required': False, 'bear_strategy': 'mean_reversion', 'bear_bb_std_mult': 1.5570955943497022, 'bear_rsi_os': 29, 'bear_rsi_ob': 51, 'bear_adx_thresh': 18.45843867219383, 'bear_atr_min_pct': 0.014175754089264676, 'bear_atr_max_pct': 0.10216310520073531, 'bear_tp_mult': 2.9654450508685044, 'bear_tsl_mult': 0.869674519705006, 'bear_time_stop': 253, 'bear_use_sma': False, 'bear_use_ema': True, 'bear_use_atr': False, 'bear_use_adx': False, 'bear_use_spike': True, 'bear_rsi_required': True, 'sideways_strategy': 'breakout', 'sideways_bb_std_mult': 2.328214470901712, 'sideways_rsi_os': 27, 'sideways_rsi_ob': 55, 'sideways_adx_thresh': 25.931193426937543, 'sideways_atr_min_pct': 0.0022369538638952915, 'sideways_atr_max_pct': 0.12106474773880174, 'sideways_tp_mult': 2.0944584222354106, 'sideways_tsl_mult': 0.7959584960925873, 'sideways_time_stop': 237, 'sideways_use_sma': False, 'sideways_use_ema': True, 'sideways_use_atr': True, 'sideways_use_adx': True, 'sideways_use_spike': True, 'sideways_rsi_required': True}.
[I 2025-09-01 09:26:13,374] Trial 153 finished with values: [-1000000000.0, 1000000000.0] and parameters: {'p_sma': 56, 'p_std': 37, 'p_atr': 27, 'p_adx': 16, 'rsi_period': 62, 'ema1': 22, 'ema2': 15, 'slip_atr_k': 0.024772039933832427, 'slip_spread_k': 0.8693275703060023, 'spread_hl_frac': 0.01238589685769361, 'bb_std_mult': 2.857207786325232, 'rsi_os': 5, 'rsi_ob': 53, 'vol_spike': 0.12294763699691108, 'adx_thresh': 11.215404182777641, 'atr_min_pct': 0.025122773401938452, 'atr_max_pct': 0.03717294801828612, 'tp_mult': 2.537312076343848, 'tsl_mult': 0.40514017373593336, 'strategy': 'breakout', 'time_stop': 131, 'use_sma': True, 'use_atr': True, 'use_adx': True, 'use_ema': False, 'use_spike': True, 'rsi_required': False, 'edge_k': 1.7573582641533219, 'edge_cap': 0.30364949207913133, 'bull_strategy': 'mean_reversion', 'bull_bb_std_mult': 2.6788478911337257, 'bull_rsi_os': 33, 'bull_rsi_ob': 58, 'bull_adx_thresh': 34.244505559589435, 'bull_atr_min_pct': 0.003256247796402439, 'bull_atr_max_pct': 0.024185236547476154, 'bull_tp_mult': 2.4025278776213645, 'bull_tsl_mult': 0.8449133067836709, 'bull_time_stop': 46, 'bull_use_sma': True, 'bull_use_ema': False, 'bull_use_atr': False, 'bull_use_adx': False, 'bull_use_spike': False, 'bull_rsi_required': False, 'bear_strategy': 'mean_reversion', 'bear_bb_std_mult': 1.5341801885281305, 'bear_rsi_os': 41, 'bear_rsi_ob': 51, 'bear_adx_thresh': 31.843016028157535, 'bear_atr_min_pct': 0.028098765891683253, 'bear_atr_max_pct': 0.015281973132730345, 'bear_tp_mult': 1.9036023766198475, 'bear_tsl_mult': 0.8740393345418812, 'bear_time_stop': 96, 'bear_use_sma': False, 'bear_use_ema': True, 'bear_use_atr': False, 'bear_use_adx': False, 'bear_use_spike': True, 'bear_rsi_required': True, 'sideways_strategy': 'breakout', 'sideways_bb_std_mult': 3.0785512293074344, 'sideways_rsi_os': 11, 'sideways_rsi_ob': 55, 'sideways_adx_thresh': 12.93147522293086, 'sideways_atr_min_pct': 0.02997202339430617, 'sideways_atr_max_pct': 0.01428013369177586, 'sideways_tp_mult': 1.4863040208155438, 'sideways_tsl_mult': 0.801931494974303, 'sideways_time_stop': 295, 'sideways_use_sma': False, 'sideways_use_ema': True, 'sideways_use_atr': True, 'sideways_use_adx': True, 'sideways_use_spike': True, 'sideways_rsi_required': True}.
[I 2025-09-01 09:26:13,671] Trial 155 finished with values: [-0.0130124399838627, 0.01347395623831996] and parameters: {'p_sma': 56, 'p_std': 35, 'p_atr': 27, 'p_adx': 10, 'rsi_period': 84, 'ema1': 22, 'ema2': 10, 'slip_atr_k': 0.023761346221418664, 'slip_spread_k': 0.838681951523029, 'spread_hl_frac': 0.021645770273689007, 'bb_std_mult': 2.832327033887313, 'rsi_os': 43, 'rsi_ob': 53, 'vol_spike': 0.03094433757896084, 'adx_thresh': 11.110118740647472, 'atr_min_pct': 0.011769270996636156, 'atr_max_pct': 0.023682652717880462, 'tp_mult': 2.528930400657591, 'tsl_mult': 0.9761842950343746, 'strategy': 'breakout', 'time_stop': 146, 'use_sma': True, 'use_atr': True, 'use_adx': True, 'use_ema': False, 'use_spike': True, 'rsi_required': False, 'edge_k': 1.7529890815575362, 'edge_cap': 0.4136065755930111, 'bull_strategy': 'mean_reversion', 'bull_bb_std_mult': 2.1254524796881906, 'bull_rsi_os': 33, 'bull_rsi_ob': 69, 'bull_adx_thresh': 18.301826518177432, 'bull_atr_min_pct': 0.0036214097081189813, 'bull_atr_max_pct': 0.08134042463810719, 'bull_tp_mult': 2.402045533091908, 'bull_tsl_mult': 0.5763885376734302, 'bull_time_stop': 67, 'bull_use_sma': True, 'bull_use_ema': False, 'bull_use_atr': False, 'bull_use_adx': False, 'bull_use_spike': False, 'bull_rsi_required': False, 'bear_strategy': 'mean_reversion', 'bear_bb_std_mult': 2.4103302814571723, 'bear_rsi_os': 38, 'bear_rsi_ob': 54, 'bear_adx_thresh': 18.29573179567892, 'bear_atr_min_pct': 0.014860681061934508, 'bear_atr_max_pct': 0.045780616065146856, 'bear_tp_mult': 2.975208544385217, 'bear_tsl_mult': 0.8623706643773399, 'bear_time_stop': 18, 'bear_use_sma': False, 'bear_use_ema': True, 'bear_use_atr': False, 'bear_use_adx': False, 'bear_use_spike': True, 'bear_rsi_required': True, 'sideways_strategy': 'breakout', 'sideways_bb_std_mult': 2.3305364271008306, 'sideways_rsi_os': 27, 'sideways_rsi_ob': 55, 'sideways_adx_thresh': 24.284609161891268, 'sideways_atr_min_pct': 0.0025159045965798222, 'sideways_atr_max_pct': 0.11867735733029919, 'sideways_tp_mult': 2.1524883916009476, 'sideways_tsl_mult': 0.7897089709371683, 'sideways_time_stop': 238, 'sideways_use_sma': False, 'sideways_use_ema': True, 'sideways_use_atr': True, 'sideways_use_adx': True, 'sideways_use_spike': True, 'sideways_rsi_required': True}.
[I 2025-09-01 09:26:53,033] Trial 159 finished with values: [-1000000000.0, 1000000000.0] and parameters: {'p_sma': 10, 'p_std': 35, 'p_atr': 29, 'p_adx': 23, 'rsi_period': 51, 'ema1': 22, 'ema2': 34, 'slip_atr_k': 0.015058339222023931, 'slip_spread_k': 0.5458197351971087, 'spread_hl_frac': 0.02180024802674431, 'bb_std_mult': 2.4991879705477418, 'rsi_os': 44, 'rsi_ob': 51, 'vol_spike': 0.010517802583787234, 'adx_thresh': 26.43416227730937, 'atr_min_pct': 0.0033336468294000183, 'atr_max_pct': 0.12086870527412591, 'tp_mult': 2.452799331260889, 'tsl_mult': 0.49095029094208603, 'strategy': 'mean_reversion', 'time_stop': 53, 'use_sma': False, 'use_atr': True, 'use_adx': False, 'use_ema': True, 'use_spike': False, 'rsi_required': True, 'edge_k': 1.9505978666515866, 'edge_cap': 0.38069453978467305, 'bull_strategy': 'breakout', 'bull_bb_std_mult': 1.947803750968148, 'bull_rsi_os': 33, 'bull_rsi_ob': 74, 'bull_adx_thresh': 16.526761238688017, 'bull_atr_min_pct': 0.0038546602504753217, 'bull_atr_max_pct': 0.14588341043262346, 'bull_tp_mult': 2.88548213195729, 'bull_tsl_mult': 0.9828456783458239, 'bull_time_stop': 251, 'bull_use_sma': False, 'bull_use_ema': True, 'bull_use_atr': True, 'bull_use_adx': False, 'bull_use_spike': True, 'bull_rsi_required': False, 'bear_strategy': 'breakout', 'bear_bb_std_mult': 3.2388515269146425, 'bear_rsi_os': 13, 'bear_rsi_ob': 54, 'bear_adx_thresh': 16.050562366756413, 'bear_atr_min_pct': 0.007104313009471581, 'bear_atr_max_pct': 0.13365860828214798, 'bear_tp_mult': 2.912681124956313, 'bear_tsl_mult': 0.3777395774124631, 'bear_time_stop': 173, 'bear_use_sma': True, 'bear_use_ema': False, 'bear_use_atr': True, 'bear_use_adx': True, 'bear_use_spike': False, 'bear_rsi_required': False, 'sideways_strategy': 'mean_reversion', 'sideways_bb_std_mult': 2.250556630672097, 'sideways_rsi_os': 38, 'sideways_rsi_ob': 87, 'sideways_adx_thresh': 25.548920810694362, 'sideways_atr_min_pct': 0.016956932325849525, 'sideways_atr_max_pct': 0.08341095913768139, 'sideways_tp_mult': 1.3136938583461346, 'sideways_tsl_mult': 0.2399746507751202, 'sideways_time_stop': 269, 'sideways_use_sma': True, 'sideways_use_ema': False, 'sideways_use_atr': False, 'sideways_use_adx': False, 'sideways_use_spike': False, 'sideways_rsi_required': False}.
[I 2025-09-01 09:26:54,051] Trial 160 finished with values: [-1000000000.0, 1000000000.0] and parameters: {'p_sma': 10, 'p_std': 55, 'p_atr': 20, 'p_adx': 7, 'rsi_period': 40, 'ema1': 28, 'ema2': 35, 'slip_atr_k': 0.01669690842778779, 'slip_spread_k': 0.11148428746024613, 'spread_hl_frac': 0.019881350051762038, 'bb_std_mult': 3.4267442050152623, 'rsi_os': 44, 'rsi_ob': 51, 'vol_spike': 0.07605499225513059, 'adx_thresh': 15.14876996601835, 'atr_min_pct': 0.0129478448619278, 'atr_max_pct': 0.051566517057519815, 'tp_mult': 2.4407510371974035, 'tsl_mult': 0.44318733066781324, 'strategy': 'mean_reversion', 'time_stop': 146, 'use_sma': False, 'use_atr': True, 'use_adx': False, 'use_ema': True, 'use_spike': False, 'rsi_required': True, 'edge_k': 1.6837692868500624, 'edge_cap': 0.35056575304739757, 'bull_strategy': 'breakout', 'bull_bb_std_mult': 0.7221261847314548, 'bull_rsi_os': 33, 'bull_rsi_ob': 90, 'bull_adx_thresh': 16.529895959468778, 'bull_atr_min_pct': 0.004598401406594801, 'bull_atr_max_pct': 0.0815511668156876, 'bull_tp_mult': 1.2959028316629773, 'bull_tsl_mult': 0.26733464596283063, 'bull_time_stop': 250, 'bull_use_sma': False, 'bull_use_ema': True, 'bull_use_atr': True, 'bull_use_adx': False, 'bull_use_spike': True, 'bull_rsi_required': False, 'bear_strategy': 'breakout', 'bear_bb_std_mult': 3.27100145104035, 'bear_rsi_os': 27, 'bear_rsi_ob': 48, 'bear_adx_thresh': 16.067432607697576, 'bear_atr_min_pct': 0.02605926942638297, 'bear_atr_max_pct': 0.08794122519594946, 'bear_tp_mult': 2.9921321434982198, 'bear_tsl_mult': 0.2661991900047307, 'bear_time_stop': 225, 'bear_use_sma': True, 'bear_use_ema': False, 'bear_use_atr': True, 'bear_use_adx': True, 'bear_use_spike': False, 'bear_rsi_required': False, 'sideways_strategy': 'mean_reversion', 'sideways_bb_std_mult': 2.229899881075367, 'sideways_rsi_os': 26, 'sideways_rsi_ob': 87, 'sideways_adx_thresh': 17.643590227767678, 'sideways_atr_min_pct': 0.00842019249897311, 'sideways_atr_max_pct': 0.08433579925268977, 'sideways_tp_mult': 1.3147962968536269, 'sideways_tsl_mult': 0.7002859080565658, 'sideways_time_stop': 271, 'sideways_use_sma': True, 'sideways_use_ema': False, 'sideways_use_atr': False, 'sideways_use_adx': False, 'sideways_use_spike': False, 'sideways_rsi_required': False}.
[I 2025-09-01 09:26:54,750] Trial 157 finished with values: [-1000000000.0, 1000000000.0] and parameters: {'p_sma': 24, 'p_std': 37, 'p_atr': 29, 'p_adx': 11, 'rsi_period': 73, 'ema1': 22, 'ema2': 12, 'slip_atr_k': 0.02491334076628401, 'slip_spread_k': 0.7017628665132973, 'spread_hl_frac': 0.03849287459576123, 'bb_std_mult': 2.4832620018044027, 'rsi_os': 5, 'rsi_ob': 54, 'vol_spike': 0.07941886015214557, 'adx_thresh': 15.34492416825576, 'atr_min_pct': 0.025006663614521633, 'atr_max_pct': 0.03657829425353813, 'tp_mult': 2.5390891021389437, 'tsl_mult': 0.4388707035375766, 'strategy': 'mean_reversion', 'time_stop': 144, 'use_sma': True, 'use_atr': True, 'use_adx': True, 'use_ema': True, 'use_spike': True, 'rsi_required': False, 'edge_k': 0.561103480172239, 'edge_cap': 0.31435531114058385, 'bull_strategy': 'mean_reversion', 'bull_bb_std_mult': 1.94793713633102, 'bull_rsi_os': 33, 'bull_rsi_ob': 90, 'bull_adx_thresh': 18.06982784296855, 'bull_atr_min_pct': 0.0036209025988094877, 'bull_atr_max_pct': 0.030236270010302806, 'bull_tp_mult': 2.8836159959414727, 'bull_tsl_mult': 0.6349691796965606, 'bull_time_stop': 238, 'bull_use_sma': False, 'bull_use_ema': False, 'bull_use_atr': False, 'bull_use_adx': False, 'bull_use_spike': False, 'bull_rsi_required': False, 'bear_strategy': 'breakout', 'bear_bb_std_mult': 2.3857501458957713, 'bear_rsi_os': 10, 'bear_rsi_ob': 89, 'bear_adx_thresh': 14.7128586011114, 'bear_atr_min_pct': 0.027981019892270306, 'bear_atr_max_pct': 0.013795719321115354, 'bear_tp_mult': 2.9990787720381347, 'bear_tsl_mult': 0.13655409869209872, 'bear_time_stop': 225, 'bear_use_sma': False, 'bear_use_ema': False, 'bear_use_atr': True, 'bear_use_adx': False, 'bear_use_spike': False, 'bear_rsi_required': True, 'sideways_strategy': 'mean_reversion', 'sideways_bb_std_mult': 2.3245801444271788, 'sideways_rsi_os': 24, 'sideways_rsi_ob': 55, 'sideways_adx_thresh': 25.696367159046442, 'sideways_atr_min_pct': 0.008816839399027913, 'sideways_atr_max_pct': 0.027670300003403592, 'sideways_tp_mult': 1.3182021272355677, 'sideways_tsl_mult': 0.25469506993442603, 'sideways_time_stop': 231, 'sideways_use_sma': True, 'sideways_use_ema': True, 'sideways_use_atr': True, 'sideways_use_adx': False, 'sideways_use_spike': False, 'sideways_rsi_required': True}.
[I 2025-09-01 09:26:54,764] Trial 158 finished with values: [-1000000000.0, 1000000000.0] and parameters: {'p_sma': 24, 'p_std': 37, 'p_atr': 29, 'p_adx': 23, 'rsi_period': 74, 'ema1': 12, 'ema2': 34, 'slip_atr_k': 0.12231359322550714, 'slip_spread_k': 0.29748030726805746, 'spread_hl_frac': 0.021791336354740877, 'bb_std_mult': 0.6895544596555221, 'rsi_os': 44, 'rsi_ob': 54, 'vol_spike': 0.21668725170255826, 'adx_thresh': 26.6147595581384, 'atr_min_pct': 0.0012974203516393293, 'atr_max_pct': 0.1434298428652564, 'tp_mult': 2.4308494827201947, 'tsl_mult': 0.9585395684519169, 'strategy': 'mean_reversion', 'time_stop': 51, 'use_sma': False, 'use_atr': True, 'use_adx': False, 'use_ema': True, 'use_spike': False, 'rsi_required': True, 'edge_k': 1.6787716740373764, 'edge_cap': 0.31650806085021077, 'bull_strategy': 'breakout', 'bull_bb_std_mult': 0.734706428437933, 'bull_rsi_os': 33, 'bull_rsi_ob': 94, 'bull_adx_thresh': 16.422046674284353, 'bull_atr_min_pct': 0.0033582462681049138, 'bull_atr_max_pct': 0.031227831363268767, 'bull_tp_mult': 2.385486621554069, 'bull_tsl_mult': 0.9904610448261091, 'bull_time_stop': 250, 'bull_use_sma': False, 'bull_use_ema': True, 'bull_use_atr': True, 'bull_use_adx': False, 'bull_use_spike': True, 'bull_rsi_required': False, 'bear_strategy': 'breakout', 'bear_bb_std_mult': 3.316944845550781, 'bear_rsi_os': 28, 'bear_rsi_ob': 54, 'bear_adx_thresh': 15.024500072608156, 'bear_atr_min_pct': 0.027868722000144692, 'bear_atr_max_pct': 0.13286050360805807, 'bear_tp_mult': 1.9043134230197505, 'bear_tsl_mult': 0.7670820509948358, 'bear_time_stop': 224, 'bear_use_sma': False, 'bear_use_ema': False, 'bear_use_atr': True, 'bear_use_adx': True, 'bear_use_spike': False, 'bear_rsi_required': False, 'sideways_strategy': 'mean_reversion', 'sideways_bb_std_mult': 2.246070190317187, 'sideways_rsi_os': 25, 'sideways_rsi_ob': 53, 'sideways_adx_thresh': 23.237518947198765, 'sideways_atr_min_pct': 0.002634030508626864, 'sideways_atr_max_pct': 0.08431268254159621, 'sideways_tp_mult': 1.3271430270304283, 'sideways_tsl_mult': 0.2974568844229504, 'sideways_time_stop': 297, 'sideways_use_sma': True, 'sideways_use_ema': False, 'sideways_use_atr': False, 'sideways_use_adx': False, 'sideways_use_spike': False, 'sideways_rsi_required': False}.
[I 2025-09-01 09:27:33,837] Trial 161 finished with values: [-1000000000.0, 1000000000.0] and parameters: {'p_sma': 23, 'p_std': 33, 'p_atr': 20, 'p_adx': 14, 'rsi_period': 44, 'ema1': 28, 'ema2': 12, 'slip_atr_k': 0.021780704261358953, 'slip_spread_k': 0.6210353657985566, 'spread_hl_frac': 0.03025250059359842, 'bb_std_mult': 2.4051466653919267, 'rsi_os': 43, 'rsi_ob': 80, 'vol_spike': 0.1728845148687374, 'adx_thresh': 15.133800728096228, 'atr_min_pct': 0.012780796036786756, 'atr_max_pct': 0.025630882702999656, 'tp_mult': 2.4147530561522506, 'tsl_mult': 0.4426082460249632, 'strategy': 'mean_reversion', 'time_stop': 78, 'use_sma': True, 'use_atr': True, 'use_adx': False, 'use_ema': True, 'use_spike': False, 'rsi_required': True, 'edge_k': 0.5018329945037711, 'edge_cap': 0.20015640314656807, 'bull_strategy': 'mean_reversion', 'bull_bb_std_mult': 1.9313832403007207, 'bull_rsi_os': 31, 'bull_rsi_ob': 54, 'bull_adx_thresh': 12.750072176337028, 'bull_atr_min_pct': 0.010151157709257607, 'bull_atr_max_pct': 0.03090034352100314, 'bull_tp_mult': 2.0872372919323645, 'bull_tsl_mult': 0.6386762656267285, 'bull_time_stop': 71, 'bull_use_sma': False, 'bull_use_ema': False, 'bull_use_atr': True, 'bull_use_adx': False, 'bull_use_spike': True, 'bull_rsi_required': False, 'bear_strategy': 'breakout', 'bear_bb_std_mult': 2.810834460102548, 'bear_rsi_os': 27, 'bear_rsi_ob': 90, 'bear_adx_thresh': 24.54168356811929, 'bear_atr_min_pct': 0.0046892810103828925, 'bear_atr_max_pct': 0.03934396863531697, 'bear_tp_mult': 2.9964035828900357, 'bear_tsl_mult': 0.7870906622567806, 'bear_time_stop': 226, 'bear_use_sma': False, 'bear_use_ema': False, 'bear_use_atr': True, 'bear_use_adx': True, 'bear_use_spike': False, 'bear_rsi_required': False, 'sideways_strategy': 'mean_reversion', 'sideways_bb_std_mult': 1.8219149985805638, 'sideways_rsi_os': 26, 'sideways_rsi_ob': 90, 'sideways_adx_thresh': 17.29553104012153, 'sideways_atr_min_pct': 0.009358267023235068, 'sideways_atr_max_pct': 0.0270516701143892, 'sideways_tp_mult': 2.27166109659369, 'sideways_tsl_mult': 0.8808679699058246, 'sideways_time_stop': 230, 'sideways_use_sma': True, 'sideways_use_ema': False, 'sideways_use_atr': False, 'sideways_use_adx': False, 'sideways_use_spike': False, 'sideways_rsi_required': False}.
