[I 2025-09-01 09:10:48,507] Trial 46 finished with values: [-1000000000.0, 1000000000.0] and parameters: {'p_sma': 56, 'p_std': 44, 'p_atr': 16, 'p_adx': 25, 'rsi_period': 31, 'ema1': 30, 'ema2': 49, 'slip_atr_k': 0.1484064766663566, 'slip_spread_k': 0.09319263481703038, 'spread_hl_frac': 0.020284813961224772, 'bb_std_mult': 1.7675650951526891, 'rsi_os': 55, 'rsi_ob': 49, 'vol_spike': 0.06982805716681281, 'adx_thresh': 26.968829958096535, 'atr_min_pct': 0.010898339004030016, 'atr_max_pct': 0.10090466717061781, 'tp_mult': 2.106270039139689, 'tsl_mult': 0.8098447875165047, 'strategy': 'mean_reversion', 'time_stop': 103, 'use_sma': False, 'use_atr': True, 'use_adx': True, 'use_ema': False, 'use_spike': False, 'rsi_required': False, 'edge_k': 1.970722355756863, 'edge_cap': 0.5747435855591284, 'bull_strategy': 'breakout', 'bull_bb_std_mult': 2.084717391306796, 'bull_rsi_os': 43, 'bull_rsi_ob': 93, 'bull_adx_thresh': 21.21076276819045, 'bull_atr_min_pct': 0.0196426777071863, 'bull_atr_max_pct': 0.07677272010882394, 'bull_tp_mult': 2.1142813054003597, 'bull_tsl_mult': 0.9153034191081857, 'bull_time_stop': 128, 'bull_use_sma': False, 'bull_use_ema': True, 'bull_use_atr': False, 'bull_use_adx': False, 'bull_use_spike': True, 'bull_rsi_required': False, 'bear_strategy': 'breakout', 'bear_bb_std_mult': 1.9677428127421266, 'bear_rsi_os': 35, 'bear_rsi_ob': 70, 'bear_adx_thresh': 10.579515279106563, 'bear_atr_min_pct': 0.004774652899164152, 'bear_atr_max_pct': 0.11311841171243808, 'bear_tp_mult': 1.828917338873775, 'bear_tsl_mult': 0.923701478749845, 'bear_time_stop': 124, 'bear_use_sma': False, 'bear_use_ema': False, 'bear_use_atr': True, 'bear_use_adx': True, 'bear_use_spike': True, 'bear_rsi_required': True, 'sideways_strategy': 'breakout', 'sideways_bb_std_mult': 1.266326227555917, 'sideways_rsi_os': 6, 'sideways_rsi_ob': 91, 'sideways_adx_thresh': 11.197837274417868, 'sideways_atr_min_pct': 0.004128544551208155, 'sideways_atr_max_pct': 0.09067495688160754, 'sideways_tp_mult': 1.5655029296607783, 'sideways_tsl_mult': 0.12268003141923073, 'sideways_time_stop': 146, 'sideways_use_sma': False, 'sideways_use_ema': False, 'sideways_use_atr': True, 'sideways_use_adx': True, 'sideways_use_spike': False, 'sideways_rsi_required': True}.
[I 2025-09-01 09:11:28,816] Trial 49 finished with values: [-1000000000.0, 1000000000.0] and parameters: {'p_sma': 44, 'p_std': 31, 'p_atr': 30, 'p_adx': 10, 'rsi_period': 62, 'ema1': 23, 'ema2': 19, 'slip_atr_k': 0.18232796048205646, 'slip_spread_k': 0.2862915590295391, 'spread_hl_frac': 0.03461234530195236, 'bb_std_mult': 2.607475562913027, 'rsi_os': 22, 'rsi_ob': 79, 'vol_spike': 0.14575730551644892, 'adx_thresh': 33.120109204232776, 'atr_min_pct': 0.018058706418336498, 'atr_max_pct': 0.04850305397983312, 'tp_mult': 2.382553243574627, 'tsl_mult': 0.09053446024390038, 'strategy': 'breakout', 'time_stop': 134, 'use_sma': False, 'use_atr': True, 'use_adx': True, 'use_ema': True, 'use_spike': False, 'rsi_required': False, 'edge_k': 0.009944363189274996, 'edge_cap': 0.6829146455399422, 'bull_strategy': 'breakout', 'bull_bb_std_mult': 0.7948824036975004, 'bull_rsi_os': 36, 'bull_rsi_ob': 45, 'bull_adx_thresh': 15.69596946561817, 'bull_atr_min_pct': 0.004936972233655959, 'bull_atr_max_pct': 0.020724761256750608, 'bull_tp_mult': 2.7272818563901056, 'bull_tsl_mult': 0.3444014227145311, 'bull_time_stop': 232, 'bull_use_sma': False, 'bull_use_ema': True, 'bull_use_atr': False, 'bull_use_adx': False, 'bull_use_spike': True, 'bull_rsi_required': False, 'bear_strategy': 'breakout', 'bear_bb_std_mult': 1.3543608661312567, 'bear_rsi_os': 39, 'bear_rsi_ob': 91, 'bear_adx_thresh': 12.02924734112803, 'bear_atr_min_pct': 0.02572451368086136, 'bear_atr_max_pct': 0.07087170968829767, 'bear_tp_mult': 2.42178401637883, 'bear_tsl_mult': 0.089579758502451, 'bear_time_stop': 208, 'bear_use_sma': False, 'bear_use_ema': False, 'bear_use_atr': False, 'bear_use_adx': True, 'bear_use_spike': True, 'bear_rsi_required': True, 'sideways_strategy': 'breakout', 'sideways_bb_std_mult': 3.459107254970359, 'sideways_rsi_os': 23, 'sideways_rsi_ob': 72, 'sideways_adx_thresh': 28.885461130995925, 'sideways_atr_min_pct': 0.0002757999864579225, 'sideways_atr_max_pct': 0.07453009547944733, 'sideways_tp_mult': 2.3978375621186925, 'sideways_tsl_mult': 0.9301309504459053, 'sideways_time_stop': 73, 'sideways_use_sma': False, 'sideways_use_ema': False, 'sideways_use_atr': True, 'sideways_use_adx': True, 'sideways_use_spike': False, 'sideways_rsi_required': True}.
[I 2025-09-01 09:11:29,390] Trial 45 finished with values: [-1000000000.0, 1000000000.0] and parameters: {'p_sma': 44, 'p_std': 44, 'p_atr': 16, 'p_adx': 30, 'rsi_period': 30, 'ema1': 30, 'ema2': 47, 'slip_atr_k': 0.15389260248659054, 'slip_spread_k': 0.0925687637320966, 'spread_hl_frac': 0.021248126160778195, 'bb_std_mult': 0.936236140154949, 'rsi_os': 39, 'rsi_ob': 68, 'vol_spike': 0.09220459399427462, 'adx_thresh': 9.826238248320832, 'atr_min_pct': 0.011150702322856405, 'atr_max_pct': 0.09966696196331531, 'tp_mult': 2.378042860721221, 'tsl_mult': 0.7951350736102705, 'strategy': 'mean_reversion', 'time_stop': 138, 'use_sma': False, 'use_atr': True, 'use_adx': True, 'use_ema': False, 'use_spike': False, 'rsi_required': False, 'edge_k': 0.3347538034125651, 'edge_cap': 0.559993473321917, 'bull_strategy': 'breakout', 'bull_bb_std_mult': 2.133551169493886, 'bull_rsi_os': 45, 'bull_rsi_ob': 95, 'bull_adx_thresh': 21.376948545081884, 'bull_atr_min_pct': 0.019254114642481786, 'bull_atr_max_pct': 0.08130243648382765, 'bull_tp_mult': 2.1102585604025026, 'bull_tsl_mult': 0.775187349392034, 'bull_time_stop': 144, 'bull_use_sma': False, 'bull_use_ema': True, 'bull_use_atr': False, 'bull_use_adx': False, 'bull_use_spike': True, 'bull_rsi_required': False, 'bear_strategy': 'breakout', 'bear_bb_std_mult': 1.9045251931056222, 'bear_rsi_os': 39, 'bear_rsi_ob': 69, 'bear_adx_thresh': 11.48569774725832, 'bear_atr_min_pct': 0.004913431592822084, 'bear_atr_max_pct': 0.13179827175404854, 'bear_tp_mult': 2.429682397700841, 'bear_tsl_mult': 0.9445816199510906, 'bear_time_stop': 91, 'bear_use_sma': False, 'bear_use_ema': False, 'bear_use_atr': True, 'bear_use_adx': True, 'bear_use_spike': True, 'bear_rsi_required': True, 'sideways_strategy': 'breakout', 'sideways_bb_std_mult': 2.0285502471513484, 'sideways_rsi_os': 6, 'sideways_rsi_ob': 72, 'sideways_adx_thresh': 12.581035965653111, 'sideways_atr_min_pct': 0.003337417593910732, 'sideways_atr_max_pct': 0.07215270273409541, 'sideways_tp_mult': 1.5923035212992211, 'sideways_tsl_mult': 0.2083798220761044, 'sideways_time_stop': 146, 'sideways_use_sma': False, 'sideways_use_ema': False, 'sideways_use_atr': True, 'sideways_use_adx': True, 'sideways_use_spike': False, 'sideways_rsi_required': True}.
[I 2025-09-01 09:11:29,944] Trial 47 finished with values: [-1000000000.0, 1000000000.0] and parameters: {'p_sma': 56, 'p_std': 44, 'p_atr': 16, 'p_adx': 25, 'rsi_period': 30, 'ema1': 30, 'ema2': 48, 'slip_atr_k': 0.15347901960907823, 'slip_spread_k': 0.29083239446634174, 'spread_hl_frac': 0.02155143194167801, 'bb_std_mult': 0.9375384668712754, 'rsi_os': 37, 'rsi_ob': 50, 'vol_spike': 0.28730272835713194, 'adx_thresh': 27.256354871431373, 'atr_min_pct': 0.011209288775179772, 'atr_max_pct': 0.10423819859393234, 'tp_mult': 2.367917419661974, 'tsl_mult': 0.8091685231996706, 'strategy': 'breakout', 'time_stop': 107, 'use_sma': False, 'use_atr': True, 'use_adx': True, 'use_ema': True, 'use_spike': False, 'rsi_required': False, 'edge_k': 1.8749511666633079, 'edge_cap': 0.5773382522872671, 'bull_strategy': 'breakout', 'bull_bb_std_mult': 2.0972196679697457, 'bull_rsi_os': 42, 'bull_rsi_ob': 53, 'bull_adx_thresh': 14.802329820599851, 'bull_atr_min_pct': 0.019078897447049093, 'bull_atr_max_pct': 0.07747056407300554, 'bull_tp_mult': 2.010888427597612, 'bull_tsl_mult': 0.9468241730756906, 'bull_time_stop': 128, 'bull_use_sma': False, 'bull_use_ema': True, 'bull_use_atr': False, 'bull_use_adx': False, 'bull_use_spike': True, 'bull_rsi_required': False, 'bear_strategy': 'breakout', 'bear_bb_std_mult': 1.9272099368874915, 'bear_rsi_os': 35, 'bear_rsi_ob': 92, 'bear_adx_thresh': 11.883202017588566, 'bear_atr_min_pct': 0.005436181710133598, 'bear_atr_max_pct': 0.07232349315832408, 'bear_tp_mult': 1.8200810031454526, 'bear_tsl_mult': 0.0974761372997284, 'bear_time_stop': 126, 'bear_use_sma': False, 'bear_use_ema': False, 'bear_use_atr': False, 'bear_use_adx': True, 'bear_use_spike': True, 'bear_rsi_required': True, 'sideways_strategy': 'breakout', 'sideways_bb_std_mult': 1.9789500452889202, 'sideways_rsi_os': 23, 'sideways_rsi_ob': 93, 'sideways_adx_thresh': 11.177674642757658, 'sideways_atr_min_pct': 0.00369747932391375, 'sideways_atr_max_pct': 0.07511405158313537, 'sideways_tp_mult': 2.993504397935649, 'sideways_tsl_mult': 0.126983547365065, 'sideways_time_stop': 249, 'sideways_use_sma': False, 'sideways_use_ema': False, 'sideways_use_atr': True, 'sideways_use_adx': True, 'sideways_use_spike': False, 'sideways_rsi_required': True}.
[I 2025-09-01 09:11:30,275] Trial 48 finished with values: [-0.2583994635821548, 0.2583141092429678] and parameters: {'p_sma': 45, 'p_std': 44, 'p_atr': 15, 'p_adx': 10, 'rsi_period': 31, 'ema1': 29, 'ema2': 49, 'slip_atr_k': 0.14797718143456423, 'slip_spread_k': 0.3314104368653392, 'spread_hl_frac': 0.03430700148037327, 'bb_std_mult': 3.376090745160603, 'rsi_os': 38, 'rsi_ob': 61, 'vol_spike': 0.17638873252538373, 'adx_thresh': 9.91016235879271, 'atr_min_pct': 0.014617292335817187, 'atr_max_pct': 0.10079015461581874, 'tp_mult': 2.386110875124348, 'tsl_mult': 0.10929079232572098, 'strategy': 'breakout', 'time_stop': 131, 'use_sma': False, 'use_atr': True, 'use_adx': True, 'use_ema': True, 'use_spike': False, 'rsi_required': False, 'edge_k': 1.8598292436561548, 'edge_cap': 0.061367529267560395, 'bull_strategy': 'breakout', 'bull_bb_std_mult': 0.8853468933361873, 'bull_rsi_os': 46, 'bull_rsi_ob': 53, 'bull_adx_thresh': 20.918491785809493, 'bull_atr_min_pct': 0.019201828533202632, 'bull_atr_max_pct': 0.1066368052790345, 'bull_tp_mult': 1.5499222941449464, 'bull_tsl_mult': 0.9726197044801155, 'bull_time_stop': 235, 'bull_use_sma': False, 'bull_use_ema': True, 'bull_use_atr': False, 'bull_use_adx': False, 'bull_use_spike': True, 'bull_rsi_required': False, 'bear_strategy': 'breakout', 'bear_bb_std_mult': 1.29113577305368, 'bear_rsi_os': 20, 'bear_rsi_ob': 70, 'bear_adx_thresh': 24.18313703047044, 'bear_atr_min_pct': 0.007767876245212509, 'bear_atr_max_pct': 0.11138469722468639, 'bear_tp_mult': 1.8461521814037014, 'bear_tsl_mult': 0.0961695418032722, 'bear_time_stop': 127, 'bear_use_sma': False, 'bear_use_ema': False, 'bear_use_atr': False, 'bear_use_adx': True, 'bear_use_spike': True, 'bear_rsi_required': True, 'sideways_strategy': 'breakout', 'sideways_bb_std_mult': 3.5566692852721307, 'sideways_rsi_os': 23, 'sideways_rsi_ob': 51, 'sideways_adx_thresh': 12.448941240825706, 'sideways_atr_min_pct': 0.0004755249442721949, 'sideways_atr_max_pct': 0.0710983052607419, 'sideways_tp_mult': 1.6171156491672214, 'sideways_tsl_mult': 0.9314744087356857, 'sideways_time_stop': 69, 'sideways_use_sma': False, 'sideways_use_ema': False, 'sideways_use_atr': True, 'sideways_use_adx': True, 'sideways_use_spike': False, 'sideways_rsi_required': True}.
[I 2025-09-01 09:11:30,666] Trial 53 finished with values: [-1000000000.0, 1000000000.0] and parameters: {'p_sma': 18, 'p_std': 40, 'p_atr': 11, 'p_adx': 22, 'rsi_period': 84, 'ema1': 19, 'ema2': 24, 'slip_atr_k': 0.18598001818783214, 'slip_spread_k': 0.16121352892282123, 'spread_hl_frac': 0.003275425659680059, 'bb_std_mult': 2.0448036654048183, 'rsi_os': 52, 'rsi_ob': 74, 'vol_spike': 0.12611414593582515, 'adx_thresh': 7.14370245633024, 'atr_min_pct': 0.00041879142321879503, 'atr_max_pct': 0.0672615307064539, 'tp_mult': 2.0589609770370947, 'tsl_mult': 0.26822818461919684, 'strategy': 'mean_reversion', 'time_stop': 82, 'use_sma': False, 'use_atr': False, 'use_adx': True, 'use_ema': False, 'use_spike': False, 'rsi_required': False, 'edge_k': 0.6235182828508782, 'edge_cap': 0.45305651355503, 'bull_strategy': 'breakout', 'bull_bb_std_mult': 1.349689165338638, 'bull_rsi_os': 25, 'bull_rsi_ob': 83, 'bull_adx_thresh': 24.865238327067605, 'bull_atr_min_pct': 0.011872616950505992, 'bull_atr_max_pct': 0.02027149225740009, 'bull_tp_mult': 1.017236003063479, 'bull_tsl_mult': 0.5190533047843683, 'bull_time_stop': 68, 'bull_use_sma': True, 'bull_use_ema': True, 'bull_use_atr': False, 'bull_use_adx': True, 'bull_use_spike': True, 'bull_rsi_required': False, 'bear_strategy': 'breakout', 'bear_bb_std_mult': 2.478757781605645, 'bear_rsi_os': 31, 'bear_rsi_ob': 59, 'bear_adx_thresh': 14.459490852622963, 'bear_atr_min_pct': 0.0009941862804349264, 'bear_atr_max_pct': 0.021068343683780445, 'bear_tp_mult': 2.246317678205232, 'bear_tsl_mult': 0.36345917165887137, 'bear_time_stop': 64, 'bear_use_sma': False, 'bear_use_ema': False, 'bear_use_atr': False, 'bear_use_adx': True, 'bear_use_spike': True, 'bear_rsi_required': True, 'sideways_strategy': 'mean_reversion', 'sideways_bb_std_mult': 3.2167609117397307, 'sideways_rsi_os': 29, 'sideways_rsi_ob': 82, 'sideways_adx_thresh': 25.82210783368662, 'sideways_atr_min_pct': 0.017515916256840697, 'sideways_atr_max_pct': 0.028854380362678025, 'sideways_tp_mult': 2.658373089231599, 'sideways_tsl_mult': 0.2859369621731058, 'sideways_time_stop': 232, 'sideways_use_sma': False, 'sideways_use_ema': False, 'sideways_use_atr': True, 'sideways_use_adx': True, 'sideways_use_spike': True, 'sideways_rsi_required': True}.
[I 2025-09-01 09:12:08,757] Trial 51 finished with values: [-1000000000.0, 1000000000.0] and parameters: {'p_sma': 15, 'p_std': 40, 'p_atr': 21, 'p_adx': 22, 'rsi_period': 76, 'ema1': 19, 'ema2': 25, 'slip_atr_k': 0.1831954349296486, 'slip_spread_k': 0.32537277828437083, 'spread_hl_frac': 0.0012937676473973904, 'bb_std_mult': 3.3084406193858227, 'rsi_os': 37, 'rsi_ob': 59, 'vol_spike': 0.17616672657638122, 'adx_thresh': 7.671762762133136, 'atr_min_pct': 8.467918919731823e-06, 'atr_max_pct': 0.0653673002358874, 'tp_mult': 1.971867347623213, 'tsl_mult': 0.2478473950248125, 'strategy': 'breakout', 'time_stop': 107, 'use_sma': False, 'use_atr': True, 'use_adx': True, 'use_ema': True, 'use_spike': False, 'rsi_required': False, 'edge_k': 1.8714118633147927, 'edge_cap': 0.841165125201236, 'bull_strategy': 'breakout', 'bull_bb_std_mult': 2.3106340458234595, 'bull_rsi_os': 12, 'bull_rsi_ob': 53, 'bull_adx_thresh': 14.092409185896138, 'bull_atr_min_pct': 0.010819974817132228, 'bull_atr_max_pct': 0.14967589353570104, 'bull_tp_mult': 1.5687920512875935, 'bull_tsl_mult': 0.6237287107869215, 'bull_time_stop': 187, 'bull_use_sma': False, 'bull_use_ema': True, 'bull_use_atr': False, 'bull_use_adx': False, 'bull_use_spike': True, 'bull_rsi_required': False, 'bear_strategy': 'breakout', 'bear_bb_std_mult': 2.534465806029497, 'bear_rsi_os': 20, 'bear_rsi_ob': 59, 'bear_adx_thresh': 24.8560139363968, 'bear_atr_min_pct': 0.008913017271082851, 'bear_atr_max_pct': 0.08804189360846564, 'bear_tp_mult': 2.242273763239369, 'bear_tsl_mult': 0.35373908871409676, 'bear_time_stop': 65, 'bear_use_sma': False, 'bear_use_ema': False, 'bear_use_atr': False, 'bear_use_adx': True, 'bear_use_spike': True, 'bear_rsi_required': True, 'sideways_strategy': 'mean_reversion', 'sideways_bb_std_mult': 1.2691332980586476, 'sideways_rsi_os': 28, 'sideways_rsi_ob': 82, 'sideways_adx_thresh': 25.59894210240169, 'sideways_atr_min_pct': 0.01769316343773751, 'sideways_atr_max_pct': 0.09982355837713498, 'sideways_tp_mult': 2.173732817143548, 'sideways_tsl_mult': 0.26696128231040983, 'sideways_time_stop': 229, 'sideways_use_sma': False, 'sideways_use_ema': False, 'sideways_use_atr': True, 'sideways_use_adx': True, 'sideways_use_spike': False, 'sideways_rsi_required': True}.
[I 2025-09-01 09:12:10,102] Trial 52 finished with values: [-1000000000.0, 1000000000.0] and parameters: {'p_sma': 20, 'p_std': 40, 'p_atr': 11, 'p_adx': 8, 'rsi_period': 73, 'ema1': 24, 'ema2': 24, 'slip_atr_k': 0.195188603332777, 'slip_spread_k': 0.18193131922609707, 'spread_hl_frac': 0.0011921983488756907, 'bb_std_mult': 3.3245945018936434, 'rsi_os': 17, 'rsi_ob': 61, 'vol_spike': 0.17803431707241538, 'adx_thresh': 7.346776205098278, 'atr_min_pct': 0.0006478860787528604, 'atr_max_pct': 0.011268308313603231, 'tp_mult': 2.0721978685713798, 'tsl_mult': 0.273487959881381, 'strategy': 'mean_reversion', 'time_stop': 78, 'use_sma': False, 'use_atr': False, 'use_adx': True, 'use_ema': True, 'use_spike': False, 'rsi_required': False, 'edge_k': 0.6308691964852676, 'edge_cap': 0.8829261139851899, 'bull_strategy': 'breakout', 'bull_bb_std_mult': 1.6685968032955978, 'bull_rsi_os': 49, 'bull_rsi_ob': 83, 'bull_adx_thresh': 24.212529490164645, 'bull_atr_min_pct': 0.011176905467937287, 'bull_atr_max_pct': 0.021384129401039877, 'bull_tp_mult': 1.5213181303412617, 'bull_tsl_mult': 0.6250165183816556, 'bull_time_stop': 184, 'bull_use_sma': True, 'bull_use_ema': True, 'bull_use_atr': False, 'bull_use_adx': True, 'bull_use_spike': True, 'bull_rsi_required': False, 'bear_strategy': 'breakout', 'bear_bb_std_mult': 2.499794044846642, 'bear_rsi_os': 31, 'bear_rsi_ob': 59, 'bear_adx_thresh': 14.549054180110687, 'bear_atr_min_pct': 0.009111100786307148, 'bear_atr_max_pct': 0.01875748188343373, 'bear_tp_mult': 2.047181261650308, 'bear_tsl_mult': 0.34344826137981044, 'bear_time_stop': 64, 'bear_use_sma': False, 'bear_use_ema': False, 'bear_use_atr': False, 'bear_use_adx': True, 'bear_use_spike': True, 'bear_rsi_required': True, 'sideways_strategy': 'mean_reversion', 'sideways_bb_std_mult': 0.737329878571829, 'sideways_rsi_os': 18, 'sideways_rsi_ob': 49, 'sideways_adx_thresh': 25.837844747006553, 'sideways_atr_min_pct': 0.017192692988375467, 'sideways_atr_max_pct': 0.021058886364058733, 'sideways_tp_mult': 2.7263547895404474, 'sideways_tsl_mult': 0.9425966168801164, 'sideways_time_stop': 187, 'sideways_use_sma': False, 'sideways_use_ema': False, 'sideways_use_atr': True, 'sideways_use_adx': True, 'sideways_use_spike': True, 'sideways_rsi_required': True}.
[I 2025-09-01 09:12:11,053] Trial 54 finished with values: [-0.03366326212492221, 0.03375096757720253] and parameters: {'p_sma': 28, 'p_std': 20, 'p_atr': 21, 'p_adx': 8, 'rsi_period': 72, 'ema1': 15, 'ema2': 30, 'slip_atr_k': 0.11568730817786067, 'slip_spread_k': 0.9888366997694558, 'spread_hl_frac': 0.027159003144121955, 'bb_std_mult': 1.6611977248945071, 'rsi_os': 24, 'rsi_ob': 68, 'vol_spike': 0.14818720355280585, 'adx_thresh': 30.16318854373199, 'atr_min_pct': 0.01762466564770461, 'atr_max_pct': 0.07907618997833576, 'tp_mult': 1.2731680795789728, 'tsl_mult': 0.9092908840333482, 'strategy': 'mean_reversion', 'time_stop': 77, 'use_sma': False, 'use_atr': False, 'use_adx': True, 'use_ema': False, 'use_spike': False, 'rsi_required': True, 'edge_k': 0.4781915114984083, 'edge_cap': 0.8219908822555007, 'bull_strategy': 'breakout', 'bull_bb_std_mult': 2.3226471176152943, 'bull_rsi_os': 8, 'bull_rsi_ob': 48, 'bull_adx_thresh': 13.25057573785401, 'bull_atr_min_pct': 0.002076453424230962, 'bull_atr_max_pct': 0.06276948016049895, 'bull_tp_mult': 2.3234662989858172, 'bull_tsl_mult': 0.6148632264895023, 'bull_time_stop': 299, 'bull_use_sma': True, 'bull_use_ema': True, 'bull_use_atr': False, 'bull_use_adx': True, 'bull_use_spike': True, 'bull_rsi_required': False, 'bear_strategy': 'mean_reversion', 'bear_bb_std_mult': 2.16234380207915, 'bear_rsi_os': 12, 'bear_rsi_ob': 85, 'bear_adx_thresh': 18.17290860898045, 'bear_atr_min_pct': 0.02039438582985809, 'bear_atr_max_pct': 0.08790471420741655, 'bear_tp_mult': 2.0484253413267783, 'bear_tsl_mult': 0.3288578730223116, 'bear_time_stop': 102, 'bear_use_sma': False, 'bear_use_ema': False, 'bear_use_atr': False, 'bear_use_adx': True, 'bear_use_spike': True, 'bear_rsi_required': True, 'sideways_strategy': 'mean_reversion', 'sideways_bb_std_mult': 0.7240429945239857, 'sideways_rsi_os': 12, 'sideways_rsi_ob': 79, 'sideways_adx_thresh': 31.41394649647315, 'sideways_atr_min_pct': 0.010354374810054951, 'sideways_atr_max_pct': 0.09611785458279869, 'sideways_tp_mult': 2.2001349031356554, 'sideways_tsl_mult': 0.5445973383070951, 'sideways_time_stop': 115, 'sideways_use_sma': False, 'sideways_use_ema': False, 'sideways_use_atr': True, 'sideways_use_adx': True, 'sideways_use_spike': True, 'sideways_rsi_required': True}.
