[I 2025-09-01 09:15:31,300] Trial 79 finished with values: [-0.19530436593889244, 0.19520824321769625] and parameters: {'p_sma': 30, 'p_std': 5, 'p_atr': 24, 'p_adx': 24, 'rsi_period': 10, 'ema1': 7, 'ema2': 15, 'slip_atr_k': 0.04946693211173357, 'slip_spread_k': 0.8986573653482315, 'spread_hl_frac': 0.018085926689469164, 'bb_std_mult': 2.9981510238839344, 'rsi_os': 40, 'rsi_ob': 53, 'vol_spike': 0.13868683716621122, 'adx_thresh': 16.130217532496037, 'atr_min_pct': 0.014153837974266937, 'atr_max_pct': 0.027681177261433005, 'tp_mult': 2.907698844131354, 'tsl_mult': 0.5297178230736709, 'strategy': 'breakout', 'time_stop': 280, 'use_sma': True, 'use_atr': True, 'use_adx': False, 'use_ema': True, 'use_spike': True, 'rsi_required': False, 'edge_k': 0.4266389816156566, 'edge_cap': 0.35680185874830767, 'bull_strategy': 'mean_reversion', 'bull_bb_std_mult': 1.7638026210470006, 'bull_rsi_os': 44, 'bull_rsi_ob': 71, 'bull_adx_thresh': 9.950272249459104, 'bull_atr_min_pct': 0.01803222482467729, 'bull_atr_max_pct': 0.12086142782497379, 'bull_tp_mult': 2.207805644693756, 'bull_tsl_mult': 0.15155525507335604, 'bull_time_stop': 258, 'bull_use_sma': False, 'bull_use_ema': False, 'bull_use_atr': True, 'bull_use_adx': False, 'bull_use_spike': True, 'bull_rsi_required': False, 'bear_strategy': 'mean_reversion', 'bear_bb_std_mult': 0.6132344978802269, 'bear_rsi_os': 14, 'bear_rsi_ob': 45, 'bear_adx_thresh': 12.504209552096803, 'bear_atr_min_pct': 0.027580131745549984, 'bear_atr_max_pct': 0.10997341049132094, 'bear_tp_mult': 2.9258814629430385, 'bear_tsl_mult': 0.6132081968423224, 'bear_time_stop': 217, 'bear_use_sma': False, 'bear_use_ema': False, 'bear_use_atr': True, 'bear_use_adx': True, 'bear_use_spike': False, 'bear_rsi_required': False, 'sideways_strategy': 'breakout', 'sideways_bb_std_mult': 2.116736856335326, 'sideways_rsi_os': 33, 'sideways_rsi_ob': 56, 'sideways_adx_thresh': 27.600345117005556, 'sideways_atr_min_pct': 0.0006758510110034171, 'sideways_atr_max_pct': 0.07792402013073743, 'sideways_tp_mult': 1.3407557348799999, 'sideways_tsl_mult': 0.680199190695845, 'sideways_time_stop': 207, 'sideways_use_sma': True, 'sideways_use_ema': False, 'sideways_use_atr': False, 'sideways_use_adx': False, 'sideways_use_spike': False, 'sideways_rsi_required': False}.
[I 2025-09-01 09:15:31,722] Trial 82 finished with values: [-1000000000.0, 1000000000.0] and parameters: {'p_sma': 42, 'p_std': 38, 'p_atr': 29, 'p_adx': 9, 'rsi_period': 28, 'ema1': 7, 'ema2': 15, 'slip_atr_k': 0.031125652896970397, 'slip_spread_k': 0.6105358802326506, 'spread_hl_frac': 0.016231372121831643, 'bb_std_mult': 3.025333922127314, 'rsi_os': 40, 'rsi_ob': 47, 'vol_spike': 0.10684952870748761, 'adx_thresh': 11.427112395590072, 'atr_min_pct': 0.012810665818639842, 'atr_max_pct': 0.015820631013822063, 'tp_mult': 2.272531302215241, 'tsl_mult': 0.49776280896445346, 'strategy': 'mean_reversion', 'time_stop': 276, 'use_sma': True, 'use_atr': False, 'use_adx': False, 'use_ema': False, 'use_spike': True, 'rsi_required': False, 'edge_k': 1.3646655347632572, 'edge_cap': 0.43528382692607676, 'bull_strategy': 'mean_reversion', 'bull_bb_std_mult': 1.8838793307614268, 'bull_rsi_os': 42, 'bull_rsi_ob': 60, 'bull_adx_thresh': 14.224892819922736, 'bull_atr_min_pct': 0.008831894167442846, 'bull_atr_max_pct': 0.015247461360729062, 'bull_tp_mult': 2.202306694237024, 'bull_tsl_mult': 0.494326874870948, 'bull_time_stop': 258, 'bull_use_sma': True, 'bull_use_ema': False, 'bull_use_atr': True, 'bull_use_adx': False, 'bull_use_spike': False, 'bull_rsi_required': False, 'bear_strategy': 'breakout', 'bear_bb_std_mult': 0.6594629868473546, 'bear_rsi_os': 24, 'bear_rsi_ob': 57, 'bear_adx_thresh': 12.735196596846105, 'bear_atr_min_pct': 0.02758794007418705, 'bear_atr_max_pct': 0.13688949368395115, 'bear_tp_mult': 2.809171515407403, 'bear_tsl_mult': 0.6129827732736599, 'bear_time_stop': 274, 'bear_use_sma': True, 'bear_use_ema': False, 'bear_use_atr': True, 'bear_use_adx': False, 'bear_use_spike': False, 'bear_rsi_required': False, 'sideways_strategy': 'breakout', 'sideways_bb_std_mult': 1.8278760612648859, 'sideways_rsi_os': 44, 'sideways_rsi_ob': 63, 'sideways_adx_thresh': 34.12568137050518, 'sideways_atr_min_pct': 0.00011923953383388263, 'sideways_atr_max_pct': 0.03473590627391378, 'sideways_tp_mult': 1.4428997525390461, 'sideways_tsl_mult': 0.41616168972706247, 'sideways_time_stop': 240, 'sideways_use_sma': True, 'sideways_use_ema': True, 'sideways_use_atr': False, 'sideways_use_adx': False, 'sideways_use_spike': True, 'sideways_rsi_required': False}.
[I 2025-09-01 09:16:11,649] Trial 84 finished with values: [-0.008862313898949314, 0.011049809775822008] and parameters: {'p_sma': 60, 'p_std': 5, 'p_atr': 29, 'p_adx': 9, 'rsi_period': 27, 'ema1': 10, 'ema2': 13, 'slip_atr_k': 0.017831742948379976, 'slip_spread_k': 0.5306358656128569, 'spread_hl_frac': 0.017030384207103587, 'bb_std_mult': 3.041247625474645, 'rsi_os': 46, 'rsi_ob': 58, 'vol_spike': 0.15674542211886977, 'adx_thresh': 11.669349556040954, 'atr_min_pct': 0.013107253165144333, 'atr_max_pct': 0.04426466538766597, 'tp_mult': 2.991880113390975, 'tsl_mult': 0.5857208623454105, 'strategy': 'mean_reversion', 'time_stop': 167, 'use_sma': True, 'use_atr': True, 'use_adx': False, 'use_ema': False, 'use_spike': True, 'rsi_required': True, 'edge_k': 1.7263503420259219, 'edge_cap': 0.3704037507419926, 'bull_strategy': 'mean_reversion', 'bull_bb_std_mult': 2.2078449318584448, 'bull_rsi_os': 19, 'bull_rsi_ob': 64, 'bull_adx_thresh': 16.44437288164371, 'bull_atr_min_pct': 0.012778936892383956, 'bull_atr_max_pct': 0.12381987924924578, 'bull_tp_mult': 2.6194503569100993, 'bull_tsl_mult': 0.5905237409583375, 'bull_time_stop': 241, 'bull_use_sma': True, 'bull_use_ema': False, 'bull_use_atr': True, 'bull_use_adx': False, 'bull_use_spike': False, 'bull_rsi_required': True, 'bear_strategy': 'breakout', 'bear_bb_std_mult': 2.6410875388213926, 'bear_rsi_os': 25, 'bear_rsi_ob': 65, 'bear_adx_thresh': 17.652947346343087, 'bear_atr_min_pct': 0.003595526415894279, 'bear_atr_max_pct': 0.10858480114277197, 'bear_tp_mult': 2.9193161501283558, 'bear_tsl_mult': 0.6469161896299928, 'bear_time_stop': 188, 'bear_use_sma': False, 'bear_use_ema': False, 'bear_use_atr': True, 'bear_use_adx': False, 'bear_use_spike': False, 'bear_rsi_required': False, 'sideways_strategy': 'mean_reversion', 'sideways_bb_std_mult': 2.116399762062867, 'sideways_rsi_os': 43, 'sideways_rsi_ob': 72, 'sideways_adx_thresh': 5.812241536826511, 'sideways_atr_min_pct': 0.0029533974813313116, 'sideways_atr_max_pct': 0.01721421191003593, 'sideways_tp_mult': 1.2388528944532857, 'sideways_tsl_mult': 0.7275329937908761, 'sideways_time_stop': 173, 'sideways_use_sma': True, 'sideways_use_ema': True, 'sideways_use_atr': False, 'sideways_use_adx': False, 'sideways_use_spike': False, 'sideways_rsi_required': False}.
[I 2025-09-01 09:16:12,568] Trial 86 finished with values: [-1000000000.0, 1000000000.0] and parameters: {'p_sma': 60, 'p_std': 28, 'p_atr': 27, 'p_adx': 11, 'rsi_period': 50, 'ema1': 10, 'ema2': 13, 'slip_atr_k': 0.01821396402529894, 'slip_spread_k': 0.7074733873452356, 'spread_hl_frac': 0.04686894950349263, 'bb_std_mult': 2.297242284614987, 'rsi_os': 46, 'rsi_ob': 58, 'vol_spike': 0.1564488997015383, 'adx_thresh': 12.26115128793557, 'atr_min_pct': 0.015450700186656076, 'atr_max_pct': 0.11867081152709888, 'tp_mult': 2.1294860595722187, 'tsl_mult': 0.6104901145651029, 'strategy': 'mean_reversion', 'time_stop': 164, 'use_sma': True, 'use_atr': True, 'use_adx': False, 'use_ema': False, 'use_spike': True, 'rsi_required': True, 'edge_k': 1.7234235811896075, 'edge_cap': 0.2923368267479329, 'bull_strategy': 'mean_reversion', 'bull_bb_std_mult': 3.0140828615969, 'bull_rsi_os': 31, 'bull_rsi_ob': 64, 'bull_adx_thresh': 20.225645204489187, 'bull_atr_min_pct': 0.012657110547261912, 'bull_atr_max_pct': 0.09470625059096334, 'bull_tp_mult': 2.4388617124307976, 'bull_tsl_mult': 0.2726986436981087, 'bull_time_stop': 242, 'bull_use_sma': True, 'bull_use_ema': False, 'bull_use_atr': True, 'bull_use_adx': True, 'bull_use_spike': False, 'bull_rsi_required': True, 'bear_strategy': 'breakout', 'bear_bb_std_mult': 2.3831728299663695, 'bear_rsi_os': 30, 'bear_rsi_ob': 64, 'bear_adx_thresh': 17.869805623021513, 'bear_atr_min_pct': 0.02991037550981979, 'bear_atr_max_pct': 0.08300333095512567, 'bear_tp_mult': 2.887355325974803, 'bear_tsl_mult': 0.5176144204241533, 'bear_time_stop': 229, 'bear_use_sma': False, 'bear_use_ema': True, 'bear_use_atr': True, 'bear_use_adx': False, 'bear_use_spike': False, 'bear_rsi_required': False, 'sideways_strategy': 'mean_reversion', 'sideways_bb_std_mult': 2.2841825943430827, 'sideways_rsi_os': 37, 'sideways_rsi_ob': 53, 'sideways_adx_thresh': 5.93763814147464, 'sideways_atr_min_pct': 0.0030122368785995748, 'sideways_atr_max_pct': 0.09781237615925209, 'sideways_tp_mult': 2.8569822430260885, 'sideways_tsl_mult': 0.733826163667195, 'sideways_time_stop': 104, 'sideways_use_sma': True, 'sideways_use_ema': True, 'sideways_use_atr': False, 'sideways_use_adx': False, 'sideways_use_spike': False, 'sideways_rsi_required': False}.
[I 2025-09-01 09:16:12,899] Trial 85 finished with values: [-1000000000.0, 1000000000.0] and parameters: {'p_sma': 60, 'p_std': 10, 'p_atr': 27, 'p_adx': 9, 'rsi_period': 44, 'ema1': 10, 'ema2': 13, 'slip_atr_k': 0.010507287245016525, 'slip_spread_k': 0.7962682054021781, 'spread_hl_frac': 0.01636005409723985, 'bb_std_mult': 2.195523373692, 'rsi_os': 37, 'rsi_ob': 95, 'vol_spike': 0.10303203670517155, 'adx_thresh': 11.717269595457367, 'atr_min_pct': 0.013211880827724698, 'atr_max_pct': 0.11825652489524205, 'tp_mult': 2.143882145373478, 'tsl_mult': 0.5896951053075212, 'strategy': 'mean_reversion', 'time_stop': 169, 'use_sma': True, 'use_atr': True, 'use_adx': False, 'use_ema': False, 'use_spike': True, 'rsi_required': True, 'edge_k': 0.6847991309670811, 'edge_cap': 0.9630934594831506, 'bull_strategy': 'mean_reversion', 'bull_bb_std_mult': 2.2547872489868235, 'bull_rsi_os': 27, 'bull_rsi_ob': 57, 'bull_adx_thresh': 16.517760813558954, 'bull_atr_min_pct': 0.012699059535922836, 'bull_atr_max_pct': 0.02477991599931667, 'bull_tp_mult': 2.758034617261034, 'bull_tsl_mult': 0.5978163406460751, 'bull_time_stop': 240, 'bull_use_sma': True, 'bull_use_ema': False, 'bull_use_atr': True, 'bull_use_adx': True, 'bull_use_spike': False, 'bull_rsi_required': True, 'bear_strategy': 'breakout', 'bear_bb_std_mult': 1.5242407461514875, 'bear_rsi_os': 29, 'bear_rsi_ob': 61, 'bear_adx_thresh': 17.883844139251245, 'bear_atr_min_pct': 0.028625174951153357, 'bear_atr_max_pct': 0.10497502439683898, 'bear_tp_mult': 2.8909087037317662, 'bear_tsl_mult': 0.6620493106935557, 'bear_time_stop': 188, 'bear_use_sma': True, 'bear_use_ema': False, 'bear_use_atr': True, 'bear_use_adx': False, 'bear_use_spike': False, 'bear_rsi_required': False, 'sideways_strategy': 'mean_reversion', 'sideways_bb_std_mult': 1.7777403409922408, 'sideways_rsi_os': 36, 'sideways_rsi_ob': 71, 'sideways_adx_thresh': 26.459313690321363, 'sideways_atr_min_pct': 0.0029052762659976792, 'sideways_atr_max_pct': 0.09859859581206103, 'sideways_tp_mult': 1.250793542013158, 'sideways_tsl_mult': 0.7311136222028385, 'sideways_time_stop': 215, 'sideways_use_sma': True, 'sideways_use_ema': True, 'sideways_use_atr': False, 'sideways_use_adx': False, 'sideways_use_spike': True, 'sideways_rsi_required': False}.
[I 2025-09-01 09:16:13,051] Trial 83 finished with values: [-1000000000.0, 1000000000.0] and parameters: {'p_sma': 51, 'p_std': 42, 'p_atr': 29, 'p_adx': 9, 'rsi_period': 50, 'ema1': 9, 'ema2': 14, 'slip_atr_k': 0.013824251351512882, 'slip_spread_k': 0.23281143746110872, 'spread_hl_frac': 0.016381346623474825, 'bb_std_mult': 2.299251173016504, 'rsi_os': 35, 'rsi_ob': 60, 'vol_spike': 0.27425333422208925, 'adx_thresh': 34.0154836071073, 'atr_min_pct': 0.010404449512565046, 'atr_max_pct': 0.016387889831786826, 'tp_mult': 2.1499201400242827, 'tsl_mult': 0.584619507045661, 'strategy': 'mean_reversion', 'time_stop': 126, 'use_sma': True, 'use_atr': True, 'use_adx': False, 'use_ema': False, 'use_spike': True, 'rsi_required': False, 'edge_k': 0.3250441660917966, 'edge_cap': 0.4257010038428706, 'bull_strategy': 'mean_reversion', 'bull_bb_std_mult': 0.5181659093493429, 'bull_rsi_os': 19, 'bull_rsi_ob': 64, 'bull_adx_thresh': 14.538969015219132, 'bull_atr_min_pct': 0.008602883275402262, 'bull_atr_max_pct': 0.02482123953813308, 'bull_tp_mult': 2.6095947408816063, 'bull_tsl_mult': 0.49320499861159783, 'bull_time_stop': 242, 'bull_use_sma': True, 'bull_use_ema': False, 'bull_use_atr': True, 'bull_use_adx': False, 'bull_use_spike': False, 'bull_rsi_required': True, 'bear_strategy': 'breakout', 'bear_bb_std_mult': 2.370257242247138, 'bear_rsi_os': 23, 'bear_rsi_ob': 61, 'bear_adx_thresh': 18.215255781970857, 'bear_atr_min_pct': 0.02993146821168916, 'bear_atr_max_pct': 0.10966018042324215, 'bear_tp_mult': 2.9143143899938, 'bear_tsl_mult': 0.5206001274355838, 'bear_time_stop': 270, 'bear_use_sma': True, 'bear_use_ema': False, 'bear_use_atr': True, 'bear_use_adx': False, 'bear_use_spike': False, 'bear_rsi_required': False, 'sideways_strategy': 'mean_reversion', 'sideways_bb_std_mult': 1.8678207411351417, 'sideways_rsi_os': 45, 'sideways_rsi_ob': 59, 'sideways_adx_thresh': 26.596069903893568, 'sideways_atr_min_pct': 0.00010192239413500215, 'sideways_atr_max_pct': 0.07924437845788625, 'sideways_tp_mult': 1.2552563062984745, 'sideways_tsl_mult': 0.7505244992928237, 'sideways_time_stop': 242, 'sideways_use_sma': True, 'sideways_use_ema': True, 'sideways_use_atr': False, 'sideways_use_adx': False, 'sideways_use_spike': True, 'sideways_rsi_required': False}.
[I 2025-09-01 09:16:50,051] Trial 87 finished with values: [-0.013208061981344166, 0.013092999026931852] and parameters: {'p_sma': 60, 'p_std': 28, 'p_atr': 22, 'p_adx': 10, 'rsi_period': 44, 'ema1': 27, 'ema2': 13, 'slip_atr_k': 0.04392489535072158, 'slip_spread_k': 0.35994092184026627, 'spread_hl_frac': 0.04678544840838355, 'bb_std_mult': 2.3354273509668775, 'rsi_os': 36, 'rsi_ob': 95, 'vol_spike': 0.020074103872387672, 'adx_thresh': 34.73209132252151, 'atr_min_pct': 0.008985824001885835, 'atr_max_pct': 0.04569457185128174, 'tp_mult': 2.1498231008910196, 'tsl_mult': 0.591169059257368, 'strategy': 'mean_reversion', 'time_stop': 148, 'use_sma': True, 'use_atr': True, 'use_adx': False, 'use_ema': False, 'use_spike': True, 'rsi_required': True, 'edge_k': 1.7525819552879036, 'edge_cap': 0.37257422558663517, 'bull_strategy': 'mean_reversion', 'bull_bb_std_mult': 2.168039132187184, 'bull_rsi_os': 31, 'bull_rsi_ob': 86, 'bull_adx_thresh': 20.145315012310544, 'bull_atr_min_pct': 0.01279166960991168, 'bull_atr_max_pct': 0.025343609773069625, 'bull_tp_mult': 2.615134923303704, 'bull_tsl_mult': 0.5936507807851856, 'bull_time_stop': 242, 'bull_use_sma': True, 'bull_use_ema': False, 'bull_use_atr': True, 'bull_use_adx': True, 'bull_use_spike': True, 'bull_rsi_required': True, 'bear_strategy': 'breakout', 'bear_bb_std_mult': 1.5345905178764259, 'bear_rsi_os': 29, 'bear_rsi_ob': 61, 'bear_adx_thresh': 17.65434422997871, 'bear_atr_min_pct': 0.01579117469029572, 'bear_atr_max_pct': 0.08246508881831013, 'bear_tp_mult': 2.8896388319182686, 'bear_tsl_mult': 0.5255716881203415, 'bear_time_stop': 231, 'bear_use_sma': False, 'bear_use_ema': False, 'bear_use_atr': True, 'bear_use_adx': True, 'bear_use_spike': False, 'bear_rsi_required': False, 'sideways_strategy': 'mean_reversion', 'sideways_bb_std_mult': 2.270458319477895, 'sideways_rsi_os': 36, 'sideways_rsi_ob': 59, 'sideways_adx_thresh': 19.939613329662127, 'sideways_atr_min_pct': 0.0029380535907150406, 'sideways_atr_max_pct': 0.0987203074982377, 'sideways_tp_mult': 2.869325608643198, 'sideways_tsl_mult': 0.7569472215824159, 'sideways_time_stop': 94, 'sideways_use_sma': True, 'sideways_use_ema': False, 'sideways_use_atr': False, 'sideways_use_adx': False, 'sideways_use_spike': False, 'sideways_rsi_required': False}.
[I 2025-09-01 09:16:50,490] Trial 89 finished with values: [-0.014630813449950653, 0.015086281960741374] and parameters: {'p_sma': 57, 'p_std': 24, 'p_atr': 22, 'p_adx': 15, 'rsi_period': 39, 'ema1': 19, 'ema2': 18, 'slip_atr_k': 0.04100304058846016, 'slip_spread_k': 0.11292468085035101, 'spread_hl_frac': 0.01325422288476329, 'bb_std_mult': 3.5951898793555497, 'rsi_os': 42, 'rsi_ob': 55, 'vol_spike': 0.012153568604792608, 'adx_thresh': 18.423619322593574, 'atr_min_pct': 0.0235902152843171, 'atr_max_pct': 0.03471496336935007, 'tp_mult': 2.986777711049025, 'tsl_mult': 0.35035811811157425, 'strategy': 'mean_reversion', 'time_stop': 149, 'use_sma': True, 'use_atr': True, 'use_adx': False, 'use_ema': False, 'use_spike': True, 'rsi_required': False, 'edge_k': 0.8335204679843797, 'edge_cap': 0.3754437191759331, 'bull_strategy': 'mean_reversion', 'bull_bb_std_mult': 2.5398452408341177, 'bull_rsi_os': 6, 'bull_rsi_ob': 89, 'bull_adx_thresh': 17.955370151355545, 'bull_atr_min_pct': 0.001111966825547062, 'bull_atr_max_pct': 0.12339447413403276, 'bull_tp_mult': 1.9977919569392673, 'bull_tsl_mult': 0.4589573276841836, 'bull_time_stop': 16, 'bull_use_sma': False, 'bull_use_ema': False, 'bull_use_atr': True, 'bull_use_adx': False, 'bull_use_spike': True, 'bull_rsi_required': False, 'bear_strategy': 'breakout', 'bear_bb_std_mult': 1.3443586672501286, 'bear_rsi_os': 28, 'bear_rsi_ob': 66, 'bear_adx_thresh': 10.458433869766772, 'bear_atr_min_pct': 0.0034413603441739975, 'bear_atr_max_pct': 0.09164664773379481, 'bear_tp_mult': 2.940986611643163, 'bear_tsl_mult': 0.7134895065054234, 'bear_time_stop': 256, 'bear_use_sma': False, 'bear_use_ema': False, 'bear_use_atr': True, 'bear_use_adx': True, 'bear_use_spike': False, 'bear_rsi_required': False, 'sideways_strategy': 'mean_reversion', 'sideways_bb_std_mult': 2.0932096507471045, 'sideways_rsi_os': 22, 'sideways_rsi_ob': 74, 'sideways_adx_thresh': 22.855222950308782, 'sideways_atr_min_pct': 0.004370624862744064, 'sideways_atr_max_pct': 0.08998804288322887, 'sideways_tp_mult': 1.1861144767233158, 'sideways_tsl_mult': 0.81440732407328, 'sideways_time_stop': 176, 'sideways_use_sma': True, 'sideways_use_ema': False, 'sideways_use_atr': False, 'sideways_use_adx': False, 'sideways_use_spike': False, 'sideways_rsi_required': False}.
[I 2025-09-01 09:16:50,810] Trial 88 finished with values: [-1000000000.0, 1000000000.0] and parameters: {'p_sma': 57, 'p_std': 31, 'p_atr': 7, 'p_adx': 9, 'rsi_period': 45, 'ema1': 27, 'ema2': 12, 'slip_atr_k': 0.04306648604487094, 'slip_spread_k': 0.3566796551193674, 'spread_hl_frac': 0.013684700081114352, 'bb_std_mult': 2.513957850321921, 'rsi_os': 36, 'rsi_ob': 83, 'vol_spike': 0.26564389598467586, 'adx_thresh': 32.87864116919616, 'atr_min_pct': 0.023326172023641796, 'atr_max_pct': 0.035055582454749955, 'tp_mult': 2.963250618094747, 'tsl_mult': 0.3688284958392083, 'strategy': 'mean_reversion', 'time_stop': 143, 'use_sma': True, 'use_atr': True, 'use_adx': False, 'use_ema': False, 'use_spike': True, 'rsi_required': False, 'edge_k': 0.31071922901981963, 'edge_cap': 0.943670933098744, 'bull_strategy': 'mean_reversion', 'bull_bb_std_mult': 0.503482625402119, 'bull_rsi_os': 19, 'bull_rsi_ob': 75, 'bull_adx_thresh': 16.611604778893533, 'bull_atr_min_pct': 0.027603948069458067, 'bull_atr_max_pct': 0.025409138174781177, 'bull_tp_mult': 2.7617515275573425, 'bull_tsl_mult': 0.5859467510294634, 'bull_time_stop': 157, 'bull_use_sma': False, 'bull_use_ema': False, 'bull_use_atr': True, 'bull_use_adx': False, 'bull_use_spike': True, 'bull_rsi_required': True, 'bear_strategy': 'breakout', 'bear_bb_std_mult': 1.5174936345201229, 'bear_rsi_os': 25, 'bear_rsi_ob': 61, 'bear_adx_thresh': 17.281436637667664, 'bear_atr_min_pct': 0.010191519204151907, 'bear_atr_max_pct': 0.10460079305520734, 'bear_tp_mult': 2.9412562179681756, 'bear_tsl_mult': 0.6614587443724389, 'bear_time_stop': 225, 'bear_use_sma': False, 'bear_use_ema': False, 'bear_use_atr': True, 'bear_use_adx': True, 'bear_use_spike': False, 'bear_rsi_required': False, 'sideways_strategy': 'mean_reversion', 'sideways_bb_std_mult': 2.089139397023128, 'sideways_rsi_os': 29, 'sideways_rsi_ob': 71, 'sideways_adx_thresh': 26.281853625667217, 'sideways_atr_min_pct': 0.00449487500649795, 'sideways_atr_max_pct': 0.015828414822392875, 'sideways_tp_mult': 1.2041643557891448, 'sideways_tsl_mult': 0.8171375087602135, 'sideways_time_stop': 213, 'sideways_use_sma': True, 'sideways_use_ema': False, 'sideways_use_atr': False, 'sideways_use_adx': False, 'sideways_use_spike': False, 'sideways_rsi_required': False}.
