[I 2025-09-01 10:15:37,920] Trial 439 finished with values: [-0.012764782065092573, 0.012468976730033441] and parameters: {'p_sma': 47, 'p_std': 10, 'p_atr': 17, 'p_adx': 10, 'rsi_period': 45, 'ema1': 8, 'ema2': 60, 'slip_atr_k': 0.029895776930259018, 'slip_spread_k': 0.593251248998447, 'spread_hl_frac': 0.007326511777982088, 'bb_std_mult': 2.091193509804007, 'rsi_os': 8, 'rsi_ob': 82, 'vol_spike': 0.1954394009058712, 'adx_thresh': 23.754413038299255, 'atr_min_pct': 0.016733094043903714, 'atr_max_pct': 0.028318714866460773, 'tp_mult': 2.5266131881166376, 'tsl_mult': 0.8084807287326213, 'strategy': 'breakout', 'time_stop': 64, 'use_sma': True, 'use_atr': False, 'use_adx': False, 'use_ema': False, 'use_spike': True, 'rsi_required': True, 'edge_k': 1.4881312301217866, 'edge_cap': 0.15027698824195507, 'bull_strategy': 'mean_reversion', 'bull_bb_std_mult': 3.4194851238719672, 'bull_rsi_os': 14, 'bull_rsi_ob': 77, 'bull_adx_thresh': 27.266834210747163, 'bull_atr_min_pct': 0.0034271436555471865, 'bull_atr_max_pct': 0.14231900560665553, 'bull_tp_mult': 1.0284993560398967, 'bull_tsl_mult': 0.4536656861868123, 'bull_time_stop': 56, 'bull_use_sma': True, 'bull_use_ema': False, 'bull_use_atr': False, 'bull_use_adx': True, 'bull_use_spike': True, 'bull_rsi_required': False, 'bear_strategy': 'breakout', 'bear_bb_std_mult': 1.586635344942381, 'bear_rsi_os': 22, 'bear_rsi_ob': 92, 'bear_adx_thresh': 33.69552262481618, 'bear_atr_min_pct': 0.027595790053890294, 'bear_atr_max_pct': 0.12373813164984714, 'bear_tp_mult': 2.798984606652516, 'bear_tsl_mult': 0.8571271257375924, 'bear_time_stop': 11, 'bear_use_sma': False, 'bear_use_ema': False, 'bear_use_atr': True, 'bear_use_adx': False, 'bear_use_spike': True, 'bear_rsi_required': False, 'sideways_strategy': 'mean_reversion', 'sideways_bb_std_mult': 2.72059280658156, 'sideways_rsi_os': 31, 'sideways_rsi_ob': 60, 'sideways_adx_thresh': 19.20723364249003, 'sideways_atr_min_pct': 0.00581430037098573, 'sideways_atr_max_pct': 0.11787392670274066, 'sideways_tp_mult': 2.6292299362969453, 'sideways_tsl_mult': 0.8722136072374123, 'sideways_time_stop': 236, 'sideways_use_sma': True, 'sideways_use_ema': True, 'sideways_use_atr': True, 'sideways_use_adx': False, 'sideways_use_spike': False, 'sideways_rsi_required': True}.
[I 2025-09-01 10:16:15,822] Trial 444 finished with values: [-1000000000.0, 1000000000.0] and parameters: {'p_sma': 46, 'p_std': 50, 'p_atr': 28, 'p_adx': 11, 'rsi_period': 81, 'ema1': 10, 'ema2': 18, 'slip_atr_k': 0.027858229440704565, 'slip_spread_k': 0.062457970248904704, 'spread_hl_frac': 0.034464380873876425, 'bb_std_mult': 2.6781031230791488, 'rsi_os': 33, 'rsi_ob': 85, 'vol_spike': 0.2496251020422781, 'adx_thresh': 10.12669520305986, 'atr_min_pct': 0.01914363063572891, 'atr_max_pct': 0.1276563284513103, 'tp_mult': 2.639711194692562, 'tsl_mult': 0.6155782637286087, 'strategy': 'mean_reversion', 'time_stop': 129, 'use_sma': False, 'use_atr': False, 'use_adx': True, 'use_ema': True, 'use_spike': True, 'rsi_required': True, 'edge_k': 0.5362749866753389, 'edge_cap': 0.14136595453509837, 'bull_strategy': 'mean_reversion', 'bull_bb_std_mult': 3.4475341297810926, 'bull_rsi_os': 34, 'bull_rsi_ob': 94, 'bull_adx_thresh': 12.501821758400471, 'bull_atr_min_pct': 0.017005260472162723, 'bull_atr_max_pct': 0.07449710650154917, 'bull_tp_mult': 1.534338759767479, 'bull_tsl_mult': 0.4521505671146361, 'bull_time_stop': 64, 'bull_use_sma': True, 'bull_use_ema': False, 'bull_use_atr': False, 'bull_use_adx': False, 'bull_use_spike': False, 'bull_rsi_required': True, 'bear_strategy': 'breakout', 'bear_bb_std_mult': 2.03737545124983, 'bear_rsi_os': 41, 'bear_rsi_ob': 71, 'bear_adx_thresh': 32.866614244476864, 'bear_atr_min_pct': 0.028915330345719463, 'bear_atr_max_pct': 0.1257536063359763, 'bear_tp_mult': 2.4816323132648535, 'bear_tsl_mult': 0.7294074798857982, 'bear_time_stop': 11, 'bear_use_sma': False, 'bear_use_ema': False, 'bear_use_atr': False, 'bear_use_adx': True, 'bear_use_spike': True, 'bear_rsi_required': True, 'sideways_strategy': 'mean_reversion', 'sideways_bb_std_mult': 2.733918271621308, 'sideways_rsi_os': 30, 'sideways_rsi_ob': 57, 'sideways_adx_thresh': 32.773543395591375, 'sideways_atr_min_pct': 0.0030223132076021737, 'sideways_atr_max_pct': 0.12705224456835956, 'sideways_tp_mult': 2.358554549528309, 'sideways_tsl_mult': 0.36706030803435885, 'sideways_time_stop': 239, 'sideways_use_sma': True, 'sideways_use_ema': False, 'sideways_use_atr': True, 'sideways_use_adx': True, 'sideways_use_spike': False, 'sideways_rsi_required': True}.
[I 2025-09-01 10:16:16,303] Trial 443 finished with values: [-0.01597686042187474, 0.01581227576556387] and parameters: {'p_sma': 27, 'p_std': 9, 'p_atr': 20, 'p_adx': 25, 'rsi_period': 45, 'ema1': 8, 'ema2': 12, 'slip_atr_k': 0.23791969312543607, 'slip_spread_k': 0.06493396158475223, 'spread_hl_frac': 0.03546639040438258, 'bb_std_mult': 0.6941871580812855, 'rsi_os': 7, 'rsi_ob': 89, 'vol_spike': 0.1798314257700128, 'adx_thresh': 26.16779646821248, 'atr_min_pct': 0.01662754866282116, 'atr_max_pct': 0.02133363269825514, 'tp_mult': 2.309799225573194, 'tsl_mult': 0.3842963945214425, 'strategy': 'mean_reversion', 'time_stop': 147, 'use_sma': False, 'use_atr': True, 'use_adx': False, 'use_ema': True, 'use_spike': True, 'rsi_required': False, 'edge_k': 0.5049105050644498, 'edge_cap': 0.7673502892655746, 'bull_strategy': 'mean_reversion', 'bull_bb_std_mult': 3.4198350986604016, 'bull_rsi_os': 42, 'bull_rsi_ob': 64, 'bull_adx_thresh': 7.440723125981659, 'bull_atr_min_pct': 0.0054313222852240975, 'bull_atr_max_pct': 0.11681761177896038, 'bull_tp_mult': 1.5313641158570346, 'bull_tsl_mult': 0.015045066454881406, 'bull_time_stop': 132, 'bull_use_sma': True, 'bull_use_ema': False, 'bull_use_atr': True, 'bull_use_adx': False, 'bull_use_spike': False, 'bull_rsi_required': False, 'bear_strategy': 'breakout', 'bear_bb_std_mult': 2.012277404433868, 'bear_rsi_os': 8, 'bear_rsi_ob': 70, 'bear_adx_thresh': 32.456117059139984, 'bear_atr_min_pct': 0.027378122215721667, 'bear_atr_max_pct': 0.12308818678542285, 'bear_tp_mult': 1.0566139757827209, 'bear_tsl_mult': 0.769260274004667, 'bear_time_stop': 25, 'bear_use_sma': False, 'bear_use_ema': False, 'bear_use_atr': False, 'bear_use_adx': True, 'bear_use_spike': True, 'bear_rsi_required': False, 'sideways_strategy': 'mean_reversion', 'sideways_bb_std_mult': 1.1491452918003806, 'sideways_rsi_os': 30, 'sideways_rsi_ob': 45, 'sideways_adx_thresh': 9.574802131471605, 'sideways_atr_min_pct': 0.0029771787733362098, 'sideways_atr_max_pct': 0.14031594557084257, 'sideways_tp_mult': 1.6246012552160307, 'sideways_tsl_mult': 0.9536803521904569, 'sideways_time_stop': 102, 'sideways_use_sma': True, 'sideways_use_ema': False, 'sideways_use_atr': False, 'sideways_use_adx': True, 'sideways_use_spike': False, 'sideways_rsi_required': False}.
[I 2025-09-01 10:16:16,865] Trial 442 finished with values: [-1000000000.0, 1000000000.0] and parameters: {'p_sma': 47, 'p_std': 9, 'p_atr': 7, 'p_adx': 12, 'rsi_period': 80, 'ema1': 18, 'ema2': 60, 'slip_atr_k': 0.031359361356968526, 'slip_spread_k': 0.06541274010920478, 'spread_hl_frac': 0.037658131051756506, 'bb_std_mult': 2.2386165106009743, 'rsi_os': 8, 'rsi_ob': 79, 'vol_spike': 0.09920485645549756, 'adx_thresh': 11.170217405251687, 'atr_min_pct': 0.019259769094452463, 'atr_max_pct': 0.058397501261315654, 'tp_mult': 2.5278261133971363, 'tsl_mult': 0.8601947862453089, 'strategy': 'mean_reversion', 'time_stop': 257, 'use_sma': False, 'use_atr': False, 'use_adx': False, 'use_ema': False, 'use_spike': True, 'rsi_required': True, 'edge_k': 1.3085128595543059, 'edge_cap': 0.5057008909333909, 'bull_strategy': 'mean_reversion', 'bull_bb_std_mult': 3.4377876627113886, 'bull_rsi_os': 40, 'bull_rsi_ob': 89, 'bull_adx_thresh': 25.593393673701307, 'bull_atr_min_pct': 0.01887819702646145, 'bull_atr_max_pct': 0.09992277313409023, 'bull_tp_mult': 2.1158694095585546, 'bull_tsl_mult': 0.9662350635282126, 'bull_time_stop': 107, 'bull_use_sma': True, 'bull_use_ema': False, 'bull_use_atr': False, 'bull_use_adx': False, 'bull_use_spike': True, 'bull_rsi_required': False, 'bear_strategy': 'breakout', 'bear_bb_std_mult': 2.0509563369200863, 'bear_rsi_os': 41, 'bear_rsi_ob': 68, 'bear_adx_thresh': 32.73320223169628, 'bear_atr_min_pct': 0.027626651936134228, 'bear_atr_max_pct': 0.12319804421999125, 'bear_tp_mult': 2.8112862875854234, 'bear_tsl_mult': 0.8461798156617694, 'bear_time_stop': 25, 'bear_use_sma': False, 'bear_use_ema': False, 'bear_use_atr': True, 'bear_use_adx': True, 'bear_use_spike': True, 'bear_rsi_required': False, 'sideways_strategy': 'mean_reversion', 'sideways_bb_std_mult': 2.7203703859887147, 'sideways_rsi_os': 31, 'sideways_rsi_ob': 79, 'sideways_adx_thresh': 32.92645675928819, 'sideways_atr_min_pct': 0.003239943320843853, 'sideways_atr_max_pct': 0.0818305845639341, 'sideways_tp_mult': 2.6514177339803386, 'sideways_tsl_mult': 0.3255309276056768, 'sideways_time_stop': 238, 'sideways_use_sma': True, 'sideways_use_ema': False, 'sideways_use_atr': True, 'sideways_use_adx': True, 'sideways_use_spike': False, 'sideways_rsi_required': True}.
[I 2025-09-01 10:16:17,410] Trial 445 finished with values: [-1000000000.0, 1000000000.0] and parameters: {'p_sma': 57, 'p_std': 57, 'p_atr': 28, 'p_adx': 25, 'rsi_period': 49, 'ema1': 6, 'ema2': 18, 'slip_atr_k': 0.008886707436277804, 'slip_spread_k': 0.8481236715420444, 'spread_hl_frac': 0.004721646960536521, 'bb_std_mult': 2.5917547680150377, 'rsi_os': 30, 'rsi_ob': 75, 'vol_spike': 0.2952862297024589, 'adx_thresh': 9.937832786433285, 'atr_min_pct': 0.019273919986165032, 'atr_max_pct': 0.13797666295444638, 'tp_mult': 2.4470040953784653, 'tsl_mult': 0.8626058212927863, 'strategy': 'mean_reversion', 'time_stop': 180, 'use_sma': False, 'use_atr': True, 'use_adx': True, 'use_ema': True, 'use_spike': True, 'rsi_required': False, 'edge_k': 0.506922432660634, 'edge_cap': 0.48652723581664853, 'bull_strategy': 'mean_reversion', 'bull_bb_std_mult': 2.4225816354194283, 'bull_rsi_os': 13, 'bull_rsi_ob': 86, 'bull_adx_thresh': 8.568221649678458, 'bull_atr_min_pct': 0.017311682272809083, 'bull_atr_max_pct': 0.06714542223644096, 'bull_tp_mult': 2.104410827041299, 'bull_tsl_mult': 0.009839697903553324, 'bull_time_stop': 83, 'bull_use_sma': False, 'bull_use_ema': False, 'bull_use_atr': True, 'bull_use_adx': False, 'bull_use_spike': False, 'bull_rsi_required': True, 'bear_strategy': 'breakout', 'bear_bb_std_mult': 2.0630185341384286, 'bear_rsi_os': 41, 'bear_rsi_ob': 71, 'bear_adx_thresh': 22.707272371187827, 'bear_atr_min_pct': 0.023063589563273347, 'bear_atr_max_pct': 0.12646523144205374, 'bear_tp_mult': 2.4578576597577655, 'bear_tsl_mult': 0.3293551722401421, 'bear_time_stop': 77, 'bear_use_sma': False, 'bear_use_ema': True, 'bear_use_atr': False, 'bear_use_adx': True, 'bear_use_spike': True, 'bear_rsi_required': True, 'sideways_strategy': 'mean_reversion', 'sideways_bb_std_mult': 1.1344148166100347, 'sideways_rsi_os': 33, 'sideways_rsi_ob': 57, 'sideways_adx_thresh': 32.60577792725215, 'sideways_atr_min_pct': 0.025961233603237138, 'sideways_atr_max_pct': 0.013456739072198562, 'sideways_tp_mult': 2.45452504919888, 'sideways_tsl_mult': 0.9589684103957122, 'sideways_time_stop': 221, 'sideways_use_sma': True, 'sideways_use_ema': False, 'sideways_use_atr': False, 'sideways_use_adx': True, 'sideways_use_spike': True, 'sideways_rsi_required': False}.
[I 2025-09-01 10:16:59,501] Trial 446 finished with values: [-0.01751090279328238, 0.020637766325238463] and parameters: {'p_sma': 27, 'p_std': 46, 'p_atr': 29, 'p_adx': 12, 'rsi_period': 31, 'ema1': 6, 'ema2': 12, 'slip_atr_k': 0.00918356285538147, 'slip_spread_k': 0.5720081480317153, 'spread_hl_frac': 0.039890167585177896, 'bb_std_mult': 2.5945757533475904, 'rsi_os': 11, 'rsi_ob': 56, 'vol_spike': 0.1512256799650556, 'adx_thresh': 29.6270025196173, 'atr_min_pct': 0.01936246675818219, 'atr_max_pct': 0.06054465189501273, 'tp_mult': 2.319754958111142, 'tsl_mult': 0.8620977757423949, 'strategy': 'mean_reversion', 'time_stop': 114, 'use_sma': False, 'use_atr': True, 'use_adx': False, 'use_ema': False, 'use_spike': False, 'rsi_required': False, 'edge_k': 1.7175971924670286, 'edge_cap': 0.5016453450984255, 'bull_strategy': 'breakout', 'bull_bb_std_mult': 1.0684160236918363, 'bull_rsi_os': 32, 'bull_rsi_ob': 80, 'bull_adx_thresh': 18.82594408497573, 'bull_atr_min_pct': 0.005276921037630031, 'bull_atr_max_pct': 0.018917361388623773, 'bull_tp_mult': 1.8743429404437262, 'bull_tsl_mult': 0.9646011597634745, 'bull_time_stop': 272, 'bull_use_sma': False, 'bull_use_ema': True, 'bull_use_atr': True, 'bull_use_adx': False, 'bull_use_spike': True, 'bull_rsi_required': False, 'bear_strategy': 'breakout', 'bear_bb_std_mult': 0.8910898033021928, 'bear_rsi_os': 45, 'bear_rsi_ob': 62, 'bear_adx_thresh': 32.705536179243005, 'bear_atr_min_pct': 0.0017713326441249969, 'bear_atr_max_pct': 0.1298788349788617, 'bear_tp_mult': 1.537775702210592, 'bear_tsl_mult': 0.8348699767293516, 'bear_time_stop': 27, 'bear_use_sma': True, 'bear_use_ema': True, 'bear_use_atr': True, 'bear_use_adx': True, 'bear_use_spike': True, 'bear_rsi_required': False, 'sideways_strategy': 'mean_reversion', 'sideways_bb_std_mult': 1.1419655576952348, 'sideways_rsi_os': 28, 'sideways_rsi_ob': 63, 'sideways_adx_thresh': 32.0038000863334, 'sideways_atr_min_pct': 0.0038647202154312686, 'sideways_atr_max_pct': 0.012479950829787256, 'sideways_tp_mult': 1.341275262803065, 'sideways_tsl_mult': 0.3273687609997198, 'sideways_time_stop': 291, 'sideways_use_sma': True, 'sideways_use_ema': False, 'sideways_use_atr': False, 'sideways_use_adx': False, 'sideways_use_spike': True, 'sideways_rsi_required': False}.
[I 2025-09-01 10:16:59,952] Trial 448 finished with values: [-0.004761580995991221, 0.005467893905345343] and parameters: {'p_sma': 57, 'p_std': 52, 'p_atr': 29, 'p_adx': 11, 'rsi_period': 49, 'ema1': 21, 'ema2': 12, 'slip_atr_k': 0.00774462453055398, 'slip_spread_k': 0.8496016268942774, 'spread_hl_frac': 0.03969107927986156, 'bb_std_mult': 3.2098849238183105, 'rsi_os': 7, 'rsi_ob': 75, 'vol_spike': 0.1503998476029409, 'adx_thresh': 31.906612741424816, 'atr_min_pct': 0.008471850629692478, 'atr_max_pct': 0.08191725592851334, 'tp_mult': 1.122986844723197, 'tsl_mult': 0.26714746219179786, 'strategy': 'breakout', 'time_stop': 33, 'use_sma': True, 'use_atr': True, 'use_adx': True, 'use_ema': False, 'use_spike': False, 'rsi_required': False, 'edge_k': 1.7247945672845477, 'edge_cap': 0.848512351486876, 'bull_strategy': 'breakout', 'bull_bb_std_mult': 3.5226826125385244, 'bull_rsi_os': 36, 'bull_rsi_ob': 80, 'bull_adx_thresh': 6.877100506932331, 'bull_atr_min_pct': 0.004148833601758117, 'bull_atr_max_pct': 0.07944633876172374, 'bull_tp_mult': 1.8747328896356403, 'bull_tsl_mult': 0.8941695587367696, 'bull_time_stop': 227, 'bull_use_sma': False, 'bull_use_ema': True, 'bull_use_atr': True, 'bull_use_adx': False, 'bull_use_spike': True, 'bull_rsi_required': True, 'bear_strategy': 'breakout', 'bear_bb_std_mult': 1.6945354780798991, 'bear_rsi_os': 44, 'bear_rsi_ob': 79, 'bear_adx_thresh': 34.26671698540441, 'bear_atr_min_pct': 0.029647307321006282, 'bear_atr_max_pct': 0.028380683065883996, 'bear_tp_mult': 2.1500833809810764, 'bear_tsl_mult': 0.8050708428645459, 'bear_time_stop': 78, 'bear_use_sma': True, 'bear_use_ema': True, 'bear_use_atr': True, 'bear_use_adx': True, 'bear_use_spike': True, 'bear_rsi_required': True, 'sideways_strategy': 'breakout', 'sideways_bb_std_mult': 3.1252994663873306, 'sideways_rsi_os': 28, 'sideways_rsi_ob': 48, 'sideways_adx_thresh': 31.864964794692987, 'sideways_atr_min_pct': 0.003993433075837832, 'sideways_atr_max_pct': 0.09006732604225538, 'sideways_tp_mult': 1.9212519200324507, 'sideways_tsl_mult': 0.9675010210156699, 'sideways_time_stop': 185, 'sideways_use_sma': True, 'sideways_use_ema': False, 'sideways_use_atr': False, 'sideways_use_adx': False, 'sideways_use_spike': True, 'sideways_rsi_required': False}.
[I 2025-09-01 10:17:00,234] Trial 449 finished with values: [-0.0055801973995383, 0.006016626741188992] and parameters: {'p_sma': 60, 'p_std': 21, 'p_atr': 15, 'p_adx': 11, 'rsi_period': 47, 'ema1': 10, 'ema2': 12, 'slip_atr_k': 0.0042399375691159905, 'slip_spread_k': 0.20719261661819077, 'spread_hl_frac': 0.006113641105486152, 'bb_std_mult': 2.6843989913128987, 'rsi_os': 11, 'rsi_ob': 56, 'vol_spike': 0.19050668909488339, 'adx_thresh': 7.8078093335935534, 'atr_min_pct': 0.019935663172064202, 'atr_max_pct': 0.07981514901886243, 'tp_mult': 1.1185036654499938, 'tsl_mult': 0.3554889935677095, 'strategy': 'breakout', 'time_stop': 169, 'use_sma': True, 'use_atr': True, 'use_adx': False, 'use_ema': False, 'use_spike': False, 'rsi_required': False, 'edge_k': 1.5914914203735129, 'edge_cap': 0.8557653000002751, 'bull_strategy': 'breakout', 'bull_bb_std_mult': 3.5142452339150663, 'bull_rsi_os': 7, 'bull_rsi_ob': 80, 'bull_adx_thresh': 29.08284966942668, 'bull_atr_min_pct': 0.004019545616723754, 'bull_atr_max_pct': 0.07966179998123546, 'bull_tp_mult': 2.7397041197969614, 'bull_tsl_mult': 0.8510595091536016, 'bull_time_stop': 22, 'bull_use_sma': False, 'bull_use_ema': True, 'bull_use_atr': True, 'bull_use_adx': False, 'bull_use_spike': True, 'bull_rsi_required': False, 'bear_strategy': 'breakout', 'bear_bb_std_mult': 1.7214296668902407, 'bear_rsi_os': 47, 'bear_rsi_ob': 74, 'bear_adx_thresh': 34.429225602352375, 'bear_atr_min_pct': 9.829644061315305e-05, 'bear_atr_max_pct': 0.030328284525923906, 'bear_tp_mult': 2.177088488034409, 'bear_tsl_mult': 0.649749754777651, 'bear_time_stop': 5, 'bear_use_sma': True, 'bear_use_ema': True, 'bear_use_atr': True, 'bear_use_adx': True, 'bear_use_spike': False, 'bear_rsi_required': False, 'sideways_strategy': 'breakout', 'sideways_bb_std_mult': 3.1582370584856623, 'sideways_rsi_os': 20, 'sideways_rsi_ob': 60, 'sideways_adx_thresh': 31.877416225135878, 'sideways_atr_min_pct': 0.004073114900293307, 'sideways_atr_max_pct': 0.0926431608549318, 'sideways_tp_mult': 1.3265719648636738, 'sideways_tsl_mult': 0.9286655678869747, 'sideways_time_stop': 252, 'sideways_use_sma': False, 'sideways_use_ema': False, 'sideways_use_atr': False, 'sideways_use_adx': False, 'sideways_use_spike': True, 'sideways_rsi_required': False}.
[I 2025-09-01 10:17:00,479] Trial 447 finished with values: [-1000000000.0, 1000000000.0] and parameters: {'p_sma': 12, 'p_std': 20, 'p_atr': 26, 'p_adx': 12, 'rsi_period': 49, 'ema1': 6, 'ema2': 12, 'slip_atr_k': 0.009350340754329748, 'slip_spread_k': 0.5712679291331267, 'spread_hl_frac': 0.02247078433782874, 'bb_std_mult': 3.5700911719416464, 'rsi_os': 8, 'rsi_ob': 70, 'vol_spike': 0.00018804966156579783, 'adx_thresh': 12.494324122641808, 'atr_min_pct': 0.01962462926052527, 'atr_max_pct': 0.08045398418675866, 'tp_mult': 2.459387382619956, 'tsl_mult': 0.36115003700920256, 'strategy': 'breakout', 'time_stop': 216, 'use_sma': True, 'use_atr': True, 'use_adx': False, 'use_ema': False, 'use_spike': False, 'rsi_required': False, 'edge_k': 0.8689208493683761, 'edge_cap': 0.8509473140519355, 'bull_strategy': 'breakout', 'bull_bb_std_mult': 2.379018620915538, 'bull_rsi_os': 13, 'bull_rsi_ob': 89, 'bull_adx_thresh': 28.841357497761702, 'bull_atr_min_pct': 0.022589869308922237, 'bull_atr_max_pct': 0.018719639124709732, 'bull_tp_mult': 2.10405957213407, 'bull_tsl_mult': 0.9665117372071842, 'bull_time_stop': 24, 'bull_use_sma': False, 'bull_use_ema': True, 'bull_use_atr': True, 'bull_use_adx': False, 'bull_use_spike': True, 'bull_rsi_required': False, 'bear_strategy': 'breakout', 'bear_bb_std_mult': 1.7286657857375143, 'bear_rsi_os': 47, 'bear_rsi_ob': 73, 'bear_adx_thresh': 34.46630373676994, 'bear_atr_min_pct': 0.002370409742987179, 'bear_atr_max_pct': 0.12963518859189774, 'bear_tp_mult': 2.1509243678620003, 'bear_tsl_mult': 0.8386788886259925, 'bear_time_stop': 10, 'bear_use_sma': True, 'bear_use_ema': True, 'bear_use_atr': True, 'bear_use_adx': True, 'bear_use_spike': True, 'bear_rsi_required': False, 'sideways_strategy': 'mean_reversion', 'sideways_bb_std_mult': 2.4205253783613045, 'sideways_rsi_os': 28, 'sideways_rsi_ob': 61, 'sideways_adx_thresh': 32.04135638295589, 'sideways_atr_min_pct': 0.0010854984031813085, 'sideways_atr_max_pct': 0.01321779875061349, 'sideways_tp_mult': 1.3264404539576427, 'sideways_tsl_mult': 0.03810638719710446, 'sideways_time_stop': 221, 'sideways_use_sma': True, 'sideways_use_ema': False, 'sideways_use_atr': False, 'sideways_use_adx': False, 'sideways_use_spike': True, 'sideways_rsi_required': False}.
