[I 2025-09-01 09:07:21,707] Trial 19 finished with values: [-1000000000.0, 1000000000.0] and parameters: {'p_sma': 46, 'p_std': 52, 'p_atr': 20, 'p_adx': 11, 'rsi_period': 19, 'ema1': 11, 'ema2': 28, 'slip_atr_k': 0.2103560590967356, 'slip_spread_k': 0.47061801623475885, 'spread_hl_frac': 0.023387546830404275, 'bb_std_mult': 1.1044689785270645, 'rsi_os': 13, 'rsi_ob': 53, 'vol_spike': 0.02686185402139167, 'adx_thresh': 10.70921061019066, 'atr_min_pct': 0.022756686719591464, 'atr_max_pct': 0.11302782372832318, 'tp_mult': 2.960024481299553, 'tsl_mult': 0.5290705597692187, 'strategy': 'mean_reversion', 'time_stop': 149, 'use_sma': True, 'use_atr': True, 'use_adx': False, 'use_ema': False, 'use_spike': True, 'rsi_required': False, 'edge_k': 1.316126911118877, 'edge_cap': 0.5030470232141389, 'bull_strategy': 'mean_reversion', 'bull_bb_std_mult': 2.898058020640161, 'bull_rsi_os': 17, 'bull_rsi_ob': 65, 'bull_adx_thresh': 30.75190846335367, 'bull_atr_min_pct': 0.01606961421877764, 'bull_atr_max_pct': 0.08367362308292613, 'bull_tp_mult': 1.2564445856263369, 'bull_tsl_mult': 0.21697289632907096, 'bull_time_stop': 251, 'bull_use_sma': False, 'bull_use_ema': False, 'bull_use_atr': True, 'bull_use_adx': False, 'bull_use_spike': True, 'bull_rsi_required': True, 'bear_strategy': 'breakout', 'bear_bb_std_mult': 3.133769921603423, 'bear_rsi_os': 28, 'bear_rsi_ob': 49, 'bear_adx_thresh': 30.85462471075008, 'bear_atr_min_pct': 0.021163569226371134, 'bear_atr_max_pct': 0.07922864318844228, 'bear_tp_mult': 1.9592487647719776, 'bear_tsl_mult': 0.43127030206858613, 'bear_time_stop': 7, 'bear_use_sma': False, 'bear_use_ema': True, 'bear_use_atr': False, 'bear_use_adx': True, 'bear_use_spike': False, 'bear_rsi_required': False, 'sideways_strategy': 'mean_reversion', 'sideways_bb_std_mult': 2.46130784323762, 'sideways_rsi_os': 55, 'sideways_rsi_ob': 76, 'sideways_adx_thresh': 30.362373431145148, 'sideways_atr_min_pct': 0.02116154717682367, 'sideways_atr_max_pct': 0.1169481828866977, 'sideways_tp_mult': 1.462680252962801, 'sideways_tsl_mult': 0.47349644564186205, 'sideways_time_stop': 296, 'sideways_use_sma': True, 'sideways_use_ema': False, 'sideways_use_atr': False, 'sideways_use_adx': False, 'sideways_use_spike': False, 'sideways_rsi_required': False}.
[I 2025-09-01 09:07:22,443] Trial 20 finished with values: [-1000000000.0, 1000000000.0] and parameters: {'p_sma': 47, 'p_std': 52, 'p_atr': 20, 'p_adx': 11, 'rsi_period': 19, 'ema1': 11, 'ema2': 53, 'slip_atr_k': 0.16846680582143855, 'slip_spread_k': 0.46419455873359694, 'spread_hl_frac': 0.02406082890203808, 'bb_std_mult': 1.1840560537473297, 'rsi_os': 14, 'rsi_ob': 53, 'vol_spike': 0.21734030089340045, 'adx_thresh': 11.009112742698383, 'atr_min_pct': 0.024432139062080735, 'atr_max_pct': 0.11443023566731339, 'tp_mult': 1.8547161788028046, 'tsl_mult': 0.6064585435355193, 'strategy': 'mean_reversion', 'time_stop': 153, 'use_sma': True, 'use_atr': True, 'use_adx': False, 'use_ema': False, 'use_spike': True, 'rsi_required': False, 'edge_k': 1.9991757614653163, 'edge_cap': 0.24253833016210563, 'bull_strategy': 'mean_reversion', 'bull_bb_std_mult': 2.9428961373017044, 'bull_rsi_os': 15, 'bull_rsi_ob': 64, 'bull_adx_thresh': 33.419124005165656, 'bull_atr_min_pct': 0.016350127098651093, 'bull_atr_max_pct': 0.07038882454859133, 'bull_tp_mult': 1.2724383754349375, 'bull_tsl_mult': 0.2545919476192616, 'bull_time_stop': 238, 'bull_use_sma': False, 'bull_use_ema': False, 'bull_use_atr': True, 'bull_use_adx': False, 'bull_use_spike': True, 'bull_rsi_required': True, 'bear_strategy': 'breakout', 'bear_bb_std_mult': 3.0306058560595033, 'bear_rsi_os': 29, 'bear_rsi_ob': 50, 'bear_adx_thresh': 30.167146112240545, 'bear_atr_min_pct': 0.0214854228688112, 'bear_atr_max_pct': 0.07880709068645839, 'bear_tp_mult': 1.9850598036519718, 'bear_tsl_mult': 0.0260764406498869, 'bear_time_stop': 9, 'bear_use_sma': False, 'bear_use_ema': True, 'bear_use_atr': False, 'bear_use_adx': True, 'bear_use_spike': False, 'bear_rsi_required': False, 'sideways_strategy': 'mean_reversion', 'sideways_bb_std_mult': 2.344030052971007, 'sideways_rsi_os': 55, 'sideways_rsi_ob': 75, 'sideways_adx_thresh': 29.88184916803983, 'sideways_atr_min_pct': 0.02223962239294855, 'sideways_atr_max_pct': 0.11374464317467903, 'sideways_tp_mult': 1.4831150166696863, 'sideways_tsl_mult': 0.4447069437674256, 'sideways_time_stop': 293, 'sideways_use_sma': True, 'sideways_use_ema': False, 'sideways_use_atr': False, 'sideways_use_adx': False, 'sideways_use_spike': False, 'sideways_rsi_required': False}.
[I 2025-09-01 09:07:22,669] Trial 21 finished with values: [-0.027063256079221, 0.027111861961950614] and parameters: {'p_sma': 32, 'p_std': 51, 'p_atr': 25, 'p_adx': 11, 'rsi_period': 19, 'ema1': 11, 'ema2': 53, 'slip_atr_k': 0.20924312225135105, 'slip_spread_k': 0.46654961267338957, 'spread_hl_frac': 0.02426508218450897, 'bb_std_mult': 0.5467016623276042, 'rsi_os': 14, 'rsi_ob': 54, 'vol_spike': 0.03623690966587681, 'adx_thresh': 11.222859552119244, 'atr_min_pct': 0.024526330946528747, 'atr_max_pct': 0.11601608255873624, 'tp_mult': 1.8545273841077612, 'tsl_mult': 0.4890344035241312, 'strategy': 'mean_reversion', 'time_stop': 160, 'use_sma': True, 'use_atr': True, 'use_adx': False, 'use_ema': False, 'use_spike': True, 'rsi_required': False, 'edge_k': 1.2482868728818934, 'edge_cap': 0.5289895921518142, 'bull_strategy': 'mean_reversion', 'bull_bb_std_mult': 2.8548739523019586, 'bull_rsi_os': 14, 'bull_rsi_ob': 66, 'bull_adx_thresh': 5.154314271418432, 'bull_atr_min_pct': 0.00016744223121772017, 'bull_atr_max_pct': 0.06982016272935371, 'bull_tp_mult': 1.2801730245553131, 'bull_tsl_mult': 0.22150510080972996, 'bull_time_stop': 241, 'bull_use_sma': False, 'bull_use_ema': False, 'bull_use_atr': True, 'bull_use_adx': False, 'bull_use_spike': True, 'bull_rsi_required': True, 'bear_strategy': 'breakout', 'bear_bb_std_mult': 3.02280855144289, 'bear_rsi_os': 28, 'bear_rsi_ob': 64, 'bear_adx_thresh': 30.472370554267776, 'bear_atr_min_pct': 0.029936056729073943, 'bear_atr_max_pct': 0.08009511179623663, 'bear_tp_mult': 1.8677951284903518, 'bear_tsl_mult': 0.38657252079587, 'bear_time_stop': 6, 'bear_use_sma': False, 'bear_use_ema': True, 'bear_use_atr': False, 'bear_use_adx': True, 'bear_use_spike': False, 'bear_rsi_required': False, 'sideways_strategy': 'mean_reversion', 'sideways_bb_std_mult': 2.4691131183410877, 'sideways_rsi_os': 25, 'sideways_rsi_ob': 76, 'sideways_adx_thresh': 30.695635599043605, 'sideways_atr_min_pct': 0.020982263517950038, 'sideways_atr_max_pct': 0.05274615359869003, 'sideways_tp_mult': 1.4852816576234522, 'sideways_tsl_mult': 0.4817548124299832, 'sideways_time_stop': 300, 'sideways_use_sma': True, 'sideways_use_ema': False, 'sideways_use_atr': False, 'sideways_use_adx': False, 'sideways_use_spike': False, 'sideways_rsi_required': False}.
[I 2025-09-01 09:07:22,670] Trial 18 finished with values: [-1000000000.0, 1000000000.0] and parameters: {'p_sma': 47, 'p_std': 52, 'p_atr': 19, 'p_adx': 11, 'rsi_period': 18, 'ema1': 10, 'ema2': 28, 'slip_atr_k': 0.20900170439807578, 'slip_spread_k': 0.5166226973118541, 'spread_hl_frac': 0.025704382689097097, 'bb_std_mult': 1.098841762859622, 'rsi_os': 14, 'rsi_ob': 53, 'vol_spike': 0.21067456828712142, 'adx_thresh': 10.920547688470151, 'atr_min_pct': 0.02390806376391009, 'atr_max_pct': 0.11447522727635277, 'tp_mult': 1.9869146829289732, 'tsl_mult': 0.5489055659904574, 'strategy': 'mean_reversion', 'time_stop': 143, 'use_sma': True, 'use_atr': True, 'use_adx': False, 'use_ema': False, 'use_spike': True, 'rsi_required': False, 'edge_k': 0.4073870531380299, 'edge_cap': 0.21749211148631659, 'bull_strategy': 'mean_reversion', 'bull_bb_std_mult': 2.8966479941289687, 'bull_rsi_os': 14, 'bull_rsi_ob': 64, 'bull_adx_thresh': 5.034193850253552, 'bull_atr_min_pct': 0.017206982391109175, 'bull_atr_max_pct': 0.067155336958473, 'bull_tp_mult': 1.6169632451101803, 'bull_tsl_mult': 0.21962739941032433, 'bull_time_stop': 245, 'bull_use_sma': False, 'bull_use_ema': False, 'bull_use_atr': True, 'bull_use_adx': False, 'bull_use_spike': True, 'bull_rsi_required': True, 'bear_strategy': 'breakout', 'bear_bb_std_mult': 3.1466017543539673, 'bear_rsi_os': 26, 'bear_rsi_ob': 46, 'bear_adx_thresh': 28.519015573571885, 'bear_atr_min_pct': 0.02099111087501667, 'bear_atr_max_pct': 0.07788045002110003, 'bear_tp_mult': 1.954506919382259, 'bear_tsl_mult': 0.42087245514814997, 'bear_time_stop': 12, 'bear_use_sma': False, 'bear_use_ema': True, 'bear_use_atr': False, 'bear_use_adx': True, 'bear_use_spike': False, 'bear_rsi_required': False, 'sideways_strategy': 'mean_reversion', 'sideways_bb_std_mult': 2.2161182749969113, 'sideways_rsi_os': 26, 'sideways_rsi_ob': 76, 'sideways_adx_thresh': 30.17017246011772, 'sideways_atr_min_pct': 0.021420171252895914, 'sideways_atr_max_pct': 0.1149534994604538, 'sideways_tp_mult': 1.619890000969694, 'sideways_tsl_mult': 0.4415964449423363, 'sideways_time_stop': 298, 'sideways_use_sma': True, 'sideways_use_ema': False, 'sideways_use_atr': False, 'sideways_use_adx': False, 'sideways_use_spike': False, 'sideways_rsi_required': False}.
[I 2025-09-01 09:07:22,927] Trial 24 finished with values: [-1000000000.0, 1000000000.0] and parameters: {'p_sma': 33, 'p_std': 60, 'p_atr': 25, 'p_adx': 14, 'rsi_period': 30, 'ema1': 8, 'ema2': 55, 'slip_atr_k': 0.22314728017557903, 'slip_spread_k': 0.6660702475112662, 'spread_hl_frac': 0.0067573839730840045, 'bb_std_mult': 0.5043227628985829, 'rsi_os': 10, 'rsi_ob': 46, 'vol_spike': 0.06116779313954013, 'adx_thresh': 14.721516437878023, 'atr_min_pct': 0.01688241161268437, 'atr_max_pct': 0.09379964225407644, 'tp_mult': 1.9062418024631747, 'tsl_mult': 0.7781358889114904, 'strategy': 'mean_reversion', 'time_stop': 41, 'use_sma': True, 'use_atr': True, 'use_adx': False, 'use_ema': False, 'use_spike': True, 'rsi_required': True, 'edge_k': 0.801730593241313, 'edge_cap': 0.4901347572469233, 'bull_strategy': 'mean_reversion', 'bull_bb_std_mult': 3.0956952140831726, 'bull_rsi_os': 32, 'bull_rsi_ob': 54, 'bull_adx_thresh': 7.80295923412409, 'bull_atr_min_pct': 0.0005108364460786707, 'bull_atr_max_pct': 0.027054162307814236, 'bull_tp_mult': 1.6846702696655322, 'bull_tsl_mult': 0.3863388132866409, 'bull_time_stop': 164, 'bull_use_sma': True, 'bull_use_ema': False, 'bull_use_atr': True, 'bull_use_adx': True, 'bull_use_spike': False, 'bull_rsi_required': True, 'bear_strategy': 'breakout', 'bear_bb_std_mult': 2.5447986013567014, 'bear_rsi_os': 34, 'bear_rsi_ob': 63, 'bear_adx_thresh': 32.55155947909576, 'bear_atr_min_pct': 0.029993271534710007, 'bear_atr_max_pct': 0.12442985011998783, 'bear_tp_mult': 2.5337539254627552, 'bear_tsl_mult': 0.7040432434605629, 'bear_time_stop': 52, 'bear_use_sma': True, 'bear_use_ema': True, 'bear_use_atr': False, 'bear_use_adx': False, 'bear_use_spike': False, 'bear_rsi_required': False, 'sideways_strategy': 'mean_reversion', 'sideways_bb_std_mult': 1.8690225236604423, 'sideways_rsi_os': 37, 'sideways_rsi_ob': 89, 'sideways_adx_thresh': 33.237258969433654, 'sideways_atr_min_pct': 0.025751959519839086, 'sideways_atr_max_pct': 0.049876571910136676, 'sideways_tp_mult': 2.3376400265743924, 'sideways_tsl_mult': 0.570231372139028, 'sideways_time_stop': 181, 'sideways_use_sma': True, 'sideways_use_ema': True, 'sideways_use_atr': False, 'sideways_use_adx': False, 'sideways_use_spike': False, 'sideways_rsi_required': False}.
[I 2025-09-01 09:08:01,278] Trial 26 finished with values: [-1000000000.0, 1000000000.0] and parameters: {'p_sma': 14, 'p_std': 8, 'p_atr': 26, 'p_adx': 9, 'rsi_period': 59, 'ema1': 13, 'ema2': 46, 'slip_atr_k': 0.007491403412471856, 'slip_spread_k': 0.14564170947441038, 'spread_hl_frac': 0.02004083744095419, 'bb_std_mult': 1.4151867951836317, 'rsi_os': 21, 'rsi_ob': 57, 'vol_spike': 0.006821615894089472, 'adx_thresh': 34.966103837679626, 'atr_min_pct': 0.015653833650647635, 'atr_max_pct': 0.12765774892162066, 'tp_mult': 2.198029457196741, 'tsl_mult': 0.36899053267729875, 'strategy': 'mean_reversion', 'time_stop': 185, 'use_sma': True, 'use_atr': True, 'use_adx': False, 'use_ema': False, 'use_spike': True, 'rsi_required': False, 'edge_k': 0.7738324574923082, 'edge_cap': 0.29015802290497894, 'bull_strategy': 'mean_reversion', 'bull_bb_std_mult': 2.659411840239325, 'bull_rsi_os': 10, 'bull_rsi_ob': 55, 'bull_adx_thresh': 17.291181999429813, 'bull_atr_min_pct': 0.004240571842553218, 'bull_atr_max_pct': 0.02855392445866167, 'bull_tp_mult': 2.2763820475383003, 'bull_tsl_mult': 0.6484534375614759, 'bull_time_stop': 169, 'bull_use_sma': False, 'bull_use_ema': False, 'bull_use_atr': True, 'bull_use_adx': False, 'bull_use_spike': True, 'bull_rsi_required': True, 'bear_strategy': 'breakout', 'bear_bb_std_mult': 2.7899156829330076, 'bear_rsi_os': 42, 'bear_rsi_ob': 60, 'bear_adx_thresh': 25.60736392799008, 'bear_atr_min_pct': 0.01111279732766729, 'bear_atr_max_pct': 0.1171953502265761, 'bear_tp_mult': 2.9115287447114317, 'bear_tsl_mult': 0.6860871672511061, 'bear_time_stop': 111, 'bear_use_sma': False, 'bear_use_ema': True, 'bear_use_atr': False, 'bear_use_adx': True, 'bear_use_spike': False, 'bear_rsi_required': False, 'sideways_strategy': 'mean_reversion', 'sideways_bb_std_mult': 1.0613924199665834, 'sideways_rsi_os': 48, 'sideways_rsi_ob': 88, 'sideways_adx_thresh': 32.7328026775528, 'sideways_atr_min_pct': 0.02559909748148743, 'sideways_atr_max_pct': 0.08020549528030527, 'sideways_tp_mult': 1.2410417418950943, 'sideways_tsl_mult': 0.18124908129812195, 'sideways_time_stop': 134, 'sideways_use_sma': True, 'sideways_use_ema': False, 'sideways_use_atr': False, 'sideways_use_adx': False, 'sideways_use_spike': False, 'sideways_rsi_required': False}.
[I 2025-09-01 09:08:02,356] Trial 25 finished with values: [-0.10253360665806899, 0.10251248094336703] and parameters: {'p_sma': 34, 'p_std': 6, 'p_atr': 26, 'p_adx': 15, 'rsi_period': 36, 'ema1': 8, 'ema2': 55, 'slip_atr_k': 0.20585319438896407, 'slip_spread_k': 0.13239164997598601, 'spread_hl_frac': 0.006093601639364269, 'bb_std_mult': 0.7152695393610534, 'rsi_os': 10, 'rsi_ob': 58, 'vol_spike': 0.0020538119708233826, 'adx_thresh': 14.146222153005906, 'atr_min_pct': 0.016270204943252178, 'atr_max_pct': 0.09403596296018601, 'tp_mult': 1.8808450021892782, 'tsl_mult': 0.7829898591717589, 'strategy': 'mean_reversion', 'time_stop': 56, 'use_sma': True, 'use_atr': True, 'use_adx': False, 'use_ema': False, 'use_spike': True, 'rsi_required': True, 'edge_k': 0.8090850425274929, 'edge_cap': 0.5094068005168088, 'bull_strategy': 'mean_reversion', 'bull_bb_std_mult': 3.1883695242995316, 'bull_rsi_os': 33, 'bull_rsi_ob': 54, 'bull_adx_thresh': 7.429523028826295, 'bull_atr_min_pct': 0.0005296580116996383, 'bull_atr_max_pct': 0.029991132457884796, 'bull_tp_mult': 2.3051312764417484, 'bull_tsl_mult': 0.4017547096388952, 'bull_time_stop': 170, 'bull_use_sma': True, 'bull_use_ema': False, 'bull_use_atr': True, 'bull_use_adx': True, 'bull_use_spike': False, 'bull_rsi_required': True, 'bear_strategy': 'breakout', 'bear_bb_std_mult': 2.6822235895290487, 'bear_rsi_os': 55, 'bear_rsi_ob': 62, 'bear_adx_thresh': 32.199778148145995, 'bear_atr_min_pct': 0.029002989475443677, 'bear_atr_max_pct': 0.12148775192654454, 'bear_tp_mult': 2.5851540901172547, 'bear_tsl_mult': 0.6539843919327217, 'bear_time_stop': 52, 'bear_use_sma': True, 'bear_use_ema': True, 'bear_use_atr': False, 'bear_use_adx': False, 'bear_use_spike': False, 'bear_rsi_required': False, 'sideways_strategy': 'mean_reversion', 'sideways_bb_std_mult': 1.773547702565155, 'sideways_rsi_os': 36, 'sideways_rsi_ob': 90, 'sideways_adx_thresh': 33.2300141656996, 'sideways_atr_min_pct': 0.025552955773449394, 'sideways_atr_max_pct': 0.05186370037439514, 'sideways_tp_mult': 2.32106026035608, 'sideways_tsl_mult': 0.6006683447242548, 'sideways_time_stop': 173, 'sideways_use_sma': True, 'sideways_use_ema': True, 'sideways_use_atr': False, 'sideways_use_adx': False, 'sideways_use_spike': False, 'sideways_rsi_required': False}.
[I 2025-09-01 09:08:02,794] Trial 23 finished with values: [-0.02470338581384024, 0.024731084610486936] and parameters: {'p_sma': 32, 'p_std': 60, 'p_atr': 26, 'p_adx': 15, 'rsi_period': 32, 'ema1': 8, 'ema2': 55, 'slip_atr_k': 0.21528267675021184, 'slip_spread_k': 0.6728464630694361, 'spread_hl_frac': 0.0070145236668750915, 'bb_std_mult': 0.7453390933384186, 'rsi_os': 20, 'rsi_ob': 58, 'vol_spike': 0.06006664729921919, 'adx_thresh': 14.166462520690839, 'atr_min_pct': 0.01763549548853003, 'atr_max_pct': 0.08796351803924314, 'tp_mult': 1.9708317749038669, 'tsl_mult': 0.7925058498130942, 'strategy': 'mean_reversion', 'time_stop': 54, 'use_sma': True, 'use_atr': True, 'use_adx': False, 'use_ema': False, 'use_spike': True, 'rsi_required': True, 'edge_k': 0.7722565615494118, 'edge_cap': 0.4964608857450473, 'bull_strategy': 'mean_reversion', 'bull_bb_std_mult': 3.1682716450807638, 'bull_rsi_os': 32, 'bull_rsi_ob': 54, 'bull_adx_thresh': 7.37708262800818, 'bull_atr_min_pct': 0.0006133331902634801, 'bull_atr_max_pct': 0.028022496681669756, 'bull_tp_mult': 2.269380022885264, 'bull_tsl_mult': 0.4277147190392585, 'bull_time_stop': 151, 'bull_use_sma': True, 'bull_use_ema': False, 'bull_use_atr': True, 'bull_use_adx': True, 'bull_use_spike': False, 'bull_rsi_required': True, 'bear_strategy': 'breakout', 'bear_bb_std_mult': 2.6886233705991396, 'bear_rsi_os': 41, 'bear_rsi_ob': 63, 'bear_adx_thresh': 32.30809436967557, 'bear_atr_min_pct': 0.012209513862301761, 'bear_atr_max_pct': 0.12037299693795908, 'bear_tp_mult': 2.644065103827166, 'bear_tsl_mult': 0.7157963592992188, 'bear_time_stop': 49, 'bear_use_sma': True, 'bear_use_ema': True, 'bear_use_atr': False, 'bear_use_adx': False, 'bear_use_spike': False, 'bear_rsi_required': False, 'sideways_strategy': 'mean_reversion', 'sideways_bb_std_mult': 1.9142765789824738, 'sideways_rsi_os': 38, 'sideways_rsi_ob': 88, 'sideways_adx_thresh': 32.25492424266764, 'sideways_atr_min_pct': 0.02522248549775137, 'sideways_atr_max_pct': 0.05097559484747481, 'sideways_tp_mult': 2.252063218428435, 'sideways_tsl_mult': 0.20476669411247916, 'sideways_time_stop': 183, 'sideways_use_sma': True, 'sideways_use_ema': True, 'sideways_use_atr': False, 'sideways_use_adx': False, 'sideways_use_spike': False, 'sideways_rsi_required': False}.
[I 2025-09-01 09:08:03,015] Trial 22 finished with values: [-0.022395984428383975, 0.022427303133391432] and parameters: {'p_sma': 32, 'p_std': 60, 'p_atr': 25, 'p_adx': 11, 'rsi_period': 30, 'ema1': 21, 'ema2': 54, 'slip_atr_k': 0.16255523416332113, 'slip_spread_k': 0.5240834651174269, 'spread_hl_frac': 0.03094793686208061, 'bb_std_mult': 0.6146093651627702, 'rsi_os': 20, 'rsi_ob': 55, 'vol_spike': 0.22355698724831158, 'adx_thresh': 10.729643340638422, 'atr_min_pct': 0.01552526698747753, 'atr_max_pct': 0.09574663179789658, 'tp_mult': 1.897497711931929, 'tsl_mult': 0.6396076100000545, 'strategy': 'mean_reversion', 'time_stop': 172, 'use_sma': True, 'use_atr': True, 'use_adx': False, 'use_ema': False, 'use_spike': True, 'rsi_required': True, 'edge_k': 1.9877279234705183, 'edge_cap': 0.19896782369146565, 'bull_strategy': 'mean_reversion', 'bull_bb_std_mult': 2.821577088024357, 'bull_rsi_os': 32, 'bull_rsi_ob': 54, 'bull_adx_thresh': 5.016565257779512, 'bull_atr_min_pct': 0.0003747648227805929, 'bull_atr_max_pct': 0.027104299884205194, 'bull_tp_mult': 1.6718302206911373, 'bull_tsl_mult': 0.4447689253066835, 'bull_time_stop': 242, 'bull_use_sma': True, 'bull_use_ema': False, 'bull_use_atr': True, 'bull_use_adx': True, 'bull_use_spike': False, 'bull_rsi_required': True, 'bear_strategy': 'breakout', 'bear_bb_std_mult': 2.6771357289121473, 'bear_rsi_os': 32, 'bear_rsi_ob': 64, 'bear_adx_thresh': 20.026006897918165, 'bear_atr_min_pct': 0.012074172614268975, 'bear_atr_max_pct': 0.1215503423343066, 'bear_tp_mult': 2.551233191062665, 'bear_tsl_mult': 0.07456717135339003, 'bear_time_stop': 111, 'bear_use_sma': True, 'bear_use_ema': True, 'bear_use_atr': False, 'bear_use_adx': False, 'bear_use_spike': False, 'bear_rsi_required': False, 'sideways_strategy': 'mean_reversion', 'sideways_bb_std_mult': 2.0075710199702015, 'sideways_rsi_os': 48, 'sideways_rsi_ob': 88, 'sideways_adx_thresh': 30.25306718589978, 'sideways_atr_min_pct': 0.02247472752987676, 'sideways_atr_max_pct': 0.04422600276877276, 'sideways_tp_mult': 1.6082196903841148, 'sideways_tsl_mult': 0.5119309371478928, 'sideways_time_stop': 139, 'sideways_use_sma': True, 'sideways_use_ema': True, 'sideways_use_atr': False, 'sideways_use_adx': False, 'sideways_use_spike': False, 'sideways_rsi_required': False}.
