[I 2025-09-01 10:03:59,883] Trial 369 finished with values: [-0.01387963965528849, 0.01409002618582971] and parameters: {'p_sma': 59, 'p_std': 45, 'p_atr': 29, 'p_adx': 16, 'rsi_period': 22, 'ema1': 16, 'ema2': 44, 'slip_atr_k': 0.01963984397574952, 'slip_spread_k': 0.5323718631717611, 'spread_hl_frac': 0.008921700043529764, 'bb_std_mult': 2.7656594881503285, 'rsi_os': 6, 'rsi_ob': 69, 'vol_spike': 0.16274932423970534, 'adx_thresh': 10.116553623641469, 'atr_min_pct': 0.020493475657087916, 'atr_max_pct': 0.05308880417413499, 'tp_mult': 2.7997786132310902, 'tsl_mult': 0.821560089880944, 'strategy': 'breakout', 'time_stop': 143, 'use_sma': True, 'use_atr': True, 'use_adx': False, 'use_ema': False, 'use_spike': False, 'rsi_required': False, 'edge_k': 1.4129139380015472, 'edge_cap': 0.8322792265218819, 'bull_strategy': 'breakout', 'bull_bb_std_mult': 0.9495480518188049, 'bull_rsi_os': 9, 'bull_rsi_ob': 68, 'bull_adx_thresh': 29.549059824638267, 'bull_atr_min_pct': 0.003282630273620347, 'bull_atr_max_pct': 0.05494970196072297, 'bull_tp_mult': 1.2173435000399002, 'bull_tsl_mult': 0.8917239332759498, 'bull_time_stop': 136, 'bull_use_sma': True, 'bull_use_ema': True, 'bull_use_atr': True, 'bull_use_adx': False, 'bull_use_spike': True, 'bull_rsi_required': False, 'bear_strategy': 'breakout', 'bear_bb_std_mult': 2.977875074330468, 'bear_rsi_os': 55, 'bear_rsi_ob': 58, 'bear_adx_thresh': 34.22630468707245, 'bear_atr_min_pct': 0.028227521358177875, 'bear_atr_max_pct': 0.12324052818720722, 'bear_tp_mult': 1.9290879690749658, 'bear_tsl_mult': 0.5637931697143381, 'bear_time_stop': 116, 'bear_use_sma': False, 'bear_use_ema': True, 'bear_use_atr': False, 'bear_use_adx': True, 'bear_use_spike': True, 'bear_rsi_required': False, 'sideways_strategy': 'mean_reversion', 'sideways_bb_std_mult': 2.672761751519329, 'sideways_rsi_os': 30, 'sideways_rsi_ob': 61, 'sideways_adx_thresh': 33.014684001072766, 'sideways_atr_min_pct': 0.002828034528569156, 'sideways_atr_max_pct': 0.06238415096211621, 'sideways_tp_mult': 1.19916614590379, 'sideways_tsl_mult': 0.7030096553729838, 'sideways_time_stop': 242, 'sideways_use_sma': False, 'sideways_use_ema': False, 'sideways_use_atr': False, 'sideways_use_adx': False, 'sideways_use_spike': True, 'sideways_rsi_required': False}.
[I 2025-09-01 10:04:00,717] Trial 371 finished with values: [-1000000000.0, 1000000000.0] and parameters: {'p_sma': 36, 'p_std': 45, 'p_atr': 27, 'p_adx': 16, 'rsi_period': 44, 'ema1': 8, 'ema2': 60, 'slip_atr_k': 0.22092049689328902, 'slip_spread_k': 0.9290283704656084, 'spread_hl_frac': 0.004843257980137747, 'bb_std_mult': 1.307907486608475, 'rsi_os': 7, 'rsi_ob': 57, 'vol_spike': 0.1940263387870278, 'adx_thresh': 28.134249164155328, 'atr_min_pct': 0.020572735999361273, 'atr_max_pct': 0.06984022850991345, 'tp_mult': 1.3093200197881862, 'tsl_mult': 0.8273761548138534, 'strategy': 'breakout', 'time_stop': 238, 'use_sma': True, 'use_atr': False, 'use_adx': False, 'use_ema': False, 'use_spike': False, 'rsi_required': False, 'edge_k': 0.5677580125400574, 'edge_cap': 0.5916041520225942, 'bull_strategy': 'breakout', 'bull_bb_std_mult': 2.415277032295903, 'bull_rsi_os': 28, 'bull_rsi_ob': 70, 'bull_adx_thresh': 25.916938576905757, 'bull_atr_min_pct': 0.00829858843875882, 'bull_atr_max_pct': 0.05644002897491377, 'bull_tp_mult': 1.3191068432917423, 'bull_tsl_mult': 0.08780710046763773, 'bull_time_stop': 225, 'bull_use_sma': False, 'bull_use_ema': True, 'bull_use_atr': True, 'bull_use_adx': True, 'bull_use_spike': True, 'bull_rsi_required': False, 'bear_strategy': 'breakout', 'bear_bb_std_mult': 1.764169151101995, 'bear_rsi_os': 44, 'bear_rsi_ob': 64, 'bear_adx_thresh': 6.375277890189382, 'bear_atr_min_pct': 0.008911399023668902, 'bear_atr_max_pct': 0.1247424552129274, 'bear_tp_mult': 2.8496849100023, 'bear_tsl_mult': 0.8166173963518696, 'bear_time_stop': 10, 'bear_use_sma': True, 'bear_use_ema': True, 'bear_use_atr': False, 'bear_use_adx': True, 'bear_use_spike': True, 'bear_rsi_required': False, 'sideways_strategy': 'mean_reversion', 'sideways_bb_std_mult': 2.682907110012876, 'sideways_rsi_os': 22, 'sideways_rsi_ob': 74, 'sideways_adx_thresh': 32.8668625530933, 'sideways_atr_min_pct': 0.020307307072102022, 'sideways_atr_max_pct': 0.09753257440403518, 'sideways_tp_mult': 1.3916467339960825, 'sideways_tsl_mult': 0.9328069578671198, 'sideways_time_stop': 240, 'sideways_use_sma': False, 'sideways_use_ema': False, 'sideways_use_atr': False, 'sideways_use_adx': False, 'sideways_use_spike': True, 'sideways_rsi_required': False}.
[I 2025-09-01 10:04:01,208] Trial 370 finished with values: [-0.010146911847053741, 0.011242006097151551] and parameters: {'p_sma': 36, 'p_std': 45, 'p_atr': 29, 'p_adx': 23, 'rsi_period': 22, 'ema1': 29, 'ema2': 46, 'slip_atr_k': 0.017299779409001896, 'slip_spread_k': 0.604264210066884, 'spread_hl_frac': 0.008959200739039176, 'bb_std_mult': 2.7524999386329423, 'rsi_os': 6, 'rsi_ob': 77, 'vol_spike': 0.1949372345421275, 'adx_thresh': 12.898940657668629, 'atr_min_pct': 0.008058435278450155, 'atr_max_pct': 0.10933534157008827, 'tp_mult': 2.4377160255973602, 'tsl_mult': 0.8279407094513614, 'strategy': 'breakout', 'time_stop': 146, 'use_sma': True, 'use_atr': True, 'use_adx': False, 'use_ema': False, 'use_spike': False, 'rsi_required': False, 'edge_k': 0.2621137561993747, 'edge_cap': 0.6463031696243868, 'bull_strategy': 'breakout', 'bull_bb_std_mult': 3.3645674564958403, 'bull_rsi_os': 12, 'bull_rsi_ob': 71, 'bull_adx_thresh': 25.935870772018255, 'bull_atr_min_pct': 0.003312828732283583, 'bull_atr_max_pct': 0.057762397537705124, 'bull_tp_mult': 2.8402064915577405, 'bull_tsl_mult': 0.88155573482517, 'bull_time_stop': 156, 'bull_use_sma': True, 'bull_use_ema': True, 'bull_use_atr': True, 'bull_use_adx': False, 'bull_use_spike': True, 'bull_rsi_required': False, 'bear_strategy': 'breakout', 'bear_bb_std_mult': 0.7579287495018394, 'bear_rsi_os': 46, 'bear_rsi_ob': 58, 'bear_adx_thresh': 34.46338823626889, 'bear_atr_min_pct': 0.02679428483126739, 'bear_atr_max_pct': 0.12280098136958983, 'bear_tp_mult': 2.832440708944033, 'bear_tsl_mult': 0.7679298715113914, 'bear_time_stop': 10, 'bear_use_sma': False, 'bear_use_ema': True, 'bear_use_atr': False, 'bear_use_adx': True, 'bear_use_spike': True, 'bear_rsi_required': False, 'sideways_strategy': 'mean_reversion', 'sideways_bb_std_mult': 1.4595560992790078, 'sideways_rsi_os': 30, 'sideways_rsi_ob': 61, 'sideways_adx_thresh': 33.08445157045227, 'sideways_atr_min_pct': 0.0022355479198412635, 'sideways_atr_max_pct': 0.04065972894145421, 'sideways_tp_mult': 1.2951494123896559, 'sideways_tsl_mult': 0.33352483301447183, 'sideways_time_stop': 275, 'sideways_use_sma': False, 'sideways_use_ema': False, 'sideways_use_atr': False, 'sideways_use_adx': False, 'sideways_use_spike': True, 'sideways_rsi_required': False}.
[I 2025-09-01 10:04:01,582] Trial 372 finished with values: [-0.004964041558330301, 0.005504043237323115] and parameters: {'p_sma': 25, 'p_std': 16, 'p_atr': 13, 'p_adx': 25, 'rsi_period': 48, 'ema1': 8, 'ema2': 44, 'slip_atr_k': 0.020449902571432296, 'slip_spread_k': 0.5338164029811604, 'spread_hl_frac': 0.008942436350727228, 'bb_std_mult': 1.6412973008078855, 'rsi_os': 6, 'rsi_ob': 63, 'vol_spike': 0.22829164755367795, 'adx_thresh': 5.996139062736379, 'atr_min_pct': 0.01863893529715406, 'atr_max_pct': 0.13268075137273372, 'tp_mult': 2.999990145977467, 'tsl_mult': 0.8238196592956166, 'strategy': 'mean_reversion', 'time_stop': 134, 'use_sma': True, 'use_atr': True, 'use_adx': False, 'use_ema': False, 'use_spike': False, 'rsi_required': False, 'edge_k': 0.555182226026163, 'edge_cap': 0.19653904559130636, 'bull_strategy': 'breakout', 'bull_bb_std_mult': 2.4234193509236235, 'bull_rsi_os': 8, 'bull_rsi_ob': 77, 'bull_adx_thresh': 20.687951553913894, 'bull_atr_min_pct': 0.0033402464760413477, 'bull_atr_max_pct': 0.14315734298123506, 'bull_tp_mult': 1.5534851635180393, 'bull_tsl_mult': 0.9104444239155798, 'bull_time_stop': 76, 'bull_use_sma': False, 'bull_use_ema': True, 'bull_use_atr': True, 'bull_use_adx': False, 'bull_use_spike': True, 'bull_rsi_required': False, 'bear_strategy': 'breakout', 'bear_bb_std_mult': 0.7586676711524114, 'bear_rsi_os': 40, 'bear_rsi_ob': 95, 'bear_adx_thresh': 9.628351068254938, 'bear_atr_min_pct': 0.02708134873136561, 'bear_atr_max_pct': 0.12487347559432121, 'bear_tp_mult': 2.8437506617593455, 'bear_tsl_mult': 0.9016916995871187, 'bear_time_stop': 10, 'bear_use_sma': True, 'bear_use_ema': True, 'bear_use_atr': False, 'bear_use_adx': True, 'bear_use_spike': False, 'bear_rsi_required': False, 'sideways_strategy': 'mean_reversion', 'sideways_bb_std_mult': 0.5497014086658039, 'sideways_rsi_os': 27, 'sideways_rsi_ob': 62, 'sideways_adx_thresh': 32.4676110275414, 'sideways_atr_min_pct': 0.002187585182677287, 'sideways_atr_max_pct': 0.08444209861849279, 'sideways_tp_mult': 1.0915214931812942, 'sideways_tsl_mult': 0.9181770340399574, 'sideways_time_stop': 250, 'sideways_use_sma': False, 'sideways_use_ema': False, 'sideways_use_atr': False, 'sideways_use_adx': False, 'sideways_use_spike': True, 'sideways_rsi_required': False}.
[I 2025-09-01 10:04:41,084] Trial 376 finished with values: [-1000000000.0, 1000000000.0] and parameters: {'p_sma': 25, 'p_std': 30, 'p_atr': 19, 'p_adx': 11, 'rsi_period': 73, 'ema1': 17, 'ema2': 11, 'slip_atr_k': 0.0034533325762626825, 'slip_spread_k': 0.5868939323957683, 'spread_hl_frac': 0.007120261742323916, 'bb_std_mult': 1.9171466654002747, 'rsi_os': 10, 'rsi_ob': 54, 'vol_spike': 0.22767455467704753, 'adx_thresh': 11.207603640192458, 'atr_min_pct': 0.01864446268466027, 'atr_max_pct': 0.11790173836793638, 'tp_mult': 2.4762694713564, 'tsl_mult': 0.9653203450701953, 'strategy': 'mean_reversion', 'time_stop': 82, 'use_sma': True, 'use_atr': True, 'use_adx': True, 'use_ema': False, 'use_spike': True, 'rsi_required': False, 'edge_k': 1.2675407923121131, 'edge_cap': 0.07828202419396774, 'bull_strategy': 'mean_reversion', 'bull_bb_std_mult': 3.4394964361650846, 'bull_rsi_os': 49, 'bull_rsi_ob': 78, 'bull_adx_thresh': 20.892723318233593, 'bull_atr_min_pct': 0.0048964745672596, 'bull_atr_max_pct': 0.0930926462683545, 'bull_tp_mult': 1.5395770054319506, 'bull_tsl_mult': 0.9172449366545065, 'bull_time_stop': 268, 'bull_use_sma': True, 'bull_use_ema': False, 'bull_use_atr': True, 'bull_use_adx': False, 'bull_use_spike': True, 'bull_rsi_required': True, 'bear_strategy': 'breakout', 'bear_bb_std_mult': 1.5660590396440455, 'bear_rsi_os': 40, 'bear_rsi_ob': 69, 'bear_adx_thresh': 7.774549746390319, 'bear_atr_min_pct': 0.016568055267401616, 'bear_atr_max_pct': 0.09633009359042725, 'bear_tp_mult': 1.7130839509948856, 'bear_tsl_mult': 0.8987023799255036, 'bear_time_stop': 260, 'bear_use_sma': True, 'bear_use_ema': True, 'bear_use_atr': True, 'bear_use_adx': True, 'bear_use_spike': False, 'bear_rsi_required': False, 'sideways_strategy': 'mean_reversion', 'sideways_bb_std_mult': 2.5409910314119504, 'sideways_rsi_os': 27, 'sideways_rsi_ob': 86, 'sideways_adx_thresh': 30.445949758757422, 'sideways_atr_min_pct': 0.0038172270221379463, 'sideways_atr_max_pct': 0.056906782217550106, 'sideways_tp_mult': 1.600200986975623, 'sideways_tsl_mult': 0.577652868414048, 'sideways_time_stop': 70, 'sideways_use_sma': True, 'sideways_use_ema': False, 'sideways_use_atr': True, 'sideways_use_adx': False, 'sideways_use_spike': True, 'sideways_rsi_required': False}.
[I 2025-09-01 10:04:41,378] Trial 373 finished with values: [-1000000000.0, 1000000000.0] and parameters: {'p_sma': 36, 'p_std': 16, 'p_atr': 27, 'p_adx': 17, 'rsi_period': 63, 'ema1': 8, 'ema2': 14, 'slip_atr_k': 0.019847392121253825, 'slip_spread_k': 0.6087327846517459, 'spread_hl_frac': 0.004998174586599275, 'bb_std_mult': 2.636486514016844, 'rsi_os': 10, 'rsi_ob': 57, 'vol_spike': 0.22738213580094596, 'adx_thresh': 12.881334041375814, 'atr_min_pct': 0.018562707862736148, 'atr_max_pct': 0.11035229246417574, 'tp_mult': 2.430414852699823, 'tsl_mult': 0.9155227762883675, 'strategy': 'mean_reversion', 'time_stop': 135, 'use_sma': True, 'use_atr': True, 'use_adx': True, 'use_ema': False, 'use_spike': True, 'rsi_required': False, 'edge_k': 0.27631908251921933, 'edge_cap': 0.0815757430967245, 'bull_strategy': 'breakout', 'bull_bb_std_mult': 3.352119256292956, 'bull_rsi_os': 24, 'bull_rsi_ob': 78, 'bull_adx_thresh': 25.919139550450964, 'bull_atr_min_pct': 0.00478893800872579, 'bull_atr_max_pct': 0.08412915619776283, 'bull_tp_mult': 1.542626739884697, 'bull_tsl_mult': 0.7309267051021491, 'bull_time_stop': 154, 'bull_use_sma': False, 'bull_use_ema': True, 'bull_use_atr': True, 'bull_use_adx': False, 'bull_use_spike': True, 'bull_rsi_required': True, 'bear_strategy': 'breakout', 'bear_bb_std_mult': 1.5660836593661973, 'bear_rsi_os': 46, 'bear_rsi_ob': 69, 'bear_adx_thresh': 9.402827142427167, 'bear_atr_min_pct': 0.02719141865773552, 'bear_atr_max_pct': 0.1270734109253386, 'bear_tp_mult': 2.84634537977119, 'bear_tsl_mult': 0.9439170789975868, 'bear_time_stop': 10, 'bear_use_sma': True, 'bear_use_ema': True, 'bear_use_atr': False, 'bear_use_adx': True, 'bear_use_spike': False, 'bear_rsi_required': False, 'sideways_strategy': 'mean_reversion', 'sideways_bb_std_mult': 2.518773451128202, 'sideways_rsi_os': 29, 'sideways_rsi_ob': 78, 'sideways_adx_thresh': 17.05541857934177, 'sideways_atr_min_pct': 0.013301660630400964, 'sideways_atr_max_pct': 0.05789671632915244, 'sideways_tp_mult': 1.398499392110312, 'sideways_tsl_mult': 0.9226935003813662, 'sideways_time_stop': 235, 'sideways_use_sma': False, 'sideways_use_ema': False, 'sideways_use_atr': True, 'sideways_use_adx': False, 'sideways_use_spike': True, 'sideways_rsi_required': False}.
[I 2025-09-01 10:04:41,795] Trial 375 finished with values: [-1000000000.0, 1000000000.0] and parameters: {'p_sma': 25, 'p_std': 12, 'p_atr': 22, 'p_adx': 11, 'rsi_period': 63, 'ema1': 8, 'ema2': 11, 'slip_atr_k': 0.00030034600386930413, 'slip_spread_k': 0.9809550869172774, 'spread_hl_frac': 0.006862855863193513, 'bb_std_mult': 3.1109617803399874, 'rsi_os': 14, 'rsi_ob': 54, 'vol_spike': 0.28362246135591773, 'adx_thresh': 7.471816025565978, 'atr_min_pct': 0.018850156630435756, 'atr_max_pct': 0.08302205767076973, 'tp_mult': 2.4696966601857455, 'tsl_mult': 0.912945728413614, 'strategy': 'mean_reversion', 'time_stop': 134, 'use_sma': True, 'use_atr': True, 'use_adx': True, 'use_ema': False, 'use_spike': True, 'rsi_required': False, 'edge_k': 0.6961914742233156, 'edge_cap': 0.0855054529634034, 'bull_strategy': 'mean_reversion', 'bull_bb_std_mult': 3.4244249089995833, 'bull_rsi_os': 15, 'bull_rsi_ob': 78, 'bull_adx_thresh': 26.485097011133217, 'bull_atr_min_pct': 0.004852623337304105, 'bull_atr_max_pct': 0.14291822787063874, 'bull_tp_mult': 1.3766168146569828, 'bull_tsl_mult': 0.9792873416071634, 'bull_time_stop': 146, 'bull_use_sma': False, 'bull_use_ema': False, 'bull_use_atr': True, 'bull_use_adx': False, 'bull_use_spike': True, 'bull_rsi_required': True, 'bear_strategy': 'breakout', 'bear_bb_std_mult': 0.5741446794600513, 'bear_rsi_os': 40, 'bear_rsi_ob': 70, 'bear_adx_thresh': 9.461755098205852, 'bear_atr_min_pct': 0.029313936725797556, 'bear_atr_max_pct': 0.13955083529991658, 'bear_tp_mult': 2.7896089103561237, 'bear_tsl_mult': 0.940025278737231, 'bear_time_stop': 64, 'bear_use_sma': True, 'bear_use_ema': True, 'bear_use_atr': True, 'bear_use_adx': True, 'bear_use_spike': False, 'bear_rsi_required': False, 'sideways_strategy': 'mean_reversion', 'sideways_bb_std_mult': 3.356141322814767, 'sideways_rsi_os': 29, 'sideways_rsi_ob': 62, 'sideways_adx_thresh': 7.706004051174313, 'sideways_atr_min_pct': 0.013175431086311626, 'sideways_atr_max_pct': 0.08302595312774615, 'sideways_tp_mult': 1.494968539790599, 'sideways_tsl_mult': 0.9738740311511672, 'sideways_time_stop': 72, 'sideways_use_sma': True, 'sideways_use_ema': False, 'sideways_use_atr': True, 'sideways_use_adx': False, 'sideways_use_spike': True, 'sideways_rsi_required': False}.
[I 2025-09-01 10:04:41,966] Trial 374 finished with values: [-0.087056159544736, 0.08689852691539217] and parameters: {'p_sma': 57, 'p_std': 10, 'p_atr': 19, 'p_adx': 11, 'rsi_period': 34, 'ema1': 8, 'ema2': 11, 'slip_atr_k': 0.22823972957497524, 'slip_spread_k': 0.6035006618855366, 'spread_hl_frac': 0.007020267156528922, 'bb_std_mult': 1.8998703990061614, 'rsi_os': 8, 'rsi_ob': 54, 'vol_spike': 0.22640463317056927, 'adx_thresh': 16.740633329301254, 'atr_min_pct': 0.018746368805138844, 'atr_max_pct': 0.04430643663153035, 'tp_mult': 2.423941566452024, 'tsl_mult': 0.8821892809772268, 'strategy': 'mean_reversion', 'time_stop': 134, 'use_sma': True, 'use_atr': True, 'use_adx': True, 'use_ema': False, 'use_spike': True, 'rsi_required': False, 'edge_k': 0.24628608102843086, 'edge_cap': 0.4809012017559329, 'bull_strategy': 'mean_reversion', 'bull_bb_std_mult': 3.3740254094418503, 'bull_rsi_os': 44, 'bull_rsi_ob': 78, 'bull_adx_thresh': 26.503246489991923, 'bull_atr_min_pct': 0.0048346237505980955, 'bull_atr_max_pct': 0.06986369554357175, 'bull_tp_mult': 2.6913404717839327, 'bull_tsl_mult': 0.9104946112507336, 'bull_time_stop': 157, 'bull_use_sma': True, 'bull_use_ema': False, 'bull_use_atr': True, 'bull_use_adx': False, 'bull_use_spike': True, 'bull_rsi_required': True, 'bear_strategy': 'breakout', 'bear_bb_std_mult': 1.5759128801213296, 'bear_rsi_os': 40, 'bear_rsi_ob': 75, 'bear_adx_thresh': 13.817642460440277, 'bear_atr_min_pct': 0.02696516775073698, 'bear_atr_max_pct': 0.11416484858848303, 'bear_tp_mult': 1.6901463971282065, 'bear_tsl_mult': 0.85603123582123, 'bear_time_stop': 10, 'bear_use_sma': False, 'bear_use_ema': True, 'bear_use_atr': True, 'bear_use_adx': True, 'bear_use_spike': False, 'bear_rsi_required': False, 'sideways_strategy': 'mean_reversion', 'sideways_bb_std_mult': 2.5203766988063516, 'sideways_rsi_os': 42, 'sideways_rsi_ob': 91, 'sideways_adx_thresh': 30.65995942778553, 'sideways_atr_min_pct': 0.002246173199257931, 'sideways_atr_max_pct': 0.08278428710508196, 'sideways_tp_mult': 1.0947770414160507, 'sideways_tsl_mult': 0.3500347497958319, 'sideways_time_stop': 275, 'sideways_use_sma': True, 'sideways_use_ema': False, 'sideways_use_atr': True, 'sideways_use_adx': False, 'sideways_use_spike': True, 'sideways_rsi_required': False}.
[I 2025-09-01 10:05:24,639] Trial 379 finished with values: [-1000000000.0, 1000000000.0] and parameters: {'p_sma': 28, 'p_std': 46, 'p_atr': 25, 'p_adx': 10, 'rsi_period': 48, 'ema1': 20, 'ema2': 10, 'slip_atr_k': 0.012404749547960675, 'slip_spread_k': 0.4558449980415491, 'spread_hl_frac': 0.03681759189515516, 'bb_std_mult': 2.1551033012333667, 'rsi_os': 8, 'rsi_ob': 53, 'vol_spike': 0.1999334516919869, 'adx_thresh': 29.791571409665902, 'atr_min_pct': 0.010116838820206867, 'atr_max_pct': 0.13212403110461973, 'tp_mult': 2.696476576789648, 'tsl_mult': 0.8479957032283069, 'strategy': 'breakout', 'time_stop': 151, 'use_sma': True, 'use_atr': False, 'use_adx': False, 'use_ema': False, 'use_spike': True, 'rsi_required': False, 'edge_k': 1.039392711803882, 'edge_cap': 0.951762835183511, 'bull_strategy': 'mean_reversion', 'bull_bb_std_mult': 3.4757212748489414, 'bull_rsi_os': 40, 'bull_rsi_ob': 76, 'bull_adx_thresh': 27.90385511998949, 'bull_atr_min_pct': 0.011158575740094817, 'bull_atr_max_pct': 0.08182851063955783, 'bull_tp_mult': 2.16174300151281, 'bull_tsl_mult': 0.946662753812743, 'bull_time_stop': 195, 'bull_use_sma': True, 'bull_use_ema': False, 'bull_use_atr': True, 'bull_use_adx': True, 'bull_use_spike': True, 'bull_rsi_required': False, 'bear_strategy': 'breakout', 'bear_bb_std_mult': 0.8749252350448424, 'bear_rsi_os': 45, 'bear_rsi_ob': 63, 'bear_adx_thresh': 33.74425831714908, 'bear_atr_min_pct': 0.02531124446086952, 'bear_atr_max_pct': 0.1163006671082918, 'bear_tp_mult': 2.9053714986146355, 'bear_tsl_mult': 0.7931837948087215, 'bear_time_stop': 6, 'bear_use_sma': False, 'bear_use_ema': True, 'bear_use_atr': True, 'bear_use_adx': True, 'bear_use_spike': True, 'bear_rsi_required': False, 'sideways_strategy': 'breakout', 'sideways_bb_std_mult': 3.0521931809535596, 'sideways_rsi_os': 15, 'sideways_rsi_ob': 58, 'sideways_adx_thresh': 32.39765111697481, 'sideways_atr_min_pct': 0.027210957778903873, 'sideways_atr_max_pct': 0.08740509908807217, 'sideways_tp_mult': 1.3612160328436729, 'sideways_tsl_mult': 0.9168476989939766, 'sideways_time_stop': 220, 'sideways_use_sma': True, 'sideways_use_ema': False, 'sideways_use_atr': False, 'sideways_use_adx': True, 'sideways_use_spike': True, 'sideways_rsi_required': False}.
