[I 2025-09-01 10:25:37,783] Trial 498 finished with values: [-1000000000.0, 1000000000.0] and parameters: {'p_sma': 60, 'p_std': 45, 'p_atr': 20, 'p_adx': 12, 'rsi_period': 44, 'ema1': 26, 'ema2': 13, 'slip_atr_k': 0.17939955642688205, 'slip_spread_k': 0.5573319163488412, 'spread_hl_frac': 0.01865074608976259, 'bb_std_mult': 2.595726105964109, 'rsi_os': 6, 'rsi_ob': 87, 'vol_spike': 0.15650834267184507, 'adx_thresh': 24.56404390877078, 'atr_min_pct': 0.017328480666946842, 'atr_max_pct': 0.060730913373233865, 'tp_mult': 2.4798366951419695, 'tsl_mult': 0.16400024680191144, 'strategy': 'mean_reversion', 'time_stop': 147, 'use_sma': True, 'use_atr': True, 'use_adx': False, 'use_ema': False, 'use_spike': False, 'rsi_required': False, 'edge_k': 1.5569812231865696, 'edge_cap': 0.8618353090968599, 'bull_strategy': 'mean_reversion', 'bull_bb_std_mult': 3.392307626865632, 'bull_rsi_os': 45, 'bull_rsi_ob': 78, 'bull_adx_thresh': 28.79454789608014, 'bull_atr_min_pct': 0.017831891024685652, 'bull_atr_max_pct': 0.028905978796229432, 'bull_tp_mult': 1.37108975360845, 'bull_tsl_mult': 0.8166545324147478, 'bull_time_stop': 150, 'bull_use_sma': True, 'bull_use_ema': False, 'bull_use_atr': True, 'bull_use_adx': False, 'bull_use_spike': True, 'bull_rsi_required': False, 'bear_strategy': 'breakout', 'bear_bb_std_mult': 1.3905436077185238, 'bear_rsi_os': 43, 'bear_rsi_ob': 73, 'bear_adx_thresh': 31.81459398458491, 'bear_atr_min_pct': 0.027695161740597857, 'bear_atr_max_pct': 0.1267746472355666, 'bear_tp_mult': 2.861036041418288, 'bear_tsl_mult': 0.5746906140223609, 'bear_time_stop': 17, 'bear_use_sma': False, 'bear_use_ema': False, 'bear_use_atr': True, 'bear_use_adx': True, 'bear_use_spike': True, 'bear_rsi_required': False, 'sideways_strategy': 'mean_reversion', 'sideways_bb_std_mult': 1.7891772723224635, 'sideways_rsi_os': 17, 'sideways_rsi_ob': 62, 'sideways_adx_thresh': 32.18171081552266, 'sideways_atr_min_pct': 0.020492787685921804, 'sideways_atr_max_pct': 0.10507913938267666, 'sideways_tp_mult': 1.378408533792122, 'sideways_tsl_mult': 0.5371344175586361, 'sideways_time_stop': 67, 'sideways_use_sma': True, 'sideways_use_ema': False, 'sideways_use_atr': False, 'sideways_use_adx': True, 'sideways_use_spike': True, 'sideways_rsi_required': False}.
[I 2025-09-01 10:25:38,207] Trial 495 finished with values: [-1000000000.0, 1000000000.0] and parameters: {'p_sma': 13, 'p_std': 47, 'p_atr': 28, 'p_adx': 9, 'rsi_period': 47, 'ema1': 8, 'ema2': 28, 'slip_atr_k': 0.015224693209752406, 'slip_spread_k': 0.5452436604164387, 'spread_hl_frac': 0.004807943032518558, 'bb_std_mult': 2.42503623402031, 'rsi_os': 7, 'rsi_ob': 88, 'vol_spike': 0.14848676667799976, 'adx_thresh': 9.680093270817611, 'atr_min_pct': 0.016816999137988963, 'atr_max_pct': 0.06866606516530165, 'tp_mult': 2.418197189754038, 'tsl_mult': 0.8017523109863047, 'strategy': 'mean_reversion', 'time_stop': 160, 'use_sma': True, 'use_atr': True, 'use_adx': False, 'use_ema': False, 'use_spike': False, 'rsi_required': False, 'edge_k': 1.864322711772507, 'edge_cap': 0.7123134583091794, 'bull_strategy': 'mean_reversion', 'bull_bb_std_mult': 3.587854104054115, 'bull_rsi_os': 9, 'bull_rsi_ob': 91, 'bull_adx_thresh': 25.377825836670237, 'bull_atr_min_pct': 0.00601349562524122, 'bull_atr_max_pct': 0.07006249331035619, 'bull_tp_mult': 1.6855807294946021, 'bull_tsl_mult': 0.8321426517647004, 'bull_time_stop': 127, 'bull_use_sma': True, 'bull_use_ema': False, 'bull_use_atr': True, 'bull_use_adx': False, 'bull_use_spike': True, 'bull_rsi_required': False, 'bear_strategy': 'breakout', 'bear_bb_std_mult': 1.4199846000302423, 'bear_rsi_os': 29, 'bear_rsi_ob': 70, 'bear_adx_thresh': 31.2998431078561, 'bear_atr_min_pct': 0.028059134695103773, 'bear_atr_max_pct': 0.13469103589098366, 'bear_tp_mult': 1.268374699463044, 'bear_tsl_mult': 0.0009173612172480583, 'bear_time_stop': 17, 'bear_use_sma': False, 'bear_use_ema': False, 'bear_use_atr': True, 'bear_use_adx': True, 'bear_use_spike': True, 'bear_rsi_required': False, 'sideways_strategy': 'mean_reversion', 'sideways_bb_std_mult': 3.0870136655477376, 'sideways_rsi_os': 31, 'sideways_rsi_ob': 62, 'sideways_adx_thresh': 32.18365379497461, 'sideways_atr_min_pct': 0.020684031093642877, 'sideways_atr_max_pct': 0.05946188191981204, 'sideways_tp_mult': 2.9459921857989064, 'sideways_tsl_mult': 0.9494308533890587, 'sideways_time_stop': 87, 'sideways_use_sma': True, 'sideways_use_ema': False, 'sideways_use_atr': False, 'sideways_use_adx': True, 'sideways_use_spike': True, 'sideways_rsi_required': False}.
[I 2025-09-01 10:25:38,563] Trial 496 finished with values: [-1000000000.0, 1000000000.0] and parameters: {'p_sma': 15, 'p_std': 44, 'p_atr': 29, 'p_adx': 12, 'rsi_period': 50, 'ema1': 8, 'ema2': 13, 'slip_atr_k': 0.01514585543647484, 'slip_spread_k': 0.5575335660133628, 'spread_hl_frac': 0.004806292254943853, 'bb_std_mult': 2.46857383764705, 'rsi_os': 6, 'rsi_ob': 52, 'vol_spike': 0.15074073203462415, 'adx_thresh': 7.179060376470893, 'atr_min_pct': 0.0041484644000164845, 'atr_max_pct': 0.06057715777041675, 'tp_mult': 2.3962109315220252, 'tsl_mult': 0.6421013799853195, 'strategy': 'mean_reversion', 'time_stop': 150, 'use_sma': True, 'use_atr': True, 'use_adx': False, 'use_ema': False, 'use_spike': False, 'rsi_required': False, 'edge_k': 1.8158707527525144, 'edge_cap': 0.7153882588361525, 'bull_strategy': 'mean_reversion', 'bull_bb_std_mult': 3.5639797922985905, 'bull_rsi_os': 45, 'bull_rsi_ob': 90, 'bull_adx_thresh': 12.098630992199688, 'bull_atr_min_pct': 0.014194933006038723, 'bull_atr_max_pct': 0.039622596219721376, 'bull_tp_mult': 1.68308399120018, 'bull_tsl_mult': 0.8603807231358092, 'bull_time_stop': 137, 'bull_use_sma': True, 'bull_use_ema': False, 'bull_use_atr': True, 'bull_use_adx': False, 'bull_use_spike': True, 'bull_rsi_required': False, 'bear_strategy': 'breakout', 'bear_bb_std_mult': 1.4065438166887103, 'bear_rsi_os': 29, 'bear_rsi_ob': 70, 'bear_adx_thresh': 34.4403902912208, 'bear_atr_min_pct': 0.027316774641590894, 'bear_atr_max_pct': 0.1311739127964941, 'bear_tp_mult': 2.8487590765976796, 'bear_tsl_mult': 0.5588320949767507, 'bear_time_stop': 18, 'bear_use_sma': False, 'bear_use_ema': False, 'bear_use_atr': True, 'bear_use_adx': True, 'bear_use_spike': True, 'bear_rsi_required': False, 'sideways_strategy': 'mean_reversion', 'sideways_bb_std_mult': 2.0930469150083297, 'sideways_rsi_os': 17, 'sideways_rsi_ob': 68, 'sideways_adx_thresh': 32.150354488564396, 'sideways_atr_min_pct': 0.00018364787944685247, 'sideways_atr_max_pct': 0.08553998842293824, 'sideways_tp_mult': 2.276414432494583, 'sideways_tsl_mult': 0.627306728369599, 'sideways_time_stop': 133, 'sideways_use_sma': True, 'sideways_use_ema': False, 'sideways_use_atr': False, 'sideways_use_adx': True, 'sideways_use_spike': True, 'sideways_rsi_required': False}.
[I 2025-09-01 10:25:38,996] Trial 497 finished with values: [-1000000000.0, 1000000000.0] and parameters: {'p_sma': 11, 'p_std': 44, 'p_atr': 29, 'p_adx': 12, 'rsi_period': 45, 'ema1': 21, 'ema2': 24, 'slip_atr_k': 0.014470835084338446, 'slip_spread_k': 0.547045271368003, 'spread_hl_frac': 0.02478986002940324, 'bb_std_mult': 2.450032497276081, 'rsi_os': 6, 'rsi_ob': 57, 'vol_spike': 0.15653528731744093, 'adx_thresh': 28.90853094609705, 'atr_min_pct': 0.00327521402345932, 'atr_max_pct': 0.061047920968272155, 'tp_mult': 2.42582486957642, 'tsl_mult': 0.16438743407509665, 'strategy': 'mean_reversion', 'time_stop': 148, 'use_sma': True, 'use_atr': True, 'use_adx': False, 'use_ema': False, 'use_spike': False, 'rsi_required': False, 'edge_k': 1.7636938546483656, 'edge_cap': 0.809640322985559, 'bull_strategy': 'mean_reversion', 'bull_bb_std_mult': 3.569735805869839, 'bull_rsi_os': 27, 'bull_rsi_ob': 91, 'bull_adx_thresh': 25.336162242317137, 'bull_atr_min_pct': 0.0039951644552438815, 'bull_atr_max_pct': 0.03264763303530417, 'bull_tp_mult': 2.8309507507172147, 'bull_tsl_mult': 0.053595437029132, 'bull_time_stop': 148, 'bull_use_sma': True, 'bull_use_ema': False, 'bull_use_atr': True, 'bull_use_adx': False, 'bull_use_spike': True, 'bull_rsi_required': False, 'bear_strategy': 'breakout', 'bear_bb_std_mult': 0.6294102286233485, 'bear_rsi_os': 43, 'bear_rsi_ob': 73, 'bear_adx_thresh': 22.44772979068486, 'bear_atr_min_pct': 0.027240530743486757, 'bear_atr_max_pct': 0.13102153008759182, 'bear_tp_mult': 2.6995649547161626, 'bear_tsl_mult': 0.10899148517260027, 'bear_time_stop': 18, 'bear_use_sma': False, 'bear_use_ema': False, 'bear_use_atr': True, 'bear_use_adx': True, 'bear_use_spike': True, 'bear_rsi_required': False, 'sideways_strategy': 'mean_reversion', 'sideways_bb_std_mult': 1.7924459157975645, 'sideways_rsi_os': 17, 'sideways_rsi_ob': 62, 'sideways_adx_thresh': 33.72689411851263, 'sideways_atr_min_pct': 0.0004314542966313063, 'sideways_atr_max_pct': 0.08604852849334066, 'sideways_tp_mult': 1.3890343697225889, 'sideways_tsl_mult': 0.5520921289370418, 'sideways_time_stop': 130, 'sideways_use_sma': True, 'sideways_use_ema': False, 'sideways_use_atr': False, 'sideways_use_adx': True, 'sideways_use_spike': True, 'sideways_rsi_required': False}.
[I 2025-09-01 10:26:22,083] Trial 501 finished with values: [-0.008698605271779125, 0.009683973704693103] and parameters: {'p_sma': 13, 'p_std': 42, 'p_atr': 29, 'p_adx': 10, 'rsi_period': 44, 'ema1': 7, 'ema2': 42, 'slip_atr_k': 0.15851811914110128, 'slip_spread_k': 0.5885721216656743, 'spread_hl_frac': 0.007376796762638771, 'bb_std_mult': 2.317359827904895, 'rsi_os': 54, 'rsi_ob': 57, 'vol_spike': 0.1866781645155739, 'adx_thresh': 12.168700872442862, 'atr_min_pct': 0.01489152998855451, 'atr_max_pct': 0.0739891648896932, 'tp_mult': 2.2611653252939083, 'tsl_mult': 0.772599981784857, 'strategy': 'breakout', 'time_stop': 136, 'use_sma': True, 'use_atr': False, 'use_adx': False, 'use_ema': False, 'use_spike': True, 'rsi_required': True, 'edge_k': 0.6561365329324711, 'edge_cap': 0.9990379233793374, 'bull_strategy': 'breakout', 'bull_bb_std_mult': 3.515078285041545, 'bull_rsi_os': 43, 'bull_rsi_ob': 78, 'bull_adx_thresh': 27.312567030020055, 'bull_atr_min_pct': 0.021570576562837493, 'bull_atr_max_pct': 0.03390041288173952, 'bull_tp_mult': 1.5123324879838078, 'bull_tsl_mult': 0.9680560483214639, 'bull_time_stop': 300, 'bull_use_sma': True, 'bull_use_ema': True, 'bull_use_atr': False, 'bull_use_adx': False, 'bull_use_spike': False, 'bull_rsi_required': False, 'bear_strategy': 'breakout', 'bear_bb_std_mult': 2.47206650930165, 'bear_rsi_os': 45, 'bear_rsi_ob': 89, 'bear_adx_thresh': 28.478438646295945, 'bear_atr_min_pct': 0.017852420653968082, 'bear_atr_max_pct': 0.12513357757296284, 'bear_tp_mult': 2.9141654897337346, 'bear_tsl_mult': 0.8300506578340964, 'bear_time_stop': 12, 'bear_use_sma': False, 'bear_use_ema': True, 'bear_use_atr': True, 'bear_use_adx': True, 'bear_use_spike': False, 'bear_rsi_required': False, 'sideways_strategy': 'mean_reversion', 'sideways_bb_std_mult': 1.8583676214157905, 'sideways_rsi_os': 46, 'sideways_rsi_ob': 60, 'sideways_adx_thresh': 31.40077426691809, 'sideways_atr_min_pct': 0.0028914267307384384, 'sideways_atr_max_pct': 0.08275305845638903, 'sideways_tp_mult': 1.041346312630667, 'sideways_tsl_mult': 0.922512354477764, 'sideways_time_stop': 161, 'sideways_use_sma': True, 'sideways_use_ema': False, 'sideways_use_atr': False, 'sideways_use_adx': False, 'sideways_use_spike': False, 'sideways_rsi_required': True}.
[I 2025-09-01 10:26:22,112] Trial 499 finished with values: [-1000000000.0, 1000000000.0] and parameters: {'p_sma': 13, 'p_std': 44, 'p_atr': 29, 'p_adx': 10, 'rsi_period': 45, 'ema1': 7, 'ema2': 12, 'slip_atr_k': 0.013302589164874451, 'slip_spread_k': 0.537851814330236, 'spread_hl_frac': 0.03651141427143118, 'bb_std_mult': 2.428109625211802, 'rsi_os': 7, 'rsi_ob': 56, 'vol_spike': 0.11032223028111669, 'adx_thresh': 9.925271056490883, 'atr_min_pct': 0.02354343061700176, 'atr_max_pct': 0.06872043296487236, 'tp_mult': 2.901915971552773, 'tsl_mult': 0.8018688903551476, 'strategy': 'breakout', 'time_stop': 138, 'use_sma': True, 'use_atr': False, 'use_adx': False, 'use_ema': False, 'use_spike': True, 'rsi_required': True, 'edge_k': 1.7994224253798003, 'edge_cap': 0.7950888679650879, 'bull_strategy': 'mean_reversion', 'bull_bb_std_mult': 3.5226976057862207, 'bull_rsi_os': 27, 'bull_rsi_ob': 78, 'bull_adx_thresh': 27.26199843812021, 'bull_atr_min_pct': 0.0040024975609402645, 'bull_atr_max_pct': 0.07031313399406461, 'bull_tp_mult': 2.8298332278941785, 'bull_tsl_mult': 0.89748066070416, 'bull_time_stop': 89, 'bull_use_sma': True, 'bull_use_ema': False, 'bull_use_atr': False, 'bull_use_adx': False, 'bull_use_spike': False, 'bull_rsi_required': False, 'bear_strategy': 'breakout', 'bear_bb_std_mult': 1.0876776578908878, 'bear_rsi_os': 45, 'bear_rsi_ob': 72, 'bear_adx_thresh': 34.4916461899578, 'bear_atr_min_pct': 0.028226459724878136, 'bear_atr_max_pct': 0.13367037662093953, 'bear_tp_mult': 2.7633554486510605, 'bear_tsl_mult': 0.2815378737790889, 'bear_time_stop': 17, 'bear_use_sma': False, 'bear_use_ema': False, 'bear_use_atr': True, 'bear_use_adx': True, 'bear_use_spike': True, 'bear_rsi_required': False, 'sideways_strategy': 'mean_reversion', 'sideways_bb_std_mult': 1.8726232884266907, 'sideways_rsi_os': 32, 'sideways_rsi_ob': 60, 'sideways_adx_thresh': 31.948787089693077, 'sideways_atr_min_pct': 0.0025818447705553624, 'sideways_atr_max_pct': 0.08451227818360628, 'sideways_tp_mult': 1.4512537220709174, 'sideways_tsl_mult': 0.2973105763041772, 'sideways_time_stop': 131, 'sideways_use_sma': True, 'sideways_use_ema': False, 'sideways_use_atr': False, 'sideways_use_adx': True, 'sideways_use_spike': True, 'sideways_rsi_required': True}.
[I 2025-09-01 10:26:22,694] Trial 500 finished with values: [-1000000000.0, 1000000000.0] and parameters: {'p_sma': 11, 'p_std': 44, 'p_atr': 29, 'p_adx': 10, 'rsi_period': 45, 'ema1': 7, 'ema2': 12, 'slip_atr_k': 0.010833962025484742, 'slip_spread_k': 0.6767752132240472, 'spread_hl_frac': 0.01680266082241036, 'bb_std_mult': 1.834609789671172, 'rsi_os': 9, 'rsi_ob': 57, 'vol_spike': 0.18594380896326104, 'adx_thresh': 28.856849989344397, 'atr_min_pct': 0.01501579791142743, 'atr_max_pct': 0.030727397246937987, 'tp_mult': 2.367764711988366, 'tsl_mult': 0.7753466801744355, 'strategy': 'breakout', 'time_stop': 137, 'use_sma': True, 'use_atr': False, 'use_adx': False, 'use_ema': False, 'use_spike': True, 'rsi_required': True, 'edge_k': 1.3791607047695642, 'edge_cap': 0.7999246657148041, 'bull_strategy': 'breakout', 'bull_bb_std_mult': 2.5570380027285866, 'bull_rsi_os': 39, 'bull_rsi_ob': 78, 'bull_adx_thresh': 34.08857137598133, 'bull_atr_min_pct': 0.00403786247960026, 'bull_atr_max_pct': 0.07989046672304267, 'bull_tp_mult': 1.508159623776646, 'bull_tsl_mult': 0.9699196033703068, 'bull_time_stop': 140, 'bull_use_sma': True, 'bull_use_ema': False, 'bull_use_atr': False, 'bull_use_adx': False, 'bull_use_spike': False, 'bull_rsi_required': False, 'bear_strategy': 'breakout', 'bear_bb_std_mult': 1.3304774500973822, 'bear_rsi_os': 45, 'bear_rsi_ob': 89, 'bear_adx_thresh': 34.48033609356373, 'bear_atr_min_pct': 0.018031164217557346, 'bear_atr_max_pct': 0.07817918061230586, 'bear_tp_mult': 2.7567666050924498, 'bear_tsl_mult': 0.8246407711079154, 'bear_time_stop': 10, 'bear_use_sma': False, 'bear_use_ema': False, 'bear_use_atr': True, 'bear_use_adx': True, 'bear_use_spike': False, 'bear_rsi_required': False, 'sideways_strategy': 'mean_reversion', 'sideways_bb_std_mult': 2.0819057008682598, 'sideways_rsi_os': 32, 'sideways_rsi_ob': 52, 'sideways_adx_thresh': 33.70298427972566, 'sideways_atr_min_pct': 0.0028955666681881815, 'sideways_atr_max_pct': 0.08373726975115946, 'sideways_tp_mult': 1.0595518833727948, 'sideways_tsl_mult': 0.29229813913148295, 'sideways_time_stop': 117, 'sideways_use_sma': True, 'sideways_use_ema': False, 'sideways_use_atr': False, 'sideways_use_adx': True, 'sideways_use_spike': True, 'sideways_rsi_required': True}.
[I 2025-09-01 10:26:23,173] Trial 502 finished with values: [-1000000000.0, 1000000000.0] and parameters: {'p_sma': 15, 'p_std': 42, 'p_atr': 28, 'p_adx': 22, 'rsi_period': 69, 'ema1': 7, 'ema2': 12, 'slip_atr_k': 0.009983862445879288, 'slip_spread_k': 0.24534169089505076, 'spread_hl_frac': 0.016124887504929707, 'bb_std_mult': 2.3168878369279824, 'rsi_os': 15, 'rsi_ob': 57, 'vol_spike': 0.16305503714311678, 'adx_thresh': 12.194519784217206, 'atr_min_pct': 0.019074679036914247, 'atr_max_pct': 0.07396794051381488, 'tp_mult': 2.2690398540287524, 'tsl_mult': 0.8092893841915643, 'strategy': 'breakout', 'time_stop': 137, 'use_sma': True, 'use_atr': False, 'use_adx': False, 'use_ema': True, 'use_spike': True, 'rsi_required': True, 'edge_k': 1.0371336180937047, 'edge_cap': 0.8778313341713524, 'bull_strategy': 'breakout', 'bull_bb_std_mult': 3.463456384352612, 'bull_rsi_os': 19, 'bull_rsi_ob': 48, 'bull_adx_thresh': 27.20883736871099, 'bull_atr_min_pct': 0.02114929132419238, 'bull_atr_max_pct': 0.08040098211649906, 'bull_tp_mult': 1.49244426115458, 'bull_tsl_mult': 0.9567293959854786, 'bull_time_stop': 143, 'bull_use_sma': True, 'bull_use_ema': True, 'bull_use_atr': False, 'bull_use_adx': True, 'bull_use_spike': False, 'bull_rsi_required': False, 'bear_strategy': 'mean_reversion', 'bear_bb_std_mult': 1.3162266330802457, 'bear_rsi_os': 45, 'bear_rsi_ob': 57, 'bear_adx_thresh': 33.42348489691336, 'bear_atr_min_pct': 0.02820474313471015, 'bear_atr_max_pct': 0.07724759945299008, 'bear_tp_mult': 1.3829636107619665, 'bear_tsl_mult': 0.27406602308096084, 'bear_time_stop': 10, 'bear_use_sma': True, 'bear_use_ema': True, 'bear_use_atr': False, 'bear_use_adx': False, 'bear_use_spike': False, 'bear_rsi_required': False, 'sideways_strategy': 'mean_reversion', 'sideways_bb_std_mult': 1.6988673324228496, 'sideways_rsi_os': 32, 'sideways_rsi_ob': 58, 'sideways_adx_thresh': 31.39779124200981, 'sideways_atr_min_pct': 0.0024581462105757153, 'sideways_atr_max_pct': 0.08354438194585806, 'sideways_tp_mult': 2.2159912871259153, 'sideways_tsl_mult': 0.7198455999143365, 'sideways_time_stop': 104, 'sideways_use_sma': True, 'sideways_use_ema': True, 'sideways_use_atr': False, 'sideways_use_adx': False, 'sideways_use_spike': False, 'sideways_rsi_required': True}.
[I 2025-09-01 10:27:10,672] Trial 503 finished with values: [-1000000000.0, 1000000000.0] and parameters: {'p_sma': 58, 'p_std': 49, 'p_atr': 28, 'p_adx': 22, 'rsi_period': 35, 'ema1': 20, 'ema2': 54, 'slip_atr_k': 0.22420409070427316, 'slip_spread_k': 0.5739080090044391, 'spread_hl_frac': 0.04103030014525087, 'bb_std_mult': 2.8167136285492016, 'rsi_os': 8, 'rsi_ob': 60, 'vol_spike': 0.16436963779477737, 'adx_thresh': 5.423460531089512, 'atr_min_pct': 0.019140339560188922, 'atr_max_pct': 0.0910361312288936, 'tp_mult': 1.932983674233167, 'tsl_mult': 0.33086420497591784, 'strategy': 'breakout', 'time_stop': 187, 'use_sma': False, 'use_atr': True, 'use_adx': False, 'use_ema': True, 'use_spike': True, 'rsi_required': False, 'edge_k': 0.14154302050658296, 'edge_cap': 0.3735854068073581, 'bull_strategy': 'breakout', 'bull_bb_std_mult': 3.4410747722159023, 'bull_rsi_os': 39, 'bull_rsi_ob': 80, 'bull_adx_thresh': 33.8370856293184, 'bull_atr_min_pct': 0.0048889173609262945, 'bull_atr_max_pct': 0.0807808674672823, 'bull_tp_mult': 1.4707170642636378, 'bull_tsl_mult': 0.9213260188279906, 'bull_time_stop': 71, 'bull_use_sma': False, 'bull_use_ema': True, 'bull_use_atr': True, 'bull_use_adx': True, 'bull_use_spike': True, 'bull_rsi_required': False, 'bear_strategy': 'mean_reversion', 'bear_bb_std_mult': 3.5357872201153646, 'bear_rsi_os': 40, 'bear_rsi_ob': 75, 'bear_adx_thresh': 33.45260858292322, 'bear_atr_min_pct': 0.028298174849075777, 'bear_atr_max_pct': 0.051174971428775695, 'bear_tp_mult': 2.8223681999067973, 'bear_tsl_mult': 0.8066224989752875, 'bear_time_stop': 10, 'bear_use_sma': True, 'bear_use_ema': True, 'bear_use_atr': False, 'bear_use_adx': False, 'bear_use_spike': False, 'bear_rsi_required': True, 'sideways_strategy': 'mean_reversion', 'sideways_bb_std_mult': 2.386592811279995, 'sideways_rsi_os': 6, 'sideways_rsi_ob': 50, 'sideways_adx_thresh': 30.05796149368493, 'sideways_atr_min_pct': 0.005684301938301134, 'sideways_atr_max_pct': 0.08922227382112058, 'sideways_tp_mult': 2.212121895543396, 'sideways_tsl_mult': 0.9862519055536058, 'sideways_time_stop': 103, 'sideways_use_sma': False, 'sideways_use_ema': True, 'sideways_use_atr': True, 'sideways_use_adx': False, 'sideways_use_spike': True, 'sideways_rsi_required': False}.
