[I 2025-09-01 09:22:13,205] Trial 128 finished with values: [-1000000000.0, 1000000000.0] and parameters: {'p_sma': 47, 'p_std': 11, 'p_atr': 28, 'p_adx': 28, 'rsi_period': 82, 'ema1': 11, 'ema2': 13, 'slip_atr_k': 0.04490500903197228, 'slip_spread_k': 0.41614625569258995, 'spread_hl_frac': 0.022751891055733598, 'bb_std_mult': 1.5272508178819404, 'rsi_os': 53, 'rsi_ob': 87, 'vol_spike': 0.055922582385171254, 'adx_thresh': 27.485484564049674, 'atr_min_pct': 0.016995351758195578, 'atr_max_pct': 0.03240238568347541, 'tp_mult': 1.3268904076321393, 'tsl_mult': 0.4844001357154318, 'strategy': 'mean_reversion', 'time_stop': 141, 'use_sma': False, 'use_atr': True, 'use_adx': True, 'use_ema': True, 'use_spike': False, 'rsi_required': True, 'edge_k': 0.5455013331456535, 'edge_cap': 0.40891171967682677, 'bull_strategy': 'breakout', 'bull_bb_std_mult': 2.0754476609095063, 'bull_rsi_os': 27, 'bull_rsi_ob': 65, 'bull_adx_thresh': 12.005621086412827, 'bull_atr_min_pct': 0.022832015125058967, 'bull_atr_max_pct': 0.04247939149332737, 'bull_tp_mult': 2.4719200263463588, 'bull_tsl_mult': 0.5089029336039818, 'bull_time_stop': 148, 'bull_use_sma': False, 'bull_use_ema': True, 'bull_use_atr': False, 'bull_use_adx': False, 'bull_use_spike': True, 'bull_rsi_required': True, 'bear_strategy': 'mean_reversion', 'bear_bb_std_mult': 2.062837522341682, 'bear_rsi_os': 25, 'bear_rsi_ob': 86, 'bear_adx_thresh': 26.251834238989254, 'bear_atr_min_pct': 0.020704650451432265, 'bear_atr_max_pct': 0.14450038892651815, 'bear_tp_mult': 1.6746497528128383, 'bear_tsl_mult': 0.005743136645592561, 'bear_time_stop': 263, 'bear_use_sma': False, 'bear_use_ema': True, 'bear_use_atr': False, 'bear_use_adx': True, 'bear_use_spike': True, 'bear_rsi_required': True, 'sideways_strategy': 'breakout', 'sideways_bb_std_mult': 2.652422281285864, 'sideways_rsi_os': 47, 'sideways_rsi_ob': 57, 'sideways_adx_thresh': 25.223096245900436, 'sideways_atr_min_pct': 0.00214964421129162, 'sideways_atr_max_pct': 0.04827971853049624, 'sideways_tp_mult': 1.637922842575926, 'sideways_tsl_mult': 0.7916117072994724, 'sideways_time_stop': 261, 'sideways_use_sma': False, 'sideways_use_ema': False, 'sideways_use_atr': True, 'sideways_use_adx': False, 'sideways_use_spike': False, 'sideways_rsi_required': True}.
[I 2025-09-01 09:22:13,212] Trial 129 finished with values: [-1000000000.0, 1000000000.0] and parameters: {'p_sma': 34, 'p_std': 15, 'p_atr': 28, 'p_adx': 25, 'rsi_period': 81, 'ema1': 12, 'ema2': 45, 'slip_atr_k': 0.11137433267556535, 'slip_spread_k': 0.160391461753496, 'spread_hl_frac': 0.01901758524543515, 'bb_std_mult': 1.204874005567639, 'rsi_os': 53, 'rsi_ob': 71, 'vol_spike': 0.20830544349067226, 'adx_thresh': 15.626296623719977, 'atr_min_pct': 0.01294627605815999, 'atr_max_pct': 0.032440593899508305, 'tp_mult': 2.46396494338171, 'tsl_mult': 0.5529226854275283, 'strategy': 'mean_reversion', 'time_stop': 139, 'use_sma': False, 'use_atr': True, 'use_adx': True, 'use_ema': True, 'use_spike': False, 'rsi_required': True, 'edge_k': 0.5735872159128189, 'edge_cap': 0.3698217738396882, 'bull_strategy': 'breakout', 'bull_bb_std_mult': 2.0639917916137747, 'bull_rsi_os': 45, 'bull_rsi_ob': 65, 'bull_adx_thresh': 16.972898918820803, 'bull_atr_min_pct': 0.0033268988130791266, 'bull_atr_max_pct': 0.09592685945864741, 'bull_tp_mult': 1.772187137054336, 'bull_tsl_mult': 0.5769837488464891, 'bull_time_stop': 237, 'bull_use_sma': False, 'bull_use_ema': True, 'bull_use_atr': False, 'bull_use_adx': False, 'bull_use_spike': True, 'bull_rsi_required': True, 'bear_strategy': 'mean_reversion', 'bear_bb_std_mult': 1.534914051902878, 'bear_rsi_os': 25, 'bear_rsi_ob': 82, 'bear_adx_thresh': 6.741540917298822, 'bear_atr_min_pct': 0.023401657148442057, 'bear_atr_max_pct': 0.10625089255606862, 'bear_tp_mult': 1.668909502108421, 'bear_tsl_mult': 0.8862102623531302, 'bear_time_stop': 263, 'bear_use_sma': False, 'bear_use_ema': True, 'bear_use_atr': False, 'bear_use_adx': True, 'bear_use_spike': True, 'bear_rsi_required': True, 'sideways_strategy': 'breakout', 'sideways_bb_std_mult': 2.421244748887847, 'sideways_rsi_os': 55, 'sideways_rsi_ob': 60, 'sideways_adx_thresh': 25.267999054916015, 'sideways_atr_min_pct': 2.144739079824355e-05, 'sideways_atr_max_pct': 0.08061094325421202, 'sideways_tp_mult': 2.2245732309442667, 'sideways_tsl_mult': 0.0018621897444496827, 'sideways_time_stop': 236, 'sideways_use_sma': False, 'sideways_use_ema': False, 'sideways_use_atr': True, 'sideways_use_adx': False, 'sideways_use_spike': False, 'sideways_rsi_required': True}.
[I 2025-09-01 09:22:48,708] Trial 127 finished with values: [-0.01916258619114264, 0.018922655961981158] and parameters: {'p_sma': 7, 'p_std': 15, 'p_atr': 28, 'p_adx': 10, 'rsi_period': 82, 'ema1': 6, 'ema2': 27, 'slip_atr_k': 0.21917835577049605, 'slip_spread_k': 0.7001555871221457, 'spread_hl_frac': 0.022211820802323944, 'bb_std_mult': 2.008020549594699, 'rsi_os': 22, 'rsi_ob': 88, 'vol_spike': 0.0036575837265157563, 'adx_thresh': 11.269299043541247, 'atr_min_pct': 0.020622576654629448, 'atr_max_pct': 0.11132402697316693, 'tp_mult': 2.481066556821819, 'tsl_mult': 0.20761986498771168, 'strategy': 'mean_reversion', 'time_stop': 141, 'use_sma': True, 'use_atr': True, 'use_adx': True, 'use_ema': False, 'use_spike': True, 'rsi_required': False, 'edge_k': 0.5562587554001119, 'edge_cap': 0.4114856109509187, 'bull_strategy': 'mean_reversion', 'bull_bb_std_mult': 2.0932381596186094, 'bull_rsi_os': 45, 'bull_rsi_ob': 70, 'bull_adx_thresh': 23.609026785596132, 'bull_atr_min_pct': 0.0034649923167568496, 'bull_atr_max_pct': 0.0424498419039188, 'bull_tp_mult': 2.413412906702041, 'bull_tsl_mult': 0.5805110928935472, 'bull_time_stop': 147, 'bull_use_sma': False, 'bull_use_ema': False, 'bull_use_atr': True, 'bull_use_adx': False, 'bull_use_spike': True, 'bull_rsi_required': False, 'bear_strategy': 'mean_reversion', 'bear_bb_std_mult': 1.5329516323100234, 'bear_rsi_os': 25, 'bear_rsi_ob': 86, 'bear_adx_thresh': 6.753315976325348, 'bear_atr_min_pct': 0.02343799449086984, 'bear_atr_max_pct': 0.0619472522332818, 'bear_tp_mult': 1.6499379679749735, 'bear_tsl_mult': 0.8748190116512198, 'bear_time_stop': 264, 'bear_use_sma': False, 'bear_use_ema': False, 'bear_use_atr': False, 'bear_use_adx': True, 'bear_use_spike': False, 'bear_rsi_required': False, 'sideways_strategy': 'breakout', 'sideways_bb_std_mult': 0.9961435023264185, 'sideways_rsi_os': 30, 'sideways_rsi_ob': 55, 'sideways_adx_thresh': 25.293454356028608, 'sideways_atr_min_pct': 0.001977750314150685, 'sideways_atr_max_pct': 0.08887457139878027, 'sideways_tp_mult': 2.1239855725208967, 'sideways_tsl_mult': 0.7936094749302217, 'sideways_time_stop': 140, 'sideways_use_sma': False, 'sideways_use_ema': False, 'sideways_use_atr': False, 'sideways_use_adx': True, 'sideways_use_spike': False, 'sideways_rsi_required': False}.
[I 2025-09-01 09:22:49,072] Trial 126 finished with values: [-1000000000.0, 1000000000.0] and parameters: {'p_sma': 50, 'p_std': 36, 'p_atr': 28, 'p_adx': 28, 'rsi_period': 81, 'ema1': 6, 'ema2': 10, 'slip_atr_k': 0.15586413403285848, 'slip_spread_k': 0.15695505640930763, 'spread_hl_frac': 0.021957246353642303, 'bb_std_mult': 1.2131452923788353, 'rsi_os': 15, 'rsi_ob': 88, 'vol_spike': 0.05510766638458453, 'adx_thresh': 27.69281102805453, 'atr_min_pct': 0.012978727891895478, 'atr_max_pct': 0.12413193993274761, 'tp_mult': 2.4947136836248887, 'tsl_mult': 0.5563231168119102, 'strategy': 'mean_reversion', 'time_stop': 139, 'use_sma': True, 'use_atr': True, 'use_adx': False, 'use_ema': False, 'use_spike': True, 'rsi_required': False, 'edge_k': 0.5693016841441679, 'edge_cap': 0.3269345054436876, 'bull_strategy': 'mean_reversion', 'bull_bb_std_mult': 1.9294939604832342, 'bull_rsi_os': 16, 'bull_rsi_ob': 70, 'bull_adx_thresh': 16.870069769000267, 'bull_atr_min_pct': 0.026326212614833686, 'bull_atr_max_pct': 0.09923752543100511, 'bull_tp_mult': 2.3133233402511952, 'bull_tsl_mult': 0.38100635246672404, 'bull_time_stop': 245, 'bull_use_sma': False, 'bull_use_ema': False, 'bull_use_atr': True, 'bull_use_adx': False, 'bull_use_spike': True, 'bull_rsi_required': True, 'bear_strategy': 'breakout', 'bear_bb_std_mult': 1.5648061352623466, 'bear_rsi_os': 28, 'bear_rsi_ob': 77, 'bear_adx_thresh': 13.31296381848643, 'bear_atr_min_pct': 0.02987595761415382, 'bear_atr_max_pct': 0.1400773482490432, 'bear_tp_mult': 2.7492463467122814, 'bear_tsl_mult': 0.7990751918479554, 'bear_time_stop': 263, 'bear_use_sma': False, 'bear_use_ema': False, 'bear_use_atr': True, 'bear_use_adx': True, 'bear_use_spike': False, 'bear_rsi_required': False, 'sideways_strategy': 'mean_reversion', 'sideways_bb_std_mult': 2.415017954734232, 'sideways_rsi_os': 30, 'sideways_rsi_ob': 55, 'sideways_adx_thresh': 25.202377434549522, 'sideways_atr_min_pct': 0.0019902982423008132, 'sideways_atr_max_pct': 0.06601612992864501, 'sideways_tp_mult': 1.5145054478752429, 'sideways_tsl_mult': 0.8574077466815436, 'sideways_time_stop': 56, 'sideways_use_sma': True, 'sideways_use_ema': False, 'sideways_use_atr': False, 'sideways_use_adx': False, 'sideways_use_spike': False, 'sideways_rsi_required': False}.
[I 2025-09-01 09:22:50,768] Trial 130 finished with values: [-1000000000.0, 1000000000.0] and parameters: {'p_sma': 60, 'p_std': 15, 'p_atr': 30, 'p_adx': 10, 'rsi_period': 65, 'ema1': 6, 'ema2': 56, 'slip_atr_k': 0.022142038576106707, 'slip_spread_k': 0.19772450106444778, 'spread_hl_frac': 0.01717237197170319, 'bb_std_mult': 2.7845458046940816, 'rsi_os': 38, 'rsi_ob': 60, 'vol_spike': 0.15224144895978295, 'adx_thresh': 11.300194158828072, 'atr_min_pct': 0.020453285478998284, 'atr_max_pct': 0.02154361101905956, 'tp_mult': 2.4701086537869337, 'tsl_mult': 0.22613404113466223, 'strategy': 'mean_reversion', 'time_stop': 165, 'use_sma': True, 'use_atr': True, 'use_adx': True, 'use_ema': False, 'use_spike': True, 'rsi_required': False, 'edge_k': 1.9214438112741832, 'edge_cap': 0.2519926439146736, 'bull_strategy': 'mean_reversion', 'bull_bb_std_mult': 1.6193369033226594, 'bull_rsi_os': 22, 'bull_rsi_ob': 52, 'bull_adx_thresh': 16.994460774536442, 'bull_atr_min_pct': 0.02784079950308626, 'bull_atr_max_pct': 0.02617817061291149, 'bull_tp_mult': 1.7516955688212463, 'bull_tsl_mult': 0.11968960591641098, 'bull_time_stop': 246, 'bull_use_sma': False, 'bull_use_ema': False, 'bull_use_atr': True, 'bull_use_adx': True, 'bull_use_spike': True, 'bull_rsi_required': False, 'bear_strategy': 'breakout', 'bear_bb_std_mult': 1.537152581236494, 'bear_rsi_os': 28, 'bear_rsi_ob': 84, 'bear_adx_thresh': 6.773056508010992, 'bear_atr_min_pct': 0.029858917158077806, 'bear_atr_max_pct': 0.034386532087608966, 'bear_tp_mult': 2.498282392455745, 'bear_tsl_mult': 0.8048867875848827, 'bear_time_stop': 192, 'bear_use_sma': False, 'bear_use_ema': False, 'bear_use_atr': False, 'bear_use_adx': True, 'bear_use_spike': False, 'bear_rsi_required': False, 'sideways_strategy': 'mean_reversion', 'sideways_bb_std_mult': 2.4083241600387706, 'sideways_rsi_os': 19, 'sideways_rsi_ob': 68, 'sideways_adx_thresh': 5.060909459158314, 'sideways_atr_min_pct': 0.00183693776677594, 'sideways_atr_max_pct': 0.06598516567006908, 'sideways_tp_mult': 1.853232660209773, 'sideways_tsl_mult': 0.8489807711384875, 'sideways_time_stop': 128, 'sideways_use_sma': False, 'sideways_use_ema': False, 'sideways_use_atr': False, 'sideways_use_adx': False, 'sideways_use_spike': False, 'sideways_rsi_required': False}.
[I 2025-09-01 09:22:51,014] Trial 131 finished with values: [-1000000000.0, 1000000000.0] and parameters: {'p_sma': 31, 'p_std': 38, 'p_atr': 30, 'p_adx': 10, 'rsi_period': 70, 'ema1': 6, 'ema2': 56, 'slip_atr_k': 0.174898427313579, 'slip_spread_k': 0.7095452012419629, 'spread_hl_frac': 0.01719848572542997, 'bb_std_mult': 1.3589422706934169, 'rsi_os': 44, 'rsi_ob': 60, 'vol_spike': 0.15056252468579123, 'adx_thresh': 26.085611720037853, 'atr_min_pct': 0.020134717909252562, 'atr_max_pct': 0.021758604751448897, 'tp_mult': 2.8014035568444484, 'tsl_mult': 0.2159561782579218, 'strategy': 'mean_reversion', 'time_stop': 151, 'use_sma': True, 'use_atr': True, 'use_adx': False, 'use_ema': False, 'use_spike': True, 'rsi_required': False, 'edge_k': 0.47477877672271307, 'edge_cap': 0.2797919593878696, 'bull_strategy': 'mean_reversion', 'bull_bb_std_mult': 3.003755569601225, 'bull_rsi_os': 16, 'bull_rsi_ob': 70, 'bull_adx_thresh': 8.23509876002224, 'bull_atr_min_pct': 0.013120301128658812, 'bull_atr_max_pct': 0.03243510916305812, 'bull_tp_mult': 2.2621527321385178, 'bull_tsl_mult': 0.481390958813689, 'bull_time_stop': 99, 'bull_use_sma': False, 'bull_use_ema': False, 'bull_use_atr': True, 'bull_use_adx': True, 'bull_use_spike': True, 'bull_rsi_required': False, 'bear_strategy': 'breakout', 'bear_bb_std_mult': 1.4152906174876554, 'bear_rsi_os': 28, 'bear_rsi_ob': 77, 'bear_adx_thresh': 13.193311224943345, 'bear_atr_min_pct': 0.01327996512470363, 'bear_atr_max_pct': 0.03559512238197609, 'bear_tp_mult': 2.999732019368036, 'bear_tsl_mult': 0.8304144373154927, 'bear_time_stop': 133, 'bear_use_sma': False, 'bear_use_ema': False, 'bear_use_atr': True, 'bear_use_adx': True, 'bear_use_spike': False, 'bear_rsi_required': False, 'sideways_strategy': 'mean_reversion', 'sideways_bb_std_mult': 3.14176171190619, 'sideways_rsi_os': 30, 'sideways_rsi_ob': 83, 'sideways_adx_thresh': 21.43191642609158, 'sideways_atr_min_pct': 0.004596227224157638, 'sideways_atr_max_pct': 0.07728483322302153, 'sideways_tp_mult': 1.531033315470966, 'sideways_tsl_mult': 0.856353588774304, 'sideways_time_stop': 135, 'sideways_use_sma': True, 'sideways_use_ema': False, 'sideways_use_atr': False, 'sideways_use_adx': False, 'sideways_use_spike': False, 'sideways_rsi_required': False}.
[I 2025-09-01 09:22:51,348] Trial 133 finished with values: [-1000000000.0, 1000000000.0] and parameters: {'p_sma': 40, 'p_std': 40, 'p_atr': 30, 'p_adx': 9, 'rsi_period': 40, 'ema1': 22, 'ema2': 31, 'slip_atr_k': 0.03251560422761726, 'slip_spread_k': 0.2721573364458171, 'spread_hl_frac': 0.02060944057832829, 'bb_std_mult': 2.623867110424296, 'rsi_os': 18, 'rsi_ob': 49, 'vol_spike': 0.150441533001497, 'adx_thresh': 14.22034170173952, 'atr_min_pct': 0.014407359039598139, 'atr_max_pct': 0.0695240066632726, 'tp_mult': 2.3974215203487153, 'tsl_mult': 0.3878833262222686, 'strategy': 'mean_reversion', 'time_stop': 167, 'use_sma': True, 'use_atr': True, 'use_adx': False, 'use_ema': False, 'use_spike': True, 'rsi_required': False, 'edge_k': 0.4660678636476184, 'edge_cap': 0.2815737933650167, 'bull_strategy': 'mean_reversion', 'bull_bb_std_mult': 3.094825649780308, 'bull_rsi_os': 38, 'bull_rsi_ob': 57, 'bull_adx_thresh': 18.508473995353135, 'bull_atr_min_pct': 0.01860551008978751, 'bull_atr_max_pct': 0.017921051094277447, 'bull_tp_mult': 2.249721912772683, 'bull_tsl_mult': 0.47625462652224587, 'bull_time_stop': 29, 'bull_use_sma': False, 'bull_use_ema': False, 'bull_use_atr': True, 'bull_use_adx': True, 'bull_use_spike': True, 'bull_rsi_required': False, 'bear_strategy': 'breakout', 'bear_bb_std_mult': 1.8720167916053516, 'bear_rsi_os': 23, 'bear_rsi_ob': 74, 'bear_adx_thresh': 22.18015478199172, 'bear_atr_min_pct': 0.019392992032588034, 'bear_atr_max_pct': 0.098579233653681, 'bear_tp_mult': 2.4949163708326787, 'bear_tsl_mult': 0.5043477425180951, 'bear_time_stop': 189, 'bear_use_sma': False, 'bear_use_ema': False, 'bear_use_atr': True, 'bear_use_adx': True, 'bear_use_spike': False, 'bear_rsi_required': False, 'sideways_strategy': 'mean_reversion', 'sideways_bb_std_mult': 1.3598580923254646, 'sideways_rsi_os': 34, 'sideways_rsi_ob': 67, 'sideways_adx_thresh': 21.358931980775516, 'sideways_atr_min_pct': 0.007398010511878577, 'sideways_atr_max_pct': 0.14512888507952326, 'sideways_tp_mult': 1.3235545466340362, 'sideways_tsl_mult': 0.49813891616254996, 'sideways_time_stop': 206, 'sideways_use_sma': True, 'sideways_use_ema': False, 'sideways_use_atr': False, 'sideways_use_adx': False, 'sideways_use_spike': False, 'sideways_rsi_required': False}.
[I 2025-09-01 09:23:28,373] Trial 132 finished with values: [-1000000000.0, 1000000000.0] and parameters: {'p_sma': 39, 'p_std': 40, 'p_atr': 30, 'p_adx': 9, 'rsi_period': 41, 'ema1': 22, 'ema2': 60, 'slip_atr_k': 0.17719568816972028, 'slip_spread_k': 0.2758010760390741, 'spread_hl_frac': 0.020618204232085383, 'bb_std_mult': 2.6354673158220994, 'rsi_os': 44, 'rsi_ob': 60, 'vol_spike': 0.14960669904547086, 'adx_thresh': 14.404817502081588, 'atr_min_pct': 0.014913822286350277, 'atr_max_pct': 0.05644189075873555, 'tp_mult': 2.99587807727604, 'tsl_mult': 0.38297855462098784, 'strategy': 'mean_reversion', 'time_stop': 246, 'use_sma': True, 'use_atr': True, 'use_adx': False, 'use_ema': False, 'use_spike': True, 'rsi_required': False, 'edge_k': 0.4774626833813496, 'edge_cap': 0.2561313050907244, 'bull_strategy': 'mean_reversion', 'bull_bb_std_mult': 1.743867359934593, 'bull_rsi_os': 22, 'bull_rsi_ob': 52, 'bull_adx_thresh': 18.537855932552308, 'bull_atr_min_pct': 0.013261845371319959, 'bull_atr_max_pct': 0.10019395242536012, 'bull_tp_mult': 2.258722466183028, 'bull_tsl_mult': 0.4746751080860205, 'bull_time_stop': 244, 'bull_use_sma': False, 'bull_use_ema': False, 'bull_use_atr': True, 'bull_use_adx': True, 'bull_use_spike': True, 'bull_rsi_required': False, 'bear_strategy': 'breakout', 'bear_bb_std_mult': 0.9314715117072405, 'bear_rsi_os': 27, 'bear_rsi_ob': 77, 'bear_adx_thresh': 15.466187979414066, 'bear_atr_min_pct': 0.029754313054714716, 'bear_atr_max_pct': 0.1002630260322019, 'bear_tp_mult': 2.9981055672231856, 'bear_tsl_mult': 0.03437867143372453, 'bear_time_stop': 190, 'bear_use_sma': False, 'bear_use_ema': False, 'bear_use_atr': True, 'bear_use_adx': True, 'bear_use_spike': False, 'bear_rsi_required': False, 'sideways_strategy': 'mean_reversion', 'sideways_bb_std_mult': 2.2194288721222644, 'sideways_rsi_os': 23, 'sideways_rsi_ob': 85, 'sideways_adx_thresh': 30.900255743617983, 'sideways_atr_min_pct': 0.02680944255491067, 'sideways_atr_max_pct': 0.14515744971905642, 'sideways_tp_mult': 1.531062763520966, 'sideways_tsl_mult': 0.8479614818480598, 'sideways_time_stop': 209, 'sideways_use_sma': True, 'sideways_use_ema': False, 'sideways_use_atr': False, 'sideways_use_adx': False, 'sideways_use_spike': False, 'sideways_rsi_required': False}.
[I 2025-09-01 09:23:28,869] Trial 135 finished with values: [-1000000000.0, 1000000000.0] and parameters: {'p_sma': 57, 'p_std': 40, 'p_atr': 10, 'p_adx': 11, 'rsi_period': 40, 'ema1': 22, 'ema2': 49, 'slip_atr_k': 0.008782536732077502, 'slip_spread_k': 0.28278036575611903, 'spread_hl_frac': 0.020556753310613678, 'bb_std_mult': 2.0174662210268663, 'rsi_os': 19, 'rsi_ob': 57, 'vol_spike': 0.1604504677481853, 'adx_thresh': 14.38079473650032, 'atr_min_pct': 0.014804639636959882, 'atr_max_pct': 0.1116061322949097, 'tp_mult': 2.4014892096370226, 'tsl_mult': 0.3787118063870876, 'strategy': 'mean_reversion', 'time_stop': 61, 'use_sma': True, 'use_atr': True, 'use_adx': False, 'use_ema': False, 'use_spike': True, 'rsi_required': False, 'edge_k': 1.1315780402341524, 'edge_cap': 0.28416803449562933, 'bull_strategy': 'mean_reversion', 'bull_bb_std_mult': 1.7321038504896136, 'bull_rsi_os': 31, 'bull_rsi_ob': 57, 'bull_adx_thresh': 34.96096542245925, 'bull_atr_min_pct': 0.010871749518827412, 'bull_atr_max_pct': 0.037904172070258105, 'bull_tp_mult': 1.8494188321862237, 'bull_tsl_mult': 0.20113809197160504, 'bull_time_stop': 31, 'bull_use_sma': False, 'bull_use_ema': False, 'bull_use_atr': True, 'bull_use_adx': False, 'bull_use_spike': True, 'bull_rsi_required': False, 'bear_strategy': 'mean_reversion', 'bear_bb_std_mult': 1.326234389119383, 'bear_rsi_os': 30, 'bear_rsi_ob': 88, 'bear_adx_thresh': 15.453695136568703, 'bear_atr_min_pct': 0.01689308163777451, 'bear_atr_max_pct': 0.10932508792532376, 'bear_tp_mult': 2.949952248649826, 'bear_tsl_mult': 0.7786895630311254, 'bear_time_stop': 70, 'bear_use_sma': False, 'bear_use_ema': False, 'bear_use_atr': True, 'bear_use_adx': True, 'bear_use_spike': False, 'bear_rsi_required': False, 'sideways_strategy': 'breakout', 'sideways_bb_std_mult': 2.2202340269945475, 'sideways_rsi_os': 23, 'sideways_rsi_ob': 92, 'sideways_adx_thresh': 23.880148047475508, 'sideways_atr_min_pct': 0.0029879703835264653, 'sideways_atr_max_pct': 0.08814090638596057, 'sideways_tp_mult': 1.371295712839292, 'sideways_tsl_mult': 0.4741422976790993, 'sideways_time_stop': 205, 'sideways_use_sma': True, 'sideways_use_ema': False, 'sideways_use_atr': False, 'sideways_use_adx': True, 'sideways_use_spike': False, 'sideways_rsi_required': False}.
