[I 2025-09-01 10:37:34,632] Trial 567 finished with values: [-1000000000.0, 1000000000.0] and parameters: {'p_sma': 26, 'p_std': 41, 'p_atr': 29, 'p_adx': 19, 'rsi_period': 81, 'ema1': 10, 'ema2': 13, 'slip_atr_k': 0.012658797510219125, 'slip_spread_k': 0.512903610970297, 'spread_hl_frac': 0.0357025572796237, 'bb_std_mult': 2.597902643708826, 'rsi_os': 9, 'rsi_ob': 58, 'vol_spike': 0.27467561851892397, 'adx_thresh': 7.194198903571122, 'atr_min_pct': 0.019355297223280946, 'atr_max_pct': 0.06932918887780933, 'tp_mult': 2.7599063792863747, 'tsl_mult': 0.8943324479589789, 'strategy': 'breakout', 'time_stop': 17, 'use_sma': False, 'use_atr': False, 'use_adx': False, 'use_ema': True, 'use_spike': True, 'rsi_required': True, 'edge_k': 0.6272914213930029, 'edge_cap': 0.7766430072192636, 'bull_strategy': 'breakout', 'bull_bb_std_mult': 3.411753431386184, 'bull_rsi_os': 38, 'bull_rsi_ob': 87, 'bull_adx_thresh': 10.820944411041042, 'bull_atr_min_pct': 0.006073663568612142, 'bull_atr_max_pct': 0.08532469642990799, 'bull_tp_mult': 2.7798770267881423, 'bull_tsl_mult': 0.9471514450995865, 'bull_time_stop': 122, 'bull_use_sma': True, 'bull_use_ema': True, 'bull_use_atr': False, 'bull_use_adx': False, 'bull_use_spike': False, 'bull_rsi_required': False, 'bear_strategy': 'mean_reversion', 'bear_bb_std_mult': 2.7717537505654004, 'bear_rsi_os': 25, 'bear_rsi_ob': 68, 'bear_adx_thresh': 34.0265059964871, 'bear_atr_min_pct': 0.028834722016246376, 'bear_atr_max_pct': 0.061241806248540115, 'bear_tp_mult': 2.838604404155225, 'bear_tsl_mult': 0.8507426950805538, 'bear_time_stop': 84, 'bear_use_sma': False, 'bear_use_ema': True, 'bear_use_atr': False, 'bear_use_adx': False, 'bear_use_spike': False, 'bear_rsi_required': False, 'sideways_strategy': 'mean_reversion', 'sideways_bb_std_mult': 3.0494669087114277, 'sideways_rsi_os': 32, 'sideways_rsi_ob': 59, 'sideways_adx_thresh': 24.508802814255855, 'sideways_atr_min_pct': 2.8461348383892072e-05, 'sideways_atr_max_pct': 0.04851143181871568, 'sideways_tp_mult': 2.6991860724639993, 'sideways_tsl_mult': 0.31635910625140495, 'sideways_time_stop': 200, 'sideways_use_sma': False, 'sideways_use_ema': True, 'sideways_use_atr': True, 'sideways_use_adx': True, 'sideways_use_spike': True, 'sideways_rsi_required': True}.
[I 2025-09-01 10:38:19,671] Trial 570 finished with values: [-1000000000.0, 1000000000.0] and parameters: {'p_sma': 58, 'p_std': 20, 'p_atr': 7, 'p_adx': 7, 'rsi_period': 16, 'ema1': 7, 'ema2': 41, 'slip_atr_k': 0.004704345668377019, 'slip_spread_k': 0.6049406178524399, 'spread_hl_frac': 0.019428598552758476, 'bb_std_mult': 1.3066695097918908, 'rsi_os': 39, 'rsi_ob': 53, 'vol_spike': 0.22400810222093717, 'adx_thresh': 7.1879248144463315, 'atr_min_pct': 0.01770905456889101, 'atr_max_pct': 0.08675400935758744, 'tp_mult': 2.465840503895844, 'tsl_mult': 0.8854382246341842, 'strategy': 'breakout', 'time_stop': 156, 'use_sma': False, 'use_atr': False, 'use_adx': False, 'use_ema': True, 'use_spike': True, 'rsi_required': True, 'edge_k': 0.38184287404254447, 'edge_cap': 0.775180372959801, 'bull_strategy': 'breakout', 'bull_bb_std_mult': 3.3153369283082172, 'bull_rsi_os': 39, 'bull_rsi_ob': 77, 'bull_adx_thresh': 28.165905617090623, 'bull_atr_min_pct': 0.020158467038125308, 'bull_atr_max_pct': 0.020651544152349176, 'bull_tp_mult': 1.6988692979975524, 'bull_tsl_mult': 0.8806490979913245, 'bull_time_stop': 121, 'bull_use_sma': True, 'bull_use_ema': True, 'bull_use_atr': False, 'bull_use_adx': False, 'bull_use_spike': False, 'bull_rsi_required': False, 'bear_strategy': 'breakout', 'bear_bb_std_mult': 2.097994399466319, 'bear_rsi_os': 44, 'bear_rsi_ob': 75, 'bear_adx_thresh': 30.553404294368534, 'bear_atr_min_pct': 0.02617463176164167, 'bear_atr_max_pct': 0.02157995824943229, 'bear_tp_mult': 2.841055260074644, 'bear_tsl_mult': 0.8158269340250615, 'bear_time_stop': 67, 'bear_use_sma': True, 'bear_use_ema': False, 'bear_use_atr': False, 'bear_use_adx': False, 'bear_use_spike': False, 'bear_rsi_required': False, 'sideways_strategy': 'mean_reversion', 'sideways_bb_std_mult': 3.551630044796948, 'sideways_rsi_os': 29, 'sideways_rsi_ob': 59, 'sideways_adx_thresh': 32.56069582783795, 'sideways_atr_min_pct': 0.024410374590459197, 'sideways_atr_max_pct': 0.09710630299540651, 'sideways_tp_mult': 1.2953768151417215, 'sideways_tsl_mult': 0.3142501537457883, 'sideways_time_stop': 99, 'sideways_use_sma': False, 'sideways_use_ema': True, 'sideways_use_atr': True, 'sideways_use_adx': False, 'sideways_use_spike': False, 'sideways_rsi_required': True}.
[I 2025-09-01 10:38:21,381] Trial 571 finished with values: [-1000000000.0, 1000000000.0] and parameters: {'p_sma': 54, 'p_std': 15, 'p_atr': 7, 'p_adx': 10, 'rsi_period': 48, 'ema1': 7, 'ema2': 40, 'slip_atr_k': 0.004582921161714784, 'slip_spread_k': 0.5982100410548528, 'spread_hl_frac': 0.010938137024974579, 'bb_std_mult': 2.5805294102126983, 'rsi_os': 10, 'rsi_ob': 46, 'vol_spike': 0.2107218190422424, 'adx_thresh': 13.554816653926927, 'atr_min_pct': 0.006328246971911864, 'atr_max_pct': 0.09264468378036603, 'tp_mult': 2.473569472936773, 'tsl_mult': 0.8372084412490863, 'strategy': 'breakout', 'time_stop': 157, 'use_sma': False, 'use_atr': False, 'use_adx': False, 'use_ema': True, 'use_spike': True, 'rsi_required': True, 'edge_k': 0.811273497155697, 'edge_cap': 0.5732485912477892, 'bull_strategy': 'breakout', 'bull_bb_std_mult': 3.340885568360304, 'bull_rsi_os': 40, 'bull_rsi_ob': 57, 'bull_adx_thresh': 28.424338196151215, 'bull_atr_min_pct': 0.02023850722921197, 'bull_atr_max_pct': 0.022312465103671575, 'bull_tp_mult': 2.412666768357633, 'bull_tsl_mult': 0.8850974726158404, 'bull_time_stop': 132, 'bull_use_sma': True, 'bull_use_ema': True, 'bull_use_atr': False, 'bull_use_adx': False, 'bull_use_spike': True, 'bull_rsi_required': False, 'bear_strategy': 'breakout', 'bear_bb_std_mult': 3.1334498911290263, 'bear_rsi_os': 44, 'bear_rsi_ob': 75, 'bear_adx_thresh': 34.98382102422022, 'bear_atr_min_pct': 0.026311493812321878, 'bear_atr_max_pct': 0.13324090805224695, 'bear_tp_mult': 2.8402816774036226, 'bear_tsl_mult': 0.9249713727593, 'bear_time_stop': 11, 'bear_use_sma': True, 'bear_use_ema': False, 'bear_use_atr': False, 'bear_use_adx': False, 'bear_use_spike': False, 'bear_rsi_required': False, 'sideways_strategy': 'mean_reversion', 'sideways_bb_std_mult': 2.491866563225299, 'sideways_rsi_os': 29, 'sideways_rsi_ob': 60, 'sideways_adx_thresh': 32.57113163058083, 'sideways_atr_min_pct': 0.02602251067973678, 'sideways_atr_max_pct': 0.08626547479182917, 'sideways_tp_mult': 2.500972256699521, 'sideways_tsl_mult': 0.8487961016769215, 'sideways_time_stop': 219, 'sideways_use_sma': False, 'sideways_use_ema': True, 'sideways_use_atr': False, 'sideways_use_adx': False, 'sideways_use_spike': False, 'sideways_rsi_required': True}.
[I 2025-09-01 10:38:22,321] Trial 569 finished with values: [-1000000000.0, 1000000000.0] and parameters: {'p_sma': 58, 'p_std': 47, 'p_atr': 20, 'p_adx': 29, 'rsi_period': 66, 'ema1': 7, 'ema2': 10, 'slip_atr_k': 0.005533798876869691, 'slip_spread_k': 0.2547568846976984, 'spread_hl_frac': 0.0028821970103884986, 'bb_std_mult': 2.5979710823565005, 'rsi_os': 9, 'rsi_ob': 58, 'vol_spike': 0.21039881649620937, 'adx_thresh': 21.907365420805547, 'atr_min_pct': 0.019377075302265824, 'atr_max_pct': 0.06933089397029385, 'tp_mult': 2.4671463167762955, 'tsl_mult': 0.8836612050785717, 'strategy': 'breakout', 'time_stop': 157, 'use_sma': False, 'use_atr': False, 'use_adx': False, 'use_ema': True, 'use_spike': True, 'rsi_required': True, 'edge_k': 0.7941667877312946, 'edge_cap': 0.872075389945496, 'bull_strategy': 'breakout', 'bull_bb_std_mult': 1.2620673487933112, 'bull_rsi_os': 40, 'bull_rsi_ob': 79, 'bull_adx_thresh': 27.098458672062243, 'bull_atr_min_pct': 0.020088995808700515, 'bull_atr_max_pct': 0.021223565449064376, 'bull_tp_mult': 1.4522432512364016, 'bull_tsl_mult': 0.33488778317690093, 'bull_time_stop': 132, 'bull_use_sma': True, 'bull_use_ema': True, 'bull_use_atr': False, 'bull_use_adx': False, 'bull_use_spike': False, 'bull_rsi_required': False, 'bear_strategy': 'breakout', 'bear_bb_std_mult': 2.7780194964354346, 'bear_rsi_os': 27, 'bear_rsi_ob': 68, 'bear_adx_thresh': 34.99567969206815, 'bear_atr_min_pct': 0.012902184593421233, 'bear_atr_max_pct': 0.1330053288858902, 'bear_tp_mult': 2.8420379626512626, 'bear_tsl_mult': 0.20995729150907128, 'bear_time_stop': 11, 'bear_use_sma': True, 'bear_use_ema': False, 'bear_use_atr': False, 'bear_use_adx': False, 'bear_use_spike': False, 'bear_rsi_required': False, 'sideways_strategy': 'mean_reversion', 'sideways_bb_std_mult': 2.934771349842591, 'sideways_rsi_os': 29, 'sideways_rsi_ob': 62, 'sideways_adx_thresh': 11.767078478412435, 'sideways_atr_min_pct': 3.8906020260414884e-05, 'sideways_atr_max_pct': 0.08717731597065465, 'sideways_tp_mult': 2.5283309702712016, 'sideways_tsl_mult': 0.9207444406468331, 'sideways_time_stop': 218, 'sideways_use_sma': False, 'sideways_use_ema': True, 'sideways_use_atr': False, 'sideways_use_adx': False, 'sideways_use_spike': False, 'sideways_rsi_required': True}.
[I 2025-09-01 10:38:22,971] Trial 568 finished with values: [-1000000000.0, 1000000000.0] and parameters: {'p_sma': 59, 'p_std': 47, 'p_atr': 20, 'p_adx': 14, 'rsi_period': 14, 'ema1': 11, 'ema2': 10, 'slip_atr_k': 0.0396242299888965, 'slip_spread_k': 0.5399795543813594, 'spread_hl_frac': 0.0025572353241634788, 'bb_std_mult': 3.3300293255845532, 'rsi_os': 17, 'rsi_ob': 53, 'vol_spike': 0.015286080461964502, 'adx_thresh': 21.892514445898513, 'atr_min_pct': 0.023050961755869792, 'atr_max_pct': 0.06964950362396398, 'tp_mult': 2.8912186547360017, 'tsl_mult': 0.8401884539366237, 'strategy': 'breakout', 'time_stop': 16, 'use_sma': False, 'use_atr': False, 'use_adx': False, 'use_ema': True, 'use_spike': True, 'rsi_required': True, 'edge_k': 0.7981630188234143, 'edge_cap': 0.571139709738754, 'bull_strategy': 'breakout', 'bull_bb_std_mult': 2.846465989559796, 'bull_rsi_os': 52, 'bull_rsi_ob': 67, 'bull_adx_thresh': 10.829165810626261, 'bull_atr_min_pct': 0.0059329664461105665, 'bull_atr_max_pct': 0.05340041512648304, 'bull_tp_mult': 1.062605100162811, 'bull_tsl_mult': 0.4317655789890376, 'bull_time_stop': 129, 'bull_use_sma': True, 'bull_use_ema': True, 'bull_use_atr': False, 'bull_use_adx': False, 'bull_use_spike': True, 'bull_rsi_required': False, 'bear_strategy': 'breakout', 'bear_bb_std_mult': 1.5989623661175192, 'bear_rsi_os': 25, 'bear_rsi_ob': 85, 'bear_adx_thresh': 33.98327470720776, 'bear_atr_min_pct': 0.02886149947506599, 'bear_atr_max_pct': 0.1328629655531791, 'bear_tp_mult': 2.8368276070223, 'bear_tsl_mult': 0.6043156421906, 'bear_time_stop': 10, 'bear_use_sma': False, 'bear_use_ema': False, 'bear_use_atr': False, 'bear_use_adx': False, 'bear_use_spike': False, 'bear_rsi_required': False, 'sideways_strategy': 'mean_reversion', 'sideways_bb_std_mult': 1.2671121310123046, 'sideways_rsi_os': 32, 'sideways_rsi_ob': 62, 'sideways_adx_thresh': 32.80947212029518, 'sideways_atr_min_pct': 0.0005141461287078365, 'sideways_atr_max_pct': 0.09743552080024573, 'sideways_tp_mult': 2.7380035074602427, 'sideways_tsl_mult': 0.9302442215687423, 'sideways_time_stop': 218, 'sideways_use_sma': False, 'sideways_use_ema': True, 'sideways_use_atr': False, 'sideways_use_adx': False, 'sideways_use_spike': True, 'sideways_rsi_required': True}.
[I 2025-09-01 10:39:04,707] Trial 572 finished with values: [-0.013008549135829162, 0.013624212962995014] and parameters: {'p_sma': 60, 'p_std': 58, 'p_atr': 8, 'p_adx': 10, 'rsi_period': 48, 'ema1': 9, 'ema2': 10, 'slip_atr_k': 0.20573482117898267, 'slip_spread_k': 0.9831310348547764, 'spread_hl_frac': 0.006897270060449019, 'bb_std_mult': 2.732725849533246, 'rsi_os': 19, 'rsi_ob': 55, 'vol_spike': 0.2113162131151581, 'adx_thresh': 13.38774738802746, 'atr_min_pct': 0.025970590383409438, 'atr_max_pct': 0.07417777105136046, 'tp_mult': 1.4145253715705048, 'tsl_mult': 0.8363309244341011, 'strategy': 'breakout', 'time_stop': 135, 'use_sma': True, 'use_atr': True, 'use_adx': False, 'use_ema': False, 'use_spike': True, 'rsi_required': False, 'edge_k': 0.767067856319328, 'edge_cap': 0.06575340016386638, 'bull_strategy': 'mean_reversion', 'bull_bb_std_mult': 1.9184396869065639, 'bull_rsi_os': 40, 'bull_rsi_ob': 79, 'bull_adx_thresh': 27.287968744722914, 'bull_atr_min_pct': 0.0032591581657573777, 'bull_atr_max_pct': 0.06596243205278636, 'bull_tp_mult': 2.4051905529132456, 'bull_tsl_mult': 0.9117866437717511, 'bull_time_stop': 133, 'bull_use_sma': True, 'bull_use_ema': False, 'bull_use_atr': True, 'bull_use_adx': False, 'bull_use_spike': True, 'bull_rsi_required': False, 'bear_strategy': 'breakout', 'bear_bb_std_mult': 1.961733259747013, 'bear_rsi_os': 37, 'bear_rsi_ob': 72, 'bear_adx_thresh': 33.258397037943695, 'bear_atr_min_pct': 0.029412844708448235, 'bear_atr_max_pct': 0.13261174268615258, 'bear_tp_mult': 1.5093604524467432, 'bear_tsl_mult': 0.9109519704451932, 'bear_time_stop': 130, 'bear_use_sma': False, 'bear_use_ema': False, 'bear_use_atr': True, 'bear_use_adx': True, 'bear_use_spike': True, 'bear_rsi_required': False, 'sideways_strategy': 'mean_reversion', 'sideways_bb_std_mult': 2.4772491645725587, 'sideways_rsi_os': 8, 'sideways_rsi_ob': 82, 'sideways_adx_thresh': 18.24535263524279, 'sideways_atr_min_pct': 0.0007874740653810498, 'sideways_atr_max_pct': 0.08735175853416507, 'sideways_tp_mult': 2.4855864437884714, 'sideways_tsl_mult': 0.5735310619769651, 'sideways_time_stop': 207, 'sideways_use_sma': True, 'sideways_use_ema': False, 'sideways_use_atr': False, 'sideways_use_adx': False, 'sideways_use_spike': True, 'sideways_rsi_required': False}.
[I 2025-09-01 10:39:04,997] Trial 575 finished with values: [-1000000000.0, 1000000000.0] and parameters: {'p_sma': 60, 'p_std': 32, 'p_atr': 28, 'p_adx': 10, 'rsi_period': 40, 'ema1': 30, 'ema2': 10, 'slip_atr_k': 0.04990115307482762, 'slip_spread_k': 0.6365811973670645, 'spread_hl_frac': 0.02931335713986094, 'bb_std_mult': 1.7222431818833464, 'rsi_os': 13, 'rsi_ob': 65, 'vol_spike': 0.04824928626704006, 'adx_thresh': 13.076558448456595, 'atr_min_pct': 0.018142620458319162, 'atr_max_pct': 0.07515244665664851, 'tp_mult': 1.5971417414239533, 'tsl_mult': 0.7840142221287518, 'strategy': 'breakout', 'time_stop': 135, 'use_sma': True, 'use_atr': True, 'use_adx': True, 'use_ema': False, 'use_spike': True, 'rsi_required': False, 'edge_k': 1.1336476518866414, 'edge_cap': 0.8427473116530961, 'bull_strategy': 'mean_reversion', 'bull_bb_std_mult': 3.540165024312685, 'bull_rsi_os': 17, 'bull_rsi_ob': 60, 'bull_adx_thresh': 19.085588030403358, 'bull_atr_min_pct': 0.003339798250909017, 'bull_atr_max_pct': 0.07505862277801317, 'bull_tp_mult': 1.5464640709883524, 'bull_tsl_mult': 0.9150894266634139, 'bull_time_stop': 144, 'bull_use_sma': False, 'bull_use_ema': False, 'bull_use_atr': True, 'bull_use_adx': False, 'bull_use_spike': True, 'bull_rsi_required': False, 'bear_strategy': 'breakout', 'bear_bb_std_mult': 1.2545310455876426, 'bear_rsi_os': 42, 'bear_rsi_ob': 72, 'bear_adx_thresh': 33.23591318647897, 'bear_atr_min_pct': 0.0220832462363986, 'bear_atr_max_pct': 0.095820997993874, 'bear_tp_mult': 1.2831642933791532, 'bear_tsl_mult': 0.8042490138151562, 'bear_time_stop': 40, 'bear_use_sma': False, 'bear_use_ema': True, 'bear_use_atr': True, 'bear_use_adx': True, 'bear_use_spike': True, 'bear_rsi_required': True, 'sideways_strategy': 'breakout', 'sideways_bb_std_mult': 2.3875482634747023, 'sideways_rsi_os': 45, 'sideways_rsi_ob': 79, 'sideways_adx_thresh': 30.683831392017808, 'sideways_atr_min_pct': 0.026881580148247722, 'sideways_atr_max_pct': 0.06605320654536152, 'sideways_tp_mult': 2.3804775602154704, 'sideways_tsl_mult': 0.5708860739576713, 'sideways_time_stop': 16, 'sideways_use_sma': True, 'sideways_use_ema': False, 'sideways_use_atr': False, 'sideways_use_adx': False, 'sideways_use_spike': True, 'sideways_rsi_required': False}.
[I 2025-09-01 10:39:05,723] Trial 574 finished with values: [-1000000000.0, 1000000000.0] and parameters: {'p_sma': 60, 'p_std': 43, 'p_atr': 28, 'p_adx': 16, 'rsi_period': 40, 'ema1': 11, 'ema2': 10, 'slip_atr_k': 0.15308698409362326, 'slip_spread_k': 0.547623619731274, 'spread_hl_frac': 0.006760865037097579, 'bb_std_mult': 2.711808957058868, 'rsi_os': 13, 'rsi_ob': 55, 'vol_spike': 0.2042783357975808, 'adx_thresh': 12.875387337568139, 'atr_min_pct': 0.026138140135387206, 'atr_max_pct': 0.07418394104034376, 'tp_mult': 1.4346286041585345, 'tsl_mult': 0.781968573316932, 'strategy': 'breakout', 'time_stop': 41, 'use_sma': True, 'use_atr': True, 'use_adx': True, 'use_ema': False, 'use_spike': True, 'rsi_required': False, 'edge_k': 1.1475285179257313, 'edge_cap': 0.07144209182930938, 'bull_strategy': 'mean_reversion', 'bull_bb_std_mult': 3.1131762858491316, 'bull_rsi_os': 17, 'bull_rsi_ob': 79, 'bull_adx_thresh': 13.874551810360371, 'bull_atr_min_pct': 0.0035044771767924012, 'bull_atr_max_pct': 0.07444705782810739, 'bull_tp_mult': 1.0663942995191893, 'bull_tsl_mult': 0.6611315117192671, 'bull_time_stop': 145, 'bull_use_sma': False, 'bull_use_ema': False, 'bull_use_atr': True, 'bull_use_adx': False, 'bull_use_spike': True, 'bull_rsi_required': False, 'bear_strategy': 'breakout', 'bear_bb_std_mult': 1.600126844105643, 'bear_rsi_os': 20, 'bear_rsi_ob': 72, 'bear_adx_thresh': 33.10129430321904, 'bear_atr_min_pct': 0.0284128310019843, 'bear_atr_max_pct': 0.1383242171670423, 'bear_tp_mult': 1.935767475600108, 'bear_tsl_mult': 0.8022316974481939, 'bear_time_stop': 107, 'bear_use_sma': False, 'bear_use_ema': True, 'bear_use_atr': True, 'bear_use_adx': True, 'bear_use_spike': True, 'bear_rsi_required': True, 'sideways_strategy': 'mean_reversion', 'sideways_bb_std_mult': 2.382371747592039, 'sideways_rsi_os': 8, 'sideways_rsi_ob': 78, 'sideways_adx_thresh': 30.41835972214582, 'sideways_atr_min_pct': 0.001864362231945514, 'sideways_atr_max_pct': 0.12858937447306107, 'sideways_tp_mult': 1.3432339301254985, 'sideways_tsl_mult': 0.1609714496068585, 'sideways_time_stop': 229, 'sideways_use_sma': True, 'sideways_use_ema': False, 'sideways_use_atr': False, 'sideways_use_adx': False, 'sideways_use_spike': True, 'sideways_rsi_required': False}.
[I 2025-09-01 10:39:05,997] Trial 573 finished with values: [-1000000000.0, 1000000000.0] and parameters: {'p_sma': 60, 'p_std': 58, 'p_atr': 10, 'p_adx': 10, 'rsi_period': 61, 'ema1': 11, 'ema2': 10, 'slip_atr_k': 0.05128251709087127, 'slip_spread_k': 0.9766539042635611, 'spread_hl_frac': 0.0028851578275105273, 'bb_std_mult': 1.7423016953237596, 'rsi_os': 8, 'rsi_ob': 55, 'vol_spike': 0.20242970798724355, 'adx_thresh': 13.186199144909413, 'atr_min_pct': 0.018173860953315777, 'atr_max_pct': 0.07465137048312961, 'tp_mult': 1.6080526076120778, 'tsl_mult': 0.7855349478988578, 'strategy': 'breakout', 'time_stop': 40, 'use_sma': True, 'use_atr': True, 'use_adx': True, 'use_ema': False, 'use_spike': True, 'rsi_required': False, 'edge_k': 1.279105652694892, 'edge_cap': 0.0955222661338685, 'bull_strategy': 'mean_reversion', 'bull_bb_std_mult': 3.245928090270996, 'bull_rsi_os': 35, 'bull_rsi_ob': 53, 'bull_adx_thresh': 27.33107795547516, 'bull_atr_min_pct': 0.018003407142426743, 'bull_atr_max_pct': 0.07535567783511936, 'bull_tp_mult': 1.5460504189099522, 'bull_tsl_mult': 0.9097917155994559, 'bull_time_stop': 144, 'bull_use_sma': True, 'bull_use_ema': False, 'bull_use_atr': True, 'bull_use_adx': False, 'bull_use_spike': True, 'bull_rsi_required': False, 'bear_strategy': 'breakout', 'bear_bb_std_mult': 0.616582451820501, 'bear_rsi_os': 20, 'bear_rsi_ob': 72, 'bear_adx_thresh': 33.19085531064504, 'bear_atr_min_pct': 0.022096270768846512, 'bear_atr_max_pct': 0.01540361508695337, 'bear_tp_mult': 1.6155949260002134, 'bear_tsl_mult': 0.6076237236921502, 'bear_time_stop': 132, 'bear_use_sma': False, 'bear_use_ema': True, 'bear_use_atr': True, 'bear_use_adx': True, 'bear_use_spike': True, 'bear_rsi_required': False, 'sideways_strategy': 'mean_reversion', 'sideways_bb_std_mult': 2.6564491976405957, 'sideways_rsi_os': 30, 'sideways_rsi_ob': 79, 'sideways_adx_thresh': 18.014866027889457, 'sideways_atr_min_pct': 0.014680200166759073, 'sideways_atr_max_pct': 0.12980730872511523, 'sideways_tp_mult': 1.3435303515185144, 'sideways_tsl_mult': 0.754829078454683, 'sideways_time_stop': 208, 'sideways_use_sma': True, 'sideways_use_ema': False, 'sideways_use_atr': False, 'sideways_use_adx': False, 'sideways_use_spike': True, 'sideways_rsi_required': False}.
