[I 2025-09-01 09:46:51,077] Trial 273 finished with values: [-1000000000.0, 1000000000.0] and parameters: {'p_sma': 31, 'p_std': 56, 'p_atr': 28, 'p_adx': 10, 'rsi_period': 42, 'ema1': 8, 'ema2': 11, 'slip_atr_k': 0.15872694682167507, 'slip_spread_k': 0.6207877879967885, 'spread_hl_frac': 0.03263899990325428, 'bb_std_mult': 2.9872226683381915, 'rsi_os': 21, 'rsi_ob': 59, 'vol_spike': 0.16616136463810569, 'adx_thresh': 13.169433203311964, 'atr_min_pct': 0.018612470348124036, 'atr_max_pct': 0.07475903952180457, 'tp_mult': 1.1045808673006967, 'tsl_mult': 0.6055634867233036, 'strategy': 'breakout', 'time_stop': 241, 'use_sma': False, 'use_atr': False, 'use_adx': False, 'use_ema': False, 'use_spike': True, 'rsi_required': False, 'edge_k': 1.227716011850974, 'edge_cap': 0.7809784237167516, 'bull_strategy': 'mean_reversion', 'bull_bb_std_mult': 3.4752133247201247, 'bull_rsi_os': 44, 'bull_rsi_ob': 83, 'bull_adx_thresh': 22.84855829264964, 'bull_atr_min_pct': 0.004432755343033393, 'bull_atr_max_pct': 0.07936737770978244, 'bull_tp_mult': 1.2497448334427892, 'bull_tsl_mult': 0.9002868486147899, 'bull_time_stop': 175, 'bull_use_sma': True, 'bull_use_ema': False, 'bull_use_atr': True, 'bull_use_adx': False, 'bull_use_spike': True, 'bull_rsi_required': True, 'bear_strategy': 'mean_reversion', 'bear_bb_std_mult': 2.4838472846153796, 'bear_rsi_os': 15, 'bear_rsi_ob': 93, 'bear_adx_thresh': 30.10069154009986, 'bear_atr_min_pct': 0.02997764568312082, 'bear_atr_max_pct': 0.036665669341761395, 'bear_tp_mult': 1.1857924152948882, 'bear_tsl_mult': 0.48257700043723495, 'bear_time_stop': 96, 'bear_use_sma': False, 'bear_use_ema': True, 'bear_use_atr': True, 'bear_use_adx': True, 'bear_use_spike': True, 'bear_rsi_required': True, 'sideways_strategy': 'mean_reversion', 'sideways_bb_std_mult': 1.7590321431582676, 'sideways_rsi_os': 31, 'sideways_rsi_ob': 77, 'sideways_adx_thresh': 30.586198177466294, 'sideways_atr_min_pct': 0.004764697526635881, 'sideways_atr_max_pct': 0.08810266632306175, 'sideways_tp_mult': 1.2030064851759552, 'sideways_tsl_mult': 0.9172087438640187, 'sideways_time_stop': 235, 'sideways_use_sma': True, 'sideways_use_ema': False, 'sideways_use_atr': True, 'sideways_use_adx': False, 'sideways_use_spike': True, 'sideways_rsi_required': True}.
[I 2025-09-01 09:46:51,442] Trial 271 finished with values: [-1000000000.0, 1000000000.0] and parameters: {'p_sma': 31, 'p_std': 43, 'p_atr': 8, 'p_adx': 22, 'rsi_period': 66, 'ema1': 8, 'ema2': 28, 'slip_atr_k': 0.13325993531091326, 'slip_spread_k': 0.6128488190582202, 'spread_hl_frac': 0.01154903476808906, 'bb_std_mult': 2.3306734175807247, 'rsi_os': 25, 'rsi_ob': 52, 'vol_spike': 0.28061155317214237, 'adx_thresh': 12.336001225886255, 'atr_min_pct': 0.01856575290451135, 'atr_max_pct': 0.06989883375762664, 'tp_mult': 1.1376930774027134, 'tsl_mult': 0.8467895544306269, 'strategy': 'breakout', 'time_stop': 43, 'use_sma': True, 'use_atr': False, 'use_adx': False, 'use_ema': False, 'use_spike': True, 'rsi_required': False, 'edge_k': 0.6349724671411959, 'edge_cap': 0.8965879124406746, 'bull_strategy': 'mean_reversion', 'bull_bb_std_mult': 0.5918357104506191, 'bull_rsi_os': 47, 'bull_rsi_ob': 74, 'bull_adx_thresh': 23.013700726746126, 'bull_atr_min_pct': 0.018685159928783838, 'bull_atr_max_pct': 0.07369251129776563, 'bull_tp_mult': 1.6432672351909154, 'bull_tsl_mult': 0.9552896076973879, 'bull_time_stop': 154, 'bull_use_sma': True, 'bull_use_ema': False, 'bull_use_atr': True, 'bull_use_adx': False, 'bull_use_spike': True, 'bull_rsi_required': False, 'bear_strategy': 'mean_reversion', 'bear_bb_std_mult': 1.536987769552616, 'bear_rsi_os': 44, 'bear_rsi_ob': 71, 'bear_adx_thresh': 29.857423626582758, 'bear_atr_min_pct': 0.028346782535580154, 'bear_atr_max_pct': 0.12332044458502711, 'bear_tp_mult': 1.7506042515353537, 'bear_tsl_mult': 0.5115940712536409, 'bear_time_stop': 50, 'bear_use_sma': False, 'bear_use_ema': True, 'bear_use_atr': True, 'bear_use_adx': True, 'bear_use_spike': True, 'bear_rsi_required': True, 'sideways_strategy': 'mean_reversion', 'sideways_bb_std_mult': 1.7557286344558394, 'sideways_rsi_os': 19, 'sideways_rsi_ob': 58, 'sideways_adx_thresh': 20.628039675933394, 'sideways_atr_min_pct': 0.02423925606959377, 'sideways_atr_max_pct': 0.0812138462699241, 'sideways_tp_mult': 1.7823355309730105, 'sideways_tsl_mult': 0.9123196139757214, 'sideways_time_stop': 73, 'sideways_use_sma': True, 'sideways_use_ema': False, 'sideways_use_atr': True, 'sideways_use_adx': True, 'sideways_use_spike': True, 'sideways_rsi_required': True}.
[I 2025-09-01 09:46:51,790] Trial 272 finished with values: [-0.02089960064651064, 0.020629662326777192] and parameters: {'p_sma': 58, 'p_std': 42, 'p_atr': 28, 'p_adx': 10, 'rsi_period': 42, 'ema1': 8, 'ema2': 11, 'slip_atr_k': 0.2184921114665397, 'slip_spread_k': 0.5673453979272375, 'spread_hl_frac': 0.04088427866672112, 'bb_std_mult': 2.493755416532811, 'rsi_os': 55, 'rsi_ob': 50, 'vol_spike': 0.16557482848025612, 'adx_thresh': 34.51193578668396, 'atr_min_pct': 0.018653881158514924, 'atr_max_pct': 0.07798825685215896, 'tp_mult': 2.7253162931109745, 'tsl_mult': 0.907413035549093, 'strategy': 'breakout', 'time_stop': 43, 'use_sma': False, 'use_atr': False, 'use_adx': False, 'use_ema': False, 'use_spike': True, 'rsi_required': False, 'edge_k': 1.903639582621663, 'edge_cap': 0.7854564089036362, 'bull_strategy': 'mean_reversion', 'bull_bb_std_mult': 3.4930044945350254, 'bull_rsi_os': 51, 'bull_rsi_ob': 82, 'bull_adx_thresh': 10.755391352753914, 'bull_atr_min_pct': 0.0022619656114468006, 'bull_atr_max_pct': 0.07937243101105651, 'bull_tp_mult': 2.0217807863138932, 'bull_tsl_mult': 0.019338623922265097, 'bull_time_stop': 143, 'bull_use_sma': True, 'bull_use_ema': False, 'bull_use_atr': True, 'bull_use_adx': False, 'bull_use_spike': True, 'bull_rsi_required': True, 'bear_strategy': 'mean_reversion', 'bear_bb_std_mult': 2.9727717029155367, 'bear_rsi_os': 44, 'bear_rsi_ob': 93, 'bear_adx_thresh': 34.514289515955845, 'bear_atr_min_pct': 0.029980278854787292, 'bear_atr_max_pct': 0.12267199659620431, 'bear_tp_mult': 2.0589929502232023, 'bear_tsl_mult': 0.8367749694555259, 'bear_time_stop': 47, 'bear_use_sma': False, 'bear_use_ema': True, 'bear_use_atr': True, 'bear_use_adx': True, 'bear_use_spike': True, 'bear_rsi_required': True, 'sideways_strategy': 'mean_reversion', 'sideways_bb_std_mult': 2.6559942059103854, 'sideways_rsi_os': 31, 'sideways_rsi_ob': 60, 'sideways_adx_thresh': 30.667048694621627, 'sideways_atr_min_pct': 0.028683835200007606, 'sideways_atr_max_pct': 0.08836344144493932, 'sideways_tp_mult': 1.27081215641362, 'sideways_tsl_mult': 0.26659064972002544, 'sideways_time_stop': 74, 'sideways_use_sma': True, 'sideways_use_ema': False, 'sideways_use_atr': True, 'sideways_use_adx': False, 'sideways_use_spike': True, 'sideways_rsi_required': True}.
[I 2025-09-01 09:46:52,137] Trial 270 finished with values: [-0.016126933744234906, 0.016389928658911108] and parameters: {'p_sma': 57, 'p_std': 48, 'p_atr': 28, 'p_adx': 12, 'rsi_period': 41, 'ema1': 8, 'ema2': 22, 'slip_atr_k': 0.20296639002235572, 'slip_spread_k': 0.596458778215791, 'spread_hl_frac': 0.011514286650183298, 'bb_std_mult': 2.737399827046161, 'rsi_os': 21, 'rsi_ob': 52, 'vol_spike': 0.05508106131570131, 'adx_thresh': 12.285090398946297, 'atr_min_pct': 0.015716423909689112, 'atr_max_pct': 0.1457840016254699, 'tp_mult': 2.568561236427009, 'tsl_mult': 0.9142943174172699, 'strategy': 'breakout', 'time_stop': 56, 'use_sma': True, 'use_atr': False, 'use_adx': True, 'use_ema': False, 'use_spike': True, 'rsi_required': False, 'edge_k': 0.35132420867756853, 'edge_cap': 0.9076416205291727, 'bull_strategy': 'mean_reversion', 'bull_bb_std_mult': 0.791855077001961, 'bull_rsi_os': 45, 'bull_rsi_ob': 82, 'bull_adx_thresh': 31.51493701775809, 'bull_atr_min_pct': 0.0022061718080435546, 'bull_atr_max_pct': 0.060867494850333825, 'bull_tp_mult': 1.5029516935135299, 'bull_tsl_mult': 0.8107499547057255, 'bull_time_stop': 152, 'bull_use_sma': True, 'bull_use_ema': False, 'bull_use_atr': True, 'bull_use_adx': True, 'bull_use_spike': True, 'bull_rsi_required': False, 'bear_strategy': 'mean_reversion', 'bear_bb_std_mult': 3.180097660391448, 'bear_rsi_os': 8, 'bear_rsi_ob': 71, 'bear_adx_thresh': 31.55225925855051, 'bear_atr_min_pct': 0.027704754578424518, 'bear_atr_max_pct': 0.1276298135280634, 'bear_tp_mult': 2.5622107290829006, 'bear_tsl_mult': 0.7816827279369443, 'bear_time_stop': 121, 'bear_use_sma': False, 'bear_use_ema': True, 'bear_use_atr': True, 'bear_use_adx': True, 'bear_use_spike': True, 'bear_rsi_required': True, 'sideways_strategy': 'breakout', 'sideways_bb_std_mult': 2.65065066495843, 'sideways_rsi_os': 19, 'sideways_rsi_ob': 49, 'sideways_adx_thresh': 30.61840026448362, 'sideways_atr_min_pct': 0.02409586444493833, 'sideways_atr_max_pct': 0.08115723002421724, 'sideways_tp_mult': 1.2041950177431713, 'sideways_tsl_mult': 0.41404362961256963, 'sideways_time_stop': 235, 'sideways_use_sma': False, 'sideways_use_ema': False, 'sideways_use_atr': True, 'sideways_use_adx': True, 'sideways_use_spike': True, 'sideways_rsi_required': True}.
[I 2025-09-01 09:47:32,182] Trial 274 finished with values: [-1000000000.0, 1000000000.0] and parameters: {'p_sma': 28, 'p_std': 42, 'p_atr': 28, 'p_adx': 29, 'rsi_period': 45, 'ema1': 30, 'ema2': 21, 'slip_atr_k': 0.23833962359458088, 'slip_spread_k': 0.5711143379517685, 'spread_hl_frac': 0.041357402115144354, 'bb_std_mult': 1.3395845289076085, 'rsi_os': 9, 'rsi_ob': 55, 'vol_spike': 0.18285913662333264, 'adx_thresh': 11.085444256031913, 'atr_min_pct': 0.019411651588404386, 'atr_max_pct': 0.06695166418421568, 'tp_mult': 2.182308020836676, 'tsl_mult': 0.9207261976887757, 'strategy': 'breakout', 'time_stop': 145, 'use_sma': False, 'use_atr': True, 'use_adx': False, 'use_ema': False, 'use_spike': True, 'rsi_required': True, 'edge_k': 0.6922274678638218, 'edge_cap': 0.9989037871655223, 'bull_strategy': 'mean_reversion', 'bull_bb_std_mult': 3.5833465917642218, 'bull_rsi_os': 39, 'bull_rsi_ob': 75, 'bull_adx_thresh': 31.65400679237976, 'bull_atr_min_pct': 0.00212374274591727, 'bull_atr_max_pct': 0.14106599536476774, 'bull_tp_mult': 1.4969143895643737, 'bull_tsl_mult': 0.9991023105640471, 'bull_time_stop': 208, 'bull_use_sma': True, 'bull_use_ema': False, 'bull_use_atr': False, 'bull_use_adx': False, 'bull_use_spike': True, 'bull_rsi_required': False, 'bear_strategy': 'breakout', 'bear_bb_std_mult': 0.9929135029595828, 'bear_rsi_os': 44, 'bear_rsi_ob': 71, 'bear_adx_thresh': 34.66390010558022, 'bear_atr_min_pct': 0.024456073647169625, 'bear_atr_max_pct': 0.07625780960387897, 'bear_tp_mult': 1.5077973470226462, 'bear_tsl_mult': 0.8405960909987759, 'bear_time_stop': 20, 'bear_use_sma': True, 'bear_use_ema': True, 'bear_use_atr': True, 'bear_use_adx': True, 'bear_use_spike': True, 'bear_rsi_required': False, 'sideways_strategy': 'mean_reversion', 'sideways_bb_std_mult': 2.647504290418237, 'sideways_rsi_os': 17, 'sideways_rsi_ob': 60, 'sideways_adx_thresh': 33.022252139561175, 'sideways_atr_min_pct': 0.0031778653558345057, 'sideways_atr_max_pct': 0.09013859995749557, 'sideways_tp_mult': 1.2659754080592516, 'sideways_tsl_mult': 0.9519710365443649, 'sideways_time_stop': 138, 'sideways_use_sma': True, 'sideways_use_ema': False, 'sideways_use_atr': False, 'sideways_use_adx': False, 'sideways_use_spike': True, 'sideways_rsi_required': False}.
[I 2025-09-01 09:47:33,729] Trial 277 finished with values: [-1000000000.0, 1000000000.0] and parameters: {'p_sma': 9, 'p_std': 50, 'p_atr': 29, 'p_adx': 14, 'rsi_period': 45, 'ema1': 30, 'ema2': 10, 'slip_atr_k': 0.01428795068405067, 'slip_spread_k': 0.5632984901627742, 'spread_hl_frac': 0.03448639983749046, 'bb_std_mult': 2.6420683289689224, 'rsi_os': 49, 'rsi_ob': 55, 'vol_spike': 0.18564742543623633, 'adx_thresh': 11.163937897034849, 'atr_min_pct': 0.01963110572600991, 'atr_max_pct': 0.06722161361848485, 'tp_mult': 2.5192528953700952, 'tsl_mult': 0.8711415130529075, 'strategy': 'breakout', 'time_stop': 234, 'use_sma': True, 'use_atr': True, 'use_adx': False, 'use_ema': True, 'use_spike': True, 'rsi_required': True, 'edge_k': 0.7212382114429686, 'edge_cap': 0.8325294516601662, 'bull_strategy': 'mean_reversion', 'bull_bb_std_mult': 3.1442344578060393, 'bull_rsi_os': 20, 'bull_rsi_ob': 80, 'bull_adx_thresh': 24.66115360898078, 'bull_atr_min_pct': 0.005835070830729025, 'bull_atr_max_pct': 0.06848772292458702, 'bull_tp_mult': 2.648785171420966, 'bull_tsl_mult': 0.31959102610404866, 'bull_time_stop': 40, 'bull_use_sma': True, 'bull_use_ema': False, 'bull_use_atr': False, 'bull_use_adx': False, 'bull_use_spike': True, 'bull_rsi_required': False, 'bear_strategy': 'breakout', 'bear_bb_std_mult': 0.5078078111359703, 'bear_rsi_os': 6, 'bear_rsi_ob': 77, 'bear_adx_thresh': 32.840830538094174, 'bear_atr_min_pct': 0.021123950092202616, 'bear_atr_max_pct': 0.07371469991183274, 'bear_tp_mult': 2.80175370628173, 'bear_tsl_mult': 0.877552476422719, 'bear_time_stop': 19, 'bear_use_sma': True, 'bear_use_ema': True, 'bear_use_atr': False, 'bear_use_adx': True, 'bear_use_spike': True, 'bear_rsi_required': False, 'sideways_strategy': 'mean_reversion', 'sideways_bb_std_mult': 2.4874918177167777, 'sideways_rsi_os': 29, 'sideways_rsi_ob': 63, 'sideways_adx_thresh': 32.98232812110538, 'sideways_atr_min_pct': 0.0295869522169232, 'sideways_atr_max_pct': 0.09176361567623219, 'sideways_tp_mult': 1.3074764812564361, 'sideways_tsl_mult': 0.9600585665714995, 'sideways_time_stop': 121, 'sideways_use_sma': True, 'sideways_use_ema': False, 'sideways_use_atr': False, 'sideways_use_adx': False, 'sideways_use_spike': True, 'sideways_rsi_required': False}.
[I 2025-09-01 09:47:33,754] Trial 276 finished with values: [-1000000000.0, 1000000000.0] and parameters: {'p_sma': 48, 'p_std': 20, 'p_atr': 29, 'p_adx': 11, 'rsi_period': 45, 'ema1': 30, 'ema2': 22, 'slip_atr_k': 0.014347053007038573, 'slip_spread_k': 0.5752447916080643, 'spread_hl_frac': 0.005945758365192682, 'bb_std_mult': 2.6330840150046124, 'rsi_os': 7, 'rsi_ob': 56, 'vol_spike': 0.18479402359969058, 'adx_thresh': 10.931591293869017, 'atr_min_pct': 0.02904095489689501, 'atr_max_pct': 0.06689903652325427, 'tp_mult': 2.5107043826365225, 'tsl_mult': 0.8452442903955448, 'strategy': 'breakout', 'time_stop': 18, 'use_sma': True, 'use_atr': True, 'use_adx': False, 'use_ema': False, 'use_spike': True, 'rsi_required': True, 'edge_k': 1.423059617788042, 'edge_cap': 0.8249630674719164, 'bull_strategy': 'mean_reversion', 'bull_bb_std_mult': 3.3668236483769367, 'bull_rsi_os': 35, 'bull_rsi_ob': 80, 'bull_adx_thresh': 24.950707878045932, 'bull_atr_min_pct': 0.005760493205321721, 'bull_atr_max_pct': 0.06843098917174159, 'bull_tp_mult': 1.5146055039204986, 'bull_tsl_mult': 0.3209395803585403, 'bull_time_stop': 209, 'bull_use_sma': True, 'bull_use_ema': False, 'bull_use_atr': False, 'bull_use_adx': True, 'bull_use_spike': True, 'bull_rsi_required': False, 'bear_strategy': 'breakout', 'bear_bb_std_mult': 0.5392710895121835, 'bear_rsi_os': 6, 'bear_rsi_ob': 71, 'bear_adx_thresh': 32.64576403786222, 'bear_atr_min_pct': 0.015377371887863528, 'bear_atr_max_pct': 0.0742955407134461, 'bear_tp_mult': 2.7151009806479083, 'bear_tsl_mult': 0.7439551669235023, 'bear_time_stop': 18, 'bear_use_sma': True, 'bear_use_ema': True, 'bear_use_atr': False, 'bear_use_adx': True, 'bear_use_spike': True, 'bear_rsi_required': False, 'sideways_strategy': 'mean_reversion', 'sideways_bb_std_mult': 3.1676446222717844, 'sideways_rsi_os': 29, 'sideways_rsi_ob': 59, 'sideways_adx_thresh': 32.92993500317823, 'sideways_atr_min_pct': 0.00914294583655959, 'sideways_atr_max_pct': 0.10240548450058069, 'sideways_tp_mult': 1.3242943560070604, 'sideways_tsl_mult': 0.9458957350962099, 'sideways_time_stop': 235, 'sideways_use_sma': True, 'sideways_use_ema': False, 'sideways_use_atr': False, 'sideways_use_adx': False, 'sideways_use_spike': True, 'sideways_rsi_required': False}.
[I 2025-09-01 09:47:34,117] Trial 275 finished with values: [-1000000000.0, 1000000000.0] and parameters: {'p_sma': 19, 'p_std': 20, 'p_atr': 28, 'p_adx': 11, 'rsi_period': 10, 'ema1': 12, 'ema2': 22, 'slip_atr_k': 0.10670814542308718, 'slip_spread_k': 0.5670474619390176, 'spread_hl_frac': 0.028407324666299798, 'bb_std_mult': 3.1268838016740435, 'rsi_os': 9, 'rsi_ob': 55, 'vol_spike': 0.18463896911307173, 'adx_thresh': 16.48139490932735, 'atr_min_pct': 0.029403772257732982, 'atr_max_pct': 0.07781237452806086, 'tp_mult': 2.074531135952071, 'tsl_mult': 0.8864947030792982, 'strategy': 'breakout', 'time_stop': 21, 'use_sma': False, 'use_atr': True, 'use_adx': False, 'use_ema': False, 'use_spike': True, 'rsi_required': True, 'edge_k': 1.9008282211701593, 'edge_cap': 0.8272271489120934, 'bull_strategy': 'mean_reversion', 'bull_bb_std_mult': 1.1699508036044315, 'bull_rsi_os': 39, 'bull_rsi_ob': 80, 'bull_adx_thresh': 27.47190682690127, 'bull_atr_min_pct': 0.006232588852004795, 'bull_atr_max_pct': 0.09587111689914316, 'bull_tp_mult': 1.5009702564173986, 'bull_tsl_mult': 0.9878873934323087, 'bull_time_stop': 143, 'bull_use_sma': True, 'bull_use_ema': False, 'bull_use_atr': False, 'bull_use_adx': False, 'bull_use_spike': True, 'bull_rsi_required': False, 'bear_strategy': 'breakout', 'bear_bb_std_mult': 1.2743481769631808, 'bear_rsi_os': 5, 'bear_rsi_ob': 84, 'bear_adx_thresh': 34.50731231655839, 'bear_atr_min_pct': 0.025396330798834084, 'bear_atr_max_pct': 0.0758613029759929, 'bear_tp_mult': 2.7262260143758605, 'bear_tsl_mult': 0.11327716625134499, 'bear_time_stop': 145, 'bear_use_sma': True, 'bear_use_ema': True, 'bear_use_atr': True, 'bear_use_adx': True, 'bear_use_spike': True, 'bear_rsi_required': False, 'sideways_strategy': 'mean_reversion', 'sideways_bb_std_mult': 3.2023427045523745, 'sideways_rsi_os': 17, 'sideways_rsi_ob': 60, 'sideways_adx_thresh': 32.88205930441908, 'sideways_atr_min_pct': 0.028084919399813432, 'sideways_atr_max_pct': 0.09139030241987994, 'sideways_tp_mult': 1.2558340292594172, 'sideways_tsl_mult': 0.07414199707237717, 'sideways_time_stop': 141, 'sideways_use_sma': True, 'sideways_use_ema': False, 'sideways_use_atr': False, 'sideways_use_adx': False, 'sideways_use_spike': True, 'sideways_rsi_required': False}.
[I 2025-09-01 09:48:13,230] Trial 278 finished with values: [-1000000000.0, 1000000000.0] and parameters: {'p_sma': 60, 'p_std': 23, 'p_atr': 29, 'p_adx': 11, 'rsi_period': 44, 'ema1': 13, 'ema2': 10, 'slip_atr_k': 0.10563531025375149, 'slip_spread_k': 0.4893484351743015, 'spread_hl_frac': 0.008007676645557965, 'bb_std_mult': 2.62789390517713, 'rsi_os': 7, 'rsi_ob': 87, 'vol_spike': 0.19599340552759884, 'adx_thresh': 31.246257027827824, 'atr_min_pct': 0.022839736912600807, 'atr_max_pct': 0.12565300293170292, 'tp_mult': 2.861900525578849, 'tsl_mult': 0.8799286997939564, 'strategy': 'breakout', 'time_stop': 126, 'use_sma': True, 'use_atr': True, 'use_adx': False, 'use_ema': True, 'use_spike': True, 'rsi_required': True, 'edge_k': 0.5443214323212485, 'edge_cap': 0.8260170389296991, 'bull_strategy': 'mean_reversion', 'bull_bb_std_mult': 2.343484841670198, 'bull_rsi_os': 36, 'bull_rsi_ob': 80, 'bull_adx_thresh': 30.461383249775764, 'bull_atr_min_pct': 0.0057277020170147155, 'bull_atr_max_pct': 0.06789214279030562, 'bull_tp_mult': 1.5868541523830728, 'bull_tsl_mult': 0.8686117347109579, 'bull_time_stop': 132, 'bull_use_sma': True, 'bull_use_ema': False, 'bull_use_atr': False, 'bull_use_adx': False, 'bull_use_spike': True, 'bull_rsi_required': False, 'bear_strategy': 'breakout', 'bear_bb_std_mult': 1.4791191216826804, 'bear_rsi_os': 21, 'bear_rsi_ob': 77, 'bear_adx_thresh': 33.04965885821778, 'bear_atr_min_pct': 0.015565712340780259, 'bear_atr_max_pct': 0.0904780092471599, 'bear_tp_mult': 2.8089766822989337, 'bear_tsl_mult': 0.9324651064648174, 'bear_time_stop': 183, 'bear_use_sma': True, 'bear_use_ema': True, 'bear_use_atr': False, 'bear_use_adx': True, 'bear_use_spike': True, 'bear_rsi_required': False, 'sideways_strategy': 'mean_reversion', 'sideways_bb_std_mult': 2.45063407378632, 'sideways_rsi_os': 29, 'sideways_rsi_ob': 59, 'sideways_adx_thresh': 16.461361889006508, 'sideways_atr_min_pct': 0.02773174260004159, 'sideways_atr_max_pct': 0.014710507127197514, 'sideways_tp_mult': 1.3103992598973397, 'sideways_tsl_mult': 0.9303620269654879, 'sideways_time_stop': 101, 'sideways_use_sma': True, 'sideways_use_ema': False, 'sideways_use_atr': False, 'sideways_use_adx': False, 'sideways_use_spike': True, 'sideways_rsi_required': False}.
