[I 2025-09-01 10:28:42,195] Trial 516 finished with values: [-1000000000.0, 1000000000.0] and parameters: {'p_sma': 21, 'p_std': 19, 'p_atr': 18, 'p_adx': 13, 'rsi_period': 47, 'ema1': 8, 'ema2': 10, 'slip_atr_k': 0.16629302849992533, 'slip_spread_k': 0.5327889266226584, 'spread_hl_frac': 0.0030236035101951454, 'bb_std_mult': 2.52864473222888, 'rsi_os': 7, 'rsi_ob': 54, 'vol_spike': 0.1923439676622854, 'adx_thresh': 13.228440108343428, 'atr_min_pct': 0.019735069229170347, 'atr_max_pct': 0.06540325619233005, 'tp_mult': 2.5594032945692518, 'tsl_mult': 0.5407431256027503, 'strategy': 'mean_reversion', 'time_stop': 156, 'use_sma': True, 'use_atr': False, 'use_adx': False, 'use_ema': False, 'use_spike': False, 'rsi_required': True, 'edge_k': 0.5825556146576182, 'edge_cap': 0.6866949844960597, 'bull_strategy': 'mean_reversion', 'bull_bb_std_mult': 3.496392966965463, 'bull_rsi_os': 40, 'bull_rsi_ob': 79, 'bull_adx_thresh': 14.5324253567758, 'bull_atr_min_pct': 0.0036639899825850622, 'bull_atr_max_pct': 0.07670811813852392, 'bull_tp_mult': 1.5482129968256426, 'bull_tsl_mult': 0.8937375135211376, 'bull_time_stop': 172, 'bull_use_sma': True, 'bull_use_ema': False, 'bull_use_atr': False, 'bull_use_adx': False, 'bull_use_spike': False, 'bull_rsi_required': False, 'bear_strategy': 'breakout', 'bear_bb_std_mult': 2.2349699149028597, 'bear_rsi_os': 13, 'bear_rsi_ob': 73, 'bear_adx_thresh': 20.148329056201327, 'bear_atr_min_pct': 0.028680552908470054, 'bear_atr_max_pct': 0.07106008379251134, 'bear_tp_mult': 2.872865750324846, 'bear_tsl_mult': 0.9986088362628224, 'bear_time_stop': 5, 'bear_use_sma': False, 'bear_use_ema': False, 'bear_use_atr': True, 'bear_use_adx': True, 'bear_use_spike': True, 'bear_rsi_required': False, 'sideways_strategy': 'mean_reversion', 'sideways_bb_std_mult': 2.559671213901626, 'sideways_rsi_os': 10, 'sideways_rsi_ob': 60, 'sideways_adx_thresh': 22.79006132683837, 'sideways_atr_min_pct': 0.0024993179468531996, 'sideways_atr_max_pct': 0.0898923142648989, 'sideways_tp_mult': 2.173312298701781, 'sideways_tsl_mult': 0.6603808111734759, 'sideways_time_stop': 231, 'sideways_use_sma': True, 'sideways_use_ema': False, 'sideways_use_atr': False, 'sideways_use_adx': True, 'sideways_use_spike': False, 'sideways_rsi_required': True}.
[I 2025-09-01 10:28:42,482] Trial 515 finished with values: [-1000000000.0, 1000000000.0] and parameters: {'p_sma': 59, 'p_std': 18, 'p_atr': 30, 'p_adx': 13, 'rsi_period': 38, 'ema1': 6, 'ema2': 10, 'slip_atr_k': 0.24780614654549937, 'slip_spread_k': 0.4954549108302492, 'spread_hl_frac': 0.008010779550597737, 'bb_std_mult': 2.571179237412708, 'rsi_os': 49, 'rsi_ob': 78, 'vol_spike': 0.19269383245169955, 'adx_thresh': 10.307919813383316, 'atr_min_pct': 0.019576723603431927, 'atr_max_pct': 0.02666205490665661, 'tp_mult': 2.563376747094114, 'tsl_mult': 0.445954996973238, 'strategy': 'mean_reversion', 'time_stop': 155, 'use_sma': True, 'use_atr': False, 'use_adx': False, 'use_ema': False, 'use_spike': False, 'rsi_required': True, 'edge_k': 0.6841933952541259, 'edge_cap': 0.833732401378805, 'bull_strategy': 'mean_reversion', 'bull_bb_std_mult': 1.3196425317374305, 'bull_rsi_os': 32, 'bull_rsi_ob': 79, 'bull_adx_thresh': 32.96372888170935, 'bull_atr_min_pct': 0.019377787710419876, 'bull_atr_max_pct': 0.11064682977324548, 'bull_tp_mult': 2.529606971366667, 'bull_tsl_mult': 0.8978631893733914, 'bull_time_stop': 6, 'bull_use_sma': True, 'bull_use_ema': False, 'bull_use_atr': False, 'bull_use_adx': False, 'bull_use_spike': False, 'bull_rsi_required': False, 'bear_strategy': 'breakout', 'bear_bb_std_mult': 1.4317318817539721, 'bear_rsi_os': 44, 'bear_rsi_ob': 72, 'bear_adx_thresh': 26.7516304195255, 'bear_atr_min_pct': 0.02867400619406876, 'bear_atr_max_pct': 0.12554434239228782, 'bear_tp_mult': 2.6116079510422474, 'bear_tsl_mult': 0.9840738716282014, 'bear_time_stop': 112, 'bear_use_sma': False, 'bear_use_ema': False, 'bear_use_atr': True, 'bear_use_adx': True, 'bear_use_spike': True, 'bear_rsi_required': False, 'sideways_strategy': 'mean_reversion', 'sideways_bb_std_mult': 2.5426630991784496, 'sideways_rsi_os': 29, 'sideways_rsi_ob': 56, 'sideways_adx_thresh': 31.3551204743552, 'sideways_atr_min_pct': 0.004035755745143199, 'sideways_atr_max_pct': 0.09001192903238929, 'sideways_tp_mult': 1.1221407158485084, 'sideways_tsl_mult': 0.9298678481574483, 'sideways_time_stop': 231, 'sideways_use_sma': True, 'sideways_use_ema': False, 'sideways_use_atr': False, 'sideways_use_adx': True, 'sideways_use_spike': False, 'sideways_rsi_required': True}.
[I 2025-09-01 10:28:43,114] Trial 514 finished with values: [-1000000000.0, 1000000000.0] and parameters: {'p_sma': 21, 'p_std': 59, 'p_atr': 22, 'p_adx': 20, 'rsi_period': 47, 'ema1': 6, 'ema2': 10, 'slip_atr_k': 0.2477494272350269, 'slip_spread_k': 0.5279765810163339, 'spread_hl_frac': 0.01024145036870868, 'bb_std_mult': 2.5404156088899144, 'rsi_os': 10, 'rsi_ob': 72, 'vol_spike': 0.28050748950220655, 'adx_thresh': 8.761564762626785, 'atr_min_pct': 0.00508171910724243, 'atr_max_pct': 0.06575852984226173, 'tp_mult': 2.562753403858448, 'tsl_mult': 0.8468395521963175, 'strategy': 'breakout', 'time_stop': 142, 'use_sma': True, 'use_atr': False, 'use_adx': False, 'use_ema': False, 'use_spike': True, 'rsi_required': True, 'edge_k': 0.9156401893425842, 'edge_cap': 0.4244666112961139, 'bull_strategy': 'mean_reversion', 'bull_bb_std_mult': 1.3196514448975427, 'bull_rsi_os': 41, 'bull_rsi_ob': 79, 'bull_adx_thresh': 32.928786032829244, 'bull_atr_min_pct': 0.0036389690754249763, 'bull_atr_max_pct': 0.07773005438593085, 'bull_tp_mult': 1.5590388973245335, 'bull_tsl_mult': 0.8955997242163866, 'bull_time_stop': 119, 'bull_use_sma': True, 'bull_use_ema': False, 'bull_use_atr': False, 'bull_use_adx': False, 'bull_use_spike': False, 'bull_rsi_required': False, 'bear_strategy': 'breakout', 'bear_bb_std_mult': 2.8165803541908003, 'bear_rsi_os': 13, 'bear_rsi_ob': 73, 'bear_adx_thresh': 16.06142317025621, 'bear_atr_min_pct': 0.025480891307825562, 'bear_atr_max_pct': 0.04754176466008344, 'bear_tp_mult': 2.8878299262248417, 'bear_tsl_mult': 0.7771246395018689, 'bear_time_stop': 5, 'bear_use_sma': False, 'bear_use_ema': False, 'bear_use_atr': True, 'bear_use_adx': True, 'bear_use_spike': True, 'bear_rsi_required': False, 'sideways_strategy': 'mean_reversion', 'sideways_bb_std_mult': 2.499463956219601, 'sideways_rsi_os': 29, 'sideways_rsi_ob': 90, 'sideways_adx_thresh': 8.262275780363986, 'sideways_atr_min_pct': 0.01800836399532087, 'sideways_atr_max_pct': 0.043363076404102724, 'sideways_tp_mult': 1.8297285832917902, 'sideways_tsl_mult': 0.9571024031046755, 'sideways_time_stop': 230, 'sideways_use_sma': True, 'sideways_use_ema': False, 'sideways_use_atr': False, 'sideways_use_adx': True, 'sideways_use_spike': False, 'sideways_rsi_required': True}.
[I 2025-09-01 10:28:43,593] Trial 513 finished with values: [-1000000000.0, 1000000000.0] and parameters: {'p_sma': 21, 'p_std': 23, 'p_atr': 18, 'p_adx': 13, 'rsi_period': 46, 'ema1': 5, 'ema2': 10, 'slip_atr_k': 0.019800957860881888, 'slip_spread_k': 0.5269692842613156, 'spread_hl_frac': 0.007396758161093246, 'bb_std_mult': 2.541186560028566, 'rsi_os': 23, 'rsi_ob': 78, 'vol_spike': 0.17889254881411557, 'adx_thresh': 8.891238714308415, 'atr_min_pct': 0.021938823786456414, 'atr_max_pct': 0.06619785589587876, 'tp_mult': 1.1376752076636123, 'tsl_mult': 0.4314562828379028, 'strategy': 'breakout', 'time_stop': 155, 'use_sma': True, 'use_atr': True, 'use_adx': False, 'use_ema': False, 'use_spike': True, 'rsi_required': False, 'edge_k': 0.9118784082587597, 'edge_cap': 0.8537553756283778, 'bull_strategy': 'mean_reversion', 'bull_bb_std_mult': 3.5047840580374063, 'bull_rsi_os': 16, 'bull_rsi_ob': 79, 'bull_adx_thresh': 30.8320009541863, 'bull_atr_min_pct': 0.0036596381988969195, 'bull_atr_max_pct': 0.07688169215651355, 'bull_tp_mult': 1.558769933646293, 'bull_tsl_mult': 0.8979516383838726, 'bull_time_stop': 274, 'bull_use_sma': True, 'bull_use_ema': False, 'bull_use_atr': True, 'bull_use_adx': False, 'bull_use_spike': True, 'bull_rsi_required': False, 'bear_strategy': 'breakout', 'bear_bb_std_mult': 1.5112321660926489, 'bear_rsi_os': 44, 'bear_rsi_ob': 72, 'bear_adx_thresh': 19.22540615195663, 'bear_atr_min_pct': 0.028568832599399286, 'bear_atr_max_pct': 0.11286422943889284, 'bear_tp_mult': 1.198269609909851, 'bear_tsl_mult': 0.1924760752324593, 'bear_time_stop': 54, 'bear_use_sma': False, 'bear_use_ema': False, 'bear_use_atr': True, 'bear_use_adx': True, 'bear_use_spike': True, 'bear_rsi_required': False, 'sideways_strategy': 'mean_reversion', 'sideways_bb_std_mult': 2.49346438840946, 'sideways_rsi_os': 29, 'sideways_rsi_ob': 64, 'sideways_adx_thresh': 31.455177831025058, 'sideways_atr_min_pct': 0.026671728966099557, 'sideways_atr_max_pct': 0.09107645148722188, 'sideways_tp_mult': 2.1699152802654886, 'sideways_tsl_mult': 0.9317538077901402, 'sideways_time_stop': 6, 'sideways_use_sma': True, 'sideways_use_ema': False, 'sideways_use_atr': False, 'sideways_use_adx': True, 'sideways_use_spike': False, 'sideways_rsi_required': False}.
[I 2025-09-01 10:29:25,445] Trial 518 finished with values: [-1000000000.0, 1000000000.0] and parameters: {'p_sma': 57, 'p_std': 34, 'p_atr': 28, 'p_adx': 8, 'rsi_period': 13, 'ema1': 12, 'ema2': 11, 'slip_atr_k': 0.046678765656198384, 'slip_spread_k': 0.6502776339905875, 'spread_hl_frac': 0.03420654911004676, 'bb_std_mult': 2.670373363836562, 'rsi_os': 23, 'rsi_ob': 85, 'vol_spike': 0.17984915347587405, 'adx_thresh': 12.455523941029815, 'atr_min_pct': 0.021178282796131927, 'atr_max_pct': 0.06963747208663632, 'tp_mult': 2.4576565623673785, 'tsl_mult': 0.8643936105482382, 'strategy': 'breakout', 'time_stop': 142, 'use_sma': True, 'use_atr': True, 'use_adx': False, 'use_ema': False, 'use_spike': True, 'rsi_required': False, 'edge_k': 0.6358497803157767, 'edge_cap': 0.32917293915415596, 'bull_strategy': 'mean_reversion', 'bull_bb_std_mult': 1.7713266319824332, 'bull_rsi_os': 15, 'bull_rsi_ob': 81, 'bull_adx_thresh': 28.7125990971675, 'bull_atr_min_pct': 0.004570791905985633, 'bull_atr_max_pct': 0.0740342229898372, 'bull_tp_mult': 1.5831190955723786, 'bull_tsl_mult': 0.8752456679736048, 'bull_time_stop': 116, 'bull_use_sma': True, 'bull_use_ema': False, 'bull_use_atr': True, 'bull_use_adx': False, 'bull_use_spike': True, 'bull_rsi_required': False, 'bear_strategy': 'breakout', 'bear_bb_std_mult': 1.614290299321926, 'bear_rsi_os': 44, 'bear_rsi_ob': 45, 'bear_adx_thresh': 15.89565379539512, 'bear_atr_min_pct': 0.016433298924553082, 'bear_atr_max_pct': 0.1291744102531013, 'bear_tp_mult': 2.503382916501592, 'bear_tsl_mult': 0.07768032173120198, 'bear_time_stop': 5, 'bear_use_sma': False, 'bear_use_ema': True, 'bear_use_atr': True, 'bear_use_adx': True, 'bear_use_spike': True, 'bear_rsi_required': False, 'sideways_strategy': 'mean_reversion', 'sideways_bb_std_mult': 1.9403288130451242, 'sideways_rsi_os': 19, 'sideways_rsi_ob': 61, 'sideways_adx_thresh': 30.925223709931366, 'sideways_atr_min_pct': 0.023054480726785155, 'sideways_atr_max_pct': 0.08663160285256429, 'sideways_tp_mult': 1.2666466436652368, 'sideways_tsl_mult': 0.05504962805818581, 'sideways_time_stop': 219, 'sideways_use_sma': True, 'sideways_use_ema': False, 'sideways_use_atr': False, 'sideways_use_adx': False, 'sideways_use_spike': True, 'sideways_rsi_required': False}.
[I 2025-09-01 10:29:25,762] Trial 519 finished with values: [-0.020467290624825774, 0.020558305598480372] and parameters: {'p_sma': 57, 'p_std': 24, 'p_atr': 28, 'p_adx': 8, 'rsi_period': 7, 'ema1': 8, 'ema2': 33, 'slip_atr_k': 0.08136631026617444, 'slip_spread_k': 0.7850484385055734, 'spread_hl_frac': 0.04866934915751299, 'bb_std_mult': 2.1275844567011335, 'rsi_os': 25, 'rsi_ob': 55, 'vol_spike': 0.17979980368852932, 'adx_thresh': 21.16631871351812, 'atr_min_pct': 0.008750518416403563, 'atr_max_pct': 0.1454039899170233, 'tp_mult': 2.4573924016714135, 'tsl_mult': 0.8129611294241679, 'strategy': 'breakout', 'time_stop': 116, 'use_sma': True, 'use_atr': True, 'use_adx': False, 'use_ema': False, 'use_spike': True, 'rsi_required': False, 'edge_k': 0.6244289520717085, 'edge_cap': 0.4685713966938374, 'bull_strategy': 'breakout', 'bull_bb_std_mult': 3.4996354934429634, 'bull_rsi_os': 30, 'bull_rsi_ob': 76, 'bull_adx_thresh': 12.535517983965105, 'bull_atr_min_pct': 0.023081814132605724, 'bull_atr_max_pct': 0.07375716370412133, 'bull_tp_mult': 1.6004111621017356, 'bull_tsl_mult': 0.5989533160341894, 'bull_time_stop': 144, 'bull_use_sma': True, 'bull_use_ema': True, 'bull_use_atr': True, 'bull_use_adx': False, 'bull_use_spike': True, 'bull_rsi_required': False, 'bear_strategy': 'breakout', 'bear_bb_std_mult': 1.6036429296753143, 'bear_rsi_os': 9, 'bear_rsi_ob': 75, 'bear_adx_thresh': 34.96762859084636, 'bear_atr_min_pct': 0.02404534825923478, 'bear_atr_max_pct': 0.12961673196453308, 'bear_tp_mult': 1.1886384827069207, 'bear_tsl_mult': 0.3632648221309551, 'bear_time_stop': 24, 'bear_use_sma': False, 'bear_use_ema': True, 'bear_use_atr': True, 'bear_use_adx': True, 'bear_use_spike': False, 'bear_rsi_required': False, 'sideways_strategy': 'mean_reversion', 'sideways_bb_std_mult': 1.3859684668053642, 'sideways_rsi_os': 31, 'sideways_rsi_ob': 61, 'sideways_adx_thresh': 31.848890887401108, 'sideways_atr_min_pct': 0.003128261367497146, 'sideways_atr_max_pct': 0.0863819501211859, 'sideways_tp_mult': 1.2468596025152268, 'sideways_tsl_mult': 0.8967640131584492, 'sideways_time_stop': 219, 'sideways_use_sma': True, 'sideways_use_ema': False, 'sideways_use_atr': False, 'sideways_use_adx': False, 'sideways_use_spike': True, 'sideways_rsi_required': False}.
[I 2025-09-01 10:29:26,314] Trial 517 finished with values: [-1000000000.0, 1000000000.0] and parameters: {'p_sma': 33, 'p_std': 60, 'p_atr': 28, 'p_adx': 12, 'rsi_period': 50, 'ema1': 28, 'ema2': 55, 'slip_atr_k': 0.0939924245934647, 'slip_spread_k': 0.6407433561771626, 'spread_hl_frac': 0.01037467981505222, 'bb_std_mult': 2.7613297777345065, 'rsi_os': 10, 'rsi_ob': 76, 'vol_spike': 0.180652775952933, 'adx_thresh': 12.619971779615469, 'atr_min_pct': 0.024874274779474174, 'atr_max_pct': 0.06881009962816094, 'tp_mult': 2.455660918723113, 'tsl_mult': 0.2507676711005806, 'strategy': 'breakout', 'time_stop': 144, 'use_sma': True, 'use_atr': True, 'use_adx': False, 'use_ema': False, 'use_spike': True, 'rsi_required': False, 'edge_k': 0.6439429231031646, 'edge_cap': 0.4292077989721841, 'bull_strategy': 'mean_reversion', 'bull_bb_std_mult': 0.5864504633368302, 'bull_rsi_os': 30, 'bull_rsi_ob': 81, 'bull_adx_thresh': 28.399333325253757, 'bull_atr_min_pct': 0.004697998262730594, 'bull_atr_max_pct': 0.07233583784091839, 'bull_tp_mult': 1.5904762368306071, 'bull_tsl_mult': 0.8704679050394368, 'bull_time_stop': 121, 'bull_use_sma': True, 'bull_use_ema': False, 'bull_use_atr': True, 'bull_use_adx': False, 'bull_use_spike': True, 'bull_rsi_required': False, 'bear_strategy': 'breakout', 'bear_bb_std_mult': 1.5878778307284789, 'bear_rsi_os': 46, 'bear_rsi_ob': 74, 'bear_adx_thresh': 16.08929725055831, 'bear_atr_min_pct': 0.013811882236194692, 'bear_atr_max_pct': 0.11285747660559955, 'bear_tp_mult': 2.498561802440234, 'bear_tsl_mult': 0.07491200632205713, 'bear_time_stop': 147, 'bear_use_sma': False, 'bear_use_ema': True, 'bear_use_atr': True, 'bear_use_adx': True, 'bear_use_spike': True, 'bear_rsi_required': False, 'sideways_strategy': 'mean_reversion', 'sideways_bb_std_mult': 2.342247610109282, 'sideways_rsi_os': 55, 'sideways_rsi_ob': 61, 'sideways_adx_thresh': 31.059938981362926, 'sideways_atr_min_pct': 0.02303476978055739, 'sideways_atr_max_pct': 0.11518311292511678, 'sideways_tp_mult': 1.2807370201063009, 'sideways_tsl_mult': 0.9576873450784187, 'sideways_time_stop': 220, 'sideways_use_sma': True, 'sideways_use_ema': False, 'sideways_use_atr': False, 'sideways_use_adx': False, 'sideways_use_spike': True, 'sideways_rsi_required': False}.
[I 2025-09-01 10:29:26,707] Trial 520 finished with values: [-0.00909070832147496, 0.010801085009653615] and parameters: {'p_sma': 57, 'p_std': 43, 'p_atr': 28, 'p_adx': 17, 'rsi_period': 50, 'ema1': 28, 'ema2': 12, 'slip_atr_k': 0.0001195286014136869, 'slip_spread_k': 0.5662613616561677, 'spread_hl_frac': 0.03428897584609986, 'bb_std_mult': 3.3622601524560407, 'rsi_os': 40, 'rsi_ob': 69, 'vol_spike': 0.2064360814115181, 'adx_thresh': 12.375975517677347, 'atr_min_pct': 0.02510935304131741, 'atr_max_pct': 0.06994267165213579, 'tp_mult': 1.5210540347717574, 'tsl_mult': 0.8068087019921568, 'strategy': 'breakout', 'time_stop': 275, 'use_sma': True, 'use_atr': True, 'use_adx': False, 'use_ema': False, 'use_spike': True, 'rsi_required': False, 'edge_k': 0.6331875457136041, 'edge_cap': 0.3195180176597057, 'bull_strategy': 'breakout', 'bull_bb_std_mult': 3.363050023129872, 'bull_rsi_os': 17, 'bull_rsi_ob': 68, 'bull_adx_thresh': 24.40128541783746, 'bull_atr_min_pct': 0.009587947901502584, 'bull_atr_max_pct': 0.07432869742424308, 'bull_tp_mult': 1.4250661039346841, 'bull_tsl_mult': 0.5980693801206126, 'bull_time_stop': 146, 'bull_use_sma': True, 'bull_use_ema': True, 'bull_use_atr': True, 'bull_use_adx': False, 'bull_use_spike': True, 'bull_rsi_required': False, 'bear_strategy': 'breakout', 'bear_bb_std_mult': 1.6206050258972722, 'bear_rsi_os': 9, 'bear_rsi_ob': 50, 'bear_adx_thresh': 32.08196261656261, 'bear_atr_min_pct': 0.02932742460580197, 'bear_atr_max_pct': 0.11900504624770335, 'bear_tp_mult': 2.4959198600294785, 'bear_tsl_mult': 0.8378141152688435, 'bear_time_stop': 201, 'bear_use_sma': False, 'bear_use_ema': True, 'bear_use_atr': True, 'bear_use_adx': True, 'bear_use_spike': False, 'bear_rsi_required': False, 'sideways_strategy': 'breakout', 'sideways_bb_std_mult': 2.355174437048326, 'sideways_rsi_os': 31, 'sideways_rsi_ob': 53, 'sideways_adx_thresh': 7.339562220880612, 'sideways_atr_min_pct': 0.002916363220453877, 'sideways_atr_max_pct': 0.03218623174542373, 'sideways_tp_mult': 1.2643850976211306, 'sideways_tsl_mult': 0.05009701932028632, 'sideways_time_stop': 221, 'sideways_use_sma': True, 'sideways_use_ema': False, 'sideways_use_atr': False, 'sideways_use_adx': False, 'sideways_use_spike': True, 'sideways_rsi_required': False}.
[I 2025-09-01 10:29:27,506] Trial 522 finished with values: [-1000000000.0, 1000000000.0] and parameters: {'p_sma': 33, 'p_std': 43, 'p_atr': 26, 'p_adx': 12, 'rsi_period': 44, 'ema1': 8, 'ema2': 55, 'slip_atr_k': 0.033243336300196394, 'slip_spread_k': 0.5618029569143955, 'spread_hl_frac': 0.006542987424429664, 'bb_std_mult': 2.761048140552468, 'rsi_os': 8, 'rsi_ob': 47, 'vol_spike': 0.20497792033028578, 'adx_thresh': 12.010340282694989, 'atr_min_pct': 0.017090249441112, 'atr_max_pct': 0.07749172906306269, 'tp_mult': 2.525723022398267, 'tsl_mult': 0.12189738357167856, 'strategy': 'mean_reversion', 'time_stop': 276, 'use_sma': False, 'use_atr': True, 'use_adx': True, 'use_ema': True, 'use_spike': False, 'rsi_required': False, 'edge_k': 0.5110142240080238, 'edge_cap': 0.8262330361111123, 'bull_strategy': 'mean_reversion', 'bull_bb_std_mult': 0.6047201776186799, 'bull_rsi_os': 36, 'bull_rsi_ob': 69, 'bull_adx_thresh': 27.981835471182276, 'bull_atr_min_pct': 0.005313174543736105, 'bull_atr_max_pct': 0.06663662433638044, 'bull_tp_mult': 1.4226111786436917, 'bull_tsl_mult': 0.9170539734263427, 'bull_time_stop': 137, 'bull_use_sma': False, 'bull_use_ema': False, 'bull_use_atr': True, 'bull_use_adx': True, 'bull_use_spike': True, 'bull_rsi_required': True, 'bear_strategy': 'mean_reversion', 'bear_bb_std_mult': 1.380003915292217, 'bear_rsi_os': 51, 'bear_rsi_ob': 69, 'bear_adx_thresh': 21.118384988813705, 'bear_atr_min_pct': 0.029961996521291157, 'bear_atr_max_pct': 0.14915632328780126, 'bear_tp_mult': 2.7953889969362935, 'bear_tsl_mult': 0.8351052751932906, 'bear_time_stop': 199, 'bear_use_sma': True, 'bear_use_ema': True, 'bear_use_atr': False, 'bear_use_adx': False, 'bear_use_spike': True, 'bear_rsi_required': True, 'sideways_strategy': 'breakout', 'sideways_bb_std_mult': 2.6064184449200365, 'sideways_rsi_os': 21, 'sideways_rsi_ob': 60, 'sideways_adx_thresh': 9.911159112252035, 'sideways_atr_min_pct': 0.0031334419575846113, 'sideways_atr_max_pct': 0.07050776430150466, 'sideways_tp_mult': 1.3876268591873848, 'sideways_tsl_mult': 0.963975884339561, 'sideways_time_stop': 244, 'sideways_use_sma': False, 'sideways_use_ema': True, 'sideways_use_atr': True, 'sideways_use_adx': False, 'sideways_use_spike': True, 'sideways_rsi_required': False}.
