[I 2025-09-01 09:53:06,365] Trial 308 finished with values: [-0.011323156368400866, 0.012003100781222664] and parameters: {'p_sma': 60, 'p_std': 53, 'p_atr': 26, 'p_adx': 14, 'rsi_period': 82, 'ema1': 19, 'ema2': 35, 'slip_atr_k': 0.14251673468767387, 'slip_spread_k': 0.5228664769288767, 'spread_hl_frac': 0.007101988604035011, 'bb_std_mult': 3.5960391977956583, 'rsi_os': 29, 'rsi_ob': 56, 'vol_spike': 0.1873060000612799, 'adx_thresh': 13.382850271399795, 'atr_min_pct': 0.019468277357880502, 'atr_max_pct': 0.0709842749521837, 'tp_mult': 2.529626111547737, 'tsl_mult': 0.8393502272053556, 'strategy': 'breakout', 'time_stop': 153, 'use_sma': True, 'use_atr': False, 'use_adx': False, 'use_ema': False, 'use_spike': True, 'rsi_required': False, 'edge_k': 1.1538442275790195, 'edge_cap': 0.8192823294239063, 'bull_strategy': 'mean_reversion', 'bull_bb_std_mult': 2.9054251771216872, 'bull_rsi_os': 39, 'bull_rsi_ob': 78, 'bull_adx_thresh': 33.867293596668354, 'bull_atr_min_pct': 0.00456710671124239, 'bull_atr_max_pct': 0.14978127225618498, 'bull_tp_mult': 1.4263042062683016, 'bull_tsl_mult': 0.772257265701119, 'bull_time_stop': 150, 'bull_use_sma': True, 'bull_use_ema': False, 'bull_use_atr': True, 'bull_use_adx': False, 'bull_use_spike': True, 'bull_rsi_required': False, 'bear_strategy': 'breakout', 'bear_bb_std_mult': 1.627791631613755, 'bear_rsi_os': 13, 'bear_rsi_ob': 59, 'bear_adx_thresh': 34.14106429414572, 'bear_atr_min_pct': 0.029394726884354145, 'bear_atr_max_pct': 0.095915240826979, 'bear_tp_mult': 2.870052236638792, 'bear_tsl_mult': 0.5395461291320462, 'bear_time_stop': 23, 'bear_use_sma': True, 'bear_use_ema': True, 'bear_use_atr': True, 'bear_use_adx': True, 'bear_use_spike': False, 'bear_rsi_required': False, 'sideways_strategy': 'mean_reversion', 'sideways_bb_std_mult': 1.6807376447267697, 'sideways_rsi_os': 50, 'sideways_rsi_ob': 63, 'sideways_adx_thresh': 31.151197946869974, 'sideways_atr_min_pct': 0.004038951345651315, 'sideways_atr_max_pct': 0.08641721545268091, 'sideways_tp_mult': 2.6563454451129718, 'sideways_tsl_mult': 0.9647173185356049, 'sideways_time_stop': 231, 'sideways_use_sma': True, 'sideways_use_ema': False, 'sideways_use_atr': False, 'sideways_use_adx': False, 'sideways_use_spike': True, 'sideways_rsi_required': False}.
[I 2025-09-01 09:53:06,646] Trial 307 finished with values: [-1000000000.0, 1000000000.0] and parameters: {'p_sma': 60, 'p_std': 45, 'p_atr': 26, 'p_adx': 22, 'rsi_period': 15, 'ema1': 18, 'ema2': 38, 'slip_atr_k': 0.14623306817832932, 'slip_spread_k': 0.6281306645056055, 'spread_hl_frac': 0.00721196638508118, 'bb_std_mult': 2.780051661899592, 'rsi_os': 8, 'rsi_ob': 48, 'vol_spike': 0.08167505947000664, 'adx_thresh': 13.411296979826552, 'atr_min_pct': 0.019526068058943302, 'atr_max_pct': 0.1389336035068567, 'tp_mult': 2.517910780749281, 'tsl_mult': 0.8323505159890299, 'strategy': 'breakout', 'time_stop': 155, 'use_sma': True, 'use_atr': False, 'use_adx': False, 'use_ema': False, 'use_spike': True, 'rsi_required': False, 'edge_k': 0.583114569560364, 'edge_cap': 0.8174211062064493, 'bull_strategy': 'mean_reversion', 'bull_bb_std_mult': 3.390418430429133, 'bull_rsi_os': 26, 'bull_rsi_ob': 78, 'bull_adx_thresh': 20.70903020454739, 'bull_atr_min_pct': 0.0044996422859801335, 'bull_atr_max_pct': 0.010159113248322638, 'bull_tp_mult': 1.1959240718428155, 'bull_tsl_mult': 0.7759834343838756, 'bull_time_stop': 142, 'bull_use_sma': True, 'bull_use_ema': False, 'bull_use_atr': True, 'bull_use_adx': False, 'bull_use_spike': True, 'bull_rsi_required': False, 'bear_strategy': 'breakout', 'bear_bb_std_mult': 1.616493461272341, 'bear_rsi_os': 43, 'bear_rsi_ob': 73, 'bear_adx_thresh': 33.13819468363622, 'bear_atr_min_pct': 0.029992765315910008, 'bear_atr_max_pct': 0.025711626770666546, 'bear_tp_mult': 2.195019919519126, 'bear_tsl_mult': 0.7130227030561689, 'bear_time_stop': 26, 'bear_use_sma': True, 'bear_use_ema': True, 'bear_use_atr': True, 'bear_use_adx': True, 'bear_use_spike': False, 'bear_rsi_required': False, 'sideways_strategy': 'mean_reversion', 'sideways_bb_std_mult': 2.9571853571053195, 'sideways_rsi_os': 50, 'sideways_rsi_ob': 51, 'sideways_adx_thresh': 31.063502750465908, 'sideways_atr_min_pct': 0.026866304321314143, 'sideways_atr_max_pct': 0.08767334967522619, 'sideways_tp_mult': 1.402471445018617, 'sideways_tsl_mult': 0.9653843899001251, 'sideways_time_stop': 256, 'sideways_use_sma': True, 'sideways_use_ema': False, 'sideways_use_atr': False, 'sideways_use_adx': False, 'sideways_use_spike': True, 'sideways_rsi_required': False}.
[I 2025-09-01 09:53:06,995] Trial 309 finished with values: [-1000000000.0, 1000000000.0] and parameters: {'p_sma': 60, 'p_std': 26, 'p_atr': 26, 'p_adx': 19, 'rsi_period': 42, 'ema1': 19, 'ema2': 39, 'slip_atr_k': 0.1429710543226686, 'slip_spread_k': 0.061732819475677825, 'spread_hl_frac': 0.04877724113728339, 'bb_std_mult': 3.0462102930987847, 'rsi_os': 27, 'rsi_ob': 48, 'vol_spike': 0.08053970491739745, 'adx_thresh': 13.446239947658384, 'atr_min_pct': 0.019255073787972893, 'atr_max_pct': 0.14004124167891588, 'tp_mult': 1.6907683897612906, 'tsl_mult': 0.6221999289309441, 'strategy': 'breakout', 'time_stop': 153, 'use_sma': True, 'use_atr': False, 'use_adx': False, 'use_ema': False, 'use_spike': True, 'rsi_required': True, 'edge_k': 1.5825754284835434, 'edge_cap': 0.8587854524986149, 'bull_strategy': 'mean_reversion', 'bull_bb_std_mult': 2.875791514367978, 'bull_rsi_os': 39, 'bull_rsi_ob': 74, 'bull_adx_thresh': 26.98488784021394, 'bull_atr_min_pct': 0.024115285404394803, 'bull_atr_max_pct': 0.08171147919705135, 'bull_tp_mult': 1.5182329598478914, 'bull_tsl_mult': 0.7739225679568931, 'bull_time_stop': 143, 'bull_use_sma': True, 'bull_use_ema': False, 'bull_use_atr': False, 'bull_use_adx': False, 'bull_use_spike': True, 'bull_rsi_required': False, 'bear_strategy': 'breakout', 'bear_bb_std_mult': 1.8165682925131335, 'bear_rsi_os': 14, 'bear_rsi_ob': 59, 'bear_adx_thresh': 34.12868292295095, 'bear_atr_min_pct': 0.02942628545208492, 'bear_atr_max_pct': 0.130233493103629, 'bear_tp_mult': 2.8621048978839374, 'bear_tsl_mult': 0.0953153117668924, 'bear_time_stop': 268, 'bear_use_sma': True, 'bear_use_ema': True, 'bear_use_atr': True, 'bear_use_adx': True, 'bear_use_spike': False, 'bear_rsi_required': False, 'sideways_strategy': 'mean_reversion', 'sideways_bb_std_mult': 2.4884725931113794, 'sideways_rsi_os': 27, 'sideways_rsi_ob': 51, 'sideways_adx_thresh': 30.97451421129659, 'sideways_atr_min_pct': 0.012773652899323211, 'sideways_atr_max_pct': 0.08844901648203964, 'sideways_tp_mult': 1.227905215976489, 'sideways_tsl_mult': 0.6078508204572934, 'sideways_time_stop': 256, 'sideways_use_sma': True, 'sideways_use_ema': False, 'sideways_use_atr': False, 'sideways_use_adx': False, 'sideways_use_spike': True, 'sideways_rsi_required': True}.
[I 2025-09-01 09:53:07,156] Trial 306 finished with values: [-1000000000.0, 1000000000.0] and parameters: {'p_sma': 59, 'p_std': 41, 'p_atr': 29, 'p_adx': 19, 'rsi_period': 54, 'ema1': 8, 'ema2': 38, 'slip_atr_k': 0.14432404793043474, 'slip_spread_k': 0.47409694136527997, 'spread_hl_frac': 0.007131234313900333, 'bb_std_mult': 1.6782189473677365, 'rsi_os': 15, 'rsi_ob': 56, 'vol_spike': 0.1947065620217546, 'adx_thresh': 30.39469340237583, 'atr_min_pct': 0.019651652745298738, 'atr_max_pct': 0.07122045563710754, 'tp_mult': 1.848753124673263, 'tsl_mult': 0.8130022115624217, 'strategy': 'mean_reversion', 'time_stop': 154, 'use_sma': True, 'use_atr': True, 'use_adx': True, 'use_ema': False, 'use_spike': False, 'rsi_required': False, 'edge_k': 1.16390926561962, 'edge_cap': 0.9252007165091308, 'bull_strategy': 'breakout', 'bull_bb_std_mult': 1.300294579013269, 'bull_rsi_os': 21, 'bull_rsi_ob': 79, 'bull_adx_thresh': 26.442375941076296, 'bull_atr_min_pct': 0.004165670676239497, 'bull_atr_max_pct': 0.09206301198702871, 'bull_tp_mult': 1.5509550001967558, 'bull_tsl_mult': 0.7905622485300103, 'bull_time_stop': 120, 'bull_use_sma': False, 'bull_use_ema': True, 'bull_use_atr': True, 'bull_use_adx': False, 'bull_use_spike': True, 'bull_rsi_required': True, 'bear_strategy': 'breakout', 'bear_bb_std_mult': 1.8354415433458369, 'bear_rsi_os': 45, 'bear_rsi_ob': 81, 'bear_adx_thresh': 19.494718426091822, 'bear_atr_min_pct': 0.012400311223725183, 'bear_atr_max_pct': 0.12771315300290392, 'bear_tp_mult': 2.8944144775139757, 'bear_tsl_mult': 0.26530039843818487, 'bear_time_stop': 172, 'bear_use_sma': False, 'bear_use_ema': True, 'bear_use_atr': False, 'bear_use_adx': True, 'bear_use_spike': False, 'bear_rsi_required': False, 'sideways_strategy': 'mean_reversion', 'sideways_bb_std_mult': 2.981573046691797, 'sideways_rsi_os': 31, 'sideways_rsi_ob': 60, 'sideways_adx_thresh': 15.399123997862873, 'sideways_atr_min_pct': 0.012525743549487312, 'sideways_atr_max_pct': 0.08238611619661665, 'sideways_tp_mult': 2.2821540800343545, 'sideways_tsl_mult': 0.9726757829601685, 'sideways_time_stop': 221, 'sideways_use_sma': False, 'sideways_use_ema': False, 'sideways_use_atr': True, 'sideways_use_adx': False, 'sideways_use_spike': False, 'sideways_rsi_required': False}.
[I 2025-09-01 09:53:49,076] Trial 310 finished with values: [-1000000000.0, 1000000000.0] and parameters: {'p_sma': 15, 'p_std': 26, 'p_atr': 28, 'p_adx': 19, 'rsi_period': 41, 'ema1': 8, 'ema2': 14, 'slip_atr_k': 7.844204840729875e-05, 'slip_spread_k': 0.7300098258153196, 'spread_hl_frac': 0.0075949674744665635, 'bb_std_mult': 2.0539826792770763, 'rsi_os': 8, 'rsi_ob': 88, 'vol_spike': 0.19419759259619374, 'adx_thresh': 12.134173509367315, 'atr_min_pct': 0.019026255775005767, 'atr_max_pct': 0.06707903025195701, 'tp_mult': 1.6948651848598082, 'tsl_mult': 0.9465891427626971, 'strategy': 'breakout', 'time_stop': 146, 'use_sma': False, 'use_atr': True, 'use_adx': False, 'use_ema': False, 'use_spike': True, 'rsi_required': True, 'edge_k': 0.745002295372968, 'edge_cap': 0.18209747569910795, 'bull_strategy': 'mean_reversion', 'bull_bb_std_mult': 3.4290359494700806, 'bull_rsi_os': 38, 'bull_rsi_ob': 90, 'bull_adx_thresh': 34.97502848324946, 'bull_atr_min_pct': 0.0064277594773034545, 'bull_atr_max_pct': 0.08043823900391674, 'bull_tp_mult': 1.871873893048575, 'bull_tsl_mult': 0.9746964120090386, 'bull_time_stop': 141, 'bull_use_sma': True, 'bull_use_ema': False, 'bull_use_atr': False, 'bull_use_adx': False, 'bull_use_spike': False, 'bull_rsi_required': False, 'bear_strategy': 'breakout', 'bear_bb_std_mult': 1.21697495706681, 'bear_rsi_os': 52, 'bear_rsi_ob': 81, 'bear_adx_thresh': 34.56370823588253, 'bear_atr_min_pct': 0.028691433684757957, 'bear_atr_max_pct': 0.13131031757223752, 'bear_tp_mult': 2.783652106146943, 'bear_tsl_mult': 0.78062104762267, 'bear_time_stop': 184, 'bear_use_sma': False, 'bear_use_ema': False, 'bear_use_atr': True, 'bear_use_adx': False, 'bear_use_spike': True, 'bear_rsi_required': False, 'sideways_strategy': 'mean_reversion', 'sideways_bb_std_mult': 2.449494804309682, 'sideways_rsi_os': 29, 'sideways_rsi_ob': 59, 'sideways_adx_thresh': 13.33382256139802, 'sideways_atr_min_pct': 0.002894166838569844, 'sideways_atr_max_pct': 0.09137146436880632, 'sideways_tp_mult': 1.1677648824346747, 'sideways_tsl_mult': 0.005646384213218836, 'sideways_time_stop': 146, 'sideways_use_sma': True, 'sideways_use_ema': True, 'sideways_use_atr': False, 'sideways_use_adx': False, 'sideways_use_spike': True, 'sideways_rsi_required': True}.
[I 2025-09-01 09:53:50,120] Trial 311 finished with values: [-1000000000.0, 1000000000.0] and parameters: {'p_sma': 34, 'p_std': 24, 'p_atr': 28, 'p_adx': 10, 'rsi_period': 42, 'ema1': 8, 'ema2': 30, 'slip_atr_k': 0.011432688384516013, 'slip_spread_k': 0.47592642739467406, 'spread_hl_frac': 0.003797560930357867, 'bb_std_mult': 2.69974594582392, 'rsi_os': 8, 'rsi_ob': 74, 'vol_spike': 0.018660697911886265, 'adx_thresh': 12.239310548287643, 'atr_min_pct': 0.018812789962926034, 'atr_max_pct': 0.06750300819203367, 'tp_mult': 2.403002999162665, 'tsl_mult': 0.770200619148426, 'strategy': 'breakout', 'time_stop': 144, 'use_sma': False, 'use_atr': True, 'use_adx': False, 'use_ema': False, 'use_spike': True, 'rsi_required': True, 'edge_k': 0.729960053599088, 'edge_cap': 0.8637842418278403, 'bull_strategy': 'mean_reversion', 'bull_bb_std_mult': 3.4426020375586486, 'bull_rsi_os': 40, 'bull_rsi_ob': 66, 'bull_adx_thresh': 27.031674173741333, 'bull_atr_min_pct': 0.008877514053008989, 'bull_atr_max_pct': 0.08132279785760126, 'bull_tp_mult': 1.5272316437030278, 'bull_tsl_mult': 0.9640917525538734, 'bull_time_stop': 142, 'bull_use_sma': True, 'bull_use_ema': False, 'bull_use_atr': False, 'bull_use_adx': False, 'bull_use_spike': False, 'bull_rsi_required': False, 'bear_strategy': 'breakout', 'bear_bb_std_mult': 1.3425027273441745, 'bear_rsi_os': 49, 'bear_rsi_ob': 81, 'bear_adx_thresh': 6.504774460131969, 'bear_atr_min_pct': 0.028702363188403506, 'bear_atr_max_pct': 0.13080077588239497, 'bear_tp_mult': 2.7622636979512754, 'bear_tsl_mult': 0.7636046069591759, 'bear_time_stop': 184, 'bear_use_sma': False, 'bear_use_ema': False, 'bear_use_atr': True, 'bear_use_adx': False, 'bear_use_spike': True, 'bear_rsi_required': False, 'sideways_strategy': 'mean_reversion', 'sideways_bb_std_mult': 2.472124525908422, 'sideways_rsi_os': 29, 'sideways_rsi_ob': 68, 'sideways_adx_thresh': 15.332712082434746, 'sideways_atr_min_pct': 0.010360218855557286, 'sideways_atr_max_pct': 0.09121256501296833, 'sideways_tp_mult': 2.8955639063215752, 'sideways_tsl_mult': 0.9321826576486, 'sideways_time_stop': 146, 'sideways_use_sma': True, 'sideways_use_ema': True, 'sideways_use_atr': False, 'sideways_use_adx': False, 'sideways_use_spike': True, 'sideways_rsi_required': True}.
[I 2025-09-01 09:53:50,121] Trial 313 finished with values: [-1000000000.0, 1000000000.0] and parameters: {'p_sma': 16, 'p_std': 18, 'p_atr': 28, 'p_adx': 13, 'rsi_period': 56, 'ema1': 8, 'ema2': 57, 'slip_atr_k': 0.011177632316405124, 'slip_spread_k': 0.735165779995557, 'spread_hl_frac': 0.0049903297136972904, 'bb_std_mult': 2.663251010114792, 'rsi_os': 49, 'rsi_ob': 54, 'vol_spike': 0.20907029526105708, 'adx_thresh': 7.269348222691445, 'atr_min_pct': 0.024635577229398534, 'atr_max_pct': 0.11796049791657234, 'tp_mult': 1.2732265580341497, 'tsl_mult': 0.7681218773563386, 'strategy': 'breakout', 'time_stop': 114, 'use_sma': False, 'use_atr': True, 'use_adx': False, 'use_ema': False, 'use_spike': True, 'rsi_required': True, 'edge_k': 0.7382279536683619, 'edge_cap': 0.8945951202969078, 'bull_strategy': 'mean_reversion', 'bull_bb_std_mult': 3.423499083442338, 'bull_rsi_os': 54, 'bull_rsi_ob': 59, 'bull_adx_thresh': 10.145306846254174, 'bull_atr_min_pct': 0.028687161819403395, 'bull_atr_max_pct': 0.1216198304458546, 'bull_tp_mult': 1.8851464389791028, 'bull_tsl_mult': 0.9621352332738079, 'bull_time_stop': 136, 'bull_use_sma': True, 'bull_use_ema': False, 'bull_use_atr': False, 'bull_use_adx': False, 'bull_use_spike': False, 'bull_rsi_required': False, 'bear_strategy': 'breakout', 'bear_bb_std_mult': 1.331370959722032, 'bear_rsi_os': 8, 'bear_rsi_ob': 62, 'bear_adx_thresh': 29.179355803247798, 'bear_atr_min_pct': 0.028699306217404276, 'bear_atr_max_pct': 0.13257800003537346, 'bear_tp_mult': 1.8176282539490383, 'bear_tsl_mult': 0.7691017543172821, 'bear_time_stop': 11, 'bear_use_sma': False, 'bear_use_ema': False, 'bear_use_atr': True, 'bear_use_adx': False, 'bear_use_spike': True, 'bear_rsi_required': False, 'sideways_strategy': 'mean_reversion', 'sideways_bb_std_mult': 2.4763621560232667, 'sideways_rsi_os': 28, 'sideways_rsi_ob': 59, 'sideways_adx_thresh': 33.28489495078722, 'sideways_atr_min_pct': 0.0029949476861709334, 'sideways_atr_max_pct': 0.09176683483893444, 'sideways_tp_mult': 1.1370797841263065, 'sideways_tsl_mult': 0.9413131207266425, 'sideways_time_stop': 215, 'sideways_use_sma': True, 'sideways_use_ema': True, 'sideways_use_atr': False, 'sideways_use_adx': False, 'sideways_use_spike': True, 'sideways_rsi_required': True}.
[I 2025-09-01 09:53:50,736] Trial 312 finished with values: [-1000000000.0, 1000000000.0] and parameters: {'p_sma': 42, 'p_std': 44, 'p_atr': 20, 'p_adx': 13, 'rsi_period': 52, 'ema1': 8, 'ema2': 20, 'slip_atr_k': 0.004473696762492485, 'slip_spread_k': 0.3756813548116865, 'spread_hl_frac': 0.0007666068075135937, 'bb_std_mult': 2.6845631355764996, 'rsi_os': 54, 'rsi_ob': 65, 'vol_spike': 0.20744302655903765, 'adx_thresh': 12.20821944624055, 'atr_min_pct': 0.01840811494653478, 'atr_max_pct': 0.06655907491608459, 'tp_mult': 2.596661573110448, 'tsl_mult': 0.5674881865279557, 'strategy': 'breakout', 'time_stop': 145, 'use_sma': False, 'use_atr': True, 'use_adx': False, 'use_ema': False, 'use_spike': True, 'rsi_required': True, 'edge_k': 1.0489429401270722, 'edge_cap': 0.8948195412404389, 'bull_strategy': 'mean_reversion', 'bull_bb_std_mult': 3.429673728569442, 'bull_rsi_os': 40, 'bull_rsi_ob': 59, 'bull_adx_thresh': 10.149039105945189, 'bull_atr_min_pct': 0.005295055063958892, 'bull_atr_max_pct': 0.08000819790272251, 'bull_tp_mult': 2.0542666378981638, 'bull_tsl_mult': 7.013651529980125e-05, 'bull_time_stop': 136, 'bull_use_sma': True, 'bull_use_ema': False, 'bull_use_atr': False, 'bull_use_adx': False, 'bull_use_spike': False, 'bull_rsi_required': False, 'bear_strategy': 'breakout', 'bear_bb_std_mult': 1.1833085209529743, 'bear_rsi_os': 19, 'bear_rsi_ob': 89, 'bear_adx_thresh': 32.3968569190137, 'bear_atr_min_pct': 0.028720924941238516, 'bear_atr_max_pct': 0.13450903434778014, 'bear_tp_mult': 2.7607036889978667, 'bear_tsl_mult': 0.7701848405063119, 'bear_time_stop': 11, 'bear_use_sma': False, 'bear_use_ema': False, 'bear_use_atr': True, 'bear_use_adx': False, 'bear_use_spike': True, 'bear_rsi_required': False, 'sideways_strategy': 'mean_reversion', 'sideways_bb_std_mult': 1.9360912828778805, 'sideways_rsi_os': 30, 'sideways_rsi_ob': 57, 'sideways_adx_thresh': 29.86918192692143, 'sideways_atr_min_pct': 0.0028871575471855686, 'sideways_atr_max_pct': 0.10490635988196934, 'sideways_tp_mult': 1.1376672404260795, 'sideways_tsl_mult': 0.9406648655056382, 'sideways_time_stop': 183, 'sideways_use_sma': True, 'sideways_use_ema': True, 'sideways_use_atr': False, 'sideways_use_adx': False, 'sideways_use_spike': True, 'sideways_rsi_required': True}.
[I 2025-09-01 09:54:34,213] Trial 315 finished with values: [-1000000000.0, 1000000000.0] and parameters: {'p_sma': 57, 'p_std': 44, 'p_atr': 23, 'p_adx': 7, 'rsi_period': 72, 'ema1': 10, 'ema2': 13, 'slip_atr_k': 0.01659084725886085, 'slip_spread_k': 0.5813909255168803, 'spread_hl_frac': 0.029959477784980405, 'bb_std_mult': 1.2692093668271145, 'rsi_os': 37, 'rsi_ob': 55, 'vol_spike': 0.06616556479562456, 'adx_thresh': 11.243215817374338, 'atr_min_pct': 0.020274549828016006, 'atr_max_pct': 0.06378942885710186, 'tp_mult': 2.5960269574429367, 'tsl_mult': 0.8320125428449118, 'strategy': 'breakout', 'time_stop': 191, 'use_sma': True, 'use_atr': True, 'use_adx': False, 'use_ema': True, 'use_spike': True, 'rsi_required': False, 'edge_k': 0.594401367409388, 'edge_cap': 0.7020835033849644, 'bull_strategy': 'mean_reversion', 'bull_bb_std_mult': 3.5497595534774677, 'bull_rsi_os': 36, 'bull_rsi_ob': 45, 'bull_adx_thresh': 27.998742445614166, 'bull_atr_min_pct': 0.005309048626759631, 'bull_atr_max_pct': 0.07102293941248115, 'bull_tp_mult': 1.7421303754776103, 'bull_tsl_mult': 0.9138889866892037, 'bull_time_stop': 149, 'bull_use_sma': True, 'bull_use_ema': False, 'bull_use_atr': True, 'bull_use_adx': True, 'bull_use_spike': True, 'bull_rsi_required': False, 'bear_strategy': 'breakout', 'bear_bb_std_mult': 1.4922573413857276, 'bear_rsi_os': 44, 'bear_rsi_ob': 45, 'bear_adx_thresh': 25.84253847089742, 'bear_atr_min_pct': 0.026388378379956258, 'bear_atr_max_pct': 0.13663048749053294, 'bear_tp_mult': 2.9476127413148605, 'bear_tsl_mult': 0.07502987735253253, 'bear_time_stop': 16, 'bear_use_sma': False, 'bear_use_ema': True, 'bear_use_atr': True, 'bear_use_adx': True, 'bear_use_spike': True, 'bear_rsi_required': True, 'sideways_strategy': 'breakout', 'sideways_bb_std_mult': 1.1252421407285405, 'sideways_rsi_os': 33, 'sideways_rsi_ob': 87, 'sideways_adx_thresh': 30.294964614180543, 'sideways_atr_min_pct': 0.0010898162710156396, 'sideways_atr_max_pct': 0.1385955200294815, 'sideways_tp_mult': 1.3138102633135538, 'sideways_tsl_mult': 0.3718328707514612, 'sideways_time_stop': 183, 'sideways_use_sma': True, 'sideways_use_ema': False, 'sideways_use_atr': False, 'sideways_use_adx': True, 'sideways_use_spike': True, 'sideways_rsi_required': False}.
