[I 2025-09-01 10:17:43,129] Trial 451 finished with values: [-0.06157137182653083, 0.06177568781700445] and parameters: {'p_sma': 18, 'p_std': 47, 'p_atr': 15, 'p_adx': 11, 'rsi_period': 12, 'ema1': 8, 'ema2': 13, 'slip_atr_k': 0.004472646223793571, 'slip_spread_k': 0.804625491200569, 'spread_hl_frac': 0.01964391159792995, 'bb_std_mult': 2.7128534616385154, 'rsi_os': 52, 'rsi_ob': 53, 'vol_spike': 0.18882990305247482, 'adx_thresh': 28.206198209786912, 'atr_min_pct': 0.010659779129322528, 'atr_max_pct': 0.08154932112455106, 'tp_mult': 1.886318093412326, 'tsl_mult': 0.22260273872515962, 'strategy': 'breakout', 'time_stop': 273, 'use_sma': True, 'use_atr': True, 'use_adx': False, 'use_ema': False, 'use_spike': True, 'rsi_required': False, 'edge_k': 0.43420642230990225, 'edge_cap': 0.5837590847147689, 'bull_strategy': 'mean_reversion', 'bull_bb_std_mult': 3.536159321616274, 'bull_rsi_os': 36, 'bull_rsi_ob': 46, 'bull_adx_thresh': 24.794510539756956, 'bull_atr_min_pct': 0.008598704005224294, 'bull_atr_max_pct': 0.0793374365176154, 'bull_tp_mult': 2.6821977439668756, 'bull_tsl_mult': 0.5881900074658052, 'bull_time_stop': 22, 'bull_use_sma': True, 'bull_use_ema': False, 'bull_use_atr': True, 'bull_use_adx': False, 'bull_use_spike': True, 'bull_rsi_required': False, 'bear_strategy': 'mean_reversion', 'bear_bb_std_mult': 1.6890666502234792, 'bear_rsi_os': 44, 'bear_rsi_ob': 74, 'bear_adx_thresh': 34.44124448889341, 'bear_atr_min_pct': 0.02846182028738115, 'bear_atr_max_pct': 0.029995198171631043, 'bear_tp_mult': 2.1488316861476995, 'bear_tsl_mult': 0.6242914212759003, 'bear_time_stop': 10, 'bear_use_sma': False, 'bear_use_ema': True, 'bear_use_atr': True, 'bear_use_adx': False, 'bear_use_spike': True, 'bear_rsi_required': False, 'sideways_strategy': 'breakout', 'sideways_bb_std_mult': 3.494592213185256, 'sideways_rsi_os': 28, 'sideways_rsi_ob': 60, 'sideways_adx_thresh': 20.31521146368312, 'sideways_atr_min_pct': 0.0014650213438651902, 'sideways_atr_max_pct': 0.09272812584785206, 'sideways_tp_mult': 1.477541816924941, 'sideways_tsl_mult': 0.9742983555744107, 'sideways_time_stop': 173, 'sideways_use_sma': True, 'sideways_use_ema': True, 'sideways_use_atr': False, 'sideways_use_adx': False, 'sideways_use_spike': True, 'sideways_rsi_required': False}.
[I 2025-09-01 10:17:43,849] Trial 452 finished with values: [-1000000000.0, 1000000000.0] and parameters: {'p_sma': 51, 'p_std': 48, 'p_atr': 27, 'p_adx': 14, 'rsi_period': 43, 'ema1': 24, 'ema2': 37, 'slip_atr_k': 0.011464480992384908, 'slip_spread_k': 0.9960569461618354, 'spread_hl_frac': 0.022077645494408882, 'bb_std_mult': 3.5521364062337497, 'rsi_os': 24, 'rsi_ob': 80, 'vol_spike': 0.2202011386878982, 'adx_thresh': 28.451356137968887, 'atr_min_pct': 0.020524060296050306, 'atr_max_pct': 0.06595557830086973, 'tp_mult': 1.8991638521097434, 'tsl_mult': 0.4173185858519694, 'strategy': 'breakout', 'time_stop': 33, 'use_sma': True, 'use_atr': True, 'use_adx': True, 'use_ema': False, 'use_spike': True, 'rsi_required': False, 'edge_k': 0.6354470800031522, 'edge_cap': 0.9398878896198939, 'bull_strategy': 'mean_reversion', 'bull_bb_std_mult': 1.2155637233707273, 'bull_rsi_os': 36, 'bull_rsi_ob': 67, 'bull_adx_thresh': 22.810494726345816, 'bull_atr_min_pct': 0.022488899875554448, 'bull_atr_max_pct': 0.08376429360591169, 'bull_tp_mult': 1.504154499994432, 'bull_tsl_mult': 0.9395208101606463, 'bull_time_stop': 119, 'bull_use_sma': True, 'bull_use_ema': False, 'bull_use_atr': True, 'bull_use_adx': False, 'bull_use_spike': True, 'bull_rsi_required': True, 'bear_strategy': 'mean_reversion', 'bear_bb_std_mult': 1.4457570039952679, 'bear_rsi_os': 46, 'bear_rsi_ob': 73, 'bear_adx_thresh': 24.70926271910685, 'bear_atr_min_pct': 0.029691421817728252, 'bear_atr_max_pct': 0.13020050089501986, 'bear_tp_mult': 2.913524483489932, 'bear_tsl_mult': 0.8067376788214884, 'bear_time_stop': 142, 'bear_use_sma': False, 'bear_use_ema': True, 'bear_use_atr': True, 'bear_use_adx': False, 'bear_use_spike': True, 'bear_rsi_required': True, 'sideways_strategy': 'breakout', 'sideways_bb_std_mult': 2.4115148162672995, 'sideways_rsi_os': 39, 'sideways_rsi_ob': 59, 'sideways_adx_thresh': 33.4290958916785, 'sideways_atr_min_pct': 0.011873454105626093, 'sideways_atr_max_pct': 0.08873432889832385, 'sideways_tp_mult': 2.178405735848078, 'sideways_tsl_mult': 0.5712519922892239, 'sideways_time_stop': 178, 'sideways_use_sma': True, 'sideways_use_ema': True, 'sideways_use_atr': False, 'sideways_use_adx': False, 'sideways_use_spike': True, 'sideways_rsi_required': False}.
[I 2025-09-01 10:17:44,347] Trial 453 finished with values: [-1000000000.0, 1000000000.0] and parameters: {'p_sma': 59, 'p_std': 54, 'p_atr': 30, 'p_adx': 28, 'rsi_period': 39, 'ema1': 24, 'ema2': 39, 'slip_atr_k': 0.12480114300777564, 'slip_spread_k': 0.5885503362046407, 'spread_hl_frac': 0.01995411019788424, 'bb_std_mult': 3.217002418299213, 'rsi_os': 52, 'rsi_ob': 54, 'vol_spike': 0.19881960693784137, 'adx_thresh': 21.631503200582102, 'atr_min_pct': 0.025443512120377647, 'atr_max_pct': 0.08983547554234607, 'tp_mult': 2.5867415326048397, 'tsl_mult': 0.23127691091930774, 'strategy': 'breakout', 'time_stop': 150, 'use_sma': True, 'use_atr': True, 'use_adx': True, 'use_ema': False, 'use_spike': True, 'rsi_required': False, 'edge_k': 0.6379873091249071, 'edge_cap': 0.8209019172771513, 'bull_strategy': 'mean_reversion', 'bull_bb_std_mult': 1.1916810625170524, 'bull_rsi_os': 20, 'bull_rsi_ob': 51, 'bull_adx_thresh': 22.386219043543218, 'bull_atr_min_pct': 0.00868053889524532, 'bull_atr_max_pct': 0.010284236700917118, 'bull_tp_mult': 2.196250609832933, 'bull_tsl_mult': 0.9947960398165191, 'bull_time_stop': 150, 'bull_use_sma': True, 'bull_use_ema': False, 'bull_use_atr': True, 'bull_use_adx': True, 'bull_use_spike': True, 'bull_rsi_required': True, 'bear_strategy': 'mean_reversion', 'bear_bb_std_mult': 1.4545272488158805, 'bear_rsi_os': 44, 'bear_rsi_ob': 64, 'bear_adx_thresh': 33.706296053709664, 'bear_atr_min_pct': 0.029486848095335933, 'bear_atr_max_pct': 0.11150416719043693, 'bear_tp_mult': 2.9232836245233074, 'bear_tsl_mult': 0.4311441165434569, 'bear_time_stop': 5, 'bear_use_sma': False, 'bear_use_ema': True, 'bear_use_atr': True, 'bear_use_adx': False, 'bear_use_spike': True, 'bear_rsi_required': True, 'sideways_strategy': 'breakout', 'sideways_bb_std_mult': 2.1933537611786624, 'sideways_rsi_os': 30, 'sideways_rsi_ob': 87, 'sideways_adx_thresh': 25.862606383038944, 'sideways_atr_min_pct': 0.001629569661229053, 'sideways_atr_max_pct': 0.08948801769084633, 'sideways_tp_mult': 1.9233670748425946, 'sideways_tsl_mult': 0.00031516146500570885, 'sideways_time_stop': 179, 'sideways_use_sma': True, 'sideways_use_ema': True, 'sideways_use_atr': False, 'sideways_use_adx': False, 'sideways_use_spike': True, 'sideways_rsi_required': False}.
[I 2025-09-01 10:17:44,730] Trial 450 finished with values: [-0.0795610291780402, 0.07952934753448743] and parameters: {'p_sma': 18, 'p_std': 54, 'p_atr': 15, 'p_adx': 11, 'rsi_period': 10, 'ema1': 24, 'ema2': 40, 'slip_atr_k': 0.0035667113036241017, 'slip_spread_k': 0.20585802882921067, 'spread_hl_frac': 0.02153751724059761, 'bb_std_mult': 3.1646885380528613, 'rsi_os': 39, 'rsi_ob': 57, 'vol_spike': 0.2192248620644554, 'adx_thresh': 13.522341469199503, 'atr_min_pct': 0.010292106712859763, 'atr_max_pct': 0.0829022646157321, 'tp_mult': 1.289123754170464, 'tsl_mult': 0.22369506081741702, 'strategy': 'breakout', 'time_stop': 300, 'use_sma': True, 'use_atr': True, 'use_adx': False, 'use_ema': False, 'use_spike': False, 'rsi_required': False, 'edge_k': 0.6564636541063157, 'edge_cap': 0.8540017621565733, 'bull_strategy': 'breakout', 'bull_bb_std_mult': 3.5342835749938306, 'bull_rsi_os': 20, 'bull_rsi_ob': 62, 'bull_adx_thresh': 26.170070368820795, 'bull_atr_min_pct': 0.004095387054305888, 'bull_atr_max_pct': 0.07955867700332779, 'bull_tp_mult': 2.0186293385172225, 'bull_tsl_mult': 0.9938992317376512, 'bull_time_stop': 151, 'bull_use_sma': True, 'bull_use_ema': True, 'bull_use_atr': True, 'bull_use_adx': False, 'bull_use_spike': True, 'bull_rsi_required': False, 'bear_strategy': 'mean_reversion', 'bear_bb_std_mult': 1.4801849294099003, 'bear_rsi_os': 47, 'bear_rsi_ob': 74, 'bear_adx_thresh': 34.18142597531555, 'bear_atr_min_pct': 0.02102838476922428, 'bear_atr_max_pct': 0.029705210435914946, 'bear_tp_mult': 2.8997832105660515, 'bear_tsl_mult': 0.8068363155284017, 'bear_time_stop': 10, 'bear_use_sma': True, 'bear_use_ema': True, 'bear_use_atr': True, 'bear_use_adx': True, 'bear_use_spike': False, 'bear_rsi_required': False, 'sideways_strategy': 'breakout', 'sideways_bb_std_mult': 3.1599834159524365, 'sideways_rsi_os': 20, 'sideways_rsi_ob': 61, 'sideways_adx_thresh': 13.464120565052243, 'sideways_atr_min_pct': 0.001227784493662466, 'sideways_atr_max_pct': 0.08954166711118407, 'sideways_tp_mult': 1.4721140771603962, 'sideways_tsl_mult': 0.1345917297966998, 'sideways_time_stop': 246, 'sideways_use_sma': False, 'sideways_use_ema': False, 'sideways_use_atr': False, 'sideways_use_adx': False, 'sideways_use_spike': True, 'sideways_rsi_required': False}.
[I 2025-09-01 10:18:25,448] Trial 454 finished with values: [-1000000000.0, 1000000000.0] and parameters: {'p_sma': 59, 'p_std': 48, 'p_atr': 28, 'p_adx': 23, 'rsi_period': 42, 'ema1': 24, 'ema2': 49, 'slip_atr_k': 0.07130168493647736, 'slip_spread_k': 0.27794962651138877, 'spread_hl_frac': 0.0054003621978433005, 'bb_std_mult': 2.5340686419465848, 'rsi_os': 22, 'rsi_ob': 57, 'vol_spike': 0.19963669232152093, 'adx_thresh': 13.577091845447512, 'atr_min_pct': 0.00478618887454663, 'atr_max_pct': 0.06595660945991513, 'tp_mult': 2.6004138788181543, 'tsl_mult': 0.26170881399855306, 'strategy': 'breakout', 'time_stop': 232, 'use_sma': True, 'use_atr': True, 'use_adx': True, 'use_ema': True, 'use_spike': True, 'rsi_required': False, 'edge_k': 0.8010946875076815, 'edge_cap': 0.8054488852177568, 'bull_strategy': 'mean_reversion', 'bull_bb_std_mult': 3.2493637280715895, 'bull_rsi_os': 39, 'bull_rsi_ob': 51, 'bull_adx_thresh': 26.30553078966694, 'bull_atr_min_pct': 0.004896185182366465, 'bull_atr_max_pct': 0.04741776404588581, 'bull_tp_mult': 1.5080143994821087, 'bull_tsl_mult': 0.9334641606722375, 'bull_time_stop': 120, 'bull_use_sma': True, 'bull_use_ema': False, 'bull_use_atr': True, 'bull_use_adx': True, 'bull_use_spike': True, 'bull_rsi_required': True, 'bear_strategy': 'mean_reversion', 'bear_bb_std_mult': 1.4837309856811156, 'bear_rsi_os': 10, 'bear_rsi_ob': 72, 'bear_adx_thresh': 24.51437724866946, 'bear_atr_min_pct': 0.029913543164247238, 'bear_atr_max_pct': 0.09988861938313912, 'bear_tp_mult': 1.745970595387513, 'bear_tsl_mult': 0.8073100339381748, 'bear_time_stop': 17, 'bear_use_sma': False, 'bear_use_ema': True, 'bear_use_atr': True, 'bear_use_adx': True, 'bear_use_spike': True, 'bear_rsi_required': True, 'sideways_strategy': 'mean_reversion', 'sideways_bb_std_mult': 1.4872527273930072, 'sideways_rsi_os': 39, 'sideways_rsi_ob': 59, 'sideways_adx_thresh': 30.98314560989494, 'sideways_atr_min_pct': 0.01138307986655999, 'sideways_atr_max_pct': 0.08991859839937959, 'sideways_tp_mult': 1.3927209542118415, 'sideways_tsl_mult': 0.40883901527402144, 'sideways_time_stop': 186, 'sideways_use_sma': True, 'sideways_use_ema': False, 'sideways_use_atr': False, 'sideways_use_adx': False, 'sideways_use_spike': True, 'sideways_rsi_required': False}.
[I 2025-09-01 10:18:25,878] Trial 455 finished with values: [-1000000000.0, 1000000000.0] and parameters: {'p_sma': 59, 'p_std': 40, 'p_atr': 30, 'p_adx': 11, 'rsi_period': 24, 'ema1': 7, 'ema2': 14, 'slip_atr_k': 0.12370108634186525, 'slip_spread_k': 0.2767841057623681, 'spread_hl_frac': 0.005591373172733937, 'bb_std_mult': 2.7956004281540556, 'rsi_os': 9, 'rsi_ob': 57, 'vol_spike': 0.19778687029177583, 'adx_thresh': 13.572787555945137, 'atr_min_pct': 0.027306697439767318, 'atr_max_pct': 0.06864051929523983, 'tp_mult': 2.1057666346530324, 'tsl_mult': 0.8200656053185155, 'strategy': 'breakout', 'time_stop': 148, 'use_sma': True, 'use_atr': True, 'use_adx': False, 'use_ema': True, 'use_spike': True, 'rsi_required': False, 'edge_k': 0.6919226165414984, 'edge_cap': 0.3574632323009995, 'bull_strategy': 'mean_reversion', 'bull_bb_std_mult': 3.2512762218548397, 'bull_rsi_os': 25, 'bull_rsi_ob': 51, 'bull_adx_thresh': 22.111754377502155, 'bull_atr_min_pct': 0.014971334651859403, 'bull_atr_max_pct': 0.011029641830944223, 'bull_tp_mult': 2.301240543629901, 'bull_tsl_mult': 0.9964406932912135, 'bull_time_stop': 150, 'bull_use_sma': True, 'bull_use_ema': False, 'bull_use_atr': True, 'bull_use_adx': True, 'bull_use_spike': False, 'bull_rsi_required': False, 'bear_strategy': 'breakout', 'bear_bb_std_mult': 1.3715793840537691, 'bear_rsi_os': 44, 'bear_rsi_ob': 64, 'bear_adx_thresh': 25.400540683385643, 'bear_atr_min_pct': 0.020934001077545478, 'bear_atr_max_pct': 0.12103255932052195, 'bear_tp_mult': 2.742799693505492, 'bear_tsl_mult': 0.6804188243446263, 'bear_time_stop': 59, 'bear_use_sma': False, 'bear_use_ema': True, 'bear_use_atr': True, 'bear_use_adx': True, 'bear_use_spike': True, 'bear_rsi_required': False, 'sideways_strategy': 'mean_reversion', 'sideways_bb_std_mult': 2.5297604820396025, 'sideways_rsi_os': 52, 'sideways_rsi_ob': 48, 'sideways_adx_thresh': 13.236596055946004, 'sideways_atr_min_pct': 0.004837357611901167, 'sideways_atr_max_pct': 0.13242466921063423, 'sideways_tp_mult': 1.9256133165181877, 'sideways_tsl_mult': 0.9472178741625671, 'sideways_time_stop': 227, 'sideways_use_sma': True, 'sideways_use_ema': False, 'sideways_use_atr': False, 'sideways_use_adx': False, 'sideways_use_spike': True, 'sideways_rsi_required': False}.
[I 2025-09-01 10:18:26,430] Trial 457 finished with values: [-1000000000.0, 1000000000.0] and parameters: {'p_sma': 16, 'p_std': 45, 'p_atr': 28, 'p_adx': 15, 'rsi_period': 45, 'ema1': 9, 'ema2': 32, 'slip_atr_k': 0.01486992954756179, 'slip_spread_k': 0.5158246178079364, 'spread_hl_frac': 0.013020238916723282, 'bb_std_mult': 2.638660858276918, 'rsi_os': 21, 'rsi_ob': 47, 'vol_spike': 0.20905092889169802, 'adx_thresh': 11.89848635643803, 'atr_min_pct': 0.01589362231775633, 'atr_max_pct': 0.06401736547465814, 'tp_mult': 2.4888758559659636, 'tsl_mult': 0.7540096725734826, 'strategy': 'breakout', 'time_stop': 138, 'use_sma': True, 'use_atr': False, 'use_adx': False, 'use_ema': True, 'use_spike': True, 'rsi_required': True, 'edge_k': 0.7883418885589814, 'edge_cap': 0.8336491499249804, 'bull_strategy': 'mean_reversion', 'bull_bb_std_mult': 0.6418101230490154, 'bull_rsi_os': 39, 'bull_rsi_ob': 59, 'bull_adx_thresh': 30.131327538858702, 'bull_atr_min_pct': 0.004872909751717162, 'bull_atr_max_pct': 0.07438293767637195, 'bull_tp_mult': 2.294010954456958, 'bull_tsl_mult': 0.8776501640401856, 'bull_time_stop': 199, 'bull_use_sma': True, 'bull_use_ema': False, 'bull_use_atr': False, 'bull_use_adx': True, 'bull_use_spike': False, 'bull_rsi_required': False, 'bear_strategy': 'breakout', 'bear_bb_std_mult': 1.3475118681554938, 'bear_rsi_os': 52, 'bear_rsi_ob': 84, 'bear_adx_thresh': 33.381102782038674, 'bear_atr_min_pct': 0.02813384907445727, 'bear_atr_max_pct': 0.1462256260622241, 'bear_tp_mult': 1.7591875464741142, 'bear_tsl_mult': 0.7787765219569392, 'bear_time_stop': 19, 'bear_use_sma': False, 'bear_use_ema': True, 'bear_use_atr': True, 'bear_use_adx': True, 'bear_use_spike': True, 'bear_rsi_required': False, 'sideways_strategy': 'mean_reversion', 'sideways_bb_std_mult': 3.5979880198356033, 'sideways_rsi_os': 41, 'sideways_rsi_ob': 47, 'sideways_adx_thresh': 5.004255707476112, 'sideways_atr_min_pct': 0.022279750083986534, 'sideways_atr_max_pct': 0.08593865514575999, 'sideways_tp_mult': 1.8655522327731253, 'sideways_tsl_mult': 0.08135233501651712, 'sideways_time_stop': 211, 'sideways_use_sma': True, 'sideways_use_ema': False, 'sideways_use_atr': True, 'sideways_use_adx': False, 'sideways_use_spike': True, 'sideways_rsi_required': True}.
[I 2025-09-01 10:18:26,777] Trial 456 finished with values: [-1000000000.0, 1000000000.0] and parameters: {'p_sma': 5, 'p_std': 45, 'p_atr': 28, 'p_adx': 26, 'rsi_period': 25, 'ema1': 20, 'ema2': 11, 'slip_atr_k': 0.01587531319228652, 'slip_spread_k': 0.5502649469577393, 'spread_hl_frac': 0.0054063204238311326, 'bb_std_mult': 3.022006443807779, 'rsi_os': 15, 'rsi_ob': 57, 'vol_spike': 0.20876408219767728, 'adx_thresh': 13.628789734068448, 'atr_min_pct': 0.01596908682190131, 'atr_max_pct': 0.06834586160377243, 'tp_mult': 2.4870689369681402, 'tsl_mult': 0.7576016710870508, 'strategy': 'breakout', 'time_stop': 136, 'use_sma': True, 'use_atr': False, 'use_adx': False, 'use_ema': True, 'use_spike': True, 'rsi_required': True, 'edge_k': 0.7133555787430498, 'edge_cap': 0.8298984795769683, 'bull_strategy': 'mean_reversion', 'bull_bb_std_mult': 3.5341782250968823, 'bull_rsi_os': 11, 'bull_rsi_ob': 82, 'bull_adx_thresh': 26.462461381260994, 'bull_atr_min_pct': 0.004461636764830731, 'bull_atr_max_pct': 0.07460915570084928, 'bull_tp_mult': 2.298534598447935, 'bull_tsl_mult': 0.8806977032057701, 'bull_time_stop': 141, 'bull_use_sma': True, 'bull_use_ema': False, 'bull_use_atr': False, 'bull_use_adx': False, 'bull_use_spike': False, 'bull_rsi_required': False, 'bear_strategy': 'breakout', 'bear_bb_std_mult': 1.365425485333576, 'bear_rsi_os': 10, 'bear_rsi_ob': 72, 'bear_adx_thresh': 25.393274752975614, 'bear_atr_min_pct': 0.028973972715694903, 'bear_atr_max_pct': 0.034263231291464503, 'bear_tp_mult': 2.7278094692559294, 'bear_tsl_mult': 0.8025457763904913, 'bear_time_stop': 60, 'bear_use_sma': False, 'bear_use_ema': True, 'bear_use_atr': True, 'bear_use_adx': True, 'bear_use_spike': True, 'bear_rsi_required': False, 'sideways_strategy': 'mean_reversion', 'sideways_bb_std_mult': 2.51182858959418, 'sideways_rsi_os': 50, 'sideways_rsi_ob': 48, 'sideways_adx_thresh': 30.856928386152656, 'sideways_atr_min_pct': 0.004824301600396612, 'sideways_atr_max_pct': 0.086328416294723, 'sideways_tp_mult': 2.2382057246341494, 'sideways_tsl_mult': 0.13750720537120492, 'sideways_time_stop': 63, 'sideways_use_sma': False, 'sideways_use_ema': False, 'sideways_use_atr': True, 'sideways_use_adx': False, 'sideways_use_spike': True, 'sideways_rsi_required': True}.
[I 2025-09-01 10:19:08,395] Trial 461 finished with values: [-1000000000.0, 1000000000.0] and parameters: {'p_sma': 57, 'p_std': 43, 'p_atr': 29, 'p_adx': 10, 'rsi_period': 44, 'ema1': 21, 'ema2': 34, 'slip_atr_k': 0.021784355485120144, 'slip_spread_k': 0.6551548589685685, 'spread_hl_frac': 0.006658965743102341, 'bb_std_mult': 2.3969242230352577, 'rsi_os': 7, 'rsi_ob': 55, 'vol_spike': 0.1608231001567518, 'adx_thresh': 32.37022654074883, 'atr_min_pct': 0.017716087110435444, 'atr_max_pct': 0.0751924020170863, 'tp_mult': 2.5558138951814433, 'tsl_mult': 0.8836000712653793, 'strategy': 'breakout', 'time_stop': 11, 'use_sma': False, 'use_atr': True, 'use_adx': False, 'use_ema': False, 'use_spike': True, 'rsi_required': False, 'edge_k': 0.5868183520284095, 'edge_cap': 0.8917097064134033, 'bull_strategy': 'mean_reversion', 'bull_bb_std_mult': 1.3800383434914971, 'bull_rsi_os': 37, 'bull_rsi_ob': 79, 'bull_adx_thresh': 27.222936820242403, 'bull_atr_min_pct': 0.005742006758665609, 'bull_atr_max_pct': 0.08271493916706787, 'bull_tp_mult': 2.4901420864070754, 'bull_tsl_mult': 0.3994280899485475, 'bull_time_stop': 135, 'bull_use_sma': True, 'bull_use_ema': False, 'bull_use_atr': True, 'bull_use_adx': False, 'bull_use_spike': True, 'bull_rsi_required': False, 'bear_strategy': 'breakout', 'bear_bb_std_mult': 1.5337069608693237, 'bear_rsi_os': 20, 'bear_rsi_ob': 87, 'bear_adx_thresh': 8.748051648011717, 'bear_atr_min_pct': 0.0035356308328465293, 'bear_atr_max_pct': 0.02520850805253605, 'bear_tp_mult': 2.8843425470552573, 'bear_tsl_mult': 0.5285093189067007, 'bear_time_stop': 5, 'bear_use_sma': False, 'bear_use_ema': False, 'bear_use_atr': False, 'bear_use_adx': True, 'bear_use_spike': False, 'bear_rsi_required': False, 'sideways_strategy': 'mean_reversion', 'sideways_bb_std_mult': 2.6267481898456926, 'sideways_rsi_os': 34, 'sideways_rsi_ob': 61, 'sideways_adx_thresh': 22.206677652330622, 'sideways_atr_min_pct': 0.027425720672771596, 'sideways_atr_max_pct': 0.0787108206581074, 'sideways_tp_mult': 1.2716061830059169, 'sideways_tsl_mult': 0.8928040407070079, 'sideways_time_stop': 77, 'sideways_use_sma': True, 'sideways_use_ema': False, 'sideways_use_atr': False, 'sideways_use_adx': True, 'sideways_use_spike': False, 'sideways_rsi_required': False}.
