[I 2025-09-01 10:10:00,156] Trial 405 finished with values: [-1000000000.0, 1000000000.0] and parameters: {'p_sma': 32, 'p_std': 26, 'p_atr': 22, 'p_adx': 27, 'rsi_period': 55, 'ema1': 5, 'ema2': 14, 'slip_atr_k': 0.023572317439498537, 'slip_spread_k': 0.1790254016710296, 'spread_hl_frac': 0.006837252275120935, 'bb_std_mult': 3.394683031808098, 'rsi_os': 9, 'rsi_ob': 60, 'vol_spike': 0.18290449884847235, 'adx_thresh': 16.18627348261101, 'atr_min_pct': 0.017461085979228245, 'atr_max_pct': 0.054523444362165864, 'tp_mult': 2.8652438746997824, 'tsl_mult': 0.8677998232505554, 'strategy': 'mean_reversion', 'time_stop': 265, 'use_sma': False, 'use_atr': False, 'use_adx': False, 'use_ema': True, 'use_spike': False, 'rsi_required': True, 'edge_k': 0.6297517016375648, 'edge_cap': 0.8494274274378708, 'bull_strategy': 'breakout', 'bull_bb_std_mult': 3.3289883310213364, 'bull_rsi_os': 17, 'bull_rsi_ob': 74, 'bull_adx_thresh': 14.810963813443447, 'bull_atr_min_pct': 0.021757543957359068, 'bull_atr_max_pct': 0.013976765120595716, 'bull_tp_mult': 2.599083858493226, 'bull_tsl_mult': 0.06506802753147573, 'bull_time_stop': 165, 'bull_use_sma': True, 'bull_use_ema': False, 'bull_use_atr': False, 'bull_use_adx': True, 'bull_use_spike': False, 'bull_rsi_required': False, 'bear_strategy': 'breakout', 'bear_bb_std_mult': 1.3925915126141946, 'bear_rsi_os': 43, 'bear_rsi_ob': 68, 'bear_adx_thresh': 33.86184913748311, 'bear_atr_min_pct': 0.009862199507560947, 'bear_atr_max_pct': 0.13588599091176806, 'bear_tp_mult': 2.927817573552238, 'bear_tsl_mult': 0.8385876767082521, 'bear_time_stop': 290, 'bear_use_sma': True, 'bear_use_ema': False, 'bear_use_atr': False, 'bear_use_adx': False, 'bear_use_spike': False, 'bear_rsi_required': True, 'sideways_strategy': 'breakout', 'sideways_bb_std_mult': 2.010007944766014, 'sideways_rsi_os': 35, 'sideways_rsi_ob': 73, 'sideways_adx_thresh': 31.80441940659057, 'sideways_atr_min_pct': 0.002761444323469196, 'sideways_atr_max_pct': 0.08859378958209178, 'sideways_tp_mult': 1.7937694502567276, 'sideways_tsl_mult': 0.6803723595214292, 'sideways_time_stop': 262, 'sideways_use_sma': False, 'sideways_use_ema': True, 'sideways_use_atr': False, 'sideways_use_adx': False, 'sideways_use_spike': False, 'sideways_rsi_required': True}.
[I 2025-09-01 10:10:00,754] Trial 403 finished with values: [-1000000000.0, 1000000000.0] and parameters: {'p_sma': 14, 'p_std': 8, 'p_atr': 22, 'p_adx': 12, 'rsi_period': 45, 'ema1': 30, 'ema2': 55, 'slip_atr_k': 0.008452088750543343, 'slip_spread_k': 0.6295463583263453, 'spread_hl_frac': 0.011909445548919219, 'bb_std_mult': 2.6608927165993768, 'rsi_os': 12, 'rsi_ob': 81, 'vol_spike': 0.19026597508999601, 'adx_thresh': 13.352157443015765, 'atr_min_pct': 0.006880479565200711, 'atr_max_pct': 0.0664770586579226, 'tp_mult': 2.55179556201695, 'tsl_mult': 0.8336201195062971, 'strategy': 'breakout', 'time_stop': 247, 'use_sma': False, 'use_atr': False, 'use_adx': False, 'use_ema': False, 'use_spike': True, 'rsi_required': True, 'edge_k': 0.9561159243723218, 'edge_cap': 0.7319587692264515, 'bull_strategy': 'mean_reversion', 'bull_bb_std_mult': 0.7624983099219709, 'bull_rsi_os': 40, 'bull_rsi_ob': 80, 'bull_adx_thresh': 24.353837641020522, 'bull_atr_min_pct': 0.012889360153614533, 'bull_atr_max_pct': 0.041368588347650725, 'bull_tp_mult': 2.5573934317424913, 'bull_tsl_mult': 0.9846807508277159, 'bull_time_stop': 164, 'bull_use_sma': True, 'bull_use_ema': False, 'bull_use_atr': False, 'bull_use_adx': True, 'bull_use_spike': False, 'bull_rsi_required': False, 'bear_strategy': 'breakout', 'bear_bb_std_mult': 1.4424158120784947, 'bear_rsi_os': 43, 'bear_rsi_ob': 83, 'bear_adx_thresh': 33.894969083714585, 'bear_atr_min_pct': 0.01906368078988524, 'bear_atr_max_pct': 0.13148768886202641, 'bear_tp_mult': 2.905107708036186, 'bear_tsl_mult': 0.8440388969269317, 'bear_time_stop': 36, 'bear_use_sma': False, 'bear_use_ema': False, 'bear_use_atr': True, 'bear_use_adx': False, 'bear_use_spike': True, 'bear_rsi_required': True, 'sideways_strategy': 'mean_reversion', 'sideways_bb_std_mult': 1.6488801927992573, 'sideways_rsi_os': 31, 'sideways_rsi_ob': 46, 'sideways_adx_thresh': 10.49901660020324, 'sideways_atr_min_pct': 0.006485438265586337, 'sideways_atr_max_pct': 0.0881958054363584, 'sideways_tp_mult': 1.1765322262561084, 'sideways_tsl_mult': 0.5197291125198481, 'sideways_time_stop': 42, 'sideways_use_sma': False, 'sideways_use_ema': True, 'sideways_use_atr': False, 'sideways_use_adx': False, 'sideways_use_spike': True, 'sideways_rsi_required': True}.
[I 2025-09-01 10:10:41,043] Trial 410 finished with values: [-1000000000.0, 1000000000.0] and parameters: {'p_sma': 56, 'p_std': 43, 'p_atr': 28, 'p_adx': 10, 'rsi_period': 47, 'ema1': 7, 'ema2': 58, 'slip_atr_k': 0.24340114101801755, 'slip_spread_k': 0.5931660866409221, 'spread_hl_frac': 0.004668728429102488, 'bb_std_mult': 1.820445705320838, 'rsi_os': 10, 'rsi_ob': 68, 'vol_spike': 0.16837094292703306, 'adx_thresh': 11.943166047589587, 'atr_min_pct': 0.018494594783108227, 'atr_max_pct': 0.07016650736392586, 'tp_mult': 2.4521982152335497, 'tsl_mult': 0.7766009229612234, 'strategy': 'breakout', 'time_stop': 21, 'use_sma': True, 'use_atr': True, 'use_adx': False, 'use_ema': False, 'use_spike': True, 'rsi_required': False, 'edge_k': 1.2075389192239876, 'edge_cap': 0.9133630476999284, 'bull_strategy': 'mean_reversion', 'bull_bb_std_mult': 1.4498263466639063, 'bull_rsi_os': 50, 'bull_rsi_ob': 79, 'bull_adx_thresh': 34.33412081420791, 'bull_atr_min_pct': 0.015728709179629957, 'bull_atr_max_pct': 0.06582155895908767, 'bull_tp_mult': 2.803596749467001, 'bull_tsl_mult': 0.9512426938346361, 'bull_time_stop': 219, 'bull_use_sma': True, 'bull_use_ema': True, 'bull_use_atr': True, 'bull_use_adx': False, 'bull_use_spike': True, 'bull_rsi_required': False, 'bear_strategy': 'breakout', 'bear_bb_std_mult': 3.5992659150218476, 'bear_rsi_os': 47, 'bear_rsi_ob': 90, 'bear_adx_thresh': 31.432838847622584, 'bear_atr_min_pct': 0.027337942180673678, 'bear_atr_max_pct': 0.12871127364965768, 'bear_tp_mult': 2.751075830546277, 'bear_tsl_mult': 0.3938184915334379, 'bear_time_stop': 14, 'bear_use_sma': False, 'bear_use_ema': True, 'bear_use_atr': True, 'bear_use_adx': True, 'bear_use_spike': True, 'bear_rsi_required': False, 'sideways_strategy': 'mean_reversion', 'sideways_bb_std_mult': 1.1851397665474488, 'sideways_rsi_os': 38, 'sideways_rsi_ob': 60, 'sideways_adx_thresh': 32.67586139643649, 'sideways_atr_min_pct': 0.009762281663365591, 'sideways_atr_max_pct': 0.09169019189860318, 'sideways_tp_mult': 1.2777879144552597, 'sideways_tsl_mult': 0.8555327404778602, 'sideways_time_stop': 226, 'sideways_use_sma': True, 'sideways_use_ema': False, 'sideways_use_atr': True, 'sideways_use_adx': True, 'sideways_use_spike': True, 'sideways_rsi_required': False}.
[I 2025-09-01 10:10:41,854] Trial 407 finished with values: [-1000000000.0, 1000000000.0] and parameters: {'p_sma': 14, 'p_std': 12, 'p_atr': 28, 'p_adx': 10, 'rsi_period': 43, 'ema1': 10, 'ema2': 36, 'slip_atr_k': 0.03694319373649427, 'slip_spread_k': 0.6004608681666854, 'spread_hl_frac': 0.014913552484186882, 'bb_std_mult': 2.621575451363046, 'rsi_os': 28, 'rsi_ob': 60, 'vol_spike': 0.1925085511426516, 'adx_thresh': 11.969985131324348, 'atr_min_pct': 0.0068488490942629696, 'atr_max_pct': 0.06907608448511876, 'tp_mult': 2.460213781719143, 'tsl_mult': 0.6305900501721411, 'strategy': 'mean_reversion', 'time_stop': 21, 'use_sma': False, 'use_atr': True, 'use_adx': False, 'use_ema': True, 'use_spike': True, 'rsi_required': False, 'edge_k': 0.8199312571611568, 'edge_cap': 0.6700844189866393, 'bull_strategy': 'mean_reversion', 'bull_bb_std_mult': 1.3157055581826316, 'bull_rsi_os': 40, 'bull_rsi_ob': 81, 'bull_adx_thresh': 14.8463366421794, 'bull_atr_min_pct': 0.019714054507954534, 'bull_atr_max_pct': 0.07861202480640016, 'bull_tp_mult': 1.54803979274353, 'bull_tsl_mult': 0.9440941158899749, 'bull_time_stop': 184, 'bull_use_sma': True, 'bull_use_ema': False, 'bull_use_atr': True, 'bull_use_adx': False, 'bull_use_spike': False, 'bull_rsi_required': False, 'bear_strategy': 'breakout', 'bear_bb_std_mult': 1.2548174473893758, 'bear_rsi_os': 46, 'bear_rsi_ob': 74, 'bear_adx_thresh': 33.17831295278699, 'bear_atr_min_pct': 0.02753119533437049, 'bear_atr_max_pct': 0.13129382497138153, 'bear_tp_mult': 2.7430335661056415, 'bear_tsl_mult': 0.17988553525792128, 'bear_time_stop': 70, 'bear_use_sma': True, 'bear_use_ema': True, 'bear_use_atr': True, 'bear_use_adx': False, 'bear_use_spike': False, 'bear_rsi_required': False, 'sideways_strategy': 'mean_reversion', 'sideways_bb_std_mult': 2.5378848733966217, 'sideways_rsi_os': 30, 'sideways_rsi_ob': 89, 'sideways_adx_thresh': 22.526974412319326, 'sideways_atr_min_pct': 0.0041781657668417075, 'sideways_atr_max_pct': 0.09106712294225905, 'sideways_tp_mult': 1.809881414237657, 'sideways_tsl_mult': 0.8558438460845099, 'sideways_time_stop': 45, 'sideways_use_sma': False, 'sideways_use_ema': True, 'sideways_use_atr': False, 'sideways_use_adx': True, 'sideways_use_spike': False, 'sideways_rsi_required': False}.
[I 2025-09-01 10:10:42,215] Trial 408 finished with values: [-1000000000.0, 1000000000.0] and parameters: {'p_sma': 59, 'p_std': 46, 'p_atr': 28, 'p_adx': 10, 'rsi_period': 9, 'ema1': 30, 'ema2': 15, 'slip_atr_k': 0.013847765028791481, 'slip_spread_k': 0.17852042433966553, 'spread_hl_frac': 0.012044343350918703, 'bb_std_mult': 2.5837870043547917, 'rsi_os': 12, 'rsi_ob': 58, 'vol_spike': 0.19111820986456074, 'adx_thresh': 23.017989206185057, 'atr_min_pct': 0.015368295494759609, 'atr_max_pct': 0.07067185255370509, 'tp_mult': 1.5764777215142733, 'tsl_mult': 0.860724925665562, 'strategy': 'mean_reversion', 'time_stop': 142, 'use_sma': False, 'use_atr': True, 'use_adx': False, 'use_ema': True, 'use_spike': True, 'rsi_required': False, 'edge_k': 0.7308054221238478, 'edge_cap': 0.6764084245192227, 'bull_strategy': 'mean_reversion', 'bull_bb_std_mult': 3.466098971437343, 'bull_rsi_os': 48, 'bull_rsi_ob': 79, 'bull_adx_thresh': 27.40450274164837, 'bull_atr_min_pct': 0.004023001589927173, 'bull_atr_max_pct': 0.07728277274732631, 'bull_tp_mult': 1.5391052181993683, 'bull_tsl_mult': 0.9494606410610431, 'bull_time_stop': 263, 'bull_use_sma': True, 'bull_use_ema': False, 'bull_use_atr': True, 'bull_use_adx': False, 'bull_use_spike': False, 'bull_rsi_required': False, 'bear_strategy': 'breakout', 'bear_bb_std_mult': 3.1903153924685883, 'bear_rsi_os': 43, 'bear_rsi_ob': 74, 'bear_adx_thresh': 31.1134417825901, 'bear_atr_min_pct': 0.018767868978278247, 'bear_atr_max_pct': 0.12968904778485038, 'bear_tp_mult': 2.215254321620105, 'bear_tsl_mult': 0.3943496461030589, 'bear_time_stop': 295, 'bear_use_sma': True, 'bear_use_ema': True, 'bear_use_atr': True, 'bear_use_adx': False, 'bear_use_spike': False, 'bear_rsi_required': False, 'sideways_strategy': 'mean_reversion', 'sideways_bb_std_mult': 2.528837811440401, 'sideways_rsi_os': 30, 'sideways_rsi_ob': 73, 'sideways_adx_thresh': 34.96820807294208, 'sideways_atr_min_pct': 0.009763882768196917, 'sideways_atr_max_pct': 0.0912285155029011, 'sideways_tp_mult': 1.3797121676730293, 'sideways_tsl_mult': 0.6867533157843302, 'sideways_time_stop': 300, 'sideways_use_sma': False, 'sideways_use_ema': True, 'sideways_use_atr': False, 'sideways_use_adx': True, 'sideways_use_spike': False, 'sideways_rsi_required': False}.
[I 2025-09-01 10:10:42,215] Trial 409 finished with values: [-1000000000.0, 1000000000.0] and parameters: {'p_sma': 59, 'p_std': 46, 'p_atr': 28, 'p_adx': 7, 'rsi_period': 29, 'ema1': 10, 'ema2': 11, 'slip_atr_k': 0.036399391307030085, 'slip_spread_k': 0.5502341727911415, 'spread_hl_frac': 0.011770031497423023, 'bb_std_mult': 1.731228554770481, 'rsi_os': 12, 'rsi_ob': 59, 'vol_spike': 0.1935599174580018, 'adx_thresh': 22.217132829295718, 'atr_min_pct': 0.015347508764230506, 'atr_max_pct': 0.06970002149156967, 'tp_mult': 2.6273215153160674, 'tsl_mult': 0.8333910544357322, 'strategy': 'breakout', 'time_stop': 142, 'use_sma': True, 'use_atr': True, 'use_adx': False, 'use_ema': False, 'use_spike': True, 'rsi_required': False, 'edge_k': 0.5849945121095779, 'edge_cap': 0.17090501020658594, 'bull_strategy': 'mean_reversion', 'bull_bb_std_mult': 0.7459679802115278, 'bull_rsi_os': 40, 'bull_rsi_ob': 82, 'bull_adx_thresh': 9.600041754664705, 'bull_atr_min_pct': 0.004141500490861277, 'bull_atr_max_pct': 0.07814922831737693, 'bull_tp_mult': 2.2332940080878085, 'bull_tsl_mult': 0.9524588363482399, 'bull_time_stop': 143, 'bull_use_sma': True, 'bull_use_ema': True, 'bull_use_atr': True, 'bull_use_adx': False, 'bull_use_spike': True, 'bull_rsi_required': False, 'bear_strategy': 'breakout', 'bear_bb_std_mult': 1.450477995108818, 'bear_rsi_os': 47, 'bear_rsi_ob': 74, 'bear_adx_thresh': 33.01419671061232, 'bear_atr_min_pct': 0.019527952381367796, 'bear_atr_max_pct': 0.14415091119206008, 'bear_tp_mult': 2.1997243133997744, 'bear_tsl_mult': 0.7557675278657103, 'bear_time_stop': 14, 'bear_use_sma': False, 'bear_use_ema': True, 'bear_use_atr': True, 'bear_use_adx': True, 'bear_use_spike': True, 'bear_rsi_required': False, 'sideways_strategy': 'mean_reversion', 'sideways_bb_std_mult': 2.5382517754704113, 'sideways_rsi_os': 5, 'sideways_rsi_ob': 61, 'sideways_adx_thresh': 33.51079635180454, 'sideways_atr_min_pct': 0.0020244389546954936, 'sideways_atr_max_pct': 0.09187521482310682, 'sideways_tp_mult': 1.4031194834138603, 'sideways_tsl_mult': 0.25242746430359925, 'sideways_time_stop': 46, 'sideways_use_sma': True, 'sideways_use_ema': False, 'sideways_use_atr': False, 'sideways_use_adx': True, 'sideways_use_spike': True, 'sideways_rsi_required': False}.
[I 2025-09-01 10:11:25,040] Trial 412 finished with values: [-0.028233573629449893, 0.028461422881352467] and parameters: {'p_sma': 60, 'p_std': 50, 'p_atr': 8, 'p_adx': 30, 'rsi_period': 49, 'ema1': 14, 'ema2': 10, 'slip_atr_k': 0.21764452323786906, 'slip_spread_k': 0.5555068421804041, 'spread_hl_frac': 0.005266396437072064, 'bb_std_mult': 0.9585407090288351, 'rsi_os': 8, 'rsi_ob': 56, 'vol_spike': 0.2588749007858458, 'adx_thresh': 10.579562628891118, 'atr_min_pct': 0.019801627879010648, 'atr_max_pct': 0.062485063079677695, 'tp_mult': 2.5053244488647697, 'tsl_mult': 0.9027932195644017, 'strategy': 'breakout', 'time_stop': 151, 'use_sma': True, 'use_atr': True, 'use_adx': True, 'use_ema': False, 'use_spike': False, 'rsi_required': False, 'edge_k': 0.6698037632451534, 'edge_cap': 0.8284405996481671, 'bull_strategy': 'breakout', 'bull_bb_std_mult': 3.4138805807194212, 'bull_rsi_os': 38, 'bull_rsi_ob': 84, 'bull_adx_thresh': 5.810572363555252, 'bull_atr_min_pct': 0.00596769675095566, 'bull_atr_max_pct': 0.05263838238634972, 'bull_tp_mult': 1.2507970686511776, 'bull_tsl_mult': 0.8954973728091794, 'bull_time_stop': 139, 'bull_use_sma': True, 'bull_use_ema': False, 'bull_use_atr': True, 'bull_use_adx': False, 'bull_use_spike': True, 'bull_rsi_required': True, 'bear_strategy': 'breakout', 'bear_bb_std_mult': 1.5652901277508557, 'bear_rsi_os': 44, 'bear_rsi_ob': 78, 'bear_adx_thresh': 34.51037634472675, 'bear_atr_min_pct': 0.028424887624184728, 'bear_atr_max_pct': 0.05353167913148917, 'bear_tp_mult': 2.868049418731855, 'bear_tsl_mult': 0.2751119447824825, 'bear_time_stop': 150, 'bear_use_sma': False, 'bear_use_ema': True, 'bear_use_atr': False, 'bear_use_adx': True, 'bear_use_spike': True, 'bear_rsi_required': False, 'sideways_strategy': 'breakout', 'sideways_bb_std_mult': 1.3693280001976746, 'sideways_rsi_os': 33, 'sideways_rsi_ob': 58, 'sideways_adx_thresh': 30.17687885857865, 'sideways_atr_min_pct': 0.0026471537971179673, 'sideways_atr_max_pct': 0.08519075130229876, 'sideways_tp_mult': 1.481870746899479, 'sideways_tsl_mult': 0.9596393554748897, 'sideways_time_stop': 219, 'sideways_use_sma': True, 'sideways_use_ema': False, 'sideways_use_atr': True, 'sideways_use_adx': False, 'sideways_use_spike': True, 'sideways_rsi_required': False}.
[I 2025-09-01 10:11:25,055] Trial 413 finished with values: [-1000000000.0, 1000000000.0] and parameters: {'p_sma': 60, 'p_std': 40, 'p_atr': 28, 'p_adx': 11, 'rsi_period': 72, 'ema1': 14, 'ema2': 10, 'slip_atr_k': 0.0006117165726370784, 'slip_spread_k': 0.5650286064939328, 'spread_hl_frac': 0.005536212595574796, 'bb_std_mult': 0.9792151189984157, 'rsi_os': 8, 'rsi_ob': 56, 'vol_spike': 0.02698022016948476, 'adx_thresh': 19.342076963201997, 'atr_min_pct': 0.029324614406980476, 'atr_max_pct': 0.0635323285615136, 'tp_mult': 1.777923658131753, 'tsl_mult': 0.2021174288350317, 'strategy': 'breakout', 'time_stop': 152, 'use_sma': True, 'use_atr': True, 'use_adx': True, 'use_ema': False, 'use_spike': False, 'rsi_required': False, 'edge_k': 0.6726617700394945, 'edge_cap': 0.862455070940891, 'bull_strategy': 'breakout', 'bull_bb_std_mult': 3.415158621904221, 'bull_rsi_os': 19, 'bull_rsi_ob': 84, 'bull_adx_thresh': 21.336096743134007, 'bull_atr_min_pct': 0.006204843195027441, 'bull_atr_max_pct': 0.08240659061881195, 'bull_tp_mult': 1.5766642642216588, 'bull_tsl_mult': 0.46952342528116314, 'bull_time_stop': 115, 'bull_use_sma': True, 'bull_use_ema': False, 'bull_use_atr': True, 'bull_use_adx': False, 'bull_use_spike': True, 'bull_rsi_required': True, 'bear_strategy': 'breakout', 'bear_bb_std_mult': 1.5649891571596015, 'bear_rsi_os': 33, 'bear_rsi_ob': 70, 'bear_adx_thresh': 34.48980095645593, 'bear_atr_min_pct': 0.02597779403290747, 'bear_atr_max_pct': 0.10226866452864783, 'bear_tp_mult': 2.8588520423962764, 'bear_tsl_mult': 0.810366374959048, 'bear_time_stop': 93, 'bear_use_sma': False, 'bear_use_ema': True, 'bear_use_atr': False, 'bear_use_adx': True, 'bear_use_spike': True, 'bear_rsi_required': False, 'sideways_strategy': 'breakout', 'sideways_bb_std_mult': 2.8111089856006086, 'sideways_rsi_os': 34, 'sideways_rsi_ob': 91, 'sideways_adx_thresh': 30.827583508782528, 'sideways_atr_min_pct': 0.027995631179846065, 'sideways_atr_max_pct': 0.08430172866737716, 'sideways_tp_mult': 2.925389746475412, 'sideways_tsl_mult': 0.9661796934938504, 'sideways_time_stop': 57, 'sideways_use_sma': True, 'sideways_use_ema': False, 'sideways_use_atr': True, 'sideways_use_adx': False, 'sideways_use_spike': True, 'sideways_rsi_required': False}.
[I 2025-09-01 10:11:25,839] Trial 411 finished with values: [-1000000000.0, 1000000000.0] and parameters: {'p_sma': 59, 'p_std': 46, 'p_atr': 28, 'p_adx': 28, 'rsi_period': 30, 'ema1': 14, 'ema2': 10, 'slip_atr_k': 0.01423139192122344, 'slip_spread_k': 0.3133902946336458, 'spread_hl_frac': 0.04778550618429989, 'bb_std_mult': 2.5695288142708264, 'rsi_os': 20, 'rsi_ob': 66, 'vol_spike': 0.1944476608892002, 'adx_thresh': 12.531694252596322, 'atr_min_pct': 0.019836294049686728, 'atr_max_pct': 0.06349030899794131, 'tp_mult': 2.609324478738063, 'tsl_mult': 0.8893891701619587, 'strategy': 'mean_reversion', 'time_stop': 152, 'use_sma': True, 'use_atr': True, 'use_adx': True, 'use_ema': False, 'use_spike': True, 'rsi_required': False, 'edge_k': 0.583075694532977, 'edge_cap': 0.8313657036779759, 'bull_strategy': 'mean_reversion', 'bull_bb_std_mult': 2.1855900863831272, 'bull_rsi_os': 53, 'bull_rsi_ob': 69, 'bull_adx_thresh': 21.53760716945356, 'bull_atr_min_pct': 0.019870578459420835, 'bull_atr_max_pct': 0.07796098337142465, 'bull_tp_mult': 1.5276583496152314, 'bull_tsl_mult': 0.9436545906879625, 'bull_time_stop': 145, 'bull_use_sma': True, 'bull_use_ema': False, 'bull_use_atr': True, 'bull_use_adx': False, 'bull_use_spike': True, 'bull_rsi_required': True, 'bear_strategy': 'breakout', 'bear_bb_std_mult': 1.560065589551606, 'bear_rsi_os': 45, 'bear_rsi_ob': 75, 'bear_adx_thresh': 10.372040560092007, 'bear_atr_min_pct': 0.028097917932262635, 'bear_atr_max_pct': 0.054112226268358515, 'bear_tp_mult': 1.4119278976253735, 'bear_tsl_mult': 0.751100051147273, 'bear_time_stop': 299, 'bear_use_sma': False, 'bear_use_ema': True, 'bear_use_atr': True, 'bear_use_adx': True, 'bear_use_spike': False, 'bear_rsi_required': False, 'sideways_strategy': 'mean_reversion', 'sideways_bb_std_mult': 2.50864560520564, 'sideways_rsi_os': 30, 'sideways_rsi_ob': 58, 'sideways_adx_thresh': 33.29807620226592, 'sideways_atr_min_pct': 0.004038404038839323, 'sideways_atr_max_pct': 0.08408828726657869, 'sideways_tp_mult': 1.3719316461317077, 'sideways_tsl_mult': 0.9594997924878221, 'sideways_time_stop': 218, 'sideways_use_sma': True, 'sideways_use_ema': False, 'sideways_use_atr': False, 'sideways_use_adx': True, 'sideways_use_spike': True, 'sideways_rsi_required': False}.
