[I 2025-09-01 10:23:34,239] Trial 487 finished with values: [-1000000000.0, 1000000000.0] and parameters: {'p_sma': 49, 'p_std': 45, 'p_atr': 27, 'p_adx': 14, 'rsi_period': 52, 'ema1': 8, 'ema2': 15, 'slip_atr_k': 0.00778590258282449, 'slip_spread_k': 0.6031064760442472, 'spread_hl_frac': 0.00945368333123733, 'bb_std_mult': 2.57755552314295, 'rsi_os': 13, 'rsi_ob': 45, 'vol_spike': 0.19644591712076886, 'adx_thresh': 6.648008597553677, 'atr_min_pct': 0.02004470531949001, 'atr_max_pct': 0.07119452953603322, 'tp_mult': 1.423084050328693, 'tsl_mult': 0.4006968593232281, 'strategy': 'mean_reversion', 'time_stop': 252, 'use_sma': True, 'use_atr': True, 'use_adx': False, 'use_ema': False, 'use_spike': False, 'rsi_required': False, 'edge_k': 0.46559795074898214, 'edge_cap': 0.8503305937637081, 'bull_strategy': 'mean_reversion', 'bull_bb_std_mult': 3.505147000868792, 'bull_rsi_os': 41, 'bull_rsi_ob': 88, 'bull_adx_thresh': 26.694651586729844, 'bull_atr_min_pct': 0.0032015015943862067, 'bull_atr_max_pct': 0.0358113806351539, 'bull_tp_mult': 1.6587402341862052, 'bull_tsl_mult': 0.15075288017336058, 'bull_time_stop': 114, 'bull_use_sma': True, 'bull_use_ema': False, 'bull_use_atr': True, 'bull_use_adx': False, 'bull_use_spike': True, 'bull_rsi_required': False, 'bear_strategy': 'breakout', 'bear_bb_std_mult': 1.5610835204379954, 'bear_rsi_os': 24, 'bear_rsi_ob': 60, 'bear_adx_thresh': 34.074097389816444, 'bear_atr_min_pct': 0.027725573896461644, 'bear_atr_max_pct': 0.1385509218057624, 'bear_tp_mult': 2.9263824503356086, 'bear_tsl_mult': 0.1681058799545534, 'bear_time_stop': 235, 'bear_use_sma': False, 'bear_use_ema': True, 'bear_use_atr': True, 'bear_use_adx': True, 'bear_use_spike': True, 'bear_rsi_required': False, 'sideways_strategy': 'mean_reversion', 'sideways_bb_std_mult': 3.398044417110321, 'sideways_rsi_os': 29, 'sideways_rsi_ob': 86, 'sideways_adx_thresh': 9.163917810228877, 'sideways_atr_min_pct': 0.004462737015795676, 'sideways_atr_max_pct': 0.08406543781676766, 'sideways_tp_mult': 2.3983288029267062, 'sideways_tsl_mult': 0.2100215743040053, 'sideways_time_stop': 256, 'sideways_use_sma': True, 'sideways_use_ema': False, 'sideways_use_atr': False, 'sideways_use_adx': False, 'sideways_use_spike': True, 'sideways_rsi_required': False}.
[I 2025-09-01 10:24:14,056] Trial 489 finished with values: [0.0014237715018772246, 0.0018009513801359827] and parameters: {'p_sma': 13, 'p_std': 45, 'p_atr': 27, 'p_adx': 10, 'rsi_period': 48, 'ema1': 8, 'ema2': 12, 'slip_atr_k': 0.01835777148222724, 'slip_spread_k': 0.6123985811496349, 'spread_hl_frac': 0.009943543005247892, 'bb_std_mult': 2.4827055614254188, 'rsi_os': 7, 'rsi_ob': 57, 'vol_spike': 0.17072839495946737, 'adx_thresh': 6.824746079618908, 'atr_min_pct': 0.017148301795120665, 'atr_max_pct': 0.06922716925966889, 'tp_mult': 2.4802062911496563, 'tsl_mult': 0.778844759464541, 'strategy': 'mean_reversion', 'time_stop': 150, 'use_sma': True, 'use_atr': True, 'use_adx': False, 'use_ema': False, 'use_spike': False, 'rsi_required': False, 'edge_k': 1.8082103280705586, 'edge_cap': 0.851876100770875, 'bull_strategy': 'mean_reversion', 'bull_bb_std_mult': 3.486855793112366, 'bull_rsi_os': 41, 'bull_rsi_ob': 88, 'bull_adx_thresh': 13.119375560417536, 'bull_atr_min_pct': 0.004977848916939845, 'bull_atr_max_pct': 0.03480216856323384, 'bull_tp_mult': 1.6716882906286306, 'bull_tsl_mult': 0.8500814042214926, 'bull_time_stop': 135, 'bull_use_sma': True, 'bull_use_ema': False, 'bull_use_atr': True, 'bull_use_adx': False, 'bull_use_spike': True, 'bull_rsi_required': False, 'bear_strategy': 'breakout', 'bear_bb_std_mult': 1.469522671926807, 'bear_rsi_os': 43, 'bear_rsi_ob': 71, 'bear_adx_thresh': 23.331922902061212, 'bear_atr_min_pct': 0.027816209476504945, 'bear_atr_max_pct': 0.13081630486309906, 'bear_tp_mult': 2.794712852892178, 'bear_tsl_mult': 0.611273541584639, 'bear_time_stop': 5, 'bear_use_sma': False, 'bear_use_ema': False, 'bear_use_atr': True, 'bear_use_adx': True, 'bear_use_spike': True, 'bear_rsi_required': False, 'sideways_strategy': 'mean_reversion', 'sideways_bb_std_mult': 2.0467743705352897, 'sideways_rsi_os': 31, 'sideways_rsi_ob': 59, 'sideways_adx_thresh': 32.202894433237944, 'sideways_atr_min_pct': 0.0016025420884142425, 'sideways_atr_max_pct': 0.08320239640281711, 'sideways_tp_mult': 2.324671641388301, 'sideways_tsl_mult': 0.9753520580866437, 'sideways_time_stop': 82, 'sideways_use_sma': True, 'sideways_use_ema': False, 'sideways_use_atr': False, 'sideways_use_adx': True, 'sideways_use_spike': True, 'sideways_rsi_required': False}.
[I 2025-09-01 10:24:15,065] Trial 488 finished with values: [-0.008570183827954159, 0.008967026264109376] and parameters: {'p_sma': 58, 'p_std': 45, 'p_atr': 27, 'p_adx': 10, 'rsi_period': 83, 'ema1': 8, 'ema2': 17, 'slip_atr_k': 0.017740885903868034, 'slip_spread_k': 0.6170027236561318, 'spread_hl_frac': 0.00893442829781524, 'bb_std_mult': 1.321220287546347, 'rsi_os': 32, 'rsi_ob': 58, 'vol_spike': 0.25462549770280063, 'adx_thresh': 10.883440557871895, 'atr_min_pct': 0.02007774577255796, 'atr_max_pct': 0.0699878718887872, 'tp_mult': 2.542320491528239, 'tsl_mult': 0.8975215506958694, 'strategy': 'mean_reversion', 'time_stop': 151, 'use_sma': True, 'use_atr': True, 'use_adx': False, 'use_ema': False, 'use_spike': False, 'rsi_required': False, 'edge_k': 0.21303408647715016, 'edge_cap': 0.8444751776550666, 'bull_strategy': 'mean_reversion', 'bull_bb_std_mult': 0.8222721251190632, 'bull_rsi_os': 38, 'bull_rsi_ob': 79, 'bull_adx_thresh': 26.70063857217023, 'bull_atr_min_pct': 0.003006712035755575, 'bull_atr_max_pct': 0.08290745138471044, 'bull_tp_mult': 1.8412478455138335, 'bull_tsl_mult': 0.8538954623986846, 'bull_time_stop': 133, 'bull_use_sma': True, 'bull_use_ema': False, 'bull_use_atr': True, 'bull_use_adx': False, 'bull_use_spike': True, 'bull_rsi_required': False, 'bear_strategy': 'breakout', 'bear_bb_std_mult': 1.279179804055547, 'bear_rsi_os': 15, 'bear_rsi_ob': 71, 'bear_adx_thresh': 34.07759956738972, 'bear_atr_min_pct': 0.012890133234489065, 'bear_atr_max_pct': 0.12786824857869766, 'bear_tp_mult': 2.6705537386514098, 'bear_tsl_mult': 0.8510129768433404, 'bear_time_stop': 66, 'bear_use_sma': False, 'bear_use_ema': False, 'bear_use_atr': True, 'bear_use_adx': True, 'bear_use_spike': True, 'bear_rsi_required': False, 'sideways_strategy': 'mean_reversion', 'sideways_bb_std_mult': 2.524955655602202, 'sideways_rsi_os': 53, 'sideways_rsi_ob': 88, 'sideways_adx_thresh': 17.63074698830965, 'sideways_atr_min_pct': 0.004336058418258882, 'sideways_atr_max_pct': 0.08401294828351943, 'sideways_tp_mult': 1.5173965521542905, 'sideways_tsl_mult': 0.9630607608030821, 'sideways_time_stop': 194, 'sideways_use_sma': True, 'sideways_use_ema': False, 'sideways_use_atr': False, 'sideways_use_adx': False, 'sideways_use_spike': True, 'sideways_rsi_required': False}.
[I 2025-09-01 10:24:15,549] Trial 486 finished with values: [-0.011578970158446111, 0.011614711508078945] and parameters: {'p_sma': 49, 'p_std': 22, 'p_atr': 27, 'p_adx': 10, 'rsi_period': 41, 'ema1': 8, 'ema2': 12, 'slip_atr_k': 0.006479522536864176, 'slip_spread_k': 0.6131830272528929, 'spread_hl_frac': 0.00932471869579395, 'bb_std_mult': 1.760417622988705, 'rsi_os': 19, 'rsi_ob': 95, 'vol_spike': 0.17020856394275893, 'adx_thresh': 10.855328490464618, 'atr_min_pct': 0.020031038411368936, 'atr_max_pct': 0.07187133907608283, 'tp_mult': 2.547062306942523, 'tsl_mult': 0.9008781362989258, 'strategy': 'mean_reversion', 'time_stop': 149, 'use_sma': True, 'use_atr': True, 'use_adx': False, 'use_ema': False, 'use_spike': False, 'rsi_required': False, 'edge_k': 1.4401732595044565, 'edge_cap': 0.8391389695221831, 'bull_strategy': 'mean_reversion', 'bull_bb_std_mult': 0.8228348185689569, 'bull_rsi_os': 41, 'bull_rsi_ob': 45, 'bull_adx_thresh': 29.770500982272175, 'bull_atr_min_pct': 0.003178395942168233, 'bull_atr_max_pct': 0.06397211086256521, 'bull_tp_mult': 1.0104795366970127, 'bull_tsl_mult': 0.34986281519035334, 'bull_time_stop': 179, 'bull_use_sma': True, 'bull_use_ema': False, 'bull_use_atr': True, 'bull_use_adx': False, 'bull_use_spike': True, 'bull_rsi_required': False, 'bear_strategy': 'breakout', 'bear_bb_std_mult': 1.5542998367591405, 'bear_rsi_os': 18, 'bear_rsi_ob': 60, 'bear_adx_thresh': 23.17307552832993, 'bear_atr_min_pct': 0.02912278222398447, 'bear_atr_max_pct': 0.1372677140156608, 'bear_tp_mult': 2.6534046508938265, 'bear_tsl_mult': 0.6024008765518839, 'bear_time_stop': 100, 'bear_use_sma': False, 'bear_use_ema': True, 'bear_use_atr': True, 'bear_use_adx': True, 'bear_use_spike': True, 'bear_rsi_required': False, 'sideways_strategy': 'mean_reversion', 'sideways_bb_std_mult': 2.2711386376907408, 'sideways_rsi_os': 30, 'sideways_rsi_ob': 86, 'sideways_adx_thresh': 8.932769633421007, 'sideways_atr_min_pct': 0.0018803461779982249, 'sideways_atr_max_pct': 0.03497170101318722, 'sideways_tp_mult': 1.5064575437014611, 'sideways_tsl_mult': 0.9769268507086517, 'sideways_time_stop': 285, 'sideways_use_sma': True, 'sideways_use_ema': False, 'sideways_use_atr': False, 'sideways_use_adx': False, 'sideways_use_spike': True, 'sideways_rsi_required': False}.
[I 2025-09-01 10:24:16,325] Trial 490 finished with values: [-1000000000.0, 1000000000.0] and parameters: {'p_sma': 7, 'p_std': 29, 'p_atr': 27, 'p_adx': 10, 'rsi_period': 42, 'ema1': 8, 'ema2': 12, 'slip_atr_k': 0.018698130990695633, 'slip_spread_k': 0.6181481516312038, 'spread_hl_frac': 0.008261245784251976, 'bb_std_mult': 2.4847972744798894, 'rsi_os': 7, 'rsi_ob': 58, 'vol_spike': 0.2543232808089615, 'adx_thresh': 10.950713197338569, 'atr_min_pct': 0.013415735915186454, 'atr_max_pct': 0.06712636655514351, 'tp_mult': 2.5365226377130234, 'tsl_mult': 0.4755038883141884, 'strategy': 'mean_reversion', 'time_stop': 222, 'use_sma': True, 'use_atr': True, 'use_adx': False, 'use_ema': False, 'use_spike': False, 'rsi_required': False, 'edge_k': 0.6318178068508482, 'edge_cap': 0.8220281795610083, 'bull_strategy': 'mean_reversion', 'bull_bb_std_mult': 3.4784272896083053, 'bull_rsi_os': 39, 'bull_rsi_ob': 64, 'bull_adx_thresh': 9.24842383690395, 'bull_atr_min_pct': 0.004949124871242407, 'bull_atr_max_pct': 0.04359143000487478, 'bull_tp_mult': 1.4659563001426028, 'bull_tsl_mult': 0.8527896081703709, 'bull_time_stop': 134, 'bull_use_sma': True, 'bull_use_ema': False, 'bull_use_atr': True, 'bull_use_adx': True, 'bull_use_spike': True, 'bull_rsi_required': False, 'bear_strategy': 'breakout', 'bear_bb_std_mult': 1.4751970716619045, 'bear_rsi_os': 53, 'bear_rsi_ob': 71, 'bear_adx_thresh': 32.53216692363842, 'bear_atr_min_pct': 0.02904364180371356, 'bear_atr_max_pct': 0.12865212628452993, 'bear_tp_mult': 2.7960084822228706, 'bear_tsl_mult': 0.8509424766270475, 'bear_time_stop': 187, 'bear_use_sma': False, 'bear_use_ema': False, 'bear_use_atr': True, 'bear_use_adx': True, 'bear_use_spike': False, 'bear_rsi_required': False, 'sideways_strategy': 'mean_reversion', 'sideways_bb_std_mult': 2.013229487145699, 'sideways_rsi_os': 13, 'sideways_rsi_ob': 59, 'sideways_adx_thresh': 31.99901107925644, 'sideways_atr_min_pct': 0.0018500546730615736, 'sideways_atr_max_pct': 0.09899065155164177, 'sideways_tp_mult': 1.5157203150863152, 'sideways_tsl_mult': 0.9686721213314947, 'sideways_time_stop': 96, 'sideways_use_sma': True, 'sideways_use_ema': False, 'sideways_use_atr': False, 'sideways_use_adx': True, 'sideways_use_spike': True, 'sideways_rsi_required': False}.
[I 2025-09-01 10:24:55,800] Trial 494 finished with values: [-1000000000.0, 1000000000.0] and parameters: {'p_sma': 12, 'p_std': 48, 'p_atr': 28, 'p_adx': 18, 'rsi_period': 48, 'ema1': 10, 'ema2': 14, 'slip_atr_k': 0.02247649773892082, 'slip_spread_k': 0.6411291486281413, 'spread_hl_frac': 0.010919792081796886, 'bb_std_mult': 2.524828673373168, 'rsi_os': 8, 'rsi_ob': 61, 'vol_spike': 0.17310270915775372, 'adx_thresh': 30.079446270806166, 'atr_min_pct': 0.017689973172152085, 'atr_max_pct': 0.08585290718440551, 'tp_mult': 2.4647525520117823, 'tsl_mult': 0.7768846511118931, 'strategy': 'mean_reversion', 'time_stop': 196, 'use_sma': True, 'use_atr': True, 'use_adx': False, 'use_ema': False, 'use_spike': False, 'rsi_required': False, 'edge_k': 1.7306049151437881, 'edge_cap': 0.8628213190511885, 'bull_strategy': 'mean_reversion', 'bull_bb_std_mult': 3.462686450559836, 'bull_rsi_os': 54, 'bull_rsi_ob': 81, 'bull_adx_thresh': 13.387610732790634, 'bull_atr_min_pct': 0.0051072653177680885, 'bull_atr_max_pct': 0.03450025700793726, 'bull_tp_mult': 1.6685445375118322, 'bull_tsl_mult': 0.8965014922086703, 'bull_time_stop': 124, 'bull_use_sma': True, 'bull_use_ema': False, 'bull_use_atr': True, 'bull_use_adx': False, 'bull_use_spike': True, 'bull_rsi_required': False, 'bear_strategy': 'breakout', 'bear_bb_std_mult': 1.663505007233828, 'bear_rsi_os': 42, 'bear_rsi_ob': 91, 'bear_adx_thresh': 20.444862283274556, 'bear_atr_min_pct': 0.026028031066336926, 'bear_atr_max_pct': 0.13176824874997928, 'bear_tp_mult': 2.7914295916603775, 'bear_tsl_mult': 0.49585928871834617, 'bear_time_stop': 5, 'bear_use_sma': False, 'bear_use_ema': False, 'bear_use_atr': True, 'bear_use_adx': True, 'bear_use_spike': True, 'bear_rsi_required': False, 'sideways_strategy': 'mean_reversion', 'sideways_bb_std_mult': 2.5422424790759486, 'sideways_rsi_os': 31, 'sideways_rsi_ob': 57, 'sideways_adx_thresh': 33.34916710989529, 'sideways_atr_min_pct': 0.0011366966092153927, 'sideways_atr_max_pct': 0.07696236882511107, 'sideways_tp_mult': 2.3355468429473785, 'sideways_tsl_mult': 0.9404023471570804, 'sideways_time_stop': 38, 'sideways_use_sma': True, 'sideways_use_ema': False, 'sideways_use_atr': False, 'sideways_use_adx': True, 'sideways_use_spike': True, 'sideways_rsi_required': False}.
[I 2025-09-01 10:24:56,541] Trial 491 finished with values: [-0.003412374426411735, 0.005583748258457391] and parameters: {'p_sma': 13, 'p_std': 48, 'p_atr': 27, 'p_adx': 10, 'rsi_period': 47, 'ema1': 8, 'ema2': 14, 'slip_atr_k': 0.020037474681284424, 'slip_spread_k': 0.623166059291549, 'spread_hl_frac': 0.01893766421162612, 'bb_std_mult': 2.4570576901229115, 'rsi_os': 8, 'rsi_ob': 58, 'vol_spike': 0.15253328400306326, 'adx_thresh': 10.553167708534936, 'atr_min_pct': 0.014991625253938514, 'atr_max_pct': 0.0777815954604188, 'tp_mult': 2.4693898476101532, 'tsl_mult': 0.7771796401297246, 'strategy': 'mean_reversion', 'time_stop': 159, 'use_sma': True, 'use_atr': True, 'use_adx': False, 'use_ema': False, 'use_spike': False, 'rsi_required': False, 'edge_k': 1.820113520367759, 'edge_cap': 0.7190763854255497, 'bull_strategy': 'mean_reversion', 'bull_bb_std_mult': 3.598145436075364, 'bull_rsi_os': 45, 'bull_rsi_ob': 92, 'bull_adx_thresh': 16.076665770982494, 'bull_atr_min_pct': 0.004767447364054525, 'bull_atr_max_pct': 0.03088981251128645, 'bull_tp_mult': 1.6605223708285242, 'bull_tsl_mult': 0.8586859250434314, 'bull_time_stop': 133, 'bull_use_sma': True, 'bull_use_ema': False, 'bull_use_atr': True, 'bull_use_adx': False, 'bull_use_spike': True, 'bull_rsi_required': False, 'bear_strategy': 'breakout', 'bear_bb_std_mult': 1.4631322898549153, 'bear_rsi_os': 13, 'bear_rsi_ob': 71, 'bear_adx_thresh': 32.13883576746295, 'bear_atr_min_pct': 0.028020767285426018, 'bear_atr_max_pct': 0.1300750212672632, 'bear_tp_mult': 2.661586844099009, 'bear_tsl_mult': 0.5958293664487975, 'bear_time_stop': 17, 'bear_use_sma': False, 'bear_use_ema': False, 'bear_use_atr': True, 'bear_use_adx': True, 'bear_use_spike': True, 'bear_rsi_required': False, 'sideways_strategy': 'mean_reversion', 'sideways_bb_std_mult': 1.8115069836775448, 'sideways_rsi_os': 34, 'sideways_rsi_ob': 59, 'sideways_adx_thresh': 32.01689457820189, 'sideways_atr_min_pct': 0.001112620651208766, 'sideways_atr_max_pct': 0.08343920224996007, 'sideways_tp_mult': 2.5390616706988, 'sideways_tsl_mult': 0.9800729067523858, 'sideways_time_stop': 83, 'sideways_use_sma': True, 'sideways_use_ema': False, 'sideways_use_atr': False, 'sideways_use_adx': True, 'sideways_use_spike': True, 'sideways_rsi_required': False}.
[I 2025-09-01 10:24:56,543] Trial 492 finished with values: [-0.0123398655219904, 0.012851561938602415] and parameters: {'p_sma': 59, 'p_std': 47, 'p_atr': 27, 'p_adx': 9, 'rsi_period': 47, 'ema1': 8, 'ema2': 41, 'slip_atr_k': 0.02085553686441068, 'slip_spread_k': 0.4780528097033424, 'spread_hl_frac': 0.026662374355783298, 'bb_std_mult': 2.5259913975682675, 'rsi_os': 27, 'rsi_ob': 58, 'vol_spike': 0.17760930861975538, 'adx_thresh': 16.976426354751755, 'atr_min_pct': 0.017834320960409412, 'atr_max_pct': 0.07746591695911205, 'tp_mult': 2.4797469615529533, 'tsl_mult': 0.7892990165517425, 'strategy': 'mean_reversion', 'time_stop': 159, 'use_sma': True, 'use_atr': True, 'use_adx': False, 'use_ema': False, 'use_spike': False, 'rsi_required': False, 'edge_k': 1.8374103470730394, 'edge_cap': 0.5622756550934195, 'bull_strategy': 'mean_reversion', 'bull_bb_std_mult': 0.9825908642355858, 'bull_rsi_os': 42, 'bull_rsi_ob': 95, 'bull_adx_thresh': 13.220900508638422, 'bull_atr_min_pct': 0.005343404812686655, 'bull_atr_max_pct': 0.03686492187126279, 'bull_tp_mult': 1.7152954574262158, 'bull_tsl_mult': 0.8031873172525497, 'bull_time_stop': 125, 'bull_use_sma': True, 'bull_use_ema': False, 'bull_use_atr': True, 'bull_use_adx': False, 'bull_use_spike': True, 'bull_rsi_required': False, 'bear_strategy': 'breakout', 'bear_bb_std_mult': 1.4667690585233548, 'bear_rsi_os': 6, 'bear_rsi_ob': 69, 'bear_adx_thresh': 23.366193982630023, 'bear_atr_min_pct': 0.026127318766203046, 'bear_atr_max_pct': 0.1357150461948987, 'bear_tp_mult': 2.8123361959422866, 'bear_tsl_mult': 0.6260831492222937, 'bear_time_stop': 10, 'bear_use_sma': False, 'bear_use_ema': False, 'bear_use_atr': True, 'bear_use_adx': True, 'bear_use_spike': True, 'bear_rsi_required': False, 'sideways_strategy': 'mean_reversion', 'sideways_bb_std_mult': 1.9933360253639294, 'sideways_rsi_os': 33, 'sideways_rsi_ob': 59, 'sideways_adx_thresh': 32.17651704072483, 'sideways_atr_min_pct': 0.0009081533749149301, 'sideways_atr_max_pct': 0.034889021118089676, 'sideways_tp_mult': 2.48725201304564, 'sideways_tsl_mult': 0.9465926551637249, 'sideways_time_stop': 82, 'sideways_use_sma': True, 'sideways_use_ema': False, 'sideways_use_atr': False, 'sideways_use_adx': True, 'sideways_use_spike': True, 'sideways_rsi_required': False}.
[I 2025-09-01 10:24:56,875] Trial 493 finished with values: [-0.01189284584697925, 0.013267387591131689] and parameters: {'p_sma': 59, 'p_std': 46, 'p_atr': 28, 'p_adx': 9, 'rsi_period': 48, 'ema1': 10, 'ema2': 14, 'slip_atr_k': 0.025519210700002164, 'slip_spread_k': 0.6323557021562487, 'spread_hl_frac': 0.02691832237040684, 'bb_std_mult': 2.455195620873072, 'rsi_os': 8, 'rsi_ob': 52, 'vol_spike': 0.17169079585465732, 'adx_thresh': 7.955693386818641, 'atr_min_pct': 0.016754726594782065, 'atr_max_pct': 0.06637575814716422, 'tp_mult': 2.412098881302245, 'tsl_mult': 0.6965631528258495, 'strategy': 'mean_reversion', 'time_stop': 159, 'use_sma': True, 'use_atr': True, 'use_adx': False, 'use_ema': False, 'use_spike': False, 'rsi_required': False, 'edge_k': 1.764916132180015, 'edge_cap': 0.8150139368954054, 'bull_strategy': 'mean_reversion', 'bull_bb_std_mult': 3.587986892990162, 'bull_rsi_os': 40, 'bull_rsi_ob': 91, 'bull_adx_thresh': 20.019575127526906, 'bull_atr_min_pct': 0.004981992779792494, 'bull_atr_max_pct': 0.038806660044312796, 'bull_tp_mult': 1.7021067128428824, 'bull_tsl_mult': 0.8709810984596732, 'bull_time_stop': 135, 'bull_use_sma': True, 'bull_use_ema': False, 'bull_use_atr': True, 'bull_use_adx': False, 'bull_use_spike': True, 'bull_rsi_required': False, 'bear_strategy': 'breakout', 'bear_bb_std_mult': 1.4614447435907167, 'bear_rsi_os': 42, 'bear_rsi_ob': 70, 'bear_adx_thresh': 21.556135492802035, 'bear_atr_min_pct': 0.02726379013759057, 'bear_atr_max_pct': 0.13056407337868328, 'bear_tp_mult': 1.629595678499344, 'bear_tsl_mult': 0.6255200225990087, 'bear_time_stop': 5, 'bear_use_sma': False, 'bear_use_ema': False, 'bear_use_atr': True, 'bear_use_adx': True, 'bear_use_spike': True, 'bear_rsi_required': False, 'sideways_strategy': 'mean_reversion', 'sideways_bb_std_mult': 1.2341384310033507, 'sideways_rsi_os': 33, 'sideways_rsi_ob': 57, 'sideways_adx_thresh': 33.226879410589916, 'sideways_atr_min_pct': 0.0008819953822128343, 'sideways_atr_max_pct': 0.07772570933644615, 'sideways_tp_mult': 2.2836956365559606, 'sideways_tsl_mult': 0.9484044520553514, 'sideways_time_stop': 145, 'sideways_use_sma': True, 'sideways_use_ema': False, 'sideways_use_atr': False, 'sideways_use_adx': True, 'sideways_use_spike': True, 'sideways_rsi_required': False}.
