[I 2025-09-01 09:57:37,394] Trial 330 finished with values: [-0.017783826700150218, 0.018709974759913865] and parameters: {'p_sma': 57, 'p_std': 46, 'p_atr': 24, 'p_adx': 12, 'rsi_period': 47, 'ema1': 8, 'ema2': 10, 'slip_atr_k': 0.007567680669556461, 'slip_spread_k': 0.5322137272829159, 'spread_hl_frac': 0.033671256384606545, 'bb_std_mult': 2.7214673015716886, 'rsi_os': 13, 'rsi_ob': 57, 'vol_spike': 0.2648463638940747, 'adx_thresh': 12.825957805125878, 'atr_min_pct': 0.019656225080303322, 'atr_max_pct': 0.08796108630390576, 'tp_mult': 2.556166997837576, 'tsl_mult': 0.8910951796592015, 'strategy': 'breakout', 'time_stop': 228, 'use_sma': False, 'use_atr': True, 'use_adx': False, 'use_ema': True, 'use_spike': True, 'rsi_required': False, 'edge_k': 0.0604010982405383, 'edge_cap': 0.5587150963197113, 'bull_strategy': 'mean_reversion', 'bull_bb_std_mult': 3.3949124046586228, 'bull_rsi_os': 51, 'bull_rsi_ob': 77, 'bull_adx_thresh': 27.307144711147128, 'bull_atr_min_pct': 0.025284948518058625, 'bull_atr_max_pct': 0.017140409608654025, 'bull_tp_mult': 1.690092446644728, 'bull_tsl_mult': 0.20043652278766422, 'bull_time_stop': 5, 'bull_use_sma': True, 'bull_use_ema': False, 'bull_use_atr': True, 'bull_use_adx': True, 'bull_use_spike': False, 'bull_rsi_required': False, 'bear_strategy': 'breakout', 'bear_bb_std_mult': 1.8994860735357408, 'bear_rsi_os': 32, 'bear_rsi_ob': 69, 'bear_adx_thresh': 34.98081921867851, 'bear_atr_min_pct': 0.020668522105640297, 'bear_atr_max_pct': 0.012919094564996625, 'bear_tp_mult': 2.0455445347266474, 'bear_tsl_mult': 0.8313549221048976, 'bear_time_stop': 45, 'bear_use_sma': False, 'bear_use_ema': False, 'bear_use_atr': True, 'bear_use_adx': False, 'bear_use_spike': True, 'bear_rsi_required': False, 'sideways_strategy': 'breakout', 'sideways_bb_std_mult': 2.8568980176227807, 'sideways_rsi_os': 27, 'sideways_rsi_ob': 48, 'sideways_adx_thresh': 32.03515499145332, 'sideways_atr_min_pct': 0.0024327631883382076, 'sideways_atr_max_pct': 0.11060218178656782, 'sideways_tp_mult': 2.3629799355088146, 'sideways_tsl_mult': 0.14968806623385794, 'sideways_time_stop': 117, 'sideways_use_sma': True, 'sideways_use_ema': True, 'sideways_use_atr': False, 'sideways_use_adx': True, 'sideways_use_spike': True, 'sideways_rsi_required': False}.
[I 2025-09-01 09:58:19,881] Trial 337 finished with values: [-0.041540007971281545, 0.04126686077139789] and parameters: {'p_sma': 57, 'p_std': 10, 'p_atr': 28, 'p_adx': 11, 'rsi_period': 32, 'ema1': 16, 'ema2': 13, 'slip_atr_k': 0.20744386087924743, 'slip_spread_k': 0.582717959026094, 'spread_hl_frac': 0.008154513947029141, 'bb_std_mult': 2.546565429699496, 'rsi_os': 16, 'rsi_ob': 55, 'vol_spike': 0.1959911383141796, 'adx_thresh': 14.352989036647386, 'atr_min_pct': 0.01749676447771467, 'atr_max_pct': 0.062406556244153186, 'tp_mult': 1.340060196319052, 'tsl_mult': 0.28693327239011823, 'strategy': 'breakout', 'time_stop': 144, 'use_sma': True, 'use_atr': False, 'use_adx': False, 'use_ema': False, 'use_spike': True, 'rsi_required': False, 'edge_k': 0.6044346481478119, 'edge_cap': 0.8041774952849259, 'bull_strategy': 'mean_reversion', 'bull_bb_std_mult': 2.728607274597195, 'bull_rsi_os': 25, 'bull_rsi_ob': 75, 'bull_adx_thresh': 19.725860287434436, 'bull_atr_min_pct': 0.015341438397168238, 'bull_atr_max_pct': 0.08223420176698394, 'bull_tp_mult': 1.4884018984473926, 'bull_tsl_mult': 0.7127798893415956, 'bull_time_stop': 127, 'bull_use_sma': True, 'bull_use_ema': False, 'bull_use_atr': True, 'bull_use_adx': False, 'bull_use_spike': True, 'bull_rsi_required': False, 'bear_strategy': 'mean_reversion', 'bear_bb_std_mult': 3.26506531293991, 'bear_rsi_os': 54, 'bear_rsi_ob': 74, 'bear_adx_thresh': 30.80210031806498, 'bear_atr_min_pct': 0.0015286086951143817, 'bear_atr_max_pct': 0.04567242670991319, 'bear_tp_mult': 2.4737962351635017, 'bear_tsl_mult': 0.8040919013693568, 'bear_time_stop': 5, 'bear_use_sma': False, 'bear_use_ema': True, 'bear_use_atr': True, 'bear_use_adx': True, 'bear_use_spike': True, 'bear_rsi_required': False, 'sideways_strategy': 'mean_reversion', 'sideways_bb_std_mult': 1.4037663531600661, 'sideways_rsi_os': 12, 'sideways_rsi_ob': 58, 'sideways_adx_thresh': 32.571008349664496, 'sideways_atr_min_pct': 0.019252596260928102, 'sideways_atr_max_pct': 0.049131345035861265, 'sideways_tp_mult': 1.6377756667765881, 'sideways_tsl_mult': 0.9088168918759819, 'sideways_time_stop': 217, 'sideways_use_sma': True, 'sideways_use_ema': False, 'sideways_use_atr': False, 'sideways_use_adx': False, 'sideways_use_spike': False, 'sideways_rsi_required': False}.
[I 2025-09-01 09:58:19,885] Trial 335 finished with values: [-1000000000.0, 1000000000.0] and parameters: {'p_sma': 57, 'p_std': 31, 'p_atr': 28, 'p_adx': 21, 'rsi_period': 84, 'ema1': 13, 'ema2': 13, 'slip_atr_k': 0.2070375289719938, 'slip_spread_k': 0.8830601963564009, 'spread_hl_frac': 0.007939962752446553, 'bb_std_mult': 1.4023849829320458, 'rsi_os': 16, 'rsi_ob': 55, 'vol_spike': 0.1955742669841278, 'adx_thresh': 11.737188814325577, 'atr_min_pct': 0.02132318322924288, 'atr_max_pct': 0.06614027396064885, 'tp_mult': 2.5181347085642174, 'tsl_mult': 0.6016480250865902, 'strategy': 'breakout', 'time_stop': 144, 'use_sma': True, 'use_atr': False, 'use_adx': False, 'use_ema': False, 'use_spike': True, 'rsi_required': False, 'edge_k': 0.6166816976917289, 'edge_cap': 0.13669281980021886, 'bull_strategy': 'mean_reversion', 'bull_bb_std_mult': 3.4795655876594767, 'bull_rsi_os': 37, 'bull_rsi_ob': 87, 'bull_adx_thresh': 27.48226859690203, 'bull_atr_min_pct': 0.00562597709473513, 'bull_atr_max_pct': 0.08245843077546028, 'bull_tp_mult': 1.074404662855866, 'bull_tsl_mult': 0.9775911337855095, 'bull_time_stop': 110, 'bull_use_sma': True, 'bull_use_ema': False, 'bull_use_atr': True, 'bull_use_adx': False, 'bull_use_spike': True, 'bull_rsi_required': False, 'bear_strategy': 'breakout', 'bear_bb_std_mult': 1.585716706414068, 'bear_rsi_os': 46, 'bear_rsi_ob': 79, 'bear_adx_thresh': 34.051557334430605, 'bear_atr_min_pct': 0.01821574918808636, 'bear_atr_max_pct': 0.0447303018721368, 'bear_tp_mult': 2.0695253017283433, 'bear_tsl_mult': 0.8152826106300414, 'bear_time_stop': 64, 'bear_use_sma': False, 'bear_use_ema': True, 'bear_use_atr': True, 'bear_use_adx': True, 'bear_use_spike': True, 'bear_rsi_required': False, 'sideways_strategy': 'mean_reversion', 'sideways_bb_std_mult': 2.5095742527628424, 'sideways_rsi_os': 12, 'sideways_rsi_ob': 80, 'sideways_adx_thresh': 32.80556936758701, 'sideways_atr_min_pct': 0.0031733204182996418, 'sideways_atr_max_pct': 0.04937265707862698, 'sideways_tp_mult': 1.31183181215043, 'sideways_tsl_mult': 0.88820230060187, 'sideways_time_stop': 217, 'sideways_use_sma': True, 'sideways_use_ema': False, 'sideways_use_atr': False, 'sideways_use_adx': False, 'sideways_use_spike': False, 'sideways_rsi_required': False}.
[I 2025-09-01 09:58:20,536] Trial 336 finished with values: [-1000000000.0, 1000000000.0] and parameters: {'p_sma': 21, 'p_std': 46, 'p_atr': 22, 'p_adx': 11, 'rsi_period': 20, 'ema1': 7, 'ema2': 13, 'slip_atr_k': 3.4106378005192145e-05, 'slip_spread_k': 0.5782366396327293, 'spread_hl_frac': 0.007469840149089472, 'bb_std_mult': 2.8149411068532006, 'rsi_os': 9, 'rsi_ob': 66, 'vol_spike': 0.19502722486562712, 'adx_thresh': 15.838597923839693, 'atr_min_pct': 0.02076793512844396, 'atr_max_pct': 0.062166967396455004, 'tp_mult': 1.1755318746526329, 'tsl_mult': 0.2803481754506538, 'strategy': 'breakout', 'time_stop': 142, 'use_sma': True, 'use_atr': False, 'use_adx': False, 'use_ema': False, 'use_spike': True, 'rsi_required': False, 'edge_k': 0.6024859019313332, 'edge_cap': 0.1289251965817923, 'bull_strategy': 'mean_reversion', 'bull_bb_std_mult': 3.4731827582830217, 'bull_rsi_os': 7, 'bull_rsi_ob': 83, 'bull_adx_thresh': 21.812980543213822, 'bull_atr_min_pct': 0.026457645767618797, 'bull_atr_max_pct': 0.08272783783951912, 'bull_tp_mult': 1.4903980107838315, 'bull_tsl_mult': 0.7477646783436104, 'bull_time_stop': 111, 'bull_use_sma': True, 'bull_use_ema': False, 'bull_use_atr': True, 'bull_use_adx': False, 'bull_use_spike': True, 'bull_rsi_required': False, 'bear_strategy': 'mean_reversion', 'bear_bb_std_mult': 2.6485004222591195, 'bear_rsi_os': 44, 'bear_rsi_ob': 76, 'bear_adx_thresh': 30.654779184787806, 'bear_atr_min_pct': 0.025807241435378457, 'bear_atr_max_pct': 0.129109594522489, 'bear_tp_mult': 2.918924499610295, 'bear_tsl_mult': 0.8068811271651444, 'bear_time_stop': 5, 'bear_use_sma': False, 'bear_use_ema': True, 'bear_use_atr': True, 'bear_use_adx': True, 'bear_use_spike': True, 'bear_rsi_required': False, 'sideways_strategy': 'mean_reversion', 'sideways_bb_std_mult': 2.8672248189194205, 'sideways_rsi_os': 29, 'sideways_rsi_ob': 48, 'sideways_adx_thresh': 32.44551139888737, 'sideways_atr_min_pct': 0.017653417456639307, 'sideways_atr_max_pct': 0.0845460060283117, 'sideways_tp_mult': 1.3199783033873822, 'sideways_tsl_mult': 0.8944388371481956, 'sideways_time_stop': 218, 'sideways_use_sma': True, 'sideways_use_ema': False, 'sideways_use_atr': False, 'sideways_use_adx': False, 'sideways_use_spike': False, 'sideways_rsi_required': False}.
[I 2025-09-01 09:58:21,595] Trial 334 finished with values: [-1000000000.0, 1000000000.0] and parameters: {'p_sma': 59, 'p_std': 57, 'p_atr': 15, 'p_adx': 29, 'rsi_period': 84, 'ema1': 13, 'ema2': 10, 'slip_atr_k': 0.004531306373610045, 'slip_spread_k': 0.5555973381391743, 'spread_hl_frac': 0.012572169379726841, 'bb_std_mult': 2.539774529691091, 'rsi_os': 16, 'rsi_ob': 54, 'vol_spike': 0.19713595487080737, 'adx_thresh': 12.570232371325828, 'atr_min_pct': 0.017632289809115305, 'atr_max_pct': 0.08945695357991838, 'tp_mult': 2.378215375842619, 'tsl_mult': 0.6921147056536878, 'strategy': 'breakout', 'time_stop': 227, 'use_sma': True, 'use_atr': False, 'use_adx': False, 'use_ema': False, 'use_spike': True, 'rsi_required': False, 'edge_k': 1.4579042777646984, 'edge_cap': 0.7673872064927441, 'bull_strategy': 'mean_reversion', 'bull_bb_std_mult': 3.598886559847604, 'bull_rsi_os': 37, 'bull_rsi_ob': 94, 'bull_adx_thresh': 12.06925273749438, 'bull_atr_min_pct': 0.026563431264503452, 'bull_atr_max_pct': 0.08271402617259865, 'bull_tp_mult': 1.4918232377715486, 'bull_tsl_mult': 0.1565872617743097, 'bull_time_stop': 68, 'bull_use_sma': True, 'bull_use_ema': False, 'bull_use_atr': True, 'bull_use_adx': True, 'bull_use_spike': True, 'bull_rsi_required': False, 'bear_strategy': 'breakout', 'bear_bb_std_mult': 1.6041083011181823, 'bear_rsi_os': 46, 'bear_rsi_ob': 71, 'bear_adx_thresh': 10.128106529208543, 'bear_atr_min_pct': 0.028336979322523888, 'bear_atr_max_pct': 0.04469512219001698, 'bear_tp_mult': 2.040458254173661, 'bear_tsl_mult': 0.12762496810582014, 'bear_time_stop': 22, 'bear_use_sma': False, 'bear_use_ema': True, 'bear_use_atr': True, 'bear_use_adx': True, 'bear_use_spike': True, 'bear_rsi_required': False, 'sideways_strategy': 'mean_reversion', 'sideways_bb_std_mult': 2.37732913185272, 'sideways_rsi_os': 11, 'sideways_rsi_ob': 80, 'sideways_adx_thresh': 11.744868049013828, 'sideways_atr_min_pct': 0.0032092041537929395, 'sideways_atr_max_pct': 0.08394156163318776, 'sideways_tp_mult': 2.940249833376966, 'sideways_tsl_mult': 0.2961064672441283, 'sideways_time_stop': 212, 'sideways_use_sma': True, 'sideways_use_ema': False, 'sideways_use_atr': False, 'sideways_use_adx': False, 'sideways_use_spike': True, 'sideways_rsi_required': False}.
[I 2025-09-01 09:59:01,412] Trial 340 finished with values: [-0.013883681875481502, 0.014208325566118469] and parameters: {'p_sma': 60, 'p_std': 43, 'p_atr': 30, 'p_adx': 20, 'rsi_period': 45, 'ema1': 9, 'ema2': 11, 'slip_atr_k': 0.013235958725861221, 'slip_spread_k': 0.7927574865827909, 'spread_hl_frac': 0.04225965005832304, 'bb_std_mult': 2.605127759153905, 'rsi_os': 7, 'rsi_ob': 94, 'vol_spike': 0.18257173584658407, 'adx_thresh': 19.70805708683438, 'atr_min_pct': 0.019046301143947595, 'atr_max_pct': 0.05707923107843622, 'tp_mult': 2.3972439993436567, 'tsl_mult': 0.7874927248316003, 'strategy': 'mean_reversion', 'time_stop': 136, 'use_sma': True, 'use_atr': True, 'use_adx': True, 'use_ema': False, 'use_spike': True, 'rsi_required': False, 'edge_k': 1.472339622339675, 'edge_cap': 0.8766609990621284, 'bull_strategy': 'mean_reversion', 'bull_bb_std_mult': 3.5530780908936754, 'bull_rsi_os': 37, 'bull_rsi_ob': 72, 'bull_adx_thresh': 13.508424258732585, 'bull_atr_min_pct': 0.0015462346334187437, 'bull_atr_max_pct': 0.08817755791796708, 'bull_tp_mult': 1.5597754077538541, 'bull_tsl_mult': 0.6288745252115386, 'bull_time_stop': 153, 'bull_use_sma': False, 'bull_use_ema': False, 'bull_use_atr': True, 'bull_use_adx': False, 'bull_use_spike': True, 'bull_rsi_required': True, 'bear_strategy': 'breakout', 'bear_bb_std_mult': 1.3799063260983784, 'bear_rsi_os': 39, 'bear_rsi_ob': 71, 'bear_adx_thresh': 12.391828786984892, 'bear_atr_min_pct': 0.0198052150198675, 'bear_atr_max_pct': 0.1289548890207484, 'bear_tp_mult': 2.881722215422457, 'bear_tsl_mult': 0.7860492131829142, 'bear_time_stop': 145, 'bear_use_sma': True, 'bear_use_ema': True, 'bear_use_atr': True, 'bear_use_adx': True, 'bear_use_spike': False, 'bear_rsi_required': False, 'sideways_strategy': 'mean_reversion', 'sideways_bb_std_mult': 2.7264535657467937, 'sideways_rsi_os': 16, 'sideways_rsi_ob': 72, 'sideways_adx_thresh': 31.20738500403284, 'sideways_atr_min_pct': 0.0033909262584283268, 'sideways_atr_max_pct': 0.08648391558903253, 'sideways_tp_mult': 1.4206612959584792, 'sideways_tsl_mult': 0.9395670342446379, 'sideways_time_stop': 227, 'sideways_use_sma': True, 'sideways_use_ema': False, 'sideways_use_atr': True, 'sideways_use_adx': False, 'sideways_use_spike': True, 'sideways_rsi_required': False}.
[I 2025-09-01 09:59:01,446] Trial 339 finished with values: [-1000000000.0, 1000000000.0] and parameters: {'p_sma': 12, 'p_std': 43, 'p_atr': 21, 'p_adx': 9, 'rsi_period': 17, 'ema1': 9, 'ema2': 10, 'slip_atr_k': 0.0032325856076441855, 'slip_spread_k': 0.5860417676540477, 'spread_hl_frac': 0.0065215173386194815, 'bb_std_mult': 2.7998877988224953, 'rsi_os': 9, 'rsi_ob': 54, 'vol_spike': 0.18419180101272742, 'adx_thresh': 9.105959991619596, 'atr_min_pct': 0.020633506535929345, 'atr_max_pct': 0.058576807678734084, 'tp_mult': 2.3032593755349065, 'tsl_mult': 0.34657502337735613, 'strategy': 'mean_reversion', 'time_stop': 89, 'use_sma': True, 'use_atr': True, 'use_adx': True, 'use_ema': False, 'use_spike': True, 'rsi_required': False, 'edge_k': 0.678842505440873, 'edge_cap': 0.7377904966723581, 'bull_strategy': 'mean_reversion', 'bull_bb_std_mult': 3.5943239512772607, 'bull_rsi_os': 37, 'bull_rsi_ob': 81, 'bull_adx_thresh': 31.103592040563576, 'bull_atr_min_pct': 0.0201897133309882, 'bull_atr_max_pct': 0.10693851567904272, 'bull_tp_mult': 1.5715374232426376, 'bull_tsl_mult': 0.9318546148866985, 'bull_time_stop': 145, 'bull_use_sma': False, 'bull_use_ema': False, 'bull_use_atr': True, 'bull_use_adx': False, 'bull_use_spike': True, 'bull_rsi_required': True, 'bear_strategy': 'mean_reversion', 'bear_bb_std_mult': 1.3726500830847277, 'bear_rsi_os': 38, 'bear_rsi_ob': 71, 'bear_adx_thresh': 26.854051594950285, 'bear_atr_min_pct': 0.028265325792306954, 'bear_atr_max_pct': 0.1474663358120728, 'bear_tp_mult': 2.9195282369571274, 'bear_tsl_mult': 0.7886645965695321, 'bear_time_stop': 21, 'bear_use_sma': True, 'bear_use_ema': True, 'bear_use_atr': True, 'bear_use_adx': True, 'bear_use_spike': False, 'bear_rsi_required': False, 'sideways_strategy': 'mean_reversion', 'sideways_bb_std_mult': 2.725104024106305, 'sideways_rsi_os': 30, 'sideways_rsi_ob': 63, 'sideways_adx_thresh': 21.878967276863236, 'sideways_atr_min_pct': 0.003397520426932344, 'sideways_atr_max_pct': 0.08475164851977109, 'sideways_tp_mult': 1.4686220513914272, 'sideways_tsl_mult': 0.28148641368286464, 'sideways_time_stop': 227, 'sideways_use_sma': True, 'sideways_use_ema': False, 'sideways_use_atr': True, 'sideways_use_adx': False, 'sideways_use_spike': True, 'sideways_rsi_required': False}.
[I 2025-09-01 09:59:01,737] Trial 341 finished with values: [-1000000000.0, 1000000000.0] and parameters: {'p_sma': 23, 'p_std': 19, 'p_atr': 29, 'p_adx': 11, 'rsi_period': 43, 'ema1': 9, 'ema2': 11, 'slip_atr_k': 0.012996554585573262, 'slip_spread_k': 0.79392074044915, 'spread_hl_frac': 0.006401763453274206, 'bb_std_mult': 3.361861804880199, 'rsi_os': 7, 'rsi_ob': 89, 'vol_spike': 0.18412211073280138, 'adx_thresh': 10.710187506847918, 'atr_min_pct': 0.019096319232183544, 'atr_max_pct': 0.05764714266691239, 'tp_mult': 2.497653312112673, 'tsl_mult': 0.8217467481932526, 'strategy': 'mean_reversion', 'time_stop': 136, 'use_sma': True, 'use_atr': True, 'use_adx': True, 'use_ema': False, 'use_spike': True, 'rsi_required': False, 'edge_k': 0.3948476986070997, 'edge_cap': 0.8771595443431551, 'bull_strategy': 'mean_reversion', 'bull_bb_std_mult': 3.5327434923131413, 'bull_rsi_os': 55, 'bull_rsi_ob': 80, 'bull_adx_thresh': 28.39821872918688, 'bull_atr_min_pct': 0.005068330153889586, 'bull_atr_max_pct': 0.07412853240817388, 'bull_tp_mult': 1.579482502732332, 'bull_tsl_mult': 0.8515355551579231, 'bull_time_stop': 152, 'bull_use_sma': False, 'bull_use_ema': False, 'bull_use_atr': True, 'bull_use_adx': False, 'bull_use_spike': True, 'bull_rsi_required': True, 'bear_strategy': 'breakout', 'bear_bb_std_mult': 1.3802429594107812, 'bear_rsi_os': 44, 'bear_rsi_ob': 74, 'bear_adx_thresh': 12.380804678460212, 'bear_atr_min_pct': 0.0028157169102208945, 'bear_atr_max_pct': 0.06549161515456478, 'bear_tp_mult': 2.81242799367414, 'bear_tsl_mult': 0.7850403437224487, 'bear_time_stop': 36, 'bear_use_sma': True, 'bear_use_ema': True, 'bear_use_atr': True, 'bear_use_adx': True, 'bear_use_spike': False, 'bear_rsi_required': False, 'sideways_strategy': 'mean_reversion', 'sideways_bb_std_mult': 0.9803531596141426, 'sideways_rsi_os': 31, 'sideways_rsi_ob': 64, 'sideways_adx_thresh': 21.719085679336683, 'sideways_atr_min_pct': 0.003725445792258868, 'sideways_atr_max_pct': 0.029930968564419548, 'sideways_tp_mult': 1.0475130006775326, 'sideways_tsl_mult': 0.9331470082036959, 'sideways_time_stop': 133, 'sideways_use_sma': True, 'sideways_use_ema': False, 'sideways_use_atr': True, 'sideways_use_adx': False, 'sideways_use_spike': True, 'sideways_rsi_required': False}.
[I 2025-09-01 09:59:01,935] Trial 338 finished with values: [-1000000000.0, 1000000000.0] and parameters: {'p_sma': 59, 'p_std': 43, 'p_atr': 15, 'p_adx': 29, 'rsi_period': 45, 'ema1': 9, 'ema2': 42, 'slip_atr_k': 0.003582697606035066, 'slip_spread_k': 0.5835016252458899, 'spread_hl_frac': 0.006647979579766611, 'bb_std_mult': 2.7981190899704074, 'rsi_os': 9, 'rsi_ob': 54, 'vol_spike': 0.18375291895931936, 'adx_thresh': 29.29332492111115, 'atr_min_pct': 0.02077378536520631, 'atr_max_pct': 0.057243828962219925, 'tp_mult': 2.377656863083116, 'tsl_mult': 0.25402640368193463, 'strategy': 'mean_reversion', 'time_stop': 49, 'use_sma': True, 'use_atr': True, 'use_adx': True, 'use_ema': False, 'use_spike': True, 'rsi_required': False, 'edge_k': 0.519991431077537, 'edge_cap': 0.8786080612148194, 'bull_strategy': 'mean_reversion', 'bull_bb_std_mult': 3.5706451122738168, 'bull_rsi_os': 55, 'bull_rsi_ob': 47, 'bull_adx_thresh': 28.471829924655747, 'bull_atr_min_pct': 0.005095587152176892, 'bull_atr_max_pct': 0.07251312558318793, 'bull_tp_mult': 1.5522186827964772, 'bull_tsl_mult': 0.9233283897981786, 'bull_time_stop': 70, 'bull_use_sma': False, 'bull_use_ema': False, 'bull_use_atr': True, 'bull_use_adx': False, 'bull_use_spike': True, 'bull_rsi_required': True, 'bear_strategy': 'mean_reversion', 'bear_bb_std_mult': 2.634563547491788, 'bear_rsi_os': 45, 'bear_rsi_ob': 76, 'bear_adx_thresh': 24.54636892760042, 'bear_atr_min_pct': 0.002968218075939685, 'bear_atr_max_pct': 0.1296646473843057, 'bear_tp_mult': 2.9122374171237655, 'bear_tsl_mult': 0.4469841606901454, 'bear_time_stop': 145, 'bear_use_sma': True, 'bear_use_ema': True, 'bear_use_atr': True, 'bear_use_adx': True, 'bear_use_spike': False, 'bear_rsi_required': False, 'sideways_strategy': 'mean_reversion', 'sideways_bb_std_mult': 0.974340651686473, 'sideways_rsi_os': 30, 'sideways_rsi_ob': 72, 'sideways_adx_thresh': 31.33499776655132, 'sideways_atr_min_pct': 0.017489799621371815, 'sideways_atr_max_pct': 0.08374348652712438, 'sideways_tp_mult': 2.7585352389262465, 'sideways_tsl_mult': 0.30648821982541274, 'sideways_time_stop': 229, 'sideways_use_sma': True, 'sideways_use_ema': False, 'sideways_use_atr': True, 'sideways_use_adx': False, 'sideways_use_spike': True, 'sideways_rsi_required': False}.
