[I 2025-09-01 10:33:08,238] Trial 538 finished with values: [-1000000000.0, 1000000000.0] and parameters: {'p_sma': 58, 'p_std': 46, 'p_atr': 12, 'p_adx': 10, 'rsi_period': 9, 'ema1': 23, 'ema2': 11, 'slip_atr_k': 0.1940850385584772, 'slip_spread_k': 0.5939479073464442, 'spread_hl_frac': 0.013597393929636895, 'bb_std_mult': 2.766315467623012, 'rsi_os': 38, 'rsi_ob': 54, 'vol_spike': 0.07745087435857452, 'adx_thresh': 17.73153792196583, 'atr_min_pct': 0.01944215342219703, 'atr_max_pct': 0.0679972072245824, 'tp_mult': 2.591629852882127, 'tsl_mult': 0.2995017006154056, 'strategy': 'breakout', 'time_stop': 132, 'use_sma': False, 'use_atr': True, 'use_adx': False, 'use_ema': False, 'use_spike': True, 'rsi_required': False, 'edge_k': 1.1835998994431933, 'edge_cap': 0.39306559183505474, 'bull_strategy': 'breakout', 'bull_bb_std_mult': 1.8873443829910082, 'bull_rsi_os': 38, 'bull_rsi_ob': 76, 'bull_adx_thresh': 8.024326980342627, 'bull_atr_min_pct': 0.004703124581957292, 'bull_atr_max_pct': 0.12845492328088307, 'bull_tp_mult': 1.644278059404222, 'bull_tsl_mult': 0.6834567007629517, 'bull_time_stop': 141, 'bull_use_sma': True, 'bull_use_ema': True, 'bull_use_atr': True, 'bull_use_adx': False, 'bull_use_spike': True, 'bull_rsi_required': False, 'bear_strategy': 'breakout', 'bear_bb_std_mult': 3.087535065772091, 'bear_rsi_os': 17, 'bear_rsi_ob': 74, 'bear_adx_thresh': 33.712328505200944, 'bear_atr_min_pct': 0.0284998780513318, 'bear_atr_max_pct': 0.13451171728739136, 'bear_tp_mult': 2.888688607750252, 'bear_tsl_mult': 0.544582189758789, 'bear_time_stop': 5, 'bear_use_sma': False, 'bear_use_ema': False, 'bear_use_atr': True, 'bear_use_adx': False, 'bear_use_spike': False, 'bear_rsi_required': False, 'sideways_strategy': 'mean_reversion', 'sideways_bb_std_mult': 1.574596159939064, 'sideways_rsi_os': 31, 'sideways_rsi_ob': 60, 'sideways_adx_thresh': 11.10554023046401, 'sideways_atr_min_pct': 0.0036700010283294018, 'sideways_atr_max_pct': 0.08612358662718526, 'sideways_tp_mult': 2.3225600847564447, 'sideways_tsl_mult': 0.9795817672131271, 'sideways_time_stop': 25, 'sideways_use_sma': False, 'sideways_use_ema': True, 'sideways_use_atr': True, 'sideways_use_adx': False, 'sideways_use_spike': True, 'sideways_rsi_required': False}.
[I 2025-09-01 10:33:08,758] Trial 539 finished with values: [-1000000000.0, 1000000000.0] and parameters: {'p_sma': 58, 'p_std': 53, 'p_atr': 14, 'p_adx': 23, 'rsi_period': 30, 'ema1': 23, 'ema2': 52, 'slip_atr_k': 0.0037181077490806144, 'slip_spread_k': 0.7054356733926207, 'spread_hl_frac': 0.005968735754910678, 'bb_std_mult': 2.493934992201311, 'rsi_os': 46, 'rsi_ob': 54, 'vol_spike': 0.20025298725844337, 'adx_thresh': 32.89150277656702, 'atr_min_pct': 0.019499828807624707, 'atr_max_pct': 0.06323286632958969, 'tp_mult': 2.5761056300881116, 'tsl_mult': 0.6607278033031467, 'strategy': 'breakout', 'time_stop': 148, 'use_sma': False, 'use_atr': True, 'use_adx': False, 'use_ema': False, 'use_spike': True, 'rsi_required': False, 'edge_k': 0.5923451749292256, 'edge_cap': 0.39115083784373306, 'bull_strategy': 'breakout', 'bull_bb_std_mult': 3.4712330209376305, 'bull_rsi_os': 11, 'bull_rsi_ob': 78, 'bull_adx_thresh': 27.817531682320443, 'bull_atr_min_pct': 0.026657602663288867, 'bull_atr_max_pct': 0.07569815203564502, 'bull_tp_mult': 1.5909467139393418, 'bull_tsl_mult': 0.5032649843467962, 'bull_time_stop': 94, 'bull_use_sma': True, 'bull_use_ema': True, 'bull_use_atr': True, 'bull_use_adx': False, 'bull_use_spike': True, 'bull_rsi_required': False, 'bear_strategy': 'breakout', 'bear_bb_std_mult': 3.3780954155838137, 'bear_rsi_os': 38, 'bear_rsi_ob': 74, 'bear_adx_thresh': 33.66875784399965, 'bear_atr_min_pct': 0.011730689990395476, 'bear_atr_max_pct': 0.0423742376171553, 'bear_tp_mult': 1.0841397501764387, 'bear_tsl_mult': 0.8720621184784063, 'bear_time_stop': 300, 'bear_use_sma': False, 'bear_use_ema': False, 'bear_use_atr': True, 'bear_use_adx': False, 'bear_use_spike': False, 'bear_rsi_required': False, 'sideways_strategy': 'mean_reversion', 'sideways_bb_std_mult': 1.7286951486474569, 'sideways_rsi_os': 31, 'sideways_rsi_ob': 60, 'sideways_adx_thresh': 34.99182372667999, 'sideways_atr_min_pct': 0.003575839081733965, 'sideways_atr_max_pct': 0.05346456918433337, 'sideways_tp_mult': 2.319193117256628, 'sideways_tsl_mult': 0.19017155744003683, 'sideways_time_stop': 225, 'sideways_use_sma': False, 'sideways_use_ema': True, 'sideways_use_atr': True, 'sideways_use_adx': False, 'sideways_use_spike': True, 'sideways_rsi_required': False}.
[I 2025-09-01 10:33:48,978] Trial 544 finished with values: [-1000000000.0, 1000000000.0] and parameters: {'p_sma': 10, 'p_std': 42, 'p_atr': 24, 'p_adx': 19, 'rsi_period': 52, 'ema1': 8, 'ema2': 29, 'slip_atr_k': 0.021357838470010652, 'slip_spread_k': 0.22569441299430565, 'spread_hl_frac': 0.006204935619250755, 'bb_std_mult': 2.3734272273807795, 'rsi_os': 46, 'rsi_ob': 67, 'vol_spike': 0.16958082737209085, 'adx_thresh': 33.724889027118735, 'atr_min_pct': 0.020573998944954267, 'atr_max_pct': 0.05695991608447609, 'tp_mult': 2.1067578604843376, 'tsl_mult': 0.8386931723749362, 'strategy': 'mean_reversion', 'time_stop': 160, 'use_sma': True, 'use_atr': False, 'use_adx': True, 'use_ema': True, 'use_spike': False, 'rsi_required': True, 'edge_k': 1.3328266342772312, 'edge_cap': 0.9200822881661099, 'bull_strategy': 'mean_reversion', 'bull_bb_std_mult': 3.4405362421117567, 'bull_rsi_os': 25, 'bull_rsi_ob': 78, 'bull_adx_thresh': 27.577080601670517, 'bull_atr_min_pct': 0.00544744681780389, 'bull_atr_max_pct': 0.036518178387968725, 'bull_tp_mult': 1.5773568142182652, 'bull_tsl_mult': 0.9099141617716924, 'bull_time_stop': 282, 'bull_use_sma': False, 'bull_use_ema': False, 'bull_use_atr': False, 'bull_use_adx': True, 'bull_use_spike': True, 'bull_rsi_required': True, 'bear_strategy': 'breakout', 'bear_bb_std_mult': 1.1469809552032282, 'bear_rsi_os': 45, 'bear_rsi_ob': 48, 'bear_adx_thresh': 28.823592733714023, 'bear_atr_min_pct': 0.010773266033721841, 'bear_atr_max_pct': 0.1278875080578134, 'bear_tp_mult': 2.749897840705961, 'bear_tsl_mult': 0.7430275445341741, 'bear_time_stop': 191, 'bear_use_sma': True, 'bear_use_ema': False, 'bear_use_atr': False, 'bear_use_adx': True, 'bear_use_spike': True, 'bear_rsi_required': True, 'sideways_strategy': 'mean_reversion', 'sideways_bb_std_mult': 3.4885440041526623, 'sideways_rsi_os': 29, 'sideways_rsi_ob': 45, 'sideways_adx_thresh': 30.362964189239875, 'sideways_atr_min_pct': 0.025119335668229603, 'sideways_atr_max_pct': 0.05458437555193647, 'sideways_tp_mult': 2.5890728312091356, 'sideways_tsl_mult': 0.641419740311965, 'sideways_time_stop': 73, 'sideways_use_sma': True, 'sideways_use_ema': False, 'sideways_use_atr': False, 'sideways_use_adx': False, 'sideways_use_spike': False, 'sideways_rsi_required': True}.
[I 2025-09-01 10:33:49,750] Trial 543 finished with values: [-1000000000.0, 1000000000.0] and parameters: {'p_sma': 59, 'p_std': 42, 'p_atr': 28, 'p_adx': 23, 'rsi_period': 52, 'ema1': 8, 'ema2': 52, 'slip_atr_k': 0.020227607544545084, 'slip_spread_k': 0.577613731121487, 'spread_hl_frac': 0.005573432745630962, 'bb_std_mult': 2.5058927243159306, 'rsi_os': 14, 'rsi_ob': 55, 'vol_spike': 0.09040379979911126, 'adx_thresh': 33.747919685462186, 'atr_min_pct': 0.01746384103412099, 'atr_max_pct': 0.07184254779255002, 'tp_mult': 2.950576135055719, 'tsl_mult': 0.6155221139743867, 'strategy': 'mean_reversion', 'time_stop': 262, 'use_sma': True, 'use_atr': False, 'use_adx': True, 'use_ema': True, 'use_spike': False, 'rsi_required': True, 'edge_k': 0.5795678372924329, 'edge_cap': 0.7842086663438077, 'bull_strategy': 'mean_reversion', 'bull_bb_std_mult': 3.4509477617386715, 'bull_rsi_os': 37, 'bull_rsi_ob': 47, 'bull_adx_thresh': 27.513287451865345, 'bull_atr_min_pct': 0.005508647176984114, 'bull_atr_max_pct': 0.08301721764763413, 'bull_tp_mult': 2.457635273866778, 'bull_tsl_mult': 0.9099346345662945, 'bull_time_stop': 282, 'bull_use_sma': False, 'bull_use_ema': False, 'bull_use_atr': False, 'bull_use_adx': True, 'bull_use_spike': True, 'bull_rsi_required': True, 'bear_strategy': 'breakout', 'bear_bb_std_mult': 2.5160762688891323, 'bear_rsi_os': 45, 'bear_rsi_ob': 76, 'bear_adx_thresh': 18.024973525666717, 'bear_atr_min_pct': 0.010557280912168693, 'bear_atr_max_pct': 0.12731958932001472, 'bear_tp_mult': 2.80613519053493, 'bear_tsl_mult': 0.8808554185816552, 'bear_time_stop': 20, 'bear_use_sma': True, 'bear_use_ema': False, 'bear_use_atr': False, 'bear_use_adx': True, 'bear_use_spike': True, 'bear_rsi_required': True, 'sideways_strategy': 'mean_reversion', 'sideways_bb_std_mult': 2.444455928885193, 'sideways_rsi_os': 29, 'sideways_rsi_ob': 45, 'sideways_adx_thresh': 23.481308587076622, 'sideways_atr_min_pct': 0.01898064855741289, 'sideways_atr_max_pct': 0.07944478992516564, 'sideways_tp_mult': 1.217302403048961, 'sideways_tsl_mult': 0.19088412131745375, 'sideways_time_stop': 31, 'sideways_use_sma': True, 'sideways_use_ema': False, 'sideways_use_atr': False, 'sideways_use_adx': False, 'sideways_use_spike': False, 'sideways_rsi_required': True}.
[I 2025-09-01 10:33:50,261] Trial 545 finished with values: [-1000000000.0, 1000000000.0] and parameters: {'p_sma': 24, 'p_std': 44, 'p_atr': 24, 'p_adx': 11, 'rsi_period': 44, 'ema1': 8, 'ema2': 29, 'slip_atr_k': 0.00034771140442378494, 'slip_spread_k': 0.9059357783509319, 'spread_hl_frac': 0.009312602485224305, 'bb_std_mult': 2.880727177912084, 'rsi_os': 8, 'rsi_ob': 55, 'vol_spike': 0.2199952490429096, 'adx_thresh': 34.960538628385876, 'atr_min_pct': 0.009917203372452834, 'atr_max_pct': 0.07287582122035823, 'tp_mult': 1.978306174958991, 'tsl_mult': 0.6123972441884244, 'strategy': 'mean_reversion', 'time_stop': 160, 'use_sma': True, 'use_atr': False, 'use_adx': True, 'use_ema': True, 'use_spike': False, 'rsi_required': True, 'edge_k': 1.3442044462006606, 'edge_cap': 0.8323850005029639, 'bull_strategy': 'mean_reversion', 'bull_bb_std_mult': 3.5982483754587995, 'bull_rsi_os': 37, 'bull_rsi_ob': 78, 'bull_adx_thresh': 28.926052033290418, 'bull_atr_min_pct': 0.0034232873912596103, 'bull_atr_max_pct': 0.08291788845824082, 'bull_tp_mult': 1.5559070865747642, 'bull_tsl_mult': 0.9811299712024667, 'bull_time_stop': 80, 'bull_use_sma': False, 'bull_use_ema': False, 'bull_use_atr': False, 'bull_use_adx': True, 'bull_use_spike': True, 'bull_rsi_required': True, 'bear_strategy': 'breakout', 'bear_bb_std_mult': 1.5545982399010787, 'bear_rsi_os': 42, 'bear_rsi_ob': 71, 'bear_adx_thresh': 34.31527318638885, 'bear_atr_min_pct': 0.02837957743885769, 'bear_atr_max_pct': 0.12687836789666862, 'bear_tp_mult': 2.8092139467156647, 'bear_tsl_mult': 0.8180255747179066, 'bear_time_stop': 45, 'bear_use_sma': True, 'bear_use_ema': True, 'bear_use_atr': False, 'bear_use_adx': True, 'bear_use_spike': True, 'bear_rsi_required': True, 'sideways_strategy': 'breakout', 'sideways_bb_std_mult': 2.6438637875893485, 'sideways_rsi_os': 29, 'sideways_rsi_ob': 57, 'sideways_adx_thresh': 33.122629833686894, 'sideways_atr_min_pct': 0.009533720845075309, 'sideways_atr_max_pct': 0.01726938106381043, 'sideways_tp_mult': 2.5848207454158265, 'sideways_tsl_mult': 0.6430967416581135, 'sideways_time_stop': 70, 'sideways_use_sma': True, 'sideways_use_ema': False, 'sideways_use_atr': False, 'sideways_use_adx': False, 'sideways_use_spike': False, 'sideways_rsi_required': True}.
[I 2025-09-01 10:33:50,630] Trial 542 finished with values: [-1000000000.0, 1000000000.0] and parameters: {'p_sma': 58, 'p_std': 45, 'p_atr': 28, 'p_adx': 11, 'rsi_period': 43, 'ema1': 8, 'ema2': 29, 'slip_atr_k': 1.0242840142875992e-05, 'slip_spread_k': 0.4202663280214945, 'spread_hl_frac': 0.006088145431450553, 'bb_std_mult': 2.5116533353483925, 'rsi_os': 33, 'rsi_ob': 55, 'vol_spike': 0.19973420240751166, 'adx_thresh': 11.00841651885838, 'atr_min_pct': 0.020498030719847488, 'atr_max_pct': 0.06684097672137784, 'tp_mult': 1.9663993354207123, 'tsl_mult': 0.8352962421086341, 'strategy': 'mean_reversion', 'time_stop': 108, 'use_sma': True, 'use_atr': True, 'use_adx': True, 'use_ema': False, 'use_spike': False, 'rsi_required': False, 'edge_k': 0.5773508442138617, 'edge_cap': 0.9138757976382867, 'bull_strategy': 'mean_reversion', 'bull_bb_std_mult': 3.4541934597393498, 'bull_rsi_os': 43, 'bull_rsi_ob': 76, 'bull_adx_thresh': 27.693104776307912, 'bull_atr_min_pct': 0.00471799847260081, 'bull_atr_max_pct': 0.043241736926653854, 'bull_tp_mult': 2.0368461132296938, 'bull_tsl_mult': 0.6829269684920161, 'bull_time_stop': 142, 'bull_use_sma': False, 'bull_use_ema': False, 'bull_use_atr': True, 'bull_use_adx': True, 'bull_use_spike': True, 'bull_rsi_required': False, 'bear_strategy': 'breakout', 'bear_bb_std_mult': 3.390530668908145, 'bear_rsi_os': 42, 'bear_rsi_ob': 74, 'bear_adx_thresh': 34.446183252683205, 'bear_atr_min_pct': 0.028536840085793755, 'bear_atr_max_pct': 0.13590081193426914, 'bear_tp_mult': 1.0501101598235008, 'bear_tsl_mult': 0.8154829411959613, 'bear_time_stop': 5, 'bear_use_sma': True, 'bear_use_ema': False, 'bear_use_atr': True, 'bear_use_adx': True, 'bear_use_spike': True, 'bear_rsi_required': True, 'sideways_strategy': 'mean_reversion', 'sideways_bb_std_mult': 2.42730601772267, 'sideways_rsi_os': 31, 'sideways_rsi_ob': 60, 'sideways_adx_thresh': 11.020639427106104, 'sideways_atr_min_pct': 0.01871579174479202, 'sideways_atr_max_pct': 0.08628692912858378, 'sideways_tp_mult': 1.2092376220134118, 'sideways_tsl_mult': 0.9787985986384026, 'sideways_time_stop': 58, 'sideways_use_sma': True, 'sideways_use_ema': False, 'sideways_use_atr': True, 'sideways_use_adx': False, 'sideways_use_spike': False, 'sideways_rsi_required': False}.
[I 2025-09-01 10:34:32,094] Trial 546 finished with values: [-1000000000.0, 1000000000.0] and parameters: {'p_sma': 43, 'p_std': 44, 'p_atr': 13, 'p_adx': 11, 'rsi_period': 76, 'ema1': 15, 'ema2': 12, 'slip_atr_k': 0.010739451449253923, 'slip_spread_k': 0.12669462870825737, 'spread_hl_frac': 0.025615443394720633, 'bb_std_mult': 2.864444527384342, 'rsi_os': 8, 'rsi_ob': 57, 'vol_spike': 0.10182323314795874, 'adx_thresh': 11.058600330363056, 'atr_min_pct': 0.01727080531305486, 'atr_max_pct': 0.07156870131552022, 'tp_mult': 2.4851531418043336, 'tsl_mult': 0.822767246981749, 'strategy': 'mean_reversion', 'time_stop': 109, 'use_sma': True, 'use_atr': True, 'use_adx': False, 'use_ema': False, 'use_spike': False, 'rsi_required': False, 'edge_k': 0.6756547665714567, 'edge_cap': 0.8375162252451066, 'bull_strategy': 'mean_reversion', 'bull_bb_std_mult': 3.3735882868205604, 'bull_rsi_os': 33, 'bull_rsi_ob': 55, 'bull_adx_thresh': 28.544780573488566, 'bull_atr_min_pct': 0.0034678971855797132, 'bull_atr_max_pct': 0.0826719501000003, 'bull_tp_mult': 2.2259669433725207, 'bull_tsl_mult': 0.9729475658549943, 'bull_time_stop': 83, 'bull_use_sma': True, 'bull_use_ema': False, 'bull_use_atr': True, 'bull_use_adx': True, 'bull_use_spike': False, 'bull_rsi_required': False, 'bear_strategy': 'mean_reversion', 'bear_bb_std_mult': 1.3469549474278366, 'bear_rsi_os': 42, 'bear_rsi_ob': 71, 'bear_adx_thresh': 12.923720935053238, 'bear_atr_min_pct': 0.018581427019304722, 'bear_atr_max_pct': 0.10201003122652746, 'bear_tp_mult': 2.806984672954322, 'bear_tsl_mult': 0.8231324081063466, 'bear_time_stop': 48, 'bear_use_sma': True, 'bear_use_ema': True, 'bear_use_atr': True, 'bear_use_adx': True, 'bear_use_spike': True, 'bear_rsi_required': False, 'sideways_strategy': 'breakout', 'sideways_bb_std_mult': 2.268281444347404, 'sideways_rsi_os': 49, 'sideways_rsi_ob': 55, 'sideways_adx_thresh': 23.531051433621744, 'sideways_atr_min_pct': 0.01872679578923813, 'sideways_atr_max_pct': 0.016995039478185384, 'sideways_tp_mult': 2.0903704123005475, 'sideways_tsl_mult': 0.6956683227482905, 'sideways_time_stop': 57, 'sideways_use_sma': True, 'sideways_use_ema': False, 'sideways_use_atr': False, 'sideways_use_adx': False, 'sideways_use_spike': False, 'sideways_rsi_required': False}.
[I 2025-09-01 10:34:32,696] Trial 549 finished with values: [-1000000000.0, 1000000000.0] and parameters: {'p_sma': 14, 'p_std': 46, 'p_atr': 27, 'p_adx': 10, 'rsi_period': 76, 'ema1': 7, 'ema2': 12, 'slip_atr_k': 0.010651799640434983, 'slip_spread_k': 0.12575046686467206, 'spread_hl_frac': 0.007269324920687098, 'bb_std_mult': 2.7274628215971606, 'rsi_os': 12, 'rsi_ob': 57, 'vol_spike': 0.10637283503996406, 'adx_thresh': 12.741945098872025, 'atr_min_pct': 0.02887515476610773, 'atr_max_pct': 0.059696411743118225, 'tp_mult': 2.850921611007152, 'tsl_mult': 0.7041839752961465, 'strategy': 'breakout', 'time_stop': 141, 'use_sma': True, 'use_atr': True, 'use_adx': False, 'use_ema': False, 'use_spike': True, 'rsi_required': False, 'edge_k': 0.180161869465977, 'edge_cap': 0.5463031647446811, 'bull_strategy': 'mean_reversion', 'bull_bb_std_mult': 3.3812921853159903, 'bull_rsi_os': 39, 'bull_rsi_ob': 82, 'bull_adx_thresh': 12.783084469577346, 'bull_atr_min_pct': 0.007986231916343772, 'bull_atr_max_pct': 0.07666216307216121, 'bull_tp_mult': 2.2248085663803567, 'bull_tsl_mult': 0.3098810400349397, 'bull_time_stop': 249, 'bull_use_sma': True, 'bull_use_ema': False, 'bull_use_atr': True, 'bull_use_adx': False, 'bull_use_spike': False, 'bull_rsi_required': False, 'bear_strategy': 'mean_reversion', 'bear_bb_std_mult': 1.3570826715699187, 'bear_rsi_os': 7, 'bear_rsi_ob': 87, 'bear_adx_thresh': 22.38842286464488, 'bear_atr_min_pct': 0.020488131716719652, 'bear_atr_max_pct': 0.0918070642867031, 'bear_tp_mult': 1.3264972729032247, 'bear_tsl_mult': 0.4003028839926902, 'bear_time_stop': 28, 'bear_use_sma': False, 'bear_use_ema': True, 'bear_use_atr': True, 'bear_use_adx': True, 'bear_use_spike': True, 'bear_rsi_required': False, 'sideways_strategy': 'breakout', 'sideways_bb_std_mult': 2.2634469935135506, 'sideways_rsi_os': 24, 'sideways_rsi_ob': 59, 'sideways_adx_thresh': 32.55541197443399, 'sideways_atr_min_pct': 0.004950587973283014, 'sideways_atr_max_pct': 0.0896124351924969, 'sideways_tp_mult': 1.6371942746296821, 'sideways_tsl_mult': 0.7450608281717143, 'sideways_time_stop': 225, 'sideways_use_sma': True, 'sideways_use_ema': False, 'sideways_use_atr': False, 'sideways_use_adx': True, 'sideways_use_spike': True, 'sideways_rsi_required': False}.
[I 2025-09-01 10:34:33,043] Trial 548 finished with values: [-1000000000.0, 1000000000.0] and parameters: {'p_sma': 43, 'p_std': 46, 'p_atr': 13, 'p_adx': 10, 'rsi_period': 76, 'ema1': 7, 'ema2': 12, 'slip_atr_k': 0.10891887243403905, 'slip_spread_k': 0.5958368437316265, 'spread_hl_frac': 0.03724936367011789, 'bb_std_mult': 2.708067695822334, 'rsi_os': 11, 'rsi_ob': 57, 'vol_spike': 0.2924207994711315, 'adx_thresh': 12.576204397866315, 'atr_min_pct': 0.01822914917200151, 'atr_max_pct': 0.0604684887698069, 'tp_mult': 2.4186502659538114, 'tsl_mult': 0.7636296589345836, 'strategy': 'breakout', 'time_stop': 140, 'use_sma': True, 'use_atr': True, 'use_adx': False, 'use_ema': False, 'use_spike': True, 'rsi_required': False, 'edge_k': 0.6838911261164914, 'edge_cap': 0.8353706569315076, 'bull_strategy': 'mean_reversion', 'bull_bb_std_mult': 3.387990691976378, 'bull_rsi_os': 39, 'bull_rsi_ob': 94, 'bull_adx_thresh': 14.992256522410457, 'bull_atr_min_pct': 0.014584905982561819, 'bull_atr_max_pct': 0.13929171852221606, 'bull_tp_mult': 1.7447603620867729, 'bull_tsl_mult': 0.6425965871153198, 'bull_time_stop': 148, 'bull_use_sma': True, 'bull_use_ema': False, 'bull_use_atr': True, 'bull_use_adx': False, 'bull_use_spike': False, 'bull_rsi_required': False, 'bear_strategy': 'mean_reversion', 'bear_bb_std_mult': 1.4073775006822875, 'bear_rsi_os': 44, 'bear_rsi_ob': 90, 'bear_adx_thresh': 26.105614848392776, 'bear_atr_min_pct': 0.0294125112807116, 'bear_atr_max_pct': 0.13158785553612268, 'bear_tp_mult': 2.960728597597732, 'bear_tsl_mult': 0.8385771020789545, 'bear_time_stop': 11, 'bear_use_sma': False, 'bear_use_ema': True, 'bear_use_atr': True, 'bear_use_adx': True, 'bear_use_spike': True, 'bear_rsi_required': False, 'sideways_strategy': 'breakout', 'sideways_bb_std_mult': 2.038361755560663, 'sideways_rsi_os': 24, 'sideways_rsi_ob': 72, 'sideways_adx_thresh': 32.39233206407775, 'sideways_atr_min_pct': 0.00277666562081794, 'sideways_atr_max_pct': 0.07508687947749582, 'sideways_tp_mult': 1.8760011796868235, 'sideways_tsl_mult': 0.9634211895275466, 'sideways_time_stop': 265, 'sideways_use_sma': True, 'sideways_use_ema': False, 'sideways_use_atr': False, 'sideways_use_adx': True, 'sideways_use_spike': True, 'sideways_rsi_required': False}.
