[I 2025-09-01 09:18:09,617] Trial 99 finished with values: [-0.035309035197290894, 0.03559586908370743] and parameters: {'p_sma': 59, 'p_std': 34, 'p_atr': 13, 'p_adx': 14, 'rsi_period': 37, 'ema1': 23, 'ema2': 13, 'slip_atr_k': 0.006036346444024707, 'slip_spread_k': 0.3908263840067676, 'spread_hl_frac': 0.0029112914254391213, 'bb_std_mult': 2.745659919693141, 'rsi_os': 43, 'rsi_ob': 57, 'vol_spike': 0.28607306667046006, 'adx_thresh': 9.369217966733395, 'atr_min_pct': 0.00949018944941503, 'atr_max_pct': 0.030105511643593163, 'tp_mult': 2.0200825999662473, 'tsl_mult': 0.48266766287505847, 'strategy': 'breakout', 'time_stop': 133, 'use_sma': True, 'use_atr': True, 'use_adx': False, 'use_ema': True, 'use_spike': True, 'rsi_required': True, 'edge_k': 0.7948455150698985, 'edge_cap': 0.47978255437292866, 'bull_strategy': 'mean_reversion', 'bull_bb_std_mult': 1.0437168129863623, 'bull_rsi_os': 36, 'bull_rsi_ob': 91, 'bull_adx_thresh': 14.82993489181793, 'bull_atr_min_pct': 0.007237141552348801, 'bull_atr_max_pct': 0.08407467204861935, 'bull_tp_mult': 2.270632805969321, 'bull_tsl_mult': 0.4056217213360118, 'bull_time_stop': 250, 'bull_use_sma': True, 'bull_use_ema': False, 'bull_use_atr': True, 'bull_use_adx': True, 'bull_use_spike': True, 'bull_rsi_required': False, 'bear_strategy': 'mean_reversion', 'bear_bb_std_mult': 1.2663985849183381, 'bear_rsi_os': 31, 'bear_rsi_ob': 58, 'bear_adx_thresh': 31.055935656357263, 'bear_atr_min_pct': 0.015852862835111215, 'bear_atr_max_pct': 0.1297497460884343, 'bear_tp_mult': 2.860909355663131, 'bear_tsl_mult': 0.4529747310306435, 'bear_time_stop': 205, 'bear_use_sma': False, 'bear_use_ema': False, 'bear_use_atr': True, 'bear_use_adx': True, 'bear_use_spike': False, 'bear_rsi_required': False, 'sideways_strategy': 'breakout', 'sideways_bb_std_mult': 2.274584043370436, 'sideways_rsi_os': 24, 'sideways_rsi_ob': 54, 'sideways_adx_thresh': 21.779687879611128, 'sideways_atr_min_pct': 0.002319681877535794, 'sideways_atr_max_pct': 0.08259733524816766, 'sideways_tp_mult': 1.470096451682841, 'sideways_tsl_mult': 0.636898344702988, 'sideways_time_stop': 156, 'sideways_use_sma': True, 'sideways_use_ema': False, 'sideways_use_atr': False, 'sideways_use_adx': False, 'sideways_use_spike': True, 'sideways_rsi_required': False}.
[I 2025-09-01 09:18:48,209] Trial 100 finished with values: [-1000000000.0, 1000000000.0] and parameters: {'p_sma': 52, 'p_std': 34, 'p_atr': 9, 'p_adx': 17, 'rsi_period': 76, 'ema1': 17, 'ema2': 14, 'slip_atr_k': 0.0036960909106441425, 'slip_spread_k': 0.18566048586459172, 'spread_hl_frac': 0.005070354788385828, 'bb_std_mult': 2.860140650149885, 'rsi_os': 43, 'rsi_ob': 62, 'vol_spike': 0.1399767291329811, 'adx_thresh': 8.094075074663579, 'atr_min_pct': 0.009171608649695746, 'atr_max_pct': 0.1087998743458178, 'tp_mult': 2.0245615960989785, 'tsl_mult': 0.3250461979890414, 'strategy': 'breakout', 'time_stop': 150, 'use_sma': True, 'use_atr': True, 'use_adx': False, 'use_ema': True, 'use_spike': True, 'rsi_required': False, 'edge_k': 1.198276017700636, 'edge_cap': 0.4095611087323905, 'bull_strategy': 'mean_reversion', 'bull_bb_std_mult': 2.153977561780974, 'bull_rsi_os': 54, 'bull_rsi_ob': 92, 'bull_adx_thresh': 14.957776408380253, 'bull_atr_min_pct': 0.007170113211352156, 'bull_atr_max_pct': 0.08539741242027102, 'bull_tp_mult': 2.263382016606512, 'bull_tsl_mult': 0.40949330719988186, 'bull_time_stop': 52, 'bull_use_sma': True, 'bull_use_ema': False, 'bull_use_atr': True, 'bull_use_adx': True, 'bull_use_spike': True, 'bull_rsi_required': False, 'bear_strategy': 'mean_reversion', 'bear_bb_std_mult': 1.5888175720216775, 'bear_rsi_os': 29, 'bear_rsi_ob': 56, 'bear_adx_thresh': 29.553932268745164, 'bear_atr_min_pct': 0.026866789399231202, 'bear_atr_max_pct': 0.12415308690079344, 'bear_tp_mult': 1.2066812257267183, 'bear_tsl_mult': 0.8393466893133411, 'bear_time_stop': 207, 'bear_use_sma': True, 'bear_use_ema': False, 'bear_use_atr': True, 'bear_use_adx': True, 'bear_use_spike': False, 'bear_rsi_required': False, 'sideways_strategy': 'breakout', 'sideways_bb_std_mult': 3.3314062412438776, 'sideways_rsi_os': 24, 'sideways_rsi_ob': 52, 'sideways_adx_thresh': 21.906076585362978, 'sideways_atr_min_pct': 0.02026347545100388, 'sideways_atr_max_pct': 0.13679128809257463, 'sideways_tp_mult': 2.751754437490601, 'sideways_tsl_mult': 0.6376489750393705, 'sideways_time_stop': 233, 'sideways_use_sma': True, 'sideways_use_ema': False, 'sideways_use_atr': False, 'sideways_use_adx': False, 'sideways_use_spike': True, 'sideways_rsi_required': False}.
[I 2025-09-01 09:18:49,126] Trial 103 finished with values: [-1000000000.0, 1000000000.0] and parameters: {'p_sma': 17, 'p_std': 39, 'p_atr': 15, 'p_adx': 8, 'rsi_period': 21, 'ema1': 20, 'ema2': 51, 'slip_atr_k': 0.2016953025185193, 'slip_spread_k': 0.2668659615583855, 'spread_hl_frac': 0.008595824935869772, 'bb_std_mult': 0.6332411285240773, 'rsi_os': 16, 'rsi_ob': 52, 'vol_spike': 0.1412742206933304, 'adx_thresh': 20.51845930854337, 'atr_min_pct': 0.010699604903330181, 'atr_max_pct': 0.10562534645548304, 'tp_mult': 1.0379151461073057, 'tsl_mult': 0.3376806925452958, 'strategy': 'breakout', 'time_stop': 288, 'use_sma': True, 'use_atr': True, 'use_adx': False, 'use_ema': False, 'use_spike': True, 'rsi_required': False, 'edge_k': 1.1984173599847274, 'edge_cap': 0.8627155557947179, 'bull_strategy': 'mean_reversion', 'bull_bb_std_mult': 2.1484636932309, 'bull_rsi_os': 53, 'bull_rsi_ob': 63, 'bull_adx_thresh': 17.292719967854964, 'bull_atr_min_pct': 0.005617132431060087, 'bull_atr_max_pct': 0.046646447250171016, 'bull_tp_mult': 2.4686363477620183, 'bull_tsl_mult': 0.07752550461898744, 'bull_time_stop': 177, 'bull_use_sma': True, 'bull_use_ema': False, 'bull_use_atr': True, 'bull_use_adx': False, 'bull_use_spike': False, 'bull_rsi_required': False, 'bear_strategy': 'breakout', 'bear_bb_std_mult': 1.4974703530246722, 'bear_rsi_os': 29, 'bear_rsi_ob': 76, 'bear_adx_thresh': 29.6072157946603, 'bear_atr_min_pct': 0.02687127815873661, 'bear_atr_max_pct': 0.07399124157294379, 'bear_tp_mult': 1.7772401509092752, 'bear_tsl_mult': 0.9162523805920443, 'bear_time_stop': 225, 'bear_use_sma': True, 'bear_use_ema': False, 'bear_use_atr': True, 'bear_use_adx': False, 'bear_use_spike': False, 'bear_rsi_required': False, 'sideways_strategy': 'mean_reversion', 'sideways_bb_std_mult': 2.478794153498433, 'sideways_rsi_os': 26, 'sideways_rsi_ob': 52, 'sideways_adx_thresh': 29.41158600105415, 'sideways_atr_min_pct': 0.0010451837177895423, 'sideways_atr_max_pct': 0.14096843036979623, 'sideways_tp_mult': 2.722382686991133, 'sideways_tsl_mult': 0.8316507013532687, 'sideways_time_stop': 223, 'sideways_use_sma': True, 'sideways_use_ema': True, 'sideways_use_atr': False, 'sideways_use_adx': False, 'sideways_use_spike': True, 'sideways_rsi_required': False}.
[I 2025-09-01 09:18:49,608] Trial 102 finished with values: [-1000000000.0, 1000000000.0] and parameters: {'p_sma': 13, 'p_std': 39, 'p_atr': 15, 'p_adx': 8, 'rsi_period': 33, 'ema1': 17, 'ema2': 57, 'slip_atr_k': 0.19750785959584008, 'slip_spread_k': 0.18760634762135137, 'spread_hl_frac': 0.023486055600641688, 'bb_std_mult': 0.627450677200277, 'rsi_os': 39, 'rsi_ob': 93, 'vol_spike': 0.09149802528784554, 'adx_thresh': 20.629305296269294, 'atr_min_pct': 0.010673059145927666, 'atr_max_pct': 0.12351078979637065, 'tp_mult': 1.6976095368408837, 'tsl_mult': 0.328592820496363, 'strategy': 'breakout', 'time_stop': 33, 'use_sma': True, 'use_atr': True, 'use_adx': False, 'use_ema': False, 'use_spike': True, 'rsi_required': False, 'edge_k': 1.1862639104734234, 'edge_cap': 0.8817882205865011, 'bull_strategy': 'mean_reversion', 'bull_bb_std_mult': 3.3650059551841656, 'bull_rsi_os': 54, 'bull_rsi_ob': 68, 'bull_adx_thresh': 16.241247712900154, 'bull_atr_min_pct': 0.009413122893426652, 'bull_atr_max_pct': 0.04793396686965707, 'bull_tp_mult': 2.8420428423606774, 'bull_tsl_mult': 0.07327960796705851, 'bull_time_stop': 266, 'bull_use_sma': True, 'bull_use_ema': False, 'bull_use_atr': True, 'bull_use_adx': False, 'bull_use_spike': False, 'bull_rsi_required': False, 'bear_strategy': 'breakout', 'bear_bb_std_mult': 1.5996778914362466, 'bear_rsi_os': 23, 'bear_rsi_ob': 56, 'bear_adx_thresh': 10.715407397387631, 'bear_atr_min_pct': 0.02877536340128803, 'bear_atr_max_pct': 0.07251160842507696, 'bear_tp_mult': 2.3628842458628814, 'bear_tsl_mult': 0.7854050054780066, 'bear_time_stop': 208, 'bear_use_sma': True, 'bear_use_ema': False, 'bear_use_atr': True, 'bear_use_adx': False, 'bear_use_spike': False, 'bear_rsi_required': False, 'sideways_strategy': 'mean_reversion', 'sideways_bb_std_mult': 3.3727843326257645, 'sideways_rsi_os': 26, 'sideways_rsi_ob': 51, 'sideways_adx_thresh': 29.744131432871594, 'sideways_atr_min_pct': 0.01985481610497497, 'sideways_atr_max_pct': 0.09521329811150112, 'sideways_tp_mult': 2.7496270293463656, 'sideways_tsl_mult': 0.8373017966676745, 'sideways_time_stop': 93, 'sideways_use_sma': True, 'sideways_use_ema': True, 'sideways_use_atr': False, 'sideways_use_adx': False, 'sideways_use_spike': True, 'sideways_rsi_required': False}.
[I 2025-09-01 09:18:49,608] Trial 101 finished with values: [-1000000000.0, 1000000000.0] and parameters: {'p_sma': 26, 'p_std': 39, 'p_atr': 15, 'p_adx': 11, 'rsi_period': 76, 'ema1': 20, 'ema2': 52, 'slip_atr_k': 0.17604155941761507, 'slip_spread_k': 0.18049774830711474, 'spread_hl_frac': 0.004047577148662634, 'bb_std_mult': 3.5675764452954697, 'rsi_os': 43, 'rsi_ob': 61, 'vol_spike': 0.1426478852563014, 'adx_thresh': 14.774393841046084, 'atr_min_pct': 0.0059590943164100334, 'atr_max_pct': 0.011472832168869797, 'tp_mult': 1.7072751641512807, 'tsl_mult': 0.33339641548037247, 'strategy': 'breakout', 'time_stop': 162, 'use_sma': True, 'use_atr': False, 'use_adx': False, 'use_ema': True, 'use_spike': True, 'rsi_required': False, 'edge_k': 0.737000166298555, 'edge_cap': 0.47131251327152296, 'bull_strategy': 'mean_reversion', 'bull_bb_std_mult': 2.170052876287865, 'bull_rsi_os': 31, 'bull_rsi_ob': 63, 'bull_adx_thresh': 15.110100919355023, 'bull_atr_min_pct': 0.007236713994098608, 'bull_atr_max_pct': 0.046326903028419034, 'bull_tp_mult': 2.354534924806175, 'bull_tsl_mult': 0.08563735132548894, 'bull_time_stop': 268, 'bull_use_sma': True, 'bull_use_ema': False, 'bull_use_atr': True, 'bull_use_adx': False, 'bull_use_spike': False, 'bull_rsi_required': False, 'bear_strategy': 'breakout', 'bear_bb_std_mult': 1.2745698008774986, 'bear_rsi_os': 29, 'bear_rsi_ob': 58, 'bear_adx_thresh': 10.848283834886685, 'bear_atr_min_pct': 0.00016343857704399084, 'bear_atr_max_pct': 0.12443217913125298, 'bear_tp_mult': 1.1676097570992336, 'bear_tsl_mult': 0.7895889559744104, 'bear_time_stop': 209, 'bear_use_sma': True, 'bear_use_ema': False, 'bear_use_atr': True, 'bear_use_adx': False, 'bear_use_spike': False, 'bear_rsi_required': False, 'sideways_strategy': 'mean_reversion', 'sideways_bb_std_mult': 3.3413703743310528, 'sideways_rsi_os': 27, 'sideways_rsi_ob': 51, 'sideways_adx_thresh': 28.09862327619904, 'sideways_atr_min_pct': 0.0054245686715477534, 'sideways_atr_max_pct': 0.13718759998319732, 'sideways_tp_mult': 2.9253601109147263, 'sideways_tsl_mult': 0.6643397411621951, 'sideways_time_stop': 157, 'sideways_use_sma': True, 'sideways_use_ema': True, 'sideways_use_atr': False, 'sideways_use_adx': False, 'sideways_use_spike': True, 'sideways_rsi_required': False}.
[I 2025-09-01 09:19:30,732] Trial 106 finished with values: [-1000000000.0, 1000000000.0] and parameters: {'p_sma': 30, 'p_std': 46, 'p_atr': 30, 'p_adx': 10, 'rsi_period': 42, 'ema1': 22, 'ema2': 16, 'slip_atr_k': 0.012560884303183696, 'slip_spread_k': 0.25052990718570406, 'spread_hl_frac': 0.048343862961854056, 'bb_std_mult': 1.0140528194659526, 'rsi_os': 41, 'rsi_ob': 54, 'vol_spike': 0.04405687947768365, 'adx_thresh': 10.975877559722424, 'atr_min_pct': 0.02203997839705548, 'atr_max_pct': 0.02394423829119039, 'tp_mult': 1.938109621054883, 'tsl_mult': 0.0538126806478465, 'strategy': 'mean_reversion', 'time_stop': 300, 'use_sma': True, 'use_atr': True, 'use_adx': False, 'use_ema': False, 'use_spike': True, 'rsi_required': False, 'edge_k': 0.25787812272670907, 'edge_cap': 0.12280565049227776, 'bull_strategy': 'mean_reversion', 'bull_bb_std_mult': 2.2627741944961786, 'bull_rsi_os': 46, 'bull_rsi_ob': 57, 'bull_adx_thresh': 19.391014721124822, 'bull_atr_min_pct': 0.0040229225971147265, 'bull_atr_max_pct': 0.03996641152064762, 'bull_tp_mult': 1.8636137009683011, 'bull_tsl_mult': 0.2365409874206877, 'bull_time_stop': 237, 'bull_use_sma': False, 'bull_use_ema': False, 'bull_use_atr': True, 'bull_use_adx': False, 'bull_use_spike': True, 'bull_rsi_required': True, 'bear_strategy': 'breakout', 'bear_bb_std_mult': 2.6257836116757978, 'bear_rsi_os': 33, 'bear_rsi_ob': 46, 'bear_adx_thresh': 33.05438107439173, 'bear_atr_min_pct': 0.028526169342681772, 'bear_atr_max_pct': 0.08417831049759286, 'bear_tp_mult': 1.925386117661001, 'bear_tsl_mult': 0.6872831231223556, 'bear_time_stop': 18, 'bear_use_sma': False, 'bear_use_ema': False, 'bear_use_atr': True, 'bear_use_adx': True, 'bear_use_spike': False, 'bear_rsi_required': False, 'sideways_strategy': 'mean_reversion', 'sideways_bb_std_mult': 1.7092688814967294, 'sideways_rsi_os': 35, 'sideways_rsi_ob': 56, 'sideways_adx_thresh': 24.14738718495747, 'sideways_atr_min_pct': 0.013299766590702401, 'sideways_atr_max_pct': 0.1019162600551273, 'sideways_tp_mult': 1.5736466671677911, 'sideways_tsl_mult': 0.7651050049086945, 'sideways_time_stop': 213, 'sideways_use_sma': True, 'sideways_use_ema': False, 'sideways_use_atr': False, 'sideways_use_adx': False, 'sideways_use_spike': False, 'sideways_rsi_required': False}.
[I 2025-09-01 09:19:32,002] Trial 107 finished with values: [-1000000000.0, 1000000000.0] and parameters: {'p_sma': 56, 'p_std': 27, 'p_atr': 25, 'p_adx': 10, 'rsi_period': 43, 'ema1': 22, 'ema2': 12, 'slip_atr_k': 0.024700045106429442, 'slip_spread_k': 0.1480444297477212, 'spread_hl_frac': 0.04850620109329725, 'bb_std_mult': 1.0387384984413854, 'rsi_os': 7, 'rsi_ob': 56, 'vol_spike': 0.03706285478657301, 'adx_thresh': 25.689404430040902, 'atr_min_pct': 0.022194612342506925, 'atr_max_pct': 0.023479074363345058, 'tp_mult': 1.4083174184765035, 'tsl_mult': 0.04847831983331774, 'strategy': 'mean_reversion', 'time_stop': 212, 'use_sma': True, 'use_atr': True, 'use_adx': False, 'use_ema': False, 'use_spike': True, 'rsi_required': False, 'edge_k': 0.16438612362916105, 'edge_cap': 0.05019490679422628, 'bull_strategy': 'mean_reversion', 'bull_bb_std_mult': 2.273124409765172, 'bull_rsi_os': 28, 'bull_rsi_ob': 46, 'bull_adx_thresh': 19.573336136899425, 'bull_atr_min_pct': 0.029875359522581725, 'bull_atr_max_pct': 0.05927095789490841, 'bull_tp_mult': 2.1403520383678742, 'bull_tsl_mult': 0.5234066795272, 'bull_time_stop': 213, 'bull_use_sma': False, 'bull_use_ema': False, 'bull_use_atr': True, 'bull_use_adx': False, 'bull_use_spike': True, 'bull_rsi_required': True, 'bear_strategy': 'breakout', 'bear_bb_std_mult': 3.4796455779758766, 'bear_rsi_os': 37, 'bear_rsi_ob': 47, 'bear_adx_thresh': 33.054430308083596, 'bear_atr_min_pct': 0.02839950995888509, 'bear_atr_max_pct': 0.01636873599462163, 'bear_tp_mult': 1.3990429727076172, 'bear_tsl_mult': 0.6858917787966174, 'bear_time_stop': 133, 'bear_use_sma': False, 'bear_use_ema': False, 'bear_use_atr': True, 'bear_use_adx': True, 'bear_use_spike': False, 'bear_rsi_required': False, 'sideways_strategy': 'mean_reversion', 'sideways_bb_std_mult': 3.171946872771815, 'sideways_rsi_os': 18, 'sideways_rsi_ob': 56, 'sideways_adx_thresh': 24.439787776164827, 'sideways_atr_min_pct': 0.003356771928994088, 'sideways_atr_max_pct': 0.05516375245348537, 'sideways_tp_mult': 1.5664251711077022, 'sideways_tsl_mult': 0.7609922284475968, 'sideways_time_stop': 228, 'sideways_use_sma': True, 'sideways_use_ema': False, 'sideways_use_atr': False, 'sideways_use_adx': False, 'sideways_use_spike': False, 'sideways_rsi_required': False}.
[I 2025-09-01 09:19:32,695] Trial 105 finished with values: [-1000000000.0, 1000000000.0] and parameters: {'p_sma': 12, 'p_std': 45, 'p_atr': 21, 'p_adx': 11, 'rsi_period': 41, 'ema1': 25, 'ema2': 58, 'slip_atr_k': 0.011784768396333106, 'slip_spread_k': 0.5507813304463816, 'spread_hl_frac': 0.04926793796606231, 'bb_std_mult': 2.35715560836649, 'rsi_os': 39, 'rsi_ob': 56, 'vol_spike': 0.09568296865799164, 'adx_thresh': 6.7054208790611405, 'atr_min_pct': 0.005404746231960866, 'atr_max_pct': 0.025604174885886725, 'tp_mult': 1.918409873561109, 'tsl_mult': 0.39015324854141575, 'strategy': 'mean_reversion', 'time_stop': 159, 'use_sma': True, 'use_atr': True, 'use_adx': False, 'use_ema': False, 'use_spike': True, 'rsi_required': False, 'edge_k': 1.661990218690581, 'edge_cap': 0.12865766116651256, 'bull_strategy': 'mean_reversion', 'bull_bb_std_mult': 3.461886893115967, 'bull_rsi_os': 41, 'bull_rsi_ob': 46, 'bull_adx_thresh': 19.390029525138562, 'bull_atr_min_pct': 0.010488522474325867, 'bull_atr_max_pct': 0.12323774301083802, 'bull_tp_mult': 2.3691866551258935, 'bull_tsl_mult': 0.7869990084884101, 'bull_time_stop': 268, 'bull_use_sma': False, 'bull_use_ema': False, 'bull_use_atr': True, 'bull_use_adx': False, 'bull_use_spike': False, 'bull_rsi_required': True, 'bear_strategy': 'breakout', 'bear_bb_std_mult': 3.3874083340864853, 'bear_rsi_os': 22, 'bear_rsi_ob': 68, 'bear_adx_thresh': 33.48012248223142, 'bear_atr_min_pct': 0.028427517423409092, 'bear_atr_max_pct': 0.10839797707997093, 'bear_tp_mult': 2.3611040198604774, 'bear_tsl_mult': 0.6824706677855359, 'bear_time_stop': 230, 'bear_use_sma': False, 'bear_use_ema': False, 'bear_use_atr': True, 'bear_use_adx': False, 'bear_use_spike': False, 'bear_rsi_required': False, 'sideways_strategy': 'mean_reversion', 'sideways_bb_std_mult': 1.6805826919558862, 'sideways_rsi_os': 18, 'sideways_rsi_ob': 56, 'sideways_adx_thresh': 24.58013176447808, 'sideways_atr_min_pct': 0.024731134692281033, 'sideways_atr_max_pct': 0.09529588862540161, 'sideways_tp_mult': 2.9081543055753274, 'sideways_tsl_mult': 0.8316324397024464, 'sideways_time_stop': 97, 'sideways_use_sma': True, 'sideways_use_ema': True, 'sideways_use_atr': False, 'sideways_use_adx': False, 'sideways_use_spike': False, 'sideways_rsi_required': False}.
[I 2025-09-01 09:19:32,705] Trial 104 finished with values: [-1000000000.0, 1000000000.0] and parameters: {'p_sma': 11, 'p_std': 46, 'p_atr': 25, 'p_adx': 8, 'rsi_period': 42, 'ema1': 22, 'ema2': 16, 'slip_atr_k': 0.010077072608691987, 'slip_spread_k': 0.26544039725996194, 'spread_hl_frac': 0.007393801249315676, 'bb_std_mult': 1.0457448575623987, 'rsi_os': 39, 'rsi_ob': 93, 'vol_spike': 0.14092833444249495, 'adx_thresh': 10.606037992840152, 'atr_min_pct': 0.00540085929774208, 'atr_max_pct': 0.024011122998048088, 'tp_mult': 1.9199690749555662, 'tsl_mult': 0.5075351746771262, 'strategy': 'mean_reversion', 'time_stop': 30, 'use_sma': True, 'use_atr': True, 'use_adx': False, 'use_ema': False, 'use_spike': True, 'rsi_required': False, 'edge_k': 1.8237684235951535, 'edge_cap': 0.13828243293619288, 'bull_strategy': 'mean_reversion', 'bull_bb_std_mult': 1.837682907290291, 'bull_rsi_os': 41, 'bull_rsi_ob': 68, 'bull_adx_thresh': 16.128849364758267, 'bull_atr_min_pct': 0.004064007215308908, 'bull_atr_max_pct': 0.059898549937392236, 'bull_tp_mult': 2.465273249436971, 'bull_tsl_mult': 0.07126673427857483, 'bull_time_stop': 216, 'bull_use_sma': False, 'bull_use_ema': False, 'bull_use_atr': True, 'bull_use_adx': False, 'bull_use_spike': False, 'bull_rsi_required': True, 'bear_strategy': 'breakout', 'bear_bb_std_mult': 3.3741890103181804, 'bear_rsi_os': 33, 'bear_rsi_ob': 71, 'bear_adx_thresh': 33.00941978419796, 'bear_atr_min_pct': 0.02866145424894324, 'bear_atr_max_pct': 0.07380515565164111, 'bear_tp_mult': 2.9000397515705667, 'bear_tsl_mult': 0.927413707516241, 'bear_time_stop': 228, 'bear_use_sma': True, 'bear_use_ema': False, 'bear_use_atr': True, 'bear_use_adx': False, 'bear_use_spike': False, 'bear_rsi_required': False, 'sideways_strategy': 'mean_reversion', 'sideways_bb_std_mult': 1.7087766200568104, 'sideways_rsi_os': 26, 'sideways_rsi_ob': 56, 'sideways_adx_thresh': 24.606919014285115, 'sideways_atr_min_pct': 0.018475433612558035, 'sideways_atr_max_pct': 0.09405425066087782, 'sideways_tp_mult': 1.5750274398634376, 'sideways_tsl_mult': 0.8335399931232126, 'sideways_time_stop': 5, 'sideways_use_sma': True, 'sideways_use_ema': True, 'sideways_use_atr': False, 'sideways_use_adx': False, 'sideways_use_spike': False, 'sideways_rsi_required': False}.
