[I 2025-09-01 09:38:28,404] Trial 222 finished with values: [-1000000000.0, 1000000000.0] and parameters: {'p_sma': 59, 'p_std': 47, 'p_atr': 27, 'p_adx': 11, 'rsi_period': 77, 'ema1': 8, 'ema2': 11, 'slip_atr_k': 0.012676931602330452, 'slip_spread_k': 0.5543345635319143, 'spread_hl_frac': 0.025694767987637427, 'bb_std_mult': 1.9152746193875125, 'rsi_os': 7, 'rsi_ob': 83, 'vol_spike': 0.19644416205675147, 'adx_thresh': 13.374855044971158, 'atr_min_pct': 0.01856097302912338, 'atr_max_pct': 0.06457250307475795, 'tp_mult': 2.5826112212723986, 'tsl_mult': 0.834221090844715, 'strategy': 'breakout', 'time_stop': 6, 'use_sma': True, 'use_atr': True, 'use_adx': False, 'use_ema': False, 'use_spike': True, 'rsi_required': False, 'edge_k': 0.6947942195310272, 'edge_cap': 0.8017227339404549, 'bull_strategy': 'mean_reversion', 'bull_bb_std_mult': 3.4410048939486804, 'bull_rsi_os': 41, 'bull_rsi_ob': 84, 'bull_adx_thresh': 21.472223098321667, 'bull_atr_min_pct': 0.004514008068414139, 'bull_atr_max_pct': 0.08110457239266503, 'bull_tp_mult': 1.7175099192812182, 'bull_tsl_mult': 0.9077607304655023, 'bull_time_stop': 126, 'bull_use_sma': True, 'bull_use_ema': False, 'bull_use_atr': True, 'bull_use_adx': False, 'bull_use_spike': True, 'bull_rsi_required': False, 'bear_strategy': 'mean_reversion', 'bear_bb_std_mult': 2.60929201887129, 'bear_rsi_os': 17, 'bear_rsi_ob': 70, 'bear_adx_thresh': 32.66657296394504, 'bear_atr_min_pct': 0.029044844759494464, 'bear_atr_max_pct': 0.14573937355961136, 'bear_tp_mult': 1.6100269469465947, 'bear_tsl_mult': 0.8026997377256666, 'bear_time_stop': 162, 'bear_use_sma': False, 'bear_use_ema': True, 'bear_use_atr': True, 'bear_use_adx': True, 'bear_use_spike': True, 'bear_rsi_required': False, 'sideways_strategy': 'breakout', 'sideways_bb_std_mult': 2.491730157520512, 'sideways_rsi_os': 31, 'sideways_rsi_ob': 61, 'sideways_adx_thresh': 33.64189351026314, 'sideways_atr_min_pct': 0.0032719918757412344, 'sideways_atr_max_pct': 0.0933062542929323, 'sideways_tp_mult': 1.3522671209804284, 'sideways_tsl_mult': 0.9110859452239884, 'sideways_time_stop': 285, 'sideways_use_sma': True, 'sideways_use_ema': False, 'sideways_use_atr': False, 'sideways_use_adx': False, 'sideways_use_spike': True, 'sideways_rsi_required': False}.
[I 2025-09-01 09:39:09,303] Trial 226 finished with values: [-1000000000.0, 1000000000.0] and parameters: {'p_sma': 22, 'p_std': 23, 'p_atr': 30, 'p_adx': 10, 'rsi_period': 68, 'ema1': 8, 'ema2': 11, 'slip_atr_k': 0.0047320443612904155, 'slip_spread_k': 0.5979821599483357, 'spread_hl_frac': 0.043723165310732615, 'bb_std_mult': 0.5682374355675386, 'rsi_os': 7, 'rsi_ob': 56, 'vol_spike': 0.19510302436228358, 'adx_thresh': 13.439491547159086, 'atr_min_pct': 0.018740686743802103, 'atr_max_pct': 0.06657557722532671, 'tp_mult': 2.483138747114492, 'tsl_mult': 0.8264874896620573, 'strategy': 'breakout', 'time_stop': 204, 'use_sma': False, 'use_atr': True, 'use_adx': False, 'use_ema': False, 'use_spike': True, 'rsi_required': False, 'edge_k': 1.1543281688877864, 'edge_cap': 0.5117329567236458, 'bull_strategy': 'mean_reversion', 'bull_bb_std_mult': 3.12703062063576, 'bull_rsi_os': 40, 'bull_rsi_ob': 79, 'bull_adx_thresh': 7.901810492225774, 'bull_atr_min_pct': 0.022075561083813387, 'bull_atr_max_pct': 0.10861716990549353, 'bull_tp_mult': 1.7026338135713035, 'bull_tsl_mult': 0.9406788887574535, 'bull_time_stop': 142, 'bull_use_sma': True, 'bull_use_ema': False, 'bull_use_atr': True, 'bull_use_adx': False, 'bull_use_spike': True, 'bull_rsi_required': False, 'bear_strategy': 'breakout', 'bear_bb_std_mult': 1.5718593372511442, 'bear_rsi_os': 18, 'bear_rsi_ob': 70, 'bear_adx_thresh': 34.99203273002666, 'bear_atr_min_pct': 0.029161999956663093, 'bear_atr_max_pct': 0.11925972760489094, 'bear_tp_mult': 2.623140230043643, 'bear_tsl_mult': 0.7998545423980561, 'bear_time_stop': 160, 'bear_use_sma': False, 'bear_use_ema': True, 'bear_use_atr': True, 'bear_use_adx': True, 'bear_use_spike': True, 'bear_rsi_required': False, 'sideways_strategy': 'breakout', 'sideways_bb_std_mult': 2.3816680284795253, 'sideways_rsi_os': 31, 'sideways_rsi_ob': 69, 'sideways_adx_thresh': 32.02498651095133, 'sideways_atr_min_pct': 0.006872492369551895, 'sideways_atr_max_pct': 0.09247901216789117, 'sideways_tp_mult': 1.360681620993246, 'sideways_tsl_mult': 0.36127724066748096, 'sideways_time_stop': 243, 'sideways_use_sma': True, 'sideways_use_ema': False, 'sideways_use_atr': False, 'sideways_use_adx': True, 'sideways_use_spike': True, 'sideways_rsi_required': False}.
[I 2025-09-01 09:39:09,918] Trial 229 finished with values: [-0.01245593961557756, 0.012725507729688662] and parameters: {'p_sma': 57, 'p_std': 18, 'p_atr': 10, 'p_adx': 16, 'rsi_period': 44, 'ema1': 7, 'ema2': 27, 'slip_atr_k': 0.0026845646339085935, 'slip_spread_k': 0.6128561030621115, 'spread_hl_frac': 0.008967852999699514, 'bb_std_mult': 2.6548238508786635, 'rsi_os': 17, 'rsi_ob': 57, 'vol_spike': 0.2724119640093774, 'adx_thresh': 10.332378406437098, 'atr_min_pct': 0.026815293731288284, 'atr_max_pct': 0.10379091572245198, 'tp_mult': 2.4783917543068474, 'tsl_mult': 0.8844260732015039, 'strategy': 'breakout', 'time_stop': 136, 'use_sma': False, 'use_atr': True, 'use_adx': False, 'use_ema': False, 'use_spike': False, 'rsi_required': True, 'edge_k': 1.5575766831543563, 'edge_cap': 0.09953661968594113, 'bull_strategy': 'breakout', 'bull_bb_std_mult': 1.214982036840488, 'bull_rsi_os': 38, 'bull_rsi_ob': 79, 'bull_adx_thresh': 25.65841453849583, 'bull_atr_min_pct': 0.0035608044256114466, 'bull_atr_max_pct': 0.07544929105719647, 'bull_tp_mult': 1.1637475941714719, 'bull_tsl_mult': 0.9436572018921645, 'bull_time_stop': 177, 'bull_use_sma': True, 'bull_use_ema': True, 'bull_use_atr': False, 'bull_use_adx': False, 'bull_use_spike': False, 'bull_rsi_required': False, 'bear_strategy': 'breakout', 'bear_bb_std_mult': 2.460018029012261, 'bear_rsi_os': 44, 'bear_rsi_ob': 73, 'bear_adx_thresh': 22.59565049374931, 'bear_atr_min_pct': 0.011984836119503552, 'bear_atr_max_pct': 0.12477577273089474, 'bear_tp_mult': 1.715376318040626, 'bear_tsl_mult': 0.7883413491626381, 'bear_time_stop': 11, 'bear_use_sma': True, 'bear_use_ema': True, 'bear_use_atr': False, 'bear_use_adx': False, 'bear_use_spike': True, 'bear_rsi_required': True, 'sideways_strategy': 'mean_reversion', 'sideways_bb_std_mult': 0.7643765969761007, 'sideways_rsi_os': 28, 'sideways_rsi_ob': 92, 'sideways_adx_thresh': 34.96185971298932, 'sideways_atr_min_pct': 0.025292014703314325, 'sideways_atr_max_pct': 0.08684172654794144, 'sideways_tp_mult': 1.4068846340417187, 'sideways_tsl_mult': 0.22349493073655047, 'sideways_time_stop': 216, 'sideways_use_sma': True, 'sideways_use_ema': True, 'sideways_use_atr': True, 'sideways_use_adx': True, 'sideways_use_spike': True, 'sideways_rsi_required': True}.
[I 2025-09-01 09:39:10,327] Trial 227 finished with values: [-1000000000.0, 1000000000.0] and parameters: {'p_sma': 57, 'p_std': 7, 'p_atr': 30, 'p_adx': 15, 'rsi_period': 77, 'ema1': 8, 'ema2': 33, 'slip_atr_k': 0.013297931343606732, 'slip_spread_k': 0.03532763225841451, 'spread_hl_frac': 0.02562645790984449, 'bb_std_mult': 2.6582112282685846, 'rsi_os': 8, 'rsi_ob': 57, 'vol_spike': 0.1957623441916895, 'adx_thresh': 12.198903305391106, 'atr_min_pct': 0.018818755487386457, 'atr_max_pct': 0.06615047050483597, 'tp_mult': 2.5239998130272197, 'tsl_mult': 0.8734338950261774, 'strategy': 'breakout', 'time_stop': 93, 'use_sma': False, 'use_atr': True, 'use_adx': False, 'use_ema': False, 'use_spike': True, 'rsi_required': False, 'edge_k': 0.6298806662630737, 'edge_cap': 0.15683063406169917, 'bull_strategy': 'mean_reversion', 'bull_bb_std_mult': 3.466801283770288, 'bull_rsi_os': 38, 'bull_rsi_ob': 79, 'bull_adx_thresh': 27.82554570568335, 'bull_atr_min_pct': 0.004879258400761053, 'bull_atr_max_pct': 0.07458651127266426, 'bull_tp_mult': 1.3931116073472516, 'bull_tsl_mult': 0.9399713819753045, 'bull_time_stop': 139, 'bull_use_sma': True, 'bull_use_ema': False, 'bull_use_atr': True, 'bull_use_adx': False, 'bull_use_spike': True, 'bull_rsi_required': False, 'bear_strategy': 'breakout', 'bear_bb_std_mult': 2.5593286932802313, 'bear_rsi_os': 44, 'bear_rsi_ob': 73, 'bear_adx_thresh': 34.40034934037183, 'bear_atr_min_pct': 0.029311731348030313, 'bear_atr_max_pct': 0.06853937043938271, 'bear_tp_mult': 2.8991666383994836, 'bear_tsl_mult': 0.6010353687155215, 'bear_time_stop': 12, 'bear_use_sma': False, 'bear_use_ema': True, 'bear_use_atr': False, 'bear_use_adx': True, 'bear_use_spike': True, 'bear_rsi_required': False, 'sideways_strategy': 'mean_reversion', 'sideways_bb_std_mult': 2.90935971189487, 'sideways_rsi_os': 30, 'sideways_rsi_ob': 92, 'sideways_adx_thresh': 31.887757644416386, 'sideways_atr_min_pct': 0.0254023181111121, 'sideways_atr_max_pct': 0.090285761344053, 'sideways_tp_mult': 1.9163427672732092, 'sideways_tsl_mult': 0.9286159079120091, 'sideways_time_stop': 98, 'sideways_use_sma': True, 'sideways_use_ema': False, 'sideways_use_atr': False, 'sideways_use_adx': True, 'sideways_use_spike': True, 'sideways_rsi_required': False}.
[I 2025-09-01 09:39:10,592] Trial 228 finished with values: [-0.006131268084712982, 0.00668950663347605] and parameters: {'p_sma': 57, 'p_std': 45, 'p_atr': 20, 'p_adx': 16, 'rsi_period': 44, 'ema1': 7, 'ema2': 43, 'slip_atr_k': 0.0032515289037742257, 'slip_spread_k': 0.027649690493270096, 'spread_hl_frac': 0.03625613047726177, 'bb_std_mult': 2.6529848262045332, 'rsi_os': 25, 'rsi_ob': 57, 'vol_spike': 0.2730879679863494, 'adx_thresh': 10.494145365595466, 'atr_min_pct': 0.01993801807838079, 'atr_max_pct': 0.06841347027356211, 'tp_mult': 2.479033051344685, 'tsl_mult': 0.886337760407043, 'strategy': 'breakout', 'time_stop': 225, 'use_sma': False, 'use_atr': True, 'use_adx': False, 'use_ema': False, 'use_spike': False, 'rsi_required': True, 'edge_k': 0.6353958784245938, 'edge_cap': 0.9309120529287442, 'bull_strategy': 'breakout', 'bull_bb_std_mult': 2.8029672524071736, 'bull_rsi_os': 38, 'bull_rsi_ob': 87, 'bull_adx_thresh': 27.429101701401578, 'bull_atr_min_pct': 0.003330584642749189, 'bull_atr_max_pct': 0.07497125169351486, 'bull_tp_mult': 1.1247891053310024, 'bull_tsl_mult': 0.1387047134933227, 'bull_time_stop': 170, 'bull_use_sma': True, 'bull_use_ema': True, 'bull_use_atr': False, 'bull_use_adx': False, 'bull_use_spike': False, 'bull_rsi_required': False, 'bear_strategy': 'breakout', 'bear_bb_std_mult': 2.780666131716526, 'bear_rsi_os': 44, 'bear_rsi_ob': 73, 'bear_adx_thresh': 22.46866036006875, 'bear_atr_min_pct': 0.029378342637040998, 'bear_atr_max_pct': 0.12524360588049677, 'bear_tp_mult': 2.3327381797190863, 'bear_tsl_mult': 0.15857768034306224, 'bear_time_stop': 10, 'bear_use_sma': True, 'bear_use_ema': True, 'bear_use_atr': False, 'bear_use_adx': False, 'bear_use_spike': True, 'bear_rsi_required': True, 'sideways_strategy': 'mean_reversion', 'sideways_bb_std_mult': 2.3927860047621943, 'sideways_rsi_os': 15, 'sideways_rsi_ob': 79, 'sideways_adx_thresh': 31.970069433030947, 'sideways_atr_min_pct': 0.02541975191522934, 'sideways_atr_max_pct': 0.041298990430047346, 'sideways_tp_mult': 1.2573097534112645, 'sideways_tsl_mult': 0.36064516508817707, 'sideways_time_stop': 6, 'sideways_use_sma': True, 'sideways_use_ema': True, 'sideways_use_atr': True, 'sideways_use_adx': True, 'sideways_use_spike': True, 'sideways_rsi_required': True}.
[I 2025-09-01 09:39:54,371] Trial 233 finished with values: [-0.014395685412166181, 0.014430115110100061] and parameters: {'p_sma': 60, 'p_std': 45, 'p_atr': 28, 'p_adx': 22, 'rsi_period': 7, 'ema1': 18, 'ema2': 10, 'slip_atr_k': 0.24810052059777052, 'slip_spread_k': 0.00027639243865090757, 'spread_hl_frac': 0.007488993930397911, 'bb_std_mult': 2.7996052403353597, 'rsi_os': 54, 'rsi_ob': 53, 'vol_spike': 0.18543764364290904, 'adx_thresh': 12.587931325216793, 'atr_min_pct': 0.019963359730760813, 'atr_max_pct': 0.06931199981511849, 'tp_mult': 2.6128379585475967, 'tsl_mult': 0.07476474856762633, 'strategy': 'breakout', 'time_stop': 213, 'use_sma': True, 'use_atr': False, 'use_adx': True, 'use_ema': True, 'use_spike': True, 'rsi_required': True, 'edge_k': 0.9241440653133198, 'edge_cap': 0.8768607882278703, 'bull_strategy': 'mean_reversion', 'bull_bb_std_mult': 2.6245669137093564, 'bull_rsi_os': 55, 'bull_rsi_ob': 77, 'bull_adx_thresh': 33.34962516633679, 'bull_atr_min_pct': 0.02717728057804185, 'bull_atr_max_pct': 0.07760058361806407, 'bull_tp_mult': 1.5321583292149896, 'bull_tsl_mult': 0.1793628432641458, 'bull_time_stop': 167, 'bull_use_sma': True, 'bull_use_ema': False, 'bull_use_atr': False, 'bull_use_adx': True, 'bull_use_spike': False, 'bull_rsi_required': True, 'bear_strategy': 'breakout', 'bear_bb_std_mult': 1.5638362602720335, 'bear_rsi_os': 54, 'bear_rsi_ob': 68, 'bear_adx_thresh': 33.893137350019806, 'bear_atr_min_pct': 0.026707792678329068, 'bear_atr_max_pct': 0.1373930816941045, 'bear_tp_mult': 2.8544958851592606, 'bear_tsl_mult': 0.8219101545800566, 'bear_time_stop': 9, 'bear_use_sma': True, 'bear_use_ema': True, 'bear_use_atr': True, 'bear_use_adx': True, 'bear_use_spike': True, 'bear_rsi_required': True, 'sideways_strategy': 'mean_reversion', 'sideways_bb_std_mult': 3.0952993329448897, 'sideways_rsi_os': 15, 'sideways_rsi_ob': 60, 'sideways_adx_thresh': 32.94392473209974, 'sideways_atr_min_pct': 0.002350615909911626, 'sideways_atr_max_pct': 0.08316928921031812, 'sideways_tp_mult': 2.2478808911605097, 'sideways_tsl_mult': 0.667416622311777, 'sideways_time_stop': 224, 'sideways_use_sma': False, 'sideways_use_ema': False, 'sideways_use_atr': True, 'sideways_use_adx': False, 'sideways_use_spike': True, 'sideways_rsi_required': True}.
[I 2025-09-01 09:39:55,063] Trial 231 finished with values: [-1000000000.0, 1000000000.0] and parameters: {'p_sma': 26, 'p_std': 57, 'p_atr': 28, 'p_adx': 12, 'rsi_period': 51, 'ema1': 13, 'ema2': 48, 'slip_atr_k': 0.137113538708698, 'slip_spread_k': 0.07307473392374741, 'spread_hl_frac': 0.010840840806753032, 'bb_std_mult': 2.7699973236488984, 'rsi_os': 30, 'rsi_ob': 71, 'vol_spike': 0.18488966037258078, 'adx_thresh': 12.415993987716877, 'atr_min_pct': 0.007706408245926876, 'atr_max_pct': 0.0504589380009582, 'tp_mult': 2.9333158062923945, 'tsl_mult': 0.18854809856036664, 'strategy': 'breakout', 'time_stop': 82, 'use_sma': True, 'use_atr': False, 'use_adx': True, 'use_ema': True, 'use_spike': True, 'rsi_required': False, 'edge_k': 0.8999375527799205, 'edge_cap': 0.15077129439790055, 'bull_strategy': 'mean_reversion', 'bull_bb_std_mult': 2.608590285104677, 'bull_rsi_os': 43, 'bull_rsi_ob': 77, 'bull_adx_thresh': 29.05706772845276, 'bull_atr_min_pct': 0.00514026446381137, 'bull_atr_max_pct': 0.07771121309846149, 'bull_tp_mult': 1.385424078438687, 'bull_tsl_mult': 0.17373014653146562, 'bull_time_stop': 45, 'bull_use_sma': True, 'bull_use_ema': False, 'bull_use_atr': True, 'bull_use_adx': True, 'bull_use_spike': True, 'bull_rsi_required': True, 'bear_strategy': 'breakout', 'bear_bb_std_mult': 1.528442432723729, 'bear_rsi_os': 54, 'bear_rsi_ob': 73, 'bear_adx_thresh': 12.065501073163404, 'bear_atr_min_pct': 0.028625819154232686, 'bear_atr_max_pct': 0.05058736646068268, 'bear_tp_mult': 2.8471643862922407, 'bear_tsl_mult': 0.8215777564357061, 'bear_time_stop': 9, 'bear_use_sma': False, 'bear_use_ema': True, 'bear_use_atr': False, 'bear_use_adx': True, 'bear_use_spike': True, 'bear_rsi_required': True, 'sideways_strategy': 'mean_reversion', 'sideways_bb_std_mult': 2.901082467973917, 'sideways_rsi_os': 15, 'sideways_rsi_ob': 79, 'sideways_adx_thresh': 31.600914423621028, 'sideways_atr_min_pct': 0.009823455860719752, 'sideways_atr_max_pct': 0.08228418893927586, 'sideways_tp_mult': 1.2571962872013875, 'sideways_tsl_mult': 0.18913077048425886, 'sideways_time_stop': 223, 'sideways_use_sma': False, 'sideways_use_ema': False, 'sideways_use_atr': True, 'sideways_use_adx': False, 'sideways_use_spike': True, 'sideways_rsi_required': True}.
[I 2025-09-01 09:39:55,949] Trial 232 finished with values: [-1000000000.0, 1000000000.0] and parameters: {'p_sma': 8, 'p_std': 43, 'p_atr': 29, 'p_adx': 10, 'rsi_period': 41, 'ema1': 9, 'ema2': 10, 'slip_atr_k': 0.12517764586395233, 'slip_spread_k': 0.563023095706508, 'spread_hl_frac': 0.04522073715206471, 'bb_std_mult': 2.7974801001831437, 'rsi_os': 30, 'rsi_ob': 71, 'vol_spike': 0.08838442518288464, 'adx_thresh': 29.366710211732872, 'atr_min_pct': 0.007722174199689633, 'atr_max_pct': 0.09500741080085395, 'tp_mult': 2.9465657395973457, 'tsl_mult': 0.9301729793467748, 'strategy': 'breakout', 'time_stop': 213, 'use_sma': True, 'use_atr': False, 'use_adx': True, 'use_ema': True, 'use_spike': True, 'rsi_required': False, 'edge_k': 0.06668714383993846, 'edge_cap': 0.8836185356903706, 'bull_strategy': 'mean_reversion', 'bull_bb_std_mult': 2.591235524290206, 'bull_rsi_os': 42, 'bull_rsi_ob': 87, 'bull_adx_thresh': 32.94094507111228, 'bull_atr_min_pct': 0.005217595750096241, 'bull_atr_max_pct': 0.11932257269902824, 'bull_tp_mult': 1.432633918808436, 'bull_tsl_mult': 0.17561759453852138, 'bull_time_stop': 161, 'bull_use_sma': True, 'bull_use_ema': False, 'bull_use_atr': False, 'bull_use_adx': True, 'bull_use_spike': True, 'bull_rsi_required': True, 'bear_strategy': 'breakout', 'bear_bb_std_mult': 1.5588799720872928, 'bear_rsi_os': 47, 'bear_rsi_ob': 68, 'bear_adx_thresh': 9.007647416344504, 'bear_atr_min_pct': 0.026698304568586198, 'bear_atr_max_pct': 0.05969403439910783, 'bear_tp_mult': 1.4725550449324163, 'bear_tsl_mult': 0.8224136386618491, 'bear_time_stop': 77, 'bear_use_sma': True, 'bear_use_ema': True, 'bear_use_atr': True, 'bear_use_adx': True, 'bear_use_spike': True, 'bear_rsi_required': True, 'sideways_strategy': 'mean_reversion', 'sideways_bb_std_mult': 3.4008784466022304, 'sideways_rsi_os': 51, 'sideways_rsi_ob': 59, 'sideways_adx_thresh': 13.79970583313822, 'sideways_atr_min_pct': 0.016368039027452385, 'sideways_atr_max_pct': 0.11686893812071994, 'sideways_tp_mult': 2.2340183580538135, 'sideways_tsl_mult': 0.9485654639174389, 'sideways_time_stop': 7, 'sideways_use_sma': False, 'sideways_use_ema': False, 'sideways_use_atr': True, 'sideways_use_adx': False, 'sideways_use_spike': True, 'sideways_rsi_required': True}.
[I 2025-09-01 09:39:56,404] Trial 230 finished with values: [-0.020284880884543055, 0.020145134353065496] and parameters: {'p_sma': 57, 'p_std': 7, 'p_atr': 28, 'p_adx': 15, 'rsi_period': 44, 'ema1': 29, 'ema2': 25, 'slip_atr_k': 0.2440837392596328, 'slip_spread_k': 0.04266595111672983, 'spread_hl_frac': 0.00029400250139896295, 'bb_std_mult': 2.662892840793899, 'rsi_os': 25, 'rsi_ob': 57, 'vol_spike': 0.2704713303490163, 'adx_thresh': 12.303121942093027, 'atr_min_pct': 0.021883342690989648, 'atr_max_pct': 0.07109429619337208, 'tp_mult': 1.3201607263243444, 'tsl_mult': 0.8815196475428254, 'strategy': 'breakout', 'time_stop': 225, 'use_sma': False, 'use_atr': False, 'use_adx': True, 'use_ema': False, 'use_spike': False, 'rsi_required': True, 'edge_k': 0.8918972139457843, 'edge_cap': 0.09485101946841884, 'bull_strategy': 'breakout', 'bull_bb_std_mult': 3.3744069170639914, 'bull_rsi_os': 38, 'bull_rsi_ob': 77, 'bull_adx_thresh': 33.390888334378616, 'bull_atr_min_pct': 0.0034267114627348928, 'bull_atr_max_pct': 0.07493325589226202, 'bull_tp_mult': 1.3814693843599988, 'bull_tsl_mult': 0.9422428096390343, 'bull_time_stop': 161, 'bull_use_sma': True, 'bull_use_ema': True, 'bull_use_atr': False, 'bull_use_adx': True, 'bull_use_spike': False, 'bull_rsi_required': True, 'bear_strategy': 'breakout', 'bear_bb_std_mult': 1.5334939791271078, 'bear_rsi_os': 44, 'bear_rsi_ob': 73, 'bear_adx_thresh': 9.138455043444106, 'bear_atr_min_pct': 0.02879961516974127, 'bear_atr_max_pct': 0.13783003284734444, 'bear_tp_mult': 2.903068300335972, 'bear_tsl_mult': 0.8185875724967101, 'bear_time_stop': 10, 'bear_use_sma': True, 'bear_use_ema': True, 'bear_use_atr': False, 'bear_use_adx': False, 'bear_use_spike': True, 'bear_rsi_required': True, 'sideways_strategy': 'mean_reversion', 'sideways_bb_std_mult': 0.7842907847277492, 'sideways_rsi_os': 38, 'sideways_rsi_ob': 60, 'sideways_adx_thresh': 14.703359619747104, 'sideways_atr_min_pct': 0.009979961788766973, 'sideways_atr_max_pct': 0.08920539915630285, 'sideways_tp_mult': 2.685021424560145, 'sideways_tsl_mult': 0.9505576242045797, 'sideways_time_stop': 6, 'sideways_use_sma': False, 'sideways_use_ema': True, 'sideways_use_atr': True, 'sideways_use_adx': True, 'sideways_use_spike': True, 'sideways_rsi_required': True}.
