[I 2025-09-01 10:14:12,115] Trial 430 finished with values: [-1000000000.0, 1000000000.0] and parameters: {'p_sma': 40, 'p_std': 25, 'p_atr': 28, 'p_adx': 19, 'rsi_period': 65, 'ema1': 17, 'ema2': 31, 'slip_atr_k': 0.11137365714316311, 'slip_spread_k': 0.5427191161627424, 'spread_hl_frac': 0.006116598842465619, 'bb_std_mult': 2.516833070277466, 'rsi_os': 10, 'rsi_ob': 54, 'vol_spike': 0.2772788734118878, 'adx_thresh': 18.062111839588738, 'atr_min_pct': 0.014303703444642539, 'atr_max_pct': 0.06871240260319038, 'tp_mult': 2.4766205877701513, 'tsl_mult': 0.06257777765162631, 'strategy': 'breakout', 'time_stop': 159, 'use_sma': True, 'use_atr': True, 'use_adx': False, 'use_ema': False, 'use_spike': True, 'rsi_required': False, 'edge_k': 0.6718539932605421, 'edge_cap': 0.8416860824846492, 'bull_strategy': 'mean_reversion', 'bull_bb_std_mult': 2.8692742533109556, 'bull_rsi_os': 30, 'bull_rsi_ob': 81, 'bull_adx_thresh': 33.167583315682926, 'bull_atr_min_pct': 0.004494025591763162, 'bull_atr_max_pct': 0.07174135535600892, 'bull_tp_mult': 1.4756878971129712, 'bull_tsl_mult': 0.7460771311216983, 'bull_time_stop': 130, 'bull_use_sma': True, 'bull_use_ema': False, 'bull_use_atr': True, 'bull_use_adx': False, 'bull_use_spike': True, 'bull_rsi_required': False, 'bear_strategy': 'breakout', 'bear_bb_std_mult': 1.296677853775305, 'bear_rsi_os': 43, 'bear_rsi_ob': 71, 'bear_adx_thresh': 14.20471967128225, 'bear_atr_min_pct': 0.02860501710906081, 'bear_atr_max_pct': 0.13543192005828036, 'bear_tp_mult': 2.860573340325761, 'bear_tsl_mult': 0.8977465312807363, 'bear_time_stop': 122, 'bear_use_sma': True, 'bear_use_ema': True, 'bear_use_atr': True, 'bear_use_adx': True, 'bear_use_spike': True, 'bear_rsi_required': False, 'sideways_strategy': 'mean_reversion', 'sideways_bb_std_mult': 2.574175470783936, 'sideways_rsi_os': 29, 'sideways_rsi_ob': 66, 'sideways_adx_thresh': 7.240696323504784, 'sideways_atr_min_pct': 0.0023192189502345313, 'sideways_atr_max_pct': 0.08676085849482347, 'sideways_tp_mult': 1.3254932995115851, 'sideways_tsl_mult': 0.9828677096068508, 'sideways_time_stop': 232, 'sideways_use_sma': True, 'sideways_use_ema': False, 'sideways_use_atr': False, 'sideways_use_adx': False, 'sideways_use_spike': True, 'sideways_rsi_required': False}.
[I 2025-09-01 10:14:12,451] Trial 432 finished with values: [-0.008409866853082315, 0.008695448366624324] and parameters: {'p_sma': 60, 'p_std': 25, 'p_atr': 28, 'p_adx': 29, 'rsi_period': 41, 'ema1': 9, 'ema2': 16, 'slip_atr_k': 0.1755200581867813, 'slip_spread_k': 0.41728184828353854, 'spread_hl_frac': 0.007130625193795777, 'bb_std_mult': 1.253128702843045, 'rsi_os': 50, 'rsi_ob': 51, 'vol_spike': 0.1863375277092258, 'adx_thresh': 12.072352189851783, 'atr_min_pct': 0.018255689716128922, 'atr_max_pct': 0.1495500462485979, 'tp_mult': 1.210610617134619, 'tsl_mult': 0.49556949106860787, 'strategy': 'breakout', 'time_stop': 293, 'use_sma': True, 'use_atr': True, 'use_adx': False, 'use_ema': True, 'use_spike': True, 'rsi_required': False, 'edge_k': 0.6101021706230613, 'edge_cap': 0.8677775451839378, 'bull_strategy': 'mean_reversion', 'bull_bb_std_mult': 3.3446909338518758, 'bull_rsi_os': 38, 'bull_rsi_ob': 81, 'bull_adx_thresh': 27.920984236870083, 'bull_atr_min_pct': 0.02704358435034326, 'bull_atr_max_pct': 0.09448346946733248, 'bull_tp_mult': 1.4858855225015626, 'bull_tsl_mult': 0.03799713879061534, 'bull_time_stop': 258, 'bull_use_sma': True, 'bull_use_ema': False, 'bull_use_atr': True, 'bull_use_adx': False, 'bull_use_spike': True, 'bull_rsi_required': False, 'bear_strategy': 'breakout', 'bear_bb_std_mult': 3.449017269862888, 'bear_rsi_os': 14, 'bear_rsi_ob': 56, 'bear_adx_thresh': 21.788182641837253, 'bear_atr_min_pct': 0.008139985574927825, 'bear_atr_max_pct': 0.13293040072548784, 'bear_tp_mult': 1.8128259496794048, 'bear_tsl_mult': 0.8955752842636563, 'bear_time_stop': 16, 'bear_use_sma': True, 'bear_use_ema': True, 'bear_use_atr': True, 'bear_use_adx': True, 'bear_use_spike': True, 'bear_rsi_required': False, 'sideways_strategy': 'mean_reversion', 'sideways_bb_std_mult': 2.5689246710933102, 'sideways_rsi_os': 29, 'sideways_rsi_ob': 66, 'sideways_adx_thresh': 18.20788127661354, 'sideways_atr_min_pct': 0.002199097218067824, 'sideways_atr_max_pct': 0.10807282840567364, 'sideways_tp_mult': 2.5105641222485553, 'sideways_tsl_mult': 0.48567535691557684, 'sideways_time_stop': 112, 'sideways_use_sma': True, 'sideways_use_ema': False, 'sideways_use_atr': False, 'sideways_use_adx': False, 'sideways_use_spike': True, 'sideways_rsi_required': False}.
[I 2025-09-01 10:14:52,750] Trial 437 finished with values: [-1000000000.0, 1000000000.0] and parameters: {'p_sma': 59, 'p_std': 59, 'p_atr': 9, 'p_adx': 11, 'rsi_period': 44, 'ema1': 29, 'ema2': 10, 'slip_atr_k': 0.01829275223688591, 'slip_spread_k': 0.563438372831156, 'spread_hl_frac': 0.010094809319691674, 'bb_std_mult': 2.633287692169314, 'rsi_os': 6, 'rsi_ob': 49, 'vol_spike': 0.20250331118026496, 'adx_thresh': 33.34127181928956, 'atr_min_pct': 0.009102893426164858, 'atr_max_pct': 0.06445549337079737, 'tp_mult': 2.220233177707987, 'tsl_mult': 0.3049186014531703, 'strategy': 'breakout', 'time_stop': 84, 'use_sma': True, 'use_atr': True, 'use_adx': True, 'use_ema': False, 'use_spike': True, 'rsi_required': False, 'edge_k': 1.8542439235881987, 'edge_cap': 0.8189464775532291, 'bull_strategy': 'mean_reversion', 'bull_bb_std_mult': 1.6205612671918515, 'bull_rsi_os': 41, 'bull_rsi_ob': 72, 'bull_adx_thresh': 19.769264752680733, 'bull_atr_min_pct': 0.0046032562733736805, 'bull_atr_max_pct': 0.07617604562393011, 'bull_tp_mult': 1.588799920337255, 'bull_tsl_mult': 0.9373864380518533, 'bull_time_stop': 173, 'bull_use_sma': False, 'bull_use_ema': False, 'bull_use_atr': True, 'bull_use_adx': False, 'bull_use_spike': False, 'bull_rsi_required': True, 'bear_strategy': 'mean_reversion', 'bear_bb_std_mult': 3.292822827561711, 'bear_rsi_os': 44, 'bear_rsi_ob': 49, 'bear_adx_thresh': 18.624781663297316, 'bear_atr_min_pct': 0.026609444680018152, 'bear_atr_max_pct': 0.11840707926616212, 'bear_tp_mult': 2.9035401077468115, 'bear_tsl_mult': 0.7902921186658254, 'bear_time_stop': 252, 'bear_use_sma': False, 'bear_use_ema': True, 'bear_use_atr': True, 'bear_use_adx': True, 'bear_use_spike': False, 'bear_rsi_required': False, 'sideways_strategy': 'mean_reversion', 'sideways_bb_std_mult': 2.919365688687985, 'sideways_rsi_os': 16, 'sideways_rsi_ob': 77, 'sideways_adx_thresh': 33.92623327953998, 'sideways_atr_min_pct': 0.008677080001652503, 'sideways_atr_max_pct': 0.08952242249154631, 'sideways_tp_mult': 1.3766109770996013, 'sideways_tsl_mult': 0.9201755787699145, 'sideways_time_stop': 206, 'sideways_use_sma': False, 'sideways_use_ema': False, 'sideways_use_atr': False, 'sideways_use_adx': True, 'sideways_use_spike': True, 'sideways_rsi_required': False}.
[I 2025-09-01 10:14:53,834] Trial 434 finished with values: [-1000000000.0, 1000000000.0] and parameters: {'p_sma': 10, 'p_std': 17, 'p_atr': 29, 'p_adx': 11, 'rsi_period': 37, 'ema1': 25, 'ema2': 10, 'slip_atr_k': 0.10762940088589223, 'slip_spread_k': 0.8299530013083174, 'spread_hl_frac': 0.006997032342102702, 'bb_std_mult': 3.2943599667950068, 'rsi_os': 6, 'rsi_ob': 49, 'vol_spike': 0.20358657335371988, 'adx_thresh': 13.041845608836578, 'atr_min_pct': 0.018232789261155444, 'atr_max_pct': 0.11729567328140857, 'tp_mult': 2.4705761712476506, 'tsl_mult': 0.6580727095557001, 'strategy': 'breakout', 'time_stop': 15, 'use_sma': True, 'use_atr': True, 'use_adx': False, 'use_ema': False, 'use_spike': True, 'rsi_required': False, 'edge_k': 1.0877265643138958, 'edge_cap': 0.8252894174283718, 'bull_strategy': 'mean_reversion', 'bull_bb_std_mult': 3.3568725110056326, 'bull_rsi_os': 23, 'bull_rsi_ob': 81, 'bull_adx_thresh': 11.477212193562789, 'bull_atr_min_pct': 0.004464809097581873, 'bull_atr_max_pct': 0.07727619434036066, 'bull_tp_mult': 1.587077411375864, 'bull_tsl_mult': 0.7453697194586473, 'bull_time_stop': 32, 'bull_use_sma': False, 'bull_use_ema': False, 'bull_use_atr': True, 'bull_use_adx': False, 'bull_use_spike': True, 'bull_rsi_required': False, 'bear_strategy': 'mean_reversion', 'bear_bb_std_mult': 2.270788613830927, 'bear_rsi_os': 43, 'bear_rsi_ob': 50, 'bear_adx_thresh': 18.561740666103574, 'bear_atr_min_pct': 0.008068687699679878, 'bear_atr_max_pct': 0.13218978416546134, 'bear_tp_mult': 1.1597076533172987, 'bear_tsl_mult': 0.13591517419565985, 'bear_time_stop': 16, 'bear_use_sma': False, 'bear_use_ema': True, 'bear_use_atr': True, 'bear_use_adx': True, 'bear_use_spike': False, 'bear_rsi_required': False, 'sideways_strategy': 'mean_reversion', 'sideways_bb_std_mult': 2.587476096667362, 'sideways_rsi_os': 27, 'sideways_rsi_ob': 59, 'sideways_adx_thresh': 30.29008700574276, 'sideways_atr_min_pct': 0.016267378977219644, 'sideways_atr_max_pct': 0.028510118485252173, 'sideways_tp_mult': 2.7819579131438577, 'sideways_tsl_mult': 0.47955506570087136, 'sideways_time_stop': 224, 'sideways_use_sma': False, 'sideways_use_ema': False, 'sideways_use_atr': False, 'sideways_use_adx': False, 'sideways_use_spike': True, 'sideways_rsi_required': False}.
[I 2025-09-01 10:14:54,323] Trial 435 finished with values: [-1000000000.0, 1000000000.0] and parameters: {'p_sma': 7, 'p_std': 17, 'p_atr': 29, 'p_adx': 11, 'rsi_period': 41, 'ema1': 9, 'ema2': 10, 'slip_atr_k': 0.13639538857842393, 'slip_spread_k': 0.560021011551692, 'spread_hl_frac': 0.009566137466813429, 'bb_std_mult': 2.7709207712420443, 'rsi_os': 6, 'rsi_ob': 65, 'vol_spike': 0.2027488652357979, 'adx_thresh': 12.106056048133444, 'atr_min_pct': 0.020075669356761125, 'atr_max_pct': 0.1006969109807459, 'tp_mult': 2.7861129373893023, 'tsl_mult': 0.4619324360386472, 'strategy': 'breakout', 'time_stop': 52, 'use_sma': True, 'use_atr': True, 'use_adx': False, 'use_ema': False, 'use_spike': True, 'rsi_required': False, 'edge_k': 0.5957788280953471, 'edge_cap': 0.38927051144686, 'bull_strategy': 'mean_reversion', 'bull_bb_std_mult': 3.3453181505308454, 'bull_rsi_os': 38, 'bull_rsi_ob': 78, 'bull_adx_thresh': 27.959388397477923, 'bull_atr_min_pct': 0.0029973707615573095, 'bull_atr_max_pct': 0.13024146726825822, 'bull_tp_mult': 1.6738500431420826, 'bull_tsl_mult': 0.6406299829126196, 'bull_time_stop': 32, 'bull_use_sma': True, 'bull_use_ema': False, 'bull_use_atr': True, 'bull_use_adx': False, 'bull_use_spike': True, 'bull_rsi_required': False, 'bear_strategy': 'mean_reversion', 'bear_bb_std_mult': 1.8600045950399768, 'bear_rsi_os': 30, 'bear_rsi_ob': 80, 'bear_adx_thresh': 11.61544233069317, 'bear_atr_min_pct': 0.02666806222545056, 'bear_atr_max_pct': 0.09284924439186895, 'bear_tp_mult': 1.1603096003824547, 'bear_tsl_mult': 0.7906158212360762, 'bear_time_stop': 20, 'bear_use_sma': False, 'bear_use_ema': True, 'bear_use_atr': True, 'bear_use_adx': True, 'bear_use_spike': False, 'bear_rsi_required': False, 'sideways_strategy': 'mean_reversion', 'sideways_bb_std_mult': 2.3181582020417175, 'sideways_rsi_os': 49, 'sideways_rsi_ob': 77, 'sideways_adx_thresh': 29.072559036623197, 'sideways_atr_min_pct': 0.01634802072343553, 'sideways_atr_max_pct': 0.044077593292028816, 'sideways_tp_mult': 2.1261137328713424, 'sideways_tsl_mult': 0.10615801079244125, 'sideways_time_stop': 111, 'sideways_use_sma': False, 'sideways_use_ema': False, 'sideways_use_atr': False, 'sideways_use_adx': False, 'sideways_use_spike': True, 'sideways_rsi_required': False}.
[I 2025-09-01 10:14:54,812] Trial 436 finished with values: [-0.005946100903912899, 0.00583755332764326] and parameters: {'p_sma': 22, 'p_std': 44, 'p_atr': 13, 'p_adx': 11, 'rsi_period': 41, 'ema1': 9, 'ema2': 10, 'slip_atr_k': 0.013571213007469385, 'slip_spread_k': 0.406755795585938, 'spread_hl_frac': 0.009708530675626487, 'bb_std_mult': 2.483271338760347, 'rsi_os': 6, 'rsi_ob': 51, 'vol_spike': 0.006518264343488983, 'adx_thresh': 23.65205176179669, 'atr_min_pct': 0.019859312367273573, 'atr_max_pct': 0.03411588522615941, 'tp_mult': 1.350989118953441, 'tsl_mult': 0.8142892266254019, 'strategy': 'breakout', 'time_stop': 82, 'use_sma': True, 'use_atr': True, 'use_adx': False, 'use_ema': False, 'use_spike': True, 'rsi_required': False, 'edge_k': 0.6042449652513152, 'edge_cap': 0.6428469892754418, 'bull_strategy': 'mean_reversion', 'bull_bb_std_mult': 3.3366970461627488, 'bull_rsi_os': 38, 'bull_rsi_ob': 48, 'bull_adx_thresh': 27.559750884874678, 'bull_atr_min_pct': 0.002912706837346359, 'bull_atr_max_pct': 0.0774278786019459, 'bull_tp_mult': 1.5868050142862076, 'bull_tsl_mult': 0.8343929814543978, 'bull_time_stop': 190, 'bull_use_sma': True, 'bull_use_ema': False, 'bull_use_atr': True, 'bull_use_adx': False, 'bull_use_spike': True, 'bull_rsi_required': False, 'bear_strategy': 'mean_reversion', 'bear_bb_std_mult': 1.8545016807747445, 'bear_rsi_os': 22, 'bear_rsi_ob': 60, 'bear_adx_thresh': 11.57432825252671, 'bear_atr_min_pct': 0.026664587761527213, 'bear_atr_max_pct': 0.11779981793114737, 'bear_tp_mult': 1.8223375018076882, 'bear_tsl_mult': 0.5585098898811391, 'bear_time_stop': 168, 'bear_use_sma': False, 'bear_use_ema': True, 'bear_use_atr': True, 'bear_use_adx': True, 'bear_use_spike': False, 'bear_rsi_required': False, 'sideways_strategy': 'mean_reversion', 'sideways_bb_std_mult': 2.304873955342675, 'sideways_rsi_os': 30, 'sideways_rsi_ob': 85, 'sideways_adx_thresh': 16.804441909373832, 'sideways_atr_min_pct': 0.01621097229388512, 'sideways_atr_max_pct': 0.10860687611218474, 'sideways_tp_mult': 2.1124888554826553, 'sideways_tsl_mult': 0.9209549596978659, 'sideways_time_stop': 205, 'sideways_use_sma': False, 'sideways_use_ema': False, 'sideways_use_atr': False, 'sideways_use_adx': False, 'sideways_use_spike': True, 'sideways_rsi_required': False}.
[I 2025-09-01 10:15:35,525] Trial 441 finished with values: [-0.0037869382615277614, 0.004761069969628315] and parameters: {'p_sma': 27, 'p_std': 43, 'p_atr': 23, 'p_adx': 11, 'rsi_period': 45, 'ema1': 10, 'ema2': 12, 'slip_atr_k': 0.01268630448269729, 'slip_spread_k': 0.34675136597479067, 'spread_hl_frac': 0.03454911928019262, 'bb_std_mult': 2.064810249498061, 'rsi_os': 8, 'rsi_ob': 85, 'vol_spike': 0.0003850024059475765, 'adx_thresh': 28.529140836772104, 'atr_min_pct': 0.019432457977959377, 'atr_max_pct': 0.060087918835387964, 'tp_mult': 1.2842358948059203, 'tsl_mult': 0.5573675474518378, 'strategy': 'breakout', 'time_stop': 255, 'use_sma': False, 'use_atr': False, 'use_adx': False, 'use_ema': False, 'use_spike': True, 'rsi_required': True, 'edge_k': 1.4830938384767012, 'edge_cap': 0.7689547271813886, 'bull_strategy': 'mean_reversion', 'bull_bb_std_mult': 3.419700218822039, 'bull_rsi_os': 34, 'bull_rsi_ob': 64, 'bull_adx_thresh': 24.997373718244354, 'bull_atr_min_pct': 0.0036484680532249468, 'bull_atr_max_pct': 0.018748103935331738, 'bull_tp_mult': 1.5295423409934994, 'bull_tsl_mult': 0.8558022516691639, 'bull_time_stop': 123, 'bull_use_sma': True, 'bull_use_ema': False, 'bull_use_atr': False, 'bull_use_adx': False, 'bull_use_spike': True, 'bull_rsi_required': False, 'bear_strategy': 'breakout', 'bear_bb_std_mult': 1.4728717479250784, 'bear_rsi_os': 8, 'bear_rsi_ob': 62, 'bear_adx_thresh': 32.5078068022641, 'bear_atr_min_pct': 0.027663510554070472, 'bear_atr_max_pct': 0.12346764325854387, 'bear_tp_mult': 2.1520616987295718, 'bear_tsl_mult': 0.8482637302949781, 'bear_time_stop': 10, 'bear_use_sma': False, 'bear_use_ema': False, 'bear_use_atr': True, 'bear_use_adx': True, 'bear_use_spike': True, 'bear_rsi_required': False, 'sideways_strategy': 'mean_reversion', 'sideways_bb_std_mult': 0.827085065466767, 'sideways_rsi_os': 30, 'sideways_rsi_ob': 60, 'sideways_adx_thresh': 19.238724262633962, 'sideways_atr_min_pct': 0.001255289538752585, 'sideways_atr_max_pct': 0.12901116754156033, 'sideways_tp_mult': 1.339484987896827, 'sideways_tsl_mult': 0.9538987554937234, 'sideways_time_stop': 100, 'sideways_use_sma': True, 'sideways_use_ema': False, 'sideways_use_atr': True, 'sideways_use_adx': True, 'sideways_use_spike': False, 'sideways_rsi_required': True}.
[I 2025-09-01 10:15:36,664] Trial 440 finished with values: [-1000000000.0, 1000000000.0] and parameters: {'p_sma': 55, 'p_std': 44, 'p_atr': 27, 'p_adx': 10, 'rsi_period': 17, 'ema1': 15, 'ema2': 11, 'slip_atr_k': 0.19080612227266416, 'slip_spread_k': 0.354275887098339, 'spread_hl_frac': 0.007507697945887054, 'bb_std_mult': 2.483053390757534, 'rsi_os': 8, 'rsi_ob': 82, 'vol_spike': 0.19572984864808438, 'adx_thresh': 10.853906233893055, 'atr_min_pct': 0.007787705736347888, 'atr_max_pct': 0.036774650527758884, 'tp_mult': 2.53028100466723, 'tsl_mult': 0.5588696757859045, 'strategy': 'breakout', 'time_stop': 65, 'use_sma': True, 'use_atr': False, 'use_adx': False, 'use_ema': False, 'use_spike': True, 'rsi_required': True, 'edge_k': 1.4916422894339292, 'edge_cap': 0.19072433837562192, 'bull_strategy': 'mean_reversion', 'bull_bb_std_mult': 3.45900374133958, 'bull_rsi_os': 37, 'bull_rsi_ob': 76, 'bull_adx_thresh': 30.92025450400761, 'bull_atr_min_pct': 0.0037396429692803314, 'bull_atr_max_pct': 0.09951618463236617, 'bull_tp_mult': 1.5558228107664367, 'bull_tsl_mult': 0.24667356593081585, 'bull_time_stop': 107, 'bull_use_sma': True, 'bull_use_ema': False, 'bull_use_atr': False, 'bull_use_adx': True, 'bull_use_spike': True, 'bull_rsi_required': False, 'bear_strategy': 'breakout', 'bear_bb_std_mult': 1.5910215573933015, 'bear_rsi_os': 54, 'bear_rsi_ob': 73, 'bear_adx_thresh': 34.979828292616396, 'bear_atr_min_pct': 0.027870120209143995, 'bear_atr_max_pct': 0.12421330728315949, 'bear_tp_mult': 2.8026567644131233, 'bear_tsl_mult': 0.8534511309916002, 'bear_time_stop': 168, 'bear_use_sma': False, 'bear_use_ema': False, 'bear_use_atr': True, 'bear_use_adx': False, 'bear_use_spike': True, 'bear_rsi_required': False, 'sideways_strategy': 'mean_reversion', 'sideways_bb_std_mult': 3.3030498837625517, 'sideways_rsi_os': 31, 'sideways_rsi_ob': 84, 'sideways_adx_thresh': 16.86072301679452, 'sideways_atr_min_pct': 0.02122281679132829, 'sideways_atr_max_pct': 0.08152783773850646, 'sideways_tp_mult': 2.6270615765514034, 'sideways_tsl_mult': 0.6536483380410358, 'sideways_time_stop': 155, 'sideways_use_sma': True, 'sideways_use_ema': True, 'sideways_use_atr': True, 'sideways_use_adx': False, 'sideways_use_spike': False, 'sideways_rsi_required': True}.
[I 2025-09-01 10:15:37,579] Trial 438 finished with values: [-0.004080932164323925, 0.004258613469969357] and parameters: {'p_sma': 26, 'p_std': 51, 'p_atr': 29, 'p_adx': 11, 'rsi_period': 31, 'ema1': 18, 'ema2': 12, 'slip_atr_k': 0.07268799547026594, 'slip_spread_k': 0.8217573661911568, 'spread_hl_frac': 0.021112438125722766, 'bb_std_mult': 3.5729957421749408, 'rsi_os': 8, 'rsi_ob': 75, 'vol_spike': 0.2218521822991975, 'adx_thresh': 23.709254669742865, 'atr_min_pct': 0.01598829507121078, 'atr_max_pct': 0.08217559067696995, 'tp_mult': 2.4558434744050497, 'tsl_mult': 0.3787755097933102, 'strategy': 'breakout', 'time_stop': 149, 'use_sma': True, 'use_atr': True, 'use_adx': False, 'use_ema': False, 'use_spike': True, 'rsi_required': False, 'edge_k': 0.5159724639056082, 'edge_cap': 0.14917960525319257, 'bull_strategy': 'mean_reversion', 'bull_bb_std_mult': 3.42973063871379, 'bull_rsi_os': 34, 'bull_rsi_ob': 48, 'bull_adx_thresh': 27.33050521667063, 'bull_atr_min_pct': 0.0028570173945877556, 'bull_atr_max_pct': 0.10036060405124643, 'bull_tp_mult': 2.124092586181619, 'bull_tsl_mult': 0.8955716914929994, 'bull_time_stop': 22, 'bull_use_sma': True, 'bull_use_ema': False, 'bull_use_atr': True, 'bull_use_adx': False, 'bull_use_spike': True, 'bull_rsi_required': False, 'bear_strategy': 'mean_reversion', 'bear_bb_std_mult': 1.5990266132403577, 'bear_rsi_os': 22, 'bear_rsi_ob': 80, 'bear_adx_thresh': 22.62986975045562, 'bear_atr_min_pct': 0.028151037744560924, 'bear_atr_max_pct': 0.123197311407034, 'bear_tp_mult': 2.7976927560693694, 'bear_tsl_mult': 0.43439225540687715, 'bear_time_stop': 171, 'bear_use_sma': False, 'bear_use_ema': True, 'bear_use_atr': True, 'bear_use_adx': True, 'bear_use_spike': False, 'bear_rsi_required': False, 'sideways_strategy': 'mean_reversion', 'sideways_bb_std_mult': 2.329392713075137, 'sideways_rsi_os': 31, 'sideways_rsi_ob': 60, 'sideways_adx_thresh': 29.130528178137723, 'sideways_atr_min_pct': 0.005880636535970709, 'sideways_atr_max_pct': 0.11933710930983597, 'sideways_tp_mult': 2.3492047262431295, 'sideways_tsl_mult': 0.37177419806228035, 'sideways_time_stop': 224, 'sideways_use_sma': False, 'sideways_use_ema': False, 'sideways_use_atr': False, 'sideways_use_adx': False, 'sideways_use_spike': True, 'sideways_rsi_required': False}.
