[I 2025-09-01 09:36:59,799] Trial 217 finished with values: [-1000000000.0, 1000000000.0] and parameters: {'p_sma': 16, 'p_std': 46, 'p_atr': 26, 'p_adx': 11, 'rsi_period': 45, 'ema1': 7, 'ema2': 10, 'slip_atr_k': 0.056046100937161863, 'slip_spread_k': 0.6068100534359493, 'spread_hl_frac': 0.005611747685711292, 'bb_std_mult': 2.6732253842111295, 'rsi_os': 8, 'rsi_ob': 90, 'vol_spike': 0.1990532920732842, 'adx_thresh': 11.658098199177882, 'atr_min_pct': 0.016538469511744022, 'atr_max_pct': 0.07714374838413335, 'tp_mult': 2.5445102148143226, 'tsl_mult': 0.8211683433258135, 'strategy': 'breakout', 'time_stop': 69, 'use_sma': True, 'use_atr': True, 'use_adx': False, 'use_ema': False, 'use_spike': True, 'rsi_required': True, 'edge_k': 1.074629295131452, 'edge_cap': 0.8287667831258186, 'bull_strategy': 'mean_reversion', 'bull_bb_std_mult': 3.518256451522631, 'bull_rsi_os': 38, 'bull_rsi_ob': 81, 'bull_adx_thresh': 24.4915701006295, 'bull_atr_min_pct': 0.003684098701702449, 'bull_atr_max_pct': 0.08404092590087524, 'bull_tp_mult': 1.5394285426184804, 'bull_tsl_mult': 0.8531351755782459, 'bull_time_stop': 148, 'bull_use_sma': True, 'bull_use_ema': False, 'bull_use_atr': True, 'bull_use_adx': False, 'bull_use_spike': True, 'bull_rsi_required': True, 'bear_strategy': 'breakout', 'bear_bb_std_mult': 1.390580917711736, 'bear_rsi_os': 45, 'bear_rsi_ob': 71, 'bear_adx_thresh': 33.28521640465887, 'bear_atr_min_pct': 0.028711755370507155, 'bear_atr_max_pct': 0.12737291600192133, 'bear_tp_mult': 1.2182753024766848, 'bear_tsl_mult': 0.4317689607733023, 'bear_time_stop': 18, 'bear_use_sma': False, 'bear_use_ema': True, 'bear_use_atr': True, 'bear_use_adx': True, 'bear_use_spike': True, 'bear_rsi_required': False, 'sideways_strategy': 'mean_reversion', 'sideways_bb_std_mult': 1.6155510552854457, 'sideways_rsi_os': 29, 'sideways_rsi_ob': 77, 'sideways_adx_thresh': 9.84622949226383, 'sideways_atr_min_pct': 0.015192838799151917, 'sideways_atr_max_pct': 0.06302804091650437, 'sideways_tp_mult': 1.3298851687053699, 'sideways_tsl_mult': 0.6138913980997087, 'sideways_time_stop': 229, 'sideways_use_sma': True, 'sideways_use_ema': False, 'sideways_use_atr': False, 'sideways_use_adx': True, 'sideways_use_spike': True, 'sideways_rsi_required': False}.
[I 2025-09-01 09:37:00,298] Trial 215 finished with values: [-1000000000.0, 1000000000.0] and parameters: {'p_sma': 16, 'p_std': 49, 'p_atr': 28, 'p_adx': 11, 'rsi_period': 42, 'ema1': 6, 'ema2': 10, 'slip_atr_k': 0.15117449452719944, 'slip_spread_k': 0.573887705463287, 'spread_hl_frac': 0.005610244991227894, 'bb_std_mult': 2.7127364144513626, 'rsi_os': 9, 'rsi_ob': 55, 'vol_spike': 0.20772230376686385, 'adx_thresh': 5.574642286251979, 'atr_min_pct': 0.028399570063594635, 'atr_max_pct': 0.07484066322241453, 'tp_mult': 1.658659819410888, 'tsl_mult': 0.7664092114452699, 'strategy': 'breakout', 'time_stop': 279, 'use_sma': True, 'use_atr': True, 'use_adx': False, 'use_ema': False, 'use_spike': True, 'rsi_required': False, 'edge_k': 0.2816317931422785, 'edge_cap': 0.8274819373058986, 'bull_strategy': 'mean_reversion', 'bull_bb_std_mult': 3.5178759809648614, 'bull_rsi_os': 36, 'bull_rsi_ob': 81, 'bull_adx_thresh': 31.341776685789107, 'bull_atr_min_pct': 0.028720181422548847, 'bull_atr_max_pct': 0.09003647088183743, 'bull_tp_mult': 1.5219488416813698, 'bull_tsl_mult': 0.049905134326495404, 'bull_time_stop': 137, 'bull_use_sma': True, 'bull_use_ema': False, 'bull_use_atr': True, 'bull_use_adx': False, 'bull_use_spike': True, 'bull_rsi_required': True, 'bear_strategy': 'breakout', 'bear_bb_std_mult': 1.4162006240424823, 'bear_rsi_os': 43, 'bear_rsi_ob': 72, 'bear_adx_thresh': 33.28309433643101, 'bear_atr_min_pct': 0.028476773629136268, 'bear_atr_max_pct': 0.12756148219331187, 'bear_tp_mult': 1.8548701737051854, 'bear_tsl_mult': 0.82197143590024, 'bear_time_stop': 20, 'bear_use_sma': False, 'bear_use_ema': True, 'bear_use_atr': True, 'bear_use_adx': False, 'bear_use_spike': True, 'bear_rsi_required': False, 'sideways_strategy': 'mean_reversion', 'sideways_bb_std_mult': 2.5387298599215766, 'sideways_rsi_os': 29, 'sideways_rsi_ob': 81, 'sideways_adx_thresh': 31.130650770903838, 'sideways_atr_min_pct': 0.0026000292062140122, 'sideways_atr_max_pct': 0.0785881121512854, 'sideways_tp_mult': 2.5221157773694998, 'sideways_tsl_mult': 0.943165118037411, 'sideways_time_stop': 229, 'sideways_use_sma': True, 'sideways_use_ema': True, 'sideways_use_atr': False, 'sideways_use_adx': False, 'sideways_use_spike': True, 'sideways_rsi_required': False}.
[I 2025-09-01 09:37:43,691] Trial 219 finished with values: [-1000000000.0, 1000000000.0] and parameters: {'p_sma': 31, 'p_std': 5, 'p_atr': 8, 'p_adx': 11, 'rsi_period': 46, 'ema1': 6, 'ema2': 12, 'slip_atr_k': 0.018142256822716585, 'slip_spread_k': 0.6024421444024307, 'spread_hl_frac': 0.007401198882232316, 'bb_std_mult': 2.242290738399076, 'rsi_os': 12, 'rsi_ob': 46, 'vol_spike': 0.18045104523815822, 'adx_thresh': 30.834795355765607, 'atr_min_pct': 0.020901161698660846, 'atr_max_pct': 0.0693434796515383, 'tp_mult': 1.371561597061334, 'tsl_mult': 0.8019381319925198, 'strategy': 'breakout', 'time_stop': 28, 'use_sma': True, 'use_atr': True, 'use_adx': True, 'use_ema': True, 'use_spike': True, 'rsi_required': False, 'edge_k': 0.27099994745711764, 'edge_cap': 0.8191524182709237, 'bull_strategy': 'mean_reversion', 'bull_bb_std_mult': 3.3988687216053757, 'bull_rsi_os': 14, 'bull_rsi_ob': 78, 'bull_adx_thresh': 9.390491213753187, 'bull_atr_min_pct': 0.01551382706962313, 'bull_atr_max_pct': 0.07769168073291466, 'bull_tp_mult': 1.6220956280661825, 'bull_tsl_mult': 0.04457046830814937, 'bull_time_stop': 152, 'bull_use_sma': True, 'bull_use_ema': False, 'bull_use_atr': True, 'bull_use_adx': False, 'bull_use_spike': True, 'bull_rsi_required': False, 'bear_strategy': 'breakout', 'bear_bb_std_mult': 0.9062152140894388, 'bear_rsi_os': 43, 'bear_rsi_ob': 74, 'bear_adx_thresh': 34.322266609501725, 'bear_atr_min_pct': 0.029713669144517285, 'bear_atr_max_pct': 0.12982968274174234, 'bear_tp_mult': 2.8781617407856444, 'bear_tsl_mult': 0.8086856510801506, 'bear_time_stop': 11, 'bear_use_sma': False, 'bear_use_ema': True, 'bear_use_atr': True, 'bear_use_adx': True, 'bear_use_spike': True, 'bear_rsi_required': False, 'sideways_strategy': 'mean_reversion', 'sideways_bb_std_mult': 2.4670090474973856, 'sideways_rsi_os': 17, 'sideways_rsi_ob': 60, 'sideways_adx_thresh': 32.62686202833207, 'sideways_atr_min_pct': 0.012755604766642352, 'sideways_atr_max_pct': 0.07845165545828059, 'sideways_tp_mult': 2.4755906654537974, 'sideways_tsl_mult': 0.08087203638517909, 'sideways_time_stop': 130, 'sideways_use_sma': False, 'sideways_use_ema': False, 'sideways_use_atr': False, 'sideways_use_adx': False, 'sideways_use_spike': True, 'sideways_rsi_required': False}.
[I 2025-09-01 09:37:43,738] Trial 221 finished with values: [-1000000000.0, 1000000000.0] and parameters: {'p_sma': 60, 'p_std': 42, 'p_atr': 29, 'p_adx': 28, 'rsi_period': 24, 'ema1': 30, 'ema2': 12, 'slip_atr_k': 0.019362078825040426, 'slip_spread_k': 0.5068857136926235, 'spread_hl_frac': 0.007603032298473051, 'bb_std_mult': 2.6514513222186498, 'rsi_os': 7, 'rsi_ob': 46, 'vol_spike': 0.17253680571756103, 'adx_thresh': 18.662502538065567, 'atr_min_pct': 0.019701750861924584, 'atr_max_pct': 0.06947329290939004, 'tp_mult': 1.37831984730389, 'tsl_mult': 0.793166115441843, 'strategy': 'breakout', 'time_stop': 143, 'use_sma': False, 'use_atr': True, 'use_adx': True, 'use_ema': True, 'use_spike': True, 'rsi_required': False, 'edge_k': 0.5383791101564541, 'edge_cap': 0.9107918477154703, 'bull_strategy': 'mean_reversion', 'bull_bb_std_mult': 3.402006313633265, 'bull_rsi_os': 39, 'bull_rsi_ob': 78, 'bull_adx_thresh': 29.85972728285528, 'bull_atr_min_pct': 0.01858322373990266, 'bull_atr_max_pct': 0.11157278778301623, 'bull_tp_mult': 1.8431634490842732, 'bull_tsl_mult': 0.24250201817398925, 'bull_time_stop': 11, 'bull_use_sma': True, 'bull_use_ema': False, 'bull_use_atr': True, 'bull_use_adx': False, 'bull_use_spike': True, 'bull_rsi_required': False, 'bear_strategy': 'breakout', 'bear_bb_std_mult': 3.1970242169726526, 'bear_rsi_os': 9, 'bear_rsi_ob': 74, 'bear_adx_thresh': 34.3263391587606, 'bear_atr_min_pct': 0.029950645334937714, 'bear_atr_max_pct': 0.1298359541608007, 'bear_tp_mult': 2.0900536670208965, 'bear_tsl_mult': 0.4945539176385429, 'bear_time_stop': 139, 'bear_use_sma': False, 'bear_use_ema': True, 'bear_use_atr': True, 'bear_use_adx': True, 'bear_use_spike': True, 'bear_rsi_required': False, 'sideways_strategy': 'breakout', 'sideways_bb_std_mult': 1.1845297544260451, 'sideways_rsi_os': 44, 'sideways_rsi_ob': 66, 'sideways_adx_thresh': 32.42524153610628, 'sideways_atr_min_pct': 0.020012484022043867, 'sideways_atr_max_pct': 0.12392371853439868, 'sideways_tp_mult': 2.894437672378377, 'sideways_tsl_mult': 0.8989819175192877, 'sideways_time_stop': 151, 'sideways_use_sma': False, 'sideways_use_ema': False, 'sideways_use_atr': False, 'sideways_use_adx': True, 'sideways_use_spike': True, 'sideways_rsi_required': False}.
[I 2025-09-01 09:37:44,028] Trial 220 finished with values: [-1000000000.0, 1000000000.0] and parameters: {'p_sma': 60, 'p_std': 42, 'p_atr': 17, 'p_adx': 28, 'rsi_period': 47, 'ema1': 6, 'ema2': 11, 'slip_atr_k': 0.147884564295172, 'slip_spread_k': 0.4818272380561082, 'spread_hl_frac': 0.0074748055469796345, 'bb_std_mult': 0.7580196795135905, 'rsi_os': 7, 'rsi_ob': 57, 'vol_spike': 0.1815164868485959, 'adx_thresh': 11.771032515806876, 'atr_min_pct': 0.020630358545392427, 'atr_max_pct': 0.0874955396648701, 'tp_mult': 2.504835722646635, 'tsl_mult': 0.7932006224450442, 'strategy': 'breakout', 'time_stop': 141, 'use_sma': True, 'use_atr': True, 'use_adx': True, 'use_ema': True, 'use_spike': True, 'rsi_required': False, 'edge_k': 0.5267982446300195, 'edge_cap': 0.8126834774720255, 'bull_strategy': 'mean_reversion', 'bull_bb_std_mult': 3.488583676428438, 'bull_rsi_os': 39, 'bull_rsi_ob': 78, 'bull_adx_thresh': 29.842058595674132, 'bull_atr_min_pct': 0.00537476724658649, 'bull_atr_max_pct': 0.1406392220177624, 'bull_tp_mult': 1.614375020413242, 'bull_tsl_mult': 0.0438941415824145, 'bull_time_stop': 150, 'bull_use_sma': True, 'bull_use_ema': False, 'bull_use_atr': True, 'bull_use_adx': False, 'bull_use_spike': True, 'bull_rsi_required': False, 'bear_strategy': 'breakout', 'bear_bb_std_mult': 0.9235640996396972, 'bear_rsi_os': 43, 'bear_rsi_ob': 74, 'bear_adx_thresh': 34.48043888715111, 'bear_atr_min_pct': 0.006470419480378459, 'bear_atr_max_pct': 0.12689668742056176, 'bear_tp_mult': 2.874399135921485, 'bear_tsl_mult': 0.08573597857718668, 'bear_time_stop': 138, 'bear_use_sma': False, 'bear_use_ema': True, 'bear_use_atr': True, 'bear_use_adx': True, 'bear_use_spike': True, 'bear_rsi_required': False, 'sideways_strategy': 'mean_reversion', 'sideways_bb_std_mult': 1.1551548684630877, 'sideways_rsi_os': 29, 'sideways_rsi_ob': 60, 'sideways_adx_thresh': 32.65280479476922, 'sideways_atr_min_pct': 0.002628059280049843, 'sideways_atr_max_pct': 0.07883952845635744, 'sideways_tp_mult': 1.3622765593779191, 'sideways_tsl_mult': 0.9370669684038017, 'sideways_time_stop': 129, 'sideways_use_sma': False, 'sideways_use_ema': False, 'sideways_use_atr': False, 'sideways_use_adx': False, 'sideways_use_spike': True, 'sideways_rsi_required': False}.
[I 2025-09-01 09:37:45,288] Trial 218 finished with values: [-0.001992967236687626, 0.0024815982631324444] and parameters: {'p_sma': 60, 'p_std': 47, 'p_atr': 26, 'p_adx': 24, 'rsi_period': 46, 'ema1': 6, 'ema2': 11, 'slip_atr_k': 0.014137453694103318, 'slip_spread_k': 0.607396478114816, 'spread_hl_frac': 0.007878413682417639, 'bb_std_mult': 2.70151825924566, 'rsi_os': 7, 'rsi_ob': 57, 'vol_spike': 0.20014003607273415, 'adx_thresh': 11.621106950128034, 'atr_min_pct': 0.026816574051512228, 'atr_max_pct': 0.09676444118479158, 'tp_mult': 1.382183668144207, 'tsl_mult': 0.8241373674284487, 'strategy': 'breakout', 'time_stop': 5, 'use_sma': True, 'use_atr': True, 'use_adx': True, 'use_ema': False, 'use_spike': True, 'rsi_required': False, 'edge_k': 1.071051502248485, 'edge_cap': 0.8116977774514249, 'bull_strategy': 'mean_reversion', 'bull_bb_std_mult': 3.4009152162082565, 'bull_rsi_os': 39, 'bull_rsi_ob': 78, 'bull_adx_thresh': 8.951504513270782, 'bull_atr_min_pct': 0.0038110261599283816, 'bull_atr_max_pct': 0.07777862588988477, 'bull_tp_mult': 1.5332384894251798, 'bull_tsl_mult': 0.9059481616059636, 'bull_time_stop': 148, 'bull_use_sma': True, 'bull_use_ema': False, 'bull_use_atr': True, 'bull_use_adx': False, 'bull_use_spike': True, 'bull_rsi_required': True, 'bear_strategy': 'breakout', 'bear_bb_std_mult': 1.528883403867198, 'bear_rsi_os': 15, 'bear_rsi_ob': 74, 'bear_adx_thresh': 34.15675763008802, 'bear_atr_min_pct': 0.006286934027000448, 'bear_atr_max_pct': 0.14610323724508492, 'bear_tp_mult': 2.890949720166937, 'bear_tsl_mult': 0.8168228039564975, 'bear_time_stop': 136, 'bear_use_sma': False, 'bear_use_ema': True, 'bear_use_atr': True, 'bear_use_adx': True, 'bear_use_spike': True, 'bear_rsi_required': False, 'sideways_strategy': 'mean_reversion', 'sideways_bb_std_mult': 2.493465107917173, 'sideways_rsi_os': 29, 'sideways_rsi_ob': 60, 'sideways_adx_thresh': 32.78843035711287, 'sideways_atr_min_pct': 0.0026655570166086604, 'sideways_atr_max_pct': 0.1424156938849045, 'sideways_tp_mult': 1.2923983704658528, 'sideways_tsl_mult': 0.0734339729088912, 'sideways_time_stop': 229, 'sideways_use_sma': False, 'sideways_use_ema': False, 'sideways_use_atr': False, 'sideways_use_adx': True, 'sideways_use_spike': True, 'sideways_rsi_required': False}.
[I 2025-09-01 09:38:25,108] Trial 225 finished with values: [-0.023067055641199485, 0.02291253881417643] and parameters: {'p_sma': 39, 'p_std': 47, 'p_atr': 27, 'p_adx': 11, 'rsi_period': 29, 'ema1': 11, 'ema2': 11, 'slip_atr_k': 0.17109811950117815, 'slip_spread_k': 0.5571104325418101, 'spread_hl_frac': 0.004038331653533733, 'bb_std_mult': 2.730761884944504, 'rsi_os': 33, 'rsi_ob': 67, 'vol_spike': 0.19995482444577892, 'adx_thresh': 11.472981077342073, 'atr_min_pct': 0.019374622055737242, 'atr_max_pct': 0.06195920307742665, 'tp_mult': 1.5574134165728115, 'tsl_mult': 0.02647782604165172, 'strategy': 'breakout', 'time_stop': 159, 'use_sma': True, 'use_atr': True, 'use_adx': False, 'use_ema': False, 'use_spike': True, 'rsi_required': True, 'edge_k': 1.830663439621425, 'edge_cap': 0.8437509347137498, 'bull_strategy': 'mean_reversion', 'bull_bb_std_mult': 3.454409460532177, 'bull_rsi_os': 37, 'bull_rsi_ob': 80, 'bull_adx_thresh': 22.580764804031414, 'bull_atr_min_pct': 0.0038903372829040797, 'bull_atr_max_pct': 0.10331960233477692, 'bull_tp_mult': 1.5516741273751977, 'bull_tsl_mult': 0.2885591240639702, 'bull_time_stop': 126, 'bull_use_sma': True, 'bull_use_ema': False, 'bull_use_atr': True, 'bull_use_adx': False, 'bull_use_spike': True, 'bull_rsi_required': False, 'bear_strategy': 'mean_reversion', 'bear_bb_std_mult': 1.878841648585666, 'bear_rsi_os': 15, 'bear_rsi_ob': 71, 'bear_adx_thresh': 33.92669530745749, 'bear_atr_min_pct': 0.02176120302146836, 'bear_atr_max_pct': 0.05593392814929412, 'bear_tp_mult': 1.6021747025873576, 'bear_tsl_mult': 0.790101685625969, 'bear_time_stop': 42, 'bear_use_sma': False, 'bear_use_ema': True, 'bear_use_atr': True, 'bear_use_adx': True, 'bear_use_spike': True, 'bear_rsi_required': False, 'sideways_strategy': 'mean_reversion', 'sideways_bb_std_mult': 2.501737322322309, 'sideways_rsi_os': 49, 'sideways_rsi_ob': 63, 'sideways_adx_thresh': 30.37220168199737, 'sideways_atr_min_pct': 0.0034504113622092687, 'sideways_atr_max_pct': 0.0859545641386281, 'sideways_tp_mult': 1.292871322134127, 'sideways_tsl_mult': 0.9487725600273027, 'sideways_time_stop': 287, 'sideways_use_sma': True, 'sideways_use_ema': False, 'sideways_use_atr': False, 'sideways_use_adx': False, 'sideways_use_spike': True, 'sideways_rsi_required': False}.
[I 2025-09-01 09:38:27,194] Trial 223 finished with values: [-1000000000.0, 1000000000.0] and parameters: {'p_sma': 38, 'p_std': 47, 'p_atr': 27, 'p_adx': 11, 'rsi_period': 47, 'ema1': 8, 'ema2': 11, 'slip_atr_k': 0.18127028549851562, 'slip_spread_k': 0.5220399342207671, 'spread_hl_frac': 0.04350167063561948, 'bb_std_mult': 2.518823025666834, 'rsi_os': 7, 'rsi_ob': 56, 'vol_spike': 0.19265387617351398, 'adx_thresh': 11.340778780076725, 'atr_min_pct': 0.01835626555396624, 'atr_max_pct': 0.11563923754367189, 'tp_mult': 2.577222024980828, 'tsl_mult': 0.8357382755583314, 'strategy': 'breakout', 'time_stop': 158, 'use_sma': True, 'use_atr': True, 'use_adx': False, 'use_ema': False, 'use_spike': True, 'rsi_required': False, 'edge_k': 0.7090777302223918, 'edge_cap': 0.8448860830125924, 'bull_strategy': 'mean_reversion', 'bull_bb_std_mult': 2.924064561346246, 'bull_rsi_os': 40, 'bull_rsi_ob': 80, 'bull_adx_thresh': 26.748487985560153, 'bull_atr_min_pct': 0.004447425759579662, 'bull_atr_max_pct': 0.08084591672223383, 'bull_tp_mult': 1.584151380034877, 'bull_tsl_mult': 0.9045837052938657, 'bull_time_stop': 124, 'bull_use_sma': True, 'bull_use_ema': False, 'bull_use_atr': True, 'bull_use_adx': False, 'bull_use_spike': True, 'bull_rsi_required': False, 'bear_strategy': 'mean_reversion', 'bear_bb_std_mult': 1.4576211885123462, 'bear_rsi_os': 42, 'bear_rsi_ob': 70, 'bear_adx_thresh': 32.30250848177609, 'bear_atr_min_pct': 0.004293543418136571, 'bear_atr_max_pct': 0.11869153209684669, 'bear_tp_mult': 1.5633325083745553, 'bear_tsl_mult': 0.016520851738790532, 'bear_time_stop': 38, 'bear_use_sma': False, 'bear_use_ema': True, 'bear_use_atr': True, 'bear_use_adx': True, 'bear_use_spike': True, 'bear_rsi_required': False, 'sideways_strategy': 'breakout', 'sideways_bb_std_mult': 0.5037728199396738, 'sideways_rsi_os': 31, 'sideways_rsi_ob': 63, 'sideways_adx_thresh': 7.463032413205587, 'sideways_atr_min_pct': 0.0033233059462431133, 'sideways_atr_max_pct': 0.0929373719768966, 'sideways_tp_mult': 1.3593282862587641, 'sideways_tsl_mult': 0.912530413655433, 'sideways_time_stop': 36, 'sideways_use_sma': True, 'sideways_use_ema': False, 'sideways_use_atr': False, 'sideways_use_adx': False, 'sideways_use_spike': True, 'sideways_rsi_required': False}.
[I 2025-09-01 09:38:27,924] Trial 224 finished with values: [-1000000000.0, 1000000000.0] and parameters: {'p_sma': 59, 'p_std': 48, 'p_atr': 27, 'p_adx': 11, 'rsi_period': 47, 'ema1': 8, 'ema2': 11, 'slip_atr_k': 0.012736376030114597, 'slip_spread_k': 0.5261141922311359, 'spread_hl_frac': 0.004132704931575394, 'bb_std_mult': 1.803457579065494, 'rsi_os': 7, 'rsi_ob': 83, 'vol_spike': 0.19706749134669216, 'adx_thresh': 13.325042185529611, 'atr_min_pct': 0.018711726147616008, 'atr_max_pct': 0.0644115959058593, 'tp_mult': 1.5530659225062613, 'tsl_mult': 0.8304084885068994, 'strategy': 'breakout', 'time_stop': 206, 'use_sma': True, 'use_atr': True, 'use_adx': False, 'use_ema': False, 'use_spike': True, 'rsi_required': False, 'edge_k': 1.8314018672723635, 'edge_cap': 0.8523710430978051, 'bull_strategy': 'mean_reversion', 'bull_bb_std_mult': 3.5787849025980862, 'bull_rsi_os': 37, 'bull_rsi_ob': 80, 'bull_adx_thresh': 27.75005426766874, 'bull_atr_min_pct': 0.004497394086556284, 'bull_atr_max_pct': 0.09497564107002346, 'bull_tp_mult': 1.5935705244473433, 'bull_tsl_mult': 0.9046356123454821, 'bull_time_stop': 125, 'bull_use_sma': True, 'bull_use_ema': False, 'bull_use_atr': True, 'bull_use_adx': False, 'bull_use_spike': True, 'bull_rsi_required': False, 'bear_strategy': 'mean_reversion', 'bear_bb_std_mult': 1.4656264991747268, 'bear_rsi_os': 42, 'bear_rsi_ob': 70, 'bear_adx_thresh': 32.29939594960136, 'bear_atr_min_pct': 0.004612170633105572, 'bear_atr_max_pct': 0.06948610002885602, 'bear_tp_mult': 1.5968496559574394, 'bear_tsl_mult': 0.01745863249335411, 'bear_time_stop': 14, 'bear_use_sma': False, 'bear_use_ema': True, 'bear_use_atr': True, 'bear_use_adx': True, 'bear_use_spike': True, 'bear_rsi_required': False, 'sideways_strategy': 'breakout', 'sideways_bb_std_mult': 2.4866922718526627, 'sideways_rsi_os': 31, 'sideways_rsi_ob': 69, 'sideways_adx_thresh': 30.53511180864368, 'sideways_atr_min_pct': 0.01801449563584145, 'sideways_atr_max_pct': 0.09325107830567606, 'sideways_tp_mult': 1.353161830996014, 'sideways_tsl_mult': 0.9257519146820221, 'sideways_time_stop': 35, 'sideways_use_sma': True, 'sideways_use_ema': False, 'sideways_use_atr': False, 'sideways_use_adx': False, 'sideways_use_spike': True, 'sideways_rsi_required': False}.
