[I 2025-09-01 10:40:40,039] Trial 584 finished with values: [-0.022100901861981215, 0.022424367783009668] and parameters: {'p_sma': 58, 'p_std': 44, 'p_atr': 26, 'p_adx': 13, 'rsi_period': 21, 'ema1': 9, 'ema2': 11, 'slip_atr_k': 0.14205593341973433, 'slip_spread_k': 0.6209733604394497, 'spread_hl_frac': 0.012474773144192555, 'bb_std_mult': 2.631049807498989, 'rsi_os': 25, 'rsi_ob': 50, 'vol_spike': 0.07193415121396961, 'adx_thresh': 24.820080226184437, 'atr_min_pct': 0.0209147614384251, 'atr_max_pct': 0.06762516968814428, 'tp_mult': 1.2392104662586596, 'tsl_mult': 0.8229977010769397, 'strategy': 'breakout', 'time_stop': 140, 'use_sma': True, 'use_atr': True, 'use_adx': False, 'use_ema': False, 'use_spike': True, 'rsi_required': False, 'edge_k': 0.25631162752474923, 'edge_cap': 0.8539995054329159, 'bull_strategy': 'mean_reversion', 'bull_bb_std_mult': 3.4812364643517246, 'bull_rsi_os': 45, 'bull_rsi_ob': 82, 'bull_adx_thresh': 21.583128414069282, 'bull_atr_min_pct': 0.0014160791767118732, 'bull_atr_max_pct': 0.11989879266051506, 'bull_tp_mult': 2.5730259678310317, 'bull_tsl_mult': 0.12697018137326443, 'bull_time_stop': 136, 'bull_use_sma': True, 'bull_use_ema': False, 'bull_use_atr': True, 'bull_use_adx': False, 'bull_use_spike': True, 'bull_rsi_required': False, 'bear_strategy': 'breakout', 'bear_bb_std_mult': 1.4367873976032757, 'bear_rsi_os': 43, 'bear_rsi_ob': 71, 'bear_adx_thresh': 34.22256117685283, 'bear_atr_min_pct': 0.021339720582799558, 'bear_atr_max_pct': 0.08345081441333746, 'bear_tp_mult': 2.8715049745773595, 'bear_tsl_mult': 0.8846757805271409, 'bear_time_stop': 5, 'bear_use_sma': False, 'bear_use_ema': False, 'bear_use_atr': True, 'bear_use_adx': True, 'bear_use_spike': True, 'bear_rsi_required': False, 'sideways_strategy': 'mean_reversion', 'sideways_bb_std_mult': 1.6368850075362418, 'sideways_rsi_os': 15, 'sideways_rsi_ob': 95, 'sideways_adx_thresh': 31.323698968452877, 'sideways_atr_min_pct': 0.022348136635766968, 'sideways_atr_max_pct': 0.09085920321984223, 'sideways_tp_mult': 1.2551270729218675, 'sideways_tsl_mult': 0.6725125449116822, 'sideways_time_stop': 281, 'sideways_use_sma': True, 'sideways_use_ema': False, 'sideways_use_atr': False, 'sideways_use_adx': False, 'sideways_use_spike': True, 'sideways_rsi_required': False}.
[I 2025-09-01 10:41:26,349] Trial 589 finished with values: [-1000000000.0, 1000000000.0] and parameters: {'p_sma': 53, 'p_std': 48, 'p_atr': 29, 'p_adx': 12, 'rsi_period': 50, 'ema1': 6, 'ema2': 11, 'slip_atr_k': 0.009650991351174703, 'slip_spread_k': 0.5577186109810053, 'spread_hl_frac': 0.006529247322286377, 'bb_std_mult': 2.168821364396434, 'rsi_os': 6, 'rsi_ob': 58, 'vol_spike': 0.21703658186027924, 'adx_thresh': 12.55280146796321, 'atr_min_pct': 0.009378380634078835, 'atr_max_pct': 0.1045070429887534, 'tp_mult': 2.811561450485521, 'tsl_mult': 0.3399186595109285, 'strategy': 'breakout', 'time_stop': 124, 'use_sma': False, 'use_atr': False, 'use_adx': False, 'use_ema': True, 'use_spike': True, 'rsi_required': True, 'edge_k': 0.6728000710355024, 'edge_cap': 0.7965063906230264, 'bull_strategy': 'breakout', 'bull_bb_std_mult': 3.360470936370338, 'bull_rsi_os': 39, 'bull_rsi_ob': 75, 'bull_adx_thresh': 28.330033305174993, 'bull_atr_min_pct': 0.004376881871557553, 'bull_atr_max_pct': 0.07838633827832212, 'bull_tp_mult': 1.4503109235147813, 'bull_tsl_mult': 0.9257719616550558, 'bull_time_stop': 141, 'bull_use_sma': False, 'bull_use_ema': True, 'bull_use_atr': False, 'bull_use_adx': False, 'bull_use_spike': True, 'bull_rsi_required': False, 'bear_strategy': 'breakout', 'bear_bb_std_mult': 1.5556742033529352, 'bear_rsi_os': 44, 'bear_rsi_ob': 80, 'bear_adx_thresh': 32.3267897920916, 'bear_atr_min_pct': 0.028247481410201895, 'bear_atr_max_pct': 0.12652411933216023, 'bear_tp_mult': 2.6174107488357845, 'bear_tsl_mult': 0.7783620928129908, 'bear_time_stop': 237, 'bear_use_sma': False, 'bear_use_ema': True, 'bear_use_atr': False, 'bear_use_adx': False, 'bear_use_spike': False, 'bear_rsi_required': True, 'sideways_strategy': 'mean_reversion', 'sideways_bb_std_mult': 3.2180423647568004, 'sideways_rsi_os': 26, 'sideways_rsi_ob': 47, 'sideways_adx_thresh': 7.839939489428453, 'sideways_atr_min_pct': 0.004549559246610893, 'sideways_atr_max_pct': 0.11322646588529531, 'sideways_tp_mult': 1.2824451341817393, 'sideways_tsl_mult': 0.9703416387172099, 'sideways_time_stop': 222, 'sideways_use_sma': False, 'sideways_use_ema': True, 'sideways_use_atr': False, 'sideways_use_adx': False, 'sideways_use_spike': True, 'sideways_rsi_required': True}.
[I 2025-09-01 10:41:27,165] Trial 586 finished with values: [-1000000000.0, 1000000000.0] and parameters: {'p_sma': 52, 'p_std': 30, 'p_atr': 17, 'p_adx': 24, 'rsi_period': 28, 'ema1': 9, 'ema2': 21, 'slip_atr_k': 0.16061926401201068, 'slip_spread_k': 0.6081911780749408, 'spread_hl_frac': 0.024692321829838524, 'bb_std_mult': 2.6576102806296644, 'rsi_os': 16, 'rsi_ob': 77, 'vol_spike': 0.058194478326131685, 'adx_thresh': 12.642880955608147, 'atr_min_pct': 0.021041396316522604, 'atr_max_pct': 0.07786484237778976, 'tp_mult': 2.564372154983342, 'tsl_mult': 0.578410275941656, 'strategy': 'breakout', 'time_stop': 162, 'use_sma': False, 'use_atr': False, 'use_adx': False, 'use_ema': True, 'use_spike': True, 'rsi_required': True, 'edge_k': 1.0614774075295346, 'edge_cap': 0.8533259580067197, 'bull_strategy': 'mean_reversion', 'bull_bb_std_mult': 3.3701714632833837, 'bull_rsi_os': 39, 'bull_rsi_ob': 70, 'bull_adx_thresh': 28.12231625660172, 'bull_atr_min_pct': 0.002567775257202285, 'bull_atr_max_pct': 0.08155089089527967, 'bull_tp_mult': 1.5022933113442787, 'bull_tsl_mult': 0.06475505549820432, 'bull_time_stop': 138, 'bull_use_sma': True, 'bull_use_ema': False, 'bull_use_atr': False, 'bull_use_adx': False, 'bull_use_spike': True, 'bull_rsi_required': False, 'bear_strategy': 'breakout', 'bear_bb_std_mult': 1.429468193450222, 'bear_rsi_os': 43, 'bear_rsi_ob': 52, 'bear_adx_thresh': 34.28362266268316, 'bear_atr_min_pct': 0.027303023342722155, 'bear_atr_max_pct': 0.12664820735493784, 'bear_tp_mult': 2.2911858390712654, 'bear_tsl_mult': 0.7622398945776521, 'bear_time_stop': 17, 'bear_use_sma': False, 'bear_use_ema': False, 'bear_use_atr': False, 'bear_use_adx': False, 'bear_use_spike': False, 'bear_rsi_required': False, 'sideways_strategy': 'mean_reversion', 'sideways_bb_std_mult': 3.221773301359459, 'sideways_rsi_os': 34, 'sideways_rsi_ob': 59, 'sideways_adx_thresh': 7.789157176598474, 'sideways_atr_min_pct': 0.004589511118065855, 'sideways_atr_max_pct': 0.08400676697798234, 'sideways_tp_mult': 1.2536659508891246, 'sideways_tsl_mult': 0.7935003216367134, 'sideways_time_stop': 165, 'sideways_use_sma': False, 'sideways_use_ema': True, 'sideways_use_atr': False, 'sideways_use_adx': False, 'sideways_use_spike': True, 'sideways_rsi_required': True}.
[I 2025-09-01 10:41:27,688] Trial 588 finished with values: [-1000000000.0, 1000000000.0] and parameters: {'p_sma': 52, 'p_std': 48, 'p_atr': 27, 'p_adx': 12, 'rsi_period': 59, 'ema1': 21, 'ema2': 11, 'slip_atr_k': 0.00018781522074916464, 'slip_spread_k': 0.5559126400646077, 'spread_hl_frac': 0.012557846424293207, 'bb_std_mult': 2.6459859265538337, 'rsi_os': 30, 'rsi_ob': 58, 'vol_spike': 0.05974878625916151, 'adx_thresh': 12.566622542367442, 'atr_min_pct': 0.0005446278439491595, 'atr_max_pct': 0.1044943956770171, 'tp_mult': 2.2954632041996366, 'tsl_mult': 0.7213993201002263, 'strategy': 'breakout', 'time_stop': 269, 'use_sma': False, 'use_atr': False, 'use_adx': False, 'use_ema': True, 'use_spike': True, 'rsi_required': True, 'edge_k': 1.6043378376491488, 'edge_cap': 0.7934273034311647, 'bull_strategy': 'breakout', 'bull_bb_std_mult': 2.6020056221834302, 'bull_rsi_os': 14, 'bull_rsi_ob': 79, 'bull_adx_thresh': 30.90010346756651, 'bull_atr_min_pct': 0.004378679277415351, 'bull_atr_max_pct': 0.08239086788234481, 'bull_tp_mult': 1.923363132302515, 'bull_tsl_mult': 0.8930864294432657, 'bull_time_stop': 137, 'bull_use_sma': True, 'bull_use_ema': True, 'bull_use_atr': False, 'bull_use_adx': False, 'bull_use_spike': True, 'bull_rsi_required': False, 'bear_strategy': 'breakout', 'bear_bb_std_mult': 1.5443304537870308, 'bear_rsi_os': 30, 'bear_rsi_ob': 73, 'bear_adx_thresh': 34.44020689842541, 'bear_atr_min_pct': 0.02827130358973907, 'bear_atr_max_pct': 0.1268334193147516, 'bear_tp_mult': 2.3032928544462385, 'bear_tsl_mult': 0.8842630824922534, 'bear_time_stop': 17, 'bear_use_sma': False, 'bear_use_ema': True, 'bear_use_atr': False, 'bear_use_adx': False, 'bear_use_spike': False, 'bear_rsi_required': False, 'sideways_strategy': 'mean_reversion', 'sideways_bb_std_mult': 0.5007700267418196, 'sideways_rsi_os': 39, 'sideways_rsi_ob': 95, 'sideways_adx_thresh': 32.11259309148143, 'sideways_atr_min_pct': 0.019952229485375256, 'sideways_atr_max_pct': 0.08413018545057721, 'sideways_tp_mult': 1.2792693505042385, 'sideways_tsl_mult': 0.9758120616132389, 'sideways_time_stop': 116, 'sideways_use_sma': False, 'sideways_use_ema': True, 'sideways_use_atr': False, 'sideways_use_adx': False, 'sideways_use_spike': True, 'sideways_rsi_required': True}.
[I 2025-09-01 10:41:28,069] Trial 587 finished with values: [-1000000000.0, 1000000000.0] and parameters: {'p_sma': 52, 'p_std': 24, 'p_atr': 17, 'p_adx': 12, 'rsi_period': 84, 'ema1': 29, 'ema2': 11, 'slip_atr_k': 0.14274490290184022, 'slip_spread_k': 0.3119906063972731, 'spread_hl_frac': 0.0045156157422807635, 'bb_std_mult': 2.832216555398971, 'rsi_os': 30, 'rsi_ob': 50, 'vol_spike': 0.08435143647400244, 'adx_thresh': 12.342512263606535, 'atr_min_pct': 0.021256151061990892, 'atr_max_pct': 0.10517818828555796, 'tp_mult': 2.5750475156562276, 'tsl_mult': 0.4169705565902578, 'strategy': 'breakout', 'time_stop': 197, 'use_sma': False, 'use_atr': False, 'use_adx': False, 'use_ema': True, 'use_spike': True, 'rsi_required': True, 'edge_k': 1.067852627798535, 'edge_cap': 0.6274516142921728, 'bull_strategy': 'breakout', 'bull_bb_std_mult': 3.363525172218015, 'bull_rsi_os': 43, 'bull_rsi_ob': 72, 'bull_adx_thresh': 30.986198506506355, 'bull_atr_min_pct': 0.005233569249574494, 'bull_atr_max_pct': 0.08058926505041239, 'bull_tp_mult': 1.5035578091182882, 'bull_tsl_mult': 0.9286780686637037, 'bull_time_stop': 135, 'bull_use_sma': True, 'bull_use_ema': True, 'bull_use_atr': False, 'bull_use_adx': False, 'bull_use_spike': True, 'bull_rsi_required': False, 'bear_strategy': 'breakout', 'bear_bb_std_mult': 1.4304349245606887, 'bear_rsi_os': 43, 'bear_rsi_ob': 52, 'bear_adx_thresh': 34.32705225980541, 'bear_atr_min_pct': 0.02849142226123603, 'bear_atr_max_pct': 0.12721772751053792, 'bear_tp_mult': 2.9993070689201313, 'bear_tsl_mult': 0.7601605970882999, 'bear_time_stop': 15, 'bear_use_sma': False, 'bear_use_ema': False, 'bear_use_atr': False, 'bear_use_adx': False, 'bear_use_spike': False, 'bear_rsi_required': False, 'sideways_strategy': 'mean_reversion', 'sideways_bb_std_mult': 1.64331221665985, 'sideways_rsi_os': 28, 'sideways_rsi_ob': 61, 'sideways_adx_thresh': 32.03246080647877, 'sideways_atr_min_pct': 0.0045414675236808335, 'sideways_atr_max_pct': 0.08392207268065584, 'sideways_tp_mult': 1.5490940311977128, 'sideways_tsl_mult': 0.9102530570686768, 'sideways_time_stop': 222, 'sideways_use_sma': False, 'sideways_use_ema': True, 'sideways_use_atr': False, 'sideways_use_adx': False, 'sideways_use_spike': True, 'sideways_rsi_required': True}.
[I 2025-09-01 10:42:10,834] Trial 592 finished with values: [-1000000000.0, 1000000000.0] and parameters: {'p_sma': 28, 'p_std': 24, 'p_atr': 28, 'p_adx': 8, 'rsi_period': 63, 'ema1': 8, 'ema2': 38, 'slip_atr_k': 0.014471717888321703, 'slip_spread_k': 0.6941965520577403, 'spread_hl_frac': 0.003930240317892474, 'bb_std_mult': 2.8285158104482444, 'rsi_os': 8, 'rsi_ob': 57, 'vol_spike': 0.13579430075434054, 'adx_thresh': 11.060301088599878, 'atr_min_pct': 0.020075422679952517, 'atr_max_pct': 0.05825774218788479, 'tp_mult': 1.1851296373411992, 'tsl_mult': 0.6390027638699952, 'strategy': 'breakout', 'time_stop': 147, 'use_sma': True, 'use_atr': True, 'use_adx': True, 'use_ema': False, 'use_spike': True, 'rsi_required': False, 'edge_k': 0.592225320785303, 'edge_cap': 0.1544644876286314, 'bull_strategy': 'mean_reversion', 'bull_bb_std_mult': 3.4270108801629737, 'bull_rsi_os': 38, 'bull_rsi_ob': 78, 'bull_adx_thresh': 28.83406053851928, 'bull_atr_min_pct': 0.003769047003122537, 'bull_atr_max_pct': 0.07207436129260257, 'bull_tp_mult': 1.4044634421187776, 'bull_tsl_mult': 0.17037628021381485, 'bull_time_stop': 129, 'bull_use_sma': True, 'bull_use_ema': False, 'bull_use_atr': True, 'bull_use_adx': True, 'bull_use_spike': False, 'bull_rsi_required': False, 'bear_strategy': 'mean_reversion', 'bear_bb_std_mult': 1.6462747216050229, 'bear_rsi_os': 47, 'bear_rsi_ob': 81, 'bear_adx_thresh': 33.97650192035182, 'bear_atr_min_pct': 0.0005667117948568064, 'bear_atr_max_pct': 0.10452243900559884, 'bear_tp_mult': 2.992836017097583, 'bear_tsl_mult': 0.09673702073609375, 'bear_time_stop': 290, 'bear_use_sma': True, 'bear_use_ema': True, 'bear_use_atr': True, 'bear_use_adx': True, 'bear_use_spike': True, 'bear_rsi_required': False, 'sideways_strategy': 'mean_reversion', 'sideways_bb_std_mult': 2.4528111977133813, 'sideways_rsi_os': 28, 'sideways_rsi_ob': 61, 'sideways_adx_thresh': 26.609934352445997, 'sideways_atr_min_pct': 0.0033882419876277536, 'sideways_atr_max_pct': 0.021948937671411685, 'sideways_tp_mult': 1.016641871643076, 'sideways_tsl_mult': 0.9313611475479354, 'sideways_time_stop': 229, 'sideways_use_sma': True, 'sideways_use_ema': False, 'sideways_use_atr': False, 'sideways_use_adx': False, 'sideways_use_spike': True, 'sideways_rsi_required': False}.
[I 2025-09-01 10:42:11,176] Trial 591 finished with values: [-1000000000.0, 1000000000.0] and parameters: {'p_sma': 59, 'p_std': 13, 'p_atr': 18, 'p_adx': 26, 'rsi_period': 84, 'ema1': 8, 'ema2': 12, 'slip_atr_k': 0.015612295016263896, 'slip_spread_k': 0.587265937997951, 'spread_hl_frac': 0.004074897179432081, 'bb_std_mult': 2.7520474877315975, 'rsi_os': 7, 'rsi_ob': 75, 'vol_spike': 0.20107115772686, 'adx_thresh': 10.810562473771816, 'atr_min_pct': 0.004125159192100967, 'atr_max_pct': 0.07118195454988478, 'tp_mult': 2.389790664032229, 'tsl_mult': 0.9998704921373239, 'strategy': 'breakout', 'time_stop': 147, 'use_sma': True, 'use_atr': True, 'use_adx': True, 'use_ema': False, 'use_spike': True, 'rsi_required': False, 'edge_k': 0.7404967385866952, 'edge_cap': 0.9046546240592637, 'bull_strategy': 'mean_reversion', 'bull_bb_std_mult': 3.597977283945841, 'bull_rsi_os': 38, 'bull_rsi_ob': 72, 'bull_adx_thresh': 32.30050640946588, 'bull_atr_min_pct': 0.0037429259053254095, 'bull_atr_max_pct': 0.0718821714934243, 'bull_tp_mult': 1.6164477620566695, 'bull_tsl_mult': 0.9339041283217357, 'bull_time_stop': 126, 'bull_use_sma': True, 'bull_use_ema': False, 'bull_use_atr': True, 'bull_use_adx': True, 'bull_use_spike': False, 'bull_rsi_required': False, 'bear_strategy': 'mean_reversion', 'bear_bb_std_mult': 3.010656239150411, 'bear_rsi_os': 47, 'bear_rsi_ob': 71, 'bear_adx_thresh': 33.8647850652055, 'bear_atr_min_pct': 0.00635906053273726, 'bear_atr_max_pct': 0.12964208047140238, 'bear_tp_mult': 2.8726928761670205, 'bear_tsl_mult': 0.5110564383806194, 'bear_time_stop': 12, 'bear_use_sma': True, 'bear_use_ema': True, 'bear_use_atr': True, 'bear_use_adx': True, 'bear_use_spike': True, 'bear_rsi_required': False, 'sideways_strategy': 'mean_reversion', 'sideways_bb_std_mult': 1.8341131821621879, 'sideways_rsi_os': 28, 'sideways_rsi_ob': 61, 'sideways_adx_thresh': 32.86614711175768, 'sideways_atr_min_pct': 0.003456806153530249, 'sideways_atr_max_pct': 0.09463537252323245, 'sideways_tp_mult': 1.4111498815722894, 'sideways_tsl_mult': 0.9293278373376082, 'sideways_time_stop': 230, 'sideways_use_sma': True, 'sideways_use_ema': False, 'sideways_use_atr': False, 'sideways_use_adx': False, 'sideways_use_spike': True, 'sideways_rsi_required': False}.
[I 2025-09-01 10:42:11,843] Trial 593 finished with values: [-1000000000.0, 1000000000.0] and parameters: {'p_sma': 59, 'p_std': 22, 'p_atr': 15, 'p_adx': 17, 'rsi_period': 44, 'ema1': 8, 'ema2': 10, 'slip_atr_k': 0.015025693255734676, 'slip_spread_k': 0.6928836464765309, 'spread_hl_frac': 0.015534400186512476, 'bb_std_mult': 1.9704296154454184, 'rsi_os': 7, 'rsi_ob': 82, 'vol_spike': 0.11307058097364417, 'adx_thresh': 10.991931371957142, 'atr_min_pct': 0.019858921907243476, 'atr_max_pct': 0.14993550656440133, 'tp_mult': 2.388772673314915, 'tsl_mult': 0.6371738076379854, 'strategy': 'breakout', 'time_stop': 149, 'use_sma': True, 'use_atr': True, 'use_adx': True, 'use_ema': False, 'use_spike': True, 'rsi_required': False, 'edge_k': 0.7206749684393849, 'edge_cap': 0.15140180410231746, 'bull_strategy': 'mean_reversion', 'bull_bb_std_mult': 3.533160067035275, 'bull_rsi_os': 31, 'bull_rsi_ob': 80, 'bull_adx_thresh': 28.915367847338768, 'bull_atr_min_pct': 0.003603158137187178, 'bull_atr_max_pct': 0.07127274365823148, 'bull_tp_mult': 1.4091413160730841, 'bull_tsl_mult': 0.8360124219472868, 'bull_time_stop': 125, 'bull_use_sma': False, 'bull_use_ema': False, 'bull_use_atr': True, 'bull_use_adx': True, 'bull_use_spike': False, 'bull_rsi_required': False, 'bear_strategy': 'mean_reversion', 'bear_bb_std_mult': 3.0081088618432736, 'bear_rsi_os': 16, 'bear_rsi_ob': 83, 'bear_adx_thresh': 19.81559711628952, 'bear_atr_min_pct': 0.006667134979633256, 'bear_atr_max_pct': 0.026911027948337066, 'bear_tp_mult': 2.372213111572628, 'bear_tsl_mult': 0.05637924863074961, 'bear_time_stop': 10, 'bear_use_sma': True, 'bear_use_ema': True, 'bear_use_atr': True, 'bear_use_adx': True, 'bear_use_spike': True, 'bear_rsi_required': True, 'sideways_strategy': 'mean_reversion', 'sideways_bb_std_mult': 3.3382218072842487, 'sideways_rsi_os': 5, 'sideways_rsi_ob': 61, 'sideways_adx_thresh': 33.00462173083093, 'sideways_atr_min_pct': 0.003564341053493158, 'sideways_atr_max_pct': 0.14990212921099222, 'sideways_tp_mult': 1.4202155947052515, 'sideways_tsl_mult': 0.9325202981793264, 'sideways_time_stop': 229, 'sideways_use_sma': True, 'sideways_use_ema': False, 'sideways_use_atr': False, 'sideways_use_adx': True, 'sideways_use_spike': True, 'sideways_rsi_required': False}.
[I 2025-09-01 10:42:12,379] Trial 590 finished with values: [-0.04240269472162217, 0.04229213179898957] and parameters: {'p_sma': 59, 'p_std': 33, 'p_atr': 25, 'p_adx': 12, 'rsi_period': 43, 'ema1': 8, 'ema2': 11, 'slip_atr_k': 0.015211130941688255, 'slip_spread_k': 0.32319118101370464, 'spread_hl_frac': 0.004125503746818816, 'bb_std_mult': 1.9791865062310157, 'rsi_os': 7, 'rsi_ob': 79, 'vol_spike': 0.17545501167546199, 'adx_thresh': 9.778838567940484, 'atr_min_pct': 0.004494720130855714, 'atr_max_pct': 0.07093176281024802, 'tp_mult': 2.56848404534415, 'tsl_mult': 0.7172922394095853, 'strategy': 'breakout', 'time_stop': 163, 'use_sma': False, 'use_atr': False, 'use_adx': False, 'use_ema': True, 'use_spike': True, 'rsi_required': True, 'edge_k': 1.0727110485201108, 'edge_cap': 0.8781064146305757, 'bull_strategy': 'breakout', 'bull_bb_std_mult': 3.5655324806838724, 'bull_rsi_os': 38, 'bull_rsi_ob': 80, 'bull_adx_thresh': 6.197650654439691, 'bull_atr_min_pct': 0.0006973845357337253, 'bull_atr_max_pct': 0.1307366049160735, 'bull_tp_mult': 1.4966751653495554, 'bull_tsl_mult': 0.8987990741297012, 'bull_time_stop': 75, 'bull_use_sma': True, 'bull_use_ema': True, 'bull_use_atr': False, 'bull_use_adx': False, 'bull_use_spike': True, 'bull_rsi_required': False, 'bear_strategy': 'breakout', 'bear_bb_std_mult': 1.4879883592227914, 'bear_rsi_os': 47, 'bear_rsi_ob': 73, 'bear_adx_thresh': 20.889467946049237, 'bear_atr_min_pct': 0.009165388995452762, 'bear_atr_max_pct': 0.1278284651208026, 'bear_tp_mult': 2.2575549455216395, 'bear_tsl_mult': 0.7467509789776394, 'bear_time_stop': 14, 'bear_use_sma': False, 'bear_use_ema': True, 'bear_use_atr': False, 'bear_use_adx': False, 'bear_use_spike': False, 'bear_rsi_required': False, 'sideways_strategy': 'mean_reversion', 'sideways_bb_std_mult': 1.8979849872578134, 'sideways_rsi_os': 28, 'sideways_rsi_ob': 61, 'sideways_adx_thresh': 32.246998713763304, 'sideways_atr_min_pct': 0.011849413364123972, 'sideways_atr_max_pct': 0.14951557450978686, 'sideways_tp_mult': 1.4215998059216874, 'sideways_tsl_mult': 0.9311204937023774, 'sideways_time_stop': 228, 'sideways_use_sma': False, 'sideways_use_ema': True, 'sideways_use_atr': False, 'sideways_use_adx': False, 'sideways_use_spike': True, 'sideways_rsi_required': True}.
