[I 2025-09-01 10:08:36,907] Trial 394 finished with values: [-1000000000.0, 1000000000.0] and parameters: {'p_sma': 60, 'p_std': 43, 'p_atr': 29, 'p_adx': 11, 'rsi_period': 79, 'ema1': 8, 'ema2': 49, 'slip_atr_k': 0.004601153935285627, 'slip_spread_k': 0.5257871425995538, 'spread_hl_frac': 0.032086882505805055, 'bb_std_mult': 2.749818195373116, 'rsi_os': 26, 'rsi_ob': 63, 'vol_spike': 0.19192549739883438, 'adx_thresh': 12.04205333583742, 'atr_min_pct': 0.01916266312996101, 'atr_max_pct': 0.06757136762808152, 'tp_mult': 2.4933975953385774, 'tsl_mult': 0.770109815774785, 'strategy': 'breakout', 'time_stop': 287, 'use_sma': True, 'use_atr': True, 'use_adx': True, 'use_ema': False, 'use_spike': True, 'rsi_required': False, 'edge_k': 0.36700804308620794, 'edge_cap': 0.8127088412575684, 'bull_strategy': 'mean_reversion', 'bull_bb_std_mult': 2.6491934351827267, 'bull_rsi_os': 37, 'bull_rsi_ob': 77, 'bull_adx_thresh': 15.741992412277892, 'bull_atr_min_pct': 0.012068126794611741, 'bull_atr_max_pct': 0.0804528158420706, 'bull_tp_mult': 1.560729402016692, 'bull_tsl_mult': 0.3645396785949171, 'bull_time_stop': 294, 'bull_use_sma': True, 'bull_use_ema': False, 'bull_use_atr': True, 'bull_use_adx': False, 'bull_use_spike': True, 'bull_rsi_required': True, 'bear_strategy': 'breakout', 'bear_bb_std_mult': 1.5033534041725714, 'bear_rsi_os': 45, 'bear_rsi_ob': 73, 'bear_adx_thresh': 34.24675362085518, 'bear_atr_min_pct': 0.014987069496938732, 'bear_atr_max_pct': 0.0102850227980327, 'bear_tp_mult': 2.8310926592808867, 'bear_tsl_mult': 0.3499438947758077, 'bear_time_stop': 5, 'bear_use_sma': False, 'bear_use_ema': True, 'bear_use_atr': True, 'bear_use_adx': True, 'bear_use_spike': True, 'bear_rsi_required': False, 'sideways_strategy': 'mean_reversion', 'sideways_bb_std_mult': 2.587283639134336, 'sideways_rsi_os': 37, 'sideways_rsi_ob': 61, 'sideways_adx_thresh': 19.671733962724062, 'sideways_atr_min_pct': 0.005111623939160977, 'sideways_atr_max_pct': 0.07916402461920204, 'sideways_tp_mult': 2.2044049210004806, 'sideways_tsl_mult': 0.4455876644137782, 'sideways_time_stop': 214, 'sideways_use_sma': True, 'sideways_use_ema': False, 'sideways_use_atr': True, 'sideways_use_adx': False, 'sideways_use_spike': True, 'sideways_rsi_required': False}.
[I 2025-09-01 10:08:37,243] Trial 397 finished with values: [-1000000000.0, 1000000000.0] and parameters: {'p_sma': 53, 'p_std': 43, 'p_atr': 29, 'p_adx': 11, 'rsi_period': 40, 'ema1': 8, 'ema2': 10, 'slip_atr_k': 0.017434144875647123, 'slip_spread_k': 0.5254023776541826, 'spread_hl_frac': 0.00799573087420804, 'bb_std_mult': 2.84350854734491, 'rsi_os': 10, 'rsi_ob': 55, 'vol_spike': 0.013882394303298101, 'adx_thresh': 6.84957331104442, 'atr_min_pct': 0.019339118329128047, 'atr_max_pct': 0.06793425589079852, 'tp_mult': 2.510512521561335, 'tsl_mult': 0.10605795962669046, 'strategy': 'breakout', 'time_stop': 99, 'use_sma': True, 'use_atr': True, 'use_adx': False, 'use_ema': False, 'use_spike': True, 'rsi_required': False, 'edge_k': 0.7061671035422763, 'edge_cap': 0.25577827574532636, 'bull_strategy': 'mean_reversion', 'bull_bb_std_mult': 3.4067582222436004, 'bull_rsi_os': 37, 'bull_rsi_ob': 77, 'bull_adx_thresh': 29.05978107102942, 'bull_atr_min_pct': 0.0069188644945976305, 'bull_atr_max_pct': 0.07784983105460486, 'bull_tp_mult': 2.6330254142811373, 'bull_tsl_mult': 0.2755074498705433, 'bull_time_stop': 293, 'bull_use_sma': False, 'bull_use_ema': False, 'bull_use_atr': True, 'bull_use_adx': False, 'bull_use_spike': True, 'bull_rsi_required': False, 'bear_strategy': 'breakout', 'bear_bb_std_mult': 3.077793241484466, 'bear_rsi_os': 12, 'bear_rsi_ob': 66, 'bear_adx_thresh': 26.306368195905215, 'bear_atr_min_pct': 0.029320718531053756, 'bear_atr_max_pct': 0.08218715222128599, 'bear_tp_mult': 2.823483648606287, 'bear_tsl_mult': 0.35448894236604656, 'bear_time_stop': 27, 'bear_use_sma': False, 'bear_use_ema': True, 'bear_use_atr': True, 'bear_use_adx': True, 'bear_use_spike': True, 'bear_rsi_required': False, 'sideways_strategy': 'mean_reversion', 'sideways_bb_std_mult': 0.877402899016928, 'sideways_rsi_os': 28, 'sideways_rsi_ob': 83, 'sideways_adx_thresh': 16.023968088557623, 'sideways_atr_min_pct': 0.004531421680119895, 'sideways_atr_max_pct': 0.02645467071505015, 'sideways_tp_mult': 1.2968278533991735, 'sideways_tsl_mult': 0.39687423358223417, 'sideways_time_stop': 238, 'sideways_use_sma': True, 'sideways_use_ema': False, 'sideways_use_atr': False, 'sideways_use_adx': False, 'sideways_use_spike': True, 'sideways_rsi_required': False}.
[I 2025-09-01 10:09:15,915] Trial 401 finished with values: [-1000000000.0, 1000000000.0] and parameters: {'p_sma': 6, 'p_std': 44, 'p_atr': 27, 'p_adx': 24, 'rsi_period': 47, 'ema1': 6, 'ema2': 54, 'slip_atr_k': 0.18520871547397455, 'slip_spread_k': 0.0810380596617189, 'spread_hl_frac': 0.005031476426286521, 'bb_std_mult': 1.1367069800386185, 'rsi_os': 7, 'rsi_ob': 73, 'vol_spike': 0.2062322315164066, 'adx_thresh': 30.909431019954695, 'atr_min_pct': 0.020248286721045304, 'atr_max_pct': 0.06089285363646654, 'tp_mult': 1.1556670514634857, 'tsl_mult': 0.8081421693397016, 'strategy': 'breakout', 'time_stop': 47, 'use_sma': True, 'use_atr': True, 'use_adx': False, 'use_ema': True, 'use_spike': True, 'rsi_required': False, 'edge_k': 0.5955033533830916, 'edge_cap': 0.11063592102885883, 'bull_strategy': 'mean_reversion', 'bull_bb_std_mult': 1.0177526128841694, 'bull_rsi_os': 41, 'bull_rsi_ob': 79, 'bull_adx_thresh': 27.99136708259568, 'bull_atr_min_pct': 0.02596025029651683, 'bull_atr_max_pct': 0.08465362091590535, 'bull_tp_mult': 1.0636931902828928, 'bull_tsl_mult': 0.1659537034515957, 'bull_time_stop': 149, 'bull_use_sma': True, 'bull_use_ema': False, 'bull_use_atr': True, 'bull_use_adx': False, 'bull_use_spike': True, 'bull_rsi_required': False, 'bear_strategy': 'mean_reversion', 'bear_bb_std_mult': 1.636472259558719, 'bear_rsi_os': 23, 'bear_rsi_ob': 61, 'bear_adx_thresh': 33.383789971241164, 'bear_atr_min_pct': 0.012409666438746074, 'bear_atr_max_pct': 0.098065032055246, 'bear_tp_mult': 2.875241636775777, 'bear_tsl_mult': 0.780015314076618, 'bear_time_stop': 19, 'bear_use_sma': False, 'bear_use_ema': True, 'bear_use_atr': True, 'bear_use_adx': True, 'bear_use_spike': True, 'bear_rsi_required': False, 'sideways_strategy': 'mean_reversion', 'sideways_bb_std_mult': 2.2806886859566564, 'sideways_rsi_os': 30, 'sideways_rsi_ob': 57, 'sideways_adx_thresh': 32.556511857633176, 'sideways_atr_min_pct': 0.00222083117331294, 'sideways_atr_max_pct': 0.07251546201116547, 'sideways_tp_mult': 1.225124015919383, 'sideways_tsl_mult': 0.8895800123664201, 'sideways_time_stop': 224, 'sideways_use_sma': True, 'sideways_use_ema': False, 'sideways_use_atr': False, 'sideways_use_adx': False, 'sideways_use_spike': False, 'sideways_rsi_required': False}.
[I 2025-09-01 10:09:16,421] Trial 398 finished with values: [-1000000000.0, 1000000000.0] and parameters: {'p_sma': 58, 'p_std': 47, 'p_atr': 27, 'p_adx': 24, 'rsi_period': 42, 'ema1': 12, 'ema2': 12, 'slip_atr_k': 0.00985574860700458, 'slip_spread_k': 0.14165051727322925, 'spread_hl_frac': 0.007836919518109416, 'bb_std_mult': 2.836283596546158, 'rsi_os': 7, 'rsi_ob': 73, 'vol_spike': 0.2046564545796437, 'adx_thresh': 9.593110348247599, 'atr_min_pct': 0.020403423984974304, 'atr_max_pct': 0.030791176330881895, 'tp_mult': 2.6313827037262993, 'tsl_mult': 0.8169544033089005, 'strategy': 'breakout', 'time_stop': 101, 'use_sma': True, 'use_atr': True, 'use_adx': False, 'use_ema': False, 'use_spike': True, 'rsi_required': False, 'edge_k': 0.6936431960420114, 'edge_cap': 0.8851842905191601, 'bull_strategy': 'mean_reversion', 'bull_bb_std_mult': 1.141005306826449, 'bull_rsi_os': 26, 'bull_rsi_ob': 91, 'bull_adx_thresh': 13.704572479691237, 'bull_atr_min_pct': 0.013583009967500689, 'bull_atr_max_pct': 0.08389914118174444, 'bull_tp_mult': 1.6333232096014851, 'bull_tsl_mult': 0.9223678451215327, 'bull_time_stop': 149, 'bull_use_sma': False, 'bull_use_ema': False, 'bull_use_atr': True, 'bull_use_adx': False, 'bull_use_spike': True, 'bull_rsi_required': False, 'bear_strategy': 'mean_reversion', 'bear_bb_std_mult': 1.6379471083527226, 'bear_rsi_os': 12, 'bear_rsi_ob': 71, 'bear_adx_thresh': 29.099202876266595, 'bear_atr_min_pct': 0.020418070591294527, 'bear_atr_max_pct': 0.11974864983548082, 'bear_tp_mult': 1.5669578267176014, 'bear_tsl_mult': 0.8074539720079678, 'bear_time_stop': 18, 'bear_use_sma': False, 'bear_use_ema': True, 'bear_use_atr': True, 'bear_use_adx': True, 'bear_use_spike': True, 'bear_rsi_required': False, 'sideways_strategy': 'mean_reversion', 'sideways_bb_std_mult': 3.2011312198033677, 'sideways_rsi_os': 29, 'sideways_rsi_ob': 59, 'sideways_adx_thresh': 15.965513501205736, 'sideways_atr_min_pct': 0.018993813616493962, 'sideways_atr_max_pct': 0.14663644603882947, 'sideways_tp_mult': 1.2218079270530258, 'sideways_tsl_mult': 0.8877888919243547, 'sideways_time_stop': 234, 'sideways_use_sma': True, 'sideways_use_ema': False, 'sideways_use_atr': False, 'sideways_use_adx': False, 'sideways_use_spike': True, 'sideways_rsi_required': False}.
[I 2025-09-01 10:09:17,291] Trial 400 finished with values: [-1000000000.0, 1000000000.0] and parameters: {'p_sma': 53, 'p_std': 6, 'p_atr': 27, 'p_adx': 12, 'rsi_period': 41, 'ema1': 27, 'ema2': 40, 'slip_atr_k': 0.048478113300134545, 'slip_spread_k': 0.6310428917621236, 'spread_hl_frac': 0.00811364265811583, 'bb_std_mult': 0.6053996696057022, 'rsi_os': 36, 'rsi_ob': 86, 'vol_spike': 0.20577432843565457, 'adx_thresh': 30.885149663100886, 'atr_min_pct': 0.020432926024864507, 'atr_max_pct': 0.1358544805801284, 'tp_mult': 1.7252936326124164, 'tsl_mult': 0.8060240025097862, 'strategy': 'breakout', 'time_stop': 247, 'use_sma': True, 'use_atr': True, 'use_adx': False, 'use_ema': False, 'use_spike': True, 'rsi_required': False, 'edge_k': 0.9606096898821554, 'edge_cap': 0.8863830670172862, 'bull_strategy': 'mean_reversion', 'bull_bb_std_mult': 1.1423449932176086, 'bull_rsi_os': 26, 'bull_rsi_ob': 94, 'bull_adx_thresh': 20.28309361006115, 'bull_atr_min_pct': 0.004561971955991131, 'bull_atr_max_pct': 0.08590812652702551, 'bull_tp_mult': 2.5545352321958066, 'bull_tsl_mult': 0.3929895671731254, 'bull_time_stop': 135, 'bull_use_sma': False, 'bull_use_ema': False, 'bull_use_atr': True, 'bull_use_adx': False, 'bull_use_spike': True, 'bull_rsi_required': False, 'bear_strategy': 'mean_reversion', 'bear_bb_std_mult': 1.4598537956142146, 'bear_rsi_os': 37, 'bear_rsi_ob': 71, 'bear_adx_thresh': 13.21310595885178, 'bear_atr_min_pct': 0.02842100904741533, 'bear_atr_max_pct': 0.12143505171387677, 'bear_tp_mult': 2.889515936454457, 'bear_tsl_mult': 0.5244071331058658, 'bear_time_stop': 279, 'bear_use_sma': False, 'bear_use_ema': True, 'bear_use_atr': True, 'bear_use_adx': True, 'bear_use_spike': True, 'bear_rsi_required': False, 'sideways_strategy': 'mean_reversion', 'sideways_bb_std_mult': 1.883015786089012, 'sideways_rsi_os': 29, 'sideways_rsi_ob': 83, 'sideways_adx_thresh': 30.665067765745864, 'sideways_atr_min_pct': 0.006663433779974514, 'sideways_atr_max_pct': 0.07363605185225444, 'sideways_tp_mult': 2.4168802946243253, 'sideways_tsl_mult': 0.21567512204209832, 'sideways_time_stop': 223, 'sideways_use_sma': True, 'sideways_use_ema': False, 'sideways_use_atr': False, 'sideways_use_adx': False, 'sideways_use_spike': True, 'sideways_rsi_required': False}.
[I 2025-09-01 10:09:17,606] Trial 399 finished with values: [-0.07481343909104221, 0.07473288877456025] and parameters: {'p_sma': 58, 'p_std': 47, 'p_atr': 27, 'p_adx': 12, 'rsi_period': 16, 'ema1': 12, 'ema2': 12, 'slip_atr_k': 0.18448425264382035, 'slip_spread_k': 0.6306390628162977, 'spread_hl_frac': 0.007924500447467767, 'bb_std_mult': 2.8271843712539084, 'rsi_os': 6, 'rsi_ob': 52, 'vol_spike': 0.20428895682472928, 'adx_thresh': 9.31475766287558, 'atr_min_pct': 0.020456024419878836, 'atr_max_pct': 0.059817109122549596, 'tp_mult': 1.733634804418048, 'tsl_mult': 0.8047033549120294, 'strategy': 'breakout', 'time_stop': 146, 'use_sma': True, 'use_atr': True, 'use_adx': False, 'use_ema': False, 'use_spike': True, 'rsi_required': False, 'edge_k': 0.9587671574272972, 'edge_cap': 0.8786233008160278, 'bull_strategy': 'mean_reversion', 'bull_bb_std_mult': 0.841161354227413, 'bull_rsi_os': 43, 'bull_rsi_ob': 80, 'bull_adx_thresh': 28.275056148567543, 'bull_atr_min_pct': 0.006952475555667416, 'bull_atr_max_pct': 0.08414238685761827, 'bull_tp_mult': 1.6155572818111987, 'bull_tsl_mult': 0.9207998938172006, 'bull_time_stop': 136, 'bull_use_sma': False, 'bull_use_ema': False, 'bull_use_atr': True, 'bull_use_adx': False, 'bull_use_spike': True, 'bull_rsi_required': False, 'bear_strategy': 'mean_reversion', 'bear_bb_std_mult': 1.6394056494612552, 'bear_rsi_os': 20, 'bear_rsi_ob': 72, 'bear_adx_thresh': 29.309467979071325, 'bear_atr_min_pct': 0.01579404220274588, 'bear_atr_max_pct': 0.12071930170544272, 'bear_tp_mult': 2.879684920402577, 'bear_tsl_mult': 0.7778316015092216, 'bear_time_stop': 37, 'bear_use_sma': False, 'bear_use_ema': True, 'bear_use_atr': True, 'bear_use_adx': True, 'bear_use_spike': True, 'bear_rsi_required': False, 'sideways_strategy': 'mean_reversion', 'sideways_bb_std_mult': 1.6232515287884532, 'sideways_rsi_os': 45, 'sideways_rsi_ob': 59, 'sideways_adx_thresh': 10.255191965865823, 'sideways_atr_min_pct': 0.002059163885333294, 'sideways_atr_max_pct': 0.0729615614003379, 'sideways_tp_mult': 2.7410679804995732, 'sideways_tsl_mult': 0.5222772018883693, 'sideways_time_stop': 234, 'sideways_use_sma': True, 'sideways_use_ema': False, 'sideways_use_atr': False, 'sideways_use_adx': False, 'sideways_use_spike': True, 'sideways_rsi_required': False}.
[I 2025-09-01 10:09:18,491] Trial 404 finished with values: [-1000000000.0, 1000000000.0] and parameters: {'p_sma': 38, 'p_std': 45, 'p_atr': 30, 'p_adx': 26, 'rsi_period': 45, 'ema1': 9, 'ema2': 13, 'slip_atr_k': 0.02286921923674476, 'slip_spread_k': 0.5901559419217409, 'spread_hl_frac': 0.00692962095088982, 'bb_std_mult': 3.446876017265976, 'rsi_os': 9, 'rsi_ob': 45, 'vol_spike': 0.18087924039157632, 'adx_thresh': 13.036974754614176, 'atr_min_pct': 0.017152946825597704, 'atr_max_pct': 0.08551299602915396, 'tp_mult': 2.8433416421654885, 'tsl_mult': 0.5859225191776393, 'strategy': 'mean_reversion', 'time_stop': 281, 'use_sma': False, 'use_atr': False, 'use_adx': False, 'use_ema': False, 'use_spike': True, 'rsi_required': True, 'edge_k': 0.9024935011744539, 'edge_cap': 0.7363498425036047, 'bull_strategy': 'mean_reversion', 'bull_bb_std_mult': 3.3055341339445725, 'bull_rsi_os': 36, 'bull_rsi_ob': 80, 'bull_adx_thresh': 29.95556273663053, 'bull_atr_min_pct': 0.028279115908105404, 'bull_atr_max_pct': 0.023391899491718812, 'bull_tp_mult': 1.6716232459212188, 'bull_tsl_mult': 0.9828191791916878, 'bull_time_stop': 125, 'bull_use_sma': True, 'bull_use_ema': False, 'bull_use_atr': False, 'bull_use_adx': True, 'bull_use_spike': False, 'bull_rsi_required': False, 'bear_strategy': 'breakout', 'bear_bb_std_mult': 0.6855800179750435, 'bear_rsi_os': 43, 'bear_rsi_ob': 88, 'bear_adx_thresh': 33.77437308764499, 'bear_atr_min_pct': 0.016124509428213824, 'bear_atr_max_pct': 0.1243377393862504, 'bear_tp_mult': 2.9317542248936688, 'bear_tsl_mult': 0.6630936200273733, 'bear_time_stop': 288, 'bear_use_sma': True, 'bear_use_ema': False, 'bear_use_atr': True, 'bear_use_adx': False, 'bear_use_spike': False, 'bear_rsi_required': False, 'sideways_strategy': 'mean_reversion', 'sideways_bb_std_mult': 1.6036110871770686, 'sideways_rsi_os': 35, 'sideways_rsi_ob': 62, 'sideways_adx_thresh': 31.82233507016509, 'sideways_atr_min_pct': 0.002801579931953712, 'sideways_atr_max_pct': 0.08844061199329928, 'sideways_tp_mult': 1.3530091193155185, 'sideways_tsl_mult': 0.7395218145601249, 'sideways_time_stop': 218, 'sideways_use_sma': False, 'sideways_use_ema': True, 'sideways_use_atr': False, 'sideways_use_adx': False, 'sideways_use_spike': True, 'sideways_rsi_required': True}.
[I 2025-09-01 10:09:59,697] Trial 402 finished with values: [-1000000000.0, 1000000000.0] and parameters: {'p_sma': 58, 'p_std': 58, 'p_atr': 7, 'p_adx': 18, 'rsi_period': 42, 'ema1': 5, 'ema2': 12, 'slip_atr_k': 0.06064034837724416, 'slip_spread_k': 0.6355803473726571, 'spread_hl_frac': 0.025545428446054133, 'bb_std_mult': 3.4527631121065774, 'rsi_os': 37, 'rsi_ob': 56, 'vol_spike': 0.18468862868957656, 'adx_thresh': 13.075441747770348, 'atr_min_pct': 1.5535829815064434e-06, 'atr_max_pct': 0.05486824334525124, 'tp_mult': 2.5564508284317844, 'tsl_mult': 0.5125333499919076, 'strategy': 'breakout', 'time_stop': 267, 'use_sma': True, 'use_atr': False, 'use_adx': False, 'use_ema': False, 'use_spike': True, 'rsi_required': True, 'edge_k': 0.6643397154092348, 'edge_cap': 0.5670145812891331, 'bull_strategy': 'mean_reversion', 'bull_bb_std_mult': 3.3141021963955852, 'bull_rsi_os': 36, 'bull_rsi_ob': 86, 'bull_adx_thresh': 28.188970961025532, 'bull_atr_min_pct': 0.01370285406143372, 'bull_atr_max_pct': 0.041517678880059354, 'bull_tp_mult': 2.6016083048153247, 'bull_tsl_mult': 0.921380413413684, 'bull_time_stop': 132, 'bull_use_sma': True, 'bull_use_ema': False, 'bull_use_atr': False, 'bull_use_adx': True, 'bull_use_spike': True, 'bull_rsi_required': False, 'bear_strategy': 'breakout', 'bear_bb_std_mult': 1.3321166036722616, 'bear_rsi_os': 36, 'bear_rsi_ob': 88, 'bear_adx_thresh': 29.513971596047156, 'bear_atr_min_pct': 0.029994710668327363, 'bear_atr_max_pct': 0.122602630917982, 'bear_tp_mult': 2.912002679110486, 'bear_tsl_mult': 0.8371501357054765, 'bear_time_stop': 104, 'bear_use_sma': False, 'bear_use_ema': False, 'bear_use_atr': True, 'bear_use_adx': True, 'bear_use_spike': True, 'bear_rsi_required': True, 'sideways_strategy': 'mean_reversion', 'sideways_bb_std_mult': 2.41651580667782, 'sideways_rsi_os': 45, 'sideways_rsi_ob': 63, 'sideways_adx_thresh': 10.493596927779327, 'sideways_atr_min_pct': 0.007825477305577339, 'sideways_atr_max_pct': 0.0875434967885878, 'sideways_tp_mult': 1.5109653277747177, 'sideways_tsl_mult': 0.7529693569334726, 'sideways_time_stop': 262, 'sideways_use_sma': True, 'sideways_use_ema': False, 'sideways_use_atr': False, 'sideways_use_adx': False, 'sideways_use_spike': True, 'sideways_rsi_required': True}.
[I 2025-09-01 10:09:59,715] Trial 406 finished with values: [-1000000000.0, 1000000000.0] and parameters: {'p_sma': 32, 'p_std': 21, 'p_atr': 26, 'p_adx': 8, 'rsi_period': 56, 'ema1': 16, 'ema2': 45, 'slip_atr_k': 0.009033017555661299, 'slip_spread_k': 0.49219176911318424, 'spread_hl_frac': 0.00665458765843841, 'bb_std_mult': 2.6840380462664974, 'rsi_os': 53, 'rsi_ob': 88, 'vol_spike': 0.21399769778293098, 'adx_thresh': 16.328672081061445, 'atr_min_pct': 0.017882627508601798, 'atr_max_pct': 0.06490535929796407, 'tp_mult': 2.525299885596423, 'tsl_mult': 0.5137357730917694, 'strategy': 'breakout', 'time_stop': 174, 'use_sma': True, 'use_atr': False, 'use_adx': False, 'use_ema': True, 'use_spike': False, 'rsi_required': True, 'edge_k': 0.6201137804126537, 'edge_cap': 0.8524342207969504, 'bull_strategy': 'breakout', 'bull_bb_std_mult': 3.545675678350724, 'bull_rsi_os': 8, 'bull_rsi_ob': 89, 'bull_adx_thresh': 26.664970406369967, 'bull_atr_min_pct': 0.0054118351059976, 'bull_atr_max_pct': 0.07626325120611159, 'bull_tp_mult': 1.4419022100799848, 'bull_tsl_mult': 0.6130149234135527, 'bull_time_stop': 88, 'bull_use_sma': True, 'bull_use_ema': True, 'bull_use_atr': False, 'bull_use_adx': True, 'bull_use_spike': True, 'bull_rsi_required': False, 'bear_strategy': 'breakout', 'bear_bb_std_mult': 1.342467852373053, 'bear_rsi_os': 42, 'bear_rsi_ob': 93, 'bear_adx_thresh': 19.889290530431474, 'bear_atr_min_pct': 0.02998705060524295, 'bear_atr_max_pct': 0.04087346098283432, 'bear_tp_mult': 2.778461943763035, 'bear_tsl_mult': 0.3012398748470845, 'bear_time_stop': 5, 'bear_use_sma': False, 'bear_use_ema': False, 'bear_use_atr': False, 'bear_use_adx': True, 'bear_use_spike': True, 'bear_rsi_required': True, 'sideways_strategy': 'breakout', 'sideways_bb_std_mult': 2.47741806327488, 'sideways_rsi_os': 31, 'sideways_rsi_ob': 60, 'sideways_adx_thresh': 31.80549364888011, 'sideways_atr_min_pct': 0.026503527656072966, 'sideways_atr_max_pct': 0.0959947601511652, 'sideways_tp_mult': 2.055034741604252, 'sideways_tsl_mult': 0.9196030595950808, 'sideways_time_stop': 211, 'sideways_use_sma': True, 'sideways_use_ema': False, 'sideways_use_atr': False, 'sideways_use_adx': False, 'sideways_use_spike': False, 'sideways_rsi_required': True}.
