[I 2025-09-01 10:31:34,762] Trial 531 finished with values: [-1000000000.0, 1000000000.0] and parameters: {'p_sma': 15, 'p_std': 44, 'p_atr': 19, 'p_adx': 11, 'rsi_period': 42, 'ema1': 11, 'ema2': 22, 'slip_atr_k': 0.007558954607456023, 'slip_spread_k': 0.6163096966566421, 'spread_hl_frac': 0.008429537322542374, 'bb_std_mult': 2.624128266763304, 'rsi_os': 51, 'rsi_ob': 57, 'vol_spike': 0.19599433081430356, 'adx_thresh': 13.245226576342521, 'atr_min_pct': 0.012050960015365968, 'atr_max_pct': 0.049335633473958335, 'tp_mult': 1.07482084254792, 'tsl_mult': 0.7873497859731158, 'strategy': 'breakout', 'time_stop': 131, 'use_sma': True, 'use_atr': True, 'use_adx': False, 'use_ema': False, 'use_spike': True, 'rsi_required': False, 'edge_k': 0.7605255316163902, 'edge_cap': 0.8511470947924076, 'bull_strategy': 'mean_reversion', 'bull_bb_std_mult': 3.4293004258884086, 'bull_rsi_os': 40, 'bull_rsi_ob': 83, 'bull_adx_thresh': 26.093803925430727, 'bull_atr_min_pct': 0.007148140493604405, 'bull_atr_max_pct': 0.0790378007742214, 'bull_tp_mult': 1.2742396272953065, 'bull_tsl_mult': 0.9543628365349398, 'bull_time_stop': 60, 'bull_use_sma': True, 'bull_use_ema': False, 'bull_use_atr': True, 'bull_use_adx': False, 'bull_use_spike': True, 'bull_rsi_required': False, 'bear_strategy': 'breakout', 'bear_bb_std_mult': 2.3198499241212605, 'bear_rsi_os': 34, 'bear_rsi_ob': 72, 'bear_adx_thresh': 34.52653186203011, 'bear_atr_min_pct': 0.019315648189273726, 'bear_atr_max_pct': 0.14450548429588095, 'bear_tp_mult': 2.8499211680270653, 'bear_tsl_mult': 0.5884665438925127, 'bear_time_stop': 22, 'bear_use_sma': False, 'bear_use_ema': True, 'bear_use_atr': True, 'bear_use_adx': True, 'bear_use_spike': False, 'bear_rsi_required': False, 'sideways_strategy': 'mean_reversion', 'sideways_bb_std_mult': 2.7775509711124946, 'sideways_rsi_os': 28, 'sideways_rsi_ob': 70, 'sideways_adx_thresh': 31.81723157996514, 'sideways_atr_min_pct': 0.021597547592617276, 'sideways_atr_max_pct': 0.09390596675809963, 'sideways_tp_mult': 1.5704574754893201, 'sideways_tsl_mult': 0.8727707833873035, 'sideways_time_stop': 228, 'sideways_use_sma': True, 'sideways_use_ema': False, 'sideways_use_atr': False, 'sideways_use_adx': False, 'sideways_use_spike': True, 'sideways_rsi_required': False}.
[I 2025-09-01 10:31:35,101] Trial 533 finished with values: [-0.0037226325700794316, 0.004274468408383488] and parameters: {'p_sma': 16, 'p_std': 47, 'p_atr': 16, 'p_adx': 19, 'rsi_period': 67, 'ema1': 7, 'ema2': 29, 'slip_atr_k': 0.01046400616866107, 'slip_spread_k': 0.11898115098248496, 'spread_hl_frac': 0.008513234754899233, 'bb_std_mult': 2.6226294259791487, 'rsi_os': 9, 'rsi_ob': 57, 'vol_spike': 0.05709625498908559, 'adx_thresh': 27.75700061592763, 'atr_min_pct': 0.02045200120578959, 'atr_max_pct': 0.06239570176628492, 'tp_mult': 2.492041075643048, 'tsl_mult': 0.7860089325206047, 'strategy': 'breakout', 'time_stop': 133, 'use_sma': True, 'use_atr': True, 'use_adx': False, 'use_ema': False, 'use_spike': True, 'rsi_required': False, 'edge_k': 0.6858419037296526, 'edge_cap': 0.39400629922851865, 'bull_strategy': 'mean_reversion', 'bull_bb_std_mult': 3.438474120063116, 'bull_rsi_os': 24, 'bull_rsi_ob': 49, 'bull_adx_thresh': 11.840686131121474, 'bull_atr_min_pct': 0.0025889523341347514, 'bull_atr_max_pct': 0.1341698019082334, 'bull_tp_mult': 1.281853362212578, 'bull_tsl_mult': 0.21399063666901552, 'bull_time_stop': 82, 'bull_use_sma': True, 'bull_use_ema': False, 'bull_use_atr': True, 'bull_use_adx': False, 'bull_use_spike': True, 'bull_rsi_required': False, 'bear_strategy': 'breakout', 'bear_bb_std_mult': 1.4683649191394654, 'bear_rsi_os': 38, 'bear_rsi_ob': 73, 'bear_adx_thresh': 34.52345204793876, 'bear_atr_min_pct': 0.011888162086253878, 'bear_atr_max_pct': 0.12882727735355087, 'bear_tp_mult': 2.833298239526067, 'bear_tsl_mult': 0.7858104383524981, 'bear_time_stop': 5, 'bear_use_sma': False, 'bear_use_ema': True, 'bear_use_atr': True, 'bear_use_adx': True, 'bear_use_spike': False, 'bear_rsi_required': False, 'sideways_strategy': 'mean_reversion', 'sideways_bb_std_mult': 2.5486205147352052, 'sideways_rsi_os': 33, 'sideways_rsi_ob': 63, 'sideways_adx_thresh': 18.38628133760545, 'sideways_atr_min_pct': 0.0021798691818353056, 'sideways_atr_max_pct': 0.0628567916512588, 'sideways_tp_mult': 1.6445570914068033, 'sideways_tsl_mult': 0.9206781401512728, 'sideways_time_stop': 225, 'sideways_use_sma': True, 'sideways_use_ema': False, 'sideways_use_atr': False, 'sideways_use_adx': False, 'sideways_use_spike': True, 'sideways_rsi_required': False}.
[I 2025-09-01 10:31:35,461] Trial 530 finished with values: [-1000000000.0, 1000000000.0] and parameters: {'p_sma': 38, 'p_std': 48, 'p_atr': 25, 'p_adx': 11, 'rsi_period': 41, 'ema1': 30, 'ema2': 37, 'slip_atr_k': 0.008489642304127253, 'slip_spread_k': 0.8518351847920751, 'spread_hl_frac': 0.027883588796044835, 'bb_std_mult': 2.6177660060455796, 'rsi_os': 36, 'rsi_ob': 58, 'vol_spike': 0.18673010397539164, 'adx_thresh': 6.439496893226657, 'atr_min_pct': 0.0269385528515833, 'atr_max_pct': 0.04914733130903505, 'tp_mult': 2.043985670189344, 'tsl_mult': 0.86798149940181, 'strategy': 'breakout', 'time_stop': 88, 'use_sma': True, 'use_atr': False, 'use_adx': False, 'use_ema': False, 'use_spike': True, 'rsi_required': True, 'edge_k': 1.6934232938286882, 'edge_cap': 0.9460454785367123, 'bull_strategy': 'mean_reversion', 'bull_bb_std_mult': 2.512515617401072, 'bull_rsi_os': 40, 'bull_rsi_ob': 49, 'bull_adx_thresh': 26.19355972450134, 'bull_atr_min_pct': 0.029137480673054272, 'bull_atr_max_pct': 0.0782980487556939, 'bull_tp_mult': 2.7087781688138186, 'bull_tsl_mult': 0.9552845236589117, 'bull_time_stop': 127, 'bull_use_sma': True, 'bull_use_ema': False, 'bull_use_atr': False, 'bull_use_adx': False, 'bull_use_spike': False, 'bull_rsi_required': False, 'bear_strategy': 'breakout', 'bear_bb_std_mult': 1.0038882075364783, 'bear_rsi_os': 34, 'bear_rsi_ob': 72, 'bear_adx_thresh': 24.248579009526388, 'bear_atr_min_pct': 0.026960113902448603, 'bear_atr_max_pct': 0.08745248517837262, 'bear_tp_mult': 1.7076311933860246, 'bear_tsl_mult': 0.8084034967896848, 'bear_time_stop': 215, 'bear_use_sma': False, 'bear_use_ema': True, 'bear_use_atr': True, 'bear_use_adx': True, 'bear_use_spike': True, 'bear_rsi_required': False, 'sideways_strategy': 'mean_reversion', 'sideways_bb_std_mult': 0.8378494965997445, 'sideways_rsi_os': 28, 'sideways_rsi_ob': 63, 'sideways_adx_thresh': 34.06039046620311, 'sideways_atr_min_pct': 0.002246230465750866, 'sideways_atr_max_pct': 0.024323311612232827, 'sideways_tp_mult': 1.3168729880416046, 'sideways_tsl_mult': 0.9116015627383683, 'sideways_time_stop': 187, 'sideways_use_sma': True, 'sideways_use_ema': False, 'sideways_use_atr': False, 'sideways_use_adx': False, 'sideways_use_spike': True, 'sideways_rsi_required': True}.
[I 2025-09-01 10:32:21,578] Trial 537 finished with values: [-1000000000.0, 1000000000.0] and parameters: {'p_sma': 16, 'p_std': 29, 'p_atr': 16, 'p_adx': 28, 'rsi_period': 46, 'ema1': 9, 'ema2': 11, 'slip_atr_k': 0.0167586341759145, 'slip_spread_k': 0.5538595706064594, 'spread_hl_frac': 0.007405086854910866, 'bb_std_mult': 1.6018145379972557, 'rsi_os': 9, 'rsi_ob': 53, 'vol_spike': 0.05579157788887466, 'adx_thresh': 14.334925771723736, 'atr_min_pct': 0.018385186213615394, 'atr_max_pct': 0.1297041966658704, 'tp_mult': 1.6953314539727948, 'tsl_mult': 0.9512948733688555, 'strategy': 'mean_reversion', 'time_stop': 123, 'use_sma': True, 'use_atr': True, 'use_adx': False, 'use_ema': True, 'use_spike': True, 'rsi_required': False, 'edge_k': 1.2388552441937468, 'edge_cap': 0.8062503742887924, 'bull_strategy': 'mean_reversion', 'bull_bb_std_mult': 3.0351574879250593, 'bull_rsi_os': 42, 'bull_rsi_ob': 62, 'bull_adx_thresh': 8.792144295080371, 'bull_atr_min_pct': 0.015286448229489309, 'bull_atr_max_pct': 0.11429689801428647, 'bull_tp_mult': 2.6510221112208168, 'bull_tsl_mult': 0.5631279148284986, 'bull_time_stop': 130, 'bull_use_sma': True, 'bull_use_ema': False, 'bull_use_atr': True, 'bull_use_adx': True, 'bull_use_spike': True, 'bull_rsi_required': False, 'bear_strategy': 'breakout', 'bear_bb_std_mult': 1.2511051186878464, 'bear_rsi_os': 46, 'bear_rsi_ob': 93, 'bear_adx_thresh': 32.842034921374044, 'bear_atr_min_pct': 0.027748048677679372, 'bear_atr_max_pct': 0.01160165864648266, 'bear_tp_mult': 1.4430366943203854, 'bear_tsl_mult': 0.7940359235025453, 'bear_time_stop': 246, 'bear_use_sma': False, 'bear_use_ema': True, 'bear_use_atr': False, 'bear_use_adx': True, 'bear_use_spike': True, 'bear_rsi_required': False, 'sideways_strategy': 'mean_reversion', 'sideways_bb_std_mult': 2.4685695052861014, 'sideways_rsi_os': 34, 'sideways_rsi_ob': 60, 'sideways_adx_thresh': 19.40959197613136, 'sideways_atr_min_pct': 0.010376678043170726, 'sideways_atr_max_pct': 0.12461336530785094, 'sideways_tp_mult': 1.4178925246458278, 'sideways_tsl_mult': 0.9416681513319931, 'sideways_time_stop': 156, 'sideways_use_sma': True, 'sideways_use_ema': False, 'sideways_use_atr': False, 'sideways_use_adx': True, 'sideways_use_spike': False, 'sideways_rsi_required': False}.
[I 2025-09-01 10:32:22,292] Trial 534 finished with values: [-1000000000.0, 1000000000.0] and parameters: {'p_sma': 35, 'p_std': 35, 'p_atr': 16, 'p_adx': 29, 'rsi_period': 39, 'ema1': 22, 'ema2': 10, 'slip_atr_k': 0.01514429713436125, 'slip_spread_k': 0.5467144499533736, 'spread_hl_frac': 0.03299337695937216, 'bb_std_mult': 2.677703645460642, 'rsi_os': 9, 'rsi_ob': 56, 'vol_spike': 0.13221533764787496, 'adx_thresh': 14.0989159300721, 'atr_min_pct': 0.02570364624814496, 'atr_max_pct': 0.10820462935833328, 'tp_mult': 2.673670178959744, 'tsl_mult': 0.8502922027893007, 'strategy': 'breakout', 'time_stop': 49, 'use_sma': True, 'use_atr': True, 'use_adx': False, 'use_ema': False, 'use_spike': True, 'rsi_required': False, 'edge_k': 1.589305961958794, 'edge_cap': 0.971633887357569, 'bull_strategy': 'mean_reversion', 'bull_bb_std_mult': 3.3025071133649124, 'bull_rsi_os': 38, 'bull_rsi_ob': 49, 'bull_adx_thresh': 26.69996357621266, 'bull_atr_min_pct': 0.0026164395482678937, 'bull_atr_max_pct': 0.1343488159936286, 'bull_tp_mult': 2.699591224823312, 'bull_tsl_mult': 0.9337830910203649, 'bull_time_stop': 129, 'bull_use_sma': True, 'bull_use_ema': False, 'bull_use_atr': True, 'bull_use_adx': False, 'bull_use_spike': True, 'bull_rsi_required': False, 'bear_strategy': 'breakout', 'bear_bb_std_mult': 1.4757052669055857, 'bear_rsi_os': 43, 'bear_rsi_ob': 51, 'bear_adx_thresh': 32.973034051925104, 'bear_atr_min_pct': 0.02898507284589537, 'bear_atr_max_pct': 0.011794051123199242, 'bear_tp_mult': 2.704139398876195, 'bear_tsl_mult': 0.7899862485166197, 'bear_time_stop': 214, 'bear_use_sma': False, 'bear_use_ema': True, 'bear_use_atr': True, 'bear_use_adx': True, 'bear_use_spike': True, 'bear_rsi_required': False, 'sideways_strategy': 'mean_reversion', 'sideways_bb_std_mult': 3.2750009966376608, 'sideways_rsi_os': 32, 'sideways_rsi_ob': 59, 'sideways_adx_thresh': 34.00884344816174, 'sideways_atr_min_pct': 0.008249622151335984, 'sideways_atr_max_pct': 0.14120797876136676, 'sideways_tp_mult': 1.3617668180620845, 'sideways_tsl_mult': 0.942685426557545, 'sideways_time_stop': 172, 'sideways_use_sma': True, 'sideways_use_ema': False, 'sideways_use_atr': False, 'sideways_use_adx': True, 'sideways_use_spike': True, 'sideways_rsi_required': False}.
[I 2025-09-01 10:32:23,368] Trial 536 finished with values: [-0.009706007338424416, 0.00965216938215073] and parameters: {'p_sma': 41, 'p_std': 47, 'p_atr': 27, 'p_adx': 9, 'rsi_period': 9, 'ema1': 9, 'ema2': 36, 'slip_atr_k': 0.015055180930199577, 'slip_spread_k': 0.8221958469402559, 'spread_hl_frac': 0.04987322406559316, 'bb_std_mult': 2.6235008289568778, 'rsi_os': 17, 'rsi_ob': 54, 'vol_spike': 0.0777009279609516, 'adx_thresh': 13.981721482360086, 'atr_min_pct': 0.027061539111468826, 'atr_max_pct': 0.0641910048272448, 'tp_mult': 1.693243805672844, 'tsl_mult': 0.9499048094311937, 'strategy': 'mean_reversion', 'time_stop': 133, 'use_sma': True, 'use_atr': True, 'use_adx': False, 'use_ema': False, 'use_spike': True, 'rsi_required': False, 'edge_k': 0.6045481204825173, 'edge_cap': 0.24707255749410417, 'bull_strategy': 'mean_reversion', 'bull_bb_std_mult': 3.2991603038777786, 'bull_rsi_os': 51, 'bull_rsi_ob': 92, 'bull_adx_thresh': 26.738079792627804, 'bull_atr_min_pct': 0.024532926059271404, 'bull_atr_max_pct': 0.055974678886220694, 'bull_tp_mult': 2.6989439119561953, 'bull_tsl_mult': 0.5052099010639561, 'bull_time_stop': 128, 'bull_use_sma': True, 'bull_use_ema': False, 'bull_use_atr': True, 'bull_use_adx': False, 'bull_use_spike': True, 'bull_rsi_required': False, 'bear_strategy': 'breakout', 'bear_bb_std_mult': 3.063161966544331, 'bear_rsi_os': 46, 'bear_rsi_ob': 51, 'bear_adx_thresh': 32.90647550892905, 'bear_atr_min_pct': 0.027620854554990346, 'bear_atr_max_pct': 0.010986216329968254, 'bear_tp_mult': 2.7095019586750153, 'bear_tsl_mult': 0.33570436396101555, 'bear_time_stop': 5, 'bear_use_sma': False, 'bear_use_ema': True, 'bear_use_atr': True, 'bear_use_adx': True, 'bear_use_spike': True, 'bear_rsi_required': False, 'sideways_strategy': 'mean_reversion', 'sideways_bb_std_mult': 2.1471982034435397, 'sideways_rsi_os': 33, 'sideways_rsi_ob': 63, 'sideways_adx_thresh': 5.652124666164012, 'sideways_atr_min_pct': 0.0035858271877214033, 'sideways_atr_max_pct': 0.12530721007321205, 'sideways_tp_mult': 1.4301218088437329, 'sideways_tsl_mult': 0.9459845754825552, 'sideways_time_stop': 92, 'sideways_use_sma': True, 'sideways_use_ema': False, 'sideways_use_atr': False, 'sideways_use_adx': True, 'sideways_use_spike': True, 'sideways_rsi_required': False}.
[I 2025-09-01 10:32:23,885] Trial 535 finished with values: [-0.020887426587810065, 0.02084714601726687] and parameters: {'p_sma': 37, 'p_std': 12, 'p_atr': 16, 'p_adx': 10, 'rsi_period': 39, 'ema1': 10, 'ema2': 11, 'slip_atr_k': 0.18927258525059495, 'slip_spread_k': 0.5455372656186349, 'spread_hl_frac': 0.014154878465318002, 'bb_std_mult': 3.476226240915593, 'rsi_os': 9, 'rsi_ob': 56, 'vol_spike': 0.18821986965326212, 'adx_thresh': 17.90641101291454, 'atr_min_pct': 0.026829234401957374, 'atr_max_pct': 0.06307502273744656, 'tp_mult': 1.7051429169400485, 'tsl_mult': 0.9564987717251215, 'strategy': 'breakout', 'time_stop': 133, 'use_sma': True, 'use_atr': True, 'use_adx': False, 'use_ema': False, 'use_spike': True, 'rsi_required': False, 'edge_k': 1.5192728579617394, 'edge_cap': 0.3961402794427705, 'bull_strategy': 'mean_reversion', 'bull_bb_std_mult': 3.3221921700758665, 'bull_rsi_os': 42, 'bull_rsi_ob': 63, 'bull_adx_thresh': 11.636827162326185, 'bull_atr_min_pct': 0.02439621340763471, 'bull_atr_max_pct': 0.13413685033506062, 'bull_tp_mult': 1.6475148497755319, 'bull_tsl_mult': 0.5741923300896977, 'bull_time_stop': 132, 'bull_use_sma': True, 'bull_use_ema': False, 'bull_use_atr': True, 'bull_use_adx': False, 'bull_use_spike': True, 'bull_rsi_required': False, 'bear_strategy': 'breakout', 'bear_bb_std_mult': 3.301006190751564, 'bear_rsi_os': 43, 'bear_rsi_ob': 73, 'bear_adx_thresh': 32.748747984360655, 'bear_atr_min_pct': 0.001492914126715662, 'bear_atr_max_pct': 0.08751977808099409, 'bear_tp_mult': 1.4506300759904187, 'bear_tsl_mult': 0.7846454728838248, 'bear_time_stop': 244, 'bear_use_sma': False, 'bear_use_ema': True, 'bear_use_atr': True, 'bear_use_adx': True, 'bear_use_spike': True, 'bear_rsi_required': False, 'sideways_strategy': 'mean_reversion', 'sideways_bb_std_mult': 1.5663456027795117, 'sideways_rsi_os': 32, 'sideways_rsi_ob': 63, 'sideways_adx_thresh': 16.444140551302013, 'sideways_atr_min_pct': 0.0022740206225688613, 'sideways_atr_max_pct': 0.14229682879782724, 'sideways_tp_mult': 1.7606511413206007, 'sideways_tsl_mult': 0.9419827505101497, 'sideways_time_stop': 278, 'sideways_use_sma': True, 'sideways_use_ema': False, 'sideways_use_atr': False, 'sideways_use_adx': True, 'sideways_use_spike': True, 'sideways_rsi_required': False}.
[I 2025-09-01 10:33:08,176] Trial 540 finished with values: [-1000000000.0, 1000000000.0] and parameters: {'p_sma': 58, 'p_std': 56, 'p_atr': 12, 'p_adx': 18, 'rsi_period': 44, 'ema1': 23, 'ema2': 14, 'slip_atr_k': 0.005894332462872888, 'slip_spread_k': 0.5119438325088665, 'spread_hl_frac': 0.014045161112503757, 'bb_std_mult': 3.477048772012684, 'rsi_os': 6, 'rsi_ob': 64, 'vol_spike': 0.030757172175550754, 'adx_thresh': 17.865092425421032, 'atr_min_pct': 0.019239547011674518, 'atr_max_pct': 0.06811033659792146, 'tp_mult': 2.603789175933568, 'tsl_mult': 0.6622868089187144, 'strategy': 'breakout', 'time_stop': 149, 'use_sma': False, 'use_atr': True, 'use_adx': False, 'use_ema': False, 'use_spike': False, 'rsi_required': False, 'edge_k': 0.6804543588038963, 'edge_cap': 0.8642585877319203, 'bull_strategy': 'breakout', 'bull_bb_std_mult': 2.880395732973482, 'bull_rsi_os': 38, 'bull_rsi_ob': 71, 'bull_adx_thresh': 28.430376388843136, 'bull_atr_min_pct': 0.0043276925027300826, 'bull_atr_max_pct': 0.07116295719380179, 'bull_tp_mult': 1.4806889847537472, 'bull_tsl_mult': 0.8279688164855683, 'bull_time_stop': 220, 'bull_use_sma': True, 'bull_use_ema': True, 'bull_use_atr': True, 'bull_use_adx': False, 'bull_use_spike': True, 'bull_rsi_required': False, 'bear_strategy': 'mean_reversion', 'bear_bb_std_mult': 2.716140256150801, 'bear_rsi_os': 38, 'bear_rsi_ob': 81, 'bear_adx_thresh': 33.6376596678401, 'bear_atr_min_pct': 0.029081095014789813, 'bear_atr_max_pct': 0.14073025970826578, 'bear_tp_mult': 2.911078411472188, 'bear_tsl_mult': 0.8520614637644333, 'bear_time_stop': 10, 'bear_use_sma': False, 'bear_use_ema': False, 'bear_use_atr': True, 'bear_use_adx': False, 'bear_use_spike': False, 'bear_rsi_required': False, 'sideways_strategy': 'mean_reversion', 'sideways_bb_std_mult': 1.4944425215242545, 'sideways_rsi_os': 11, 'sideways_rsi_ob': 62, 'sideways_adx_thresh': 21.712735148528214, 'sideways_atr_min_pct': 0.00736947630408541, 'sideways_atr_max_pct': 0.09870849221896727, 'sideways_tp_mult': 1.770812651629496, 'sideways_tsl_mult': 0.5920247272501687, 'sideways_time_stop': 21, 'sideways_use_sma': False, 'sideways_use_ema': True, 'sideways_use_atr': True, 'sideways_use_adx': False, 'sideways_use_spike': True, 'sideways_rsi_required': False}.
[I 2025-09-01 10:33:08,190] Trial 541 finished with values: [-0.0037101433333084355, 0.003706774520960497] and parameters: {'p_sma': 58, 'p_std': 7, 'p_atr': 30, 'p_adx': 23, 'rsi_period': 43, 'ema1': 8, 'ema2': 11, 'slip_atr_k': 0.0038049690548376232, 'slip_spread_k': 0.4168559731514027, 'spread_hl_frac': 0.03730794685905578, 'bb_std_mult': 2.760813207235459, 'rsi_os': 46, 'rsi_ob': 55, 'vol_spike': 0.1061486354536959, 'adx_thresh': 12.620038732265204, 'atr_min_pct': 0.020216894284519737, 'atr_max_pct': 0.06729258185758662, 'tp_mult': 2.5992345401500834, 'tsl_mult': 0.3039546837820435, 'strategy': 'breakout', 'time_stop': 147, 'use_sma': False, 'use_atr': True, 'use_adx': True, 'use_ema': True, 'use_spike': False, 'rsi_required': False, 'edge_k': 0.6804472910693452, 'edge_cap': 0.8484570205537086, 'bull_strategy': 'breakout', 'bull_bb_std_mult': 3.4382397812465726, 'bull_rsi_os': 38, 'bull_rsi_ob': 78, 'bull_adx_thresh': 9.614074094480754, 'bull_atr_min_pct': 0.0043808463740232775, 'bull_atr_max_pct': 0.13877356229637702, 'bull_tp_mult': 1.4642204363353115, 'bull_tsl_mult': 0.6565293421427658, 'bull_time_stop': 79, 'bull_use_sma': True, 'bull_use_ema': True, 'bull_use_atr': True, 'bull_use_adx': True, 'bull_use_spike': True, 'bull_rsi_required': True, 'bear_strategy': 'mean_reversion', 'bear_bb_std_mult': 3.1295579005876624, 'bear_rsi_os': 45, 'bear_rsi_ob': 48, 'bear_adx_thresh': 33.57735877623089, 'bear_atr_min_pct': 0.028438293125806778, 'bear_atr_max_pct': 0.13181371804306802, 'bear_tp_mult': 1.0894298825110074, 'bear_tsl_mult': 0.7498278804571095, 'bear_time_stop': 300, 'bear_use_sma': True, 'bear_use_ema': False, 'bear_use_atr': False, 'bear_use_adx': False, 'bear_use_spike': False, 'bear_rsi_required': False, 'sideways_strategy': 'mean_reversion', 'sideways_bb_std_mult': 2.4362483450700494, 'sideways_rsi_os': 30, 'sideways_rsi_ob': 60, 'sideways_adx_thresh': 30.374054247128374, 'sideways_atr_min_pct': 0.028265183773742562, 'sideways_atr_max_pct': 0.08642918042850667, 'sideways_tp_mult': 1.1921944344031226, 'sideways_tsl_mult': 0.7547414139462325, 'sideways_time_stop': 224, 'sideways_use_sma': False, 'sideways_use_ema': True, 'sideways_use_atr': True, 'sideways_use_adx': False, 'sideways_use_spike': False, 'sideways_rsi_required': False}.
