[I 2025-09-01 09:20:11,600] Trial 109 finished with values: [-0.020322102302191114, 0.02022295137393588] and parameters: {'p_sma': 22, 'p_std': 9, 'p_atr': 21, 'p_adx': 29, 'rsi_period': 45, 'ema1': 25, 'ema2': 16, 'slip_atr_k': 0.017865838017229928, 'slip_spread_k': 0.29607863703551807, 'spread_hl_frac': 0.044252073333879746, 'bb_std_mult': 2.435072647492388, 'rsi_os': 45, 'rsi_ob': 58, 'vol_spike': 0.1087476394698104, 'adx_thresh': 6.394833808608979, 'atr_min_pct': 0.0024176491436248976, 'atr_max_pct': 0.03479539876777791, 'tp_mult': 1.2233504549179908, 'tsl_mult': 0.38814508587443775, 'strategy': 'mean_reversion', 'time_stop': 69, 'use_sma': True, 'use_atr': False, 'use_adx': False, 'use_ema': False, 'use_spike': True, 'rsi_required': False, 'edge_k': 1.7961242813187308, 'edge_cap': 0.7146075552899567, 'bull_strategy': 'mean_reversion', 'bull_bb_std_mult': 1.4425251731280655, 'bull_rsi_os': 25, 'bull_rsi_ob': 79, 'bull_adx_thresh': 9.146029091223019, 'bull_atr_min_pct': 0.0029165603751791884, 'bull_atr_max_pct': 0.12408300720983806, 'bull_tp_mult': 2.5682119931084104, 'bull_tsl_mult': 0.48282662245249447, 'bull_time_stop': 192, 'bull_use_sma': False, 'bull_use_ema': False, 'bull_use_atr': True, 'bull_use_adx': False, 'bull_use_spike': True, 'bull_rsi_required': False, 'bear_strategy': 'breakout', 'bear_bb_std_mult': 1.1746510633800404, 'bear_rsi_os': 26, 'bear_rsi_ob': 68, 'bear_adx_thresh': 18.819181201618893, 'bear_atr_min_pct': 0.02506952567799157, 'bear_atr_max_pct': 0.09768185032555801, 'bear_tp_mult': 2.846014348326229, 'bear_tsl_mult': 0.643125368572386, 'bear_time_stop': 157, 'bear_use_sma': False, 'bear_use_ema': False, 'bear_use_atr': True, 'bear_use_adx': True, 'bear_use_spike': False, 'bear_rsi_required': False, 'sideways_strategy': 'mean_reversion', 'sideways_bb_std_mult': 2.232091848635, 'sideways_rsi_os': 39, 'sideways_rsi_ob': 58, 'sideways_adx_thresh': 10.626948684943004, 'sideways_atr_min_pct': 0.024448764695330038, 'sideways_atr_max_pct': 0.08709337169574037, 'sideways_tp_mult': 1.6988039856878248, 'sideways_tsl_mult': 0.8971762831393625, 'sideways_time_stop': 203, 'sideways_use_sma': True, 'sideways_use_ema': False, 'sideways_use_atr': False, 'sideways_use_adx': False, 'sideways_use_spike': False, 'sideways_rsi_required': False}.
[I 2025-09-01 09:20:12,135] Trial 108 finished with values: [-0.029084623604102355, 0.02913340049931239] and parameters: {'p_sma': 56, 'p_std': 41, 'p_atr': 21, 'p_adx': 19, 'rsi_period': 45, 'ema1': 25, 'ema2': 12, 'slip_atr_k': 0.23850655062823423, 'slip_spread_k': 0.28281540067184174, 'spread_hl_frac': 0.035514401117790494, 'bb_std_mult': 2.4444394538986245, 'rsi_os': 6, 'rsi_ob': 56, 'vol_spike': 0.2590885913501289, 'adx_thresh': 10.701802404904964, 'atr_min_pct': 0.0013439567940621046, 'atr_max_pct': 0.02653595869786329, 'tp_mult': 2.3328637214062606, 'tsl_mult': 0.5036046427299036, 'strategy': 'mean_reversion', 'time_stop': 208, 'use_sma': True, 'use_atr': True, 'use_adx': False, 'use_ema': False, 'use_spike': True, 'rsi_required': False, 'edge_k': 0.5211831755271998, 'edge_cap': 0.7965938912765855, 'bull_strategy': 'mean_reversion', 'bull_bb_std_mult': 1.4211967074060206, 'bull_rsi_os': 28, 'bull_rsi_ob': 55, 'bull_adx_thresh': 17.21191375739992, 'bull_atr_min_pct': 3.661895806542255e-05, 'bull_atr_max_pct': 0.0666170140854743, 'bull_tp_mult': 2.651119967918741, 'bull_tsl_mult': 0.3021487739425399, 'bull_time_stop': 216, 'bull_use_sma': False, 'bull_use_ema': False, 'bull_use_atr': True, 'bull_use_adx': False, 'bull_use_spike': True, 'bull_rsi_required': True, 'bear_strategy': 'breakout', 'bear_bb_std_mult': 3.421729548862954, 'bear_rsi_os': 53, 'bear_rsi_ob': 67, 'bear_adx_thresh': 15.964097838875587, 'bear_atr_min_pct': 0.028493665517991946, 'bear_atr_max_pct': 0.10834622597186833, 'bear_tp_mult': 2.8419003055600016, 'bear_tsl_mult': 0.6378044291336442, 'bear_time_stop': 227, 'bear_use_sma': False, 'bear_use_ema': False, 'bear_use_atr': True, 'bear_use_adx': True, 'bear_use_spike': False, 'bear_rsi_required': False, 'sideways_strategy': 'mean_reversion', 'sideways_bb_std_mult': 3.0112266530482663, 'sideways_rsi_os': 39, 'sideways_rsi_ob': 59, 'sideways_adx_thresh': 24.778871410088303, 'sideways_atr_min_pct': 0.024714015252401772, 'sideways_atr_max_pct': 0.023913346219492468, 'sideways_tp_mult': 1.290166798288161, 'sideways_tsl_mult': 0.8944366578977891, 'sideways_time_stop': 221, 'sideways_use_sma': True, 'sideways_use_ema': False, 'sideways_use_atr': False, 'sideways_use_adx': False, 'sideways_use_spike': False, 'sideways_rsi_required': False}.
[I 2025-09-01 09:20:12,386] Trial 110 finished with values: [-0.04674464333443806, 0.046712684353024066] and parameters: {'p_sma': 58, 'p_std': 8, 'p_atr': 17, 'p_adx': 19, 'rsi_period': 49, 'ema1': 5, 'ema2': 37, 'slip_atr_k': 0.10061247049524243, 'slip_spread_k': 0.9534251144538455, 'spread_hl_frac': 0.04550029934830497, 'bb_std_mult': 0.837629727705202, 'rsi_os': 45, 'rsi_ob': 58, 'vol_spike': 0.11067321661942621, 'adx_thresh': 12.672640873951948, 'atr_min_pct': 0.01255324934435072, 'atr_max_pct': 0.035770584292700594, 'tp_mult': 2.3447624136498226, 'tsl_mult': 0.16365671988525765, 'strategy': 'mean_reversion', 'time_stop': 263, 'use_sma': True, 'use_atr': False, 'use_adx': True, 'use_ema': False, 'use_spike': True, 'rsi_required': False, 'edge_k': 0.5140696521433855, 'edge_cap': 0.7881808705462517, 'bull_strategy': 'mean_reversion', 'bull_bb_std_mult': 3.599821443715033, 'bull_rsi_os': 9, 'bull_rsi_ob': 51, 'bull_adx_thresh': 18.00282925485422, 'bull_atr_min_pct': 4.186182041772922e-06, 'bull_atr_max_pct': 0.014404477976858378, 'bull_tp_mult': 2.6720583259371233, 'bull_tsl_mult': 0.6532380811921207, 'bull_time_stop': 253, 'bull_use_sma': False, 'bull_use_ema': False, 'bull_use_atr': False, 'bull_use_adx': False, 'bull_use_spike': True, 'bull_rsi_required': False, 'bear_strategy': 'breakout', 'bear_bb_std_mult': 1.1145558391690753, 'bear_rsi_os': 28, 'bear_rsi_ob': 65, 'bear_adx_thresh': 18.690699886357038, 'bear_atr_min_pct': 0.025050891140415418, 'bear_atr_max_pct': 0.06713938811642017, 'bear_tp_mult': 2.8292629735678605, 'bear_tsl_mult': 0.6417585149971021, 'bear_time_stop': 174, 'bear_use_sma': False, 'bear_use_ema': True, 'bear_use_atr': True, 'bear_use_adx': True, 'bear_use_spike': False, 'bear_rsi_required': True, 'sideways_strategy': 'mean_reversion', 'sideways_bb_std_mult': 2.2370246347444813, 'sideways_rsi_os': 30, 'sideways_rsi_ob': 58, 'sideways_adx_thresh': 10.168249558049911, 'sideways_atr_min_pct': 0.00967268212070836, 'sideways_atr_max_pct': 0.1090247444490073, 'sideways_tp_mult': 2.2921303039960184, 'sideways_tsl_mult': 0.8946086901376553, 'sideways_time_stop': 117, 'sideways_use_sma': True, 'sideways_use_ema': False, 'sideways_use_atr': True, 'sideways_use_adx': False, 'sideways_use_spike': False, 'sideways_rsi_required': True}.
[I 2025-09-01 09:20:12,636] Trial 111 finished with values: [-1000000000.0, 1000000000.0] and parameters: {'p_sma': 58, 'p_std': 9, 'p_atr': 17, 'p_adx': 21, 'rsi_period': 45, 'ema1': 25, 'ema2': 37, 'slip_atr_k': 0.03620738807498601, 'slip_spread_k': 0.30175812552332676, 'spread_hl_frac': 0.04579016165782657, 'bb_std_mult': 2.461298738510081, 'rsi_os': 45, 'rsi_ob': 81, 'vol_spike': 0.16871538659678464, 'adx_thresh': 31.433775896673836, 'atr_min_pct': 0.02883108088030819, 'atr_max_pct': 0.048003242327337575, 'tp_mult': 2.3317718101380027, 'tsl_mult': 0.6887583881231018, 'strategy': 'mean_reversion', 'time_stop': 9, 'use_sma': True, 'use_atr': False, 'use_adx': True, 'use_ema': False, 'use_spike': True, 'rsi_required': False, 'edge_k': 0.5236130338127192, 'edge_cap': 0.17336414678306467, 'bull_strategy': 'mean_reversion', 'bull_bb_std_mult': 0.8779413555088569, 'bull_rsi_os': 33, 'bull_rsi_ob': 80, 'bull_adx_thresh': 13.567325510364043, 'bull_atr_min_pct': 0.012008085682457929, 'bull_atr_max_pct': 0.07424237400746975, 'bull_tp_mult': 2.6917072532161304, 'bull_tsl_mult': 0.5616282958995027, 'bull_time_stop': 278, 'bull_use_sma': False, 'bull_use_ema': False, 'bull_use_atr': False, 'bull_use_adx': False, 'bull_use_spike': True, 'bull_rsi_required': False, 'bear_strategy': 'breakout', 'bear_bb_std_mult': 1.139526776793275, 'bear_rsi_os': 28, 'bear_rsi_ob': 63, 'bear_adx_thresh': 5.944025843677107, 'bear_atr_min_pct': 0.006128189604186497, 'bear_atr_max_pct': 0.06807767676048175, 'bear_tp_mult': 2.843045238259839, 'bear_tsl_mult': 0.7611964966182588, 'bear_time_stop': 219, 'bear_use_sma': False, 'bear_use_ema': True, 'bear_use_atr': True, 'bear_use_adx': True, 'bear_use_spike': False, 'bear_rsi_required': True, 'sideways_strategy': 'mean_reversion', 'sideways_bb_std_mult': 2.9080407912413997, 'sideways_rsi_os': 52, 'sideways_rsi_ob': 58, 'sideways_adx_thresh': 25.867612197130068, 'sideways_atr_min_pct': 0.029138372357603685, 'sideways_atr_max_pct': 0.07413924123545126, 'sideways_tp_mult': 1.2985485377558483, 'sideways_tsl_mult': 0.8966987136398021, 'sideways_time_stop': 82, 'sideways_use_sma': True, 'sideways_use_ema': False, 'sideways_use_atr': True, 'sideways_use_adx': False, 'sideways_use_spike': False, 'sideways_rsi_required': True}.
[I 2025-09-01 09:20:13,023] Trial 112 finished with values: [-1000000000.0, 1000000000.0] and parameters: {'p_sma': 54, 'p_std': 19, 'p_atr': 19, 'p_adx': 21, 'rsi_period': 15, 'ema1': 24, 'ema2': 22, 'slip_atr_k': 0.14097916791301895, 'slip_spread_k': 0.9601188970178047, 'spread_hl_frac': 0.011481652063457373, 'bb_std_mult': 0.7947029361055928, 'rsi_os': 33, 'rsi_ob': 50, 'vol_spike': 0.12059640039859323, 'adx_thresh': 16.400149706367174, 'atr_min_pct': 0.013709952768794186, 'atr_max_pct': 0.01776919633734509, 'tp_mult': 2.3113979500707584, 'tsl_mult': 0.1749822627368608, 'strategy': 'mean_reversion', 'time_stop': 148, 'use_sma': False, 'use_atr': True, 'use_adx': True, 'use_ema': False, 'use_spike': True, 'rsi_required': True, 'edge_k': 0.357827206483473, 'edge_cap': 0.2373806627277406, 'bull_strategy': 'breakout', 'bull_bb_std_mult': 0.6359019319627801, 'bull_rsi_os': 9, 'bull_rsi_ob': 51, 'bull_adx_thresh': 30.557844580736457, 'bull_atr_min_pct': 6.809158341568918e-05, 'bull_atr_max_pct': 0.10825640263634126, 'bull_tp_mult': 1.4717544277144503, 'bull_tsl_mult': 0.3069052057400379, 'bull_time_stop': 277, 'bull_use_sma': False, 'bull_use_ema': True, 'bull_use_atr': False, 'bull_use_adx': False, 'bull_use_spike': True, 'bull_rsi_required': False, 'bear_strategy': 'breakout', 'bear_bb_std_mult': 1.1274225439311931, 'bear_rsi_os': 53, 'bear_rsi_ob': 63, 'bear_adx_thresh': 15.087303110715238, 'bear_atr_min_pct': 0.006535276160580951, 'bear_atr_max_pct': 0.10388744348935484, 'bear_tp_mult': 2.9372097096139695, 'bear_tsl_mult': 0.14250715783790008, 'bear_time_stop': 280, 'bear_use_sma': False, 'bear_use_ema': True, 'bear_use_atr': True, 'bear_use_adx': True, 'bear_use_spike': False, 'bear_rsi_required': True, 'sideways_strategy': 'mean_reversion', 'sideways_bb_std_mult': 2.0539624968857377, 'sideways_rsi_os': 53, 'sideways_rsi_ob': 58, 'sideways_adx_thresh': 14.690350609723449, 'sideways_atr_min_pct': 0.028401780075912708, 'sideways_atr_max_pct': 0.023030358177878726, 'sideways_tp_mult': 2.544974776330671, 'sideways_tsl_mult': 0.7179722232890466, 'sideways_time_stop': 77, 'sideways_use_sma': True, 'sideways_use_ema': False, 'sideways_use_atr': True, 'sideways_use_adx': False, 'sideways_use_spike': False, 'sideways_rsi_required': True}.
[I 2025-09-01 09:20:50,613] Trial 114 finished with values: [-1000000000.0, 1000000000.0] and parameters: {'p_sma': 59, 'p_std': 19, 'p_atr': 12, 'p_adx': 9, 'rsi_period': 48, 'ema1': 24, 'ema2': 22, 'slip_atr_k': 0.03558787631205914, 'slip_spread_k': 0.21736790903669964, 'spread_hl_frac': 0.021079379173866014, 'bb_std_mult': 2.5422338009173147, 'rsi_os': 41, 'rsi_ob': 85, 'vol_spike': 0.13236732120629321, 'adx_thresh': 31.345191671513568, 'atr_min_pct': 0.010019111985640676, 'atr_max_pct': 0.018484166532520833, 'tp_mult': 2.5380901188860183, 'tsl_mult': 0.46086088811232306, 'strategy': 'mean_reversion', 'time_stop': 113, 'use_sma': False, 'use_atr': True, 'use_adx': True, 'use_ema': True, 'use_spike': True, 'rsi_required': True, 'edge_k': 0.6060301325601611, 'edge_cap': 0.29904092797877924, 'bull_strategy': 'breakout', 'bull_bb_std_mult': 2.374162915090312, 'bull_rsi_os': 18, 'bull_rsi_ob': 58, 'bull_adx_thresh': 30.0790997217619, 'bull_atr_min_pct': 0.011527208620807831, 'bull_atr_max_pct': 0.029877382193015542, 'bull_tp_mult': 1.4759003870287337, 'bull_tsl_mult': 0.44992166204550976, 'bull_time_stop': 205, 'bull_use_sma': False, 'bull_use_ema': True, 'bull_use_atr': False, 'bull_use_adx': False, 'bull_use_spike': True, 'bull_rsi_required': False, 'bear_strategy': 'breakout', 'bear_bb_std_mult': 1.4389088849373384, 'bear_rsi_os': 43, 'bear_rsi_ob': 62, 'bear_adx_thresh': 14.864193336073665, 'bear_atr_min_pct': 0.029097631042141744, 'bear_atr_max_pct': 0.10329959466443159, 'bear_tp_mult': 2.5969058560026466, 'bear_tsl_mult': 0.3956303573648542, 'bear_time_stop': 33, 'bear_use_sma': False, 'bear_use_ema': True, 'bear_use_atr': False, 'bear_use_adx': True, 'bear_use_spike': False, 'bear_rsi_required': True, 'sideways_strategy': 'mean_reversion', 'sideways_bb_std_mult': 3.596623689453132, 'sideways_rsi_os': 28, 'sideways_rsi_ob': 61, 'sideways_adx_thresh': 25.98747103333021, 'sideways_atr_min_pct': 0.026574746824600974, 'sideways_atr_max_pct': 0.03260816768689715, 'sideways_tp_mult': 1.4593623091222057, 'sideways_tsl_mult': 0.20987220243882543, 'sideways_time_stop': 245, 'sideways_use_sma': False, 'sideways_use_ema': False, 'sideways_use_atr': True, 'sideways_use_adx': False, 'sideways_use_spike': False, 'sideways_rsi_required': True}.
[I 2025-09-01 09:20:50,859] Trial 116 finished with values: [-1000000000.0, 1000000000.0] and parameters: {'p_sma': 42, 'p_std': 43, 'p_atr': 28, 'p_adx': 26, 'rsi_period': 48, 'ema1': 14, 'ema2': 46, 'slip_atr_k': 0.053858789694768205, 'slip_spread_k': 0.2276429454074167, 'spread_hl_frac': 0.01968426687427288, 'bb_std_mult': 2.8350423252954693, 'rsi_os': 36, 'rsi_ob': 60, 'vol_spike': 0.1348307079201468, 'adx_thresh': 13.476146084008272, 'atr_min_pct': 0.003998370975220655, 'atr_max_pct': 0.020887853527274118, 'tp_mult': 1.8156544067817215, 'tsl_mult': 0.4578694716859905, 'strategy': 'mean_reversion', 'time_stop': 113, 'use_sma': False, 'use_atr': True, 'use_adx': False, 'use_ema': True, 'use_spike': False, 'rsi_required': False, 'edge_k': 0.6068751913829835, 'edge_cap': 0.37009233099778804, 'bull_strategy': 'breakout', 'bull_bb_std_mult': 3.1742865571377283, 'bull_rsi_os': 18, 'bull_rsi_ob': 83, 'bull_adx_thresh': 17.903562523435294, 'bull_atr_min_pct': 0.024832131670989604, 'bull_atr_max_pct': 0.029331404437719706, 'bull_tp_mult': 2.8003579778432286, 'bull_tsl_mult': 0.5248414109924691, 'bull_time_stop': 129, 'bull_use_sma': False, 'bull_use_ema': True, 'bull_use_atr': True, 'bull_use_adx': True, 'bull_use_spike': True, 'bull_rsi_required': False, 'bear_strategy': 'mean_reversion', 'bear_bb_std_mult': 1.4961082615025518, 'bear_rsi_os': 26, 'bear_rsi_ob': 52, 'bear_adx_thresh': 19.762288866594353, 'bear_atr_min_pct': 0.029402249098969782, 'bear_atr_max_pct': 0.11970277228149298, 'bear_tp_mult': 2.5967455691431445, 'bear_tsl_mult': 0.8672287240728477, 'bear_time_stop': 31, 'bear_use_sma': False, 'bear_use_ema': False, 'bear_use_atr': False, 'bear_use_adx': True, 'bear_use_spike': True, 'bear_rsi_required': False, 'sideways_strategy': 'breakout', 'sideways_bb_std_mult': 2.1779649481161942, 'sideways_rsi_os': 32, 'sideways_rsi_ob': 47, 'sideways_adx_thresh': 23.464581949943184, 'sideways_atr_min_pct': 0.021858513325567357, 'sideways_atr_max_pct': 0.032235351310634146, 'sideways_tp_mult': 1.4754710224988092, 'sideways_tsl_mult': 0.24271663429739743, 'sideways_time_stop': 188, 'sideways_use_sma': False, 'sideways_use_ema': False, 'sideways_use_atr': False, 'sideways_use_adx': False, 'sideways_use_spike': False, 'sideways_rsi_required': False}.
[I 2025-09-01 09:20:51,215] Trial 113 finished with values: [-0.04329207261179513, 0.043198627442556536] and parameters: {'p_sma': 59, 'p_std': 37, 'p_atr': 11, 'p_adx': 9, 'rsi_period': 54, 'ema1': 24, 'ema2': 13, 'slip_atr_k': 0.035707731544350835, 'slip_spread_k': 0.2188017625218341, 'spread_hl_frac': 0.021126326836386544, 'bb_std_mult': 2.5227058812356447, 'rsi_os': 10, 'rsi_ob': 85, 'vol_spike': 0.13469729257742702, 'adx_thresh': 14.73341149077854, 'atr_min_pct': 0.013409176410205706, 'atr_max_pct': 0.09698257018089071, 'tp_mult': 2.541516096764717, 'tsl_mult': 0.461412586017576, 'strategy': 'mean_reversion', 'time_stop': 147, 'use_sma': False, 'use_atr': True, 'use_adx': True, 'use_ema': True, 'use_spike': True, 'rsi_required': True, 'edge_k': 0.5985379653950974, 'edge_cap': 0.29858868241853664, 'bull_strategy': 'breakout', 'bull_bb_std_mult': 0.7733106296913026, 'bull_rsi_os': 33, 'bull_rsi_ob': 73, 'bull_adx_thresh': 30.82416473808823, 'bull_atr_min_pct': 0.0009406141764710355, 'bull_atr_max_pct': 0.03014666970482513, 'bull_tp_mult': 2.3027773072703863, 'bull_tsl_mult': 0.559923782467756, 'bull_time_stop': 205, 'bull_use_sma': False, 'bull_use_ema': True, 'bull_use_atr': False, 'bull_use_adx': False, 'bull_use_spike': True, 'bull_rsi_required': False, 'bear_strategy': 'breakout', 'bear_bb_std_mult': 2.997418195261674, 'bear_rsi_os': 30, 'bear_rsi_ob': 62, 'bear_adx_thresh': 25.338647234877357, 'bear_atr_min_pct': 0.02937398659938161, 'bear_atr_max_pct': 0.057081829921610795, 'bear_tp_mult': 2.94037464252508, 'bear_tsl_mult': 0.8439211299875166, 'bear_time_stop': 221, 'bear_use_sma': False, 'bear_use_ema': True, 'bear_use_atr': False, 'bear_use_adx': True, 'bear_use_spike': False, 'bear_rsi_required': True, 'sideways_strategy': 'mean_reversion', 'sideways_bb_std_mult': 2.033819261524652, 'sideways_rsi_os': 28, 'sideways_rsi_ob': 61, 'sideways_adx_thresh': 15.866267079589853, 'sideways_atr_min_pct': 0.027885309462766877, 'sideways_atr_max_pct': 0.03615412431768684, 'sideways_tp_mult': 1.4653359483260928, 'sideways_tsl_mult': 0.27649435601471317, 'sideways_time_stop': 187, 'sideways_use_sma': False, 'sideways_use_ema': False, 'sideways_use_atr': True, 'sideways_use_adx': False, 'sideways_use_spike': False, 'sideways_rsi_required': True}.
[I 2025-09-01 09:20:51,429] Trial 115 finished with values: [-1000000000.0, 1000000000.0] and parameters: {'p_sma': 54, 'p_std': 21, 'p_atr': 12, 'p_adx': 11, 'rsi_period': 15, 'ema1': 24, 'ema2': 33, 'slip_atr_k': 0.02646467738874028, 'slip_spread_k': 0.21604987788474017, 'spread_hl_frac': 0.017485958214721688, 'bb_std_mult': 2.535888166165893, 'rsi_os': 41, 'rsi_ob': 85, 'vol_spike': 0.07820471172673606, 'adx_thresh': 13.851536065074175, 'atr_min_pct': 0.02638904239488425, 'atr_max_pct': 0.13280852541474292, 'tp_mult': 1.8374042233242935, 'tsl_mult': 0.46762961018987914, 'strategy': 'mean_reversion', 'time_stop': 173, 'use_sma': False, 'use_atr': True, 'use_adx': False, 'use_ema': True, 'use_spike': False, 'rsi_required': True, 'edge_k': 0.6071049618566291, 'edge_cap': 0.3015184839799762, 'bull_strategy': 'breakout', 'bull_bb_std_mult': 0.6352595964414307, 'bull_rsi_os': 35, 'bull_rsi_ob': 60, 'bull_adx_thresh': 30.58953128037678, 'bull_atr_min_pct': 0.005883798604215487, 'bull_atr_max_pct': 0.028916219882307505, 'bull_tp_mult': 1.6194572444320796, 'bull_tsl_mult': 0.5293092005238775, 'bull_time_stop': 246, 'bull_use_sma': False, 'bull_use_ema': True, 'bull_use_atr': True, 'bull_use_adx': True, 'bull_use_spike': True, 'bull_rsi_required': False, 'bear_strategy': 'mean_reversion', 'bear_bb_std_mult': 2.960336435063607, 'bear_rsi_os': 16, 'bear_rsi_ob': 53, 'bear_adx_thresh': 14.980930467447438, 'bear_atr_min_pct': 0.02905409849945026, 'bear_atr_max_pct': 0.05806793308874916, 'bear_tp_mult': 2.9434067968799593, 'bear_tsl_mult': 0.5807276789876632, 'bear_time_stop': 241, 'bear_use_sma': False, 'bear_use_ema': False, 'bear_use_atr': False, 'bear_use_adx': True, 'bear_use_spike': True, 'bear_rsi_required': False, 'sideways_strategy': 'breakout', 'sideways_bb_std_mult': 0.653050410781983, 'sideways_rsi_os': 43, 'sideways_rsi_ob': 47, 'sideways_adx_thresh': 23.34572187880639, 'sideways_atr_min_pct': 0.02176631951456324, 'sideways_atr_max_pct': 0.031073591501265707, 'sideways_tp_mult': 2.523880043351978, 'sideways_tsl_mult': 0.7794291572784189, 'sideways_time_stop': 185, 'sideways_use_sma': False, 'sideways_use_ema': False, 'sideways_use_atr': False, 'sideways_use_adx': False, 'sideways_use_spike': False, 'sideways_rsi_required': False}.
