[I 2025-09-01 09:56:08,926] Trial 324 finished with values: [-1000000000.0, 1000000000.0] and parameters: {'p_sma': 59, 'p_std': 14, 'p_atr': 8, 'p_adx': 8, 'rsi_period': 38, 'ema1': 21, 'ema2': 12, 'slip_atr_k': 0.017438968877204704, 'slip_spread_k': 0.09849568472528408, 'spread_hl_frac': 0.0053559598750206605, 'bb_std_mult': 2.557668573290991, 'rsi_os': 20, 'rsi_ob': 72, 'vol_spike': 0.10510211440752726, 'adx_thresh': 12.746033845738648, 'atr_min_pct': 0.022476874907068175, 'atr_max_pct': 0.06886370351906163, 'tp_mult': 1.7581104314997076, 'tsl_mult': 0.8620814829946741, 'strategy': 'breakout', 'time_stop': 150, 'use_sma': True, 'use_atr': True, 'use_adx': False, 'use_ema': False, 'use_spike': True, 'rsi_required': False, 'edge_k': 0.9451398394812016, 'edge_cap': 0.8278185083997932, 'bull_strategy': 'mean_reversion', 'bull_bb_std_mult': 3.50798256361515, 'bull_rsi_os': 49, 'bull_rsi_ob': 88, 'bull_adx_thresh': 27.85954599300494, 'bull_atr_min_pct': 0.004345561411447588, 'bull_atr_max_pct': 0.07520085484540574, 'bull_tp_mult': 1.4881483567280527, 'bull_tsl_mult': 0.8850673334097554, 'bull_time_stop': 22, 'bull_use_sma': True, 'bull_use_ema': False, 'bull_use_atr': True, 'bull_use_adx': False, 'bull_use_spike': True, 'bull_rsi_required': False, 'bear_strategy': 'breakout', 'bear_bb_std_mult': 2.205725888352037, 'bear_rsi_os': 16, 'bear_rsi_ob': 72, 'bear_adx_thresh': 34.36537239409094, 'bear_atr_min_pct': 0.010559735082057944, 'bear_atr_max_pct': 0.11656926470322111, 'bear_tp_mult': 2.8519394207875424, 'bear_tsl_mult': 0.8205416151072157, 'bear_time_stop': 11, 'bear_use_sma': False, 'bear_use_ema': True, 'bear_use_atr': True, 'bear_use_adx': True, 'bear_use_spike': True, 'bear_rsi_required': False, 'sideways_strategy': 'mean_reversion', 'sideways_bb_std_mult': 2.5383372740128194, 'sideways_rsi_os': 14, 'sideways_rsi_ob': 61, 'sideways_adx_thresh': 11.129263812271038, 'sideways_atr_min_pct': 0.0044519659906530635, 'sideways_atr_max_pct': 0.03696188748029101, 'sideways_tp_mult': 1.429110752462777, 'sideways_tsl_mult': 0.9507681058685771, 'sideways_time_stop': 265, 'sideways_use_sma': True, 'sideways_use_ema': False, 'sideways_use_atr': False, 'sideways_use_adx': False, 'sideways_use_spike': True, 'sideways_rsi_required': False}.
[I 2025-09-01 09:56:10,012] Trial 323 finished with values: [-0.010756275360671808, 0.01058709477040932] and parameters: {'p_sma': 37, 'p_std': 14, 'p_atr': 8, 'p_adx': 10, 'rsi_period': 27, 'ema1': 21, 'ema2': 12, 'slip_atr_k': 0.0181735154753561, 'slip_spread_k': 0.5666705420493274, 'spread_hl_frac': 0.005571411399522372, 'bb_std_mult': 0.8638629494224725, 'rsi_os': 20, 'rsi_ob': 53, 'vol_spike': 0.10734567830608255, 'adx_thresh': 26.533281489663846, 'atr_min_pct': 0.023244532871224452, 'atr_max_pct': 0.06949242361522491, 'tp_mult': 2.4875810444741955, 'tsl_mult': 0.8629270345290003, 'strategy': 'mean_reversion', 'time_stop': 149, 'use_sma': True, 'use_atr': True, 'use_adx': False, 'use_ema': False, 'use_spike': True, 'rsi_required': False, 'edge_k': 0.3191818699511615, 'edge_cap': 0.050641408080445593, 'bull_strategy': 'mean_reversion', 'bull_bb_std_mult': 2.5217472700758097, 'bull_rsi_os': 38, 'bull_rsi_ob': 80, 'bull_adx_thresh': 27.957739031566373, 'bull_atr_min_pct': 0.0047228690755372095, 'bull_atr_max_pct': 0.0753434426638778, 'bull_tp_mult': 2.76098010256947, 'bull_tsl_mult': 0.8848781893335744, 'bull_time_stop': 131, 'bull_use_sma': False, 'bull_use_ema': False, 'bull_use_atr': True, 'bull_use_adx': False, 'bull_use_spike': True, 'bull_rsi_required': False, 'bear_strategy': 'breakout', 'bear_bb_std_mult': 1.6748513649954793, 'bear_rsi_os': 44, 'bear_rsi_ob': 73, 'bear_adx_thresh': 8.093335977823314, 'bear_atr_min_pct': 0.028097809595899, 'bear_atr_max_pct': 0.11781114290005221, 'bear_tp_mult': 2.8499622903759145, 'bear_tsl_mult': 0.7324658264148343, 'bear_time_stop': 10, 'bear_use_sma': True, 'bear_use_ema': True, 'bear_use_atr': True, 'bear_use_adx': True, 'bear_use_spike': False, 'bear_rsi_required': False, 'sideways_strategy': 'mean_reversion', 'sideways_bb_std_mult': 2.5321345793519234, 'sideways_rsi_os': 36, 'sideways_rsi_ob': 61, 'sideways_adx_thresh': 11.013639212142664, 'sideways_atr_min_pct': 0.0043013307073376285, 'sideways_atr_max_pct': 0.09944533184654472, 'sideways_tp_mult': 2.8365990224006765, 'sideways_tsl_mult': 0.9565844394857572, 'sideways_time_stop': 246, 'sideways_use_sma': True, 'sideways_use_ema': False, 'sideways_use_atr': False, 'sideways_use_adx': False, 'sideways_use_spike': True, 'sideways_rsi_required': False}.
[I 2025-09-01 09:56:54,249] Trial 327 finished with values: [-1000000000.0, 1000000000.0] and parameters: {'p_sma': 29, 'p_std': 42, 'p_atr': 9, 'p_adx': 28, 'rsi_period': 44, 'ema1': 6, 'ema2': 11, 'slip_atr_k': 0.01026201880308761, 'slip_spread_k': 0.6900084233029464, 'spread_hl_frac': 0.0032505996063811465, 'bb_std_mult': 1.8697811631313275, 'rsi_os': 8, 'rsi_ob': 86, 'vol_spike': 0.20298638661772545, 'adx_thresh': 11.90429543848828, 'atr_min_pct': 0.01701214934041863, 'atr_max_pct': 0.14692172541950144, 'tp_mult': 1.4171949675713416, 'tsl_mult': 0.5430971211786955, 'strategy': 'breakout', 'time_stop': 133, 'use_sma': False, 'use_atr': True, 'use_adx': False, 'use_ema': False, 'use_spike': True, 'rsi_required': True, 'edge_k': 0.47541545317094847, 'edge_cap': 0.8343454110609252, 'bull_strategy': 'mean_reversion', 'bull_bb_std_mult': 3.346561963175565, 'bull_rsi_os': 39, 'bull_rsi_ob': 79, 'bull_adx_thresh': 23.805677196058134, 'bull_atr_min_pct': 0.00627714192778919, 'bull_atr_max_pct': 0.07891173074397456, 'bull_tp_mult': 1.6103077914538013, 'bull_tsl_mult': 0.9422918709139894, 'bull_time_stop': 149, 'bull_use_sma': True, 'bull_use_ema': False, 'bull_use_atr': False, 'bull_use_adx': False, 'bull_use_spike': False, 'bull_rsi_required': False, 'bear_strategy': 'breakout', 'bear_bb_std_mult': 1.471949566175114, 'bear_rsi_os': 41, 'bear_rsi_ob': 65, 'bear_adx_thresh': 32.859419773562756, 'bear_atr_min_pct': 0.02961614575145188, 'bear_atr_max_pct': 0.05219955668726725, 'bear_tp_mult': 1.5598951301769808, 'bear_tsl_mult': 0.6467045335778199, 'bear_time_stop': 136, 'bear_use_sma': False, 'bear_use_ema': True, 'bear_use_atr': True, 'bear_use_adx': False, 'bear_use_spike': True, 'bear_rsi_required': True, 'sideways_strategy': 'mean_reversion', 'sideways_bb_std_mult': 2.6388568659198537, 'sideways_rsi_os': 45, 'sideways_rsi_ob': 58, 'sideways_adx_thresh': 33.51217176636832, 'sideways_atr_min_pct': 0.001838034879628017, 'sideways_atr_max_pct': 0.07971317803702745, 'sideways_tp_mult': 1.3702544439834035, 'sideways_tsl_mult': 0.9295908944771927, 'sideways_time_stop': 232, 'sideways_use_sma': True, 'sideways_use_ema': True, 'sideways_use_atr': False, 'sideways_use_adx': False, 'sideways_use_spike': True, 'sideways_rsi_required': True}.
[I 2025-09-01 09:56:54,812] Trial 328 finished with values: [-1000000000.0, 1000000000.0] and parameters: {'p_sma': 25, 'p_std': 22, 'p_atr': 9, 'p_adx': 14, 'rsi_period': 68, 'ema1': 29, 'ema2': 47, 'slip_atr_k': 0.08454112455065929, 'slip_spread_k': 0.5995346994774697, 'spread_hl_frac': 0.00661822969305155, 'bb_std_mult': 2.265602795645611, 'rsi_os': 8, 'rsi_ob': 57, 'vol_spike': 0.18758645368245738, 'adx_thresh': 26.512617421376873, 'atr_min_pct': 0.019700610246055565, 'atr_max_pct': 0.10225377810676745, 'tp_mult': 2.5383279559762078, 'tsl_mult': 0.8068047612261141, 'strategy': 'breakout', 'time_stop': 159, 'use_sma': False, 'use_atr': True, 'use_adx': False, 'use_ema': False, 'use_spike': True, 'rsi_required': True, 'edge_k': 0.5612927221514568, 'edge_cap': 0.8298646228996778, 'bull_strategy': 'mean_reversion', 'bull_bb_std_mult': 3.296563959825354, 'bull_rsi_os': 51, 'bull_rsi_ob': 56, 'bull_adx_thresh': 24.133828264989464, 'bull_atr_min_pct': 0.012420672725430052, 'bull_atr_max_pct': 0.07797763942900914, 'bull_tp_mult': 1.6061752418139026, 'bull_tsl_mult': 0.9431137872704368, 'bull_time_stop': 202, 'bull_use_sma': True, 'bull_use_ema': False, 'bull_use_atr': False, 'bull_use_adx': False, 'bull_use_spike': False, 'bull_rsi_required': False, 'bear_strategy': 'breakout', 'bear_bb_std_mult': 2.283228404910976, 'bear_rsi_os': 41, 'bear_rsi_ob': 60, 'bear_adx_thresh': 34.92558804876464, 'bear_atr_min_pct': 0.02735231386437657, 'bear_atr_max_pct': 0.1265577176550351, 'bear_tp_mult': 1.8963122335514109, 'bear_tsl_mult': 0.8259671369304015, 'bear_time_stop': 18, 'bear_use_sma': False, 'bear_use_ema': True, 'bear_use_atr': True, 'bear_use_adx': False, 'bear_use_spike': True, 'bear_rsi_required': True, 'sideways_strategy': 'mean_reversion', 'sideways_bb_std_mult': 2.639728135966259, 'sideways_rsi_os': 28, 'sideways_rsi_ob': 59, 'sideways_adx_thresh': 20.91035821434515, 'sideways_atr_min_pct': 0.0017071189010605106, 'sideways_atr_max_pct': 0.08925370040773599, 'sideways_tp_mult': 1.3750623744280603, 'sideways_tsl_mult': 0.2581357486624052, 'sideways_time_stop': 245, 'sideways_use_sma': True, 'sideways_use_ema': True, 'sideways_use_atr': False, 'sideways_use_adx': False, 'sideways_use_spike': True, 'sideways_rsi_required': True}.
[I 2025-09-01 09:56:55,403] Trial 326 finished with values: [-1000000000.0, 1000000000.0] and parameters: {'p_sma': 47, 'p_std': 22, 'p_atr': 30, 'p_adx': 28, 'rsi_period': 47, 'ema1': 6, 'ema2': 11, 'slip_atr_k': 0.08500377917679011, 'slip_spread_k': 0.5343870967224187, 'spread_hl_frac': 0.04491987394741382, 'bb_std_mult': 2.885321915681705, 'rsi_os': 8, 'rsi_ob': 57, 'vol_spike': 0.09327297417576734, 'adx_thresh': 22.39006956063744, 'atr_min_pct': 0.016017309996548636, 'atr_max_pct': 0.1462130784681781, 'tp_mult': 2.5516113997722587, 'tsl_mult': 0.8862071986908958, 'strategy': 'breakout', 'time_stop': 13, 'use_sma': False, 'use_atr': True, 'use_adx': False, 'use_ema': False, 'use_spike': True, 'rsi_required': True, 'edge_k': 0.5601067222113547, 'edge_cap': 0.8267032760373545, 'bull_strategy': 'mean_reversion', 'bull_bb_std_mult': 3.3748355739800227, 'bull_rsi_os': 39, 'bull_rsi_ob': 77, 'bull_adx_thresh': 27.198788636035733, 'bull_atr_min_pct': 0.006217498656969158, 'bull_atr_max_pct': 0.07709644769136716, 'bull_tp_mult': 1.5291485178775877, 'bull_tsl_mult': 0.9507668816571948, 'bull_time_stop': 88, 'bull_use_sma': True, 'bull_use_ema': False, 'bull_use_atr': False, 'bull_use_adx': False, 'bull_use_spike': False, 'bull_rsi_required': False, 'bear_strategy': 'breakout', 'bear_bb_std_mult': 1.4862447739348839, 'bear_rsi_os': 41, 'bear_rsi_ob': 65, 'bear_adx_thresh': 34.99903430226099, 'bear_atr_min_pct': 0.014061215210844375, 'bear_atr_max_pct': 0.12633539797108703, 'bear_tp_mult': 1.6416966613705086, 'bear_tsl_mult': 0.8303649797258329, 'bear_time_stop': 292, 'bear_use_sma': False, 'bear_use_ema': True, 'bear_use_atr': True, 'bear_use_adx': False, 'bear_use_spike': True, 'bear_rsi_required': True, 'sideways_strategy': 'mean_reversion', 'sideways_bb_std_mult': 2.6370566227870067, 'sideways_rsi_os': 28, 'sideways_rsi_ob': 63, 'sideways_adx_thresh': 33.50510260693137, 'sideways_atr_min_pct': 0.0017607619805961362, 'sideways_atr_max_pct': 0.08906226936102822, 'sideways_tp_mult': 2.203325340548155, 'sideways_tsl_mult': 0.15610644979795252, 'sideways_time_stop': 117, 'sideways_use_sma': True, 'sideways_use_ema': True, 'sideways_use_atr': False, 'sideways_use_adx': False, 'sideways_use_spike': True, 'sideways_rsi_required': True}.
[I 2025-09-01 09:56:55,413] Trial 329 finished with values: [-1000000000.0, 1000000000.0] and parameters: {'p_sma': 27, 'p_std': 44, 'p_atr': 27, 'p_adx': 11, 'rsi_period': 44, 'ema1': 6, 'ema2': 11, 'slip_atr_k': 0.00868785644686037, 'slip_spread_k': 0.6011517238208356, 'spread_hl_frac': 0.0335953960418026, 'bb_std_mult': 2.7153787344461113, 'rsi_os': 5, 'rsi_ob': 57, 'vol_spike': 0.19023908133357068, 'adx_thresh': 21.437831651833893, 'atr_min_pct': 0.016932552771421142, 'atr_max_pct': 0.10205076601323093, 'tp_mult': 2.550886116790002, 'tsl_mult': 0.8971060302629995, 'strategy': 'breakout', 'time_stop': 268, 'use_sma': False, 'use_atr': True, 'use_adx': False, 'use_ema': True, 'use_spike': True, 'rsi_required': True, 'edge_k': 0.46581579718078225, 'edge_cap': 0.21519989149814167, 'bull_strategy': 'mean_reversion', 'bull_bb_std_mult': 3.3156912411223938, 'bull_rsi_os': 43, 'bull_rsi_ob': 77, 'bull_adx_thresh': 27.025862966716165, 'bull_atr_min_pct': 0.007545348145325578, 'bull_atr_max_pct': 0.07860304043086985, 'bull_tp_mult': 1.6951405029661848, 'bull_tsl_mult': 0.06147426299731806, 'bull_time_stop': 203, 'bull_use_sma': True, 'bull_use_ema': False, 'bull_use_atr': False, 'bull_use_adx': False, 'bull_use_spike': False, 'bull_rsi_required': False, 'bear_strategy': 'breakout', 'bear_bb_std_mult': 1.4826304457722181, 'bear_rsi_os': 41, 'bear_rsi_ob': 69, 'bear_adx_thresh': 32.8182953433653, 'bear_atr_min_pct': 0.016976492768517676, 'bear_atr_max_pct': 0.12575474704297965, 'bear_tp_mult': 1.735603515355221, 'bear_tsl_mult': 0.6305404910079172, 'bear_time_stop': 136, 'bear_use_sma': False, 'bear_use_ema': False, 'bear_use_atr': True, 'bear_use_adx': False, 'bear_use_spike': True, 'bear_rsi_required': True, 'sideways_strategy': 'breakout', 'sideways_bb_std_mult': 2.634915763044548, 'sideways_rsi_os': 30, 'sideways_rsi_ob': 74, 'sideways_adx_thresh': 12.670686141565593, 'sideways_atr_min_pct': 0.026141809676542043, 'sideways_atr_max_pct': 0.08924945462223156, 'sideways_tp_mult': 2.3830834972137445, 'sideways_tsl_mult': 0.9243694129556409, 'sideways_time_stop': 232, 'sideways_use_sma': True, 'sideways_use_ema': True, 'sideways_use_atr': False, 'sideways_use_adx': True, 'sideways_use_spike': True, 'sideways_rsi_required': True}.
[I 2025-09-01 09:57:35,038] Trial 333 finished with values: [-1000000000.0, 1000000000.0] and parameters: {'p_sma': 10, 'p_std': 47, 'p_atr': 29, 'p_adx': 12, 'rsi_period': 40, 'ema1': 8, 'ema2': 55, 'slip_atr_k': 0.19782433305451955, 'slip_spread_k': 0.5431461495447136, 'spread_hl_frac': 0.009039193705392088, 'bb_std_mult': 2.6478192914094625, 'rsi_os': 52, 'rsi_ob': 56, 'vol_spike': 0.20289302811437102, 'adx_thresh': 25.133555314513522, 'atr_min_pct': 0.018477413669976434, 'atr_max_pct': 0.09454304923618387, 'tp_mult': 2.4279081193354166, 'tsl_mult': 0.842348532247013, 'strategy': 'breakout', 'time_stop': 124, 'use_sma': True, 'use_atr': True, 'use_adx': True, 'use_ema': True, 'use_spike': False, 'rsi_required': False, 'edge_k': 0.13417284591571788, 'edge_cap': 0.8592781845971809, 'bull_strategy': 'breakout', 'bull_bb_std_mult': 0.8483923901387289, 'bull_rsi_os': 36, 'bull_rsi_ob': 79, 'bull_adx_thresh': 28.29230759160855, 'bull_atr_min_pct': 0.0035678191976815485, 'bull_atr_max_pct': 0.09757182612759924, 'bull_tp_mult': 1.4224990760226086, 'bull_tsl_mult': 0.19819782988570372, 'bull_time_stop': 136, 'bull_use_sma': True, 'bull_use_ema': True, 'bull_use_atr': True, 'bull_use_adx': True, 'bull_use_spike': True, 'bull_rsi_required': True, 'bear_strategy': 'breakout', 'bear_bb_std_mult': 1.9432696292971534, 'bear_rsi_os': 32, 'bear_rsi_ob': 72, 'bear_adx_thresh': 33.82295428534311, 'bear_atr_min_pct': 0.02908218369739578, 'bear_atr_max_pct': 0.07031374863791108, 'bear_tp_mult': 2.8082083132822673, 'bear_tsl_mult': 0.8583534328110712, 'bear_time_stop': 45, 'bear_use_sma': False, 'bear_use_ema': False, 'bear_use_atr': False, 'bear_use_adx': True, 'bear_use_spike': True, 'bear_rsi_required': False, 'sideways_strategy': 'breakout', 'sideways_bb_std_mult': 0.8330982326381089, 'sideways_rsi_os': 26, 'sideways_rsi_ob': 60, 'sideways_adx_thresh': 31.89981333455871, 'sideways_atr_min_pct': 0.0026391619103378976, 'sideways_atr_max_pct': 0.07103928752657901, 'sideways_tp_mult': 1.7655007361847184, 'sideways_tsl_mult': 0.19750220422413634, 'sideways_time_stop': 280, 'sideways_use_sma': False, 'sideways_use_ema': False, 'sideways_use_atr': True, 'sideways_use_adx': True, 'sideways_use_spike': True, 'sideways_rsi_required': False}.
[I 2025-09-01 09:57:35,938] Trial 332 finished with values: [-0.015529139036220996, 0.01552504960972534] and parameters: {'p_sma': 59, 'p_std': 47, 'p_atr': 24, 'p_adx': 12, 'rsi_period': 8, 'ema1': 8, 'ema2': 10, 'slip_atr_k': 0.24965979067542007, 'slip_spread_k': 0.549648355636275, 'spread_hl_frac': 0.009366708698234597, 'bb_std_mult': 2.64398323837858, 'rsi_os': 36, 'rsi_ob': 50, 'vol_spike': 0.26370457833520294, 'adx_thresh': 12.567604243961645, 'atr_min_pct': 0.01835663726613247, 'atr_max_pct': 0.08728457000395136, 'tp_mult': 1.9343778574158372, 'tsl_mult': 0.05334754927850899, 'strategy': 'breakout', 'time_stop': 128, 'use_sma': True, 'use_atr': True, 'use_adx': True, 'use_ema': True, 'use_spike': False, 'rsi_required': False, 'edge_k': 0.6864050551336096, 'edge_cap': 0.8529041846827633, 'bull_strategy': 'breakout', 'bull_bb_std_mult': 1.1374773016497497, 'bull_rsi_os': 28, 'bull_rsi_ob': 79, 'bull_adx_thresh': 9.19796273442591, 'bull_atr_min_pct': 0.0033234817824364885, 'bull_atr_max_pct': 0.017278278525793667, 'bull_tp_mult': 1.4175981328696015, 'bull_tsl_mult': 0.906922448359581, 'bull_time_stop': 135, 'bull_use_sma': True, 'bull_use_ema': True, 'bull_use_atr': True, 'bull_use_adx': True, 'bull_use_spike': True, 'bull_rsi_required': True, 'bear_strategy': 'breakout', 'bear_bb_std_mult': 1.92908889783432, 'bear_rsi_os': 32, 'bear_rsi_ob': 72, 'bear_adx_thresh': 33.65930207619063, 'bear_atr_min_pct': 0.029034043131086932, 'bear_atr_max_pct': 0.05573451300872067, 'bear_tp_mult': 2.5709833392847505, 'bear_tsl_mult': 0.7903388068149411, 'bear_time_stop': 90, 'bear_use_sma': False, 'bear_use_ema': False, 'bear_use_atr': False, 'bear_use_adx': True, 'bear_use_spike': True, 'bear_rsi_required': False, 'sideways_strategy': 'breakout', 'sideways_bb_std_mult': 2.430629006474307, 'sideways_rsi_os': 26, 'sideways_rsi_ob': 60, 'sideways_adx_thresh': 11.910546978158244, 'sideways_atr_min_pct': 0.016816701731124376, 'sideways_atr_max_pct': 0.13451623333600382, 'sideways_tp_mult': 1.2802647784938694, 'sideways_tsl_mult': 0.3909179539039548, 'sideways_time_stop': 207, 'sideways_use_sma': False, 'sideways_use_ema': False, 'sideways_use_atr': True, 'sideways_use_adx': True, 'sideways_use_spike': True, 'sideways_rsi_required': False}.
[I 2025-09-01 09:57:36,502] Trial 331 finished with values: [-0.008685087123634694, 0.009224917031301808] and parameters: {'p_sma': 19, 'p_std': 44, 'p_atr': 27, 'p_adx': 21, 'rsi_period': 47, 'ema1': 13, 'ema2': 10, 'slip_atr_k': 0.24281710764490116, 'slip_spread_k': 0.5409360690198313, 'spread_hl_frac': 0.03310544651199791, 'bb_std_mult': 2.715224302094314, 'rsi_os': 13, 'rsi_ob': 56, 'vol_spike': 0.09171619168999931, 'adx_thresh': 21.511173423236748, 'atr_min_pct': 0.018483387662963216, 'atr_max_pct': 0.0653376201733431, 'tp_mult': 2.444055627753795, 'tsl_mult': 0.003175586566863453, 'strategy': 'breakout', 'time_stop': 227, 'use_sma': True, 'use_atr': True, 'use_adx': False, 'use_ema': True, 'use_spike': False, 'rsi_required': False, 'edge_k': 0.04218010201001887, 'edge_cap': 0.7660109609415562, 'bull_strategy': 'breakout', 'bull_bb_std_mult': 3.3768174925149115, 'bull_rsi_os': 40, 'bull_rsi_ob': 77, 'bull_adx_thresh': 11.942118742626292, 'bull_atr_min_pct': 0.00770731717804456, 'bull_atr_max_pct': 0.09857522054616571, 'bull_tp_mult': 1.7008381567216868, 'bull_tsl_mult': 0.9828563614183681, 'bull_time_stop': 137, 'bull_use_sma': True, 'bull_use_ema': True, 'bull_use_atr': True, 'bull_use_adx': True, 'bull_use_spike': True, 'bull_rsi_required': False, 'bear_strategy': 'breakout', 'bear_bb_std_mult': 1.5931878492140188, 'bear_rsi_os': 46, 'bear_rsi_ob': 68, 'bear_adx_thresh': 33.821497023079594, 'bear_atr_min_pct': 0.028839593747711067, 'bear_atr_max_pct': 0.07072568907368094, 'bear_tp_mult': 1.0333327065205526, 'bear_tsl_mult': 0.984495195860575, 'bear_time_stop': 286, 'bear_use_sma': False, 'bear_use_ema': False, 'bear_use_atr': False, 'bear_use_adx': True, 'bear_use_spike': True, 'bear_rsi_required': False, 'sideways_strategy': 'breakout', 'sideways_bb_std_mult': 2.3571372241222255, 'sideways_rsi_os': 35, 'sideways_rsi_ob': 60, 'sideways_adx_thresh': 9.711054808464386, 'sideways_atr_min_pct': 0.002460941888033555, 'sideways_atr_max_pct': 0.11054857181479348, 'sideways_tp_mult': 1.2787683110691828, 'sideways_tsl_mult': 0.20182214074780963, 'sideways_time_stop': 94, 'sideways_use_sma': False, 'sideways_use_ema': False, 'sideways_use_atr': False, 'sideways_use_adx': True, 'sideways_use_spike': True, 'sideways_rsi_required': False}.
