[I 2025-09-01 09:27:33,845] Trial 162 finished with values: [-1000000000.0, 1000000000.0] and parameters: {'p_sma': 24, 'p_std': 35, 'p_atr': 29, 'p_adx': 8, 'rsi_period': 74, 'ema1': 12, 'ema2': 12, 'slip_atr_k': 0.10018076615573629, 'slip_spread_k': 0.29314015842213464, 'spread_hl_frac': 0.001953618752403085, 'bb_std_mult': 2.398463524447721, 'rsi_os': 43, 'rsi_ob': 95, 'vol_spike': 0.23041283435567855, 'adx_thresh': 7.225394270678436, 'atr_min_pct': 0.015732808027621344, 'atr_max_pct': 0.1429509326697732, 'tp_mult': 2.357977578204079, 'tsl_mult': 0.9541778260031202, 'strategy': 'mean_reversion', 'time_stop': 147, 'use_sma': True, 'use_atr': False, 'use_adx': False, 'use_ema': False, 'use_spike': True, 'rsi_required': False, 'edge_k': 0.5075007928209025, 'edge_cap': 0.21195555618199996, 'bull_strategy': 'mean_reversion', 'bull_bb_std_mult': 0.883937363798754, 'bull_rsi_os': 31, 'bull_rsi_ob': 53, 'bull_adx_thresh': 12.576057440893344, 'bull_atr_min_pct': 0.020004424319488, 'bull_atr_max_pct': 0.03095998476235706, 'bull_tp_mult': 2.5249420863245255, 'bull_tsl_mult': 0.5642605621610277, 'bull_time_stop': 24, 'bull_use_sma': False, 'bull_use_ema': False, 'bull_use_atr': True, 'bull_use_adx': False, 'bull_use_spike': True, 'bull_rsi_required': True, 'bear_strategy': 'breakout', 'bear_bb_std_mult': 2.3935007362922813, 'bear_rsi_os': 29, 'bear_rsi_ob': 94, 'bear_adx_thresh': 14.871193752220497, 'bear_atr_min_pct': 0.027323954604945168, 'bear_atr_max_pct': 0.04606641874196063, 'bear_tp_mult': 2.793976984507423, 'bear_tsl_mult': 0.7731022502628165, 'bear_time_stop': 215, 'bear_use_sma': False, 'bear_use_ema': False, 'bear_use_atr': True, 'bear_use_adx': True, 'bear_use_spike': False, 'bear_rsi_required': False, 'sideways_strategy': 'mean_reversion', 'sideways_bb_std_mult': 0.5901053489304915, 'sideways_rsi_os': 28, 'sideways_rsi_ob': 64, 'sideways_adx_thresh': 34.683154919572154, 'sideways_atr_min_pct': 0.027273110460551028, 'sideways_atr_max_pct': 0.060462876173821976, 'sideways_tp_mult': 1.971014820076773, 'sideways_tsl_mult': 0.5543169482879745, 'sideways_time_stop': 19, 'sideways_use_sma': True, 'sideways_use_ema': False, 'sideways_use_atr': False, 'sideways_use_adx': False, 'sideways_use_spike': False, 'sideways_rsi_required': False}.
[I 2025-09-01 09:27:34,104] Trial 164 finished with values: [-1000000000.0, 1000000000.0] and parameters: {'p_sma': 19, 'p_std': 51, 'p_atr': 28, 'p_adx': 10, 'rsi_period': 41, 'ema1': 23, 'ema2': 51, 'slip_atr_k': 0.1060575264115741, 'slip_spread_k': 0.22981719682409898, 'spread_hl_frac': 0.03357589921815096, 'bb_std_mult': 2.5897769196037563, 'rsi_os': 43, 'rsi_ob': 95, 'vol_spike': 0.1457218874151659, 'adx_thresh': 24.865582511764735, 'atr_min_pct': 0.012419313294808677, 'atr_max_pct': 0.04627779038856499, 'tp_mult': 2.332823425814892, 'tsl_mult': 0.4756917183688327, 'strategy': 'mean_reversion', 'time_stop': 137, 'use_sma': True, 'use_atr': False, 'use_adx': False, 'use_ema': False, 'use_spike': True, 'rsi_required': False, 'edge_k': 0.9758125264716742, 'edge_cap': 0.6728247189917305, 'bull_strategy': 'mean_reversion', 'bull_bb_std_mult': 0.92953500146548, 'bull_rsi_os': 31, 'bull_rsi_ob': 54, 'bull_adx_thresh': 17.233084183311625, 'bull_atr_min_pct': 0.02540416431751035, 'bull_atr_max_pct': 0.0379118066788446, 'bull_tp_mult': 2.5255682240676567, 'bull_tsl_mult': 0.49533580931457105, 'bull_time_stop': 259, 'bull_use_sma': False, 'bull_use_ema': False, 'bull_use_atr': True, 'bull_use_adx': False, 'bull_use_spike': True, 'bull_rsi_required': True, 'bear_strategy': 'breakout', 'bear_bb_std_mult': 0.8029356366682077, 'bear_rsi_os': 6, 'bear_rsi_ob': 49, 'bear_adx_thresh': 16.93998408245147, 'bear_atr_min_pct': 0.01863324552543035, 'bear_atr_max_pct': 0.04762884013014901, 'bear_tp_mult': 2.9359852533463973, 'bear_tsl_mult': 0.7964861428244273, 'bear_time_stop': 116, 'bear_use_sma': False, 'bear_use_ema': False, 'bear_use_atr': True, 'bear_use_adx': True, 'bear_use_spike': False, 'bear_rsi_required': False, 'sideways_strategy': 'mean_reversion', 'sideways_bb_std_mult': 2.1556700060489975, 'sideways_rsi_os': 28, 'sideways_rsi_ob': 65, 'sideways_adx_thresh': 24.89192562581354, 'sideways_atr_min_pct': 0.027264306986930185, 'sideways_atr_max_pct': 0.0537935762569218, 'sideways_tp_mult': 1.9763843519569109, 'sideways_tsl_mult': 0.8775870020121264, 'sideways_time_stop': 18, 'sideways_use_sma': True, 'sideways_use_ema': False, 'sideways_use_atr': False, 'sideways_use_adx': False, 'sideways_use_spike': False, 'sideways_rsi_required': False}.
[I 2025-09-01 09:27:34,363] Trial 163 finished with values: [-1000000000.0, 1000000000.0] and parameters: {'p_sma': 17, 'p_std': 12, 'p_atr': 28, 'p_adx': 10, 'rsi_period': 44, 'ema1': 23, 'ema2': 26, 'slip_atr_k': 0.22338172103195603, 'slip_spread_k': 0.6165234252704664, 'spread_hl_frac': 0.017049540697931936, 'bb_std_mult': 2.6123861748482176, 'rsi_os': 43, 'rsi_ob': 81, 'vol_spike': 0.1311233446337523, 'adx_thresh': 24.913795051491924, 'atr_min_pct': 0.012357137211850564, 'atr_max_pct': 0.025100411463378734, 'tp_mult': 2.3362867541177725, 'tsl_mult': 0.9050809896814351, 'strategy': 'mean_reversion', 'time_stop': 139, 'use_sma': True, 'use_atr': False, 'use_adx': False, 'use_ema': False, 'use_spike': True, 'rsi_required': False, 'edge_k': 0.01862008674834481, 'edge_cap': 0.7147599130866811, 'bull_strategy': 'mean_reversion', 'bull_bb_std_mult': 0.8649503782483685, 'bull_rsi_os': 31, 'bull_rsi_ob': 54, 'bull_adx_thresh': 12.47457785394808, 'bull_atr_min_pct': 0.007755078168603636, 'bull_atr_max_pct': 0.03801259637088575, 'bull_tp_mult': 2.337037948373906, 'bull_tsl_mult': 0.559355729559895, 'bull_time_stop': 73, 'bull_use_sma': False, 'bull_use_ema': False, 'bull_use_atr': True, 'bull_use_adx': False, 'bull_use_spike': True, 'bull_rsi_required': True, 'bear_strategy': 'breakout', 'bear_bb_std_mult': 0.7633783248812469, 'bear_rsi_os': 7, 'bear_rsi_ob': 94, 'bear_adx_thresh': 17.19267043724474, 'bear_atr_min_pct': 0.02921221857833381, 'bear_atr_max_pct': 0.040982901849495025, 'bear_tp_mult': 1.3664538316104045, 'bear_tsl_mult': 0.7908253164172648, 'bear_time_stop': 240, 'bear_use_sma': False, 'bear_use_ema': False, 'bear_use_atr': True, 'bear_use_adx': True, 'bear_use_spike': False, 'bear_rsi_required': False, 'sideways_strategy': 'mean_reversion', 'sideways_bb_std_mult': 2.156929684167434, 'sideways_rsi_os': 28, 'sideways_rsi_ob': 90, 'sideways_adx_thresh': 33.633393259857264, 'sideways_atr_min_pct': 0.025885670840257412, 'sideways_atr_max_pct': 0.05676960835022482, 'sideways_tp_mult': 1.9565984640891958, 'sideways_tsl_mult': 0.8752214853852109, 'sideways_time_stop': 13, 'sideways_use_sma': True, 'sideways_use_ema': False, 'sideways_use_atr': False, 'sideways_use_adx': False, 'sideways_use_spike': False, 'sideways_rsi_required': False}.
[I 2025-09-01 09:27:35,240] Trial 165 finished with values: [-1000000000.0, 1000000000.0] and parameters: {'p_sma': 20, 'p_std': 52, 'p_atr': 28, 'p_adx': 10, 'rsi_period': 41, 'ema1': 8, 'ema2': 51, 'slip_atr_k': 0.012333274885314285, 'slip_spread_k': 0.2230081198960615, 'spread_hl_frac': 0.03509342974262983, 'bb_std_mult': 2.5809926090535784, 'rsi_os': 13, 'rsi_ob': 57, 'vol_spike': 0.1447909303336696, 'adx_thresh': 24.768960343177234, 'atr_min_pct': 0.010873439242482418, 'atr_max_pct': 0.01015413962566673, 'tp_mult': 2.4886898950498684, 'tsl_mult': 0.2716765224988902, 'strategy': 'mean_reversion', 'time_stop': 138, 'use_sma': True, 'use_atr': False, 'use_adx': False, 'use_ema': False, 'use_spike': True, 'rsi_required': False, 'edge_k': 0.5899851782699136, 'edge_cap': 0.8459900653716156, 'bull_strategy': 'mean_reversion', 'bull_bb_std_mult': 2.0884069749138243, 'bull_rsi_os': 30, 'bull_rsi_ob': 69, 'bull_adx_thresh': 17.479598326986977, 'bull_atr_min_pct': 0.025553238061341937, 'bull_atr_max_pct': 0.03916906903031833, 'bull_tp_mult': 1.3801821445371485, 'bull_tsl_mult': 0.4930089652221472, 'bull_time_stop': 219, 'bull_use_sma': False, 'bull_use_ema': False, 'bull_use_atr': True, 'bull_use_adx': False, 'bull_use_spike': True, 'bull_rsi_required': False, 'bear_strategy': 'breakout', 'bear_bb_std_mult': 1.990746352312858, 'bear_rsi_os': 25, 'bear_rsi_ob': 56, 'bear_adx_thresh': 17.460843966806827, 'bear_atr_min_pct': 0.02909057663433494, 'bear_atr_max_pct': 0.10013840012041667, 'bear_tp_mult': 1.3716468089542866, 'bear_tsl_mult': 0.805870270172164, 'bear_time_stop': 240, 'bear_use_sma': False, 'bear_use_ema': False, 'bear_use_atr': True, 'bear_use_adx': True, 'bear_use_spike': True, 'bear_rsi_required': False, 'sideways_strategy': 'mean_reversion', 'sideways_bb_std_mult': 2.125603161220812, 'sideways_rsi_os': 27, 'sideways_rsi_ob': 57, 'sideways_adx_thresh': 24.94781631966679, 'sideways_atr_min_pct': 0.002022049450660882, 'sideways_atr_max_pct': 0.09017111063544472, 'sideways_tp_mult': 1.3559709362396313, 'sideways_tsl_mult': 0.8346932422257287, 'sideways_time_stop': 225, 'sideways_use_sma': True, 'sideways_use_ema': False, 'sideways_use_atr': False, 'sideways_use_adx': False, 'sideways_use_spike': False, 'sideways_rsi_required': False}.
[I 2025-09-01 09:28:15,961] Trial 167 finished with values: [-1000000000.0, 1000000000.0] and parameters: {'p_sma': 57, 'p_std': 30, 'p_atr': 28, 'p_adx': 29, 'rsi_period': 56, 'ema1': 8, 'ema2': 10, 'slip_atr_k': 0.2080060227905132, 'slip_spread_k': 0.8354194325300264, 'spread_hl_frac': 0.014269245436397108, 'bb_std_mult': 2.756695293078132, 'rsi_os': 41, 'rsi_ob': 57, 'vol_spike': 0.20269109939127597, 'adx_thresh': 12.63545481864534, 'atr_min_pct': 0.010871018314021005, 'atr_max_pct': 0.0710657839844413, 'tp_mult': 2.4975925946887276, 'tsl_mult': 0.26497076168745803, 'strategy': 'breakout', 'time_stop': 151, 'use_sma': True, 'use_atr': True, 'use_adx': True, 'use_ema': False, 'use_spike': True, 'rsi_required': False, 'edge_k': 0.5878567468010777, 'edge_cap': 0.33388520320189324, 'bull_strategy': 'mean_reversion', 'bull_bb_std_mult': 2.1007641766883887, 'bull_rsi_os': 35, 'bull_rsi_ob': 69, 'bull_adx_thresh': 19.075093494644573, 'bull_atr_min_pct': 0.008565712511386726, 'bull_atr_max_pct': 0.14938522706860607, 'bull_tp_mult': 2.420116896249373, 'bull_tsl_mult': 0.5211868651733677, 'bull_time_stop': 199, 'bull_use_sma': True, 'bull_use_ema': False, 'bull_use_atr': True, 'bull_use_adx': True, 'bull_use_spike': True, 'bull_rsi_required': False, 'bear_strategy': 'breakout', 'bear_bb_std_mult': 1.4506598719147434, 'bear_rsi_os': 43, 'bear_rsi_ob': 79, 'bear_adx_thresh': 13.90801630419929, 'bear_atr_min_pct': 0.028585681632597094, 'bear_atr_max_pct': 0.0830004105735864, 'bear_tp_mult': 2.9223334408917507, 'bear_tsl_mult': 0.7295415633055161, 'bear_time_stop': 234, 'bear_use_sma': True, 'bear_use_ema': True, 'bear_use_atr': False, 'bear_use_adx': True, 'bear_use_spike': True, 'bear_rsi_required': False, 'sideways_strategy': 'mean_reversion', 'sideways_bb_std_mult': 2.118486331725817, 'sideways_rsi_os': 27, 'sideways_rsi_ob': 58, 'sideways_adx_thresh': 24.024312372658976, 'sideways_atr_min_pct': 0.002021813250234848, 'sideways_atr_max_pct': 0.0450100159467793, 'sideways_tp_mult': 1.3827662635782814, 'sideways_tsl_mult': 0.17030132289403077, 'sideways_time_stop': 141, 'sideways_use_sma': False, 'sideways_use_ema': False, 'sideways_use_atr': False, 'sideways_use_adx': True, 'sideways_use_spike': True, 'sideways_rsi_required': False}.
[I 2025-09-01 09:28:16,521] Trial 166 finished with values: [-0.0009046756208718199, 0.0018643760066128132] and parameters: {'p_sma': 59, 'p_std': 39, 'p_atr': 28, 'p_adx': 11, 'rsi_period': 44, 'ema1': 8, 'ema2': 10, 'slip_atr_k': 0.012658443618897449, 'slip_spread_k': 0.4900121494953035, 'spread_hl_frac': 0.006244792601256842, 'bb_std_mult': 2.6982850967807455, 'rsi_os': 13, 'rsi_ob': 57, 'vol_spike': 0.20223473947182408, 'adx_thresh': 12.779581992421138, 'atr_min_pct': 0.021322293598180567, 'atr_max_pct': 0.07158117312199577, 'tp_mult': 2.4886650570526556, 'tsl_mult': 0.9013935416309388, 'strategy': 'breakout', 'time_stop': 140, 'use_sma': True, 'use_atr': True, 'use_adx': False, 'use_ema': False, 'use_spike': True, 'rsi_required': False, 'edge_k': 0.594346659642293, 'edge_cap': 0.8527503940418824, 'bull_strategy': 'mean_reversion', 'bull_bb_std_mult': 3.38251356745685, 'bull_rsi_os': 35, 'bull_rsi_ob': 77, 'bull_adx_thresh': 28.75108959158574, 'bull_atr_min_pct': 0.006976519377461915, 'bull_atr_max_pct': 0.06713351329175561, 'bull_tp_mult': 1.69546944162679, 'bull_tsl_mult': 0.8760528583231408, 'bull_time_stop': 104, 'bull_use_sma': True, 'bull_use_ema': False, 'bull_use_atr': True, 'bull_use_adx': False, 'bull_use_spike': True, 'bull_rsi_required': False, 'bear_strategy': 'breakout', 'bear_bb_std_mult': 1.4603486040905098, 'bear_rsi_os': 43, 'bear_rsi_ob': 80, 'bear_adx_thresh': 30.42787144824561, 'bear_atr_min_pct': 0.02921132476795027, 'bear_atr_max_pct': 0.12216778482524068, 'bear_tp_mult': 2.900901844642106, 'bear_tsl_mult': 0.8155583480507067, 'bear_time_stop': 238, 'bear_use_sma': False, 'bear_use_ema': True, 'bear_use_atr': True, 'bear_use_adx': True, 'bear_use_spike': True, 'bear_rsi_required': False, 'sideways_strategy': 'mean_reversion', 'sideways_bb_std_mult': 2.5358213867921924, 'sideways_rsi_os': 29, 'sideways_rsi_ob': 58, 'sideways_adx_thresh': 31.900393991324254, 'sideways_atr_min_pct': 0.002117369635402622, 'sideways_atr_max_pct': 0.09097693643646018, 'sideways_tp_mult': 1.3828438834807426, 'sideways_tsl_mult': 0.9589360157801744, 'sideways_time_stop': 224, 'sideways_use_sma': True, 'sideways_use_ema': False, 'sideways_use_atr': False, 'sideways_use_adx': False, 'sideways_use_spike': True, 'sideways_rsi_required': False}.
[I 2025-09-01 09:28:16,970] Trial 168 finished with values: [-0.01759017381726713, 0.017537672450563677] and parameters: {'p_sma': 57, 'p_std': 60, 'p_atr': 28, 'p_adx': 29, 'rsi_period': 28, 'ema1': 8, 'ema2': 10, 'slip_atr_k': 0.21230545728545924, 'slip_spread_k': 0.23250998542606513, 'spread_hl_frac': 0.006121992737119615, 'bb_std_mult': 2.7729401781100953, 'rsi_os': 41, 'rsi_ob': 57, 'vol_spike': 0.2027547195480671, 'adx_thresh': 9.837494071085166, 'atr_min_pct': 0.021104794858641186, 'atr_max_pct': 0.13667395255665588, 'tp_mult': 2.4974628350705106, 'tsl_mult': 0.2701300410184716, 'strategy': 'breakout', 'time_stop': 13, 'use_sma': True, 'use_atr': True, 'use_adx': True, 'use_ema': False, 'use_spike': True, 'rsi_required': False, 'edge_k': 0.5802668178825651, 'edge_cap': 0.2872652037712893, 'bull_strategy': 'mean_reversion', 'bull_bb_std_mult': 2.0665408808429957, 'bull_rsi_os': 35, 'bull_rsi_ob': 62, 'bull_adx_thresh': 13.995890869464144, 'bull_atr_min_pct': 0.0068523225257647365, 'bull_atr_max_pct': 0.05167476440348895, 'bull_tp_mult': 2.4933550886478235, 'bull_tsl_mult': 0.6996730130155475, 'bull_time_stop': 232, 'bull_use_sma': True, 'bull_use_ema': False, 'bull_use_atr': True, 'bull_use_adx': True, 'bull_use_spike': True, 'bull_rsi_required': False, 'bear_strategy': 'breakout', 'bear_bb_std_mult': 1.4633429837255785, 'bear_rsi_os': 25, 'bear_rsi_ob': 72, 'bear_adx_thresh': 10.101751620720634, 'bear_atr_min_pct': 0.028723770166822853, 'bear_atr_max_pct': 0.12241623450649104, 'bear_tp_mult': 2.0102296599050424, 'bear_tsl_mult': 0.8154143014703764, 'bear_time_stop': 23, 'bear_use_sma': True, 'bear_use_ema': True, 'bear_use_atr': False, 'bear_use_adx': True, 'bear_use_spike': True, 'bear_rsi_required': False, 'sideways_strategy': 'mean_reversion', 'sideways_bb_std_mult': 2.524302420156043, 'sideways_rsi_os': 29, 'sideways_rsi_ob': 58, 'sideways_adx_thresh': 24.03053718926477, 'sideways_atr_min_pct': 0.0018881607144604691, 'sideways_atr_max_pct': 0.04417672603891234, 'sideways_tp_mult': 1.3916503329853465, 'sideways_tsl_mult': 0.44616231328987455, 'sideways_time_stop': 202, 'sideways_use_sma': False, 'sideways_use_ema': False, 'sideways_use_atr': False, 'sideways_use_adx': True, 'sideways_use_spike': True, 'sideways_rsi_required': False}.
[I 2025-09-01 09:28:17,388] Trial 169 finished with values: [-0.03761717308484602, 0.03740496461195868] and parameters: {'p_sma': 59, 'p_std': 59, 'p_atr': 27, 'p_adx': 25, 'rsi_period': 39, 'ema1': 24, 'ema2': 10, 'slip_atr_k': 0.09097417458066072, 'slip_spread_k': 0.8371199404965576, 'spread_hl_frac': 0.040367031792892645, 'bb_std_mult': 2.7671622880977385, 'rsi_os': 41, 'rsi_ob': 64, 'vol_spike': 0.12480056713598515, 'adx_thresh': 28.30454212432144, 'atr_min_pct': 0.020915274260525328, 'atr_max_pct': 0.07196255986446581, 'tp_mult': 1.4507244240768886, 'tsl_mult': 0.3491811722339773, 'strategy': 'breakout', 'time_stop': 121, 'use_sma': True, 'use_atr': True, 'use_adx': True, 'use_ema': False, 'use_spike': True, 'rsi_required': False, 'edge_k': 0.42194706313385355, 'edge_cap': 0.3359380419901511, 'bull_strategy': 'mean_reversion', 'bull_bb_std_mult': 1.3613659895430201, 'bull_rsi_os': 35, 'bull_rsi_ob': 56, 'bull_adx_thresh': 5.5133149123062495, 'bull_atr_min_pct': 0.006891999291188644, 'bull_atr_max_pct': 0.03444963281020133, 'bull_tp_mult': 2.425813173527393, 'bull_tsl_mult': 0.11258801477045399, 'bull_time_stop': 198, 'bull_use_sma': True, 'bull_use_ema': False, 'bull_use_atr': False, 'bull_use_adx': True, 'bull_use_spike': False, 'bull_rsi_required': False, 'bear_strategy': 'mean_reversion', 'bear_bb_std_mult': 3.5170591898641836, 'bear_rsi_os': 26, 'bear_rsi_ob': 79, 'bear_adx_thresh': 26.326100114475153, 'bear_atr_min_pct': 0.028276350703408892, 'bear_atr_max_pct': 0.10730233759210689, 'bear_tp_mult': 2.911621451773902, 'bear_tsl_mult': 0.8317052216134317, 'bear_time_stop': 26, 'bear_use_sma': True, 'bear_use_ema': True, 'bear_use_atr': False, 'bear_use_adx': False, 'bear_use_spike': False, 'bear_rsi_required': True, 'sideways_strategy': 'breakout', 'sideways_bb_std_mult': 2.9400092158449698, 'sideways_rsi_os': 29, 'sideways_rsi_ob': 58, 'sideways_adx_thresh': 24.154944192582896, 'sideways_atr_min_pct': 0.0017608751357379281, 'sideways_atr_max_pct': 0.09335117814892016, 'sideways_tp_mult': 2.425766969746836, 'sideways_tsl_mult': 0.39332120105866036, 'sideways_time_stop': 203, 'sideways_use_sma': False, 'sideways_use_ema': True, 'sideways_use_atr': True, 'sideways_use_adx': True, 'sideways_use_spike': True, 'sideways_rsi_required': True}.
[I 2025-09-01 09:28:59,855] Trial 171 finished with values: [-1000000000.0, 1000000000.0] and parameters: {'p_sma': 60, 'p_std': 40, 'p_atr': 27, 'p_adx': 12, 'rsi_period': 49, 'ema1': 7, 'ema2': 11, 'slip_atr_k': 0.0015514036581084772, 'slip_spread_k': 0.4883727982307066, 'spread_hl_frac': 0.004797163654450701, 'bb_std_mult': 2.6901685475043595, 'rsi_os': 11, 'rsi_ob': 58, 'vol_spike': 0.18138398792108465, 'adx_thresh': 13.234459683159294, 'atr_min_pct': 0.021252760610326858, 'atr_max_pct': 0.06583402236337722, 'tp_mult': 2.588552541450565, 'tsl_mult': 0.9000376067100431, 'strategy': 'breakout', 'time_stop': 121, 'use_sma': True, 'use_atr': True, 'use_adx': False, 'use_ema': False, 'use_spike': True, 'rsi_required': False, 'edge_k': 0.6411988423134448, 'edge_cap': 0.8980576315133899, 'bull_strategy': 'mean_reversion', 'bull_bb_std_mult': 3.393908753285801, 'bull_rsi_os': 36, 'bull_rsi_ob': 77, 'bull_adx_thresh': 28.879737984225972, 'bull_atr_min_pct': 0.007102946781962849, 'bull_atr_max_pct': 0.06721101988862038, 'bull_tp_mult': 1.6838034021095534, 'bull_tsl_mult': 0.8708090434431722, 'bull_time_stop': 107, 'bull_use_sma': True, 'bull_use_ema': False, 'bull_use_atr': True, 'bull_use_adx': False, 'bull_use_spike': True, 'bull_rsi_required': False, 'bear_strategy': 'breakout', 'bear_bb_std_mult': 1.6553865401710144, 'bear_rsi_os': 47, 'bear_rsi_ob': 80, 'bear_adx_thresh': 26.085206968166503, 'bear_atr_min_pct': 0.029577888069402827, 'bear_atr_max_pct': 0.12208339065736185, 'bear_tp_mult': 2.814991847617694, 'bear_tsl_mult': 0.8380014515755256, 'bear_time_stop': 246, 'bear_use_sma': False, 'bear_use_ema': True, 'bear_use_atr': True, 'bear_use_adx': True, 'bear_use_spike': True, 'bear_rsi_required': False, 'sideways_strategy': 'mean_reversion', 'sideways_bb_std_mult': 2.6343724201680856, 'sideways_rsi_os': 29, 'sideways_rsi_ob': 58, 'sideways_adx_thresh': 31.626904034995007, 'sideways_atr_min_pct': 0.004192096479133038, 'sideways_atr_max_pct': 0.09476671599947685, 'sideways_tp_mult': 1.3900277146635183, 'sideways_tsl_mult': 0.9610349436083632, 'sideways_time_stop': 243, 'sideways_use_sma': True, 'sideways_use_ema': False, 'sideways_use_atr': False, 'sideways_use_adx': False, 'sideways_use_spike': True, 'sideways_rsi_required': False}.
