[I 2025-09-01 10:42:52,515] Trial 596 finished with values: [-0.06048235332978691, 0.060676089967186715] and parameters: {'p_sma': 55, 'p_std': 42, 'p_atr': 27, 'p_adx': 10, 'rsi_period': 47, 'ema1': 27, 'ema2': 15, 'slip_atr_k': 0.007438424487243789, 'slip_spread_k': 0.5285775019637022, 'spread_hl_frac': 0.006328280475855406, 'bb_std_mult': 3.3940998953822765, 'rsi_os': 37, 'rsi_ob': 55, 'vol_spike': 0.17520392940589255, 'adx_thresh': 11.812735960039435, 'atr_min_pct': 0.016982093634160672, 'atr_max_pct': 0.0663265552794881, 'tp_mult': 2.445983727981223, 'tsl_mult': 0.390839248451181, 'strategy': 'mean_reversion', 'time_stop': 167, 'use_sma': True, 'use_atr': True, 'use_adx': False, 'use_ema': False, 'use_spike': False, 'rsi_required': False, 'edge_k': 0.4256020403714428, 'edge_cap': 0.8850771681433657, 'bull_strategy': 'mean_reversion', 'bull_bb_std_mult': 1.4646193979761253, 'bull_rsi_os': 19, 'bull_rsi_ob': 80, 'bull_adx_thresh': 27.752066089430162, 'bull_atr_min_pct': 0.015982408609296075, 'bull_atr_max_pct': 0.08481252409797645, 'bull_tp_mult': 1.5972689961034634, 'bull_tsl_mult': 0.8947474993033083, 'bull_time_stop': 159, 'bull_use_sma': True, 'bull_use_ema': False, 'bull_use_atr': True, 'bull_use_adx': False, 'bull_use_spike': True, 'bull_rsi_required': False, 'bear_strategy': 'breakout', 'bear_bb_std_mult': 1.4954664056371598, 'bear_rsi_os': 41, 'bear_rsi_ob': 70, 'bear_adx_thresh': 20.864793861825273, 'bear_atr_min_pct': 0.004120849826493297, 'bear_atr_max_pct': 0.03665770627211044, 'bear_tp_mult': 1.0131691787213835, 'bear_tsl_mult': 0.29842336958733584, 'bear_time_stop': 29, 'bear_use_sma': False, 'bear_use_ema': True, 'bear_use_atr': True, 'bear_use_adx': True, 'bear_use_spike': True, 'bear_rsi_required': False, 'sideways_strategy': 'breakout', 'sideways_bb_std_mult': 2.487202638609902, 'sideways_rsi_os': 30, 'sideways_rsi_ob': 58, 'sideways_adx_thresh': 29.771420540893676, 'sideways_atr_min_pct': 0.0012255108030559785, 'sideways_atr_max_pct': 0.08818682048208121, 'sideways_tp_mult': 1.3651762540076486, 'sideways_tsl_mult': 0.4683038994028276, 'sideways_time_stop': 291, 'sideways_use_sma': True, 'sideways_use_ema': False, 'sideways_use_atr': False, 'sideways_use_adx': True, 'sideways_use_spike': False, 'sideways_rsi_required': False}.
[I 2025-09-01 10:42:52,523] Trial 597 finished with values: [-1000000000.0, 1000000000.0] and parameters: {'p_sma': 47, 'p_std': 44, 'p_atr': 29, 'p_adx': 10, 'rsi_period': 47, 'ema1': 7, 'ema2': 42, 'slip_atr_k': 0.008796677744439622, 'slip_spread_k': 0.5311309899023928, 'spread_hl_frac': 0.04022153009342715, 'bb_std_mult': 0.710064263717574, 'rsi_os': 45, 'rsi_ob': 67, 'vol_spike': 0.12366794819507769, 'adx_thresh': 5.018216731958054, 'atr_min_pct': 0.017114668999312896, 'atr_max_pct': 0.06603008631834327, 'tp_mult': 2.4489021866891276, 'tsl_mult': 0.8382080949318218, 'strategy': 'mean_reversion', 'time_stop': 130, 'use_sma': True, 'use_atr': True, 'use_adx': False, 'use_ema': False, 'use_spike': False, 'rsi_required': False, 'edge_k': 0.6520715878088362, 'edge_cap': 0.8318203896460007, 'bull_strategy': 'mean_reversion', 'bull_bb_std_mult': 3.2145549053766613, 'bull_rsi_os': 34, 'bull_rsi_ob': 79, 'bull_adx_thresh': 27.6735853683245, 'bull_atr_min_pct': 0.02792176264437704, 'bull_atr_max_pct': 0.08500600641078657, 'bull_tp_mult': 1.5871346739652301, 'bull_tsl_mult': 0.619632316251195, 'bull_time_stop': 145, 'bull_use_sma': False, 'bull_use_ema': False, 'bull_use_atr': True, 'bull_use_adx': False, 'bull_use_spike': True, 'bull_rsi_required': False, 'bear_strategy': 'breakout', 'bear_bb_std_mult': 1.091466275016824, 'bear_rsi_os': 40, 'bear_rsi_ob': 76, 'bear_adx_thresh': 33.46946923456901, 'bear_atr_min_pct': 0.019915041165771235, 'bear_atr_max_pct': 0.0752548518528308, 'bear_tp_mult': 1.1318983744549413, 'bear_tsl_mult': 0.8617067138167175, 'bear_time_stop': 154, 'bear_use_sma': False, 'bear_use_ema': True, 'bear_use_atr': True, 'bear_use_adx': True, 'bear_use_spike': True, 'bear_rsi_required': True, 'sideways_strategy': 'breakout', 'sideways_bb_std_mult': 2.3411236985562223, 'sideways_rsi_os': 30, 'sideways_rsi_ob': 58, 'sideways_adx_thresh': 14.4734780658366, 'sideways_atr_min_pct': 0.02999896022872096, 'sideways_atr_max_pct': 0.10139752888038205, 'sideways_tp_mult': 2.9087158885021753, 'sideways_tsl_mult': 0.031990259325201886, 'sideways_time_stop': 91, 'sideways_use_sma': True, 'sideways_use_ema': False, 'sideways_use_atr': True, 'sideways_use_adx': True, 'sideways_use_spike': False, 'sideways_rsi_required': False}.
[I 2025-09-01 10:42:53,035] Trial 594 finished with values: [-1000000000.0, 1000000000.0] and parameters: {'p_sma': 55, 'p_std': 33, 'p_atr': 29, 'p_adx': 10, 'rsi_period': 43, 'ema1': 12, 'ema2': 34, 'slip_atr_k': 0.22081137984495816, 'slip_spread_k': 0.9251448033411119, 'spread_hl_frac': 0.00592906376668662, 'bb_std_mult': 3.0656538820127492, 'rsi_os': 9, 'rsi_ob': 55, 'vol_spike': 0.12793893889135824, 'adx_thresh': 11.622965035249273, 'atr_min_pct': 0.017177591743084822, 'atr_max_pct': 0.06641477362404691, 'tp_mult': 1.3111661315213954, 'tsl_mult': 0.8419367308012126, 'strategy': 'mean_reversion', 'time_stop': 207, 'use_sma': True, 'use_atr': True, 'use_adx': False, 'use_ema': False, 'use_spike': False, 'rsi_required': False, 'edge_k': 0.4236854582256433, 'edge_cap': 0.8801337971619445, 'bull_strategy': 'mean_reversion', 'bull_bb_std_mult': 3.5468827894204655, 'bull_rsi_os': 6, 'bull_rsi_ob': 80, 'bull_adx_thresh': 6.251103606907243, 'bull_atr_min_pct': 0.00492664061653769, 'bull_atr_max_pct': 0.08499334949915016, 'bull_tp_mult': 1.5898793883274764, 'bull_tsl_mult': 0.6250121054191358, 'bull_time_stop': 147, 'bull_use_sma': False, 'bull_use_ema': False, 'bull_use_atr': True, 'bull_use_adx': False, 'bull_use_spike': True, 'bull_rsi_required': False, 'bear_strategy': 'breakout', 'bear_bb_std_mult': 3.571040033384318, 'bear_rsi_os': 11, 'bear_rsi_ob': 83, 'bear_adx_thresh': 32.47150594025292, 'bear_atr_min_pct': 0.009274967007742468, 'bear_atr_max_pct': 0.12973081407176876, 'bear_tp_mult': 2.3745170445335155, 'bear_tsl_mult': 0.8060837209299667, 'bear_time_stop': 28, 'bear_use_sma': False, 'bear_use_ema': True, 'bear_use_atr': True, 'bear_use_adx': True, 'bear_use_spike': True, 'bear_rsi_required': True, 'sideways_strategy': 'breakout', 'sideways_bb_std_mult': 2.155579746414798, 'sideways_rsi_os': 33, 'sideways_rsi_ob': 58, 'sideways_adx_thresh': 33.14543545973857, 'sideways_atr_min_pct': 0.008758245241000502, 'sideways_atr_max_pct': 0.03164758228092911, 'sideways_tp_mult': 1.358344814681581, 'sideways_tsl_mult': 0.9562789303888701, 'sideways_time_stop': 215, 'sideways_use_sma': True, 'sideways_use_ema': False, 'sideways_use_atr': False, 'sideways_use_adx': True, 'sideways_use_spike': True, 'sideways_rsi_required': False}.
[I 2025-09-01 10:42:53,051] Trial 595 finished with values: [-0.010865031274865045, 0.011629867830882006] and parameters: {'p_sma': 55, 'p_std': 55, 'p_atr': 29, 'p_adx': 10, 'rsi_period': 43, 'ema1': 15, 'ema2': 19, 'slip_atr_k': 0.006402221895855706, 'slip_spread_k': 0.5769441333398387, 'spread_hl_frac': 0.005779053245844307, 'bb_std_mult': 1.9676910027517116, 'rsi_os': 9, 'rsi_ob': 82, 'vol_spike': 0.19833025764870313, 'adx_thresh': 9.71724983892228, 'atr_min_pct': 0.019703010383714414, 'atr_max_pct': 0.06710479590967323, 'tp_mult': 2.6714730443823917, 'tsl_mult': 0.21189672776392088, 'strategy': 'mean_reversion', 'time_stop': 153, 'use_sma': True, 'use_atr': True, 'use_adx': False, 'use_ema': False, 'use_spike': False, 'rsi_required': False, 'edge_k': 0.6614603952857208, 'edge_cap': 0.22405934368421643, 'bull_strategy': 'mean_reversion', 'bull_bb_std_mult': 1.9854965838594083, 'bull_rsi_os': 36, 'bull_rsi_ob': 80, 'bull_adx_thresh': 27.762675131018934, 'bull_atr_min_pct': 0.0007636636533408271, 'bull_atr_max_pct': 0.13111518727074123, 'bull_tp_mult': 2.0714800943277085, 'bull_tsl_mult': 0.7588610326088929, 'bull_time_stop': 288, 'bull_use_sma': False, 'bull_use_ema': False, 'bull_use_atr': True, 'bull_use_adx': False, 'bull_use_spike': True, 'bull_rsi_required': False, 'bear_strategy': 'breakout', 'bear_bb_std_mult': 2.2699062750719436, 'bear_rsi_os': 41, 'bear_rsi_ob': 76, 'bear_adx_thresh': 17.570549641903288, 'bear_atr_min_pct': 0.009096536705882972, 'bear_atr_max_pct': 0.035447513601445865, 'bear_tp_mult': 2.798032752260482, 'bear_tsl_mult': 0.5690812584121505, 'bear_time_stop': 153, 'bear_use_sma': False, 'bear_use_ema': True, 'bear_use_atr': True, 'bear_use_adx': True, 'bear_use_spike': True, 'bear_rsi_required': True, 'sideways_strategy': 'breakout', 'sideways_bb_std_mult': 1.425165638624006, 'sideways_rsi_os': 30, 'sideways_rsi_ob': 60, 'sideways_adx_thresh': 32.96255105898113, 'sideways_atr_min_pct': 0.01176763955662374, 'sideways_atr_max_pct': 0.08770267374847807, 'sideways_tp_mult': 1.377598438353219, 'sideways_tsl_mult': 0.6088312198886265, 'sideways_time_stop': 91, 'sideways_use_sma': True, 'sideways_use_ema': False, 'sideways_use_atr': False, 'sideways_use_adx': True, 'sideways_use_spike': True, 'sideways_rsi_required': False}.
[I 2025-09-01 10:43:12,293] Trial 599 finished with values: [-1000000000.0, 1000000000.0] and parameters: {'p_sma': 57, 'p_std': 45, 'p_atr': 28, 'p_adx': 18, 'rsi_period': 49, 'ema1': 7, 'ema2': 49, 'slip_atr_k': 0.005172659710940731, 'slip_spread_k': 0.569581587267023, 'spread_hl_frac': 0.007222098433863187, 'bb_std_mult': 2.583110620954853, 'rsi_os': 6, 'rsi_ob': 70, 'vol_spike': 0.20601356459297732, 'adx_thresh': 10.212350508988292, 'atr_min_pct': 0.01808506282457624, 'atr_max_pct': 0.029690318616286175, 'tp_mult': 1.9201094105113696, 'tsl_mult': 0.8095383544590282, 'strategy': 'breakout', 'time_stop': 154, 'use_sma': True, 'use_atr': True, 'use_adx': False, 'use_ema': False, 'use_spike': True, 'rsi_required': False, 'edge_k': 0.5758389133640281, 'edge_cap': 0.18106703756619397, 'bull_strategy': 'mean_reversion', 'bull_bb_std_mult': 1.9855052084636076, 'bull_rsi_os': 36, 'bull_rsi_ob': 54, 'bull_adx_thresh': 9.058659428347392, 'bull_atr_min_pct': 0.0167482011164209, 'bull_atr_max_pct': 0.07824703938705231, 'bull_tp_mult': 2.949596296081393, 'bull_tsl_mult': 0.9500196894448806, 'bull_time_stop': 132, 'bull_use_sma': True, 'bull_use_ema': False, 'bull_use_atr': True, 'bull_use_adx': False, 'bull_use_spike': True, 'bull_rsi_required': True, 'bear_strategy': 'breakout', 'bear_bb_std_mult': 0.7390511996377236, 'bear_rsi_os': 45, 'bear_rsi_ob': 91, 'bear_adx_thresh': 17.57465672861713, 'bear_atr_min_pct': 0.007424528023248343, 'bear_atr_max_pct': 0.05207890818365739, 'bear_tp_mult': 2.7973641158331253, 'bear_tsl_mult': 0.9466958590720109, 'bear_time_stop': 10, 'bear_use_sma': False, 'bear_use_ema': False, 'bear_use_atr': True, 'bear_use_adx': True, 'bear_use_spike': True, 'bear_rsi_required': False, 'sideways_strategy': 'mean_reversion', 'sideways_bb_std_mult': 2.554541326920994, 'sideways_rsi_os': 47, 'sideways_rsi_ob': 73, 'sideways_adx_thresh': 31.718668960438144, 'sideways_atr_min_pct': 0.021083343015612377, 'sideways_atr_max_pct': 0.07720482239609536, 'sideways_tp_mult': 2.9687378736112646, 'sideways_tsl_mult': 0.24022064363497386, 'sideways_time_stop': 211, 'sideways_use_sma': True, 'sideways_use_ema': False, 'sideways_use_atr': False, 'sideways_use_adx': False, 'sideways_use_spike': True, 'sideways_rsi_required': False}.
[I 2025-09-01 10:43:12,600] Trial 598 finished with values: [-1000000000.0, 1000000000.0] and parameters: {'p_sma': 35, 'p_std': 53, 'p_atr': 14, 'p_adx': 11, 'rsi_period': 72, 'ema1': 7, 'ema2': 10, 'slip_atr_k': 0.0044208467936703855, 'slip_spread_k': 0.5765704171687044, 'spread_hl_frac': 0.005508562004401682, 'bb_std_mult': 2.5908707774205286, 'rsi_os': 9, 'rsi_ob': 54, 'vol_spike': 0.20574021106822055, 'adx_thresh': 11.464685013769085, 'atr_min_pct': 0.01852689620614031, 'atr_max_pct': 0.06014115931745588, 'tp_mult': 2.62787446620446, 'tsl_mult': 0.8002259413798041, 'strategy': 'breakout', 'time_stop': 208, 'use_sma': True, 'use_atr': True, 'use_adx': False, 'use_ema': False, 'use_spike': True, 'rsi_required': False, 'edge_k': 0.5752001869213342, 'edge_cap': 0.20433799316867962, 'bull_strategy': 'mean_reversion', 'bull_bb_std_mult': 1.0570279447756465, 'bull_rsi_os': 36, 'bull_rsi_ob': 85, 'bull_adx_thresh': 28.517028045115524, 'bull_atr_min_pct': 0.00477820110571355, 'bull_atr_max_pct': 0.07727300301551965, 'bull_tp_mult': 1.4603981845904783, 'bull_tsl_mult': 0.9480691317652629, 'bull_time_stop': 147, 'bull_use_sma': True, 'bull_use_ema': False, 'bull_use_atr': True, 'bull_use_adx': False, 'bull_use_spike': True, 'bull_rsi_required': True, 'bear_strategy': 'breakout', 'bear_bb_std_mult': 1.288035428243362, 'bear_rsi_os': 45, 'bear_rsi_ob': 66, 'bear_adx_thresh': 26.555577665481195, 'bear_atr_min_pct': 0.029507929634650872, 'bear_atr_max_pct': 0.051155532193606884, 'bear_tp_mult': 1.8338480563845492, 'bear_tsl_mult': 0.5457420344768774, 'bear_time_stop': 205, 'bear_use_sma': False, 'bear_use_ema': False, 'bear_use_atr': True, 'bear_use_adx': True, 'bear_use_spike': True, 'bear_rsi_required': False, 'sideways_strategy': 'mean_reversion', 'sideways_bb_std_mult': 2.5798869455046387, 'sideways_rsi_os': 33, 'sideways_rsi_ob': 49, 'sideways_adx_thresh': 34.20078015058685, 'sideways_atr_min_pct': 0.008584556200298011, 'sideways_atr_max_pct': 0.043330751942137195, 'sideways_tp_mult': 1.8090523590601286, 'sideways_tsl_mult': 0.9580009272259473, 'sideways_time_stop': 214, 'sideways_use_sma': True, 'sideways_use_ema': False, 'sideways_use_atr': False, 'sideways_use_adx': False, 'sideways_use_spike': True, 'sideways_rsi_required': False}.
Starting optimization (600 trials, n_jobs=4) | multi-objective=True
Saved trials CSV -> runs/REAL_SPOT_LONG_US_ret/h14-15-16-17-18-19-20-22_r0.025_s912/trials_metrics.csv
Saved Pareto plot -> runs/REAL_SPOT_LONG_US_ret/h14-15-16-17-18-19-20-22_r0.025_s912/pareto_return_vs_drawdown.png
Top-K under DD cap: [393] (agg='median')
=== Selected trial(s) ===
top_k=1 selected_trial_numbers=[393] primary=393
ret%_train=0.00% dd%_train=0.00% trades=0
ret%_test=0.00% dd%_test=0.00% pnl_test=0.00 trades_test=0
WFO fold 1: OOS PnL=0.00 trades=0 win_rate=0.00% avg=0.000000 ret%=0.00% maxDD=0.000000 maxDD%=0.00%
WFO fold 2: OOS PnL=0.00 trades=0 win_rate=0.00% avg=0.000000 ret%=0.00% maxDD=0.000000 maxDD%=0.00%
WFO fold 3: OOS PnL=0.00 trades=0 win_rate=0.00% avg=0.000000 ret%=0.00% maxDD=0.000000 maxDD%=0.00%
WFO fold 4: OOS PnL=0.00 trades=0 win_rate=0.00% avg=0.000000 ret%=0.00% maxDD=0.000000 maxDD%=0.00%
WFO fold 5: OOS PnL=0.00 trades=0 win_rate=0.00% avg=0.000000 ret%=0.00% maxDD=0.000000 maxDD%=0.00%
WFO fold 6: OOS PnL=0.00 trades=0 win_rate=0.00% avg=0.000000 ret%=0.00% maxDD=0.000000 maxDD%=0.00%
WFO summary: meanPnL=0.00 stdPnL=0.00 meanWR=0.00% meanAvg=0.000000 meanRet%=0.00% worstDD=0.000000 worstDD%=0.00% folds=6 trades=0
Wrote runs/REAL_SPOT_LONG_US_ret/h14-15-16-17-18-19-20-22_r0.025_s912/strategy_profile.json
=== ECHO SELECTED PARAMS (JSON) ===
{
  "adx_thresh": 10.87861637980046,
  "aggregate_params": "median",
  "atr_max_pct": 0.062249806280335634,
  "atr_min_pct": 0.02312826790184647,
  "bar_priority": "stop_first",
  "bb_std_mult": 2.4518530619807684,
  "bear_adx_thresh": 34.57561063306981,
  "bear_atr_max_pct": 0.035840284990994044,
  "bear_atr_min_pct": 0.004015909656460193,
  "bear_bb_std_mult": 2.1320992833909282,
  "bear_rsi_ob": 73,
  "bear_rsi_os": 50,
  "bear_rsi_required": false,
  "bear_strategy": "breakout",
  "bear_time_stop": 10,
  "bear_tp_mult": 1.8513439195261399,
  "bear_tsl_mult": 0.06210823340308674,
  "bear_use_adx": true,
  "bear_use_atr": true,
  "bear_use_ema": true,
  "bear_use_sma": false,
  "bear_use_spike": false,
  "bull_adx_thresh": 26.988492295297085,
  "bull_atr_max_pct": 0.10488577338534216,
  "bull_atr_min_pct": 0.018151191123636775,
  "bull_bb_std_mult": 2.6561981312494725,
  "bull_rsi_ob": 81,
  "bull_rsi_os": 52,
  "bull_rsi_required": true,
  "bull_strategy": "mean_reversion",
  "bull_time_stop": 132,
  "bull_tp_mult": 2.0666705299176606,
  "bull_tsl_mult": 0.9619635086384856,
  "bull_use_adx": false,
  "bull_use_atr": true,
  "bull_use_ema": false,
  "bull_use_sma": true,
  "bull_use_spike": true,
  "cooldown_bars": 30,
  "daily_loss_limit_pct": 0.1,
  "edge_cap": 0.8105612459840716,
  "edge_k": 1.6832145205407096,
  "ema1": 8,
  "ema2": 13,
  "embargo_bars": 150,
  "fee": 0.0005,
  "fill_timing": "next_open",
  "include_hours_set": "{14, 15, 16, 17, 18, 19, 20, 22}",
  "lockout_bars": 100,
  "max_consec_losses": 7,
  "max_notional_pct_equity": 1.0,
  "min_notional": 5.0,
  "ml_thresh": 0.0,
  "objective": "multi",
  "p_adx": 11,
  "p_atr": 20,
  "p_sma": 20,
  "p_std": 52,
  "participation_cap": 1.0,
  "price_step": 0.0001,
  "proba_temp": 1.0,
  "qty_step": 0.0001,
  "regime_adapt": true,
  "regime_band": 0.006,
  "regime_fast": 50,
  "regime_overrides": {
    "bear": {
      "adx": 20.0,
      "allowed_sides": [
        "long",
        "short"
      ],
      "atr_range": [
        0.0015,
        0.06
      ],
      "bb_std_mult": 1.2571599337995167,
      "mode": "breakout",
      "rsi_required": true,
      "time_stop_bars": 122,
      "tp_mult": 1.7149673432024581,
      "tsl_mult": 0.25,
      "use_adx": true,
      "use_atr": true
    },
    "bull": {
      "adx": 18.0,
      "allowed_sides": [
        "long",
        "short"
      ],
      "atr_range": [
        0.0008,
        0.06
      ],
      "bb_std_mult": 2.0169431746748376,
      "mode": "mean_reversion",
      "rsi_required": false,
      "time_stop_bars": 214,
      "tp_mult": 1.9194251920826044,
      "tsl_mult": 0.6891458682949287,
      "use_adx": true,
      "use_atr": true
    },
    "sideways": {
      "adx": 15.0,
      "allowed_sides": [
        "long",
        "short"
      ],
      "atr_range": [
        0.001,
        0.14
      ],
      "bb_std_mult": 1.5828092896467827,
      "mode": "breakout",
      "rsi_required": true,
      "time_stop_bars": 235,
      "tp_mult": 2.341879695778944,
      "tsl_mult": 0.651967765830165,
      "use_adx": true,
      "use_atr": true
    }
  },
  "regime_slow": 200,
  "risk_min_stop_frac": 0.001,
  "risk_per_trade": 0.025,
  "risk_stop_atr_mult": 1.0,
  "round_exits": true,
  "rsi_key": "rsi13",
  "rsi_ob": 76,
  "rsi_os": 39,
  "rsi_period": 13,
  "rsi_required": false,
  "select_top_k": 1,
  "session_end": 24,
  "session_start": 0,
  "sides": "long",
  "sideways_adx_thresh": 29.876776957686367,
  "sideways_atr_max_pct": 0.07957822572520211,
  "sideways_atr_min_pct": 0.020962876708092545,
  "sideways_bb_std_mult": 2.5934616552160845,
  "sideways_rsi_ob": 61,
  "sideways_rsi_os": 55,
  "sideways_rsi_required": false,
  "sideways_strategy": "breakout",
  "sideways_time_stop": 283,
  "sideways_tp_mult": 1.3318052268005633,
  "sideways_tsl_mult": 0.9420579503563573,
  "sideways_use_adx": true,
  "sideways_use_atr": true,
  "sideways_use_ema": false,
  "sideways_use_sma": true,
  "sideways_use_spike": true,
  "slip_atr_k": 0.0036387147693520408,
  "slip_spread_k": 0.5757650129868913,
  "slippage": 0.0004,
  "spread_hl_frac": 0.03208578783244863,
  "start_equity": 20000.0,
  "stop_extra_slip": 0.0,
  "strategy": "mean_reversion",
  "time_stop": 125,
  "tp_mult": 2.7353200889400644,
  "tsl_mult": 0.8272942140628187,
  "use_adx": true,
  "use_atr": true,
  "use_ema": false,
  "use_ml": false,
  "use_sma": true,
  "use_spike": true,
  "vol_spike": 0.1962929958374217,
  "wfo_folds": 6
}
Wrote runs/REAL_SPOT_LONG_US_ret/h14-15-16-17-18-19-20-22_r0.025_s912/best_params.pkl
