[I 2025-09-01 09:54:35,103] Trial 316 finished with values: [-0.017693940885130877, 0.01760960559941425] and parameters: {'p_sma': 40, 'p_std': 50, 'p_atr': 27, 'p_adx': 11, 'rsi_period': 11, 'ema1': 10, 'ema2': 19, 'slip_atr_k': 0.0039020905638570266, 'slip_spread_k': 0.9950320275475455, 'spread_hl_frac': 0.001306278924729832, 'bb_std_mult': 1.1830472606538092, 'rsi_os': 10, 'rsi_ob': 55, 'vol_spike': 0.18810111340918212, 'adx_thresh': 27.29820920073675, 'atr_min_pct': 0.020258662885064564, 'atr_max_pct': 0.0644251713945275, 'tp_mult': 2.6089574923354113, 'tsl_mult': 0.656685344721576, 'strategy': 'breakout', 'time_stop': 138, 'use_sma': True, 'use_atr': True, 'use_adx': False, 'use_ema': True, 'use_spike': True, 'rsi_required': False, 'edge_k': 1.0978279572165714, 'edge_cap': 0.8508701935469257, 'bull_strategy': 'mean_reversion', 'bull_bb_std_mult': 3.182499922304539, 'bull_rsi_os': 35, 'bull_rsi_ob': 45, 'bull_adx_thresh': 29.956766972207244, 'bull_atr_min_pct': 0.0053609365704259185, 'bull_atr_max_pct': 0.07173290622544674, 'bull_tp_mult': 1.2883269653024216, 'bull_tsl_mult': 0.9186401537748782, 'bull_time_stop': 194, 'bull_use_sma': True, 'bull_use_ema': False, 'bull_use_atr': True, 'bull_use_adx': True, 'bull_use_spike': True, 'bull_rsi_required': False, 'bear_strategy': 'breakout', 'bear_bb_std_mult': 1.5060036877213676, 'bear_rsi_os': 19, 'bear_rsi_ob': 71, 'bear_adx_thresh': 12.965562985618067, 'bear_atr_min_pct': 0.026380867207097147, 'bear_atr_max_pct': 0.13783784416062683, 'bear_tp_mult': 2.8388953611867, 'bear_tsl_mult': 0.000982901444283979, 'bear_time_stop': 17, 'bear_use_sma': False, 'bear_use_ema': True, 'bear_use_atr': True, 'bear_use_adx': True, 'bear_use_spike': True, 'bear_rsi_required': True, 'sideways_strategy': 'breakout', 'sideways_bb_std_mult': 1.9220109155132186, 'sideways_rsi_os': 32, 'sideways_rsi_ob': 57, 'sideways_adx_thresh': 30.031517912826452, 'sideways_atr_min_pct': 0.0021934784337986316, 'sideways_atr_max_pct': 0.07738469585964028, 'sideways_tp_mult': 1.2862829129634978, 'sideways_tsl_mult': 0.8698392998271144, 'sideways_time_stop': 235, 'sideways_use_sma': True, 'sideways_use_ema': False, 'sideways_use_atr': False, 'sideways_use_adx': True, 'sideways_use_spike': True, 'sideways_rsi_required': False}.
[I 2025-09-01 09:54:35,132] Trial 317 finished with values: [-0.01813612644120821, 0.017925059628748144] and parameters: {'p_sma': 40, 'p_std': 46, 'p_atr': 27, 'p_adx': 25, 'rsi_period': 11, 'ema1': 10, 'ema2': 18, 'slip_atr_k': 0.04706416687454046, 'slip_spread_k': 0.577761925034936, 'spread_hl_frac': 0.0266553726002738, 'bb_std_mult': 2.4187104374019595, 'rsi_os': 10, 'rsi_ob': 56, 'vol_spike': 0.2999845547866478, 'adx_thresh': 27.6768974886186, 'atr_min_pct': 0.02016268640186739, 'atr_max_pct': 0.0626907777262788, 'tp_mult': 2.5759702013716437, 'tsl_mult': 0.8372184498539763, 'strategy': 'breakout', 'time_stop': 169, 'use_sma': True, 'use_atr': True, 'use_adx': False, 'use_ema': True, 'use_spike': True, 'rsi_required': False, 'edge_k': 1.6536833064151983, 'edge_cap': 0.6671832269737454, 'bull_strategy': 'mean_reversion', 'bull_bb_std_mult': 1.0201234102457735, 'bull_rsi_os': 35, 'bull_rsi_ob': 82, 'bull_adx_thresh': 29.800068247900455, 'bull_atr_min_pct': 0.0037031315150449365, 'bull_atr_max_pct': 0.053619395390190505, 'bull_tp_mult': 1.2737711424252374, 'bull_tsl_mult': 0.9170451157411419, 'bull_time_stop': 59, 'bull_use_sma': True, 'bull_use_ema': False, 'bull_use_atr': True, 'bull_use_adx': True, 'bull_use_spike': True, 'bull_rsi_required': False, 'bear_strategy': 'mean_reversion', 'bear_bb_std_mult': 0.6744129330967188, 'bear_rsi_os': 41, 'bear_rsi_ob': 71, 'bear_adx_thresh': 33.39540975989357, 'bear_atr_min_pct': 0.007791211872889184, 'bear_atr_max_pct': 0.12629020854363976, 'bear_tp_mult': 2.9444694297447525, 'bear_tsl_mult': 0.3499942967508185, 'bear_time_stop': 17, 'bear_use_sma': False, 'bear_use_ema': True, 'bear_use_atr': True, 'bear_use_adx': True, 'bear_use_spike': True, 'bear_rsi_required': True, 'sideways_strategy': 'breakout', 'sideways_bb_std_mult': 2.5920318067841133, 'sideways_rsi_os': 32, 'sideways_rsi_ob': 82, 'sideways_adx_thresh': 32.6263199711304, 'sideways_atr_min_pct': 0.0009316755229152713, 'sideways_atr_max_pct': 0.025989150179472148, 'sideways_tp_mult': 1.4875248303247608, 'sideways_tsl_mult': 0.8645265764340424, 'sideways_time_stop': 205, 'sideways_use_sma': True, 'sideways_use_ema': False, 'sideways_use_atr': False, 'sideways_use_adx': True, 'sideways_use_spike': False, 'sideways_rsi_required': False}.
[I 2025-09-01 09:54:35,693] Trial 314 finished with values: [-0.007038380875983408, 0.007487392879862326] and parameters: {'p_sma': 34, 'p_std': 18, 'p_atr': 27, 'p_adx': 10, 'rsi_period': 44, 'ema1': 10, 'ema2': 19, 'slip_atr_k': 0.010827093301165757, 'slip_spread_k': 0.5815647493353806, 'spread_hl_frac': 0.0033499970971865925, 'bb_std_mult': 1.1940760152594196, 'rsi_os': 8, 'rsi_ob': 55, 'vol_spike': 0.10948313679666505, 'adx_thresh': 18.799264704636226, 'atr_min_pct': 0.018456954284476478, 'atr_max_pct': 0.06355839775101335, 'tp_mult': 2.5743310487087414, 'tsl_mult': 0.0004203772989460619, 'strategy': 'breakout', 'time_stop': 91, 'use_sma': False, 'use_atr': True, 'use_adx': False, 'use_ema': True, 'use_spike': True, 'rsi_required': False, 'edge_k': 0.6091078940474298, 'edge_cap': 0.8950216452073188, 'bull_strategy': 'mean_reversion', 'bull_bb_std_mult': 2.4915234157655646, 'bull_rsi_os': 54, 'bull_rsi_ob': 56, 'bull_adx_thresh': 14.405413913030534, 'bull_atr_min_pct': 0.028922750024112293, 'bull_atr_max_pct': 0.12196780111884639, 'bull_tp_mult': 1.8128213644956723, 'bull_tsl_mult': 0.9157974074912274, 'bull_time_stop': 134, 'bull_use_sma': True, 'bull_use_ema': False, 'bull_use_atr': True, 'bull_use_adx': False, 'bull_use_spike': False, 'bull_rsi_required': False, 'bear_strategy': 'breakout', 'bear_bb_std_mult': 2.18119223253527, 'bear_rsi_os': 19, 'bear_rsi_ob': 71, 'bear_adx_thresh': 27.79035945180447, 'bear_atr_min_pct': 0.02867476020833057, 'bear_atr_max_pct': 0.13579057021983082, 'bear_tp_mult': 2.839902397583149, 'bear_tsl_mult': 0.8000470116879401, 'bear_time_stop': 12, 'bear_use_sma': False, 'bear_use_ema': False, 'bear_use_atr': True, 'bear_use_adx': False, 'bear_use_spike': True, 'bear_rsi_required': False, 'sideways_strategy': 'breakout', 'sideways_bb_std_mult': 1.953377434418332, 'sideways_rsi_os': 29, 'sideways_rsi_ob': 61, 'sideways_adx_thresh': 14.175360273605225, 'sideways_atr_min_pct': 0.002954144487859339, 'sideways_atr_max_pct': 0.0775893874560467, 'sideways_tp_mult': 1.2984908137640019, 'sideways_tsl_mult': 0.9360121864408613, 'sideways_time_stop': 208, 'sideways_use_sma': True, 'sideways_use_ema': True, 'sideways_use_atr': False, 'sideways_use_adx': True, 'sideways_use_spike': True, 'sideways_rsi_required': False}.
[I 2025-09-01 09:55:19,038] Trial 318 finished with values: [-1000000000.0, 1000000000.0] and parameters: {'p_sma': 57, 'p_std': 46, 'p_atr': 27, 'p_adx': 11, 'rsi_period': 79, 'ema1': 7, 'ema2': 10, 'slip_atr_k': 0.006352563699426991, 'slip_spread_k': 0.6480475405070396, 'spread_hl_frac': 0.007887634514071637, 'bb_std_mult': 2.415339793701741, 'rsi_os': 10, 'rsi_ob': 60, 'vol_spike': 0.2469105526943778, 'adx_thresh': 18.573984561944396, 'atr_min_pct': 0.009737987368985082, 'atr_max_pct': 0.07337000650045436, 'tp_mult': 1.0480529842123438, 'tsl_mult': 0.7957234176380541, 'strategy': 'breakout', 'time_stop': 138, 'use_sma': True, 'use_atr': False, 'use_adx': False, 'use_ema': True, 'use_spike': True, 'rsi_required': False, 'edge_k': 0.6940529700606741, 'edge_cap': 0.4679834109535239, 'bull_strategy': 'mean_reversion', 'bull_bb_std_mult': 3.172848036308249, 'bull_rsi_os': 35, 'bull_rsi_ob': 52, 'bull_adx_thresh': 29.39715765893485, 'bull_atr_min_pct': 0.003764344351085847, 'bull_atr_max_pct': 0.08492144585697303, 'bull_tp_mult': 1.4662760293102146, 'bull_tsl_mult': 0.9328211169517725, 'bull_time_stop': 62, 'bull_use_sma': True, 'bull_use_ema': False, 'bull_use_atr': True, 'bull_use_adx': True, 'bull_use_spike': True, 'bull_rsi_required': False, 'bear_strategy': 'mean_reversion', 'bear_bb_std_mult': 3.4920583363596585, 'bear_rsi_os': 43, 'bear_rsi_ob': 71, 'bear_adx_thresh': 33.350858169817485, 'bear_atr_min_pct': 0.028068210697633423, 'bear_atr_max_pct': 0.12179925522847851, 'bear_tp_mult': 1.4533865344885837, 'bear_tsl_mult': 0.8012994119963873, 'bear_time_stop': 5, 'bear_use_sma': False, 'bear_use_ema': True, 'bear_use_atr': True, 'bear_use_adx': True, 'bear_use_spike': True, 'bear_rsi_required': False, 'sideways_strategy': 'breakout', 'sideways_bb_std_mult': 2.585215162024443, 'sideways_rsi_os': 32, 'sideways_rsi_ob': 82, 'sideways_adx_thresh': 32.638583974150464, 'sideways_atr_min_pct': 0.022732962705498034, 'sideways_atr_max_pct': 0.08598679520620463, 'sideways_tp_mult': 1.8954181853965648, 'sideways_tsl_mult': 0.8707968235345513, 'sideways_time_stop': 13, 'sideways_use_sma': True, 'sideways_use_ema': False, 'sideways_use_atr': False, 'sideways_use_adx': True, 'sideways_use_spike': False, 'sideways_rsi_required': False}.
[I 2025-09-01 09:55:19,068] Trial 321 finished with values: [-1000000000.0, 1000000000.0] and parameters: {'p_sma': 8, 'p_std': 45, 'p_atr': 30, 'p_adx': 15, 'rsi_period': 45, 'ema1': 7, 'ema2': 10, 'slip_atr_k': 0.15425018558934864, 'slip_spread_k': 0.6013329473409202, 'spread_hl_frac': 0.023508956154550162, 'bb_std_mult': 1.591123122600399, 'rsi_os': 6, 'rsi_ob': 59, 'vol_spike': 0.23479500153122254, 'adx_thresh': 18.651109065434056, 'atr_min_pct': 0.021087643285132546, 'atr_max_pct': 0.07445161896121232, 'tp_mult': 2.2193024589621464, 'tsl_mult': 0.0921181469022912, 'strategy': 'mean_reversion', 'time_stop': 246, 'use_sma': True, 'use_atr': False, 'use_adx': True, 'use_ema': False, 'use_spike': False, 'rsi_required': False, 'edge_k': 1.7858055110971272, 'edge_cap': 0.7869691364912976, 'bull_strategy': 'breakout', 'bull_bb_std_mult': 3.3189318138260244, 'bull_rsi_os': 38, 'bull_rsi_ob': 93, 'bull_adx_thresh': 28.742447890421122, 'bull_atr_min_pct': 0.009829393649802193, 'bull_atr_max_pct': 0.11337956196155487, 'bull_tp_mult': 1.8205496669053052, 'bull_tsl_mult': 0.29639420916002174, 'bull_time_stop': 292, 'bull_use_sma': False, 'bull_use_ema': True, 'bull_use_atr': True, 'bull_use_adx': False, 'bull_use_spike': True, 'bull_rsi_required': True, 'bear_strategy': 'mean_reversion', 'bear_bb_std_mult': 2.52518886785398, 'bear_rsi_os': 43, 'bear_rsi_ob': 85, 'bear_adx_thresh': 27.674654851147814, 'bear_atr_min_pct': 0.027015460752915346, 'bear_atr_max_pct': 0.12152922061722005, 'bear_tp_mult': 2.8984122662697467, 'bear_tsl_mult': 0.8038107216880136, 'bear_time_stop': 5, 'bear_use_sma': True, 'bear_use_ema': True, 'bear_use_atr': False, 'bear_use_adx': True, 'bear_use_spike': False, 'bear_rsi_required': False, 'sideways_strategy': 'mean_reversion', 'sideways_bb_std_mult': 3.078626361386367, 'sideways_rsi_os': 29, 'sideways_rsi_ob': 78, 'sideways_adx_thresh': 14.561840874867846, 'sideways_atr_min_pct': 0.0036267628354678554, 'sideways_atr_max_pct': 0.0946788537354346, 'sideways_tp_mult': 1.891476462104771, 'sideways_tsl_mult': 0.9892965119372651, 'sideways_time_stop': 224, 'sideways_use_sma': False, 'sideways_use_ema': False, 'sideways_use_atr': True, 'sideways_use_adx': False, 'sideways_use_spike': False, 'sideways_rsi_required': False}.
[I 2025-09-01 09:55:20,330] Trial 320 finished with values: [-1000000000.0, 1000000000.0] and parameters: {'p_sma': 8, 'p_std': 45, 'p_atr': 29, 'p_adx': 10, 'rsi_period': 27, 'ema1': 5, 'ema2': 10, 'slip_atr_k': 0.1277857678319285, 'slip_spread_k': 0.6553888472315179, 'spread_hl_frac': 0.03548098170944388, 'bb_std_mult': 2.612434849622149, 'rsi_os': 6, 'rsi_ob': 53, 'vol_spike': 0.2469209551678641, 'adx_thresh': 11.416908142109747, 'atr_min_pct': 0.0034742313430061126, 'atr_max_pct': 0.07378796058794697, 'tp_mult': 2.4738050733809134, 'tsl_mult': 0.2185805783103239, 'strategy': 'mean_reversion', 'time_stop': 199, 'use_sma': True, 'use_atr': False, 'use_adx': True, 'use_ema': False, 'use_spike': False, 'rsi_required': False, 'edge_k': 1.782122984416603, 'edge_cap': 0.9604604676882009, 'bull_strategy': 'breakout', 'bull_bb_std_mult': 3.5035825168406647, 'bull_rsi_os': 38, 'bull_rsi_ob': 52, 'bull_adx_thresh': 29.31121157203407, 'bull_atr_min_pct': 0.029218771185203544, 'bull_atr_max_pct': 0.08354310146352745, 'bull_tp_mult': 2.7655231213282967, 'bull_tsl_mult': 0.9373013614087958, 'bull_time_stop': 81, 'bull_use_sma': False, 'bull_use_ema': True, 'bull_use_atr': True, 'bull_use_adx': False, 'bull_use_spike': True, 'bull_rsi_required': True, 'bear_strategy': 'mean_reversion', 'bear_bb_std_mult': 1.7038667234603535, 'bear_rsi_os': 43, 'bear_rsi_ob': 83, 'bear_adx_thresh': 11.037435037719325, 'bear_atr_min_pct': 0.022050187906275345, 'bear_atr_max_pct': 0.12220937640669122, 'bear_tp_mult': 2.901577580021288, 'bear_tsl_mult': 0.5997315568866259, 'bear_time_stop': 9, 'bear_use_sma': True, 'bear_use_ema': True, 'bear_use_atr': False, 'bear_use_adx': True, 'bear_use_spike': False, 'bear_rsi_required': False, 'sideways_strategy': 'mean_reversion', 'sideways_bb_std_mult': 1.2488762288187787, 'sideways_rsi_os': 7, 'sideways_rsi_ob': 85, 'sideways_adx_thresh': 14.595294420499286, 'sideways_atr_min_pct': 0.0037801941403455873, 'sideways_atr_max_pct': 0.08516475639306109, 'sideways_tp_mult': 2.805487711208912, 'sideways_tsl_mult': 0.9894316213570168, 'sideways_time_stop': 14, 'sideways_use_sma': False, 'sideways_use_ema': False, 'sideways_use_atr': True, 'sideways_use_adx': False, 'sideways_use_spike': False, 'sideways_rsi_required': False}.
[I 2025-09-01 09:55:20,912] Trial 319 finished with values: [-1000000000.0, 1000000000.0] and parameters: {'p_sma': 8, 'p_std': 45, 'p_atr': 29, 'p_adx': 10, 'rsi_period': 25, 'ema1': 5, 'ema2': 32, 'slip_atr_k': 0.15329468727661988, 'slip_spread_k': 0.5712018670674383, 'spread_hl_frac': 0.008663722482054754, 'bb_std_mult': 2.52513799275559, 'rsi_os': 6, 'rsi_ob': 59, 'vol_spike': 0.19903840368355588, 'adx_thresh': 11.262165255104009, 'atr_min_pct': 0.022257771716662916, 'atr_max_pct': 0.0736698314034812, 'tp_mult': 1.068023410823181, 'tsl_mult': 0.8611486738643601, 'strategy': 'mean_reversion', 'time_stop': 300, 'use_sma': True, 'use_atr': False, 'use_adx': True, 'use_ema': False, 'use_spike': False, 'rsi_required': False, 'edge_k': 0.3206989071119666, 'edge_cap': 0.7934106194955522, 'bull_strategy': 'breakout', 'bull_bb_std_mult': 3.5013551083707584, 'bull_rsi_os': 41, 'bull_rsi_ob': 61, 'bull_adx_thresh': 28.862339315473378, 'bull_atr_min_pct': 0.013261221046406623, 'bull_atr_max_pct': 0.07443642759932245, 'bull_tp_mult': 1.8180567871740076, 'bull_tsl_mult': 0.2963129080995598, 'bull_time_stop': 33, 'bull_use_sma': False, 'bull_use_ema': True, 'bull_use_atr': True, 'bull_use_adx': False, 'bull_use_spike': True, 'bull_rsi_required': True, 'bear_strategy': 'mean_reversion', 'bear_bb_std_mult': 1.6688742305533626, 'bear_rsi_os': 16, 'bear_rsi_ob': 73, 'bear_adx_thresh': 8.27323160156746, 'bear_atr_min_pct': 0.014715459639775592, 'bear_atr_max_pct': 0.12160934846517399, 'bear_tp_mult': 1.4507847241569538, 'bear_tsl_mult': 0.7996718568900449, 'bear_time_stop': 10, 'bear_use_sma': True, 'bear_use_ema': True, 'bear_use_atr': False, 'bear_use_adx': True, 'bear_use_spike': False, 'bear_rsi_required': False, 'sideways_strategy': 'mean_reversion', 'sideways_bb_std_mult': 3.115528613088014, 'sideways_rsi_os': 14, 'sideways_rsi_ob': 62, 'sideways_adx_thresh': 31.637380951888442, 'sideways_atr_min_pct': 0.02272822732504518, 'sideways_atr_max_pct': 0.09569015494493682, 'sideways_tp_mult': 1.2407160896815561, 'sideways_tsl_mult': 0.9872460701208494, 'sideways_time_stop': 224, 'sideways_use_sma': False, 'sideways_use_ema': False, 'sideways_use_atr': True, 'sideways_use_adx': False, 'sideways_use_spike': False, 'sideways_rsi_required': False}.
[I 2025-09-01 09:56:07,571] Trial 322 finished with values: [-1000000000.0, 1000000000.0] and parameters: {'p_sma': 59, 'p_std': 15, 'p_atr': 25, 'p_adx': 10, 'rsi_period': 59, 'ema1': 21, 'ema2': 33, 'slip_atr_k': 0.07052692901054078, 'slip_spread_k': 0.5671851352919547, 'spread_hl_frac': 0.005519341773214524, 'bb_std_mult': 0.8822782087748691, 'rsi_os': 7, 'rsi_ob': 72, 'vol_spike': 0.19861337375919383, 'adx_thresh': 9.744061581542287, 'atr_min_pct': 0.02211532785900601, 'atr_max_pct': 0.06898027235825027, 'tp_mult': 2.4800950487006115, 'tsl_mult': 0.2039582428303438, 'strategy': 'mean_reversion', 'time_stop': 149, 'use_sma': True, 'use_atr': True, 'use_adx': False, 'use_ema': False, 'use_spike': True, 'rsi_required': False, 'edge_k': 0.6178213167306289, 'edge_cap': 0.4377197058101113, 'bull_strategy': 'mean_reversion', 'bull_bb_std_mult': 3.5911997018644333, 'bull_rsi_os': 38, 'bull_rsi_ob': 80, 'bull_adx_thresh': 27.940600771848707, 'bull_atr_min_pct': 0.004611245114197215, 'bull_atr_max_pct': 0.06376518693350425, 'bull_tp_mult': 1.6431272446192418, 'bull_tsl_mult': 0.360354832766413, 'bull_time_stop': 18, 'bull_use_sma': False, 'bull_use_ema': False, 'bull_use_atr': True, 'bull_use_adx': False, 'bull_use_spike': True, 'bull_rsi_required': False, 'bear_strategy': 'breakout', 'bear_bb_std_mult': 1.7069290702835629, 'bear_rsi_os': 16, 'bear_rsi_ob': 73, 'bear_adx_thresh': 10.731825774085653, 'bear_atr_min_pct': 0.02798407205041273, 'bear_atr_max_pct': 0.03935731538521891, 'bear_tp_mult': 2.848436660012488, 'bear_tsl_mult': 0.7447668842662392, 'bear_time_stop': 10, 'bear_use_sma': True, 'bear_use_ema': True, 'bear_use_atr': True, 'bear_use_adx': True, 'bear_use_spike': False, 'bear_rsi_required': False, 'sideways_strategy': 'mean_reversion', 'sideways_bb_std_mult': 1.5778110582848963, 'sideways_rsi_os': 21, 'sideways_rsi_ob': 61, 'sideways_adx_thresh': 19.882388916679336, 'sideways_atr_min_pct': 0.004607022287454741, 'sideways_atr_max_pct': 0.09931870142826178, 'sideways_tp_mult': 2.809957386669895, 'sideways_tsl_mult': 0.9526807040169619, 'sideways_time_stop': 172, 'sideways_use_sma': True, 'sideways_use_ema': False, 'sideways_use_atr': False, 'sideways_use_adx': False, 'sideways_use_spike': True, 'sideways_rsi_required': False}.
[I 2025-09-01 09:56:08,374] Trial 325 finished with values: [-1000000000.0, 1000000000.0] and parameters: {'p_sma': 45, 'p_std': 43, 'p_atr': 19, 'p_adx': 8, 'rsi_period': 64, 'ema1': 9, 'ema2': 12, 'slip_atr_k': 0.01581453625105518, 'slip_spread_k': 0.6237243907917979, 'spread_hl_frac': 0.005441969499341877, 'bb_std_mult': 2.7366760485863084, 'rsi_os': 25, 'rsi_ob': 92, 'vol_spike': 0.19336675760625938, 'adx_thresh': 10.663078916860673, 'atr_min_pct': 0.005089148901680914, 'atr_max_pct': 0.04163018551184227, 'tp_mult': 2.1497903153176647, 'tsl_mult': 0.822815514743466, 'strategy': 'breakout', 'time_stop': 94, 'use_sma': True, 'use_atr': True, 'use_adx': False, 'use_ema': False, 'use_spike': True, 'rsi_required': False, 'edge_k': 0.6215876285698426, 'edge_cap': 0.43252103653271423, 'bull_strategy': 'mean_reversion', 'bull_bb_std_mult': 1.4567692988399268, 'bull_rsi_os': 44, 'bull_rsi_ob': 48, 'bull_adx_thresh': 14.234684168365554, 'bull_atr_min_pct': 0.004348896303957519, 'bull_atr_max_pct': 0.06373430878466446, 'bull_tp_mult': 2.5751592139460016, 'bull_tsl_mult': 0.9042760924954547, 'bull_time_stop': 129, 'bull_use_sma': True, 'bull_use_ema': False, 'bull_use_atr': True, 'bull_use_adx': False, 'bull_use_spike': True, 'bull_rsi_required': False, 'bear_strategy': 'breakout', 'bear_bb_std_mult': 2.454171015950648, 'bear_rsi_os': 45, 'bear_rsi_ob': 73, 'bear_adx_thresh': 34.351217099464144, 'bear_atr_min_pct': 0.010220973035335378, 'bear_atr_max_pct': 0.03843606790146293, 'bear_tp_mult': 2.670403131059789, 'bear_tsl_mult': 0.8722566662075464, 'bear_time_stop': 193, 'bear_use_sma': False, 'bear_use_ema': False, 'bear_use_atr': True, 'bear_use_adx': True, 'bear_use_spike': True, 'bear_rsi_required': False, 'sideways_strategy': 'mean_reversion', 'sideways_bb_std_mult': 2.3925611117328756, 'sideways_rsi_os': 52, 'sideways_rsi_ob': 61, 'sideways_adx_thresh': 31.597781625773116, 'sideways_atr_min_pct': 0.024964798299047238, 'sideways_atr_max_pct': 0.13015540262481823, 'sideways_tp_mult': 1.8265950400025421, 'sideways_tsl_mult': 0.9583361044947598, 'sideways_time_stop': 267, 'sideways_use_sma': True, 'sideways_use_ema': False, 'sideways_use_atr': False, 'sideways_use_adx': False, 'sideways_use_spike': True, 'sideways_rsi_required': False}.
