2025-09-01 09:03:58,944 WARNING: DATA SANITY: Extreme jumps >20*ATR200: 42
[I 2025-09-01 09:03:58,965] A new study created in memory with name: no-name-3e6ad067-c792-4318-9fe4-b77e56e7629c
[I 2025-09-01 09:04:35,341] Trial 0 finished with values: [-1000000000.0, 1000000000.0] and parameters: {'p_sma': 7, 'p_std': 49, 'p_atr': 13, 'p_adx': 28, 'rsi_period': 46, 'ema1': 10, 'ema2': 11, 'slip_atr_k': 0.04821409914206756, 'slip_spread_k': 0.9080142964919559, 'spread_hl_frac': 0.046766195036669206, 'bb_std_mult': 3.388491881126906, 'rsi_os': 42, 'rsi_ob': 95, 'vol_spike': 0.08666268814340018, 'adx_thresh': 15.236758798643027, 'atr_min_pct': 0.012398406266927562, 'atr_max_pct': 0.1254419881895608, 'tp_mult': 1.2908231629392488, 'tsl_mult': 0.13738118316838788, 'strategy': 'breakout', 'time_stop': 220, 'use_sma': True, 'use_atr': False, 'use_adx': False, 'use_ema': True, 'use_spike': False, 'rsi_required': True, 'edge_k': 1.2232860232793032, 'edge_cap': 0.6621930031321667, 'bull_strategy': 'breakout', 'bull_bb_std_mult': 0.7835963546015283, 'bull_rsi_os': 15, 'bull_rsi_ob': 75, 'bull_adx_thresh': 24.98828591758815, 'bull_atr_min_pct': 0.02851394413093417, 'bull_atr_max_pct': 0.024354999521069755, 'bull_tp_mult': 1.143984249308868, 'bull_tsl_mult': 0.3204886685524033, 'bull_time_stop': 31, 'bull_use_sma': True, 'bull_use_ema': False, 'bull_use_atr': False, 'bull_use_adx': True, 'bull_use_spike': True, 'bull_rsi_required': False, 'bear_strategy': 'breakout', 'bear_bb_std_mult': 1.1200128084934018, 'bear_rsi_os': 14, 'bear_rsi_ob': 54, 'bear_adx_thresh': 28.27939538373304, 'bear_atr_min_pct': 0.009206715426991485, 'bear_atr_max_pct': 0.13593940506589586, 'bear_tp_mult': 2.6639797237656, 'bear_tsl_mult': 0.49843361076617854, 'bear_time_stop': 122, 'bear_use_sma': False, 'bear_use_ema': False, 'bear_use_atr': True, 'bear_use_adx': True, 'bear_use_spike': True, 'bear_rsi_required': True, 'sideways_strategy': 'breakout', 'sideways_bb_std_mult': 0.8035536762052422, 'sideways_rsi_os': 22, 'sideways_rsi_ob': 68, 'sideways_adx_thresh': 28.831899019364503, 'sideways_atr_min_pct': 0.009302239602092468, 'sideways_atr_max_pct': 0.1296446518864789, 'sideways_tp_mult': 1.9844962503322083, 'sideways_tsl_mult': 0.9537633234828982, 'sideways_time_stop': 86, 'sideways_use_sma': True, 'sideways_use_ema': False, 'sideways_use_atr': True, 'sideways_use_adx': True, 'sideways_use_spike': False, 'sideways_rsi_required': True}.
[I 2025-09-01 09:04:35,504] Trial 4 finished with values: [-1000000000.0, 1000000000.0] and parameters: {'p_sma': 28, 'p_std': 55, 'p_atr': 12, 'p_adx': 17, 'rsi_period': 80, 'ema1': 28, 'ema2': 34, 'slip_atr_k': 0.010558705861688417, 'slip_spread_k': 0.8204958657127156, 'spread_hl_frac': 0.04319912704150991, 'bb_std_mult': 1.6254069363075938, 'rsi_os': 55, 'rsi_ob': 47, 'vol_spike': 0.2250015031181111, 'adx_thresh': 29.825984125055157, 'atr_min_pct': 0.009221559275619623, 'atr_max_pct': 0.08834799031017807, 'tp_mult': 1.6359788224916507, 'tsl_mult': 0.6683337433575695, 'strategy': 'mean_reversion', 'time_stop': 238, 'use_sma': False, 'use_atr': False, 'use_adx': True, 'use_ema': False, 'use_spike': True, 'rsi_required': False, 'edge_k': 0.21220988874411573, 'edge_cap': 0.9852737106484246, 'bull_strategy': 'mean_reversion', 'bull_bb_std_mult': 0.9974927889898481, 'bull_rsi_os': 10, 'bull_rsi_ob': 61, 'bull_adx_thresh': 15.480990078935054, 'bull_atr_min_pct': 0.009059701857014988, 'bull_atr_max_pct': 0.11922958301463862, 'bull_tp_mult': 1.8966424736981857, 'bull_tsl_mult': 0.9611035684694934, 'bull_time_stop': 45, 'bull_use_sma': False, 'bull_use_ema': False, 'bull_use_atr': True, 'bull_use_adx': False, 'bull_use_spike': False, 'bull_rsi_required': False, 'bear_strategy': 'mean_reversion', 'bear_bb_std_mult': 1.3326726659781407, 'bear_rsi_os': 45, 'bear_rsi_ob': 72, 'bear_adx_thresh': 11.333116729717078, 'bear_atr_min_pct': 0.002247221453088769, 'bear_atr_max_pct': 0.025366096857140075, 'bear_tp_mult': 1.2547957973776278, 'bear_tsl_mult': 0.7431791055892902, 'bear_time_stop': 18, 'bear_use_sma': True, 'bear_use_ema': False, 'bear_use_atr': True, 'bear_use_adx': False, 'bear_use_spike': True, 'bear_rsi_required': True, 'sideways_strategy': 'mean_reversion', 'sideways_bb_std_mult': 2.2460329688347374, 'sideways_rsi_os': 53, 'sideways_rsi_ob': 84, 'sideways_adx_thresh': 9.575977674830469, 'sideways_atr_min_pct': 0.01541499892418571, 'sideways_atr_max_pct': 0.04146099727600707, 'sideways_tp_mult': 1.3749606632651614, 'sideways_tsl_mult': 0.6083061702297341, 'sideways_time_stop': 163, 'sideways_use_sma': False, 'sideways_use_ema': True, 'sideways_use_atr': True, 'sideways_use_adx': True, 'sideways_use_spike': True, 'sideways_rsi_required': True}.
[I 2025-09-01 09:04:37,642] Trial 2 finished with values: [-1000000000.0, 1000000000.0] and parameters: {'p_sma': 57, 'p_std': 31, 'p_atr': 19, 'p_adx': 14, 'rsi_period': 53, 'ema1': 25, 'ema2': 42, 'slip_atr_k': 0.18858113116341682, 'slip_spread_k': 0.054365704726948905, 'spread_hl_frac': 0.0017826947426688611, 'bb_std_mult': 3.215773485617329, 'rsi_os': 30, 'rsi_ob': 62, 'vol_spike': 0.17570329555126207, 'adx_thresh': 31.10091095617373, 'atr_min_pct': 0.006427412704139824, 'atr_max_pct': 0.06342762717255111, 'tp_mult': 1.1052356079381191, 'tsl_mult': 0.22602474854507348, 'strategy': 'mean_reversion', 'time_stop': 177, 'use_sma': True, 'use_atr': False, 'use_adx': False, 'use_ema': False, 'use_spike': False, 'rsi_required': True, 'edge_k': 1.7413779768689805, 'edge_cap': 0.2778509039444255, 'bull_strategy': 'mean_reversion', 'bull_bb_std_mult': 2.1075785100396427, 'bull_rsi_os': 20, 'bull_rsi_ob': 56, 'bull_adx_thresh': 11.453262838994071, 'bull_atr_min_pct': 0.02203137080875497, 'bull_atr_max_pct': 0.059274847283062586, 'bull_tp_mult': 2.8355485219484047, 'bull_tsl_mult': 0.9245469621844553, 'bull_time_stop': 270, 'bull_use_sma': False, 'bull_use_ema': True, 'bull_use_atr': False, 'bull_use_adx': True, 'bull_use_spike': True, 'bull_rsi_required': False, 'bear_strategy': 'mean_reversion', 'bear_bb_std_mult': 3.0042548764759713, 'bear_rsi_os': 28, 'bear_rsi_ob': 94, 'bear_adx_thresh': 16.54072517084112, 'bear_atr_min_pct': 0.023891725862006222, 'bear_atr_max_pct': 0.041929800120170946, 'bear_tp_mult': 1.0563688721250417, 'bear_tsl_mult': 0.966974153173921, 'bear_time_stop': 192, 'bear_use_sma': False, 'bear_use_ema': True, 'bear_use_atr': True, 'bear_use_adx': True, 'bear_use_spike': False, 'bear_rsi_required': True, 'sideways_strategy': 'breakout', 'sideways_bb_std_mult': 3.2118970550292683, 'sideways_rsi_os': 21, 'sideways_rsi_ob': 81, 'sideways_adx_thresh': 19.10489054466765, 'sideways_atr_min_pct': 0.002807965780418795, 'sideways_atr_max_pct': 0.0164191940796599, 'sideways_tp_mult': 2.574088158896527, 'sideways_tsl_mult': 0.6198805688604392, 'sideways_time_stop': 57, 'sideways_use_sma': False, 'sideways_use_ema': False, 'sideways_use_atr': False, 'sideways_use_adx': True, 'sideways_use_spike': True, 'sideways_rsi_required': False}.
[I 2025-09-01 09:04:38,056] Trial 1 finished with values: [-1000000000.0, 1000000000.0] and parameters: {'p_sma': 41, 'p_std': 9, 'p_atr': 29, 'p_adx': 24, 'rsi_period': 18, 'ema1': 29, 'ema2': 44, 'slip_atr_k': 0.1377225317574521, 'slip_spread_k': 0.9402316514691521, 'spread_hl_frac': 0.0009104127991166667, 'bb_std_mult': 2.6046847855731183, 'rsi_os': 51, 'rsi_ob': 82, 'vol_spike': 0.27471799039923667, 'adx_thresh': 29.40016069147794, 'atr_min_pct': 0.004993051758351824, 'atr_max_pct': 0.04542534591349509, 'tp_mult': 2.1249926212916623, 'tsl_mult': 0.6690609248975802, 'strategy': 'breakout', 'time_stop': 41, 'use_sma': True, 'use_atr': True, 'use_adx': False, 'use_ema': True, 'use_spike': True, 'rsi_required': True, 'edge_k': 0.8960488326860485, 'edge_cap': 0.07365704952512546, 'bull_strategy': 'breakout', 'bull_bb_std_mult': 1.9298394898237756, 'bull_rsi_os': 25, 'bull_rsi_ob': 80, 'bull_adx_thresh': 16.285461296755702, 'bull_atr_min_pct': 0.02399195879336295, 'bull_atr_max_pct': 0.1408440120309729, 'bull_tp_mult': 2.8777690646516882, 'bull_tsl_mult': 0.7244856572878287, 'bull_time_stop': 8, 'bull_use_sma': True, 'bull_use_ema': False, 'bull_use_atr': True, 'bull_use_adx': False, 'bull_use_spike': True, 'bull_rsi_required': False, 'bear_strategy': 'mean_reversion', 'bear_bb_std_mult': 2.5304933193262453, 'bear_rsi_os': 51, 'bear_rsi_ob': 95, 'bear_adx_thresh': 23.70915241535488, 'bear_atr_min_pct': 0.026673386953687764, 'bear_atr_max_pct': 0.04121093512596274, 'bear_tp_mult': 1.7079233121188564, 'bear_tsl_mult': 0.9335248269055036, 'bear_time_stop': 294, 'bear_use_sma': True, 'bear_use_ema': False, 'bear_use_atr': False, 'bear_use_adx': True, 'bear_use_spike': True, 'bear_rsi_required': True, 'sideways_strategy': 'breakout', 'sideways_bb_std_mult': 1.8873147049854229, 'sideways_rsi_os': 5, 'sideways_rsi_ob': 66, 'sideways_adx_thresh': 17.3718154375067, 'sideways_atr_min_pct': 0.01686931732748965, 'sideways_atr_max_pct': 0.03414534827474855, 'sideways_tp_mult': 2.687389624325016, 'sideways_tsl_mult': 0.33949367434719635, 'sideways_time_stop': 73, 'sideways_use_sma': False, 'sideways_use_ema': False, 'sideways_use_atr': True, 'sideways_use_adx': False, 'sideways_use_spike': True, 'sideways_rsi_required': True}.
[I 2025-09-01 09:04:38,298] Trial 3 finished with values: [-1000000000.0, 1000000000.0] and parameters: {'p_sma': 52, 'p_std': 20, 'p_atr': 12, 'p_adx': 12, 'rsi_period': 26, 'ema1': 30, 'ema2': 35, 'slip_atr_k': 0.14998008230678028, 'slip_spread_k': 0.6461258030213588, 'spread_hl_frac': 0.016686546971564, 'bb_std_mult': 0.7428921921119772, 'rsi_os': 48, 'rsi_ob': 84, 'vol_spike': 0.09498847471856717, 'adx_thresh': 23.613012159201364, 'atr_min_pct': 0.026942213064406577, 'atr_max_pct': 0.05141975377082452, 'tp_mult': 1.3862105128767908, 'tsl_mult': 0.8473763754156591, 'strategy': 'breakout', 'time_stop': 23, 'use_sma': True, 'use_atr': False, 'use_adx': False, 'use_ema': True, 'use_spike': False, 'rsi_required': True, 'edge_k': 1.6976307210860477, 'edge_cap': 0.16937421570664735, 'bull_strategy': 'mean_reversion', 'bull_bb_std_mult': 0.9513701936986848, 'bull_rsi_os': 24, 'bull_rsi_ob': 91, 'bull_adx_thresh': 6.472865906356162, 'bull_atr_min_pct': 0.009762845431278385, 'bull_atr_max_pct': 0.11444952865755903, 'bull_tp_mult': 2.126141027697294, 'bull_tsl_mult': 0.36404230994798625, 'bull_time_stop': 120, 'bull_use_sma': True, 'bull_use_ema': True, 'bull_use_atr': False, 'bull_use_adx': True, 'bull_use_spike': False, 'bull_rsi_required': False, 'bear_strategy': 'mean_reversion', 'bear_bb_std_mult': 2.141825614553917, 'bear_rsi_os': 21, 'bear_rsi_ob': 81, 'bear_adx_thresh': 13.661558540236294, 'bear_atr_min_pct': 0.002799493085076401, 'bear_atr_max_pct': 0.06321662665005014, 'bear_tp_mult': 1.0351607011988837, 'bear_tsl_mult': 0.3657593576393243, 'bear_time_stop': 297, 'bear_use_sma': False, 'bear_use_ema': False, 'bear_use_atr': False, 'bear_use_adx': False, 'bear_use_spike': False, 'bear_rsi_required': False, 'sideways_strategy': 'mean_reversion', 'sideways_bb_std_mult': 3.297292356535268, 'sideways_rsi_os': 17, 'sideways_rsi_ob': 84, 'sideways_adx_thresh': 5.57520400530417, 'sideways_atr_min_pct': 0.002379348937793014, 'sideways_atr_max_pct': 0.0989650888167706, 'sideways_tp_mult': 1.7661589336594778, 'sideways_tsl_mult': 0.005831557497777529, 'sideways_time_stop': 293, 'sideways_use_sma': True, 'sideways_use_ema': True, 'sideways_use_atr': True, 'sideways_use_adx': True, 'sideways_use_spike': True, 'sideways_rsi_required': False}.
[I 2025-09-01 09:05:16,784] Trial 5 finished with values: [-1000000000.0, 1000000000.0] and parameters: {'p_sma': 53, 'p_std': 59, 'p_atr': 16, 'p_adx': 27, 'rsi_period': 69, 'ema1': 14, 'ema2': 10, 'slip_atr_k': 0.1937719524440161, 'slip_spread_k': 0.031078548621895297, 'spread_hl_frac': 0.04786799763047851, 'bb_std_mult': 2.71764228918752, 'rsi_os': 23, 'rsi_ob': 92, 'vol_spike': 0.24480286601293522, 'adx_thresh': 17.37840764582125, 'atr_min_pct': 0.011081150809606798, 'atr_max_pct': 0.028106614892619793, 'tp_mult': 1.664642714256688, 'tsl_mult': 0.24091209519572632, 'strategy': 'breakout', 'time_stop': 283, 'use_sma': False, 'use_atr': False, 'use_adx': False, 'use_ema': True, 'use_spike': False, 'rsi_required': False, 'edge_k': 0.08916014957760265, 'edge_cap': 0.5426016508747115, 'bull_strategy': 'breakout', 'bull_bb_std_mult': 2.333946953193132, 'bull_rsi_os': 15, 'bull_rsi_ob': 95, 'bull_adx_thresh': 20.53701905273717, 'bull_atr_min_pct': 0.0246727892762073, 'bull_atr_max_pct': 0.03995600160014214, 'bull_tp_mult': 2.8613269913543395, 'bull_tsl_mult': 0.4770913576849002, 'bull_time_stop': 101, 'bull_use_sma': False, 'bull_use_ema': True, 'bull_use_atr': False, 'bull_use_adx': False, 'bull_use_spike': False, 'bull_rsi_required': False, 'bear_strategy': 'mean_reversion', 'bear_bb_std_mult': 1.2136814800834883, 'bear_rsi_os': 33, 'bear_rsi_ob': 83, 'bear_adx_thresh': 13.891035855743505, 'bear_atr_min_pct': 0.006362592056538161, 'bear_atr_max_pct': 0.04887212290496016, 'bear_tp_mult': 2.742020670801525, 'bear_tsl_mult': 0.27807508938363845, 'bear_time_stop': 192, 'bear_use_sma': True, 'bear_use_ema': True, 'bear_use_atr': True, 'bear_use_adx': True, 'bear_use_spike': True, 'bear_rsi_required': False, 'sideways_strategy': 'breakout', 'sideways_bb_std_mult': 2.9219010213438565, 'sideways_rsi_os': 7, 'sideways_rsi_ob': 56, 'sideways_adx_thresh': 25.48843758151182, 'sideways_atr_min_pct': 0.010363189650175214, 'sideways_atr_max_pct': 0.1409933346029227, 'sideways_tp_mult': 2.872561846267813, 'sideways_tsl_mult': 0.33247318676592374, 'sideways_time_stop': 104, 'sideways_use_sma': False, 'sideways_use_ema': False, 'sideways_use_atr': False, 'sideways_use_adx': True, 'sideways_use_spike': True, 'sideways_rsi_required': True}.
[I 2025-09-01 09:05:18,033] Trial 8 finished with values: [-0.016142593177618125, 0.016434502353422944] and parameters: {'p_sma': 52, 'p_std': 52, 'p_atr': 19, 'p_adx': 9, 'rsi_period': 27, 'ema1': 5, 'ema2': 23, 'slip_atr_k': 0.1350658197844059, 'slip_spread_k': 0.5614528324512698, 'spread_hl_frac': 0.020985947426322555, 'bb_std_mult': 3.314203142056303, 'rsi_os': 44, 'rsi_ob': 74, 'vol_spike': 0.29496204723071884, 'adx_thresh': 14.354133797192738, 'atr_min_pct': 0.026852656350111265, 'atr_max_pct': 0.10147874312096236, 'tp_mult': 1.6161850335798968, 'tsl_mult': 0.6689112418211849, 'strategy': 'mean_reversion', 'time_stop': 103, 'use_sma': True, 'use_atr': True, 'use_adx': False, 'use_ema': True, 'use_spike': False, 'rsi_required': False, 'edge_k': 0.503415378003081, 'edge_cap': 0.2770622943116762, 'bull_strategy': 'mean_reversion', 'bull_bb_std_mult': 3.1188779561394697, 'bull_rsi_os': 18, 'bull_rsi_ob': 65, 'bull_adx_thresh': 10.8697122099776, 'bull_atr_min_pct': 0.0037575097999793636, 'bull_atr_max_pct': 0.03879092977925624, 'bull_tp_mult': 1.3573730953567777, 'bull_tsl_mult': 0.25907840110692615, 'bull_time_stop': 100, 'bull_use_sma': False, 'bull_use_ema': False, 'bull_use_atr': True, 'bull_use_adx': False, 'bull_use_spike': True, 'bull_rsi_required': True, 'bear_strategy': 'mean_reversion', 'bear_bb_std_mult': 2.8774856260265644, 'bear_rsi_os': 35, 'bear_rsi_ob': 68, 'bear_adx_thresh': 17.62435027066845, 'bear_atr_min_pct': 0.02601421404631433, 'bear_atr_max_pct': 0.014290010090376669, 'bear_tp_mult': 2.648660836519458, 'bear_tsl_mult': 0.5715032905518345, 'bear_time_stop': 66, 'bear_use_sma': False, 'bear_use_ema': True, 'bear_use_atr': True, 'bear_use_adx': True, 'bear_use_spike': True, 'bear_rsi_required': False, 'sideways_strategy': 'breakout', 'sideways_bb_std_mult': 1.7825240971281628, 'sideways_rsi_os': 20, 'sideways_rsi_ob': 78, 'sideways_adx_thresh': 5.93718679658005, 'sideways_atr_min_pct': 0.0005446328257027299, 'sideways_atr_max_pct': 0.054174100952376326, 'sideways_tp_mult': 1.227512765779646, 'sideways_tsl_mult': 0.4830613244218743, 'sideways_time_stop': 271, 'sideways_use_sma': False, 'sideways_use_ema': False, 'sideways_use_atr': False, 'sideways_use_adx': True, 'sideways_use_spike': True, 'sideways_rsi_required': False}.
[I 2025-09-01 09:05:18,284] Trial 7 finished with values: [-1000000000.0, 1000000000.0] and parameters: {'p_sma': 23, 'p_std': 26, 'p_atr': 29, 'p_adx': 28, 'rsi_period': 24, 'ema1': 9, 'ema2': 48, 'slip_atr_k': 0.0728261163481625, 'slip_spread_k': 0.525740392305473, 'spread_hl_frac': 0.005029676130244393, 'bb_std_mult': 3.0756414664289897, 'rsi_os': 50, 'rsi_ob': 75, 'vol_spike': 0.2689288845911682, 'adx_thresh': 12.018837854525499, 'atr_min_pct': 0.013109567707864422, 'atr_max_pct': 0.10312644304148864, 'tp_mult': 1.4322070696280895, 'tsl_mult': 0.3508838570527778, 'strategy': 'breakout', 'time_stop': 127, 'use_sma': True, 'use_atr': False, 'use_adx': True, 'use_ema': False, 'use_spike': False, 'rsi_required': False, 'edge_k': 1.4136188891459165, 'edge_cap': 0.13580601316285193, 'bull_strategy': 'mean_reversion', 'bull_bb_std_mult': 2.3367723882090603, 'bull_rsi_os': 26, 'bull_rsi_ob': 87, 'bull_adx_thresh': 20.59504035076482, 'bull_atr_min_pct': 0.01144162300317557, 'bull_atr_max_pct': 0.147572285401901, 'bull_tp_mult': 2.884331735830412, 'bull_tsl_mult': 0.5362510380143473, 'bull_time_stop': 288, 'bull_use_sma': True, 'bull_use_ema': True, 'bull_use_atr': True, 'bull_use_adx': False, 'bull_use_spike': True, 'bull_rsi_required': True, 'bear_strategy': 'mean_reversion', 'bear_bb_std_mult': 2.464340954483239, 'bear_rsi_os': 52, 'bear_rsi_ob': 57, 'bear_adx_thresh': 9.920114976490103, 'bear_atr_min_pct': 0.00285655378899916, 'bear_atr_max_pct': 0.0314542492192219, 'bear_tp_mult': 1.4276855131957915, 'bear_tsl_mult': 0.7931091906843942, 'bear_time_stop': 220, 'bear_use_sma': True, 'bear_use_ema': True, 'bear_use_atr': True, 'bear_use_adx': True, 'bear_use_spike': True, 'bear_rsi_required': False, 'sideways_strategy': 'breakout', 'sideways_bb_std_mult': 0.754036677544058, 'sideways_rsi_os': 46, 'sideways_rsi_ob': 55, 'sideways_adx_thresh': 13.1812135882022, 'sideways_atr_min_pct': 0.02276037694155317, 'sideways_atr_max_pct': 0.0128847755822109, 'sideways_tp_mult': 2.140013201457809, 'sideways_tsl_mult': 0.6973998541597438, 'sideways_time_stop': 242, 'sideways_use_sma': False, 'sideways_use_ema': False, 'sideways_use_atr': False, 'sideways_use_adx': True, 'sideways_use_spike': True, 'sideways_rsi_required': True}.
[I 2025-09-01 09:05:18,521] Trial 6 finished with values: [-0.15838371081133773, 0.15817778405864555] and parameters: {'p_sma': 20, 'p_std': 18, 'p_atr': 15, 'p_adx': 23, 'rsi_period': 42, 'ema1': 17, 'ema2': 24, 'slip_atr_k': 0.14633562585630855, 'slip_spread_k': 0.33902768223774493, 'spread_hl_frac': 0.028025056756810593, 'bb_std_mult': 2.475330921860456, 'rsi_os': 39, 'rsi_ob': 72, 'vol_spike': 0.08485301287898497, 'adx_thresh': 27.915011442739953, 'atr_min_pct': 0.029089874752450368, 'atr_max_pct': 0.06740117718919791, 'tp_mult': 2.736096321274607, 'tsl_mult': 0.4935556575497113, 'strategy': 'breakout', 'time_stop': 70, 'use_sma': False, 'use_atr': False, 'use_adx': True, 'use_ema': True, 'use_spike': False, 'rsi_required': True, 'edge_k': 0.5793297031814577, 'edge_cap': 0.7979573940559248, 'bull_strategy': 'mean_reversion', 'bull_bb_std_mult': 1.4528673550515556, 'bull_rsi_os': 42, 'bull_rsi_ob': 73, 'bull_adx_thresh': 32.34438990673058, 'bull_atr_min_pct': 0.02105593696877036, 'bull_atr_max_pct': 0.07429147084321021, 'bull_tp_mult': 1.8669608049841837, 'bull_tsl_mult': 0.15705372879932666, 'bull_time_stop': 294, 'bull_use_sma': False, 'bull_use_ema': False, 'bull_use_atr': False, 'bull_use_adx': True, 'bull_use_spike': False, 'bull_rsi_required': True, 'bear_strategy': 'breakout', 'bear_bb_std_mult': 1.0767887437533803, 'bear_rsi_os': 14, 'bear_rsi_ob': 46, 'bear_adx_thresh': 9.430687483296282, 'bear_atr_min_pct': 0.0004766169050840707, 'bear_atr_max_pct': 0.044158862569745834, 'bear_tp_mult': 2.9021735979500325, 'bear_tsl_mult': 0.2744975254313111, 'bear_time_stop': 183, 'bear_use_sma': True, 'bear_use_ema': False, 'bear_use_atr': True, 'bear_use_adx': False, 'bear_use_spike': True, 'bear_rsi_required': True, 'sideways_strategy': 'breakout', 'sideways_bb_std_mult': 0.8243653577453441, 'sideways_rsi_os': 12, 'sideways_rsi_ob': 95, 'sideways_adx_thresh': 16.905843060970103, 'sideways_atr_min_pct': 0.008615015431495768, 'sideways_atr_max_pct': 0.14747504545583628, 'sideways_tp_mult': 1.8518950856299898, 'sideways_tsl_mult': 0.0029048613984546945, 'sideways_time_stop': 122, 'sideways_use_sma': True, 'sideways_use_ema': True, 'sideways_use_atr': True, 'sideways_use_adx': True, 'sideways_use_spike': True, 'sideways_rsi_required': True}.
