[I 2025-09-01 09:12:11,456] Trial 50 finished with values: [-0.01414636782487122, 0.014015472441803546] and parameters: {'p_sma': 18, 'p_std': 44, 'p_atr': 11, 'p_adx': 22, 'rsi_period': 31, 'ema1': 19, 'ema2': 23, 'slip_atr_k': 0.11611369461133539, 'slip_spread_k': 0.33207004812742136, 'spread_hl_frac': 0.001718721862004887, 'bb_std_mult': 0.9223879982847734, 'rsi_os': 37, 'rsi_ob': 61, 'vol_spike': 0.29141449398063624, 'adx_thresh': 29.41753683716393, 'atr_min_pct': 0.01488745322140308, 'atr_max_pct': 0.06641490996880363, 'tp_mult': 2.043551780087619, 'tsl_mult': 0.2962642164596936, 'strategy': 'breakout', 'time_stop': 76, 'use_sma': False, 'use_atr': True, 'use_adx': True, 'use_ema': True, 'use_spike': False, 'rsi_required': False, 'edge_k': 1.8737195797170754, 'edge_cap': 0.05900412650886988, 'bull_strategy': 'breakout', 'bull_bb_std_mult': 1.3586056011204017, 'bull_rsi_os': 49, 'bull_rsi_ob': 53, 'bull_adx_thresh': 14.705775736489699, 'bull_atr_min_pct': 0.001841708232075277, 'bull_atr_max_pct': 0.06244389974673035, 'bull_tp_mult': 1.5584093988074024, 'bull_tsl_mult': 0.6074002905344659, 'bull_time_stop': 298, 'bull_use_sma': False, 'bull_use_ema': True, 'bull_use_atr': False, 'bull_use_adx': False, 'bull_use_spike': True, 'bull_rsi_required': False, 'bear_strategy': 'breakout', 'bear_bb_std_mult': 1.2863813454427928, 'bear_rsi_os': 30, 'bear_rsi_ob': 80, 'bear_adx_thresh': 14.697396422406232, 'bear_atr_min_pct': 3.0945713424769886e-05, 'bear_atr_max_pct': 0.13604827129370076, 'bear_tp_mult': 2.985622912861034, 'bear_tsl_mult': 0.9818330059830518, 'bear_time_stop': 67, 'bear_use_sma': False, 'bear_use_ema': False, 'bear_use_atr': False, 'bear_use_adx': True, 'bear_use_spike': True, 'bear_rsi_required': True, 'sideways_strategy': 'mean_reversion', 'sideways_bb_std_mult': 0.6906550432063481, 'sideways_rsi_os': 5, 'sideways_rsi_ob': 52, 'sideways_adx_thresh': 25.769749353500096, 'sideways_atr_min_pct': 0.017479692264898716, 'sideways_atr_max_pct': 0.024785363616931316, 'sideways_tp_mult': 2.17229016818645, 'sideways_tsl_mult': 0.21255450244756724, 'sideways_time_stop': 239, 'sideways_use_sma': False, 'sideways_use_ema': False, 'sideways_use_atr': True, 'sideways_use_adx': True, 'sideways_use_spike': False, 'sideways_rsi_required': True}.
[I 2025-09-01 09:12:11,675] Trial 55 finished with values: [-1000000000.0, 1000000000.0] and parameters: {'p_sma': 28, 'p_std': 50, 'p_atr': 20, 'p_adx': 8, 'rsi_period': 23, 'ema1': 15, 'ema2': 42, 'slip_atr_k': 0.11582233232366387, 'slip_spread_k': 0.575909104567665, 'spread_hl_frac': 0.026854349457929846, 'bb_std_mult': 1.593942829107589, 'rsi_os': 17, 'rsi_ob': 73, 'vol_spike': 0.145624833749121, 'adx_thresh': 30.598065546551247, 'atr_min_pct': 0.02158549428516932, 'atr_max_pct': 0.013210022351150402, 'tp_mult': 2.188539951328854, 'tsl_mult': 0.9200196676111904, 'strategy': 'mean_reversion', 'time_stop': 294, 'use_sma': False, 'use_atr': False, 'use_adx': True, 'use_ema': False, 'use_spike': False, 'rsi_required': True, 'edge_k': 0.49999712481615133, 'edge_cap': 0.6575676106836382, 'bull_strategy': 'breakout', 'bull_bb_std_mult': 1.6618137682082708, 'bull_rsi_os': 8, 'bull_rsi_ob': 48, 'bull_adx_thresh': 28.31151289346321, 'bull_atr_min_pct': 0.006628599020871005, 'bull_atr_max_pct': 0.06286408266184705, 'bull_tp_mult': 1.333829997685432, 'bull_tsl_mult': 0.6778569791082765, 'bull_time_stop': 5, 'bull_use_sma': True, 'bull_use_ema': True, 'bull_use_atr': False, 'bull_use_adx': True, 'bull_use_spike': True, 'bull_rsi_required': False, 'bear_strategy': 'mean_reversion', 'bear_bb_std_mult': 2.163661995357975, 'bear_rsi_os': 30, 'bear_rsi_ob': 85, 'bear_adx_thresh': 17.603839339285, 'bear_atr_min_pct': 0.025519840431645912, 'bear_atr_max_pct': 0.05229885678419565, 'bear_tp_mult': 2.0428933947125656, 'bear_tsl_mult': 0.32008509441252664, 'bear_time_stop': 100, 'bear_use_sma': True, 'bear_use_ema': False, 'bear_use_atr': False, 'bear_use_adx': True, 'bear_use_spike': True, 'bear_rsi_required': True, 'sideways_strategy': 'mean_reversion', 'sideways_bb_std_mult': 0.785516339077738, 'sideways_rsi_os': 11, 'sideways_rsi_ob': 78, 'sideways_adx_thresh': 31.55419357025999, 'sideways_atr_min_pct': 0.010094782913210705, 'sideways_atr_max_pct': 0.010316697122310453, 'sideways_tp_mult': 1.3497840319799308, 'sideways_tsl_mult': 0.9513687966165496, 'sideways_time_stop': 190, 'sideways_use_sma': False, 'sideways_use_ema': False, 'sideways_use_atr': True, 'sideways_use_adx': True, 'sideways_use_spike': True, 'sideways_rsi_required': True}.
[I 2025-09-01 09:12:51,655] Trial 58 finished with values: [-1000000000.0, 1000000000.0] and parameters: {'p_sma': 51, 'p_std': 50, 'p_atr': 27, 'p_adx': 12, 'rsi_period': 24, 'ema1': 22, 'ema2': 42, 'slip_atr_k': 0.08063612596307913, 'slip_spread_k': 0.4310286405299484, 'spread_hl_frac': 0.008616196192205088, 'bb_std_mult': 2.3982538201178634, 'rsi_os': 24, 'rsi_ob': 64, 'vol_spike': 0.18584099841372595, 'adx_thresh': 5.3551770556199845, 'atr_min_pct': 0.014578728663883942, 'atr_max_pct': 0.05392454749554556, 'tp_mult': 2.1813610837906077, 'tsl_mult': 0.8329495055099959, 'strategy': 'mean_reversion', 'time_stop': 49, 'use_sma': True, 'use_atr': True, 'use_adx': False, 'use_ema': False, 'use_spike': False, 'rsi_required': False, 'edge_k': 0.3823680207764476, 'edge_cap': 0.646410292184333, 'bull_strategy': 'mean_reversion', 'bull_bb_std_mult': 1.3185589579523975, 'bull_rsi_os': 23, 'bull_rsi_ob': 56, 'bull_adx_thresh': 27.9611141092021, 'bull_atr_min_pct': 0.006743760193672511, 'bull_atr_max_pct': 0.045618292873831796, 'bull_tp_mult': 1.3332294774323918, 'bull_tsl_mult': 0.6794711272506861, 'bull_time_stop': 211, 'bull_use_sma': False, 'bull_use_ema': False, 'bull_use_atr': True, 'bull_use_adx': False, 'bull_use_spike': True, 'bull_rsi_required': False, 'bear_strategy': 'breakout', 'bear_bb_std_mult': 0.8791089691243077, 'bear_rsi_os': 26, 'bear_rsi_ob': 81, 'bear_adx_thresh': 34.302680543382984, 'bear_atr_min_pct': 0.011369538467059969, 'bear_atr_max_pct': 0.05021965813928702, 'bear_tp_mult': 1.09405364611738, 'bear_tsl_mult': 0.551616416493246, 'bear_time_stop': 80, 'bear_use_sma': True, 'bear_use_ema': False, 'bear_use_atr': False, 'bear_use_adx': True, 'bear_use_spike': True, 'bear_rsi_required': False, 'sideways_strategy': 'mean_reversion', 'sideways_bb_std_mult': 1.7395513525614976, 'sideways_rsi_os': 45, 'sideways_rsi_ob': 88, 'sideways_adx_thresh': 28.779284474980535, 'sideways_atr_min_pct': 0.02386378302200169, 'sideways_atr_max_pct': 0.0593149327495391, 'sideways_tp_mult': 1.3092408844943213, 'sideways_tsl_mult': 0.6567494907016687, 'sideways_time_stop': 28, 'sideways_use_sma': False, 'sideways_use_ema': False, 'sideways_use_atr': False, 'sideways_use_adx': True, 'sideways_use_spike': False, 'sideways_rsi_required': False}.
[I 2025-09-01 09:12:52,472] Trial 59 finished with values: [-1000000000.0, 1000000000.0] and parameters: {'p_sma': 9, 'p_std': 53, 'p_atr': 8, 'p_adx': 12, 'rsi_period': 35, 'ema1': 22, 'ema2': 34, 'slip_atr_k': 0.00015233636694657327, 'slip_spread_k': 0.43098666348079645, 'spread_hl_frac': 0.030196867346913712, 'bb_std_mult': 3.0565176957932385, 'rsi_os': 24, 'rsi_ob': 79, 'vol_spike': 0.2230475150532492, 'adx_thresh': 5.171151815655415, 'atr_min_pct': 0.014818978966816145, 'atr_max_pct': 0.05449359739720294, 'tp_mult': 2.3019116751392055, 'tsl_mult': 0.7551499648240325, 'strategy': 'mean_reversion', 'time_stop': 60, 'use_sma': True, 'use_atr': True, 'use_adx': False, 'use_ema': False, 'use_spike': False, 'rsi_required': False, 'edge_k': 0.10878450646088922, 'edge_cap': 0.10603683556092347, 'bull_strategy': 'mean_reversion', 'bull_bb_std_mult': 1.0043857510723855, 'bull_rsi_os': 23, 'bull_rsi_ob': 89, 'bull_adx_thresh': 31.30277578625601, 'bull_atr_min_pct': 0.027039210086132446, 'bull_atr_max_pct': 0.049604848425489664, 'bull_tp_mult': 1.2080863451098216, 'bull_tsl_mult': 0.42048192579774046, 'bull_time_stop': 34, 'bull_use_sma': False, 'bull_use_ema': False, 'bull_use_atr': True, 'bull_use_adx': False, 'bull_use_spike': False, 'bull_rsi_required': False, 'bear_strategy': 'breakout', 'bear_bb_std_mult': 1.100608502979636, 'bear_rsi_os': 45, 'bear_rsi_ob': 81, 'bear_adx_thresh': 28.94542106745523, 'bear_atr_min_pct': 0.018354866354297422, 'bear_atr_max_pct': 0.04732877735364255, 'bear_tp_mult': 2.232805369298507, 'bear_tsl_mult': 0.5663785008493374, 'bear_time_stop': 26, 'bear_use_sma': False, 'bear_use_ema': False, 'bear_use_atr': False, 'bear_use_adx': False, 'bear_use_spike': True, 'bear_rsi_required': False, 'sideways_strategy': 'mean_reversion', 'sideways_bb_std_mult': 0.9571588876288606, 'sideways_rsi_os': 50, 'sideways_rsi_ob': 95, 'sideways_adx_thresh': 28.554459620963417, 'sideways_atr_min_pct': 0.028079420279466378, 'sideways_atr_max_pct': 0.14651723695571872, 'sideways_tp_mult': 1.8191897686866554, 'sideways_tsl_mult': 0.3588065297575017, 'sideways_time_stop': 287, 'sideways_use_sma': False, 'sideways_use_ema': True, 'sideways_use_atr': False, 'sideways_use_adx': True, 'sideways_use_spike': False, 'sideways_rsi_required': False}.
[I 2025-09-01 09:12:52,837] Trial 56 finished with values: [-1000000000.0, 1000000000.0] and parameters: {'p_sma': 8, 'p_std': 49, 'p_atr': 20, 'p_adx': 8, 'rsi_period': 43, 'ema1': 15, 'ema2': 28, 'slip_atr_k': 0.12036097354761767, 'slip_spread_k': 0.9776577780606017, 'spread_hl_frac': 0.026308781186739443, 'bb_std_mult': 1.6300384824816634, 'rsi_os': 42, 'rsi_ob': 68, 'vol_spike': 0.15068924551973648, 'adx_thresh': 5.929607173505467, 'atr_min_pct': 0.01758584586335742, 'atr_max_pct': 0.07932896090001362, 'tp_mult': 1.328133587621613, 'tsl_mult': 0.9469865249289098, 'strategy': 'mean_reversion', 'time_stop': 120, 'use_sma': True, 'use_atr': True, 'use_adx': False, 'use_ema': False, 'use_spike': False, 'rsi_required': True, 'edge_k': 0.38172190634849046, 'edge_cap': 0.6638690034753243, 'bull_strategy': 'mean_reversion', 'bull_bb_std_mult': 1.2456821359243468, 'bull_rsi_os': 23, 'bull_rsi_ob': 49, 'bull_adx_thresh': 28.30510354454897, 'bull_atr_min_pct': 0.0021721910837353125, 'bull_atr_max_pct': 0.0635824301171031, 'bull_tp_mult': 1.3448750427467822, 'bull_tsl_mult': 0.6821239084469235, 'bull_time_stop': 5, 'bull_use_sma': False, 'bull_use_ema': False, 'bull_use_atr': False, 'bull_use_adx': False, 'bull_use_spike': False, 'bull_rsi_required': False, 'bear_strategy': 'mean_reversion', 'bear_bb_std_mult': 2.168598991935293, 'bear_rsi_os': 11, 'bear_rsi_ob': 52, 'bear_adx_thresh': 15.634797552340553, 'bear_atr_min_pct': 0.020004783514376442, 'bear_atr_max_pct': 0.051683467994221896, 'bear_tp_mult': 2.042666911940324, 'bear_tsl_mult': 0.7719350673289551, 'bear_time_stop': 297, 'bear_use_sma': True, 'bear_use_ema': False, 'bear_use_atr': True, 'bear_use_adx': False, 'bear_use_spike': True, 'bear_rsi_required': True, 'sideways_strategy': 'mean_reversion', 'sideways_bb_std_mult': 1.4561158503743115, 'sideways_rsi_os': 49, 'sideways_rsi_ob': 78, 'sideways_adx_thresh': 6.988531689458801, 'sideways_atr_min_pct': 0.013841726497981162, 'sideways_atr_max_pct': 0.14820695926731225, 'sideways_tp_mult': 1.8093880195213081, 'sideways_tsl_mult': 0.6482008946539586, 'sideways_time_stop': 286, 'sideways_use_sma': False, 'sideways_use_ema': True, 'sideways_use_atr': True, 'sideways_use_adx': True, 'sideways_use_spike': False, 'sideways_rsi_required': True}.
[I 2025-09-01 09:12:53,307] Trial 57 finished with values: [-1000000000.0, 1000000000.0] and parameters: {'p_sma': 5, 'p_std': 50, 'p_atr': 18, 'p_adx': 12, 'rsi_period': 24, 'ema1': 22, 'ema2': 42, 'slip_atr_k': 0.09587598997943098, 'slip_spread_k': 0.5732425833288342, 'spread_hl_frac': 0.030844715706981045, 'bb_std_mult': 1.2884579049117517, 'rsi_os': 24, 'rsi_ob': 64, 'vol_spike': 0.22969158498610315, 'adx_thresh': 5.977111448563555, 'atr_min_pct': 0.0202908046875572, 'atr_max_pct': 0.09084867525456464, 'tp_mult': 2.4539209530019024, 'tsl_mult': 0.18337265123650154, 'strategy': 'mean_reversion', 'time_stop': 46, 'use_sma': True, 'use_atr': True, 'use_adx': False, 'use_ema': False, 'use_spike': False, 'rsi_required': True, 'edge_k': 0.09907058399571375, 'edge_cap': 0.1572196165360643, 'bull_strategy': 'mean_reversion', 'bull_bb_std_mult': 1.2622267377178287, 'bull_rsi_os': 12, 'bull_rsi_ob': 49, 'bull_adx_thresh': 34.20079395495623, 'bull_atr_min_pct': 0.006307887572959659, 'bull_atr_max_pct': 0.14254788227384874, 'bull_tp_mult': 1.3389811585236593, 'bull_tsl_mult': 0.6824945301205821, 'bull_time_stop': 207, 'bull_use_sma': False, 'bull_use_ema': False, 'bull_use_atr': True, 'bull_use_adx': False, 'bull_use_spike': False, 'bull_rsi_required': False, 'bear_strategy': 'mean_reversion', 'bear_bb_std_mult': 2.1655853761596218, 'bear_rsi_os': 26, 'bear_rsi_ob': 79, 'bear_adx_thresh': 28.639692739928314, 'bear_atr_min_pct': 0.022835958484839738, 'bear_atr_max_pct': 0.05401562826382019, 'bear_tp_mult': 1.0611614742242268, 'bear_tsl_mult': 0.21730064721718162, 'bear_time_stop': 76, 'bear_use_sma': True, 'bear_use_ema': False, 'bear_use_atr': True, 'bear_use_adx': False, 'bear_use_spike': True, 'bear_rsi_required': False, 'sideways_strategy': 'mean_reversion', 'sideways_bb_std_mult': 1.4736270640056703, 'sideways_rsi_os': 49, 'sideways_rsi_ob': 95, 'sideways_adx_thresh': 28.83011455719757, 'sideways_atr_min_pct': 0.015319574275868195, 'sideways_atr_max_pct': 0.08743216889692186, 'sideways_tp_mult': 1.3897979785230996, 'sideways_tsl_mult': 0.8105603398919459, 'sideways_time_stop': 30, 'sideways_use_sma': False, 'sideways_use_ema': True, 'sideways_use_atr': False, 'sideways_use_adx': True, 'sideways_use_spike': False, 'sideways_rsi_required': False}.
[I 2025-09-01 09:12:53,688] Trial 63 finished with values: [-1000000000.0, 1000000000.0] and parameters: {'p_sma': 55, 'p_std': 37, 'p_atr': 23, 'p_adx': 10, 'rsi_period': 52, 'ema1': 23, 'ema2': 21, 'slip_atr_k': 0.2248993090181808, 'slip_spread_k': 0.27903222848109976, 'spread_hl_frac': 0.017849694485708594, 'bb_std_mult': 1.8668181468041563, 'rsi_os': 29, 'rsi_ob': 72, 'vol_spike': 0.21240220436396726, 'adx_thresh': 28.751453916663415, 'atr_min_pct': 0.029811200239136103, 'atr_max_pct': 0.020393054856912465, 'tp_mult': 1.5888328461677426, 'tsl_mult': 0.5691316857083665, 'strategy': 'breakout', 'time_stop': 152, 'use_sma': False, 'use_atr': True, 'use_adx': False, 'use_ema': False, 'use_spike': True, 'rsi_required': False, 'edge_k': 0.7202571574266495, 'edge_cap': 0.3190643976534677, 'bull_strategy': 'breakout', 'bull_bb_std_mult': 1.9900223483319324, 'bull_rsi_os': 33, 'bull_rsi_ob': 62, 'bull_adx_thresh': 32.738952994702174, 'bull_atr_min_pct': 0.004401959577952082, 'bull_atr_max_pct': 0.03253829157282713, 'bull_tp_mult': 1.077347053673563, 'bull_tsl_mult': 0.5239249922639706, 'bull_time_stop': 247, 'bull_use_sma': False, 'bull_use_ema': True, 'bull_use_atr': True, 'bull_use_adx': False, 'bull_use_spike': True, 'bull_rsi_required': True, 'bear_strategy': 'breakout', 'bear_bb_std_mult': 2.855476465233291, 'bear_rsi_os': 29, 'bear_rsi_ob': 73, 'bear_adx_thresh': 7.237566323638173, 'bear_atr_min_pct': 0.028681167819673514, 'bear_atr_max_pct': 0.10600299874177524, 'bear_tp_mult': 2.981967045272671, 'bear_tsl_mult': 0.43027809961524993, 'bear_time_stop': 239, 'bear_use_sma': False, 'bear_use_ema': True, 'bear_use_atr': False, 'bear_use_adx': True, 'bear_use_spike': False, 'bear_rsi_required': False, 'sideways_strategy': 'mean_reversion', 'sideways_bb_std_mult': 1.1991884079698316, 'sideways_rsi_os': 27, 'sideways_rsi_ob': 89, 'sideways_adx_thresh': 23.783228402094984, 'sideways_atr_min_pct': 0.023550301251446637, 'sideways_atr_max_pct': 0.06206846429105863, 'sideways_tp_mult': 1.5303850554895226, 'sideways_tsl_mult': 0.37390628419250516, 'sideways_time_stop': 269, 'sideways_use_sma': True, 'sideways_use_ema': False, 'sideways_use_atr': False, 'sideways_use_adx': False, 'sideways_use_spike': False, 'sideways_rsi_required': False}.
[I 2025-09-01 09:13:31,432] Trial 62 finished with values: [-1000000000.0, 1000000000.0] and parameters: {'p_sma': 5, 'p_std': 54, 'p_atr': 23, 'p_adx': 10, 'rsi_period': 65, 'ema1': 23, 'ema2': 10, 'slip_atr_k': 0.23139296370904988, 'slip_spread_k': 0.2628188566791715, 'spread_hl_frac': 0.018444121079039692, 'bb_std_mult': 1.2702441316202981, 'rsi_os': 29, 'rsi_ob': 63, 'vol_spike': 0.04847749807256149, 'adx_thresh': 21.85346337157484, 'atr_min_pct': 0.009675908543004274, 'atr_max_pct': 0.022998911720057108, 'tp_mult': 2.461436356972861, 'tsl_mult': 0.6314309896278718, 'strategy': 'mean_reversion', 'time_stop': 24, 'use_sma': True, 'use_atr': True, 'use_adx': False, 'use_ema': False, 'use_spike': True, 'rsi_required': False, 'edge_k': 0.0590831259668855, 'edge_cap': 0.30846135301598, 'bull_strategy': 'mean_reversion', 'bull_bb_std_mult': 1.9574343256792834, 'bull_rsi_os': 40, 'bull_rsi_ob': 62, 'bull_adx_thresh': 33.129504832158, 'bull_atr_min_pct': 0.004661330825470573, 'bull_atr_max_pct': 0.03385809516836668, 'bull_tp_mult': 1.0788467582141852, 'bull_tsl_mult': 0.8196580834969189, 'bull_time_stop': 252, 'bull_use_sma': False, 'bull_use_ema': False, 'bull_use_atr': True, 'bull_use_adx': False, 'bull_use_spike': True, 'bull_rsi_required': True, 'bear_strategy': 'breakout', 'bear_bb_std_mult': 2.851689958987887, 'bear_rsi_os': 28, 'bear_rsi_ob': 73, 'bear_adx_thresh': 23.158317088388866, 'bear_atr_min_pct': 0.02818060852939686, 'bear_atr_max_pct': 0.14237088854780314, 'bear_tp_mult': 1.3034924110058403, 'bear_tsl_mult': 0.41053882341812653, 'bear_time_stop': 231, 'bear_use_sma': False, 'bear_use_ema': True, 'bear_use_atr': False, 'bear_use_adx': True, 'bear_use_spike': False, 'bear_rsi_required': False, 'sideways_strategy': 'mean_reversion', 'sideways_bb_std_mult': 2.8481599171233474, 'sideways_rsi_os': 16, 'sideways_rsi_ob': 58, 'sideways_adx_thresh': 23.898986122060087, 'sideways_atr_min_pct': 0.004961212913461427, 'sideways_atr_max_pct': 0.06348701630181877, 'sideways_tp_mult': 2.4712027104812475, 'sideways_tsl_mult': 0.7940307276649138, 'sideways_time_stop': 254, 'sideways_use_sma': True, 'sideways_use_ema': False, 'sideways_use_atr': False, 'sideways_use_adx': False, 'sideways_use_spike': False, 'sideways_rsi_required': False}.
[I 2025-09-01 09:13:31,785] Trial 61 finished with values: [-0.00042186234767982445, 0.002395353624865118] and parameters: {'p_sma': 57, 'p_std': 37, 'p_atr': 28, 'p_adx': 10, 'rsi_period': 43, 'ema1': 23, 'ema2': 12, 'slip_atr_k': 0.022301287347555182, 'slip_spread_k': 0.24875259315217008, 'spread_hl_frac': 0.0182811883299466, 'bb_std_mult': 2.634555081002993, 'rsi_os': 42, 'rsi_ob': 56, 'vol_spike': 0.13556959546882963, 'adx_thresh': 11.679587545099162, 'atr_min_pct': 0.012144857479567759, 'atr_max_pct': 0.024647340490243516, 'tp_mult': 2.439927703141604, 'tsl_mult': 0.4464323911917957, 'strategy': 'mean_reversion', 'time_stop': 147, 'use_sma': True, 'use_atr': True, 'use_adx': False, 'use_ema': False, 'use_spike': True, 'rsi_required': False, 'edge_k': 0.5530810859334161, 'edge_cap': 0.32324857173117616, 'bull_strategy': 'mean_reversion', 'bull_bb_std_mult': 1.965205868003383, 'bull_rsi_os': 32, 'bull_rsi_ob': 62, 'bull_adx_thresh': 17.14720573385413, 'bull_atr_min_pct': 0.004842909468238653, 'bull_atr_max_pct': 0.03284751861420471, 'bull_tp_mult': 2.3977502033365687, 'bull_tsl_mult': 0.5225625458169841, 'bull_time_stop': 250, 'bull_use_sma': False, 'bull_use_ema': False, 'bull_use_atr': True, 'bull_use_adx': False, 'bull_use_spike': True, 'bull_rsi_required': False, 'bear_strategy': 'breakout', 'bear_bb_std_mult': 1.452908396932124, 'bear_rsi_os': 27, 'bear_rsi_ob': 52, 'bear_adx_thresh': 15.974972642938083, 'bear_atr_min_pct': 0.028609476449827483, 'bear_atr_max_pct': 0.10790673882386623, 'bear_tp_mult': 2.9949732655843446, 'bear_tsl_mult': 0.799431269452795, 'bear_time_stop': 235, 'bear_use_sma': False, 'bear_use_ema': False, 'bear_use_atr': True, 'bear_use_adx': True, 'bear_use_spike': False, 'bear_rsi_required': False, 'sideways_strategy': 'mean_reversion', 'sideways_bb_std_mult': 2.1935356896004836, 'sideways_rsi_os': 27, 'sideways_rsi_ob': 56, 'sideways_adx_thresh': 24.378569390748204, 'sideways_atr_min_pct': 0.0015542258334254773, 'sideways_atr_max_pct': 0.08701091499486484, 'sideways_tp_mult': 1.416468994937448, 'sideways_tsl_mult': 0.8229476531749873, 'sideways_time_stop': 220, 'sideways_use_sma': True, 'sideways_use_ema': False, 'sideways_use_atr': False, 'sideways_use_adx': False, 'sideways_use_spike': False, 'sideways_rsi_required': False}.
