[I 2025-09-01 09:14:48,102] Trial 69 finished with values: [-0.012375844450311924, 0.013008791404810713] and parameters: {'p_sma': 24, 'p_std': 34, 'p_atr': 28, 'p_adx': 23, 'rsi_period': 45, 'ema1': 28, 'ema2': 12, 'slip_atr_k': 0.06614223070578716, 'slip_spread_k': 0.35320617478123745, 'spread_hl_frac': 0.015637127487505176, 'bb_std_mult': 2.62027747471989, 'rsi_os': 47, 'rsi_ob': 56, 'vol_spike': 0.2783592971524777, 'adx_thresh': 15.708718300652372, 'atr_min_pct': 0.011936687712720344, 'atr_max_pct': 0.03886014298915847, 'tp_mult': 2.2874676514236145, 'tsl_mult': 0.3285697212898171, 'strategy': 'mean_reversion', 'time_stop': 142, 'use_sma': True, 'use_atr': True, 'use_adx': False, 'use_ema': False, 'use_spike': True, 'rsi_required': False, 'edge_k': 0.7296156930367295, 'edge_cap': 0.3459375155597453, 'bull_strategy': 'mean_reversion', 'bull_bb_std_mult': 2.2213876446607372, 'bull_rsi_os': 49, 'bull_rsi_ob': 73, 'bull_adx_thresh': 18.01292200870829, 'bull_atr_min_pct': 0.02200576550697606, 'bull_atr_max_pct': 0.01617391220981292, 'bull_tp_mult': 2.3768103995279164, 'bull_tsl_mult': 0.5034837946735032, 'bull_time_stop': 279, 'bull_use_sma': False, 'bull_use_ema': False, 'bull_use_atr': True, 'bull_use_adx': False, 'bull_use_spike': True, 'bull_rsi_required': False, 'bear_strategy': 'breakout', 'bear_bb_std_mult': 0.9340277419351549, 'bear_rsi_os': 23, 'bear_rsi_ob': 51, 'bear_adx_thresh': 16.47124592282735, 'bear_atr_min_pct': 0.02859551037709252, 'bear_atr_max_pct': 0.10810719019926633, 'bear_tp_mult': 2.9898448288870445, 'bear_tsl_mult': 0.7336239165189712, 'bear_time_stop': 214, 'bear_use_sma': False, 'bear_use_ema': True, 'bear_use_atr': True, 'bear_use_adx': True, 'bear_use_spike': False, 'bear_rsi_required': False, 'sideways_strategy': 'breakout', 'sideways_bb_std_mult': 2.1399858467187887, 'sideways_rsi_os': 34, 'sideways_rsi_ob': 45, 'sideways_adx_thresh': 19.520262195462962, 'sideways_atr_min_pct': 0.002702905201577033, 'sideways_atr_max_pct': 0.08575260035368663, 'sideways_tp_mult': 1.4301735679583054, 'sideways_tsl_mult': 0.03138455617812297, 'sideways_time_stop': 199, 'sideways_use_sma': True, 'sideways_use_ema': False, 'sideways_use_atr': False, 'sideways_use_adx': False, 'sideways_use_spike': False, 'sideways_rsi_required': False}.
[I 2025-09-01 09:14:49,342] Trial 73 finished with values: [-1000000000.0, 1000000000.0] and parameters: {'p_sma': 38, 'p_std': 23, 'p_atr': 26, 'p_adx': 21, 'rsi_period': 47, 'ema1': 21, 'ema2': 21, 'slip_atr_k': 0.07121538693523513, 'slip_spread_k': 0.16947019768614935, 'spread_hl_frac': 0.023221151199356166, 'bb_std_mult': 2.575641551771612, 'rsi_os': 43, 'rsi_ob': 59, 'vol_spike': 0.13064667218234816, 'adx_thresh': 10.00501149834256, 'atr_min_pct': 0.01628356500823331, 'atr_max_pct': 0.018963285903790914, 'tp_mult': 2.299771211677135, 'tsl_mult': 0.39330543383700556, 'strategy': 'mean_reversion', 'time_stop': 169, 'use_sma': True, 'use_atr': True, 'use_adx': False, 'use_ema': False, 'use_spike': True, 'rsi_required': True, 'edge_k': 0.5432884232292396, 'edge_cap': 0.2776192285640996, 'bull_strategy': 'mean_reversion', 'bull_bb_std_mult': 1.673015110117588, 'bull_rsi_os': 38, 'bull_rsi_ob': 66, 'bull_adx_thresh': 12.684539506387768, 'bull_atr_min_pct': 0.010041041561667423, 'bull_atr_max_pct': 0.023367946819851083, 'bull_tp_mult': 2.497140033792965, 'bull_tsl_mult': 0.5530783937336327, 'bull_time_stop': 274, 'bull_use_sma': False, 'bull_use_ema': False, 'bull_use_atr': True, 'bull_use_adx': True, 'bull_use_spike': True, 'bull_rsi_required': True, 'bear_strategy': 'breakout', 'bear_bb_std_mult': 1.0120910299133024, 'bear_rsi_os': 24, 'bear_rsi_ob': 51, 'bear_adx_thresh': 16.46885139715245, 'bear_atr_min_pct': 0.026349615033660127, 'bear_atr_max_pct': 0.11740518010763949, 'bear_tp_mult': 2.6610164852720395, 'bear_tsl_mult': 0.8979949486365808, 'bear_time_stop': 180, 'bear_use_sma': False, 'bear_use_ema': True, 'bear_use_atr': True, 'bear_use_adx': True, 'bear_use_spike': False, 'bear_rsi_required': False, 'sideways_strategy': 'mean_reversion', 'sideways_bb_std_mult': 2.4613676951051553, 'sideways_rsi_os': 25, 'sideways_rsi_ob': 49, 'sideways_adx_thresh': 14.17328092188155, 'sideways_atr_min_pct': 0.00790301222107843, 'sideways_atr_max_pct': 0.12497277647900969, 'sideways_tp_mult': 1.5228310453961245, 'sideways_tsl_mult': 0.6210008422015515, 'sideways_time_stop': 238, 'sideways_use_sma': True, 'sideways_use_ema': False, 'sideways_use_atr': False, 'sideways_use_adx': False, 'sideways_use_spike': False, 'sideways_rsi_required': False}.
[I 2025-09-01 09:14:49,781] Trial 74 finished with values: [-1000000000.0, 1000000000.0] and parameters: {'p_sma': 55, 'p_std': 22, 'p_atr': 26, 'p_adx': 27, 'rsi_period': 47, 'ema1': 21, 'ema2': 19, 'slip_atr_k': 0.07310804152982742, 'slip_spread_k': 0.32285565905384705, 'spread_hl_frac': 0.022323753751795437, 'bb_std_mult': 2.5600948210112726, 'rsi_os': 44, 'rsi_ob': 55, 'vol_spike': 0.12336176833362082, 'adx_thresh': 10.100386244667364, 'atr_min_pct': 0.016291432028186198, 'atr_max_pct': 0.02054399362924024, 'tp_mult': 2.7313300205989237, 'tsl_mult': 0.4035615789280399, 'strategy': 'mean_reversion', 'time_stop': 153, 'use_sma': True, 'use_atr': True, 'use_adx': False, 'use_ema': False, 'use_spike': True, 'rsi_required': True, 'edge_k': 1.0704660002571735, 'edge_cap': 0.2632796655448135, 'bull_strategy': 'mean_reversion', 'bull_bb_std_mult': 2.765286678054707, 'bull_rsi_os': 39, 'bull_rsi_ob': 66, 'bull_adx_thresh': 19.74539190206936, 'bull_atr_min_pct': 0.015518840644463766, 'bull_atr_max_pct': 0.02743710057006869, 'bull_tp_mult': 2.525636476078703, 'bull_tsl_mult': 0.5477790817085082, 'bull_time_stop': 228, 'bull_use_sma': False, 'bull_use_ema': False, 'bull_use_atr': True, 'bull_use_adx': True, 'bull_use_spike': True, 'bull_rsi_required': True, 'bear_strategy': 'breakout', 'bear_bb_std_mult': 1.8003591791220495, 'bear_rsi_os': 27, 'bear_rsi_ob': 51, 'bear_adx_thresh': 16.52629844345137, 'bear_atr_min_pct': 0.026132219571718497, 'bear_atr_max_pct': 0.11781435137497445, 'bear_tp_mult': 2.711265675376705, 'bear_tsl_mult': 0.6827422891819588, 'bear_time_stop': 247, 'bear_use_sma': False, 'bear_use_ema': True, 'bear_use_atr': True, 'bear_use_adx': True, 'bear_use_spike': False, 'bear_rsi_required': False, 'sideways_strategy': 'mean_reversion', 'sideways_bb_std_mult': 2.5755531992981266, 'sideways_rsi_os': 25, 'sideways_rsi_ob': 69, 'sideways_adx_thresh': 18.228260545928592, 'sideways_atr_min_pct': 0.005043179249744083, 'sideways_atr_max_pct': 0.12377622300472421, 'sideways_tp_mult': 1.5128144067525433, 'sideways_tsl_mult': 0.7447323938717909, 'sideways_time_stop': 222, 'sideways_use_sma': True, 'sideways_use_ema': False, 'sideways_use_atr': False, 'sideways_use_adx': False, 'sideways_use_spike': False, 'sideways_rsi_required': False}.
[I 2025-09-01 09:14:50,058] Trial 75 finished with values: [-1000000000.0, 1000000000.0] and parameters: {'p_sma': 55, 'p_std': 17, 'p_atr': 27, 'p_adx': 27, 'rsi_period': 46, 'ema1': 21, 'ema2': 10, 'slip_atr_k': 0.06952987907732022, 'slip_spread_k': 0.3130395138575219, 'spread_hl_frac': 0.022341497151458757, 'bb_std_mult': 2.810395171751088, 'rsi_os': 44, 'rsi_ob': 45, 'vol_spike': 0.1284310420540181, 'adx_thresh': 10.109415136099516, 'atr_min_pct': 0.027289081048494798, 'atr_max_pct': 0.02305970853777775, 'tp_mult': 2.732823777201354, 'tsl_mult': 0.4094889103938662, 'strategy': 'mean_reversion', 'time_stop': 191, 'use_sma': True, 'use_atr': True, 'use_adx': False, 'use_ema': True, 'use_spike': True, 'rsi_required': False, 'edge_k': 1.037770559334457, 'edge_cap': 0.32503371947621046, 'bull_strategy': 'mean_reversion', 'bull_bb_std_mult': 2.762716795987897, 'bull_rsi_os': 48, 'bull_rsi_ob': 66, 'bull_adx_thresh': 15.495704775430228, 'bull_atr_min_pct': 0.01579503790371618, 'bull_atr_max_pct': 0.03690367250302372, 'bull_tp_mult': 2.5040943700123837, 'bull_tsl_mult': 0.5393418082654228, 'bull_time_stop': 112, 'bull_use_sma': False, 'bull_use_ema': False, 'bull_use_atr': True, 'bull_use_adx': True, 'bull_use_spike': True, 'bull_rsi_required': False, 'bear_strategy': 'breakout', 'bear_bb_std_mult': 1.828724385831572, 'bear_rsi_os': 27, 'bear_rsi_ob': 51, 'bear_adx_thresh': 16.513842362644876, 'bear_atr_min_pct': 0.025819538884546585, 'bear_atr_max_pct': 0.11578769052870405, 'bear_tp_mult': 2.9890045473564624, 'bear_tsl_mult': 0.9019459013915843, 'bear_time_stop': 248, 'bear_use_sma': False, 'bear_use_ema': True, 'bear_use_atr': True, 'bear_use_adx': True, 'bear_use_spike': False, 'bear_rsi_required': False, 'sideways_strategy': 'mean_reversion', 'sideways_bb_std_mult': 2.5676444504868368, 'sideways_rsi_os': 25, 'sideways_rsi_ob': 67, 'sideways_adx_thresh': 9.230406331116228, 'sideways_atr_min_pct': 0.00197980932158935, 'sideways_atr_max_pct': 0.08527246706939184, 'sideways_tp_mult': 1.5120349118992358, 'sideways_tsl_mult': 0.033968140538411684, 'sideways_time_stop': 126, 'sideways_use_sma': True, 'sideways_use_ema': False, 'sideways_use_atr': False, 'sideways_use_adx': False, 'sideways_use_spike': False, 'sideways_rsi_required': False}.
[I 2025-09-01 09:14:50,074] Trial 76 finished with values: [-1000000000.0, 1000000000.0] and parameters: {'p_sma': 54, 'p_std': 35, 'p_atr': 24, 'p_adx': 18, 'rsi_period': 47, 'ema1': 21, 'ema2': 10, 'slip_atr_k': 0.025396822760189775, 'slip_spread_k': 0.3204157473581168, 'spread_hl_frac': 0.0100908044420399, 'bb_std_mult': 2.5756444801094363, 'rsi_os': 44, 'rsi_ob': 54, 'vol_spike': 0.1290443041882248, 'adx_thresh': 16.023004347738294, 'atr_min_pct': 0.027993072828431678, 'atr_max_pct': 0.019889682868928373, 'tp_mult': 2.7162839309321387, 'tsl_mult': 0.4111348436096372, 'strategy': 'mean_reversion', 'time_stop': 157, 'use_sma': True, 'use_atr': True, 'use_adx': False, 'use_ema': True, 'use_spike': True, 'rsi_required': False, 'edge_k': 0.5566090525113024, 'edge_cap': 0.2687161793369655, 'bull_strategy': 'mean_reversion', 'bull_bb_std_mult': 1.693759400642857, 'bull_rsi_os': 39, 'bull_rsi_ob': 65, 'bull_adx_thresh': 15.704180000713224, 'bull_atr_min_pct': 0.015838574706561706, 'bull_atr_max_pct': 0.036969814937005616, 'bull_tp_mult': 2.510670745190995, 'bull_tsl_mult': 0.5385361463284549, 'bull_time_stop': 109, 'bull_use_sma': False, 'bull_use_ema': False, 'bull_use_atr': True, 'bull_use_adx': False, 'bull_use_spike': True, 'bull_rsi_required': False, 'bear_strategy': 'mean_reversion', 'bear_bb_std_mult': 1.7892327047752954, 'bear_rsi_os': 5, 'bear_rsi_ob': 52, 'bear_adx_thresh': 16.375667676235487, 'bear_atr_min_pct': 0.02632362462485903, 'bear_atr_max_pct': 0.11496751157289599, 'bear_tp_mult': 2.7211555349931054, 'bear_tsl_mult': 0.8896851265932307, 'bear_time_stop': 244, 'bear_use_sma': False, 'bear_use_ema': False, 'bear_use_atr': True, 'bear_use_adx': True, 'bear_use_spike': False, 'bear_rsi_required': False, 'sideways_strategy': 'mean_reversion', 'sideways_bb_std_mult': 2.5932628621777027, 'sideways_rsi_os': 32, 'sideways_rsi_ob': 49, 'sideways_adx_thresh': 18.243852140191926, 'sideways_atr_min_pct': 0.0016865405867346423, 'sideways_atr_max_pct': 0.10004938391527882, 'sideways_tp_mult': 1.3369058724527427, 'sideways_tsl_mult': 0.06180795649526449, 'sideways_time_stop': 226, 'sideways_use_sma': True, 'sideways_use_ema': False, 'sideways_use_atr': False, 'sideways_use_adx': False, 'sideways_use_spike': False, 'sideways_rsi_required': False}.
[I 2025-09-01 09:14:50,272] Trial 78 finished with values: [-1000000000.0, 1000000000.0] and parameters: {'p_sma': 36, 'p_std': 35, 'p_atr': 24, 'p_adx': 23, 'rsi_period': 40, 'ema1': 24, 'ema2': 10, 'slip_atr_k': 0.0491725961802776, 'slip_spread_k': 0.9145932209590245, 'spread_hl_frac': 0.019011545035883506, 'bb_std_mult': 2.8878200286769515, 'rsi_os': 40, 'rsi_ob': 53, 'vol_spike': 0.11672241547236953, 'adx_thresh': 19.47554052357502, 'atr_min_pct': 0.02778426600357127, 'atr_max_pct': 0.026131621813191837, 'tp_mult': 2.903487357166686, 'tsl_mult': 0.5328462180072722, 'strategy': 'breakout', 'time_stop': 192, 'use_sma': True, 'use_atr': True, 'use_adx': False, 'use_ema': True, 'use_spike': True, 'rsi_required': False, 'edge_k': 0.4468572990860259, 'edge_cap': 0.33663724766562125, 'bull_strategy': 'mean_reversion', 'bull_bb_std_mult': 1.777053922833248, 'bull_rsi_os': 48, 'bull_rsi_ob': 71, 'bull_adx_thresh': 11.332522189319198, 'bull_atr_min_pct': 0.017204127619755198, 'bull_atr_max_pct': 0.035872531473094924, 'bull_tp_mult': 2.3524133969089567, 'bull_tsl_mult': 0.15894147347794546, 'bull_time_stop': 110, 'bull_use_sma': False, 'bull_use_ema': False, 'bull_use_atr': True, 'bull_use_adx': False, 'bull_use_spike': True, 'bull_rsi_required': False, 'bear_strategy': 'mean_reversion', 'bear_bb_std_mult': 1.2449962110648103, 'bear_rsi_os': 5, 'bear_rsi_ob': 45, 'bear_adx_thresh': 21.06167852415627, 'bear_atr_min_pct': 0.014279451924592887, 'bear_atr_max_pct': 0.09972786413064082, 'bear_tp_mult': 2.9844253251160686, 'bear_tsl_mult': 0.8210263742712735, 'bear_time_stop': 215, 'bear_use_sma': False, 'bear_use_ema': False, 'bear_use_atr': True, 'bear_use_adx': True, 'bear_use_spike': False, 'bear_rsi_required': False, 'sideways_strategy': 'breakout', 'sideways_bb_std_mult': 2.138437726354902, 'sideways_rsi_os': 33, 'sideways_rsi_ob': 55, 'sideways_adx_thresh': 8.928884398918699, 'sideways_atr_min_pct': 0.0015966746611215858, 'sideways_atr_max_pct': 0.08582745151552362, 'sideways_tp_mult': 1.3604223560404631, 'sideways_tsl_mult': 0.5911621860506163, 'sideways_time_stop': 207, 'sideways_use_sma': True, 'sideways_use_ema': False, 'sideways_use_atr': False, 'sideways_use_adx': False, 'sideways_use_spike': False, 'sideways_rsi_required': False}.
[I 2025-09-01 09:15:30,012] Trial 77 finished with values: [-0.039766636565378266, 0.03977222515470412] and parameters: {'p_sma': 55, 'p_std': 15, 'p_atr': 24, 'p_adx': 7, 'rsi_period': 11, 'ema1': 24, 'ema2': 11, 'slip_atr_k': 0.05064955593844415, 'slip_spread_k': 0.31826559718561376, 'spread_hl_frac': 0.009652568807727416, 'bb_std_mult': 2.8020458996791273, 'rsi_os': 48, 'rsi_ob': 52, 'vol_spike': 0.12184371377129904, 'adx_thresh': 13.559636609687118, 'atr_min_pct': 0.014055653254058855, 'atr_max_pct': 0.024856376060865683, 'tp_mult': 2.904801733409911, 'tsl_mult': 0.5508117081215779, 'strategy': 'breakout', 'time_stop': 155, 'use_sma': True, 'use_atr': True, 'use_adx': False, 'use_ema': True, 'use_spike': True, 'rsi_required': False, 'edge_k': 0.5997606813872438, 'edge_cap': 0.33678119863759165, 'bull_strategy': 'mean_reversion', 'bull_bb_std_mult': 2.767616508483406, 'bull_rsi_os': 49, 'bull_rsi_ob': 71, 'bull_adx_thresh': 15.567262914632575, 'bull_atr_min_pct': 0.017836971918291554, 'bull_atr_max_pct': 0.034585491553626134, 'bull_tp_mult': 2.209343028821377, 'bull_tsl_mult': 0.1832564550157209, 'bull_time_stop': 226, 'bull_use_sma': False, 'bull_use_ema': False, 'bull_use_atr': True, 'bull_use_adx': False, 'bull_use_spike': True, 'bull_rsi_required': False, 'bear_strategy': 'mean_reversion', 'bear_bb_std_mult': 1.2031405203546193, 'bear_rsi_os': 27, 'bear_rsi_ob': 45, 'bear_adx_thresh': 14.631612660698867, 'bear_atr_min_pct': 0.025649744112969206, 'bear_atr_max_pct': 0.10108503983455255, 'bear_tp_mult': 2.710239247939424, 'bear_tsl_mult': 0.816924118085927, 'bear_time_stop': 246, 'bear_use_sma': False, 'bear_use_ema': False, 'bear_use_atr': True, 'bear_use_adx': True, 'bear_use_spike': False, 'bear_rsi_required': False, 'sideways_strategy': 'mean_reversion', 'sideways_bb_std_mult': 2.5924623830798845, 'sideways_rsi_os': 27, 'sideways_rsi_ob': 48, 'sideways_adx_thresh': 18.45057533130998, 'sideways_atr_min_pct': 0.0018854488166941121, 'sideways_atr_max_pct': 0.08512003420074336, 'sideways_tp_mult': 1.3460618589416127, 'sideways_tsl_mult': 0.6912200309622876, 'sideways_time_stop': 223, 'sideways_use_sma': True, 'sideways_use_ema': False, 'sideways_use_atr': False, 'sideways_use_adx': False, 'sideways_use_spike': False, 'sideways_rsi_required': False}.
[I 2025-09-01 09:15:30,764] Trial 80 finished with values: [-0.07083304719498917, 0.07074238735416473] and parameters: {'p_sma': 48, 'p_std': 38, 'p_atr': 24, 'p_adx': 24, 'rsi_period': 33, 'ema1': 24, 'ema2': 15, 'slip_atr_k': 0.00539279154038827, 'slip_spread_k': 0.6110113157594859, 'spread_hl_frac': 0.019244969571532183, 'bb_std_mult': 2.922260043657529, 'rsi_os': 40, 'rsi_ob': 47, 'vol_spike': 0.1145649114466109, 'adx_thresh': 20.182309653603227, 'atr_min_pct': 0.013954935556152652, 'atr_max_pct': 0.029610652760214573, 'tp_mult': 2.8720431163520797, 'tsl_mult': 0.54000842219606, 'strategy': 'breakout', 'time_stop': 243, 'use_sma': True, 'use_atr': False, 'use_adx': False, 'use_ema': False, 'use_spike': True, 'rsi_required': False, 'edge_k': 1.29857353762045, 'edge_cap': 0.4568430027938755, 'bull_strategy': 'mean_reversion', 'bull_bb_std_mult': 3.2902944776645286, 'bull_rsi_os': 43, 'bull_rsi_ob': 60, 'bull_adx_thresh': 10.850899973915135, 'bull_atr_min_pct': 0.017979339479479682, 'bull_atr_max_pct': 0.031632897695918004, 'bull_tp_mult': 2.190477381148616, 'bull_tsl_mult': 0.9985920994827745, 'bull_time_stop': 257, 'bull_use_sma': False, 'bull_use_ema': False, 'bull_use_atr': True, 'bull_use_adx': False, 'bull_use_spike': True, 'bull_rsi_required': False, 'bear_strategy': 'mean_reversion', 'bear_bb_std_mult': 0.7131792468332803, 'bear_rsi_os': 14, 'bear_rsi_ob': 54, 'bear_adx_thresh': 12.62793111143343, 'bear_atr_min_pct': 0.027867267152976948, 'bear_atr_max_pct': 0.0988287371649604, 'bear_tp_mult': 2.8179092741233487, 'bear_tsl_mult': 0.8132830564388137, 'bear_time_stop': 215, 'bear_use_sma': True, 'bear_use_ema': False, 'bear_use_atr': True, 'bear_use_adx': True, 'bear_use_spike': False, 'bear_rsi_required': False, 'sideways_strategy': 'breakout', 'sideways_bb_std_mult': 2.2897922372235002, 'sideways_rsi_os': 53, 'sideways_rsi_ob': 62, 'sideways_adx_thresh': 24.898756339633316, 'sideways_atr_min_pct': 0.0008261313716648028, 'sideways_atr_max_pct': 0.07662476691102008, 'sideways_tp_mult': 1.670472178556926, 'sideways_tsl_mult': 0.6848489142804017, 'sideways_time_stop': 207, 'sideways_use_sma': True, 'sideways_use_ema': False, 'sideways_use_atr': False, 'sideways_use_adx': False, 'sideways_use_spike': False, 'sideways_rsi_required': False}.
[I 2025-09-01 09:15:31,111] Trial 81 finished with values: [-1000000000.0, 1000000000.0] and parameters: {'p_sma': 51, 'p_std': 42, 'p_atr': 29, 'p_adx': 7, 'rsi_period': 68, 'ema1': 7, 'ema2': 15, 'slip_atr_k': 0.02767699028187728, 'slip_spread_k': 0.23263607960444974, 'spread_hl_frac': 0.016640248429038045, 'bb_std_mult': 2.7660172834185004, 'rsi_os': 49, 'rsi_ob': 47, 'vol_spike': 0.13988570244957693, 'adx_thresh': 13.620663731947346, 'atr_min_pct': 0.010337227900780198, 'atr_max_pct': 0.015849851882188043, 'tp_mult': 2.84600452592703, 'tsl_mult': 0.5007426232565835, 'strategy': 'breakout', 'time_stop': 236, 'use_sma': True, 'use_atr': False, 'use_adx': False, 'use_ema': False, 'use_spike': True, 'rsi_required': False, 'edge_k': 1.3312656903016924, 'edge_cap': 0.4405882814420083, 'bull_strategy': 'mean_reversion', 'bull_bb_std_mult': 1.9009875765826434, 'bull_rsi_os': 43, 'bull_rsi_ob': 61, 'bull_adx_thresh': 9.801504102551801, 'bull_atr_min_pct': 0.0085569571083739, 'bull_atr_max_pct': 0.03221974512928022, 'bull_tp_mult': 2.2066425085039434, 'bull_tsl_mult': 0.4941111431803308, 'bull_time_stop': 264, 'bull_use_sma': False, 'bull_use_ema': False, 'bull_use_atr': True, 'bull_use_adx': False, 'bull_use_spike': False, 'bull_rsi_required': False, 'bear_strategy': 'breakout', 'bear_bb_std_mult': 1.6633124744427636, 'bear_rsi_os': 24, 'bear_rsi_ob': 57, 'bear_adx_thresh': 12.587385902732624, 'bear_atr_min_pct': 0.027663731019874988, 'bear_atr_max_pct': 0.10174608289560626, 'bear_tp_mult': 2.8116581542937915, 'bear_tsl_mult': 0.5989829862455727, 'bear_time_stop': 272, 'bear_use_sma': True, 'bear_use_ema': False, 'bear_use_atr': True, 'bear_use_adx': False, 'bear_use_spike': False, 'bear_rsi_required': False, 'sideways_strategy': 'mean_reversion', 'sideways_bb_std_mult': 1.9039088438655152, 'sideways_rsi_os': 27, 'sideways_rsi_ob': 63, 'sideways_adx_thresh': 34.05298450192029, 'sideways_atr_min_pct': 0.0008653478952830706, 'sideways_atr_max_pct': 0.07791867320544556, 'sideways_tp_mult': 1.4274999207235215, 'sideways_tsl_mult': 0.4097329460611435, 'sideways_time_stop': 240, 'sideways_use_sma': True, 'sideways_use_ema': True, 'sideways_use_atr': False, 'sideways_use_adx': False, 'sideways_use_spike': True, 'sideways_rsi_required': False}.
