[I 2025-09-01 10:19:08,408] Trial 459 finished with values: [-1000000000.0, 1000000000.0] and parameters: {'p_sma': 5, 'p_std': 45, 'p_atr': 29, 'p_adx': 10, 'rsi_period': 44, 'ema1': 8, 'ema2': 35, 'slip_atr_k': 0.2289720673200464, 'slip_spread_k': 0.6590361042906574, 'spread_hl_frac': 0.006359316100100152, 'bb_std_mult': 2.6283724882736132, 'rsi_os': 29, 'rsi_ob': 55, 'vol_spike': 0.20898215273865156, 'adx_thresh': 31.87710047909761, 'atr_min_pct': 0.02443881974937277, 'atr_max_pct': 0.06333402195150478, 'tp_mult': 1.6627501480145426, 'tsl_mult': 0.7622923894086397, 'strategy': 'breakout', 'time_stop': 9, 'use_sma': True, 'use_atr': False, 'use_adx': False, 'use_ema': False, 'use_spike': True, 'rsi_required': True, 'edge_k': 0.12034755049416135, 'edge_cap': 0.8383167202198707, 'bull_strategy': 'mean_reversion', 'bull_bb_std_mult': 1.479333057623053, 'bull_rsi_os': 52, 'bull_rsi_ob': 83, 'bull_adx_thresh': 30.196904464282756, 'bull_atr_min_pct': 0.004656792189493779, 'bull_atr_max_pct': 0.07280727769919214, 'bull_tp_mult': 1.6608671690613457, 'bull_tsl_mult': 0.8848446727902102, 'bull_time_stop': 141, 'bull_use_sma': True, 'bull_use_ema': False, 'bull_use_atr': False, 'bull_use_adx': False, 'bull_use_spike': False, 'bull_rsi_required': False, 'bear_strategy': 'breakout', 'bear_bb_std_mult': 0.5058223950052683, 'bear_rsi_os': 14, 'bear_rsi_ob': 70, 'bear_adx_thresh': 33.117745417202414, 'bear_atr_min_pct': 0.028299124267811337, 'bear_atr_max_pct': 0.1280820508679187, 'bear_tp_mult': 1.6629896252902352, 'bear_tsl_mult': 0.777100506915392, 'bear_time_stop': 176, 'bear_use_sma': False, 'bear_use_ema': False, 'bear_use_atr': False, 'bear_use_adx': True, 'bear_use_spike': True, 'bear_rsi_required': False, 'sideways_strategy': 'mean_reversion', 'sideways_bb_std_mult': 0.8147317679865833, 'sideways_rsi_os': 23, 'sideways_rsi_ob': 92, 'sideways_adx_thresh': 31.562086593241528, 'sideways_atr_min_pct': 0.02745008299250829, 'sideways_atr_max_pct': 0.08634280184216774, 'sideways_tp_mult': 1.170859468023935, 'sideways_tsl_mult': 0.9018550866291476, 'sideways_time_stop': 211, 'sideways_use_sma': True, 'sideways_use_ema': False, 'sideways_use_atr': True, 'sideways_use_adx': True, 'sideways_use_spike': False, 'sideways_rsi_required': True}.
[I 2025-09-01 10:19:08,744] Trial 460 finished with values: [-1000000000.0, 1000000000.0] and parameters: {'p_sma': 57, 'p_std': 34, 'p_atr': 29, 'p_adx': 10, 'rsi_period': 58, 'ema1': 13, 'ema2': 11, 'slip_atr_k': 0.02359348117634915, 'slip_spread_k': 0.3771481957229659, 'spread_hl_frac': 0.006299973428708383, 'bb_std_mult': 1.0699399132148288, 'rsi_os': 7, 'rsi_ob': 91, 'vol_spike': 0.16469312865414232, 'adx_thresh': 11.226789890352732, 'atr_min_pct': 0.026390838015014486, 'atr_max_pct': 0.11198943196207745, 'tp_mult': 2.935995094354584, 'tsl_mult': 0.845780305737358, 'strategy': 'breakout', 'time_stop': 129, 'use_sma': False, 'use_atr': False, 'use_adx': False, 'use_ema': False, 'use_spike': True, 'rsi_required': True, 'edge_k': 1.7576171825835356, 'edge_cap': 0.913149296155832, 'bull_strategy': 'mean_reversion', 'bull_bb_std_mult': 3.4532993655064197, 'bull_rsi_os': 35, 'bull_rsi_ob': 83, 'bull_adx_thresh': 6.699524364234152, 'bull_atr_min_pct': 0.006606110322252225, 'bull_atr_max_pct': 0.10321820595989706, 'bull_tp_mult': 1.3408093794348543, 'bull_tsl_mult': 0.5598573817415232, 'bull_time_stop': 140, 'bull_use_sma': True, 'bull_use_ema': False, 'bull_use_atr': False, 'bull_use_adx': False, 'bull_use_spike': True, 'bull_rsi_required': False, 'bear_strategy': 'breakout', 'bear_bb_std_mult': 0.5022444282175413, 'bear_rsi_os': 45, 'bear_rsi_ob': 86, 'bear_adx_thresh': 13.468974053113506, 'bear_atr_min_pct': 0.028855992191736263, 'bear_atr_max_pct': 0.013749439390928292, 'bear_tp_mult': 2.8709838682000894, 'bear_tsl_mult': 0.5267976164299261, 'bear_time_stop': 175, 'bear_use_sma': False, 'bear_use_ema': False, 'bear_use_atr': False, 'bear_use_adx': True, 'bear_use_spike': False, 'bear_rsi_required': False, 'sideways_strategy': 'mean_reversion', 'sideways_bb_std_mult': 2.628605009486793, 'sideways_rsi_os': 54, 'sideways_rsi_ob': 67, 'sideways_adx_thresh': 15.016859985915357, 'sideways_atr_min_pct': 0.01959976394260935, 'sideways_atr_max_pct': 0.0969468954060228, 'sideways_tp_mult': 1.2499599161417465, 'sideways_tsl_mult': 0.8347098603366283, 'sideways_time_stop': 63, 'sideways_use_sma': False, 'sideways_use_ema': False, 'sideways_use_atr': True, 'sideways_use_adx': True, 'sideways_use_spike': False, 'sideways_rsi_required': True}.
[I 2025-09-01 10:19:08,970] Trial 458 finished with values: [-0.020458954976083965, 0.020207932094095687] and parameters: {'p_sma': 54, 'p_std': 51, 'p_atr': 29, 'p_adx': 10, 'rsi_period': 58, 'ema1': 9, 'ema2': 35, 'slip_atr_k': 0.19878568043827563, 'slip_spread_k': 0.5408264890351304, 'spread_hl_frac': 0.012975911754830672, 'bb_std_mult': 0.7939345647666836, 'rsi_os': 49, 'rsi_ob': 55, 'vol_spike': 0.0766977898210649, 'adx_thresh': 32.32901060847265, 'atr_min_pct': 0.017521859730405293, 'atr_max_pct': 0.06289329258791461, 'tp_mult': 1.6614217124381003, 'tsl_mult': 0.04084678709910211, 'strategy': 'breakout', 'time_stop': 136, 'use_sma': True, 'use_atr': False, 'use_adx': False, 'use_ema': True, 'use_spike': True, 'rsi_required': True, 'edge_k': 1.991691616191031, 'edge_cap': 0.8366308545693613, 'bull_strategy': 'mean_reversion', 'bull_bb_std_mult': 1.3870210640331921, 'bull_rsi_os': 24, 'bull_rsi_ob': 68, 'bull_adx_thresh': 6.808658220901039, 'bull_atr_min_pct': 0.00648174859784274, 'bull_atr_max_pct': 0.07415449041977266, 'bull_tp_mult': 2.270688654989503, 'bull_tsl_mult': 0.8889045823978069, 'bull_time_stop': 138, 'bull_use_sma': True, 'bull_use_ema': False, 'bull_use_atr': False, 'bull_use_adx': False, 'bull_use_spike': False, 'bull_rsi_required': False, 'bear_strategy': 'breakout', 'bear_bb_std_mult': 1.3560604326658703, 'bear_rsi_os': 33, 'bear_rsi_ob': 70, 'bear_adx_thresh': 33.48303953329415, 'bear_atr_min_pct': 0.028868818840912542, 'bear_atr_max_pct': 0.023950077010741103, 'bear_tp_mult': 2.733510023567397, 'bear_tsl_mult': 0.5131951064251664, 'bear_time_stop': 177, 'bear_use_sma': False, 'bear_use_ema': True, 'bear_use_atr': False, 'bear_use_adx': True, 'bear_use_spike': True, 'bear_rsi_required': False, 'sideways_strategy': 'mean_reversion', 'sideways_bb_std_mult': 2.5140351085603125, 'sideways_rsi_os': 41, 'sideways_rsi_ob': 48, 'sideways_adx_thresh': 31.580382347573703, 'sideways_atr_min_pct': 0.0028604124689514685, 'sideways_atr_max_pct': 0.12390769024752213, 'sideways_tp_mult': 1.192995962787362, 'sideways_tsl_mult': 0.9490477339150505, 'sideways_time_stop': 211, 'sideways_use_sma': True, 'sideways_use_ema': False, 'sideways_use_atr': True, 'sideways_use_adx': False, 'sideways_use_spike': False, 'sideways_rsi_required': True}.
[I 2025-09-01 10:19:56,375] Trial 465 finished with values: [-1000000000.0, 1000000000.0] and parameters: {'p_sma': 60, 'p_std': 32, 'p_atr': 8, 'p_adx': 11, 'rsi_period': 42, 'ema1': 26, 'ema2': 10, 'slip_atr_k': 0.06513036959108456, 'slip_spread_k': 0.7760939593413289, 'spread_hl_frac': 0.046401118237515, 'bb_std_mult': 2.3100819784780993, 'rsi_os': 8, 'rsi_ob': 59, 'vol_spike': 0.192100869731199, 'adx_thresh': 12.798925424688981, 'atr_min_pct': 0.006136190912310015, 'atr_max_pct': 0.071925166637636, 'tp_mult': 2.19229161760915, 'tsl_mult': 0.13363080218963452, 'strategy': 'mean_reversion', 'time_stop': 153, 'use_sma': True, 'use_atr': True, 'use_adx': True, 'use_ema': False, 'use_spike': False, 'rsi_required': False, 'edge_k': 0.06271484066579502, 'edge_cap': 0.05641333299680806, 'bull_strategy': 'breakout', 'bull_bb_std_mult': 2.035704508928287, 'bull_rsi_os': 48, 'bull_rsi_ob': 74, 'bull_adx_thresh': 28.463889593895015, 'bull_atr_min_pct': 0.011226084565868917, 'bull_atr_max_pct': 0.1326244845224693, 'bull_tp_mult': 1.427831654422925, 'bull_tsl_mult': 0.9260749385072893, 'bull_time_stop': 130, 'bull_use_sma': False, 'bull_use_ema': True, 'bull_use_atr': True, 'bull_use_adx': False, 'bull_use_spike': True, 'bull_rsi_required': True, 'bear_strategy': 'breakout', 'bear_bb_std_mult': 2.567556531667525, 'bear_rsi_os': 5, 'bear_rsi_ob': 75, 'bear_adx_thresh': 34.092563380534685, 'bear_atr_min_pct': 0.010375519569679966, 'bear_atr_max_pct': 0.03824914465765138, 'bear_tp_mult': 2.0203595306662234, 'bear_tsl_mult': 0.8260167669624391, 'bear_time_stop': 263, 'bear_use_sma': True, 'bear_use_ema': True, 'bear_use_atr': True, 'bear_use_adx': False, 'bear_use_spike': True, 'bear_rsi_required': True, 'sideways_strategy': 'mean_reversion', 'sideways_bb_std_mult': 2.447317351530916, 'sideways_rsi_os': 29, 'sideways_rsi_ob': 54, 'sideways_adx_thresh': 34.54264166298105, 'sideways_atr_min_pct': 0.003638967922673355, 'sideways_atr_max_pct': 0.08257957800862717, 'sideways_tp_mult': 2.721764882892539, 'sideways_tsl_mult': 0.9686722766591072, 'sideways_time_stop': 228, 'sideways_use_sma': True, 'sideways_use_ema': True, 'sideways_use_atr': False, 'sideways_use_adx': False, 'sideways_use_spike': True, 'sideways_rsi_required': False}.
[I 2025-09-01 10:19:56,411] Trial 463 finished with values: [-1000000000.0, 1000000000.0] and parameters: {'p_sma': 56, 'p_std': 51, 'p_atr': 27, 'p_adx': 12, 'rsi_period': 78, 'ema1': 13, 'ema2': 10, 'slip_atr_k': 0.20371356481783193, 'slip_spread_k': 0.6020466542211663, 'spread_hl_frac': 0.015491528567348757, 'bb_std_mult': 0.8132732131354705, 'rsi_os': 17, 'rsi_ob': 59, 'vol_spike': 0.18139216100184982, 'adx_thresh': 11.301379775323285, 'atr_min_pct': 0.013057068694251358, 'atr_max_pct': 0.12060559257534031, 'tp_mult': 2.444271049193962, 'tsl_mult': 0.8473974651670562, 'strategy': 'breakout', 'time_stop': 155, 'use_sma': True, 'use_atr': True, 'use_adx': True, 'use_ema': False, 'use_spike': True, 'rsi_required': False, 'edge_k': 0.35324205580831736, 'edge_cap': 0.27898968207175606, 'bull_strategy': 'mean_reversion', 'bull_bb_std_mult': 3.469536929923512, 'bull_rsi_os': 16, 'bull_rsi_ob': 78, 'bull_adx_thresh': 28.335587320732223, 'bull_atr_min_pct': 0.023732233773776992, 'bull_atr_max_pct': 0.07774979963089397, 'bull_tp_mult': 1.3126182410914446, 'bull_tsl_mult': 0.6625361696013452, 'bull_time_stop': 128, 'bull_use_sma': True, 'bull_use_ema': False, 'bull_use_atr': True, 'bull_use_adx': False, 'bull_use_spike': True, 'bull_rsi_required': True, 'bear_strategy': 'breakout', 'bear_bb_std_mult': 2.181478444066323, 'bear_rsi_os': 43, 'bear_rsi_ob': 75, 'bear_adx_thresh': 33.91493254089415, 'bear_atr_min_pct': 0.028952620796680956, 'bear_atr_max_pct': 0.08968861806299777, 'bear_tp_mult': 2.8748382412898423, 'bear_tsl_mult': 0.8308931947516208, 'bear_time_stop': 15, 'bear_use_sma': False, 'bear_use_ema': True, 'bear_use_atr': True, 'bear_use_adx': False, 'bear_use_spike': True, 'bear_rsi_required': True, 'sideways_strategy': 'mean_reversion', 'sideways_bb_std_mult': 2.5085006110881793, 'sideways_rsi_os': 26, 'sideways_rsi_ob': 58, 'sideways_adx_thresh': 34.427565962806, 'sideways_atr_min_pct': 0.019466812780587477, 'sideways_atr_max_pct': 0.09655559818056976, 'sideways_tp_mult': 1.3765953506186344, 'sideways_tsl_mult': 0.8384193121360621, 'sideways_time_stop': 227, 'sideways_use_sma': True, 'sideways_use_ema': True, 'sideways_use_atr': False, 'sideways_use_adx': False, 'sideways_use_spike': True, 'sideways_rsi_required': False}.
[I 2025-09-01 10:19:57,005] Trial 462 finished with values: [-1000000000.0, 1000000000.0] and parameters: {'p_sma': 57, 'p_std': 51, 'p_atr': 8, 'p_adx': 7, 'rsi_period': 77, 'ema1': 13, 'ema2': 10, 'slip_atr_k': 0.06499739319830608, 'slip_spread_k': 0.8799082215747605, 'spread_hl_frac': 0.0075170265949144124, 'bb_std_mult': 0.7715858292569886, 'rsi_os': 8, 'rsi_ob': 91, 'vol_spike': 0.18208598621831243, 'adx_thresh': 11.380656729573722, 'atr_min_pct': 0.018680027959703017, 'atr_max_pct': 0.04505669057065629, 'tp_mult': 2.439217999134712, 'tsl_mult': 0.927725910552801, 'strategy': 'breakout', 'time_stop': 154, 'use_sma': True, 'use_atr': True, 'use_adx': True, 'use_ema': False, 'use_spike': True, 'rsi_required': False, 'edge_k': 0.39712315892890715, 'edge_cap': 0.9201737222976705, 'bull_strategy': 'mean_reversion', 'bull_bb_std_mult': 3.478231326117721, 'bull_rsi_os': 37, 'bull_rsi_ob': 78, 'bull_adx_thresh': 28.405491271839374, 'bull_atr_min_pct': 0.011270023476243451, 'bull_atr_max_pct': 0.06937655248132685, 'bull_tp_mult': 1.440049761763202, 'bull_tsl_mult': 0.9033904254150124, 'bull_time_stop': 208, 'bull_use_sma': True, 'bull_use_ema': False, 'bull_use_atr': True, 'bull_use_adx': False, 'bull_use_spike': True, 'bull_rsi_required': True, 'bear_strategy': 'breakout', 'bear_bb_std_mult': 3.13308991187765, 'bear_rsi_os': 49, 'bear_rsi_ob': 53, 'bear_adx_thresh': 7.627484126083612, 'bear_atr_min_pct': 0.02895461989581849, 'bear_atr_max_pct': 0.03749861308498677, 'bear_tp_mult': 2.7722916690682813, 'bear_tsl_mult': 0.20909393255737962, 'bear_time_stop': 264, 'bear_use_sma': False, 'bear_use_ema': True, 'bear_use_atr': True, 'bear_use_adx': False, 'bear_use_spike': True, 'bear_rsi_required': True, 'sideways_strategy': 'mean_reversion', 'sideways_bb_std_mult': 2.826512677136609, 'sideways_rsi_os': 43, 'sideways_rsi_ob': 74, 'sideways_adx_thresh': 15.219097169375683, 'sideways_atr_min_pct': 0.01380450898654927, 'sideways_atr_max_pct': 0.055216080261130326, 'sideways_tp_mult': 1.583648162190748, 'sideways_tsl_mult': 0.9987714082491811, 'sideways_time_stop': 226, 'sideways_use_sma': True, 'sideways_use_ema': True, 'sideways_use_atr': False, 'sideways_use_adx': False, 'sideways_use_spike': True, 'sideways_rsi_required': False}.
[I 2025-09-01 10:19:57,015] Trial 464 finished with values: [-1000000000.0, 1000000000.0] and parameters: {'p_sma': 60, 'p_std': 46, 'p_atr': 9, 'p_adx': 8, 'rsi_period': 78, 'ema1': 8, 'ema2': 10, 'slip_atr_k': 0.1977083395266766, 'slip_spread_k': 0.8827765594369236, 'spread_hl_frac': 0.008192138532094318, 'bb_std_mult': 2.773357463877519, 'rsi_os': 8, 'rsi_ob': 74, 'vol_spike': 0.18206845852891967, 'adx_thresh': 12.267094080180925, 'atr_min_pct': 0.008312511051297468, 'atr_max_pct': 0.07186414866758735, 'tp_mult': 2.4393803514084382, 'tsl_mult': 0.9325280474768797, 'strategy': 'mean_reversion', 'time_stop': 155, 'use_sma': True, 'use_atr': True, 'use_adx': True, 'use_ema': False, 'use_spike': False, 'rsi_required': False, 'edge_k': 0.6008992119279617, 'edge_cap': 0.8632950723675258, 'bull_strategy': 'breakout', 'bull_bb_std_mult': 2.9604411956360313, 'bull_rsi_os': 41, 'bull_rsi_ob': 78, 'bull_adx_thresh': 28.285848803866543, 'bull_atr_min_pct': 0.023856758581494754, 'bull_atr_max_pct': 0.09097699642133567, 'bull_tp_mult': 2.9972254996405567, 'bull_tsl_mult': 0.3690622504794693, 'bull_time_stop': 246, 'bull_use_sma': False, 'bull_use_ema': False, 'bull_use_atr': True, 'bull_use_adx': False, 'bull_use_spike': True, 'bull_rsi_required': True, 'bear_strategy': 'breakout', 'bear_bb_std_mult': 1.6226025051503332, 'bear_rsi_os': 43, 'bear_rsi_ob': 79, 'bear_adx_thresh': 33.73626747108374, 'bear_atr_min_pct': 0.011106226673429403, 'bear_atr_max_pct': 0.042272137746390964, 'bear_tp_mult': 2.0191379434878067, 'bear_tsl_mult': 0.8199796749465759, 'bear_time_stop': 107, 'bear_use_sma': False, 'bear_use_ema': True, 'bear_use_atr': True, 'bear_use_adx': False, 'bear_use_spike': True, 'bear_rsi_required': True, 'sideways_strategy': 'mean_reversion', 'sideways_bb_std_mult': 2.494625292083524, 'sideways_rsi_os': 26, 'sideways_rsi_ob': 90, 'sideways_adx_thresh': 31.761187183240196, 'sideways_atr_min_pct': 0.013824808943296798, 'sideways_atr_max_pct': 0.0946410915420959, 'sideways_tp_mult': 1.3645923175341643, 'sideways_tsl_mult': 0.9976082853882123, 'sideways_time_stop': 227, 'sideways_use_sma': True, 'sideways_use_ema': True, 'sideways_use_atr': False, 'sideways_use_adx': False, 'sideways_use_spike': True, 'sideways_rsi_required': False}.
[I 2025-09-01 10:20:38,029] Trial 469 finished with values: [-1000000000.0, 1000000000.0] and parameters: {'p_sma': 58, 'p_std': 7, 'p_atr': 28, 'p_adx': 22, 'rsi_period': 46, 'ema1': 7, 'ema2': 30, 'slip_atr_k': 0.0001301737350549708, 'slip_spread_k': 0.9486448719897735, 'spread_hl_frac': 0.011042716676812605, 'bb_std_mult': 2.9348090376001545, 'rsi_os': 9, 'rsi_ob': 56, 'vol_spike': 0.033414493423829156, 'adx_thresh': 15.602961238018452, 'atr_min_pct': 0.011367624010932602, 'atr_max_pct': 0.06782221535285603, 'tp_mult': 2.5512402432739805, 'tsl_mult': 0.8026799747427814, 'strategy': 'breakout', 'time_stop': 140, 'use_sma': False, 'use_atr': True, 'use_adx': False, 'use_ema': False, 'use_spike': True, 'rsi_required': False, 'edge_k': 0.6314387598573679, 'edge_cap': 0.8039375579690832, 'bull_strategy': 'mean_reversion', 'bull_bb_std_mult': 3.597620046721745, 'bull_rsi_os': 5, 'bull_rsi_ob': 55, 'bull_adx_thresh': 31.555501178329187, 'bull_atr_min_pct': 0.0035767141535791376, 'bull_atr_max_pct': 0.08170346232158344, 'bull_tp_mult': 1.1822419540660376, 'bull_tsl_mult': 0.41618505823147955, 'bull_time_stop': 145, 'bull_use_sma': True, 'bull_use_ema': True, 'bull_use_atr': True, 'bull_use_adx': True, 'bull_use_spike': True, 'bull_rsi_required': False, 'bear_strategy': 'mean_reversion', 'bear_bb_std_mult': 0.9680484003171015, 'bear_rsi_os': 45, 'bear_rsi_ob': 71, 'bear_adx_thresh': 5.39187633747655, 'bear_atr_min_pct': 0.028002876304146135, 'bear_atr_max_pct': 0.1262589785653061, 'bear_tp_mult': 1.3056147771804398, 'bear_tsl_mult': 0.01849078474935245, 'bear_time_stop': 196, 'bear_use_sma': True, 'bear_use_ema': True, 'bear_use_atr': True, 'bear_use_adx': True, 'bear_use_spike': False, 'bear_rsi_required': False, 'sideways_strategy': 'breakout', 'sideways_bb_std_mult': 2.375792528807157, 'sideways_rsi_os': 22, 'sideways_rsi_ob': 60, 'sideways_adx_thresh': 11.475663352844222, 'sideways_atr_min_pct': 0.0185897343980387, 'sideways_atr_max_pct': 0.13709483311394627, 'sideways_tp_mult': 2.8436798501410694, 'sideways_tsl_mult': 0.9322958775582797, 'sideways_time_stop': 53, 'sideways_use_sma': False, 'sideways_use_ema': False, 'sideways_use_atr': False, 'sideways_use_adx': False, 'sideways_use_spike': True, 'sideways_rsi_required': False}.
[I 2025-09-01 10:20:38,558] Trial 468 finished with values: [-0.04368628170315236, 0.04390804222858838] and parameters: {'p_sma': 58, 'p_std': 38, 'p_atr': 25, 'p_adx': 11, 'rsi_period': 46, 'ema1': 7, 'ema2': 13, 'slip_atr_k': 0.002863985334580427, 'slip_spread_k': 0.9161249112039366, 'spread_hl_frac': 0.02991014197693944, 'bb_std_mult': 2.547505000255029, 'rsi_os': 9, 'rsi_ob': 84, 'vol_spike': 0.13949716832832879, 'adx_thresh': 15.701491211617443, 'atr_min_pct': 0.02053807753812674, 'atr_max_pct': 0.06748368150711165, 'tp_mult': 2.709482126861575, 'tsl_mult': 0.8046948785385472, 'strategy': 'breakout', 'time_stop': 141, 'use_sma': False, 'use_atr': True, 'use_adx': False, 'use_ema': False, 'use_spike': True, 'rsi_required': False, 'edge_k': 0.6402476438720364, 'edge_cap': 0.9616989716169506, 'bull_strategy': 'mean_reversion', 'bull_bb_std_mult': 2.2455191199508096, 'bull_rsi_os': 38, 'bull_rsi_ob': 76, 'bull_adx_thresh': 27.518755137845325, 'bull_atr_min_pct': 0.0037847782144847294, 'bull_atr_max_pct': 0.12109544594636618, 'bull_tp_mult': 1.6115931952782658, 'bull_tsl_mult': 0.4161424104235347, 'bull_time_stop': 146, 'bull_use_sma': True, 'bull_use_ema': True, 'bull_use_atr': True, 'bull_use_adx': True, 'bull_use_spike': True, 'bull_rsi_required': False, 'bear_strategy': 'mean_reversion', 'bear_bb_std_mult': 3.2273641729000637, 'bear_rsi_os': 45, 'bear_rsi_ob': 71, 'bear_adx_thresh': 34.62148942348587, 'bear_atr_min_pct': 0.028100347151591345, 'bear_atr_max_pct': 0.12639449188385973, 'bear_tp_mult': 2.9495870842704366, 'bear_tsl_mult': 0.7578130682445824, 'bear_time_stop': 131, 'bear_use_sma': True, 'bear_use_ema': True, 'bear_use_atr': True, 'bear_use_adx': True, 'bear_use_spike': False, 'bear_rsi_required': False, 'sideways_strategy': 'breakout', 'sideways_bb_std_mult': 3.2347171476273604, 'sideways_rsi_os': 31, 'sideways_rsi_ob': 51, 'sideways_adx_thresh': 23.391875758088357, 'sideways_atr_min_pct': 0.0019623734978369885, 'sideways_atr_max_pct': 0.13707322535684136, 'sideways_tp_mult': 2.998440133206807, 'sideways_tsl_mult': 0.9363167220517334, 'sideways_time_stop': 53, 'sideways_use_sma': False, 'sideways_use_ema': False, 'sideways_use_atr': False, 'sideways_use_adx': False, 'sideways_use_spike': True, 'sideways_rsi_required': False}.
