[I 2025-09-01 10:34:33,205] Trial 547 finished with values: [-1000000000.0, 1000000000.0] and parameters: {'p_sma': 45, 'p_std': 40, 'p_atr': 30, 'p_adx': 12, 'rsi_period': 48, 'ema1': 7, 'ema2': 12, 'slip_atr_k': 0.10667586884339059, 'slip_spread_k': 0.4236705629366404, 'spread_hl_frac': 0.03812214747664701, 'bb_std_mult': 3.597609312223179, 'rsi_os': 11, 'rsi_ob': 57, 'vol_spike': 0.19460398340556356, 'adx_thresh': 26.01889778424026, 'atr_min_pct': 0.018630532311242023, 'atr_max_pct': 0.1192715445317257, 'tp_mult': 2.427771700108777, 'tsl_mult': 0.5586053394668555, 'strategy': 'breakout', 'time_stop': 141, 'use_sma': True, 'use_atr': True, 'use_adx': False, 'use_ema': False, 'use_spike': True, 'rsi_required': False, 'edge_k': 0.6817305014788696, 'edge_cap': 0.8413270342218192, 'bull_strategy': 'mean_reversion', 'bull_bb_std_mult': 3.416189489735575, 'bull_rsi_os': 33, 'bull_rsi_ob': 80, 'bull_adx_thresh': 15.003083316006776, 'bull_atr_min_pct': 0.008074764099750125, 'bull_atr_max_pct': 0.03262231780222619, 'bull_tp_mult': 1.746050709472622, 'bull_tsl_mult': 0.47352276463496235, 'bull_time_stop': 149, 'bull_use_sma': True, 'bull_use_ema': False, 'bull_use_atr': True, 'bull_use_adx': False, 'bull_use_spike': False, 'bull_rsi_required': False, 'bear_strategy': 'mean_reversion', 'bear_bb_std_mult': 2.9211102424934383, 'bear_rsi_os': 44, 'bear_rsi_ob': 61, 'bear_adx_thresh': 34.43697228342544, 'bear_atr_min_pct': 0.023410293640143943, 'bear_atr_max_pct': 0.12117552724747872, 'bear_tp_mult': 2.955080297335367, 'bear_tsl_mult': 0.44400376009768894, 'bear_time_stop': 11, 'bear_use_sma': False, 'bear_use_ema': True, 'bear_use_atr': True, 'bear_use_adx': True, 'bear_use_spike': True, 'bear_rsi_required': False, 'sideways_strategy': 'mean_reversion', 'sideways_bb_std_mult': 2.5400871179175324, 'sideways_rsi_os': 26, 'sideways_rsi_ob': 74, 'sideways_adx_thresh': 15.669292056902883, 'sideways_atr_min_pct': 0.004981477909247096, 'sideways_atr_max_pct': 0.09074593393253744, 'sideways_tp_mult': 1.646705536197695, 'sideways_tsl_mult': 0.6905782627665098, 'sideways_time_stop': 268, 'sideways_use_sma': True, 'sideways_use_ema': False, 'sideways_use_atr': False, 'sideways_use_adx': True, 'sideways_use_spike': True, 'sideways_rsi_required': False}.
[I 2025-09-01 10:35:17,536] Trial 551 finished with values: [-0.012200870370119299, 0.01231402477687071] and parameters: {'p_sma': 60, 'p_std': 47, 'p_atr': 30, 'p_adx': 12, 'rsi_period': 46, 'ema1': 7, 'ema2': 10, 'slip_atr_k': 0.1818540045162038, 'slip_spread_k': 0.3394299984449785, 'spread_hl_frac': 0.04437407875809103, 'bb_std_mult': 2.5678156525384983, 'rsi_os': 27, 'rsi_ob': 58, 'vol_spike': 0.17325465935846257, 'adx_thresh': 23.272066350591817, 'atr_min_pct': 0.018642057464257733, 'atr_max_pct': 0.032625712239780044, 'tp_mult': 2.430125314902034, 'tsl_mult': 0.7498684066392988, 'strategy': 'breakout', 'time_stop': 145, 'use_sma': True, 'use_atr': True, 'use_adx': False, 'use_ema': False, 'use_spike': True, 'rsi_required': False, 'edge_k': 1.4025525943432577, 'edge_cap': 0.8617343591762534, 'bull_strategy': 'mean_reversion', 'bull_bb_std_mult': 3.5403582243192577, 'bull_rsi_os': 36, 'bull_rsi_ob': 93, 'bull_adx_thresh': 14.96393437654422, 'bull_atr_min_pct': 0.004088420490816837, 'bull_atr_max_pct': 0.09070732400820702, 'bull_tp_mult': 1.4751817927594915, 'bull_tsl_mult': 0.9417510614730481, 'bull_time_stop': 148, 'bull_use_sma': True, 'bull_use_ema': False, 'bull_use_atr': True, 'bull_use_adx': False, 'bull_use_spike': True, 'bull_rsi_required': False, 'bear_strategy': 'breakout', 'bear_bb_std_mult': 1.6784568300869505, 'bear_rsi_os': 48, 'bear_rsi_ob': 73, 'bear_adx_thresh': 32.178221175458695, 'bear_atr_min_pct': 0.029387669750212498, 'bear_atr_max_pct': 0.13134461201393693, 'bear_tp_mult': 2.871977136965947, 'bear_tsl_mult': 0.9694530013895755, 'bear_time_stop': 12, 'bear_use_sma': False, 'bear_use_ema': True, 'bear_use_atr': True, 'bear_use_adx': True, 'bear_use_spike': True, 'bear_rsi_required': False, 'sideways_strategy': 'mean_reversion', 'sideways_bb_std_mult': 2.524339116129471, 'sideways_rsi_os': 30, 'sideways_rsi_ob': 88, 'sideways_adx_thresh': 29.581157496511025, 'sideways_atr_min_pct': 0.0015643668146373489, 'sideways_atr_max_pct': 0.07487010833312764, 'sideways_tp_mult': 1.1504450371082524, 'sideways_tsl_mult': 0.896843344232196, 'sideways_time_stop': 268, 'sideways_use_sma': True, 'sideways_use_ema': False, 'sideways_use_atr': False, 'sideways_use_adx': True, 'sideways_use_spike': True, 'sideways_rsi_required': False}.
[I 2025-09-01 10:35:18,258] Trial 552 finished with values: [-0.008135991223514605, 0.008550583243368806] and parameters: {'p_sma': 60, 'p_std': 7, 'p_atr': 30, 'p_adx': 12, 'rsi_period': 46, 'ema1': 9, 'ema2': 19, 'slip_atr_k': 0.09817139504286361, 'slip_spread_k': 0.5712645950226385, 'spread_hl_frac': 0.0017934157654597473, 'bb_std_mult': 2.9720502894482634, 'rsi_os': 6, 'rsi_ob': 60, 'vol_spike': 0.06529377910164544, 'adx_thresh': 26.036556848171376, 'atr_min_pct': 0.018790343099925198, 'atr_max_pct': 0.07631522871382201, 'tp_mult': 2.5332913215662316, 'tsl_mult': 0.918995736190914, 'strategy': 'breakout', 'time_stop': 146, 'use_sma': False, 'use_atr': True, 'use_adx': False, 'use_ema': False, 'use_spike': True, 'rsi_required': False, 'edge_k': 0.07808211222732397, 'edge_cap': 0.8651822531553091, 'bull_strategy': 'breakout', 'bull_bb_std_mult': 3.538519295187497, 'bull_rsi_os': 36, 'bull_rsi_ob': 79, 'bull_adx_thresh': 9.950474761853238, 'bull_atr_min_pct': 0.004112304643207997, 'bull_atr_max_pct': 0.10191977476879849, 'bull_tp_mult': 1.4792565649582865, 'bull_tsl_mult': 0.1855407930571109, 'bull_time_stop': 39, 'bull_use_sma': True, 'bull_use_ema': True, 'bull_use_atr': True, 'bull_use_adx': False, 'bull_use_spike': True, 'bull_rsi_required': False, 'bear_strategy': 'breakout', 'bear_bb_std_mult': 1.6721746510219384, 'bear_rsi_os': 41, 'bear_rsi_ob': 73, 'bear_adx_thresh': 32.10651803129464, 'bear_atr_min_pct': 0.023576401735567118, 'bear_atr_max_pct': 0.1210402603977405, 'bear_tp_mult': 2.8756290723058937, 'bear_tsl_mult': 0.12740873894391813, 'bear_time_stop': 13, 'bear_use_sma': False, 'bear_use_ema': True, 'bear_use_atr': True, 'bear_use_adx': False, 'bear_use_spike': False, 'bear_rsi_required': False, 'sideways_strategy': 'mean_reversion', 'sideways_bb_std_mult': 2.5580418742033104, 'sideways_rsi_os': 35, 'sideways_rsi_ob': 59, 'sideways_adx_thresh': 31.640502976081734, 'sideways_atr_min_pct': 0.017603598363432144, 'sideways_atr_max_pct': 0.08437510032954985, 'sideways_tp_mult': 1.154110095647476, 'sideways_tsl_mult': 0.8971084346503999, 'sideways_time_stop': 234, 'sideways_use_sma': False, 'sideways_use_ema': True, 'sideways_use_atr': False, 'sideways_use_adx': False, 'sideways_use_spike': True, 'sideways_rsi_required': False}.
[I 2025-09-01 10:35:18,546] Trial 550 finished with values: [-1000000000.0, 1000000000.0] and parameters: {'p_sma': 14, 'p_std': 7, 'p_atr': 27, 'p_adx': 12, 'rsi_period': 47, 'ema1': 7, 'ema2': 10, 'slip_atr_k': 0.10603016520441164, 'slip_spread_k': 0.4675865193236063, 'spread_hl_frac': 0.007308508885547876, 'bb_std_mult': 2.9717660826160204, 'rsi_os': 29, 'rsi_ob': 60, 'vol_spike': 0.0384417980454789, 'adx_thresh': 7.805675669545977, 'atr_min_pct': 0.018826856797967893, 'atr_max_pct': 0.14740523535430416, 'tp_mult': 2.4400349559199466, 'tsl_mult': 0.7533948295979933, 'strategy': 'breakout', 'time_stop': 141, 'use_sma': True, 'use_atr': True, 'use_adx': False, 'use_ema': False, 'use_spike': True, 'rsi_required': False, 'edge_k': 1.4000861023172937, 'edge_cap': 0.8663202519055409, 'bull_strategy': 'mean_reversion', 'bull_bb_std_mult': 3.369454267491114, 'bull_rsi_os': 39, 'bull_rsi_ob': 79, 'bull_adx_thresh': 9.704783346695333, 'bull_atr_min_pct': 0.004313163029183612, 'bull_atr_max_pct': 0.02750169239074226, 'bull_tp_mult': 1.4995988822518023, 'bull_tsl_mult': 0.03338413549622038, 'bull_time_stop': 249, 'bull_use_sma': True, 'bull_use_ema': False, 'bull_use_atr': True, 'bull_use_adx': False, 'bull_use_spike': False, 'bull_rsi_required': False, 'bear_strategy': 'mean_reversion', 'bear_bb_std_mult': 1.4128065818005993, 'bear_rsi_os': 48, 'bear_rsi_ob': 73, 'bear_adx_thresh': 22.268218605400065, 'bear_atr_min_pct': 0.023430693749936865, 'bear_atr_max_pct': 0.11621950825782512, 'bear_tp_mult': 2.9440611611351803, 'bear_tsl_mult': 0.43950367409903374, 'bear_time_stop': 120, 'bear_use_sma': False, 'bear_use_ema': True, 'bear_use_atr': True, 'bear_use_adx': True, 'bear_use_spike': True, 'bear_rsi_required': False, 'sideways_strategy': 'mean_reversion', 'sideways_bb_std_mult': 2.5558685758977524, 'sideways_rsi_os': 16, 'sideways_rsi_ob': 87, 'sideways_adx_thresh': 32.47451201260493, 'sideways_atr_min_pct': 0.0015956859775244849, 'sideways_atr_max_pct': 0.09170122739136893, 'sideways_tp_mult': 1.3432153760896508, 'sideways_tsl_mult': 0.921723634686919, 'sideways_time_stop': 234, 'sideways_use_sma': True, 'sideways_use_ema': False, 'sideways_use_atr': False, 'sideways_use_adx': True, 'sideways_use_spike': True, 'sideways_rsi_required': False}.
[I 2025-09-01 10:35:19,144] Trial 553 finished with values: [-0.005785950532523398, 0.005700983526855659] and parameters: {'p_sma': 23, 'p_std': 47, 'p_atr': 28, 'p_adx': 12, 'rsi_period': 56, 'ema1': 9, 'ema2': 48, 'slip_atr_k': 0.005144243570397483, 'slip_spread_k': 0.4689829842281043, 'spread_hl_frac': 0.008542391846420295, 'bb_std_mult': 2.594804514752576, 'rsi_os': 5, 'rsi_ob': 89, 'vol_spike': 0.17296589693074285, 'adx_thresh': 7.891563153635902, 'atr_min_pct': 0.018864155653941502, 'atr_max_pct': 0.1398349731419646, 'tp_mult': 1.7605392857978215, 'tsl_mult': 0.8527998315974052, 'strategy': 'breakout', 'time_stop': 285, 'use_sma': False, 'use_atr': True, 'use_adx': False, 'use_ema': False, 'use_spike': True, 'rsi_required': False, 'edge_k': 1.4457881548176759, 'edge_cap': 0.34518312186302413, 'bull_strategy': 'breakout', 'bull_bb_std_mult': 3.5291357615680363, 'bull_rsi_os': 36, 'bull_rsi_ob': 59, 'bull_adx_thresh': 30.133884707380545, 'bull_atr_min_pct': 0.004478281870082487, 'bull_atr_max_pct': 0.12327871644864405, 'bull_tp_mult': 1.4999781558117635, 'bull_tsl_mult': 0.9324939755763795, 'bull_time_stop': 137, 'bull_use_sma': True, 'bull_use_ema': True, 'bull_use_atr': True, 'bull_use_adx': False, 'bull_use_spike': True, 'bull_rsi_required': False, 'bear_strategy': 'breakout', 'bear_bb_std_mult': 1.552380746898986, 'bear_rsi_os': 5, 'bear_rsi_ob': 73, 'bear_adx_thresh': 13.736945023661702, 'bear_atr_min_pct': 6.548428082526342e-06, 'bear_atr_max_pct': 0.06460941849862968, 'bear_tp_mult': 2.8763397090229628, 'bear_tsl_mult': 0.12085465784382976, 'bear_time_stop': 118, 'bear_use_sma': False, 'bear_use_ema': True, 'bear_use_atr': True, 'bear_use_adx': False, 'bear_use_spike': False, 'bear_rsi_required': False, 'sideways_strategy': 'mean_reversion', 'sideways_bb_std_mult': 2.7151301549574933, 'sideways_rsi_os': 54, 'sideways_rsi_ob': 59, 'sideways_adx_thresh': 31.63353532494723, 'sideways_atr_min_pct': 0.001319704235586346, 'sideways_atr_max_pct': 0.08405727187776638, 'sideways_tp_mult': 1.4605197673308592, 'sideways_tsl_mult': 0.40860208949778204, 'sideways_time_stop': 234, 'sideways_use_sma': False, 'sideways_use_ema': True, 'sideways_use_atr': False, 'sideways_use_adx': False, 'sideways_use_spike': True, 'sideways_rsi_required': False}.
[I 2025-09-01 10:35:20,299] Trial 556 finished with values: [-1000000000.0, 1000000000.0] and parameters: {'p_sma': 51, 'p_std': 44, 'p_atr': 28, 'p_adx': 11, 'rsi_period': 70, 'ema1': 12, 'ema2': 16, 'slip_atr_k': 0.00451747525166475, 'slip_spread_k': 0.032905878028573254, 'spread_hl_frac': 0.008312228296863806, 'bb_std_mult': 2.6686885984650868, 'rsi_os': 5, 'rsi_ob': 94, 'vol_spike': 0.18587518964183647, 'adx_thresh': 12.294552537024355, 'atr_min_pct': 0.02134833610893327, 'atr_max_pct': 0.017245896963468177, 'tp_mult': 2.376378433190915, 'tsl_mult': 0.8563550242581716, 'strategy': 'breakout', 'time_stop': 152, 'use_sma': False, 'use_atr': False, 'use_adx': False, 'use_ema': True, 'use_spike': True, 'rsi_required': True, 'edge_k': 1.451053704378219, 'edge_cap': 0.8933804267166359, 'bull_strategy': 'breakout', 'bull_bb_std_mult': 1.5661936003030164, 'bull_rsi_os': 9, 'bull_rsi_ob': 78, 'bull_adx_thresh': 30.29687013376974, 'bull_atr_min_pct': 0.013346553965147301, 'bull_atr_max_pct': 0.12328820653597601, 'bull_tp_mult': 1.3836010985901808, 'bull_tsl_mult': 0.9336468327307195, 'bull_time_stop': 111, 'bull_use_sma': True, 'bull_use_ema': True, 'bull_use_atr': False, 'bull_use_adx': False, 'bull_use_spike': True, 'bull_rsi_required': True, 'bear_strategy': 'breakout', 'bear_bb_std_mult': 1.5611847529111018, 'bear_rsi_os': 19, 'bear_rsi_ob': 65, 'bear_adx_thresh': 8.906871959171895, 'bear_atr_min_pct': 0.028933227858263112, 'bear_atr_max_pct': 0.06681395387756923, 'bear_tp_mult': 2.761613928977267, 'bear_tsl_mult': 0.77091152833534, 'bear_time_stop': 18, 'bear_use_sma': False, 'bear_use_ema': True, 'bear_use_atr': False, 'bear_use_adx': False, 'bear_use_spike': False, 'bear_rsi_required': False, 'sideways_strategy': 'mean_reversion', 'sideways_bb_std_mult': 2.732478817329381, 'sideways_rsi_os': 30, 'sideways_rsi_ob': 61, 'sideways_adx_thresh': 31.090545553566766, 'sideways_atr_min_pct': 0.00661139487796183, 'sideways_atr_max_pct': 0.08747541723774475, 'sideways_tp_mult': 1.4586296395525276, 'sideways_tsl_mult': 0.49178675730461086, 'sideways_time_stop': 213, 'sideways_use_sma': False, 'sideways_use_ema': True, 'sideways_use_atr': True, 'sideways_use_adx': False, 'sideways_use_spike': True, 'sideways_rsi_required': True}.
[I 2025-09-01 10:35:59,557] Trial 555 finished with values: [-1000000000.0, 1000000000.0] and parameters: {'p_sma': 17, 'p_std': 26, 'p_atr': 10, 'p_adx': 11, 'rsi_period': 42, 'ema1': 9, 'ema2': 10, 'slip_atr_k': 0.010764938908059355, 'slip_spread_k': 0.6227766571294431, 'spread_hl_frac': 0.008255784831953345, 'bb_std_mult': 2.67170869480051, 'rsi_os': 44, 'rsi_ob': 93, 'vol_spike': 0.03796278583489143, 'adx_thresh': 12.202629626981098, 'atr_min_pct': 0.020098308005581433, 'atr_max_pct': 0.14724827762358955, 'tp_mult': 1.7655638089180374, 'tsl_mult': 0.3731034761145062, 'strategy': 'breakout', 'time_stop': 182, 'use_sma': True, 'use_atr': False, 'use_adx': False, 'use_ema': True, 'use_spike': True, 'rsi_required': True, 'edge_k': 0.33489746822952693, 'edge_cap': 0.798784925562761, 'bull_strategy': 'mean_reversion', 'bull_bb_std_mult': 2.1958307830362425, 'bull_rsi_os': 41, 'bull_rsi_ob': 77, 'bull_adx_thresh': 21.013389612804396, 'bull_atr_min_pct': 0.004997414819059461, 'bull_atr_max_pct': 0.062206254238751105, 'bull_tp_mult': 1.513996352863853, 'bull_tsl_mult': 0.26690812063713354, 'bull_time_stop': 242, 'bull_use_sma': True, 'bull_use_ema': False, 'bull_use_atr': False, 'bull_use_adx': False, 'bull_use_spike': True, 'bull_rsi_required': False, 'bear_strategy': 'breakout', 'bear_bb_std_mult': 2.4271734488467063, 'bear_rsi_os': 15, 'bear_rsi_ob': 54, 'bear_adx_thresh': 13.546194132647765, 'bear_atr_min_pct': 0.027950187883441183, 'bear_atr_max_pct': 0.06443100455300245, 'bear_tp_mult': 2.9041965934768035, 'bear_tsl_mult': 0.4880838416428102, 'bear_time_stop': 119, 'bear_use_sma': False, 'bear_use_ema': True, 'bear_use_atr': False, 'bear_use_adx': True, 'bear_use_spike': True, 'bear_rsi_required': False, 'sideways_strategy': 'mean_reversion', 'sideways_bb_std_mult': 2.7339879762357624, 'sideways_rsi_os': 30, 'sideways_rsi_ob': 76, 'sideways_adx_thresh': 31.111912149803498, 'sideways_atr_min_pct': 0.028039819028639803, 'sideways_atr_max_pct': 0.08243447140156095, 'sideways_tp_mult': 1.3456411041424479, 'sideways_tsl_mult': 0.9241131613507939, 'sideways_time_stop': 213, 'sideways_use_sma': True, 'sideways_use_ema': False, 'sideways_use_atr': True, 'sideways_use_adx': False, 'sideways_use_spike': True, 'sideways_rsi_required': True}.
[I 2025-09-01 10:35:59,554] Trial 558 finished with values: [-1000000000.0, 1000000000.0] and parameters: {'p_sma': 12, 'p_std': 37, 'p_atr': 28, 'p_adx': 17, 'rsi_period': 42, 'ema1': 26, 'ema2': 24, 'slip_atr_k': 0.23225904409916281, 'slip_spread_k': 0.395647820197943, 'spread_hl_frac': 0.004931907882619688, 'bb_std_mult': 0.5026604073867202, 'rsi_os': 41, 'rsi_ob': 73, 'vol_spike': 0.2098339314450448, 'adx_thresh': 27.77438950231172, 'atr_min_pct': 0.01085816341002814, 'atr_max_pct': 0.06622201214165484, 'tp_mult': 2.4866527602323756, 'tsl_mult': 0.013251712306031449, 'strategy': 'breakout', 'time_stop': 153, 'use_sma': True, 'use_atr': True, 'use_adx': True, 'use_ema': False, 'use_spike': True, 'rsi_required': False, 'edge_k': 1.9776803793673126, 'edge_cap': 0.5180196136143216, 'bull_strategy': 'mean_reversion', 'bull_bb_std_mult': 3.259367823577054, 'bull_rsi_os': 38, 'bull_rsi_ob': 65, 'bull_adx_thresh': 20.639918174781407, 'bull_atr_min_pct': 0.0050591656020892205, 'bull_atr_max_pct': 0.07179892177812554, 'bull_tp_mult': 1.5449201563976755, 'bull_tsl_mult': 0.5471113630671782, 'bull_time_stop': 167, 'bull_use_sma': False, 'bull_use_ema': False, 'bull_use_atr': True, 'bull_use_adx': False, 'bull_use_spike': True, 'bull_rsi_required': False, 'bear_strategy': 'breakout', 'bear_bb_std_mult': 1.892380171196693, 'bear_rsi_os': 23, 'bear_rsi_ob': 71, 'bear_adx_thresh': 27.44918507467576, 'bear_atr_min_pct': 0.01588593042149072, 'bear_atr_max_pct': 0.10917176320972335, 'bear_tp_mult': 2.90177512595782, 'bear_tsl_mult': 0.6420316596073664, 'bear_time_stop': 181, 'bear_use_sma': False, 'bear_use_ema': False, 'bear_use_atr': True, 'bear_use_adx': True, 'bear_use_spike': True, 'bear_rsi_required': True, 'sideways_strategy': 'mean_reversion', 'sideways_bb_std_mult': 0.9206737028533727, 'sideways_rsi_os': 12, 'sideways_rsi_ob': 68, 'sideways_adx_thresh': 33.33687030062986, 'sideways_atr_min_pct': 0.0025646296280704846, 'sideways_atr_max_pct': 0.08109455179227791, 'sideways_tp_mult': 1.301351749420554, 'sideways_tsl_mult': 0.9973155058899789, 'sideways_time_stop': 297, 'sideways_use_sma': True, 'sideways_use_ema': False, 'sideways_use_atr': False, 'sideways_use_adx': False, 'sideways_use_spike': True, 'sideways_rsi_required': False}.
[I 2025-09-01 10:36:00,551] Trial 557 finished with values: [-1000000000.0, 1000000000.0] and parameters: {'p_sma': 59, 'p_std': 44, 'p_atr': 28, 'p_adx': 11, 'rsi_period': 68, 'ema1': 29, 'ema2': 15, 'slip_atr_k': 0.017236941915477578, 'slip_spread_k': 0.02548879404338894, 'spread_hl_frac': 0.004363713586172358, 'bb_std_mult': 2.7836301015244675, 'rsi_os': 7, 'rsi_ob': 62, 'vol_spike': 0.1858371246399628, 'adx_thresh': 27.91162322108306, 'atr_min_pct': 0.024041932305512777, 'atr_max_pct': 0.06626963062424099, 'tp_mult': 2.4915971894853293, 'tsl_mult': 0.052332345047008455, 'strategy': 'breakout', 'time_stop': 182, 'use_sma': True, 'use_atr': False, 'use_adx': False, 'use_ema': True, 'use_spike': True, 'rsi_required': True, 'edge_k': 1.9861849562936387, 'edge_cap': 0.8090910812865344, 'bull_strategy': 'mean_reversion', 'bull_bb_std_mult': 3.47637277739829, 'bull_rsi_os': 9, 'bull_rsi_ob': 84, 'bull_adx_thresh': 16.716264954165975, 'bull_atr_min_pct': 0.011666846057054571, 'bull_atr_max_pct': 0.10890415394674306, 'bull_tp_mult': 1.6082838103289991, 'bull_tsl_mult': 0.7822385193133838, 'bull_time_stop': 113, 'bull_use_sma': True, 'bull_use_ema': False, 'bull_use_atr': False, 'bull_use_adx': False, 'bull_use_spike': True, 'bull_rsi_required': True, 'bear_strategy': 'breakout', 'bear_bb_std_mult': 1.488974396010305, 'bear_rsi_os': 44, 'bear_rsi_ob': 70, 'bear_adx_thresh': 33.390200822608335, 'bear_atr_min_pct': 0.027879567403305095, 'bear_atr_max_pct': 0.1246495030825401, 'bear_tp_mult': 2.7677923810650444, 'bear_tsl_mult': 0.7767985774164256, 'bear_time_stop': 19, 'bear_use_sma': False, 'bear_use_ema': True, 'bear_use_atr': False, 'bear_use_adx': True, 'bear_use_spike': True, 'bear_rsi_required': False, 'sideways_strategy': 'mean_reversion', 'sideways_bb_std_mult': 2.6418533501011683, 'sideways_rsi_os': 9, 'sideways_rsi_ob': 57, 'sideways_adx_thresh': 33.321490956191276, 'sideways_atr_min_pct': 0.012667313836125408, 'sideways_atr_max_pct': 0.08695879388631644, 'sideways_tp_mult': 1.312514889732539, 'sideways_tsl_mult': 0.9864919582237004, 'sideways_time_stop': 122, 'sideways_use_sma': True, 'sideways_use_ema': False, 'sideways_use_atr': True, 'sideways_use_adx': False, 'sideways_use_spike': True, 'sideways_rsi_required': True}.
