[I 2025-09-01 09:21:29,743] Trial 117 finished with values: [-0.000490980866711288, 0.0024187135689316794] and parameters: {'p_sma': 38, 'p_std': 37, 'p_atr': 26, 'p_adx': 13, 'rsi_period': 27, 'ema1': 29, 'ema2': 14, 'slip_atr_k': 0.029134054793216166, 'slip_spread_k': 0.8574090773006511, 'spread_hl_frac': 0.018796811483393586, 'bb_std_mult': 2.702243201959211, 'rsi_os': 54, 'rsi_ob': 55, 'vol_spike': 0.1625169727587625, 'adx_thresh': 14.479158089618497, 'atr_min_pct': 0.015196305939127429, 'atr_max_pct': 0.040670572009858366, 'tp_mult': 2.217065729549908, 'tsl_mult': 0.29837669347633544, 'strategy': 'breakout', 'time_stop': 174, 'use_sma': True, 'use_atr': True, 'use_adx': False, 'use_ema': False, 'use_spike': False, 'rsi_required': False, 'edge_k': 0.4440915639578385, 'edge_cap': 0.34126223507736664, 'bull_strategy': 'mean_reversion', 'bull_bb_std_mult': 1.7164711792198344, 'bull_rsi_os': 22, 'bull_rsi_ob': 73, 'bull_adx_thresh': 25.61121208638303, 'bull_atr_min_pct': 0.014777178277522496, 'bull_atr_max_pct': 0.03995926237125287, 'bull_tp_mult': 2.404023070003378, 'bull_tsl_mult': 0.8475472500988668, 'bull_time_stop': 300, 'bull_use_sma': True, 'bull_use_ema': False, 'bull_use_atr': True, 'bull_use_adx': True, 'bull_use_spike': True, 'bull_rsi_required': False, 'bear_strategy': 'breakout', 'bear_bb_std_mult': 1.3133991159015588, 'bear_rsi_os': 12, 'bear_rsi_ob': 50, 'bear_adx_thresh': 17.06870121331441, 'bear_atr_min_pct': 0.01742520270133815, 'bear_atr_max_pct': 0.09344731705823396, 'bear_tp_mult': 2.9615863558292763, 'bear_tsl_mult': 0.5774760817509581, 'bear_time_stop': 239, 'bear_use_sma': False, 'bear_use_ema': False, 'bear_use_atr': True, 'bear_use_adx': True, 'bear_use_spike': True, 'bear_rsi_required': False, 'sideways_strategy': 'mean_reversion', 'sideways_bb_std_mult': 2.3294915944475667, 'sideways_rsi_os': 21, 'sideways_rsi_ob': 53, 'sideways_adx_thresh': 26.878085615913733, 'sideways_atr_min_pct': 0.001330525416792145, 'sideways_atr_max_pct': 0.08583741958221602, 'sideways_tp_mult': 2.1226514585053247, 'sideways_tsl_mult': 0.31027980682087725, 'sideways_time_stop': 37, 'sideways_use_sma': True, 'sideways_use_ema': False, 'sideways_use_atr': False, 'sideways_use_adx': True, 'sideways_use_spike': True, 'sideways_rsi_required': False}.
[I 2025-09-01 09:21:30,223] Trial 118 finished with values: [-1000000000.0, 1000000000.0] and parameters: {'p_sma': 55, 'p_std': 37, 'p_atr': 26, 'p_adx': 13, 'rsi_period': 26, 'ema1': 29, 'ema2': 14, 'slip_atr_k': 0.02736940570183174, 'slip_spread_k': 0.34316919683304364, 'spread_hl_frac': 0.017508229678795506, 'bb_std_mult': 2.9547134195681903, 'rsi_os': 48, 'rsi_ob': 55, 'vol_spike': 0.12531054418592608, 'adx_thresh': 34.97644114551745, 'atr_min_pct': 0.02593438160980489, 'atr_max_pct': 0.1331088885900149, 'tp_mult': 2.5778948293655084, 'tsl_mult': 0.2988782016508663, 'strategy': 'breakout', 'time_stop': 174, 'use_sma': True, 'use_atr': True, 'use_adx': False, 'use_ema': False, 'use_spike': False, 'rsi_required': False, 'edge_k': 0.46492019561735487, 'edge_cap': 0.3445494358176367, 'bull_strategy': 'mean_reversion', 'bull_bb_std_mult': 1.7220324600534507, 'bull_rsi_os': 21, 'bull_rsi_ob': 61, 'bull_adx_thresh': 20.381147005982434, 'bull_atr_min_pct': 0.014614139943435727, 'bull_atr_max_pct': 0.040227088826855745, 'bull_tp_mult': 2.5574403541726456, 'bull_tsl_mult': 0.8541744110851848, 'bull_time_stop': 229, 'bull_use_sma': True, 'bull_use_ema': False, 'bull_use_atr': True, 'bull_use_adx': True, 'bull_use_spike': True, 'bull_rsi_required': False, 'bear_strategy': 'breakout', 'bear_bb_std_mult': 3.5966812945401454, 'bear_rsi_os': 16, 'bear_rsi_ob': 50, 'bear_adx_thresh': 17.050380820204538, 'bear_atr_min_pct': 0.00997130038369965, 'bear_atr_max_pct': 0.10194420805829002, 'bear_tp_mult': 2.949550488431059, 'bear_tsl_mult': 0.5831159255061212, 'bear_time_stop': 245, 'bear_use_sma': False, 'bear_use_ema': False, 'bear_use_atr': True, 'bear_use_adx': True, 'bear_use_spike': True, 'bear_rsi_required': False, 'sideways_strategy': 'mean_reversion', 'sideways_bb_std_mult': 2.3316044013948307, 'sideways_rsi_os': 43, 'sideways_rsi_ob': 50, 'sideways_adx_thresh': 8.358266373860413, 'sideways_atr_min_pct': 0.011403570405415708, 'sideways_atr_max_pct': 0.08504529675163494, 'sideways_tp_mult': 1.0723296578371149, 'sideways_tsl_mult': 0.3209675447998218, 'sideways_time_stop': 26, 'sideways_use_sma': True, 'sideways_use_ema': False, 'sideways_use_atr': False, 'sideways_use_adx': True, 'sideways_use_spike': True, 'sideways_rsi_required': False}.
[I 2025-09-01 09:21:30,471] Trial 119 finished with values: [-0.11821923371781518, 0.11823479314068489] and parameters: {'p_sma': 57, 'p_std': 21, 'p_atr': 26, 'p_adx': 23, 'rsi_period': 35, 'ema1': 29, 'ema2': 14, 'slip_atr_k': 0.027363248315135716, 'slip_spread_k': 0.34134904046247894, 'spread_hl_frac': 0.017837286233351825, 'bb_std_mult': 2.166821215866959, 'rsi_os': 48, 'rsi_ob': 54, 'vol_spike': 0.1477582341361765, 'adx_thresh': 8.242017038301269, 'atr_min_pct': 0.011236193346104945, 'atr_max_pct': 0.1478668682387461, 'tp_mult': 2.2396904330430885, 'tsl_mult': 0.42371035454777467, 'strategy': 'breakout', 'time_stop': 122, 'use_sma': True, 'use_atr': True, 'use_adx': False, 'use_ema': False, 'use_spike': False, 'rsi_required': False, 'edge_k': 0.65891550333122, 'edge_cap': 0.3449704077072108, 'bull_strategy': 'mean_reversion', 'bull_bb_std_mult': 1.9912012976673892, 'bull_rsi_os': 21, 'bull_rsi_ob': 60, 'bull_adx_thresh': 25.242980579954416, 'bull_atr_min_pct': 0.016642488727848927, 'bull_atr_max_pct': 0.038982656808025214, 'bull_tp_mult': 2.395470636269641, 'bull_tsl_mult': 0.6069721060398775, 'bull_time_stop': 224, 'bull_use_sma': True, 'bull_use_ema': False, 'bull_use_atr': True, 'bull_use_adx': True, 'bull_use_spike': False, 'bull_rsi_required': False, 'bear_strategy': 'mean_reversion', 'bear_bb_std_mult': 2.739455150955449, 'bear_rsi_os': 46, 'bear_rsi_ob': 50, 'bear_adx_thresh': 16.9138849365758, 'bear_atr_min_pct': 0.017757396699308613, 'bear_atr_max_pct': 0.09325598446727712, 'bear_tp_mult': 1.0139171897659205, 'bear_tsl_mult': 0.7440813356494361, 'bear_time_stop': 117, 'bear_use_sma': True, 'bear_use_ema': False, 'bear_use_atr': True, 'bear_use_adx': True, 'bear_use_spike': True, 'bear_rsi_required': False, 'sideways_strategy': 'breakout', 'sideways_bb_std_mult': 2.50077330673199, 'sideways_rsi_os': 21, 'sideways_rsi_ob': 50, 'sideways_adx_thresh': 13.707181667515993, 'sideways_atr_min_pct': 0.001312796315451367, 'sideways_atr_max_pct': 0.08514954327166022, 'sideways_tp_mult': 1.0793996821541767, 'sideways_tsl_mult': 0.08738115894441584, 'sideways_time_stop': 23, 'sideways_use_sma': True, 'sideways_use_ema': False, 'sideways_use_atr': False, 'sideways_use_adx': True, 'sideways_use_spike': True, 'sideways_rsi_required': False}.
[I 2025-09-01 09:21:30,794] Trial 120 finished with values: [-1000000000.0, 1000000000.0] and parameters: {'p_sma': 37, 'p_std': 41, 'p_atr': 26, 'p_adx': 30, 'rsi_period': 26, 'ema1': 26, 'ema2': 14, 'slip_atr_k': 0.016606844561286555, 'slip_spread_k': 0.6482460462201616, 'spread_hl_frac': 0.015293536449717763, 'bb_std_mult': 2.7061621326970484, 'rsi_os': 47, 'rsi_ob': 54, 'vol_spike': 0.2401364012867575, 'adx_thresh': 12.005554330754633, 'atr_min_pct': 0.011256657819394455, 'atr_max_pct': 0.1490120338416416, 'tp_mult': 1.4876264083499962, 'tsl_mult': 0.4207366332640535, 'strategy': 'breakout', 'time_stop': 186, 'use_sma': True, 'use_atr': False, 'use_adx': False, 'use_ema': False, 'use_spike': True, 'rsi_required': False, 'edge_k': 1.567332236335941, 'edge_cap': 0.34972218732056465, 'bull_strategy': 'mean_reversion', 'bull_bb_std_mult': 1.982831884591504, 'bull_rsi_os': 50, 'bull_rsi_ob': 55, 'bull_adx_thresh': 20.10597898334412, 'bull_atr_min_pct': 0.014484920792959276, 'bull_atr_max_pct': 0.021692221402071957, 'bull_tp_mult': 2.3930607347706685, 'bull_tsl_mult': 0.6157180913728054, 'bull_time_stop': 231, 'bull_use_sma': True, 'bull_use_ema': False, 'bull_use_atr': True, 'bull_use_adx': False, 'bull_use_spike': False, 'bull_rsi_required': False, 'bear_strategy': 'breakout', 'bear_bb_std_mult': 1.0212237578715384, 'bear_rsi_os': 40, 'bear_rsi_ob': 50, 'bear_adx_thresh': 9.154313649603012, 'bear_atr_min_pct': 0.027072190227439754, 'bear_atr_max_pct': 0.024204774490283562, 'bear_tp_mult': 1.0157302862096624, 'bear_tsl_mult': 0.45334877480706554, 'bear_time_stop': 249, 'bear_use_sma': True, 'bear_use_ema': False, 'bear_use_atr': True, 'bear_use_adx': False, 'bear_use_spike': False, 'bear_rsi_required': False, 'sideways_strategy': 'mean_reversion', 'sideways_bb_std_mult': 2.334242666871436, 'sideways_rsi_os': 21, 'sideways_rsi_ob': 55, 'sideways_adx_thresh': 26.942147905461624, 'sideways_atr_min_pct': 0.0007645743895361892, 'sideways_atr_max_pct': 0.08520624048699929, 'sideways_tp_mult': 1.0924837987058789, 'sideways_tsl_mult': 0.9238398715640258, 'sideways_time_stop': 217, 'sideways_use_sma': True, 'sideways_use_ema': True, 'sideways_use_atr': False, 'sideways_use_adx': True, 'sideways_use_spike': True, 'sideways_rsi_required': False}.
[I 2025-09-01 09:21:31,300] Trial 124 finished with values: [-1000000000.0, 1000000000.0] and parameters: {'p_sma': 18, 'p_std': 36, 'p_atr': 27, 'p_adx': 10, 'rsi_period': 44, 'ema1': 23, 'ema2': 10, 'slip_atr_k': 0.02293061768006119, 'slip_spread_k': 0.7941273066544381, 'spread_hl_frac': 0.01874077872043729, 'bb_std_mult': 1.736128631788491, 'rsi_os': 55, 'rsi_ob': 52, 'vol_spike': 0.298258366822408, 'adx_thresh': 12.904534324676675, 'atr_min_pct': 0.012143666255044455, 'atr_max_pct': 0.02723732841848525, 'tp_mult': 2.198445603144503, 'tsl_mult': 0.11044889346137132, 'strategy': 'mean_reversion', 'time_stop': 158, 'use_sma': True, 'use_atr': True, 'use_adx': False, 'use_ema': False, 'use_spike': True, 'rsi_required': False, 'edge_k': 0.41503133124369795, 'edge_cap': 0.25639886978261733, 'bull_strategy': 'mean_reversion', 'bull_bb_std_mult': 1.8853766530107048, 'bull_rsi_os': 30, 'bull_rsi_ob': 67, 'bull_adx_thresh': 6.869536581398915, 'bull_atr_min_pct': 0.0025630699901059684, 'bull_atr_max_pct': 0.03397777452313582, 'bull_tp_mult': 2.335422288268627, 'bull_tsl_mult': 0.025235014992467664, 'bull_time_stop': 298, 'bull_use_sma': False, 'bull_use_ema': False, 'bull_use_atr': True, 'bull_use_adx': False, 'bull_use_spike': True, 'bull_rsi_required': True, 'bear_strategy': 'breakout', 'bear_bb_std_mult': 1.2912666164153865, 'bear_rsi_os': 27, 'bear_rsi_ob': 92, 'bear_adx_thresh': 16.09013453757545, 'bear_atr_min_pct': 0.02766677441910454, 'bear_atr_max_pct': 0.11507601331288937, 'bear_tp_mult': 2.198158924370874, 'bear_tsl_mult': 0.5375683973516209, 'bear_time_stop': 238, 'bear_use_sma': False, 'bear_use_ema': False, 'bear_use_atr': True, 'bear_use_adx': False, 'bear_use_spike': False, 'bear_rsi_required': False, 'sideways_strategy': 'mean_reversion', 'sideways_bb_std_mult': 2.745645275841563, 'sideways_rsi_os': 14, 'sideways_rsi_ob': 53, 'sideways_adx_thresh': 22.407164612604582, 'sideways_atr_min_pct': 0.02303338312557166, 'sideways_atr_max_pct': 0.09064342010701326, 'sideways_tp_mult': 2.3805916870450474, 'sideways_tsl_mult': 0.8109789228085693, 'sideways_time_stop': 41, 'sideways_use_sma': True, 'sideways_use_ema': True, 'sideways_use_atr': False, 'sideways_use_adx': False, 'sideways_use_spike': False, 'sideways_rsi_required': False}.
[I 2025-09-01 09:22:10,040] Trial 125 finished with values: [-1000000000.0, 1000000000.0] and parameters: {'p_sma': 56, 'p_std': 38, 'p_atr': 29, 'p_adx': 11, 'rsi_period': 68, 'ema1': 16, 'ema2': 12, 'slip_atr_k': 0.017835423849120246, 'slip_spread_k': 0.8713858943204125, 'spread_hl_frac': 0.02012695305259216, 'bb_std_mult': 2.3423333995383944, 'rsi_os': 42, 'rsi_ob': 57, 'vol_spike': 0.1908966940931777, 'adx_thresh': 29.141268149796698, 'atr_min_pct': 0.015201312127335744, 'atr_max_pct': 0.04075837615246448, 'tp_mult': 2.606244468911985, 'tsl_mult': 0.5206039005713781, 'strategy': 'mean_reversion', 'time_stop': 229, 'use_sma': True, 'use_atr': False, 'use_adx': False, 'use_ema': False, 'use_spike': True, 'rsi_required': False, 'edge_k': 0.6797693491970141, 'edge_cap': 0.3175245032866497, 'bull_strategy': 'mean_reversion', 'bull_bb_std_mult': 1.8243229433832002, 'bull_rsi_os': 37, 'bull_rsi_ob': 73, 'bull_adx_thresh': 16.202892301426697, 'bull_atr_min_pct': 0.00823514188804694, 'bull_atr_max_pct': 0.03575995689305176, 'bull_tp_mult': 2.4453901579737303, 'bull_tsl_mult': 0.7417803407179206, 'bull_time_stop': 255, 'bull_use_sma': False, 'bull_use_ema': False, 'bull_use_atr': True, 'bull_use_adx': False, 'bull_use_spike': True, 'bull_rsi_required': False, 'bear_strategy': 'breakout', 'bear_bb_std_mult': 1.6391285163582552, 'bear_rsi_os': 49, 'bear_rsi_ob': 60, 'bear_adx_thresh': 21.373877235856796, 'bear_atr_min_pct': 0.0019690289587167703, 'bear_atr_max_pct': 0.13659209099841532, 'bear_tp_mult': 2.8850340872144096, 'bear_tsl_mult': 0.9413431093940785, 'bear_time_stop': 41, 'bear_use_sma': False, 'bear_use_ema': False, 'bear_use_atr': True, 'bear_use_adx': True, 'bear_use_spike': False, 'bear_rsi_required': False, 'sideways_strategy': 'mean_reversion', 'sideways_bb_std_mult': 2.1522785079833917, 'sideways_rsi_os': 5, 'sideways_rsi_ob': 57, 'sideways_adx_thresh': 6.137860898557065, 'sideways_atr_min_pct': 0.0015026623223520234, 'sideways_atr_max_pct': 0.11510816054509035, 'sideways_tp_mult': 2.818005218279277, 'sideways_tsl_mult': 0.8479797236089972, 'sideways_time_stop': 228, 'sideways_use_sma': True, 'sideways_use_ema': False, 'sideways_use_atr': False, 'sideways_use_adx': False, 'sideways_use_spike': False, 'sideways_rsi_required': False}.
[I 2025-09-01 09:22:12,125] Trial 123 finished with values: [-1000000000.0, 1000000000.0] and parameters: {'p_sma': 36, 'p_std': 36, 'p_atr': 27, 'p_adx': 30, 'rsi_period': 78, 'ema1': 16, 'ema2': 10, 'slip_atr_k': 0.15838330055608957, 'slip_spread_k': 0.24912456778572095, 'spread_hl_frac': 0.015083802064007265, 'bb_std_mult': 2.7016174937048407, 'rsi_os': 12, 'rsi_ob': 52, 'vol_spike': 0.2399947335013192, 'adx_thresh': 11.862489780048035, 'atr_min_pct': 0.012278392711526101, 'atr_max_pct': 0.028097356019716496, 'tp_mult': 2.609891044188732, 'tsl_mult': 0.4197607217627796, 'strategy': 'mean_reversion', 'time_stop': 157, 'use_sma': True, 'use_atr': False, 'use_adx': False, 'use_ema': False, 'use_spike': True, 'rsi_required': False, 'edge_k': 0.4187282924036022, 'edge_cap': 0.5528664719381664, 'bull_strategy': 'mean_reversion', 'bull_bb_std_mult': 1.8965810992136822, 'bull_rsi_os': 50, 'bull_rsi_ob': 89, 'bull_adx_thresh': 7.200740065907153, 'bull_atr_min_pct': 0.02674471021779466, 'bull_atr_max_pct': 0.14465968356276726, 'bull_tp_mult': 2.3270060756082103, 'bull_tsl_mult': 0.37820574923703804, 'bull_time_stop': 296, 'bull_use_sma': False, 'bull_use_ema': False, 'bull_use_atr': True, 'bull_use_adx': False, 'bull_use_spike': True, 'bull_rsi_required': True, 'bear_strategy': 'breakout', 'bear_bb_std_mult': 3.133222033727457, 'bear_rsi_os': 12, 'bear_rsi_ob': 47, 'bear_adx_thresh': 34.91747691145674, 'bear_atr_min_pct': 0.026934092222411204, 'bear_atr_max_pct': 0.13744185898352554, 'bear_tp_mult': 2.8953458509345866, 'bear_tsl_mult': 0.46451725198158156, 'bear_time_stop': 235, 'bear_use_sma': True, 'bear_use_ema': False, 'bear_use_atr': True, 'bear_use_adx': False, 'bear_use_spike': False, 'bear_rsi_required': False, 'sideways_strategy': 'mean_reversion', 'sideways_bb_std_mult': 2.1651383084284133, 'sideways_rsi_os': 7, 'sideways_rsi_ob': 75, 'sideways_adx_thresh': 22.517918290612048, 'sideways_atr_min_pct': 0.015827779553453637, 'sideways_atr_max_pct': 0.01922851982162159, 'sideways_tp_mult': 2.372704130366697, 'sideways_tsl_mult': 0.9204872831003397, 'sideways_time_stop': 53, 'sideways_use_sma': True, 'sideways_use_ema': True, 'sideways_use_atr': False, 'sideways_use_adx': False, 'sideways_use_spike': False, 'sideways_rsi_required': False}.
[I 2025-09-01 09:22:12,688] Trial 122 finished with values: [-1000000000.0, 1000000000.0] and parameters: {'p_sma': 49, 'p_std': 36, 'p_atr': 29, 'p_adx': 30, 'rsi_period': 35, 'ema1': 16, 'ema2': 26, 'slip_atr_k': 0.24683509336267623, 'slip_spread_k': 0.24936900439710022, 'spread_hl_frac': 0.015492792495472724, 'bb_std_mult': 2.1705291463436733, 'rsi_os': 47, 'rsi_ob': 53, 'vol_spike': 0.00048212261565633296, 'adx_thresh': 12.117788576025452, 'atr_min_pct': 0.011178635224766162, 'atr_max_pct': 0.04024915935116158, 'tp_mult': 2.2171509929882682, 'tsl_mult': 0.4190925653482839, 'strategy': 'breakout', 'time_stop': 128, 'use_sma': True, 'use_atr': False, 'use_adx': False, 'use_ema': False, 'use_spike': True, 'rsi_required': False, 'edge_k': 0.6689808110974762, 'edge_cap': 0.6030213390215287, 'bull_strategy': 'mean_reversion', 'bull_bb_std_mult': 2.0039955926465516, 'bull_rsi_os': 51, 'bull_rsi_ob': 70, 'bull_adx_thresh': 25.714226323777755, 'bull_atr_min_pct': 0.0024006365598079576, 'bull_atr_max_pct': 0.021975296155733792, 'bull_tp_mult': 2.41859272482422, 'bull_tsl_mult': 0.6010810855204762, 'bull_time_stop': 223, 'bull_use_sma': True, 'bull_use_ema': False, 'bull_use_atr': True, 'bull_use_adx': False, 'bull_use_spike': False, 'bull_rsi_required': False, 'bear_strategy': 'breakout', 'bear_bb_std_mult': 1.0374311055003267, 'bear_rsi_os': 46, 'bear_rsi_ob': 92, 'bear_adx_thresh': 8.483484323262067, 'bear_atr_min_pct': 0.027122804314923393, 'bear_atr_max_pct': 0.09351435017530622, 'bear_tp_mult': 2.7752325495820567, 'bear_tsl_mult': 0.45584266750657365, 'bear_time_stop': 232, 'bear_use_sma': True, 'bear_use_ema': False, 'bear_use_atr': True, 'bear_use_adx': False, 'bear_use_spike': False, 'bear_rsi_required': False, 'sideways_strategy': 'mean_reversion', 'sideways_bb_std_mult': 2.7838441686370166, 'sideways_rsi_os': 14, 'sideways_rsi_ob': 55, 'sideways_adx_thresh': 22.264415567361553, 'sideways_atr_min_pct': 0.0008237025614809518, 'sideways_atr_max_pct': 0.09040877061850909, 'sideways_tp_mult': 2.8024376135757394, 'sideways_tsl_mult': 0.9243324939628886, 'sideways_time_stop': 218, 'sideways_use_sma': True, 'sideways_use_ema': True, 'sideways_use_atr': False, 'sideways_use_adx': True, 'sideways_use_spike': True, 'sideways_rsi_required': False}.
[I 2025-09-01 09:22:12,860] Trial 121 finished with values: [-1000000000.0, 1000000000.0] and parameters: {'p_sma': 50, 'p_std': 36, 'p_atr': 29, 'p_adx': 13, 'rsi_period': 12, 'ema1': 16, 'ema2': 14, 'slip_atr_k': 0.2170263950897252, 'slip_spread_k': 0.7971876889505136, 'spread_hl_frac': 0.015365140268867435, 'bb_std_mult': 2.95100635676435, 'rsi_os': 48, 'rsi_ob': 78, 'vol_spike': 0.12463798339811119, 'adx_thresh': 12.496160869109836, 'atr_min_pct': 0.011263716312781443, 'atr_max_pct': 0.01338805614780221, 'tp_mult': 1.5558525092051207, 'tsl_mult': 0.2986210010536551, 'strategy': 'breakout', 'time_stop': 126, 'use_sma': True, 'use_atr': False, 'use_adx': False, 'use_ema': False, 'use_spike': True, 'rsi_required': False, 'edge_k': 0.6501642281028632, 'edge_cap': 0.6046695433693691, 'bull_strategy': 'mean_reversion', 'bull_bb_std_mult': 1.9717915873987388, 'bull_rsi_os': 24, 'bull_rsi_ob': 61, 'bull_adx_thresh': 20.412314488889066, 'bull_atr_min_pct': 0.01237799217862206, 'bull_atr_max_pct': 0.04026448734280213, 'bull_tp_mult': 2.414522287314856, 'bull_tsl_mult': 0.6101809403337953, 'bull_time_stop': 224, 'bull_use_sma': True, 'bull_use_ema': False, 'bull_use_atr': True, 'bull_use_adx': False, 'bull_use_spike': False, 'bull_rsi_required': False, 'bear_strategy': 'breakout', 'bear_bb_std_mult': 3.1337501191110784, 'bear_rsi_os': 26, 'bear_rsi_ob': 50, 'bear_adx_thresh': 17.114426484594052, 'bear_atr_min_pct': 0.009815470016012445, 'bear_atr_max_pct': 0.02408474824715104, 'bear_tp_mult': 2.903747190669326, 'bear_tsl_mult': 0.4641021077255551, 'bear_time_stop': 249, 'bear_use_sma': True, 'bear_use_ema': False, 'bear_use_atr': True, 'bear_use_adx': False, 'bear_use_spike': False, 'bear_rsi_required': False, 'sideways_strategy': 'mean_reversion', 'sideways_bb_std_mult': 2.7435878485544554, 'sideways_rsi_os': 31, 'sideways_rsi_ob': 53, 'sideways_adx_thresh': 8.210065714941479, 'sideways_atr_min_pct': 0.011218263015409674, 'sideways_atr_max_pct': 0.08379758258131532, 'sideways_tp_mult': 2.7934914115323792, 'sideways_tsl_mult': 0.16185345704865023, 'sideways_time_stop': 215, 'sideways_use_sma': True, 'sideways_use_ema': True, 'sideways_use_atr': False, 'sideways_use_adx': True, 'sideways_use_spike': True, 'sideways_rsi_required': False}.
