[I 2025-09-01 09:13:32,351] Trial 60 finished with values: [-1000000000.0, 1000000000.0] and parameters: {'p_sma': 9, 'p_std': 37, 'p_atr': 23, 'p_adx': 10, 'rsi_period': 35, 'ema1': 23, 'ema2': 35, 'slip_atr_k': 0.22834358854218514, 'slip_spread_k': 0.26391751889822473, 'spread_hl_frac': 0.02937403825014804, 'bb_std_mult': 1.917755031721961, 'rsi_os': 8, 'rsi_ob': 79, 'vol_spike': 0.22085649160226384, 'adx_thresh': 28.57011798669504, 'atr_min_pct': 0.009666498671637425, 'atr_max_pct': 0.09235334140734476, 'tp_mult': 1.5972459439675142, 'tsl_mult': 0.758149785923598, 'strategy': 'mean_reversion', 'time_stop': 119, 'use_sma': True, 'use_atr': True, 'use_adx': False, 'use_ema': False, 'use_spike': False, 'rsi_required': False, 'edge_k': 0.09145394751657632, 'edge_cap': 0.1360948342967428, 'bull_strategy': 'mean_reversion', 'bull_bb_std_mult': 1.9541492855234608, 'bull_rsi_os': 39, 'bull_rsi_ob': 62, 'bull_adx_thresh': 33.52615748735373, 'bull_atr_min_pct': 0.0050747350597011975, 'bull_atr_max_pct': 0.05120815488696198, 'bull_tp_mult': 1.2084077976876606, 'bull_tsl_mult': 0.42833003827909244, 'bull_time_stop': 251, 'bull_use_sma': False, 'bull_use_ema': False, 'bull_use_atr': True, 'bull_use_adx': False, 'bull_use_spike': False, 'bull_rsi_required': False, 'bear_strategy': 'breakout', 'bear_bb_std_mult': 1.1723757437202147, 'bear_rsi_os': 44, 'bear_rsi_ob': 80, 'bear_adx_thresh': 8.395666271750358, 'bear_atr_min_pct': 0.018238162680963392, 'bear_atr_max_pct': 0.09447078631698905, 'bear_tp_mult': 1.3465495393587519, 'bear_tsl_mult': 0.21313712422899747, 'bear_time_stop': 299, 'bear_use_sma': False, 'bear_use_ema': False, 'bear_use_atr': True, 'bear_use_adx': False, 'bear_use_spike': True, 'bear_rsi_required': False, 'sideways_strategy': 'mean_reversion', 'sideways_bb_std_mult': 2.6940033180219087, 'sideways_rsi_os': 50, 'sideways_rsi_ob': 94, 'sideways_adx_thresh': 23.855253386291647, 'sideways_atr_min_pct': 0.02801998089012414, 'sideways_atr_max_pct': 0.14036332947926464, 'sideways_tp_mult': 2.456123059702225, 'sideways_tsl_mult': 0.37621407037031207, 'sideways_time_stop': 288, 'sideways_use_sma': True, 'sideways_use_ema': True, 'sideways_use_atr': False, 'sideways_use_adx': True, 'sideways_use_spike': False, 'sideways_rsi_required': False}.
[I 2025-09-01 09:13:32,352] Trial 64 finished with values: [-1000000000.0, 1000000000.0] and parameters: {'p_sma': 52, 'p_std': 54, 'p_atr': 28, 'p_adx': 29, 'rsi_period': 44, 'ema1': 25, 'ema2': 58, 'slip_atr_k': 0.060489236270730246, 'slip_spread_k': 0.7396076190086942, 'spread_hl_frac': 0.033445695691670385, 'bb_std_mult': 2.1099589215417565, 'rsi_os': 47, 'rsi_ob': 66, 'vol_spike': 0.10309512864455053, 'adx_thresh': 21.63709700453866, 'atr_min_pct': 0.006821845400955496, 'atr_max_pct': 0.06833458411255895, 'tp_mult': 2.7514838679659697, 'tsl_mult': 0.9677908322429117, 'strategy': 'mean_reversion', 'time_stop': 18, 'use_sma': False, 'use_atr': True, 'use_adx': True, 'use_ema': False, 'use_spike': True, 'rsi_required': False, 'edge_k': 0.9195623700301815, 'edge_cap': 0.5979024974148982, 'bull_strategy': 'breakout', 'bull_bb_std_mult': 0.6707361702691446, 'bull_rsi_os': 26, 'bull_rsi_ob': 56, 'bull_adx_thresh': 16.93939199150154, 'bull_atr_min_pct': 0.005281107959868107, 'bull_atr_max_pct': 0.0528652228340806, 'bull_tp_mult': 1.061186655435969, 'bull_tsl_mult': 0.3113703297104066, 'bull_time_stop': 200, 'bull_use_sma': False, 'bull_use_ema': True, 'bull_use_atr': False, 'bull_use_adx': False, 'bull_use_spike': True, 'bull_rsi_required': False, 'bear_strategy': 'breakout', 'bear_bb_std_mult': 0.519382718823804, 'bear_rsi_os': 34, 'bear_rsi_ob': 75, 'bear_adx_thresh': 23.208823285463335, 'bear_atr_min_pct': 0.02319859586032938, 'bear_atr_max_pct': 0.0944421357164279, 'bear_tp_mult': 1.3381930236970143, 'bear_tsl_mult': 0.8733312370943034, 'bear_time_stop': 287, 'bear_use_sma': False, 'bear_use_ema': False, 'bear_use_atr': False, 'bear_use_adx': True, 'bear_use_spike': False, 'bear_rsi_required': True, 'sideways_strategy': 'mean_reversion', 'sideways_bb_std_mult': 3.022109091282599, 'sideways_rsi_os': 34, 'sideways_rsi_ob': 59, 'sideways_adx_thresh': 24.274726866027486, 'sideways_atr_min_pct': 0.0075068848285702455, 'sideways_atr_max_pct': 0.11025012813896727, 'sideways_tp_mult': 2.475208232419274, 'sideways_tsl_mult': 0.957226734885313, 'sideways_time_stop': 255, 'sideways_use_sma': True, 'sideways_use_ema': False, 'sideways_use_atr': True, 'sideways_use_adx': True, 'sideways_use_spike': False, 'sideways_rsi_required': True}.
[I 2025-09-01 09:14:09,705] Trial 67 finished with values: [-0.08523441895455541, 0.08533436188318907] and parameters: {'p_sma': 58, 'p_std': 33, 'p_atr': 30, 'p_adx': 13, 'rsi_period': 38, 'ema1': 25, 'ema2': 13, 'slip_atr_k': 0.02022892474237348, 'slip_spread_k': 0.21436374627059107, 'spread_hl_frac': 0.014746805051962195, 'bb_std_mult': 2.7026768061956066, 'rsi_os': 41, 'rsi_ob': 56, 'vol_spike': 0.0705874834512027, 'adx_thresh': 14.26741478293188, 'atr_min_pct': 0.012225906236161588, 'atr_max_pct': 0.037737198373570445, 'tp_mult': 2.563927134532097, 'tsl_mult': 0.45318859999639216, 'strategy': 'breakout', 'time_stop': 177, 'use_sma': True, 'use_atr': True, 'use_adx': False, 'use_ema': True, 'use_spike': True, 'rsi_required': False, 'edge_k': 0.5599873883897011, 'edge_cap': 0.23790723871914204, 'bull_strategy': 'mean_reversion', 'bull_bb_std_mult': 2.4305520396940956, 'bull_rsi_os': 52, 'bull_rsi_ob': 68, 'bull_adx_thresh': 18.91907318136127, 'bull_atr_min_pct': 0.013961850957624648, 'bull_atr_max_pct': 0.04313682333681813, 'bull_tp_mult': 2.4372655612454, 'bull_tsl_mult': 0.07889414014006135, 'bull_time_stop': 287, 'bull_use_sma': False, 'bull_use_ema': False, 'bull_use_atr': True, 'bull_use_adx': False, 'bull_use_spike': True, 'bull_rsi_required': True, 'bear_strategy': 'breakout', 'bear_bb_std_mult': 1.4417739665239875, 'bear_rsi_os': 21, 'bear_rsi_ob': 48, 'bear_adx_thresh': 13.579219072242882, 'bear_atr_min_pct': 0.02924465822793539, 'bear_atr_max_pct': 0.12538236119668986, 'bear_tp_mult': 2.869904294873718, 'bear_tsl_mult': 0.9972726235564644, 'bear_time_stop': 201, 'bear_use_sma': False, 'bear_use_ema': True, 'bear_use_atr': True, 'bear_use_adx': True, 'bear_use_spike': False, 'bear_rsi_required': False, 'sideways_strategy': 'breakout', 'sideways_bb_std_mult': 2.2066293276912736, 'sideways_rsi_os': 30, 'sideways_rsi_ob': 53, 'sideways_adx_thresh': 20.889315605800103, 'sideways_atr_min_pct': 0.0014303461693466876, 'sideways_atr_max_pct': 0.09345462530739254, 'sideways_tp_mult': 1.105217321936159, 'sideways_tsl_mult': 0.5354140407330965, 'sideways_time_stop': 213, 'sideways_use_sma': True, 'sideways_use_ema': False, 'sideways_use_atr': False, 'sideways_use_adx': False, 'sideways_use_spike': False, 'sideways_rsi_required': False}.
[I 2025-09-01 09:14:10,046] Trial 68 finished with values: [-1000000000.0, 1000000000.0] and parameters: {'p_sma': 58, 'p_std': 33, 'p_atr': 30, 'p_adx': 13, 'rsi_period': 38, 'ema1': 28, 'ema2': 12, 'slip_atr_k': 0.028713351449472447, 'slip_spread_k': 0.2020953144643368, 'spread_hl_frac': 0.015150935786644176, 'bb_std_mult': 2.6704873396491426, 'rsi_os': 42, 'rsi_ob': 57, 'vol_spike': 0.06800204158846816, 'adx_thresh': 15.29298229286588, 'atr_min_pct': 0.011850811215049396, 'atr_max_pct': 0.03991618263427301, 'tp_mult': 2.575862460188111, 'tsl_mult': 0.45331377360879127, 'strategy': 'breakout', 'time_stop': 180, 'use_sma': True, 'use_atr': True, 'use_adx': False, 'use_ema': True, 'use_spike': True, 'rsi_required': False, 'edge_k': 0.5675093212775253, 'edge_cap': 0.21774995394353347, 'bull_strategy': 'mean_reversion', 'bull_bb_std_mult': 2.1923669603012472, 'bull_rsi_os': 55, 'bull_rsi_ob': 68, 'bull_adx_thresh': 19.38853408182501, 'bull_atr_min_pct': 0.013983671363934093, 'bull_atr_max_pct': 0.0434286714763649, 'bull_tp_mult': 2.416218750979028, 'bull_tsl_mult': 0.3818231253990213, 'bull_time_stop': 291, 'bull_use_sma': False, 'bull_use_ema': False, 'bull_use_atr': True, 'bull_use_adx': False, 'bull_use_spike': True, 'bull_rsi_required': True, 'bear_strategy': 'breakout', 'bear_bb_std_mult': 1.4618518043698752, 'bear_rsi_os': 22, 'bear_rsi_ob': 48, 'bear_adx_thresh': 13.304678645592714, 'bear_atr_min_pct': 0.0293130948040013, 'bear_atr_max_pct': 0.12830857621032854, 'bear_tp_mult': 2.831216778157701, 'bear_tsl_mult': 0.8200405892742324, 'bear_time_stop': 196, 'bear_use_sma': False, 'bear_use_ema': True, 'bear_use_atr': True, 'bear_use_adx': True, 'bear_use_spike': False, 'bear_rsi_required': False, 'sideways_strategy': 'breakout', 'sideways_bb_std_mult': 2.1800404864774983, 'sideways_rsi_os': 31, 'sideways_rsi_ob': 55, 'sideways_adx_thresh': 20.628830556559404, 'sideways_atr_min_pct': 0.005014815249231076, 'sideways_atr_max_pct': 0.09208348179957021, 'sideways_tp_mult': 1.129465501638114, 'sideways_tsl_mult': 0.5660451032756028, 'sideways_time_stop': 196, 'sideways_use_sma': True, 'sideways_use_ema': False, 'sideways_use_atr': False, 'sideways_use_adx': False, 'sideways_use_spike': False, 'sideways_rsi_required': False}.
[I 2025-09-01 09:14:10,649] Trial 66 finished with values: [-0.07919170144291598, 0.07948267732071584] and parameters: {'p_sma': 58, 'p_std': 33, 'p_atr': 28, 'p_adx': 29, 'rsi_period': 43, 'ema1': 25, 'ema2': 12, 'slip_atr_k': 0.06197650720975982, 'slip_spread_k': 0.2120087174944597, 'spread_hl_frac': 0.014788468583299325, 'bb_std_mult': 2.6732308748840308, 'rsi_os': 46, 'rsi_ob': 56, 'vol_spike': 0.06946718077908863, 'adx_thresh': 15.501794393105929, 'atr_min_pct': 0.012137446786172458, 'atr_max_pct': 0.03963916000001887, 'tp_mult': 2.607101498030608, 'tsl_mult': 0.4655888570201737, 'strategy': 'mean_reversion', 'time_stop': 179, 'use_sma': True, 'use_atr': True, 'use_adx': False, 'use_ema': False, 'use_spike': True, 'rsi_required': False, 'edge_k': 0.8655536790934386, 'edge_cap': 0.2027662701658019, 'bull_strategy': 'mean_reversion', 'bull_bb_std_mult': 2.215787628314478, 'bull_rsi_os': 50, 'bull_rsi_ob': 69, 'bull_adx_thresh': 16.71691328645811, 'bull_atr_min_pct': 0.013301835578216365, 'bull_atr_max_pct': 0.042410950959188946, 'bull_tp_mult': 2.3856142758158367, 'bull_tsl_mult': 0.4351340998973871, 'bull_time_stop': 283, 'bull_use_sma': False, 'bull_use_ema': False, 'bull_use_atr': True, 'bull_use_adx': False, 'bull_use_spike': True, 'bull_rsi_required': False, 'bear_strategy': 'breakout', 'bear_bb_std_mult': 1.4295803484216472, 'bear_rsi_os': 21, 'bear_rsi_ob': 48, 'bear_adx_thresh': 15.788753511498275, 'bear_atr_min_pct': 0.029506600329916935, 'bear_atr_max_pct': 0.09662310398626463, 'bear_tp_mult': 2.862223125768055, 'bear_tsl_mult': 0.8614655388842891, 'bear_time_stop': 198, 'bear_use_sma': False, 'bear_use_ema': False, 'bear_use_atr': True, 'bear_use_adx': True, 'bear_use_spike': False, 'bear_rsi_required': False, 'sideways_strategy': 'breakout', 'sideways_bb_std_mult': 2.1800895546117296, 'sideways_rsi_os': 34, 'sideways_rsi_ob': 45, 'sideways_adx_thresh': 21.110815151894393, 'sideways_atr_min_pct': 0.001364060794976387, 'sideways_atr_max_pct': 0.11100501404329202, 'sideways_tp_mult': 1.4219280812438577, 'sideways_tsl_mult': 0.5167396109955031, 'sideways_time_stop': 196, 'sideways_use_sma': True, 'sideways_use_ema': False, 'sideways_use_atr': False, 'sideways_use_adx': False, 'sideways_use_spike': False, 'sideways_rsi_required': False}.
[I 2025-09-01 09:14:10,664] Trial 65 finished with values: [-0.012409328470512127, 0.01254774587973208] and parameters: {'p_sma': 37, 'p_std': 46, 'p_atr': 28, 'p_adx': 27, 'rsi_period': 44, 'ema1': 25, 'ema2': 51, 'slip_atr_k': 0.19638861459888507, 'slip_spread_k': 0.12003778294172579, 'spread_hl_frac': 0.03328931210754157, 'bb_std_mult': 2.6373826444539827, 'rsi_os': 41, 'rsi_ob': 66, 'vol_spike': 0.13217040255629675, 'adx_thresh': 15.824611080409976, 'atr_min_pct': 0.0066531654392778874, 'atr_max_pct': 0.042670652764838155, 'tp_mult': 1.0138250795520727, 'tsl_mult': 0.9655096701114793, 'strategy': 'mean_reversion', 'time_stop': 177, 'use_sma': False, 'use_atr': True, 'use_adx': True, 'use_ema': False, 'use_spike': False, 'rsi_required': False, 'edge_k': 0.3068319139723296, 'edge_cap': 0.48149921788826644, 'bull_strategy': 'breakout', 'bull_bb_std_mult': 0.6147942895737744, 'bull_rsi_os': 27, 'bull_rsi_ob': 68, 'bull_adx_thresh': 30.33993478908368, 'bull_atr_min_pct': 0.0012681617375245044, 'bull_atr_max_pct': 0.053388307993614555, 'bull_tp_mult': 1.2117964771691616, 'bull_tsl_mult': 0.5925548906544198, 'bull_time_stop': 156, 'bull_use_sma': False, 'bull_use_ema': True, 'bull_use_atr': False, 'bull_use_adx': False, 'bull_use_spike': True, 'bull_rsi_required': False, 'bear_strategy': 'breakout', 'bear_bb_std_mult': 1.4155946864891689, 'bear_rsi_os': 51, 'bear_rsi_ob': 93, 'bear_adx_thresh': 20.632279090588963, 'bear_atr_min_pct': 0.023361675139347785, 'bear_atr_max_pct': 0.09548418398324283, 'bear_tp_mult': 2.360739539208018, 'bear_tsl_mult': 0.14349208008513153, 'bear_time_stop': 112, 'bear_use_sma': False, 'bear_use_ema': False, 'bear_use_atr': False, 'bear_use_adx': True, 'bear_use_spike': True, 'bear_rsi_required': True, 'sideways_strategy': 'mean_reversion', 'sideways_bb_std_mult': 0.9756020531632659, 'sideways_rsi_os': 5, 'sideways_rsi_ob': 86, 'sideways_adx_thresh': 9.006024389251646, 'sideways_atr_min_pct': 0.0077873593557340965, 'sideways_atr_max_pct': 0.12023539156937052, 'sideways_tp_mult': 1.682023333202819, 'sideways_tsl_mult': 0.04706331758284732, 'sideways_time_stop': 236, 'sideways_use_sma': False, 'sideways_use_ema': False, 'sideways_use_atr': True, 'sideways_use_adx': True, 'sideways_use_spike': False, 'sideways_rsi_required': True}.
[I 2025-09-01 09:14:10,999] Trial 72 finished with values: [-1000000000.0, 1000000000.0] and parameters: {'p_sma': 24, 'p_std': 30, 'p_atr': 28, 'p_adx': 11, 'rsi_period': 52, 'ema1': 13, 'ema2': 17, 'slip_atr_k': 0.05746377039986719, 'slip_spread_k': 0.12301705501484148, 'spread_hl_frac': 0.011126794738299152, 'bb_std_mult': 2.415377143411913, 'rsi_os': 51, 'rsi_ob': 51, 'vol_spike': 0.13356116385139857, 'adx_thresh': 12.269807277918172, 'atr_min_pct': 0.0023618918679609354, 'atr_max_pct': 0.031867586880815285, 'tp_mult': 1.766284493710263, 'tsl_mult': 0.31886346380881425, 'strategy': 'mean_reversion', 'time_stop': 143, 'use_sma': True, 'use_atr': False, 'use_adx': False, 'use_ema': False, 'use_spike': True, 'rsi_required': False, 'edge_k': 0.6787247003818362, 'edge_cap': 0.3870473614057342, 'bull_strategy': 'mean_reversion', 'bull_bb_std_mult': 2.483372030267751, 'bull_rsi_os': 34, 'bull_rsi_ob': 74, 'bull_adx_thresh': 17.78426262920381, 'bull_atr_min_pct': 0.02211742094934056, 'bull_atr_max_pct': 0.017839139873101484, 'bull_tp_mult': 2.6712744284892285, 'bull_tsl_mult': 0.5037772351316113, 'bull_time_stop': 61, 'bull_use_sma': True, 'bull_use_ema': False, 'bull_use_atr': True, 'bull_use_adx': False, 'bull_use_spike': True, 'bull_rsi_required': False, 'bear_strategy': 'breakout', 'bear_bb_std_mult': 0.9716382689244785, 'bear_rsi_os': 53, 'bear_rsi_ob': 66, 'bear_adx_thresh': 19.27798761044812, 'bear_atr_min_pct': 0.0281730432109804, 'bear_atr_max_pct': 0.10768124779291761, 'bear_tp_mult': 2.967280221544094, 'bear_tsl_mult': 0.7453593146167361, 'bear_time_stop': 221, 'bear_use_sma': False, 'bear_use_ema': False, 'bear_use_atr': True, 'bear_use_adx': True, 'bear_use_spike': False, 'bear_rsi_required': False, 'sideways_strategy': 'mean_reversion', 'sideways_bb_std_mult': 2.383461019870874, 'sideways_rsi_os': 41, 'sideways_rsi_ob': 65, 'sideways_adx_thresh': 19.57089607393996, 'sideways_atr_min_pct': 0.0021150067816839515, 'sideways_atr_max_pct': 0.12023945928778787, 'sideways_tp_mult': 1.433535179885475, 'sideways_tsl_mult': 0.4142804435799242, 'sideways_time_stop': 165, 'sideways_use_sma': True, 'sideways_use_ema': False, 'sideways_use_atr': False, 'sideways_use_adx': False, 'sideways_use_spike': True, 'sideways_rsi_required': False}.
[I 2025-09-01 09:14:10,999] Trial 71 finished with values: [-1000000000.0, 1000000000.0] and parameters: {'p_sma': 25, 'p_std': 29, 'p_atr': 28, 'p_adx': 11, 'rsi_period': 52, 'ema1': 13, 'ema2': 17, 'slip_atr_k': 0.015743836265565928, 'slip_spread_k': 0.36177880054363176, 'spread_hl_frac': 0.012410162011816732, 'bb_std_mult': 2.37790769514483, 'rsi_os': 50, 'rsi_ob': 51, 'vol_spike': 0.102990855622902, 'adx_thresh': 11.71043886846265, 'atr_min_pct': 0.019192574335409905, 'atr_max_pct': 0.03170209398322612, 'tp_mult': 2.4411164818612425, 'tsl_mult': 0.3128409297550126, 'strategy': 'mean_reversion', 'time_stop': 141, 'use_sma': True, 'use_atr': False, 'use_adx': False, 'use_ema': False, 'use_spike': True, 'rsi_required': False, 'edge_k': 0.713042601098087, 'edge_cap': 0.3899229925133586, 'bull_strategy': 'mean_reversion', 'bull_bb_std_mult': 2.4549076571319115, 'bull_rsi_os': 35, 'bull_rsi_ob': 73, 'bull_adx_thresh': 18.00597480572754, 'bull_atr_min_pct': 0.02296870439516017, 'bull_atr_max_pct': 0.016229296060423122, 'bull_tp_mult': 2.2159804507928578, 'bull_tsl_mult': 0.5966952455078537, 'bull_time_stop': 279, 'bull_use_sma': True, 'bull_use_ema': False, 'bull_use_atr': True, 'bull_use_adx': False, 'bull_use_spike': True, 'bull_rsi_required': False, 'bear_strategy': 'breakout', 'bear_bb_std_mult': 1.6183098015182094, 'bear_rsi_os': 50, 'bear_rsi_ob': 53, 'bear_adx_thresh': 19.130066846244787, 'bear_atr_min_pct': 0.028000648040469384, 'bear_atr_max_pct': 0.10708503768178652, 'bear_tp_mult': 2.929311209704451, 'bear_tsl_mult': 0.7649736687093787, 'bear_time_stop': 283, 'bear_use_sma': False, 'bear_use_ema': False, 'bear_use_atr': True, 'bear_use_adx': True, 'bear_use_spike': False, 'bear_rsi_required': False, 'sideways_strategy': 'mean_reversion', 'sideways_bb_std_mult': 2.355636856172987, 'sideways_rsi_os': 41, 'sideways_rsi_ob': 65, 'sideways_adx_thresh': 23.023034356613568, 'sideways_atr_min_pct': 0.0027906585347564758, 'sideways_atr_max_pct': 0.1321072703690194, 'sideways_tp_mult': 1.28223944600628, 'sideways_tsl_mult': 0.45315324246902916, 'sideways_time_stop': 166, 'sideways_use_sma': True, 'sideways_use_ema': False, 'sideways_use_atr': False, 'sideways_use_adx': False, 'sideways_use_spike': True, 'sideways_rsi_required': False}.
[I 2025-09-01 09:14:47,130] Trial 70 finished with values: [-0.007736803794863412, 0.0077500643135517515] and parameters: {'p_sma': 24, 'p_std': 29, 'p_atr': 28, 'p_adx': 11, 'rsi_period': 47, 'ema1': 12, 'ema2': 18, 'slip_atr_k': 0.06500531563568487, 'slip_spread_k': 0.34788810571123246, 'spread_hl_frac': 0.010515011103586512, 'bb_std_mult': 2.351822555922943, 'rsi_os': 44, 'rsi_ob': 55, 'vol_spike': 0.013460312948856093, 'adx_thresh': 11.661790921127995, 'atr_min_pct': 0.02795620006478495, 'atr_max_pct': 0.03322002604174622, 'tp_mult': 2.7227381444932117, 'tsl_mult': 0.31178651214527264, 'strategy': 'mean_reversion', 'time_stop': 146, 'use_sma': True, 'use_atr': True, 'use_adx': False, 'use_ema': False, 'use_spike': True, 'rsi_required': False, 'edge_k': 0.7081347375123782, 'edge_cap': 0.38794084573284204, 'bull_strategy': 'mean_reversion', 'bull_bb_std_mult': 2.5352759315419022, 'bull_rsi_os': 50, 'bull_rsi_ob': 71, 'bull_adx_thresh': 17.55155931154239, 'bull_atr_min_pct': 0.022053895388533584, 'bull_atr_max_pct': 0.024880042560910587, 'bull_tp_mult': 2.2517073424906053, 'bull_tsl_mult': 0.5948863832256105, 'bull_time_stop': 275, 'bull_use_sma': True, 'bull_use_ema': False, 'bull_use_atr': True, 'bull_use_adx': False, 'bull_use_spike': True, 'bull_rsi_required': False, 'bear_strategy': 'breakout', 'bear_bb_std_mult': 0.9874265461664269, 'bear_rsi_os': 27, 'bear_rsi_ob': 51, 'bear_adx_thresh': 19.147328466838722, 'bear_atr_min_pct': 0.02781161335127158, 'bear_atr_max_pct': 0.10795086643879057, 'bear_tp_mult': 2.677501580801521, 'bear_tsl_mult': 0.7532368467786872, 'bear_time_stop': 284, 'bear_use_sma': False, 'bear_use_ema': False, 'bear_use_atr': True, 'bear_use_adx': True, 'bear_use_spike': False, 'bear_rsi_required': False, 'sideways_strategy': 'mean_reversion', 'sideways_bb_std_mult': 2.5522214587360708, 'sideways_rsi_os': 34, 'sideways_rsi_ob': 45, 'sideways_adx_thresh': 14.079544635053526, 'sideways_atr_min_pct': 0.001873327087440331, 'sideways_atr_max_pct': 0.09875712999144583, 'sideways_tp_mult': 1.4089556390015405, 'sideways_tsl_mult': 0.05966457493332877, 'sideways_time_stop': 161, 'sideways_use_sma': True, 'sideways_use_ema': False, 'sideways_use_atr': False, 'sideways_use_adx': False, 'sideways_use_spike': False, 'sideways_rsi_required': False}.
