[I 2025-09-01 10:06:59,974] Trial 387 finished with values: [-1000000000.0, 1000000000.0] and parameters: {'p_sma': 57, 'p_std': 44, 'p_atr': 28, 'p_adx': 20, 'rsi_period': 45, 'ema1': 7, 'ema2': 21, 'slip_atr_k': 0.07971029428588991, 'slip_spread_k': 0.8930015182899862, 'spread_hl_frac': 0.002763097771660228, 'bb_std_mult': 2.689622730310294, 'rsi_os': 9, 'rsi_ob': 57, 'vol_spike': 0.23495387858434424, 'adx_thresh': 11.516397675389529, 'atr_min_pct': 0.01637579862756186, 'atr_max_pct': 0.07273929181543243, 'tp_mult': 1.6208728903026945, 'tsl_mult': 0.711276381523027, 'strategy': 'breakout', 'time_stop': 58, 'use_sma': True, 'use_atr': False, 'use_adx': False, 'use_ema': False, 'use_spike': False, 'rsi_required': False, 'edge_k': 1.118066317470362, 'edge_cap': 0.8380024372920173, 'bull_strategy': 'breakout', 'bull_bb_std_mult': 3.5450356734176407, 'bull_rsi_os': 35, 'bull_rsi_ob': 54, 'bull_adx_thresh': 27.688233080649255, 'bull_atr_min_pct': 0.024337705782904864, 'bull_atr_max_pct': 0.07279530845176821, 'bull_tp_mult': 1.4853515161392121, 'bull_tsl_mult': 0.9025799958709536, 'bull_time_stop': 28, 'bull_use_sma': False, 'bull_use_ema': True, 'bull_use_atr': True, 'bull_use_adx': True, 'bull_use_spike': True, 'bull_rsi_required': False, 'bear_strategy': 'breakout', 'bear_bb_std_mult': 2.5821604480899136, 'bear_rsi_os': 44, 'bear_rsi_ob': 74, 'bear_adx_thresh': 33.69059422936125, 'bear_atr_min_pct': 0.02780852013503513, 'bear_atr_max_pct': 0.1258952315133525, 'bear_tp_mult': 2.9462188422714113, 'bear_tsl_mult': 0.8240531604248882, 'bear_time_stop': 14, 'bear_use_sma': True, 'bear_use_ema': True, 'bear_use_atr': False, 'bear_use_adx': True, 'bear_use_spike': True, 'bear_rsi_required': False, 'sideways_strategy': 'mean_reversion', 'sideways_bb_std_mult': 2.4591745088420875, 'sideways_rsi_os': 7, 'sideways_rsi_ob': 60, 'sideways_adx_thresh': 32.24892183628282, 'sideways_atr_min_pct': 0.010458545025768588, 'sideways_atr_max_pct': 0.08539425312946597, 'sideways_tp_mult': 1.7578702077434525, 'sideways_tsl_mult': 0.9811560829109011, 'sideways_time_stop': 229, 'sideways_use_sma': False, 'sideways_use_ema': False, 'sideways_use_atr': False, 'sideways_use_adx': False, 'sideways_use_spike': True, 'sideways_rsi_required': False}.
[I 2025-09-01 10:07:00,624] Trial 385 finished with values: [-1000000000.0, 1000000000.0] and parameters: {'p_sma': 58, 'p_std': 24, 'p_atr': 28, 'p_adx': 20, 'rsi_period': 41, 'ema1': 9, 'ema2': 12, 'slip_atr_k': 0.04337287041253016, 'slip_spread_k': 0.6844819649259106, 'spread_hl_frac': 0.006217068021817443, 'bb_std_mult': 2.6047118245798653, 'rsi_os': 23, 'rsi_ob': 57, 'vol_spike': 0.27147800892088114, 'adx_thresh': 12.382715556813029, 'atr_min_pct': 0.0037150812666784487, 'atr_max_pct': 0.07318841957634296, 'tp_mult': 2.28027614285181, 'tsl_mult': 0.84939768118336, 'strategy': 'breakout', 'time_stop': 217, 'use_sma': False, 'use_atr': True, 'use_adx': False, 'use_ema': True, 'use_spike': False, 'rsi_required': True, 'edge_k': 1.9475013511363937, 'edge_cap': 0.8464017975104826, 'bull_strategy': 'breakout', 'bull_bb_std_mult': 3.213859003147991, 'bull_rsi_os': 34, 'bull_rsi_ob': 57, 'bull_adx_thresh': 28.572685012928574, 'bull_atr_min_pct': 0.009999783772814363, 'bull_atr_max_pct': 0.0896643004131975, 'bull_tp_mult': 1.5014820513992082, 'bull_tsl_mult': 0.9332103518581326, 'bull_time_stop': 52, 'bull_use_sma': True, 'bull_use_ema': True, 'bull_use_atr': False, 'bull_use_adx': False, 'bull_use_spike': False, 'bull_rsi_required': False, 'bear_strategy': 'mean_reversion', 'bear_bb_std_mult': 2.3097542914238653, 'bear_rsi_os': 44, 'bear_rsi_ob': 72, 'bear_adx_thresh': 32.9777517355497, 'bear_atr_min_pct': 0.0075050745894278455, 'bear_atr_max_pct': 0.12589503622936885, 'bear_tp_mult': 2.7006318308208863, 'bear_tsl_mult': 0.7267121978839892, 'bear_time_stop': 22, 'bear_use_sma': False, 'bear_use_ema': False, 'bear_use_atr': False, 'bear_use_adx': False, 'bear_use_spike': True, 'bear_rsi_required': True, 'sideways_strategy': 'mean_reversion', 'sideways_bb_std_mult': 0.7767073969835514, 'sideways_rsi_os': 25, 'sideways_rsi_ob': 95, 'sideways_adx_thresh': 31.22911564745288, 'sideways_atr_min_pct': 0.0034802966133978346, 'sideways_atr_max_pct': 0.1024632099423185, 'sideways_tp_mult': 1.3799925569498184, 'sideways_tsl_mult': 0.6073206694358222, 'sideways_time_stop': 227, 'sideways_use_sma': False, 'sideways_use_ema': True, 'sideways_use_atr': False, 'sideways_use_adx': False, 'sideways_use_spike': False, 'sideways_rsi_required': True}.
[I 2025-09-01 10:07:01,642] Trial 389 finished with values: [-1000000000.0, 1000000000.0] and parameters: {'p_sma': 57, 'p_std': 46, 'p_atr': 10, 'p_adx': 9, 'rsi_period': 44, 'ema1': 15, 'ema2': 11, 'slip_atr_k': 0.0775669720153306, 'slip_spread_k': 0.5743831331439498, 'spread_hl_frac': 0.009406824138331982, 'bb_std_mult': 2.532235831013855, 'rsi_os': 51, 'rsi_ob': 57, 'vol_spike': 0.20022437296196677, 'adx_thresh': 11.72476416008814, 'atr_min_pct': 0.027786594004066363, 'atr_max_pct': 0.06500209264403975, 'tp_mult': 2.2429585847881124, 'tsl_mult': 0.8083352834066604, 'strategy': 'mean_reversion', 'time_stop': 139, 'use_sma': True, 'use_atr': False, 'use_adx': False, 'use_ema': False, 'use_spike': True, 'rsi_required': False, 'edge_k': 0.42922513851367655, 'edge_cap': 0.8320853024310226, 'bull_strategy': 'mean_reversion', 'bull_bb_std_mult': 3.4977763445912387, 'bull_rsi_os': 39, 'bull_rsi_ob': 73, 'bull_adx_thresh': 30.445966658151917, 'bull_atr_min_pct': 0.003905557924152111, 'bull_atr_max_pct': 0.07296961185878781, 'bull_tp_mult': 1.4962924959730035, 'bull_tsl_mult': 0.8968521770418421, 'bull_time_stop': 142, 'bull_use_sma': True, 'bull_use_ema': False, 'bull_use_atr': True, 'bull_use_adx': True, 'bull_use_spike': True, 'bull_rsi_required': False, 'bear_strategy': 'breakout', 'bear_bb_std_mult': 1.3955971844018042, 'bear_rsi_os': 31, 'bear_rsi_ob': 70, 'bear_adx_thresh': 33.94384568059472, 'bear_atr_min_pct': 0.029476979113116017, 'bear_atr_max_pct': 0.12625976169409422, 'bear_tp_mult': 2.6948537796485805, 'bear_tsl_mult': 0.786537572655281, 'bear_time_stop': 82, 'bear_use_sma': True, 'bear_use_ema': False, 'bear_use_atr': True, 'bear_use_adx': True, 'bear_use_spike': False, 'bear_rsi_required': False, 'sideways_strategy': 'breakout', 'sideways_bb_std_mult': 2.46133539968233, 'sideways_rsi_os': 27, 'sideways_rsi_ob': 95, 'sideways_adx_thresh': 21.2250513338513, 'sideways_atr_min_pct': 0.01066258922697082, 'sideways_atr_max_pct': 0.09369736229833175, 'sideways_tp_mult': 1.4138859686971985, 'sideways_tsl_mult': 0.6065981111027714, 'sideways_time_stop': 150, 'sideways_use_sma': True, 'sideways_use_ema': False, 'sideways_use_atr': False, 'sideways_use_adx': True, 'sideways_use_spike': True, 'sideways_rsi_required': False}.
[I 2025-09-01 10:07:50,920] Trial 390 finished with values: [-1000000000.0, 1000000000.0] and parameters: {'p_sma': 57, 'p_std': 46, 'p_atr': 21, 'p_adx': 9, 'rsi_period': 59, 'ema1': 11, 'ema2': 11, 'slip_atr_k': 0.0054661370903206444, 'slip_spread_k': 0.5742140216645979, 'spread_hl_frac': 0.03498442704006388, 'bb_std_mult': 2.4655125528287347, 'rsi_os': 9, 'rsi_ob': 57, 'vol_spike': 0.20086645692862212, 'adx_thresh': 10.996114479446911, 'atr_min_pct': 0.0038582257598400414, 'atr_max_pct': 0.07356145378627625, 'tp_mult': 1.6314927091669773, 'tsl_mult': 0.7147985239152069, 'strategy': 'mean_reversion', 'time_stop': 193, 'use_sma': True, 'use_atr': False, 'use_adx': False, 'use_ema': False, 'use_spike': True, 'rsi_required': False, 'edge_k': 1.6413937747756544, 'edge_cap': 0.8428190436759972, 'bull_strategy': 'mean_reversion', 'bull_bb_std_mult': 3.4796062639896905, 'bull_rsi_os': 39, 'bull_rsi_ob': 83, 'bull_adx_thresh': 28.0125790773721, 'bull_atr_min_pct': 0.018393195705065094, 'bull_atr_max_pct': 0.07355352350989418, 'bull_tp_mult': 1.5041906686329838, 'bull_tsl_mult': 0.9067237413004775, 'bull_time_stop': 141, 'bull_use_sma': True, 'bull_use_ema': False, 'bull_use_atr': True, 'bull_use_adx': True, 'bull_use_spike': True, 'bull_rsi_required': False, 'bear_strategy': 'breakout', 'bear_bb_std_mult': 1.4280096726964497, 'bear_rsi_os': 51, 'bear_rsi_ob': 70, 'bear_adx_thresh': 34.997887896839686, 'bear_atr_min_pct': 0.028377506156489467, 'bear_atr_max_pct': 0.12006885805971099, 'bear_tp_mult': 2.95024800679464, 'bear_tsl_mult': 0.06639164444436585, 'bear_time_stop': 12, 'bear_use_sma': True, 'bear_use_ema': False, 'bear_use_atr': True, 'bear_use_adx': True, 'bear_use_spike': False, 'bear_rsi_required': False, 'sideways_strategy': 'breakout', 'sideways_bb_std_mult': 2.5075245068187457, 'sideways_rsi_os': 7, 'sideways_rsi_ob': 53, 'sideways_adx_thresh': 29.70806236649767, 'sideways_atr_min_pct': 0.011158886793433576, 'sideways_atr_max_pct': 0.09337784625381809, 'sideways_tp_mult': 1.4036405866007393, 'sideways_tsl_mult': 0.9368672003029904, 'sideways_time_stop': 81, 'sideways_use_sma': True, 'sideways_use_ema': False, 'sideways_use_atr': False, 'sideways_use_adx': True, 'sideways_use_spike': True, 'sideways_rsi_required': False}.
[I 2025-09-01 10:07:51,491] Trial 391 finished with values: [-0.000673356710915507, 0.005043582257344814] and parameters: {'p_sma': 58, 'p_std': 25, 'p_atr': 10, 'p_adx': 25, 'rsi_period': 41, 'ema1': 5, 'ema2': 11, 'slip_atr_k': 0.004477294003757503, 'slip_spread_k': 0.07722938498443499, 'spread_hl_frac': 0.009210510615174743, 'bb_std_mult': 2.4380398839306525, 'rsi_os': 26, 'rsi_ob': 90, 'vol_spike': 0.014929675830470612, 'adx_thresh': 10.620990175983964, 'atr_min_pct': 0.019347287022591204, 'atr_max_pct': 0.06219023603203788, 'tp_mult': 2.4975930944539493, 'tsl_mult': 0.8047905256113692, 'strategy': 'mean_reversion', 'time_stop': 283, 'use_sma': True, 'use_atr': True, 'use_adx': False, 'use_ema': False, 'use_spike': True, 'rsi_required': False, 'edge_k': 0.7183961944594831, 'edge_cap': 0.8113287088284784, 'bull_strategy': 'mean_reversion', 'bull_bb_std_mult': 3.472590418663679, 'bull_rsi_os': 39, 'bull_rsi_ob': 77, 'bull_adx_thresh': 19.054192018512474, 'bull_atr_min_pct': 0.003822124948793189, 'bull_atr_max_pct': 0.07798854828996236, 'bull_tp_mult': 2.5494400640280794, 'bull_tsl_mult': 0.2742713885543529, 'bull_time_stop': 294, 'bull_use_sma': True, 'bull_use_ema': False, 'bull_use_atr': True, 'bull_use_adx': False, 'bull_use_spike': True, 'bull_rsi_required': False, 'bear_strategy': 'breakout', 'bear_bb_std_mult': 3.590853010098509, 'bear_rsi_os': 45, 'bear_rsi_ob': 55, 'bear_adx_thresh': 29.781655436859523, 'bear_atr_min_pct': 0.0039560811568034576, 'bear_atr_max_pct': 0.12085154512629237, 'bear_tp_mult': 2.822164003632282, 'bear_tsl_mult': 0.05344734321798095, 'bear_time_stop': 176, 'bear_use_sma': False, 'bear_use_ema': False, 'bear_use_atr': True, 'bear_use_adx': True, 'bear_use_spike': False, 'bear_rsi_required': False, 'sideways_strategy': 'breakout', 'sideways_bb_std_mult': 2.558968870922029, 'sideways_rsi_os': 55, 'sideways_rsi_ob': 69, 'sideways_adx_thresh': 19.72570695374166, 'sideways_atr_min_pct': 0.009648729539774786, 'sideways_atr_max_pct': 0.09264170060276425, 'sideways_tp_mult': 1.3366559895651609, 'sideways_tsl_mult': 0.48701625889205286, 'sideways_time_stop': 100, 'sideways_use_sma': True, 'sideways_use_ema': False, 'sideways_use_atr': False, 'sideways_use_adx': True, 'sideways_use_spike': True, 'sideways_rsi_required': False}.
[I 2025-09-01 10:07:51,868] Trial 393 finished with values: [-1000000000.0, 1000000000.0] and parameters: {'p_sma': 20, 'p_std': 52, 'p_atr': 20, 'p_adx': 11, 'rsi_period': 13, 'ema1': 8, 'ema2': 13, 'slip_atr_k': 0.0036387147693520408, 'slip_spread_k': 0.5757650129868913, 'spread_hl_frac': 0.03208578783244863, 'bb_std_mult': 2.4518530619807684, 'rsi_os': 39, 'rsi_ob': 76, 'vol_spike': 0.1962929958374217, 'adx_thresh': 10.87861637980046, 'atr_min_pct': 0.02312826790184647, 'atr_max_pct': 0.062249806280335634, 'tp_mult': 2.7353200889400644, 'tsl_mult': 0.8272942140628187, 'strategy': 'mean_reversion', 'time_stop': 125, 'use_sma': True, 'use_atr': True, 'use_adx': True, 'use_ema': False, 'use_spike': True, 'rsi_required': False, 'edge_k': 1.6832145205407096, 'edge_cap': 0.8105612459840716, 'bull_strategy': 'mean_reversion', 'bull_bb_std_mult': 2.6561981312494725, 'bull_rsi_os': 52, 'bull_rsi_ob': 81, 'bull_adx_thresh': 26.988492295297085, 'bull_atr_min_pct': 0.018151191123636775, 'bull_atr_max_pct': 0.10488577338534216, 'bull_tp_mult': 2.0666705299176606, 'bull_tsl_mult': 0.9619635086384856, 'bull_time_stop': 132, 'bull_use_sma': True, 'bull_use_ema': False, 'bull_use_atr': True, 'bull_use_adx': False, 'bull_use_spike': True, 'bull_rsi_required': True, 'bear_strategy': 'breakout', 'bear_bb_std_mult': 2.1320992833909282, 'bear_rsi_os': 50, 'bear_rsi_ob': 73, 'bear_adx_thresh': 34.57561063306981, 'bear_atr_min_pct': 0.004015909656460193, 'bear_atr_max_pct': 0.035840284990994044, 'bear_tp_mult': 1.8513439195261399, 'bear_tsl_mult': 0.06210823340308674, 'bear_time_stop': 10, 'bear_use_sma': False, 'bear_use_ema': True, 'bear_use_atr': True, 'bear_use_adx': True, 'bear_use_spike': False, 'bear_rsi_required': False, 'sideways_strategy': 'breakout', 'sideways_bb_std_mult': 2.5934616552160845, 'sideways_rsi_os': 55, 'sideways_rsi_ob': 61, 'sideways_adx_thresh': 29.876776957686367, 'sideways_atr_min_pct': 0.020962876708092545, 'sideways_atr_max_pct': 0.07957822572520211, 'sideways_tp_mult': 1.3318052268005633, 'sideways_tsl_mult': 0.9420579503563573, 'sideways_time_stop': 283, 'sideways_use_sma': True, 'sideways_use_ema': False, 'sideways_use_atr': True, 'sideways_use_adx': True, 'sideways_use_spike': True, 'sideways_rsi_required': False}.
[I 2025-09-01 10:07:52,190] Trial 392 finished with values: [-0.013458552972815396, 0.013123876094524766] and parameters: {'p_sma': 20, 'p_std': 41, 'p_atr': 10, 'p_adx': 9, 'rsi_period': 43, 'ema1': 8, 'ema2': 11, 'slip_atr_k': 0.13818030117130106, 'slip_spread_k': 0.5738415852678896, 'spread_hl_frac': 0.009220540156371356, 'bb_std_mult': 2.516645085539625, 'rsi_os': 26, 'rsi_ob': 63, 'vol_spike': 0.19945050553955557, 'adx_thresh': 6.046874157443506, 'atr_min_pct': 0.019389357434077104, 'atr_max_pct': 0.06467084921780641, 'tp_mult': 2.483536690303067, 'tsl_mult': 0.04088710253482092, 'strategy': 'mean_reversion', 'time_stop': 140, 'use_sma': True, 'use_atr': True, 'use_adx': True, 'use_ema': False, 'use_spike': True, 'rsi_required': False, 'edge_k': 0.4889121293268406, 'edge_cap': 0.8126376175814845, 'bull_strategy': 'mean_reversion', 'bull_bb_std_mult': 3.4710472905731966, 'bull_rsi_os': 38, 'bull_rsi_ob': 66, 'bull_adx_thresh': 19.188892147726204, 'bull_atr_min_pct': 0.003496925851315999, 'bull_atr_max_pct': 0.08045205541297885, 'bull_tp_mult': 1.1112549357471622, 'bull_tsl_mult': 0.868776875077343, 'bull_time_stop': 140, 'bull_use_sma': True, 'bull_use_ema': False, 'bull_use_atr': True, 'bull_use_adx': False, 'bull_use_spike': True, 'bull_rsi_required': True, 'bear_strategy': 'breakout', 'bear_bb_std_mult': 2.8379496045796833, 'bear_rsi_os': 45, 'bear_rsi_ob': 73, 'bear_adx_thresh': 34.9305877861973, 'bear_atr_min_pct': 0.018069747608458486, 'bear_atr_max_pct': 0.1494823306442294, 'bear_tp_mult': 1.6331392777251468, 'bear_tsl_mult': 0.8553175688336757, 'bear_time_stop': 10, 'bear_use_sma': False, 'bear_use_ema': True, 'bear_use_atr': True, 'bear_use_adx': True, 'bear_use_spike': False, 'bear_rsi_required': False, 'sideways_strategy': 'breakout', 'sideways_bb_std_mult': 2.5935599817114663, 'sideways_rsi_os': 27, 'sideways_rsi_ob': 61, 'sideways_adx_thresh': 26.357558947976237, 'sideways_atr_min_pct': 0.005226160298278128, 'sideways_atr_max_pct': 0.0913552596304479, 'sideways_tp_mult': 1.3337763064914792, 'sideways_tsl_mult': 0.9390823517260695, 'sideways_time_stop': 97, 'sideways_use_sma': True, 'sideways_use_ema': False, 'sideways_use_atr': True, 'sideways_use_adx': True, 'sideways_use_spike': True, 'sideways_rsi_required': False}.
[I 2025-09-01 10:08:36,452] Trial 396 finished with values: [-0.005764174635847996, 0.006555663310361352] and parameters: {'p_sma': 60, 'p_std': 48, 'p_atr': 29, 'p_adx': 25, 'rsi_period': 25, 'ema1': 8, 'ema2': 10, 'slip_atr_k': 0.017240118371917856, 'slip_spread_k': 0.5276539300686547, 'spread_hl_frac': 1.0769242417444508e-05, 'bb_std_mult': 2.995651357448497, 'rsi_os': 6, 'rsi_ob': 95, 'vol_spike': 0.015426040656014717, 'adx_thresh': 5.790798354997227, 'atr_min_pct': 0.01906747152599132, 'atr_max_pct': 0.09393037754699937, 'tp_mult': 2.505562551392567, 'tsl_mult': 0.08248047934987474, 'strategy': 'breakout', 'time_stop': 151, 'use_sma': True, 'use_atr': True, 'use_adx': True, 'use_ema': False, 'use_spike': True, 'rsi_required': False, 'edge_k': 0.4847365182352116, 'edge_cap': 0.8166902395287979, 'bull_strategy': 'mean_reversion', 'bull_bb_std_mult': 0.6583629408072529, 'bull_rsi_os': 37, 'bull_rsi_ob': 77, 'bull_adx_thresh': 29.04758944773937, 'bull_atr_min_pct': 0.0015292285471522771, 'bull_atr_max_pct': 0.0807316791436604, 'bull_tp_mult': 1.569546216627786, 'bull_tsl_mult': 0.8626312724133975, 'bull_time_stop': 294, 'bull_use_sma': False, 'bull_use_ema': False, 'bull_use_atr': True, 'bull_use_adx': False, 'bull_use_spike': True, 'bull_rsi_required': True, 'bear_strategy': 'breakout', 'bear_bb_std_mult': 1.5133045946591608, 'bear_rsi_os': 46, 'bear_rsi_ob': 86, 'bear_adx_thresh': 33.51695032340923, 'bear_atr_min_pct': 0.006138843827889319, 'bear_atr_max_pct': 0.13316051585984628, 'bear_tp_mult': 2.82789605518758, 'bear_tsl_mult': 0.8079114957620563, 'bear_time_stop': 178, 'bear_use_sma': False, 'bear_use_ema': True, 'bear_use_atr': True, 'bear_use_adx': True, 'bear_use_spike': True, 'bear_rsi_required': False, 'sideways_strategy': 'mean_reversion', 'sideways_bb_std_mult': 2.56777942382852, 'sideways_rsi_os': 21, 'sideways_rsi_ob': 60, 'sideways_adx_thresh': 12.9949332399962, 'sideways_atr_min_pct': 0.001421109968759118, 'sideways_atr_max_pct': 0.13098385407838173, 'sideways_tp_mult': 2.311863973165714, 'sideways_tsl_mult': 0.4491053187167536, 'sideways_time_stop': 238, 'sideways_use_sma': True, 'sideways_use_ema': False, 'sideways_use_atr': False, 'sideways_use_adx': False, 'sideways_use_spike': True, 'sideways_rsi_required': False}.
[I 2025-09-01 10:08:36,443] Trial 395 finished with values: [-1000000000.0, 1000000000.0] and parameters: {'p_sma': 60, 'p_std': 41, 'p_atr': 29, 'p_adx': 11, 'rsi_period': 82, 'ema1': 25, 'ema2': 48, 'slip_atr_k': 0.016108613259828118, 'slip_spread_k': 0.525965184520633, 'spread_hl_frac': 0.03240579779164614, 'bb_std_mult': 2.746793665836312, 'rsi_os': 33, 'rsi_ob': 90, 'vol_spike': 0.19383577515083147, 'adx_thresh': 19.985073678709178, 'atr_min_pct': 0.02634168935728714, 'atr_max_pct': 0.09306979949232619, 'tp_mult': 2.3458615417865447, 'tsl_mult': 0.10624370057107269, 'strategy': 'breakout', 'time_stop': 125, 'use_sma': True, 'use_atr': True, 'use_adx': True, 'use_ema': False, 'use_spike': True, 'rsi_required': False, 'edge_k': 0.48143300050885685, 'edge_cap': 0.2608351753073354, 'bull_strategy': 'mean_reversion', 'bull_bb_std_mult': 3.4095799928013264, 'bull_rsi_os': 37, 'bull_rsi_ob': 81, 'bull_adx_thresh': 27.070071370137565, 'bull_atr_min_pct': 0.012089207572027194, 'bull_atr_max_pct': 0.1475312281494971, 'bull_tp_mult': 2.0585322456930615, 'bull_tsl_mult': 0.8724385397435233, 'bull_time_stop': 132, 'bull_use_sma': True, 'bull_use_ema': False, 'bull_use_atr': True, 'bull_use_adx': False, 'bull_use_spike': True, 'bull_rsi_required': True, 'bear_strategy': 'breakout', 'bear_bb_std_mult': 3.0278553438221447, 'bear_rsi_os': 53, 'bear_rsi_ob': 55, 'bear_adx_thresh': 34.295027050404045, 'bear_atr_min_pct': 0.004163062348942365, 'bear_atr_max_pct': 0.13358815035700797, 'bear_tp_mult': 2.837170229333874, 'bear_tsl_mult': 0.8507183945687318, 'bear_time_stop': 30, 'bear_use_sma': False, 'bear_use_ema': True, 'bear_use_atr': True, 'bear_use_adx': True, 'bear_use_spike': True, 'bear_rsi_required': False, 'sideways_strategy': 'mean_reversion', 'sideways_bb_std_mult': 2.599383077970126, 'sideways_rsi_os': 28, 'sideways_rsi_ob': 69, 'sideways_adx_thresh': 27.06020484904042, 'sideways_atr_min_pct': 0.001420296297682663, 'sideways_atr_max_pct': 0.13678250740437314, 'sideways_tp_mult': 1.3169120785934278, 'sideways_tsl_mult': 0.44991871802460404, 'sideways_time_stop': 206, 'sideways_use_sma': True, 'sideways_use_ema': False, 'sideways_use_atr': True, 'sideways_use_adx': False, 'sideways_use_spike': True, 'sideways_rsi_required': False}.
