[I 2025-09-01 09:23:29,127] Trial 136 finished with values: [-1000000000.0, 1000000000.0] and parameters: {'p_sma': 7, 'p_std': 34, 'p_atr': 27, 'p_adx': 11, 'rsi_period': 42, 'ema1': 9, 'ema2': 12, 'slip_atr_k': 0.13084605692327916, 'slip_spread_k': 0.45235495332630776, 'spread_hl_frac': 0.019211716108417747, 'bb_std_mult': 1.9788137147556908, 'rsi_os': 41, 'rsi_ob': 57, 'vol_spike': 0.15884771720224303, 'adx_thresh': 10.43050119992729, 'atr_min_pct': 0.009997461461097697, 'atr_max_pct': 0.015035083810696343, 'tp_mult': 2.5019792193694417, 'tsl_mult': 0.448954377387493, 'strategy': 'mean_reversion', 'time_stop': 148, 'use_sma': True, 'use_atr': True, 'use_adx': False, 'use_ema': False, 'use_spike': True, 'rsi_required': False, 'edge_k': 0.5242540752546873, 'edge_cap': 0.3227169661112996, 'bull_strategy': 'mean_reversion', 'bull_bb_std_mult': 1.7115217000707303, 'bull_rsi_os': 47, 'bull_rsi_ob': 72, 'bull_adx_thresh': 15.831663104528664, 'bull_atr_min_pct': 0.024085475205334456, 'bull_atr_max_pct': 0.03367997325615663, 'bull_tp_mult': 2.491573937590543, 'bull_tsl_mult': 0.5461502171076954, 'bull_time_stop': 91, 'bull_use_sma': False, 'bull_use_ema': False, 'bull_use_atr': False, 'bull_use_adx': False, 'bull_use_spike': False, 'bull_rsi_required': False, 'bear_strategy': 'mean_reversion', 'bear_bb_std_mult': 1.3336374883546032, 'bear_rsi_os': 30, 'bear_rsi_ob': 55, 'bear_adx_thresh': 15.695128014899431, 'bear_atr_min_pct': 0.02765157119028572, 'bear_atr_max_pct': 0.06204302439634336, 'bear_tp_mult': 1.5994858499261058, 'bear_tsl_mult': 0.7726646732665182, 'bear_time_stop': 291, 'bear_use_sma': False, 'bear_use_ema': False, 'bear_use_atr': True, 'bear_use_adx': True, 'bear_use_spike': True, 'bear_rsi_required': True, 'sideways_strategy': 'breakout', 'sideways_bb_std_mult': 2.10938607652681, 'sideways_rsi_os': 23, 'sideways_rsi_ob': 59, 'sideways_adx_thresh': 32.64409662191129, 'sideways_atr_min_pct': 0.0032044762242708184, 'sideways_atr_max_pct': 0.08765037750900145, 'sideways_tp_mult': 1.3812054426638407, 'sideways_tsl_mult': 0.8197978971051667, 'sideways_time_stop': 251, 'sideways_use_sma': True, 'sideways_use_ema': False, 'sideways_use_atr': True, 'sideways_use_adx': True, 'sideways_use_spike': False, 'sideways_rsi_required': True}.
[I 2025-09-01 09:23:29,335] Trial 134 finished with values: [-0.006406301382538393, 0.00696405558331312] and parameters: {'p_sma': 57, 'p_std': 39, 'p_atr': 27, 'p_adx': 10, 'rsi_period': 41, 'ema1': 22, 'ema2': 12, 'slip_atr_k': 0.032463661520620885, 'slip_spread_k': 0.71166674148976, 'spread_hl_frac': 0.02043748976166292, 'bb_std_mult': 1.3634575194245682, 'rsi_os': 44, 'rsi_ob': 58, 'vol_spike': 0.11633601467378601, 'adx_thresh': 17.08502139125537, 'atr_min_pct': 0.029854894874429255, 'atr_max_pct': 0.07066859345397387, 'tp_mult': 2.387714844178638, 'tsl_mult': 0.39546217135798306, 'strategy': 'mean_reversion', 'time_stop': 153, 'use_sma': True, 'use_atr': True, 'use_adx': False, 'use_ema': False, 'use_spike': True, 'rsi_required': False, 'edge_k': 0.5065106827857382, 'edge_cap': 0.22170528076960477, 'bull_strategy': 'mean_reversion', 'bull_bb_std_mult': 1.7809119812125074, 'bull_rsi_os': 38, 'bull_rsi_ob': 84, 'bull_adx_thresh': 7.934436751242302, 'bull_atr_min_pct': 0.009216572743944499, 'bull_atr_max_pct': 0.03186023206667341, 'bull_tp_mult': 2.4930459164865173, 'bull_tsl_mult': 0.47559486520377453, 'bull_time_stop': 287, 'bull_use_sma': False, 'bull_use_ema': False, 'bull_use_atr': True, 'bull_use_adx': False, 'bull_use_spike': True, 'bull_rsi_required': False, 'bear_strategy': 'breakout', 'bear_bb_std_mult': 1.4063153207279087, 'bear_rsi_os': 27, 'bear_rsi_ob': 89, 'bear_adx_thresh': 15.712730229085954, 'bear_atr_min_pct': 0.027961124780987084, 'bear_atr_max_pct': 0.014871754157546976, 'bear_tp_mult': 2.973467306664798, 'bear_tsl_mult': 0.8382384683795752, 'bear_time_stop': 138, 'bear_use_sma': False, 'bear_use_ema': False, 'bear_use_atr': True, 'bear_use_adx': True, 'bear_use_spike': False, 'bear_rsi_required': False, 'sideways_strategy': 'mean_reversion', 'sideways_bb_std_mult': 1.0250707809601878, 'sideways_rsi_os': 34, 'sideways_rsi_ob': 80, 'sideways_adx_thresh': 24.02719085991112, 'sideways_atr_min_pct': 0.0032170594513763638, 'sideways_atr_max_pct': 0.14435194767242918, 'sideways_tp_mult': 2.155322965612505, 'sideways_tsl_mult': 0.8227051269699741, 'sideways_time_stop': 209, 'sideways_use_sma': True, 'sideways_use_ema': False, 'sideways_use_atr': False, 'sideways_use_adx': False, 'sideways_use_spike': False, 'sideways_rsi_required': False}.
[I 2025-09-01 09:23:29,757] Trial 137 finished with values: [-1000000000.0, 1000000000.0] and parameters: {'p_sma': 27, 'p_std': 34, 'p_atr': 27, 'p_adx': 11, 'rsi_period': 43, 'ema1': 9, 'ema2': 11, 'slip_atr_k': 0.12815180875919838, 'slip_spread_k': 0.46015791860411165, 'spread_hl_frac': 0.018720934224184516, 'bb_std_mult': 2.0433481939281615, 'rsi_os': 21, 'rsi_ob': 77, 'vol_spike': 0.1180426538980016, 'adx_thresh': 19.018363624973368, 'atr_min_pct': 0.02445196155363653, 'atr_max_pct': 0.01459805410266026, 'tp_mult': 2.377287299993111, 'tsl_mult': 0.4428847969591735, 'strategy': 'mean_reversion', 'time_stop': 62, 'use_sma': False, 'use_atr': True, 'use_adx': False, 'use_ema': True, 'use_spike': False, 'rsi_required': True, 'edge_k': 1.1353497075662284, 'edge_cap': 0.31475967185348247, 'bull_strategy': 'breakout', 'bull_bb_std_mult': 1.0894526315230153, 'bull_rsi_os': 31, 'bull_rsi_ob': 72, 'bull_adx_thresh': 23.44848734685352, 'bull_atr_min_pct': 0.011177558159772116, 'bull_atr_max_pct': 0.03718281425021421, 'bull_tp_mult': 2.3747854199452725, 'bull_tsl_mult': 0.5034907799227415, 'bull_time_stop': 263, 'bull_use_sma': False, 'bull_use_ema': True, 'bull_use_atr': False, 'bull_use_adx': False, 'bull_use_spike': False, 'bull_rsi_required': False, 'bear_strategy': 'mean_reversion', 'bear_bb_std_mult': 1.306192861738389, 'bear_rsi_os': 51, 'bear_rsi_ob': 55, 'bear_adx_thresh': 14.375499837194262, 'bear_atr_min_pct': 0.01691597225070704, 'bear_atr_max_pct': 0.11429880941869594, 'bear_tp_mult': 1.439533770258256, 'bear_tsl_mult': 0.7770827551393312, 'bear_time_stop': 289, 'bear_use_sma': False, 'bear_use_ema': False, 'bear_use_atr': True, 'bear_use_adx': True, 'bear_use_spike': True, 'bear_rsi_required': True, 'sideways_strategy': 'breakout', 'sideways_bb_std_mult': 2.2860074326759743, 'sideways_rsi_os': 16, 'sideways_rsi_ob': 59, 'sideways_adx_thresh': 23.846779713720842, 'sideways_atr_min_pct': 0.002811012178525704, 'sideways_atr_max_pct': 0.08816265502104745, 'sideways_tp_mult': 1.3707979921818594, 'sideways_tsl_mult': 0.8175292842320948, 'sideways_time_stop': 248, 'sideways_use_sma': True, 'sideways_use_ema': False, 'sideways_use_atr': True, 'sideways_use_adx': True, 'sideways_use_spike': False, 'sideways_rsi_required': True}.
[I 2025-09-01 09:23:29,763] Trial 140 finished with values: [-1000000000.0, 1000000000.0] and parameters: {'p_sma': 55, 'p_std': 38, 'p_atr': 29, 'p_adx': 8, 'rsi_period': 43, 'ema1': 21, 'ema2': 11, 'slip_atr_k': 0.08395476282667583, 'slip_spread_k': 0.236107795171373, 'spread_hl_frac': 0.014064137059805264, 'bb_std_mult': 3.2730693629388985, 'rsi_os': 40, 'rsi_ob': 55, 'vol_spike': 0.11509049046594327, 'adx_thresh': 17.24786396257855, 'atr_min_pct': 0.02980824947640366, 'atr_max_pct': 0.029199536231494072, 'tp_mult': 2.0883899946195545, 'tsl_mult': 0.7547945625207884, 'strategy': 'breakout', 'time_stop': 202, 'use_sma': False, 'use_atr': True, 'use_adx': False, 'use_ema': True, 'use_spike': False, 'rsi_required': True, 'edge_k': 1.5097854741619376, 'edge_cap': 0.35898770367476945, 'bull_strategy': 'breakout', 'bull_bb_std_mult': 1.7973808573414913, 'bull_rsi_os': 34, 'bull_rsi_ob': 63, 'bull_adx_thresh': 32.09342821459035, 'bull_atr_min_pct': 0.0048957694114372344, 'bull_atr_max_pct': 0.1343936345115097, 'bull_tp_mult': 2.5334542489737597, 'bull_tsl_mult': 0.954481726164251, 'bull_time_stop': 290, 'bull_use_sma': True, 'bull_use_ema': True, 'bull_use_atr': False, 'bull_use_adx': False, 'bull_use_spike': False, 'bull_rsi_required': False, 'bear_strategy': 'breakout', 'bear_bb_std_mult': 1.4670449552913942, 'bear_rsi_os': 51, 'bear_rsi_ob': 59, 'bear_adx_thresh': 17.70815554803894, 'bear_atr_min_pct': 0.01129476581325514, 'bear_atr_max_pct': 0.11467475882135268, 'bear_tp_mult': 1.4800941954866524, 'bear_tsl_mult': 0.8511274372820503, 'bear_time_stop': 222, 'bear_use_sma': True, 'bear_use_ema': True, 'bear_use_atr': True, 'bear_use_adx': False, 'bear_use_spike': True, 'bear_rsi_required': True, 'sideways_strategy': 'mean_reversion', 'sideways_bb_std_mult': 1.9183895674906517, 'sideways_rsi_os': 32, 'sideways_rsi_ob': 80, 'sideways_adx_thresh': 6.744137392950785, 'sideways_atr_min_pct': 0.014653760568998982, 'sideways_atr_max_pct': 0.09283444002635348, 'sideways_tp_mult': 1.4246878010257273, 'sideways_tsl_mult': 0.7641933919313725, 'sideways_time_stop': 226, 'sideways_use_sma': True, 'sideways_use_ema': True, 'sideways_use_atr': True, 'sideways_use_adx': False, 'sideways_use_spike': True, 'sideways_rsi_required': True}.
[I 2025-09-01 09:23:29,794] Trial 139 finished with values: [-1000000000.0, 1000000000.0] and parameters: {'p_sma': 27, 'p_std': 38, 'p_atr': 28, 'p_adx': 10, 'rsi_period': 18, 'ema1': 23, 'ema2': 43, 'slip_atr_k': 0.08112367004752245, 'slip_spread_k': 0.2420967933013944, 'spread_hl_frac': 0.04178055694265761, 'bb_std_mult': 0.528347272104315, 'rsi_os': 22, 'rsi_ob': 82, 'vol_spike': 0.11666766772845048, 'adx_thresh': 24.365565099396196, 'atr_min_pct': 0.029707459643014453, 'atr_max_pct': 0.02884121216265502, 'tp_mult': 2.277543874966458, 'tsl_mult': 0.65655412959698, 'strategy': 'breakout', 'time_stop': 105, 'use_sma': False, 'use_atr': True, 'use_adx': True, 'use_ema': True, 'use_spike': False, 'rsi_required': True, 'edge_k': 0.37977194027124406, 'edge_cap': 0.3598234338679235, 'bull_strategy': 'breakout', 'bull_bb_std_mult': 2.1050582775049764, 'bull_rsi_os': 30, 'bull_rsi_ob': 63, 'bull_adx_thresh': 24.03857534320443, 'bull_atr_min_pct': 0.009360813123740293, 'bull_atr_max_pct': 0.13307047929821886, 'bull_tp_mult': 2.1630890416474506, 'bull_tsl_mult': 0.5070023426918613, 'bull_time_stop': 262, 'bull_use_sma': True, 'bull_use_ema': True, 'bull_use_atr': True, 'bull_use_adx': False, 'bull_use_spike': True, 'bull_rsi_required': False, 'bear_strategy': 'breakout', 'bear_bb_std_mult': 1.468918458623737, 'bear_rsi_os': 32, 'bear_rsi_ob': 53, 'bear_adx_thresh': 14.269096015700416, 'bear_atr_min_pct': 0.011013837746173271, 'bear_atr_max_pct': 0.11769228624398305, 'bear_tp_mult': 2.9648495234537595, 'bear_tsl_mult': 0.7459408915102049, 'bear_time_stop': 60, 'bear_use_sma': True, 'bear_use_ema': True, 'bear_use_atr': False, 'bear_use_adx': True, 'bear_use_spike': False, 'bear_rsi_required': False, 'sideways_strategy': 'mean_reversion', 'sideways_bb_std_mult': 0.9265061142493809, 'sideways_rsi_os': 28, 'sideways_rsi_ob': 57, 'sideways_adx_thresh': 23.61036047648608, 'sideways_atr_min_pct': 0.01820533461703619, 'sideways_atr_max_pct': 0.09295790333291425, 'sideways_tp_mult': 2.6089548071925215, 'sideways_tsl_mult': 0.7720606167501357, 'sideways_time_stop': 37, 'sideways_use_sma': False, 'sideways_use_ema': False, 'sideways_use_atr': False, 'sideways_use_adx': False, 'sideways_use_spike': True, 'sideways_rsi_required': False}.
[I 2025-09-01 09:24:07,638] Trial 138 finished with values: [-1000000000.0, 1000000000.0] and parameters: {'p_sma': 56, 'p_std': 35, 'p_atr': 27, 'p_adx': 22, 'rsi_period': 43, 'ema1': 9, 'ema2': 39, 'slip_atr_k': 0.014079135089790964, 'slip_spread_k': 0.45354374009406806, 'spread_hl_frac': 0.0419220854767514, 'bb_std_mult': 3.4927621610271533, 'rsi_os': 40, 'rsi_ob': 55, 'vol_spike': 0.11745579810517691, 'adx_thresh': 10.315601017871932, 'atr_min_pct': 0.018749282846162434, 'atr_max_pct': 0.1275973219258989, 'tp_mult': 2.485727370298765, 'tsl_mult': 0.6529767586082104, 'strategy': 'breakout', 'time_stop': 102, 'use_sma': False, 'use_atr': True, 'use_adx': False, 'use_ema': True, 'use_spike': False, 'rsi_required': True, 'edge_k': 1.2771239635515697, 'edge_cap': 0.22690486294470458, 'bull_strategy': 'breakout', 'bull_bb_std_mult': 1.8013251731941127, 'bull_rsi_os': 26, 'bull_rsi_ob': 59, 'bull_adx_thresh': 23.443150118013452, 'bull_atr_min_pct': 0.009504114362571911, 'bull_atr_max_pct': 0.033456532546058876, 'bull_tp_mult': 2.1518601727122713, 'bull_tsl_mult': 0.44511064678891965, 'bull_time_stop': 118, 'bull_use_sma': True, 'bull_use_ema': True, 'bull_use_atr': False, 'bull_use_adx': False, 'bull_use_spike': False, 'bull_rsi_required': False, 'bear_strategy': 'breakout', 'bear_bb_std_mult': 1.4683783721225516, 'bear_rsi_os': 55, 'bear_rsi_ob': 60, 'bear_adx_thresh': 16.139775582913913, 'bear_atr_min_pct': 0.02784686310837223, 'bear_atr_max_pct': 0.11505996777844324, 'bear_tp_mult': 1.0877149735475506, 'bear_tsl_mult': 0.7502345797158961, 'bear_time_stop': 242, 'bear_use_sma': False, 'bear_use_ema': True, 'bear_use_atr': True, 'bear_use_adx': True, 'bear_use_spike': True, 'bear_rsi_required': True, 'sideways_strategy': 'mean_reversion', 'sideways_bb_std_mult': 2.111825861715845, 'sideways_rsi_os': 32, 'sideways_rsi_ob': 59, 'sideways_adx_thresh': 24.05169966094456, 'sideways_atr_min_pct': 0.003196555482496118, 'sideways_atr_max_pct': 0.09712528089567062, 'sideways_tp_mult': 2.0302678167893107, 'sideways_tsl_mult': 0.7683801958190877, 'sideways_time_stop': 249, 'sideways_use_sma': False, 'sideways_use_ema': False, 'sideways_use_atr': True, 'sideways_use_adx': False, 'sideways_use_spike': True, 'sideways_rsi_required': True}.
[I 2025-09-01 09:24:11,358] Trial 143 finished with values: [-1000000000.0, 1000000000.0] and parameters: {'p_sma': 52, 'p_std': 32, 'p_atr': 29, 'p_adx': 18, 'rsi_period': 8, 'ema1': 18, 'ema2': 19, 'slip_atr_k': 0.06550881517146812, 'slip_spread_k': 0.30441981611474944, 'spread_hl_frac': 0.023925497658479313, 'bb_std_mult': 2.743559260555095, 'rsi_os': 9, 'rsi_ob': 91, 'vol_spike': 0.12870123788662696, 'adx_thresh': 9.450535722551885, 'atr_min_pct': 0.011966216231519583, 'atr_max_pct': 0.12800064907820446, 'tp_mult': 2.769308569059932, 'tsl_mult': 0.4773172025860114, 'strategy': 'mean_reversion', 'time_stop': 152, 'use_sma': True, 'use_atr': False, 'use_adx': False, 'use_ema': False, 'use_spike': True, 'rsi_required': False, 'edge_k': 1.2558440757561513, 'edge_cap': 0.38991712094068287, 'bull_strategy': 'mean_reversion', 'bull_bb_std_mult': 1.9131473128108092, 'bull_rsi_os': 36, 'bull_rsi_ob': 75, 'bull_adx_thresh': 17.749916018621487, 'bull_atr_min_pct': 0.006383069876280487, 'bull_atr_max_pct': 0.10495885247907517, 'bull_tp_mult': 1.9715807514146264, 'bull_tsl_mult': 0.4508670243547121, 'bull_time_stop': 172, 'bull_use_sma': False, 'bull_use_ema': False, 'bull_use_atr': True, 'bull_use_adx': False, 'bull_use_spike': True, 'bull_rsi_required': True, 'bear_strategy': 'breakout', 'bear_bb_std_mult': 1.3854137372684185, 'bear_rsi_os': 19, 'bear_rsi_ob': 49, 'bear_adx_thresh': 16.562783773786233, 'bear_atr_min_pct': 0.02647047169376991, 'bear_atr_max_pct': 0.10496546358392472, 'bear_tp_mult': 1.1171512272048383, 'bear_tsl_mult': 0.802025905693049, 'bear_time_stop': 212, 'bear_use_sma': False, 'bear_use_ema': False, 'bear_use_atr': True, 'bear_use_adx': False, 'bear_use_spike': False, 'bear_rsi_required': False, 'sideways_strategy': 'mean_reversion', 'sideways_bb_std_mult': 1.4224516675675996, 'sideways_rsi_os': 26, 'sideways_rsi_ob': 54, 'sideways_adx_thresh': 11.402919550212161, 'sideways_atr_min_pct': 0.005760126518852996, 'sideways_atr_max_pct': 0.10708304542579697, 'sideways_tp_mult': 2.022004730849373, 'sideways_tsl_mult': 0.7272923225245096, 'sideways_time_stop': 232, 'sideways_use_sma': True, 'sideways_use_ema': True, 'sideways_use_atr': False, 'sideways_use_adx': False, 'sideways_use_spike': False, 'sideways_rsi_required': False}.
[I 2025-09-01 09:24:11,666] Trial 142 finished with values: [-0.007019909061521723, 0.010217615884145544] and parameters: {'p_sma': 52, 'p_std': 6, 'p_atr': 28, 'p_adx': 27, 'rsi_period': 18, 'ema1': 23, 'ema2': 40, 'slip_atr_k': 0.014990653429792292, 'slip_spread_k': 0.2986967443687576, 'spread_hl_frac': 0.016345485964644187, 'bb_std_mult': 2.751994595832371, 'rsi_os': 42, 'rsi_ob': 83, 'vol_spike': 0.12943335272858275, 'adx_thresh': 34.11151889726577, 'atr_min_pct': 0.018279425607431937, 'atr_max_pct': 0.018707427153120834, 'tp_mult': 2.6998188838460484, 'tsl_mult': 0.5171329864784052, 'strategy': 'breakout', 'time_stop': 152, 'use_sma': True, 'use_atr': False, 'use_adx': True, 'use_ema': False, 'use_spike': True, 'rsi_required': False, 'edge_k': 0.7284164178755359, 'edge_cap': 0.2326659274336399, 'bull_strategy': 'mean_reversion', 'bull_bb_std_mult': 1.9369689527607223, 'bull_rsi_os': 35, 'bull_rsi_ob': 67, 'bull_adx_thresh': 17.565180066800735, 'bull_atr_min_pct': 0.00941925763875566, 'bull_atr_max_pct': 0.027541313884048308, 'bull_tp_mult': 2.296019512169065, 'bull_tsl_mult': 0.5431770993671619, 'bull_time_stop': 284, 'bull_use_sma': True, 'bull_use_ema': False, 'bull_use_atr': True, 'bull_use_adx': False, 'bull_use_spike': True, 'bull_rsi_required': True, 'bear_strategy': 'breakout', 'bear_bb_std_mult': 1.393899559105614, 'bear_rsi_os': 55, 'bear_rsi_ob': 53, 'bear_adx_thresh': 16.33702748774113, 'bear_atr_min_pct': 0.0032938425433605735, 'bear_atr_max_pct': 0.014211993406489487, 'bear_tp_mult': 1.872286487338572, 'bear_tsl_mult': 0.8007322355143032, 'bear_time_stop': 241, 'bear_use_sma': True, 'bear_use_ema': True, 'bear_use_atr': False, 'bear_use_adx': True, 'bear_use_spike': False, 'bear_rsi_required': False, 'sideways_strategy': 'mean_reversion', 'sideways_bb_std_mult': 2.062080706524093, 'sideways_rsi_os': 27, 'sideways_rsi_ob': 57, 'sideways_adx_thresh': 24.42639892340039, 'sideways_atr_min_pct': 0.018246116092366985, 'sideways_atr_max_pct': 0.01263766104524118, 'sideways_tp_mult': 1.2678706698271938, 'sideways_tsl_mult': 0.09559243139650636, 'sideways_time_stop': 37, 'sideways_use_sma': False, 'sideways_use_ema': False, 'sideways_use_atr': False, 'sideways_use_adx': False, 'sideways_use_spike': True, 'sideways_rsi_required': False}.
[I 2025-09-01 09:24:12,201] Trial 141 finished with values: [-1000000000.0, 1000000000.0] and parameters: {'p_sma': 52, 'p_std': 6, 'p_atr': 29, 'p_adx': 27, 'rsi_period': 17, 'ema1': 21, 'ema2': 41, 'slip_atr_k': 0.08336366978493523, 'slip_spread_k': 0.9267886468107012, 'spread_hl_frac': 0.0324424924284291, 'bb_std_mult': 3.265706444186583, 'rsi_os': 40, 'rsi_ob': 55, 'vol_spike': 0.12750672650642528, 'adx_thresh': 13.245507425602028, 'atr_min_pct': 0.01872328648344642, 'atr_max_pct': 0.06283922735734598, 'tp_mult': 2.693654116341502, 'tsl_mult': 0.8792771878549055, 'strategy': 'breakout', 'time_stop': 87, 'use_sma': False, 'use_atr': False, 'use_adx': False, 'use_ema': True, 'use_spike': False, 'rsi_required': True, 'edge_k': 1.5027097941919405, 'edge_cap': 0.3702227698910312, 'bull_strategy': 'breakout', 'bull_bb_std_mult': 1.8138632673236086, 'bull_rsi_os': 34, 'bull_rsi_ob': 67, 'bull_adx_thresh': 32.24215392859106, 'bull_atr_min_pct': 0.0064759872870439605, 'bull_atr_max_pct': 0.1327477315449957, 'bull_tp_mult': 2.3670658849766566, 'bull_tsl_mult': 0.9332292461100231, 'bull_time_stop': 288, 'bull_use_sma': True, 'bull_use_ema': True, 'bull_use_atr': True, 'bull_use_adx': False, 'bull_use_spike': True, 'bull_rsi_required': False, 'bear_strategy': 'breakout', 'bear_bb_std_mult': 0.831591987605097, 'bear_rsi_os': 32, 'bear_rsi_ob': 53, 'bear_adx_thresh': 17.723252332667528, 'bear_atr_min_pct': 0.011898774167603626, 'bear_atr_max_pct': 0.1178443476602396, 'bear_tp_mult': 2.956978067562917, 'bear_tsl_mult': 0.7533835309467027, 'bear_time_stop': 53, 'bear_use_sma': True, 'bear_use_ema': True, 'bear_use_atr': True, 'bear_use_adx': False, 'bear_use_spike': False, 'bear_rsi_required': False, 'sideways_strategy': 'mean_reversion', 'sideways_bb_std_mult': 3.4943585175668606, 'sideways_rsi_os': 32, 'sideways_rsi_ob': 77, 'sideways_adx_thresh': 11.565359250592374, 'sideways_atr_min_pct': 0.012903089134241246, 'sideways_atr_max_pct': 0.09740195340116888, 'sideways_tp_mult': 1.429384658082829, 'sideways_tsl_mult': 0.7656913275829276, 'sideways_time_stop': 227, 'sideways_use_sma': True, 'sideways_use_ema': True, 'sideways_use_atr': False, 'sideways_use_adx': False, 'sideways_use_spike': True, 'sideways_rsi_required': False}.
