[I 2025-09-01 09:29:01,324] Trial 172 finished with values: [-1000000000.0, 1000000000.0] and parameters: {'p_sma': 60, 'p_std': 39, 'p_atr': 27, 'p_adx': 12, 'rsi_period': 49, 'ema1': 7, 'ema2': 10, 'slip_atr_k': 0.0005627238201466166, 'slip_spread_k': 0.5407319750626669, 'spread_hl_frac': 0.004532719266750808, 'bb_std_mult': 2.6922248766610313, 'rsi_os': 15, 'rsi_ob': 59, 'vol_spike': 0.24999246948504017, 'adx_thresh': 13.279994966166202, 'atr_min_pct': 0.022570427866319534, 'atr_max_pct': 0.0733529623297363, 'tp_mult': 2.583005477007272, 'tsl_mult': 0.9783334869514659, 'strategy': 'breakout', 'time_stop': 128, 'use_sma': True, 'use_atr': True, 'use_adx': False, 'use_ema': False, 'use_spike': True, 'rsi_required': False, 'edge_k': 0.6592252362844934, 'edge_cap': 0.9492353961261385, 'bull_strategy': 'mean_reversion', 'bull_bb_std_mult': 3.3696313270974882, 'bull_rsi_os': 37, 'bull_rsi_ob': 77, 'bull_adx_thresh': 28.787244026097383, 'bull_atr_min_pct': 0.005702743348372278, 'bull_atr_max_pct': 0.06814780533710425, 'bull_tp_mult': 1.6531030321179443, 'bull_tsl_mult': 0.8715052455841463, 'bull_time_stop': 121, 'bull_use_sma': True, 'bull_use_ema': False, 'bull_use_atr': True, 'bull_use_adx': False, 'bull_use_spike': True, 'bull_rsi_required': False, 'bear_strategy': 'breakout', 'bear_bb_std_mult': 1.6228169260636616, 'bear_rsi_os': 47, 'bear_rsi_ob': 75, 'bear_adx_thresh': 29.207889023229463, 'bear_atr_min_pct': 0.029912796330859394, 'bear_atr_max_pct': 0.12791411894346624, 'bear_tp_mult': 2.8118374462067917, 'bear_tsl_mult': 0.8389087620229663, 'bear_time_stop': 246, 'bear_use_sma': False, 'bear_use_ema': True, 'bear_use_atr': True, 'bear_use_adx': True, 'bear_use_spike': True, 'bear_rsi_required': False, 'sideways_strategy': 'mean_reversion', 'sideways_bb_std_mult': 2.675471159816162, 'sideways_rsi_os': 31, 'sideways_rsi_ob': 60, 'sideways_adx_thresh': 31.286624139707182, 'sideways_atr_min_pct': 0.0038723889537927037, 'sideways_atr_max_pct': 0.09233642200357206, 'sideways_tp_mult': 1.5471201328419744, 'sideways_tsl_mult': 0.9622060135402963, 'sideways_time_stop': 241, 'sideways_use_sma': True, 'sideways_use_ema': False, 'sideways_use_atr': False, 'sideways_use_adx': False, 'sideways_use_spike': True, 'sideways_rsi_required': False}.
[I 2025-09-01 09:29:01,326] Trial 170 finished with values: [-1000000000.0, 1000000000.0] and parameters: {'p_sma': 59, 'p_std': 60, 'p_atr': 27, 'p_adx': 11, 'rsi_period': 39, 'ema1': 25, 'ema2': 11, 'slip_atr_k': 0.02883691305923652, 'slip_spread_k': 0.3201688939906722, 'spread_hl_frac': 0.005236576538342898, 'bb_std_mult': 2.7114086328420313, 'rsi_os': 50, 'rsi_ob': 65, 'vol_spike': 0.12334900110357123, 'adx_thresh': 9.490391226466976, 'atr_min_pct': 0.02155732746317643, 'atr_max_pct': 0.10737362110001822, 'tp_mult': 1.4627186324390733, 'tsl_mult': 0.11993650494109082, 'strategy': 'breakout', 'time_stop': 23, 'use_sma': False, 'use_atr': True, 'use_adx': False, 'use_ema': False, 'use_spike': True, 'rsi_required': False, 'edge_k': 0.42835842271092883, 'edge_cap': 0.2844268027598822, 'bull_strategy': 'breakout', 'bull_bb_std_mult': 1.3408762813785042, 'bull_rsi_os': 36, 'bull_rsi_ob': 64, 'bull_adx_thresh': 18.29845111132278, 'bull_atr_min_pct': 0.005898703107593142, 'bull_atr_max_pct': 0.019471468133829675, 'bull_tp_mult': 1.2027135294007665, 'bull_tsl_mult': 0.10635910692316725, 'bull_time_stop': 231, 'bull_use_sma': False, 'bull_use_ema': True, 'bull_use_atr': False, 'bull_use_adx': False, 'bull_use_spike': False, 'bull_rsi_required': False, 'bear_strategy': 'mean_reversion', 'bear_bb_std_mult': 1.742469716355167, 'bear_rsi_os': 30, 'bear_rsi_ob': 71, 'bear_adx_thresh': 15.450479931280615, 'bear_atr_min_pct': 0.02005585557499205, 'bear_atr_max_pct': 0.021235722452958662, 'bear_tp_mult': 2.8720504828626794, 'bear_tsl_mult': 0.23958977040937784, 'bear_time_stop': 218, 'bear_use_sma': False, 'bear_use_ema': False, 'bear_use_atr': True, 'bear_use_adx': False, 'bear_use_spike': False, 'bear_rsi_required': True, 'sideways_strategy': 'breakout', 'sideways_bb_std_mult': 3.247108888892358, 'sideways_rsi_os': 29, 'sideways_rsi_ob': 94, 'sideways_adx_thresh': 22.854938458670414, 'sideways_atr_min_pct': 0.0036691594656103276, 'sideways_atr_max_pct': 0.1497712624147554, 'sideways_tp_mult': 2.68786663259664, 'sideways_tsl_mult': 0.4386563285224263, 'sideways_time_stop': 114, 'sideways_use_sma': True, 'sideways_use_ema': True, 'sideways_use_atr': True, 'sideways_use_adx': False, 'sideways_use_spike': True, 'sideways_rsi_required': True}.
[I 2025-09-01 09:29:01,596] Trial 173 finished with values: [-1000000000.0, 1000000000.0] and parameters: {'p_sma': 60, 'p_std': 43, 'p_atr': 27, 'p_adx': 12, 'rsi_period': 49, 'ema1': 7, 'ema2': 11, 'slip_atr_k': 7.224607005155287e-05, 'slip_spread_k': 0.5370652051066142, 'spread_hl_frac': 0.004602142089552965, 'bb_std_mult': 2.675830106864334, 'rsi_os': 11, 'rsi_ob': 59, 'vol_spike': 0.18253254362839702, 'adx_thresh': 12.34074995854288, 'atr_min_pct': 0.022801511490012496, 'atr_max_pct': 0.07429416385330823, 'tp_mult': 2.5969529228482493, 'tsl_mult': 0.9040435950051225, 'strategy': 'breakout', 'time_stop': 122, 'use_sma': True, 'use_atr': True, 'use_adx': False, 'use_ema': False, 'use_spike': True, 'rsi_required': False, 'edge_k': 0.6875325202261078, 'edge_cap': 0.9021650215523851, 'bull_strategy': 'mean_reversion', 'bull_bb_std_mult': 3.3851133601563883, 'bull_rsi_os': 37, 'bull_rsi_ob': 77, 'bull_adx_thresh': 28.67704026101272, 'bull_atr_min_pct': 0.004794873144492163, 'bull_atr_max_pct': 0.06598872893062802, 'bull_tp_mult': 1.7313378016611811, 'bull_tsl_mult': 0.8818415483451219, 'bull_time_stop': 104, 'bull_use_sma': True, 'bull_use_ema': False, 'bull_use_atr': True, 'bull_use_adx': False, 'bull_use_spike': True, 'bull_rsi_required': False, 'bear_strategy': 'breakout', 'bear_bb_std_mult': 1.6345443607306007, 'bear_rsi_os': 47, 'bear_rsi_ob': 82, 'bear_adx_thresh': 30.86762806957122, 'bear_atr_min_pct': 0.029666394872857438, 'bear_atr_max_pct': 0.12788937880472298, 'bear_tp_mult': 2.6795993244124494, 'bear_tsl_mult': 0.9052101380542358, 'bear_time_stop': 247, 'bear_use_sma': False, 'bear_use_ema': True, 'bear_use_atr': True, 'bear_use_adx': True, 'bear_use_spike': True, 'bear_rsi_required': False, 'sideways_strategy': 'mean_reversion', 'sideways_bb_std_mult': 2.618216051834449, 'sideways_rsi_os': 30, 'sideways_rsi_ob': 60, 'sideways_adx_thresh': 30.265530201673936, 'sideways_atr_min_pct': 0.003630252964557561, 'sideways_atr_max_pct': 0.09566647001591122, 'sideways_tp_mult': 1.4491671777735646, 'sideways_tsl_mult': 0.9651684433507777, 'sideways_time_stop': 217, 'sideways_use_sma': True, 'sideways_use_ema': False, 'sideways_use_atr': False, 'sideways_use_adx': False, 'sideways_use_spike': True, 'sideways_rsi_required': False}.
[I 2025-09-01 09:29:43,677] Trial 176 finished with values: [0.001371343059580532, 0.0010339175947433653] and parameters: {'p_sma': 59, 'p_std': 45, 'p_atr': 28, 'p_adx': 11, 'rsi_period': 44, 'ema1': 8, 'ema2': 10, 'slip_atr_k': 0.008582614641908785, 'slip_spread_k': 0.5711288554167883, 'spread_hl_frac': 0.0069756518072444885, 'bb_std_mult': 2.6446410735329664, 'rsi_os': 8, 'rsi_ob': 56, 'vol_spike': 0.19587952869206587, 'adx_thresh': 12.095470473624152, 'atr_min_pct': 0.01941078481158666, 'atr_max_pct': 0.06728331346841084, 'tp_mult': 2.5169596457155476, 'tsl_mult': 0.8368437224518521, 'strategy': 'breakout', 'time_stop': 146, 'use_sma': True, 'use_atr': True, 'use_adx': False, 'use_ema': False, 'use_spike': True, 'rsi_required': False, 'edge_k': 0.6202363620262944, 'edge_cap': 0.8458928393438229, 'bull_strategy': 'mean_reversion', 'bull_bb_std_mult': 3.457871345151048, 'bull_rsi_os': 38, 'bull_rsi_ob': 79, 'bull_adx_thresh': 27.945728633852458, 'bull_atr_min_pct': 0.004426552549649132, 'bull_atr_max_pct': 0.07885398049553047, 'bull_tp_mult': 1.5451606977916978, 'bull_tsl_mult': 0.9274144321150621, 'bull_time_stop': 138, 'bull_use_sma': True, 'bull_use_ema': False, 'bull_use_atr': True, 'bull_use_adx': False, 'bull_use_spike': True, 'bull_rsi_required': False, 'bear_strategy': 'breakout', 'bear_bb_std_mult': 1.4885339661425157, 'bear_rsi_os': 44, 'bear_rsi_ob': 72, 'bear_adx_thresh': 34.115532323845656, 'bear_atr_min_pct': 0.028865729146986988, 'bear_atr_max_pct': 0.12649702409292343, 'bear_tp_mult': 2.8642087115023243, 'bear_tsl_mult': 0.8134672965553262, 'bear_time_stop': 5, 'bear_use_sma': False, 'bear_use_ema': True, 'bear_use_atr': True, 'bear_use_adx': True, 'bear_use_spike': True, 'bear_rsi_required': False, 'sideways_strategy': 'mean_reversion', 'sideways_bb_std_mult': 2.5357272877146206, 'sideways_rsi_os': 30, 'sideways_rsi_ob': 60, 'sideways_adx_thresh': 31.927083764463923, 'sideways_atr_min_pct': 0.0027795024569568162, 'sideways_atr_max_pct': 0.08767280276532383, 'sideways_tp_mult': 1.3456673743247238, 'sideways_tsl_mult': 0.9422378512017597, 'sideways_time_stop': 225, 'sideways_use_sma': True, 'sideways_use_ema': False, 'sideways_use_atr': False, 'sideways_use_adx': False, 'sideways_use_spike': True, 'sideways_rsi_required': False}.
[I 2025-09-01 09:29:44,300] Trial 177 finished with values: [-0.0012931121796027067, 0.004136916192336761] and parameters: {'p_sma': 59, 'p_std': 45, 'p_atr': 28, 'p_adx': 11, 'rsi_period': 44, 'ema1': 9, 'ema2': 10, 'slip_atr_k': 0.009557557286672465, 'slip_spread_k': 0.5761170033322982, 'spread_hl_frac': 0.007601406201060849, 'bb_std_mult': 2.8042051338984946, 'rsi_os': 17, 'rsi_ob': 56, 'vol_spike': 0.2111463516793451, 'adx_thresh': 11.881490329884105, 'atr_min_pct': 0.019674078006817516, 'atr_max_pct': 0.071321512605437, 'tp_mult': 2.516936811608726, 'tsl_mult': 0.9238273525683792, 'strategy': 'breakout', 'time_stop': 145, 'use_sma': True, 'use_atr': True, 'use_adx': False, 'use_ema': False, 'use_spike': True, 'rsi_required': False, 'edge_k': 0.621495684749666, 'edge_cap': 0.8648944774385479, 'bull_strategy': 'mean_reversion', 'bull_bb_std_mult': 3.5044657004889332, 'bull_rsi_os': 38, 'bull_rsi_ob': 80, 'bull_adx_thresh': 27.985739448277315, 'bull_atr_min_pct': 0.004397124744292602, 'bull_atr_max_pct': 0.07747331725843698, 'bull_tp_mult': 1.537184223770077, 'bull_tsl_mult': 0.9139478700086747, 'bull_time_stop': 141, 'bull_use_sma': True, 'bull_use_ema': False, 'bull_use_atr': True, 'bull_use_adx': False, 'bull_use_spike': True, 'bull_rsi_required': False, 'bear_strategy': 'breakout', 'bear_bb_std_mult': 1.5104333907512009, 'bear_rsi_os': 45, 'bear_rsi_ob': 73, 'bear_adx_thresh': 30.22268228365786, 'bear_atr_min_pct': 0.02899437899560567, 'bear_atr_max_pct': 0.12258834990674686, 'bear_tp_mult': 2.8524904641649216, 'bear_tsl_mult': 0.8177734916031452, 'bear_time_stop': 235, 'bear_use_sma': False, 'bear_use_ema': True, 'bear_use_atr': True, 'bear_use_adx': True, 'bear_use_spike': True, 'bear_rsi_required': False, 'sideways_strategy': 'mean_reversion', 'sideways_bb_std_mult': 2.494812455260519, 'sideways_rsi_os': 33, 'sideways_rsi_ob': 60, 'sideways_adx_thresh': 32.21536986919009, 'sideways_atr_min_pct': 0.00288779796984979, 'sideways_atr_max_pct': 0.08719470840086464, 'sideways_tp_mult': 1.4011600442491219, 'sideways_tsl_mult': 0.9947945740699948, 'sideways_time_stop': 226, 'sideways_use_sma': True, 'sideways_use_ema': False, 'sideways_use_atr': False, 'sideways_use_adx': False, 'sideways_use_spike': True, 'sideways_rsi_required': False}.
[I 2025-09-01 09:29:45,272] Trial 175 finished with values: [-0.0025178815020914236, 0.004322048136728364] and parameters: {'p_sma': 59, 'p_std': 43, 'p_atr': 28, 'p_adx': 11, 'rsi_period': 44, 'ema1': 8, 'ema2': 10, 'slip_atr_k': 0.00936130806870201, 'slip_spread_k': 0.5691216641186557, 'spread_hl_frac': 0.00627154916277122, 'bb_std_mult': 2.6433233433882872, 'rsi_os': 20, 'rsi_ob': 56, 'vol_spike': 0.194921346963681, 'adx_thresh': 12.228405756911943, 'atr_min_pct': 0.019443599071140513, 'atr_max_pct': 0.06830945806978146, 'tp_mult': 2.526234992714974, 'tsl_mult': 0.8519158781644516, 'strategy': 'breakout', 'time_stop': 134, 'use_sma': True, 'use_atr': True, 'use_adx': False, 'use_ema': False, 'use_spike': True, 'rsi_required': False, 'edge_k': 0.6054500947772794, 'edge_cap': 0.854621636567622, 'bull_strategy': 'mean_reversion', 'bull_bb_std_mult': 3.4898631675793363, 'bull_rsi_os': 38, 'bull_rsi_ob': 79, 'bull_adx_thresh': 27.916072830595432, 'bull_atr_min_pct': 0.007591887392376047, 'bull_atr_max_pct': 0.05146749095564522, 'bull_tp_mult': 1.5353500950478163, 'bull_tsl_mult': 0.9126837352036686, 'bull_time_stop': 136, 'bull_use_sma': True, 'bull_use_ema': False, 'bull_use_atr': True, 'bull_use_adx': False, 'bull_use_spike': True, 'bull_rsi_required': False, 'bear_strategy': 'breakout', 'bear_bb_std_mult': 1.4406211569172958, 'bear_rsi_os': 39, 'bear_rsi_ob': 74, 'bear_adx_thresh': 30.448074244667765, 'bear_atr_min_pct': 0.02863543462714211, 'bear_atr_max_pct': 0.125914118249478, 'bear_tp_mult': 2.859790896910117, 'bear_tsl_mult': 0.8182629593493288, 'bear_time_stop': 231, 'bear_use_sma': False, 'bear_use_ema': True, 'bear_use_atr': True, 'bear_use_adx': True, 'bear_use_spike': True, 'bear_rsi_required': False, 'sideways_strategy': 'mean_reversion', 'sideways_bb_std_mult': 2.5274427313251007, 'sideways_rsi_os': 33, 'sideways_rsi_ob': 60, 'sideways_adx_thresh': 32.284932068169084, 'sideways_atr_min_pct': 0.002578256869653697, 'sideways_atr_max_pct': 0.08685907093007035, 'sideways_tp_mult': 1.3421750139326165, 'sideways_tsl_mult': 0.9895279999603408, 'sideways_time_stop': 223, 'sideways_use_sma': True, 'sideways_use_ema': False, 'sideways_use_atr': False, 'sideways_use_adx': False, 'sideways_use_spike': True, 'sideways_rsi_required': False}.
[I 2025-09-01 09:29:45,754] Trial 174 finished with values: [0.001181442772930863, 0.0017616865748927206] and parameters: {'p_sma': 59, 'p_std': 45, 'p_atr': 28, 'p_adx': 11, 'rsi_period': 44, 'ema1': 8, 'ema2': 10, 'slip_atr_k': 0.009795241864069899, 'slip_spread_k': 0.562286282808974, 'spread_hl_frac': 0.006242408418596281, 'bb_std_mult': 2.8165658553720005, 'rsi_os': 8, 'rsi_ob': 56, 'vol_spike': 0.1935892546704056, 'adx_thresh': 12.056557447882229, 'atr_min_pct': 0.01970574248878891, 'atr_max_pct': 0.06753040393423404, 'tp_mult': 2.504107468443537, 'tsl_mult': 0.8646226770929581, 'strategy': 'breakout', 'time_stop': 144, 'use_sma': True, 'use_atr': True, 'use_adx': False, 'use_ema': False, 'use_spike': True, 'rsi_required': False, 'edge_k': 0.6046295011589626, 'edge_cap': 0.8648902795403397, 'bull_strategy': 'mean_reversion', 'bull_bb_std_mult': 3.4773621055997954, 'bull_rsi_os': 35, 'bull_rsi_ob': 75, 'bull_adx_thresh': 27.950912902383788, 'bull_atr_min_pct': 0.0051109637566952885, 'bull_atr_max_pct': 0.07652028738384511, 'bull_tp_mult': 1.5824003194797684, 'bull_tsl_mult': 0.9237641015133752, 'bull_time_stop': 157, 'bull_use_sma': True, 'bull_use_ema': False, 'bull_use_atr': True, 'bull_use_adx': False, 'bull_use_spike': True, 'bull_rsi_required': False, 'bear_strategy': 'breakout', 'bear_bb_std_mult': 1.498535630242616, 'bear_rsi_os': 40, 'bear_rsi_ob': 84, 'bear_adx_thresh': 26.889255378140575, 'bear_atr_min_pct': 0.02894278776770902, 'bear_atr_max_pct': 0.12223371925101453, 'bear_tp_mult': 2.8664973004327927, 'bear_tsl_mult': 0.8104792577529552, 'bear_time_stop': 234, 'bear_use_sma': False, 'bear_use_ema': True, 'bear_use_atr': True, 'bear_use_adx': True, 'bear_use_spike': True, 'bear_rsi_required': False, 'sideways_strategy': 'mean_reversion', 'sideways_bb_std_mult': 2.5317383393881503, 'sideways_rsi_os': 31, 'sideways_rsi_ob': 60, 'sideways_adx_thresh': 33.39082503388078, 'sideways_atr_min_pct': 0.0025848223834821216, 'sideways_atr_max_pct': 0.0873675623968544, 'sideways_tp_mult': 1.388097608858286, 'sideways_tsl_mult': 0.9877484811007956, 'sideways_time_stop': 220, 'sideways_use_sma': True, 'sideways_use_ema': False, 'sideways_use_atr': False, 'sideways_use_adx': False, 'sideways_use_spike': True, 'sideways_rsi_required': False}.
[I 2025-09-01 09:30:28,965] Trial 179 finished with values: [-1000000000.0, 1000000000.0] and parameters: {'p_sma': 60, 'p_std': 45, 'p_atr': 18, 'p_adx': 13, 'rsi_period': 45, 'ema1': 8, 'ema2': 10, 'slip_atr_k': 0.008923001141490711, 'slip_spread_k': 0.590059797052129, 'spread_hl_frac': 0.0076681419605397795, 'bb_std_mult': 1.1363711502476976, 'rsi_os': 8, 'rsi_ob': 72, 'vol_spike': 0.18861969782744945, 'adx_thresh': 12.078710831374616, 'atr_min_pct': 0.01960639560614941, 'atr_max_pct': 0.06121878398621954, 'tp_mult': 2.541077113875552, 'tsl_mult': 0.6986807674263902, 'strategy': 'breakout', 'time_stop': 36, 'use_sma': False, 'use_atr': True, 'use_adx': False, 'use_ema': True, 'use_spike': False, 'rsi_required': True, 'edge_k': 0.7750518487826215, 'edge_cap': 0.8601784424904508, 'bull_strategy': 'breakout', 'bull_bb_std_mult': 3.477711729319368, 'bull_rsi_os': 40, 'bull_rsi_ob': 79, 'bull_adx_thresh': 29.941660823071157, 'bull_atr_min_pct': 0.004818129124935149, 'bull_atr_max_pct': 0.07756989472822676, 'bull_tp_mult': 1.5551653097559095, 'bull_tsl_mult': 0.9436140763894457, 'bull_time_stop': 137, 'bull_use_sma': True, 'bull_use_ema': True, 'bull_use_atr': False, 'bull_use_adx': False, 'bull_use_spike': False, 'bull_rsi_required': True, 'bear_strategy': 'breakout', 'bear_bb_std_mult': 1.5167403776578954, 'bear_rsi_os': 44, 'bear_rsi_ob': 73, 'bear_adx_thresh': 30.312942447752807, 'bear_atr_min_pct': 0.021063751286321403, 'bear_atr_max_pct': 0.12633748019242472, 'bear_tp_mult': 2.726182222726256, 'bear_tsl_mult': 0.8535052103280534, 'bear_time_stop': 6, 'bear_use_sma': False, 'bear_use_ema': True, 'bear_use_atr': True, 'bear_use_adx': False, 'bear_use_spike': True, 'bear_rsi_required': True, 'sideways_strategy': 'mean_reversion', 'sideways_bb_std_mult': 2.5141796229734323, 'sideways_rsi_os': 33, 'sideways_rsi_ob': 63, 'sideways_adx_thresh': 32.28498902739584, 'sideways_atr_min_pct': 0.004367025812068446, 'sideways_atr_max_pct': 0.08760715618787268, 'sideways_tp_mult': 1.2111505289841475, 'sideways_tsl_mult': 0.9994144642375995, 'sideways_time_stop': 224, 'sideways_use_sma': True, 'sideways_use_ema': True, 'sideways_use_atr': True, 'sideways_use_adx': False, 'sideways_use_spike': True, 'sideways_rsi_required': True}.
[I 2025-09-01 09:30:28,976] Trial 180 finished with values: [-0.0040428991018792715, 0.004731297991801807] and parameters: {'p_sma': 59, 'p_std': 45, 'p_atr': 10, 'p_adx': 13, 'rsi_period': 47, 'ema1': 8, 'ema2': 10, 'slip_atr_k': 0.008024497785957258, 'slip_spread_k': 0.5846681623379663, 'spread_hl_frac': 0.008085335665387158, 'bb_std_mult': 1.3371004157047413, 'rsi_os': 8, 'rsi_ob': 75, 'vol_spike': 0.19211616061712222, 'adx_thresh': 12.048337299822322, 'atr_min_pct': 0.01965525676116849, 'atr_max_pct': 0.06387918134693513, 'tp_mult': 2.5559238987843664, 'tsl_mult': 0.7399034303825278, 'strategy': 'breakout', 'time_stop': 34, 'use_sma': False, 'use_atr': True, 'use_adx': False, 'use_ema': True, 'use_spike': False, 'rsi_required': True, 'edge_k': 0.7803386434915093, 'edge_cap': 0.7595555558701704, 'bull_strategy': 'breakout', 'bull_bb_std_mult': 3.4871159883408573, 'bull_rsi_os': 40, 'bull_rsi_ob': 79, 'bull_adx_thresh': 27.894339529152138, 'bull_atr_min_pct': 0.004221078320867218, 'bull_atr_max_pct': 0.08013430868828637, 'bull_tp_mult': 1.5173320628895786, 'bull_tsl_mult': 0.916439737135479, 'bull_time_stop': 134, 'bull_use_sma': True, 'bull_use_ema': True, 'bull_use_atr': False, 'bull_use_adx': False, 'bull_use_spike': False, 'bull_rsi_required': True, 'bear_strategy': 'breakout', 'bear_bb_std_mult': 2.2248245346151476, 'bear_rsi_os': 44, 'bear_rsi_ob': 73, 'bear_adx_thresh': 30.113523941495547, 'bear_atr_min_pct': 0.021096742873153166, 'bear_atr_max_pct': 0.1295788292536716, 'bear_tp_mult': 2.7428923912992023, 'bear_tsl_mult': 0.8153668244364671, 'bear_time_stop': 6, 'bear_use_sma': False, 'bear_use_ema': True, 'bear_use_atr': True, 'bear_use_adx': False, 'bear_use_spike': True, 'bear_rsi_required': True, 'sideways_strategy': 'mean_reversion', 'sideways_bb_std_mult': 2.5333093164334852, 'sideways_rsi_os': 33, 'sideways_rsi_ob': 63, 'sideways_adx_thresh': 32.294560280716645, 'sideways_atr_min_pct': 0.0046129709775714215, 'sideways_atr_max_pct': 0.08657652265490207, 'sideways_tp_mult': 1.2261111567166023, 'sideways_tsl_mult': 0.9908479379057189, 'sideways_time_stop': 223, 'sideways_use_sma': True, 'sideways_use_ema': True, 'sideways_use_atr': True, 'sideways_use_adx': False, 'sideways_use_spike': True, 'sideways_rsi_required': True}.
