[I 2025-09-01 10:30:10,383] Trial 521 finished with values: [-0.008266851137456399, 0.00930436474382715] and parameters: {'p_sma': 60, 'p_std': 43, 'p_atr': 26, 'p_adx': 12, 'rsi_period': 18, 'ema1': 28, 'ema2': 32, 'slip_atr_k': 0.005041938617366775, 'slip_spread_k': 0.5618282987509083, 'spread_hl_frac': 0.006520282122680448, 'bb_std_mult': 1.4837705766148712, 'rsi_os': 20, 'rsi_ob': 86, 'vol_spike': 0.2048690544906399, 'adx_thresh': 11.862271288124823, 'atr_min_pct': 0.0021709782883067748, 'atr_max_pct': 0.12199544299299431, 'tp_mult': 2.528375504624771, 'tsl_mult': 0.7977587032475616, 'strategy': 'mean_reversion', 'time_stop': 148, 'use_sma': False, 'use_atr': True, 'use_adx': True, 'use_ema': True, 'use_spike': False, 'rsi_required': False, 'edge_k': 0.556188548345053, 'edge_cap': 0.8222172560598487, 'bull_strategy': 'mean_reversion', 'bull_bb_std_mult': 1.9971191194565394, 'bull_rsi_os': 49, 'bull_rsi_ob': 68, 'bull_adx_thresh': 24.07661204924651, 'bull_atr_min_pct': 0.010674317835707667, 'bull_atr_max_pct': 0.09724721431376808, 'bull_tp_mult': 1.4425039922844967, 'bull_tsl_mult': 0.8420858564020335, 'bull_time_stop': 136, 'bull_use_sma': False, 'bull_use_ema': False, 'bull_use_atr': True, 'bull_use_adx': True, 'bull_use_spike': True, 'bull_rsi_required': True, 'bear_strategy': 'mean_reversion', 'bear_bb_std_mult': 1.3836208960592624, 'bear_rsi_os': 42, 'bear_rsi_ob': 84, 'bear_adx_thresh': 5.024358798276252, 'bear_atr_min_pct': 0.029509296210489613, 'bear_atr_max_pct': 0.11926455448800154, 'bear_tp_mult': 2.9197530630000452, 'bear_tsl_mult': 0.8210451759338091, 'bear_time_stop': 148, 'bear_use_sma': True, 'bear_use_ema': True, 'bear_use_atr': False, 'bear_use_adx': False, 'bear_use_spike': True, 'bear_rsi_required': True, 'sideways_strategy': 'breakout', 'sideways_bb_std_mult': 2.3838715176064738, 'sideways_rsi_os': 38, 'sideways_rsi_ob': 53, 'sideways_adx_thresh': 6.783854998711838, 'sideways_atr_min_pct': 0.003072711038293494, 'sideways_atr_max_pct': 0.03875426684777524, 'sideways_tp_mult': 1.3870552582250735, 'sideways_tsl_mult': 0.3473262484924644, 'sideways_time_stop': 203, 'sideways_use_sma': False, 'sideways_use_ema': True, 'sideways_use_atr': True, 'sideways_use_adx': False, 'sideways_use_spike': True, 'sideways_rsi_required': False}.
[I 2025-09-01 10:30:11,512] Trial 523 finished with values: [-1000000000.0, 1000000000.0] and parameters: {'p_sma': 60, 'p_std': 43, 'p_atr': 26, 'p_adx': 10, 'rsi_period': 45, 'ema1': 17, 'ema2': 39, 'slip_atr_k': 0.03248076987091794, 'slip_spread_k': 0.3708646687433684, 'spread_hl_frac': 0.023439213268079972, 'bb_std_mult': 2.6818906358220556, 'rsi_os': 11, 'rsi_ob': 86, 'vol_spike': 0.20465492696219942, 'adx_thresh': 11.873885234590663, 'atr_min_pct': 0.001994543159495493, 'atr_max_pct': 0.03537654544912218, 'tp_mult': 1.530976946426068, 'tsl_mult': 0.12498151894216247, 'strategy': 'mean_reversion', 'time_stop': 275, 'use_sma': False, 'use_atr': True, 'use_adx': True, 'use_ema': True, 'use_spike': False, 'rsi_required': False, 'edge_k': 0.5139702826443087, 'edge_cap': 0.8377658660658227, 'bull_strategy': 'breakout', 'bull_bb_std_mult': 1.0931624274755083, 'bull_rsi_os': 37, 'bull_rsi_ob': 77, 'bull_adx_thresh': 19.477335707889416, 'bull_atr_min_pct': 0.010619901947349984, 'bull_atr_max_pct': 0.024973102372547074, 'bull_tp_mult': 1.9092577448255819, 'bull_tsl_mult': 0.11577872404019501, 'bull_time_stop': 137, 'bull_use_sma': False, 'bull_use_ema': True, 'bull_use_atr': True, 'bull_use_adx': True, 'bull_use_spike': True, 'bull_rsi_required': True, 'bear_strategy': 'mean_reversion', 'bear_bb_std_mult': 1.4152237791649231, 'bear_rsi_os': 23, 'bear_rsi_ob': 69, 'bear_adx_thresh': 12.027277519831625, 'bear_atr_min_pct': 0.014728289965749002, 'bear_atr_max_pct': 0.10676487463567558, 'bear_tp_mult': 2.7850147267698593, 'bear_tsl_mult': 0.8364181455090047, 'bear_time_stop': 14, 'bear_use_sma': True, 'bear_use_ema': True, 'bear_use_atr': False, 'bear_use_adx': False, 'bear_use_spike': False, 'bear_rsi_required': True, 'sideways_strategy': 'breakout', 'sideways_bb_std_mult': 2.612338844968748, 'sideways_rsi_os': 48, 'sideways_rsi_ob': 84, 'sideways_adx_thresh': 6.962796823151411, 'sideways_atr_min_pct': 0.02923727993198931, 'sideways_atr_max_pct': 0.020307888375813328, 'sideways_tp_mult': 1.449536352517387, 'sideways_tsl_mult': 0.3427740268381778, 'sideways_time_stop': 244, 'sideways_use_sma': False, 'sideways_use_ema': True, 'sideways_use_atr': True, 'sideways_use_adx': False, 'sideways_use_spike': True, 'sideways_rsi_required': False}.
[I 2025-09-01 10:30:11,824] Trial 525 finished with values: [-0.00244247830291211, 0.0033364211164729736] and parameters: {'p_sma': 16, 'p_std': 44, 'p_atr': 29, 'p_adx': 10, 'rsi_period': 9, 'ema1': 30, 'ema2': 12, 'slip_atr_k': 0.0066547490424959995, 'slip_spread_k': 0.36367743959103244, 'spread_hl_frac': 0.041778141276603904, 'bb_std_mult': 2.3651633841145454, 'rsi_os': 7, 'rsi_ob': 57, 'vol_spike': 0.19890469664473995, 'adx_thresh': 11.651084740956835, 'atr_min_pct': 0.012435107273930159, 'atr_max_pct': 0.06320796180483083, 'tp_mult': 2.348751493148036, 'tsl_mult': 0.9530112663781768, 'strategy': 'mean_reversion', 'time_stop': 131, 'use_sma': True, 'use_atr': False, 'use_adx': True, 'use_ema': True, 'use_spike': True, 'rsi_required': False, 'edge_k': 0.4527320209002964, 'edge_cap': 0.82154973424472, 'bull_strategy': 'mean_reversion', 'bull_bb_std_mult': 2.1250151202583583, 'bull_rsi_os': 37, 'bull_rsi_ob': 77, 'bull_adx_thresh': 17.47743738379962, 'bull_atr_min_pct': 0.0025675396684791, 'bull_atr_max_pct': 0.08271707369215184, 'bull_tp_mult': 1.6403902164203203, 'bull_tsl_mult': 0.9816469580400111, 'bull_time_stop': 136, 'bull_use_sma': True, 'bull_use_ema': False, 'bull_use_atr': True, 'bull_use_adx': True, 'bull_use_spike': False, 'bull_rsi_required': True, 'bear_strategy': 'mean_reversion', 'bear_bb_std_mult': 1.009157792762203, 'bear_rsi_os': 43, 'bear_rsi_ob': 84, 'bear_adx_thresh': 27.516301249088357, 'bear_atr_min_pct': 0.014834138866775697, 'bear_atr_max_pct': 0.10677991708136438, 'bear_tp_mult': 2.9316327291876716, 'bear_tsl_mult': 0.3368662836364854, 'bear_time_stop': 12, 'bear_use_sma': True, 'bear_use_ema': True, 'bear_use_atr': False, 'bear_use_adx': False, 'bear_use_spike': True, 'bear_rsi_required': False, 'sideways_strategy': 'mean_reversion', 'sideways_bb_std_mult': 2.4336449094948764, 'sideways_rsi_os': 38, 'sideways_rsi_ob': 59, 'sideways_adx_thresh': 32.44483556074511, 'sideways_atr_min_pct': 0.029348284449899183, 'sideways_atr_max_pct': 0.09405622495562466, 'sideways_tp_mult': 2.0305864551335997, 'sideways_tsl_mult': 0.9187377710547395, 'sideways_time_stop': 206, 'sideways_use_sma': True, 'sideways_use_ema': True, 'sideways_use_atr': True, 'sideways_use_adx': False, 'sideways_use_spike': True, 'sideways_rsi_required': True}.
[I 2025-09-01 10:30:12,020] Trial 524 finished with values: [-0.026441484909411006, 0.027577789050303135] and parameters: {'p_sma': 60, 'p_std': 45, 'p_atr': 9, 'p_adx': 10, 'rsi_period': 18, 'ema1': 8, 'ema2': 59, 'slip_atr_k': 0.026243460962965797, 'slip_spread_k': 0.7320984406031044, 'spread_hl_frac': 0.04213763492564723, 'bb_std_mult': 1.684063765594261, 'rsi_os': 8, 'rsi_ob': 80, 'vol_spike': 0.19870316905352955, 'adx_thresh': 11.673975016334674, 'atr_min_pct': 0.016082708428128336, 'atr_max_pct': 0.06301303670469996, 'tp_mult': 2.523310930888833, 'tsl_mult': 0.4912115877294577, 'strategy': 'mean_reversion', 'time_stop': 291, 'use_sma': False, 'use_atr': True, 'use_adx': True, 'use_ema': True, 'use_spike': False, 'rsi_required': False, 'edge_k': 0.5652349788172355, 'edge_cap': 0.8187103866276803, 'bull_strategy': 'mean_reversion', 'bull_bb_std_mult': 0.8897567877873342, 'bull_rsi_os': 37, 'bull_rsi_ob': 52, 'bull_adx_thresh': 17.372905449977512, 'bull_atr_min_pct': 0.005285420784742952, 'bull_atr_max_pct': 0.09693543251245956, 'bull_tp_mult': 1.5193388635961647, 'bull_tsl_mult': 0.9183990249968113, 'bull_time_stop': 265, 'bull_use_sma': False, 'bull_use_ema': False, 'bull_use_atr': True, 'bull_use_adx': True, 'bull_use_spike': True, 'bull_rsi_required': True, 'bear_strategy': 'mean_reversion', 'bear_bb_std_mult': 1.7942435312723752, 'bear_rsi_os': 43, 'bear_rsi_ob': 69, 'bear_adx_thresh': 27.86955452045025, 'bear_atr_min_pct': 0.005613884923009325, 'bear_atr_max_pct': 0.12455329504117445, 'bear_tp_mult': 2.342386886137232, 'bear_tsl_mult': 0.8219713634268156, 'bear_time_stop': 14, 'bear_use_sma': True, 'bear_use_ema': True, 'bear_use_atr': False, 'bear_use_adx': False, 'bear_use_spike': True, 'bear_rsi_required': True, 'sideways_strategy': 'breakout', 'sideways_bb_std_mult': 2.6143669184068887, 'sideways_rsi_os': 44, 'sideways_rsi_ob': 58, 'sideways_adx_thresh': 26.217650328917525, 'sideways_atr_min_pct': 0.003039504468848738, 'sideways_atr_max_pct': 0.09478126862253783, 'sideways_tp_mult': 2.0422552770156797, 'sideways_tsl_mult': 0.34596724863374934, 'sideways_time_stop': 241, 'sideways_use_sma': False, 'sideways_use_ema': True, 'sideways_use_atr': True, 'sideways_use_adx': False, 'sideways_use_spike': True, 'sideways_rsi_required': False}.
[I 2025-09-01 10:30:51,065] Trial 528 finished with values: [-0.014049110318349989, 0.014026534517583868] and parameters: {'p_sma': 31, 'p_std': 45, 'p_atr': 29, 'p_adx': 10, 'rsi_period': 45, 'ema1': 25, 'ema2': 58, 'slip_atr_k': 0.02724954501482335, 'slip_spread_k': 0.9643841940084217, 'spread_hl_frac': 0.00011096363478165644, 'bb_std_mult': 1.1047706546068636, 'rsi_os': 7, 'rsi_ob': 50, 'vol_spike': 0.1252753222871354, 'adx_thresh': 11.320953900989704, 'atr_min_pct': 0.019469017138482838, 'atr_max_pct': 0.023001261387280196, 'tp_mult': 1.0133072476775014, 'tsl_mult': 0.1922102024163641, 'strategy': 'breakout', 'time_stop': 234, 'use_sma': True, 'use_atr': False, 'use_adx': False, 'use_ema': False, 'use_spike': True, 'rsi_required': True, 'edge_k': 1.9463148051546417, 'edge_cap': 0.8834524716267338, 'bull_strategy': 'mean_reversion', 'bull_bb_std_mult': 0.8941661922345059, 'bull_rsi_os': 55, 'bull_rsi_ob': 56, 'bull_adx_thresh': 29.530015565064208, 'bull_atr_min_pct': 0.0018116567559311272, 'bull_atr_max_pct': 0.08291117933684355, 'bull_tp_mult': 1.5270242109895191, 'bull_tsl_mult': 0.9271569650292241, 'bull_time_stop': 195, 'bull_use_sma': True, 'bull_use_ema': False, 'bull_use_atr': False, 'bull_use_adx': False, 'bull_use_spike': False, 'bull_rsi_required': False, 'bear_strategy': 'breakout', 'bear_bb_std_mult': 1.461266769999441, 'bear_rsi_os': 47, 'bear_rsi_ob': 70, 'bear_adx_thresh': 33.90826204254218, 'bear_atr_min_pct': 0.022725883867408737, 'bear_atr_max_pct': 0.12361183718070445, 'bear_tp_mult': 2.9492018821414163, 'bear_tsl_mult': 0.7741243582925443, 'bear_time_stop': 15, 'bear_use_sma': False, 'bear_use_ema': False, 'bear_use_atr': True, 'bear_use_adx': True, 'bear_use_spike': True, 'bear_rsi_required': False, 'sideways_strategy': 'mean_reversion', 'sideways_bb_std_mult': 2.6936016354113357, 'sideways_rsi_os': 31, 'sideways_rsi_ob': 58, 'sideways_adx_thresh': 28.87638690161897, 'sideways_atr_min_pct': 0.0011588215922461393, 'sideways_atr_max_pct': 0.08187438798568979, 'sideways_tp_mult': 2.896374407322885, 'sideways_tsl_mult': 0.4628834109892203, 'sideways_time_stop': 209, 'sideways_use_sma': True, 'sideways_use_ema': False, 'sideways_use_atr': False, 'sideways_use_adx': True, 'sideways_use_spike': False, 'sideways_rsi_required': True}.
[I 2025-09-01 10:30:51,546] Trial 529 finished with values: [-0.053286220883561275, 0.05319141861403313] and parameters: {'p_sma': 59, 'p_std': 39, 'p_atr': 29, 'p_adx': 30, 'rsi_period': 41, 'ema1': 27, 'ema2': 13, 'slip_atr_k': 0.017103093483979214, 'slip_spread_k': 0.5764149102869475, 'spread_hl_frac': 0.02817307454367814, 'bb_std_mult': 2.3507988944719207, 'rsi_os': 7, 'rsi_ob': 90, 'vol_spike': 0.18922883464359447, 'adx_thresh': 26.810573413372857, 'atr_min_pct': 0.01811371934775825, 'atr_max_pct': 0.07292525100155096, 'tp_mult': 1.330392749862425, 'tsl_mult': 0.8703576797463948, 'strategy': 'breakout', 'time_stop': 88, 'use_sma': True, 'use_atr': False, 'use_adx': False, 'use_ema': False, 'use_spike': True, 'rsi_required': True, 'edge_k': 0.4527265578808244, 'edge_cap': 0.2697549570541046, 'bull_strategy': 'mean_reversion', 'bull_bb_std_mult': 2.472376113019105, 'bull_rsi_os': 7, 'bull_rsi_ob': 80, 'bull_adx_thresh': 29.544285036423407, 'bull_atr_min_pct': 0.012449524737364336, 'bull_atr_max_pct': 0.08285923540460376, 'bull_tp_mult': 1.6372375246683621, 'bull_tsl_mult': 0.9822580880308989, 'bull_time_stop': 148, 'bull_use_sma': True, 'bull_use_ema': False, 'bull_use_atr': False, 'bull_use_adx': False, 'bull_use_spike': False, 'bull_rsi_required': False, 'bear_strategy': 'breakout', 'bear_bb_std_mult': 2.610015344185249, 'bear_rsi_os': 47, 'bear_rsi_ob': 62, 'bear_adx_thresh': 24.26904753421666, 'bear_atr_min_pct': 0.026979689003040364, 'bear_atr_max_pct': 0.1319847155948894, 'bear_tp_mult': 1.6904713250535133, 'bear_tsl_mult': 0.7681927764927071, 'bear_time_stop': 137, 'bear_use_sma': False, 'bear_use_ema': False, 'bear_use_atr': True, 'bear_use_adx': True, 'bear_use_spike': True, 'bear_rsi_required': False, 'sideways_strategy': 'mean_reversion', 'sideways_bb_std_mult': 2.424870408681708, 'sideways_rsi_os': 51, 'sideways_rsi_ob': 92, 'sideways_adx_thresh': 32.35135504762668, 'sideways_atr_min_pct': 0.0014141092212838597, 'sideways_atr_max_pct': 0.08211480569853188, 'sideways_tp_mult': 1.3250634186812216, 'sideways_tsl_mult': 0.0954092949138508, 'sideways_time_stop': 237, 'sideways_use_sma': True, 'sideways_use_ema': False, 'sideways_use_atr': False, 'sideways_use_adx': True, 'sideways_use_spike': False, 'sideways_rsi_required': True}.
[I 2025-09-01 10:30:52,274] Trial 527 finished with values: [-1000000000.0, 1000000000.0] and parameters: {'p_sma': 59, 'p_std': 45, 'p_atr': 29, 'p_adx': 30, 'rsi_period': 41, 'ema1': 25, 'ema2': 12, 'slip_atr_k': 0.02478055942566236, 'slip_spread_k': 0.5832849555676558, 'spread_hl_frac': 0.04574360749425535, 'bb_std_mult': 2.6323980917296756, 'rsi_os': 7, 'rsi_ob': 58, 'vol_spike': 0.1974931742138661, 'adx_thresh': 6.394850964409139, 'atr_min_pct': 0.01630798492642867, 'atr_max_pct': 0.02129842286814375, 'tp_mult': 2.3411517205609957, 'tsl_mult': 0.8767359918570423, 'strategy': 'breakout', 'time_stop': 88, 'use_sma': True, 'use_atr': False, 'use_adx': False, 'use_ema': False, 'use_spike': True, 'rsi_required': True, 'edge_k': 1.6904844084417512, 'edge_cap': 0.8810433947068466, 'bull_strategy': 'mean_reversion', 'bull_bb_std_mult': 0.9134418905763768, 'bull_rsi_os': 53, 'bull_rsi_ob': 80, 'bull_adx_thresh': 17.54743834195727, 'bull_atr_min_pct': 0.028622888866371876, 'bull_atr_max_pct': 0.029934681380453347, 'bull_tp_mult': 1.5316355024199673, 'bull_tsl_mult': 0.9575404170423947, 'bull_time_stop': 185, 'bull_use_sma': True, 'bull_use_ema': False, 'bull_use_atr': False, 'bull_use_adx': False, 'bull_use_spike': False, 'bull_rsi_required': False, 'bear_strategy': 'breakout', 'bear_bb_std_mult': 1.4552750058869557, 'bear_rsi_os': 43, 'bear_rsi_ob': 70, 'bear_adx_thresh': 33.79680644396845, 'bear_atr_min_pct': 0.026887464197577676, 'bear_atr_max_pct': 0.12324018106832024, 'bear_tp_mult': 2.852719406839042, 'bear_tsl_mult': 0.247091148397184, 'bear_time_stop': 14, 'bear_use_sma': False, 'bear_use_ema': False, 'bear_use_atr': True, 'bear_use_adx': True, 'bear_use_spike': True, 'bear_rsi_required': False, 'sideways_strategy': 'mean_reversion', 'sideways_bb_std_mult': 0.8472044539664325, 'sideways_rsi_os': 28, 'sideways_rsi_ob': 58, 'sideways_adx_thresh': 32.44551082525782, 'sideways_atr_min_pct': 0.021843215768026336, 'sideways_atr_max_pct': 0.09443308513485357, 'sideways_tp_mult': 2.0223470733206517, 'sideways_tsl_mult': 0.8686709454938575, 'sideways_time_stop': 78, 'sideways_use_sma': True, 'sideways_use_ema': False, 'sideways_use_atr': False, 'sideways_use_adx': False, 'sideways_use_spike': True, 'sideways_rsi_required': True}.
[I 2025-09-01 10:30:52,567] Trial 526 finished with values: [-0.0033555251220741544, 0.003394795221638965] and parameters: {'p_sma': 38, 'p_std': 45, 'p_atr': 10, 'p_adx': 10, 'rsi_period': 41, 'ema1': 17, 'ema2': 59, 'slip_atr_k': 0.00906272065131237, 'slip_spread_k': 0.9704631186579589, 'spread_hl_frac': 0.00346742573348142, 'bb_std_mult': 2.35508767480278, 'rsi_os': 11, 'rsi_ob': 58, 'vol_spike': 0.12401547643454891, 'adx_thresh': 34.98300802362543, 'atr_min_pct': 0.029960070753052598, 'atr_max_pct': 0.06231758571442745, 'tp_mult': 2.6038452212064653, 'tsl_mult': 0.8705979186409056, 'strategy': 'breakout', 'time_stop': 130, 'use_sma': True, 'use_atr': False, 'use_adx': False, 'use_ema': False, 'use_spike': True, 'rsi_required': True, 'edge_k': 0.6931618326568033, 'edge_cap': 0.8421259326177828, 'bull_strategy': 'mean_reversion', 'bull_bb_std_mult': 2.8474088341965063, 'bull_rsi_os': 37, 'bull_rsi_ob': 77, 'bull_adx_thresh': 26.145631533569826, 'bull_atr_min_pct': 0.02918479116361837, 'bull_atr_max_pct': 0.025351288448159315, 'bull_tp_mult': 1.280893694056484, 'bull_tsl_mult': 0.9764863046289673, 'bull_time_stop': 130, 'bull_use_sma': True, 'bull_use_ema': False, 'bull_use_atr': False, 'bull_use_adx': False, 'bull_use_spike': False, 'bull_rsi_required': False, 'bear_strategy': 'breakout', 'bear_bb_std_mult': 3.104098883141898, 'bear_rsi_os': 34, 'bear_rsi_ob': 93, 'bear_adx_thresh': 33.91533453563025, 'bear_atr_min_pct': 0.0014127977053889577, 'bear_atr_max_pct': 0.12381890067599882, 'bear_tp_mult': 2.843062961351639, 'bear_tsl_mult': 0.24594424313378477, 'bear_time_stop': 11, 'bear_use_sma': False, 'bear_use_ema': True, 'bear_use_atr': True, 'bear_use_adx': True, 'bear_use_spike': True, 'bear_rsi_required': False, 'sideways_strategy': 'mean_reversion', 'sideways_bb_std_mult': 0.8462969040514099, 'sideways_rsi_os': 28, 'sideways_rsi_ob': 57, 'sideways_adx_thresh': 26.251137240776295, 'sideways_atr_min_pct': 0.0013147191891192949, 'sideways_atr_max_pct': 0.06299791038706277, 'sideways_tp_mult': 1.4528569817378156, 'sideways_tsl_mult': 0.9131561105408418, 'sideways_time_stop': 93, 'sideways_use_sma': True, 'sideways_use_ema': False, 'sideways_use_atr': False, 'sideways_use_adx': False, 'sideways_use_spike': True, 'sideways_rsi_required': True}.
[I 2025-09-01 10:31:34,730] Trial 532 finished with values: [-1000000000.0, 1000000000.0] and parameters: {'p_sma': 46, 'p_std': 48, 'p_atr': 19, 'p_adx': 24, 'rsi_period': 64, 'ema1': 7, 'ema2': 31, 'slip_atr_k': 0.007904058438551572, 'slip_spread_k': 0.6177511935523968, 'spread_hl_frac': 0.0036514533593867853, 'bb_std_mult': 3.0266636614840032, 'rsi_os': 10, 'rsi_ob': 57, 'vol_spike': 0.18951822563799156, 'adx_thresh': 13.144469740343158, 'atr_min_pct': 0.020339153285644455, 'atr_max_pct': 0.049050544754625, 'tp_mult': 2.489254646805033, 'tsl_mult': 0.7789775351801315, 'strategy': 'breakout', 'time_stop': 165, 'use_sma': True, 'use_atr': True, 'use_adx': False, 'use_ema': False, 'use_spike': True, 'rsi_required': False, 'edge_k': 0.7049666705568187, 'edge_cap': 0.9447515556961252, 'bull_strategy': 'breakout', 'bull_bb_std_mult': 2.1136802900760707, 'bull_rsi_os': 40, 'bull_rsi_ob': 83, 'bull_adx_thresh': 27.502230846529233, 'bull_atr_min_pct': 0.007141659259025631, 'bull_atr_max_pct': 0.07857747541304234, 'bull_tp_mult': 2.150766977433924, 'bull_tsl_mult': 0.2152354924806258, 'bull_time_stop': 134, 'bull_use_sma': True, 'bull_use_ema': True, 'bull_use_atr': True, 'bull_use_adx': False, 'bull_use_spike': True, 'bull_rsi_required': False, 'bear_strategy': 'breakout', 'bear_bb_std_mult': 1.0125671627635973, 'bear_rsi_os': 33, 'bear_rsi_ob': 59, 'bear_adx_thresh': 34.99846720786477, 'bear_atr_min_pct': 0.02796457836334337, 'bear_atr_max_pct': 0.12795701918911753, 'bear_tp_mult': 2.8378422622624764, 'bear_tsl_mult': 0.03959703389321395, 'bear_time_stop': 92, 'bear_use_sma': False, 'bear_use_ema': True, 'bear_use_atr': True, 'bear_use_adx': True, 'bear_use_spike': False, 'bear_rsi_required': False, 'sideways_strategy': 'mean_reversion', 'sideways_bb_std_mult': 2.546184268231603, 'sideways_rsi_os': 28, 'sideways_rsi_ob': 81, 'sideways_adx_thresh': 18.580732702683807, 'sideways_atr_min_pct': 0.002252720510811202, 'sideways_atr_max_pct': 0.06322522605709505, 'sideways_tp_mult': 2.7797097284424024, 'sideways_tsl_mult': 0.9160252925347859, 'sideways_time_stop': 185, 'sideways_use_sma': True, 'sideways_use_ema': False, 'sideways_use_atr': False, 'sideways_use_adx': False, 'sideways_use_spike': True, 'sideways_rsi_required': False}.
