[I 2025-09-01 09:30:29,200] Trial 178 finished with values: [-1000000000.0, 1000000000.0] and parameters: {'p_sma': 59, 'p_std': 45, 'p_atr': 18, 'p_adx': 13, 'rsi_period': 53, 'ema1': 10, 'ema2': 10, 'slip_atr_k': 0.006945760147867597, 'slip_spread_k': 0.5732620259425435, 'spread_hl_frac': 0.007818193509814553, 'bb_std_mult': 1.697223672745319, 'rsi_os': 8, 'rsi_ob': 56, 'vol_spike': 0.19277452282653268, 'adx_thresh': 11.897506562097256, 'atr_min_pct': 0.019431628891841517, 'atr_max_pct': 0.06079159958674817, 'tp_mult': 2.641488025987216, 'tsl_mult': 0.8069008096229574, 'strategy': 'breakout', 'time_stop': 37, 'use_sma': False, 'use_atr': True, 'use_adx': False, 'use_ema': True, 'use_spike': False, 'rsi_required': True, 'edge_k': 0.7488648894025177, 'edge_cap': 0.768029715042692, 'bull_strategy': 'breakout', 'bull_bb_std_mult': 3.4825744308480604, 'bull_rsi_os': 39, 'bull_rsi_ob': 79, 'bull_adx_thresh': 27.847863346835236, 'bull_atr_min_pct': 0.004510562074904846, 'bull_atr_max_pct': 0.09174126244138653, 'bull_tp_mult': 1.5290440928482565, 'bull_tsl_mult': 0.9188405788491684, 'bull_time_stop': 139, 'bull_use_sma': True, 'bull_use_ema': True, 'bull_use_atr': False, 'bull_use_adx': False, 'bull_use_spike': False, 'bull_rsi_required': True, 'bear_strategy': 'breakout', 'bear_bb_std_mult': 2.252585129521475, 'bear_rsi_os': 44, 'bear_rsi_ob': 70, 'bear_adx_thresh': 33.9406824839437, 'bear_atr_min_pct': 0.015096370843838948, 'bear_atr_max_pct': 0.13171665487448492, 'bear_tp_mult': 2.652065592799753, 'bear_tsl_mult': 0.8567090672718833, 'bear_time_stop': 7, 'bear_use_sma': False, 'bear_use_ema': True, 'bear_use_atr': True, 'bear_use_adx': False, 'bear_use_spike': True, 'bear_rsi_required': True, 'sideways_strategy': 'mean_reversion', 'sideways_bb_std_mult': 2.5470246566426042, 'sideways_rsi_os': 33, 'sideways_rsi_ob': 73, 'sideways_adx_thresh': 32.04522601778412, 'sideways_atr_min_pct': 0.004807061935530928, 'sideways_atr_max_pct': 0.08681278552577401, 'sideways_tp_mult': 1.2202810744856225, 'sideways_tsl_mult': 0.9417249948530987, 'sideways_time_stop': 234, 'sideways_use_sma': True, 'sideways_use_ema': True, 'sideways_use_atr': True, 'sideways_use_adx': False, 'sideways_use_spike': True, 'sideways_rsi_required': True}.
[I 2025-09-01 09:30:29,495] Trial 181 finished with values: [-1000000000.0, 1000000000.0] and parameters: {'p_sma': 59, 'p_std': 45, 'p_atr': 29, 'p_adx': 13, 'rsi_period': 45, 'ema1': 8, 'ema2': 10, 'slip_atr_k': 0.010771487970802369, 'slip_spread_k': 0.5882432765763963, 'spread_hl_frac': 0.007757865094728873, 'bb_std_mult': 1.7534008278133206, 'rsi_os': 8, 'rsi_ob': 56, 'vol_spike': 0.18810435698656117, 'adx_thresh': 11.847740804064207, 'atr_min_pct': 0.019510236551141726, 'atr_max_pct': 0.06341451804569156, 'tp_mult': 2.556424965669727, 'tsl_mult': 0.7460436990064988, 'strategy': 'breakout', 'time_stop': 250, 'use_sma': False, 'use_atr': False, 'use_adx': False, 'use_ema': True, 'use_spike': False, 'rsi_required': True, 'edge_k': 0.7042762239215031, 'edge_cap': 0.6363451661216788, 'bull_strategy': 'breakout', 'bull_bb_std_mult': 3.5024014252037174, 'bull_rsi_os': 40, 'bull_rsi_ob': 79, 'bull_adx_thresh': 27.835252711693045, 'bull_atr_min_pct': 0.004990565909258352, 'bull_atr_max_pct': 0.07763734348230174, 'bull_tp_mult': 1.5189619079736618, 'bull_tsl_mult': 0.9168023067787662, 'bull_time_stop': 138, 'bull_use_sma': True, 'bull_use_ema': True, 'bull_use_atr': False, 'bull_use_adx': False, 'bull_use_spike': False, 'bull_rsi_required': True, 'bear_strategy': 'breakout', 'bear_bb_std_mult': 2.925667463475607, 'bear_rsi_os': 44, 'bear_rsi_ob': 73, 'bear_adx_thresh': 33.56715092517255, 'bear_atr_min_pct': 0.005338748375083899, 'bear_atr_max_pct': 0.12964303018033105, 'bear_tp_mult': 2.7406913486328763, 'bear_tsl_mult': 0.3300852018307603, 'bear_time_stop': 5, 'bear_use_sma': False, 'bear_use_ema': True, 'bear_use_atr': True, 'bear_use_adx': False, 'bear_use_spike': True, 'bear_rsi_required': True, 'sideways_strategy': 'mean_reversion', 'sideways_bb_std_mult': 2.5589595781073227, 'sideways_rsi_os': 32, 'sideways_rsi_ob': 63, 'sideways_adx_thresh': 32.103343714323344, 'sideways_atr_min_pct': 0.004881636149130529, 'sideways_atr_max_pct': 0.08680449090364928, 'sideways_tp_mult': 1.8644105409104776, 'sideways_tsl_mult': 0.9911627985324132, 'sideways_time_stop': 234, 'sideways_use_sma': True, 'sideways_use_ema': True, 'sideways_use_atr': True, 'sideways_use_adx': False, 'sideways_use_spike': True, 'sideways_rsi_required': True}.
[I 2025-09-01 09:31:07,889] Trial 183 finished with values: [-0.0034435016338422164, 0.004627680980702096] and parameters: {'p_sma': 59, 'p_std': 47, 'p_atr': 29, 'p_adx': 12, 'rsi_period': 47, 'ema1': 8, 'ema2': 11, 'slip_atr_k': 0.011394373984258986, 'slip_spread_k': 0.5933656156659607, 'spread_hl_frac': 0.009409435873004853, 'bb_std_mult': 1.5599290553145744, 'rsi_os': 7, 'rsi_ob': 54, 'vol_spike': 0.19799566333018462, 'adx_thresh': 12.706589341162214, 'atr_min_pct': 0.01813714968537284, 'atr_max_pct': 0.06517661234038491, 'tp_mult': 2.517018817265244, 'tsl_mult': 0.8540063172229048, 'strategy': 'breakout', 'time_stop': 152, 'use_sma': True, 'use_atr': False, 'use_adx': False, 'use_ema': False, 'use_spike': True, 'rsi_required': False, 'edge_k': 0.6905641911020478, 'edge_cap': 0.8171196621560158, 'bull_strategy': 'mean_reversion', 'bull_bb_std_mult': 3.5718534902765295, 'bull_rsi_os': 40, 'bull_rsi_ob': 80, 'bull_adx_thresh': 26.531509402907226, 'bull_atr_min_pct': 0.004090119184838553, 'bull_atr_max_pct': 0.08090916294506616, 'bull_tp_mult': 1.5023210910673306, 'bull_tsl_mult': 0.9131434839929609, 'bull_time_stop': 130, 'bull_use_sma': True, 'bull_use_ema': False, 'bull_use_atr': True, 'bull_use_adx': True, 'bull_use_spike': True, 'bull_rsi_required': False, 'bear_strategy': 'mean_reversion', 'bear_bb_std_mult': 2.089582883075829, 'bear_rsi_os': 42, 'bear_rsi_ob': 72, 'bear_adx_thresh': 33.51046268238827, 'bear_atr_min_pct': 0.028906874766277024, 'bear_atr_max_pct': 0.12914220666777773, 'bear_tp_mult': 2.770550024069578, 'bear_tsl_mult': 0.11918728050578636, 'bear_time_stop': 13, 'bear_use_sma': True, 'bear_use_ema': True, 'bear_use_atr': True, 'bear_use_adx': True, 'bear_use_spike': True, 'bear_rsi_required': False, 'sideways_strategy': 'breakout', 'sideways_bb_std_mult': 2.5732935937475783, 'sideways_rsi_os': 31, 'sideways_rsi_ob': 61, 'sideways_adx_thresh': 32.91883367065644, 'sideways_atr_min_pct': 0.003105640159027925, 'sideways_atr_max_pct': 0.018484284117992196, 'sideways_tp_mult': 1.8838947627009193, 'sideways_tsl_mult': 0.9841009248565217, 'sideways_time_stop': 88, 'sideways_use_sma': True, 'sideways_use_ema': False, 'sideways_use_atr': False, 'sideways_use_adx': False, 'sideways_use_spike': True, 'sideways_rsi_required': False}.
[I 2025-09-01 09:31:08,313] Trial 182 finished with values: [-0.012146273446725586, 0.012656156325319221] and parameters: {'p_sma': 59, 'p_std': 48, 'p_atr': 12, 'p_adx': 12, 'rsi_period': 47, 'ema1': 8, 'ema2': 11, 'slip_atr_k': 0.010632078101599432, 'slip_spread_k': 0.5235568013113276, 'spread_hl_frac': 0.009380066414826046, 'bb_std_mult': 2.5485081972218393, 'rsi_os': 7, 'rsi_ob': 83, 'vol_spike': 0.19629885027708893, 'adx_thresh': 12.885498597479248, 'atr_min_pct': 0.018412570423379907, 'atr_max_pct': 0.06471889410684752, 'tp_mult': 2.571160817982038, 'tsl_mult': 0.8480243648918047, 'strategy': 'breakout', 'time_stop': 146, 'use_sma': True, 'use_atr': False, 'use_adx': False, 'use_ema': False, 'use_spike': True, 'rsi_required': False, 'edge_k': 0.7055957252897996, 'edge_cap': 0.8069044334778047, 'bull_strategy': 'mean_reversion', 'bull_bb_std_mult': 3.598759331517779, 'bull_rsi_os': 40, 'bull_rsi_ob': 80, 'bull_adx_thresh': 26.334170381293177, 'bull_atr_min_pct': 0.004537256674219423, 'bull_atr_max_pct': 0.0825469231841621, 'bull_tp_mult': 1.594375018989601, 'bull_tsl_mult': 0.9034490569942286, 'bull_time_stop': 128, 'bull_use_sma': True, 'bull_use_ema': False, 'bull_use_atr': True, 'bull_use_adx': True, 'bull_use_spike': True, 'bull_rsi_required': False, 'bear_strategy': 'mean_reversion', 'bear_bb_std_mult': 1.4724262116488098, 'bear_rsi_os': 42, 'bear_rsi_ob': 72, 'bear_adx_thresh': 32.47907808818566, 'bear_atr_min_pct': 0.0007604014303942558, 'bear_atr_max_pct': 0.12522037584492746, 'bear_tp_mult': 2.762789849137551, 'bear_tsl_mult': 0.12137359745926501, 'bear_time_stop': 17, 'bear_use_sma': True, 'bear_use_ema': True, 'bear_use_atr': True, 'bear_use_adx': True, 'bear_use_spike': True, 'bear_rsi_required': False, 'sideways_strategy': 'breakout', 'sideways_bb_std_mult': 2.4698379889158697, 'sideways_rsi_os': 31, 'sideways_rsi_ob': 61, 'sideways_adx_thresh': 33.262580980149586, 'sideways_atr_min_pct': 0.003315811115923421, 'sideways_atr_max_pct': 0.11293010981032711, 'sideways_tp_mult': 1.347741121965828, 'sideways_tsl_mult': 0.9048026511389902, 'sideways_time_stop': 35, 'sideways_use_sma': True, 'sideways_use_ema': False, 'sideways_use_atr': False, 'sideways_use_adx': False, 'sideways_use_spike': True, 'sideways_rsi_required': False}.
[I 2025-09-01 09:31:08,738] Trial 185 finished with values: [-0.004760803163171068, 0.005693631693458384] and parameters: {'p_sma': 59, 'p_std': 47, 'p_atr': 14, 'p_adx': 11, 'rsi_period': 43, 'ema1': 9, 'ema2': 11, 'slip_atr_k': 0.004440216776506702, 'slip_spread_k': 0.5708602650996859, 'spread_hl_frac': 0.009188348411991515, 'bb_std_mult': 1.3665968799862838, 'rsi_os': 7, 'rsi_ob': 54, 'vol_spike': 0.1968622601877942, 'adx_thresh': 12.555761292820414, 'atr_min_pct': 0.018108494777736038, 'atr_max_pct': 0.06697057655055152, 'tp_mult': 2.507779359238173, 'tsl_mult': 0.8416393523011885, 'strategy': 'breakout', 'time_stop': 283, 'use_sma': True, 'use_atr': True, 'use_adx': False, 'use_ema': False, 'use_spike': True, 'rsi_required': False, 'edge_k': 0.6252959232867839, 'edge_cap': 0.8281270148147969, 'bull_strategy': 'mean_reversion', 'bull_bb_std_mult': 3.5515008771750605, 'bull_rsi_os': 38, 'bull_rsi_ob': 80, 'bull_adx_thresh': 26.32171129875647, 'bull_atr_min_pct': 0.004287462941666725, 'bull_atr_max_pct': 0.08099652481614203, 'bull_tp_mult': 1.436819351650208, 'bull_tsl_mult': 0.9090447269103459, 'bull_time_stop': 131, 'bull_use_sma': True, 'bull_use_ema': False, 'bull_use_atr': True, 'bull_use_adx': True, 'bull_use_spike': True, 'bull_rsi_required': False, 'bear_strategy': 'mean_reversion', 'bear_bb_std_mult': 1.4867081292041255, 'bear_rsi_os': 42, 'bear_rsi_ob': 71, 'bear_adx_thresh': 32.49621894049853, 'bear_atr_min_pct': 0.02899180191723394, 'bear_atr_max_pct': 0.12513574174459874, 'bear_tp_mult': 2.7749198953612426, 'bear_tsl_mult': 0.3010011324864431, 'bear_time_stop': 14, 'bear_use_sma': True, 'bear_use_ema': True, 'bear_use_atr': True, 'bear_use_adx': True, 'bear_use_spike': True, 'bear_rsi_required': False, 'sideways_strategy': 'breakout', 'sideways_bb_std_mult': 2.4499677849046453, 'sideways_rsi_os': 31, 'sideways_rsi_ob': 61, 'sideways_adx_thresh': 32.89469987609774, 'sideways_atr_min_pct': 0.0034885021789919607, 'sideways_atr_max_pct': 0.13694432299788434, 'sideways_tp_mult': 1.3458059000944986, 'sideways_tsl_mult': 0.9098372860256808, 'sideways_time_stop': 226, 'sideways_use_sma': True, 'sideways_use_ema': False, 'sideways_use_atr': False, 'sideways_use_adx': False, 'sideways_use_spike': True, 'sideways_rsi_required': False}.
[I 2025-09-01 09:31:08,955] Trial 184 finished with values: [-0.01600448799901566, 0.016588970314092122] and parameters: {'p_sma': 59, 'p_std': 47, 'p_atr': 12, 'p_adx': 12, 'rsi_period': 13, 'ema1': 8, 'ema2': 47, 'slip_atr_k': 0.004948993021095858, 'slip_spread_k': 0.5642027252082148, 'spread_hl_frac': 0.009587687370313493, 'bb_std_mult': 1.558740685828189, 'rsi_os': 7, 'rsi_ob': 75, 'vol_spike': 0.1959844085009736, 'adx_thresh': 12.938218629929112, 'atr_min_pct': 0.018166434308407593, 'atr_max_pct': 0.06495553268645961, 'tp_mult': 2.563971424587624, 'tsl_mult': 0.8336640104891893, 'strategy': 'breakout', 'time_stop': 289, 'use_sma': True, 'use_atr': False, 'use_adx': False, 'use_ema': False, 'use_spike': True, 'rsi_required': False, 'edge_k': 0.7006153730298481, 'edge_cap': 0.8036427589785023, 'bull_strategy': 'mean_reversion', 'bull_bb_std_mult': 3.5981287563808344, 'bull_rsi_os': 38, 'bull_rsi_ob': 81, 'bull_adx_thresh': 26.263668184144453, 'bull_atr_min_pct': 0.004239379518412531, 'bull_atr_max_pct': 0.08143739404209678, 'bull_tp_mult': 1.4913344577213452, 'bull_tsl_mult': 0.9073202176615179, 'bull_time_stop': 130, 'bull_use_sma': True, 'bull_use_ema': False, 'bull_use_atr': True, 'bull_use_adx': True, 'bull_use_spike': True, 'bull_rsi_required': False, 'bear_strategy': 'mean_reversion', 'bear_bb_std_mult': 1.5705012229992126, 'bear_rsi_os': 42, 'bear_rsi_ob': 72, 'bear_adx_thresh': 32.434991013146885, 'bear_atr_min_pct': 0.02890906009351957, 'bear_atr_max_pct': 0.1247866777541497, 'bear_tp_mult': 2.7453164599622717, 'bear_tsl_mult': 0.11439732145441267, 'bear_time_stop': 11, 'bear_use_sma': True, 'bear_use_ema': True, 'bear_use_atr': True, 'bear_use_adx': True, 'bear_use_spike': True, 'bear_rsi_required': False, 'sideways_strategy': 'breakout', 'sideways_bb_std_mult': 2.5605167859920948, 'sideways_rsi_os': 31, 'sideways_rsi_ob': 61, 'sideways_adx_thresh': 32.90694506836679, 'sideways_atr_min_pct': 0.0030955752473165645, 'sideways_atr_max_pct': 0.13686988905153807, 'sideways_tp_mult': 1.886655717484661, 'sideways_tsl_mult': 0.9065529604900386, 'sideways_time_stop': 228, 'sideways_use_sma': True, 'sideways_use_ema': False, 'sideways_use_atr': False, 'sideways_use_adx': False, 'sideways_use_spike': True, 'sideways_rsi_required': False}.
[I 2025-09-01 09:31:48,516] Trial 188 finished with values: [-0.018953651189196896, 0.018722875490700907] and parameters: {'p_sma': 43, 'p_std': 47, 'p_atr': 14, 'p_adx': 12, 'rsi_period': 43, 'ema1': 9, 'ema2': 11, 'slip_atr_k': 0.23782725859658302, 'slip_spread_k': 0.5634123775240044, 'spread_hl_frac': 0.00936716584070375, 'bb_std_mult': 1.3854553255386102, 'rsi_os': 7, 'rsi_ob': 48, 'vol_spike': 0.1961002769530421, 'adx_thresh': 13.023917850161439, 'atr_min_pct': 0.01827957674364348, 'atr_max_pct': 0.06836843122781763, 'tp_mult': 2.5776025514156133, 'tsl_mult': 0.834282987403949, 'strategy': 'breakout', 'time_stop': 232, 'use_sma': True, 'use_atr': False, 'use_adx': False, 'use_ema': False, 'use_spike': True, 'rsi_required': False, 'edge_k': 0.6597754522594147, 'edge_cap': 0.8111579158489846, 'bull_strategy': 'mean_reversion', 'bull_bb_std_mult': 3.5817705557929935, 'bull_rsi_os': 39, 'bull_rsi_ob': 80, 'bull_adx_thresh': 26.121468260960228, 'bull_atr_min_pct': 0.004208981579524013, 'bull_atr_max_pct': 0.07366333338019676, 'bull_tp_mult': 1.5955917946626337, 'bull_tsl_mult': 0.8978573383776381, 'bull_time_stop': 155, 'bull_use_sma': True, 'bull_use_ema': False, 'bull_use_atr': True, 'bull_use_adx': True, 'bull_use_spike': True, 'bull_rsi_required': False, 'bear_strategy': 'breakout', 'bear_bb_std_mult': 1.5816748585744471, 'bear_rsi_os': 42, 'bear_rsi_ob': 71, 'bear_adx_thresh': 34.586748884238524, 'bear_atr_min_pct': 0.0010501002357169928, 'bear_atr_max_pct': 0.12472071146943349, 'bear_tp_mult': 2.7662456128564843, 'bear_tsl_mult': 0.8155519526861729, 'bear_time_stop': 12, 'bear_use_sma': True, 'bear_use_ema': True, 'bear_use_atr': True, 'bear_use_adx': True, 'bear_use_spike': True, 'bear_rsi_required': False, 'sideways_strategy': 'mean_reversion', 'sideways_bb_std_mult': 2.4635335686745505, 'sideways_rsi_os': 31, 'sideways_rsi_ob': 61, 'sideways_adx_thresh': 33.13997266081991, 'sideways_atr_min_pct': 0.003367080045542513, 'sideways_atr_max_pct': 0.0906593167096444, 'sideways_tp_mult': 1.2831500690062823, 'sideways_tsl_mult': 0.9402880062802299, 'sideways_time_stop': 226, 'sideways_use_sma': True, 'sideways_use_ema': False, 'sideways_use_atr': False, 'sideways_use_adx': False, 'sideways_use_spike': True, 'sideways_rsi_required': False}.
[I 2025-09-01 09:31:49,031] Trial 189 finished with values: [-1000000000.0, 1000000000.0] and parameters: {'p_sma': 58, 'p_std': 47, 'p_atr': 10, 'p_adx': 11, 'rsi_period': 47, 'ema1': 9, 'ema2': 11, 'slip_atr_k': 0.005045110931752408, 'slip_spread_k': 0.6456720378677174, 'spread_hl_frac': 0.0062763260906508155, 'bb_std_mult': 2.5456656984253696, 'rsi_os': 9, 'rsi_ob': 55, 'vol_spike': 0.20132399843998025, 'adx_thresh': 12.822105940601988, 'atr_min_pct': 0.018146076012496157, 'atr_max_pct': 0.06802092402587964, 'tp_mult': 1.2584211820223656, 'tsl_mult': 0.7825132647399148, 'strategy': 'breakout', 'time_stop': 152, 'use_sma': True, 'use_atr': True, 'use_adx': False, 'use_ema': False, 'use_spike': True, 'rsi_required': False, 'edge_k': 0.6351467566136088, 'edge_cap': 0.8336381896314591, 'bull_strategy': 'mean_reversion', 'bull_bb_std_mult': 3.4035770403135506, 'bull_rsi_os': 38, 'bull_rsi_ob': 80, 'bull_adx_thresh': 27.62151973362698, 'bull_atr_min_pct': 0.004156110173838846, 'bull_atr_max_pct': 0.07308443761732185, 'bull_tp_mult': 1.423533503361195, 'bull_tsl_mult': 0.9700375806646534, 'bull_time_stop': 151, 'bull_use_sma': True, 'bull_use_ema': False, 'bull_use_atr': True, 'bull_use_adx': False, 'bull_use_spike': True, 'bull_rsi_required': False, 'bear_strategy': 'breakout', 'bear_bb_std_mult': 1.4360387677660436, 'bear_rsi_os': 45, 'bear_rsi_ob': 71, 'bear_adx_thresh': 34.36008783518436, 'bear_atr_min_pct': 0.02733358944017973, 'bear_atr_max_pct': 0.12969973650759606, 'bear_tp_mult': 2.8382136932178503, 'bear_tsl_mult': 0.8186375233316094, 'bear_time_stop': 16, 'bear_use_sma': True, 'bear_use_ema': True, 'bear_use_atr': True, 'bear_use_adx': True, 'bear_use_spike': True, 'bear_rsi_required': False, 'sideways_strategy': 'mean_reversion', 'sideways_bb_std_mult': 2.4619405939074714, 'sideways_rsi_os': 31, 'sideways_rsi_ob': 60, 'sideways_adx_thresh': 33.35488125572098, 'sideways_atr_min_pct': 0.006498117812152038, 'sideways_atr_max_pct': 0.09143255380094499, 'sideways_tp_mult': 1.280599304689846, 'sideways_tsl_mult': 0.9349861063989579, 'sideways_time_stop': 217, 'sideways_use_sma': True, 'sideways_use_ema': False, 'sideways_use_atr': False, 'sideways_use_adx': False, 'sideways_use_spike': True, 'sideways_rsi_required': False}.
[I 2025-09-01 09:31:49,872] Trial 186 finished with values: [-0.015405934689892042, 0.016131490123784106] and parameters: {'p_sma': 29, 'p_std': 47, 'p_atr': 11, 'p_adx': 12, 'rsi_period': 13, 'ema1': 9, 'ema2': 54, 'slip_atr_k': 0.005153527338064755, 'slip_spread_k': 0.5619151422986093, 'spread_hl_frac': 0.009558773814272656, 'bb_std_mult': 1.3167996554845707, 'rsi_os': 7, 'rsi_ob': 75, 'vol_spike': 0.19762731292120048, 'adx_thresh': 12.678593985141845, 'atr_min_pct': 0.018189015137046488, 'atr_max_pct': 0.06780785188697777, 'tp_mult': 2.5230073839391998, 'tsl_mult': 0.8523513375302977, 'strategy': 'breakout', 'time_stop': 285, 'use_sma': True, 'use_atr': False, 'use_adx': False, 'use_ema': False, 'use_spike': True, 'rsi_required': False, 'edge_k': 0.6392577857942531, 'edge_cap': 0.8229174052444378, 'bull_strategy': 'mean_reversion', 'bull_bb_std_mult': 3.5643186434177534, 'bull_rsi_os': 38, 'bull_rsi_ob': 80, 'bull_adx_thresh': 26.228130772266347, 'bull_atr_min_pct': 0.003940134604374652, 'bull_atr_max_pct': 0.07238217613466767, 'bull_tp_mult': 1.5972469137964151, 'bull_tsl_mult': 0.9691328844478128, 'bull_time_stop': 153, 'bull_use_sma': True, 'bull_use_ema': False, 'bull_use_atr': True, 'bull_use_adx': True, 'bull_use_spike': True, 'bull_rsi_required': False, 'bear_strategy': 'mean_reversion', 'bear_bb_std_mult': 3.0524894482331657, 'bear_rsi_os': 43, 'bear_rsi_ob': 71, 'bear_adx_thresh': 34.61206096401689, 'bear_atr_min_pct': 0.029026727722450876, 'bear_atr_max_pct': 0.12521442094129273, 'bear_tp_mult': 2.7897640378416035, 'bear_tsl_mult': 0.299648339722247, 'bear_time_stop': 14, 'bear_use_sma': True, 'bear_use_ema': True, 'bear_use_atr': True, 'bear_use_adx': True, 'bear_use_spike': True, 'bear_rsi_required': False, 'sideways_strategy': 'breakout', 'sideways_bb_std_mult': 2.464489396492137, 'sideways_rsi_os': 31, 'sideways_rsi_ob': 61, 'sideways_adx_thresh': 32.985963606042404, 'sideways_atr_min_pct': 0.0031673766245092524, 'sideways_atr_max_pct': 0.09166351343326064, 'sideways_tp_mult': 1.283748210865303, 'sideways_tsl_mult': 0.9412043522811107, 'sideways_time_stop': 226, 'sideways_use_sma': True, 'sideways_use_ema': False, 'sideways_use_atr': False, 'sideways_use_adx': False, 'sideways_use_spike': True, 'sideways_rsi_required': False}.
