[I 2025-09-01 09:05:18,548] Trial 10 finished with values: [-1000000000.0, 1000000000.0] and parameters: {'p_sma': 6, 'p_std': 31, 'p_atr': 12, 'p_adx': 22, 'rsi_period': 66, 'ema1': 21, 'ema2': 51, 'slip_atr_k': 0.10340321889582021, 'slip_spread_k': 0.9836868052537605, 'spread_hl_frac': 0.03407738851062542, 'bb_std_mult': 2.6849958025058633, 'rsi_os': 14, 'rsi_ob': 81, 'vol_spike': 0.027456635503216496, 'adx_thresh': 23.667278267144614, 'atr_min_pct': 0.028776487548540543, 'atr_max_pct': 0.02876278384627858, 'tp_mult': 2.50951012986509, 'tsl_mult': 0.04664202247546856, 'strategy': 'breakout', 'time_stop': 275, 'use_sma': False, 'use_atr': False, 'use_adx': True, 'use_ema': True, 'use_spike': True, 'rsi_required': False, 'edge_k': 0.008571478344616024, 'edge_cap': 0.655189911409437, 'bull_strategy': 'breakout', 'bull_bb_std_mult': 3.0586242262018204, 'bull_rsi_os': 37, 'bull_rsi_ob': 85, 'bull_adx_thresh': 12.123261710337482, 'bull_atr_min_pct': 0.0015770835512955682, 'bull_atr_max_pct': 0.11090152730150069, 'bull_tp_mult': 2.8674020565028453, 'bull_tsl_mult': 0.11894818498788928, 'bull_time_stop': 137, 'bull_use_sma': False, 'bull_use_ema': False, 'bull_use_atr': False, 'bull_use_adx': True, 'bull_use_spike': False, 'bull_rsi_required': True, 'bear_strategy': 'mean_reversion', 'bear_bb_std_mult': 2.903011667975949, 'bear_rsi_os': 48, 'bear_rsi_ob': 68, 'bear_adx_thresh': 24.424432093749868, 'bear_atr_min_pct': 0.002384046904933421, 'bear_atr_max_pct': 0.0587401271836237, 'bear_tp_mult': 1.8966878564488716, 'bear_tsl_mult': 0.12047702657667492, 'bear_time_stop': 143, 'bear_use_sma': False, 'bear_use_ema': False, 'bear_use_atr': True, 'bear_use_adx': False, 'bear_use_spike': True, 'bear_rsi_required': False, 'sideways_strategy': 'breakout', 'sideways_bb_std_mult': 2.858254225540315, 'sideways_rsi_os': 33, 'sideways_rsi_ob': 74, 'sideways_adx_thresh': 12.362810417177565, 'sideways_atr_min_pct': 0.016585831834391697, 'sideways_atr_max_pct': 0.026237969445591695, 'sideways_tp_mult': 2.837382696603351, 'sideways_tsl_mult': 0.31527666449331837, 'sideways_time_stop': 165, 'sideways_use_sma': False, 'sideways_use_ema': True, 'sideways_use_atr': False, 'sideways_use_adx': True, 'sideways_use_spike': True, 'sideways_rsi_required': False}.
[I 2025-09-01 09:05:59,097] Trial 9 finished with values: [-1000000000.0, 1000000000.0] and parameters: {'p_sma': 51, 'p_std': 42, 'p_atr': 25, 'p_adx': 30, 'rsi_period': 72, 'ema1': 14, 'ema2': 17, 'slip_atr_k': 0.0804080522185594, 'slip_spread_k': 0.38797414180270584, 'spread_hl_frac': 0.02460322900175026, 'bb_std_mult': 1.2041339777347806, 'rsi_os': 24, 'rsi_ob': 54, 'vol_spike': 0.2989051583866963, 'adx_thresh': 31.75881358705455, 'atr_min_pct': 0.0004862253709141373, 'atr_max_pct': 0.050225880973975436, 'tp_mult': 1.7014584660506145, 'tsl_mult': 0.780205233137172, 'strategy': 'mean_reversion', 'time_stop': 292, 'use_sma': False, 'use_atr': False, 'use_adx': True, 'use_ema': True, 'use_spike': False, 'rsi_required': False, 'edge_k': 0.6428606099811405, 'edge_cap': 0.7502728257660949, 'bull_strategy': 'breakout', 'bull_bb_std_mult': 0.559854163724712, 'bull_rsi_os': 8, 'bull_rsi_ob': 62, 'bull_adx_thresh': 22.493921670869344, 'bull_atr_min_pct': 0.003777649618936457, 'bull_atr_max_pct': 0.03813563494265467, 'bull_tp_mult': 1.0140809260520813, 'bull_tsl_mult': 0.2796733276316181, 'bull_time_stop': 63, 'bull_use_sma': True, 'bull_use_ema': True, 'bull_use_atr': True, 'bull_use_adx': False, 'bull_use_spike': True, 'bull_rsi_required': True, 'bear_strategy': 'mean_reversion', 'bear_bb_std_mult': 1.8562964655034542, 'bear_rsi_os': 22, 'bear_rsi_ob': 61, 'bear_adx_thresh': 33.67328931793588, 'bear_atr_min_pct': 0.026852931391018003, 'bear_atr_max_pct': 0.046070645026220186, 'bear_tp_mult': 1.2803846246272237, 'bear_tsl_mult': 0.8407195993085433, 'bear_time_stop': 36, 'bear_use_sma': False, 'bear_use_ema': False, 'bear_use_atr': True, 'bear_use_adx': False, 'bear_use_spike': True, 'bear_rsi_required': True, 'sideways_strategy': 'breakout', 'sideways_bb_std_mult': 3.0451103428841844, 'sideways_rsi_os': 8, 'sideways_rsi_ob': 83, 'sideways_adx_thresh': 34.65562991793625, 'sideways_atr_min_pct': 0.016124207993020705, 'sideways_atr_max_pct': 0.057704595633527984, 'sideways_tp_mult': 1.2493431334692822, 'sideways_tsl_mult': 0.05020768272643683, 'sideways_time_stop': 15, 'sideways_use_sma': True, 'sideways_use_ema': True, 'sideways_use_atr': False, 'sideways_use_adx': False, 'sideways_use_spike': True, 'sideways_rsi_required': False}.
[I 2025-09-01 09:06:00,127] Trial 12 finished with values: [-0.029660323015253787, 0.029653840782392686] and parameters: {'p_sma': 40, 'p_std': 43, 'p_atr': 22, 'p_adx': 7, 'rsi_period': 7, 'ema1': 6, 'ema2': 21, 'slip_atr_k': 0.2336156673892648, 'slip_spread_k': 0.3030339685513119, 'spread_hl_frac': 0.016848608180080982, 'bb_std_mult': 1.640182309936876, 'rsi_os': 33, 'rsi_ob': 60, 'vol_spike': 0.18305987072885016, 'adx_thresh': 6.099413669733178, 'atr_min_pct': 0.021562064197470875, 'atr_max_pct': 0.14826139456067147, 'tp_mult': 2.0932523069220257, 'tsl_mult': 0.9980713052427703, 'strategy': 'mean_reversion', 'time_stop': 118, 'use_sma': True, 'use_atr': True, 'use_adx': False, 'use_ema': False, 'use_spike': True, 'rsi_required': False, 'edge_k': 0.643346617058993, 'edge_cap': 0.3581391329068553, 'bull_strategy': 'mean_reversion', 'bull_bb_std_mult': 3.5390300881609527, 'bull_rsi_os': 52, 'bull_rsi_ob': 49, 'bull_adx_thresh': 5.475648387942453, 'bull_atr_min_pct': 0.001495865459414528, 'bull_atr_max_pct': 0.012786995410654652, 'bull_tp_mult': 1.0284610945499184, 'bull_tsl_mult': 0.05278722600512892, 'bull_time_stop': 208, 'bull_use_sma': False, 'bull_use_ema': False, 'bull_use_atr': True, 'bull_use_adx': False, 'bull_use_spike': True, 'bull_rsi_required': True, 'bear_strategy': 'breakout', 'bear_bb_std_mult': 3.4973881026613167, 'bear_rsi_os': 37, 'bear_rsi_ob': 66, 'bear_adx_thresh': 34.803167544421996, 'bear_atr_min_pct': 0.019627687639606844, 'bear_atr_max_pct': 0.10335906886663852, 'bear_tp_mult': 2.335102357984942, 'bear_tsl_mult': 0.6182350363232414, 'bear_time_stop': 37, 'bear_use_sma': False, 'bear_use_ema': True, 'bear_use_atr': False, 'bear_use_adx': True, 'bear_use_spike': False, 'bear_rsi_required': False, 'sideways_strategy': 'mean_reversion', 'sideways_bb_std_mult': 1.6000613571642384, 'sideways_rsi_os': 29, 'sideways_rsi_ob': 46, 'sideways_adx_thresh': 5.23643370477736, 'sideways_atr_min_pct': 0.029288344887509137, 'sideways_atr_max_pct': 0.06696583041992876, 'sideways_tp_mult': 1.2978744080433948, 'sideways_tsl_mult': 0.902114039645585, 'sideways_time_stop': 234, 'sideways_use_sma': True, 'sideways_use_ema': False, 'sideways_use_atr': False, 'sideways_use_adx': False, 'sideways_use_spike': False, 'sideways_rsi_required': False}.
[I 2025-09-01 09:06:00,150] Trial 13 finished with values: [-0.016205457134198742, 0.0159253032150437] and parameters: {'p_sma': 41, 'p_std': 46, 'p_atr': 22, 'p_adx': 8, 'rsi_period': 7, 'ema1': 7, 'ema2': 59, 'slip_atr_k': 0.24404674746864746, 'slip_spread_k': 0.27865807457778824, 'spread_hl_frac': 0.01608278978907677, 'bb_std_mult': 1.541239783025314, 'rsi_os': 6, 'rsi_ob': 60, 'vol_spike': 0.18624149804624593, 'adx_thresh': 6.914069290132263, 'atr_min_pct': 0.02049032790017437, 'atr_max_pct': 0.14952053218834113, 'tp_mult': 2.0081235835435876, 'tsl_mult': 0.9790589305863966, 'strategy': 'mean_reversion', 'time_stop': 114, 'use_sma': True, 'use_atr': True, 'use_adx': False, 'use_ema': False, 'use_spike': True, 'rsi_required': False, 'edge_k': 0.6592997919213298, 'edge_cap': 0.341993670593103, 'bull_strategy': 'mean_reversion', 'bull_bb_std_mult': 3.5384467124504315, 'bull_rsi_os': 5, 'bull_rsi_ob': 45, 'bull_adx_thresh': 5.056751109085537, 'bull_atr_min_pct': 0.0026111417675779213, 'bull_atr_max_pct': 0.012493452566137913, 'bull_tp_mult': 1.046913458640031, 'bull_tsl_mult': 0.048161795235132365, 'bull_time_stop': 215, 'bull_use_sma': False, 'bull_use_ema': False, 'bull_use_atr': True, 'bull_use_adx': False, 'bull_use_spike': True, 'bull_rsi_required': True, 'bear_strategy': 'breakout', 'bear_bb_std_mult': 3.458246951068057, 'bear_rsi_os': 36, 'bear_rsi_ob': 66, 'bear_adx_thresh': 34.87050698149726, 'bear_atr_min_pct': 0.01930043462583351, 'bear_atr_max_pct': 0.10115734291676996, 'bear_tp_mult': 2.3367656723068255, 'bear_tsl_mult': 0.6382083313286666, 'bear_time_stop': 32, 'bear_use_sma': False, 'bear_use_ema': True, 'bear_use_atr': False, 'bear_use_adx': True, 'bear_use_spike': False, 'bear_rsi_required': False, 'sideways_strategy': 'mean_reversion', 'sideways_bb_std_mult': 1.6760311691485805, 'sideways_rsi_os': 34, 'sideways_rsi_ob': 95, 'sideways_adx_thresh': 33.72300068047116, 'sideways_atr_min_pct': 0.027337070383092972, 'sideways_atr_max_pct': 0.067597988592111, 'sideways_tp_mult': 1.0936150781822396, 'sideways_tsl_mult': 0.8860945845216381, 'sideways_time_stop': 225, 'sideways_use_sma': True, 'sideways_use_ema': False, 'sideways_use_atr': False, 'sideways_use_adx': False, 'sideways_use_spike': False, 'sideways_rsi_required': False}.
[I 2025-09-01 09:06:00,494] Trial 11 finished with values: [-1000000000.0, 1000000000.0] and parameters: {'p_sma': 24, 'p_std': 47, 'p_atr': 29, 'p_adx': 28, 'rsi_period': 35, 'ema1': 28, 'ema2': 33, 'slip_atr_k': 0.19071929781787947, 'slip_spread_k': 0.6783143298422573, 'spread_hl_frac': 0.0403123817293195, 'bb_std_mult': 2.488117471398876, 'rsi_os': 44, 'rsi_ob': 81, 'vol_spike': 0.2620575687323367, 'adx_thresh': 21.33533347806906, 'atr_min_pct': 0.027565815262071428, 'atr_max_pct': 0.04398510187800417, 'tp_mult': 2.6841941475538738, 'tsl_mult': 0.8487787667125952, 'strategy': 'breakout', 'time_stop': 183, 'use_sma': False, 'use_atr': False, 'use_adx': True, 'use_ema': True, 'use_spike': True, 'rsi_required': False, 'edge_k': 0.04952699810444261, 'edge_cap': 0.10888721162892986, 'bull_strategy': 'breakout', 'bull_bb_std_mult': 0.5956567468140241, 'bull_rsi_os': 26, 'bull_rsi_ob': 89, 'bull_adx_thresh': 13.875132033157518, 'bull_atr_min_pct': 0.011747807799398585, 'bull_atr_max_pct': 0.11887067038910198, 'bull_tp_mult': 2.5399002863468776, 'bull_tsl_mult': 0.11803735363786905, 'bull_time_stop': 53, 'bull_use_sma': False, 'bull_use_ema': True, 'bull_use_atr': True, 'bull_use_adx': False, 'bull_use_spike': True, 'bull_rsi_required': False, 'bear_strategy': 'mean_reversion', 'bear_bb_std_mult': 0.505776126155429, 'bear_rsi_os': 37, 'bear_rsi_ob': 81, 'bear_adx_thresh': 12.798996998547313, 'bear_atr_min_pct': 0.008428022691615092, 'bear_atr_max_pct': 0.13569320488765796, 'bear_tp_mult': 2.1724582533121066, 'bear_tsl_mult': 0.8502966324031416, 'bear_time_stop': 233, 'bear_use_sma': False, 'bear_use_ema': True, 'bear_use_atr': True, 'bear_use_adx': True, 'bear_use_spike': False, 'bear_rsi_required': False, 'sideways_strategy': 'breakout', 'sideways_bb_std_mult': 3.477764379018887, 'sideways_rsi_os': 31, 'sideways_rsi_ob': 57, 'sideways_adx_thresh': 7.6535556944113505, 'sideways_atr_min_pct': 0.0034922296145533725, 'sideways_atr_max_pct': 0.02480622193303228, 'sideways_tp_mult': 2.574952444393216, 'sideways_tsl_mult': 0.8792027053856033, 'sideways_time_stop': 257, 'sideways_use_sma': False, 'sideways_use_ema': False, 'sideways_use_atr': True, 'sideways_use_adx': False, 'sideways_use_spike': True, 'sideways_rsi_required': False}.
[I 2025-09-01 09:06:41,870] Trial 17 finished with values: [-1000000000.0, 1000000000.0] and parameters: {'p_sma': 39, 'p_std': 39, 'p_atr': 7, 'p_adx': 7, 'rsi_period': 7, 'ema1': 5, 'ema2': 60, 'slip_atr_k': 0.24836855441728448, 'slip_spread_k': 0.19719149412922543, 'spread_hl_frac': 0.011559612640443879, 'bb_std_mult': 1.7645347757199632, 'rsi_os': 5, 'rsi_ob': 63, 'vol_spike': 0.15023691998049749, 'adx_thresh': 5.007458699296013, 'atr_min_pct': 0.01862248346024732, 'atr_max_pct': 0.13471901606320247, 'tp_mult': 2.3459768217809445, 'tsl_mult': 0.9977190541480166, 'strategy': 'mean_reversion', 'time_stop': 86, 'use_sma': True, 'use_atr': True, 'use_adx': False, 'use_ema': False, 'use_spike': True, 'rsi_required': False, 'edge_k': 0.3799450738186413, 'edge_cap': 0.39983294127127406, 'bull_strategy': 'mean_reversion', 'bull_bb_std_mult': 3.5338018643244213, 'bull_rsi_os': 5, 'bull_rsi_ob': 47, 'bull_adx_thresh': 8.661984802714752, 'bull_atr_min_pct': 0.006116277945350421, 'bull_atr_max_pct': 0.011829211150072898, 'bull_tp_mult': 1.4410313223702864, 'bull_tsl_mult': 0.013314369259229852, 'bull_time_stop': 193, 'bull_use_sma': False, 'bull_use_ema': False, 'bull_use_atr': True, 'bull_use_adx': False, 'bull_use_spike': True, 'bull_rsi_required': True, 'bear_strategy': 'breakout', 'bear_bb_std_mult': 3.4123539814099573, 'bear_rsi_os': 6, 'bear_rsi_ob': 72, 'bear_adx_thresh': 6.059335859414816, 'bear_atr_min_pct': 0.016353253792043446, 'bear_atr_max_pct': 0.10307009790957627, 'bear_tp_mult': 2.3035980107637313, 'bear_tsl_mult': 0.5682245329213178, 'bear_time_stop': 83, 'bear_use_sma': False, 'bear_use_ema': True, 'bear_use_atr': False, 'bear_use_adx': True, 'bear_use_spike': False, 'bear_rsi_required': False, 'sideways_strategy': 'mean_reversion', 'sideways_bb_std_mult': 1.3456282468377094, 'sideways_rsi_os': 42, 'sideways_rsi_ob': 93, 'sideways_adx_thresh': 24.571799639182977, 'sideways_atr_min_pct': 0.02648513408588061, 'sideways_atr_max_pct': 0.08912461076187513, 'sideways_tp_mult': 1.0185514412267693, 'sideways_tsl_mult': 0.8321712868027292, 'sideways_time_stop': 202, 'sideways_use_sma': True, 'sideways_use_ema': False, 'sideways_use_atr': False, 'sideways_use_adx': False, 'sideways_use_spike': False, 'sideways_rsi_required': False}.
[I 2025-09-01 09:06:41,656] Trial 16 finished with values: [-1000000000.0, 1000000000.0] and parameters: {'p_sma': 40, 'p_std': 38, 'p_atr': 8, 'p_adx': 7, 'rsi_period': 9, 'ema1': 5, 'ema2': 60, 'slip_atr_k': 0.24159380641723, 'slip_spread_k': 0.2128783545036334, 'spread_hl_frac': 0.012745492642968342, 'bb_std_mult': 1.9552092621516661, 'rsi_os': 5, 'rsi_ob': 64, 'vol_spike': 0.13515756398476617, 'adx_thresh': 7.406742669235847, 'atr_min_pct': 0.019488905753824764, 'atr_max_pct': 0.14447207568293513, 'tp_mult': 2.3602135847914765, 'tsl_mult': 0.9865181069943336, 'strategy': 'mean_reversion', 'time_stop': 91, 'use_sma': True, 'use_atr': True, 'use_adx': False, 'use_ema': False, 'use_spike': True, 'rsi_required': False, 'edge_k': 0.986252177348531, 'edge_cap': 0.39597172447331597, 'bull_strategy': 'mean_reversion', 'bull_bb_std_mult': 3.398389217088915, 'bull_rsi_os': 5, 'bull_rsi_ob': 47, 'bull_adx_thresh': 8.620624397674849, 'bull_atr_min_pct': 0.005562046060465627, 'bull_atr_max_pct': 0.012638580700025985, 'bull_tp_mult': 1.44597297923627, 'bull_tsl_mult': 0.025308822049642965, 'bull_time_stop': 198, 'bull_use_sma': False, 'bull_use_ema': False, 'bull_use_atr': True, 'bull_use_adx': False, 'bull_use_spike': True, 'bull_rsi_required': True, 'bear_strategy': 'breakout', 'bear_bb_std_mult': 3.5503018160190836, 'bear_rsi_os': 7, 'bear_rsi_ob': 74, 'bear_adx_thresh': 5.2317952329988024, 'bear_atr_min_pct': 0.014416973445508966, 'bear_atr_max_pct': 0.09950705901223565, 'bear_tp_mult': 2.416670991263664, 'bear_tsl_mult': 0.6239360181617517, 'bear_time_stop': 67, 'bear_use_sma': False, 'bear_use_ema': True, 'bear_use_atr': False, 'bear_use_adx': True, 'bear_use_spike': False, 'bear_rsi_required': False, 'sideways_strategy': 'mean_reversion', 'sideways_bb_std_mult': 1.3618856188616864, 'sideways_rsi_os': 40, 'sideways_rsi_ob': 95, 'sideways_adx_thresh': 34.80520220795793, 'sideways_atr_min_pct': 0.02983075454514966, 'sideways_atr_max_pct': 0.09510206745114487, 'sideways_tp_mult': 1.0298006968094324, 'sideways_tsl_mult': 0.7711686649106022, 'sideways_time_stop': 203, 'sideways_use_sma': True, 'sideways_use_ema': False, 'sideways_use_atr': False, 'sideways_use_adx': False, 'sideways_use_spike': False, 'sideways_rsi_required': False}.
[I 2025-09-01 09:06:41,885] Trial 15 finished with values: [-1000000000.0, 1000000000.0] and parameters: {'p_sma': 40, 'p_std': 41, 'p_atr': 23, 'p_adx': 7, 'rsi_period': 8, 'ema1': 6, 'ema2': 59, 'slip_atr_k': 0.24122285253496858, 'slip_spread_k': 0.14119991878442317, 'spread_hl_frac': 0.013760199552540552, 'bb_std_mult': 1.9256302002355419, 'rsi_os': 6, 'rsi_ob': 65, 'vol_spike': 0.1348437397909097, 'adx_thresh': 6.051397930150539, 'atr_min_pct': 0.01969764626395817, 'atr_max_pct': 0.14543393901271917, 'tp_mult': 2.4891897882142526, 'tsl_mult': 0.9848689726108697, 'strategy': 'mean_reversion', 'time_stop': 90, 'use_sma': True, 'use_atr': True, 'use_adx': False, 'use_ema': False, 'use_spike': True, 'rsi_required': False, 'edge_k': 0.9736419426498153, 'edge_cap': 0.35149753450388466, 'bull_strategy': 'mean_reversion', 'bull_bb_std_mult': 3.4702132953475107, 'bull_rsi_os': 5, 'bull_rsi_ob': 47, 'bull_adx_thresh': 10.077077512744502, 'bull_atr_min_pct': 0.006086509380166657, 'bull_atr_max_pct': 0.04829087622803198, 'bull_tp_mult': 1.4263529489017575, 'bull_tsl_mult': 0.003496343081879072, 'bull_time_stop': 200, 'bull_use_sma': False, 'bull_use_ema': False, 'bull_use_atr': True, 'bull_use_adx': False, 'bull_use_spike': True, 'bull_rsi_required': True, 'bear_strategy': 'breakout', 'bear_bb_std_mult': 3.573285985686712, 'bear_rsi_os': 42, 'bear_rsi_ob': 76, 'bear_adx_thresh': 5.471547918258752, 'bear_atr_min_pct': 0.014896949535804584, 'bear_atr_max_pct': 0.09600934089164295, 'bear_tp_mult': 2.311824415536434, 'bear_tsl_mult': 0.538927728719858, 'bear_time_stop': 88, 'bear_use_sma': False, 'bear_use_ema': True, 'bear_use_atr': False, 'bear_use_adx': True, 'bear_use_spike': False, 'bear_rsi_required': False, 'sideways_strategy': 'mean_reversion', 'sideways_bb_std_mult': 1.3772116121283353, 'sideways_rsi_os': 39, 'sideways_rsi_ob': 92, 'sideways_adx_thresh': 24.760393049370073, 'sideways_atr_min_pct': 0.029849915087565064, 'sideways_atr_max_pct': 0.09438815279521638, 'sideways_tp_mult': 1.0271876981430654, 'sideways_tsl_mult': 0.8090767912419803, 'sideways_time_stop': 208, 'sideways_use_sma': True, 'sideways_use_ema': False, 'sideways_use_atr': False, 'sideways_use_adx': False, 'sideways_use_spike': False, 'sideways_rsi_required': False}.
[I 2025-09-01 09:06:41,904] Trial 14 finished with values: [-0.2702257646695989, 0.27014367136772555] and parameters: {'p_sma': 41, 'p_std': 42, 'p_atr': 21, 'p_adx': 7, 'rsi_period': 7, 'ema1': 6, 'ema2': 24, 'slip_atr_k': 0.24917708402909033, 'slip_spread_k': 0.28979507107943947, 'spread_hl_frac': 0.016721426224007307, 'bb_std_mult': 2.0959133436814774, 'rsi_os': 38, 'rsi_ob': 67, 'vol_spike': 0.1859836976201608, 'adx_thresh': 6.824410735881259, 'atr_min_pct': 0.02080572455419495, 'atr_max_pct': 0.13944068065922416, 'tp_mult': 2.929413994911762, 'tsl_mult': 0.9848977562613046, 'strategy': 'mean_reversion', 'time_stop': 97, 'use_sma': True, 'use_atr': True, 'use_adx': False, 'use_ema': True, 'use_spike': False, 'rsi_required': False, 'edge_k': 0.4965450189527799, 'edge_cap': 0.3601620826423807, 'bull_strategy': 'mean_reversion', 'bull_bb_std_mult': 3.2916950327053667, 'bull_rsi_os': 46, 'bull_rsi_ob': 45, 'bull_adx_thresh': 29.818346195222446, 'bull_atr_min_pct': 0.01719719359723245, 'bull_atr_max_pct': 0.010436834690592544, 'bull_tp_mult': 1.528710767231895, 'bull_tsl_mult': 0.032486667847904216, 'bull_time_stop': 200, 'bull_use_sma': False, 'bull_use_ema': False, 'bull_use_atr': True, 'bull_use_adx': False, 'bull_use_spike': True, 'bull_rsi_required': True, 'bear_strategy': 'breakout', 'bear_bb_std_mult': 3.3896784472314816, 'bear_rsi_os': 38, 'bear_rsi_ob': 45, 'bear_adx_thresh': 5.015512578905966, 'bear_atr_min_pct': 0.01884606173866815, 'bear_atr_max_pct': 0.011577255323295878, 'bear_tp_mult': 2.3020120842760283, 'bear_tsl_mult': 0.6236391270573368, 'bear_time_stop': 74, 'bear_use_sma': False, 'bear_use_ema': True, 'bear_use_atr': False, 'bear_use_adx': True, 'bear_use_spike': False, 'bear_rsi_required': False, 'sideways_strategy': 'mean_reversion', 'sideways_bb_std_mult': 1.4829102562965875, 'sideways_rsi_os': 32, 'sideways_rsi_ob': 46, 'sideways_adx_thresh': 7.368842331753993, 'sideways_atr_min_pct': 0.0004063445532906855, 'sideways_atr_max_pct': 0.07315068454307198, 'sideways_tp_mult': 1.0250510198081124, 'sideways_tsl_mult': 0.9501854992216792, 'sideways_time_stop': 232, 'sideways_use_sma': False, 'sideways_use_ema': False, 'sideways_use_atr': False, 'sideways_use_adx': False, 'sideways_use_spike': False, 'sideways_rsi_required': False}.
