[I 2025-08-30 16:39:39,162] Trial 486 finished with values: [-1000000000.0, 1000000000.0] and parameters: {'p_sma': 57, 'p_std': 58, 'p_atr': 24, 'p_adx': 22, 'rsi_period': 40, 'ema1': 16, 'ema2': 18, 'slip_atr_k': 0.11590157809334384, 'slip_spread_k': 0.6087515719322577, 'spread_hl_frac': 0.017121041988592725, 'bb_std_mult': 3.122459884146532, 'rsi_os': 26, 'rsi_ob': 87, 'vol_spike': 0.1213718564643136, 'adx_thresh': 31.451529335273918, 'atr_min_pct': 0.01787076208350167, 'atr_max_pct': 0.09392165929926943, 'tp_mult': 2.7471412792135266, 'tsl_mult': 0.19106319685097528, 'strategy': 'mean_reversion', 'time_stop': 19, 'use_sma': False, 'use_atr': True, 'use_adx': True, 'use_ema': False, 'use_spike': False, 'rsi_required': True, 'edge_k': 1.582092597123537, 'edge_cap': 0.6301246317929238, 'bull_strategy': 'mean_reversion', 'bull_bb_std_mult': 2.2384579292426925, 'bull_rsi_os': 31, 'bull_rsi_ob': 47, 'bull_adx_thresh': 5.858496751475231, 'bull_atr_min_pct': 0.02269724677859948, 'bull_atr_max_pct': 0.13561906534665794, 'bull_tp_mult': 2.1057510120051663, 'bull_tsl_mult': 0.2990455512818172, 'bull_time_stop': 107, 'bull_use_sma': False, 'bull_use_ema': True, 'bull_use_atr': True, 'bull_use_adx': True, 'bull_use_spike': False, 'bull_rsi_required': False, 'bear_strategy': 'mean_reversion', 'bear_bb_std_mult': 1.0602867772452913, 'bear_rsi_os': 14, 'bear_rsi_ob': 78, 'bear_adx_thresh': 13.094968127428306, 'bear_atr_min_pct': 0.011781187147233535, 'bear_atr_max_pct': 0.08724176700751923, 'bear_tp_mult': 1.0928504490412094, 'bear_tsl_mult': 0.42606189760289304, 'bear_time_stop': 90, 'bear_use_sma': True, 'bear_use_ema': False, 'bear_use_atr': False, 'bear_use_adx': False, 'bear_use_spike': False, 'bear_rsi_required': False, 'sideways_strategy': 'breakout', 'sideways_bb_std_mult': 2.2502953154082883, 'sideways_rsi_os': 29, 'sideways_rsi_ob': 64, 'sideways_adx_thresh': 14.832066554886751, 'sideways_atr_min_pct': 0.002153133007559531, 'sideways_atr_max_pct': 0.14618060442380898, 'sideways_tp_mult': 1.3820761199280052, 'sideways_tsl_mult': 0.48386381953559127, 'sideways_time_stop': 213, 'sideways_use_sma': True, 'sideways_use_ema': False, 'sideways_use_atr': False, 'sideways_use_adx': False, 'sideways_use_spike': False, 'sideways_rsi_required': True}.
[I 2025-08-30 16:40:23,106] Trial 487 finished with values: [-1000000000.0, 1000000000.0] and parameters: {'p_sma': 38, 'p_std': 58, 'p_atr': 25, 'p_adx': 22, 'rsi_period': 39, 'ema1': 27, 'ema2': 11, 'slip_atr_k': 0.16604233454564438, 'slip_spread_k': 0.33507584760719905, 'spread_hl_frac': 0.03671071354241182, 'bb_std_mult': 3.2172725448673325, 'rsi_os': 32, 'rsi_ob': 91, 'vol_spike': 0.005522825787092891, 'adx_thresh': 13.707826449286953, 'atr_min_pct': 0.004945622891721301, 'atr_max_pct': 0.13467599042748257, 'tp_mult': 2.339372415755522, 'tsl_mult': 0.658617072682725, 'strategy': 'mean_reversion', 'time_stop': 21, 'use_sma': False, 'use_atr': True, 'use_adx': True, 'use_ema': False, 'use_spike': False, 'rsi_required': True, 'edge_k': 1.5805940622924277, 'edge_cap': 0.17326058751455592, 'bull_strategy': 'mean_reversion', 'bull_bb_std_mult': 3.5230522960353357, 'bull_rsi_os': 13, 'bull_rsi_ob': 67, 'bull_adx_thresh': 16.88257723205051, 'bull_atr_min_pct': 0.011558861370548821, 'bull_atr_max_pct': 0.09037276817057446, 'bull_tp_mult': 1.375435142515735, 'bull_tsl_mult': 0.7493980796080327, 'bull_time_stop': 268, 'bull_use_sma': False, 'bull_use_ema': True, 'bull_use_atr': True, 'bull_use_adx': True, 'bull_use_spike': False, 'bull_rsi_required': False, 'bear_strategy': 'mean_reversion', 'bear_bb_std_mult': 2.029354750427358, 'bear_rsi_os': 32, 'bear_rsi_ob': 78, 'bear_adx_thresh': 9.002175727231318, 'bear_atr_min_pct': 0.018049262529701963, 'bear_atr_max_pct': 0.08499276722699543, 'bear_tp_mult': 2.282380193758932, 'bear_tsl_mult': 0.6840635251776073, 'bear_time_stop': 224, 'bear_use_sma': True, 'bear_use_ema': False, 'bear_use_atr': False, 'bear_use_adx': False, 'bear_use_spike': False, 'bear_rsi_required': False, 'sideways_strategy': 'breakout', 'sideways_bb_std_mult': 2.250063882133606, 'sideways_rsi_os': 8, 'sideways_rsi_ob': 59, 'sideways_adx_thresh': 16.562804539281945, 'sideways_atr_min_pct': 0.029286500627999163, 'sideways_atr_max_pct': 0.14639707449884526, 'sideways_tp_mult': 1.378225040241986, 'sideways_tsl_mult': 0.47631840928136404, 'sideways_time_stop': 208, 'sideways_use_sma': True, 'sideways_use_ema': False, 'sideways_use_atr': False, 'sideways_use_adx': False, 'sideways_use_spike': False, 'sideways_rsi_required': True}.
[I 2025-08-30 16:40:24,046] Trial 488 finished with values: [-1000000000.0, 1000000000.0] and parameters: {'p_sma': 24, 'p_std': 58, 'p_atr': 25, 'p_adx': 21, 'rsi_period': 13, 'ema1': 16, 'ema2': 11, 'slip_atr_k': 0.1137653022045046, 'slip_spread_k': 0.3949166272305479, 'spread_hl_frac': 0.015466311188039018, 'bb_std_mult': 0.9515214297891537, 'rsi_os': 42, 'rsi_ob': 90, 'vol_spike': 5.72527154804314e-05, 'adx_thresh': 13.802598462161157, 'atr_min_pct': 0.0025978404727021245, 'atr_max_pct': 0.13536053341087875, 'tp_mult': 2.9970623833320458, 'tsl_mult': 0.4958464764069534, 'strategy': 'mean_reversion', 'time_stop': 5, 'use_sma': False, 'use_atr': True, 'use_adx': True, 'use_ema': False, 'use_spike': False, 'rsi_required': True, 'edge_k': 1.5901419044181573, 'edge_cap': 0.17337928235586342, 'bull_strategy': 'breakout', 'bull_bb_std_mult': 3.0554984992154117, 'bull_rsi_os': 11, 'bull_rsi_ob': 70, 'bull_adx_thresh': 19.324067985248316, 'bull_atr_min_pct': 0.025954065719226226, 'bull_atr_max_pct': 0.13498304711732742, 'bull_tp_mult': 1.4563722190262, 'bull_tsl_mult': 0.3024633322935478, 'bull_time_stop': 73, 'bull_use_sma': False, 'bull_use_ema': False, 'bull_use_atr': True, 'bull_use_adx': True, 'bull_use_spike': False, 'bull_rsi_required': False, 'bear_strategy': 'mean_reversion', 'bear_bb_std_mult': 2.304363416219563, 'bear_rsi_os': 46, 'bear_rsi_ob': 78, 'bear_adx_thresh': 8.09832131594668, 'bear_atr_min_pct': 0.011845760100134434, 'bear_atr_max_pct': 0.09217305121047145, 'bear_tp_mult': 2.2879581444958683, 'bear_tsl_mult': 0.6371411747324671, 'bear_time_stop': 89, 'bear_use_sma': False, 'bear_use_ema': False, 'bear_use_atr': False, 'bear_use_adx': False, 'bear_use_spike': False, 'bear_rsi_required': False, 'sideways_strategy': 'breakout', 'sideways_bb_std_mult': 1.8419543283294972, 'sideways_rsi_os': 21, 'sideways_rsi_ob': 55, 'sideways_adx_thresh': 16.62094622363053, 'sideways_atr_min_pct': 0.002838596841804315, 'sideways_atr_max_pct': 0.14576480443319326, 'sideways_tp_mult': 1.387191067858565, 'sideways_tsl_mult': 0.5238264278399793, 'sideways_time_stop': 210, 'sideways_use_sma': False, 'sideways_use_ema': False, 'sideways_use_atr': False, 'sideways_use_adx': True, 'sideways_use_spike': False, 'sideways_rsi_required': False}.
[I 2025-08-30 16:40:24,656] Trial 490 finished with values: [-0.0183176975238577, 0.018239364171841646] and parameters: {'p_sma': 27, 'p_std': 57, 'p_atr': 25, 'p_adx': 28, 'rsi_period': 25, 'ema1': 26, 'ema2': 22, 'slip_atr_k': 0.047647515740680796, 'slip_spread_k': 0.5637363298001503, 'spread_hl_frac': 0.015438019915603257, 'bb_std_mult': 3.206669480615019, 'rsi_os': 16, 'rsi_ob': 91, 'vol_spike': 0.13119257964227707, 'adx_thresh': 34.621086435863546, 'atr_min_pct': 0.004922108592613876, 'atr_max_pct': 0.13686752686415318, 'tp_mult': 2.3240806586675875, 'tsl_mult': 0.40956007100978475, 'strategy': 'mean_reversion', 'time_stop': 244, 'use_sma': True, 'use_atr': True, 'use_adx': True, 'use_ema': True, 'use_spike': False, 'rsi_required': True, 'edge_k': 1.3661621429550261, 'edge_cap': 0.23040825699263573, 'bull_strategy': 'breakout', 'bull_bb_std_mult': 3.510456353534389, 'bull_rsi_os': 40, 'bull_rsi_ob': 83, 'bull_adx_thresh': 11.370452835926708, 'bull_atr_min_pct': 0.011629897724329772, 'bull_atr_max_pct': 0.13042435369662414, 'bull_tp_mult': 1.314770776670576, 'bull_tsl_mult': 0.6783552774685484, 'bull_time_stop': 64, 'bull_use_sma': False, 'bull_use_ema': False, 'bull_use_atr': True, 'bull_use_adx': True, 'bull_use_spike': False, 'bull_rsi_required': False, 'bear_strategy': 'breakout', 'bear_bb_std_mult': 2.316854037578081, 'bear_rsi_os': 21, 'bear_rsi_ob': 65, 'bear_adx_thresh': 9.222042218676247, 'bear_atr_min_pct': 0.01795312248406279, 'bear_atr_max_pct': 0.10533724683986138, 'bear_tp_mult': 2.2854573308763197, 'bear_tsl_mult': 0.6259377376901418, 'bear_time_stop': 171, 'bear_use_sma': False, 'bear_use_ema': False, 'bear_use_atr': False, 'bear_use_adx': False, 'bear_use_spike': False, 'bear_rsi_required': False, 'sideways_strategy': 'breakout', 'sideways_bb_std_mult': 2.1275800913947682, 'sideways_rsi_os': 25, 'sideways_rsi_ob': 93, 'sideways_adx_thresh': 16.877200477139493, 'sideways_atr_min_pct': 0.0007177714593101911, 'sideways_atr_max_pct': 0.14288427500762288, 'sideways_tp_mult': 1.5113844274695443, 'sideways_tsl_mult': 0.22763212031376623, 'sideways_time_stop': 211, 'sideways_use_sma': False, 'sideways_use_ema': True, 'sideways_use_atr': False, 'sideways_use_adx': True, 'sideways_use_spike': False, 'sideways_rsi_required': False}.
[I 2025-08-30 16:40:25,085] Trial 489 finished with values: [-1000000000.0, 1000000000.0] and parameters: {'p_sma': 24, 'p_std': 58, 'p_atr': 25, 'p_adx': 21, 'rsi_period': 13, 'ema1': 27, 'ema2': 11, 'slip_atr_k': 0.20447365909057044, 'slip_spread_k': 0.39671968387627016, 'spread_hl_frac': 0.0163095022489727, 'bb_std_mult': 0.9781323768304093, 'rsi_os': 26, 'rsi_ob': 91, 'vol_spike': 1.1248690869411103e-06, 'adx_thresh': 16.008083051215387, 'atr_min_pct': 0.019890779424118224, 'atr_max_pct': 0.13899918494862237, 'tp_mult': 2.7675953785542475, 'tsl_mult': 0.05103501958877843, 'strategy': 'mean_reversion', 'time_stop': 194, 'use_sma': True, 'use_atr': True, 'use_adx': True, 'use_ema': True, 'use_spike': False, 'rsi_required': True, 'edge_k': 1.580994866846125, 'edge_cap': 0.6964343003685994, 'bull_strategy': 'breakout', 'bull_bb_std_mult': 1.9033343866923282, 'bull_rsi_os': 13, 'bull_rsi_ob': 93, 'bull_adx_thresh': 19.768501824381175, 'bull_atr_min_pct': 0.011064501247248722, 'bull_atr_max_pct': 0.1354534662882171, 'bull_tp_mult': 1.5253224914967412, 'bull_tsl_mult': 0.6685907769001813, 'bull_time_stop': 142, 'bull_use_sma': False, 'bull_use_ema': False, 'bull_use_atr': True, 'bull_use_adx': True, 'bull_use_spike': False, 'bull_rsi_required': False, 'bear_strategy': 'breakout', 'bear_bb_std_mult': 3.365840076803461, 'bear_rsi_os': 14, 'bear_rsi_ob': 50, 'bear_adx_thresh': 19.819504133559516, 'bear_atr_min_pct': 0.022132875214010757, 'bear_atr_max_pct': 0.08550353764954055, 'bear_tp_mult': 2.276999951858123, 'bear_tsl_mult': 0.48341493658525014, 'bear_time_stop': 229, 'bear_use_sma': False, 'bear_use_ema': False, 'bear_use_atr': False, 'bear_use_adx': False, 'bear_use_spike': False, 'bear_rsi_required': False, 'sideways_strategy': 'breakout', 'sideways_bb_std_mult': 2.138589076267472, 'sideways_rsi_os': 29, 'sideways_rsi_ob': 93, 'sideways_adx_thresh': 14.991255526512058, 'sideways_atr_min_pct': 0.002797072038857186, 'sideways_atr_max_pct': 0.14596867265405303, 'sideways_tp_mult': 1.3724466578743244, 'sideways_tsl_mult': 0.48453512469680016, 'sideways_time_stop': 57, 'sideways_use_sma': False, 'sideways_use_ema': True, 'sideways_use_atr': False, 'sideways_use_adx': True, 'sideways_use_spike': False, 'sideways_rsi_required': False}.
[I 2025-08-30 16:41:11,687] Trial 494 finished with values: [-1000000000.0, 1000000000.0] and parameters: {'p_sma': 46, 'p_std': 60, 'p_atr': 27, 'p_adx': 27, 'rsi_period': 50, 'ema1': 22, 'ema2': 13, 'slip_atr_k': 0.039804961669543004, 'slip_spread_k': 0.863908610959202, 'spread_hl_frac': 0.013980345734775164, 'bb_std_mult': 2.1450044044844634, 'rsi_os': 37, 'rsi_ob': 78, 'vol_spike': 0.011857418758911392, 'adx_thresh': 12.732853784122167, 'atr_min_pct': 0.011126730048637488, 'atr_max_pct': 0.14339909936536022, 'tp_mult': 2.4644659006613328, 'tsl_mult': 0.9568928368384577, 'strategy': 'breakout', 'time_stop': 12, 'use_sma': False, 'use_atr': True, 'use_adx': False, 'use_ema': False, 'use_spike': True, 'rsi_required': True, 'edge_k': 0.12001090833543593, 'edge_cap': 0.9431002006624907, 'bull_strategy': 'mean_reversion', 'bull_bb_std_mult': 2.1457117724476187, 'bull_rsi_os': 12, 'bull_rsi_ob': 51, 'bull_adx_thresh': 20.962570456204524, 'bull_atr_min_pct': 0.01754818605953831, 'bull_atr_max_pct': 0.018579888913872952, 'bull_tp_mult': 1.4304928140677904, 'bull_tsl_mult': 0.8729756606169203, 'bull_time_stop': 46, 'bull_use_sma': False, 'bull_use_ema': True, 'bull_use_atr': True, 'bull_use_adx': False, 'bull_use_spike': False, 'bull_rsi_required': False, 'bear_strategy': 'mean_reversion', 'bear_bb_std_mult': 3.485952530796382, 'bear_rsi_os': 11, 'bear_rsi_ob': 74, 'bear_adx_thresh': 13.951968139455438, 'bear_atr_min_pct': 0.020609795306228525, 'bear_atr_max_pct': 0.14982801354407177, 'bear_tp_mult': 2.210720894537293, 'bear_tsl_mult': 0.5889086711582037, 'bear_time_stop': 210, 'bear_use_sma': True, 'bear_use_ema': True, 'bear_use_atr': True, 'bear_use_adx': False, 'bear_use_spike': False, 'bear_rsi_required': False, 'sideways_strategy': 'breakout', 'sideways_bb_std_mult': 1.498172319757387, 'sideways_rsi_os': 53, 'sideways_rsi_ob': 49, 'sideways_adx_thresh': 34.232190981156506, 'sideways_atr_min_pct': 0.013507736670060793, 'sideways_atr_max_pct': 0.13627807019592567, 'sideways_tp_mult': 1.6986551415577036, 'sideways_tsl_mult': 0.4461849470561242, 'sideways_time_stop': 90, 'sideways_use_sma': True, 'sideways_use_ema': False, 'sideways_use_atr': False, 'sideways_use_adx': False, 'sideways_use_spike': False, 'sideways_rsi_required': True}.
[I 2025-08-30 16:41:12,473] Trial 493 finished with values: [-1000000000.0, 1000000000.0] and parameters: {'p_sma': 7, 'p_std': 60, 'p_atr': 27, 'p_adx': 25, 'rsi_period': 42, 'ema1': 15, 'ema2': 10, 'slip_atr_k': 0.010040938236855795, 'slip_spread_k': 0.5819983853277095, 'spread_hl_frac': 0.019670027654198063, 'bb_std_mult': 1.1824367249618097, 'rsi_os': 36, 'rsi_ob': 75, 'vol_spike': 0.18811800709227947, 'adx_thresh': 15.876416576795346, 'atr_min_pct': 0.012845954767015385, 'atr_max_pct': 0.14447767390907795, 'tp_mult': 1.813661111087775, 'tsl_mult': 0.46328239898027873, 'strategy': 'breakout', 'time_stop': 14, 'use_sma': True, 'use_atr': True, 'use_adx': False, 'use_ema': True, 'use_spike': False, 'rsi_required': True, 'edge_k': 1.760549177145876, 'edge_cap': 0.6729134701508376, 'bull_strategy': 'mean_reversion', 'bull_bb_std_mult': 3.309934665892987, 'bull_rsi_os': 5, 'bull_rsi_ob': 51, 'bull_adx_thresh': 27.152638461041562, 'bull_atr_min_pct': 0.018977383785234413, 'bull_atr_max_pct': 0.061067751590241165, 'bull_tp_mult': 1.5130327910669252, 'bull_tsl_mult': 0.3520759582179762, 'bull_time_stop': 79, 'bull_use_sma': False, 'bull_use_ema': True, 'bull_use_atr': True, 'bull_use_adx': False, 'bull_use_spike': False, 'bull_rsi_required': False, 'bear_strategy': 'breakout', 'bear_bb_std_mult': 0.5952120357862252, 'bear_rsi_os': 11, 'bear_rsi_ob': 80, 'bear_adx_thresh': 13.985937247058109, 'bear_atr_min_pct': 0.022092322550770066, 'bear_atr_max_pct': 0.09212813869458271, 'bear_tp_mult': 2.2076864179146027, 'bear_tsl_mult': 0.4791566223034909, 'bear_time_stop': 230, 'bear_use_sma': True, 'bear_use_ema': True, 'bear_use_atr': True, 'bear_use_adx': False, 'bear_use_spike': False, 'bear_rsi_required': False, 'sideways_strategy': 'breakout', 'sideways_bb_std_mult': 1.2646048820005504, 'sideways_rsi_os': 27, 'sideways_rsi_ob': 72, 'sideways_adx_thresh': 15.496533768252037, 'sideways_atr_min_pct': 0.0023361804372422873, 'sideways_atr_max_pct': 0.05437463840270465, 'sideways_tp_mult': 1.7157470806311996, 'sideways_tsl_mult': 0.44637271429477476, 'sideways_time_stop': 160, 'sideways_use_sma': True, 'sideways_use_ema': True, 'sideways_use_atr': False, 'sideways_use_adx': False, 'sideways_use_spike': False, 'sideways_rsi_required': True}.
[I 2025-08-30 16:41:13,591] Trial 491 finished with values: [-1000000000.0, 1000000000.0] and parameters: {'p_sma': 46, 'p_std': 59, 'p_atr': 28, 'p_adx': 20, 'rsi_period': 13, 'ema1': 13, 'ema2': 10, 'slip_atr_k': 0.008605300594771102, 'slip_spread_k': 0.28169382308278107, 'spread_hl_frac': 0.015675193961047666, 'bb_std_mult': 0.9689809779807796, 'rsi_os': 16, 'rsi_ob': 90, 'vol_spike': 0.07032038762199339, 'adx_thresh': 29.227344543025886, 'atr_min_pct': 0.01554879765493987, 'atr_max_pct': 0.13833223586331453, 'tp_mult': 2.453761248335751, 'tsl_mult': 0.4972106313305494, 'strategy': 'mean_reversion', 'time_stop': 248, 'use_sma': True, 'use_atr': True, 'use_adx': True, 'use_ema': True, 'use_spike': False, 'rsi_required': True, 'edge_k': 1.5098202261966343, 'edge_cap': 0.6696571706131921, 'bull_strategy': 'breakout', 'bull_bb_std_mult': 1.9193574600534866, 'bull_rsi_os': 38, 'bull_rsi_ob': 70, 'bull_adx_thresh': 19.793272331965042, 'bull_atr_min_pct': 0.019090744229004152, 'bull_atr_max_pct': 0.1349126778256334, 'bull_tp_mult': 1.4595970153616182, 'bull_tsl_mult': 0.52579026611891, 'bull_time_stop': 61, 'bull_use_sma': False, 'bull_use_ema': False, 'bull_use_atr': True, 'bull_use_adx': True, 'bull_use_spike': False, 'bull_rsi_required': False, 'bear_strategy': 'breakout', 'bear_bb_std_mult': 2.29957787227438, 'bear_rsi_os': 45, 'bear_rsi_ob': 80, 'bear_adx_thresh': 12.177903980982984, 'bear_atr_min_pct': 0.023607045293993625, 'bear_atr_max_pct': 0.09198036891068422, 'bear_tp_mult': 1.2144996593414263, 'bear_tsl_mult': 0.38516977127180707, 'bear_time_stop': 228, 'bear_use_sma': False, 'bear_use_ema': False, 'bear_use_atr': False, 'bear_use_adx': False, 'bear_use_spike': False, 'bear_rsi_required': False, 'sideways_strategy': 'breakout', 'sideways_bb_std_mult': 2.1420595483954137, 'sideways_rsi_os': 27, 'sideways_rsi_ob': 67, 'sideways_adx_thresh': 16.715789388728705, 'sideways_atr_min_pct': 0.005846609951810234, 'sideways_atr_max_pct': 0.04762159375002853, 'sideways_tp_mult': 2.9981142394962634, 'sideways_tsl_mult': 0.5248394465058035, 'sideways_time_stop': 216, 'sideways_use_sma': False, 'sideways_use_ema': True, 'sideways_use_atr': False, 'sideways_use_adx': True, 'sideways_use_spike': False, 'sideways_rsi_required': False}.
[I 2025-08-30 16:41:14,021] Trial 492 finished with values: [-1000000000.0, 1000000000.0] and parameters: {'p_sma': 7, 'p_std': 37, 'p_atr': 27, 'p_adx': 29, 'rsi_period': 72, 'ema1': 26, 'ema2': 10, 'slip_atr_k': 0.20510379389609218, 'slip_spread_k': 0.8459019565402154, 'spread_hl_frac': 0.019532395267290583, 'bb_std_mult': 1.1583358020728742, 'rsi_os': 30, 'rsi_ob': 93, 'vol_spike': 0.06927556489510965, 'adx_thresh': 25.02474349885157, 'atr_min_pct': 0.00017976741524449238, 'atr_max_pct': 0.12434209801266498, 'tp_mult': 2.7520672198552623, 'tsl_mult': 0.951288163392487, 'strategy': 'mean_reversion', 'time_stop': 14, 'use_sma': True, 'use_atr': True, 'use_adx': True, 'use_ema': True, 'use_spike': False, 'rsi_required': True, 'edge_k': 1.3510890761753631, 'edge_cap': 0.9282686057518323, 'bull_strategy': 'breakout', 'bull_bb_std_mult': 2.0026516727126094, 'bull_rsi_os': 12, 'bull_rsi_ob': 51, 'bull_adx_thresh': 20.89285105735054, 'bull_atr_min_pct': 0.012686048875030533, 'bull_atr_max_pct': 0.1121782437968265, 'bull_tp_mult': 1.5292258357670585, 'bull_tsl_mult': 0.2511034682137132, 'bull_time_stop': 63, 'bull_use_sma': False, 'bull_use_ema': False, 'bull_use_atr': True, 'bull_use_adx': True, 'bull_use_spike': False, 'bull_rsi_required': False, 'bear_strategy': 'breakout', 'bear_bb_std_mult': 0.5756813521609401, 'bear_rsi_os': 11, 'bear_rsi_ob': 80, 'bear_adx_thresh': 13.9290662349277, 'bear_atr_min_pct': 0.02371378415556621, 'bear_atr_max_pct': 0.1006511876800045, 'bear_tp_mult': 2.067552857777137, 'bear_tsl_mult': 0.38123013596949923, 'bear_time_stop': 189, 'bear_use_sma': False, 'bear_use_ema': True, 'bear_use_atr': True, 'bear_use_adx': False, 'bear_use_spike': False, 'bear_rsi_required': False, 'sideways_strategy': 'breakout', 'sideways_bb_std_mult': 2.13883886035817, 'sideways_rsi_os': 25, 'sideways_rsi_ob': 67, 'sideways_adx_thresh': 15.562396375429003, 'sideways_atr_min_pct': 0.0008228627463555241, 'sideways_atr_max_pct': 0.1422180278392298, 'sideways_tp_mult': 1.526077258003232, 'sideways_tsl_mult': 0.49765247967182924, 'sideways_time_stop': 217, 'sideways_use_sma': False, 'sideways_use_ema': True, 'sideways_use_atr': False, 'sideways_use_adx': True, 'sideways_use_spike': False, 'sideways_rsi_required': False}.
