[I 2025-08-30 15:55:21,663] Trial 228 finished with values: [-1000000000.0, 1000000000.0] and parameters: {'p_sma': 7, 'p_std': 54, 'p_atr': 24, 'p_adx': 15, 'rsi_period': 31, 'ema1': 8, 'ema2': 60, 'slip_atr_k': 0.027698511116902316, 'slip_spread_k': 0.01969364852438537, 'spread_hl_frac': 0.048083422848173844, 'bb_std_mult': 2.3240706871570382, 'rsi_os': 41, 'rsi_ob': 52, 'vol_spike': 0.006600579566407682, 'adx_thresh': 25.795694789447477, 'atr_min_pct': 0.021842295732287527, 'atr_max_pct': 0.08079839870890866, 'tp_mult': 1.1515478766046146, 'tsl_mult': 0.47509412733982676, 'strategy': 'breakout', 'time_stop': 13, 'use_sma': False, 'use_atr': True, 'use_adx': False, 'use_ema': True, 'use_spike': True, 'rsi_required': False, 'edge_k': 1.9092443806588033, 'edge_cap': 0.3058963871223117, 'bull_strategy': 'breakout', 'bull_bb_std_mult': 1.7207823132381497, 'bull_rsi_os': 15, 'bull_rsi_ob': 77, 'bull_adx_thresh': 28.047821596171474, 'bull_atr_min_pct': 5.658327217581414e-05, 'bull_atr_max_pct': 0.1257210483446405, 'bull_tp_mult': 1.446116816157344, 'bull_tsl_mult': 0.3710645546839187, 'bull_time_stop': 299, 'bull_use_sma': True, 'bull_use_ema': True, 'bull_use_atr': False, 'bull_use_adx': False, 'bull_use_spike': False, 'bull_rsi_required': False, 'bear_strategy': 'breakout', 'bear_bb_std_mult': 2.078404287482219, 'bear_rsi_os': 19, 'bear_rsi_ob': 75, 'bear_adx_thresh': 12.800326498502283, 'bear_atr_min_pct': 0.028506549641105963, 'bear_atr_max_pct': 0.0566056767514294, 'bear_tp_mult': 2.7905467100793437, 'bear_tsl_mult': 0.7033892372557895, 'bear_time_stop': 215, 'bear_use_sma': False, 'bear_use_ema': False, 'bear_use_atr': False, 'bear_use_adx': True, 'bear_use_spike': True, 'bear_rsi_required': True, 'sideways_strategy': 'breakout', 'sideways_bb_std_mult': 2.9433812816817424, 'sideways_rsi_os': 8, 'sideways_rsi_ob': 91, 'sideways_adx_thresh': 14.577476778408858, 'sideways_atr_min_pct': 0.00212899272953976, 'sideways_atr_max_pct': 0.14973294423273423, 'sideways_tp_mult': 2.3381906984337837, 'sideways_tsl_mult': 0.6697707346364111, 'sideways_time_stop': 224, 'sideways_use_sma': True, 'sideways_use_ema': False, 'sideways_use_atr': False, 'sideways_use_adx': True, 'sideways_use_spike': False, 'sideways_rsi_required': True}.
[I 2025-08-30 15:55:22,650] Trial 224 finished with values: [-1000000000.0, 1000000000.0] and parameters: {'p_sma': 17, 'p_std': 57, 'p_atr': 10, 'p_adx': 15, 'rsi_period': 32, 'ema1': 17, 'ema2': 60, 'slip_atr_k': 0.01309031619553295, 'slip_spread_k': 0.38296568577625767, 'spread_hl_frac': 0.04688864849312489, 'bb_std_mult': 2.9786827337212443, 'rsi_os': 37, 'rsi_ob': 50, 'vol_spike': 0.07665497158162554, 'adx_thresh': 27.54607798523102, 'atr_min_pct': 0.021617945078506968, 'atr_max_pct': 0.0865096613180892, 'tp_mult': 1.1562223988975098, 'tsl_mult': 0.45911338856008377, 'strategy': 'breakout', 'time_stop': 22, 'use_sma': False, 'use_atr': True, 'use_adx': False, 'use_ema': False, 'use_spike': True, 'rsi_required': False, 'edge_k': 1.92220451758969, 'edge_cap': 0.30965131222806147, 'bull_strategy': 'breakout', 'bull_bb_std_mult': 1.712765365454512, 'bull_rsi_os': 12, 'bull_rsi_ob': 76, 'bull_adx_thresh': 28.873617241307524, 'bull_atr_min_pct': 0.012709374150140451, 'bull_atr_max_pct': 0.11804363806540512, 'bull_tp_mult': 1.5081412054180765, 'bull_tsl_mult': 0.7220303707560097, 'bull_time_stop': 166, 'bull_use_sma': True, 'bull_use_ema': True, 'bull_use_atr': False, 'bull_use_adx': False, 'bull_use_spike': False, 'bull_rsi_required': True, 'bear_strategy': 'mean_reversion', 'bear_bb_std_mult': 2.666331146604346, 'bear_rsi_os': 17, 'bear_rsi_ob': 77, 'bear_adx_thresh': 13.06596676960038, 'bear_atr_min_pct': 0.029258896985566347, 'bear_atr_max_pct': 0.08606825843103416, 'bear_tp_mult': 2.326267990088312, 'bear_tsl_mult': 0.16020146291733423, 'bear_time_stop': 264, 'bear_use_sma': False, 'bear_use_ema': False, 'bear_use_atr': False, 'bear_use_adx': False, 'bear_use_spike': True, 'bear_rsi_required': False, 'sideways_strategy': 'breakout', 'sideways_bb_std_mult': 3.087200103457345, 'sideways_rsi_os': 30, 'sideways_rsi_ob': 91, 'sideways_adx_thresh': 15.544404433991149, 'sideways_atr_min_pct': 0.002193743336862469, 'sideways_atr_max_pct': 0.14983220234559583, 'sideways_tp_mult': 2.4400310564524754, 'sideways_tsl_mult': 0.6180783591031918, 'sideways_time_stop': 226, 'sideways_use_sma': True, 'sideways_use_ema': False, 'sideways_use_atr': False, 'sideways_use_adx': True, 'sideways_use_spike': False, 'sideways_rsi_required': True}.
[I 2025-08-30 15:55:22,937] Trial 225 finished with values: [-1000000000.0, 1000000000.0] and parameters: {'p_sma': 16, 'p_std': 57, 'p_atr': 25, 'p_adx': 14, 'rsi_period': 30, 'ema1': 26, 'ema2': 60, 'slip_atr_k': 0.027771469953179924, 'slip_spread_k': 0.0001969834922698854, 'spread_hl_frac': 0.03278320776728426, 'bb_std_mult': 2.470205147326374, 'rsi_os': 37, 'rsi_ob': 52, 'vol_spike': 0.0232749514710478, 'adx_thresh': 25.906777482114865, 'atr_min_pct': 0.016582937558004496, 'atr_max_pct': 0.0738027552085189, 'tp_mult': 1.150952641630123, 'tsl_mult': 0.454715175814868, 'strategy': 'breakout', 'time_stop': 5, 'use_sma': True, 'use_atr': True, 'use_adx': False, 'use_ema': False, 'use_spike': True, 'rsi_required': False, 'edge_k': 1.9231739206172715, 'edge_cap': 0.30896370483138935, 'bull_strategy': 'breakout', 'bull_bb_std_mult': 1.7112316700709784, 'bull_rsi_os': 12, 'bull_rsi_ob': 77, 'bull_adx_thresh': 30.6992148687017, 'bull_atr_min_pct': 0.029893552445714275, 'bull_atr_max_pct': 0.11736318745873116, 'bull_tp_mult': 1.4926533503150528, 'bull_tsl_mult': 0.32332398997459644, 'bull_time_stop': 84, 'bull_use_sma': True, 'bull_use_ema': True, 'bull_use_atr': False, 'bull_use_adx': False, 'bull_use_spike': True, 'bull_rsi_required': True, 'bear_strategy': 'mean_reversion', 'bear_bb_std_mult': 1.5745955029752763, 'bear_rsi_os': 19, 'bear_rsi_ob': 77, 'bear_adx_thresh': 14.517703577510636, 'bear_atr_min_pct': 0.022497433714237493, 'bear_atr_max_pct': 0.094851202165561, 'bear_tp_mult': 2.266583325447444, 'bear_tsl_mult': 0.6697736206901309, 'bear_time_stop': 274, 'bear_use_sma': False, 'bear_use_ema': False, 'bear_use_atr': False, 'bear_use_adx': False, 'bear_use_spike': True, 'bear_rsi_required': False, 'sideways_strategy': 'breakout', 'sideways_bb_std_mult': 3.0891831069480022, 'sideways_rsi_os': 30, 'sideways_rsi_ob': 91, 'sideways_adx_thresh': 15.53575397137486, 'sideways_atr_min_pct': 0.019908134577138106, 'sideways_atr_max_pct': 0.14861791082768724, 'sideways_tp_mult': 2.430510320539324, 'sideways_tsl_mult': 0.718667305279312, 'sideways_time_stop': 219, 'sideways_use_sma': True, 'sideways_use_ema': False, 'sideways_use_atr': False, 'sideways_use_adx': True, 'sideways_use_spike': False, 'sideways_rsi_required': True}.
[I 2025-08-30 15:55:23,403] Trial 227 finished with values: [-1000000000.0, 1000000000.0] and parameters: {'p_sma': 15, 'p_std': 55, 'p_atr': 25, 'p_adx': 14, 'rsi_period': 30, 'ema1': 26, 'ema2': 60, 'slip_atr_k': 0.025555043951048538, 'slip_spread_k': 0.7784820949435514, 'spread_hl_frac': 0.02233440135599606, 'bb_std_mult': 3.1044254851135915, 'rsi_os': 37, 'rsi_ob': 51, 'vol_spike': 0.24160886270720452, 'adx_thresh': 25.8418262970553, 'atr_min_pct': 0.02265014759928172, 'atr_max_pct': 0.08011957690725517, 'tp_mult': 1.144633111372492, 'tsl_mult': 0.03046120283877579, 'strategy': 'breakout', 'time_stop': 5, 'use_sma': False, 'use_atr': True, 'use_adx': False, 'use_ema': False, 'use_spike': True, 'rsi_required': False, 'edge_k': 1.941445834324002, 'edge_cap': 0.7331228129351788, 'bull_strategy': 'breakout', 'bull_bb_std_mult': 1.7176567798154534, 'bull_rsi_os': 8, 'bull_rsi_ob': 76, 'bull_adx_thresh': 5.986479036705951, 'bull_atr_min_pct': 0.012578624936704613, 'bull_atr_max_pct': 0.12611897749931994, 'bull_tp_mult': 1.461936710661525, 'bull_tsl_mult': 0.3549329018228334, 'bull_time_stop': 154, 'bull_use_sma': True, 'bull_use_ema': True, 'bull_use_atr': False, 'bull_use_adx': False, 'bull_use_spike': True, 'bull_rsi_required': False, 'bear_strategy': 'mean_reversion', 'bear_bb_std_mult': 2.674854590552633, 'bear_rsi_os': 17, 'bear_rsi_ob': 77, 'bear_adx_thresh': 14.39244361801722, 'bear_atr_min_pct': 0.028137527624073427, 'bear_atr_max_pct': 0.08519351442461237, 'bear_tp_mult': 1.3441580159839794, 'bear_tsl_mult': 0.5502881410066717, 'bear_time_stop': 275, 'bear_use_sma': False, 'bear_use_ema': True, 'bear_use_atr': False, 'bear_use_adx': False, 'bear_use_spike': True, 'bear_rsi_required': False, 'sideways_strategy': 'breakout', 'sideways_bb_std_mult': 2.902307578568359, 'sideways_rsi_os': 30, 'sideways_rsi_ob': 91, 'sideways_adx_thresh': 27.0475813222128, 'sideways_atr_min_pct': 0.0021626190472731504, 'sideways_atr_max_pct': 0.14975970177094675, 'sideways_tp_mult': 2.443646019471069, 'sideways_tsl_mult': 0.7193835668434774, 'sideways_time_stop': 225, 'sideways_use_sma': True, 'sideways_use_ema': False, 'sideways_use_atr': True, 'sideways_use_adx': True, 'sideways_use_spike': True, 'sideways_rsi_required': True}.
[I 2025-08-30 15:56:04,683] Trial 232 finished with values: [-1000000000.0, 1000000000.0] and parameters: {'p_sma': 18, 'p_std': 60, 'p_atr': 26, 'p_adx': 15, 'rsi_period': 28, 'ema1': 27, 'ema2': 57, 'slip_atr_k': 0.01774539858851047, 'slip_spread_k': 0.17470749357340493, 'spread_hl_frac': 0.007566089282769622, 'bb_std_mult': 1.137473882500685, 'rsi_os': 49, 'rsi_ob': 55, 'vol_spike': 0.16848327353150203, 'adx_thresh': 28.354756172498224, 'atr_min_pct': 0.020632362121446576, 'atr_max_pct': 0.11243601292626455, 'tp_mult': 2.923058229219172, 'tsl_mult': 0.4281722398072673, 'strategy': 'breakout', 'time_stop': 13, 'use_sma': False, 'use_atr': True, 'use_adx': False, 'use_ema': True, 'use_spike': True, 'rsi_required': False, 'edge_k': 1.9853356246931673, 'edge_cap': 0.37576643108847774, 'bull_strategy': 'mean_reversion', 'bull_bb_std_mult': 1.971349282111164, 'bull_rsi_os': 5, 'bull_rsi_ob': 78, 'bull_adx_thresh': 23.17706057354732, 'bull_atr_min_pct': 0.0006035122045815414, 'bull_atr_max_pct': 0.11086313677370886, 'bull_tp_mult': 1.0145769026877276, 'bull_tsl_mult': 0.35671754435725445, 'bull_time_stop': 64, 'bull_use_sma': True, 'bull_use_ema': False, 'bull_use_atr': False, 'bull_use_adx': False, 'bull_use_spike': False, 'bull_rsi_required': True, 'bear_strategy': 'breakout', 'bear_bb_std_mult': 0.6010234435610451, 'bear_rsi_os': 9, 'bear_rsi_ob': 75, 'bear_adx_thresh': 23.56106028768969, 'bear_atr_min_pct': 0.027797823815423693, 'bear_atr_max_pct': 0.024228049182719813, 'bear_tp_mult': 1.9404951089094968, 'bear_tsl_mult': 0.6147583268562486, 'bear_time_stop': 284, 'bear_use_sma': False, 'bear_use_ema': False, 'bear_use_atr': False, 'bear_use_adx': True, 'bear_use_spike': True, 'bear_rsi_required': True, 'sideways_strategy': 'mean_reversion', 'sideways_bb_std_mult': 2.9637602680722956, 'sideways_rsi_os': 33, 'sideways_rsi_ob': 94, 'sideways_adx_thresh': 24.159743494306603, 'sideways_atr_min_pct': 0.001766698169007639, 'sideways_atr_max_pct': 0.1455241344557755, 'sideways_tp_mult': 2.2435428059261486, 'sideways_tsl_mult': 0.6309985839335764, 'sideways_time_stop': 204, 'sideways_use_sma': True, 'sideways_use_ema': False, 'sideways_use_atr': False, 'sideways_use_adx': True, 'sideways_use_spike': False, 'sideways_rsi_required': True}.
[I 2025-08-30 15:56:05,219] Trial 229 finished with values: [-1000000000.0, 1000000000.0] and parameters: {'p_sma': 15, 'p_std': 55, 'p_atr': 26, 'p_adx': 14, 'rsi_period': 29, 'ema1': 19, 'ema2': 60, 'slip_atr_k': 0.017595587106701976, 'slip_spread_k': 0.3189518355249984, 'spread_hl_frac': 0.04686577558057089, 'bb_std_mult': 0.6684563625792777, 'rsi_os': 37, 'rsi_ob': 51, 'vol_spike': 0.16910552227507553, 'adx_thresh': 28.568934136757097, 'atr_min_pct': 0.020567632128578216, 'atr_max_pct': 0.13259514337714298, 'tp_mult': 1.3078285931355471, 'tsl_mult': 0.6431721698301733, 'strategy': 'breakout', 'time_stop': 13, 'use_sma': False, 'use_atr': True, 'use_adx': False, 'use_ema': False, 'use_spike': True, 'rsi_required': False, 'edge_k': 1.9431770100609551, 'edge_cap': 0.22089183405656498, 'bull_strategy': 'mean_reversion', 'bull_bb_std_mult': 2.5306804903037543, 'bull_rsi_os': 8, 'bull_rsi_ob': 78, 'bull_adx_thresh': 23.10762931732225, 'bull_atr_min_pct': 0.001528815371610291, 'bull_atr_max_pct': 0.11654878863919825, 'bull_tp_mult': 1.381784466349115, 'bull_tsl_mult': 0.5305893080496997, 'bull_time_stop': 232, 'bull_use_sma': True, 'bull_use_ema': False, 'bull_use_atr': False, 'bull_use_adx': False, 'bull_use_spike': True, 'bull_rsi_required': True, 'bear_strategy': 'mean_reversion', 'bear_bb_std_mult': 1.5627678943374987, 'bear_rsi_os': 13, 'bear_rsi_ob': 77, 'bear_adx_thresh': 25.069302900038164, 'bear_atr_min_pct': 0.02331111764310227, 'bear_atr_max_pct': 0.08459075158527724, 'bear_tp_mult': 1.3394591905126108, 'bear_tsl_mult': 0.5760106425230255, 'bear_time_stop': 273, 'bear_use_sma': False, 'bear_use_ema': False, 'bear_use_atr': False, 'bear_use_adx': False, 'bear_use_spike': True, 'bear_rsi_required': False, 'sideways_strategy': 'breakout', 'sideways_bb_std_mult': 2.9115194826491915, 'sideways_rsi_os': 29, 'sideways_rsi_ob': 92, 'sideways_adx_thresh': 27.589962169265462, 'sideways_atr_min_pct': 0.0022611708431564707, 'sideways_atr_max_pct': 0.1474972431027975, 'sideways_tp_mult': 2.4674313971946242, 'sideways_tsl_mult': 0.6409580111400239, 'sideways_time_stop': 228, 'sideways_use_sma': True, 'sideways_use_ema': False, 'sideways_use_atr': True, 'sideways_use_adx': True, 'sideways_use_spike': True, 'sideways_rsi_required': True}.
[I 2025-08-30 15:56:05,852] Trial 230 finished with values: [-1000000000.0, 1000000000.0] and parameters: {'p_sma': 15, 'p_std': 55, 'p_atr': 25, 'p_adx': 14, 'rsi_period': 29, 'ema1': 19, 'ema2': 57, 'slip_atr_k': 0.12845277364152283, 'slip_spread_k': 0.4267981276314663, 'spread_hl_frac': 0.03261397915944954, 'bb_std_mult': 3.1156603135486036, 'rsi_os': 39, 'rsi_ob': 51, 'vol_spike': 0.014854021098338065, 'adx_thresh': 28.606974683493764, 'atr_min_pct': 0.02070099002140535, 'atr_max_pct': 0.11273697677389308, 'tp_mult': 1.3102856663413645, 'tsl_mult': 0.43978718925233795, 'strategy': 'breakout', 'time_stop': 10, 'use_sma': False, 'use_atr': True, 'use_adx': False, 'use_ema': False, 'use_spike': True, 'rsi_required': False, 'edge_k': 1.9989889610102693, 'edge_cap': 0.23140734266315144, 'bull_strategy': 'mean_reversion', 'bull_bb_std_mult': 0.8090640862001575, 'bull_rsi_os': 8, 'bull_rsi_ob': 52, 'bull_adx_thresh': 26.857946393910336, 'bull_atr_min_pct': 0.029994228294816162, 'bull_atr_max_pct': 0.1102416770546932, 'bull_tp_mult': 1.573445820628418, 'bull_tsl_mult': 0.36416881911484267, 'bull_time_stop': 85, 'bull_use_sma': True, 'bull_use_ema': False, 'bull_use_atr': False, 'bull_use_adx': False, 'bull_use_spike': True, 'bull_rsi_required': False, 'bear_strategy': 'mean_reversion', 'bear_bb_std_mult': 0.7265246483433216, 'bear_rsi_os': 9, 'bear_rsi_ob': 77, 'bear_adx_thresh': 26.664556274623955, 'bear_atr_min_pct': 0.028019692458388416, 'bear_atr_max_pct': 0.09080334695228551, 'bear_tp_mult': 1.948095751219763, 'bear_tsl_mult': 0.11728630128979706, 'bear_time_stop': 284, 'bear_use_sma': False, 'bear_use_ema': True, 'bear_use_atr': False, 'bear_use_adx': False, 'bear_use_spike': True, 'bear_rsi_required': False, 'sideways_strategy': 'breakout', 'sideways_bb_std_mult': 2.892239504814212, 'sideways_rsi_os': 42, 'sideways_rsi_ob': 94, 'sideways_adx_thresh': 27.424707889943445, 'sideways_atr_min_pct': 0.007700564785559432, 'sideways_atr_max_pct': 0.14720576964798696, 'sideways_tp_mult': 2.9022548856573054, 'sideways_tsl_mult': 0.642661055611324, 'sideways_time_stop': 211, 'sideways_use_sma': True, 'sideways_use_ema': False, 'sideways_use_atr': True, 'sideways_use_adx': True, 'sideways_use_spike': True, 'sideways_rsi_required': True}.
[I 2025-08-30 15:56:06,211] Trial 231 finished with values: [-1000000000.0, 1000000000.0] and parameters: {'p_sma': 15, 'p_std': 55, 'p_atr': 26, 'p_adx': 14, 'rsi_period': 28, 'ema1': 7, 'ema2': 57, 'slip_atr_k': 0.1273794853654122, 'slip_spread_k': 0.037526385327922664, 'spread_hl_frac': 0.025873540848296777, 'bb_std_mult': 3.140492209302493, 'rsi_os': 49, 'rsi_ob': 56, 'vol_spike': 0.017092757554143013, 'adx_thresh': 26.761497703488676, 'atr_min_pct': 0.020616305367218396, 'atr_max_pct': 0.13271852629953437, 'tp_mult': 1.3050260825988775, 'tsl_mult': 0.4270267847260322, 'strategy': 'breakout', 'time_stop': 13, 'use_sma': False, 'use_atr': True, 'use_adx': False, 'use_ema': True, 'use_spike': True, 'rsi_required': False, 'edge_k': 1.9977842963511743, 'edge_cap': 0.38429656272560164, 'bull_strategy': 'mean_reversion', 'bull_bb_std_mult': 2.5453490697082706, 'bull_rsi_os': 5, 'bull_rsi_ob': 78, 'bull_adx_thresh': 13.178793608637783, 'bull_atr_min_pct': 0.0015753650530540026, 'bull_atr_max_pct': 0.11101171570170981, 'bull_tp_mult': 1.0121585352203355, 'bull_tsl_mult': 0.37753799953189404, 'bull_time_stop': 108, 'bull_use_sma': True, 'bull_use_ema': False, 'bull_use_atr': False, 'bull_use_adx': False, 'bull_use_spike': False, 'bull_rsi_required': False, 'bear_strategy': 'breakout', 'bear_bb_std_mult': 0.5934702765364235, 'bear_rsi_os': 15, 'bear_rsi_ob': 74, 'bear_adx_thresh': 27.46009856919908, 'bear_atr_min_pct': 0.02005109638482539, 'bear_atr_max_pct': 0.040372210786385185, 'bear_tp_mult': 2.717011233605693, 'bear_tsl_mult': 0.57787841409521, 'bear_time_stop': 284, 'bear_use_sma': False, 'bear_use_ema': True, 'bear_use_atr': False, 'bear_use_adx': False, 'bear_use_spike': True, 'bear_rsi_required': False, 'sideways_strategy': 'mean_reversion', 'sideways_bb_std_mult': 2.8983964997582374, 'sideways_rsi_os': 29, 'sideways_rsi_ob': 92, 'sideways_adx_thresh': 25.04865673777025, 'sideways_atr_min_pct': 0.007850832006652785, 'sideways_atr_max_pct': 0.14582583279922168, 'sideways_tp_mult': 2.277285339676753, 'sideways_tsl_mult': 0.8189842245315582, 'sideways_time_stop': 209, 'sideways_use_sma': True, 'sideways_use_ema': False, 'sideways_use_atr': True, 'sideways_use_adx': True, 'sideways_use_spike': True, 'sideways_rsi_required': True}.
[I 2025-08-30 15:56:44,303] Trial 236 finished with values: [-1000000000.0, 1000000000.0] and parameters: {'p_sma': 47, 'p_std': 59, 'p_atr': 24, 'p_adx': 15, 'rsi_period': 32, 'ema1': 10, 'ema2': 58, 'slip_atr_k': 0.010191234209603776, 'slip_spread_k': 0.01988969135782059, 'spread_hl_frac': 0.048334997460472456, 'bb_std_mult': 1.0439175194614714, 'rsi_os': 53, 'rsi_ob': 91, 'vol_spike': 0.005155983357825573, 'adx_thresh': 26.59497980803991, 'atr_min_pct': 0.01568102456251455, 'atr_max_pct': 0.14075506327357012, 'tp_mult': 1.1002197202382782, 'tsl_mult': 0.48105065687197757, 'strategy': 'breakout', 'time_stop': 26, 'use_sma': False, 'use_atr': True, 'use_adx': False, 'use_ema': False, 'use_spike': True, 'rsi_required': False, 'edge_k': 1.8587272328199456, 'edge_cap': 0.7127364303561974, 'bull_strategy': 'breakout', 'bull_bb_std_mult': 1.824120788245981, 'bull_rsi_os': 10, 'bull_rsi_ob': 75, 'bull_adx_thresh': 22.104957790792714, 'bull_atr_min_pct': 0.010438544110074255, 'bull_atr_max_pct': 0.13180823306289435, 'bull_tp_mult': 1.7111281897319517, 'bull_tsl_mult': 0.02746442553407935, 'bull_time_stop': 79, 'bull_use_sma': True, 'bull_use_ema': True, 'bull_use_atr': False, 'bull_use_adx': False, 'bull_use_spike': False, 'bull_rsi_required': True, 'bear_strategy': 'mean_reversion', 'bear_bb_std_mult': 1.2002813229038638, 'bear_rsi_os': 16, 'bear_rsi_ob': 74, 'bear_adx_thresh': 13.997358083691887, 'bear_atr_min_pct': 0.02856253578558145, 'bear_atr_max_pct': 0.09220023408695571, 'bear_tp_mult': 2.9148653463968164, 'bear_tsl_mult': 0.7546978027162388, 'bear_time_stop': 256, 'bear_use_sma': False, 'bear_use_ema': False, 'bear_use_atr': False, 'bear_use_adx': False, 'bear_use_spike': True, 'bear_rsi_required': False, 'sideways_strategy': 'breakout', 'sideways_bb_std_mult': 3.0271157507976727, 'sideways_rsi_os': 30, 'sideways_rsi_ob': 80, 'sideways_adx_thresh': 16.220675893992293, 'sideways_atr_min_pct': 0.006635741652496748, 'sideways_atr_max_pct': 0.13904343654162277, 'sideways_tp_mult': 1.469218206714657, 'sideways_tsl_mult': 0.8120534609205281, 'sideways_time_stop': 293, 'sideways_use_sma': True, 'sideways_use_ema': False, 'sideways_use_atr': False, 'sideways_use_adx': True, 'sideways_use_spike': False, 'sideways_rsi_required': True}.
