[I 2025-08-30 16:09:29,196] Trial 303 finished with values: [-0.029828665975783597, 0.029802911817747857] and parameters: {'p_sma': 8, 'p_std': 27, 'p_atr': 28, 'p_adx': 24, 'rsi_period': 17, 'ema1': 25, 'ema2': 12, 'slip_atr_k': 0.009743402996176664, 'slip_spread_k': 0.5270848431046422, 'spread_hl_frac': 0.016895851974548255, 'bb_std_mult': 3.085364414576691, 'rsi_os': 36, 'rsi_ob': 91, 'vol_spike': 0.25770825298987804, 'adx_thresh': 11.837528197409, 'atr_min_pct': 0.01946261353639543, 'atr_max_pct': 0.1367840729184563, 'tp_mult': 2.9947394476307725, 'tsl_mult': 0.6134831555861896, 'strategy': 'mean_reversion', 'time_stop': 5, 'use_sma': True, 'use_atr': True, 'use_adx': True, 'use_ema': False, 'use_spike': False, 'rsi_required': True, 'edge_k': 1.5292401690890185, 'edge_cap': 0.6750397670024751, 'bull_strategy': 'mean_reversion', 'bull_bb_std_mult': 3.486567365459596, 'bull_rsi_os': 9, 'bull_rsi_ob': 50, 'bull_adx_thresh': 20.022847755877624, 'bull_atr_min_pct': 0.020787207627943744, 'bull_atr_max_pct': 0.13856168966802898, 'bull_tp_mult': 1.1564324397950456, 'bull_tsl_mult': 0.2682933498587434, 'bull_time_stop': 252, 'bull_use_sma': False, 'bull_use_ema': False, 'bull_use_atr': True, 'bull_use_adx': True, 'bull_use_spike': True, 'bull_rsi_required': False, 'bear_strategy': 'mean_reversion', 'bear_bb_std_mult': 3.591414279770602, 'bear_rsi_os': 13, 'bear_rsi_ob': 77, 'bear_adx_thresh': 30.008285773892958, 'bear_atr_min_pct': 0.02190052643116991, 'bear_atr_max_pct': 0.10201056007854532, 'bear_tp_mult': 2.2351380680340505, 'bear_tsl_mult': 0.6489111102926021, 'bear_time_stop': 216, 'bear_use_sma': True, 'bear_use_ema': True, 'bear_use_atr': False, 'bear_use_adx': True, 'bear_use_spike': False, 'bear_rsi_required': True, 'sideways_strategy': 'breakout', 'sideways_bb_std_mult': 2.146105624371165, 'sideways_rsi_os': 24, 'sideways_rsi_ob': 92, 'sideways_adx_thresh': 16.49154988930947, 'sideways_atr_min_pct': 0.00012302629515829454, 'sideways_atr_max_pct': 0.14357199050912234, 'sideways_tp_mult': 1.5703467101610475, 'sideways_tsl_mult': 0.5433969132660654, 'sideways_time_stop': 211, 'sideways_use_sma': True, 'sideways_use_ema': False, 'sideways_use_atr': False, 'sideways_use_adx': False, 'sideways_use_spike': True, 'sideways_rsi_required': False}.
[I 2025-08-30 16:10:12,039] Trial 309 finished with values: [-1000000000.0, 1000000000.0] and parameters: {'p_sma': 9, 'p_std': 59, 'p_atr': 20, 'p_adx': 25, 'rsi_period': 18, 'ema1': 26, 'ema2': 13, 'slip_atr_k': 0.17898288194697431, 'slip_spread_k': 0.5734338269080316, 'spread_hl_frac': 0.016129609244803302, 'bb_std_mult': 1.3758722581988843, 'rsi_os': 32, 'rsi_ob': 88, 'vol_spike': 0.004925078403997656, 'adx_thresh': 11.81681750414312, 'atr_min_pct': 0.019850933186562607, 'atr_max_pct': 0.13282266444745808, 'tp_mult': 2.997218953252735, 'tsl_mult': 0.482016398949255, 'strategy': 'mean_reversion', 'time_stop': 22, 'use_sma': False, 'use_atr': True, 'use_adx': True, 'use_ema': False, 'use_spike': False, 'rsi_required': True, 'edge_k': 1.6146843508577136, 'edge_cap': 0.4427448688939486, 'bull_strategy': 'mean_reversion', 'bull_bb_std_mult': 2.0416402142554895, 'bull_rsi_os': 47, 'bull_rsi_ob': 52, 'bull_adx_thresh': 21.370603445831, 'bull_atr_min_pct': 0.021512065738877786, 'bull_atr_max_pct': 0.1378676864348333, 'bull_tp_mult': 1.3390940015817097, 'bull_tsl_mult': 0.2326020932427949, 'bull_time_stop': 73, 'bull_use_sma': False, 'bull_use_ema': True, 'bull_use_atr': True, 'bull_use_adx': True, 'bull_use_spike': False, 'bull_rsi_required': False, 'bear_strategy': 'mean_reversion', 'bear_bb_std_mult': 3.3135094077689553, 'bear_rsi_os': 14, 'bear_rsi_ob': 87, 'bear_adx_thresh': 14.388880933480568, 'bear_atr_min_pct': 0.01961800725499585, 'bear_atr_max_pct': 0.10137565732674075, 'bear_tp_mult': 2.174616570053257, 'bear_tsl_mult': 0.6829531129165023, 'bear_time_stop': 227, 'bear_use_sma': True, 'bear_use_ema': False, 'bear_use_atr': False, 'bear_use_adx': False, 'bear_use_spike': False, 'bear_rsi_required': False, 'sideways_strategy': 'mean_reversion', 'sideways_bb_std_mult': 1.9011386559889738, 'sideways_rsi_os': 28, 'sideways_rsi_ob': 91, 'sideways_adx_thresh': 23.80299908309363, 'sideways_atr_min_pct': 0.0011254467765438557, 'sideways_atr_max_pct': 0.13992102079150068, 'sideways_tp_mult': 1.444483166974047, 'sideways_tsl_mult': 0.5082452574446253, 'sideways_time_stop': 207, 'sideways_use_sma': False, 'sideways_use_ema': True, 'sideways_use_atr': False, 'sideways_use_adx': False, 'sideways_use_spike': False, 'sideways_rsi_required': True}.
[I 2025-08-30 16:10:12,932] Trial 310 finished with values: [-1000000000.0, 1000000000.0] and parameters: {'p_sma': 5, 'p_std': 58, 'p_atr': 17, 'p_adx': 25, 'rsi_period': 18, 'ema1': 15, 'ema2': 13, 'slip_atr_k': 0.005903239728261117, 'slip_spread_k': 0.5869553517049951, 'spread_hl_frac': 0.015874028474388225, 'bb_std_mult': 3.2375510374817886, 'rsi_os': 32, 'rsi_ob': 86, 'vol_spike': 0.1304154578588093, 'adx_thresh': 13.82683183399661, 'atr_min_pct': 0.018567853556118948, 'atr_max_pct': 0.13468491587948866, 'tp_mult': 2.683505915723236, 'tsl_mult': 0.21842586599607983, 'strategy': 'mean_reversion', 'time_stop': 153, 'use_sma': False, 'use_atr': False, 'use_adx': True, 'use_ema': False, 'use_spike': False, 'rsi_required': True, 'edge_k': 1.6120196891381062, 'edge_cap': 0.44376187678391776, 'bull_strategy': 'mean_reversion', 'bull_bb_std_mult': 1.9025191885258124, 'bull_rsi_os': 37, 'bull_rsi_ob': 52, 'bull_adx_thresh': 21.567431397319194, 'bull_atr_min_pct': 0.021473052322269426, 'bull_atr_max_pct': 0.14174433469098094, 'bull_tp_mult': 1.3373867880673334, 'bull_tsl_mult': 0.23105002711561823, 'bull_time_stop': 208, 'bull_use_sma': False, 'bull_use_ema': True, 'bull_use_atr': True, 'bull_use_adx': True, 'bull_use_spike': False, 'bull_rsi_required': False, 'bear_strategy': 'mean_reversion', 'bear_bb_std_mult': 3.151950028519939, 'bear_rsi_os': 14, 'bear_rsi_ob': 76, 'bear_adx_thresh': 14.170060746378995, 'bear_atr_min_pct': 0.023100998038313718, 'bear_atr_max_pct': 0.09527859360579773, 'bear_tp_mult': 1.9891219976260008, 'bear_tsl_mult': 0.6831922434187226, 'bear_time_stop': 227, 'bear_use_sma': True, 'bear_use_ema': False, 'bear_use_atr': False, 'bear_use_adx': False, 'bear_use_spike': False, 'bear_rsi_required': False, 'sideways_strategy': 'mean_reversion', 'sideways_bb_std_mult': 1.9482720708672865, 'sideways_rsi_os': 27, 'sideways_rsi_ob': 89, 'sideways_adx_thresh': 10.245245170260857, 'sideways_atr_min_pct': 0.019569061786593508, 'sideways_atr_max_pct': 0.1391895038654539, 'sideways_tp_mult': 1.4392273136913751, 'sideways_tsl_mult': 0.507911514755687, 'sideways_time_stop': 152, 'sideways_use_sma': False, 'sideways_use_ema': True, 'sideways_use_atr': False, 'sideways_use_adx': False, 'sideways_use_spike': False, 'sideways_rsi_required': True}.
[I 2025-08-30 16:10:14,336] Trial 307 finished with values: [-1000000000.0, 1000000000.0] and parameters: {'p_sma': 9, 'p_std': 58, 'p_atr': 19, 'p_adx': 25, 'rsi_period': 18, 'ema1': 25, 'ema2': 13, 'slip_atr_k': 0.05132716214929868, 'slip_spread_k': 0.6295878185419634, 'spread_hl_frac': 0.016269530372825327, 'bb_std_mult': 1.4975792967815589, 'rsi_os': 34, 'rsi_ob': 91, 'vol_spike': 0.008324636286590604, 'adx_thresh': 12.013153751994388, 'atr_min_pct': 0.019351760555245807, 'atr_max_pct': 0.132654002946066, 'tp_mult': 2.802030939983638, 'tsl_mult': 0.49848502041150516, 'strategy': 'mean_reversion', 'time_stop': 11, 'use_sma': False, 'use_atr': True, 'use_adx': True, 'use_ema': False, 'use_spike': False, 'rsi_required': True, 'edge_k': 1.668589139106274, 'edge_cap': 0.6812621964803548, 'bull_strategy': 'mean_reversion', 'bull_bb_std_mult': 2.7215927250461887, 'bull_rsi_os': 37, 'bull_rsi_ob': 52, 'bull_adx_thresh': 21.386126729718672, 'bull_atr_min_pct': 0.02171827559394263, 'bull_atr_max_pct': 0.14024853214046004, 'bull_tp_mult': 1.1764922296317275, 'bull_tsl_mult': 0.22262792859062247, 'bull_time_stop': 72, 'bull_use_sma': False, 'bull_use_ema': False, 'bull_use_atr': True, 'bull_use_adx': True, 'bull_use_spike': False, 'bull_rsi_required': False, 'bear_strategy': 'mean_reversion', 'bear_bb_std_mult': 2.103308492874053, 'bear_rsi_os': 14, 'bear_rsi_ob': 78, 'bear_adx_thresh': 29.95450679521324, 'bear_atr_min_pct': 0.019630595149295656, 'bear_atr_max_pct': 0.10232235732830028, 'bear_tp_mult': 2.2321754453174023, 'bear_tsl_mult': 0.6223207511665079, 'bear_time_stop': 226, 'bear_use_sma': True, 'bear_use_ema': False, 'bear_use_atr': False, 'bear_use_adx': False, 'bear_use_spike': False, 'bear_rsi_required': False, 'sideways_strategy': 'breakout', 'sideways_bb_std_mult': 2.0181746725775502, 'sideways_rsi_os': 28, 'sideways_rsi_ob': 91, 'sideways_adx_thresh': 23.793789451301986, 'sideways_atr_min_pct': 0.022712923111122406, 'sideways_atr_max_pct': 0.1392437785190141, 'sideways_tp_mult': 1.4375568131802734, 'sideways_tsl_mult': 0.5044229589008626, 'sideways_time_stop': 288, 'sideways_use_sma': True, 'sideways_use_ema': True, 'sideways_use_atr': True, 'sideways_use_adx': False, 'sideways_use_spike': False, 'sideways_rsi_required': False}.
[I 2025-08-30 16:10:14,969] Trial 308 finished with values: [-1000000000.0, 1000000000.0] and parameters: {'p_sma': 5, 'p_std': 36, 'p_atr': 20, 'p_adx': 24, 'rsi_period': 21, 'ema1': 27, 'ema2': 13, 'slip_atr_k': 0.051110465601901814, 'slip_spread_k': 0.5824608765838597, 'spread_hl_frac': 0.016083452533728032, 'bb_std_mult': 1.5170613359480987, 'rsi_os': 34, 'rsi_ob': 92, 'vol_spike': 0.2213990254697273, 'adx_thresh': 11.597850267772678, 'atr_min_pct': 0.01977312618534444, 'atr_max_pct': 0.13229147251646364, 'tp_mult': 2.70341212438828, 'tsl_mult': 0.20577585898134698, 'strategy': 'mean_reversion', 'time_stop': 155, 'use_sma': False, 'use_atr': True, 'use_adx': True, 'use_ema': False, 'use_spike': False, 'rsi_required': True, 'edge_k': 1.5263612626337337, 'edge_cap': 0.28695059038172355, 'bull_strategy': 'mean_reversion', 'bull_bb_std_mult': 1.9135572739790583, 'bull_rsi_os': 14, 'bull_rsi_ob': 50, 'bull_adx_thresh': 21.53465313923973, 'bull_atr_min_pct': 0.0195327955541767, 'bull_atr_max_pct': 0.14701681681813053, 'bull_tp_mult': 1.185945610266541, 'bull_tsl_mult': 0.2282458034714072, 'bull_time_stop': 74, 'bull_use_sma': False, 'bull_use_ema': True, 'bull_use_atr': True, 'bull_use_adx': True, 'bull_use_spike': False, 'bull_rsi_required': False, 'bear_strategy': 'mean_reversion', 'bear_bb_std_mult': 3.026352641820402, 'bear_rsi_os': 14, 'bear_rsi_ob': 51, 'bear_adx_thresh': 29.74766553929048, 'bear_atr_min_pct': 0.021406817191539775, 'bear_atr_max_pct': 0.09557921976231397, 'bear_tp_mult': 2.228642175268505, 'bear_tsl_mult': 0.685995607281225, 'bear_time_stop': 227, 'bear_use_sma': True, 'bear_use_ema': False, 'bear_use_atr': False, 'bear_use_adx': False, 'bear_use_spike': False, 'bear_rsi_required': False, 'sideways_strategy': 'breakout', 'sideways_bb_std_mult': 1.9107932153355132, 'sideways_rsi_os': 36, 'sideways_rsi_ob': 91, 'sideways_adx_thresh': 33.164433765002755, 'sideways_atr_min_pct': 0.006458456832427817, 'sideways_atr_max_pct': 0.13879328989731773, 'sideways_tp_mult': 1.426907655117882, 'sideways_tsl_mult': 0.49808702538389593, 'sideways_time_stop': 207, 'sideways_use_sma': True, 'sideways_use_ema': True, 'sideways_use_atr': False, 'sideways_use_adx': False, 'sideways_use_spike': False, 'sideways_rsi_required': True}.
[I 2025-08-30 16:10:56,028] Trial 312 finished with values: [-1000000000.0, 1000000000.0] and parameters: {'p_sma': 7, 'p_std': 56, 'p_atr': 23, 'p_adx': 24, 'rsi_period': 20, 'ema1': 27, 'ema2': 10, 'slip_atr_k': 0.012789845544854106, 'slip_spread_k': 0.5952985640794767, 'spread_hl_frac': 0.0185315559062043, 'bb_std_mult': 1.9902344761782365, 'rsi_os': 34, 'rsi_ob': 89, 'vol_spike': 0.10247406555907479, 'adx_thresh': 12.633848589396028, 'atr_min_pct': 0.01775914914600164, 'atr_max_pct': 0.09916710388079156, 'tp_mult': 2.7175135575084077, 'tsl_mult': 0.058886106174485975, 'strategy': 'mean_reversion', 'time_stop': 143, 'use_sma': False, 'use_atr': True, 'use_adx': True, 'use_ema': False, 'use_spike': False, 'rsi_required': True, 'edge_k': 1.411323162750428, 'edge_cap': 0.2886229957342874, 'bull_strategy': 'mean_reversion', 'bull_bb_std_mult': 2.6766620249036794, 'bull_rsi_os': 51, 'bull_rsi_ob': 50, 'bull_adx_thresh': 22.371245218852753, 'bull_atr_min_pct': 0.019528299679161094, 'bull_atr_max_pct': 0.1455160958540222, 'bull_tp_mult': 1.1103872308879539, 'bull_tsl_mult': 0.9669687969068075, 'bull_time_stop': 181, 'bull_use_sma': False, 'bull_use_ema': True, 'bull_use_atr': True, 'bull_use_adx': True, 'bull_use_spike': False, 'bull_rsi_required': False, 'bear_strategy': 'mean_reversion', 'bear_bb_std_mult': 2.107495459861872, 'bear_rsi_os': 12, 'bear_rsi_ob': 78, 'bear_adx_thresh': 25.996432240031943, 'bear_atr_min_pct': 0.021208941120507887, 'bear_atr_max_pct': 0.12066791683343403, 'bear_tp_mult': 2.2125803628435508, 'bear_tsl_mult': 0.6227077209653964, 'bear_time_stop': 208, 'bear_use_sma': True, 'bear_use_ema': False, 'bear_use_atr': False, 'bear_use_adx': False, 'bear_use_spike': False, 'bear_rsi_required': False, 'sideways_strategy': 'breakout', 'sideways_bb_std_mult': 2.0967188070406446, 'sideways_rsi_os': 36, 'sideways_rsi_ob': 81, 'sideways_adx_thresh': 17.569490298082126, 'sideways_atr_min_pct': 0.006457106501615595, 'sideways_atr_max_pct': 0.14438187860967586, 'sideways_tp_mult': 1.3366678658437903, 'sideways_tsl_mult': 0.4300699258736337, 'sideways_time_stop': 117, 'sideways_use_sma': True, 'sideways_use_ema': False, 'sideways_use_atr': False, 'sideways_use_adx': False, 'sideways_use_spike': False, 'sideways_rsi_required': True}.
[I 2025-08-30 16:10:56,494] Trial 314 finished with values: [-1000000000.0, 1000000000.0] and parameters: {'p_sma': 7, 'p_std': 56, 'p_atr': 23, 'p_adx': 23, 'rsi_period': 20, 'ema1': 28, 'ema2': 10, 'slip_atr_k': 0.012321243887336804, 'slip_spread_k': 0.6608821098781188, 'spread_hl_frac': 0.018972563044397005, 'bb_std_mult': 3.181037969274785, 'rsi_os': 7, 'rsi_ob': 89, 'vol_spike': 0.2106486905151872, 'adx_thresh': 12.801032707711885, 'atr_min_pct': 0.017888089799545884, 'atr_max_pct': 0.1383358506007442, 'tp_mult': 2.895903992844515, 'tsl_mult': 0.4346703317077076, 'strategy': 'mean_reversion', 'time_stop': 34, 'use_sma': False, 'use_atr': False, 'use_adx': True, 'use_ema': True, 'use_spike': False, 'rsi_required': True, 'edge_k': 1.5669786156060561, 'edge_cap': 0.320343396092182, 'bull_strategy': 'mean_reversion', 'bull_bb_std_mult': 1.8399875147508045, 'bull_rsi_os': 11, 'bull_rsi_ob': 50, 'bull_adx_thresh': 23.326369089587935, 'bull_atr_min_pct': 0.02238512692181778, 'bull_atr_max_pct': 0.03947896559248312, 'bull_tp_mult': 1.1292111782211163, 'bull_tsl_mult': 0.31125184669718015, 'bull_time_stop': 62, 'bull_use_sma': False, 'bull_use_ema': True, 'bull_use_atr': True, 'bull_use_adx': True, 'bull_use_spike': False, 'bull_rsi_required': False, 'bear_strategy': 'breakout', 'bear_bb_std_mult': 1.336941752283254, 'bear_rsi_os': 12, 'bear_rsi_ob': 64, 'bear_adx_thresh': 7.9084527393032555, 'bear_atr_min_pct': 0.021087131858758136, 'bear_atr_max_pct': 0.08738735622007963, 'bear_tp_mult': 2.174180148303535, 'bear_tsl_mult': 0.6194465732581739, 'bear_time_stop': 233, 'bear_use_sma': True, 'bear_use_ema': False, 'bear_use_atr': False, 'bear_use_adx': False, 'bear_use_spike': False, 'bear_rsi_required': False, 'sideways_strategy': 'breakout', 'sideways_bb_std_mult': 2.076707509706374, 'sideways_rsi_os': 29, 'sideways_rsi_ob': 81, 'sideways_adx_thresh': 17.218363201044035, 'sideways_atr_min_pct': 0.009354734957323422, 'sideways_atr_max_pct': 0.0544028794148457, 'sideways_tp_mult': 1.3387475665760586, 'sideways_tsl_mult': 0.4326820124836182, 'sideways_time_stop': 14, 'sideways_use_sma': True, 'sideways_use_ema': False, 'sideways_use_atr': False, 'sideways_use_adx': False, 'sideways_use_spike': False, 'sideways_rsi_required': True}.
[I 2025-08-30 16:10:56,870] Trial 313 finished with values: [-0.023574421366423626, 0.023491989495430843] and parameters: {'p_sma': 7, 'p_std': 36, 'p_atr': 23, 'p_adx': 26, 'rsi_period': 20, 'ema1': 27, 'ema2': 10, 'slip_atr_k': 0.10728510819330546, 'slip_spread_k': 0.5978145048263447, 'spread_hl_frac': 0.013648199509883883, 'bb_std_mult': 3.1691791976201, 'rsi_os': 17, 'rsi_ob': 89, 'vol_spike': 0.22331076441402645, 'adx_thresh': 12.66625894410513, 'atr_min_pct': 0.017851035968212692, 'atr_max_pct': 0.12075739085581537, 'tp_mult': 2.7116908579480916, 'tsl_mult': 0.43626403318811563, 'strategy': 'mean_reversion', 'time_stop': 34, 'use_sma': False, 'use_atr': True, 'use_adx': True, 'use_ema': True, 'use_spike': False, 'rsi_required': True, 'edge_k': 1.4129442883116718, 'edge_cap': 0.6337851013705748, 'bull_strategy': 'mean_reversion', 'bull_bb_std_mult': 1.8332319914186674, 'bull_rsi_os': 51, 'bull_rsi_ob': 51, 'bull_adx_thresh': 22.175248762911057, 'bull_atr_min_pct': 0.019350681162163, 'bull_atr_max_pct': 0.14767373451552077, 'bull_tp_mult': 1.1122774249671106, 'bull_tsl_mult': 0.30945393316245995, 'bull_time_stop': 62, 'bull_use_sma': False, 'bull_use_ema': True, 'bull_use_atr': True, 'bull_use_adx': True, 'bull_use_spike': False, 'bull_rsi_required': False, 'bear_strategy': 'breakout', 'bear_bb_std_mult': 3.0163256639441656, 'bear_rsi_os': 12, 'bear_rsi_ob': 64, 'bear_adx_thresh': 25.934865678419737, 'bear_atr_min_pct': 0.02124987933430386, 'bear_atr_max_pct': 0.0865403791014161, 'bear_tp_mult': 1.0128176756874712, 'bear_tsl_mult': 0.6313559108618922, 'bear_time_stop': 234, 'bear_use_sma': True, 'bear_use_ema': False, 'bear_use_atr': False, 'bear_use_adx': False, 'bear_use_spike': False, 'bear_rsi_required': False, 'sideways_strategy': 'breakout', 'sideways_bb_std_mult': 2.0935634885889547, 'sideways_rsi_os': 36, 'sideways_rsi_ob': 93, 'sideways_adx_thresh': 23.151035961354815, 'sideways_atr_min_pct': 0.001061403408195868, 'sideways_atr_max_pct': 0.14437460991655943, 'sideways_tp_mult': 1.3914870849370422, 'sideways_tsl_mult': 0.4340136663833826, 'sideways_time_stop': 136, 'sideways_use_sma': True, 'sideways_use_ema': False, 'sideways_use_atr': False, 'sideways_use_adx': False, 'sideways_use_spike': False, 'sideways_rsi_required': True}.
[I 2025-08-30 16:10:57,216] Trial 311 finished with values: [-1000000000.0, 1000000000.0] and parameters: {'p_sma': 5, 'p_std': 56, 'p_atr': 23, 'p_adx': 24, 'rsi_period': 20, 'ema1': 28, 'ema2': 10, 'slip_atr_k': 0.04992278873516673, 'slip_spread_k': 0.6001331724154546, 'spread_hl_frac': 0.01880424736287648, 'bb_std_mult': 3.2046699035684854, 'rsi_os': 34, 'rsi_ob': 89, 'vol_spike': 0.13092086510499884, 'adx_thresh': 13.662078056738464, 'atr_min_pct': 0.01868941913229215, 'atr_max_pct': 0.1054816996089426, 'tp_mult': 2.685335004212548, 'tsl_mult': 0.4953560519131798, 'strategy': 'mean_reversion', 'time_stop': 13, 'use_sma': False, 'use_atr': False, 'use_adx': True, 'use_ema': False, 'use_spike': False, 'rsi_required': True, 'edge_k': 1.664596921764102, 'edge_cap': 0.6337347334493431, 'bull_strategy': 'mean_reversion', 'bull_bb_std_mult': 2.946595895037522, 'bull_rsi_os': 11, 'bull_rsi_ob': 51, 'bull_adx_thresh': 23.366857984999235, 'bull_atr_min_pct': 0.021872424350599724, 'bull_atr_max_pct': 0.1471137158003128, 'bull_tp_mult': 1.11892066481513, 'bull_tsl_mult': 0.7398514320068984, 'bull_time_stop': 72, 'bull_use_sma': False, 'bull_use_ema': True, 'bull_use_atr': True, 'bull_use_adx': True, 'bull_use_spike': False, 'bull_rsi_required': False, 'bear_strategy': 'mean_reversion', 'bear_bb_std_mult': 3.423601649204799, 'bear_rsi_os': 12, 'bear_rsi_ob': 51, 'bear_adx_thresh': 25.68425988763761, 'bear_atr_min_pct': 0.021021374978325073, 'bear_atr_max_pct': 0.09511311416933368, 'bear_tp_mult': 2.6384102976809833, 'bear_tsl_mult': 0.6324240202476668, 'bear_time_stop': 225, 'bear_use_sma': True, 'bear_use_ema': False, 'bear_use_atr': False, 'bear_use_adx': False, 'bear_use_spike': False, 'bear_rsi_required': False, 'sideways_strategy': 'breakout', 'sideways_bb_std_mult': 2.099382377285243, 'sideways_rsi_os': 41, 'sideways_rsi_ob': 52, 'sideways_adx_thresh': 17.361243873122174, 'sideways_atr_min_pct': 0.022887105153950503, 'sideways_atr_max_pct': 0.1387115753463499, 'sideways_tp_mult': 1.410779854960111, 'sideways_tsl_mult': 0.49289287404709803, 'sideways_time_stop': 119, 'sideways_use_sma': True, 'sideways_use_ema': True, 'sideways_use_atr': False, 'sideways_use_adx': False, 'sideways_use_spike': False, 'sideways_rsi_required': True}.
