[I 2025-08-30 16:35:48,445] Trial 456 finished with values: [-1000000000.0, 1000000000.0] and parameters: {'p_sma': 26, 'p_std': 15, 'p_atr': 24, 'p_adx': 22, 'rsi_period': 81, 'ema1': 24, 'ema2': 12, 'slip_atr_k': 0.008761108875294311, 'slip_spread_k': 0.08984497528275637, 'spread_hl_frac': 0.016822003537301056, 'bb_std_mult': 0.8730180596187838, 'rsi_os': 22, 'rsi_ob': 90, 'vol_spike': 0.2053859522928272, 'adx_thresh': 12.421071715587289, 'atr_min_pct': 0.006449226483021441, 'atr_max_pct': 0.14680850040108423, 'tp_mult': 2.8052000145342633, 'tsl_mult': 0.8229344457672881, 'strategy': 'mean_reversion', 'time_stop': 149, 'use_sma': True, 'use_atr': True, 'use_adx': True, 'use_ema': False, 'use_spike': False, 'rsi_required': True, 'edge_k': 1.2425324730401937, 'edge_cap': 0.28047768126414113, 'bull_strategy': 'mean_reversion', 'bull_bb_std_mult': 1.965951811323483, 'bull_rsi_os': 10, 'bull_rsi_ob': 51, 'bull_adx_thresh': 21.50039910730245, 'bull_atr_min_pct': 0.00821497484102681, 'bull_atr_max_pct': 0.14073076794431427, 'bull_tp_mult': 1.338457861396765, 'bull_tsl_mult': 0.2986870179814454, 'bull_time_stop': 69, 'bull_use_sma': False, 'bull_use_ema': True, 'bull_use_atr': True, 'bull_use_adx': True, 'bull_use_spike': False, 'bull_rsi_required': False, 'bear_strategy': 'mean_reversion', 'bear_bb_std_mult': 1.8545867097484408, 'bear_rsi_os': 14, 'bear_rsi_ob': 52, 'bear_adx_thresh': 18.396826102911334, 'bear_atr_min_pct': 0.006791612325612394, 'bear_atr_max_pct': 0.09608142467843653, 'bear_tp_mult': 2.254986342786464, 'bear_tsl_mult': 0.9017717732785702, 'bear_time_stop': 212, 'bear_use_sma': True, 'bear_use_ema': False, 'bear_use_atr': False, 'bear_use_adx': False, 'bear_use_spike': False, 'bear_rsi_required': False, 'sideways_strategy': 'breakout', 'sideways_bb_std_mult': 2.6158279801353945, 'sideways_rsi_os': 29, 'sideways_rsi_ob': 46, 'sideways_adx_thresh': 15.413189027033177, 'sideways_atr_min_pct': 0.0005605662575756949, 'sideways_atr_max_pct': 0.06646281383290693, 'sideways_tp_mult': 1.513129359413419, 'sideways_tsl_mult': 0.4865042611667798, 'sideways_time_stop': 216, 'sideways_use_sma': True, 'sideways_use_ema': False, 'sideways_use_atr': False, 'sideways_use_adx': False, 'sideways_use_spike': False, 'sideways_rsi_required': True}.
[I 2025-08-30 16:35:48,930] Trial 460 finished with values: [-1000000000.0, 1000000000.0] and parameters: {'p_sma': 5, 'p_std': 44, 'p_atr': 24, 'p_adx': 20, 'rsi_period': 19, 'ema1': 27, 'ema2': 24, 'slip_atr_k': 0.021769305106998406, 'slip_spread_k': 0.5423713732307466, 'spread_hl_frac': 0.04229330213524528, 'bb_std_mult': 3.056085335815423, 'rsi_os': 35, 'rsi_ob': 90, 'vol_spike': 0.007302333580348894, 'adx_thresh': 29.644968431295545, 'atr_min_pct': 0.0179566911945784, 'atr_max_pct': 0.13607614616276956, 'tp_mult': 2.715126138127377, 'tsl_mult': 0.13573398063380987, 'strategy': 'breakout', 'time_stop': 5, 'use_sma': False, 'use_atr': True, 'use_adx': False, 'use_ema': False, 'use_spike': False, 'rsi_required': True, 'edge_k': 1.0595015842314137, 'edge_cap': 0.598469021713374, 'bull_strategy': 'mean_reversion', 'bull_bb_std_mult': 1.951248809250305, 'bull_rsi_os': 37, 'bull_rsi_ob': 49, 'bull_adx_thresh': 21.98708419253438, 'bull_atr_min_pct': 0.01956116857738601, 'bull_atr_max_pct': 0.09585735779159286, 'bull_tp_mult': 1.6339564385339336, 'bull_tsl_mult': 0.2320290580269395, 'bull_time_stop': 52, 'bull_use_sma': False, 'bull_use_ema': True, 'bull_use_atr': True, 'bull_use_adx': False, 'bull_use_spike': False, 'bull_rsi_required': False, 'bear_strategy': 'mean_reversion', 'bear_bb_std_mult': 1.2362779408534377, 'bear_rsi_os': 8, 'bear_rsi_ob': 77, 'bear_adx_thresh': 18.798057651957635, 'bear_atr_min_pct': 0.02012407069904616, 'bear_atr_max_pct': 0.021276347443622418, 'bear_tp_mult': 2.2071710628142776, 'bear_tsl_mult': 0.4555113387703698, 'bear_time_stop': 38, 'bear_use_sma': True, 'bear_use_ema': False, 'bear_use_atr': False, 'bear_use_adx': False, 'bear_use_spike': False, 'bear_rsi_required': False, 'sideways_strategy': 'breakout', 'sideways_bb_std_mult': 2.1073574458958495, 'sideways_rsi_os': 50, 'sideways_rsi_ob': 52, 'sideways_adx_thresh': 16.004567608619965, 'sideways_atr_min_pct': 0.015477446260253437, 'sideways_atr_max_pct': 0.14914936229085127, 'sideways_tp_mult': 1.4524242295014895, 'sideways_tsl_mult': 0.426731644496464, 'sideways_time_stop': 212, 'sideways_use_sma': True, 'sideways_use_ema': False, 'sideways_use_atr': False, 'sideways_use_adx': False, 'sideways_use_spike': False, 'sideways_rsi_required': True}.
[I 2025-08-30 16:36:34,264] Trial 462 finished with values: [-1000000000.0, 1000000000.0] and parameters: {'p_sma': 8, 'p_std': 43, 'p_atr': 9, 'p_adx': 9, 'rsi_period': 26, 'ema1': 26, 'ema2': 11, 'slip_atr_k': 0.18713517858353457, 'slip_spread_k': 0.5456582127785016, 'spread_hl_frac': 0.017037603567304393, 'bb_std_mult': 3.072987880062926, 'rsi_os': 22, 'rsi_ob': 73, 'vol_spike': 0.05827748437095785, 'adx_thresh': 12.217110653566724, 'atr_min_pct': 0.0013439674414540952, 'atr_max_pct': 0.1038900202395459, 'tp_mult': 2.69598020995796, 'tsl_mult': 0.5004336049470379, 'strategy': 'breakout', 'time_stop': 9, 'use_sma': False, 'use_atr': True, 'use_adx': False, 'use_ema': False, 'use_spike': True, 'rsi_required': True, 'edge_k': 1.5063548435791303, 'edge_cap': 0.892257224913821, 'bull_strategy': 'mean_reversion', 'bull_bb_std_mult': 1.9481688063462994, 'bull_rsi_os': 18, 'bull_rsi_ob': 90, 'bull_adx_thresh': 25.712862606988132, 'bull_atr_min_pct': 0.01954593286410013, 'bull_atr_max_pct': 0.06805945721614508, 'bull_tp_mult': 1.290656435080111, 'bull_tsl_mult': 0.980081138224645, 'bull_time_stop': 40, 'bull_use_sma': True, 'bull_use_ema': True, 'bull_use_atr': False, 'bull_use_adx': False, 'bull_use_spike': True, 'bull_rsi_required': False, 'bear_strategy': 'mean_reversion', 'bear_bb_std_mult': 1.186125584131976, 'bear_rsi_os': 11, 'bear_rsi_ob': 75, 'bear_adx_thresh': 13.591305162818019, 'bear_atr_min_pct': 0.008641716526410045, 'bear_atr_max_pct': 0.05184817196074307, 'bear_tp_mult': 2.2089991068687627, 'bear_tsl_mult': 0.6952212685334037, 'bear_time_stop': 106, 'bear_use_sma': False, 'bear_use_ema': True, 'bear_use_atr': True, 'bear_use_adx': False, 'bear_use_spike': False, 'bear_rsi_required': False, 'sideways_strategy': 'breakout', 'sideways_bb_std_mult': 2.202336218636002, 'sideways_rsi_os': 30, 'sideways_rsi_ob': 70, 'sideways_adx_thresh': 17.06636971711078, 'sideways_atr_min_pct': 0.008848327923839862, 'sideways_atr_max_pct': 0.07024302374520618, 'sideways_tp_mult': 1.4134387111960645, 'sideways_tsl_mult': 0.4769403458508937, 'sideways_time_stop': 287, 'sideways_use_sma': False, 'sideways_use_ema': False, 'sideways_use_atr': True, 'sideways_use_adx': True, 'sideways_use_spike': False, 'sideways_rsi_required': True}.
[I 2025-08-30 16:36:34,714] Trial 463 finished with values: [-1000000000.0, 1000000000.0] and parameters: {'p_sma': 7, 'p_std': 58, 'p_atr': 21, 'p_adx': 27, 'rsi_period': 19, 'ema1': 21, 'ema2': 11, 'slip_atr_k': 0.02316285005862881, 'slip_spread_k': 0.5502708593257765, 'spread_hl_frac': 0.008918388980894396, 'bb_std_mult': 0.8083624118401627, 'rsi_os': 54, 'rsi_ob': 47, 'vol_spike': 0.05899476127320451, 'adx_thresh': 13.558611014240146, 'atr_min_pct': 0.01862917512055985, 'atr_max_pct': 0.13697181822640012, 'tp_mult': 2.7156847192968794, 'tsl_mult': 0.5073023664024728, 'strategy': 'breakout', 'time_stop': 179, 'use_sma': False, 'use_atr': True, 'use_adx': False, 'use_ema': False, 'use_spike': True, 'rsi_required': True, 'edge_k': 1.0555309388872447, 'edge_cap': 0.6432868015811805, 'bull_strategy': 'mean_reversion', 'bull_bb_std_mult': 1.9320711691309915, 'bull_rsi_os': 15, 'bull_rsi_ob': 90, 'bull_adx_thresh': 28.144278882845676, 'bull_atr_min_pct': 0.01951265790321724, 'bull_atr_max_pct': 0.1366530525348985, 'bull_tp_mult': 1.300673085320886, 'bull_tsl_mult': 0.23360293073309535, 'bull_time_stop': 36, 'bull_use_sma': True, 'bull_use_ema': True, 'bull_use_atr': False, 'bull_use_adx': False, 'bull_use_spike': True, 'bull_rsi_required': True, 'bear_strategy': 'mean_reversion', 'bear_bb_std_mult': 1.1690958060140848, 'bear_rsi_os': 11, 'bear_rsi_ob': 75, 'bear_adx_thresh': 13.454240754733366, 'bear_atr_min_pct': 0.022452429581705353, 'bear_atr_max_pct': 0.08778395011678992, 'bear_tp_mult': 1.3021835905932537, 'bear_tsl_mult': 0.6981431939687167, 'bear_time_stop': 166, 'bear_use_sma': False, 'bear_use_ema': True, 'bear_use_atr': True, 'bear_use_adx': False, 'bear_use_spike': False, 'bear_rsi_required': False, 'sideways_strategy': 'breakout', 'sideways_bb_std_mult': 2.1121699676266856, 'sideways_rsi_os': 52, 'sideways_rsi_ob': 75, 'sideways_adx_thresh': 17.061400300658196, 'sideways_atr_min_pct': 0.008863424093403183, 'sideways_atr_max_pct': 0.14941745475691975, 'sideways_tp_mult': 1.451912635998661, 'sideways_tsl_mult': 0.35925214155846075, 'sideways_time_stop': 223, 'sideways_use_sma': False, 'sideways_use_ema': False, 'sideways_use_atr': True, 'sideways_use_adx': True, 'sideways_use_spike': False, 'sideways_rsi_required': True}.
[I 2025-08-30 16:36:35,320] Trial 461 finished with values: [-1000000000.0, 1000000000.0] and parameters: {'p_sma': 8, 'p_std': 58, 'p_atr': 9, 'p_adx': 26, 'rsi_period': 19, 'ema1': 26, 'ema2': 38, 'slip_atr_k': 0.011927320368168976, 'slip_spread_k': 0.5491674078729744, 'spread_hl_frac': 0.016863741662502905, 'bb_std_mult': 3.1319009392974024, 'rsi_os': 22, 'rsi_ob': 90, 'vol_spike': 0.00011512228290292968, 'adx_thresh': 12.217837205916489, 'atr_min_pct': 0.001435483275298433, 'atr_max_pct': 0.13795146451146448, 'tp_mult': 2.7161500033289245, 'tsl_mult': 0.4997041830311249, 'strategy': 'breakout', 'time_stop': 9, 'use_sma': False, 'use_atr': True, 'use_adx': False, 'use_ema': False, 'use_spike': True, 'rsi_required': True, 'edge_k': 1.776620690573198, 'edge_cap': 0.6373050108230669, 'bull_strategy': 'mean_reversion', 'bull_bb_std_mult': 1.9548539156467806, 'bull_rsi_os': 49, 'bull_rsi_ob': 49, 'bull_adx_thresh': 25.45052969912861, 'bull_atr_min_pct': 0.019801939168645318, 'bull_atr_max_pct': 0.06940544170888319, 'bull_tp_mult': 1.2799244979444273, 'bull_tsl_mult': 0.23895689527609137, 'bull_time_stop': 37, 'bull_use_sma': False, 'bull_use_ema': True, 'bull_use_atr': True, 'bull_use_adx': False, 'bull_use_spike': True, 'bull_rsi_required': False, 'bear_strategy': 'mean_reversion', 'bear_bb_std_mult': 2.033157765196071, 'bear_rsi_os': 14, 'bear_rsi_ob': 73, 'bear_adx_thresh': 13.36849814818057, 'bear_atr_min_pct': 0.013314689115979014, 'bear_atr_max_pct': 0.05635510034181043, 'bear_tp_mult': 2.5128206185602133, 'bear_tsl_mult': 0.6156191591121557, 'bear_time_stop': 292, 'bear_use_sma': True, 'bear_use_ema': False, 'bear_use_atr': False, 'bear_use_adx': False, 'bear_use_spike': False, 'bear_rsi_required': False, 'sideways_strategy': 'breakout', 'sideways_bb_std_mult': 2.1180603853629996, 'sideways_rsi_os': 15, 'sideways_rsi_ob': 94, 'sideways_adx_thresh': 16.911554586226636, 'sideways_atr_min_pct': 0.00888124855571851, 'sideways_atr_max_pct': 0.10603495312060846, 'sideways_tp_mult': 1.7502544189067513, 'sideways_tsl_mult': 0.4351100359408312, 'sideways_time_stop': 228, 'sideways_use_sma': True, 'sideways_use_ema': False, 'sideways_use_atr': True, 'sideways_use_adx': False, 'sideways_use_spike': False, 'sideways_rsi_required': True}.
[I 2025-08-30 16:36:35,336] Trial 464 finished with values: [-1000000000.0, 1000000000.0] and parameters: {'p_sma': 8, 'p_std': 58, 'p_atr': 9, 'p_adx': 26, 'rsi_period': 21, 'ema1': 28, 'ema2': 11, 'slip_atr_k': 0.013197415876396754, 'slip_spread_k': 0.5782207416494879, 'spread_hl_frac': 0.02240533037300247, 'bb_std_mult': 2.964064178597877, 'rsi_os': 12, 'rsi_ob': 73, 'vol_spike': 0.05482056246383683, 'adx_thresh': 8.095642773223325, 'atr_min_pct': 0.01853375905256474, 'atr_max_pct': 0.08228574661451292, 'tp_mult': 1.615193089229396, 'tsl_mult': 0.8715505099910728, 'strategy': 'breakout', 'time_stop': 78, 'use_sma': False, 'use_atr': True, 'use_adx': False, 'use_ema': False, 'use_spike': True, 'rsi_required': False, 'edge_k': 1.4134970216497162, 'edge_cap': 0.8787801968813568, 'bull_strategy': 'mean_reversion', 'bull_bb_std_mult': 2.0470533458455056, 'bull_rsi_os': 18, 'bull_rsi_ob': 47, 'bull_adx_thresh': 25.65034174185372, 'bull_atr_min_pct': 0.020432681853443876, 'bull_atr_max_pct': 0.04725605258837869, 'bull_tp_mult': 1.278267933884072, 'bull_tsl_mult': 0.09981583335471422, 'bull_time_stop': 82, 'bull_use_sma': True, 'bull_use_ema': True, 'bull_use_atr': False, 'bull_use_adx': False, 'bull_use_spike': True, 'bull_rsi_required': True, 'bear_strategy': 'mean_reversion', 'bear_bb_std_mult': 3.084653429971654, 'bear_rsi_os': 11, 'bear_rsi_ob': 73, 'bear_adx_thresh': 13.513982856888354, 'bear_atr_min_pct': 0.007979229558595868, 'bear_atr_max_pct': 0.08201671160660685, 'bear_tp_mult': 2.2946794963881767, 'bear_tsl_mult': 0.6159406871900388, 'bear_time_stop': 292, 'bear_use_sma': False, 'bear_use_ema': True, 'bear_use_atr': True, 'bear_use_adx': False, 'bear_use_spike': True, 'bear_rsi_required': False, 'sideways_strategy': 'breakout', 'sideways_bb_std_mult': 1.6036158997674925, 'sideways_rsi_os': 26, 'sideways_rsi_ob': 48, 'sideways_adx_thresh': 10.273070638041169, 'sideways_atr_min_pct': 0.002674212052128093, 'sideways_atr_max_pct': 0.10935734748739205, 'sideways_tp_mult': 2.935480143486896, 'sideways_tsl_mult': 0.35057755305513233, 'sideways_time_stop': 105, 'sideways_use_sma': False, 'sideways_use_ema': False, 'sideways_use_atr': True, 'sideways_use_adx': True, 'sideways_use_spike': False, 'sideways_rsi_required': True}.
[I 2025-08-30 16:36:36,435] Trial 465 finished with values: [-1000000000.0, 1000000000.0] and parameters: {'p_sma': 8, 'p_std': 11, 'p_atr': 21, 'p_adx': 26, 'rsi_period': 64, 'ema1': 7, 'ema2': 10, 'slip_atr_k': 0.23328464579207234, 'slip_spread_k': 0.5712397823908569, 'spread_hl_frac': 0.01839561049738391, 'bb_std_mult': 1.533190192615364, 'rsi_os': 55, 'rsi_ob': 88, 'vol_spike': 0.009977552462423846, 'adx_thresh': 13.719131294442125, 'atr_min_pct': 0.018659971788666886, 'atr_max_pct': 0.1378789952461116, 'tp_mult': 1.606725332545448, 'tsl_mult': 0.4492185828311365, 'strategy': 'mean_reversion', 'time_stop': 19, 'use_sma': False, 'use_atr': True, 'use_adx': True, 'use_ema': False, 'use_spike': True, 'rsi_required': False, 'edge_k': 0.5753678391822636, 'edge_cap': 0.6382700306294902, 'bull_strategy': 'mean_reversion', 'bull_bb_std_mult': 1.4504973571467854, 'bull_rsi_os': 15, 'bull_rsi_ob': 49, 'bull_adx_thresh': 20.80969814252251, 'bull_atr_min_pct': 0.020355757625760425, 'bull_atr_max_pct': 0.043335015833941476, 'bull_tp_mult': 1.2451268637133204, 'bull_tsl_mult': 0.3342707748312358, 'bull_time_stop': 151, 'bull_use_sma': True, 'bull_use_ema': False, 'bull_use_atr': False, 'bull_use_adx': True, 'bull_use_spike': True, 'bull_rsi_required': True, 'bear_strategy': 'mean_reversion', 'bear_bb_std_mult': 3.0840891460835147, 'bear_rsi_os': 51, 'bear_rsi_ob': 81, 'bear_adx_thresh': 12.199573961633961, 'bear_atr_min_pct': 0.02262828174934174, 'bear_atr_max_pct': 0.08789669329896019, 'bear_tp_mult': 2.7717791671484013, 'bear_tsl_mult': 0.612480262171762, 'bear_time_stop': 296, 'bear_use_sma': True, 'bear_use_ema': False, 'bear_use_atr': False, 'bear_use_adx': False, 'bear_use_spike': True, 'bear_rsi_required': False, 'sideways_strategy': 'breakout', 'sideways_bb_std_mult': 2.0627756070550856, 'sideways_rsi_os': 26, 'sideways_rsi_ob': 94, 'sideways_adx_thresh': 16.26241690546824, 'sideways_atr_min_pct': 0.0027633553713466465, 'sideways_atr_max_pct': 0.1047898861456115, 'sideways_tp_mult': 2.142034271406187, 'sideways_tsl_mult': 0.34972217307821096, 'sideways_time_stop': 167, 'sideways_use_sma': True, 'sideways_use_ema': False, 'sideways_use_atr': True, 'sideways_use_adx': False, 'sideways_use_spike': False, 'sideways_rsi_required': True}.
[I 2025-08-30 16:36:36,469] Trial 468 finished with values: [-1000000000.0, 1000000000.0] and parameters: {'p_sma': 30, 'p_std': 10, 'p_atr': 23, 'p_adx': 23, 'rsi_period': 22, 'ema1': 23, 'ema2': 16, 'slip_atr_k': 0.22966852391616016, 'slip_spread_k': 0.5716454097632158, 'spread_hl_frac': 0.018654635869191923, 'bb_std_mult': 3.5913091619145137, 'rsi_os': 38, 'rsi_ob': 45, 'vol_spike': 0.17239143167490614, 'adx_thresh': 15.298423604777097, 'atr_min_pct': 0.024151075886916944, 'atr_max_pct': 0.09946371100193557, 'tp_mult': 1.8899262537065495, 'tsl_mult': 0.4474140455890453, 'strategy': 'mean_reversion', 'time_stop': 17, 'use_sma': False, 'use_atr': False, 'use_adx': True, 'use_ema': True, 'use_spike': False, 'rsi_required': False, 'edge_k': 1.5504269540535889, 'edge_cap': 0.20424000501752676, 'bull_strategy': 'breakout', 'bull_bb_std_mult': 2.679486747302327, 'bull_rsi_os': 12, 'bull_rsi_ob': 49, 'bull_adx_thresh': 20.54955888768959, 'bull_atr_min_pct': 0.004658169742215168, 'bull_atr_max_pct': 0.04275096257719349, 'bull_tp_mult': 1.4387355760300962, 'bull_tsl_mult': 0.35048073325815265, 'bull_time_stop': 151, 'bull_use_sma': False, 'bull_use_ema': False, 'bull_use_atr': True, 'bull_use_adx': True, 'bull_use_spike': False, 'bull_rsi_required': False, 'bear_strategy': 'breakout', 'bear_bb_std_mult': 1.996823477641469, 'bear_rsi_os': 51, 'bear_rsi_ob': 81, 'bear_adx_thresh': 29.565800925511063, 'bear_atr_min_pct': 0.01722428204371132, 'bear_atr_max_pct': 0.14706042901852476, 'bear_tp_mult': 2.156656438954932, 'bear_tsl_mult': 0.5922727509567034, 'bear_time_stop': 148, 'bear_use_sma': True, 'bear_use_ema': False, 'bear_use_atr': False, 'bear_use_adx': True, 'bear_use_spike': True, 'bear_rsi_required': True, 'sideways_strategy': 'mean_reversion', 'sideways_bb_std_mult': 2.4084140155448654, 'sideways_rsi_os': 41, 'sideways_rsi_ob': 91, 'sideways_adx_thresh': 28.32719227520446, 'sideways_atr_min_pct': 0.0017963424342348, 'sideways_atr_max_pct': 0.14454624607556285, 'sideways_tp_mult': 1.4047920654519714, 'sideways_tsl_mult': 0.4457020145589277, 'sideways_time_stop': 206, 'sideways_use_sma': True, 'sideways_use_ema': True, 'sideways_use_atr': False, 'sideways_use_adx': False, 'sideways_use_spike': True, 'sideways_rsi_required': False}.
[I 2025-08-30 16:36:37,510] Trial 469 finished with values: [-1000000000.0, 1000000000.0] and parameters: {'p_sma': 30, 'p_std': 56, 'p_atr': 23, 'p_adx': 7, 'rsi_period': 23, 'ema1': 27, 'ema2': 31, 'slip_atr_k': 0.06124926432188432, 'slip_spread_k': 0.5973872580036832, 'spread_hl_frac': 0.02425474172023897, 'bb_std_mult': 2.99458900058011, 'rsi_os': 36, 'rsi_ob': 45, 'vol_spike': 0.17214393798935887, 'adx_thresh': 14.251949705944153, 'atr_min_pct': 0.008396744762988153, 'atr_max_pct': 0.14024773005289443, 'tp_mult': 1.8825014785364398, 'tsl_mult': 0.4419336285205325, 'strategy': 'mean_reversion', 'time_stop': 17, 'use_sma': False, 'use_atr': False, 'use_adx': True, 'use_ema': True, 'use_spike': False, 'rsi_required': True, 'edge_k': 1.623758290292123, 'edge_cap': 0.4856300361465447, 'bull_strategy': 'breakout', 'bull_bb_std_mult': 2.680138016132304, 'bull_rsi_os': 43, 'bull_rsi_ob': 48, 'bull_adx_thresh': 20.092010555606468, 'bull_atr_min_pct': 0.021020841254151858, 'bull_atr_max_pct': 0.13307791083493628, 'bull_tp_mult': 1.9956116741363261, 'bull_tsl_mult': 0.8543270433452201, 'bull_time_stop': 67, 'bull_use_sma': False, 'bull_use_ema': False, 'bull_use_atr': True, 'bull_use_adx': True, 'bull_use_spike': False, 'bull_rsi_required': False, 'bear_strategy': 'breakout', 'bear_bb_std_mult': 2.280574985381653, 'bear_rsi_os': 13, 'bear_rsi_ob': 79, 'bear_adx_thresh': 5.505862952345629, 'bear_atr_min_pct': 0.0019854586599604047, 'bear_atr_max_pct': 0.017488479679638513, 'bear_tp_mult': 1.4088577967186966, 'bear_tsl_mult': 0.6609213826161014, 'bear_time_stop': 223, 'bear_use_sma': True, 'bear_use_ema': False, 'bear_use_atr': False, 'bear_use_adx': True, 'bear_use_spike': False, 'bear_rsi_required': True, 'sideways_strategy': 'mean_reversion', 'sideways_bb_std_mult': 3.487406858643529, 'sideways_rsi_os': 47, 'sideways_rsi_ob': 54, 'sideways_adx_thresh': 24.29318773067915, 'sideways_atr_min_pct': 0.0019944413775272885, 'sideways_atr_max_pct': 0.14490100818526355, 'sideways_tp_mult': 2.0358147772725257, 'sideways_tsl_mult': 0.4579966187392642, 'sideways_time_stop': 70, 'sideways_use_sma': True, 'sideways_use_ema': True, 'sideways_use_atr': False, 'sideways_use_adx': False, 'sideways_use_spike': True, 'sideways_rsi_required': False}.
