[I 2025-08-30 16:46:09,793] Trial 521 finished with values: [-0.02664956261135154, 0.02653987289781846] and parameters: {'p_sma': 50, 'p_std': 48, 'p_atr': 25, 'p_adx': 27, 'rsi_period': 21, 'ema1': 6, 'ema2': 10, 'slip_atr_k': 0.09931877027276374, 'slip_spread_k': 0.9990564517384581, 'spread_hl_frac': 0.019074263740115147, 'bb_std_mult': 3.1520387413997515, 'rsi_os': 35, 'rsi_ob': 63, 'vol_spike': 5.7077100631421133e-05, 'adx_thresh': 10.42605082956834, 'atr_min_pct': 0.01962857343611649, 'atr_max_pct': 0.1299521343869335, 'tp_mult': 2.910931961650547, 'tsl_mult': 0.41423920640261164, 'strategy': 'breakout', 'time_stop': 29, 'use_sma': False, 'use_atr': True, 'use_adx': False, 'use_ema': False, 'use_spike': True, 'rsi_required': True, 'edge_k': 1.5556756641729843, 'edge_cap': 0.6834793297538803, 'bull_strategy': 'mean_reversion', 'bull_bb_std_mult': 1.003148954643805, 'bull_rsi_os': 9, 'bull_rsi_ob': 52, 'bull_adx_thresh': 18.83132758448399, 'bull_atr_min_pct': 0.019715268286297556, 'bull_atr_max_pct': 0.13425260820720644, 'bull_tp_mult': 1.2588583860056748, 'bull_tsl_mult': 0.47031968463549567, 'bull_time_stop': 73, 'bull_use_sma': False, 'bull_use_ema': True, 'bull_use_atr': True, 'bull_use_adx': False, 'bull_use_spike': True, 'bull_rsi_required': False, 'bear_strategy': 'mean_reversion', 'bear_bb_std_mult': 0.6545191268677031, 'bear_rsi_os': 13, 'bear_rsi_ob': 78, 'bear_adx_thresh': 13.669292536910186, 'bear_atr_min_pct': 0.020356053981189018, 'bear_atr_max_pct': 0.026134126427182804, 'bear_tp_mult': 2.10439477605687, 'bear_tsl_mult': 0.21815152772067176, 'bear_time_stop': 24, 'bear_use_sma': True, 'bear_use_ema': False, 'bear_use_atr': False, 'bear_use_adx': False, 'bear_use_spike': False, 'bear_rsi_required': False, 'sideways_strategy': 'breakout', 'sideways_bb_std_mult': 2.822128387133863, 'sideways_rsi_os': 29, 'sideways_rsi_ob': 45, 'sideways_adx_thresh': 16.732937615647746, 'sideways_atr_min_pct': 0.0017376629406270704, 'sideways_atr_max_pct': 0.14830504456156782, 'sideways_tp_mult': 1.4574880717942702, 'sideways_tsl_mult': 0.03089410473039489, 'sideways_time_stop': 109, 'sideways_use_sma': True, 'sideways_use_ema': False, 'sideways_use_atr': True, 'sideways_use_adx': False, 'sideways_use_spike': False, 'sideways_rsi_required': True}.
[I 2025-08-30 16:46:10,771] Trial 523 finished with values: [-1000000000.0, 1000000000.0] and parameters: {'p_sma': 9, 'p_std': 49, 'p_atr': 24, 'p_adx': 21, 'rsi_period': 21, 'ema1': 27, 'ema2': 12, 'slip_atr_k': 0.017761849288876863, 'slip_spread_k': 0.6247749770601964, 'spread_hl_frac': 0.017260928803390786, 'bb_std_mult': 3.1212317653216366, 'rsi_os': 30, 'rsi_ob': 62, 'vol_spike': 0.15408886773258137, 'adx_thresh': 10.412866159782183, 'atr_min_pct': 0.01474001378138414, 'atr_max_pct': 0.053063191924338095, 'tp_mult': 2.290238970624572, 'tsl_mult': 0.17129719471304627, 'strategy': 'breakout', 'time_stop': 16, 'use_sma': False, 'use_atr': True, 'use_adx': False, 'use_ema': False, 'use_spike': False, 'rsi_required': True, 'edge_k': 1.3999243940561052, 'edge_cap': 0.6624179682060132, 'bull_strategy': 'mean_reversion', 'bull_bb_std_mult': 1.009747241108011, 'bull_rsi_os': 9, 'bull_rsi_ob': 52, 'bull_adx_thresh': 27.928179117040997, 'bull_atr_min_pct': 0.019640232192761047, 'bull_atr_max_pct': 0.1184947308438138, 'bull_tp_mult': 1.4141908897908175, 'bull_tsl_mult': 0.35164003749338874, 'bull_time_stop': 73, 'bull_use_sma': False, 'bull_use_ema': True, 'bull_use_atr': True, 'bull_use_adx': False, 'bull_use_spike': False, 'bull_rsi_required': False, 'bear_strategy': 'mean_reversion', 'bear_bb_std_mult': 2.0458679926506944, 'bear_rsi_os': 40, 'bear_rsi_ob': 78, 'bear_adx_thresh': 17.969682273338993, 'bear_atr_min_pct': 0.0007978623201139127, 'bear_atr_max_pct': 0.08345200303488398, 'bear_tp_mult': 2.0988052086576876, 'bear_tsl_mult': 0.10432419531709192, 'bear_time_stop': 206, 'bear_use_sma': True, 'bear_use_ema': False, 'bear_use_atr': False, 'bear_use_adx': False, 'bear_use_spike': False, 'bear_rsi_required': False, 'sideways_strategy': 'breakout', 'sideways_bb_std_mult': 2.0238003125337443, 'sideways_rsi_os': 28, 'sideways_rsi_ob': 83, 'sideways_adx_thresh': 28.720060301269918, 'sideways_atr_min_pct': 0.027916129470194548, 'sideways_atr_max_pct': 0.1473603740203035, 'sideways_tp_mult': 2.1374414767137058, 'sideways_tsl_mult': 0.4417015457261836, 'sideways_time_stop': 219, 'sideways_use_sma': True, 'sideways_use_ema': False, 'sideways_use_atr': False, 'sideways_use_adx': False, 'sideways_use_spike': False, 'sideways_rsi_required': True}.
[I 2025-08-30 16:46:11,937] Trial 526 finished with values: [-1000000000.0, 1000000000.0] and parameters: {'p_sma': 9, 'p_std': 54, 'p_atr': 14, 'p_adx': 30, 'rsi_period': 18, 'ema1': 27, 'ema2': 14, 'slip_atr_k': 0.020422902447525905, 'slip_spread_k': 0.7831670385174725, 'spread_hl_frac': 0.016406543332230086, 'bb_std_mult': 3.069038879331992, 'rsi_os': 52, 'rsi_ob': 89, 'vol_spike': 0.07890294502678465, 'adx_thresh': 12.243974634817423, 'atr_min_pct': 0.020352957756372518, 'atr_max_pct': 0.1202394595173277, 'tp_mult': 2.783005726897391, 'tsl_mult': 0.5073194267430625, 'strategy': 'mean_reversion', 'time_stop': 15, 'use_sma': True, 'use_atr': False, 'use_adx': True, 'use_ema': True, 'use_spike': False, 'rsi_required': False, 'edge_k': 1.388557061717382, 'edge_cap': 0.6577575269910365, 'bull_strategy': 'breakout', 'bull_bb_std_mult': 2.0183445967998024, 'bull_rsi_os': 54, 'bull_rsi_ob': 51, 'bull_adx_thresh': 21.804942357543556, 'bull_atr_min_pct': 0.020361833030373554, 'bull_atr_max_pct': 0.10441367455052425, 'bull_tp_mult': 1.39650146450145, 'bull_tsl_mult': 0.35763709625224954, 'bull_time_stop': 84, 'bull_use_sma': False, 'bull_use_ema': False, 'bull_use_atr': True, 'bull_use_adx': True, 'bull_use_spike': False, 'bull_rsi_required': False, 'bear_strategy': 'breakout', 'bear_bb_std_mult': 1.5154283135824098, 'bear_rsi_os': 23, 'bear_rsi_ob': 91, 'bear_adx_thresh': 12.512116622561598, 'bear_atr_min_pct': 0.022502384201032236, 'bear_atr_max_pct': 0.08605126825833712, 'bear_tp_mult': 1.5627121136498532, 'bear_tsl_mult': 0.6975864503136164, 'bear_time_stop': 210, 'bear_use_sma': False, 'bear_use_ema': False, 'bear_use_atr': True, 'bear_use_adx': True, 'bear_use_spike': True, 'bear_rsi_required': True, 'sideways_strategy': 'mean_reversion', 'sideways_bb_std_mult': 2.1618854741260725, 'sideways_rsi_os': 51, 'sideways_rsi_ob': 84, 'sideways_adx_thresh': 16.07926906977159, 'sideways_atr_min_pct': 0.0062761509638674575, 'sideways_atr_max_pct': 0.14245318190504333, 'sideways_tp_mult': 1.387796889617144, 'sideways_tsl_mult': 0.4136591679869802, 'sideways_time_stop': 183, 'sideways_use_sma': False, 'sideways_use_ema': True, 'sideways_use_atr': False, 'sideways_use_adx': True, 'sideways_use_spike': True, 'sideways_rsi_required': False}.
[I 2025-08-30 16:46:12,139] Trial 527 finished with values: [-1000000000.0, 1000000000.0] and parameters: {'p_sma': 6, 'p_std': 53, 'p_atr': 28, 'p_adx': 23, 'rsi_period': 18, 'ema1': 26, 'ema2': 14, 'slip_atr_k': 0.06376825840874759, 'slip_spread_k': 0.5881108516472381, 'spread_hl_frac': 0.015891862916243876, 'bb_std_mult': 1.5021758787482575, 'rsi_os': 52, 'rsi_ob': 89, 'vol_spike': 0.012336852637611907, 'adx_thresh': 13.136428273383038, 'atr_min_pct': 0.009195794535193914, 'atr_max_pct': 0.0958794049641844, 'tp_mult': 1.2811480741578383, 'tsl_mult': 0.31110083893185975, 'strategy': 'mean_reversion', 'time_stop': 113, 'use_sma': True, 'use_atr': False, 'use_adx': True, 'use_ema': True, 'use_spike': False, 'rsi_required': False, 'edge_k': 0.4506372099325383, 'edge_cap': 0.6378213456535563, 'bull_strategy': 'breakout', 'bull_bb_std_mult': 1.2624337748002663, 'bull_rsi_os': 29, 'bull_rsi_ob': 51, 'bull_adx_thresh': 20.053115110003596, 'bull_atr_min_pct': 0.020421842277786085, 'bull_atr_max_pct': 0.10172700288783107, 'bull_tp_mult': 1.3040439351773045, 'bull_tsl_mult': 0.16207494813389373, 'bull_time_stop': 253, 'bull_use_sma': False, 'bull_use_ema': False, 'bull_use_atr': True, 'bull_use_adx': True, 'bull_use_spike': False, 'bull_rsi_required': False, 'bear_strategy': 'breakout', 'bear_bb_std_mult': 2.127378128004699, 'bear_rsi_os': 30, 'bear_rsi_ob': 67, 'bear_adx_thresh': 12.25833291524703, 'bear_atr_min_pct': 0.02278725838609478, 'bear_atr_max_pct': 0.09188156299550429, 'bear_tp_mult': 2.1613866440683585, 'bear_tsl_mult': 0.6988239231854668, 'bear_time_stop': 109, 'bear_use_sma': False, 'bear_use_ema': False, 'bear_use_atr': True, 'bear_use_adx': True, 'bear_use_spike': True, 'bear_rsi_required': True, 'sideways_strategy': 'mean_reversion', 'sideways_bb_std_mult': 2.139297890263815, 'sideways_rsi_os': 30, 'sideways_rsi_ob': 93, 'sideways_adx_thresh': 16.028453687832805, 'sideways_atr_min_pct': 0.0043083973264403524, 'sideways_atr_max_pct': 0.14283146343612652, 'sideways_tp_mult': 1.387207192330519, 'sideways_tsl_mult': 0.4134134652254049, 'sideways_time_stop': 214, 'sideways_use_sma': False, 'sideways_use_ema': True, 'sideways_use_atr': False, 'sideways_use_adx': True, 'sideways_use_spike': True, 'sideways_rsi_required': False}.
[I 2025-08-30 16:46:53,544] Trial 524 finished with values: [-1000000000.0, 1000000000.0] and parameters: {'p_sma': 10, 'p_std': 53, 'p_atr': 24, 'p_adx': 8, 'rsi_period': 21, 'ema1': 9, 'ema2': 12, 'slip_atr_k': 0.020099804197622834, 'slip_spread_k': 0.9606349489934776, 'spread_hl_frac': 0.016093362493016666, 'bb_std_mult': 3.083148864342527, 'rsi_os': 34, 'rsi_ob': 91, 'vol_spike': 0.011070543947328136, 'adx_thresh': 12.03598028700878, 'atr_min_pct': 0.009255474220262351, 'atr_max_pct': 0.144794303097515, 'tp_mult': 2.284996348594577, 'tsl_mult': 0.3076063549216164, 'strategy': 'breakout', 'time_stop': 156, 'use_sma': False, 'use_atr': True, 'use_adx': False, 'use_ema': False, 'use_spike': True, 'rsi_required': True, 'edge_k': 1.3858266329604036, 'edge_cap': 0.6371804046754214, 'bull_strategy': 'mean_reversion', 'bull_bb_std_mult': 0.7623374926058695, 'bull_rsi_os': 9, 'bull_rsi_ob': 52, 'bull_adx_thresh': 21.742946116048365, 'bull_atr_min_pct': 0.020282363813519146, 'bull_atr_max_pct': 0.13494820666727506, 'bull_tp_mult': 1.2204348457730931, 'bull_tsl_mult': 0.455251128019046, 'bull_time_stop': 66, 'bull_use_sma': False, 'bull_use_ema': True, 'bull_use_atr': True, 'bull_use_adx': False, 'bull_use_spike': False, 'bull_rsi_required': False, 'bear_strategy': 'mean_reversion', 'bear_bb_std_mult': 2.043195415547065, 'bear_rsi_os': 15, 'bear_rsi_ob': 78, 'bear_adx_thresh': 13.340385059374517, 'bear_atr_min_pct': 0.0006873522850521733, 'bear_atr_max_pct': 0.10909147100077699, 'bear_tp_mult': 2.124682536378785, 'bear_tsl_mult': 0.7055889772455302, 'bear_time_stop': 203, 'bear_use_sma': True, 'bear_use_ema': False, 'bear_use_atr': False, 'bear_use_adx': False, 'bear_use_spike': False, 'bear_rsi_required': False, 'sideways_strategy': 'breakout', 'sideways_bb_std_mult': 2.012491013825885, 'sideways_rsi_os': 29, 'sideways_rsi_ob': 90, 'sideways_adx_thresh': 16.598768685396355, 'sideways_atr_min_pct': 0.027878556996945573, 'sideways_atr_max_pct': 0.14737097220299455, 'sideways_tp_mult': 1.3892884894929318, 'sideways_tsl_mult': 0.4439905620057672, 'sideways_time_stop': 148, 'sideways_use_sma': True, 'sideways_use_ema': False, 'sideways_use_atr': False, 'sideways_use_adx': False, 'sideways_use_spike': False, 'sideways_rsi_required': True}.
[I 2025-08-30 16:46:53,941] Trial 525 finished with values: [-0.026853408392733535, 0.026745542922213972] and parameters: {'p_sma': 9, 'p_std': 26, 'p_atr': 21, 'p_adx': 28, 'rsi_period': 21, 'ema1': 6, 'ema2': 30, 'slip_atr_k': 0.017548172697472667, 'slip_spread_k': 0.9580987085787953, 'spread_hl_frac': 0.037759365853369246, 'bb_std_mult': 3.103585435749537, 'rsi_os': 7, 'rsi_ob': 91, 'vol_spike': 0.010737320100444168, 'adx_thresh': 10.44075056363619, 'atr_min_pct': 0.020105314250633707, 'atr_max_pct': 0.09639332094933045, 'tp_mult': 2.85448565248596, 'tsl_mult': 0.39604228591700674, 'strategy': 'mean_reversion', 'time_stop': 50, 'use_sma': False, 'use_atr': True, 'use_adx': True, 'use_ema': False, 'use_spike': True, 'rsi_required': True, 'edge_k': 1.399251685983018, 'edge_cap': 0.6375458401056996, 'bull_strategy': 'breakout', 'bull_bb_std_mult': 1.6157086600179087, 'bull_rsi_os': 39, 'bull_rsi_ob': 52, 'bull_adx_thresh': 21.807896760999224, 'bull_atr_min_pct': 0.006251783893187394, 'bull_atr_max_pct': 0.13024247030252503, 'bull_tp_mult': 1.4076820684447477, 'bull_tsl_mult': 0.3056003470414047, 'bull_time_stop': 68, 'bull_use_sma': False, 'bull_use_ema': False, 'bull_use_atr': True, 'bull_use_adx': True, 'bull_use_spike': False, 'bull_rsi_required': False, 'bear_strategy': 'mean_reversion', 'bear_bb_std_mult': 2.055400424804242, 'bear_rsi_os': 15, 'bear_rsi_ob': 78, 'bear_adx_thresh': 12.302250212431025, 'bear_atr_min_pct': 0.022635172348455537, 'bear_atr_max_pct': 0.08604704844459, 'bear_tp_mult': 2.5817380044083063, 'bear_tsl_mult': 0.6944411590994282, 'bear_time_stop': 164, 'bear_use_sma': False, 'bear_use_ema': False, 'bear_use_atr': False, 'bear_use_adx': False, 'bear_use_spike': False, 'bear_rsi_required': False, 'sideways_strategy': 'breakout', 'sideways_bb_std_mult': 0.957125094583122, 'sideways_rsi_os': 30, 'sideways_rsi_ob': 90, 'sideways_adx_thresh': 16.528062190304915, 'sideways_atr_min_pct': 0.0009477324798135463, 'sideways_atr_max_pct': 0.14166515296432358, 'sideways_tp_mult': 1.5272142354267033, 'sideways_tsl_mult': 0.4448766909275583, 'sideways_time_stop': 169, 'sideways_use_sma': False, 'sideways_use_ema': False, 'sideways_use_atr': False, 'sideways_use_adx': True, 'sideways_use_spike': False, 'sideways_rsi_required': False}.
[I 2025-08-30 16:46:57,482] Trial 528 finished with values: [-1000000000.0, 1000000000.0] and parameters: {'p_sma': 6, 'p_std': 59, 'p_atr': 28, 'p_adx': 22, 'rsi_period': 56, 'ema1': 26, 'ema2': 11, 'slip_atr_k': 0.21101599697461634, 'slip_spread_k': 0.5873366103756655, 'spread_hl_frac': 0.023120175876171305, 'bb_std_mult': 2.887764552382718, 'rsi_os': 18, 'rsi_ob': 91, 'vol_spike': 0.26682535907712845, 'adx_thresh': 13.944689311993754, 'atr_min_pct': 0.01779359479397043, 'atr_max_pct': 0.13851183325768943, 'tp_mult': 2.813503265873866, 'tsl_mult': 0.3105577888002684, 'strategy': 'mean_reversion', 'time_stop': 49, 'use_sma': False, 'use_atr': True, 'use_adx': True, 'use_ema': False, 'use_spike': True, 'rsi_required': True, 'edge_k': 0.46483336182340085, 'edge_cap': 0.457161460605371, 'bull_strategy': 'mean_reversion', 'bull_bb_std_mult': 3.3890297723130294, 'bull_rsi_os': 38, 'bull_rsi_ob': 57, 'bull_adx_thresh': 22.529450616715934, 'bull_atr_min_pct': 0.018241403614224803, 'bull_atr_max_pct': 0.13037025125620608, 'bull_tp_mult': 1.2155225963645373, 'bull_tsl_mult': 0.23699418557377636, 'bull_time_stop': 62, 'bull_use_sma': False, 'bull_use_ema': True, 'bull_use_atr': True, 'bull_use_adx': True, 'bull_use_spike': False, 'bull_rsi_required': False, 'bear_strategy': 'mean_reversion', 'bear_bb_std_mult': 2.151136499400581, 'bear_rsi_os': 55, 'bear_rsi_ob': 49, 'bear_adx_thresh': 13.282060574306257, 'bear_atr_min_pct': 0.022685624389158894, 'bear_atr_max_pct': 0.03594954221395939, 'bear_tp_mult': 2.165267005254457, 'bear_tsl_mult': 0.6300916916522676, 'bear_time_stop': 53, 'bear_use_sma': True, 'bear_use_ema': False, 'bear_use_atr': False, 'bear_use_adx': False, 'bear_use_spike': False, 'bear_rsi_required': False, 'sideways_strategy': 'breakout', 'sideways_bb_std_mult': 1.00932775631299, 'sideways_rsi_os': 30, 'sideways_rsi_ob': 93, 'sideways_adx_thresh': 21.448938938984107, 'sideways_atr_min_pct': 0.0010096352149482062, 'sideways_atr_max_pct': 0.13822752770539423, 'sideways_tp_mult': 2.007961017793337, 'sideways_tsl_mult': 0.8741037779646388, 'sideways_time_stop': 124, 'sideways_use_sma': True, 'sideways_use_ema': False, 'sideways_use_atr': False, 'sideways_use_adx': False, 'sideways_use_spike': False, 'sideways_rsi_required': True}.
[I 2025-08-30 16:46:58,475] Trial 529 finished with values: [-1000000000.0, 1000000000.0] and parameters: {'p_sma': 13, 'p_std': 59, 'p_atr': 29, 'p_adx': 22, 'rsi_period': 56, 'ema1': 7, 'ema2': 38, 'slip_atr_k': 0.004163516829648441, 'slip_spread_k': 0.6439449439323146, 'spread_hl_frac': 0.01841212345430524, 'bb_std_mult': 1.7289599659446149, 'rsi_os': 18, 'rsi_ob': 91, 'vol_spike': 0.11532962870998865, 'adx_thresh': 14.043380969237726, 'atr_min_pct': 0.01800732373822381, 'atr_max_pct': 0.13718174796987964, 'tp_mult': 1.959940630490014, 'tsl_mult': 0.47321252997545254, 'strategy': 'mean_reversion', 'time_stop': 24, 'use_sma': False, 'use_atr': True, 'use_adx': True, 'use_ema': False, 'use_spike': True, 'rsi_required': True, 'edge_k': 1.7763561770968197, 'edge_cap': 0.5953811610502364, 'bull_strategy': 'mean_reversion', 'bull_bb_std_mult': 1.4188056519890109, 'bull_rsi_os': 52, 'bull_rsi_ob': 89, 'bull_adx_thresh': 22.931960339917975, 'bull_atr_min_pct': 0.015018890102223304, 'bull_atr_max_pct': 0.1364243556112788, 'bull_tp_mult': 1.1884886708206956, 'bull_tsl_mult': 0.23358095267269086, 'bull_time_stop': 228, 'bull_use_sma': False, 'bull_use_ema': True, 'bull_use_atr': True, 'bull_use_adx': True, 'bull_use_spike': False, 'bull_rsi_required': True, 'bear_strategy': 'mean_reversion', 'bear_bb_std_mult': 1.9689915655523882, 'bear_rsi_os': 15, 'bear_rsi_ob': 73, 'bear_adx_thresh': 24.533553528459528, 'bear_atr_min_pct': 0.020829543056979895, 'bear_atr_max_pct': 0.05424705812925058, 'bear_tp_mult': 2.5739878079058687, 'bear_tsl_mult': 0.6178551093463298, 'bear_time_stop': 100, 'bear_use_sma': True, 'bear_use_ema': False, 'bear_use_atr': False, 'bear_use_adx': False, 'bear_use_spike': False, 'bear_rsi_required': False, 'sideways_strategy': 'breakout', 'sideways_bb_std_mult': 1.8789132940715432, 'sideways_rsi_os': 27, 'sideways_rsi_ob': 90, 'sideways_adx_thresh': 16.75482426626205, 'sideways_atr_min_pct': 0.000873242824268404, 'sideways_atr_max_pct': 0.13851647804656506, 'sideways_tp_mult': 1.5341359885867616, 'sideways_tsl_mult': 0.45044603152341056, 'sideways_time_stop': 149, 'sideways_use_sma': True, 'sideways_use_ema': False, 'sideways_use_atr': False, 'sideways_use_adx': False, 'sideways_use_spike': False, 'sideways_rsi_required': True}.
[I 2025-08-30 16:47:41,199] Trial 531 finished with values: [-1000000000.0, 1000000000.0] and parameters: {'p_sma': 22, 'p_std': 60, 'p_atr': 26, 'p_adx': 25, 'rsi_period': 55, 'ema1': 7, 'ema2': 11, 'slip_atr_k': 0.0038771167336105142, 'slip_spread_k': 0.6499081284914027, 'spread_hl_frac': 0.027395731708049088, 'bb_std_mult': 2.95828519499521, 'rsi_os': 18, 'rsi_ob': 90, 'vol_spike': 0.2659775121405917, 'adx_thresh': 22.485220174221336, 'atr_min_pct': 0.0192531325949997, 'atr_max_pct': 0.1372272155761507, 'tp_mult': 2.674916219206773, 'tsl_mult': 0.47434608513674303, 'strategy': 'mean_reversion', 'time_stop': 225, 'use_sma': False, 'use_atr': True, 'use_adx': True, 'use_ema': False, 'use_spike': False, 'rsi_required': True, 'edge_k': 1.2090305678799405, 'edge_cap': 0.45604200574548037, 'bull_strategy': 'mean_reversion', 'bull_bb_std_mult': 0.5530013211908738, 'bull_rsi_os': 11, 'bull_rsi_ob': 68, 'bull_adx_thresh': 22.901952452599332, 'bull_atr_min_pct': 0.021564146316420594, 'bull_atr_max_pct': 0.09607068281551466, 'bull_tp_mult': 1.1777989049162843, 'bull_tsl_mult': 0.24718513623374538, 'bull_time_stop': 136, 'bull_use_sma': False, 'bull_use_ema': True, 'bull_use_atr': True, 'bull_use_adx': True, 'bull_use_spike': False, 'bull_rsi_required': True, 'bear_strategy': 'mean_reversion', 'bear_bb_std_mult': 1.9775131169781508, 'bear_rsi_os': 47, 'bear_rsi_ob': 50, 'bear_adx_thresh': 11.775845769390164, 'bear_atr_min_pct': 0.020900560393104436, 'bear_atr_max_pct': 0.051392532692469475, 'bear_tp_mult': 2.2245610386591053, 'bear_tsl_mult': 0.6511782307573108, 'bear_time_stop': 62, 'bear_use_sma': True, 'bear_use_ema': False, 'bear_use_atr': False, 'bear_use_adx': False, 'bear_use_spike': False, 'bear_rsi_required': False, 'sideways_strategy': 'breakout', 'sideways_bb_std_mult': 2.4395003447609884, 'sideways_rsi_os': 27, 'sideways_rsi_ob': 91, 'sideways_adx_thresh': 17.89925946840796, 'sideways_atr_min_pct': 0.002417136764718016, 'sideways_atr_max_pct': 0.13828196063786155, 'sideways_tp_mult': 2.4526576783853775, 'sideways_tsl_mult': 0.47654707654261164, 'sideways_time_stop': 74, 'sideways_use_sma': True, 'sideways_use_ema': False, 'sideways_use_atr': False, 'sideways_use_adx': False, 'sideways_use_spike': False, 'sideways_rsi_required': True}.
