[I 2025-08-30 16:04:55,678] Trial 279 finished with values: [-0.02539231453245061, 0.025275364737187892] and parameters: {'p_sma': 7, 'p_std': 59, 'p_atr': 15, 'p_adx': 25, 'rsi_period': 18, 'ema1': 27, 'ema2': 12, 'slip_atr_k': 0.00030706605523083633, 'slip_spread_k': 0.6110346258307647, 'spread_hl_frac': 0.022062132218508758, 'bb_std_mult': 3.2536877185316806, 'rsi_os': 34, 'rsi_ob': 92, 'vol_spike': 0.002259271455423476, 'adx_thresh': 12.99596689719487, 'atr_min_pct': 0.017814618302507024, 'atr_max_pct': 0.13142402666754682, 'tp_mult': 2.860152460427429, 'tsl_mult': 0.5184912206849239, 'strategy': 'mean_reversion', 'time_stop': 15, 'use_sma': True, 'use_atr': False, 'use_adx': True, 'use_ema': False, 'use_spike': False, 'rsi_required': True, 'edge_k': 1.5601199398871792, 'edge_cap': 0.8680566074994982, 'bull_strategy': 'mean_reversion', 'bull_bb_std_mult': 2.0314264848459676, 'bull_rsi_os': 10, 'bull_rsi_ob': 54, 'bull_adx_thresh': 21.490551800828133, 'bull_atr_min_pct': 0.020517419457200894, 'bull_atr_max_pct': 0.13736850277125207, 'bull_tp_mult': 1.2952619853269118, 'bull_tsl_mult': 0.27427906929654766, 'bull_time_stop': 57, 'bull_use_sma': False, 'bull_use_ema': True, 'bull_use_atr': True, 'bull_use_adx': True, 'bull_use_spike': False, 'bull_rsi_required': False, 'bear_strategy': 'mean_reversion', 'bear_bb_std_mult': 1.9079602057452303, 'bear_rsi_os': 7, 'bear_rsi_ob': 78, 'bear_adx_thresh': 14.90245341904526, 'bear_atr_min_pct': 0.02056005694413058, 'bear_atr_max_pct': 0.026235461299846094, 'bear_tp_mult': 2.124632490101604, 'bear_tsl_mult': 0.698973775623608, 'bear_time_stop': 228, 'bear_use_sma': True, 'bear_use_ema': False, 'bear_use_atr': False, 'bear_use_adx': False, 'bear_use_spike': False, 'bear_rsi_required': False, 'sideways_strategy': 'mean_reversion', 'sideways_bb_std_mult': 2.1041861655960594, 'sideways_rsi_os': 27, 'sideways_rsi_ob': 74, 'sideways_adx_thresh': 17.477321040334417, 'sideways_atr_min_pct': 6.240883578417528e-05, 'sideways_atr_max_pct': 0.1322763077787352, 'sideways_tp_mult': 1.5164997958549533, 'sideways_tsl_mult': 0.4764751010342115, 'sideways_time_stop': 204, 'sideways_use_sma': False, 'sideways_use_ema': False, 'sideways_use_atr': False, 'sideways_use_adx': False, 'sideways_use_spike': False, 'sideways_rsi_required': True}.
[I 2025-08-30 16:04:56,487] Trial 282 finished with values: [-0.009723929606924475, 0.009697847967385317] and parameters: {'p_sma': 6, 'p_std': 57, 'p_atr': 27, 'p_adx': 24, 'rsi_period': 20, 'ema1': 27, 'ema2': 11, 'slip_atr_k': 0.001747201253795942, 'slip_spread_k': 0.4391788585955769, 'spread_hl_frac': 0.018182899655233526, 'bb_std_mult': 3.2866602856865477, 'rsi_os': 34, 'rsi_ob': 91, 'vol_spike': 0.002626456834783821, 'adx_thresh': 13.007094352160054, 'atr_min_pct': 0.01806238312312099, 'atr_max_pct': 0.13214469414966848, 'tp_mult': 2.882166001398693, 'tsl_mult': 0.4749453939257706, 'strategy': 'mean_reversion', 'time_stop': 12, 'use_sma': True, 'use_atr': False, 'use_adx': True, 'use_ema': False, 'use_spike': False, 'rsi_required': True, 'edge_k': 1.574789557422818, 'edge_cap': 0.20130730174700145, 'bull_strategy': 'mean_reversion', 'bull_bb_std_mult': 1.985671949340595, 'bull_rsi_os': 45, 'bull_rsi_ob': 50, 'bull_adx_thresh': 20.876326897729776, 'bull_atr_min_pct': 0.019498944100298517, 'bull_atr_max_pct': 0.1361802204702337, 'bull_tp_mult': 1.2763889693527166, 'bull_tsl_mult': 0.27648559263152916, 'bull_time_stop': 56, 'bull_use_sma': False, 'bull_use_ema': True, 'bull_use_atr': True, 'bull_use_adx': True, 'bull_use_spike': False, 'bull_rsi_required': False, 'bear_strategy': 'mean_reversion', 'bear_bb_std_mult': 1.940476544938202, 'bear_rsi_os': 13, 'bear_rsi_ob': 78, 'bear_adx_thresh': 14.368536371520536, 'bear_atr_min_pct': 0.021631567522773266, 'bear_atr_max_pct': 0.034211718618696, 'bear_tp_mult': 2.1518448845454676, 'bear_tsl_mult': 0.6485180288616946, 'bear_time_stop': 224, 'bear_use_sma': True, 'bear_use_ema': True, 'bear_use_atr': False, 'bear_use_adx': False, 'bear_use_spike': False, 'bear_rsi_required': False, 'sideways_strategy': 'breakout', 'sideways_bb_std_mult': 2.026684693654769, 'sideways_rsi_os': 26, 'sideways_rsi_ob': 91, 'sideways_adx_thresh': 17.711356906097933, 'sideways_atr_min_pct': 0.0006984953504170806, 'sideways_atr_max_pct': 0.1363656046803884, 'sideways_tp_mult': 1.5171693865509879, 'sideways_tsl_mult': 0.433313002640599, 'sideways_time_stop': 207, 'sideways_use_sma': False, 'sideways_use_ema': False, 'sideways_use_atr': False, 'sideways_use_adx': False, 'sideways_use_spike': False, 'sideways_rsi_required': True}.
[I 2025-08-30 16:04:56,493] Trial 281 finished with values: [-0.01673770187156587, 0.01671157035427224] and parameters: {'p_sma': 6, 'p_std': 59, 'p_atr': 27, 'p_adx': 23, 'rsi_period': 16, 'ema1': 27, 'ema2': 11, 'slip_atr_k': 0.002919266713884788, 'slip_spread_k': 0.5935886050313421, 'spread_hl_frac': 0.01725989634098899, 'bb_std_mult': 3.222529877447284, 'rsi_os': 34, 'rsi_ob': 91, 'vol_spike': 0.00027519577688696724, 'adx_thresh': 13.568829984988543, 'atr_min_pct': 0.0177450339277233, 'atr_max_pct': 0.13210453316554827, 'tp_mult': 2.9462917078435074, 'tsl_mult': 0.5280615086494278, 'strategy': 'mean_reversion', 'time_stop': 11, 'use_sma': True, 'use_atr': False, 'use_adx': True, 'use_ema': False, 'use_spike': False, 'rsi_required': True, 'edge_k': 1.5824016133269827, 'edge_cap': 0.6219520262457301, 'bull_strategy': 'mean_reversion', 'bull_bb_std_mult': 1.9912035362783367, 'bull_rsi_os': 10, 'bull_rsi_ob': 50, 'bull_adx_thresh': 20.54883328869596, 'bull_atr_min_pct': 0.019551711543071615, 'bull_atr_max_pct': 0.13569613915934894, 'bull_tp_mult': 1.2779493093854808, 'bull_tsl_mult': 0.2777900000441703, 'bull_time_stop': 65, 'bull_use_sma': False, 'bull_use_ema': True, 'bull_use_atr': True, 'bull_use_adx': True, 'bull_use_spike': False, 'bull_rsi_required': False, 'bear_strategy': 'mean_reversion', 'bear_bb_std_mult': 1.9198134473088762, 'bear_rsi_os': 12, 'bear_rsi_ob': 64, 'bear_adx_thresh': 14.776743596195042, 'bear_atr_min_pct': 0.021489691588885355, 'bear_atr_max_pct': 0.09195717540292374, 'bear_tp_mult': 2.1523793638689805, 'bear_tsl_mult': 0.6542539027825279, 'bear_time_stop': 206, 'bear_use_sma': True, 'bear_use_ema': False, 'bear_use_atr': False, 'bear_use_adx': False, 'bear_use_spike': False, 'bear_rsi_required': False, 'sideways_strategy': 'breakout', 'sideways_bb_std_mult': 2.050289305950339, 'sideways_rsi_os': 26, 'sideways_rsi_ob': 74, 'sideways_adx_thresh': 17.056680917712576, 'sideways_atr_min_pct': 0.0007146305671735696, 'sideways_atr_max_pct': 0.13952497016896034, 'sideways_tp_mult': 1.518680307854095, 'sideways_tsl_mult': 0.4407183880524787, 'sideways_time_stop': 204, 'sideways_use_sma': False, 'sideways_use_ema': False, 'sideways_use_atr': False, 'sideways_use_adx': False, 'sideways_use_spike': False, 'sideways_rsi_required': True}.
[I 2025-08-30 16:04:56,789] Trial 280 finished with values: [-0.015241681336335522, 0.015164870086985376] and parameters: {'p_sma': 6, 'p_std': 59, 'p_atr': 27, 'p_adx': 23, 'rsi_period': 16, 'ema1': 27, 'ema2': 11, 'slip_atr_k': 0.003543058397208725, 'slip_spread_k': 0.4459129829522266, 'spread_hl_frac': 0.014488190854452966, 'bb_std_mult': 3.252213599194366, 'rsi_os': 34, 'rsi_ob': 90, 'vol_spike': 0.0016644377433892542, 'adx_thresh': 11.076935157224442, 'atr_min_pct': 0.01765768670278777, 'atr_max_pct': 0.13206943225013773, 'tp_mult': 2.917621949298334, 'tsl_mult': 0.4738917753880663, 'strategy': 'mean_reversion', 'time_stop': 12, 'use_sma': True, 'use_atr': False, 'use_adx': True, 'use_ema': False, 'use_spike': False, 'rsi_required': True, 'edge_k': 1.5667720489628523, 'edge_cap': 0.24991193504721976, 'bull_strategy': 'mean_reversion', 'bull_bb_std_mult': 1.949423604160897, 'bull_rsi_os': 13, 'bull_rsi_ob': 52, 'bull_adx_thresh': 20.607847222511605, 'bull_atr_min_pct': 0.01944056936477638, 'bull_atr_max_pct': 0.13671687811056307, 'bull_tp_mult': 1.2277757668210731, 'bull_tsl_mult': 0.265909585525808, 'bull_time_stop': 67, 'bull_use_sma': False, 'bull_use_ema': True, 'bull_use_atr': True, 'bull_use_adx': True, 'bull_use_spike': False, 'bull_rsi_required': False, 'bear_strategy': 'mean_reversion', 'bear_bb_std_mult': 1.9186861459734228, 'bear_rsi_os': 6, 'bear_rsi_ob': 78, 'bear_adx_thresh': 14.708731894278172, 'bear_atr_min_pct': 0.021219565321280654, 'bear_atr_max_pct': 0.09219172063239472, 'bear_tp_mult': 2.13640002986145, 'bear_tsl_mult': 0.7063403213750976, 'bear_time_stop': 223, 'bear_use_sma': True, 'bear_use_ema': False, 'bear_use_atr': False, 'bear_use_adx': False, 'bear_use_spike': False, 'bear_rsi_required': False, 'sideways_strategy': 'breakout', 'sideways_bb_std_mult': 2.030637973171269, 'sideways_rsi_os': 26, 'sideways_rsi_ob': 92, 'sideways_adx_thresh': 17.58791114183842, 'sideways_atr_min_pct': 0.0007981889142045822, 'sideways_atr_max_pct': 0.1349097342377662, 'sideways_tp_mult': 1.4743554251578956, 'sideways_tsl_mult': 0.509646924524623, 'sideways_time_stop': 206, 'sideways_use_sma': False, 'sideways_use_ema': False, 'sideways_use_atr': False, 'sideways_use_adx': False, 'sideways_use_spike': False, 'sideways_rsi_required': True}.
[I 2025-08-30 16:05:42,611] Trial 283 finished with values: [-0.009128251505368778, 0.009082218961746122] and parameters: {'p_sma': 6, 'p_std': 26, 'p_atr': 23, 'p_adx': 24, 'rsi_period': 20, 'ema1': 26, 'ema2': 11, 'slip_atr_k': 0.0011999176737263664, 'slip_spread_k': 0.342545628869906, 'spread_hl_frac': 0.018173336243197356, 'bb_std_mult': 3.2775848037019095, 'rsi_os': 34, 'rsi_ob': 90, 'vol_spike': 0.0002091227388877927, 'adx_thresh': 13.586200552256289, 'atr_min_pct': 0.019251174021654476, 'atr_max_pct': 0.13148293652747922, 'tp_mult': 2.8868720612450747, 'tsl_mult': 0.5466206054993821, 'strategy': 'mean_reversion', 'time_stop': 10, 'use_sma': False, 'use_atr': False, 'use_adx': True, 'use_ema': False, 'use_spike': False, 'rsi_required': True, 'edge_k': 1.6108718528610682, 'edge_cap': 0.6246467314849588, 'bull_strategy': 'mean_reversion', 'bull_bb_std_mult': 1.960993273022247, 'bull_rsi_os': 13, 'bull_rsi_ob': 50, 'bull_adx_thresh': 20.54586969963371, 'bull_atr_min_pct': 0.01963614536128563, 'bull_atr_max_pct': 0.14476206562261773, 'bull_tp_mult': 1.2561594034150951, 'bull_tsl_mult': 0.28503437833025613, 'bull_time_stop': 57, 'bull_use_sma': False, 'bull_use_ema': False, 'bull_use_atr': True, 'bull_use_adx': True, 'bull_use_spike': False, 'bull_rsi_required': False, 'bear_strategy': 'mean_reversion', 'bear_bb_std_mult': 1.9809468579933154, 'bear_rsi_os': 12, 'bear_rsi_ob': 78, 'bear_adx_thresh': 14.592225138862783, 'bear_atr_min_pct': 0.021639557015853822, 'bear_atr_max_pct': 0.1157724851982147, 'bear_tp_mult': 2.1814444858516406, 'bear_tsl_mult': 0.6540586805619649, 'bear_time_stop': 215, 'bear_use_sma': True, 'bear_use_ema': True, 'bear_use_atr': False, 'bear_use_adx': False, 'bear_use_spike': False, 'bear_rsi_required': False, 'sideways_strategy': 'breakout', 'sideways_bb_std_mult': 1.9927613036104324, 'sideways_rsi_os': 26, 'sideways_rsi_ob': 47, 'sideways_adx_thresh': 17.851922529228062, 'sideways_atr_min_pct': 0.0007631433318752985, 'sideways_atr_max_pct': 0.1343784277898703, 'sideways_tp_mult': 1.632783158681334, 'sideways_tsl_mult': 0.5122604906126355, 'sideways_time_stop': 206, 'sideways_use_sma': True, 'sideways_use_ema': False, 'sideways_use_atr': False, 'sideways_use_adx': False, 'sideways_use_spike': False, 'sideways_rsi_required': True}.
[I 2025-08-30 16:05:43,469] Trial 285 finished with values: [-0.018846328709957394, 0.01882020774763641] and parameters: {'p_sma': 10, 'p_std': 58, 'p_atr': 27, 'p_adx': 24, 'rsi_period': 20, 'ema1': 26, 'ema2': 11, 'slip_atr_k': 0.0028302547328279766, 'slip_spread_k': 0.596003848648694, 'spread_hl_frac': 0.01813897625633437, 'bb_std_mult': 3.2900499161826886, 'rsi_os': 34, 'rsi_ob': 89, 'vol_spike': 0.0009306194663948693, 'adx_thresh': 13.394117730582074, 'atr_min_pct': 0.01817248780827443, 'atr_max_pct': 0.13476989635560807, 'tp_mult': 2.8966257171149765, 'tsl_mult': 0.5353101151365398, 'strategy': 'mean_reversion', 'time_stop': 70, 'use_sma': True, 'use_atr': False, 'use_adx': True, 'use_ema': False, 'use_spike': False, 'rsi_required': True, 'edge_k': 1.6111871947675043, 'edge_cap': 0.6240181147362308, 'bull_strategy': 'mean_reversion', 'bull_bb_std_mult': 1.9598122453202287, 'bull_rsi_os': 13, 'bull_rsi_ob': 51, 'bull_adx_thresh': 20.58327695613345, 'bull_atr_min_pct': 0.01957437020336156, 'bull_atr_max_pct': 0.1366260462511949, 'bull_tp_mult': 1.2304089537255802, 'bull_tsl_mult': 0.28902090715982937, 'bull_time_stop': 59, 'bull_use_sma': False, 'bull_use_ema': False, 'bull_use_atr': True, 'bull_use_adx': True, 'bull_use_spike': True, 'bull_rsi_required': False, 'bear_strategy': 'mean_reversion', 'bear_bb_std_mult': 1.9673122972146877, 'bear_rsi_os': 12, 'bear_rsi_ob': 78, 'bear_adx_thresh': 14.535537427153116, 'bear_atr_min_pct': 0.021544570640743672, 'bear_atr_max_pct': 0.05783853541730614, 'bear_tp_mult': 2.1686099653222155, 'bear_tsl_mult': 0.6521203125867462, 'bear_time_stop': 212, 'bear_use_sma': True, 'bear_use_ema': True, 'bear_use_atr': False, 'bear_use_adx': True, 'bear_use_spike': False, 'bear_rsi_required': True, 'sideways_strategy': 'breakout', 'sideways_bb_std_mult': 2.0154583840096474, 'sideways_rsi_os': 26, 'sideways_rsi_ob': 84, 'sideways_adx_thresh': 17.584770166585926, 'sideways_atr_min_pct': 0.000704759878378038, 'sideways_atr_max_pct': 0.13457981204272268, 'sideways_tp_mult': 1.3930413547827738, 'sideways_tsl_mult': 0.5226317828549015, 'sideways_time_stop': 195, 'sideways_use_sma': True, 'sideways_use_ema': False, 'sideways_use_atr': True, 'sideways_use_adx': False, 'sideways_use_spike': True, 'sideways_rsi_required': True}.
[I 2025-08-30 16:05:44,858] Trial 284 finished with values: [-0.010563072278101382, 0.010536672139149097] and parameters: {'p_sma': 6, 'p_std': 57, 'p_atr': 27, 'p_adx': 24, 'rsi_period': 19, 'ema1': 26, 'ema2': 11, 'slip_atr_k': 0.004001944345518116, 'slip_spread_k': 0.5993254527938957, 'spread_hl_frac': 0.01838898613758847, 'bb_std_mult': 3.2614255927646947, 'rsi_os': 34, 'rsi_ob': 90, 'vol_spike': 0.0008188554722178636, 'adx_thresh': 13.684194612993645, 'atr_min_pct': 0.01894128431269526, 'atr_max_pct': 0.13415361724849229, 'tp_mult': 2.900030765199396, 'tsl_mult': 0.47799910132124185, 'strategy': 'mean_reversion', 'time_stop': 11, 'use_sma': True, 'use_atr': False, 'use_adx': True, 'use_ema': False, 'use_spike': False, 'rsi_required': True, 'edge_k': 1.6002725366572097, 'edge_cap': 0.6236379208878318, 'bull_strategy': 'mean_reversion', 'bull_bb_std_mult': 1.9278253421928746, 'bull_rsi_os': 43, 'bull_rsi_ob': 50, 'bull_adx_thresh': 20.766787900637823, 'bull_atr_min_pct': 0.019578018701302942, 'bull_atr_max_pct': 0.1361140933437542, 'bull_tp_mult': 1.2191415031747947, 'bull_tsl_mult': 0.2871835255689125, 'bull_time_stop': 270, 'bull_use_sma': False, 'bull_use_ema': False, 'bull_use_atr': True, 'bull_use_adx': True, 'bull_use_spike': True, 'bull_rsi_required': False, 'bear_strategy': 'mean_reversion', 'bear_bb_std_mult': 1.9741221879614306, 'bear_rsi_os': 12, 'bear_rsi_ob': 78, 'bear_adx_thresh': 14.492974391228646, 'bear_atr_min_pct': 0.021678827310870973, 'bear_atr_max_pct': 0.09927877694328117, 'bear_tp_mult': 2.170248942736395, 'bear_tsl_mult': 0.6514348161179873, 'bear_time_stop': 216, 'bear_use_sma': True, 'bear_use_ema': True, 'bear_use_atr': False, 'bear_use_adx': True, 'bear_use_spike': False, 'bear_rsi_required': True, 'sideways_strategy': 'breakout', 'sideways_bb_std_mult': 2.024972762115483, 'sideways_rsi_os': 26, 'sideways_rsi_ob': 47, 'sideways_adx_thresh': 17.610022148922646, 'sideways_atr_min_pct': 0.0006876570981714223, 'sideways_atr_max_pct': 0.13483722145116694, 'sideways_tp_mult': 1.459666258454949, 'sideways_tsl_mult': 0.5064695336503968, 'sideways_time_stop': 208, 'sideways_use_sma': True, 'sideways_use_ema': False, 'sideways_use_atr': True, 'sideways_use_adx': False, 'sideways_use_spike': True, 'sideways_rsi_required': True}.
[I 2025-08-30 16:05:45,267] Trial 286 finished with values: [-0.021522821370542955, 0.021446455999925125] and parameters: {'p_sma': 10, 'p_std': 57, 'p_atr': 23, 'p_adx': 23, 'rsi_period': 20, 'ema1': 27, 'ema2': 10, 'slip_atr_k': 0.0035791219683283847, 'slip_spread_k': 0.5820540451000087, 'spread_hl_frac': 0.017841655293321938, 'bb_std_mult': 3.2729520707330377, 'rsi_os': 34, 'rsi_ob': 90, 'vol_spike': 0.00015795641436477936, 'adx_thresh': 14.194755459996353, 'atr_min_pct': 0.019143512409431605, 'atr_max_pct': 0.13386808870420688, 'tp_mult': 2.96034400578274, 'tsl_mult': 0.5402696510475141, 'strategy': 'mean_reversion', 'time_stop': 11, 'use_sma': False, 'use_atr': True, 'use_adx': True, 'use_ema': False, 'use_spike': False, 'rsi_required': True, 'edge_k': 1.5953934681111084, 'edge_cap': 0.6284360988450407, 'bull_strategy': 'mean_reversion', 'bull_bb_std_mult': 1.974897561845668, 'bull_rsi_os': 13, 'bull_rsi_ob': 50, 'bull_adx_thresh': 20.790072726418003, 'bull_atr_min_pct': 0.019784019728079853, 'bull_atr_max_pct': 0.13624257146291244, 'bull_tp_mult': 1.188862963470726, 'bull_tsl_mult': 0.2617372657187407, 'bull_time_stop': 65, 'bull_use_sma': False, 'bull_use_ema': False, 'bull_use_atr': True, 'bull_use_adx': True, 'bull_use_spike': True, 'bull_rsi_required': False, 'bear_strategy': 'mean_reversion', 'bear_bb_std_mult': 1.9932228599035648, 'bear_rsi_os': 12, 'bear_rsi_ob': 78, 'bear_adx_thresh': 14.688208779497748, 'bear_atr_min_pct': 0.02169579270022881, 'bear_atr_max_pct': 0.03565799581839604, 'bear_tp_mult': 2.149565252932601, 'bear_tsl_mult': 0.6490688633813861, 'bear_time_stop': 214, 'bear_use_sma': True, 'bear_use_ema': True, 'bear_use_atr': False, 'bear_use_adx': True, 'bear_use_spike': False, 'bear_rsi_required': True, 'sideways_strategy': 'breakout', 'sideways_bb_std_mult': 2.0074348130633655, 'sideways_rsi_os': 27, 'sideways_rsi_ob': 91, 'sideways_adx_thresh': 17.83602571333327, 'sideways_atr_min_pct': 0.0008478343690899199, 'sideways_atr_max_pct': 0.1346232782799316, 'sideways_tp_mult': 1.4719736342992384, 'sideways_tsl_mult': 0.44348028181852617, 'sideways_time_stop': 193, 'sideways_use_sma': True, 'sideways_use_ema': False, 'sideways_use_atr': True, 'sideways_use_adx': False, 'sideways_use_spike': True, 'sideways_rsi_required': True}.
[I 2025-08-30 16:06:28,696] Trial 289 finished with values: [-1000000000.0, 1000000000.0] and parameters: {'p_sma': 5, 'p_std': 26, 'p_atr': 24, 'p_adx': 24, 'rsi_period': 16, 'ema1': 18, 'ema2': 11, 'slip_atr_k': 0.005634883928867823, 'slip_spread_k': 0.6316058344670232, 'spread_hl_frac': 0.01593989410581356, 'bb_std_mult': 3.4055751755949912, 'rsi_os': 35, 'rsi_ob': 87, 'vol_spike': 0.0072732301721325715, 'adx_thresh': 12.37731110796204, 'atr_min_pct': 0.019064003074361294, 'atr_max_pct': 0.13511830290945473, 'tp_mult': 2.735869881385274, 'tsl_mult': 0.47228185949688034, 'strategy': 'mean_reversion', 'time_stop': 5, 'use_sma': False, 'use_atr': True, 'use_adx': True, 'use_ema': False, 'use_spike': False, 'rsi_required': True, 'edge_k': 1.50014093773598, 'edge_cap': 0.6045308532900721, 'bull_strategy': 'mean_reversion', 'bull_bb_std_mult': 1.9234669735372372, 'bull_rsi_os': 52, 'bull_rsi_ob': 48, 'bull_adx_thresh': 22.60361136511502, 'bull_atr_min_pct': 0.021204919736554625, 'bull_atr_max_pct': 0.14138461629669488, 'bull_tp_mult': 1.326248382690741, 'bull_tsl_mult': 0.2940373271943337, 'bull_time_stop': 68, 'bull_use_sma': False, 'bull_use_ema': True, 'bull_use_atr': True, 'bull_use_adx': True, 'bull_use_spike': False, 'bull_rsi_required': False, 'bear_strategy': 'mean_reversion', 'bear_bb_std_mult': 1.8100038931522544, 'bear_rsi_os': 13, 'bear_rsi_ob': 77, 'bear_adx_thresh': 13.755274717559818, 'bear_atr_min_pct': 0.022287994568924444, 'bear_atr_max_pct': 0.01346377220237975, 'bear_tp_mult': 2.2002532481658728, 'bear_tsl_mult': 0.6339919636350421, 'bear_time_stop': 235, 'bear_use_sma': True, 'bear_use_ema': True, 'bear_use_atr': False, 'bear_use_adx': False, 'bear_use_spike': False, 'bear_rsi_required': False, 'sideways_strategy': 'breakout', 'sideways_bb_std_mult': 2.1312803741926234, 'sideways_rsi_os': 28, 'sideways_rsi_ob': 90, 'sideways_adx_thresh': 16.76221583501477, 'sideways_atr_min_pct': 0.013007042337918846, 'sideways_atr_max_pct': 0.14096946799265403, 'sideways_tp_mult': 1.425416816330376, 'sideways_tsl_mult': 0.48852848719234365, 'sideways_time_stop': 211, 'sideways_use_sma': True, 'sideways_use_ema': False, 'sideways_use_atr': False, 'sideways_use_adx': False, 'sideways_use_spike': False, 'sideways_rsi_required': True}.
