[I 2025-08-30 16:49:32,283] Trial 538 finished with values: [-1000000000.0, 1000000000.0] and parameters: {'p_sma': 47, 'p_std': 43, 'p_atr': 18, 'p_adx': 24, 'rsi_period': 36, 'ema1': 17, 'ema2': 55, 'slip_atr_k': 0.012565429456291199, 'slip_spread_k': 0.5652837073363309, 'spread_hl_frac': 0.015075967068952222, 'bb_std_mult': 2.2692328551057366, 'rsi_os': 28, 'rsi_ob': 88, 'vol_spike': 0.01836182499515948, 'adx_thresh': 30.033077242376656, 'atr_min_pct': 0.019793076654062308, 'atr_max_pct': 0.13113093321954905, 'tp_mult': 2.0480081956317937, 'tsl_mult': 0.49812326545919705, 'strategy': 'breakout', 'time_stop': 5, 'use_sma': True, 'use_atr': False, 'use_adx': False, 'use_ema': False, 'use_spike': False, 'rsi_required': False, 'edge_k': 1.645483062284461, 'edge_cap': 0.611367419082955, 'bull_strategy': 'breakout', 'bull_bb_std_mult': 1.8357417652316605, 'bull_rsi_os': 10, 'bull_rsi_ob': 54, 'bull_adx_thresh': 19.670737640313302, 'bull_atr_min_pct': 0.02083808955619818, 'bull_atr_max_pct': 0.13645480170247673, 'bull_tp_mult': 1.2817885891662995, 'bull_tsl_mult': 0.2692129918335416, 'bull_time_stop': 58, 'bull_use_sma': False, 'bull_use_ema': False, 'bull_use_atr': True, 'bull_use_adx': False, 'bull_use_spike': True, 'bull_rsi_required': False, 'bear_strategy': 'mean_reversion', 'bear_bb_std_mult': 3.0303855554422654, 'bear_rsi_os': 14, 'bear_rsi_ob': 57, 'bear_adx_thresh': 6.337079219240387, 'bear_atr_min_pct': 0.021433226059665224, 'bear_atr_max_pct': 0.09152880309524163, 'bear_tp_mult': 2.3050386162251613, 'bear_tsl_mult': 0.35496059176072536, 'bear_time_stop': 214, 'bear_use_sma': False, 'bear_use_ema': False, 'bear_use_atr': False, 'bear_use_adx': True, 'bear_use_spike': True, 'bear_rsi_required': True, 'sideways_strategy': 'mean_reversion', 'sideways_bb_std_mult': 1.1868218272096882, 'sideways_rsi_os': 55, 'sideways_rsi_ob': 76, 'sideways_adx_thresh': 15.602078982173166, 'sideways_atr_min_pct': 0.0015925496434119131, 'sideways_atr_max_pct': 0.011352938175791916, 'sideways_tp_mult': 1.7978274879268896, 'sideways_tsl_mult': 0.1312519232153071, 'sideways_time_stop': 287, 'sideways_use_sma': False, 'sideways_use_ema': False, 'sideways_use_atr': True, 'sideways_use_adx': True, 'sideways_use_spike': True, 'sideways_rsi_required': False}.
[I 2025-08-30 16:49:32,558] Trial 539 finished with values: [-0.14139854497125592, 0.14137275579323078] and parameters: {'p_sma': 47, 'p_std': 57, 'p_atr': 22, 'p_adx': 11, 'rsi_period': 11, 'ema1': 27, 'ema2': 10, 'slip_atr_k': 0.10609699076379445, 'slip_spread_k': 0.26982207021200466, 'spread_hl_frac': 0.03442808985569912, 'bb_std_mult': 3.0418762578808427, 'rsi_os': 28, 'rsi_ob': 88, 'vol_spike': 0.018205298377832413, 'adx_thresh': 28.74900147076417, 'atr_min_pct': 0.007076489308125433, 'atr_max_pct': 0.0477926760459211, 'tp_mult': 2.765088114898598, 'tsl_mult': 0.5058179775908692, 'strategy': 'breakout', 'time_stop': 122, 'use_sma': False, 'use_atr': True, 'use_adx': False, 'use_ema': False, 'use_spike': False, 'rsi_required': True, 'edge_k': 1.6410104064265447, 'edge_cap': 0.519759337442105, 'bull_strategy': 'breakout', 'bull_bb_std_mult': 2.735098811146845, 'bull_rsi_os': 12, 'bull_rsi_ob': 94, 'bull_adx_thresh': 13.089876324947955, 'bull_atr_min_pct': 0.020933258978726575, 'bull_atr_max_pct': 0.09150809749320439, 'bull_tp_mult': 1.2765707868095904, 'bull_tsl_mult': 0.26308297098023653, 'bull_time_stop': 128, 'bull_use_sma': False, 'bull_use_ema': False, 'bull_use_atr': True, 'bull_use_adx': False, 'bull_use_spike': True, 'bull_rsi_required': False, 'bear_strategy': 'mean_reversion', 'bear_bb_std_mult': 1.112823596351987, 'bear_rsi_os': 14, 'bear_rsi_ob': 57, 'bear_adx_thresh': 15.02545150477862, 'bear_atr_min_pct': 0.026317320117910478, 'bear_atr_max_pct': 0.08921704826810915, 'bear_tp_mult': 2.277656911289339, 'bear_tsl_mult': 0.3592446429057108, 'bear_time_stop': 214, 'bear_use_sma': False, 'bear_use_ema': False, 'bear_use_atr': False, 'bear_use_adx': False, 'bear_use_spike': False, 'bear_rsi_required': False, 'sideways_strategy': 'breakout', 'sideways_bb_std_mult': 3.401821875021035, 'sideways_rsi_os': 25, 'sideways_rsi_ob': 56, 'sideways_adx_thresh': 14.351958677158938, 'sideways_atr_min_pct': 0.00030649041327257564, 'sideways_atr_max_pct': 0.05646739337344692, 'sideways_tp_mult': 1.087748168631153, 'sideways_tsl_mult': 0.4926423437644952, 'sideways_time_stop': 227, 'sideways_use_sma': False, 'sideways_use_ema': False, 'sideways_use_atr': True, 'sideways_use_adx': True, 'sideways_use_spike': False, 'sideways_rsi_required': False}.
[I 2025-08-30 16:50:22,073] Trial 545 finished with values: [-1000000000.0, 1000000000.0] and parameters: {'p_sma': 5, 'p_std': 59, 'p_atr': 24, 'p_adx': 26, 'rsi_period': 18, 'ema1': 24, 'ema2': 23, 'slip_atr_k': 0.1798592296888797, 'slip_spread_k': 0.6981843087390578, 'spread_hl_frac': 0.017342978924490157, 'bb_std_mult': 3.3898389836518232, 'rsi_os': 33, 'rsi_ob': 84, 'vol_spike': 0.0636240378830898, 'adx_thresh': 6.6328250600933885, 'atr_min_pct': 0.004193321189187067, 'atr_max_pct': 0.13956381787524344, 'tp_mult': 2.881876423196548, 'tsl_mult': 0.11487948993105518, 'strategy': 'mean_reversion', 'time_stop': 19, 'use_sma': False, 'use_atr': True, 'use_adx': True, 'use_ema': False, 'use_spike': True, 'rsi_required': True, 'edge_k': 1.4907844847065668, 'edge_cap': 0.705546749761815, 'bull_strategy': 'mean_reversion', 'bull_bb_std_mult': 1.8767404760681905, 'bull_rsi_os': 13, 'bull_rsi_ob': 50, 'bull_adx_thresh': 23.919838552085253, 'bull_atr_min_pct': 0.017053929133820082, 'bull_atr_max_pct': 0.06633904611181404, 'bull_tp_mult': 2.1203045027719867, 'bull_tsl_mult': 0.3091534359835488, 'bull_time_stop': 69, 'bull_use_sma': False, 'bull_use_ema': True, 'bull_use_atr': True, 'bull_use_adx': True, 'bull_use_spike': False, 'bull_rsi_required': False, 'bear_strategy': 'mean_reversion', 'bear_bb_std_mult': 2.0603380023137605, 'bear_rsi_os': 11, 'bear_rsi_ob': 77, 'bear_adx_thresh': 27.78563027331594, 'bear_atr_min_pct': 0.020261710202642762, 'bear_atr_max_pct': 0.08045035540113471, 'bear_tp_mult': 2.1835540622134184, 'bear_tsl_mult': 0.29946131447246305, 'bear_time_stop': 124, 'bear_use_sma': True, 'bear_use_ema': False, 'bear_use_atr': False, 'bear_use_adx': False, 'bear_use_spike': False, 'bear_rsi_required': False, 'sideways_strategy': 'breakout', 'sideways_bb_std_mult': 1.9688338567905541, 'sideways_rsi_os': 9, 'sideways_rsi_ob': 65, 'sideways_adx_thresh': 17.063773244451532, 'sideways_atr_min_pct': 0.0018553684369092016, 'sideways_atr_max_pct': 0.06295320881001162, 'sideways_tp_mult': 1.4322334333796318, 'sideways_tsl_mult': 0.45732079903199646, 'sideways_time_stop': 198, 'sideways_use_sma': True, 'sideways_use_ema': False, 'sideways_use_atr': False, 'sideways_use_adx': False, 'sideways_use_spike': False, 'sideways_rsi_required': True}.
[I 2025-08-30 16:50:22,762] Trial 542 finished with values: [-1000000000.0, 1000000000.0] and parameters: {'p_sma': 58, 'p_std': 58, 'p_atr': 22, 'p_adx': 21, 'rsi_period': 36, 'ema1': 27, 'ema2': 55, 'slip_atr_k': 0.10734691510962607, 'slip_spread_k': 0.698854549257305, 'spread_hl_frac': 0.013335745556216576, 'bb_std_mult': 3.055877533737219, 'rsi_os': 33, 'rsi_ob': 89, 'vol_spike': 0.006404869137121884, 'adx_thresh': 11.513367109823129, 'atr_min_pct': 0.020992300263736628, 'atr_max_pct': 0.11048399004222206, 'tp_mult': 2.5005450225485153, 'tsl_mult': 0.40903300282601224, 'strategy': 'breakout', 'time_stop': 121, 'use_sma': False, 'use_atr': True, 'use_adx': False, 'use_ema': False, 'use_spike': False, 'rsi_required': True, 'edge_k': 0.5410999860545557, 'edge_cap': 0.953329902433462, 'bull_strategy': 'mean_reversion', 'bull_bb_std_mult': 2.4030854116738802, 'bull_rsi_os': 6, 'bull_rsi_ob': 50, 'bull_adx_thresh': 13.158884216453018, 'bull_atr_min_pct': 0.02271387702340393, 'bull_atr_max_pct': 0.06649204356045318, 'bull_tp_mult': 1.4567248610647927, 'bull_tsl_mult': 0.30052621905277926, 'bull_time_stop': 113, 'bull_use_sma': False, 'bull_use_ema': True, 'bull_use_atr': True, 'bull_use_adx': False, 'bull_use_spike': False, 'bull_rsi_required': False, 'bear_strategy': 'mean_reversion', 'bear_bb_std_mult': 2.05936668192521, 'bear_rsi_os': 44, 'bear_rsi_ob': 74, 'bear_adx_thresh': 15.065883364551375, 'bear_atr_min_pct': 0.006038876120438168, 'bear_atr_max_pct': 0.08889166136799494, 'bear_tp_mult': 1.1530616725989074, 'bear_tsl_mult': 0.6428777988429569, 'bear_time_stop': 74, 'bear_use_sma': True, 'bear_use_ema': False, 'bear_use_atr': False, 'bear_use_adx': False, 'bear_use_spike': False, 'bear_rsi_required': False, 'sideways_strategy': 'breakout', 'sideways_bb_std_mult': 2.059383263551243, 'sideways_rsi_os': 25, 'sideways_rsi_ob': 95, 'sideways_adx_thresh': 11.825191324780198, 'sideways_atr_min_pct': 0.004980175893346346, 'sideways_atr_max_pct': 0.10839587389515369, 'sideways_tp_mult': 1.8216808374651396, 'sideways_tsl_mult': 0.9875275710329614, 'sideways_time_stop': 213, 'sideways_use_sma': True, 'sideways_use_ema': False, 'sideways_use_atr': False, 'sideways_use_adx': False, 'sideways_use_spike': False, 'sideways_rsi_required': True}.
[I 2025-08-30 16:50:23,407] Trial 544 finished with values: [-1000000000.0, 1000000000.0] and parameters: {'p_sma': 59, 'p_std': 10, 'p_atr': 22, 'p_adx': 21, 'rsi_period': 60, 'ema1': 24, 'ema2': 13, 'slip_atr_k': 0.03720240671491247, 'slip_spread_k': 0.5846360146609059, 'spread_hl_frac': 0.02871326843685566, 'bb_std_mult': 1.245683938616116, 'rsi_os': 33, 'rsi_ob': 90, 'vol_spike': 0.237194982611059, 'adx_thresh': 12.937045075935586, 'atr_min_pct': 0.0209662279318552, 'atr_max_pct': 0.14023267047932542, 'tp_mult': 2.8508323302638203, 'tsl_mult': 0.54910581612921, 'strategy': 'mean_reversion', 'time_stop': 19, 'use_sma': False, 'use_atr': True, 'use_adx': True, 'use_ema': False, 'use_spike': True, 'rsi_required': True, 'edge_k': 1.4770176579641012, 'edge_cap': 0.6541987759239026, 'bull_strategy': 'mean_reversion', 'bull_bb_std_mult': 0.9231356038213605, 'bull_rsi_os': 7, 'bull_rsi_ob': 66, 'bull_adx_thresh': 22.093944992850655, 'bull_atr_min_pct': 0.015880747893582407, 'bull_atr_max_pct': 0.06618502326247626, 'bull_tp_mult': 1.9872755171493992, 'bull_tsl_mult': 0.3000486750044495, 'bull_time_stop': 69, 'bull_use_sma': False, 'bull_use_ema': True, 'bull_use_atr': True, 'bull_use_adx': True, 'bull_use_spike': False, 'bull_rsi_required': False, 'bear_strategy': 'mean_reversion', 'bear_bb_std_mult': 2.5976184642364193, 'bear_rsi_os': 22, 'bear_rsi_ob': 74, 'bear_adx_thresh': 15.21707065151148, 'bear_atr_min_pct': 0.02011388982387213, 'bear_atr_max_pct': 0.04034164455159894, 'bear_tp_mult': 2.711609303372498, 'bear_tsl_mult': 0.1284563856918357, 'bear_time_stop': 126, 'bear_use_sma': True, 'bear_use_ema': False, 'bear_use_atr': False, 'bear_use_adx': False, 'bear_use_spike': False, 'bear_rsi_required': False, 'sideways_strategy': 'breakout', 'sideways_bb_std_mult': 2.1362080389562714, 'sideways_rsi_os': 25, 'sideways_rsi_ob': 56, 'sideways_adx_thresh': 11.865023814943214, 'sideways_atr_min_pct': 0.026919617330073586, 'sideways_atr_max_pct': 0.0686240763700637, 'sideways_tp_mult': 1.4401029853576668, 'sideways_tsl_mult': 0.4900994246816435, 'sideways_time_stop': 178, 'sideways_use_sma': True, 'sideways_use_ema': False, 'sideways_use_atr': False, 'sideways_use_adx': False, 'sideways_use_spike': False, 'sideways_rsi_required': True}.
[I 2025-08-30 16:50:23,417] Trial 543 finished with values: [-0.049329032362560477, 0.049257879053692874] and parameters: {'p_sma': 29, 'p_std': 11, 'p_atr': 23, 'p_adx': 21, 'rsi_period': 17, 'ema1': 24, 'ema2': 55, 'slip_atr_k': 0.0067180806619377455, 'slip_spread_k': 0.5636096078405323, 'spread_hl_frac': 0.028700274255076662, 'bb_std_mult': 3.2168129402675905, 'rsi_os': 38, 'rsi_ob': 90, 'vol_spike': 0.006381742821731937, 'adx_thresh': 31.825386981571235, 'atr_min_pct': 0.004317953841426992, 'atr_max_pct': 0.13170177644866382, 'tp_mult': 2.851118466366899, 'tsl_mult': 0.5486123799984053, 'strategy': 'mean_reversion', 'time_stop': 19, 'use_sma': False, 'use_atr': True, 'use_adx': True, 'use_ema': False, 'use_spike': True, 'rsi_required': True, 'edge_k': 1.5103686848290876, 'edge_cap': 0.702979204246591, 'bull_strategy': 'mean_reversion', 'bull_bb_std_mult': 1.8700068068697393, 'bull_rsi_os': 15, 'bull_rsi_ob': 50, 'bull_adx_thresh': 20.086983575939552, 'bull_atr_min_pct': 0.019930888750240194, 'bull_atr_max_pct': 0.14158809123603636, 'bull_tp_mult': 1.4620086936792833, 'bull_tsl_mult': 0.9802037607565661, 'bull_time_stop': 68, 'bull_use_sma': False, 'bull_use_ema': True, 'bull_use_atr': True, 'bull_use_adx': True, 'bull_use_spike': False, 'bull_rsi_required': False, 'bear_strategy': 'mean_reversion', 'bear_bb_std_mult': 2.0669351067807407, 'bear_rsi_os': 11, 'bear_rsi_ob': 54, 'bear_adx_thresh': 15.02566779517944, 'bear_atr_min_pct': 0.022181791116455164, 'bear_atr_max_pct': 0.10378928020051165, 'bear_tp_mult': 2.414082508526228, 'bear_tsl_mult': 0.6319247277832643, 'bear_time_stop': 223, 'bear_use_sma': True, 'bear_use_ema': False, 'bear_use_atr': False, 'bear_use_adx': False, 'bear_use_spike': False, 'bear_rsi_required': False, 'sideways_strategy': 'breakout', 'sideways_bb_std_mult': 1.9491679489817328, 'sideways_rsi_os': 54, 'sideways_rsi_ob': 95, 'sideways_adx_thresh': 19.64752436386125, 'sideways_atr_min_pct': 0.0019804434272910273, 'sideways_atr_max_pct': 0.143908916306032, 'sideways_tp_mult': 1.4308441010940522, 'sideways_tsl_mult': 0.49519285411698744, 'sideways_time_stop': 194, 'sideways_use_sma': True, 'sideways_use_ema': False, 'sideways_use_atr': False, 'sideways_use_adx': False, 'sideways_use_spike': False, 'sideways_rsi_required': True}.
[I 2025-08-30 16:51:12,391] Trial 548 finished with values: [-1000000000.0, 1000000000.0] and parameters: {'p_sma': 8, 'p_std': 60, 'p_atr': 25, 'p_adx': 25, 'rsi_period': 14, 'ema1': 26, 'ema2': 13, 'slip_atr_k': 0.18952805533457534, 'slip_spread_k': 0.6783766502334599, 'spread_hl_frac': 0.012027140455618944, 'bb_std_mult': 2.515761852395219, 'rsi_os': 15, 'rsi_ob': 92, 'vol_spike': 0.27499168360041815, 'adx_thresh': 12.352459805772149, 'atr_min_pct': 0.013462523113138383, 'atr_max_pct': 0.020550289144523608, 'tp_mult': 2.12333923640678, 'tsl_mult': 0.23529185388479235, 'strategy': 'mean_reversion', 'time_stop': 11, 'use_sma': False, 'use_atr': True, 'use_adx': True, 'use_ema': False, 'use_spike': False, 'rsi_required': True, 'edge_k': 1.3386534804720878, 'edge_cap': 0.6382027620060039, 'bull_strategy': 'mean_reversion', 'bull_bb_std_mult': 1.6971942312123514, 'bull_rsi_os': 26, 'bull_rsi_ob': 51, 'bull_adx_thresh': 7.088858234508569, 'bull_atr_min_pct': 0.018912342154029975, 'bull_atr_max_pct': 0.1256043644092908, 'bull_tp_mult': 1.2369426496689284, 'bull_tsl_mult': 0.29608307888045404, 'bull_time_stop': 93, 'bull_use_sma': False, 'bull_use_ema': True, 'bull_use_atr': True, 'bull_use_adx': True, 'bull_use_spike': False, 'bull_rsi_required': True, 'bear_strategy': 'mean_reversion', 'bear_bb_std_mult': 2.1239716156235176, 'bear_rsi_os': 39, 'bear_rsi_ob': 89, 'bear_adx_thresh': 17.207583586156233, 'bear_atr_min_pct': 0.023592992004201285, 'bear_atr_max_pct': 0.032415832308140366, 'bear_tp_mult': 1.2636407166134673, 'bear_tsl_mult': 0.6545869942344359, 'bear_time_stop': 231, 'bear_use_sma': True, 'bear_use_ema': False, 'bear_use_atr': False, 'bear_use_adx': False, 'bear_use_spike': False, 'bear_rsi_required': False, 'sideways_strategy': 'breakout', 'sideways_bb_std_mult': 2.1672254974491714, 'sideways_rsi_os': 20, 'sideways_rsi_ob': 62, 'sideways_adx_thresh': 19.13815124109513, 'sideways_atr_min_pct': 0.0039488526339981605, 'sideways_atr_max_pct': 0.09010170815757007, 'sideways_tp_mult': 1.3482695275833207, 'sideways_tsl_mult': 0.4611554960820174, 'sideways_time_stop': 218, 'sideways_use_sma': True, 'sideways_use_ema': False, 'sideways_use_atr': False, 'sideways_use_adx': False, 'sideways_use_spike': False, 'sideways_rsi_required': True}.
[I 2025-08-30 16:51:13,200] Trial 547 finished with values: [-1000000000.0, 1000000000.0] and parameters: {'p_sma': 8, 'p_std': 56, 'p_atr': 23, 'p_adx': 27, 'rsi_period': 14, 'ema1': 26, 'ema2': 13, 'slip_atr_k': 0.007595855968542456, 'slip_spread_k': 0.5798539787504915, 'spread_hl_frac': 0.015950664887593297, 'bb_std_mult': 3.180461049239697, 'rsi_os': 44, 'rsi_ob': 66, 'vol_spike': 0.14518615962720388, 'adx_thresh': 13.014529806140407, 'atr_min_pct': 0.0032684343191180763, 'atr_max_pct': 0.1037867503665245, 'tp_mult': 2.852469218129349, 'tsl_mult': 0.5569207590843737, 'strategy': 'mean_reversion', 'time_stop': 17, 'use_sma': False, 'use_atr': True, 'use_adx': True, 'use_ema': False, 'use_spike': True, 'rsi_required': True, 'edge_k': 1.5196450924621603, 'edge_cap': 0.6558225471166842, 'bull_strategy': 'mean_reversion', 'bull_bb_std_mult': 1.1908867605909932, 'bull_rsi_os': 14, 'bull_rsi_ob': 51, 'bull_adx_thresh': 22.011855986881375, 'bull_atr_min_pct': 0.020187926523620822, 'bull_atr_max_pct': 0.12602509244048676, 'bull_tp_mult': 2.444641508523797, 'bull_tsl_mult': 0.29248057130639943, 'bull_time_stop': 76, 'bull_use_sma': False, 'bull_use_ema': True, 'bull_use_atr': True, 'bull_use_adx': True, 'bull_use_spike': False, 'bull_rsi_required': False, 'bear_strategy': 'mean_reversion', 'bear_bb_std_mult': 2.609233271636292, 'bear_rsi_os': 11, 'bear_rsi_ob': 90, 'bear_adx_thresh': 13.525414946368933, 'bear_atr_min_pct': 0.022242869416281598, 'bear_atr_max_pct': 0.12021750395317757, 'bear_tp_mult': 1.6024315076608886, 'bear_tsl_mult': 0.2544770721398625, 'bear_time_stop': 224, 'bear_use_sma': True, 'bear_use_ema': False, 'bear_use_atr': False, 'bear_use_adx': False, 'bear_use_spike': False, 'bear_rsi_required': False, 'sideways_strategy': 'breakout', 'sideways_bb_std_mult': 2.110959237045154, 'sideways_rsi_os': 11, 'sideways_rsi_ob': 91, 'sideways_adx_thresh': 20.126874096736888, 'sideways_atr_min_pct': 0.011009342693319615, 'sideways_atr_max_pct': 0.023317466305830876, 'sideways_tp_mult': 1.3616954322618713, 'sideways_tsl_mult': 0.3218431518324345, 'sideways_time_stop': 95, 'sideways_use_sma': True, 'sideways_use_ema': False, 'sideways_use_atr': False, 'sideways_use_adx': False, 'sideways_use_spike': False, 'sideways_rsi_required': True}.
[I 2025-08-30 16:51:13,558] Trial 546 finished with values: [-1000000000.0, 1000000000.0] and parameters: {'p_sma': 8, 'p_std': 56, 'p_atr': 23, 'p_adx': 27, 'rsi_period': 71, 'ema1': 26, 'ema2': 13, 'slip_atr_k': 0.18656125775482646, 'slip_spread_k': 0.6751402297384863, 'spread_hl_frac': 0.012093378346628998, 'bb_std_mult': 2.5469931924126796, 'rsi_os': 38, 'rsi_ob': 80, 'vol_spike': 0.14758146668253158, 'adx_thresh': 20.584187656938635, 'atr_min_pct': 0.003139937720544418, 'atr_max_pct': 0.025573285634769204, 'tp_mult': 2.4972320850916456, 'tsl_mult': 0.4344567455860042, 'strategy': 'mean_reversion', 'time_stop': 17, 'use_sma': False, 'use_atr': True, 'use_adx': True, 'use_ema': False, 'use_spike': True, 'rsi_required': True, 'edge_k': 1.3061260185619417, 'edge_cap': 0.6434293065283907, 'bull_strategy': 'mean_reversion', 'bull_bb_std_mult': 2.545178048611464, 'bull_rsi_os': 26, 'bull_rsi_ob': 66, 'bull_adx_thresh': 17.318776390036238, 'bull_atr_min_pct': 0.004105579197429777, 'bull_atr_max_pct': 0.12507772319029425, 'bull_tp_mult': 1.4741969400786923, 'bull_tsl_mult': 0.2926803698041599, 'bull_time_stop': 76, 'bull_use_sma': False, 'bull_use_ema': True, 'bull_use_atr': True, 'bull_use_adx': True, 'bull_use_spike': False, 'bull_rsi_required': False, 'bear_strategy': 'mean_reversion', 'bear_bb_std_mult': 2.095065267415837, 'bear_rsi_os': 11, 'bear_rsi_ob': 94, 'bear_adx_thresh': 17.295614874813733, 'bear_atr_min_pct': 0.0016499810895961413, 'bear_atr_max_pct': 0.10361122510535906, 'bear_tp_mult': 1.2629165447744426, 'bear_tsl_mult': 0.6381786851022905, 'bear_time_stop': 198, 'bear_use_sma': True, 'bear_use_ema': False, 'bear_use_atr': False, 'bear_use_adx': False, 'bear_use_spike': False, 'bear_rsi_required': False, 'sideways_strategy': 'breakout', 'sideways_bb_std_mult': 2.1725196927370245, 'sideways_rsi_os': 50, 'sideways_rsi_ob': 95, 'sideways_adx_thresh': 17.05558751045981, 'sideways_atr_min_pct': 0.004727872751520359, 'sideways_atr_max_pct': 0.06908172845979181, 'sideways_tp_mult': 1.3509564234299993, 'sideways_tsl_mult': 0.21126029048180367, 'sideways_time_stop': 212, 'sideways_use_sma': True, 'sideways_use_ema': False, 'sideways_use_atr': False, 'sideways_use_adx': False, 'sideways_use_spike': False, 'sideways_rsi_required': True}.
