[I 2025-08-30 15:23:05,838] Trial 74 finished with values: [-1000000000.0, 1000000000.0] and parameters: {'p_sma': 38, 'p_std': 5, 'p_atr': 25, 'p_adx': 7, 'rsi_period': 29, 'ema1': 29, 'ema2': 38, 'slip_atr_k': 0.038543148216741985, 'slip_spread_k': 0.23630543156509465, 'spread_hl_frac': 0.04352788091472496, 'bb_std_mult': 1.6876098174866234, 'rsi_os': 12, 'rsi_ob': 48, 'vol_spike': 0.18544616378725848, 'adx_thresh': 34.91634205274705, 'atr_min_pct': 0.012626793073072323, 'atr_max_pct': 0.04542589081134177, 'tp_mult': 2.564355825736327, 'tsl_mult': 0.8026099291087787, 'strategy': 'mean_reversion', 'time_stop': 267, 'use_sma': True, 'use_atr': False, 'use_adx': True, 'use_ema': True, 'use_spike': False, 'rsi_required': True, 'edge_k': 0.49329936303914557, 'edge_cap': 0.9475530178222064, 'bull_strategy': 'breakout', 'bull_bb_std_mult': 2.11039859218732, 'bull_rsi_os': 42, 'bull_rsi_ob': 83, 'bull_adx_thresh': 31.94346007497716, 'bull_atr_min_pct': 0.0020166053509863575, 'bull_atr_max_pct': 0.10893145167673501, 'bull_tp_mult': 2.8528061983954545, 'bull_tsl_mult': 0.43152024191213967, 'bull_time_stop': 131, 'bull_use_sma': False, 'bull_use_ema': True, 'bull_use_atr': False, 'bull_use_adx': False, 'bull_use_spike': True, 'bull_rsi_required': False, 'bear_strategy': 'breakout', 'bear_bb_std_mult': 1.4721339172357166, 'bear_rsi_os': 36, 'bear_rsi_ob': 93, 'bear_adx_thresh': 32.147117154434795, 'bear_atr_min_pct': 0.012961632884658479, 'bear_atr_max_pct': 0.13278988064219582, 'bear_tp_mult': 2.2574098690730797, 'bear_tsl_mult': 0.8947761808705352, 'bear_time_stop': 59, 'bear_use_sma': False, 'bear_use_ema': False, 'bear_use_atr': True, 'bear_use_adx': False, 'bear_use_spike': True, 'bear_rsi_required': True, 'sideways_strategy': 'breakout', 'sideways_bb_std_mult': 1.9543116853466067, 'sideways_rsi_os': 45, 'sideways_rsi_ob': 74, 'sideways_adx_thresh': 11.17243130167954, 'sideways_atr_min_pct': 0.0015726538937279315, 'sideways_atr_max_pct': 0.0924360763449457, 'sideways_tp_mult': 1.2483575271094576, 'sideways_tsl_mult': 0.05774625835423519, 'sideways_time_stop': 20, 'sideways_use_sma': False, 'sideways_use_ema': True, 'sideways_use_atr': True, 'sideways_use_adx': True, 'sideways_use_spike': True, 'sideways_rsi_required': False}.
[I 2025-08-30 15:23:06,381] Trial 75 finished with values: [-1000000000.0, 1000000000.0] and parameters: {'p_sma': 37, 'p_std': 30, 'p_atr': 27, 'p_adx': 7, 'rsi_period': 77, 'ema1': 29, 'ema2': 38, 'slip_atr_k': 0.1349129374136885, 'slip_spread_k': 0.9630476236869423, 'spread_hl_frac': 0.04213779330699501, 'bb_std_mult': 1.48398645139035, 'rsi_os': 22, 'rsi_ob': 48, 'vol_spike': 0.1669369939737155, 'adx_thresh': 31.44211658773952, 'atr_min_pct': 0.012770317148917989, 'atr_max_pct': 0.051910431204956475, 'tp_mult': 2.23423883538269, 'tsl_mult': 0.7983631911377077, 'strategy': 'mean_reversion', 'time_stop': 264, 'use_sma': True, 'use_atr': False, 'use_adx': True, 'use_ema': True, 'use_spike': False, 'rsi_required': True, 'edge_k': 0.5157948428155317, 'edge_cap': 0.9684574440440447, 'bull_strategy': 'breakout', 'bull_bb_std_mult': 3.2153318345265225, 'bull_rsi_os': 42, 'bull_rsi_ob': 95, 'bull_adx_thresh': 31.991884409759148, 'bull_atr_min_pct': 0.017103071456464378, 'bull_atr_max_pct': 0.11025935411118673, 'bull_tp_mult': 2.860119429545488, 'bull_tsl_mult': 0.5413171342841278, 'bull_time_stop': 165, 'bull_use_sma': False, 'bull_use_ema': True, 'bull_use_atr': False, 'bull_use_adx': False, 'bull_use_spike': False, 'bull_rsi_required': False, 'bear_strategy': 'breakout', 'bear_bb_std_mult': 2.949532682781005, 'bear_rsi_os': 36, 'bear_rsi_ob': 93, 'bear_adx_thresh': 32.174773300950655, 'bear_atr_min_pct': 0.02182023559997123, 'bear_atr_max_pct': 0.13242033191647412, 'bear_tp_mult': 1.6823408230697903, 'bear_tsl_mult': 0.8058971124159722, 'bear_time_stop': 208, 'bear_use_sma': False, 'bear_use_ema': False, 'bear_use_atr': True, 'bear_use_adx': False, 'bear_use_spike': True, 'bear_rsi_required': True, 'sideways_strategy': 'breakout', 'sideways_bb_std_mult': 2.4535172810059462, 'sideways_rsi_os': 53, 'sideways_rsi_ob': 74, 'sideways_adx_thresh': 11.52492600129181, 'sideways_atr_min_pct': 0.0013534300219304335, 'sideways_atr_max_pct': 0.09078882417598579, 'sideways_tp_mult': 1.2658970493641806, 'sideways_tsl_mult': 0.10183326783469271, 'sideways_time_stop': 24, 'sideways_use_sma': False, 'sideways_use_ema': True, 'sideways_use_atr': True, 'sideways_use_adx': True, 'sideways_use_spike': True, 'sideways_rsi_required': False}.
[I 2025-08-30 15:23:35,036] Trial 72 finished with values: [-1000000000.0, 1000000000.0] and parameters: {'p_sma': 24, 'p_std': 54, 'p_atr': 30, 'p_adx': 8, 'rsi_period': 76, 'ema1': 20, 'ema2': 49, 'slip_atr_k': 0.20476563146184942, 'slip_spread_k': 0.21416146324334512, 'spread_hl_frac': 0.016225153081923384, 'bb_std_mult': 1.2980597807027432, 'rsi_os': 54, 'rsi_ob': 87, 'vol_spike': 0.24666096388675035, 'adx_thresh': 10.002400614718914, 'atr_min_pct': 0.012486643046475477, 'atr_max_pct': 0.05175948400454311, 'tp_mult': 1.9142844682377267, 'tsl_mult': 0.9993284926103881, 'strategy': 'breakout', 'time_stop': 221, 'use_sma': False, 'use_atr': False, 'use_adx': False, 'use_ema': True, 'use_spike': True, 'rsi_required': True, 'edge_k': 0.9292235166924294, 'edge_cap': 0.9017641523210168, 'bull_strategy': 'mean_reversion', 'bull_bb_std_mult': 2.042351420227868, 'bull_rsi_os': 31, 'bull_rsi_ob': 83, 'bull_adx_thresh': 25.35138805954798, 'bull_atr_min_pct': 0.020345411728367385, 'bull_atr_max_pct': 0.10001192458535962, 'bull_tp_mult': 2.92529740130799, 'bull_tsl_mult': 0.3850940995848207, 'bull_time_stop': 174, 'bull_use_sma': False, 'bull_use_ema': True, 'bull_use_atr': False, 'bull_use_adx': False, 'bull_use_spike': True, 'bull_rsi_required': True, 'bear_strategy': 'breakout', 'bear_bb_std_mult': 2.059752820723404, 'bear_rsi_os': 30, 'bear_rsi_ob': 45, 'bear_adx_thresh': 28.51109016977142, 'bear_atr_min_pct': 0.022251153985574368, 'bear_atr_max_pct': 0.10700687285212185, 'bear_tp_mult': 1.3010303883219123, 'bear_tsl_mult': 0.7214748567599983, 'bear_time_stop': 251, 'bear_use_sma': False, 'bear_use_ema': False, 'bear_use_atr': False, 'bear_use_adx': True, 'bear_use_spike': True, 'bear_rsi_required': True, 'sideways_strategy': 'mean_reversion', 'sideways_bb_std_mult': 2.9448881335037727, 'sideways_rsi_os': 47, 'sideways_rsi_ob': 83, 'sideways_adx_thresh': 22.528697957525154, 'sideways_atr_min_pct': 0.005087696643013315, 'sideways_atr_max_pct': 0.05420185336379856, 'sideways_tp_mult': 1.5951437746571424, 'sideways_tsl_mult': 0.8213417135787832, 'sideways_time_stop': 72, 'sideways_use_sma': True, 'sideways_use_ema': True, 'sideways_use_atr': True, 'sideways_use_adx': False, 'sideways_use_spike': True, 'sideways_rsi_required': False}.
[I 2025-08-30 15:23:55,005] Trial 76 finished with values: [-1000000000.0, 1000000000.0] and parameters: {'p_sma': 35, 'p_std': 30, 'p_atr': 27, 'p_adx': 10, 'rsi_period': 17, 'ema1': 13, 'ema2': 25, 'slip_atr_k': 0.20473597412518835, 'slip_spread_k': 0.7316254861838248, 'spread_hl_frac': 0.04328605232660708, 'bb_std_mult': 1.546461182069532, 'rsi_os': 35, 'rsi_ob': 80, 'vol_spike': 0.16369838573042886, 'adx_thresh': 31.409021954590273, 'atr_min_pct': 0.028339949388911885, 'atr_max_pct': 0.05194372213370744, 'tp_mult': 2.214157239188104, 'tsl_mult': 0.876785899701828, 'strategy': 'mean_reversion', 'time_stop': 291, 'use_sma': True, 'use_atr': False, 'use_adx': True, 'use_ema': True, 'use_spike': False, 'rsi_required': True, 'edge_k': 0.556165682203843, 'edge_cap': 0.9857368652495115, 'bull_strategy': 'mean_reversion', 'bull_bb_std_mult': 3.195243510214972, 'bull_rsi_os': 31, 'bull_rsi_ob': 80, 'bull_adx_thresh': 25.542981521952242, 'bull_atr_min_pct': 0.013132878620919566, 'bull_atr_max_pct': 0.02157353016382637, 'bull_tp_mult': 2.8238640199599776, 'bull_tsl_mult': 0.05487652933427445, 'bull_time_stop': 285, 'bull_use_sma': False, 'bull_use_ema': True, 'bull_use_atr': True, 'bull_use_adx': False, 'bull_use_spike': False, 'bull_rsi_required': True, 'bear_strategy': 'breakout', 'bear_bb_std_mult': 2.9227018655529795, 'bear_rsi_os': 46, 'bear_rsi_ob': 45, 'bear_adx_thresh': 28.177917835906854, 'bear_atr_min_pct': 0.022218614886240717, 'bear_atr_max_pct': 0.11491676668881286, 'bear_tp_mult': 1.4768138841661749, 'bear_tsl_mult': 0.731810956307523, 'bear_time_stop': 10, 'bear_use_sma': True, 'bear_use_ema': False, 'bear_use_atr': True, 'bear_use_adx': True, 'bear_use_spike': True, 'bear_rsi_required': True, 'sideways_strategy': 'mean_reversion', 'sideways_bb_std_mult': 3.00458997671764, 'sideways_rsi_os': 53, 'sideways_rsi_ob': 55, 'sideways_adx_thresh': 27.80782102513877, 'sideways_atr_min_pct': 0.02115612008058956, 'sideways_atr_max_pct': 0.07480573734900015, 'sideways_tp_mult': 1.2633821586669138, 'sideways_tsl_mult': 0.9415250241609936, 'sideways_time_stop': 90, 'sideways_use_sma': False, 'sideways_use_ema': True, 'sideways_use_atr': True, 'sideways_use_adx': False, 'sideways_use_spike': False, 'sideways_rsi_required': False}.
[I 2025-08-30 15:23:56,575] Trial 73 finished with values: [-1000000000.0, 1000000000.0] and parameters: {'p_sma': 24, 'p_std': 30, 'p_atr': 25, 'p_adx': 23, 'rsi_period': 76, 'ema1': 20, 'ema2': 55, 'slip_atr_k': 0.20378154020375489, 'slip_spread_k': 0.254599413929811, 'spread_hl_frac': 0.016339185722181113, 'bb_std_mult': 1.4848642767888824, 'rsi_os': 12, 'rsi_ob': 47, 'vol_spike': 0.14352778867217428, 'adx_thresh': 26.93192081327716, 'atr_min_pct': 0.009583622641313032, 'atr_max_pct': 0.029474646918953365, 'tp_mult': 1.9156263281857857, 'tsl_mult': 0.44352410762203276, 'strategy': 'breakout', 'time_stop': 265, 'use_sma': True, 'use_atr': False, 'use_adx': False, 'use_ema': True, 'use_spike': False, 'rsi_required': True, 'edge_k': 1.5050698088241137, 'edge_cap': 0.9734547590057955, 'bull_strategy': 'mean_reversion', 'bull_bb_std_mult': 3.196240578993027, 'bull_rsi_os': 42, 'bull_rsi_ob': 88, 'bull_adx_thresh': 32.28647298362249, 'bull_atr_min_pct': 0.019669046570206995, 'bull_atr_max_pct': 0.10872310529287238, 'bull_tp_mult': 2.392355534494649, 'bull_tsl_mult': 0.5486108872485018, 'bull_time_stop': 142, 'bull_use_sma': False, 'bull_use_ema': True, 'bull_use_atr': False, 'bull_use_adx': False, 'bull_use_spike': True, 'bull_rsi_required': True, 'bear_strategy': 'breakout', 'bear_bb_std_mult': 2.062472713491767, 'bear_rsi_os': 15, 'bear_rsi_ob': 95, 'bear_adx_thresh': 28.169119526408736, 'bear_atr_min_pct': 0.02277327213269763, 'bear_atr_max_pct': 0.02744479257753346, 'bear_tp_mult': 2.226105216759941, 'bear_tsl_mult': 0.7232365958837584, 'bear_time_stop': 250, 'bear_use_sma': False, 'bear_use_ema': False, 'bear_use_atr': False, 'bear_use_adx': True, 'bear_use_spike': True, 'bear_rsi_required': True, 'sideways_strategy': 'mean_reversion', 'sideways_bb_std_mult': 1.9897076208949205, 'sideways_rsi_os': 45, 'sideways_rsi_ob': 70, 'sideways_adx_thresh': 20.21677538542154, 'sideways_atr_min_pct': 0.004915757616168543, 'sideways_atr_max_pct': 0.07332377421533681, 'sideways_tp_mult': 2.226517219191764, 'sideways_tsl_mult': 0.5466210089149582, 'sideways_time_stop': 70, 'sideways_use_sma': True, 'sideways_use_ema': True, 'sideways_use_atr': True, 'sideways_use_adx': False, 'sideways_use_spike': True, 'sideways_rsi_required': False}.
[I 2025-08-30 15:23:59,860] Trial 77 finished with values: [-1000000000.0, 1000000000.0] and parameters: {'p_sma': 34, 'p_std': 52, 'p_atr': 29, 'p_adx': 10, 'rsi_period': 15, 'ema1': 9, 'ema2': 24, 'slip_atr_k': 0.20395531755430862, 'slip_spread_k': 0.7295172678231938, 'spread_hl_frac': 0.04649010141957294, 'bb_std_mult': 2.008022257045788, 'rsi_os': 34, 'rsi_ob': 76, 'vol_spike': 0.22667054136300333, 'adx_thresh': 18.359742496256494, 'atr_min_pct': 0.014132313193463326, 'atr_max_pct': 0.11060232613422691, 'tp_mult': 1.405780234284069, 'tsl_mult': 0.9536359813267445, 'strategy': 'mean_reversion', 'time_stop': 291, 'use_sma': True, 'use_atr': False, 'use_adx': True, 'use_ema': False, 'use_spike': False, 'rsi_required': True, 'edge_k': 0.5751931176673024, 'edge_cap': 0.33576743553295896, 'bull_strategy': 'mean_reversion', 'bull_bb_std_mult': 2.673530089250242, 'bull_rsi_os': 31, 'bull_rsi_ob': 81, 'bull_adx_thresh': 25.19988380796259, 'bull_atr_min_pct': 0.01354281622235016, 'bull_atr_max_pct': 0.02192510681155084, 'bull_tp_mult': 2.403656989147141, 'bull_tsl_mult': 0.38050110002878845, 'bull_time_stop': 290, 'bull_use_sma': False, 'bull_use_ema': True, 'bull_use_atr': True, 'bull_use_adx': True, 'bull_use_spike': False, 'bull_rsi_required': True, 'bear_strategy': 'mean_reversion', 'bear_bb_std_mult': 0.973717651336396, 'bear_rsi_os': 51, 'bear_rsi_ob': 89, 'bear_adx_thresh': 20.085896924059668, 'bear_atr_min_pct': 0.019398508259554515, 'bear_atr_max_pct': 0.10801851639319761, 'bear_tp_mult': 1.8302818118326898, 'bear_tsl_mult': 0.7465185027299955, 'bear_time_stop': 11, 'bear_use_sma': True, 'bear_use_ema': False, 'bear_use_atr': True, 'bear_use_adx': True, 'bear_use_spike': False, 'bear_rsi_required': False, 'sideways_strategy': 'mean_reversion', 'sideways_bb_std_mult': 3.0160618654072278, 'sideways_rsi_os': 54, 'sideways_rsi_ob': 80, 'sideways_adx_thresh': 19.287668210912713, 'sideways_atr_min_pct': 0.02126648931851332, 'sideways_atr_max_pct': 0.07410486846632272, 'sideways_tp_mult': 1.1602758472100119, 'sideways_tsl_mult': 0.4541140877239501, 'sideways_time_stop': 66, 'sideways_use_sma': False, 'sideways_use_ema': True, 'sideways_use_atr': False, 'sideways_use_adx': False, 'sideways_use_spike': False, 'sideways_rsi_required': False}.
[I 2025-08-30 15:24:38,058] Trial 78 finished with values: [-1000000000.0, 1000000000.0] and parameters: {'p_sma': 33, 'p_std': 42, 'p_atr': 29, 'p_adx': 10, 'rsi_period': 18, 'ema1': 13, 'ema2': 24, 'slip_atr_k': 0.2169141340788377, 'slip_spread_k': 0.7993562491201993, 'spread_hl_frac': 0.043490521198693226, 'bb_std_mult': 1.7536910107822665, 'rsi_os': 7, 'rsi_ob': 80, 'vol_spike': 0.20791560380916482, 'adx_thresh': 6.444921885185938, 'atr_min_pct': 0.007238318154251012, 'atr_max_pct': 0.029527815358872396, 'tp_mult': 2.08621355251196, 'tsl_mult': 0.8523379505434581, 'strategy': 'mean_reversion', 'time_stop': 159, 'use_sma': True, 'use_atr': False, 'use_adx': True, 'use_ema': False, 'use_spike': False, 'rsi_required': True, 'edge_k': 1.4663392743062025, 'edge_cap': 0.9880259276436171, 'bull_strategy': 'breakout', 'bull_bb_std_mult': 2.396800523658046, 'bull_rsi_os': 9, 'bull_rsi_ob': 80, 'bull_adx_thresh': 16.747356127680675, 'bull_atr_min_pct': 0.002604731490126336, 'bull_atr_max_pct': 0.021540430099265477, 'bull_tp_mult': 2.779382853909811, 'bull_tsl_mult': 0.9633735723417627, 'bull_time_stop': 147, 'bull_use_sma': True, 'bull_use_ema': True, 'bull_use_atr': True, 'bull_use_adx': True, 'bull_use_spike': False, 'bull_rsi_required': True, 'bear_strategy': 'mean_reversion', 'bear_bb_std_mult': 0.9857333910995003, 'bear_rsi_os': 17, 'bear_rsi_ob': 89, 'bear_adx_thresh': 7.973418800319118, 'bear_atr_min_pct': 0.02047511507603534, 'bear_atr_max_pct': 0.11491296749802396, 'bear_tp_mult': 1.8200287572469531, 'bear_tsl_mult': 0.47302943834562494, 'bear_time_stop': 11, 'bear_use_sma': True, 'bear_use_ema': True, 'bear_use_atr': True, 'bear_use_adx': False, 'bear_use_spike': False, 'bear_rsi_required': False, 'sideways_strategy': 'mean_reversion', 'sideways_bb_std_mult': 1.9705134510616784, 'sideways_rsi_os': 54, 'sideways_rsi_ob': 80, 'sideways_adx_thresh': 20.40640761934813, 'sideways_atr_min_pct': 0.009546988495652721, 'sideways_atr_max_pct': 0.07405043347672485, 'sideways_tp_mult': 1.1744563531890653, 'sideways_tsl_mult': 0.9418207339121769, 'sideways_time_stop': 246, 'sideways_use_sma': False, 'sideways_use_ema': True, 'sideways_use_atr': False, 'sideways_use_adx': False, 'sideways_use_spike': False, 'sideways_rsi_required': False}.
[I 2025-08-30 15:24:54,887] Trial 80 finished with values: [-1000000000.0, 1000000000.0] and parameters: {'p_sma': 8, 'p_std': 9, 'p_atr': 20, 'p_adx': 10, 'rsi_period': 22, 'ema1': 10, 'ema2': 51, 'slip_atr_k': 0.2241352219307325, 'slip_spread_k': 0.8935018461519131, 'spread_hl_frac': 0.04702302001059814, 'bb_std_mult': 2.0347359340696283, 'rsi_os': 7, 'rsi_ob': 75, 'vol_spike': 0.20930014268947827, 'adx_thresh': 32.34965785585705, 'atr_min_pct': 0.014464475485810695, 'atr_max_pct': 0.11016146568517368, 'tp_mult': 2.4131671912905244, 'tsl_mult': 0.9523952608558706, 'strategy': 'mean_reversion', 'time_stop': 300, 'use_sma': True, 'use_atr': False, 'use_adx': True, 'use_ema': False, 'use_spike': False, 'rsi_required': True, 'edge_k': 0.39380312983787946, 'edge_cap': 0.9313812964177386, 'bull_strategy': 'breakout', 'bull_bb_std_mult': 2.40112891091357, 'bull_rsi_os': 10, 'bull_rsi_ob': 61, 'bull_adx_thresh': 10.93884306996319, 'bull_atr_min_pct': 0.003079149449980176, 'bull_atr_max_pct': 0.011835674372848918, 'bull_tp_mult': 2.7670183226937555, 'bull_tsl_mult': 0.3292356687276584, 'bull_time_stop': 211, 'bull_use_sma': True, 'bull_use_ema': True, 'bull_use_atr': True, 'bull_use_adx': True, 'bull_use_spike': False, 'bull_rsi_required': False, 'bear_strategy': 'mean_reversion', 'bear_bb_std_mult': 0.9920922438363748, 'bear_rsi_os': 51, 'bear_rsi_ob': 90, 'bear_adx_thresh': 20.03381648752453, 'bear_atr_min_pct': 0.01992591937882803, 'bear_atr_max_pct': 0.09498899260712218, 'bear_tp_mult': 1.8289899249986918, 'bear_tsl_mult': 0.9978597880838322, 'bear_time_stop': 48, 'bear_use_sma': True, 'bear_use_ema': True, 'bear_use_atr': True, 'bear_use_adx': False, 'bear_use_spike': False, 'bear_rsi_required': False, 'sideways_strategy': 'breakout', 'sideways_bb_std_mult': 1.0186605807928113, 'sideways_rsi_os': 22, 'sideways_rsi_ob': 69, 'sideways_adx_thresh': 24.863315485487874, 'sideways_atr_min_pct': 0.009405950552986212, 'sideways_atr_max_pct': 0.06722841195254899, 'sideways_tp_mult': 1.1805696782239512, 'sideways_tsl_mult': 0.1586519665253439, 'sideways_time_stop': 5, 'sideways_use_sma': False, 'sideways_use_ema': True, 'sideways_use_atr': False, 'sideways_use_adx': True, 'sideways_use_spike': False, 'sideways_rsi_required': True}.
[I 2025-08-30 15:24:56,009] Trial 79 finished with values: [-1000000000.0, 1000000000.0] and parameters: {'p_sma': 33, 'p_std': 9, 'p_atr': 20, 'p_adx': 10, 'rsi_period': 19, 'ema1': 10, 'ema2': 55, 'slip_atr_k': 0.21658301039854772, 'slip_spread_k': 0.8934736632685315, 'spread_hl_frac': 0.04691895060840536, 'bb_std_mult': 1.9768432619972522, 'rsi_os': 26, 'rsi_ob': 76, 'vol_spike': 0.20851279169453485, 'adx_thresh': 26.589002406601782, 'atr_min_pct': 0.014066162251342962, 'atr_max_pct': 0.0309015661568008, 'tp_mult': 1.5750511943992036, 'tsl_mult': 0.955680115036687, 'strategy': 'mean_reversion', 'time_stop': 299, 'use_sma': True, 'use_atr': False, 'use_adx': True, 'use_ema': False, 'use_spike': False, 'rsi_required': True, 'edge_k': 1.4635907806878903, 'edge_cap': 0.9327387264761099, 'bull_strategy': 'breakout', 'bull_bb_std_mult': 2.35670557023901, 'bull_rsi_os': 39, 'bull_rsi_ob': 66, 'bull_adx_thresh': 10.67383220117669, 'bull_atr_min_pct': 0.006009313764263474, 'bull_atr_max_pct': 0.14050262736755662, 'bull_tp_mult': 2.4367762833526676, 'bull_tsl_mult': 0.41661402762064115, 'bull_time_stop': 147, 'bull_use_sma': True, 'bull_use_ema': True, 'bull_use_atr': True, 'bull_use_adx': True, 'bull_use_spike': False, 'bull_rsi_required': False, 'bear_strategy': 'mean_reversion', 'bear_bb_std_mult': 1.1427295115059088, 'bear_rsi_os': 33, 'bear_rsi_ob': 88, 'bear_adx_thresh': 7.589454359016562, 'bear_atr_min_pct': 0.0192336311832455, 'bear_atr_max_pct': 0.09707040615990631, 'bear_tp_mult': 1.816888860528131, 'bear_tsl_mult': 0.48606251967575376, 'bear_time_stop': 45, 'bear_use_sma': True, 'bear_use_ema': True, 'bear_use_atr': True, 'bear_use_adx': False, 'bear_use_spike': False, 'bear_rsi_required': False, 'sideways_strategy': 'breakout', 'sideways_bb_std_mult': 3.1494982734334904, 'sideways_rsi_os': 55, 'sideways_rsi_ob': 69, 'sideways_adx_thresh': 20.12425675011811, 'sideways_atr_min_pct': 0.009611409588007516, 'sideways_atr_max_pct': 0.06962460410276998, 'sideways_tp_mult': 2.2077401889222434, 'sideways_tsl_mult': 0.5360027162097873, 'sideways_time_stop': 245, 'sideways_use_sma': False, 'sideways_use_ema': True, 'sideways_use_atr': False, 'sideways_use_adx': False, 'sideways_use_spike': False, 'sideways_rsi_required': True}.
