[I 2025-08-30 15:36:28,453] Trial 133 finished with values: [-1000000000.0, 1000000000.0] and parameters: {'p_sma': 48, 'p_std': 13, 'p_atr': 14, 'p_adx': 15, 'rsi_period': 79, 'ema1': 28, 'ema2': 31, 'slip_atr_k': 0.049766341138748046, 'slip_spread_k': 0.2839958588036087, 'spread_hl_frac': 0.02418129671408574, 'bb_std_mult': 2.5799042921630493, 'rsi_os': 31, 'rsi_ob': 81, 'vol_spike': 0.26677879719186887, 'adx_thresh': 14.972294019314324, 'atr_min_pct': 0.003618573181453331, 'atr_max_pct': 0.03262954603993231, 'tp_mult': 1.0492225858987996, 'tsl_mult': 0.10899167459721804, 'strategy': 'mean_reversion', 'time_stop': 243, 'use_sma': False, 'use_atr': False, 'use_adx': True, 'use_ema': False, 'use_spike': True, 'rsi_required': False, 'edge_k': 1.7123506429726894, 'edge_cap': 0.14122136682802816, 'bull_strategy': 'breakout', 'bull_bb_std_mult': 0.8870229981843225, 'bull_rsi_os': 30, 'bull_rsi_ob': 95, 'bull_adx_thresh': 24.88716085377065, 'bull_atr_min_pct': 0.023053304212269265, 'bull_atr_max_pct': 0.14325541132654296, 'bull_tp_mult': 1.601912347545811, 'bull_tsl_mult': 0.6630771974906099, 'bull_time_stop': 12, 'bull_use_sma': True, 'bull_use_ema': True, 'bull_use_atr': False, 'bull_use_adx': True, 'bull_use_spike': False, 'bull_rsi_required': True, 'bear_strategy': 'mean_reversion', 'bear_bb_std_mult': 1.9134745845087822, 'bear_rsi_os': 43, 'bear_rsi_ob': 94, 'bear_adx_thresh': 18.731246365830422, 'bear_atr_min_pct': 0.012145644991514212, 'bear_atr_max_pct': 0.12979592318738892, 'bear_tp_mult': 1.1641012441666292, 'bear_tsl_mult': 0.15173055927866613, 'bear_time_stop': 246, 'bear_use_sma': True, 'bear_use_ema': False, 'bear_use_atr': True, 'bear_use_adx': False, 'bear_use_spike': True, 'bear_rsi_required': False, 'sideways_strategy': 'breakout', 'sideways_bb_std_mult': 0.6712588984013389, 'sideways_rsi_os': 31, 'sideways_rsi_ob': 83, 'sideways_adx_thresh': 18.53792513050102, 'sideways_atr_min_pct': 0.0008346601229281205, 'sideways_atr_max_pct': 0.13771763992508732, 'sideways_tp_mult': 2.6080184132794897, 'sideways_tsl_mult': 0.6790650263605784, 'sideways_time_stop': 269, 'sideways_use_sma': False, 'sideways_use_ema': True, 'sideways_use_atr': False, 'sideways_use_adx': True, 'sideways_use_spike': False, 'sideways_rsi_required': False}.
[I 2025-08-30 15:36:29,509] Trial 138 finished with values: [-1000000000.0, 1000000000.0] and parameters: {'p_sma': 27, 'p_std': 11, 'p_atr': 9, 'p_adx': 20, 'rsi_period': 82, 'ema1': 29, 'ema2': 20, 'slip_atr_k': 0.1388803863889257, 'slip_spread_k': 0.8948175339722486, 'spread_hl_frac': 0.046174711270598634, 'bb_std_mult': 3.3808890041544792, 'rsi_os': 53, 'rsi_ob': 81, 'vol_spike': 0.29969677743171746, 'adx_thresh': 21.243510012158517, 'atr_min_pct': 0.00597633984783126, 'atr_max_pct': 0.054230642859704345, 'tp_mult': 1.017686339273122, 'tsl_mult': 0.46803741681554617, 'strategy': 'mean_reversion', 'time_stop': 213, 'use_sma': False, 'use_atr': True, 'use_adx': True, 'use_ema': False, 'use_spike': False, 'rsi_required': True, 'edge_k': 0.44634721140671263, 'edge_cap': 0.5144630888444148, 'bull_strategy': 'breakout', 'bull_bb_std_mult': 1.8334694695887652, 'bull_rsi_os': 29, 'bull_rsi_ob': 51, 'bull_adx_thresh': 31.54839398242469, 'bull_atr_min_pct': 0.0011780939531629338, 'bull_atr_max_pct': 0.12650904859872714, 'bull_tp_mult': 1.5049714698201089, 'bull_tsl_mult': 0.3056556891978532, 'bull_time_stop': 39, 'bull_use_sma': False, 'bull_use_ema': False, 'bull_use_atr': True, 'bull_use_adx': True, 'bull_use_spike': False, 'bull_rsi_required': True, 'bear_strategy': 'mean_reversion', 'bear_bb_std_mult': 1.8977007974636606, 'bear_rsi_os': 43, 'bear_rsi_ob': 90, 'bear_adx_thresh': 19.963721707319607, 'bear_atr_min_pct': 0.004193795005823512, 'bear_atr_max_pct': 0.12372786748108665, 'bear_tp_mult': 1.7321110960602244, 'bear_tsl_mult': 0.09253183793816722, 'bear_time_stop': 165, 'bear_use_sma': True, 'bear_use_ema': False, 'bear_use_atr': True, 'bear_use_adx': False, 'bear_use_spike': False, 'bear_rsi_required': False, 'sideways_strategy': 'breakout', 'sideways_bb_std_mult': 2.8249406360191545, 'sideways_rsi_os': 11, 'sideways_rsi_ob': 63, 'sideways_adx_thresh': 18.212892849015386, 'sideways_atr_min_pct': 0.024062818055948725, 'sideways_atr_max_pct': 0.11239655982763909, 'sideways_tp_mult': 2.6516195901170794, 'sideways_tsl_mult': 0.021414013423434644, 'sideways_time_stop': 22, 'sideways_use_sma': False, 'sideways_use_ema': True, 'sideways_use_atr': False, 'sideways_use_adx': False, 'sideways_use_spike': False, 'sideways_rsi_required': False}.
[I 2025-08-30 15:36:29,809] Trial 134 finished with values: [-1000000000.0, 0.18323429722621254] and parameters: {'p_sma': 18, 'p_std': 13, 'p_atr': 23, 'p_adx': 11, 'rsi_period': 78, 'ema1': 18, 'ema2': 31, 'slip_atr_k': 0.1391443366681248, 'slip_spread_k': 0.8945777712727163, 'spread_hl_frac': 0.044326338421801434, 'bb_std_mult': 3.371628520786426, 'rsi_os': 31, 'rsi_ob': 83, 'vol_spike': 0.27900380694624377, 'adx_thresh': 17.237601007224242, 'atr_min_pct': 0.0025873140658854844, 'atr_max_pct': 0.10948756677703415, 'tp_mult': 1.8138147220291805, 'tsl_mult': 0.09912261593034793, 'strategy': 'mean_reversion', 'time_stop': 209, 'use_sma': False, 'use_atr': False, 'use_adx': True, 'use_ema': False, 'use_spike': False, 'rsi_required': False, 'edge_k': 0.5906594927320552, 'edge_cap': 0.33345829933549376, 'bull_strategy': 'breakout', 'bull_bb_std_mult': 1.0148814151518193, 'bull_rsi_os': 31, 'bull_rsi_ob': 92, 'bull_adx_thresh': 33.755046803062434, 'bull_atr_min_pct': 0.023178044738809963, 'bull_atr_max_pct': 0.016432801805876765, 'bull_tp_mult': 2.376889072441542, 'bull_tsl_mult': 0.25076591797685277, 'bull_time_stop': 37, 'bull_use_sma': True, 'bull_use_ema': True, 'bull_use_atr': False, 'bull_use_adx': True, 'bull_use_spike': False, 'bull_rsi_required': True, 'bear_strategy': 'mean_reversion', 'bear_bb_std_mult': 3.132453761901167, 'bear_rsi_os': 42, 'bear_rsi_ob': 76, 'bear_adx_thresh': 18.82417199789202, 'bear_atr_min_pct': 0.023761777947438383, 'bear_atr_max_pct': 0.09338038775633523, 'bear_tp_mult': 1.7821053705623657, 'bear_tsl_mult': 0.6636350331314074, 'bear_time_stop': 258, 'bear_use_sma': False, 'bear_use_ema': False, 'bear_use_atr': True, 'bear_use_adx': False, 'bear_use_spike': True, 'bear_rsi_required': False, 'sideways_strategy': 'breakout', 'sideways_bb_std_mult': 0.563845272392359, 'sideways_rsi_os': 55, 'sideways_rsi_ob': 45, 'sideways_adx_thresh': 18.320607868472827, 'sideways_atr_min_pct': 0.0008104391150591164, 'sideways_atr_max_pct': 0.11661784642269342, 'sideways_tp_mult': 2.5947656280692057, 'sideways_tsl_mult': 0.6290775790001757, 'sideways_time_stop': 271, 'sideways_use_sma': False, 'sideways_use_ema': True, 'sideways_use_atr': False, 'sideways_use_adx': True, 'sideways_use_spike': False, 'sideways_rsi_required': False}.
[I 2025-08-30 15:36:30,166] Trial 140 finished with values: [-1000000000.0, 1000000000.0] and parameters: {'p_sma': 29, 'p_std': 13, 'p_atr': 15, 'p_adx': 24, 'rsi_period': 71, 'ema1': 27, 'ema2': 25, 'slip_atr_k': 0.109890120439682, 'slip_spread_k': 0.1974591062923035, 'spread_hl_frac': 0.0003398877025019009, 'bb_std_mult': 3.159782752955887, 'rsi_os': 27, 'rsi_ob': 46, 'vol_spike': 0.29989542433347177, 'adx_thresh': 15.973243255839032, 'atr_min_pct': 0.0014227453850929827, 'atr_max_pct': 0.016374259253355908, 'tp_mult': 1.8598457054774242, 'tsl_mult': 0.7383175340357646, 'strategy': 'mean_reversion', 'time_stop': 257, 'use_sma': False, 'use_atr': False, 'use_adx': True, 'use_ema': False, 'use_spike': False, 'rsi_required': True, 'edge_k': 0.38911210438302724, 'edge_cap': 0.3963400536062589, 'bull_strategy': 'mean_reversion', 'bull_bb_std_mult': 1.4021529139913724, 'bull_rsi_os': 20, 'bull_rsi_ob': 90, 'bull_adx_thresh': 33.697060490284755, 'bull_atr_min_pct': 0.008939353125052925, 'bull_atr_max_pct': 0.10409451856500586, 'bull_tp_mult': 1.743211155336309, 'bull_tsl_mult': 0.24374173973852603, 'bull_time_stop': 16, 'bull_use_sma': False, 'bull_use_ema': True, 'bull_use_atr': True, 'bull_use_adx': True, 'bull_use_spike': False, 'bull_rsi_required': True, 'bear_strategy': 'mean_reversion', 'bear_bb_std_mult': 2.0690350780389477, 'bear_rsi_os': 39, 'bear_rsi_ob': 95, 'bear_adx_thresh': 19.834844381081624, 'bear_atr_min_pct': 0.01438650151007243, 'bear_atr_max_pct': 0.13849890532231582, 'bear_tp_mult': 2.5907255992795992, 'bear_tsl_mult': 0.5574776384038523, 'bear_time_stop': 271, 'bear_use_sma': True, 'bear_use_ema': False, 'bear_use_atr': True, 'bear_use_adx': True, 'bear_use_spike': False, 'bear_rsi_required': False, 'sideways_strategy': 'mean_reversion', 'sideways_bb_std_mult': 1.7095020675150507, 'sideways_rsi_os': 23, 'sideways_rsi_ob': 55, 'sideways_adx_thresh': 25.719732959198062, 'sideways_atr_min_pct': 0.002624149620861752, 'sideways_atr_max_pct': 0.017922044278934353, 'sideways_tp_mult': 2.5475494383465325, 'sideways_tsl_mult': 0.2245213831761651, 'sideways_time_stop': 196, 'sideways_use_sma': False, 'sideways_use_ema': True, 'sideways_use_atr': True, 'sideways_use_adx': False, 'sideways_use_spike': False, 'sideways_rsi_required': True}.
[I 2025-08-30 15:37:14,112] Trial 141 finished with values: [-1000000000.0, 1000000000.0] and parameters: {'p_sma': 31, 'p_std': 11, 'p_atr': 15, 'p_adx': 27, 'rsi_period': 71, 'ema1': 27, 'ema2': 24, 'slip_atr_k': 0.11069786520615482, 'slip_spread_k': 0.21272839010032812, 'spread_hl_frac': 0.04510262638553389, 'bb_std_mult': 3.137221617777242, 'rsi_os': 10, 'rsi_ob': 79, 'vol_spike': 0.09406437447838811, 'adx_thresh': 16.072762407192076, 'atr_min_pct': 0.0016546580697473154, 'atr_max_pct': 0.03733411087002242, 'tp_mult': 1.1723469613161728, 'tsl_mult': 0.7437495171716526, 'strategy': 'mean_reversion', 'time_stop': 258, 'use_sma': False, 'use_atr': True, 'use_adx': True, 'use_ema': True, 'use_spike': False, 'rsi_required': True, 'edge_k': 0.6274613552075738, 'edge_cap': 0.07145157706596766, 'bull_strategy': 'mean_reversion', 'bull_bb_std_mult': 1.987998343077525, 'bull_rsi_os': 34, 'bull_rsi_ob': 45, 'bull_adx_thresh': 30.16588952356026, 'bull_atr_min_pct': 0.009293712538820598, 'bull_atr_max_pct': 0.025261794609917218, 'bull_tp_mult': 2.482580356337938, 'bull_tsl_mult': 0.6928396874753905, 'bull_time_stop': 21, 'bull_use_sma': False, 'bull_use_ema': False, 'bull_use_atr': True, 'bull_use_adx': True, 'bull_use_spike': True, 'bull_rsi_required': True, 'bear_strategy': 'breakout', 'bear_bb_std_mult': 2.0781322899075687, 'bear_rsi_os': 39, 'bear_rsi_ob': 59, 'bear_adx_thresh': 20.618062274551257, 'bear_atr_min_pct': 0.014377935812329445, 'bear_atr_max_pct': 0.12188510676289122, 'bear_tp_mult': 2.7549235204556823, 'bear_tsl_mult': 0.6101194755164102, 'bear_time_stop': 200, 'bear_use_sma': True, 'bear_use_ema': False, 'bear_use_atr': False, 'bear_use_adx': True, 'bear_use_spike': False, 'bear_rsi_required': True, 'sideways_strategy': 'mean_reversion', 'sideways_bb_std_mult': 1.7298201699100773, 'sideways_rsi_os': 23, 'sideways_rsi_ob': 54, 'sideways_adx_thresh': 12.912790900818084, 'sideways_atr_min_pct': 0.02235388930179899, 'sideways_atr_max_pct': 0.07438959389250814, 'sideways_tp_mult': 2.5461293829535214, 'sideways_tsl_mult': 0.9376287805453727, 'sideways_time_stop': 246, 'sideways_use_sma': False, 'sideways_use_ema': False, 'sideways_use_atr': True, 'sideways_use_adx': False, 'sideways_use_spike': True, 'sideways_rsi_required': True}.
[I 2025-08-30 15:37:14,735] Trial 139 finished with values: [-1000000000.0, 1000000000.0] and parameters: {'p_sma': 20, 'p_std': 11, 'p_atr': 20, 'p_adx': 26, 'rsi_period': 66, 'ema1': 21, 'ema2': 20, 'slip_atr_k': 0.029169730796532622, 'slip_spread_k': 0.8986922674348795, 'spread_hl_frac': 0.04607228630978503, 'bb_std_mult': 3.1703067676469194, 'rsi_os': 32, 'rsi_ob': 79, 'vol_spike': 0.29958267243625947, 'adx_thresh': 15.916231973277565, 'atr_min_pct': 0.0018733971685507447, 'atr_max_pct': 0.019594739352864904, 'tp_mult': 1.347614554018455, 'tsl_mult': 0.30143003622368103, 'strategy': 'mean_reversion', 'time_stop': 214, 'use_sma': False, 'use_atr': True, 'use_adx': True, 'use_ema': False, 'use_spike': False, 'rsi_required': True, 'edge_k': 0.177896258893671, 'edge_cap': 0.737160605063088, 'bull_strategy': 'breakout', 'bull_bb_std_mult': 1.8190481950342892, 'bull_rsi_os': 20, 'bull_rsi_ob': 90, 'bull_adx_thresh': 31.614395054669487, 'bull_atr_min_pct': 0.008251000847775164, 'bull_atr_max_pct': 0.09006026249559097, 'bull_tp_mult': 2.385373492272356, 'bull_tsl_mult': 0.25422963348187405, 'bull_time_stop': 36, 'bull_use_sma': False, 'bull_use_ema': False, 'bull_use_atr': True, 'bull_use_adx': True, 'bull_use_spike': False, 'bull_rsi_required': True, 'bear_strategy': 'mean_reversion', 'bear_bb_std_mult': 2.078855047713134, 'bear_rsi_os': 44, 'bear_rsi_ob': 90, 'bear_adx_thresh': 19.79455289259327, 'bear_atr_min_pct': 0.004273291611006574, 'bear_atr_max_pct': 0.09973388172769644, 'bear_tp_mult': 2.578353330448738, 'bear_tsl_mult': 0.09171026325669285, 'bear_time_stop': 164, 'bear_use_sma': True, 'bear_use_ema': False, 'bear_use_atr': True, 'bear_use_adx': False, 'bear_use_spike': False, 'bear_rsi_required': False, 'sideways_strategy': 'breakout', 'sideways_bb_std_mult': 3.5027067515388897, 'sideways_rsi_os': 9, 'sideways_rsi_ob': 88, 'sideways_adx_thresh': 25.547565369206417, 'sideways_atr_min_pct': 0.023919364276335106, 'sideways_atr_max_pct': 0.039982751971428726, 'sideways_tp_mult': 2.656109666721419, 'sideways_tsl_mult': 0.49181095292381083, 'sideways_time_stop': 68, 'sideways_use_sma': False, 'sideways_use_ema': True, 'sideways_use_atr': True, 'sideways_use_adx': False, 'sideways_use_spike': False, 'sideways_rsi_required': True}.
[I 2025-08-30 15:37:15,253] Trial 137 finished with values: [-0.017474736843122396, 0.01736610125170101] and parameters: {'p_sma': 20, 'p_std': 13, 'p_atr': 21, 'p_adx': 15, 'rsi_period': 71, 'ema1': 27, 'ema2': 33, 'slip_atr_k': 0.022198102894876837, 'slip_spread_k': 0.9423092652251321, 'spread_hl_frac': 0.04508086036899775, 'bb_std_mult': 2.9787509757307014, 'rsi_os': 33, 'rsi_ob': 81, 'vol_spike': 0.2996957609825855, 'adx_thresh': 21.298197204050172, 'atr_min_pct': 0.006118372384392815, 'atr_max_pct': 0.14577077588293252, 'tp_mult': 1.0403190143099992, 'tsl_mult': 0.7282833633822166, 'strategy': 'mean_reversion', 'time_stop': 258, 'use_sma': False, 'use_atr': True, 'use_adx': True, 'use_ema': False, 'use_spike': False, 'rsi_required': False, 'edge_k': 0.4658244307961352, 'edge_cap': 0.4052964173765162, 'bull_strategy': 'breakout', 'bull_bb_std_mult': 1.3891877653042832, 'bull_rsi_os': 21, 'bull_rsi_ob': 89, 'bull_adx_thresh': 33.82990965010177, 'bull_atr_min_pct': 0.0014311302659256626, 'bull_atr_max_pct': 0.025414099985678597, 'bull_tp_mult': 2.3776746517672454, 'bull_tsl_mult': 0.24630058594113136, 'bull_time_stop': 38, 'bull_use_sma': True, 'bull_use_ema': True, 'bull_use_atr': False, 'bull_use_adx': True, 'bull_use_spike': False, 'bull_rsi_required': True, 'bear_strategy': 'mean_reversion', 'bear_bb_std_mult': 2.05884113903446, 'bear_rsi_os': 43, 'bear_rsi_ob': 76, 'bear_adx_thresh': 13.559440524522376, 'bear_atr_min_pct': 0.023631258969390667, 'bear_atr_max_pct': 0.0933313279237242, 'bear_tp_mult': 2.5589549785475225, 'bear_tsl_mult': 0.5755423687098916, 'bear_time_stop': 256, 'bear_use_sma': False, 'bear_use_ema': False, 'bear_use_atr': True, 'bear_use_adx': False, 'bear_use_spike': True, 'bear_rsi_required': False, 'sideways_strategy': 'breakout', 'sideways_bb_std_mult': 1.7352417652198218, 'sideways_rsi_os': 31, 'sideways_rsi_ob': 88, 'sideways_adx_thresh': 18.542753570572035, 'sideways_atr_min_pct': 0.002302590672822135, 'sideways_atr_max_pct': 0.11446896879542805, 'sideways_tp_mult': 2.666131907710522, 'sideways_tsl_mult': 0.9591886609979781, 'sideways_time_stop': 240, 'sideways_use_sma': False, 'sideways_use_ema': True, 'sideways_use_atr': False, 'sideways_use_adx': True, 'sideways_use_spike': False, 'sideways_rsi_required': False}.
[I 2025-08-30 15:37:15,386] Trial 142 finished with values: [-1000000000.0, 1000000000.0] and parameters: {'p_sma': 54, 'p_std': 45, 'p_atr': 21, 'p_adx': 12, 'rsi_period': 66, 'ema1': 9, 'ema2': 23, 'slip_atr_k': 0.027354418467546285, 'slip_spread_k': 0.933889406014772, 'spread_hl_frac': 0.02921869465864882, 'bb_std_mult': 3.0135032659415355, 'rsi_os': 33, 'rsi_ob': 84, 'vol_spike': 0.28945228248559385, 'adx_thresh': 14.30355717475, 'atr_min_pct': 0.027563488971504093, 'atr_max_pct': 0.09543904808857016, 'tp_mult': 1.187523442278463, 'tsl_mult': 0.04883450046512078, 'strategy': 'breakout', 'time_stop': 224, 'use_sma': False, 'use_atr': True, 'use_adx': False, 'use_ema': True, 'use_spike': False, 'rsi_required': True, 'edge_k': 0.46794149580607314, 'edge_cap': 0.0696059415044733, 'bull_strategy': 'breakout', 'bull_bb_std_mult': 2.301681511347827, 'bull_rsi_os': 17, 'bull_rsi_ob': 46, 'bull_adx_thresh': 30.20319178582878, 'bull_atr_min_pct': 0.007866575486780207, 'bull_atr_max_pct': 0.020283528497056138, 'bull_tp_mult': 2.5067345568082393, 'bull_tsl_mult': 0.6946550483174265, 'bull_time_stop': 22, 'bull_use_sma': False, 'bull_use_ema': False, 'bull_use_atr': True, 'bull_use_adx': False, 'bull_use_spike': True, 'bull_rsi_required': True, 'bear_strategy': 'breakout', 'bear_bb_std_mult': 2.0236460871156488, 'bear_rsi_os': 44, 'bear_rsi_ob': 92, 'bear_adx_thresh': 13.602329195327298, 'bear_atr_min_pct': 0.024635676955711974, 'bear_atr_max_pct': 0.09938263429560837, 'bear_tp_mult': 1.5167262781461113, 'bear_tsl_mult': 0.6263712526871654, 'bear_time_stop': 197, 'bear_use_sma': True, 'bear_use_ema': False, 'bear_use_atr': False, 'bear_use_adx': False, 'bear_use_spike': False, 'bear_rsi_required': True, 'sideways_strategy': 'breakout', 'sideways_bb_std_mult': 0.7948831857565386, 'sideways_rsi_os': 15, 'sideways_rsi_ob': 47, 'sideways_adx_thresh': 19.874842041402164, 'sideways_atr_min_pct': 0.002034102980245093, 'sideways_atr_max_pct': 0.03584891983819194, 'sideways_tp_mult': 2.6661238941625305, 'sideways_tsl_mult': 0.25782587078311114, 'sideways_time_stop': 34, 'sideways_use_sma': True, 'sideways_use_ema': False, 'sideways_use_atr': True, 'sideways_use_adx': False, 'sideways_use_spike': True, 'sideways_rsi_required': False}.
[I 2025-08-30 15:38:01,488] Trial 145 finished with values: [-0.016951220962210356, 0.017042703760611358] and parameters: {'p_sma': 21, 'p_std': 14, 'p_atr': 22, 'p_adx': 16, 'rsi_period': 53, 'ema1': 25, 'ema2': 33, 'slip_atr_k': 0.014896762834432213, 'slip_spread_k': 0.101865356380959, 'spread_hl_frac': 0.04991598335694637, 'bb_std_mult': 2.929178667111087, 'rsi_os': 39, 'rsi_ob': 81, 'vol_spike': 0.29174653127366257, 'adx_thresh': 22.79944222383542, 'atr_min_pct': 0.007727951852920478, 'atr_max_pct': 0.14617699302879403, 'tp_mult': 1.090943608202344, 'tsl_mult': 0.5741668011626444, 'strategy': 'breakout', 'time_stop': 260, 'use_sma': False, 'use_atr': True, 'use_adx': False, 'use_ema': False, 'use_spike': True, 'rsi_required': False, 'edge_k': 0.47174432812938344, 'edge_cap': 0.6929317547678019, 'bull_strategy': 'breakout', 'bull_bb_std_mult': 1.3642540343928153, 'bull_rsi_os': 23, 'bull_rsi_ob': 87, 'bull_adx_thresh': 32.698279571384944, 'bull_atr_min_pct': 0.001219816685947877, 'bull_atr_max_pct': 0.0353170260658043, 'bull_tp_mult': 2.561879866975112, 'bull_tsl_mult': 0.27998783532137655, 'bull_time_stop': 67, 'bull_use_sma': True, 'bull_use_ema': True, 'bull_use_atr': False, 'bull_use_adx': False, 'bull_use_spike': False, 'bull_rsi_required': True, 'bear_strategy': 'mean_reversion', 'bear_bb_std_mult': 2.308738112279763, 'bear_rsi_os': 46, 'bear_rsi_ob': 81, 'bear_adx_thresh': 13.22826050495915, 'bear_atr_min_pct': 0.02498782880105226, 'bear_atr_max_pct': 0.08401112148970011, 'bear_tp_mult': 2.39582270972132, 'bear_tsl_mult': 0.5847677700573994, 'bear_time_stop': 256, 'bear_use_sma': False, 'bear_use_ema': False, 'bear_use_atr': True, 'bear_use_adx': False, 'bear_use_spike': True, 'bear_rsi_required': False, 'sideways_strategy': 'breakout', 'sideways_bb_std_mult': 3.166422845679385, 'sideways_rsi_os': 30, 'sideways_rsi_ob': 93, 'sideways_adx_thresh': 16.827946664172693, 'sideways_atr_min_pct': 0.00216407317300499, 'sideways_atr_max_pct': 0.10246238293054605, 'sideways_tp_mult': 2.728857819297699, 'sideways_tsl_mult': 0.961495928724525, 'sideways_time_stop': 239, 'sideways_use_sma': True, 'sideways_use_ema': True, 'sideways_use_atr': False, 'sideways_use_adx': True, 'sideways_use_spike': False, 'sideways_rsi_required': False}.
