[I 2025-08-30 17:18:51,266] Trial 709 finished with values: [-1000000000.0, 1000000000.0] and parameters: {'p_sma': 7, 'p_std': 43, 'p_atr': 8, 'p_adx': 9, 'rsi_period': 43, 'ema1': 17, 'ema2': 43, 'slip_atr_k': 0.011898463051789938, 'slip_spread_k': 0.9321718900870071, 'spread_hl_frac': 0.036508248265516526, 'bb_std_mult': 2.301756252961119, 'rsi_os': 34, 'rsi_ob': 85, 'vol_spike': 0.06992642975177418, 'adx_thresh': 9.651111044054838, 'atr_min_pct': 0.021587800349393366, 'atr_max_pct': 0.1045763182024746, 'tp_mult': 1.6469439618378816, 'tsl_mult': 0.9141481239697304, 'strategy': 'mean_reversion', 'time_stop': 250, 'use_sma': False, 'use_atr': False, 'use_adx': False, 'use_ema': False, 'use_spike': False, 'rsi_required': True, 'edge_k': 0.745048492893988, 'edge_cap': 0.9690705805407118, 'bull_strategy': 'mean_reversion', 'bull_bb_std_mult': 1.8389763358324736, 'bull_rsi_os': 33, 'bull_rsi_ob': 84, 'bull_adx_thresh': 34.970141613489766, 'bull_atr_min_pct': 0.02140871342554776, 'bull_atr_max_pct': 0.13671761404795627, 'bull_tp_mult': 2.2442624447544617, 'bull_tsl_mult': 0.8389705586184575, 'bull_time_stop': 133, 'bull_use_sma': True, 'bull_use_ema': True, 'bull_use_atr': False, 'bull_use_adx': False, 'bull_use_spike': False, 'bull_rsi_required': False, 'bear_strategy': 'mean_reversion', 'bear_bb_std_mult': 1.7948503923715642, 'bear_rsi_os': 15, 'bear_rsi_ob': 58, 'bear_adx_thresh': 11.87618561747455, 'bear_atr_min_pct': 0.01683250142811901, 'bear_atr_max_pct': 0.11461923356551033, 'bear_tp_mult': 2.2242888595689045, 'bear_tsl_mult': 0.28347466017633416, 'bear_time_stop': 140, 'bear_use_sma': True, 'bear_use_ema': False, 'bear_use_atr': False, 'bear_use_adx': False, 'bear_use_spike': False, 'bear_rsi_required': False, 'sideways_strategy': 'mean_reversion', 'sideways_bb_std_mult': 0.7696036771062943, 'sideways_rsi_os': 34, 'sideways_rsi_ob': 91, 'sideways_adx_thresh': 9.547613766827558, 'sideways_atr_min_pct': 0.02076232771478577, 'sideways_atr_max_pct': 0.09975138498718364, 'sideways_tp_mult': 2.369987134225179, 'sideways_tsl_mult': 0.4267793628972234, 'sideways_time_stop': 276, 'sideways_use_sma': False, 'sideways_use_ema': False, 'sideways_use_atr': False, 'sideways_use_adx': False, 'sideways_use_spike': False, 'sideways_rsi_required': True}.
[I 2025-08-30 17:18:52,471] Trial 712 finished with values: [-1000000000.0, 1000000000.0] and parameters: {'p_sma': 6, 'p_std': 22, 'p_atr': 16, 'p_adx': 9, 'rsi_period': 21, 'ema1': 17, 'ema2': 12, 'slip_atr_k': 0.019800919598299632, 'slip_spread_k': 0.826873241799492, 'spread_hl_frac': 0.018894197058886498, 'bb_std_mult': 3.3976660288608045, 'rsi_os': 34, 'rsi_ob': 47, 'vol_spike': 0.06844826395622405, 'adx_thresh': 11.439845225350725, 'atr_min_pct': 0.003930352774210319, 'atr_max_pct': 0.11838077619722609, 'tp_mult': 2.8023536927053745, 'tsl_mult': 0.9104021038659047, 'strategy': 'mean_reversion', 'time_stop': 24, 'use_sma': False, 'use_atr': True, 'use_adx': True, 'use_ema': False, 'use_spike': False, 'rsi_required': True, 'edge_k': 0.7468739404427813, 'edge_cap': 0.8332288123546961, 'bull_strategy': 'mean_reversion', 'bull_bb_std_mult': 1.8362776745301794, 'bull_rsi_os': 49, 'bull_rsi_ob': 63, 'bull_adx_thresh': 33.61243162653417, 'bull_atr_min_pct': 0.021249305423836747, 'bull_atr_max_pct': 0.1430353131500037, 'bull_tp_mult': 2.241487245564951, 'bull_tsl_mult': 0.4809852633738324, 'bull_time_stop': 50, 'bull_use_sma': True, 'bull_use_ema': True, 'bull_use_atr': False, 'bull_use_adx': True, 'bull_use_spike': False, 'bull_rsi_required': False, 'bear_strategy': 'mean_reversion', 'bear_bb_std_mult': 1.7882119811456862, 'bear_rsi_os': 19, 'bear_rsi_ob': 61, 'bear_adx_thresh': 12.495459671640033, 'bear_atr_min_pct': 0.019603425537862863, 'bear_atr_max_pct': 0.10944207852834816, 'bear_tp_mult': 2.1626931657776858, 'bear_tsl_mult': 0.6323155809194377, 'bear_time_stop': 138, 'bear_use_sma': True, 'bear_use_ema': False, 'bear_use_atr': False, 'bear_use_adx': False, 'bear_use_spike': False, 'bear_rsi_required': False, 'sideways_strategy': 'breakout', 'sideways_bb_std_mult': 0.623983808506966, 'sideways_rsi_os': 13, 'sideways_rsi_ob': 90, 'sideways_adx_thresh': 10.716574596953363, 'sideways_atr_min_pct': 0.0011652923253483143, 'sideways_atr_max_pct': 0.09500777269336082, 'sideways_tp_mult': 2.6248621016614653, 'sideways_tsl_mult': 0.4397812203677435, 'sideways_time_stop': 279, 'sideways_use_sma': True, 'sideways_use_ema': False, 'sideways_use_atr': False, 'sideways_use_adx': False, 'sideways_use_spike': False, 'sideways_rsi_required': True}.
[I 2025-08-30 17:19:28,762] Trial 714 finished with values: [-1000000000.0, 1000000000.0] and parameters: {'p_sma': 47, 'p_std': 22, 'p_atr': 17, 'p_adx': 18, 'rsi_period': 21, 'ema1': 18, 'ema2': 12, 'slip_atr_k': 0.10631121823457501, 'slip_spread_k': 0.20484730614691682, 'spread_hl_frac': 0.017315133112875275, 'bb_std_mult': 3.4280169241911413, 'rsi_os': 31, 'rsi_ob': 88, 'vol_spike': 0.11079148016066988, 'adx_thresh': 8.58702850029425, 'atr_min_pct': 0.026489526205768575, 'atr_max_pct': 0.14212640110830194, 'tp_mult': 2.8133005239004683, 'tsl_mult': 0.05275729146551866, 'strategy': 'mean_reversion', 'time_stop': 36, 'use_sma': False, 'use_atr': True, 'use_adx': True, 'use_ema': False, 'use_spike': False, 'rsi_required': True, 'edge_k': 1.0913105284942126, 'edge_cap': 0.7131536888345126, 'bull_strategy': 'mean_reversion', 'bull_bb_std_mult': 1.8754954970177398, 'bull_rsi_os': 31, 'bull_rsi_ob': 63, 'bull_adx_thresh': 33.90576379791246, 'bull_atr_min_pct': 0.022167843072563077, 'bull_atr_max_pct': 0.14986544689506945, 'bull_tp_mult': 2.304901420548793, 'bull_tsl_mult': 0.7817225654717221, 'bull_time_stop': 83, 'bull_use_sma': True, 'bull_use_ema': True, 'bull_use_atr': False, 'bull_use_adx': True, 'bull_use_spike': False, 'bull_rsi_required': False, 'bear_strategy': 'mean_reversion', 'bear_bb_std_mult': 1.2494133012232889, 'bear_rsi_os': 24, 'bear_rsi_ob': 77, 'bear_adx_thresh': 16.734882617455213, 'bear_atr_min_pct': 0.024618737784599755, 'bear_atr_max_pct': 0.10825144204644627, 'bear_tp_mult': 2.1624484121305434, 'bear_tsl_mult': 0.6323481903455236, 'bear_time_stop': 51, 'bear_use_sma': True, 'bear_use_ema': False, 'bear_use_atr': False, 'bear_use_adx': False, 'bear_use_spike': False, 'bear_rsi_required': False, 'sideways_strategy': 'breakout', 'sideways_bb_std_mult': 2.6166687746117883, 'sideways_rsi_os': 13, 'sideways_rsi_ob': 77, 'sideways_adx_thresh': 7.204830296749535, 'sideways_atr_min_pct': 0.0011664934962987462, 'sideways_atr_max_pct': 0.11462053870527408, 'sideways_tp_mult': 2.9027897404821865, 'sideways_tsl_mult': 0.7370952937569236, 'sideways_time_stop': 295, 'sideways_use_sma': True, 'sideways_use_ema': False, 'sideways_use_atr': False, 'sideways_use_adx': False, 'sideways_use_spike': False, 'sideways_rsi_required': True}.
[I 2025-08-30 17:19:28,763] Trial 715 finished with values: [-0.04710070309104197, 0.047009274881230446] and parameters: {'p_sma': 5, 'p_std': 22, 'p_atr': 11, 'p_adx': 18, 'rsi_period': 21, 'ema1': 18, 'ema2': 12, 'slip_atr_k': 0.17561878002627948, 'slip_spread_k': 0.19966853875286034, 'spread_hl_frac': 0.017286352514943138, 'bb_std_mult': 3.2073681025868366, 'rsi_os': 31, 'rsi_ob': 86, 'vol_spike': 0.08766024866168952, 'adx_thresh': 8.432682980275448, 'atr_min_pct': 0.013519731646196116, 'atr_max_pct': 0.14281331789613533, 'tp_mult': 2.8072591407061407, 'tsl_mult': 0.9844043976325522, 'strategy': 'mean_reversion', 'time_stop': 115, 'use_sma': False, 'use_atr': True, 'use_adx': True, 'use_ema': False, 'use_spike': False, 'rsi_required': True, 'edge_k': 0.9761251700913745, 'edge_cap': 0.8519237202345012, 'bull_strategy': 'mean_reversion', 'bull_bb_std_mult': 1.8841355339764525, 'bull_rsi_os': 13, 'bull_rsi_ob': 67, 'bull_adx_thresh': 34.98625985112586, 'bull_atr_min_pct': 0.02210981782515626, 'bull_atr_max_pct': 0.14396098127366375, 'bull_tp_mult': 2.0085406856519143, 'bull_tsl_mult': 0.8973786128324417, 'bull_time_stop': 247, 'bull_use_sma': True, 'bull_use_ema': True, 'bull_use_atr': False, 'bull_use_adx': True, 'bull_use_spike': False, 'bull_rsi_required': False, 'bear_strategy': 'mean_reversion', 'bear_bb_std_mult': 1.0024600196811906, 'bear_rsi_os': 24, 'bear_rsi_ob': 77, 'bear_adx_thresh': 16.862276153987022, 'bear_atr_min_pct': 0.019907761365106465, 'bear_atr_max_pct': 0.03782180161386632, 'bear_tp_mult': 2.160934895040236, 'bear_tsl_mult': 0.633856663903335, 'bear_time_stop': 211, 'bear_use_sma': True, 'bear_use_ema': False, 'bear_use_atr': False, 'bear_use_adx': False, 'bear_use_spike': False, 'bear_rsi_required': False, 'sideways_strategy': 'breakout', 'sideways_bb_std_mult': 0.5691310940175922, 'sideways_rsi_os': 36, 'sideways_rsi_ob': 49, 'sideways_adx_thresh': 10.93024979066453, 'sideways_atr_min_pct': 0.0009258106480890435, 'sideways_atr_max_pct': 0.09432978461668451, 'sideways_tp_mult': 2.9003630496178663, 'sideways_tsl_mult': 0.4459734207219409, 'sideways_time_stop': 69, 'sideways_use_sma': True, 'sideways_use_ema': False, 'sideways_use_atr': False, 'sideways_use_adx': False, 'sideways_use_spike': False, 'sideways_rsi_required': True}.
[I 2025-08-30 17:19:29,065] Trial 713 finished with values: [-1000000000.0, 1000000000.0] and parameters: {'p_sma': 40, 'p_std': 21, 'p_atr': 17, 'p_adx': 18, 'rsi_period': 21, 'ema1': 17, 'ema2': 11, 'slip_atr_k': 0.22268929764429116, 'slip_spread_k': 0.18787045271589464, 'spread_hl_frac': 0.007432817661484788, 'bb_std_mult': 3.2048990906252808, 'rsi_os': 32, 'rsi_ob': 88, 'vol_spike': 0.11068805510390274, 'adx_thresh': 8.571963236960165, 'atr_min_pct': 0.0018343768456852618, 'atr_max_pct': 0.14236351307180764, 'tp_mult': 2.203070769500954, 'tsl_mult': 0.9086145227467347, 'strategy': 'mean_reversion', 'time_stop': 116, 'use_sma': False, 'use_atr': True, 'use_adx': True, 'use_ema': False, 'use_spike': False, 'rsi_required': True, 'edge_k': 1.0758920718957592, 'edge_cap': 0.33911958673409354, 'bull_strategy': 'mean_reversion', 'bull_bb_std_mult': 1.837650612509862, 'bull_rsi_os': 33, 'bull_rsi_ob': 84, 'bull_adx_thresh': 34.96299078233755, 'bull_atr_min_pct': 0.022121376133246603, 'bull_atr_max_pct': 0.14982540678283413, 'bull_tp_mult': 2.2394373020930387, 'bull_tsl_mult': 0.08430949563273771, 'bull_time_stop': 81, 'bull_use_sma': True, 'bull_use_ema': True, 'bull_use_atr': False, 'bull_use_adx': True, 'bull_use_spike': False, 'bull_rsi_required': False, 'bear_strategy': 'mean_reversion', 'bear_bb_std_mult': 1.246340414707007, 'bear_rsi_os': 17, 'bear_rsi_ob': 93, 'bear_adx_thresh': 12.377228277487438, 'bear_atr_min_pct': 0.02091640556408689, 'bear_atr_max_pct': 0.11552494881771938, 'bear_tp_mult': 1.7905990074875553, 'bear_tsl_mult': 0.6355804888056422, 'bear_time_stop': 207, 'bear_use_sma': True, 'bear_use_ema': False, 'bear_use_atr': False, 'bear_use_adx': False, 'bear_use_spike': False, 'bear_rsi_required': False, 'sideways_strategy': 'mean_reversion', 'sideways_bb_std_mult': 0.5936929652135694, 'sideways_rsi_os': 13, 'sideways_rsi_ob': 90, 'sideways_adx_thresh': 10.769442412088758, 'sideways_atr_min_pct': 0.0011033306742914842, 'sideways_atr_max_pct': 0.10001532994246733, 'sideways_tp_mult': 2.5932468087003504, 'sideways_tsl_mult': 0.030284660075980963, 'sideways_time_stop': 295, 'sideways_use_sma': False, 'sideways_use_ema': False, 'sideways_use_atr': False, 'sideways_use_adx': False, 'sideways_use_spike': False, 'sideways_rsi_required': True}.
[I 2025-08-30 17:19:30,004] Trial 716 finished with values: [-1000000000.0, 1000000000.0] and parameters: {'p_sma': 6, 'p_std': 24, 'p_atr': 11, 'p_adx': 14, 'rsi_period': 46, 'ema1': 18, 'ema2': 10, 'slip_atr_k': 0.0687918464298024, 'slip_spread_k': 0.15804687690056118, 'spread_hl_frac': 0.017357918363373494, 'bb_std_mult': 3.1086529114354304, 'rsi_os': 32, 'rsi_ob': 88, 'vol_spike': 0.10964800629170236, 'adx_thresh': 8.709752185214077, 'atr_min_pct': 0.019830076460895813, 'atr_max_pct': 0.1420399840521553, 'tp_mult': 2.3809154036846096, 'tsl_mult': 0.9437539075986676, 'strategy': 'mean_reversion', 'time_stop': 115, 'use_sma': False, 'use_atr': True, 'use_adx': True, 'use_ema': False, 'use_spike': False, 'rsi_required': True, 'edge_k': 0.3918066928438241, 'edge_cap': 0.8389970036648631, 'bull_strategy': 'mean_reversion', 'bull_bb_std_mult': 1.8862578080290693, 'bull_rsi_os': 13, 'bull_rsi_ob': 95, 'bull_adx_thresh': 34.984887533154115, 'bull_atr_min_pct': 0.022310589745012425, 'bull_atr_max_pct': 0.10686268247395729, 'bull_tp_mult': 2.4610725763277284, 'bull_tsl_mult': 0.09488782425578779, 'bull_time_stop': 83, 'bull_use_sma': True, 'bull_use_ema': True, 'bull_use_atr': False, 'bull_use_adx': True, 'bull_use_spike': False, 'bull_rsi_required': False, 'bear_strategy': 'mean_reversion', 'bear_bb_std_mult': 1.2665932153241277, 'bear_rsi_os': 24, 'bear_rsi_ob': 55, 'bear_adx_thresh': 33.15421860623597, 'bear_atr_min_pct': 0.02463068609165807, 'bear_atr_max_pct': 0.13307198348499047, 'bear_tp_mult': 2.162554863835359, 'bear_tsl_mult': 0.05664431589577146, 'bear_time_stop': 210, 'bear_use_sma': True, 'bear_use_ema': True, 'bear_use_atr': False, 'bear_use_adx': False, 'bear_use_spike': False, 'bear_rsi_required': False, 'sideways_strategy': 'breakout', 'sideways_bb_std_mult': 3.340568637536745, 'sideways_rsi_os': 5, 'sideways_rsi_ob': 92, 'sideways_adx_thresh': 11.277956842386214, 'sideways_atr_min_pct': 0.0012962483316089177, 'sideways_atr_max_pct': 0.043317856360647555, 'sideways_tp_mult': 2.8880938060944548, 'sideways_tsl_mult': 0.5924776049575418, 'sideways_time_stop': 253, 'sideways_use_sma': True, 'sideways_use_ema': False, 'sideways_use_atr': False, 'sideways_use_adx': False, 'sideways_use_spike': False, 'sideways_rsi_required': True}.
[I 2025-08-30 17:19:31,035] Trial 719 finished with values: [-1000000000.0, 1000000000.0] and parameters: {'p_sma': 20, 'p_std': 49, 'p_atr': 15, 'p_adx': 8, 'rsi_period': 48, 'ema1': 19, 'ema2': 10, 'slip_atr_k': 0.2498141817740081, 'slip_spread_k': 0.15786149754615178, 'spread_hl_frac': 0.021183706097484926, 'bb_std_mult': 3.1131113294418196, 'rsi_os': 33, 'rsi_ob': 48, 'vol_spike': 0.09434821894779447, 'adx_thresh': 25.040774345544563, 'atr_min_pct': 0.01857593865141197, 'atr_max_pct': 0.09325083772422424, 'tp_mult': 2.2876133905002276, 'tsl_mult': 0.9347485052188658, 'strategy': 'mean_reversion', 'time_stop': 49, 'use_sma': False, 'use_atr': True, 'use_adx': True, 'use_ema': False, 'use_spike': False, 'rsi_required': True, 'edge_k': 0.3796397494201771, 'edge_cap': 0.8891339579248447, 'bull_strategy': 'mean_reversion', 'bull_bb_std_mult': 3.5139251852986875, 'bull_rsi_os': 12, 'bull_rsi_ob': 95, 'bull_adx_thresh': 32.724382968404825, 'bull_atr_min_pct': 0.02346432003921043, 'bull_atr_max_pct': 0.06423933019338612, 'bull_tp_mult': 2.4739554933120296, 'bull_tsl_mult': 0.8291220048251068, 'bull_time_stop': 59, 'bull_use_sma': True, 'bull_use_ema': True, 'bull_use_atr': False, 'bull_use_adx': True, 'bull_use_spike': False, 'bull_rsi_required': False, 'bear_strategy': 'mean_reversion', 'bear_bb_std_mult': 1.597925052059304, 'bear_rsi_os': 28, 'bear_rsi_ob': 75, 'bear_adx_thresh': 19.019430930868012, 'bear_atr_min_pct': 0.0012181930009651561, 'bear_atr_max_pct': 0.021158126311692622, 'bear_tp_mult': 2.001653747991311, 'bear_tsl_mult': 0.32500962812704304, 'bear_time_stop': 290, 'bear_use_sma': True, 'bear_use_ema': True, 'bear_use_atr': False, 'bear_use_adx': False, 'bear_use_spike': False, 'bear_rsi_required': False, 'sideways_strategy': 'breakout', 'sideways_bb_std_mult': 0.9803872290450364, 'sideways_rsi_os': 55, 'sideways_rsi_ob': 93, 'sideways_adx_thresh': 11.630806158796897, 'sideways_atr_min_pct': 0.011356157436552976, 'sideways_atr_max_pct': 0.060397391847181486, 'sideways_tp_mult': 2.958493803947192, 'sideways_tsl_mult': 0.1926760485359887, 'sideways_time_stop': 255, 'sideways_use_sma': True, 'sideways_use_ema': False, 'sideways_use_atr': False, 'sideways_use_adx': False, 'sideways_use_spike': False, 'sideways_rsi_required': True}.
[I 2025-08-30 17:20:10,765] Trial 718 finished with values: [-0.03259639106095835, 0.03246449567919732] and parameters: {'p_sma': 20, 'p_std': 51, 'p_atr': 15, 'p_adx': 8, 'rsi_period': 20, 'ema1': 14, 'ema2': 10, 'slip_atr_k': 0.24951352417351325, 'slip_spread_k': 0.15870072023425702, 'spread_hl_frac': 0.006092490119301044, 'bb_std_mult': 3.1191450595492554, 'rsi_os': 10, 'rsi_ob': 61, 'vol_spike': 0.09496638521681156, 'adx_thresh': 18.709901821199384, 'atr_min_pct': 0.01658623218862871, 'atr_max_pct': 0.1456141459490951, 'tp_mult': 2.2028065412348, 'tsl_mult': 0.9431899857111156, 'strategy': 'mean_reversion', 'time_stop': 60, 'use_sma': False, 'use_atr': True, 'use_adx': True, 'use_ema': False, 'use_spike': False, 'rsi_required': True, 'edge_k': 0.36322007579238913, 'edge_cap': 0.793902445768341, 'bull_strategy': 'mean_reversion', 'bull_bb_std_mult': 2.0098318238846584, 'bull_rsi_os': 11, 'bull_rsi_ob': 54, 'bull_adx_thresh': 26.76025896686181, 'bull_atr_min_pct': 0.005976578304186367, 'bull_atr_max_pct': 0.10035355239824743, 'bull_tp_mult': 2.27530616689088, 'bull_tsl_mult': 0.07883621614354913, 'bull_time_stop': 60, 'bull_use_sma': True, 'bull_use_ema': True, 'bull_use_atr': False, 'bull_use_adx': True, 'bull_use_spike': False, 'bull_rsi_required': False, 'bear_strategy': 'mean_reversion', 'bear_bb_std_mult': 1.6300467788349748, 'bear_rsi_os': 14, 'bear_rsi_ob': 75, 'bear_adx_thresh': 21.498253361169095, 'bear_atr_min_pct': 0.0037051854508122865, 'bear_atr_max_pct': 0.1356324762368071, 'bear_tp_mult': 1.5348525961364443, 'bear_tsl_mult': 0.3259860882198531, 'bear_time_stop': 201, 'bear_use_sma': True, 'bear_use_ema': True, 'bear_use_atr': False, 'bear_use_adx': False, 'bear_use_spike': False, 'bear_rsi_required': False, 'sideways_strategy': 'breakout', 'sideways_bb_std_mult': 3.335442953327636, 'sideways_rsi_os': 30, 'sideways_rsi_ob': 72, 'sideways_adx_thresh': 11.499448497136118, 'sideways_atr_min_pct': 0.001961467940143008, 'sideways_atr_max_pct': 0.11855424402573374, 'sideways_tp_mult': 2.9564770118654873, 'sideways_tsl_mult': 0.8113263566681428, 'sideways_time_stop': 259, 'sideways_use_sma': True, 'sideways_use_ema': False, 'sideways_use_atr': False, 'sideways_use_adx': False, 'sideways_use_spike': False, 'sideways_rsi_required': True}.
[I 2025-08-30 17:20:11,345] Trial 717 finished with values: [-1000000000.0, 1000000000.0] and parameters: {'p_sma': 8, 'p_std': 51, 'p_atr': 15, 'p_adx': 8, 'rsi_period': 20, 'ema1': 19, 'ema2': 10, 'slip_atr_k': 0.24966279227455518, 'slip_spread_k': 0.7715372029871715, 'spread_hl_frac': 0.0016489957629310797, 'bb_std_mult': 3.108490143819595, 'rsi_os': 33, 'rsi_ob': 84, 'vol_spike': 0.09227909156029387, 'adx_thresh': 24.871950600413612, 'atr_min_pct': 0.001564786550893293, 'atr_max_pct': 0.08071447769935262, 'tp_mult': 2.735386973934075, 'tsl_mult': 0.28650913455103266, 'strategy': 'mean_reversion', 'time_stop': 221, 'use_sma': False, 'use_atr': True, 'use_adx': True, 'use_ema': False, 'use_spike': False, 'rsi_required': True, 'edge_k': 0.37443330574915445, 'edge_cap': 0.4701411086346097, 'bull_strategy': 'mean_reversion', 'bull_bb_std_mult': 2.018452970761972, 'bull_rsi_os': 12, 'bull_rsi_ob': 54, 'bull_adx_thresh': 34.43080340190202, 'bull_atr_min_pct': 0.011891916447224277, 'bull_atr_max_pct': 0.0728964171201005, 'bull_tp_mult': 2.2768865659792907, 'bull_tsl_mult': 0.8262369424897638, 'bull_time_stop': 31, 'bull_use_sma': True, 'bull_use_ema': True, 'bull_use_atr': False, 'bull_use_adx': True, 'bull_use_spike': False, 'bull_rsi_required': False, 'bear_strategy': 'mean_reversion', 'bear_bb_std_mult': 1.5653454797658188, 'bear_rsi_os': 17, 'bear_rsi_ob': 75, 'bear_adx_thresh': 18.90039534427909, 'bear_atr_min_pct': 0.017905500249570584, 'bear_atr_max_pct': 0.10002372877618106, 'bear_tp_mult': 1.7858485795710304, 'bear_tsl_mult': 0.9380017855883509, 'bear_time_stop': 291, 'bear_use_sma': True, 'bear_use_ema': True, 'bear_use_atr': False, 'bear_use_adx': False, 'bear_use_spike': False, 'bear_rsi_required': False, 'sideways_strategy': 'breakout', 'sideways_bb_std_mult': 0.7540324900794881, 'sideways_rsi_os': 43, 'sideways_rsi_ob': 93, 'sideways_adx_thresh': 11.477883806326792, 'sideways_atr_min_pct': 0.02536031085713267, 'sideways_atr_max_pct': 0.03583063798448175, 'sideways_tp_mult': 2.9560074033131065, 'sideways_tsl_mult': 0.36011766355756314, 'sideways_time_stop': 260, 'sideways_use_sma': True, 'sideways_use_ema': False, 'sideways_use_atr': False, 'sideways_use_adx': False, 'sideways_use_spike': False, 'sideways_rsi_required': True}.
