[I 2025-08-30 17:43:45,829] Trial 872 finished with values: [-1000000000.0, 1000000000.0] and parameters: {'p_sma': 8, 'p_std': 22, 'p_atr': 16, 'p_adx': 7, 'rsi_period': 22, 'ema1': 18, 'ema2': 12, 'slip_atr_k': 0.23378145020065433, 'slip_spread_k': 0.194489849278427, 'spread_hl_frac': 0.0100458296024387, 'bb_std_mult': 1.9135759930253315, 'rsi_os': 34, 'rsi_ob': 87, 'vol_spike': 0.19936970306546853, 'adx_thresh': 12.48995856271766, 'atr_min_pct': 0.02042704060893536, 'atr_max_pct': 0.14140085970597677, 'tp_mult': 1.20112860528707, 'tsl_mult': 0.8908935177382749, 'strategy': 'mean_reversion', 'time_stop': 270, 'use_sma': False, 'use_atr': False, 'use_adx': True, 'use_ema': False, 'use_spike': False, 'rsi_required': False, 'edge_k': 0.46331301818771553, 'edge_cap': 0.8955318280139876, 'bull_strategy': 'mean_reversion', 'bull_bb_std_mult': 1.5378345944364264, 'bull_rsi_os': 11, 'bull_rsi_ob': 56, 'bull_adx_thresh': 7.005625698780346, 'bull_atr_min_pct': 0.016468825258896327, 'bull_atr_max_pct': 0.021954528603164408, 'bull_tp_mult': 2.58365571137245, 'bull_tsl_mult': 0.0828467470244339, 'bull_time_stop': 80, 'bull_use_sma': True, 'bull_use_ema': True, 'bull_use_atr': False, 'bull_use_adx': False, 'bull_use_spike': True, 'bull_rsi_required': False, 'bear_strategy': 'mean_reversion', 'bear_bb_std_mult': 1.7311218747194472, 'bear_rsi_os': 17, 'bear_rsi_ob': 77, 'bear_adx_thresh': 13.633393498467123, 'bear_atr_min_pct': 0.0010383389847529612, 'bear_atr_max_pct': 0.05272732708370091, 'bear_tp_mult': 1.3714619346947525, 'bear_tsl_mult': 0.6698631217717875, 'bear_time_stop': 216, 'bear_use_sma': True, 'bear_use_ema': False, 'bear_use_atr': False, 'bear_use_adx': True, 'bear_use_spike': True, 'bear_rsi_required': True, 'sideways_strategy': 'breakout', 'sideways_bb_std_mult': 0.6797366916000935, 'sideways_rsi_os': 32, 'sideways_rsi_ob': 61, 'sideways_adx_thresh': 22.762612494133823, 'sideways_atr_min_pct': 0.0020800833511289514, 'sideways_atr_max_pct': 0.04136205238648812, 'sideways_tp_mult': 2.9727953081107126, 'sideways_tsl_mult': 0.4439737941610546, 'sideways_time_stop': 5, 'sideways_use_sma': True, 'sideways_use_ema': False, 'sideways_use_atr': False, 'sideways_use_adx': False, 'sideways_use_spike': True, 'sideways_rsi_required': True}.
[I 2025-08-30 17:44:23,896] Trial 874 finished with values: [-1000000000.0, 1000000000.0] and parameters: {'p_sma': 5, 'p_std': 31, 'p_atr': 16, 'p_adx': 9, 'rsi_period': 39, 'ema1': 11, 'ema2': 21, 'slip_atr_k': 0.08853543317005896, 'slip_spread_k': 0.21732140012643758, 'spread_hl_frac': 0.020589709451523497, 'bb_std_mult': 1.905449690214034, 'rsi_os': 34, 'rsi_ob': 88, 'vol_spike': 0.15369236629310898, 'adx_thresh': 11.42182406706415, 'atr_min_pct': 0.01967221393546041, 'atr_max_pct': 0.14772607001196317, 'tp_mult': 1.197126622036601, 'tsl_mult': 0.895868955279803, 'strategy': 'breakout', 'time_stop': 39, 'use_sma': False, 'use_atr': False, 'use_adx': True, 'use_ema': False, 'use_spike': False, 'rsi_required': False, 'edge_k': 0.4585676148040132, 'edge_cap': 0.8948793559191568, 'bull_strategy': 'mean_reversion', 'bull_bb_std_mult': 1.8123127975747053, 'bull_rsi_os': 13, 'bull_rsi_ob': 51, 'bull_adx_thresh': 34.53798614903577, 'bull_atr_min_pct': 0.009909745980724808, 'bull_atr_max_pct': 0.14245202775673713, 'bull_tp_mult': 2.4918982957595737, 'bull_tsl_mult': 0.819387837841402, 'bull_time_stop': 222, 'bull_use_sma': True, 'bull_use_ema': True, 'bull_use_atr': False, 'bull_use_adx': False, 'bull_use_spike': True, 'bull_rsi_required': False, 'bear_strategy': 'mean_reversion', 'bear_bb_std_mult': 3.595614914163277, 'bear_rsi_os': 17, 'bear_rsi_ob': 45, 'bear_adx_thresh': 12.753149703767157, 'bear_atr_min_pct': 0.026207852520136986, 'bear_atr_max_pct': 0.11547248298006406, 'bear_tp_mult': 2.355496297955187, 'bear_tsl_mult': 0.9640969060802336, 'bear_time_stop': 202, 'bear_use_sma': True, 'bear_use_ema': False, 'bear_use_atr': False, 'bear_use_adx': True, 'bear_use_spike': True, 'bear_rsi_required': True, 'sideways_strategy': 'breakout', 'sideways_bb_std_mult': 0.6787850082543602, 'sideways_rsi_os': 49, 'sideways_rsi_ob': 61, 'sideways_adx_thresh': 9.759252963059103, 'sideways_atr_min_pct': 0.02809731524045289, 'sideways_atr_max_pct': 0.12395930261775318, 'sideways_tp_mult': 1.8583975621928712, 'sideways_tsl_mult': 0.44991127882001053, 'sideways_time_stop': 88, 'sideways_use_sma': False, 'sideways_use_ema': False, 'sideways_use_atr': False, 'sideways_use_adx': True, 'sideways_use_spike': True, 'sideways_rsi_required': True}.
[I 2025-08-30 17:44:24,066] Trial 876 finished with values: [-1000000000.0, 1000000000.0] and parameters: {'p_sma': 28, 'p_std': 21, 'p_atr': 17, 'p_adx': 12, 'rsi_period': 71, 'ema1': 20, 'ema2': 11, 'slip_atr_k': 0.09270263533433369, 'slip_spread_k': 0.21495820062861876, 'spread_hl_frac': 0.020742426631758175, 'bb_std_mult': 0.9290235085873173, 'rsi_os': 33, 'rsi_ob': 84, 'vol_spike': 0.12003113884263986, 'adx_thresh': 11.18190604090304, 'atr_min_pct': 0.004971502053588532, 'atr_max_pct': 0.10841510509644665, 'tp_mult': 1.1896566099966372, 'tsl_mult': 0.3568895504772931, 'strategy': 'breakout', 'time_stop': 26, 'use_sma': True, 'use_atr': True, 'use_adx': False, 'use_ema': False, 'use_spike': True, 'rsi_required': True, 'edge_k': 0.40406915733365734, 'edge_cap': 0.9366733859090169, 'bull_strategy': 'breakout', 'bull_bb_std_mult': 1.523615572084846, 'bull_rsi_os': 13, 'bull_rsi_ob': 51, 'bull_adx_thresh': 32.31946975500538, 'bull_atr_min_pct': 0.02235963011906677, 'bull_atr_max_pct': 0.13932764870068648, 'bull_tp_mult': 2.2705686128324625, 'bull_tsl_mult': 0.7897791935137441, 'bull_time_stop': 282, 'bull_use_sma': True, 'bull_use_ema': False, 'bull_use_atr': False, 'bull_use_adx': True, 'bull_use_spike': False, 'bull_rsi_required': False, 'bear_strategy': 'mean_reversion', 'bear_bb_std_mult': 3.296016718337636, 'bear_rsi_os': 17, 'bear_rsi_ob': 76, 'bear_adx_thresh': 10.355356695486108, 'bear_atr_min_pct': 0.006043490998977646, 'bear_atr_max_pct': 0.07947920874004798, 'bear_tp_mult': 2.1434108338511284, 'bear_tsl_mult': 0.965665414419353, 'bear_time_stop': 203, 'bear_use_sma': True, 'bear_use_ema': False, 'bear_use_atr': True, 'bear_use_adx': False, 'bear_use_spike': False, 'bear_rsi_required': False, 'sideways_strategy': 'breakout', 'sideways_bb_std_mult': 0.7678088123397465, 'sideways_rsi_os': 29, 'sideways_rsi_ob': 90, 'sideways_adx_thresh': 10.69839970345984, 'sideways_atr_min_pct': 0.006351677402404679, 'sideways_atr_max_pct': 0.1003140858235593, 'sideways_tp_mult': 2.9292677691253646, 'sideways_tsl_mult': 0.41830520570826607, 'sideways_time_stop': 268, 'sideways_use_sma': False, 'sideways_use_ema': True, 'sideways_use_atr': True, 'sideways_use_adx': False, 'sideways_use_spike': False, 'sideways_rsi_required': False}.
[I 2025-08-30 17:44:24,348] Trial 877 finished with values: [-1000000000.0, 1000000000.0] and parameters: {'p_sma': 5, 'p_std': 50, 'p_atr': 13, 'p_adx': 15, 'rsi_period': 62, 'ema1': 11, 'ema2': 17, 'slip_atr_k': 0.020743302811582258, 'slip_spread_k': 0.17395656085066308, 'spread_hl_frac': 0.018546601188556413, 'bb_std_mult': 3.16879287421836, 'rsi_os': 31, 'rsi_ob': 80, 'vol_spike': 0.15272143465125118, 'adx_thresh': 11.061897213840913, 'atr_min_pct': 0.009186352157760723, 'atr_max_pct': 0.08231130506468883, 'tp_mult': 2.7323227999963247, 'tsl_mult': 0.3550529756341382, 'strategy': 'breakout', 'time_stop': 112, 'use_sma': True, 'use_atr': True, 'use_adx': False, 'use_ema': True, 'use_spike': True, 'rsi_required': True, 'edge_k': 0.22927516658051572, 'edge_cap': 0.8459121736269398, 'bull_strategy': 'breakout', 'bull_bb_std_mult': 2.2083008286908274, 'bull_rsi_os': 20, 'bull_rsi_ob': 70, 'bull_adx_thresh': 27.044986140965136, 'bull_atr_min_pct': 0.009841059388933038, 'bull_atr_max_pct': 0.13853796187695405, 'bull_tp_mult': 1.579465396888973, 'bull_tsl_mult': 0.8183789183437522, 'bull_time_stop': 72, 'bull_use_sma': True, 'bull_use_ema': False, 'bull_use_atr': False, 'bull_use_adx': True, 'bull_use_spike': False, 'bull_rsi_required': False, 'bear_strategy': 'breakout', 'bear_bb_std_mult': 1.12394400721276, 'bear_rsi_os': 17, 'bear_rsi_ob': 76, 'bear_adx_thresh': 12.859056081082405, 'bear_atr_min_pct': 0.023810361509174517, 'bear_atr_max_pct': 0.0792303777259428, 'bear_tp_mult': 2.132532720886758, 'bear_tsl_mult': 0.5443945849514139, 'bear_time_stop': 197, 'bear_use_sma': False, 'bear_use_ema': True, 'bear_use_atr': True, 'bear_use_adx': False, 'bear_use_spike': False, 'bear_rsi_required': False, 'sideways_strategy': 'breakout', 'sideways_bb_std_mult': 0.7623921234142126, 'sideways_rsi_os': 12, 'sideways_rsi_ob': 70, 'sideways_adx_thresh': 23.44077824011723, 'sideways_atr_min_pct': 0.006351090811704284, 'sideways_atr_max_pct': 0.10064732725184387, 'sideways_tp_mult': 1.8497697594498403, 'sideways_tsl_mult': 0.42019162888897427, 'sideways_time_stop': 262, 'sideways_use_sma': False, 'sideways_use_ema': True, 'sideways_use_atr': True, 'sideways_use_adx': True, 'sideways_use_spike': False, 'sideways_rsi_required': False}.
[I 2025-08-30 17:44:24,451] Trial 875 finished with values: [-1000000000.0, 1000000000.0] and parameters: {'p_sma': 30, 'p_std': 32, 'p_atr': 17, 'p_adx': 9, 'rsi_period': 71, 'ema1': 11, 'ema2': 21, 'slip_atr_k': 0.08902052081089384, 'slip_spread_k': 0.4002923863741795, 'spread_hl_frac': 0.027342872505986077, 'bb_std_mult': 3.1802186510060784, 'rsi_os': 51, 'rsi_ob': 80, 'vol_spike': 0.1199805415657101, 'adx_thresh': 6.2481140942485816, 'atr_min_pct': 0.019470095059576562, 'atr_max_pct': 0.1475836995233597, 'tp_mult': 1.2292077466088354, 'tsl_mult': 0.8852675962408596, 'strategy': 'breakout', 'time_stop': 120, 'use_sma': True, 'use_atr': False, 'use_adx': True, 'use_ema': False, 'use_spike': True, 'rsi_required': True, 'edge_k': 0.7410708001817109, 'edge_cap': 0.4022868598284353, 'bull_strategy': 'breakout', 'bull_bb_std_mult': 2.197546915654936, 'bull_rsi_os': 34, 'bull_rsi_ob': 83, 'bull_adx_thresh': 34.46421898897206, 'bull_atr_min_pct': 0.022319556114886577, 'bull_atr_max_pct': 0.13901101183791972, 'bull_tp_mult': 1.57286808988461, 'bull_tsl_mult': 0.8217228404848747, 'bull_time_stop': 142, 'bull_use_sma': True, 'bull_use_ema': True, 'bull_use_atr': False, 'bull_use_adx': True, 'bull_use_spike': False, 'bull_rsi_required': False, 'bear_strategy': 'mean_reversion', 'bear_bb_std_mult': 0.9961557730574335, 'bear_rsi_os': 54, 'bear_rsi_ob': 76, 'bear_adx_thresh': 12.819081494824232, 'bear_atr_min_pct': 0.0010369062784815752, 'bear_atr_max_pct': 0.07957157805615837, 'bear_tp_mult': 2.3642109456245173, 'bear_tsl_mult': 0.6785977189531315, 'bear_time_stop': 146, 'bear_use_sma': True, 'bear_use_ema': False, 'bear_use_atr': True, 'bear_use_adx': True, 'bear_use_spike': False, 'bear_rsi_required': True, 'sideways_strategy': 'breakout', 'sideways_bb_std_mult': 0.7333203817733104, 'sideways_rsi_os': 30, 'sideways_rsi_ob': 90, 'sideways_adx_thresh': 23.540632444006437, 'sideways_atr_min_pct': 0.022793972476324947, 'sideways_atr_max_pct': 0.10054449855027833, 'sideways_tp_mult': 2.965849072136227, 'sideways_tsl_mult': 0.7924375324873161, 'sideways_time_stop': 272, 'sideways_use_sma': False, 'sideways_use_ema': True, 'sideways_use_atr': False, 'sideways_use_adx': True, 'sideways_use_spike': False, 'sideways_rsi_required': True}.
[I 2025-08-30 17:44:26,183] Trial 880 finished with values: [-1000000000.0, 1000000000.0] and parameters: {'p_sma': 11, 'p_std': 16, 'p_atr': 17, 'p_adx': 19, 'rsi_period': 24, 'ema1': 5, 'ema2': 10, 'slip_atr_k': 0.00800241889383328, 'slip_spread_k': 0.47891734714808093, 'spread_hl_frac': 0.01801859393041126, 'bb_std_mult': 3.0625601875115827, 'rsi_os': 51, 'rsi_ob': 63, 'vol_spike': 0.09297745356108308, 'adx_thresh': 10.408505215703777, 'atr_min_pct': 0.01907148149615135, 'atr_max_pct': 0.14679773823579523, 'tp_mult': 2.8322231173410843, 'tsl_mult': 0.9523599077238429, 'strategy': 'mean_reversion', 'time_stop': 58, 'use_sma': False, 'use_atr': True, 'use_adx': True, 'use_ema': False, 'use_spike': False, 'rsi_required': True, 'edge_k': 0.2980862165128103, 'edge_cap': 0.07178186148884191, 'bull_strategy': 'mean_reversion', 'bull_bb_std_mult': 1.9208694590221713, 'bull_rsi_os': 45, 'bull_rsi_ob': 45, 'bull_adx_thresh': 12.373856998108844, 'bull_atr_min_pct': 0.02109789532973982, 'bull_atr_max_pct': 0.1350427561841306, 'bull_tp_mult': 2.2776427233919985, 'bull_tsl_mult': 0.613463069041762, 'bull_time_stop': 143, 'bull_use_sma': True, 'bull_use_ema': True, 'bull_use_atr': False, 'bull_use_adx': True, 'bull_use_spike': False, 'bull_rsi_required': True, 'bear_strategy': 'mean_reversion', 'bear_bb_std_mult': 3.374137514776753, 'bear_rsi_os': 34, 'bear_rsi_ob': 49, 'bear_adx_thresh': 30.279451187259056, 'bear_atr_min_pct': 0.017901143512935872, 'bear_atr_max_pct': 0.0990724181947821, 'bear_tp_mult': 2.295555776355924, 'bear_tsl_mult': 0.6421395573919795, 'bear_time_stop': 145, 'bear_use_sma': False, 'bear_use_ema': True, 'bear_use_atr': False, 'bear_use_adx': False, 'bear_use_spike': False, 'bear_rsi_required': False, 'sideways_strategy': 'breakout', 'sideways_bb_std_mult': 0.8614097016319442, 'sideways_rsi_os': 30, 'sideways_rsi_ob': 87, 'sideways_adx_thresh': 11.324331041061994, 'sideways_atr_min_pct': 0.0012678828267400394, 'sideways_atr_max_pct': 0.08803891690171076, 'sideways_tp_mult': 2.8912700679179655, 'sideways_tsl_mult': 0.3752534989449063, 'sideways_time_stop': 283, 'sideways_use_sma': True, 'sideways_use_ema': False, 'sideways_use_atr': False, 'sideways_use_adx': False, 'sideways_use_spike': False, 'sideways_rsi_required': True}.
