[I 2025-08-30 17:09:33,291] Trial 648 finished with values: [-1000000000.0, 1000000000.0] and parameters: {'p_sma': 7, 'p_std': 20, 'p_atr': 16, 'p_adx': 9, 'rsi_period': 25, 'ema1': 18, 'ema2': 11, 'slip_atr_k': 0.0037543298527909896, 'slip_spread_k': 0.09426744800749431, 'spread_hl_frac': 0.008867144539103259, 'bb_std_mult': 3.107374036812039, 'rsi_os': 33, 'rsi_ob': 85, 'vol_spike': 0.10029288842469183, 'adx_thresh': 11.55911100776681, 'atr_min_pct': 0.012529632894826634, 'atr_max_pct': 0.14335363052325192, 'tp_mult': 2.8185257773180736, 'tsl_mult': 0.9532969875541801, 'strategy': 'mean_reversion', 'time_stop': 29, 'use_sma': False, 'use_atr': True, 'use_adx': True, 'use_ema': False, 'use_spike': True, 'rsi_required': True, 'edge_k': 0.5509314695935592, 'edge_cap': 0.8774531462386771, 'bull_strategy': 'mean_reversion', 'bull_bb_std_mult': 1.8513110593036988, 'bull_rsi_os': 11, 'bull_rsi_ob': 52, 'bull_adx_thresh': 34.99455420771523, 'bull_atr_min_pct': 0.02359252575961755, 'bull_atr_max_pct': 0.03441011595623449, 'bull_tp_mult': 2.2949833054542306, 'bull_tsl_mult': 0.820641150474021, 'bull_time_stop': 166, 'bull_use_sma': True, 'bull_use_ema': False, 'bull_use_atr': False, 'bull_use_adx': True, 'bull_use_spike': True, 'bull_rsi_required': False, 'bear_strategy': 'mean_reversion', 'bear_bb_std_mult': 1.2063886982037284, 'bear_rsi_os': 40, 'bear_rsi_ob': 52, 'bear_adx_thresh': 28.547158748685874, 'bear_atr_min_pct': 0.02032997067423605, 'bear_atr_max_pct': 0.10930783049503091, 'bear_tp_mult': 1.973840127491525, 'bear_tsl_mult': 0.7661935476221873, 'bear_time_stop': 180, 'bear_use_sma': True, 'bear_use_ema': True, 'bear_use_atr': False, 'bear_use_adx': False, 'bear_use_spike': False, 'bear_rsi_required': True, 'sideways_strategy': 'breakout', 'sideways_bb_std_mult': 0.7982749049999479, 'sideways_rsi_os': 31, 'sideways_rsi_ob': 94, 'sideways_adx_thresh': 10.532898703469746, 'sideways_atr_min_pct': 0.006145263687980922, 'sideways_atr_max_pct': 0.09202275296632768, 'sideways_tp_mult': 2.998216325775579, 'sideways_tsl_mult': 0.43139849993248564, 'sideways_time_stop': 290, 'sideways_use_sma': True, 'sideways_use_ema': False, 'sideways_use_atr': False, 'sideways_use_adx': False, 'sideways_use_spike': False, 'sideways_rsi_required': True}.
[I 2025-08-30 17:09:33,669] Trial 650 finished with values: [-1000000000.0, 1000000000.0] and parameters: {'p_sma': 7, 'p_std': 21, 'p_atr': 15, 'p_adx': 9, 'rsi_period': 45, 'ema1': 20, 'ema2': 17, 'slip_atr_k': 0.0030692119454429527, 'slip_spread_k': 0.18921850946191504, 'spread_hl_frac': 0.009343322755069897, 'bb_std_mult': 0.911313560201676, 'rsi_os': 33, 'rsi_ob': 86, 'vol_spike': 0.08322382479324039, 'adx_thresh': 10.353129695761886, 'atr_min_pct': 0.015814547573200426, 'atr_max_pct': 0.1497227672633333, 'tp_mult': 2.8922912565475167, 'tsl_mult': 0.9487163152511221, 'strategy': 'mean_reversion', 'time_stop': 28, 'use_sma': False, 'use_atr': True, 'use_adx': False, 'use_ema': False, 'use_spike': True, 'rsi_required': True, 'edge_k': 0.4737696448335658, 'edge_cap': 0.9219114930998569, 'bull_strategy': 'mean_reversion', 'bull_bb_std_mult': 2.4403157079995057, 'bull_rsi_os': 11, 'bull_rsi_ob': 54, 'bull_adx_thresh': 33.605413642665084, 'bull_atr_min_pct': 0.0030391020997702807, 'bull_atr_max_pct': 0.10223827626299109, 'bull_tp_mult': 2.17422713142207, 'bull_tsl_mult': 0.7793650267037284, 'bull_time_stop': 62, 'bull_use_sma': True, 'bull_use_ema': False, 'bull_use_atr': False, 'bull_use_adx': False, 'bull_use_spike': True, 'bull_rsi_required': False, 'bear_strategy': 'mean_reversion', 'bear_bb_std_mult': 1.172127547713199, 'bear_rsi_os': 17, 'bear_rsi_ob': 76, 'bear_adx_thresh': 28.61214693152577, 'bear_atr_min_pct': 0.02031484588801182, 'bear_atr_max_pct': 0.10802017552102353, 'bear_tp_mult': 2.1929537032233317, 'bear_tsl_mult': 0.7508616929408224, 'bear_time_stop': 199, 'bear_use_sma': True, 'bear_use_ema': False, 'bear_use_atr': False, 'bear_use_adx': False, 'bear_use_spike': False, 'bear_rsi_required': True, 'sideways_strategy': 'mean_reversion', 'sideways_bb_std_mult': 0.7975336622915524, 'sideways_rsi_os': 31, 'sideways_rsi_ob': 95, 'sideways_adx_thresh': 11.925794794925658, 'sideways_atr_min_pct': 0.012559323842684485, 'sideways_atr_max_pct': 0.09200671814978272, 'sideways_tp_mult': 2.852609035766996, 'sideways_tsl_mult': 0.09042168898200265, 'sideways_time_stop': 268, 'sideways_use_sma': True, 'sideways_use_ema': False, 'sideways_use_atr': False, 'sideways_use_adx': False, 'sideways_use_spike': False, 'sideways_rsi_required': True}.
[I 2025-08-30 17:09:34,065] Trial 649 finished with values: [-1000000000.0, 1000000000.0] and parameters: {'p_sma': 45, 'p_std': 24, 'p_atr': 16, 'p_adx': 9, 'rsi_period': 76, 'ema1': 16, 'ema2': 12, 'slip_atr_k': 0.0022354786021534095, 'slip_spread_k': 0.19105310456942426, 'spread_hl_frac': 0.018653843657393924, 'bb_std_mult': 3.1010058688716704, 'rsi_os': 10, 'rsi_ob': 85, 'vol_spike': 0.10031990015009695, 'adx_thresh': 10.43340904649247, 'atr_min_pct': 0.019145080743090917, 'atr_max_pct': 0.14993759422530462, 'tp_mult': 1.4439075477598116, 'tsl_mult': 0.902913682336896, 'strategy': 'mean_reversion', 'time_stop': 25, 'use_sma': False, 'use_atr': True, 'use_adx': True, 'use_ema': False, 'use_spike': True, 'rsi_required': True, 'edge_k': 0.5473758036415629, 'edge_cap': 0.8653558767065846, 'bull_strategy': 'mean_reversion', 'bull_bb_std_mult': 1.8599867903092384, 'bull_rsi_os': 11, 'bull_rsi_ob': 55, 'bull_adx_thresh': 33.488083162147156, 'bull_atr_min_pct': 0.014036173745506175, 'bull_atr_max_pct': 0.03455955530982657, 'bull_tp_mult': 2.288295803851912, 'bull_tsl_mult': 0.7737521585558543, 'bull_time_stop': 165, 'bull_use_sma': True, 'bull_use_ema': False, 'bull_use_atr': False, 'bull_use_adx': True, 'bull_use_spike': True, 'bull_rsi_required': False, 'bear_strategy': 'mean_reversion', 'bear_bb_std_mult': 1.1867917773302186, 'bear_rsi_os': 40, 'bear_rsi_ob': 75, 'bear_adx_thresh': 12.418532002825147, 'bear_atr_min_pct': 0.004752121611205761, 'bear_atr_max_pct': 0.10921814854946033, 'bear_tp_mult': 1.9737719215044842, 'bear_tsl_mult': 0.12087245167973543, 'bear_time_stop': 200, 'bear_use_sma': True, 'bear_use_ema': True, 'bear_use_atr': False, 'bear_use_adx': False, 'bear_use_spike': False, 'bear_rsi_required': True, 'sideways_strategy': 'mean_reversion', 'sideways_bb_std_mult': 0.7197471551042643, 'sideways_rsi_os': 31, 'sideways_rsi_ob': 94, 'sideways_adx_thresh': 12.068561997832056, 'sideways_atr_min_pct': 0.02733079409143821, 'sideways_atr_max_pct': 0.09955346883137739, 'sideways_tp_mult': 2.99852546228109, 'sideways_tsl_mult': 0.45740071468816446, 'sideways_time_stop': 289, 'sideways_use_sma': True, 'sideways_use_ema': False, 'sideways_use_atr': False, 'sideways_use_adx': False, 'sideways_use_spike': False, 'sideways_rsi_required': True}.
[I 2025-08-30 17:09:34,718] Trial 651 finished with values: [-1000000000.0, 1000000000.0] and parameters: {'p_sma': 9, 'p_std': 20, 'p_atr': 15, 'p_adx': 9, 'rsi_period': 25, 'ema1': 16, 'ema2': 12, 'slip_atr_k': 0.0041498978752301805, 'slip_spread_k': 0.08237867121153697, 'spread_hl_frac': 0.02635556493999853, 'bb_std_mult': 2.6007392790173336, 'rsi_os': 34, 'rsi_ob': 85, 'vol_spike': 0.08216971189695221, 'adx_thresh': 10.519117406449697, 'atr_min_pct': 0.013248196607537786, 'atr_max_pct': 0.1440915132904629, 'tp_mult': 2.3544914794106577, 'tsl_mult': 0.8814442643572561, 'strategy': 'mean_reversion', 'time_stop': 28, 'use_sma': True, 'use_atr': True, 'use_adx': False, 'use_ema': False, 'use_spike': True, 'rsi_required': True, 'edge_k': 0.5472662567267383, 'edge_cap': 0.8600286882079423, 'bull_strategy': 'mean_reversion', 'bull_bb_std_mult': 1.829425281576458, 'bull_rsi_os': 11, 'bull_rsi_ob': 55, 'bull_adx_thresh': 33.34869717246951, 'bull_atr_min_pct': 0.021572806827494517, 'bull_atr_max_pct': 0.13937477239795795, 'bull_tp_mult': 2.1768748762311, 'bull_tsl_mult': 0.7596094218861068, 'bull_time_stop': 69, 'bull_use_sma': True, 'bull_use_ema': False, 'bull_use_atr': False, 'bull_use_adx': False, 'bull_use_spike': False, 'bull_rsi_required': False, 'bear_strategy': 'mean_reversion', 'bear_bb_std_mult': 1.1837523789738427, 'bear_rsi_os': 48, 'bear_rsi_ob': 76, 'bear_adx_thresh': 28.28340600031281, 'bear_atr_min_pct': 0.019749855362530898, 'bear_atr_max_pct': 0.10981463183006031, 'bear_tp_mult': 2.179991837019609, 'bear_tsl_mult': 0.1289712827562562, 'bear_time_stop': 210, 'bear_use_sma': True, 'bear_use_ema': False, 'bear_use_atr': True, 'bear_use_adx': False, 'bear_use_spike': False, 'bear_rsi_required': False, 'sideways_strategy': 'mean_reversion', 'sideways_bb_std_mult': 0.6848438028957003, 'sideways_rsi_os': 31, 'sideways_rsi_ob': 95, 'sideways_adx_thresh': 12.076681727323948, 'sideways_atr_min_pct': 0.0018936920822365255, 'sideways_atr_max_pct': 0.09215014551979363, 'sideways_tp_mult': 2.8611503698462486, 'sideways_tsl_mult': 0.7942193873525283, 'sideways_time_stop': 283, 'sideways_use_sma': True, 'sideways_use_ema': True, 'sideways_use_atr': False, 'sideways_use_adx': False, 'sideways_use_spike': True, 'sideways_rsi_required': True}.
[I 2025-08-30 17:10:18,837] Trial 653 finished with values: [-1000000000.0, 1000000000.0] and parameters: {'p_sma': 45, 'p_std': 27, 'p_atr': 17, 'p_adx': 7, 'rsi_period': 58, 'ema1': 17, 'ema2': 12, 'slip_atr_k': 0.018045541123999684, 'slip_spread_k': 0.1618223681383659, 'spread_hl_frac': 0.0305445366255961, 'bb_std_mult': 1.5187757511724702, 'rsi_os': 34, 'rsi_ob': 87, 'vol_spike': 0.10206233070368603, 'adx_thresh': 10.674717445269772, 'atr_min_pct': 0.005882470122526882, 'atr_max_pct': 0.10610269734796676, 'tp_mult': 1.4390365204643634, 'tsl_mult': 0.8869946007610676, 'strategy': 'breakout', 'time_stop': 54, 'use_sma': True, 'use_atr': True, 'use_adx': True, 'use_ema': True, 'use_spike': False, 'rsi_required': False, 'edge_k': 0.7013155828939445, 'edge_cap': 0.8583984817116284, 'bull_strategy': 'mean_reversion', 'bull_bb_std_mult': 1.8677023255561223, 'bull_rsi_os': 12, 'bull_rsi_ob': 55, 'bull_adx_thresh': 33.96382145818754, 'bull_atr_min_pct': 0.022236416029781863, 'bull_atr_max_pct': 0.1389768433302539, 'bull_tp_mult': 2.320182301655027, 'bull_tsl_mult': 0.7647014149068185, 'bull_time_stop': 211, 'bull_use_sma': True, 'bull_use_ema': True, 'bull_use_atr': False, 'bull_use_adx': True, 'bull_use_spike': False, 'bull_rsi_required': True, 'bear_strategy': 'breakout', 'bear_bb_std_mult': 0.982787052998056, 'bear_rsi_os': 16, 'bear_rsi_ob': 47, 'bear_adx_thresh': 12.684811893316455, 'bear_atr_min_pct': 0.019645048936808386, 'bear_atr_max_pct': 0.11034111276086772, 'bear_tp_mult': 2.148822277584735, 'bear_tsl_mult': 0.1274643731711536, 'bear_time_stop': 213, 'bear_use_sma': False, 'bear_use_ema': False, 'bear_use_atr': True, 'bear_use_adx': False, 'bear_use_spike': False, 'bear_rsi_required': False, 'sideways_strategy': 'mean_reversion', 'sideways_bb_std_mult': 0.7111694532785378, 'sideways_rsi_os': 33, 'sideways_rsi_ob': 58, 'sideways_adx_thresh': 11.501732558089342, 'sideways_atr_min_pct': 0.0018993877710216463, 'sideways_atr_max_pct': 0.09641650045625799, 'sideways_tp_mult': 2.7960926574075238, 'sideways_tsl_mult': 0.7758717224265568, 'sideways_time_stop': 283, 'sideways_use_sma': True, 'sideways_use_ema': True, 'sideways_use_atr': True, 'sideways_use_adx': True, 'sideways_use_spike': True, 'sideways_rsi_required': False}.
[I 2025-08-30 17:10:19,375] Trial 652 finished with values: [-1000000000.0, 1000000000.0] and parameters: {'p_sma': 45, 'p_std': 24, 'p_atr': 17, 'p_adx': 7, 'rsi_period': 49, 'ema1': 16, 'ema2': 12, 'slip_atr_k': 0.017320196055277362, 'slip_spread_k': 0.16134892098221218, 'spread_hl_frac': 0.030325424368884003, 'bb_std_mult': 2.3709316653955717, 'rsi_os': 34, 'rsi_ob': 87, 'vol_spike': 0.0810933750585585, 'adx_thresh': 10.755976841589055, 'atr_min_pct': 0.0036649820986866116, 'atr_max_pct': 0.08999132868221164, 'tp_mult': 2.322397559437003, 'tsl_mult': 0.878466945600059, 'strategy': 'breakout', 'time_stop': 55, 'use_sma': True, 'use_atr': True, 'use_adx': True, 'use_ema': True, 'use_spike': False, 'rsi_required': False, 'edge_k': 0.2924992168455346, 'edge_cap': 0.8238700743362215, 'bull_strategy': 'mean_reversion', 'bull_bb_std_mult': 1.8743189289957833, 'bull_rsi_os': 12, 'bull_rsi_ob': 55, 'bull_adx_thresh': 34.08522378396551, 'bull_atr_min_pct': 0.008330684972953611, 'bull_atr_max_pct': 0.13879643512950535, 'bull_tp_mult': 2.3109472216200357, 'bull_tsl_mult': 0.7652327303646177, 'bull_time_stop': 149, 'bull_use_sma': True, 'bull_use_ema': True, 'bull_use_atr': False, 'bull_use_adx': True, 'bull_use_spike': False, 'bull_rsi_required': True, 'bear_strategy': 'breakout', 'bear_bb_std_mult': 1.565014208781773, 'bear_rsi_os': 43, 'bear_rsi_ob': 77, 'bear_adx_thresh': 12.762984137240164, 'bear_atr_min_pct': 0.018672169704387346, 'bear_atr_max_pct': 0.11148159224201983, 'bear_tp_mult': 2.93191814730291, 'bear_tsl_mult': 0.6518794826830095, 'bear_time_stop': 8, 'bear_use_sma': False, 'bear_use_ema': False, 'bear_use_atr': True, 'bear_use_adx': False, 'bear_use_spike': False, 'bear_rsi_required': False, 'sideways_strategy': 'mean_reversion', 'sideways_bb_std_mult': 0.709835821894654, 'sideways_rsi_os': 33, 'sideways_rsi_ob': 58, 'sideways_adx_thresh': 11.28641335315387, 'sideways_atr_min_pct': 0.0018976569222078112, 'sideways_atr_max_pct': 0.09729249687450126, 'sideways_tp_mult': 2.7858521001537775, 'sideways_tsl_mult': 0.45783728084345615, 'sideways_time_stop': 283, 'sideways_use_sma': True, 'sideways_use_ema': True, 'sideways_use_atr': True, 'sideways_use_adx': True, 'sideways_use_spike': True, 'sideways_rsi_required': False}.
[I 2025-08-30 17:10:19,510] Trial 654 finished with values: [-0.021109100790264512, 0.021003035138837715] and parameters: {'p_sma': 9, 'p_std': 22, 'p_atr': 17, 'p_adx': 7, 'rsi_period': 25, 'ema1': 17, 'ema2': 57, 'slip_atr_k': 0.017989756071737716, 'slip_spread_k': 0.16075249052874221, 'spread_hl_frac': 0.030404193866287475, 'bb_std_mult': 3.303147823266912, 'rsi_os': 15, 'rsi_ob': 87, 'vol_spike': 0.08403857946321322, 'adx_thresh': 18.991740448403043, 'atr_min_pct': 0.008618399290787206, 'atr_max_pct': 0.08965257346095447, 'tp_mult': 2.33145566805243, 'tsl_mult': 0.8854266944103857, 'strategy': 'breakout', 'time_stop': 52, 'use_sma': True, 'use_atr': True, 'use_adx': False, 'use_ema': True, 'use_spike': False, 'rsi_required': False, 'edge_k': 0.2739012917842285, 'edge_cap': 0.8285482897291047, 'bull_strategy': 'mean_reversion', 'bull_bb_std_mult': 2.8732300711791288, 'bull_rsi_os': 12, 'bull_rsi_ob': 56, 'bull_adx_thresh': 34.19855265385667, 'bull_atr_min_pct': 0.008522298189543785, 'bull_atr_max_pct': 0.1393223976139648, 'bull_tp_mult': 2.320252339731656, 'bull_tsl_mult': 0.7573108435818529, 'bull_time_stop': 224, 'bull_use_sma': True, 'bull_use_ema': True, 'bull_use_atr': False, 'bull_use_adx': False, 'bull_use_spike': False, 'bull_rsi_required': True, 'bear_strategy': 'breakout', 'bear_bb_std_mult': 1.5513522856093676, 'bear_rsi_os': 16, 'bear_rsi_ob': 77, 'bear_adx_thresh': 11.80513956517947, 'bear_atr_min_pct': 0.019553038551189107, 'bear_atr_max_pct': 0.11499507232000503, 'bear_tp_mult': 2.924461632504465, 'bear_tsl_mult': 0.04494105658777153, 'bear_time_stop': 212, 'bear_use_sma': False, 'bear_use_ema': False, 'bear_use_atr': True, 'bear_use_adx': True, 'bear_use_spike': True, 'bear_rsi_required': False, 'sideways_strategy': 'breakout', 'sideways_bb_std_mult': 0.8442097489113012, 'sideways_rsi_os': 44, 'sideways_rsi_ob': 48, 'sideways_adx_thresh': 11.222218015550398, 'sideways_atr_min_pct': 0.0019301589356246465, 'sideways_atr_max_pct': 0.10301482167540163, 'sideways_tp_mult': 2.9238617555573, 'sideways_tsl_mult': 0.4614276264027039, 'sideways_time_stop': 266, 'sideways_use_sma': True, 'sideways_use_ema': True, 'sideways_use_atr': True, 'sideways_use_adx': True, 'sideways_use_spike': True, 'sideways_rsi_required': False}.
[I 2025-08-30 17:10:19,599] Trial 655 finished with values: [-0.0088682368267331, 0.008761950389590122] and parameters: {'p_sma': 8, 'p_std': 22, 'p_atr': 17, 'p_adx': 7, 'rsi_period': 23, 'ema1': 17, 'ema2': 57, 'slip_atr_k': 0.009078545227176368, 'slip_spread_k': 0.16749768320678182, 'spread_hl_frac': 0.019893784640030845, 'bb_std_mult': 1.6841872537205007, 'rsi_os': 16, 'rsi_ob': 87, 'vol_spike': 0.09992497527475505, 'adx_thresh': 10.8680715863658, 'atr_min_pct': 0.0026384045055678554, 'atr_max_pct': 0.14526422590304053, 'tp_mult': 1.6900270273202016, 'tsl_mult': 0.9231489277803628, 'strategy': 'breakout', 'time_stop': 54, 'use_sma': True, 'use_atr': True, 'use_adx': True, 'use_ema': True, 'use_spike': False, 'rsi_required': False, 'edge_k': 0.7063712985405717, 'edge_cap': 0.8276300999583177, 'bull_strategy': 'mean_reversion', 'bull_bb_std_mult': 3.0558989420754257, 'bull_rsi_os': 12, 'bull_rsi_ob': 53, 'bull_adx_thresh': 34.15328192338149, 'bull_atr_min_pct': 0.00850484870997064, 'bull_atr_max_pct': 0.14740725280559205, 'bull_tp_mult': 2.3373550855548375, 'bull_tsl_mult': 0.7864125937735406, 'bull_time_stop': 240, 'bull_use_sma': True, 'bull_use_ema': True, 'bull_use_atr': False, 'bull_use_adx': True, 'bull_use_spike': False, 'bull_rsi_required': True, 'bear_strategy': 'breakout', 'bear_bb_std_mult': 1.5586932263636992, 'bear_rsi_os': 43, 'bear_rsi_ob': 56, 'bear_adx_thresh': 24.734491903917387, 'bear_atr_min_pct': 0.01877485153030516, 'bear_atr_max_pct': 0.11239837361316385, 'bear_tp_mult': 2.9242945756241308, 'bear_tsl_mult': 0.634617923655157, 'bear_time_stop': 191, 'bear_use_sma': False, 'bear_use_ema': False, 'bear_use_atr': True, 'bear_use_adx': True, 'bear_use_spike': True, 'bear_rsi_required': False, 'sideways_strategy': 'breakout', 'sideways_bb_std_mult': 0.8454161554413102, 'sideways_rsi_os': 33, 'sideways_rsi_ob': 58, 'sideways_adx_thresh': 11.200634643429389, 'sideways_atr_min_pct': 0.0019736107843046627, 'sideways_atr_max_pct': 0.10250129446756678, 'sideways_tp_mult': 2.780246827021168, 'sideways_tsl_mult': 0.2509340220842353, 'sideways_time_stop': 267, 'sideways_use_sma': True, 'sideways_use_ema': True, 'sideways_use_atr': True, 'sideways_use_adx': True, 'sideways_use_spike': True, 'sideways_rsi_required': False}.
[I 2025-08-30 17:10:20,888] Trial 659 finished with values: [-1000000000.0, 1000000000.0] and parameters: {'p_sma': 43, 'p_std': 21, 'p_atr': 15, 'p_adx': 8, 'rsi_period': 82, 'ema1': 18, 'ema2': 11, 'slip_atr_k': 0.06485771168158237, 'slip_spread_k': 0.17541773898087798, 'spread_hl_frac': 0.019576159791462138, 'bb_std_mult': 1.8202493783550178, 'rsi_os': 54, 'rsi_ob': 74, 'vol_spike': 0.09308696038418432, 'adx_thresh': 33.99326396233514, 'atr_min_pct': 0.011166513626526757, 'atr_max_pct': 0.04614229463393116, 'tp_mult': 2.7620032473837184, 'tsl_mult': 0.9154734093898914, 'strategy': 'mean_reversion', 'time_stop': 173, 'use_sma': False, 'use_atr': True, 'use_adx': True, 'use_ema': False, 'use_spike': False, 'rsi_required': True, 'edge_k': 0.6533568077393861, 'edge_cap': 0.8872252868619842, 'bull_strategy': 'mean_reversion', 'bull_bb_std_mult': 2.0390575142566507, 'bull_rsi_os': 39, 'bull_rsi_ob': 53, 'bull_adx_thresh': 34.42976280378955, 'bull_atr_min_pct': 0.02144879713107652, 'bull_atr_max_pct': 0.06262613643686882, 'bull_tp_mult': 2.2006603428733333, 'bull_tsl_mult': 0.8106911280094041, 'bull_time_stop': 73, 'bull_use_sma': True, 'bull_use_ema': True, 'bull_use_atr': False, 'bull_use_adx': True, 'bull_use_spike': False, 'bull_rsi_required': False, 'bear_strategy': 'mean_reversion', 'bear_bb_std_mult': 1.3352540860026973, 'bear_rsi_os': 14, 'bear_rsi_ob': 53, 'bear_adx_thresh': 12.011305246199633, 'bear_atr_min_pct': 5.973610036980395e-06, 'bear_atr_max_pct': 0.10385309679531413, 'bear_tp_mult': 2.225995311476375, 'bear_tsl_mult': 0.560596305001659, 'bear_time_stop': 193, 'bear_use_sma': True, 'bear_use_ema': False, 'bear_use_atr': False, 'bear_use_adx': True, 'bear_use_spike': True, 'bear_rsi_required': False, 'sideways_strategy': 'breakout', 'sideways_bb_std_mult': 0.8427568019600418, 'sideways_rsi_os': 47, 'sideways_rsi_ob': 93, 'sideways_adx_thresh': 10.372268413102793, 'sideways_atr_min_pct': 0.0011679197482641341, 'sideways_atr_max_pct': 0.10097814468521321, 'sideways_tp_mult': 2.9195575804702623, 'sideways_tsl_mult': 0.3798963446569432, 'sideways_time_stop': 277, 'sideways_use_sma': False, 'sideways_use_ema': False, 'sideways_use_atr': False, 'sideways_use_adx': False, 'sideways_use_spike': False, 'sideways_rsi_required': True}.
