[I 2025-08-30 17:39:12,022] Trial 837 finished with values: [-1000000000.0, 1000000000.0] and parameters: {'p_sma': 18, 'p_std': 21, 'p_atr': 9, 'p_adx': 13, 'rsi_period': 24, 'ema1': 10, 'ema2': 10, 'slip_atr_k': 0.01702563356125419, 'slip_spread_k': 0.23277065925216817, 'spread_hl_frac': 0.0012943727389034716, 'bb_std_mult': 3.1036670320193522, 'rsi_os': 21, 'rsi_ob': 86, 'vol_spike': 0.2389108757861912, 'adx_thresh': 12.330651572959585, 'atr_min_pct': 0.024314277948624057, 'atr_max_pct': 0.144856964088131, 'tp_mult': 2.268689826455096, 'tsl_mult': 0.20896587871010108, 'strategy': 'breakout', 'time_stop': 30, 'use_sma': True, 'use_atr': False, 'use_adx': True, 'use_ema': False, 'use_spike': True, 'rsi_required': False, 'edge_k': 0.9874353938603211, 'edge_cap': 0.9592500519973393, 'bull_strategy': 'breakout', 'bull_bb_std_mult': 2.503294228765213, 'bull_rsi_os': 8, 'bull_rsi_ob': 52, 'bull_adx_thresh': 34.973247915725054, 'bull_atr_min_pct': 0.02131946578146855, 'bull_atr_max_pct': 0.0977828145559715, 'bull_tp_mult': 1.014265132365272, 'bull_tsl_mult': 0.48942238044664177, 'bull_time_stop': 70, 'bull_use_sma': True, 'bull_use_ema': True, 'bull_use_atr': False, 'bull_use_adx': False, 'bull_use_spike': False, 'bull_rsi_required': False, 'bear_strategy': 'mean_reversion', 'bear_bb_std_mult': 1.6342451734765544, 'bear_rsi_os': 14, 'bear_rsi_ob': 63, 'bear_adx_thresh': 11.093818219422625, 'bear_atr_min_pct': 0.0187007541138478, 'bear_atr_max_pct': 0.09929919857305268, 'bear_tp_mult': 2.1694976178608973, 'bear_tsl_mult': 0.9005749975243034, 'bear_time_stop': 202, 'bear_use_sma': True, 'bear_use_ema': False, 'bear_use_atr': True, 'bear_use_adx': True, 'bear_use_spike': True, 'bear_rsi_required': True, 'sideways_strategy': 'mean_reversion', 'sideways_bb_std_mult': 0.9415622527686784, 'sideways_rsi_os': 32, 'sideways_rsi_ob': 46, 'sideways_adx_thresh': 30.50469235602694, 'sideways_atr_min_pct': 0.0014727764661694634, 'sideways_atr_max_pct': 0.05526771632381591, 'sideways_tp_mult': 2.870399435842382, 'sideways_tsl_mult': 0.43206546388422595, 'sideways_time_stop': 169, 'sideways_use_sma': False, 'sideways_use_ema': True, 'sideways_use_atr': False, 'sideways_use_adx': False, 'sideways_use_spike': False, 'sideways_rsi_required': True}.
[I 2025-08-30 17:39:13,350] Trial 839 finished with values: [-1000000000.0, 1000000000.0] and parameters: {'p_sma': 7, 'p_std': 49, 'p_atr': 14, 'p_adx': 11, 'rsi_period': 21, 'ema1': 21, 'ema2': 13, 'slip_atr_k': 0.017154028862651084, 'slip_spread_k': 0.20531808749810088, 'spread_hl_frac': 0.04573633220022845, 'bb_std_mult': 3.529271712333438, 'rsi_os': 33, 'rsi_ob': 88, 'vol_spike': 0.07935637367023882, 'adx_thresh': 23.56901591824706, 'atr_min_pct': 0.009901935157193738, 'atr_max_pct': 0.14423665209380196, 'tp_mult': 1.404435611481579, 'tsl_mult': 0.9425659863058906, 'strategy': 'breakout', 'time_stop': 27, 'use_sma': True, 'use_atr': False, 'use_adx': True, 'use_ema': False, 'use_spike': True, 'rsi_required': False, 'edge_k': 0.26979204600582085, 'edge_cap': 0.8205240880422032, 'bull_strategy': 'breakout', 'bull_bb_std_mult': 2.5296237694569697, 'bull_rsi_os': 10, 'bull_rsi_ob': 52, 'bull_adx_thresh': 34.37221920980122, 'bull_atr_min_pct': 0.02095780169198718, 'bull_atr_max_pct': 0.05280907129976141, 'bull_tp_mult': 2.312157529968548, 'bull_tsl_mult': 0.8456947177876911, 'bull_time_stop': 60, 'bull_use_sma': True, 'bull_use_ema': True, 'bull_use_atr': False, 'bull_use_adx': False, 'bull_use_spike': False, 'bull_rsi_required': False, 'bear_strategy': 'mean_reversion', 'bear_bb_std_mult': 3.0217059120739886, 'bear_rsi_os': 13, 'bear_rsi_ob': 66, 'bear_adx_thresh': 21.86060051997874, 'bear_atr_min_pct': 0.00011532338982311006, 'bear_atr_max_pct': 0.14995035392113612, 'bear_tp_mult': 2.1531515387921143, 'bear_tsl_mult': 0.5540281701771153, 'bear_time_stop': 205, 'bear_use_sma': True, 'bear_use_ema': False, 'bear_use_atr': True, 'bear_use_adx': True, 'bear_use_spike': True, 'bear_rsi_required': True, 'sideways_strategy': 'mean_reversion', 'sideways_bb_std_mult': 0.7925917102845377, 'sideways_rsi_os': 10, 'sideways_rsi_ob': 55, 'sideways_adx_thresh': 9.822222920495042, 'sideways_atr_min_pct': 0.001470356370395421, 'sideways_atr_max_pct': 0.0978031370481948, 'sideways_tp_mult': 2.750525154975216, 'sideways_tsl_mult': 0.4387050310220094, 'sideways_time_stop': 169, 'sideways_use_sma': False, 'sideways_use_ema': True, 'sideways_use_atr': False, 'sideways_use_adx': False, 'sideways_use_spike': False, 'sideways_rsi_required': True}.
[I 2025-08-30 17:39:13,680] Trial 838 finished with values: [-1000000000.0, 1000000000.0] and parameters: {'p_sma': 20, 'p_std': 18, 'p_atr': 12, 'p_adx': 9, 'rsi_period': 44, 'ema1': 10, 'ema2': 13, 'slip_atr_k': 0.016726248361883703, 'slip_spread_k': 0.2490695039804145, 'spread_hl_frac': 0.01963451110466446, 'bb_std_mult': 1.4194190378876677, 'rsi_os': 17, 'rsi_ob': 88, 'vol_spike': 0.07596193113556118, 'adx_thresh': 12.159962821481992, 'atr_min_pct': 0.020627419755572737, 'atr_max_pct': 0.14382695705177947, 'tp_mult': 2.233433921034038, 'tsl_mult': 0.9612087344130169, 'strategy': 'breakout', 'time_stop': 27, 'use_sma': True, 'use_atr': False, 'use_adx': True, 'use_ema': False, 'use_spike': True, 'rsi_required': False, 'edge_k': 1.2967945270007084, 'edge_cap': 0.9650234519535545, 'bull_strategy': 'breakout', 'bull_bb_std_mult': 2.0215617314267083, 'bull_rsi_os': 12, 'bull_rsi_ob': 52, 'bull_adx_thresh': 34.982283799779715, 'bull_atr_min_pct': 0.016834245627978032, 'bull_atr_max_pct': 0.12941727885459098, 'bull_tp_mult': 2.3367732690492575, 'bull_tsl_mult': 0.48974874921128814, 'bull_time_stop': 110, 'bull_use_sma': True, 'bull_use_ema': True, 'bull_use_atr': False, 'bull_use_adx': False, 'bull_use_spike': False, 'bull_rsi_required': False, 'bear_strategy': 'mean_reversion', 'bear_bb_std_mult': 1.0545151667800698, 'bear_rsi_os': 14, 'bear_rsi_ob': 47, 'bear_adx_thresh': 12.213337476820678, 'bear_atr_min_pct': 0.004853278306657497, 'bear_atr_max_pct': 0.14998632187987038, 'bear_tp_mult': 2.148712278030413, 'bear_tsl_mult': 0.6075209601293364, 'bear_time_stop': 208, 'bear_use_sma': True, 'bear_use_ema': False, 'bear_use_atr': True, 'bear_use_adx': True, 'bear_use_spike': True, 'bear_rsi_required': True, 'sideways_strategy': 'mean_reversion', 'sideways_bb_std_mult': 0.7933334261454951, 'sideways_rsi_os': 31, 'sideways_rsi_ob': 55, 'sideways_adx_thresh': 21.0512324605629, 'sideways_atr_min_pct': 0.00816322236742233, 'sideways_atr_max_pct': 0.08197849974411844, 'sideways_tp_mult': 1.0623067263914114, 'sideways_tsl_mult': 0.6845317164359123, 'sideways_time_stop': 78, 'sideways_use_sma': False, 'sideways_use_ema': True, 'sideways_use_atr': False, 'sideways_use_adx': False, 'sideways_use_spike': False, 'sideways_rsi_required': True}.
[I 2025-08-30 17:39:49,897] Trial 843 finished with values: [-1000000000.0, 1000000000.0] and parameters: {'p_sma': 55, 'p_std': 33, 'p_atr': 19, 'p_adx': 10, 'rsi_period': 23, 'ema1': 20, 'ema2': 12, 'slip_atr_k': 0.2088172004489383, 'slip_spread_k': 0.16733254092548433, 'spread_hl_frac': 0.03962907532026898, 'bb_std_mult': 3.136876644465354, 'rsi_os': 11, 'rsi_ob': 52, 'vol_spike': 0.06740108782393625, 'adx_thresh': 11.42906850080685, 'atr_min_pct': 0.01698774495523334, 'atr_max_pct': 0.14984804720238967, 'tp_mult': 2.4699107419331257, 'tsl_mult': 0.912323801817693, 'strategy': 'mean_reversion', 'time_stop': 36, 'use_sma': False, 'use_atr': True, 'use_adx': True, 'use_ema': True, 'use_spike': False, 'rsi_required': True, 'edge_k': 0.5475720256085967, 'edge_cap': 0.351986261233896, 'bull_strategy': 'mean_reversion', 'bull_bb_std_mult': 1.9753856545519062, 'bull_rsi_os': 35, 'bull_rsi_ob': 54, 'bull_adx_thresh': 33.53385553840394, 'bull_atr_min_pct': 0.013228818321175066, 'bull_atr_max_pct': 0.13979078428274422, 'bull_tp_mult': 2.1229606608038765, 'bull_tsl_mult': 0.9251610130203229, 'bull_time_stop': 79, 'bull_use_sma': True, 'bull_use_ema': False, 'bull_use_atr': False, 'bull_use_adx': True, 'bull_use_spike': True, 'bull_rsi_required': True, 'bear_strategy': 'breakout', 'bear_bb_std_mult': 2.6370468660595403, 'bear_rsi_os': 15, 'bear_rsi_ob': 77, 'bear_adx_thresh': 12.054356469976106, 'bear_atr_min_pct': 0.01734169032601368, 'bear_atr_max_pct': 0.10494943436181092, 'bear_tp_mult': 1.5134565426279232, 'bear_tsl_mult': 0.7965927628106906, 'bear_time_stop': 190, 'bear_use_sma': False, 'bear_use_ema': True, 'bear_use_atr': False, 'bear_use_adx': False, 'bear_use_spike': False, 'bear_rsi_required': False, 'sideways_strategy': 'breakout', 'sideways_bb_std_mult': 0.5971576717110003, 'sideways_rsi_os': 31, 'sideways_rsi_ob': 94, 'sideways_adx_thresh': 27.475274507424544, 'sideways_atr_min_pct': 0.0035725652252482417, 'sideways_atr_max_pct': 0.07640907799567741, 'sideways_tp_mult': 2.9632021806975275, 'sideways_tsl_mult': 0.6262864480459762, 'sideways_time_stop': 277, 'sideways_use_sma': True, 'sideways_use_ema': False, 'sideways_use_atr': True, 'sideways_use_adx': True, 'sideways_use_spike': False, 'sideways_rsi_required': False}.
[I 2025-08-30 17:39:50,509] Trial 842 finished with values: [-1000000000.0, 1000000000.0] and parameters: {'p_sma': 57, 'p_std': 20, 'p_atr': 19, 'p_adx': 28, 'rsi_period': 45, 'ema1': 12, 'ema2': 12, 'slip_atr_k': 0.08252261214367297, 'slip_spread_k': 0.16703809471663564, 'spread_hl_frac': 0.01895485273867082, 'bb_std_mult': 3.2206074281058137, 'rsi_os': 17, 'rsi_ob': 85, 'vol_spike': 0.06748564692855895, 'adx_thresh': 29.813526660416038, 'atr_min_pct': 0.019243446355495155, 'atr_max_pct': 0.14801342180639054, 'tp_mult': 2.8473892207979152, 'tsl_mult': 0.6544355853954091, 'strategy': 'mean_reversion', 'time_stop': 34, 'use_sma': False, 'use_atr': True, 'use_adx': True, 'use_ema': True, 'use_spike': False, 'rsi_required': True, 'edge_k': 0.6666591658545675, 'edge_cap': 0.42957719107664544, 'bull_strategy': 'mean_reversion', 'bull_bb_std_mult': 1.7062381179652601, 'bull_rsi_os': 52, 'bull_rsi_ob': 68, 'bull_adx_thresh': 33.67135245330954, 'bull_atr_min_pct': 0.017898680346971785, 'bull_atr_max_pct': 0.13186689695099083, 'bull_tp_mult': 2.1455297491490746, 'bull_tsl_mult': 0.7370722087058703, 'bull_time_stop': 110, 'bull_use_sma': True, 'bull_use_ema': False, 'bull_use_atr': False, 'bull_use_adx': True, 'bull_use_spike': True, 'bull_rsi_required': True, 'bear_strategy': 'breakout', 'bear_bb_std_mult': 1.069226523033067, 'bear_rsi_os': 15, 'bear_rsi_ob': 77, 'bear_adx_thresh': 12.480779180217256, 'bear_atr_min_pct': 0.020994078773145363, 'bear_atr_max_pct': 0.10488350604616889, 'bear_tp_mult': 2.423619308201164, 'bear_tsl_mult': 0.7207470794458019, 'bear_time_stop': 191, 'bear_use_sma': True, 'bear_use_ema': True, 'bear_use_atr': False, 'bear_use_adx': False, 'bear_use_spike': False, 'bear_rsi_required': False, 'sideways_strategy': 'breakout', 'sideways_bb_std_mult': 0.6691796496143734, 'sideways_rsi_os': 38, 'sideways_rsi_ob': 93, 'sideways_adx_thresh': 21.59237455315487, 'sideways_atr_min_pct': 0.014853306709265102, 'sideways_atr_max_pct': 0.11054801813905572, 'sideways_tp_mult': 1.0401187115500043, 'sideways_tsl_mult': 0.4622052046674109, 'sideways_time_stop': 279, 'sideways_use_sma': True, 'sideways_use_ema': False, 'sideways_use_atr': True, 'sideways_use_adx': False, 'sideways_use_spike': False, 'sideways_rsi_required': False}.
[I 2025-08-30 17:39:50,881] Trial 840 finished with values: [-1000000000.0, 1000000000.0] and parameters: {'p_sma': 57, 'p_std': 21, 'p_atr': 13, 'p_adx': 11, 'rsi_period': 23, 'ema1': 19, 'ema2': 12, 'slip_atr_k': 0.04428867000663822, 'slip_spread_k': 0.20673437519234183, 'spread_hl_frac': 0.04300283559993155, 'bb_std_mult': 3.5980021942539837, 'rsi_os': 33, 'rsi_ob': 52, 'vol_spike': 0.10335489676814136, 'adx_thresh': 12.35847147343008, 'atr_min_pct': 0.013008063416201622, 'atr_max_pct': 0.11600327503901331, 'tp_mult': 2.250585222003073, 'tsl_mult': 0.943250799271392, 'strategy': 'breakout', 'time_stop': 34, 'use_sma': True, 'use_atr': False, 'use_adx': True, 'use_ema': False, 'use_spike': True, 'rsi_required': False, 'edge_k': 0.4956757451546119, 'edge_cap': 0.3093728034099734, 'bull_strategy': 'breakout', 'bull_bb_std_mult': 3.035274924005889, 'bull_rsi_os': 22, 'bull_rsi_ob': 52, 'bull_adx_thresh': 34.426647529790564, 'bull_atr_min_pct': 0.021480924743231253, 'bull_atr_max_pct': 0.13232688035141169, 'bull_tp_mult': 2.724175431976752, 'bull_tsl_mult': 0.9078444471242499, 'bull_time_stop': 55, 'bull_use_sma': True, 'bull_use_ema': True, 'bull_use_atr': False, 'bull_use_adx': False, 'bull_use_spike': True, 'bull_rsi_required': False, 'bear_strategy': 'mean_reversion', 'bear_bb_std_mult': 3.003957536948355, 'bear_rsi_os': 13, 'bear_rsi_ob': 54, 'bear_adx_thresh': 21.84842944799689, 'bear_atr_min_pct': 0.005106652034596556, 'bear_atr_max_pct': 0.04977364220997983, 'bear_tp_mult': 2.177028856114024, 'bear_tsl_mult': 0.8904783102241587, 'bear_time_stop': 191, 'bear_use_sma': True, 'bear_use_ema': False, 'bear_use_atr': True, 'bear_use_adx': True, 'bear_use_spike': True, 'bear_rsi_required': True, 'sideways_strategy': 'mean_reversion', 'sideways_bb_std_mult': 1.7959696150938624, 'sideways_rsi_os': 40, 'sideways_rsi_ob': 79, 'sideways_adx_thresh': 27.40362351777806, 'sideways_atr_min_pct': 0.0012807297741215513, 'sideways_atr_max_pct': 0.09898690424561077, 'sideways_tp_mult': 1.793156897540499, 'sideways_tsl_mult': 0.4369988223168424, 'sideways_time_stop': 166, 'sideways_use_sma': False, 'sideways_use_ema': True, 'sideways_use_atr': False, 'sideways_use_adx': False, 'sideways_use_spike': False, 'sideways_rsi_required': True}.
[I 2025-08-30 17:39:51,012] Trial 841 finished with values: [-1000000000.0, 1000000000.0] and parameters: {'p_sma': 7, 'p_std': 18, 'p_atr': 15, 'p_adx': 28, 'rsi_period': 23, 'ema1': 14, 'ema2': 34, 'slip_atr_k': 0.010445750751208432, 'slip_spread_k': 0.19793643642275652, 'spread_hl_frac': 0.03976531768851662, 'bb_std_mult': 1.4152903502335452, 'rsi_os': 33, 'rsi_ob': 85, 'vol_spike': 0.05905286975650803, 'adx_thresh': 29.791374891650644, 'atr_min_pct': 0.02853192279362571, 'atr_max_pct': 0.14386790818177564, 'tp_mult': 2.837390598151234, 'tsl_mult': 0.9413625547065344, 'strategy': 'mean_reversion', 'time_stop': 21, 'use_sma': True, 'use_atr': False, 'use_adx': True, 'use_ema': False, 'use_spike': True, 'rsi_required': True, 'edge_k': 0.09881303013516585, 'edge_cap': 0.42842716618046306, 'bull_strategy': 'breakout', 'bull_bb_std_mult': 2.0283700376705327, 'bull_rsi_os': 11, 'bull_rsi_ob': 53, 'bull_adx_thresh': 34.3782621980412, 'bull_atr_min_pct': 0.02601320538897916, 'bull_atr_max_pct': 0.13134826948864747, 'bull_tp_mult': 2.1435776066624523, 'bull_tsl_mult': 0.8499252293221616, 'bull_time_stop': 55, 'bull_use_sma': True, 'bull_use_ema': True, 'bull_use_atr': False, 'bull_use_adx': False, 'bull_use_spike': True, 'bull_rsi_required': False, 'bear_strategy': 'mean_reversion', 'bear_bb_std_mult': 1.0689757688272858, 'bear_rsi_os': 13, 'bear_rsi_ob': 77, 'bear_adx_thresh': 12.21986074605149, 'bear_atr_min_pct': 0.005159584700945867, 'bear_atr_max_pct': 0.06743675604179708, 'bear_tp_mult': 2.0868688002442415, 'bear_tsl_mult': 0.8644779664418696, 'bear_time_stop': 191, 'bear_use_sma': True, 'bear_use_ema': False, 'bear_use_atr': True, 'bear_use_adx': True, 'bear_use_spike': False, 'bear_rsi_required': False, 'sideways_strategy': 'breakout', 'sideways_bb_std_mult': 0.808529973481198, 'sideways_rsi_os': 31, 'sideways_rsi_ob': 93, 'sideways_adx_thresh': 27.32305875848519, 'sideways_atr_min_pct': 0.015412809933121736, 'sideways_atr_max_pct': 0.019163594763004596, 'sideways_tp_mult': 1.7925220943528006, 'sideways_tsl_mult': 0.4629306746423854, 'sideways_time_stop': 276, 'sideways_use_sma': True, 'sideways_use_ema': True, 'sideways_use_atr': False, 'sideways_use_adx': False, 'sideways_use_spike': False, 'sideways_rsi_required': True}.
[I 2025-08-30 17:40:28,514] Trial 847 finished with values: [-1000000000.0, 1000000000.0] and parameters: {'p_sma': 5, 'p_std': 23, 'p_atr': 17, 'p_adx': 8, 'rsi_period': 31, 'ema1': 17, 'ema2': 36, 'slip_atr_k': 0.008258898357901634, 'slip_spread_k': 0.34014962127051196, 'spread_hl_frac': 0.017436728957343044, 'bb_std_mult': 2.431857027624654, 'rsi_os': 7, 'rsi_ob': 81, 'vol_spike': 0.09153215377596241, 'adx_thresh': 8.068532057545044, 'atr_min_pct': 0.019267409545126516, 'atr_max_pct': 0.1499006399372372, 'tp_mult': 2.76882977931125, 'tsl_mult': 0.8396994344242564, 'strategy': 'mean_reversion', 'time_stop': 174, 'use_sma': False, 'use_atr': True, 'use_adx': False, 'use_ema': False, 'use_spike': False, 'rsi_required': True, 'edge_k': 0.3373046526229876, 'edge_cap': 0.9179706221326684, 'bull_strategy': 'mean_reversion', 'bull_bb_std_mult': 0.6108950449143091, 'bull_rsi_os': 11, 'bull_rsi_ob': 51, 'bull_adx_thresh': 33.9857991967521, 'bull_atr_min_pct': 0.011610570098160695, 'bull_atr_max_pct': 0.14568018795340792, 'bull_tp_mult': 2.2168494890665387, 'bull_tsl_mult': 0.5781304015909262, 'bull_time_stop': 168, 'bull_use_sma': True, 'bull_use_ema': True, 'bull_use_atr': False, 'bull_use_adx': True, 'bull_use_spike': False, 'bull_rsi_required': False, 'bear_strategy': 'mean_reversion', 'bear_bb_std_mult': 3.097402082887746, 'bear_rsi_os': 35, 'bear_rsi_ob': 82, 'bear_adx_thresh': 29.462802829715514, 'bear_atr_min_pct': 0.009473442621722889, 'bear_atr_max_pct': 0.13448392694916506, 'bear_tp_mult': 2.21557464474814, 'bear_tsl_mult': 0.6491965918451226, 'bear_time_stop': 219, 'bear_use_sma': False, 'bear_use_ema': False, 'bear_use_atr': False, 'bear_use_adx': False, 'bear_use_spike': False, 'bear_rsi_required': False, 'sideways_strategy': 'breakout', 'sideways_bb_std_mult': 3.5931542744971363, 'sideways_rsi_os': 29, 'sideways_rsi_ob': 91, 'sideways_adx_thresh': 11.893686354949162, 'sideways_atr_min_pct': 0.0024697156106820626, 'sideways_atr_max_pct': 0.10003416880091234, 'sideways_tp_mult': 2.9307175252556674, 'sideways_tsl_mult': 0.0700596384168925, 'sideways_time_stop': 27, 'sideways_use_sma': True, 'sideways_use_ema': False, 'sideways_use_atr': False, 'sideways_use_adx': True, 'sideways_use_spike': True, 'sideways_rsi_required': True}.
[I 2025-08-30 17:40:28,664] Trial 844 finished with values: [-1000000000.0, 1000000000.0] and parameters: {'p_sma': 5, 'p_std': 11, 'p_atr': 11, 'p_adx': 28, 'rsi_period': 42, 'ema1': 17, 'ema2': 11, 'slip_atr_k': 0.08219873340774858, 'slip_spread_k': 0.44937543860948614, 'spread_hl_frac': 0.01858790032858777, 'bb_std_mult': 3.0276972577348493, 'rsi_os': 24, 'rsi_ob': 82, 'vol_spike': 0.06130997564886489, 'adx_thresh': 10.421019180567272, 'atr_min_pct': 0.019101891580983882, 'atr_max_pct': 0.1499922596574936, 'tp_mult': 2.842411460568819, 'tsl_mult': 0.9300220756194738, 'strategy': 'mean_reversion', 'time_stop': 35, 'use_sma': False, 'use_atr': True, 'use_adx': False, 'use_ema': False, 'use_spike': False, 'rsi_required': True, 'edge_k': 0.4915263363684805, 'edge_cap': 0.916427013810023, 'bull_strategy': 'mean_reversion', 'bull_bb_std_mult': 3.063335051611997, 'bull_rsi_os': 22, 'bull_rsi_ob': 61, 'bull_adx_thresh': 16.758419709897264, 'bull_atr_min_pct': 0.024120056219539752, 'bull_atr_max_pct': 0.14532650544988077, 'bull_tp_mult': 2.7432984027464657, 'bull_tsl_mult': 0.8226648728773756, 'bull_time_stop': 57, 'bull_use_sma': True, 'bull_use_ema': True, 'bull_use_atr': False, 'bull_use_adx': True, 'bull_use_spike': True, 'bull_rsi_required': False, 'bear_strategy': 'mean_reversion', 'bear_bb_std_mult': 1.749530879189448, 'bear_rsi_os': 15, 'bear_rsi_ob': 80, 'bear_adx_thresh': 10.01856021840748, 'bear_atr_min_pct': 0.02082292784082154, 'bear_atr_max_pct': 0.10512440040316745, 'bear_tp_mult': 2.2103515157542972, 'bear_tsl_mult': 0.7222985202536805, 'bear_time_stop': 100, 'bear_use_sma': True, 'bear_use_ema': False, 'bear_use_atr': False, 'bear_use_adx': False, 'bear_use_spike': False, 'bear_rsi_required': False, 'sideways_strategy': 'breakout', 'sideways_bb_std_mult': 0.712939026041562, 'sideways_rsi_os': 40, 'sideways_rsi_ob': 62, 'sideways_adx_thresh': 21.716945782695145, 'sideways_atr_min_pct': 0.015094844151424935, 'sideways_atr_max_pct': 0.1002761188404375, 'sideways_tp_mult': 2.9248180710509457, 'sideways_tsl_mult': 0.46246163975570037, 'sideways_time_stop': 283, 'sideways_use_sma': True, 'sideways_use_ema': False, 'sideways_use_atr': False, 'sideways_use_adx': False, 'sideways_use_spike': False, 'sideways_rsi_required': True}.
