[I 2025-08-30 15:29:21,377] Trial 99 finished with values: [-1000000000.0, 1000000000.0] and parameters: {'p_sma': 32, 'p_std': 6, 'p_atr': 8, 'p_adx': 29, 'rsi_period': 13, 'ema1': 26, 'ema2': 54, 'slip_atr_k': 0.24332335282273765, 'slip_spread_k': 0.9373777787513312, 'spread_hl_frac': 0.011058290883970149, 'bb_std_mult': 2.722951531878286, 'rsi_os': 29, 'rsi_ob': 78, 'vol_spike': 0.0911631698528302, 'adx_thresh': 33.52138660258375, 'atr_min_pct': 0.021041473236288594, 'atr_max_pct': 0.040315961488505664, 'tp_mult': 1.9648056581061033, 'tsl_mult': 0.7739857724388981, 'strategy': 'mean_reversion', 'time_stop': 168, 'use_sma': True, 'use_atr': True, 'use_adx': True, 'use_ema': False, 'use_spike': True, 'rsi_required': True, 'edge_k': 1.5637417211180855, 'edge_cap': 0.8706990035759997, 'bull_strategy': 'breakout', 'bull_bb_std_mult': 3.259252022788182, 'bull_rsi_os': 13, 'bull_rsi_ob': 95, 'bull_adx_thresh': 13.754251686193637, 'bull_atr_min_pct': 0.01917037778989175, 'bull_atr_max_pct': 0.08498567375746531, 'bull_tp_mult': 1.1066028017363203, 'bull_tsl_mult': 0.39786465256293, 'bull_time_stop': 200, 'bull_use_sma': True, 'bull_use_ema': False, 'bull_use_atr': True, 'bull_use_adx': True, 'bull_use_spike': False, 'bull_rsi_required': False, 'bear_strategy': 'mean_reversion', 'bear_bb_std_mult': 1.0667726829811157, 'bear_rsi_os': 19, 'bear_rsi_ob': 80, 'bear_adx_thresh': 33.91354497598513, 'bear_atr_min_pct': 0.018495386898723508, 'bear_atr_max_pct': 0.07745368980021473, 'bear_tp_mult': 1.904299616243084, 'bear_tsl_mult': 0.5304628272357693, 'bear_time_stop': 148, 'bear_use_sma': True, 'bear_use_ema': True, 'bear_use_atr': True, 'bear_use_adx': False, 'bear_use_spike': False, 'bear_rsi_required': False, 'sideways_strategy': 'breakout', 'sideways_bb_std_mult': 2.6114192577199704, 'sideways_rsi_os': 48, 'sideways_rsi_ob': 94, 'sideways_adx_thresh': 30.412504893835496, 'sideways_atr_min_pct': 0.026895024431590073, 'sideways_atr_max_pct': 0.06594492941649434, 'sideways_tp_mult': 1.377180319143426, 'sideways_tsl_mult': 0.387199915493718, 'sideways_time_stop': 108, 'sideways_use_sma': False, 'sideways_use_ema': True, 'sideways_use_atr': True, 'sideways_use_adx': True, 'sideways_use_spike': False, 'sideways_rsi_required': True}.
[I 2025-08-30 15:29:40,776] Trial 100 finished with values: [-1000000000.0, 1000000000.0] and parameters: {'p_sma': 32, 'p_std': 7, 'p_atr': 14, 'p_adx': 11, 'rsi_period': 8, 'ema1': 26, 'ema2': 54, 'slip_atr_k': 0.12156644423594412, 'slip_spread_k': 0.8501344378444974, 'spread_hl_frac': 0.03630639939132073, 'bb_std_mult': 0.6280892561512423, 'rsi_os': 41, 'rsi_ob': 78, 'vol_spike': 0.23328478210178616, 'adx_thresh': 33.29065431400194, 'atr_min_pct': 0.011689237992147819, 'atr_max_pct': 0.041140262396656316, 'tp_mult': 2.9498527631405818, 'tsl_mult': 0.9298038850759163, 'strategy': 'mean_reversion', 'time_stop': 170, 'use_sma': True, 'use_atr': True, 'use_adx': True, 'use_ema': False, 'use_spike': False, 'rsi_required': True, 'edge_k': 1.8815255777237274, 'edge_cap': 0.9986618599613194, 'bull_strategy': 'breakout', 'bull_bb_std_mult': 1.595489576281204, 'bull_rsi_os': 13, 'bull_rsi_ob': 86, 'bull_adx_thresh': 11.701844873494359, 'bull_atr_min_pct': 0.015002812154013367, 'bull_atr_max_pct': 0.07228844334030166, 'bull_tp_mult': 2.970912072466074, 'bull_tsl_mult': 0.9453545899231061, 'bull_time_stop': 60, 'bull_use_sma': True, 'bull_use_ema': False, 'bull_use_atr': True, 'bull_use_adx': True, 'bull_use_spike': False, 'bull_rsi_required': False, 'bear_strategy': 'mean_reversion', 'bear_bb_std_mult': 1.701807482587554, 'bear_rsi_os': 35, 'bear_rsi_ob': 47, 'bear_adx_thresh': 30.552068424889214, 'bear_atr_min_pct': 0.018415998449371515, 'bear_atr_max_pct': 0.03508042291388019, 'bear_tp_mult': 1.2970593118788127, 'bear_tsl_mult': 0.7956706994228623, 'bear_time_stop': 83, 'bear_use_sma': True, 'bear_use_ema': True, 'bear_use_atr': True, 'bear_use_adx': False, 'bear_use_spike': False, 'bear_rsi_required': False, 'sideways_strategy': 'breakout', 'sideways_bb_std_mult': 1.587101282021496, 'sideways_rsi_os': 43, 'sideways_rsi_ob': 91, 'sideways_adx_thresh': 29.73138125011402, 'sideways_atr_min_pct': 0.028302236220550295, 'sideways_atr_max_pct': 0.06622132759027817, 'sideways_tp_mult': 1.3932449530661646, 'sideways_tsl_mult': 0.1389180216313301, 'sideways_time_stop': 105, 'sideways_use_sma': False, 'sideways_use_ema': True, 'sideways_use_atr': True, 'sideways_use_adx': True, 'sideways_use_spike': False, 'sideways_rsi_required': True}.
[I 2025-08-30 15:29:41,569] Trial 101 finished with values: [-1000000000.0, 1000000000.0] and parameters: {'p_sma': 44, 'p_std': 8, 'p_atr': 29, 'p_adx': 17, 'rsi_period': 9, 'ema1': 28, 'ema2': 30, 'slip_atr_k': 0.12250987788098847, 'slip_spread_k': 0.8765023637916459, 'spread_hl_frac': 0.004539646993066103, 'bb_std_mult': 0.9132023146056238, 'rsi_os': 41, 'rsi_ob': 77, 'vol_spike': 0.2924776482118109, 'adx_thresh': 33.387609482706516, 'atr_min_pct': 0.009967516579332526, 'atr_max_pct': 0.03436947049541267, 'tp_mult': 2.77305034019749, 'tsl_mult': 0.7670191512882039, 'strategy': 'mean_reversion', 'time_stop': 170, 'use_sma': True, 'use_atr': True, 'use_adx': True, 'use_ema': False, 'use_spike': False, 'rsi_required': True, 'edge_k': 1.9248059775661734, 'edge_cap': 0.14277611596336254, 'bull_strategy': 'breakout', 'bull_bb_std_mult': 3.3800981074586502, 'bull_rsi_os': 15, 'bull_rsi_ob': 87, 'bull_adx_thresh': 11.511026849303988, 'bull_atr_min_pct': 0.019038405353854853, 'bull_atr_max_pct': 0.013847329043058795, 'bull_tp_mult': 1.1056902573263723, 'bull_tsl_mult': 0.948494025947656, 'bull_time_stop': 265, 'bull_use_sma': False, 'bull_use_ema': False, 'bull_use_atr': True, 'bull_use_adx': True, 'bull_use_spike': False, 'bull_rsi_required': False, 'bear_strategy': 'mean_reversion', 'bear_bb_std_mult': 2.51483244676313, 'bear_rsi_os': 35, 'bear_rsi_ob': 78, 'bear_adx_thresh': 29.55470838916592, 'bear_atr_min_pct': 0.018737212645857402, 'bear_atr_max_pct': 0.07652832859840032, 'bear_tp_mult': 1.895120188921577, 'bear_tsl_mult': 0.9767317470539201, 'bear_time_stop': 39, 'bear_use_sma': True, 'bear_use_ema': True, 'bear_use_atr': True, 'bear_use_adx': False, 'bear_use_spike': False, 'bear_rsi_required': False, 'sideways_strategy': 'breakout', 'sideways_bb_std_mult': 0.7442605906035062, 'sideways_rsi_os': 52, 'sideways_rsi_ob': 67, 'sideways_adx_thresh': 23.388131264244105, 'sideways_atr_min_pct': 0.012377946887870285, 'sideways_atr_max_pct': 0.0601112979722407, 'sideways_tp_mult': 1.4158530901154893, 'sideways_tsl_mult': 0.13436159227571848, 'sideways_time_stop': 57, 'sideways_use_sma': False, 'sideways_use_ema': True, 'sideways_use_atr': True, 'sideways_use_adx': False, 'sideways_use_spike': False, 'sideways_rsi_required': True}.
[I 2025-08-30 15:29:41,946] Trial 102 finished with values: [-1000000000.0, 1000000000.0] and parameters: {'p_sma': 43, 'p_std': 12, 'p_atr': 22, 'p_adx': 17, 'rsi_period': 8, 'ema1': 28, 'ema2': 29, 'slip_atr_k': 0.21012431656247937, 'slip_spread_k': 0.818367865320674, 'spread_hl_frac': 0.03625521166012589, 'bb_std_mult': 0.6632099209067213, 'rsi_os': 18, 'rsi_ob': 77, 'vol_spike': 0.2530914147439116, 'adx_thresh': 32.90846079496434, 'atr_min_pct': 0.006169867472258615, 'atr_max_pct': 0.03434997125831964, 'tp_mult': 2.776851348269036, 'tsl_mult': 0.7733450419168089, 'strategy': 'mean_reversion', 'time_stop': 72, 'use_sma': True, 'use_atr': True, 'use_adx': True, 'use_ema': False, 'use_spike': False, 'rsi_required': True, 'edge_k': 1.5989377660914101, 'edge_cap': 0.14296664598395836, 'bull_strategy': 'breakout', 'bull_bb_std_mult': 1.548308987881765, 'bull_rsi_os': 36, 'bull_rsi_ob': 86, 'bull_adx_thresh': 11.531993661234045, 'bull_atr_min_pct': 0.014847158998946123, 'bull_atr_max_pct': 0.048251709614675384, 'bull_tp_mult': 1.0968136434404343, 'bull_tsl_mult': 0.4030067065326705, 'bull_time_stop': 264, 'bull_use_sma': False, 'bull_use_ema': False, 'bull_use_atr': True, 'bull_use_adx': True, 'bull_use_spike': False, 'bull_rsi_required': False, 'bear_strategy': 'mean_reversion', 'bear_bb_std_mult': 2.470446680815474, 'bear_rsi_os': 35, 'bear_rsi_ob': 78, 'bear_adx_thresh': 30.71071382619791, 'bear_atr_min_pct': 0.02654503918127083, 'bear_atr_max_pct': 0.08421672478761891, 'bear_tp_mult': 2.8897454268033393, 'bear_tsl_mult': 0.7899368176099992, 'bear_time_stop': 36, 'bear_use_sma': True, 'bear_use_ema': True, 'bear_use_atr': True, 'bear_use_adx': False, 'bear_use_spike': False, 'bear_rsi_required': False, 'sideways_strategy': 'breakout', 'sideways_bb_std_mult': 0.689800162842001, 'sideways_rsi_os': 27, 'sideways_rsi_ob': 70, 'sideways_adx_thresh': 30.097914031748147, 'sideways_atr_min_pct': 0.012582351867380277, 'sideways_atr_max_pct': 0.06632633805138073, 'sideways_tp_mult': 1.5165510785169762, 'sideways_tsl_mult': 0.3979628871028846, 'sideways_time_stop': 62, 'sideways_use_sma': False, 'sideways_use_ema': True, 'sideways_use_atr': True, 'sideways_use_adx': False, 'sideways_use_spike': False, 'sideways_rsi_required': True}.
[I 2025-08-30 15:29:42,744] Trial 106 finished with values: [-1000000000.0, 1000000000.0] and parameters: {'p_sma': 11, 'p_std': 43, 'p_atr': 29, 'p_adx': 7, 'rsi_period': 24, 'ema1': 5, 'ema2': 12, 'slip_atr_k': 0.24182973339169822, 'slip_spread_k': 0.3287385211038333, 'spread_hl_frac': 0.045496239189602605, 'bb_std_mult': 2.915612925587282, 'rsi_os': 48, 'rsi_ob': 72, 'vol_spike': 0.2636457684661088, 'adx_thresh': 31.894830232908333, 'atr_min_pct': 0.012126070609148007, 'atr_max_pct': 0.011055263569272819, 'tp_mult': 2.4990680738333877, 'tsl_mult': 0.8385335700779861, 'strategy': 'breakout', 'time_stop': 272, 'use_sma': True, 'use_atr': False, 'use_adx': False, 'use_ema': True, 'use_spike': False, 'rsi_required': False, 'edge_k': 0.599688242352646, 'edge_cap': 0.36152476913706655, 'bull_strategy': 'mean_reversion', 'bull_bb_std_mult': 3.435276399854974, 'bull_rsi_os': 34, 'bull_rsi_ob': 76, 'bull_adx_thresh': 9.102417319779526, 'bull_atr_min_pct': 0.017920645789672524, 'bull_atr_max_pct': 0.012873893624839186, 'bull_tp_mult': 2.749867994874867, 'bull_tsl_mult': 0.34058083808627115, 'bull_time_stop': 209, 'bull_use_sma': False, 'bull_use_ema': True, 'bull_use_atr': False, 'bull_use_adx': False, 'bull_use_spike': True, 'bull_rsi_required': False, 'bear_strategy': 'breakout', 'bear_bb_std_mult': 2.1880083037429596, 'bear_rsi_os': 25, 'bear_rsi_ob': 91, 'bear_adx_thresh': 33.007229968886996, 'bear_atr_min_pct': 0.008212059265257768, 'bear_atr_max_pct': 0.016412995839380648, 'bear_tp_mult': 1.7329059467679313, 'bear_tsl_mult': 0.6412508492552027, 'bear_time_stop': 15, 'bear_use_sma': False, 'bear_use_ema': True, 'bear_use_atr': False, 'bear_use_adx': True, 'bear_use_spike': True, 'bear_rsi_required': True, 'sideways_strategy': 'breakout', 'sideways_bb_std_mult': 2.296267105115419, 'sideways_rsi_os': 45, 'sideways_rsi_ob': 75, 'sideways_adx_thresh': 33.237744823608935, 'sideways_atr_min_pct': 0.0008907619473964255, 'sideways_atr_max_pct': 0.14679315889326805, 'sideways_tp_mult': 1.187684055704563, 'sideways_tsl_mult': 0.3495705124806774, 'sideways_time_stop': 118, 'sideways_use_sma': True, 'sideways_use_ema': False, 'sideways_use_atr': False, 'sideways_use_adx': False, 'sideways_use_spike': True, 'sideways_rsi_required': False}.
[I 2025-08-30 15:29:42,928] Trial 105 finished with values: [-1000000000.0, 1000000000.0] and parameters: {'p_sma': 42, 'p_std': 42, 'p_atr': 29, 'p_adx': 7, 'rsi_period': 21, 'ema1': 28, 'ema2': 56, 'slip_atr_k': 0.16808119400867488, 'slip_spread_k': 0.33565364278815724, 'spread_hl_frac': 0.046025769708043604, 'bb_std_mult': 1.4236058038274935, 'rsi_os': 18, 'rsi_ob': 75, 'vol_spike': 0.2815530110694971, 'adx_thresh': 34.924470239883696, 'atr_min_pct': 0.012036445738739094, 'atr_max_pct': 0.01107322401926994, 'tp_mult': 2.605855315643247, 'tsl_mult': 0.8377733817536229, 'strategy': 'mean_reversion', 'time_stop': 281, 'use_sma': True, 'use_atr': False, 'use_adx': True, 'use_ema': False, 'use_spike': False, 'rsi_required': False, 'edge_k': 0.5555152459971117, 'edge_cap': 0.9666439645394393, 'bull_strategy': 'mean_reversion', 'bull_bb_std_mult': 2.9749181145900856, 'bull_rsi_os': 36, 'bull_rsi_ob': 76, 'bull_adx_thresh': 9.30315655341774, 'bull_atr_min_pct': 0.017902683527110722, 'bull_atr_max_pct': 0.04836828694918317, 'bull_tp_mult': 2.8916511222501073, 'bull_tsl_mult': 0.05249858934576085, 'bull_time_stop': 212, 'bull_use_sma': False, 'bull_use_ema': True, 'bull_use_atr': False, 'bull_use_adx': True, 'bull_use_spike': False, 'bull_rsi_required': False, 'bear_strategy': 'mean_reversion', 'bear_bb_std_mult': 0.6955082484198003, 'bear_rsi_os': 37, 'bear_rsi_ob': 90, 'bear_adx_thresh': 22.16740252996939, 'bear_atr_min_pct': 0.015149988097579281, 'bear_atr_max_pct': 0.09305842544653095, 'bear_tp_mult': 1.7648685992994806, 'bear_tsl_mult': 0.013434333384479913, 'bear_time_stop': 18, 'bear_use_sma': False, 'bear_use_ema': True, 'bear_use_atr': True, 'bear_use_adx': True, 'bear_use_spike': True, 'bear_rsi_required': True, 'sideways_strategy': 'breakout', 'sideways_bb_std_mult': 1.8989188158483126, 'sideways_rsi_os': 33, 'sideways_rsi_ob': 70, 'sideways_adx_thresh': 17.28169183743457, 'sideways_atr_min_pct': 2.2322818720453812e-05, 'sideways_atr_max_pct': 0.09754601383353077, 'sideways_tp_mult': 1.1403740343205102, 'sideways_tsl_mult': 0.2895720356760423, 'sideways_time_stop': 48, 'sideways_use_sma': False, 'sideways_use_ema': False, 'sideways_use_atr': False, 'sideways_use_adx': False, 'sideways_use_spike': False, 'sideways_rsi_required': False}.
[I 2025-08-30 15:30:12,730] Trial 103 finished with values: [-1000000000.0, 1000000000.0] and parameters: {'p_sma': 42, 'p_std': 8, 'p_atr': 22, 'p_adx': 13, 'rsi_period': 80, 'ema1': 5, 'ema2': 28, 'slip_atr_k': 0.20999890895135395, 'slip_spread_k': 0.8482470654510592, 'spread_hl_frac': 0.012658018671388561, 'bb_std_mult': 1.1751336817375937, 'rsi_os': 41, 'rsi_ob': 81, 'vol_spike': 0.28962054359593736, 'adx_thresh': 34.94276921123847, 'atr_min_pct': 0.010004016369209542, 'atr_max_pct': 0.035796546364349494, 'tp_mult': 2.777435140799411, 'tsl_mult': 0.8322997591585493, 'strategy': 'mean_reversion', 'time_stop': 56, 'use_sma': True, 'use_atr': False, 'use_adx': True, 'use_ema': False, 'use_spike': False, 'rsi_required': True, 'edge_k': 0.33162749724956697, 'edge_cap': 0.36327055184795637, 'bull_strategy': 'breakout', 'bull_bb_std_mult': 2.9737468261195077, 'bull_rsi_os': 36, 'bull_rsi_ob': 92, 'bull_adx_thresh': 11.712724997789042, 'bull_atr_min_pct': 0.014793774446385115, 'bull_atr_max_pct': 0.07422402145737506, 'bull_tp_mult': 2.9692054237205805, 'bull_tsl_mult': 0.06337061276926848, 'bull_time_stop': 60, 'bull_use_sma': False, 'bull_use_ema': True, 'bull_use_atr': True, 'bull_use_adx': True, 'bull_use_spike': False, 'bull_rsi_required': False, 'bear_strategy': 'mean_reversion', 'bear_bb_std_mult': 2.515901974855194, 'bear_rsi_os': 40, 'bear_rsi_ob': 90, 'bear_adx_thresh': 30.78472617218704, 'bear_atr_min_pct': 0.01198691898174903, 'bear_atr_max_pct': 0.03249176547282206, 'bear_tp_mult': 2.8922164937443253, 'bear_tsl_mult': 0.7907796468714622, 'bear_time_stop': 36, 'bear_use_sma': True, 'bear_use_ema': True, 'bear_use_atr': True, 'bear_use_adx': False, 'bear_use_spike': False, 'bear_rsi_required': False, 'sideways_strategy': 'breakout', 'sideways_bb_std_mult': 1.5577111854906556, 'sideways_rsi_os': 26, 'sideways_rsi_ob': 66, 'sideways_adx_thresh': 23.457773047035644, 'sideways_atr_min_pct': 0.0019701161912750176, 'sideways_atr_max_pct': 0.010437717642667876, 'sideways_tp_mult': 1.9979965095008982, 'sideways_tsl_mult': 0.1340636791529139, 'sideways_time_stop': 62, 'sideways_use_sma': False, 'sideways_use_ema': True, 'sideways_use_atr': True, 'sideways_use_adx': False, 'sideways_use_spike': False, 'sideways_rsi_required': True}.
[I 2025-08-30 15:30:33,925] Trial 104 finished with values: [-1000000000.0, 1000000000.0] and parameters: {'p_sma': 44, 'p_std': 8, 'p_atr': 22, 'p_adx': 17, 'rsi_period': 84, 'ema1': 28, 'ema2': 31, 'slip_atr_k': 0.16873894253860033, 'slip_spread_k': 0.8728294560362255, 'spread_hl_frac': 0.04514024913198634, 'bb_std_mult': 0.9107888806229052, 'rsi_os': 45, 'rsi_ob': 75, 'vol_spike': 0.29185458689635096, 'adx_thresh': 33.0253726497321, 'atr_min_pct': 0.00792783655882356, 'atr_max_pct': 0.14208158480966648, 'tp_mult': 2.618279431882433, 'tsl_mult': 0.8417180119134573, 'strategy': 'mean_reversion', 'time_stop': 78, 'use_sma': True, 'use_atr': False, 'use_adx': True, 'use_ema': False, 'use_spike': False, 'rsi_required': True, 'edge_k': 0.6112352354158984, 'edge_cap': 0.10737472257986996, 'bull_strategy': 'breakout', 'bull_bb_std_mult': 3.4199284758268984, 'bull_rsi_os': 34, 'bull_rsi_ob': 75, 'bull_adx_thresh': 9.184360852082918, 'bull_atr_min_pct': 0.01830731824514415, 'bull_atr_max_pct': 0.013017708670452231, 'bull_tp_mult': 2.8818625561451987, 'bull_tsl_mult': 0.8015876134324464, 'bull_time_stop': 215, 'bull_use_sma': False, 'bull_use_ema': True, 'bull_use_atr': True, 'bull_use_adx': True, 'bull_use_spike': False, 'bull_rsi_required': False, 'bear_strategy': 'mean_reversion', 'bear_bb_std_mult': 0.665586904872872, 'bear_rsi_os': 25, 'bear_rsi_ob': 65, 'bear_adx_thresh': 18.42506205421711, 'bear_atr_min_pct': 0.012205130934295233, 'bear_atr_max_pct': 0.10040364331095147, 'bear_tp_mult': 1.7332403394916513, 'bear_tsl_mult': 0.9770501280728964, 'bear_time_stop': 195, 'bear_use_sma': True, 'bear_use_ema': True, 'bear_use_atr': True, 'bear_use_adx': False, 'bear_use_spike': False, 'bear_rsi_required': False, 'sideways_strategy': 'breakout', 'sideways_bb_std_mult': 2.286202023107916, 'sideways_rsi_os': 52, 'sideways_rsi_ob': 70, 'sideways_adx_thresh': 19.65684475696551, 'sideways_atr_min_pct': 0.01253502374153552, 'sideways_atr_max_pct': 0.07702100057383185, 'sideways_tp_mult': 1.1488052530389121, 'sideways_tsl_mult': 0.11041292332041729, 'sideways_time_stop': 64, 'sideways_use_sma': False, 'sideways_use_ema': True, 'sideways_use_atr': False, 'sideways_use_adx': False, 'sideways_use_spike': False, 'sideways_rsi_required': False}.
[I 2025-08-30 15:30:34,544] Trial 107 finished with values: [-0.03512738283753447, 0.03512979198818575] and parameters: {'p_sma': 26, 'p_std': 33, 'p_atr': 27, 'p_adx': 9, 'rsi_period': 21, 'ema1': 29, 'ema2': 56, 'slip_atr_k': 0.1032990463783472, 'slip_spread_k': 0.9784399104325587, 'spread_hl_frac': 0.04562324080237362, 'bb_std_mult': 1.2028285184955552, 'rsi_os': 44, 'rsi_ob': 81, 'vol_spike': 0.2821055210892716, 'adx_thresh': 34.799611213756805, 'atr_min_pct': 0.022725592302814127, 'atr_max_pct': 0.04427822900710067, 'tp_mult': 2.3150122869583174, 'tsl_mult': 0.9194496736605907, 'strategy': 'mean_reversion', 'time_stop': 282, 'use_sma': False, 'use_atr': False, 'use_adx': True, 'use_ema': False, 'use_spike': False, 'rsi_required': True, 'edge_k': 0.5510227584194263, 'edge_cap': 0.09728609711147468, 'bull_strategy': 'breakout', 'bull_bb_std_mult': 2.980752801233017, 'bull_rsi_os': 32, 'bull_rsi_ob': 89, 'bull_adx_thresh': 9.390237465425729, 'bull_atr_min_pct': 0.02374292789932656, 'bull_atr_max_pct': 0.09857105903591618, 'bull_tp_mult': 2.6063750602391944, 'bull_tsl_mult': 0.31253441173128044, 'bull_time_stop': 85, 'bull_use_sma': False, 'bull_use_ema': True, 'bull_use_atr': True, 'bull_use_adx': True, 'bull_use_spike': False, 'bull_rsi_required': True, 'bear_strategy': 'mean_reversion', 'bear_bb_std_mult': 1.9456531194358029, 'bear_rsi_os': 41, 'bear_rsi_ob': 90, 'bear_adx_thresh': 22.503360317517906, 'bear_atr_min_pct': 0.012286440621441823, 'bear_atr_max_pct': 0.10087241367391113, 'bear_tp_mult': 1.6245553781786601, 'bear_tsl_mult': 0.12959165575993375, 'bear_time_stop': 34, 'bear_use_sma': True, 'bear_use_ema': False, 'bear_use_atr': True, 'bear_use_adx': False, 'bear_use_spike': False, 'bear_rsi_required': False, 'sideways_strategy': 'breakout', 'sideways_bb_std_mult': 3.3319574411540493, 'sideways_rsi_os': 54, 'sideways_rsi_ob': 65, 'sideways_adx_thresh': 19.661317362651115, 'sideways_atr_min_pct': 0.0021206024996431004, 'sideways_atr_max_pct': 0.08169058241188705, 'sideways_tp_mult': 1.7917301699349977, 'sideways_tsl_mult': 0.10824635880156196, 'sideways_time_stop': 51, 'sideways_use_sma': False, 'sideways_use_ema': True, 'sideways_use_atr': False, 'sideways_use_adx': False, 'sideways_use_spike': False, 'sideways_rsi_required': False}.
