[I 2025-08-30 15:20:23,044] Trial 54 finished with values: [-0.07189170331670625, 0.07181802681520563] and parameters: {'p_sma': 32, 'p_std': 5, 'p_atr': 29, 'p_adx': 9, 'rsi_period': 50, 'ema1': 30, 'ema2': 49, 'slip_atr_k': 0.2323893093625377, 'slip_spread_k': 0.9978676444247675, 'spread_hl_frac': 0.04546656553763759, 'bb_std_mult': 1.6584013477474144, 'rsi_os': 24, 'rsi_ob': 68, 'vol_spike': 0.06748764760929586, 'adx_thresh': 33.44613016692484, 'atr_min_pct': 0.026494566793239277, 'atr_max_pct': 0.11456482898319365, 'tp_mult': 2.9129568570909132, 'tsl_mult': 0.0656995967689542, 'strategy': 'mean_reversion', 'time_stop': 144, 'use_sma': True, 'use_atr': False, 'use_adx': True, 'use_ema': False, 'use_spike': True, 'rsi_required': True, 'edge_k': 0.4600410605467263, 'edge_cap': 0.9583455673685056, 'bull_strategy': 'breakout', 'bull_bb_std_mult': 1.1574068879583166, 'bull_rsi_os': 28, 'bull_rsi_ob': 51, 'bull_adx_thresh': 26.157062438355098, 'bull_atr_min_pct': 0.024764872332717888, 'bull_atr_max_pct': 0.13536720188615597, 'bull_tp_mult': 2.608529980954955, 'bull_tsl_mult': 0.778229682924819, 'bull_time_stop': 290, 'bull_use_sma': False, 'bull_use_ema': True, 'bull_use_atr': True, 'bull_use_adx': True, 'bull_use_spike': True, 'bull_rsi_required': False, 'bear_strategy': 'mean_reversion', 'bear_bb_std_mult': 2.7803465304911703, 'bear_rsi_os': 23, 'bear_rsi_ob': 85, 'bear_adx_thresh': 34.246096289645884, 'bear_atr_min_pct': 0.00041732230301979104, 'bear_atr_max_pct': 0.02909815337908689, 'bear_tp_mult': 1.6353968865585757, 'bear_tsl_mult': 0.8550559388488994, 'bear_time_stop': 6, 'bear_use_sma': True, 'bear_use_ema': True, 'bear_use_atr': False, 'bear_use_adx': False, 'bear_use_spike': False, 'bear_rsi_required': False, 'sideways_strategy': 'breakout', 'sideways_bb_std_mult': 1.9439631816584433, 'sideways_rsi_os': 37, 'sideways_rsi_ob': 65, 'sideways_adx_thresh': 25.59316193886461, 'sideways_atr_min_pct': 0.00019087575172249162, 'sideways_atr_max_pct': 0.08686515072493295, 'sideways_tp_mult': 1.0938632170392155, 'sideways_tsl_mult': 0.11585187457751706, 'sideways_time_stop': 264, 'sideways_use_sma': True, 'sideways_use_ema': True, 'sideways_use_atr': True, 'sideways_use_adx': False, 'sideways_use_spike': False, 'sideways_rsi_required': True}.
[I 2025-08-30 15:20:36,668] Trial 57 finished with values: [-1000000000.0, 1000000000.0] and parameters: {'p_sma': 42, 'p_std': 5, 'p_atr': 12, 'p_adx': 7, 'rsi_period': 35, 'ema1': 30, 'ema2': 21, 'slip_atr_k': 0.2338158644084849, 'slip_spread_k': 0.44898969917931736, 'spread_hl_frac': 0.0019214807458366144, 'bb_std_mult': 1.6562999938714171, 'rsi_os': 35, 'rsi_ob': 66, 'vol_spike': 0.05581236058601641, 'adx_thresh': 33.6466736714184, 'atr_min_pct': 0.001659441700486472, 'atr_max_pct': 0.05812381465935853, 'tp_mult': 2.9513512630653063, 'tsl_mult': 0.8638982116798253, 'strategy': 'mean_reversion', 'time_stop': 286, 'use_sma': True, 'use_atr': True, 'use_adx': True, 'use_ema': False, 'use_spike': False, 'rsi_required': True, 'edge_k': 0.4650667353864877, 'edge_cap': 0.05229584327257164, 'bull_strategy': 'breakout', 'bull_bb_std_mult': 3.0974296759890083, 'bull_rsi_os': 9, 'bull_rsi_ob': 71, 'bull_adx_thresh': 8.500016479669979, 'bull_atr_min_pct': 0.02458614566384837, 'bull_atr_max_pct': 0.015387909179158887, 'bull_tp_mult': 2.870410955496177, 'bull_tsl_mult': 0.39790023670105373, 'bull_time_stop': 299, 'bull_use_sma': False, 'bull_use_ema': True, 'bull_use_atr': True, 'bull_use_adx': True, 'bull_use_spike': False, 'bull_rsi_required': False, 'bear_strategy': 'mean_reversion', 'bear_bb_std_mult': 2.654759681741186, 'bear_rsi_os': 22, 'bear_rsi_ob': 93, 'bear_adx_thresh': 34.84231532013817, 'bear_atr_min_pct': 0.0005692225560367647, 'bear_atr_max_pct': 0.027458936151107387, 'bear_tp_mult': 1.6221664775415618, 'bear_tsl_mult': 0.9708350592191355, 'bear_time_stop': 5, 'bear_use_sma': True, 'bear_use_ema': True, 'bear_use_atr': True, 'bear_use_adx': False, 'bear_use_spike': False, 'bear_rsi_required': False, 'sideways_strategy': 'breakout', 'sideways_bb_std_mult': 1.8608949573164155, 'sideways_rsi_os': 49, 'sideways_rsi_ob': 64, 'sideways_adx_thresh': 28.459571650482264, 'sideways_atr_min_pct': 0.029346769657719037, 'sideways_atr_max_pct': 0.07738040587177616, 'sideways_tp_mult': 1.0166608773467982, 'sideways_tsl_mult': 0.09469006756206877, 'sideways_time_stop': 88, 'sideways_use_sma': False, 'sideways_use_ema': True, 'sideways_use_atr': False, 'sideways_use_adx': False, 'sideways_use_spike': False, 'sideways_rsi_required': False}.
[I 2025-08-30 15:20:37,202] Trial 55 finished with values: [-0.11068929230279212, 0.11063774763041456] and parameters: {'p_sma': 41, 'p_std': 60, 'p_atr': 30, 'p_adx': 27, 'rsi_period': 44, 'ema1': 30, 'ema2': 49, 'slip_atr_k': 0.23265292543486107, 'slip_spread_k': 0.4571535174026299, 'spread_hl_frac': 0.04645805531271253, 'bb_std_mult': 1.6521429433782822, 'rsi_os': 16, 'rsi_ob': 67, 'vol_spike': 0.05362780994866863, 'adx_thresh': 30.809243746164658, 'atr_min_pct': 0.012388196271214347, 'atr_max_pct': 0.056879954162943475, 'tp_mult': 2.4459162896172626, 'tsl_mult': 0.982743818057691, 'strategy': 'mean_reversion', 'time_stop': 53, 'use_sma': True, 'use_atr': False, 'use_adx': True, 'use_ema': False, 'use_spike': True, 'rsi_required': True, 'edge_k': 0.465396323042255, 'edge_cap': 0.9627702296709365, 'bull_strategy': 'breakout', 'bull_bb_std_mult': 3.1220160547116342, 'bull_rsi_os': 35, 'bull_rsi_ob': 50, 'bull_adx_thresh': 25.606535359093055, 'bull_atr_min_pct': 0.01758968695740446, 'bull_atr_max_pct': 0.015643069957619903, 'bull_tp_mult': 2.869847538990182, 'bull_tsl_mult': 0.5416663588265879, 'bull_time_stop': 72, 'bull_use_sma': False, 'bull_use_ema': True, 'bull_use_atr': True, 'bull_use_adx': True, 'bull_use_spike': False, 'bull_rsi_required': False, 'bear_strategy': 'mean_reversion', 'bear_bb_std_mult': 2.75441970658849, 'bear_rsi_os': 41, 'bear_rsi_ob': 93, 'bear_adx_thresh': 34.920516363361436, 'bear_atr_min_pct': 0.0006550599421400027, 'bear_atr_max_pct': 0.058206233269441784, 'bear_tp_mult': 1.6335942000474448, 'bear_tsl_mult': 0.8660148078301746, 'bear_time_stop': 269, 'bear_use_sma': True, 'bear_use_ema': True, 'bear_use_atr': False, 'bear_use_adx': False, 'bear_use_spike': False, 'bear_rsi_required': False, 'sideways_strategy': 'breakout', 'sideways_bb_std_mult': 1.8591823178465923, 'sideways_rsi_os': 49, 'sideways_rsi_ob': 65, 'sideways_adx_thresh': 30.468966466600367, 'sideways_atr_min_pct': 4.8917619282959866e-05, 'sideways_atr_max_pct': 0.08839232115974388, 'sideways_tp_mult': 1.4860663162178696, 'sideways_tsl_mult': 0.11973996755459636, 'sideways_time_stop': 182, 'sideways_use_sma': False, 'sideways_use_ema': True, 'sideways_use_atr': False, 'sideways_use_adx': True, 'sideways_use_spike': False, 'sideways_rsi_required': True}.
[I 2025-08-30 15:20:37,225] Trial 56 finished with values: [-0.08070068264239905, 0.08064783179856863] and parameters: {'p_sma': 43, 'p_std': 5, 'p_atr': 29, 'p_adx': 27, 'rsi_period': 35, 'ema1': 30, 'ema2': 52, 'slip_atr_k': 0.2335642367326703, 'slip_spread_k': 0.4684881700684128, 'spread_hl_frac': 0.046535236233434786, 'bb_std_mult': 2.170369469022934, 'rsi_os': 15, 'rsi_ob': 67, 'vol_spike': 0.07102281333877876, 'adx_thresh': 30.888110800244505, 'atr_min_pct': 0.00198261701697674, 'atr_max_pct': 0.05625278643929569, 'tp_mult': 2.8897005045514828, 'tsl_mult': 0.9989093851804047, 'strategy': 'mean_reversion', 'time_stop': 39, 'use_sma': True, 'use_atr': True, 'use_adx': True, 'use_ema': False, 'use_spike': False, 'rsi_required': True, 'edge_k': 0.48050862992605936, 'edge_cap': 0.944815568389477, 'bull_strategy': 'breakout', 'bull_bb_std_mult': 3.0916108345557123, 'bull_rsi_os': 8, 'bull_rsi_ob': 72, 'bull_adx_thresh': 21.345267380267025, 'bull_atr_min_pct': 0.025283993905606882, 'bull_atr_max_pct': 0.02683868490149458, 'bull_tp_mult': 2.8442183911736145, 'bull_tsl_mult': 0.21478125550614607, 'bull_time_stop': 292, 'bull_use_sma': False, 'bull_use_ema': True, 'bull_use_atr': True, 'bull_use_adx': True, 'bull_use_spike': False, 'bull_rsi_required': False, 'bear_strategy': 'mean_reversion', 'bear_bb_std_mult': 1.380436794242125, 'bear_rsi_os': 33, 'bear_rsi_ob': 93, 'bear_adx_thresh': 34.194770360274724, 'bear_atr_min_pct': 0.011304920504671509, 'bear_atr_max_pct': 0.027012057085151392, 'bear_tp_mult': 2.0020597203258865, 'bear_tsl_mult': 0.9681385304591525, 'bear_time_stop': 56, 'bear_use_sma': True, 'bear_use_ema': True, 'bear_use_atr': True, 'bear_use_adx': False, 'bear_use_spike': False, 'bear_rsi_required': False, 'sideways_strategy': 'breakout', 'sideways_bb_std_mult': 1.9320055714795643, 'sideways_rsi_os': 35, 'sideways_rsi_ob': 65, 'sideways_adx_thresh': 13.963165709802759, 'sideways_atr_min_pct': 0.0006927580043296138, 'sideways_atr_max_pct': 0.07668020692251537, 'sideways_tp_mult': 1.097737507463748, 'sideways_tsl_mult': 0.11393039418393389, 'sideways_time_stop': 253, 'sideways_use_sma': False, 'sideways_use_ema': True, 'sideways_use_atr': False, 'sideways_use_adx': False, 'sideways_use_spike': False, 'sideways_rsi_required': False}.
[I 2025-08-30 15:20:38,142] Trial 60 finished with values: [-1000000000.0, 1000000000.0] and parameters: {'p_sma': 36, 'p_std': 56, 'p_atr': 23, 'p_adx': 9, 'rsi_period': 26, 'ema1': 22, 'ema2': 55, 'slip_atr_k': 0.21609154885335885, 'slip_spread_k': 0.3680109886990033, 'spread_hl_frac': 0.0355933028536965, 'bb_std_mult': 3.319095881388753, 'rsi_os': 17, 'rsi_ob': 50, 'vol_spike': 0.025950158223216516, 'adx_thresh': 30.788501204695454, 'atr_min_pct': 0.029325532087573263, 'atr_max_pct': 0.14464512295494109, 'tp_mult': 2.8879228707577704, 'tsl_mult': 0.5946189811873487, 'strategy': 'mean_reversion', 'time_stop': 51, 'use_sma': True, 'use_atr': False, 'use_adx': True, 'use_ema': False, 'use_spike': False, 'rsi_required': True, 'edge_k': 1.9866558731426338, 'edge_cap': 0.8865625623837036, 'bull_strategy': 'breakout', 'bull_bb_std_mult': 3.439061140374606, 'bull_rsi_os': 41, 'bull_rsi_ob': 78, 'bull_adx_thresh': 18.90348465128383, 'bull_atr_min_pct': 0.01776059138032127, 'bull_atr_max_pct': 0.027882277843247726, 'bull_tp_mult': 2.6656022568234325, 'bull_tsl_mult': 0.5474287903422328, 'bull_time_stop': 237, 'bull_use_sma': True, 'bull_use_ema': True, 'bull_use_atr': True, 'bull_use_adx': True, 'bull_use_spike': False, 'bull_rsi_required': False, 'bear_strategy': 'mean_reversion', 'bear_bb_std_mult': 2.1676188834252645, 'bear_rsi_os': 41, 'bear_rsi_ob': 67, 'bear_adx_thresh': 23.27333494255769, 'bear_atr_min_pct': 0.011364742711935726, 'bear_atr_max_pct': 0.074671241793029, 'bear_tp_mult': 1.8175405237980888, 'bear_tsl_mult': 0.8643037791767506, 'bear_time_stop': 32, 'bear_use_sma': True, 'bear_use_ema': True, 'bear_use_atr': True, 'bear_use_adx': False, 'bear_use_spike': False, 'bear_rsi_required': False, 'sideways_strategy': 'breakout', 'sideways_bb_std_mult': 2.555485908696017, 'sideways_rsi_os': 53, 'sideways_rsi_ob': 67, 'sideways_adx_thresh': 13.784972971724319, 'sideways_atr_min_pct': 0.024523417930943307, 'sideways_atr_max_pct': 0.09934066873144465, 'sideways_tp_mult': 2.80990483525055, 'sideways_tsl_mult': 0.12954162025665594, 'sideways_time_stop': 48, 'sideways_use_sma': False, 'sideways_use_ema': True, 'sideways_use_atr': False, 'sideways_use_adx': False, 'sideways_use_spike': False, 'sideways_rsi_required': False}.
[I 2025-08-30 15:20:38,507] Trial 62 finished with values: [-1000000000.0, 1000000000.0] and parameters: {'p_sma': 56, 'p_std': 13, 'p_atr': 20, 'p_adx': 28, 'rsi_period': 17, 'ema1': 24, 'ema2': 51, 'slip_atr_k': 0.1728335764570637, 'slip_spread_k': 0.4951270828807379, 'spread_hl_frac': 0.025202393040792095, 'bb_std_mult': 0.726481454113185, 'rsi_os': 51, 'rsi_ob': 68, 'vol_spike': 0.22658720627764212, 'adx_thresh': 21.65399464882259, 'atr_min_pct': 0.01174999655846251, 'atr_max_pct': 0.12272761107612962, 'tp_mult': 2.2949884893631896, 'tsl_mult': 0.5591798041473298, 'strategy': 'mean_reversion', 'time_stop': 29, 'use_sma': True, 'use_atr': False, 'use_adx': True, 'use_ema': False, 'use_spike': False, 'rsi_required': True, 'edge_k': 0.6264159220662846, 'edge_cap': 0.9674803100845726, 'bull_strategy': 'breakout', 'bull_bb_std_mult': 2.965401777869534, 'bull_rsi_os': 35, 'bull_rsi_ob': 83, 'bull_adx_thresh': 33.932404713029605, 'bull_atr_min_pct': 0.026734319393536172, 'bull_atr_max_pct': 0.019225005614429448, 'bull_tp_mult': 2.5896208255976925, 'bull_tsl_mult': 0.20608705338485428, 'bull_time_stop': 75, 'bull_use_sma': True, 'bull_use_ema': True, 'bull_use_atr': True, 'bull_use_adx': True, 'bull_use_spike': False, 'bull_rsi_required': False, 'bear_strategy': 'mean_reversion', 'bear_bb_std_mult': 1.6268118973496046, 'bear_rsi_os': 28, 'bear_rsi_ob': 89, 'bear_adx_thresh': 27.572837823462866, 'bear_atr_min_pct': 0.017939778643003848, 'bear_atr_max_pct': 0.11084998189544559, 'bear_tp_mult': 2.0448219656512245, 'bear_tsl_mult': 0.4398972375685601, 'bear_time_stop': 53, 'bear_use_sma': True, 'bear_use_ema': True, 'bear_use_atr': True, 'bear_use_adx': False, 'bear_use_spike': False, 'bear_rsi_required': False, 'sideways_strategy': 'breakout', 'sideways_bb_std_mult': 2.3869353100281323, 'sideways_rsi_os': 49, 'sideways_rsi_ob': 75, 'sideways_adx_thresh': 25.83098763759564, 'sideways_atr_min_pct': 0.0002273044677962386, 'sideways_atr_max_pct': 0.11264504750268323, 'sideways_tp_mult': 1.4193716137223926, 'sideways_tsl_mult': 0.5364507327601264, 'sideways_time_stop': 256, 'sideways_use_sma': False, 'sideways_use_ema': True, 'sideways_use_atr': False, 'sideways_use_adx': True, 'sideways_use_spike': False, 'sideways_rsi_required': False}.
[I 2025-08-30 15:21:14,291] Trial 58 finished with values: [-1000000000.0, 1000000000.0] and parameters: {'p_sma': 43, 'p_std': 56, 'p_atr': 12, 'p_adx': 27, 'rsi_period': 35, 'ema1': 23, 'ema2': 19, 'slip_atr_k': 0.2139652997807629, 'slip_spread_k': 0.8645704466381628, 'spread_hl_frac': 0.035778552426133786, 'bb_std_mult': 0.757697682627041, 'rsi_os': 14, 'rsi_ob': 66, 'vol_spike': 0.042067698314473365, 'adx_thresh': 33.537898517542644, 'atr_min_pct': 0.0017120745570024642, 'atr_max_pct': 0.057766939871088274, 'tp_mult': 2.7330546864089866, 'tsl_mult': 0.6061344851937784, 'strategy': 'mean_reversion', 'time_stop': 36, 'use_sma': True, 'use_atr': False, 'use_adx': True, 'use_ema': False, 'use_spike': False, 'rsi_required': True, 'edge_k': 1.3646699671183935, 'edge_cap': 0.062260342982118966, 'bull_strategy': 'breakout', 'bull_bb_std_mult': 3.1045550454823636, 'bull_rsi_os': 28, 'bull_rsi_ob': 71, 'bull_adx_thresh': 34.99434555876165, 'bull_atr_min_pct': 0.025641118898588486, 'bull_atr_max_pct': 0.027009505852196025, 'bull_tp_mult': 2.875474154788733, 'bull_tsl_mult': 0.40487031525527717, 'bull_time_stop': 232, 'bull_use_sma': True, 'bull_use_ema': True, 'bull_use_atr': True, 'bull_use_adx': True, 'bull_use_spike': False, 'bull_rsi_required': False, 'bear_strategy': 'mean_reversion', 'bear_bb_std_mult': 2.689538125025778, 'bear_rsi_os': 22, 'bear_rsi_ob': 93, 'bear_adx_thresh': 33.27465340718644, 'bear_atr_min_pct': 0.018273722749947686, 'bear_atr_max_pct': 0.07629964386859464, 'bear_tp_mult': 1.6076275118215233, 'bear_tsl_mult': 0.852822600165873, 'bear_time_stop': 29, 'bear_use_sma': True, 'bear_use_ema': True, 'bear_use_atr': True, 'bear_use_adx': False, 'bear_use_spike': False, 'bear_rsi_required': False, 'sideways_strategy': 'breakout', 'sideways_bb_std_mult': 1.8585188186501551, 'sideways_rsi_os': 53, 'sideways_rsi_ob': 66, 'sideways_adx_thresh': 14.064883654255187, 'sideways_atr_min_pct': 0.02531951132153368, 'sideways_atr_max_pct': 0.07688390533736324, 'sideways_tp_mult': 2.8126783460272495, 'sideways_tsl_mult': 0.12385648358866319, 'sideways_time_stop': 268, 'sideways_use_sma': False, 'sideways_use_ema': True, 'sideways_use_atr': False, 'sideways_use_adx': True, 'sideways_use_spike': False, 'sideways_rsi_required': False}.
[I 2025-08-30 15:21:27,072] Trial 59 finished with values: [-1000000000.0, 1000000000.0] and parameters: {'p_sma': 56, 'p_std': 56, 'p_atr': 23, 'p_adx': 27, 'rsi_period': 25, 'ema1': 24, 'ema2': 36, 'slip_atr_k': 0.17433120479378483, 'slip_spread_k': 0.8012628881543598, 'spread_hl_frac': 0.04690866424522458, 'bb_std_mult': 3.1488379214070923, 'rsi_os': 15, 'rsi_ob': 68, 'vol_spike': 0.22636219919977557, 'adx_thresh': 33.341468672669755, 'atr_min_pct': 0.029754549784040112, 'atr_max_pct': 0.0937910676824552, 'tp_mult': 2.905378056564372, 'tsl_mult': 0.31805699153916106, 'strategy': 'mean_reversion', 'time_stop': 66, 'use_sma': True, 'use_atr': False, 'use_adx': True, 'use_ema': False, 'use_spike': False, 'rsi_required': True, 'edge_k': 0.5981225614210361, 'edge_cap': 0.9508077255452891, 'bull_strategy': 'breakout', 'bull_bb_std_mult': 2.8419569403488745, 'bull_rsi_os': 28, 'bull_rsi_ob': 77, 'bull_adx_thresh': 18.87381426966398, 'bull_atr_min_pct': 0.02625848829934714, 'bull_atr_max_pct': 0.027867288036052897, 'bull_tp_mult': 2.591234111491516, 'bull_tsl_mult': 0.20662108092207354, 'bull_time_stop': 72, 'bull_use_sma': True, 'bull_use_ema': True, 'bull_use_atr': True, 'bull_use_adx': True, 'bull_use_spike': False, 'bull_rsi_required': False, 'bear_strategy': 'mean_reversion', 'bear_bb_std_mult': 1.6631029631684608, 'bear_rsi_os': 36, 'bear_rsi_ob': 89, 'bear_adx_thresh': 32.77497278110116, 'bear_atr_min_pct': 0.01853251073435141, 'bear_atr_max_pct': 0.013117460502421852, 'bear_tp_mult': 1.8073737145905198, 'bear_tsl_mult': 0.8702809063244847, 'bear_time_stop': 32, 'bear_use_sma': True, 'bear_use_ema': True, 'bear_use_atr': True, 'bear_use_adx': False, 'bear_use_spike': False, 'bear_rsi_required': False, 'sideways_strategy': 'breakout', 'sideways_bb_std_mult': 1.2887689010754904, 'sideways_rsi_os': 39, 'sideways_rsi_ob': 67, 'sideways_adx_thresh': 14.535096477590837, 'sideways_atr_min_pct': 0.010957790819076949, 'sideways_atr_max_pct': 0.04422288433802327, 'sideways_tp_mult': 2.7694360641542235, 'sideways_tsl_mult': 0.121287370689289, 'sideways_time_stop': 257, 'sideways_use_sma': False, 'sideways_use_ema': True, 'sideways_use_atr': False, 'sideways_use_adx': True, 'sideways_use_spike': False, 'sideways_rsi_required': False}.
[I 2025-08-30 15:21:28,038] Trial 61 finished with values: [-1000000000.0, 1000000000.0] and parameters: {'p_sma': 20, 'p_std': 59, 'p_atr': 7, 'p_adx': 9, 'rsi_period': 25, 'ema1': 22, 'ema2': 18, 'slip_atr_k': 0.09485404764756983, 'slip_spread_k': 0.36703239180441605, 'spread_hl_frac': 7.358586734240724e-05, 'bb_std_mult': 2.6362525659871205, 'rsi_os': 16, 'rsi_ob': 68, 'vol_spike': 0.02263829180124699, 'adx_thresh': 32.88380091239108, 'atr_min_pct': 0.011520241891824391, 'atr_max_pct': 0.14861097531177608, 'tp_mult': 2.2988509448000287, 'tsl_mult': 0.3322681243161909, 'strategy': 'mean_reversion', 'time_stop': 53, 'use_sma': True, 'use_atr': False, 'use_adx': True, 'use_ema': False, 'use_spike': False, 'rsi_required': True, 'edge_k': 0.6242635481734103, 'edge_cap': 0.20341122884896728, 'bull_strategy': 'breakout', 'bull_bb_std_mult': 3.4281726303811664, 'bull_rsi_os': 28, 'bull_rsi_ob': 78, 'bull_adx_thresh': 18.93433234479223, 'bull_atr_min_pct': 0.017619142974440866, 'bull_atr_max_pct': 0.026593776364674207, 'bull_tp_mult': 2.6175484039062127, 'bull_tsl_mult': 0.4724898965136552, 'bull_time_stop': 72, 'bull_use_sma': True, 'bull_use_ema': True, 'bull_use_atr': True, 'bull_use_adx': True, 'bull_use_spike': False, 'bull_rsi_required': False, 'bear_strategy': 'mean_reversion', 'bear_bb_std_mult': 1.358752716880713, 'bear_rsi_os': 5, 'bear_rsi_ob': 85, 'bear_adx_thresh': 23.92592308892153, 'bear_atr_min_pct': 0.011181051521791292, 'bear_atr_max_pct': 0.010493020967485042, 'bear_tp_mult': 2.033897501154732, 'bear_tsl_mult': 0.8476891759956952, 'bear_time_stop': 124, 'bear_use_sma': True, 'bear_use_ema': True, 'bear_use_atr': True, 'bear_use_adx': False, 'bear_use_spike': False, 'bear_rsi_required': False, 'sideways_strategy': 'breakout', 'sideways_bb_std_mult': 2.143708777279427, 'sideways_rsi_os': 52, 'sideways_rsi_ob': 66, 'sideways_adx_thresh': 31.767853515180946, 'sideways_atr_min_pct': 0.024771066453993195, 'sideways_atr_max_pct': 0.10044724974218276, 'sideways_tp_mult': 1.4310844536186615, 'sideways_tsl_mult': 0.1289616261451686, 'sideways_time_stop': 54, 'sideways_use_sma': False, 'sideways_use_ema': True, 'sideways_use_atr': False, 'sideways_use_adx': False, 'sideways_use_spike': False, 'sideways_rsi_required': False}.
