[I 2025-08-30 17:17:30,228] Trial 702 finished with values: [-1000000000.0, 1000000000.0] and parameters: {'p_sma': 24, 'p_std': 46, 'p_atr': 15, 'p_adx': 7, 'rsi_period': 23, 'ema1': 18, 'ema2': 47, 'slip_atr_k': 0.008093342939305493, 'slip_spread_k': 0.17009250634433173, 'spread_hl_frac': 0.016065124034051873, 'bb_std_mult': 3.148961504292154, 'rsi_os': 28, 'rsi_ob': 87, 'vol_spike': 0.07841564162065184, 'adx_thresh': 10.390953004599774, 'atr_min_pct': 0.007407888056455985, 'atr_max_pct': 0.10989162689385173, 'tp_mult': 2.8539009332681062, 'tsl_mult': 0.9604341138192622, 'strategy': 'breakout', 'time_stop': 274, 'use_sma': False, 'use_atr': True, 'use_adx': True, 'use_ema': False, 'use_spike': False, 'rsi_required': False, 'edge_k': 0.6608965233867631, 'edge_cap': 0.7527857783980194, 'bull_strategy': 'mean_reversion', 'bull_bb_std_mult': 1.9300519231052116, 'bull_rsi_os': 10, 'bull_rsi_ob': 52, 'bull_adx_thresh': 34.39371301667378, 'bull_atr_min_pct': 0.017445626490368, 'bull_atr_max_pct': 0.051728717996634324, 'bull_tp_mult': 2.2715969246699736, 'bull_tsl_mult': 0.8076103732592002, 'bull_time_stop': 65, 'bull_use_sma': True, 'bull_use_ema': True, 'bull_use_atr': False, 'bull_use_adx': True, 'bull_use_spike': True, 'bull_rsi_required': False, 'bear_strategy': 'mean_reversion', 'bear_bb_std_mult': 1.0947056437791765, 'bear_rsi_os': 44, 'bear_rsi_ob': 77, 'bear_adx_thresh': 17.781354386661782, 'bear_atr_min_pct': 0.02038924479772417, 'bear_atr_max_pct': 0.10551765935160004, 'bear_tp_mult': 2.806112554460572, 'bear_tsl_mult': 0.9031378250092369, 'bear_time_stop': 173, 'bear_use_sma': True, 'bear_use_ema': False, 'bear_use_atr': False, 'bear_use_adx': False, 'bear_use_spike': True, 'bear_rsi_required': True, 'sideways_strategy': 'breakout', 'sideways_bb_std_mult': 0.8975602708846123, 'sideways_rsi_os': 46, 'sideways_rsi_ob': 85, 'sideways_adx_thresh': 11.565255158138536, 'sideways_atr_min_pct': 0.019250346083325764, 'sideways_atr_max_pct': 0.12499511560825066, 'sideways_tp_mult': 2.0483837478915747, 'sideways_tsl_mult': 0.38974640598240573, 'sideways_time_stop': 291, 'sideways_use_sma': True, 'sideways_use_ema': False, 'sideways_use_atr': False, 'sideways_use_adx': False, 'sideways_use_spike': False, 'sideways_rsi_required': True}.
[I 2025-08-30 17:17:31,030] Trial 703 finished with values: [-1000000000.0, 1000000000.0] and parameters: {'p_sma': 24, 'p_std': 18, 'p_atr': 17, 'p_adx': 7, 'rsi_period': 70, 'ema1': 16, 'ema2': 19, 'slip_atr_k': 0.004571146864900345, 'slip_spread_k': 0.21876903832219186, 'spread_hl_frac': 0.03436577650400514, 'bb_std_mult': 3.1507950728769223, 'rsi_os': 16, 'rsi_ob': 87, 'vol_spike': 0.0804329065241123, 'adx_thresh': 11.971598864119017, 'atr_min_pct': 0.01895767625951739, 'atr_max_pct': 0.1425808298946535, 'tp_mult': 2.8530280268942114, 'tsl_mult': 0.9537792707127264, 'strategy': 'breakout', 'time_stop': 31, 'use_sma': True, 'use_atr': True, 'use_adx': True, 'use_ema': False, 'use_spike': True, 'rsi_required': False, 'edge_k': 0.6744233613010862, 'edge_cap': 0.7300808294458151, 'bull_strategy': 'breakout', 'bull_bb_std_mult': 0.9684397749229889, 'bull_rsi_os': 10, 'bull_rsi_ob': 90, 'bull_adx_thresh': 5.397525106100494, 'bull_atr_min_pct': 0.025778110322807093, 'bull_atr_max_pct': 0.14051565786039907, 'bull_tp_mult': 2.186198285160215, 'bull_tsl_mult': 0.8099757248487571, 'bull_time_stop': 64, 'bull_use_sma': True, 'bull_use_ema': True, 'bull_use_atr': False, 'bull_use_adx': True, 'bull_use_spike': True, 'bull_rsi_required': False, 'bear_strategy': 'mean_reversion', 'bear_bb_std_mult': 1.0987671903153091, 'bear_rsi_os': 35, 'bear_rsi_ob': 72, 'bear_adx_thresh': 17.690966542207654, 'bear_atr_min_pct': 0.0235165384357873, 'bear_atr_max_pct': 0.041770738051651816, 'bear_tp_mult': 2.2595069891118906, 'bear_tsl_mult': 0.6825219824328865, 'bear_time_stop': 299, 'bear_use_sma': True, 'bear_use_ema': False, 'bear_use_atr': True, 'bear_use_adx': True, 'bear_use_spike': True, 'bear_rsi_required': True, 'sideways_strategy': 'breakout', 'sideways_bb_std_mult': 0.8702516700673406, 'sideways_rsi_os': 20, 'sideways_rsi_ob': 62, 'sideways_adx_thresh': 33.27740383494047, 'sideways_atr_min_pct': 0.0006001097699965359, 'sideways_atr_max_pct': 0.016270304332044155, 'sideways_tp_mult': 2.921703822279013, 'sideways_tsl_mult': 0.7043021080468167, 'sideways_time_stop': 166, 'sideways_use_sma': True, 'sideways_use_ema': True, 'sideways_use_atr': False, 'sideways_use_adx': False, 'sideways_use_spike': False, 'sideways_rsi_required': True}.
[I 2025-08-30 17:18:11,193] Trial 705 finished with values: [-0.026905382040644743, 0.0268137822577163] and parameters: {'p_sma': 25, 'p_std': 32, 'p_atr': 15, 'p_adx': 7, 'rsi_period': 23, 'ema1': 16, 'ema2': 11, 'slip_atr_k': 0.03135637339638783, 'slip_spread_k': 0.1380178675443575, 'spread_hl_frac': 0.003366509125316851, 'bb_std_mult': 3.0488547019711443, 'rsi_os': 28, 'rsi_ob': 63, 'vol_spike': 0.10022116753805402, 'adx_thresh': 10.489179399223016, 'atr_min_pct': 0.019059591699234404, 'atr_max_pct': 0.06031450473792818, 'tp_mult': 2.839378574127221, 'tsl_mult': 0.08740577459665538, 'strategy': 'breakout', 'time_stop': 31, 'use_sma': True, 'use_atr': True, 'use_adx': True, 'use_ema': True, 'use_spike': True, 'rsi_required': False, 'edge_k': 0.6266789983867522, 'edge_cap': 0.8835579802029608, 'bull_strategy': 'breakout', 'bull_bb_std_mult': 1.3948462281829799, 'bull_rsi_os': 10, 'bull_rsi_ob': 86, 'bull_adx_thresh': 32.04195148819029, 'bull_atr_min_pct': 0.023199236056346318, 'bull_atr_max_pct': 0.04970260821749698, 'bull_tp_mult': 2.181187834907275, 'bull_tsl_mult': 0.9621669463452969, 'bull_time_stop': 75, 'bull_use_sma': True, 'bull_use_ema': False, 'bull_use_atr': False, 'bull_use_adx': True, 'bull_use_spike': True, 'bull_rsi_required': True, 'bear_strategy': 'breakout', 'bear_bb_std_mult': 1.4428096861503394, 'bear_rsi_os': 50, 'bear_rsi_ob': 74, 'bear_adx_thresh': 20.42909670110974, 'bear_atr_min_pct': 0.020619072042502063, 'bear_atr_max_pct': 0.10329000933445596, 'bear_tp_mult': 2.8175908743039697, 'bear_tsl_mult': 0.5646158278199334, 'bear_time_stop': 215, 'bear_use_sma': False, 'bear_use_ema': False, 'bear_use_atr': True, 'bear_use_adx': True, 'bear_use_spike': True, 'bear_rsi_required': True, 'sideways_strategy': 'breakout', 'sideways_bb_std_mult': 0.8565852712037413, 'sideways_rsi_os': 39, 'sideways_rsi_ob': 47, 'sideways_adx_thresh': 33.240136045973394, 'sideways_atr_min_pct': 0.0023851462960028788, 'sideways_atr_max_pct': 0.06474549412054767, 'sideways_tp_mult': 1.1636492811535417, 'sideways_tsl_mult': 0.3938976879975628, 'sideways_time_stop': 286, 'sideways_use_sma': True, 'sideways_use_ema': True, 'sideways_use_atr': True, 'sideways_use_adx': True, 'sideways_use_spike': True, 'sideways_rsi_required': False}.
[I 2025-08-30 17:18:11,845] Trial 706 finished with values: [-1000000000.0, 1000000000.0] and parameters: {'p_sma': 8, 'p_std': 22, 'p_atr': 17, 'p_adx': 11, 'rsi_period': 7, 'ema1': 9, 'ema2': 13, 'slip_atr_k': 0.005799460238844159, 'slip_spread_k': 0.1377187541327104, 'spread_hl_frac': 0.02377293150813956, 'bb_std_mult': 0.5690621147488453, 'rsi_os': 33, 'rsi_ob': 83, 'vol_spike': 0.08577689505180339, 'adx_thresh': 11.907970862968309, 'atr_min_pct': 0.01942357904885844, 'atr_max_pct': 0.14751426580985094, 'tp_mult': 2.7212089643301005, 'tsl_mult': 0.8660991885684795, 'strategy': 'breakout', 'time_stop': 289, 'use_sma': True, 'use_atr': True, 'use_adx': True, 'use_ema': True, 'use_spike': True, 'rsi_required': False, 'edge_k': 0.1672367584134427, 'edge_cap': 0.4224353565260231, 'bull_strategy': 'breakout', 'bull_bb_std_mult': 0.5060899354661408, 'bull_rsi_os': 22, 'bull_rsi_ob': 52, 'bull_adx_thresh': 15.78216878262528, 'bull_atr_min_pct': 0.005169855499235668, 'bull_atr_max_pct': 0.14642544285814366, 'bull_tp_mult': 2.391030255120575, 'bull_tsl_mult': 0.7925187658705322, 'bull_time_stop': 206, 'bull_use_sma': True, 'bull_use_ema': False, 'bull_use_atr': False, 'bull_use_adx': True, 'bull_use_spike': True, 'bull_rsi_required': True, 'bear_strategy': 'breakout', 'bear_bb_std_mult': 1.4535869518450293, 'bear_rsi_os': 35, 'bear_rsi_ob': 74, 'bear_adx_thresh': 12.522500065908561, 'bear_atr_min_pct': 0.023677972507749008, 'bear_atr_max_pct': 0.10248518909285363, 'bear_tp_mult': 2.124535963579642, 'bear_tsl_mult': 0.6802664096050073, 'bear_time_stop': 215, 'bear_use_sma': False, 'bear_use_ema': False, 'bear_use_atr': True, 'bear_use_adx': True, 'bear_use_spike': True, 'bear_rsi_required': True, 'sideways_strategy': 'breakout', 'sideways_bb_std_mult': 0.8640464134303681, 'sideways_rsi_os': 39, 'sideways_rsi_ob': 94, 'sideways_adx_thresh': 12.622049236769987, 'sideways_atr_min_pct': 0.003282215007741019, 'sideways_atr_max_pct': 0.053661957302098905, 'sideways_tp_mult': 2.4759835689327376, 'sideways_tsl_mult': 0.4582639137562892, 'sideways_time_stop': 164, 'sideways_use_sma': True, 'sideways_use_ema': True, 'sideways_use_atr': True, 'sideways_use_adx': True, 'sideways_use_spike': True, 'sideways_rsi_required': False}.
[I 2025-08-30 17:18:11,846] Trial 704 finished with values: [-1000000000.0, 1000000000.0] and parameters: {'p_sma': 25, 'p_std': 20, 'p_atr': 15, 'p_adx': 7, 'rsi_period': 23, 'ema1': 16, 'ema2': 13, 'slip_atr_k': 0.11254663932110119, 'slip_spread_k': 0.22013511075341885, 'spread_hl_frac': 0.023838690740893776, 'bb_std_mult': 3.490625400601458, 'rsi_os': 31, 'rsi_ob': 63, 'vol_spike': 0.10008553474197744, 'adx_thresh': 25.985489948152548, 'atr_min_pct': 0.01909083946239214, 'atr_max_pct': 0.05609503357572729, 'tp_mult': 2.851814348094834, 'tsl_mult': 0.9775812243055153, 'strategy': 'breakout', 'time_stop': 127, 'use_sma': True, 'use_atr': True, 'use_adx': True, 'use_ema': True, 'use_spike': True, 'rsi_required': False, 'edge_k': 0.20168045402670043, 'edge_cap': 0.20943498025141477, 'bull_strategy': 'breakout', 'bull_bb_std_mult': 1.963889820767884, 'bull_rsi_os': 10, 'bull_rsi_ob': 69, 'bull_adx_thresh': 15.41007746410571, 'bull_atr_min_pct': 0.02245456534287132, 'bull_atr_max_pct': 0.14694586159472994, 'bull_tp_mult': 2.220980694177442, 'bull_tsl_mult': 0.8144714045576825, 'bull_time_stop': 75, 'bull_use_sma': True, 'bull_use_ema': False, 'bull_use_atr': False, 'bull_use_adx': True, 'bull_use_spike': True, 'bull_rsi_required': True, 'bear_strategy': 'breakout', 'bear_bb_std_mult': 1.425903227020479, 'bear_rsi_os': 14, 'bear_rsi_ob': 67, 'bear_adx_thresh': 10.101624357393526, 'bear_atr_min_pct': 0.023606076502116973, 'bear_atr_max_pct': 0.10558654793021818, 'bear_tp_mult': 2.2734710577109825, 'bear_tsl_mult': 0.69031510930518, 'bear_time_stop': 5, 'bear_use_sma': True, 'bear_use_ema': False, 'bear_use_atr': True, 'bear_use_adx': True, 'bear_use_spike': True, 'bear_rsi_required': True, 'sideways_strategy': 'breakout', 'sideways_bb_std_mult': 0.8621644616893143, 'sideways_rsi_os': 39, 'sideways_rsi_ob': 47, 'sideways_adx_thresh': 33.14157751782571, 'sideways_atr_min_pct': 0.01985610783742428, 'sideways_atr_max_pct': 0.015100637703635442, 'sideways_tp_mult': 2.748404318574699, 'sideways_tsl_mult': 0.1331503996345671, 'sideways_time_stop': 286, 'sideways_use_sma': True, 'sideways_use_ema': True, 'sideways_use_atr': True, 'sideways_use_adx': False, 'sideways_use_spike': True, 'sideways_rsi_required': False}.
[I 2025-08-30 17:18:11,942] Trial 707 finished with values: [-0.04640576985322131, 0.04631075518470643] and parameters: {'p_sma': 30, 'p_std': 20, 'p_atr': 16, 'p_adx': 11, 'rsi_period': 23, 'ema1': 21, 'ema2': 11, 'slip_atr_k': 0.11645902053031969, 'slip_spread_k': 0.13433519620874979, 'spread_hl_frac': 0.012794378378069642, 'bb_std_mult': 3.052852355066266, 'rsi_os': 23, 'rsi_ob': 75, 'vol_spike': 0.09903324254341396, 'adx_thresh': 25.65228221155365, 'atr_min_pct': 0.009446584547590647, 'atr_max_pct': 0.10040669090154253, 'tp_mult': 2.695428348129221, 'tsl_mult': 0.9163383846517046, 'strategy': 'mean_reversion', 'time_stop': 30, 'use_sma': True, 'use_atr': True, 'use_adx': True, 'use_ema': True, 'use_spike': True, 'rsi_required': True, 'edge_k': 0.4966873336123811, 'edge_cap': 0.816467292829794, 'bull_strategy': 'breakout', 'bull_bb_std_mult': 1.3979113380291015, 'bull_rsi_os': 12, 'bull_rsi_ob': 69, 'bull_adx_thresh': 15.126981951627021, 'bull_atr_min_pct': 0.022975487410755363, 'bull_atr_max_pct': 0.14645259942352537, 'bull_tp_mult': 2.391340876735659, 'bull_tsl_mult': 0.7932607402591966, 'bull_time_stop': 74, 'bull_use_sma': True, 'bull_use_ema': False, 'bull_use_atr': False, 'bull_use_adx': True, 'bull_use_spike': False, 'bull_rsi_required': True, 'bear_strategy': 'breakout', 'bear_bb_std_mult': 1.422210084113254, 'bear_rsi_os': 15, 'bear_rsi_ob': 67, 'bear_adx_thresh': 10.332511325899151, 'bear_atr_min_pct': 0.014588542366636127, 'bear_atr_max_pct': 0.04951428926444719, 'bear_tp_mult': 2.1154366597855363, 'bear_tsl_mult': 0.011121734383845228, 'bear_time_stop': 114, 'bear_use_sma': False, 'bear_use_ema': False, 'bear_use_atr': True, 'bear_use_adx': True, 'bear_use_spike': False, 'bear_rsi_required': False, 'sideways_strategy': 'breakout', 'sideways_bb_std_mult': 0.671318996505356, 'sideways_rsi_os': 38, 'sideways_rsi_ob': 94, 'sideways_adx_thresh': 12.507808723098213, 'sideways_atr_min_pct': 0.0020860590902231405, 'sideways_atr_max_pct': 0.07174168336846773, 'sideways_tp_mult': 2.960534591609881, 'sideways_tsl_mult': 0.46908887309446834, 'sideways_time_stop': 286, 'sideways_use_sma': True, 'sideways_use_ema': True, 'sideways_use_atr': True, 'sideways_use_adx': True, 'sideways_use_spike': True, 'sideways_rsi_required': False}.
[I 2025-08-30 17:18:50,808] Trial 710 finished with values: [-1000000000.0, 1000000000.0] and parameters: {'p_sma': 7, 'p_std': 38, 'p_atr': 16, 'p_adx': 9, 'rsi_period': 26, 'ema1': 30, 'ema2': 10, 'slip_atr_k': 0.012464985684573117, 'slip_spread_k': 0.9269631197362824, 'spread_hl_frac': 0.020004189768223865, 'bb_std_mult': 3.2700574281078554, 'rsi_os': 34, 'rsi_ob': 85, 'vol_spike': 0.08855790835470685, 'adx_thresh': 9.618539474642603, 'atr_min_pct': 0.01804126818085553, 'atr_max_pct': 0.14999524609736775, 'tp_mult': 2.660792479084964, 'tsl_mult': 0.33807809696156227, 'strategy': 'mean_reversion', 'time_stop': 177, 'use_sma': False, 'use_atr': False, 'use_adx': False, 'use_ema': False, 'use_spike': False, 'rsi_required': True, 'edge_k': 0.2716419583495062, 'edge_cap': 0.9662275159992424, 'bull_strategy': 'mean_reversion', 'bull_bb_std_mult': 2.4956521455265936, 'bull_rsi_os': 38, 'bull_rsi_ob': 56, 'bull_adx_thresh': 10.719443683836861, 'bull_atr_min_pct': 0.021814354354736328, 'bull_atr_max_pct': 0.13772565964185685, 'bull_tp_mult': 2.8700575336093754, 'bull_tsl_mult': 0.5426803758922922, 'bull_time_stop': 55, 'bull_use_sma': True, 'bull_use_ema': True, 'bull_use_atr': False, 'bull_use_adx': False, 'bull_use_spike': False, 'bull_rsi_required': False, 'bear_strategy': 'mean_reversion', 'bear_bb_std_mult': 2.819257077156384, 'bear_rsi_os': 15, 'bear_rsi_ob': 76, 'bear_adx_thresh': 11.215405146138743, 'bear_atr_min_pct': 0.01744696346832822, 'bear_atr_max_pct': 0.07619888176046187, 'bear_tp_mult': 2.208423236521206, 'bear_tsl_mult': 0.5977710460457918, 'bear_time_stop': 201, 'bear_use_sma': True, 'bear_use_ema': False, 'bear_use_atr': False, 'bear_use_adx': False, 'bear_use_spike': False, 'bear_rsi_required': False, 'sideways_strategy': 'mean_reversion', 'sideways_bb_std_mult': 0.7576785040750388, 'sideways_rsi_os': 15, 'sideways_rsi_ob': 91, 'sideways_adx_thresh': 9.308897491814992, 'sideways_atr_min_pct': 0.013702184192828445, 'sideways_atr_max_pct': 0.10107662669069059, 'sideways_tp_mult': 2.824592636267358, 'sideways_tsl_mult': 0.42123659048644696, 'sideways_time_stop': 174, 'sideways_use_sma': False, 'sideways_use_ema': False, 'sideways_use_atr': False, 'sideways_use_adx': False, 'sideways_use_spike': False, 'sideways_rsi_required': True}.
[I 2025-08-30 17:18:51,011] Trial 708 finished with values: [-1000000000.0, 1000000000.0] and parameters: {'p_sma': 8, 'p_std': 42, 'p_atr': 16, 'p_adx': 11, 'rsi_period': 25, 'ema1': 22, 'ema2': 13, 'slip_atr_k': 0.012431167053029255, 'slip_spread_k': 0.8769644587639533, 'spread_hl_frac': 0.023925154328929815, 'bb_std_mult': 3.294065055061659, 'rsi_os': 34, 'rsi_ob': 76, 'vol_spike': 0.09928718401070845, 'adx_thresh': 11.401254344111141, 'atr_min_pct': 0.00951388949983737, 'atr_max_pct': 0.14972599636346992, 'tp_mult': 1.2344909610099637, 'tsl_mult': 0.2655926518675996, 'strategy': 'mean_reversion', 'time_stop': 178, 'use_sma': False, 'use_atr': True, 'use_adx': True, 'use_ema': True, 'use_spike': False, 'rsi_required': True, 'edge_k': 0.48608396468243015, 'edge_cap': 0.9758256494012361, 'bull_strategy': 'mean_reversion', 'bull_bb_std_mult': 1.8278262042710332, 'bull_rsi_os': 49, 'bull_rsi_ob': 69, 'bull_adx_thresh': 33.397311352782054, 'bull_atr_min_pct': 0.02136310545198224, 'bull_atr_max_pct': 0.14606141084519023, 'bull_tp_mult': 2.3876573436898116, 'bull_tsl_mult': 0.72814840278291, 'bull_time_stop': 54, 'bull_use_sma': True, 'bull_use_ema': False, 'bull_use_atr': False, 'bull_use_adx': True, 'bull_use_spike': False, 'bull_rsi_required': True, 'bear_strategy': 'breakout', 'bear_bb_std_mult': 1.1822996476535557, 'bear_rsi_os': 15, 'bear_rsi_ob': 66, 'bear_adx_thresh': 29.166410728200248, 'bear_atr_min_pct': 0.0006053905813874893, 'bear_atr_max_pct': 0.14620973948128949, 'bear_tp_mult': 2.3907407986877294, 'bear_tsl_mult': 0.603142201463572, 'bear_time_stop': 202, 'bear_use_sma': False, 'bear_use_ema': False, 'bear_use_atr': False, 'bear_use_adx': False, 'bear_use_spike': False, 'bear_rsi_required': False, 'sideways_strategy': 'breakout', 'sideways_bb_std_mult': 0.6693359913100141, 'sideways_rsi_os': 34, 'sideways_rsi_ob': 94, 'sideways_adx_thresh': 12.731580683976492, 'sideways_atr_min_pct': 0.02236322184781639, 'sideways_atr_max_pct': 0.0860880235418973, 'sideways_tp_mult': 2.3781133102789465, 'sideways_tsl_mult': 0.4689680787242748, 'sideways_time_stop': 40, 'sideways_use_sma': True, 'sideways_use_ema': False, 'sideways_use_atr': True, 'sideways_use_adx': True, 'sideways_use_spike': True, 'sideways_rsi_required': False}.
[I 2025-08-30 17:18:51,186] Trial 711 finished with values: [-1000000000.0, 1000000000.0] and parameters: {'p_sma': 51, 'p_std': 42, 'p_atr': 16, 'p_adx': 9, 'rsi_period': 43, 'ema1': 17, 'ema2': 25, 'slip_atr_k': 0.013160462990596172, 'slip_spread_k': 0.18784451287325601, 'spread_hl_frac': 0.01960268812458279, 'bb_std_mult': 2.3544173805051907, 'rsi_os': 26, 'rsi_ob': 85, 'vol_spike': 0.06995530876206207, 'adx_thresh': 9.714310454386442, 'atr_min_pct': 0.019853363012969243, 'atr_max_pct': 0.1499927391047155, 'tp_mult': 1.2459948201215165, 'tsl_mult': 0.3356083104724677, 'strategy': 'mean_reversion', 'time_stop': 23, 'use_sma': False, 'use_atr': False, 'use_adx': False, 'use_ema': False, 'use_spike': False, 'rsi_required': True, 'edge_k': 0.7495647805899424, 'edge_cap': 0.35399797209533623, 'bull_strategy': 'mean_reversion', 'bull_bb_std_mult': 1.6765241918371292, 'bull_rsi_os': 49, 'bull_rsi_ob': 56, 'bull_adx_thresh': 34.93615334114, 'bull_atr_min_pct': 0.02150097766179551, 'bull_atr_max_pct': 0.05767631023535461, 'bull_tp_mult': 2.2342301947327936, 'bull_tsl_mult': 0.5407590282351196, 'bull_time_stop': 125, 'bull_use_sma': True, 'bull_use_ema': True, 'bull_use_atr': False, 'bull_use_adx': False, 'bull_use_spike': False, 'bull_rsi_required': False, 'bear_strategy': 'mean_reversion', 'bear_bb_std_mult': 2.826679284295564, 'bear_rsi_os': 7, 'bear_rsi_ob': 91, 'bear_adx_thresh': 11.231607238244566, 'bear_atr_min_pct': 0.02710276925007761, 'bear_atr_max_pct': 0.10984674881227305, 'bear_tp_mult': 2.1952659231553358, 'bear_tsl_mult': 0.28336732966704037, 'bear_time_stop': 206, 'bear_use_sma': True, 'bear_use_ema': False, 'bear_use_atr': False, 'bear_use_adx': False, 'bear_use_spike': False, 'bear_rsi_required': False, 'sideways_strategy': 'mean_reversion', 'sideways_bb_std_mult': 2.501836130054572, 'sideways_rsi_os': 33, 'sideways_rsi_ob': 91, 'sideways_adx_thresh': 9.562742410090507, 'sideways_atr_min_pct': 0.013676610368352111, 'sideways_atr_max_pct': 0.09972111138347632, 'sideways_tp_mult': 2.8322275046822516, 'sideways_tsl_mult': 0.42106937366802405, 'sideways_time_stop': 173, 'sideways_use_sma': False, 'sideways_use_ema': False, 'sideways_use_atr': False, 'sideways_use_adx': False, 'sideways_use_spike': False, 'sideways_rsi_required': True}.
