[I 2025-08-30 15:24:57,015] Trial 81 finished with values: [-1000000000.0, 1000000000.0] and parameters: {'p_sma': 6, 'p_std': 9, 'p_atr': 20, 'p_adx': 8, 'rsi_period': 18, 'ema1': 12, 'ema2': 51, 'slip_atr_k': 0.2181434837887894, 'slip_spread_k': 0.7970848798438055, 'spread_hl_frac': 0.040834616992371495, 'bb_std_mult': 1.8872433805212192, 'rsi_os': 8, 'rsi_ob': 73, 'vol_spike': 0.005870889939686319, 'adx_thresh': 14.08162906783554, 'atr_min_pct': 0.007062152931273076, 'atr_max_pct': 0.046580958233820614, 'tp_mult': 2.4208544650460366, 'tsl_mult': 0.9591172598615622, 'strategy': 'mean_reversion', 'time_stop': 298, 'use_sma': True, 'use_atr': True, 'use_adx': True, 'use_ema': False, 'use_spike': False, 'rsi_required': True, 'edge_k': 0.23042052639834698, 'edge_cap': 0.9385234938139797, 'bull_strategy': 'breakout', 'bull_bb_std_mult': 1.6216644923385917, 'bull_rsi_os': 5, 'bull_rsi_ob': 60, 'bull_adx_thresh': 10.83896393364949, 'bull_atr_min_pct': 0.005675942321169185, 'bull_atr_max_pct': 0.13318960920137027, 'bull_tp_mult': 2.7618594666418894, 'bull_tsl_mult': 0.32887148167890246, 'bull_time_stop': 121, 'bull_use_sma': True, 'bull_use_ema': False, 'bull_use_atr': True, 'bull_use_adx': True, 'bull_use_spike': False, 'bull_rsi_required': False, 'bear_strategy': 'mean_reversion', 'bear_bb_std_mult': 1.2995141737031601, 'bear_rsi_os': 33, 'bear_rsi_ob': 87, 'bear_adx_thresh': 34.910329321432975, 'bear_atr_min_pct': 0.020458362544919673, 'bear_atr_max_pct': 0.09732790804659455, 'bear_tp_mult': 1.6970852671761691, 'bear_tsl_mult': 0.9295240059252647, 'bear_time_stop': 47, 'bear_use_sma': True, 'bear_use_ema': True, 'bear_use_atr': True, 'bear_use_adx': False, 'bear_use_spike': False, 'bear_rsi_required': False, 'sideways_strategy': 'breakout', 'sideways_bb_std_mult': 1.0770413393363705, 'sideways_rsi_os': 21, 'sideways_rsi_ob': 68, 'sideways_adx_thresh': 17.709298273914687, 'sideways_atr_min_pct': 0.023107909346886175, 'sideways_atr_max_pct': 0.14077612138172857, 'sideways_tp_mult': 2.382511651990991, 'sideways_tsl_mult': 0.15473483428110557, 'sideways_time_stop': 135, 'sideways_use_sma': False, 'sideways_use_ema': True, 'sideways_use_atr': False, 'sideways_use_adx': True, 'sideways_use_spike': False, 'sideways_rsi_required': True}.
[I 2025-08-30 15:24:58,454] Trial 84 finished with values: [-1000000000.0, 1000000000.0] and parameters: {'p_sma': 39, 'p_std': 6, 'p_atr': 17, 'p_adx': 8, 'rsi_period': 52, 'ema1': 27, 'ema2': 52, 'slip_atr_k': 0.06108957674742299, 'slip_spread_k': 0.8345598881614272, 'spread_hl_frac': 0.04045310585708001, 'bb_std_mult': 1.6329742168692243, 'rsi_os': 50, 'rsi_ob': 58, 'vol_spike': 0.2994527973440899, 'adx_thresh': 34.572251872272176, 'atr_min_pct': 0.011333231340603345, 'atr_max_pct': 0.05500652902613476, 'tp_mult': 2.8692579921736927, 'tsl_mult': 0.9948698264928709, 'strategy': 'mean_reversion', 'time_stop': 278, 'use_sma': True, 'use_atr': True, 'use_adx': True, 'use_ema': False, 'use_spike': True, 'rsi_required': True, 'edge_k': 1.8133262330701925, 'edge_cap': 0.8548431086373192, 'bull_strategy': 'breakout', 'bull_bb_std_mult': 1.1292865880641632, 'bull_rsi_os': 52, 'bull_rsi_ob': 93, 'bull_adx_thresh': 12.384340365052136, 'bull_atr_min_pct': 0.015253978981491816, 'bull_atr_max_pct': 0.010182610624887276, 'bull_tp_mult': 2.662816912988774, 'bull_tsl_mult': 0.2698589624120846, 'bull_time_stop': 119, 'bull_use_sma': False, 'bull_use_ema': False, 'bull_use_atr': True, 'bull_use_adx': True, 'bull_use_spike': False, 'bull_rsi_required': False, 'bear_strategy': 'mean_reversion', 'bear_bb_std_mult': 1.3043938759201281, 'bear_rsi_os': 27, 'bear_rsi_ob': 92, 'bear_adx_thresh': 34.338070195215614, 'bear_atr_min_pct': 0.0009092671513316643, 'bear_atr_max_pct': 0.08959001944339058, 'bear_tp_mult': 1.6630078902698182, 'bear_tsl_mult': 0.9238836898653379, 'bear_time_stop': 59, 'bear_use_sma': False, 'bear_use_ema': True, 'bear_use_atr': True, 'bear_use_adx': False, 'bear_use_spike': False, 'bear_rsi_required': False, 'sideways_strategy': 'breakout', 'sideways_bb_std_mult': 3.47608102301942, 'sideways_rsi_os': 27, 'sideways_rsi_ob': 48, 'sideways_adx_thresh': 17.839328600837376, 'sideways_atr_min_pct': 0.0023668397811668156, 'sideways_atr_max_pct': 0.14174161816903144, 'sideways_tp_mult': 1.0571024576450505, 'sideways_tsl_mult': 0.08514331198970171, 'sideways_time_stop': 48, 'sideways_use_sma': False, 'sideways_use_ema': True, 'sideways_use_atr': False, 'sideways_use_adx': False, 'sideways_use_spike': False, 'sideways_rsi_required': False}.
[I 2025-08-30 15:25:23,459] Trial 82 finished with values: [-1000000000.0, 1000000000.0] and parameters: {'p_sma': 8, 'p_std': 9, 'p_atr': 20, 'p_adx': 8, 'rsi_period': 50, 'ema1': 18, 'ema2': 51, 'slip_atr_k': 0.22239148448910984, 'slip_spread_k': 0.8863739466491141, 'spread_hl_frac': 0.04037948569556268, 'bb_std_mult': 1.8936549085578862, 'rsi_os': 26, 'rsi_ob': 73, 'vol_spike': 0.2986799532255205, 'adx_thresh': 28.878095556327608, 'atr_min_pct': 0.01545888250930231, 'atr_max_pct': 0.042922850323951725, 'tp_mult': 2.5004770180293696, 'tsl_mult': 0.9575128519681417, 'strategy': 'mean_reversion', 'time_stop': 299, 'use_sma': True, 'use_atr': True, 'use_adx': True, 'use_ema': False, 'use_spike': False, 'rsi_required': True, 'edge_k': 0.3755196255267086, 'edge_cap': 0.8446097466867871, 'bull_strategy': 'breakout', 'bull_bb_std_mult': 1.2724174477057613, 'bull_rsi_os': 52, 'bull_rsi_ob': 67, 'bull_adx_thresh': 8.777314512045852, 'bull_atr_min_pct': 0.011191990561907266, 'bull_atr_max_pct': 0.08258748802996001, 'bull_tp_mult': 2.5390709074332483, 'bull_tsl_mult': 0.3260097328222821, 'bull_time_stop': 160, 'bull_use_sma': True, 'bull_use_ema': False, 'bull_use_atr': True, 'bull_use_adx': True, 'bull_use_spike': False, 'bull_rsi_required': False, 'bear_strategy': 'mean_reversion', 'bear_bb_std_mult': 1.139624865886844, 'bear_rsi_os': 32, 'bear_rsi_ob': 62, 'bear_adx_thresh': 15.542840041423023, 'bear_atr_min_pct': 0.002298852223956916, 'bear_atr_max_pct': 0.08698729332432649, 'bear_tp_mult': 1.9942099792619357, 'bear_tsl_mult': 0.9324819488310024, 'bear_time_stop': 45, 'bear_use_sma': True, 'bear_use_ema': True, 'bear_use_atr': True, 'bear_use_adx': False, 'bear_use_spike': False, 'bear_rsi_required': False, 'sideways_strategy': 'breakout', 'sideways_bb_std_mult': 2.2288930452046, 'sideways_rsi_os': 7, 'sideways_rsi_ob': 68, 'sideways_adx_thresh': 24.72908478356595, 'sideways_atr_min_pct': 0.0034333206959010765, 'sideways_atr_max_pct': 0.0804918823042317, 'sideways_tp_mult': 2.3887424579530605, 'sideways_tsl_mult': 0.24169481078947763, 'sideways_time_stop': 131, 'sideways_use_sma': False, 'sideways_use_ema': True, 'sideways_use_atr': False, 'sideways_use_adx': True, 'sideways_use_spike': False, 'sideways_rsi_required': True}.
[I 2025-08-30 15:25:49,622] Trial 83 finished with values: [-1000000000.0, 1000000000.0] and parameters: {'p_sma': 39, 'p_std': 6, 'p_atr': 17, 'p_adx': 8, 'rsi_period': 50, 'ema1': 25, 'ema2': 10, 'slip_atr_k': 0.027065488152453354, 'slip_spread_k': 0.8284273520304026, 'spread_hl_frac': 0.0396890081245389, 'bb_std_mult': 2.1421696842538553, 'rsi_os': 26, 'rsi_ob': 91, 'vol_spike': 0.18926106951492563, 'adx_thresh': 28.982725184302986, 'atr_min_pct': 0.00416243620420088, 'atr_max_pct': 0.04585890649853489, 'tp_mult': 2.3040355612189676, 'tsl_mult': 0.9578274516464266, 'strategy': 'mean_reversion', 'time_stop': 278, 'use_sma': True, 'use_atr': True, 'use_adx': True, 'use_ema': False, 'use_spike': True, 'rsi_required': True, 'edge_k': 0.254805791224996, 'edge_cap': 0.8368895539063934, 'bull_strategy': 'breakout', 'bull_bb_std_mult': 1.1022807119533096, 'bull_rsi_os': 33, 'bull_rsi_ob': 53, 'bull_adx_thresh': 8.925907220949513, 'bull_atr_min_pct': 0.018280254898924743, 'bull_atr_max_pct': 0.01039397467420379, 'bull_tp_mult': 1.9845620654878169, 'bull_tsl_mult': 0.9059127824916247, 'bull_time_stop': 98, 'bull_use_sma': False, 'bull_use_ema': False, 'bull_use_atr': True, 'bull_use_adx': True, 'bull_use_spike': False, 'bull_rsi_required': False, 'bear_strategy': 'mean_reversion', 'bear_bb_std_mult': 1.296784408974172, 'bear_rsi_os': 33, 'bear_rsi_ob': 86, 'bear_adx_thresh': 34.883588485677556, 'bear_atr_min_pct': 0.0027017100783492433, 'bear_atr_max_pct': 0.087404362773849, 'bear_tp_mult': 1.7068312271923596, 'bear_tsl_mult': 0.9371816392392914, 'bear_time_stop': 42, 'bear_use_sma': True, 'bear_use_ema': True, 'bear_use_atr': True, 'bear_use_adx': False, 'bear_use_spike': False, 'bear_rsi_required': False, 'sideways_strategy': 'breakout', 'sideways_bb_std_mult': 2.213210013246431, 'sideways_rsi_os': 55, 'sideways_rsi_ob': 47, 'sideways_adx_thresh': 22.193779273553073, 'sideways_atr_min_pct': 0.023353397993893448, 'sideways_atr_max_pct': 0.07953327822349263, 'sideways_tp_mult': 1.3718066543439364, 'sideways_tsl_mult': 0.23469151807363942, 'sideways_time_stop': 83, 'sideways_use_sma': False, 'sideways_use_ema': True, 'sideways_use_atr': False, 'sideways_use_adx': True, 'sideways_use_spike': False, 'sideways_rsi_required': True}.
[I 2025-08-30 15:25:49,641] Trial 86 finished with values: [-1000000000.0, 1000000000.0] and parameters: {'p_sma': 46, 'p_std': 23, 'p_atr': 11, 'p_adx': 18, 'rsi_period': 38, 'ema1': 28, 'ema2': 15, 'slip_atr_k': 0.24780678164838824, 'slip_spread_k': 0.9543869145741862, 'spread_hl_frac': 0.03840477108513713, 'bb_std_mult': 2.171967722538909, 'rsi_os': 20, 'rsi_ob': 92, 'vol_spike': 0.19693762245633772, 'adx_thresh': 28.9408384467311, 'atr_min_pct': 0.02369364639711817, 'atr_max_pct': 0.09752893693217084, 'tp_mult': 2.74368370145575, 'tsl_mult': 0.8940009379029821, 'strategy': 'breakout', 'time_stop': 102, 'use_sma': True, 'use_atr': False, 'use_adx': False, 'use_ema': False, 'use_spike': False, 'rsi_required': False, 'edge_k': 0.6394303202139306, 'edge_cap': 0.4922486042579, 'bull_strategy': 'breakout', 'bull_bb_std_mult': 3.305736877348819, 'bull_rsi_os': 33, 'bull_rsi_ob': 91, 'bull_adx_thresh': 8.803877236509713, 'bull_atr_min_pct': 0.01042811582938704, 'bull_atr_max_pct': 0.013508900569863928, 'bull_tp_mult': 2.534846822130416, 'bull_tsl_mult': 0.35800888371843487, 'bull_time_stop': 157, 'bull_use_sma': False, 'bull_use_ema': True, 'bull_use_atr': True, 'bull_use_adx': False, 'bull_use_spike': False, 'bull_rsi_required': False, 'bear_strategy': 'mean_reversion', 'bear_bb_std_mult': 1.4728477026383318, 'bear_rsi_os': 38, 'bear_rsi_ob': 61, 'bear_adx_thresh': 16.400907069850795, 'bear_atr_min_pct': 0.014657842358635948, 'bear_atr_max_pct': 0.10219009624904878, 'bear_tp_mult': 2.48144241254617, 'bear_tsl_mult': 0.3885393357917798, 'bear_time_stop': 104, 'bear_use_sma': True, 'bear_use_ema': True, 'bear_use_atr': False, 'bear_use_adx': False, 'bear_use_spike': False, 'bear_rsi_required': False, 'sideways_strategy': 'breakout', 'sideways_bb_std_mult': 2.184711038786099, 'sideways_rsi_os': 43, 'sideways_rsi_ob': 65, 'sideways_adx_thresh': 13.516697342744681, 'sideways_atr_min_pct': 0.008377782418027769, 'sideways_atr_max_pct': 0.08003096487096298, 'sideways_tp_mult': 1.7791312829801003, 'sideways_tsl_mult': 0.7031545486479635, 'sideways_time_stop': 79, 'sideways_use_sma': True, 'sideways_use_ema': False, 'sideways_use_atr': False, 'sideways_use_adx': False, 'sideways_use_spike': False, 'sideways_rsi_required': False}.
[I 2025-08-30 15:25:50,896] Trial 85 finished with values: [-0.053638857271435025, 0.053534726715568685] and parameters: {'p_sma': 41, 'p_std': 6, 'p_atr': 28, 'p_adx': 18, 'rsi_period': 37, 'ema1': 27, 'ema2': 15, 'slip_atr_k': 0.17975711749353973, 'slip_spread_k': 0.8331181248235555, 'spread_hl_frac': 0.039020496641797804, 'bb_std_mult': 1.6424436059403467, 'rsi_os': 50, 'rsi_ob': 93, 'vol_spike': 0.29938913879291207, 'adx_thresh': 24.316554804299834, 'atr_min_pct': 0.011316983795129182, 'atr_max_pct': 0.09807199534660492, 'tp_mult': 1.7633753827527692, 'tsl_mult': 0.8895896563924648, 'strategy': 'breakout', 'time_stop': 277, 'use_sma': True, 'use_atr': True, 'use_adx': True, 'use_ema': False, 'use_spike': True, 'rsi_required': False, 'edge_k': 0.6422888110179215, 'edge_cap': 0.8502875819522301, 'bull_strategy': 'breakout', 'bull_bb_std_mult': 3.2663785193172554, 'bull_rsi_os': 33, 'bull_rsi_ob': 92, 'bull_adx_thresh': 12.050563612712653, 'bull_atr_min_pct': 0.015164115593452971, 'bull_atr_max_pct': 0.011817514568681887, 'bull_tp_mult': 1.4644967870741579, 'bull_tsl_mult': 0.26442413502691875, 'bull_time_stop': 64, 'bull_use_sma': False, 'bull_use_ema': False, 'bull_use_atr': True, 'bull_use_adx': False, 'bull_use_spike': False, 'bull_rsi_required': False, 'bear_strategy': 'mean_reversion', 'bear_bb_std_mult': 1.4525934585043552, 'bear_rsi_os': 27, 'bear_rsi_ob': 92, 'bear_adx_thresh': 15.941675629392432, 'bear_atr_min_pct': 0.0012315660500552428, 'bear_atr_max_pct': 0.061423561611276746, 'bear_tp_mult': 1.5849958368892372, 'bear_tsl_mult': 0.8287634765751337, 'bear_time_stop': 61, 'bear_use_sma': False, 'bear_use_ema': True, 'bear_use_atr': False, 'bear_use_adx': False, 'bear_use_spike': False, 'bear_rsi_required': False, 'sideways_strategy': 'breakout', 'sideways_bb_std_mult': 2.2103555824835603, 'sideways_rsi_os': 43, 'sideways_rsi_ob': 64, 'sideways_adx_thresh': 18.524660147422086, 'sideways_atr_min_pct': 0.0020694378055662486, 'sideways_atr_max_pct': 0.0793356612270453, 'sideways_tp_mult': 1.7809691425737544, 'sideways_tsl_mult': 0.06764142600264104, 'sideways_time_stop': 281, 'sideways_use_sma': False, 'sideways_use_ema': False, 'sideways_use_atr': False, 'sideways_use_adx': False, 'sideways_use_spike': False, 'sideways_rsi_required': False}.
[I 2025-08-30 15:26:27,474] Trial 87 finished with values: [-1000000000.0, 1000000000.0] and parameters: {'p_sma': 29, 'p_std': 5, 'p_atr': 28, 'p_adx': 7, 'rsi_period': 38, 'ema1': 28, 'ema2': 58, 'slip_atr_k': 0.16406376453603888, 'slip_spread_k': 0.6761715608501683, 'spread_hl_frac': 0.038242815670089754, 'bb_std_mult': 2.1474988518581304, 'rsi_os': 20, 'rsi_ob': 93, 'vol_spike': 0.18474878673976278, 'adx_thresh': 34.08174057950091, 'atr_min_pct': 0.01342371549914792, 'atr_max_pct': 0.06080445434535588, 'tp_mult': 2.7092268981852223, 'tsl_mult': 0.6293595164557327, 'strategy': 'breakout', 'time_stop': 110, 'use_sma': False, 'use_atr': False, 'use_adx': False, 'use_ema': True, 'use_spike': True, 'rsi_required': False, 'edge_k': 0.8472262382497591, 'edge_cap': 0.6701326238017102, 'bull_strategy': 'mean_reversion', 'bull_bb_std_mult': 3.3043701964882675, 'bull_rsi_os': 33, 'bull_rsi_ob': 53, 'bull_adx_thresh': 7.9984962137588145, 'bull_atr_min_pct': 0.02991609214717317, 'bull_atr_max_pct': 0.11766980872686891, 'bull_tp_mult': 1.396592941855244, 'bull_tsl_mult': 0.3679102812582772, 'bull_time_stop': 97, 'bull_use_sma': False, 'bull_use_ema': True, 'bull_use_atr': False, 'bull_use_adx': False, 'bull_use_spike': False, 'bull_rsi_required': False, 'bear_strategy': 'breakout', 'bear_bb_std_mult': 1.4530574879266258, 'bear_rsi_os': 23, 'bear_rsi_ob': 92, 'bear_adx_thresh': 10.565879448954849, 'bear_atr_min_pct': 0.014411222559869331, 'bear_atr_max_pct': 0.06262205965487476, 'bear_tp_mult': 2.4909013940787776, 'bear_tsl_mult': 0.8226150374377601, 'bear_time_stop': 132, 'bear_use_sma': False, 'bear_use_ema': True, 'bear_use_atr': False, 'bear_use_adx': True, 'bear_use_spike': True, 'bear_rsi_required': True, 'sideways_strategy': 'breakout', 'sideways_bb_std_mult': 2.2098383525791117, 'sideways_rsi_os': 51, 'sideways_rsi_ob': 64, 'sideways_adx_thresh': 22.09167943545216, 'sideways_atr_min_pct': 0.008599688851866353, 'sideways_atr_max_pct': 0.12941873978015817, 'sideways_tp_mult': 1.218056758732799, 'sideways_tsl_mult': 0.7161687715695102, 'sideways_time_stop': 28, 'sideways_use_sma': True, 'sideways_use_ema': False, 'sideways_use_atr': False, 'sideways_use_adx': False, 'sideways_use_spike': True, 'sideways_rsi_required': False}.
[I 2025-08-30 15:26:56,330] Trial 90 finished with values: [-1000000000.0, 1000000000.0] and parameters: {'p_sma': 52, 'p_std': 14, 'p_atr': 28, 'p_adx': 26, 'rsi_period': 35, 'ema1': 29, 'ema2': 58, 'slip_atr_k': 0.18085167322081233, 'slip_spread_k': 0.8606086431286514, 'spread_hl_frac': 0.044049955027348334, 'bb_std_mult': 2.429664725389181, 'rsi_os': 31, 'rsi_ob': 65, 'vol_spike': 0.27934756367880714, 'adx_thresh': 11.780546232508973, 'atr_min_pct': 0.013115944202118722, 'atr_max_pct': 0.07625659782381433, 'tp_mult': 1.7556003003311156, 'tsl_mult': 0.8443470644547133, 'strategy': 'breakout', 'time_stop': 151, 'use_sma': False, 'use_atr': False, 'use_adx': False, 'use_ema': True, 'use_spike': False, 'rsi_required': False, 'edge_k': 1.7443287269735301, 'edge_cap': 0.9124874341443463, 'bull_strategy': 'mean_reversion', 'bull_bb_std_mult': 2.911102512770451, 'bull_rsi_os': 36, 'bull_rsi_ob': 64, 'bull_adx_thresh': 7.262571773184867, 'bull_atr_min_pct': 0.016803120538553637, 'bull_atr_max_pct': 0.017909208901799763, 'bull_tp_mult': 1.7216107402253904, 'bull_tsl_mult': 0.14032572396020065, 'bull_time_stop': 184, 'bull_use_sma': False, 'bull_use_ema': True, 'bull_use_atr': False, 'bull_use_adx': False, 'bull_use_spike': True, 'bull_rsi_required': False, 'bear_strategy': 'breakout', 'bear_bb_std_mult': 1.6333436311171314, 'bear_rsi_os': 23, 'bear_rsi_ob': 53, 'bear_adx_thresh': 26.79582009805068, 'bear_atr_min_pct': 0.027808443072454593, 'bear_atr_max_pct': 0.04079650865778861, 'bear_tp_mult': 1.5738685454017354, 'bear_tsl_mult': 0.8896668902705682, 'bear_time_stop': 28, 'bear_use_sma': False, 'bear_use_ema': False, 'bear_use_atr': False, 'bear_use_adx': True, 'bear_use_spike': True, 'bear_rsi_required': True, 'sideways_strategy': 'breakout', 'sideways_bb_std_mult': 2.422597043966481, 'sideways_rsi_os': 52, 'sideways_rsi_ob': 86, 'sideways_adx_thresh': 18.630600326836305, 'sideways_atr_min_pct': 0.006054864862068021, 'sideways_atr_max_pct': 0.12818327613273348, 'sideways_tp_mult': 2.646003494559885, 'sideways_tsl_mult': 0.03362357911071914, 'sideways_time_stop': 29, 'sideways_use_sma': True, 'sideways_use_ema': False, 'sideways_use_atr': True, 'sideways_use_adx': False, 'sideways_use_spike': True, 'sideways_rsi_required': False}.
[I 2025-08-30 15:26:57,478] Trial 89 finished with values: [-1000000000.0, 1000000000.0] and parameters: {'p_sma': 29, 'p_std': 19, 'p_atr': 28, 'p_adx': 15, 'rsi_period': 65, 'ema1': 30, 'ema2': 58, 'slip_atr_k': 0.1812398043645004, 'slip_spread_k': 0.06253063074868753, 'spread_hl_frac': 0.04425016182369456, 'bb_std_mult': 1.704726000112442, 'rsi_os': 5, 'rsi_ob': 65, 'vol_spike': 0.13295247895634865, 'adx_thresh': 20.685656708753978, 'atr_min_pct': 0.01700583059813091, 'atr_max_pct': 0.061112564725487005, 'tp_mult': 2.3794024264566156, 'tsl_mult': 0.6291553354337185, 'strategy': 'breakout', 'time_stop': 263, 'use_sma': False, 'use_atr': False, 'use_adx': False, 'use_ema': True, 'use_spike': False, 'rsi_required': False, 'edge_k': 1.3016466730625562, 'edge_cap': 0.9081970345147452, 'bull_strategy': 'mean_reversion', 'bull_bb_std_mult': 3.508536546771353, 'bull_rsi_os': 38, 'bull_rsi_ob': 64, 'bull_adx_thresh': 7.844470940151506, 'bull_atr_min_pct': 0.01672909145829631, 'bull_atr_max_pct': 0.12746720494695996, 'bull_tp_mult': 2.834390224448233, 'bull_tsl_mult': 0.44236987307143516, 'bull_time_stop': 184, 'bull_use_sma': False, 'bull_use_ema': True, 'bull_use_atr': False, 'bull_use_adx': False, 'bull_use_spike': True, 'bull_rsi_required': True, 'bear_strategy': 'breakout', 'bear_bb_std_mult': 2.329185275836605, 'bear_rsi_os': 23, 'bear_rsi_ob': 73, 'bear_adx_thresh': 12.251983698660915, 'bear_atr_min_pct': 0.017395846893815188, 'bear_atr_max_pct': 0.04223615626932014, 'bear_tp_mult': 1.5956764969816546, 'bear_tsl_mult': 0.8151448970350358, 'bear_time_stop': 24, 'bear_use_sma': False, 'bear_use_ema': False, 'bear_use_atr': False, 'bear_use_adx': True, 'bear_use_spike': True, 'bear_rsi_required': True, 'sideways_strategy': 'breakout', 'sideways_bb_std_mult': 2.41016074323819, 'sideways_rsi_os': 37, 'sideways_rsi_ob': 73, 'sideways_adx_thresh': 10.064219264952662, 'sideways_atr_min_pct': 0.017334012513822886, 'sideways_atr_max_pct': 0.08878850031601052, 'sideways_tp_mult': 1.0129081870372576, 'sideways_tsl_mult': 0.026971797654604668, 'sideways_time_stop': 284, 'sideways_use_sma': True, 'sideways_use_ema': False, 'sideways_use_atr': False, 'sideways_use_adx': False, 'sideways_use_spike': True, 'sideways_rsi_required': False}.
