[I 2025-08-30 15:30:35,246] Trial 108 finished with values: [-0.019839756831061428, 0.01979563330887493] and parameters: {'p_sma': 30, 'p_std': 10, 'p_atr': 19, 'p_adx': 13, 'rsi_period': 84, 'ema1': 29, 'ema2': 27, 'slip_atr_k': 0.10315335919661531, 'slip_spread_k': 0.9720079116512893, 'spread_hl_frac': 0.0429841988945665, 'bb_std_mult': 1.76345657995299, 'rsi_os': 32, 'rsi_ob': 82, 'vol_spike': 0.29202705194757994, 'adx_thresh': 16.465945892733217, 'atr_min_pct': 0.003754235978471533, 'atr_max_pct': 0.0445544128994247, 'tp_mult': 1.3724253716367865, 'tsl_mult': 0.8122442563489729, 'strategy': 'mean_reversion', 'time_stop': 232, 'use_sma': False, 'use_atr': False, 'use_adx': True, 'use_ema': False, 'use_spike': False, 'rsi_required': True, 'edge_k': 0.5271424344053439, 'edge_cap': 0.08691627711349248, 'bull_strategy': 'breakout', 'bull_bb_std_mult': 1.4339516246741142, 'bull_rsi_os': 32, 'bull_rsi_ob': 92, 'bull_adx_thresh': 29.115845891275473, 'bull_atr_min_pct': 0.021487900284110743, 'bull_atr_max_pct': 0.020333805781980296, 'bull_tp_mult': 2.6020470385983776, 'bull_tsl_mult': 0.22604082055228747, 'bull_time_stop': 5, 'bull_use_sma': False, 'bull_use_ema': True, 'bull_use_atr': True, 'bull_use_adx': True, 'bull_use_spike': False, 'bull_rsi_required': True, 'bear_strategy': 'mean_reversion', 'bear_bb_std_mult': 1.9374725958272543, 'bear_rsi_os': 42, 'bear_rsi_ob': 92, 'bear_adx_thresh': 18.848060517639126, 'bear_atr_min_pct': 0.012375849142682693, 'bear_atr_max_pct': 0.12457602915195744, 'bear_tp_mult': 1.6619921429012814, 'bear_tsl_mult': 0.4082507063322736, 'bear_time_stop': 197, 'bear_use_sma': True, 'bear_use_ema': False, 'bear_use_atr': True, 'bear_use_adx': False, 'bear_use_spike': False, 'bear_rsi_required': False, 'sideways_strategy': 'breakout', 'sideways_bb_std_mult': 1.2048003913813503, 'sideways_rsi_os': 54, 'sideways_rsi_ob': 60, 'sideways_adx_thresh': 19.659945920856025, 'sideways_atr_min_pct': 0.0034095762223098017, 'sideways_atr_max_pct': 0.07039427353398613, 'sideways_tp_mult': 2.6265659413300284, 'sideways_tsl_mult': 0.11258953505065006, 'sideways_time_stop': 44, 'sideways_use_sma': False, 'sideways_use_ema': True, 'sideways_use_atr': False, 'sideways_use_adx': False, 'sideways_use_spike': False, 'sideways_rsi_required': False}.
[I 2025-08-30 15:31:03,092] Trial 109 finished with values: [-1000000000.0, 1000000000.0] and parameters: {'p_sma': 22, 'p_std': 10, 'p_atr': 27, 'p_adx': 21, 'rsi_period': 54, 'ema1': 29, 'ema2': 50, 'slip_atr_k': 0.002495042763534114, 'slip_spread_k': 0.9882888450067926, 'spread_hl_frac': 0.04116593465965901, 'bb_std_mult': 1.4586498351772341, 'rsi_os': 44, 'rsi_ob': 51, 'vol_spike': 0.2498256094080754, 'adx_thresh': 15.750785098666796, 'atr_min_pct': 0.002183182584242483, 'atr_max_pct': 0.057981719449999504, 'tp_mult': 1.589565286224615, 'tsl_mult': 0.0017975006824560436, 'strategy': 'breakout', 'time_stop': 294, 'use_sma': False, 'use_atr': False, 'use_adx': False, 'use_ema': True, 'use_spike': False, 'rsi_required': True, 'edge_k': 0.4266545606180836, 'edge_cap': 0.45274169659029917, 'bull_strategy': 'breakout', 'bull_bb_std_mult': 3.1715474637722707, 'bull_rsi_os': 32, 'bull_rsi_ob': 84, 'bull_adx_thresh': 29.751630472895314, 'bull_atr_min_pct': 0.02362096587790124, 'bull_atr_max_pct': 0.1002989276980412, 'bull_tp_mult': 1.2503882564632864, 'bull_tsl_mult': 0.8082919178490404, 'bull_time_stop': 134, 'bull_use_sma': False, 'bull_use_ema': True, 'bull_use_atr': True, 'bull_use_adx': True, 'bull_use_spike': True, 'bull_rsi_required': True, 'bear_strategy': 'breakout', 'bear_bb_std_mult': 3.3880515708083614, 'bear_rsi_os': 42, 'bear_rsi_ob': 65, 'bear_adx_thresh': 32.35418446261381, 'bear_atr_min_pct': 0.010621745059193699, 'bear_atr_max_pct': 0.11796997416156005, 'bear_tp_mult': 1.8608244663936215, 'bear_tsl_mult': 0.6920255337122478, 'bear_time_stop': 54, 'bear_use_sma': True, 'bear_use_ema': False, 'bear_use_atr': False, 'bear_use_adx': False, 'bear_use_spike': False, 'bear_rsi_required': False, 'sideways_strategy': 'breakout', 'sideways_bb_std_mult': 1.1846289324643207, 'sideways_rsi_os': 53, 'sideways_rsi_ob': 61, 'sideways_adx_thresh': 19.67171224821575, 'sideways_atr_min_pct': 0.003248654964206007, 'sideways_atr_max_pct': 0.08103975772547627, 'sideways_tp_mult': 1.8164860347160383, 'sideways_tsl_mult': 0.09844629595308219, 'sideways_time_stop': 94, 'sideways_use_sma': True, 'sideways_use_ema': True, 'sideways_use_atr': False, 'sideways_use_adx': False, 'sideways_use_spike': True, 'sideways_rsi_required': False}.
[I 2025-08-30 15:31:38,542] Trial 112 finished with values: [-1000000000.0, 1000000000.0] and parameters: {'p_sma': 26, 'p_std': 15, 'p_atr': 19, 'p_adx': 16, 'rsi_period': 73, 'ema1': 30, 'ema2': 26, 'slip_atr_k': 0.08919815446006284, 'slip_spread_k': 0.975295778826624, 'spread_hl_frac': 0.03447530840039268, 'bb_std_mult': 2.5162578987921664, 'rsi_os': 32, 'rsi_ob': 85, 'vol_spike': 0.2856258761282209, 'adx_thresh': 14.648834796112967, 'atr_min_pct': 0.002943783061310364, 'atr_max_pct': 0.044102549433453535, 'tp_mult': 1.3888851816086445, 'tsl_mult': 0.5389990514018462, 'strategy': 'breakout', 'time_stop': 211, 'use_sma': False, 'use_atr': False, 'use_adx': False, 'use_ema': True, 'use_spike': False, 'rsi_required': True, 'edge_k': 0.42530200541410434, 'edge_cap': 0.09159476021334707, 'bull_strategy': 'breakout', 'bull_bb_std_mult': 1.4227178585050846, 'bull_rsi_os': 27, 'bull_rsi_ob': 90, 'bull_adx_thresh': 29.52060647454338, 'bull_atr_min_pct': 0.023545237523721865, 'bull_atr_max_pct': 0.030252333595464354, 'bull_tp_mult': 2.2023407166117073, 'bull_tsl_mult': 0.233392824092427, 'bull_time_stop': 10, 'bull_use_sma': False, 'bull_use_ema': True, 'bull_use_atr': True, 'bull_use_adx': False, 'bull_use_spike': True, 'bull_rsi_required': True, 'bear_strategy': 'breakout', 'bear_bb_std_mult': 1.9811269455647118, 'bear_rsi_os': 42, 'bear_rsi_ob': 59, 'bear_adx_thresh': 18.756924806392455, 'bear_atr_min_pct': 0.010365521931997444, 'bear_atr_max_pct': 0.11770496939598528, 'bear_tp_mult': 1.635339070151957, 'bear_tsl_mult': 0.423346537297298, 'bear_time_stop': 206, 'bear_use_sma': True, 'bear_use_ema': False, 'bear_use_atr': False, 'bear_use_adx': False, 'bear_use_spike': False, 'bear_rsi_required': False, 'sideways_strategy': 'breakout', 'sideways_bb_std_mult': 1.2181703308131069, 'sideways_rsi_os': 54, 'sideways_rsi_ob': 60, 'sideways_adx_thresh': 9.094213468960625, 'sideways_atr_min_pct': 0.007763621552491971, 'sideways_atr_max_pct': 0.06092737528074403, 'sideways_tp_mult': 2.650216532211453, 'sideways_tsl_mult': 0.43695736601725244, 'sideways_time_stop': 46, 'sideways_use_sma': True, 'sideways_use_ema': False, 'sideways_use_atr': False, 'sideways_use_adx': False, 'sideways_use_spike': True, 'sideways_rsi_required': False}.
[I 2025-08-30 15:31:41,416] Trial 110 finished with values: [-1000000000.0, 1000000000.0] and parameters: {'p_sma': 26, 'p_std': 10, 'p_atr': 27, 'p_adx': 21, 'rsi_period': 72, 'ema1': 8, 'ema2': 50, 'slip_atr_k': 0.13248090980361887, 'slip_spread_k': 0.9794585674359918, 'spread_hl_frac': 0.041151392668819294, 'bb_std_mult': 1.7998973136007925, 'rsi_os': 34, 'rsi_ob': 56, 'vol_spike': 0.25098816852323586, 'adx_thresh': 33.84191940769357, 'atr_min_pct': 0.02297385492570856, 'atr_max_pct': 0.04401017877119427, 'tp_mult': 2.321199111627407, 'tsl_mult': 0.9191543982920233, 'strategy': 'breakout', 'time_stop': 284, 'use_sma': False, 'use_atr': False, 'use_adx': False, 'use_ema': True, 'use_spike': False, 'rsi_required': True, 'edge_k': 0.43100677515233965, 'edge_cap': 0.4529114400437116, 'bull_strategy': 'breakout', 'bull_bb_std_mult': 3.164793811476764, 'bull_rsi_os': 32, 'bull_rsi_ob': 84, 'bull_adx_thresh': 28.410299545133917, 'bull_atr_min_pct': 0.021523312097267506, 'bull_atr_max_pct': 0.040650974852807845, 'bull_tp_mult': 2.258843042181181, 'bull_tsl_mult': 0.22853780337338978, 'bull_time_stop': 134, 'bull_use_sma': False, 'bull_use_ema': True, 'bull_use_atr': True, 'bull_use_adx': False, 'bull_use_spike': True, 'bull_rsi_required': True, 'bear_strategy': 'breakout', 'bear_bb_std_mult': 1.9841532070234038, 'bear_rsi_os': 45, 'bear_rsi_ob': 92, 'bear_adx_thresh': 28.849595846755275, 'bear_atr_min_pct': 0.028950333336164633, 'bear_atr_max_pct': 0.11295446502540424, 'bear_tp_mult': 1.6359192475979183, 'bear_tsl_mult': 0.9135387333640873, 'bear_time_stop': 5, 'bear_use_sma': True, 'bear_use_ema': False, 'bear_use_atr': False, 'bear_use_adx': False, 'bear_use_spike': False, 'bear_rsi_required': False, 'sideways_strategy': 'breakout', 'sideways_bb_std_mult': 1.2214747735991855, 'sideways_rsi_os': 54, 'sideways_rsi_ob': 65, 'sideways_adx_thresh': 8.954957523377475, 'sideways_atr_min_pct': 0.0034075113353435778, 'sideways_atr_max_pct': 0.0817896030959174, 'sideways_tp_mult': 1.2396916874079176, 'sideways_tsl_mult': 0.6513386379449193, 'sideways_time_stop': 93, 'sideways_use_sma': True, 'sideways_use_ema': True, 'sideways_use_atr': False, 'sideways_use_adx': False, 'sideways_use_spike': True, 'sideways_rsi_required': False}.
[I 2025-08-30 15:31:41,426] Trial 111 finished with values: [-1000000000.0, 1000000000.0] and parameters: {'p_sma': 26, 'p_std': 10, 'p_atr': 19, 'p_adx': 9, 'rsi_period': 16, 'ema1': 29, 'ema2': 52, 'slip_atr_k': 0.004298276606878676, 'slip_spread_k': 0.9742023352160165, 'spread_hl_frac': 0.041013719921698444, 'bb_std_mult': 1.8058083918750427, 'rsi_os': 32, 'rsi_ob': 84, 'vol_spike': 0.27514357106104304, 'adx_thresh': 16.307497865819304, 'atr_min_pct': 0.0023985236025410844, 'atr_max_pct': 0.09992712486083907, 'tp_mult': 1.375090940400512, 'tsl_mult': 0.86822303218506, 'strategy': 'breakout', 'time_stop': 294, 'use_sma': False, 'use_atr': False, 'use_adx': False, 'use_ema': True, 'use_spike': False, 'rsi_required': True, 'edge_k': 0.5507752923469111, 'edge_cap': 0.45920008328937584, 'bull_strategy': 'breakout', 'bull_bb_std_mult': 3.3425948361364086, 'bull_rsi_os': 32, 'bull_rsi_ob': 90, 'bull_adx_thresh': 28.375582165784955, 'bull_atr_min_pct': 0.02182285149880935, 'bull_atr_max_pct': 0.09670692178069644, 'bull_tp_mult': 2.6112172142281036, 'bull_tsl_mult': 0.22227056858220398, 'bull_time_stop': 104, 'bull_use_sma': False, 'bull_use_ema': True, 'bull_use_atr': True, 'bull_use_adx': False, 'bull_use_spike': True, 'bull_rsi_required': True, 'bear_strategy': 'breakout', 'bear_bb_std_mult': 3.46193955266187, 'bear_rsi_os': 42, 'bear_rsi_ob': 57, 'bear_adx_thresh': 32.36431327739808, 'bear_atr_min_pct': 0.028661935931436316, 'bear_atr_max_pct': 0.11752681734020108, 'bear_tp_mult': 1.6549885423228847, 'bear_tsl_mult': 0.6877206818488071, 'bear_time_stop': 31, 'bear_use_sma': True, 'bear_use_ema': False, 'bear_use_atr': False, 'bear_use_adx': False, 'bear_use_spike': False, 'bear_rsi_required': False, 'sideways_strategy': 'breakout', 'sideways_bb_std_mult': 3.325752523201475, 'sideways_rsi_os': 54, 'sideways_rsi_ob': 85, 'sideways_adx_thresh': 21.61311644947024, 'sideways_atr_min_pct': 0.00357819972907581, 'sideways_atr_max_pct': 0.0702141608668414, 'sideways_tp_mult': 1.2443139471312585, 'sideways_tsl_mult': 0.1732728962927729, 'sideways_time_stop': 91, 'sideways_use_sma': True, 'sideways_use_ema': True, 'sideways_use_atr': False, 'sideways_use_adx': False, 'sideways_use_spike': True, 'sideways_rsi_required': False}.
[I 2025-08-30 15:31:59,819] Trial 113 finished with values: [-1000000000.0, 1000000000.0] and parameters: {'p_sma': 26, 'p_std': 25, 'p_atr': 19, 'p_adx': 13, 'rsi_period': 61, 'ema1': 29, 'ema2': 21, 'slip_atr_k': 0.10373499632683983, 'slip_spread_k': 0.9768540189139795, 'spread_hl_frac': 0.04299065280741773, 'bb_std_mult': 1.8445704748588971, 'rsi_os': 32, 'rsi_ob': 84, 'vol_spike': 0.2847860574253418, 'adx_thresh': 14.694267186543634, 'atr_min_pct': 0.0029883718042621405, 'atr_max_pct': 0.04457776315444918, 'tp_mult': 1.3850165651040598, 'tsl_mult': 0.3679970819179597, 'strategy': 'mean_reversion', 'time_stop': 228, 'use_sma': False, 'use_atr': False, 'use_adx': True, 'use_ema': False, 'use_spike': False, 'rsi_required': False, 'edge_k': 1.3584150832867419, 'edge_cap': 0.08433746490107191, 'bull_strategy': 'mean_reversion', 'bull_bb_std_mult': 1.461593842207852, 'bull_rsi_os': 27, 'bull_rsi_ob': 90, 'bull_adx_thresh': 29.774493533694926, 'bull_atr_min_pct': 0.021511730055446085, 'bull_atr_max_pct': 0.03986455589370798, 'bull_tp_mult': 2.2280555538704863, 'bull_tsl_mult': 0.23141931276786967, 'bull_time_stop': 6, 'bull_use_sma': True, 'bull_use_ema': True, 'bull_use_atr': True, 'bull_use_adx': False, 'bull_use_spike': False, 'bull_rsi_required': True, 'bear_strategy': 'mean_reversion', 'bear_bb_std_mult': 1.9897789362740497, 'bear_rsi_os': 46, 'bear_rsi_ob': 92, 'bear_adx_thresh': 19.22345230945205, 'bear_atr_min_pct': 0.01074206501372073, 'bear_atr_max_pct': 0.10894271806864225, 'bear_tp_mult': 1.6247422628055253, 'bear_tsl_mult': 0.40484844525334374, 'bear_time_stop': 208, 'bear_use_sma': True, 'bear_use_ema': False, 'bear_use_atr': True, 'bear_use_adx': True, 'bear_use_spike': False, 'bear_rsi_required': True, 'sideways_strategy': 'mean_reversion', 'sideways_bb_std_mult': 0.9073845190069816, 'sideways_rsi_os': 54, 'sideways_rsi_ob': 60, 'sideways_adx_thresh': 21.810845179474644, 'sideways_atr_min_pct': 0.020488559974908567, 'sideways_atr_max_pct': 0.07061366501830554, 'sideways_tp_mult': 2.6245648048182484, 'sideways_tsl_mult': 0.4552060784766911, 'sideways_time_stop': 41, 'sideways_use_sma': False, 'sideways_use_ema': False, 'sideways_use_atr': False, 'sideways_use_adx': False, 'sideways_use_spike': False, 'sideways_rsi_required': False}.
[I 2025-08-30 15:32:23,948] Trial 114 finished with values: [-1000000000.0, 1000000000.0] and parameters: {'p_sma': 29, 'p_std': 27, 'p_atr': 19, 'p_adx': 20, 'rsi_period': 60, 'ema1': 29, 'ema2': 21, 'slip_atr_k': 0.10172653435994923, 'slip_spread_k': 0.9522329083310965, 'spread_hl_frac': 0.04299481677346414, 'bb_std_mult': 2.0663093927367604, 'rsi_os': 33, 'rsi_ob': 83, 'vol_spike': 0.2734321742231334, 'adx_thresh': 17.026047433363903, 'atr_min_pct': 2.618903232214911e-05, 'atr_max_pct': 0.12494907979877345, 'tp_mult': 1.3274805035251747, 'tsl_mult': 0.8117137372153383, 'strategy': 'mean_reversion', 'time_stop': 230, 'use_sma': False, 'use_atr': False, 'use_adx': True, 'use_ema': False, 'use_spike': True, 'rsi_required': False, 'edge_k': 0.5587936382396385, 'edge_cap': 0.07088658481667226, 'bull_strategy': 'mean_reversion', 'bull_bb_std_mult': 1.0299129724381766, 'bull_rsi_os': 32, 'bull_rsi_ob': 92, 'bull_adx_thresh': 28.09007054682392, 'bull_atr_min_pct': 0.021281266341220444, 'bull_atr_max_pct': 0.02297034284327286, 'bull_tp_mult': 2.0469525527027246, 'bull_tsl_mult': 0.17620165728360937, 'bull_time_stop': 21, 'bull_use_sma': True, 'bull_use_ema': True, 'bull_use_atr': False, 'bull_use_adx': True, 'bull_use_spike': False, 'bull_rsi_required': True, 'bear_strategy': 'mean_reversion', 'bear_bb_std_mult': 1.9511335905621021, 'bear_rsi_os': 45, 'bear_rsi_ob': 92, 'bear_adx_thresh': 19.390733586967727, 'bear_atr_min_pct': 0.0114240508314251, 'bear_atr_max_pct': 0.12459081907491923, 'bear_tp_mult': 1.6475939530700743, 'bear_tsl_mult': 0.27738161275919637, 'bear_time_stop': 157, 'bear_use_sma': True, 'bear_use_ema': False, 'bear_use_atr': True, 'bear_use_adx': False, 'bear_use_spike': False, 'bear_rsi_required': False, 'sideways_strategy': 'mean_reversion', 'sideways_bb_std_mult': 0.9172132309063681, 'sideways_rsi_os': 54, 'sideways_rsi_ob': 54, 'sideways_adx_thresh': 21.694280542079234, 'sideways_atr_min_pct': 0.003848539804854712, 'sideways_atr_max_pct': 0.07108180262039625, 'sideways_tp_mult': 2.7081294965724227, 'sideways_tsl_mult': 0.49620568742424365, 'sideways_time_stop': 42, 'sideways_use_sma': False, 'sideways_use_ema': True, 'sideways_use_atr': False, 'sideways_use_adx': True, 'sideways_use_spike': False, 'sideways_rsi_required': False}.
[I 2025-08-30 15:32:26,994] Trial 116 finished with values: [-1000000000.0, 1000000000.0] and parameters: {'p_sma': 30, 'p_std': 25, 'p_atr': 21, 'p_adx': 13, 'rsi_period': 56, 'ema1': 30, 'ema2': 22, 'slip_atr_k': 0.10240855296034217, 'slip_spread_k': 0.9651580881534283, 'spread_hl_frac': 0.008036602356650185, 'bb_std_mult': 2.260338862132402, 'rsi_os': 31, 'rsi_ob': 81, 'vol_spike': 0.2935767588706176, 'adx_thresh': 17.811877514436755, 'atr_min_pct': 0.00019569555224972996, 'atr_max_pct': 0.027286712160089717, 'tp_mult': 1.4855958496829078, 'tsl_mult': 0.8137937977723574, 'strategy': 'mean_reversion', 'time_stop': 193, 'use_sma': False, 'use_atr': False, 'use_adx': True, 'use_ema': False, 'use_spike': True, 'rsi_required': False, 'edge_k': 0.9761988511804114, 'edge_cap': 0.0791172073315912, 'bull_strategy': 'mean_reversion', 'bull_bb_std_mult': 1.7371324932987922, 'bull_rsi_os': 27, 'bull_rsi_ob': 93, 'bull_adx_thresh': 26.146578350161292, 'bull_atr_min_pct': 0.022708638657288813, 'bull_atr_max_pct': 0.025272879198194723, 'bull_tp_mult': 1.812507567941343, 'bull_tsl_mult': 0.18324712844458166, 'bull_time_stop': 21, 'bull_use_sma': True, 'bull_use_ema': True, 'bull_use_atr': False, 'bull_use_adx': True, 'bull_use_spike': False, 'bull_rsi_required': True, 'bear_strategy': 'mean_reversion', 'bear_bb_std_mult': 1.8660311197995352, 'bear_rsi_os': 47, 'bear_rsi_ob': 53, 'bear_adx_thresh': 19.349271236502513, 'bear_atr_min_pct': 0.011560181467574215, 'bear_atr_max_pct': 0.1261469152486331, 'bear_tp_mult': 1.4322908695366945, 'bear_tsl_mult': 0.1275690551244258, 'bear_time_stop': 157, 'bear_use_sma': False, 'bear_use_ema': False, 'bear_use_atr': True, 'bear_use_adx': True, 'bear_use_spike': True, 'bear_rsi_required': True, 'sideways_strategy': 'mean_reversion', 'sideways_bb_std_mult': 0.9024923712092303, 'sideways_rsi_os': 55, 'sideways_rsi_ob': 57, 'sideways_adx_thresh': 19.233330877865484, 'sideways_atr_min_pct': 0.02060005464490009, 'sideways_atr_max_pct': 0.07140624765754845, 'sideways_tp_mult': 2.738081804418461, 'sideways_tsl_mult': 0.5776792685639618, 'sideways_time_stop': 43, 'sideways_use_sma': False, 'sideways_use_ema': True, 'sideways_use_atr': False, 'sideways_use_adx': True, 'sideways_use_spike': False, 'sideways_rsi_required': False}.
[I 2025-08-30 15:32:30,344] Trial 115 finished with values: [-1000000000.0, 1000000000.0] and parameters: {'p_sma': 30, 'p_std': 25, 'p_atr': 16, 'p_adx': 13, 'rsi_period': 62, 'ema1': 14, 'ema2': 22, 'slip_atr_k': 0.10332946873089185, 'slip_spread_k': 0.9522380670985257, 'spread_hl_frac': 0.04295519643875634, 'bb_std_mult': 1.9227624717869876, 'rsi_os': 34, 'rsi_ob': 82, 'vol_spike': 0.2958631237048593, 'adx_thresh': 17.871380578814524, 'atr_min_pct': 0.0009006615337485225, 'atr_max_pct': 0.12609174135711496, 'tp_mult': 1.464677823240085, 'tsl_mult': 0.8159193083985239, 'strategy': 'mean_reversion', 'time_stop': 196, 'use_sma': False, 'use_atr': False, 'use_adx': True, 'use_ema': False, 'use_spike': True, 'rsi_required': False, 'edge_k': 0.9814103455168343, 'edge_cap': 0.08545572275469678, 'bull_strategy': 'mean_reversion', 'bull_bb_std_mult': 1.6934855522297072, 'bull_rsi_os': 27, 'bull_rsi_ob': 93, 'bull_adx_thresh': 31.13182731649191, 'bull_atr_min_pct': 0.02223382917312834, 'bull_atr_max_pct': 0.02412979549751862, 'bull_tp_mult': 2.052168989557346, 'bull_tsl_mult': 0.18785607650372213, 'bull_time_stop': 20, 'bull_use_sma': True, 'bull_use_ema': True, 'bull_use_atr': False, 'bull_use_adx': True, 'bull_use_spike': False, 'bull_rsi_required': True, 'bear_strategy': 'mean_reversion', 'bear_bb_std_mult': 1.9205108831939783, 'bear_rsi_os': 49, 'bear_rsi_ob': 88, 'bear_adx_thresh': 17.412110930611878, 'bear_atr_min_pct': 0.01108503972951654, 'bear_atr_max_pct': 0.10618753884066742, 'bear_tp_mult': 1.5298967740072842, 'bear_tsl_mult': 0.27950456321619943, 'bear_time_stop': 159, 'bear_use_sma': False, 'bear_use_ema': False, 'bear_use_atr': True, 'bear_use_adx': True, 'bear_use_spike': True, 'bear_rsi_required': True, 'sideways_strategy': 'mean_reversion', 'sideways_bb_std_mult': 1.430000818964531, 'sideways_rsi_os': 50, 'sideways_rsi_ob': 57, 'sideways_adx_thresh': 18.204441239864646, 'sideways_atr_min_pct': 0.007073472107717409, 'sideways_atr_max_pct': 0.07086318214768103, 'sideways_tp_mult': 2.756030065380326, 'sideways_tsl_mult': 0.5860361515069172, 'sideways_time_stop': 34, 'sideways_use_sma': False, 'sideways_use_ema': True, 'sideways_use_atr': False, 'sideways_use_adx': True, 'sideways_use_spike': False, 'sideways_rsi_required': False}.
