[I 2025-08-30 16:52:55,105] Trial 558 finished with values: [-1000000000.0, 1000000000.0] and parameters: {'p_sma': 56, 'p_std': 59, 'p_atr': 24, 'p_adx': 28, 'rsi_period': 18, 'ema1': 10, 'ema2': 10, 'slip_atr_k': 0.15486055232472218, 'slip_spread_k': 0.419412717863718, 'spread_hl_frac': 0.016700869437219594, 'bb_std_mult': 2.9977807354526576, 'rsi_os': 49, 'rsi_ob': 94, 'vol_spike': 0.21647976330951393, 'adx_thresh': 14.286644153498298, 'atr_min_pct': 0.018607417530548974, 'atr_max_pct': 0.10036400363295472, 'tp_mult': 1.3864339804537713, 'tsl_mult': 0.48558586271961973, 'strategy': 'breakout', 'time_stop': 251, 'use_sma': False, 'use_atr': False, 'use_adx': False, 'use_ema': False, 'use_spike': False, 'rsi_required': False, 'edge_k': 1.7388701046269, 'edge_cap': 0.13594834171617448, 'bull_strategy': 'breakout', 'bull_bb_std_mult': 1.8220578548378108, 'bull_rsi_os': 8, 'bull_rsi_ob': 49, 'bull_adx_thresh': 22.379249364380534, 'bull_atr_min_pct': 0.020484144786714197, 'bull_atr_max_pct': 0.07974196061024759, 'bull_tp_mult': 2.3180091585081257, 'bull_tsl_mult': 0.653740187199847, 'bull_time_stop': 63, 'bull_use_sma': False, 'bull_use_ema': False, 'bull_use_atr': True, 'bull_use_adx': False, 'bull_use_spike': True, 'bull_rsi_required': False, 'bear_strategy': 'mean_reversion', 'bear_bb_std_mult': 2.265575891090467, 'bear_rsi_os': 16, 'bear_rsi_ob': 79, 'bear_adx_thresh': 12.722651811738814, 'bear_atr_min_pct': 0.0230770268469271, 'bear_atr_max_pct': 0.09174135935052066, 'bear_tp_mult': 2.0237659204610643, 'bear_tsl_mult': 0.9489987642648852, 'bear_time_stop': 217, 'bear_use_sma': False, 'bear_use_ema': False, 'bear_use_atr': False, 'bear_use_adx': False, 'bear_use_spike': True, 'bear_rsi_required': True, 'sideways_strategy': 'mean_reversion', 'sideways_bb_std_mult': 1.3934493128116128, 'sideways_rsi_os': 27, 'sideways_rsi_ob': 74, 'sideways_adx_thresh': 34.57758239902281, 'sideways_atr_min_pct': 0.014335853954568155, 'sideways_atr_max_pct': 0.13333909762035895, 'sideways_tp_mult': 1.4026249949158152, 'sideways_tsl_mult': 0.4701291816766041, 'sideways_time_stop': 219, 'sideways_use_sma': False, 'sideways_use_ema': False, 'sideways_use_atr': True, 'sideways_use_adx': True, 'sideways_use_spike': True, 'sideways_rsi_required': False}.
[I 2025-08-30 16:52:55,989] Trial 559 finished with values: [-1000000000.0, 1000000000.0] and parameters: {'p_sma': 38, 'p_std': 54, 'p_atr': 28, 'p_adx': 26, 'rsi_period': 8, 'ema1': 27, 'ema2': 10, 'slip_atr_k': 0.1718652507899742, 'slip_spread_k': 0.5992944173229016, 'spread_hl_frac': 0.016752378354821556, 'bb_std_mult': 2.982375727949437, 'rsi_os': 31, 'rsi_ob': 90, 'vol_spike': 0.00016809565748065916, 'adx_thresh': 34.883603851061295, 'atr_min_pct': 0.006169652943447056, 'atr_max_pct': 0.0683890796866415, 'tp_mult': 1.4077617832484415, 'tsl_mult': 0.49007029534237107, 'strategy': 'breakout', 'time_stop': 24, 'use_sma': False, 'use_atr': False, 'use_adx': False, 'use_ema': False, 'use_spike': False, 'rsi_required': False, 'edge_k': 1.7614670001112507, 'edge_cap': 0.25425264294882954, 'bull_strategy': 'breakout', 'bull_bb_std_mult': 1.8132560649348155, 'bull_rsi_os': 8, 'bull_rsi_ob': 49, 'bull_adx_thresh': 25.03830438472698, 'bull_atr_min_pct': 0.02857237902292475, 'bull_atr_max_pct': 0.04109890535972372, 'bull_tp_mult': 1.309963086655084, 'bull_tsl_mult': 0.2514825599850402, 'bull_time_stop': 193, 'bull_use_sma': False, 'bull_use_ema': False, 'bull_use_atr': True, 'bull_use_adx': False, 'bull_use_spike': False, 'bull_rsi_required': True, 'bear_strategy': 'mean_reversion', 'bear_bb_std_mult': 1.9409664211346302, 'bear_rsi_os': 12, 'bear_rsi_ob': 79, 'bear_adx_thresh': 12.935428790055798, 'bear_atr_min_pct': 0.02308134494678166, 'bear_atr_max_pct': 0.13198211748519542, 'bear_tp_mult': 2.011463534482274, 'bear_tsl_mult': 0.6743977945871952, 'bear_time_stop': 45, 'bear_use_sma': False, 'bear_use_ema': True, 'bear_use_atr': True, 'bear_use_adx': False, 'bear_use_spike': True, 'bear_rsi_required': True, 'sideways_strategy': 'mean_reversion', 'sideways_bb_std_mult': 2.083127413511445, 'sideways_rsi_os': 5, 'sideways_rsi_ob': 89, 'sideways_adx_thresh': 17.629518337634295, 'sideways_atr_min_pct': 0.0025327813574099294, 'sideways_atr_max_pct': 0.13194801848778706, 'sideways_tp_mult': 1.3905052488342764, 'sideways_tsl_mult': 0.39693996595333747, 'sideways_time_stop': 61, 'sideways_use_sma': False, 'sideways_use_ema': False, 'sideways_use_atr': False, 'sideways_use_adx': True, 'sideways_use_spike': True, 'sideways_rsi_required': False}.
[I 2025-08-30 16:52:56,281] Trial 560 finished with values: [-1000000000.0, 1000000000.0] and parameters: {'p_sma': 12, 'p_std': 60, 'p_atr': 28, 'p_adx': 25, 'rsi_period': 18, 'ema1': 13, 'ema2': 17, 'slip_atr_k': 0.16102435157406003, 'slip_spread_k': 0.5983929593624171, 'spread_hl_frac': 0.015353606498414678, 'bb_std_mult': 3.2177361341813584, 'rsi_os': 37, 'rsi_ob': 90, 'vol_spike': 0.03555121389171942, 'adx_thresh': 34.97461171878163, 'atr_min_pct': 0.020165753755419524, 'atr_max_pct': 0.1327545661610362, 'tp_mult': 2.7293327789201527, 'tsl_mult': 0.478904092282776, 'strategy': 'breakout', 'time_stop': 238, 'use_sma': True, 'use_atr': False, 'use_adx': False, 'use_ema': True, 'use_spike': False, 'rsi_required': False, 'edge_k': 0.1387969816420328, 'edge_cap': 0.22563846178356034, 'bull_strategy': 'mean_reversion', 'bull_bb_std_mult': 1.9105311521607697, 'bull_rsi_os': 17, 'bull_rsi_ob': 49, 'bull_adx_thresh': 22.2474837610179, 'bull_atr_min_pct': 0.012141396072698537, 'bull_atr_max_pct': 0.08016653165222372, 'bull_tp_mult': 1.318929519507893, 'bull_tsl_mult': 0.30910988025016256, 'bull_time_stop': 292, 'bull_use_sma': False, 'bull_use_ema': True, 'bull_use_atr': True, 'bull_use_adx': False, 'bull_use_spike': False, 'bull_rsi_required': True, 'bear_strategy': 'breakout', 'bear_bb_std_mult': 3.1860327845660765, 'bear_rsi_os': 12, 'bear_rsi_ob': 81, 'bear_adx_thresh': 32.81534121548544, 'bear_atr_min_pct': 0.02303187670190508, 'bear_atr_max_pct': 0.0866728351760381, 'bear_tp_mult': 2.249865254333017, 'bear_tsl_mult': 0.28122176926661535, 'bear_time_stop': 140, 'bear_use_sma': True, 'bear_use_ema': True, 'bear_use_atr': True, 'bear_use_adx': True, 'bear_use_spike': True, 'bear_rsi_required': True, 'sideways_strategy': 'mean_reversion', 'sideways_bb_std_mult': 2.3609518722395024, 'sideways_rsi_os': 40, 'sideways_rsi_ob': 89, 'sideways_adx_thresh': 17.514870876391374, 'sideways_atr_min_pct': 0.01689631677023764, 'sideways_atr_max_pct': 0.08291520241254907, 'sideways_tp_mult': 2.3161686506040953, 'sideways_tsl_mult': 0.40221442302801236, 'sideways_time_stop': 253, 'sideways_use_sma': True, 'sideways_use_ema': True, 'sideways_use_atr': False, 'sideways_use_adx': False, 'sideways_use_spike': True, 'sideways_rsi_required': True}.
[I 2025-08-30 16:53:42,503] Trial 561 finished with values: [-1000000000.0, 1000000000.0] and parameters: {'p_sma': 9, 'p_std': 54, 'p_atr': 24, 'p_adx': 25, 'rsi_period': 8, 'ema1': 27, 'ema2': 18, 'slip_atr_k': 0.02502892381532673, 'slip_spread_k': 0.594207813621961, 'spread_hl_frac': 0.014756730575487487, 'bb_std_mult': 2.86207280387562, 'rsi_os': 35, 'rsi_ob': 89, 'vol_spike': 0.04376937676152426, 'adx_thresh': 17.13052351068648, 'atr_min_pct': 0.00227404994173591, 'atr_max_pct': 0.13954354732365912, 'tp_mult': 2.9549558441954553, 'tsl_mult': 0.6499129380433167, 'strategy': 'mean_reversion', 'time_stop': 10, 'use_sma': True, 'use_atr': True, 'use_adx': False, 'use_ema': True, 'use_spike': True, 'rsi_required': True, 'edge_k': 1.691664119100792, 'edge_cap': 0.6208071104842547, 'bull_strategy': 'mean_reversion', 'bull_bb_std_mult': 3.2461395462426337, 'bull_rsi_os': 13, 'bull_rsi_ob': 49, 'bull_adx_thresh': 27.551086517203913, 'bull_atr_min_pct': 0.028759013898532214, 'bull_atr_max_pct': 0.02160498932022517, 'bull_tp_mult': 1.3283287745132635, 'bull_tsl_mult': 0.20923127328394175, 'bull_time_stop': 196, 'bull_use_sma': False, 'bull_use_ema': True, 'bull_use_atr': True, 'bull_use_adx': False, 'bull_use_spike': False, 'bull_rsi_required': True, 'bear_strategy': 'breakout', 'bear_bb_std_mult': 3.1549175866443315, 'bear_rsi_os': 42, 'bear_rsi_ob': 75, 'bear_adx_thresh': 32.70562069967622, 'bear_atr_min_pct': 0.01490940071143045, 'bear_atr_max_pct': 0.08678807268617594, 'bear_tp_mult': 2.0054632034385524, 'bear_tsl_mult': 0.6713054212373067, 'bear_time_stop': 229, 'bear_use_sma': True, 'bear_use_ema': True, 'bear_use_atr': True, 'bear_use_adx': True, 'bear_use_spike': False, 'bear_rsi_required': False, 'sideways_strategy': 'breakout', 'sideways_bb_std_mult': 2.3123710397046016, 'sideways_rsi_os': 36, 'sideways_rsi_ob': 74, 'sideways_adx_thresh': 14.923478844438453, 'sideways_atr_min_pct': 0.029312388255108332, 'sideways_atr_max_pct': 0.13616059140401374, 'sideways_tp_mult': 1.3944166214248783, 'sideways_tsl_mult': 0.5216229240081197, 'sideways_time_stop': 221, 'sideways_use_sma': True, 'sideways_use_ema': True, 'sideways_use_atr': False, 'sideways_use_adx': False, 'sideways_use_spike': False, 'sideways_rsi_required': True}.
[I 2025-08-30 16:53:42,708] Trial 562 finished with values: [-1000000000.0, 1000000000.0] and parameters: {'p_sma': 9, 'p_std': 16, 'p_atr': 24, 'p_adx': 25, 'rsi_period': 16, 'ema1': 27, 'ema2': 14, 'slip_atr_k': 0.0044607624941204495, 'slip_spread_k': 0.604229527515176, 'spread_hl_frac': 0.014965707834034007, 'bb_std_mult': 1.9955523245585773, 'rsi_os': 31, 'rsi_ob': 58, 'vol_spike': 0.22290571753954994, 'adx_thresh': 12.521684818733426, 'atr_min_pct': 0.020081282826494892, 'atr_max_pct': 0.11784701977676657, 'tp_mult': 2.9952545204592713, 'tsl_mult': 0.6704442800200069, 'strategy': 'mean_reversion', 'time_stop': 9, 'use_sma': True, 'use_atr': True, 'use_adx': True, 'use_ema': True, 'use_spike': True, 'rsi_required': True, 'edge_k': 0.9238770905399388, 'edge_cap': 0.62394332413737, 'bull_strategy': 'mean_reversion', 'bull_bb_std_mult': 2.2795808742701245, 'bull_rsi_os': 13, 'bull_rsi_ob': 49, 'bull_adx_thresh': 9.572599209533132, 'bull_atr_min_pct': 0.00762287638260015, 'bull_atr_max_pct': 0.1379198872736895, 'bull_tp_mult': 1.3171208446181055, 'bull_tsl_mult': 0.3979971907612905, 'bull_time_stop': 82, 'bull_use_sma': False, 'bull_use_ema': True, 'bull_use_atr': True, 'bull_use_adx': True, 'bull_use_spike': False, 'bull_rsi_required': True, 'bear_strategy': 'breakout', 'bear_bb_std_mult': 1.9251036655752904, 'bear_rsi_os': 12, 'bear_rsi_ob': 81, 'bear_adx_thresh': 9.622085371763326, 'bear_atr_min_pct': 0.02196971042953446, 'bear_atr_max_pct': 0.08743073978535489, 'bear_tp_mult': 2.257626971413398, 'bear_tsl_mult': 0.6778720165320716, 'bear_time_stop': 249, 'bear_use_sma': True, 'bear_use_ema': True, 'bear_use_atr': True, 'bear_use_adx': True, 'bear_use_spike': False, 'bear_rsi_required': False, 'sideways_strategy': 'breakout', 'sideways_bb_std_mult': 2.401997001990369, 'sideways_rsi_os': 28, 'sideways_rsi_ob': 72, 'sideways_adx_thresh': 29.56778086181616, 'sideways_atr_min_pct': 0.016835669730239308, 'sideways_atr_max_pct': 0.08373231286603254, 'sideways_tp_mult': 2.187166753791178, 'sideways_tsl_mult': 0.5237897451392854, 'sideways_time_stop': 244, 'sideways_use_sma': True, 'sideways_use_ema': True, 'sideways_use_atr': False, 'sideways_use_adx': False, 'sideways_use_spike': False, 'sideways_rsi_required': True}.
[I 2025-08-30 16:53:43,229] Trial 564 finished with values: [-1000000000.0, 1000000000.0] and parameters: {'p_sma': 42, 'p_std': 25, 'p_atr': 14, 'p_adx': 23, 'rsi_period': 16, 'ema1': 27, 'ema2': 14, 'slip_atr_k': 0.014010426098755926, 'slip_spread_k': 0.6526898402686087, 'spread_hl_frac': 0.017842391773665065, 'bb_std_mult': 2.873935452498115, 'rsi_os': 35, 'rsi_ob': 83, 'vol_spike': 0.04479227712095607, 'adx_thresh': 12.62088328887091, 'atr_min_pct': 0.016075407999709444, 'atr_max_pct': 0.13939498864091177, 'tp_mult': 2.960251510232354, 'tsl_mult': 0.4609318304877877, 'strategy': 'mean_reversion', 'time_stop': 11, 'use_sma': True, 'use_atr': True, 'use_adx': True, 'use_ema': True, 'use_spike': True, 'rsi_required': True, 'edge_k': 1.2621053712066457, 'edge_cap': 0.1912729435473446, 'bull_strategy': 'mean_reversion', 'bull_bb_std_mult': 2.2789632538735156, 'bull_rsi_os': 12, 'bull_rsi_ob': 65, 'bull_adx_thresh': 21.42169180329724, 'bull_atr_min_pct': 0.020056240932928578, 'bull_atr_max_pct': 0.13845463786276951, 'bull_tp_mult': 2.91691904552751, 'bull_tsl_mult': 0.7516862693017708, 'bull_time_stop': 20, 'bull_use_sma': False, 'bull_use_ema': True, 'bull_use_atr': True, 'bull_use_adx': True, 'bull_use_spike': False, 'bull_rsi_required': False, 'bear_strategy': 'breakout', 'bear_bb_std_mult': 1.663578698349636, 'bear_rsi_os': 48, 'bear_rsi_ob': 75, 'bear_adx_thresh': 13.984562863027795, 'bear_atr_min_pct': 0.008087483271489337, 'bear_atr_max_pct': 0.09213177062603915, 'bear_tp_mult': 2.46292883371076, 'bear_tsl_mult': 0.7194729955174906, 'bear_time_stop': 189, 'bear_use_sma': True, 'bear_use_ema': False, 'bear_use_atr': False, 'bear_use_adx': True, 'bear_use_spike': False, 'bear_rsi_required': False, 'sideways_strategy': 'breakout', 'sideways_bb_std_mult': 2.206561626575996, 'sideways_rsi_os': 28, 'sideways_rsi_ob': 58, 'sideways_adx_thresh': 14.816356978461247, 'sideways_atr_min_pct': 0.013324771431263333, 'sideways_atr_max_pct': 0.13724793534515348, 'sideways_tp_mult': 1.5267946493940614, 'sideways_tsl_mult': 0.5190873258420239, 'sideways_time_stop': 84, 'sideways_use_sma': True, 'sideways_use_ema': True, 'sideways_use_atr': False, 'sideways_use_adx': False, 'sideways_use_spike': False, 'sideways_rsi_required': True}.
[I 2025-08-30 16:53:43,558] Trial 563 finished with values: [-1000000000.0, 1000000000.0] and parameters: {'p_sma': 28, 'p_std': 60, 'p_atr': 24, 'p_adx': 23, 'rsi_period': 38, 'ema1': 27, 'ema2': 26, 'slip_atr_k': 0.015496595551264772, 'slip_spread_k': 0.5958567896071809, 'spread_hl_frac': 0.003030050087251209, 'bb_std_mult': 2.8726438772437026, 'rsi_os': 48, 'rsi_ob': 89, 'vol_spike': 0.025151295497666766, 'adx_thresh': 12.566243850401875, 'atr_min_pct': 0.020235082499154178, 'atr_max_pct': 0.032277893678572755, 'tp_mult': 1.3321955753959456, 'tsl_mult': 0.0021571331385521475, 'strategy': 'mean_reversion', 'time_stop': 11, 'use_sma': True, 'use_atr': True, 'use_adx': True, 'use_ema': True, 'use_spike': True, 'rsi_required': True, 'edge_k': 1.6009814346712539, 'edge_cap': 0.558306005293703, 'bull_strategy': 'mean_reversion', 'bull_bb_std_mult': 3.2417637502960037, 'bull_rsi_os': 55, 'bull_rsi_ob': 59, 'bull_adx_thresh': 21.432290538331333, 'bull_atr_min_pct': 0.012300400411693226, 'bull_atr_max_pct': 0.13724470717864926, 'bull_tp_mult': 1.2365551317316492, 'bull_tsl_mult': 0.9968394189801991, 'bull_time_stop': 21, 'bull_use_sma': False, 'bull_use_ema': True, 'bull_use_atr': True, 'bull_use_adx': True, 'bull_use_spike': False, 'bull_rsi_required': True, 'bear_strategy': 'breakout', 'bear_bb_std_mult': 2.2208327514216393, 'bear_rsi_os': 10, 'bear_rsi_ob': 75, 'bear_adx_thresh': 14.440278045907144, 'bear_atr_min_pct': 0.022178480302978885, 'bear_atr_max_pct': 0.08673960780311575, 'bear_tp_mult': 2.463494151104289, 'bear_tsl_mult': 0.2831619261054992, 'bear_time_stop': 230, 'bear_use_sma': True, 'bear_use_ema': True, 'bear_use_atr': True, 'bear_use_adx': True, 'bear_use_spike': False, 'bear_rsi_required': False, 'sideways_strategy': 'breakout', 'sideways_bb_std_mult': 2.333162842458447, 'sideways_rsi_os': 40, 'sideways_rsi_ob': 87, 'sideways_adx_thresh': 14.861854521209105, 'sideways_atr_min_pct': 0.010376698732375308, 'sideways_atr_max_pct': 0.14564279293302232, 'sideways_tp_mult': 2.8202709009088194, 'sideways_tsl_mult': 0.5154442869002592, 'sideways_time_stop': 255, 'sideways_use_sma': True, 'sideways_use_ema': True, 'sideways_use_atr': False, 'sideways_use_adx': False, 'sideways_use_spike': False, 'sideways_rsi_required': True}.
[I 2025-08-30 16:53:44,958] Trial 566 finished with values: [-1000000000.0, 1000000000.0] and parameters: {'p_sma': 42, 'p_std': 24, 'p_atr': 26, 'p_adx': 23, 'rsi_period': 16, 'ema1': 8, 'ema2': 12, 'slip_atr_k': 0.013600468214667333, 'slip_spread_k': 0.18128717820225326, 'spread_hl_frac': 0.018058883145096054, 'bb_std_mult': 1.596233611455903, 'rsi_os': 35, 'rsi_ob': 47, 'vol_spike': 0.19919087984172457, 'adx_thresh': 16.66515674219008, 'atr_min_pct': 0.019478634549548745, 'atr_max_pct': 0.031855319731685025, 'tp_mult': 2.780097477090515, 'tsl_mult': 0.4630549866281881, 'strategy': 'mean_reversion', 'time_stop': 207, 'use_sma': False, 'use_atr': True, 'use_adx': True, 'use_ema': False, 'use_spike': False, 'rsi_required': True, 'edge_k': 1.269921274460357, 'edge_cap': 0.6041034965120867, 'bull_strategy': 'mean_reversion', 'bull_bb_std_mult': 1.5827730140669443, 'bull_rsi_os': 24, 'bull_rsi_ob': 51, 'bull_adx_thresh': 34.90783927738589, 'bull_atr_min_pct': 0.01300583061624794, 'bull_atr_max_pct': 0.14222041926692183, 'bull_tp_mult': 1.2356564469351872, 'bull_tsl_mult': 0.5805736177697283, 'bull_time_stop': 70, 'bull_use_sma': True, 'bull_use_ema': True, 'bull_use_atr': False, 'bull_use_adx': True, 'bull_use_spike': False, 'bull_rsi_required': False, 'bear_strategy': 'mean_reversion', 'bear_bb_std_mult': 3.395726096525198, 'bear_rsi_os': 21, 'bear_rsi_ob': 76, 'bear_adx_thresh': 14.368442119669272, 'bear_atr_min_pct': 0.022316264690277435, 'bear_atr_max_pct': 0.0919450740935621, 'bear_tp_mult': 1.713571219865655, 'bear_tsl_mult': 0.07600692076896892, 'bear_time_stop': 189, 'bear_use_sma': True, 'bear_use_ema': False, 'bear_use_atr': False, 'bear_use_adx': False, 'bear_use_spike': False, 'bear_rsi_required': False, 'sideways_strategy': 'breakout', 'sideways_bb_std_mult': 1.3100559708295287, 'sideways_rsi_os': 53, 'sideways_rsi_ob': 92, 'sideways_adx_thresh': 32.27661371993675, 'sideways_atr_min_pct': 0.0032997168276726226, 'sideways_atr_max_pct': 0.030551850749830738, 'sideways_tp_mult': 1.5332357380410866, 'sideways_tsl_mult': 0.4485751726232351, 'sideways_time_stop': 34, 'sideways_use_sma': True, 'sideways_use_ema': False, 'sideways_use_atr': False, 'sideways_use_adx': False, 'sideways_use_spike': False, 'sideways_rsi_required': True}.
[I 2025-08-30 16:53:45,032] Trial 568 finished with values: [-1000000000.0, 1000000000.0] and parameters: {'p_sma': 34, 'p_std': 24, 'p_atr': 27, 'p_adx': 24, 'rsi_period': 65, 'ema1': 18, 'ema2': 24, 'slip_atr_k': 0.00813840555622186, 'slip_spread_k': 0.5621568717020999, 'spread_hl_frac': 0.01850495143300049, 'bb_std_mult': 3.1521112993374185, 'rsi_os': 53, 'rsi_ob': 77, 'vol_spike': 0.01403859298143506, 'adx_thresh': 11.278428812434894, 'atr_min_pct': 0.019437010760822684, 'atr_max_pct': 0.1329334286398287, 'tp_mult': 2.8961561587077105, 'tsl_mult': 0.15769764197819697, 'strategy': 'mean_reversion', 'time_stop': 221, 'use_sma': False, 'use_atr': True, 'use_adx': True, 'use_ema': False, 'use_spike': False, 'rsi_required': True, 'edge_k': 1.4742239211824428, 'edge_cap': 0.15532407504019752, 'bull_strategy': 'mean_reversion', 'bull_bb_std_mult': 1.6265332125492984, 'bull_rsi_os': 11, 'bull_rsi_ob': 53, 'bull_adx_thresh': 23.525441883419585, 'bull_atr_min_pct': 0.009555512381417493, 'bull_atr_max_pct': 0.08570185267490672, 'bull_tp_mult': 1.1041509917376164, 'bull_tsl_mult': 0.5054773753143773, 'bull_time_stop': 73, 'bull_use_sma': True, 'bull_use_ema': True, 'bull_use_atr': False, 'bull_use_adx': True, 'bull_use_spike': False, 'bull_rsi_required': False, 'bear_strategy': 'mean_reversion', 'bear_bb_std_mult': 2.005335435043306, 'bear_rsi_os': 15, 'bear_rsi_ob': 76, 'bear_adx_thresh': 15.674261341998726, 'bear_atr_min_pct': 0.020347733081560807, 'bear_atr_max_pct': 0.08285538051100727, 'bear_tp_mult': 2.216998743780637, 'bear_tsl_mult': 0.7594574350445171, 'bear_time_stop': 67, 'bear_use_sma': True, 'bear_use_ema': False, 'bear_use_atr': False, 'bear_use_adx': False, 'bear_use_spike': False, 'bear_rsi_required': False, 'sideways_strategy': 'breakout', 'sideways_bb_std_mult': 1.681307436295473, 'sideways_rsi_os': 13, 'sideways_rsi_ob': 92, 'sideways_adx_thresh': 16.414915106483953, 'sideways_atr_min_pct': 0.000543396662180752, 'sideways_atr_max_pct': 0.14983099003768982, 'sideways_tp_mult': 1.4339582110808602, 'sideways_tsl_mult': 0.4511329565195044, 'sideways_time_stop': 213, 'sideways_use_sma': True, 'sideways_use_ema': False, 'sideways_use_atr': False, 'sideways_use_adx': False, 'sideways_use_spike': False, 'sideways_rsi_required': True}.
