[I 2025-08-30 16:18:38,287] Trial 361 finished with values: [-1000000000.0, 1000000000.0] and parameters: {'p_sma': 44, 'p_std': 43, 'p_atr': 24, 'p_adx': 24, 'rsi_period': 76, 'ema1': 21, 'ema2': 10, 'slip_atr_k': 0.00036716553379107647, 'slip_spread_k': 0.5941578986061614, 'spread_hl_frac': 0.020837284054714085, 'bb_std_mult': 3.219701475809248, 'rsi_os': 34, 'rsi_ob': 87, 'vol_spike': 0.06158847177999176, 'adx_thresh': 12.880832641531114, 'atr_min_pct': 0.017688091205416912, 'atr_max_pct': 0.05594968240959917, 'tp_mult': 2.999313853082379, 'tsl_mult': 0.5146849767155367, 'strategy': 'mean_reversion', 'time_stop': 5, 'use_sma': False, 'use_atr': False, 'use_adx': True, 'use_ema': True, 'use_spike': False, 'rsi_required': True, 'edge_k': 1.4900955675955103, 'edge_cap': 0.20160604696574397, 'bull_strategy': 'mean_reversion', 'bull_bb_std_mult': 1.778869384467187, 'bull_rsi_os': 8, 'bull_rsi_ob': 51, 'bull_adx_thresh': 17.369301471101995, 'bull_atr_min_pct': 0.021133846987125244, 'bull_atr_max_pct': 0.0747978341931165, 'bull_tp_mult': 1.0687041296755675, 'bull_tsl_mult': 0.9736655669711773, 'bull_time_stop': 111, 'bull_use_sma': False, 'bull_use_ema': False, 'bull_use_atr': True, 'bull_use_adx': True, 'bull_use_spike': True, 'bull_rsi_required': False, 'bear_strategy': 'breakout', 'bear_bb_std_mult': 2.5366509967618365, 'bear_rsi_os': 14, 'bear_rsi_ob': 77, 'bear_adx_thresh': 13.795308964964104, 'bear_atr_min_pct': 0.000274771883175734, 'bear_atr_max_pct': 0.08908726371063691, 'bear_tp_mult': 1.3690634994992155, 'bear_tsl_mult': 0.6171578885818176, 'bear_time_stop': 230, 'bear_use_sma': True, 'bear_use_ema': True, 'bear_use_atr': False, 'bear_use_adx': False, 'bear_use_spike': False, 'bear_rsi_required': True, 'sideways_strategy': 'mean_reversion', 'sideways_bb_std_mult': 2.117175555803551, 'sideways_rsi_os': 29, 'sideways_rsi_ob': 93, 'sideways_adx_thresh': 11.312338422716977, 'sideways_atr_min_pct': 0.007215377608586351, 'sideways_atr_max_pct': 0.025416827406875883, 'sideways_tp_mult': 1.4890372081127738, 'sideways_tsl_mult': 0.4706054352730784, 'sideways_time_stop': 20, 'sideways_use_sma': False, 'sideways_use_ema': True, 'sideways_use_atr': True, 'sideways_use_adx': False, 'sideways_use_spike': True, 'sideways_rsi_required': False}.
[I 2025-08-30 16:18:38,290] Trial 358 finished with values: [-1000000000.0, 1000000000.0] and parameters: {'p_sma': 9, 'p_std': 57, 'p_atr': 30, 'p_adx': 24, 'rsi_period': 16, 'ema1': 8, 'ema2': 10, 'slip_atr_k': 0.14232099504233597, 'slip_spread_k': 0.6184915823463015, 'spread_hl_frac': 0.017187113765791222, 'bb_std_mult': 2.543130038374081, 'rsi_os': 30, 'rsi_ob': 89, 'vol_spike': 0.0003680880517498205, 'adx_thresh': 12.589178365774004, 'atr_min_pct': 0.01883654057482706, 'atr_max_pct': 0.14005406207404036, 'tp_mult': 1.9197754809739571, 'tsl_mult': 0.8548572050858326, 'strategy': 'mean_reversion', 'time_stop': 188, 'use_sma': False, 'use_atr': False, 'use_adx': True, 'use_ema': True, 'use_spike': False, 'rsi_required': True, 'edge_k': 0.06153782813942732, 'edge_cap': 0.6471506060638, 'bull_strategy': 'mean_reversion', 'bull_bb_std_mult': 3.027791395673622, 'bull_rsi_os': 12, 'bull_rsi_ob': 50, 'bull_adx_thresh': 5.025354446789505, 'bull_atr_min_pct': 0.02120734672950158, 'bull_atr_max_pct': 0.1344290328494654, 'bull_tp_mult': 1.3044188273889958, 'bull_tsl_mult': 0.046599070284630506, 'bull_time_stop': 148, 'bull_use_sma': False, 'bull_use_ema': True, 'bull_use_atr': True, 'bull_use_adx': True, 'bull_use_spike': True, 'bull_rsi_required': False, 'bear_strategy': 'breakout', 'bear_bb_std_mult': 2.512954557326024, 'bear_rsi_os': 45, 'bear_rsi_ob': 75, 'bear_adx_thresh': 14.536279074966567, 'bear_atr_min_pct': 0.022328383839877695, 'bear_atr_max_pct': 0.08956775303762889, 'bear_tp_mult': 2.1214125982238357, 'bear_tsl_mult': 0.00286557944106286, 'bear_time_stop': 74, 'bear_use_sma': True, 'bear_use_ema': False, 'bear_use_atr': True, 'bear_use_adx': False, 'bear_use_spike': False, 'bear_rsi_required': False, 'sideways_strategy': 'mean_reversion', 'sideways_bb_std_mult': 2.1250319727229843, 'sideways_rsi_os': 29, 'sideways_rsi_ob': 46, 'sideways_adx_thresh': 15.68413134946354, 'sideways_atr_min_pct': 0.004096361271205398, 'sideways_atr_max_pct': 0.02524226087736206, 'sideways_tp_mult': 2.0304326446375938, 'sideways_tsl_mult': 0.49927740281548527, 'sideways_time_stop': 164, 'sideways_use_sma': False, 'sideways_use_ema': True, 'sideways_use_atr': False, 'sideways_use_adx': False, 'sideways_use_spike': True, 'sideways_rsi_required': True}.
[I 2025-08-30 16:18:39,192] Trial 365 finished with values: [-1000000000.0, 1000000000.0] and parameters: {'p_sma': 10, 'p_std': 15, 'p_atr': 12, 'p_adx': 12, 'rsi_period': 19, 'ema1': 15, 'ema2': 14, 'slip_atr_k': 0.24377459349790387, 'slip_spread_k': 0.29933568932886456, 'spread_hl_frac': 0.018655281207511688, 'bb_std_mult': 3.0132492163846503, 'rsi_os': 13, 'rsi_ob': 46, 'vol_spike': 0.00018355868400706093, 'adx_thresh': 5.748659197359066, 'atr_min_pct': 0.017567317812240895, 'atr_max_pct': 0.13157025112563842, 'tp_mult': 2.536887338574029, 'tsl_mult': 0.4258733864991696, 'strategy': 'mean_reversion', 'time_stop': 68, 'use_sma': False, 'use_atr': True, 'use_adx': True, 'use_ema': False, 'use_spike': False, 'rsi_required': True, 'edge_k': 1.653842196770304, 'edge_cap': 0.7454611678741286, 'bull_strategy': 'mean_reversion', 'bull_bb_std_mult': 1.2476078641820847, 'bull_rsi_os': 47, 'bull_rsi_ob': 52, 'bull_adx_thresh': 21.756772886147306, 'bull_atr_min_pct': 0.013275802684587786, 'bull_atr_max_pct': 0.1409306329507722, 'bull_tp_mult': 1.8165969373916324, 'bull_tsl_mult': 0.5438578300410666, 'bull_time_stop': 85, 'bull_use_sma': False, 'bull_use_ema': True, 'bull_use_atr': True, 'bull_use_adx': True, 'bull_use_spike': False, 'bull_rsi_required': False, 'bear_strategy': 'mean_reversion', 'bear_bb_std_mult': 2.112082603533562, 'bear_rsi_os': 12, 'bear_rsi_ob': 79, 'bear_adx_thresh': 19.586489876599938, 'bear_atr_min_pct': 0.023025578477159508, 'bear_atr_max_pct': 0.020069147794152253, 'bear_tp_mult': 2.223853759206062, 'bear_tsl_mult': 0.29021934730551124, 'bear_time_stop': 242, 'bear_use_sma': True, 'bear_use_ema': True, 'bear_use_atr': False, 'bear_use_adx': False, 'bear_use_spike': False, 'bear_rsi_required': False, 'sideways_strategy': 'breakout', 'sideways_bb_std_mult': 1.1535172692171285, 'sideways_rsi_os': 28, 'sideways_rsi_ob': 61, 'sideways_adx_thresh': 17.645496269728874, 'sideways_atr_min_pct': 0.024288485987386317, 'sideways_atr_max_pct': 0.14420060911525617, 'sideways_tp_mult': 1.3357899618720572, 'sideways_tsl_mult': 0.4794337614354218, 'sideways_time_stop': 93, 'sideways_use_sma': True, 'sideways_use_ema': False, 'sideways_use_atr': False, 'sideways_use_adx': False, 'sideways_use_spike': False, 'sideways_rsi_required': False}.
[I 2025-08-30 16:19:22,716] Trial 363 finished with values: [-1000000000.0, 1000000000.0] and parameters: {'p_sma': 38, 'p_std': 52, 'p_atr': 12, 'p_adx': 12, 'rsi_period': 76, 'ema1': 10, 'ema2': 10, 'slip_atr_k': 0.0002665316877194157, 'slip_spread_k': 0.5975305916399425, 'spread_hl_frac': 0.016016470059461666, 'bb_std_mult': 0.6395934522526185, 'rsi_os': 34, 'rsi_ob': 94, 'vol_spike': 0.0001635449102817552, 'adx_thresh': 12.772210076001198, 'atr_min_pct': 0.017567902216407093, 'atr_max_pct': 0.13188528063939192, 'tp_mult': 2.973249938615239, 'tsl_mult': 0.46589928625396565, 'strategy': 'mean_reversion', 'time_stop': 183, 'use_sma': False, 'use_atr': True, 'use_adx': True, 'use_ema': False, 'use_spike': False, 'rsi_required': True, 'edge_k': 1.6370783836070049, 'edge_cap': 0.5336898306604665, 'bull_strategy': 'mean_reversion', 'bull_bb_std_mult': 3.0057296703390373, 'bull_rsi_os': 10, 'bull_rsi_ob': 52, 'bull_adx_thresh': 21.619717017019585, 'bull_atr_min_pct': 0.01560054608033925, 'bull_atr_max_pct': 0.13376665902579649, 'bull_tp_mult': 1.2004842054736846, 'bull_tsl_mult': 0.27912560376907647, 'bull_time_stop': 67, 'bull_use_sma': False, 'bull_use_ema': True, 'bull_use_atr': True, 'bull_use_adx': True, 'bull_use_spike': False, 'bull_rsi_required': False, 'bear_strategy': 'mean_reversion', 'bear_bb_std_mult': 2.5487033552761047, 'bear_rsi_os': 7, 'bear_rsi_ob': 80, 'bear_adx_thresh': 18.363814576531777, 'bear_atr_min_pct': 0.013097078284899272, 'bear_atr_max_pct': 0.05994367808269291, 'bear_tp_mult': 2.783953136207919, 'bear_tsl_mult': 0.013738375311865725, 'bear_time_stop': 209, 'bear_use_sma': True, 'bear_use_ema': True, 'bear_use_atr': False, 'bear_use_adx': False, 'bear_use_spike': False, 'bear_rsi_required': False, 'sideways_strategy': 'breakout', 'sideways_bb_std_mult': 1.5325739862693166, 'sideways_rsi_os': 29, 'sideways_rsi_ob': 95, 'sideways_adx_thresh': 16.685802038471476, 'sideways_atr_min_pct': 0.02508863596019007, 'sideways_atr_max_pct': 0.04387151930178026, 'sideways_tp_mult': 1.3535023117022267, 'sideways_tsl_mult': 0.473286487337608, 'sideways_time_stop': 300, 'sideways_use_sma': True, 'sideways_use_ema': False, 'sideways_use_atr': False, 'sideways_use_adx': False, 'sideways_use_spike': False, 'sideways_rsi_required': False}.
[I 2025-08-30 16:19:24,251] Trial 364 finished with values: [-1000000000.0, 1000000000.0] and parameters: {'p_sma': 10, 'p_std': 58, 'p_atr': 24, 'p_adx': 26, 'rsi_period': 19, 'ema1': 25, 'ema2': 39, 'slip_atr_k': 0.010100664130241513, 'slip_spread_k': 0.6497693212654443, 'spread_hl_frac': 0.029414033647330678, 'bb_std_mult': 2.2030455535607767, 'rsi_os': 24, 'rsi_ob': 91, 'vol_spike': 0.0052483212275093085, 'adx_thresh': 24.54955231722006, 'atr_min_pct': 0.01743317300285767, 'atr_max_pct': 0.0695174006321701, 'tp_mult': 2.6805397800962516, 'tsl_mult': 0.47014415156043066, 'strategy': 'mean_reversion', 'time_stop': 12, 'use_sma': False, 'use_atr': True, 'use_adx': True, 'use_ema': False, 'use_spike': False, 'rsi_required': True, 'edge_k': 1.6568425106984384, 'edge_cap': 0.6216871907352377, 'bull_strategy': 'mean_reversion', 'bull_bb_std_mult': 1.2504866690560554, 'bull_rsi_os': 47, 'bull_rsi_ob': 52, 'bull_adx_thresh': 10.372874093512895, 'bull_atr_min_pct': 0.02306676219790905, 'bull_atr_max_pct': 0.09188272004062083, 'bull_tp_mult': 2.2831051371226554, 'bull_tsl_mult': 0.27490680250965027, 'bull_time_stop': 62, 'bull_use_sma': False, 'bull_use_ema': True, 'bull_use_atr': True, 'bull_use_adx': True, 'bull_use_spike': False, 'bull_rsi_required': False, 'bear_strategy': 'mean_reversion', 'bear_bb_std_mult': 2.1104958817562522, 'bear_rsi_os': 12, 'bear_rsi_ob': 80, 'bear_adx_thresh': 22.635776056845792, 'bear_atr_min_pct': 0.004094173820693882, 'bear_atr_max_pct': 0.0599762971533096, 'bear_tp_mult': 2.2234945603899976, 'bear_tsl_mult': 0.2897754533832325, 'bear_time_stop': 211, 'bear_use_sma': True, 'bear_use_ema': True, 'bear_use_atr': False, 'bear_use_adx': False, 'bear_use_spike': False, 'bear_rsi_required': False, 'sideways_strategy': 'breakout', 'sideways_bb_std_mult': 1.9595593601603023, 'sideways_rsi_os': 28, 'sideways_rsi_ob': 90, 'sideways_adx_thresh': 16.698785890043943, 'sideways_atr_min_pct': 0.009761307471261233, 'sideways_atr_max_pct': 0.13156448023520897, 'sideways_tp_mult': 1.340816484459155, 'sideways_tsl_mult': 0.47383307678932235, 'sideways_time_stop': 207, 'sideways_use_sma': True, 'sideways_use_ema': False, 'sideways_use_atr': False, 'sideways_use_adx': False, 'sideways_use_spike': False, 'sideways_rsi_required': False}.
[I 2025-08-30 16:19:25,670] Trial 366 finished with values: [-1000000000.0, 1000000000.0] and parameters: {'p_sma': 40, 'p_std': 58, 'p_atr': 24, 'p_adx': 26, 'rsi_period': 21, 'ema1': 6, 'ema2': 11, 'slip_atr_k': 0.009410199054726471, 'slip_spread_k': 0.6447232848541067, 'spread_hl_frac': 0.016118644515707794, 'bb_std_mult': 2.20908590511793, 'rsi_os': 22, 'rsi_ob': 91, 'vol_spike': 0.006944400362566342, 'adx_thresh': 9.200667374981178, 'atr_min_pct': 0.01254798031152838, 'atr_max_pct': 0.09699690281939725, 'tp_mult': 2.6810467992916185, 'tsl_mult': 0.462706321070423, 'strategy': 'mean_reversion', 'time_stop': 14, 'use_sma': False, 'use_atr': True, 'use_adx': True, 'use_ema': False, 'use_spike': False, 'rsi_required': True, 'edge_k': 0.7134742020791573, 'edge_cap': 0.6198999863957372, 'bull_strategy': 'mean_reversion', 'bull_bb_std_mult': 1.9394173607197267, 'bull_rsi_os': 10, 'bull_rsi_ob': 66, 'bull_adx_thresh': 23.0377466429169, 'bull_atr_min_pct': 0.02337253721645257, 'bull_atr_max_pct': 0.09371043258019814, 'bull_tp_mult': 1.2031007223362609, 'bull_tsl_mult': 0.8937285327029838, 'bull_time_stop': 66, 'bull_use_sma': False, 'bull_use_ema': True, 'bull_use_atr': True, 'bull_use_adx': True, 'bull_use_spike': False, 'bull_rsi_required': False, 'bear_strategy': 'mean_reversion', 'bear_bb_std_mult': 2.245213901745051, 'bear_rsi_os': 13, 'bear_rsi_ob': 46, 'bear_adx_thresh': 12.894645901588992, 'bear_atr_min_pct': 0.021741356715854185, 'bear_atr_max_pct': 0.09958652164453786, 'bear_tp_mult': 1.8315764702901711, 'bear_tsl_mult': 0.27049619572495703, 'bear_time_stop': 210, 'bear_use_sma': True, 'bear_use_ema': False, 'bear_use_atr': False, 'bear_use_adx': False, 'bear_use_spike': False, 'bear_rsi_required': False, 'sideways_strategy': 'breakout', 'sideways_bb_std_mult': 1.7717732126781394, 'sideways_rsi_os': 22, 'sideways_rsi_ob': 80, 'sideways_adx_thresh': 16.69650129655006, 'sideways_atr_min_pct': 0.027436768320536906, 'sideways_atr_max_pct': 0.043636653858889624, 'sideways_tp_mult': 1.05503352996298, 'sideways_tsl_mult': 0.46145592129146945, 'sideways_time_stop': 223, 'sideways_use_sma': True, 'sideways_use_ema': False, 'sideways_use_atr': False, 'sideways_use_adx': False, 'sideways_use_spike': False, 'sideways_rsi_required': True}.
[I 2025-08-30 16:19:26,649] Trial 362 finished with values: [-1000000000.0, 1000000000.0] and parameters: {'p_sma': 10, 'p_std': 46, 'p_atr': 12, 'p_adx': 24, 'rsi_period': 19, 'ema1': 6, 'ema2': 10, 'slip_atr_k': 0.248765178342616, 'slip_spread_k': 0.5965898018939749, 'spread_hl_frac': 5.5388380187548075e-05, 'bb_std_mult': 2.208320352611018, 'rsi_os': 30, 'rsi_ob': 93, 'vol_spike': 0.0003307729832607324, 'adx_thresh': 24.47690887860972, 'atr_min_pct': 0.01811289822503971, 'atr_max_pct': 0.06926790422776387, 'tp_mult': 2.9992898603164333, 'tsl_mult': 0.509716062189817, 'strategy': 'mean_reversion', 'time_stop': 12, 'use_sma': False, 'use_atr': False, 'use_adx': True, 'use_ema': True, 'use_spike': False, 'rsi_required': True, 'edge_k': 0.718369650023865, 'edge_cap': 0.9511175606222868, 'bull_strategy': 'mean_reversion', 'bull_bb_std_mult': 0.7943931228773669, 'bull_rsi_os': 8, 'bull_rsi_ob': 49, 'bull_adx_thresh': 21.517910999952015, 'bull_atr_min_pct': 0.023156673395384356, 'bull_atr_max_pct': 0.1391512989303488, 'bull_tp_mult': 1.2580218728724295, 'bull_tsl_mult': 0.19008052685119292, 'bull_time_stop': 76, 'bull_use_sma': False, 'bull_use_ema': False, 'bull_use_atr': True, 'bull_use_adx': True, 'bull_use_spike': True, 'bull_rsi_required': False, 'bear_strategy': 'breakout', 'bear_bb_std_mult': 2.2284560390621095, 'bear_rsi_os': 14, 'bear_rsi_ob': 80, 'bear_adx_thresh': 24.598475078171678, 'bear_atr_min_pct': 0.004065642652258764, 'bear_atr_max_pct': 0.06073581797015823, 'bear_tp_mult': 1.3470858241875794, 'bear_tsl_mult': 0.6075259395207961, 'bear_time_stop': 244, 'bear_use_sma': True, 'bear_use_ema': True, 'bear_use_atr': False, 'bear_use_adx': False, 'bear_use_spike': False, 'bear_rsi_required': True, 'sideways_strategy': 'mean_reversion', 'sideways_bb_std_mult': 1.5341213623063417, 'sideways_rsi_os': 29, 'sideways_rsi_ob': 61, 'sideways_adx_thresh': 16.682674836611437, 'sideways_atr_min_pct': 0.027492316851353442, 'sideways_atr_max_pct': 0.13222326870821485, 'sideways_tp_mult': 1.3520692495366946, 'sideways_tsl_mult': 0.48203890584827913, 'sideways_time_stop': 223, 'sideways_use_sma': True, 'sideways_use_ema': True, 'sideways_use_atr': True, 'sideways_use_adx': False, 'sideways_use_spike': True, 'sideways_rsi_required': False}.
[I 2025-08-30 16:20:06,618] Trial 367 finished with values: [-1000000000.0, 1000000000.0] and parameters: {'p_sma': 47, 'p_std': 58, 'p_atr': 26, 'p_adx': 23, 'rsi_period': 21, 'ema1': 26, 'ema2': 11, 'slip_atr_k': 0.1247594269037289, 'slip_spread_k': 0.5886589022002761, 'spread_hl_frac': 0.01881798742279779, 'bb_std_mult': 1.9421504773067422, 'rsi_os': 23, 'rsi_ob': 91, 'vol_spike': 0.14035086517178527, 'adx_thresh': 14.567725142721846, 'atr_min_pct': 0.004485869354203507, 'atr_max_pct': 0.14066790510624969, 'tp_mult': 2.6631969371534616, 'tsl_mult': 0.4978306356404962, 'strategy': 'mean_reversion', 'time_stop': 13, 'use_sma': True, 'use_atr': True, 'use_adx': True, 'use_ema': False, 'use_spike': False, 'rsi_required': True, 'edge_k': 1.4963416371898812, 'edge_cap': 0.8477169151969756, 'bull_strategy': 'mean_reversion', 'bull_bb_std_mult': 0.8020716483881651, 'bull_rsi_os': 10, 'bull_rsi_ob': 48, 'bull_adx_thresh': 22.906375851990237, 'bull_atr_min_pct': 0.023452354722688327, 'bull_atr_max_pct': 0.09292971991683653, 'bull_tp_mult': 2.285007381896225, 'bull_tsl_mult': 0.15274484021472895, 'bull_time_stop': 34, 'bull_use_sma': False, 'bull_use_ema': True, 'bull_use_atr': True, 'bull_use_adx': True, 'bull_use_spike': False, 'bull_rsi_required': False, 'bear_strategy': 'mean_reversion', 'bear_bb_std_mult': 2.0351479886681694, 'bear_rsi_os': 34, 'bear_rsi_ob': 46, 'bear_adx_thresh': 12.868065036995304, 'bear_atr_min_pct': 0.02088461904028911, 'bear_atr_max_pct': 0.09853252750407879, 'bear_tp_mult': 2.1870827376486965, 'bear_tsl_mult': 0.6679797118575443, 'bear_time_stop': 219, 'bear_use_sma': True, 'bear_use_ema': False, 'bear_use_atr': False, 'bear_use_adx': True, 'bear_use_spike': False, 'bear_rsi_required': True, 'sideways_strategy': 'breakout', 'sideways_bb_std_mult': 1.7697015197476833, 'sideways_rsi_os': 27, 'sideways_rsi_ob': 78, 'sideways_adx_thresh': 33.524790320198804, 'sideways_atr_min_pct': 0.02720918205092128, 'sideways_atr_max_pct': 0.06045401998930147, 'sideways_tp_mult': 1.2146572404571643, 'sideways_tsl_mult': 0.4561974935529183, 'sideways_time_stop': 222, 'sideways_use_sma': True, 'sideways_use_ema': False, 'sideways_use_atr': True, 'sideways_use_adx': False, 'sideways_use_spike': False, 'sideways_rsi_required': True}.
[I 2025-08-30 16:20:08,570] Trial 368 finished with values: [-0.02133639426922951, 0.02124617999658249] and parameters: {'p_sma': 54, 'p_std': 55, 'p_atr': 26, 'p_adx': 23, 'rsi_period': 22, 'ema1': 26, 'ema2': 48, 'slip_atr_k': 0.15006382656604564, 'slip_spread_k': 0.5873351089733116, 'spread_hl_frac': 0.0011443892751844195, 'bb_std_mult': 3.116494193494226, 'rsi_os': 48, 'rsi_ob': 93, 'vol_spike': 0.010144133090429134, 'adx_thresh': 13.267994829271162, 'atr_min_pct': 0.024972208706014278, 'atr_max_pct': 0.1413679019762811, 'tp_mult': 2.793587924253374, 'tsl_mult': 0.7992278136854931, 'strategy': 'mean_reversion', 'time_stop': 29, 'use_sma': True, 'use_atr': True, 'use_adx': True, 'use_ema': False, 'use_spike': False, 'rsi_required': True, 'edge_k': 0.7243918859597164, 'edge_cap': 0.682287328159664, 'bull_strategy': 'mean_reversion', 'bull_bb_std_mult': 0.8890899042966618, 'bull_rsi_os': 10, 'bull_rsi_ob': 49, 'bull_adx_thresh': 16.24773896379366, 'bull_atr_min_pct': 0.019982980918667455, 'bull_atr_max_pct': 0.13829164563908877, 'bull_tp_mult': 1.4414734354188943, 'bull_tsl_mult': 0.18827868223935307, 'bull_time_stop': 32, 'bull_use_sma': False, 'bull_use_ema': True, 'bull_use_atr': True, 'bull_use_adx': True, 'bull_use_spike': False, 'bull_rsi_required': False, 'bear_strategy': 'mean_reversion', 'bear_bb_std_mult': 1.1254651271117635, 'bear_rsi_os': 33, 'bear_rsi_ob': 72, 'bear_adx_thresh': 24.612261832703588, 'bear_atr_min_pct': 0.005088281176810329, 'bear_atr_max_pct': 0.07756443907493646, 'bear_tp_mult': 2.168661415395828, 'bear_tsl_mult': 0.26633693841182826, 'bear_time_stop': 221, 'bear_use_sma': True, 'bear_use_ema': False, 'bear_use_atr': False, 'bear_use_adx': True, 'bear_use_spike': False, 'bear_rsi_required': True, 'sideways_strategy': 'breakout', 'sideways_bb_std_mult': 1.8803591893537623, 'sideways_rsi_os': 27, 'sideways_rsi_ob': 83, 'sideways_adx_thresh': 7.701756986916557, 'sideways_atr_min_pct': 0.002010115798982161, 'sideways_atr_max_pct': 0.14586544302883916, 'sideways_tp_mult': 1.53054246651991, 'sideways_tsl_mult': 0.37939184436187307, 'sideways_time_stop': 223, 'sideways_use_sma': True, 'sideways_use_ema': False, 'sideways_use_atr': True, 'sideways_use_adx': False, 'sideways_use_spike': False, 'sideways_rsi_required': True}.
