[I 2025-08-30 16:15:42,124] Trial 344 finished with values: [-1000000000.0, 1000000000.0] and parameters: {'p_sma': 57, 'p_std': 38, 'p_atr': 26, 'p_adx': 24, 'rsi_period': 12, 'ema1': 26, 'ema2': 11, 'slip_atr_k': 4.026785638631611e-05, 'slip_spread_k': 0.6604337103374214, 'spread_hl_frac': 0.019711568582659354, 'bb_std_mult': 3.00864322767127, 'rsi_os': 9, 'rsi_ob': 88, 'vol_spike': 0.006502578970844197, 'adx_thresh': 6.7095181750247725, 'atr_min_pct': 0.018524807131834683, 'atr_max_pct': 0.13795307541644453, 'tp_mult': 2.829185301778317, 'tsl_mult': 0.7187880747267044, 'strategy': 'mean_reversion', 'time_stop': 5, 'use_sma': False, 'use_atr': False, 'use_adx': True, 'use_ema': True, 'use_spike': False, 'rsi_required': True, 'edge_k': 1.0211957527660984, 'edge_cap': 0.5703036078514037, 'bull_strategy': 'mean_reversion', 'bull_bb_std_mult': 1.8833667821147553, 'bull_rsi_os': 13, 'bull_rsi_ob': 52, 'bull_adx_thresh': 11.081722275299846, 'bull_atr_min_pct': 0.02045888372274309, 'bull_atr_max_pct': 0.14097773049358092, 'bull_tp_mult': 2.3429679107554895, 'bull_tsl_mult': 0.6518516570683187, 'bull_time_stop': 73, 'bull_use_sma': False, 'bull_use_ema': False, 'bull_use_atr': True, 'bull_use_adx': True, 'bull_use_spike': True, 'bull_rsi_required': False, 'bear_strategy': 'breakout', 'bear_bb_std_mult': 0.7998328702548358, 'bear_rsi_os': 36, 'bear_rsi_ob': 77, 'bear_adx_thresh': 29.07466806966275, 'bear_atr_min_pct': 0.01984594294693524, 'bear_atr_max_pct': 0.08833949082668892, 'bear_tp_mult': 2.220543036864365, 'bear_tsl_mult': 0.6377346467000257, 'bear_time_stop': 87, 'bear_use_sma': True, 'bear_use_ema': True, 'bear_use_atr': False, 'bear_use_adx': False, 'bear_use_spike': False, 'bear_rsi_required': False, 'sideways_strategy': 'mean_reversion', 'sideways_bb_std_mult': 0.8712965225617106, 'sideways_rsi_os': 27, 'sideways_rsi_ob': 92, 'sideways_adx_thresh': 16.431834449206384, 'sideways_atr_min_pct': 0.0006796524725741311, 'sideways_atr_max_pct': 0.03255711059224485, 'sideways_tp_mult': 1.9300022350953245, 'sideways_tsl_mult': 0.25065925785946563, 'sideways_time_stop': 124, 'sideways_use_sma': True, 'sideways_use_ema': True, 'sideways_use_atr': False, 'sideways_use_adx': False, 'sideways_use_spike': True, 'sideways_rsi_required': False}.
[I 2025-08-30 16:15:42,424] Trial 342 finished with values: [-0.04625645583643123, 0.046228371672675087] and parameters: {'p_sma': 8, 'p_std': 59, 'p_atr': 22, 'p_adx': 24, 'rsi_period': 7, 'ema1': 26, 'ema2': 23, 'slip_atr_k': 0.09534402259306886, 'slip_spread_k': 0.3522164330210721, 'spread_hl_frac': 0.01947448161402254, 'bb_std_mult': 3.1502164781719544, 'rsi_os': 6, 'rsi_ob': 69, 'vol_spike': 0.08630404616450406, 'adx_thresh': 12.041887502889466, 'atr_min_pct': 0.029093031196701202, 'atr_max_pct': 0.10185811829818392, 'tp_mult': 1.5138581083878278, 'tsl_mult': 0.6628571056558596, 'strategy': 'mean_reversion', 'time_stop': 137, 'use_sma': False, 'use_atr': True, 'use_adx': True, 'use_ema': False, 'use_spike': False, 'rsi_required': True, 'edge_k': 1.0047584046781148, 'edge_cap': 0.5678768871476297, 'bull_strategy': 'mean_reversion', 'bull_bb_std_mult': 2.503744415776286, 'bull_rsi_os': 28, 'bull_rsi_ob': 64, 'bull_adx_thresh': 20.37200915023517, 'bull_atr_min_pct': 0.020497946125844522, 'bull_atr_max_pct': 0.13107050814396085, 'bull_tp_mult': 2.0122547812994633, 'bull_tsl_mult': 0.3165934618319539, 'bull_time_stop': 81, 'bull_use_sma': False, 'bull_use_ema': True, 'bull_use_atr': True, 'bull_use_adx': True, 'bull_use_spike': False, 'bull_rsi_required': False, 'bear_strategy': 'mean_reversion', 'bear_bb_std_mult': 2.036737364652514, 'bear_rsi_os': 38, 'bear_rsi_ob': 76, 'bear_adx_thresh': 26.677008313641338, 'bear_atr_min_pct': 0.009976481156643693, 'bear_atr_max_pct': 0.08551980427266624, 'bear_tp_mult': 2.260604909199775, 'bear_tsl_mult': 0.6604549411510687, 'bear_time_stop': 235, 'bear_use_sma': True, 'bear_use_ema': False, 'bear_use_atr': False, 'bear_use_adx': False, 'bear_use_spike': False, 'bear_rsi_required': True, 'sideways_strategy': 'breakout', 'sideways_bb_std_mult': 1.0612079332644617, 'sideways_rsi_os': 27, 'sideways_rsi_ob': 92, 'sideways_adx_thresh': 24.36940652477801, 'sideways_atr_min_pct': 0.0006121237712889338, 'sideways_atr_max_pct': 0.14556716788045923, 'sideways_tp_mult': 1.2793820467154928, 'sideways_tsl_mult': 0.492189705859736, 'sideways_time_stop': 218, 'sideways_use_sma': True, 'sideways_use_ema': False, 'sideways_use_atr': True, 'sideways_use_adx': False, 'sideways_use_spike': False, 'sideways_rsi_required': True}.
[I 2025-08-30 16:15:42,720] Trial 343 finished with values: [-0.027649925065759806, 0.027594982175374455] and parameters: {'p_sma': 8, 'p_std': 58, 'p_atr': 27, 'p_adx': 24, 'rsi_period': 7, 'ema1': 26, 'ema2': 20, 'slip_atr_k': 0.0033904552997692534, 'slip_spread_k': 0.35530721963584144, 'spread_hl_frac': 0.013236387627076185, 'bb_std_mult': 3.162575180911955, 'rsi_os': 34, 'rsi_ob': 69, 'vol_spike': 0.04372747300280054, 'adx_thresh': 11.89302527048517, 'atr_min_pct': 0.02874592477297381, 'atr_max_pct': 0.10162887489266581, 'tp_mult': 1.5132349612195573, 'tsl_mult': 0.4673025619330111, 'strategy': 'mean_reversion', 'time_stop': 5, 'use_sma': False, 'use_atr': False, 'use_adx': True, 'use_ema': True, 'use_spike': False, 'rsi_required': True, 'edge_k': 1.45057415647086, 'edge_cap': 0.5628999059990344, 'bull_strategy': 'mean_reversion', 'bull_bb_std_mult': 1.906483612137091, 'bull_rsi_os': 14, 'bull_rsi_ob': 68, 'bull_adx_thresh': 19.73719561384881, 'bull_atr_min_pct': 0.02049910321818242, 'bull_atr_max_pct': 0.13132603354388284, 'bull_tp_mult': 2.2254137426776137, 'bull_tsl_mult': 0.2872608327996608, 'bull_time_stop': 72, 'bull_use_sma': False, 'bull_use_ema': True, 'bull_use_atr': True, 'bull_use_adx': True, 'bull_use_spike': True, 'bull_rsi_required': False, 'bear_strategy': 'breakout', 'bear_bb_std_mult': 0.796481371056609, 'bear_rsi_os': 38, 'bear_rsi_ob': 76, 'bear_adx_thresh': 12.267338328642511, 'bear_atr_min_pct': 0.009963294436883732, 'bear_atr_max_pct': 0.14955452071553615, 'bear_tp_mult': 2.2614883817318376, 'bear_tsl_mult': 0.6633327883407332, 'bear_time_stop': 143, 'bear_use_sma': True, 'bear_use_ema': True, 'bear_use_atr': False, 'bear_use_adx': False, 'bear_use_spike': False, 'bear_rsi_required': True, 'sideways_strategy': 'mean_reversion', 'sideways_bb_std_mult': 1.9898582561115354, 'sideways_rsi_os': 28, 'sideways_rsi_ob': 51, 'sideways_adx_thresh': 15.996727900909024, 'sideways_atr_min_pct': 0.0006001634206290567, 'sideways_atr_max_pct': 0.14433835381467944, 'sideways_tp_mult': 1.45777366864153, 'sideways_tsl_mult': 0.48930137842084126, 'sideways_time_stop': 63, 'sideways_use_sma': True, 'sideways_use_ema': True, 'sideways_use_atr': True, 'sideways_use_adx': False, 'sideways_use_spike': True, 'sideways_rsi_required': False}.
[I 2025-08-30 16:16:26,874] Trial 348 finished with values: [-1000000000.0, 1000000000.0] and parameters: {'p_sma': 6, 'p_std': 30, 'p_atr': 24, 'p_adx': 23, 'rsi_period': 67, 'ema1': 19, 'ema2': 14, 'slip_atr_k': 0.21347589316369714, 'slip_spread_k': 0.6038476877515176, 'spread_hl_frac': 0.03126263666861432, 'bb_std_mult': 1.0444105239580963, 'rsi_os': 27, 'rsi_ob': 74, 'vol_spike': 0.0055675073790004016, 'adx_thresh': 14.866546331864665, 'atr_min_pct': 0.018164268982365547, 'atr_max_pct': 0.11276949886626982, 'tp_mult': 2.213324177472293, 'tsl_mult': 0.42010247869148704, 'strategy': 'mean_reversion', 'time_stop': 30, 'use_sma': False, 'use_atr': True, 'use_adx': True, 'use_ema': False, 'use_spike': False, 'rsi_required': True, 'edge_k': 1.5384273360583756, 'edge_cap': 0.6246460702749075, 'bull_strategy': 'mean_reversion', 'bull_bb_std_mult': 1.7922513507750766, 'bull_rsi_os': 10, 'bull_rsi_ob': 48, 'bull_adx_thresh': 20.569954931849082, 'bull_atr_min_pct': 0.026342844949308733, 'bull_atr_max_pct': 0.13650903984876664, 'bull_tp_mult': 2.069706973201267, 'bull_tsl_mult': 0.32434435926493205, 'bull_time_stop': 62, 'bull_use_sma': False, 'bull_use_ema': False, 'bull_use_atr': True, 'bull_use_adx': True, 'bull_use_spike': False, 'bull_rsi_required': False, 'bear_strategy': 'mean_reversion', 'bear_bb_std_mult': 2.1727458780333837, 'bear_rsi_os': 15, 'bear_rsi_ob': 78, 'bear_adx_thresh': 13.534097978563995, 'bear_atr_min_pct': 0.0219960481125531, 'bear_atr_max_pct': 0.0965049843251611, 'bear_tp_mult': 2.2026085704226275, 'bear_tsl_mult': 0.9027281067593158, 'bear_time_stop': 48, 'bear_use_sma': True, 'bear_use_ema': False, 'bear_use_atr': False, 'bear_use_adx': False, 'bear_use_spike': False, 'bear_rsi_required': False, 'sideways_strategy': 'breakout', 'sideways_bb_std_mult': 1.9152290522314204, 'sideways_rsi_os': 47, 'sideways_rsi_ob': 93, 'sideways_adx_thresh': 17.31419202903928, 'sideways_atr_min_pct': 0.002607772634187705, 'sideways_atr_max_pct': 0.010097527519193392, 'sideways_tp_mult': 1.5018697936539394, 'sideways_tsl_mult': 0.4677583325659215, 'sideways_time_stop': 216, 'sideways_use_sma': False, 'sideways_use_ema': False, 'sideways_use_atr': False, 'sideways_use_adx': False, 'sideways_use_spike': False, 'sideways_rsi_required': True}.
[I 2025-08-30 16:16:27,673] Trial 346 finished with values: [-1000000000.0, 1000000000.0] and parameters: {'p_sma': 8, 'p_std': 31, 'p_atr': 7, 'p_adx': 23, 'rsi_period': 19, 'ema1': 25, 'ema2': 19, 'slip_atr_k': 0.04400216665243524, 'slip_spread_k': 0.5975438614077322, 'spread_hl_frac': 0.036584625227625796, 'bb_std_mult': 3.0954014846291376, 'rsi_os': 34, 'rsi_ob': 91, 'vol_spike': 0.01078526596128583, 'adx_thresh': 12.018351025575143, 'atr_min_pct': 0.013127596813085845, 'atr_max_pct': 0.13512769474587938, 'tp_mult': 2.9104234346696, 'tsl_mult': 0.7594931045070399, 'strategy': 'mean_reversion', 'time_stop': 134, 'use_sma': False, 'use_atr': True, 'use_adx': True, 'use_ema': False, 'use_spike': False, 'rsi_required': True, 'edge_k': 1.5450092189365976, 'edge_cap': 0.6982318512775567, 'bull_strategy': 'mean_reversion', 'bull_bb_std_mult': 1.7990535747450753, 'bull_rsi_os': 15, 'bull_rsi_ob': 50, 'bull_adx_thresh': 20.363548625653415, 'bull_atr_min_pct': 0.026402633066296692, 'bull_atr_max_pct': 0.13572680769004425, 'bull_tp_mult': 1.4356331868083023, 'bull_tsl_mult': 0.4895199863147107, 'bull_time_stop': 299, 'bull_use_sma': False, 'bull_use_ema': True, 'bull_use_atr': True, 'bull_use_adx': True, 'bull_use_spike': False, 'bull_rsi_required': False, 'bear_strategy': 'mean_reversion', 'bear_bb_std_mult': 3.0958078648679552, 'bear_rsi_os': 14, 'bear_rsi_ob': 78, 'bear_adx_thresh': 12.43689788731204, 'bear_atr_min_pct': 0.008532184071889144, 'bear_atr_max_pct': 0.09612953552888677, 'bear_tp_mult': 2.2607498355966116, 'bear_tsl_mult': 0.10972599453075033, 'bear_time_stop': 236, 'bear_use_sma': True, 'bear_use_ema': False, 'bear_use_atr': False, 'bear_use_adx': False, 'bear_use_spike': False, 'bear_rsi_required': False, 'sideways_strategy': 'breakout', 'sideways_bb_std_mult': 0.6293850481887135, 'sideways_rsi_os': 42, 'sideways_rsi_ob': 56, 'sideways_adx_thresh': 5.032356219453419, 'sideways_atr_min_pct': 0.018136929393188634, 'sideways_atr_max_pct': 0.04938676331601241, 'sideways_tp_mult': 1.2955165551783172, 'sideways_tsl_mult': 0.32957743916801396, 'sideways_time_stop': 219, 'sideways_use_sma': False, 'sideways_use_ema': False, 'sideways_use_atr': False, 'sideways_use_adx': False, 'sideways_use_spike': False, 'sideways_rsi_required': False}.
[I 2025-08-30 16:16:28,279] Trial 347 finished with values: [-1000000000.0, 1000000000.0] and parameters: {'p_sma': 36, 'p_std': 56, 'p_atr': 27, 'p_adx': 23, 'rsi_period': 23, 'ema1': 25, 'ema2': 11, 'slip_atr_k': 0.043403899363774895, 'slip_spread_k': 0.3966662483961825, 'spread_hl_frac': 0.012728883660702418, 'bb_std_mult': 3.0609955224694434, 'rsi_os': 33, 'rsi_ob': 92, 'vol_spike': 0.011944387982852446, 'adx_thresh': 15.088176758941968, 'atr_min_pct': 0.013172303096773728, 'atr_max_pct': 0.1124980717618502, 'tp_mult': 2.9218315613375503, 'tsl_mult': 0.4866387619516451, 'strategy': 'mean_reversion', 'time_stop': 10, 'use_sma': False, 'use_atr': False, 'use_adx': True, 'use_ema': True, 'use_spike': False, 'rsi_required': True, 'edge_k': 1.5367864210776967, 'edge_cap': 0.6240026461687186, 'bull_strategy': 'mean_reversion', 'bull_bb_std_mult': 3.2186764584722916, 'bull_rsi_os': 41, 'bull_rsi_ob': 68, 'bull_adx_thresh': 22.45056392707808, 'bull_atr_min_pct': 0.021553398333187073, 'bull_atr_max_pct': 0.13569812654662475, 'bull_tp_mult': 2.0866752570040075, 'bull_tsl_mult': 0.46495637926879096, 'bull_time_stop': 299, 'bull_use_sma': False, 'bull_use_ema': False, 'bull_use_atr': True, 'bull_use_adx': True, 'bull_use_spike': True, 'bull_rsi_required': False, 'bear_strategy': 'breakout', 'bear_bb_std_mult': 3.0882364115865246, 'bear_rsi_os': 15, 'bear_rsi_ob': 78, 'bear_adx_thresh': 14.718058261208459, 'bear_atr_min_pct': 0.01905882563105459, 'bear_atr_max_pct': 0.09597787507065708, 'bear_tp_mult': 1.9920287711738422, 'bear_tsl_mult': 0.6171715001145875, 'bear_time_stop': 232, 'bear_use_sma': True, 'bear_use_ema': True, 'bear_use_atr': False, 'bear_use_adx': False, 'bear_use_spike': False, 'bear_rsi_required': False, 'sideways_strategy': 'mean_reversion', 'sideways_bb_std_mult': 1.9196254672611424, 'sideways_rsi_os': 28, 'sideways_rsi_ob': 56, 'sideways_adx_thresh': 17.44446684950418, 'sideways_atr_min_pct': 0.0026327217011967215, 'sideways_atr_max_pct': 0.05067157854132524, 'sideways_tp_mult': 1.3126974428809328, 'sideways_tsl_mult': 0.46531176939326874, 'sideways_time_stop': 284, 'sideways_use_sma': False, 'sideways_use_ema': True, 'sideways_use_atr': False, 'sideways_use_adx': False, 'sideways_use_spike': True, 'sideways_rsi_required': False}.
[I 2025-08-30 16:16:28,953] Trial 345 finished with values: [-1000000000.0, 1000000000.0] and parameters: {'p_sma': 57, 'p_std': 58, 'p_atr': 27, 'p_adx': 23, 'rsi_period': 12, 'ema1': 26, 'ema2': 47, 'slip_atr_k': 0.04328600020804593, 'slip_spread_k': 0.6678324984697379, 'spread_hl_frac': 0.019719141337320865, 'bb_std_mult': 1.1335752392656961, 'rsi_os': 10, 'rsi_ob': 69, 'vol_spike': 0.07894192360966433, 'adx_thresh': 12.167047221560514, 'atr_min_pct': 0.018224078806054894, 'atr_max_pct': 0.10224018158914258, 'tp_mult': 2.8259607161876943, 'tsl_mult': 0.48141443839196224, 'strategy': 'mean_reversion', 'time_stop': 9, 'use_sma': False, 'use_atr': False, 'use_adx': True, 'use_ema': True, 'use_spike': False, 'rsi_required': True, 'edge_k': 1.5514492295840336, 'edge_cap': 0.5974497942874789, 'bull_strategy': 'mean_reversion', 'bull_bb_std_mult': 2.0298024014285474, 'bull_rsi_os': 28, 'bull_rsi_ob': 52, 'bull_adx_thresh': 20.35261505404045, 'bull_atr_min_pct': 0.020339166231866223, 'bull_atr_max_pct': 0.1404459591182864, 'bull_tp_mult': 2.085993463733242, 'bull_tsl_mult': 0.00042776972258018464, 'bull_time_stop': 71, 'bull_use_sma': False, 'bull_use_ema': False, 'bull_use_atr': True, 'bull_use_adx': True, 'bull_use_spike': True, 'bull_rsi_required': False, 'bear_strategy': 'breakout', 'bear_bb_std_mult': 2.018146456933854, 'bear_rsi_os': 15, 'bear_rsi_ob': 77, 'bear_adx_thresh': 12.393014527905548, 'bear_atr_min_pct': 0.019845350946565424, 'bear_atr_max_pct': 0.08484897573460311, 'bear_tp_mult': 2.2664559561732, 'bear_tsl_mult': 0.6382523413710366, 'bear_time_stop': 53, 'bear_use_sma': True, 'bear_use_ema': True, 'bear_use_atr': False, 'bear_use_adx': False, 'bear_use_spike': False, 'bear_rsi_required': False, 'sideways_strategy': 'mean_reversion', 'sideways_bb_std_mult': 1.996707218248482, 'sideways_rsi_os': 47, 'sideways_rsi_ob': 76, 'sideways_adx_thresh': 17.32520178743466, 'sideways_atr_min_pct': 9.328354513385298e-06, 'sideways_atr_max_pct': 0.032087962634975306, 'sideways_tp_mult': 1.2815413115858, 'sideways_tsl_mult': 0.48141473392338874, 'sideways_time_stop': 145, 'sideways_use_sma': True, 'sideways_use_ema': True, 'sideways_use_atr': False, 'sideways_use_adx': False, 'sideways_use_spike': True, 'sideways_rsi_required': False}.
[I 2025-08-30 16:17:12,153] Trial 352 finished with values: [-1000000000.0, 1000000000.0] and parameters: {'p_sma': 11, 'p_std': 54, 'p_atr': 23, 'p_adx': 21, 'rsi_period': 80, 'ema1': 27, 'ema2': 40, 'slip_atr_k': 0.15505599507908813, 'slip_spread_k': 0.5307676637121587, 'spread_hl_frac': 0.018026161403498324, 'bb_std_mult': 3.4585595675393144, 'rsi_os': 36, 'rsi_ob': 92, 'vol_spike': 0.0001931955195568258, 'adx_thresh': 12.787360657170993, 'atr_min_pct': 0.026168350677555872, 'atr_max_pct': 0.03495640505071106, 'tp_mult': 2.158879602751373, 'tsl_mult': 0.4412528463069437, 'strategy': 'mean_reversion', 'time_stop': 108, 'use_sma': True, 'use_atr': True, 'use_adx': True, 'use_ema': False, 'use_spike': False, 'rsi_required': True, 'edge_k': 1.2219456834393454, 'edge_cap': 0.6621305989873624, 'bull_strategy': 'mean_reversion', 'bull_bb_std_mult': 1.872177565189923, 'bull_rsi_os': 38, 'bull_rsi_ob': 54, 'bull_adx_thresh': 21.658926168891266, 'bull_atr_min_pct': 0.019134964139185858, 'bull_atr_max_pct': 0.08616866140449231, 'bull_tp_mult': 1.3638895295508993, 'bull_tsl_mult': 0.28801095141708893, 'bull_time_stop': 58, 'bull_use_sma': False, 'bull_use_ema': True, 'bull_use_atr': True, 'bull_use_adx': True, 'bull_use_spike': False, 'bull_rsi_required': False, 'bear_strategy': 'mean_reversion', 'bear_bb_std_mult': 3.374036371834589, 'bear_rsi_os': 13, 'bear_rsi_ob': 57, 'bear_adx_thresh': 5.003705697427938, 'bear_atr_min_pct': 0.024028149801931242, 'bear_atr_max_pct': 0.09263206530218376, 'bear_tp_mult': 2.573829901073623, 'bear_tsl_mult': 0.687362838042684, 'bear_time_stop': 185, 'bear_use_sma': True, 'bear_use_ema': False, 'bear_use_atr': False, 'bear_use_adx': True, 'bear_use_spike': False, 'bear_rsi_required': False, 'sideways_strategy': 'breakout', 'sideways_bb_std_mult': 2.046397201751566, 'sideways_rsi_os': 25, 'sideways_rsi_ob': 73, 'sideways_adx_thresh': 29.3149543070289, 'sideways_atr_min_pct': 0.0017732548763016581, 'sideways_atr_max_pct': 0.14174801646919108, 'sideways_tp_mult': 1.382289676220214, 'sideways_tsl_mult': 0.5555944221424226, 'sideways_time_stop': 264, 'sideways_use_sma': True, 'sideways_use_ema': False, 'sideways_use_atr': False, 'sideways_use_adx': False, 'sideways_use_spike': False, 'sideways_rsi_required': True}.
[I 2025-08-30 16:17:12,500] Trial 351 finished with values: [-1000000000.0, 1000000000.0] and parameters: {'p_sma': 11, 'p_std': 54, 'p_atr': 23, 'p_adx': 25, 'rsi_period': 47, 'ema1': 28, 'ema2': 12, 'slip_atr_k': 0.007032086471130684, 'slip_spread_k': 0.5354052458640637, 'spread_hl_frac': 0.034037763452937894, 'bb_std_mult': 1.5792259235486972, 'rsi_os': 36, 'rsi_ob': 88, 'vol_spike': 0.21614730544293276, 'adx_thresh': 13.69781610030647, 'atr_min_pct': 0.020120372299759912, 'atr_max_pct': 0.13018533529246112, 'tp_mult': 2.066635253476065, 'tsl_mult': 0.4477693243498865, 'strategy': 'mean_reversion', 'time_stop': 12, 'use_sma': True, 'use_atr': True, 'use_adx': True, 'use_ema': False, 'use_spike': False, 'rsi_required': True, 'edge_k': 1.5993963559546935, 'edge_cap': 0.5995503971685223, 'bull_strategy': 'mean_reversion', 'bull_bb_std_mult': 1.9939906445750246, 'bull_rsi_os': 38, 'bull_rsi_ob': 56, 'bull_adx_thresh': 14.179964986632687, 'bull_atr_min_pct': 0.01658531049368975, 'bull_atr_max_pct': 0.13967831095840946, 'bull_tp_mult': 1.3951528292334172, 'bull_tsl_mult': 0.8166921502721709, 'bull_time_stop': 53, 'bull_use_sma': False, 'bull_use_ema': True, 'bull_use_atr': True, 'bull_use_adx': True, 'bull_use_spike': False, 'bull_rsi_required': False, 'bear_strategy': 'mean_reversion', 'bear_bb_std_mult': 1.919864267420667, 'bear_rsi_os': 13, 'bear_rsi_ob': 53, 'bear_adx_thresh': 13.097021233739518, 'bear_atr_min_pct': 0.02154583149170246, 'bear_atr_max_pct': 0.09271149416596602, 'bear_tp_mult': 1.7926033297656607, 'bear_tsl_mult': 0.8652531948779816, 'bear_time_stop': 183, 'bear_use_sma': True, 'bear_use_ema': False, 'bear_use_atr': False, 'bear_use_adx': True, 'bear_use_spike': False, 'bear_rsi_required': False, 'sideways_strategy': 'breakout', 'sideways_bb_std_mult': 2.0483431861930397, 'sideways_rsi_os': 38, 'sideways_rsi_ob': 75, 'sideways_adx_thresh': 29.19980977658767, 'sideways_atr_min_pct': 0.002010055403475839, 'sideways_atr_max_pct': 0.14176439631734927, 'sideways_tp_mult': 1.3904000946293635, 'sideways_tsl_mult': 0.22401743065018082, 'sideways_time_stop': 202, 'sideways_use_sma': True, 'sideways_use_ema': False, 'sideways_use_atr': False, 'sideways_use_adx': False, 'sideways_use_spike': False, 'sideways_rsi_required': True}.
