[I 2025-08-30 17:30:15,927] Trial 781 finished with values: [-1000000000.0, 1000000000.0] and parameters: {'p_sma': 35, 'p_std': 23, 'p_atr': 16, 'p_adx': 19, 'rsi_period': 7, 'ema1': 20, 'ema2': 10, 'slip_atr_k': 8.339851895657752e-06, 'slip_spread_k': 0.1538145237719475, 'spread_hl_frac': 0.03299454969014547, 'bb_std_mult': 0.7431985761876008, 'rsi_os': 55, 'rsi_ob': 46, 'vol_spike': 0.10900288007868966, 'adx_thresh': 10.601189344871655, 'atr_min_pct': 0.0010815210412308002, 'atr_max_pct': 0.14549745926222296, 'tp_mult': 2.8330328983346544, 'tsl_mult': 0.17519446072165745, 'strategy': 'breakout', 'time_stop': 247, 'use_sma': True, 'use_atr': False, 'use_adx': False, 'use_ema': False, 'use_spike': True, 'rsi_required': False, 'edge_k': 0.425414363539389, 'edge_cap': 0.5082452072345216, 'bull_strategy': 'mean_reversion', 'bull_bb_std_mult': 0.8168980952997942, 'bull_rsi_os': 34, 'bull_rsi_ob': 54, 'bull_adx_thresh': 34.374080911613035, 'bull_atr_min_pct': 0.022205055013414812, 'bull_atr_max_pct': 0.04145683915827656, 'bull_tp_mult': 1.8355104525810055, 'bull_tsl_mult': 0.18787545474825013, 'bull_time_stop': 63, 'bull_use_sma': True, 'bull_use_ema': True, 'bull_use_atr': False, 'bull_use_adx': False, 'bull_use_spike': False, 'bull_rsi_required': False, 'bear_strategy': 'mean_reversion', 'bear_bb_std_mult': 1.1849163528039395, 'bear_rsi_os': 15, 'bear_rsi_ob': 77, 'bear_adx_thresh': 20.39961833770348, 'bear_atr_min_pct': 0.02145232560578062, 'bear_atr_max_pct': 0.02395650248084067, 'bear_tp_mult': 2.2534171672491197, 'bear_tsl_mult': 0.611896300137302, 'bear_time_stop': 202, 'bear_use_sma': True, 'bear_use_ema': False, 'bear_use_atr': True, 'bear_use_adx': True, 'bear_use_spike': True, 'bear_rsi_required': True, 'sideways_strategy': 'breakout', 'sideways_bb_std_mult': 1.010458707442102, 'sideways_rsi_os': 7, 'sideways_rsi_ob': 75, 'sideways_adx_thresh': 10.292115327767313, 'sideways_atr_min_pct': 0.017778306865079432, 'sideways_atr_max_pct': 0.11824132379932475, 'sideways_tp_mult': 2.9163423439809795, 'sideways_tsl_mult': 0.4944445811347684, 'sideways_time_stop': 271, 'sideways_use_sma': True, 'sideways_use_ema': True, 'sideways_use_atr': False, 'sideways_use_adx': True, 'sideways_use_spike': False, 'sideways_rsi_required': True}.
[I 2025-08-30 17:30:16,828] Trial 782 finished with values: [-1000000000.0, 1000000000.0] and parameters: {'p_sma': 7, 'p_std': 23, 'p_atr': 16, 'p_adx': 9, 'rsi_period': 60, 'ema1': 20, 'ema2': 10, 'slip_atr_k': 0.014690530987709028, 'slip_spread_k': 0.20980713456247585, 'spread_hl_frac': 0.016760897399635582, 'bb_std_mult': 2.942553771594715, 'rsi_os': 32, 'rsi_ob': 84, 'vol_spike': 0.09030130593380821, 'adx_thresh': 9.474285071310224, 'atr_min_pct': 0.01958259852289998, 'atr_max_pct': 0.1170877589404206, 'tp_mult': 2.8229712431936833, 'tsl_mult': 0.977803673774977, 'strategy': 'breakout', 'time_stop': 28, 'use_sma': False, 'use_atr': True, 'use_adx': True, 'use_ema': False, 'use_spike': True, 'rsi_required': False, 'edge_k': 0.7213228178993534, 'edge_cap': 0.8937745143506772, 'bull_strategy': 'mean_reversion', 'bull_bb_std_mult': 0.8282783092073149, 'bull_rsi_os': 38, 'bull_rsi_ob': 54, 'bull_adx_thresh': 32.01909072409152, 'bull_atr_min_pct': 0.02513172286417072, 'bull_atr_max_pct': 0.041364432181191776, 'bull_tp_mult': 2.26851485969626, 'bull_tsl_mult': 0.8656513398216261, 'bull_time_stop': 163, 'bull_use_sma': True, 'bull_use_ema': True, 'bull_use_atr': False, 'bull_use_adx': True, 'bull_use_spike': False, 'bull_rsi_required': False, 'bear_strategy': 'mean_reversion', 'bear_bb_std_mult': 1.2102587153180808, 'bear_rsi_os': 17, 'bear_rsi_ob': 90, 'bear_adx_thresh': 19.722618165437503, 'bear_atr_min_pct': 0.02329604005433387, 'bear_atr_max_pct': 0.10296320965699098, 'bear_tp_mult': 2.3870534700113533, 'bear_tsl_mult': 0.3047158752561977, 'bear_time_stop': 253, 'bear_use_sma': True, 'bear_use_ema': False, 'bear_use_atr': True, 'bear_use_adx': False, 'bear_use_spike': False, 'bear_rsi_required': False, 'sideways_strategy': 'breakout', 'sideways_bb_std_mult': 0.583579359159864, 'sideways_rsi_os': 33, 'sideways_rsi_ob': 94, 'sideways_adx_thresh': 26.485216919319427, 'sideways_atr_min_pct': 0.0020419036004440446, 'sideways_atr_max_pct': 0.09534922516865481, 'sideways_tp_mult': 2.916897366251637, 'sideways_tsl_mult': 0.4611713652417919, 'sideways_time_stop': 277, 'sideways_use_sma': True, 'sideways_use_ema': True, 'sideways_use_atr': False, 'sideways_use_adx': False, 'sideways_use_spike': True, 'sideways_rsi_required': True}.
[I 2025-08-30 17:30:19,377] Trial 785 finished with values: [-0.030284762708779445, 0.03022294310383938] and parameters: {'p_sma': 31, 'p_std': 23, 'p_atr': 10, 'p_adx': 19, 'rsi_period': 21, 'ema1': 18, 'ema2': 47, 'slip_atr_k': 0.011107166886870612, 'slip_spread_k': 0.4958842519637737, 'spread_hl_frac': 0.017562314564054715, 'bb_std_mult': 2.9541946075072723, 'rsi_os': 30, 'rsi_ob': 81, 'vol_spike': 0.1775773066460818, 'adx_thresh': 9.154477591776793, 'atr_min_pct': 0.02559689552650978, 'atr_max_pct': 0.1447338658283026, 'tp_mult': 2.7749765131831237, 'tsl_mult': 0.9726996377595238, 'strategy': 'breakout', 'time_stop': 51, 'use_sma': False, 'use_atr': True, 'use_adx': True, 'use_ema': False, 'use_spike': False, 'rsi_required': False, 'edge_k': 0.43493314711799724, 'edge_cap': 0.7984335134364837, 'bull_strategy': 'mean_reversion', 'bull_bb_std_mult': 0.8140082026100068, 'bull_rsi_os': 12, 'bull_rsi_ob': 56, 'bull_adx_thresh': 25.826214307523898, 'bull_atr_min_pct': 0.023999698697147978, 'bull_atr_max_pct': 0.02565956945570061, 'bull_tp_mult': 1.8455113842400155, 'bull_tsl_mult': 0.5887266970468983, 'bull_time_stop': 10, 'bull_use_sma': True, 'bull_use_ema': True, 'bull_use_atr': False, 'bull_use_adx': True, 'bull_use_spike': False, 'bull_rsi_required': False, 'bear_strategy': 'mean_reversion', 'bear_bb_std_mult': 1.242844796548031, 'bear_rsi_os': 33, 'bear_rsi_ob': 53, 'bear_adx_thresh': 11.737639424576818, 'bear_atr_min_pct': 0.0235748461146277, 'bear_atr_max_pct': 0.13732256694984507, 'bear_tp_mult': 1.5690949333984014, 'bear_tsl_mult': 0.9187514425892193, 'bear_time_stop': 213, 'bear_use_sma': True, 'bear_use_ema': False, 'bear_use_atr': False, 'bear_use_adx': False, 'bear_use_spike': False, 'bear_rsi_required': False, 'sideways_strategy': 'breakout', 'sideways_bb_std_mult': 0.7014018545215108, 'sideways_rsi_os': 32, 'sideways_rsi_ob': 73, 'sideways_adx_thresh': 26.62352415736436, 'sideways_atr_min_pct': 0.002160414961260455, 'sideways_atr_max_pct': 0.10100231784419561, 'sideways_tp_mult': 2.9052320874484163, 'sideways_tsl_mult': 0.14430310380405298, 'sideways_time_stop': 278, 'sideways_use_sma': True, 'sideways_use_ema': False, 'sideways_use_atr': False, 'sideways_use_adx': False, 'sideways_use_spike': False, 'sideways_rsi_required': True}.
[I 2025-08-30 17:31:00,465] Trial 789 finished with values: [-1000000000.0, 1000000000.0] and parameters: {'p_sma': 43, 'p_std': 21, 'p_atr': 17, 'p_adx': 11, 'rsi_period': 22, 'ema1': 18, 'ema2': 12, 'slip_atr_k': 0.20268361835468102, 'slip_spread_k': 0.16299394774497608, 'spread_hl_frac': 0.005576838048332339, 'bb_std_mult': 0.9327867326007158, 'rsi_os': 5, 'rsi_ob': 60, 'vol_spike': 0.09500044408791876, 'adx_thresh': 24.47490932586592, 'atr_min_pct': 0.02998553575499121, 'atr_max_pct': 0.1497651221074468, 'tp_mult': 2.5975405276263026, 'tsl_mult': 0.8803268561938699, 'strategy': 'mean_reversion', 'time_stop': 97, 'use_sma': False, 'use_atr': True, 'use_adx': True, 'use_ema': False, 'use_spike': False, 'rsi_required': True, 'edge_k': 0.6302902691564367, 'edge_cap': 0.9307374506159729, 'bull_strategy': 'breakout', 'bull_bb_std_mult': 2.5515361826922547, 'bull_rsi_os': 18, 'bull_rsi_ob': 68, 'bull_adx_thresh': 34.46619554388627, 'bull_atr_min_pct': 0.023195791499664182, 'bull_atr_max_pct': 0.1477016598205588, 'bull_tp_mult': 2.304224497181223, 'bull_tsl_mult': 0.48062331509815903, 'bull_time_stop': 205, 'bull_use_sma': True, 'bull_use_ema': True, 'bull_use_atr': False, 'bull_use_adx': True, 'bull_use_spike': False, 'bull_rsi_required': False, 'bear_strategy': 'mean_reversion', 'bear_bb_std_mult': 0.9482015470246117, 'bear_rsi_os': 13, 'bear_rsi_ob': 92, 'bear_adx_thresh': 12.934902735894337, 'bear_atr_min_pct': 0.02429742016547274, 'bear_atr_max_pct': 0.1129825080969336, 'bear_tp_mult': 2.2050249533372432, 'bear_tsl_mult': 0.5990916695460987, 'bear_time_stop': 70, 'bear_use_sma': True, 'bear_use_ema': False, 'bear_use_atr': False, 'bear_use_adx': False, 'bear_use_spike': False, 'bear_rsi_required': False, 'sideways_strategy': 'mean_reversion', 'sideways_bb_std_mult': 0.6876545535211098, 'sideways_rsi_os': 30, 'sideways_rsi_ob': 91, 'sideways_adx_thresh': 11.288945143435436, 'sideways_atr_min_pct': 0.01161783700011012, 'sideways_atr_max_pct': 0.05238900392395143, 'sideways_tp_mult': 1.022464045197828, 'sideways_tsl_mult': 0.48024452920722704, 'sideways_time_stop': 285, 'sideways_use_sma': False, 'sideways_use_ema': False, 'sideways_use_atr': False, 'sideways_use_adx': False, 'sideways_use_spike': False, 'sideways_rsi_required': True}.
[I 2025-08-30 17:31:01,168] Trial 788 finished with values: [-1000000000.0, 1000000000.0] and parameters: {'p_sma': 9, 'p_std': 21, 'p_atr': 20, 'p_adx': 11, 'rsi_period': 22, 'ema1': 18, 'ema2': 12, 'slip_atr_k': 0.010079810383468347, 'slip_spread_k': 0.4882914595038364, 'spread_hl_frac': 0.0199978709494109, 'bb_std_mult': 2.751014666335255, 'rsi_os': 35, 'rsi_ob': 60, 'vol_spike': 0.09467496944425709, 'adx_thresh': 12.00407785412975, 'atr_min_pct': 0.01933514519980993, 'atr_max_pct': 0.14811863042275494, 'tp_mult': 2.9090288749858595, 'tsl_mult': 0.9422462479972654, 'strategy': 'mean_reversion', 'time_stop': 40, 'use_sma': False, 'use_atr': True, 'use_adx': True, 'use_ema': False, 'use_spike': False, 'rsi_required': True, 'edge_k': 0.6478979987008561, 'edge_cap': 0.7897577896804695, 'bull_strategy': 'mean_reversion', 'bull_bb_std_mult': 1.8758206641802295, 'bull_rsi_os': 14, 'bull_rsi_ob': 56, 'bull_adx_thresh': 34.026755177216224, 'bull_atr_min_pct': 0.023051244850415927, 'bull_atr_max_pct': 0.07819237244960357, 'bull_tp_mult': 2.3178893731955212, 'bull_tsl_mult': 0.8143999607706223, 'bull_time_stop': 219, 'bull_use_sma': True, 'bull_use_ema': True, 'bull_use_atr': False, 'bull_use_adx': True, 'bull_use_spike': False, 'bull_rsi_required': False, 'bear_strategy': 'mean_reversion', 'bear_bb_std_mult': 2.5566258516393567, 'bear_rsi_os': 23, 'bear_rsi_ob': 75, 'bear_adx_thresh': 18.244222000859526, 'bear_atr_min_pct': 0.024377051783669477, 'bear_atr_max_pct': 0.11407071417518827, 'bear_tp_mult': 1.5619388426130247, 'bear_tsl_mult': 0.164744169946758, 'bear_time_stop': 217, 'bear_use_sma': True, 'bear_use_ema': False, 'bear_use_atr': False, 'bear_use_adx': False, 'bear_use_spike': False, 'bear_rsi_required': False, 'sideways_strategy': 'mean_reversion', 'sideways_bb_std_mult': 0.69812462006556, 'sideways_rsi_os': 18, 'sideways_rsi_ob': 73, 'sideways_adx_thresh': 29.337245273157883, 'sideways_atr_min_pct': 0.0014057506048859838, 'sideways_atr_max_pct': 0.1014311763926484, 'sideways_tp_mult': 2.859042887801744, 'sideways_tsl_mult': 0.1783503393030051, 'sideways_time_stop': 287, 'sideways_use_sma': False, 'sideways_use_ema': False, 'sideways_use_atr': False, 'sideways_use_adx': False, 'sideways_use_spike': False, 'sideways_rsi_required': True}.
[I 2025-08-30 17:31:02,331] Trial 786 finished with values: [-1000000000.0, 1000000000.0] and parameters: {'p_sma': 46, 'p_std': 21, 'p_atr': 17, 'p_adx': 19, 'rsi_period': 22, 'ema1': 18, 'ema2': 25, 'slip_atr_k': 0.1194150861380135, 'slip_spread_k': 0.14719562664135957, 'spread_hl_frac': 0.04383722657306224, 'bb_std_mult': 2.9448677510597756, 'rsi_os': 35, 'rsi_ob': 85, 'vol_spike': 0.1198217355472667, 'adx_thresh': 16.64059453134158, 'atr_min_pct': 0.01934885921641314, 'atr_max_pct': 0.119669378816341, 'tp_mult': 2.807627945008447, 'tsl_mult': 0.9628112102093803, 'strategy': 'mean_reversion', 'time_stop': 248, 'use_sma': False, 'use_atr': True, 'use_adx': True, 'use_ema': False, 'use_spike': False, 'rsi_required': True, 'edge_k': 0.641266762325277, 'edge_cap': 0.05326803711648237, 'bull_strategy': 'mean_reversion', 'bull_bb_std_mult': 0.8459751991757103, 'bull_rsi_os': 14, 'bull_rsi_ob': 73, 'bull_adx_thresh': 34.98871429012697, 'bull_atr_min_pct': 0.023401401094260598, 'bull_atr_max_pct': 0.025411275840565413, 'bull_tp_mult': 2.315718460083297, 'bull_tsl_mult': 0.8173339388794559, 'bull_time_stop': 58, 'bull_use_sma': True, 'bull_use_ema': True, 'bull_use_atr': False, 'bull_use_adx': True, 'bull_use_spike': False, 'bull_rsi_required': False, 'bear_strategy': 'mean_reversion', 'bear_bb_std_mult': 0.9683302947156689, 'bear_rsi_os': 17, 'bear_rsi_ob': 78, 'bear_adx_thresh': 16.23999545792979, 'bear_atr_min_pct': 0.021818343933424793, 'bear_atr_max_pct': 0.13147577130037877, 'bear_tp_mult': 2.3096938063006607, 'bear_tsl_mult': 0.47439740529091384, 'bear_time_stop': 212, 'bear_use_sma': True, 'bear_use_ema': False, 'bear_use_atr': False, 'bear_use_adx': False, 'bear_use_spike': False, 'bear_rsi_required': False, 'sideways_strategy': 'breakout', 'sideways_bb_std_mult': 1.0371260106184266, 'sideways_rsi_os': 16, 'sideways_rsi_ob': 94, 'sideways_adx_thresh': 26.63620124509919, 'sideways_atr_min_pct': 0.007761384709139453, 'sideways_atr_max_pct': 0.10056831053478804, 'sideways_tp_mult': 2.580089592364591, 'sideways_tsl_mult': 0.6947012070688894, 'sideways_time_stop': 286, 'sideways_use_sma': True, 'sideways_use_ema': False, 'sideways_use_atr': False, 'sideways_use_adx': False, 'sideways_use_spike': False, 'sideways_rsi_required': True}.
[I 2025-08-30 17:31:04,113] Trial 787 finished with values: [-0.06993256064920317, 0.06985993524274695] and parameters: {'p_sma': 30, 'p_std': 21, 'p_atr': 17, 'p_adx': 10, 'rsi_period': 22, 'ema1': 18, 'ema2': 26, 'slip_atr_k': 0.15022856728476983, 'slip_spread_k': 0.33388434992765537, 'spread_hl_frac': 0.04464584125667208, 'bb_std_mult': 3.1351289639042497, 'rsi_os': 35, 'rsi_ob': 86, 'vol_spike': 0.09436813398884057, 'adx_thresh': 24.551598654668343, 'atr_min_pct': 0.01940049508340641, 'atr_max_pct': 0.14986042183697437, 'tp_mult': 2.305639691544879, 'tsl_mult': 0.9780603566364658, 'strategy': 'mean_reversion', 'time_stop': 96, 'use_sma': False, 'use_atr': True, 'use_adx': True, 'use_ema': False, 'use_spike': False, 'rsi_required': True, 'edge_k': 0.634486097121906, 'edge_cap': 0.45392773348214477, 'bull_strategy': 'mean_reversion', 'bull_bb_std_mult': 2.058787117809047, 'bull_rsi_os': 14, 'bull_rsi_ob': 94, 'bull_adx_thresh': 33.95733917263904, 'bull_atr_min_pct': 0.005596505857143132, 'bull_atr_max_pct': 0.025521890505378488, 'bull_tp_mult': 2.324674688211938, 'bull_tsl_mult': 0.597639059549771, 'bull_time_stop': 11, 'bull_use_sma': True, 'bull_use_ema': True, 'bull_use_atr': False, 'bull_use_adx': True, 'bull_use_spike': False, 'bull_rsi_required': False, 'bear_strategy': 'mean_reversion', 'bear_bb_std_mult': 2.3831202080600504, 'bear_rsi_os': 17, 'bear_rsi_ob': 75, 'bear_adx_thresh': 12.881087406532282, 'bear_atr_min_pct': 0.024342823587264275, 'bear_atr_max_pct': 0.13128611798212303, 'bear_tp_mult': 1.628595844431509, 'bear_tsl_mult': 0.59802477641691, 'bear_time_stop': 212, 'bear_use_sma': True, 'bear_use_ema': False, 'bear_use_atr': False, 'bear_use_adx': False, 'bear_use_spike': False, 'bear_rsi_required': False, 'sideways_strategy': 'mean_reversion', 'sideways_bb_std_mult': 0.7158573655901828, 'sideways_rsi_os': 16, 'sideways_rsi_ob': 73, 'sideways_adx_thresh': 11.287024907397857, 'sideways_atr_min_pct': 0.0004803548298094795, 'sideways_atr_max_pct': 0.1013126706998461, 'sideways_tp_mult': 2.8492636653428827, 'sideways_tsl_mult': 0.04020879782226622, 'sideways_time_stop': 287, 'sideways_use_sma': False, 'sideways_use_ema': False, 'sideways_use_atr': False, 'sideways_use_adx': False, 'sideways_use_spike': False, 'sideways_rsi_required': True}.
[I 2025-08-30 17:31:05,592] Trial 791 finished with values: [-1000000000.0, 1000000000.0] and parameters: {'p_sma': 7, 'p_std': 15, 'p_atr': 17, 'p_adx': 10, 'rsi_period': 19, 'ema1': 8, 'ema2': 11, 'slip_atr_k': 0.118978566818151, 'slip_spread_k': 0.24603971313226625, 'spread_hl_frac': 0.021201993982217428, 'bb_std_mult': 3.1264104635473897, 'rsi_os': 53, 'rsi_ob': 85, 'vol_spike': 0.08586071425462957, 'adx_thresh': 16.436751786219602, 'atr_min_pct': 0.007817683480485853, 'atr_max_pct': 0.14388280341184928, 'tp_mult': 2.742001825153855, 'tsl_mult': 0.7257239131931701, 'strategy': 'mean_reversion', 'time_stop': 21, 'use_sma': False, 'use_atr': True, 'use_adx': True, 'use_ema': True, 'use_spike': False, 'rsi_required': True, 'edge_k': 0.5086729797980006, 'edge_cap': 0.8190855829538439, 'bull_strategy': 'mean_reversion', 'bull_bb_std_mult': 3.462629790847971, 'bull_rsi_os': 27, 'bull_rsi_ob': 51, 'bull_adx_thresh': 17.770804246455373, 'bull_atr_min_pct': 0.02925906463157904, 'bull_atr_max_pct': 0.1346316091178103, 'bull_tp_mult': 2.3693792950068033, 'bull_tsl_mult': 0.7650753535714384, 'bull_time_stop': 17, 'bull_use_sma': True, 'bull_use_ema': False, 'bull_use_atr': False, 'bull_use_adx': True, 'bull_use_spike': True, 'bull_rsi_required': True, 'bear_strategy': 'breakout', 'bear_bb_std_mult': 2.3642425760478174, 'bear_rsi_os': 27, 'bear_rsi_ob': 77, 'bear_adx_thresh': 10.845875648812813, 'bear_atr_min_pct': 0.0007417059309192085, 'bear_atr_max_pct': 0.07672420550529857, 'bear_tp_mult': 1.6299054958223498, 'bear_tsl_mult': 0.4694905289883062, 'bear_time_stop': 208, 'bear_use_sma': True, 'bear_use_ema': True, 'bear_use_atr': False, 'bear_use_adx': False, 'bear_use_spike': False, 'bear_rsi_required': False, 'sideways_strategy': 'breakout', 'sideways_bb_std_mult': 2.8342676966721854, 'sideways_rsi_os': 55, 'sideways_rsi_ob': 89, 'sideways_adx_thresh': 5.876872137400181, 'sideways_atr_min_pct': 0.0004923925022521664, 'sideways_atr_max_pct': 0.07915006213157474, 'sideways_tp_mult': 2.233928993159348, 'sideways_tsl_mult': 0.38660242653547483, 'sideways_time_stop': 293, 'sideways_use_sma': True, 'sideways_use_ema': False, 'sideways_use_atr': True, 'sideways_use_adx': True, 'sideways_use_spike': False, 'sideways_rsi_required': False}.
[I 2025-08-30 17:31:47,995] Trial 790 finished with values: [-1000000000.0, 1000000000.0] and parameters: {'p_sma': 59, 'p_std': 50, 'p_atr': 17, 'p_adx': 10, 'rsi_period': 19, 'ema1': 18, 'ema2': 26, 'slip_atr_k': 0.006837714617497291, 'slip_spread_k': 0.23900678226305952, 'spread_hl_frac': 0.02023401521259508, 'bb_std_mult': 1.2909595214766023, 'rsi_os': 35, 'rsi_ob': 85, 'vol_spike': 0.117844049446961, 'adx_thresh': 16.441510743180462, 'atr_min_pct': 0.019214779696286956, 'atr_max_pct': 0.11054028632163361, 'tp_mult': 2.9273304383792373, 'tsl_mult': 0.7134939558368424, 'strategy': 'mean_reversion', 'time_stop': 42, 'use_sma': False, 'use_atr': True, 'use_adx': True, 'use_ema': True, 'use_spike': False, 'rsi_required': True, 'edge_k': 0.5036827666125147, 'edge_cap': 0.45315469177814105, 'bull_strategy': 'mean_reversion', 'bull_bb_std_mult': 1.871124935010166, 'bull_rsi_os': 14, 'bull_rsi_ob': 74, 'bull_adx_thresh': 34.98468404895358, 'bull_atr_min_pct': 0.02113523831990658, 'bull_atr_max_pct': 0.13469630627459903, 'bull_tp_mult': 1.9076757774442026, 'bull_tsl_mult': 0.8147358003052035, 'bull_time_stop': 152, 'bull_use_sma': True, 'bull_use_ema': False, 'bull_use_atr': False, 'bull_use_adx': True, 'bull_use_spike': False, 'bull_rsi_required': True, 'bear_strategy': 'breakout', 'bear_bb_std_mult': 0.7007106585031805, 'bear_rsi_os': 34, 'bear_rsi_ob': 78, 'bear_adx_thresh': 10.847108554554683, 'bear_atr_min_pct': 0.019123758268800625, 'bear_atr_max_pct': 0.07688245126566694, 'bear_tp_mult': 2.1159565974312744, 'bear_tsl_mult': 0.8327747018468388, 'bear_time_stop': 127, 'bear_use_sma': True, 'bear_use_ema': True, 'bear_use_atr': False, 'bear_use_adx': False, 'bear_use_spike': False, 'bear_rsi_required': False, 'sideways_strategy': 'breakout', 'sideways_bb_std_mult': 2.846655581684441, 'sideways_rsi_os': 53, 'sideways_rsi_ob': 57, 'sideways_adx_thresh': 13.887704978705006, 'sideways_atr_min_pct': 0.0227937285334186, 'sideways_atr_max_pct': 0.08516751706593707, 'sideways_tp_mult': 2.2711355944993175, 'sideways_tsl_mult': 0.18440414647762138, 'sideways_time_stop': 288, 'sideways_use_sma': True, 'sideways_use_ema': False, 'sideways_use_atr': True, 'sideways_use_adx': True, 'sideways_use_spike': False, 'sideways_rsi_required': False}.
