[I 2025-08-30 17:36:35,031] Trial 820 finished with values: [-1000000000.0, 1000000000.0] and parameters: {'p_sma': 52, 'p_std': 14, 'p_atr': 15, 'p_adx': 8, 'rsi_period': 47, 'ema1': 19, 'ema2': 12, 'slip_atr_k': 0.008213722347447674, 'slip_spread_k': 0.19541311707262976, 'spread_hl_frac': 0.03161147363584062, 'bb_std_mult': 3.1005571206002838, 'rsi_os': 41, 'rsi_ob': 69, 'vol_spike': 0.08391179995992594, 'adx_thresh': 11.573125787354158, 'atr_min_pct': 0.020857128701808437, 'atr_max_pct': 0.1462457922184089, 'tp_mult': 2.830049956562067, 'tsl_mult': 0.9886167989556408, 'strategy': 'breakout', 'time_stop': 91, 'use_sma': False, 'use_atr': True, 'use_adx': True, 'use_ema': False, 'use_spike': False, 'rsi_required': True, 'edge_k': 0.45755514896023897, 'edge_cap': 0.8454569388472939, 'bull_strategy': 'mean_reversion', 'bull_bb_std_mult': 2.2896008304708264, 'bull_rsi_os': 12, 'bull_rsi_ob': 57, 'bull_adx_thresh': 25.437407691935313, 'bull_atr_min_pct': 0.02150210215045746, 'bull_atr_max_pct': 0.13926981062044322, 'bull_tp_mult': 2.440674865917391, 'bull_tsl_mult': 0.020114769167998647, 'bull_time_stop': 42, 'bull_use_sma': True, 'bull_use_ema': True, 'bull_use_atr': False, 'bull_use_adx': True, 'bull_use_spike': False, 'bull_rsi_required': False, 'bear_strategy': 'mean_reversion', 'bear_bb_std_mult': 1.8333142198139583, 'bear_rsi_os': 20, 'bear_rsi_ob': 73, 'bear_adx_thresh': 11.760700850866769, 'bear_atr_min_pct': 0.02110183818628859, 'bear_atr_max_pct': 0.1071655412871411, 'bear_tp_mult': 1.8616578577850045, 'bear_tsl_mult': 0.493707305011337, 'bear_time_stop': 158, 'bear_use_sma': True, 'bear_use_ema': False, 'bear_use_atr': False, 'bear_use_adx': False, 'bear_use_spike': False, 'bear_rsi_required': False, 'sideways_strategy': 'mean_reversion', 'sideways_bb_std_mult': 1.7061471408603903, 'sideways_rsi_os': 50, 'sideways_rsi_ob': 90, 'sideways_adx_thresh': 10.428113426958424, 'sideways_atr_min_pct': 0.018576669351691458, 'sideways_atr_max_pct': 0.014584474008056195, 'sideways_tp_mult': 1.6548648467389069, 'sideways_tsl_mult': 0.43039758339617934, 'sideways_time_stop': 284, 'sideways_use_sma': False, 'sideways_use_ema': False, 'sideways_use_atr': False, 'sideways_use_adx': False, 'sideways_use_spike': False, 'sideways_rsi_required': True}.
[I 2025-08-30 17:36:36,030] Trial 818 finished with values: [-1000000000.0, 1000000000.0] and parameters: {'p_sma': 6, 'p_std': 39, 'p_atr': 15, 'p_adx': 10, 'rsi_period': 36, 'ema1': 30, 'ema2': 12, 'slip_atr_k': 0.0776625134335451, 'slip_spread_k': 0.1931095638803674, 'spread_hl_frac': 0.018687159141321835, 'bb_std_mult': 3.006515660769512, 'rsi_os': 49, 'rsi_ob': 85, 'vol_spike': 0.08150204743942825, 'adx_thresh': 12.290369192307072, 'atr_min_pct': 0.022090711822181332, 'atr_max_pct': 0.09770683429903271, 'tp_mult': 2.8320690701236546, 'tsl_mult': 0.9205973902054931, 'strategy': 'breakout', 'time_stop': 36, 'use_sma': True, 'use_atr': True, 'use_adx': True, 'use_ema': False, 'use_spike': True, 'rsi_required': True, 'edge_k': 1.1345746159840862, 'edge_cap': 0.2616245748275912, 'bull_strategy': 'mean_reversion', 'bull_bb_std_mult': 3.219111767510391, 'bull_rsi_os': 54, 'bull_rsi_ob': 57, 'bull_adx_thresh': 12.486883690401664, 'bull_atr_min_pct': 0.021572902358633936, 'bull_atr_max_pct': 0.08574098569617161, 'bull_tp_mult': 2.208045976450312, 'bull_tsl_mult': 0.7652116095449535, 'bull_time_stop': 81, 'bull_use_sma': True, 'bull_use_ema': True, 'bull_use_atr': False, 'bull_use_adx': True, 'bull_use_spike': False, 'bull_rsi_required': False, 'bear_strategy': 'mean_reversion', 'bear_bb_std_mult': 1.1636052903659593, 'bear_rsi_os': 29, 'bear_rsi_ob': 59, 'bear_adx_thresh': 11.606945655093368, 'bear_atr_min_pct': 0.016531067142702943, 'bear_atr_max_pct': 0.10749377633606808, 'bear_tp_mult': 2.184611974776908, 'bear_tsl_mult': 0.0340444100746769, 'bear_time_stop': 84, 'bear_use_sma': True, 'bear_use_ema': False, 'bear_use_atr': True, 'bear_use_adx': False, 'bear_use_spike': False, 'bear_rsi_required': False, 'sideways_strategy': 'mean_reversion', 'sideways_bb_std_mult': 3.199869162903327, 'sideways_rsi_os': 31, 'sideways_rsi_ob': 94, 'sideways_adx_thresh': 12.411799193461762, 'sideways_atr_min_pct': 0.002729679153219643, 'sideways_atr_max_pct': 0.04515448417334373, 'sideways_tp_mult': 1.9915318831986561, 'sideways_tsl_mult': 0.40525846224247725, 'sideways_time_stop': 33, 'sideways_use_sma': False, 'sideways_use_ema': True, 'sideways_use_atr': False, 'sideways_use_adx': False, 'sideways_use_spike': False, 'sideways_rsi_required': True}.
[I 2025-08-30 17:36:36,031] Trial 819 finished with values: [-1000000000.0, 1000000000.0] and parameters: {'p_sma': 6, 'p_std': 24, 'p_atr': 15, 'p_adx': 10, 'rsi_period': 24, 'ema1': 18, 'ema2': 57, 'slip_atr_k': 0.00801418430918899, 'slip_spread_k': 0.1824840865093183, 'spread_hl_frac': 0.0269081744935506, 'bb_std_mult': 3.0662904582174533, 'rsi_os': 49, 'rsi_ob': 85, 'vol_spike': 0.2077992725556565, 'adx_thresh': 11.6349274102443, 'atr_min_pct': 0.026349631365068887, 'atr_max_pct': 0.09859235423248716, 'tp_mult': 2.1087802154529625, 'tsl_mult': 0.5887374633721385, 'strategy': 'breakout', 'time_stop': 36, 'use_sma': True, 'use_atr': True, 'use_adx': True, 'use_ema': False, 'use_spike': True, 'rsi_required': True, 'edge_k': 0.6804528278933761, 'edge_cap': 0.8067012238831779, 'bull_strategy': 'mean_reversion', 'bull_bb_std_mult': 2.746258497409387, 'bull_rsi_os': 40, 'bull_rsi_ob': 57, 'bull_adx_thresh': 11.084867235698068, 'bull_atr_min_pct': 0.005227577056269682, 'bull_atr_max_pct': 0.14062203934367895, 'bull_tp_mult': 2.207085015887779, 'bull_tsl_mult': 0.764992248921327, 'bull_time_stop': 84, 'bull_use_sma': True, 'bull_use_ema': True, 'bull_use_atr': False, 'bull_use_adx': True, 'bull_use_spike': False, 'bull_rsi_required': False, 'bear_strategy': 'mean_reversion', 'bear_bb_std_mult': 1.165354701938076, 'bear_rsi_os': 15, 'bear_rsi_ob': 59, 'bear_adx_thresh': 11.91568441438779, 'bear_atr_min_pct': 0.01144566083134149, 'bear_atr_max_pct': 0.1465563318668598, 'bear_tp_mult': 1.8219316012725935, 'bear_tsl_mult': 0.028553630041852407, 'bear_time_stop': 83, 'bear_use_sma': True, 'bear_use_ema': False, 'bear_use_atr': True, 'bear_use_adx': False, 'bear_use_spike': False, 'bear_rsi_required': False, 'sideways_strategy': 'mean_reversion', 'sideways_bb_std_mult': 1.6845262693069427, 'sideways_rsi_os': 32, 'sideways_rsi_ob': 90, 'sideways_adx_thresh': 11.064512781064309, 'sideways_atr_min_pct': 0.023704350331434792, 'sideways_atr_max_pct': 0.09632900945898826, 'sideways_tp_mult': 1.7276822533240281, 'sideways_tsl_mult': 0.20885619122798493, 'sideways_time_stop': 284, 'sideways_use_sma': False, 'sideways_use_ema': True, 'sideways_use_atr': False, 'sideways_use_adx': False, 'sideways_use_spike': False, 'sideways_rsi_required': True}.
[I 2025-08-30 17:37:16,164] Trial 822 finished with values: [-1000000000.0, 1000000000.0] and parameters: {'p_sma': 47, 'p_std': 39, 'p_atr': 14, 'p_adx': 8, 'rsi_period': 22, 'ema1': 19, 'ema2': 52, 'slip_atr_k': 0.00017467625486125224, 'slip_spread_k': 0.19042860797306224, 'spread_hl_frac': 0.019131785753960153, 'bb_std_mult': 3.0761225940221326, 'rsi_os': 34, 'rsi_ob': 77, 'vol_spike': 0.18219780560980398, 'adx_thresh': 9.940844257530102, 'atr_min_pct': 0.02122068660455813, 'atr_max_pct': 0.022818541785638954, 'tp_mult': 2.6021099452930256, 'tsl_mult': 0.9219431164456283, 'strategy': 'mean_reversion', 'time_stop': 233, 'use_sma': True, 'use_atr': True, 'use_adx': True, 'use_ema': False, 'use_spike': True, 'rsi_required': True, 'edge_k': 0.003380768243075871, 'edge_cap': 0.8462822280853823, 'bull_strategy': 'breakout', 'bull_bb_std_mult': 1.6953315547128276, 'bull_rsi_os': 40, 'bull_rsi_ob': 86, 'bull_adx_thresh': 9.414817609216222, 'bull_atr_min_pct': 0.020824089082545263, 'bull_atr_max_pct': 0.08513090221089423, 'bull_tp_mult': 2.9481545360731434, 'bull_tsl_mult': 0.7499057196098492, 'bull_time_stop': 64, 'bull_use_sma': True, 'bull_use_ema': True, 'bull_use_atr': False, 'bull_use_adx': True, 'bull_use_spike': False, 'bull_rsi_required': False, 'bear_strategy': 'mean_reversion', 'bear_bb_std_mult': 1.2610142974411647, 'bear_rsi_os': 30, 'bear_rsi_ob': 73, 'bear_adx_thresh': 12.775368599211387, 'bear_atr_min_pct': 0.01648042834796142, 'bear_atr_max_pct': 0.10273017443974974, 'bear_tp_mult': 2.790318105466366, 'bear_tsl_mult': 0.9535544263213603, 'bear_time_stop': 162, 'bear_use_sma': True, 'bear_use_ema': False, 'bear_use_atr': True, 'bear_use_adx': False, 'bear_use_spike': False, 'bear_rsi_required': False, 'sideways_strategy': 'breakout', 'sideways_bb_std_mult': 0.7568286240806237, 'sideways_rsi_os': 11, 'sideways_rsi_ob': 94, 'sideways_adx_thresh': 12.481366761323645, 'sideways_atr_min_pct': 0.018759513142420338, 'sideways_atr_max_pct': 0.09867768203221018, 'sideways_tp_mult': 1.6845200841648218, 'sideways_tsl_mult': 0.43576003173968936, 'sideways_time_stop': 289, 'sideways_use_sma': True, 'sideways_use_ema': True, 'sideways_use_atr': False, 'sideways_use_adx': False, 'sideways_use_spike': False, 'sideways_rsi_required': True}.
[I 2025-08-30 17:37:16,189] Trial 825 finished with values: [-1000000000.0, 1000000000.0] and parameters: {'p_sma': 5, 'p_std': 41, 'p_atr': 30, 'p_adx': 9, 'rsi_period': 22, 'ema1': 19, 'ema2': 42, 'slip_atr_k': 0.19615198438612158, 'slip_spread_k': 0.11783537652807134, 'spread_hl_frac': 0.021891959525272175, 'bb_std_mult': 3.177628085296203, 'rsi_os': 34, 'rsi_ob': 84, 'vol_spike': 0.25470630172181274, 'adx_thresh': 10.045645426374215, 'atr_min_pct': 0.01879803303527338, 'atr_max_pct': 0.022906623449349017, 'tp_mult': 2.6132802253070015, 'tsl_mult': 0.16133976202207045, 'strategy': 'mean_reversion', 'time_stop': 291, 'use_sma': False, 'use_atr': False, 'use_adx': True, 'use_ema': False, 'use_spike': False, 'rsi_required': False, 'edge_k': 0.06002100844372349, 'edge_cap': 0.7773008177672112, 'bull_strategy': 'breakout', 'bull_bb_std_mult': 2.0666268758261905, 'bull_rsi_os': 35, 'bull_rsi_ob': 91, 'bull_adx_thresh': 31.384898150348086, 'bull_atr_min_pct': 0.014100267950952554, 'bull_atr_max_pct': 0.09361210054954122, 'bull_tp_mult': 1.776500656429674, 'bull_tsl_mult': 0.8055948855649658, 'bull_time_stop': 64, 'bull_use_sma': True, 'bull_use_ema': True, 'bull_use_atr': False, 'bull_use_adx': False, 'bull_use_spike': True, 'bull_rsi_required': False, 'bear_strategy': 'mean_reversion', 'bear_bb_std_mult': 1.2726217233495678, 'bear_rsi_os': 55, 'bear_rsi_ob': 76, 'bear_adx_thresh': 10.729880002228786, 'bear_atr_min_pct': 0.024991725300437022, 'bear_atr_max_pct': 0.10273516468285775, 'bear_tp_mult': 2.0563230682052605, 'bear_tsl_mult': 0.6400968539003803, 'bear_time_stop': 135, 'bear_use_sma': True, 'bear_use_ema': False, 'bear_use_atr': False, 'bear_use_adx': True, 'bear_use_spike': True, 'bear_rsi_required': True, 'sideways_strategy': 'breakout', 'sideways_bb_std_mult': 0.7515358861398203, 'sideways_rsi_os': 30, 'sideways_rsi_ob': 92, 'sideways_adx_thresh': 8.701027683966391, 'sideways_atr_min_pct': 0.01413532237814784, 'sideways_atr_max_pct': 0.09664311751396318, 'sideways_tp_mult': 2.9224145551965424, 'sideways_tsl_mult': 0.45603598677106033, 'sideways_time_stop': 180, 'sideways_use_sma': True, 'sideways_use_ema': False, 'sideways_use_atr': False, 'sideways_use_adx': False, 'sideways_use_spike': False, 'sideways_rsi_required': True}.
[I 2025-08-30 17:37:16,356] Trial 824 finished with values: [-1000000000.0, 1000000000.0] and parameters: {'p_sma': 48, 'p_std': 5, 'p_atr': 8, 'p_adx': 30, 'rsi_period': 21, 'ema1': 19, 'ema2': 42, 'slip_atr_k': 0.02315779199626749, 'slip_spread_k': 0.9542551610589293, 'spread_hl_frac': 0.022461926671528302, 'bb_std_mult': 0.6867010107989828, 'rsi_os': 34, 'rsi_ob': 84, 'vol_spike': 0.16290756082755328, 'adx_thresh': 9.907931533150673, 'atr_min_pct': 0.019046736332722174, 'atr_max_pct': 0.06756263807006124, 'tp_mult': 1.271048620137161, 'tsl_mult': 0.12694520069269977, 'strategy': 'mean_reversion', 'time_stop': 23, 'use_sma': False, 'use_atr': False, 'use_adx': True, 'use_ema': False, 'use_spike': False, 'rsi_required': False, 'edge_k': 0.5696529960588778, 'edge_cap': 0.775321671292504, 'bull_strategy': 'breakout', 'bull_bb_std_mult': 2.0653585775804366, 'bull_rsi_os': 20, 'bull_rsi_ob': 66, 'bull_adx_thresh': 34.51981546806814, 'bull_atr_min_pct': 0.02099466701217413, 'bull_atr_max_pct': 0.13747679398585566, 'bull_tp_mult': 2.2981400461894093, 'bull_tsl_mult': 0.660293661311428, 'bull_time_stop': 137, 'bull_use_sma': True, 'bull_use_ema': True, 'bull_use_atr': False, 'bull_use_adx': False, 'bull_use_spike': True, 'bull_rsi_required': False, 'bear_strategy': 'mean_reversion', 'bear_bb_std_mult': 1.280241541914802, 'bear_rsi_os': 13, 'bear_rsi_ob': 76, 'bear_adx_thresh': 12.752047328779005, 'bear_atr_min_pct': 0.013874115457373583, 'bear_atr_max_pct': 0.010215875923534873, 'bear_tp_mult': 2.684372449591188, 'bear_tsl_mult': 0.4492931744261711, 'bear_time_stop': 212, 'bear_use_sma': True, 'bear_use_ema': False, 'bear_use_atr': False, 'bear_use_adx': True, 'bear_use_spike': True, 'bear_rsi_required': True, 'sideways_strategy': 'breakout', 'sideways_bb_std_mult': 1.3462867406259271, 'sideways_rsi_os': 30, 'sideways_rsi_ob': 83, 'sideways_adx_thresh': 25.092626694788066, 'sideways_atr_min_pct': 0.025869034689192535, 'sideways_atr_max_pct': 0.09725676167707051, 'sideways_tp_mult': 2.920309515160036, 'sideways_tsl_mult': 0.45632217040174117, 'sideways_time_stop': 179, 'sideways_use_sma': True, 'sideways_use_ema': False, 'sideways_use_atr': False, 'sideways_use_adx': False, 'sideways_use_spike': False, 'sideways_rsi_required': True}.
[I 2025-08-30 17:37:16,672] Trial 823 finished with values: [-0.028001262514285363, 0.027873209741321812] and parameters: {'p_sma': 47, 'p_std': 25, 'p_atr': 30, 'p_adx': 10, 'rsi_period': 36, 'ema1': 18, 'ema2': 45, 'slip_atr_k': 0.15333623409874933, 'slip_spread_k': 0.12010578553917797, 'spread_hl_frac': 0.026180167685842977, 'bb_std_mult': 3.1726014544701067, 'rsi_os': 34, 'rsi_ob': 84, 'vol_spike': 0.2317750048709053, 'adx_thresh': 33.192420190108656, 'atr_min_pct': 0.018792604077374687, 'atr_max_pct': 0.08007768684964163, 'tp_mult': 2.799387199343709, 'tsl_mult': 0.9266609048379739, 'strategy': 'mean_reversion', 'time_stop': 41, 'use_sma': True, 'use_atr': True, 'use_adx': True, 'use_ema': False, 'use_spike': True, 'rsi_required': True, 'edge_k': 0.1744485050082787, 'edge_cap': 0.8827154467189439, 'bull_strategy': 'breakout', 'bull_bb_std_mult': 1.9263211773271218, 'bull_rsi_os': 54, 'bull_rsi_ob': 65, 'bull_adx_thresh': 31.602601963274473, 'bull_atr_min_pct': 0.014174578594819607, 'bull_atr_max_pct': 0.08438930643501745, 'bull_tp_mult': 2.305785959662683, 'bull_tsl_mult': 0.8578334448801697, 'bull_time_stop': 81, 'bull_use_sma': True, 'bull_use_ema': True, 'bull_use_atr': False, 'bull_use_adx': True, 'bull_use_spike': False, 'bull_rsi_required': False, 'bear_strategy': 'mean_reversion', 'bear_bb_std_mult': 1.2405251772600094, 'bear_rsi_os': 46, 'bear_rsi_ob': 61, 'bear_adx_thresh': 12.565173354901562, 'bear_atr_min_pct': 0.012734824684749776, 'bear_atr_max_pct': 0.10362781653187077, 'bear_tp_mult': 2.186137265683967, 'bear_tsl_mult': 0.4220469753033228, 'bear_time_stop': 84, 'bear_use_sma': True, 'bear_use_ema': False, 'bear_use_atr': True, 'bear_use_adx': False, 'bear_use_spike': False, 'bear_rsi_required': False, 'sideways_strategy': 'breakout', 'sideways_bb_std_mult': 0.8627509075957749, 'sideways_rsi_os': 45, 'sideways_rsi_ob': 92, 'sideways_adx_thresh': 12.493748997074835, 'sideways_atr_min_pct': 0.0026348361655906213, 'sideways_atr_max_pct': 0.0957709219833098, 'sideways_tp_mult': 2.9202836009040074, 'sideways_tsl_mult': 0.45296347357678257, 'sideways_time_stop': 52, 'sideways_use_sma': True, 'sideways_use_ema': True, 'sideways_use_atr': False, 'sideways_use_adx': False, 'sideways_use_spike': False, 'sideways_rsi_required': True}.
[I 2025-08-30 17:37:55,081] Trial 828 finished with values: [-1000000000.0, 1000000000.0] and parameters: {'p_sma': 60, 'p_std': 20, 'p_atr': 17, 'p_adx': 29, 'rsi_period': 21, 'ema1': 18, 'ema2': 11, 'slip_atr_k': 0.15234323012512474, 'slip_spread_k': 0.9755661459746057, 'spread_hl_frac': 0.0175933591257421, 'bb_std_mult': 3.3618633527806034, 'rsi_os': 28, 'rsi_ob': 57, 'vol_spike': 0.18561160857845713, 'adx_thresh': 15.617469578338675, 'atr_min_pct': 0.018126388629500844, 'atr_max_pct': 0.1411984781114376, 'tp_mult': 2.792545926751687, 'tsl_mult': 0.7414125448493072, 'strategy': 'mean_reversion', 'time_stop': 63, 'use_sma': False, 'use_atr': True, 'use_adx': False, 'use_ema': True, 'use_spike': False, 'rsi_required': True, 'edge_k': 0.20013047901127456, 'edge_cap': 0.2214049807658513, 'bull_strategy': 'mean_reversion', 'bull_bb_std_mult': 3.5352183402775292, 'bull_rsi_os': 11, 'bull_rsi_ob': 53, 'bull_adx_thresh': 34.41535289596919, 'bull_atr_min_pct': 0.022185758469192508, 'bull_atr_max_pct': 0.07509105892691273, 'bull_tp_mult': 2.067722843003776, 'bull_tsl_mult': 0.11125780900789611, 'bull_time_stop': 185, 'bull_use_sma': True, 'bull_use_ema': False, 'bull_use_atr': False, 'bull_use_adx': True, 'bull_use_spike': False, 'bull_rsi_required': True, 'bear_strategy': 'breakout', 'bear_bb_std_mult': 0.9653636166368857, 'bear_rsi_os': 21, 'bear_rsi_ob': 78, 'bear_adx_thresh': 31.86587572121561, 'bear_atr_min_pct': 0.0196820859087033, 'bear_atr_max_pct': 0.1134107099183327, 'bear_tp_mult': 2.235608502195566, 'bear_tsl_mult': 0.6947509864309358, 'bear_time_stop': 5, 'bear_use_sma': True, 'bear_use_ema': True, 'bear_use_atr': False, 'bear_use_adx': False, 'bear_use_spike': False, 'bear_rsi_required': False, 'sideways_strategy': 'breakout', 'sideways_bb_std_mult': 0.869950814105438, 'sideways_rsi_os': 44, 'sideways_rsi_ob': 91, 'sideways_adx_thresh': 33.74262228413703, 'sideways_atr_min_pct': 0.019622457888300162, 'sideways_atr_max_pct': 0.10656605416748455, 'sideways_tp_mult': 2.961339702230834, 'sideways_tsl_mult': 0.47988786973802666, 'sideways_time_stop': 96, 'sideways_use_sma': True, 'sideways_use_ema': False, 'sideways_use_atr': True, 'sideways_use_adx': True, 'sideways_use_spike': True, 'sideways_rsi_required': False}.
[I 2025-08-30 17:37:55,450] Trial 826 finished with values: [-0.07576022623974699, 0.07571518022881567] and parameters: {'p_sma': 60, 'p_std': 52, 'p_atr': 17, 'p_adx': 30, 'rsi_period': 26, 'ema1': 18, 'ema2': 45, 'slip_atr_k': 0.023457961028283156, 'slip_spread_k': 0.8813721234291302, 'spread_hl_frac': 0.012494975099811446, 'bb_std_mult': 1.8350901857224071, 'rsi_os': 28, 'rsi_ob': 87, 'vol_spike': 0.16248393886390042, 'adx_thresh': 11.016785488359432, 'atr_min_pct': 0.004555815826419885, 'atr_max_pct': 0.14128144976907847, 'tp_mult': 1.268496729666547, 'tsl_mult': 0.9455176868078536, 'strategy': 'mean_reversion', 'time_stop': 284, 'use_sma': False, 'use_atr': True, 'use_adx': False, 'use_ema': True, 'use_spike': False, 'rsi_required': True, 'edge_k': 0.18031389650685448, 'edge_cap': 0.88846511440747, 'bull_strategy': 'mean_reversion', 'bull_bb_std_mult': 1.9139529455712578, 'bull_rsi_os': 11, 'bull_rsi_ob': 64, 'bull_adx_thresh': 34.44616554604453, 'bull_atr_min_pct': 0.0072258188105518845, 'bull_atr_max_pct': 0.13684685054685444, 'bull_tp_mult': 2.0724130973888455, 'bull_tsl_mult': 0.7947497400141676, 'bull_time_stop': 212, 'bull_use_sma': True, 'bull_use_ema': False, 'bull_use_atr': False, 'bull_use_adx': True, 'bull_use_spike': False, 'bull_rsi_required': True, 'bear_strategy': 'breakout', 'bear_bb_std_mult': 3.3362522118991995, 'bear_rsi_os': 45, 'bear_rsi_ob': 76, 'bear_adx_thresh': 32.94624467171309, 'bear_atr_min_pct': 0.019598885271936557, 'bear_atr_max_pct': 0.11427525305878239, 'bear_tp_mult': 2.2259368940950908, 'bear_tsl_mult': 0.4197871501395099, 'bear_time_stop': 214, 'bear_use_sma': True, 'bear_use_ema': True, 'bear_use_atr': False, 'bear_use_adx': False, 'bear_use_spike': False, 'bear_rsi_required': False, 'sideways_strategy': 'breakout', 'sideways_bb_std_mult': 0.5492154870121831, 'sideways_rsi_os': 45, 'sideways_rsi_ob': 92, 'sideways_adx_thresh': 13.709140908922212, 'sideways_atr_min_pct': 0.0015334791302967607, 'sideways_atr_max_pct': 0.10470952079774887, 'sideways_tp_mult': 2.9248657581572295, 'sideways_tsl_mult': 0.48452155970916727, 'sideways_time_stop': 258, 'sideways_use_sma': True, 'sideways_use_ema': False, 'sideways_use_atr': True, 'sideways_use_adx': False, 'sideways_use_spike': True, 'sideways_rsi_required': False}.
