[I 2025-08-30 16:34:09,274] Trial 451 finished with values: [-1000000000.0, 1000000000.0] and parameters: {'p_sma': 41, 'p_std': 54, 'p_atr': 25, 'p_adx': 30, 'rsi_period': 75, 'ema1': 25, 'ema2': 26, 'slip_atr_k': 0.014852452511419135, 'slip_spread_k': 0.7210775194957311, 'spread_hl_frac': 0.016474627628937928, 'bb_std_mult': 2.914419281971201, 'rsi_os': 33, 'rsi_ob': 65, 'vol_spike': 0.02216155064726598, 'adx_thresh': 11.757118478362177, 'atr_min_pct': 0.010361626062278086, 'atr_max_pct': 0.12949103479616392, 'tp_mult': 1.974498285897488, 'tsl_mult': 0.42358058686009964, 'strategy': 'mean_reversion', 'time_stop': 199, 'use_sma': False, 'use_atr': True, 'use_adx': True, 'use_ema': True, 'use_spike': False, 'rsi_required': True, 'edge_k': 1.3010039034390797, 'edge_cap': 0.6509579350919733, 'bull_strategy': 'mean_reversion', 'bull_bb_std_mult': 1.3109867946602238, 'bull_rsi_os': 8, 'bull_rsi_ob': 52, 'bull_adx_thresh': 21.27351894662841, 'bull_atr_min_pct': 0.021204130923071544, 'bull_atr_max_pct': 0.07921385911290624, 'bull_tp_mult': 1.3856578938927901, 'bull_tsl_mult': 0.927409331004935, 'bull_time_stop': 60, 'bull_use_sma': False, 'bull_use_ema': True, 'bull_use_atr': True, 'bull_use_adx': True, 'bull_use_spike': False, 'bull_rsi_required': False, 'bear_strategy': 'breakout', 'bear_bb_std_mult': 1.905965938891201, 'bear_rsi_os': 14, 'bear_rsi_ob': 76, 'bear_adx_thresh': 25.425440029811277, 'bear_atr_min_pct': 0.01581366951009192, 'bear_atr_max_pct': 0.04118870691534063, 'bear_tp_mult': 1.4990411199831934, 'bear_tsl_mult': 0.40536017431925986, 'bear_time_stop': 204, 'bear_use_sma': True, 'bear_use_ema': False, 'bear_use_atr': False, 'bear_use_adx': False, 'bear_use_spike': False, 'bear_rsi_required': False, 'sideways_strategy': 'breakout', 'sideways_bb_std_mult': 2.046014250852736, 'sideways_rsi_os': 28, 'sideways_rsi_ob': 93, 'sideways_adx_thresh': 17.29130300858164, 'sideways_atr_min_pct': 0.012728214128428107, 'sideways_atr_max_pct': 0.1477417924583059, 'sideways_tp_mult': 1.3622411676889037, 'sideways_tsl_mult': 0.009968054515489044, 'sideways_time_stop': 196, 'sideways_use_sma': True, 'sideways_use_ema': True, 'sideways_use_atr': False, 'sideways_use_adx': False, 'sideways_use_spike': False, 'sideways_rsi_required': False}.
[I 2025-08-30 16:34:09,507] Trial 450 finished with values: [-1000000000.0, 1000000000.0] and parameters: {'p_sma': 9, 'p_std': 54, 'p_atr': 25, 'p_adx': 22, 'rsi_period': 52, 'ema1': 26, 'ema2': 41, 'slip_atr_k': 0.035469619087293, 'slip_spread_k': 0.7203168036842257, 'spread_hl_frac': 0.002470853261307037, 'bb_std_mult': 2.285480949126536, 'rsi_os': 33, 'rsi_ob': 65, 'vol_spike': 0.24074516013945746, 'adx_thresh': 11.239452485862413, 'atr_min_pct': 0.018362561677498973, 'atr_max_pct': 0.07144825158771087, 'tp_mult': 2.5062012327665637, 'tsl_mult': 0.42236094511895894, 'strategy': 'mean_reversion', 'time_stop': 12, 'use_sma': False, 'use_atr': True, 'use_adx': True, 'use_ema': True, 'use_spike': False, 'rsi_required': True, 'edge_k': 1.5373341640031142, 'edge_cap': 0.5692541408361083, 'bull_strategy': 'mean_reversion', 'bull_bb_std_mult': 1.3466299965012931, 'bull_rsi_os': 8, 'bull_rsi_ob': 50, 'bull_adx_thresh': 20.353646393585258, 'bull_atr_min_pct': 0.019070161292130537, 'bull_atr_max_pct': 0.1308071032731277, 'bull_tp_mult': 1.484088182394595, 'bull_tsl_mult': 0.29529046894198385, 'bull_time_stop': 60, 'bull_use_sma': False, 'bull_use_ema': True, 'bull_use_atr': True, 'bull_use_adx': True, 'bull_use_spike': True, 'bull_rsi_required': False, 'bear_strategy': 'breakout', 'bear_bb_std_mult': 3.586789576196825, 'bear_rsi_os': 12, 'bear_rsi_ob': 76, 'bear_adx_thresh': 13.769005761513203, 'bear_atr_min_pct': 0.021783248095886464, 'bear_atr_max_pct': 0.08834288622139852, 'bear_tp_mult': 1.491432626508066, 'bear_tsl_mult': 0.6588860492832413, 'bear_time_stop': 233, 'bear_use_sma': True, 'bear_use_ema': False, 'bear_use_atr': False, 'bear_use_adx': False, 'bear_use_spike': False, 'bear_rsi_required': False, 'sideways_strategy': 'breakout', 'sideways_bb_std_mult': 3.581566079049189, 'sideways_rsi_os': 27, 'sideways_rsi_ob': 80, 'sideways_adx_thresh': 22.359222198242975, 'sideways_atr_min_pct': 0.0022493341161770423, 'sideways_atr_max_pct': 0.14667509078398722, 'sideways_tp_mult': 1.3873226230312368, 'sideways_tsl_mult': 0.9959944263658818, 'sideways_time_stop': 197, 'sideways_use_sma': True, 'sideways_use_ema': True, 'sideways_use_atr': False, 'sideways_use_adx': False, 'sideways_use_spike': False, 'sideways_rsi_required': False}.
[I 2025-08-30 16:34:59,216] Trial 454 finished with values: [-1000000000.0, 1000000000.0] and parameters: {'p_sma': 39, 'p_std': 59, 'p_atr': 26, 'p_adx': 22, 'rsi_period': 55, 'ema1': 25, 'ema2': 20, 'slip_atr_k': 0.005669030818936147, 'slip_spread_k': 0.4994629702173305, 'spread_hl_frac': 0.018703110573787148, 'bb_std_mult': 3.1801738939265096, 'rsi_os': 19, 'rsi_ob': 63, 'vol_spike': 0.08476153918831364, 'adx_thresh': 11.026493457391235, 'atr_min_pct': 0.019559044931074798, 'atr_max_pct': 0.049436960863541074, 'tp_mult': 1.716185311495236, 'tsl_mult': 0.361027422752888, 'strategy': 'mean_reversion', 'time_stop': 23, 'use_sma': True, 'use_atr': True, 'use_adx': True, 'use_ema': False, 'use_spike': False, 'rsi_required': True, 'edge_k': 1.6695757313792552, 'edge_cap': 0.6212101769946543, 'bull_strategy': 'mean_reversion', 'bull_bb_std_mult': 1.8616401786520111, 'bull_rsi_os': 12, 'bull_rsi_ob': 50, 'bull_adx_thresh': 21.18149187816729, 'bull_atr_min_pct': 0.00715034625830018, 'bull_atr_max_pct': 0.1310100061911752, 'bull_tp_mult': 1.2553671415777083, 'bull_tsl_mult': 0.5854440822887429, 'bull_time_stop': 77, 'bull_use_sma': False, 'bull_use_ema': True, 'bull_use_atr': True, 'bull_use_adx': True, 'bull_use_spike': False, 'bull_rsi_required': False, 'bear_strategy': 'mean_reversion', 'bear_bb_std_mult': 1.4253779869297265, 'bear_rsi_os': 15, 'bear_rsi_ob': 45, 'bear_adx_thresh': 14.267772681658851, 'bear_atr_min_pct': 0.021662424211717997, 'bear_atr_max_pct': 0.09223041686407067, 'bear_tp_mult': 2.33348816461261, 'bear_tsl_mult': 0.6491756324679414, 'bear_time_stop': 233, 'bear_use_sma': True, 'bear_use_ema': False, 'bear_use_atr': False, 'bear_use_adx': False, 'bear_use_spike': False, 'bear_rsi_required': False, 'sideways_strategy': 'breakout', 'sideways_bb_std_mult': 1.9485189852936662, 'sideways_rsi_os': 27, 'sideways_rsi_ob': 65, 'sideways_adx_thresh': 20.85079761717245, 'sideways_atr_min_pct': 0.016883859652472143, 'sideways_atr_max_pct': 0.13392520560581989, 'sideways_tp_mult': 1.189506127302117, 'sideways_tsl_mult': 0.5449765744853802, 'sideways_time_stop': 206, 'sideways_use_sma': False, 'sideways_use_ema': False, 'sideways_use_atr': False, 'sideways_use_adx': False, 'sideways_use_spike': False, 'sideways_rsi_required': True}.
[I 2025-08-30 16:34:59,734] Trial 453 finished with values: [-1000000000.0, 1000000000.0] and parameters: {'p_sma': 36, 'p_std': 33, 'p_atr': 23, 'p_adx': 30, 'rsi_period': 74, 'ema1': 25, 'ema2': 12, 'slip_atr_k': 0.005799512657139184, 'slip_spread_k': 0.7188801912723866, 'spread_hl_frac': 0.0031971503381563425, 'bb_std_mult': 3.2037817659624674, 'rsi_os': 36, 'rsi_ob': 65, 'vol_spike': 0.1648427521163687, 'adx_thresh': 10.875536626214394, 'atr_min_pct': 0.019544070545018024, 'atr_max_pct': 0.05116513091804105, 'tp_mult': 2.8256371604884434, 'tsl_mult': 0.6770237844665181, 'strategy': 'mean_reversion', 'time_stop': 211, 'use_sma': True, 'use_atr': True, 'use_adx': True, 'use_ema': False, 'use_spike': False, 'rsi_required': True, 'edge_k': 1.6596596242737447, 'edge_cap': 0.6219655415011381, 'bull_strategy': 'mean_reversion', 'bull_bb_std_mult': 1.8503641939927382, 'bull_rsi_os': 10, 'bull_rsi_ob': 50, 'bull_adx_thresh': 21.169774451454067, 'bull_atr_min_pct': 0.007913784568902873, 'bull_atr_max_pct': 0.024035931652258827, 'bull_tp_mult': 1.8994124640608503, 'bull_tsl_mult': 0.2971142136712655, 'bull_time_stop': 76, 'bull_use_sma': False, 'bull_use_ema': True, 'bull_use_atr': True, 'bull_use_adx': True, 'bull_use_spike': False, 'bull_rsi_required': False, 'bear_strategy': 'mean_reversion', 'bear_bb_std_mult': 1.8338964166138831, 'bear_rsi_os': 15, 'bear_rsi_ob': 45, 'bear_adx_thresh': 16.772034242466056, 'bear_atr_min_pct': 0.0157846179963529, 'bear_atr_max_pct': 0.09261759463150586, 'bear_tp_mult': 2.605751654166525, 'bear_tsl_mult': 0.11983421031152469, 'bear_time_stop': 234, 'bear_use_sma': True, 'bear_use_ema': False, 'bear_use_atr': False, 'bear_use_adx': False, 'bear_use_spike': False, 'bear_rsi_required': False, 'sideways_strategy': 'breakout', 'sideways_bb_std_mult': 2.6493748071395, 'sideways_rsi_os': 28, 'sideways_rsi_ob': 90, 'sideways_adx_thresh': 20.635749680699163, 'sideways_atr_min_pct': 0.0005003387913482158, 'sideways_atr_max_pct': 0.13321037173804406, 'sideways_tp_mult': 1.194775628944162, 'sideways_tsl_mult': 0.48443242351411697, 'sideways_time_stop': 206, 'sideways_use_sma': True, 'sideways_use_ema': False, 'sideways_use_atr': False, 'sideways_use_adx': False, 'sideways_use_spike': False, 'sideways_rsi_required': True}.
[I 2025-08-30 16:35:01,636] Trial 452 finished with values: [-1000000000.0, 1000000000.0] and parameters: {'p_sma': 9, 'p_std': 56, 'p_atr': 24, 'p_adx': 22, 'rsi_period': 75, 'ema1': 25, 'ema2': 10, 'slip_atr_k': 0.005033248898454993, 'slip_spread_k': 0.37335492328911857, 'spread_hl_frac': 0.03380947759798089, 'bb_std_mult': 2.3170796816379227, 'rsi_os': 5, 'rsi_ob': 64, 'vol_spike': 0.20600181485517705, 'adx_thresh': 11.214469339472341, 'atr_min_pct': 0.010076694948035881, 'atr_max_pct': 0.14640499646344143, 'tp_mult': 1.3581413688544883, 'tsl_mult': 0.4571536789030489, 'strategy': 'mean_reversion', 'time_stop': 200, 'use_sma': True, 'use_atr': True, 'use_adx': True, 'use_ema': True, 'use_spike': False, 'rsi_required': True, 'edge_k': 1.3345097114395852, 'edge_cap': 0.6213283116838065, 'bull_strategy': 'mean_reversion', 'bull_bb_std_mult': 1.3498884635958832, 'bull_rsi_os': 10, 'bull_rsi_ob': 95, 'bull_adx_thresh': 20.922819292935962, 'bull_atr_min_pct': 0.02109291552659991, 'bull_atr_max_pct': 0.1420020661761991, 'bull_tp_mult': 1.3909596235368158, 'bull_tsl_mult': 0.29962310906283607, 'bull_time_stop': 59, 'bull_use_sma': False, 'bull_use_ema': True, 'bull_use_atr': True, 'bull_use_adx': True, 'bull_use_spike': False, 'bull_rsi_required': False, 'bear_strategy': 'breakout', 'bear_bb_std_mult': 1.888601439016796, 'bear_rsi_os': 22, 'bear_rsi_ob': 80, 'bear_adx_thresh': 16.764589421645788, 'bear_atr_min_pct': 0.02185365676462087, 'bear_atr_max_pct': 0.07995884499481452, 'bear_tp_mult': 2.327357151727203, 'bear_tsl_mult': 0.6550161186265121, 'bear_time_stop': 232, 'bear_use_sma': True, 'bear_use_ema': False, 'bear_use_atr': False, 'bear_use_adx': False, 'bear_use_spike': False, 'bear_rsi_required': False, 'sideways_strategy': 'breakout', 'sideways_bb_std_mult': 1.9934272761452858, 'sideways_rsi_os': 27, 'sideways_rsi_ob': 46, 'sideways_adx_thresh': 20.755828663937166, 'sideways_atr_min_pct': 0.0021699118535098644, 'sideways_atr_max_pct': 0.03450518617390479, 'sideways_tp_mult': 1.3735430019075445, 'sideways_tsl_mult': 0.5409441215771029, 'sideways_time_stop': 215, 'sideways_use_sma': True, 'sideways_use_ema': True, 'sideways_use_atr': False, 'sideways_use_adx': False, 'sideways_use_spike': False, 'sideways_rsi_required': True}.
[I 2025-08-30 16:35:01,648] Trial 455 finished with values: [-0.06974328797331986, 0.06973187478679713] and parameters: {'p_sma': 39, 'p_std': 59, 'p_atr': 26, 'p_adx': 8, 'rsi_period': 24, 'ema1': 25, 'ema2': 14, 'slip_atr_k': 0.00732558151070916, 'slip_spread_k': 0.3673267235092942, 'spread_hl_frac': 0.014162118422252798, 'bb_std_mult': 3.1991385666457473, 'rsi_os': 19, 'rsi_ob': 90, 'vol_spike': 0.08705623513491631, 'adx_thresh': 10.819293679698205, 'atr_min_pct': 0.019627937814849748, 'atr_max_pct': 0.1460291814844898, 'tp_mult': 1.7053968347848885, 'tsl_mult': 0.45732165251251905, 'strategy': 'mean_reversion', 'time_stop': 211, 'use_sma': True, 'use_atr': True, 'use_adx': True, 'use_ema': False, 'use_spike': False, 'rsi_required': True, 'edge_k': 1.6647282925303717, 'edge_cap': 0.2707670623166627, 'bull_strategy': 'mean_reversion', 'bull_bb_std_mult': 1.8640878475939904, 'bull_rsi_os': 12, 'bull_rsi_ob': 51, 'bull_adx_thresh': 21.27115698142736, 'bull_atr_min_pct': 0.021904517938703696, 'bull_atr_max_pct': 0.022444848985696306, 'bull_tp_mult': 1.3415936135674875, 'bull_tsl_mult': 0.4903786886606356, 'bull_time_stop': 76, 'bull_use_sma': False, 'bull_use_ema': True, 'bull_use_atr': True, 'bull_use_adx': True, 'bull_use_spike': False, 'bull_rsi_required': False, 'bear_strategy': 'mean_reversion', 'bear_bb_std_mult': 1.440064833571113, 'bear_rsi_os': 15, 'bear_rsi_ob': 59, 'bear_adx_thresh': 16.56874526984677, 'bear_atr_min_pct': 0.02170544741669655, 'bear_atr_max_pct': 0.010446652015263014, 'bear_tp_mult': 1.9622130764409378, 'bear_tsl_mult': 0.36465734191738775, 'bear_time_stop': 212, 'bear_use_sma': True, 'bear_use_ema': False, 'bear_use_atr': False, 'bear_use_adx': False, 'bear_use_spike': False, 'bear_rsi_required': False, 'sideways_strategy': 'breakout', 'sideways_bb_std_mult': 1.329845643830669, 'sideways_rsi_os': 30, 'sideways_rsi_ob': 90, 'sideways_adx_thresh': 15.349699664774533, 'sideways_atr_min_pct': 0.0003237542422921229, 'sideways_atr_max_pct': 0.06556505309205994, 'sideways_tp_mult': 1.519148615399831, 'sideways_tsl_mult': 0.06931512338486073, 'sideways_time_stop': 215, 'sideways_use_sma': False, 'sideways_use_ema': False, 'sideways_use_atr': False, 'sideways_use_adx': False, 'sideways_use_spike': False, 'sideways_rsi_required': True}.
[I 2025-08-30 16:35:02,425] Trial 458 finished with values: [-1000000000.0, 1000000000.0] and parameters: {'p_sma': 13, 'p_std': 15, 'p_atr': 14, 'p_adx': 29, 'rsi_period': 15, 'ema1': 24, 'ema2': 49, 'slip_atr_k': 0.1354699923150575, 'slip_spread_k': 0.6405844933304007, 'spread_hl_frac': 0.012590007601879259, 'bb_std_mult': 3.433198083636605, 'rsi_os': 36, 'rsi_ob': 91, 'vol_spike': 0.19826222480617445, 'adx_thresh': 16.80764894997391, 'atr_min_pct': 0.02056679851322015, 'atr_max_pct': 0.020382648441249034, 'tp_mult': 2.9130891810160104, 'tsl_mult': 0.9336771056368, 'strategy': 'mean_reversion', 'time_stop': 228, 'use_sma': False, 'use_atr': False, 'use_adx': True, 'use_ema': False, 'use_spike': False, 'rsi_required': True, 'edge_k': 1.2313285045112923, 'edge_cap': 0.6707702878349482, 'bull_strategy': 'breakout', 'bull_bb_std_mult': 1.789321591294154, 'bull_rsi_os': 46, 'bull_rsi_ob': 69, 'bull_adx_thresh': 22.380196350526536, 'bull_atr_min_pct': 0.018698351423453746, 'bull_atr_max_pct': 0.14080069342074256, 'bull_tp_mult': 1.1826283220690026, 'bull_tsl_mult': 0.2648442850927301, 'bull_time_stop': 69, 'bull_use_sma': False, 'bull_use_ema': False, 'bull_use_atr': True, 'bull_use_adx': True, 'bull_use_spike': False, 'bull_rsi_required': False, 'bear_strategy': 'mean_reversion', 'bear_bb_std_mult': 2.205582714333406, 'bear_rsi_os': 13, 'bear_rsi_ob': 63, 'bear_adx_thresh': 14.672797138271786, 'bear_atr_min_pct': 0.025583130344921216, 'bear_atr_max_pct': 0.09589094377619331, 'bear_tp_mult': 2.2598649295490696, 'bear_tsl_mult': 0.6357990852252288, 'bear_time_stop': 220, 'bear_use_sma': True, 'bear_use_ema': False, 'bear_use_atr': False, 'bear_use_adx': True, 'bear_use_spike': False, 'bear_rsi_required': True, 'sideways_strategy': 'mean_reversion', 'sideways_bb_std_mult': 1.9001199141162017, 'sideways_rsi_os': 29, 'sideways_rsi_ob': 91, 'sideways_adx_thresh': 8.413702074634857, 'sideways_atr_min_pct': 0.023428902268672714, 'sideways_atr_max_pct': 0.13817685408343408, 'sideways_tp_mult': 1.6017105492092958, 'sideways_tsl_mult': 0.46002352705596583, 'sideways_time_stop': 190, 'sideways_use_sma': True, 'sideways_use_ema': False, 'sideways_use_atr': False, 'sideways_use_adx': False, 'sideways_use_spike': True, 'sideways_rsi_required': True}.
[I 2025-08-30 16:35:47,074] Trial 459 finished with values: [-1000000000.0, 1000000000.0] and parameters: {'p_sma': 5, 'p_std': 14, 'p_atr': 28, 'p_adx': 20, 'rsi_period': 15, 'ema1': 27, 'ema2': 28, 'slip_atr_k': 0.2410300676831101, 'slip_spread_k': 0.6454571240202478, 'spread_hl_frac': 0.02621928873859123, 'bb_std_mult': 3.0454882449259917, 'rsi_os': 45, 'rsi_ob': 91, 'vol_spike': 0.005978828920733896, 'adx_thresh': 23.18968472569275, 'atr_min_pct': 0.014308639987276604, 'atr_max_pct': 0.13497750616294835, 'tp_mult': 2.9096209317737896, 'tsl_mult': 0.47640421164310326, 'strategy': 'mean_reversion', 'time_stop': 45, 'use_sma': False, 'use_atr': False, 'use_adx': True, 'use_ema': False, 'use_spike': False, 'rsi_required': True, 'edge_k': 1.5979828187242455, 'edge_cap': 0.5960270526550456, 'bull_strategy': 'breakout', 'bull_bb_std_mult': 1.7921454086605872, 'bull_rsi_os': 12, 'bull_rsi_ob': 63, 'bull_adx_thresh': 22.04210160249012, 'bull_atr_min_pct': 0.018572042209863044, 'bull_atr_max_pct': 0.0727881818871951, 'bull_tp_mult': 1.1874839603757439, 'bull_tsl_mult': 0.274317213196934, 'bull_time_stop': 196, 'bull_use_sma': False, 'bull_use_ema': False, 'bull_use_atr': True, 'bull_use_adx': True, 'bull_use_spike': False, 'bull_rsi_required': False, 'bear_strategy': 'mean_reversion', 'bear_bb_std_mult': 1.9781764026991249, 'bear_rsi_os': 47, 'bear_rsi_ob': 77, 'bear_adx_thresh': 26.512481026579117, 'bear_atr_min_pct': 0.02037026389289513, 'bear_atr_max_pct': 0.09915144080904187, 'bear_tp_mult': 1.5785967765741076, 'bear_tsl_mult': 0.9051064056567519, 'bear_time_stop': 33, 'bear_use_sma': True, 'bear_use_ema': False, 'bear_use_atr': False, 'bear_use_adx': True, 'bear_use_spike': False, 'bear_rsi_required': True, 'sideways_strategy': 'mean_reversion', 'sideways_bb_std_mult': 1.8817217210403905, 'sideways_rsi_os': 39, 'sideways_rsi_ob': 68, 'sideways_adx_thresh': 32.04899406586116, 'sideways_atr_min_pct': 0.015280548172859966, 'sideways_atr_max_pct': 0.13776575928378626, 'sideways_tp_mult': 2.239062702289373, 'sideways_tsl_mult': 0.4711928000438834, 'sideways_time_stop': 213, 'sideways_use_sma': True, 'sideways_use_ema': False, 'sideways_use_atr': False, 'sideways_use_adx': False, 'sideways_use_spike': True, 'sideways_rsi_required': True}.
[I 2025-08-30 16:35:47,871] Trial 457 finished with values: [-1000000000.0, 1000000000.0] and parameters: {'p_sma': 6, 'p_std': 45, 'p_atr': 20, 'p_adx': 8, 'rsi_period': 15, 'ema1': 24, 'ema2': 14, 'slip_atr_k': 0.1361451382833226, 'slip_spread_k': 0.08721449173351048, 'spread_hl_frac': 0.012366066361535102, 'bb_std_mult': 0.6484776468427929, 'rsi_os': 35, 'rsi_ob': 90, 'vol_spike': 2.5286940237385442e-05, 'adx_thresh': 33.76196411178697, 'atr_min_pct': 0.006622738384104945, 'atr_max_pct': 0.1475342421004575, 'tp_mult': 1.3562854604434706, 'tsl_mult': 0.14300709341064738, 'strategy': 'mean_reversion', 'time_stop': 150, 'use_sma': False, 'use_atr': True, 'use_adx': True, 'use_ema': False, 'use_spike': False, 'rsi_required': True, 'edge_k': 1.5862503848928418, 'edge_cap': 0.6646031336296843, 'bull_strategy': 'mean_reversion', 'bull_bb_std_mult': 0.9194972617562778, 'bull_rsi_os': 41, 'bull_rsi_ob': 51, 'bull_adx_thresh': 34.93764144130725, 'bull_atr_min_pct': 0.02094488272660904, 'bull_atr_max_pct': 0.1264725458357075, 'bull_tp_mult': 1.1883569172477404, 'bull_tsl_mult': 0.49569793586322636, 'bull_time_stop': 50, 'bull_use_sma': False, 'bull_use_ema': True, 'bull_use_atr': True, 'bull_use_adx': True, 'bull_use_spike': False, 'bull_rsi_required': False, 'bear_strategy': 'mean_reversion', 'bear_bb_std_mult': 2.190082184552521, 'bear_rsi_os': 13, 'bear_rsi_ob': 59, 'bear_adx_thresh': 14.951285900688086, 'bear_atr_min_pct': 0.024206794336404172, 'bear_atr_max_pct': 0.057179369855885794, 'bear_tp_mult': 1.0214636353121862, 'bear_tsl_mult': 0.6335929037706245, 'bear_time_stop': 39, 'bear_use_sma': True, 'bear_use_ema': False, 'bear_use_atr': False, 'bear_use_adx': False, 'bear_use_spike': False, 'bear_rsi_required': False, 'sideways_strategy': 'breakout', 'sideways_bb_std_mult': 2.113669385934334, 'sideways_rsi_os': 39, 'sideways_rsi_ob': 92, 'sideways_adx_thresh': 15.519354943667526, 'sideways_atr_min_pct': 0.023491381309849332, 'sideways_atr_max_pct': 0.1390743385916679, 'sideways_tp_mult': 1.5116910654263838, 'sideways_tsl_mult': 0.26400771682189333, 'sideways_time_stop': 214, 'sideways_use_sma': True, 'sideways_use_ema': False, 'sideways_use_atr': False, 'sideways_use_adx': False, 'sideways_use_spike': False, 'sideways_rsi_required': True}.
