[I 2025-08-30 16:24:48,995] Trial 395 finished with values: [-1000000000.0, 1000000000.0] and parameters: {'p_sma': 55, 'p_std': 35, 'p_atr': 26, 'p_adx': 23, 'rsi_period': 20, 'ema1': 5, 'ema2': 11, 'slip_atr_k': 0.11001655035407759, 'slip_spread_k': 0.6514250371479183, 'spread_hl_frac': 0.019597772313890312, 'bb_std_mult': 3.0057666864596113, 'rsi_os': 35, 'rsi_ob': 74, 'vol_spike': 0.1509837114525954, 'adx_thresh': 11.119099221766575, 'atr_min_pct': 0.018979830104671597, 'atr_max_pct': 0.12741516021450042, 'tp_mult': 2.0381816339526546, 'tsl_mult': 0.43235524496994104, 'strategy': 'mean_reversion', 'time_stop': 25, 'use_sma': False, 'use_atr': True, 'use_adx': True, 'use_ema': True, 'use_spike': False, 'rsi_required': True, 'edge_k': 1.2594201643104075, 'edge_cap': 0.5444723792890283, 'bull_strategy': 'mean_reversion', 'bull_bb_std_mult': 0.6006448395490558, 'bull_rsi_os': 27, 'bull_rsi_ob': 58, 'bull_adx_thresh': 21.622468700989884, 'bull_atr_min_pct': 0.019188196512817807, 'bull_atr_max_pct': 0.06996456517478958, 'bull_tp_mult': 1.1660261596975081, 'bull_tsl_mult': 0.7879263327445325, 'bull_time_stop': 65, 'bull_use_sma': False, 'bull_use_ema': True, 'bull_use_atr': True, 'bull_use_adx': True, 'bull_use_spike': False, 'bull_rsi_required': False, 'bear_strategy': 'breakout', 'bear_bb_std_mult': 2.259336929430776, 'bear_rsi_os': 11, 'bear_rsi_ob': 79, 'bear_adx_thresh': 13.248897724746074, 'bear_atr_min_pct': 0.02114600272302833, 'bear_atr_max_pct': 0.013098746471850706, 'bear_tp_mult': 2.1736333570920943, 'bear_tsl_mult': 0.20446400621561284, 'bear_time_stop': 238, 'bear_use_sma': True, 'bear_use_ema': False, 'bear_use_atr': False, 'bear_use_adx': False, 'bear_use_spike': False, 'bear_rsi_required': True, 'sideways_strategy': 'breakout', 'sideways_bb_std_mult': 2.7167869215155664, 'sideways_rsi_os': 29, 'sideways_rsi_ob': 50, 'sideways_adx_thresh': 10.28579891506191, 'sideways_atr_min_pct': 0.014831391957244585, 'sideways_atr_max_pct': 0.0369182463142229, 'sideways_tp_mult': 1.412043383171524, 'sideways_tsl_mult': 0.29239007313494864, 'sideways_time_stop': 198, 'sideways_use_sma': False, 'sideways_use_ema': True, 'sideways_use_atr': True, 'sideways_use_adx': False, 'sideways_use_spike': False, 'sideways_rsi_required': True}.
[I 2025-08-30 16:24:49,011] Trial 394 finished with values: [-0.08283436805073108, 0.08275983436886038] and parameters: {'p_sma': 55, 'p_std': 57, 'p_atr': 26, 'p_adx': 23, 'rsi_period': 19, 'ema1': 11, 'ema2': 10, 'slip_atr_k': 8.784749737930642e-05, 'slip_spread_k': 0.2638406789630714, 'spread_hl_frac': 0.01845833481823577, 'bb_std_mult': 3.1243357779752072, 'rsi_os': 15, 'rsi_ob': 88, 'vol_spike': 0.15074961312835566, 'adx_thresh': 14.0076128683961, 'atr_min_pct': 0.016868441376824073, 'atr_max_pct': 0.1259119186799204, 'tp_mult': 2.927027810484474, 'tsl_mult': 0.6301926155884965, 'strategy': 'mean_reversion', 'time_stop': 26, 'use_sma': False, 'use_atr': True, 'use_adx': True, 'use_ema': False, 'use_spike': False, 'rsi_required': True, 'edge_k': 1.6362730587841963, 'edge_cap': 0.1255064566855188, 'bull_strategy': 'mean_reversion', 'bull_bb_std_mult': 2.2912803058058273, 'bull_rsi_os': 13, 'bull_rsi_ob': 82, 'bull_adx_thresh': 9.820034429510784, 'bull_atr_min_pct': 0.022323847438105462, 'bull_atr_max_pct': 0.13364106355897634, 'bull_tp_mult': 1.8678625977960954, 'bull_tsl_mult': 0.22092723676326875, 'bull_time_stop': 286, 'bull_use_sma': False, 'bull_use_ema': True, 'bull_use_atr': True, 'bull_use_adx': True, 'bull_use_spike': False, 'bull_rsi_required': False, 'bear_strategy': 'mean_reversion', 'bear_bb_std_mult': 1.876082955248981, 'bear_rsi_os': 11, 'bear_rsi_ob': 95, 'bear_adx_thresh': 13.532386353206528, 'bear_atr_min_pct': 0.024865361904262508, 'bear_atr_max_pct': 0.09046102122003745, 'bear_tp_mult': 2.1816709529217215, 'bear_tsl_mult': 0.13775770369498413, 'bear_time_stop': 111, 'bear_use_sma': True, 'bear_use_ema': False, 'bear_use_atr': False, 'bear_use_adx': False, 'bear_use_spike': False, 'bear_rsi_required': True, 'sideways_strategy': 'breakout', 'sideways_bb_std_mult': 2.082774682058754, 'sideways_rsi_os': 50, 'sideways_rsi_ob': 50, 'sideways_adx_thresh': 16.399371206003075, 'sideways_atr_min_pct': 0.0013022827806165914, 'sideways_atr_max_pct': 0.14705015087128445, 'sideways_tp_mult': 1.6877312861783982, 'sideways_tsl_mult': 0.2909479188976797, 'sideways_time_stop': 212, 'sideways_use_sma': False, 'sideways_use_ema': False, 'sideways_use_atr': True, 'sideways_use_adx': False, 'sideways_use_spike': False, 'sideways_rsi_required': True}.
[I 2025-08-30 16:24:49,708] Trial 399 finished with values: [-1000000000.0, 1000000000.0] and parameters: {'p_sma': 9, 'p_std': 59, 'p_atr': 22, 'p_adx': 27, 'rsi_period': 15, 'ema1': 26, 'ema2': 11, 'slip_atr_k': 0.009911542396656058, 'slip_spread_k': 0.5740339301430436, 'spread_hl_frac': 0.017431117221117804, 'bb_std_mult': 3.1423226147401477, 'rsi_os': 51, 'rsi_ob': 74, 'vol_spike': 0.017330350753094824, 'adx_thresh': 17.46043688041609, 'atr_min_pct': 0.01887970250535519, 'atr_max_pct': 0.10595033781501723, 'tp_mult': 2.9466702169216563, 'tsl_mult': 0.6342244678184276, 'strategy': 'mean_reversion', 'time_stop': 12, 'use_sma': False, 'use_atr': True, 'use_adx': True, 'use_ema': True, 'use_spike': False, 'rsi_required': True, 'edge_k': 1.170235771715776, 'edge_cap': 0.6400968307630688, 'bull_strategy': 'mean_reversion', 'bull_bb_std_mult': 1.9023648809977602, 'bull_rsi_os': 27, 'bull_rsi_ob': 49, 'bull_adx_thresh': 25.2065155112665, 'bull_atr_min_pct': 0.019284890911100194, 'bull_atr_max_pct': 0.04471696063766831, 'bull_tp_mult': 1.1623364220854282, 'bull_tsl_mult': 0.24103913722267367, 'bull_time_stop': 130, 'bull_use_sma': False, 'bull_use_ema': True, 'bull_use_atr': True, 'bull_use_adx': True, 'bull_use_spike': False, 'bull_rsi_required': False, 'bear_strategy': 'breakout', 'bear_bb_std_mult': 2.266347866131069, 'bear_rsi_os': 15, 'bear_rsi_ob': 78, 'bear_adx_thresh': 13.828223660824248, 'bear_atr_min_pct': 0.02481885401187758, 'bear_atr_max_pct': 0.09036592088418621, 'bear_tp_mult': 1.6979618187577235, 'bear_tsl_mult': 0.662462956429661, 'bear_time_stop': 222, 'bear_use_sma': True, 'bear_use_ema': False, 'bear_use_atr': False, 'bear_use_adx': False, 'bear_use_spike': False, 'bear_rsi_required': False, 'sideways_strategy': 'breakout', 'sideways_bb_std_mult': 2.0847074073234677, 'sideways_rsi_os': 28, 'sideways_rsi_ob': 95, 'sideways_adx_thresh': 32.72002883383191, 'sideways_atr_min_pct': 0.0004625673023824972, 'sideways_atr_max_pct': 0.1443992891499632, 'sideways_tp_mult': 2.2228309226180216, 'sideways_tsl_mult': 0.24715608210512807, 'sideways_time_stop': 36, 'sideways_use_sma': True, 'sideways_use_ema': True, 'sideways_use_atr': False, 'sideways_use_adx': False, 'sideways_use_spike': False, 'sideways_rsi_required': True}.
[I 2025-08-30 16:24:49,718] Trial 400 finished with values: [-1000000000.0, 1000000000.0] and parameters: {'p_sma': 37, 'p_std': 41, 'p_atr': 22, 'p_adx': 25, 'rsi_period': 16, 'ema1': 17, 'ema2': 21, 'slip_atr_k': 0.19693090578178074, 'slip_spread_k': 0.5735587497072787, 'spread_hl_frac': 0.016776832470925013, 'bb_std_mult': 3.1400621003920106, 'rsi_os': 52, 'rsi_ob': 92, 'vol_spike': 0.017058999298627094, 'adx_thresh': 9.785826144322652, 'atr_min_pct': 0.00023866761813816015, 'atr_max_pct': 0.013369753657747008, 'tp_mult': 2.9513444883112343, 'tsl_mult': 0.32126576974480975, 'strategy': 'mean_reversion', 'time_stop': 12, 'use_sma': False, 'use_atr': True, 'use_adx': True, 'use_ema': False, 'use_spike': False, 'rsi_required': True, 'edge_k': 1.4534415218552739, 'edge_cap': 0.6386076652542714, 'bull_strategy': 'mean_reversion', 'bull_bb_std_mult': 1.9025393381428382, 'bull_rsi_os': 11, 'bull_rsi_ob': 52, 'bull_adx_thresh': 17.010740077963007, 'bull_atr_min_pct': 0.020380613651901993, 'bull_atr_max_pct': 0.13781207877209053, 'bull_tp_mult': 1.370695551532141, 'bull_tsl_mult': 0.2398621970313053, 'bull_time_stop': 199, 'bull_use_sma': False, 'bull_use_ema': True, 'bull_use_atr': True, 'bull_use_adx': True, 'bull_use_spike': False, 'bull_rsi_required': False, 'bear_strategy': 'mean_reversion', 'bear_bb_std_mult': 2.1191691058078668, 'bear_rsi_os': 15, 'bear_rsi_ob': 78, 'bear_adx_thresh': 14.21225334430712, 'bear_atr_min_pct': 0.024775720127723572, 'bear_atr_max_pct': 0.09000979379936705, 'bear_tp_mult': 1.7557970727504741, 'bear_tsl_mult': 0.8361617106997696, 'bear_time_stop': 225, 'bear_use_sma': True, 'bear_use_ema': False, 'bear_use_atr': False, 'bear_use_adx': False, 'bear_use_spike': False, 'bear_rsi_required': False, 'sideways_strategy': 'breakout', 'sideways_bb_std_mult': 1.6022307426461968, 'sideways_rsi_os': 17, 'sideways_rsi_ob': 64, 'sideways_adx_thresh': 6.142606218041482, 'sideways_atr_min_pct': 0.0005563310058843422, 'sideways_atr_max_pct': 0.12374273486579636, 'sideways_tp_mult': 1.5445525138840965, 'sideways_tsl_mult': 0.4726786266815358, 'sideways_time_stop': 210, 'sideways_use_sma': True, 'sideways_use_ema': False, 'sideways_use_atr': False, 'sideways_use_adx': False, 'sideways_use_spike': False, 'sideways_rsi_required': True}.
[I 2025-08-30 16:24:50,617] Trial 402 finished with values: [-1000000000.0, 1000000000.0] and parameters: {'p_sma': 6, 'p_std': 50, 'p_atr': 28, 'p_adx': 9, 'rsi_period': 17, 'ema1': 17, 'ema2': 12, 'slip_atr_k': 0.00800870482701041, 'slip_spread_k': 0.6314960829736036, 'spread_hl_frac': 0.015056188332481273, 'bb_std_mult': 1.8491091245907245, 'rsi_os': 50, 'rsi_ob': 93, 'vol_spike': 3.789442732035164e-05, 'adx_thresh': 16.497246468284064, 'atr_min_pct': 0.0020825961859079634, 'atr_max_pct': 0.06437015537713385, 'tp_mult': 2.646832045783702, 'tsl_mult': 0.3238901785566034, 'strategy': 'mean_reversion', 'time_stop': 12, 'use_sma': True, 'use_atr': True, 'use_adx': True, 'use_ema': False, 'use_spike': False, 'rsi_required': True, 'edge_k': 0.8892550175223201, 'edge_cap': 0.9366472434384492, 'bull_strategy': 'mean_reversion', 'bull_bb_std_mult': 2.6465813025107243, 'bull_rsi_os': 7, 'bull_rsi_ob': 48, 'bull_adx_thresh': 19.709173896926742, 'bull_atr_min_pct': 0.02045356386938323, 'bull_atr_max_pct': 0.1386100337404704, 'bull_tp_mult': 1.3754417409523423, 'bull_tsl_mult': 0.26751117108525135, 'bull_time_stop': 93, 'bull_use_sma': False, 'bull_use_ema': True, 'bull_use_atr': True, 'bull_use_adx': True, 'bull_use_spike': False, 'bull_rsi_required': False, 'bear_strategy': 'mean_reversion', 'bear_bb_std_mult': 3.3326883608109314, 'bear_rsi_os': 13, 'bear_rsi_ob': 76, 'bear_adx_thresh': 9.937478829067153, 'bear_atr_min_pct': 0.022585210961662685, 'bear_atr_max_pct': 0.10760792173068369, 'bear_tp_mult': 1.7437144583346986, 'bear_tsl_mult': 0.8403469822809447, 'bear_time_stop': 216, 'bear_use_sma': True, 'bear_use_ema': False, 'bear_use_atr': False, 'bear_use_adx': True, 'bear_use_spike': False, 'bear_rsi_required': False, 'sideways_strategy': 'breakout', 'sideways_bb_std_mult': 2.0089189898347253, 'sideways_rsi_os': 30, 'sideways_rsi_ob': 85, 'sideways_adx_thresh': 15.395922142649155, 'sideways_atr_min_pct': 0.006015293975751885, 'sideways_atr_max_pct': 0.012279366219597035, 'sideways_tp_mult': 1.5539249543554594, 'sideways_tsl_mult': 0.4626880673316191, 'sideways_time_stop': 221, 'sideways_use_sma': True, 'sideways_use_ema': False, 'sideways_use_atr': False, 'sideways_use_adx': False, 'sideways_use_spike': False, 'sideways_rsi_required': True}.
[I 2025-08-30 16:25:28,454] Trial 401 finished with values: [-0.052341811514515446, 0.05225880086107535] and parameters: {'p_sma': 9, 'p_std': 50, 'p_atr': 22, 'p_adx': 25, 'rsi_period': 14, 'ema1': 26, 'ema2': 12, 'slip_atr_k': 0.2076495841296172, 'slip_spread_k': 0.5720243044981981, 'spread_hl_frac': 0.032273477866728614, 'bb_std_mult': 3.235523363063662, 'rsi_os': 26, 'rsi_ob': 75, 'vol_spike': 0.1797470789583841, 'adx_thresh': 16.193442438203473, 'atr_min_pct': 0.0019503700469008303, 'atr_max_pct': 0.06555471519303072, 'tp_mult': 1.8297157857260578, 'tsl_mult': 0.4769537268258474, 'strategy': 'mean_reversion', 'time_stop': 12, 'use_sma': True, 'use_atr': True, 'use_adx': True, 'use_ema': False, 'use_spike': False, 'rsi_required': True, 'edge_k': 0.8738490095514797, 'edge_cap': 0.6447393272223017, 'bull_strategy': 'mean_reversion', 'bull_bb_std_mult': 3.4179788395625224, 'bull_rsi_os': 11, 'bull_rsi_ob': 52, 'bull_adx_thresh': 23.28370799042151, 'bull_atr_min_pct': 0.00529483562477724, 'bull_atr_max_pct': 0.13818007883293928, 'bull_tp_mult': 1.0186035869572052, 'bull_tsl_mult': 0.24587167954288824, 'bull_time_stop': 73, 'bull_use_sma': False, 'bull_use_ema': True, 'bull_use_atr': True, 'bull_use_adx': True, 'bull_use_spike': False, 'bull_rsi_required': False, 'bear_strategy': 'mean_reversion', 'bear_bb_std_mult': 2.1375350835950444, 'bear_rsi_os': 6, 'bear_rsi_ob': 73, 'bear_adx_thresh': 9.148951113865623, 'bear_atr_min_pct': 0.02290048378605925, 'bear_atr_max_pct': 0.0983432363846871, 'bear_tp_mult': 1.735860099457098, 'bear_tsl_mult': 0.837889380350826, 'bear_time_stop': 222, 'bear_use_sma': True, 'bear_use_ema': False, 'bear_use_atr': False, 'bear_use_adx': True, 'bear_use_spike': False, 'bear_rsi_required': False, 'sideways_strategy': 'breakout', 'sideways_bb_std_mult': 1.9693263484397279, 'sideways_rsi_os': 28, 'sideways_rsi_ob': 84, 'sideways_adx_thresh': 15.3997896880745, 'sideways_atr_min_pct': 0.0008635592567990794, 'sideways_atr_max_pct': 0.12360366281130229, 'sideways_tp_mult': 1.5558398945635161, 'sideways_tsl_mult': 0.4637230151704096, 'sideways_time_stop': 171, 'sideways_use_sma': True, 'sideways_use_ema': False, 'sideways_use_atr': False, 'sideways_use_adx': False, 'sideways_use_spike': False, 'sideways_rsi_required': True}.
[I 2025-08-30 16:25:30,485] Trial 398 finished with values: [-1000000000.0, 1000000000.0] and parameters: {'p_sma': 46, 'p_std': 59, 'p_atr': 22, 'p_adx': 20, 'rsi_period': 70, 'ema1': 15, 'ema2': 21, 'slip_atr_k': 0.13205803000564648, 'slip_spread_k': 0.25865535970701425, 'spread_hl_frac': 0.03328703721536093, 'bb_std_mult': 2.4495586548463764, 'rsi_os': 46, 'rsi_ob': 92, 'vol_spike': 9.984938558766119e-05, 'adx_thresh': 12.846732683627245, 'atr_min_pct': 0.009624278560014549, 'atr_max_pct': 0.14078970834219978, 'tp_mult': 1.8513313928644017, 'tsl_mult': 0.6363112880828007, 'strategy': 'mean_reversion', 'time_stop': 51, 'use_sma': False, 'use_atr': True, 'use_adx': True, 'use_ema': True, 'use_spike': False, 'rsi_required': True, 'edge_k': 1.1658814693742778, 'edge_cap': 0.6437909945067223, 'bull_strategy': 'mean_reversion', 'bull_bb_std_mult': 3.4190529918017485, 'bull_rsi_os': 27, 'bull_rsi_ob': 48, 'bull_adx_thresh': 23.366814240126047, 'bull_atr_min_pct': 0.005508012168362041, 'bull_atr_max_pct': 0.1380764810766369, 'bull_tp_mult': 2.713433880194376, 'bull_tsl_mult': 0.25403828045974153, 'bull_time_stop': 90, 'bull_use_sma': False, 'bull_use_ema': True, 'bull_use_atr': True, 'bull_use_adx': True, 'bull_use_spike': False, 'bull_rsi_required': False, 'bear_strategy': 'breakout', 'bear_bb_std_mult': 2.079538989054029, 'bear_rsi_os': 6, 'bear_rsi_ob': 78, 'bear_adx_thresh': 9.926531714017527, 'bear_atr_min_pct': 0.023043523728901623, 'bear_atr_max_pct': 0.09050548962208346, 'bear_tp_mult': 2.3060764687865234, 'bear_tsl_mult': 0.6649495596735914, 'bear_time_stop': 113, 'bear_use_sma': True, 'bear_use_ema': False, 'bear_use_atr': False, 'bear_use_adx': False, 'bear_use_spike': False, 'bear_rsi_required': False, 'sideways_strategy': 'breakout', 'sideways_bb_std_mult': 1.9384882782551422, 'sideways_rsi_os': 20, 'sideways_rsi_ob': 45, 'sideways_adx_thresh': 32.662805991858605, 'sideways_atr_min_pct': 0.026302944080724235, 'sideways_atr_max_pct': 0.1476050313876806, 'sideways_tp_mult': 1.5669046852774446, 'sideways_tsl_mult': 0.3530315269715064, 'sideways_time_stop': 70, 'sideways_use_sma': True, 'sideways_use_ema': True, 'sideways_use_atr': False, 'sideways_use_adx': False, 'sideways_use_spike': False, 'sideways_rsi_required': True}.
[I 2025-08-30 16:25:32,177] Trial 403 finished with values: [-1000000000.0, 1000000000.0] and parameters: {'p_sma': 45, 'p_std': 50, 'p_atr': 24, 'p_adx': 25, 'rsi_period': 24, 'ema1': 26, 'ema2': 29, 'slip_atr_k': 0.00881089810966217, 'slip_spread_k': 0.5462484201949173, 'spread_hl_frac': 0.015607516188748807, 'bb_std_mult': 3.2372523769253823, 'rsi_os': 20, 'rsi_ob': 85, 'vol_spike': 3.0003199187468295e-05, 'adx_thresh': 18.694838916004013, 'atr_min_pct': 0.0294473940249094, 'atr_max_pct': 0.05807644202846293, 'tp_mult': 2.3700939518047823, 'tsl_mult': 0.8892619724611908, 'strategy': 'mean_reversion', 'time_stop': 300, 'use_sma': True, 'use_atr': True, 'use_adx': True, 'use_ema': False, 'use_spike': False, 'rsi_required': True, 'edge_k': 1.3156861690461326, 'edge_cap': 0.5885881808805611, 'bull_strategy': 'mean_reversion', 'bull_bb_std_mult': 3.4504243709443463, 'bull_rsi_os': 12, 'bull_rsi_ob': 85, 'bull_adx_thresh': 22.815538646099746, 'bull_atr_min_pct': 0.005466902609391155, 'bull_atr_max_pct': 0.13636252329414442, 'bull_tp_mult': 2.702359025814204, 'bull_tsl_mult': 0.2730579265683507, 'bull_time_stop': 92, 'bull_use_sma': False, 'bull_use_ema': True, 'bull_use_atr': True, 'bull_use_adx': True, 'bull_use_spike': False, 'bull_rsi_required': False, 'bear_strategy': 'mean_reversion', 'bear_bb_std_mult': 2.062749711946242, 'bear_rsi_os': 36, 'bear_rsi_ob': 87, 'bear_adx_thresh': 12.730151934622628, 'bear_atr_min_pct': 0.022607692565607084, 'bear_atr_max_pct': 0.10894200727123074, 'bear_tp_mult': 2.2972373060066085, 'bear_tsl_mult': 0.6406430462231097, 'bear_time_stop': 217, 'bear_use_sma': True, 'bear_use_ema': False, 'bear_use_atr': False, 'bear_use_adx': True, 'bear_use_spike': False, 'bear_rsi_required': False, 'sideways_strategy': 'breakout', 'sideways_bb_std_mult': 1.959235084169436, 'sideways_rsi_os': 20, 'sideways_rsi_ob': 85, 'sideways_adx_thresh': 15.297604504328422, 'sideways_atr_min_pct': 0.02898821274852697, 'sideways_atr_max_pct': 0.13379200639384398, 'sideways_tp_mult': 1.586783148293624, 'sideways_tsl_mult': 0.49878289991364405, 'sideways_time_stop': 176, 'sideways_use_sma': True, 'sideways_use_ema': False, 'sideways_use_atr': False, 'sideways_use_adx': False, 'sideways_use_spike': False, 'sideways_rsi_required': True}.
[I 2025-08-30 16:25:32,919] Trial 404 finished with values: [-1000000000.0, 1000000000.0] and parameters: {'p_sma': 45, 'p_std': 58, 'p_atr': 21, 'p_adx': 24, 'rsi_period': 70, 'ema1': 27, 'ema2': 19, 'slip_atr_k': 0.009267781842483783, 'slip_spread_k': 0.5492155620054924, 'spread_hl_frac': 0.016438157905149717, 'bb_std_mult': 3.2451705254067913, 'rsi_os': 36, 'rsi_ob': 85, 'vol_spike': 0.12002281261614946, 'adx_thresh': 12.706161909917201, 'atr_min_pct': 0.017869744255522145, 'atr_max_pct': 0.05339290823491036, 'tp_mult': 2.5271077504414583, 'tsl_mult': 0.4694872596734887, 'strategy': 'mean_reversion', 'time_stop': 241, 'use_sma': True, 'use_atr': True, 'use_adx': True, 'use_ema': False, 'use_spike': False, 'rsi_required': True, 'edge_k': 0.6754052483021737, 'edge_cap': 0.5837191945268642, 'bull_strategy': 'mean_reversion', 'bull_bb_std_mult': 1.7271744778399205, 'bull_rsi_os': 18, 'bull_rsi_ob': 50, 'bull_adx_thresh': 20.979008362913117, 'bull_atr_min_pct': 0.0055442994500996545, 'bull_atr_max_pct': 0.13673442160189436, 'bull_tp_mult': 1.0882917701032548, 'bull_tsl_mult': 0.9987158001782898, 'bull_time_stop': 246, 'bull_use_sma': False, 'bull_use_ema': True, 'bull_use_atr': True, 'bull_use_adx': True, 'bull_use_spike': False, 'bull_rsi_required': False, 'bear_strategy': 'mean_reversion', 'bear_bb_std_mult': 2.0553843948940598, 'bear_rsi_os': 14, 'bear_rsi_ob': 72, 'bear_adx_thresh': 12.643366626814387, 'bear_atr_min_pct': 0.022928561897589288, 'bear_atr_max_pct': 0.0981383560372615, 'bear_tp_mult': 1.8397874552942741, 'bear_tsl_mult': 0.6366326670456903, 'bear_time_stop': 102, 'bear_use_sma': True, 'bear_use_ema': False, 'bear_use_atr': False, 'bear_use_adx': True, 'bear_use_spike': False, 'bear_rsi_required': False, 'sideways_strategy': 'breakout', 'sideways_bb_std_mult': 3.4415138038833497, 'sideways_rsi_os': 19, 'sideways_rsi_ob': 47, 'sideways_adx_thresh': 17.94169826078766, 'sideways_atr_min_pct': 0.02061705806029513, 'sideways_atr_max_pct': 0.1366007923377183, 'sideways_tp_mult': 1.3159575358256745, 'sideways_tsl_mult': 0.4980851326723911, 'sideways_time_stop': 177, 'sideways_use_sma': True, 'sideways_use_ema': False, 'sideways_use_atr': False, 'sideways_use_adx': False, 'sideways_use_spike': False, 'sideways_rsi_required': True}.
