[I 2025-08-30 15:48:43,126] Trial 187 finished with values: [-1000000000.0, 1000000000.0] and parameters: {'p_sma': 15, 'p_std': 21, 'p_atr': 24, 'p_adx': 16, 'rsi_period': 37, 'ema1': 26, 'ema2': 11, 'slip_atr_k': 0.019402525273924026, 'slip_spread_k': 0.039537692307797676, 'spread_hl_frac': 0.00646513935964246, 'bb_std_mult': 2.896020594423609, 'rsi_os': 37, 'rsi_ob': 59, 'vol_spike': 0.027685583695041024, 'adx_thresh': 19.890873456922908, 'atr_min_pct': 0.0234382872420495, 'atr_max_pct': 0.14077036645307522, 'tp_mult': 1.1237609371621156, 'tsl_mult': 0.39344180968376974, 'strategy': 'breakout', 'time_stop': 277, 'use_sma': False, 'use_atr': True, 'use_adx': False, 'use_ema': False, 'use_spike': True, 'rsi_required': False, 'edge_k': 0.1763508438339361, 'edge_cap': 0.6049581734096648, 'bull_strategy': 'breakout', 'bull_bb_std_mult': 1.7451048907946376, 'bull_rsi_os': 24, 'bull_rsi_ob': 65, 'bull_adx_thresh': 5.281418488735708, 'bull_atr_min_pct': 0.00669093042639092, 'bull_atr_max_pct': 0.05413800573088768, 'bull_tp_mult': 2.6441601316034617, 'bull_tsl_mult': 0.40825269140319875, 'bull_time_stop': 103, 'bull_use_sma': True, 'bull_use_ema': True, 'bull_use_atr': False, 'bull_use_adx': False, 'bull_use_spike': False, 'bull_rsi_required': True, 'bear_strategy': 'mean_reversion', 'bear_bb_std_mult': 0.8370402306234848, 'bear_rsi_os': 7, 'bear_rsi_ob': 83, 'bear_adx_thresh': 11.305641203336927, 'bear_atr_min_pct': 0.029004828135251615, 'bear_atr_max_pct': 0.09336804877123604, 'bear_tp_mult': 2.312353484002672, 'bear_tsl_mult': 0.4849137103767698, 'bear_time_stop': 273, 'bear_use_sma': False, 'bear_use_ema': False, 'bear_use_atr': False, 'bear_use_adx': False, 'bear_use_spike': True, 'bear_rsi_required': False, 'sideways_strategy': 'breakout', 'sideways_bb_std_mult': 3.496283841471331, 'sideways_rsi_os': 30, 'sideways_rsi_ob': 89, 'sideways_adx_thresh': 12.121405028843421, 'sideways_atr_min_pct': 0.002363404577368556, 'sideways_atr_max_pct': 0.09448774065739558, 'sideways_tp_mult': 2.7811307444863496, 'sideways_tsl_mult': 0.8968046949074188, 'sideways_time_stop': 221, 'sideways_use_sma': True, 'sideways_use_ema': False, 'sideways_use_atr': True, 'sideways_use_adx': True, 'sideways_use_spike': True, 'sideways_rsi_required': True}.
[I 2025-08-30 15:48:43,127] Trial 190 finished with values: [-0.012762191189960137, 0.012869025402350522] and parameters: {'p_sma': 15, 'p_std': 19, 'p_atr': 25, 'p_adx': 18, 'rsi_period': 39, 'ema1': 26, 'ema2': 32, 'slip_atr_k': 0.0075265277539915045, 'slip_spread_k': 0.0013804495189876354, 'spread_hl_frac': 0.04534811739173689, 'bb_std_mult': 2.8744427024705868, 'rsi_os': 37, 'rsi_ob': 61, 'vol_spike': 0.017857445648922124, 'adx_thresh': 19.171735390499563, 'atr_min_pct': 0.01864452657356494, 'atr_max_pct': 0.14090186493508275, 'tp_mult': 1.2005037982106672, 'tsl_mult': 0.3476521953296809, 'strategy': 'breakout', 'time_stop': 275, 'use_sma': False, 'use_atr': True, 'use_adx': False, 'use_ema': False, 'use_spike': True, 'rsi_required': False, 'edge_k': 0.1535987030563659, 'edge_cap': 0.697957439442598, 'bull_strategy': 'breakout', 'bull_bb_std_mult': 1.742956360285188, 'bull_rsi_os': 24, 'bull_rsi_ob': 67, 'bull_adx_thresh': 16.391602500941698, 'bull_atr_min_pct': 0.002880990530761844, 'bull_atr_max_pct': 0.044856893157320596, 'bull_tp_mult': 1.2876495340760743, 'bull_tsl_mult': 0.41075326961766156, 'bull_time_stop': 70, 'bull_use_sma': True, 'bull_use_ema': False, 'bull_use_atr': False, 'bull_use_adx': False, 'bull_use_spike': True, 'bull_rsi_required': True, 'bear_strategy': 'mean_reversion', 'bear_bb_std_mult': 2.1993662157458544, 'bear_rsi_os': 20, 'bear_rsi_ob': 78, 'bear_adx_thresh': 14.068853692420184, 'bear_atr_min_pct': 0.029009651070936716, 'bear_atr_max_pct': 0.01585686935274662, 'bear_tp_mult': 2.30017850191684, 'bear_tsl_mult': 0.6339513990854818, 'bear_time_stop': 271, 'bear_use_sma': False, 'bear_use_ema': False, 'bear_use_atr': False, 'bear_use_adx': False, 'bear_use_spike': True, 'bear_rsi_required': False, 'sideways_strategy': 'breakout', 'sideways_bb_std_mult': 3.485412010377819, 'sideways_rsi_os': 30, 'sideways_rsi_ob': 89, 'sideways_adx_thresh': 17.32412420827949, 'sideways_atr_min_pct': 0.0018373909421686447, 'sideways_atr_max_pct': 0.08809173192786436, 'sideways_tp_mult': 1.7439299514839137, 'sideways_tsl_mult': 0.9197614130349722, 'sideways_time_stop': 254, 'sideways_use_sma': True, 'sideways_use_ema': False, 'sideways_use_atr': True, 'sideways_use_adx': True, 'sideways_use_spike': True, 'sideways_rsi_required': True}.
[I 2025-08-30 15:49:31,519] Trial 193 finished with values: [-1000000000.0, 1000000000.0] and parameters: {'p_sma': 9, 'p_std': 19, 'p_atr': 24, 'p_adx': 17, 'rsi_period': 34, 'ema1': 25, 'ema2': 32, 'slip_atr_k': 0.00843717002967101, 'slip_spread_k': 0.12335664815395272, 'spread_hl_frac': 0.04584391598275592, 'bb_std_mult': 2.9961658768612254, 'rsi_os': 36, 'rsi_ob': 61, 'vol_spike': 0.01604973616650099, 'adx_thresh': 5.643977695509653, 'atr_min_pct': 0.018848816331601865, 'atr_max_pct': 0.11901009342685513, 'tp_mult': 1.0551436950458306, 'tsl_mult': 0.43486611589636626, 'strategy': 'breakout', 'time_stop': 275, 'use_sma': False, 'use_atr': True, 'use_adx': False, 'use_ema': False, 'use_spike': True, 'rsi_required': False, 'edge_k': 1.8652179915796137, 'edge_cap': 0.6982319709487455, 'bull_strategy': 'breakout', 'bull_bb_std_mult': 1.671870027278644, 'bull_rsi_os': 6, 'bull_rsi_ob': 82, 'bull_adx_thresh': 6.820496936990212, 'bull_atr_min_pct': 0.010021753888669806, 'bull_atr_max_pct': 0.05786104215189207, 'bull_tp_mult': 1.3181237983708178, 'bull_tsl_mult': 0.3812755452200694, 'bull_time_stop': 68, 'bull_use_sma': True, 'bull_use_ema': False, 'bull_use_atr': False, 'bull_use_adx': False, 'bull_use_spike': True, 'bull_rsi_required': True, 'bear_strategy': 'mean_reversion', 'bear_bb_std_mult': 2.2014775697786453, 'bear_rsi_os': 16, 'bear_rsi_ob': 80, 'bear_adx_thresh': 9.649421427573843, 'bear_atr_min_pct': 0.02946135172454905, 'bear_atr_max_pct': 0.08573923752893989, 'bear_tp_mult': 2.407645693391381, 'bear_tsl_mult': 0.0015885885243652198, 'bear_time_stop': 129, 'bear_use_sma': False, 'bear_use_ema': False, 'bear_use_atr': False, 'bear_use_adx': False, 'bear_use_spike': True, 'bear_rsi_required': False, 'sideways_strategy': 'breakout', 'sideways_bb_std_mult': 3.2929110259815966, 'sideways_rsi_os': 28, 'sideways_rsi_ob': 85, 'sideways_adx_thresh': 14.912818878121271, 'sideways_atr_min_pct': 0.0033190315271060906, 'sideways_atr_max_pct': 0.08869294789222162, 'sideways_tp_mult': 1.7364018375626908, 'sideways_tsl_mult': 0.9581122616075974, 'sideways_time_stop': 209, 'sideways_use_sma': True, 'sideways_use_ema': False, 'sideways_use_atr': False, 'sideways_use_adx': True, 'sideways_use_spike': False, 'sideways_rsi_required': True}.
[I 2025-08-30 15:49:32,082] Trial 194 finished with values: [-1000000000.0, 1000000000.0] and parameters: {'p_sma': 9, 'p_std': 28, 'p_atr': 24, 'p_adx': 17, 'rsi_period': 34, 'ema1': 25, 'ema2': 32, 'slip_atr_k': 0.005339703987451404, 'slip_spread_k': 0.5788958235332352, 'spread_hl_frac': 0.008727807044636087, 'bb_std_mult': 3.0136982395162013, 'rsi_os': 36, 'rsi_ob': 61, 'vol_spike': 0.01844372184117777, 'adx_thresh': 11.449759730763574, 'atr_min_pct': 0.018403768695088495, 'atr_max_pct': 0.14718085734605887, 'tp_mult': 1.2142020328477616, 'tsl_mult': 0.4359351309944506, 'strategy': 'breakout', 'time_stop': 254, 'use_sma': False, 'use_atr': True, 'use_adx': False, 'use_ema': False, 'use_spike': True, 'rsi_required': False, 'edge_k': 1.0672285391549527, 'edge_cap': 0.691070866367649, 'bull_strategy': 'breakout', 'bull_bb_std_mult': 1.6297106614764698, 'bull_rsi_os': 43, 'bull_rsi_ob': 70, 'bull_adx_thresh': 16.763270743371166, 'bull_atr_min_pct': 0.004346622038004072, 'bull_atr_max_pct': 0.05855399002277891, 'bull_tp_mult': 2.5189845982710883, 'bull_tsl_mult': 0.37076105860890496, 'bull_time_stop': 82, 'bull_use_sma': True, 'bull_use_ema': False, 'bull_use_atr': False, 'bull_use_adx': False, 'bull_use_spike': True, 'bull_rsi_required': True, 'bear_strategy': 'mean_reversion', 'bear_bb_std_mult': 2.207532195682711, 'bear_rsi_os': 16, 'bear_rsi_ob': 51, 'bear_adx_thresh': 24.51746232044806, 'bear_atr_min_pct': 0.028277769281127376, 'bear_atr_max_pct': 0.016558253777571377, 'bear_tp_mult': 2.2263122613025232, 'bear_tsl_mult': 0.5200012778737362, 'bear_time_stop': 248, 'bear_use_sma': False, 'bear_use_ema': False, 'bear_use_atr': False, 'bear_use_adx': False, 'bear_use_spike': True, 'bear_rsi_required': False, 'sideways_strategy': 'breakout', 'sideways_bb_std_mult': 3.150245565000823, 'sideways_rsi_os': 29, 'sideways_rsi_ob': 86, 'sideways_adx_thresh': 16.995600317219363, 'sideways_atr_min_pct': 0.0032696216987197838, 'sideways_atr_max_pct': 0.08891398305939403, 'sideways_tp_mult': 2.695929130000513, 'sideways_tsl_mult': 0.5624670246330041, 'sideways_time_stop': 233, 'sideways_use_sma': True, 'sideways_use_ema': False, 'sideways_use_atr': False, 'sideways_use_adx': True, 'sideways_use_spike': False, 'sideways_rsi_required': True}.
[I 2025-08-30 15:49:32,566] Trial 191 finished with values: [-1000000000.0, 1000000000.0] and parameters: {'p_sma': 9, 'p_std': 40, 'p_atr': 24, 'p_adx': 17, 'rsi_period': 34, 'ema1': 25, 'ema2': 32, 'slip_atr_k': 0.0064273783262126065, 'slip_spread_k': 0.5750736611978249, 'spread_hl_frac': 0.04497642025516476, 'bb_std_mult': 0.8381409697254669, 'rsi_os': 36, 'rsi_ob': 61, 'vol_spike': 0.01605073797983631, 'adx_thresh': 10.570293174882464, 'atr_min_pct': 0.018311602332049474, 'atr_max_pct': 0.08000289512042613, 'tp_mult': 1.1927641072858686, 'tsl_mult': 0.43576960372485946, 'strategy': 'breakout', 'time_stop': 102, 'use_sma': False, 'use_atr': True, 'use_adx': False, 'use_ema': False, 'use_spike': True, 'rsi_required': False, 'edge_k': 1.8170722357282107, 'edge_cap': 0.6920472991880726, 'bull_strategy': 'breakout', 'bull_bb_std_mult': 1.6447558119504455, 'bull_rsi_os': 22, 'bull_rsi_ob': 84, 'bull_adx_thresh': 16.382758066829727, 'bull_atr_min_pct': 0.0016487863727137747, 'bull_atr_max_pct': 0.058162531397124725, 'bull_tp_mult': 2.5183865083388404, 'bull_tsl_mult': 0.36755409389013094, 'bull_time_stop': 70, 'bull_use_sma': True, 'bull_use_ema': False, 'bull_use_atr': False, 'bull_use_adx': False, 'bull_use_spike': True, 'bull_rsi_required': True, 'bear_strategy': 'mean_reversion', 'bear_bb_std_mult': 2.2186132002007954, 'bear_rsi_os': 16, 'bear_rsi_ob': 63, 'bear_adx_thresh': 12.322604281111259, 'bear_atr_min_pct': 0.02939445678604613, 'bear_atr_max_pct': 0.08534961622009736, 'bear_tp_mult': 2.3962783278115722, 'bear_tsl_mult': 0.5285784780043709, 'bear_time_stop': 253, 'bear_use_sma': False, 'bear_use_ema': False, 'bear_use_atr': False, 'bear_use_adx': False, 'bear_use_spike': True, 'bear_rsi_required': False, 'sideways_strategy': 'breakout', 'sideways_bb_std_mult': 3.16214973384011, 'sideways_rsi_os': 28, 'sideways_rsi_ob': 85, 'sideways_adx_thresh': 26.593245576037567, 'sideways_atr_min_pct': 0.0018778336029464725, 'sideways_atr_max_pct': 0.04754622083387477, 'sideways_tp_mult': 2.685376126717269, 'sideways_tsl_mult': 0.9099444544421037, 'sideways_time_stop': 234, 'sideways_use_sma': True, 'sideways_use_ema': False, 'sideways_use_atr': False, 'sideways_use_adx': True, 'sideways_use_spike': False, 'sideways_rsi_required': True}.
[I 2025-08-30 15:49:32,883] Trial 192 finished with values: [-1000000000.0, 1000000000.0] and parameters: {'p_sma': 13, 'p_std': 40, 'p_atr': 24, 'p_adx': 17, 'rsi_period': 34, 'ema1': 25, 'ema2': 32, 'slip_atr_k': 0.007063676701111359, 'slip_spread_k': 0.5718671210661582, 'spread_hl_frac': 0.04559701583968332, 'bb_std_mult': 0.7796270467910129, 'rsi_os': 36, 'rsi_ob': 61, 'vol_spike': 0.01381298567359493, 'adx_thresh': 7.288381877305808, 'atr_min_pct': 0.025647995250791887, 'atr_max_pct': 0.14676814111043524, 'tp_mult': 1.2222637952563544, 'tsl_mult': 0.4392286413383628, 'strategy': 'breakout', 'time_stop': 79, 'use_sma': False, 'use_atr': True, 'use_adx': False, 'use_ema': False, 'use_spike': True, 'rsi_required': False, 'edge_k': 1.31664613576628, 'edge_cap': 0.6861183151302536, 'bull_strategy': 'breakout', 'bull_bb_std_mult': 1.6615851839417142, 'bull_rsi_os': 41, 'bull_rsi_ob': 70, 'bull_adx_thresh': 16.826084306084248, 'bull_atr_min_pct': 0.0014552201154829436, 'bull_atr_max_pct': 0.058449079780083145, 'bull_tp_mult': 2.5189333580645044, 'bull_tsl_mult': 0.37520126831462003, 'bull_time_stop': 71, 'bull_use_sma': True, 'bull_use_ema': False, 'bull_use_atr': False, 'bull_use_adx': False, 'bull_use_spike': True, 'bull_rsi_required': True, 'bear_strategy': 'mean_reversion', 'bear_bb_std_mult': 2.2186821891918305, 'bear_rsi_os': 16, 'bear_rsi_ob': 61, 'bear_adx_thresh': 12.1354510088838, 'bear_atr_min_pct': 0.02800526196343056, 'bear_atr_max_pct': 0.05134546908102228, 'bear_tp_mult': 2.223543460799423, 'bear_tsl_mult': 0.5243371921283428, 'bear_time_stop': 250, 'bear_use_sma': False, 'bear_use_ema': False, 'bear_use_atr': False, 'bear_use_adx': False, 'bear_use_spike': True, 'bear_rsi_required': False, 'sideways_strategy': 'breakout', 'sideways_bb_std_mult': 3.155212887375728, 'sideways_rsi_os': 28, 'sideways_rsi_ob': 86, 'sideways_adx_thresh': 17.138078735739484, 'sideways_atr_min_pct': 0.022813279834766186, 'sideways_atr_max_pct': 0.08894092682559288, 'sideways_tp_mult': 2.695692791613339, 'sideways_tsl_mult': 0.997893772128154, 'sideways_time_stop': 234, 'sideways_use_sma': True, 'sideways_use_ema': False, 'sideways_use_atr': False, 'sideways_use_adx': True, 'sideways_use_spike': False, 'sideways_rsi_required': True}.
[I 2025-08-30 15:50:15,794] Trial 198 finished with values: [-1000000000.0, 1000000000.0] and parameters: {'p_sma': 17, 'p_std': 49, 'p_atr': 25, 'p_adx': 18, 'rsi_period': 30, 'ema1': 24, 'ema2': 35, 'slip_atr_k': 0.0006179811406695525, 'slip_spread_k': 0.05124200518859047, 'spread_hl_frac': 0.016334836835273966, 'bb_std_mult': 3.0919401454952333, 'rsi_os': 39, 'rsi_ob': 57, 'vol_spike': 0.0006430578374177487, 'adx_thresh': 21.30358008341678, 'atr_min_pct': 0.02713103569380714, 'atr_max_pct': 0.13941946091623558, 'tp_mult': 1.9427200041325845, 'tsl_mult': 0.34797648082854726, 'strategy': 'breakout', 'time_stop': 270, 'use_sma': False, 'use_atr': True, 'use_adx': False, 'use_ema': False, 'use_spike': True, 'rsi_required': False, 'edge_k': 0.29846590895013947, 'edge_cap': 0.636987965436779, 'bull_strategy': 'mean_reversion', 'bull_bb_std_mult': 1.7081880350154361, 'bull_rsi_os': 20, 'bull_rsi_ob': 72, 'bull_adx_thresh': 32.744204918642595, 'bull_atr_min_pct': 0.0023978817515550735, 'bull_atr_max_pct': 0.13130156565456896, 'bull_tp_mult': 2.590129511141513, 'bull_tsl_mult': 0.4166582236844264, 'bull_time_stop': 82, 'bull_use_sma': True, 'bull_use_ema': True, 'bull_use_atr': False, 'bull_use_adx': False, 'bull_use_spike': False, 'bull_rsi_required': True, 'bear_strategy': 'mean_reversion', 'bear_bb_std_mult': 2.110562129970744, 'bear_rsi_os': 19, 'bear_rsi_ob': 47, 'bear_adx_thresh': 11.57799234644055, 'bear_atr_min_pct': 0.029955730599645035, 'bear_atr_max_pct': 0.05454278577762681, 'bear_tp_mult': 2.3332817164210535, 'bear_tsl_mult': 0.5881800689676776, 'bear_time_stop': 293, 'bear_use_sma': False, 'bear_use_ema': False, 'bear_use_atr': False, 'bear_use_adx': True, 'bear_use_spike': True, 'bear_rsi_required': True, 'sideways_strategy': 'mean_reversion', 'sideways_bb_std_mult': 3.270668269873465, 'sideways_rsi_os': 17, 'sideways_rsi_ob': 91, 'sideways_adx_thresh': 32.32613963492737, 'sideways_atr_min_pct': 0.00047070240585819225, 'sideways_atr_max_pct': 0.02605968407713688, 'sideways_tp_mult': 2.3716830109367377, 'sideways_tsl_mult': 0.9190641639185991, 'sideways_time_stop': 170, 'sideways_use_sma': True, 'sideways_use_ema': False, 'sideways_use_atr': False, 'sideways_use_adx': True, 'sideways_use_spike': False, 'sideways_rsi_required': True}.
[I 2025-08-30 15:50:16,105] Trial 197 finished with values: [-0.01050211874018947, 0.01058349315379027] and parameters: {'p_sma': 17, 'p_std': 48, 'p_atr': 25, 'p_adx': 18, 'rsi_period': 30, 'ema1': 6, 'ema2': 45, 'slip_atr_k': 0.0005350274869540808, 'slip_spread_k': 0.0038777659555788574, 'spread_hl_frac': 0.031486387065547225, 'bb_std_mult': 3.0967518294848078, 'rsi_os': 39, 'rsi_ob': 57, 'vol_spike': 0.011840188728715171, 'adx_thresh': 21.262660818982717, 'atr_min_pct': 0.021378348521015132, 'atr_max_pct': 0.14622472747300636, 'tp_mult': 1.076650283042471, 'tsl_mult': 0.41289153179121824, 'strategy': 'breakout', 'time_stop': 161, 'use_sma': False, 'use_atr': True, 'use_adx': False, 'use_ema': False, 'use_spike': True, 'rsi_required': False, 'edge_k': 0.8949475493501896, 'edge_cap': 0.6685004131764135, 'bull_strategy': 'mean_reversion', 'bull_bb_std_mult': 1.7211967417624603, 'bull_rsi_os': 40, 'bull_rsi_ob': 69, 'bull_adx_thresh': 32.723972502452504, 'bull_atr_min_pct': 0.002550438781497147, 'bull_atr_max_pct': 0.04831134517153194, 'bull_tp_mult': 2.469756705231193, 'bull_tsl_mult': 0.41935424681011524, 'bull_time_stop': 71, 'bull_use_sma': True, 'bull_use_ema': True, 'bull_use_atr': False, 'bull_use_adx': False, 'bull_use_spike': False, 'bull_rsi_required': True, 'bear_strategy': 'mean_reversion', 'bear_bb_std_mult': 2.3134597189488044, 'bear_rsi_os': 19, 'bear_rsi_ob': 82, 'bear_adx_thresh': 11.743890561627666, 'bear_atr_min_pct': 0.027697958683153022, 'bear_atr_max_pct': 0.0322028375794788, 'bear_tp_mult': 2.330454141648244, 'bear_tsl_mult': 0.6344141568053604, 'bear_time_stop': 238, 'bear_use_sma': False, 'bear_use_ema': False, 'bear_use_atr': False, 'bear_use_adx': True, 'bear_use_spike': True, 'bear_rsi_required': True, 'sideways_strategy': 'breakout', 'sideways_bb_std_mult': 3.5963688373038707, 'sideways_rsi_os': 25, 'sideways_rsi_ob': 92, 'sideways_adx_thresh': 17.166209786455426, 'sideways_atr_min_pct': 4.206469210980119e-05, 'sideways_atr_max_pct': 0.10344438795467652, 'sideways_tp_mult': 2.359548421380818, 'sideways_tsl_mult': 0.7441807546520915, 'sideways_time_stop': 226, 'sideways_use_sma': True, 'sideways_use_ema': False, 'sideways_use_atr': False, 'sideways_use_adx': True, 'sideways_use_spike': False, 'sideways_rsi_required': True}.
[I 2025-08-30 15:50:16,106] Trial 196 finished with values: [-1000000000.0, 1000000000.0] and parameters: {'p_sma': 13, 'p_std': 49, 'p_atr': 13, 'p_adx': 18, 'rsi_period': 34, 'ema1': 6, 'ema2': 38, 'slip_atr_k': 0.0005183489450201204, 'slip_spread_k': 0.06036036880303591, 'spread_hl_frac': 0.03162226255280112, 'bb_std_mult': 3.1089228892392775, 'rsi_os': 39, 'rsi_ob': 57, 'vol_spike': 0.01304671487595481, 'adx_thresh': 21.386297501186128, 'atr_min_pct': 0.027093527466044792, 'atr_max_pct': 0.14613567601188834, 'tp_mult': 1.1771778097705339, 'tsl_mult': 0.3463720804312837, 'strategy': 'breakout', 'time_stop': 77, 'use_sma': False, 'use_atr': True, 'use_adx': False, 'use_ema': False, 'use_spike': True, 'rsi_required': False, 'edge_k': 0.8901696319240219, 'edge_cap': 0.5393042296296329, 'bull_strategy': 'mean_reversion', 'bull_bb_std_mult': 1.7275437564217868, 'bull_rsi_os': 25, 'bull_rsi_ob': 72, 'bull_adx_thresh': 33.103946875890536, 'bull_atr_min_pct': 0.0015437603859004404, 'bull_atr_max_pct': 0.04960779898245419, 'bull_tp_mult': 2.603666820530992, 'bull_tsl_mult': 0.42157734315302176, 'bull_time_stop': 72, 'bull_use_sma': True, 'bull_use_ema': True, 'bull_use_atr': False, 'bull_use_adx': False, 'bull_use_spike': False, 'bull_rsi_required': True, 'bear_strategy': 'mean_reversion', 'bear_bb_std_mult': 2.1292096423536315, 'bear_rsi_os': 19, 'bear_rsi_ob': 62, 'bear_adx_thresh': 7.2273401730448406, 'bear_atr_min_pct': 0.02993648204810361, 'bear_atr_max_pct': 0.06587795446594423, 'bear_tp_mult': 2.3224748658741543, 'bear_tsl_mult': 0.5862323704823708, 'bear_time_stop': 257, 'bear_use_sma': False, 'bear_use_ema': False, 'bear_use_atr': False, 'bear_use_adx': True, 'bear_use_spike': True, 'bear_rsi_required': True, 'sideways_strategy': 'breakout', 'sideways_bb_std_mult': 3.184442622568901, 'sideways_rsi_os': 28, 'sideways_rsi_ob': 91, 'sideways_adx_thresh': 16.790615249385255, 'sideways_atr_min_pct': 0.001862072476693944, 'sideways_atr_max_pct': 0.1030305615659133, 'sideways_tp_mult': 2.392669568460511, 'sideways_tsl_mult': 0.9168897027337797, 'sideways_time_stop': 225, 'sideways_use_sma': True, 'sideways_use_ema': False, 'sideways_use_atr': False, 'sideways_use_adx': True, 'sideways_use_spike': False, 'sideways_rsi_required': True}.
