[I 2025-08-30 17:40:28,847] Trial 845 finished with values: [-1000000000.0, 1000000000.0] and parameters: {'p_sma': 6, 'p_std': 20, 'p_atr': 17, 'p_adx': 8, 'rsi_period': 31, 'ema1': 19, 'ema2': 29, 'slip_atr_k': 0.011144031511395622, 'slip_spread_k': 0.4599843272383894, 'spread_hl_frac': 0.018052033497333104, 'bb_std_mult': 3.0240146978982736, 'rsi_os': 35, 'rsi_ob': 82, 'vol_spike': 0.10562369901444428, 'adx_thresh': 22.23081684078048, 'atr_min_pct': 0.013003689485200923, 'atr_max_pct': 0.1149168374091456, 'tp_mult': 2.754946022528565, 'tsl_mult': 0.29846542678121124, 'strategy': 'mean_reversion', 'time_stop': 276, 'use_sma': False, 'use_atr': True, 'use_adx': False, 'use_ema': False, 'use_spike': False, 'rsi_required': True, 'edge_k': 0.1038720709007821, 'edge_cap': 0.13014487076979692, 'bull_strategy': 'mean_reversion', 'bull_bb_std_mult': 2.339368632348188, 'bull_rsi_os': 37, 'bull_rsi_ob': 92, 'bull_adx_thresh': 34.117712173583605, 'bull_atr_min_pct': 0.02178490926636129, 'bull_atr_max_pct': 0.1452072552672729, 'bull_tp_mult': 2.2252723526449936, 'bull_tsl_mult': 0.8299193168098623, 'bull_time_stop': 54, 'bull_use_sma': True, 'bull_use_ema': True, 'bull_use_atr': False, 'bull_use_adx': True, 'bull_use_spike': False, 'bull_rsi_required': False, 'bear_strategy': 'mean_reversion', 'bear_bb_std_mult': 0.5009159333780282, 'bear_rsi_os': 19, 'bear_rsi_ob': 80, 'bear_adx_thresh': 18.414544027056536, 'bear_atr_min_pct': 0.02297912763512438, 'bear_atr_max_pct': 0.1374781897451874, 'bear_tp_mult': 1.679465941563244, 'bear_tsl_mult': 0.861764844509336, 'bear_time_stop': 213, 'bear_use_sma': True, 'bear_use_ema': False, 'bear_use_atr': False, 'bear_use_adx': False, 'bear_use_spike': False, 'bear_rsi_required': False, 'sideways_strategy': 'breakout', 'sideways_bb_std_mult': 3.5937641065623573, 'sideways_rsi_os': 35, 'sideways_rsi_ob': 90, 'sideways_adx_thresh': 11.568341873923908, 'sideways_atr_min_pct': 0.002386980105507782, 'sideways_atr_max_pct': 0.09890617187611678, 'sideways_tp_mult': 2.7977434845632883, 'sideways_tsl_mult': 0.41303511472879906, 'sideways_time_stop': 272, 'sideways_use_sma': True, 'sideways_use_ema': False, 'sideways_use_atr': False, 'sideways_use_adx': False, 'sideways_use_spike': True, 'sideways_rsi_required': True}.
[I 2025-08-30 17:40:29,009] Trial 846 finished with values: [-1000000000.0, 1000000000.0] and parameters: {'p_sma': 16, 'p_std': 23, 'p_atr': 17, 'p_adx': 8, 'rsi_period': 55, 'ema1': 17, 'ema2': 53, 'slip_atr_k': 0.21891465222775447, 'slip_spread_k': 0.1916107527831663, 'spread_hl_frac': 0.017370872419591593, 'bb_std_mult': 2.379230993414759, 'rsi_os': 8, 'rsi_ob': 61, 'vol_spike': 0.09181583703725504, 'adx_thresh': 10.48022247920661, 'atr_min_pct': 0.018317563537887632, 'atr_max_pct': 0.04968059060171884, 'tp_mult': 2.7651398690138604, 'tsl_mult': 0.9291124724137533, 'strategy': 'mean_reversion', 'time_stop': 128, 'use_sma': False, 'use_atr': True, 'use_adx': False, 'use_ema': False, 'use_spike': False, 'rsi_required': True, 'edge_k': 0.584235643840882, 'edge_cap': 0.9174498237331358, 'bull_strategy': 'mean_reversion', 'bull_bb_std_mult': 1.8737240691684254, 'bull_rsi_os': 37, 'bull_rsi_ob': 51, 'bull_adx_thresh': 34.98664686644152, 'bull_atr_min_pct': 0.008726423433849904, 'bull_atr_max_pct': 0.14419516678389752, 'bull_tp_mult': 2.2144886168941715, 'bull_tsl_mult': 0.8272218905619511, 'bull_time_stop': 64, 'bull_use_sma': True, 'bull_use_ema': True, 'bull_use_atr': False, 'bull_use_adx': True, 'bull_use_spike': False, 'bull_rsi_required': False, 'bear_strategy': 'mean_reversion', 'bear_bb_std_mult': 1.3289726787262612, 'bear_rsi_os': 19, 'bear_rsi_ob': 76, 'bear_adx_thresh': 13.587706054369791, 'bear_atr_min_pct': 0.023290334772352067, 'bear_atr_max_pct': 0.10244415192279173, 'bear_tp_mult': 1.7698996031681857, 'bear_tsl_mult': 0.15081705986950522, 'bear_time_stop': 282, 'bear_use_sma': False, 'bear_use_ema': False, 'bear_use_atr': False, 'bear_use_adx': False, 'bear_use_spike': False, 'bear_rsi_required': False, 'sideways_strategy': 'breakout', 'sideways_bb_std_mult': 0.7094346150420114, 'sideways_rsi_os': 35, 'sideways_rsi_ob': 59, 'sideways_adx_thresh': 11.647380306447966, 'sideways_atr_min_pct': 0.0026057949775451106, 'sideways_atr_max_pct': 0.09597010917354164, 'sideways_tp_mult': 2.799337696808206, 'sideways_tsl_mult': 0.5036997403146942, 'sideways_time_stop': 284, 'sideways_use_sma': True, 'sideways_use_ema': False, 'sideways_use_atr': False, 'sideways_use_adx': True, 'sideways_use_spike': True, 'sideways_rsi_required': True}.
[I 2025-08-30 17:40:29,944] Trial 850 finished with values: [-1000000000.0, 1000000000.0] and parameters: {'p_sma': 22, 'p_std': 21, 'p_atr': 21, 'p_adx': 9, 'rsi_period': 26, 'ema1': 18, 'ema2': 11, 'slip_atr_k': 0.2182653125280858, 'slip_spread_k': 0.18673036777113766, 'spread_hl_frac': 0.03764751241379869, 'bb_std_mult': 1.3346895949140498, 'rsi_os': 19, 'rsi_ob': 48, 'vol_spike': 0.20354614610842697, 'adx_thresh': 28.30050682286766, 'atr_min_pct': 0.018594459615123352, 'atr_max_pct': 0.1469704964254991, 'tp_mult': 2.7131338576402313, 'tsl_mult': 0.9035208190535241, 'strategy': 'mean_reversion', 'time_stop': 204, 'use_sma': False, 'use_atr': True, 'use_adx': True, 'use_ema': True, 'use_spike': False, 'rsi_required': True, 'edge_k': 1.0923696403459366, 'edge_cap': 0.9826641314885353, 'bull_strategy': 'mean_reversion', 'bull_bb_std_mult': 1.9187442718642396, 'bull_rsi_os': 24, 'bull_rsi_ob': 71, 'bull_adx_thresh': 10.052816679362985, 'bull_atr_min_pct': 0.008622449581320215, 'bull_atr_max_pct': 0.140885434623168, 'bull_tp_mult': 2.547686605524688, 'bull_tsl_mult': 0.5300732981406936, 'bull_time_stop': 90, 'bull_use_sma': True, 'bull_use_ema': False, 'bull_use_atr': False, 'bull_use_adx': True, 'bull_use_spike': False, 'bull_rsi_required': True, 'bear_strategy': 'breakout', 'bear_bb_std_mult': 0.9059290708736809, 'bear_rsi_os': 25, 'bear_rsi_ob': 76, 'bear_adx_thresh': 13.094452214474407, 'bear_atr_min_pct': 0.02226300543312738, 'bear_atr_max_pct': 0.10283874308866715, 'bear_tp_mult': 2.7430216004857715, 'bear_tsl_mult': 0.669259472409649, 'bear_time_stop': 281, 'bear_use_sma': False, 'bear_use_ema': True, 'bear_use_atr': False, 'bear_use_adx': False, 'bear_use_spike': False, 'bear_rsi_required': False, 'sideways_strategy': 'breakout', 'sideways_bb_std_mult': 0.748941614016295, 'sideways_rsi_os': 30, 'sideways_rsi_ob': 92, 'sideways_adx_thresh': 10.496399690047888, 'sideways_atr_min_pct': 0.0006832624611718976, 'sideways_atr_max_pct': 0.09524531465381611, 'sideways_tp_mult': 2.54565769733115, 'sideways_tsl_mult': 0.0006582226575259087, 'sideways_time_stop': 288, 'sideways_use_sma': True, 'sideways_use_ema': False, 'sideways_use_atr': True, 'sideways_use_adx': True, 'sideways_use_spike': False, 'sideways_rsi_required': False}.
[I 2025-08-30 17:41:08,881] Trial 851 finished with values: [-1000000000.0, 1000000000.0] and parameters: {'p_sma': 8, 'p_std': 6, 'p_atr': 20, 'p_adx': 9, 'rsi_period': 26, 'ema1': 18, 'ema2': 11, 'slip_atr_k': 0.19144068678849835, 'slip_spread_k': 0.1653233246481245, 'spread_hl_frac': 0.037181830253436535, 'bb_std_mult': 3.1691899409580238, 'rsi_os': 31, 'rsi_ob': 86, 'vol_spike': 0.1736699130929124, 'adx_thresh': 28.168098281080173, 'atr_min_pct': 0.022729980218818224, 'atr_max_pct': 0.03762447041508611, 'tp_mult': 2.4174080573111962, 'tsl_mult': 0.897987236195777, 'strategy': 'mean_reversion', 'time_stop': 20, 'use_sma': False, 'use_atr': True, 'use_adx': True, 'use_ema': True, 'use_spike': False, 'rsi_required': True, 'edge_k': 1.0798445917588744, 'edge_cap': 0.7989680061952661, 'bull_strategy': 'mean_reversion', 'bull_bb_std_mult': 0.9436743771856673, 'bull_rsi_os': 13, 'bull_rsi_ob': 54, 'bull_adx_thresh': 15.32873938638625, 'bull_atr_min_pct': 0.0066910749932857175, 'bull_atr_max_pct': 0.14050954671951868, 'bull_tp_mult': 2.286217384687571, 'bull_tsl_mult': 0.7536247216042172, 'bull_time_stop': 89, 'bull_use_sma': True, 'bull_use_ema': False, 'bull_use_atr': False, 'bull_use_adx': True, 'bull_use_spike': False, 'bull_rsi_required': True, 'bear_strategy': 'breakout', 'bear_bb_std_mult': 0.9135150457337005, 'bear_rsi_os': 25, 'bear_rsi_ob': 91, 'bear_adx_thresh': 12.917939592871843, 'bear_atr_min_pct': 0.019962010597819026, 'bear_atr_max_pct': 0.0381536990583764, 'bear_tp_mult': 1.921191182730073, 'bear_tsl_mult': 0.6736537416113666, 'bear_time_stop': 174, 'bear_use_sma': True, 'bear_use_ema': True, 'bear_use_atr': False, 'bear_use_adx': False, 'bear_use_spike': False, 'bear_rsi_required': False, 'sideways_strategy': 'breakout', 'sideways_bb_std_mult': 0.9580870405937364, 'sideways_rsi_os': 30, 'sideways_rsi_ob': 86, 'sideways_adx_thresh': 6.546737065133295, 'sideways_atr_min_pct': 0.013341533888230308, 'sideways_atr_max_pct': 0.12069294707076766, 'sideways_tp_mult': 2.966048962708722, 'sideways_tsl_mult': 0.3306660952647331, 'sideways_time_stop': 152, 'sideways_use_sma': True, 'sideways_use_ema': False, 'sideways_use_atr': True, 'sideways_use_adx': False, 'sideways_use_spike': False, 'sideways_rsi_required': False}.
[I 2025-08-30 17:41:09,454] Trial 848 finished with values: [-0.05400910866521713, 0.05397342839927636] and parameters: {'p_sma': 9, 'p_std': 20, 'p_atr': 16, 'p_adx': 12, 'rsi_period': 25, 'ema1': 18, 'ema2': 11, 'slip_atr_k': 0.2181336136295333, 'slip_spread_k': 0.8369213723188058, 'spread_hl_frac': 0.018535663934209447, 'bb_std_mult': 3.058849633789819, 'rsi_os': 35, 'rsi_ob': 78, 'vol_spike': 0.10841570087205321, 'adx_thresh': 10.685177095011849, 'atr_min_pct': 0.01855184765234846, 'atr_max_pct': 0.04929365102867146, 'tp_mult': 2.674349369835677, 'tsl_mult': 0.9010214474652989, 'strategy': 'mean_reversion', 'time_stop': 127, 'use_sma': False, 'use_atr': True, 'use_adx': False, 'use_ema': False, 'use_spike': False, 'rsi_required': True, 'edge_k': 0.62123163146077, 'edge_cap': 0.1285095407825808, 'bull_strategy': 'mean_reversion', 'bull_bb_std_mult': 1.886510168106397, 'bull_rsi_os': 13, 'bull_rsi_ob': 54, 'bull_adx_thresh': 16.64646710495655, 'bull_atr_min_pct': 0.023256434876204577, 'bull_atr_max_pct': 0.08056103126047798, 'bull_tp_mult': 2.417081085435414, 'bull_tsl_mult': 0.5257529253158069, 'bull_time_stop': 64, 'bull_use_sma': True, 'bull_use_ema': True, 'bull_use_atr': False, 'bull_use_adx': True, 'bull_use_spike': False, 'bull_rsi_required': False, 'bear_strategy': 'mean_reversion', 'bear_bb_std_mult': 1.3585410139024905, 'bear_rsi_os': 16, 'bear_rsi_ob': 76, 'bear_adx_thresh': 16.2003580839329, 'bear_atr_min_pct': 0.023158830761785633, 'bear_atr_max_pct': 0.10277883687759894, 'bear_tp_mult': 1.9698058025375178, 'bear_tsl_mult': 0.14600110726737642, 'bear_time_stop': 213, 'bear_use_sma': True, 'bear_use_ema': False, 'bear_use_atr': False, 'bear_use_adx': False, 'bear_use_spike': False, 'bear_rsi_required': False, 'sideways_strategy': 'breakout', 'sideways_bb_std_mult': 3.497208904740638, 'sideways_rsi_os': 34, 'sideways_rsi_ob': 71, 'sideways_adx_thresh': 32.419017196934874, 'sideways_atr_min_pct': 0.0007095326704666472, 'sideways_atr_max_pct': 0.09571217531611884, 'sideways_tp_mult': 2.9073595677668256, 'sideways_tsl_mult': 0.4088899032683384, 'sideways_time_stop': 285, 'sideways_use_sma': True, 'sideways_use_ema': False, 'sideways_use_atr': False, 'sideways_use_adx': False, 'sideways_use_spike': False, 'sideways_rsi_required': True}.
[I 2025-08-30 17:41:10,309] Trial 849 finished with values: [-0.032690718740551294, 0.03260505798281707] and parameters: {'p_sma': 9, 'p_std': 37, 'p_atr': 20, 'p_adx': 9, 'rsi_period': 26, 'ema1': 18, 'ema2': 30, 'slip_atr_k': 0.219827394601753, 'slip_spread_k': 0.18065789622325634, 'spread_hl_frac': 0.01785966802905635, 'bb_std_mult': 3.146675981981348, 'rsi_os': 35, 'rsi_ob': 72, 'vol_spike': 0.2781477822558819, 'adx_thresh': 8.724707080347967, 'atr_min_pct': 0.018420887961212246, 'atr_max_pct': 0.12264203738642655, 'tp_mult': 2.672020700284473, 'tsl_mult': 0.38078424997478977, 'strategy': 'mean_reversion', 'time_stop': 42, 'use_sma': False, 'use_atr': True, 'use_adx': True, 'use_ema': True, 'use_spike': False, 'rsi_required': True, 'edge_k': 0.5839937520598903, 'edge_cap': 0.124724954231133, 'bull_strategy': 'mean_reversion', 'bull_bb_std_mult': 0.6966385176774927, 'bull_rsi_os': 24, 'bull_rsi_ob': 77, 'bull_adx_thresh': 26.185001595843275, 'bull_atr_min_pct': 0.0030246310816349087, 'bull_atr_max_pct': 0.14038557724378573, 'bull_tp_mult': 2.3865652405513975, 'bull_tsl_mult': 0.5308794700464498, 'bull_time_stop': 64, 'bull_use_sma': True, 'bull_use_ema': False, 'bull_use_atr': False, 'bull_use_adx': True, 'bull_use_spike': False, 'bull_rsi_required': False, 'bear_strategy': 'breakout', 'bear_bb_std_mult': 1.3357357125852665, 'bear_rsi_os': 16, 'bear_rsi_ob': 76, 'bear_adx_thresh': 13.007231903482344, 'bear_atr_min_pct': 0.02326518720219966, 'bear_atr_max_pct': 0.10219541565961938, 'bear_tp_mult': 1.909771972889969, 'bear_tsl_mult': 0.07818785300988035, 'bear_time_stop': 212, 'bear_use_sma': True, 'bear_use_ema': False, 'bear_use_atr': False, 'bear_use_adx': False, 'bear_use_spike': False, 'bear_rsi_required': False, 'sideways_strategy': 'breakout', 'sideways_bb_std_mult': 1.304736354457166, 'sideways_rsi_os': 30, 'sideways_rsi_ob': 90, 'sideways_adx_thresh': 6.73202958770753, 'sideways_atr_min_pct': 0.0005890385457060802, 'sideways_atr_max_pct': 0.09521962310228099, 'sideways_tp_mult': 2.8110604393517686, 'sideways_tsl_mult': 0.49840589488456805, 'sideways_time_stop': 269, 'sideways_use_sma': True, 'sideways_use_ema': False, 'sideways_use_atr': False, 'sideways_use_adx': False, 'sideways_use_spike': True, 'sideways_rsi_required': True}.
[I 2025-08-30 17:41:11,032] Trial 852 finished with values: [-1000000000.0, 1000000000.0] and parameters: {'p_sma': 9, 'p_std': 19, 'p_atr': 10, 'p_adx': 9, 'rsi_period': 66, 'ema1': 6, 'ema2': 16, 'slip_atr_k': 0.004656338376746816, 'slip_spread_k': 0.15928585134330864, 'spread_hl_frac': 0.021228258253050327, 'bb_std_mult': 3.132820082378874, 'rsi_os': 31, 'rsi_ob': 86, 'vol_spike': 0.17119973420753015, 'adx_thresh': 11.179420016909964, 'atr_min_pct': 0.020096876315486324, 'atr_max_pct': 0.035681013311048455, 'tp_mult': 2.6897850666672833, 'tsl_mult': 0.9712968503623379, 'strategy': 'mean_reversion', 'time_stop': 20, 'use_sma': False, 'use_atr': True, 'use_adx': True, 'use_ema': False, 'use_spike': False, 'rsi_required': True, 'edge_k': 0.6448796370321439, 'edge_cap': 0.5386182646244185, 'bull_strategy': 'mean_reversion', 'bull_bb_std_mult': 1.775344388878045, 'bull_rsi_os': 9, 'bull_rsi_ob': 67, 'bull_adx_thresh': 14.669833173185193, 'bull_atr_min_pct': 0.006375241600223191, 'bull_atr_max_pct': 0.13658409318969253, 'bull_tp_mult': 2.2704612988477164, 'bull_tsl_mult': 0.7526299592334268, 'bull_time_stop': 75, 'bull_use_sma': True, 'bull_use_ema': True, 'bull_use_atr': False, 'bull_use_adx': True, 'bull_use_spike': False, 'bull_rsi_required': False, 'bear_strategy': 'mean_reversion', 'bear_bb_std_mult': 3.2140743764124906, 'bear_rsi_os': 27, 'bear_rsi_ob': 50, 'bear_adx_thresh': 11.580000997621326, 'bear_atr_min_pct': 0.025335881061804313, 'bear_atr_max_pct': 0.03743377986973717, 'bear_tp_mult': 1.9164568297879443, 'bear_tsl_mult': 0.34867159023039396, 'bear_time_stop': 30, 'bear_use_sma': True, 'bear_use_ema': False, 'bear_use_atr': False, 'bear_use_adx': False, 'bear_use_spike': False, 'bear_rsi_required': False, 'sideways_strategy': 'breakout', 'sideways_bb_std_mult': 0.9892225735878759, 'sideways_rsi_os': 33, 'sideways_rsi_ob': 84, 'sideways_adx_thresh': 32.48725111616277, 'sideways_atr_min_pct': 0.0016858570705662618, 'sideways_atr_max_pct': 0.026110569015871152, 'sideways_tp_mult': 2.966856971637143, 'sideways_tsl_mult': 0.48773741987259295, 'sideways_time_stop': 66, 'sideways_use_sma': True, 'sideways_use_ema': False, 'sideways_use_atr': False, 'sideways_use_adx': False, 'sideways_use_spike': False, 'sideways_rsi_required': True}.
[I 2025-08-30 17:41:47,622] Trial 854 finished with values: [-1000000000.0, 1000000000.0] and parameters: {'p_sma': 10, 'p_std': 42, 'p_atr': 16, 'p_adx': 13, 'rsi_period': 21, 'ema1': 13, 'ema2': 37, 'slip_atr_k': 0.003475094328237665, 'slip_spread_k': 0.7848234774349913, 'spread_hl_frac': 0.015215006735841249, 'bb_std_mult': 3.22242164683481, 'rsi_os': 32, 'rsi_ob': 66, 'vol_spike': 0.0870744937306407, 'adx_thresh': 11.72713181135327, 'atr_min_pct': 0.020040596196637245, 'atr_max_pct': 0.12155734882679518, 'tp_mult': 2.708641723275362, 'tsl_mult': 0.9652409812499047, 'strategy': 'mean_reversion', 'time_stop': 41, 'use_sma': False, 'use_atr': True, 'use_adx': True, 'use_ema': False, 'use_spike': False, 'rsi_required': True, 'edge_k': 0.4392975939063336, 'edge_cap': 0.7116976415220602, 'bull_strategy': 'mean_reversion', 'bull_bb_std_mult': 2.8425841367039415, 'bull_rsi_os': 43, 'bull_rsi_ob': 53, 'bull_adx_thresh': 34.47657076490003, 'bull_atr_min_pct': 0.0032456588841086095, 'bull_atr_max_pct': 0.135980150348948, 'bull_tp_mult': 2.396087434039365, 'bull_tsl_mult': 0.7801150750584483, 'bull_time_stop': 80, 'bull_use_sma': True, 'bull_use_ema': True, 'bull_use_atr': False, 'bull_use_adx': True, 'bull_use_spike': False, 'bull_rsi_required': False, 'bear_strategy': 'mean_reversion', 'bear_bb_std_mult': 1.469954915057786, 'bear_rsi_os': 16, 'bear_rsi_ob': 73, 'bear_adx_thresh': 11.706577927282622, 'bear_atr_min_pct': 0.004175695489483855, 'bear_atr_max_pct': 0.10812190643612464, 'bear_tp_mult': 2.518761520265324, 'bear_tsl_mult': 0.6355955421477271, 'bear_time_stop': 43, 'bear_use_sma': True, 'bear_use_ema': False, 'bear_use_atr': False, 'bear_use_adx': False, 'bear_use_spike': False, 'bear_rsi_required': False, 'sideways_strategy': 'mean_reversion', 'sideways_bb_std_mult': 0.8279120979456266, 'sideways_rsi_os': 33, 'sideways_rsi_ob': 95, 'sideways_adx_thresh': 8.073784561316293, 'sideways_atr_min_pct': 0.0017767918710107705, 'sideways_atr_max_pct': 0.09170998702311017, 'sideways_tp_mult': 2.036831657432396, 'sideways_tsl_mult': 0.8790971573058518, 'sideways_time_stop': 269, 'sideways_use_sma': True, 'sideways_use_ema': False, 'sideways_use_atr': False, 'sideways_use_adx': False, 'sideways_use_spike': False, 'sideways_rsi_required': True}.
[I 2025-08-30 17:41:48,766] Trial 855 finished with values: [-1000000000.0, 1000000000.0] and parameters: {'p_sma': 11, 'p_std': 26, 'p_atr': 16, 'p_adx': 8, 'rsi_period': 48, 'ema1': 13, 'ema2': 16, 'slip_atr_k': 0.0036653875892718856, 'slip_spread_k': 0.9141283143696766, 'spread_hl_frac': 0.03289356324378425, 'bb_std_mult': 3.2298204115579536, 'rsi_os': 32, 'rsi_ob': 95, 'vol_spike': 0.08611284403256286, 'adx_thresh': 26.774305984095406, 'atr_min_pct': 0.0006341576538353814, 'atr_max_pct': 0.1461838138550413, 'tp_mult': 2.8253766055528224, 'tsl_mult': 0.9667944615928388, 'strategy': 'breakout', 'time_stop': 26, 'use_sma': False, 'use_atr': False, 'use_adx': True, 'use_ema': False, 'use_spike': False, 'rsi_required': False, 'edge_k': 0.9443528667104725, 'edge_cap': 0.8382140643823134, 'bull_strategy': 'mean_reversion', 'bull_bb_std_mult': 1.7610222815947472, 'bull_rsi_os': 12, 'bull_rsi_ob': 53, 'bull_adx_thresh': 8.542461787541221, 'bull_atr_min_pct': 0.029880708104687098, 'bull_atr_max_pct': 0.07255023674762406, 'bull_tp_mult': 1.9489621231970826, 'bull_tsl_mult': 0.6428128629525196, 'bull_time_stop': 294, 'bull_use_sma': True, 'bull_use_ema': True, 'bull_use_atr': False, 'bull_use_adx': False, 'bull_use_spike': False, 'bull_rsi_required': False, 'bear_strategy': 'mean_reversion', 'bear_bb_std_mult': 3.2101655047933897, 'bear_rsi_os': 27, 'bear_rsi_ob': 72, 'bear_adx_thresh': 11.547172372898702, 'bear_atr_min_pct': 0.020610978968958485, 'bear_atr_max_pct': 0.10730278927804146, 'bear_tp_mult': 2.5416492911945108, 'bear_tsl_mult': 0.6342973697047244, 'bear_time_stop': 203, 'bear_use_sma': True, 'bear_use_ema': False, 'bear_use_atr': False, 'bear_use_adx': True, 'bear_use_spike': True, 'bear_rsi_required': True, 'sideways_strategy': 'mean_reversion', 'sideways_bb_std_mult': 1.5100900161427515, 'sideways_rsi_os': 42, 'sideways_rsi_ob': 95, 'sideways_adx_thresh': 8.358985899470177, 'sideways_atr_min_pct': 0.009269278760810427, 'sideways_atr_max_pct': 0.06085178091638861, 'sideways_tp_mult': 2.4149174983069397, 'sideways_tsl_mult': 0.4465269622505216, 'sideways_time_stop': 249, 'sideways_use_sma': False, 'sideways_use_ema': False, 'sideways_use_atr': False, 'sideways_use_adx': False, 'sideways_use_spike': False, 'sideways_rsi_required': True}.
