[I 2025-08-30 16:29:32,512] Trial 425 finished with values: [-1000000000.0, 1000000000.0] and parameters: {'p_sma': 5, 'p_std': 59, 'p_atr': 13, 'p_adx': 27, 'rsi_period': 83, 'ema1': 27, 'ema2': 13, 'slip_atr_k': 0.11961070402848205, 'slip_spread_k': 0.8475208416717033, 'spread_hl_frac': 0.029139686877334633, 'bb_std_mult': 3.3475742691840105, 'rsi_os': 36, 'rsi_ob': 91, 'vol_spike': 0.013177145956305467, 'adx_thresh': 12.312618927020996, 'atr_min_pct': 0.016150202409373517, 'atr_max_pct': 0.13815720915660096, 'tp_mult': 2.9151999447614014, 'tsl_mult': 0.49800809506659593, 'strategy': 'mean_reversion', 'time_stop': 62, 'use_sma': False, 'use_atr': True, 'use_adx': True, 'use_ema': False, 'use_spike': False, 'rsi_required': True, 'edge_k': 1.4593678337776732, 'edge_cap': 0.6356797118671424, 'bull_strategy': 'mean_reversion', 'bull_bb_std_mult': 2.1386839386892658, 'bull_rsi_os': 40, 'bull_rsi_ob': 66, 'bull_adx_thresh': 14.51126326033066, 'bull_atr_min_pct': 0.018761510916529882, 'bull_atr_max_pct': 0.1353821788453409, 'bull_tp_mult': 1.3979771168202189, 'bull_tsl_mult': 0.8872149054658438, 'bull_time_stop': 70, 'bull_use_sma': False, 'bull_use_ema': True, 'bull_use_atr': True, 'bull_use_adx': True, 'bull_use_spike': False, 'bull_rsi_required': False, 'bear_strategy': 'mean_reversion', 'bear_bb_std_mult': 2.076979928544442, 'bear_rsi_os': 13, 'bear_rsi_ob': 62, 'bear_adx_thresh': 11.475358425183323, 'bear_atr_min_pct': 0.012762642990455831, 'bear_atr_max_pct': 0.09302022608265921, 'bear_tp_mult': 2.196913323701921, 'bear_tsl_mult': 0.3364633753043036, 'bear_time_stop': 133, 'bear_use_sma': True, 'bear_use_ema': True, 'bear_use_atr': True, 'bear_use_adx': False, 'bear_use_spike': False, 'bear_rsi_required': False, 'sideways_strategy': 'breakout', 'sideways_bb_std_mult': 1.92520321781395, 'sideways_rsi_os': 37, 'sideways_rsi_ob': 70, 'sideways_adx_thresh': 5.501528014986526, 'sideways_atr_min_pct': 0.01034941435330387, 'sideways_atr_max_pct': 0.14122518512105744, 'sideways_tp_mult': 1.4218603057353811, 'sideways_tsl_mult': 0.3315567593318765, 'sideways_time_stop': 194, 'sideways_use_sma': False, 'sideways_use_ema': False, 'sideways_use_atr': True, 'sideways_use_adx': False, 'sideways_use_spike': False, 'sideways_rsi_required': False}.
[I 2025-08-30 16:29:32,761] Trial 422 finished with values: [-1000000000.0, 1000000000.0] and parameters: {'p_sma': 5, 'p_std': 30, 'p_atr': 15, 'p_adx': 21, 'rsi_period': 57, 'ema1': 20, 'ema2': 10, 'slip_atr_k': 0.004774564047372968, 'slip_spread_k': 0.2936357627502493, 'spread_hl_frac': 0.019267083696150128, 'bb_std_mult': 3.0562096243153114, 'rsi_os': 8, 'rsi_ob': 90, 'vol_spike': 0.015959402295920924, 'adx_thresh': 14.8216903703251, 'atr_min_pct': 0.01854927889827022, 'atr_max_pct': 0.13929073229229302, 'tp_mult': 1.778760885878467, 'tsl_mult': 0.4629103513192376, 'strategy': 'mean_reversion', 'time_stop': 9, 'use_sma': True, 'use_atr': True, 'use_adx': True, 'use_ema': False, 'use_spike': False, 'rsi_required': True, 'edge_k': 0.16323486745470306, 'edge_cap': 0.40428571608678177, 'bull_strategy': 'mean_reversion', 'bull_bb_std_mult': 0.7152716545994087, 'bull_rsi_os': 30, 'bull_rsi_ob': 87, 'bull_adx_thresh': 21.207880834673254, 'bull_atr_min_pct': 0.019723182555121208, 'bull_atr_max_pct': 0.13363552107306947, 'bull_tp_mult': 2.8754385234495508, 'bull_tsl_mult': 0.8944779520895503, 'bull_time_stop': 62, 'bull_use_sma': False, 'bull_use_ema': True, 'bull_use_atr': True, 'bull_use_adx': True, 'bull_use_spike': False, 'bull_rsi_required': False, 'bear_strategy': 'mean_reversion', 'bear_bb_std_mult': 0.9573701286622078, 'bear_rsi_os': 13, 'bear_rsi_ob': 79, 'bear_adx_thresh': 13.122740631269032, 'bear_atr_min_pct': 0.02180757602314814, 'bear_atr_max_pct': 0.10085175223875856, 'bear_tp_mult': 1.530727139556271, 'bear_tsl_mult': 0.6521257427062197, 'bear_time_stop': 142, 'bear_use_sma': True, 'bear_use_ema': False, 'bear_use_atr': False, 'bear_use_adx': True, 'bear_use_spike': False, 'bear_rsi_required': True, 'sideways_strategy': 'breakout', 'sideways_bb_std_mult': 2.0168735551542745, 'sideways_rsi_os': 37, 'sideways_rsi_ob': 93, 'sideways_adx_thresh': 13.071171704891558, 'sideways_atr_min_pct': 0.0007551134568835188, 'sideways_atr_max_pct': 0.07343952004431932, 'sideways_tp_mult': 1.4048693468587667, 'sideways_tsl_mult': 0.3237405834520414, 'sideways_time_stop': 96, 'sideways_use_sma': True, 'sideways_use_ema': False, 'sideways_use_atr': False, 'sideways_use_adx': False, 'sideways_use_spike': False, 'sideways_rsi_required': True}.
[I 2025-08-30 16:29:33,146] Trial 424 finished with values: [-1000000000.0, 1000000000.0] and parameters: {'p_sma': 13, 'p_std': 59, 'p_atr': 23, 'p_adx': 27, 'rsi_period': 20, 'ema1': 26, 'ema2': 14, 'slip_atr_k': 0.004975189008300543, 'slip_spread_k': 0.885791322053546, 'spread_hl_frac': 0.02995634742597305, 'bb_std_mult': 1.0210980667176341, 'rsi_os': 17, 'rsi_ob': 91, 'vol_spike': 0.18921116396517676, 'adx_thresh': 31.50656745027994, 'atr_min_pct': 0.027568385301838756, 'atr_max_pct': 0.1385672899689342, 'tp_mult': 2.903751860228781, 'tsl_mult': 0.48225955035513385, 'strategy': 'mean_reversion', 'time_stop': 216, 'use_sma': False, 'use_atr': True, 'use_adx': True, 'use_ema': False, 'use_spike': False, 'rsi_required': True, 'edge_k': 0.16527856616134673, 'edge_cap': 0.6603447946072943, 'bull_strategy': 'mean_reversion', 'bull_bb_std_mult': 3.294757742929071, 'bull_rsi_os': 11, 'bull_rsi_ob': 52, 'bull_adx_thresh': 19.915670749713968, 'bull_atr_min_pct': 0.020077478918019843, 'bull_atr_max_pct': 0.03456844164814016, 'bull_tp_mult': 2.879406987984669, 'bull_tsl_mult': 0.5115897345673093, 'bull_time_stop': 137, 'bull_use_sma': False, 'bull_use_ema': True, 'bull_use_atr': True, 'bull_use_adx': True, 'bull_use_spike': False, 'bull_rsi_required': False, 'bear_strategy': 'mean_reversion', 'bear_bb_std_mult': 2.0864201367245823, 'bear_rsi_os': 13, 'bear_rsi_ob': 80, 'bear_adx_thresh': 11.665254742670001, 'bear_atr_min_pct': 0.01851806083965383, 'bear_atr_max_pct': 0.13043652206410794, 'bear_tp_mult': 2.196120197954791, 'bear_tsl_mult': 0.3368424887949589, 'bear_time_stop': 195, 'bear_use_sma': True, 'bear_use_ema': False, 'bear_use_atr': False, 'bear_use_adx': False, 'bear_use_spike': False, 'bear_rsi_required': False, 'sideways_strategy': 'breakout', 'sideways_bb_std_mult': 2.0770739694078224, 'sideways_rsi_os': 26, 'sideways_rsi_ob': 93, 'sideways_adx_thresh': 31.313271184218948, 'sideways_atr_min_pct': 0.0009203829687780122, 'sideways_atr_max_pct': 0.14182169442403392, 'sideways_tp_mult': 1.5102044033548088, 'sideways_tsl_mult': 0.5291816582112709, 'sideways_time_stop': 146, 'sideways_use_sma': True, 'sideways_use_ema': False, 'sideways_use_atr': True, 'sideways_use_adx': False, 'sideways_use_spike': False, 'sideways_rsi_required': True}.
[I 2025-08-30 16:30:18,655] Trial 428 finished with values: [-1000000000.0, 1000000000.0] and parameters: {'p_sma': 22, 'p_std': 57, 'p_atr': 23, 'p_adx': 28, 'rsi_period': 22, 'ema1': 26, 'ema2': 12, 'slip_atr_k': 0.22447357719441374, 'slip_spread_k': 0.6555258032590064, 'spread_hl_frac': 0.011270412563923377, 'bb_std_mult': 1.084242584028266, 'rsi_os': 44, 'rsi_ob': 91, 'vol_spike': 0.06571714368288821, 'adx_thresh': 12.927625789161564, 'atr_min_pct': 0.005737119681238065, 'atr_max_pct': 0.02377221422753325, 'tp_mult': 2.7628681718965855, 'tsl_mult': 0.45888857876441214, 'strategy': 'mean_reversion', 'time_stop': 21, 'use_sma': False, 'use_atr': False, 'use_adx': True, 'use_ema': False, 'use_spike': False, 'rsi_required': True, 'edge_k': 0.8283062430808745, 'edge_cap': 0.10618505473969986, 'bull_strategy': 'mean_reversion', 'bull_bb_std_mult': 2.533737109187474, 'bull_rsi_os': 34, 'bull_rsi_ob': 50, 'bull_adx_thresh': 20.829619973463306, 'bull_atr_min_pct': 0.020053841196445286, 'bull_atr_max_pct': 0.10941720215388437, 'bull_tp_mult': 1.1295942565856736, 'bull_tsl_mult': 0.5394947191281646, 'bull_time_stop': 207, 'bull_use_sma': False, 'bull_use_ema': False, 'bull_use_atr': True, 'bull_use_adx': True, 'bull_use_spike': True, 'bull_rsi_required': False, 'bear_strategy': 'mean_reversion', 'bear_bb_std_mult': 2.4722489942429986, 'bear_rsi_os': 15, 'bear_rsi_ob': 75, 'bear_adx_thresh': 33.27466126540868, 'bear_atr_min_pct': 0.022314383381516444, 'bear_atr_max_pct': 0.02315220303424248, 'bear_tp_mult': 2.2429447142026615, 'bear_tsl_mult': 0.6741269593622558, 'bear_time_stop': 192, 'bear_use_sma': True, 'bear_use_ema': False, 'bear_use_atr': False, 'bear_use_adx': False, 'bear_use_spike': False, 'bear_rsi_required': False, 'sideways_strategy': 'mean_reversion', 'sideways_bb_std_mult': 2.0623419919014045, 'sideways_rsi_os': 11, 'sideways_rsi_ob': 79, 'sideways_adx_thresh': 16.066495356428163, 'sideways_atr_min_pct': 0.0024243182591469365, 'sideways_atr_max_pct': 0.11213260191113975, 'sideways_tp_mult': 2.291246095196724, 'sideways_tsl_mult': 0.4204633621561154, 'sideways_time_stop': 221, 'sideways_use_sma': False, 'sideways_use_ema': False, 'sideways_use_atr': True, 'sideways_use_adx': False, 'sideways_use_spike': True, 'sideways_rsi_required': True}.
[I 2025-08-30 16:30:19,094] Trial 427 finished with values: [-1000000000.0, 1000000000.0] and parameters: {'p_sma': 22, 'p_std': 48, 'p_atr': 23, 'p_adx': 28, 'rsi_period': 22, 'ema1': 23, 'ema2': 12, 'slip_atr_k': 0.12873670824654063, 'slip_spread_k': 0.5577951563238475, 'spread_hl_frac': 0.016956384504125174, 'bb_std_mult': 3.1293067667800964, 'rsi_os': 33, 'rsi_ob': 91, 'vol_spike': 0.006382469589860075, 'adx_thresh': 12.955100619452292, 'atr_min_pct': 0.0056994511054424876, 'atr_max_pct': 0.1335645802796621, 'tp_mult': 2.630830863716195, 'tsl_mult': 0.4625316109151552, 'strategy': 'mean_reversion', 'time_stop': 21, 'use_sma': False, 'use_atr': False, 'use_adx': True, 'use_ema': False, 'use_spike': False, 'rsi_required': True, 'edge_k': 1.5238097454900124, 'edge_cap': 0.6027439090712109, 'bull_strategy': 'mean_reversion', 'bull_bb_std_mult': 2.2113490763367527, 'bull_rsi_os': 34, 'bull_rsi_ob': 94, 'bull_adx_thresh': 20.910303921214243, 'bull_atr_min_pct': 0.0198397389031744, 'bull_atr_max_pct': 0.13702243957419966, 'bull_tp_mult': 1.1824262538309709, 'bull_tsl_mult': 0.31661323746410397, 'bull_time_stop': 48, 'bull_use_sma': False, 'bull_use_ema': True, 'bull_use_atr': True, 'bull_use_adx': True, 'bull_use_spike': False, 'bull_rsi_required': False, 'bear_strategy': 'mean_reversion', 'bear_bb_std_mult': 1.9388080543728892, 'bear_rsi_os': 46, 'bear_rsi_ob': 75, 'bear_adx_thresh': 6.572940722852618, 'bear_atr_min_pct': 0.01855019550021071, 'bear_atr_max_pct': 0.09750196339524268, 'bear_tp_mult': 1.9288869421206274, 'bear_tsl_mult': 0.6596127910466437, 'bear_time_stop': 144, 'bear_use_sma': True, 'bear_use_ema': False, 'bear_use_atr': False, 'bear_use_adx': False, 'bear_use_spike': False, 'bear_rsi_required': False, 'sideways_strategy': 'mean_reversion', 'sideways_bb_std_mult': 2.035657446473913, 'sideways_rsi_os': 51, 'sideways_rsi_ob': 81, 'sideways_adx_thresh': 8.080562611812677, 'sideways_atr_min_pct': 0.001159603557014645, 'sideways_atr_max_pct': 0.11328384134217104, 'sideways_tp_mult': 1.4983650819133467, 'sideways_tsl_mult': 0.14213450624703383, 'sideways_time_stop': 220, 'sideways_use_sma': True, 'sideways_use_ema': False, 'sideways_use_atr': True, 'sideways_use_adx': False, 'sideways_use_spike': True, 'sideways_rsi_required': True}.
[I 2025-08-30 16:30:19,784] Trial 429 finished with values: [-1000000000.0, 1000000000.0] and parameters: {'p_sma': 32, 'p_std': 46, 'p_atr': 28, 'p_adx': 10, 'rsi_period': 23, 'ema1': 15, 'ema2': 12, 'slip_atr_k': 0.02576436376566945, 'slip_spread_k': 0.6036013531109216, 'spread_hl_frac': 0.016995768294693497, 'bb_std_mult': 3.1346905829834606, 'rsi_os': 13, 'rsi_ob': 68, 'vol_spike': 0.12799052749002013, 'adx_thresh': 17.983474928865252, 'atr_min_pct': 0.00555830372382371, 'atr_max_pct': 0.1446895919754097, 'tp_mult': 2.4560868203482893, 'tsl_mult': 0.41215388451994184, 'strategy': 'mean_reversion', 'time_stop': 22, 'use_sma': False, 'use_atr': False, 'use_adx': True, 'use_ema': True, 'use_spike': False, 'rsi_required': True, 'edge_k': 1.519745002530637, 'edge_cap': 0.774381695787198, 'bull_strategy': 'mean_reversion', 'bull_bb_std_mult': 2.058902383499608, 'bull_rsi_os': 9, 'bull_rsi_ob': 50, 'bull_adx_thresh': 20.59931686466509, 'bull_atr_min_pct': 0.015362049448564358, 'bull_atr_max_pct': 0.013539640250167254, 'bull_tp_mult': 1.121022898163506, 'bull_tsl_mult': 0.8390730067018586, 'bull_time_stop': 78, 'bull_use_sma': False, 'bull_use_ema': False, 'bull_use_atr': True, 'bull_use_adx': True, 'bull_use_spike': True, 'bull_rsi_required': False, 'bear_strategy': 'breakout', 'bear_bb_std_mult': 1.9365441943423285, 'bear_rsi_os': 25, 'bear_rsi_ob': 57, 'bear_adx_thresh': 22.16722524146756, 'bear_atr_min_pct': 0.022328366395707382, 'bear_atr_max_pct': 0.09702385241088708, 'bear_tp_mult': 1.6164111246740716, 'bear_tsl_mult': 0.2471863614370386, 'bear_time_stop': 227, 'bear_use_sma': True, 'bear_use_ema': True, 'bear_use_atr': True, 'bear_use_adx': False, 'bear_use_spike': False, 'bear_rsi_required': False, 'sideways_strategy': 'mean_reversion', 'sideways_bb_std_mult': 2.311369901385246, 'sideways_rsi_os': 30, 'sideways_rsi_ob': 89, 'sideways_adx_thresh': 25.458541812945487, 'sideways_atr_min_pct': 0.0021756486118514546, 'sideways_atr_max_pct': 0.14487168241898885, 'sideways_tp_mult': 1.8951711741675044, 'sideways_tsl_mult': 0.41504054284359193, 'sideways_time_stop': 219, 'sideways_use_sma': False, 'sideways_use_ema': True, 'sideways_use_atr': False, 'sideways_use_adx': False, 'sideways_use_spike': True, 'sideways_rsi_required': False}.
[I 2025-08-30 16:30:20,092] Trial 426 finished with values: [-1000000000.0, 1000000000.0] and parameters: {'p_sma': 8, 'p_std': 57, 'p_atr': 13, 'p_adx': 28, 'rsi_period': 22, 'ema1': 27, 'ema2': 12, 'slip_atr_k': 0.2149179516184733, 'slip_spread_k': 0.5590708772640763, 'spread_hl_frac': 0.03615125190116773, 'bb_std_mult': 2.5933533797285713, 'rsi_os': 17, 'rsi_ob': 91, 'vol_spike': 7.108778389677126e-05, 'adx_thresh': 15.395856381697016, 'atr_min_pct': 0.016263336412999922, 'atr_max_pct': 0.023732803154054828, 'tp_mult': 2.9625756520419717, 'tsl_mult': 0.4172357717612022, 'strategy': 'mean_reversion', 'time_stop': 21, 'use_sma': False, 'use_atr': False, 'use_adx': True, 'use_ema': False, 'use_spike': False, 'rsi_required': True, 'edge_k': 0.8098382439388494, 'edge_cap': 0.397667232910475, 'bull_strategy': 'mean_reversion', 'bull_bb_std_mult': 0.7266403244830899, 'bull_rsi_os': 11, 'bull_rsi_ob': 50, 'bull_adx_thresh': 21.053741688059517, 'bull_atr_min_pct': 0.020199512649185715, 'bull_atr_max_pct': 0.09930584021970913, 'bull_tp_mult': 1.1208786617043363, 'bull_tsl_mult': 0.7594783226695054, 'bull_time_stop': 206, 'bull_use_sma': False, 'bull_use_ema': True, 'bull_use_atr': True, 'bull_use_adx': True, 'bull_use_spike': False, 'bull_rsi_required': False, 'bear_strategy': 'mean_reversion', 'bear_bb_std_mult': 0.8461041712157624, 'bear_rsi_os': 15, 'bear_rsi_ob': 62, 'bear_adx_thresh': 33.01977484026729, 'bear_atr_min_pct': 0.022037992013328622, 'bear_atr_max_pct': 0.11256647893821908, 'bear_tp_mult': 2.2426055822579714, 'bear_tsl_mult': 0.3064048761071919, 'bear_time_stop': 237, 'bear_use_sma': True, 'bear_use_ema': True, 'bear_use_atr': True, 'bear_use_adx': False, 'bear_use_spike': False, 'bear_rsi_required': False, 'sideways_strategy': 'mean_reversion', 'sideways_bb_std_mult': 1.9261040907901597, 'sideways_rsi_os': 40, 'sideways_rsi_ob': 94, 'sideways_adx_thresh': 29.748481185152478, 'sideways_atr_min_pct': 0.0010449872695474174, 'sideways_atr_max_pct': 0.11324341486131144, 'sideways_tp_mult': 1.5149040610965787, 'sideways_tsl_mult': 0.409248650264399, 'sideways_time_stop': 203, 'sideways_use_sma': False, 'sideways_use_ema': False, 'sideways_use_atr': True, 'sideways_use_adx': False, 'sideways_use_spike': True, 'sideways_rsi_required': False}.
[I 2025-08-30 16:31:08,048] Trial 432 finished with values: [-1000000000.0, 1000000000.0] and parameters: {'p_sma': 8, 'p_std': 40, 'p_atr': 27, 'p_adx': 21, 'rsi_period': 18, 'ema1': 7, 'ema2': 11, 'slip_atr_k': 0.020113015737874752, 'slip_spread_k': 0.5286083639867177, 'spread_hl_frac': 0.0055544458978929664, 'bb_std_mult': 2.593219773165257, 'rsi_os': 34, 'rsi_ob': 88, 'vol_spike': 0.22725468928634499, 'adx_thresh': 12.239348057863149, 'atr_min_pct': 0.017556116288983018, 'atr_max_pct': 0.14263073843429727, 'tp_mult': 1.6482685978897462, 'tsl_mult': 0.11089431406555655, 'strategy': 'mean_reversion', 'time_stop': 109, 'use_sma': False, 'use_atr': True, 'use_adx': True, 'use_ema': False, 'use_spike': False, 'rsi_required': True, 'edge_k': 1.5742514470985005, 'edge_cap': 0.9152014096997008, 'bull_strategy': 'mean_reversion', 'bull_bb_std_mult': 1.9113185287959213, 'bull_rsi_os': 11, 'bull_rsi_ob': 47, 'bull_adx_thresh': 8.825343952771894, 'bull_atr_min_pct': 0.013080333088803851, 'bull_atr_max_pct': 0.09995718238886339, 'bull_tp_mult': 2.9959894667524383, 'bull_tsl_mult': 0.28659901484844946, 'bull_time_stop': 274, 'bull_use_sma': False, 'bull_use_ema': True, 'bull_use_atr': True, 'bull_use_adx': True, 'bull_use_spike': False, 'bull_rsi_required': False, 'bear_strategy': 'mean_reversion', 'bear_bb_std_mult': 0.8332776684286134, 'bear_rsi_os': 41, 'bear_rsi_ob': 78, 'bear_adx_thresh': 10.734583002282442, 'bear_atr_min_pct': 0.02367969325869903, 'bear_atr_max_pct': 0.09042377468177232, 'bear_tp_mult': 2.277449844626109, 'bear_tsl_mult': 0.056755558404463946, 'bear_time_stop': 214, 'bear_use_sma': True, 'bear_use_ema': False, 'bear_use_atr': False, 'bear_use_adx': False, 'bear_use_spike': False, 'bear_rsi_required': False, 'sideways_strategy': 'breakout', 'sideways_bb_std_mult': 2.1235526174122312, 'sideways_rsi_os': 42, 'sideways_rsi_ob': 94, 'sideways_adx_thresh': 6.804775308695049, 'sideways_atr_min_pct': 0.014234266205413031, 'sideways_atr_max_pct': 0.14461030479240608, 'sideways_tp_mult': 1.4634146423969088, 'sideways_tsl_mult': 0.47439726810542676, 'sideways_time_stop': 202, 'sideways_use_sma': True, 'sideways_use_ema': False, 'sideways_use_atr': False, 'sideways_use_adx': False, 'sideways_use_spike': False, 'sideways_rsi_required': False}.
[I 2025-08-30 16:31:08,491] Trial 433 finished with values: [-1000000000.0, 1000000000.0] and parameters: {'p_sma': 12, 'p_std': 53, 'p_atr': 27, 'p_adx': 21, 'rsi_period': 17, 'ema1': 22, 'ema2': 51, 'slip_atr_k': 0.01743056055972997, 'slip_spread_k': 0.7447671529103113, 'spread_hl_frac': 0.03141213222826435, 'bb_std_mult': 2.8242650197235726, 'rsi_os': 49, 'rsi_ob': 89, 'vol_spike': 0.22022435525846704, 'adx_thresh': 12.300537518745898, 'atr_min_pct': 0.017430956725757233, 'atr_max_pct': 0.14222584667084376, 'tp_mult': 2.8237597280755815, 'tsl_mult': 0.5056164966641633, 'strategy': 'mean_reversion', 'time_stop': 10, 'use_sma': False, 'use_atr': True, 'use_adx': True, 'use_ema': True, 'use_spike': False, 'rsi_required': True, 'edge_k': 1.562414761762964, 'edge_cap': 0.8136796158133024, 'bull_strategy': 'mean_reversion', 'bull_bb_std_mult': 1.9004330124783004, 'bull_rsi_os': 50, 'bull_rsi_ob': 46, 'bull_adx_thresh': 22.243070314082814, 'bull_atr_min_pct': 0.021405188657781894, 'bull_atr_max_pct': 0.1369860471768982, 'bull_tp_mult': 2.8024121057994504, 'bull_tsl_mult': 0.28284981678112764, 'bull_time_stop': 85, 'bull_use_sma': False, 'bull_use_ema': True, 'bull_use_atr': True, 'bull_use_adx': True, 'bull_use_spike': False, 'bull_rsi_required': False, 'bear_strategy': 'breakout', 'bear_bb_std_mult': 2.1529398254648426, 'bear_rsi_os': 35, 'bear_rsi_ob': 78, 'bear_adx_thresh': 10.438657388918331, 'bear_atr_min_pct': 0.019862567788709103, 'bear_atr_max_pct': 0.14333281337870646, 'bear_tp_mult': 2.3456974951430833, 'bear_tsl_mult': 0.059158704677066354, 'bear_time_stop': 234, 'bear_use_sma': True, 'bear_use_ema': False, 'bear_use_atr': False, 'bear_use_adx': False, 'bear_use_spike': False, 'bear_rsi_required': False, 'sideways_strategy': 'breakout', 'sideways_bb_std_mult': 2.229067536075897, 'sideways_rsi_os': 28, 'sideways_rsi_ob': 92, 'sideways_adx_thresh': 15.769023801924787, 'sideways_atr_min_pct': 0.01406662254828629, 'sideways_atr_max_pct': 0.0307941390940187, 'sideways_tp_mult': 1.3147002512491404, 'sideways_tsl_mult': 0.4689365502931615, 'sideways_time_stop': 204, 'sideways_use_sma': True, 'sideways_use_ema': True, 'sideways_use_atr': False, 'sideways_use_adx': False, 'sideways_use_spike': False, 'sideways_rsi_required': True}.
