[I 2025-08-30 17:20:11,673] Trial 720 finished with values: [-1000000000.0, 1000000000.0] and parameters: {'p_sma': 8, 'p_std': 20, 'p_atr': 18, 'p_adx': 8, 'rsi_period': 54, 'ema1': 19, 'ema2': 49, 'slip_atr_k': 0.00025806631110567545, 'slip_spread_k': 0.7684294641621404, 'spread_hl_frac': 0.018746203148933476, 'bb_std_mult': 1.0036973785279248, 'rsi_os': 10, 'rsi_ob': 66, 'vol_spike': 0.2428906963549904, 'adx_thresh': 10.72436516883171, 'atr_min_pct': 0.01853854418711391, 'atr_max_pct': 0.04021768672348672, 'tp_mult': 2.7375877880760626, 'tsl_mult': 0.28910317943531016, 'strategy': 'breakout', 'time_stop': 28, 'use_sma': False, 'use_atr': True, 'use_adx': True, 'use_ema': False, 'use_spike': False, 'rsi_required': True, 'edge_k': 0.028871339125322693, 'edge_cap': 0.9199695446086334, 'bull_strategy': 'mean_reversion', 'bull_bb_std_mult': 1.7534824613665316, 'bull_rsi_os': 12, 'bull_rsi_ob': 54, 'bull_adx_thresh': 26.851638904616035, 'bull_atr_min_pct': 0.023525002843972923, 'bull_atr_max_pct': 0.10108853040555212, 'bull_tp_mult': 2.285302770230922, 'bull_tsl_mult': 0.7556435726164908, 'bull_time_stop': 273, 'bull_use_sma': True, 'bull_use_ema': True, 'bull_use_atr': False, 'bull_use_adx': True, 'bull_use_spike': True, 'bull_rsi_required': False, 'bear_strategy': 'mean_reversion', 'bear_bb_std_mult': 3.255636729796352, 'bear_rsi_os': 17, 'bear_rsi_ob': 75, 'bear_adx_thresh': 13.021485604776016, 'bear_atr_min_pct': 0.017643687088288014, 'bear_atr_max_pct': 0.022842442744511485, 'bear_tp_mult': 2.1058397451594333, 'bear_tsl_mult': 0.46259265710155045, 'bear_time_stop': 198, 'bear_use_sma': False, 'bear_use_ema': True, 'bear_use_atr': False, 'bear_use_adx': False, 'bear_use_spike': False, 'bear_rsi_required': False, 'sideways_strategy': 'breakout', 'sideways_bb_std_mult': 0.948717616550269, 'sideways_rsi_os': 31, 'sideways_rsi_ob': 64, 'sideways_adx_thresh': 27.168628049315476, 'sideways_atr_min_pct': 0.002224378164412384, 'sideways_atr_max_pct': 0.035706172623252944, 'sideways_tp_mult': 2.2363878892233937, 'sideways_tsl_mult': 0.3283979228588454, 'sideways_time_stop': 275, 'sideways_use_sma': True, 'sideways_use_ema': False, 'sideways_use_atr': False, 'sideways_use_adx': True, 'sideways_use_spike': False, 'sideways_rsi_required': True}.
[I 2025-08-30 17:20:12,260] Trial 721 finished with values: [-1000000000.0, 1000000000.0] and parameters: {'p_sma': 8, 'p_std': 6, 'p_atr': 18, 'p_adx': 10, 'rsi_period': 79, 'ema1': 19, 'ema2': 14, 'slip_atr_k': 0.025982386695584614, 'slip_spread_k': 0.17913803685617818, 'spread_hl_frac': 0.0008546225461052506, 'bb_std_mult': 3.3498299435395245, 'rsi_os': 24, 'rsi_ob': 84, 'vol_spike': 0.0859082477480244, 'adx_thresh': 17.137488722178794, 'atr_min_pct': 0.02894587441234782, 'atr_max_pct': 0.040249930296990824, 'tp_mult': 2.061932215913576, 'tsl_mult': 0.8960569894340222, 'strategy': 'breakout', 'time_stop': 59, 'use_sma': True, 'use_atr': False, 'use_adx': False, 'use_ema': False, 'use_spike': False, 'rsi_required': False, 'edge_k': 0.6111776332424359, 'edge_cap': 0.7881835557421645, 'bull_strategy': 'mean_reversion', 'bull_bb_std_mult': 1.7816353613814302, 'bull_rsi_os': 11, 'bull_rsi_ob': 54, 'bull_adx_thresh': 34.48532825235696, 'bull_atr_min_pct': 0.01120617944170497, 'bull_atr_max_pct': 0.11168200956264002, 'bull_tp_mult': 1.7156431993579406, 'bull_tsl_mult': 0.7548740604416693, 'bull_time_stop': 74, 'bull_use_sma': True, 'bull_use_ema': True, 'bull_use_atr': False, 'bull_use_adx': False, 'bull_use_spike': True, 'bull_rsi_required': False, 'bear_strategy': 'mean_reversion', 'bear_bb_std_mult': 3.4681724504150333, 'bear_rsi_os': 14, 'bear_rsi_ob': 76, 'bear_adx_thresh': 13.221490076696867, 'bear_atr_min_pct': 0.003770546479725894, 'bear_atr_max_pct': 0.10076383341846215, 'bear_tp_mult': 2.4908410022915826, 'bear_tsl_mult': 0.9363965853985933, 'bear_time_stop': 199, 'bear_use_sma': False, 'bear_use_ema': False, 'bear_use_atr': False, 'bear_use_adx': True, 'bear_use_spike': True, 'bear_rsi_required': True, 'sideways_strategy': 'breakout', 'sideways_bb_std_mult': 0.766391324335913, 'sideways_rsi_os': 43, 'sideways_rsi_ob': 60, 'sideways_adx_thresh': 30.59774910409113, 'sideways_atr_min_pct': 0.025387250696419682, 'sideways_atr_max_pct': 0.10256673836022541, 'sideways_tp_mult': 1.7701365073008581, 'sideways_tsl_mult': 0.25649276617705336, 'sideways_time_stop': 272, 'sideways_use_sma': True, 'sideways_use_ema': False, 'sideways_use_atr': False, 'sideways_use_adx': True, 'sideways_use_spike': False, 'sideways_rsi_required': True}.
[I 2025-08-30 17:20:51,719] Trial 724 finished with values: [-1000000000.0, 1000000000.0] and parameters: {'p_sma': 6, 'p_std': 19, 'p_atr': 9, 'p_adx': 12, 'rsi_period': 25, 'ema1': 20, 'ema2': 29, 'slip_atr_k': 0.006905540331032729, 'slip_spread_k': 0.18000646808393334, 'spread_hl_frac': 0.020736698007972697, 'bb_std_mult': 0.6716396140205272, 'rsi_os': 32, 'rsi_ob': 86, 'vol_spike': 0.29425403347804746, 'adx_thresh': 10.279235224930451, 'atr_min_pct': 0.00810359535599365, 'atr_max_pct': 0.1474168005616652, 'tp_mult': 2.0427308252887064, 'tsl_mult': 0.8955898423883328, 'strategy': 'breakout', 'time_stop': 38, 'use_sma': True, 'use_atr': False, 'use_adx': False, 'use_ema': True, 'use_spike': True, 'rsi_required': False, 'edge_k': 0.6069636229160992, 'edge_cap': 0.38661185414707744, 'bull_strategy': 'breakout', 'bull_bb_std_mult': 1.3024484734812882, 'bull_rsi_os': 11, 'bull_rsi_ob': 52, 'bull_adx_thresh': 17.223220435502217, 'bull_atr_min_pct': 0.02990229704342192, 'bull_atr_max_pct': 0.08545519257217352, 'bull_tp_mult': 1.7997004234807723, 'bull_tsl_mult': 0.8688511562296406, 'bull_time_stop': 171, 'bull_use_sma': True, 'bull_use_ema': False, 'bull_use_atr': False, 'bull_use_adx': False, 'bull_use_spike': True, 'bull_rsi_required': True, 'bear_strategy': 'breakout', 'bear_bb_std_mult': 0.8315189285624176, 'bear_rsi_os': 14, 'bear_rsi_ob': 76, 'bear_adx_thresh': 11.847287901855754, 'bear_atr_min_pct': 0.02585290866886293, 'bear_atr_max_pct': 0.03393505455370196, 'bear_tp_mult': 2.238220665251145, 'bear_tsl_mult': 0.9591841525673712, 'bear_time_stop': 215, 'bear_use_sma': False, 'bear_use_ema': False, 'bear_use_atr': True, 'bear_use_adx': True, 'bear_use_spike': True, 'bear_rsi_required': True, 'sideways_strategy': 'mean_reversion', 'sideways_bb_std_mult': 0.8179752438502658, 'sideways_rsi_os': 32, 'sideways_rsi_ob': 59, 'sideways_adx_thresh': 8.186859503215041, 'sideways_atr_min_pct': 0.004271047576164009, 'sideways_atr_max_pct': 0.1026873927519277, 'sideways_tp_mult': 1.8596433405412816, 'sideways_tsl_mult': 0.11048467824228236, 'sideways_time_stop': 53, 'sideways_use_sma': False, 'sideways_use_ema': True, 'sideways_use_atr': True, 'sideways_use_adx': True, 'sideways_use_spike': True, 'sideways_rsi_required': False}.
[I 2025-08-30 17:20:52,435] Trial 725 finished with values: [-1000000000.0, 1000000000.0] and parameters: {'p_sma': 6, 'p_std': 19, 'p_atr': 16, 'p_adx': 12, 'rsi_period': 25, 'ema1': 20, 'ema2': 29, 'slip_atr_k': 0.009016487363379264, 'slip_spread_k': 0.18106069003600872, 'spread_hl_frac': 0.029354008414371618, 'bb_std_mult': 1.1836019173560968, 'rsi_os': 17, 'rsi_ob': 86, 'vol_spike': 0.10573613798085313, 'adx_thresh': 32.585213502751216, 'atr_min_pct': 0.019531572787092125, 'atr_max_pct': 0.14682594700592963, 'tp_mult': 2.882447229095031, 'tsl_mult': 0.8674508166218793, 'strategy': 'mean_reversion', 'time_stop': 36, 'use_sma': True, 'use_atr': False, 'use_adx': False, 'use_ema': True, 'use_spike': True, 'rsi_required': False, 'edge_k': 0.825969197307679, 'edge_cap': 0.38426304174173853, 'bull_strategy': 'breakout', 'bull_bb_std_mult': 1.5204413983998104, 'bull_rsi_os': 9, 'bull_rsi_ob': 73, 'bull_adx_thresh': 18.078760301938015, 'bull_atr_min_pct': 0.02286014427589199, 'bull_atr_max_pct': 0.04666352402259468, 'bull_tp_mult': 1.8174516932554379, 'bull_tsl_mult': 0.776548638298635, 'bull_time_stop': 116, 'bull_use_sma': True, 'bull_use_ema': False, 'bull_use_atr': False, 'bull_use_adx': False, 'bull_use_spike': False, 'bull_rsi_required': True, 'bear_strategy': 'breakout', 'bear_bb_std_mult': 0.8258950268595848, 'bear_rsi_os': 53, 'bear_rsi_ob': 78, 'bear_adx_thresh': 10.857466521466778, 'bear_atr_min_pct': 0.005341416175315358, 'bear_atr_max_pct': 0.034145748122244295, 'bear_tp_mult': 2.225425133711661, 'bear_tsl_mult': 0.6546795948520718, 'bear_time_stop': 216, 'bear_use_sma': True, 'bear_use_ema': False, 'bear_use_atr': True, 'bear_use_adx': True, 'bear_use_spike': True, 'bear_rsi_required': True, 'sideways_strategy': 'mean_reversion', 'sideways_bb_std_mult': 0.6930787414331485, 'sideways_rsi_os': 22, 'sideways_rsi_ob': 95, 'sideways_adx_thresh': 10.265852516514926, 'sideways_atr_min_pct': 0.02900825477739078, 'sideways_atr_max_pct': 0.09706198126324685, 'sideways_tp_mult': 2.431379722255905, 'sideways_tsl_mult': 0.30092192344177887, 'sideways_time_stop': 281, 'sideways_use_sma': False, 'sideways_use_ema': True, 'sideways_use_atr': True, 'sideways_use_adx': False, 'sideways_use_spike': True, 'sideways_rsi_required': False}.
[I 2025-08-30 17:20:52,629] Trial 723 finished with values: [-1000000000.0, 1000000000.0] and parameters: {'p_sma': 7, 'p_std': 19, 'p_atr': 16, 'p_adx': 10, 'rsi_period': 55, 'ema1': 8, 'ema2': 21, 'slip_atr_k': 0.02628166026829549, 'slip_spread_k': 0.17558973047941118, 'spread_hl_frac': 0.02933891560235817, 'bb_std_mult': 1.791208486649588, 'rsi_os': 21, 'rsi_ob': 86, 'vol_spike': 0.08536426301363512, 'adx_thresh': 10.40581341605521, 'atr_min_pct': 0.0052549889070715, 'atr_max_pct': 0.14592094316617885, 'tp_mult': 2.6276584849182214, 'tsl_mult': 0.8894844479517298, 'strategy': 'breakout', 'time_stop': 35, 'use_sma': True, 'use_atr': False, 'use_adx': False, 'use_ema': True, 'use_spike': True, 'rsi_required': False, 'edge_k': 0.6333098160231019, 'edge_cap': 0.4967461024006368, 'bull_strategy': 'breakout', 'bull_bb_std_mult': 1.7497242497720213, 'bull_rsi_os': 11, 'bull_rsi_ob': 52, 'bull_adx_thresh': 8.886759864535481, 'bull_atr_min_pct': 0.02287242600027845, 'bull_atr_max_pct': 0.13867689271723294, 'bull_tp_mult': 2.33045988969591, 'bull_tsl_mult': 0.7854343950885303, 'bull_time_stop': 274, 'bull_use_sma': True, 'bull_use_ema': False, 'bull_use_atr': False, 'bull_use_adx': False, 'bull_use_spike': True, 'bull_rsi_required': True, 'bear_strategy': 'breakout', 'bear_bb_std_mult': 3.2392404422947845, 'bear_rsi_os': 18, 'bear_rsi_ob': 85, 'bear_adx_thresh': 12.986095888367013, 'bear_atr_min_pct': 0.025779567589436572, 'bear_atr_max_pct': 0.03531401881344178, 'bear_tp_mult': 2.1039904968922154, 'bear_tsl_mult': 0.6633090913438735, 'bear_time_stop': 12, 'bear_use_sma': False, 'bear_use_ema': False, 'bear_use_atr': True, 'bear_use_adx': True, 'bear_use_spike': True, 'bear_rsi_required': True, 'sideways_strategy': 'breakout', 'sideways_bb_std_mult': 2.750986999275018, 'sideways_rsi_os': 31, 'sideways_rsi_ob': 95, 'sideways_adx_thresh': 12.305808981919965, 'sideways_atr_min_pct': 0.017345250849008394, 'sideways_atr_max_pct': 0.1028330346983974, 'sideways_tp_mult': 1.0689239101521715, 'sideways_tsl_mult': 0.4692542629838855, 'sideways_time_stop': 271, 'sideways_use_sma': True, 'sideways_use_ema': True, 'sideways_use_atr': True, 'sideways_use_adx': True, 'sideways_use_spike': True, 'sideways_rsi_required': False}.
[I 2025-08-30 17:20:52,867] Trial 722 finished with values: [-1000000000.0, 1000000000.0] and parameters: {'p_sma': 8, 'p_std': 19, 'p_atr': 18, 'p_adx': 10, 'rsi_period': 25, 'ema1': 19, 'ema2': 20, 'slip_atr_k': 0.00608809520186412, 'slip_spread_k': 0.18609140625906145, 'spread_hl_frac': 0.027983706897695134, 'bb_std_mult': 3.3252480497870947, 'rsi_os': 25, 'rsi_ob': 83, 'vol_spike': 0.29053317978216175, 'adx_thresh': 22.70659268698635, 'atr_min_pct': 0.01973420239090469, 'atr_max_pct': 0.0448322350166008, 'tp_mult': 2.071909025644625, 'tsl_mult': 0.12107767864712754, 'strategy': 'breakout', 'time_stop': 36, 'use_sma': True, 'use_atr': False, 'use_adx': False, 'use_ema': False, 'use_spike': True, 'rsi_required': False, 'edge_k': 0.03632920775240067, 'edge_cap': 0.926015160623726, 'bull_strategy': 'breakout', 'bull_bb_std_mult': 1.949124802920415, 'bull_rsi_os': 11, 'bull_rsi_ob': 52, 'bull_adx_thresh': 34.25331064681603, 'bull_atr_min_pct': 0.010724879064423232, 'bull_atr_max_pct': 0.0449093658390348, 'bull_tp_mult': 2.200761613032078, 'bull_tsl_mult': 0.7544265052314096, 'bull_time_stop': 175, 'bull_use_sma': True, 'bull_use_ema': True, 'bull_use_atr': False, 'bull_use_adx': False, 'bull_use_spike': True, 'bull_rsi_required': False, 'bear_strategy': 'mean_reversion', 'bear_bb_std_mult': 1.5252554381738859, 'bear_rsi_os': 17, 'bear_rsi_ob': 76, 'bear_adx_thresh': 11.896987511949987, 'bear_atr_min_pct': 0.01830005875194104, 'bear_atr_max_pct': 0.10188933123254393, 'bear_tp_mult': 2.874212608535144, 'bear_tsl_mult': 0.6642005302289168, 'bear_time_stop': 188, 'bear_use_sma': False, 'bear_use_ema': False, 'bear_use_atr': True, 'bear_use_adx': True, 'bear_use_spike': True, 'bear_rsi_required': True, 'sideways_strategy': 'breakout', 'sideways_bb_std_mult': 0.7241679723274896, 'sideways_rsi_os': 43, 'sideways_rsi_ob': 61, 'sideways_adx_thresh': 11.952991212257158, 'sideways_atr_min_pct': 0.002978691037464266, 'sideways_atr_max_pct': 0.0507815498202516, 'sideways_tp_mult': 1.8438836620643664, 'sideways_tsl_mult': 0.37671474572410135, 'sideways_time_stop': 88, 'sideways_use_sma': True, 'sideways_use_ema': True, 'sideways_use_atr': False, 'sideways_use_adx': True, 'sideways_use_spike': True, 'sideways_rsi_required': True}.
[I 2025-08-30 17:20:53,953] Trial 729 finished with values: [-1000000000.0, 1000000000.0] and parameters: {'p_sma': 46, 'p_std': 21, 'p_atr': 17, 'p_adx': 7, 'rsi_period': 58, 'ema1': 18, 'ema2': 52, 'slip_atr_k': 0.1985302281066333, 'slip_spread_k': 0.8515247100252079, 'spread_hl_frac': 0.01795168225215006, 'bb_std_mult': 3.2311386087099896, 'rsi_os': 33, 'rsi_ob': 45, 'vol_spike': 0.10352801456177374, 'adx_thresh': 16.102543052149997, 'atr_min_pct': 0.015621999109538667, 'atr_max_pct': 0.11309461827376643, 'tp_mult': 2.7684516915138175, 'tsl_mult': 0.9631968170906922, 'strategy': 'mean_reversion', 'time_stop': 195, 'use_sma': False, 'use_atr': True, 'use_adx': True, 'use_ema': False, 'use_spike': False, 'rsi_required': True, 'edge_k': 0.4526380535489809, 'edge_cap': 0.8709655137811687, 'bull_strategy': 'mean_reversion', 'bull_bb_std_mult': 3.0759850602437973, 'bull_rsi_os': 51, 'bull_rsi_ob': 53, 'bull_adx_thresh': 6.071495689491165, 'bull_atr_min_pct': 0.022541924581558955, 'bull_atr_max_pct': 0.14251540435367588, 'bull_tp_mult': 2.7031408996078334, 'bull_tsl_mult': 0.6749532263969904, 'bull_time_stop': 65, 'bull_use_sma': True, 'bull_use_ema': True, 'bull_use_atr': False, 'bull_use_adx': True, 'bull_use_spike': False, 'bull_rsi_required': False, 'bear_strategy': 'mean_reversion', 'bear_bb_std_mult': 1.1671272936071875, 'bear_rsi_os': 30, 'bear_rsi_ob': 51, 'bear_adx_thresh': 12.445641524170354, 'bear_atr_min_pct': 0.02071946300078798, 'bear_atr_max_pct': 0.04633667500927944, 'bear_tp_mult': 2.318913167191025, 'bear_tsl_mult': 0.8192175672672202, 'bear_time_stop': 205, 'bear_use_sma': True, 'bear_use_ema': False, 'bear_use_atr': False, 'bear_use_adx': False, 'bear_use_spike': False, 'bear_rsi_required': False, 'sideways_strategy': 'breakout', 'sideways_bb_std_mult': 2.6887744298083343, 'sideways_rsi_os': 30, 'sideways_rsi_ob': 79, 'sideways_adx_thresh': 21.437097861906427, 'sideways_atr_min_pct': 0.0017351914140226793, 'sideways_atr_max_pct': 0.026184754471014947, 'sideways_tp_mult': 2.919876005612278, 'sideways_tsl_mult': 0.9700992151372532, 'sideways_time_stop': 153, 'sideways_use_sma': True, 'sideways_use_ema': False, 'sideways_use_atr': False, 'sideways_use_adx': False, 'sideways_use_spike': False, 'sideways_rsi_required': True}.
[I 2025-08-30 17:21:30,818] Trial 728 finished with values: [-1000000000.0, 1000000000.0] and parameters: {'p_sma': 9, 'p_std': 34, 'p_atr': 17, 'p_adx': 7, 'rsi_period': 27, 'ema1': 18, 'ema2': 17, 'slip_atr_k': 0.05832586651671248, 'slip_spread_k': 0.22430746836853593, 'spread_hl_frac': 0.04508172674611095, 'bb_std_mult': 3.24202915916852, 'rsi_os': 30, 'rsi_ob': 68, 'vol_spike': 0.28266620376116347, 'adx_thresh': 11.959329540921546, 'atr_min_pct': 0.015706402331069194, 'atr_max_pct': 0.1474662357046242, 'tp_mult': 1.379784238162831, 'tsl_mult': 0.9720469061176666, 'strategy': 'mean_reversion', 'time_stop': 25, 'use_sma': False, 'use_atr': True, 'use_adx': True, 'use_ema': False, 'use_spike': False, 'rsi_required': True, 'edge_k': 0.4468155730430601, 'edge_cap': 0.26504767576509564, 'bull_strategy': 'mean_reversion', 'bull_bb_std_mult': 1.9445165612474833, 'bull_rsi_os': 27, 'bull_rsi_ob': 53, 'bull_adx_thresh': 33.94968479509641, 'bull_atr_min_pct': 0.015919001123752746, 'bull_atr_max_pct': 0.039983000380516186, 'bull_tp_mult': 2.702448924233912, 'bull_tsl_mult': 0.41229320975026784, 'bull_time_stop': 68, 'bull_use_sma': True, 'bull_use_ema': True, 'bull_use_atr': False, 'bull_use_adx': True, 'bull_use_spike': False, 'bull_rsi_required': False, 'bear_strategy': 'mean_reversion', 'bear_bb_std_mult': 1.1702540121507448, 'bear_rsi_os': 36, 'bear_rsi_ob': 77, 'bear_adx_thresh': 12.29706211724441, 'bear_atr_min_pct': 0.018429431734640636, 'bear_atr_max_pct': 0.10564920343842493, 'bear_tp_mult': 2.5848780359151773, 'bear_tsl_mult': 0.2102009497688937, 'bear_time_stop': 98, 'bear_use_sma': True, 'bear_use_ema': False, 'bear_use_atr': False, 'bear_use_adx': False, 'bear_use_spike': False, 'bear_rsi_required': False, 'sideways_strategy': 'breakout', 'sideways_bb_std_mult': 0.7015009957801976, 'sideways_rsi_os': 30, 'sideways_rsi_ob': 92, 'sideways_adx_thresh': 12.032776940075314, 'sideways_atr_min_pct': 0.003110066963872709, 'sideways_atr_max_pct': 0.09401253379386626, 'sideways_tp_mult': 2.9976678890878268, 'sideways_tsl_mult': 0.4500717102960898, 'sideways_time_stop': 75, 'sideways_use_sma': True, 'sideways_use_ema': False, 'sideways_use_atr': False, 'sideways_use_adx': False, 'sideways_use_spike': False, 'sideways_rsi_required': True}.
[I 2025-08-30 17:21:33,341] Trial 726 finished with values: [-1000000000.0, 1000000000.0] and parameters: {'p_sma': 33, 'p_std': 23, 'p_atr': 16, 'p_adx': 13, 'rsi_period': 27, 'ema1': 18, 'ema2': 16, 'slip_atr_k': 0.23973525530349193, 'slip_spread_k': 0.7975724863923493, 'spread_hl_frac': 0.0177687496971258, 'bb_std_mult': 3.046273491865777, 'rsi_os': 33, 'rsi_ob': 68, 'vol_spike': 0.2516640431798047, 'adx_thresh': 32.4821659409293, 'atr_min_pct': 0.002984900394215135, 'atr_max_pct': 0.147218517740472, 'tp_mult': 2.8878003098972975, 'tsl_mult': 0.8623920735365089, 'strategy': 'mean_reversion', 'time_stop': 236, 'use_sma': False, 'use_atr': True, 'use_adx': True, 'use_ema': True, 'use_spike': True, 'rsi_required': True, 'edge_k': 0.827647405949411, 'edge_cap': 0.2959366732024595, 'bull_strategy': 'breakout', 'bull_bb_std_mult': 2.589294581922551, 'bull_rsi_os': 26, 'bull_rsi_ob': 52, 'bull_adx_thresh': 14.543279341885073, 'bull_atr_min_pct': 0.022768084726463595, 'bull_atr_max_pct': 0.1365422358086631, 'bull_tp_mult': 2.3275715797449936, 'bull_tsl_mult': 0.6885408351291732, 'bull_time_stop': 69, 'bull_use_sma': True, 'bull_use_ema': False, 'bull_use_atr': False, 'bull_use_adx': True, 'bull_use_spike': False, 'bull_rsi_required': False, 'bear_strategy': 'breakout', 'bear_bb_std_mult': 1.323835465256343, 'bear_rsi_os': 33, 'bear_rsi_ob': 77, 'bear_adx_thresh': 12.454780291046177, 'bear_atr_min_pct': 0.020933560981938246, 'bear_atr_max_pct': 0.10523107238305597, 'bear_tp_mult': 2.5735360205347515, 'bear_tsl_mult': 0.653300976396855, 'bear_time_stop': 215, 'bear_use_sma': True, 'bear_use_ema': False, 'bear_use_atr': True, 'bear_use_adx': False, 'bear_use_spike': False, 'bear_rsi_required': False, 'sideways_strategy': 'breakout', 'sideways_bb_std_mult': 2.6808468873517586, 'sideways_rsi_os': 8, 'sideways_rsi_ob': 95, 'sideways_adx_thresh': 12.067228959252056, 'sideways_atr_min_pct': 0.028925599856814956, 'sideways_atr_max_pct': 0.09741772910997391, 'sideways_tp_mult': 1.939871311305026, 'sideways_tsl_mult': 0.4723482904730627, 'sideways_time_stop': 279, 'sideways_use_sma': True, 'sideways_use_ema': True, 'sideways_use_atr': False, 'sideways_use_adx': False, 'sideways_use_spike': True, 'sideways_rsi_required': True}.
