[I 2025-08-30 16:47:41,481] Trial 530 finished with values: [-1000000000.0, 1000000000.0] and parameters: {'p_sma': 13, 'p_std': 28, 'p_atr': 26, 'p_adx': 28, 'rsi_period': 56, 'ema1': 15, 'ema2': 11, 'slip_atr_k': 0.07487494718782743, 'slip_spread_k': 0.11257156331129697, 'spread_hl_frac': 0.03716075381926618, 'bb_std_mult': 3.0133413943412126, 'rsi_os': 9, 'rsi_ob': 90, 'vol_spike': 0.10103095144077909, 'adx_thresh': 13.925552367552875, 'atr_min_pct': 0.025131288756078785, 'atr_max_pct': 0.1383817455269368, 'tp_mult': 2.8195089169936245, 'tsl_mult': 0.4776249633242251, 'strategy': 'mean_reversion', 'time_stop': 22, 'use_sma': False, 'use_atr': True, 'use_adx': True, 'use_ema': False, 'use_spike': False, 'rsi_required': True, 'edge_k': 0.1919465835670644, 'edge_cap': 0.908383275818083, 'bull_strategy': 'mean_reversion', 'bull_bb_std_mult': 1.9610705707963707, 'bull_rsi_os': 11, 'bull_rsi_ob': 86, 'bull_adx_thresh': 22.809015517056302, 'bull_atr_min_pct': 0.018413295365653073, 'bull_atr_max_pct': 0.12991875111889814, 'bull_tp_mult': 1.1513949345408678, 'bull_tsl_mult': 0.22923161710881873, 'bull_time_stop': 229, 'bull_use_sma': False, 'bull_use_ema': True, 'bull_use_atr': True, 'bull_use_adx': True, 'bull_use_spike': False, 'bull_rsi_required': True, 'bear_strategy': 'mean_reversion', 'bear_bb_std_mult': 1.9892015978613056, 'bear_rsi_os': 33, 'bear_rsi_ob': 66, 'bear_adx_thresh': 11.80870253783981, 'bear_atr_min_pct': 0.02095181018180822, 'bear_atr_max_pct': 0.09768432514204942, 'bear_tp_mult': 2.9091062448058294, 'bear_tsl_mult': 0.62032489070491, 'bear_time_stop': 54, 'bear_use_sma': True, 'bear_use_ema': False, 'bear_use_atr': False, 'bear_use_adx': False, 'bear_use_spike': False, 'bear_rsi_required': False, 'sideways_strategy': 'breakout', 'sideways_bb_std_mult': 1.5714722970210606, 'sideways_rsi_os': 24, 'sideways_rsi_ob': 91, 'sideways_adx_thresh': 17.815592660976822, 'sideways_atr_min_pct': 0.0008191168783433861, 'sideways_atr_max_pct': 0.14989320541623508, 'sideways_tp_mult': 1.5465646331876146, 'sideways_tsl_mult': 0.474907615262418, 'sideways_time_stop': 126, 'sideways_use_sma': True, 'sideways_use_ema': False, 'sideways_use_atr': False, 'sideways_use_adx': False, 'sideways_use_spike': False, 'sideways_rsi_required': True}.
[I 2025-08-30 16:47:42,309] Trial 532 finished with values: [-1000000000.0, 1000000000.0] and parameters: {'p_sma': 22, 'p_std': 28, 'p_atr': 29, 'p_adx': 26, 'rsi_period': 17, 'ema1': 7, 'ema2': 37, 'slip_atr_k': 0.004043320142082012, 'slip_spread_k': 0.6405696875364804, 'spread_hl_frac': 0.018217745135778483, 'bb_std_mult': 0.7637819727792226, 'rsi_os': 37, 'rsi_ob': 77, 'vol_spike': 0.16568243263236773, 'adx_thresh': 13.011430634120709, 'atr_min_pct': 0.019100667643167372, 'atr_max_pct': 0.14131319337097845, 'tp_mult': 2.4010985825108815, 'tsl_mult': 0.9803832103709673, 'strategy': 'mean_reversion', 'time_stop': 167, 'use_sma': False, 'use_atr': True, 'use_adx': True, 'use_ema': False, 'use_spike': False, 'rsi_required': True, 'edge_k': 0.0768940328309442, 'edge_cap': 0.9083636032651621, 'bull_strategy': 'mean_reversion', 'bull_bb_std_mult': 1.9664460351285475, 'bull_rsi_os': 11, 'bull_rsi_ob': 49, 'bull_adx_thresh': 5.592073244487622, 'bull_atr_min_pct': 0.014577154307166112, 'bull_atr_max_pct': 0.14788041180078282, 'bull_tp_mult': 1.327727500453773, 'bull_tsl_mult': 0.3302748722214458, 'bull_time_stop': 137, 'bull_use_sma': True, 'bull_use_ema': True, 'bull_use_atr': False, 'bull_use_adx': True, 'bull_use_spike': False, 'bull_rsi_required': True, 'bear_strategy': 'mean_reversion', 'bear_bb_std_mult': 0.5008989800343908, 'bear_rsi_os': 12, 'bear_rsi_ob': 52, 'bear_adx_thresh': 16.110438990822367, 'bear_atr_min_pct': 0.00903783718360933, 'bear_atr_max_pct': 0.053871491638264934, 'bear_tp_mult': 2.2119815945715278, 'bear_tsl_mult': 0.6101935184170595, 'bear_time_stop': 246, 'bear_use_sma': True, 'bear_use_ema': False, 'bear_use_atr': False, 'bear_use_adx': False, 'bear_use_spike': False, 'bear_rsi_required': False, 'sideways_strategy': 'breakout', 'sideways_bb_std_mult': 2.226753653575898, 'sideways_rsi_os': 27, 'sideways_rsi_ob': 48, 'sideways_adx_thresh': 18.045513903930416, 'sideways_atr_min_pct': 0.0023317054392437636, 'sideways_atr_max_pct': 0.14968885969598422, 'sideways_tp_mult': 1.5913623587614678, 'sideways_tsl_mult': 0.5271759691511735, 'sideways_time_stop': 236, 'sideways_use_sma': True, 'sideways_use_ema': False, 'sideways_use_atr': False, 'sideways_use_adx': False, 'sideways_use_spike': False, 'sideways_rsi_required': True}.
[I 2025-08-30 16:47:43,420] Trial 533 finished with values: [-1000000000.0, 1000000000.0] and parameters: {'p_sma': 23, 'p_std': 22, 'p_atr': 26, 'p_adx': 25, 'rsi_period': 52, 'ema1': 25, 'ema2': 11, 'slip_atr_k': 0.13166660885853423, 'slip_spread_k': 0.6098330013390441, 'spread_hl_frac': 0.018175341096716393, 'bb_std_mult': 2.974628460978694, 'rsi_os': 34, 'rsi_ob': 68, 'vol_spike': 0.19333388306391242, 'adx_thresh': 22.27612856323618, 'atr_min_pct': 0.018850766600006216, 'atr_max_pct': 0.07528376716225597, 'tp_mult': 2.9673775407847427, 'tsl_mult': 0.45047886472135484, 'strategy': 'mean_reversion', 'time_stop': 85, 'use_sma': False, 'use_atr': True, 'use_adx': True, 'use_ema': True, 'use_spike': False, 'rsi_required': True, 'edge_k': 0.7701397820382694, 'edge_cap': 0.903632365144825, 'bull_strategy': 'mean_reversion', 'bull_bb_std_mult': 1.9268581135032683, 'bull_rsi_os': 20, 'bull_rsi_ob': 49, 'bull_adx_thresh': 21.05401142246152, 'bull_atr_min_pct': 0.022134184388310538, 'bull_atr_max_pct': 0.14058843607038987, 'bull_tp_mult': 1.1403171309593372, 'bull_tsl_mult': 0.6035604273462466, 'bull_time_stop': 11, 'bull_use_sma': True, 'bull_use_ema': True, 'bull_use_atr': False, 'bull_use_adx': True, 'bull_use_spike': False, 'bull_rsi_required': True, 'bear_strategy': 'breakout', 'bear_bb_std_mult': 1.9730292428239558, 'bear_rsi_os': 33, 'bear_rsi_ob': 75, 'bear_adx_thresh': 11.585151776100536, 'bear_atr_min_pct': 0.01912815774032337, 'bear_atr_max_pct': 0.0976469637836676, 'bear_tp_mult': 2.223913028771992, 'bear_tsl_mult': 0.6521042630017052, 'bear_time_stop': 232, 'bear_use_sma': True, 'bear_use_ema': True, 'bear_use_atr': True, 'bear_use_adx': False, 'bear_use_spike': False, 'bear_rsi_required': False, 'sideways_strategy': 'breakout', 'sideways_bb_std_mult': 0.626496451033133, 'sideways_rsi_os': 28, 'sideways_rsi_ob': 69, 'sideways_adx_thresh': 5.005463626210563, 'sideways_atr_min_pct': 0.014873795219364295, 'sideways_atr_max_pct': 0.14475782334362358, 'sideways_tp_mult': 2.3502396208309007, 'sideways_tsl_mult': 0.4735074799253589, 'sideways_time_stop': 203, 'sideways_use_sma': True, 'sideways_use_ema': True, 'sideways_use_atr': False, 'sideways_use_adx': False, 'sideways_use_spike': False, 'sideways_rsi_required': True}.
[I 2025-08-30 16:48:38,312] Trial 534 finished with values: [-1000000000.0, 1000000000.0] and parameters: {'p_sma': 7, 'p_std': 18, 'p_atr': 27, 'p_adx': 24, 'rsi_period': 16, 'ema1': 25, 'ema2': 21, 'slip_atr_k': 0.0001019244200082493, 'slip_spread_k': 0.6143518798684403, 'spread_hl_frac': 0.02578218475853187, 'bb_std_mult': 0.6116862570750659, 'rsi_os': 9, 'rsi_ob': 75, 'vol_spike': 0.10347917969043924, 'adx_thresh': 23.31153365021489, 'atr_min_pct': 0.018956394015082114, 'atr_max_pct': 0.14142792698918052, 'tp_mult': 2.967263311029937, 'tsl_mult': 0.03008406094225402, 'strategy': 'mean_reversion', 'time_stop': 60, 'use_sma': True, 'use_atr': False, 'use_adx': True, 'use_ema': True, 'use_spike': False, 'rsi_required': False, 'edge_k': 0.7748755753255329, 'edge_cap': 0.9930383868929858, 'bull_strategy': 'mean_reversion', 'bull_bb_std_mult': 1.9433389695486003, 'bull_rsi_os': 47, 'bull_rsi_ob': 83, 'bull_adx_thresh': 20.813344924508105, 'bull_atr_min_pct': 0.02183607914909141, 'bull_atr_max_pct': 0.14832696094149783, 'bull_tp_mult': 1.3503549121618477, 'bull_tsl_mult': 0.10132701699889857, 'bull_time_stop': 80, 'bull_use_sma': True, 'bull_use_ema': True, 'bull_use_atr': False, 'bull_use_adx': True, 'bull_use_spike': False, 'bull_rsi_required': False, 'bear_strategy': 'breakout', 'bear_bb_std_mult': 2.507556654206262, 'bear_rsi_os': 12, 'bear_rsi_ob': 83, 'bear_adx_thresh': 10.450292610808031, 'bear_atr_min_pct': 0.008733595670520308, 'bear_atr_max_pct': 0.09745511909732532, 'bear_tp_mult': 1.8048057675869096, 'bear_tsl_mult': 0.6613319395967254, 'bear_time_stop': 12, 'bear_use_sma': True, 'bear_use_ema': True, 'bear_use_atr': True, 'bear_use_adx': True, 'bear_use_spike': True, 'bear_rsi_required': True, 'sideways_strategy': 'mean_reversion', 'sideways_bb_std_mult': 2.2733512790669703, 'sideways_rsi_os': 28, 'sideways_rsi_ob': 92, 'sideways_adx_thresh': 15.176156427200679, 'sideways_atr_min_pct': 0.0024896034321877387, 'sideways_atr_max_pct': 0.03383316066875811, 'sideways_tp_mult': 1.5966932496117312, 'sideways_tsl_mult': 0.5204770011851592, 'sideways_time_stop': 203, 'sideways_use_sma': True, 'sideways_use_ema': True, 'sideways_use_atr': False, 'sideways_use_adx': False, 'sideways_use_spike': True, 'sideways_rsi_required': True}.
[I 2025-08-30 16:48:39,230] Trial 535 finished with values: [-1000000000.0, 1000000000.0] and parameters: {'p_sma': 7, 'p_std': 18, 'p_atr': 27, 'p_adx': 24, 'rsi_period': 26, 'ema1': 25, 'ema2': 44, 'slip_atr_k': 0.012804795012163014, 'slip_spread_k': 0.6042919950597193, 'spread_hl_frac': 0.019833759630169878, 'bb_std_mult': 0.8840530752426436, 'rsi_os': 25, 'rsi_ob': 93, 'vol_spike': 0.00017214141279695081, 'adx_thresh': 9.52311520960848, 'atr_min_pct': 0.018973820771267046, 'atr_max_pct': 0.0754015686350015, 'tp_mult': 2.593863573984943, 'tsl_mult': 0.36333271906517106, 'strategy': 'mean_reversion', 'time_stop': 5, 'use_sma': True, 'use_atr': False, 'use_adx': True, 'use_ema': True, 'use_spike': False, 'rsi_required': False, 'edge_k': 0.3779900363509041, 'edge_cap': 0.6116803931680173, 'bull_strategy': 'mean_reversion', 'bull_bb_std_mult': 2.1902750180347113, 'bull_rsi_os': 10, 'bull_rsi_ob': 84, 'bull_adx_thresh': 20.983040143063732, 'bull_atr_min_pct': 0.024033303795613532, 'bull_atr_max_pct': 0.14038790319350983, 'bull_tp_mult': 1.340444389571012, 'bull_tsl_mult': 0.3313291757068516, 'bull_time_stop': 88, 'bull_use_sma': True, 'bull_use_ema': True, 'bull_use_atr': False, 'bull_use_adx': True, 'bull_use_spike': False, 'bull_rsi_required': False, 'bear_strategy': 'breakout', 'bear_bb_std_mult': 2.1753150143279063, 'bear_rsi_os': 12, 'bear_rsi_ob': 75, 'bear_adx_thresh': 29.29681819190451, 'bear_atr_min_pct': 0.021463623554306817, 'bear_atr_max_pct': 0.09208013054004581, 'bear_tp_mult': 1.7910237236144337, 'bear_tsl_mult': 0.7315747684733295, 'bear_time_stop': 244, 'bear_use_sma': True, 'bear_use_ema': True, 'bear_use_atr': True, 'bear_use_adx': True, 'bear_use_spike': True, 'bear_rsi_required': True, 'sideways_strategy': 'mean_reversion', 'sideways_bb_std_mult': 2.250198581570714, 'sideways_rsi_os': 10, 'sideways_rsi_ob': 93, 'sideways_adx_thresh': 5.325425011349489, 'sideways_atr_min_pct': 0.02293004833116912, 'sideways_atr_max_pct': 0.02909361472995218, 'sideways_tp_mult': 1.4317887777097282, 'sideways_tsl_mult': 0.1416650695547103, 'sideways_time_stop': 52, 'sideways_use_sma': True, 'sideways_use_ema': True, 'sideways_use_atr': True, 'sideways_use_adx': False, 'sideways_use_spike': True, 'sideways_rsi_required': True}.
[I 2025-08-30 16:48:39,682] Trial 537 finished with values: [-1000000000.0, 1000000000.0] and parameters: {'p_sma': 7, 'p_std': 19, 'p_atr': 18, 'p_adx': 24, 'rsi_period': 80, 'ema1': 25, 'ema2': 12, 'slip_atr_k': 0.013423807050188452, 'slip_spread_k': 0.5697922136816738, 'spread_hl_frac': 0.0346531810821825, 'bb_std_mult': 0.6013162116024211, 'rsi_os': 42, 'rsi_ob': 88, 'vol_spike': 0.12603684441345256, 'adx_thresh': 8.625284458022293, 'atr_min_pct': 0.0197360988415501, 'atr_max_pct': 0.1304290505705124, 'tp_mult': 2.7450240645875223, 'tsl_mult': 0.49547747055967106, 'strategy': 'mean_reversion', 'time_stop': 5, 'use_sma': True, 'use_atr': False, 'use_adx': True, 'use_ema': True, 'use_spike': False, 'rsi_required': False, 'edge_k': 1.5691985330360048, 'edge_cap': 0.5234184072900634, 'bull_strategy': 'breakout', 'bull_bb_std_mult': 2.7477145051531724, 'bull_rsi_os': 44, 'bull_rsi_ob': 94, 'bull_adx_thresh': 20.822284054978795, 'bull_atr_min_pct': 0.02071834948009697, 'bull_atr_max_pct': 0.05045325171573752, 'bull_tp_mult': 1.363101509552449, 'bull_tsl_mult': 0.0022987253171602995, 'bull_time_stop': 81, 'bull_use_sma': False, 'bull_use_ema': False, 'bull_use_atr': True, 'bull_use_adx': True, 'bull_use_spike': True, 'bull_rsi_required': False, 'bear_strategy': 'breakout', 'bear_bb_std_mult': 2.1644633745223842, 'bear_rsi_os': 7, 'bear_rsi_ob': 77, 'bear_adx_thresh': 12.986054204487079, 'bear_atr_min_pct': 0.015410433723818326, 'bear_atr_max_pct': 0.07306415554666307, 'bear_tp_mult': 1.438149852391571, 'bear_tsl_mult': 0.45591120612742303, 'bear_time_stop': 213, 'bear_use_sma': False, 'bear_use_ema': True, 'bear_use_atr': True, 'bear_use_adx': True, 'bear_use_spike': True, 'bear_rsi_required': True, 'sideways_strategy': 'mean_reversion', 'sideways_bb_std_mult': 0.8863827858751023, 'sideways_rsi_os': 31, 'sideways_rsi_ob': 92, 'sideways_adx_thresh': 8.605454363037813, 'sideways_atr_min_pct': 5.779464353100204e-05, 'sideways_atr_max_pct': 0.019324594241031556, 'sideways_tp_mult': 2.8878575872083108, 'sideways_tsl_mult': 0.37178956996516427, 'sideways_time_stop': 288, 'sideways_use_sma': False, 'sideways_use_ema': True, 'sideways_use_atr': True, 'sideways_use_adx': True, 'sideways_use_spike': True, 'sideways_rsi_required': False}.
[I 2025-08-30 16:48:40,466] Trial 536 finished with values: [-1000000000.0, 1000000000.0] and parameters: {'p_sma': 33, 'p_std': 57, 'p_atr': 27, 'p_adx': 24, 'rsi_period': 58, 'ema1': 25, 'ema2': 45, 'slip_atr_k': 0.011588340136506052, 'slip_spread_k': 0.617219470285934, 'spread_hl_frac': 0.009305649588081756, 'bb_std_mult': 2.2473672452122617, 'rsi_os': 21, 'rsi_ob': 88, 'vol_spike': 0.02517510392197035, 'adx_thresh': 31.10565321089568, 'atr_min_pct': 0.007099765352813172, 'atr_max_pct': 0.07408457166121366, 'tp_mult': 2.0419646025691183, 'tsl_mult': 0.45083969653187916, 'strategy': 'mean_reversion', 'time_stop': 5, 'use_sma': True, 'use_atr': False, 'use_adx': True, 'use_ema': True, 'use_spike': False, 'rsi_required': False, 'edge_k': 1.6536431168292482, 'edge_cap': 0.6190695509010893, 'bull_strategy': 'mean_reversion', 'bull_bb_std_mult': 1.7601324870671222, 'bull_rsi_os': 32, 'bull_rsi_ob': 49, 'bull_adx_thresh': 21.067485742635334, 'bull_atr_min_pct': 0.0070611855095851495, 'bull_atr_max_pct': 0.05100546229446913, 'bull_tp_mult': 2.7321638747779335, 'bull_tsl_mult': 0.6044670386800085, 'bull_time_stop': 58, 'bull_use_sma': True, 'bull_use_ema': False, 'bull_use_atr': False, 'bull_use_adx': True, 'bull_use_spike': True, 'bull_rsi_required': False, 'bear_strategy': 'breakout', 'bear_bb_std_mult': 2.174410571343738, 'bear_rsi_os': 14, 'bear_rsi_ob': 83, 'bear_adx_thresh': 6.4047707045285005, 'bear_atr_min_pct': 0.019016679850566116, 'bear_atr_max_pct': 0.047102112111661404, 'bear_tp_mult': 2.2464356116398774, 'bear_tsl_mult': 0.3514611733426304, 'bear_time_stop': 231, 'bear_use_sma': False, 'bear_use_ema': True, 'bear_use_atr': True, 'bear_use_adx': True, 'bear_use_spike': True, 'bear_rsi_required': True, 'sideways_strategy': 'mean_reversion', 'sideways_bb_std_mult': 2.093724564985834, 'sideways_rsi_os': 16, 'sideways_rsi_ob': 92, 'sideways_adx_thresh': 14.216455344900993, 'sideways_atr_min_pct': 7.968781904829528e-05, 'sideways_atr_max_pct': 0.045420778482543424, 'sideways_tp_mult': 1.9331302832315422, 'sideways_tsl_mult': 0.3772308722405741, 'sideways_time_stop': 226, 'sideways_use_sma': True, 'sideways_use_ema': True, 'sideways_use_atr': True, 'sideways_use_adx': True, 'sideways_use_spike': True, 'sideways_rsi_required': True}.
[I 2025-08-30 16:49:31,258] Trial 540 finished with values: [-1000000000.0, 1000000000.0] and parameters: {'p_sma': 52, 'p_std': 57, 'p_atr': 12, 'p_adx': 23, 'rsi_period': 20, 'ema1': 21, 'ema2': 10, 'slip_atr_k': 0.00845120760547867, 'slip_spread_k': 0.27024711018669023, 'spread_hl_frac': 0.017049953069633906, 'bb_std_mult': 3.4706032409521343, 'rsi_os': 35, 'rsi_ob': 70, 'vol_spike': 0.017153516578880153, 'adx_thresh': 30.132647869830713, 'atr_min_pct': 0.018218962776239248, 'atr_max_pct': 0.1348110852211405, 'tp_mult': 2.7704743210657523, 'tsl_mult': 0.4573846016526246, 'strategy': 'breakout', 'time_stop': 11, 'use_sma': False, 'use_atr': True, 'use_adx': False, 'use_ema': False, 'use_spike': False, 'rsi_required': True, 'edge_k': 1.642547235481701, 'edge_cap': 0.6045902792648311, 'bull_strategy': 'breakout', 'bull_bb_std_mult': 1.8126057518885432, 'bull_rsi_os': 25, 'bull_rsi_ob': 54, 'bull_adx_thresh': 19.41880567262444, 'bull_atr_min_pct': 0.02111039198412145, 'bull_atr_max_pct': 0.13678234170309123, 'bull_tp_mult': 1.2883504265876176, 'bull_tsl_mult': 0.26407137450565543, 'bull_time_stop': 59, 'bull_use_sma': False, 'bull_use_ema': False, 'bull_use_atr': True, 'bull_use_adx': False, 'bull_use_spike': True, 'bull_rsi_required': False, 'bear_strategy': 'mean_reversion', 'bear_bb_std_mult': 3.0240440406151636, 'bear_rsi_os': 14, 'bear_rsi_ob': 87, 'bear_adx_thresh': 22.703545723697513, 'bear_atr_min_pct': 0.025689389042130098, 'bear_atr_max_pct': 0.08984412138625944, 'bear_tp_mult': 2.3124630463298317, 'bear_tsl_mult': 0.6767347959038524, 'bear_time_stop': 175, 'bear_use_sma': False, 'bear_use_ema': False, 'bear_use_atr': False, 'bear_use_adx': False, 'bear_use_spike': False, 'bear_rsi_required': False, 'sideways_strategy': 'breakout', 'sideways_bb_std_mult': 3.4174628125343496, 'sideways_rsi_os': 16, 'sideways_rsi_ob': 80, 'sideways_adx_thresh': 15.614516026529296, 'sideways_atr_min_pct': 0.0016033179003094352, 'sideways_atr_max_pct': 0.011973661142003683, 'sideways_tp_mult': 1.2883248315427986, 'sideways_tsl_mult': 0.49811935343210295, 'sideways_time_stop': 224, 'sideways_use_sma': False, 'sideways_use_ema': False, 'sideways_use_atr': False, 'sideways_use_adx': True, 'sideways_use_spike': False, 'sideways_rsi_required': False}.
[I 2025-08-30 16:49:31,675] Trial 541 finished with values: [-1000000000.0, 1000000000.0] and parameters: {'p_sma': 36, 'p_std': 58, 'p_atr': 12, 'p_adx': 23, 'rsi_period': 69, 'ema1': 28, 'ema2': 10, 'slip_atr_k': 0.12199848346870933, 'slip_spread_k': 0.2700737432191819, 'spread_hl_frac': 0.013822095350681813, 'bb_std_mult': 2.6598454869824595, 'rsi_os': 23, 'rsi_ob': 89, 'vol_spike': 0.007079197983017725, 'adx_thresh': 11.527515647474273, 'atr_min_pct': 0.027923109954595036, 'atr_max_pct': 0.1126486300024415, 'tp_mult': 1.9160185987003, 'tsl_mult': 0.4225876792929806, 'strategy': 'breakout', 'time_stop': 14, 'use_sma': False, 'use_atr': True, 'use_adx': False, 'use_ema': False, 'use_spike': False, 'rsi_required': True, 'edge_k': 0.6937402778497133, 'edge_cap': 0.5714087930157116, 'bull_strategy': 'breakout', 'bull_bb_std_mult': 2.3948293769057276, 'bull_rsi_os': 19, 'bull_rsi_ob': 53, 'bull_adx_thresh': 17.934918572957457, 'bull_atr_min_pct': 0.022666631357526276, 'bull_atr_max_pct': 0.09184632404455118, 'bull_tp_mult': 1.2678102566905562, 'bull_tsl_mult': 0.17921350796338098, 'bull_time_stop': 66, 'bull_use_sma': False, 'bull_use_ema': True, 'bull_use_atr': True, 'bull_use_adx': False, 'bull_use_spike': False, 'bull_rsi_required': False, 'bear_strategy': 'mean_reversion', 'bear_bb_std_mult': 1.8515270354834992, 'bear_rsi_os': 13, 'bear_rsi_ob': 57, 'bear_adx_thresh': 30.884956143911992, 'bear_atr_min_pct': 0.02651395195180904, 'bear_atr_max_pct': 0.020759720929992405, 'bear_tp_mult': 2.2974461270219244, 'bear_tsl_mult': 0.6756816467118967, 'bear_time_stop': 217, 'bear_use_sma': True, 'bear_use_ema': False, 'bear_use_atr': False, 'bear_use_adx': False, 'bear_use_spike': False, 'bear_rsi_required': False, 'sideways_strategy': 'breakout', 'sideways_bb_std_mult': 2.0629051078761234, 'sideways_rsi_os': 18, 'sideways_rsi_ob': 94, 'sideways_adx_thresh': 15.611441512401052, 'sideways_atr_min_pct': 0.0014229641420931947, 'sideways_atr_max_pct': 0.011774660461717087, 'sideways_tp_mult': 1.13793904992459, 'sideways_tsl_mult': 0.8240597778296541, 'sideways_time_stop': 212, 'sideways_use_sma': False, 'sideways_use_ema': False, 'sideways_use_atr': False, 'sideways_use_adx': False, 'sideways_use_spike': False, 'sideways_rsi_required': False}.
