[I 2025-08-30 17:13:53,841] Trial 677 finished with values: [-1000000000.0, 1000000000.0] and parameters: {'p_sma': 27, 'p_std': 23, 'p_atr': 16, 'p_adx': 7, 'rsi_period': 21, 'ema1': 19, 'ema2': 12, 'slip_atr_k': 0.14039835489802732, 'slip_spread_k': 0.1880907244261858, 'spread_hl_frac': 0.020554657919093278, 'bb_std_mult': 3.342603431277378, 'rsi_os': 5, 'rsi_ob': 60, 'vol_spike': 0.09062973869586957, 'adx_thresh': 10.077421951584258, 'atr_min_pct': 0.018305580119717772, 'atr_max_pct': 0.14724277287192605, 'tp_mult': 1.6001569139198855, 'tsl_mult': 0.9247711961486424, 'strategy': 'mean_reversion', 'time_stop': 65, 'use_sma': False, 'use_atr': False, 'use_adx': True, 'use_ema': False, 'use_spike': False, 'rsi_required': True, 'edge_k': 0.4245821362356984, 'edge_cap': 0.9749249357069176, 'bull_strategy': 'mean_reversion', 'bull_bb_std_mult': 1.8965222499013312, 'bull_rsi_os': 10, 'bull_rsi_ob': 52, 'bull_adx_thresh': 34.993827648896364, 'bull_atr_min_pct': 0.021620453816898328, 'bull_atr_max_pct': 0.07443987757033116, 'bull_tp_mult': 2.2165845566716547, 'bull_tsl_mult': 0.8358012559431737, 'bull_time_stop': 101, 'bull_use_sma': True, 'bull_use_ema': True, 'bull_use_atr': False, 'bull_use_adx': True, 'bull_use_spike': False, 'bull_rsi_required': False, 'bear_strategy': 'mean_reversion', 'bear_bb_std_mult': 1.2349920148003464, 'bear_rsi_os': 19, 'bear_rsi_ob': 60, 'bear_adx_thresh': 6.849123428572231, 'bear_atr_min_pct': 0.01051702718750841, 'bear_atr_max_pct': 0.10475237824371644, 'bear_tp_mult': 2.130904361101234, 'bear_tsl_mult': 0.2631351308323229, 'bear_time_stop': 186, 'bear_use_sma': True, 'bear_use_ema': False, 'bear_use_atr': False, 'bear_use_adx': False, 'bear_use_spike': False, 'bear_rsi_required': False, 'sideways_strategy': 'mean_reversion', 'sideways_bb_std_mult': 0.6518491340054061, 'sideways_rsi_os': 30, 'sideways_rsi_ob': 46, 'sideways_adx_thresh': 11.142883764152401, 'sideways_atr_min_pct': 0.011970014758990753, 'sideways_atr_max_pct': 0.1008953106239891, 'sideways_tp_mult': 2.939429912768418, 'sideways_tsl_mult': 0.9114232368744195, 'sideways_time_stop': 264, 'sideways_use_sma': False, 'sideways_use_ema': False, 'sideways_use_atr': False, 'sideways_use_adx': False, 'sideways_use_spike': False, 'sideways_rsi_required': True}.
[I 2025-08-30 17:13:54,062] Trial 675 finished with values: [-1000000000.0, 1000000000.0] and parameters: {'p_sma': 8, 'p_std': 20, 'p_atr': 16, 'p_adx': 7, 'rsi_period': 21, 'ema1': 18, 'ema2': 11, 'slip_atr_k': 0.14981486750395567, 'slip_spread_k': 0.1893847964910072, 'spread_hl_frac': 0.02081596473757218, 'bb_std_mult': 3.2179640066810484, 'rsi_os': 34, 'rsi_ob': 85, 'vol_spike': 0.10060455890901576, 'adx_thresh': 9.863404336950207, 'atr_min_pct': 0.027661250013814, 'atr_max_pct': 0.12236484241991606, 'tp_mult': 2.8002749909587052, 'tsl_mult': 0.934564550000512, 'strategy': 'mean_reversion', 'time_stop': 110, 'use_sma': False, 'use_atr': True, 'use_adx': True, 'use_ema': False, 'use_spike': False, 'rsi_required': True, 'edge_k': 0.3999637203936248, 'edge_cap': 0.9602360645153879, 'bull_strategy': 'mean_reversion', 'bull_bb_std_mult': 1.8939817030421293, 'bull_rsi_os': 47, 'bull_rsi_ob': 92, 'bull_adx_thresh': 34.05773585347026, 'bull_atr_min_pct': 0.010340739970754832, 'bull_atr_max_pct': 0.07862218536151194, 'bull_tp_mult': 2.2082578774048716, 'bull_tsl_mult': 0.8603381405451753, 'bull_time_stop': 99, 'bull_use_sma': True, 'bull_use_ema': True, 'bull_use_atr': False, 'bull_use_adx': True, 'bull_use_spike': False, 'bull_rsi_required': False, 'bear_strategy': 'mean_reversion', 'bear_bb_std_mult': 0.9899926639851451, 'bear_rsi_os': 15, 'bear_rsi_ob': 76, 'bear_adx_thresh': 24.813025809712766, 'bear_atr_min_pct': 0.012477232680134495, 'bear_atr_max_pct': 0.10401381834950163, 'bear_tp_mult': 2.1875400350103056, 'bear_tsl_mult': 0.632089481192031, 'bear_time_stop': 185, 'bear_use_sma': True, 'bear_use_ema': False, 'bear_use_atr': False, 'bear_use_adx': False, 'bear_use_spike': False, 'bear_rsi_required': False, 'sideways_strategy': 'mean_reversion', 'sideways_bb_std_mult': 0.6668467253465187, 'sideways_rsi_os': 30, 'sideways_rsi_ob': 91, 'sideways_adx_thresh': 11.303902173830126, 'sideways_atr_min_pct': 0.007577865737652187, 'sideways_atr_max_pct': 0.10062929120734146, 'sideways_tp_mult': 2.9962360535284502, 'sideways_tsl_mult': 0.057079818552927875, 'sideways_time_stop': 272, 'sideways_use_sma': False, 'sideways_use_ema': False, 'sideways_use_atr': False, 'sideways_use_adx': False, 'sideways_use_spike': False, 'sideways_rsi_required': True}.
[I 2025-08-30 17:13:54,517] Trial 676 finished with values: [-1000000000.0, 1000000000.0] and parameters: {'p_sma': 27, 'p_std': 23, 'p_atr': 16, 'p_adx': 7, 'rsi_period': 21, 'ema1': 19, 'ema2': 12, 'slip_atr_k': 0.00016607422140786816, 'slip_spread_k': 0.18759870851827434, 'spread_hl_frac': 0.004827100077325109, 'bb_std_mult': 3.3349372654591263, 'rsi_os': 34, 'rsi_ob': 69, 'vol_spike': 0.1066158921816103, 'adx_thresh': 10.023936700919208, 'atr_min_pct': 0.027662989831509333, 'atr_max_pct': 0.14997655185751835, 'tp_mult': 2.613015767531584, 'tsl_mult': 0.9286952552824184, 'strategy': 'mean_reversion', 'time_stop': 66, 'use_sma': False, 'use_atr': False, 'use_adx': True, 'use_ema': False, 'use_spike': False, 'rsi_required': True, 'edge_k': 0.336605699315479, 'edge_cap': 0.8564669359495738, 'bull_strategy': 'mean_reversion', 'bull_bb_std_mult': 1.9003557342151745, 'bull_rsi_os': 13, 'bull_rsi_ob': 52, 'bull_adx_thresh': 34.42058464884207, 'bull_atr_min_pct': 0.011402578708026774, 'bull_atr_max_pct': 0.031541484302231214, 'bull_tp_mult': 2.1881552349593885, 'bull_tsl_mult': 0.8903863699733329, 'bull_time_stop': 97, 'bull_use_sma': True, 'bull_use_ema': True, 'bull_use_atr': False, 'bull_use_adx': True, 'bull_use_spike': False, 'bull_rsi_required': False, 'bear_strategy': 'mean_reversion', 'bear_bb_std_mult': 0.9853281958529103, 'bear_rsi_os': 16, 'bear_rsi_ob': 76, 'bear_adx_thresh': 12.140486417683565, 'bear_atr_min_pct': 0.020607323767438, 'bear_atr_max_pct': 0.1051128303991235, 'bear_tp_mult': 2.1378456131252963, 'bear_tsl_mult': 0.6384602943373802, 'bear_time_stop': 22, 'bear_use_sma': True, 'bear_use_ema': False, 'bear_use_atr': False, 'bear_use_adx': False, 'bear_use_spike': False, 'bear_rsi_required': False, 'sideways_strategy': 'mean_reversion', 'sideways_bb_std_mult': 0.6664308001017331, 'sideways_rsi_os': 30, 'sideways_rsi_ob': 54, 'sideways_adx_thresh': 11.165731884516617, 'sideways_atr_min_pct': 0.003648684103349586, 'sideways_atr_max_pct': 0.10130733972535531, 'sideways_tp_mult': 2.9115527106948873, 'sideways_tsl_mult': 0.9100258306254556, 'sideways_time_stop': 268, 'sideways_use_sma': False, 'sideways_use_ema': False, 'sideways_use_atr': False, 'sideways_use_adx': False, 'sideways_use_spike': False, 'sideways_rsi_required': True}.
[I 2025-08-30 17:13:54,813] Trial 678 finished with values: [-1000000000.0, 1000000000.0] and parameters: {'p_sma': 26, 'p_std': 23, 'p_atr': 16, 'p_adx': 7, 'rsi_period': 47, 'ema1': 17, 'ema2': 18, 'slip_atr_k': 0.1340244455283431, 'slip_spread_k': 0.19176338556093792, 'spread_hl_frac': 0.01698157828716594, 'bb_std_mult': 1.3952787992653282, 'rsi_os': 44, 'rsi_ob': 87, 'vol_spike': 0.09146274551386993, 'adx_thresh': 10.037922354120642, 'atr_min_pct': 0.026896388997342126, 'atr_max_pct': 0.14716559808022803, 'tp_mult': 2.9152001533224086, 'tsl_mult': 0.931960902936373, 'strategy': 'mean_reversion', 'time_stop': 41, 'use_sma': False, 'use_atr': False, 'use_adx': True, 'use_ema': False, 'use_spike': False, 'rsi_required': True, 'edge_k': 0.34639892907167386, 'edge_cap': 0.957866641378729, 'bull_strategy': 'mean_reversion', 'bull_bb_std_mult': 1.902149379582796, 'bull_rsi_os': 13, 'bull_rsi_ob': 68, 'bull_adx_thresh': 34.49804015233338, 'bull_atr_min_pct': 0.021534733797804177, 'bull_atr_max_pct': 0.13832729622178855, 'bull_tp_mult': 2.223523738655156, 'bull_tsl_mult': 0.8772687686680436, 'bull_time_stop': 191, 'bull_use_sma': True, 'bull_use_ema': True, 'bull_use_atr': False, 'bull_use_adx': True, 'bull_use_spike': False, 'bull_rsi_required': False, 'bear_strategy': 'mean_reversion', 'bear_bb_std_mult': 0.9352334490990009, 'bear_rsi_os': 14, 'bear_rsi_ob': 54, 'bear_adx_thresh': 6.042457950885106, 'bear_atr_min_pct': 0.01252128021325405, 'bear_atr_max_pct': 0.10490060560877246, 'bear_tp_mult': 2.13008037573878, 'bear_tsl_mult': 0.42654132148990165, 'bear_time_stop': 27, 'bear_use_sma': True, 'bear_use_ema': True, 'bear_use_atr': False, 'bear_use_adx': False, 'bear_use_spike': False, 'bear_rsi_required': False, 'sideways_strategy': 'mean_reversion', 'sideways_bb_std_mult': 0.6583264773093875, 'sideways_rsi_os': 19, 'sideways_rsi_ob': 45, 'sideways_adx_thresh': 11.139683953882347, 'sideways_atr_min_pct': 0.02417851408889352, 'sideways_atr_max_pct': 0.10048351876244292, 'sideways_tp_mult': 2.9139340882368687, 'sideways_tsl_mult': 0.4430594582807374, 'sideways_time_stop': 291, 'sideways_use_sma': False, 'sideways_use_ema': False, 'sideways_use_atr': False, 'sideways_use_adx': False, 'sideways_use_spike': False, 'sideways_rsi_required': True}.
[I 2025-08-30 17:14:32,860] Trial 682 finished with values: [-1000000000.0, 1000000000.0] and parameters: {'p_sma': 58, 'p_std': 19, 'p_atr': 17, 'p_adx': 8, 'rsi_period': 44, 'ema1': 16, 'ema2': 14, 'slip_atr_k': 0.005170761967312377, 'slip_spread_k': 0.21225180393980259, 'spread_hl_frac': 0.018841506208562207, 'bb_std_mult': 3.0823790316687, 'rsi_os': 12, 'rsi_ob': 83, 'vol_spike': 0.07396109407278847, 'adx_thresh': 8.838871107186858, 'atr_min_pct': 0.029982395065083472, 'atr_max_pct': 0.0708843087137394, 'tp_mult': 2.8325132685989125, 'tsl_mult': 0.9641385338261527, 'strategy': 'mean_reversion', 'time_stop': 27, 'use_sma': False, 'use_atr': True, 'use_adx': False, 'use_ema': False, 'use_spike': False, 'rsi_required': True, 'edge_k': 0.9416454907374465, 'edge_cap': 0.7479679490443835, 'bull_strategy': 'mean_reversion', 'bull_bb_std_mult': 1.3327195098201394, 'bull_rsi_os': 10, 'bull_rsi_ob': 53, 'bull_adx_thresh': 33.29147449613071, 'bull_atr_min_pct': 0.022425249947444895, 'bull_atr_max_pct': 0.14973247579712906, 'bull_tp_mult': 2.2945394492813116, 'bull_tsl_mult': 0.7556967532362637, 'bull_time_stop': 110, 'bull_use_sma': True, 'bull_use_ema': False, 'bull_use_atr': False, 'bull_use_adx': False, 'bull_use_spike': False, 'bull_rsi_required': True, 'bear_strategy': 'mean_reversion', 'bear_bb_std_mult': 1.2349950934911884, 'bear_rsi_os': 14, 'bear_rsi_ob': 77, 'bear_adx_thresh': 11.905012552780683, 'bear_atr_min_pct': 0.019222142659077616, 'bear_atr_max_pct': 0.10817215475461726, 'bear_tp_mult': 1.670022822245922, 'bear_tsl_mult': 0.30429184650725954, 'bear_time_stop': 214, 'bear_use_sma': False, 'bear_use_ema': True, 'bear_use_atr': False, 'bear_use_adx': False, 'bear_use_spike': False, 'bear_rsi_required': False, 'sideways_strategy': 'breakout', 'sideways_bb_std_mult': 0.7688456523546718, 'sideways_rsi_os': 33, 'sideways_rsi_ob': 94, 'sideways_adx_thresh': 7.866452607652329, 'sideways_atr_min_pct': 0.029495731173641355, 'sideways_atr_max_pct': 0.11002867560881759, 'sideways_tp_mult': 2.8860804418410915, 'sideways_tsl_mult': 0.4204559776937978, 'sideways_time_stop': 288, 'sideways_use_sma': True, 'sideways_use_ema': False, 'sideways_use_atr': True, 'sideways_use_adx': True, 'sideways_use_spike': False, 'sideways_rsi_required': False}.
[I 2025-08-30 17:14:33,277] Trial 680 finished with values: [-1000000000.0, 1000000000.0] and parameters: {'p_sma': 59, 'p_std': 22, 'p_atr': 17, 'p_adx': 9, 'rsi_period': 26, 'ema1': 17, 'ema2': 39, 'slip_atr_k': 0.022045867753107018, 'slip_spread_k': 0.21371873373267736, 'spread_hl_frac': 0.042812982266835165, 'bb_std_mult': 1.399675681581022, 'rsi_os': 34, 'rsi_ob': 58, 'vol_spike': 0.07553413047137504, 'adx_thresh': 10.85510004382214, 'atr_min_pct': 0.020244566590953795, 'atr_max_pct': 0.07038759903937573, 'tp_mult': 1.8209398765030067, 'tsl_mult': 0.9678142576149542, 'strategy': 'mean_reversion', 'time_stop': 25, 'use_sma': False, 'use_atr': False, 'use_adx': False, 'use_ema': False, 'use_spike': False, 'rsi_required': True, 'edge_k': 0.3219003802483167, 'edge_cap': 0.7951064169063943, 'bull_strategy': 'mean_reversion', 'bull_bb_std_mult': 1.9853658740436624, 'bull_rsi_os': 45, 'bull_rsi_ob': 53, 'bull_adx_thresh': 34.995385598133055, 'bull_atr_min_pct': 0.0225033594166199, 'bull_atr_max_pct': 0.13859580579428651, 'bull_tp_mult': 2.2997933219058755, 'bull_tsl_mult': 0.7468137368075018, 'bull_time_stop': 79, 'bull_use_sma': True, 'bull_use_ema': True, 'bull_use_atr': False, 'bull_use_adx': False, 'bull_use_spike': False, 'bull_rsi_required': False, 'bear_strategy': 'mean_reversion', 'bear_bb_std_mult': 1.3654330484951092, 'bear_rsi_os': 14, 'bear_rsi_ob': 77, 'bear_adx_thresh': 11.988809234791233, 'bear_atr_min_pct': 0.02066544122861424, 'bear_atr_max_pct': 0.10750760418445579, 'bear_tp_mult': 1.1436576421871907, 'bear_tsl_mult': 0.6164090523660075, 'bear_time_stop': 215, 'bear_use_sma': True, 'bear_use_ema': True, 'bear_use_atr': False, 'bear_use_adx': False, 'bear_use_spike': False, 'bear_rsi_required': False, 'sideways_strategy': 'breakout', 'sideways_bb_std_mult': 0.8010170681577626, 'sideways_rsi_os': 6, 'sideways_rsi_ob': 65, 'sideways_adx_thresh': 10.680502616847102, 'sideways_atr_min_pct': 0.023562261846128987, 'sideways_atr_max_pct': 0.1097933801549157, 'sideways_tp_mult': 2.9213169744079797, 'sideways_tsl_mult': 0.4434156997641978, 'sideways_time_stop': 290, 'sideways_use_sma': True, 'sideways_use_ema': False, 'sideways_use_atr': False, 'sideways_use_adx': False, 'sideways_use_spike': False, 'sideways_rsi_required': True}.
[I 2025-08-30 17:14:33,688] Trial 679 finished with values: [-1000000000.0, 1000000000.0] and parameters: {'p_sma': 58, 'p_std': 22, 'p_atr': 16, 'p_adx': 7, 'rsi_period': 50, 'ema1': 17, 'ema2': 11, 'slip_atr_k': 0.022391310272553925, 'slip_spread_k': 0.18064009905371245, 'spread_hl_frac': 0.019043549718117357, 'bb_std_mult': 3.17386181529958, 'rsi_os': 34, 'rsi_ob': 69, 'vol_spike': 0.07422643347266579, 'adx_thresh': 10.852247026249724, 'atr_min_pct': 0.016461294256093627, 'atr_max_pct': 0.07079849604457457, 'tp_mult': 2.8236607063299166, 'tsl_mult': 0.9647981463884134, 'strategy': 'mean_reversion', 'time_stop': 165, 'use_sma': False, 'use_atr': True, 'use_adx': True, 'use_ema': False, 'use_spike': False, 'rsi_required': True, 'edge_k': 0.5066937083954349, 'edge_cap': 0.7896330781612555, 'bull_strategy': 'mean_reversion', 'bull_bb_std_mult': 1.991693870168286, 'bull_rsi_os': 13, 'bull_rsi_ob': 73, 'bull_adx_thresh': 34.484426628516275, 'bull_atr_min_pct': 0.012871216849791629, 'bull_atr_max_pct': 0.1370221315228728, 'bull_tp_mult': 2.290501192594594, 'bull_tsl_mult': 0.739022835904257, 'bull_time_stop': 190, 'bull_use_sma': True, 'bull_use_ema': True, 'bull_use_atr': False, 'bull_use_adx': True, 'bull_use_spike': False, 'bull_rsi_required': False, 'bear_strategy': 'mean_reversion', 'bear_bb_std_mult': 1.3879338362469196, 'bear_rsi_os': 34, 'bear_rsi_ob': 89, 'bear_adx_thresh': 12.135629416022535, 'bear_atr_min_pct': 0.01195230718537657, 'bear_atr_max_pct': 0.10762268328713662, 'bear_tp_mult': 2.259446637007, 'bear_tsl_mult': 0.0940439401350825, 'bear_time_stop': 132, 'bear_use_sma': True, 'bear_use_ema': True, 'bear_use_atr': False, 'bear_use_adx': False, 'bear_use_spike': False, 'bear_rsi_required': False, 'sideways_strategy': 'mean_reversion', 'sideways_bb_std_mult': 0.8077954913979843, 'sideways_rsi_os': 30, 'sideways_rsi_ob': 53, 'sideways_adx_thresh': 11.69968758346382, 'sideways_atr_min_pct': 0.0033946955897882682, 'sideways_atr_max_pct': 0.11003239463974096, 'sideways_tp_mult': 2.904559858953053, 'sideways_tsl_mult': 0.4398290895804108, 'sideways_time_stop': 293, 'sideways_use_sma': False, 'sideways_use_ema': False, 'sideways_use_atr': False, 'sideways_use_adx': False, 'sideways_use_spike': False, 'sideways_rsi_required': True}.
[I 2025-08-30 17:14:34,114] Trial 681 finished with values: [-1000000000.0, 1000000000.0] and parameters: {'p_sma': 40, 'p_std': 22, 'p_atr': 17, 'p_adx': 8, 'rsi_period': 24, 'ema1': 17, 'ema2': 38, 'slip_atr_k': 0.038105337652085444, 'slip_spread_k': 0.2172071233903276, 'spread_hl_frac': 0.01710301672786099, 'bb_std_mult': 3.130352252727239, 'rsi_os': 33, 'rsi_ob': 87, 'vol_spike': 0.08685464642026886, 'adx_thresh': 30.986966111670945, 'atr_min_pct': 0.014985115195283007, 'atr_max_pct': 0.1462506959354498, 'tp_mult': 1.8144334412774117, 'tsl_mult': 0.8687262875914008, 'strategy': 'mean_reversion', 'time_stop': 243, 'use_sma': False, 'use_atr': True, 'use_adx': False, 'use_ema': False, 'use_spike': False, 'rsi_required': True, 'edge_k': 0.7985323058353395, 'edge_cap': 0.8341593095310978, 'bull_strategy': 'mean_reversion', 'bull_bb_std_mult': 1.9825458190427343, 'bull_rsi_os': 45, 'bull_rsi_ob': 53, 'bull_adx_thresh': 33.406507398414185, 'bull_atr_min_pct': 0.013164969016664488, 'bull_atr_max_pct': 0.1370588546280489, 'bull_tp_mult': 2.300786483996429, 'bull_tsl_mult': 0.7967702844091931, 'bull_time_stop': 79, 'bull_use_sma': True, 'bull_use_ema': True, 'bull_use_atr': False, 'bull_use_adx': False, 'bull_use_spike': False, 'bull_rsi_required': False, 'bear_strategy': 'mean_reversion', 'bear_bb_std_mult': 1.4049047910691514, 'bear_rsi_os': 14, 'bear_rsi_ob': 95, 'bear_adx_thresh': 5.788687026063528, 'bear_atr_min_pct': 0.013688393353768064, 'bear_atr_max_pct': 0.11247797840311236, 'bear_tp_mult': 1.671418504966058, 'bear_tsl_mult': 0.8733612040416148, 'bear_time_stop': 132, 'bear_use_sma': True, 'bear_use_ema': True, 'bear_use_atr': False, 'bear_use_adx': False, 'bear_use_spike': False, 'bear_rsi_required': False, 'sideways_strategy': 'breakout', 'sideways_bb_std_mult': 0.8032833796418999, 'sideways_rsi_os': 41, 'sideways_rsi_ob': 75, 'sideways_adx_thresh': 11.758771443177848, 'sideways_atr_min_pct': 0.023374541693418953, 'sideways_atr_max_pct': 0.08886504504369065, 'sideways_tp_mult': 2.891905755535543, 'sideways_tsl_mult': 0.9391745866497603, 'sideways_time_stop': 293, 'sideways_use_sma': True, 'sideways_use_ema': False, 'sideways_use_atr': False, 'sideways_use_adx': False, 'sideways_use_spike': False, 'sideways_rsi_required': True}.
[I 2025-08-30 17:15:19,821] Trial 683 finished with values: [-1000000000.0, 1000000000.0] and parameters: {'p_sma': 5, 'p_std': 22, 'p_atr': 17, 'p_adx': 9, 'rsi_period': 26, 'ema1': 17, 'ema2': 11, 'slip_atr_k': 0.020542347161180648, 'slip_spread_k': 0.22087907267188947, 'spread_hl_frac': 0.04124611904083232, 'bb_std_mult': 1.2783016298822405, 'rsi_os': 33, 'rsi_ob': 66, 'vol_spike': 0.08333764656882736, 'adx_thresh': 10.908418490357588, 'atr_min_pct': 0.006558106919116638, 'atr_max_pct': 0.14337935561177353, 'tp_mult': 1.7816327075764966, 'tsl_mult': 0.9646153286927118, 'strategy': 'breakout', 'time_stop': 184, 'use_sma': False, 'use_atr': True, 'use_adx': True, 'use_ema': False, 'use_spike': False, 'rsi_required': False, 'edge_k': 0.7913971901323771, 'edge_cap': 0.9382107472367494, 'bull_strategy': 'mean_reversion', 'bull_bb_std_mult': 1.9898062378644163, 'bull_rsi_os': 34, 'bull_rsi_ob': 53, 'bull_adx_thresh': 34.43871113653771, 'bull_atr_min_pct': 0.02283024597167323, 'bull_atr_max_pct': 0.13843010786772042, 'bull_tp_mult': 2.2835921636994763, 'bull_tsl_mult': 0.7424670924216102, 'bull_time_stop': 79, 'bull_use_sma': True, 'bull_use_ema': True, 'bull_use_atr': False, 'bull_use_adx': True, 'bull_use_spike': True, 'bull_rsi_required': False, 'bear_strategy': 'mean_reversion', 'bear_bb_std_mult': 1.3650050031395116, 'bear_rsi_os': 15, 'bear_rsi_ob': 89, 'bear_adx_thresh': 12.198018783315165, 'bear_atr_min_pct': 0.020292723108652093, 'bear_atr_max_pct': 0.11280173490123785, 'bear_tp_mult': 2.2420747554803024, 'bear_tsl_mult': 0.6159854357711593, 'bear_time_stop': 121, 'bear_use_sma': True, 'bear_use_ema': False, 'bear_use_atr': False, 'bear_use_adx': False, 'bear_use_spike': True, 'bear_rsi_required': False, 'sideways_strategy': 'breakout', 'sideways_bb_std_mult': 0.8111289697629096, 'sideways_rsi_os': 9, 'sideways_rsi_ob': 93, 'sideways_adx_thresh': 11.792258333454372, 'sideways_atr_min_pct': 0.001046821346402805, 'sideways_atr_max_pct': 0.0919835282795681, 'sideways_tp_mult': 2.8040642279734436, 'sideways_tsl_mult': 0.4609111181152076, 'sideways_time_stop': 283, 'sideways_use_sma': True, 'sideways_use_ema': False, 'sideways_use_atr': False, 'sideways_use_adx': False, 'sideways_use_spike': False, 'sideways_rsi_required': True}.
