[I 2025-08-30 16:17:12,753] Trial 349 finished with values: [-0.06005110307842154, 0.0600241825594541] and parameters: {'p_sma': 51, 'p_std': 56, 'p_atr': 28, 'p_adx': 25, 'rsi_period': 19, 'ema1': 25, 'ema2': 12, 'slip_atr_k': 0.06767138169878735, 'slip_spread_k': 0.5427015558233164, 'spread_hl_frac': 0.018270218548304747, 'bb_std_mult': 3.091940719809763, 'rsi_os': 36, 'rsi_ob': 92, 'vol_spike': 0.12286002940362446, 'adx_thresh': 13.732395106336801, 'atr_min_pct': 0.013762333611465501, 'atr_max_pct': 0.13463268008901083, 'tp_mult': 2.9176475719462127, 'tsl_mult': 0.4886688118174677, 'strategy': 'mean_reversion', 'time_stop': 206, 'use_sma': True, 'use_atr': True, 'use_adx': True, 'use_ema': False, 'use_spike': False, 'rsi_required': True, 'edge_k': 1.5764138535911187, 'edge_cap': 0.7023193221483852, 'bull_strategy': 'mean_reversion', 'bull_bb_std_mult': 2.0109366449098123, 'bull_rsi_os': 45, 'bull_rsi_ob': 82, 'bull_adx_thresh': 22.321838088498154, 'bull_atr_min_pct': 0.016311194918187832, 'bull_atr_max_pct': 0.08067077026714178, 'bull_tp_mult': 1.3354614822327597, 'bull_tsl_mult': 0.2928543135298405, 'bull_time_stop': 299, 'bull_use_sma': False, 'bull_use_ema': True, 'bull_use_atr': True, 'bull_use_adx': True, 'bull_use_spike': False, 'bull_rsi_required': False, 'bear_strategy': 'mean_reversion', 'bear_bb_std_mult': 1.9682507639391489, 'bear_rsi_os': 10, 'bear_rsi_ob': 53, 'bear_adx_thresh': 23.624897042765, 'bear_atr_min_pct': 0.021645071284577124, 'bear_atr_max_pct': 0.09288846633753334, 'bear_tp_mult': 1.51162940404095, 'bear_tsl_mult': 0.09967288981694816, 'bear_time_stop': 57, 'bear_use_sma': True, 'bear_use_ema': False, 'bear_use_atr': False, 'bear_use_adx': True, 'bear_use_spike': False, 'bear_rsi_required': False, 'sideways_strategy': 'breakout', 'sideways_bb_std_mult': 2.048563540819783, 'sideways_rsi_os': 25, 'sideways_rsi_ob': 55, 'sideways_adx_thresh': 18.831384059724925, 'sideways_atr_min_pct': 3.226317367913275e-05, 'sideways_atr_max_pct': 0.049078084817335214, 'sideways_tp_mult': 1.6204772200051845, 'sideways_tsl_mult': 0.41689130776974714, 'sideways_time_stop': 200, 'sideways_use_sma': True, 'sideways_use_ema': False, 'sideways_use_atr': False, 'sideways_use_adx': False, 'sideways_use_spike': False, 'sideways_rsi_required': True}.
[I 2025-08-30 16:17:13,240] Trial 350 finished with values: [-0.050178791487589636, 0.050166970143174755] and parameters: {'p_sma': 11, 'p_std': 56, 'p_atr': 26, 'p_adx': 26, 'rsi_period': 23, 'ema1': 27, 'ema2': 11, 'slip_atr_k': 0.007797206983552245, 'slip_spread_k': 0.5677665823722199, 'spread_hl_frac': 0.014511436714600912, 'bb_std_mult': 1.1451613491191095, 'rsi_os': 36, 'rsi_ob': 92, 'vol_spike': 0.22853960088357236, 'adx_thresh': 13.7771861520831, 'atr_min_pct': 0.020045720274801806, 'atr_max_pct': 0.13436631239671823, 'tp_mult': 2.7358872255499262, 'tsl_mult': 0.9357889608658694, 'strategy': 'mean_reversion', 'time_stop': 206, 'use_sma': True, 'use_atr': True, 'use_adx': True, 'use_ema': False, 'use_spike': False, 'rsi_required': True, 'edge_k': 0.849514170198312, 'edge_cap': 0.6054664338369513, 'bull_strategy': 'mean_reversion', 'bull_bb_std_mult': 2.0052840945997747, 'bull_rsi_os': 41, 'bull_rsi_ob': 67, 'bull_adx_thresh': 22.29481684980787, 'bull_atr_min_pct': 0.019097287080719318, 'bull_atr_max_pct': 0.08076731947207559, 'bull_tp_mult': 2.807818190623397, 'bull_tsl_mult': 0.013670656897325828, 'bull_time_stop': 42, 'bull_use_sma': False, 'bull_use_ema': True, 'bull_use_atr': True, 'bull_use_adx': True, 'bull_use_spike': False, 'bull_rsi_required': False, 'bear_strategy': 'mean_reversion', 'bear_bb_std_mult': 1.9350197100144102, 'bear_rsi_os': 13, 'bear_rsi_ob': 49, 'bear_adx_thresh': 21.813529932802364, 'bear_atr_min_pct': 0.0179262829751647, 'bear_atr_max_pct': 0.09326433697221624, 'bear_tp_mult': 2.0224311626495446, 'bear_tsl_mult': 0.8527447104106207, 'bear_time_stop': 184, 'bear_use_sma': True, 'bear_use_ema': True, 'bear_use_atr': False, 'bear_use_adx': True, 'bear_use_spike': False, 'bear_rsi_required': False, 'sideways_strategy': 'breakout', 'sideways_bb_std_mult': 2.0405751059100887, 'sideways_rsi_os': 38, 'sideways_rsi_ob': 76, 'sideways_adx_thresh': 25.018458549948328, 'sideways_atr_min_pct': 1.5199041114628657e-05, 'sideways_atr_max_pct': 0.14136279617140518, 'sideways_tp_mult': 1.6177402890365071, 'sideways_tsl_mult': 0.4646908655597365, 'sideways_time_stop': 5, 'sideways_use_sma': True, 'sideways_use_ema': False, 'sideways_use_atr': False, 'sideways_use_adx': False, 'sideways_use_spike': False, 'sideways_rsi_required': True}.
[I 2025-08-30 16:17:14,186] Trial 356 finished with values: [-1000000000.0, 1000000000.0] and parameters: {'p_sma': 6, 'p_std': 60, 'p_atr': 20, 'p_adx': 8, 'rsi_period': 61, 'ema1': 17, 'ema2': 14, 'slip_atr_k': 0.11646413372410133, 'slip_spread_k': 0.2763919572895616, 'spread_hl_frac': 0.02340670884547523, 'bb_std_mult': 0.8630920334180976, 'rsi_os': 55, 'rsi_ob': 72, 'vol_spike': 0.005954516219478623, 'adx_thresh': 18.282724747951665, 'atr_min_pct': 0.019439240756479643, 'atr_max_pct': 0.03041056210452217, 'tp_mult': 1.4513537370839895, 'tsl_mult': 0.1400428401621172, 'strategy': 'mean_reversion', 'time_stop': 21, 'use_sma': False, 'use_atr': True, 'use_adx': True, 'use_ema': False, 'use_spike': False, 'rsi_required': True, 'edge_k': 1.758041343092657, 'edge_cap': 0.8296472660271058, 'bull_strategy': 'mean_reversion', 'bull_bb_std_mult': 1.8128373643111257, 'bull_rsi_os': 9, 'bull_rsi_ob': 48, 'bull_adx_thresh': 20.973084043826155, 'bull_atr_min_pct': 0.008170752848926842, 'bull_atr_max_pct': 0.03550607389298446, 'bull_tp_mult': 1.5002834025328413, 'bull_tsl_mult': 0.24651332734572076, 'bull_time_stop': 96, 'bull_use_sma': False, 'bull_use_ema': True, 'bull_use_atr': True, 'bull_use_adx': True, 'bull_use_spike': False, 'bull_rsi_required': False, 'bear_strategy': 'mean_reversion', 'bear_bb_std_mult': 2.0910229860435363, 'bear_rsi_os': 11, 'bear_rsi_ob': 73, 'bear_adx_thresh': 34.966912557005244, 'bear_atr_min_pct': 0.017004797957772457, 'bear_atr_max_pct': 0.11480552914425704, 'bear_tp_mult': 2.198804246669214, 'bear_tsl_mult': 0.7095282724877288, 'bear_time_stop': 100, 'bear_use_sma': True, 'bear_use_ema': False, 'bear_use_atr': True, 'bear_use_adx': False, 'bear_use_spike': False, 'bear_rsi_required': True, 'sideways_strategy': 'breakout', 'sideways_bb_std_mult': 2.219176424399498, 'sideways_rsi_os': 26, 'sideways_rsi_ob': 68, 'sideways_adx_thresh': 21.897022123247734, 'sideways_atr_min_pct': 0.0011055471286370408, 'sideways_atr_max_pct': 0.14601408033618885, 'sideways_tp_mult': 1.4301797952250208, 'sideways_tsl_mult': 0.4516717728161589, 'sideways_time_stop': 209, 'sideways_use_sma': True, 'sideways_use_ema': False, 'sideways_use_atr': True, 'sideways_use_adx': False, 'sideways_use_spike': False, 'sideways_rsi_required': True}.
[I 2025-08-30 16:17:52,108] Trial 353 finished with values: [-1000000000.0, 1000000000.0] and parameters: {'p_sma': 6, 'p_std': 60, 'p_atr': 28, 'p_adx': 30, 'rsi_period': 69, 'ema1': 22, 'ema2': 12, 'slip_atr_k': 0.006715396291384748, 'slip_spread_k': 0.5628285364141431, 'spread_hl_frac': 0.014244196991838761, 'bb_std_mult': 3.0145413765299094, 'rsi_os': 16, 'rsi_ob': 88, 'vol_spike': 0.015541300985209897, 'adx_thresh': 13.900133015070624, 'atr_min_pct': 0.02019575623949684, 'atr_max_pct': 0.08225762601409943, 'tp_mult': 1.7372243026704588, 'tsl_mult': 0.4546175528821715, 'strategy': 'mean_reversion', 'time_stop': 203, 'use_sma': True, 'use_atr': True, 'use_adx': True, 'use_ema': False, 'use_spike': False, 'rsi_required': True, 'edge_k': 1.5923241138770317, 'edge_cap': 0.34634175098971176, 'bull_strategy': 'mean_reversion', 'bull_bb_std_mult': 1.9936499528466325, 'bull_rsi_os': 45, 'bull_rsi_ob': 47, 'bull_adx_thresh': 20.9900503737952, 'bull_atr_min_pct': 0.019886206675732352, 'bull_atr_max_pct': 0.14409774337370954, 'bull_tp_mult': 1.3195148028963493, 'bull_tsl_mult': 0.29897986727619885, 'bull_time_stop': 53, 'bull_use_sma': False, 'bull_use_ema': True, 'bull_use_atr': True, 'bull_use_adx': True, 'bull_use_spike': False, 'bull_rsi_required': False, 'bear_strategy': 'mean_reversion', 'bear_bb_std_mult': 1.9045558639293703, 'bear_rsi_os': 10, 'bear_rsi_ob': 55, 'bear_adx_thresh': 13.202658239876984, 'bear_atr_min_pct': 0.02152828513387385, 'bear_atr_max_pct': 0.12685529111066307, 'bear_tp_mult': 2.2067570777271164, 'bear_tsl_mult': 0.705549573124942, 'bear_time_stop': 160, 'bear_use_sma': True, 'bear_use_ema': False, 'bear_use_atr': False, 'bear_use_adx': True, 'bear_use_spike': False, 'bear_rsi_required': False, 'sideways_strategy': 'breakout', 'sideways_bb_std_mult': 2.071458776342304, 'sideways_rsi_os': 38, 'sideways_rsi_ob': 91, 'sideways_adx_thresh': 21.973455922374967, 'sideways_atr_min_pct': 0.012953620142209703, 'sideways_atr_max_pct': 0.1401467857717069, 'sideways_tp_mult': 1.4226167960887093, 'sideways_tsl_mult': 0.4348983408895582, 'sideways_time_stop': 200, 'sideways_use_sma': True, 'sideways_use_ema': False, 'sideways_use_atr': False, 'sideways_use_adx': False, 'sideways_use_spike': False, 'sideways_rsi_required': True}.
[I 2025-08-30 16:17:52,778] Trial 355 finished with values: [-1000000000.0, 1000000000.0] and parameters: {'p_sma': 6, 'p_std': 60, 'p_atr': 20, 'p_adx': 8, 'rsi_period': 61, 'ema1': 27, 'ema2': 10, 'slip_atr_k': 0.006001804364216628, 'slip_spread_k': 0.5677141823911737, 'spread_hl_frac': 0.014518559022689483, 'bb_std_mult': 2.513792926599309, 'rsi_os': 35, 'rsi_ob': 72, 'vol_spike': 0.0054090907626038725, 'adx_thresh': 12.73866891473222, 'atr_min_pct': 0.019607228823694957, 'atr_max_pct': 0.13623094193161256, 'tp_mult': 1.9477488864414423, 'tsl_mult': 0.9473529245296368, 'strategy': 'mean_reversion', 'time_stop': 191, 'use_sma': False, 'use_atr': True, 'use_adx': True, 'use_ema': False, 'use_spike': False, 'rsi_required': True, 'edge_k': 1.749817860818765, 'edge_cap': 0.64019563531054, 'bull_strategy': 'mean_reversion', 'bull_bb_std_mult': 3.5530630270598036, 'bull_rsi_os': 19, 'bull_rsi_ob': 50, 'bull_adx_thresh': 6.35685331502707, 'bull_atr_min_pct': 0.02186791854798442, 'bull_atr_max_pct': 0.14415902426428398, 'bull_tp_mult': 2.909226886931884, 'bull_tsl_mult': 0.2660019840345598, 'bull_time_stop': 144, 'bull_use_sma': False, 'bull_use_ema': True, 'bull_use_atr': True, 'bull_use_adx': True, 'bull_use_spike': False, 'bull_rsi_required': False, 'bear_strategy': 'mean_reversion', 'bear_bb_std_mult': 1.6444625603815852, 'bear_rsi_os': 45, 'bear_rsi_ob': 75, 'bear_adx_thresh': 14.457326836612506, 'bear_atr_min_pct': 0.022327138723354074, 'bear_atr_max_pct': 0.08169888995693476, 'bear_tp_mult': 2.8401605007440076, 'bear_tsl_mult': 0.6518265212794594, 'bear_time_stop': 215, 'bear_use_sma': True, 'bear_use_ema': False, 'bear_use_atr': True, 'bear_use_adx': False, 'bear_use_spike': False, 'bear_rsi_required': False, 'sideways_strategy': 'breakout', 'sideways_bb_std_mult': 2.277933963993286, 'sideways_rsi_os': 14, 'sideways_rsi_ob': 68, 'sideways_adx_thresh': 16.791860333682607, 'sideways_atr_min_pct': 0.0012976659234464854, 'sideways_atr_max_pct': 0.14584011216366044, 'sideways_tp_mult': 1.4393166574223701, 'sideways_tsl_mult': 0.44257696547328607, 'sideways_time_stop': 212, 'sideways_use_sma': True, 'sideways_use_ema': False, 'sideways_use_atr': False, 'sideways_use_adx': False, 'sideways_use_spike': False, 'sideways_rsi_required': True}.
[I 2025-08-30 16:17:53,273] Trial 354 finished with values: [-1000000000.0, 1000000000.0] and parameters: {'p_sma': 6, 'p_std': 60, 'p_atr': 28, 'p_adx': 25, 'rsi_period': 61, 'ema1': 27, 'ema2': 25, 'slip_atr_k': 0.017285926115442232, 'slip_spread_k': 0.5586550529263232, 'spread_hl_frac': 0.014537691726478133, 'bb_std_mult': 2.040926503567076, 'rsi_os': 44, 'rsi_ob': 72, 'vol_spike': 0.006187349556251674, 'adx_thresh': 14.13537680181944, 'atr_min_pct': 0.01946287810696965, 'atr_max_pct': 0.13471755734241908, 'tp_mult': 2.339504339417922, 'tsl_mult': 0.35278037513932947, 'strategy': 'mean_reversion', 'time_stop': 20, 'use_sma': False, 'use_atr': True, 'use_adx': True, 'use_ema': False, 'use_spike': False, 'rsi_required': True, 'edge_k': 0.05242734430948437, 'edge_cap': 0.6395249468043928, 'bull_strategy': 'mean_reversion', 'bull_bb_std_mult': 3.596467852573826, 'bull_rsi_os': 44, 'bull_rsi_ob': 47, 'bull_adx_thresh': 24.712584854612334, 'bull_atr_min_pct': 0.021851485094992622, 'bull_atr_max_pct': 0.13767224460722274, 'bull_tp_mult': 1.3333109734293283, 'bull_tsl_mult': 0.9407058499739875, 'bull_time_stop': 43, 'bull_use_sma': False, 'bull_use_ema': True, 'bull_use_atr': True, 'bull_use_adx': True, 'bull_use_spike': False, 'bull_rsi_required': False, 'bear_strategy': 'mean_reversion', 'bear_bb_std_mult': 0.941486046254943, 'bear_rsi_os': 30, 'bear_rsi_ob': 75, 'bear_adx_thresh': 23.585786078007388, 'bear_atr_min_pct': 0.022203317853436894, 'bear_atr_max_pct': 0.08136346204547623, 'bear_tp_mult': 2.1242471686469595, 'bear_tsl_mult': 0.6342192955383309, 'bear_time_stop': 163, 'bear_use_sma': True, 'bear_use_ema': False, 'bear_use_atr': True, 'bear_use_adx': False, 'bear_use_spike': False, 'bear_rsi_required': False, 'sideways_strategy': 'breakout', 'sideways_bb_std_mult': 2.2509496879763367, 'sideways_rsi_os': 26, 'sideways_rsi_ob': 91, 'sideways_adx_thresh': 15.618120280100635, 'sideways_atr_min_pct': 0.021825635716734727, 'sideways_atr_max_pct': 0.03592684797872392, 'sideways_tp_mult': 1.642115678872623, 'sideways_tsl_mult': 0.42218640542467506, 'sideways_time_stop': 131, 'sideways_use_sma': True, 'sideways_use_ema': False, 'sideways_use_atr': False, 'sideways_use_adx': False, 'sideways_use_spike': False, 'sideways_rsi_required': True}.
[I 2025-08-30 16:17:54,057] Trial 357 finished with values: [-1000000000.0, 1000000000.0] and parameters: {'p_sma': 8, 'p_std': 57, 'p_atr': 30, 'p_adx': 30, 'rsi_period': 72, 'ema1': 26, 'ema2': 52, 'slip_atr_k': 0.017181313359379235, 'slip_spread_k': 0.6221696203172273, 'spread_hl_frac': 0.025314665666618625, 'bb_std_mult': 1.823483737584747, 'rsi_os': 32, 'rsi_ob': 89, 'vol_spike': 0.014394229767950014, 'adx_thresh': 11.359335237233998, 'atr_min_pct': 0.018802169045541054, 'atr_max_pct': 0.13699430278162825, 'tp_mult': 1.9316325658611573, 'tsl_mult': 0.39242886781398595, 'strategy': 'mean_reversion', 'time_stop': 190, 'use_sma': False, 'use_atr': True, 'use_adx': True, 'use_ema': False, 'use_spike': False, 'rsi_required': True, 'edge_k': 1.6993279031923298, 'edge_cap': 0.15081318027039214, 'bull_strategy': 'mean_reversion', 'bull_bb_std_mult': 3.566245355716487, 'bull_rsi_os': 12, 'bull_rsi_ob': 50, 'bull_adx_thresh': 24.627375535825188, 'bull_atr_min_pct': 0.021909712183509053, 'bull_atr_max_pct': 0.1450717041148327, 'bull_tp_mult': 1.3019680593679572, 'bull_tsl_mult': 0.3239147538914166, 'bull_time_stop': 123, 'bull_use_sma': False, 'bull_use_ema': True, 'bull_use_atr': True, 'bull_use_adx': True, 'bull_use_spike': False, 'bull_rsi_required': False, 'bear_strategy': 'mean_reversion', 'bear_bb_std_mult': 1.6441470407276835, 'bear_rsi_os': 48, 'bear_rsi_ob': 75, 'bear_adx_thresh': 13.817073047402431, 'bear_atr_min_pct': 0.020766815632186086, 'bear_atr_max_pct': 0.12729862104214118, 'bear_tp_mult': 2.095207118466434, 'bear_tsl_mult': 0.6496638411249941, 'bear_time_stop': 16, 'bear_use_sma': True, 'bear_use_ema': False, 'bear_use_atr': False, 'bear_use_adx': False, 'bear_use_spike': False, 'bear_rsi_required': False, 'sideways_strategy': 'breakout', 'sideways_bb_std_mult': 2.4447949851212623, 'sideways_rsi_os': 5, 'sideways_rsi_ob': 91, 'sideways_adx_thresh': 15.771333332900822, 'sideways_atr_min_pct': 0.018854886782585494, 'sideways_atr_max_pct': 0.13903207246286817, 'sideways_tp_mult': 2.021578325184097, 'sideways_tsl_mult': 0.43134340601318105, 'sideways_time_stop': 213, 'sideways_use_sma': False, 'sideways_use_ema': False, 'sideways_use_atr': False, 'sideways_use_adx': False, 'sideways_use_spike': False, 'sideways_rsi_required': True}.
[I 2025-08-30 16:18:36,557] Trial 359 finished with values: [-1000000000.0, 1000000000.0] and parameters: {'p_sma': 9, 'p_std': 57, 'p_atr': 30, 'p_adx': 24, 'rsi_period': 73, 'ema1': 21, 'ema2': 17, 'slip_atr_k': 0.017463504183699366, 'slip_spread_k': 0.6247549861122027, 'spread_hl_frac': 0.01743413863272012, 'bb_std_mult': 3.2129004746447154, 'rsi_os': 33, 'rsi_ob': 89, 'vol_spike': 0.25330908956641657, 'adx_thresh': 11.252563819022726, 'atr_min_pct': 0.018787257272342664, 'atr_max_pct': 0.13927114769231608, 'tp_mult': 2.7699259933282114, 'tsl_mult': 0.34907674010162426, 'strategy': 'mean_reversion', 'time_stop': 19, 'use_sma': False, 'use_atr': False, 'use_adx': True, 'use_ema': True, 'use_spike': False, 'rsi_required': True, 'edge_k': 1.6921243113570537, 'edge_cap': 0.5056043514734553, 'bull_strategy': 'mean_reversion', 'bull_bb_std_mult': 1.8888714582553456, 'bull_rsi_os': 12, 'bull_rsi_ob': 51, 'bull_adx_thresh': 26.732001018158392, 'bull_atr_min_pct': 0.0210197058462899, 'bull_atr_max_pct': 0.12797669187584512, 'bull_tp_mult': 1.0737238609235493, 'bull_tsl_mult': 0.32527537961540365, 'bull_time_stop': 106, 'bull_use_sma': False, 'bull_use_ema': False, 'bull_use_atr': True, 'bull_use_adx': True, 'bull_use_spike': True, 'bull_rsi_required': False, 'bear_strategy': 'breakout', 'bear_bb_std_mult': 2.1572957767356926, 'bear_rsi_os': 14, 'bear_rsi_ob': 77, 'bear_adx_thresh': 13.869786354954972, 'bear_atr_min_pct': 0.020466435591868334, 'bear_atr_max_pct': 0.08961312360608317, 'bear_tp_mult': 2.0988917802560407, 'bear_tsl_mult': 0.633015858113048, 'bear_time_stop': 74, 'bear_use_sma': True, 'bear_use_ema': False, 'bear_use_atr': False, 'bear_use_adx': False, 'bear_use_spike': False, 'bear_rsi_required': False, 'sideways_strategy': 'mean_reversion', 'sideways_bb_std_mult': 2.123811591780827, 'sideways_rsi_os': 18, 'sideways_rsi_ob': 93, 'sideways_adx_thresh': 15.657964887692467, 'sideways_atr_min_pct': 0.008958713325727528, 'sideways_atr_max_pct': 0.11264370154619169, 'sideways_tp_mult': 1.4767693422271608, 'sideways_tsl_mult': 0.5022942298847838, 'sideways_time_stop': 163, 'sideways_use_sma': False, 'sideways_use_ema': True, 'sideways_use_atr': False, 'sideways_use_adx': False, 'sideways_use_spike': True, 'sideways_rsi_required': True}.
[I 2025-08-30 16:18:37,450] Trial 360 finished with values: [-0.04670062353688287, 0.04642757187679573] and parameters: {'p_sma': 8, 'p_std': 57, 'p_atr': 30, 'p_adx': 24, 'rsi_period': 73, 'ema1': 26, 'ema2': 53, 'slip_atr_k': 0.2224557741892866, 'slip_spread_k': 0.6160991677630118, 'spread_hl_frac': 0.02530427089423588, 'bb_std_mult': 3.2100875568156377, 'rsi_os': 32, 'rsi_ob': 65, 'vol_spike': 0.012158035115239968, 'adx_thresh': 30.45210057172015, 'atr_min_pct': 0.018818163830014074, 'atr_max_pct': 0.05047896755046424, 'tp_mult': 1.643509956187183, 'tsl_mult': 0.5194087241608563, 'strategy': 'mean_reversion', 'time_stop': 5, 'use_sma': False, 'use_atr': False, 'use_adx': True, 'use_ema': True, 'use_spike': False, 'rsi_required': True, 'edge_k': 1.4687409582026758, 'edge_cap': 0.1533501578649299, 'bull_strategy': 'mean_reversion', 'bull_bb_std_mult': 1.7769387673823305, 'bull_rsi_os': 12, 'bull_rsi_ob': 58, 'bull_adx_thresh': 5.041490045841353, 'bull_atr_min_pct': 0.02086722107501748, 'bull_atr_max_pct': 0.07542636677752626, 'bull_tp_mult': 1.3953732152741776, 'bull_tsl_mult': 0.0423980587073316, 'bull_time_stop': 77, 'bull_use_sma': False, 'bull_use_ema': False, 'bull_use_atr': True, 'bull_use_adx': True, 'bull_use_spike': True, 'bull_rsi_required': False, 'bear_strategy': 'breakout', 'bear_bb_std_mult': 1.266265011141943, 'bear_rsi_os': 48, 'bear_rsi_ob': 77, 'bear_adx_thresh': 13.87778005634912, 'bear_atr_min_pct': 0.0004720926999396569, 'bear_atr_max_pct': 0.14104204038024465, 'bear_tp_mult': 1.3605319017769726, 'bear_tsl_mult': 0.6050085505135633, 'bear_time_stop': 195, 'bear_use_sma': True, 'bear_use_ema': False, 'bear_use_atr': False, 'bear_use_adx': False, 'bear_use_spike': False, 'bear_rsi_required': True, 'sideways_strategy': 'mean_reversion', 'sideways_bb_std_mult': 2.127471515537869, 'sideways_rsi_os': 6, 'sideways_rsi_ob': 93, 'sideways_adx_thresh': 15.986798687390896, 'sideways_atr_min_pct': 0.01881077212190169, 'sideways_atr_max_pct': 0.02463927797759389, 'sideways_tp_mult': 1.4923455428854966, 'sideways_tsl_mult': 0.3705804692640565, 'sideways_time_stop': 219, 'sideways_use_sma': False, 'sideways_use_ema': True, 'sideways_use_atr': True, 'sideways_use_adx': False, 'sideways_use_spike': True, 'sideways_rsi_required': True}.
