[I 2025-08-30 17:22:53,573] Trial 738 finished with values: [-1000000000.0, 1000000000.0] and parameters: {'p_sma': 9, 'p_std': 21, 'p_atr': 17, 'p_adx': 7, 'rsi_period': 23, 'ema1': 12, 'ema2': 13, 'slip_atr_k': 0.16884485051893128, 'slip_spread_k': 0.47026299375332764, 'spread_hl_frac': 0.016799450894290784, 'bb_std_mult': 3.1499203334589665, 'rsi_os': 32, 'rsi_ob': 86, 'vol_spike': 0.09720513768979329, 'adx_thresh': 11.814775140443958, 'atr_min_pct': 0.02110065216470902, 'atr_max_pct': 0.08458117382748513, 'tp_mult': 1.976992129535797, 'tsl_mult': 0.9609708665287117, 'strategy': 'mean_reversion', 'time_stop': 106, 'use_sma': False, 'use_atr': True, 'use_adx': True, 'use_ema': True, 'use_spike': False, 'rsi_required': True, 'edge_k': 0.5452876912416016, 'edge_cap': 0.8877468995202835, 'bull_strategy': 'mean_reversion', 'bull_bb_std_mult': 0.6396593356447857, 'bull_rsi_os': 9, 'bull_rsi_ob': 74, 'bull_adx_thresh': 34.072801834601705, 'bull_atr_min_pct': 0.024464146674512036, 'bull_atr_max_pct': 0.06820941124662094, 'bull_tp_mult': 2.2872501382287345, 'bull_tsl_mult': 0.1749542336061976, 'bull_time_stop': 94, 'bull_use_sma': True, 'bull_use_ema': False, 'bull_use_atr': False, 'bull_use_adx': True, 'bull_use_spike': False, 'bull_rsi_required': True, 'bear_strategy': 'breakout', 'bear_bb_std_mult': 0.7099555284478783, 'bear_rsi_os': 14, 'bear_rsi_ob': 73, 'bear_adx_thresh': 13.212641901448404, 'bear_atr_min_pct': 0.011810109393337827, 'bear_atr_max_pct': 0.10795712668921814, 'bear_tp_mult': 1.859390153000069, 'bear_tsl_mult': 0.3987724083090469, 'bear_time_stop': 43, 'bear_use_sma': False, 'bear_use_ema': True, 'bear_use_atr': False, 'bear_use_adx': False, 'bear_use_spike': False, 'bear_rsi_required': False, 'sideways_strategy': 'breakout', 'sideways_bb_std_mult': 0.7523340347559465, 'sideways_rsi_os': 33, 'sideways_rsi_ob': 93, 'sideways_adx_thresh': 22.931444985148353, 'sideways_atr_min_pct': 0.006425919414233941, 'sideways_atr_max_pct': 0.09117527232998085, 'sideways_tp_mult': 2.7776112196106317, 'sideways_tsl_mult': 0.44261121865535413, 'sideways_time_stop': 269, 'sideways_use_sma': True, 'sideways_use_ema': False, 'sideways_use_atr': True, 'sideways_use_adx': True, 'sideways_use_spike': False, 'sideways_rsi_required': False}.
[I 2025-08-30 17:22:54,094] Trial 736 finished with values: [-0.08184364327169658, 0.0817479476819875] and parameters: {'p_sma': 7, 'p_std': 8, 'p_atr': 17, 'p_adx': 7, 'rsi_period': 24, 'ema1': 18, 'ema2': 32, 'slip_atr_k': 0.16790524043210162, 'slip_spread_k': 0.12328979284106768, 'spread_hl_frac': 0.03802472599541808, 'bb_std_mult': 2.121227350848802, 'rsi_os': 7, 'rsi_ob': 82, 'vol_spike': 0.09690898165436874, 'adx_thresh': 11.069774940443112, 'atr_min_pct': 0.00885678283246082, 'atr_max_pct': 0.14441250794333704, 'tp_mult': 1.9733663676741524, 'tsl_mult': 0.9939901078234711, 'strategy': 'mean_reversion', 'time_stop': 144, 'use_sma': False, 'use_atr': True, 'use_adx': True, 'use_ema': False, 'use_spike': False, 'rsi_required': True, 'edge_k': 0.5570574264988702, 'edge_cap': 0.8487873418048223, 'bull_strategy': 'mean_reversion', 'bull_bb_std_mult': 2.671549122173825, 'bull_rsi_os': 9, 'bull_rsi_ob': 89, 'bull_adx_thresh': 26.16329930021725, 'bull_atr_min_pct': 0.024448855569770493, 'bull_atr_max_pct': 0.0765643503667322, 'bull_tp_mult': 2.1929292652136, 'bull_tsl_mult': 0.849980820433656, 'bull_time_stop': 147, 'bull_use_sma': True, 'bull_use_ema': True, 'bull_use_atr': False, 'bull_use_adx': True, 'bull_use_spike': False, 'bull_rsi_required': True, 'bear_strategy': 'mean_reversion', 'bear_bb_std_mult': 0.5298692217137246, 'bear_rsi_os': 14, 'bear_rsi_ob': 73, 'bear_adx_thresh': 6.9371560911827075, 'bear_atr_min_pct': 0.0022268916770337363, 'bear_atr_max_pct': 0.11210623552618619, 'bear_tp_mult': 2.2656753118695954, 'bear_tsl_mult': 0.5851697369668093, 'bear_time_stop': 203, 'bear_use_sma': True, 'bear_use_ema': True, 'bear_use_atr': False, 'bear_use_adx': False, 'bear_use_spike': False, 'bear_rsi_required': False, 'sideways_strategy': 'breakout', 'sideways_bb_std_mult': 3.563881126482098, 'sideways_rsi_os': 33, 'sideways_rsi_ob': 91, 'sideways_adx_thresh': 22.968211628127715, 'sideways_atr_min_pct': 0.0005093744449025904, 'sideways_atr_max_pct': 0.10474888859627154, 'sideways_tp_mult': 2.9710035664812766, 'sideways_tsl_mult': 0.4376659513760385, 'sideways_time_stop': 18, 'sideways_use_sma': True, 'sideways_use_ema': False, 'sideways_use_atr': True, 'sideways_use_adx': False, 'sideways_use_spike': False, 'sideways_rsi_required': False}.
[I 2025-08-30 17:22:55,523] Trial 743 finished with values: [-1000000000.0, 1000000000.0] and parameters: {'p_sma': 6, 'p_std': 36, 'p_atr': 14, 'p_adx': 10, 'rsi_period': 20, 'ema1': 15, 'ema2': 53, 'slip_atr_k': 0.008275978381473011, 'slip_spread_k': 0.14515702315239212, 'spread_hl_frac': 0.018437385882922135, 'bb_std_mult': 2.59231712693321, 'rsi_os': 12, 'rsi_ob': 84, 'vol_spike': 0.21051397366311458, 'adx_thresh': 9.583370565142758, 'atr_min_pct': 0.01880992486144406, 'atr_max_pct': 0.0107377953978358, 'tp_mult': 1.5014703052552674, 'tsl_mult': 0.22398747295117116, 'strategy': 'breakout', 'time_stop': 207, 'use_sma': True, 'use_atr': False, 'use_adx': False, 'use_ema': False, 'use_spike': True, 'rsi_required': False, 'edge_k': 0.7178415633194237, 'edge_cap': 0.10354397607822752, 'bull_strategy': 'breakout', 'bull_bb_std_mult': 1.9290860955212068, 'bull_rsi_os': 28, 'bull_rsi_ob': 53, 'bull_adx_thresh': 32.47263427633795, 'bull_atr_min_pct': 0.028464601355505124, 'bull_atr_max_pct': 0.13527259999814475, 'bull_tp_mult': 1.642965374760673, 'bull_tsl_mult': 0.9270054276538273, 'bull_time_stop': 88, 'bull_use_sma': True, 'bull_use_ema': True, 'bull_use_atr': False, 'bull_use_adx': False, 'bull_use_spike': True, 'bull_rsi_required': False, 'bear_strategy': 'mean_reversion', 'bear_bb_std_mult': 1.6910198551689342, 'bear_rsi_os': 44, 'bear_rsi_ob': 78, 'bear_adx_thresh': 11.732782948940493, 'bear_atr_min_pct': 0.019388612586677054, 'bear_atr_max_pct': 0.12908087145857094, 'bear_tp_mult': 1.1200516965004719, 'bear_tsl_mult': 0.6465227341570003, 'bear_time_stop': 123, 'bear_use_sma': True, 'bear_use_ema': False, 'bear_use_atr': True, 'bear_use_adx': True, 'bear_use_spike': True, 'bear_rsi_required': True, 'sideways_strategy': 'breakout', 'sideways_bb_std_mult': 0.6754076860717461, 'sideways_rsi_os': 50, 'sideways_rsi_ob': 55, 'sideways_adx_thresh': 10.104736568455689, 'sideways_atr_min_pct': 1.0826020250007205e-06, 'sideways_atr_max_pct': 0.08718553473575016, 'sideways_tp_mult': 2.9441082523148294, 'sideways_tsl_mult': 0.7890522617639465, 'sideways_time_stop': 283, 'sideways_use_sma': True, 'sideways_use_ema': True, 'sideways_use_atr': False, 'sideways_use_adx': False, 'sideways_use_spike': True, 'sideways_rsi_required': True}.
[I 2025-08-30 17:22:56,501] Trial 744 finished with values: [-1000000000.0, 1000000000.0] and parameters: {'p_sma': 41, 'p_std': 5, 'p_atr': 16, 'p_adx': 8, 'rsi_period': 67, 'ema1': 6, 'ema2': 11, 'slip_atr_k': 0.0037104993941343457, 'slip_spread_k': 0.15977933611937034, 'spread_hl_frac': 0.02174314313479326, 'bb_std_mult': 2.8034762017735737, 'rsi_os': 52, 'rsi_ob': 85, 'vol_spike': 0.08931216305777379, 'adx_thresh': 19.60788370606976, 'atr_min_pct': 0.011605378889433748, 'atr_max_pct': 0.047830283442035486, 'tp_mult': 2.8283562442974923, 'tsl_mult': 0.15427272549789078, 'strategy': 'mean_reversion', 'time_stop': 161, 'use_sma': True, 'use_atr': False, 'use_adx': False, 'use_ema': False, 'use_spike': True, 'rsi_required': True, 'edge_k': 0.7745607685043115, 'edge_cap': 0.7775877614408161, 'bull_strategy': 'breakout', 'bull_bb_std_mult': 2.009635010739465, 'bull_rsi_os': 13, 'bull_rsi_ob': 56, 'bull_adx_thresh': 33.317042920482436, 'bull_atr_min_pct': 0.014037609334991248, 'bull_atr_max_pct': 0.11590485704030906, 'bull_tp_mult': 2.245866649014446, 'bull_tsl_mult': 0.7745553617719015, 'bull_time_stop': 81, 'bull_use_sma': True, 'bull_use_ema': True, 'bull_use_atr': False, 'bull_use_adx': False, 'bull_use_spike': False, 'bull_rsi_required': False, 'bear_strategy': 'mean_reversion', 'bear_bb_std_mult': 1.2029074834168796, 'bear_rsi_os': 16, 'bear_rsi_ob': 65, 'bear_adx_thresh': 12.552597097216756, 'bear_atr_min_pct': 0.010668969952046897, 'bear_atr_max_pct': 0.057801695940559276, 'bear_tp_mult': 2.439198639822941, 'bear_tsl_mult': 0.08392497951452704, 'bear_time_stop': 160, 'bear_use_sma': True, 'bear_use_ema': False, 'bear_use_atr': True, 'bear_use_adx': True, 'bear_use_spike': False, 'bear_rsi_required': False, 'sideways_strategy': 'breakout', 'sideways_bb_std_mult': 0.7697806898421191, 'sideways_rsi_os': 11, 'sideways_rsi_ob': 56, 'sideways_adx_thresh': 9.869184062825237, 'sideways_atr_min_pct': 0.0040264853710062784, 'sideways_atr_max_pct': 0.09538792734033621, 'sideways_tp_mult': 2.997105992088118, 'sideways_tsl_mult': 0.15716825537120988, 'sideways_time_stop': 274, 'sideways_use_sma': True, 'sideways_use_ema': True, 'sideways_use_atr': False, 'sideways_use_adx': False, 'sideways_use_spike': False, 'sideways_rsi_required': True}.
[I 2025-08-30 17:23:24,703] Trial 740 finished with values: [-1000000000.0, 0.17888433621114683] and parameters: {'p_sma': 23, 'p_std': 10, 'p_atr': 17, 'p_adx': 11, 'rsi_period': 24, 'ema1': 18, 'ema2': 35, 'slip_atr_k': 0.004361812676773152, 'slip_spread_k': 0.14379234408514688, 'spread_hl_frac': 0.018517514395423772, 'bb_std_mult': 3.0849407191332903, 'rsi_os': 31, 'rsi_ob': 70, 'vol_spike': 0.09500958896647689, 'adx_thresh': 9.947978123505148, 'atr_min_pct': 0.011919121985481913, 'atr_max_pct': 0.14204472845164626, 'tp_mult': 2.8279316926254237, 'tsl_mult': 0.599229709744813, 'strategy': 'mean_reversion', 'time_stop': 30, 'use_sma': True, 'use_atr': False, 'use_adx': False, 'use_ema': False, 'use_spike': True, 'rsi_required': True, 'edge_k': 1.039672053150733, 'edge_cap': 0.11026594591608913, 'bull_strategy': 'breakout', 'bull_bb_std_mult': 2.987662291667678, 'bull_rsi_os': 10, 'bull_rsi_ob': 53, 'bull_adx_thresh': 34.431789566372714, 'bull_atr_min_pct': 0.021957890266181092, 'bull_atr_max_pct': 0.1396929025040295, 'bull_tp_mult': 2.282701579030355, 'bull_tsl_mult': 0.7752009900817618, 'bull_time_stop': 88, 'bull_use_sma': True, 'bull_use_ema': True, 'bull_use_atr': False, 'bull_use_adx': False, 'bull_use_spike': False, 'bull_rsi_required': False, 'bear_strategy': 'mean_reversion', 'bear_bb_std_mult': 2.7433673673029784, 'bear_rsi_os': 16, 'bear_rsi_ob': 65, 'bear_adx_thresh': 6.810250510195903, 'bear_atr_min_pct': 0.01937642495683351, 'bear_atr_max_pct': 0.056401035943331124, 'bear_tp_mult': 2.2741190258610677, 'bear_tsl_mult': 0.40294093757890015, 'bear_time_stop': 196, 'bear_use_sma': True, 'bear_use_ema': False, 'bear_use_atr': True, 'bear_use_adx': True, 'bear_use_spike': False, 'bear_rsi_required': False, 'sideways_strategy': 'breakout', 'sideways_bb_std_mult': 3.5414684873780047, 'sideways_rsi_os': 41, 'sideways_rsi_ob': 93, 'sideways_adx_thresh': 8.7814977220026, 'sideways_atr_min_pct': 0.0004996880658770751, 'sideways_atr_max_pct': 0.038721643799906294, 'sideways_tp_mult': 2.9571653347180065, 'sideways_tsl_mult': 0.44284435129522787, 'sideways_time_stop': 47, 'sideways_use_sma': True, 'sideways_use_ema': True, 'sideways_use_atr': False, 'sideways_use_adx': False, 'sideways_use_spike': False, 'sideways_rsi_required': True}.
[I 2025-08-30 17:23:25,718] Trial 741 finished with values: [-1000000000.0, 1000000000.0] and parameters: {'p_sma': 22, 'p_std': 40, 'p_atr': 17, 'p_adx': 11, 'rsi_period': 24, 'ema1': 19, 'ema2': 56, 'slip_atr_k': 0.00012436485762489825, 'slip_spread_k': 0.23282580424689886, 'spread_hl_frac': 0.01816672958727505, 'bb_std_mult': 1.9310800430254866, 'rsi_os': 31, 'rsi_ob': 82, 'vol_spike': 0.08898541212527124, 'adx_thresh': 10.2299947499467, 'atr_min_pct': 0.008789400190671063, 'atr_max_pct': 0.012028262563537923, 'tp_mult': 2.8352460856352386, 'tsl_mult': 0.94178629420633, 'strategy': 'mean_reversion', 'time_stop': 207, 'use_sma': True, 'use_atr': False, 'use_adx': False, 'use_ema': True, 'use_spike': True, 'rsi_required': True, 'edge_k': 0.7205127564462044, 'edge_cap': 0.4060423667701919, 'bull_strategy': 'breakout', 'bull_bb_std_mult': 1.138504389363857, 'bull_rsi_os': 47, 'bull_rsi_ob': 56, 'bull_adx_thresh': 34.983398815862294, 'bull_atr_min_pct': 0.021889903014237606, 'bull_atr_max_pct': 0.14098017023071338, 'bull_tp_mult': 2.221325368766075, 'bull_tsl_mult': 0.02718571692550742, 'bull_time_stop': 92, 'bull_use_sma': True, 'bull_use_ema': False, 'bull_use_atr': False, 'bull_use_adx': False, 'bull_use_spike': False, 'bull_rsi_required': False, 'bear_strategy': 'breakout', 'bear_bb_std_mult': 1.6774070720363492, 'bear_rsi_os': 16, 'bear_rsi_ob': 73, 'bear_adx_thresh': 11.73634628962139, 'bear_atr_min_pct': 0.011814952066716627, 'bear_atr_max_pct': 0.10793311994775134, 'bear_tp_mult': 2.266949375688977, 'bear_tsl_mult': 0.6471553413397071, 'bear_time_stop': 65, 'bear_use_sma': True, 'bear_use_ema': False, 'bear_use_atr': True, 'bear_use_adx': True, 'bear_use_spike': False, 'bear_rsi_required': False, 'sideways_strategy': 'breakout', 'sideways_bb_std_mult': 0.7557261984125498, 'sideways_rsi_os': 31, 'sideways_rsi_ob': 90, 'sideways_adx_thresh': 8.821684347564883, 'sideways_atr_min_pct': 0.00399986014128081, 'sideways_atr_max_pct': 0.10404046624080568, 'sideways_tp_mult': 2.512515451288204, 'sideways_tsl_mult': 0.4813083218187287, 'sideways_time_stop': 283, 'sideways_use_sma': True, 'sideways_use_ema': True, 'sideways_use_atr': False, 'sideways_use_adx': False, 'sideways_use_spike': True, 'sideways_rsi_required': True}.
[I 2025-08-30 17:23:27,076] Trial 742 finished with values: [-1000000000.0, 1000000000.0] and parameters: {'p_sma': 6, 'p_std': 40, 'p_atr': 17, 'p_adx': 11, 'rsi_period': 20, 'ema1': 19, 'ema2': 57, 'slip_atr_k': 0.005214160090526166, 'slip_spread_k': 0.15789694021958944, 'spread_hl_frac': 0.018570239638020753, 'bb_std_mult': 2.1084369290411744, 'rsi_os': 12, 'rsi_ob': 57, 'vol_spike': 0.09020644251895663, 'adx_thresh': 9.289385148915787, 'atr_min_pct': 0.011891318366394402, 'atr_max_pct': 0.1477483994081904, 'tp_mult': 1.755324200378361, 'tsl_mult': 0.9435686974574622, 'strategy': 'mean_reversion', 'time_stop': 43, 'use_sma': True, 'use_atr': False, 'use_adx': False, 'use_ema': False, 'use_spike': True, 'rsi_required': True, 'edge_k': 0.656849738145376, 'edge_cap': 0.09467507223734606, 'bull_strategy': 'breakout', 'bull_bb_std_mult': 2.7067538172247243, 'bull_rsi_os': 12, 'bull_rsi_ob': 53, 'bull_adx_thresh': 33.292295268872124, 'bull_atr_min_pct': 0.021948911650909068, 'bull_atr_max_pct': 0.09627536236487508, 'bull_tp_mult': 2.2356904168237834, 'bull_tsl_mult': 0.7690128939142576, 'bull_time_stop': 80, 'bull_use_sma': True, 'bull_use_ema': True, 'bull_use_atr': False, 'bull_use_adx': False, 'bull_use_spike': False, 'bull_rsi_required': False, 'bear_strategy': 'mean_reversion', 'bear_bb_std_mult': 2.7209702159935243, 'bear_rsi_os': 16, 'bear_rsi_ob': 76, 'bear_adx_thresh': 11.697798064513572, 'bear_atr_min_pct': 0.006095288053091523, 'bear_atr_max_pct': 0.0576789696139427, 'bear_tp_mult': 2.1318420725532534, 'bear_tsl_mult': 0.6430727325866797, 'bear_time_stop': 196, 'bear_use_sma': True, 'bear_use_ema': False, 'bear_use_atr': True, 'bear_use_adx': True, 'bear_use_spike': False, 'bear_rsi_required': False, 'sideways_strategy': 'breakout', 'sideways_bb_std_mult': 0.6799883604126397, 'sideways_rsi_os': 51, 'sideways_rsi_ob': 90, 'sideways_adx_thresh': 10.195188255326888, 'sideways_atr_min_pct': 0.0038528531556426774, 'sideways_atr_max_pct': 0.10512236843907383, 'sideways_tp_mult': 2.9976889773274813, 'sideways_tsl_mult': 0.4726930725580387, 'sideways_time_stop': 282, 'sideways_use_sma': True, 'sideways_use_ema': True, 'sideways_use_atr': False, 'sideways_use_adx': False, 'sideways_use_spike': True, 'sideways_rsi_required': True}.
[I 2025-08-30 17:23:37,017] Trial 745 finished with values: [-1000000000.0, 1000000000.0] and parameters: {'p_sma': 5, 'p_std': 22, 'p_atr': 8, 'p_adx': 11, 'rsi_period': 20, 'ema1': 11, 'ema2': 14, 'slip_atr_k': 0.09355329901120783, 'slip_spread_k': 0.22714575052600877, 'spread_hl_frac': 0.013775702012537123, 'bb_std_mult': 1.2468755382775334, 'rsi_os': 6, 'rsi_ob': 88, 'vol_spike': 0.08711797070781245, 'adx_thresh': 10.211861856335195, 'atr_min_pct': 0.019328138462623518, 'atr_max_pct': 0.028213237505961074, 'tp_mult': 2.7612713273760585, 'tsl_mult': 0.9335526121680199, 'strategy': 'mean_reversion', 'time_stop': 30, 'use_sma': False, 'use_atr': True, 'use_adx': True, 'use_ema': True, 'use_spike': False, 'rsi_required': True, 'edge_k': 0.24920823833633088, 'edge_cap': 0.9884804157130309, 'bull_strategy': 'mean_reversion', 'bull_bb_std_mult': 2.889020487038019, 'bull_rsi_os': 10, 'bull_rsi_ob': 93, 'bull_adx_thresh': 34.992490914492954, 'bull_atr_min_pct': 0.021902504131278134, 'bull_atr_max_pct': 0.1396902709322677, 'bull_tp_mult': 2.9065973019524307, 'bull_tsl_mult': 0.5657372738345624, 'bull_time_stop': 71, 'bull_use_sma': True, 'bull_use_ema': False, 'bull_use_atr': False, 'bull_use_adx': True, 'bull_use_spike': False, 'bull_rsi_required': False, 'bear_strategy': 'breakout', 'bear_bb_std_mult': 2.7563684219263007, 'bear_rsi_os': 19, 'bear_rsi_ob': 76, 'bear_adx_thresh': 10.433894491750953, 'bear_atr_min_pct': 0.023013803379124412, 'bear_atr_max_pct': 0.02792111407010782, 'bear_tp_mult': 1.236035312776678, 'bear_tsl_mult': 0.6296775463226603, 'bear_time_stop': 194, 'bear_use_sma': True, 'bear_use_ema': False, 'bear_use_atr': False, 'bear_use_adx': False, 'bear_use_spike': False, 'bear_rsi_required': False, 'sideways_strategy': 'breakout', 'sideways_bb_std_mult': 0.9955734315136648, 'sideways_rsi_os': 48, 'sideways_rsi_ob': 90, 'sideways_adx_thresh': 9.06267090158178, 'sideways_atr_min_pct': 0.015963934312592097, 'sideways_atr_max_pct': 0.04712964077598083, 'sideways_tp_mult': 2.522730402272699, 'sideways_tsl_mult': 0.6391994366320418, 'sideways_time_stop': 280, 'sideways_use_sma': True, 'sideways_use_ema': False, 'sideways_use_atr': False, 'sideways_use_adx': False, 'sideways_use_spike': True, 'sideways_rsi_required': True}.
[I 2025-08-30 17:24:01,728] Trial 748 finished with values: [-1000000000.0, 1000000000.0] and parameters: {'p_sma': 31, 'p_std': 23, 'p_atr': 16, 'p_adx': 9, 'rsi_period': 22, 'ema1': 11, 'ema2': 14, 'slip_atr_k': 0.014678794788979396, 'slip_spread_k': 0.17719462428419647, 'spread_hl_frac': 0.042784881574002995, 'bb_std_mult': 2.4101939387798144, 'rsi_os': 33, 'rsi_ob': 60, 'vol_spike': 0.18944857415230956, 'adx_thresh': 10.61686266973091, 'atr_min_pct': 0.006016824143650528, 'atr_max_pct': 0.07875969620218394, 'tp_mult': 2.736776248212459, 'tsl_mult': 0.9063987693205899, 'strategy': 'breakout', 'time_stop': 46, 'use_sma': False, 'use_atr': True, 'use_adx': True, 'use_ema': False, 'use_spike': False, 'rsi_required': False, 'edge_k': 0.41547393238524405, 'edge_cap': 0.8702146142039123, 'bull_strategy': 'mean_reversion', 'bull_bb_std_mult': 1.8127116163035948, 'bull_rsi_os': 11, 'bull_rsi_ob': 93, 'bull_adx_thresh': 34.96396066422373, 'bull_atr_min_pct': 0.021127515455393965, 'bull_atr_max_pct': 0.02854718687773533, 'bull_tp_mult': 2.3220969803716596, 'bull_tsl_mult': 0.8231166296018865, 'bull_time_stop': 71, 'bull_use_sma': True, 'bull_use_ema': True, 'bull_use_atr': False, 'bull_use_adx': True, 'bull_use_spike': True, 'bull_rsi_required': False, 'bear_strategy': 'mean_reversion', 'bear_bb_std_mult': 2.977700803738423, 'bear_rsi_os': 20, 'bear_rsi_ob': 87, 'bear_adx_thresh': 10.38666621547462, 'bear_atr_min_pct': 0.021115221268433074, 'bear_atr_max_pct': 0.1492740043376935, 'bear_tp_mult': 1.2735779211848914, 'bear_tsl_mult': 0.0020468705937930487, 'bear_time_stop': 77, 'bear_use_sma': False, 'bear_use_ema': False, 'bear_use_atr': False, 'bear_use_adx': False, 'bear_use_spike': True, 'bear_rsi_required': True, 'sideways_strategy': 'breakout', 'sideways_bb_std_mult': 0.5727278318306737, 'sideways_rsi_os': 30, 'sideways_rsi_ob': 92, 'sideways_adx_thresh': 20.435832717251134, 'sideways_atr_min_pct': 0.01601953013852263, 'sideways_atr_max_pct': 0.05688277880509911, 'sideways_tp_mult': 1.7010001879616212, 'sideways_tsl_mult': 0.39492383136090986, 'sideways_time_stop': 276, 'sideways_use_sma': True, 'sideways_use_ema': False, 'sideways_use_atr': False, 'sideways_use_adx': True, 'sideways_use_spike': False, 'sideways_rsi_required': True}.
