[I 2025-08-30 16:54:25,330] Trial 565 finished with values: [-1000000000.0, 1000000000.0] and parameters: {'p_sma': 10, 'p_std': 57, 'p_atr': 26, 'p_adx': 23, 'rsi_period': 17, 'ema1': 5, 'ema2': 24, 'slip_atr_k': 0.004570011752128063, 'slip_spread_k': 0.6605579690441161, 'spread_hl_frac': 0.018134115762698223, 'bb_std_mult': 1.5968756263333441, 'rsi_os': 36, 'rsi_ob': 83, 'vol_spike': 0.013548244656404028, 'adx_thresh': 16.558886474685906, 'atr_min_pct': 0.019508577360034546, 'atr_max_pct': 0.03018779691562578, 'tp_mult': 1.3266565000453379, 'tsl_mult': 0.461044336184786, 'strategy': 'mean_reversion', 'time_stop': 10, 'use_sma': False, 'use_atr': True, 'use_adx': True, 'use_ema': False, 'use_spike': True, 'rsi_required': True, 'edge_k': 0.9181386302832191, 'edge_cap': 0.8568276474886936, 'bull_strategy': 'mean_reversion', 'bull_bb_std_mult': 1.6349305011352135, 'bull_rsi_os': 24, 'bull_rsi_ob': 89, 'bull_adx_thresh': 11.460582308051581, 'bull_atr_min_pct': 0.009026974438157014, 'bull_atr_max_pct': 0.13750605922843448, 'bull_tp_mult': 1.2278237440815247, 'bull_tsl_mult': 0.4350015260905897, 'bull_time_stop': 73, 'bull_use_sma': False, 'bull_use_ema': True, 'bull_use_atr': False, 'bull_use_adx': True, 'bull_use_spike': False, 'bull_rsi_required': False, 'bear_strategy': 'mean_reversion', 'bear_bb_std_mult': 3.403825823212375, 'bear_rsi_os': 15, 'bear_rsi_ob': 76, 'bear_adx_thresh': 14.551660563569612, 'bear_atr_min_pct': 0.021991461046161058, 'bear_atr_max_pct': 0.08344181990316725, 'bear_tp_mult': 2.2542155204109826, 'bear_tsl_mult': 0.40430971785280234, 'bear_time_stop': 179, 'bear_use_sma': True, 'bear_use_ema': False, 'bear_use_atr': False, 'bear_use_adx': False, 'bear_use_spike': False, 'bear_rsi_required': False, 'sideways_strategy': 'breakout', 'sideways_bb_std_mult': 2.209140451445714, 'sideways_rsi_os': 28, 'sideways_rsi_ob': 90, 'sideways_adx_thresh': 16.499287343341898, 'sideways_atr_min_pct': 0.026105527527639255, 'sideways_atr_max_pct': 0.031931024922710334, 'sideways_tp_mult': 2.189939316931249, 'sideways_tsl_mult': 0.44891389796344605, 'sideways_time_stop': 216, 'sideways_use_sma': True, 'sideways_use_ema': False, 'sideways_use_atr': False, 'sideways_use_adx': False, 'sideways_use_spike': False, 'sideways_rsi_required': True}.
[I 2025-08-30 16:54:26,164] Trial 567 finished with values: [-0.007971241858579003, 0.0079063799745086] and parameters: {'p_sma': 7, 'p_std': 21, 'p_atr': 16, 'p_adx': 8, 'rsi_period': 22, 'ema1': 18, 'ema2': 11, 'slip_atr_k': 0.008781334077529804, 'slip_spread_k': 0.18192267821207125, 'spread_hl_frac': 0.018177257133827934, 'bb_std_mult': 3.157704711300946, 'rsi_os': 33, 'rsi_ob': 86, 'vol_spike': 0.09150337990929988, 'adx_thresh': 11.091902240697289, 'atr_min_pct': 0.019339532835139985, 'atr_max_pct': 0.1475179717711912, 'tp_mult': 2.7996321931983714, 'tsl_mult': 0.9312973000810546, 'strategy': 'mean_reversion', 'time_stop': 30, 'use_sma': False, 'use_atr': True, 'use_adx': True, 'use_ema': False, 'use_spike': False, 'rsi_required': True, 'edge_k': 0.5874212448674595, 'edge_cap': 0.8651120457181285, 'bull_strategy': 'mean_reversion', 'bull_bb_std_mult': 1.897907177654012, 'bull_rsi_os': 11, 'bull_rsi_ob': 53, 'bull_adx_thresh': 34.96967644882466, 'bull_atr_min_pct': 0.02205175755978769, 'bull_atr_max_pct': 0.1409859323460897, 'bull_tp_mult': 2.2645551608452674, 'bull_tsl_mult': 0.8003796438575992, 'bull_time_stop': 71, 'bull_use_sma': True, 'bull_use_ema': True, 'bull_use_atr': False, 'bull_use_adx': True, 'bull_use_spike': False, 'bull_rsi_required': False, 'bear_strategy': 'mean_reversion', 'bear_bb_std_mult': 1.2522562105209718, 'bear_rsi_os': 15, 'bear_rsi_ob': 76, 'bear_adx_thresh': 12.370338065105429, 'bear_atr_min_pct': 0.020721480228403918, 'bear_atr_max_pct': 0.10676539511388149, 'bear_tp_mult': 2.185489118480654, 'bear_tsl_mult': 0.6316096194865424, 'bear_time_stop': 208, 'bear_use_sma': True, 'bear_use_ema': False, 'bear_use_atr': False, 'bear_use_adx': False, 'bear_use_spike': False, 'bear_rsi_required': False, 'sideways_strategy': 'breakout', 'sideways_bb_std_mult': 0.7687536567029607, 'sideways_rsi_os': 31, 'sideways_rsi_ob': 92, 'sideways_adx_thresh': 11.090331367890341, 'sideways_atr_min_pct': 0.001705191398564004, 'sideways_atr_max_pct': 0.09922594396790682, 'sideways_tp_mult': 2.9498624237444235, 'sideways_tsl_mult': 0.44779117173684757, 'sideways_time_stop': 280, 'sideways_use_sma': True, 'sideways_use_ema': False, 'sideways_use_atr': False, 'sideways_use_adx': False, 'sideways_use_spike': False, 'sideways_rsi_required': True}.
[I 2025-08-30 16:54:27,781] Trial 569 finished with values: [-1000000000.0, 1000000000.0] and parameters: {'p_sma': 7, 'p_std': 13, 'p_atr': 10, 'p_adx': 20, 'rsi_period': 65, 'ema1': 5, 'ema2': 24, 'slip_atr_k': 0.007868957385802858, 'slip_spread_k': 0.5541898998332576, 'spread_hl_frac': 0.018315904178714756, 'bb_std_mult': 3.1665471514101817, 'rsi_os': 36, 'rsi_ob': 77, 'vol_spike': 0.08983150780018115, 'adx_thresh': 20.21604050705451, 'atr_min_pct': 0.019181784960463254, 'atr_max_pct': 0.038224998003631175, 'tp_mult': 2.419308851705014, 'tsl_mult': 0.4413210112448873, 'strategy': 'mean_reversion', 'time_stop': 31, 'use_sma': False, 'use_atr': True, 'use_adx': True, 'use_ema': False, 'use_spike': False, 'rsi_required': True, 'edge_k': 0.5748234101156042, 'edge_cap': 0.09520772635019908, 'bull_strategy': 'mean_reversion', 'bull_bb_std_mult': 1.8998458195193413, 'bull_rsi_os': 11, 'bull_rsi_ob': 56, 'bull_adx_thresh': 23.52531219706677, 'bull_atr_min_pct': 0.022212422441982724, 'bull_atr_max_pct': 0.140119699198339, 'bull_tp_mult': 2.486710142370158, 'bull_tsl_mult': 0.34749483410009396, 'bull_time_stop': 161, 'bull_use_sma': True, 'bull_use_ema': True, 'bull_use_atr': False, 'bull_use_adx': True, 'bull_use_spike': False, 'bull_rsi_required': False, 'bear_strategy': 'mean_reversion', 'bear_bb_std_mult': 2.0212777356467027, 'bear_rsi_os': 15, 'bear_rsi_ob': 78, 'bear_adx_thresh': 15.905558596390968, 'bear_atr_min_pct': 0.02058800043291545, 'bear_atr_max_pct': 0.08312446664092825, 'bear_tp_mult': 2.6261740516338543, 'bear_tsl_mult': 0.5792828235775018, 'bear_time_stop': 208, 'bear_use_sma': True, 'bear_use_ema': False, 'bear_use_atr': False, 'bear_use_adx': False, 'bear_use_spike': False, 'bear_rsi_required': False, 'sideways_strategy': 'breakout', 'sideways_bb_std_mult': 2.1227739803392303, 'sideways_rsi_os': 34, 'sideways_rsi_ob': 49, 'sideways_adx_thresh': 16.08034779954719, 'sideways_atr_min_pct': 0.025708630187863218, 'sideways_atr_max_pct': 0.14756031031240588, 'sideways_tp_mult': 1.4411956749180015, 'sideways_tsl_mult': 0.4878439022069373, 'sideways_time_stop': 9, 'sideways_use_sma': True, 'sideways_use_ema': False, 'sideways_use_atr': False, 'sideways_use_adx': False, 'sideways_use_spike': False, 'sideways_rsi_required': True}.
[I 2025-08-30 16:54:28,131] Trial 570 finished with values: [-1000000000.0, 1000000000.0] and parameters: {'p_sma': 7, 'p_std': 57, 'p_atr': 10, 'p_adx': 20, 'rsi_period': 84, 'ema1': 16, 'ema2': 53, 'slip_atr_k': 0.09379136221916269, 'slip_spread_k': 0.6226297367399904, 'spread_hl_frac': 0.033404712927684294, 'bb_std_mult': 0.8222184153576659, 'rsi_os': 36, 'rsi_ob': 71, 'vol_spike': 0.16141887280191836, 'adx_thresh': 32.632384094784285, 'atr_min_pct': 0.01818965416766546, 'atr_max_pct': 0.14793379006760976, 'tp_mult': 2.8214812274884205, 'tsl_mult': 0.4297742659055961, 'strategy': 'mean_reversion', 'time_stop': 95, 'use_sma': False, 'use_atr': True, 'use_adx': True, 'use_ema': False, 'use_spike': False, 'rsi_required': True, 'edge_k': 0.639790653729819, 'edge_cap': 0.2827794145683218, 'bull_strategy': 'mean_reversion', 'bull_bb_std_mult': 1.8968086551310606, 'bull_rsi_os': 11, 'bull_rsi_ob': 50, 'bull_adx_thresh': 20.436913547073242, 'bull_atr_min_pct': 0.020948921951345997, 'bull_atr_max_pct': 0.14032968589777406, 'bull_tp_mult': 2.2458368972230582, 'bull_tsl_mult': 0.04099839575060665, 'bull_time_stop': 84, 'bull_use_sma': False, 'bull_use_ema': True, 'bull_use_atr': True, 'bull_use_adx': True, 'bull_use_spike': False, 'bull_rsi_required': False, 'bear_strategy': 'mean_reversion', 'bear_bb_std_mult': 2.701410994974258, 'bear_rsi_os': 14, 'bear_rsi_ob': 78, 'bear_adx_thresh': 30.257509986984886, 'bear_atr_min_pct': 0.0028037080400605662, 'bear_atr_max_pct': 0.014074696368840511, 'bear_tp_mult': 1.1173309890462682, 'bear_tsl_mult': 0.585108440661682, 'bear_time_stop': 151, 'bear_use_sma': True, 'bear_use_ema': False, 'bear_use_atr': False, 'bear_use_adx': False, 'bear_use_spike': False, 'bear_rsi_required': False, 'sideways_strategy': 'breakout', 'sideways_bb_std_mult': 1.8193154072217372, 'sideways_rsi_os': 33, 'sideways_rsi_ob': 47, 'sideways_adx_thresh': 16.835863062792356, 'sideways_atr_min_pct': 0.026025289983530063, 'sideways_atr_max_pct': 0.09859930367089441, 'sideways_tp_mult': 1.4269910843098252, 'sideways_tsl_mult': 0.4844359534879449, 'sideways_time_stop': 188, 'sideways_use_sma': True, 'sideways_use_ema': False, 'sideways_use_atr': False, 'sideways_use_adx': False, 'sideways_use_spike': False, 'sideways_rsi_required': True}.
[I 2025-08-30 16:55:10,738] Trial 573 finished with values: [-1000000000.0, 1000000000.0] and parameters: {'p_sma': 7, 'p_std': 21, 'p_atr': 16, 'p_adx': 8, 'rsi_period': 27, 'ema1': 17, 'ema2': 11, 'slip_atr_k': 0.02005367913681621, 'slip_spread_k': 0.07411788968993499, 'spread_hl_frac': 0.021095928601621197, 'bb_std_mult': 3.3000492719221626, 'rsi_os': 31, 'rsi_ob': 84, 'vol_spike': 0.07326361127661744, 'adx_thresh': 9.079798458666946, 'atr_min_pct': 0.019948768266940236, 'atr_max_pct': 0.14912011944943623, 'tp_mult': 2.7279191954388375, 'tsl_mult': 0.929225176996971, 'strategy': 'mean_reversion', 'time_stop': 43, 'use_sma': False, 'use_atr': True, 'use_adx': True, 'use_ema': False, 'use_spike': False, 'rsi_required': True, 'edge_k': 0.5129394975763785, 'edge_cap': 0.8747615353830647, 'bull_strategy': 'mean_reversion', 'bull_bb_std_mult': 1.9932774696864932, 'bull_rsi_os': 9, 'bull_rsi_ob': 56, 'bull_adx_thresh': 34.89908331807987, 'bull_atr_min_pct': 0.02335704716025859, 'bull_atr_max_pct': 0.14587099786413038, 'bull_tp_mult': 2.2923737063883016, 'bull_tsl_mult': 0.7938296141713972, 'bull_time_stop': 86, 'bull_use_sma': True, 'bull_use_ema': True, 'bull_use_atr': False, 'bull_use_adx': True, 'bull_use_spike': True, 'bull_rsi_required': False, 'bear_strategy': 'mean_reversion', 'bear_bb_std_mult': 0.7928817361932408, 'bear_rsi_os': 17, 'bear_rsi_ob': 73, 'bear_adx_thresh': 11.175871480110885, 'bear_atr_min_pct': 0.018879531875089187, 'bear_atr_max_pct': 0.11083843796416622, 'bear_tp_mult': 2.0926578525086836, 'bear_tsl_mult': 0.6122221983236402, 'bear_time_stop': 201, 'bear_use_sma': True, 'bear_use_ema': False, 'bear_use_atr': False, 'bear_use_adx': False, 'bear_use_spike': False, 'bear_rsi_required': False, 'sideways_strategy': 'breakout', 'sideways_bb_std_mult': 0.7434037800709024, 'sideways_rsi_os': 32, 'sideways_rsi_ob': 91, 'sideways_adx_thresh': 11.154889433703673, 'sideways_atr_min_pct': 0.003807889599465831, 'sideways_atr_max_pct': 0.09853458485561838, 'sideways_tp_mult': 2.9724073385282206, 'sideways_tsl_mult': 0.4067406774147245, 'sideways_time_stop': 280, 'sideways_use_sma': True, 'sideways_use_ema': False, 'sideways_use_atr': True, 'sideways_use_adx': False, 'sideways_use_spike': False, 'sideways_rsi_required': True}.
[I 2025-08-30 16:55:11,088] Trial 572 finished with values: [-1000000000.0, 1000000000.0] and parameters: {'p_sma': 7, 'p_std': 21, 'p_atr': 17, 'p_adx': 8, 'rsi_period': 26, 'ema1': 17, 'ema2': 11, 'slip_atr_k': 0.021813537760649003, 'slip_spread_k': 0.15425830447273953, 'spread_hl_frac': 0.020436159329201058, 'bb_std_mult': 3.2569553316322484, 'rsi_os': 31, 'rsi_ob': 81, 'vol_spike': 0.07429587299693424, 'adx_thresh': 9.103001850897861, 'atr_min_pct': 0.020730260022131755, 'atr_max_pct': 0.1494791515816422, 'tp_mult': 2.7232047450489505, 'tsl_mult': 0.9234288846401233, 'strategy': 'mean_reversion', 'time_stop': 43, 'use_sma': False, 'use_atr': True, 'use_adx': True, 'use_ema': False, 'use_spike': False, 'rsi_required': True, 'edge_k': 0.5663730842755096, 'edge_cap': 0.8787071541443562, 'bull_strategy': 'mean_reversion', 'bull_bb_std_mult': 2.011239440854411, 'bull_rsi_os': 48, 'bull_rsi_ob': 56, 'bull_adx_thresh': 34.968773540362925, 'bull_atr_min_pct': 0.02337298012842175, 'bull_atr_max_pct': 0.14854334916854922, 'bull_tp_mult': 2.256608270991681, 'bull_tsl_mult': 0.7936827227558687, 'bull_time_stop': 82, 'bull_use_sma': True, 'bull_use_ema': True, 'bull_use_atr': False, 'bull_use_adx': True, 'bull_use_spike': False, 'bull_rsi_required': False, 'bear_strategy': 'mean_reversion', 'bear_bb_std_mult': 1.2309321610738788, 'bear_rsi_os': 17, 'bear_rsi_ob': 73, 'bear_adx_thresh': 11.334068382470326, 'bear_atr_min_pct': 0.01857789128839572, 'bear_atr_max_pct': 0.10701089137861935, 'bear_tp_mult': 2.0675347603994765, 'bear_tsl_mult': 0.5892850577202359, 'bear_time_stop': 198, 'bear_use_sma': True, 'bear_use_ema': False, 'bear_use_atr': False, 'bear_use_adx': False, 'bear_use_spike': False, 'bear_rsi_required': False, 'sideways_strategy': 'breakout', 'sideways_bb_std_mult': 0.7282538107976444, 'sideways_rsi_os': 32, 'sideways_rsi_ob': 91, 'sideways_adx_thresh': 11.2273076880881, 'sideways_atr_min_pct': 0.0031147968339683262, 'sideways_atr_max_pct': 0.10049387685670606, 'sideways_tp_mult': 2.9635804155907803, 'sideways_tsl_mult': 0.40233841932016945, 'sideways_time_stop': 281, 'sideways_use_sma': True, 'sideways_use_ema': False, 'sideways_use_atr': False, 'sideways_use_adx': False, 'sideways_use_spike': False, 'sideways_rsi_required': True}.
[I 2025-08-30 16:55:11,317] Trial 571 finished with values: [-0.027415971277674034, 0.027297483995667084] and parameters: {'p_sma': 7, 'p_std': 21, 'p_atr': 10, 'p_adx': 20, 'rsi_period': 19, 'ema1': 26, 'ema2': 11, 'slip_atr_k': 0.09658705788155772, 'slip_spread_k': 0.5518147777658492, 'spread_hl_frac': 0.03357887817594813, 'bb_std_mult': 1.8028927832654689, 'rsi_os': 33, 'rsi_ob': 71, 'vol_spike': 0.09206592622699722, 'adx_thresh': 15.37080617661801, 'atr_min_pct': 0.01688147587041586, 'atr_max_pct': 0.0385490339549774, 'tp_mult': 2.8126665488961353, 'tsl_mult': 0.9274197004151917, 'strategy': 'mean_reversion', 'time_stop': 192, 'use_sma': False, 'use_atr': True, 'use_adx': True, 'use_ema': False, 'use_spike': False, 'rsi_required': True, 'edge_k': 1.5227138843368175, 'edge_cap': 0.06225488573480925, 'bull_strategy': 'mean_reversion', 'bull_bb_std_mult': 1.9138179701117466, 'bull_rsi_os': 9, 'bull_rsi_ob': 50, 'bull_adx_thresh': 20.816017543698283, 'bull_atr_min_pct': 0.023428992334457003, 'bull_atr_max_pct': 0.14015443084691345, 'bull_tp_mult': 1.1733162208238674, 'bull_tsl_mult': 0.34810242827986, 'bull_time_stop': 178, 'bull_use_sma': False, 'bull_use_ema': True, 'bull_use_atr': True, 'bull_use_adx': True, 'bull_use_spike': False, 'bull_rsi_required': False, 'bear_strategy': 'mean_reversion', 'bear_bb_std_mult': 2.122398264193357, 'bear_rsi_os': 31, 'bear_rsi_ob': 78, 'bear_adx_thresh': 10.958104078373815, 'bear_atr_min_pct': 0.021180223954039738, 'bear_atr_max_pct': 0.013889259652583766, 'bear_tp_mult': 2.0672361511592126, 'bear_tsl_mult': 0.5775257739428948, 'bear_time_stop': 32, 'bear_use_sma': True, 'bear_use_ema': False, 'bear_use_atr': False, 'bear_use_adx': False, 'bear_use_spike': False, 'bear_rsi_required': False, 'sideways_strategy': 'breakout', 'sideways_bb_std_mult': 2.117250268065364, 'sideways_rsi_os': 34, 'sideways_rsi_ob': 91, 'sideways_adx_thresh': 15.628226001912447, 'sideways_atr_min_pct': 0.001698816850767013, 'sideways_atr_max_pct': 0.10370054885436183, 'sideways_tp_mult': 2.557064638802146, 'sideways_tsl_mult': 0.48423524724595723, 'sideways_time_stop': 198, 'sideways_use_sma': True, 'sideways_use_ema': False, 'sideways_use_atr': False, 'sideways_use_adx': False, 'sideways_use_spike': False, 'sideways_rsi_required': True}.
[I 2025-08-30 16:55:11,510] Trial 574 finished with values: [-1000000000.0, 1000000000.0] and parameters: {'p_sma': 7, 'p_std': 20, 'p_atr': 16, 'p_adx': 8, 'rsi_period': 26, 'ema1': 18, 'ema2': 11, 'slip_atr_k': 0.022780166443188987, 'slip_spread_k': 0.15610632702785224, 'spread_hl_frac': 0.020875536566588238, 'bb_std_mult': 3.352783063578809, 'rsi_os': 30, 'rsi_ob': 84, 'vol_spike': 0.0770119801770139, 'adx_thresh': 9.528471954639276, 'atr_min_pct': 0.02048333587446819, 'atr_max_pct': 0.1497451543897752, 'tp_mult': 2.7464655561066817, 'tsl_mult': 0.9207248455436139, 'strategy': 'mean_reversion', 'time_stop': 43, 'use_sma': False, 'use_atr': True, 'use_adx': True, 'use_ema': False, 'use_spike': False, 'rsi_required': True, 'edge_k': 0.5228005030930688, 'edge_cap': 0.8811178262063468, 'bull_strategy': 'breakout', 'bull_bb_std_mult': 2.0120501875133527, 'bull_rsi_os': 48, 'bull_rsi_ob': 57, 'bull_adx_thresh': 34.629178083910084, 'bull_atr_min_pct': 0.022759504551024372, 'bull_atr_max_pct': 0.14652886464261686, 'bull_tp_mult': 2.271756458747258, 'bull_tsl_mult': 0.8762012037558283, 'bull_time_stop': 87, 'bull_use_sma': True, 'bull_use_ema': False, 'bull_use_atr': False, 'bull_use_adx': True, 'bull_use_spike': True, 'bull_rsi_required': False, 'bear_strategy': 'mean_reversion', 'bear_bb_std_mult': 0.8729194516299226, 'bear_rsi_os': 17, 'bear_rsi_ob': 73, 'bear_adx_thresh': 10.754615182357787, 'bear_atr_min_pct': 0.018805274288689902, 'bear_atr_max_pct': 0.10673142546446529, 'bear_tp_mult': 2.080788024669243, 'bear_tsl_mult': 0.5852857725337589, 'bear_time_stop': 197, 'bear_use_sma': False, 'bear_use_ema': False, 'bear_use_atr': False, 'bear_use_adx': False, 'bear_use_spike': False, 'bear_rsi_required': False, 'sideways_strategy': 'breakout', 'sideways_bb_std_mult': 0.7335040673594058, 'sideways_rsi_os': 33, 'sideways_rsi_ob': 91, 'sideways_adx_thresh': 11.069407044891932, 'sideways_atr_min_pct': 0.003137638516806166, 'sideways_atr_max_pct': 0.10239906771234927, 'sideways_tp_mult': 2.9600009446380686, 'sideways_tsl_mult': 0.41032065509794885, 'sideways_time_stop': 279, 'sideways_use_sma': True, 'sideways_use_ema': False, 'sideways_use_atr': True, 'sideways_use_adx': True, 'sideways_use_spike': False, 'sideways_rsi_required': False}.
[I 2025-08-30 16:55:52,851] Trial 576 finished with values: [-1000000000.0, 1000000000.0] and parameters: {'p_sma': 6, 'p_std': 20, 'p_atr': 16, 'p_adx': 10, 'rsi_period': 26, 'ema1': 18, 'ema2': 12, 'slip_atr_k': 0.021479890093272173, 'slip_spread_k': 0.11486389115873204, 'spread_hl_frac': 0.020726102467672976, 'bb_std_mult': 3.27196336778851, 'rsi_os': 30, 'rsi_ob': 84, 'vol_spike': 0.08182100950672495, 'adx_thresh': 8.230409020795202, 'atr_min_pct': 0.020607038447109795, 'atr_max_pct': 0.14988132139234978, 'tp_mult': 2.7953626864556314, 'tsl_mult': 0.9690091088073626, 'strategy': 'breakout', 'time_stop': 41, 'use_sma': False, 'use_atr': True, 'use_adx': False, 'use_ema': False, 'use_spike': False, 'rsi_required': False, 'edge_k': 0.733754627454315, 'edge_cap': 0.7988165303562603, 'bull_strategy': 'breakout', 'bull_bb_std_mult': 2.134752189435627, 'bull_rsi_os': 52, 'bull_rsi_ob': 58, 'bull_adx_thresh': 34.37665720611881, 'bull_atr_min_pct': 0.023602021125698657, 'bull_atr_max_pct': 0.1464076259835289, 'bull_tp_mult': 2.351110079064802, 'bull_tsl_mult': 0.8469961079577248, 'bull_time_stop': 79, 'bull_use_sma': True, 'bull_use_ema': False, 'bull_use_atr': False, 'bull_use_adx': False, 'bull_use_spike': False, 'bull_rsi_required': False, 'bear_strategy': 'mean_reversion', 'bear_bb_std_mult': 1.3987762400825512, 'bear_rsi_os': 17, 'bear_rsi_ob': 74, 'bear_adx_thresh': 10.797810389005218, 'bear_atr_min_pct': 0.017767883496024338, 'bear_atr_max_pct': 0.10730868167163832, 'bear_tp_mult': 2.078795959631532, 'bear_tsl_mult': 0.6072548187675086, 'bear_time_stop': 201, 'bear_use_sma': False, 'bear_use_ema': False, 'bear_use_atr': False, 'bear_use_adx': False, 'bear_use_spike': True, 'bear_rsi_required': True, 'sideways_strategy': 'mean_reversion', 'sideways_bb_std_mult': 0.6458773162049956, 'sideways_rsi_os': 33, 'sideways_rsi_ob': 90, 'sideways_adx_thresh': 10.638434534561245, 'sideways_atr_min_pct': 0.002946169018235205, 'sideways_atr_max_pct': 0.10207823351356994, 'sideways_tp_mult': 2.9372138964951406, 'sideways_tsl_mult': 0.41484424334779774, 'sideways_time_stop': 279, 'sideways_use_sma': False, 'sideways_use_ema': False, 'sideways_use_atr': False, 'sideways_use_adx': True, 'sideways_use_spike': True, 'sideways_rsi_required': False}.
