[I 2025-08-30 15:59:39,859] Trial 252 finished with values: [-1000000000.0, 1000000000.0] and parameters: {'p_sma': 16, 'p_std': 31, 'p_atr': 26, 'p_adx': 13, 'rsi_period': 27, 'ema1': 6, 'ema2': 58, 'slip_atr_k': 0.06460869567503424, 'slip_spread_k': 0.6946022276394326, 'spread_hl_frac': 0.04971283165610543, 'bb_std_mult': 0.5002243892903198, 'rsi_os': 38, 'rsi_ob': 54, 'vol_spike': 0.14591198563766955, 'adx_thresh': 29.320880764074712, 'atr_min_pct': 0.022409897139225907, 'atr_max_pct': 0.10313895517455195, 'tp_mult': 1.0934009081807528, 'tsl_mult': 0.44232498333611997, 'strategy': 'breakout', 'time_stop': 15, 'use_sma': False, 'use_atr': True, 'use_adx': False, 'use_ema': False, 'use_spike': True, 'rsi_required': False, 'edge_k': 1.8530765911127747, 'edge_cap': 0.6366262752213284, 'bull_strategy': 'mean_reversion', 'bull_bb_std_mult': 0.9673683848145813, 'bull_rsi_os': 12, 'bull_rsi_ob': 47, 'bull_adx_thresh': 29.551365168631975, 'bull_atr_min_pct': 0.002055583456609386, 'bull_atr_max_pct': 0.12112090018388799, 'bull_tp_mult': 2.0963782705310705, 'bull_tsl_mult': 0.9026004415472144, 'bull_time_stop': 84, 'bull_use_sma': True, 'bull_use_ema': True, 'bull_use_atr': False, 'bull_use_adx': False, 'bull_use_spike': False, 'bull_rsi_required': True, 'bear_strategy': 'mean_reversion', 'bear_bb_std_mult': 2.014107086211167, 'bear_rsi_os': 20, 'bear_rsi_ob': 76, 'bear_adx_thresh': 13.119324159438662, 'bear_atr_min_pct': 0.02755260498769156, 'bear_atr_max_pct': 0.09399927873396988, 'bear_tp_mult': 2.3840614985449515, 'bear_tsl_mult': 0.5637286036632573, 'bear_time_stop': 150, 'bear_use_sma': False, 'bear_use_ema': False, 'bear_use_atr': False, 'bear_use_adx': False, 'bear_use_spike': True, 'bear_rsi_required': False, 'sideways_strategy': 'breakout', 'sideways_bb_std_mult': 3.155721144235454, 'sideways_rsi_os': 30, 'sideways_rsi_ob': 82, 'sideways_adx_thresh': 14.437065296912568, 'sideways_atr_min_pct': 0.0027781603816852893, 'sideways_atr_max_pct': 0.13743066233959347, 'sideways_tp_mult': 1.971226347025973, 'sideways_tsl_mult': 0.7737592726683529, 'sideways_time_stop': 228, 'sideways_use_sma': True, 'sideways_use_ema': False, 'sideways_use_atr': False, 'sideways_use_adx': True, 'sideways_use_spike': False, 'sideways_rsi_required': True}.
[I 2025-08-30 16:00:20,487] Trial 254 finished with values: [-0.039622410580224865, 0.03955848790219437] and parameters: {'p_sma': 60, 'p_std': 44, 'p_atr': 11, 'p_adx': 13, 'rsi_period': 51, 'ema1': 20, 'ema2': 58, 'slip_atr_k': 0.08165355150940211, 'slip_spread_k': 0.04397642773910682, 'spread_hl_frac': 0.04516155564777803, 'bb_std_mult': 3.1540847323463517, 'rsi_os': 5, 'rsi_ob': 55, 'vol_spike': 0.019699785604684397, 'adx_thresh': 5.054227399827724, 'atr_min_pct': 0.020067919099598458, 'atr_max_pct': 0.1407545528816048, 'tp_mult': 2.5246282306133145, 'tsl_mult': 0.41947358173151583, 'strategy': 'breakout', 'time_stop': 13, 'use_sma': False, 'use_atr': True, 'use_adx': False, 'use_ema': False, 'use_spike': True, 'rsi_required': False, 'edge_k': 1.906606067941247, 'edge_cap': 0.6481422900262448, 'bull_strategy': 'mean_reversion', 'bull_bb_std_mult': 1.847923816898101, 'bull_rsi_os': 12, 'bull_rsi_ob': 75, 'bull_adx_thresh': 29.65379081549279, 'bull_atr_min_pct': 0.0007681442484534634, 'bull_atr_max_pct': 0.12097470099628885, 'bull_tp_mult': 1.5176395809514007, 'bull_tsl_mult': 0.3174502603224587, 'bull_time_stop': 170, 'bull_use_sma': True, 'bull_use_ema': False, 'bull_use_atr': False, 'bull_use_adx': False, 'bull_use_spike': False, 'bull_rsi_required': True, 'bear_strategy': 'mean_reversion', 'bear_bb_std_mult': 2.0171136340842635, 'bear_rsi_os': 15, 'bear_rsi_ob': 76, 'bear_adx_thresh': 14.510862308446079, 'bear_atr_min_pct': 0.02745531726542315, 'bear_atr_max_pct': 0.09423481180357379, 'bear_tp_mult': 2.379219186183112, 'bear_tsl_mult': 0.49341659451461506, 'bear_time_stop': 115, 'bear_use_sma': False, 'bear_use_ema': False, 'bear_use_atr': False, 'bear_use_adx': False, 'bear_use_spike': True, 'bear_rsi_required': False, 'sideways_strategy': 'breakout', 'sideways_bb_std_mult': 1.5435861107736957, 'sideways_rsi_os': 14, 'sideways_rsi_ob': 91, 'sideways_adx_thresh': 16.34276965190421, 'sideways_atr_min_pct': 0.02924035682863107, 'sideways_atr_max_pct': 0.14999559959893563, 'sideways_tp_mult': 2.305988617533295, 'sideways_tsl_mult': 0.7426097634939465, 'sideways_time_stop': 181, 'sideways_use_sma': True, 'sideways_use_ema': False, 'sideways_use_atr': False, 'sideways_use_adx': True, 'sideways_use_spike': False, 'sideways_rsi_required': True}.
[I 2025-08-30 16:00:20,510] Trial 256 finished with values: [-0.03684755460916189, 0.036745073578960216] and parameters: {'p_sma': 56, 'p_std': 34, 'p_atr': 7, 'p_adx': 15, 'rsi_period': 14, 'ema1': 9, 'ema2': 14, 'slip_atr_k': 0.055681193700226506, 'slip_spread_k': 0.04474590134498605, 'spread_hl_frac': 0.024450332703737036, 'bb_std_mult': 3.167901894648145, 'rsi_os': 47, 'rsi_ob': 49, 'vol_spike': 0.1814920878853501, 'adx_thresh': 26.252419662737378, 'atr_min_pct': 0.019182947652361858, 'atr_max_pct': 0.14079065232805058, 'tp_mult': 1.1168267169928847, 'tsl_mult': 0.4174691277281924, 'strategy': 'breakout', 'time_stop': 11, 'use_sma': False, 'use_atr': True, 'use_adx': False, 'use_ema': True, 'use_spike': True, 'rsi_required': False, 'edge_k': 1.9014525190387281, 'edge_cap': 0.6058842091619437, 'bull_strategy': 'breakout', 'bull_bb_std_mult': 1.8448693294947807, 'bull_rsi_os': 54, 'bull_rsi_ob': 77, 'bull_adx_thresh': 13.882174181545322, 'bull_atr_min_pct': 0.0008053796929492945, 'bull_atr_max_pct': 0.08834539467640828, 'bull_tp_mult': 1.074291563584289, 'bull_tsl_mult': 0.8121056901956998, 'bull_time_stop': 176, 'bull_use_sma': True, 'bull_use_ema': False, 'bull_use_atr': False, 'bull_use_adx': False, 'bull_use_spike': False, 'bull_rsi_required': True, 'bear_strategy': 'breakout', 'bear_bb_std_mult': 2.0316921123279905, 'bear_rsi_os': 24, 'bear_rsi_ob': 77, 'bear_adx_thresh': 26.246058578856804, 'bear_atr_min_pct': 0.004589436521167689, 'bear_atr_max_pct': 0.08672447191646065, 'bear_tp_mult': 2.2700562295338216, 'bear_tsl_mult': 0.4906443834555201, 'bear_time_stop': 234, 'bear_use_sma': False, 'bear_use_ema': False, 'bear_use_atr': False, 'bear_use_adx': False, 'bear_use_spike': True, 'bear_rsi_required': False, 'sideways_strategy': 'breakout', 'sideways_bb_std_mult': 1.2853989392372882, 'sideways_rsi_os': 29, 'sideways_rsi_ob': 91, 'sideways_adx_thresh': 34.209674912375775, 'sideways_atr_min_pct': 0.015071278073344688, 'sideways_atr_max_pct': 0.023122101914430974, 'sideways_tp_mult': 2.3752730487337375, 'sideways_tsl_mult': 0.7421590845894498, 'sideways_time_stop': 100, 'sideways_use_sma': True, 'sideways_use_ema': False, 'sideways_use_atr': False, 'sideways_use_adx': True, 'sideways_use_spike': False, 'sideways_rsi_required': True}.
[I 2025-08-30 16:00:21,156] Trial 253 finished with values: [-0.0197032137626737, 0.019627699270280737] and parameters: {'p_sma': 16, 'p_std': 31, 'p_atr': 11, 'p_adx': 13, 'rsi_period': 27, 'ema1': 5, 'ema2': 58, 'slip_atr_k': 0.08026864908555875, 'slip_spread_k': 0.04685612303286599, 'spread_hl_frac': 0.04919646601512939, 'bb_std_mult': 3.169589235624828, 'rsi_os': 5, 'rsi_ob': 55, 'vol_spike': 0.019965234805132265, 'adx_thresh': 26.097987473020655, 'atr_min_pct': 0.014644872948834932, 'atr_max_pct': 0.14496475568233855, 'tp_mult': 1.0863630042180175, 'tsl_mult': 0.42400114599591854, 'strategy': 'breakout', 'time_stop': 16, 'use_sma': False, 'use_atr': True, 'use_adx': False, 'use_ema': False, 'use_spike': True, 'rsi_required': False, 'edge_k': 1.9070539035043477, 'edge_cap': 0.6284836611632906, 'bull_strategy': 'mean_reversion', 'bull_bb_std_mult': 0.9305237870135723, 'bull_rsi_os': 12, 'bull_rsi_ob': 75, 'bull_adx_thresh': 29.751700491531036, 'bull_atr_min_pct': 0.0018866390799509903, 'bull_atr_max_pct': 0.09186216249249872, 'bull_tp_mult': 1.0828256419301616, 'bull_tsl_mult': 0.009730477126727255, 'bull_time_stop': 238, 'bull_use_sma': True, 'bull_use_ema': False, 'bull_use_atr': False, 'bull_use_adx': False, 'bull_use_spike': False, 'bull_rsi_required': True, 'bear_strategy': 'mean_reversion', 'bear_bb_std_mult': 3.131472843488658, 'bear_rsi_os': 24, 'bear_rsi_ob': 76, 'bear_adx_thresh': 22.992791012344043, 'bear_atr_min_pct': 0.029804046490381, 'bear_atr_max_pct': 0.09345628912864576, 'bear_tp_mult': 2.3803583121060448, 'bear_tsl_mult': 0.9480053046789017, 'bear_time_stop': 119, 'bear_use_sma': False, 'bear_use_ema': False, 'bear_use_atr': False, 'bear_use_adx': False, 'bear_use_spike': True, 'bear_rsi_required': False, 'sideways_strategy': 'breakout', 'sideways_bb_std_mult': 1.2771294872789343, 'sideways_rsi_os': 30, 'sideways_rsi_ob': 82, 'sideways_adx_thresh': 26.27193286547651, 'sideways_atr_min_pct': 0.003059365680343481, 'sideways_atr_max_pct': 0.13730932575955346, 'sideways_tp_mult': 2.115713894392301, 'sideways_tsl_mult': 0.7331285114235703, 'sideways_time_stop': 236, 'sideways_use_sma': True, 'sideways_use_ema': False, 'sideways_use_atr': False, 'sideways_use_adx': True, 'sideways_use_spike': False, 'sideways_rsi_required': True}.
[I 2025-08-30 16:00:21,389] Trial 255 finished with values: [-0.01900341681889295, 0.01890472481383597] and parameters: {'p_sma': 23, 'p_std': 35, 'p_atr': 7, 'p_adx': 13, 'rsi_period': 51, 'ema1': 26, 'ema2': 58, 'slip_atr_k': 0.004868935052057658, 'slip_spread_k': 0.0528390352199928, 'spread_hl_frac': 0.03412733474640768, 'bb_std_mult': 0.9769702723770213, 'rsi_os': 37, 'rsi_ob': 55, 'vol_spike': 0.022143336294998407, 'adx_thresh': 26.308548806958786, 'atr_min_pct': 0.02275025189595843, 'atr_max_pct': 0.14012132378558237, 'tp_mult': 2.5291458481298683, 'tsl_mult': 0.387348729261831, 'strategy': 'breakout', 'time_stop': 90, 'use_sma': False, 'use_atr': True, 'use_adx': False, 'use_ema': False, 'use_spike': True, 'rsi_required': False, 'edge_k': 0.7894757475369762, 'edge_cap': 0.615907627745182, 'bull_strategy': 'breakout', 'bull_bb_std_mult': 0.9542108574099559, 'bull_rsi_os': 11, 'bull_rsi_ob': 78, 'bull_adx_thresh': 29.622488105793202, 'bull_atr_min_pct': 0.000977787261764665, 'bull_atr_max_pct': 0.135261394039274, 'bull_tp_mult': 1.0752591448449085, 'bull_tsl_mult': 0.6809686801878532, 'bull_time_stop': 97, 'bull_use_sma': True, 'bull_use_ema': False, 'bull_use_atr': False, 'bull_use_adx': False, 'bull_use_spike': False, 'bull_rsi_required': True, 'bear_strategy': 'mean_reversion', 'bear_bb_std_mult': 2.0193950829517853, 'bear_rsi_os': 15, 'bear_rsi_ob': 76, 'bear_adx_thresh': 24.396002576487714, 'bear_atr_min_pct': 0.027206358697129417, 'bear_atr_max_pct': 0.09377360641378082, 'bear_tp_mult': 2.265927587024462, 'bear_tsl_mult': 0.26620133036466465, 'bear_time_stop': 269, 'bear_use_sma': False, 'bear_use_ema': False, 'bear_use_atr': False, 'bear_use_adx': False, 'bear_use_spike': True, 'bear_rsi_required': False, 'sideways_strategy': 'breakout', 'sideways_bb_std_mult': 2.799175194638228, 'sideways_rsi_os': 5, 'sideways_rsi_ob': 91, 'sideways_adx_thresh': 34.155684633411724, 'sideways_atr_min_pct': 0.01485792992499615, 'sideways_atr_max_pct': 0.02211874583488673, 'sideways_tp_mult': 1.6323985705214135, 'sideways_tsl_mult': 0.7429902171946067, 'sideways_time_stop': 237, 'sideways_use_sma': True, 'sideways_use_ema': False, 'sideways_use_atr': False, 'sideways_use_adx': True, 'sideways_use_spike': False, 'sideways_rsi_required': True}.
[I 2025-08-30 16:00:23,024] Trial 260 finished with values: [-1000000000.0, 1000000000.0] and parameters: {'p_sma': 37, 'p_std': 51, 'p_atr': 24, 'p_adx': 15, 'rsi_period': 34, 'ema1': 14, 'ema2': 59, 'slip_atr_k': 0.038158640427962506, 'slip_spread_k': 0.6294698928239266, 'spread_hl_frac': 0.04629063511980168, 'bb_std_mult': 3.0837552780083906, 'rsi_os': 11, 'rsi_ob': 73, 'vol_spike': 0.006383575562337205, 'adx_thresh': 25.418717934095252, 'atr_min_pct': 0.020604954136471648, 'atr_max_pct': 0.013861414345916659, 'tp_mult': 1.1736327490897465, 'tsl_mult': 0.07284605401729127, 'strategy': 'breakout', 'time_stop': 26, 'use_sma': True, 'use_atr': True, 'use_adx': False, 'use_ema': True, 'use_spike': True, 'rsi_required': False, 'edge_k': 0.8212263346583143, 'edge_cap': 0.6553884376103725, 'bull_strategy': 'breakout', 'bull_bb_std_mult': 1.602121748811728, 'bull_rsi_os': 9, 'bull_rsi_ob': 55, 'bull_adx_thresh': 30.63221221384722, 'bull_atr_min_pct': 0.0011043941936849495, 'bull_atr_max_pct': 0.1275163932475081, 'bull_tp_mult': 1.3080532063493073, 'bull_tsl_mult': 0.38525288811562053, 'bull_time_stop': 63, 'bull_use_sma': True, 'bull_use_ema': True, 'bull_use_atr': False, 'bull_use_adx': False, 'bull_use_spike': False, 'bull_rsi_required': False, 'bear_strategy': 'breakout', 'bear_bb_std_mult': 1.2653721405327563, 'bear_rsi_os': 18, 'bear_rsi_ob': 46, 'bear_adx_thresh': 12.017349235219587, 'bear_atr_min_pct': 0.0033767919531830087, 'bear_atr_max_pct': 0.09057325287024949, 'bear_tp_mult': 2.5079521765400328, 'bear_tsl_mult': 0.4295391282529557, 'bear_time_stop': 278, 'bear_use_sma': False, 'bear_use_ema': False, 'bear_use_atr': False, 'bear_use_adx': True, 'bear_use_spike': True, 'bear_rsi_required': True, 'sideways_strategy': 'breakout', 'sideways_bb_std_mult': 1.8305235411887186, 'sideways_rsi_os': 28, 'sideways_rsi_ob': 72, 'sideways_adx_thresh': 10.705987234060453, 'sideways_atr_min_pct': 0.0055858475219944005, 'sideways_atr_max_pct': 0.04741375872977465, 'sideways_tp_mult': 2.9966097128120546, 'sideways_tsl_mult': 0.67505955382039, 'sideways_time_stop': 219, 'sideways_use_sma': True, 'sideways_use_ema': False, 'sideways_use_atr': False, 'sideways_use_adx': True, 'sideways_use_spike': False, 'sideways_rsi_required': True}.
[I 2025-08-30 16:01:07,426] Trial 257 finished with values: [-1000000000.0, 1000000000.0] and parameters: {'p_sma': 23, 'p_std': 59, 'p_atr': 16, 'p_adx': 22, 'rsi_period': 22, 'ema1': 26, 'ema2': 59, 'slip_atr_k': 0.038110749682150086, 'slip_spread_k': 0.7483001519778467, 'spread_hl_frac': 0.0461271683323508, 'bb_std_mult': 0.9682949289189655, 'rsi_os': 36, 'rsi_ob': 53, 'vol_spike': 0.08373757458143616, 'adx_thresh': 25.56490056538006, 'atr_min_pct': 0.023065535436505184, 'atr_max_pct': 0.13576779944128659, 'tp_mult': 1.1831682170932556, 'tsl_mult': 0.46446552695208165, 'strategy': 'breakout', 'time_stop': 94, 'use_sma': True, 'use_atr': True, 'use_adx': False, 'use_ema': False, 'use_spike': True, 'rsi_required': False, 'edge_k': 1.9847621765003878, 'edge_cap': 0.6180656801481041, 'bull_strategy': 'breakout', 'bull_bb_std_mult': 2.8694247518854663, 'bull_rsi_os': 46, 'bull_rsi_ob': 80, 'bull_adx_thresh': 30.41652084660956, 'bull_atr_min_pct': 0.014185612792293746, 'bull_atr_max_pct': 0.1459085820791264, 'bull_tp_mult': 1.1471811150384024, 'bull_tsl_mult': 0.38791570067933456, 'bull_time_stop': 259, 'bull_use_sma': True, 'bull_use_ema': True, 'bull_use_atr': False, 'bull_use_adx': False, 'bull_use_spike': False, 'bull_rsi_required': True, 'bear_strategy': 'mean_reversion', 'bear_bb_std_mult': 3.273197255030982, 'bear_rsi_os': 14, 'bear_rsi_ob': 45, 'bear_adx_thresh': 23.13123509332119, 'bear_atr_min_pct': 0.029349206883989638, 'bear_atr_max_pct': 0.043455734471002455, 'bear_tp_mult': 2.48938108366897, 'bear_tsl_mult': 0.18765347018226503, 'bear_time_stop': 269, 'bear_use_sma': False, 'bear_use_ema': False, 'bear_use_atr': False, 'bear_use_adx': True, 'bear_use_spike': True, 'bear_rsi_required': True, 'sideways_strategy': 'breakout', 'sideways_bb_std_mult': 3.188787740761827, 'sideways_rsi_os': 33, 'sideways_rsi_ob': 92, 'sideways_adx_thresh': 10.936336383017117, 'sideways_atr_min_pct': 0.022309416870604067, 'sideways_atr_max_pct': 0.0297548825631941, 'sideways_tp_mult': 2.648225257214591, 'sideways_tsl_mult': 0.6787702705470344, 'sideways_time_stop': 238, 'sideways_use_sma': True, 'sideways_use_ema': False, 'sideways_use_atr': False, 'sideways_use_adx': True, 'sideways_use_spike': False, 'sideways_rsi_required': True}.
[I 2025-08-30 16:01:08,384] Trial 258 finished with values: [-1000000000.0, 1000000000.0] and parameters: {'p_sma': 17, 'p_std': 46, 'p_atr': 16, 'p_adx': 22, 'rsi_period': 63, 'ema1': 15, 'ema2': 59, 'slip_atr_k': 0.11902253225743105, 'slip_spread_k': 0.4920073943461576, 'spread_hl_frac': 0.04627552001924059, 'bb_std_mult': 0.94093949066903, 'rsi_os': 36, 'rsi_ob': 53, 'vol_spike': 0.04934205033052165, 'adx_thresh': 25.74865275279376, 'atr_min_pct': 0.023033382649906824, 'atr_max_pct': 0.14428493370841128, 'tp_mult': 2.4110193029649856, 'tsl_mult': 0.60996191557276, 'strategy': 'breakout', 'time_stop': 178, 'use_sma': True, 'use_atr': True, 'use_adx': False, 'use_ema': False, 'use_spike': True, 'rsi_required': False, 'edge_k': 1.9922191195799588, 'edge_cap': 0.6167746959315311, 'bull_strategy': 'breakout', 'bull_bb_std_mult': 1.104292163738545, 'bull_rsi_os': 9, 'bull_rsi_ob': 55, 'bull_adx_thresh': 30.363559168617144, 'bull_atr_min_pct': 0.008721123801552468, 'bull_atr_max_pct': 0.13475324811154132, 'bull_tp_mult': 1.597173401583972, 'bull_tsl_mult': 0.38507634851883654, 'bull_time_stop': 63, 'bull_use_sma': True, 'bull_use_ema': True, 'bull_use_atr': False, 'bull_use_adx': False, 'bull_use_spike': False, 'bull_rsi_required': True, 'bear_strategy': 'mean_reversion', 'bear_bb_std_mult': 2.9718124242768673, 'bear_rsi_os': 14, 'bear_rsi_ob': 45, 'bear_adx_thresh': 24.08134873161364, 'bear_atr_min_pct': 0.0013551306605245061, 'bear_atr_max_pct': 0.08270345256967823, 'bear_tp_mult': 2.486196563161992, 'bear_tsl_mult': 0.1838640032863601, 'bear_time_stop': 269, 'bear_use_sma': False, 'bear_use_ema': False, 'bear_use_atr': False, 'bear_use_adx': True, 'bear_use_spike': True, 'bear_rsi_required': True, 'sideways_strategy': 'breakout', 'sideways_bb_std_mult': 2.775846364456296, 'sideways_rsi_os': 33, 'sideways_rsi_ob': 72, 'sideways_adx_thresh': 14.172271873496747, 'sideways_atr_min_pct': 0.02199606208167233, 'sideways_atr_max_pct': 0.14186918209499041, 'sideways_tp_mult': 2.2612251986224328, 'sideways_tsl_mult': 0.6721593136012104, 'sideways_time_stop': 237, 'sideways_use_sma': True, 'sideways_use_ema': False, 'sideways_use_atr': False, 'sideways_use_adx': True, 'sideways_use_spike': False, 'sideways_rsi_required': True}.
[I 2025-08-30 16:01:08,704] Trial 261 finished with values: [-1000000000.0, 1000000000.0] and parameters: {'p_sma': 17, 'p_std': 56, 'p_atr': 26, 'p_adx': 15, 'rsi_period': 10, 'ema1': 26, 'ema2': 57, 'slip_atr_k': 0.010451648357336866, 'slip_spread_k': 0.7499986356476291, 'spread_hl_frac': 0.00883751211200864, 'bb_std_mult': 3.0482798822382664, 'rsi_os': 21, 'rsi_ob': 53, 'vol_spike': 0.04931575540036534, 'adx_thresh': 27.761515036007484, 'atr_min_pct': 0.02307709572785176, 'atr_max_pct': 0.14766910367873026, 'tp_mult': 1.1537768541194413, 'tsl_mult': 0.6612023699635411, 'strategy': 'breakout', 'time_stop': 148, 'use_sma': True, 'use_atr': True, 'use_adx': False, 'use_ema': False, 'use_spike': True, 'rsi_required': False, 'edge_k': 1.9933223049073694, 'edge_cap': 0.6063501103815396, 'bull_strategy': 'breakout', 'bull_bb_std_mult': 1.7370003504979497, 'bull_rsi_os': 48, 'bull_rsi_ob': 63, 'bull_adx_thresh': 15.951395370443276, 'bull_atr_min_pct': 0.006652416973667178, 'bull_atr_max_pct': 0.07669061741883035, 'bull_tp_mult': 1.1520093737046269, 'bull_tsl_mult': 0.8708953733547424, 'bull_time_stop': 261, 'bull_use_sma': True, 'bull_use_ema': True, 'bull_use_atr': False, 'bull_use_adx': False, 'bull_use_spike': True, 'bull_rsi_required': True, 'bear_strategy': 'mean_reversion', 'bear_bb_std_mult': 2.110487064262732, 'bear_rsi_os': 16, 'bear_rsi_ob': 60, 'bear_adx_thresh': 16.69665040460736, 'bear_atr_min_pct': 0.029181874050557347, 'bear_atr_max_pct': 0.09644793557415447, 'bear_tp_mult': 1.4376750412044113, 'bear_tsl_mult': 0.6178172383665923, 'bear_time_stop': 265, 'bear_use_sma': False, 'bear_use_ema': False, 'bear_use_atr': False, 'bear_use_adx': True, 'bear_use_spike': True, 'bear_rsi_required': True, 'sideways_strategy': 'breakout', 'sideways_bb_std_mult': 2.967307081629947, 'sideways_rsi_os': 33, 'sideways_rsi_ob': 92, 'sideways_adx_thresh': 16.724429853372566, 'sideways_atr_min_pct': 0.011873214540969354, 'sideways_atr_max_pct': 0.14178879011705564, 'sideways_tp_mult': 2.51636613387711, 'sideways_tsl_mult': 0.3683135031128758, 'sideways_time_stop': 260, 'sideways_use_sma': True, 'sideways_use_ema': False, 'sideways_use_atr': True, 'sideways_use_adx': True, 'sideways_use_spike': True, 'sideways_rsi_required': True}.
