[I 2025-08-30 16:58:58,547] Trial 593 finished with values: [-1000000000.0, 1000000000.0] and parameters: {'p_sma': 7, 'p_std': 21, 'p_atr': 17, 'p_adx': 10, 'rsi_period': 24, 'ema1': 17, 'ema2': 12, 'slip_atr_k': 0.01929033429730931, 'slip_spread_k': 0.15091580355874668, 'spread_hl_frac': 0.021322538392914574, 'bb_std_mult': 3.3055501347941947, 'rsi_os': 30, 'rsi_ob': 86, 'vol_spike': 0.12840655555110775, 'adx_thresh': 8.92042663729714, 'atr_min_pct': 0.028974381287270957, 'atr_max_pct': 0.14620613573992564, 'tp_mult': 2.7273224889037935, 'tsl_mult': 0.7359038907639052, 'strategy': 'mean_reversion', 'time_stop': 37, 'use_sma': False, 'use_atr': True, 'use_adx': True, 'use_ema': False, 'use_spike': True, 'rsi_required': True, 'edge_k': 0.5526469215531421, 'edge_cap': 0.8497556766729787, 'bull_strategy': 'mean_reversion', 'bull_bb_std_mult': 2.038865404167976, 'bull_rsi_os': 7, 'bull_rsi_ob': 54, 'bull_adx_thresh': 33.84573360329828, 'bull_atr_min_pct': 0.02343974906469552, 'bull_atr_max_pct': 0.14762996023657787, 'bull_tp_mult': 2.2195792414498263, 'bull_tsl_mult': 0.8357503945955296, 'bull_time_stop': 66, 'bull_use_sma': True, 'bull_use_ema': False, 'bull_use_atr': False, 'bull_use_adx': True, 'bull_use_spike': True, 'bull_rsi_required': False, 'bear_strategy': 'mean_reversion', 'bear_bb_std_mult': 1.1662992787464614, 'bear_rsi_os': 17, 'bear_rsi_ob': 74, 'bear_adx_thresh': 12.171841369963342, 'bear_atr_min_pct': 0.0191808360774423, 'bear_atr_max_pct': 0.1073497537311228, 'bear_tp_mult': 2.16607299719636, 'bear_tsl_mult': 0.8490037650454698, 'bear_time_stop': 194, 'bear_use_sma': True, 'bear_use_ema': False, 'bear_use_atr': False, 'bear_use_adx': True, 'bear_use_spike': False, 'bear_rsi_required': False, 'sideways_strategy': 'breakout', 'sideways_bb_std_mult': 1.6107421499680972, 'sideways_rsi_os': 33, 'sideways_rsi_ob': 57, 'sideways_adx_thresh': 9.737220634428787, 'sideways_atr_min_pct': 0.016207253194130727, 'sideways_atr_max_pct': 0.10377428440176856, 'sideways_tp_mult': 2.9657750510850254, 'sideways_tsl_mult': 0.3767686381306974, 'sideways_time_stop': 277, 'sideways_use_sma': False, 'sideways_use_ema': False, 'sideways_use_atr': True, 'sideways_use_adx': False, 'sideways_use_spike': False, 'sideways_rsi_required': False}.
[I 2025-08-30 16:59:38,762] Trial 596 finished with values: [-1000000000.0, 1000000000.0] and parameters: {'p_sma': 5, 'p_std': 25, 'p_atr': 18, 'p_adx': 9, 'rsi_period': 23, 'ema1': 17, 'ema2': 42, 'slip_atr_k': 0.011832128519156482, 'slip_spread_k': 0.24902537290434354, 'spread_hl_frac': 0.04351236673573218, 'bb_std_mult': 3.178802145998469, 'rsi_os': 33, 'rsi_ob': 86, 'vol_spike': 0.10248579255008292, 'adx_thresh': 6.196675921785564, 'atr_min_pct': 0.019286042507960763, 'atr_max_pct': 0.14672783305772524, 'tp_mult': 2.783212580382385, 'tsl_mult': 0.8377623356520235, 'strategy': 'breakout', 'time_stop': 46, 'use_sma': False, 'use_atr': False, 'use_adx': False, 'use_ema': False, 'use_spike': False, 'rsi_required': False, 'edge_k': 0.39052885099226997, 'edge_cap': 0.8993600062963822, 'bull_strategy': 'mean_reversion', 'bull_bb_std_mult': 1.9147743076301673, 'bull_rsi_os': 17, 'bull_rsi_ob': 55, 'bull_adx_thresh': 34.37527349776621, 'bull_atr_min_pct': 0.02319217011665826, 'bull_atr_max_pct': 0.14549564466480921, 'bull_tp_mult': 2.2331179390628293, 'bull_tsl_mult': 0.8160388616973202, 'bull_time_stop': 73, 'bull_use_sma': True, 'bull_use_ema': True, 'bull_use_atr': False, 'bull_use_adx': False, 'bull_use_spike': False, 'bull_rsi_required': True, 'bear_strategy': 'mean_reversion', 'bear_bb_std_mult': 1.444582979376233, 'bear_rsi_os': 15, 'bear_rsi_ob': 75, 'bear_adx_thresh': 12.104045893474167, 'bear_atr_min_pct': 0.024165096796494034, 'bear_atr_max_pct': 0.10311334251319394, 'bear_tp_mult': 2.0289244730602145, 'bear_tsl_mult': 0.4417921558410023, 'bear_time_stop': 197, 'bear_use_sma': True, 'bear_use_ema': False, 'bear_use_atr': False, 'bear_use_adx': False, 'bear_use_spike': True, 'bear_rsi_required': True, 'sideways_strategy': 'mean_reversion', 'sideways_bb_std_mult': 1.6330662384282753, 'sideways_rsi_os': 31, 'sideways_rsi_ob': 53, 'sideways_adx_thresh': 9.942886420017686, 'sideways_atr_min_pct': 0.00549213102877487, 'sideways_atr_max_pct': 0.09627784289729992, 'sideways_tp_mult': 2.8545865783694193, 'sideways_tsl_mult': 0.374840891715602, 'sideways_time_stop': 279, 'sideways_use_sma': True, 'sideways_use_ema': False, 'sideways_use_atr': False, 'sideways_use_adx': False, 'sideways_use_spike': True, 'sideways_rsi_required': True}.
[I 2025-08-30 16:59:39,956] Trial 597 finished with values: [-1000000000.0, 1000000000.0] and parameters: {'p_sma': 5, 'p_std': 23, 'p_atr': 16, 'p_adx': 9, 'rsi_period': 24, 'ema1': 18, 'ema2': 49, 'slip_atr_k': 0.20977930540807538, 'slip_spread_k': 0.24707561619277738, 'spread_hl_frac': 0.0216405079727468, 'bb_std_mult': 0.7187282278849736, 'rsi_os': 33, 'rsi_ob': 86, 'vol_spike': 0.12550717484691068, 'adx_thresh': 6.136852444045953, 'atr_min_pct': 0.019374134362999756, 'atr_max_pct': 0.14991907600267657, 'tp_mult': 2.701092712241169, 'tsl_mult': 0.7918971974275243, 'strategy': 'breakout', 'time_stop': 48, 'use_sma': False, 'use_atr': False, 'use_adx': False, 'use_ema': False, 'use_spike': False, 'rsi_required': False, 'edge_k': 0.6012661449148757, 'edge_cap': 0.743672956591143, 'bull_strategy': 'mean_reversion', 'bull_bb_std_mult': 1.9115068685798458, 'bull_rsi_os': 17, 'bull_rsi_ob': 54, 'bull_adx_thresh': 34.480594579227954, 'bull_atr_min_pct': 0.024280860987933642, 'bull_atr_max_pct': 0.1465249722136373, 'bull_tp_mult': 2.3984351186285986, 'bull_tsl_mult': 0.8219739577554412, 'bull_time_stop': 249, 'bull_use_sma': True, 'bull_use_ema': True, 'bull_use_atr': False, 'bull_use_adx': False, 'bull_use_spike': False, 'bull_rsi_required': True, 'bear_strategy': 'mean_reversion', 'bear_bb_std_mult': 0.6963436418708193, 'bear_rsi_os': 15, 'bear_rsi_ob': 74, 'bear_adx_thresh': 12.357167962247443, 'bear_atr_min_pct': 0.018360064538695053, 'bear_atr_max_pct': 0.1023757970098253, 'bear_tp_mult': 2.1197242836957555, 'bear_tsl_mult': 0.5631955418774566, 'bear_time_stop': 194, 'bear_use_sma': True, 'bear_use_ema': False, 'bear_use_atr': False, 'bear_use_adx': False, 'bear_use_spike': True, 'bear_rsi_required': True, 'sideways_strategy': 'mean_reversion', 'sideways_bb_std_mult': 0.5003735191623784, 'sideways_rsi_os': 32, 'sideways_rsi_ob': 50, 'sideways_adx_thresh': 9.862144570793754, 'sideways_atr_min_pct': 0.020455910538522533, 'sideways_atr_max_pct': 0.09775177943758308, 'sideways_tp_mult': 2.865224193648272, 'sideways_tsl_mult': 0.3817861413336252, 'sideways_time_stop': 279, 'sideways_use_sma': True, 'sideways_use_ema': False, 'sideways_use_atr': False, 'sideways_use_adx': False, 'sideways_use_spike': True, 'sideways_rsi_required': True}.
[I 2025-08-30 16:59:39,960] Trial 598 finished with values: [-0.025278573679255012, 0.025161476244775008] and parameters: {'p_sma': 6, 'p_std': 23, 'p_atr': 16, 'p_adx': 9, 'rsi_period': 27, 'ema1': 18, 'ema2': 11, 'slip_atr_k': 0.21137764958768318, 'slip_spread_k': 0.29136043498615144, 'spread_hl_frac': 0.018860386646931775, 'bb_std_mult': 0.6899086931349783, 'rsi_os': 33, 'rsi_ob': 86, 'vol_spike': 0.10560046477708294, 'adx_thresh': 6.088201722665236, 'atr_min_pct': 0.019408916715895917, 'atr_max_pct': 0.1475507013316723, 'tp_mult': 1.6725642006074424, 'tsl_mult': 0.788496428644329, 'strategy': 'breakout', 'time_stop': 45, 'use_sma': False, 'use_atr': False, 'use_adx': False, 'use_ema': False, 'use_spike': False, 'rsi_required': False, 'edge_k': 0.49788841975872955, 'edge_cap': 0.8955853992074616, 'bull_strategy': 'breakout', 'bull_bb_std_mult': 2.211222600168876, 'bull_rsi_os': 17, 'bull_rsi_ob': 45, 'bull_adx_thresh': 34.55235528459007, 'bull_atr_min_pct': 0.024163892853030125, 'bull_atr_max_pct': 0.14395360991754413, 'bull_tp_mult': 2.3044773294313132, 'bull_tsl_mult': 0.756180735925156, 'bull_time_stop': 76, 'bull_use_sma': True, 'bull_use_ema': True, 'bull_use_atr': False, 'bull_use_adx': False, 'bull_use_spike': False, 'bull_rsi_required': True, 'bear_strategy': 'mean_reversion', 'bear_bb_std_mult': 0.747969147699925, 'bear_rsi_os': 15, 'bear_rsi_ob': 76, 'bear_adx_thresh': 11.092855525287984, 'bear_atr_min_pct': 0.02522222876740971, 'bear_atr_max_pct': 0.1033247971567858, 'bear_tp_mult': 2.0955122743936214, 'bear_tsl_mult': 0.8214001408757888, 'bear_time_stop': 202, 'bear_use_sma': False, 'bear_use_ema': True, 'bear_use_atr': False, 'bear_use_adx': False, 'bear_use_spike': True, 'bear_rsi_required': True, 'sideways_strategy': 'mean_reversion', 'sideways_bb_std_mult': 0.9691802376496158, 'sideways_rsi_os': 31, 'sideways_rsi_ob': 55, 'sideways_adx_thresh': 10.441494661012506, 'sideways_atr_min_pct': 0.0018979484208717006, 'sideways_atr_max_pct': 0.09701810125107858, 'sideways_tp_mult': 2.8513931833157886, 'sideways_tsl_mult': 0.37715478220285215, 'sideways_time_stop': 292, 'sideways_use_sma': True, 'sideways_use_ema': False, 'sideways_use_atr': False, 'sideways_use_adx': True, 'sideways_use_spike': True, 'sideways_rsi_required': True}.
[I 2025-08-30 16:59:40,759] Trial 595 finished with values: [-1000000000.0, 1000000000.0] and parameters: {'p_sma': 6, 'p_std': 23, 'p_atr': 18, 'p_adx': 9, 'rsi_period': 23, 'ema1': 17, 'ema2': 12, 'slip_atr_k': 0.013391460953342801, 'slip_spread_k': 0.15828941800697874, 'spread_hl_frac': 0.03624790683014209, 'bb_std_mult': 3.196903554710677, 'rsi_os': 33, 'rsi_ob': 86, 'vol_spike': 0.10359060242057756, 'adx_thresh': 9.768657541062009, 'atr_min_pct': 0.026549847767229837, 'atr_max_pct': 0.14992475879594996, 'tp_mult': 2.782057608079824, 'tsl_mult': 0.794881808725388, 'strategy': 'breakout', 'time_stop': 40, 'use_sma': False, 'use_atr': False, 'use_adx': False, 'use_ema': False, 'use_spike': False, 'rsi_required': False, 'edge_k': 0.4993179170712226, 'edge_cap': 0.9779820637674066, 'bull_strategy': 'mean_reversion', 'bull_bb_std_mult': 3.4621356632732665, 'bull_rsi_os': 15, 'bull_rsi_ob': 55, 'bull_adx_thresh': 34.41268662558205, 'bull_atr_min_pct': 0.02383595377383666, 'bull_atr_max_pct': 0.14756663113251772, 'bull_tp_mult': 2.397190797723992, 'bull_tsl_mult': 0.8382780340843777, 'bull_time_stop': 73, 'bull_use_sma': True, 'bull_use_ema': True, 'bull_use_atr': False, 'bull_use_adx': False, 'bull_use_spike': False, 'bull_rsi_required': True, 'bear_strategy': 'mean_reversion', 'bear_bb_std_mult': 0.7871979576616821, 'bear_rsi_os': 15, 'bear_rsi_ob': 74, 'bear_adx_thresh': 12.383933693985234, 'bear_atr_min_pct': 0.018568134215408823, 'bear_atr_max_pct': 0.10303138851814497, 'bear_tp_mult': 2.1912777486698456, 'bear_tsl_mult': 0.44500201572426284, 'bear_time_stop': 194, 'bear_use_sma': True, 'bear_use_ema': False, 'bear_use_atr': False, 'bear_use_adx': False, 'bear_use_spike': True, 'bear_rsi_required': True, 'sideways_strategy': 'mean_reversion', 'sideways_bb_std_mult': 1.6170835850245666, 'sideways_rsi_os': 32, 'sideways_rsi_ob': 55, 'sideways_adx_thresh': 9.749830865265892, 'sideways_atr_min_pct': 0.020468151565589027, 'sideways_atr_max_pct': 0.09977783376633462, 'sideways_tp_mult': 2.8637882512869397, 'sideways_tsl_mult': 0.41695525361749247, 'sideways_time_stop': 277, 'sideways_use_sma': True, 'sideways_use_ema': False, 'sideways_use_atr': False, 'sideways_use_adx': False, 'sideways_use_spike': True, 'sideways_rsi_required': True}.
[I 2025-08-30 17:00:19,339] Trial 601 finished with values: [-1000000000.0, 1000000000.0] and parameters: {'p_sma': 9, 'p_std': 22, 'p_atr': 13, 'p_adx': 7, 'rsi_period': 23, 'ema1': 19, 'ema2': 13, 'slip_atr_k': 0.011300911843845247, 'slip_spread_k': 0.2242869873681366, 'spread_hl_frac': 0.03579301439245809, 'bb_std_mult': 3.250359740982518, 'rsi_os': 31, 'rsi_ob': 84, 'vol_spike': 0.1412417086352249, 'adx_thresh': 9.792536425080574, 'atr_min_pct': 0.020703017029463627, 'atr_max_pct': 0.1499822896884585, 'tp_mult': 2.7889599861906396, 'tsl_mult': 0.8258088266065693, 'strategy': 'mean_reversion', 'time_stop': 30, 'use_sma': True, 'use_atr': True, 'use_adx': True, 'use_ema': True, 'use_spike': False, 'rsi_required': True, 'edge_k': 0.3065654755098084, 'edge_cap': 0.9751083100905287, 'bull_strategy': 'mean_reversion', 'bull_bb_std_mult': 3.4737320026072767, 'bull_rsi_os': 15, 'bull_rsi_ob': 56, 'bull_adx_thresh': 34.58450150695356, 'bull_atr_min_pct': 0.021940357056618526, 'bull_atr_max_pct': 0.14162648900352579, 'bull_tp_mult': 2.145660339697929, 'bull_tsl_mult': 0.8006968007965033, 'bull_time_stop': 103, 'bull_use_sma': True, 'bull_use_ema': True, 'bull_use_atr': False, 'bull_use_adx': True, 'bull_use_spike': False, 'bull_rsi_required': False, 'bear_strategy': 'breakout', 'bear_bb_std_mult': 0.8241566443277311, 'bear_rsi_os': 16, 'bear_rsi_ob': 92, 'bear_adx_thresh': 11.414105696474335, 'bear_atr_min_pct': 0.01973357912063929, 'bear_atr_max_pct': 0.10661776490411254, 'bear_tp_mult': 2.188573231075815, 'bear_tsl_mult': 0.6057704681180879, 'bear_time_stop': 209, 'bear_use_sma': True, 'bear_use_ema': False, 'bear_use_atr': True, 'bear_use_adx': False, 'bear_use_spike': False, 'bear_rsi_required': False, 'sideways_strategy': 'breakout', 'sideways_bb_std_mult': 1.104655338300586, 'sideways_rsi_os': 31, 'sideways_rsi_ob': 88, 'sideways_adx_thresh': 12.400920485578244, 'sideways_atr_min_pct': 0.006928227007123635, 'sideways_atr_max_pct': 0.10021002732231109, 'sideways_tp_mult': 2.890569029886796, 'sideways_tsl_mult': 0.4411812911140777, 'sideways_time_stop': 283, 'sideways_use_sma': True, 'sideways_use_ema': True, 'sideways_use_atr': False, 'sideways_use_adx': False, 'sideways_use_spike': False, 'sideways_rsi_required': True}.
[I 2025-08-30 17:00:20,399] Trial 600 finished with values: [-1000000000.0, 1000000000.0] and parameters: {'p_sma': 9, 'p_std': 17, 'p_atr': 13, 'p_adx': 7, 'rsi_period': 23, 'ema1': 19, 'ema2': 13, 'slip_atr_k': 0.06789106832807953, 'slip_spread_k': 0.2253679510465072, 'spread_hl_frac': 0.007864482889239754, 'bb_std_mult': 3.2434667213987938, 'rsi_os': 31, 'rsi_ob': 84, 'vol_spike': 0.1545883034916538, 'adx_thresh': 10.65011877425782, 'atr_min_pct': 0.020586857070710365, 'atr_max_pct': 0.14995462500465712, 'tp_mult': 2.7778653916846943, 'tsl_mult': 0.8186132077786326, 'strategy': 'mean_reversion', 'time_stop': 30, 'use_sma': True, 'use_atr': True, 'use_adx': True, 'use_ema': True, 'use_spike': False, 'rsi_required': True, 'edge_k': 0.3001852194656755, 'edge_cap': 0.9800673692417475, 'bull_strategy': 'mean_reversion', 'bull_bb_std_mult': 1.3939672351487786, 'bull_rsi_os': 15, 'bull_rsi_ob': 56, 'bull_adx_thresh': 34.96478629332885, 'bull_atr_min_pct': 0.022086978504041635, 'bull_atr_max_pct': 0.1409029373745625, 'bull_tp_mult': 2.1272821592492597, 'bull_tsl_mult': 0.7916035615572202, 'bull_time_stop': 82, 'bull_use_sma': True, 'bull_use_ema': True, 'bull_use_atr': False, 'bull_use_adx': True, 'bull_use_spike': False, 'bull_rsi_required': False, 'bear_strategy': 'breakout', 'bear_bb_std_mult': 1.362360037782926, 'bear_rsi_os': 16, 'bear_rsi_ob': 95, 'bear_adx_thresh': 12.224576785921947, 'bear_atr_min_pct': 0.01857085524404133, 'bear_atr_max_pct': 0.10504997335005556, 'bear_tp_mult': 1.9576458691413696, 'bear_tsl_mult': 0.5995759670044879, 'bear_time_stop': 209, 'bear_use_sma': True, 'bear_use_ema': False, 'bear_use_atr': True, 'bear_use_adx': False, 'bear_use_spike': False, 'bear_rsi_required': False, 'sideways_strategy': 'breakout', 'sideways_bb_std_mult': 1.087300160800996, 'sideways_rsi_os': 31, 'sideways_rsi_ob': 94, 'sideways_adx_thresh': 10.974636904400864, 'sideways_atr_min_pct': 0.006699981859578893, 'sideways_atr_max_pct': 0.10012548249473636, 'sideways_tp_mult': 2.9145820465214207, 'sideways_tsl_mult': 0.41411487661845514, 'sideways_time_stop': 273, 'sideways_use_sma': True, 'sideways_use_ema': True, 'sideways_use_atr': False, 'sideways_use_adx': False, 'sideways_use_spike': False, 'sideways_rsi_required': True}.
[I 2025-08-30 17:00:21,728] Trial 602 finished with values: [-0.01268745673284577, 0.01257418993692044] and parameters: {'p_sma': 9, 'p_std': 20, 'p_atr': 15, 'p_adx': 7, 'rsi_period': 27, 'ema1': 19, 'ema2': 13, 'slip_atr_k': 0.042234897326069026, 'slip_spread_k': 0.22295277004367997, 'spread_hl_frac': 0.020116094441709222, 'bb_std_mult': 1.1183295720966306, 'rsi_os': 31, 'rsi_ob': 84, 'vol_spike': 0.09689153545875162, 'adx_thresh': 9.587066937239797, 'atr_min_pct': 0.0207213389370707, 'atr_max_pct': 0.14494400026178084, 'tp_mult': 2.821131565203357, 'tsl_mult': 0.831575717892772, 'strategy': 'mean_reversion', 'time_stop': 29, 'use_sma': True, 'use_atr': True, 'use_adx': True, 'use_ema': True, 'use_spike': False, 'rsi_required': True, 'edge_k': 0.30928594608322946, 'edge_cap': 0.8098648923777741, 'bull_strategy': 'breakout', 'bull_bb_std_mult': 1.8812420366337304, 'bull_rsi_os': 15, 'bull_rsi_ob': 57, 'bull_adx_thresh': 34.82397853137833, 'bull_atr_min_pct': 0.021981885854210428, 'bull_atr_max_pct': 0.1420741455841706, 'bull_tp_mult': 2.140636519502986, 'bull_tsl_mult': 0.7914755834929129, 'bull_time_stop': 300, 'bull_use_sma': True, 'bull_use_ema': True, 'bull_use_atr': False, 'bull_use_adx': True, 'bull_use_spike': False, 'bull_rsi_required': False, 'bear_strategy': 'mean_reversion', 'bear_bb_std_mult': 0.5679528652492631, 'bear_rsi_os': 17, 'bear_rsi_ob': 60, 'bear_adx_thresh': 11.5719033914424, 'bear_atr_min_pct': 0.01661860505572731, 'bear_atr_max_pct': 0.10507019994471711, 'bear_tp_mult': 2.053601336291207, 'bear_tsl_mult': 0.02883081500300322, 'bear_time_stop': 207, 'bear_use_sma': False, 'bear_use_ema': True, 'bear_use_atr': True, 'bear_use_adx': False, 'bear_use_spike': False, 'bear_rsi_required': False, 'sideways_strategy': 'breakout', 'sideways_bb_std_mult': 1.171555635443945, 'sideways_rsi_os': 31, 'sideways_rsi_ob': 94, 'sideways_adx_thresh': 11.646645343504916, 'sideways_atr_min_pct': 0.0015643537777271792, 'sideways_atr_max_pct': 0.10695677866189368, 'sideways_tp_mult': 2.9979671126398735, 'sideways_tsl_mult': 0.4461009176959476, 'sideways_time_stop': 295, 'sideways_use_sma': True, 'sideways_use_ema': True, 'sideways_use_atr': False, 'sideways_use_adx': True, 'sideways_use_spike': False, 'sideways_rsi_required': True}.
[I 2025-08-30 17:00:21,754] Trial 599 finished with values: [-1000000000.0, 1000000000.0] and parameters: {'p_sma': 25, 'p_std': 24, 'p_atr': 16, 'p_adx': 9, 'rsi_period': 27, 'ema1': 18, 'ema2': 11, 'slip_atr_k': 0.19546352288662955, 'slip_spread_k': 0.2326876676200974, 'spread_hl_frac': 0.008043412613272807, 'bb_std_mult': 3.278147895184281, 'rsi_os': 33, 'rsi_ob': 84, 'vol_spike': 0.13963366007489317, 'adx_thresh': 9.737745320957046, 'atr_min_pct': 0.010577237772598645, 'atr_max_pct': 0.14976142370716256, 'tp_mult': 2.778576169386991, 'tsl_mult': 0.7640079083905813, 'strategy': 'breakout', 'time_stop': 30, 'use_sma': False, 'use_atr': True, 'use_adx': True, 'use_ema': True, 'use_spike': False, 'rsi_required': False, 'edge_k': 0.5977666448518866, 'edge_cap': 0.9778568519405811, 'bull_strategy': 'breakout', 'bull_bb_std_mult': 3.0243269580433014, 'bull_rsi_os': 5, 'bull_rsi_ob': 45, 'bull_adx_thresh': 34.5204493184542, 'bull_atr_min_pct': 0.022014434515595944, 'bull_atr_max_pct': 0.14641152581918576, 'bull_tp_mult': 2.1326042136709007, 'bull_tsl_mult': 0.7595264340691428, 'bull_time_stop': 234, 'bull_use_sma': True, 'bull_use_ema': True, 'bull_use_atr': False, 'bull_use_adx': True, 'bull_use_spike': False, 'bull_rsi_required': True, 'bear_strategy': 'breakout', 'bear_bb_std_mult': 1.5857730111569595, 'bear_rsi_os': 15, 'bear_rsi_ob': 76, 'bear_adx_thresh': 12.36683007168159, 'bear_atr_min_pct': 0.019526674227364683, 'bear_atr_max_pct': 0.10360155849136493, 'bear_tp_mult': 2.5462219075069004, 'bear_tsl_mult': 0.5746707014825571, 'bear_time_stop': 209, 'bear_use_sma': False, 'bear_use_ema': True, 'bear_use_atr': True, 'bear_use_adx': False, 'bear_use_spike': True, 'bear_rsi_required': False, 'sideways_strategy': 'mean_reversion', 'sideways_bb_std_mult': 0.9857535763541356, 'sideways_rsi_os': 32, 'sideways_rsi_ob': 50, 'sideways_adx_thresh': 10.64303217129068, 'sideways_atr_min_pct': 0.008215049777729563, 'sideways_atr_max_pct': 0.09955339074414217, 'sideways_tp_mult': 2.8622051040870358, 'sideways_tsl_mult': 0.43723122971482337, 'sideways_time_stop': 292, 'sideways_use_sma': True, 'sideways_use_ema': True, 'sideways_use_atr': False, 'sideways_use_adx': True, 'sideways_use_spike': True, 'sideways_rsi_required': True}.
