[I 2025-08-30 17:24:02,245] Trial 747 finished with values: [-1000000000.0, 1000000000.0] and parameters: {'p_sma': 5, 'p_std': 20, 'p_atr': 16, 'p_adx': 17, 'rsi_period': 20, 'ema1': 19, 'ema2': 14, 'slip_atr_k': 0.014269269207998016, 'slip_spread_k': 0.16279881464276214, 'spread_hl_frac': 0.013755420155751735, 'bb_std_mult': 3.2562191071019884, 'rsi_os': 43, 'rsi_ob': 87, 'vol_spike': 0.08439110732302237, 'adx_thresh': 20.5498574657856, 'atr_min_pct': 0.01906116362688824, 'atr_max_pct': 0.07344555229138326, 'tp_mult': 2.729291431932567, 'tsl_mult': 0.9455928752355407, 'strategy': 'breakout', 'time_stop': 45, 'use_sma': False, 'use_atr': True, 'use_adx': True, 'use_ema': False, 'use_spike': False, 'rsi_required': False, 'edge_k': 0.6582478257301086, 'edge_cap': 0.8691851760176892, 'bull_strategy': 'mean_reversion', 'bull_bb_std_mult': 2.891289120464736, 'bull_rsi_os': 12, 'bull_rsi_ob': 85, 'bull_adx_thresh': 33.7151029194317, 'bull_atr_min_pct': 0.023437562331502085, 'bull_atr_max_pct': 0.09668474826857483, 'bull_tp_mult': 2.3642963274522693, 'bull_tsl_mult': 0.6212009712823217, 'bull_time_stop': 72, 'bull_use_sma': True, 'bull_use_ema': True, 'bull_use_atr': False, 'bull_use_adx': True, 'bull_use_spike': True, 'bull_rsi_required': False, 'bear_strategy': 'mean_reversion', 'bear_bb_std_mult': 1.514717663633102, 'bear_rsi_os': 49, 'bear_rsi_ob': 87, 'bear_adx_thresh': 21.143777365298078, 'bear_atr_min_pct': 0.02302714813664846, 'bear_atr_max_pct': 0.10007817617057654, 'bear_tp_mult': 2.1306204438737892, 'bear_tsl_mult': 0.7984891783966113, 'bear_time_stop': 77, 'bear_use_sma': False, 'bear_use_ema': False, 'bear_use_atr': False, 'bear_use_adx': False, 'bear_use_spike': True, 'bear_rsi_required': True, 'sideways_strategy': 'breakout', 'sideways_bb_std_mult': 0.6907173964979474, 'sideways_rsi_os': 35, 'sideways_rsi_ob': 51, 'sideways_adx_thresh': 29.884968537072048, 'sideways_atr_min_pct': 0.018426525193407994, 'sideways_atr_max_pct': 0.09985937846290222, 'sideways_tp_mult': 2.9258441597915987, 'sideways_tsl_mult': 0.46084936667729787, 'sideways_time_stop': 275, 'sideways_use_sma': True, 'sideways_use_ema': False, 'sideways_use_atr': False, 'sideways_use_adx': True, 'sideways_use_spike': False, 'sideways_rsi_required': True}.
[I 2025-08-30 17:24:02,593] Trial 746 finished with values: [-1000000000.0, 1000000000.0] and parameters: {'p_sma': 10, 'p_std': 20, 'p_atr': 16, 'p_adx': 9, 'rsi_period': 21, 'ema1': 21, 'ema2': 14, 'slip_atr_k': 0.1582730750478272, 'slip_spread_k': 0.7346041310729043, 'spread_hl_frac': 0.013620183468206275, 'bb_std_mult': 3.2811400298035593, 'rsi_os': 20, 'rsi_ob': 87, 'vol_spike': 0.10532524657978609, 'adx_thresh': 9.120866622371564, 'atr_min_pct': 0.019157926375101407, 'atr_max_pct': 0.02934958986764051, 'tp_mult': 2.7128789926439962, 'tsl_mult': 0.9372581213461503, 'strategy': 'mean_reversion', 'time_stop': 46, 'use_sma': False, 'use_atr': True, 'use_adx': True, 'use_ema': True, 'use_spike': False, 'rsi_required': True, 'edge_k': 0.41873600285117335, 'edge_cap': 0.987084058699964, 'bull_strategy': 'mean_reversion', 'bull_bb_std_mult': 3.314088337657177, 'bull_rsi_os': 40, 'bull_rsi_ob': 55, 'bull_adx_thresh': 34.99567690554372, 'bull_atr_min_pct': 0.021241833939727325, 'bull_atr_max_pct': 0.1448175223342599, 'bull_tp_mult': 2.750465172508226, 'bull_tsl_mult': 0.8233741501947945, 'bull_time_stop': 200, 'bull_use_sma': True, 'bull_use_ema': False, 'bull_use_atr': False, 'bull_use_adx': True, 'bull_use_spike': True, 'bull_rsi_required': False, 'bear_strategy': 'breakout', 'bear_bb_std_mult': 1.4963796510879788, 'bear_rsi_os': 19, 'bear_rsi_ob': 76, 'bear_adx_thresh': 10.416978967776533, 'bear_atr_min_pct': 0.021104585210970264, 'bear_atr_max_pct': 0.10756494662740113, 'bear_tp_mult': 1.9370717600515004, 'bear_tsl_mult': 0.2356842224210866, 'bear_time_stop': 198, 'bear_use_sma': False, 'bear_use_ema': False, 'bear_use_atr': False, 'bear_use_adx': False, 'bear_use_spike': False, 'bear_rsi_required': False, 'sideways_strategy': 'breakout', 'sideways_bb_std_mult': 0.7224170475624753, 'sideways_rsi_os': 31, 'sideways_rsi_ob': 90, 'sideways_adx_thresh': 23.563980147184775, 'sideways_atr_min_pct': 0.016097376773696073, 'sideways_atr_max_pct': 0.10007830968694377, 'sideways_tp_mult': 2.515348871010773, 'sideways_tsl_mult': 0.7110554600230279, 'sideways_time_stop': 140, 'sideways_use_sma': True, 'sideways_use_ema': False, 'sideways_use_atr': False, 'sideways_use_adx': True, 'sideways_use_spike': True, 'sideways_rsi_required': True}.
[I 2025-08-30 17:24:35,032] Trial 749 finished with values: [-1000000000.0, 1000000000.0] and parameters: {'p_sma': 15, 'p_std': 20, 'p_atr': 16, 'p_adx': 17, 'rsi_period': 22, 'ema1': 20, 'ema2': 12, 'slip_atr_k': 0.1593013557062573, 'slip_spread_k': 0.19409919457227146, 'spread_hl_frac': 0.025573453406267318, 'bb_std_mult': 3.2692710143042127, 'rsi_os': 33, 'rsi_ob': 87, 'vol_spike': 0.10377337166730405, 'adx_thresh': 10.749983543076286, 'atr_min_pct': 0.01833741415993895, 'atr_max_pct': 0.1476613127787222, 'tp_mult': 2.753432255310844, 'tsl_mult': 0.891641555670612, 'strategy': 'breakout', 'time_stop': 51, 'use_sma': False, 'use_atr': True, 'use_adx': True, 'use_ema': False, 'use_spike': False, 'rsi_required': False, 'edge_k': 0.5070857545190292, 'edge_cap': 0.7190113027802891, 'bull_strategy': 'mean_reversion', 'bull_bb_std_mult': 1.7971520135212156, 'bull_rsi_os': 31, 'bull_rsi_ob': 67, 'bull_adx_thresh': 33.880330715808526, 'bull_atr_min_pct': 0.023549410912047913, 'bull_atr_max_pct': 0.02802548039013377, 'bull_tp_mult': 2.3113811520573817, 'bull_tsl_mult': 0.6187424106822805, 'bull_time_stop': 57, 'bull_use_sma': True, 'bull_use_ema': True, 'bull_use_atr': False, 'bull_use_adx': True, 'bull_use_spike': True, 'bull_rsi_required': False, 'bear_strategy': 'mean_reversion', 'bear_bb_std_mult': 3.3351580147592434, 'bear_rsi_os': 43, 'bear_rsi_ob': 62, 'bear_adx_thresh': 20.95854676141156, 'bear_atr_min_pct': 0.02013343421274737, 'bear_atr_max_pct': 0.10945342732297655, 'bear_tp_mult': 1.9441856315308792, 'bear_tsl_mult': 0.4343675797050952, 'bear_time_stop': 216, 'bear_use_sma': False, 'bear_use_ema': False, 'bear_use_atr': False, 'bear_use_adx': False, 'bear_use_spike': True, 'bear_rsi_required': True, 'sideways_strategy': 'breakout', 'sideways_bb_std_mult': 2.885452333895438, 'sideways_rsi_os': 35, 'sideways_rsi_ob': 51, 'sideways_adx_thresh': 20.261084164094306, 'sideways_atr_min_pct': 0.028243838052060693, 'sideways_atr_max_pct': 0.09627800959680875, 'sideways_tp_mult': 2.921878160244872, 'sideways_tsl_mult': 0.3887482163044077, 'sideways_time_stop': 296, 'sideways_use_sma': True, 'sideways_use_ema': False, 'sideways_use_atr': False, 'sideways_use_adx': True, 'sideways_use_spike': False, 'sideways_rsi_required': True}.
[I 2025-08-30 17:24:48,489] Trial 752 finished with values: [-1000000000.0, 1000000000.0] and parameters: {'p_sma': 7, 'p_std': 29, 'p_atr': 15, 'p_adx': 19, 'rsi_period': 65, 'ema1': 9, 'ema2': 12, 'slip_atr_k': 0.0783293646940714, 'slip_spread_k': 0.19796784865902076, 'spread_hl_frac': 0.02013139634848462, 'bb_std_mult': 3.201140644352303, 'rsi_os': 33, 'rsi_ob': 85, 'vol_spike': 0.06541803398805045, 'adx_thresh': 7.481307736785178, 'atr_min_pct': 0.018157980656301774, 'atr_max_pct': 0.14770593600031107, 'tp_mult': 2.8726310543533935, 'tsl_mult': 0.9720129967398321, 'strategy': 'mean_reversion', 'time_stop': 29, 'use_sma': False, 'use_atr': True, 'use_adx': True, 'use_ema': False, 'use_spike': False, 'rsi_required': True, 'edge_k': 0.5055239732002569, 'edge_cap': 0.43666468385009627, 'bull_strategy': 'mean_reversion', 'bull_bb_std_mult': 2.2732449899813543, 'bull_rsi_os': 13, 'bull_rsi_ob': 91, 'bull_adx_thresh': 34.049063847507306, 'bull_atr_min_pct': 0.02790740280096694, 'bull_atr_max_pct': 0.010269216972308426, 'bull_tp_mult': 2.1686303861701903, 'bull_tsl_mult': 0.7901639456186553, 'bull_time_stop': 61, 'bull_use_sma': True, 'bull_use_ema': True, 'bull_use_atr': False, 'bull_use_adx': True, 'bull_use_spike': False, 'bull_rsi_required': False, 'bear_strategy': 'mean_reversion', 'bear_bb_std_mult': 1.3898323221973936, 'bear_rsi_os': 17, 'bear_rsi_ob': 62, 'bear_adx_thresh': 24.177984715239745, 'bear_atr_min_pct': 0.015295045343464396, 'bear_atr_max_pct': 0.10933972373451656, 'bear_tp_mult': 2.219539887680668, 'bear_tsl_mult': 0.7083270970793167, 'bear_time_stop': 215, 'bear_use_sma': True, 'bear_use_ema': False, 'bear_use_atr': False, 'bear_use_adx': False, 'bear_use_spike': False, 'bear_rsi_required': False, 'sideways_strategy': 'mean_reversion', 'sideways_bb_std_mult': 0.8588337415879808, 'sideways_rsi_os': 19, 'sideways_rsi_ob': 92, 'sideways_adx_thresh': 11.289270689871131, 'sideways_atr_min_pct': 0.0015000718618252383, 'sideways_atr_max_pct': 0.09771066622211497, 'sideways_tp_mult': 2.9118025834580816, 'sideways_tsl_mult': 0.423945493937562, 'sideways_time_stop': 294, 'sideways_use_sma': False, 'sideways_use_ema': False, 'sideways_use_atr': False, 'sideways_use_adx': False, 'sideways_use_spike': False, 'sideways_rsi_required': True}.
[I 2025-08-30 17:24:49,065] Trial 750 finished with values: [-0.026745208139905996, 0.026655579893824482] and parameters: {'p_sma': 7, 'p_std': 20, 'p_atr': 14, 'p_adx': 14, 'rsi_period': 35, 'ema1': 9, 'ema2': 12, 'slip_atr_k': 0.01037670583251371, 'slip_spread_k': 0.19177496354711673, 'spread_hl_frac': 0.025051814540612505, 'bb_std_mult': 3.53925455566944, 'rsi_os': 43, 'rsi_ob': 85, 'vol_spike': 0.08224195039686459, 'adx_thresh': 7.488495804952775, 'atr_min_pct': 0.01817073303195154, 'atr_max_pct': 0.0529505897188239, 'tp_mult': 2.8858893148967235, 'tsl_mult': 0.9724001674512233, 'strategy': 'breakout', 'time_stop': 23, 'use_sma': False, 'use_atr': True, 'use_adx': True, 'use_ema': False, 'use_spike': False, 'rsi_required': False, 'edge_k': 0.11747345556948519, 'edge_cap': 0.9306262649296082, 'bull_strategy': 'mean_reversion', 'bull_bb_std_mult': 1.9139300286491558, 'bull_rsi_os': 11, 'bull_rsi_ob': 62, 'bull_adx_thresh': 33.98295419211314, 'bull_atr_min_pct': 0.023739007226409113, 'bull_atr_max_pct': 0.14503566826173855, 'bull_tp_mult': 2.363085630032679, 'bull_tsl_mult': 0.8215547835395757, 'bull_time_stop': 59, 'bull_use_sma': True, 'bull_use_ema': True, 'bull_use_atr': False, 'bull_use_adx': True, 'bull_use_spike': True, 'bull_rsi_required': False, 'bear_strategy': 'mean_reversion', 'bear_bb_std_mult': 1.4936950035334746, 'bear_rsi_os': 52, 'bear_rsi_ob': 77, 'bear_adx_thresh': 13.188583300177967, 'bear_atr_min_pct': 0.02012564379637664, 'bear_atr_max_pct': 0.07220842757119339, 'bear_tp_mult': 2.2208129814382818, 'bear_tsl_mult': 0.7181290554049717, 'bear_time_stop': 215, 'bear_use_sma': False, 'bear_use_ema': False, 'bear_use_atr': False, 'bear_use_adx': False, 'bear_use_spike': False, 'bear_rsi_required': False, 'sideways_strategy': 'mean_reversion', 'sideways_bb_std_mult': 0.786299318945564, 'sideways_rsi_os': 31, 'sideways_rsi_ob': 51, 'sideways_adx_thresh': 30.095058278463, 'sideways_atr_min_pct': 0.0015521625916279482, 'sideways_atr_max_pct': 0.09933336984856835, 'sideways_tp_mult': 2.0019938461019553, 'sideways_tsl_mult': 0.46027328567710196, 'sideways_time_stop': 63, 'sideways_use_sma': False, 'sideways_use_ema': False, 'sideways_use_atr': False, 'sideways_use_adx': True, 'sideways_use_spike': False, 'sideways_rsi_required': True}.
[I 2025-08-30 17:24:49,296] Trial 751 finished with values: [-1000000000.0, 1000000000.0] and parameters: {'p_sma': 9, 'p_std': 45, 'p_atr': 14, 'p_adx': 14, 'rsi_period': 22, 'ema1': 9, 'ema2': 39, 'slip_atr_k': 0.13604080978311953, 'slip_spread_k': 0.7342023988353519, 'spread_hl_frac': 0.020735955173414793, 'bb_std_mult': 3.302732814481396, 'rsi_os': 33, 'rsi_ob': 85, 'vol_spike': 0.10496816476142137, 'adx_thresh': 11.754869716243945, 'atr_min_pct': 0.018399400734789153, 'atr_max_pct': 0.1475702454985883, 'tp_mult': 2.874187185886796, 'tsl_mult': 0.648728273321685, 'strategy': 'mean_reversion', 'time_stop': 23, 'use_sma': False, 'use_atr': True, 'use_adx': True, 'use_ema': False, 'use_spike': False, 'rsi_required': True, 'edge_k': 0.1246683870092612, 'edge_cap': 0.7150236019179832, 'bull_strategy': 'mean_reversion', 'bull_bb_std_mult': 1.8980594946477347, 'bull_rsi_os': 19, 'bull_rsi_ob': 62, 'bull_adx_thresh': 27.364537083034506, 'bull_atr_min_pct': 0.027868687787716034, 'bull_atr_max_pct': 0.14474514041244158, 'bull_tp_mult': 2.4283821343150986, 'bull_tsl_mult': 0.8150233743584764, 'bull_time_stop': 62, 'bull_use_sma': True, 'bull_use_ema': True, 'bull_use_atr': False, 'bull_use_adx': True, 'bull_use_spike': False, 'bull_rsi_required': False, 'bear_strategy': 'mean_reversion', 'bear_bb_std_mult': 1.3828153035309858, 'bear_rsi_os': 54, 'bear_rsi_ob': 77, 'bear_adx_thresh': 12.748309845928281, 'bear_atr_min_pct': 0.01699348936492466, 'bear_atr_max_pct': 0.10911357215535157, 'bear_tp_mult': 2.223358755951065, 'bear_tsl_mult': 0.513237553878319, 'bear_time_stop': 218, 'bear_use_sma': True, 'bear_use_ema': False, 'bear_use_atr': False, 'bear_use_adx': False, 'bear_use_spike': False, 'bear_rsi_required': False, 'sideways_strategy': 'mean_reversion', 'sideways_bb_std_mult': 0.8899594233972705, 'sideways_rsi_os': 10, 'sideways_rsi_ob': 78, 'sideways_adx_thresh': 6.696576035003844, 'sideways_atr_min_pct': 0.001710061083445132, 'sideways_atr_max_pct': 0.09494357444718277, 'sideways_tp_mult': 2.1445875639906133, 'sideways_tsl_mult': 0.4261082663821017, 'sideways_time_stop': 144, 'sideways_use_sma': False, 'sideways_use_ema': False, 'sideways_use_atr': False, 'sideways_use_adx': False, 'sideways_use_spike': False, 'sideways_rsi_required': True}.
[I 2025-08-30 17:24:50,550] Trial 755 finished with values: [-1000000000.0, 1000000000.0] and parameters: {'p_sma': 8, 'p_std': 22, 'p_atr': 18, 'p_adx': 8, 'rsi_period': 77, 'ema1': 30, 'ema2': 39, 'slip_atr_k': 0.19158594580869934, 'slip_spread_k': 0.16133197687854395, 'spread_hl_frac': 0.03550550552874798, 'bb_std_mult': 3.088497839770435, 'rsi_os': 50, 'rsi_ob': 65, 'vol_spike': 0.23652420575393102, 'adx_thresh': 11.545036862398279, 'atr_min_pct': 0.019601714846818108, 'atr_max_pct': 0.09597491027759406, 'tp_mult': 2.4680768582875756, 'tsl_mult': 0.9175974807522522, 'strategy': 'mean_reversion', 'time_stop': 24, 'use_sma': False, 'use_atr': True, 'use_adx': True, 'use_ema': False, 'use_spike': False, 'rsi_required': True, 'edge_k': 0.5941151167985013, 'edge_cap': 0.9510388987705944, 'bull_strategy': 'mean_reversion', 'bull_bb_std_mult': 1.8709372816794656, 'bull_rsi_os': 12, 'bull_rsi_ob': 54, 'bull_adx_thresh': 28.730620622167898, 'bull_atr_min_pct': 0.017200641129256396, 'bull_atr_max_pct': 0.13550912313473534, 'bull_tp_mult': 2.025414909439338, 'bull_tsl_mult': 0.8740200676182062, 'bull_time_stop': 23, 'bull_use_sma': True, 'bull_use_ema': True, 'bull_use_atr': False, 'bull_use_adx': True, 'bull_use_spike': False, 'bull_rsi_required': True, 'bear_strategy': 'mean_reversion', 'bear_bb_std_mult': 3.1197591436870775, 'bear_rsi_os': 15, 'bear_rsi_ob': 78, 'bear_adx_thresh': 26.721009825525734, 'bear_atr_min_pct': 0.010234110913601472, 'bear_atr_max_pct': 0.10311673704334043, 'bear_tp_mult': 1.3348858673182502, 'bear_tsl_mult': 0.5555763888918768, 'bear_time_stop': 175, 'bear_use_sma': True, 'bear_use_ema': True, 'bear_use_atr': False, 'bear_use_adx': False, 'bear_use_spike': False, 'bear_rsi_required': False, 'sideways_strategy': 'breakout', 'sideways_bb_std_mult': 1.490896474302335, 'sideways_rsi_os': 30, 'sideways_rsi_ob': 87, 'sideways_adx_thresh': 34.877052893559885, 'sideways_atr_min_pct': 0.008848464037762464, 'sideways_atr_max_pct': 0.0942642083288682, 'sideways_tp_mult': 1.102182925629081, 'sideways_tsl_mult': 0.6174893823400442, 'sideways_time_stop': 181, 'sideways_use_sma': True, 'sideways_use_ema': False, 'sideways_use_atr': True, 'sideways_use_adx': False, 'sideways_use_spike': False, 'sideways_rsi_required': False}.
[I 2025-08-30 17:25:38,393] Trial 753 finished with values: [-1000000000.0, 1000000000.0] and parameters: {'p_sma': 43, 'p_std': 18, 'p_atr': 15, 'p_adx': 8, 'rsi_period': 72, 'ema1': 9, 'ema2': 11, 'slip_atr_k': 0.21393237116906272, 'slip_spread_k': 0.18569988303248558, 'spread_hl_frac': 0.020726798327762093, 'bb_std_mult': 3.2186285540200976, 'rsi_os': 22, 'rsi_ob': 85, 'vol_spike': 0.11349430600495715, 'adx_thresh': 7.97114675271535, 'atr_min_pct': 0.01959711417712621, 'atr_max_pct': 0.14995838171558304, 'tp_mult': 2.8722844403940857, 'tsl_mult': 0.24273533093924798, 'strategy': 'mean_reversion', 'time_stop': 23, 'use_sma': False, 'use_atr': True, 'use_adx': True, 'use_ema': False, 'use_spike': False, 'rsi_required': True, 'edge_k': 0.6053130400555493, 'edge_cap': 0.9095082686287573, 'bull_strategy': 'mean_reversion', 'bull_bb_std_mult': 1.8829851407368348, 'bull_rsi_os': 11, 'bull_rsi_ob': 83, 'bull_adx_thresh': 28.291545783258286, 'bull_atr_min_pct': 0.017119774200119644, 'bull_atr_max_pct': 0.13646874974489656, 'bull_tp_mult': 2.0478358169025714, 'bull_tsl_mult': 0.00019950025798959325, 'bull_time_stop': 66, 'bull_use_sma': True, 'bull_use_ema': True, 'bull_use_atr': False, 'bull_use_adx': True, 'bull_use_spike': False, 'bull_rsi_required': True, 'bear_strategy': 'mean_reversion', 'bear_bb_std_mult': 3.546810648310779, 'bear_rsi_os': 5, 'bear_rsi_ob': 78, 'bear_adx_thresh': 26.594217761801715, 'bear_atr_min_pct': 0.025193278895660177, 'bear_atr_max_pct': 0.07379433791103839, 'bear_tp_mult': 2.2301455673062307, 'bear_tsl_mult': 0.6821039747174653, 'bear_time_stop': 92, 'bear_use_sma': True, 'bear_use_ema': True, 'bear_use_atr': False, 'bear_use_adx': False, 'bear_use_spike': False, 'bear_rsi_required': False, 'sideways_strategy': 'mean_reversion', 'sideways_bb_std_mult': 1.70703254799857, 'sideways_rsi_os': 37, 'sideways_rsi_ob': 92, 'sideways_adx_thresh': 11.325403798863597, 'sideways_atr_min_pct': 0.0015190165606662875, 'sideways_atr_max_pct': 0.08169049793862818, 'sideways_tp_mult': 2.829440768619579, 'sideways_tsl_mult': 0.42704834416719056, 'sideways_time_stop': 290, 'sideways_use_sma': False, 'sideways_use_ema': False, 'sideways_use_atr': True, 'sideways_use_adx': False, 'sideways_use_spike': False, 'sideways_rsi_required': False}.
[I 2025-08-30 17:25:44,654] Trial 756 finished with values: [-1000000000.0, 1000000000.0] and parameters: {'p_sma': 8, 'p_std': 18, 'p_atr': 15, 'p_adx': 8, 'rsi_period': 26, 'ema1': 22, 'ema2': 10, 'slip_atr_k': 0.00022044184128934205, 'slip_spread_k': 0.17122838117278558, 'spread_hl_frac': 0.03580332436794459, 'bb_std_mult': 3.0743893895660355, 'rsi_os': 41, 'rsi_ob': 86, 'vol_spike': 0.20408601234162044, 'adx_thresh': 12.006137794334608, 'atr_min_pct': 0.01965127600999535, 'atr_max_pct': 0.09470524910914958, 'tp_mult': 2.796174126813239, 'tsl_mult': 0.920728088309976, 'strategy': 'mean_reversion', 'time_stop': 265, 'use_sma': False, 'use_atr': True, 'use_adx': True, 'use_ema': True, 'use_spike': False, 'rsi_required': True, 'edge_k': 0.5978850005882428, 'edge_cap': 0.9114763583725679, 'bull_strategy': 'mean_reversion', 'bull_bb_std_mult': 1.5715410371448542, 'bull_rsi_os': 10, 'bull_rsi_ob': 52, 'bull_adx_thresh': 28.375506236781565, 'bull_atr_min_pct': 0.02281448304384658, 'bull_atr_max_pct': 0.053679727834328804, 'bull_tp_mult': 2.025421129250539, 'bull_tsl_mult': 0.7894648880743661, 'bull_time_stop': 78, 'bull_use_sma': True, 'bull_use_ema': False, 'bull_use_atr': False, 'bull_use_adx': True, 'bull_use_spike': False, 'bull_rsi_required': True, 'bear_strategy': 'breakout', 'bear_bb_std_mult': 0.9259926641724434, 'bear_rsi_os': 46, 'bear_rsi_ob': 54, 'bear_adx_thresh': 34.92683480411413, 'bear_atr_min_pct': 0.010146888003790322, 'bear_atr_max_pct': 0.14327663243555416, 'bear_tp_mult': 1.1598464175857064, 'bear_tsl_mult': 0.14026928547035766, 'bear_time_stop': 204, 'bear_use_sma': True, 'bear_use_ema': True, 'bear_use_atr': False, 'bear_use_adx': False, 'bear_use_spike': False, 'bear_rsi_required': False, 'sideways_strategy': 'breakout', 'sideways_bb_std_mult': 0.7520296955190057, 'sideways_rsi_os': 30, 'sideways_rsi_ob': 94, 'sideways_adx_thresh': 24.59728989087334, 'sideways_atr_min_pct': 0.00899119439832885, 'sideways_atr_max_pct': 0.10241668230265258, 'sideways_tp_mult': 2.8418638547489596, 'sideways_tsl_mult': 0.4789013869138658, 'sideways_time_stop': 158, 'sideways_use_sma': True, 'sideways_use_ema': False, 'sideways_use_atr': True, 'sideways_use_adx': False, 'sideways_use_spike': False, 'sideways_rsi_required': False}.
