[I 2025-08-30 15:11:49,014] Trial 9 finished with values: [-1000000000.0, 1000000000.0] and parameters: {'p_sma': 44, 'p_std': 29, 'p_atr': 13, 'p_adx': 28, 'rsi_period': 72, 'ema1': 21, 'ema2': 16, 'slip_atr_k': 0.022106905606543076, 'slip_spread_k': 0.947074682330608, 'spread_hl_frac': 0.03479122437454149, 'bb_std_mult': 2.290462556980888, 'rsi_os': 27, 'rsi_ob': 67, 'vol_spike': 0.02412077167556079, 'adx_thresh': 6.64831910773329, 'atr_min_pct': 0.015861183809504045, 'atr_max_pct': 0.13808141352643669, 'tp_mult': 1.3077873899920736, 'tsl_mult': 0.5961739767927757, 'strategy': 'mean_reversion', 'time_stop': 36, 'use_sma': False, 'use_atr': True, 'use_adx': True, 'use_ema': True, 'use_spike': False, 'rsi_required': False, 'edge_k': 1.8629178727447984, 'edge_cap': 0.0622843271629567, 'bull_strategy': 'breakout', 'bull_bb_std_mult': 1.8021797550418002, 'bull_rsi_os': 18, 'bull_rsi_ob': 46, 'bull_adx_thresh': 12.100840130134134, 'bull_atr_min_pct': 0.003479649650618164, 'bull_atr_max_pct': 0.042200087739113455, 'bull_tp_mult': 2.0051051488923197, 'bull_tsl_mult': 0.8311789547470798, 'bull_time_stop': 239, 'bull_use_sma': False, 'bull_use_ema': True, 'bull_use_atr': True, 'bull_use_adx': True, 'bull_use_spike': False, 'bull_rsi_required': False, 'bear_strategy': 'breakout', 'bear_bb_std_mult': 3.093075948672636, 'bear_rsi_os': 43, 'bear_rsi_ob': 59, 'bear_adx_thresh': 29.048233101119642, 'bear_atr_min_pct': 0.027856460207308503, 'bear_atr_max_pct': 0.09325191851625377, 'bear_tp_mult': 1.624303360241437, 'bear_tsl_mult': 0.09932300362664992, 'bear_time_stop': 255, 'bear_use_sma': True, 'bear_use_ema': False, 'bear_use_atr': True, 'bear_use_adx': False, 'bear_use_spike': False, 'bear_rsi_required': False, 'sideways_strategy': 'mean_reversion', 'sideways_bb_std_mult': 0.597670621289229, 'sideways_rsi_os': 47, 'sideways_rsi_ob': 82, 'sideways_adx_thresh': 27.01760063284875, 'sideways_atr_min_pct': 0.008390134472944557, 'sideways_atr_max_pct': 0.038205346782781244, 'sideways_tp_mult': 1.371035465989525, 'sideways_tsl_mult': 0.8583480480529894, 'sideways_time_stop': 232, 'sideways_use_sma': True, 'sideways_use_ema': False, 'sideways_use_atr': True, 'sideways_use_adx': True, 'sideways_use_spike': True, 'sideways_rsi_required': False}.
[I 2025-08-30 15:11:50,813] Trial 10 finished with values: [-1000000000.0, 1000000000.0] and parameters: {'p_sma': 55, 'p_std': 56, 'p_atr': 27, 'p_adx': 16, 'rsi_period': 29, 'ema1': 18, 'ema2': 33, 'slip_atr_k': 0.052739991958642374, 'slip_spread_k': 0.3939053362567747, 'spread_hl_frac': 0.0368532850973257, 'bb_std_mult': 3.0156685395353877, 'rsi_os': 18, 'rsi_ob': 68, 'vol_spike': 0.07095815478959487, 'adx_thresh': 10.321895681989105, 'atr_min_pct': 0.025620254596023035, 'atr_max_pct': 0.10429409430937896, 'tp_mult': 1.7960073171809061, 'tsl_mult': 0.8180973040363991, 'strategy': 'breakout', 'time_stop': 110, 'use_sma': True, 'use_atr': False, 'use_adx': True, 'use_ema': True, 'use_spike': True, 'rsi_required': False, 'edge_k': 1.2886100971077583, 'edge_cap': 0.12458055818137445, 'bull_strategy': 'breakout', 'bull_bb_std_mult': 3.371672131506381, 'bull_rsi_os': 14, 'bull_rsi_ob': 49, 'bull_adx_thresh': 27.85579117474774, 'bull_atr_min_pct': 0.026445488882319842, 'bull_atr_max_pct': 0.049062111978622994, 'bull_tp_mult': 2.438779259325044, 'bull_tsl_mult': 0.6960836029320584, 'bull_time_stop': 251, 'bull_use_sma': True, 'bull_use_ema': False, 'bull_use_atr': True, 'bull_use_adx': True, 'bull_use_spike': True, 'bull_rsi_required': False, 'bear_strategy': 'breakout', 'bear_bb_std_mult': 2.880595666235308, 'bear_rsi_os': 41, 'bear_rsi_ob': 72, 'bear_adx_thresh': 23.742056111599037, 'bear_atr_min_pct': 0.028655704683542577, 'bear_atr_max_pct': 0.07127094887265009, 'bear_tp_mult': 1.03136248041195, 'bear_tsl_mult': 0.4816844495787965, 'bear_time_stop': 110, 'bear_use_sma': True, 'bear_use_ema': True, 'bear_use_atr': False, 'bear_use_adx': True, 'bear_use_spike': False, 'bear_rsi_required': False, 'sideways_strategy': 'mean_reversion', 'sideways_bb_std_mult': 2.8344652280406804, 'sideways_rsi_os': 26, 'sideways_rsi_ob': 62, 'sideways_adx_thresh': 31.683209214485004, 'sideways_atr_min_pct': 0.0247821228151871, 'sideways_atr_max_pct': 0.12722262025262823, 'sideways_tp_mult': 2.980450837840961, 'sideways_tsl_mult': 0.5054787713441516, 'sideways_time_stop': 141, 'sideways_use_sma': True, 'sideways_use_ema': True, 'sideways_use_atr': True, 'sideways_use_adx': True, 'sideways_use_spike': False, 'sideways_rsi_required': True}.
[I 2025-08-30 15:11:53,980] Trial 12 finished with values: [-1000000000.0, 1000000000.0] and parameters: {'p_sma': 10, 'p_std': 44, 'p_atr': 7, 'p_adx': 16, 'rsi_period': 73, 'ema1': 21, 'ema2': 37, 'slip_atr_k': 0.08147706062359783, 'slip_spread_k': 0.5325474779618784, 'spread_hl_frac': 0.02439845318775863, 'bb_std_mult': 2.538867775332239, 'rsi_os': 15, 'rsi_ob': 72, 'vol_spike': 0.26615057610162773, 'adx_thresh': 10.881457092054172, 'atr_min_pct': 0.02368902250297869, 'atr_max_pct': 0.1481626703117074, 'tp_mult': 2.682634271833058, 'tsl_mult': 0.750395648683536, 'strategy': 'mean_reversion', 'time_stop': 118, 'use_sma': False, 'use_atr': False, 'use_adx': False, 'use_ema': False, 'use_spike': True, 'rsi_required': False, 'edge_k': 1.0867178735139111, 'edge_cap': 0.6609553854368913, 'bull_strategy': 'breakout', 'bull_bb_std_mult': 1.9853200103966118, 'bull_rsi_os': 12, 'bull_rsi_ob': 46, 'bull_adx_thresh': 33.24010341344587, 'bull_atr_min_pct': 0.029416497281380512, 'bull_atr_max_pct': 0.05672917826987078, 'bull_tp_mult': 1.0522819223204039, 'bull_tsl_mult': 0.6032120300280136, 'bull_time_stop': 129, 'bull_use_sma': True, 'bull_use_ema': True, 'bull_use_atr': True, 'bull_use_adx': True, 'bull_use_spike': True, 'bull_rsi_required': False, 'bear_strategy': 'mean_reversion', 'bear_bb_std_mult': 3.0829724138408587, 'bear_rsi_os': 26, 'bear_rsi_ob': 65, 'bear_adx_thresh': 27.132286380696783, 'bear_atr_min_pct': 0.00892539984971731, 'bear_atr_max_pct': 0.036157024872094275, 'bear_tp_mult': 2.391580822774201, 'bear_tsl_mult': 0.02004541730760101, 'bear_time_stop': 71, 'bear_use_sma': False, 'bear_use_ema': True, 'bear_use_atr': False, 'bear_use_adx': False, 'bear_use_spike': False, 'bear_rsi_required': True, 'sideways_strategy': 'breakout', 'sideways_bb_std_mult': 1.2053833094248414, 'sideways_rsi_os': 22, 'sideways_rsi_ob': 63, 'sideways_adx_thresh': 15.666297907713915, 'sideways_atr_min_pct': 0.028730569011576303, 'sideways_atr_max_pct': 0.09058153718565753, 'sideways_tp_mult': 2.5446842375166585, 'sideways_tsl_mult': 0.41759970929544654, 'sideways_time_stop': 286, 'sideways_use_sma': True, 'sideways_use_ema': False, 'sideways_use_atr': False, 'sideways_use_adx': True, 'sideways_use_spike': False, 'sideways_rsi_required': True}.
[I 2025-08-30 15:11:55,635] Trial 11 finished with values: [-1000000000.0, 1000000000.0] and parameters: {'p_sma': 30, 'p_std': 45, 'p_atr': 21, 'p_adx': 16, 'rsi_period': 7, 'ema1': 13, 'ema2': 13, 'slip_atr_k': 0.1099222114164729, 'slip_spread_k': 0.010628425773525074, 'spread_hl_frac': 0.037182034295741836, 'bb_std_mult': 1.2876048701153195, 'rsi_os': 18, 'rsi_ob': 51, 'vol_spike': 0.1728931497863008, 'adx_thresh': 9.19075507441204, 'atr_min_pct': 0.0029809268405366104, 'atr_max_pct': 0.0910064315495778, 'tp_mult': 2.829341410051413, 'tsl_mult': 0.4126898958834322, 'strategy': 'breakout', 'time_stop': 195, 'use_sma': False, 'use_atr': False, 'use_adx': False, 'use_ema': True, 'use_spike': True, 'rsi_required': False, 'edge_k': 1.93442831102165, 'edge_cap': 0.14732885751899266, 'bull_strategy': 'mean_reversion', 'bull_bb_std_mult': 2.5904864822003955, 'bull_rsi_os': 7, 'bull_rsi_ob': 87, 'bull_adx_thresh': 17.18617074353706, 'bull_atr_min_pct': 0.014090818857496636, 'bull_atr_max_pct': 0.07966721267432511, 'bull_tp_mult': 1.2856237723434347, 'bull_tsl_mult': 0.8902162021725263, 'bull_time_stop': 119, 'bull_use_sma': False, 'bull_use_ema': True, 'bull_use_atr': False, 'bull_use_adx': True, 'bull_use_spike': True, 'bull_rsi_required': True, 'bear_strategy': 'breakout', 'bear_bb_std_mult': 2.188360949996222, 'bear_rsi_os': 8, 'bear_rsi_ob': 94, 'bear_adx_thresh': 23.730974538743187, 'bear_atr_min_pct': 0.016354895159119358, 'bear_atr_max_pct': 0.07584955343301553, 'bear_tp_mult': 1.3892895017269498, 'bear_tsl_mult': 0.3657368537968396, 'bear_time_stop': 37, 'bear_use_sma': False, 'bear_use_ema': False, 'bear_use_atr': False, 'bear_use_adx': False, 'bear_use_spike': True, 'bear_rsi_required': False, 'sideways_strategy': 'breakout', 'sideways_bb_std_mult': 2.7559187067008795, 'sideways_rsi_os': 19, 'sideways_rsi_ob': 73, 'sideways_adx_thresh': 22.893899639864294, 'sideways_atr_min_pct': 0.028493919267251297, 'sideways_atr_max_pct': 0.013279559218811347, 'sideways_tp_mult': 2.6773597593306264, 'sideways_tsl_mult': 0.2981738471546814, 'sideways_time_stop': 189, 'sideways_use_sma': True, 'sideways_use_ema': False, 'sideways_use_atr': True, 'sideways_use_adx': True, 'sideways_use_spike': True, 'sideways_rsi_required': True}.
[I 2025-08-30 15:12:34,528] Trial 13 finished with values: [-1000000000.0, 1000000000.0] and parameters: {'p_sma': 30, 'p_std': 51, 'p_atr': 21, 'p_adx': 7, 'rsi_period': 37, 'ema1': 30, 'ema2': 46, 'slip_atr_k': 0.21087153380542772, 'slip_spread_k': 0.0007654300457411445, 'spread_hl_frac': 0.022474849651145747, 'bb_std_mult': 1.6171928138864238, 'rsi_os': 40, 'rsi_ob': 79, 'vol_spike': 0.16940603345103347, 'adx_thresh': 23.306167864062502, 'atr_min_pct': 0.02924249784751237, 'atr_max_pct': 0.08807919358637556, 'tp_mult': 2.998693886280418, 'tsl_mult': 0.9766525928988451, 'strategy': 'breakout', 'time_stop': 222, 'use_sma': True, 'use_atr': False, 'use_adx': False, 'use_ema': True, 'use_spike': False, 'rsi_required': True, 'edge_k': 0.6939436652547071, 'edge_cap': 0.5646703894534149, 'bull_strategy': 'mean_reversion', 'bull_bb_std_mult': 3.5383380853194417, 'bull_rsi_os': 40, 'bull_rsi_ob': 95, 'bull_adx_thresh': 5.026660889492916, 'bull_atr_min_pct': 0.02902716476267067, 'bull_atr_max_pct': 0.102725024752922, 'bull_tp_mult': 2.9577105236536383, 'bull_tsl_mult': 0.5244991830843557, 'bull_time_stop': 300, 'bull_use_sma': False, 'bull_use_ema': True, 'bull_use_atr': True, 'bull_use_adx': False, 'bull_use_spike': True, 'bull_rsi_required': False, 'bear_strategy': 'breakout', 'bear_bb_std_mult': 1.726575609312409, 'bear_rsi_os': 17, 'bear_rsi_ob': 89, 'bear_adx_thresh': 15.47964525736673, 'bear_atr_min_pct': 0.017982794863144615, 'bear_atr_max_pct': 0.021366182797884894, 'bear_tp_mult': 1.0384738079322422, 'bear_tsl_mult': 0.025070071824339957, 'bear_time_stop': 8, 'bear_use_sma': False, 'bear_use_ema': True, 'bear_use_atr': True, 'bear_use_adx': True, 'bear_use_spike': True, 'bear_rsi_required': True, 'sideways_strategy': 'mean_reversion', 'sideways_bb_std_mult': 2.5252407480856935, 'sideways_rsi_os': 37, 'sideways_rsi_ob': 65, 'sideways_adx_thresh': 33.66075931101094, 'sideways_atr_min_pct': 0.0015623996658853945, 'sideways_atr_max_pct': 0.14750036494556007, 'sideways_tp_mult': 1.0425037944116198, 'sideways_tsl_mult': 0.008760581860756095, 'sideways_time_stop': 196, 'sideways_use_sma': True, 'sideways_use_ema': True, 'sideways_use_atr': False, 'sideways_use_adx': False, 'sideways_use_spike': False, 'sideways_rsi_required': False}.
[I 2025-08-30 15:12:38,035] Trial 14 finished with values: [-1000000000.0, 1000000000.0] and parameters: {'p_sma': 28, 'p_std': 6, 'p_atr': 22, 'p_adx': 7, 'rsi_period': 10, 'ema1': 30, 'ema2': 47, 'slip_atr_k': 0.2461846546633466, 'slip_spread_k': 0.015215540077736067, 'spread_hl_frac': 0.019510083946183806, 'bb_std_mult': 1.4219232142014837, 'rsi_os': 5, 'rsi_ob': 95, 'vol_spike': 0.1968146221525204, 'adx_thresh': 33.86211446189166, 'atr_min_pct': 0.009642220931119376, 'atr_max_pct': 0.06018392227331716, 'tp_mult': 2.9752569608445256, 'tsl_mult': 0.9775548744563234, 'strategy': 'mean_reversion', 'time_stop': 296, 'use_sma': True, 'use_atr': False, 'use_adx': False, 'use_ema': True, 'use_spike': False, 'rsi_required': True, 'edge_k': 0.559649380693092, 'edge_cap': 0.609519019078485, 'bull_strategy': 'mean_reversion', 'bull_bb_std_mult': 2.626452998517752, 'bull_rsi_os': 6, 'bull_rsi_ob': 94, 'bull_adx_thresh': 5.884030431034567, 'bull_atr_min_pct': 0.01026056405822088, 'bull_atr_max_pct': 0.010808436922411069, 'bull_tp_mult': 2.91002040144046, 'bull_tsl_mult': 0.5106507067948309, 'bull_time_stop': 126, 'bull_use_sma': False, 'bull_use_ema': True, 'bull_use_atr': True, 'bull_use_adx': False, 'bull_use_spike': False, 'bull_rsi_required': True, 'bear_strategy': 'breakout', 'bear_bb_std_mult': 1.7391338618384564, 'bear_rsi_os': 55, 'bear_rsi_ob': 94, 'bear_adx_thresh': 17.123345033584897, 'bear_atr_min_pct': 0.019056430461441586, 'bear_atr_max_pct': 0.010029330927314173, 'bear_tp_mult': 2.997896554491967, 'bear_tsl_mult': 0.9462695623859873, 'bear_time_stop': 6, 'bear_use_sma': False, 'bear_use_ema': False, 'bear_use_atr': True, 'bear_use_adx': True, 'bear_use_spike': True, 'bear_rsi_required': True, 'sideways_strategy': 'breakout', 'sideways_bb_std_mult': 2.37161253883124, 'sideways_rsi_os': 5, 'sideways_rsi_ob': 94, 'sideways_adx_thresh': 16.97117812373035, 'sideways_atr_min_pct': 0.019821009920553367, 'sideways_atr_max_pct': 0.08883587584059602, 'sideways_tp_mult': 2.1429052630874965, 'sideways_tsl_mult': 0.03119280906149796, 'sideways_time_stop': 194, 'sideways_use_sma': False, 'sideways_use_ema': True, 'sideways_use_atr': False, 'sideways_use_adx': False, 'sideways_use_spike': False, 'sideways_rsi_required': False}.
[I 2025-08-30 15:12:42,231] Trial 15 finished with values: [-0.033092754044864114, 0.0329909650292107] and parameters: {'p_sma': 29, 'p_std': 6, 'p_atr': 22, 'p_adx': 7, 'rsi_period': 8, 'ema1': 30, 'ema2': 49, 'slip_atr_k': 0.2436802090584256, 'slip_spread_k': 0.03252341588351393, 'spread_hl_frac': 0.01760602319240363, 'bb_std_mult': 1.5033744639167559, 'rsi_os': 6, 'rsi_ob': 94, 'vol_spike': 0.21030830392072078, 'adx_thresh': 34.09632159592974, 'atr_min_pct': 0.010186123307554317, 'atr_max_pct': 0.061721440521252786, 'tp_mult': 2.985636061743807, 'tsl_mult': 0.9564672638081626, 'strategy': 'breakout', 'time_stop': 276, 'use_sma': True, 'use_atr': False, 'use_adx': True, 'use_ema': True, 'use_spike': False, 'rsi_required': True, 'edge_k': 0.5934330576312138, 'edge_cap': 0.9836209440571579, 'bull_strategy': 'mean_reversion', 'bull_bb_std_mult': 2.6370514939059966, 'bull_rsi_os': 39, 'bull_rsi_ob': 95, 'bull_adx_thresh': 20.753420492839066, 'bull_atr_min_pct': 0.009289276871950993, 'bull_atr_max_pct': 0.014082850200719074, 'bull_tp_mult': 2.9949910721585553, 'bull_tsl_mult': 0.37004121039801874, 'bull_time_stop': 138, 'bull_use_sma': False, 'bull_use_ema': True, 'bull_use_atr': False, 'bull_use_adx': False, 'bull_use_spike': False, 'bull_rsi_required': True, 'bear_strategy': 'breakout', 'bear_bb_std_mult': 1.725823100747073, 'bear_rsi_os': 35, 'bear_rsi_ob': 93, 'bear_adx_thresh': 17.68187209101373, 'bear_atr_min_pct': 0.01859086274997423, 'bear_atr_max_pct': 0.1460559944364977, 'bear_tp_mult': 2.9726681156449093, 'bear_tsl_mult': 0.985818305641406, 'bear_time_stop': 6, 'bear_use_sma': False, 'bear_use_ema': False, 'bear_use_atr': True, 'bear_use_adx': True, 'bear_use_spike': True, 'bear_rsi_required': True, 'sideways_strategy': 'mean_reversion', 'sideways_bb_std_mult': 2.4501871849010786, 'sideways_rsi_os': 5, 'sideways_rsi_ob': 95, 'sideways_adx_thresh': 5.216687910738946, 'sideways_atr_min_pct': 0.00028949230036570857, 'sideways_atr_max_pct': 0.14699272840226046, 'sideways_tp_mult': 1.0890218136275267, 'sideways_tsl_mult': 0.09352236374242334, 'sideways_time_stop': 12, 'sideways_use_sma': False, 'sideways_use_ema': True, 'sideways_use_atr': False, 'sideways_use_adx': False, 'sideways_use_spike': True, 'sideways_rsi_required': False}.
[I 2025-08-30 15:12:44,129] Trial 16 finished with values: [-0.140380669734953, 0.14032867338591481] and parameters: {'p_sma': 33, 'p_std': 5, 'p_atr': 30, 'p_adx': 7, 'rsi_period': 44, 'ema1': 27, 'ema2': 49, 'slip_atr_k': 0.22892868769279895, 'slip_spread_k': 0.9894358132209731, 'spread_hl_frac': 0.021162795608462612, 'bb_std_mult': 1.6572364946836355, 'rsi_os': 5, 'rsi_ob': 93, 'vol_spike': 0.19327328842655664, 'adx_thresh': 34.7211868080893, 'atr_min_pct': 0.01265767797324066, 'atr_max_pct': 0.05455405155494658, 'tp_mult': 2.3702098055226166, 'tsl_mult': 0.9878138351516041, 'strategy': 'mean_reversion', 'time_stop': 293, 'use_sma': True, 'use_atr': True, 'use_adx': True, 'use_ema': True, 'use_spike': False, 'rsi_required': True, 'edge_k': 0.5014863936863283, 'edge_cap': 0.9813099571377565, 'bull_strategy': 'mean_reversion', 'bull_bb_std_mult': 2.519954217034318, 'bull_rsi_os': 39, 'bull_rsi_ob': 94, 'bull_adx_thresh': 8.092906294958093, 'bull_atr_min_pct': 0.010205009522945615, 'bull_atr_max_pct': 0.011990638019128835, 'bull_tp_mult': 2.793853702491081, 'bull_tsl_mult': 0.370829783478622, 'bull_time_stop': 295, 'bull_use_sma': False, 'bull_use_ema': True, 'bull_use_atr': True, 'bull_use_adx': False, 'bull_use_spike': False, 'bull_rsi_required': True, 'bear_strategy': 'breakout', 'bear_bb_std_mult': 1.443102037184064, 'bear_rsi_os': 53, 'bear_rsi_ob': 91, 'bear_adx_thresh': 34.22253582956065, 'bear_atr_min_pct': 0.0013938062928989178, 'bear_atr_max_pct': 0.146449154084567, 'bear_tp_mult': 2.976204347229292, 'bear_tsl_mult': 0.9847024348092674, 'bear_time_stop': 293, 'bear_use_sma': False, 'bear_use_ema': False, 'bear_use_atr': True, 'bear_use_adx': True, 'bear_use_spike': True, 'bear_rsi_required': True, 'sideways_strategy': 'mean_reversion', 'sideways_bb_std_mult': 2.2550249697624833, 'sideways_rsi_os': 36, 'sideways_rsi_ob': 95, 'sideways_adx_thresh': 5.134822495090985, 'sideways_atr_min_pct': 0.0005133186328879283, 'sideways_atr_max_pct': 0.14739703627706377, 'sideways_tp_mult': 1.0317265638559652, 'sideways_tsl_mult': 0.08495013192427803, 'sideways_time_stop': 12, 'sideways_use_sma': False, 'sideways_use_ema': True, 'sideways_use_atr': False, 'sideways_use_adx': False, 'sideways_use_spike': False, 'sideways_rsi_required': False}.
[I 2025-08-30 15:13:22,468] Trial 17 finished with values: [-0.1184456977646754, 0.11805630741559461] and parameters: {'p_sma': 45, 'p_std': 20, 'p_atr': 29, 'p_adx': 11, 'rsi_period': 8, 'ema1': 30, 'ema2': 24, 'slip_atr_k': 0.24760892822028724, 'slip_spread_k': 0.9449709565679314, 'spread_hl_frac': 0.014561004720741382, 'bb_std_mult': 0.5257138444086451, 'rsi_os': 5, 'rsi_ob': 89, 'vol_spike': 0.19868742930400768, 'adx_thresh': 33.44274408071333, 'atr_min_pct': 0.010530950693087198, 'atr_max_pct': 0.05865289583997106, 'tp_mult': 2.206774112816133, 'tsl_mult': 0.23677365180659898, 'strategy': 'mean_reversion', 'time_stop': 289, 'use_sma': True, 'use_atr': True, 'use_adx': True, 'use_ema': False, 'use_spike': False, 'rsi_required': True, 'edge_k': 0.11274790885516306, 'edge_cap': 0.8313881498940371, 'bull_strategy': 'mean_reversion', 'bull_bb_std_mult': 2.5359141649065178, 'bull_rsi_os': 55, 'bull_rsi_ob': 55, 'bull_adx_thresh': 22.112608814998257, 'bull_atr_min_pct': 0.0075876040970439046, 'bull_atr_max_pct': 0.014079813487876236, 'bull_tp_mult': 2.9033548740878743, 'bull_tsl_mult': 0.35894077276114034, 'bull_time_stop': 169, 'bull_use_sma': False, 'bull_use_ema': False, 'bull_use_atr': False, 'bull_use_adx': False, 'bull_use_spike': False, 'bull_rsi_required': True, 'bear_strategy': 'mean_reversion', 'bear_bb_std_mult': 1.8448443193936828, 'bear_rsi_os': 52, 'bear_rsi_ob': 54, 'bear_adx_thresh': 32.32966717205575, 'bear_atr_min_pct': 0.00011665314477180347, 'bear_atr_max_pct': 0.1495313607557488, 'bear_tp_mult': 2.9507778952996877, 'bear_tsl_mult': 0.9762743091797834, 'bear_time_stop': 224, 'bear_use_sma': False, 'bear_use_ema': False, 'bear_use_atr': True, 'bear_use_adx': True, 'bear_use_spike': True, 'bear_rsi_required': True, 'sideways_strategy': 'mean_reversion', 'sideways_bb_std_mult': 2.0781357401272897, 'sideways_rsi_os': 5, 'sideways_rsi_ob': 94, 'sideways_adx_thresh': 14.872613016363005, 'sideways_atr_min_pct': 0.020335455088102868, 'sideways_atr_max_pct': 0.07881214538708455, 'sideways_tp_mult': 2.13518820873256, 'sideways_tsl_mult': 0.011200951337954512, 'sideways_time_stop': 27, 'sideways_use_sma': False, 'sideways_use_ema': True, 'sideways_use_atr': False, 'sideways_use_adx': False, 'sideways_use_spike': True, 'sideways_rsi_required': False}.
