[I 2025-08-30 16:41:14,855] Trial 498 finished with values: [-1000000000.0, 1000000000.0] and parameters: {'p_sma': 5, 'p_std': 29, 'p_atr': 30, 'p_adx': 11, 'rsi_period': 22, 'ema1': 8, 'ema2': 13, 'slip_atr_k': 0.08505556417601573, 'slip_spread_k': 0.6541359334301102, 'spread_hl_frac': 0.007974344340064683, 'bb_std_mult': 3.3576712729670346, 'rsi_os': 37, 'rsi_ob': 48, 'vol_spike': 0.006071171983790224, 'adx_thresh': 13.242449102088415, 'atr_min_pct': 0.018785207568993923, 'atr_max_pct': 0.028879095393064935, 'tp_mult': 1.6620315593546149, 'tsl_mult': 0.33875945000790875, 'strategy': 'mean_reversion', 'time_stop': 218, 'use_sma': False, 'use_atr': False, 'use_adx': True, 'use_ema': False, 'use_spike': True, 'rsi_required': False, 'edge_k': 1.028317384410857, 'edge_cap': 0.6005339042938521, 'bull_strategy': 'mean_reversion', 'bull_bb_std_mult': 1.7767991237817844, 'bull_rsi_os': 11, 'bull_rsi_ob': 50, 'bull_adx_thresh': 21.436253411433903, 'bull_atr_min_pct': 0.003491166028845019, 'bull_atr_max_pct': 0.036999477020387646, 'bull_tp_mult': 1.7524923555483216, 'bull_tsl_mult': 0.2923872849479566, 'bull_time_stop': 71, 'bull_use_sma': True, 'bull_use_ema': True, 'bull_use_atr': False, 'bull_use_adx': True, 'bull_use_spike': True, 'bull_rsi_required': False, 'bear_strategy': 'mean_reversion', 'bear_bb_std_mult': 2.1500035893232554, 'bear_rsi_os': 6, 'bear_rsi_ob': 76, 'bear_adx_thresh': 13.187282516873402, 'bear_atr_min_pct': 0.022928211244457597, 'bear_atr_max_pct': 0.04405758596395326, 'bear_tp_mult': 2.3315343521948853, 'bear_tsl_mult': 0.7487686203668393, 'bear_time_stop': 223, 'bear_use_sma': True, 'bear_use_ema': False, 'bear_use_atr': False, 'bear_use_adx': True, 'bear_use_spike': True, 'bear_rsi_required': True, 'sideways_strategy': 'mean_reversion', 'sideways_bb_std_mult': 0.5032767413599148, 'sideways_rsi_os': 44, 'sideways_rsi_ob': 95, 'sideways_adx_thresh': 23.270601653253173, 'sideways_atr_min_pct': 0.0017026752712128396, 'sideways_atr_max_pct': 0.1494513837295228, 'sideways_tp_mult': 2.256017636699335, 'sideways_tsl_mult': 0.502857293740636, 'sideways_time_stop': 5, 'sideways_use_sma': True, 'sideways_use_ema': False, 'sideways_use_atr': True, 'sideways_use_adx': False, 'sideways_use_spike': True, 'sideways_rsi_required': True}.
[I 2025-08-30 16:41:15,699] Trial 499 finished with values: [-1000000000.0, 1000000000.0] and parameters: {'p_sma': 11, 'p_std': 56, 'p_atr': 7, 'p_adx': 25, 'rsi_period': 19, 'ema1': 28, 'ema2': 11, 'slip_atr_k': 0.15879621998879453, 'slip_spread_k': 0.19441266110436484, 'spread_hl_frac': 0.043160877878442125, 'bb_std_mult': 3.011302369991219, 'rsi_os': 51, 'rsi_ob': 67, 'vol_spike': 0.14103324683446597, 'adx_thresh': 32.821357951079996, 'atr_min_pct': 0.028589702063603634, 'atr_max_pct': 0.1279060489419101, 'tp_mult': 2.9415430830447535, 'tsl_mult': 0.4328994851750573, 'strategy': 'mean_reversion', 'time_stop': 284, 'use_sma': False, 'use_atr': True, 'use_adx': True, 'use_ema': False, 'use_spike': False, 'rsi_required': True, 'edge_k': 0.42072133052365646, 'edge_cap': 0.631464979600901, 'bull_strategy': 'mean_reversion', 'bull_bb_std_mult': 1.745102096746989, 'bull_rsi_os': 17, 'bull_rsi_ob': 48, 'bull_adx_thresh': 21.377690261963, 'bull_atr_min_pct': 0.029804349679047798, 'bull_atr_max_pct': 0.13904189104359801, 'bull_tp_mult': 1.9214436496831235, 'bull_tsl_mult': 0.552206463406728, 'bull_time_stop': 88, 'bull_use_sma': True, 'bull_use_ema': True, 'bull_use_atr': False, 'bull_use_adx': True, 'bull_use_spike': False, 'bull_rsi_required': True, 'bear_strategy': 'mean_reversion', 'bear_bb_std_mult': 1.2885882520740517, 'bear_rsi_os': 15, 'bear_rsi_ob': 77, 'bear_adx_thresh': 27.210847470882236, 'bear_atr_min_pct': 0.005497883288518151, 'bear_atr_max_pct': 0.09541211108570552, 'bear_tp_mult': 2.187519776301856, 'bear_tsl_mult': 0.3164443261293259, 'bear_time_stop': 181, 'bear_use_sma': True, 'bear_use_ema': False, 'bear_use_atr': False, 'bear_use_adx': False, 'bear_use_spike': False, 'bear_rsi_required': False, 'sideways_strategy': 'breakout', 'sideways_bb_std_mult': 1.105746814419708, 'sideways_rsi_os': 31, 'sideways_rsi_ob': 82, 'sideways_adx_thresh': 12.588830530446302, 'sideways_atr_min_pct': 0.01598082462035739, 'sideways_atr_max_pct': 0.1210207139424665, 'sideways_tp_mult': 1.3229253241382182, 'sideways_tsl_mult': 0.3053529546264726, 'sideways_time_stop': 23, 'sideways_use_sma': True, 'sideways_use_ema': False, 'sideways_use_atr': False, 'sideways_use_adx': False, 'sideways_use_spike': False, 'sideways_rsi_required': True}.
[I 2025-08-30 16:41:56,007] Trial 495 finished with values: [-0.03607314353603319, 0.03600895774312817] and parameters: {'p_sma': 7, 'p_std': 59, 'p_atr': 12, 'p_adx': 20, 'rsi_period': 21, 'ema1': 5, 'ema2': 10, 'slip_atr_k': 0.009522243757823377, 'slip_spread_k': 0.19513510460897687, 'spread_hl_frac': 0.020012388851650895, 'bb_std_mult': 3.021141830736861, 'rsi_os': 6, 'rsi_ob': 57, 'vol_spike': 0.00683109646076302, 'adx_thresh': 18.497747030135685, 'atr_min_pct': 0.012941906707141855, 'atr_max_pct': 0.12731180038206646, 'tp_mult': 2.9312688644237155, 'tsl_mult': 0.6942448836941713, 'strategy': 'mean_reversion', 'time_stop': 104, 'use_sma': False, 'use_atr': True, 'use_adx': True, 'use_ema': False, 'use_spike': False, 'rsi_required': True, 'edge_k': 1.8260850753424676, 'edge_cap': 0.8570537390879992, 'bull_strategy': 'mean_reversion', 'bull_bb_std_mult': 3.3279460398450893, 'bull_rsi_os': 42, 'bull_rsi_ob': 48, 'bull_adx_thresh': 21.35379784896304, 'bull_atr_min_pct': 0.01905260553782013, 'bull_atr_max_pct': 0.03637691285269876, 'bull_tp_mult': 1.9362233652733953, 'bull_tsl_mult': 0.5668444295113452, 'bull_time_stop': 56, 'bull_use_sma': True, 'bull_use_ema': True, 'bull_use_atr': False, 'bull_use_adx': True, 'bull_use_spike': False, 'bull_rsi_required': False, 'bear_strategy': 'mean_reversion', 'bear_bb_std_mult': 2.1731982005352957, 'bear_rsi_os': 8, 'bear_rsi_ob': 80, 'bear_adx_thresh': 12.122862448279296, 'bear_atr_min_pct': 0.022508299759462152, 'bear_atr_max_pct': 0.10135192701653507, 'bear_tp_mult': 1.1945164048544945, 'bear_tsl_mult': 0.02877963118811716, 'bear_time_stop': 222, 'bear_use_sma': True, 'bear_use_ema': False, 'bear_use_atr': False, 'bear_use_adx': False, 'bear_use_spike': False, 'bear_rsi_required': False, 'sideways_strategy': 'breakout', 'sideways_bb_std_mult': 1.9811543436650014, 'sideways_rsi_os': 42, 'sideways_rsi_ob': 71, 'sideways_adx_thresh': 15.57686718335189, 'sideways_atr_min_pct': 0.0013251817492083559, 'sideways_atr_max_pct': 0.048335137431271866, 'sideways_tp_mult': 2.267302242293602, 'sideways_tsl_mult': 0.6262860866058627, 'sideways_time_stop': 158, 'sideways_use_sma': True, 'sideways_use_ema': False, 'sideways_use_atr': False, 'sideways_use_adx': False, 'sideways_use_spike': False, 'sideways_rsi_required': True}.
[I 2025-08-30 16:41:55,994] Trial 497 finished with values: [-1000000000.0, 1000000000.0] and parameters: {'p_sma': 5, 'p_std': 37, 'p_atr': 26, 'p_adx': 29, 'rsi_period': 22, 'ema1': 28, 'ema2': 28, 'slip_atr_k': 0.004368883362465103, 'slip_spread_k': 0.5172216026875854, 'spread_hl_frac': 0.018266603274667628, 'bb_std_mult': 3.3206757636794597, 'rsi_os': 10, 'rsi_ob': 57, 'vol_spike': 0.2540267337920664, 'adx_thresh': 24.798852408916705, 'atr_min_pct': 0.01877826665402196, 'atr_max_pct': 0.14070411126407126, 'tp_mult': 2.941933477863585, 'tsl_mult': 0.27748292139129815, 'strategy': 'mean_reversion', 'time_stop': 282, 'use_sma': False, 'use_atr': False, 'use_adx': True, 'use_ema': False, 'use_spike': False, 'rsi_required': False, 'edge_k': 1.6249504386591682, 'edge_cap': 0.6023294969798089, 'bull_strategy': 'mean_reversion', 'bull_bb_std_mult': 1.7495273353153205, 'bull_rsi_os': 8, 'bull_rsi_ob': 48, 'bull_adx_thresh': 21.275099906707226, 'bull_atr_min_pct': 0.02025294120290977, 'bull_atr_max_pct': 0.03673104044460974, 'bull_tp_mult': 2.833554641150015, 'bull_tsl_mult': 0.9076746878454474, 'bull_time_stop': 73, 'bull_use_sma': True, 'bull_use_ema': True, 'bull_use_atr': False, 'bull_use_adx': True, 'bull_use_spike': False, 'bull_rsi_required': False, 'bear_strategy': 'mean_reversion', 'bear_bb_std_mult': 1.701873006157127, 'bear_rsi_os': 24, 'bear_rsi_ob': 93, 'bear_adx_thresh': 14.74110895884272, 'bear_atr_min_pct': 0.022898257182686777, 'bear_atr_max_pct': 0.0997538048896451, 'bear_tp_mult': 2.059362899865725, 'bear_tsl_mult': 0.6628094337984675, 'bear_time_stop': 300, 'bear_use_sma': True, 'bear_use_ema': False, 'bear_use_atr': False, 'bear_use_adx': True, 'bear_use_spike': True, 'bear_rsi_required': True, 'sideways_strategy': 'mean_reversion', 'sideways_bb_std_mult': 0.8312919722522998, 'sideways_rsi_os': 24, 'sideways_rsi_ob': 63, 'sideways_adx_thresh': 23.21488057047168, 'sideways_atr_min_pct': 0.0012672223745336208, 'sideways_atr_max_pct': 0.09911422363355686, 'sideways_tp_mult': 2.2043150128492663, 'sideways_tsl_mult': 0.5690331821052972, 'sideways_time_stop': 294, 'sideways_use_sma': True, 'sideways_use_ema': False, 'sideways_use_atr': False, 'sideways_use_adx': False, 'sideways_use_spike': True, 'sideways_rsi_required': True}.
[I 2025-08-30 16:41:57,319] Trial 496 finished with values: [-1000000000.0, 1000000000.0] and parameters: {'p_sma': 5, 'p_std': 59, 'p_atr': 30, 'p_adx': 20, 'rsi_period': 22, 'ema1': 10, 'ema2': 12, 'slip_atr_k': 0.14161461355766328, 'slip_spread_k': 0.9803548346499065, 'spread_hl_frac': 0.03253164962039246, 'bb_std_mult': 3.336153196541143, 'rsi_os': 46, 'rsi_ob': 93, 'vol_spike': 0.17928689084495353, 'adx_thresh': 13.240157584132671, 'atr_min_pct': 0.01884939352282059, 'atr_max_pct': 0.12480362863319158, 'tp_mult': 1.4301561052071246, 'tsl_mult': 0.6929938967310203, 'strategy': 'mean_reversion', 'time_stop': 15, 'use_sma': False, 'use_atr': True, 'use_adx': True, 'use_ema': False, 'use_spike': False, 'rsi_required': True, 'edge_k': 1.0013079775747329, 'edge_cap': 0.6018901350956969, 'bull_strategy': 'mean_reversion', 'bull_bb_std_mult': 0.665579098085151, 'bull_rsi_os': 46, 'bull_rsi_ob': 48, 'bull_adx_thresh': 21.267662916431217, 'bull_atr_min_pct': 0.020110651768200014, 'bull_atr_max_pct': 0.037719177584982624, 'bull_tp_mult': 1.9396250563815347, 'bull_tsl_mult': 0.5246707901988177, 'bull_time_stop': 63, 'bull_use_sma': True, 'bull_use_ema': True, 'bull_use_atr': False, 'bull_use_adx': True, 'bull_use_spike': False, 'bull_rsi_required': False, 'bear_strategy': 'mean_reversion', 'bear_bb_std_mult': 2.1495915885594243, 'bear_rsi_os': 12, 'bear_rsi_ob': 76, 'bear_adx_thresh': 11.886025542426081, 'bear_atr_min_pct': 0.02314022685678949, 'bear_atr_max_pct': 0.04397596612334523, 'bear_tp_mult': 2.1847915868066545, 'bear_tsl_mult': 0.9736896336916698, 'bear_time_stop': 222, 'bear_use_sma': True, 'bear_use_ema': False, 'bear_use_atr': False, 'bear_use_adx': False, 'bear_use_spike': False, 'bear_rsi_required': False, 'sideways_strategy': 'breakout', 'sideways_bb_std_mult': 2.0779730475357496, 'sideways_rsi_os': 31, 'sideways_rsi_ob': 78, 'sideways_adx_thresh': 24.96241042795037, 'sideways_atr_min_pct': 0.0011258136315150699, 'sideways_atr_max_pct': 0.11626881973549316, 'sideways_tp_mult': 1.56869622269114, 'sideways_tsl_mult': 0.5741974448754177, 'sideways_time_stop': 24, 'sideways_use_sma': True, 'sideways_use_ema': False, 'sideways_use_atr': False, 'sideways_use_adx': False, 'sideways_use_spike': False, 'sideways_rsi_required': True}.
[I 2025-08-30 16:42:02,888] Trial 500 finished with values: [-1000000000.0, 1000000000.0] and parameters: {'p_sma': 10, 'p_std': 57, 'p_atr': 17, 'p_adx': 26, 'rsi_period': 62, 'ema1': 25, 'ema2': 12, 'slip_atr_k': 0.1428239228132378, 'slip_spread_k': 0.7525261027069416, 'spread_hl_frac': 0.0017096317897945523, 'bb_std_mult': 2.4339922809335466, 'rsi_os': 46, 'rsi_ob': 87, 'vol_spike': 0.010438846994427205, 'adx_thresh': 18.352434688280443, 'atr_min_pct': 0.019354017669951876, 'atr_max_pct': 0.03442821985194794, 'tp_mult': 2.8046929396182416, 'tsl_mult': 0.09844465940322517, 'strategy': 'breakout', 'time_stop': 11, 'use_sma': False, 'use_atr': False, 'use_adx': True, 'use_ema': False, 'use_spike': False, 'rsi_required': False, 'edge_k': 1.5187581949075264, 'edge_cap': 0.37400239962161186, 'bull_strategy': 'mean_reversion', 'bull_bb_std_mult': 1.8665311470010706, 'bull_rsi_os': 45, 'bull_rsi_ob': 81, 'bull_adx_thresh': 20.45915952393027, 'bull_atr_min_pct': 0.019983934221191567, 'bull_atr_max_pct': 0.12805432856036117, 'bull_tp_mult': 2.2936496539010394, 'bull_tsl_mult': 0.05897508228941056, 'bull_time_stop': 279, 'bull_use_sma': False, 'bull_use_ema': True, 'bull_use_atr': True, 'bull_use_adx': True, 'bull_use_spike': False, 'bull_rsi_required': False, 'bear_strategy': 'mean_reversion', 'bear_bb_std_mult': 2.0247618422592444, 'bear_rsi_os': 12, 'bear_rsi_ob': 75, 'bear_adx_thresh': 7.034090209040082, 'bear_atr_min_pct': 0.021077082670137363, 'bear_atr_max_pct': 0.06437304327407545, 'bear_tp_mult': 2.146660238302486, 'bear_tsl_mult': 0.9706703951165137, 'bear_time_stop': 199, 'bear_use_sma': True, 'bear_use_ema': False, 'bear_use_atr': False, 'bear_use_adx': True, 'bear_use_spike': True, 'bear_rsi_required': True, 'sideways_strategy': 'mean_reversion', 'sideways_bb_std_mult': 1.9964603786498856, 'sideways_rsi_os': 28, 'sideways_rsi_ob': 86, 'sideways_adx_thresh': 33.21115871365405, 'sideways_atr_min_pct': 0.0012397744564821046, 'sideways_atr_max_pct': 0.11613357975924941, 'sideways_tp_mult': 1.449459401501383, 'sideways_tsl_mult': 0.9522811647834055, 'sideways_time_stop': 200, 'sideways_use_sma': True, 'sideways_use_ema': False, 'sideways_use_atr': False, 'sideways_use_adx': False, 'sideways_use_spike': True, 'sideways_rsi_required': True}.
[I 2025-08-30 16:42:48,253] Trial 503 finished with values: [-1000000000.0, 1000000000.0] and parameters: {'p_sma': 9, 'p_std': 34, 'p_atr': 23, 'p_adx': 7, 'rsi_period': 62, 'ema1': 26, 'ema2': 48, 'slip_atr_k': 0.02042982679233326, 'slip_spread_k': 0.7509951507928163, 'spread_hl_frac': 0.01657391346518383, 'bb_std_mult': 3.0705659958304743, 'rsi_os': 47, 'rsi_ob': 87, 'vol_spike': 0.21320367508675525, 'adx_thresh': 19.625915390987846, 'atr_min_pct': 0.0036114408074818145, 'atr_max_pct': 0.058136786375659166, 'tp_mult': 2.7980682165217665, 'tsl_mult': 0.46675376209451563, 'strategy': 'breakout', 'time_stop': 131, 'use_sma': False, 'use_atr': True, 'use_adx': False, 'use_ema': False, 'use_spike': True, 'rsi_required': True, 'edge_k': 1.5244978403549083, 'edge_cap': 0.5749085292395677, 'bull_strategy': 'mean_reversion', 'bull_bb_std_mult': 2.0003346095594825, 'bull_rsi_os': 10, 'bull_rsi_ob': 50, 'bull_adx_thresh': 10.472497214961784, 'bull_atr_min_pct': 0.021253987831837875, 'bull_atr_max_pct': 0.10778049082007632, 'bull_tp_mult': 1.3175046362590612, 'bull_tsl_mult': 0.07042921482634046, 'bull_time_stop': 79, 'bull_use_sma': False, 'bull_use_ema': True, 'bull_use_atr': True, 'bull_use_adx': False, 'bull_use_spike': True, 'bull_rsi_required': True, 'bear_strategy': 'mean_reversion', 'bear_bb_std_mult': 1.9926418968210773, 'bear_rsi_os': 29, 'bear_rsi_ob': 74, 'bear_adx_thresh': 13.477140665523727, 'bear_atr_min_pct': 0.021017736990200358, 'bear_atr_max_pct': 0.06364584104846904, 'bear_tp_mult': 2.9502938579554083, 'bear_tsl_mult': 0.7055408228035764, 'bear_time_stop': 246, 'bear_use_sma': True, 'bear_use_ema': True, 'bear_use_atr': False, 'bear_use_adx': False, 'bear_use_spike': False, 'bear_rsi_required': False, 'sideways_strategy': 'breakout', 'sideways_bb_std_mult': 1.929634324409105, 'sideways_rsi_os': 14, 'sideways_rsi_ob': 91, 'sideways_adx_thresh': 30.85490819839127, 'sideways_atr_min_pct': 0.0020699757231703725, 'sideways_atr_max_pct': 0.1395561119764916, 'sideways_tp_mult': 1.4511649067958785, 'sideways_tsl_mult': 0.4297359468382706, 'sideways_time_stop': 201, 'sideways_use_sma': True, 'sideways_use_ema': False, 'sideways_use_atr': True, 'sideways_use_adx': False, 'sideways_use_spike': False, 'sideways_rsi_required': True}.
[I 2025-08-30 16:42:50,771] Trial 502 finished with values: [-1000000000.0, 1000000000.0] and parameters: {'p_sma': 10, 'p_std': 57, 'p_atr': 26, 'p_adx': 25, 'rsi_period': 59, 'ema1': 17, 'ema2': 43, 'slip_atr_k': 0.24732141883383504, 'slip_spread_k': 0.6285043391827511, 'spread_hl_frac': 0.01663504771365822, 'bb_std_mult': 3.0837142757819196, 'rsi_os': 34, 'rsi_ob': 87, 'vol_spike': 0.005801180490256176, 'adx_thresh': 17.428422739024732, 'atr_min_pct': 0.020434276077742116, 'atr_max_pct': 0.05901436246483425, 'tp_mult': 2.002735400945423, 'tsl_mult': 0.46346446580355477, 'strategy': 'breakout', 'time_stop': 36, 'use_sma': False, 'use_atr': True, 'use_adx': False, 'use_ema': False, 'use_spike': True, 'rsi_required': True, 'edge_k': 1.2958417156974595, 'edge_cap': 0.377239496637723, 'bull_strategy': 'mean_reversion', 'bull_bb_std_mult': 3.1774946601537595, 'bull_rsi_os': 10, 'bull_rsi_ob': 52, 'bull_adx_thresh': 20.507711084923027, 'bull_atr_min_pct': 0.021442828469431276, 'bull_atr_max_pct': 0.1276266981831867, 'bull_tp_mult': 1.0504382153050966, 'bull_tsl_mult': 0.28356673592448, 'bull_time_stop': 79, 'bull_use_sma': False, 'bull_use_ema': True, 'bull_use_atr': True, 'bull_use_adx': False, 'bull_use_spike': True, 'bull_rsi_required': True, 'bear_strategy': 'mean_reversion', 'bear_bb_std_mult': 0.901877807645926, 'bear_rsi_os': 12, 'bear_rsi_ob': 88, 'bear_adx_thresh': 21.789831573745552, 'bear_atr_min_pct': 0.021090143346531007, 'bear_atr_max_pct': 0.029379304616939883, 'bear_tp_mult': 2.125538985930617, 'bear_tsl_mult': 0.641343121055175, 'bear_time_stop': 117, 'bear_use_sma': True, 'bear_use_ema': True, 'bear_use_atr': False, 'bear_use_adx': False, 'bear_use_spike': False, 'bear_rsi_required': False, 'sideways_strategy': 'breakout', 'sideways_bb_std_mult': 2.0176773233322107, 'sideways_rsi_os': 28, 'sideways_rsi_ob': 93, 'sideways_adx_thresh': 17.344753556543083, 'sideways_atr_min_pct': 0.0006060057703606625, 'sideways_atr_max_pct': 0.1403437150711521, 'sideways_tp_mult': 1.4626454382778227, 'sideways_tsl_mult': 0.3903865777666427, 'sideways_time_stop': 118, 'sideways_use_sma': True, 'sideways_use_ema': False, 'sideways_use_atr': True, 'sideways_use_adx': False, 'sideways_use_spike': False, 'sideways_rsi_required': True}.
[I 2025-08-30 16:42:50,799] Trial 501 finished with values: [-1000000000.0, 1000000000.0] and parameters: {'p_sma': 60, 'p_std': 57, 'p_atr': 23, 'p_adx': 7, 'rsi_period': 62, 'ema1': 25, 'ema2': 46, 'slip_atr_k': 0.24986356144492083, 'slip_spread_k': 0.5932981953617248, 'spread_hl_frac': 0.0324557877135576, 'bb_std_mult': 3.154279499378507, 'rsi_os': 20, 'rsi_ob': 87, 'vol_spike': 0.011087807164709267, 'adx_thresh': 14.400156534641885, 'atr_min_pct': 0.02041635252356142, 'atr_max_pct': 0.05825705915266424, 'tp_mult': 2.557384790985023, 'tsl_mult': 0.9124836117264772, 'strategy': 'breakout', 'time_stop': 37, 'use_sma': False, 'use_atr': True, 'use_adx': False, 'use_ema': False, 'use_spike': True, 'rsi_required': True, 'edge_k': 1.532258258354897, 'edge_cap': 0.6197227733364403, 'bull_strategy': 'mean_reversion', 'bull_bb_std_mult': 2.5875636879088644, 'bull_rsi_os': 10, 'bull_rsi_ob': 80, 'bull_adx_thresh': 20.484414930235474, 'bull_atr_min_pct': 0.021243952181781663, 'bull_atr_max_pct': 0.1234019279333321, 'bull_tp_mult': 1.158313030831337, 'bull_tsl_mult': 0.8269049452398612, 'bull_time_stop': 66, 'bull_use_sma': False, 'bull_use_ema': True, 'bull_use_atr': True, 'bull_use_adx': False, 'bull_use_spike': True, 'bull_rsi_required': False, 'bear_strategy': 'mean_reversion', 'bear_bb_std_mult': 2.012382365879907, 'bear_rsi_os': 12, 'bear_rsi_ob': 64, 'bear_adx_thresh': 33.79851659920189, 'bear_atr_min_pct': 0.021254005405966194, 'bear_atr_max_pct': 0.08329560916422724, 'bear_tp_mult': 2.4887064058678785, 'bear_tsl_mult': 0.6419079884167309, 'bear_time_stop': 207, 'bear_use_sma': True, 'bear_use_ema': False, 'bear_use_atr': False, 'bear_use_adx': False, 'bear_use_spike': False, 'bear_rsi_required': False, 'sideways_strategy': 'breakout', 'sideways_bb_std_mult': 2.054313668573388, 'sideways_rsi_os': 28, 'sideways_rsi_ob': 86, 'sideways_adx_thresh': 25.801081972162958, 'sideways_atr_min_pct': 0.002098971992011413, 'sideways_atr_max_pct': 0.13984625599794434, 'sideways_tp_mult': 1.5708455964494838, 'sideways_tsl_mult': 0.9544606484383439, 'sideways_time_stop': 201, 'sideways_use_sma': True, 'sideways_use_ema': False, 'sideways_use_atr': True, 'sideways_use_adx': False, 'sideways_use_spike': False, 'sideways_rsi_required': True}.
