[I 2025-08-30 15:38:01,822] Trial 144 finished with values: [-1000000000.0, 1000000000.0] and parameters: {'p_sma': 25, 'p_std': 51, 'p_atr': 23, 'p_adx': 28, 'rsi_period': 84, 'ema1': 19, 'ema2': 28, 'slip_atr_k': 0.015819035738572643, 'slip_spread_k': 0.9384296542275218, 'spread_hl_frac': 0.04188863602982353, 'bb_std_mult': 2.9982116388978812, 'rsi_os': 14, 'rsi_ob': 53, 'vol_spike': 0.2872997792960898, 'adx_thresh': 6.409809163001642, 'atr_min_pct': 0.02775346185870707, 'atr_max_pct': 0.1499153860977328, 'tp_mult': 1.4308320863599435, 'tsl_mult': 0.5751434613169177, 'strategy': 'breakout', 'time_stop': 224, 'use_sma': False, 'use_atr': False, 'use_adx': False, 'use_ema': False, 'use_spike': False, 'rsi_required': True, 'edge_k': 0.46696749172536317, 'edge_cap': 0.05209803027936641, 'bull_strategy': 'breakout', 'bull_bb_std_mult': 1.367989037025521, 'bull_rsi_os': 31, 'bull_rsi_ob': 91, 'bull_adx_thresh': 32.49489959244283, 'bull_atr_min_pct': 0.02385990642264681, 'bull_atr_max_pct': 0.07841193697832129, 'bull_tp_mult': 2.525851637211618, 'bull_tsl_mult': 0.2817027845922735, 'bull_time_stop': 83, 'bull_use_sma': False, 'bull_use_ema': True, 'bull_use_atr': True, 'bull_use_adx': False, 'bull_use_spike': False, 'bull_rsi_required': True, 'bear_strategy': 'mean_reversion', 'bear_bb_std_mult': 3.048772386659998, 'bear_rsi_os': 42, 'bear_rsi_ob': 92, 'bear_adx_thresh': 6.241099937821673, 'bear_atr_min_pct': 0.023675031064224673, 'bear_atr_max_pct': 0.10952439414213279, 'bear_tp_mult': 2.440143304624247, 'bear_tsl_mult': 0.38641639201213446, 'bear_time_stop': 257, 'bear_use_sma': False, 'bear_use_ema': False, 'bear_use_atr': True, 'bear_use_adx': False, 'bear_use_spike': False, 'bear_rsi_required': False, 'sideways_strategy': 'breakout', 'sideways_bb_std_mult': 3.11580160020124, 'sideways_rsi_os': 52, 'sideways_rsi_ob': 79, 'sideways_adx_thresh': 19.740278030340715, 'sideways_atr_min_pct': 0.00874353292249927, 'sideways_atr_max_pct': 0.07305738482001395, 'sideways_tp_mult': 1.8920569671938492, 'sideways_tsl_mult': 0.9753310131457651, 'sideways_time_stop': 45, 'sideways_use_sma': True, 'sideways_use_ema': True, 'sideways_use_atr': False, 'sideways_use_adx': False, 'sideways_use_spike': False, 'sideways_rsi_required': False}.
[I 2025-08-30 15:38:02,269] Trial 143 finished with values: [-1000000000.0, 1000000000.0] and parameters: {'p_sma': 25, 'p_std': 9, 'p_atr': 20, 'p_adx': 12, 'rsi_period': 64, 'ema1': 17, 'ema2': 28, 'slip_atr_k': 0.016670852099595748, 'slip_spread_k': 0.9372022395957424, 'spread_hl_frac': 0.04192280514304791, 'bb_std_mult': 3.0349122462045957, 'rsi_os': 39, 'rsi_ob': 53, 'vol_spike': 0.1754760983843707, 'adx_thresh': 8.331891407853217, 'atr_min_pct': 0.004684866467686816, 'atr_max_pct': 0.14270618672759688, 'tp_mult': 1.4302813645433738, 'tsl_mult': 0.5743838498901578, 'strategy': 'breakout', 'time_stop': 203, 'use_sma': False, 'use_atr': False, 'use_adx': False, 'use_ema': False, 'use_spike': False, 'rsi_required': True, 'edge_k': 0.17241856272102252, 'edge_cap': 0.07380988716248171, 'bull_strategy': 'breakout', 'bull_bb_std_mult': 0.7468789167725753, 'bull_rsi_os': 33, 'bull_rsi_ob': 89, 'bull_adx_thresh': 32.52336095626853, 'bull_atr_min_pct': 0.01914739200103103, 'bull_atr_max_pct': 0.07934212309734526, 'bull_tp_mult': 2.5690969486885935, 'bull_tsl_mult': 0.2816146001357967, 'bull_time_stop': 26, 'bull_use_sma': False, 'bull_use_ema': True, 'bull_use_atr': True, 'bull_use_adx': False, 'bull_use_spike': False, 'bull_rsi_required': True, 'bear_strategy': 'mean_reversion', 'bear_bb_std_mult': 2.002463703258338, 'bear_rsi_os': 5, 'bear_rsi_ob': 92, 'bear_adx_thresh': 5.017712930515172, 'bear_atr_min_pct': 0.0029032190630044665, 'bear_atr_max_pct': 0.10958746922536486, 'bear_tp_mult': 2.689316883185505, 'bear_tsl_mult': 0.5810233857840741, 'bear_time_stop': 116, 'bear_use_sma': True, 'bear_use_ema': False, 'bear_use_atr': True, 'bear_use_adx': False, 'bear_use_spike': False, 'bear_rsi_required': False, 'sideways_strategy': 'breakout', 'sideways_bb_std_mult': 0.8207761768603707, 'sideways_rsi_os': 15, 'sideways_rsi_ob': 56, 'sideways_adx_thresh': 19.843754932120746, 'sideways_atr_min_pct': 0.00911277207090096, 'sideways_atr_max_pct': 0.06579837885614041, 'sideways_tp_mult': 2.685508542510504, 'sideways_tsl_mult': 0.47822388414368855, 'sideways_time_stop': 45, 'sideways_use_sma': True, 'sideways_use_ema': True, 'sideways_use_atr': False, 'sideways_use_adx': False, 'sideways_use_spike': False, 'sideways_rsi_required': False}.
[I 2025-08-30 15:38:02,474] Trial 146 finished with values: [-1000000000.0, 1000000000.0] and parameters: {'p_sma': 13, 'p_std': 14, 'p_atr': 22, 'p_adx': 17, 'rsi_period': 53, 'ema1': 26, 'ema2': 39, 'slip_atr_k': 0.01662250388718771, 'slip_spread_k': 0.09502368519249177, 'spread_hl_frac': 0.04870422002469249, 'bb_std_mult': 2.95139766039644, 'rsi_os': 36, 'rsi_ob': 80, 'vol_spike': 0.29250560951974236, 'adx_thresh': 22.479227378682793, 'atr_min_pct': 0.007992029658955166, 'atr_max_pct': 0.14477781627246342, 'tp_mult': 1.0697813653533186, 'tsl_mult': 0.602903148525614, 'strategy': 'mean_reversion', 'time_stop': 253, 'use_sma': False, 'use_atr': True, 'use_adx': False, 'use_ema': False, 'use_spike': True, 'rsi_required': False, 'edge_k': 0.3920214686987001, 'edge_cap': 0.4239578568662534, 'bull_strategy': 'breakout', 'bull_bb_std_mult': 1.355925532921983, 'bull_rsi_os': 23, 'bull_rsi_ob': 88, 'bull_adx_thresh': 32.45329346622275, 'bull_atr_min_pct': 0.0011692688566309673, 'bull_atr_max_pct': 0.032698944173242095, 'bull_tp_mult': 2.180857717765294, 'bull_tsl_mult': 0.28787347987409756, 'bull_time_stop': 66, 'bull_use_sma': True, 'bull_use_ema': True, 'bull_use_atr': False, 'bull_use_adx': True, 'bull_use_spike': False, 'bull_rsi_required': True, 'bear_strategy': 'mean_reversion', 'bear_bb_std_mult': 2.340412193070566, 'bear_rsi_os': 46, 'bear_rsi_ob': 80, 'bear_adx_thresh': 13.458084154683574, 'bear_atr_min_pct': 0.02638172890200071, 'bear_atr_max_pct': 0.08479807550075859, 'bear_tp_mult': 2.5331358065884735, 'bear_tsl_mult': 0.5870431134588426, 'bear_time_stop': 265, 'bear_use_sma': False, 'bear_use_ema': False, 'bear_use_atr': True, 'bear_use_adx': False, 'bear_use_spike': True, 'bear_rsi_required': False, 'sideways_strategy': 'breakout', 'sideways_bb_std_mult': 1.904797072966097, 'sideways_rsi_os': 30, 'sideways_rsi_ob': 93, 'sideways_adx_thresh': 16.783488932041394, 'sideways_atr_min_pct': 0.0029697249042575837, 'sideways_atr_max_pct': 0.10716100831792576, 'sideways_tp_mult': 2.6848007460103274, 'sideways_tsl_mult': 0.7957176631654315, 'sideways_time_stop': 236, 'sideways_use_sma': True, 'sideways_use_ema': True, 'sideways_use_atr': False, 'sideways_use_adx': True, 'sideways_use_spike': False, 'sideways_rsi_required': False}.
[I 2025-08-30 15:38:53,540] Trial 150 finished with values: [-1000000000.0, 1000000000.0] and parameters: {'p_sma': 21, 'p_std': 19, 'p_atr': 23, 'p_adx': 17, 'rsi_period': 44, 'ema1': 24, 'ema2': 33, 'slip_atr_k': 0.010060566839883508, 'slip_spread_k': 0.002211611749824108, 'spread_hl_frac': 0.04988040252254108, 'bb_std_mult': 2.8198358091299056, 'rsi_os': 42, 'rsi_ob': 58, 'vol_spike': 0.283043465010811, 'adx_thresh': 24.26821728983573, 'atr_min_pct': 0.008747406861486428, 'atr_max_pct': 0.13936991886890143, 'tp_mult': 1.0937943343568992, 'tsl_mult': 0.4069864454389678, 'strategy': 'breakout', 'time_stop': 269, 'use_sma': False, 'use_atr': True, 'use_adx': False, 'use_ema': False, 'use_spike': True, 'rsi_required': False, 'edge_k': 0.3419379641341919, 'edge_cap': 0.6966106251088912, 'bull_strategy': 'mean_reversion', 'bull_bb_std_mult': 1.5034662169610322, 'bull_rsi_os': 23, 'bull_rsi_ob': 68, 'bull_adx_thresh': 33.31601274067668, 'bull_atr_min_pct': 0.0015621892026043145, 'bull_atr_max_pct': 0.06243652850492465, 'bull_tp_mult': 2.575879121456055, 'bull_tsl_mult': 0.9986664957296688, 'bull_time_stop': 77, 'bull_use_sma': True, 'bull_use_ema': True, 'bull_use_atr': False, 'bull_use_adx': False, 'bull_use_spike': True, 'bull_rsi_required': True, 'bear_strategy': 'mean_reversion', 'bear_bb_std_mult': 2.3829737528892125, 'bear_rsi_os': 50, 'bear_rsi_ob': 81, 'bear_adx_thresh': 10.931404651556539, 'bear_atr_min_pct': 0.02465894299450102, 'bear_atr_max_pct': 0.08083629530160161, 'bear_tp_mult': 2.147631366583388, 'bear_tsl_mult': 0.45396711900878944, 'bear_time_stop': 275, 'bear_use_sma': False, 'bear_use_ema': False, 'bear_use_atr': False, 'bear_use_adx': False, 'bear_use_spike': True, 'bear_rsi_required': False, 'sideways_strategy': 'mean_reversion', 'sideways_bb_std_mult': 3.2495679152028094, 'sideways_rsi_os': 28, 'sideways_rsi_ob': 89, 'sideways_adx_thresh': 15.64466512594685, 'sideways_atr_min_pct': 0.0017500294888237288, 'sideways_atr_max_pct': 0.10332192938252223, 'sideways_tp_mult': 2.8008104672672474, 'sideways_tsl_mult': 0.9182319579008466, 'sideways_time_stop': 225, 'sideways_use_sma': True, 'sideways_use_ema': False, 'sideways_use_atr': False, 'sideways_use_adx': True, 'sideways_use_spike': True, 'sideways_rsi_required': False}.
[I 2025-08-30 15:38:53,557] Trial 147 finished with values: [-1000000000.0, 1000000000.0] and parameters: {'p_sma': 21, 'p_std': 19, 'p_atr': 22, 'p_adx': 16, 'rsi_period': 53, 'ema1': 24, 'ema2': 33, 'slip_atr_k': 0.015131351896841961, 'slip_spread_k': 0.10463116752436175, 'spread_hl_frac': 0.04987232042721042, 'bb_std_mult': 2.9100823663162956, 'rsi_os': 39, 'rsi_ob': 80, 'vol_spike': 0.17710013097858748, 'adx_thresh': 22.672976322597986, 'atr_min_pct': 0.007591594217348627, 'atr_max_pct': 0.14618399367951646, 'tp_mult': 1.1193429997125606, 'tsl_mult': 0.5733564222893291, 'strategy': 'breakout', 'time_stop': 251, 'use_sma': False, 'use_atr': True, 'use_adx': False, 'use_ema': False, 'use_spike': True, 'rsi_required': False, 'edge_k': 0.40422019984170443, 'edge_cap': 0.6997892454582978, 'bull_strategy': 'breakout', 'bull_bb_std_mult': 1.38372186970169, 'bull_rsi_os': 23, 'bull_rsi_ob': 72, 'bull_adx_thresh': 32.519558176092936, 'bull_atr_min_pct': 0.0016368245700322135, 'bull_atr_max_pct': 0.06129166973472124, 'bull_tp_mult': 2.5437779136673697, 'bull_tsl_mult': 0.28759860269357546, 'bull_time_stop': 67, 'bull_use_sma': True, 'bull_use_ema': True, 'bull_use_atr': False, 'bull_use_adx': False, 'bull_use_spike': False, 'bull_rsi_required': True, 'bear_strategy': 'mean_reversion', 'bear_bb_std_mult': 2.592452757789857, 'bear_rsi_os': 47, 'bear_rsi_ob': 81, 'bear_adx_thresh': 11.091367665533166, 'bear_atr_min_pct': 0.0267009996365436, 'bear_atr_max_pct': 0.08193886066448824, 'bear_tp_mult': 2.4331979429750104, 'bear_tsl_mult': 0.45041854872014264, 'bear_time_stop': 262, 'bear_use_sma': False, 'bear_use_ema': False, 'bear_use_atr': True, 'bear_use_adx': False, 'bear_use_spike': True, 'bear_rsi_required': False, 'sideways_strategy': 'breakout', 'sideways_bb_std_mult': 3.1627651455845, 'sideways_rsi_os': 29, 'sideways_rsi_ob': 94, 'sideways_adx_thresh': 14.50532444713463, 'sideways_atr_min_pct': 0.001881471510146832, 'sideways_atr_max_pct': 0.10654549593422703, 'sideways_tp_mult': 2.7829791133805983, 'sideways_tsl_mult': 0.9676505922079102, 'sideways_time_stop': 239, 'sideways_use_sma': True, 'sideways_use_ema': True, 'sideways_use_atr': False, 'sideways_use_adx': True, 'sideways_use_spike': False, 'sideways_rsi_required': False}.
[I 2025-08-30 15:38:53,870] Trial 148 finished with values: [-0.011719403516970539, 0.011709492838679253] and parameters: {'p_sma': 19, 'p_std': 19, 'p_atr': 22, 'p_adx': 17, 'rsi_period': 41, 'ema1': 24, 'ema2': 33, 'slip_atr_k': 0.018377362995502994, 'slip_spread_k': 0.019756743094908602, 'spread_hl_frac': 0.04996485246026334, 'bb_std_mult': 2.879027735575503, 'rsi_os': 39, 'rsi_ob': 80, 'vol_spike': 0.012771933045553435, 'adx_thresh': 22.557056575585506, 'atr_min_pct': 0.007724180911853834, 'atr_max_pct': 0.1449145457515931, 'tp_mult': 1.0928118049206728, 'tsl_mult': 0.5148664628077436, 'strategy': 'breakout', 'time_stop': 261, 'use_sma': False, 'use_atr': True, 'use_adx': False, 'use_ema': False, 'use_spike': True, 'rsi_required': False, 'edge_k': 0.3060803266062938, 'edge_cap': 0.696790783756829, 'bull_strategy': 'breakout', 'bull_bb_std_mult': 1.501096595465812, 'bull_rsi_os': 23, 'bull_rsi_ob': 79, 'bull_adx_thresh': 32.86840479062143, 'bull_atr_min_pct': 0.001331526487819402, 'bull_atr_max_pct': 0.06052571417130724, 'bull_tp_mult': 2.595109174750485, 'bull_tsl_mult': 0.31361458692438027, 'bull_time_stop': 67, 'bull_use_sma': True, 'bull_use_ema': True, 'bull_use_atr': False, 'bull_use_adx': False, 'bull_use_spike': False, 'bull_rsi_required': True, 'bear_strategy': 'mean_reversion', 'bear_bb_std_mult': 2.3385181193804643, 'bear_rsi_os': 50, 'bear_rsi_ob': 81, 'bear_adx_thresh': 11.12534037539539, 'bear_atr_min_pct': 0.026605391249237925, 'bear_atr_max_pct': 0.08371900010336623, 'bear_tp_mult': 2.1455600557051557, 'bear_tsl_mult': 0.5827729649836791, 'bear_time_stop': 264, 'bear_use_sma': False, 'bear_use_ema': False, 'bear_use_atr': True, 'bear_use_adx': False, 'bear_use_spike': True, 'bear_rsi_required': False, 'sideways_strategy': 'breakout', 'sideways_bb_std_mult': 3.2488860961798203, 'sideways_rsi_os': 29, 'sideways_rsi_ob': 93, 'sideways_adx_thresh': 16.070405906532994, 'sideways_atr_min_pct': 0.0015250450741508721, 'sideways_atr_max_pct': 0.09463058113862828, 'sideways_tp_mult': 2.8026288441246545, 'sideways_tsl_mult': 0.916067238156188, 'sideways_time_stop': 239, 'sideways_use_sma': True, 'sideways_use_ema': True, 'sideways_use_atr': False, 'sideways_use_adx': True, 'sideways_use_spike': False, 'sideways_rsi_required': False}.
[I 2025-08-30 15:38:54,704] Trial 149 finished with values: [-0.01374501260960792, 0.013734907938590859] and parameters: {'p_sma': 21, 'p_std': 20, 'p_atr': 22, 'p_adx': 16, 'rsi_period': 40, 'ema1': 24, 'ema2': 35, 'slip_atr_k': 0.01161351865368819, 'slip_spread_k': 0.10128212845965417, 'spread_hl_frac': 0.049925603579451215, 'bb_std_mult': 2.8991965537268047, 'rsi_os': 39, 'rsi_ob': 80, 'vol_spike': 0.2907344178557845, 'adx_thresh': 22.819186495987264, 'atr_min_pct': 0.007868077431345167, 'atr_max_pct': 0.14635798632825825, 'tp_mult': 1.0886173969460653, 'tsl_mult': 0.6099951531554281, 'strategy': 'breakout', 'time_stop': 254, 'use_sma': False, 'use_atr': True, 'use_adx': False, 'use_ema': False, 'use_spike': True, 'rsi_required': False, 'edge_k': 0.3917573036950902, 'edge_cap': 0.765120261342645, 'bull_strategy': 'breakout', 'bull_bb_std_mult': 1.5167113492865176, 'bull_rsi_os': 23, 'bull_rsi_ob': 79, 'bull_adx_thresh': 33.29464992172556, 'bull_atr_min_pct': 0.0014159977519584612, 'bull_atr_max_pct': 0.06938808537264493, 'bull_tp_mult': 2.435623094672401, 'bull_tsl_mult': 0.31470970697660505, 'bull_time_stop': 65, 'bull_use_sma': True, 'bull_use_ema': True, 'bull_use_atr': False, 'bull_use_adx': False, 'bull_use_spike': False, 'bull_rsi_required': True, 'bear_strategy': 'mean_reversion', 'bear_bb_std_mult': 2.5999940686473524, 'bear_rsi_os': 50, 'bear_rsi_ob': 81, 'bear_adx_thresh': 10.892029580058892, 'bear_atr_min_pct': 0.02674770964182907, 'bear_atr_max_pct': 0.07978770149416466, 'bear_tp_mult': 2.4169542415550125, 'bear_tsl_mult': 0.45207225440970905, 'bear_time_stop': 262, 'bear_use_sma': False, 'bear_use_ema': False, 'bear_use_atr': True, 'bear_use_adx': False, 'bear_use_spike': True, 'bear_rsi_required': False, 'sideways_strategy': 'breakout', 'sideways_bb_std_mult': 3.233532826436281, 'sideways_rsi_os': 29, 'sideways_rsi_ob': 93, 'sideways_adx_thresh': 16.064311970087065, 'sideways_atr_min_pct': 0.001457445013585038, 'sideways_atr_max_pct': 0.1020131270392915, 'sideways_tp_mult': 2.8485356627982226, 'sideways_tsl_mult': 0.9095036916840638, 'sideways_time_stop': 237, 'sideways_use_sma': True, 'sideways_use_ema': True, 'sideways_use_atr': False, 'sideways_use_adx': True, 'sideways_use_spike': False, 'sideways_rsi_required': False}.
[I 2025-08-30 15:39:41,404] Trial 154 finished with values: [-0.02084437471821543, 0.0208069399765969] and parameters: {'p_sma': 19, 'p_std': 17, 'p_atr': 22, 'p_adx': 17, 'rsi_period': 41, 'ema1': 22, 'ema2': 43, 'slip_atr_k': 0.022931890664680262, 'slip_spread_k': 0.038541934455883164, 'spread_hl_frac': 0.048983375798870896, 'bb_std_mult': 2.6535569863764796, 'rsi_os': 40, 'rsi_ob': 77, 'vol_spike': 0.008299409739413434, 'adx_thresh': 21.78856667512426, 'atr_min_pct': 0.007487494385230648, 'atr_max_pct': 0.13553222226698802, 'tp_mult': 1.2703355650957295, 'tsl_mult': 0.5309919336819906, 'strategy': 'breakout', 'time_stop': 263, 'use_sma': False, 'use_atr': True, 'use_adx': False, 'use_ema': True, 'use_spike': True, 'rsi_required': False, 'edge_k': 0.12080569222691628, 'edge_cap': 0.6750936080411203, 'bull_strategy': 'breakout', 'bull_bb_std_mult': 1.5635278355208309, 'bull_rsi_os': 21, 'bull_rsi_ob': 79, 'bull_adx_thresh': 34.12192737195356, 'bull_atr_min_pct': 4.1633379676997645e-05, 'bull_atr_max_pct': 0.06605754954827125, 'bull_tp_mult': 2.6324670419079683, 'bull_tsl_mult': 0.31042339134709784, 'bull_time_stop': 56, 'bull_use_sma': True, 'bull_use_ema': True, 'bull_use_atr': False, 'bull_use_adx': False, 'bull_use_spike': False, 'bull_rsi_required': True, 'bear_strategy': 'breakout', 'bear_bb_std_mult': 2.4533883004661545, 'bear_rsi_os': 53, 'bear_rsi_ob': 79, 'bear_adx_thresh': 8.767254812719592, 'bear_atr_min_pct': 0.026950563156483323, 'bear_atr_max_pct': 0.08921246269043126, 'bear_tp_mult': 2.0509313097850392, 'bear_tsl_mult': 0.541826928595991, 'bear_time_stop': 281, 'bear_use_sma': False, 'bear_use_ema': False, 'bear_use_atr': True, 'bear_use_adx': True, 'bear_use_spike': True, 'bear_rsi_required': True, 'sideways_strategy': 'breakout', 'sideways_bb_std_mult': 3.245979024331694, 'sideways_rsi_os': 32, 'sideways_rsi_ob': 93, 'sideways_adx_thresh': 16.111534869053433, 'sideways_atr_min_pct': 0.0013963869655777479, 'sideways_atr_max_pct': 0.09552169536808018, 'sideways_tp_mult': 2.857124809709517, 'sideways_tsl_mult': 0.8615329063506796, 'sideways_time_stop': 229, 'sideways_use_sma': True, 'sideways_use_ema': True, 'sideways_use_atr': False, 'sideways_use_adx': True, 'sideways_use_spike': False, 'sideways_rsi_required': False}.
[I 2025-08-30 15:39:42,086] Trial 152 finished with values: [-0.014364066942240572, 0.01441491348711041] and parameters: {'p_sma': 19, 'p_std': 17, 'p_atr': 22, 'p_adx': 16, 'rsi_period': 44, 'ema1': 23, 'ema2': 35, 'slip_atr_k': 0.02172192284812718, 'slip_spread_k': 0.026517963602090328, 'spread_hl_frac': 0.0492468927697609, 'bb_std_mult': 2.487195695867693, 'rsi_os': 40, 'rsi_ob': 81, 'vol_spike': 0.0007260774120835811, 'adx_thresh': 24.043794963608498, 'atr_min_pct': 0.006368636162447776, 'atr_max_pct': 0.14710533409023216, 'tp_mult': 1.205660517763806, 'tsl_mult': 0.5327893512676987, 'strategy': 'breakout', 'time_stop': 265, 'use_sma': False, 'use_atr': True, 'use_adx': False, 'use_ema': True, 'use_spike': True, 'rsi_required': False, 'edge_k': 0.30895028969953003, 'edge_cap': 0.7523348524270951, 'bull_strategy': 'breakout', 'bull_bb_std_mult': 1.2114463197627119, 'bull_rsi_os': 25, 'bull_rsi_ob': 77, 'bull_adx_thresh': 34.36483359893614, 'bull_atr_min_pct': 3.635976180142654e-05, 'bull_atr_max_pct': 0.0669198590610589, 'bull_tp_mult': 2.422222699369033, 'bull_tsl_mult': 0.3030071300085478, 'bull_time_stop': 90, 'bull_use_sma': True, 'bull_use_ema': True, 'bull_use_atr': False, 'bull_use_adx': False, 'bull_use_spike': False, 'bull_rsi_required': True, 'bear_strategy': 'breakout', 'bear_bb_std_mult': 2.6298513592693467, 'bear_rsi_os': 53, 'bear_rsi_ob': 79, 'bear_adx_thresh': 9.685583272882726, 'bear_atr_min_pct': 0.025348170929074213, 'bear_atr_max_pct': 0.07343523770004189, 'bear_tp_mult': 2.1954109027712505, 'bear_tsl_mult': 0.544193891199277, 'bear_time_stop': 252, 'bear_use_sma': False, 'bear_use_ema': False, 'bear_use_atr': True, 'bear_use_adx': True, 'bear_use_spike': True, 'bear_rsi_required': True, 'sideways_strategy': 'breakout', 'sideways_bb_std_mult': 2.921591132441937, 'sideways_rsi_os': 32, 'sideways_rsi_ob': 95, 'sideways_adx_thresh': 16.124848689342798, 'sideways_atr_min_pct': 0.0024776343423633137, 'sideways_atr_max_pct': 0.10044881976472883, 'sideways_tp_mult': 2.8323243551741037, 'sideways_tsl_mult': 0.9532478483762282, 'sideways_time_stop': 251, 'sideways_use_sma': True, 'sideways_use_ema': True, 'sideways_use_atr': False, 'sideways_use_adx': True, 'sideways_use_spike': False, 'sideways_rsi_required': True}.
