[I 2025-08-30 17:37:55,575] Trial 829 finished with values: [-1000000000.0, 1000000000.0] and parameters: {'p_sma': 7, 'p_std': 20, 'p_atr': 17, 'p_adx': 7, 'rsi_period': 72, 'ema1': 18, 'ema2': 14, 'slip_atr_k': 0.22921740956209707, 'slip_spread_k': 0.14344106272522894, 'spread_hl_frac': 0.01231960898717543, 'bb_std_mult': 1.8330299103362788, 'rsi_os': 28, 'rsi_ob': 87, 'vol_spike': 0.08979101958544225, 'adx_thresh': 10.996460949158061, 'atr_min_pct': 0.0029854638303924465, 'atr_max_pct': 0.14155709752643109, 'tp_mult': 1.8002167260859436, 'tsl_mult': 0.08105478423624041, 'strategy': 'mean_reversion', 'time_stop': 50, 'use_sma': False, 'use_atr': True, 'use_adx': False, 'use_ema': True, 'use_spike': False, 'rsi_required': True, 'edge_k': 0.41861862524217386, 'edge_cap': 0.9187767103820053, 'bull_strategy': 'mean_reversion', 'bull_bb_std_mult': 0.5070654020263405, 'bull_rsi_os': 33, 'bull_rsi_ob': 53, 'bull_adx_thresh': 34.28537119509781, 'bull_atr_min_pct': 0.022252869652955375, 'bull_atr_max_pct': 0.10597247939821713, 'bull_tp_mult': 2.0790405936356073, 'bull_tsl_mult': 0.7842945419685933, 'bull_time_stop': 96, 'bull_use_sma': True, 'bull_use_ema': False, 'bull_use_atr': False, 'bull_use_adx': True, 'bull_use_spike': False, 'bull_rsi_required': True, 'bear_strategy': 'breakout', 'bear_bb_std_mult': 0.9763439711790125, 'bear_rsi_os': 49, 'bear_rsi_ob': 78, 'bear_adx_thresh': 33.07059937513549, 'bear_atr_min_pct': 0.01957984282518544, 'bear_atr_max_pct': 0.11424734090331116, 'bear_tp_mult': 1.1874404897188184, 'bear_tsl_mult': 0.5914945985673502, 'bear_time_stop': 187, 'bear_use_sma': True, 'bear_use_ema': True, 'bear_use_atr': False, 'bear_use_adx': False, 'bear_use_spike': False, 'bear_rsi_required': False, 'sideways_strategy': 'breakout', 'sideways_bb_std_mult': 0.5001115716274384, 'sideways_rsi_os': 36, 'sideways_rsi_ob': 92, 'sideways_adx_thresh': 13.180567548101312, 'sideways_atr_min_pct': 0.010922712861991094, 'sideways_atr_max_pct': 0.1065474964486246, 'sideways_tp_mult': 1.1142224853103029, 'sideways_tsl_mult': 0.4973501571896816, 'sideways_time_stop': 256, 'sideways_use_sma': True, 'sideways_use_ema': False, 'sideways_use_atr': True, 'sideways_use_adx': True, 'sideways_use_spike': True, 'sideways_rsi_required': False}.
[I 2025-08-30 17:37:55,740] Trial 827 finished with values: [-1000000000.0, 1000000000.0] and parameters: {'p_sma': 60, 'p_std': 30, 'p_atr': 17, 'p_adx': 14, 'rsi_period': 26, 'ema1': 18, 'ema2': 45, 'slip_atr_k': 0.15235422296578213, 'slip_spread_k': 0.1379605228461768, 'spread_hl_frac': 0.016221310392439556, 'bb_std_mult': 3.192260320888901, 'rsi_os': 28, 'rsi_ob': 87, 'vol_spike': 0.09143017224759648, 'adx_thresh': 10.842441081628417, 'atr_min_pct': 0.018010313088612246, 'atr_max_pct': 0.14094701643650945, 'tp_mult': 2.7837604375604936, 'tsl_mult': 0.08300012145472835, 'strategy': 'mean_reversion', 'time_stop': 41, 'use_sma': False, 'use_atr': True, 'use_adx': False, 'use_ema': True, 'use_spike': False, 'rsi_required': True, 'edge_k': 0.7266587063586041, 'edge_cap': 0.8814765424131075, 'bull_strategy': 'mean_reversion', 'bull_bb_std_mult': 1.918508433311377, 'bull_rsi_os': 8, 'bull_rsi_ob': 65, 'bull_adx_thresh': 6.079947555317169, 'bull_atr_min_pct': 0.022344225747108846, 'bull_atr_max_pct': 0.13661943917819083, 'bull_tp_mult': 2.0673557911404106, 'bull_tsl_mult': 0.45838829397036185, 'bull_time_stop': 74, 'bull_use_sma': True, 'bull_use_ema': False, 'bull_use_atr': False, 'bull_use_adx': True, 'bull_use_spike': False, 'bull_rsi_required': True, 'bear_strategy': 'breakout', 'bear_bb_std_mult': 0.8110082127005985, 'bear_rsi_os': 15, 'bear_rsi_ob': 78, 'bear_adx_thresh': 24.155369334881673, 'bear_atr_min_pct': 0.012757915959189169, 'bear_atr_max_pct': 0.11315479055811122, 'bear_tp_mult': 2.226505486005916, 'bear_tsl_mult': 0.5913337183019773, 'bear_time_stop': 9, 'bear_use_sma': True, 'bear_use_ema': True, 'bear_use_atr': False, 'bear_use_adx': False, 'bear_use_spike': False, 'bear_rsi_required': False, 'sideways_strategy': 'breakout', 'sideways_bb_std_mult': 0.8664207132265492, 'sideways_rsi_os': 20, 'sideways_rsi_ob': 91, 'sideways_adx_thresh': 13.601841612029073, 'sideways_atr_min_pct': 0.019616781955569047, 'sideways_atr_max_pct': 0.10697955053487505, 'sideways_tp_mult': 1.252082854384855, 'sideways_tsl_mult': 0.7788991595605477, 'sideways_time_stop': 255, 'sideways_use_sma': True, 'sideways_use_ema': False, 'sideways_use_atr': True, 'sideways_use_adx': True, 'sideways_use_spike': True, 'sideways_rsi_required': False}.
[I 2025-08-30 17:37:56,702] Trial 833 finished with values: [-1000000000.0, 1000000000.0] and parameters: {'p_sma': 9, 'p_std': 22, 'p_atr': 16, 'p_adx': 8, 'rsi_period': 19, 'ema1': 22, 'ema2': 11, 'slip_atr_k': 0.13331566468857917, 'slip_spread_k': 0.38972783683955325, 'spread_hl_frac': 0.017837209505380786, 'bb_std_mult': 3.129860579643129, 'rsi_os': 33, 'rsi_ob': 45, 'vol_spike': 0.032821637497851844, 'adx_thresh': 21.233227286470356, 'atr_min_pct': 0.019603644305775478, 'atr_max_pct': 0.14823577579176417, 'tp_mult': 2.7348462588511793, 'tsl_mult': 0.8768378398748038, 'strategy': 'mean_reversion', 'time_stop': 213, 'use_sma': False, 'use_atr': False, 'use_adx': True, 'use_ema': False, 'use_spike': False, 'rsi_required': False, 'edge_k': 0.6092878914317043, 'edge_cap': 0.7588233263580404, 'bull_strategy': 'mean_reversion', 'bull_bb_std_mult': 1.831943408787193, 'bull_rsi_os': 30, 'bull_rsi_ob': 54, 'bull_adx_thresh': 34.984816476146634, 'bull_atr_min_pct': 0.0020753594449235586, 'bull_atr_max_pct': 0.04578915453769043, 'bull_tp_mult': 2.2687248080763056, 'bull_tsl_mult': 0.8263251208215436, 'bull_time_stop': 263, 'bull_use_sma': True, 'bull_use_ema': True, 'bull_use_atr': False, 'bull_use_adx': False, 'bull_use_spike': True, 'bull_rsi_required': False, 'bear_strategy': 'mean_reversion', 'bear_bb_std_mult': 2.4730751016910335, 'bear_rsi_os': 16, 'bear_rsi_ob': 56, 'bear_adx_thresh': 13.65717769709127, 'bear_atr_min_pct': 0.021791861327473884, 'bear_atr_max_pct': 0.10984468332790663, 'bear_tp_mult': 2.131352314713965, 'bear_tsl_mult': 0.636050098675789, 'bear_time_stop': 198, 'bear_use_sma': False, 'bear_use_ema': False, 'bear_use_atr': False, 'bear_use_adx': True, 'bear_use_spike': True, 'bear_rsi_required': True, 'sideways_strategy': 'breakout', 'sideways_bb_std_mult': 2.7533455182486737, 'sideways_rsi_os': 54, 'sideways_rsi_ob': 81, 'sideways_adx_thresh': 11.166729949219965, 'sideways_atr_min_pct': 0.0005291435601309014, 'sideways_atr_max_pct': 0.10113164190840636, 'sideways_tp_mult': 2.977162179900325, 'sideways_tsl_mult': 0.23970857949669583, 'sideways_time_stop': 269, 'sideways_use_sma': True, 'sideways_use_ema': False, 'sideways_use_atr': False, 'sideways_use_adx': False, 'sideways_use_spike': False, 'sideways_rsi_required': True}.
[I 2025-08-30 17:37:56,729] Trial 831 finished with values: [-1000000000.0, 1000000000.0] and parameters: {'p_sma': 32, 'p_std': 22, 'p_atr': 16, 'p_adx': 14, 'rsi_period': 19, 'ema1': 16, 'ema2': 14, 'slip_atr_k': 0.004641793724502731, 'slip_spread_k': 0.14149606844632623, 'spread_hl_frac': 0.016333975098083434, 'bb_std_mult': 3.229309212414179, 'rsi_os': 31, 'rsi_ob': 50, 'vol_spike': 0.0898303949070971, 'adx_thresh': 9.282532590759779, 'atr_min_pct': 0.019897466156024574, 'atr_max_pct': 0.14760087011870693, 'tp_mult': 2.7172213086923707, 'tsl_mult': 0.8846260038822437, 'strategy': 'mean_reversion', 'time_stop': 21, 'use_sma': False, 'use_atr': True, 'use_adx': True, 'use_ema': False, 'use_spike': False, 'rsi_required': True, 'edge_k': 0.722946273750999, 'edge_cap': 0.744753241347894, 'bull_strategy': 'mean_reversion', 'bull_bb_std_mult': 1.8366550267601478, 'bull_rsi_os': 12, 'bull_rsi_ob': 55, 'bull_adx_thresh': 33.13573959385836, 'bull_atr_min_pct': 0.022324296432821456, 'bull_atr_max_pct': 0.10670492943072715, 'bull_tp_mult': 2.256968670090064, 'bull_tsl_mult': 0.7814789149055831, 'bull_time_stop': 94, 'bull_use_sma': True, 'bull_use_ema': True, 'bull_use_atr': False, 'bull_use_adx': True, 'bull_use_spike': False, 'bull_rsi_required': False, 'bear_strategy': 'mean_reversion', 'bear_bb_std_mult': 0.8060307656965049, 'bear_rsi_os': 17, 'bear_rsi_ob': 75, 'bear_adx_thresh': 25.53655030747277, 'bear_atr_min_pct': 0.021655367878212473, 'bear_atr_max_pct': 0.10995143339373935, 'bear_tp_mult': 2.0005636569175937, 'bear_tsl_mult': 0.585786120812842, 'bear_time_stop': 18, 'bear_use_sma': False, 'bear_use_ema': False, 'bear_use_atr': False, 'bear_use_adx': False, 'bear_use_spike': False, 'bear_rsi_required': False, 'sideways_strategy': 'breakout', 'sideways_bb_std_mult': 2.7375384049658282, 'sideways_rsi_os': 52, 'sideways_rsi_ob': 93, 'sideways_adx_thresh': 11.012394120526224, 'sideways_atr_min_pct': 0.010233959801833902, 'sideways_atr_max_pct': 0.10090456906535891, 'sideways_tp_mult': 1.2468517589815549, 'sideways_tsl_mult': 0.545294321351636, 'sideways_time_stop': 112, 'sideways_use_sma': True, 'sideways_use_ema': False, 'sideways_use_atr': False, 'sideways_use_adx': True, 'sideways_use_spike': False, 'sideways_rsi_required': True}.
[I 2025-08-30 17:38:28,308] Trial 832 finished with values: [-1000000000.0, 1000000000.0] and parameters: {'p_sma': 8, 'p_std': 22, 'p_atr': 16, 'p_adx': 7, 'rsi_period': 19, 'ema1': 16, 'ema2': 11, 'slip_atr_k': 0.05515281654206326, 'slip_spread_k': 0.7777314841624798, 'spread_hl_frac': 0.016103351617692288, 'bb_std_mult': 3.286938926066403, 'rsi_os': 31, 'rsi_ob': 86, 'vol_spike': 0.11316111506458816, 'adx_thresh': 33.991326839281186, 'atr_min_pct': 0.01973103065007418, 'atr_max_pct': 0.1481356886331577, 'tp_mult': 1.715991539261544, 'tsl_mult': 0.8733332838786297, 'strategy': 'mean_reversion', 'time_stop': 212, 'use_sma': False, 'use_atr': True, 'use_adx': True, 'use_ema': False, 'use_spike': False, 'rsi_required': True, 'edge_k': 0.7488244099363459, 'edge_cap': 0.7406611257755445, 'bull_strategy': 'mean_reversion', 'bull_bb_std_mult': 1.8205626845071854, 'bull_rsi_os': 46, 'bull_rsi_ob': 59, 'bull_adx_thresh': 33.11177756883911, 'bull_atr_min_pct': 0.022503219035008563, 'bull_atr_max_pct': 0.14226418946327013, 'bull_tp_mult': 2.2574950141922714, 'bull_tsl_mult': 0.42976118551630843, 'bull_time_stop': 268, 'bull_use_sma': True, 'bull_use_ema': True, 'bull_use_atr': False, 'bull_use_adx': True, 'bull_use_spike': True, 'bull_rsi_required': False, 'bear_strategy': 'mean_reversion', 'bear_bb_std_mult': 0.5787905690642035, 'bear_rsi_os': 16, 'bear_rsi_ob': 75, 'bear_adx_thresh': 8.016114183984008, 'bear_atr_min_pct': 0.0034031550035267515, 'bear_atr_max_pct': 0.1089851032974976, 'bear_tp_mult': 2.3362635422685414, 'bear_tsl_mult': 0.6398316005841941, 'bear_time_stop': 199, 'bear_use_sma': False, 'bear_use_ema': False, 'bear_use_atr': False, 'bear_use_adx': False, 'bear_use_spike': False, 'bear_rsi_required': False, 'sideways_strategy': 'breakout', 'sideways_bb_std_mult': 0.692451882874959, 'sideways_rsi_os': 21, 'sideways_rsi_ob': 65, 'sideways_adx_thresh': 19.437585019474504, 'sideways_atr_min_pct': 0.02155286724464913, 'sideways_atr_max_pct': 0.10236966937460418, 'sideways_tp_mult': 2.998985402834936, 'sideways_tsl_mult': 0.4253653721000016, 'sideways_time_stop': 267, 'sideways_use_sma': True, 'sideways_use_ema': False, 'sideways_use_atr': False, 'sideways_use_adx': False, 'sideways_use_spike': False, 'sideways_rsi_required': True}.
[I 2025-08-30 17:38:29,388] Trial 830 finished with values: [-1000000000.0, 1000000000.0] and parameters: {'p_sma': 32, 'p_std': 43, 'p_atr': 16, 'p_adx': 7, 'rsi_period': 39, 'ema1': 18, 'ema2': 14, 'slip_atr_k': 0.0034899667065445778, 'slip_spread_k': 0.15499318537698134, 'spread_hl_frac': 0.016115550415971687, 'bb_std_mult': 3.3089238172607645, 'rsi_os': 46, 'rsi_ob': 87, 'vol_spike': 0.07320348843969339, 'adx_thresh': 34.25994243551273, 'atr_min_pct': 0.019994736056789864, 'atr_max_pct': 0.08898535340637258, 'tp_mult': 2.9027553888924706, 'tsl_mult': 0.07915895822574492, 'strategy': 'mean_reversion', 'time_stop': 51, 'use_sma': False, 'use_atr': True, 'use_adx': False, 'use_ema': False, 'use_spike': False, 'rsi_required': True, 'edge_k': 0.40882070808582394, 'edge_cap': 0.7426072489657354, 'bull_strategy': 'mean_reversion', 'bull_bb_std_mult': 1.4364127504570336, 'bull_rsi_os': 28, 'bull_rsi_ob': 55, 'bull_adx_thresh': 32.49715289039873, 'bull_atr_min_pct': 0.02217434281466014, 'bull_atr_max_pct': 0.11094473276345666, 'bull_tp_mult': 2.259679716178553, 'bull_tsl_mult': 0.7854503695746172, 'bull_time_stop': 212, 'bull_use_sma': True, 'bull_use_ema': True, 'bull_use_atr': False, 'bull_use_adx': True, 'bull_use_spike': False, 'bull_rsi_required': False, 'bear_strategy': 'mean_reversion', 'bear_bb_std_mult': 0.6754031218026572, 'bear_rsi_os': 40, 'bear_rsi_ob': 75, 'bear_adx_thresh': 33.381727184451435, 'bear_atr_min_pct': 0.021798001359421053, 'bear_atr_max_pct': 0.1098510536823537, 'bear_tp_mult': 1.1949384709797681, 'bear_tsl_mult': 0.5869890037869673, 'bear_time_stop': 213, 'bear_use_sma': True, 'bear_use_ema': False, 'bear_use_atr': False, 'bear_use_adx': False, 'bear_use_spike': False, 'bear_rsi_required': False, 'sideways_strategy': 'breakout', 'sideways_bb_std_mult': 1.1200607718240136, 'sideways_rsi_os': 19, 'sideways_rsi_ob': 77, 'sideways_adx_thresh': 10.980119218142152, 'sideways_atr_min_pct': 0.021908856090490446, 'sideways_atr_max_pct': 0.10319897630575563, 'sideways_tp_mult': 2.9999325077478747, 'sideways_tsl_mult': 0.7478530074396763, 'sideways_time_stop': 136, 'sideways_use_sma': True, 'sideways_use_ema': False, 'sideways_use_atr': False, 'sideways_use_adx': False, 'sideways_use_spike': True, 'sideways_rsi_required': True}.
[I 2025-08-30 17:38:33,999] Trial 835 finished with values: [-1000000000.0, 1000000000.0] and parameters: {'p_sma': 10, 'p_std': 23, 'p_atr': 16, 'p_adx': 7, 'rsi_period': 52, 'ema1': 17, 'ema2': 10, 'slip_atr_k': 0.1626803953485495, 'slip_spread_k': 0.22581900183786702, 'spread_hl_frac': 0.02868412318897233, 'bb_std_mult': 3.286120318623861, 'rsi_os': 46, 'rsi_ob': 55, 'vol_spike': 0.12345407742563395, 'adx_thresh': 10.448986575011624, 'atr_min_pct': 0.020772614176213847, 'atr_max_pct': 0.08842816271842886, 'tp_mult': 2.916221679148334, 'tsl_mult': 0.22176163769649243, 'strategy': 'mean_reversion', 'time_stop': 147, 'use_sma': False, 'use_atr': True, 'use_adx': True, 'use_ema': False, 'use_spike': False, 'rsi_required': True, 'edge_k': 0.8847360471588177, 'edge_cap': 0.1763579915166006, 'bull_strategy': 'mean_reversion', 'bull_bb_std_mult': 1.438164174438316, 'bull_rsi_os': 9, 'bull_rsi_ob': 89, 'bull_adx_thresh': 18.34673788160101, 'bull_atr_min_pct': 0.010443939429466757, 'bull_atr_max_pct': 0.14209962442476204, 'bull_tp_mult': 2.614795704516799, 'bull_tsl_mult': 0.8080881732403679, 'bull_time_stop': 71, 'bull_use_sma': True, 'bull_use_ema': True, 'bull_use_atr': False, 'bull_use_adx': True, 'bull_use_spike': False, 'bull_rsi_required': False, 'bear_strategy': 'mean_reversion', 'bear_bb_std_mult': 1.6136900389497502, 'bear_rsi_os': 18, 'bear_rsi_ob': 74, 'bear_adx_thresh': 10.930373175169512, 'bear_atr_min_pct': 0.018275276970571276, 'bear_atr_max_pct': 0.10608605038441782, 'bear_tp_mult': 2.3047236355631533, 'bear_tsl_mult': 0.6191093566662672, 'bear_time_stop': 294, 'bear_use_sma': True, 'bear_use_ema': False, 'bear_use_atr': False, 'bear_use_adx': False, 'bear_use_spike': False, 'bear_rsi_required': False, 'sideways_strategy': 'breakout', 'sideways_bb_std_mult': 3.3808478033179137, 'sideways_rsi_os': 32, 'sideways_rsi_ob': 89, 'sideways_adx_thresh': 10.401144887572872, 'sideways_atr_min_pct': 0.022216566831783142, 'sideways_atr_max_pct': 0.022501653988061268, 'sideways_tp_mult': 2.8676867392699332, 'sideways_tsl_mult': 0.996573708606616, 'sideways_time_stop': 139, 'sideways_use_sma': True, 'sideways_use_ema': False, 'sideways_use_atr': False, 'sideways_use_adx': False, 'sideways_use_spike': False, 'sideways_rsi_required': True}.
[I 2025-08-30 17:38:34,455] Trial 834 finished with values: [-1000000000.0, 1000000000.0] and parameters: {'p_sma': 14, 'p_std': 45, 'p_atr': 16, 'p_adx': 7, 'rsi_period': 24, 'ema1': 16, 'ema2': 10, 'slip_atr_k': 0.0962638755227647, 'slip_spread_k': 0.2320444680050741, 'spread_hl_frac': 0.01994679242046699, 'bb_std_mult': 3.2848539015888085, 'rsi_os': 14, 'rsi_ob': 55, 'vol_spike': 0.1153182764142672, 'adx_thresh': 9.28157989482282, 'atr_min_pct': 0.00633178090479973, 'atr_max_pct': 0.14586258489830353, 'tp_mult': 2.9211003191182283, 'tsl_mult': 0.9620371312886228, 'strategy': 'mean_reversion', 'time_stop': 240, 'use_sma': False, 'use_atr': True, 'use_adx': True, 'use_ema': False, 'use_spike': False, 'rsi_required': True, 'edge_k': 0.8814191010480924, 'edge_cap': 0.16427909404753877, 'bull_strategy': 'mean_reversion', 'bull_bb_std_mult': 1.4400171456915722, 'bull_rsi_os': 12, 'bull_rsi_ob': 55, 'bull_adx_thresh': 32.80324664647068, 'bull_atr_min_pct': 0.023018883274494074, 'bull_atr_max_pct': 0.09976932241423109, 'bull_tp_mult': 2.3440093188234497, 'bull_tsl_mult': 0.8021713093584595, 'bull_time_stop': 71, 'bull_use_sma': True, 'bull_use_ema': True, 'bull_use_atr': False, 'bull_use_adx': True, 'bull_use_spike': False, 'bull_rsi_required': False, 'bear_strategy': 'mean_reversion', 'bear_bb_std_mult': 1.6172753377073894, 'bear_rsi_os': 17, 'bear_rsi_ob': 74, 'bear_adx_thresh': 13.281080567125292, 'bear_atr_min_pct': 0.021565498462692914, 'bear_atr_max_pct': 0.09934743748053876, 'bear_tp_mult': 2.279352253728753, 'bear_tsl_mult': 0.609947329870772, 'bear_time_stop': 21, 'bear_use_sma': True, 'bear_use_ema': False, 'bear_use_atr': False, 'bear_use_adx': False, 'bear_use_spike': False, 'bear_rsi_required': False, 'sideways_strategy': 'breakout', 'sideways_bb_std_mult': 2.63245573090949, 'sideways_rsi_os': 12, 'sideways_rsi_ob': 65, 'sideways_adx_thresh': 10.183852547352274, 'sideways_atr_min_pct': 0.0020435980870253155, 'sideways_atr_max_pct': 0.0677497601221315, 'sideways_tp_mult': 1.913689957707173, 'sideways_tsl_mult': 0.9968834324934533, 'sideways_time_stop': 77, 'sideways_use_sma': True, 'sideways_use_ema': False, 'sideways_use_atr': False, 'sideways_use_adx': False, 'sideways_use_spike': False, 'sideways_rsi_required': True}.
[I 2025-08-30 17:39:11,061] Trial 836 finished with values: [-1000000000.0, 1000000000.0] and parameters: {'p_sma': 14, 'p_std': 17, 'p_atr': 14, 'p_adx': 9, 'rsi_period': 21, 'ema1': 10, 'ema2': 10, 'slip_atr_k': 0.2446846570286234, 'slip_spread_k': 0.2362703743593746, 'spread_hl_frac': 0.031104453501019754, 'bb_std_mult': 3.443561099949064, 'rsi_os': 46, 'rsi_ob': 88, 'vol_spike': 0.07672763311256163, 'adx_thresh': 34.46136434659155, 'atr_min_pct': 0.020465197329338106, 'atr_max_pct': 0.14546102069222294, 'tp_mult': 1.9415786055629214, 'tsl_mult': 0.2185871283280169, 'strategy': 'breakout', 'time_stop': 28, 'use_sma': False, 'use_atr': True, 'use_adx': True, 'use_ema': False, 'use_spike': False, 'rsi_required': False, 'edge_k': 0.8248118626671501, 'edge_cap': 0.19427416990474666, 'bull_strategy': 'mean_reversion', 'bull_bb_std_mult': 2.497676097063081, 'bull_rsi_os': 8, 'bull_rsi_ob': 89, 'bull_adx_thresh': 33.98910943188489, 'bull_atr_min_pct': 0.023390045899375968, 'bull_atr_max_pct': 0.11287360812561323, 'bull_tp_mult': 2.3308493799369403, 'bull_tsl_mult': 0.8092016754194041, 'bull_time_stop': 68, 'bull_use_sma': True, 'bull_use_ema': True, 'bull_use_atr': False, 'bull_use_adx': True, 'bull_use_spike': False, 'bull_rsi_required': False, 'bear_strategy': 'mean_reversion', 'bear_bb_std_mult': 1.596414801929892, 'bear_rsi_os': 40, 'bear_rsi_ob': 71, 'bear_adx_thresh': 11.213046138898694, 'bear_atr_min_pct': 0.020378929342566954, 'bear_atr_max_pct': 0.10005571195151204, 'bear_tp_mult': 2.150771580935883, 'bear_tsl_mult': 0.6116466857118354, 'bear_time_stop': 205, 'bear_use_sma': True, 'bear_use_ema': False, 'bear_use_atr': False, 'bear_use_adx': False, 'bear_use_spike': True, 'bear_rsi_required': True, 'sideways_strategy': 'mean_reversion', 'sideways_bb_std_mult': 3.3819548637307895, 'sideways_rsi_os': 32, 'sideways_rsi_ob': 89, 'sideways_adx_thresh': 9.760991183945437, 'sideways_atr_min_pct': 0.008198605441090093, 'sideways_atr_max_pct': 0.05497387384056461, 'sideways_tp_mult': 2.88311084324677, 'sideways_tsl_mult': 0.3772429581784391, 'sideways_time_stop': 290, 'sideways_use_sma': False, 'sideways_use_ema': False, 'sideways_use_atr': False, 'sideways_use_adx': False, 'sideways_use_spike': False, 'sideways_rsi_required': True}.
