[I 2025-08-30 15:34:46,689] Trial 128 finished with values: [-1000000000.0, 1000000000.0] and parameters: {'p_sma': 5, 'p_std': 34, 'p_atr': 17, 'p_adx': 22, 'rsi_period': 68, 'ema1': 29, 'ema2': 24, 'slip_atr_k': 0.06293967149738144, 'slip_spread_k': 0.9608301411541617, 'spread_hl_frac': 0.0024255825559026424, 'bb_std_mult': 1.7572905896673354, 'rsi_os': 33, 'rsi_ob': 85, 'vol_spike': 0.28814389626281833, 'adx_thresh': 13.661152161105026, 'atr_min_pct': 0.0066556396550349894, 'atr_max_pct': 0.04839095850791686, 'tp_mult': 1.279557597513036, 'tsl_mult': 0.22174595335138997, 'strategy': 'breakout', 'time_stop': 202, 'use_sma': False, 'use_atr': False, 'use_adx': False, 'use_ema': True, 'use_spike': False, 'rsi_required': True, 'edge_k': 0.6558588500167479, 'edge_cap': 0.06121219208330211, 'bull_strategy': 'mean_reversion', 'bull_bb_std_mult': 2.1090480084124716, 'bull_rsi_os': 16, 'bull_rsi_ob': 91, 'bull_adx_thresh': 29.245388694308147, 'bull_atr_min_pct': 0.024162992183989526, 'bull_atr_max_pct': 0.019877806451575494, 'bull_tp_mult': 1.3540946977697483, 'bull_tsl_mult': 0.2045511350883509, 'bull_time_stop': 28, 'bull_use_sma': False, 'bull_use_ema': True, 'bull_use_atr': True, 'bull_use_adx': False, 'bull_use_spike': True, 'bull_rsi_required': True, 'bear_strategy': 'breakout', 'bear_bb_std_mult': 2.0321704794423456, 'bear_rsi_os': 44, 'bear_rsi_ob': 93, 'bear_adx_thresh': 16.1680175241905, 'bear_atr_min_pct': 0.009902706588349353, 'bear_atr_max_pct': 0.14467602606342914, 'bear_tp_mult': 2.9599392908774744, 'bear_tsl_mult': 0.5020788654990774, 'bear_time_stop': 229, 'bear_use_sma': True, 'bear_use_ema': False, 'bear_use_atr': False, 'bear_use_adx': True, 'bear_use_spike': False, 'bear_rsi_required': True, 'sideways_strategy': 'mean_reversion', 'sideways_bb_std_mult': 0.9834043830299685, 'sideways_rsi_os': 40, 'sideways_rsi_ob': 53, 'sideways_adx_thresh': 6.784156143337631, 'sideways_atr_min_pct': 0.025874287944063677, 'sideways_atr_max_pct': 0.12203484337662032, 'sideways_tp_mult': 2.2966903880086065, 'sideways_tsl_mult': 0.05706188463921394, 'sideways_time_stop': 39, 'sideways_use_sma': True, 'sideways_use_ema': True, 'sideways_use_atr': False, 'sideways_use_adx': False, 'sideways_use_spike': True, 'sideways_rsi_required': False}.
[I 2025-08-30 15:34:46,911] Trial 127 finished with values: [-1000000000.0, 1000000000.0] and parameters: {'p_sma': 5, 'p_std': 54, 'p_atr': 17, 'p_adx': 22, 'rsi_period': 68, 'ema1': 23, 'ema2': 40, 'slip_atr_k': 0.0876779806965643, 'slip_spread_k': 0.4801872916052419, 'spread_hl_frac': 0.0037008215184623217, 'bb_std_mult': 1.9249870107745821, 'rsi_os': 33, 'rsi_ob': 85, 'vol_spike': 0.2605868578265349, 'adx_thresh': 13.505684843780418, 'atr_min_pct': 0.004925688974897065, 'atr_max_pct': 0.08927050953837298, 'tp_mult': 1.6167625255147149, 'tsl_mult': 0.15916410767445172, 'strategy': 'breakout', 'time_stop': 249, 'use_sma': False, 'use_atr': False, 'use_adx': False, 'use_ema': True, 'use_spike': False, 'rsi_required': True, 'edge_k': 0.5060013113806698, 'edge_cap': 0.09991683094773714, 'bull_strategy': 'mean_reversion', 'bull_bb_std_mult': 2.1711923213835767, 'bull_rsi_os': 35, 'bull_rsi_ob': 91, 'bull_adx_thresh': 23.15090052112032, 'bull_atr_min_pct': 0.02015736638850396, 'bull_atr_max_pct': 0.021071747154321134, 'bull_tp_mult': 1.3609173096082243, 'bull_tsl_mult': 0.20103061313964507, 'bull_time_stop': 28, 'bull_use_sma': False, 'bull_use_ema': True, 'bull_use_atr': True, 'bull_use_adx': False, 'bull_use_spike': True, 'bull_rsi_required': True, 'bear_strategy': 'breakout', 'bear_bb_std_mult': 2.0299638476926587, 'bear_rsi_os': 44, 'bear_rsi_ob': 91, 'bear_adx_thresh': 15.474789207641974, 'bear_atr_min_pct': 0.006521482101501943, 'bear_atr_max_pct': 0.14976340462699847, 'bear_tp_mult': 1.577876565827756, 'bear_tsl_mult': 0.5001481135642089, 'bear_time_stop': 201, 'bear_use_sma': True, 'bear_use_ema': False, 'bear_use_atr': False, 'bear_use_adx': True, 'bear_use_spike': False, 'bear_rsi_required': True, 'sideways_strategy': 'mean_reversion', 'sideways_bb_std_mult': 1.028916774498636, 'sideways_rsi_os': 40, 'sideways_rsi_ob': 53, 'sideways_adx_thresh': 21.293711490616406, 'sideways_atr_min_pct': 0.005281903235620085, 'sideways_atr_max_pct': 0.06799453907748704, 'sideways_tp_mult': 2.5160948582264018, 'sideways_tsl_mult': 0.11515349265720348, 'sideways_time_stop': 37, 'sideways_use_sma': True, 'sideways_use_ema': True, 'sideways_use_atr': False, 'sideways_use_adx': False, 'sideways_use_spike': True, 'sideways_rsi_required': False}.
[I 2025-08-30 15:34:47,141] Trial 126 finished with values: [-0.04743213658469281, 0.04708926529494222] and parameters: {'p_sma': 34, 'p_std': 14, 'p_atr': 23, 'p_adx': 18, 'rsi_period': 68, 'ema1': 29, 'ema2': 40, 'slip_atr_k': 0.062330966474254436, 'slip_spread_k': 0.9466538152105304, 'spread_hl_frac': 0.039859933462092614, 'bb_std_mult': 1.753996939841318, 'rsi_os': 36, 'rsi_ob': 84, 'vol_spike': 0.11652755937645462, 'adx_thresh': 16.89824370524099, 'atr_min_pct': 0.0060293137656753076, 'atr_max_pct': 0.053533163115156455, 'tp_mult': 1.2504376264958332, 'tsl_mult': 0.2885773148454235, 'strategy': 'breakout', 'time_stop': 208, 'use_sma': False, 'use_atr': False, 'use_adx': False, 'use_ema': True, 'use_spike': False, 'rsi_required': True, 'edge_k': 0.5244021463193408, 'edge_cap': 0.16645024789447965, 'bull_strategy': 'breakout', 'bull_bb_std_mult': 2.1146530769810883, 'bull_rsi_os': 17, 'bull_rsi_ob': 92, 'bull_adx_thresh': 32.974077622233395, 'bull_atr_min_pct': 0.0012421983434181844, 'bull_atr_max_pct': 0.020379728910671045, 'bull_tp_mult': 1.9458317578832478, 'bull_tsl_mult': 0.20897898176844495, 'bull_time_stop': 28, 'bull_use_sma': False, 'bull_use_ema': True, 'bull_use_atr': True, 'bull_use_adx': False, 'bull_use_spike': True, 'bull_rsi_required': True, 'bear_strategy': 'breakout', 'bear_bb_std_mult': 2.274115950143325, 'bear_rsi_os': 44, 'bear_rsi_ob': 91, 'bear_adx_thresh': 21.51416869024402, 'bear_atr_min_pct': 0.006298306048822533, 'bear_atr_max_pct': 0.14200399865553415, 'bear_tp_mult': 1.5804485108038548, 'bear_tsl_mult': 0.5126798572716426, 'bear_time_stop': 244, 'bear_use_sma': True, 'bear_use_ema': False, 'bear_use_atr': False, 'bear_use_adx': False, 'bear_use_spike': False, 'bear_rsi_required': False, 'sideways_strategy': 'breakout', 'sideways_bb_std_mult': 0.5881803471956868, 'sideways_rsi_os': 55, 'sideways_rsi_ob': 45, 'sideways_adx_thresh': 6.250761299137498, 'sideways_atr_min_pct': 0.0027057605477623214, 'sideways_atr_max_pct': 0.07519236326353713, 'sideways_tp_mult': 2.6082517809529184, 'sideways_tsl_mult': 0.05851991389791545, 'sideways_time_stop': 222, 'sideways_use_sma': True, 'sideways_use_ema': True, 'sideways_use_atr': False, 'sideways_use_adx': False, 'sideways_use_spike': True, 'sideways_rsi_required': False}.
[I 2025-08-30 15:35:35,583] Trial 129 finished with values: [-1000000000.0, 1000000000.0] and parameters: {'p_sma': 15, 'p_std': 12, 'p_atr': 17, 'p_adx': 18, 'rsi_period': 49, 'ema1': 11, 'ema2': 37, 'slip_atr_k': 0.08611247504098943, 'slip_spread_k': 0.9497725399584253, 'spread_hl_frac': 0.014221228911400402, 'bb_std_mult': 1.7492001155125707, 'rsi_os': 37, 'rsi_ob': 80, 'vol_spike': 0.28432303749173465, 'adx_thresh': 19.681189649928545, 'atr_min_pct': 0.0068237000381977005, 'atr_max_pct': 0.04826040537999008, 'tp_mult': 1.812943442314722, 'tsl_mult': 0.26837482058936424, 'strategy': 'breakout', 'time_stop': 178, 'use_sma': False, 'use_atr': False, 'use_adx': False, 'use_ema': True, 'use_spike': False, 'rsi_required': True, 'edge_k': 0.518442170890615, 'edge_cap': 0.10023572345655371, 'bull_strategy': 'mean_reversion', 'bull_bb_std_mult': 1.2173707553688615, 'bull_rsi_os': 35, 'bull_rsi_ob': 92, 'bull_adx_thresh': 30.504942778286555, 'bull_atr_min_pct': 0.020234323313275744, 'bull_atr_max_pct': 0.11413601579972321, 'bull_tp_mult': 1.845402814015938, 'bull_tsl_mult': 0.8828609892839325, 'bull_time_stop': 14, 'bull_use_sma': False, 'bull_use_ema': True, 'bull_use_atr': True, 'bull_use_adx': False, 'bull_use_spike': True, 'bull_rsi_required': True, 'bear_strategy': 'breakout', 'bear_bb_std_mult': 2.2548168150783776, 'bear_rsi_os': 14, 'bear_rsi_ob': 86, 'bear_adx_thresh': 22.79214833413352, 'bear_atr_min_pct': 0.009507410728721457, 'bear_atr_max_pct': 0.10392393407273348, 'bear_tp_mult': 1.5887168028514622, 'bear_tsl_mult': 0.04766209898781981, 'bear_time_stop': 230, 'bear_use_sma': True, 'bear_use_ema': False, 'bear_use_atr': False, 'bear_use_adx': True, 'bear_use_spike': False, 'bear_rsi_required': True, 'sideways_strategy': 'mean_reversion', 'sideways_bb_std_mult': 1.281831390674636, 'sideways_rsi_os': 55, 'sideways_rsi_ob': 59, 'sideways_adx_thresh': 33.7659296046575, 'sideways_atr_min_pct': 0.01756675049194802, 'sideways_atr_max_pct': 0.12355630380857328, 'sideways_tp_mult': 2.50838133820418, 'sideways_tsl_mult': 0.10798311150585291, 'sideways_time_stop': 299, 'sideways_use_sma': True, 'sideways_use_ema': True, 'sideways_use_atr': False, 'sideways_use_adx': False, 'sideways_use_spike': True, 'sideways_rsi_required': False}.
[I 2025-08-30 15:35:38,022] Trial 132 finished with values: [-1000000000.0, 1000000000.0] and parameters: {'p_sma': 49, 'p_std': 12, 'p_atr': 14, 'p_adx': 23, 'rsi_period': 79, 'ema1': 30, 'ema2': 37, 'slip_atr_k': 0.046659155703813286, 'slip_spread_k': 0.9383604330481913, 'spread_hl_frac': 0.023605143062445495, 'bb_std_mult': 3.278620921794591, 'rsi_os': 37, 'rsi_ob': 89, 'vol_spike': 0.2680468920173218, 'adx_thresh': 15.15395160174668, 'atr_min_pct': 0.0036419529791048835, 'atr_max_pct': 0.06989214305402808, 'tp_mult': 1.6308734497859307, 'tsl_mult': 0.28108357778368087, 'strategy': 'mean_reversion', 'time_stop': 237, 'use_sma': False, 'use_atr': False, 'use_adx': True, 'use_ema': False, 'use_spike': True, 'rsi_required': True, 'edge_k': 1.118539174495737, 'edge_cap': 0.13370228984594212, 'bull_strategy': 'breakout', 'bull_bb_std_mult': 1.2164553766972577, 'bull_rsi_os': 30, 'bull_rsi_ob': 95, 'bull_adx_thresh': 24.17771986917888, 'bull_atr_min_pct': 0.02894223001188305, 'bull_atr_max_pct': 0.11218236407216892, 'bull_tp_mult': 1.4436591278778907, 'bull_tsl_mult': 0.15096253415821903, 'bull_time_stop': 12, 'bull_use_sma': False, 'bull_use_ema': True, 'bull_use_atr': True, 'bull_use_adx': True, 'bull_use_spike': False, 'bull_rsi_required': True, 'bear_strategy': 'mean_reversion', 'bear_bb_std_mult': 2.2342710778187462, 'bear_rsi_os': 43, 'bear_rsi_ob': 86, 'bear_adx_thresh': 21.503357407903582, 'bear_atr_min_pct': 0.009063095555162486, 'bear_atr_max_pct': 0.1303182199103132, 'bear_tp_mult': 1.0263185972155497, 'bear_tsl_mult': 0.05169707002500501, 'bear_time_stop': 137, 'bear_use_sma': True, 'bear_use_ema': False, 'bear_use_atr': True, 'bear_use_adx': False, 'bear_use_spike': False, 'bear_rsi_required': False, 'sideways_strategy': 'breakout', 'sideways_bb_std_mult': 0.6657748304977813, 'sideways_rsi_os': 52, 'sideways_rsi_ob': 59, 'sideways_adx_thresh': 22.626771807630632, 'sideways_atr_min_pct': 0.017055073627857596, 'sideways_atr_max_pct': 0.031399974241951414, 'sideways_tp_mult': 2.690221055713737, 'sideways_tsl_mult': 0.31069166462341735, 'sideways_time_stop': 12, 'sideways_use_sma': False, 'sideways_use_ema': True, 'sideways_use_atr': False, 'sideways_use_adx': False, 'sideways_use_spike': False, 'sideways_rsi_required': False}.
[I 2025-08-30 15:35:38,424] Trial 131 finished with values: [-1000000000.0, 1000000000.0] and parameters: {'p_sma': 60, 'p_std': 32, 'p_atr': 24, 'p_adx': 18, 'rsi_period': 48, 'ema1': 11, 'ema2': 37, 'slip_atr_k': 0.04312399783838211, 'slip_spread_k': 0.2790672657771901, 'spread_hl_frac': 0.039811307004599235, 'bb_std_mult': 1.3743726471346918, 'rsi_os': 31, 'rsi_ob': 89, 'vol_spike': 0.28214985268667647, 'adx_thresh': 19.902585987226658, 'atr_min_pct': 0.0033107774585948387, 'atr_max_pct': 0.10754393620134736, 'tp_mult': 1.8161694211795578, 'tsl_mult': 0.08618988298406494, 'strategy': 'mean_reversion', 'time_stop': 211, 'use_sma': False, 'use_atr': False, 'use_adx': True, 'use_ema': False, 'use_spike': False, 'rsi_required': True, 'edge_k': 1.6765119198022276, 'edge_cap': 0.14227539299018338, 'bull_strategy': 'breakout', 'bull_bb_std_mult': 1.014807443633279, 'bull_rsi_os': 31, 'bull_rsi_ob': 95, 'bull_adx_thresh': 24.281734881338846, 'bull_atr_min_pct': 0.023105278114526968, 'bull_atr_max_pct': 0.11492716360128569, 'bull_tp_mult': 1.6849009367298196, 'bull_tsl_mult': 0.6667822531439609, 'bull_time_stop': 10, 'bull_use_sma': False, 'bull_use_ema': True, 'bull_use_atr': True, 'bull_use_adx': True, 'bull_use_spike': False, 'bull_rsi_required': True, 'bear_strategy': 'mean_reversion', 'bear_bb_std_mult': 2.251929953606708, 'bear_rsi_os': 48, 'bear_rsi_ob': 86, 'bear_adx_thresh': 21.393569061646428, 'bear_atr_min_pct': 0.009305811899250479, 'bear_atr_max_pct': 0.10376233674859524, 'bear_tp_mult': 1.7828447865931514, 'bear_tsl_mult': 0.1871002456976424, 'bear_time_stop': 176, 'bear_use_sma': True, 'bear_use_ema': False, 'bear_use_atr': True, 'bear_use_adx': False, 'bear_use_spike': False, 'bear_rsi_required': False, 'sideways_strategy': 'breakout', 'sideways_bb_std_mult': 0.6107059942197466, 'sideways_rsi_os': 55, 'sideways_rsi_ob': 61, 'sideways_adx_thresh': 33.04916992171408, 'sideways_atr_min_pct': 0.017005598430034692, 'sideways_atr_max_pct': 0.13838785352110067, 'sideways_tp_mult': 2.9483255990746153, 'sideways_tsl_mult': 0.10464423724785901, 'sideways_time_stop': 267, 'sideways_use_sma': False, 'sideways_use_ema': True, 'sideways_use_atr': False, 'sideways_use_adx': False, 'sideways_use_spike': False, 'sideways_rsi_required': False}.
[I 2025-08-30 15:35:38,782] Trial 130 finished with values: [-1000000000.0, 1000000000.0] and parameters: {'p_sma': 17, 'p_std': 32, 'p_atr': 24, 'p_adx': 18, 'rsi_period': 49, 'ema1': 30, 'ema2': 37, 'slip_atr_k': 0.04710523434233202, 'slip_spread_k': 0.4007006032672381, 'spread_hl_frac': 0.032112486475388634, 'bb_std_mult': 3.259734547661071, 'rsi_os': 31, 'rsi_ob': 80, 'vol_spike': 0.2655078594940052, 'adx_thresh': 19.56508524686679, 'atr_min_pct': 0.01932422271046933, 'atr_max_pct': 0.03230371821845052, 'tp_mult': 1.6151559404798452, 'tsl_mult': 0.14876743257050323, 'strategy': 'breakout', 'time_stop': 238, 'use_sma': False, 'use_atr': False, 'use_adx': False, 'use_ema': False, 'use_spike': False, 'rsi_required': True, 'edge_k': 1.6831075848573689, 'edge_cap': 0.10468672800650133, 'bull_strategy': 'breakout', 'bull_bb_std_mult': 1.046178437102216, 'bull_rsi_os': 11, 'bull_rsi_ob': 92, 'bull_adx_thresh': 24.68757143881242, 'bull_atr_min_pct': 0.02308347770566046, 'bull_atr_max_pct': 0.016912850709359748, 'bull_tp_mult': 1.8241584732621703, 'bull_tsl_mult': 0.8821417347446499, 'bull_time_stop': 12, 'bull_use_sma': False, 'bull_use_ema': True, 'bull_use_atr': True, 'bull_use_adx': False, 'bull_use_spike': False, 'bull_rsi_required': True, 'bear_strategy': 'mean_reversion', 'bear_bb_std_mult': 3.1991052255521755, 'bear_rsi_os': 48, 'bear_rsi_ob': 91, 'bear_adx_thresh': 21.934674257267186, 'bear_atr_min_pct': 0.005809345364989652, 'bear_atr_max_pct': 0.022697743320952146, 'bear_tp_mult': 1.601000065333057, 'bear_tsl_mult': 0.04254696020147897, 'bear_time_stop': 135, 'bear_use_sma': True, 'bear_use_ema': False, 'bear_use_atr': False, 'bear_use_adx': False, 'bear_use_spike': False, 'bear_rsi_required': False, 'sideways_strategy': 'breakout', 'sideways_bb_std_mult': 1.481065227731055, 'sideways_rsi_os': 55, 'sideways_rsi_ob': 61, 'sideways_adx_thresh': 22.696971556389865, 'sideways_atr_min_pct': 0.029755598122256602, 'sideways_atr_max_pct': 0.06845161398505216, 'sideways_tp_mult': 2.824739991712305, 'sideways_tsl_mult': 0.1138244259233282, 'sideways_time_stop': 298, 'sideways_use_sma': True, 'sideways_use_ema': True, 'sideways_use_atr': False, 'sideways_use_adx': False, 'sideways_use_spike': False, 'sideways_rsi_required': False}.
[I 2025-08-30 15:36:27,775] Trial 136 finished with values: [-1000000000.0, 1000000000.0] and parameters: {'p_sma': 33, 'p_std': 39, 'p_atr': 11, 'p_adx': 11, 'rsi_period': 77, 'ema1': 28, 'ema2': 31, 'slip_atr_k': 0.09294106975827368, 'slip_spread_k': 0.6105337357645151, 'spread_hl_frac': 0.04402742963531252, 'bb_std_mult': 2.5433029016679494, 'rsi_os': 29, 'rsi_ob': 83, 'vol_spike': 0.27652254278439115, 'adx_thresh': 17.17325791587377, 'atr_min_pct': 0.002414109016295649, 'atr_max_pct': 0.13255041520738162, 'tp_mult': 1.7184020509441464, 'tsl_mult': 0.8611252768172936, 'strategy': 'mean_reversion', 'time_stop': 227, 'use_sma': False, 'use_atr': False, 'use_adx': True, 'use_ema': False, 'use_spike': True, 'rsi_required': False, 'edge_k': 1.402779651752543, 'edge_cap': 0.33250992828494336, 'bull_strategy': 'breakout', 'bull_bb_std_mult': 0.8772009726473855, 'bull_rsi_os': 33, 'bull_rsi_ob': 93, 'bull_adx_thresh': 34.80661490305318, 'bull_atr_min_pct': 0.025982914667936022, 'bull_atr_max_pct': 0.13429256066257544, 'bull_tp_mult': 2.0024249627404975, 'bull_tsl_mult': 0.6217761895615416, 'bull_time_stop': 33, 'bull_use_sma': True, 'bull_use_ema': True, 'bull_use_atr': False, 'bull_use_adx': True, 'bull_use_spike': False, 'bull_rsi_required': True, 'bear_strategy': 'mean_reversion', 'bear_bb_std_mult': 1.6757684801570194, 'bear_rsi_os': 41, 'bear_rsi_ob': 93, 'bear_adx_thresh': 19.00282782664957, 'bear_atr_min_pct': 0.011922761309630625, 'bear_atr_max_pct': 0.04599451668414536, 'bear_tp_mult': 1.145666239257515, 'bear_tsl_mult': 0.6518132097069568, 'bear_time_stop': 144, 'bear_use_sma': False, 'bear_use_ema': False, 'bear_use_atr': True, 'bear_use_adx': False, 'bear_use_spike': True, 'bear_rsi_required': False, 'sideways_strategy': 'breakout', 'sideways_bb_std_mult': 1.6162548845035856, 'sideways_rsi_os': 34, 'sideways_rsi_ob': 64, 'sideways_adx_thresh': 5.313039690802924, 'sideways_atr_min_pct': 0.013239881731198456, 'sideways_atr_max_pct': 0.117805008213889, 'sideways_tp_mult': 2.605174208200701, 'sideways_tsl_mult': 0.0864417106211875, 'sideways_time_stop': 75, 'sideways_use_sma': False, 'sideways_use_ema': True, 'sideways_use_atr': False, 'sideways_use_adx': True, 'sideways_use_spike': False, 'sideways_rsi_required': False}.
[I 2025-08-30 15:36:28,094] Trial 135 finished with values: [-1000000000.0, 1000000000.0] and parameters: {'p_sma': 33, 'p_std': 58, 'p_atr': 11, 'p_adx': 11, 'rsi_period': 78, 'ema1': 28, 'ema2': 31, 'slip_atr_k': 0.07895634990552752, 'slip_spread_k': 0.4164784369000783, 'spread_hl_frac': 0.018025712828032572, 'bb_std_mult': 3.4764006578108133, 'rsi_os': 31, 'rsi_ob': 83, 'vol_spike': 0.2763926362489949, 'adx_thresh': 17.203231586004136, 'atr_min_pct': 0.002638951248004605, 'atr_max_pct': 0.04277141885797736, 'tp_mult': 1.7240378624539379, 'tsl_mult': 0.7237768247518218, 'strategy': 'mean_reversion', 'time_stop': 238, 'use_sma': False, 'use_atr': False, 'use_adx': True, 'use_ema': False, 'use_spike': False, 'rsi_required': False, 'edge_k': 0.5844856943644016, 'edge_cap': 0.19438722918939477, 'bull_strategy': 'breakout', 'bull_bb_std_mult': 0.8701006969345308, 'bull_rsi_os': 34, 'bull_rsi_ob': 92, 'bull_adx_thresh': 34.43976503100521, 'bull_atr_min_pct': 0.02586909388184395, 'bull_atr_max_pct': 0.017238978082325777, 'bull_tp_mult': 2.2881709522847404, 'bull_tsl_mult': 0.2544802388704334, 'bull_time_stop': 11, 'bull_use_sma': True, 'bull_use_ema': True, 'bull_use_atr': False, 'bull_use_adx': True, 'bull_use_spike': False, 'bull_rsi_required': True, 'bear_strategy': 'mean_reversion', 'bear_bb_std_mult': 3.2146192026847755, 'bear_rsi_os': 41, 'bear_rsi_ob': 94, 'bear_adx_thresh': 19.02789158664419, 'bear_atr_min_pct': 0.007791679285968659, 'bear_atr_max_pct': 0.09275575291937616, 'bear_tp_mult': 1.6828722129024845, 'bear_tsl_mult': 0.24918939449690322, 'bear_time_stop': 146, 'bear_use_sma': False, 'bear_use_ema': False, 'bear_use_atr': True, 'bear_use_adx': False, 'bear_use_spike': True, 'bear_rsi_required': False, 'sideways_strategy': 'breakout', 'sideways_bb_std_mult': 1.6229363800619552, 'sideways_rsi_os': 49, 'sideways_rsi_ob': 45, 'sideways_adx_thresh': 5.2766569296396355, 'sideways_atr_min_pct': 0.02963938706275793, 'sideways_atr_max_pct': 0.10355272763482917, 'sideways_tp_mult': 2.5921237224785525, 'sideways_tsl_mult': 0.08088370517119897, 'sideways_time_stop': 57, 'sideways_use_sma': False, 'sideways_use_ema': True, 'sideways_use_atr': False, 'sideways_use_adx': True, 'sideways_use_spike': False, 'sideways_rsi_required': False}.
