[I 2025-08-30 15:39:42,887] Trial 151 finished with values: [-0.017980005466322835, 0.017970191431673464] and parameters: {'p_sma': 19, 'p_std': 17, 'p_atr': 22, 'p_adx': 15, 'rsi_period': 58, 'ema1': 23, 'ema2': 34, 'slip_atr_k': 0.022014698614477104, 'slip_spread_k': 0.2542496981425238, 'spread_hl_frac': 0.04888272518677449, 'bb_std_mult': 2.6470950230501464, 'rsi_os': 40, 'rsi_ob': 49, 'vol_spike': 0.0009195248479894058, 'adx_thresh': 21.721439105001576, 'atr_min_pct': 0.00751251956818001, 'atr_max_pct': 0.14689452811888506, 'tp_mult': 1.208092160443184, 'tsl_mult': 0.37367366929467727, 'strategy': 'breakout', 'time_stop': 260, 'use_sma': False, 'use_atr': True, 'use_adx': False, 'use_ema': True, 'use_spike': True, 'rsi_required': False, 'edge_k': 0.5450240434420046, 'edge_cap': 0.7670688311236868, 'bull_strategy': 'breakout', 'bull_bb_std_mult': 1.225628628058483, 'bull_rsi_os': 21, 'bull_rsi_ob': 79, 'bull_adx_thresh': 34.4127082082169, 'bull_atr_min_pct': 0.000135742244903099, 'bull_atr_max_pct': 0.053498382745148135, 'bull_tp_mult': 2.441340393297358, 'bull_tsl_mult': 0.3241431690234683, 'bull_time_stop': 53, 'bull_use_sma': True, 'bull_use_ema': True, 'bull_use_atr': False, 'bull_use_adx': False, 'bull_use_spike': False, 'bull_rsi_required': True, 'bear_strategy': 'breakout', 'bear_bb_std_mult': 2.5932711756368985, 'bear_rsi_os': 54, 'bear_rsi_ob': 77, 'bear_adx_thresh': 9.803275024312232, 'bear_atr_min_pct': 0.022970526720413238, 'bear_atr_max_pct': 0.07423319261886308, 'bear_tp_mult': 2.7967902528251436, 'bear_tsl_mult': 0.547691170762975, 'bear_time_stop': 249, 'bear_use_sma': False, 'bear_use_ema': False, 'bear_use_atr': True, 'bear_use_adx': True, 'bear_use_spike': True, 'bear_rsi_required': True, 'sideways_strategy': 'breakout', 'sideways_bb_std_mult': 3.243061821217356, 'sideways_rsi_os': 32, 'sideways_rsi_ob': 95, 'sideways_adx_thresh': 16.046085139332785, 'sideways_atr_min_pct': 0.0011682165742947525, 'sideways_atr_max_pct': 0.09512274591602136, 'sideways_tp_mult': 2.8477893990082346, 'sideways_tsl_mult': 0.9998229574642922, 'sideways_time_stop': 251, 'sideways_use_sma': True, 'sideways_use_ema': True, 'sideways_use_atr': False, 'sideways_use_adx': True, 'sideways_use_spike': False, 'sideways_rsi_required': True}.
[I 2025-08-30 15:39:42,951] Trial 153 finished with values: [-0.02057611895160083, 0.020506597540904347] and parameters: {'p_sma': 19, 'p_std': 23, 'p_atr': 22, 'p_adx': 17, 'rsi_period': 40, 'ema1': 23, 'ema2': 34, 'slip_atr_k': 0.02263515409711568, 'slip_spread_k': 0.02816020860609425, 'spread_hl_frac': 0.04924241837672748, 'bb_std_mult': 2.7483473564854966, 'rsi_os': 40, 'rsi_ob': 78, 'vol_spike': 0.0009709199076381528, 'adx_thresh': 23.676130506989367, 'atr_min_pct': 0.007446556733839541, 'atr_max_pct': 0.12170438222087696, 'tp_mult': 1.0819460362439337, 'tsl_mult': 0.5112388571659994, 'strategy': 'breakout', 'time_stop': 261, 'use_sma': False, 'use_atr': True, 'use_adx': False, 'use_ema': True, 'use_spike': True, 'rsi_required': False, 'edge_k': 0.2168022524144972, 'edge_cap': 0.7774408410038712, 'bull_strategy': 'breakout', 'bull_bb_std_mult': 1.6246196439090648, 'bull_rsi_os': 21, 'bull_rsi_ob': 79, 'bull_adx_thresh': 34.435373445374466, 'bull_atr_min_pct': 0.00026882833151682076, 'bull_atr_max_pct': 0.06780624827601903, 'bull_tp_mult': 2.6394551788200324, 'bull_tsl_mult': 0.3138685993190985, 'bull_time_stop': 52, 'bull_use_sma': True, 'bull_use_ema': True, 'bull_use_atr': False, 'bull_use_adx': False, 'bull_use_spike': False, 'bull_rsi_required': True, 'bear_strategy': 'breakout', 'bear_bb_std_mult': 2.5662115742053184, 'bear_rsi_os': 53, 'bear_rsi_ob': 79, 'bear_adx_thresh': 8.705154482862735, 'bear_atr_min_pct': 0.026856025686116388, 'bear_atr_max_pct': 0.07505051703577811, 'bear_tp_mult': 1.9910870796903095, 'bear_tsl_mult': 0.5462032117756034, 'bear_time_stop': 278, 'bear_use_sma': False, 'bear_use_ema': False, 'bear_use_atr': True, 'bear_use_adx': True, 'bear_use_spike': True, 'bear_rsi_required': True, 'sideways_strategy': 'breakout', 'sideways_bb_std_mult': 3.263269748810781, 'sideways_rsi_os': 32, 'sideways_rsi_ob': 93, 'sideways_adx_thresh': 16.42503113822053, 'sideways_atr_min_pct': 0.0011711315421005304, 'sideways_atr_max_pct': 0.09599554426598783, 'sideways_tp_mult': 2.8649349806098754, 'sideways_tsl_mult': 0.8390552991520176, 'sideways_time_stop': 216, 'sideways_use_sma': True, 'sideways_use_ema': True, 'sideways_use_atr': False, 'sideways_use_adx': True, 'sideways_use_spike': False, 'sideways_rsi_required': False}.
[I 2025-08-30 15:40:35,922] Trial 158 finished with values: [-1000000000.0, 1000000000.0] and parameters: {'p_sma': 19, 'p_std': 20, 'p_atr': 21, 'p_adx': 17, 'rsi_period': 39, 'ema1': 25, 'ema2': 34, 'slip_atr_k': 0.02114237337357141, 'slip_spread_k': 0.026173118167933204, 'spread_hl_frac': 0.04900630499688746, 'bb_std_mult': 2.7520809299551985, 'rsi_os': 40, 'rsi_ob': 78, 'vol_spike': 0.0021956607854628357, 'adx_thresh': 23.72237038327348, 'atr_min_pct': 0.006278048010211235, 'atr_max_pct': 0.13940059529516663, 'tp_mult': 1.073985806504101, 'tsl_mult': 0.5097348386921005, 'strategy': 'breakout', 'time_stop': 260, 'use_sma': False, 'use_atr': True, 'use_adx': False, 'use_ema': True, 'use_spike': True, 'rsi_required': False, 'edge_k': 0.20710267351360379, 'edge_cap': 0.6733837224258975, 'bull_strategy': 'breakout', 'bull_bb_std_mult': 1.5900425936222822, 'bull_rsi_os': 21, 'bull_rsi_ob': 79, 'bull_adx_thresh': 33.01544197207472, 'bull_atr_min_pct': 2.8899732796006366e-06, 'bull_atr_max_pct': 0.05494886316161934, 'bull_tp_mult': 2.6352129032055895, 'bull_tsl_mult': 0.32744117139590617, 'bull_time_stop': 90, 'bull_use_sma': True, 'bull_use_ema': True, 'bull_use_atr': False, 'bull_use_adx': False, 'bull_use_spike': False, 'bull_rsi_required': True, 'bear_strategy': 'breakout', 'bear_bb_std_mult': 2.415337020920469, 'bear_rsi_os': 54, 'bear_rsi_ob': 79, 'bear_adx_thresh': 9.229425588399643, 'bear_atr_min_pct': 0.025929466584854784, 'bear_atr_max_pct': 0.07828097149534914, 'bear_tp_mult': 2.208535557881942, 'bear_tsl_mult': 0.5494816593946433, 'bear_time_stop': 279, 'bear_use_sma': False, 'bear_use_ema': False, 'bear_use_atr': True, 'bear_use_adx': True, 'bear_use_spike': True, 'bear_rsi_required': True, 'sideways_strategy': 'mean_reversion', 'sideways_bb_std_mult': 3.252104226257374, 'sideways_rsi_os': 32, 'sideways_rsi_ob': 93, 'sideways_adx_thresh': 15.969326607742342, 'sideways_atr_min_pct': 0.001323126445874555, 'sideways_atr_max_pct': 0.09461070952132197, 'sideways_tp_mult': 2.8613262780595696, 'sideways_tsl_mult': 0.9106779190691693, 'sideways_time_stop': 229, 'sideways_use_sma': True, 'sideways_use_ema': False, 'sideways_use_atr': False, 'sideways_use_adx': True, 'sideways_use_spike': False, 'sideways_rsi_required': False}.
[I 2025-08-30 15:40:36,474] Trial 157 finished with values: [-0.012179099951832195, 0.01240788288251703] and parameters: {'p_sma': 19, 'p_std': 20, 'p_atr': 22, 'p_adx': 17, 'rsi_period': 40, 'ema1': 25, 'ema2': 42, 'slip_atr_k': 0.0372073637305733, 'slip_spread_k': 0.031540695404190966, 'spread_hl_frac': 0.04895064091322883, 'bb_std_mult': 2.761416207505359, 'rsi_os': 38, 'rsi_ob': 77, 'vol_spike': 0.008333309198730793, 'adx_thresh': 23.902653016536345, 'atr_min_pct': 0.007530193278762257, 'atr_max_pct': 0.13895676347606573, 'tp_mult': 1.0633815419869934, 'tsl_mult': 0.506958387418242, 'strategy': 'breakout', 'time_stop': 260, 'use_sma': False, 'use_atr': True, 'use_adx': False, 'use_ema': True, 'use_spike': True, 'rsi_required': False, 'edge_k': 0.14087996287299714, 'edge_cap': 0.6744404022534359, 'bull_strategy': 'breakout', 'bull_bb_std_mult': 1.5864525662666378, 'bull_rsi_os': 25, 'bull_rsi_ob': 79, 'bull_adx_thresh': 34.23241738923187, 'bull_atr_min_pct': 4.341421321585369e-05, 'bull_atr_max_pct': 0.05425901021399574, 'bull_tp_mult': 2.6215068298231783, 'bull_tsl_mult': 0.31555226176292195, 'bull_time_stop': 56, 'bull_use_sma': True, 'bull_use_ema': True, 'bull_use_atr': False, 'bull_use_adx': False, 'bull_use_spike': False, 'bull_rsi_required': True, 'bear_strategy': 'breakout', 'bear_bb_std_mult': 2.406687311717444, 'bear_rsi_os': 53, 'bear_rsi_ob': 79, 'bear_adx_thresh': 10.20828295862832, 'bear_atr_min_pct': 0.027186942922994083, 'bear_atr_max_pct': 0.07411454845140927, 'bear_tp_mult': 2.1978054502334405, 'bear_tsl_mult': 0.5398743724228097, 'bear_time_stop': 278, 'bear_use_sma': False, 'bear_use_ema': False, 'bear_use_atr': True, 'bear_use_adx': True, 'bear_use_spike': True, 'bear_rsi_required': True, 'sideways_strategy': 'breakout', 'sideways_bb_std_mult': 3.2446215592662195, 'sideways_rsi_os': 32, 'sideways_rsi_ob': 93, 'sideways_adx_thresh': 16.212358392266374, 'sideways_atr_min_pct': 0.002577375809136055, 'sideways_atr_max_pct': 0.09542477833698643, 'sideways_tp_mult': 2.8550207591146224, 'sideways_tsl_mult': 0.8629490263372299, 'sideways_time_stop': 252, 'sideways_use_sma': True, 'sideways_use_ema': True, 'sideways_use_atr': False, 'sideways_use_adx': True, 'sideways_use_spike': False, 'sideways_rsi_required': False}.
[I 2025-08-30 15:40:37,877] Trial 156 finished with values: [-0.018044146465682753, 0.01797366951798961] and parameters: {'p_sma': 19, 'p_std': 20, 'p_atr': 22, 'p_adx': 17, 'rsi_period': 41, 'ema1': 23, 'ema2': 43, 'slip_atr_k': 0.03383398514498013, 'slip_spread_k': 0.03506732225263268, 'spread_hl_frac': 0.048926494548924004, 'bb_std_mult': 2.7547635571404716, 'rsi_os': 40, 'rsi_ob': 76, 'vol_spike': 0.0011575023147569353, 'adx_thresh': 22.060622010348983, 'atr_min_pct': 0.007476893525449053, 'atr_max_pct': 0.13897542096910678, 'tp_mult': 1.0436347913446136, 'tsl_mult': 0.513951549749463, 'strategy': 'breakout', 'time_stop': 257, 'use_sma': False, 'use_atr': True, 'use_adx': False, 'use_ema': True, 'use_spike': True, 'rsi_required': False, 'edge_k': 0.11883259845997471, 'edge_cap': 0.6704099488173406, 'bull_strategy': 'breakout', 'bull_bb_std_mult': 1.592286684844179, 'bull_rsi_os': 21, 'bull_rsi_ob': 78, 'bull_adx_thresh': 34.37087960013929, 'bull_atr_min_pct': 0.00012145064495910321, 'bull_atr_max_pct': 0.06778954793200953, 'bull_tp_mult': 2.628602670247181, 'bull_tsl_mult': 0.31215958965560936, 'bull_time_stop': 51, 'bull_use_sma': True, 'bull_use_ema': True, 'bull_use_atr': False, 'bull_use_adx': False, 'bull_use_spike': False, 'bull_rsi_required': True, 'bear_strategy': 'breakout', 'bear_bb_std_mult': 2.4195537109095695, 'bear_rsi_os': 54, 'bear_rsi_ob': 79, 'bear_adx_thresh': 8.604241666086342, 'bear_atr_min_pct': 0.027175483696770357, 'bear_atr_max_pct': 0.07316458957588771, 'bear_tp_mult': 2.191234140587468, 'bear_tsl_mult': 0.5443094209373974, 'bear_time_stop': 281, 'bear_use_sma': False, 'bear_use_ema': False, 'bear_use_atr': True, 'bear_use_adx': True, 'bear_use_spike': True, 'bear_rsi_required': True, 'sideways_strategy': 'breakout', 'sideways_bb_std_mult': 3.2442345969051414, 'sideways_rsi_os': 31, 'sideways_rsi_ob': 93, 'sideways_adx_thresh': 16.139025131249905, 'sideways_atr_min_pct': 0.0012114029183936754, 'sideways_atr_max_pct': 0.09576328728976442, 'sideways_tp_mult': 2.85802856577727, 'sideways_tsl_mult': 0.9141430869288408, 'sideways_time_stop': 251, 'sideways_use_sma': True, 'sideways_use_ema': True, 'sideways_use_atr': False, 'sideways_use_adx': True, 'sideways_use_spike': False, 'sideways_rsi_required': False}.
[I 2025-08-30 15:40:38,096] Trial 155 finished with values: [-0.018123810231140847, 0.01802847980764021] and parameters: {'p_sma': 19, 'p_std': 20, 'p_atr': 22, 'p_adx': 17, 'rsi_period': 40, 'ema1': 23, 'ema2': 42, 'slip_atr_k': 0.023862438541004217, 'slip_spread_k': 0.032244622090784096, 'spread_hl_frac': 0.049069290461815185, 'bb_std_mult': 2.7431504340538058, 'rsi_os': 40, 'rsi_ob': 79, 'vol_spike': 0.000965458631626755, 'adx_thresh': 21.451079816557318, 'atr_min_pct': 0.007438351238268756, 'atr_max_pct': 0.13965894343764781, 'tp_mult': 1.2056935629795793, 'tsl_mult': 0.4978397018458216, 'strategy': 'breakout', 'time_stop': 261, 'use_sma': False, 'use_atr': True, 'use_adx': False, 'use_ema': True, 'use_spike': True, 'rsi_required': False, 'edge_k': 0.2200564748620047, 'edge_cap': 0.7681948784477838, 'bull_strategy': 'breakout', 'bull_bb_std_mult': 1.5955943048770551, 'bull_rsi_os': 21, 'bull_rsi_ob': 79, 'bull_adx_thresh': 33.44391668069358, 'bull_atr_min_pct': 1.6787599322663207e-05, 'bull_atr_max_pct': 0.05793497416404171, 'bull_tp_mult': 2.623350697436248, 'bull_tsl_mult': 0.31158885684723037, 'bull_time_stop': 90, 'bull_use_sma': True, 'bull_use_ema': True, 'bull_use_atr': False, 'bull_use_adx': False, 'bull_use_spike': False, 'bull_rsi_required': True, 'bear_strategy': 'breakout', 'bear_bb_std_mult': 2.39216624535836, 'bear_rsi_os': 50, 'bear_rsi_ob': 82, 'bear_adx_thresh': 8.60847027449276, 'bear_atr_min_pct': 0.02582284848807349, 'bear_atr_max_pct': 0.08986051845602262, 'bear_tp_mult': 2.032911199168697, 'bear_tsl_mult': 0.5373105882923767, 'bear_time_stop': 280, 'bear_use_sma': False, 'bear_use_ema': False, 'bear_use_atr': True, 'bear_use_adx': True, 'bear_use_spike': True, 'bear_rsi_required': True, 'sideways_strategy': 'breakout', 'sideways_bb_std_mult': 3.3101346824881777, 'sideways_rsi_os': 31, 'sideways_rsi_ob': 93, 'sideways_adx_thresh': 16.18817428144201, 'sideways_atr_min_pct': 0.0012047557900064598, 'sideways_atr_max_pct': 0.0947593940441159, 'sideways_tp_mult': 2.9632565053283493, 'sideways_tsl_mult': 0.8681013867426268, 'sideways_time_stop': 252, 'sideways_use_sma': True, 'sideways_use_ema': True, 'sideways_use_atr': False, 'sideways_use_adx': True, 'sideways_use_spike': False, 'sideways_rsi_required': False}.
[I 2025-08-30 15:41:37,665] Trial 160 finished with values: [-1000000000.0, 1000000000.0] and parameters: {'p_sma': 17, 'p_std': 23, 'p_atr': 22, 'p_adx': 18, 'rsi_period': 41, 'ema1': 23, 'ema2': 32, 'slip_atr_k': 0.03378875449545507, 'slip_spread_k': 0.05157602119964193, 'spread_hl_frac': 0.048991104351444645, 'bb_std_mult': 2.847292493255154, 'rsi_os': 39, 'rsi_ob': 77, 'vol_spike': 0.011605698845560631, 'adx_thresh': 21.758706822730357, 'atr_min_pct': 0.008407939118609277, 'atr_max_pct': 0.1465510472632762, 'tp_mult': 1.0434605435118112, 'tsl_mult': 0.47480389386121846, 'strategy': 'breakout', 'time_stop': 268, 'use_sma': False, 'use_atr': True, 'use_adx': False, 'use_ema': False, 'use_spike': True, 'rsi_required': False, 'edge_k': 0.28977101220717116, 'edge_cap': 0.7557406881643813, 'bull_strategy': 'mean_reversion', 'bull_bb_std_mult': 1.476359067450081, 'bull_rsi_os': 25, 'bull_rsi_ob': 81, 'bull_adx_thresh': 34.23995343728001, 'bull_atr_min_pct': 0.002425743903298445, 'bull_atr_max_pct': 0.06778468991377748, 'bull_tp_mult': 2.695197840481515, 'bull_tsl_mult': 0.3084604313669116, 'bull_time_stop': 51, 'bull_use_sma': True, 'bull_use_ema': True, 'bull_use_atr': False, 'bull_use_adx': False, 'bull_use_spike': False, 'bull_rsi_required': True, 'bear_strategy': 'mean_reversion', 'bear_bb_std_mult': 2.553947491220404, 'bear_rsi_os': 53, 'bear_rsi_ob': 73, 'bear_adx_thresh': 10.33340965025423, 'bear_atr_min_pct': 0.02728392107545915, 'bear_atr_max_pct': 0.08847570873672093, 'bear_tp_mult': 2.0466638237997308, 'bear_tsl_mult': 0.6158138901951555, 'bear_time_stop': 284, 'bear_use_sma': False, 'bear_use_ema': False, 'bear_use_atr': True, 'bear_use_adx': False, 'bear_use_spike': True, 'bear_rsi_required': False, 'sideways_strategy': 'breakout', 'sideways_bb_std_mult': 3.3774665068964276, 'sideways_rsi_os': 25, 'sideways_rsi_ob': 91, 'sideways_adx_thresh': 16.46252749438045, 'sideways_atr_min_pct': 0.0012460176667204504, 'sideways_atr_max_pct': 0.09949464674194991, 'sideways_tp_mult': 2.845191479731589, 'sideways_tsl_mult': 0.8789959365123678, 'sideways_time_stop': 214, 'sideways_use_sma': True, 'sideways_use_ema': True, 'sideways_use_atr': False, 'sideways_use_adx': True, 'sideways_use_spike': False, 'sideways_rsi_required': False}.
[I 2025-08-30 15:41:37,958] Trial 159 finished with values: [-1000000000.0, 1000000000.0] and parameters: {'p_sma': 18, 'p_std': 22, 'p_atr': 22, 'p_adx': 16, 'rsi_period': 41, 'ema1': 23, 'ema2': 34, 'slip_atr_k': 0.031994487886340836, 'slip_spread_k': 0.05096501730401464, 'spread_hl_frac': 0.04996826413154804, 'bb_std_mult': 2.873461891244135, 'rsi_os': 38, 'rsi_ob': 76, 'vol_spike': 0.0878229500354796, 'adx_thresh': 21.926934799884496, 'atr_min_pct': 0.0073334579369478, 'atr_max_pct': 0.1342590138486911, 'tp_mult': 1.039335754761351, 'tsl_mult': 0.47650329774920097, 'strategy': 'breakout', 'time_stop': 93, 'use_sma': False, 'use_atr': True, 'use_adx': False, 'use_ema': False, 'use_spike': True, 'rsi_required': False, 'edge_k': 0.29672283143032396, 'edge_cap': 0.7614657558931242, 'bull_strategy': 'mean_reversion', 'bull_bb_std_mult': 1.4829627912548746, 'bull_rsi_os': 21, 'bull_rsi_ob': 81, 'bull_adx_thresh': 34.324530200098685, 'bull_atr_min_pct': 0.002374480367485528, 'bull_atr_max_pct': 0.06547630633412158, 'bull_tp_mult': 2.6030412161219845, 'bull_tsl_mult': 0.36350579537733135, 'bull_time_stop': 55, 'bull_use_sma': True, 'bull_use_ema': False, 'bull_use_atr': False, 'bull_use_adx': False, 'bull_use_spike': False, 'bull_rsi_required': True, 'bear_strategy': 'mean_reversion', 'bear_bb_std_mult': 2.4601992236638277, 'bear_rsi_os': 53, 'bear_rsi_ob': 82, 'bear_adx_thresh': 10.19457642748217, 'bear_atr_min_pct': 0.027269381532010604, 'bear_atr_max_pct': 0.07355021200946771, 'bear_tp_mult': 2.0401156525045505, 'bear_tsl_mult': 0.6160583309375922, 'bear_time_stop': 250, 'bear_use_sma': False, 'bear_use_ema': False, 'bear_use_atr': True, 'bear_use_adx': True, 'bear_use_spike': True, 'bear_rsi_required': True, 'sideways_strategy': 'breakout', 'sideways_bb_std_mult': 3.3607241140394417, 'sideways_rsi_os': 28, 'sideways_rsi_ob': 91, 'sideways_adx_thresh': 16.438762926551433, 'sideways_atr_min_pct': 0.0024148399864318305, 'sideways_atr_max_pct': 0.099855148764757, 'sideways_tp_mult': 2.8707545904147365, 'sideways_tsl_mult': 0.8696110277026727, 'sideways_time_stop': 215, 'sideways_use_sma': True, 'sideways_use_ema': True, 'sideways_use_atr': False, 'sideways_use_adx': True, 'sideways_use_spike': False, 'sideways_rsi_required': False}.
[I 2025-08-30 15:41:38,534] Trial 162 finished with values: [-1000000000.0, 1000000000.0] and parameters: {'p_sma': 18, 'p_std': 22, 'p_atr': 22, 'p_adx': 16, 'rsi_period': 41, 'ema1': 23, 'ema2': 32, 'slip_atr_k': 0.03432903517218538, 'slip_spread_k': 0.05129046812485117, 'spread_hl_frac': 0.04924820780289932, 'bb_std_mult': 2.858524736240015, 'rsi_os': 40, 'rsi_ob': 77, 'vol_spike': 0.013923419586159697, 'adx_thresh': 21.64378841778474, 'atr_min_pct': 0.007368001111942025, 'atr_max_pct': 0.14762276097138854, 'tp_mult': 1.035307692447191, 'tsl_mult': 0.47498200700662024, 'strategy': 'breakout', 'time_stop': 263, 'use_sma': False, 'use_atr': True, 'use_adx': False, 'use_ema': False, 'use_spike': True, 'rsi_required': False, 'edge_k': 0.2858944884638161, 'edge_cap': 0.7570901924610338, 'bull_strategy': 'mean_reversion', 'bull_bb_std_mult': 1.489668713955148, 'bull_rsi_os': 21, 'bull_rsi_ob': 81, 'bull_adx_thresh': 34.079756721475796, 'bull_atr_min_pct': 0.0027164996059134035, 'bull_atr_max_pct': 0.06629590257031055, 'bull_tp_mult': 2.587986681417, 'bull_tsl_mult': 0.3146649295774369, 'bull_time_stop': 53, 'bull_use_sma': True, 'bull_use_ema': True, 'bull_use_atr': False, 'bull_use_adx': False, 'bull_use_spike': False, 'bull_rsi_required': True, 'bear_strategy': 'mean_reversion', 'bear_bb_std_mult': 2.4650168715040155, 'bear_rsi_os': 50, 'bear_rsi_ob': 82, 'bear_adx_thresh': 10.204472541801497, 'bear_atr_min_pct': 0.026959286266780586, 'bear_atr_max_pct': 0.07274026479047456, 'bear_tp_mult': 2.0623589455006073, 'bear_tsl_mult': 0.5743455664573655, 'bear_time_stop': 282, 'bear_use_sma': False, 'bear_use_ema': False, 'bear_use_atr': True, 'bear_use_adx': True, 'bear_use_spike': True, 'bear_rsi_required': True, 'sideways_strategy': 'breakout', 'sideways_bb_std_mult': 3.378260612533243, 'sideways_rsi_os': 26, 'sideways_rsi_ob': 93, 'sideways_adx_thresh': 16.483369132311342, 'sideways_atr_min_pct': 0.0011328899176285458, 'sideways_atr_max_pct': 0.10126734550684743, 'sideways_tp_mult': 2.874134996455872, 'sideways_tsl_mult': 0.8761708306330073, 'sideways_time_stop': 250, 'sideways_use_sma': True, 'sideways_use_ema': True, 'sideways_use_atr': False, 'sideways_use_adx': True, 'sideways_use_spike': False, 'sideways_rsi_required': True}.
