[I 2025-08-30 17:12:29,330] Trial 669 finished with values: [-1000000000.0, 1000000000.0] and parameters: {'p_sma': 55, 'p_std': 22, 'p_atr': 17, 'p_adx': 9, 'rsi_period': 71, 'ema1': 20, 'ema2': 36, 'slip_atr_k': 0.21864401242443515, 'slip_spread_k': 0.17815482580874797, 'spread_hl_frac': 0.016453822013323318, 'bb_std_mult': 0.501215215204184, 'rsi_os': 17, 'rsi_ob': 86, 'vol_spike': 0.0783352505503697, 'adx_thresh': 9.124145844986044, 'atr_min_pct': 0.01819378624648173, 'atr_max_pct': 0.14306623927164322, 'tp_mult': 2.123206377911409, 'tsl_mult': 0.957382086087605, 'strategy': 'breakout', 'time_stop': 88, 'use_sma': True, 'use_atr': True, 'use_adx': True, 'use_ema': True, 'use_spike': True, 'rsi_required': False, 'edge_k': 0.7037316632690235, 'edge_cap': 0.999864771211705, 'bull_strategy': 'mean_reversion', 'bull_bb_std_mult': 2.6994035649320285, 'bull_rsi_os': 10, 'bull_rsi_ob': 54, 'bull_adx_thresh': 33.818377997852465, 'bull_atr_min_pct': 0.026412161424969195, 'bull_atr_max_pct': 0.11868744828533206, 'bull_tp_mult': 2.259831995755828, 'bull_tsl_mult': 0.8079385263864526, 'bull_time_stop': 198, 'bull_use_sma': True, 'bull_use_ema': True, 'bull_use_atr': False, 'bull_use_adx': True, 'bull_use_spike': False, 'bull_rsi_required': True, 'bear_strategy': 'breakout', 'bear_bb_std_mult': 1.3056337324884733, 'bear_rsi_os': 14, 'bear_rsi_ob': 73, 'bear_adx_thresh': 12.81770860294359, 'bear_atr_min_pct': 0.0030895007214011526, 'bear_atr_max_pct': 0.10685898487266303, 'bear_tp_mult': 2.6449664709170415, 'bear_tsl_mult': 0.6509021875473557, 'bear_time_stop': 207, 'bear_use_sma': False, 'bear_use_ema': False, 'bear_use_atr': True, 'bear_use_adx': False, 'bear_use_spike': False, 'bear_rsi_required': True, 'sideways_strategy': 'mean_reversion', 'sideways_bb_std_mult': 0.7400004546319588, 'sideways_rsi_os': 21, 'sideways_rsi_ob': 89, 'sideways_adx_thresh': 13.175756762856164, 'sideways_atr_min_pct': 0.021230942102481977, 'sideways_atr_max_pct': 0.09508721340390464, 'sideways_tp_mult': 2.970815725017952, 'sideways_tsl_mult': 0.1952151041564052, 'sideways_time_stop': 300, 'sideways_use_sma': False, 'sideways_use_ema': True, 'sideways_use_atr': True, 'sideways_use_adx': True, 'sideways_use_spike': True, 'sideways_rsi_required': False}.
[I 2025-08-30 17:12:29,810] Trial 667 finished with values: [-1000000000.0, 1000000000.0] and parameters: {'p_sma': 6, 'p_std': 21, 'p_atr': 17, 'p_adx': 8, 'rsi_period': 40, 'ema1': 17, 'ema2': 13, 'slip_atr_k': 0.12152373559369233, 'slip_spread_k': 0.20967527588374846, 'spread_hl_frac': 0.022104309558006463, 'bb_std_mult': 3.5981362894022935, 'rsi_os': 32, 'rsi_ob': 86, 'vol_spike': 0.0913176988358617, 'adx_thresh': 21.70546501691273, 'atr_min_pct': 0.020646290332504535, 'atr_max_pct': 0.06475101639602417, 'tp_mult': 1.6901679406506214, 'tsl_mult': 0.9506501408315645, 'strategy': 'breakout', 'time_stop': 214, 'use_sma': True, 'use_atr': True, 'use_adx': True, 'use_ema': True, 'use_spike': True, 'rsi_required': False, 'edge_k': 0.7004498603526279, 'edge_cap': 0.8436141609321579, 'bull_strategy': 'mean_reversion', 'bull_bb_std_mult': 1.7824412836239376, 'bull_rsi_os': 11, 'bull_rsi_ob': 54, 'bull_adx_thresh': 33.64446203882826, 'bull_atr_min_pct': 0.028012369157112763, 'bull_atr_max_pct': 0.1418939085825109, 'bull_tp_mult': 2.2622281614786655, 'bull_tsl_mult': 0.8156818581213652, 'bull_time_stop': 75, 'bull_use_sma': True, 'bull_use_ema': False, 'bull_use_atr': False, 'bull_use_adx': True, 'bull_use_spike': True, 'bull_rsi_required': True, 'bear_strategy': 'breakout', 'bear_bb_std_mult': 1.4498169478107872, 'bear_rsi_os': 23, 'bear_rsi_ob': 73, 'bear_adx_thresh': 23.67582893447699, 'bear_atr_min_pct': 0.0013899920451920702, 'bear_atr_max_pct': 0.11163756182126723, 'bear_tp_mult': 2.6372610131711336, 'bear_tsl_mult': 0.38897656377769574, 'bear_time_stop': 95, 'bear_use_sma': False, 'bear_use_ema': True, 'bear_use_atr': True, 'bear_use_adx': False, 'bear_use_spike': False, 'bear_rsi_required': False, 'sideways_strategy': 'breakout', 'sideways_bb_std_mult': 0.7285466613994463, 'sideways_rsi_os': 35, 'sideways_rsi_ob': 82, 'sideways_adx_thresh': 12.59137108614283, 'sideways_atr_min_pct': 0.021406635046715267, 'sideways_atr_max_pct': 0.09557652100229201, 'sideways_tp_mult': 2.837463548363479, 'sideways_tsl_mult': 0.669903243615328, 'sideways_time_stop': 281, 'sideways_use_sma': True, 'sideways_use_ema': True, 'sideways_use_atr': True, 'sideways_use_adx': True, 'sideways_use_spike': True, 'sideways_rsi_required': False}.
[I 2025-08-30 17:12:29,995] Trial 666 finished with values: [-0.060606973755605975, 0.060536241088110655] and parameters: {'p_sma': 34, 'p_std': 22, 'p_atr': 17, 'p_adx': 8, 'rsi_period': 40, 'ema1': 17, 'ema2': 33, 'slip_atr_k': 0.1237947985083874, 'slip_spread_k': 0.20194059201153652, 'spread_hl_frac': 0.019871859094751594, 'bb_std_mult': 3.2809105726690597, 'rsi_os': 32, 'rsi_ob': 86, 'vol_spike': 0.07915664649255372, 'adx_thresh': 21.812251623617158, 'atr_min_pct': 0.0259153314197798, 'atr_max_pct': 0.06633342773808878, 'tp_mult': 1.6816821866019187, 'tsl_mult': 0.9492219180544093, 'strategy': 'breakout', 'time_stop': 231, 'use_sma': True, 'use_atr': True, 'use_adx': True, 'use_ema': True, 'use_spike': True, 'rsi_required': False, 'edge_k': 0.6988785670338976, 'edge_cap': 0.9985795492895077, 'bull_strategy': 'mean_reversion', 'bull_bb_std_mult': 2.989390831571161, 'bull_rsi_os': 11, 'bull_rsi_ob': 54, 'bull_adx_thresh': 34.98551886067377, 'bull_atr_min_pct': 0.023163926595179605, 'bull_atr_max_pct': 0.10924763907431617, 'bull_tp_mult': 2.26336511131819, 'bull_tsl_mult': 0.8096293085357218, 'bull_time_stop': 89, 'bull_use_sma': True, 'bull_use_ema': False, 'bull_use_atr': False, 'bull_use_adx': True, 'bull_use_spike': True, 'bull_rsi_required': True, 'bear_strategy': 'breakout', 'bear_bb_std_mult': 1.476768119946748, 'bear_rsi_os': 17, 'bear_rsi_ob': 94, 'bear_adx_thresh': 23.731612847135978, 'bear_atr_min_pct': 0.024128213562917, 'bear_atr_max_pct': 0.10195927863013286, 'bear_tp_mult': 2.855238927877485, 'bear_tsl_mult': 0.6612989373290743, 'bear_time_stop': 77, 'bear_use_sma': False, 'bear_use_ema': True, 'bear_use_atr': True, 'bear_use_adx': False, 'bear_use_spike': False, 'bear_rsi_required': False, 'sideways_strategy': 'breakout', 'sideways_bb_std_mult': 0.7690274151139247, 'sideways_rsi_os': 35, 'sideways_rsi_ob': 89, 'sideways_adx_thresh': 12.391033061817467, 'sideways_atr_min_pct': 0.0005551251247469741, 'sideways_atr_max_pct': 0.0957620107840745, 'sideways_tp_mult': 2.8525264039347156, 'sideways_tsl_mult': 0.2481962063010948, 'sideways_time_stop': 258, 'sideways_use_sma': True, 'sideways_use_ema': True, 'sideways_use_atr': True, 'sideways_use_adx': True, 'sideways_use_spike': True, 'sideways_rsi_required': False}.
[I 2025-08-30 17:12:30,103] Trial 668 finished with values: [-1000000000.0, 1000000000.0] and parameters: {'p_sma': 54, 'p_std': 22, 'p_atr': 17, 'p_adx': 8, 'rsi_period': 40, 'ema1': 20, 'ema2': 13, 'slip_atr_k': 0.08885995462863311, 'slip_spread_k': 0.16588168418678909, 'spread_hl_frac': 0.022035386071883746, 'bb_std_mult': 1.1542927069045716, 'rsi_os': 51, 'rsi_ob': 86, 'vol_spike': 0.07842843135992916, 'adx_thresh': 25.35906465306849, 'atr_min_pct': 0.025490398814142393, 'atr_max_pct': 0.14995444818911322, 'tp_mult': 2.11599838174391, 'tsl_mult': 0.9145611426792969, 'strategy': 'breakout', 'time_stop': 100, 'use_sma': True, 'use_atr': True, 'use_adx': True, 'use_ema': True, 'use_spike': True, 'rsi_required': False, 'edge_k': 0.7004759660182893, 'edge_cap': 0.8483304817148902, 'bull_strategy': 'mean_reversion', 'bull_bb_std_mult': 3.2773015367601706, 'bull_rsi_os': 51, 'bull_rsi_ob': 54, 'bull_adx_thresh': 32.95155775541394, 'bull_atr_min_pct': 0.023806463866867727, 'bull_atr_max_pct': 0.11737956034463168, 'bull_tp_mult': 2.2571252566564364, 'bull_tsl_mult': 0.8081449063793272, 'bull_time_stop': 256, 'bull_use_sma': True, 'bull_use_ema': True, 'bull_use_atr': False, 'bull_use_adx': True, 'bull_use_spike': True, 'bull_rsi_required': True, 'bear_strategy': 'breakout', 'bear_bb_std_mult': 1.294635415372108, 'bear_rsi_os': 55, 'bear_rsi_ob': 73, 'bear_adx_thresh': 12.894539880206679, 'bear_atr_min_pct': 0.008573498622464468, 'bear_atr_max_pct': 0.11071125686752835, 'bear_tp_mult': 2.045705162517816, 'bear_tsl_mult': 0.1949911629495537, 'bear_time_stop': 207, 'bear_use_sma': False, 'bear_use_ema': False, 'bear_use_atr': True, 'bear_use_adx': False, 'bear_use_spike': False, 'bear_rsi_required': False, 'sideways_strategy': 'mean_reversion', 'sideways_bb_std_mult': 0.7672009705922346, 'sideways_rsi_os': 32, 'sideways_rsi_ob': 82, 'sideways_adx_thresh': 12.13532715387141, 'sideways_atr_min_pct': 0.0006263582481651272, 'sideways_atr_max_pct': 0.09416593273210615, 'sideways_tp_mult': 2.995294491135693, 'sideways_tsl_mult': 0.3926672107499231, 'sideways_time_stop': 281, 'sideways_use_sma': False, 'sideways_use_ema': True, 'sideways_use_atr': True, 'sideways_use_adx': True, 'sideways_use_spike': True, 'sideways_rsi_required': False}.
[I 2025-08-30 17:12:31,432] Trial 670 finished with values: [-1000000000.0, 1000000000.0] and parameters: {'p_sma': 34, 'p_std': 20, 'p_atr': 15, 'p_adx': 8, 'rsi_period': 41, 'ema1': 18, 'ema2': 13, 'slip_atr_k': 0.09052106360378616, 'slip_spread_k': 0.1632196846732329, 'spread_hl_frac': 0.03923593886670147, 'bb_std_mult': 1.1108225701669563, 'rsi_os': 51, 'rsi_ob': 86, 'vol_spike': 0.09837018011322755, 'adx_thresh': 29.349755694124173, 'atr_min_pct': 0.02210755313257145, 'atr_max_pct': 0.06462586924609794, 'tp_mult': 2.705406499279975, 'tsl_mult': 0.8993614155007456, 'strategy': 'mean_reversion', 'time_stop': 230, 'use_sma': True, 'use_atr': True, 'use_adx': True, 'use_ema': True, 'use_spike': True, 'rsi_required': True, 'edge_k': 0.6347489647115068, 'edge_cap': 0.9013772922996169, 'bull_strategy': 'mean_reversion', 'bull_bb_std_mult': 3.0560842246305246, 'bull_rsi_os': 12, 'bull_rsi_ob': 54, 'bull_adx_thresh': 34.97988966193908, 'bull_atr_min_pct': 0.015447847561034185, 'bull_atr_max_pct': 0.1410951328894034, 'bull_tp_mult': 2.3366157127369918, 'bull_tsl_mult': 0.7894301958547705, 'bull_time_stop': 60, 'bull_use_sma': True, 'bull_use_ema': False, 'bull_use_atr': False, 'bull_use_adx': True, 'bull_use_spike': False, 'bull_rsi_required': False, 'bear_strategy': 'breakout', 'bear_bb_std_mult': 1.44492053611915, 'bear_rsi_os': 54, 'bear_rsi_ob': 75, 'bear_adx_thresh': 12.83874727800593, 'bear_atr_min_pct': 0.018299700044598292, 'bear_atr_max_pct': 0.11109398094389947, 'bear_tp_mult': 2.4192804254383087, 'bear_tsl_mult': 0.601034097704076, 'bear_time_stop': 200, 'bear_use_sma': True, 'bear_use_ema': False, 'bear_use_atr': True, 'bear_use_adx': False, 'bear_use_spike': False, 'bear_rsi_required': False, 'sideways_strategy': 'breakout', 'sideways_bb_std_mult': 0.7851081460777526, 'sideways_rsi_os': 49, 'sideways_rsi_ob': 92, 'sideways_adx_thresh': 12.19377416283644, 'sideways_atr_min_pct': 0.0012969720223579735, 'sideways_atr_max_pct': 0.09654085991676262, 'sideways_tp_mult': 2.944591369754231, 'sideways_tsl_mult': 0.6716737143973142, 'sideways_time_stop': 278, 'sideways_use_sma': True, 'sideways_use_ema': True, 'sideways_use_atr': False, 'sideways_use_adx': False, 'sideways_use_spike': True, 'sideways_rsi_required': True}.
[I 2025-08-30 17:13:12,733] Trial 672 finished with values: [-0.01618194016357033, 0.016073137374592567] and parameters: {'p_sma': 8, 'p_std': 20, 'p_atr': 15, 'p_adx': 9, 'rsi_period': 24, 'ema1': 18, 'ema2': 10, 'slip_atr_k': 0.00948939361543856, 'slip_spread_k': 0.16533457104997842, 'spread_hl_frac': 0.0023048397312984623, 'bb_std_mult': 0.638931092340872, 'rsi_os': 29, 'rsi_ob': 85, 'vol_spike': 0.09775269845436574, 'adx_thresh': 11.708972238241627, 'atr_min_pct': 0.018900106031192708, 'atr_max_pct': 0.050294977465225515, 'tp_mult': 2.695822543197578, 'tsl_mult': 0.900224154762931, 'strategy': 'mean_reversion', 'time_stop': 203, 'use_sma': False, 'use_atr': True, 'use_adx': True, 'use_ema': False, 'use_spike': False, 'rsi_required': True, 'edge_k': 0.5344012754561104, 'edge_cap': 0.8764951847713535, 'bull_strategy': 'breakout', 'bull_bb_std_mult': 2.076619526894025, 'bull_rsi_os': 53, 'bull_rsi_ob': 72, 'bull_adx_thresh': 33.91327674039658, 'bull_atr_min_pct': 0.02256920832176936, 'bull_atr_max_pct': 0.14279223618225867, 'bull_tp_mult': 2.351596246653251, 'bull_tsl_mult': 0.7816448680077919, 'bull_time_stop': 61, 'bull_use_sma': True, 'bull_use_ema': True, 'bull_use_atr': False, 'bull_use_adx': True, 'bull_use_spike': False, 'bull_rsi_required': False, 'bear_strategy': 'mean_reversion', 'bear_bb_std_mult': 1.6365540219308083, 'bear_rsi_os': 16, 'bear_rsi_ob': 63, 'bear_adx_thresh': 29.616352526999716, 'bear_atr_min_pct': 0.025794788986384123, 'bear_atr_max_pct': 0.116856837935356, 'bear_tp_mult': 2.7694407256631703, 'bear_tsl_mult': 0.5991118311644655, 'bear_time_stop': 200, 'bear_use_sma': True, 'bear_use_ema': False, 'bear_use_atr': False, 'bear_use_adx': True, 'bear_use_spike': True, 'bear_rsi_required': True, 'sideways_strategy': 'breakout', 'sideways_bb_std_mult': 0.8770581737648058, 'sideways_rsi_os': 31, 'sideways_rsi_ob': 51, 'sideways_adx_thresh': 9.259260627060945, 'sideways_atr_min_pct': 0.0014561385417031132, 'sideways_atr_max_pct': 0.10558016774162642, 'sideways_tp_mult': 2.952961447471985, 'sideways_tsl_mult': 0.2741293564573889, 'sideways_time_stop': 277, 'sideways_use_sma': True, 'sideways_use_ema': False, 'sideways_use_atr': False, 'sideways_use_adx': False, 'sideways_use_spike': False, 'sideways_rsi_required': True}.
[I 2025-08-30 17:13:13,124] Trial 673 finished with values: [-0.022336203738486438, 0.02222735838408233] and parameters: {'p_sma': 8, 'p_std': 20, 'p_atr': 15, 'p_adx': 9, 'rsi_period': 21, 'ema1': 18, 'ema2': 10, 'slip_atr_k': 0.008427762858560525, 'slip_spread_k': 0.15341717141930153, 'spread_hl_frac': 0.03907196883760897, 'bb_std_mult': 3.208064273469599, 'rsi_os': 14, 'rsi_ob': 85, 'vol_spike': 0.09901504537631911, 'adx_thresh': 29.33556560227664, 'atr_min_pct': 0.022243498089371212, 'atr_max_pct': 0.02353461295096474, 'tp_mult': 2.807752088158472, 'tsl_mult': 0.915000701712434, 'strategy': 'mean_reversion', 'time_stop': 199, 'use_sma': False, 'use_atr': True, 'use_adx': True, 'use_ema': False, 'use_spike': False, 'rsi_required': True, 'edge_k': 0.6433317599931723, 'edge_cap': 0.8829547939999773, 'bull_strategy': 'breakout', 'bull_bb_std_mult': 0.5939330460233851, 'bull_rsi_os': 53, 'bull_rsi_ob': 91, 'bull_adx_thresh': 34.00025027379658, 'bull_atr_min_pct': 0.015298628964097354, 'bull_atr_max_pct': 0.14282692532194788, 'bull_tp_mult': 2.3603611261922843, 'bull_tsl_mult': 0.7761481938162538, 'bull_time_stop': 61, 'bull_use_sma': True, 'bull_use_ema': True, 'bull_use_atr': False, 'bull_use_adx': True, 'bull_use_spike': False, 'bull_rsi_required': False, 'bear_strategy': 'mean_reversion', 'bear_bb_std_mult': 1.1286169954885512, 'bear_rsi_os': 15, 'bear_rsi_ob': 63, 'bear_adx_thresh': 24.693578784464563, 'bear_atr_min_pct': 0.016398368112145997, 'bear_atr_max_pct': 0.10711009326182593, 'bear_tp_mult': 2.1695778428031054, 'bear_tsl_mult': 0.5953082437739957, 'bear_time_stop': 200, 'bear_use_sma': True, 'bear_use_ema': False, 'bear_use_atr': False, 'bear_use_adx': True, 'bear_use_spike': True, 'bear_rsi_required': True, 'sideways_strategy': 'breakout', 'sideways_bb_std_mult': 0.8780197930297068, 'sideways_rsi_os': 49, 'sideways_rsi_ob': 92, 'sideways_adx_thresh': 9.617159380745663, 'sideways_atr_min_pct': 0.0021391869429721955, 'sideways_atr_max_pct': 0.10055642886091586, 'sideways_tp_mult': 2.938945084680505, 'sideways_tsl_mult': 0.4616470994104718, 'sideways_time_stop': 272, 'sideways_use_sma': True, 'sideways_use_ema': False, 'sideways_use_atr': False, 'sideways_use_adx': False, 'sideways_use_spike': False, 'sideways_rsi_required': True}.
[I 2025-08-30 17:13:13,503] Trial 671 finished with values: [-1000000000.0, 1000000000.0] and parameters: {'p_sma': 34, 'p_std': 20, 'p_atr': 15, 'p_adx': 9, 'rsi_period': 21, 'ema1': 18, 'ema2': 27, 'slip_atr_k': 0.010776877272126211, 'slip_spread_k': 0.15903583342233302, 'spread_hl_frac': 0.004676718734724715, 'bb_std_mult': 0.8368983536107761, 'rsi_os': 29, 'rsi_ob': 86, 'vol_spike': 0.09599820295780194, 'adx_thresh': 11.832637682617758, 'atr_min_pct': 0.004754383944365963, 'atr_max_pct': 0.05085862753674064, 'tp_mult': 2.614861699897445, 'tsl_mult': 0.9070232567228657, 'strategy': 'mean_reversion', 'time_stop': 102, 'use_sma': False, 'use_atr': True, 'use_adx': True, 'use_ema': False, 'use_spike': False, 'rsi_required': True, 'edge_k': 0.6213564681760554, 'edge_cap': 0.8874596482577064, 'bull_strategy': 'mean_reversion', 'bull_bb_std_mult': 1.051329934193221, 'bull_rsi_os': 12, 'bull_rsi_ob': 92, 'bull_adx_thresh': 34.411702157945335, 'bull_atr_min_pct': 0.006845059440650177, 'bull_atr_max_pct': 0.14289109043806922, 'bull_tp_mult': 2.345300133696495, 'bull_tsl_mult': 0.7841641377357582, 'bull_time_stop': 258, 'bull_use_sma': True, 'bull_use_ema': True, 'bull_use_atr': False, 'bull_use_adx': True, 'bull_use_spike': False, 'bull_rsi_required': False, 'bear_strategy': 'mean_reversion', 'bear_bb_std_mult': 1.6325767532498316, 'bear_rsi_os': 22, 'bear_rsi_ob': 64, 'bear_adx_thresh': 25.728244176393247, 'bear_atr_min_pct': 0.018122168210806765, 'bear_atr_max_pct': 0.10332190257700488, 'bear_tp_mult': 2.183790011552879, 'bear_tsl_mult': 0.6627090047906837, 'bear_time_stop': 200, 'bear_use_sma': True, 'bear_use_ema': False, 'bear_use_atr': False, 'bear_use_adx': False, 'bear_use_spike': False, 'bear_rsi_required': False, 'sideways_strategy': 'breakout', 'sideways_bb_std_mult': 0.8715035944722324, 'sideways_rsi_os': 32, 'sideways_rsi_ob': 78, 'sideways_adx_thresh': 9.153109731919908, 'sideways_atr_min_pct': 0.007467290712400255, 'sideways_atr_max_pct': 0.09666763841196162, 'sideways_tp_mult': 2.9981700306673207, 'sideways_tsl_mult': 0.2761498442105943, 'sideways_time_stop': 276, 'sideways_use_sma': True, 'sideways_use_ema': False, 'sideways_use_atr': False, 'sideways_use_adx': False, 'sideways_use_spike': False, 'sideways_rsi_required': True}.
[I 2025-08-30 17:13:14,148] Trial 674 finished with values: [-1000000000.0, 1000000000.0] and parameters: {'p_sma': 8, 'p_std': 20, 'p_atr': 15, 'p_adx': 7, 'rsi_period': 80, 'ema1': 18, 'ema2': 10, 'slip_atr_k': 0.0105461044532211, 'slip_spread_k': 0.15906662093820118, 'spread_hl_frac': 0.03523281168813193, 'bb_std_mult': 2.233482712053196, 'rsi_os': 14, 'rsi_ob': 85, 'vol_spike': 0.09903625817979081, 'adx_thresh': 11.782748701420733, 'atr_min_pct': 0.018917011002635566, 'atr_max_pct': 0.12139020569679722, 'tp_mult': 2.2488238047182514, 'tsl_mult': 0.9076495360658594, 'strategy': 'mean_reversion', 'time_stop': 31, 'use_sma': False, 'use_atr': True, 'use_adx': True, 'use_ema': False, 'use_spike': False, 'rsi_required': True, 'edge_k': 0.390625163727647, 'edge_cap': 0.8711785746439399, 'bull_strategy': 'breakout', 'bull_bb_std_mult': 2.099446492461469, 'bull_rsi_os': 37, 'bull_rsi_ob': 80, 'bull_adx_thresh': 33.866403456397, 'bull_atr_min_pct': 0.0066625348375660975, 'bull_atr_max_pct': 0.0298952126458474, 'bull_tp_mult': 2.1912066102236545, 'bull_tsl_mult': 0.7748380570376907, 'bull_time_stop': 66, 'bull_use_sma': True, 'bull_use_ema': True, 'bull_use_atr': False, 'bull_use_adx': True, 'bull_use_spike': False, 'bull_rsi_required': False, 'bear_strategy': 'mean_reversion', 'bear_bb_std_mult': 1.1226253006049633, 'bear_rsi_os': 16, 'bear_rsi_ob': 76, 'bear_adx_thresh': 25.774124019814, 'bear_atr_min_pct': 0.026546768766679756, 'bear_atr_max_pct': 0.1167407861109112, 'bear_tp_mult': 2.1807885537098533, 'bear_tsl_mult': 0.6341169816346921, 'bear_time_stop': 18, 'bear_use_sma': True, 'bear_use_ema': False, 'bear_use_atr': False, 'bear_use_adx': True, 'bear_use_spike': True, 'bear_rsi_required': True, 'sideways_strategy': 'breakout', 'sideways_bb_std_mult': 0.8861664032649731, 'sideways_rsi_os': 31, 'sideways_rsi_ob': 80, 'sideways_adx_thresh': 10.118124591872435, 'sideways_atr_min_pct': 0.002182530300688947, 'sideways_atr_max_pct': 0.10144067838276932, 'sideways_tp_mult': 2.998815442797986, 'sideways_tsl_mult': 0.05160493527826615, 'sideways_time_stop': 272, 'sideways_use_sma': True, 'sideways_use_ema': False, 'sideways_use_atr': False, 'sideways_use_adx': False, 'sideways_use_spike': False, 'sideways_rsi_required': True}.
