[I 2025-08-30 17:05:35,782] Trial 629 finished with values: [-1000000000.0, 1000000000.0] and parameters: {'p_sma': 9, 'p_std': 23, 'p_atr': 17, 'p_adx': 7, 'rsi_period': 24, 'ema1': 17, 'ema2': 41, 'slip_atr_k': 0.07375792517824722, 'slip_spread_k': 0.3289704224835548, 'spread_hl_frac': 0.018979238990118597, 'bb_std_mult': 3.347711842481006, 'rsi_os': 33, 'rsi_ob': 87, 'vol_spike': 0.06861011981491054, 'adx_thresh': 11.5034858137578, 'atr_min_pct': 0.0006664916699858497, 'atr_max_pct': 0.14696117146520404, 'tp_mult': 2.703179577112917, 'tsl_mult': 0.9114304142866082, 'strategy': 'mean_reversion', 'time_stop': 28, 'use_sma': False, 'use_atr': True, 'use_adx': True, 'use_ema': False, 'use_spike': True, 'rsi_required': True, 'edge_k': 0.8277367629965495, 'edge_cap': 0.7720102402045855, 'bull_strategy': 'mean_reversion', 'bull_bb_std_mult': 2.181255427629541, 'bull_rsi_os': 36, 'bull_rsi_ob': 54, 'bull_adx_thresh': 34.417241716759634, 'bull_atr_min_pct': 0.022666106930629506, 'bull_atr_max_pct': 0.08887230541911866, 'bull_tp_mult': 2.2053953944772395, 'bull_tsl_mult': 0.736052652897409, 'bull_time_stop': 71, 'bull_use_sma': True, 'bull_use_ema': True, 'bull_use_atr': False, 'bull_use_adx': True, 'bull_use_spike': False, 'bull_rsi_required': False, 'bear_strategy': 'mean_reversion', 'bear_bb_std_mult': 0.8682477628815091, 'bear_rsi_os': 37, 'bear_rsi_ob': 76, 'bear_adx_thresh': 26.384590990594425, 'bear_atr_min_pct': 0.009737229209907822, 'bear_atr_max_pct': 0.11327313263184084, 'bear_tp_mult': 2.159818580863283, 'bear_tsl_mult': 0.6219468488491553, 'bear_time_stop': 198, 'bear_use_sma': True, 'bear_use_ema': False, 'bear_use_atr': False, 'bear_use_adx': False, 'bear_use_spike': False, 'bear_rsi_required': True, 'sideways_strategy': 'breakout', 'sideways_bb_std_mult': 0.7694821161615478, 'sideways_rsi_os': 33, 'sideways_rsi_ob': 89, 'sideways_adx_thresh': 11.964037510285038, 'sideways_atr_min_pct': 0.023098986436305074, 'sideways_atr_max_pct': 0.1057238678891911, 'sideways_tp_mult': 2.9589655643409998, 'sideways_tsl_mult': 0.4518785186263858, 'sideways_time_stop': 268, 'sideways_use_sma': True, 'sideways_use_ema': False, 'sideways_use_atr': False, 'sideways_use_adx': False, 'sideways_use_spike': False, 'sideways_rsi_required': True}.
[I 2025-08-30 17:06:22,643] Trial 631 finished with values: [-1000000000.0, 1000000000.0] and parameters: {'p_sma': 7, 'p_std': 21, 'p_atr': 15, 'p_adx': 7, 'rsi_period': 24, 'ema1': 18, 'ema2': 19, 'slip_atr_k': 0.07367145396470737, 'slip_spread_k': 0.17311391570616388, 'spread_hl_frac': 0.01954364789502417, 'bb_std_mult': 3.2176054228951885, 'rsi_os': 33, 'rsi_ob': 87, 'vol_spike': 0.08803160131326826, 'adx_thresh': 10.255958640525767, 'atr_min_pct': 0.0006325628360722684, 'atr_max_pct': 0.1469009298785439, 'tp_mult': 2.7153136937618596, 'tsl_mult': 0.936458187012086, 'strategy': 'mean_reversion', 'time_stop': 26, 'use_sma': True, 'use_atr': True, 'use_adx': True, 'use_ema': False, 'use_spike': True, 'rsi_required': True, 'edge_k': 0.8375638890825201, 'edge_cap': 0.7663169127137744, 'bull_strategy': 'mean_reversion', 'bull_bb_std_mult': 3.3610263466299157, 'bull_rsi_os': 30, 'bull_rsi_ob': 54, 'bull_adx_thresh': 34.98194071849586, 'bull_atr_min_pct': 0.02244064735480955, 'bull_atr_max_pct': 0.14830326815525802, 'bull_tp_mult': 2.206129577332629, 'bull_tsl_mult': 0.8296278125617754, 'bull_time_stop': 33, 'bull_use_sma': True, 'bull_use_ema': True, 'bull_use_atr': False, 'bull_use_adx': True, 'bull_use_spike': False, 'bull_rsi_required': False, 'bear_strategy': 'mean_reversion', 'bear_bb_std_mult': 1.1207860384967225, 'bear_rsi_os': 31, 'bear_rsi_ob': 75, 'bear_adx_thresh': 12.18034745536258, 'bear_atr_min_pct': 0.005742456630198553, 'bear_atr_max_pct': 0.11373981738871351, 'bear_tp_mult': 2.1708446253481593, 'bear_tsl_mult': 0.6156277005623468, 'bear_time_stop': 191, 'bear_use_sma': True, 'bear_use_ema': False, 'bear_use_atr': True, 'bear_use_adx': False, 'bear_use_spike': False, 'bear_rsi_required': True, 'sideways_strategy': 'breakout', 'sideways_bb_std_mult': 0.999859331703143, 'sideways_rsi_os': 31, 'sideways_rsi_ob': 87, 'sideways_adx_thresh': 10.413016189317283, 'sideways_atr_min_pct': 0.0022297245989824025, 'sideways_atr_max_pct': 0.10277594162505739, 'sideways_tp_mult': 2.9964653486131496, 'sideways_tsl_mult': 0.4404171843132852, 'sideways_time_stop': 283, 'sideways_use_sma': True, 'sideways_use_ema': True, 'sideways_use_atr': False, 'sideways_use_adx': False, 'sideways_use_spike': False, 'sideways_rsi_required': True}.
[I 2025-08-30 17:06:23,120] Trial 634 finished with values: [-1000000000.0, 1000000000.0] and parameters: {'p_sma': 39, 'p_std': 16, 'p_atr': 15, 'p_adx': 7, 'rsi_period': 21, 'ema1': 18, 'ema2': 31, 'slip_atr_k': 0.052637301631985906, 'slip_spread_k': 0.23431352840663258, 'spread_hl_frac': 0.04438292594534162, 'bb_std_mult': 3.178408857422572, 'rsi_os': 24, 'rsi_ob': 87, 'vol_spike': 0.0878200845203719, 'adx_thresh': 10.790904379729396, 'atr_min_pct': 0.018587306748736494, 'atr_max_pct': 0.14392052096256466, 'tp_mult': 2.6523586770455103, 'tsl_mult': 0.9557572636210738, 'strategy': 'breakout', 'time_stop': 27, 'use_sma': True, 'use_atr': True, 'use_adx': False, 'use_ema': True, 'use_spike': False, 'rsi_required': False, 'edge_k': 0.6335905558812222, 'edge_cap': 0.8603209189341611, 'bull_strategy': 'mean_reversion', 'bull_bb_std_mult': 1.9106966407420802, 'bull_rsi_os': 21, 'bull_rsi_ob': 55, 'bull_adx_thresh': 34.970885733919175, 'bull_atr_min_pct': 0.0048509692967364775, 'bull_atr_max_pct': 0.1406252475328145, 'bull_tp_mult': 2.322422270126866, 'bull_tsl_mult': 0.8311575904163131, 'bull_time_stop': 39, 'bull_use_sma': True, 'bull_use_ema': True, 'bull_use_atr': False, 'bull_use_adx': False, 'bull_use_spike': False, 'bull_rsi_required': True, 'bear_strategy': 'breakout', 'bear_bb_std_mult': 1.439473607692899, 'bear_rsi_os': 20, 'bear_rsi_ob': 51, 'bear_adx_thresh': 11.875023743759806, 'bear_atr_min_pct': 0.020351763767088093, 'bear_atr_max_pct': 0.10519095520703514, 'bear_tp_mult': 2.094591545498058, 'bear_tsl_mult': 0.1752551972328525, 'bear_time_stop': 205, 'bear_use_sma': True, 'bear_use_ema': False, 'bear_use_atr': True, 'bear_use_adx': False, 'bear_use_spike': True, 'bear_rsi_required': False, 'sideways_strategy': 'mean_reversion', 'sideways_bb_std_mult': 0.9201902372601536, 'sideways_rsi_os': 31, 'sideways_rsi_ob': 76, 'sideways_adx_thresh': 10.948963811905857, 'sideways_atr_min_pct': 0.013760865455586782, 'sideways_atr_max_pct': 0.10138066136257096, 'sideways_tp_mult': 2.9119692457948316, 'sideways_tsl_mult': 0.818631109268276, 'sideways_time_stop': 281, 'sideways_use_sma': True, 'sideways_use_ema': True, 'sideways_use_atr': True, 'sideways_use_adx': False, 'sideways_use_spike': True, 'sideways_rsi_required': True}.
[I 2025-08-30 17:06:23,568] Trial 633 finished with values: [-1000000000.0, 1000000000.0] and parameters: {'p_sma': 5, 'p_std': 17, 'p_atr': 15, 'p_adx': 13, 'rsi_period': 21, 'ema1': 18, 'ema2': 50, 'slip_atr_k': 0.02047409062778658, 'slip_spread_k': 0.23651075455337625, 'spread_hl_frac': 0.022982850575577175, 'bb_std_mult': 3.338973830411976, 'rsi_os': 43, 'rsi_ob': 87, 'vol_spike': 0.08792683452059233, 'adx_thresh': 10.801344147741155, 'atr_min_pct': 0.005366857547225969, 'atr_max_pct': 0.14425760771917173, 'tp_mult': 2.2028903500838233, 'tsl_mult': 0.9659074129119268, 'strategy': 'breakout', 'time_stop': 57, 'use_sma': True, 'use_atr': True, 'use_adx': False, 'use_ema': True, 'use_spike': False, 'rsi_required': False, 'edge_k': 0.7166758811119414, 'edge_cap': 0.8364783136155545, 'bull_strategy': 'mean_reversion', 'bull_bb_std_mult': 3.382470937887235, 'bull_rsi_os': 32, 'bull_rsi_ob': 53, 'bull_adx_thresh': 34.427186582140386, 'bull_atr_min_pct': 0.022928991301394364, 'bull_atr_max_pct': 0.1403164868252913, 'bull_tp_mult': 2.3694042095903374, 'bull_tsl_mult': 0.8023049598868476, 'bull_time_stop': 76, 'bull_use_sma': True, 'bull_use_ema': True, 'bull_use_atr': False, 'bull_use_adx': False, 'bull_use_spike': False, 'bull_rsi_required': True, 'bear_strategy': 'breakout', 'bear_bb_std_mult': 1.131637017781641, 'bear_rsi_os': 15, 'bear_rsi_ob': 76, 'bear_adx_thresh': 34.92298738642889, 'bear_atr_min_pct': 0.005524050551279205, 'bear_atr_max_pct': 0.11266286677286073, 'bear_tp_mult': 2.1039192672673717, 'bear_tsl_mult': 0.6422173786337435, 'bear_time_stop': 191, 'bear_use_sma': True, 'bear_use_ema': False, 'bear_use_atr': True, 'bear_use_adx': False, 'bear_use_spike': True, 'bear_rsi_required': False, 'sideways_strategy': 'mean_reversion', 'sideways_bb_std_mult': 0.60028402221094, 'sideways_rsi_os': 32, 'sideways_rsi_ob': 91, 'sideways_adx_thresh': 10.829962361477827, 'sideways_atr_min_pct': 0.015191405112475258, 'sideways_atr_max_pct': 0.09731503921005547, 'sideways_tp_mult': 2.9108351232822827, 'sideways_tsl_mult': 0.43655899010990673, 'sideways_time_stop': 284, 'sideways_use_sma': True, 'sideways_use_ema': True, 'sideways_use_atr': True, 'sideways_use_adx': False, 'sideways_use_spike': True, 'sideways_rsi_required': True}.
[I 2025-08-30 17:06:23,760] Trial 632 finished with values: [-1000000000.0, 1000000000.0] and parameters: {'p_sma': 48, 'p_std': 24, 'p_atr': 15, 'p_adx': 7, 'rsi_period': 51, 'ema1': 18, 'ema2': 50, 'slip_atr_k': 0.226128793453514, 'slip_spread_k': 0.17161826550611864, 'spread_hl_frac': 0.043940155897935346, 'bb_std_mult': 2.43402317582958, 'rsi_os': 25, 'rsi_ob': 87, 'vol_spike': 0.08830815109989207, 'adx_thresh': 11.373423065016599, 'atr_min_pct': 0.018713314568847783, 'atr_max_pct': 0.14451689966851144, 'tp_mult': 2.648277271330167, 'tsl_mult': 0.9608050722690864, 'strategy': 'mean_reversion', 'time_stop': 27, 'use_sma': True, 'use_atr': True, 'use_adx': True, 'use_ema': True, 'use_spike': False, 'rsi_required': True, 'edge_k': 0.7304387022654779, 'edge_cap': 0.7721878071919199, 'bull_strategy': 'mean_reversion', 'bull_bb_std_mult': 2.3393780732368525, 'bull_rsi_os': 7, 'bull_rsi_ob': 54, 'bull_adx_thresh': 34.35781466406223, 'bull_atr_min_pct': 0.02265004941796865, 'bull_atr_max_pct': 0.08837085442245426, 'bull_tp_mult': 2.1935127534389927, 'bull_tsl_mult': 0.8287818190691968, 'bull_time_stop': 64, 'bull_use_sma': True, 'bull_use_ema': True, 'bull_use_atr': False, 'bull_use_adx': True, 'bull_use_spike': False, 'bull_rsi_required': True, 'bear_strategy': 'breakout', 'bear_bb_std_mult': 1.117686188596323, 'bear_rsi_os': 52, 'bear_rsi_ob': 86, 'bear_adx_thresh': 10.81606366408124, 'bear_atr_min_pct': 0.020356238334073146, 'bear_atr_max_pct': 0.1061536644392852, 'bear_tp_mult': 2.108480225964532, 'bear_tsl_mult': 0.6475398614992436, 'bear_time_stop': 204, 'bear_use_sma': True, 'bear_use_ema': False, 'bear_use_atr': True, 'bear_use_adx': False, 'bear_use_spike': False, 'bear_rsi_required': False, 'sideways_strategy': 'breakout', 'sideways_bb_std_mult': 0.9422701539645446, 'sideways_rsi_os': 32, 'sideways_rsi_ob': 76, 'sideways_adx_thresh': 10.875993680584003, 'sideways_atr_min_pct': 0.0225934670468565, 'sideways_atr_max_pct': 0.1024247427650436, 'sideways_tp_mult': 2.99943882418754, 'sideways_tsl_mult': 0.8678279415833094, 'sideways_time_stop': 284, 'sideways_use_sma': True, 'sideways_use_ema': True, 'sideways_use_atr': False, 'sideways_use_adx': False, 'sideways_use_spike': True, 'sideways_rsi_required': True}.
[I 2025-08-30 17:07:10,197] Trial 638 finished with values: [-1000000000.0, 1000000000.0] and parameters: {'p_sma': 6, 'p_std': 26, 'p_atr': 16, 'p_adx': 9, 'rsi_period': 22, 'ema1': 17, 'ema2': 38, 'slip_atr_k': 0.24414283153292982, 'slip_spread_k': 0.09743757766434272, 'spread_hl_frac': 0.01117094951553074, 'bb_std_mult': 3.123021325401654, 'rsi_os': 34, 'rsi_ob': 83, 'vol_spike': 0.11565482086212459, 'adx_thresh': 11.453198179084396, 'atr_min_pct': 0.0014295171121556944, 'atr_max_pct': 0.14993273145998795, 'tp_mult': 2.877293072624442, 'tsl_mult': 0.8945157095085818, 'strategy': 'mean_reversion', 'time_stop': 46, 'use_sma': False, 'use_atr': True, 'use_adx': True, 'use_ema': False, 'use_spike': False, 'rsi_required': True, 'edge_k': 0.2329814201445507, 'edge_cap': 0.7923072475044445, 'bull_strategy': 'mean_reversion', 'bull_bb_std_mult': 1.933334416668225, 'bull_rsi_os': 18, 'bull_rsi_ob': 53, 'bull_adx_thresh': 33.90305377795653, 'bull_atr_min_pct': 0.010751586772884252, 'bull_atr_max_pct': 0.07522395974511607, 'bull_tp_mult': 2.3585288340729424, 'bull_tsl_mult': 0.8009759457781459, 'bull_time_stop': 49, 'bull_use_sma': True, 'bull_use_ema': False, 'bull_use_atr': False, 'bull_use_adx': True, 'bull_use_spike': True, 'bull_rsi_required': False, 'bear_strategy': 'mean_reversion', 'bear_bb_std_mult': 0.9921188233115534, 'bear_rsi_os': 17, 'bear_rsi_ob': 70, 'bear_adx_thresh': 10.651340107918502, 'bear_atr_min_pct': 0.013215458898951184, 'bear_atr_max_pct': 0.10523659467876091, 'bear_tp_mult': 1.1786800672566387, 'bear_tsl_mult': 0.4085326076564057, 'bear_time_stop': 206, 'bear_use_sma': True, 'bear_use_ema': True, 'bear_use_atr': False, 'bear_use_adx': True, 'bear_use_spike': False, 'bear_rsi_required': False, 'sideways_strategy': 'breakout', 'sideways_bb_std_mult': 0.8993548433491783, 'sideways_rsi_os': 31, 'sideways_rsi_ob': 69, 'sideways_adx_thresh': 9.836103460302827, 'sideways_atr_min_pct': 0.003063404817526199, 'sideways_atr_max_pct': 0.0987010038259185, 'sideways_tp_mult': 2.8578850992409786, 'sideways_tsl_mult': 0.3960367902657049, 'sideways_time_stop': 262, 'sideways_use_sma': True, 'sideways_use_ema': False, 'sideways_use_atr': False, 'sideways_use_adx': False, 'sideways_use_spike': False, 'sideways_rsi_required': False}.
[I 2025-08-30 17:07:10,624] Trial 637 finished with values: [-1000000000.0, 1000000000.0] and parameters: {'p_sma': 6, 'p_std': 20, 'p_atr': 16, 'p_adx': 9, 'rsi_period': 22, 'ema1': 18, 'ema2': 13, 'slip_atr_k': 0.20197458080877578, 'slip_spread_k': 0.25525416997967054, 'spread_hl_frac': 0.017556395873113338, 'bb_std_mult': 3.5297845535656296, 'rsi_os': 30, 'rsi_ob': 84, 'vol_spike': 0.11408198434908141, 'adx_thresh': 10.75247254062139, 'atr_min_pct': 0.018629209976091347, 'atr_max_pct': 0.14382092029646582, 'tp_mult': 2.7759434707334427, 'tsl_mult': 0.890832513325194, 'strategy': 'mean_reversion', 'time_stop': 45, 'use_sma': False, 'use_atr': True, 'use_adx': True, 'use_ema': False, 'use_spike': False, 'rsi_required': True, 'edge_k': 0.7480294773842268, 'edge_cap': 0.7328214016193142, 'bull_strategy': 'mean_reversion', 'bull_bb_std_mult': 1.9435010573806404, 'bull_rsi_os': 54, 'bull_rsi_ob': 53, 'bull_adx_thresh': 33.987192674988165, 'bull_atr_min_pct': 0.025151940276509598, 'bull_atr_max_pct': 0.019574960563292804, 'bull_tp_mult': 2.360171195750916, 'bull_tsl_mult': 0.8010523374617746, 'bull_time_stop': 283, 'bull_use_sma': True, 'bull_use_ema': False, 'bull_use_atr': False, 'bull_use_adx': True, 'bull_use_spike': True, 'bull_rsi_required': False, 'bear_strategy': 'mean_reversion', 'bear_bb_std_mult': 1.2553826245477304, 'bear_rsi_os': 24, 'bear_rsi_ob': 62, 'bear_adx_thresh': 10.692616740991344, 'bear_atr_min_pct': 0.013220912037787632, 'bear_atr_max_pct': 0.10570477838400416, 'bear_tp_mult': 1.8259479897763935, 'bear_tsl_mult': 0.602054981912206, 'bear_time_stop': 204, 'bear_use_sma': True, 'bear_use_ema': True, 'bear_use_atr': False, 'bear_use_adx': True, 'bear_use_spike': False, 'bear_rsi_required': False, 'sideways_strategy': 'breakout', 'sideways_bb_std_mult': 0.6415287646120649, 'sideways_rsi_os': 32, 'sideways_rsi_ob': 94, 'sideways_adx_thresh': 12.726665911530333, 'sideways_atr_min_pct': 0.025192720749464527, 'sideways_atr_max_pct': 0.09759829111995309, 'sideways_tp_mult': 2.8347218410631125, 'sideways_tsl_mult': 0.15258262725110477, 'sideways_time_stop': 295, 'sideways_use_sma': True, 'sideways_use_ema': False, 'sideways_use_atr': False, 'sideways_use_adx': False, 'sideways_use_spike': False, 'sideways_rsi_required': False}.
[I 2025-08-30 17:07:11,125] Trial 636 finished with values: [-1000000000.0, 1000000000.0] and parameters: {'p_sma': 5, 'p_std': 19, 'p_atr': 16, 'p_adx': 11, 'rsi_period': 21, 'ema1': 18, 'ema2': 48, 'slip_atr_k': 0.021506790717295002, 'slip_spread_k': 0.24989792101239133, 'spread_hl_frac': 0.02792053916081947, 'bb_std_mult': 3.2704946427476114, 'rsi_os': 7, 'rsi_ob': 84, 'vol_spike': 0.06250133726391727, 'adx_thresh': 11.283496876517516, 'atr_min_pct': 0.021298514603125634, 'atr_max_pct': 0.14997270284979308, 'tp_mult': 1.8685827762156286, 'tsl_mult': 0.967656619569618, 'strategy': 'mean_reversion', 'time_stop': 46, 'use_sma': False, 'use_atr': True, 'use_adx': True, 'use_ema': True, 'use_spike': False, 'rsi_required': True, 'edge_k': 0.756286558418475, 'edge_cap': 0.7907826907793839, 'bull_strategy': 'mean_reversion', 'bull_bb_std_mult': 1.9473902541898576, 'bull_rsi_os': 15, 'bull_rsi_ob': 53, 'bull_adx_thresh': 33.961288894272656, 'bull_atr_min_pct': 0.023069593722234404, 'bull_atr_max_pct': 0.1419262835913551, 'bull_tp_mult': 2.3355438648325224, 'bull_tsl_mult': 0.8015429897590228, 'bull_time_stop': 76, 'bull_use_sma': True, 'bull_use_ema': False, 'bull_use_atr': False, 'bull_use_adx': True, 'bull_use_spike': False, 'bull_rsi_required': True, 'bear_strategy': 'breakout', 'bear_bb_std_mult': 0.6371871612106079, 'bear_rsi_os': 15, 'bear_rsi_ob': 59, 'bear_adx_thresh': 10.950507707516968, 'bear_atr_min_pct': 0.0020704081634085048, 'bear_atr_max_pct': 0.10573375405926363, 'bear_tp_mult': 2.2248167623690502, 'bear_tsl_mult': 0.6511983806972885, 'bear_time_stop': 204, 'bear_use_sma': True, 'bear_use_ema': False, 'bear_use_atr': False, 'bear_use_adx': True, 'bear_use_spike': False, 'bear_rsi_required': False, 'sideways_strategy': 'breakout', 'sideways_bb_std_mult': 0.5993855168035201, 'sideways_rsi_os': 32, 'sideways_rsi_ob': 52, 'sideways_adx_thresh': 12.820454451154351, 'sideways_atr_min_pct': 0.003353081375402878, 'sideways_atr_max_pct': 0.09026951360261415, 'sideways_tp_mult': 2.895384712400889, 'sideways_tsl_mult': 0.11571670381354171, 'sideways_time_stop': 260, 'sideways_use_sma': True, 'sideways_use_ema': False, 'sideways_use_atr': True, 'sideways_use_adx': False, 'sideways_use_spike': True, 'sideways_rsi_required': False}.
[I 2025-08-30 17:07:11,404] Trial 635 finished with values: [-1000000000.0, 1000000000.0] and parameters: {'p_sma': 5, 'p_std': 26, 'p_atr': 15, 'p_adx': 8, 'rsi_period': 21, 'ema1': 18, 'ema2': 31, 'slip_atr_k': 0.051296024007274274, 'slip_spread_k': 0.24633985132249991, 'spread_hl_frac': 0.022950097421092944, 'bb_std_mult': 3.1407018014959824, 'rsi_os': 34, 'rsi_ob': 87, 'vol_spike': 0.13408811304925733, 'adx_thresh': 10.753087437080747, 'atr_min_pct': 0.01843943489404962, 'atr_max_pct': 0.14481988065029971, 'tp_mult': 2.6623071071706486, 'tsl_mult': 0.9723632735091043, 'strategy': 'breakout', 'time_stop': 46, 'use_sma': True, 'use_atr': True, 'use_adx': False, 'use_ema': True, 'use_spike': False, 'rsi_required': False, 'edge_k': 0.6483860739462989, 'edge_cap': 0.8662066891772752, 'bull_strategy': 'mean_reversion', 'bull_bb_std_mult': 1.9221984052316614, 'bull_rsi_os': 22, 'bull_rsi_ob': 53, 'bull_adx_thresh': 34.16815042881047, 'bull_atr_min_pct': 0.021875549319557114, 'bull_atr_max_pct': 0.14055510494396456, 'bull_tp_mult': 2.365055663847188, 'bull_tsl_mult': 0.7979665170711384, 'bull_time_stop': 78, 'bull_use_sma': True, 'bull_use_ema': True, 'bull_use_atr': False, 'bull_use_adx': False, 'bull_use_spike': False, 'bull_rsi_required': True, 'bear_strategy': 'breakout', 'bear_bb_std_mult': 1.4344501509148797, 'bear_rsi_os': 19, 'bear_rsi_ob': 48, 'bear_adx_thresh': 11.956161043740192, 'bear_atr_min_pct': 0.01244902563802106, 'bear_atr_max_pct': 0.10538482502602645, 'bear_tp_mult': 2.1001815744376033, 'bear_tsl_mult': 0.9851377910276282, 'bear_time_stop': 205, 'bear_use_sma': True, 'bear_use_ema': False, 'bear_use_atr': True, 'bear_use_adx': True, 'bear_use_spike': True, 'bear_rsi_required': False, 'sideways_strategy': 'mean_reversion', 'sideways_bb_std_mult': 0.9238733475882788, 'sideways_rsi_os': 31, 'sideways_rsi_ob': 91, 'sideways_adx_thresh': 10.919966231238195, 'sideways_atr_min_pct': 0.0033801429986994795, 'sideways_atr_max_pct': 0.09751945719441496, 'sideways_tp_mult': 2.9091300446224486, 'sideways_tsl_mult': 0.2970381079027807, 'sideways_time_stop': 282, 'sideways_use_sma': True, 'sideways_use_ema': True, 'sideways_use_atr': True, 'sideways_use_adx': False, 'sideways_use_spike': True, 'sideways_rsi_required': True}.
