[I 2025-08-30 16:37:20,001] Trial 466 finished with values: [-1000000000.0, 1000000000.0] and parameters: {'p_sma': 10, 'p_std': 47, 'p_atr': 23, 'p_adx': 19, 'rsi_period': 64, 'ema1': 26, 'ema2': 29, 'slip_atr_k': 0.23124829882846215, 'slip_spread_k': 0.13522747305323057, 'spread_hl_frac': 0.01905706970129526, 'bb_std_mult': 3.5728160458125564, 'rsi_os': 38, 'rsi_ob': 88, 'vol_spike': 0.031413044731313955, 'adx_thresh': 7.718997115157562, 'atr_min_pct': 0.008224075214476462, 'atr_max_pct': 0.08101606629799651, 'tp_mult': 2.603710820970806, 'tsl_mult': 0.4485890197317595, 'strategy': 'mean_reversion', 'time_stop': 80, 'use_sma': False, 'use_atr': True, 'use_adx': True, 'use_ema': True, 'use_spike': False, 'rsi_required': False, 'edge_k': 1.5462962029521923, 'edge_cap': 0.0841296011754255, 'bull_strategy': 'breakout', 'bull_bb_std_mult': 2.075185220787377, 'bull_rsi_os': 9, 'bull_rsi_ob': 49, 'bull_adx_thresh': 9.24668360063455, 'bull_atr_min_pct': 0.020377009844877905, 'bull_atr_max_pct': 0.13247092598386828, 'bull_tp_mult': 1.240378565949463, 'bull_tsl_mult': 0.20103698607854698, 'bull_time_stop': 67, 'bull_use_sma': False, 'bull_use_ema': False, 'bull_use_atr': True, 'bull_use_adx': True, 'bull_use_spike': False, 'bull_rsi_required': True, 'bear_strategy': 'breakout', 'bear_bb_std_mult': 2.012636271086192, 'bear_rsi_os': 13, 'bear_rsi_ob': 87, 'bear_adx_thresh': 5.708257131364331, 'bear_atr_min_pct': 0.010556138780051972, 'bear_atr_max_pct': 0.14731731533304357, 'bear_tp_mult': 2.160468168735271, 'bear_tsl_mult': 0.612257195928316, 'bear_time_stop': 156, 'bear_use_sma': True, 'bear_use_ema': False, 'bear_use_atr': False, 'bear_use_adx': False, 'bear_use_spike': True, 'bear_rsi_required': False, 'sideways_strategy': 'breakout', 'sideways_bb_std_mult': 3.472153271908115, 'sideways_rsi_os': 26, 'sideways_rsi_ob': 94, 'sideways_adx_thresh': 24.17168785024449, 'sideways_atr_min_pct': 0.007633653469658179, 'sideways_atr_max_pct': 0.14462433854985615, 'sideways_tp_mult': 2.3159082116015313, 'sideways_tsl_mult': 0.4559297584583744, 'sideways_time_stop': 102, 'sideways_use_sma': True, 'sideways_use_ema': True, 'sideways_use_atr': False, 'sideways_use_adx': False, 'sideways_use_spike': False, 'sideways_rsi_required': False}.
[I 2025-08-30 16:37:20,658] Trial 467 finished with values: [-1000000000.0, 1000000000.0] and parameters: {'p_sma': 6, 'p_std': 56, 'p_atr': 8, 'p_adx': 19, 'rsi_period': 23, 'ema1': 28, 'ema2': 10, 'slip_atr_k': 0.12506203316707212, 'slip_spread_k': 0.5762290240873408, 'spread_hl_frac': 0.01853640316710853, 'bb_std_mult': 0.5143101498430283, 'rsi_os': 38, 'rsi_ob': 88, 'vol_spike': 0.009726045198373303, 'adx_thresh': 15.270058562088382, 'atr_min_pct': 0.018775838842967407, 'atr_max_pct': 0.14154525718419642, 'tp_mult': 1.5966947549369406, 'tsl_mult': 0.4455504940920073, 'strategy': 'mean_reversion', 'time_stop': 78, 'use_sma': False, 'use_atr': False, 'use_adx': True, 'use_ema': True, 'use_spike': False, 'rsi_required': False, 'edge_k': 1.5511053914247304, 'edge_cap': 0.4795174212080697, 'bull_strategy': 'breakout', 'bull_bb_std_mult': 2.474781611936805, 'bull_rsi_os': 7, 'bull_rsi_ob': 84, 'bull_adx_thresh': 20.385036490774585, 'bull_atr_min_pct': 0.020507758883338934, 'bull_atr_max_pct': 0.04734175911382092, 'bull_tp_mult': 1.2355180493983002, 'bull_tsl_mult': 0.20352774356995235, 'bull_time_stop': 221, 'bull_use_sma': False, 'bull_use_ema': False, 'bull_use_atr': True, 'bull_use_adx': True, 'bull_use_spike': False, 'bull_rsi_required': True, 'bear_strategy': 'breakout', 'bear_bb_std_mult': 2.878177537141932, 'bear_rsi_os': 51, 'bear_rsi_ob': 79, 'bear_adx_thresh': 12.57662541698394, 'bear_atr_min_pct': 0.01723170908230499, 'bear_atr_max_pct': 0.08164697839164672, 'bear_tp_mult': 2.291885198965203, 'bear_tsl_mult': 0.14595517669801222, 'bear_time_stop': 148, 'bear_use_sma': True, 'bear_use_ema': False, 'bear_use_atr': False, 'bear_use_adx': True, 'bear_use_spike': True, 'bear_rsi_required': True, 'sideways_strategy': 'mean_reversion', 'sideways_bb_std_mult': 1.9860140505635595, 'sideways_rsi_os': 26, 'sideways_rsi_ob': 73, 'sideways_adx_thresh': 23.969758533406527, 'sideways_atr_min_pct': 0.0018177371064857254, 'sideways_atr_max_pct': 0.11935619583468349, 'sideways_tp_mult': 2.9190678818522287, 'sideways_tsl_mult': 0.4593879394004473, 'sideways_time_stop': 100, 'sideways_use_sma': True, 'sideways_use_ema': True, 'sideways_use_atr': False, 'sideways_use_adx': False, 'sideways_use_spike': True, 'sideways_rsi_required': False}.
[I 2025-08-30 16:37:23,554] Trial 470 finished with values: [-0.03256294832983753, 0.03249873504835856] and parameters: {'p_sma': 10, 'p_std': 59, 'p_atr': 26, 'p_adx': 19, 'rsi_period': 10, 'ema1': 27, 'ema2': 31, 'slip_atr_k': 0.19662637879135358, 'slip_spread_k': 0.13551528258687184, 'spread_hl_frac': 0.017719901539440218, 'bb_std_mult': 3.2611931393829323, 'rsi_os': 36, 'rsi_ob': 89, 'vol_spike': 0.029923740797260956, 'adx_thresh': 10.06999557423957, 'atr_min_pct': 0.019247709808171132, 'atr_max_pct': 0.05596491615125403, 'tp_mult': 2.9422837280279297, 'tsl_mult': 0.4839749900476225, 'strategy': 'mean_reversion', 'time_stop': 89, 'use_sma': True, 'use_atr': False, 'use_adx': True, 'use_ema': True, 'use_spike': False, 'rsi_required': True, 'edge_k': 1.7214317448471337, 'edge_cap': 0.6144700054628763, 'bull_strategy': 'breakout', 'bull_bb_std_mult': 1.7438548768501816, 'bull_rsi_os': 9, 'bull_rsi_ob': 72, 'bull_adx_thresh': 17.598043602651266, 'bull_atr_min_pct': 0.02376874916223947, 'bull_atr_max_pct': 0.12041306325060075, 'bull_tp_mult': 1.3414148157839751, 'bull_tsl_mult': 0.31457133982632846, 'bull_time_stop': 66, 'bull_use_sma': False, 'bull_use_ema': True, 'bull_use_atr': True, 'bull_use_adx': True, 'bull_use_spike': False, 'bull_rsi_required': False, 'bear_strategy': 'breakout', 'bear_bb_std_mult': 2.8609628330223407, 'bear_rsi_os': 27, 'bear_rsi_ob': 79, 'bear_adx_thresh': 32.25585305031926, 'bear_atr_min_pct': 0.020887762424709102, 'bear_atr_max_pct': 0.017832514108492695, 'bear_tp_mult': 2.2396028102163705, 'bear_tsl_mult': 0.8723147154005912, 'bear_time_stop': 157, 'bear_use_sma': True, 'bear_use_ema': False, 'bear_use_atr': False, 'bear_use_adx': True, 'bear_use_spike': False, 'bear_rsi_required': True, 'sideways_strategy': 'mean_reversion', 'sideways_bb_std_mult': 3.5101218382160795, 'sideways_rsi_os': 35, 'sideways_rsi_ob': 54, 'sideways_adx_thresh': 26.80262800058797, 'sideways_atr_min_pct': 4.0655858515962e-05, 'sideways_atr_max_pct': 0.013385195353327536, 'sideways_tp_mult': 1.478896518544638, 'sideways_tsl_mult': 0.12595601011126323, 'sideways_time_stop': 203, 'sideways_use_sma': True, 'sideways_use_ema': True, 'sideways_use_atr': False, 'sideways_use_adx': False, 'sideways_use_spike': True, 'sideways_rsi_required': False}.
[I 2025-08-30 16:37:24,009] Trial 471 finished with values: [-1000000000.0, 1000000000.0] and parameters: {'p_sma': 43, 'p_std': 27, 'p_atr': 26, 'p_adx': 10, 'rsi_period': 10, 'ema1': 26, 'ema2': 12, 'slip_atr_k': 0.0050776015144559684, 'slip_spread_k': 0.7982183385224144, 'spread_hl_frac': 0.019313757407484772, 'bb_std_mult': 3.167939508352111, 'rsi_os': 33, 'rsi_ob': 71, 'vol_spike': 0.006042097062282783, 'adx_thresh': 7.042559981094451, 'atr_min_pct': 0.019339691346318254, 'atr_max_pct': 0.13379076501641124, 'tp_mult': 2.6139384657925877, 'tsl_mult': 0.4766662984206263, 'strategy': 'mean_reversion', 'time_stop': 26, 'use_sma': True, 'use_atr': True, 'use_adx': True, 'use_ema': False, 'use_spike': False, 'rsi_required': True, 'edge_k': 1.7287934146636683, 'edge_cap': 0.07750995812829625, 'bull_strategy': 'mean_reversion', 'bull_bb_std_mult': 1.7086234740158555, 'bull_rsi_os': 9, 'bull_rsi_ob': 65, 'bull_adx_thresh': 9.144477381428757, 'bull_atr_min_pct': 0.0158707172715525, 'bull_atr_max_pct': 0.08725269070100772, 'bull_tp_mult': 1.8409176037793429, 'bull_tsl_mult': 0.7194562222011547, 'bull_time_stop': 72, 'bull_use_sma': False, 'bull_use_ema': True, 'bull_use_atr': True, 'bull_use_adx': True, 'bull_use_spike': False, 'bull_rsi_required': False, 'bear_strategy': 'mean_reversion', 'bear_bb_std_mult': 2.9170601914832477, 'bear_rsi_os': 16, 'bear_rsi_ob': 78, 'bear_adx_thresh': 12.595209343088312, 'bear_atr_min_pct': 0.010461991942988942, 'bear_atr_max_pct': 0.09192063098404031, 'bear_tp_mult': 2.2441383327440763, 'bear_tsl_mult': 0.8688241806140933, 'bear_time_stop': 218, 'bear_use_sma': True, 'bear_use_ema': False, 'bear_use_atr': False, 'bear_use_adx': False, 'bear_use_spike': False, 'bear_rsi_required': False, 'sideways_strategy': 'breakout', 'sideways_bb_std_mult': 1.163074165382878, 'sideways_rsi_os': 5, 'sideways_rsi_ob': 62, 'sideways_adx_thresh': 26.758039015128723, 'sideways_atr_min_pct': 0.026090823263261318, 'sideways_atr_max_pct': 0.08031564611742491, 'sideways_tp_mult': 1.4749286796449559, 'sideways_tsl_mult': 0.5082035840381466, 'sideways_time_stop': 42, 'sideways_use_sma': True, 'sideways_use_ema': False, 'sideways_use_atr': False, 'sideways_use_adx': False, 'sideways_use_spike': False, 'sideways_rsi_required': True}.
[I 2025-08-30 16:38:08,021] Trial 473 finished with values: [-1000000000.0, 1000000000.0] and parameters: {'p_sma': 6, 'p_std': 59, 'p_atr': 26, 'p_adx': 10, 'rsi_period': 84, 'ema1': 26, 'ema2': 12, 'slip_atr_k': 0.005422815665364315, 'slip_spread_k': 0.5224321806110818, 'spread_hl_frac': 0.016298680551597344, 'bb_std_mult': 2.4976855194433907, 'rsi_os': 33, 'rsi_ob': 91, 'vol_spike': 0.008727334116177451, 'adx_thresh': 12.945999470042567, 'atr_min_pct': 0.019333120001364053, 'atr_max_pct': 0.045593063451204396, 'tp_mult': 2.7916882878666467, 'tsl_mult': 0.4755598290895267, 'strategy': 'mean_reversion', 'time_stop': 26, 'use_sma': True, 'use_atr': True, 'use_adx': True, 'use_ema': False, 'use_spike': False, 'rsi_required': True, 'edge_k': 1.6994686216816095, 'edge_cap': 0.7892799499333585, 'bull_strategy': 'mean_reversion', 'bull_bb_std_mult': 1.6891502858822935, 'bull_rsi_os': 54, 'bull_rsi_ob': 86, 'bull_adx_thresh': 15.332733814684602, 'bull_atr_min_pct': 0.013758281931588796, 'bull_atr_max_pct': 0.07680296950303013, 'bull_tp_mult': 1.3928566920467582, 'bull_tsl_mult': 0.7850852006720789, 'bull_time_stop': 234, 'bull_use_sma': False, 'bull_use_ema': True, 'bull_use_atr': True, 'bull_use_adx': True, 'bull_use_spike': False, 'bull_rsi_required': False, 'bear_strategy': 'mean_reversion', 'bear_bb_std_mult': 2.5942941683112046, 'bear_rsi_os': 16, 'bear_rsi_ob': 71, 'bear_adx_thresh': 14.356117229550696, 'bear_atr_min_pct': 0.020673843309236842, 'bear_atr_max_pct': 0.07497370176490903, 'bear_tp_mult': 2.2377412068559868, 'bear_tsl_mult': 0.9412717873493244, 'bear_time_stop': 27, 'bear_use_sma': False, 'bear_use_ema': False, 'bear_use_atr': False, 'bear_use_adx': False, 'bear_use_spike': False, 'bear_rsi_required': False, 'sideways_strategy': 'breakout', 'sideways_bb_std_mult': 2.1898012595830108, 'sideways_rsi_os': 28, 'sideways_rsi_ob': 92, 'sideways_adx_thresh': 11.60081705667946, 'sideways_atr_min_pct': 0.01158081049815105, 'sideways_atr_max_pct': 0.14192709939376502, 'sideways_tp_mult': 1.4745815660511112, 'sideways_tsl_mult': 0.15752923056501306, 'sideways_time_stop': 272, 'sideways_use_sma': False, 'sideways_use_ema': False, 'sideways_use_atr': False, 'sideways_use_adx': True, 'sideways_use_spike': False, 'sideways_rsi_required': True}.
[I 2025-08-30 16:38:09,116] Trial 474 finished with values: [-1000000000.0, 1000000000.0] and parameters: {'p_sma': 6, 'p_std': 23, 'p_atr': 27, 'p_adx': 28, 'rsi_period': 21, 'ema1': 20, 'ema2': 12, 'slip_atr_k': 0.003864009863302666, 'slip_spread_k': 0.8113897899109166, 'spread_hl_frac': 0.014641429330905068, 'bb_std_mult': 3.1402637765016745, 'rsi_os': 33, 'rsi_ob': 91, 'vol_spike': 0.2622442454662538, 'adx_thresh': 5.722402323927385, 'atr_min_pct': 0.020542972891362983, 'atr_max_pct': 0.10818814830168426, 'tp_mult': 2.788487563013713, 'tsl_mult': 0.9995701759859739, 'strategy': 'mean_reversion', 'time_stop': 27, 'use_sma': True, 'use_atr': True, 'use_adx': True, 'use_ema': False, 'use_spike': False, 'rsi_required': True, 'edge_k': 0.039445172698457265, 'edge_cap': 0.7985926010271706, 'bull_strategy': 'mean_reversion', 'bull_bb_std_mult': 1.8750421746296178, 'bull_rsi_os': 20, 'bull_rsi_ob': 53, 'bull_adx_thresh': 23.278759458073715, 'bull_atr_min_pct': 0.01362842112295222, 'bull_atr_max_pct': 0.13777009863873102, 'bull_tp_mult': 1.8355270917265318, 'bull_tsl_mult': 0.723585448785963, 'bull_time_stop': 74, 'bull_use_sma': False, 'bull_use_ema': True, 'bull_use_atr': True, 'bull_use_adx': True, 'bull_use_spike': False, 'bull_rsi_required': False, 'bear_strategy': 'mean_reversion', 'bear_bb_std_mult': 2.1706275466797518, 'bear_rsi_os': 15, 'bear_rsi_ob': 61, 'bear_adx_thresh': 14.256507627484973, 'bear_atr_min_pct': 0.021452816403311707, 'bear_atr_max_pct': 0.09394672479137785, 'bear_tp_mult': 2.1971213132945313, 'bear_tsl_mult': 0.6454382200369634, 'bear_time_stop': 56, 'bear_use_sma': False, 'bear_use_ema': True, 'bear_use_atr': True, 'bear_use_adx': False, 'bear_use_spike': False, 'bear_rsi_required': False, 'sideways_strategy': 'breakout', 'sideways_bb_std_mult': 2.201514326159683, 'sideways_rsi_os': 23, 'sideways_rsi_ob': 92, 'sideways_adx_thresh': 20.05268519346387, 'sideways_atr_min_pct': 0.020291290682522042, 'sideways_atr_max_pct': 0.027615654508911375, 'sideways_tp_mult': 1.4083985846070497, 'sideways_tsl_mult': 0.5094321727622249, 'sideways_time_stop': 38, 'sideways_use_sma': False, 'sideways_use_ema': False, 'sideways_use_atr': False, 'sideways_use_adx': True, 'sideways_use_spike': False, 'sideways_rsi_required': True}.
[I 2025-08-30 16:38:09,357] Trial 472 finished with values: [-1000000000.0, 1000000000.0] and parameters: {'p_sma': 6, 'p_std': 24, 'p_atr': 27, 'p_adx': 10, 'rsi_period': 78, 'ema1': 18, 'ema2': 23, 'slip_atr_k': 0.12593183565854896, 'slip_spread_k': 0.5868921708702517, 'spread_hl_frac': 0.0157898906883926, 'bb_std_mult': 1.9837937634312572, 'rsi_os': 33, 'rsi_ob': 71, 'vol_spike': 0.006296932335636432, 'adx_thresh': 9.789320305817302, 'atr_min_pct': 0.01907487622441405, 'atr_max_pct': 0.10809244943110591, 'tp_mult': 2.9499780692080804, 'tsl_mult': 0.469361807261888, 'strategy': 'mean_reversion', 'time_stop': 53, 'use_sma': True, 'use_atr': True, 'use_adx': True, 'use_ema': False, 'use_spike': False, 'rsi_required': True, 'edge_k': 1.7193047661896255, 'edge_cap': 0.6130365337140985, 'bull_strategy': 'mean_reversion', 'bull_bb_std_mult': 2.4741302713404765, 'bull_rsi_os': 13, 'bull_rsi_ob': 72, 'bull_adx_thresh': 23.28544011459047, 'bull_atr_min_pct': 0.01363611597400193, 'bull_atr_max_pct': 0.07678632703767461, 'bull_tp_mult': 2.9225075989297693, 'bull_tsl_mult': 0.7770233246523011, 'bull_time_stop': 18, 'bull_use_sma': False, 'bull_use_ema': True, 'bull_use_atr': True, 'bull_use_adx': True, 'bull_use_spike': False, 'bull_rsi_required': False, 'bear_strategy': 'mean_reversion', 'bear_bb_std_mult': 0.7530728733075727, 'bear_rsi_os': 26, 'bear_rsi_ob': 77, 'bear_adx_thresh': 12.529547949222565, 'bear_atr_min_pct': 1.2578934410952328e-05, 'bear_atr_max_pct': 0.0939142877863111, 'bear_tp_mult': 2.228285393505308, 'bear_tsl_mult': 0.6473340583088624, 'bear_time_stop': 226, 'bear_use_sma': True, 'bear_use_ema': False, 'bear_use_atr': False, 'bear_use_adx': False, 'bear_use_spike': False, 'bear_rsi_required': False, 'sideways_strategy': 'breakout', 'sideways_bb_std_mult': 3.3879219234399245, 'sideways_rsi_os': 28, 'sideways_rsi_ob': 92, 'sideways_adx_thresh': 16.369924988900237, 'sideways_atr_min_pct': 7.309103304700996e-06, 'sideways_atr_max_pct': 0.08042012212175954, 'sideways_tp_mult': 1.351375902271682, 'sideways_tsl_mult': 0.49169252160750443, 'sideways_time_stop': 204, 'sideways_use_sma': True, 'sideways_use_ema': False, 'sideways_use_atr': False, 'sideways_use_adx': False, 'sideways_use_spike': False, 'sideways_rsi_required': True}.
[I 2025-08-30 16:38:09,728] Trial 475 finished with values: [-1000000000.0, 1000000000.0] and parameters: {'p_sma': 6, 'p_std': 60, 'p_atr': 22, 'p_adx': 13, 'rsi_period': 20, 'ema1': 19, 'ema2': 12, 'slip_atr_k': 0.016247224338628588, 'slip_spread_k': 0.5939485996184396, 'spread_hl_frac': 0.028261344329964036, 'bb_std_mult': 3.024922890098179, 'rsi_os': 34, 'rsi_ob': 92, 'vol_spike': 4.180014192571848e-05, 'adx_thresh': 13.263958976681815, 'atr_min_pct': 0.017255502810420785, 'atr_max_pct': 0.13226673903361877, 'tp_mult': 2.8817890156382617, 'tsl_mult': 0.2153688080655724, 'strategy': 'mean_reversion', 'time_stop': 159, 'use_sma': False, 'use_atr': True, 'use_adx': True, 'use_ema': False, 'use_spike': False, 'rsi_required': True, 'edge_k': 0.6460098429055539, 'edge_cap': 0.8236235839874086, 'bull_strategy': 'mean_reversion', 'bull_bb_std_mult': 1.534149181678814, 'bull_rsi_os': 11, 'bull_rsi_ob': 60, 'bull_adx_thresh': 13.442153094240386, 'bull_atr_min_pct': 0.021866414139385865, 'bull_atr_max_pct': 0.14448878353069194, 'bull_tp_mult': 2.77860601651178, 'bull_tsl_mult': 0.2816405082283904, 'bull_time_stop': 245, 'bull_use_sma': False, 'bull_use_ema': True, 'bull_use_atr': True, 'bull_use_adx': True, 'bull_use_spike': False, 'bull_rsi_required': False, 'bear_strategy': 'mean_reversion', 'bear_bb_std_mult': 2.163271101398446, 'bear_rsi_os': 14, 'bear_rsi_ob': 77, 'bear_adx_thresh': 20.606179184992797, 'bear_atr_min_pct': 0.026218187065494655, 'bear_atr_max_pct': 0.09479362203519479, 'bear_tp_mult': 1.7964142647275756, 'bear_tsl_mult': 0.65499402865557, 'bear_time_stop': 226, 'bear_use_sma': False, 'bear_use_ema': True, 'bear_use_atr': True, 'bear_use_adx': False, 'bear_use_spike': False, 'bear_rsi_required': False, 'sideways_strategy': 'breakout', 'sideways_bb_std_mult': 2.1849055068583874, 'sideways_rsi_os': 28, 'sideways_rsi_ob': 92, 'sideways_adx_thresh': 17.881803880575912, 'sideways_atr_min_pct': 0.011883652950396917, 'sideways_atr_max_pct': 0.14034781324584533, 'sideways_tp_mult': 1.4052501977755194, 'sideways_tsl_mult': 0.48763528007823187, 'sideways_time_stop': 221, 'sideways_use_sma': False, 'sideways_use_ema': False, 'sideways_use_atr': False, 'sideways_use_adx': True, 'sideways_use_spike': False, 'sideways_rsi_required': True}.
[I 2025-08-30 16:38:10,617] Trial 476 finished with values: [-1000000000.0, 1000000000.0] and parameters: {'p_sma': 13, 'p_std': 55, 'p_atr': 22, 'p_adx': 25, 'rsi_period': 78, 'ema1': 18, 'ema2': 10, 'slip_atr_k': 0.016950374459991056, 'slip_spread_k': 0.5983466304683572, 'spread_hl_frac': 0.010776240785959483, 'bb_std_mult': 1.6806487699073613, 'rsi_os': 53, 'rsi_ob': 59, 'vol_spike': 0.23101778776527246, 'adx_thresh': 5.874352648747797, 'atr_min_pct': 0.020780429376259155, 'atr_max_pct': 0.13118818735632304, 'tp_mult': 2.1343965030647074, 'tsl_mult': 0.004793051787465197, 'strategy': 'mean_reversion', 'time_stop': 11, 'use_sma': False, 'use_atr': True, 'use_adx': True, 'use_ema': False, 'use_spike': False, 'rsi_required': True, 'edge_k': 1.5089682226278407, 'edge_cap': 0.8263322776495605, 'bull_strategy': 'mean_reversion', 'bull_bb_std_mult': 1.5155470441150425, 'bull_rsi_os': 51, 'bull_rsi_ob': 52, 'bull_adx_thresh': 23.357675315533843, 'bull_atr_min_pct': 0.02152596779532504, 'bull_atr_max_pct': 0.1390178214483726, 'bull_tp_mult': 2.7507046773427515, 'bull_tsl_mult': 0.2664720342234091, 'bull_time_stop': 132, 'bull_use_sma': True, 'bull_use_ema': True, 'bull_use_atr': False, 'bull_use_adx': True, 'bull_use_spike': False, 'bull_rsi_required': False, 'bear_strategy': 'mean_reversion', 'bear_bb_std_mult': 2.087599018560678, 'bear_rsi_os': 53, 'bear_rsi_ob': 77, 'bear_adx_thresh': 23.32179937330445, 'bear_atr_min_pct': 0.021462430115275724, 'bear_atr_max_pct': 0.1290555002982318, 'bear_tp_mult': 2.1837263417414627, 'bear_tsl_mult': 0.8046431878903986, 'bear_time_stop': 97, 'bear_use_sma': True, 'bear_use_ema': True, 'bear_use_atr': True, 'bear_use_adx': False, 'bear_use_spike': False, 'bear_rsi_required': False, 'sideways_strategy': 'breakout', 'sideways_bb_std_mult': 2.039796922131734, 'sideways_rsi_os': 18, 'sideways_rsi_ob': 92, 'sideways_adx_thresh': 17.772682592815528, 'sideways_atr_min_pct': 0.0009517855081143581, 'sideways_atr_max_pct': 0.08543913256144865, 'sideways_tp_mult': 1.3466401952268465, 'sideways_tsl_mult': 0.4024764334548366, 'sideways_time_stop': 208, 'sideways_use_sma': True, 'sideways_use_ema': False, 'sideways_use_atr': False, 'sideways_use_adx': False, 'sideways_use_spike': False, 'sideways_rsi_required': True}.
