[I 2025-08-30 15:16:36,143] Trial 36 finished with values: [-1000000000.0, 1000000000.0] and parameters: {'p_sma': 33, 'p_std': 5, 'p_atr': 30, 'p_adx': 8, 'rsi_period': 20, 'ema1': 28, 'ema2': 49, 'slip_atr_k': 0.22361422384486032, 'slip_spread_k': 0.8349885726860375, 'spread_hl_frac': 0.022404548632321705, 'bb_std_mult': 1.512671461064122, 'rsi_os': 20, 'rsi_ob': 59, 'vol_spike': 0.19749335951147368, 'adx_thresh': 17.57254268830148, 'atr_min_pct': 0.011207876507831274, 'atr_max_pct': 0.05088812195520692, 'tp_mult': 2.468474249419074, 'tsl_mult': 0.1522829843896646, 'strategy': 'mean_reversion', 'time_stop': 300, 'use_sma': True, 'use_atr': False, 'use_adx': False, 'use_ema': False, 'use_spike': True, 'rsi_required': True, 'edge_k': 0.5873706106484231, 'edge_cap': 0.9240641203136077, 'bull_strategy': 'breakout', 'bull_bb_std_mult': 2.508781749888561, 'bull_rsi_os': 33, 'bull_rsi_ob': 94, 'bull_adx_thresh': 30.39109933674201, 'bull_atr_min_pct': 0.008467848079759782, 'bull_atr_max_pct': 0.01026824910600491, 'bull_tp_mult': 2.7898310699587685, 'bull_tsl_mult': 0.34920578888820064, 'bull_time_stop': 110, 'bull_use_sma': False, 'bull_use_ema': True, 'bull_use_atr': True, 'bull_use_adx': True, 'bull_use_spike': True, 'bull_rsi_required': False, 'bear_strategy': 'mean_reversion', 'bear_bb_std_mult': 3.5464467962251742, 'bear_rsi_os': 53, 'bear_rsi_ob': 92, 'bear_adx_thresh': 9.338620306961875, 'bear_atr_min_pct': 0.01663674967741672, 'bear_atr_max_pct': 0.14900356321343164, 'bear_tp_mult': 1.7562755272396684, 'bear_tsl_mult': 0.8760114605475804, 'bear_time_stop': 75, 'bear_use_sma': True, 'bear_use_ema': True, 'bear_use_atr': True, 'bear_use_adx': False, 'bear_use_spike': False, 'bear_rsi_required': False, 'sideways_strategy': 'breakout', 'sideways_bb_std_mult': 2.2535002530613935, 'sideways_rsi_os': 18, 'sideways_rsi_ob': 95, 'sideways_adx_thresh': 22.812571363671136, 'sideways_atr_min_pct': 0.002896811657173557, 'sideways_atr_max_pct': 0.07758262772327484, 'sideways_tp_mult': 1.7096573912841877, 'sideways_tsl_mult': 0.09174716585052763, 'sideways_time_stop': 20, 'sideways_use_sma': True, 'sideways_use_ema': True, 'sideways_use_atr': True, 'sideways_use_adx': False, 'sideways_use_spike': False, 'sideways_rsi_required': True}.
[I 2025-08-30 15:17:13,540] Trial 37 finished with values: [-1000000000.0, 1000000000.0] and parameters: {'p_sma': 25, 'p_std': 5, 'p_atr': 30, 'p_adx': 8, 'rsi_period': 20, 'ema1': 28, 'ema2': 50, 'slip_atr_k': 0.22683845207586753, 'slip_spread_k': 0.11228512140145339, 'spread_hl_frac': 0.04478171419094063, 'bb_std_mult': 1.577170805548212, 'rsi_os': 21, 'rsi_ob': 81, 'vol_spike': 0.20320294344541784, 'adx_thresh': 17.097278258240994, 'atr_min_pct': 0.013490058192116062, 'atr_max_pct': 0.054443242457208156, 'tp_mult': 2.362896844403105, 'tsl_mult': 0.7677295184014068, 'strategy': 'mean_reversion', 'time_stop': 295, 'use_sma': True, 'use_atr': False, 'use_adx': True, 'use_ema': False, 'use_spike': True, 'rsi_required': True, 'edge_k': 0.5250503317206818, 'edge_cap': 0.9268952398083959, 'bull_strategy': 'breakout', 'bull_bb_std_mult': 2.5006075853727543, 'bull_rsi_os': 32, 'bull_rsi_ob': 93, 'bull_adx_thresh': 30.642789051407092, 'bull_atr_min_pct': 0.009216268787801001, 'bull_atr_max_pct': 0.012213869312960118, 'bull_tp_mult': 2.732676567481803, 'bull_tsl_mult': 0.3526117631029342, 'bull_time_stop': 112, 'bull_use_sma': False, 'bull_use_ema': True, 'bull_use_atr': True, 'bull_use_adx': False, 'bull_use_spike': True, 'bull_rsi_required': False, 'bear_strategy': 'mean_reversion', 'bear_bb_std_mult': 3.5853324110370917, 'bear_rsi_os': 54, 'bear_rsi_ob': 95, 'bear_adx_thresh': 9.925948322828798, 'bear_atr_min_pct': 0.015039869870548497, 'bear_atr_max_pct': 0.12923567561781665, 'bear_tp_mult': 1.7484472906155677, 'bear_tsl_mult': 0.7652978966883337, 'bear_time_stop': 66, 'bear_use_sma': True, 'bear_use_ema': False, 'bear_use_atr': False, 'bear_use_adx': False, 'bear_use_spike': False, 'bear_rsi_required': False, 'sideways_strategy': 'breakout', 'sideways_bb_std_mult': 2.2523047715523723, 'sideways_rsi_os': 17, 'sideways_rsi_ob': 49, 'sideways_adx_thresh': 9.858980948413086, 'sideways_atr_min_pct': 0.002600966712490164, 'sideways_atr_max_pct': 0.07272318689206005, 'sideways_tp_mult': 1.1837611673725466, 'sideways_tsl_mult': 0.06596669307783917, 'sideways_time_stop': 59, 'sideways_use_sma': True, 'sideways_use_ema': True, 'sideways_use_atr': True, 'sideways_use_adx': True, 'sideways_use_spike': False, 'sideways_rsi_required': True}.
[I 2025-08-30 15:17:22,787] Trial 38 finished with values: [-0.1270546549756989, 0.12696927224616802] and parameters: {'p_sma': 40, 'p_std': 5, 'p_atr': 22, 'p_adx': 7, 'rsi_period': 19, 'ema1': 29, 'ema2': 36, 'slip_atr_k': 0.07309872612954131, 'slip_spread_k': 0.6919413256326074, 'spread_hl_frac': 0.04183815934277031, 'bb_std_mult': 1.6526752039038661, 'rsi_os': 21, 'rsi_ob': 82, 'vol_spike': 0.19512764421857476, 'adx_thresh': 18.29930208303011, 'atr_min_pct': 2.1515554779161575e-05, 'atr_max_pct': 0.06463121149503881, 'tp_mult': 2.4063861979530423, 'tsl_mult': 0.7742572942567935, 'strategy': 'mean_reversion', 'time_stop': 263, 'use_sma': True, 'use_atr': False, 'use_adx': False, 'use_ema': True, 'use_spike': True, 'rsi_required': True, 'edge_k': 0.5355245523891359, 'edge_cap': 0.9438275084287195, 'bull_strategy': 'breakout', 'bull_bb_std_mult': 2.444731651829542, 'bull_rsi_os': 24, 'bull_rsi_ob': 95, 'bull_adx_thresh': 30.549923403085714, 'bull_atr_min_pct': 0.0033777459204037998, 'bull_atr_max_pct': 0.1146732059386808, 'bull_tp_mult': 2.846292026215924, 'bull_tsl_mult': 0.09490399032895697, 'bull_time_stop': 281, 'bull_use_sma': False, 'bull_use_ema': True, 'bull_use_atr': False, 'bull_use_adx': True, 'bull_use_spike': True, 'bull_rsi_required': False, 'bear_strategy': 'breakout', 'bear_bb_std_mult': 3.5610392248812452, 'bear_rsi_os': 55, 'bear_rsi_ob': 91, 'bear_adx_thresh': 9.754884654292297, 'bear_atr_min_pct': 0.0009303993695842679, 'bear_atr_max_pct': 0.13331843925429243, 'bear_tp_mult': 1.7126184470615076, 'bear_tsl_mult': 0.7648305848407063, 'bear_time_stop': 67, 'bear_use_sma': True, 'bear_use_ema': False, 'bear_use_atr': False, 'bear_use_adx': False, 'bear_use_spike': False, 'bear_rsi_required': False, 'sideways_strategy': 'breakout', 'sideways_bb_std_mult': 1.9055303951109708, 'sideways_rsi_os': 30, 'sideways_rsi_ob': 95, 'sideways_adx_thresh': 10.262474628607926, 'sideways_atr_min_pct': 0.0019173215976901557, 'sideways_atr_max_pct': 0.11919989873821399, 'sideways_tp_mult': 1.2715735525464593, 'sideways_tsl_mult': 0.7174827023084669, 'sideways_time_stop': 23, 'sideways_use_sma': True, 'sideways_use_ema': True, 'sideways_use_atr': True, 'sideways_use_adx': True, 'sideways_use_spike': True, 'sideways_rsi_required': True}.
[I 2025-08-30 15:17:24,241] Trial 39 finished with values: [-1000000000.0, 1000000000.0] and parameters: {'p_sma': 51, 'p_std': 32, 'p_atr': 28, 'p_adx': 8, 'rsi_period': 46, 'ema1': 29, 'ema2': 57, 'slip_atr_k': 0.07887667676836402, 'slip_spread_k': 0.6985320455051399, 'spread_hl_frac': 0.0425243797023102, 'bb_std_mult': 1.7141006129887244, 'rsi_os': 42, 'rsi_ob': 80, 'vol_spike': 0.2753955288640041, 'adx_thresh': 19.41310817970636, 'atr_min_pct': 0.014105004434458656, 'atr_max_pct': 0.02045779752666839, 'tp_mult': 1.6867959200022469, 'tsl_mult': 0.7409222493901427, 'strategy': 'mean_reversion', 'time_stop': 270, 'use_sma': True, 'use_atr': False, 'use_adx': False, 'use_ema': False, 'use_spike': True, 'rsi_required': True, 'edge_k': 0.0018235661345595844, 'edge_cap': 0.9231183836920218, 'bull_strategy': 'breakout', 'bull_bb_std_mult': 3.4826714981072957, 'bull_rsi_os': 24, 'bull_rsi_ob': 68, 'bull_adx_thresh': 30.979971946542523, 'bull_atr_min_pct': 0.01852006628915317, 'bull_atr_max_pct': 0.1178439294160033, 'bull_tp_mult': 2.336989329934787, 'bull_tsl_mult': 0.10141415312531893, 'bull_time_stop': 225, 'bull_use_sma': False, 'bull_use_ema': True, 'bull_use_atr': True, 'bull_use_adx': True, 'bull_use_spike': True, 'bull_rsi_required': False, 'bear_strategy': 'mean_reversion', 'bear_bb_std_mult': 3.5345888808072248, 'bear_rsi_os': 32, 'bear_rsi_ob': 75, 'bear_adx_thresh': 30.99122211140047, 'bear_atr_min_pct': 0.01488307888243027, 'bear_atr_max_pct': 0.12886051493664166, 'bear_tp_mult': 1.7379068000043574, 'bear_tsl_mult': 0.14721135163970855, 'bear_time_stop': 71, 'bear_use_sma': True, 'bear_use_ema': True, 'bear_use_atr': False, 'bear_use_adx': False, 'bear_use_spike': False, 'bear_rsi_required': False, 'sideways_strategy': 'breakout', 'sideways_bb_std_mult': 2.019703606088158, 'sideways_rsi_os': 42, 'sideways_rsi_ob': 51, 'sideways_adx_thresh': 23.289083508541943, 'sideways_atr_min_pct': 0.02163644688064262, 'sideways_atr_max_pct': 0.07216782023970368, 'sideways_tp_mult': 1.2273861265063328, 'sideways_tsl_mult': 0.7252745209781062, 'sideways_time_stop': 122, 'sideways_use_sma': True, 'sideways_use_ema': True, 'sideways_use_atr': True, 'sideways_use_adx': True, 'sideways_use_spike': False, 'sideways_rsi_required': True}.
[I 2025-08-30 15:17:26,200] Trial 40 finished with values: [-1000000000.0, 1000000000.0] and parameters: {'p_sma': 41, 'p_std': 35, 'p_atr': 28, 'p_adx': 21, 'rsi_period': 57, 'ema1': 10, 'ema2': 10, 'slip_atr_k': 0.19413162856020882, 'slip_spread_k': 0.7020253458551833, 'spread_hl_frac': 0.04058715627202224, 'bb_std_mult': 1.7847356770496055, 'rsi_os': 43, 'rsi_ob': 70, 'vol_spike': 0.27144579516361816, 'adx_thresh': 19.492154022298415, 'atr_min_pct': 0.014016046358585239, 'atr_max_pct': 0.02287171020217219, 'tp_mult': 1.6822932232765966, 'tsl_mult': 0.7689160857460999, 'strategy': 'mean_reversion', 'time_stop': 272, 'use_sma': True, 'use_atr': False, 'use_adx': True, 'use_ema': False, 'use_spike': True, 'rsi_required': True, 'edge_k': 1.0178454373636805, 'edge_cap': 0.2981126044329684, 'bull_strategy': 'breakout', 'bull_bb_std_mult': 3.58177659488062, 'bull_rsi_os': 24, 'bull_rsi_ob': 69, 'bull_adx_thresh': 9.79111885909231, 'bull_atr_min_pct': 0.01879659508094951, 'bull_atr_max_pct': 0.11934643593081974, 'bull_tp_mult': 2.2191281334355595, 'bull_tsl_mult': 0.10985068871305287, 'bull_time_stop': 220, 'bull_use_sma': False, 'bull_use_ema': True, 'bull_use_atr': True, 'bull_use_adx': True, 'bull_use_spike': True, 'bull_rsi_required': False, 'bear_strategy': 'mean_reversion', 'bear_bb_std_mult': 1.2434803075299123, 'bear_rsi_os': 39, 'bear_rsi_ob': 75, 'bear_adx_thresh': 30.786685600129935, 'bear_atr_min_pct': 0.014168288457067541, 'bear_atr_max_pct': 0.12777867064091608, 'bear_tp_mult': 1.547752611235545, 'bear_tsl_mult': 0.44011998304595784, 'bear_time_stop': 60, 'bear_use_sma': True, 'bear_use_ema': True, 'bear_use_atr': False, 'bear_use_adx': False, 'bear_use_spike': False, 'bear_rsi_required': False, 'sideways_strategy': 'breakout', 'sideways_bb_std_mult': 1.8840341381355659, 'sideways_rsi_os': 40, 'sideways_rsi_ob': 52, 'sideways_adx_thresh': 17.935733058263285, 'sideways_atr_min_pct': 0.022212184982788576, 'sideways_atr_max_pct': 0.06896026684814772, 'sideways_tp_mult': 1.2210854517206222, 'sideways_tsl_mult': 0.6536877232966856, 'sideways_time_stop': 128, 'sideways_use_sma': True, 'sideways_use_ema': True, 'sideways_use_atr': True, 'sideways_use_adx': True, 'sideways_use_spike': False, 'sideways_rsi_required': True}.
[I 2025-08-30 15:18:00,703] Trial 41 finished with values: [-1000000000.0, 1000000000.0] and parameters: {'p_sma': 40, 'p_std': 8, 'p_atr': 28, 'p_adx': 20, 'rsi_period': 55, 'ema1': 9, 'ema2': 56, 'slip_atr_k': 0.1968234866908199, 'slip_spread_k': 0.6961232323530333, 'spread_hl_frac': 0.041773972826380255, 'bb_std_mult': 1.8083844737365862, 'rsi_os': 43, 'rsi_ob': 71, 'vol_spike': 0.2720747548616059, 'adx_thresh': 27.943100583616854, 'atr_min_pct': 0.00039914139123216515, 'atr_max_pct': 0.017836683465568166, 'tp_mult': 1.6620232860501294, 'tsl_mult': 0.48188484959451006, 'strategy': 'mean_reversion', 'time_stop': 274, 'use_sma': True, 'use_atr': False, 'use_adx': False, 'use_ema': False, 'use_spike': True, 'rsi_required': True, 'edge_k': 1.0524076730637058, 'edge_cap': 0.29045227831492737, 'bull_strategy': 'breakout', 'bull_bb_std_mult': 3.5955497581967344, 'bull_rsi_os': 24, 'bull_rsi_ob': 69, 'bull_adx_thresh': 9.734985721951858, 'bull_atr_min_pct': 0.01958944105997574, 'bull_atr_max_pct': 0.09333078573404693, 'bull_tp_mult': 2.3442994309524954, 'bull_tsl_mult': 0.25859101219970043, 'bull_time_stop': 219, 'bull_use_sma': True, 'bull_use_ema': True, 'bull_use_atr': True, 'bull_use_adx': True, 'bull_use_spike': True, 'bull_rsi_required': False, 'bear_strategy': 'mean_reversion', 'bear_bb_std_mult': 1.2325560712563801, 'bear_rsi_os': 38, 'bear_rsi_ob': 75, 'bear_adx_thresh': 31.281823998458744, 'bear_atr_min_pct': 0.009877467097892447, 'bear_atr_max_pct': 0.08588033443559366, 'bear_tp_mult': 1.468764594344116, 'bear_tsl_mult': 0.2976923292411625, 'bear_time_stop': 89, 'bear_use_sma': True, 'bear_use_ema': True, 'bear_use_atr': False, 'bear_use_adx': False, 'bear_use_spike': False, 'bear_rsi_required': False, 'sideways_strategy': 'breakout', 'sideways_bb_std_mult': 1.693871626042477, 'sideways_rsi_os': 41, 'sideways_rsi_ob': 70, 'sideways_adx_thresh': 23.777991579267244, 'sideways_atr_min_pct': 0.01156885419874766, 'sideways_atr_max_pct': 0.08299748968886811, 'sideways_tp_mult': 2.120894201819826, 'sideways_tsl_mult': 0.6092622534723265, 'sideways_time_stop': 122, 'sideways_use_sma': True, 'sideways_use_ema': True, 'sideways_use_atr': True, 'sideways_use_adx': True, 'sideways_use_spike': False, 'sideways_rsi_required': True}.
[I 2025-08-30 15:18:11,214] Trial 43 finished with values: [-1000000000.0, 1000000000.0] and parameters: {'p_sma': 59, 'p_std': 21, 'p_atr': 28, 'p_adx': 30, 'rsi_period': 61, 'ema1': 23, 'ema2': 44, 'slip_atr_k': 0.16496683692940675, 'slip_spread_k': 0.760080378983236, 'spread_hl_frac': 0.049873905077577434, 'bb_std_mult': 2.1295037279143365, 'rsi_os': 44, 'rsi_ob': 71, 'vol_spike': 0.26156770443673133, 'adx_thresh': 27.84936567456652, 'atr_min_pct': 0.009287355191046514, 'atr_max_pct': 0.025308216417746703, 'tp_mult': 1.6748037547554528, 'tsl_mult': 0.4927509105372417, 'strategy': 'mean_reversion', 'time_stop': 277, 'use_sma': True, 'use_atr': True, 'use_adx': True, 'use_ema': False, 'use_spike': True, 'rsi_required': True, 'edge_k': 1.0375855181521225, 'edge_cap': 0.2604444731140473, 'bull_strategy': 'breakout', 'bull_bb_std_mult': 3.2092720426857104, 'bull_rsi_os': 26, 'bull_rsi_ob': 60, 'bull_adx_thresh': 9.625032650105686, 'bull_atr_min_pct': 0.020521772558681893, 'bull_atr_max_pct': 0.09456202190929591, 'bull_tp_mult': 2.1782134358031526, 'bull_tsl_mult': 0.98565472221643, 'bull_time_stop': 206, 'bull_use_sma': True, 'bull_use_ema': False, 'bull_use_atr': True, 'bull_use_adx': True, 'bull_use_spike': False, 'bull_rsi_required': False, 'bear_strategy': 'mean_reversion', 'bear_bb_std_mult': 1.1824183193806677, 'bear_rsi_os': 38, 'bear_rsi_ob': 83, 'bear_adx_thresh': 31.71062149148434, 'bear_atr_min_pct': 0.00960555010279189, 'bear_atr_max_pct': 0.08141688514180619, 'bear_tp_mult': 1.5141204448647891, 'bear_tsl_mult': 0.2964909826068729, 'bear_time_stop': 96, 'bear_use_sma': True, 'bear_use_ema': True, 'bear_use_atr': False, 'bear_use_adx': False, 'bear_use_spike': False, 'bear_rsi_required': False, 'sideways_strategy': 'breakout', 'sideways_bb_std_mult': 1.677889067731594, 'sideways_rsi_os': 51, 'sideways_rsi_ob': 69, 'sideways_adx_thresh': 24.453268910034218, 'sideways_atr_min_pct': 0.012210482429200685, 'sideways_atr_max_pct': 0.05735271070723086, 'sideways_tp_mult': 2.054233610637953, 'sideways_tsl_mult': 0.5903381857301456, 'sideways_time_stop': 168, 'sideways_use_sma': False, 'sideways_use_ema': True, 'sideways_use_atr': False, 'sideways_use_adx': True, 'sideways_use_spike': False, 'sideways_rsi_required': True}.
[I 2025-08-30 15:18:11,664] Trial 42 finished with values: [-1000000000.0, 1000000000.0] and parameters: {'p_sma': 48, 'p_std': 33, 'p_atr': 28, 'p_adx': 20, 'rsi_period': 52, 'ema1': 15, 'ema2': 57, 'slip_atr_k': 0.19826860882445874, 'slip_spread_k': 0.7712329144096939, 'spread_hl_frac': 0.04964786029414865, 'bb_std_mult': 3.5084959903514905, 'rsi_os': 43, 'rsi_ob': 72, 'vol_spike': 0.26386206332905904, 'adx_thresh': 22.321871658516457, 'atr_min_pct': 0.02205794435910271, 'atr_max_pct': 0.022716474377946612, 'tp_mult': 1.6452371179211855, 'tsl_mult': 0.5033088760182977, 'strategy': 'mean_reversion', 'time_stop': 273, 'use_sma': True, 'use_atr': False, 'use_adx': True, 'use_ema': False, 'use_spike': True, 'rsi_required': True, 'edge_k': 0.0029434347042980313, 'edge_cap': 0.2647364412412311, 'bull_strategy': 'breakout', 'bull_bb_std_mult': 3.533387787964358, 'bull_rsi_os': 25, 'bull_rsi_ob': 68, 'bull_adx_thresh': 10.100288656329795, 'bull_atr_min_pct': 0.01897838051412205, 'bull_atr_max_pct': 0.09210304731358653, 'bull_tp_mult': 2.2853303613138016, 'bull_tsl_mult': 0.24726637939322538, 'bull_time_stop': 221, 'bull_use_sma': True, 'bull_use_ema': False, 'bull_use_atr': True, 'bull_use_adx': True, 'bull_use_spike': False, 'bull_rsi_required': False, 'bear_strategy': 'mean_reversion', 'bear_bb_std_mult': 0.5343510737668791, 'bear_rsi_os': 24, 'bear_rsi_ob': 75, 'bear_adx_thresh': 31.03536113696191, 'bear_atr_min_pct': 0.009755788085396712, 'bear_atr_max_pct': 0.08144253724213013, 'bear_tp_mult': 1.5429571478877537, 'bear_tsl_mult': 0.2271314965865962, 'bear_time_stop': 92, 'bear_use_sma': True, 'bear_use_ema': True, 'bear_use_atr': False, 'bear_use_adx': False, 'bear_use_spike': False, 'bear_rsi_required': False, 'sideways_strategy': 'breakout', 'sideways_bb_std_mult': 1.7276395353229776, 'sideways_rsi_os': 43, 'sideways_rsi_ob': 58, 'sideways_adx_thresh': 17.595522869106087, 'sideways_atr_min_pct': 0.022278066586522188, 'sideways_atr_max_pct': 0.06305255875216337, 'sideways_tp_mult': 2.054519863029085, 'sideways_tsl_mult': 0.6547005726069781, 'sideways_time_stop': 119, 'sideways_use_sma': False, 'sideways_use_ema': True, 'sideways_use_atr': False, 'sideways_use_adx': True, 'sideways_use_spike': False, 'sideways_rsi_required': True}.
[I 2025-08-30 15:18:13,696] Trial 44 finished with values: [-1000000000.0, 1000000000.0] and parameters: {'p_sma': 38, 'p_std': 8, 'p_atr': 26, 'p_adx': 30, 'rsi_period': 26, 'ema1': 5, 'ema2': 60, 'slip_atr_k': 0.15932943861946586, 'slip_spread_k': 0.7560782912199742, 'spread_hl_frac': 0.048842036036985635, 'bb_std_mult': 3.550432592185806, 'rsi_os': 27, 'rsi_ob': 72, 'vol_spike': 0.25810888984688873, 'adx_thresh': 27.655049943963938, 'atr_min_pct': 0.00885731826006846, 'atr_max_pct': 0.024736408125149056, 'tp_mult': 2.6571472677723724, 'tsl_mult': 0.913987453357479, 'strategy': 'mean_reversion', 'time_stop': 251, 'use_sma': True, 'use_atr': True, 'use_adx': True, 'use_ema': False, 'use_spike': False, 'rsi_required': True, 'edge_k': 0.6889452903688431, 'edge_cap': 0.8187562570343654, 'bull_strategy': 'breakout', 'bull_bb_std_mult': 3.150581492858003, 'bull_rsi_os': 26, 'bull_rsi_ob': 58, 'bull_adx_thresh': 6.469504019949256, 'bull_atr_min_pct': 0.021270443343655465, 'bull_atr_max_pct': 0.08944642772515682, 'bull_tp_mult': 2.1116118207211154, 'bull_tsl_mult': 0.24512150614882655, 'bull_time_stop': 275, 'bull_use_sma': True, 'bull_use_ema': False, 'bull_use_atr': True, 'bull_use_adx': True, 'bull_use_spike': False, 'bull_rsi_required': False, 'bear_strategy': 'mean_reversion', 'bear_bb_std_mult': 1.2118928085266354, 'bear_rsi_os': 26, 'bear_rsi_ob': 91, 'bear_adx_thresh': 31.674712051904237, 'bear_atr_min_pct': 0.00923114855786269, 'bear_atr_max_pct': 0.09050858947528127, 'bear_tp_mult': 1.2311140908653158, 'bear_tsl_mult': 0.24815217007201035, 'bear_time_stop': 35, 'bear_use_sma': True, 'bear_use_ema': True, 'bear_use_atr': True, 'bear_use_adx': False, 'bear_use_spike': False, 'bear_rsi_required': False, 'sideways_strategy': 'breakout', 'sideways_bb_std_mult': 1.654318768958688, 'sideways_rsi_os': 29, 'sideways_rsi_ob': 68, 'sideways_adx_thresh': 24.333668657830234, 'sideways_atr_min_pct': 0.012220886195963513, 'sideways_atr_max_pct': 0.05972263432268936, 'sideways_tp_mult': 1.3736534027405911, 'sideways_tsl_mult': 0.2100487831280245, 'sideways_time_stop': 165, 'sideways_use_sma': False, 'sideways_use_ema': True, 'sideways_use_atr': False, 'sideways_use_adx': True, 'sideways_use_spike': False, 'sideways_rsi_required': False}.
