[I 2025-08-30 17:27:23,163] Trial 764 finished with values: [-1000000000.0, 1000000000.0] and parameters: {'p_sma': 49, 'p_std': 48, 'p_atr': 17, 'p_adx': 7, 'rsi_period': 49, 'ema1': 18, 'ema2': 27, 'slip_atr_k': 0.18135199771828936, 'slip_spread_k': 0.22941995993051933, 'spread_hl_frac': 0.019184169210088857, 'bb_std_mult': 2.5489921466073215, 'rsi_os': 29, 'rsi_ob': 87, 'vol_spike': 0.07174133701066945, 'adx_thresh': 23.05724421360943, 'atr_min_pct': 0.01738284761806351, 'atr_max_pct': 0.1027870545944133, 'tp_mult': 2.703198408850987, 'tsl_mult': 0.9542194192278335, 'strategy': 'breakout', 'time_stop': 85, 'use_sma': False, 'use_atr': True, 'use_adx': True, 'use_ema': False, 'use_spike': False, 'rsi_required': False, 'edge_k': 1.1223157383127373, 'edge_cap': 0.7669498248782068, 'bull_strategy': 'mean_reversion', 'bull_bb_std_mult': 2.1268422987731106, 'bull_rsi_os': 24, 'bull_rsi_ob': 53, 'bull_adx_thresh': 34.37831575930459, 'bull_atr_min_pct': 0.02128448853255906, 'bull_atr_max_pct': 0.061777683960202896, 'bull_tp_mult': 2.223353183886594, 'bull_tsl_mult': 0.9104450567299495, 'bull_time_stop': 243, 'bull_use_sma': True, 'bull_use_ema': True, 'bull_use_atr': False, 'bull_use_adx': True, 'bull_use_spike': False, 'bull_rsi_required': False, 'bear_strategy': 'mean_reversion', 'bear_bb_std_mult': 1.288666097876842, 'bear_rsi_os': 31, 'bear_rsi_ob': 83, 'bear_adx_thresh': 12.312813762653096, 'bear_atr_min_pct': 0.02011358071204509, 'bear_atr_max_pct': 0.11748722541741721, 'bear_tp_mult': 2.0757088936124726, 'bear_tsl_mult': 0.9982030364793325, 'bear_time_stop': 210, 'bear_use_sma': False, 'bear_use_ema': False, 'bear_use_atr': False, 'bear_use_adx': False, 'bear_use_spike': False, 'bear_rsi_required': False, 'sideways_strategy': 'breakout', 'sideways_bb_std_mult': 0.9314278025858604, 'sideways_rsi_os': 34, 'sideways_rsi_ob': 80, 'sideways_adx_thresh': 11.761269007873144, 'sideways_atr_min_pct': 0.026648331804800376, 'sideways_atr_max_pct': 0.11273393975314493, 'sideways_tp_mult': 2.889040547046986, 'sideways_tsl_mult': 0.4108309726737617, 'sideways_time_stop': 300, 'sideways_use_sma': True, 'sideways_use_ema': False, 'sideways_use_atr': False, 'sideways_use_adx': True, 'sideways_use_spike': False, 'sideways_rsi_required': True}.
[I 2025-08-30 17:27:23,653] Trial 763 finished with values: [-1000000000.0, 1000000000.0] and parameters: {'p_sma': 28, 'p_std': 21, 'p_atr': 17, 'p_adx': 9, 'rsi_period': 80, 'ema1': 18, 'ema2': 22, 'slip_atr_k': 0.04609315941865226, 'slip_spread_k': 0.22753241195535237, 'spread_hl_frac': 0.01540696471444197, 'bb_std_mult': 2.5475405935065636, 'rsi_os': 29, 'rsi_ob': 88, 'vol_spike': 0.08822185311932351, 'adx_thresh': 17.40150826210106, 'atr_min_pct': 0.0172608854629094, 'atr_max_pct': 0.10167942736236171, 'tp_mult': 1.8452135807684202, 'tsl_mult': 0.8820706830307021, 'strategy': 'breakout', 'time_stop': 31, 'use_sma': True, 'use_atr': True, 'use_adx': True, 'use_ema': False, 'use_spike': True, 'rsi_required': False, 'edge_k': 0.9590565068934283, 'edge_cap': 0.32708480754416885, 'bull_strategy': 'breakout', 'bull_bb_std_mult': 2.146358928921778, 'bull_rsi_os': 12, 'bull_rsi_ob': 53, 'bull_adx_thresh': 34.574039448063935, 'bull_atr_min_pct': 0.012618055456374998, 'bull_atr_max_pct': 0.05916512369714992, 'bull_tp_mult': 2.9639386747926855, 'bull_tsl_mult': 0.7418921013415314, 'bull_time_stop': 51, 'bull_use_sma': True, 'bull_use_ema': True, 'bull_use_atr': False, 'bull_use_adx': True, 'bull_use_spike': False, 'bull_rsi_required': False, 'bear_strategy': 'mean_reversion', 'bear_bb_std_mult': 1.120885057341718, 'bear_rsi_os': 17, 'bear_rsi_ob': 74, 'bear_adx_thresh': 12.341557016947341, 'bear_atr_min_pct': 0.022612270686127863, 'bear_atr_max_pct': 0.11694945287742162, 'bear_tp_mult': 1.4224927860705483, 'bear_tsl_mult': 0.5979998459171463, 'bear_time_stop': 210, 'bear_use_sma': True, 'bear_use_ema': False, 'bear_use_atr': True, 'bear_use_adx': False, 'bear_use_spike': False, 'bear_rsi_required': False, 'sideways_strategy': 'breakout', 'sideways_bb_std_mult': 3.4467232393618974, 'sideways_rsi_os': 34, 'sideways_rsi_ob': 66, 'sideways_adx_thresh': 10.649732659341414, 'sideways_atr_min_pct': 0.014437269003155387, 'sideways_atr_max_pct': 0.09883419652157359, 'sideways_tp_mult': 2.675308393100314, 'sideways_tsl_mult': 0.4174964100818432, 'sideways_time_stop': 273, 'sideways_use_sma': True, 'sideways_use_ema': True, 'sideways_use_atr': False, 'sideways_use_adx': False, 'sideways_use_spike': True, 'sideways_rsi_required': True}.
[I 2025-08-30 17:27:24,801] Trial 769 finished with values: [-1000000000.0, 1000000000.0] and parameters: {'p_sma': 8, 'p_std': 31, 'p_atr': 16, 'p_adx': 7, 'rsi_period': 27, 'ema1': 5, 'ema2': 11, 'slip_atr_k': 0.033253914099692056, 'slip_spread_k': 0.8706746644839461, 'spread_hl_frac': 0.01646403777786237, 'bb_std_mult': 3.3709240135375396, 'rsi_os': 45, 'rsi_ob': 62, 'vol_spike': 0.2709670305339326, 'adx_thresh': 17.53883321632828, 'atr_min_pct': 0.02348044597029094, 'atr_max_pct': 0.01964791823892329, 'tp_mult': 1.7036806867509242, 'tsl_mult': 0.9019521273047458, 'strategy': 'mean_reversion', 'time_stop': 152, 'use_sma': False, 'use_atr': True, 'use_adx': True, 'use_ema': False, 'use_spike': False, 'rsi_required': True, 'edge_k': 0.47577836800784756, 'edge_cap': 0.8106036708936106, 'bull_strategy': 'mean_reversion', 'bull_bb_std_mult': 1.7815592891928445, 'bull_rsi_os': 12, 'bull_rsi_ob': 55, 'bull_adx_thresh': 32.80892382650426, 'bull_atr_min_pct': 0.01247350191529825, 'bull_atr_max_pct': 0.14758614548256116, 'bull_tp_mult': 2.1665158588576277, 'bull_tsl_mult': 0.7675927460320234, 'bull_time_stop': 70, 'bull_use_sma': True, 'bull_use_ema': True, 'bull_use_atr': False, 'bull_use_adx': True, 'bull_use_spike': False, 'bull_rsi_required': False, 'bear_strategy': 'mean_reversion', 'bear_bb_std_mult': 3.0578533526825726, 'bear_rsi_os': 25, 'bear_rsi_ob': 77, 'bear_adx_thresh': 21.872136364655933, 'bear_atr_min_pct': 0.013124295184623077, 'bear_atr_max_pct': 0.10062425121642199, 'bear_tp_mult': 2.183216805652959, 'bear_tsl_mult': 0.6548351666207474, 'bear_time_stop': 218, 'bear_use_sma': True, 'bear_use_ema': False, 'bear_use_atr': False, 'bear_use_adx': False, 'bear_use_spike': False, 'bear_rsi_required': False, 'sideways_strategy': 'mean_reversion', 'sideways_bb_std_mult': 0.7309908223344089, 'sideways_rsi_os': 29, 'sideways_rsi_ob': 94, 'sideways_adx_thresh': 9.54669508481947, 'sideways_atr_min_pct': 0.0009882158566313333, 'sideways_atr_max_pct': 0.09883904296803242, 'sideways_tp_mult': 2.92763352878098, 'sideways_tsl_mult': 0.10239276028579075, 'sideways_time_stop': 281, 'sideways_use_sma': False, 'sideways_use_ema': False, 'sideways_use_atr': False, 'sideways_use_adx': False, 'sideways_use_spike': False, 'sideways_rsi_required': True}.
[I 2025-08-30 17:28:06,831] Trial 767 finished with values: [-1000000000.0, 1000000000.0] and parameters: {'p_sma': 8, 'p_std': 32, 'p_atr': 12, 'p_adx': 7, 'rsi_period': 52, 'ema1': 5, 'ema2': 22, 'slip_atr_k': 0.050055665204926394, 'slip_spread_k': 0.1739501368788342, 'spread_hl_frac': 0.02253538665997006, 'bb_std_mult': 1.7561814157051239, 'rsi_os': 33, 'rsi_ob': 62, 'vol_spike': 0.2714876170325267, 'adx_thresh': 15.869897134679917, 'atr_min_pct': 0.021556808015901388, 'atr_max_pct': 0.14539778635908232, 'tp_mult': 2.7016429843363703, 'tsl_mult': 0.9554411902883341, 'strategy': 'mean_reversion', 'time_stop': 280, 'use_sma': False, 'use_atr': True, 'use_adx': True, 'use_ema': False, 'use_spike': False, 'rsi_required': True, 'edge_k': 0.9618672816362068, 'edge_cap': 0.3625981523599124, 'bull_strategy': 'mean_reversion', 'bull_bb_std_mult': 2.122423181996603, 'bull_rsi_os': 11, 'bull_rsi_ob': 55, 'bull_adx_thresh': 13.910168950016761, 'bull_atr_min_pct': 0.012081847976650066, 'bull_atr_max_pct': 0.10916308989327865, 'bull_tp_mult': 2.3064794147027916, 'bull_tsl_mult': 0.7950512587103404, 'bull_time_stop': 70, 'bull_use_sma': True, 'bull_use_ema': True, 'bull_use_atr': False, 'bull_use_adx': True, 'bull_use_spike': False, 'bull_rsi_required': False, 'bear_strategy': 'mean_reversion', 'bear_bb_std_mult': 0.6168314872988744, 'bear_rsi_os': 6, 'bear_rsi_ob': 85, 'bear_adx_thresh': 24.95309867433348, 'bear_atr_min_pct': 0.020085247443044518, 'bear_atr_max_pct': 0.11073547359331853, 'bear_tp_mult': 2.0743709692092307, 'bear_tsl_mult': 0.9956917466355678, 'bear_time_stop': 201, 'bear_use_sma': True, 'bear_use_ema': False, 'bear_use_atr': False, 'bear_use_adx': False, 'bear_use_spike': False, 'bear_rsi_required': False, 'sideways_strategy': 'breakout', 'sideways_bb_std_mult': 3.4296073543505012, 'sideways_rsi_os': 34, 'sideways_rsi_ob': 66, 'sideways_adx_thresh': 11.600924563621575, 'sideways_atr_min_pct': 0.026540795506730656, 'sideways_atr_max_pct': 0.09858838825025129, 'sideways_tp_mult': 2.8882646445330944, 'sideways_tsl_mult': 0.3639081025778029, 'sideways_time_stop': 283, 'sideways_use_sma': True, 'sideways_use_ema': False, 'sideways_use_atr': False, 'sideways_use_adx': False, 'sideways_use_spike': False, 'sideways_rsi_required': True}.
[I 2025-08-30 17:28:08,150] Trial 768 finished with values: [-0.015054913189721963, 0.014998462131058715] and parameters: {'p_sma': 8, 'p_std': 20, 'p_atr': 16, 'p_adx': 7, 'rsi_period': 28, 'ema1': 7, 'ema2': 11, 'slip_atr_k': 0.01654157847280731, 'slip_spread_k': 0.1714312568530897, 'spread_hl_frac': 0.0499713057015382, 'bb_std_mult': 3.021841581524851, 'rsi_os': 33, 'rsi_ob': 87, 'vol_spike': 0.26883927199439644, 'adx_thresh': 10.410174984509785, 'atr_min_pct': 0.021619143224200287, 'atr_max_pct': 0.025222240957026784, 'tp_mult': 2.5270001277958563, 'tsl_mult': 0.8996869870661317, 'strategy': 'mean_reversion', 'time_stop': 154, 'use_sma': False, 'use_atr': True, 'use_adx': True, 'use_ema': False, 'use_spike': False, 'rsi_required': True, 'edge_k': 0.22879020189484667, 'edge_cap': 0.7602685603634891, 'bull_strategy': 'mean_reversion', 'bull_bb_std_mult': 0.9220682090860486, 'bull_rsi_os': 44, 'bull_rsi_ob': 64, 'bull_adx_thresh': 24.718209686438065, 'bull_atr_min_pct': 0.01218173991299409, 'bull_atr_max_pct': 0.13919184922974778, 'bull_tp_mult': 2.162996442563683, 'bull_tsl_mult': 0.7919336768312298, 'bull_time_stop': 70, 'bull_use_sma': True, 'bull_use_ema': True, 'bull_use_atr': False, 'bull_use_adx': True, 'bull_use_spike': False, 'bull_rsi_required': False, 'bear_strategy': 'mean_reversion', 'bear_bb_std_mult': 1.2913392532002663, 'bear_rsi_os': 39, 'bear_rsi_ob': 46, 'bear_adx_thresh': 34.30473223155714, 'bear_atr_min_pct': 0.022644424963270557, 'bear_atr_max_pct': 0.10110649909665463, 'bear_tp_mult': 2.039312561656805, 'bear_tsl_mult': 0.6562120746438929, 'bear_time_stop': 218, 'bear_use_sma': True, 'bear_use_ema': False, 'bear_use_atr': False, 'bear_use_adx': False, 'bear_use_spike': False, 'bear_rsi_required': False, 'sideways_strategy': 'breakout', 'sideways_bb_std_mult': 1.3661403486473247, 'sideways_rsi_os': 29, 'sideways_rsi_ob': 88, 'sideways_adx_thresh': 9.68057594576037, 'sideways_atr_min_pct': 0.0008521945034666483, 'sideways_atr_max_pct': 0.09803888585828059, 'sideways_tp_mult': 2.885439448875771, 'sideways_tsl_mult': 0.09886997830580468, 'sideways_time_stop': 249, 'sideways_use_sma': True, 'sideways_use_ema': False, 'sideways_use_atr': False, 'sideways_use_adx': False, 'sideways_use_spike': False, 'sideways_rsi_required': True}.
[I 2025-08-30 17:28:08,734] Trial 770 finished with values: [-1000000000.0, 1000000000.0] and parameters: {'p_sma': 8, 'p_std': 38, 'p_atr': 16, 'p_adx': 7, 'rsi_period': 27, 'ema1': 7, 'ema2': 12, 'slip_atr_k': 0.10356969354666265, 'slip_spread_k': 0.1712940086257797, 'spread_hl_frac': 0.04179334131489167, 'bb_std_mult': 1.0936898830989974, 'rsi_os': 34, 'rsi_ob': 67, 'vol_spike': 0.27338865540749974, 'adx_thresh': 28.187317797916634, 'atr_min_pct': 0.018887701458705563, 'atr_max_pct': 0.14997360585874336, 'tp_mult': 2.5472088416980925, 'tsl_mult': 0.9113947374900341, 'strategy': 'mean_reversion', 'time_stop': 133, 'use_sma': False, 'use_atr': True, 'use_adx': True, 'use_ema': False, 'use_spike': False, 'rsi_required': True, 'edge_k': 0.23206857079794307, 'edge_cap': 0.8091464223491036, 'bull_strategy': 'mean_reversion', 'bull_bb_std_mult': 1.8094896906621492, 'bull_rsi_os': 10, 'bull_rsi_ob': 54, 'bull_adx_thresh': 32.93741663375422, 'bull_atr_min_pct': 0.004005625061595082, 'bull_atr_max_pct': 0.14669588703554887, 'bull_tp_mult': 2.1574168064609958, 'bull_tsl_mult': 0.8014245354916629, 'bull_time_stop': 69, 'bull_use_sma': True, 'bull_use_ema': True, 'bull_use_atr': False, 'bull_use_adx': True, 'bull_use_spike': False, 'bull_rsi_required': False, 'bear_strategy': 'mean_reversion', 'bear_bb_std_mult': 0.6218159974417365, 'bear_rsi_os': 48, 'bear_rsi_ob': 46, 'bear_adx_thresh': 25.070844523152942, 'bear_atr_min_pct': 0.014813766661410481, 'bear_atr_max_pct': 0.1001991853422848, 'bear_tp_mult': 2.1728343183003256, 'bear_tsl_mult': 0.8854853417052662, 'bear_time_stop': 47, 'bear_use_sma': True, 'bear_use_ema': False, 'bear_use_atr': False, 'bear_use_adx': False, 'bear_use_spike': False, 'bear_rsi_required': False, 'sideways_strategy': 'mean_reversion', 'sideways_bb_std_mult': 0.7332222649146825, 'sideways_rsi_os': 29, 'sideways_rsi_ob': 93, 'sideways_adx_thresh': 27.65277245947324, 'sideways_atr_min_pct': 0.004843410528696947, 'sideways_atr_max_pct': 0.09390957086000526, 'sideways_tp_mult': 2.9332109268006925, 'sideways_tsl_mult': 0.47335206864747936, 'sideways_time_stop': 280, 'sideways_use_sma': False, 'sideways_use_ema': False, 'sideways_use_atr': False, 'sideways_use_adx': False, 'sideways_use_spike': False, 'sideways_rsi_required': True}.
[I 2025-08-30 17:28:09,720] Trial 771 finished with values: [-0.015902115182738985, 0.015871706048602757] and parameters: {'p_sma': 51, 'p_std': 37, 'p_atr': 7, 'p_adx': 10, 'rsi_period': 22, 'ema1': 19, 'ema2': 31, 'slip_atr_k': 0.014207078483167795, 'slip_spread_k': 0.17984955165809943, 'spread_hl_frac': 0.041580181943606874, 'bb_std_mult': 3.015479813078512, 'rsi_os': 9, 'rsi_ob': 72, 'vol_spike': 0.21729820120334103, 'adx_thresh': 26.30119971189082, 'atr_min_pct': 0.018651909303883957, 'atr_max_pct': 0.14555738302908572, 'tp_mult': 2.5356128663123823, 'tsl_mult': 0.9243580344621859, 'strategy': 'mean_reversion', 'time_stop': 287, 'use_sma': False, 'use_atr': True, 'use_adx': True, 'use_ema': True, 'use_spike': False, 'rsi_required': True, 'edge_k': 0.5388018584684052, 'edge_cap': 0.1441651757028159, 'bull_strategy': 'mean_reversion', 'bull_bb_std_mult': 1.821210125323275, 'bull_rsi_os': 10, 'bull_rsi_ob': 51, 'bull_adx_thresh': 24.28266704511152, 'bull_atr_min_pct': 0.003913357893378922, 'bull_atr_max_pct': 0.13904859941256603, 'bull_tp_mult': 2.3092205148197227, 'bull_tsl_mult': 0.7986336879525145, 'bull_time_stop': 84, 'bull_use_sma': True, 'bull_use_ema': False, 'bull_use_atr': False, 'bull_use_adx': True, 'bull_use_spike': False, 'bull_rsi_required': False, 'bear_strategy': 'breakout', 'bear_bb_std_mult': 1.5949809564682809, 'bear_rsi_os': 55, 'bear_rsi_ob': 57, 'bear_adx_thresh': 13.066521112431639, 'bear_atr_min_pct': 0.01457051304050423, 'bear_atr_max_pct': 0.11100558988945984, 'bear_tp_mult': 2.0126892317426672, 'bear_tsl_mult': 0.3438433876110828, 'bear_time_stop': 15, 'bear_use_sma': True, 'bear_use_ema': True, 'bear_use_atr': False, 'bear_use_adx': False, 'bear_use_spike': False, 'bear_rsi_required': False, 'sideways_strategy': 'breakout', 'sideways_bb_std_mult': 2.459879790950557, 'sideways_rsi_os': 31, 'sideways_rsi_ob': 88, 'sideways_adx_thresh': 21.931604167244533, 'sideways_atr_min_pct': 0.005291929236661596, 'sideways_atr_max_pct': 0.09422420653270314, 'sideways_tp_mult': 2.8941971144212726, 'sideways_tsl_mult': 0.6533725854147658, 'sideways_time_stop': 131, 'sideways_use_sma': True, 'sideways_use_ema': False, 'sideways_use_atr': True, 'sideways_use_adx': False, 'sideways_use_spike': False, 'sideways_rsi_required': False}.
[I 2025-08-30 17:28:11,057] Trial 775 finished with values: [-1000000000.0, 1000000000.0] and parameters: {'p_sma': 53, 'p_std': 24, 'p_atr': 18, 'p_adx': 9, 'rsi_period': 23, 'ema1': 18, 'ema2': 55, 'slip_atr_k': 0.00522184355980621, 'slip_spread_k': 0.19972869310312963, 'spread_hl_frac': 0.04019106802058418, 'bb_std_mult': 3.100683546473527, 'rsi_os': 35, 'rsi_ob': 50, 'vol_spike': 0.10191267789443127, 'adx_thresh': 11.272145362345137, 'atr_min_pct': 0.010296287219296065, 'atr_max_pct': 0.14167623447191258, 'tp_mult': 2.3895861878997513, 'tsl_mult': 0.06852428578038305, 'strategy': 'mean_reversion', 'time_stop': 24, 'use_sma': False, 'use_atr': True, 'use_adx': True, 'use_ema': True, 'use_spike': True, 'rsi_required': True, 'edge_k': 0.622776780650069, 'edge_cap': 0.24237663539908888, 'bull_strategy': 'breakout', 'bull_bb_std_mult': 1.6637071992144585, 'bull_rsi_os': 53, 'bull_rsi_ob': 87, 'bull_adx_thresh': 34.982890393475316, 'bull_atr_min_pct': 0.017936127874832234, 'bull_atr_max_pct': 0.0875748295543822, 'bull_tp_mult': 2.3576952657440597, 'bull_tsl_mult': 0.8383357536416909, 'bull_time_stop': 77, 'bull_use_sma': True, 'bull_use_ema': False, 'bull_use_atr': False, 'bull_use_adx': True, 'bull_use_spike': True, 'bull_rsi_required': True, 'bear_strategy': 'breakout', 'bear_bb_std_mult': 0.8685751728565614, 'bear_rsi_os': 14, 'bear_rsi_ob': 71, 'bear_adx_thresh': 11.870575629193151, 'bear_atr_min_pct': 0.019245242276742253, 'bear_atr_max_pct': 0.10362109270308137, 'bear_tp_mult': 2.1285988365678685, 'bear_tsl_mult': 0.18382639444161808, 'bear_time_stop': 282, 'bear_use_sma': True, 'bear_use_ema': True, 'bear_use_atr': True, 'bear_use_adx': False, 'bear_use_spike': False, 'bear_rsi_required': False, 'sideways_strategy': 'breakout', 'sideways_bb_std_mult': 1.7619188983489682, 'sideways_rsi_os': 31, 'sideways_rsi_ob': 92, 'sideways_adx_thresh': 21.116860935073888, 'sideways_atr_min_pct': 0.0018977759426363646, 'sideways_atr_max_pct': 0.10775715184525984, 'sideways_tp_mult': 2.997916083310907, 'sideways_tsl_mult': 0.31369366666205867, 'sideways_time_stop': 91, 'sideways_use_sma': True, 'sideways_use_ema': True, 'sideways_use_atr': True, 'sideways_use_adx': True, 'sideways_use_spike': True, 'sideways_rsi_required': False}.
[I 2025-08-30 17:28:46,998] Trial 772 finished with values: [-1000000000.0, 1000000000.0] and parameters: {'p_sma': 10, 'p_std': 20, 'p_atr': 16, 'p_adx': 10, 'rsi_period': 23, 'ema1': 19, 'ema2': 12, 'slip_atr_k': 0.013287467516786448, 'slip_spread_k': 0.12361394285761926, 'spread_hl_frac': 0.0499017918011673, 'bb_std_mult': 1.0969073576487092, 'rsi_os': 27, 'rsi_ob': 58, 'vol_spike': 0.10109205851195383, 'adx_thresh': 26.297387834179673, 'atr_min_pct': 0.01895792389936337, 'atr_max_pct': 0.14175458146615302, 'tp_mult': 2.525181164534269, 'tsl_mult': 0.9307504431877143, 'strategy': 'mean_reversion', 'time_stop': 22, 'use_sma': False, 'use_atr': True, 'use_adx': True, 'use_ema': True, 'use_spike': False, 'rsi_required': True, 'edge_k': 0.568324413253055, 'edge_cap': 0.8721208796634521, 'bull_strategy': 'mean_reversion', 'bull_bb_std_mult': 1.8361426359736934, 'bull_rsi_os': 44, 'bull_rsi_ob': 51, 'bull_adx_thresh': 33.47694723428767, 'bull_atr_min_pct': 0.006323690618673992, 'bull_atr_max_pct': 0.13890755289023887, 'bull_tp_mult': 2.2636391433070067, 'bull_tsl_mult': 0.8354597725613487, 'bull_time_stop': 81, 'bull_use_sma': True, 'bull_use_ema': False, 'bull_use_atr': False, 'bull_use_adx': True, 'bull_use_spike': True, 'bull_rsi_required': True, 'bear_strategy': 'breakout', 'bear_bb_std_mult': 1.5793420061232366, 'bear_rsi_os': 14, 'bear_rsi_ob': 76, 'bear_adx_thresh': 7.558359642147195, 'bear_atr_min_pct': 0.014872592019785932, 'bear_atr_max_pct': 0.12502673278226933, 'bear_tp_mult': 2.1825455847430213, 'bear_tsl_mult': 0.10250980070256543, 'bear_time_stop': 38, 'bear_use_sma': True, 'bear_use_ema': True, 'bear_use_atr': False, 'bear_use_adx': False, 'bear_use_spike': False, 'bear_rsi_required': False, 'sideways_strategy': 'mean_reversion', 'sideways_bb_std_mult': 0.7987504691308442, 'sideways_rsi_os': 31, 'sideways_rsi_ob': 88, 'sideways_adx_thresh': 11.04225393566221, 'sideways_atr_min_pct': 0.000990641802966811, 'sideways_atr_max_pct': 0.1065744300341239, 'sideways_tp_mult': 2.9967774973319803, 'sideways_tsl_mult': 0.4388760515751298, 'sideways_time_stop': 8, 'sideways_use_sma': False, 'sideways_use_ema': False, 'sideways_use_atr': True, 'sideways_use_adx': False, 'sideways_use_spike': False, 'sideways_rsi_required': False}.
