[I 2025-08-30 16:42:54,956] Trial 504 finished with values: [-1000000000.0, 1000000000.0] and parameters: {'p_sma': 8, 'p_std': 57, 'p_atr': 23, 'p_adx': 25, 'rsi_period': 15, 'ema1': 26, 'ema2': 49, 'slip_atr_k': 0.0714916313625266, 'slip_spread_k': 0.5951128552886935, 'spread_hl_frac': 0.030318795628027084, 'bb_std_mult': 3.1599386321183793, 'rsi_os': 34, 'rsi_ob': 90, 'vol_spike': 0.0957838463521609, 'adx_thresh': 19.315008596678304, 'atr_min_pct': 0.029742691638815755, 'atr_max_pct': 0.14165395035002093, 'tp_mult': 2.541846972607207, 'tsl_mult': 0.4597680564962461, 'strategy': 'breakout', 'time_stop': 129, 'use_sma': False, 'use_atr': True, 'use_adx': False, 'use_ema': False, 'use_spike': True, 'rsi_required': True, 'edge_k': 1.6876738438254455, 'edge_cap': 0.582157749102309, 'bull_strategy': 'mean_reversion', 'bull_bb_std_mult': 3.195526988617771, 'bull_rsi_os': 35, 'bull_rsi_ob': 88, 'bull_adx_thresh': 10.259506039943775, 'bull_atr_min_pct': 0.021154664841490853, 'bull_atr_max_pct': 0.13199490831503463, 'bull_tp_mult': 1.3027407569611469, 'bull_tsl_mult': 0.8286471634627217, 'bull_time_stop': 259, 'bull_use_sma': False, 'bull_use_ema': True, 'bull_use_atr': True, 'bull_use_adx': False, 'bull_use_spike': True, 'bull_rsi_required': True, 'bear_strategy': 'mean_reversion', 'bear_bb_std_mult': 2.0015781889526436, 'bear_rsi_os': 38, 'bear_rsi_ob': 69, 'bear_adx_thresh': 13.486072501429778, 'bear_atr_min_pct': 0.020542977534914724, 'bear_atr_max_pct': 0.12228472117407965, 'bear_tp_mult': 2.9988648043380035, 'bear_tsl_mult': 0.6428954247857703, 'bear_time_stop': 235, 'bear_use_sma': True, 'bear_use_ema': True, 'bear_use_atr': True, 'bear_use_adx': False, 'bear_use_spike': False, 'bear_rsi_required': False, 'sideways_strategy': 'breakout', 'sideways_bb_std_mult': 1.6610163803807396, 'sideways_rsi_os': 14, 'sideways_rsi_ob': 91, 'sideways_adx_thresh': 25.83687696681099, 'sideways_atr_min_pct': 0.008067546160278966, 'sideways_atr_max_pct': 0.14020434358858708, 'sideways_tp_mult': 1.4799037350597994, 'sideways_tsl_mult': 0.4321511111964023, 'sideways_time_stop': 223, 'sideways_use_sma': True, 'sideways_use_ema': False, 'sideways_use_atr': True, 'sideways_use_adx': False, 'sideways_use_spike': False, 'sideways_rsi_required': True}.
[I 2025-08-30 16:43:38,176] Trial 505 finished with values: [-1000000000.0, 1000000000.0] and parameters: {'p_sma': 53, 'p_std': 41, 'p_atr': 26, 'p_adx': 23, 'rsi_period': 15, 'ema1': 21, 'ema2': 13, 'slip_atr_k': 0.17526340109645402, 'slip_spread_k': 0.8286322517253646, 'spread_hl_frac': 0.02148708684441593, 'bb_std_mult': 2.956494317504227, 'rsi_os': 34, 'rsi_ob': 90, 'vol_spike': 0.005935270839846615, 'adx_thresh': 14.415480247148245, 'atr_min_pct': 0.029842904424511048, 'atr_max_pct': 0.13927714211458844, 'tp_mult': 2.5449273184983374, 'tsl_mult': 0.5745845622152639, 'strategy': 'mean_reversion', 'time_stop': 37, 'use_sma': False, 'use_atr': True, 'use_adx': False, 'use_ema': False, 'use_spike': True, 'rsi_required': True, 'edge_k': 1.6880778333132818, 'edge_cap': 0.6259546387897806, 'bull_strategy': 'mean_reversion', 'bull_bb_std_mult': 1.6858154763322328, 'bull_rsi_os': 35, 'bull_rsi_ob': 53, 'bull_adx_thresh': 21.88886492666778, 'bull_atr_min_pct': 0.020916316732279887, 'bull_atr_max_pct': 0.14628852285690044, 'bull_tp_mult': 1.2676096378601454, 'bull_tsl_mult': 0.8269001036780235, 'bull_time_stop': 260, 'bull_use_sma': False, 'bull_use_ema': True, 'bull_use_atr': True, 'bull_use_adx': False, 'bull_use_spike': False, 'bull_rsi_required': False, 'bear_strategy': 'mean_reversion', 'bear_bb_std_mult': 2.086212689428342, 'bear_rsi_os': 14, 'bear_rsi_ob': 69, 'bear_adx_thresh': 34.42226942232756, 'bear_atr_min_pct': 0.0036201125436865073, 'bear_atr_max_pct': 0.0779390729801394, 'bear_tp_mult': 2.235526184712684, 'bear_tsl_mult': 0.6422478063326469, 'bear_time_stop': 235, 'bear_use_sma': True, 'bear_use_ema': False, 'bear_use_atr': True, 'bear_use_adx': False, 'bear_use_spike': False, 'bear_rsi_required': False, 'sideways_strategy': 'breakout', 'sideways_bb_std_mult': 2.0624591387728715, 'sideways_rsi_os': 46, 'sideways_rsi_ob': 94, 'sideways_adx_thresh': 18.4738743878339, 'sideways_atr_min_pct': 0.02126391454609532, 'sideways_atr_max_pct': 0.1499186049865008, 'sideways_tp_mult': 1.6292131226264543, 'sideways_tsl_mult': 0.4646620720190618, 'sideways_time_stop': 223, 'sideways_use_sma': True, 'sideways_use_ema': False, 'sideways_use_atr': False, 'sideways_use_adx': False, 'sideways_use_spike': False, 'sideways_rsi_required': True}.
[I 2025-08-30 16:43:40,945] Trial 506 finished with values: [-1000000000.0, 1000000000.0] and parameters: {'p_sma': 41, 'p_std': 6, 'p_atr': 24, 'p_adx': 13, 'rsi_period': 16, 'ema1': 26, 'ema2': 12, 'slip_atr_k': 0.05324483161923377, 'slip_spread_k': 0.9078143395284228, 'spread_hl_frac': 0.021232996825378506, 'bb_std_mult': 2.9447308618357004, 'rsi_os': 49, 'rsi_ob': 90, 'vol_spike': 0.050197251743349824, 'adx_thresh': 12.485799701950342, 'atr_min_pct': 0.019764437185735503, 'atr_max_pct': 0.07822437235962024, 'tp_mult': 1.5070535280972446, 'tsl_mult': 0.25216657840810586, 'strategy': 'mean_reversion', 'time_stop': 23, 'use_sma': False, 'use_atr': True, 'use_adx': True, 'use_ema': True, 'use_spike': False, 'rsi_required': True, 'edge_k': 1.6777440430811004, 'edge_cap': 0.1134390972821458, 'bull_strategy': 'breakout', 'bull_bb_std_mult': 2.835574148373862, 'bull_rsi_os': 12, 'bull_rsi_ob': 50, 'bull_adx_thresh': 22.043110986118144, 'bull_atr_min_pct': 0.020550873704134966, 'bull_atr_max_pct': 0.13776169140187314, 'bull_tp_mult': 2.2043282215352096, 'bull_tsl_mult': 0.029314688553168766, 'bull_time_stop': 28, 'bull_use_sma': False, 'bull_use_ema': False, 'bull_use_atr': True, 'bull_use_adx': True, 'bull_use_spike': False, 'bull_rsi_required': False, 'bear_strategy': 'breakout', 'bear_bb_std_mult': 2.1042538506765003, 'bear_rsi_os': 5, 'bear_rsi_ob': 77, 'bear_adx_thresh': 31.46587740255185, 'bear_atr_min_pct': 0.012671641459787455, 'bear_atr_max_pct': 0.06981262964665697, 'bear_tp_mult': 1.8494497032839996, 'bear_tsl_mult': 0.5957449648738313, 'bear_time_stop': 235, 'bear_use_sma': False, 'bear_use_ema': False, 'bear_use_atr': True, 'bear_use_adx': False, 'bear_use_spike': False, 'bear_rsi_required': False, 'sideways_strategy': 'breakout', 'sideways_bb_std_mult': 2.3494099216702047, 'sideways_rsi_os': 46, 'sideways_rsi_ob': 94, 'sideways_adx_thresh': 30.036293762076294, 'sideways_atr_min_pct': 0.021213213402412157, 'sideways_atr_max_pct': 0.1438877060358403, 'sideways_tp_mult': 1.869699901166113, 'sideways_tsl_mult': 0.4677611961794104, 'sideways_time_stop': 245, 'sideways_use_sma': False, 'sideways_use_ema': True, 'sideways_use_atr': False, 'sideways_use_adx': True, 'sideways_use_spike': False, 'sideways_rsi_required': False}.
[I 2025-08-30 16:43:42,328] Trial 507 finished with values: [-1000000000.0, 1000000000.0] and parameters: {'p_sma': 41, 'p_std': 41, 'p_atr': 16, 'p_adx': 13, 'rsi_period': 16, 'ema1': 26, 'ema2': 13, 'slip_atr_k': 9.228498661397171e-05, 'slip_spread_k': 0.676587166835023, 'spread_hl_frac': 0.018385007471996413, 'bb_std_mult': 3.2678643490135553, 'rsi_os': 11, 'rsi_ob': 90, 'vol_spike': 0.020332356530603973, 'adx_thresh': 12.397990314016447, 'atr_min_pct': 0.02355546505882883, 'atr_max_pct': 0.14172806957278689, 'tp_mult': 1.5379057192264665, 'tsl_mult': 0.4887659268716405, 'strategy': 'mean_reversion', 'time_stop': 5, 'use_sma': False, 'use_atr': True, 'use_adx': True, 'use_ema': True, 'use_spike': False, 'rsi_required': True, 'edge_k': 1.1439163942405648, 'edge_cap': 0.6401688679877492, 'bull_strategy': 'breakout', 'bull_bb_std_mult': 1.679005154946358, 'bull_rsi_os': 16, 'bull_rsi_ob': 50, 'bull_adx_thresh': 22.1348732858342, 'bull_atr_min_pct': 0.02084903228805522, 'bull_atr_max_pct': 0.1326453016071638, 'bull_tp_mult': 1.2172099075524634, 'bull_tsl_mult': 0.3261645757223902, 'bull_time_stop': 28, 'bull_use_sma': False, 'bull_use_ema': False, 'bull_use_atr': True, 'bull_use_adx': True, 'bull_use_spike': False, 'bull_rsi_required': False, 'bear_strategy': 'breakout', 'bear_bb_std_mult': 2.441344416103099, 'bear_rsi_os': 5, 'bear_rsi_ob': 77, 'bear_adx_thresh': 34.61098480829388, 'bear_atr_min_pct': 0.022130502481918522, 'bear_atr_max_pct': 0.0944269497186305, 'bear_tp_mult': 2.2468360551951467, 'bear_tsl_mult': 0.5958157466525714, 'bear_time_stop': 235, 'bear_use_sma': False, 'bear_use_ema': False, 'bear_use_atr': True, 'bear_use_adx': False, 'bear_use_spike': False, 'bear_rsi_required': False, 'sideways_strategy': 'breakout', 'sideways_bb_std_mult': 2.2902394878747225, 'sideways_rsi_os': 48, 'sideways_rsi_ob': 94, 'sideways_adx_thresh': 18.44327995390999, 'sideways_atr_min_pct': 0.019966519856237926, 'sideways_atr_max_pct': 0.14255315240415112, 'sideways_tp_mult': 1.6354757913128304, 'sideways_tsl_mult': 0.45882465854047116, 'sideways_time_stop': 225, 'sideways_use_sma': False, 'sideways_use_ema': True, 'sideways_use_atr': False, 'sideways_use_adx': True, 'sideways_use_spike': False, 'sideways_rsi_required': False}.
[I 2025-08-30 16:43:43,189] Trial 508 finished with values: [-1000000000.0, 1000000000.0] and parameters: {'p_sma': 54, 'p_std': 56, 'p_atr': 19, 'p_adx': 23, 'rsi_period': 19, 'ema1': 27, 'ema2': 13, 'slip_atr_k': 2.7333615877197376e-05, 'slip_spread_k': 0.6252763980362452, 'spread_hl_frac': 0.021806193531110855, 'bb_std_mult': 3.257000605570724, 'rsi_os': 27, 'rsi_ob': 82, 'vol_spike': 0.2467403753327182, 'adx_thresh': 12.542661612360774, 'atr_min_pct': 0.026534469961936633, 'atr_max_pct': 0.13846546367170096, 'tp_mult': 2.8747036311071796, 'tsl_mult': 0.5802458027642883, 'strategy': 'mean_reversion', 'time_stop': 182, 'use_sma': True, 'use_atr': False, 'use_adx': True, 'use_ema': True, 'use_spike': False, 'rsi_required': False, 'edge_k': 0.6064928381052483, 'edge_cap': 0.6460050722340134, 'bull_strategy': 'breakout', 'bull_bb_std_mult': 2.0811736650895365, 'bull_rsi_os': 12, 'bull_rsi_ob': 50, 'bull_adx_thresh': 24.728037202482604, 'bull_atr_min_pct': 0.020762589379073163, 'bull_atr_max_pct': 0.1380309126654199, 'bull_tp_mult': 1.010583132500399, 'bull_tsl_mult': 0.25320064725291963, 'bull_time_stop': 157, 'bull_use_sma': False, 'bull_use_ema': False, 'bull_use_atr': True, 'bull_use_adx': True, 'bull_use_spike': False, 'bull_rsi_required': False, 'bear_strategy': 'breakout', 'bear_bb_std_mult': 2.2224799593821434, 'bear_rsi_os': 14, 'bear_rsi_ob': 47, 'bear_adx_thresh': 15.321487851595892, 'bear_atr_min_pct': 0.021913016225251696, 'bear_atr_max_pct': 0.0939722932506227, 'bear_tp_mult': 2.261596226713608, 'bear_tsl_mult': 0.5930974827059469, 'bear_time_stop': 70, 'bear_use_sma': False, 'bear_use_ema': False, 'bear_use_atr': True, 'bear_use_adx': True, 'bear_use_spike': True, 'bear_rsi_required': True, 'sideways_strategy': 'mean_reversion', 'sideways_bb_std_mult': 2.698221294172133, 'sideways_rsi_os': 6, 'sideways_rsi_ob': 94, 'sideways_adx_thresh': 18.50476115963555, 'sideways_atr_min_pct': 0.009869229002462232, 'sideways_atr_max_pct': 0.1441816553118521, 'sideways_tp_mult': 1.4128710518211887, 'sideways_tsl_mult': 0.4648337479773641, 'sideways_time_stop': 190, 'sideways_use_sma': False, 'sideways_use_ema': True, 'sideways_use_atr': False, 'sideways_use_adx': True, 'sideways_use_spike': True, 'sideways_rsi_required': False}.
[I 2025-08-30 16:44:29,731] Trial 510 finished with values: [-1000000000.0, 1000000000.0] and parameters: {'p_sma': 8, 'p_std': 56, 'p_atr': 19, 'p_adx': 26, 'rsi_period': 19, 'ema1': 27, 'ema2': 11, 'slip_atr_k': 0.0038363133671026244, 'slip_spread_k': 0.5591615819729021, 'spread_hl_frac': 0.03880860436377723, 'bb_std_mult': 3.2686533058854326, 'rsi_os': 32, 'rsi_ob': 91, 'vol_spike': 0.01835329281406016, 'adx_thresh': 12.746628934031902, 'atr_min_pct': 0.02358698689889973, 'atr_max_pct': 0.14963321307814834, 'tp_mult': 2.631897209944101, 'tsl_mult': 0.53079282657297, 'strategy': 'mean_reversion', 'time_stop': 173, 'use_sma': True, 'use_atr': False, 'use_adx': True, 'use_ema': False, 'use_spike': False, 'rsi_required': False, 'edge_k': 1.4485875136141093, 'edge_cap': 0.6527286461036529, 'bull_strategy': 'breakout', 'bull_bb_std_mult': 2.0716444728154952, 'bull_rsi_os': 14, 'bull_rsi_ob': 49, 'bull_adx_thresh': 6.46199288474676, 'bull_atr_min_pct': 0.01650966578854481, 'bull_atr_max_pct': 0.13918929183758097, 'bull_tp_mult': 1.7097731014134463, 'bull_tsl_mult': 0.1320631245841717, 'bull_time_stop': 5, 'bull_use_sma': False, 'bull_use_ema': False, 'bull_use_atr': True, 'bull_use_adx': True, 'bull_use_spike': False, 'bull_rsi_required': False, 'bear_strategy': 'mean_reversion', 'bear_bb_std_mult': 2.439165330168968, 'bear_rsi_os': 28, 'bear_rsi_ob': 58, 'bear_adx_thresh': 12.838993824326089, 'bear_atr_min_pct': 0.022049379237407792, 'bear_atr_max_pct': 0.09398738909431963, 'bear_tp_mult': 2.2464965519767666, 'bear_tsl_mult': 0.19070402642001721, 'bear_time_stop': 213, 'bear_use_sma': False, 'bear_use_ema': False, 'bear_use_atr': False, 'bear_use_adx': True, 'bear_use_spike': True, 'bear_rsi_required': True, 'sideways_strategy': 'mean_reversion', 'sideways_bb_std_mult': 2.2100632606799167, 'sideways_rsi_os': 29, 'sideways_rsi_ob': 75, 'sideways_adx_thresh': 6.19749745908311, 'sideways_atr_min_pct': 0.012502957278444407, 'sideways_atr_max_pct': 0.12567059516446955, 'sideways_tp_mult': 1.423996679865601, 'sideways_tsl_mult': 0.5060521390224927, 'sideways_time_stop': 217, 'sideways_use_sma': False, 'sideways_use_ema': False, 'sideways_use_atr': False, 'sideways_use_adx': True, 'sideways_use_spike': True, 'sideways_rsi_required': False}.
[I 2025-08-30 16:44:30,810] Trial 511 finished with values: [-1000000000.0, 1000000000.0] and parameters: {'p_sma': 29, 'p_std': 13, 'p_atr': 20, 'p_adx': 21, 'rsi_period': 19, 'ema1': 24, 'ema2': 40, 'slip_atr_k': 0.02682444305574025, 'slip_spread_k': 0.24550272443106536, 'spread_hl_frac': 0.02485432751279078, 'bb_std_mult': 3.032245529413202, 'rsi_os': 32, 'rsi_ob': 82, 'vol_spike': 0.285119239636323, 'adx_thresh': 12.83206502097901, 'atr_min_pct': 0.016423008604963787, 'atr_max_pct': 0.04240722689774848, 'tp_mult': 2.6333405550050197, 'tsl_mult': 0.840695814050873, 'strategy': 'mean_reversion', 'time_stop': 17, 'use_sma': True, 'use_atr': False, 'use_adx': True, 'use_ema': False, 'use_spike': False, 'rsi_required': False, 'edge_k': 1.1000456405750472, 'edge_cap': 0.5374784526392703, 'bull_strategy': 'mean_reversion', 'bull_bb_std_mult': 1.1361356063343295, 'bull_rsi_os': 7, 'bull_rsi_ob': 62, 'bull_adx_thresh': 14.22593986165455, 'bull_atr_min_pct': 0.028080204037751588, 'bull_atr_max_pct': 0.1385931180933918, 'bull_tp_mult': 1.5945095852223767, 'bull_tsl_mult': 0.25905587503082356, 'bull_time_stop': 55, 'bull_use_sma': False, 'bull_use_ema': True, 'bull_use_atr': True, 'bull_use_adx': True, 'bull_use_spike': False, 'bull_rsi_required': False, 'bear_strategy': 'mean_reversion', 'bear_bb_std_mult': 2.21801792055558, 'bear_rsi_os': 14, 'bear_rsi_ob': 58, 'bear_adx_thresh': 14.7509591467063, 'bear_atr_min_pct': 0.0217728388828917, 'bear_atr_max_pct': 0.09029423270470453, 'bear_tp_mult': 2.175611659121397, 'bear_tsl_mult': 0.6233162864958066, 'bear_time_stop': 218, 'bear_use_sma': True, 'bear_use_ema': False, 'bear_use_atr': False, 'bear_use_adx': True, 'bear_use_spike': True, 'bear_rsi_required': True, 'sideways_strategy': 'mean_reversion', 'sideways_bb_std_mult': 2.7426638754764365, 'sideways_rsi_os': 37, 'sideways_rsi_ob': 92, 'sideways_adx_thresh': 17.246147337719812, 'sideways_atr_min_pct': 0.00041796038044584257, 'sideways_atr_max_pct': 0.1347791433761703, 'sideways_tp_mult': 1.4168814656961788, 'sideways_tsl_mult': 0.5081524712544208, 'sideways_time_stop': 65, 'sideways_use_sma': True, 'sideways_use_ema': False, 'sideways_use_atr': False, 'sideways_use_adx': False, 'sideways_use_spike': True, 'sideways_rsi_required': True}.
[I 2025-08-30 16:44:31,809] Trial 512 finished with values: [-1000000000.0, 1000000000.0] and parameters: {'p_sma': 8, 'p_std': 59, 'p_atr': 8, 'p_adx': 26, 'rsi_period': 19, 'ema1': 25, 'ema2': 41, 'slip_atr_k': 0.02834646873370392, 'slip_spread_k': 0.5607198355558953, 'spread_hl_frac': 0.0411464996104365, 'bb_std_mult': 2.0718819318789907, 'rsi_os': 32, 'rsi_ob': 92, 'vol_spike': 0.0051828468186231585, 'adx_thresh': 13.542990038674542, 'atr_min_pct': 0.012056316348475048, 'atr_max_pct': 0.08831922627584701, 'tp_mult': 2.630039276502006, 'tsl_mult': 0.5308262587439174, 'strategy': 'mean_reversion', 'time_stop': 17, 'use_sma': True, 'use_atr': False, 'use_adx': True, 'use_ema': False, 'use_spike': False, 'rsi_required': False, 'edge_k': 1.432369108258311, 'edge_cap': 0.7667836385539583, 'bull_strategy': 'mean_reversion', 'bull_bb_std_mult': 1.921807970111926, 'bull_rsi_os': 14, 'bull_rsi_ob': 52, 'bull_adx_thresh': 6.669237292918037, 'bull_atr_min_pct': 0.009923944021583156, 'bull_atr_max_pct': 0.1401909239409403, 'bull_tp_mult': 1.3496202556329069, 'bull_tsl_mult': 0.2993682993798144, 'bull_time_stop': 52, 'bull_use_sma': False, 'bull_use_ema': True, 'bull_use_atr': True, 'bull_use_adx': True, 'bull_use_spike': False, 'bull_rsi_required': False, 'bear_strategy': 'mean_reversion', 'bear_bb_std_mult': 1.8907183344690863, 'bear_rsi_os': 13, 'bear_rsi_ob': 61, 'bear_adx_thresh': 12.945259058404373, 'bear_atr_min_pct': 0.02175175681886812, 'bear_atr_max_pct': 0.11718528521741986, 'bear_tp_mult': 1.9317725642181491, 'bear_tsl_mult': 0.6726020518427641, 'bear_time_stop': 215, 'bear_use_sma': True, 'bear_use_ema': False, 'bear_use_atr': False, 'bear_use_adx': True, 'bear_use_spike': True, 'bear_rsi_required': True, 'sideways_strategy': 'mean_reversion', 'sideways_bb_std_mult': 2.0922775712718376, 'sideways_rsi_os': 12, 'sideways_rsi_ob': 79, 'sideways_adx_thresh': 17.369616274607736, 'sideways_atr_min_pct': 0.00036803965594615776, 'sideways_atr_max_pct': 0.1471557765681032, 'sideways_tp_mult': 1.7630533264932073, 'sideways_tsl_mult': 0.5058582104740704, 'sideways_time_stop': 261, 'sideways_use_sma': True, 'sideways_use_ema': False, 'sideways_use_atr': False, 'sideways_use_adx': False, 'sideways_use_spike': True, 'sideways_rsi_required': True}.
[I 2025-08-30 16:44:32,643] Trial 509 finished with values: [-1000000000.0, 1000000000.0] and parameters: {'p_sma': 8, 'p_std': 56, 'p_atr': 19, 'p_adx': 9, 'rsi_period': 19, 'ema1': 26, 'ema2': 11, 'slip_atr_k': 0.00391036194427874, 'slip_spread_k': 0.906244485840726, 'spread_hl_frac': 9.092932878972115e-05, 'bb_std_mult': 3.281229487750242, 'rsi_os': 32, 'rsi_ob': 92, 'vol_spike': 0.00417139410081189, 'adx_thresh': 12.591566895552905, 'atr_min_pct': 0.012220656947650448, 'atr_max_pct': 0.042754648342924556, 'tp_mult': 2.870060575859087, 'tsl_mult': 0.491861145380858, 'strategy': 'mean_reversion', 'time_stop': 186, 'use_sma': True, 'use_atr': False, 'use_adx': True, 'use_ema': True, 'use_spike': False, 'rsi_required': False, 'edge_k': 1.466137026472341, 'edge_cap': 0.7548907463503636, 'bull_strategy': 'breakout', 'bull_bb_std_mult': 2.8678834914551112, 'bull_rsi_os': 12, 'bull_rsi_ob': 50, 'bull_adx_thresh': 14.606722658604582, 'bull_atr_min_pct': 0.010208489188554649, 'bull_atr_max_pct': 0.13867410021069743, 'bull_tp_mult': 2.1980697458123504, 'bull_tsl_mult': 0.32163064122471524, 'bull_time_stop': 53, 'bull_use_sma': False, 'bull_use_ema': False, 'bull_use_atr': True, 'bull_use_adx': True, 'bull_use_spike': False, 'bull_rsi_required': False, 'bear_strategy': 'breakout', 'bear_bb_std_mult': 2.231688450557446, 'bear_rsi_os': 5, 'bear_rsi_ob': 77, 'bear_adx_thresh': 12.875887857876025, 'bear_atr_min_pct': 0.021884574424236084, 'bear_atr_max_pct': 0.09440380185779812, 'bear_tp_mult': 1.8693506372245958, 'bear_tsl_mult': 0.5963211656535258, 'bear_time_stop': 137, 'bear_use_sma': False, 'bear_use_ema': False, 'bear_use_atr': False, 'bear_use_adx': True, 'bear_use_spike': True, 'bear_rsi_required': True, 'sideways_strategy': 'mean_reversion', 'sideways_bb_std_mult': 2.1889641639158226, 'sideways_rsi_os': 48, 'sideways_rsi_ob': 52, 'sideways_adx_thresh': 6.28561561336776, 'sideways_atr_min_pct': 0.025433145778878133, 'sideways_atr_max_pct': 0.1437445363232753, 'sideways_tp_mult': 1.4142196758990877, 'sideways_tsl_mult': 0.5431514856079289, 'sideways_time_stop': 193, 'sideways_use_sma': False, 'sideways_use_ema': True, 'sideways_use_atr': False, 'sideways_use_adx': True, 'sideways_use_spike': True, 'sideways_rsi_required': False}.
