[I 2025-08-30 17:41:49,427] Trial 853 finished with values: [-1000000000.0, 1000000000.0] and parameters: {'p_sma': 8, 'p_std': 37, 'p_atr': 16, 'p_adx': 16, 'rsi_period': 66, 'ema1': 23, 'ema2': 49, 'slip_atr_k': 0.0038489573409640565, 'slip_spread_k': 0.9172390560458428, 'spread_hl_frac': 0.015044262054633304, 'bb_std_mult': 3.1324274666659693, 'rsi_os': 32, 'rsi_ob': 58, 'vol_spike': 0.08589759084195055, 'adx_thresh': 19.373583135405795, 'atr_min_pct': 0.008113038737852114, 'atr_max_pct': 0.149959975295408, 'tp_mult': 2.638552481397841, 'tsl_mult': 0.975331555899367, 'strategy': 'mean_reversion', 'time_stop': 43, 'use_sma': False, 'use_atr': True, 'use_adx': True, 'use_ema': False, 'use_spike': False, 'rsi_required': True, 'edge_k': 0.9374686572728668, 'edge_cap': 0.8307417264634854, 'bull_strategy': 'mean_reversion', 'bull_bb_std_mult': 1.7685735725225156, 'bull_rsi_os': 18, 'bull_rsi_ob': 77, 'bull_adx_thresh': 26.04138449872366, 'bull_atr_min_pct': 0.0031492991033119644, 'bull_atr_max_pct': 0.08134192309326807, 'bull_tp_mult': 1.9644500120400346, 'bull_tsl_mult': 0.7719642536991596, 'bull_time_stop': 75, 'bull_use_sma': True, 'bull_use_ema': True, 'bull_use_atr': False, 'bull_use_adx': True, 'bull_use_spike': False, 'bull_rsi_required': False, 'bear_strategy': 'mean_reversion', 'bear_bb_std_mult': 1.4676902192959307, 'bear_rsi_os': 16, 'bear_rsi_ob': 84, 'bear_adx_thresh': 28.756877582213257, 'bear_atr_min_pct': 0.010851031594771295, 'bear_atr_max_pct': 0.10734636890662179, 'bear_tp_mult': 2.041249535777468, 'bear_tsl_mult': 0.351278600567158, 'bear_time_stop': 251, 'bear_use_sma': True, 'bear_use_ema': False, 'bear_use_atr': False, 'bear_use_adx': False, 'bear_use_spike': False, 'bear_rsi_required': False, 'sideways_strategy': 'breakout', 'sideways_bb_std_mult': 0.901414352988071, 'sideways_rsi_os': 33, 'sideways_rsi_ob': 91, 'sideways_adx_thresh': 32.608724895035415, 'sideways_atr_min_pct': 0.0017630287573477987, 'sideways_atr_max_pct': 0.09147374637140303, 'sideways_tp_mult': 2.9000946520249276, 'sideways_tsl_mult': 0.40545290099537523, 'sideways_time_stop': 264, 'sideways_use_sma': True, 'sideways_use_ema': False, 'sideways_use_atr': False, 'sideways_use_adx': False, 'sideways_use_spike': False, 'sideways_rsi_required': True}.
[I 2025-08-30 17:41:49,901] Trial 856 finished with values: [-1000000000.0, 1000000000.0] and parameters: {'p_sma': 7, 'p_std': 26, 'p_atr': 15, 'p_adx': 16, 'rsi_period': 21, 'ema1': 20, 'ema2': 41, 'slip_atr_k': 0.009999872420448835, 'slip_spread_k': 0.2627786228877768, 'spread_hl_frac': 0.03295580044380425, 'bb_std_mult': 3.2476857614092953, 'rsi_os': 32, 'rsi_ob': 84, 'vol_spike': 0.08663912765970867, 'adx_thresh': 19.397260965976297, 'atr_min_pct': 0.0005462932675816233, 'atr_max_pct': 0.08566168051480692, 'tp_mult': 2.9698847976183, 'tsl_mult': 0.14726020408857188, 'strategy': 'breakout', 'time_stop': 81, 'use_sma': True, 'use_atr': False, 'use_adx': True, 'use_ema': False, 'use_spike': True, 'rsi_required': False, 'edge_k': 0.5307365184759645, 'edge_cap': 0.8355767280522142, 'bull_strategy': 'breakout', 'bull_bb_std_mult': 2.8506277099600217, 'bull_rsi_os': 11, 'bull_rsi_ob': 53, 'bull_adx_thresh': 24.341549415424772, 'bull_atr_min_pct': 0.029942473771893782, 'bull_atr_max_pct': 0.0729152863843599, 'bull_tp_mult': 2.3045541597749506, 'bull_tsl_mult': 0.7769391224850614, 'bull_time_stop': 77, 'bull_use_sma': True, 'bull_use_ema': True, 'bull_use_atr': False, 'bull_use_adx': False, 'bull_use_spike': False, 'bull_rsi_required': False, 'bear_strategy': 'mean_reversion', 'bear_bb_std_mult': 1.8093195874743384, 'bear_rsi_os': 23, 'bear_rsi_ob': 73, 'bear_adx_thresh': 28.51301059159499, 'bear_atr_min_pct': 0.01897616513621807, 'bear_atr_max_pct': 0.11117939535237285, 'bear_tp_mult': 2.1109682131149734, 'bear_tsl_mult': 0.1941259026745531, 'bear_time_stop': 204, 'bear_use_sma': True, 'bear_use_ema': False, 'bear_use_atr': True, 'bear_use_adx': True, 'bear_use_spike': True, 'bear_rsi_required': True, 'sideways_strategy': 'mean_reversion', 'sideways_bb_std_mult': 2.473244436052474, 'sideways_rsi_os': 6, 'sideways_rsi_ob': 95, 'sideways_adx_thresh': 9.03389487908774, 'sideways_atr_min_pct': 0.025006814724529106, 'sideways_atr_max_pct': 0.0903315676804353, 'sideways_tp_mult': 2.1796959868872485, 'sideways_tsl_mult': 0.7188219528653201, 'sideways_time_stop': 290, 'sideways_use_sma': False, 'sideways_use_ema': True, 'sideways_use_atr': False, 'sideways_use_adx': False, 'sideways_use_spike': False, 'sideways_rsi_required': True}.
[I 2025-08-30 17:41:51,599] Trial 859 finished with values: [-1000000000.0, 1000000000.0] and parameters: {'p_sma': 7, 'p_std': 29, 'p_atr': 15, 'p_adx': 10, 'rsi_period': 83, 'ema1': 19, 'ema2': 13, 'slip_atr_k': 0.01130378293182697, 'slip_spread_k': 0.2137004485112614, 'spread_hl_frac': 0.024382945595189838, 'bb_std_mult': 1.5747831471720508, 'rsi_os': 30, 'rsi_ob': 83, 'vol_spike': 0.0967453902598639, 'adx_thresh': 9.659513061889196, 'atr_min_pct': 0.02768395152074587, 'atr_max_pct': 0.026971285805212734, 'tp_mult': 2.892928818963789, 'tsl_mult': 0.10780963922726244, 'strategy': 'breakout', 'time_stop': 29, 'use_sma': True, 'use_atr': False, 'use_adx': True, 'use_ema': False, 'use_spike': True, 'rsi_required': False, 'edge_k': 1.2525792364701969, 'edge_cap': 0.3721745260664391, 'bull_strategy': 'breakout', 'bull_bb_std_mult': 1.9641380452263022, 'bull_rsi_os': 10, 'bull_rsi_ob': 75, 'bull_adx_thresh': 33.50705888481817, 'bull_atr_min_pct': 0.02874538778989949, 'bull_atr_max_pct': 0.13881727877770422, 'bull_tp_mult': 2.2975837767326777, 'bull_tsl_mult': 0.8063618813054177, 'bull_time_stop': 72, 'bull_use_sma': True, 'bull_use_ema': True, 'bull_use_atr': False, 'bull_use_adx': False, 'bull_use_spike': True, 'bull_rsi_required': True, 'bear_strategy': 'mean_reversion', 'bear_bb_std_mult': 1.1560464283631207, 'bear_rsi_os': 14, 'bear_rsi_ob': 88, 'bear_adx_thresh': 12.618942758942994, 'bear_atr_min_pct': 0.019209156625827783, 'bear_atr_max_pct': 0.06012675324253945, 'bear_tp_mult': 2.28508173723006, 'bear_tsl_mult': 0.6486705829167964, 'bear_time_stop': 219, 'bear_use_sma': False, 'bear_use_ema': True, 'bear_use_atr': True, 'bear_use_adx': True, 'bear_use_spike': True, 'bear_rsi_required': True, 'sideways_strategy': 'breakout', 'sideways_bb_std_mult': 2.9691969512513987, 'sideways_rsi_os': 47, 'sideways_rsi_ob': 93, 'sideways_adx_thresh': 9.09990593011566, 'sideways_atr_min_pct': 0.029406802997026787, 'sideways_atr_max_pct': 0.10390607867211361, 'sideways_tp_mult': 2.938707827306886, 'sideways_tsl_mult': 0.42752328144634544, 'sideways_time_stop': 119, 'sideways_use_sma': False, 'sideways_use_ema': True, 'sideways_use_atr': True, 'sideways_use_adx': True, 'sideways_use_spike': False, 'sideways_rsi_required': False}.
[I 2025-08-30 17:41:51,637] Trial 860 finished with values: [-1000000000.0, 1000000000.0] and parameters: {'p_sma': 6, 'p_std': 22, 'p_atr': 15, 'p_adx': 10, 'rsi_period': 23, 'ema1': 19, 'ema2': 13, 'slip_atr_k': 0.02035706463887515, 'slip_spread_k': 0.21161265894958373, 'spread_hl_frac': 0.02457932932254485, 'bb_std_mult': 3.3564014816021297, 'rsi_os': 30, 'rsi_ob': 87, 'vol_spike': 0.09503291160374756, 'adx_thresh': 10.073857237543761, 'atr_min_pct': 0.01943840419469646, 'atr_max_pct': 0.018167285720756494, 'tp_mult': 1.4930738392869543, 'tsl_mult': 0.9215003518152254, 'strategy': 'mean_reversion', 'time_stop': 29, 'use_sma': True, 'use_atr': True, 'use_adx': True, 'use_ema': False, 'use_spike': True, 'rsi_required': True, 'edge_k': 1.23935812479588, 'edge_cap': 0.8580078660382856, 'bull_strategy': 'breakout', 'bull_bb_std_mult': 1.9684258128076482, 'bull_rsi_os': 50, 'bull_rsi_ob': 94, 'bull_adx_thresh': 34.44303932905188, 'bull_atr_min_pct': 0.022816702808644184, 'bull_atr_max_pct': 0.14801686058940217, 'bull_tp_mult': 2.1714845577465023, 'bull_tsl_mult': 0.8042972920413115, 'bull_time_stop': 161, 'bull_use_sma': True, 'bull_use_ema': True, 'bull_use_atr': False, 'bull_use_adx': True, 'bull_use_spike': True, 'bull_rsi_required': True, 'bear_strategy': 'mean_reversion', 'bear_bb_std_mult': 2.541997204285102, 'bear_rsi_os': 47, 'bear_rsi_ob': 78, 'bear_adx_thresh': 7.370691508059869, 'bear_atr_min_pct': 0.015432477794460827, 'bear_atr_max_pct': 0.11263864497193954, 'bear_tp_mult': 1.2347965963089833, 'bear_tsl_mult': 0.7013999873669128, 'bear_time_stop': 72, 'bear_use_sma': False, 'bear_use_ema': True, 'bear_use_atr': True, 'bear_use_adx': False, 'bear_use_spike': False, 'bear_rsi_required': False, 'sideways_strategy': 'breakout', 'sideways_bb_std_mult': 0.6164302621718021, 'sideways_rsi_os': 14, 'sideways_rsi_ob': 92, 'sideways_adx_thresh': 12.245335412693723, 'sideways_atr_min_pct': 0.0030017140746066403, 'sideways_atr_max_pct': 0.12772453793982902, 'sideways_tp_mult': 2.938028378392848, 'sideways_tsl_mult': 0.42895985913683715, 'sideways_time_stop': 279, 'sideways_use_sma': True, 'sideways_use_ema': True, 'sideways_use_atr': True, 'sideways_use_adx': True, 'sideways_use_spike': True, 'sideways_rsi_required': False}.
[I 2025-08-30 17:41:51,835] Trial 858 finished with values: [-1000000000.0, 1000000000.0] and parameters: {'p_sma': 7, 'p_std': 22, 'p_atr': 15, 'p_adx': 10, 'rsi_period': 20, 'ema1': 19, 'ema2': 49, 'slip_atr_k': 0.010191506052274583, 'slip_spread_k': 0.7430927225053497, 'spread_hl_frac': 0.019540444613285052, 'bb_std_mult': 2.062399074447196, 'rsi_os': 30, 'rsi_ob': 58, 'vol_spike': 0.0983604757866478, 'adx_thresh': 10.023358546417313, 'atr_min_pct': 0.02775809886807662, 'atr_max_pct': 0.01901238307858282, 'tp_mult': 2.9665277961749803, 'tsl_mult': 0.6941906460503167, 'strategy': 'breakout', 'time_stop': 226, 'use_sma': True, 'use_atr': True, 'use_adx': True, 'use_ema': False, 'use_spike': True, 'rsi_required': True, 'edge_k': 0.5339712414650255, 'edge_cap': 0.8688630483426789, 'bull_strategy': 'breakout', 'bull_bb_std_mult': 1.985103446872312, 'bull_rsi_os': 10, 'bull_rsi_ob': 94, 'bull_adx_thresh': 33.45952334919714, 'bull_atr_min_pct': 0.0154790692891701, 'bull_atr_max_pct': 0.14336906121464452, 'bull_tp_mult': 2.3027285156140924, 'bull_tsl_mult': 0.7232589274775524, 'bull_time_stop': 254, 'bull_use_sma': True, 'bull_use_ema': True, 'bull_use_atr': False, 'bull_use_adx': True, 'bull_use_spike': True, 'bull_rsi_required': True, 'bear_strategy': 'mean_reversion', 'bear_bb_std_mult': 1.5422820944936195, 'bear_rsi_os': 47, 'bear_rsi_ob': 79, 'bear_adx_thresh': 28.856953968061745, 'bear_atr_min_pct': 0.01939850812934536, 'bear_atr_max_pct': 0.11071611373984963, 'bear_tp_mult': 2.1220209073283622, 'bear_tsl_mult': 0.651157294341125, 'bear_time_stop': 72, 'bear_use_sma': False, 'bear_use_ema': True, 'bear_use_atr': True, 'bear_use_adx': False, 'bear_use_spike': False, 'bear_rsi_required': False, 'sideways_strategy': 'breakout', 'sideways_bb_std_mult': 1.218375225755953, 'sideways_rsi_os': 37, 'sideways_rsi_ob': 50, 'sideways_adx_thresh': 12.134003886909477, 'sideways_atr_min_pct': 0.029451180869884894, 'sideways_atr_max_pct': 0.10399367497096054, 'sideways_tp_mult': 2.721629758227614, 'sideways_tsl_mult': 0.3921671916658224, 'sideways_time_stop': 293, 'sideways_use_sma': False, 'sideways_use_ema': True, 'sideways_use_atr': True, 'sideways_use_adx': True, 'sideways_use_spike': False, 'sideways_rsi_required': False}.
[I 2025-08-30 17:42:11,346] Trial 857 finished with values: [-1000000000.0, 1000000000.0] and parameters: {'p_sma': 44, 'p_std': 26, 'p_atr': 15, 'p_adx': 10, 'rsi_period': 20, 'ema1': 19, 'ema2': 27, 'slip_atr_k': 0.10764082069712455, 'slip_spread_k': 0.7344105515381909, 'spread_hl_frac': 0.019768579025070787, 'bb_std_mult': 3.3528740090572193, 'rsi_os': 33, 'rsi_ob': 83, 'vol_spike': 0.10020567124459559, 'adx_thresh': 9.66956318511677, 'atr_min_pct': 0.019465002588906953, 'atr_max_pct': 0.14625246702297418, 'tp_mult': 2.8123303530998656, 'tsl_mult': 0.8545500067282441, 'strategy': 'breakout', 'time_stop': 261, 'use_sma': True, 'use_atr': False, 'use_adx': True, 'use_ema': False, 'use_spike': True, 'rsi_required': False, 'edge_k': 0.8045779500661778, 'edge_cap': 0.8399171210402833, 'bull_strategy': 'breakout', 'bull_bb_std_mult': 1.9793359201088383, 'bull_rsi_os': 10, 'bull_rsi_ob': 81, 'bull_adx_thresh': 33.457742158173446, 'bull_atr_min_pct': 0.022768617323705276, 'bull_atr_max_pct': 0.05675492164588264, 'bull_tp_mult': 2.2962577656315974, 'bull_tsl_mult': 0.7232007801111183, 'bull_time_stop': 252, 'bull_use_sma': True, 'bull_use_ema': True, 'bull_use_atr': False, 'bull_use_adx': False, 'bull_use_spike': False, 'bull_rsi_required': True, 'bear_strategy': 'mean_reversion', 'bear_bb_std_mult': 1.5273907275719651, 'bear_rsi_os': 23, 'bear_rsi_ob': 78, 'bear_adx_thresh': 34.346544998859784, 'bear_atr_min_pct': 0.01861929148915089, 'bear_atr_max_pct': 0.14130149771136002, 'bear_tp_mult': 1.251027596810275, 'bear_tsl_mult': 0.6288799564206007, 'bear_time_stop': 258, 'bear_use_sma': False, 'bear_use_ema': True, 'bear_use_atr': True, 'bear_use_adx': True, 'bear_use_spike': True, 'bear_rsi_required': True, 'sideways_strategy': 'breakout', 'sideways_bb_std_mult': 0.9062484868301534, 'sideways_rsi_os': 29, 'sideways_rsi_ob': 91, 'sideways_adx_thresh': 12.187363933997833, 'sideways_atr_min_pct': 0.024909494090836728, 'sideways_atr_max_pct': 0.1273593368922729, 'sideways_tp_mult': 2.8948245018027623, 'sideways_tsl_mult': 0.45361138335811374, 'sideways_time_stop': 294, 'sideways_use_sma': False, 'sideways_use_ema': True, 'sideways_use_atr': True, 'sideways_use_adx': False, 'sideways_use_spike': False, 'sideways_rsi_required': False}.
[I 2025-08-30 17:42:25,220] Trial 864 finished with values: [-1000000000.0, 1000000000.0] and parameters: {'p_sma': 36, 'p_std': 19, 'p_atr': 18, 'p_adx': 20, 'rsi_period': 9, 'ema1': 21, 'ema2': 56, 'slip_atr_k': 0.00014437130745258674, 'slip_spread_k': 0.11408706306961594, 'spread_hl_frac': 0.004662868026767832, 'bb_std_mult': 2.8821431379232507, 'rsi_os': 55, 'rsi_ob': 85, 'vol_spike': 0.12628289088494649, 'adx_thresh': 17.751577889583483, 'atr_min_pct': 0.015506886182883779, 'atr_max_pct': 0.05727307595921034, 'tp_mult': 1.6801037723179686, 'tsl_mult': 0.9201673780221648, 'strategy': 'mean_reversion', 'time_stop': 140, 'use_sma': False, 'use_atr': True, 'use_adx': False, 'use_ema': True, 'use_spike': False, 'rsi_required': True, 'edge_k': 0.35927911179220623, 'edge_cap': 0.5045980880258203, 'bull_strategy': 'mean_reversion', 'bull_bb_std_mult': 1.877785571980885, 'bull_rsi_os': 14, 'bull_rsi_ob': 88, 'bull_adx_thresh': 34.49514006187645, 'bull_atr_min_pct': 0.020728819096999716, 'bull_atr_max_pct': 0.13544882143496015, 'bull_tp_mult': 2.2102947760399663, 'bull_tsl_mult': 0.8627188352355533, 'bull_time_stop': 69, 'bull_use_sma': True, 'bull_use_ema': False, 'bull_use_atr': False, 'bull_use_adx': True, 'bull_use_spike': False, 'bull_rsi_required': False, 'bear_strategy': 'breakout', 'bear_bb_std_mult': 2.419723698279296, 'bear_rsi_os': 39, 'bear_rsi_ob': 75, 'bear_adx_thresh': 5.122190032477802, 'bear_atr_min_pct': 0.017500828405653163, 'bear_atr_max_pct': 0.1287500044308786, 'bear_tp_mult': 2.256005384052396, 'bear_tsl_mult': 0.6206268739138864, 'bear_time_stop': 197, 'bear_use_sma': True, 'bear_use_ema': False, 'bear_use_atr': False, 'bear_use_adx': False, 'bear_use_spike': False, 'bear_rsi_required': False, 'sideways_strategy': 'breakout', 'sideways_bb_std_mult': 0.6619100125069566, 'sideways_rsi_os': 31, 'sideways_rsi_ob': 48, 'sideways_adx_thresh': 10.883563273277321, 'sideways_atr_min_pct': 0.0042959229761252, 'sideways_atr_max_pct': 0.10189516523141827, 'sideways_tp_mult': 1.1976280742393552, 'sideways_tsl_mult': 0.28421378451505147, 'sideways_time_stop': 279, 'sideways_use_sma': True, 'sideways_use_ema': False, 'sideways_use_atr': False, 'sideways_use_adx': False, 'sideways_use_spike': True, 'sideways_rsi_required': True}.
[I 2025-08-30 17:42:26,314] Trial 862 finished with values: [-0.06725861824228851, 0.06720809773708371] and parameters: {'p_sma': 38, 'p_std': 24, 'p_atr': 21, 'p_adx': 7, 'rsi_period': 19, 'ema1': 7, 'ema2': 28, 'slip_atr_k': 0.0001286510063712252, 'slip_spread_k': 0.1348113984250735, 'spread_hl_frac': 0.023128684533051867, 'bb_std_mult': 2.727478399094111, 'rsi_os': 33, 'rsi_ob': 79, 'vol_spike': 0.21841843754146428, 'adx_thresh': 20.495116281774624, 'atr_min_pct': 0.021057942681281423, 'atr_max_pct': 0.058335433089543844, 'tp_mult': 2.7979433292765354, 'tsl_mult': 0.33249538520114613, 'strategy': 'mean_reversion', 'time_stop': 191, 'use_sma': False, 'use_atr': True, 'use_adx': True, 'use_ema': True, 'use_spike': False, 'rsi_required': True, 'edge_k': 0.7920223763273191, 'edge_cap': 0.8753179365542074, 'bull_strategy': 'mean_reversion', 'bull_bb_std_mult': 1.8600415450848005, 'bull_rsi_os': 10, 'bull_rsi_ob': 54, 'bull_adx_thresh': 34.98549461911552, 'bull_atr_min_pct': 0.020749557296850546, 'bull_atr_max_pct': 0.05741146856809555, 'bull_tp_mult': 1.8968769532546719, 'bull_tsl_mult': 0.8471343318932515, 'bull_time_stop': 256, 'bull_use_sma': True, 'bull_use_ema': False, 'bull_use_atr': False, 'bull_use_adx': True, 'bull_use_spike': False, 'bull_rsi_required': False, 'bear_strategy': 'breakout', 'bear_bb_std_mult': 2.79953323245318, 'bear_rsi_os': 6, 'bear_rsi_ob': 48, 'bear_adx_thresh': 12.217932407704083, 'bear_atr_min_pct': 0.020070631315824563, 'bear_atr_max_pct': 0.012399612210031385, 'bear_tp_mult': 2.249608412098936, 'bear_tsl_mult': 0.6154161073622089, 'bear_time_stop': 118, 'bear_use_sma': True, 'bear_use_ema': False, 'bear_use_atr': False, 'bear_use_adx': False, 'bear_use_spike': False, 'bear_rsi_required': False, 'sideways_strategy': 'breakout', 'sideways_bb_std_mult': 0.7635654563697744, 'sideways_rsi_os': 31, 'sideways_rsi_ob': 94, 'sideways_adx_thresh': 11.137702882678427, 'sideways_atr_min_pct': 0.0010757175327686212, 'sideways_atr_max_pct': 0.017427062833709678, 'sideways_tp_mult': 2.970270052714868, 'sideways_tsl_mult': 0.28320422765106057, 'sideways_time_stop': 274, 'sideways_use_sma': True, 'sideways_use_ema': False, 'sideways_use_atr': False, 'sideways_use_adx': False, 'sideways_use_spike': False, 'sideways_rsi_required': True}.
[I 2025-08-30 17:42:26,721] Trial 861 finished with values: [-0.04206998509461979, 0.041975436108663916] and parameters: {'p_sma': 6, 'p_std': 21, 'p_atr': 29, 'p_adx': 12, 'rsi_period': 19, 'ema1': 19, 'ema2': 10, 'slip_atr_k': 0.0002908143368631124, 'slip_spread_k': 0.1346724974694024, 'spread_hl_frac': 0.0077849880109728785, 'bb_std_mult': 2.2665872487427117, 'rsi_os': 6, 'rsi_ob': 76, 'vol_spike': 0.10107072958353047, 'adx_thresh': 17.91413350550262, 'atr_min_pct': 0.013912946418834681, 'atr_max_pct': 0.057261726251348094, 'tp_mult': 2.572537576763583, 'tsl_mult': 0.9972526862825257, 'strategy': 'mean_reversion', 'time_stop': 70, 'use_sma': False, 'use_atr': True, 'use_adx': True, 'use_ema': True, 'use_spike': False, 'rsi_required': True, 'edge_k': 0.8041580887962049, 'edge_cap': 0.8650079346347626, 'bull_strategy': 'mean_reversion', 'bull_bb_std_mult': 1.9742466022649452, 'bull_rsi_os': 10, 'bull_rsi_ob': 55, 'bull_adx_thresh': 34.96283779704722, 'bull_atr_min_pct': 0.022738569028350225, 'bull_atr_max_pct': 0.14821438002853407, 'bull_tp_mult': 2.1790245796515624, 'bull_tsl_mult': 0.7144935578614923, 'bull_time_stop': 161, 'bull_use_sma': True, 'bull_use_ema': False, 'bull_use_atr': False, 'bull_use_adx': True, 'bull_use_spike': False, 'bull_rsi_required': True, 'bear_strategy': 'breakout', 'bear_bb_std_mult': 1.5664006662960928, 'bear_rsi_os': 6, 'bear_rsi_ob': 75, 'bear_adx_thresh': 6.43530098843458, 'bear_atr_min_pct': 0.020096393886789302, 'bear_atr_max_pct': 0.11248537535330445, 'bear_tp_mult': 2.9439462444213023, 'bear_tsl_mult': 0.7002098217221371, 'bear_time_stop': 118, 'bear_use_sma': False, 'bear_use_ema': True, 'bear_use_atr': False, 'bear_use_adx': False, 'bear_use_spike': False, 'bear_rsi_required': False, 'sideways_strategy': 'breakout', 'sideways_bb_std_mult': 1.0575681840265663, 'sideways_rsi_os': 31, 'sideways_rsi_ob': 92, 'sideways_adx_thresh': 29.372457758850594, 'sideways_atr_min_pct': 2.9433767816853217e-05, 'sideways_atr_max_pct': 0.1029097789008547, 'sideways_tp_mult': 2.85974948772843, 'sideways_tsl_mult': 0.47458902266062847, 'sideways_time_stop': 278, 'sideways_use_sma': True, 'sideways_use_ema': False, 'sideways_use_atr': True, 'sideways_use_adx': True, 'sideways_use_spike': True, 'sideways_rsi_required': False}.
