[I 2025-08-30 15:21:28,436] Trial 63 finished with values: [-1000000000.0, 1000000000.0] and parameters: {'p_sma': 20, 'p_std': 12, 'p_atr': 7, 'p_adx': 9, 'rsi_period': 23, 'ema1': 16, 'ema2': 19, 'slip_atr_k': 0.09440457302936733, 'slip_spread_k': 0.5504325417297145, 'spread_hl_frac': 0.011264827412003332, 'bb_std_mult': 1.8752514218268799, 'rsi_os': 46, 'rsi_ob': 69, 'vol_spike': 0.10704317597324761, 'adx_thresh': 32.7928763325358, 'atr_min_pct': 0.017467459300691858, 'atr_max_pct': 0.09237022848841552, 'tp_mult': 2.7216524901180548, 'tsl_mult': 0.326035866997173, 'strategy': 'mean_reversion', 'time_stop': 121, 'use_sma': True, 'use_atr': False, 'use_adx': True, 'use_ema': False, 'use_spike': False, 'rsi_required': True, 'edge_k': 1.785611338738165, 'edge_cap': 0.18543536953498707, 'bull_strategy': 'breakout', 'bull_bb_std_mult': 2.809603045896783, 'bull_rsi_os': 28, 'bull_rsi_ob': 76, 'bull_adx_thresh': 5.088801041731509, 'bull_atr_min_pct': 0.01099055056758783, 'bull_atr_max_pct': 0.027317975647239076, 'bull_tp_mult': 1.1625425097255613, 'bull_tsl_mult': 0.4921894827634469, 'bull_time_stop': 257, 'bull_use_sma': False, 'bull_use_ema': True, 'bull_use_atr': True, 'bull_use_adx': True, 'bull_use_spike': False, 'bull_rsi_required': False, 'bear_strategy': 'mean_reversion', 'bear_bb_std_mult': 1.3524701783922664, 'bear_rsi_os': 9, 'bear_rsi_ob': 58, 'bear_adx_thresh': 24.41967890779283, 'bear_atr_min_pct': 0.015534878169218664, 'bear_atr_max_pct': 0.12070295131095715, 'bear_tp_mult': 1.3778001714228132, 'bear_tsl_mult': 0.8590241012343678, 'bear_time_stop': 122, 'bear_use_sma': True, 'bear_use_ema': True, 'bear_use_atr': True, 'bear_use_adx': False, 'bear_use_spike': False, 'bear_rsi_required': False, 'sideways_strategy': 'breakout', 'sideways_bb_std_mult': 1.3846537872118452, 'sideways_rsi_os': 52, 'sideways_rsi_ob': 62, 'sideways_adx_thresh': 31.633570721705816, 'sideways_atr_min_pct': 0.01622561694726499, 'sideways_atr_max_pct': 0.02205437580754664, 'sideways_tp_mult': 2.568359433197612, 'sideways_tsl_mult': 0.8889191530761489, 'sideways_time_stop': 110, 'sideways_use_sma': False, 'sideways_use_ema': True, 'sideways_use_atr': False, 'sideways_use_adx': False, 'sideways_use_spike': False, 'sideways_rsi_required': False}.
[I 2025-08-30 15:22:00,070] Trial 64 finished with values: [-1000000000.0, 1000000000.0] and parameters: {'p_sma': 22, 'p_std': 7, 'p_atr': 15, 'p_adx': 9, 'rsi_period': 11, 'ema1': 16, 'ema2': 53, 'slip_atr_k': 0.23384745116230904, 'slip_spread_k': 0.6402907444625023, 'spread_hl_frac': 0.00458672924759488, 'bb_std_mult': 1.8323511756909718, 'rsi_os': 46, 'rsi_ob': 74, 'vol_spike': 0.10523620737271178, 'adx_thresh': 33.022304603364766, 'atr_min_pct': 0.027037223753373012, 'atr_max_pct': 0.0385333057642888, 'tp_mult': 1.2100574126720658, 'tsl_mult': 0.3342440061151747, 'strategy': 'mean_reversion', 'time_stop': 183, 'use_sma': True, 'use_atr': True, 'use_adx': True, 'use_ema': False, 'use_spike': False, 'rsi_required': True, 'edge_k': 0.756323581784899, 'edge_cap': 0.10450337036233931, 'bull_strategy': 'breakout', 'bull_bb_std_mult': 2.843786874649012, 'bull_rsi_os': 34, 'bull_rsi_ob': 48, 'bull_adx_thresh': 21.187522996203313, 'bull_atr_min_pct': 0.028120122928095938, 'bull_atr_max_pct': 0.015451553513039097, 'bull_tp_mult': 1.1760507582684807, 'bull_tsl_mult': 0.8441669042656015, 'bull_time_stop': 254, 'bull_use_sma': False, 'bull_use_ema': False, 'bull_use_atr': True, 'bull_use_adx': True, 'bull_use_spike': False, 'bull_rsi_required': False, 'bear_strategy': 'mean_reversion', 'bear_bb_std_mult': 1.3685505071095452, 'bear_rsi_os': 7, 'bear_rsi_ob': 71, 'bear_adx_thresh': 33.36874016014517, 'bear_atr_min_pct': 0.01949740997161605, 'bear_atr_max_pct': 0.12084315938313747, 'bear_tp_mult': 1.3995258320895336, 'bear_tsl_mult': 0.9594061251720587, 'bear_time_stop': 123, 'bear_use_sma': True, 'bear_use_ema': True, 'bear_use_atr': True, 'bear_use_adx': False, 'bear_use_spike': False, 'bear_rsi_required': False, 'sideways_strategy': 'breakout', 'sideways_bb_std_mult': 2.122465068382672, 'sideways_rsi_os': 55, 'sideways_rsi_ob': 61, 'sideways_adx_thresh': 18.975528210655625, 'sideways_atr_min_pct': 0.013445373272864701, 'sideways_atr_max_pct': 0.06876122356595224, 'sideways_tp_mult': 1.4820076843832448, 'sideways_tsl_mult': 0.04196683107197435, 'sideways_time_stop': 112, 'sideways_use_sma': False, 'sideways_use_ema': True, 'sideways_use_atr': False, 'sideways_use_adx': False, 'sideways_use_spike': False, 'sideways_rsi_required': False}.
[I 2025-08-30 15:22:16,177] Trial 65 finished with values: [-1000000000.0, 1000000000.0] and parameters: {'p_sma': 27, 'p_std': 7, 'p_atr': 15, 'p_adx': 9, 'rsi_period': 11, 'ema1': 26, 'ema2': 53, 'slip_atr_k': 0.23836810804416383, 'slip_spread_k': 0.3539787521537203, 'spread_hl_frac': 0.031115984177325882, 'bb_std_mult': 1.0391322345628333, 'rsi_os': 46, 'rsi_ob': 74, 'vol_spike': 0.10716249487621339, 'adx_thresh': 16.076199934364702, 'atr_min_pct': 0.015133970696274547, 'atr_max_pct': 0.036429715921018346, 'tp_mult': 1.2910379442696165, 'tsl_mult': 0.7387359703796015, 'strategy': 'mean_reversion', 'time_stop': 240, 'use_sma': True, 'use_atr': True, 'use_adx': True, 'use_ema': False, 'use_spike': False, 'rsi_required': True, 'edge_k': 0.7914843323138347, 'edge_cap': 0.5477119001781092, 'bull_strategy': 'breakout', 'bull_bb_std_mult': 3.409732106819101, 'bull_rsi_os': 35, 'bull_rsi_ob': 74, 'bull_adx_thresh': 28.746279115335653, 'bull_atr_min_pct': 0.015508598012063375, 'bull_atr_max_pct': 0.14952610826394822, 'bull_tp_mult': 2.713194089981574, 'bull_tsl_mult': 0.45931377115016975, 'bull_time_stop': 257, 'bull_use_sma': False, 'bull_use_ema': False, 'bull_use_atr': True, 'bull_use_adx': True, 'bull_use_spike': False, 'bull_rsi_required': False, 'bear_strategy': 'mean_reversion', 'bear_bb_std_mult': 1.3932195833756438, 'bear_rsi_os': 8, 'bear_rsi_ob': 84, 'bear_adx_thresh': 33.416633353902185, 'bear_atr_min_pct': 0.01546498347909684, 'bear_atr_max_pct': 0.12081552588368032, 'bear_tp_mult': 1.4007982808728827, 'bear_tsl_mult': 0.8035170021256159, 'bear_time_stop': 267, 'bear_use_sma': True, 'bear_use_ema': True, 'bear_use_atr': True, 'bear_use_adx': False, 'bear_use_spike': False, 'bear_rsi_required': False, 'sideways_strategy': 'breakout', 'sideways_bb_std_mult': 2.137302835089304, 'sideways_rsi_os': 55, 'sideways_rsi_ob': 63, 'sideways_adx_thresh': 16.86190525277553, 'sideways_atr_min_pct': 0.015873642125496145, 'sideways_atr_max_pct': 0.08436774537935744, 'sideways_tp_mult': 2.559524051624357, 'sideways_tsl_mult': 0.8997493649892256, 'sideways_time_stop': 186, 'sideways_use_sma': False, 'sideways_use_ema': True, 'sideways_use_atr': False, 'sideways_use_adx': False, 'sideways_use_spike': False, 'sideways_rsi_required': False}.
[I 2025-08-30 15:22:16,416] Trial 67 finished with values: [-1000000000.0, 1000000000.0] and parameters: {'p_sma': 28, 'p_std': 7, 'p_atr': 29, 'p_adx': 11, 'rsi_period': 10, 'ema1': 26, 'ema2': 53, 'slip_atr_k': 0.23601124195948867, 'slip_spread_k': 0.6494384328215586, 'spread_hl_frac': 0.025505671836733607, 'bb_std_mult': 1.5619972991318476, 'rsi_os': 31, 'rsi_ob': 83, 'vol_spike': 0.08174575436766134, 'adx_thresh': 34.2300954905922, 'atr_min_pct': 0.008364986454714635, 'atr_max_pct': 0.030427920715008397, 'tp_mult': 2.579617081684556, 'tsl_mult': 0.13056387651466705, 'strategy': 'mean_reversion', 'time_stop': 242, 'use_sma': True, 'use_atr': True, 'use_adx': True, 'use_ema': False, 'use_spike': False, 'rsi_required': False, 'edge_k': 0.08351855541949788, 'edge_cap': 0.585499161193209, 'bull_strategy': 'breakout', 'bull_bb_std_mult': 0.7848222279304706, 'bull_rsi_os': 22, 'bull_rsi_ob': 73, 'bull_adx_thresh': 21.55697536224426, 'bull_atr_min_pct': 0.028237308320686876, 'bull_atr_max_pct': 0.014599010270888106, 'bull_tp_mult': 2.72703510259048, 'bull_tsl_mult': 0.8454852811626667, 'bull_time_stop': 28, 'bull_use_sma': False, 'bull_use_ema': False, 'bull_use_atr': True, 'bull_use_adx': True, 'bull_use_spike': False, 'bull_rsi_required': False, 'bear_strategy': 'mean_reversion', 'bear_bb_std_mult': 1.1198611651942223, 'bear_rsi_os': 34, 'bear_rsi_ob': 83, 'bear_adx_thresh': 33.697832211293, 'bear_atr_min_pct': 0.013914796661621202, 'bear_atr_max_pct': 0.12390146519389479, 'bear_tp_mult': 1.663775323282041, 'bear_tsl_mult': 0.9586541858221435, 'bear_time_stop': 264, 'bear_use_sma': True, 'bear_use_ema': True, 'bear_use_atr': True, 'bear_use_adx': False, 'bear_use_spike': False, 'bear_rsi_required': False, 'sideways_strategy': 'breakout', 'sideways_bb_std_mult': 2.074197219777707, 'sideways_rsi_os': 50, 'sideways_rsi_ob': 76, 'sideways_adx_thresh': 16.839420306050975, 'sideways_atr_min_pct': 0.013205479027248791, 'sideways_atr_max_pct': 0.08392013593741282, 'sideways_tp_mult': 1.954253324424848, 'sideways_tsl_mult': 0.04154891048031721, 'sideways_time_stop': 176, 'sideways_use_sma': False, 'sideways_use_ema': False, 'sideways_use_atr': False, 'sideways_use_adx': False, 'sideways_use_spike': False, 'sideways_rsi_required': True}.
[I 2025-08-30 15:22:16,947] Trial 66 finished with values: [-1000000000.0, 1000000000.0] and parameters: {'p_sma': 27, 'p_std': 7, 'p_atr': 9, 'p_adx': 11, 'rsi_period': 11, 'ema1': 16, 'ema2': 44, 'slip_atr_k': 0.23453881065311094, 'slip_spread_k': 0.5493803535873614, 'spread_hl_frac': 0.030610500616168775, 'bb_std_mult': 1.0636321469150922, 'rsi_os': 39, 'rsi_ob': 78, 'vol_spike': 0.10948460174017947, 'adx_thresh': 33.957260838965404, 'atr_min_pct': 0.008175033840627042, 'atr_max_pct': 0.03747593506602983, 'tp_mult': 1.2321177852140013, 'tsl_mult': 0.7281151344794223, 'strategy': 'mean_reversion', 'time_stop': 284, 'use_sma': True, 'use_atr': True, 'use_adx': True, 'use_ema': False, 'use_spike': False, 'rsi_required': False, 'edge_k': 1.1664755196171759, 'edge_cap': 0.5916083025577485, 'bull_strategy': 'breakout', 'bull_bb_std_mult': 0.7704005723211225, 'bull_rsi_os': 34, 'bull_rsi_ob': 45, 'bull_adx_thresh': 21.0965811026349, 'bull_atr_min_pct': 0.004716645334769096, 'bull_atr_max_pct': 0.014976122511548284, 'bull_tp_mult': 1.2780683794671184, 'bull_tsl_mult': 0.8261757724600911, 'bull_time_stop': 204, 'bull_use_sma': False, 'bull_use_ema': False, 'bull_use_atr': True, 'bull_use_adx': True, 'bull_use_spike': False, 'bull_rsi_required': False, 'bear_strategy': 'mean_reversion', 'bear_bb_std_mult': 1.8403168497420284, 'bear_rsi_os': 9, 'bear_rsi_ob': 83, 'bear_adx_thresh': 33.48994093449701, 'bear_atr_min_pct': 0.01591054834383585, 'bear_atr_max_pct': 0.12368831201296777, 'bear_tp_mult': 1.3737517080645811, 'bear_tsl_mult': 0.9625193996945273, 'bear_time_stop': 272, 'bear_use_sma': True, 'bear_use_ema': True, 'bear_use_atr': True, 'bear_use_adx': False, 'bear_use_spike': False, 'bear_rsi_required': False, 'sideways_strategy': 'breakout', 'sideways_bb_std_mult': 2.151074709003077, 'sideways_rsi_os': 51, 'sideways_rsi_ob': 62, 'sideways_adx_thresh': 16.166975772449682, 'sideways_atr_min_pct': 0.01643713320129501, 'sideways_atr_max_pct': 0.08553487544471028, 'sideways_tp_mult': 1.1152338093267493, 'sideways_tsl_mult': 0.8828922780689503, 'sideways_time_stop': 188, 'sideways_use_sma': False, 'sideways_use_ema': False, 'sideways_use_atr': False, 'sideways_use_adx': False, 'sideways_use_spike': False, 'sideways_rsi_required': False}.
[I 2025-08-30 15:22:44,470] Trial 68 finished with values: [-1000000000.0, 1000000000.0] and parameters: {'p_sma': 27, 'p_std': 47, 'p_atr': 29, 'p_adx': 7, 'rsi_period': 41, 'ema1': 25, 'ema2': 44, 'slip_atr_k': 0.18913321343821646, 'slip_spread_k': 0.4523106531780569, 'spread_hl_frac': 0.025489116693902518, 'bb_std_mult': 1.11511112468637, 'rsi_os': 38, 'rsi_ob': 83, 'vol_spike': 0.07482410394538756, 'adx_thresh': 30.312694505491585, 'atr_min_pct': 0.010519840761894153, 'atr_max_pct': 0.13642029096326164, 'tp_mult': 2.458178451440397, 'tsl_mult': 0.7202078004752406, 'strategy': 'breakout', 'time_stop': 287, 'use_sma': False, 'use_atr': True, 'use_adx': True, 'use_ema': False, 'use_spike': True, 'rsi_required': False, 'edge_k': 0.7715182488087176, 'edge_cap': 0.5498768303601927, 'bull_strategy': 'breakout', 'bull_bb_std_mult': 3.3614560841563867, 'bull_rsi_os': 37, 'bull_rsi_ob': 73, 'bull_adx_thresh': 15.14097479313273, 'bull_atr_min_pct': 0.015266826590697814, 'bull_atr_max_pct': 0.03726237977455821, 'bull_tp_mult': 2.7102940566002434, 'bull_tsl_mult': 0.6544207837542182, 'bull_time_stop': 37, 'bull_use_sma': False, 'bull_use_ema': False, 'bull_use_atr': True, 'bull_use_adx': True, 'bull_use_spike': False, 'bull_rsi_required': False, 'bear_strategy': 'mean_reversion', 'bear_bb_std_mult': 1.8398715930513694, 'bear_rsi_os': 34, 'bear_rsi_ob': 83, 'bear_adx_thresh': 30.287692359799546, 'bear_atr_min_pct': 0.015666916671021783, 'bear_atr_max_pct': 0.14228222103745808, 'bear_tp_mult': 2.652565064530485, 'bear_tsl_mult': 0.1051773165255841, 'bear_time_stop': 169, 'bear_use_sma': True, 'bear_use_ema': True, 'bear_use_atr': True, 'bear_use_adx': False, 'bear_use_spike': False, 'bear_rsi_required': False, 'sideways_strategy': 'breakout', 'sideways_bb_std_mult': 2.3543028964219372, 'sideways_rsi_os': 50, 'sideways_rsi_ob': 71, 'sideways_adx_thresh': 16.223631629157364, 'sideways_atr_min_pct': 0.018322712018081697, 'sideways_atr_max_pct': 0.08456114685129, 'sideways_tp_mult': 1.1064085626548035, 'sideways_tsl_mult': 0.18123680357414096, 'sideways_time_stop': 179, 'sideways_use_sma': False, 'sideways_use_ema': False, 'sideways_use_atr': False, 'sideways_use_adx': False, 'sideways_use_spike': False, 'sideways_rsi_required': True}.
[I 2025-08-30 15:23:04,487] Trial 70 finished with values: [-1000000000.0, 1000000000.0] and parameters: {'p_sma': 16, 'p_std': 11, 'p_atr': 30, 'p_adx': 22, 'rsi_period': 29, 'ema1': 21, 'ema2': 49, 'slip_atr_k': 0.18873830037910183, 'slip_spread_k': 0.41520852268030833, 'spread_hl_frac': 0.037400408496127455, 'bb_std_mult': 1.3435084673553561, 'rsi_os': 55, 'rsi_ob': 87, 'vol_spike': 0.24720093631501477, 'adx_thresh': 9.025343414847814, 'atr_min_pct': 0.010465056492637265, 'atr_max_pct': 0.13608422085423522, 'tp_mult': 1.1408355995724826, 'tsl_mult': 0.7080626519567139, 'strategy': 'breakout', 'time_stop': 219, 'use_sma': False, 'use_atr': False, 'use_adx': False, 'use_ema': True, 'use_spike': True, 'rsi_required': False, 'edge_k': 0.9483342211968696, 'edge_cap': 0.8791328060634686, 'bull_strategy': 'mean_reversion', 'bull_bb_std_mult': 3.042488440970436, 'bull_rsi_os': 49, 'bull_rsi_ob': 91, 'bull_adx_thresh': 15.883706398786675, 'bull_atr_min_pct': 0.00449608734834497, 'bull_atr_max_pct': 0.03694868056673313, 'bull_tp_mult': 2.9188896602613457, 'bull_tsl_mult': 0.380349215117488, 'bull_time_stop': 177, 'bull_use_sma': False, 'bull_use_ema': True, 'bull_use_atr': False, 'bull_use_adx': True, 'bull_use_spike': True, 'bull_rsi_required': True, 'bear_strategy': 'breakout', 'bear_bb_std_mult': 1.8387204921271791, 'bear_rsi_os': 30, 'bear_rsi_ob': 89, 'bear_adx_thresh': 11.37592929449829, 'bear_atr_min_pct': 0.017327851057323037, 'bear_atr_max_pct': 0.1434786466042726, 'bear_tp_mult': 1.1253137402945383, 'bear_tsl_mult': 0.052880133506460814, 'bear_time_stop': 80, 'bear_use_sma': True, 'bear_use_ema': True, 'bear_use_atr': False, 'bear_use_adx': True, 'bear_use_spike': False, 'bear_rsi_required': False, 'sideways_strategy': 'mean_reversion', 'sideways_bb_std_mult': 2.3200934891725047, 'sideways_rsi_os': 48, 'sideways_rsi_ob': 81, 'sideways_adx_thresh': 6.695575576186432, 'sideways_atr_min_pct': 0.01849323438464928, 'sideways_atr_max_pct': 0.056501483424559594, 'sideways_tp_mult': 1.1328527879282997, 'sideways_tsl_mult': 0.8327489402146295, 'sideways_time_stop': 203, 'sideways_use_sma': True, 'sideways_use_ema': False, 'sideways_use_atr': False, 'sideways_use_adx': False, 'sideways_use_spike': True, 'sideways_rsi_required': False}.
[I 2025-08-30 15:23:04,923] Trial 71 finished with values: [-1000000000.0, 1000000000.0] and parameters: {'p_sma': 16, 'p_std': 11, 'p_atr': 30, 'p_adx': 8, 'rsi_period': 43, 'ema1': 27, 'ema2': 13, 'slip_atr_k': 0.18688733721578005, 'slip_spread_k': 0.1325218933313504, 'spread_hl_frac': 0.03789104804841835, 'bb_std_mult': 1.3320251517245658, 'rsi_os': 54, 'rsi_ob': 87, 'vol_spike': 0.1431444622338958, 'adx_thresh': 30.183878048532883, 'atr_min_pct': 0.010153023006501045, 'atr_max_pct': 0.13056831244690298, 'tp_mult': 2.4407519534423296, 'tsl_mult': 0.7013218840313596, 'strategy': 'breakout', 'time_stop': 219, 'use_sma': False, 'use_atr': False, 'use_adx': False, 'use_ema': True, 'use_spike': True, 'rsi_required': True, 'edge_k': 0.41112110009941205, 'edge_cap': 0.891553826462226, 'bull_strategy': 'mean_reversion', 'bull_bb_std_mult': 3.0413385333432927, 'bull_rsi_os': 48, 'bull_rsi_ob': 88, 'bull_adx_thresh': 15.571125615378588, 'bull_atr_min_pct': 0.022495071149492826, 'bull_atr_max_pct': 0.037042149177594574, 'bull_tp_mult': 2.93752493459346, 'bull_tsl_mult': 0.6488443146445484, 'bull_time_stop': 178, 'bull_use_sma': False, 'bull_use_ema': True, 'bull_use_atr': False, 'bull_use_adx': True, 'bull_use_spike': True, 'bull_rsi_required': True, 'bear_strategy': 'breakout', 'bear_bb_std_mult': 2.0884153940757044, 'bear_rsi_os': 30, 'bear_rsi_ob': 95, 'bear_adx_thresh': 30.22298526083089, 'bear_atr_min_pct': 0.017314574420828788, 'bear_atr_max_pct': 0.04981934864940528, 'bear_tp_mult': 2.5875697803605417, 'bear_tsl_mult': 0.17248979371889872, 'bear_time_stop': 230, 'bear_use_sma': False, 'bear_use_ema': False, 'bear_use_atr': False, 'bear_use_adx': True, 'bear_use_spike': True, 'bear_rsi_required': True, 'sideways_strategy': 'mean_reversion', 'sideways_bb_std_mult': 2.3249994440490807, 'sideways_rsi_os': 47, 'sideways_rsi_ob': 71, 'sideways_adx_thresh': 21.844519338695974, 'sideways_atr_min_pct': 0.01874828278569702, 'sideways_atr_max_pct': 0.05578849811743773, 'sideways_tp_mult': 1.0710607144224136, 'sideways_tsl_mult': 0.8134389550444729, 'sideways_time_stop': 207, 'sideways_use_sma': True, 'sideways_use_ema': True, 'sideways_use_atr': True, 'sideways_use_adx': False, 'sideways_use_spike': True, 'sideways_rsi_required': True}.
[I 2025-08-30 15:23:05,337] Trial 69 finished with values: [-1000000000.0, 1000000000.0] and parameters: {'p_sma': 24, 'p_std': 48, 'p_atr': 30, 'p_adx': 23, 'rsi_period': 29, 'ema1': 20, 'ema2': 44, 'slip_atr_k': 0.05541331002370861, 'slip_spread_k': 0.4405076921434015, 'spread_hl_frac': 0.02635717140965491, 'bb_std_mult': 1.3108370007586474, 'rsi_os': 55, 'rsi_ob': 88, 'vol_spike': 0.07980840680551624, 'adx_thresh': 9.26838658916279, 'atr_min_pct': 0.008590072381576629, 'atr_max_pct': 0.1312705969772676, 'tp_mult': 2.5662955241802554, 'tsl_mult': 0.7008264901399085, 'strategy': 'breakout', 'time_stop': 219, 'use_sma': False, 'use_atr': False, 'use_adx': False, 'use_ema': False, 'use_spike': True, 'rsi_required': False, 'edge_k': 0.1187768791811632, 'edge_cap': 0.8962113780099773, 'bull_strategy': 'breakout', 'bull_bb_std_mult': 0.8670609009959975, 'bull_rsi_os': 37, 'bull_rsi_ob': 83, 'bull_adx_thresh': 14.609770738456199, 'bull_atr_min_pct': 0.01987900734491612, 'bull_atr_max_pct': 0.03558211005323539, 'bull_tp_mult': 2.9179020217451255, 'bull_tsl_mult': 0.3292927193372218, 'bull_time_stop': 31, 'bull_use_sma': False, 'bull_use_ema': True, 'bull_use_atr': False, 'bull_use_adx': True, 'bull_use_spike': True, 'bull_rsi_required': False, 'bear_strategy': 'mean_reversion', 'bear_bb_std_mult': 1.755325446498157, 'bear_rsi_os': 29, 'bear_rsi_ob': 82, 'bear_adx_thresh': 29.919561441446568, 'bear_atr_min_pct': 0.013461492686855672, 'bear_atr_max_pct': 0.06001007220000837, 'bear_tp_mult': 2.2379313537528445, 'bear_tsl_mult': 0.0611344654993472, 'bear_time_stop': 236, 'bear_use_sma': True, 'bear_use_ema': True, 'bear_use_atr': False, 'bear_use_adx': False, 'bear_use_spike': False, 'bear_rsi_required': False, 'sideways_strategy': 'breakout', 'sideways_bb_std_mult': 2.5468822983309454, 'sideways_rsi_os': 50, 'sideways_rsi_ob': 76, 'sideways_adx_thresh': 16.4151085935068, 'sideways_atr_min_pct': 0.01850181572418364, 'sideways_atr_max_pct': 0.05472627007565716, 'sideways_tp_mult': 1.6324293185344054, 'sideways_tsl_mult': 0.18128781724845383, 'sideways_time_stop': 179, 'sideways_use_sma': True, 'sideways_use_ema': False, 'sideways_use_atr': False, 'sideways_use_adx': False, 'sideways_use_spike': True, 'sideways_rsi_required': True}.
