[I 2025-08-30 16:23:19,028] Trial 387 finished with values: [-0.0231526344027827, 0.023047720554700852] and parameters: {'p_sma': 27, 'p_std': 7, 'p_atr': 27, 'p_adx': 22, 'rsi_period': 13, 'ema1': 25, 'ema2': 27, 'slip_atr_k': 0.005763185034568783, 'slip_spread_k': 0.4091814390308688, 'spread_hl_frac': 0.011680568064547557, 'bb_std_mult': 3.413163465849556, 'rsi_os': 36, 'rsi_ob': 93, 'vol_spike': 0.00025790613551549295, 'adx_thresh': 12.883506042189081, 'atr_min_pct': 0.018269875972262678, 'atr_max_pct': 0.1432320973514195, 'tp_mult': 2.9581638440775677, 'tsl_mult': 0.45370024695111755, 'strategy': 'mean_reversion', 'time_stop': 5, 'use_sma': True, 'use_atr': True, 'use_adx': True, 'use_ema': False, 'use_spike': False, 'rsi_required': True, 'edge_k': 1.062836418857416, 'edge_cap': 0.6516587476129412, 'bull_strategy': 'mean_reversion', 'bull_bb_std_mult': 2.124799065817125, 'bull_rsi_os': 50, 'bull_rsi_ob': 49, 'bull_adx_thresh': 20.46624385610087, 'bull_atr_min_pct': 0.020718668350367588, 'bull_atr_max_pct': 0.03135857937955336, 'bull_tp_mult': 1.4081103256878889, 'bull_tsl_mult': 0.2870380403324909, 'bull_time_stop': 191, 'bull_use_sma': False, 'bull_use_ema': True, 'bull_use_atr': True, 'bull_use_adx': True, 'bull_use_spike': False, 'bull_rsi_required': False, 'bear_strategy': 'mean_reversion', 'bear_bb_std_mult': 2.7283235931152587, 'bear_rsi_os': 31, 'bear_rsi_ob': 77, 'bear_adx_thresh': 34.171727118621696, 'bear_atr_min_pct': 0.007954477695931102, 'bear_atr_max_pct': 0.048399473330712504, 'bear_tp_mult': 2.296935639418407, 'bear_tsl_mult': 0.17588382603564762, 'bear_time_stop': 30, 'bear_use_sma': True, 'bear_use_ema': False, 'bear_use_atr': False, 'bear_use_adx': True, 'bear_use_spike': False, 'bear_rsi_required': False, 'sideways_strategy': 'breakout', 'sideways_bb_std_mult': 2.036096712582768, 'sideways_rsi_os': 27, 'sideways_rsi_ob': 92, 'sideways_adx_thresh': 9.103252933959304, 'sideways_atr_min_pct': 0.0022387907622875053, 'sideways_atr_max_pct': 0.14656522933257643, 'sideways_tp_mult': 1.3844711457975967, 'sideways_tsl_mult': 0.9781527493106172, 'sideways_time_stop': 270, 'sideways_use_sma': True, 'sideways_use_ema': False, 'sideways_use_atr': False, 'sideways_use_adx': False, 'sideways_use_spike': False, 'sideways_rsi_required': True}.
[I 2025-08-30 16:23:19,028] Trial 385 finished with values: [-1000000000.0, 1000000000.0] and parameters: {'p_sma': 9, 'p_std': 7, 'p_atr': 14, 'p_adx': 19, 'rsi_period': 9, 'ema1': 26, 'ema2': 23, 'slip_atr_k': 0.00527579399237001, 'slip_spread_k': 0.4156519423769154, 'spread_hl_frac': 0.02035703208657701, 'bb_std_mult': 0.919425028451756, 'rsi_os': 34, 'rsi_ob': 62, 'vol_spike': 0.27079333772552305, 'adx_thresh': 13.360358698568119, 'atr_min_pct': 0.018313740680072573, 'atr_max_pct': 0.1438955590190833, 'tp_mult': 1.4034116621726302, 'tsl_mult': 0.046575757308770616, 'strategy': 'mean_reversion', 'time_stop': 5, 'use_sma': False, 'use_atr': True, 'use_adx': True, 'use_ema': False, 'use_spike': False, 'rsi_required': True, 'edge_k': 1.5418837759624755, 'edge_cap': 0.5842456062871759, 'bull_strategy': 'mean_reversion', 'bull_bb_std_mult': 2.4624754306841123, 'bull_rsi_os': 5, 'bull_rsi_ob': 49, 'bull_adx_thresh': 11.868500637261118, 'bull_atr_min_pct': 0.02051072382035543, 'bull_atr_max_pct': 0.09763756789907219, 'bull_tp_mult': 1.334223970655183, 'bull_tsl_mult': 0.2910298797962348, 'bull_time_stop': 189, 'bull_use_sma': False, 'bull_use_ema': True, 'bull_use_atr': True, 'bull_use_adx': True, 'bull_use_spike': False, 'bull_rsi_required': False, 'bear_strategy': 'mean_reversion', 'bear_bb_std_mult': 2.0833964290496865, 'bear_rsi_os': 13, 'bear_rsi_ob': 76, 'bear_adx_thresh': 14.332102215745865, 'bear_atr_min_pct': 0.022049205805525034, 'bear_atr_max_pct': 0.024713862313574725, 'bear_tp_mult': 2.2269763730837147, 'bear_tsl_mult': 0.1702332412865879, 'bear_time_stop': 215, 'bear_use_sma': True, 'bear_use_ema': False, 'bear_use_atr': False, 'bear_use_adx': False, 'bear_use_spike': False, 'bear_rsi_required': False, 'sideways_strategy': 'breakout', 'sideways_bb_std_mult': 1.4587522447752106, 'sideways_rsi_os': 30, 'sideways_rsi_ob': 66, 'sideways_adx_thresh': 17.082937150767922, 'sideways_atr_min_pct': 0.012259749209983527, 'sideways_atr_max_pct': 0.14661628609908173, 'sideways_tp_mult': 1.380383842477021, 'sideways_tsl_mult': 0.46223554714275117, 'sideways_time_stop': 215, 'sideways_use_sma': True, 'sideways_use_ema': False, 'sideways_use_atr': False, 'sideways_use_adx': False, 'sideways_use_spike': False, 'sideways_rsi_required': True}.
[I 2025-08-30 16:24:04,719] Trial 389 finished with values: [-1000000000.0, 1000000000.0] and parameters: {'p_sma': 50, 'p_std': 55, 'p_atr': 8, 'p_adx': 24, 'rsi_period': 18, 'ema1': 12, 'ema2': 13, 'slip_atr_k': 0.016685830269672228, 'slip_spread_k': 0.6135550969488166, 'spread_hl_frac': 0.017712864970093205, 'bb_std_mult': 0.7289902832257862, 'rsi_os': 35, 'rsi_ob': 91, 'vol_spike': 6.109246555044978e-05, 'adx_thresh': 12.047234368368498, 'atr_min_pct': 0.01966113853570624, 'atr_max_pct': 0.1328153670655151, 'tp_mult': 2.790187710717089, 'tsl_mult': 0.5394671834166718, 'strategy': 'mean_reversion', 'time_stop': 40, 'use_sma': False, 'use_atr': False, 'use_adx': True, 'use_ema': False, 'use_spike': False, 'rsi_required': True, 'edge_k': 1.4770846060042992, 'edge_cap': 0.6048438260743763, 'bull_strategy': 'mean_reversion', 'bull_bb_std_mult': 1.7894878074611849, 'bull_rsi_os': 12, 'bull_rsi_ob': 61, 'bull_adx_thresh': 25.977368654284973, 'bull_atr_min_pct': 0.021342225123124826, 'bull_atr_max_pct': 0.14219616119952014, 'bull_tp_mult': 1.2158986266625296, 'bull_tsl_mult': 0.826805748796832, 'bull_time_stop': 80, 'bull_use_sma': False, 'bull_use_ema': False, 'bull_use_atr': True, 'bull_use_adx': True, 'bull_use_spike': True, 'bull_rsi_required': False, 'bear_strategy': 'mean_reversion', 'bear_bb_std_mult': 2.004588178189973, 'bear_rsi_os': 14, 'bear_rsi_ob': 76, 'bear_adx_thresh': 11.295251948097222, 'bear_atr_min_pct': 0.019407283658587477, 'bear_atr_max_pct': 0.09589397697521482, 'bear_tp_mult': 2.0714724202808625, 'bear_tsl_mult': 0.468328240066218, 'bear_time_stop': 203, 'bear_use_sma': True, 'bear_use_ema': True, 'bear_use_atr': True, 'bear_use_adx': False, 'bear_use_spike': False, 'bear_rsi_required': False, 'sideways_strategy': 'mean_reversion', 'sideways_bb_std_mult': 2.2660932428463294, 'sideways_rsi_os': 7, 'sideways_rsi_ob': 91, 'sideways_adx_thresh': 30.40206654217709, 'sideways_atr_min_pct': 0.00215125823950702, 'sideways_atr_max_pct': 0.1403866284081049, 'sideways_tp_mult': 1.443006293172927, 'sideways_tsl_mult': 0.04703048670629861, 'sideways_time_stop': 12, 'sideways_use_sma': True, 'sideways_use_ema': False, 'sideways_use_atr': False, 'sideways_use_adx': False, 'sideways_use_spike': True, 'sideways_rsi_required': False}.
[I 2025-08-30 16:24:05,121] Trial 391 finished with values: [-1000000000.0, 1000000000.0] and parameters: {'p_sma': 34, 'p_std': 53, 'p_atr': 9, 'p_adx': 29, 'rsi_period': 18, 'ema1': 27, 'ema2': 13, 'slip_atr_k': 0.1916251465196282, 'slip_spread_k': 0.6340254873782655, 'spread_hl_frac': 0.007274956295170287, 'bb_std_mult': 3.081810537952323, 'rsi_os': 36, 'rsi_ob': 91, 'vol_spike': 0.00047973166789947634, 'adx_thresh': 12.136626112536769, 'atr_min_pct': 0.019709475261767168, 'atr_max_pct': 0.036498860664527524, 'tp_mult': 2.122883499893574, 'tsl_mult': 0.5316467135622599, 'strategy': 'mean_reversion', 'time_stop': 16, 'use_sma': False, 'use_atr': False, 'use_adx': True, 'use_ema': False, 'use_spike': False, 'rsi_required': True, 'edge_k': 1.1917668190739634, 'edge_cap': 0.6058561323500086, 'bull_strategy': 'mean_reversion', 'bull_bb_std_mult': 1.7978532110401333, 'bull_rsi_os': 29, 'bull_rsi_ob': 50, 'bull_adx_thresh': 27.29902532321807, 'bull_atr_min_pct': 0.021401444624262078, 'bull_atr_max_pct': 0.10238537212169191, 'bull_tp_mult': 1.2246517303082403, 'bull_tsl_mult': 0.3273364728206275, 'bull_time_stop': 80, 'bull_use_sma': False, 'bull_use_ema': False, 'bull_use_atr': True, 'bull_use_adx': True, 'bull_use_spike': True, 'bull_rsi_required': False, 'bear_strategy': 'mean_reversion', 'bear_bb_std_mult': 2.91152767190209, 'bear_rsi_os': 12, 'bear_rsi_ob': 77, 'bear_adx_thresh': 12.771271184880623, 'bear_atr_min_pct': 0.018909978262078023, 'bear_atr_max_pct': 0.09501621709081029, 'bear_tp_mult': 2.991738545770047, 'bear_tsl_mult': 0.7946473711308393, 'bear_time_stop': 200, 'bear_use_sma': True, 'bear_use_ema': True, 'bear_use_atr': True, 'bear_use_adx': False, 'bear_use_spike': False, 'bear_rsi_required': False, 'sideways_strategy': 'mean_reversion', 'sideways_bb_std_mult': 2.141643144559943, 'sideways_rsi_os': 26, 'sideways_rsi_ob': 91, 'sideways_adx_thresh': 12.617057203047583, 'sideways_atr_min_pct': 0.002040431859617187, 'sideways_atr_max_pct': 0.1450775568348692, 'sideways_tp_mult': 1.4804644459418248, 'sideways_tsl_mult': 0.04301022392420217, 'sideways_time_stop': 112, 'sideways_use_sma': True, 'sideways_use_ema': False, 'sideways_use_atr': False, 'sideways_use_adx': False, 'sideways_use_spike': True, 'sideways_rsi_required': False}.
[I 2025-08-30 16:24:05,793] Trial 390 finished with values: [-0.06407955145557465, 0.06398634777230751] and parameters: {'p_sma': 43, 'p_std': 55, 'p_atr': 8, 'p_adx': 24, 'rsi_period': 18, 'ema1': 11, 'ema2': 13, 'slip_atr_k': 0.19125356398824767, 'slip_spread_k': 0.608948718692725, 'spread_hl_frac': 0.018358021868099178, 'bb_std_mult': 3.0972809756385, 'rsi_os': 15, 'rsi_ob': 91, 'vol_spike': 0.007768106402425812, 'adx_thresh': 13.992419113398801, 'atr_min_pct': 0.01978876183742561, 'atr_max_pct': 0.046878408349451825, 'tp_mult': 2.7721240439251136, 'tsl_mult': 0.5358750299065648, 'strategy': 'mean_reversion', 'time_stop': 39, 'use_sma': False, 'use_atr': False, 'use_adx': True, 'use_ema': False, 'use_spike': False, 'rsi_required': True, 'edge_k': 1.621313459159035, 'edge_cap': 0.6121353879892619, 'bull_strategy': 'mean_reversion', 'bull_bb_std_mult': 1.8126204964623598, 'bull_rsi_os': 48, 'bull_rsi_ob': 50, 'bull_adx_thresh': 9.931471608072364, 'bull_atr_min_pct': 0.01161883650724099, 'bull_atr_max_pct': 0.08361236451707343, 'bull_tp_mult': 1.2487665425867718, 'bull_tsl_mult': 0.3284108151193761, 'bull_time_stop': 81, 'bull_use_sma': False, 'bull_use_ema': False, 'bull_use_atr': True, 'bull_use_adx': True, 'bull_use_spike': True, 'bull_rsi_required': False, 'bear_strategy': 'mean_reversion', 'bear_bb_std_mult': 2.199131374319751, 'bear_rsi_os': 12, 'bear_rsi_ob': 77, 'bear_adx_thresh': 16.103994284278127, 'bear_atr_min_pct': 0.020192010328122713, 'bear_atr_max_pct': 0.09680962595422014, 'bear_tp_mult': 2.93588098900346, 'bear_tsl_mult': 0.8815241743713098, 'bear_time_stop': 125, 'bear_use_sma': True, 'bear_use_ema': True, 'bear_use_atr': True, 'bear_use_adx': False, 'bear_use_spike': False, 'bear_rsi_required': False, 'sideways_strategy': 'mean_reversion', 'sideways_bb_std_mult': 2.24650786873163, 'sideways_rsi_os': 26, 'sideways_rsi_ob': 53, 'sideways_adx_thresh': 16.590123697255773, 'sideways_atr_min_pct': 0.0022839894246846583, 'sideways_atr_max_pct': 0.14152886721326546, 'sideways_tp_mult': 1.7273570963264777, 'sideways_tsl_mult': 0.5258667586614526, 'sideways_time_stop': 139, 'sideways_use_sma': True, 'sideways_use_ema': False, 'sideways_use_atr': False, 'sideways_use_adx': False, 'sideways_use_spike': True, 'sideways_rsi_required': False}.
[I 2025-08-30 16:24:06,121] Trial 392 finished with values: [-0.05824167892190435, 0.058165019818310064] and parameters: {'p_sma': 34, 'p_std': 55, 'p_atr': 9, 'p_adx': 24, 'rsi_period': 18, 'ema1': 5, 'ema2': 13, 'slip_atr_k': 0.0171299094641343, 'slip_spread_k': 0.6073275162155111, 'spread_hl_frac': 0.018075850924973744, 'bb_std_mult': 3.0839333662880923, 'rsi_os': 35, 'rsi_ob': 91, 'vol_spike': 0.16836575500897782, 'adx_thresh': 11.949105806297293, 'atr_min_pct': 0.011753635186072706, 'atr_max_pct': 0.13204743739368707, 'tp_mult': 2.0288742058254745, 'tsl_mult': 0.5433874408774457, 'strategy': 'mean_reversion', 'time_stop': 17, 'use_sma': False, 'use_atr': False, 'use_adx': True, 'use_ema': False, 'use_spike': False, 'rsi_required': True, 'edge_k': 1.6214443130000193, 'edge_cap': 0.6054300010143772, 'bull_strategy': 'mean_reversion', 'bull_bb_std_mult': 0.5927820056229072, 'bull_rsi_os': 48, 'bull_rsi_ob': 82, 'bull_adx_thresh': 27.75243472185044, 'bull_atr_min_pct': 0.021117341448320174, 'bull_atr_max_pct': 0.14121771529150048, 'bull_tp_mult': 1.2182259833498075, 'bull_tsl_mult': 0.32676759844282705, 'bull_time_stop': 82, 'bull_use_sma': False, 'bull_use_ema': False, 'bull_use_atr': True, 'bull_use_adx': True, 'bull_use_spike': True, 'bull_rsi_required': False, 'bear_strategy': 'mean_reversion', 'bear_bb_std_mult': 1.9889852370192447, 'bear_rsi_os': 12, 'bear_rsi_ob': 95, 'bear_adx_thresh': 15.984044198655639, 'bear_atr_min_pct': 0.019423452978028652, 'bear_atr_max_pct': 0.01551137158579391, 'bear_tp_mult': 2.172957388864935, 'bear_tsl_mult': 0.20814121611614234, 'bear_time_stop': 41, 'bear_use_sma': True, 'bear_use_ema': True, 'bear_use_atr': True, 'bear_use_adx': False, 'bear_use_spike': False, 'bear_rsi_required': False, 'sideways_strategy': 'mean_reversion', 'sideways_bb_std_mult': 2.1487601390999336, 'sideways_rsi_os': 26, 'sideways_rsi_ob': 54, 'sideways_adx_thresh': 30.65133695018988, 'sideways_atr_min_pct': 0.0013235231473714007, 'sideways_atr_max_pct': 0.14006951330395945, 'sideways_tp_mult': 1.4354038779094798, 'sideways_tsl_mult': 0.28775618875553716, 'sideways_time_stop': 135, 'sideways_use_sma': True, 'sideways_use_ema': False, 'sideways_use_atr': False, 'sideways_use_adx': False, 'sideways_use_spike': True, 'sideways_rsi_required': False}.
[I 2025-08-30 16:24:07,314] Trial 396 finished with values: [-1000000000.0, 1000000000.0] and parameters: {'p_sma': 55, 'p_std': 60, 'p_atr': 24, 'p_adx': 23, 'rsi_period': 20, 'ema1': 25, 'ema2': 10, 'slip_atr_k': 0.0008532544272103698, 'slip_spread_k': 0.5694399462814782, 'spread_hl_frac': 0.01943578315762725, 'bb_std_mult': 2.9945757272939217, 'rsi_os': 54, 'rsi_ob': 45, 'vol_spike': 0.042820653519493004, 'adx_thresh': 10.94308370318483, 'atr_min_pct': 0.01680544627352685, 'atr_max_pct': 0.12635157570886155, 'tp_mult': 2.9077292666370513, 'tsl_mult': 0.375782689462255, 'strategy': 'mean_reversion', 'time_stop': 27, 'use_sma': False, 'use_atr': True, 'use_adx': True, 'use_ema': True, 'use_spike': False, 'rsi_required': True, 'edge_k': 1.2764713380127852, 'edge_cap': 0.6640328817686888, 'bull_strategy': 'mean_reversion', 'bull_bb_std_mult': 2.285236135679638, 'bull_rsi_os': 35, 'bull_rsi_ob': 53, 'bull_adx_thresh': 22.611893660849912, 'bull_atr_min_pct': 0.02250731517376365, 'bull_atr_max_pct': 0.14629088905349727, 'bull_tp_mult': 1.8746714504044881, 'bull_tsl_mult': 0.21356217599199018, 'bull_time_stop': 66, 'bull_use_sma': False, 'bull_use_ema': True, 'bull_use_atr': True, 'bull_use_adx': True, 'bull_use_spike': False, 'bull_rsi_required': False, 'bear_strategy': 'breakout', 'bear_bb_std_mult': 1.1813662008408894, 'bear_rsi_os': 14, 'bear_rsi_ob': 75, 'bear_adx_thresh': 13.27910983263656, 'bear_atr_min_pct': 0.02160174614163784, 'bear_atr_max_pct': 0.052698615037681126, 'bear_tp_mult': 2.2398457613768077, 'bear_tsl_mult': 0.37110203073640236, 'bear_time_stop': 225, 'bear_use_sma': True, 'bear_use_ema': False, 'bear_use_atr': False, 'bear_use_adx': False, 'bear_use_spike': False, 'bear_rsi_required': True, 'sideways_strategy': 'breakout', 'sideways_bb_std_mult': 2.0720177171614576, 'sideways_rsi_os': 15, 'sideways_rsi_ob': 93, 'sideways_adx_thresh': 7.312758693090311, 'sideways_atr_min_pct': 0.008298654903498289, 'sideways_atr_max_pct': 0.14678526434958933, 'sideways_tp_mult': 1.41531085400083, 'sideways_tsl_mult': 0.17609644098308253, 'sideways_time_stop': 211, 'sideways_use_sma': False, 'sideways_use_ema': True, 'sideways_use_atr': True, 'sideways_use_adx': False, 'sideways_use_spike': False, 'sideways_rsi_required': True}.
[I 2025-08-30 16:24:48,235] Trial 397 finished with values: [-1000000000.0, 1000000000.0] and parameters: {'p_sma': 52, 'p_std': 57, 'p_atr': 26, 'p_adx': 25, 'rsi_period': 23, 'ema1': 22, 'ema2': 11, 'slip_atr_k': 0.11207410323904946, 'slip_spread_k': 0.6501334608121738, 'spread_hl_frac': 0.021669840193991343, 'bb_std_mult': 3.2227168943749067, 'rsi_os': 32, 'rsi_ob': 89, 'vol_spike': 0.009200588404731327, 'adx_thresh': 13.996451466356543, 'atr_min_pct': 0.019065996950479926, 'atr_max_pct': 0.139390602140758, 'tp_mult': 2.830064324277017, 'tsl_mult': 0.9696426305541265, 'strategy': 'mean_reversion', 'time_stop': 22, 'use_sma': True, 'use_atr': True, 'use_adx': True, 'use_ema': False, 'use_spike': False, 'rsi_required': True, 'edge_k': 1.7157840172769152, 'edge_cap': 0.5475914543956842, 'bull_strategy': 'mean_reversion', 'bull_bb_std_mult': 1.4272718433520923, 'bull_rsi_os': 11, 'bull_rsi_ob': 47, 'bull_adx_thresh': 21.512336783832115, 'bull_atr_min_pct': 0.014476520820187674, 'bull_atr_max_pct': 0.1338087931062568, 'bull_tp_mult': 1.3005536523019448, 'bull_tsl_mult': 0.30436220025645555, 'bull_time_stop': 232, 'bull_use_sma': False, 'bull_use_ema': True, 'bull_use_atr': True, 'bull_use_adx': True, 'bull_use_spike': False, 'bull_rsi_required': False, 'bear_strategy': 'mean_reversion', 'bear_bb_std_mult': 1.8849530984828629, 'bear_rsi_os': 23, 'bear_rsi_ob': 79, 'bear_adx_thresh': 31.976728522520098, 'bear_atr_min_pct': 0.020885768223614674, 'bear_atr_max_pct': 0.08642258898939531, 'bear_tp_mult': 1.9791899212751174, 'bear_tsl_mult': 0.6120201862852354, 'bear_time_stop': 239, 'bear_use_sma': True, 'bear_use_ema': False, 'bear_use_atr': False, 'bear_use_adx': True, 'bear_use_spike': False, 'bear_rsi_required': True, 'sideways_strategy': 'breakout', 'sideways_bb_std_mult': 0.6960482077201724, 'sideways_rsi_os': 29, 'sideways_rsi_ob': 93, 'sideways_adx_thresh': 17.280316244692862, 'sideways_atr_min_pct': 0.0032809602392240983, 'sideways_atr_max_pct': 0.021152253795507683, 'sideways_tp_mult': 1.4787392662257675, 'sideways_tsl_mult': 0.4105659941113185, 'sideways_time_stop': 199, 'sideways_use_sma': True, 'sideways_use_ema': False, 'sideways_use_atr': True, 'sideways_use_adx': False, 'sideways_use_spike': False, 'sideways_rsi_required': True}.
[I 2025-08-30 16:24:48,240] Trial 393 finished with values: [-0.0809898480418969, 0.08096852514995381] and parameters: {'p_sma': 59, 'p_std': 57, 'p_atr': 26, 'p_adx': 23, 'rsi_period': 19, 'ema1': 11, 'ema2': 10, 'slip_atr_k': 9.78219061588282e-05, 'slip_spread_k': 0.13018883366776068, 'spread_hl_frac': 0.02775421376121534, 'bb_std_mult': 2.9922978080615352, 'rsi_os': 35, 'rsi_ob': 88, 'vol_spike': 0.04444303965939159, 'adx_thresh': 29.846239424233254, 'atr_min_pct': 0.01690449472378395, 'atr_max_pct': 0.13393701798582916, 'tp_mult': 2.8514237584070408, 'tsl_mult': 0.16706340514004991, 'strategy': 'mean_reversion', 'time_stop': 26, 'use_sma': False, 'use_atr': True, 'use_adx': True, 'use_ema': False, 'use_spike': False, 'rsi_required': True, 'edge_k': 1.6355129359961522, 'edge_cap': 0.6255168157606775, 'bull_strategy': 'mean_reversion', 'bull_bb_std_mult': 0.6180101234008262, 'bull_rsi_os': 13, 'bull_rsi_ob': 83, 'bull_adx_thresh': 21.441438033103903, 'bull_atr_min_pct': 0.014563659413380697, 'bull_atr_max_pct': 0.14602854704162843, 'bull_tp_mult': 1.2900717604393597, 'bull_tsl_mult': 0.2159852761513763, 'bull_time_stop': 287, 'bull_use_sma': False, 'bull_use_ema': True, 'bull_use_atr': True, 'bull_use_adx': True, 'bull_use_spike': False, 'bull_rsi_required': False, 'bear_strategy': 'mean_reversion', 'bear_bb_std_mult': 1.314545807904976, 'bear_rsi_os': 11, 'bear_rsi_ob': 70, 'bear_adx_thresh': 13.562528584089492, 'bear_atr_min_pct': 0.01385682845091725, 'bear_atr_max_pct': 0.0852568098015332, 'bear_tp_mult': 2.175200871025941, 'bear_tsl_mult': 0.7228053619344914, 'bear_time_stop': 239, 'bear_use_sma': True, 'bear_use_ema': False, 'bear_use_atr': False, 'bear_use_adx': False, 'bear_use_spike': False, 'bear_rsi_required': True, 'sideways_strategy': 'breakout', 'sideways_bb_std_mult': 2.15099239426058, 'sideways_rsi_os': 45, 'sideways_rsi_ob': 53, 'sideways_adx_thresh': 16.470774542800807, 'sideways_atr_min_pct': 0.001294492547904737, 'sideways_atr_max_pct': 0.041025896008712676, 'sideways_tp_mult': 1.4252660636883714, 'sideways_tsl_mult': 0.17873502801306868, 'sideways_time_stop': 199, 'sideways_use_sma': False, 'sideways_use_ema': False, 'sideways_use_atr': True, 'sideways_use_adx': False, 'sideways_use_spike': False, 'sideways_rsi_required': True}.
