[I 2025-08-30 15:52:25,874] Trial 209 finished with values: [-1000000000.0, 1000000000.0] and parameters: {'p_sma': 20, 'p_std': 58, 'p_atr': 9, 'p_adx': 15, 'rsi_period': 29, 'ema1': 8, 'ema2': 60, 'slip_atr_k': 0.026353790066035096, 'slip_spread_k': 0.020843793703315436, 'spread_hl_frac': 0.045871515519174705, 'bb_std_mult': 3.239513790899327, 'rsi_os': 38, 'rsi_ob': 52, 'vol_spike': 0.023562025362907153, 'adx_thresh': 27.19763158956436, 'atr_min_pct': 0.020493753342510544, 'atr_max_pct': 0.1355556670053944, 'tp_mult': 1.2610555756374513, 'tsl_mult': 0.4743685958393218, 'strategy': 'breakout', 'time_stop': 9, 'use_sma': True, 'use_atr': True, 'use_adx': False, 'use_ema': True, 'use_spike': True, 'rsi_required': False, 'edge_k': 1.7529770365429231, 'edge_cap': 0.5569024232125594, 'bull_strategy': 'mean_reversion', 'bull_bb_std_mult': 2.461509033653847, 'bull_rsi_os': 11, 'bull_rsi_ob': 75, 'bull_adx_thresh': 30.120852255761037, 'bull_atr_min_pct': 0.00026504690633834396, 'bull_atr_max_pct': 0.12366019334682407, 'bull_tp_mult': 1.538250098739807, 'bull_tsl_mult': 0.3389275134177039, 'bull_time_stop': 76, 'bull_use_sma': True, 'bull_use_ema': True, 'bull_use_atr': False, 'bull_use_adx': False, 'bull_use_spike': False, 'bull_rsi_required': False, 'bear_strategy': 'breakout', 'bear_bb_std_mult': 2.050163573742999, 'bear_rsi_os': 17, 'bear_rsi_ob': 74, 'bear_adx_thresh': 14.356045827815898, 'bear_atr_min_pct': 0.028550259697664476, 'bear_atr_max_pct': 0.09663001530850343, 'bear_tp_mult': 2.365865536947985, 'bear_tsl_mult': 0.561373965931504, 'bear_time_stop': 261, 'bear_use_sma': False, 'bear_use_ema': True, 'bear_use_atr': False, 'bear_use_adx': False, 'bear_use_spike': True, 'bear_rsi_required': False, 'sideways_strategy': 'mean_reversion', 'sideways_bb_std_mult': 2.858326436105462, 'sideways_rsi_os': 35, 'sideways_rsi_ob': 94, 'sideways_adx_thresh': 13.878983070997734, 'sideways_atr_min_pct': 0.004512891021148569, 'sideways_atr_max_pct': 0.14987570130614536, 'sideways_tp_mult': 2.4679906988482827, 'sideways_tsl_mult': 0.6879301029479418, 'sideways_time_stop': 211, 'sideways_use_sma': True, 'sideways_use_ema': False, 'sideways_use_atr': False, 'sideways_use_adx': True, 'sideways_use_spike': False, 'sideways_rsi_required': True}.
[I 2025-08-30 15:52:26,064] Trial 207 finished with values: [-1000000000.0, 1000000000.0] and parameters: {'p_sma': 51, 'p_std': 53, 'p_atr': 9, 'p_adx': 28, 'rsi_period': 38, 'ema1': 15, 'ema2': 37, 'slip_atr_k': 0.012635643681775718, 'slip_spread_k': 0.6626798791825795, 'spread_hl_frac': 0.0171751788475848, 'bb_std_mult': 3.183988303808881, 'rsi_os': 38, 'rsi_ob': 55, 'vol_spike': 0.022063073432787864, 'adx_thresh': 28.26824090924179, 'atr_min_pct': 0.02401827868586258, 'atr_max_pct': 0.14152251678207564, 'tp_mult': 1.138540514397834, 'tsl_mult': 0.49265993750377873, 'strategy': 'breakout', 'time_stop': 8, 'use_sma': False, 'use_atr': True, 'use_adx': False, 'use_ema': True, 'use_spike': True, 'rsi_required': False, 'edge_k': 0.37405692546072566, 'edge_cap': 0.6193275198239854, 'bull_strategy': 'mean_reversion', 'bull_bb_std_mult': 1.78414212146777, 'bull_rsi_os': 51, 'bull_rsi_ob': 78, 'bull_adx_thresh': 31.69244006476455, 'bull_atr_min_pct': 0.002174933523601763, 'bull_atr_max_pct': 0.06316184061737232, 'bull_tp_mult': 1.5447683608989955, 'bull_tsl_mult': 0.41229152826382, 'bull_time_stop': 76, 'bull_use_sma': True, 'bull_use_ema': True, 'bull_use_atr': False, 'bull_use_adx': False, 'bull_use_spike': False, 'bull_rsi_required': False, 'bear_strategy': 'breakout', 'bear_bb_std_mult': 3.276311302433834, 'bear_rsi_os': 18, 'bear_rsi_ob': 55, 'bear_adx_thresh': 12.144698423583883, 'bear_atr_min_pct': 0.02111638497729629, 'bear_atr_max_pct': 0.09217127476267135, 'bear_tp_mult': 2.3605539149866925, 'bear_tsl_mult': 0.5653799539772447, 'bear_time_stop': 287, 'bear_use_sma': False, 'bear_use_ema': True, 'bear_use_atr': False, 'bear_use_adx': False, 'bear_use_spike': True, 'bear_rsi_required': False, 'sideways_strategy': 'mean_reversion', 'sideways_bb_std_mult': 3.2263101590886154, 'sideways_rsi_os': 26, 'sideways_rsi_ob': 82, 'sideways_adx_thresh': 16.125279656911392, 'sideways_atr_min_pct': 0.0017524344806985517, 'sideways_atr_max_pct': 0.12970537598711523, 'sideways_tp_mult': 2.7419956219871864, 'sideways_tsl_mult': 0.5155182019853781, 'sideways_time_stop': 237, 'sideways_use_sma': True, 'sideways_use_ema': False, 'sideways_use_atr': False, 'sideways_use_adx': True, 'sideways_use_spike': False, 'sideways_rsi_required': True}.
[I 2025-08-30 15:52:26,604] Trial 208 finished with values: [-1000000000.0, 1000000000.0] and parameters: {'p_sma': 19, 'p_std': 58, 'p_atr': 9, 'p_adx': 15, 'rsi_period': 28, 'ema1': 27, 'ema2': 60, 'slip_atr_k': 0.019100529807745587, 'slip_spread_k': 0.01908918921658136, 'spread_hl_frac': 0.0349590388211388, 'bb_std_mult': 3.2003490843492113, 'rsi_os': 38, 'rsi_ob': 52, 'vol_spike': 0.14820054977596928, 'adx_thresh': 28.238597237851852, 'atr_min_pct': 0.02146672656429666, 'atr_max_pct': 0.1355962035411095, 'tp_mult': 1.2646354659310446, 'tsl_mult': 0.4934417804489951, 'strategy': 'breakout', 'time_stop': 8, 'use_sma': False, 'use_atr': True, 'use_adx': False, 'use_ema': True, 'use_spike': True, 'rsi_required': False, 'edge_k': 1.9464370760048229, 'edge_cap': 0.5059070980724832, 'bull_strategy': 'mean_reversion', 'bull_bb_std_mult': 2.236865301834446, 'bull_rsi_os': 11, 'bull_rsi_ob': 75, 'bull_adx_thresh': 29.80186330811037, 'bull_atr_min_pct': 0.0004339266406758151, 'bull_atr_max_pct': 0.12258145358701268, 'bull_tp_mult': 1.3912842650660446, 'bull_tsl_mult': 0.344135274029254, 'bull_time_stop': 67, 'bull_use_sma': True, 'bull_use_ema': True, 'bull_use_atr': False, 'bull_use_adx': False, 'bull_use_spike': False, 'bull_rsi_required': False, 'bear_strategy': 'breakout', 'bear_bb_std_mult': 2.051382381286817, 'bear_rsi_os': 17, 'bear_rsi_ob': 75, 'bear_adx_thresh': 14.291261168440663, 'bear_atr_min_pct': 0.02879159318109935, 'bear_atr_max_pct': 0.0919388958780848, 'bear_tp_mult': 2.3602525655680684, 'bear_tsl_mult': 0.5706212435506112, 'bear_time_stop': 258, 'bear_use_sma': False, 'bear_use_ema': True, 'bear_use_atr': False, 'bear_use_adx': False, 'bear_use_spike': True, 'bear_rsi_required': False, 'sideways_strategy': 'mean_reversion', 'sideways_bb_std_mult': 2.877308859609679, 'sideways_rsi_os': 34, 'sideways_rsi_ob': 94, 'sideways_adx_thresh': 14.189434676458376, 'sideways_atr_min_pct': 0.02553817950129746, 'sideways_atr_max_pct': 0.1493598791300969, 'sideways_tp_mult': 2.216702850622627, 'sideways_tsl_mult': 0.7417562605320936, 'sideways_time_stop': 197, 'sideways_use_sma': True, 'sideways_use_ema': False, 'sideways_use_atr': False, 'sideways_use_adx': True, 'sideways_use_spike': False, 'sideways_rsi_required': True}.
[I 2025-08-30 15:52:26,936] Trial 210 finished with values: [-1000000000.0, 1000000000.0] and parameters: {'p_sma': 58, 'p_std': 52, 'p_atr': 25, 'p_adx': 15, 'rsi_period': 30, 'ema1': 27, 'ema2': 60, 'slip_atr_k': 0.05533964841106587, 'slip_spread_k': 0.6660596620593771, 'spread_hl_frac': 0.04608339858178164, 'bb_std_mult': 3.2309658441946056, 'rsi_os': 38, 'rsi_ob': 52, 'vol_spike': 0.16026235455198443, 'adx_thresh': 27.357873626863288, 'atr_min_pct': 0.022431542573925482, 'atr_max_pct': 0.13641735133514893, 'tp_mult': 1.2510796157513202, 'tsl_mult': 0.4841140116789963, 'strategy': 'breakout', 'time_stop': 8, 'use_sma': True, 'use_atr': True, 'use_adx': False, 'use_ema': True, 'use_spike': True, 'rsi_required': False, 'edge_k': 1.7653437232287885, 'edge_cap': 0.5105239314333438, 'bull_strategy': 'mean_reversion', 'bull_bb_std_mult': 2.1813342185092983, 'bull_rsi_os': 8, 'bull_rsi_ob': 75, 'bull_adx_thresh': 29.762709015457844, 'bull_atr_min_pct': 7.80056634118822e-05, 'bull_atr_max_pct': 0.12338562648758153, 'bull_tp_mult': 1.0510863571576312, 'bull_tsl_mult': 0.34106842749394345, 'bull_time_stop': 277, 'bull_use_sma': True, 'bull_use_ema': True, 'bull_use_atr': False, 'bull_use_adx': False, 'bull_use_spike': False, 'bull_rsi_required': False, 'bear_strategy': 'breakout', 'bear_bb_std_mult': 2.021803147897733, 'bear_rsi_os': 14, 'bear_rsi_ob': 75, 'bear_adx_thresh': 14.811264689923963, 'bear_atr_min_pct': 0.0020109259730265658, 'bear_atr_max_pct': 0.09671652474768869, 'bear_tp_mult': 2.363472865833864, 'bear_tsl_mult': 0.6042862800642497, 'bear_time_stop': 260, 'bear_use_sma': False, 'bear_use_ema': True, 'bear_use_atr': False, 'bear_use_adx': False, 'bear_use_spike': True, 'bear_rsi_required': False, 'sideways_strategy': 'mean_reversion', 'sideways_bb_std_mult': 2.972223298967357, 'sideways_rsi_os': 35, 'sideways_rsi_ob': 93, 'sideways_adx_thresh': 14.36953653407983, 'sideways_atr_min_pct': 0.002483513964648827, 'sideways_atr_max_pct': 0.1492007889208949, 'sideways_tp_mult': 2.338597413074958, 'sideways_tsl_mult': 0.6910929970595748, 'sideways_time_stop': 210, 'sideways_use_sma': True, 'sideways_use_ema': False, 'sideways_use_atr': False, 'sideways_use_adx': True, 'sideways_use_spike': False, 'sideways_rsi_required': True}.
[I 2025-08-30 15:53:11,247] Trial 212 finished with values: [-0.015939690856723088, 0.01583496816960514] and parameters: {'p_sma': 19, 'p_std': 55, 'p_atr': 25, 'p_adx': 15, 'rsi_period': 28, 'ema1': 27, 'ema2': 45, 'slip_atr_k': 0.055791568409388065, 'slip_spread_k': 0.03611430184274086, 'spread_hl_frac': 0.0011149235242460913, 'bb_std_mult': 3.1994999531635857, 'rsi_os': 25, 'rsi_ob': 53, 'vol_spike': 0.2016114176975647, 'adx_thresh': 26.74240828974036, 'atr_min_pct': 0.022422572730668014, 'atr_max_pct': 0.1313361101327658, 'tp_mult': 1.1922136960855347, 'tsl_mult': 0.4554391124439901, 'strategy': 'breakout', 'time_stop': 20, 'use_sma': True, 'use_atr': True, 'use_adx': False, 'use_ema': False, 'use_spike': True, 'rsi_required': False, 'edge_k': 1.624818210949755, 'edge_cap': 0.5127827350419113, 'bull_strategy': 'breakout', 'bull_bb_std_mult': 1.9280279235214712, 'bull_rsi_os': 8, 'bull_rsi_ob': 75, 'bull_adx_thresh': 28.806065124308617, 'bull_atr_min_pct': 0.00010693638099308026, 'bull_atr_max_pct': 0.10663877642172909, 'bull_tp_mult': 1.1514594982236983, 'bull_tsl_mult': 0.34229406813055585, 'bull_time_stop': 229, 'bull_use_sma': True, 'bull_use_ema': False, 'bull_use_atr': False, 'bull_use_adx': False, 'bull_use_spike': True, 'bull_rsi_required': True, 'bear_strategy': 'mean_reversion', 'bear_bb_std_mult': 2.014082489624587, 'bear_rsi_os': 14, 'bear_rsi_ob': 76, 'bear_adx_thresh': 14.762406958780257, 'bear_atr_min_pct': 0.02771416483541429, 'bear_atr_max_pct': 0.09542732228049433, 'bear_tp_mult': 1.2619568403228647, 'bear_tsl_mult': 0.5984716150098953, 'bear_time_stop': 87, 'bear_use_sma': False, 'bear_use_ema': False, 'bear_use_atr': False, 'bear_use_adx': True, 'bear_use_spike': True, 'bear_rsi_required': True, 'sideways_strategy': 'breakout', 'sideways_bb_std_mult': 2.933851312703427, 'sideways_rsi_os': 32, 'sideways_rsi_ob': 93, 'sideways_adx_thresh': 14.380037777077506, 'sideways_atr_min_pct': 0.002995505006539447, 'sideways_atr_max_pct': 0.14412781120794246, 'sideways_tp_mult': 2.4151850625787468, 'sideways_tsl_mult': 0.7292320896437878, 'sideways_time_stop': 198, 'sideways_use_sma': True, 'sideways_use_ema': False, 'sideways_use_atr': False, 'sideways_use_adx': True, 'sideways_use_spike': False, 'sideways_rsi_required': True}.
[I 2025-08-30 15:53:11,715] Trial 214 finished with values: [-1000000000.0, 1000000000.0] and parameters: {'p_sma': 18, 'p_std': 60, 'p_atr': 25, 'p_adx': 14, 'rsi_period': 28, 'ema1': 26, 'ema2': 45, 'slip_atr_k': 0.04144105903508612, 'slip_spread_k': 0.044702411322542435, 'spread_hl_frac': 0.04475768472326824, 'bb_std_mult': 3.0486963023585187, 'rsi_os': 19, 'rsi_ob': 46, 'vol_spike': 0.040180072917644985, 'adx_thresh': 26.70420649647482, 'atr_min_pct': 0.020732906001626854, 'atr_max_pct': 0.13029400045031317, 'tp_mult': 1.1760969133979096, 'tsl_mult': 0.4551079779683732, 'strategy': 'breakout', 'time_stop': 20, 'use_sma': False, 'use_atr': True, 'use_adx': False, 'use_ema': False, 'use_spike': True, 'rsi_required': False, 'edge_k': 1.2309332471484056, 'edge_cap': 0.4891077675441048, 'bull_strategy': 'breakout', 'bull_bb_std_mult': 1.9514058525846667, 'bull_rsi_os': 14, 'bull_rsi_ob': 77, 'bull_adx_thresh': 28.405444977236876, 'bull_atr_min_pct': 0.0008830399724663473, 'bull_atr_max_pct': 0.10578441134615917, 'bull_tp_mult': 1.6729743130832113, 'bull_tsl_mult': 0.323824563506269, 'bull_time_stop': 142, 'bull_use_sma': True, 'bull_use_ema': False, 'bull_use_atr': False, 'bull_use_adx': False, 'bull_use_spike': True, 'bull_rsi_required': True, 'bear_strategy': 'mean_reversion', 'bear_bb_std_mult': 2.0742399110351735, 'bear_rsi_os': 14, 'bear_rsi_ob': 71, 'bear_adx_thresh': 13.956917827357861, 'bear_atr_min_pct': 0.027689966974159014, 'bear_atr_max_pct': 0.010566493428092127, 'bear_tp_mult': 2.823698351099263, 'bear_tsl_mult': 0.5931078767420265, 'bear_time_stop': 277, 'bear_use_sma': False, 'bear_use_ema': False, 'bear_use_atr': False, 'bear_use_adx': True, 'bear_use_spike': True, 'bear_rsi_required': True, 'sideways_strategy': 'breakout', 'sideways_bb_std_mult': 2.7916823269846267, 'sideways_rsi_os': 32, 'sideways_rsi_ob': 92, 'sideways_adx_thresh': 8.350645056345204, 'sideways_atr_min_pct': 0.0031086141281864935, 'sideways_atr_max_pct': 0.14378406903393331, 'sideways_tp_mult': 2.614501709493228, 'sideways_tsl_mult': 0.7320163770990304, 'sideways_time_stop': 215, 'sideways_use_sma': True, 'sideways_use_ema': False, 'sideways_use_atr': False, 'sideways_use_adx': True, 'sideways_use_spike': False, 'sideways_rsi_required': True}.
[I 2025-08-30 15:53:12,005] Trial 211 finished with values: [-1000000000.0, 1000000000.0] and parameters: {'p_sma': 18, 'p_std': 52, 'p_atr': 25, 'p_adx': 14, 'rsi_period': 28, 'ema1': 27, 'ema2': 59, 'slip_atr_k': 0.019101052165111945, 'slip_spread_k': 0.6699302670200652, 'spread_hl_frac': 0.044690898565018386, 'bb_std_mult': 3.205803792046255, 'rsi_os': 19, 'rsi_ob': 54, 'vol_spike': 0.037361144486799364, 'adx_thresh': 26.36345521668919, 'atr_min_pct': 0.022178893229516914, 'atr_max_pct': 0.1376027406604329, 'tp_mult': 1.183417681455518, 'tsl_mult': 0.4925700897729845, 'strategy': 'breakout', 'time_stop': 26, 'use_sma': False, 'use_atr': True, 'use_adx': False, 'use_ema': True, 'use_spike': True, 'rsi_required': False, 'edge_k': 1.648594379119408, 'edge_cap': 0.4895495702035858, 'bull_strategy': 'mean_reversion', 'bull_bb_std_mult': 2.219289417967652, 'bull_rsi_os': 14, 'bull_rsi_ob': 76, 'bull_adx_thresh': 29.687341841581667, 'bull_atr_min_pct': 1.2112039143015538e-06, 'bull_atr_max_pct': 0.10608929890493439, 'bull_tp_mult': 1.414812267283053, 'bull_tsl_mult': 0.34326988314034607, 'bull_time_stop': 67, 'bull_use_sma': True, 'bull_use_ema': False, 'bull_use_atr': False, 'bull_use_adx': False, 'bull_use_spike': False, 'bull_rsi_required': False, 'bear_strategy': 'breakout', 'bear_bb_std_mult': 2.0110738073714796, 'bear_rsi_os': 14, 'bear_rsi_ob': 76, 'bear_adx_thresh': 14.984530197309864, 'bear_atr_min_pct': 0.003402441152414167, 'bear_atr_max_pct': 0.09728093581837743, 'bear_tp_mult': 2.4589178200965325, 'bear_tsl_mult': 0.31235221424046195, 'bear_time_stop': 279, 'bear_use_sma': False, 'bear_use_ema': True, 'bear_use_atr': False, 'bear_use_adx': True, 'bear_use_spike': True, 'bear_rsi_required': True, 'sideways_strategy': 'mean_reversion', 'sideways_bb_std_mult': 2.8854628949964236, 'sideways_rsi_os': 32, 'sideways_rsi_ob': 93, 'sideways_adx_thresh': 14.85859626164471, 'sideways_atr_min_pct': 0.0028674958703813133, 'sideways_atr_max_pct': 0.14467762754985308, 'sideways_tp_mult': 2.198273262720223, 'sideways_tsl_mult': 0.7370703008537896, 'sideways_time_stop': 200, 'sideways_use_sma': True, 'sideways_use_ema': False, 'sideways_use_atr': False, 'sideways_use_adx': True, 'sideways_use_spike': False, 'sideways_rsi_required': True}.
[I 2025-08-30 15:53:12,278] Trial 213 finished with values: [-0.012014672635943136, 0.011921464090601222] and parameters: {'p_sma': 18, 'p_std': 55, 'p_atr': 25, 'p_adx': 14, 'rsi_period': 30, 'ema1': 27, 'ema2': 59, 'slip_atr_k': 0.019585692414559562, 'slip_spread_k': 0.044384233247518626, 'spread_hl_frac': 0.0014342973800065238, 'bb_std_mult': 3.1150920960330493, 'rsi_os': 19, 'rsi_ob': 53, 'vol_spike': 0.03666555263581033, 'adx_thresh': 26.45279293929288, 'atr_min_pct': 0.019851580369394696, 'atr_max_pct': 0.1304468371709914, 'tp_mult': 1.1870304772432891, 'tsl_mult': 0.45533413330287137, 'strategy': 'breakout', 'time_stop': 30, 'use_sma': True, 'use_atr': True, 'use_adx': False, 'use_ema': False, 'use_spike': True, 'rsi_required': False, 'edge_k': 1.6420644193630514, 'edge_cap': 0.8060823001712685, 'bull_strategy': 'breakout', 'bull_bb_std_mult': 1.94022045727008, 'bull_rsi_os': 8, 'bull_rsi_ob': 77, 'bull_adx_thresh': 29.601531979002786, 'bull_atr_min_pct': 0.0009594669991983937, 'bull_atr_max_pct': 0.13833551915923156, 'bull_tp_mult': 1.0685950154628001, 'bull_tsl_mult': 0.3438885990085301, 'bull_time_stop': 233, 'bull_use_sma': True, 'bull_use_ema': False, 'bull_use_atr': False, 'bull_use_adx': False, 'bull_use_spike': True, 'bull_rsi_required': True, 'bear_strategy': 'mean_reversion', 'bear_bb_std_mult': 3.5966110601500683, 'bear_rsi_os': 14, 'bear_rsi_ob': 76, 'bear_adx_thresh': 13.648043462399002, 'bear_atr_min_pct': 0.003398673920295924, 'bear_atr_max_pct': 0.03818162600570576, 'bear_tp_mult': 2.488978274346745, 'bear_tsl_mult': 0.7458881097763805, 'bear_time_stop': 279, 'bear_use_sma': False, 'bear_use_ema': False, 'bear_use_atr': False, 'bear_use_adx': True, 'bear_use_spike': True, 'bear_rsi_required': True, 'sideways_strategy': 'breakout', 'sideways_bb_std_mult': 2.997662998731982, 'sideways_rsi_os': 31, 'sideways_rsi_ob': 93, 'sideways_adx_thresh': 14.592296631234525, 'sideways_atr_min_pct': 0.002961249127900317, 'sideways_atr_max_pct': 0.14469591678792515, 'sideways_tp_mult': 2.34493196228272, 'sideways_tsl_mult': 0.6136727552314163, 'sideways_time_stop': 211, 'sideways_use_sma': True, 'sideways_use_ema': False, 'sideways_use_atr': False, 'sideways_use_adx': True, 'sideways_use_spike': False, 'sideways_rsi_required': True}.
[I 2025-08-30 15:53:12,893] Trial 217 finished with values: [-1000000000.0, 1000000000.0] and parameters: {'p_sma': 46, 'p_std': 55, 'p_atr': 24, 'p_adx': 15, 'rsi_period': 30, 'ema1': 26, 'ema2': 56, 'slip_atr_k': 0.16076402085546532, 'slip_spread_k': 0.026447460150507737, 'spread_hl_frac': 0.04770735110437176, 'bb_std_mult': 0.9879243619834128, 'rsi_os': 16, 'rsi_ob': 53, 'vol_spike': 0.013476953455853534, 'adx_thresh': 26.13234675152677, 'atr_min_pct': 0.020846757026891823, 'atr_max_pct': 0.014212146848975774, 'tp_mult': 1.1523719224146247, 'tsl_mult': 0.24360281536626094, 'strategy': 'breakout', 'time_stop': 16, 'use_sma': True, 'use_atr': True, 'use_adx': False, 'use_ema': False, 'use_spike': True, 'rsi_required': False, 'edge_k': 1.8810358755065473, 'edge_cap': 0.5296393971443332, 'bull_strategy': 'breakout', 'bull_bb_std_mult': 1.9265320847983285, 'bull_rsi_os': 10, 'bull_rsi_ob': 77, 'bull_adx_thresh': 29.0098970018895, 'bull_atr_min_pct': 0.0010890805874909596, 'bull_atr_max_pct': 0.13969986187294306, 'bull_tp_mult': 1.7641392287400004, 'bull_tsl_mult': 0.3497883949154812, 'bull_time_stop': 82, 'bull_use_sma': True, 'bull_use_ema': True, 'bull_use_atr': False, 'bull_use_adx': False, 'bull_use_spike': True, 'bull_rsi_required': True, 'bear_strategy': 'mean_reversion', 'bear_bb_std_mult': 2.1201919405320204, 'bear_rsi_os': 15, 'bear_rsi_ob': 66, 'bear_adx_thresh': 13.58325823520187, 'bear_atr_min_pct': 0.028275183209020876, 'bear_atr_max_pct': 0.06259599637177048, 'bear_tp_mult': 2.303362373043838, 'bear_tsl_mult': 0.5436360162831315, 'bear_time_stop': 85, 'bear_use_sma': False, 'bear_use_ema': False, 'bear_use_atr': False, 'bear_use_adx': False, 'bear_use_spike': True, 'bear_rsi_required': False, 'sideways_strategy': 'breakout', 'sideways_bb_std_mult': 3.007627021192492, 'sideways_rsi_os': 31, 'sideways_rsi_ob': 92, 'sideways_adx_thresh': 13.427286909229165, 'sideways_atr_min_pct': 0.01785608157546833, 'sideways_atr_max_pct': 0.1469597637264952, 'sideways_tp_mult': 2.474352305760941, 'sideways_tsl_mult': 0.7847818264684471, 'sideways_time_stop': 221, 'sideways_use_sma': True, 'sideways_use_ema': False, 'sideways_use_atr': False, 'sideways_use_adx': True, 'sideways_use_spike': False, 'sideways_rsi_required': True}.
