[I 2025-08-30 16:45:18,394] Trial 515 finished with values: [-1000000000.0, 1000000000.0] and parameters: {'p_sma': 32, 'p_std': 16, 'p_atr': 17, 'p_adx': 27, 'rsi_period': 48, 'ema1': 11, 'ema2': 36, 'slip_atr_k': 0.013248417934123707, 'slip_spread_k': 0.6443136978268073, 'spread_hl_frac': 0.00027266909645533993, 'bb_std_mult': 3.1157667778533558, 'rsi_os': 37, 'rsi_ob': 88, 'vol_spike': 0.012077060857224682, 'adx_thresh': 14.00886451304842, 'atr_min_pct': 0.02462096572609156, 'atr_max_pct': 0.13357549641991287, 'tp_mult': 2.081560516508342, 'tsl_mult': 0.4358681603818108, 'strategy': 'mean_reversion', 'time_stop': 234, 'use_sma': False, 'use_atr': True, 'use_adx': True, 'use_ema': False, 'use_spike': False, 'rsi_required': True, 'edge_k': 1.4883788523810275, 'edge_cap': 0.30567599179100047, 'bull_strategy': 'mean_reversion', 'bull_bb_std_mult': 1.8528732284535114, 'bull_rsi_os': 11, 'bull_rsi_ob': 95, 'bull_adx_thresh': 26.360208452145386, 'bull_atr_min_pct': 0.02732564663302594, 'bull_atr_max_pct': 0.14436631810027323, 'bull_tp_mult': 1.667788771861952, 'bull_tsl_mult': 0.33840493937190097, 'bull_time_stop': 70, 'bull_use_sma': True, 'bull_use_ema': True, 'bull_use_atr': False, 'bull_use_adx': True, 'bull_use_spike': False, 'bull_rsi_required': True, 'bear_strategy': 'mean_reversion', 'bear_bb_std_mult': 2.0996939264732815, 'bear_rsi_os': 9, 'bear_rsi_ob': 79, 'bear_adx_thresh': 28.404340884175205, 'bear_atr_min_pct': 0.016510337858319683, 'bear_atr_max_pct': 0.08737622820435285, 'bear_tp_mult': 1.6748844314447402, 'bear_tsl_mult': 0.26366421550565733, 'bear_time_stop': 229, 'bear_use_sma': True, 'bear_use_ema': True, 'bear_use_atr': False, 'bear_use_adx': False, 'bear_use_spike': False, 'bear_rsi_required': False, 'sideways_strategy': 'breakout', 'sideways_bb_std_mult': 1.932824193960239, 'sideways_rsi_os': 30, 'sideways_rsi_ob': 89, 'sideways_adx_thresh': 31.686169140263218, 'sideways_atr_min_pct': 0.0030229087011684848, 'sideways_atr_max_pct': 0.13631123970616377, 'sideways_tp_mult': 1.4995018146836931, 'sideways_tsl_mult': 0.6542158285548054, 'sideways_time_stop': 300, 'sideways_use_sma': True, 'sideways_use_ema': False, 'sideways_use_atr': False, 'sideways_use_adx': False, 'sideways_use_spike': False, 'sideways_rsi_required': True}.
[I 2025-08-30 16:45:19,229] Trial 513 finished with values: [-1000000000.0, 1000000000.0] and parameters: {'p_sma': 7, 'p_std': 33, 'p_atr': 8, 'p_adx': 9, 'rsi_period': 66, 'ema1': 25, 'ema2': 15, 'slip_atr_k': 0.029069531106870772, 'slip_spread_k': 0.48758583222520213, 'spread_hl_frac': 0.004132139885437605, 'bb_std_mult': 3.031708478827644, 'rsi_os': 36, 'rsi_ob': 92, 'vol_spike': 0.0044864309043577055, 'adx_thresh': 13.323820258985076, 'atr_min_pct': 0.01847515708397075, 'atr_max_pct': 0.042294350880262885, 'tp_mult': 2.2281622126264398, 'tsl_mult': 0.7806604390391114, 'strategy': 'mean_reversion', 'time_stop': 11, 'use_sma': False, 'use_atr': True, 'use_adx': True, 'use_ema': False, 'use_spike': False, 'rsi_required': True, 'edge_k': 1.0995807840696235, 'edge_cap': 0.6159619139327897, 'bull_strategy': 'mean_reversion', 'bull_bb_std_mult': 1.9447744071516755, 'bull_rsi_os': 11, 'bull_rsi_ob': 62, 'bull_adx_thresh': 22.67850577684383, 'bull_atr_min_pct': 0.02701480224458857, 'bull_atr_max_pct': 0.14445780800258445, 'bull_tp_mult': 1.4027228306522788, 'bull_tsl_mult': 0.9415281626245067, 'bull_time_stop': 99, 'bull_use_sma': True, 'bull_use_ema': True, 'bull_use_atr': False, 'bull_use_adx': True, 'bull_use_spike': False, 'bull_rsi_required': False, 'bear_strategy': 'mean_reversion', 'bear_bb_std_mult': 1.924908051759858, 'bear_rsi_os': 16, 'bear_rsi_ob': 79, 'bear_adx_thresh': 25.342564271669964, 'bear_atr_min_pct': 0.02156750292506364, 'bear_atr_max_pct': 0.08963282974742713, 'bear_tp_mult': 1.6431261675175448, 'bear_tsl_mult': 0.6622940887543797, 'bear_time_stop': 227, 'bear_use_sma': True, 'bear_use_ema': False, 'bear_use_atr': False, 'bear_use_adx': False, 'bear_use_spike': False, 'bear_rsi_required': False, 'sideways_strategy': 'breakout', 'sideways_bb_std_mult': 1.4301648402666156, 'sideways_rsi_os': 27, 'sideways_rsi_ob': 92, 'sideways_adx_thresh': 17.407515917675347, 'sideways_atr_min_pct': 0.0029945307469558613, 'sideways_atr_max_pct': 0.13556475197491497, 'sideways_tp_mult': 1.3357745835040156, 'sideways_tsl_mult': 0.5478044012529093, 'sideways_time_stop': 209, 'sideways_use_sma': True, 'sideways_use_ema': False, 'sideways_use_atr': False, 'sideways_use_adx': False, 'sideways_use_spike': False, 'sideways_rsi_required': True}.
[I 2025-08-30 16:45:19,859] Trial 514 finished with values: [-1000000000.0, 1000000000.0] and parameters: {'p_sma': 7, 'p_std': 58, 'p_atr': 15, 'p_adx': 9, 'rsi_period': 24, 'ema1': 29, 'ema2': 42, 'slip_atr_k': 0.012625750698191435, 'slip_spread_k': 0.49729143579658464, 'spread_hl_frac': 0.017534093654466103, 'bb_std_mult': 3.209198358721407, 'rsi_os': 36, 'rsi_ob': 92, 'vol_spike': 0.00011804514757060965, 'adx_thresh': 13.65116687054336, 'atr_min_pct': 0.018356128729220673, 'atr_max_pct': 0.13404306059062768, 'tp_mult': 2.1767602254499567, 'tsl_mult': 0.4335969972558128, 'strategy': 'mean_reversion', 'time_stop': 11, 'use_sma': False, 'use_atr': True, 'use_adx': True, 'use_ema': False, 'use_spike': False, 'rsi_required': True, 'edge_k': 1.6125975845819258, 'edge_cap': 0.6208631474917505, 'bull_strategy': 'mean_reversion', 'bull_bb_std_mult': 1.9051609049417073, 'bull_rsi_os': 11, 'bull_rsi_ob': 45, 'bull_adx_thresh': 26.579854301568908, 'bull_atr_min_pct': 0.021861206619316207, 'bull_atr_max_pct': 0.1443230247611465, 'bull_tp_mult': 1.6648161118332196, 'bull_tsl_mult': 0.9483581475806833, 'bull_time_stop': 185, 'bull_use_sma': True, 'bull_use_ema': True, 'bull_use_atr': False, 'bull_use_adx': True, 'bull_use_spike': False, 'bull_rsi_required': True, 'bear_strategy': 'mean_reversion', 'bear_bb_std_mult': 1.8985847582896085, 'bear_rsi_os': 9, 'bear_rsi_ob': 79, 'bear_adx_thresh': 25.254034514527667, 'bear_atr_min_pct': 0.013583393887366086, 'bear_atr_max_pct': 0.14235697184453555, 'bear_tp_mult': 1.934842656575274, 'bear_tsl_mult': 0.6710909029371962, 'bear_time_stop': 228, 'bear_use_sma': True, 'bear_use_ema': False, 'bear_use_atr': False, 'bear_use_adx': False, 'bear_use_spike': False, 'bear_rsi_required': False, 'sideways_strategy': 'breakout', 'sideways_bb_std_mult': 2.091592629142843, 'sideways_rsi_os': 22, 'sideways_rsi_ob': 91, 'sideways_adx_thresh': 10.650471053868246, 'sideways_atr_min_pct': 0.028661847720693488, 'sideways_atr_max_pct': 0.059095817932531006, 'sideways_tp_mult': 1.3310320940597302, 'sideways_tsl_mult': 0.2678290327326331, 'sideways_time_stop': 209, 'sideways_use_sma': True, 'sideways_use_ema': False, 'sideways_use_atr': False, 'sideways_use_adx': False, 'sideways_use_spike': False, 'sideways_rsi_required': True}.
[I 2025-08-30 16:45:20,224] Trial 516 finished with values: [-1000000000.0, 1000000000.0] and parameters: {'p_sma': 11, 'p_std': 58, 'p_atr': 17, 'p_adx': 12, 'rsi_period': 24, 'ema1': 12, 'ema2': 27, 'slip_atr_k': 0.012738016510770032, 'slip_spread_k': 0.5798040491589069, 'spread_hl_frac': 0.014619200669757476, 'bb_std_mult': 1.8918758968614777, 'rsi_os': 36, 'rsi_ob': 88, 'vol_spike': 0.000498713622297209, 'adx_thresh': 5.03771524741984, 'atr_min_pct': 0.018467193308369934, 'atr_max_pct': 0.13337929166065388, 'tp_mult': 2.6987234690539235, 'tsl_mult': 0.6185021346994319, 'strategy': 'mean_reversion', 'time_stop': 94, 'use_sma': False, 'use_atr': True, 'use_adx': True, 'use_ema': False, 'use_spike': False, 'rsi_required': True, 'edge_k': 0.8911745532758484, 'edge_cap': 0.6184604556925903, 'bull_strategy': 'mean_reversion', 'bull_bb_std_mult': 1.8466087050153637, 'bull_rsi_os': 50, 'bull_rsi_ob': 64, 'bull_adx_thresh': 23.78005520860191, 'bull_atr_min_pct': 0.024849330877107702, 'bull_atr_max_pct': 0.033190928608070956, 'bull_tp_mult': 2.3476872420123045, 'bull_tsl_mult': 0.27815427212652266, 'bull_time_stop': 185, 'bull_use_sma': True, 'bull_use_ema': True, 'bull_use_atr': False, 'bull_use_adx': True, 'bull_use_spike': False, 'bull_rsi_required': True, 'bear_strategy': 'mean_reversion', 'bear_bb_std_mult': 2.095594196178291, 'bear_rsi_os': 10, 'bear_rsi_ob': 85, 'bear_adx_thresh': 26.054620319185506, 'bear_atr_min_pct': 0.02432062944328764, 'bear_atr_max_pct': 0.08772441530413412, 'bear_tp_mult': 2.197660050484523, 'bear_tsl_mult': 0.9213858184550758, 'bear_time_stop': 227, 'bear_use_sma': True, 'bear_use_ema': True, 'bear_use_atr': False, 'bear_use_adx': False, 'bear_use_spike': False, 'bear_rsi_required': False, 'sideways_strategy': 'breakout', 'sideways_bb_std_mult': 1.9393283187433998, 'sideways_rsi_os': 26, 'sideways_rsi_ob': 89, 'sideways_adx_thresh': 16.256465053563876, 'sideways_atr_min_pct': 0.0030709736685354374, 'sideways_atr_max_pct': 0.072867045525736, 'sideways_tp_mult': 1.289868820349655, 'sideways_tsl_mult': 0.6672745561469935, 'sideways_time_stop': 208, 'sideways_use_sma': True, 'sideways_use_ema': False, 'sideways_use_atr': False, 'sideways_use_adx': False, 'sideways_use_spike': False, 'sideways_rsi_required': True}.
[I 2025-08-30 16:45:21,339] Trial 517 finished with values: [-1000000000.0, 1000000000.0] and parameters: {'p_sma': 11, 'p_std': 58, 'p_atr': 15, 'p_adx': 18, 'rsi_period': 17, 'ema1': 23, 'ema2': 26, 'slip_atr_k': 0.009150286944358694, 'slip_spread_k': 0.46790957412446793, 'spread_hl_frac': 0.018016062952454323, 'bb_std_mult': 1.0687981366331547, 'rsi_os': 36, 'rsi_ob': 67, 'vol_spike': 0.004707822597325946, 'adx_thresh': 14.843526161763874, 'atr_min_pct': 0.017252719828428152, 'atr_max_pct': 0.017123293228955158, 'tp_mult': 2.7291932646240116, 'tsl_mult': 0.7807206048730901, 'strategy': 'mean_reversion', 'time_stop': 10, 'use_sma': False, 'use_atr': True, 'use_adx': True, 'use_ema': False, 'use_spike': False, 'rsi_required': True, 'edge_k': 1.615879283019278, 'edge_cap': 0.422979221630846, 'bull_strategy': 'mean_reversion', 'bull_bb_std_mult': 1.9855896824578905, 'bull_rsi_os': 8, 'bull_rsi_ob': 47, 'bull_adx_thresh': 8.43976222036598, 'bull_atr_min_pct': 0.02176059627304271, 'bull_atr_max_pct': 0.07311667678090068, 'bull_tp_mult': 1.1936335612601212, 'bull_tsl_mult': 0.28259486986790433, 'bull_time_stop': 188, 'bull_use_sma': True, 'bull_use_ema': True, 'bull_use_atr': False, 'bull_use_adx': True, 'bull_use_spike': True, 'bull_rsi_required': False, 'bear_strategy': 'mean_reversion', 'bear_bb_std_mult': 1.7926004408151957, 'bear_rsi_os': 16, 'bear_rsi_ob': 76, 'bear_adx_thresh': 14.314631696208235, 'bear_atr_min_pct': 0.0024801551744157626, 'bear_atr_max_pct': 0.09051830439269803, 'bear_tp_mult': 2.35635175651254, 'bear_tsl_mult': 0.6614468515648267, 'bear_time_stop': 225, 'bear_use_sma': True, 'bear_use_ema': False, 'bear_use_atr': False, 'bear_use_adx': False, 'bear_use_spike': False, 'bear_rsi_required': False, 'sideways_strategy': 'breakout', 'sideways_bb_std_mult': 2.0940319948911306, 'sideways_rsi_os': 27, 'sideways_rsi_ob': 92, 'sideways_adx_thresh': 16.001749184235553, 'sideways_atr_min_pct': 0.01738461164363358, 'sideways_atr_max_pct': 0.07429301534837393, 'sideways_tp_mult': 1.3379290928914094, 'sideways_tsl_mult': 0.4840194453865376, 'sideways_time_stop': 208, 'sideways_use_sma': True, 'sideways_use_ema': False, 'sideways_use_atr': True, 'sideways_use_adx': False, 'sideways_use_spike': False, 'sideways_rsi_required': True}.
[I 2025-08-30 16:45:21,714] Trial 520 finished with values: [-1000000000.0, 1000000000.0] and parameters: {'p_sma': 5, 'p_std': 60, 'p_atr': 10, 'p_adx': 25, 'rsi_period': 45, 'ema1': 19, 'ema2': 10, 'slip_atr_k': 0.008108500140097325, 'slip_spread_k': 0.5396489262613511, 'spread_hl_frac': 0.018962601724774424, 'bb_std_mult': 3.158525480869534, 'rsi_os': 35, 'rsi_ob': 89, 'vol_spike': 0.1358726950279029, 'adx_thresh': 14.86551255586435, 'atr_min_pct': 0.01720873492417033, 'atr_max_pct': 0.0166863819525344, 'tp_mult': 2.91319500888177, 'tsl_mult': 0.7498584413248135, 'strategy': 'breakout', 'time_stop': 29, 'use_sma': False, 'use_atr': True, 'use_adx': False, 'use_ema': False, 'use_spike': True, 'rsi_required': True, 'edge_k': 0.8482189048977643, 'edge_cap': 0.6808887574920633, 'bull_strategy': 'mean_reversion', 'bull_bb_std_mult': 2.9896796580376503, 'bull_rsi_os': 9, 'bull_rsi_ob': 47, 'bull_adx_thresh': 18.602881960171537, 'bull_atr_min_pct': 0.01953410528461535, 'bull_atr_max_pct': 0.13366875140078588, 'bull_tp_mult': 1.2650480511835438, 'bull_tsl_mult': 0.2904395731418854, 'bull_time_stop': 215, 'bull_use_sma': False, 'bull_use_ema': True, 'bull_use_atr': True, 'bull_use_adx': False, 'bull_use_spike': True, 'bull_rsi_required': False, 'bear_strategy': 'mean_reversion', 'bear_bb_std_mult': 0.6523489109579044, 'bear_rsi_os': 42, 'bear_rsi_ob': 76, 'bear_adx_thresh': 14.306355123343643, 'bear_atr_min_pct': 0.007497675722331019, 'bear_atr_max_pct': 0.02512751443716705, 'bear_tp_mult': 2.3577489005275134, 'bear_tsl_mult': 0.0021670298485940154, 'bear_time_stop': 19, 'bear_use_sma': True, 'bear_use_ema': False, 'bear_use_atr': False, 'bear_use_adx': False, 'bear_use_spike': False, 'bear_rsi_required': False, 'sideways_strategy': 'breakout', 'sideways_bb_std_mult': 1.832755209783428, 'sideways_rsi_os': 35, 'sideways_rsi_ob': 58, 'sideways_adx_thresh': 14.666426611343674, 'sideways_atr_min_pct': 0.018926605234819874, 'sideways_atr_max_pct': 0.148052199589511, 'sideways_tp_mult': 1.4903714559718955, 'sideways_tsl_mult': 0.4870738189370638, 'sideways_time_stop': 79, 'sideways_use_sma': True, 'sideways_use_ema': False, 'sideways_use_atr': True, 'sideways_use_adx': False, 'sideways_use_spike': False, 'sideways_rsi_required': True}.
[I 2025-08-30 16:45:22,912] Trial 522 finished with values: [-1000000000.0, 1000000000.0] and parameters: {'p_sma': 26, 'p_std': 39, 'p_atr': 25, 'p_adx': 23, 'rsi_period': 82, 'ema1': 26, 'ema2': 51, 'slip_atr_k': 0.005690563924923319, 'slip_spread_k': 0.604849690209364, 'spread_hl_frac': 0.016499807348231567, 'bb_std_mult': 2.3831620049095568, 'rsi_os': 38, 'rsi_ob': 46, 'vol_spike': 0.011639058950271078, 'adx_thresh': 33.468559861992894, 'atr_min_pct': 0.019444442726124212, 'atr_max_pct': 0.13705304805464427, 'tp_mult': 2.841241278944455, 'tsl_mult': 0.47654306316483536, 'strategy': 'mean_reversion', 'time_stop': 22, 'use_sma': False, 'use_atr': True, 'use_adx': True, 'use_ema': True, 'use_spike': False, 'rsi_required': True, 'edge_k': 1.5442433660389865, 'edge_cap': 0.5893883961321901, 'bull_strategy': 'mean_reversion', 'bull_bb_std_mult': 1.7702521150573562, 'bull_rsi_os': 13, 'bull_rsi_ob': 91, 'bull_adx_thresh': 20.726037860824462, 'bull_atr_min_pct': 0.020004513335128392, 'bull_atr_max_pct': 0.05527734052155618, 'bull_tp_mult': 1.3558601763680154, 'bull_tsl_mult': 0.31217809000290436, 'bull_time_stop': 201, 'bull_use_sma': False, 'bull_use_ema': True, 'bull_use_atr': True, 'bull_use_adx': True, 'bull_use_spike': False, 'bull_rsi_required': False, 'bear_strategy': 'breakout', 'bear_bb_std_mult': 1.5981373379970971, 'bear_rsi_os': 13, 'bear_rsi_ob': 72, 'bear_adx_thresh': 13.789807962656042, 'bear_atr_min_pct': 0.020388694768775386, 'bear_atr_max_pct': 0.09707162413234628, 'bear_tp_mult': 2.7955413715797572, 'bear_tsl_mult': 0.9997868769544667, 'bear_time_stop': 219, 'bear_use_sma': True, 'bear_use_ema': True, 'bear_use_atr': True, 'bear_use_adx': False, 'bear_use_spike': False, 'bear_rsi_required': False, 'sideways_strategy': 'breakout', 'sideways_bb_std_mult': 1.3410965825039018, 'sideways_rsi_os': 29, 'sideways_rsi_ob': 45, 'sideways_adx_thresh': 7.51053460472737, 'sideways_atr_min_pct': 0.001888443923789253, 'sideways_atr_max_pct': 0.14513500120440948, 'sideways_tp_mult': 1.4514525592250123, 'sideways_tsl_mult': 0.08272386734763582, 'sideways_time_stop': 108, 'sideways_use_sma': True, 'sideways_use_ema': True, 'sideways_use_atr': False, 'sideways_use_adx': False, 'sideways_use_spike': False, 'sideways_rsi_required': True}.
[I 2025-08-30 16:46:07,791] Trial 518 finished with values: [-1000000000.0, 1000000000.0] and parameters: {'p_sma': 5, 'p_std': 39, 'p_atr': 15, 'p_adx': 18, 'rsi_period': 24, 'ema1': 23, 'ema2': 20, 'slip_atr_k': 0.008940772073395404, 'slip_spread_k': 0.3088788150946027, 'spread_hl_frac': 0.017389005627571875, 'bb_std_mult': 3.1790217392023097, 'rsi_os': 36, 'rsi_ob': 62, 'vol_spike': 0.0003883965372020737, 'adx_thresh': 14.788570152481602, 'atr_min_pct': 0.019275757178614718, 'atr_max_pct': 0.13514583724524112, 'tp_mult': 2.9095660180526037, 'tsl_mult': 0.4423574870821667, 'strategy': 'mean_reversion', 'time_stop': 9, 'use_sma': False, 'use_atr': True, 'use_adx': True, 'use_ema': False, 'use_spike': False, 'rsi_required': True, 'edge_k': 1.6090313151676772, 'edge_cap': 0.5597226675369743, 'bull_strategy': 'mean_reversion', 'bull_bb_std_mult': 1.879222037610842, 'bull_rsi_os': 49, 'bull_rsi_ob': 49, 'bull_adx_thresh': 18.76096735575985, 'bull_atr_min_pct': 0.019607422793309306, 'bull_atr_max_pct': 0.027297134999225668, 'bull_tp_mult': 1.1019492124854993, 'bull_tsl_mult': 0.27679818242095644, 'bull_time_stop': 75, 'bull_use_sma': False, 'bull_use_ema': True, 'bull_use_atr': True, 'bull_use_adx': True, 'bull_use_spike': True, 'bull_rsi_required': True, 'bear_strategy': 'mean_reversion', 'bear_bb_std_mult': 1.6107579482366439, 'bear_rsi_os': 10, 'bear_rsi_ob': 76, 'bear_adx_thresh': 14.104727213570936, 'bear_atr_min_pct': 0.006949031381320666, 'bear_atr_max_pct': 0.1434874338108365, 'bear_tp_mult': 2.3549793743754, 'bear_tsl_mult': 0.2199114922614765, 'bear_time_stop': 222, 'bear_use_sma': True, 'bear_use_ema': True, 'bear_use_atr': False, 'bear_use_adx': False, 'bear_use_spike': False, 'bear_rsi_required': False, 'sideways_strategy': 'breakout', 'sideways_bb_std_mult': 2.85004219018976, 'sideways_rsi_os': 22, 'sideways_rsi_ob': 51, 'sideways_adx_thresh': 28.875500674107798, 'sideways_atr_min_pct': 0.0015716619372865865, 'sideways_atr_max_pct': 0.05160093172033012, 'sideways_tp_mult': 1.4792498339041997, 'sideways_tsl_mult': 0.2717244122348026, 'sideways_time_stop': 219, 'sideways_use_sma': True, 'sideways_use_ema': False, 'sideways_use_atr': True, 'sideways_use_adx': False, 'sideways_use_spike': False, 'sideways_rsi_required': True}.
[I 2025-08-30 16:46:09,159] Trial 519 finished with values: [-1000000000.0, 1000000000.0] and parameters: {'p_sma': 11, 'p_std': 47, 'p_atr': 25, 'p_adx': 12, 'rsi_period': 21, 'ema1': 20, 'ema2': 16, 'slip_atr_k': 0.006356012856368711, 'slip_spread_k': 0.5382512998108951, 'spread_hl_frac': 0.01458335275621393, 'bb_std_mult': 1.8885150991071349, 'rsi_os': 35, 'rsi_ob': 61, 'vol_spike': 0.13597182078965503, 'adx_thresh': 11.446905136288084, 'atr_min_pct': 0.014921367098184514, 'atr_max_pct': 0.14440500606697854, 'tp_mult': 2.708494506543528, 'tsl_mult': 0.8831846040314846, 'strategy': 'breakout', 'time_stop': 5, 'use_sma': False, 'use_atr': True, 'use_adx': False, 'use_ema': False, 'use_spike': False, 'rsi_required': True, 'edge_k': 0.8533704755109703, 'edge_cap': 0.6794298953304355, 'bull_strategy': 'mean_reversion', 'bull_bb_std_mult': 1.832543883278703, 'bull_rsi_os': 13, 'bull_rsi_ob': 47, 'bull_adx_thresh': 15.873582804733573, 'bull_atr_min_pct': 0.008504785956492967, 'bull_atr_max_pct': 0.0263901330174139, 'bull_tp_mult': 1.11314792138768, 'bull_tsl_mult': 0.45912012992055673, 'bull_time_stop': 75, 'bull_use_sma': False, 'bull_use_ema': True, 'bull_use_atr': True, 'bull_use_adx': False, 'bull_use_spike': True, 'bull_rsi_required': False, 'bear_strategy': 'mean_reversion', 'bear_bb_std_mult': 2.7593030240221057, 'bear_rsi_os': 13, 'bear_rsi_ob': 76, 'bear_adx_thresh': 14.345596092137328, 'bear_atr_min_pct': 0.006983879392952195, 'bear_atr_max_pct': 0.13430295949342644, 'bear_tp_mult': 2.334613397104902, 'bear_tsl_mult': 0.6209435826665098, 'bear_time_stop': 221, 'bear_use_sma': True, 'bear_use_ema': True, 'bear_use_atr': False, 'bear_use_adx': False, 'bear_use_spike': False, 'bear_rsi_required': False, 'sideways_strategy': 'breakout', 'sideways_bb_std_mult': 2.00416346109377, 'sideways_rsi_os': 26, 'sideways_rsi_ob': 60, 'sideways_adx_thresh': 28.92020285483204, 'sideways_atr_min_pct': 0.018892894899988515, 'sideways_atr_max_pct': 0.14592180056860787, 'sideways_tp_mult': 1.4930388596055075, 'sideways_tsl_mult': 0.027225677490066547, 'sideways_time_stop': 218, 'sideways_use_sma': True, 'sideways_use_ema': False, 'sideways_use_atr': True, 'sideways_use_adx': False, 'sideways_use_spike': False, 'sideways_rsi_required': True}.
