[I 2025-08-30 16:21:45,116] Trial 378 finished with values: [-1000000000.0, 1000000000.0] and parameters: {'p_sma': 7, 'p_std': 28, 'p_atr': 25, 'p_adx': 24, 'rsi_period': 49, 'ema1': 28, 'ema2': 16, 'slip_atr_k': 0.17588846873529954, 'slip_spread_k': 0.17962406573041084, 'spread_hl_frac': 0.016931401984604758, 'bb_std_mult': 3.1791738905600235, 'rsi_os': 37, 'rsi_ob': 64, 'vol_spike': 0.006556035257733878, 'adx_thresh': 32.128713667896385, 'atr_min_pct': 0.005359047243719316, 'atr_max_pct': 0.13330193324583323, 'tp_mult': 2.7265971166881977, 'tsl_mult': 0.40200047691545726, 'strategy': 'mean_reversion', 'time_stop': 221, 'use_sma': False, 'use_atr': False, 'use_adx': True, 'use_ema': True, 'use_spike': False, 'rsi_required': True, 'edge_k': 1.5062486417795005, 'edge_cap': 0.4194919308563503, 'bull_strategy': 'mean_reversion', 'bull_bb_std_mult': 1.8584871711666173, 'bull_rsi_os': 16, 'bull_rsi_ob': 54, 'bull_adx_thresh': 21.053705145074655, 'bull_atr_min_pct': 0.012206521297304743, 'bull_atr_max_pct': 0.06442119784597447, 'bull_tp_mult': 1.258934440677551, 'bull_tsl_mult': 0.4434786010957573, 'bull_time_stop': 263, 'bull_use_sma': False, 'bull_use_ema': True, 'bull_use_atr': True, 'bull_use_adx': True, 'bull_use_spike': True, 'bull_rsi_required': False, 'bear_strategy': 'breakout', 'bear_bb_std_mult': 1.8190337181461218, 'bear_rsi_os': 9, 'bear_rsi_ob': 89, 'bear_adx_thresh': 7.502256512554437, 'bear_atr_min_pct': 0.021339995723681202, 'bear_atr_max_pct': 0.12261254913689376, 'bear_tp_mult': 2.536640351300064, 'bear_tsl_mult': 0.6301725075815567, 'bear_time_stop': 135, 'bear_use_sma': True, 'bear_use_ema': False, 'bear_use_atr': False, 'bear_use_adx': False, 'bear_use_spike': False, 'bear_rsi_required': False, 'sideways_strategy': 'mean_reversion', 'sideways_bb_std_mult': 1.3639790914150358, 'sideways_rsi_os': 43, 'sideways_rsi_ob': 90, 'sideways_adx_thresh': 20.563749329893145, 'sideways_atr_min_pct': 0.011124316524591022, 'sideways_atr_max_pct': 0.1395816082281937, 'sideways_tp_mult': 1.5057910792963103, 'sideways_tsl_mult': 0.433309561245122, 'sideways_time_stop': 203, 'sideways_use_sma': False, 'sideways_use_ema': True, 'sideways_use_atr': False, 'sideways_use_adx': False, 'sideways_use_spike': True, 'sideways_rsi_required': True}.
[I 2025-08-30 16:21:46,193] Trial 381 finished with values: [-1000000000.0, 1000000000.0] and parameters: {'p_sma': 8, 'p_std': 32, 'p_atr': 23, 'p_adx': 7, 'rsi_period': 20, 'ema1': 27, 'ema2': 14, 'slip_atr_k': 0.014013400188724705, 'slip_spread_k': 0.5193484026507383, 'spread_hl_frac': 0.002348294275666029, 'bb_std_mult': 3.1688733585260747, 'rsi_os': 33, 'rsi_ob': 90, 'vol_spike': 0.24534774309290475, 'adx_thresh': 12.35733034323305, 'atr_min_pct': 0.020275687561341352, 'atr_max_pct': 0.018276494632358704, 'tp_mult': 2.7298007022987933, 'tsl_mult': 0.8280675386704142, 'strategy': 'mean_reversion', 'time_stop': 225, 'use_sma': False, 'use_atr': True, 'use_adx': True, 'use_ema': False, 'use_spike': False, 'rsi_required': True, 'edge_k': 1.5792792661725032, 'edge_cap': 0.323132994877242, 'bull_strategy': 'mean_reversion', 'bull_bb_std_mult': 2.8891715310020794, 'bull_rsi_os': 43, 'bull_rsi_ob': 69, 'bull_adx_thresh': 22.035702338559762, 'bull_atr_min_pct': 0.01236671739749443, 'bull_atr_max_pct': 0.037761019321210794, 'bull_tp_mult': 2.849707319519368, 'bull_tsl_mult': 0.4410737325250911, 'bull_time_stop': 264, 'bull_use_sma': False, 'bull_use_ema': False, 'bull_use_atr': True, 'bull_use_adx': True, 'bull_use_spike': False, 'bull_rsi_required': False, 'bear_strategy': 'mean_reversion', 'bear_bb_std_mult': 1.9781913172352343, 'bear_rsi_os': 24, 'bear_rsi_ob': 65, 'bear_adx_thresh': 32.6501039087763, 'bear_atr_min_pct': 0.023905307896769555, 'bear_atr_max_pct': 0.11883449957267755, 'bear_tp_mult': 1.408696639203225, 'bear_tsl_mult': 0.4180404748192825, 'bear_time_stop': 169, 'bear_use_sma': True, 'bear_use_ema': True, 'bear_use_atr': False, 'bear_use_adx': False, 'bear_use_spike': False, 'bear_rsi_required': False, 'sideways_strategy': 'breakout', 'sideways_bb_std_mult': 1.9762054758548895, 'sideways_rsi_os': 28, 'sideways_rsi_ob': 94, 'sideways_adx_thresh': 27.012808589970472, 'sideways_atr_min_pct': 0.001089068979764174, 'sideways_atr_max_pct': 0.10495671764222167, 'sideways_tp_mult': 1.4654980562676185, 'sideways_tsl_mult': 0.5004475763468903, 'sideways_time_stop': 206, 'sideways_use_sma': True, 'sideways_use_ema': False, 'sideways_use_atr': False, 'sideways_use_adx': False, 'sideways_use_spike': False, 'sideways_rsi_required': False}.
[I 2025-08-30 16:21:46,614] Trial 382 finished with values: [-1000000000.0, 1000000000.0] and parameters: {'p_sma': 8, 'p_std': 32, 'p_atr': 19, 'p_adx': 27, 'rsi_period': 20, 'ema1': 26, 'ema2': 11, 'slip_atr_k': 0.012759136170546243, 'slip_spread_k': 0.8343609367597814, 'spread_hl_frac': 0.0160063737521597, 'bb_std_mult': 3.055163328464406, 'rsi_os': 28, 'rsi_ob': 47, 'vol_spike': 0.15831029942858135, 'adx_thresh': 6.844466671806726, 'atr_min_pct': 0.014203593884940614, 'atr_max_pct': 0.13708303259493648, 'tp_mult': 2.837481286328371, 'tsl_mult': 0.4873115336875942, 'strategy': 'mean_reversion', 'time_stop': 85, 'use_sma': False, 'use_atr': True, 'use_adx': True, 'use_ema': False, 'use_spike': False, 'rsi_required': True, 'edge_k': 1.351780521007377, 'edge_cap': 0.24413456691161461, 'bull_strategy': 'mean_reversion', 'bull_bb_std_mult': 2.0586238732642066, 'bull_rsi_os': 14, 'bull_rsi_ob': 51, 'bull_adx_thresh': 22.063415825065917, 'bull_atr_min_pct': 0.007115637528490613, 'bull_atr_max_pct': 0.1346055028399373, 'bull_tp_mult': 1.5292681525825482, 'bull_tsl_mult': 0.6988474030554034, 'bull_time_stop': 220, 'bull_use_sma': False, 'bull_use_ema': False, 'bull_use_atr': True, 'bull_use_adx': True, 'bull_use_spike': False, 'bull_rsi_required': False, 'bear_strategy': 'mean_reversion', 'bear_bb_std_mult': 1.9717302255916453, 'bear_rsi_os': 52, 'bear_rsi_ob': 78, 'bear_adx_thresh': 27.729201121280056, 'bear_atr_min_pct': 0.020242279070886073, 'bear_atr_max_pct': 0.08801914875162656, 'bear_tp_mult': 2.1353716242854595, 'bear_tsl_mult': 0.3954685733931932, 'bear_time_stop': 232, 'bear_use_sma': True, 'bear_use_ema': True, 'bear_use_atr': False, 'bear_use_adx': False, 'bear_use_spike': False, 'bear_rsi_required': True, 'sideways_strategy': 'breakout', 'sideways_bb_std_mult': 2.657308059182327, 'sideways_rsi_os': 28, 'sideways_rsi_ob': 94, 'sideways_adx_thresh': 15.29592722769571, 'sideways_atr_min_pct': 0.0008316026305446956, 'sideways_atr_max_pct': 0.14311340657782964, 'sideways_tp_mult': 1.1205541277968294, 'sideways_tsl_mult': 0.20473985927034188, 'sideways_time_stop': 207, 'sideways_use_sma': True, 'sideways_use_ema': False, 'sideways_use_atr': True, 'sideways_use_adx': False, 'sideways_use_spike': False, 'sideways_rsi_required': False}.
[I 2025-08-30 16:22:32,274] Trial 380 finished with values: [-1000000000.0, 1000000000.0] and parameters: {'p_sma': 5, 'p_std': 27, 'p_atr': 23, 'p_adx': 21, 'rsi_period': 25, 'ema1': 28, 'ema2': 14, 'slip_atr_k': 0.013102511236484638, 'slip_spread_k': 0.508934654390197, 'spread_hl_frac': 0.004671798447048743, 'bb_std_mult': 0.5700168450791148, 'rsi_os': 33, 'rsi_ob': 89, 'vol_spike': 0.1584828116762124, 'adx_thresh': 11.640854412006869, 'atr_min_pct': 0.020383178210827683, 'atr_max_pct': 0.137708444292105, 'tp_mult': 2.744057396422951, 'tsl_mult': 0.47902420286376757, 'strategy': 'mean_reversion', 'time_stop': 178, 'use_sma': False, 'use_atr': True, 'use_adx': True, 'use_ema': True, 'use_spike': False, 'rsi_required': True, 'edge_k': 1.5912634249020465, 'edge_cap': 0.3269235331679896, 'bull_strategy': 'mean_reversion', 'bull_bb_std_mult': 1.9318425116443374, 'bull_rsi_os': 14, 'bull_rsi_ob': 51, 'bull_adx_thresh': 22.08492995849763, 'bull_atr_min_pct': 0.018046604887121384, 'bull_atr_max_pct': 0.1311135581102583, 'bull_tp_mult': 1.6869320080822048, 'bull_tsl_mult': 0.700018176672428, 'bull_time_stop': 100, 'bull_use_sma': False, 'bull_use_ema': True, 'bull_use_atr': True, 'bull_use_adx': True, 'bull_use_spike': False, 'bull_rsi_required': False, 'bear_strategy': 'breakout', 'bear_bb_std_mult': 2.1312184950983797, 'bear_rsi_os': 15, 'bear_rsi_ob': 88, 'bear_adx_thresh': 13.37181484620095, 'bear_atr_min_pct': 0.023685416108209827, 'bear_atr_max_pct': 0.03859769110006432, 'bear_tp_mult': 2.6115922529910867, 'bear_tsl_mult': 0.6231104601914171, 'bear_time_stop': 62, 'bear_use_sma': True, 'bear_use_ema': True, 'bear_use_atr': False, 'bear_use_adx': False, 'bear_use_spike': False, 'bear_rsi_required': False, 'sideways_strategy': 'breakout', 'sideways_bb_std_mult': 1.9929150025807416, 'sideways_rsi_os': 43, 'sideways_rsi_ob': 94, 'sideways_adx_thresh': 15.230979691135449, 'sideways_atr_min_pct': 0.011187503279469291, 'sideways_atr_max_pct': 0.14286685008922795, 'sideways_tp_mult': 1.1493578052559354, 'sideways_tsl_mult': 0.4426207746973527, 'sideways_time_stop': 204, 'sideways_use_sma': False, 'sideways_use_ema': True, 'sideways_use_atr': False, 'sideways_use_adx': False, 'sideways_use_spike': False, 'sideways_rsi_required': False}.
[I 2025-08-30 16:22:33,206] Trial 384 finished with values: [-1000000000.0, 1000000000.0] and parameters: {'p_sma': 5, 'p_std': 57, 'p_atr': 14, 'p_adx': 23, 'rsi_period': 9, 'ema1': 26, 'ema2': 54, 'slip_atr_k': 0.006297819839881477, 'slip_spread_k': 0.8056579421987193, 'spread_hl_frac': 0.015299178215640492, 'bb_std_mult': 3.3003114522676755, 'rsi_os': 31, 'rsi_ob': 84, 'vol_spike': 0.01718424781776736, 'adx_thresh': 13.497355362233549, 'atr_min_pct': 0.003301404394155166, 'atr_max_pct': 0.13792728961488954, 'tp_mult': 1.4135488747579603, 'tsl_mult': 0.46340806139506135, 'strategy': 'mean_reversion', 'time_stop': 16, 'use_sma': False, 'use_atr': True, 'use_adx': True, 'use_ema': False, 'use_spike': False, 'rsi_required': True, 'edge_k': 1.5491813627267017, 'edge_cap': 0.6118164605806721, 'bull_strategy': 'mean_reversion', 'bull_bb_std_mult': 1.9422641929778872, 'bull_rsi_os': 53, 'bull_rsi_ob': 51, 'bull_adx_thresh': 11.897105753326898, 'bull_atr_min_pct': 0.018205643575891935, 'bull_atr_max_pct': 0.13186629991906204, 'bull_tp_mult': 1.352497832755172, 'bull_tsl_mult': 0.3102953247792736, 'bull_time_stop': 59, 'bull_use_sma': False, 'bull_use_ema': True, 'bull_use_atr': True, 'bull_use_adx': True, 'bull_use_spike': False, 'bull_rsi_required': False, 'bear_strategy': 'mean_reversion', 'bear_bb_std_mult': 1.4692645140710172, 'bear_rsi_os': 13, 'bear_rsi_ob': 76, 'bear_adx_thresh': 14.310514283682814, 'bear_atr_min_pct': 0.02201299799072301, 'bear_atr_max_pct': 0.037607006501252226, 'bear_tp_mult': 2.21798535504665, 'bear_tsl_mult': 0.9701574439158398, 'bear_time_stop': 215, 'bear_use_sma': True, 'bear_use_ema': False, 'bear_use_atr': False, 'bear_use_adx': False, 'bear_use_spike': False, 'bear_rsi_required': False, 'sideways_strategy': 'breakout', 'sideways_bb_std_mult': 2.390743269973608, 'sideways_rsi_os': 30, 'sideways_rsi_ob': 66, 'sideways_adx_thresh': 17.118512493413355, 'sideways_atr_min_pct': 0.019773514949710632, 'sideways_atr_max_pct': 0.14305042801830292, 'sideways_tp_mult': 1.1639635625851885, 'sideways_tsl_mult': 0.4558665230040463, 'sideways_time_stop': 217, 'sideways_use_sma': True, 'sideways_use_ema': False, 'sideways_use_atr': False, 'sideways_use_adx': False, 'sideways_use_spike': False, 'sideways_rsi_required': True}.
[I 2025-08-30 16:22:33,819] Trial 383 finished with values: [-1000000000.0, 1000000000.0] and parameters: {'p_sma': 5, 'p_std': 38, 'p_atr': 24, 'p_adx': 19, 'rsi_period': 65, 'ema1': 26, 'ema2': 11, 'slip_atr_k': 0.010688153161178387, 'slip_spread_k': 0.4828134655933708, 'spread_hl_frac': 0.015792544868550338, 'bb_std_mult': 0.5611802743238734, 'rsi_os': 34, 'rsi_ob': 86, 'vol_spike': 0.013968471065183001, 'adx_thresh': 13.371958952143096, 'atr_min_pct': 0.028171534002338593, 'atr_max_pct': 0.1362999165203965, 'tp_mult': 2.8155296306289146, 'tsl_mult': 0.4831909781095617, 'strategy': 'mean_reversion', 'time_stop': 59, 'use_sma': False, 'use_atr': True, 'use_adx': True, 'use_ema': False, 'use_spike': False, 'rsi_required': True, 'edge_k': 1.5517767915609293, 'edge_cap': 0.2464999687267499, 'bull_strategy': 'mean_reversion', 'bull_bb_std_mult': 1.9516031403671614, 'bull_rsi_os': 9, 'bull_rsi_ob': 51, 'bull_adx_thresh': 22.076161152029965, 'bull_atr_min_pct': 0.0180317717942102, 'bull_atr_max_pct': 0.14961397702929452, 'bull_tp_mult': 1.5292014721052438, 'bull_tsl_mult': 0.5851901503872281, 'bull_time_stop': 62, 'bull_use_sma': False, 'bull_use_ema': True, 'bull_use_atr': True, 'bull_use_adx': True, 'bull_use_spike': False, 'bull_rsi_required': False, 'bear_strategy': 'mean_reversion', 'bear_bb_std_mult': 2.1635515650268595, 'bear_rsi_os': 13, 'bear_rsi_ob': 78, 'bear_adx_thresh': 6.022257098919109, 'bear_atr_min_pct': 0.022115942892214552, 'bear_atr_max_pct': 0.037895514871314914, 'bear_tp_mult': 2.2172458597905274, 'bear_tsl_mult': 0.6533651549539008, 'bear_time_stop': 230, 'bear_use_sma': True, 'bear_use_ema': False, 'bear_use_atr': False, 'bear_use_adx': False, 'bear_use_spike': False, 'bear_rsi_required': True, 'sideways_strategy': 'breakout', 'sideways_bb_std_mult': 0.9550605771329139, 'sideways_rsi_os': 40, 'sideways_rsi_ob': 66, 'sideways_adx_thresh': 18.926467144593648, 'sideways_atr_min_pct': 0.0009329329181838095, 'sideways_atr_max_pct': 0.14305755678438142, 'sideways_tp_mult': 1.115069443939358, 'sideways_tsl_mult': 0.4875341310812037, 'sideways_time_stop': 104, 'sideways_use_sma': True, 'sideways_use_ema': False, 'sideways_use_atr': True, 'sideways_use_adx': False, 'sideways_use_spike': False, 'sideways_rsi_required': True}.
[I 2025-08-30 16:22:34,119] Trial 379 finished with values: [-1000000000.0, 1000000000.0] and parameters: {'p_sma': 5, 'p_std': 51, 'p_atr': 23, 'p_adx': 7, 'rsi_period': 14, 'ema1': 27, 'ema2': 16, 'slip_atr_k': 0.012873379779346404, 'slip_spread_k': 0.4782316800454506, 'spread_hl_frac': 0.016573746455126978, 'bb_std_mult': 3.1726247585228116, 'rsi_os': 33, 'rsi_ob': 90, 'vol_spike': 0.0055907507880870585, 'adx_thresh': 32.4041840743628, 'atr_min_pct': 0.018195848511684546, 'atr_max_pct': 0.13737802021483966, 'tp_mult': 2.7420682945709816, 'tsl_mult': 0.48921876745343645, 'strategy': 'mean_reversion', 'time_stop': 10, 'use_sma': False, 'use_atr': False, 'use_adx': True, 'use_ema': True, 'use_spike': False, 'rsi_required': True, 'edge_k': 1.5236676976317973, 'edge_cap': 0.32579474102212447, 'bull_strategy': 'mean_reversion', 'bull_bb_std_mult': 2.0671780490823575, 'bull_rsi_os': 53, 'bull_rsi_ob': 69, 'bull_adx_thresh': 21.087617172378337, 'bull_atr_min_pct': 0.006426611055723798, 'bull_atr_max_pct': 0.06423328290131011, 'bull_tp_mult': 1.6868724184525306, 'bull_tsl_mult': 0.6928732113636221, 'bull_time_stop': 58, 'bull_use_sma': False, 'bull_use_ema': True, 'bull_use_atr': True, 'bull_use_adx': True, 'bull_use_spike': True, 'bull_rsi_required': False, 'bear_strategy': 'breakout', 'bear_bb_std_mult': 2.1072841488336556, 'bear_rsi_os': 9, 'bear_rsi_ob': 78, 'bear_adx_thresh': 12.053390133348449, 'bear_atr_min_pct': 0.01118691871876615, 'bear_atr_max_pct': 0.11947919268381518, 'bear_tp_mult': 2.1346514470106235, 'bear_tsl_mult': 0.9575977440259864, 'bear_time_stop': 230, 'bear_use_sma': True, 'bear_use_ema': False, 'bear_use_atr': False, 'bear_use_adx': False, 'bear_use_spike': False, 'bear_rsi_required': False, 'sideways_strategy': 'mean_reversion', 'sideways_bb_std_mult': 1.431880317605898, 'sideways_rsi_os': 28, 'sideways_rsi_ob': 90, 'sideways_adx_thresh': 16.167735310140245, 'sideways_atr_min_pct': 0.0009233867638246427, 'sideways_atr_max_pct': 0.1380959060532407, 'sideways_tp_mult': 1.5260319297390486, 'sideways_tsl_mult': 0.43566451637191683, 'sideways_time_stop': 205, 'sideways_use_sma': False, 'sideways_use_ema': True, 'sideways_use_atr': False, 'sideways_use_adx': False, 'sideways_use_spike': True, 'sideways_rsi_required': True}.
[I 2025-08-30 16:23:19,003] Trial 386 finished with values: [-1000000000.0, 1000000000.0] and parameters: {'p_sma': 28, 'p_std': 38, 'p_atr': 16, 'p_adx': 11, 'rsi_period': 18, 'ema1': 25, 'ema2': 46, 'slip_atr_k': 0.004449477991976812, 'slip_spread_k': 0.5448631732445003, 'spread_hl_frac': 0.02017174471028193, 'bb_std_mult': 3.531801688299899, 'rsi_os': 34, 'rsi_ob': 86, 'vol_spike': 0.2705605801317629, 'adx_thresh': 12.978845674834984, 'atr_min_pct': 0.028349548550118033, 'atr_max_pct': 0.07439957749897981, 'tp_mult': 2.421815565499476, 'tsl_mult': 0.44853289101056026, 'strategy': 'mean_reversion', 'time_stop': 5, 'use_sma': True, 'use_atr': True, 'use_adx': True, 'use_ema': False, 'use_spike': False, 'rsi_required': True, 'edge_k': 1.7028133390473994, 'edge_cap': 0.2646955418935219, 'bull_strategy': 'mean_reversion', 'bull_bb_std_mult': 2.36715545089344, 'bull_rsi_os': 9, 'bull_rsi_ob': 71, 'bull_adx_thresh': 20.32014302429104, 'bull_atr_min_pct': 0.025681983704329277, 'bull_atr_max_pct': 0.031533053811799515, 'bull_tp_mult': 2.7668504051954828, 'bull_tsl_mult': 0.2847566077858207, 'bull_time_stop': 154, 'bull_use_sma': False, 'bull_use_ema': True, 'bull_use_atr': True, 'bull_use_adx': True, 'bull_use_spike': False, 'bull_rsi_required': False, 'bear_strategy': 'mean_reversion', 'bear_bb_std_mult': 2.9686084696089265, 'bear_rsi_os': 40, 'bear_rsi_ob': 79, 'bear_adx_thresh': 12.487186076809131, 'bear_atr_min_pct': 0.009053717899504767, 'bear_atr_max_pct': 0.09079438363237802, 'bear_tp_mult': 1.2073487419553068, 'bear_tsl_mult': 0.6522042599595652, 'bear_time_stop': 153, 'bear_use_sma': True, 'bear_use_ema': False, 'bear_use_atr': False, 'bear_use_adx': True, 'bear_use_spike': False, 'bear_rsi_required': True, 'sideways_strategy': 'breakout', 'sideways_bb_std_mult': 1.2394545841804583, 'sideways_rsi_os': 23, 'sideways_rsi_ob': 92, 'sideways_adx_thresh': 18.49700142649895, 'sideways_atr_min_pct': 0.016407606944632294, 'sideways_atr_max_pct': 0.1273243543891494, 'sideways_tp_mult': 1.9572084371372798, 'sideways_tsl_mult': 0.48641551931941945, 'sideways_time_stop': 217, 'sideways_use_sma': True, 'sideways_use_ema': False, 'sideways_use_atr': True, 'sideways_use_adx': False, 'sideways_use_spike': False, 'sideways_rsi_required': True}.
[I 2025-08-30 16:23:19,027] Trial 388 finished with values: [-1000000000.0, 1000000000.0] and parameters: {'p_sma': 28, 'p_std': 58, 'p_atr': 27, 'p_adx': 22, 'rsi_period': 17, 'ema1': 19, 'ema2': 46, 'slip_atr_k': 0.030203485910759876, 'slip_spread_k': 0.7277246077712599, 'spread_hl_frac': 0.018425009810237175, 'bb_std_mult': 1.3476167398571866, 'rsi_os': 36, 'rsi_ob': 94, 'vol_spike': 0.10463131729040029, 'adx_thresh': 12.610302367689247, 'atr_min_pct': 0.01884329517217303, 'atr_max_pct': 0.14341015726939516, 'tp_mult': 2.422395555217124, 'tsl_mult': 0.45364172079051907, 'strategy': 'mean_reversion', 'time_stop': 5, 'use_sma': True, 'use_atr': True, 'use_adx': True, 'use_ema': False, 'use_spike': False, 'rsi_required': True, 'edge_k': 1.7857402252532752, 'edge_cap': 0.6372972242519129, 'bull_strategy': 'mean_reversion', 'bull_bb_std_mult': 1.7210506264245578, 'bull_rsi_os': 9, 'bull_rsi_ob': 87, 'bull_adx_thresh': 20.460836934459962, 'bull_atr_min_pct': 0.027384997694226518, 'bull_atr_max_pct': 0.031055302910321665, 'bull_tp_mult': 1.4190615605778976, 'bull_tsl_mult': 0.28917749007821564, 'bull_time_stop': 49, 'bull_use_sma': False, 'bull_use_ema': False, 'bull_use_atr': True, 'bull_use_adx': True, 'bull_use_spike': False, 'bull_rsi_required': False, 'bear_strategy': 'mean_reversion', 'bear_bb_std_mult': 2.048870254583324, 'bear_rsi_os': 11, 'bear_rsi_ob': 74, 'bear_adx_thresh': 34.26288518510563, 'bear_atr_min_pct': 0.02294660555263977, 'bear_atr_max_pct': 0.04875888752023684, 'bear_tp_mult': 1.1647895035849571, 'bear_tsl_mult': 0.16228021678658894, 'bear_time_stop': 295, 'bear_use_sma': True, 'bear_use_ema': False, 'bear_use_atr': True, 'bear_use_adx': True, 'bear_use_spike': False, 'bear_rsi_required': False, 'sideways_strategy': 'breakout', 'sideways_bb_std_mult': 2.021330915964582, 'sideways_rsi_os': 25, 'sideways_rsi_ob': 92, 'sideways_adx_thresh': 23.005742393459826, 'sideways_atr_min_pct': 0.016449187503315855, 'sideways_atr_max_pct': 0.02834900304281543, 'sideways_tp_mult': 1.3871208951017293, 'sideways_tsl_mult': 0.5117175915724989, 'sideways_time_stop': 216, 'sideways_use_sma': True, 'sideways_use_ema': False, 'sideways_use_atr': False, 'sideways_use_adx': False, 'sideways_use_spike': False, 'sideways_rsi_required': True}.
