[I 2025-08-30 16:02:45,298] Trial 271 finished with values: [-1000000000.0, 1000000000.0] and parameters: {'p_sma': 49, 'p_std': 59, 'p_atr': 18, 'p_adx': 14, 'rsi_period': 34, 'ema1': 27, 'ema2': 60, 'slip_atr_k': 0.21031368501657718, 'slip_spread_k': 0.11291842177072225, 'spread_hl_frac': 0.04726998075551552, 'bb_std_mult': 2.91148060251627, 'rsi_os': 37, 'rsi_ob': 54, 'vol_spike': 0.07138629357572501, 'adx_thresh': 26.506819121822268, 'atr_min_pct': 0.02089236071668127, 'atr_max_pct': 0.01822529116176743, 'tp_mult': 1.074987024555293, 'tsl_mult': 0.182822437333517, 'strategy': 'breakout', 'time_stop': 48, 'use_sma': False, 'use_atr': True, 'use_adx': False, 'use_ema': True, 'use_spike': False, 'rsi_required': False, 'edge_k': 1.8329439848000213, 'edge_cap': 0.8316167538265054, 'bull_strategy': 'breakout', 'bull_bb_std_mult': 1.933513735647923, 'bull_rsi_os': 11, 'bull_rsi_ob': 61, 'bull_adx_thresh': 30.910268877085787, 'bull_atr_min_pct': 0.011841550660276944, 'bull_atr_max_pct': 0.11672061505888331, 'bull_tp_mult': 1.7804774722450492, 'bull_tsl_mult': 0.338920345982194, 'bull_time_stop': 77, 'bull_use_sma': False, 'bull_use_ema': False, 'bull_use_atr': True, 'bull_use_adx': False, 'bull_use_spike': False, 'bull_rsi_required': True, 'bear_strategy': 'breakout', 'bear_bb_std_mult': 1.0291156032001456, 'bear_rsi_os': 26, 'bear_rsi_ob': 74, 'bear_adx_thresh': 28.564303008819568, 'bear_atr_min_pct': 0.028054601472955278, 'bear_atr_max_pct': 0.10539018030604325, 'bear_tp_mult': 1.8612045547364722, 'bear_tsl_mult': 0.7048925778403179, 'bear_time_stop': 69, 'bear_use_sma': True, 'bear_use_ema': False, 'bear_use_atr': False, 'bear_use_adx': False, 'bear_use_spike': True, 'bear_rsi_required': False, 'sideways_strategy': 'breakout', 'sideways_bb_std_mult': 3.114330710225109, 'sideways_rsi_os': 31, 'sideways_rsi_ob': 67, 'sideways_adx_thresh': 9.38079901397526, 'sideways_atr_min_pct': 0.011112133922532422, 'sideways_atr_max_pct': 0.1499599362056808, 'sideways_tp_mult': 2.8205814904757465, 'sideways_tsl_mult': 0.7103146566044534, 'sideways_time_stop': 159, 'sideways_use_sma': True, 'sideways_use_ema': False, 'sideways_use_atr': False, 'sideways_use_adx': False, 'sideways_use_spike': False, 'sideways_rsi_required': True}.
[I 2025-08-30 16:03:29,611] Trial 270 finished with values: [-1000000000.0, 1000000000.0] and parameters: {'p_sma': 14, 'p_std': 42, 'p_atr': 25, 'p_adx': 27, 'rsi_period': 57, 'ema1': 13, 'ema2': 60, 'slip_atr_k': 0.15716885696248567, 'slip_spread_k': 0.11274220870761786, 'spread_hl_frac': 0.047700162491717726, 'bb_std_mult': 0.853021053724685, 'rsi_os': 37, 'rsi_ob': 54, 'vol_spike': 0.07089275198989596, 'adx_thresh': 6.003733744890882, 'atr_min_pct': 0.016422017293375463, 'atr_max_pct': 0.13912230376604487, 'tp_mult': 1.0688196116495616, 'tsl_mult': 0.1839455045633362, 'strategy': 'breakout', 'time_stop': 47, 'use_sma': False, 'use_atr': True, 'use_adx': False, 'use_ema': True, 'use_spike': False, 'rsi_required': False, 'edge_k': 0.012511758592808508, 'edge_cap': 0.6276766999167196, 'bull_strategy': 'breakout', 'bull_bb_std_mult': 0.697208159403196, 'bull_rsi_os': 40, 'bull_rsi_ob': 61, 'bull_adx_thresh': 19.264552688606102, 'bull_atr_min_pct': 0.022210784882604452, 'bull_atr_max_pct': 0.10486463185082756, 'bull_tp_mult': 2.026124251042627, 'bull_tsl_mult': 0.2943554069487002, 'bull_time_stop': 76, 'bull_use_sma': False, 'bull_use_ema': False, 'bull_use_atr': True, 'bull_use_adx': False, 'bull_use_spike': False, 'bull_rsi_required': True, 'bear_strategy': 'breakout', 'bear_bb_std_mult': 2.0651307911064944, 'bear_rsi_os': 22, 'bear_rsi_ob': 75, 'bear_adx_thresh': 25.080089073909864, 'bear_atr_min_pct': 0.022060566661546363, 'bear_atr_max_pct': 0.10248460200460657, 'bear_tp_mult': 1.265971792464021, 'bear_tsl_mult': 0.33044466905017683, 'bear_time_stop': 263, 'bear_use_sma': True, 'bear_use_ema': False, 'bear_use_atr': False, 'bear_use_adx': False, 'bear_use_spike': True, 'bear_rsi_required': False, 'sideways_strategy': 'breakout', 'sideways_bb_std_mult': 2.3654009887053227, 'sideways_rsi_os': 31, 'sideways_rsi_ob': 67, 'sideways_adx_thresh': 29.457759695491777, 'sideways_atr_min_pct': 0.016019236522647643, 'sideways_atr_max_pct': 0.03381161050893609, 'sideways_tp_mult': 1.4246279890890892, 'sideways_tsl_mult': 0.7192344753095258, 'sideways_time_stop': 214, 'sideways_use_sma': True, 'sideways_use_ema': False, 'sideways_use_atr': False, 'sideways_use_adx': False, 'sideways_use_spike': False, 'sideways_rsi_required': True}.
[I 2025-08-30 16:03:30,264] Trial 272 finished with values: [-1000000000.0, 1000000000.0] and parameters: {'p_sma': 14, 'p_std': 58, 'p_atr': 25, 'p_adx': 24, 'rsi_period': 34, 'ema1': 7, 'ema2': 60, 'slip_atr_k': 0.007205178675354501, 'slip_spread_k': 0.10113850618423531, 'spread_hl_frac': 0.030363348534496837, 'bb_std_mult': 2.1172841800317994, 'rsi_os': 35, 'rsi_ob': 54, 'vol_spike': 0.07136224139592386, 'adx_thresh': 29.140913865284627, 'atr_min_pct': 0.0209263234318035, 'atr_max_pct': 0.13785163251819502, 'tp_mult': 2.1063727725337826, 'tsl_mult': 0.9736584309755079, 'strategy': 'mean_reversion', 'time_stop': 27, 'use_sma': False, 'use_atr': True, 'use_adx': False, 'use_ema': True, 'use_spike': False, 'rsi_required': True, 'edge_k': 1.4861783444344059, 'edge_cap': 0.6742595166783616, 'bull_strategy': 'mean_reversion', 'bull_bb_std_mult': 1.892098373826867, 'bull_rsi_os': 40, 'bull_rsi_ob': 47, 'bull_adx_thresh': 23.965884593023652, 'bull_atr_min_pct': 0.0011849858655589049, 'bull_atr_max_pct': 0.08188337486766716, 'bull_tp_mult': 1.9726810040982348, 'bull_tsl_mult': 0.12896556613895527, 'bull_time_stop': 70, 'bull_use_sma': False, 'bull_use_ema': True, 'bull_use_atr': True, 'bull_use_adx': False, 'bull_use_spike': False, 'bull_rsi_required': True, 'bear_strategy': 'breakout', 'bear_bb_std_mult': 2.743022485951009, 'bear_rsi_os': 22, 'bear_rsi_ob': 74, 'bear_adx_thresh': 25.14742035899703, 'bear_atr_min_pct': 0.026872775367180003, 'bear_atr_max_pct': 0.10618289322520973, 'bear_tp_mult': 2.87951276555014, 'bear_tsl_mult': 0.6476175397429491, 'bear_time_stop': 264, 'bear_use_sma': True, 'bear_use_ema': False, 'bear_use_atr': False, 'bear_use_adx': False, 'bear_use_spike': False, 'bear_rsi_required': False, 'sideways_strategy': 'breakout', 'sideways_bb_std_mult': 0.510856913499582, 'sideways_rsi_os': 31, 'sideways_rsi_ob': 79, 'sideways_adx_thresh': 9.656770621660211, 'sideways_atr_min_pct': 0.023407003167393824, 'sideways_atr_max_pct': 0.1498903463657011, 'sideways_tp_mult': 2.598747772707285, 'sideways_tsl_mult': 0.7192639230576289, 'sideways_time_stop': 212, 'sideways_use_sma': True, 'sideways_use_ema': False, 'sideways_use_atr': False, 'sideways_use_adx': False, 'sideways_use_spike': False, 'sideways_rsi_required': True}.
[I 2025-08-30 16:03:30,480] Trial 274 finished with values: [-0.009020181331868993, 0.008969572434548214] and parameters: {'p_sma': 7, 'p_std': 58, 'p_atr': 25, 'p_adx': 24, 'rsi_period': 19, 'ema1': 26, 'ema2': 11, 'slip_atr_k': 0.006253157139636631, 'slip_spread_k': 0.6024336465986374, 'spread_hl_frac': 0.017391183207152945, 'bb_std_mult': 3.0993572071138167, 'rsi_os': 35, 'rsi_ob': 90, 'vol_spike': 0.0002630836224839662, 'adx_thresh': 12.92333503297382, 'atr_min_pct': 0.019023555442652433, 'atr_max_pct': 0.13784056915259243, 'tp_mult': 2.8578282684612955, 'tsl_mult': 0.46813289177029643, 'strategy': 'mean_reversion', 'time_stop': 10, 'use_sma': False, 'use_atr': True, 'use_adx': True, 'use_ema': False, 'use_spike': False, 'rsi_required': True, 'edge_k': 1.5583549473799745, 'edge_cap': 0.6280060130376969, 'bull_strategy': 'mean_reversion', 'bull_bb_std_mult': 1.8718643532102566, 'bull_rsi_os': 11, 'bull_rsi_ob': 50, 'bull_adx_thresh': 21.42179464124353, 'bull_atr_min_pct': 0.020627503130813216, 'bull_atr_max_pct': 0.13758652770204977, 'bull_tp_mult': 1.2967372056853796, 'bull_tsl_mult': 0.29440033629634077, 'bull_time_stop': 70, 'bull_use_sma': False, 'bull_use_ema': True, 'bull_use_atr': True, 'bull_use_adx': True, 'bull_use_spike': False, 'bull_rsi_required': False, 'bear_strategy': 'mean_reversion', 'bear_bb_std_mult': 2.0692088525134182, 'bear_rsi_os': 13, 'bear_rsi_ob': 77, 'bear_adx_thresh': 13.424826126246236, 'bear_atr_min_pct': 0.021680983694695927, 'bear_atr_max_pct': 0.09155408310647851, 'bear_tp_mult': 2.213833997052781, 'bear_tsl_mult': 0.6464263629375663, 'bear_time_stop': 225, 'bear_use_sma': True, 'bear_use_ema': False, 'bear_use_atr': False, 'bear_use_adx': False, 'bear_use_spike': False, 'bear_rsi_required': False, 'sideways_strategy': 'breakout', 'sideways_bb_std_mult': 2.0813241570205325, 'sideways_rsi_os': 28, 'sideways_rsi_ob': 92, 'sideways_adx_thresh': 16.517286880180766, 'sideways_atr_min_pct': 0.001381951148645439, 'sideways_atr_max_pct': 0.1444266578162219, 'sideways_tp_mult': 1.43742507004905, 'sideways_tsl_mult': 0.47295858003982755, 'sideways_time_stop': 213, 'sideways_use_sma': True, 'sideways_use_ema': False, 'sideways_use_atr': False, 'sideways_use_adx': False, 'sideways_use_spike': False, 'sideways_rsi_required': True}.
[I 2025-08-30 16:03:30,784] Trial 273 finished with values: [-0.013245008795192748, 0.013173957997739476] and parameters: {'p_sma': 16, 'p_std': 58, 'p_atr': 12, 'p_adx': 14, 'rsi_period': 31, 'ema1': 7, 'ema2': 26, 'slip_atr_k': 0.008322519096111584, 'slip_spread_k': 0.09397287978162433, 'spread_hl_frac': 0.04796418211011131, 'bb_std_mult': 2.915974827938312, 'rsi_os': 37, 'rsi_ob': 54, 'vol_spike': 0.016401723750181597, 'adx_thresh': 26.5348675984523, 'atr_min_pct': 0.01890091835688391, 'atr_max_pct': 0.13768423564628146, 'tp_mult': 1.069060777796617, 'tsl_mult': 0.46638598629715755, 'strategy': 'mean_reversion', 'time_stop': 45, 'use_sma': False, 'use_atr': True, 'use_adx': False, 'use_ema': True, 'use_spike': False, 'rsi_required': True, 'edge_k': 1.4422604133296602, 'edge_cap': 0.4671333706605743, 'bull_strategy': 'mean_reversion', 'bull_bb_std_mult': 1.9067922152909327, 'bull_rsi_os': 11, 'bull_rsi_ob': 75, 'bull_adx_thresh': 15.267239238588282, 'bull_atr_min_pct': 0.020890492655769543, 'bull_atr_max_pct': 0.11812727912514115, 'bull_tp_mult': 1.9766022476222906, 'bull_tsl_mult': 0.33749084916649597, 'bull_time_stop': 57, 'bull_use_sma': False, 'bull_use_ema': True, 'bull_use_atr': True, 'bull_use_adx': False, 'bull_use_spike': False, 'bull_rsi_required': True, 'bear_strategy': 'breakout', 'bear_bb_std_mult': 2.078760641631404, 'bear_rsi_os': 22, 'bear_rsi_ob': 75, 'bear_adx_thresh': 15.747461903142776, 'bear_atr_min_pct': 0.02673821267268666, 'bear_atr_max_pct': 0.10608480028753027, 'bear_tp_mult': 2.1974874450750104, 'bear_tsl_mult': 0.3387650025269025, 'bear_time_stop': 226, 'bear_use_sma': True, 'bear_use_ema': False, 'bear_use_atr': False, 'bear_use_adx': False, 'bear_use_spike': False, 'bear_rsi_required': False, 'sideways_strategy': 'breakout', 'sideways_bb_std_mult': 2.090262177992402, 'sideways_rsi_os': 28, 'sideways_rsi_ob': 92, 'sideways_adx_thresh': 11.914830324588706, 'sideways_atr_min_pct': 0.0009886852377128798, 'sideways_atr_max_pct': 0.1498359808845184, 'sideways_tp_mult': 2.0365133750993034, 'sideways_tsl_mult': 0.7165389542976467, 'sideways_time_stop': 279, 'sideways_use_sma': True, 'sideways_use_ema': False, 'sideways_use_atr': False, 'sideways_use_adx': False, 'sideways_use_spike': False, 'sideways_rsi_required': True}.
[I 2025-08-30 16:04:12,619] Trial 275 finished with values: [-1000000000.0, 1000000000.0] and parameters: {'p_sma': 7, 'p_std': 58, 'p_atr': 26, 'p_adx': 24, 'rsi_period': 75, 'ema1': 26, 'ema2': 55, 'slip_atr_k': 0.004031500688130312, 'slip_spread_k': 0.00010722542830359514, 'spread_hl_frac': 0.017231160233517513, 'bb_std_mult': 2.0834347796596644, 'rsi_os': 35, 'rsi_ob': 52, 'vol_spike': 0.026011375647782865, 'adx_thresh': 11.930885364721334, 'atr_min_pct': 0.018780349871647322, 'atr_max_pct': 0.14622175661851206, 'tp_mult': 2.8224858471133185, 'tsl_mult': 0.7053955502950042, 'strategy': 'mean_reversion', 'time_stop': 27, 'use_sma': False, 'use_atr': True, 'use_adx': True, 'use_ema': False, 'use_spike': True, 'rsi_required': True, 'edge_k': 1.1890630072498174, 'edge_cap': 0.46922471447398545, 'bull_strategy': 'mean_reversion', 'bull_bb_std_mult': 1.860056682749428, 'bull_rsi_os': 11, 'bull_rsi_ob': 45, 'bull_adx_thresh': 7.577337176273986, 'bull_atr_min_pct': 0.0004838846675319433, 'bull_atr_max_pct': 0.1395024294201585, 'bull_tp_mult': 1.4788619780345826, 'bull_tsl_mult': 0.36932290178793276, 'bull_time_stop': 294, 'bull_use_sma': True, 'bull_use_ema': True, 'bull_use_atr': False, 'bull_use_adx': True, 'bull_use_spike': False, 'bull_rsi_required': False, 'bear_strategy': 'mean_reversion', 'bear_bb_std_mult': 2.7922743957512974, 'bear_rsi_os': 37, 'bear_rsi_ob': 77, 'bear_adx_thresh': 15.552589333542384, 'bear_atr_min_pct': 0.024135024569782795, 'bear_atr_max_pct': 0.04981290698091057, 'bear_tp_mult': 2.869967681953198, 'bear_tsl_mult': 0.5472635745730335, 'bear_time_stop': 271, 'bear_use_sma': False, 'bear_use_ema': False, 'bear_use_atr': False, 'bear_use_adx': False, 'bear_use_spike': False, 'bear_rsi_required': False, 'sideways_strategy': 'breakout', 'sideways_bb_std_mult': 0.5303447702696917, 'sideways_rsi_os': 8, 'sideways_rsi_ob': 92, 'sideways_adx_thresh': 11.673618450132075, 'sideways_atr_min_pct': 0.017924515142253232, 'sideways_atr_max_pct': 0.14973062404626164, 'sideways_tp_mult': 2.0513686370441477, 'sideways_tsl_mult': 0.3099695303303762, 'sideways_time_stop': 231, 'sideways_use_sma': True, 'sideways_use_ema': False, 'sideways_use_atr': False, 'sideways_use_adx': True, 'sideways_use_spike': False, 'sideways_rsi_required': True}.
[I 2025-08-30 16:04:12,962] Trial 278 finished with values: [-0.05602704010279991, 0.05597293689375152] and parameters: {'p_sma': 7, 'p_std': 59, 'p_atr': 26, 'p_adx': 24, 'rsi_period': 18, 'ema1': 11, 'ema2': 12, 'slip_atr_k': 0.0025920724851419994, 'slip_spread_k': 0.46294831488312366, 'spread_hl_frac': 0.021877298537179592, 'bb_std_mult': 3.179310047729604, 'rsi_os': 34, 'rsi_ob': 92, 'vol_spike': 0.0002489088444822711, 'adx_thresh': 12.028804023831984, 'atr_min_pct': 0.018725881227249115, 'atr_max_pct': 0.12969176910733665, 'tp_mult': 2.8414849436042564, 'tsl_mult': 0.516159885139021, 'strategy': 'mean_reversion', 'time_stop': 11, 'use_sma': True, 'use_atr': False, 'use_adx': True, 'use_ema': False, 'use_spike': False, 'rsi_required': True, 'edge_k': 1.5384125488638438, 'edge_cap': 0.8708459444411442, 'bull_strategy': 'mean_reversion', 'bull_bb_std_mult': 2.0050090001248755, 'bull_rsi_os': 11, 'bull_rsi_ob': 50, 'bull_adx_thresh': 21.380510112565975, 'bull_atr_min_pct': 0.020495681774510933, 'bull_atr_max_pct': 0.13965966483296344, 'bull_tp_mult': 1.3171652140768333, 'bull_tsl_mult': 0.2693927977869051, 'bull_time_stop': 58, 'bull_use_sma': False, 'bull_use_ema': True, 'bull_use_atr': True, 'bull_use_adx': True, 'bull_use_spike': False, 'bull_rsi_required': False, 'bear_strategy': 'mean_reversion', 'bear_bb_std_mult': 1.873807905170445, 'bear_rsi_os': 8, 'bear_rsi_ob': 78, 'bear_adx_thresh': 15.506284897420038, 'bear_atr_min_pct': 0.02016761532675106, 'bear_atr_max_pct': 0.09730925294965949, 'bear_tp_mult': 2.1085509444347017, 'bear_tsl_mult': 0.6792087657329198, 'bear_time_stop': 225, 'bear_use_sma': True, 'bear_use_ema': False, 'bear_use_atr': False, 'bear_use_adx': False, 'bear_use_spike': False, 'bear_rsi_required': False, 'sideways_strategy': 'mean_reversion', 'sideways_bb_std_mult': 2.0911679679656996, 'sideways_rsi_os': 27, 'sideways_rsi_ob': 50, 'sideways_adx_thresh': 17.25649212907652, 'sideways_atr_min_pct': 0.0006834920342829714, 'sideways_atr_max_pct': 0.1397508485592504, 'sideways_tp_mult': 1.3085298883766445, 'sideways_tsl_mult': 0.4676361921500727, 'sideways_time_stop': 201, 'sideways_use_sma': False, 'sideways_use_ema': False, 'sideways_use_atr': False, 'sideways_use_adx': False, 'sideways_use_spike': False, 'sideways_rsi_required': True}.
[I 2025-08-30 16:04:13,173] Trial 276 finished with values: [-0.01614876358852002, 0.01612244533847979] and parameters: {'p_sma': 7, 'p_std': 59, 'p_atr': 24, 'p_adx': 24, 'rsi_period': 18, 'ema1': 26, 'ema2': 12, 'slip_atr_k': 0.0003230169182702495, 'slip_spread_k': 0.4385526098068562, 'spread_hl_frac': 0.018049929152489055, 'bb_std_mult': 3.30175059972972, 'rsi_os': 34, 'rsi_ob': 91, 'vol_spike': 0.0005911204611360253, 'adx_thresh': 12.469545526197242, 'atr_min_pct': 0.018781218549066586, 'atr_max_pct': 0.13123590839718152, 'tp_mult': 2.8732005370128864, 'tsl_mult': 0.5307899384224528, 'strategy': 'mean_reversion', 'time_stop': 10, 'use_sma': True, 'use_atr': False, 'use_adx': True, 'use_ema': False, 'use_spike': False, 'rsi_required': True, 'edge_k': 1.5527207965856302, 'edge_cap': 0.8719004786853194, 'bull_strategy': 'mean_reversion', 'bull_bb_std_mult': 1.9873921399048515, 'bull_rsi_os': 10, 'bull_rsi_ob': 50, 'bull_adx_thresh': 20.89619881034771, 'bull_atr_min_pct': 0.018359972096028465, 'bull_atr_max_pct': 0.13951563848826126, 'bull_tp_mult': 1.2900937406908317, 'bull_tsl_mult': 0.2684378454858741, 'bull_time_stop': 58, 'bull_use_sma': False, 'bull_use_ema': True, 'bull_use_atr': True, 'bull_use_adx': True, 'bull_use_spike': False, 'bull_rsi_required': False, 'bear_strategy': 'mean_reversion', 'bear_bb_std_mult': 1.866454179461096, 'bear_rsi_os': 12, 'bear_rsi_ob': 78, 'bear_adx_thresh': 13.67875817749457, 'bear_atr_min_pct': 0.020114298944343856, 'bear_atr_max_pct': 0.09740339103455119, 'bear_tp_mult': 2.107273586940438, 'bear_tsl_mult': 0.6874969719491999, 'bear_time_stop': 226, 'bear_use_sma': True, 'bear_use_ema': False, 'bear_use_atr': False, 'bear_use_adx': False, 'bear_use_spike': False, 'bear_rsi_required': False, 'sideways_strategy': 'breakout', 'sideways_bb_std_mult': 2.034050339456813, 'sideways_rsi_os': 27, 'sideways_rsi_ob': 92, 'sideways_adx_thresh': 17.516856907170197, 'sideways_atr_min_pct': 0.0007255327100581781, 'sideways_atr_max_pct': 0.14009212175915264, 'sideways_tp_mult': 1.3370291105265213, 'sideways_tsl_mult': 0.48137545094483347, 'sideways_time_stop': 203, 'sideways_use_sma': False, 'sideways_use_ema': False, 'sideways_use_atr': False, 'sideways_use_adx': False, 'sideways_use_spike': False, 'sideways_rsi_required': True}.
[I 2025-08-30 16:04:13,334] Trial 277 finished with values: [-0.017007273720303417, 0.01697878234609125] and parameters: {'p_sma': 7, 'p_std': 58, 'p_atr': 12, 'p_adx': 24, 'rsi_period': 19, 'ema1': 26, 'ema2': 12, 'slip_atr_k': 0.00027451318295886387, 'slip_spread_k': 0.43264979813008086, 'spread_hl_frac': 0.01746652536573929, 'bb_std_mult': 3.2276402375167006, 'rsi_os': 34, 'rsi_ob': 92, 'vol_spike': 0.000600147307301767, 'adx_thresh': 13.001081276656889, 'atr_min_pct': 0.018519601973167165, 'atr_max_pct': 0.13326960218628534, 'tp_mult': 2.846398006428339, 'tsl_mult': 0.5167854705558634, 'strategy': 'mean_reversion', 'time_stop': 11, 'use_sma': True, 'use_atr': False, 'use_adx': True, 'use_ema': False, 'use_spike': False, 'rsi_required': True, 'edge_k': 1.5500472517865802, 'edge_cap': 0.4112687211320453, 'bull_strategy': 'mean_reversion', 'bull_bb_std_mult': 2.0343876702766464, 'bull_rsi_os': 10, 'bull_rsi_ob': 50, 'bull_adx_thresh': 21.415697529075715, 'bull_atr_min_pct': 0.020667501852142552, 'bull_atr_max_pct': 0.13787500437398034, 'bull_tp_mult': 1.2787478347237609, 'bull_tsl_mult': 0.2782456324390348, 'bull_time_stop': 56, 'bull_use_sma': False, 'bull_use_ema': True, 'bull_use_atr': True, 'bull_use_adx': True, 'bull_use_spike': False, 'bull_rsi_required': False, 'bear_strategy': 'mean_reversion', 'bear_bb_std_mult': 1.8722079705877386, 'bear_rsi_os': 10, 'bear_rsi_ob': 78, 'bear_adx_thresh': 15.710428249280177, 'bear_atr_min_pct': 0.02058296856602241, 'bear_atr_max_pct': 0.11364182840875034, 'bear_tp_mult': 2.091235647072582, 'bear_tsl_mult': 0.6792621952940706, 'bear_time_stop': 223, 'bear_use_sma': True, 'bear_use_ema': False, 'bear_use_atr': False, 'bear_use_adx': False, 'bear_use_spike': False, 'bear_rsi_required': False, 'sideways_strategy': 'breakout', 'sideways_bb_std_mult': 2.1653329010721114, 'sideways_rsi_os': 27, 'sideways_rsi_ob': 92, 'sideways_adx_thresh': 17.657549601048775, 'sideways_atr_min_pct': 0.0008541297438547994, 'sideways_atr_max_pct': 0.1391863408712865, 'sideways_tp_mult': 1.293846377156064, 'sideways_tsl_mult': 0.4706145806041297, 'sideways_time_stop': 204, 'sideways_use_sma': False, 'sideways_use_ema': False, 'sideways_use_atr': False, 'sideways_use_adx': False, 'sideways_use_spike': False, 'sideways_rsi_required': True}.
