[I 2025-08-30 17:35:05,927] Trial 812 finished with values: [-1000000000.0, 1000000000.0] and parameters: {'p_sma': 7, 'p_std': 35, 'p_atr': 16, 'p_adx': 17, 'rsi_period': 33, 'ema1': 17, 'ema2': 16, 'slip_atr_k': 0.06935451197771716, 'slip_spread_k': 0.8519350814516793, 'spread_hl_frac': 0.03859099414419109, 'bb_std_mult': 0.8295670955337195, 'rsi_os': 23, 'rsi_ob': 87, 'vol_spike': 0.09806998833872019, 'adx_thresh': 25.498972966030742, 'atr_min_pct': 0.015051010219355595, 'atr_max_pct': 0.09197233297693211, 'tp_mult': 2.6834943332358296, 'tsl_mult': 0.8639247980551588, 'strategy': 'mean_reversion', 'time_stop': 198, 'use_sma': False, 'use_atr': True, 'use_adx': False, 'use_ema': True, 'use_spike': False, 'rsi_required': True, 'edge_k': 0.7928178806586024, 'edge_cap': 0.4838271442248198, 'bull_strategy': 'breakout', 'bull_bb_std_mult': 1.764899001349025, 'bull_rsi_os': 10, 'bull_rsi_ob': 80, 'bull_adx_thresh': 34.93375044613923, 'bull_atr_min_pct': 0.023916055527695344, 'bull_atr_max_pct': 0.1498161504575723, 'bull_tp_mult': 2.357859141269582, 'bull_tsl_mult': 0.6933830126636479, 'bull_time_stop': 234, 'bull_use_sma': True, 'bull_use_ema': False, 'bull_use_atr': False, 'bull_use_adx': True, 'bull_use_spike': False, 'bull_rsi_required': True, 'bear_strategy': 'breakout', 'bear_bb_std_mult': 0.7518514231305242, 'bear_rsi_os': 16, 'bear_rsi_ob': 88, 'bear_adx_thresh': 12.91835064528507, 'bear_atr_min_pct': 0.021823838261923457, 'bear_atr_max_pct': 0.06413009235967766, 'bear_tp_mult': 1.30845458171686, 'bear_tsl_mult': 0.7488360671048003, 'bear_time_stop': 184, 'bear_use_sma': True, 'bear_use_ema': True, 'bear_use_atr': False, 'bear_use_adx': False, 'bear_use_spike': False, 'bear_rsi_required': False, 'sideways_strategy': 'breakout', 'sideways_bb_std_mult': 3.298616476677943, 'sideways_rsi_os': 23, 'sideways_rsi_ob': 91, 'sideways_adx_thresh': 19.840902338684156, 'sideways_atr_min_pct': 0.01679487912314143, 'sideways_atr_max_pct': 0.10411511385226674, 'sideways_tp_mult': 2.6391044811777506, 'sideways_tsl_mult': 0.8550007393922301, 'sideways_time_stop': 294, 'sideways_use_sma': True, 'sideways_use_ema': False, 'sideways_use_atr': True, 'sideways_use_adx': True, 'sideways_use_spike': True, 'sideways_rsi_required': False}.
[I 2025-08-30 17:35:06,400] Trial 811 finished with values: [-0.049607335860430646, 0.0495311805027307] and parameters: {'p_sma': 26, 'p_std': 24, 'p_atr': 10, 'p_adx': 11, 'rsi_period': 78, 'ema1': 17, 'ema2': 19, 'slip_atr_k': 0.019851746612760325, 'slip_spread_k': 0.15749011574382413, 'spread_hl_frac': 0.014444818262323477, 'bb_std_mult': 1.2203279352151823, 'rsi_os': 32, 'rsi_ob': 87, 'vol_spike': 0.09689247095360319, 'adx_thresh': 18.434212125373687, 'atr_min_pct': 0.013776274905240821, 'atr_max_pct': 0.14995899230002005, 'tp_mult': 1.534790248464182, 'tsl_mult': 0.01250244547671242, 'strategy': 'mean_reversion', 'time_stop': 160, 'use_sma': False, 'use_atr': True, 'use_adx': False, 'use_ema': True, 'use_spike': False, 'rsi_required': True, 'edge_k': 0.7868729326065693, 'edge_cap': 0.4849025664160556, 'bull_strategy': 'breakout', 'bull_bb_std_mult': 1.3511085482927943, 'bull_rsi_os': 10, 'bull_rsi_ob': 51, 'bull_adx_thresh': 34.96831484319378, 'bull_atr_min_pct': 0.023820410785550764, 'bull_atr_max_pct': 0.11936617031784057, 'bull_tp_mult': 2.285570025446445, 'bull_tsl_mult': 0.8232359850562375, 'bull_time_stop': 300, 'bull_use_sma': True, 'bull_use_ema': False, 'bull_use_atr': False, 'bull_use_adx': True, 'bull_use_spike': False, 'bull_rsi_required': True, 'bear_strategy': 'breakout', 'bear_bb_std_mult': 1.0091143600193042, 'bear_rsi_os': 32, 'bear_rsi_ob': 70, 'bear_adx_thresh': 9.830317143888518, 'bear_atr_min_pct': 0.022548098092147584, 'bear_atr_max_pct': 0.02741703846594503, 'bear_tp_mult': 2.274968490033876, 'bear_tsl_mult': 0.6652712155352083, 'bear_time_stop': 204, 'bear_use_sma': True, 'bear_use_ema': True, 'bear_use_atr': False, 'bear_use_adx': False, 'bear_use_spike': False, 'bear_rsi_required': False, 'sideways_strategy': 'breakout', 'sideways_bb_std_mult': 0.9719216974860311, 'sideways_rsi_os': 48, 'sideways_rsi_ob': 89, 'sideways_adx_thresh': 11.331312261640138, 'sideways_atr_min_pct': 0.002043941110115444, 'sideways_atr_max_pct': 0.10915047161804035, 'sideways_tp_mult': 2.8334075486986814, 'sideways_tsl_mult': 0.47079312001281, 'sideways_time_stop': 295, 'sideways_use_sma': True, 'sideways_use_ema': False, 'sideways_use_atr': True, 'sideways_use_adx': True, 'sideways_use_spike': True, 'sideways_rsi_required': False}.
[I 2025-08-30 17:35:06,680] Trial 810 finished with values: [-0.08136532410956276, 0.08128587611276979] and parameters: {'p_sma': 8, 'p_std': 22, 'p_atr': 16, 'p_adx': 17, 'rsi_period': 84, 'ema1': 17, 'ema2': 38, 'slip_atr_k': 0.06993639136568255, 'slip_spread_k': 0.3665062521862831, 'spread_hl_frac': 0.0038729354141889515, 'bb_std_mult': 1.0022561690523664, 'rsi_os': 32, 'rsi_ob': 86, 'vol_spike': 0.09888335761692302, 'adx_thresh': 22.38082681454159, 'atr_min_pct': 0.0177464619556563, 'atr_max_pct': 0.14396262016129185, 'tp_mult': 2.6812243436233456, 'tsl_mult': 0.26933837511603753, 'strategy': 'mean_reversion', 'time_stop': 45, 'use_sma': False, 'use_atr': True, 'use_adx': True, 'use_ema': True, 'use_spike': False, 'rsi_required': True, 'edge_k': 0.5347861097274691, 'edge_cap': 0.891729580569228, 'bull_strategy': 'mean_reversion', 'bull_bb_std_mult': 1.146290486317013, 'bull_rsi_os': 10, 'bull_rsi_ob': 55, 'bull_adx_thresh': 34.9591084723336, 'bull_atr_min_pct': 0.023154007847140837, 'bull_atr_max_pct': 0.11608768717360428, 'bull_tp_mult': 2.36160898653905, 'bull_tsl_mult': 0.7229767967915876, 'bull_time_stop': 229, 'bull_use_sma': True, 'bull_use_ema': False, 'bull_use_atr': False, 'bull_use_adx': True, 'bull_use_spike': True, 'bull_rsi_required': True, 'bear_strategy': 'breakout', 'bear_bb_std_mult': 0.7448253333966344, 'bear_rsi_os': 17, 'bear_rsi_ob': 86, 'bear_adx_thresh': 13.474294759408183, 'bear_atr_min_pct': 0.022681948703462365, 'bear_atr_max_pct': 0.12145097210817353, 'bear_tp_mult': 2.249257565148153, 'bear_tsl_mult': 0.7516563823015048, 'bear_time_stop': 207, 'bear_use_sma': True, 'bear_use_ema': True, 'bear_use_atr': False, 'bear_use_adx': False, 'bear_use_spike': False, 'bear_rsi_required': False, 'sideways_strategy': 'breakout', 'sideways_bb_std_mult': 0.8239755123365249, 'sideways_rsi_os': 48, 'sideways_rsi_ob': 91, 'sideways_adx_thresh': 11.668652796316643, 'sideways_atr_min_pct': 0.0009986979861864656, 'sideways_atr_max_pct': 0.0491468176515928, 'sideways_tp_mult': 2.839712591795967, 'sideways_tsl_mult': 0.1271289242383723, 'sideways_time_stop': 14, 'sideways_use_sma': True, 'sideways_use_ema': False, 'sideways_use_atr': True, 'sideways_use_adx': True, 'sideways_use_spike': True, 'sideways_rsi_required': False}.
[I 2025-08-30 17:35:07,855] Trial 816 finished with values: [-1000000000.0, 1000000000.0] and parameters: {'p_sma': 15, 'p_std': 18, 'p_atr': 17, 'p_adx': 12, 'rsi_period': 20, 'ema1': 13, 'ema2': 10, 'slip_atr_k': 0.013878421148604606, 'slip_spread_k': 0.10600494231830768, 'spread_hl_frac': 0.020636555996128132, 'bb_std_mult': 3.158232997888557, 'rsi_os': 52, 'rsi_ob': 64, 'vol_spike': 0.22492685328985146, 'adx_thresh': 8.938553436270457, 'atr_min_pct': 0.019682832002502447, 'atr_max_pct': 0.03225140671765107, 'tp_mult': 2.7864171688453547, 'tsl_mult': 0.9027973874193794, 'strategy': 'mean_reversion', 'time_stop': 78, 'use_sma': True, 'use_atr': False, 'use_adx': True, 'use_ema': False, 'use_spike': True, 'rsi_required': False, 'edge_k': 0.38582559082793066, 'edge_cap': 0.9999914711461636, 'bull_strategy': 'mean_reversion', 'bull_bb_std_mult': 1.9783511812207795, 'bull_rsi_os': 12, 'bull_rsi_ob': 60, 'bull_adx_thresh': 29.315357909875726, 'bull_atr_min_pct': 0.021025207100336254, 'bull_atr_max_pct': 0.06482307069062546, 'bull_tp_mult': 2.2502111941634486, 'bull_tsl_mult': 0.55664263926041, 'bull_time_stop': 58, 'bull_use_sma': True, 'bull_use_ema': True, 'bull_use_atr': False, 'bull_use_adx': False, 'bull_use_spike': False, 'bull_rsi_required': False, 'bear_strategy': 'mean_reversion', 'bear_bb_std_mult': 1.3969074339478122, 'bear_rsi_os': 14, 'bear_rsi_ob': 75, 'bear_adx_thresh': 6.054668727621424, 'bear_atr_min_pct': 0.0015255036986687454, 'bear_atr_max_pct': 0.10017409698679783, 'bear_tp_mult': 2.6137251665461063, 'bear_tsl_mult': 0.6044784530514783, 'bear_time_stop': 53, 'bear_use_sma': False, 'bear_use_ema': False, 'bear_use_atr': True, 'bear_use_adx': True, 'bear_use_spike': True, 'bear_rsi_required': True, 'sideways_strategy': 'breakout', 'sideways_bb_std_mult': 2.5279333391120713, 'sideways_rsi_os': 33, 'sideways_rsi_ob': 92, 'sideways_adx_thresh': 5.36016073380538, 'sideways_atr_min_pct': 0.003642172390342705, 'sideways_atr_max_pct': 0.06431410414592839, 'sideways_tp_mult': 1.1747676456551974, 'sideways_tsl_mult': 0.9577992947674799, 'sideways_time_stop': 275, 'sideways_use_sma': True, 'sideways_use_ema': True, 'sideways_use_atr': False, 'sideways_use_adx': False, 'sideways_use_spike': False, 'sideways_rsi_required': True}.
[I 2025-08-30 17:35:50,840] Trial 813 finished with values: [-1000000000.0, 1000000000.0] and parameters: {'p_sma': 7, 'p_std': 35, 'p_atr': 16, 'p_adx': 11, 'rsi_period': 24, 'ema1': 18, 'ema2': 10, 'slip_atr_k': 0.014194423838123351, 'slip_spread_k': 0.17690700826982547, 'spread_hl_frac': 0.01615941862387035, 'bb_std_mult': 2.825636502313656, 'rsi_os': 23, 'rsi_ob': 85, 'vol_spike': 0.09694111376797815, 'adx_thresh': 5.624291599565803, 'atr_min_pct': 0.01984063248276342, 'atr_max_pct': 0.04763281982906268, 'tp_mult': 1.760913331256211, 'tsl_mult': 0.011261668226776544, 'strategy': 'mean_reversion', 'time_stop': 28, 'use_sma': False, 'use_atr': True, 'use_adx': False, 'use_ema': False, 'use_spike': False, 'rsi_required': True, 'edge_k': 0.7571390533668609, 'edge_cap': 0.7026561458079326, 'bull_strategy': 'breakout', 'bull_bb_std_mult': 1.7814193412500774, 'bull_rsi_os': 10, 'bull_rsi_ob': 51, 'bull_adx_thresh': 33.970412949858506, 'bull_atr_min_pct': 0.01104547374109292, 'bull_atr_max_pct': 0.14461235210966522, 'bull_tp_mult': 2.3673193964479626, 'bull_tsl_mult': 0.6954672738273342, 'bull_time_stop': 68, 'bull_use_sma': True, 'bull_use_ema': True, 'bull_use_atr': False, 'bull_use_adx': True, 'bull_use_spike': False, 'bull_rsi_required': True, 'bear_strategy': 'mean_reversion', 'bear_bb_std_mult': 1.4045257728849567, 'bear_rsi_os': 32, 'bear_rsi_ob': 68, 'bear_adx_thresh': 13.34480558203399, 'bear_atr_min_pct': 0.022595324832616864, 'bear_atr_max_pct': 0.11969634672602149, 'bear_tp_mult': 2.8430350885249087, 'bear_tsl_mult': 0.6682224951119172, 'bear_time_stop': 54, 'bear_use_sma': False, 'bear_use_ema': True, 'bear_use_atr': False, 'bear_use_adx': False, 'bear_use_spike': False, 'bear_rsi_required': False, 'sideways_strategy': 'breakout', 'sideways_bb_std_mult': 0.8222207703601054, 'sideways_rsi_os': 23, 'sideways_rsi_ob': 68, 'sideways_adx_thresh': 10.053492978668478, 'sideways_atr_min_pct': 0.001974049360572248, 'sideways_atr_max_pct': 0.033166676373854544, 'sideways_tp_mult': 2.9600601169658907, 'sideways_tsl_mult': 0.9251152667751502, 'sideways_time_stop': 295, 'sideways_use_sma': True, 'sideways_use_ema': False, 'sideways_use_atr': True, 'sideways_use_adx': True, 'sideways_use_spike': False, 'sideways_rsi_required': False}.
[I 2025-08-30 17:35:50,895] Trial 814 finished with values: [-0.02328863945508186, 0.023189382876389275] and parameters: {'p_sma': 26, 'p_std': 21, 'p_atr': 29, 'p_adx': 18, 'rsi_period': 20, 'ema1': 6, 'ema2': 10, 'slip_atr_k': 0.013385837107874502, 'slip_spread_k': 0.1688521791890597, 'spread_hl_frac': 0.020052304177470965, 'bb_std_mult': 2.1935961128300256, 'rsi_os': 32, 'rsi_ob': 79, 'vol_spike': 0.09572299930572747, 'adx_thresh': 7.0224165830687095, 'atr_min_pct': 0.01785826599564771, 'atr_max_pct': 0.14758481961040745, 'tp_mult': 1.6101313390385261, 'tsl_mult': 0.8994730625925649, 'strategy': 'mean_reversion', 'time_stop': 30, 'use_sma': False, 'use_atr': False, 'use_adx': False, 'use_ema': False, 'use_spike': False, 'rsi_required': False, 'edge_k': 0.36941233401430007, 'edge_cap': 0.9451009886798009, 'bull_strategy': 'mean_reversion', 'bull_bb_std_mult': 1.9919279074558074, 'bull_rsi_os': 9, 'bull_rsi_ob': 51, 'bull_adx_thresh': 33.72339548520549, 'bull_atr_min_pct': 0.021948533160124708, 'bull_atr_max_pct': 0.14406108625248154, 'bull_tp_mult': 2.665187576144216, 'bull_tsl_mult': 0.557413547243318, 'bull_time_stop': 68, 'bull_use_sma': True, 'bull_use_ema': True, 'bull_use_atr': False, 'bull_use_adx': False, 'bull_use_spike': False, 'bull_rsi_required': False, 'bear_strategy': 'mean_reversion', 'bear_bb_std_mult': 1.4142129262280803, 'bear_rsi_os': 14, 'bear_rsi_ob': 69, 'bear_adx_thresh': 5.574005454113541, 'bear_atr_min_pct': 0.019675841831124086, 'bear_atr_max_pct': 0.12017407106392627, 'bear_tp_mult': 2.8982211031356733, 'bear_tsl_mult': 0.6650662217373019, 'bear_time_stop': 197, 'bear_use_sma': False, 'bear_use_ema': False, 'bear_use_atr': False, 'bear_use_adx': True, 'bear_use_spike': True, 'bear_rsi_required': True, 'sideways_strategy': 'breakout', 'sideways_bb_std_mult': 2.402939339518107, 'sideways_rsi_os': 33, 'sideways_rsi_ob': 68, 'sideways_adx_thresh': 5.5057634959148025, 'sideways_atr_min_pct': 0.001974419125361329, 'sideways_atr_max_pct': 0.09920967652775485, 'sideways_tp_mult': 2.957296717403753, 'sideways_tsl_mult': 0.9276663170252373, 'sideways_time_stop': 277, 'sideways_use_sma': True, 'sideways_use_ema': False, 'sideways_use_atr': False, 'sideways_use_adx': False, 'sideways_use_spike': False, 'sideways_rsi_required': True}.
[I 2025-08-30 17:35:51,309] Trial 815 finished with values: [-1000000000.0, 1000000000.0] and parameters: {'p_sma': 8, 'p_std': 16, 'p_atr': 11, 'p_adx': 18, 'rsi_period': 20, 'ema1': 11, 'ema2': 24, 'slip_atr_k': 0.01373019782002596, 'slip_spread_k': 0.17544482187055868, 'spread_hl_frac': 0.020298972720261294, 'bb_std_mult': 2.1743674184536754, 'rsi_os': 20, 'rsi_ob': 85, 'vol_spike': 0.21282042174729845, 'adx_thresh': 6.738986042609328, 'atr_min_pct': 0.007128962305054332, 'atr_max_pct': 0.10618271420474554, 'tp_mult': 1.60348838928837, 'tsl_mult': 0.9034823436494167, 'strategy': 'mean_reversion', 'time_stop': 29, 'use_sma': True, 'use_atr': False, 'use_adx': True, 'use_ema': False, 'use_spike': True, 'rsi_required': False, 'edge_k': 0.542543603886562, 'edge_cap': 0.9458352605914955, 'bull_strategy': 'mean_reversion', 'bull_bb_std_mult': 1.084474780317466, 'bull_rsi_os': 31, 'bull_rsi_ob': 56, 'bull_adx_thresh': 33.72486965199933, 'bull_atr_min_pct': 0.0049694788906642015, 'bull_atr_max_pct': 0.06509900550119155, 'bull_tp_mult': 2.653459355041206, 'bull_tsl_mult': 0.7639068597532079, 'bull_time_stop': 58, 'bull_use_sma': True, 'bull_use_ema': True, 'bull_use_atr': False, 'bull_use_adx': False, 'bull_use_spike': False, 'bull_rsi_required': False, 'bear_strategy': 'mean_reversion', 'bear_bb_std_mult': 1.391671243295931, 'bear_rsi_os': 7, 'bear_rsi_ob': 75, 'bear_adx_thresh': 11.985272314874369, 'bear_atr_min_pct': 0.026267346004310688, 'bear_atr_max_pct': 0.12203507163121524, 'bear_tp_mult': 2.8420581353910936, 'bear_tsl_mult': 0.029219941034371644, 'bear_time_stop': 64, 'bear_use_sma': False, 'bear_use_ema': False, 'bear_use_atr': True, 'bear_use_adx': True, 'bear_use_spike': True, 'bear_rsi_required': True, 'sideways_strategy': 'breakout', 'sideways_bb_std_mult': 2.5299001902335103, 'sideways_rsi_os': 33, 'sideways_rsi_ob': 68, 'sideways_adx_thresh': 5.0308316886872735, 'sideways_atr_min_pct': 0.02377660180788929, 'sideways_atr_max_pct': 0.09910452445718518, 'sideways_tp_mult': 2.090558184506331, 'sideways_tsl_mult': 0.41538179353154037, 'sideways_time_stop': 276, 'sideways_use_sma': True, 'sideways_use_ema': True, 'sideways_use_atr': False, 'sideways_use_adx': False, 'sideways_use_spike': False, 'sideways_rsi_required': True}.
[I 2025-08-30 17:35:52,591] Trial 817 finished with values: [-1000000000.0, 1000000000.0] and parameters: {'p_sma': 28, 'p_std': 21, 'p_atr': 15, 'p_adx': 8, 'rsi_period': 24, 'ema1': 18, 'ema2': 12, 'slip_atr_k': 0.012053278452448319, 'slip_spread_k': 0.17000790543276592, 'spread_hl_frac': 0.016718871345724116, 'bb_std_mult': 3.0135460838592603, 'rsi_os': 25, 'rsi_ob': 69, 'vol_spike': 0.08275864037933756, 'adx_thresh': 11.64669583085239, 'atr_min_pct': 0.026399496351059593, 'atr_max_pct': 0.14091142644159282, 'tp_mult': 2.3589263955515283, 'tsl_mult': 0.9938620364336268, 'strategy': 'breakout', 'time_stop': 89, 'use_sma': False, 'use_atr': True, 'use_adx': True, 'use_ema': False, 'use_spike': False, 'rsi_required': True, 'edge_k': 0.6800964820746424, 'edge_cap': 0.8003734599401398, 'bull_strategy': 'mean_reversion', 'bull_bb_std_mult': 1.7886030176525252, 'bull_rsi_os': 9, 'bull_rsi_ob': 57, 'bull_adx_thresh': 33.84464393444942, 'bull_atr_min_pct': 0.021619309815108137, 'bull_atr_max_pct': 0.14493452982743252, 'bull_tp_mult': 2.456047410850194, 'bull_tsl_mult': 0.9961545003225798, 'bull_time_stop': 43, 'bull_use_sma': True, 'bull_use_ema': True, 'bull_use_atr': False, 'bull_use_adx': True, 'bull_use_spike': False, 'bull_rsi_required': False, 'bear_strategy': 'mean_reversion', 'bear_bb_std_mult': 1.1609897954925013, 'bear_rsi_os': 28, 'bear_rsi_ob': 68, 'bear_adx_thresh': 11.588374589779818, 'bear_atr_min_pct': 0.027559217723473826, 'bear_atr_max_pct': 0.14632159645650034, 'bear_tp_mult': 2.0923436131376354, 'bear_tsl_mult': 0.05784092720675593, 'bear_time_stop': 197, 'bear_use_sma': False, 'bear_use_ema': False, 'bear_use_atr': False, 'bear_use_adx': False, 'bear_use_spike': False, 'bear_rsi_required': False, 'sideways_strategy': 'mean_reversion', 'sideways_bb_std_mult': 0.6918162194858655, 'sideways_rsi_os': 31, 'sideways_rsi_ob': 48, 'sideways_adx_thresh': 10.103631515822245, 'sideways_atr_min_pct': 0.007118113691434435, 'sideways_atr_max_pct': 0.10175947126024143, 'sideways_tp_mult': 2.1129232764460384, 'sideways_tsl_mult': 0.40067306475048575, 'sideways_time_stop': 283, 'sideways_use_sma': False, 'sideways_use_ema': False, 'sideways_use_atr': False, 'sideways_use_adx': False, 'sideways_use_spike': False, 'sideways_rsi_required': True}.
[I 2025-08-30 17:36:34,751] Trial 821 finished with values: [-1000000000.0, 1000000000.0] and parameters: {'p_sma': 11, 'p_std': 24, 'p_atr': 15, 'p_adx': 7, 'rsi_period': 23, 'ema1': 30, 'ema2': 12, 'slip_atr_k': 0.007909945375343947, 'slip_spread_k': 0.422788968536002, 'spread_hl_frac': 0.018615086365478737, 'bb_std_mult': 1.6260297929171728, 'rsi_os': 50, 'rsi_ob': 88, 'vol_spike': 0.08462022967606214, 'adx_thresh': 8.261429375595469, 'atr_min_pct': 0.021953351207104895, 'atr_max_pct': 0.14590764122195093, 'tp_mult': 2.102899766261633, 'tsl_mult': 0.5890512041242042, 'strategy': 'breakout', 'time_stop': 36, 'use_sma': False, 'use_atr': True, 'use_adx': True, 'use_ema': False, 'use_spike': False, 'rsi_required': True, 'edge_k': 0.46902369757750045, 'edge_cap': 0.2948707033369036, 'bull_strategy': 'mean_reversion', 'bull_bb_std_mult': 2.253188267765211, 'bull_rsi_os': 12, 'bull_rsi_ob': 53, 'bull_adx_thresh': 10.961260786688847, 'bull_atr_min_pct': 0.02254345259628139, 'bull_atr_max_pct': 0.14024419450815812, 'bull_tp_mult': 2.2213052275139864, 'bull_tsl_mult': 0.8287162441191245, 'bull_time_stop': 85, 'bull_use_sma': True, 'bull_use_ema': True, 'bull_use_atr': False, 'bull_use_adx': True, 'bull_use_spike': True, 'bull_rsi_required': False, 'bear_strategy': 'mean_reversion', 'bear_bb_std_mult': 3.4979751877581764, 'bear_rsi_os': 18, 'bear_rsi_ob': 51, 'bear_adx_thresh': 12.407345791432945, 'bear_atr_min_pct': 0.02119815268041433, 'bear_atr_max_pct': 0.10721584211997644, 'bear_tp_mult': 1.094098964974111, 'bear_tsl_mult': 0.6107462659089065, 'bear_time_stop': 94, 'bear_use_sma': True, 'bear_use_ema': False, 'bear_use_atr': False, 'bear_use_adx': False, 'bear_use_spike': False, 'bear_rsi_required': False, 'sideways_strategy': 'mean_reversion', 'sideways_bb_std_mult': 1.7110535455150235, 'sideways_rsi_os': 30, 'sideways_rsi_ob': 86, 'sideways_adx_thresh': 11.074818212430731, 'sideways_atr_min_pct': 0.020744968282914382, 'sideways_atr_max_pct': 0.11507513034156286, 'sideways_tp_mult': 1.9735633389728477, 'sideways_tsl_mult': 0.20983760510247856, 'sideways_time_stop': 34, 'sideways_use_sma': False, 'sideways_use_ema': False, 'sideways_use_atr': False, 'sideways_use_adx': False, 'sideways_use_spike': False, 'sideways_rsi_required': True}.
