[I 2025-08-30 15:50:16,589] Trial 195 finished with values: [-0.025485094426745625, 0.025388361308091387] and parameters: {'p_sma': 13, 'p_std': 19, 'p_atr': 13, 'p_adx': 30, 'rsi_period': 35, 'ema1': 25, 'ema2': 38, 'slip_atr_k': 0.005729003183699968, 'slip_spread_k': 0.5714480465529734, 'spread_hl_frac': 0.04757816499006115, 'bb_std_mult': 0.7824467050329349, 'rsi_os': 12, 'rsi_ob': 61, 'vol_spike': 0.016981298950007773, 'adx_thresh': 21.33843828195196, 'atr_min_pct': 0.02573197474982624, 'atr_max_pct': 0.14636410933342836, 'tp_mult': 1.9673639729650454, 'tsl_mult': 0.34567037442128656, 'strategy': 'breakout', 'time_stop': 257, 'use_sma': False, 'use_atr': True, 'use_adx': False, 'use_ema': False, 'use_spike': True, 'rsi_required': False, 'edge_k': 0.894390983645809, 'edge_cap': 0.663761969623772, 'bull_strategy': 'mean_reversion', 'bull_bb_std_mult': 1.6460775012310984, 'bull_rsi_os': 44, 'bull_rsi_ob': 70, 'bull_adx_thresh': 32.665604094680745, 'bull_atr_min_pct': 0.0015388357026270391, 'bull_atr_max_pct': 0.05073732580897693, 'bull_tp_mult': 2.525126380442712, 'bull_tsl_mult': 0.36785135587750084, 'bull_time_stop': 82, 'bull_use_sma': True, 'bull_use_ema': False, 'bull_use_atr': False, 'bull_use_adx': False, 'bull_use_spike': True, 'bull_rsi_required': True, 'bear_strategy': 'mean_reversion', 'bear_bb_std_mult': 2.2017931193173688, 'bear_rsi_os': 19, 'bear_rsi_ob': 63, 'bear_adx_thresh': 7.327118132330368, 'bear_atr_min_pct': 0.02791535008310199, 'bear_atr_max_pct': 0.05235636695204279, 'bear_tp_mult': 2.24594798889793, 'bear_tsl_mult': 0.5210841633304972, 'bear_time_stop': 253, 'bear_use_sma': False, 'bear_use_ema': False, 'bear_use_atr': False, 'bear_use_adx': True, 'bear_use_spike': True, 'bear_rsi_required': True, 'sideways_strategy': 'breakout', 'sideways_bb_std_mult': 3.1219728613773716, 'sideways_rsi_os': 29, 'sideways_rsi_ob': 91, 'sideways_adx_thresh': 17.281610550192475, 'sideways_atr_min_pct': 4.379875099299159e-05, 'sideways_atr_max_pct': 0.14485546123251056, 'sideways_tp_mult': 2.7092390922108764, 'sideways_tsl_mult': 0.9178256199213224, 'sideways_time_stop': 233, 'sideways_use_sma': True, 'sideways_use_ema': False, 'sideways_use_atr': False, 'sideways_use_adx': True, 'sideways_use_spike': False, 'sideways_rsi_required': True}.
[I 2025-08-30 15:50:57,228] Trial 202 finished with values: [-1000000000.0, 1000000000.0] and parameters: {'p_sma': 16, 'p_std': 19, 'p_atr': 25, 'p_adx': 16, 'rsi_period': 38, 'ema1': 12, 'ema2': 13, 'slip_atr_k': 0.014502401127095053, 'slip_spread_k': 0.7342534808889263, 'spread_hl_frac': 0.01506359818896049, 'bb_std_mult': 2.8757970802308472, 'rsi_os': 6, 'rsi_ob': 69, 'vol_spike': 0.00697864334040426, 'adx_thresh': 20.027914604703213, 'atr_min_pct': 0.02984442732133975, 'atr_max_pct': 0.10133269513293008, 'tp_mult': 2.687289069607325, 'tsl_mult': 0.46111449800123055, 'strategy': 'breakout', 'time_stop': 162, 'use_sma': False, 'use_atr': True, 'use_adx': False, 'use_ema': False, 'use_spike': True, 'rsi_required': False, 'edge_k': 1.1388811203639242, 'edge_cap': 0.26651070078048394, 'bull_strategy': 'breakout', 'bull_bb_std_mult': 1.844748556498634, 'bull_rsi_os': 23, 'bull_rsi_ob': 54, 'bull_adx_thresh': 14.502242556011517, 'bull_atr_min_pct': 0.0029228969151431543, 'bull_atr_max_pct': 0.04782409235320775, 'bull_tp_mult': 2.461597401443506, 'bull_tsl_mult': 0.355744094344258, 'bull_time_stop': 116, 'bull_use_sma': True, 'bull_use_ema': True, 'bull_use_atr': False, 'bull_use_adx': False, 'bull_use_spike': False, 'bull_rsi_required': True, 'bear_strategy': 'mean_reversion', 'bear_bb_std_mult': 2.311766837378113, 'bear_rsi_os': 21, 'bear_rsi_ob': 82, 'bear_adx_thresh': 11.386054913138839, 'bear_atr_min_pct': 0.027664172883640644, 'bear_atr_max_pct': 0.08799536667689029, 'bear_tp_mult': 2.1884498399510894, 'bear_tsl_mult': 0.6269434673616698, 'bear_time_stop': 238, 'bear_use_sma': False, 'bear_use_ema': False, 'bear_use_atr': False, 'bear_use_adx': False, 'bear_use_spike': True, 'bear_rsi_required': False, 'sideways_strategy': 'mean_reversion', 'sideways_bb_std_mult': 3.345547508649095, 'sideways_rsi_os': 21, 'sideways_rsi_ob': 90, 'sideways_adx_thresh': 14.519552027894468, 'sideways_atr_min_pct': 0.015472002250823836, 'sideways_atr_max_pct': 0.09252164077359623, 'sideways_tp_mult': 2.822288225182378, 'sideways_tsl_mult': 0.7912139014448257, 'sideways_time_stop': 147, 'sideways_use_sma': True, 'sideways_use_ema': False, 'sideways_use_atr': True, 'sideways_use_adx': True, 'sideways_use_spike': True, 'sideways_rsi_required': True}.
[I 2025-08-30 15:50:58,278] Trial 199 finished with values: [-0.011262663948755858, 0.0112497608288643] and parameters: {'p_sma': 16, 'p_std': 19, 'p_atr': 26, 'p_adx': 30, 'rsi_period': 31, 'ema1': 16, 'ema2': 13, 'slip_atr_k': 0.013963910701821656, 'slip_spread_k': 2.6990713698656337e-05, 'spread_hl_frac': 0.047020839672253706, 'bb_std_mult': 2.8831753535863123, 'rsi_os': 38, 'rsi_ob': 72, 'vol_spike': 0.16208651314249345, 'adx_thresh': 19.23609068308637, 'atr_min_pct': 0.021439104049548928, 'atr_max_pct': 0.10178239025465677, 'tp_mult': 2.678562991171462, 'tsl_mult': 0.40585553741269637, 'strategy': 'breakout', 'time_stop': 255, 'use_sma': False, 'use_atr': True, 'use_adx': False, 'use_ema': False, 'use_spike': True, 'rsi_required': False, 'edge_k': 0.3075515617031104, 'edge_cap': 0.6618317300258406, 'bull_strategy': 'breakout', 'bull_bb_std_mult': 2.70423223371174, 'bull_rsi_os': 11, 'bull_rsi_ob': 75, 'bull_adx_thresh': 30.115950072070248, 'bull_atr_min_pct': 0.0029344103494708083, 'bull_atr_max_pct': 0.05175073762516653, 'bull_tp_mult': 2.470019959960657, 'bull_tsl_mult': 0.6205957933195843, 'bull_time_stop': 123, 'bull_use_sma': True, 'bull_use_ema': True, 'bull_use_atr': False, 'bull_use_adx': False, 'bull_use_spike': False, 'bull_rsi_required': True, 'bear_strategy': 'mean_reversion', 'bear_bb_std_mult': 2.266104130142031, 'bear_rsi_os': 21, 'bear_rsi_ob': 76, 'bear_adx_thresh': 11.388108277194846, 'bear_atr_min_pct': 0.028839136195520455, 'bear_atr_max_pct': 0.08762930867224797, 'bear_tp_mult': 2.7971101916367345, 'bear_tsl_mult': 0.6372240648605908, 'bear_time_stop': 236, 'bear_use_sma': False, 'bear_use_ema': False, 'bear_use_atr': False, 'bear_use_adx': False, 'bear_use_spike': True, 'bear_rsi_required': False, 'sideways_strategy': 'breakout', 'sideways_bb_std_mult': 3.3021199493913107, 'sideways_rsi_os': 25, 'sideways_rsi_ob': 88, 'sideways_adx_thresh': 15.057251957139679, 'sideways_atr_min_pct': 6.877650326417295e-05, 'sideways_atr_max_pct': 0.13196986961023116, 'sideways_tp_mult': 2.821372040574172, 'sideways_tsl_mult': 0.8681158325915146, 'sideways_time_stop': 227, 'sideways_use_sma': True, 'sideways_use_ema': False, 'sideways_use_atr': True, 'sideways_use_adx': True, 'sideways_use_spike': True, 'sideways_rsi_required': True}.
[I 2025-08-30 15:50:58,564] Trial 201 finished with values: [-0.025694994334449994, 0.02575050759758867] and parameters: {'p_sma': 16, 'p_std': 37, 'p_atr': 26, 'p_adx': 16, 'rsi_period': 27, 'ema1': 12, 'ema2': 46, 'slip_atr_k': 0.15106062348480725, 'slip_spread_k': 0.001010720770008364, 'spread_hl_frac': 0.030235826047234512, 'bb_std_mult': 2.8811261132404855, 'rsi_os': 13, 'rsi_ob': 71, 'vol_spike': 0.008376764721968522, 'adx_thresh': 20.161040206579443, 'atr_min_pct': 0.029901836105789822, 'atr_max_pct': 0.14382856411368222, 'tp_mult': 1.044602022883574, 'tsl_mult': 0.4114567244357853, 'strategy': 'breakout', 'time_stop': 254, 'use_sma': False, 'use_atr': True, 'use_adx': False, 'use_ema': False, 'use_spike': True, 'rsi_required': False, 'edge_k': 0.06968789330220604, 'edge_cap': 0.666622169849707, 'bull_strategy': 'breakout', 'bull_bb_std_mult': 1.8449949715924414, 'bull_rsi_os': 23, 'bull_rsi_ob': 76, 'bull_adx_thresh': 15.062998152857844, 'bull_atr_min_pct': 0.002913647841040432, 'bull_atr_max_pct': 0.04857940661950918, 'bull_tp_mult': 2.466126529424118, 'bull_tsl_mult': 0.624263018953301, 'bull_time_stop': 90, 'bull_use_sma': True, 'bull_use_ema': True, 'bull_use_atr': False, 'bull_use_adx': False, 'bull_use_spike': False, 'bull_rsi_required': True, 'bear_strategy': 'mean_reversion', 'bear_bb_std_mult': 2.271880589077645, 'bear_rsi_os': 21, 'bear_rsi_ob': 82, 'bear_adx_thresh': 11.307405653524397, 'bear_atr_min_pct': 0.027763794404216075, 'bear_atr_max_pct': 0.0883533518523307, 'bear_tp_mult': 2.176074484656005, 'bear_tsl_mult': 0.6339426113281019, 'bear_time_stop': 78, 'bear_use_sma': False, 'bear_use_ema': False, 'bear_use_atr': False, 'bear_use_adx': False, 'bear_use_spike': True, 'bear_rsi_required': False, 'sideways_strategy': 'breakout', 'sideways_bb_std_mult': 3.31885611662883, 'sideways_rsi_os': 25, 'sideways_rsi_ob': 90, 'sideways_adx_thresh': 17.682283365029843, 'sideways_atr_min_pct': 5.209522604599881e-05, 'sideways_atr_max_pct': 0.01814553797323363, 'sideways_tp_mult': 2.8225437176551207, 'sideways_tsl_mult': 0.3432149772925114, 'sideways_time_stop': 248, 'sideways_use_sma': True, 'sideways_use_ema': False, 'sideways_use_atr': True, 'sideways_use_adx': True, 'sideways_use_spike': True, 'sideways_rsi_required': True}.
[I 2025-08-30 15:50:59,034] Trial 200 finished with values: [-1000000000.0, 1000000000.0] and parameters: {'p_sma': 16, 'p_std': 37, 'p_atr': 26, 'p_adx': 15, 'rsi_period': 31, 'ema1': 25, 'ema2': 30, 'slip_atr_k': 0.015919835208020264, 'slip_spread_k': 0.6264243587342391, 'spread_hl_frac': 0.04759660932972289, 'bb_std_mult': 2.886197193276695, 'rsi_os': 12, 'rsi_ob': 71, 'vol_spike': 0.13670734977589338, 'adx_thresh': 20.030980494091434, 'atr_min_pct': 0.02126053378732519, 'atr_max_pct': 0.1437281827523937, 'tp_mult': 2.190812453892916, 'tsl_mult': 0.4052534829674952, 'strategy': 'breakout', 'time_stop': 255, 'use_sma': False, 'use_atr': True, 'use_adx': False, 'use_ema': False, 'use_spike': True, 'rsi_required': False, 'edge_k': 1.1501659302557008, 'edge_cap': 0.6617821368912645, 'bull_strategy': 'breakout', 'bull_bb_std_mult': 2.7705705254737683, 'bull_rsi_os': 23, 'bull_rsi_ob': 76, 'bull_adx_thresh': 31.654669477265394, 'bull_atr_min_pct': 0.0029335432304579286, 'bull_atr_max_pct': 0.05193644451483591, 'bull_tp_mult': 2.4719563342183717, 'bull_tsl_mult': 0.35974682150832643, 'bull_time_stop': 116, 'bull_use_sma': True, 'bull_use_ema': True, 'bull_use_atr': False, 'bull_use_adx': False, 'bull_use_spike': False, 'bull_rsi_required': True, 'bear_strategy': 'mean_reversion', 'bear_bb_std_mult': 3.0059719727308107, 'bear_rsi_os': 21, 'bear_rsi_ob': 82, 'bear_adx_thresh': 13.361965712831907, 'bear_atr_min_pct': 2.815622759393642e-05, 'bear_atr_max_pct': 0.08866786335467912, 'bear_tp_mult': 2.1769057736969804, 'bear_tsl_mult': 0.6343162340673711, 'bear_time_stop': 269, 'bear_use_sma': False, 'bear_use_ema': False, 'bear_use_atr': False, 'bear_use_adx': False, 'bear_use_spike': True, 'bear_rsi_required': False, 'sideways_strategy': 'breakout', 'sideways_bb_std_mult': 3.311367352613494, 'sideways_rsi_os': 25, 'sideways_rsi_ob': 88, 'sideways_adx_thresh': 15.084766708341293, 'sideways_atr_min_pct': 0.019191293372104408, 'sideways_atr_max_pct': 0.09304463339979058, 'sideways_tp_mult': 1.5863591121575804, 'sideways_tsl_mult': 0.7521664075138349, 'sideways_time_stop': 246, 'sideways_use_sma': True, 'sideways_use_ema': False, 'sideways_use_atr': True, 'sideways_use_adx': True, 'sideways_use_spike': True, 'sideways_rsi_required': True}.
[I 2025-08-30 15:51:36,674] Trial 206 finished with values: [-1000000000.0, 1000000000.0] and parameters: {'p_sma': 17, 'p_std': 22, 'p_atr': 25, 'p_adx': 20, 'rsi_period': 36, 'ema1': 26, 'ema2': 34, 'slip_atr_k': 0.008910220422077708, 'slip_spread_k': 0.001451192333622628, 'spread_hl_frac': 0.04647697028499546, 'bb_std_mult': 2.9900142799665788, 'rsi_os': 51, 'rsi_ob': 49, 'vol_spike': 0.09900365450265847, 'adx_thresh': 22.135013726952167, 'atr_min_pct': 0.028755888157044177, 'atr_max_pct': 0.1399453629835227, 'tp_mult': 2.0939048710186494, 'tsl_mult': 0.4658678854417713, 'strategy': 'breakout', 'time_stop': 270, 'use_sma': False, 'use_atr': True, 'use_adx': False, 'use_ema': False, 'use_spike': True, 'rsi_required': False, 'edge_k': 1.5900005340559287, 'edge_cap': 0.6423076188079382, 'bull_strategy': 'breakout', 'bull_bb_std_mult': 1.7433493570632643, 'bull_rsi_os': 18, 'bull_rsi_ob': 77, 'bull_adx_thresh': 30.677671540442798, 'bull_atr_min_pct': 0.0006297404593735849, 'bull_atr_max_pct': 0.08548315234776935, 'bull_tp_mult': 1.6195406425584236, 'bull_tsl_mult': 0.9198063613643875, 'bull_time_stop': 124, 'bull_use_sma': True, 'bull_use_ema': True, 'bull_use_atr': False, 'bull_use_adx': False, 'bull_use_spike': False, 'bull_rsi_required': True, 'bear_strategy': 'mean_reversion', 'bear_bb_std_mult': 2.1108839032372626, 'bear_rsi_os': 17, 'bear_rsi_ob': 80, 'bear_adx_thresh': 10.798116781642012, 'bear_atr_min_pct': 0.028970956994657765, 'bear_atr_max_pct': 0.0327058567508561, 'bear_tp_mult': 2.2932730716133545, 'bear_tsl_mult': 0.5623791235923119, 'bear_time_stop': 266, 'bear_use_sma': False, 'bear_use_ema': False, 'bear_use_atr': False, 'bear_use_adx': False, 'bear_use_spike': True, 'bear_rsi_required': False, 'sideways_strategy': 'breakout', 'sideways_bb_std_mult': 3.043528474998714, 'sideways_rsi_os': 38, 'sideways_rsi_ob': 92, 'sideways_adx_thresh': 9.659209842386089, 'sideways_atr_min_pct': 0.027321016288405855, 'sideways_atr_max_pct': 0.11446846946990195, 'sideways_tp_mult': 2.638304522982171, 'sideways_tsl_mult': 0.864446615160975, 'sideways_time_stop': 226, 'sideways_use_sma': True, 'sideways_use_ema': False, 'sideways_use_atr': False, 'sideways_use_adx': True, 'sideways_use_spike': False, 'sideways_rsi_required': True}.
[I 2025-08-30 15:51:39,856] Trial 205 finished with values: [-0.009535299423162669, 0.009468002909349932] and parameters: {'p_sma': 17, 'p_std': 58, 'p_atr': 25, 'p_adx': 15, 'rsi_period': 31, 'ema1': 26, 'ema2': 60, 'slip_atr_k': 0.011992623036108619, 'slip_spread_k': 0.002827197225584108, 'spread_hl_frac': 0.04729249016916081, 'bb_std_mult': 3.0123413785183137, 'rsi_os': 38, 'rsi_ob': 53, 'vol_spike': 0.011405918288322525, 'adx_thresh': 27.12826334198143, 'atr_min_pct': 0.021399091181314292, 'atr_max_pct': 0.14156573057015925, 'tp_mult': 1.137572665341538, 'tsl_mult': 0.45731735352650743, 'strategy': 'breakout', 'time_stop': 11, 'use_sma': False, 'use_atr': True, 'use_adx': False, 'use_ema': False, 'use_spike': True, 'rsi_required': False, 'edge_k': 1.958476412675521, 'edge_cap': 0.626876544918429, 'bull_strategy': 'breakout', 'bull_bb_std_mult': 1.7513260600014249, 'bull_rsi_os': 11, 'bull_rsi_ob': 76, 'bull_adx_thresh': 30.480593111316786, 'bull_atr_min_pct': 0.0006740739593627822, 'bull_atr_max_pct': 0.12363418577284035, 'bull_tp_mult': 1.4223637443285841, 'bull_tsl_mult': 0.3502356124708539, 'bull_time_stop': 76, 'bull_use_sma': True, 'bull_use_ema': True, 'bull_use_atr': False, 'bull_use_adx': False, 'bull_use_spike': False, 'bull_rsi_required': True, 'bear_strategy': 'mean_reversion', 'bear_bb_std_mult': 2.1000583364962915, 'bear_rsi_os': 17, 'bear_rsi_ob': 76, 'bear_adx_thresh': 13.294727048758073, 'bear_atr_min_pct': 0.028742079962408934, 'bear_atr_max_pct': 0.09100333260313284, 'bear_tp_mult': 2.2934477634216157, 'bear_tsl_mult': 0.5625288471053074, 'bear_time_stop': 267, 'bear_use_sma': False, 'bear_use_ema': False, 'bear_use_atr': False, 'bear_use_adx': False, 'bear_use_spike': True, 'bear_rsi_required': False, 'sideways_strategy': 'breakout', 'sideways_bb_std_mult': 3.064755394213684, 'sideways_rsi_os': 30, 'sideways_rsi_ob': 92, 'sideways_adx_thresh': 15.308063199934347, 'sideways_atr_min_pct': 0.0018653185843293973, 'sideways_atr_max_pct': 0.14996451942844524, 'sideways_tp_mult': 2.6462957026973166, 'sideways_tsl_mult': 0.7446435594112113, 'sideways_time_stop': 225, 'sideways_use_sma': True, 'sideways_use_ema': False, 'sideways_use_atr': False, 'sideways_use_adx': True, 'sideways_use_spike': False, 'sideways_rsi_required': True}.
[I 2025-08-30 15:51:40,489] Trial 203 finished with values: [-1000000000.0, 1000000000.0] and parameters: {'p_sma': 17, 'p_std': 22, 'p_atr': 26, 'p_adx': 18, 'rsi_period': 27, 'ema1': 26, 'ema2': 30, 'slip_atr_k': 0.15294505654182622, 'slip_spread_k': 0.0008478358448280462, 'spread_hl_frac': 0.04760766087129768, 'bb_std_mult': 2.8923600827396196, 'rsi_os': 9, 'rsi_ob': 48, 'vol_spike': 0.13547014525704548, 'adx_thresh': 12.464871082328049, 'atr_min_pct': 0.021575639795489963, 'atr_max_pct': 0.1433841962370345, 'tp_mult': 2.2454440306481867, 'tsl_mult': 0.40805000121190516, 'strategy': 'breakout', 'time_stop': 269, 'use_sma': False, 'use_atr': True, 'use_adx': False, 'use_ema': False, 'use_spike': True, 'rsi_required': False, 'edge_k': 1.9537133270361338, 'edge_cap': 0.6706030215761414, 'bull_strategy': 'breakout', 'bull_bb_std_mult': 2.7138431321645684, 'bull_rsi_os': 18, 'bull_rsi_ob': 75, 'bull_adx_thresh': 30.55010420599405, 'bull_atr_min_pct': 0.0007541258095620439, 'bull_atr_max_pct': 0.052395963847398405, 'bull_tp_mult': 1.7928599763276685, 'bull_tsl_mult': 0.7873981281237412, 'bull_time_stop': 90, 'bull_use_sma': True, 'bull_use_ema': True, 'bull_use_atr': False, 'bull_use_adx': False, 'bull_use_spike': False, 'bull_rsi_required': True, 'bear_strategy': 'mean_reversion', 'bear_bb_std_mult': 2.3244375953237544, 'bear_rsi_os': 17, 'bear_rsi_ob': 56, 'bear_adx_thresh': 10.837860391501328, 'bear_atr_min_pct': 0.021284059373600915, 'bear_atr_max_pct': 0.03154370741549539, 'bear_tp_mult': 1.0730533408583627, 'bear_tsl_mult': 0.41456366999552213, 'bear_time_stop': 268, 'bear_use_sma': False, 'bear_use_ema': False, 'bear_use_atr': False, 'bear_use_adx': False, 'bear_use_spike': True, 'bear_rsi_required': False, 'sideways_strategy': 'breakout', 'sideways_bb_std_mult': 3.0507693407398166, 'sideways_rsi_os': 25, 'sideways_rsi_ob': 88, 'sideways_adx_thresh': 15.188524297497779, 'sideways_atr_min_pct': 0.025100107153085298, 'sideways_atr_max_pct': 0.13205266338899152, 'sideways_tp_mult': 1.5611431312580852, 'sideways_tsl_mult': 0.4202149984849447, 'sideways_time_stop': 247, 'sideways_use_sma': True, 'sideways_use_ema': False, 'sideways_use_atr': True, 'sideways_use_adx': True, 'sideways_use_spike': True, 'sideways_rsi_required': True}.
[I 2025-08-30 15:51:41,903] Trial 204 finished with values: [-1000000000.0, 1000000000.0] and parameters: {'p_sma': 17, 'p_std': 57, 'p_atr': 26, 'p_adx': 18, 'rsi_period': 31, 'ema1': 25, 'ema2': 30, 'slip_atr_k': 0.017193674676071066, 'slip_spread_k': 0.006322550762599688, 'spread_hl_frac': 0.04732430045189434, 'bb_std_mult': 2.9016226116861747, 'rsi_os': 38, 'rsi_ob': 55, 'vol_spike': 0.0103659822099027, 'adx_thresh': 28.137869802252716, 'atr_min_pct': 0.023896465041510846, 'atr_max_pct': 0.14296364942285344, 'tp_mult': 1.0508263652119507, 'tsl_mult': 0.40813911422184856, 'strategy': 'breakout', 'time_stop': 270, 'use_sma': False, 'use_atr': True, 'use_adx': False, 'use_ema': False, 'use_spike': True, 'rsi_required': False, 'edge_k': 1.4036310652739474, 'edge_cap': 0.6614550056660315, 'bull_strategy': 'breakout', 'bull_bb_std_mult': 1.7685897137181525, 'bull_rsi_os': 11, 'bull_rsi_ob': 76, 'bull_adx_thresh': 30.59250652297322, 'bull_atr_min_pct': 0.002594367963521316, 'bull_atr_max_pct': 0.08438807503021747, 'bull_tp_mult': 2.580221928349418, 'bull_tsl_mult': 0.38840467909979376, 'bull_time_stop': 91, 'bull_use_sma': True, 'bull_use_ema': True, 'bull_use_atr': False, 'bull_use_adx': False, 'bull_use_spike': False, 'bull_rsi_required': True, 'bear_strategy': 'mean_reversion', 'bear_bb_std_mult': 2.323553169722391, 'bear_rsi_os': 17, 'bear_rsi_ob': 56, 'bear_adx_thresh': 13.149902362616071, 'bear_atr_min_pct': 0.028671094723735167, 'bear_atr_max_pct': 0.09156257427992567, 'bear_tp_mult': 2.285936669689192, 'bear_tsl_mult': 0.561749788037447, 'bear_time_stop': 269, 'bear_use_sma': False, 'bear_use_ema': False, 'bear_use_atr': False, 'bear_use_adx': False, 'bear_use_spike': True, 'bear_rsi_required': False, 'sideways_strategy': 'breakout', 'sideways_bb_std_mult': 3.223839306075755, 'sideways_rsi_os': 25, 'sideways_rsi_ob': 92, 'sideways_adx_thresh': 15.304010714242274, 'sideways_atr_min_pct': 0.0017074600665995183, 'sideways_atr_max_pct': 0.08559285316670164, 'sideways_tp_mult': 1.5331552727637967, 'sideways_tsl_mult': 0.3358236400463736, 'sideways_time_stop': 227, 'sideways_use_sma': True, 'sideways_use_ema': False, 'sideways_use_atr': True, 'sideways_use_adx': True, 'sideways_use_spike': True, 'sideways_rsi_required': True}.
