[I 2025-08-30 16:14:12,626] Trial 332 finished with values: [-1000000000.0, 1000000000.0] and parameters: {'p_sma': 7, 'p_std': 57, 'p_atr': 18, 'p_adx': 20, 'rsi_period': 21, 'ema1': 24, 'ema2': 13, 'slip_atr_k': 0.011777683745912142, 'slip_spread_k': 0.1450943514976457, 'spread_hl_frac': 0.01813991132009891, 'bb_std_mult': 2.4018228719578074, 'rsi_os': 35, 'rsi_ob': 90, 'vol_spike': 0.013502122293264212, 'adx_thresh': 31.28887532054043, 'atr_min_pct': 0.0010001716575864603, 'atr_max_pct': 0.09172822734728223, 'tp_mult': 2.480022180011156, 'tsl_mult': 0.45006201167733545, 'strategy': 'mean_reversion', 'time_stop': 233, 'use_sma': False, 'use_atr': True, 'use_adx': True, 'use_ema': False, 'use_spike': False, 'rsi_required': True, 'edge_k': 0.925430484331794, 'edge_cap': 0.6561706955411141, 'bull_strategy': 'mean_reversion', 'bull_bb_std_mult': 1.9408916746066993, 'bull_rsi_os': 9, 'bull_rsi_ob': 51, 'bull_adx_thresh': 25.736536268901673, 'bull_atr_min_pct': 0.017355913524822603, 'bull_atr_max_pct': 0.08932868885769767, 'bull_tp_mult': 1.0477811699329647, 'bull_tsl_mult': 0.30738141938643476, 'bull_time_stop': 65, 'bull_use_sma': False, 'bull_use_ema': True, 'bull_use_atr': True, 'bull_use_adx': True, 'bull_use_spike': True, 'bull_rsi_required': False, 'bear_strategy': 'mean_reversion', 'bear_bb_std_mult': 2.0866098292572537, 'bear_rsi_os': 13, 'bear_rsi_ob': 47, 'bear_adx_thresh': 27.19614836432524, 'bear_atr_min_pct': 0.00639695641658139, 'bear_atr_max_pct': 0.06766385172423241, 'bear_tp_mult': 1.102261782795597, 'bear_tsl_mult': 0.7391015998462229, 'bear_time_stop': 217, 'bear_use_sma': True, 'bear_use_ema': False, 'bear_use_atr': False, 'bear_use_adx': False, 'bear_use_spike': False, 'bear_rsi_required': False, 'sideways_strategy': 'mean_reversion', 'sideways_bb_std_mult': 2.0797702663144157, 'sideways_rsi_os': 29, 'sideways_rsi_ob': 91, 'sideways_adx_thresh': 16.947278093366656, 'sideways_atr_min_pct': 0.029861767878636675, 'sideways_atr_max_pct': 0.11938745830967895, 'sideways_tp_mult': 1.50448498672106, 'sideways_tsl_mult': 0.4456713153316223, 'sideways_time_stop': 85, 'sideways_use_sma': False, 'sideways_use_ema': False, 'sideways_use_atr': False, 'sideways_use_adx': False, 'sideways_use_spike': True, 'sideways_rsi_required': True}.
[I 2025-08-30 16:14:12,976] Trial 330 finished with values: [-0.01861230433230321, 0.018548564934270515] and parameters: {'p_sma': 10, 'p_std': 48, 'p_atr': 18, 'p_adx': 24, 'rsi_period': 21, 'ema1': 24, 'ema2': 12, 'slip_atr_k': 0.012481708500638398, 'slip_spread_k': 0.6101445119429846, 'spread_hl_frac': 0.015563055614503026, 'bb_std_mult': 3.0581718903386528, 'rsi_os': 19, 'rsi_ob': 90, 'vol_spike': 0.2026125465324878, 'adx_thresh': 15.217070448600063, 'atr_min_pct': 0.0008463407620812949, 'atr_max_pct': 0.021919393907021828, 'tp_mult': 2.956277775758042, 'tsl_mult': 0.3055938582027833, 'strategy': 'mean_reversion', 'time_stop': 232, 'use_sma': False, 'use_atr': True, 'use_adx': True, 'use_ema': False, 'use_spike': False, 'rsi_required': True, 'edge_k': 1.3828797003469189, 'edge_cap': 0.9784636013652785, 'bull_strategy': 'mean_reversion', 'bull_bb_std_mult': 1.0609306224352644, 'bull_rsi_os': 17, 'bull_rsi_ob': 51, 'bull_adx_thresh': 21.328051788372377, 'bull_atr_min_pct': 0.019764652534672498, 'bull_atr_max_pct': 0.04170978769197717, 'bull_tp_mult': 1.2324161283277428, 'bull_tsl_mult': 0.3041712014339858, 'bull_time_stop': 77, 'bull_use_sma': False, 'bull_use_ema': True, 'bull_use_atr': True, 'bull_use_adx': True, 'bull_use_spike': False, 'bull_rsi_required': False, 'bear_strategy': 'mean_reversion', 'bear_bb_std_mult': 2.7438349996235747, 'bear_rsi_os': 13, 'bear_rsi_ob': 48, 'bear_adx_thresh': 31.35524937265744, 'bear_atr_min_pct': 0.020623681324102257, 'bear_atr_max_pct': 0.06806257531196833, 'bear_tp_mult': 1.2962800093649727, 'bear_tsl_mult': 0.7422843255495896, 'bear_time_stop': 212, 'bear_use_sma': True, 'bear_use_ema': False, 'bear_use_atr': False, 'bear_use_adx': False, 'bear_use_spike': False, 'bear_rsi_required': False, 'sideways_strategy': 'breakout', 'sideways_bb_std_mult': 2.0562181866808555, 'sideways_rsi_os': 29, 'sideways_rsi_ob': 89, 'sideways_adx_thresh': 17.939480444362413, 'sideways_atr_min_pct': 0.0012320609156204543, 'sideways_atr_max_pct': 0.11690551856780292, 'sideways_tp_mult': 1.424974375752603, 'sideways_tsl_mult': 0.4813687554690358, 'sideways_time_stop': 192, 'sideways_use_sma': True, 'sideways_use_ema': False, 'sideways_use_atr': False, 'sideways_use_adx': False, 'sideways_use_spike': False, 'sideways_rsi_required': True}.
[I 2025-08-30 16:14:13,936] Trial 335 finished with values: [-1000000000.0, 1000000000.0] and parameters: {'p_sma': 53, 'p_std': 58, 'p_atr': 18, 'p_adx': 23, 'rsi_period': 21, 'ema1': 5, 'ema2': 13, 'slip_atr_k': 0.011577095090624726, 'slip_spread_k': 0.1959034108101934, 'spread_hl_frac': 0.005388293108342802, 'bb_std_mult': 2.4112016708280533, 'rsi_os': 33, 'rsi_ob': 67, 'vol_spike': 0.19424172193081096, 'adx_thresh': 10.12658508186691, 'atr_min_pct': 0.009567841177701571, 'atr_max_pct': 0.12356178767484129, 'tp_mult': 2.601022176375139, 'tsl_mult': 0.026389233928443834, 'strategy': 'mean_reversion', 'time_stop': 43, 'use_sma': False, 'use_atr': True, 'use_adx': True, 'use_ema': False, 'use_spike': False, 'rsi_required': True, 'edge_k': 1.0973754955948296, 'edge_cap': 0.6465548563818094, 'bull_strategy': 'mean_reversion', 'bull_bb_std_mult': 1.9345594993518709, 'bull_rsi_os': 49, 'bull_rsi_ob': 49, 'bull_adx_thresh': 21.886214106268497, 'bull_atr_min_pct': 0.005966370905105142, 'bull_atr_max_pct': 0.1369753879472853, 'bull_tp_mult': 2.9847996221143385, 'bull_tsl_mult': 0.2617598317041224, 'bull_time_stop': 63, 'bull_use_sma': False, 'bull_use_ema': True, 'bull_use_atr': True, 'bull_use_adx': True, 'bull_use_spike': False, 'bull_rsi_required': False, 'bear_strategy': 'mean_reversion', 'bear_bb_std_mult': 2.6443941838870906, 'bear_rsi_os': 25, 'bear_rsi_ob': 59, 'bear_adx_thresh': 13.943691181013431, 'bear_atr_min_pct': 0.02264512968794541, 'bear_atr_max_pct': 0.06698822888743376, 'bear_tp_mult': 1.0686503210917144, 'bear_tsl_mult': 0.7396060131214706, 'bear_time_stop': 223, 'bear_use_sma': True, 'bear_use_ema': False, 'bear_use_atr': False, 'bear_use_adx': False, 'bear_use_spike': False, 'bear_rsi_required': False, 'sideways_strategy': 'breakout', 'sideways_bb_std_mult': 1.6581432278151405, 'sideways_rsi_os': 28, 'sideways_rsi_ob': 91, 'sideways_adx_thresh': 18.06833741177062, 'sideways_atr_min_pct': 0.02359112299864513, 'sideways_atr_max_pct': 0.13671325939331333, 'sideways_tp_mult': 1.7596914586635855, 'sideways_tsl_mult': 0.5234735157928613, 'sideways_time_stop': 99, 'sideways_use_sma': False, 'sideways_use_ema': False, 'sideways_use_atr': False, 'sideways_use_adx': False, 'sideways_use_spike': False, 'sideways_rsi_required': True}.
[I 2025-08-30 16:14:14,695] Trial 339 finished with values: [-1000000000.0, 1000000000.0] and parameters: {'p_sma': 5, 'p_std': 39, 'p_atr': 9, 'p_adx': 25, 'rsi_period': 17, 'ema1': 27, 'ema2': 10, 'slip_atr_k': 0.19947001218541333, 'slip_spread_k': 0.5083879727486407, 'spread_hl_frac': 0.016717164028802294, 'bb_std_mult': 1.433843336775045, 'rsi_os': 51, 'rsi_ob': 85, 'vol_spike': 0.05567482396025816, 'adx_thresh': 13.391729733632648, 'atr_min_pct': 0.01904275343159842, 'atr_max_pct': 0.1400368982013361, 'tp_mult': 2.639598144086766, 'tsl_mult': 0.8711589287902926, 'strategy': 'mean_reversion', 'time_stop': 101, 'use_sma': True, 'use_atr': True, 'use_adx': True, 'use_ema': True, 'use_spike': False, 'rsi_required': True, 'edge_k': 1.4457715017404038, 'edge_cap': 0.473801859882581, 'bull_strategy': 'mean_reversion', 'bull_bb_std_mult': 0.6411981459210228, 'bull_rsi_os': 11, 'bull_rsi_ob': 49, 'bull_adx_thresh': 14.937482557061152, 'bull_atr_min_pct': 0.02438594463008841, 'bull_atr_max_pct': 0.13405883383576997, 'bull_tp_mult': 1.1680468878705013, 'bull_tsl_mult': 0.08768406146401986, 'bull_time_stop': 280, 'bull_use_sma': False, 'bull_use_ema': True, 'bull_use_atr': True, 'bull_use_adx': True, 'bull_use_spike': False, 'bull_rsi_required': False, 'bear_strategy': 'breakout', 'bear_bb_std_mult': 3.2471134332668274, 'bear_rsi_os': 12, 'bear_rsi_ob': 85, 'bear_adx_thresh': 11.713020509038717, 'bear_atr_min_pct': 0.015306508488453762, 'bear_atr_max_pct': 0.11051702717183973, 'bear_tp_mult': 2.0687671130623304, 'bear_tsl_mult': 0.22851677516811625, 'bear_time_stop': 225, 'bear_use_sma': True, 'bear_use_ema': True, 'bear_use_atr': True, 'bear_use_adx': True, 'bear_use_spike': False, 'bear_rsi_required': True, 'sideways_strategy': 'breakout', 'sideways_bb_std_mult': 0.9665404912761626, 'sideways_rsi_os': 24, 'sideways_rsi_ob': 93, 'sideways_adx_thresh': 15.917750914594931, 'sideways_atr_min_pct': 0.0172253944503287, 'sideways_atr_max_pct': 0.14552307574651052, 'sideways_tp_mult': 1.5498597099724734, 'sideways_tsl_mult': 0.4608265924764844, 'sideways_time_stop': 294, 'sideways_use_sma': True, 'sideways_use_ema': False, 'sideways_use_atr': True, 'sideways_use_adx': False, 'sideways_use_spike': False, 'sideways_rsi_required': False}.
[I 2025-08-30 16:14:58,229] Trial 340 finished with values: [-1000000000.0, 1000000000.0] and parameters: {'p_sma': 43, 'p_std': 55, 'p_atr': 13, 'p_adx': 10, 'rsi_period': 19, 'ema1': 25, 'ema2': 11, 'slip_atr_k': 0.18437770639041753, 'slip_spread_k': 0.707574080115497, 'spread_hl_frac': 0.010603627166083701, 'bb_std_mult': 3.1492106446161676, 'rsi_os': 35, 'rsi_ob': 95, 'vol_spike': 0.1832243441693106, 'adx_thresh': 13.033178865775929, 'atr_min_pct': 0.01929455069013941, 'atr_max_pct': 0.13133737245796084, 'tp_mult': 2.7414298918055477, 'tsl_mult': 0.24936871941738875, 'strategy': 'mean_reversion', 'time_stop': 55, 'use_sma': False, 'use_atr': True, 'use_adx': True, 'use_ema': False, 'use_spike': False, 'rsi_required': True, 'edge_k': 1.6521877931606663, 'edge_cap': 0.6311238796029797, 'bull_strategy': 'mean_reversion', 'bull_bb_std_mult': 0.7292546729216598, 'bull_rsi_os': 6, 'bull_rsi_ob': 50, 'bull_adx_thresh': 23.7465847933195, 'bull_atr_min_pct': 0.021355514828280957, 'bull_atr_max_pct': 0.07701515411374231, 'bull_tp_mult': 1.2842171171640029, 'bull_tsl_mult': 0.2501716138550512, 'bull_time_stop': 291, 'bull_use_sma': False, 'bull_use_ema': True, 'bull_use_atr': True, 'bull_use_adx': True, 'bull_use_spike': False, 'bull_rsi_required': False, 'bear_strategy': 'mean_reversion', 'bear_bb_std_mult': 0.6799910232326283, 'bear_rsi_os': 11, 'bear_rsi_ob': 66, 'bear_adx_thresh': 13.220571303966512, 'bear_atr_min_pct': 0.021297404509719536, 'bear_atr_max_pct': 0.045037865903180735, 'bear_tp_mult': 2.181742780093003, 'bear_tsl_mult': 0.8165848463829288, 'bear_time_stop': 110, 'bear_use_sma': True, 'bear_use_ema': False, 'bear_use_atr': True, 'bear_use_adx': False, 'bear_use_spike': False, 'bear_rsi_required': False, 'sideways_strategy': 'breakout', 'sideways_bb_std_mult': 2.147984301844657, 'sideways_rsi_os': 16, 'sideways_rsi_ob': 94, 'sideways_adx_thresh': 21.09331677558966, 'sideways_atr_min_pct': 0.0033567022540784528, 'sideways_atr_max_pct': 0.1420923763945967, 'sideways_tp_mult': 1.3634917119653691, 'sideways_tsl_mult': 0.511359344267958, 'sideways_time_stop': 208, 'sideways_use_sma': True, 'sideways_use_ema': False, 'sideways_use_atr': False, 'sideways_use_adx': False, 'sideways_use_spike': False, 'sideways_rsi_required': True}.
[I 2025-08-30 16:14:58,230] Trial 337 finished with values: [-1000000000.0, 1000000000.0] and parameters: {'p_sma': 5, 'p_std': 26, 'p_atr': 16, 'p_adx': 29, 'rsi_period': 17, 'ema1': 9, 'ema2': 17, 'slip_atr_k': 0.016420241585670736, 'slip_spread_k': 0.5755667611083457, 'spread_hl_frac': 0.028162029572914457, 'bb_std_mult': 3.3489262442624184, 'rsi_os': 18, 'rsi_ob': 67, 'vol_spike': 0.00028426889389918705, 'adx_thresh': 13.205823936136962, 'atr_min_pct': 0.01917214746372511, 'atr_max_pct': 0.12361022116967182, 'tp_mult': 1.7814003038711124, 'tsl_mult': 0.3004146494834049, 'strategy': 'mean_reversion', 'time_stop': 17, 'use_sma': True, 'use_atr': True, 'use_adx': True, 'use_ema': False, 'use_spike': False, 'rsi_required': True, 'edge_k': 1.656384002628923, 'edge_cap': 0.17909092142735916, 'bull_strategy': 'mean_reversion', 'bull_bb_std_mult': 3.3389757706269716, 'bull_rsi_os': 11, 'bull_rsi_ob': 49, 'bull_adx_thresh': 15.184070350617684, 'bull_atr_min_pct': 0.01864738157591971, 'bull_atr_max_pct': 0.07082429173901061, 'bull_tp_mult': 1.2703242434443769, 'bull_tsl_mult': 0.09269962937459514, 'bull_time_stop': 133, 'bull_use_sma': False, 'bull_use_ema': True, 'bull_use_atr': True, 'bull_use_adx': True, 'bull_use_spike': False, 'bull_rsi_required': False, 'bear_strategy': 'mean_reversion', 'bear_bb_std_mult': 2.6137142647951435, 'bear_rsi_os': 12, 'bear_rsi_ob': 62, 'bear_adx_thresh': 15.981217831940176, 'bear_atr_min_pct': 0.02269858283979922, 'bear_atr_max_pct': 0.09953638537844661, 'bear_tp_mult': 1.2871429474351175, 'bear_tsl_mult': 0.3488031634270712, 'bear_time_stop': 222, 'bear_use_sma': True, 'bear_use_ema': False, 'bear_use_atr': True, 'bear_use_adx': True, 'bear_use_spike': False, 'bear_rsi_required': False, 'sideways_strategy': 'breakout', 'sideways_bb_std_mult': 2.127012078132622, 'sideways_rsi_os': 26, 'sideways_rsi_ob': 94, 'sideways_adx_thresh': 5.878926323284125, 'sideways_atr_min_pct': 0.01563138599865185, 'sideways_atr_max_pct': 0.13678094868777232, 'sideways_tp_mult': 1.571261373279232, 'sideways_tsl_mult': 0.5199752644804138, 'sideways_time_stop': 74, 'sideways_use_sma': True, 'sideways_use_ema': False, 'sideways_use_atr': False, 'sideways_use_adx': False, 'sideways_use_spike': False, 'sideways_rsi_required': True}.
[I 2025-08-30 16:14:58,573] Trial 336 finished with values: [-1000000000.0, 1000000000.0] and parameters: {'p_sma': 41, 'p_std': 59, 'p_atr': 13, 'p_adx': 10, 'rsi_period': 17, 'ema1': 9, 'ema2': 12, 'slip_atr_k': 0.09643248412354499, 'slip_spread_k': 0.7071661393427313, 'spread_hl_frac': 0.01644690074465655, 'bb_std_mult': 3.3594079017875873, 'rsi_os': 18, 'rsi_ob': 85, 'vol_spike': 0.00016682923678670663, 'adx_thresh': 13.210070132409463, 'atr_min_pct': 0.010744398433933757, 'atr_max_pct': 0.06595585914521652, 'tp_mult': 2.90579683979303, 'tsl_mult': 0.4701647820754759, 'strategy': 'mean_reversion', 'time_stop': 16, 'use_sma': False, 'use_atr': True, 'use_adx': True, 'use_ema': False, 'use_spike': False, 'rsi_required': True, 'edge_k': 1.1036435329901229, 'edge_cap': 0.4730919606324737, 'bull_strategy': 'mean_reversion', 'bull_bb_std_mult': 1.9524230790956865, 'bull_rsi_os': 11, 'bull_rsi_ob': 49, 'bull_adx_thresh': 22.031064604125447, 'bull_atr_min_pct': 0.021329725530504298, 'bull_atr_max_pct': 0.041737135017227305, 'bull_tp_mult': 1.9171116472461143, 'bull_tsl_mult': 0.31119874741738285, 'bull_time_stop': 279, 'bull_use_sma': False, 'bull_use_ema': True, 'bull_use_atr': True, 'bull_use_adx': True, 'bull_use_spike': False, 'bull_rsi_required': False, 'bear_strategy': 'mean_reversion', 'bear_bb_std_mult': 1.8442272207226957, 'bear_rsi_os': 12, 'bear_rsi_ob': 60, 'bear_adx_thresh': 11.549178536280504, 'bear_atr_min_pct': 0.021112460294736735, 'bear_atr_max_pct': 0.06692330419102066, 'bear_tp_mult': 2.163834797134578, 'bear_tsl_mult': 0.8175814285772074, 'bear_time_stop': 225, 'bear_use_sma': True, 'bear_use_ema': False, 'bear_use_atr': True, 'bear_use_adx': False, 'bear_use_spike': False, 'bear_rsi_required': False, 'sideways_strategy': 'breakout', 'sideways_bb_std_mult': 1.6727818939254246, 'sideways_rsi_os': 16, 'sideways_rsi_ob': 71, 'sideways_adx_thresh': 18.113254266136394, 'sideways_atr_min_pct': 0.015608859609501128, 'sideways_atr_max_pct': 0.13598880503880012, 'sideways_tp_mult': 1.5575306871098922, 'sideways_tsl_mult': 0.5202569215633623, 'sideways_time_stop': 294, 'sideways_use_sma': True, 'sideways_use_ema': False, 'sideways_use_atr': False, 'sideways_use_adx': False, 'sideways_use_spike': False, 'sideways_rsi_required': True}.
[I 2025-08-30 16:14:58,912] Trial 338 finished with values: [-1000000000.0, 1000000000.0] and parameters: {'p_sma': 5, 'p_std': 59, 'p_atr': 22, 'p_adx': 25, 'rsi_period': 17, 'ema1': 27, 'ema2': 10, 'slip_atr_k': 0.09535667303315869, 'slip_spread_k': 0.5796640293435589, 'spread_hl_frac': 0.016758668180306278, 'bb_std_mult': 3.1517616990658857, 'rsi_os': 6, 'rsi_ob': 85, 'vol_spike': 0.18532790787091127, 'adx_thresh': 13.286665506757219, 'atr_min_pct': 0.010869311799931386, 'atr_max_pct': 0.13928004325277266, 'tp_mult': 2.644317760610273, 'tsl_mult': 0.6559605014414654, 'strategy': 'mean_reversion', 'time_stop': 16, 'use_sma': True, 'use_atr': True, 'use_adx': True, 'use_ema': False, 'use_spike': False, 'rsi_required': True, 'edge_k': 1.45307213300359, 'edge_cap': 0.9219899033104608, 'bull_strategy': 'mean_reversion', 'bull_bb_std_mult': 3.3656372979425617, 'bull_rsi_os': 11, 'bull_rsi_ob': 86, 'bull_adx_thresh': 18.431740016736278, 'bull_atr_min_pct': 0.018611127335073585, 'bull_atr_max_pct': 0.1309687249958464, 'bull_tp_mult': 1.1758825401859545, 'bull_tsl_mult': 0.26329651142177013, 'bull_time_stop': 203, 'bull_use_sma': False, 'bull_use_ema': True, 'bull_use_atr': True, 'bull_use_adx': True, 'bull_use_spike': False, 'bull_rsi_required': False, 'bear_strategy': 'mean_reversion', 'bear_bb_std_mult': 3.241895336717355, 'bear_rsi_os': 12, 'bear_rsi_ob': 76, 'bear_adx_thresh': 6.951000531658579, 'bear_atr_min_pct': 0.010481070875801371, 'bear_atr_max_pct': 0.02622418171102754, 'bear_tp_mult': 2.1602085456714795, 'bear_tsl_mult': 0.674864616639842, 'bear_time_stop': 226, 'bear_use_sma': True, 'bear_use_ema': False, 'bear_use_atr': True, 'bear_use_adx': True, 'bear_use_spike': False, 'bear_rsi_required': True, 'sideways_strategy': 'breakout', 'sideways_bb_std_mult': 2.139445645842901, 'sideways_rsi_os': 8, 'sideways_rsi_ob': 94, 'sideways_adx_thresh': 15.80919059359546, 'sideways_atr_min_pct': 0.02048261379255583, 'sideways_atr_max_pct': 0.13546296087797838, 'sideways_tp_mult': 1.7002464389158607, 'sideways_tsl_mult': 0.5145844138421887, 'sideways_time_stop': 66, 'sideways_use_sma': True, 'sideways_use_ema': False, 'sideways_use_atr': True, 'sideways_use_adx': False, 'sideways_use_spike': False, 'sideways_rsi_required': True}.
[I 2025-08-30 16:15:40,581] Trial 341 finished with values: [-0.043553855804281505, 0.043616664551996975] and parameters: {'p_sma': 11, 'p_std': 59, 'p_atr': 22, 'p_adx': 24, 'rsi_period': 7, 'ema1': 26, 'ema2': 22, 'slip_atr_k': 0.0008771061850542852, 'slip_spread_k': 0.33997855691608964, 'spread_hl_frac': 0.03549687479360376, 'bb_std_mult': 3.1560559785692033, 'rsi_os': 8, 'rsi_ob': 87, 'vol_spike': 0.006613013894545958, 'adx_thresh': 10.792010733091821, 'atr_min_pct': 0.010298161856210363, 'atr_max_pct': 0.13883927012972766, 'tp_mult': 1.5873579124664383, 'tsl_mult': 0.7144380890523326, 'strategy': 'mean_reversion', 'time_stop': 14, 'use_sma': False, 'use_atr': True, 'use_adx': True, 'use_ema': False, 'use_spike': False, 'rsi_required': True, 'edge_k': 1.6040037882134965, 'edge_cap': 0.5722583183104831, 'bull_strategy': 'mean_reversion', 'bull_bb_std_mult': 1.8954264551695057, 'bull_rsi_os': 12, 'bull_rsi_ob': 85, 'bull_adx_thresh': 18.30898736629796, 'bull_atr_min_pct': 0.009502276431925302, 'bull_atr_max_pct': 0.1322246947328806, 'bull_tp_mult': 2.229819733454814, 'bull_tsl_mult': 0.2732760210745748, 'bull_time_stop': 81, 'bull_use_sma': False, 'bull_use_ema': True, 'bull_use_atr': True, 'bull_use_adx': True, 'bull_use_spike': False, 'bull_rsi_required': False, 'bear_strategy': 'mean_reversion', 'bear_bb_std_mult': 1.751513435038053, 'bear_rsi_os': 9, 'bear_rsi_ob': 76, 'bear_adx_thresh': 17.60993844605454, 'bear_atr_min_pct': 0.002637615929954984, 'bear_atr_max_pct': 0.08813957371649157, 'bear_tp_mult': 2.155615187165151, 'bear_tsl_mult': 0.039792795784515, 'bear_time_stop': 84, 'bear_use_sma': True, 'bear_use_ema': False, 'bear_use_atr': False, 'bear_use_adx': False, 'bear_use_spike': False, 'bear_rsi_required': True, 'sideways_strategy': 'breakout', 'sideways_bb_std_mult': 1.0558303297847722, 'sideways_rsi_os': 9, 'sideways_rsi_ob': 71, 'sideways_adx_thresh': 16.356832337450488, 'sideways_atr_min_pct': 0.000671604963925286, 'sideways_atr_max_pct': 0.11055350239681375, 'sideways_tp_mult': 1.435740414256661, 'sideways_tsl_mult': 0.4919642371114488, 'sideways_time_stop': 60, 'sideways_use_sma': True, 'sideways_use_ema': False, 'sideways_use_atr': True, 'sideways_use_adx': False, 'sideways_use_spike': False, 'sideways_rsi_required': True}.
