[I 2025-08-30 17:31:49,366] Trial 793 finished with values: [-0.01457382676767971, 0.014593204964833104] and parameters: {'p_sma': 6, 'p_std': 19, 'p_atr': 16, 'p_adx': 7, 'rsi_period': 42, 'ema1': 8, 'ema2': 11, 'slip_atr_k': 0.005538233168709665, 'slip_spread_k': 0.9432773275673154, 'spread_hl_frac': 0.02154932173730063, 'bb_std_mult': 3.0584532576008256, 'rsi_os': 48, 'rsi_ob': 87, 'vol_spike': 0.08563106185011429, 'adx_thresh': 10.035097645698755, 'atr_min_pct': 0.02080900930297079, 'atr_max_pct': 0.11069053073414953, 'tp_mult': 2.744825740536825, 'tsl_mult': 0.9126243938224674, 'strategy': 'mean_reversion', 'time_stop': 70, 'use_sma': False, 'use_atr': True, 'use_adx': True, 'use_ema': True, 'use_spike': False, 'rsi_required': True, 'edge_k': 1.2314991387627017, 'edge_cap': 0.965489703984663, 'bull_strategy': 'breakout', 'bull_bb_std_mult': 1.7602235447634713, 'bull_rsi_os': 29, 'bull_rsi_ob': 85, 'bull_adx_thresh': 17.20582123943916, 'bull_atr_min_pct': 0.002888688881528007, 'bull_atr_max_pct': 0.13437629059843362, 'bull_tp_mult': 2.227085317703993, 'bull_tsl_mult': 0.7638907840075777, 'bull_time_stop': 154, 'bull_use_sma': True, 'bull_use_ema': False, 'bull_use_atr': False, 'bull_use_adx': True, 'bull_use_spike': True, 'bull_rsi_required': True, 'bear_strategy': 'breakout', 'bear_bb_std_mult': 1.1089310664914156, 'bear_rsi_os': 37, 'bear_rsi_ob': 55, 'bear_adx_thresh': 12.027715787415161, 'bear_atr_min_pct': 0.019265493425701132, 'bear_atr_max_pct': 0.018836933830509578, 'bear_tp_mult': 2.1018250427888656, 'bear_tsl_mult': 0.6585129641827037, 'bear_time_stop': 206, 'bear_use_sma': True, 'bear_use_ema': True, 'bear_use_atr': False, 'bear_use_adx': False, 'bear_use_spike': False, 'bear_rsi_required': False, 'sideways_strategy': 'breakout', 'sideways_bb_std_mult': 0.7706502431643402, 'sideways_rsi_os': 31, 'sideways_rsi_ob': 64, 'sideways_adx_thresh': 7.933623800291347, 'sideways_atr_min_pct': 9.39648220651089e-06, 'sideways_atr_max_pct': 0.0713609151852171, 'sideways_tp_mult': 2.954352137558936, 'sideways_tsl_mult': 0.38602407337646877, 'sideways_time_stop': 127, 'sideways_use_sma': True, 'sideways_use_ema': False, 'sideways_use_atr': True, 'sideways_use_adx': True, 'sideways_use_spike': True, 'sideways_rsi_required': False}.
[I 2025-08-30 17:31:49,908] Trial 792 finished with values: [-1000000000.0, 1000000000.0] and parameters: {'p_sma': 33, 'p_std': 19, 'p_atr': 18, 'p_adx': 10, 'rsi_period': 23, 'ema1': 8, 'ema2': 11, 'slip_atr_k': 0.17638727860015002, 'slip_spread_k': 0.23572927182737785, 'spread_hl_frac': 0.018902638478083513, 'bb_std_mult': 3.143686385653629, 'rsi_os': 34, 'rsi_ob': 86, 'vol_spike': 0.07383627843688643, 'adx_thresh': 11.489824221250956, 'atr_min_pct': 0.0182758832683683, 'atr_max_pct': 0.0569040849791667, 'tp_mult': 2.7340181240089096, 'tsl_mult': 0.7006015206479994, 'strategy': 'mean_reversion', 'time_stop': 170, 'use_sma': False, 'use_atr': True, 'use_adx': True, 'use_ema': True, 'use_spike': False, 'rsi_required': True, 'edge_k': 0.5058674363333494, 'edge_cap': 0.4649872312380366, 'bull_strategy': 'breakout', 'bull_bb_std_mult': 2.0423127128788487, 'bull_rsi_os': 26, 'bull_rsi_ob': 85, 'bull_adx_thresh': 17.49379179200612, 'bull_atr_min_pct': 0.029164013419814575, 'bull_atr_max_pct': 0.13404327458789236, 'bull_tp_mult': 1.693575210024208, 'bull_tsl_mult': 0.8398305883238294, 'bull_time_stop': 118, 'bull_use_sma': True, 'bull_use_ema': False, 'bull_use_atr': False, 'bull_use_adx': True, 'bull_use_spike': True, 'bull_rsi_required': True, 'bear_strategy': 'breakout', 'bear_bb_std_mult': 1.0820533914068777, 'bear_rsi_os': 15, 'bear_rsi_ob': 55, 'bear_adx_thresh': 31.58233370541093, 'bear_atr_min_pct': 0.019120740141853304, 'bear_atr_max_pct': 0.015384414630989635, 'bear_tp_mult': 2.1161116231872845, 'bear_tsl_mult': 0.8393120827116214, 'bear_time_stop': 300, 'bear_use_sma': True, 'bear_use_ema': True, 'bear_use_atr': False, 'bear_use_adx': False, 'bear_use_spike': False, 'bear_rsi_required': False, 'sideways_strategy': 'breakout', 'sideways_bb_std_mult': 0.7409850535491916, 'sideways_rsi_os': 9, 'sideways_rsi_ob': 57, 'sideways_adx_thresh': 13.095137868661878, 'sideways_atr_min_pct': 0.0004448861943808272, 'sideways_atr_max_pct': 0.08589673258184599, 'sideways_tp_mult': 2.2218118728725416, 'sideways_tsl_mult': 0.410142878082858, 'sideways_time_stop': 123, 'sideways_use_sma': True, 'sideways_use_ema': False, 'sideways_use_atr': True, 'sideways_use_adx': True, 'sideways_use_spike': False, 'sideways_rsi_required': False}.
[I 2025-08-30 17:31:50,235] Trial 794 finished with values: [-1000000000.0, 1000000000.0] and parameters: {'p_sma': 6, 'p_std': 19, 'p_atr': 18, 'p_adx': 8, 'rsi_period': 64, 'ema1': 10, 'ema2': 11, 'slip_atr_k': 0.08528751511291378, 'slip_spread_k': 0.4031247439312514, 'spread_hl_frac': 0.006579367269961511, 'bb_std_mult': 3.3143625466192796, 'rsi_os': 34, 'rsi_ob': 87, 'vol_spike': 0.0654975799399825, 'adx_thresh': 9.957821249855003, 'atr_min_pct': 0.027213376796141525, 'atr_max_pct': 0.1417437127623089, 'tp_mult': 2.74118144761966, 'tsl_mult': 0.9124879407506131, 'strategy': 'mean_reversion', 'time_stop': 222, 'use_sma': False, 'use_atr': True, 'use_adx': True, 'use_ema': True, 'use_spike': False, 'rsi_required': True, 'edge_k': 1.8676461630049763, 'edge_cap': 0.976906402858509, 'bull_strategy': 'breakout', 'bull_bb_std_mult': 3.276520708093388, 'bull_rsi_os': 25, 'bull_rsi_ob': 52, 'bull_adx_thresh': 6.536033978187346, 'bull_atr_min_pct': 0.021134021191139614, 'bull_atr_max_pct': 0.14153900246030143, 'bull_tp_mult': 2.2288695576900124, 'bull_tsl_mult': 0.8419763956131174, 'bull_time_stop': 120, 'bull_use_sma': True, 'bull_use_ema': False, 'bull_use_atr': False, 'bull_use_adx': True, 'bull_use_spike': False, 'bull_rsi_required': True, 'bear_strategy': 'breakout', 'bear_bb_std_mult': 1.1038424320324027, 'bear_rsi_os': 15, 'bear_rsi_ob': 74, 'bear_adx_thresh': 12.042159797018478, 'bear_atr_min_pct': 0.006598150660134607, 'bear_atr_max_pct': 0.01934568118456355, 'bear_tp_mult': 2.99977266130775, 'bear_tsl_mult': 0.2676621076472092, 'bear_time_stop': 128, 'bear_use_sma': False, 'bear_use_ema': True, 'bear_use_atr': False, 'bear_use_adx': False, 'bear_use_spike': False, 'bear_rsi_required': False, 'sideways_strategy': 'breakout', 'sideways_bb_std_mult': 1.1934873202798926, 'sideways_rsi_os': 8, 'sideways_rsi_ob': 91, 'sideways_adx_thresh': 31.55324994751987, 'sideways_atr_min_pct': 0.0028972708081415367, 'sideways_atr_max_pct': 0.07158938059466442, 'sideways_tp_mult': 2.9999774293767136, 'sideways_tsl_mult': 0.8082342677498413, 'sideways_time_stop': 128, 'sideways_use_sma': True, 'sideways_use_ema': False, 'sideways_use_atr': True, 'sideways_use_adx': True, 'sideways_use_spike': True, 'sideways_rsi_required': False}.
[I 2025-08-30 17:31:51,763] Trial 795 finished with values: [-1000000000.0, 1000000000.0] and parameters: {'p_sma': 6, 'p_std': 19, 'p_atr': 18, 'p_adx': 8, 'rsi_period': 76, 'ema1': 15, 'ema2': 11, 'slip_atr_k': 0.22263764815963344, 'slip_spread_k': 0.1815573363973088, 'spread_hl_frac': 0.006962242501198836, 'bb_std_mult': 3.305972909160081, 'rsi_os': 34, 'rsi_ob': 48, 'vol_spike': 0.10780378409105493, 'adx_thresh': 9.990329146428857, 'atr_min_pct': 0.0036255261113845687, 'atr_max_pct': 0.01532550811964456, 'tp_mult': 2.7073209578822213, 'tsl_mult': 0.9124943627300907, 'strategy': 'mean_reversion', 'time_stop': 34, 'use_sma': False, 'use_atr': True, 'use_adx': True, 'use_ema': False, 'use_spike': False, 'rsi_required': True, 'edge_k': 1.8655019570159364, 'edge_cap': 0.9337278117833524, 'bull_strategy': 'breakout', 'bull_bb_std_mult': 1.737573489469669, 'bull_rsi_os': 12, 'bull_rsi_ob': 52, 'bull_adx_thresh': 34.53426488158601, 'bull_atr_min_pct': 0.02104941398154004, 'bull_atr_max_pct': 0.14235942254954947, 'bull_tp_mult': 1.690817891187052, 'bull_tsl_mult': 0.8395694446178956, 'bull_time_stop': 67, 'bull_use_sma': True, 'bull_use_ema': True, 'bull_use_atr': False, 'bull_use_adx': True, 'bull_use_spike': True, 'bull_rsi_required': False, 'bear_strategy': 'mean_reversion', 'bear_bb_std_mult': 1.1070562821018628, 'bear_rsi_os': 15, 'bear_rsi_ob': 74, 'bear_adx_thresh': 11.774982942273857, 'bear_atr_min_pct': 0.020100647569204634, 'bear_atr_max_pct': 0.10668691495288102, 'bear_tp_mult': 2.208324834687092, 'bear_tsl_mult': 0.2623131650999602, 'bear_time_stop': 120, 'bear_use_sma': False, 'bear_use_ema': False, 'bear_use_atr': False, 'bear_use_adx': False, 'bear_use_spike': True, 'bear_rsi_required': True, 'sideways_strategy': 'breakout', 'sideways_bb_std_mult': 0.7860890743640898, 'sideways_rsi_os': 8, 'sideways_rsi_ob': 91, 'sideways_adx_thresh': 7.30554292177686, 'sideways_atr_min_pct': 0.003017082721977856, 'sideways_atr_max_pct': 0.07060189345316445, 'sideways_tp_mult': 2.9999245762375906, 'sideways_tsl_mult': 0.7262015208233374, 'sideways_time_stop': 127, 'sideways_use_sma': True, 'sideways_use_ema': False, 'sideways_use_atr': False, 'sideways_use_adx': False, 'sideways_use_spike': True, 'sideways_rsi_required': True}.
[I 2025-08-30 17:31:51,896] Trial 796 finished with values: [-1000000000.0, 1000000000.0] and parameters: {'p_sma': 37, 'p_std': 19, 'p_atr': 18, 'p_adx': 8, 'rsi_period': 67, 'ema1': 15, 'ema2': 54, 'slip_atr_k': 0.01742951598746633, 'slip_spread_k': 0.1665115585176584, 'spread_hl_frac': 0.018899417594245915, 'bb_std_mult': 0.552402267221924, 'rsi_os': 34, 'rsi_ob': 88, 'vol_spike': 0.29953647686617246, 'adx_thresh': 11.009055236708203, 'atr_min_pct': 0.018444150690490276, 'atr_max_pct': 0.01558668819476458, 'tp_mult': 2.787371852349764, 'tsl_mult': 0.9302165614666618, 'strategy': 'mean_reversion', 'time_stop': 35, 'use_sma': True, 'use_atr': False, 'use_adx': False, 'use_ema': False, 'use_spike': True, 'rsi_required': True, 'edge_k': 1.8505012018831846, 'edge_cap': 0.9230809921785526, 'bull_strategy': 'breakout', 'bull_bb_std_mult': 1.9441097243554464, 'bull_rsi_os': 48, 'bull_rsi_ob': 52, 'bull_adx_thresh': 34.42563992252763, 'bull_atr_min_pct': 0.021742704489292705, 'bull_atr_max_pct': 0.14182929831680383, 'bull_tp_mult': 2.249754142792356, 'bull_tsl_mult': 0.7834725104599923, 'bull_time_stop': 250, 'bull_use_sma': True, 'bull_use_ema': True, 'bull_use_atr': False, 'bull_use_adx': False, 'bull_use_spike': False, 'bull_rsi_required': False, 'bear_strategy': 'mean_reversion', 'bear_bb_std_mult': 1.6380188926603563, 'bear_rsi_os': 15, 'bear_rsi_ob': 93, 'bear_adx_thresh': 13.535715035213832, 'bear_atr_min_pct': 0.02022134682571752, 'bear_atr_max_pct': 0.043799624524204495, 'bear_tp_mult': 2.2134988297920737, 'bear_tsl_mult': 0.26355772693911095, 'bear_time_stop': 202, 'bear_use_sma': False, 'bear_use_ema': False, 'bear_use_atr': True, 'bear_use_adx': True, 'bear_use_spike': True, 'bear_rsi_required': True, 'sideways_strategy': 'breakout', 'sideways_bb_std_mult': 0.6440137102455963, 'sideways_rsi_os': 32, 'sideways_rsi_ob': 60, 'sideways_adx_thresh': 31.17713303558595, 'sideways_atr_min_pct': 0.027814302523606425, 'sideways_atr_max_pct': 0.010059473691712756, 'sideways_tp_mult': 2.793508182921158, 'sideways_tsl_mult': 0.4281910452274082, 'sideways_time_stop': 262, 'sideways_use_sma': True, 'sideways_use_ema': True, 'sideways_use_atr': False, 'sideways_use_adx': False, 'sideways_use_spike': False, 'sideways_rsi_required': True}.
[I 2025-08-30 17:32:41,934] Trial 797 finished with values: [-0.02108422891352546, 0.02098016350039119] and parameters: {'p_sma': 37, 'p_std': 7, 'p_atr': 14, 'p_adx': 8, 'rsi_period': 25, 'ema1': 22, 'ema2': 32, 'slip_atr_k': 0.11069819062839176, 'slip_spread_k': 0.9093171668422709, 'spread_hl_frac': 0.01826356434438654, 'bb_std_mult': 3.2346624320135082, 'rsi_os': 13, 'rsi_ob': 88, 'vol_spike': 0.06564995220385783, 'adx_thresh': 10.651773487202426, 'atr_min_pct': 0.01862897992527928, 'atr_max_pct': 0.14990546929568474, 'tp_mult': 2.0118455863148355, 'tsl_mult': 0.926843039044842, 'strategy': 'mean_reversion', 'time_stop': 218, 'use_sma': True, 'use_atr': False, 'use_adx': False, 'use_ema': False, 'use_spike': True, 'rsi_required': True, 'edge_k': 1.0468365785316947, 'edge_cap': 0.20692817365642974, 'bull_strategy': 'mean_reversion', 'bull_bb_std_mult': 1.9709168512933415, 'bull_rsi_os': 23, 'bull_rsi_ob': 52, 'bull_adx_thresh': 34.509370329136715, 'bull_atr_min_pct': 0.02179212025940627, 'bull_atr_max_pct': 0.1415893929415194, 'bull_tp_mult': 2.2533107106589196, 'bull_tsl_mult': 0.15781901423478784, 'bull_time_stop': 88, 'bull_use_sma': True, 'bull_use_ema': True, 'bull_use_atr': False, 'bull_use_adx': False, 'bull_use_spike': False, 'bull_rsi_required': False, 'bear_strategy': 'mean_reversion', 'bear_bb_std_mult': 1.461372128833919, 'bear_rsi_os': 14, 'bear_rsi_ob': 74, 'bear_adx_thresh': 12.501408405903382, 'bear_atr_min_pct': 0.006637708227180418, 'bear_atr_max_pct': 0.046672457157815414, 'bear_tp_mult': 2.2102112668982934, 'bear_tsl_mult': 0.6247667126381511, 'bear_time_stop': 202, 'bear_use_sma': False, 'bear_use_ema': False, 'bear_use_atr': True, 'bear_use_adx': True, 'bear_use_spike': True, 'bear_rsi_required': True, 'sideways_strategy': 'breakout', 'sideways_bb_std_mult': 0.8274566764205241, 'sideways_rsi_os': 32, 'sideways_rsi_ob': 69, 'sideways_adx_thresh': 10.641477805871022, 'sideways_atr_min_pct': 0.003016581064752311, 'sideways_atr_max_pct': 0.03967927213668739, 'sideways_tp_mult': 2.9643563459940796, 'sideways_tsl_mult': 0.42707732186888, 'sideways_time_stop': 44, 'sideways_use_sma': True, 'sideways_use_ema': True, 'sideways_use_atr': False, 'sideways_use_adx': False, 'sideways_use_spike': True, 'sideways_rsi_required': True}.
[I 2025-08-30 17:32:42,181] Trial 799 finished with values: [-1000000000.0, 1000000000.0] and parameters: {'p_sma': 9, 'p_std': 22, 'p_atr': 13, 'p_adx': 9, 'rsi_period': 68, 'ema1': 14, 'ema2': 32, 'slip_atr_k': 0.0302954995944133, 'slip_spread_k': 0.18212412897364014, 'spread_hl_frac': 0.009650562476329888, 'bb_std_mult': 3.2446747395377704, 'rsi_os': 18, 'rsi_ob': 88, 'vol_spike': 0.1930926949680575, 'adx_thresh': 10.618812013767018, 'atr_min_pct': 0.028264779618234315, 'atr_max_pct': 0.14524198712182584, 'tp_mult': 2.015792626449366, 'tsl_mult': 0.9312748369158239, 'strategy': 'breakout', 'time_stop': 27, 'use_sma': True, 'use_atr': False, 'use_adx': False, 'use_ema': False, 'use_spike': True, 'rsi_required': False, 'edge_k': 1.0443766476396226, 'edge_cap': 0.8596553489579838, 'bull_strategy': 'mean_reversion', 'bull_bb_std_mult': 1.270769764205268, 'bull_rsi_os': 48, 'bull_rsi_ob': 55, 'bull_adx_thresh': 33.96581740593045, 'bull_atr_min_pct': 0.021813558483458256, 'bull_atr_max_pct': 0.12288949525827496, 'bull_tp_mult': 1.6281911425624394, 'bull_tsl_mult': 0.945864503029977, 'bull_time_stop': 34, 'bull_use_sma': True, 'bull_use_ema': True, 'bull_use_atr': False, 'bull_use_adx': False, 'bull_use_spike': False, 'bull_rsi_required': False, 'bear_strategy': 'mean_reversion', 'bear_bb_std_mult': 1.493273736271513, 'bear_rsi_os': 18, 'bear_rsi_ob': 84, 'bear_adx_thresh': 25.933997104541454, 'bear_atr_min_pct': 0.020539424798359157, 'bear_atr_max_pct': 0.046645355964562665, 'bear_tp_mult': 2.464973676910202, 'bear_tsl_mult': 0.6257952707154693, 'bear_time_stop': 169, 'bear_use_sma': True, 'bear_use_ema': False, 'bear_use_atr': True, 'bear_use_adx': True, 'bear_use_spike': True, 'bear_rsi_required': True, 'sideways_strategy': 'mean_reversion', 'sideways_bb_std_mult': 0.636608230703556, 'sideways_rsi_os': 33, 'sideways_rsi_ob': 93, 'sideways_adx_thresh': 10.6323018425105, 'sideways_atr_min_pct': 0.0013386684209911667, 'sideways_atr_max_pct': 0.08925805590900097, 'sideways_tp_mult': 2.9370225103361762, 'sideways_tsl_mult': 0.45055865634760106, 'sideways_time_stop': 264, 'sideways_use_sma': False, 'sideways_use_ema': True, 'sideways_use_atr': False, 'sideways_use_adx': False, 'sideways_use_spike': False, 'sideways_rsi_required': True}.
[I 2025-08-30 17:32:42,711] Trial 800 finished with values: [-1000000000.0, 1000000000.0] and parameters: {'p_sma': 42, 'p_std': 25, 'p_atr': 12, 'p_adx': 7, 'rsi_period': 57, 'ema1': 19, 'ema2': 13, 'slip_atr_k': 0.05793958241978345, 'slip_spread_k': 0.1285080471914516, 'spread_hl_frac': 0.017979357247274206, 'bb_std_mult': 3.242006869986103, 'rsi_os': 30, 'rsi_ob': 67, 'vol_spike': 0.19254864940847202, 'adx_thresh': 19.88059204903252, 'atr_min_pct': 0.016381713728906667, 'atr_max_pct': 0.04307839805653824, 'tp_mult': 1.8986548048737926, 'tsl_mult': 0.8903540211792066, 'strategy': 'breakout', 'time_stop': 187, 'use_sma': True, 'use_atr': False, 'use_adx': True, 'use_ema': False, 'use_spike': True, 'rsi_required': False, 'edge_k': 1.028994169401423, 'edge_cap': 0.8588304755714631, 'bull_strategy': 'mean_reversion', 'bull_bb_std_mult': 1.9858277270267832, 'bull_rsi_os': 11, 'bull_rsi_ob': 72, 'bull_adx_thresh': 33.77611464059969, 'bull_atr_min_pct': 0.02253419660424449, 'bull_atr_max_pct': 0.1385652496612237, 'bull_tp_mult': 2.5083076531468826, 'bull_tsl_mult': 0.40794554995921833, 'bull_time_stop': 196, 'bull_use_sma': True, 'bull_use_ema': True, 'bull_use_atr': False, 'bull_use_adx': False, 'bull_use_spike': False, 'bull_rsi_required': False, 'bear_strategy': 'mean_reversion', 'bear_bb_std_mult': 0.8933089536269867, 'bear_rsi_os': 50, 'bear_rsi_ob': 77, 'bear_adx_thresh': 12.646849042974967, 'bear_atr_min_pct': 0.0221994111227856, 'bear_atr_max_pct': 0.1103159954407961, 'bear_tp_mult': 2.175645475529583, 'bear_tsl_mult': 0.6270614981551597, 'bear_time_stop': 219, 'bear_use_sma': True, 'bear_use_ema': False, 'bear_use_atr': True, 'bear_use_adx': True, 'bear_use_spike': False, 'bear_rsi_required': False, 'sideways_strategy': 'mean_reversion', 'sideways_bb_std_mult': 1.553499591686934, 'sideways_rsi_os': 42, 'sideways_rsi_ob': 63, 'sideways_adx_thresh': 10.826807589652876, 'sideways_atr_min_pct': 0.0017233381448733018, 'sideways_atr_max_pct': 0.08905460405862504, 'sideways_tp_mult': 2.9417011904326693, 'sideways_tsl_mult': 0.8997060485488799, 'sideways_time_stop': 279, 'sideways_use_sma': False, 'sideways_use_ema': True, 'sideways_use_atr': False, 'sideways_use_adx': False, 'sideways_use_spike': False, 'sideways_rsi_required': True}.
[I 2025-08-30 17:32:42,988] Trial 798 finished with values: [-1000000000.0, 1000000000.0] and parameters: {'p_sma': 44, 'p_std': 13, 'p_atr': 15, 'p_adx': 8, 'rsi_period': 69, 'ema1': 15, 'ema2': 54, 'slip_atr_k': 0.0640916292496794, 'slip_spread_k': 0.18268231427433396, 'spread_hl_frac': 0.018308055279109423, 'bb_std_mult': 0.5977286417867249, 'rsi_os': 30, 'rsi_ob': 82, 'vol_spike': 0.2991635223505778, 'adx_thresh': 10.766903926265831, 'atr_min_pct': 0.016448488444986045, 'atr_max_pct': 0.0834665151914967, 'tp_mult': 1.8836637482553982, 'tsl_mult': 0.9383607303003488, 'strategy': 'mean_reversion', 'time_stop': 183, 'use_sma': True, 'use_atr': False, 'use_adx': False, 'use_ema': False, 'use_spike': True, 'rsi_required': True, 'edge_k': 0.28158431185319494, 'edge_cap': 0.8630678846915496, 'bull_strategy': 'mean_reversion', 'bull_bb_std_mult': 1.6126368489598513, 'bull_rsi_os': 11, 'bull_rsi_ob': 90, 'bull_adx_thresh': 34.35697853358851, 'bull_atr_min_pct': 0.021715937061132926, 'bull_atr_max_pct': 0.14421157065177623, 'bull_tp_mult': 1.6278913940032111, 'bull_tsl_mult': 0.1296465993075157, 'bull_time_stop': 28, 'bull_use_sma': True, 'bull_use_ema': True, 'bull_use_atr': False, 'bull_use_adx': False, 'bull_use_spike': False, 'bull_rsi_required': False, 'bear_strategy': 'mean_reversion', 'bear_bb_std_mult': 1.4615822821220972, 'bear_rsi_os': 14, 'bear_rsi_ob': 80, 'bear_adx_thresh': 12.603722762081771, 'bear_atr_min_pct': 0.020468958590296918, 'bear_atr_max_pct': 0.05376936428575093, 'bear_tp_mult': 2.206123526637381, 'bear_tsl_mult': 0.621062399787398, 'bear_time_stop': 201, 'bear_use_sma': False, 'bear_use_ema': False, 'bear_use_atr': True, 'bear_use_adx': True, 'bear_use_spike': True, 'bear_rsi_required': True, 'sideways_strategy': 'breakout', 'sideways_bb_std_mult': 0.6383794071439156, 'sideways_rsi_os': 32, 'sideways_rsi_ob': 93, 'sideways_adx_thresh': 34.33084970248869, 'sideways_atr_min_pct': 0.001477905161840154, 'sideways_atr_max_pct': 0.12964430032046279, 'sideways_tp_mult': 2.9525075940180394, 'sideways_tsl_mult': 0.8999483175146591, 'sideways_time_stop': 266, 'sideways_use_sma': True, 'sideways_use_ema': True, 'sideways_use_atr': False, 'sideways_use_adx': False, 'sideways_use_spike': False, 'sideways_rsi_required': True}.
