[I 2025-08-30 16:10:58,311] Trial 318 finished with values: [-1000000000.0, 1000000000.0] and parameters: {'p_sma': 10, 'p_std': 42, 'p_atr': 12, 'p_adx': 23, 'rsi_period': 23, 'ema1': 26, 'ema2': 15, 'slip_atr_k': 0.00032852623594211827, 'slip_spread_k': 0.555463581154519, 'spread_hl_frac': 0.020284679115876413, 'bb_std_mult': 0.586600841702108, 'rsi_os': 50, 'rsi_ob': 91, 'vol_spike': 0.11070956808599236, 'adx_thresh': 10.539028940537117, 'atr_min_pct': 0.01845974482393296, 'atr_max_pct': 0.07713237384203109, 'tp_mult': 2.5671135701218906, 'tsl_mult': 0.4592626228101257, 'strategy': 'mean_reversion', 'time_stop': 17, 'use_sma': False, 'use_atr': True, 'use_adx': True, 'use_ema': False, 'use_spike': False, 'rsi_required': True, 'edge_k': 1.3627465233907117, 'edge_cap': 0.3924937497127394, 'bull_strategy': 'mean_reversion', 'bull_bb_std_mult': 2.8060768727003356, 'bull_rsi_os': 8, 'bull_rsi_ob': 48, 'bull_adx_thresh': 20.892268580176907, 'bull_atr_min_pct': 0.020212243128952295, 'bull_atr_max_pct': 0.0712717546231405, 'bull_tp_mult': 1.3041464216477456, 'bull_tsl_mult': 0.28495721862881956, 'bull_time_stop': 195, 'bull_use_sma': False, 'bull_use_ema': True, 'bull_use_atr': True, 'bull_use_adx': True, 'bull_use_spike': True, 'bull_rsi_required': False, 'bear_strategy': 'mean_reversion', 'bear_bb_std_mult': 2.031346708489348, 'bear_rsi_os': 11, 'bear_rsi_ob': 76, 'bear_adx_thresh': 13.449210311759497, 'bear_atr_min_pct': 0.022323429719232388, 'bear_atr_max_pct': 0.06365219014656992, 'bear_tp_mult': 1.3872715384936014, 'bear_tsl_mult': 0.6581572945681936, 'bear_time_stop': 219, 'bear_use_sma': True, 'bear_use_ema': False, 'bear_use_atr': True, 'bear_use_adx': False, 'bear_use_spike': False, 'bear_rsi_required': False, 'sideways_strategy': 'mean_reversion', 'sideways_bb_std_mult': 2.2640733830805506, 'sideways_rsi_os': 29, 'sideways_rsi_ob': 93, 'sideways_adx_thresh': 18.761076773511125, 'sideways_atr_min_pct': 0.001071302320948806, 'sideways_atr_max_pct': 0.02794114395953498, 'sideways_tp_mult': 1.4997200094055958, 'sideways_tsl_mult': 0.47699395480875667, 'sideways_time_stop': 216, 'sideways_use_sma': False, 'sideways_use_ema': False, 'sideways_use_atr': False, 'sideways_use_adx': False, 'sideways_use_spike': True, 'sideways_rsi_required': True}.
[I 2025-08-30 16:11:43,290] Trial 316 finished with values: [-1000000000.0, 1000000000.0] and parameters: {'p_sma': 6, 'p_std': 59, 'p_atr': 23, 'p_adx': 26, 'rsi_period': 13, 'ema1': 26, 'ema2': 11, 'slip_atr_k': 0.10719735460152635, 'slip_spread_k': 0.5676525604567785, 'spread_hl_frac': 0.02028146555492662, 'bb_std_mult': 1.3053437151294691, 'rsi_os': 48, 'rsi_ob': 94, 'vol_spike': 0.10954337111895729, 'adx_thresh': 13.526406607324219, 'atr_min_pct': 0.018901117914882293, 'atr_max_pct': 0.07727477657313794, 'tp_mult': 2.74814063879997, 'tsl_mult': 0.45622556518727647, 'strategy': 'mean_reversion', 'time_stop': 96, 'use_sma': False, 'use_atr': True, 'use_adx': True, 'use_ema': False, 'use_spike': False, 'rsi_required': True, 'edge_k': 1.5996557222936238, 'edge_cap': 0.633065359755166, 'bull_strategy': 'mean_reversion', 'bull_bb_std_mult': 3.0530582269043114, 'bull_rsi_os': 13, 'bull_rsi_ob': 47, 'bull_adx_thresh': 22.258992638252902, 'bull_atr_min_pct': 0.02008620039209138, 'bull_atr_max_pct': 0.1399476669237004, 'bull_tp_mult': 2.157294513575117, 'bull_tsl_mult': 0.5181840980662478, 'bull_time_stop': 67, 'bull_use_sma': False, 'bull_use_ema': True, 'bull_use_atr': True, 'bull_use_adx': True, 'bull_use_spike': False, 'bull_rsi_required': False, 'bear_strategy': 'mean_reversion', 'bear_bb_std_mult': 2.036563351793293, 'bear_rsi_os': 10, 'bear_rsi_ob': 71, 'bear_adx_thresh': 13.49001032913562, 'bear_atr_min_pct': 0.02259574634313113, 'bear_atr_max_pct': 0.08652961223412994, 'bear_tp_mult': 2.173865219992401, 'bear_tsl_mult': 0.6398852438024454, 'bear_time_stop': 240, 'bear_use_sma': True, 'bear_use_ema': False, 'bear_use_atr': False, 'bear_use_adx': False, 'bear_use_spike': False, 'bear_rsi_required': False, 'sideways_strategy': 'breakout', 'sideways_bb_std_mult': 2.113856212586366, 'sideways_rsi_os': 41, 'sideways_rsi_ob': 66, 'sideways_adx_thresh': 32.52584254253351, 'sideways_atr_min_pct': 0.01058439900614852, 'sideways_atr_max_pct': 0.1430505416745038, 'sideways_tp_mult': 1.3886853489351394, 'sideways_tsl_mult': 0.46772859327197175, 'sideways_time_stop': 216, 'sideways_use_sma': False, 'sideways_use_ema': False, 'sideways_use_atr': False, 'sideways_use_adx': False, 'sideways_use_spike': False, 'sideways_rsi_required': True}.
[I 2025-08-30 16:11:43,345] Trial 315 finished with values: [-0.010272797158849434, 0.01018754414791044] and parameters: {'p_sma': 7, 'p_std': 55, 'p_atr': 29, 'p_adx': 26, 'rsi_period': 13, 'ema1': 26, 'ema2': 11, 'slip_atr_k': 0.0002455529423319473, 'slip_spread_k': 0.6790742737995725, 'spread_hl_frac': 0.014008046743000185, 'bb_std_mult': 3.1390446586431273, 'rsi_os': 10, 'rsi_ob': 94, 'vol_spike': 0.20962820284369138, 'adx_thresh': 13.79487987600125, 'atr_min_pct': 0.018563023761027225, 'atr_max_pct': 0.12234316775528935, 'tp_mult': 2.883226793055852, 'tsl_mult': 0.5859234691374268, 'strategy': 'mean_reversion', 'time_stop': 15, 'use_sma': False, 'use_atr': False, 'use_adx': True, 'use_ema': True, 'use_spike': False, 'rsi_required': True, 'edge_k': 1.5911073163106553, 'edge_cap': 0.32768332010380513, 'bull_strategy': 'mean_reversion', 'bull_bb_std_mult': 1.823634896247968, 'bull_rsi_os': 11, 'bull_rsi_ob': 46, 'bull_adx_thresh': 23.615060517106127, 'bull_atr_min_pct': 0.020213662423904724, 'bull_atr_max_pct': 0.14057003265853527, 'bull_tp_mult': 2.1310002600327076, 'bull_tsl_mult': 0.312360160277291, 'bull_time_stop': 61, 'bull_use_sma': False, 'bull_use_ema': True, 'bull_use_atr': True, 'bull_use_adx': True, 'bull_use_spike': False, 'bull_rsi_required': False, 'bear_strategy': 'breakout', 'bear_bb_std_mult': 3.413596320422654, 'bear_rsi_os': 10, 'bear_rsi_ob': 60, 'bear_adx_thresh': 13.571641286596217, 'bear_atr_min_pct': 0.022431525108818896, 'bear_atr_max_pct': 0.05558605987877578, 'bear_tp_mult': 1.3754791452423376, 'bear_tsl_mult': 0.6303118193369024, 'bear_time_stop': 202, 'bear_use_sma': True, 'bear_use_ema': False, 'bear_use_atr': False, 'bear_use_adx': False, 'bear_use_spike': False, 'bear_rsi_required': False, 'sideways_strategy': 'breakout', 'sideways_bb_std_mult': 2.29644593190771, 'sideways_rsi_os': 41, 'sideways_rsi_ob': 93, 'sideways_adx_thresh': 32.326041029517626, 'sideways_atr_min_pct': 0.000970042801769473, 'sideways_atr_max_pct': 0.05398204514304834, 'sideways_tp_mult': 1.508613825868659, 'sideways_tsl_mult': 0.4408441165830483, 'sideways_time_stop': 135, 'sideways_use_sma': True, 'sideways_use_ema': False, 'sideways_use_atr': False, 'sideways_use_adx': False, 'sideways_use_spike': False, 'sideways_rsi_required': True}.
[I 2025-08-30 16:11:43,868] Trial 317 finished with values: [-1000000000.0, 1000000000.0] and parameters: {'p_sma': 6, 'p_std': 42, 'p_atr': 29, 'p_adx': 23, 'rsi_period': 23, 'ema1': 26, 'ema2': 11, 'slip_atr_k': 0.12236468446731595, 'slip_spread_k': 0.5503971468309128, 'spread_hl_frac': 0.017596518752440993, 'bb_std_mult': 3.115425331493951, 'rsi_os': 36, 'rsi_ob': 94, 'vol_spike': 0.1124080208135663, 'adx_thresh': 13.522909976484039, 'atr_min_pct': 0.018547106729914345, 'atr_max_pct': 0.10853143069610101, 'tp_mult': 2.578854931308737, 'tsl_mult': 0.48143331697618963, 'strategy': 'mean_reversion', 'time_stop': 16, 'use_sma': False, 'use_atr': True, 'use_adx': True, 'use_ema': False, 'use_spike': False, 'rsi_required': True, 'edge_k': 1.4900005079578316, 'edge_cap': 0.36234533109545664, 'bull_strategy': 'mean_reversion', 'bull_bb_std_mult': 2.0104933270357193, 'bull_rsi_os': 13, 'bull_rsi_ob': 51, 'bull_adx_thresh': 20.927265489387803, 'bull_atr_min_pct': 0.02019192997740062, 'bull_atr_max_pct': 0.13892730375856244, 'bull_tp_mult': 2.1264365549464506, 'bull_tsl_mult': 0.7382174879629625, 'bull_time_stop': 68, 'bull_use_sma': False, 'bull_use_ema': True, 'bull_use_atr': True, 'bull_use_adx': True, 'bull_use_spike': True, 'bull_rsi_required': False, 'bear_strategy': 'mean_reversion', 'bear_bb_std_mult': 0.6395497091998792, 'bear_rsi_os': 12, 'bear_rsi_ob': 57, 'bear_adx_thresh': 6.449134090536912, 'bear_atr_min_pct': 0.02234950381180285, 'bear_atr_max_pct': 0.03939761337663161, 'bear_tp_mult': 2.646008078862499, 'bear_tsl_mult': 0.6462255924603294, 'bear_time_stop': 221, 'bear_use_sma': True, 'bear_use_ema': False, 'bear_use_atr': False, 'bear_use_adx': False, 'bear_use_spike': False, 'bear_rsi_required': False, 'sideways_strategy': 'mean_reversion', 'sideways_bb_std_mult': 2.191858468808565, 'sideways_rsi_os': 14, 'sideways_rsi_ob': 84, 'sideways_adx_thresh': 17.26788194292525, 'sideways_atr_min_pct': 0.0022829397768977058, 'sideways_atr_max_pct': 0.14237274510295395, 'sideways_tp_mult': 1.369052002765633, 'sideways_tsl_mult': 0.47065219464686203, 'sideways_time_stop': 215, 'sideways_use_sma': False, 'sideways_use_ema': False, 'sideways_use_atr': False, 'sideways_use_adx': False, 'sideways_use_spike': True, 'sideways_rsi_required': True}.
[I 2025-08-30 16:11:44,883] Trial 319 finished with values: [-1000000000.0, 1000000000.0] and parameters: {'p_sma': 6, 'p_std': 59, 'p_atr': 29, 'p_adx': 22, 'rsi_period': 14, 'ema1': 26, 'ema2': 11, 'slip_atr_k': 0.1687994101968932, 'slip_spread_k': 0.6380689191287772, 'spread_hl_frac': 0.017549971600372607, 'bb_std_mult': 3.0854870711888323, 'rsi_os': 11, 'rsi_ob': 94, 'vol_spike': 0.006703185890199774, 'adx_thresh': 14.183009597998183, 'atr_min_pct': 0.01889381474205432, 'atr_max_pct': 0.13791248086948033, 'tp_mult': 2.6384992452375817, 'tsl_mult': 0.48346290050227714, 'strategy': 'mean_reversion', 'time_stop': 123, 'use_sma': True, 'use_atr': True, 'use_adx': True, 'use_ema': False, 'use_spike': False, 'rsi_required': True, 'edge_k': 1.487041994660467, 'edge_cap': 0.5907446150482629, 'bull_strategy': 'mean_reversion', 'bull_bb_std_mult': 2.1723685155598838, 'bull_rsi_os': 13, 'bull_rsi_ob': 47, 'bull_adx_thresh': 20.83787783834927, 'bull_atr_min_pct': 0.020364782577860643, 'bull_atr_max_pct': 0.1398371322658204, 'bull_tp_mult': 2.183736416721134, 'bull_tsl_mult': 0.5225223170537577, 'bull_time_stop': 68, 'bull_use_sma': False, 'bull_use_ema': True, 'bull_use_atr': True, 'bull_use_adx': True, 'bull_use_spike': False, 'bull_rsi_required': False, 'bear_strategy': 'mean_reversion', 'bear_bb_std_mult': 2.231263912632441, 'bear_rsi_os': 10, 'bear_rsi_ob': 71, 'bear_adx_thresh': 14.068786247180187, 'bear_atr_min_pct': 0.022245662882875807, 'bear_atr_max_pct': 0.07835278070351735, 'bear_tp_mult': 1.899552271205169, 'bear_tsl_mult': 0.7067328265480926, 'bear_time_stop': 221, 'bear_use_sma': True, 'bear_use_ema': False, 'bear_use_atr': False, 'bear_use_adx': True, 'bear_use_spike': False, 'bear_rsi_required': True, 'sideways_strategy': 'breakout', 'sideways_bb_std_mult': 2.19192322539028, 'sideways_rsi_os': 12, 'sideways_rsi_ob': 59, 'sideways_adx_thresh': 16.300931561758187, 'sideways_atr_min_pct': 0.002329052009207879, 'sideways_atr_max_pct': 0.1427354839585775, 'sideways_tp_mult': 1.365052918602106, 'sideways_tsl_mult': 0.46832614713197485, 'sideways_time_stop': 215, 'sideways_use_sma': True, 'sideways_use_ema': False, 'sideways_use_atr': True, 'sideways_use_adx': False, 'sideways_use_spike': False, 'sideways_rsi_required': True}.
[I 2025-08-30 16:11:45,338] Trial 320 finished with values: [-1000000000.0, 1000000000.0] and parameters: {'p_sma': 12, 'p_std': 33, 'p_atr': 29, 'p_adx': 22, 'rsi_period': 15, 'ema1': 13, 'ema2': 11, 'slip_atr_k': 0.006330111175213725, 'slip_spread_k': 0.645051424409644, 'spread_hl_frac': 0.01793387740326157, 'bb_std_mult': 3.091230546221779, 'rsi_os': 54, 'rsi_ob': 87, 'vol_spike': 1.4420656377606145e-05, 'adx_thresh': 14.419513576231234, 'atr_min_pct': 0.020022106658759684, 'atr_max_pct': 0.10863963885701783, 'tp_mult': 2.875610830587629, 'tsl_mult': 0.5597732698949911, 'strategy': 'mean_reversion', 'time_stop': 124, 'use_sma': True, 'use_atr': True, 'use_adx': True, 'use_ema': True, 'use_spike': False, 'rsi_required': True, 'edge_k': 1.313432231568673, 'edge_cap': 0.5920244381207633, 'bull_strategy': 'mean_reversion', 'bull_bb_std_mult': 2.0174466526607935, 'bull_rsi_os': 10, 'bull_rsi_ob': 46, 'bull_adx_thresh': 20.935538796182275, 'bull_atr_min_pct': 0.0206348325740405, 'bull_atr_max_pct': 0.14298918727981028, 'bull_tp_mult': 1.2508435303336127, 'bull_tsl_mult': 0.6356202835936785, 'bull_time_stop': 56, 'bull_use_sma': False, 'bull_use_ema': True, 'bull_use_atr': True, 'bull_use_adx': True, 'bull_use_spike': True, 'bull_rsi_required': False, 'bear_strategy': 'breakout', 'bear_bb_std_mult': 2.212302268366302, 'bear_rsi_os': 14, 'bear_rsi_ob': 80, 'bear_adx_thresh': 15.121251039033165, 'bear_atr_min_pct': 0.020210473897382408, 'bear_atr_max_pct': 0.13792561717753396, 'bear_tp_mult': 1.9043259701836437, 'bear_tsl_mult': 0.6953276137506977, 'bear_time_stop': 233, 'bear_use_sma': True, 'bear_use_ema': True, 'bear_use_atr': True, 'bear_use_adx': True, 'bear_use_spike': False, 'bear_rsi_required': True, 'sideways_strategy': 'mean_reversion', 'sideways_bb_std_mult': 2.18318975568417, 'sideways_rsi_os': 12, 'sideways_rsi_ob': 63, 'sideways_adx_thresh': 16.005068009747934, 'sideways_atr_min_pct': 0.001913707966587371, 'sideways_atr_max_pct': 0.13041839129987864, 'sideways_tp_mult': 1.473851749984552, 'sideways_tsl_mult': 0.44657250106265445, 'sideways_time_stop': 205, 'sideways_use_sma': True, 'sideways_use_ema': False, 'sideways_use_atr': True, 'sideways_use_adx': False, 'sideways_use_spike': True, 'sideways_rsi_required': False}.
[I 2025-08-30 16:11:45,916] Trial 323 finished with values: [-1000000000.0, 1000000000.0] and parameters: {'p_sma': 12, 'p_std': 34, 'p_atr': 15, 'p_adx': 25, 'rsi_period': 16, 'ema1': 20, 'ema2': 15, 'slip_atr_k': 0.006224240810744771, 'slip_spread_k': 0.6288513677406884, 'spread_hl_frac': 0.01700378318479935, 'bb_std_mult': 1.2091233563947577, 'rsi_os': 53, 'rsi_ob': 88, 'vol_spike': 0.0009101750626607416, 'adx_thresh': 12.927494308940117, 'atr_min_pct': 0.027989937428336727, 'atr_max_pct': 0.11669055700948522, 'tp_mult': 2.8747490860335185, 'tsl_mult': 0.16229060056703903, 'strategy': 'mean_reversion', 'time_stop': 85, 'use_sma': True, 'use_atr': True, 'use_adx': True, 'use_ema': True, 'use_spike': False, 'rsi_required': True, 'edge_k': 1.6894188875671003, 'edge_cap': 0.5704485075103041, 'bull_strategy': 'mean_reversion', 'bull_bb_std_mult': 0.5053317593340514, 'bull_rsi_os': 9, 'bull_rsi_ob': 49, 'bull_adx_thresh': 21.77254306232185, 'bull_atr_min_pct': 0.020870691165226656, 'bull_atr_max_pct': 0.13244035757896258, 'bull_tp_mult': 1.366441342880903, 'bull_tsl_mult': 0.6752234232557955, 'bull_time_stop': 152, 'bull_use_sma': False, 'bull_use_ema': True, 'bull_use_atr': True, 'bull_use_adx': True, 'bull_use_spike': False, 'bull_rsi_required': False, 'bear_strategy': 'breakout', 'bear_bb_std_mult': 1.208625751390933, 'bear_rsi_os': 14, 'bear_rsi_ob': 76, 'bear_adx_thresh': 17.14382124689827, 'bear_atr_min_pct': 0.023362031832580017, 'bear_atr_max_pct': 0.049426260495241355, 'bear_tp_mult': 2.120925663153661, 'bear_tsl_mult': 0.6565668836290334, 'bear_time_stop': 230, 'bear_use_sma': True, 'bear_use_ema': True, 'bear_use_atr': True, 'bear_use_adx': True, 'bear_use_spike': False, 'bear_rsi_required': True, 'sideways_strategy': 'breakout', 'sideways_bb_std_mult': 2.0057340982088396, 'sideways_rsi_os': 48, 'sideways_rsi_ob': 64, 'sideways_adx_thresh': 6.597966839858341, 'sideways_atr_min_pct': 0.0016295895342706879, 'sideways_atr_max_pct': 0.14507021364599718, 'sideways_tp_mult': 1.6007079334895753, 'sideways_tsl_mult': 0.3962358998925055, 'sideways_time_stop': 183, 'sideways_use_sma': True, 'sideways_use_ema': False, 'sideways_use_atr': True, 'sideways_use_adx': False, 'sideways_use_spike': False, 'sideways_rsi_required': False}.
[I 2025-08-30 16:12:30,251] Trial 321 finished with values: [-1000000000.0, 1000000000.0] and parameters: {'p_sma': 12, 'p_std': 34, 'p_atr': 17, 'p_adx': 22, 'rsi_period': 15, 'ema1': 13, 'ema2': 11, 'slip_atr_k': 0.0061014730928976085, 'slip_spread_k': 0.6401366165181164, 'spread_hl_frac': 0.0174226697940783, 'bb_std_mult': 3.1144037724914133, 'rsi_os': 11, 'rsi_ob': 86, 'vol_spike': 0.010720711264522379, 'adx_thresh': 14.1809822996815, 'atr_min_pct': 0.02001442463168734, 'atr_max_pct': 0.13790462700960693, 'tp_mult': 2.8773202945948917, 'tsl_mult': 0.4785211260455857, 'strategy': 'mean_reversion', 'time_stop': 125, 'use_sma': True, 'use_atr': True, 'use_adx': True, 'use_ema': True, 'use_spike': False, 'rsi_required': True, 'edge_k': 1.3279792737621685, 'edge_cap': 0.8112248180689877, 'bull_strategy': 'mean_reversion', 'bull_bb_std_mult': 2.172043728346821, 'bull_rsi_os': 10, 'bull_rsi_ob': 46, 'bull_adx_thresh': 20.63285631723655, 'bull_atr_min_pct': 0.02079036675500334, 'bull_atr_max_pct': 0.1366652629115287, 'bull_tp_mult': 1.3690972453934602, 'bull_tsl_mult': 0.05105811434534324, 'bull_time_stop': 171, 'bull_use_sma': False, 'bull_use_ema': True, 'bull_use_atr': True, 'bull_use_adx': True, 'bull_use_spike': True, 'bull_rsi_required': False, 'bear_strategy': 'breakout', 'bear_bb_std_mult': 2.841115973546005, 'bear_rsi_os': 5, 'bear_rsi_ob': 80, 'bear_adx_thresh': 33.803562395792994, 'bear_atr_min_pct': 0.022122250403780318, 'bear_atr_max_pct': 0.05563079183215353, 'bear_tp_mult': 1.9069304219255512, 'bear_tsl_mult': 0.7716976671374864, 'bear_time_stop': 232, 'bear_use_sma': True, 'bear_use_ema': True, 'bear_use_atr': True, 'bear_use_adx': True, 'bear_use_spike': False, 'bear_rsi_required': True, 'sideways_strategy': 'mean_reversion', 'sideways_bb_std_mult': 2.196538818946918, 'sideways_rsi_os': 6, 'sideways_rsi_ob': 63, 'sideways_adx_thresh': 25.402935609076895, 'sideways_atr_min_pct': 0.025701595102057197, 'sideways_atr_max_pct': 0.019663032200974984, 'sideways_tp_mult': 1.4682252436592047, 'sideways_tsl_mult': 0.39860098382385534, 'sideways_time_stop': 204, 'sideways_use_sma': True, 'sideways_use_ema': False, 'sideways_use_atr': True, 'sideways_use_adx': False, 'sideways_use_spike': True, 'sideways_rsi_required': False}.
[I 2025-08-30 16:12:31,033] Trial 322 finished with values: [-1000000000.0, 1000000000.0] and parameters: {'p_sma': 12, 'p_std': 60, 'p_atr': 29, 'p_adx': 22, 'rsi_period': 15, 'ema1': 13, 'ema2': 15, 'slip_atr_k': 0.00609162135304419, 'slip_spread_k': 0.6380090536986268, 'spread_hl_frac': 0.01722892408971276, 'bb_std_mult': 1.8846704512763934, 'rsi_os': 25, 'rsi_ob': 88, 'vol_spike': 0.005670584377756339, 'adx_thresh': 14.097967774886897, 'atr_min_pct': 0.015265031416866819, 'atr_max_pct': 0.11727247799758692, 'tp_mult': 2.8539116338305788, 'tsl_mult': 0.5561360256970658, 'strategy': 'mean_reversion', 'time_stop': 127, 'use_sma': True, 'use_atr': True, 'use_adx': True, 'use_ema': True, 'use_spike': False, 'rsi_required': True, 'edge_k': 1.714220512424463, 'edge_cap': 0.5899010188517502, 'bull_strategy': 'mean_reversion', 'bull_bb_std_mult': 2.2696407647136843, 'bull_rsi_os': 10, 'bull_rsi_ob': 46, 'bull_adx_thresh': 21.790382110815667, 'bull_atr_min_pct': 0.020852281216379668, 'bull_atr_max_pct': 0.1368005240836504, 'bull_tp_mult': 1.3680904314221114, 'bull_tsl_mult': 0.25361674362409975, 'bull_time_stop': 55, 'bull_use_sma': False, 'bull_use_ema': True, 'bull_use_atr': True, 'bull_use_adx': True, 'bull_use_spike': False, 'bull_rsi_required': False, 'bear_strategy': 'breakout', 'bear_bb_std_mult': 2.202419584692804, 'bear_rsi_os': 14, 'bear_rsi_ob': 67, 'bear_adx_thresh': 15.123138365972858, 'bear_atr_min_pct': 0.02048037901902319, 'bear_atr_max_pct': 0.054961373966781524, 'bear_tp_mult': 2.759754174215372, 'bear_tsl_mult': 0.1348628756769949, 'bear_time_stop': 231, 'bear_use_sma': True, 'bear_use_ema': True, 'bear_use_atr': True, 'bear_use_adx': True, 'bear_use_spike': False, 'bear_rsi_required': True, 'sideways_strategy': 'breakout', 'sideways_bb_std_mult': 2.3201684887994087, 'sideways_rsi_os': 26, 'sideways_rsi_ob': 60, 'sideways_adx_thresh': 16.308831524345056, 'sideways_atr_min_pct': 0.025616190424419653, 'sideways_atr_max_pct': 0.14472284257441134, 'sideways_tp_mult': 1.4637089480446739, 'sideways_tsl_mult': 0.5755568447521543, 'sideways_time_stop': 176, 'sideways_use_sma': True, 'sideways_use_ema': False, 'sideways_use_atr': True, 'sideways_use_adx': False, 'sideways_use_spike': False, 'sideways_rsi_required': False}.
