[I 2025-08-30 16:32:32,499] Trial 438 finished with values: [-1000000000.0, 1000000000.0] and parameters: {'p_sma': 11, 'p_std': 60, 'p_atr': 16, 'p_adx': 26, 'rsi_period': 20, 'ema1': 6, 'ema2': 13, 'slip_atr_k': 0.009956958451428157, 'slip_spread_k': 0.6654099357597517, 'spread_hl_frac': 0.02044879776798969, 'bb_std_mult': 3.2981322242318787, 'rsi_os': 37, 'rsi_ob': 89, 'vol_spike': 0.004091183150579786, 'adx_thresh': 13.16808085521693, 'atr_min_pct': 0.01885889528520283, 'atr_max_pct': 0.13650066737156463, 'tp_mult': 2.8732433702980202, 'tsl_mult': 0.39192713524573236, 'strategy': 'mean_reversion', 'time_stop': 237, 'use_sma': False, 'use_atr': True, 'use_adx': True, 'use_ema': False, 'use_spike': False, 'rsi_required': True, 'edge_k': 1.4542743750882399, 'edge_cap': 0.6079678693283768, 'bull_strategy': 'mean_reversion', 'bull_bb_std_mult': 1.9751466990271362, 'bull_rsi_os': 44, 'bull_rsi_ob': 53, 'bull_adx_thresh': 22.871974561522695, 'bull_atr_min_pct': 0.025412469485606024, 'bull_atr_max_pct': 0.13864292300596978, 'bull_tp_mult': 1.7961765938120773, 'bull_tsl_mult': 0.25660176561840725, 'bull_time_stop': 70, 'bull_use_sma': False, 'bull_use_ema': True, 'bull_use_atr': True, 'bull_use_adx': True, 'bull_use_spike': False, 'bull_rsi_required': False, 'bear_strategy': 'mean_reversion', 'bear_bb_std_mult': 2.1196155015459635, 'bear_rsi_os': 23, 'bear_rsi_ob': 48, 'bear_adx_thresh': 12.958684762222177, 'bear_atr_min_pct': 0.020959474810688078, 'bear_atr_max_pct': 0.1357775341130742, 'bear_tp_mult': 2.556586648857124, 'bear_tsl_mult': 0.7798165786161138, 'bear_time_stop': 49, 'bear_use_sma': True, 'bear_use_ema': False, 'bear_use_atr': False, 'bear_use_adx': False, 'bear_use_spike': False, 'bear_rsi_required': False, 'sideways_strategy': 'breakout', 'sideways_bb_std_mult': 0.5686696344150353, 'sideways_rsi_os': 45, 'sideways_rsi_ob': 77, 'sideways_adx_thresh': 19.33067250903697, 'sideways_atr_min_pct': 0.0035672052385330773, 'sideways_atr_max_pct': 0.017401631790979852, 'sideways_tp_mult': 1.4272834082345678, 'sideways_tsl_mult': 0.5026185404831051, 'sideways_time_stop': 113, 'sideways_use_sma': False, 'sideways_use_ema': False, 'sideways_use_atr': False, 'sideways_use_adx': False, 'sideways_use_spike': False, 'sideways_rsi_required': True}.
[I 2025-08-30 16:32:34,739] Trial 443 finished with values: [-1000000000.0, 1000000000.0] and parameters: {'p_sma': 51, 'p_std': 60, 'p_atr': 10, 'p_adx': 27, 'rsi_period': 17, 'ema1': 12, 'ema2': 11, 'slip_atr_k': 6.55107868112086e-05, 'slip_spread_k': 0.6748086660829432, 'spread_hl_frac': 0.02047133257472549, 'bb_std_mult': 3.1121132475160698, 'rsi_os': 37, 'rsi_ob': 92, 'vol_spike': 0.011513091293619734, 'adx_thresh': 12.618072378561726, 'atr_min_pct': 0.01247714004052608, 'atr_max_pct': 0.13288186734082957, 'tp_mult': 2.655374124110795, 'tsl_mult': 0.4832776114035898, 'strategy': 'mean_reversion', 'time_stop': 117, 'use_sma': False, 'use_atr': True, 'use_adx': True, 'use_ema': False, 'use_spike': False, 'rsi_required': True, 'edge_k': 1.1253466234800995, 'edge_cap': 0.7259577025446664, 'bull_strategy': 'mean_reversion', 'bull_bb_std_mult': 2.81187839424698, 'bull_rsi_os': 52, 'bull_rsi_ob': 71, 'bull_adx_thresh': 22.77922516661102, 'bull_atr_min_pct': 0.02223386445836176, 'bull_atr_max_pct': 0.13463731111162613, 'bull_tp_mult': 1.237232023184188, 'bull_tsl_mult': 0.3187849930669459, 'bull_time_stop': 239, 'bull_use_sma': False, 'bull_use_ema': False, 'bull_use_atr': True, 'bull_use_adx': True, 'bull_use_spike': False, 'bull_rsi_required': False, 'bear_strategy': 'mean_reversion', 'bear_bb_std_mult': 2.1193842441502366, 'bear_rsi_os': 11, 'bear_rsi_ob': 84, 'bear_adx_thresh': 12.98604752909405, 'bear_atr_min_pct': 0.009514816315933079, 'bear_atr_max_pct': 0.03426936845901378, 'bear_tp_mult': 1.1394424741413633, 'bear_tsl_mult': 0.7601101470838826, 'bear_time_stop': 219, 'bear_use_sma': True, 'bear_use_ema': False, 'bear_use_atr': False, 'bear_use_adx': False, 'bear_use_spike': False, 'bear_rsi_required': False, 'sideways_strategy': 'breakout', 'sideways_bb_std_mult': 2.8258951949650584, 'sideways_rsi_os': 45, 'sideways_rsi_ob': 92, 'sideways_adx_thresh': 17.34810544032124, 'sideways_atr_min_pct': 0.009560095894346997, 'sideways_atr_max_pct': 0.14056855347844902, 'sideways_tp_mult': 1.3688805696006237, 'sideways_tsl_mult': 0.23847395923022335, 'sideways_time_stop': 31, 'sideways_use_sma': True, 'sideways_use_ema': False, 'sideways_use_atr': True, 'sideways_use_adx': False, 'sideways_use_spike': False, 'sideways_rsi_required': True}.
[I 2025-08-30 16:32:34,973] Trial 442 finished with values: [-1000000000.0, 1000000000.0] and parameters: {'p_sma': 6, 'p_std': 26, 'p_atr': 19, 'p_adx': 11, 'rsi_period': 17, 'ema1': 14, 'ema2': 13, 'slip_atr_k': 0.14971380081952537, 'slip_spread_k': 0.6666116005316265, 'spread_hl_frac': 0.02068925267578662, 'bb_std_mult': 3.096072625570283, 'rsi_os': 37, 'rsi_ob': 92, 'vol_spike': 0.004743382476245803, 'adx_thresh': 12.641935893747503, 'atr_min_pct': 0.020080841153340273, 'atr_max_pct': 0.07628189110156078, 'tp_mult': 2.998995631160818, 'tsl_mult': 0.3849472055198223, 'strategy': 'mean_reversion', 'time_stop': 32, 'use_sma': True, 'use_atr': False, 'use_adx': True, 'use_ema': False, 'use_spike': False, 'rsi_required': True, 'edge_k': 0.957294148955517, 'edge_cap': 0.7217611903150071, 'bull_strategy': 'mean_reversion', 'bull_bb_std_mult': 3.091963642285224, 'bull_rsi_os': 11, 'bull_rsi_ob': 49, 'bull_adx_thresh': 19.798188316594945, 'bull_atr_min_pct': 0.020394756198555127, 'bull_atr_max_pct': 0.13470432968504722, 'bull_tp_mult': 1.5594643233328422, 'bull_tsl_mult': 0.3429182539355668, 'bull_time_stop': 182, 'bull_use_sma': False, 'bull_use_ema': True, 'bull_use_atr': True, 'bull_use_adx': True, 'bull_use_spike': False, 'bull_rsi_required': False, 'bear_strategy': 'mean_reversion', 'bear_bb_std_mult': 2.1359445776704185, 'bear_rsi_os': 37, 'bear_rsi_ob': 66, 'bear_adx_thresh': 12.919302684563636, 'bear_atr_min_pct': 0.02101692315709077, 'bear_atr_max_pct': 0.09117069254694886, 'bear_tp_mult': 1.6722464357194173, 'bear_tsl_mult': 0.7808627834610298, 'bear_time_stop': 47, 'bear_use_sma': True, 'bear_use_ema': False, 'bear_use_atr': False, 'bear_use_adx': True, 'bear_use_spike': False, 'bear_rsi_required': True, 'sideways_strategy': 'mean_reversion', 'sideways_bb_std_mult': 2.0855918029380285, 'sideways_rsi_os': 45, 'sideways_rsi_ob': 91, 'sideways_adx_thresh': 11.071609086223475, 'sideways_atr_min_pct': 0.0035152868520022095, 'sideways_atr_max_pct': 0.10210404825963543, 'sideways_tp_mult': 1.4326687853069342, 'sideways_tsl_mult': 0.6325025188092335, 'sideways_time_stop': 82, 'sideways_use_sma': True, 'sideways_use_ema': False, 'sideways_use_atr': True, 'sideways_use_adx': False, 'sideways_use_spike': True, 'sideways_rsi_required': True}.
[I 2025-08-30 16:33:20,609] Trial 445 finished with values: [-1000000000.0, 1000000000.0] and parameters: {'p_sma': 7, 'p_std': 57, 'p_atr': 28, 'p_adx': 27, 'rsi_period': 18, 'ema1': 13, 'ema2': 11, 'slip_atr_k': 4.368435554589871e-05, 'slip_spread_k': 0.6156364419124962, 'spread_hl_frac': 0.017528047594759177, 'bb_std_mult': 3.0931934665522474, 'rsi_os': 14, 'rsi_ob': 92, 'vol_spike': 0.011748268251645481, 'adx_thresh': 12.409407031919056, 'atr_min_pct': 0.020154634506554664, 'atr_max_pct': 0.1152036072308574, 'tp_mult': 2.650875879473123, 'tsl_mult': 0.49350626736003356, 'strategy': 'mean_reversion', 'time_stop': 117, 'use_sma': False, 'use_atr': False, 'use_adx': True, 'use_ema': False, 'use_spike': False, 'rsi_required': True, 'edge_k': 0.9297448074902298, 'edge_cap': 0.717308639486074, 'bull_strategy': 'mean_reversion', 'bull_bb_std_mult': 2.038606442197569, 'bull_rsi_os': 11, 'bull_rsi_ob': 48, 'bull_adx_thresh': 21.866501631474982, 'bull_atr_min_pct': 0.020561837444712905, 'bull_atr_max_pct': 0.1353997648960136, 'bull_tp_mult': 1.040872946988583, 'bull_tsl_mult': 0.3152421125251264, 'bull_time_stop': 122, 'bull_use_sma': False, 'bull_use_ema': False, 'bull_use_atr': True, 'bull_use_adx': True, 'bull_use_spike': False, 'bull_rsi_required': False, 'bear_strategy': 'mean_reversion', 'bear_bb_std_mult': 2.6865264292667117, 'bear_rsi_os': 31, 'bear_rsi_ob': 78, 'bear_adx_thresh': 19.345614616258842, 'bear_atr_min_pct': 0.023154772310821203, 'bear_atr_max_pct': 0.07132636616026977, 'bear_tp_mult': 2.2085757705620224, 'bear_tsl_mult': 0.5982975299995711, 'bear_time_stop': 226, 'bear_use_sma': True, 'bear_use_ema': True, 'bear_use_atr': True, 'bear_use_adx': True, 'bear_use_spike': False, 'bear_rsi_required': True, 'sideways_strategy': 'mean_reversion', 'sideways_bb_std_mult': 2.1665572858774724, 'sideways_rsi_os': 34, 'sideways_rsi_ob': 95, 'sideways_adx_thresh': 16.386884724707606, 'sideways_atr_min_pct': 0.029973275264978137, 'sideways_atr_max_pct': 0.14209871135549834, 'sideways_tp_mult': 1.7983409945078974, 'sideways_tsl_mult': 0.46615201222694785, 'sideways_time_stop': 211, 'sideways_use_sma': True, 'sideways_use_ema': False, 'sideways_use_atr': True, 'sideways_use_adx': False, 'sideways_use_spike': True, 'sideways_rsi_required': True}.
[I 2025-08-30 16:33:21,049] Trial 446 finished with values: [-1000000000.0, 1000000000.0] and parameters: {'p_sma': 58, 'p_std': 57, 'p_atr': 20, 'p_adx': 12, 'rsi_period': 18, 'ema1': 19, 'ema2': 11, 'slip_atr_k': 0.10178035115413447, 'slip_spread_k': 0.6185937421258334, 'spread_hl_frac': 0.017841326778463305, 'bb_std_mult': 3.0023797169236035, 'rsi_os': 14, 'rsi_ob': 76, 'vol_spike': 0.0004680576007162486, 'adx_thresh': 13.740400346542227, 'atr_min_pct': 0.0039862334901380626, 'atr_max_pct': 0.1156354837437644, 'tp_mult': 2.5768305480523774, 'tsl_mult': 0.5942657728926041, 'strategy': 'mean_reversion', 'time_stop': 16, 'use_sma': False, 'use_atr': False, 'use_adx': True, 'use_ema': False, 'use_spike': False, 'rsi_required': True, 'edge_k': 0.9607389654777779, 'edge_cap': 0.4357557800222491, 'bull_strategy': 'mean_reversion', 'bull_bb_std_mult': 2.407445841630516, 'bull_rsi_os': 11, 'bull_rsi_ob': 85, 'bull_adx_thresh': 21.828590963275683, 'bull_atr_min_pct': 0.01705575959126352, 'bull_atr_max_pct': 0.1471256191576389, 'bull_tp_mult': 1.5602908633885744, 'bull_tsl_mult': 0.45772784216241785, 'bull_time_stop': 122, 'bull_use_sma': False, 'bull_use_ema': True, 'bull_use_atr': True, 'bull_use_adx': True, 'bull_use_spike': True, 'bull_rsi_required': False, 'bear_strategy': 'mean_reversion', 'bear_bb_std_mult': 2.0488011259779215, 'bear_rsi_os': 37, 'bear_rsi_ob': 68, 'bear_adx_thresh': 12.25797257797195, 'bear_atr_min_pct': 0.023254937649860193, 'bear_atr_max_pct': 0.10015361302458711, 'bear_tp_mult': 2.0897518135746735, 'bear_tsl_mult': 0.6009789458222129, 'bear_time_stop': 121, 'bear_use_sma': True, 'bear_use_ema': True, 'bear_use_atr': True, 'bear_use_adx': True, 'bear_use_spike': False, 'bear_rsi_required': True, 'sideways_strategy': 'mean_reversion', 'sideways_bb_std_mult': 2.1661353900777143, 'sideways_rsi_os': 25, 'sideways_rsi_ob': 87, 'sideways_adx_thresh': 16.614103829610446, 'sideways_atr_min_pct': 0.0013093287135505839, 'sideways_atr_max_pct': 0.14233210373528643, 'sideways_tp_mult': 1.4732238173459267, 'sideways_tsl_mult': 0.08913269013736813, 'sideways_time_stop': 225, 'sideways_use_sma': True, 'sideways_use_ema': False, 'sideways_use_atr': True, 'sideways_use_adx': False, 'sideways_use_spike': True, 'sideways_rsi_required': True}.
[I 2025-08-30 16:33:21,329] Trial 444 finished with values: [-0.029593030392407682, 0.029514339756885034] and parameters: {'p_sma': 7, 'p_std': 29, 'p_atr': 10, 'p_adx': 12, 'rsi_period': 12, 'ema1': 12, 'ema2': 47, 'slip_atr_k': 0.17970353840097508, 'slip_spread_k': 0.6627095145689716, 'spread_hl_frac': 0.020195092404969466, 'bb_std_mult': 1.3103860899428965, 'rsi_os': 34, 'rsi_ob': 92, 'vol_spike': 0.0002097307791915899, 'adx_thresh': 19.15570953855466, 'atr_min_pct': 0.020130657335846017, 'atr_max_pct': 0.03962839134385774, 'tp_mult': 2.554861947339343, 'tsl_mult': 0.4853208810035309, 'strategy': 'mean_reversion', 'time_stop': 170, 'use_sma': False, 'use_atr': False, 'use_adx': True, 'use_ema': False, 'use_spike': False, 'rsi_required': True, 'edge_k': 0.9661479742825108, 'edge_cap': 0.7167812336274965, 'bull_strategy': 'mean_reversion', 'bull_bb_std_mult': 0.8469810381865643, 'bull_rsi_os': 11, 'bull_rsi_ob': 53, 'bull_adx_thresh': 6.715444413672769, 'bull_atr_min_pct': 0.020403267586325168, 'bull_atr_max_pct': 0.13595030299254202, 'bull_tp_mult': 2.379938202536663, 'bull_tsl_mult': 0.3149050275757689, 'bull_time_stop': 121, 'bull_use_sma': False, 'bull_use_ema': False, 'bull_use_atr': True, 'bull_use_adx': True, 'bull_use_spike': False, 'bull_rsi_required': False, 'bear_strategy': 'mean_reversion', 'bear_bb_std_mult': 2.1019536140029165, 'bear_rsi_os': 29, 'bear_rsi_ob': 68, 'bear_adx_thresh': 12.097828304953334, 'bear_atr_min_pct': 0.009479981435912568, 'bear_atr_max_pct': 0.13728115942055288, 'bear_tp_mult': 2.8968419502004457, 'bear_tsl_mult': 0.6797609633474364, 'bear_time_stop': 223, 'bear_use_sma': True, 'bear_use_ema': True, 'bear_use_atr': True, 'bear_use_adx': True, 'bear_use_spike': False, 'bear_rsi_required': True, 'sideways_strategy': 'mean_reversion', 'sideways_bb_std_mult': 0.9253464943889962, 'sideways_rsi_os': 24, 'sideways_rsi_ob': 77, 'sideways_adx_thresh': 16.519953465902876, 'sideways_atr_min_pct': 0.001338251522038484, 'sideways_atr_max_pct': 0.1425973766556836, 'sideways_tp_mult': 1.9606914929285153, 'sideways_tsl_mult': 0.6521775043244635, 'sideways_time_stop': 29, 'sideways_use_sma': True, 'sideways_use_ema': False, 'sideways_use_atr': True, 'sideways_use_adx': False, 'sideways_use_spike': True, 'sideways_rsi_required': True}.
[I 2025-08-30 16:33:21,646] Trial 447 finished with values: [-1000000000.0, 1000000000.0] and parameters: {'p_sma': 7, 'p_std': 57, 'p_atr': 25, 'p_adx': 19, 'rsi_period': 18, 'ema1': 26, 'ema2': 17, 'slip_atr_k': 0.10418254404267217, 'slip_spread_k': 0.6201867987192988, 'spread_hl_frac': 0.01770427503002932, 'bb_std_mult': 1.286610972242439, 'rsi_os': 34, 'rsi_ob': 88, 'vol_spike': 0.010953473396600171, 'adx_thresh': 30.536970382196813, 'atr_min_pct': 0.009078128623794866, 'atr_max_pct': 0.13997232489583866, 'tp_mult': 2.212484239175601, 'tsl_mult': 0.6019262276890445, 'strategy': 'mean_reversion', 'time_stop': 13, 'use_sma': False, 'use_atr': True, 'use_adx': True, 'use_ema': False, 'use_spike': False, 'rsi_required': True, 'edge_k': 1.5320415364660624, 'edge_cap': 0.5694083092597123, 'bull_strategy': 'mean_reversion', 'bull_bb_std_mult': 0.8402795576833915, 'bull_rsi_os': 6, 'bull_rsi_ob': 48, 'bull_adx_thresh': 12.655136622899061, 'bull_atr_min_pct': 0.0062153757155060455, 'bull_atr_max_pct': 0.14625765474590802, 'bull_tp_mult': 1.4848156754893713, 'bull_tsl_mult': 0.805916499719282, 'bull_time_stop': 86, 'bull_use_sma': False, 'bull_use_ema': False, 'bull_use_atr': True, 'bull_use_adx': True, 'bull_use_spike': True, 'bull_rsi_required': False, 'bear_strategy': 'mean_reversion', 'bear_bb_std_mult': 2.6620222803154627, 'bear_rsi_os': 12, 'bear_rsi_ob': 78, 'bear_adx_thresh': 24.066495174494992, 'bear_atr_min_pct': 0.02328339056831847, 'bear_atr_max_pct': 0.08955721557707902, 'bear_tp_mult': 2.223879628070382, 'bear_tsl_mult': 0.6769671253544884, 'bear_time_stop': 227, 'bear_use_sma': True, 'bear_use_ema': True, 'bear_use_atr': True, 'bear_use_adx': False, 'bear_use_spike': False, 'bear_rsi_required': False, 'sideways_strategy': 'breakout', 'sideways_bb_std_mult': 3.5957032969597895, 'sideways_rsi_os': 25, 'sideways_rsi_ob': 95, 'sideways_adx_thresh': 18.20033283112594, 'sideways_atr_min_pct': 0.0012913659158787045, 'sideways_atr_max_pct': 0.14249013041104994, 'sideways_tp_mult': 1.981486652298344, 'sideways_tsl_mult': 0.5233632603179579, 'sideways_time_stop': 11, 'sideways_use_sma': True, 'sideways_use_ema': False, 'sideways_use_atr': False, 'sideways_use_adx': False, 'sideways_use_spike': False, 'sideways_rsi_required': False}.
[I 2025-08-30 16:34:08,153] Trial 449 finished with values: [-1000000000.0, 1000000000.0] and parameters: {'p_sma': 37, 'p_std': 58, 'p_atr': 25, 'p_adx': 26, 'rsi_period': 53, 'ema1': 27, 'ema2': 37, 'slip_atr_k': 0.06741299470842974, 'slip_spread_k': 0.4618098736238593, 'spread_hl_frac': 0.016664590629862648, 'bb_std_mult': 1.3120045249306895, 'rsi_os': 34, 'rsi_ob': 90, 'vol_spike': 0.01677378728885886, 'adx_thresh': 30.597671806761525, 'atr_min_pct': 0.018343827320878008, 'atr_max_pct': 0.1402286743226173, 'tp_mult': 2.5029154419221915, 'tsl_mult': 0.42887740247326683, 'strategy': 'mean_reversion', 'time_stop': 11, 'use_sma': False, 'use_atr': True, 'use_adx': True, 'use_ema': True, 'use_spike': False, 'rsi_required': True, 'edge_k': 0.4114726561699249, 'edge_cap': 0.6489883790455729, 'bull_strategy': 'mean_reversion', 'bull_bb_std_mult': 1.1826504488826404, 'bull_rsi_os': 32, 'bull_rsi_ob': 80, 'bull_adx_thresh': 20.347797385386425, 'bull_atr_min_pct': 0.004151162170763438, 'bull_atr_max_pct': 0.10415573045261278, 'bull_tp_mult': 2.372599517705398, 'bull_tsl_mult': 0.024014131747611467, 'bull_time_stop': 85, 'bull_use_sma': False, 'bull_use_ema': True, 'bull_use_atr': True, 'bull_use_adx': True, 'bull_use_spike': False, 'bull_rsi_required': False, 'bear_strategy': 'breakout', 'bear_bb_std_mult': 3.589777290833048, 'bear_rsi_os': 12, 'bear_rsi_ob': 86, 'bear_adx_thresh': 13.674982240016861, 'bear_atr_min_pct': 0.022248178513174788, 'bear_atr_max_pct': 0.12464238339775419, 'bear_tp_mult': 1.483234436099158, 'bear_tsl_mult': 0.22851084195389249, 'bear_time_stop': 205, 'bear_use_sma': True, 'bear_use_ema': False, 'bear_use_atr': False, 'bear_use_adx': False, 'bear_use_spike': False, 'bear_rsi_required': False, 'sideways_strategy': 'breakout', 'sideways_bb_std_mult': 1.2177849377939616, 'sideways_rsi_os': 17, 'sideways_rsi_ob': 93, 'sideways_adx_thresh': 18.47640890262642, 'sideways_atr_min_pct': 0.028015584260886905, 'sideways_atr_max_pct': 0.14680773561534965, 'sideways_tp_mult': 1.9754891115801683, 'sideways_tsl_mult': 0.010082847871354883, 'sideways_time_stop': 197, 'sideways_use_sma': True, 'sideways_use_ema': True, 'sideways_use_atr': False, 'sideways_use_adx': False, 'sideways_use_spike': False, 'sideways_rsi_required': False}.
[I 2025-08-30 16:34:09,026] Trial 448 finished with values: [-1000000000.0, 1000000000.0] and parameters: {'p_sma': 9, 'p_std': 57, 'p_atr': 25, 'p_adx': 22, 'rsi_period': 48, 'ema1': 26, 'ema2': 10, 'slip_atr_k': 0.016001873203349667, 'slip_spread_k': 0.6241277455802244, 'spread_hl_frac': 0.027102821133360672, 'bb_std_mult': 2.999681936060867, 'rsi_os': 28, 'rsi_ob': 88, 'vol_spike': 0.016299335442991593, 'adx_thresh': 13.711177125450464, 'atr_min_pct': 0.01015341695110156, 'atr_max_pct': 0.07208304194071603, 'tp_mult': 2.0870550709520965, 'tsl_mult': 0.4628225940219655, 'strategy': 'mean_reversion', 'time_stop': 16, 'use_sma': False, 'use_atr': True, 'use_adx': True, 'use_ema': True, 'use_spike': False, 'rsi_required': True, 'edge_k': 1.7190527236710655, 'edge_cap': 0.43874493786508384, 'bull_strategy': 'mean_reversion', 'bull_bb_std_mult': 1.7196723623785752, 'bull_rsi_os': 10, 'bull_rsi_ob': 52, 'bull_adx_thresh': 12.378123926559336, 'bull_atr_min_pct': 0.02774980693861475, 'bull_atr_max_pct': 0.14984426688347774, 'bull_tp_mult': 1.4942823227003437, 'bull_tsl_mult': 0.1679657513970335, 'bull_time_stop': 60, 'bull_use_sma': False, 'bull_use_ema': True, 'bull_use_atr': True, 'bull_use_adx': True, 'bull_use_spike': True, 'bull_rsi_required': False, 'bear_strategy': 'breakout', 'bear_bb_std_mult': 2.0754618534708587, 'bear_rsi_os': 12, 'bear_rsi_ob': 94, 'bear_adx_thresh': 13.866932235490978, 'bear_atr_min_pct': 0.02256935262916274, 'bear_atr_max_pct': 0.12498318827388258, 'bear_tp_mult': 2.0931313050031206, 'bear_tsl_mult': 0.6753043691660072, 'bear_time_stop': 229, 'bear_use_sma': True, 'bear_use_ema': True, 'bear_use_atr': True, 'bear_use_adx': False, 'bear_use_spike': False, 'bear_rsi_required': False, 'sideways_strategy': 'breakout', 'sideways_bb_std_mult': 2.0320094216850157, 'sideways_rsi_os': 17, 'sideways_rsi_ob': 93, 'sideways_adx_thresh': 22.57518512622581, 'sideways_atr_min_pct': 0.0011718605424766448, 'sideways_atr_max_pct': 0.14617199841748685, 'sideways_tp_mult': 1.4889657841052413, 'sideways_tsl_mult': 0.5208777952956367, 'sideways_time_stop': 223, 'sideways_use_sma': True, 'sideways_use_ema': True, 'sideways_use_atr': False, 'sideways_use_adx': False, 'sideways_use_spike': False, 'sideways_rsi_required': False}.
