[I 2025-08-30 17:16:03,935] Trial 695 finished with values: [-1000000000.0, 1000000000.0] and parameters: {'p_sma': 48, 'p_std': 20, 'p_atr': 16, 'p_adx': 8, 'rsi_period': 66, 'ema1': 18, 'ema2': 12, 'slip_atr_k': 0.20614531260024566, 'slip_spread_k': 0.17665630173953423, 'spread_hl_frac': 0.01805746756671512, 'bb_std_mult': 1.8750954027286735, 'rsi_os': 33, 'rsi_ob': 59, 'vol_spike': 0.09313480710154796, 'adx_thresh': 28.5602373459976, 'atr_min_pct': 0.018517356234118643, 'atr_max_pct': 0.015191311691269582, 'tp_mult': 2.7954663317084965, 'tsl_mult': 0.990454344244358, 'strategy': 'mean_reversion', 'time_stop': 41, 'use_sma': False, 'use_atr': False, 'use_adx': False, 'use_ema': False, 'use_spike': False, 'rsi_required': True, 'edge_k': 0.7381413346856627, 'edge_cap': 0.8248204586067698, 'bull_strategy': 'mean_reversion', 'bull_bb_std_mult': 2.2117006704710955, 'bull_rsi_os': 10, 'bull_rsi_ob': 54, 'bull_adx_thresh': 33.69698409269164, 'bull_atr_min_pct': 0.023862026824124468, 'bull_atr_max_pct': 0.1396960385505287, 'bull_tp_mult': 2.824432607588924, 'bull_tsl_mult': 0.759270249114378, 'bull_time_stop': 16, 'bull_use_sma': True, 'bull_use_ema': True, 'bull_use_atr': False, 'bull_use_adx': False, 'bull_use_spike': False, 'bull_rsi_required': False, 'bear_strategy': 'mean_reversion', 'bear_bb_std_mult': 1.6990776846436033, 'bear_rsi_os': 16, 'bear_rsi_ob': 77, 'bear_adx_thresh': 7.774645961895285, 'bear_atr_min_pct': 0.015591160862948707, 'bear_atr_max_pct': 0.10250820255134467, 'bear_tp_mult': 2.2014686158299224, 'bear_tsl_mult': 0.6072978871301649, 'bear_time_stop': 36, 'bear_use_sma': True, 'bear_use_ema': False, 'bear_use_atr': False, 'bear_use_adx': False, 'bear_use_spike': False, 'bear_rsi_required': False, 'sideways_strategy': 'mean_reversion', 'sideways_bb_std_mult': 0.6297638968195164, 'sideways_rsi_os': 31, 'sideways_rsi_ob': 92, 'sideways_adx_thresh': 10.77540383185135, 'sideways_atr_min_pct': 0.026394106633369704, 'sideways_atr_max_pct': 0.10390423304629211, 'sideways_tp_mult': 2.999248615086868, 'sideways_tsl_mult': 0.424232140551531, 'sideways_time_stop': 300, 'sideways_use_sma': False, 'sideways_use_ema': False, 'sideways_use_atr': False, 'sideways_use_adx': False, 'sideways_use_spike': False, 'sideways_rsi_required': True}.
[I 2025-08-30 17:16:40,477] Trial 693 finished with values: [-0.0458817022719995, 0.04582005362433087] and parameters: {'p_sma': 7, 'p_std': 21, 'p_atr': 16, 'p_adx': 8, 'rsi_period': 22, 'ema1': 13, 'ema2': 15, 'slip_atr_k': 0.005559841596185937, 'slip_spread_k': 0.19289586877367942, 'spread_hl_frac': 0.018190153217812043, 'bb_std_mult': 3.0908142258176485, 'rsi_os': 32, 'rsi_ob': 86, 'vol_spike': 0.10265581847736967, 'adx_thresh': 11.142672371475884, 'atr_min_pct': 0.01850663315436866, 'atr_max_pct': 0.14994787300562382, 'tp_mult': 1.3133966896108076, 'tsl_mult': 0.9017396395138417, 'strategy': 'mean_reversion', 'time_stop': 41, 'use_sma': False, 'use_atr': False, 'use_adx': False, 'use_ema': False, 'use_spike': False, 'rsi_required': True, 'edge_k': 0.5656062131130296, 'edge_cap': 0.8562593270157389, 'bull_strategy': 'mean_reversion', 'bull_bb_std_mult': 2.327833189388778, 'bull_rsi_os': 20, 'bull_rsi_ob': 81, 'bull_adx_thresh': 8.163060409551731, 'bull_atr_min_pct': 0.01468330901734527, 'bull_atr_max_pct': 0.09405627233756993, 'bull_tp_mult': 2.3310030122598437, 'bull_tsl_mult': 0.7680269736235252, 'bull_time_stop': 89, 'bull_use_sma': True, 'bull_use_ema': True, 'bull_use_atr': False, 'bull_use_adx': False, 'bull_use_spike': False, 'bull_rsi_required': False, 'bear_strategy': 'mean_reversion', 'bear_bb_std_mult': 2.9383095745135437, 'bear_rsi_os': 16, 'bear_rsi_ob': 82, 'bear_adx_thresh': 5.0174073716097105, 'bear_atr_min_pct': 0.019807112898844202, 'bear_atr_max_pct': 0.10997898339383275, 'bear_tp_mult': 2.1552801105143713, 'bear_tsl_mult': 0.5886697961357154, 'bear_time_stop': 70, 'bear_use_sma': True, 'bear_use_ema': False, 'bear_use_atr': False, 'bear_use_adx': False, 'bear_use_spike': False, 'bear_rsi_required': False, 'sideways_strategy': 'breakout', 'sideways_bb_std_mult': 0.7329234020830451, 'sideways_rsi_os': 54, 'sideways_rsi_ob': 91, 'sideways_adx_thresh': 11.011257466710038, 'sideways_atr_min_pct': 0.0016177224646744086, 'sideways_atr_max_pct': 0.10351583761187352, 'sideways_tp_mult': 2.99825082951826, 'sideways_tsl_mult': 0.8838076084565203, 'sideways_time_stop': 264, 'sideways_use_sma': True, 'sideways_use_ema': False, 'sideways_use_atr': False, 'sideways_use_adx': False, 'sideways_use_spike': False, 'sideways_rsi_required': True}.
[I 2025-08-30 17:16:40,915] Trial 694 finished with values: [-0.029273868363940192, 0.029202698691208243] and parameters: {'p_sma': 42, 'p_std': 21, 'p_atr': 16, 'p_adx': 8, 'rsi_period': 9, 'ema1': 20, 'ema2': 12, 'slip_atr_k': 0.014407572338162072, 'slip_spread_k': 0.19664355234343034, 'spread_hl_frac': 0.02582601829448021, 'bb_std_mult': 1.8638563986692414, 'rsi_os': 42, 'rsi_ob': 59, 'vol_spike': 0.09373392315198216, 'adx_thresh': 9.260587709666282, 'atr_min_pct': 0.010594588560788949, 'atr_max_pct': 0.1472944071172765, 'tp_mult': 2.771314073408493, 'tsl_mult': 0.9135989929149285, 'strategy': 'mean_reversion', 'time_stop': 152, 'use_sma': False, 'use_atr': False, 'use_adx': False, 'use_ema': False, 'use_spike': False, 'rsi_required': True, 'edge_k': 1.161299256556508, 'edge_cap': 0.8607680205229981, 'bull_strategy': 'mean_reversion', 'bull_bb_std_mult': 2.2121222498819595, 'bull_rsi_os': 36, 'bull_rsi_ob': 54, 'bull_adx_thresh': 13.763435053512032, 'bull_atr_min_pct': 0.022901004232620578, 'bull_atr_max_pct': 0.12216535510525933, 'bull_tp_mult': 2.333846886509079, 'bull_tsl_mult': 0.7725358646221631, 'bull_time_stop': 232, 'bull_use_sma': True, 'bull_use_ema': True, 'bull_use_atr': False, 'bull_use_adx': False, 'bull_use_spike': False, 'bull_rsi_required': False, 'bear_strategy': 'mean_reversion', 'bear_bb_std_mult': 1.3304267944908579, 'bear_rsi_os': 16, 'bear_rsi_ob': 82, 'bear_adx_thresh': 11.584470478019618, 'bear_atr_min_pct': 0.0025427267323210653, 'bear_atr_max_pct': 0.062237727909050244, 'bear_tp_mult': 2.1967113242584344, 'bear_tsl_mult': 0.7832614738446406, 'bear_time_stop': 147, 'bear_use_sma': True, 'bear_use_ema': False, 'bear_use_atr': False, 'bear_use_adx': False, 'bear_use_spike': False, 'bear_rsi_required': False, 'sideways_strategy': 'mean_reversion', 'sideways_bb_std_mult': 0.6834474918896652, 'sideways_rsi_os': 17, 'sideways_rsi_ob': 92, 'sideways_adx_thresh': 13.431277580378572, 'sideways_atr_min_pct': 0.0017295512780034906, 'sideways_atr_max_pct': 0.0977676672811516, 'sideways_tp_mult': 2.8675858711825577, 'sideways_tsl_mult': 0.42375275545578206, 'sideways_time_stop': 269, 'sideways_use_sma': False, 'sideways_use_ema': False, 'sideways_use_atr': False, 'sideways_use_adx': False, 'sideways_use_spike': False, 'sideways_rsi_required': True}.
[I 2025-08-30 17:16:45,343] Trial 696 finished with values: [-1000000000.0, 1000000000.0] and parameters: {'p_sma': 9, 'p_std': 23, 'p_atr': 14, 'p_adx': 9, 'rsi_period': 75, 'ema1': 12, 'ema2': 12, 'slip_atr_k': 0.2066566162394805, 'slip_spread_k': 0.16968074716183165, 'spread_hl_frac': 0.01044246410723329, 'bb_std_mult': 3.0675271861880917, 'rsi_os': 49, 'rsi_ob': 85, 'vol_spike': 0.09207505142603914, 'adx_thresh': 5.315879902633384, 'atr_min_pct': 0.02032626442371376, 'atr_max_pct': 0.14567654850347223, 'tp_mult': 2.7792493467652246, 'tsl_mult': 0.9259017076511753, 'strategy': 'mean_reversion', 'time_stop': 47, 'use_sma': False, 'use_atr': True, 'use_adx': True, 'use_ema': False, 'use_spike': False, 'rsi_required': True, 'edge_k': 0.5793136975421082, 'edge_cap': 0.31143914489706365, 'bull_strategy': 'mean_reversion', 'bull_bb_std_mult': 2.0781311189841825, 'bull_rsi_os': 55, 'bull_rsi_ob': 55, 'bull_adx_thresh': 33.823451134318425, 'bull_atr_min_pct': 0.00957107123632684, 'bull_atr_max_pct': 0.08214493833109739, 'bull_tp_mult': 2.2388952090754533, 'bull_tsl_mult': 0.7865716094100886, 'bull_time_stop': 87, 'bull_use_sma': True, 'bull_use_ema': True, 'bull_use_atr': False, 'bull_use_adx': True, 'bull_use_spike': False, 'bull_rsi_required': False, 'bear_strategy': 'mean_reversion', 'bear_bb_std_mult': 1.708493286993504, 'bear_rsi_os': 16, 'bear_rsi_ob': 69, 'bear_adx_thresh': 11.482509377002902, 'bear_atr_min_pct': 0.019044072514926395, 'bear_atr_max_pct': 0.010353839011430707, 'bear_tp_mult': 1.3896784273888683, 'bear_tsl_mult': 0.17672499980039852, 'bear_time_stop': 215, 'bear_use_sma': True, 'bear_use_ema': False, 'bear_use_atr': False, 'bear_use_adx': False, 'bear_use_spike': False, 'bear_rsi_required': False, 'sideways_strategy': 'mean_reversion', 'sideways_bb_std_mult': 0.618932303749835, 'sideways_rsi_os': 31, 'sideways_rsi_ob': 92, 'sideways_adx_thresh': 24.98161271419723, 'sideways_atr_min_pct': 0.000817324305218689, 'sideways_atr_max_pct': 0.103545809922619, 'sideways_tp_mult': 1.8889011114501715, 'sideways_tsl_mult': 0.8768824420392736, 'sideways_time_stop': 114, 'sideways_use_sma': False, 'sideways_use_ema': False, 'sideways_use_atr': False, 'sideways_use_adx': False, 'sideways_use_spike': False, 'sideways_rsi_required': True}.
[I 2025-08-30 17:16:45,525] Trial 697 finished with values: [-0.024027394095968102, 0.02405303124259718] and parameters: {'p_sma': 7, 'p_std': 23, 'p_atr': 17, 'p_adx': 9, 'rsi_period': 10, 'ema1': 18, 'ema2': 10, 'slip_atr_k': 0.015398149020583281, 'slip_spread_k': 0.20438121300139003, 'spread_hl_frac': 0.010689572997303396, 'bb_std_mult': 3.1875662348557903, 'rsi_os': 32, 'rsi_ob': 86, 'vol_spike': 0.09076171573024264, 'adx_thresh': 11.732364881528724, 'atr_min_pct': 0.020519228542451542, 'atr_max_pct': 0.14984608543652828, 'tp_mult': 2.6744544038074998, 'tsl_mult': 0.9321369426002322, 'strategy': 'mean_reversion', 'time_stop': 38, 'use_sma': False, 'use_atr': True, 'use_adx': True, 'use_ema': False, 'use_spike': False, 'rsi_required': True, 'edge_k': 0.5708815930024618, 'edge_cap': 0.7868019237678825, 'bull_strategy': 'mean_reversion', 'bull_bb_std_mult': 2.130092832674502, 'bull_rsi_os': 12, 'bull_rsi_ob': 55, 'bull_adx_thresh': 7.618776901274357, 'bull_atr_min_pct': 0.014588078791209031, 'bull_atr_max_pct': 0.14090465767263513, 'bull_tp_mult': 2.08779386855986, 'bull_tsl_mult': 0.8574884597834576, 'bull_time_stop': 70, 'bull_use_sma': True, 'bull_use_ema': True, 'bull_use_atr': False, 'bull_use_adx': True, 'bull_use_spike': False, 'bull_rsi_required': False, 'bear_strategy': 'mean_reversion', 'bear_bb_std_mult': 0.9269951446603533, 'bear_rsi_os': 21, 'bear_rsi_ob': 76, 'bear_adx_thresh': 8.653806356181502, 'bear_atr_min_pct': 0.01899274570277683, 'bear_atr_max_pct': 0.12624729849088645, 'bear_tp_mult': 1.2055340552894704, 'bear_tsl_mult': 0.7375730474951523, 'bear_time_stop': 194, 'bear_use_sma': True, 'bear_use_ema': True, 'bear_use_atr': False, 'bear_use_adx': False, 'bear_use_spike': False, 'bear_rsi_required': False, 'sideways_strategy': 'breakout', 'sideways_bb_std_mult': 0.816901863767291, 'sideways_rsi_os': 30, 'sideways_rsi_ob': 88, 'sideways_adx_thresh': 22.22955274129126, 'sideways_atr_min_pct': 0.0017037688727060548, 'sideways_atr_max_pct': 0.09757151046885389, 'sideways_tp_mult': 2.6920407447987893, 'sideways_tsl_mult': 0.4458519001031968, 'sideways_time_stop': 273, 'sideways_use_sma': True, 'sideways_use_ema': False, 'sideways_use_atr': False, 'sideways_use_adx': False, 'sideways_use_spike': False, 'sideways_rsi_required': True}.
[I 2025-08-30 17:16:46,711] Trial 699 finished with values: [-1000000000.0, 1000000000.0] and parameters: {'p_sma': 9, 'p_std': 35, 'p_atr': 14, 'p_adx': 9, 'rsi_period': 20, 'ema1': 18, 'ema2': 51, 'slip_atr_k': 0.0985781057408303, 'slip_spread_k': 0.22519710970386758, 'spread_hl_frac': 0.010988765877632282, 'bb_std_mult': 2.6447492450604666, 'rsi_os': 47, 'rsi_ob': 50, 'vol_spike': 0.08020230216203293, 'adx_thresh': 11.045995597761339, 'atr_min_pct': 0.02033356738818012, 'atr_max_pct': 0.14546109707282362, 'tp_mult': 2.9074962093016232, 'tsl_mult': 0.9311260846427987, 'strategy': 'mean_reversion', 'time_stop': 36, 'use_sma': False, 'use_atr': True, 'use_adx': True, 'use_ema': False, 'use_spike': False, 'rsi_required': True, 'edge_k': 1.0194912111837793, 'edge_cap': 0.7804417254361942, 'bull_strategy': 'mean_reversion', 'bull_bb_std_mult': 2.05424097762022, 'bull_rsi_os': 25, 'bull_rsi_ob': 53, 'bull_adx_thresh': 33.98382469437786, 'bull_atr_min_pct': 0.02148293195719206, 'bull_atr_max_pct': 0.08145333713921239, 'bull_tp_mult': 2.0855299156871894, 'bull_tsl_mult': 0.8547878947499761, 'bull_time_stop': 70, 'bull_use_sma': True, 'bull_use_ema': True, 'bull_use_atr': False, 'bull_use_adx': True, 'bull_use_spike': False, 'bull_rsi_required': False, 'bear_strategy': 'mean_reversion', 'bear_bb_std_mult': 1.2247104636268653, 'bear_rsi_os': 38, 'bear_rsi_ob': 49, 'bear_adx_thresh': 19.438246957593776, 'bear_atr_min_pct': 0.018859017626077897, 'bear_atr_max_pct': 0.10710483553207786, 'bear_tp_mult': 2.707108748438194, 'bear_tsl_mult': 0.24566224080361027, 'bear_time_stop': 194, 'bear_use_sma': True, 'bear_use_ema': True, 'bear_use_atr': False, 'bear_use_adx': False, 'bear_use_spike': False, 'bear_rsi_required': False, 'sideways_strategy': 'breakout', 'sideways_bb_std_mult': 0.7980103161161921, 'sideways_rsi_os': 30, 'sideways_rsi_ob': 88, 'sideways_adx_thresh': 22.39699089815444, 'sideways_atr_min_pct': 0.024611465738025556, 'sideways_atr_max_pct': 0.09639169697743322, 'sideways_tp_mult': 2.111405197437991, 'sideways_tsl_mult': 0.5637877766020357, 'sideways_time_stop': 274, 'sideways_use_sma': True, 'sideways_use_ema': False, 'sideways_use_atr': False, 'sideways_use_adx': False, 'sideways_use_spike': False, 'sideways_rsi_required': True}.
[I 2025-08-30 17:16:46,991] Trial 701 finished with values: [-1000000000.0, 1000000000.0] and parameters: {'p_sma': 6, 'p_std': 46, 'p_atr': 15, 'p_adx': 30, 'rsi_period': 35, 'ema1': 15, 'ema2': 45, 'slip_atr_k': 0.1295692292689365, 'slip_spread_k': 0.16796078667166822, 'spread_hl_frac': 0.016186502824310917, 'bb_std_mult': 1.5556072792012798, 'rsi_os': 53, 'rsi_ob': 88, 'vol_spike': 0.07483197247994709, 'adx_thresh': 11.0256811088876, 'atr_min_pct': 0.017915231636096443, 'atr_max_pct': 0.1455008782045441, 'tp_mult': 2.9135290917983805, 'tsl_mult': 0.9567812970574184, 'strategy': 'mean_reversion', 'time_stop': 24, 'use_sma': False, 'use_atr': True, 'use_adx': True, 'use_ema': False, 'use_spike': False, 'rsi_required': True, 'edge_k': 0.5279775018056833, 'edge_cap': 0.7572708183767449, 'bull_strategy': 'mean_reversion', 'bull_bb_std_mult': 0.7027557977646872, 'bull_rsi_os': 11, 'bull_rsi_ob': 53, 'bull_adx_thresh': 34.37081993289442, 'bull_atr_min_pct': 0.029170208970787703, 'bull_atr_max_pct': 0.020783747908403163, 'bull_tp_mult': 2.2620701265307055, 'bull_tsl_mult': 0.8121679896887553, 'bull_time_stop': 280, 'bull_use_sma': True, 'bull_use_ema': True, 'bull_use_atr': False, 'bull_use_adx': True, 'bull_use_spike': False, 'bull_rsi_required': False, 'bear_strategy': 'mean_reversion', 'bear_bb_std_mult': 1.5155869857377275, 'bear_rsi_os': 37, 'bear_rsi_ob': 77, 'bear_adx_thresh': 12.107373036770595, 'bear_atr_min_pct': 0.020402558615457773, 'bear_atr_max_pct': 0.02995196498495621, 'bear_tp_mult': 1.8363556256930913, 'bear_tsl_mult': 0.6225755248578728, 'bear_time_stop': 153, 'bear_use_sma': True, 'bear_use_ema': True, 'bear_use_atr': False, 'bear_use_adx': False, 'bear_use_spike': False, 'bear_rsi_required': False, 'sideways_strategy': 'breakout', 'sideways_bb_std_mult': 0.9311427579067916, 'sideways_rsi_os': 34, 'sideways_rsi_ob': 86, 'sideways_adx_thresh': 10.58220572729242, 'sideways_atr_min_pct': 0.019195552475421897, 'sideways_atr_max_pct': 0.12528542548081226, 'sideways_tp_mult': 2.0373292196563906, 'sideways_tsl_mult': 0.0790754209292045, 'sideways_time_stop': 289, 'sideways_use_sma': True, 'sideways_use_ema': False, 'sideways_use_atr': False, 'sideways_use_adx': False, 'sideways_use_spike': False, 'sideways_rsi_required': True}.
[I 2025-08-30 17:17:25,437] Trial 698 finished with values: [-0.015758564832613065, 0.01567299620370944] and parameters: {'p_sma': 9, 'p_std': 23, 'p_atr': 14, 'p_adx': 9, 'rsi_period': 9, 'ema1': 18, 'ema2': 10, 'slip_atr_k': 0.0003777273127301122, 'slip_spread_k': 0.17098802345295686, 'spread_hl_frac': 0.033173078461624574, 'bb_std_mult': 3.1878732553259153, 'rsi_os': 48, 'rsi_ob': 85, 'vol_spike': 0.09238349825890467, 'adx_thresh': 5.013634937596471, 'atr_min_pct': 0.02086979404563083, 'atr_max_pct': 0.027306629365748583, 'tp_mult': 2.766780292062373, 'tsl_mult': 0.9304468872607049, 'strategy': 'mean_reversion', 'time_stop': 272, 'use_sma': False, 'use_atr': True, 'use_adx': True, 'use_ema': False, 'use_spike': False, 'rsi_required': True, 'edge_k': 0.6633709597671992, 'edge_cap': 0.867305928719747, 'bull_strategy': 'mean_reversion', 'bull_bb_std_mult': 2.078252719170042, 'bull_rsi_os': 29, 'bull_rsi_ob': 54, 'bull_adx_thresh': 34.10373459331674, 'bull_atr_min_pct': 0.021368215771989885, 'bull_atr_max_pct': 0.1402870639293622, 'bull_tp_mult': 1.876115960991831, 'bull_tsl_mult': 0.6371975533953226, 'bull_time_stop': 68, 'bull_use_sma': True, 'bull_use_ema': True, 'bull_use_atr': False, 'bull_use_adx': True, 'bull_use_spike': False, 'bull_rsi_required': False, 'bear_strategy': 'mean_reversion', 'bear_bb_std_mult': 1.5919547049113443, 'bear_rsi_os': 38, 'bear_rsi_ob': 76, 'bear_adx_thresh': 22.907653547725673, 'bear_atr_min_pct': 0.018931124355115275, 'bear_atr_max_pct': 0.10772621063027467, 'bear_tp_mult': 2.7237620815921577, 'bear_tsl_mult': 0.7352301830830695, 'bear_time_stop': 193, 'bear_use_sma': True, 'bear_use_ema': True, 'bear_use_atr': False, 'bear_use_adx': False, 'bear_use_spike': False, 'bear_rsi_required': False, 'sideways_strategy': 'mean_reversion', 'sideways_bb_std_mult': 0.7886402328832194, 'sideways_rsi_os': 31, 'sideways_rsi_ob': 94, 'sideways_adx_thresh': 26.39448524581642, 'sideways_atr_min_pct': 0.0007602964738720585, 'sideways_atr_max_pct': 0.07852398561344796, 'sideways_tp_mult': 2.9263277001686467, 'sideways_tsl_mult': 0.446341391028943, 'sideways_time_stop': 114, 'sideways_use_sma': False, 'sideways_use_ema': False, 'sideways_use_atr': False, 'sideways_use_adx': False, 'sideways_use_spike': False, 'sideways_rsi_required': True}.
[I 2025-08-30 17:17:26,184] Trial 700 finished with values: [-1000000000.0, 0.22134499151375023] and parameters: {'p_sma': 53, 'p_std': 18, 'p_atr': 17, 'p_adx': 7, 'rsi_period': 20, 'ema1': 18, 'ema2': 54, 'slip_atr_k': 0.0848971762416596, 'slip_spread_k': 0.2201535664830595, 'spread_hl_frac': 0.016380776568999215, 'bb_std_mult': 3.1694236643232596, 'rsi_os': 45, 'rsi_ob': 87, 'vol_spike': 0.08038592964329061, 'adx_thresh': 11.804189510825356, 'atr_min_pct': 0.02052846978172792, 'atr_max_pct': 0.14528958028598782, 'tp_mult': 2.90870640156609, 'tsl_mult': 0.9544577860975725, 'strategy': 'mean_reversion', 'time_stop': 82, 'use_sma': False, 'use_atr': True, 'use_adx': True, 'use_ema': False, 'use_spike': False, 'rsi_required': True, 'edge_k': 0.5287709730145814, 'edge_cap': 0.7491122303434327, 'bull_strategy': 'mean_reversion', 'bull_bb_std_mult': 1.9237007472590193, 'bull_rsi_os': 29, 'bull_rsi_ob': 53, 'bull_adx_thresh': 34.35790399901993, 'bull_atr_min_pct': 0.022371561837954773, 'bull_atr_max_pct': 0.14119383211303552, 'bull_tp_mult': 1.8900848968013189, 'bull_tsl_mult': 0.8087969364924444, 'bull_time_stop': 66, 'bull_use_sma': True, 'bull_use_ema': True, 'bull_use_atr': False, 'bull_use_adx': True, 'bull_use_spike': False, 'bull_rsi_required': False, 'bear_strategy': 'mean_reversion', 'bear_bb_std_mult': 0.9335001355865542, 'bear_rsi_os': 21, 'bear_rsi_ob': 49, 'bear_adx_thresh': 32.26221731664945, 'bear_atr_min_pct': 0.009304903803705557, 'bear_atr_max_pct': 0.03023016377938586, 'bear_tp_mult': 2.2789574744136125, 'bear_tsl_mult': 0.6155139594555927, 'bear_time_stop': 210, 'bear_use_sma': True, 'bear_use_ema': True, 'bear_use_atr': False, 'bear_use_adx': False, 'bear_use_spike': False, 'bear_rsi_required': False, 'sideways_strategy': 'breakout', 'sideways_bb_std_mult': 0.7950970267893223, 'sideways_rsi_os': 46, 'sideways_rsi_ob': 85, 'sideways_adx_thresh': 31.134122564891612, 'sideways_atr_min_pct': 3.540086548314489e-05, 'sideways_atr_max_pct': 0.07645535458557214, 'sideways_tp_mult': 2.917356120118507, 'sideways_tsl_mult': 0.5678094947855774, 'sideways_time_stop': 136, 'sideways_use_sma': True, 'sideways_use_ema': False, 'sideways_use_atr': False, 'sideways_use_adx': False, 'sideways_use_spike': False, 'sideways_rsi_required': True}.
