[I 2025-08-30 16:27:52,948] Trial 417 finished with values: [-1000000000.0, 1000000000.0] and parameters: {'p_sma': 10, 'p_std': 60, 'p_atr': 7, 'p_adx': 21, 'rsi_period': 16, 'ema1': 26, 'ema2': 12, 'slip_atr_k': 0.019243954706171046, 'slip_spread_k': 0.2008856281304529, 'spread_hl_frac': 0.024156005792771492, 'bb_std_mult': 2.9637633653167117, 'rsi_os': 34, 'rsi_ob': 90, 'vol_spike': 0.13657000825465415, 'adx_thresh': 11.657691119935627, 'atr_min_pct': 0.02608466680355724, 'atr_max_pct': 0.04219991571102312, 'tp_mult': 2.807202360529942, 'tsl_mult': 0.7645580732237522, 'strategy': 'mean_reversion', 'time_stop': 141, 'use_sma': False, 'use_atr': True, 'use_adx': True, 'use_ema': False, 'use_spike': False, 'rsi_required': True, 'edge_k': 1.5811850455163285, 'edge_cap': 0.6219477064344267, 'bull_strategy': 'mean_reversion', 'bull_bb_std_mult': 1.865972360834195, 'bull_rsi_os': 39, 'bull_rsi_ob': 51, 'bull_adx_thresh': 11.037443655393275, 'bull_atr_min_pct': 0.021018268942396397, 'bull_atr_max_pct': 0.14038289122912403, 'bull_tp_mult': 1.9538863023574269, 'bull_tsl_mult': 0.27128763782092974, 'bull_time_stop': 54, 'bull_use_sma': False, 'bull_use_ema': True, 'bull_use_atr': True, 'bull_use_adx': True, 'bull_use_spike': False, 'bull_rsi_required': False, 'bear_strategy': 'mean_reversion', 'bear_bb_std_mult': 2.1399615431836807, 'bear_rsi_os': 10, 'bear_rsi_ob': 74, 'bear_adx_thresh': 17.368452084506707, 'bear_atr_min_pct': 0.016504590957493872, 'bear_atr_max_pct': 0.08757476034703139, 'bear_tp_mult': 2.1356346275983085, 'bear_tsl_mult': 0.6180382566335929, 'bear_time_stop': 81, 'bear_use_sma': True, 'bear_use_ema': False, 'bear_use_atr': False, 'bear_use_adx': False, 'bear_use_spike': False, 'bear_rsi_required': False, 'sideways_strategy': 'breakout', 'sideways_bb_std_mult': 2.481664540264687, 'sideways_rsi_os': 29, 'sideways_rsi_ob': 95, 'sideways_adx_thresh': 12.05350089384703, 'sideways_atr_min_pct': 0.023900183996084484, 'sideways_atr_max_pct': 0.13907907858509005, 'sideways_tp_mult': 1.45255718722717, 'sideways_tsl_mult': 0.5624516054717106, 'sideways_time_stop': 56, 'sideways_use_sma': True, 'sideways_use_ema': False, 'sideways_use_atr': True, 'sideways_use_adx': False, 'sideways_use_spike': False, 'sideways_rsi_required': True}.
[I 2025-08-30 16:27:54,202] Trial 416 finished with values: [-0.06518100595507725, 0.06514383292812842] and parameters: {'p_sma': 10, 'p_std': 56, 'p_atr': 7, 'p_adx': 27, 'rsi_period': 16, 'ema1': 26, 'ema2': 27, 'slip_atr_k': 0.09059517830677463, 'slip_spread_k': 0.583752105325701, 'spread_hl_frac': 0.013418164220472331, 'bb_std_mult': 2.944674224403916, 'rsi_os': 37, 'rsi_ob': 90, 'vol_spike': 0.25784161556116036, 'adx_thresh': 23.864784197283754, 'atr_min_pct': 0.019344617855806122, 'atr_max_pct': 0.12035421910425366, 'tp_mult': 2.6991118611168554, 'tsl_mult': 0.4392041487233406, 'strategy': 'mean_reversion', 'time_stop': 90, 'use_sma': False, 'use_atr': True, 'use_adx': True, 'use_ema': False, 'use_spike': False, 'rsi_required': True, 'edge_k': 1.5782180702780182, 'edge_cap': 0.6210928517825313, 'bull_strategy': 'mean_reversion', 'bull_bb_std_mult': 2.925404798948421, 'bull_rsi_os': 36, 'bull_rsi_ob': 51, 'bull_adx_thresh': 10.7816438536003, 'bull_atr_min_pct': 0.020740900133502715, 'bull_atr_max_pct': 0.1401341663014901, 'bull_tp_mult': 2.1583400922069984, 'bull_tsl_mult': 0.11975255067913404, 'bull_time_stop': 56, 'bull_use_sma': False, 'bull_use_ema': True, 'bull_use_atr': True, 'bull_use_adx': True, 'bull_use_spike': False, 'bull_rsi_required': False, 'bear_strategy': 'mean_reversion', 'bear_bb_std_mult': 0.5107369779209061, 'bear_rsi_os': 49, 'bear_rsi_ob': 74, 'bear_adx_thresh': 7.988192253241497, 'bear_atr_min_pct': 0.022143260748304316, 'bear_atr_max_pct': 0.08755188269209636, 'bear_tp_mult': 2.135097148739618, 'bear_tsl_mult': 0.034604864420797576, 'bear_time_stop': 81, 'bear_use_sma': True, 'bear_use_ema': False, 'bear_use_atr': False, 'bear_use_adx': False, 'bear_use_spike': False, 'bear_rsi_required': False, 'sideways_strategy': 'breakout', 'sideways_bb_std_mult': 2.052438919275273, 'sideways_rsi_os': 29, 'sideways_rsi_ob': 86, 'sideways_adx_thresh': 16.946998095992775, 'sideways_atr_min_pct': 2.1909000210552356e-05, 'sideways_atr_max_pct': 0.0766385414580543, 'sideways_tp_mult': 1.4797292849089716, 'sideways_tsl_mult': 0.5542830438763948, 'sideways_time_stop': 185, 'sideways_use_sma': True, 'sideways_use_ema': False, 'sideways_use_atr': True, 'sideways_use_adx': False, 'sideways_use_spike': False, 'sideways_rsi_required': True}.
[I 2025-08-30 16:27:54,839] Trial 414 finished with values: [-1000000000.0, 1000000000.0] and parameters: {'p_sma': 10, 'p_std': 56, 'p_atr': 29, 'p_adx': 26, 'rsi_period': 46, 'ema1': 10, 'ema2': 15, 'slip_atr_k': 0.08923407608246131, 'slip_spread_k': 0.5920139198664396, 'spread_hl_frac': 0.01786693480832474, 'bb_std_mult': 2.0146453717480752, 'rsi_os': 10, 'rsi_ob': 83, 'vol_spike': 0.0059161861310667, 'adx_thresh': 23.9715044924058, 'atr_min_pct': 0.015320771242778008, 'atr_max_pct': 0.032894372343821, 'tp_mult': 2.6945614017514394, 'tsl_mult': 0.7704301021794223, 'strategy': 'mean_reversion', 'time_stop': 10, 'use_sma': False, 'use_atr': True, 'use_adx': True, 'use_ema': True, 'use_spike': False, 'rsi_required': True, 'edge_k': 0.0016751398656534855, 'edge_cap': 0.6217257433567227, 'bull_strategy': 'mean_reversion', 'bull_bb_std_mult': 0.9776738243671494, 'bull_rsi_os': 12, 'bull_rsi_ob': 48, 'bull_adx_thresh': 7.80165883868297, 'bull_atr_min_pct': 0.02071207063823255, 'bull_atr_max_pct': 0.1406066649461768, 'bull_tp_mult': 2.139502843012639, 'bull_tsl_mult': 0.11948906407888726, 'bull_time_stop': 56, 'bull_use_sma': False, 'bull_use_ema': True, 'bull_use_atr': True, 'bull_use_adx': True, 'bull_use_spike': False, 'bull_rsi_required': False, 'bear_strategy': 'breakout', 'bear_bb_std_mult': 2.0086308150643593, 'bear_rsi_os': 12, 'bear_rsi_ob': 74, 'bear_adx_thresh': 14.162334694902738, 'bear_atr_min_pct': 0.021267497918676326, 'bear_atr_max_pct': 0.07984550732478521, 'bear_tp_mult': 2.124670587619222, 'bear_tsl_mult': 0.6051883651560798, 'bear_time_stop': 80, 'bear_use_sma': True, 'bear_use_ema': False, 'bear_use_atr': False, 'bear_use_adx': False, 'bear_use_spike': False, 'bear_rsi_required': False, 'sideways_strategy': 'breakout', 'sideways_bb_std_mult': 2.546640481837089, 'sideways_rsi_os': 29, 'sideways_rsi_ob': 89, 'sideways_adx_thresh': 16.84842677465063, 'sideways_atr_min_pct': 0.0016475715545331052, 'sideways_atr_max_pct': 0.13825380943125884, 'sideways_tp_mult': 1.442203772322279, 'sideways_tsl_mult': 0.4797993677488536, 'sideways_time_stop': 218, 'sideways_use_sma': True, 'sideways_use_ema': True, 'sideways_use_atr': False, 'sideways_use_adx': False, 'sideways_use_spike': False, 'sideways_rsi_required': True}.
[I 2025-08-30 16:27:54,840] Trial 415 finished with values: [-0.03239972154971926, 0.03232900290860747] and parameters: {'p_sma': 10, 'p_std': 56, 'p_atr': 29, 'p_adx': 26, 'rsi_period': 16, 'ema1': 26, 'ema2': 43, 'slip_atr_k': 0.09032303000004493, 'slip_spread_k': 0.16774577517298234, 'spread_hl_frac': 0.013441717971526991, 'bb_std_mult': 2.9482035903044017, 'rsi_os': 47, 'rsi_ob': 90, 'vol_spike': 0.006008026245523137, 'adx_thresh': 13.366752456785003, 'atr_min_pct': 0.018575172270234586, 'atr_max_pct': 0.1219863997309893, 'tp_mult': 2.305441856197108, 'tsl_mult': 0.4380312334099203, 'strategy': 'mean_reversion', 'time_stop': 99, 'use_sma': False, 'use_atr': True, 'use_adx': True, 'use_ema': True, 'use_spike': False, 'rsi_required': True, 'edge_k': 1.6720716300197702, 'edge_cap': 0.620214893920977, 'bull_strategy': 'mean_reversion', 'bull_bb_std_mult': 1.8731539427024817, 'bull_rsi_os': 36, 'bull_rsi_ob': 51, 'bull_adx_thresh': 7.348985678012539, 'bull_atr_min_pct': 0.02091855776030919, 'bull_atr_max_pct': 0.1399790283332404, 'bull_tp_mult': 2.3304983576369045, 'bull_tsl_mult': 0.3117453011931207, 'bull_time_stop': 57, 'bull_use_sma': False, 'bull_use_ema': True, 'bull_use_atr': True, 'bull_use_adx': True, 'bull_use_spike': False, 'bull_rsi_required': False, 'bear_strategy': 'breakout', 'bear_bb_std_mult': 3.442326658586426, 'bear_rsi_os': 49, 'bear_rsi_ob': 76, 'bear_adx_thresh': 17.896231861234494, 'bear_atr_min_pct': 0.001054517242563769, 'bear_atr_max_pct': 0.0839141034228171, 'bear_tp_mult': 2.1286457968197845, 'bear_tsl_mult': 0.6169854479236463, 'bear_time_stop': 80, 'bear_use_sma': True, 'bear_use_ema': False, 'bear_use_atr': False, 'bear_use_adx': False, 'bear_use_spike': False, 'bear_rsi_required': False, 'sideways_strategy': 'breakout', 'sideways_bb_std_mult': 2.472262272125092, 'sideways_rsi_os': 29, 'sideways_rsi_ob': 74, 'sideways_adx_thresh': 34.99367539155392, 'sideways_atr_min_pct': 0.0016875461897283978, 'sideways_atr_max_pct': 0.062858999839662, 'sideways_tp_mult': 1.2543432334080302, 'sideways_tsl_mult': 0.48293488285814723, 'sideways_time_stop': 128, 'sideways_use_sma': True, 'sideways_use_ema': True, 'sideways_use_atr': False, 'sideways_use_adx': False, 'sideways_use_spike': False, 'sideways_rsi_required': True}.
[I 2025-08-30 16:28:40,061] Trial 420 finished with values: [-1000000000.0, 1000000000.0] and parameters: {'p_sma': 6, 'p_std': 60, 'p_atr': 17, 'p_adx': 22, 'rsi_period': 63, 'ema1': 25, 'ema2': 55, 'slip_atr_k': 0.012502979168699298, 'slip_spread_k': 0.6292254725262342, 'spread_hl_frac': 0.041047995046755756, 'bb_std_mult': 1.754395482162006, 'rsi_os': 35, 'rsi_ob': 90, 'vol_spike': 0.024624998413517084, 'adx_thresh': 6.319555578996617, 'atr_min_pct': 0.01979395502479575, 'atr_max_pct': 0.0931577873990667, 'tp_mult': 2.5519629410821647, 'tsl_mult': 0.07526432598250565, 'strategy': 'mean_reversion', 'time_stop': 71, 'use_sma': True, 'use_atr': True, 'use_adx': True, 'use_ema': False, 'use_spike': False, 'rsi_required': True, 'edge_k': 1.7510277562939436, 'edge_cap': 0.21798531809620886, 'bull_strategy': 'mean_reversion', 'bull_bb_std_mult': 3.2282309102448643, 'bull_rsi_os': 13, 'bull_rsi_ob': 49, 'bull_adx_thresh': 21.540312340169457, 'bull_atr_min_pct': 0.024300217853467247, 'bull_atr_max_pct': 0.13228284089370293, 'bull_tp_mult': 1.2657506290669895, 'bull_tsl_mult': 0.7312950982606164, 'bull_time_stop': 66, 'bull_use_sma': False, 'bull_use_ema': True, 'bull_use_atr': True, 'bull_use_adx': True, 'bull_use_spike': False, 'bull_rsi_required': False, 'bear_strategy': 'mean_reversion', 'bear_bb_std_mult': 2.1845912583688203, 'bear_rsi_os': 12, 'bear_rsi_ob': 65, 'bear_adx_thresh': 13.526145733052562, 'bear_atr_min_pct': 0.021374798339561418, 'bear_atr_max_pct': 0.08828557472210137, 'bear_tp_mult': 2.825167700938208, 'bear_tsl_mult': 0.4396102627533675, 'bear_time_stop': 5, 'bear_use_sma': True, 'bear_use_ema': False, 'bear_use_atr': False, 'bear_use_adx': True, 'bear_use_spike': False, 'bear_rsi_required': True, 'sideways_strategy': 'breakout', 'sideways_bb_std_mult': 2.2425012172856653, 'sideways_rsi_os': 25, 'sideways_rsi_ob': 91, 'sideways_adx_thresh': 23.59172659888529, 'sideways_atr_min_pct': 0.007120795296308959, 'sideways_atr_max_pct': 0.1477884244892565, 'sideways_tp_mult': 1.3589834508576923, 'sideways_tsl_mult': 0.3882017169724031, 'sideways_time_stop': 210, 'sideways_use_sma': True, 'sideways_use_ema': False, 'sideways_use_atr': False, 'sideways_use_adx': False, 'sideways_use_spike': False, 'sideways_rsi_required': True}.
[I 2025-08-30 16:28:41,408] Trial 419 finished with values: [-1000000000.0, 1000000000.0] and parameters: {'p_sma': 6, 'p_std': 24, 'p_atr': 29, 'p_adx': 22, 'rsi_period': 19, 'ema1': 27, 'ema2': 25, 'slip_atr_k': 0.012345122992113109, 'slip_spread_k': 0.6316616500494823, 'spread_hl_frac': 0.019020226179707975, 'bb_std_mult': 1.205656944457512, 'rsi_os': 8, 'rsi_ob': 89, 'vol_spike': 0.211676787595591, 'adx_thresh': 10.581970201353398, 'atr_min_pct': 0.01484211509774222, 'atr_max_pct': 0.08853601739911895, 'tp_mult': 1.7789085890615541, 'tsl_mult': 0.06723990774197602, 'strategy': 'mean_reversion', 'time_stop': 10, 'use_sma': True, 'use_atr': True, 'use_adx': True, 'use_ema': False, 'use_spike': False, 'rsi_required': True, 'edge_k': 1.6759097978847883, 'edge_cap': 0.658331930137257, 'bull_strategy': 'mean_reversion', 'bull_bb_std_mult': 1.8094100313738746, 'bull_rsi_os': 12, 'bull_rsi_ob': 49, 'bull_adx_thresh': 21.63071579783022, 'bull_atr_min_pct': 0.02439012996322388, 'bull_atr_max_pct': 0.08645815236501123, 'bull_tp_mult': 1.2671231664884797, 'bull_tsl_mult': 0.33281914027408344, 'bull_time_stop': 63, 'bull_use_sma': False, 'bull_use_ema': True, 'bull_use_atr': True, 'bull_use_adx': True, 'bull_use_spike': False, 'bull_rsi_required': False, 'bear_strategy': 'mean_reversion', 'bear_bb_std_mult': 0.6382953949610075, 'bear_rsi_os': 39, 'bear_rsi_ob': 51, 'bear_adx_thresh': 13.950836275327585, 'bear_atr_min_pct': 0.011913910170602861, 'bear_atr_max_pct': 0.04503730010541733, 'bear_tp_mult': 1.5343508354903457, 'bear_tsl_mult': 0.63230296201227, 'bear_time_stop': 221, 'bear_use_sma': True, 'bear_use_ema': False, 'bear_use_atr': False, 'bear_use_adx': True, 'bear_use_spike': False, 'bear_rsi_required': True, 'sideways_strategy': 'breakout', 'sideways_bb_std_mult': 1.1106083007363157, 'sideways_rsi_os': 28, 'sideways_rsi_ob': 57, 'sideways_adx_thresh': 16.610882579577797, 'sideways_atr_min_pct': 0.006855286428632064, 'sideways_atr_max_pct': 0.06184230528296402, 'sideways_tp_mult': 1.2527756540926536, 'sideways_tsl_mult': 0.38760482847650846, 'sideways_time_stop': 89, 'sideways_use_sma': True, 'sideways_use_ema': False, 'sideways_use_atr': False, 'sideways_use_adx': False, 'sideways_use_spike': False, 'sideways_rsi_required': True}.
[I 2025-08-30 16:28:42,428] Trial 421 finished with values: [-1000000000.0, 1000000000.0] and parameters: {'p_sma': 60, 'p_std': 9, 'p_atr': 17, 'p_adx': 22, 'rsi_period': 57, 'ema1': 25, 'ema2': 25, 'slip_atr_k': 0.15753307998113908, 'slip_spread_k': 0.6366094245687473, 'spread_hl_frac': 0.019330655940405162, 'bb_std_mult': 3.0445515854205687, 'rsi_os': 7, 'rsi_ob': 90, 'vol_spike': 0.019843434042746223, 'adx_thresh': 14.735292443947296, 'atr_min_pct': 0.0029047856315624326, 'atr_max_pct': 0.14237104551195995, 'tp_mult': 2.8461190175880886, 'tsl_mult': 0.4710240925328281, 'strategy': 'mean_reversion', 'time_stop': 34, 'use_sma': True, 'use_atr': True, 'use_adx': True, 'use_ema': False, 'use_spike': False, 'rsi_required': True, 'edge_k': 0.6197650601071703, 'edge_cap': 0.18492506501748618, 'bull_strategy': 'mean_reversion', 'bull_bb_std_mult': 1.8164402644037245, 'bull_rsi_os': 15, 'bull_rsi_ob': 49, 'bull_adx_thresh': 21.58460296070285, 'bull_atr_min_pct': 0.019671773449410384, 'bull_atr_max_pct': 0.13437616802967994, 'bull_tp_mult': 1.4902623856272401, 'bull_tsl_mult': 0.6709887231745475, 'bull_time_stop': 64, 'bull_use_sma': False, 'bull_use_ema': True, 'bull_use_atr': True, 'bull_use_adx': True, 'bull_use_spike': False, 'bull_rsi_required': False, 'bear_strategy': 'mean_reversion', 'bear_bb_std_mult': 1.0044741873877987, 'bear_rsi_os': 39, 'bear_rsi_ob': 79, 'bear_adx_thresh': 13.342378738798532, 'bear_atr_min_pct': 0.021413737893142326, 'bear_atr_max_pct': 0.06362355878828066, 'bear_tp_mult': 2.0663165505582657, 'bear_tsl_mult': 0.6370723952566081, 'bear_time_stop': 223, 'bear_use_sma': True, 'bear_use_ema': False, 'bear_use_atr': False, 'bear_use_adx': True, 'bear_use_spike': False, 'bear_rsi_required': True, 'sideways_strategy': 'breakout', 'sideways_bb_std_mult': 2.0107577708264825, 'sideways_rsi_os': 13, 'sideways_rsi_ob': 91, 'sideways_adx_thresh': 21.44264883581658, 'sideways_atr_min_pct': 0.013283928084357844, 'sideways_atr_max_pct': 0.14764942482043222, 'sideways_tp_mult': 1.3583957603441128, 'sideways_tsl_mult': 0.4307721081234597, 'sideways_time_stop': 210, 'sideways_use_sma': True, 'sideways_use_ema': False, 'sideways_use_atr': False, 'sideways_use_adx': False, 'sideways_use_spike': False, 'sideways_rsi_required': True}.
[I 2025-08-30 16:28:43,573] Trial 418 finished with values: [-0.13921973670060683, 0.1391973465096895] and parameters: {'p_sma': 42, 'p_std': 9, 'p_atr': 29, 'p_adx': 22, 'rsi_period': 19, 'ema1': 25, 'ema2': 15, 'slip_atr_k': 0.013060022148095323, 'slip_spread_k': 0.16414823521896393, 'spread_hl_frac': 0.0189596551035312, 'bb_std_mult': 3.053132888764792, 'rsi_os': 29, 'rsi_ob': 90, 'vol_spike': 0.0051841522752773175, 'adx_thresh': 23.981940756668582, 'atr_min_pct': 0.01986591631939936, 'atr_max_pct': 0.13946197158255047, 'tp_mult': 1.7666717797102824, 'tsl_mult': 0.07155805988180752, 'strategy': 'mean_reversion', 'time_stop': 73, 'use_sma': True, 'use_atr': True, 'use_adx': True, 'use_ema': False, 'use_spike': False, 'rsi_required': True, 'edge_k': 1.727939290162471, 'edge_cap': 0.6586875516901217, 'bull_strategy': 'mean_reversion', 'bull_bb_std_mult': 2.936144658355089, 'bull_rsi_os': 12, 'bull_rsi_ob': 48, 'bull_adx_thresh': 7.858251996002126, 'bull_atr_min_pct': 0.020702852670868813, 'bull_atr_max_pct': 0.13233455578096182, 'bull_tp_mult': 2.9512717303063813, 'bull_tsl_mult': 0.3305680782591002, 'bull_time_stop': 65, 'bull_use_sma': False, 'bull_use_ema': True, 'bull_use_atr': True, 'bull_use_adx': True, 'bull_use_spike': False, 'bull_rsi_required': False, 'bear_strategy': 'mean_reversion', 'bear_bb_std_mult': 3.4256700879983843, 'bear_rsi_os': 52, 'bear_rsi_ob': 51, 'bear_adx_thresh': 26.945361422678765, 'bear_atr_min_pct': 0.0011650580373696318, 'bear_atr_max_pct': 0.08815273959453986, 'bear_tp_mult': 2.6632671217998367, 'bear_tsl_mult': 0.6531857767313826, 'bear_time_stop': 218, 'bear_use_sma': True, 'bear_use_ema': False, 'bear_use_atr': False, 'bear_use_adx': True, 'bear_use_spike': False, 'bear_rsi_required': True, 'sideways_strategy': 'breakout', 'sideways_bb_std_mult': 2.5506404666664695, 'sideways_rsi_os': 29, 'sideways_rsi_ob': 57, 'sideways_adx_thresh': 16.829023787391563, 'sideways_atr_min_pct': 0.0005202771908530154, 'sideways_atr_max_pct': 0.14769918727248832, 'sideways_tp_mult': 1.2603896638912264, 'sideways_tsl_mult': 0.48313408394160917, 'sideways_time_stop': 209, 'sideways_use_sma': True, 'sideways_use_ema': False, 'sideways_use_atr': False, 'sideways_use_adx': False, 'sideways_use_spike': False, 'sideways_rsi_required': True}.
[I 2025-08-30 16:29:31,439] Trial 423 finished with values: [-1000000000.0, 1000000000.0] and parameters: {'p_sma': 5, 'p_std': 59, 'p_atr': 15, 'p_adx': 27, 'rsi_period': 20, 'ema1': 26, 'ema2': 10, 'slip_atr_k': 0.004476005248493415, 'slip_spread_k': 0.8818463330922799, 'spread_hl_frac': 0.021313891091999434, 'bb_std_mult': 3.045909007976177, 'rsi_os': 29, 'rsi_ob': 90, 'vol_spike': 0.24942706243174095, 'adx_thresh': 34.11372406275402, 'atr_min_pct': 0.02753312561204003, 'atr_max_pct': 0.13809354460634804, 'tp_mult': 2.1790750808826425, 'tsl_mult': 0.48581283174719786, 'strategy': 'mean_reversion', 'time_stop': 5, 'use_sma': False, 'use_atr': True, 'use_adx': True, 'use_ema': False, 'use_spike': False, 'rsi_required': True, 'edge_k': 0.09763041316984555, 'edge_cap': 0.661844580410055, 'bull_strategy': 'mean_reversion', 'bull_bb_std_mult': 1.9991593177571423, 'bull_rsi_os': 30, 'bull_rsi_ob': 52, 'bull_adx_thresh': 20.170837449029538, 'bull_atr_min_pct': 0.019270062890359794, 'bull_atr_max_pct': 0.1333162183791132, 'bull_tp_mult': 1.2293365314995763, 'bull_tsl_mult': 0.28266596686277945, 'bull_time_stop': 64, 'bull_use_sma': False, 'bull_use_ema': True, 'bull_use_atr': True, 'bull_use_adx': True, 'bull_use_spike': False, 'bull_rsi_required': False, 'bear_strategy': 'mean_reversion', 'bear_bb_std_mult': 0.9625170812365194, 'bear_rsi_os': 13, 'bear_rsi_ob': 79, 'bear_adx_thresh': 11.542532176255428, 'bear_atr_min_pct': 0.0058010410039919524, 'bear_atr_max_pct': 0.09313424490816095, 'bear_tp_mult': 2.212569076882141, 'bear_tsl_mult': 0.3399681660157408, 'bear_time_stop': 177, 'bear_use_sma': True, 'bear_use_ema': False, 'bear_use_atr': False, 'bear_use_adx': False, 'bear_use_spike': False, 'bear_rsi_required': False, 'sideways_strategy': 'breakout', 'sideways_bb_std_mult': 0.6290555954243604, 'sideways_rsi_os': 13, 'sideways_rsi_ob': 93, 'sideways_adx_thresh': 18.58838747184052, 'sideways_atr_min_pct': 0.021629376632146244, 'sideways_atr_max_pct': 0.14051917996621993, 'sideways_tp_mult': 1.4067451680157164, 'sideways_tsl_mult': 0.517654683999828, 'sideways_time_stop': 210, 'sideways_use_sma': True, 'sideways_use_ema': False, 'sideways_use_atr': False, 'sideways_use_adx': False, 'sideways_use_spike': False, 'sideways_rsi_required': True}.
