[I 2025-08-30 16:57:29,099] Trial 584 finished with values: [-1000000000.0, 1000000000.0] and parameters: {'p_sma': 8, 'p_std': 19, 'p_atr': 15, 'p_adx': 8, 'rsi_period': 25, 'ema1': 18, 'ema2': 10, 'slip_atr_k': 0.025690680490040807, 'slip_spread_k': 0.17589283565251856, 'spread_hl_frac': 0.022236268148189714, 'bb_std_mult': 3.233271619038529, 'rsi_os': 32, 'rsi_ob': 86, 'vol_spike': 0.11707500084875647, 'adx_thresh': 10.19612902035258, 'atr_min_pct': 0.01982177691252334, 'atr_max_pct': 0.14991435281156418, 'tp_mult': 2.7436554023391673, 'tsl_mult': 0.9808581951600497, 'strategy': 'mean_reversion', 'time_stop': 34, 'use_sma': True, 'use_atr': True, 'use_adx': True, 'use_ema': True, 'use_spike': False, 'rsi_required': True, 'edge_k': 0.8064435239626881, 'edge_cap': 0.9369387687172229, 'bull_strategy': 'mean_reversion', 'bull_bb_std_mult': 1.975866910896466, 'bull_rsi_os': 16, 'bull_rsi_ob': 58, 'bull_adx_thresh': 34.91876026656199, 'bull_atr_min_pct': 0.022322506982688516, 'bull_atr_max_pct': 0.1439226780222546, 'bull_tp_mult': 2.2342105376588246, 'bull_tsl_mult': 0.8089504457952417, 'bull_time_stop': 91, 'bull_use_sma': True, 'bull_use_ema': True, 'bull_use_atr': False, 'bull_use_adx': True, 'bull_use_spike': False, 'bull_rsi_required': False, 'bear_strategy': 'breakout', 'bear_bb_std_mult': 1.4935488183369148, 'bear_rsi_os': 16, 'bear_rsi_ob': 72, 'bear_adx_thresh': 11.60794554849683, 'bear_atr_min_pct': 0.017214235155778558, 'bear_atr_max_pct': 0.10528741490896919, 'bear_tp_mult': 2.1393050449877826, 'bear_tsl_mult': 0.6274603665516336, 'bear_time_stop': 205, 'bear_use_sma': True, 'bear_use_ema': False, 'bear_use_atr': True, 'bear_use_adx': False, 'bear_use_spike': False, 'bear_rsi_required': False, 'sideways_strategy': 'breakout', 'sideways_bb_std_mult': 0.886333151400482, 'sideways_rsi_os': 32, 'sideways_rsi_ob': 92, 'sideways_adx_thresh': 12.235079267808045, 'sideways_atr_min_pct': 0.002552648306635333, 'sideways_atr_max_pct': 0.09778067980445172, 'sideways_tp_mult': 2.89781992022696, 'sideways_tsl_mult': 0.4367265218018983, 'sideways_time_stop': 285, 'sideways_use_sma': True, 'sideways_use_ema': True, 'sideways_use_atr': False, 'sideways_use_adx': False, 'sideways_use_spike': False, 'sideways_rsi_required': True}.
[I 2025-08-30 16:57:29,914] Trial 583 finished with values: [-1000000000.0, 1000000000.0] and parameters: {'p_sma': 8, 'p_std': 19, 'p_atr': 15, 'p_adx': 8, 'rsi_period': 25, 'ema1': 18, 'ema2': 10, 'slip_atr_k': 0.025763092160222267, 'slip_spread_k': 0.18241965151330758, 'spread_hl_frac': 0.022449217310824124, 'bb_std_mult': 3.23338878215015, 'rsi_os': 32, 'rsi_ob': 86, 'vol_spike': 0.11976768371272223, 'adx_thresh': 10.13000744003516, 'atr_min_pct': 0.019914766628054227, 'atr_max_pct': 0.1474911227164474, 'tp_mult': 2.754927035917918, 'tsl_mult': 0.876083681232686, 'strategy': 'mean_reversion', 'time_stop': 32, 'use_sma': True, 'use_atr': True, 'use_adx': True, 'use_ema': True, 'use_spike': False, 'rsi_required': True, 'edge_k': 0.6052106921262697, 'edge_cap': 0.9379271069877482, 'bull_strategy': 'mean_reversion', 'bull_bb_std_mult': 1.9685148523360458, 'bull_rsi_os': 16, 'bull_rsi_ob': 57, 'bull_adx_thresh': 34.95535729276065, 'bull_atr_min_pct': 0.022556669051274493, 'bull_atr_max_pct': 0.14357515897024278, 'bull_tp_mult': 2.3125485874743013, 'bull_tsl_mult': 0.8137204509128908, 'bull_time_stop': 93, 'bull_use_sma': True, 'bull_use_ema': True, 'bull_use_atr': False, 'bull_use_adx': True, 'bull_use_spike': False, 'bull_rsi_required': False, 'bear_strategy': 'breakout', 'bear_bb_std_mult': 1.1010817972477724, 'bear_rsi_os': 16, 'bear_rsi_ob': 71, 'bear_adx_thresh': 11.494177045387236, 'bear_atr_min_pct': 0.017568735019391938, 'bear_atr_max_pct': 0.10467205564531928, 'bear_tp_mult': 2.1510661166272924, 'bear_tsl_mult': 0.6015859905317346, 'bear_time_stop': 207, 'bear_use_sma': True, 'bear_use_ema': False, 'bear_use_atr': True, 'bear_use_adx': False, 'bear_use_spike': False, 'bear_rsi_required': False, 'sideways_strategy': 'breakout', 'sideways_bb_std_mult': 0.5827696983467371, 'sideways_rsi_os': 32, 'sideways_rsi_ob': 85, 'sideways_adx_thresh': 12.071375183621305, 'sideways_atr_min_pct': 0.0036492515403821904, 'sideways_atr_max_pct': 0.09362724329315049, 'sideways_tp_mult': 2.999782079724305, 'sideways_tsl_mult': 0.39053854961718815, 'sideways_time_stop': 286, 'sideways_use_sma': True, 'sideways_use_ema': True, 'sideways_use_atr': False, 'sideways_use_adx': False, 'sideways_use_spike': False, 'sideways_rsi_required': True}.
[I 2025-08-30 16:58:10,249] Trial 588 finished with values: [-1000000000.0, 1000000000.0] and parameters: {'p_sma': 8, 'p_std': 19, 'p_atr': 18, 'p_adx': 8, 'rsi_period': 25, 'ema1': 18, 'ema2': 22, 'slip_atr_k': 0.022461950410475426, 'slip_spread_k': 0.1909607807568635, 'spread_hl_frac': 0.019402796125038996, 'bb_std_mult': 3.407116132741198, 'rsi_os': 32, 'rsi_ob': 85, 'vol_spike': 0.06322663672946001, 'adx_thresh': 7.085668826376958, 'atr_min_pct': 0.02030250487021969, 'atr_max_pct': 0.14550000626937903, 'tp_mult': 2.8185003360277205, 'tsl_mult': 0.8549416979012228, 'strategy': 'mean_reversion', 'time_stop': 33, 'use_sma': False, 'use_atr': True, 'use_adx': True, 'use_ema': False, 'use_spike': False, 'rsi_required': True, 'edge_k': 0.473248214142578, 'edge_cap': 0.9611369055913576, 'bull_strategy': 'mean_reversion', 'bull_bb_std_mult': 2.942732851855952, 'bull_rsi_os': 6, 'bull_rsi_ob': 58, 'bull_adx_thresh': 33.1689464586676, 'bull_atr_min_pct': 0.02238653740118925, 'bull_atr_max_pct': 0.1435101761407256, 'bull_tp_mult': 2.2613563962078183, 'bull_tsl_mult': 0.7774271585705281, 'bull_time_stop': 265, 'bull_use_sma': True, 'bull_use_ema': True, 'bull_use_atr': False, 'bull_use_adx': True, 'bull_use_spike': False, 'bull_rsi_required': False, 'bear_strategy': 'mean_reversion', 'bear_bb_std_mult': 1.517580439790302, 'bear_rsi_os': 16, 'bear_rsi_ob': 75, 'bear_adx_thresh': 11.962967598374794, 'bear_atr_min_pct': 0.01704450298903744, 'bear_atr_max_pct': 0.10926872009246677, 'bear_tp_mult': 2.1853843131169537, 'bear_tsl_mult': 0.6287459957738143, 'bear_time_stop': 207, 'bear_use_sma': True, 'bear_use_ema': False, 'bear_use_atr': False, 'bear_use_adx': False, 'bear_use_spike': False, 'bear_rsi_required': False, 'sideways_strategy': 'breakout', 'sideways_bb_std_mult': 1.2688251616137478, 'sideways_rsi_os': 31, 'sideways_rsi_ob': 68, 'sideways_adx_thresh': 11.619704773800867, 'sideways_atr_min_pct': 0.003637906699279942, 'sideways_atr_max_pct': 0.10537294950322638, 'sideways_tp_mult': 2.9248377349085266, 'sideways_tsl_mult': 0.40022376252869746, 'sideways_time_stop': 282, 'sideways_use_sma': True, 'sideways_use_ema': False, 'sideways_use_atr': False, 'sideways_use_adx': False, 'sideways_use_spike': False, 'sideways_rsi_required': True}.
[I 2025-08-30 16:58:11,200] Trial 587 finished with values: [-1000000000.0, 1000000000.0] and parameters: {'p_sma': 8, 'p_std': 19, 'p_atr': 18, 'p_adx': 11, 'rsi_period': 25, 'ema1': 18, 'ema2': 30, 'slip_atr_k': 0.056099862323278446, 'slip_spread_k': 0.19869723368233566, 'spread_hl_frac': 0.01909737469821987, 'bb_std_mult': 3.21470512778186, 'rsi_os': 32, 'rsi_ob': 86, 'vol_spike': 0.06627344952128095, 'adx_thresh': 6.9072269529195855, 'atr_min_pct': 0.02016929866696312, 'atr_max_pct': 0.14702493337400369, 'tp_mult': 2.8460636224252425, 'tsl_mult': 0.8101677947306996, 'strategy': 'mean_reversion', 'time_stop': 33, 'use_sma': False, 'use_atr': True, 'use_adx': True, 'use_ema': False, 'use_spike': False, 'rsi_required': True, 'edge_k': 0.4756426338235034, 'edge_cap': 0.9662423352536583, 'bull_strategy': 'mean_reversion', 'bull_bb_std_mult': 2.629136077212095, 'bull_rsi_os': 15, 'bull_rsi_ob': 58, 'bull_adx_thresh': 33.31808201160977, 'bull_atr_min_pct': 0.022367391195211226, 'bull_atr_max_pct': 0.14332077008812183, 'bull_tp_mult': 2.2702860424887366, 'bull_tsl_mult': 0.8054587682353118, 'bull_time_stop': 268, 'bull_use_sma': True, 'bull_use_ema': True, 'bull_use_atr': False, 'bull_use_adx': True, 'bull_use_spike': False, 'bull_rsi_required': False, 'bear_strategy': 'mean_reversion', 'bear_bb_std_mult': 1.4987841516636697, 'bear_rsi_os': 16, 'bear_rsi_ob': 75, 'bear_adx_thresh': 11.780338298544455, 'bear_atr_min_pct': 0.01955544511289002, 'bear_atr_max_pct': 0.10888004981507307, 'bear_tp_mult': 2.166262189190503, 'bear_tsl_mult': 0.6009244208642257, 'bear_time_stop': 207, 'bear_use_sma': True, 'bear_use_ema': False, 'bear_use_atr': False, 'bear_use_adx': False, 'bear_use_spike': False, 'bear_rsi_required': False, 'sideways_strategy': 'breakout', 'sideways_bb_std_mult': 1.0341041969849698, 'sideways_rsi_os': 31, 'sideways_rsi_ob': 68, 'sideways_adx_thresh': 12.106894516919427, 'sideways_atr_min_pct': 0.0020251127677499365, 'sideways_atr_max_pct': 0.09378362243335359, 'sideways_tp_mult': 2.9346961728132794, 'sideways_tsl_mult': 0.3901389368058105, 'sideways_time_stop': 269, 'sideways_use_sma': True, 'sideways_use_ema': False, 'sideways_use_atr': False, 'sideways_use_adx': False, 'sideways_use_spike': False, 'sideways_rsi_required': True}.
[I 2025-08-30 16:58:11,223] Trial 590 finished with values: [-1000000000.0, 1000000000.0] and parameters: {'p_sma': 6, 'p_std': 21, 'p_atr': 17, 'p_adx': 11, 'rsi_period': 25, 'ema1': 18, 'ema2': 22, 'slip_atr_k': 0.011597969561290083, 'slip_spread_k': 0.09963425655533863, 'spread_hl_frac': 0.01921640719518244, 'bb_std_mult': 3.396861641704799, 'rsi_os': 32, 'rsi_ob': 85, 'vol_spike': 0.051788002838238506, 'adx_thresh': 6.583275977138401, 'atr_min_pct': 0.008537029220856081, 'atr_max_pct': 0.14571854862238792, 'tp_mult': 2.8176319792750295, 'tsl_mult': 0.8576244425891825, 'strategy': 'mean_reversion', 'time_stop': 32, 'use_sma': False, 'use_atr': True, 'use_adx': True, 'use_ema': False, 'use_spike': True, 'rsi_required': True, 'edge_k': 0.4204323519907729, 'edge_cap': 0.8167719627376704, 'bull_strategy': 'mean_reversion', 'bull_bb_std_mult': 2.916967765699346, 'bull_rsi_os': 15, 'bull_rsi_ob': 59, 'bull_adx_thresh': 33.60844661224677, 'bull_atr_min_pct': 0.022280672320055532, 'bull_atr_max_pct': 0.1427321131308381, 'bull_tp_mult': 2.264131149584465, 'bull_tsl_mult': 0.7730727710933104, 'bull_time_stop': 71, 'bull_use_sma': True, 'bull_use_ema': True, 'bull_use_atr': False, 'bull_use_adx': True, 'bull_use_spike': False, 'bull_rsi_required': False, 'bear_strategy': 'mean_reversion', 'bear_bb_std_mult': 1.0144648630176125, 'bear_rsi_os': 18, 'bear_rsi_ob': 75, 'bear_adx_thresh': 11.973408912991712, 'bear_atr_min_pct': 0.0248453158751503, 'bear_atr_max_pct': 0.10935948733637697, 'bear_tp_mult': 2.163683812441106, 'bear_tsl_mult': 0.6290562211264159, 'bear_time_stop': 202, 'bear_use_sma': True, 'bear_use_ema': False, 'bear_use_atr': False, 'bear_use_adx': False, 'bear_use_spike': False, 'bear_rsi_required': False, 'sideways_strategy': 'breakout', 'sideways_bb_std_mult': 1.2523609465201562, 'sideways_rsi_os': 31, 'sideways_rsi_ob': 90, 'sideways_adx_thresh': 11.343915844039081, 'sideways_atr_min_pct': 0.0021302174368322564, 'sideways_atr_max_pct': 0.1011708941750538, 'sideways_tp_mult': 2.925005993047971, 'sideways_tsl_mult': 0.4032498245399791, 'sideways_time_stop': 266, 'sideways_use_sma': True, 'sideways_use_ema': False, 'sideways_use_atr': False, 'sideways_use_adx': False, 'sideways_use_spike': False, 'sideways_rsi_required': True}.
[I 2025-08-30 16:58:12,524] Trial 589 finished with values: [-1000000000.0, 1000000000.0] and parameters: {'p_sma': 7, 'p_std': 21, 'p_atr': 17, 'p_adx': 11, 'rsi_period': 23, 'ema1': 18, 'ema2': 47, 'slip_atr_k': 0.059251241069244884, 'slip_spread_k': 0.20382639227886565, 'spread_hl_frac': 0.01906913832646385, 'bb_std_mult': 3.19335165164077, 'rsi_os': 30, 'rsi_ob': 85, 'vol_spike': 0.0626350255932334, 'adx_thresh': 9.889496968515626, 'atr_min_pct': 0.014034309995923012, 'atr_max_pct': 0.14581909389318234, 'tp_mult': 2.8506875346254277, 'tsl_mult': 0.9471709728277484, 'strategy': 'mean_reversion', 'time_stop': 32, 'use_sma': False, 'use_atr': True, 'use_adx': True, 'use_ema': False, 'use_spike': True, 'rsi_required': True, 'edge_k': 0.4289457154248514, 'edge_cap': 0.8589829332515236, 'bull_strategy': 'mean_reversion', 'bull_bb_std_mult': 2.635390198612556, 'bull_rsi_os': 6, 'bull_rsi_ob': 55, 'bull_adx_thresh': 33.385528435839106, 'bull_atr_min_pct': 0.02226342543193367, 'bull_atr_max_pct': 0.14336495655672368, 'bull_tp_mult': 2.259702312702136, 'bull_tsl_mult': 0.7766377971682544, 'bull_time_stop': 267, 'bull_use_sma': True, 'bull_use_ema': True, 'bull_use_atr': False, 'bull_use_adx': True, 'bull_use_spike': False, 'bull_rsi_required': False, 'bear_strategy': 'mean_reversion', 'bear_bb_std_mult': 1.1904908243867232, 'bear_rsi_os': 16, 'bear_rsi_ob': 75, 'bear_adx_thresh': 11.798113455096246, 'bear_atr_min_pct': 0.019416460529639412, 'bear_atr_max_pct': 0.11003832408377162, 'bear_tp_mult': 2.1642619856789462, 'bear_tsl_mult': 0.6273230519629082, 'bear_time_stop': 207, 'bear_use_sma': True, 'bear_use_ema': False, 'bear_use_atr': False, 'bear_use_adx': False, 'bear_use_spike': False, 'bear_rsi_required': False, 'sideways_strategy': 'breakout', 'sideways_bb_std_mult': 1.2639376494914445, 'sideways_rsi_os': 33, 'sideways_rsi_ob': 84, 'sideways_adx_thresh': 11.507914176900343, 'sideways_atr_min_pct': 0.003684133750505951, 'sideways_atr_max_pct': 0.09411883217302255, 'sideways_tp_mult': 2.9531564689636443, 'sideways_tsl_mult': 0.41213646913308255, 'sideways_time_stop': 267, 'sideways_use_sma': True, 'sideways_use_ema': False, 'sideways_use_atr': False, 'sideways_use_adx': False, 'sideways_use_spike': False, 'sideways_rsi_required': True}.
[I 2025-08-30 16:58:57,130] Trial 594 finished with values: [-1000000000.0, 1000000000.0] and parameters: {'p_sma': 6, 'p_std': 18, 'p_atr': 17, 'p_adx': 10, 'rsi_period': 24, 'ema1': 19, 'ema2': 12, 'slip_atr_k': 0.08626415421836639, 'slip_spread_k': 0.1347637189979909, 'spread_hl_frac': 0.04036950099044009, 'bb_std_mult': 3.1777933743380915, 'rsi_os': 30, 'rsi_ob': 85, 'vol_spike': 0.1286021982980396, 'adx_thresh': 8.637740406444525, 'atr_min_pct': 0.02726096833446106, 'atr_max_pct': 0.14645937747117246, 'tp_mult': 2.7319732525533857, 'tsl_mult': 0.8071766918071659, 'strategy': 'mean_reversion', 'time_stop': 41, 'use_sma': False, 'use_atr': True, 'use_adx': True, 'use_ema': False, 'use_spike': False, 'rsi_required': True, 'edge_k': 0.6709263130460337, 'edge_cap': 0.9219157582258399, 'bull_strategy': 'breakout', 'bull_bb_std_mult': 2.0501557891920554, 'bull_rsi_os': 6, 'bull_rsi_ob': 60, 'bull_adx_thresh': 34.21949922696776, 'bull_atr_min_pct': 0.023341322420161903, 'bull_atr_max_pct': 0.1419581293707555, 'bull_tp_mult': 2.367781283983172, 'bull_tsl_mult': 0.791337418878992, 'bull_time_stop': 66, 'bull_use_sma': True, 'bull_use_ema': False, 'bull_use_atr': False, 'bull_use_adx': True, 'bull_use_spike': True, 'bull_rsi_required': False, 'bear_strategy': 'mean_reversion', 'bear_bb_std_mult': 1.6820064292328805, 'bear_rsi_os': 16, 'bear_rsi_ob': 75, 'bear_adx_thresh': 10.170435226430728, 'bear_atr_min_pct': 0.01905809801087566, 'bear_atr_max_pct': 0.10644161231301036, 'bear_tp_mult': 2.7499958270497986, 'bear_tsl_mult': 0.8469469479962517, 'bear_time_stop': 188, 'bear_use_sma': False, 'bear_use_ema': True, 'bear_use_atr': False, 'bear_use_adx': True, 'bear_use_spike': False, 'bear_rsi_required': False, 'sideways_strategy': 'breakout', 'sideways_bb_std_mult': 1.5376500871994363, 'sideways_rsi_os': 34, 'sideways_rsi_ob': 61, 'sideways_adx_thresh': 11.013680579556741, 'sideways_atr_min_pct': 0.012054877472027908, 'sideways_atr_max_pct': 0.10373786002357131, 'sideways_tp_mult': 2.9636264174900075, 'sideways_tsl_mult': 0.4358193849802435, 'sideways_time_stop': 276, 'sideways_use_sma': False, 'sideways_use_ema': False, 'sideways_use_atr': True, 'sideways_use_adx': True, 'sideways_use_spike': False, 'sideways_rsi_required': False}.
[I 2025-08-30 16:58:57,135] Trial 592 finished with values: [-1000000000.0, 1000000000.0] and parameters: {'p_sma': 7, 'p_std': 21, 'p_atr': 17, 'p_adx': 10, 'rsi_period': 24, 'ema1': 17, 'ema2': 36, 'slip_atr_k': 0.017981103290831732, 'slip_spread_k': 0.1421399154260311, 'spread_hl_frac': 0.03092736206963182, 'bb_std_mult': 3.310549619425981, 'rsi_os': 30, 'rsi_ob': 85, 'vol_spike': 0.09259599969302305, 'adx_thresh': 8.937433214014584, 'atr_min_pct': 0.014041194577828422, 'atr_max_pct': 0.14591438045578162, 'tp_mult': 2.7201783182937302, 'tsl_mult': 0.9623060843845713, 'strategy': 'mean_reversion', 'time_stop': 38, 'use_sma': False, 'use_atr': True, 'use_adx': True, 'use_ema': False, 'use_spike': True, 'rsi_required': True, 'edge_k': 0.5447645840956605, 'edge_cap': 0.8654548574653064, 'bull_strategy': 'mean_reversion', 'bull_bb_std_mult': 0.6605193169418693, 'bull_rsi_os': 7, 'bull_rsi_ob': 55, 'bull_adx_thresh': 34.07379732328768, 'bull_atr_min_pct': 0.02353117815983817, 'bull_atr_max_pct': 0.14995786698644686, 'bull_tp_mult': 2.34112750484083, 'bull_tsl_mult': 0.7847091390371176, 'bull_time_stop': 67, 'bull_use_sma': True, 'bull_use_ema': False, 'bull_use_atr': False, 'bull_use_adx': True, 'bull_use_spike': True, 'bull_rsi_required': False, 'bear_strategy': 'mean_reversion', 'bear_bb_std_mult': 0.9461701739285322, 'bear_rsi_os': 18, 'bear_rsi_ob': 74, 'bear_adx_thresh': 10.505930353312356, 'bear_atr_min_pct': 0.01925887451858988, 'bear_atr_max_pct': 0.10773722099988238, 'bear_tp_mult': 2.069667753604025, 'bear_tsl_mult': 0.8538815644633981, 'bear_time_stop': 198, 'bear_use_sma': True, 'bear_use_ema': False, 'bear_use_atr': False, 'bear_use_adx': True, 'bear_use_spike': False, 'bear_rsi_required': False, 'sideways_strategy': 'breakout', 'sideways_bb_std_mult': 1.4174203991676457, 'sideways_rsi_os': 33, 'sideways_rsi_ob': 93, 'sideways_adx_thresh': 9.694796840998654, 'sideways_atr_min_pct': 0.016169061345810545, 'sideways_atr_max_pct': 0.1031835786749, 'sideways_tp_mult': 2.960916306187629, 'sideways_tsl_mult': 0.4356565018716887, 'sideways_time_stop': 292, 'sideways_use_sma': False, 'sideways_use_ema': False, 'sideways_use_atr': True, 'sideways_use_adx': False, 'sideways_use_spike': False, 'sideways_rsi_required': False}.
[I 2025-08-30 16:58:58,046] Trial 591 finished with values: [-1000000000.0, 1000000000.0] and parameters: {'p_sma': 50, 'p_std': 21, 'p_atr': 17, 'p_adx': 10, 'rsi_period': 23, 'ema1': 17, 'ema2': 42, 'slip_atr_k': 0.011277875436213947, 'slip_spread_k': 0.0951605963202921, 'spread_hl_frac': 0.023653387684196527, 'bb_std_mult': 3.1895107897536423, 'rsi_os': 29, 'rsi_ob': 85, 'vol_spike': 0.052560705280184396, 'adx_thresh': 9.105942538325447, 'atr_min_pct': 0.011703595709011791, 'atr_max_pct': 0.14624309723599, 'tp_mult': 2.8584503865659245, 'tsl_mult': 0.9474663244258108, 'strategy': 'mean_reversion', 'time_stop': 38, 'use_sma': False, 'use_atr': True, 'use_adx': True, 'use_ema': False, 'use_spike': True, 'rsi_required': True, 'edge_k': 0.40697219345431734, 'edge_cap': 0.8646316954217427, 'bull_strategy': 'mean_reversion', 'bull_bb_std_mult': 0.6786186387535178, 'bull_rsi_os': 7, 'bull_rsi_ob': 55, 'bull_adx_thresh': 33.72897544170355, 'bull_atr_min_pct': 0.023333457932151323, 'bull_atr_max_pct': 0.14251885151629415, 'bull_tp_mult': 2.269527484761902, 'bull_tsl_mult': 0.7788479753230891, 'bull_time_stop': 71, 'bull_use_sma': True, 'bull_use_ema': True, 'bull_use_atr': False, 'bull_use_adx': True, 'bull_use_spike': False, 'bull_rsi_required': False, 'bear_strategy': 'mean_reversion', 'bear_bb_std_mult': 0.9688214219460614, 'bear_rsi_os': 18, 'bear_rsi_ob': 75, 'bear_adx_thresh': 12.133014071067516, 'bear_atr_min_pct': 0.024614462572683342, 'bear_atr_max_pct': 0.10922051049673408, 'bear_tp_mult': 2.163469844277595, 'bear_tsl_mult': 0.6107629145100626, 'bear_time_stop': 194, 'bear_use_sma': True, 'bear_use_ema': False, 'bear_use_atr': False, 'bear_use_adx': False, 'bear_use_spike': False, 'bear_rsi_required': False, 'sideways_strategy': 'breakout', 'sideways_bb_std_mult': 1.604223062331711, 'sideways_rsi_os': 34, 'sideways_rsi_ob': 71, 'sideways_adx_thresh': 11.351504349906822, 'sideways_atr_min_pct': 0.01973010811455618, 'sideways_atr_max_pct': 0.10049112609723396, 'sideways_tp_mult': 2.960050220128082, 'sideways_tsl_mult': 0.41875137105794896, 'sideways_time_stop': 266, 'sideways_use_sma': True, 'sideways_use_ema': False, 'sideways_use_atr': False, 'sideways_use_adx': False, 'sideways_use_spike': False, 'sideways_rsi_required': True}.
