[I 2025-08-30 15:44:46,491] Trial 173 finished with values: [-0.010320424180872978, 0.01047660112547234] and parameters: {'p_sma': 16, 'p_std': 20, 'p_atr': 25, 'p_adx': 17, 'rsi_period': 36, 'ema1': 25, 'ema2': 34, 'slip_atr_k': 0.005680628995579237, 'slip_spread_k': 0.00230862989446029, 'spread_hl_frac': 0.0474196825599678, 'bb_std_mult': 2.9398921180147846, 'rsi_os': 38, 'rsi_ob': 63, 'vol_spike': 0.007900232732693179, 'adx_thresh': 21.01362892534438, 'atr_min_pct': 0.024550202437368655, 'atr_max_pct': 0.14355107756686303, 'tp_mult': 1.0890770978842628, 'tsl_mult': 0.44392969005543015, 'strategy': 'breakout', 'time_stop': 267, 'use_sma': False, 'use_atr': True, 'use_adx': False, 'use_ema': False, 'use_spike': True, 'rsi_required': False, 'edge_k': 0.31105578089731883, 'edge_cap': 0.6471826206917257, 'bull_strategy': 'breakout', 'bull_bb_std_mult': 1.677403447701681, 'bull_rsi_os': 23, 'bull_rsi_ob': 77, 'bull_adx_thresh': 32.06703345048108, 'bull_atr_min_pct': 0.0018102930048258588, 'bull_atr_max_pct': 0.05407986320816097, 'bull_tp_mult': 2.5589887538262968, 'bull_tsl_mult': 0.3764059751297341, 'bull_time_stop': 78, 'bull_use_sma': True, 'bull_use_ema': True, 'bull_use_atr': False, 'bull_use_adx': False, 'bull_use_spike': False, 'bull_rsi_required': True, 'bear_strategy': 'mean_reversion', 'bear_bb_std_mult': 2.2172357333896087, 'bear_rsi_os': 18, 'bear_rsi_ob': 81, 'bear_adx_thresh': 11.767089183856363, 'bear_atr_min_pct': 0.029383703379665182, 'bear_atr_max_pct': 0.08992650263660437, 'bear_tp_mult': 2.2778759002860047, 'bear_tsl_mult': 0.5592956658955657, 'bear_time_stop': 267, 'bear_use_sma': False, 'bear_use_ema': False, 'bear_use_atr': False, 'bear_use_adx': False, 'bear_use_spike': True, 'bear_rsi_required': False, 'sideways_strategy': 'breakout', 'sideways_bb_std_mult': 3.210815191314329, 'sideways_rsi_os': 29, 'sideways_rsi_ob': 90, 'sideways_adx_thresh': 15.877976989584667, 'sideways_atr_min_pct': 0.001415347074983414, 'sideways_atr_max_pct': 0.0934054904288494, 'sideways_tp_mult': 2.743211322429923, 'sideways_tsl_mult': 0.8935688917544421, 'sideways_time_stop': 231, 'sideways_use_sma': True, 'sideways_use_ema': False, 'sideways_use_atr': False, 'sideways_use_adx': True, 'sideways_use_spike': False, 'sideways_rsi_required': True}.
[I 2025-08-30 15:44:47,844] Trial 172 finished with values: [-0.04159865078996294, 0.041524256273745404] and parameters: {'p_sma': 16, 'p_std': 18, 'p_atr': 24, 'p_adx': 19, 'rsi_period': 36, 'ema1': 25, 'ema2': 35, 'slip_atr_k': 0.00820797563919522, 'slip_spread_k': 0.0809400510453257, 'spread_hl_frac': 0.048356220598467246, 'bb_std_mult': 2.6693333817033302, 'rsi_os': 40, 'rsi_ob': 79, 'vol_spike': 0.021024149739201598, 'adx_thresh': 25.481388836980827, 'atr_min_pct': 0.020322451874698583, 'atr_max_pct': 0.13730038765440294, 'tp_mult': 1.1527297831464933, 'tsl_mult': 0.5520616580190171, 'strategy': 'breakout', 'time_stop': 244, 'use_sma': False, 'use_atr': True, 'use_adx': False, 'use_ema': False, 'use_spike': True, 'rsi_required': False, 'edge_k': 0.2138508637303252, 'edge_cap': 0.6529357705199768, 'bull_strategy': 'breakout', 'bull_bb_std_mult': 1.5320305848727598, 'bull_rsi_os': 25, 'bull_rsi_ob': 78, 'bull_adx_thresh': 22.080409392250264, 'bull_atr_min_pct': 0.0018524774032143252, 'bull_atr_max_pct': 0.05359344733265123, 'bull_tp_mult': 2.492189489234163, 'bull_tsl_mult': 0.5757785479142239, 'bull_time_stop': 61, 'bull_use_sma': True, 'bull_use_ema': False, 'bull_use_atr': False, 'bull_use_adx': False, 'bull_use_spike': False, 'bull_rsi_required': True, 'bear_strategy': 'mean_reversion', 'bear_bb_std_mult': 2.397581395912414, 'bear_rsi_os': 47, 'bear_rsi_ob': 80, 'bear_adx_thresh': 11.833655753893447, 'bear_atr_min_pct': 0.025132797793919488, 'bear_atr_max_pct': 0.0794899236814554, 'bear_tp_mult': 2.255930834804579, 'bear_tsl_mult': 0.5980897702926267, 'bear_time_stop': 267, 'bear_use_sma': False, 'bear_use_ema': False, 'bear_use_atr': True, 'bear_use_adx': False, 'bear_use_spike': True, 'bear_rsi_required': False, 'sideways_strategy': 'breakout', 'sideways_bb_std_mult': 3.0756733421961933, 'sideways_rsi_os': 31, 'sideways_rsi_ob': 90, 'sideways_adx_thresh': 15.670468052404727, 'sideways_atr_min_pct': 0.0002847979790942445, 'sideways_atr_max_pct': 0.09511154633176003, 'sideways_tp_mult': 2.7950012366385595, 'sideways_tsl_mult': 0.9002570134293173, 'sideways_time_stop': 240, 'sideways_use_sma': True, 'sideways_use_ema': False, 'sideways_use_atr': False, 'sideways_use_adx': True, 'sideways_use_spike': False, 'sideways_rsi_required': True}.
[I 2025-08-30 15:44:48,376] Trial 174 finished with values: [-0.012519182098191584, 0.012647034688366776] and parameters: {'p_sma': 16, 'p_std': 19, 'p_atr': 25, 'p_adx': 17, 'rsi_period': 36, 'ema1': 25, 'ema2': 34, 'slip_atr_k': 0.021309974913065795, 'slip_spread_k': 0.0015358559386824573, 'spread_hl_frac': 0.04994421603893554, 'bb_std_mult': 2.9304258628209974, 'rsi_os': 38, 'rsi_ob': 50, 'vol_spike': 0.008945745254425541, 'adx_thresh': 24.77363187390545, 'atr_min_pct': 0.0203517953659042, 'atr_max_pct': 0.14360061131025495, 'tp_mult': 1.0979920084994177, 'tsl_mult': 0.4920709300225026, 'strategy': 'breakout', 'time_stop': 267, 'use_sma': False, 'use_atr': True, 'use_adx': False, 'use_ema': False, 'use_spike': True, 'rsi_required': False, 'edge_k': 0.3432244691111427, 'edge_cap': 0.647151133988108, 'bull_strategy': 'breakout', 'bull_bb_std_mult': 1.4161228782238648, 'bull_rsi_os': 23, 'bull_rsi_ob': 78, 'bull_adx_thresh': 22.10988199806251, 'bull_atr_min_pct': 0.0020165910433775722, 'bull_atr_max_pct': 0.05191247734729532, 'bull_tp_mult': 2.5536088974225297, 'bull_tsl_mult': 0.3052136687706134, 'bull_time_stop': 67, 'bull_use_sma': True, 'bull_use_ema': True, 'bull_use_atr': False, 'bull_use_adx': False, 'bull_use_spike': False, 'bull_rsi_required': True, 'bear_strategy': 'mean_reversion', 'bear_bb_std_mult': 2.271121004774914, 'bear_rsi_os': 47, 'bear_rsi_ob': 81, 'bear_adx_thresh': 9.585338242408357, 'bear_atr_min_pct': 0.026176252367985983, 'bear_atr_max_pct': 0.08557403868890157, 'bear_tp_mult': 2.2669018763929456, 'bear_tsl_mult': 0.5629654106026248, 'bear_time_stop': 268, 'bear_use_sma': False, 'bear_use_ema': False, 'bear_use_atr': False, 'bear_use_adx': False, 'bear_use_spike': True, 'bear_rsi_required': False, 'sideways_strategy': 'breakout', 'sideways_bb_std_mult': 3.458705444321588, 'sideways_rsi_os': 29, 'sideways_rsi_ob': 90, 'sideways_adx_thresh': 15.7425406622722, 'sideways_atr_min_pct': 0.0014136011033948368, 'sideways_atr_max_pct': 0.09314548929157192, 'sideways_tp_mult': 2.753645928491483, 'sideways_tsl_mult': 0.8442156668226922, 'sideways_time_stop': 230, 'sideways_use_sma': True, 'sideways_use_ema': False, 'sideways_use_atr': False, 'sideways_use_adx': True, 'sideways_use_spike': False, 'sideways_rsi_required': True}.
[I 2025-08-30 15:44:49,113] Trial 171 finished with values: [-0.04302191694512514, 0.04294765358398096] and parameters: {'p_sma': 16, 'p_std': 18, 'p_atr': 24, 'p_adx': 19, 'rsi_period': 36, 'ema1': 24, 'ema2': 35, 'slip_atr_k': 0.008493046651691209, 'slip_spread_k': 0.07091121580040419, 'spread_hl_frac': 0.04855284047435997, 'bb_std_mult': 2.6634341216356927, 'rsi_os': 40, 'rsi_ob': 51, 'vol_spike': 0.022112685206105903, 'adx_thresh': 22.68991149807553, 'atr_min_pct': 0.0068003309114142456, 'atr_max_pct': 0.1384316224497309, 'tp_mult': 1.1593771603888443, 'tsl_mult': 0.44692372958327387, 'strategy': 'breakout', 'time_stop': 247, 'use_sma': False, 'use_atr': True, 'use_adx': False, 'use_ema': False, 'use_spike': True, 'rsi_required': False, 'edge_k': 0.31897079488447166, 'edge_cap': 0.6513243928138374, 'bull_strategy': 'breakout', 'bull_bb_std_mult': 1.5403535402199164, 'bull_rsi_os': 23, 'bull_rsi_ob': 77, 'bull_adx_thresh': 17.521142854225406, 'bull_atr_min_pct': 0.002066702819227534, 'bull_atr_max_pct': 0.06067409121341932, 'bull_tp_mult': 2.5121963903961815, 'bull_tsl_mult': 0.37009752385352485, 'bull_time_stop': 61, 'bull_use_sma': True, 'bull_use_ema': False, 'bull_use_atr': False, 'bull_use_adx': False, 'bull_use_spike': False, 'bull_rsi_required': True, 'bear_strategy': 'mean_reversion', 'bear_bb_std_mult': 2.387744548581617, 'bear_rsi_os': 47, 'bear_rsi_ob': 80, 'bear_adx_thresh': 11.883887932918658, 'bear_atr_min_pct': 0.026229186670141964, 'bear_atr_max_pct': 0.0865508441016112, 'bear_tp_mult': 2.1961887059361165, 'bear_tsl_mult': 0.5607560926134257, 'bear_time_stop': 268, 'bear_use_sma': False, 'bear_use_ema': False, 'bear_use_atr': True, 'bear_use_adx': False, 'bear_use_spike': True, 'bear_rsi_required': False, 'sideways_strategy': 'breakout', 'sideways_bb_std_mult': 3.1052473789164314, 'sideways_rsi_os': 31, 'sideways_rsi_ob': 90, 'sideways_adx_thresh': 15.812815315514703, 'sideways_atr_min_pct': 0.00024791686909514583, 'sideways_atr_max_pct': 0.09166464030630674, 'sideways_tp_mult': 2.7399455453236077, 'sideways_tsl_mult': 0.8461417440363688, 'sideways_time_stop': 241, 'sideways_use_sma': True, 'sideways_use_ema': False, 'sideways_use_atr': False, 'sideways_use_adx': True, 'sideways_use_spike': False, 'sideways_rsi_required': True}.
[I 2025-08-30 15:45:55,457] Trial 175 finished with values: [-1000000000.0, 1000000000.0] and parameters: {'p_sma': 14, 'p_std': 20, 'p_atr': 25, 'p_adx': 17, 'rsi_period': 36, 'ema1': 25, 'ema2': 36, 'slip_atr_k': 0.0004358148184527358, 'slip_spread_k': 8.646712235095165e-05, 'spread_hl_frac': 0.04694057317344643, 'bb_std_mult': 3.072191398031593, 'rsi_os': 38, 'rsi_ob': 56, 'vol_spike': 0.007931651979040603, 'adx_thresh': 20.740406767536484, 'atr_min_pct': 0.0200866962759712, 'atr_max_pct': 0.14407990483647878, 'tp_mult': 1.0952818948850191, 'tsl_mult': 0.3737697899865303, 'strategy': 'breakout', 'time_stop': 273, 'use_sma': False, 'use_atr': True, 'use_adx': False, 'use_ema': False, 'use_spike': True, 'rsi_required': False, 'edge_k': 0.328491368954091, 'edge_cap': 0.5976164455231454, 'bull_strategy': 'breakout', 'bull_bb_std_mult': 1.7896229889904438, 'bull_rsi_os': 23, 'bull_rsi_ob': 77, 'bull_adx_thresh': 30.997445956229054, 'bull_atr_min_pct': 0.005607871129786959, 'bull_atr_max_pct': 0.051247254526756124, 'bull_tp_mult': 2.469642280429597, 'bull_tsl_mult': 0.4668290581399194, 'bull_time_stop': 94, 'bull_use_sma': True, 'bull_use_ema': True, 'bull_use_atr': False, 'bull_use_adx': False, 'bull_use_spike': False, 'bull_rsi_required': True, 'bear_strategy': 'mean_reversion', 'bear_bb_std_mult': 2.1952728242009996, 'bear_rsi_os': 11, 'bear_rsi_ob': 78, 'bear_adx_thresh': 11.570152242269666, 'bear_atr_min_pct': 0.02923182662928694, 'bear_atr_max_pct': 0.09062560690441337, 'bear_tp_mult': 2.2813435271521474, 'bear_tsl_mult': 0.5598100254500676, 'bear_time_stop': 266, 'bear_use_sma': False, 'bear_use_ema': False, 'bear_use_atr': False, 'bear_use_adx': False, 'bear_use_spike': True, 'bear_rsi_required': False, 'sideways_strategy': 'breakout', 'sideways_bb_std_mult': 2.9235245359390722, 'sideways_rsi_os': 29, 'sideways_rsi_ob': 90, 'sideways_adx_thresh': 15.746486087568973, 'sideways_atr_min_pct': 0.0015068863450014573, 'sideways_atr_max_pct': 0.09285259612727567, 'sideways_tp_mult': 2.7395806562236946, 'sideways_tsl_mult': 0.8396911760092828, 'sideways_time_stop': 230, 'sideways_use_sma': True, 'sideways_use_ema': False, 'sideways_use_atr': False, 'sideways_use_adx': True, 'sideways_use_spike': False, 'sideways_rsi_required': True}.
[I 2025-08-30 15:45:56,301] Trial 178 finished with values: [-1000000000.0, 1000000000.0] and parameters: {'p_sma': 14, 'p_std': 21, 'p_atr': 25, 'p_adx': 18, 'rsi_period': 33, 'ema1': 25, 'ema2': 36, 'slip_atr_k': 0.0021461845334215537, 'slip_spread_k': 0.0008021122150200866, 'spread_hl_frac': 0.0474709881403233, 'bb_std_mult': 3.074326884632101, 'rsi_os': 43, 'rsi_ob': 62, 'vol_spike': 0.00874573680937468, 'adx_thresh': 20.650974485913775, 'atr_min_pct': 0.024561361765294172, 'atr_max_pct': 0.14365879627072123, 'tp_mult': 1.0874543114552788, 'tsl_mult': 0.3688838957842036, 'strategy': 'breakout', 'time_stop': 26, 'use_sma': False, 'use_atr': True, 'use_adx': False, 'use_ema': False, 'use_spike': True, 'rsi_required': False, 'edge_k': 0.3199798087088322, 'edge_cap': 0.6180179128767141, 'bull_strategy': 'breakout', 'bull_bb_std_mult': 1.8876695272909296, 'bull_rsi_os': 22, 'bull_rsi_ob': 73, 'bull_adx_thresh': 31.06204656627554, 'bull_atr_min_pct': 0.003020780066238067, 'bull_atr_max_pct': 0.04635453905219321, 'bull_tp_mult': 2.552618891311963, 'bull_tsl_mult': 0.4980928344428216, 'bull_time_stop': 95, 'bull_use_sma': True, 'bull_use_ema': True, 'bull_use_atr': False, 'bull_use_adx': False, 'bull_use_spike': True, 'bull_rsi_required': True, 'bear_strategy': 'mean_reversion', 'bear_bb_std_mult': 2.1711753046595033, 'bear_rsi_os': 11, 'bear_rsi_ob': 84, 'bear_adx_thresh': 12.654396178453913, 'bear_atr_min_pct': 0.02948116010752477, 'bear_atr_max_pct': 0.09055648830041482, 'bear_tp_mult': 2.3855594025110083, 'bear_tsl_mult': 0.5438698714394, 'bear_time_stop': 300, 'bear_use_sma': False, 'bear_use_ema': False, 'bear_use_atr': False, 'bear_use_adx': True, 'bear_use_spike': True, 'bear_rsi_required': True, 'sideways_strategy': 'mean_reversion', 'sideways_bb_std_mult': 2.9351669889817207, 'sideways_rsi_os': 29, 'sideways_rsi_ob': 88, 'sideways_adx_thresh': 14.995318346303225, 'sideways_atr_min_pct': 0.0012727323651772681, 'sideways_atr_max_pct': 0.08732755499574658, 'sideways_tp_mult': 2.73946988727029, 'sideways_tsl_mult': 0.8363688306668453, 'sideways_time_stop': 230, 'sideways_use_sma': True, 'sideways_use_ema': False, 'sideways_use_atr': True, 'sideways_use_adx': True, 'sideways_use_spike': True, 'sideways_rsi_required': True}.
[I 2025-08-30 15:45:56,809] Trial 177 finished with values: [-1000000000.0, 1000000000.0] and parameters: {'p_sma': 14, 'p_std': 20, 'p_atr': 25, 'p_adx': 17, 'rsi_period': 33, 'ema1': 25, 'ema2': 36, 'slip_atr_k': 0.001057236850108334, 'slip_spread_k': 0.012682299667000244, 'spread_hl_frac': 0.04642280198083202, 'bb_std_mult': 2.9377019537943507, 'rsi_os': 45, 'rsi_ob': 63, 'vol_spike': 0.008123304118126529, 'adx_thresh': 20.543797994293648, 'atr_min_pct': 0.02516088852174839, 'atr_max_pct': 0.1426853874547379, 'tp_mult': 1.1767182778369731, 'tsl_mult': 0.38075051419220785, 'strategy': 'breakout', 'time_stop': 110, 'use_sma': False, 'use_atr': True, 'use_adx': False, 'use_ema': False, 'use_spike': True, 'rsi_required': False, 'edge_k': 0.3420052815876231, 'edge_cap': 0.5872451547743486, 'bull_strategy': 'breakout', 'bull_bb_std_mult': 1.7947626948330277, 'bull_rsi_os': 22, 'bull_rsi_ob': 69, 'bull_adx_thresh': 31.050995437234047, 'bull_atr_min_pct': 0.003397819356414539, 'bull_atr_max_pct': 0.0499084168389697, 'bull_tp_mult': 2.561691178498768, 'bull_tsl_mult': 0.49453452512956947, 'bull_time_stop': 91, 'bull_use_sma': True, 'bull_use_ema': True, 'bull_use_atr': False, 'bull_use_adx': False, 'bull_use_spike': False, 'bull_rsi_required': True, 'bear_strategy': 'mean_reversion', 'bear_bb_std_mult': 2.1405630329537453, 'bear_rsi_os': 18, 'bear_rsi_ob': 84, 'bear_adx_thresh': 12.647740375310928, 'bear_atr_min_pct': 0.02985236589930764, 'bear_atr_max_pct': 0.09015873279533415, 'bear_tp_mult': 2.279143959125983, 'bear_tsl_mult': 0.5486526503127923, 'bear_time_stop': 262, 'bear_use_sma': False, 'bear_use_ema': False, 'bear_use_atr': False, 'bear_use_adx': True, 'bear_use_spike': True, 'bear_rsi_required': True, 'sideways_strategy': 'mean_reversion', 'sideways_bb_std_mult': 3.2208043242842166, 'sideways_rsi_os': 27, 'sideways_rsi_ob': 89, 'sideways_adx_thresh': 13.171752839974602, 'sideways_atr_min_pct': 0.00131059765471032, 'sideways_atr_max_pct': 0.09083327904078543, 'sideways_tp_mult': 2.7493419314204495, 'sideways_tsl_mult': 0.8388540627226925, 'sideways_time_stop': 234, 'sideways_use_sma': True, 'sideways_use_ema': False, 'sideways_use_atr': False, 'sideways_use_adx': True, 'sideways_use_spike': False, 'sideways_rsi_required': True}.
[I 2025-08-30 15:45:57,125] Trial 176 finished with values: [-1000000000.0, 1000000000.0] and parameters: {'p_sma': 14, 'p_std': 20, 'p_atr': 25, 'p_adx': 17, 'rsi_period': 33, 'ema1': 25, 'ema2': 36, 'slip_atr_k': 0.000977631819863524, 'slip_spread_k': 0.010372636875845954, 'spread_hl_frac': 0.04727701411339049, 'bb_std_mult': 3.0767228106655424, 'rsi_os': 37, 'rsi_ob': 63, 'vol_spike': 0.008796538085285832, 'adx_thresh': 20.560762539281622, 'atr_min_pct': 0.02428626550358874, 'atr_max_pct': 0.14461933873034477, 'tp_mult': 1.0883647161988825, 'tsl_mult': 0.43040465276577194, 'strategy': 'breakout', 'time_stop': 274, 'use_sma': False, 'use_atr': True, 'use_adx': False, 'use_ema': False, 'use_spike': True, 'rsi_required': False, 'edge_k': 0.3219915810449183, 'edge_cap': 0.5787121892460693, 'bull_strategy': 'breakout', 'bull_bb_std_mult': 2.004855890741903, 'bull_rsi_os': 23, 'bull_rsi_ob': 75, 'bull_adx_thresh': 30.94451378290636, 'bull_atr_min_pct': 0.005168821339377442, 'bull_atr_max_pct': 0.04327342686458959, 'bull_tp_mult': 2.564469947858877, 'bull_tsl_mult': 0.47354608885285837, 'bull_time_stop': 78, 'bull_use_sma': True, 'bull_use_ema': True, 'bull_use_atr': False, 'bull_use_adx': False, 'bull_use_spike': False, 'bull_rsi_required': True, 'bear_strategy': 'mean_reversion', 'bear_bb_std_mult': 2.185658474788758, 'bear_rsi_os': 18, 'bear_rsi_ob': 79, 'bear_adx_thresh': 12.880099706171828, 'bear_atr_min_pct': 0.029509273903102894, 'bear_atr_max_pct': 0.09024755026183867, 'bear_tp_mult': 2.3049762295625134, 'bear_tsl_mult': 0.5449051986180746, 'bear_time_stop': 300, 'bear_use_sma': False, 'bear_use_ema': False, 'bear_use_atr': False, 'bear_use_adx': False, 'bear_use_spike': True, 'bear_rsi_required': False, 'sideways_strategy': 'mean_reversion', 'sideways_bb_std_mult': 2.947918136147809, 'sideways_rsi_os': 29, 'sideways_rsi_ob': 87, 'sideways_adx_thresh': 31.229418980676527, 'sideways_atr_min_pct': 0.0014919901712733027, 'sideways_atr_max_pct': 0.09188836597084407, 'sideways_tp_mult': 2.7212422574122472, 'sideways_tsl_mult': 0.856967277966918, 'sideways_time_stop': 227, 'sideways_use_sma': True, 'sideways_use_ema': False, 'sideways_use_atr': False, 'sideways_use_adx': True, 'sideways_use_spike': False, 'sideways_rsi_required': True}.
[I 2025-08-30 15:46:54,108] Trial 179 finished with values: [-1000000000.0, 1000000000.0] and parameters: {'p_sma': 11, 'p_std': 20, 'p_atr': 25, 'p_adx': 18, 'rsi_period': 33, 'ema1': 24, 'ema2': 34, 'slip_atr_k': 0.0050491340512619914, 'slip_spread_k': 0.010762667587935844, 'spread_hl_frac': 0.019873204560746743, 'bb_std_mult': 2.930382903171184, 'rsi_os': 45, 'rsi_ob': 63, 'vol_spike': 0.0036546610360147632, 'adx_thresh': 20.4687243197052, 'atr_min_pct': 0.024550719460059656, 'atr_max_pct': 0.14418386713689513, 'tp_mult': 1.07619786232084, 'tsl_mult': 0.42894641656738647, 'strategy': 'breakout', 'time_stop': 268, 'use_sma': False, 'use_atr': True, 'use_adx': False, 'use_ema': False, 'use_spike': True, 'rsi_required': False, 'edge_k': 0.36258154547107513, 'edge_cap': 0.5703319297828726, 'bull_strategy': 'breakout', 'bull_bb_std_mult': 1.8921875982316894, 'bull_rsi_os': 22, 'bull_rsi_ob': 74, 'bull_adx_thresh': 31.399679910902808, 'bull_atr_min_pct': 0.0031671221980427234, 'bull_atr_max_pct': 0.049789564064619825, 'bull_tp_mult': 2.5598278092969995, 'bull_tsl_mult': 0.5067373452705556, 'bull_time_stop': 78, 'bull_use_sma': True, 'bull_use_ema': True, 'bull_use_atr': False, 'bull_use_adx': False, 'bull_use_spike': True, 'bull_rsi_required': True, 'bear_strategy': 'mean_reversion', 'bear_bb_std_mult': 2.144742417413873, 'bear_rsi_os': 18, 'bear_rsi_ob': 84, 'bear_adx_thresh': 12.897473111549663, 'bear_atr_min_pct': 0.02981876637967694, 'bear_atr_max_pct': 0.09063845749007965, 'bear_tp_mult': 2.3461202174750047, 'bear_tsl_mult': 0.5383986218259706, 'bear_time_stop': 261, 'bear_use_sma': False, 'bear_use_ema': False, 'bear_use_atr': False, 'bear_use_adx': True, 'bear_use_spike': True, 'bear_rsi_required': True, 'sideways_strategy': 'mean_reversion', 'sideways_bb_std_mult': 3.1984056488688957, 'sideways_rsi_os': 27, 'sideways_rsi_ob': 87, 'sideways_adx_thresh': 14.020795648955712, 'sideways_atr_min_pct': 0.0009146043685267609, 'sideways_atr_max_pct': 0.08841229876957485, 'sideways_tp_mult': 2.7150837697010486, 'sideways_tsl_mult': 0.9255805529957026, 'sideways_time_stop': 206, 'sideways_use_sma': True, 'sideways_use_ema': False, 'sideways_use_atr': True, 'sideways_use_adx': True, 'sideways_use_spike': True, 'sideways_rsi_required': True}.
