[I 2025-08-30 17:33:33,128] Trial 804 finished with values: [-1000000000.0, 1000000000.0] and parameters: {'p_sma': 12, 'p_std': 27, 'p_atr': 19, 'p_adx': 7, 'rsi_period': 21, 'ema1': 16, 'ema2': 34, 'slip_atr_k': 0.010617387939613485, 'slip_spread_k': 0.7573171047773279, 'spread_hl_frac': 0.01620762836325222, 'bb_std_mult': 3.0597363401453306, 'rsi_os': 31, 'rsi_ob': 75, 'vol_spike': 0.07480821194242254, 'adx_thresh': 12.128897252626526, 'atr_min_pct': 0.02016209043813095, 'atr_max_pct': 0.14705200212631167, 'tp_mult': 2.806107451225135, 'tsl_mult': 0.35433134308564745, 'strategy': 'mean_reversion', 'time_stop': 21, 'use_sma': False, 'use_atr': True, 'use_adx': True, 'use_ema': False, 'use_spike': False, 'rsi_required': True, 'edge_k': 0.6989544005083295, 'edge_cap': 0.41161195782899385, 'bull_strategy': 'mean_reversion', 'bull_bb_std_mult': 1.9112439496159248, 'bull_rsi_os': 51, 'bull_rsi_ob': 53, 'bull_adx_thresh': 14.923868847684592, 'bull_atr_min_pct': 0.022585712502522396, 'bull_atr_max_pct': 0.07127039037286692, 'bull_tp_mult': 2.846861280439443, 'bull_tsl_mult': 0.7978949495876025, 'bull_time_stop': 75, 'bull_use_sma': True, 'bull_use_ema': True, 'bull_use_atr': False, 'bull_use_adx': True, 'bull_use_spike': False, 'bull_rsi_required': False, 'bear_strategy': 'mean_reversion', 'bear_bb_std_mult': 3.1711923948111, 'bear_rsi_os': 13, 'bear_rsi_ob': 75, 'bear_adx_thresh': 27.974061511979784, 'bear_atr_min_pct': 0.016010583286729784, 'bear_atr_max_pct': 0.0994691237845358, 'bear_tp_mult': 2.1502123236932964, 'bear_tsl_mult': 0.6793056602098428, 'bear_time_stop': 209, 'bear_use_sma': True, 'bear_use_ema': False, 'bear_use_atr': False, 'bear_use_adx': False, 'bear_use_spike': False, 'bear_rsi_required': False, 'sideways_strategy': 'breakout', 'sideways_bb_std_mult': 1.434109817192156, 'sideways_rsi_os': 29, 'sideways_rsi_ob': 54, 'sideways_adx_thresh': 23.92006099696848, 'sideways_atr_min_pct': 0.0024053430556450588, 'sideways_atr_max_pct': 0.096549423281477, 'sideways_tp_mult': 2.8901455280252604, 'sideways_tsl_mult': 0.47386373578378704, 'sideways_time_stop': 281, 'sideways_use_sma': True, 'sideways_use_ema': False, 'sideways_use_atr': False, 'sideways_use_adx': False, 'sideways_use_spike': False, 'sideways_rsi_required': True}.
[I 2025-08-30 17:33:34,341] Trial 803 finished with values: [-1000000000.0, 1000000000.0] and parameters: {'p_sma': 7, 'p_std': 20, 'p_atr': 15, 'p_adx': 7, 'rsi_period': 50, 'ema1': 29, 'ema2': 51, 'slip_atr_k': 0.008511221184632156, 'slip_spread_k': 0.21728382313449934, 'spread_hl_frac': 0.019336850380234857, 'bb_std_mult': 1.9826938129857448, 'rsi_os': 31, 'rsi_ob': 84, 'vol_spike': 0.07477863704450786, 'adx_thresh': 11.33708208111265, 'atr_min_pct': 0.02007332237897337, 'atr_max_pct': 0.14738203036566955, 'tp_mult': 1.3116697223172502, 'tsl_mult': 0.9410804574239897, 'strategy': 'mean_reversion', 'time_stop': 121, 'use_sma': False, 'use_atr': True, 'use_adx': True, 'use_ema': False, 'use_spike': False, 'rsi_required': True, 'edge_k': 0.5963283851780792, 'edge_cap': 0.827524414061384, 'bull_strategy': 'mean_reversion', 'bull_bb_std_mult': 1.606009227437721, 'bull_rsi_os': 11, 'bull_rsi_ob': 53, 'bull_adx_thresh': 13.197212814013987, 'bull_atr_min_pct': 0.02247997016617839, 'bull_atr_max_pct': 0.04942162178119018, 'bull_tp_mult': 2.8878453149404333, 'bull_tsl_mult': 0.8865809965673017, 'bull_time_stop': 75, 'bull_use_sma': True, 'bull_use_ema': True, 'bull_use_atr': False, 'bull_use_adx': True, 'bull_use_spike': False, 'bull_rsi_required': False, 'bear_strategy': 'mean_reversion', 'bear_bb_std_mult': 1.3265568530204654, 'bear_rsi_os': 42, 'bear_rsi_ob': 72, 'bear_adx_thresh': 11.34266369374611, 'bear_atr_min_pct': 0.01779286856659617, 'bear_atr_max_pct': 0.10632753971436792, 'bear_tp_mult': 2.1454044601552766, 'bear_tsl_mult': 0.686739715593234, 'bear_time_stop': 25, 'bear_use_sma': True, 'bear_use_ema': False, 'bear_use_atr': False, 'bear_use_adx': False, 'bear_use_spike': False, 'bear_rsi_required': False, 'sideways_strategy': 'breakout', 'sideways_bb_std_mult': 0.8958706475074063, 'sideways_rsi_os': 29, 'sideways_rsi_ob': 90, 'sideways_adx_thresh': 9.48998367833345, 'sideways_atr_min_pct': 0.002441928938168469, 'sideways_atr_max_pct': 0.09602439619416901, 'sideways_tp_mult': 2.4651333822444403, 'sideways_tsl_mult': 0.25880231907464635, 'sideways_time_stop': 70, 'sideways_use_sma': True, 'sideways_use_ema': False, 'sideways_use_atr': False, 'sideways_use_adx': False, 'sideways_use_spike': False, 'sideways_rsi_required': True}.
[I 2025-08-30 17:33:34,841] Trial 801 finished with values: [-1000000000.0, 1000000000.0] and parameters: {'p_sma': 9, 'p_std': 27, 'p_atr': 15, 'p_adx': 9, 'rsi_period': 74, 'ema1': 29, 'ema2': 13, 'slip_atr_k': 0.02849060847601495, 'slip_spread_k': 0.18948606247478542, 'spread_hl_frac': 0.017801762894164165, 'bb_std_mult': 3.1764591759935734, 'rsi_os': 47, 'rsi_ob': 70, 'vol_spike': 0.08814479683164592, 'adx_thresh': 20.01416326952269, 'atr_min_pct': 0.02044955217411023, 'atr_max_pct': 0.1251859966691381, 'tp_mult': 2.877802915449374, 'tsl_mult': 0.199653981225292, 'strategy': 'breakout', 'time_stop': 183, 'use_sma': False, 'use_atr': True, 'use_adx': True, 'use_ema': False, 'use_spike': False, 'rsi_required': False, 'edge_k': 0.5768350513911428, 'edge_cap': 0.8689094799321154, 'bull_strategy': 'mean_reversion', 'bull_bb_std_mult': 1.923338688389814, 'bull_rsi_os': 42, 'bull_rsi_ob': 72, 'bull_adx_thresh': 5.287614886955575, 'bull_atr_min_pct': 0.026714272834590266, 'bull_atr_max_pct': 0.1377601351270506, 'bull_tp_mult': 2.125726124313416, 'bull_tsl_mult': 0.4045561418495329, 'bull_time_stop': 105, 'bull_use_sma': True, 'bull_use_ema': True, 'bull_use_atr': False, 'bull_use_adx': True, 'bull_use_spike': False, 'bull_rsi_required': False, 'bear_strategy': 'mean_reversion', 'bear_bb_std_mult': 1.3110404875841046, 'bear_rsi_os': 53, 'bear_rsi_ob': 77, 'bear_adx_thresh': 27.389808223785483, 'bear_atr_min_pct': 0.02067772587107266, 'bear_atr_max_pct': 0.11017826270905574, 'bear_tp_mult': 2.173668515427177, 'bear_tsl_mult': 0.21672117501088078, 'bear_time_stop': 218, 'bear_use_sma': True, 'bear_use_ema': False, 'bear_use_atr': False, 'bear_use_adx': False, 'bear_use_spike': False, 'bear_rsi_required': False, 'sideways_strategy': 'mean_reversion', 'sideways_bb_std_mult': 0.6450747955516118, 'sideways_rsi_os': 29, 'sideways_rsi_ob': 93, 'sideways_adx_thresh': 9.417931364154946, 'sideways_atr_min_pct': 0.024310040418217504, 'sideways_atr_max_pct': 0.09153230977326055, 'sideways_tp_mult': 2.469984398329363, 'sideways_tsl_mult': 0.45158533626872643, 'sideways_time_stop': 281, 'sideways_use_sma': False, 'sideways_use_ema': False, 'sideways_use_atr': False, 'sideways_use_adx': False, 'sideways_use_spike': False, 'sideways_rsi_required': True}.
[I 2025-08-30 17:33:35,100] Trial 802 finished with values: [-1000000000.0, 1000000000.0] and parameters: {'p_sma': 21, 'p_std': 20, 'p_atr': 21, 'p_adx': 7, 'rsi_period': 57, 'ema1': 19, 'ema2': 28, 'slip_atr_k': 0.06215305094390382, 'slip_spread_k': 0.2112708258451499, 'spread_hl_frac': 0.019365721298206233, 'bb_std_mult': 1.9654092793314981, 'rsi_os': 44, 'rsi_ob': 83, 'vol_spike': 0.1101045613341983, 'adx_thresh': 12.220729876580931, 'atr_min_pct': 0.010910687981911322, 'atr_max_pct': 0.04420228606036826, 'tp_mult': 2.8710894110939273, 'tsl_mult': 0.8861347331958043, 'strategy': 'breakout', 'time_stop': 22, 'use_sma': False, 'use_atr': True, 'use_adx': True, 'use_ema': False, 'use_spike': False, 'rsi_required': True, 'edge_k': 0.30662330492914924, 'edge_cap': 0.7507969040039549, 'bull_strategy': 'mean_reversion', 'bull_bb_std_mult': 1.890342147356642, 'bull_rsi_os': 11, 'bull_rsi_ob': 53, 'bull_adx_thresh': 13.285501203069499, 'bull_atr_min_pct': 0.009603542558770821, 'bull_atr_max_pct': 0.13792914654822208, 'bull_tp_mult': 2.865952292907382, 'bull_tsl_mult': 0.40671657805968875, 'bull_time_stop': 75, 'bull_use_sma': True, 'bull_use_ema': True, 'bull_use_atr': False, 'bull_use_adx': True, 'bull_use_spike': False, 'bull_rsi_required': False, 'bear_strategy': 'mean_reversion', 'bear_bb_std_mult': 0.885907588667656, 'bear_rsi_os': 44, 'bear_rsi_ob': 77, 'bear_adx_thresh': 17.436781181112146, 'bear_atr_min_pct': 0.018174179127327494, 'bear_atr_max_pct': 0.11063727085753802, 'bear_tp_mult': 2.146430602484865, 'bear_tsl_mult': 0.5295554010818514, 'bear_time_stop': 218, 'bear_use_sma': True, 'bear_use_ema': False, 'bear_use_atr': False, 'bear_use_adx': False, 'bear_use_spike': False, 'bear_rsi_required': False, 'sideways_strategy': 'mean_reversion', 'sideways_bb_std_mult': 0.8985085596927651, 'sideways_rsi_os': 29, 'sideways_rsi_ob': 93, 'sideways_adx_thresh': 34.29005173994562, 'sideways_atr_min_pct': 0.024611535213976153, 'sideways_atr_max_pct': 0.09197843492376483, 'sideways_tp_mult': 2.8848848766495414, 'sideways_tsl_mult': 0.5568810706328514, 'sideways_time_stop': 244, 'sideways_use_sma': False, 'sideways_use_ema': False, 'sideways_use_atr': False, 'sideways_use_adx': False, 'sideways_use_spike': False, 'sideways_rsi_required': True}.
[I 2025-08-30 17:34:22,120] Trial 806 finished with values: [-1000000000.0, 1000000000.0] and parameters: {'p_sma': 9, 'p_std': 11, 'p_atr': 16, 'p_adx': 9, 'rsi_period': 54, 'ema1': 12, 'ema2': 13, 'slip_atr_k': 0.003917126284744438, 'slip_spread_k': 0.2053741986580737, 'spread_hl_frac': 0.017527127146924167, 'bb_std_mult': 2.3132542282166058, 'rsi_os': 33, 'rsi_ob': 86, 'vol_spike': 0.0883365386000099, 'adx_thresh': 29.08962447982357, 'atr_min_pct': 0.023854478956743058, 'atr_max_pct': 0.12456940987706025, 'tp_mult': 2.8762823793615127, 'tsl_mult': 0.9611022746268518, 'strategy': 'breakout', 'time_stop': 56, 'use_sma': False, 'use_atr': True, 'use_adx': True, 'use_ema': False, 'use_spike': False, 'rsi_required': False, 'edge_k': 0.319264123559064, 'edge_cap': 0.7752624942765416, 'bull_strategy': 'mean_reversion', 'bull_bb_std_mult': 1.8485121615026472, 'bull_rsi_os': 13, 'bull_rsi_ob': 54, 'bull_adx_thresh': 32.87536105166547, 'bull_atr_min_pct': 0.0159113206529091, 'bull_atr_max_pct': 0.14562259306871322, 'bull_tp_mult': 2.1843152198443976, 'bull_tsl_mult': 0.7863810875129266, 'bull_time_stop': 103, 'bull_use_sma': True, 'bull_use_ema': True, 'bull_use_atr': False, 'bull_use_adx': True, 'bull_use_spike': True, 'bull_rsi_required': False, 'bear_strategy': 'mean_reversion', 'bear_bb_std_mult': 3.433479837323557, 'bear_rsi_os': 51, 'bear_rsi_ob': 77, 'bear_adx_thresh': 17.449011332466267, 'bear_atr_min_pct': 0.005771552612245238, 'bear_atr_max_pct': 0.10998246093414311, 'bear_tp_mult': 2.320671373516762, 'bear_tsl_mult': 0.21758732975304818, 'bear_time_stop': 142, 'bear_use_sma': True, 'bear_use_ema': False, 'bear_use_atr': False, 'bear_use_adx': False, 'bear_use_spike': False, 'bear_rsi_required': False, 'sideways_strategy': 'mean_reversion', 'sideways_bb_std_mult': 0.7308846814780253, 'sideways_rsi_os': 5, 'sideways_rsi_ob': 95, 'sideways_adx_thresh': 28.54852709149828, 'sideways_atr_min_pct': 0.0010876408352072323, 'sideways_atr_max_pct': 0.09363065786752404, 'sideways_tp_mult': 2.342022828025759, 'sideways_tsl_mult': 0.024082780907357326, 'sideways_time_stop': 271, 'sideways_use_sma': False, 'sideways_use_ema': False, 'sideways_use_atr': False, 'sideways_use_adx': False, 'sideways_use_spike': False, 'sideways_rsi_required': True}.
[I 2025-08-30 17:34:23,060] Trial 805 finished with values: [-1000000000.0, 1000000000.0] and parameters: {'p_sma': 5, 'p_std': 20, 'p_atr': 7, 'p_adx': 9, 'rsi_period': 29, 'ema1': 29, 'ema2': 30, 'slip_atr_k': 0.1398833370038098, 'slip_spread_k': 0.21374189118200793, 'spread_hl_frac': 0.034589346198651325, 'bb_std_mult': 1.7132771041240615, 'rsi_os': 33, 'rsi_ob': 83, 'vol_spike': 0.2869363045653497, 'adx_thresh': 31.806570503063302, 'atr_min_pct': 0.010688945335727697, 'atr_max_pct': 0.07524304694776504, 'tp_mult': 2.8695125308459297, 'tsl_mult': 0.9570597166459607, 'strategy': 'mean_reversion', 'time_stop': 135, 'use_sma': False, 'use_atr': True, 'use_adx': True, 'use_ema': False, 'use_spike': False, 'rsi_required': True, 'edge_k': 0.5849083663658207, 'edge_cap': 0.8250349165658876, 'bull_strategy': 'mean_reversion', 'bull_bb_std_mult': 1.8625022560484308, 'bull_rsi_os': 13, 'bull_rsi_ob': 54, 'bull_adx_thresh': 5.018501158056917, 'bull_atr_min_pct': 0.0267421553515324, 'bull_atr_max_pct': 0.13887586080097092, 'bull_tp_mult': 2.179620290247782, 'bull_tsl_mult': 0.8813715993462689, 'bull_time_stop': 79, 'bull_use_sma': True, 'bull_use_ema': True, 'bull_use_atr': False, 'bull_use_adx': True, 'bull_use_spike': False, 'bull_rsi_required': False, 'bear_strategy': 'mean_reversion', 'bear_bb_std_mult': 1.726921843024329, 'bear_rsi_os': 36, 'bear_rsi_ob': 79, 'bear_adx_thresh': 11.212604771215329, 'bear_atr_min_pct': 0.01774435583104359, 'bear_atr_max_pct': 0.10551935607857567, 'bear_tp_mult': 1.469458277832839, 'bear_tsl_mult': 0.5304247506419555, 'bear_time_stop': 216, 'bear_use_sma': True, 'bear_use_ema': False, 'bear_use_atr': False, 'bear_use_adx': False, 'bear_use_spike': False, 'bear_rsi_required': False, 'sideways_strategy': 'breakout', 'sideways_bb_std_mult': 0.7417447770662735, 'sideways_rsi_os': 30, 'sideways_rsi_ob': 52, 'sideways_adx_thresh': 28.334609142816568, 'sideways_atr_min_pct': 0.005857160747726591, 'sideways_atr_max_pct': 0.09353474987908217, 'sideways_tp_mult': 2.8975706366368637, 'sideways_tsl_mult': 0.44409220178365477, 'sideways_time_stop': 241, 'sideways_use_sma': True, 'sideways_use_ema': False, 'sideways_use_atr': False, 'sideways_use_adx': False, 'sideways_use_spike': False, 'sideways_rsi_required': True}.
[I 2025-08-30 17:34:23,676] Trial 807 finished with values: [-1000000000.0, 1000000000.0] and parameters: {'p_sma': 5, 'p_std': 47, 'p_atr': 16, 'p_adx': 9, 'rsi_period': 29, 'ema1': 19, 'ema2': 48, 'slip_atr_k': 0.0033664513347449647, 'slip_spread_k': 0.7094122971038113, 'spread_hl_frac': 0.03466530992955609, 'bb_std_mult': 3.383723734636346, 'rsi_os': 11, 'rsi_ob': 86, 'vol_spike': 0.1067452212349945, 'adx_thresh': 11.46901666276789, 'atr_min_pct': 0.029308190468435448, 'atr_max_pct': 0.07615347691446174, 'tp_mult': 2.9412573297548867, 'tsl_mult': 0.9525581012093517, 'strategy': 'mean_reversion', 'time_stop': 258, 'use_sma': False, 'use_atr': True, 'use_adx': True, 'use_ema': False, 'use_spike': False, 'rsi_required': True, 'edge_k': 0.4633863452392333, 'edge_cap': 0.08157878746603675, 'bull_strategy': 'mean_reversion', 'bull_bb_std_mult': 1.8591915009377833, 'bull_rsi_os': 13, 'bull_rsi_ob': 54, 'bull_adx_thresh': 33.211235485596184, 'bull_atr_min_pct': 0.02288963030128962, 'bull_atr_max_pct': 0.14727377385185653, 'bull_tp_mult': 2.181099000944288, 'bull_tsl_mult': 0.7986067718043616, 'bull_time_stop': 280, 'bull_use_sma': True, 'bull_use_ema': True, 'bull_use_atr': False, 'bull_use_adx': True, 'bull_use_spike': True, 'bull_rsi_required': False, 'bear_strategy': 'mean_reversion', 'bear_bb_std_mult': 1.6624392777562673, 'bear_rsi_os': 43, 'bear_rsi_ob': 76, 'bear_adx_thresh': 13.425719482409608, 'bear_atr_min_pct': 0.01871996930739933, 'bear_atr_max_pct': 0.12687100609768434, 'bear_tp_mult': 1.0183333039373172, 'bear_tsl_mult': 0.6487324108920824, 'bear_time_stop': 208, 'bear_use_sma': True, 'bear_use_ema': False, 'bear_use_atr': False, 'bear_use_adx': False, 'bear_use_spike': False, 'bear_rsi_required': False, 'sideways_strategy': 'breakout', 'sideways_bb_std_mult': 0.8093120263103911, 'sideways_rsi_os': 30, 'sideways_rsi_ob': 95, 'sideways_adx_thresh': 11.886971095427185, 'sideways_atr_min_pct': 0.0011284405872077946, 'sideways_atr_max_pct': 0.09360334661484121, 'sideways_tp_mult': 2.8844630283834003, 'sideways_tsl_mult': 0.6032791278015122, 'sideways_time_stop': 272, 'sideways_use_sma': True, 'sideways_use_ema': False, 'sideways_use_atr': False, 'sideways_use_adx': False, 'sideways_use_spike': False, 'sideways_rsi_required': True}.
[I 2025-08-30 17:34:23,676] Trial 808 finished with values: [-1000000000.0, 1000000000.0] and parameters: {'p_sma': 40, 'p_std': 22, 'p_atr': 16, 'p_adx': 16, 'rsi_period': 26, 'ema1': 17, 'ema2': 20, 'slip_atr_k': 0.0036998453226934104, 'slip_spread_k': 0.14962147612603965, 'spread_hl_frac': 0.017219288980741473, 'bb_std_mult': 2.3247201239493225, 'rsi_os': 33, 'rsi_ob': 86, 'vol_spike': 0.10354712340593085, 'adx_thresh': 31.850529829359377, 'atr_min_pct': 0.01880840772490915, 'atr_max_pct': 0.14370350827018968, 'tp_mult': 2.951936923725395, 'tsl_mult': 0.3206704212847935, 'strategy': 'mean_reversion', 'time_stop': 45, 'use_sma': False, 'use_atr': True, 'use_adx': True, 'use_ema': True, 'use_spike': False, 'rsi_required': True, 'edge_k': 0.911188314086497, 'edge_cap': 0.9072639549980555, 'bull_strategy': 'mean_reversion', 'bull_bb_std_mult': 2.639689922389527, 'bull_rsi_os': 13, 'bull_rsi_ob': 82, 'bull_adx_thresh': 16.079038312227503, 'bull_atr_min_pct': 0.015043662903872828, 'bull_atr_max_pct': 0.03708010495636261, 'bull_tp_mult': 2.9982390748137666, 'bull_tsl_mult': 0.7872320874732327, 'bull_time_stop': 179, 'bull_use_sma': True, 'bull_use_ema': False, 'bull_use_atr': False, 'bull_use_adx': True, 'bull_use_spike': True, 'bull_rsi_required': False, 'bear_strategy': 'breakout', 'bear_bb_std_mult': 1.5372263647087825, 'bear_rsi_os': 13, 'bear_rsi_ob': 79, 'bear_adx_thresh': 8.953055586729864, 'bear_atr_min_pct': 0.008137104981693042, 'bear_atr_max_pct': 0.1045119598980393, 'bear_tp_mult': 1.4735283510487085, 'bear_tsl_mult': 0.6438330265314057, 'bear_time_stop': 106, 'bear_use_sma': True, 'bear_use_ema': False, 'bear_use_atr': False, 'bear_use_adx': False, 'bear_use_spike': False, 'bear_rsi_required': False, 'sideways_strategy': 'breakout', 'sideways_bb_std_mult': 0.7574976265503898, 'sideways_rsi_os': 31, 'sideways_rsi_ob': 52, 'sideways_adx_thresh': 11.749971801553775, 'sideways_atr_min_pct': 0.012206228883853832, 'sideways_atr_max_pct': 0.05805832393408456, 'sideways_tp_mult': 1.8869069263087286, 'sideways_tsl_mult': 0.01743064161902058, 'sideways_time_stop': 148, 'sideways_use_sma': True, 'sideways_use_ema': False, 'sideways_use_atr': False, 'sideways_use_adx': False, 'sideways_use_spike': True, 'sideways_rsi_required': True}.
[I 2025-08-30 17:35:05,186] Trial 809 finished with values: [-0.03844266018881304, 0.03840864720589235] and parameters: {'p_sma': 8, 'p_std': 22, 'p_atr': 7, 'p_adx': 17, 'rsi_period': 23, 'ema1': 17, 'ema2': 12, 'slip_atr_k': 0.01912155863581853, 'slip_spread_k': 0.1413486789354998, 'spread_hl_frac': 0.015008255172706987, 'bb_std_mult': 1.1902397322880627, 'rsi_os': 32, 'rsi_ob': 73, 'vol_spike': 0.10413000392872361, 'adx_thresh': 18.751660445569478, 'atr_min_pct': 0.018915015310547893, 'atr_max_pct': 0.14359001404317975, 'tp_mult': 1.4638972695663386, 'tsl_mult': 0.9468687422756663, 'strategy': 'mean_reversion', 'time_stop': 163, 'use_sma': False, 'use_atr': True, 'use_adx': True, 'use_ema': True, 'use_spike': False, 'rsi_required': True, 'edge_k': 0.9085707745393043, 'edge_cap': 0.9023432435589757, 'bull_strategy': 'mean_reversion', 'bull_bb_std_mult': 3.3539370218243683, 'bull_rsi_os': 10, 'bull_rsi_ob': 82, 'bull_adx_thresh': 34.97592350052964, 'bull_atr_min_pct': 0.02309953185167185, 'bull_atr_max_pct': 0.14759792974789598, 'bull_tp_mult': 2.2778453442344913, 'bull_tsl_mult': 0.8066046692484603, 'bull_time_stop': 227, 'bull_use_sma': True, 'bull_use_ema': False, 'bull_use_atr': False, 'bull_use_adx': True, 'bull_use_spike': False, 'bull_rsi_required': True, 'bear_strategy': 'breakout', 'bear_bb_std_mult': 1.539039771884255, 'bear_rsi_os': 16, 'bear_rsi_ob': 64, 'bear_adx_thresh': 8.69804964503569, 'bear_atr_min_pct': 0.008163281597875698, 'bear_atr_max_pct': 0.0620431816654652, 'bear_tp_mult': 2.253447870699224, 'bear_tsl_mult': 0.6534949941103942, 'bear_time_stop': 208, 'bear_use_sma': True, 'bear_use_ema': True, 'bear_use_atr': False, 'bear_use_adx': False, 'bear_use_spike': False, 'bear_rsi_required': False, 'sideways_strategy': 'breakout', 'sideways_bb_std_mult': 2.9214792690124325, 'sideways_rsi_os': 31, 'sideways_rsi_ob': 52, 'sideways_adx_thresh': 11.746501554028837, 'sideways_atr_min_pct': 0.0009580808842839094, 'sideways_atr_max_pct': 0.1040828075824339, 'sideways_tp_mult': 2.8426632330972486, 'sideways_tsl_mult': 0.47547719500548924, 'sideways_time_stop': 13, 'sideways_use_sma': True, 'sideways_use_ema': False, 'sideways_use_atr': True, 'sideways_use_adx': True, 'sideways_use_spike': True, 'sideways_rsi_required': False}.
