[I 2025-08-30 16:12:31,614] Trial 324 finished with values: [-1000000000.0, 1000000000.0] and parameters: {'p_sma': 8, 'p_std': 60, 'p_atr': 17, 'p_adx': 25, 'rsi_period': 19, 'ema1': 12, 'ema2': 15, 'slip_atr_k': 0.21788725086003635, 'slip_spread_k': 0.6187600423187982, 'spread_hl_frac': 0.016723425121309112, 'bb_std_mult': 3.275685135403139, 'rsi_os': 46, 'rsi_ob': 91, 'vol_spike': 0.24403255070185143, 'adx_thresh': 12.563360917931961, 'atr_min_pct': 0.01588773379154926, 'atr_max_pct': 0.11785349868108094, 'tp_mult': 2.8566146181386145, 'tsl_mult': 0.591043320881499, 'strategy': 'mean_reversion', 'time_stop': 216, 'use_sma': False, 'use_atr': True, 'use_adx': True, 'use_ema': True, 'use_spike': False, 'rsi_required': True, 'edge_k': 1.7096439828689185, 'edge_cap': 0.9009433402912195, 'bull_strategy': 'mean_reversion', 'bull_bb_std_mult': 1.8832533493956392, 'bull_rsi_os': 46, 'bull_rsi_ob': 53, 'bull_adx_thresh': 19.321703987298392, 'bull_atr_min_pct': 0.02124691479527555, 'bull_atr_max_pct': 0.1325796788652799, 'bull_tp_mult': 2.943616313148766, 'bull_tsl_mult': 0.7942353888119544, 'bull_time_stop': 225, 'bull_use_sma': False, 'bull_use_ema': True, 'bull_use_atr': True, 'bull_use_adx': True, 'bull_use_spike': False, 'bull_rsi_required': False, 'bear_strategy': 'breakout', 'bear_bb_std_mult': 2.1273092536240634, 'bear_rsi_os': 14, 'bear_rsi_ob': 76, 'bear_adx_thresh': 33.28161133286371, 'bear_atr_min_pct': 0.023386446942991464, 'bear_atr_max_pct': 0.13203305732904108, 'bear_tp_mult': 2.120024216725301, 'bear_tsl_mult': 0.6696309251727939, 'bear_time_stop': 203, 'bear_use_sma': True, 'bear_use_ema': True, 'bear_use_atr': False, 'bear_use_adx': False, 'bear_use_spike': False, 'bear_rsi_required': False, 'sideways_strategy': 'breakout', 'sideways_bb_std_mult': 2.3226383741883354, 'sideways_rsi_os': 19, 'sideways_rsi_ob': 92, 'sideways_adx_thresh': 30.09730919163251, 'sideways_atr_min_pct': 0.005452152825076691, 'sideways_atr_max_pct': 0.14467943222633925, 'sideways_tp_mult': 1.456039571559533, 'sideways_tsl_mult': 0.4056880333773589, 'sideways_time_stop': 183, 'sideways_use_sma': True, 'sideways_use_ema': False, 'sideways_use_atr': False, 'sideways_use_adx': False, 'sideways_use_spike': False, 'sideways_rsi_required': False}.
[I 2025-08-30 16:12:32,319] Trial 325 finished with values: [-1000000000.0, 1000000000.0] and parameters: {'p_sma': 9, 'p_std': 50, 'p_atr': 21, 'p_adx': 25, 'rsi_period': 18, 'ema1': 25, 'ema2': 26, 'slip_atr_k': 0.05897358762942899, 'slip_spread_k': 0.6843399638848957, 'spread_hl_frac': 0.014099054643547269, 'bb_std_mult': 3.2576643736624358, 'rsi_os': 33, 'rsi_ob': 86, 'vol_spike': 0.01166876768386396, 'adx_thresh': 12.300934865163661, 'atr_min_pct': 0.019854243566209132, 'atr_max_pct': 0.13552062879432758, 'tp_mult': 2.7704595473815132, 'tsl_mult': 0.400283676841234, 'strategy': 'mean_reversion', 'time_stop': 5, 'use_sma': False, 'use_atr': False, 'use_adx': True, 'use_ema': False, 'use_spike': False, 'rsi_required': True, 'edge_k': 1.3416163884190542, 'edge_cap': 0.6147346303598046, 'bull_strategy': 'mean_reversion', 'bull_bb_std_mult': 1.830297955575324, 'bull_rsi_os': 12, 'bull_rsi_ob': 53, 'bull_adx_thresh': 22.908671191149914, 'bull_atr_min_pct': 0.022413865924048048, 'bull_atr_max_pct': 0.1361052491275048, 'bull_tp_mult': 1.3078260200451148, 'bull_tsl_mult': 0.6024880917074671, 'bull_time_stop': 226, 'bull_use_sma': False, 'bull_use_ema': False, 'bull_use_atr': True, 'bull_use_adx': True, 'bull_use_spike': False, 'bull_rsi_required': False, 'bear_strategy': 'mean_reversion', 'bear_bb_std_mult': 1.9268744261050474, 'bear_rsi_os': 5, 'bear_rsi_ob': 78, 'bear_adx_thresh': 12.594188966725534, 'bear_atr_min_pct': 0.021569360605645498, 'bear_atr_max_pct': 0.09000780391069342, 'bear_tp_mult': 2.247821121876097, 'bear_tsl_mult': 0.7684243912855373, 'bear_time_stop': 241, 'bear_use_sma': True, 'bear_use_ema': False, 'bear_use_atr': False, 'bear_use_adx': False, 'bear_use_spike': False, 'bear_rsi_required': False, 'sideways_strategy': 'breakout', 'sideways_bb_std_mult': 2.317820573273388, 'sideways_rsi_os': 21, 'sideways_rsi_ob': 49, 'sideways_adx_thresh': 26.649618654889686, 'sideways_atr_min_pct': 0.005494822560138701, 'sideways_atr_max_pct': 0.1346369916416121, 'sideways_tp_mult': 1.462176493161009, 'sideways_tsl_mult': 0.3658006240969639, 'sideways_time_stop': 109, 'sideways_use_sma': True, 'sideways_use_ema': True, 'sideways_use_atr': False, 'sideways_use_adx': False, 'sideways_use_spike': False, 'sideways_rsi_required': True}.
[I 2025-08-30 16:13:24,417] Trial 328 finished with values: [-1000000000.0, 1000000000.0] and parameters: {'p_sma': 9, 'p_std': 58, 'p_atr': 27, 'p_adx': 23, 'rsi_period': 18, 'ema1': 14, 'ema2': 12, 'slip_atr_k': 0.2059208027002668, 'slip_spread_k': 0.6793286841354882, 'spread_hl_frac': 0.019226495981156187, 'bb_std_mult': 2.2972512528558333, 'rsi_os': 36, 'rsi_ob': 92, 'vol_spike': 1.3740704223734273e-05, 'adx_thresh': 12.369083593090945, 'atr_min_pct': 0.019609524914530087, 'atr_max_pct': 0.07145410425153222, 'tp_mult': 2.778372275038204, 'tsl_mult': 0.5066860420314564, 'strategy': 'mean_reversion', 'time_stop': 24, 'use_sma': False, 'use_atr': False, 'use_adx': True, 'use_ema': False, 'use_spike': False, 'rsi_required': True, 'edge_k': 1.4157193816872062, 'edge_cap': 0.6113850917308662, 'bull_strategy': 'mean_reversion', 'bull_bb_std_mult': 1.833836289743774, 'bull_rsi_os': 12, 'bull_rsi_ob': 50, 'bull_adx_thresh': 22.87565832656127, 'bull_atr_min_pct': 0.02176153871805655, 'bull_atr_max_pct': 0.14241158642846963, 'bull_tp_mult': 1.4593398968257616, 'bull_tsl_mult': 0.6137496920234625, 'bull_time_stop': 74, 'bull_use_sma': False, 'bull_use_ema': False, 'bull_use_atr': True, 'bull_use_adx': True, 'bull_use_spike': False, 'bull_rsi_required': False, 'bear_strategy': 'mean_reversion', 'bear_bb_std_mult': 1.9951817926383038, 'bear_rsi_os': 32, 'bear_rsi_ob': 78, 'bear_adx_thresh': 12.797095688648865, 'bear_atr_min_pct': 0.021575902446159183, 'bear_atr_max_pct': 0.08970871010864775, 'bear_tp_mult': 2.2516138453983623, 'bear_tsl_mult': 0.9969538124455203, 'bear_time_stop': 240, 'bear_use_sma': True, 'bear_use_ema': False, 'bear_use_atr': False, 'bear_use_adx': False, 'bear_use_spike': False, 'bear_rsi_required': False, 'sideways_strategy': 'breakout', 'sideways_bb_std_mult': 1.9597155530379053, 'sideways_rsi_os': 21, 'sideways_rsi_ob': 78, 'sideways_adx_thresh': 28.157820070034717, 'sideways_atr_min_pct': 0.02108088963660046, 'sideways_atr_max_pct': 0.10669775075186311, 'sideways_tp_mult': 1.5246681661852306, 'sideways_tsl_mult': 0.4442585276980031, 'sideways_time_stop': 209, 'sideways_use_sma': True, 'sideways_use_ema': True, 'sideways_use_atr': False, 'sideways_use_adx': False, 'sideways_use_spike': False, 'sideways_rsi_required': True}.
[I 2025-08-30 16:13:25,102] Trial 329 finished with values: [-1000000000.0, 1000000000.0] and parameters: {'p_sma': 10, 'p_std': 55, 'p_atr': 27, 'p_adx': 23, 'rsi_period': 22, 'ema1': 14, 'ema2': 12, 'slip_atr_k': 0.0875906684022979, 'slip_spread_k': 0.6125417502769718, 'spread_hl_frac': 0.021040353791033917, 'bb_std_mult': 2.2771110479503283, 'rsi_os': 36, 'rsi_ob': 93, 'vol_spike': 0.17388098396853485, 'adx_thresh': 13.500931240298822, 'atr_min_pct': 0.016814147950810723, 'atr_max_pct': 0.02163728054918962, 'tp_mult': 2.3854811328311354, 'tsl_mult': 0.505230572414495, 'strategy': 'mean_reversion', 'time_stop': 26, 'use_sma': False, 'use_atr': False, 'use_adx': True, 'use_ema': False, 'use_spike': False, 'rsi_required': True, 'edge_k': 1.3776041184555083, 'edge_cap': 0.6164564888910959, 'bull_strategy': 'mean_reversion', 'bull_bb_std_mult': 1.165864758618654, 'bull_rsi_os': 14, 'bull_rsi_ob': 50, 'bull_adx_thresh': 22.54180801355992, 'bull_atr_min_pct': 0.01973234539849159, 'bull_atr_max_pct': 0.14279674646771412, 'bull_tp_mult': 1.249480610349598, 'bull_tsl_mult': 0.7090078443475822, 'bull_time_stop': 237, 'bull_use_sma': False, 'bull_use_ema': False, 'bull_use_atr': True, 'bull_use_adx': True, 'bull_use_spike': False, 'bull_rsi_required': False, 'bear_strategy': 'mean_reversion', 'bear_bb_std_mult': 2.0042532452483472, 'bear_rsi_os': 32, 'bear_rsi_ob': 75, 'bear_adx_thresh': 9.314283156896087, 'bear_atr_min_pct': 0.020663344093736966, 'bear_atr_max_pct': 0.09168082646611234, 'bear_tp_mult': 2.198768208192827, 'bear_tsl_mult': 0.24417394079165106, 'bear_time_stop': 210, 'bear_use_sma': True, 'bear_use_ema': False, 'bear_use_atr': False, 'bear_use_adx': False, 'bear_use_spike': False, 'bear_rsi_required': False, 'sideways_strategy': 'breakout', 'sideways_bb_std_mult': 1.801021525602941, 'sideways_rsi_os': 39, 'sideways_rsi_ob': 89, 'sideways_adx_thresh': 31.343343445726838, 'sideways_atr_min_pct': 0.011891210996419894, 'sideways_atr_max_pct': 0.10799931751578008, 'sideways_tp_mult': 1.4015910615229823, 'sideways_tsl_mult': 0.48775034794449246, 'sideways_time_stop': 193, 'sideways_use_sma': True, 'sideways_use_ema': True, 'sideways_use_atr': False, 'sideways_use_adx': False, 'sideways_use_spike': False, 'sideways_rsi_required': True}.
[I 2025-08-30 16:13:25,328] Trial 326 finished with values: [-1000000000.0, 1000000000.0] and parameters: {'p_sma': 9, 'p_std': 49, 'p_atr': 21, 'p_adx': 24, 'rsi_period': 18, 'ema1': 11, 'ema2': 45, 'slip_atr_k': 0.06051875004804991, 'slip_spread_k': 0.6146546498258686, 'spread_hl_frac': 0.01574052496832966, 'bb_std_mult': 3.268029200209724, 'rsi_os': 32, 'rsi_ob': 93, 'vol_spike': 0.09599344704809085, 'adx_thresh': 12.650210005102746, 'atr_min_pct': 0.01579693314139536, 'atr_max_pct': 0.1339043709950003, 'tp_mult': 2.9647359206247157, 'tsl_mult': 0.4261229822305449, 'strategy': 'mean_reversion', 'time_stop': 24, 'use_sma': False, 'use_atr': False, 'use_adx': True, 'use_ema': False, 'use_spike': False, 'rsi_required': True, 'edge_k': 1.7460233226300437, 'edge_cap': 0.788105977580834, 'bull_strategy': 'mean_reversion', 'bull_bb_std_mult': 1.8391113035849036, 'bull_rsi_os': 17, 'bull_rsi_ob': 53, 'bull_adx_thresh': 19.22637449393649, 'bull_atr_min_pct': 0.022324548758136636, 'bull_atr_max_pct': 0.13413803918427622, 'bull_tp_mult': 1.4535517107215796, 'bull_tsl_mult': 0.599382828693968, 'bull_time_stop': 77, 'bull_use_sma': False, 'bull_use_ema': False, 'bull_use_atr': True, 'bull_use_adx': True, 'bull_use_spike': False, 'bull_rsi_required': False, 'bear_strategy': 'mean_reversion', 'bear_bb_std_mult': 1.938449380010621, 'bear_rsi_os': 34, 'bear_rsi_ob': 78, 'bear_adx_thresh': 31.44025733785859, 'bear_atr_min_pct': 0.023254225273758027, 'bear_atr_max_pct': 0.09009420481141524, 'bear_tp_mult': 1.473927580338582, 'bear_tsl_mult': 0.6730142246766588, 'bear_time_stop': 207, 'bear_use_sma': True, 'bear_use_ema': False, 'bear_use_atr': False, 'bear_use_adx': False, 'bear_use_spike': False, 'bear_rsi_required': False, 'sideways_strategy': 'breakout', 'sideways_bb_std_mult': 1.9786552854211208, 'sideways_rsi_os': 25, 'sideways_rsi_ob': 92, 'sideways_adx_thresh': 27.897199251247816, 'sideways_atr_min_pct': 0.004992905068944009, 'sideways_atr_max_pct': 0.11568124112484579, 'sideways_tp_mult': 1.407515072804121, 'sideways_tsl_mult': 0.5641283075631554, 'sideways_time_stop': 194, 'sideways_use_sma': True, 'sideways_use_ema': True, 'sideways_use_atr': False, 'sideways_use_adx': False, 'sideways_use_spike': False, 'sideways_rsi_required': True}.
[I 2025-08-30 16:13:25,550] Trial 327 finished with values: [-1000000000.0, 1000000000.0] and parameters: {'p_sma': 9, 'p_std': 45, 'p_atr': 21, 'p_adx': 24, 'rsi_period': 18, 'ema1': 14, 'ema2': 45, 'slip_atr_k': 0.057059703191292124, 'slip_spread_k': 0.5835434144614267, 'spread_hl_frac': 0.018807353730554022, 'bb_std_mult': 3.2712161870408454, 'rsi_os': 29, 'rsi_ob': 91, 'vol_spike': 0.17480797409076312, 'adx_thresh': 12.347597351876955, 'atr_min_pct': 0.016835011273707214, 'atr_max_pct': 0.13622236883453168, 'tp_mult': 2.803560489182888, 'tsl_mult': 0.4448695720032962, 'strategy': 'mean_reversion', 'time_stop': 22, 'use_sma': False, 'use_atr': False, 'use_adx': True, 'use_ema': False, 'use_spike': False, 'rsi_required': True, 'edge_k': 1.3866305715140022, 'edge_cap': 0.6107824348956803, 'bull_strategy': 'mean_reversion', 'bull_bb_std_mult': 1.8331355760509058, 'bull_rsi_os': 11, 'bull_rsi_ob': 53, 'bull_adx_thresh': 19.23204238308382, 'bull_atr_min_pct': 0.022611357565082986, 'bull_atr_max_pct': 0.14346186578348227, 'bull_tp_mult': 1.3068768683573737, 'bull_tsl_mult': 0.30400199020038765, 'bull_time_stop': 240, 'bull_use_sma': False, 'bull_use_ema': False, 'bull_use_atr': True, 'bull_use_adx': True, 'bull_use_spike': False, 'bull_rsi_required': False, 'bear_strategy': 'mean_reversion', 'bear_bb_std_mult': 2.1212494725149, 'bear_rsi_os': 11, 'bear_rsi_ob': 75, 'bear_adx_thresh': 12.710741585902625, 'bear_atr_min_pct': 0.02339482900171009, 'bear_atr_max_pct': 0.13258441820220798, 'bear_tp_mult': 1.4571280298094642, 'bear_tsl_mult': 0.9957510267551895, 'bear_time_stop': 203, 'bear_use_sma': True, 'bear_use_ema': False, 'bear_use_atr': False, 'bear_use_adx': False, 'bear_use_spike': False, 'bear_rsi_required': False, 'sideways_strategy': 'breakout', 'sideways_bb_std_mult': 1.8569704930790072, 'sideways_rsi_os': 29, 'sideways_rsi_ob': 92, 'sideways_adx_thresh': 22.500159334511103, 'sideways_atr_min_pct': 0.005112698956706074, 'sideways_atr_max_pct': 0.11842219021241651, 'sideways_tp_mult': 1.508214165985299, 'sideways_tsl_mult': 0.0002985457734174246, 'sideways_time_stop': 192, 'sideways_use_sma': True, 'sideways_use_ema': True, 'sideways_use_atr': False, 'sideways_use_adx': False, 'sideways_use_spike': False, 'sideways_rsi_required': True}.
[I 2025-08-30 16:13:26,253] Trial 331 finished with values: [-1000000000.0, 1000000000.0] and parameters: {'p_sma': 7, 'p_std': 48, 'p_atr': 10, 'p_adx': 24, 'rsi_period': 21, 'ema1': 24, 'ema2': 13, 'slip_atr_k': 0.1334846886129891, 'slip_spread_k': 0.15540550921353563, 'spread_hl_frac': 0.018115472345937376, 'bb_std_mult': 0.7467367628780903, 'rsi_os': 20, 'rsi_ob': 90, 'vol_spike': 0.014169942966603044, 'adx_thresh': 11.388525873459072, 'atr_min_pct': 0.01820525067836762, 'atr_max_pct': 0.01020760311536123, 'tp_mult': 2.940794076562187, 'tsl_mult': 0.9076294872074329, 'strategy': 'mean_reversion', 'time_stop': 75, 'use_sma': False, 'use_atr': True, 'use_adx': True, 'use_ema': False, 'use_spike': False, 'rsi_required': True, 'edge_k': 1.6418314338304547, 'edge_cap': 0.7871706222313972, 'bull_strategy': 'mean_reversion', 'bull_bb_std_mult': 2.6019252152242984, 'bull_rsi_os': 53, 'bull_rsi_ob': 51, 'bull_adx_thresh': 6.981723579224802, 'bull_atr_min_pct': 0.01754928375210837, 'bull_atr_max_pct': 0.08869305656441549, 'bull_tp_mult': 2.740235799315493, 'bull_tsl_mult': 0.1651992416239692, 'bull_time_stop': 117, 'bull_use_sma': False, 'bull_use_ema': True, 'bull_use_atr': True, 'bull_use_adx': True, 'bull_use_spike': False, 'bull_rsi_required': False, 'bear_strategy': 'mean_reversion', 'bear_bb_std_mult': 2.071413936678079, 'bear_rsi_os': 13, 'bear_rsi_ob': 79, 'bear_adx_thresh': 14.332448296282724, 'bear_atr_min_pct': 0.0062529617304473446, 'bear_atr_max_pct': 0.09238380175264883, 'bear_tp_mult': 1.441107253001248, 'bear_tsl_mult': 0.6115132365829063, 'bear_time_stop': 218, 'bear_use_sma': True, 'bear_use_ema': False, 'bear_use_atr': False, 'bear_use_adx': False, 'bear_use_spike': False, 'bear_rsi_required': False, 'sideways_strategy': 'breakout', 'sideways_bb_std_mult': 2.0428644709788846, 'sideways_rsi_os': 29, 'sideways_rsi_ob': 90, 'sideways_adx_thresh': 16.92447623656368, 'sideways_atr_min_pct': 0.00466234350916538, 'sideways_atr_max_pct': 0.1409365376810982, 'sideways_tp_mult': 1.4081046741456693, 'sideways_tsl_mult': 0.44763320987741445, 'sideways_time_stop': 86, 'sideways_use_sma': False, 'sideways_use_ema': False, 'sideways_use_atr': False, 'sideways_use_adx': False, 'sideways_use_spike': False, 'sideways_rsi_required': True}.
[I 2025-08-30 16:13:26,520] Trial 334 finished with values: [-1000000000.0, 1000000000.0] and parameters: {'p_sma': 7, 'p_std': 57, 'p_atr': 19, 'p_adx': 26, 'rsi_period': 24, 'ema1': 26, 'ema2': 10, 'slip_atr_k': 0.013189016415383068, 'slip_spread_k': 0.5626820977344376, 'spread_hl_frac': 0.015638160764702615, 'bb_std_mult': 3.037192799565337, 'rsi_os': 13, 'rsi_ob': 47, 'vol_spike': 0.006143540354888444, 'adx_thresh': 30.897807296471314, 'atr_min_pct': 0.017678370182819803, 'atr_max_pct': 0.09030618679999168, 'tp_mult': 2.4778720959353686, 'tsl_mult': 0.10279500051382057, 'strategy': 'mean_reversion', 'time_stop': 11, 'use_sma': False, 'use_atr': True, 'use_adx': True, 'use_ema': False, 'use_spike': False, 'rsi_required': True, 'edge_k': 0.9248847139850352, 'edge_cap': 0.6552967586694735, 'bull_strategy': 'mean_reversion', 'bull_bb_std_mult': 1.9425470897658534, 'bull_rsi_os': 9, 'bull_rsi_ob': 48, 'bull_adx_thresh': 21.28868721236179, 'bull_atr_min_pct': 0.019624820453032495, 'bull_atr_max_pct': 0.13979656018911338, 'bull_tp_mult': 1.228988297446931, 'bull_tsl_mult': 0.28221931844342624, 'bull_time_stop': 67, 'bull_use_sma': False, 'bull_use_ema': True, 'bull_use_atr': True, 'bull_use_adx': True, 'bull_use_spike': True, 'bull_rsi_required': False, 'bear_strategy': 'mean_reversion', 'bear_bb_std_mult': 2.1604616513764885, 'bear_rsi_os': 27, 'bear_rsi_ob': 47, 'bear_adx_thresh': 13.26540695262159, 'bear_atr_min_pct': 0.02190270581976585, 'bear_atr_max_pct': 0.010621078456648655, 'bear_tp_mult': 1.125655056763711, 'bear_tsl_mult': 0.6410484861056361, 'bear_time_stop': 217, 'bear_use_sma': True, 'bear_use_ema': False, 'bear_use_atr': False, 'bear_use_adx': False, 'bear_use_spike': False, 'bear_rsi_required': False, 'sideways_strategy': 'mean_reversion', 'sideways_bb_std_mult': 3.5391392572486478, 'sideways_rsi_os': 27, 'sideways_rsi_ob': 95, 'sideways_adx_thresh': 12.090754654501138, 'sideways_atr_min_pct': 0.0013360598205765656, 'sideways_atr_max_pct': 0.12288472637810448, 'sideways_tp_mult': 1.3402550797227664, 'sideways_tsl_mult': 0.4903921051720251, 'sideways_time_stop': 201, 'sideways_use_sma': True, 'sideways_use_ema': False, 'sideways_use_atr': False, 'sideways_use_adx': False, 'sideways_use_spike': True, 'sideways_rsi_required': True}.
[I 2025-08-30 16:14:11,732] Trial 333 finished with values: [-1000000000.0, 1000000000.0] and parameters: {'p_sma': 7, 'p_std': 57, 'p_atr': 18, 'p_adx': 20, 'rsi_period': 20, 'ema1': 24, 'ema2': 13, 'slip_atr_k': 0.011540424801626202, 'slip_spread_k': 0.8150599986955367, 'spread_hl_frac': 0.006547662983584567, 'bb_std_mult': 3.047235871117265, 'rsi_os': 35, 'rsi_ob': 90, 'vol_spike': 0.19573753378668277, 'adx_thresh': 11.462732223022492, 'atr_min_pct': 0.0009101315274858777, 'atr_max_pct': 0.01487301832125533, 'tp_mult': 2.5051882127074245, 'tsl_mult': 0.9811885340835286, 'strategy': 'mean_reversion', 'time_stop': 10, 'use_sma': False, 'use_atr': True, 'use_adx': True, 'use_ema': False, 'use_spike': False, 'rsi_required': True, 'edge_k': 1.2675216083720375, 'edge_cap': 0.6518782124497523, 'bull_strategy': 'mean_reversion', 'bull_bb_std_mult': 2.596089377553962, 'bull_rsi_os': 8, 'bull_rsi_ob': 51, 'bull_adx_thresh': 21.406627696090144, 'bull_atr_min_pct': 0.02798872188288406, 'bull_atr_max_pct': 0.13841308616053097, 'bull_tp_mult': 1.2227724210211952, 'bull_tsl_mult': 0.28327459065036875, 'bull_time_stop': 117, 'bull_use_sma': False, 'bull_use_ema': True, 'bull_use_atr': True, 'bull_use_adx': True, 'bull_use_spike': True, 'bull_rsi_required': False, 'bear_strategy': 'mean_reversion', 'bear_bb_std_mult': 2.0687281687833323, 'bear_rsi_os': 27, 'bear_rsi_ob': 79, 'bear_adx_thresh': 13.974070637107408, 'bear_atr_min_pct': 0.0062197746214919854, 'bear_atr_max_pct': 0.09352854830104132, 'bear_tp_mult': 2.954964899857749, 'bear_tsl_mult': 0.6156263407489572, 'bear_time_stop': 217, 'bear_use_sma': True, 'bear_use_ema': False, 'bear_use_atr': False, 'bear_use_adx': False, 'bear_use_spike': False, 'bear_rsi_required': False, 'sideways_strategy': 'mean_reversion', 'sideways_bb_std_mult': 3.542883245416381, 'sideways_rsi_os': 27, 'sideways_rsi_ob': 90, 'sideways_adx_thresh': 17.007549140531808, 'sideways_atr_min_pct': 0.01446363499024, 'sideways_atr_max_pct': 0.14117747941460929, 'sideways_tp_mult': 1.0129590017708439, 'sideways_tsl_mult': 0.44770623907221974, 'sideways_time_stop': 212, 'sideways_use_sma': False, 'sideways_use_ema': False, 'sideways_use_atr': False, 'sideways_use_adx': False, 'sideways_use_spike': True, 'sideways_rsi_required': True}.
