[I 2025-08-30 16:31:08,966] Trial 430 finished with values: [-1000000000.0, 1000000000.0] and parameters: {'p_sma': 9, 'p_std': 40, 'p_atr': 27, 'p_adx': 21, 'rsi_period': 42, 'ema1': 30, 'ema2': 44, 'slip_atr_k': 0.02955872996894486, 'slip_spread_k': 0.6086189146843592, 'spread_hl_frac': 0.031155186449361688, 'bb_std_mult': 2.8478323053789434, 'rsi_os': 32, 'rsi_ob': 70, 'vol_spike': 0.21967818158190816, 'adx_thresh': 11.761502959607974, 'atr_min_pct': 0.019099857581313114, 'atr_max_pct': 0.1426251473686167, 'tp_mult': 2.958096163607998, 'tsl_mult': 0.5189184161313236, 'strategy': 'mean_reversion', 'time_stop': 108, 'use_sma': False, 'use_atr': True, 'use_adx': True, 'use_ema': True, 'use_spike': False, 'rsi_required': True, 'edge_k': 1.43457840513823, 'edge_cap': 0.2983530429708048, 'bull_strategy': 'mean_reversion', 'bull_bb_std_mult': 1.9008073074225305, 'bull_rsi_os': 9, 'bull_rsi_ob': 62, 'bull_adx_thresh': 22.174780633957482, 'bull_atr_min_pct': 0.029254806286232768, 'bull_atr_max_pct': 0.027577347786019245, 'bull_tp_mult': 2.9978557298797464, 'bull_tsl_mult': 0.29248842076892073, 'bull_time_stop': 24, 'bull_use_sma': False, 'bull_use_ema': True, 'bull_use_atr': True, 'bull_use_adx': True, 'bull_use_spike': True, 'bull_rsi_required': False, 'bear_strategy': 'breakout', 'bear_bb_std_mult': 1.7542659479305631, 'bear_rsi_os': 25, 'bear_rsi_ob': 77, 'bear_adx_thresh': 15.487627070182654, 'bear_atr_min_pct': 0.015011313086082978, 'bear_atr_max_pct': 0.1396956722678918, 'bear_tp_mult': 2.279027086270761, 'bear_tsl_mult': 0.7184666141078543, 'bear_time_stop': 64, 'bear_use_sma': True, 'bear_use_ema': True, 'bear_use_atr': True, 'bear_use_adx': False, 'bear_use_spike': False, 'bear_rsi_required': False, 'sideways_strategy': 'breakout', 'sideways_bb_std_mult': 2.2938869761268634, 'sideways_rsi_os': 28, 'sideways_rsi_ob': 89, 'sideways_adx_thresh': 15.823697005068654, 'sideways_atr_min_pct': 0.0022320748821535483, 'sideways_atr_max_pct': 0.14493308393622328, 'sideways_tp_mult': 1.4644643387679706, 'sideways_tsl_mult': 0.2136541095292881, 'sideways_time_stop': 18, 'sideways_use_sma': True, 'sideways_use_ema': True, 'sideways_use_atr': False, 'sideways_use_adx': False, 'sideways_use_spike': False, 'sideways_rsi_required': False}.
[I 2025-08-30 16:31:09,294] Trial 431 finished with values: [-1000000000.0, 1000000000.0] and parameters: {'p_sma': 8, 'p_std': 58, 'p_atr': 27, 'p_adx': 21, 'rsi_period': 17, 'ema1': 30, 'ema2': 11, 'slip_atr_k': 0.21446840142863524, 'slip_spread_k': 0.604874099050286, 'spread_hl_frac': 0.005650418534918482, 'bb_std_mult': 2.6206193265884057, 'rsi_os': 32, 'rsi_ob': 68, 'vol_spike': 0.03664535572446212, 'adx_thresh': 11.708328843955861, 'atr_min_pct': 0.017512488250844813, 'atr_max_pct': 0.14389765518118902, 'tp_mult': 2.9772311322848037, 'tsl_mult': 0.0259499139053892, 'strategy': 'mean_reversion', 'time_stop': 16, 'use_sma': False, 'use_atr': True, 'use_adx': True, 'use_ema': True, 'use_spike': False, 'rsi_required': True, 'edge_k': 1.5722254109240559, 'edge_cap': 0.45827478988969206, 'bull_strategy': 'mean_reversion', 'bull_bb_std_mult': 1.9129821624827885, 'bull_rsi_os': 9, 'bull_rsi_ob': 46, 'bull_adx_thresh': 13.89674064767435, 'bull_atr_min_pct': 0.015169477372222137, 'bull_atr_max_pct': 0.14234505042879772, 'bull_tp_mult': 1.101667545493132, 'bull_tsl_mult': 0.28196892979059623, 'bull_time_stop': 77, 'bull_use_sma': False, 'bull_use_ema': True, 'bull_use_atr': True, 'bull_use_adx': True, 'bull_use_spike': True, 'bull_rsi_required': False, 'bear_strategy': 'breakout', 'bear_bb_std_mult': 2.0439601292881915, 'bear_rsi_os': 10, 'bear_rsi_ob': 77, 'bear_adx_thresh': 22.733911693989402, 'bear_atr_min_pct': 0.02022054679928435, 'bear_atr_max_pct': 0.11578241254443253, 'bear_tp_mult': 2.4323916181878724, 'bear_tsl_mult': 0.05624010368225629, 'bear_time_stop': 235, 'bear_use_sma': True, 'bear_use_ema': True, 'bear_use_atr': True, 'bear_use_adx': False, 'bear_use_spike': False, 'bear_rsi_required': False, 'sideways_strategy': 'breakout', 'sideways_bb_std_mult': 2.353509680298643, 'sideways_rsi_os': 30, 'sideways_rsi_ob': 89, 'sideways_adx_thresh': 6.763621524040428, 'sideways_atr_min_pct': 0.024959337977846045, 'sideways_atr_max_pct': 0.045744171939567556, 'sideways_tp_mult': 1.3148015159897442, 'sideways_tsl_mult': 0.4760124760678809, 'sideways_time_stop': 215, 'sideways_use_sma': True, 'sideways_use_ema': True, 'sideways_use_atr': False, 'sideways_use_adx': False, 'sideways_use_spike': False, 'sideways_rsi_required': False}.
[I 2025-08-30 16:31:50,506] Trial 436 finished with values: [-1000000000.0, 1000000000.0] and parameters: {'p_sma': 53, 'p_std': 58, 'p_atr': 24, 'p_adx': 29, 'rsi_period': 14, 'ema1': 9, 'ema2': 10, 'slip_atr_k': 0.0007517800324847715, 'slip_spread_k': 0.5923538992320252, 'spread_hl_frac': 0.017890739658871144, 'bb_std_mult': 3.1851804921768263, 'rsi_os': 36, 'rsi_ob': 66, 'vol_spike': 0.09934281942307452, 'adx_thresh': 14.17121444531561, 'atr_min_pct': 0.01800338275240366, 'atr_max_pct': 0.1350927752450634, 'tp_mult': 2.769048295332091, 'tsl_mult': 0.4455368680464677, 'strategy': 'mean_reversion', 'time_stop': 15, 'use_sma': False, 'use_atr': True, 'use_adx': True, 'use_ema': False, 'use_spike': False, 'rsi_required': True, 'edge_k': 1.6063916882272227, 'edge_cap': 0.6357951336663933, 'bull_strategy': 'mean_reversion', 'bull_bb_std_mult': 1.7699432109089128, 'bull_rsi_os': 14, 'bull_rsi_ob': 51, 'bull_adx_thresh': 26.510390224087146, 'bull_atr_min_pct': 0.021488794398143215, 'bull_atr_max_pct': 0.14356360125535, 'bull_tp_mult': 1.2916869737783938, 'bull_tsl_mult': 0.9538231090571867, 'bull_time_stop': 77, 'bull_use_sma': False, 'bull_use_ema': False, 'bull_use_atr': True, 'bull_use_adx': True, 'bull_use_spike': False, 'bull_rsi_required': False, 'bear_strategy': 'mean_reversion', 'bear_bb_std_mult': 1.993701691086651, 'bear_rsi_os': 10, 'bear_rsi_ob': 81, 'bear_adx_thresh': 14.090532728034995, 'bear_atr_min_pct': 0.01426722140739382, 'bear_atr_max_pct': 0.02807701828483191, 'bear_tp_mult': 2.0205052808458124, 'bear_tsl_mult': 0.6262749846906771, 'bear_time_stop': 242, 'bear_use_sma': True, 'bear_use_ema': False, 'bear_use_atr': False, 'bear_use_adx': False, 'bear_use_spike': False, 'bear_rsi_required': False, 'sideways_strategy': 'breakout', 'sideways_bb_std_mult': 2.7551147925826696, 'sideways_rsi_os': 30, 'sideways_rsi_ob': 92, 'sideways_adx_thresh': 14.903552535549883, 'sideways_atr_min_pct': 0.02484151295022325, 'sideways_atr_max_pct': 0.137424034584634, 'sideways_tp_mult': 1.0807251823139612, 'sideways_tsl_mult': 0.4438044306467863, 'sideways_time_stop': 48, 'sideways_use_sma': True, 'sideways_use_ema': False, 'sideways_use_atr': False, 'sideways_use_adx': False, 'sideways_use_spike': False, 'sideways_rsi_required': True}.
[I 2025-08-30 16:31:50,760] Trial 437 finished with values: [-1000000000.0, 1000000000.0] and parameters: {'p_sma': 48, 'p_std': 36, 'p_atr': 26, 'p_adx': 20, 'rsi_period': 67, 'ema1': 9, 'ema2': 10, 'slip_atr_k': 0.0006076410461765113, 'slip_spread_k': 0.5827146156191392, 'spread_hl_frac': 0.015023264219342934, 'bb_std_mult': 2.084713662314067, 'rsi_os': 35, 'rsi_ob': 57, 'vol_spike': 0.011446068601758817, 'adx_thresh': 32.99939601893191, 'atr_min_pct': 0.01826078660955883, 'atr_max_pct': 0.111026971157236, 'tp_mult': 2.760748841307131, 'tsl_mult': 0.259395382463689, 'strategy': 'mean_reversion', 'time_stop': 10, 'use_sma': True, 'use_atr': True, 'use_adx': True, 'use_ema': False, 'use_spike': False, 'rsi_required': True, 'edge_k': 1.6174499517895302, 'edge_cap': 0.6323555804928059, 'bull_strategy': 'mean_reversion', 'bull_bb_std_mult': 1.771932947198076, 'bull_rsi_os': 14, 'bull_rsi_ob': 51, 'bull_adx_thresh': 18.034771195765476, 'bull_atr_min_pct': 0.021362189113419063, 'bull_atr_max_pct': 0.14396253274053744, 'bull_tp_mult': 1.3755120254718705, 'bull_tsl_mult': 0.0690234753172978, 'bull_time_stop': 70, 'bull_use_sma': False, 'bull_use_ema': False, 'bull_use_atr': True, 'bull_use_adx': True, 'bull_use_spike': False, 'bull_rsi_required': False, 'bear_strategy': 'mean_reversion', 'bear_bb_std_mult': 1.3611838443324629, 'bear_rsi_os': 12, 'bear_rsi_ob': 76, 'bear_adx_thresh': 14.341108876553404, 'bear_atr_min_pct': 0.014275957883037682, 'bear_atr_max_pct': 0.09435538652592709, 'bear_tp_mult': 1.870495013997623, 'bear_tsl_mult': 0.6265602610098646, 'bear_time_stop': 226, 'bear_use_sma': True, 'bear_use_ema': False, 'bear_use_atr': False, 'bear_use_adx': True, 'bear_use_spike': False, 'bear_rsi_required': True, 'sideways_strategy': 'breakout', 'sideways_bb_std_mult': 2.1250257749547785, 'sideways_rsi_os': 27, 'sideways_rsi_ob': 83, 'sideways_adx_thresh': 14.949840315385766, 'sideways_atr_min_pct': 0.02268810289077157, 'sideways_atr_max_pct': 0.14972459455478598, 'sideways_tp_mult': 1.3955894345730198, 'sideways_tsl_mult': 0.4434691192432541, 'sideways_time_stop': 48, 'sideways_use_sma': True, 'sideways_use_ema': False, 'sideways_use_atr': False, 'sideways_use_adx': False, 'sideways_use_spike': False, 'sideways_rsi_required': True}.
[I 2025-08-30 16:31:52,044] Trial 435 finished with values: [-1000000000.0, 1000000000.0] and parameters: {'p_sma': 11, 'p_std': 36, 'p_atr': 26, 'p_adx': 26, 'rsi_period': 19, 'ema1': 16, 'ema2': 53, 'slip_atr_k': 0.009907760465860525, 'slip_spread_k': 0.2306694328179632, 'spread_hl_frac': 0.015337712986274708, 'bb_std_mult': 3.305709539855919, 'rsi_os': 35, 'rsi_ob': 62, 'vol_spike': 0.14505113291426963, 'adx_thresh': 14.109029320102172, 'atr_min_pct': 0.018948819821187873, 'atr_max_pct': 0.13675383988034628, 'tp_mult': 2.7521194386841925, 'tsl_mult': 0.5200869410386685, 'strategy': 'mean_reversion', 'time_stop': 5, 'use_sma': False, 'use_atr': True, 'use_adx': True, 'use_ema': False, 'use_spike': False, 'rsi_required': True, 'edge_k': 1.4451952646036168, 'edge_cap': 0.36296819554971743, 'bull_strategy': 'mean_reversion', 'bull_bb_std_mult': 1.82035546055769, 'bull_rsi_os': 19, 'bull_rsi_ob': 59, 'bull_adx_thresh': 21.84507322747408, 'bull_atr_min_pct': 0.009973555372700066, 'bull_atr_max_pct': 0.03931034524871232, 'bull_tp_mult': 1.7343289330897484, 'bull_tsl_mult': 0.26603105056536486, 'bull_time_stop': 69, 'bull_use_sma': False, 'bull_use_ema': True, 'bull_use_atr': True, 'bull_use_adx': True, 'bull_use_spike': True, 'bull_rsi_required': False, 'bear_strategy': 'mean_reversion', 'bear_bb_std_mult': 1.5890327737157688, 'bear_rsi_os': 10, 'bear_rsi_ob': 49, 'bear_adx_thresh': 15.632336303825138, 'bear_atr_min_pct': 0.0030951009896382376, 'bear_atr_max_pct': 0.09472577920494761, 'bear_tp_mult': 2.4408629962714765, 'bear_tsl_mult': 0.6252431430350828, 'bear_time_stop': 243, 'bear_use_sma': True, 'bear_use_ema': False, 'bear_use_atr': False, 'bear_use_adx': False, 'bear_use_spike': False, 'bear_rsi_required': False, 'sideways_strategy': 'breakout', 'sideways_bb_std_mult': 0.5639959129628485, 'sideways_rsi_os': 7, 'sideways_rsi_ob': 90, 'sideways_adx_thresh': 27.435414755626503, 'sideways_atr_min_pct': 0.02458012816994186, 'sideways_atr_max_pct': 0.05719957471464208, 'sideways_tp_mult': 1.0567129463534792, 'sideways_tsl_mult': 0.44967287211321794, 'sideways_time_stop': 216, 'sideways_use_sma': True, 'sideways_use_ema': False, 'sideways_use_atr': False, 'sideways_use_adx': False, 'sideways_use_spike': False, 'sideways_rsi_required': True}.
[I 2025-08-30 16:31:52,362] Trial 434 finished with values: [-1000000000.0, 1000000000.0] and parameters: {'p_sma': 48, 'p_std': 35, 'p_atr': 24, 'p_adx': 21, 'rsi_period': 67, 'ema1': 30, 'ema2': 51, 'slip_atr_k': 0.008924553219174626, 'slip_spread_k': 0.5843696533503941, 'spread_hl_frac': 0.015246881655941728, 'bb_std_mult': 2.8309865465204282, 'rsi_os': 35, 'rsi_ob': 70, 'vol_spike': 0.03824899107182528, 'adx_thresh': 14.17220813538288, 'atr_min_pct': 0.01904842755566749, 'atr_max_pct': 0.09791480331282255, 'tp_mult': 2.8531669908475736, 'tsl_mult': 0.5656866086994503, 'strategy': 'mean_reversion', 'time_stop': 131, 'use_sma': False, 'use_atr': True, 'use_adx': True, 'use_ema': True, 'use_spike': False, 'rsi_required': True, 'edge_k': 1.4444684175846456, 'edge_cap': 0.050275633809829245, 'bull_strategy': 'mean_reversion', 'bull_bb_std_mult': 1.868350964647641, 'bull_rsi_os': 14, 'bull_rsi_ob': 88, 'bull_adx_thresh': 24.213543882442387, 'bull_atr_min_pct': 0.029349137003965707, 'bull_atr_max_pct': 0.13866643910782447, 'bull_tp_mult': 1.2951475161427046, 'bull_tsl_mult': 0.6214961534501215, 'bull_time_stop': 160, 'bull_use_sma': False, 'bull_use_ema': True, 'bull_use_atr': True, 'bull_use_adx': True, 'bull_use_spike': False, 'bull_rsi_required': False, 'bear_strategy': 'breakout', 'bear_bb_std_mult': 2.0280900988082697, 'bear_rsi_os': 43, 'bear_rsi_ob': 55, 'bear_adx_thresh': 15.455468703615583, 'bear_atr_min_pct': 0.014420360382268484, 'bear_atr_max_pct': 0.08568186476423632, 'bear_tp_mult': 2.0226121495445537, 'bear_tsl_mult': 0.7271266404242209, 'bear_time_stop': 19, 'bear_use_sma': True, 'bear_use_ema': False, 'bear_use_atr': False, 'bear_use_adx': False, 'bear_use_spike': False, 'bear_rsi_required': False, 'sideways_strategy': 'breakout', 'sideways_bb_std_mult': 2.234819441896064, 'sideways_rsi_os': 28, 'sideways_rsi_ob': 92, 'sideways_adx_thresh': 16.006160124161163, 'sideways_atr_min_pct': 0.018249319969748122, 'sideways_atr_max_pct': 0.01655638684273883, 'sideways_tp_mult': 1.3140655295457022, 'sideways_tsl_mult': 0.4440529330854171, 'sideways_time_stop': 18, 'sideways_use_sma': True, 'sideways_use_ema': True, 'sideways_use_atr': False, 'sideways_use_adx': False, 'sideways_use_spike': False, 'sideways_rsi_required': True}.
[I 2025-08-30 16:31:53,115] Trial 439 finished with values: [-1000000000.0, 1000000000.0] and parameters: {'p_sma': 11, 'p_std': 5, 'p_atr': 16, 'p_adx': 26, 'rsi_period': 20, 'ema1': 28, 'ema2': 13, 'slip_atr_k': 0.07910871423097443, 'slip_spread_k': 0.22871259859277615, 'spread_hl_frac': 0.01583913240431454, 'bb_std_mult': 0.703923784177978, 'rsi_os': 24, 'rsi_ob': 89, 'vol_spike': 0.004422054815722817, 'adx_thresh': 13.036187311109133, 'atr_min_pct': 0.019063468243740465, 'atr_max_pct': 0.01669227304886413, 'tp_mult': 1.4681434394679802, 'tsl_mult': 0.2928805371808101, 'strategy': 'mean_reversion', 'time_stop': 5, 'use_sma': False, 'use_atr': True, 'use_adx': True, 'use_ema': False, 'use_spike': False, 'rsi_required': True, 'edge_k': 1.7978844479127938, 'edge_cap': 0.520560263722819, 'bull_strategy': 'mean_reversion', 'bull_bb_std_mult': 1.831621978407294, 'bull_rsi_os': 13, 'bull_rsi_ob': 57, 'bull_adx_thresh': 24.262124413146122, 'bull_atr_min_pct': 0.02865455742768104, 'bull_atr_max_pct': 0.1389570132771506, 'bull_tp_mult': 1.1929326065679204, 'bull_tsl_mult': 0.25469765416362034, 'bull_time_stop': 214, 'bull_use_sma': False, 'bull_use_ema': True, 'bull_use_atr': True, 'bull_use_adx': True, 'bull_use_spike': False, 'bull_rsi_required': False, 'bear_strategy': 'mean_reversion', 'bear_bb_std_mult': 2.228117355615864, 'bear_rsi_os': 43, 'bear_rsi_ob': 76, 'bear_adx_thresh': 30.86143167536097, 'bear_atr_min_pct': 0.0032757563649334475, 'bear_atr_max_pct': 0.08530818973964842, 'bear_tp_mult': 2.1640020528292427, 'bear_tsl_mult': 0.08503549889286355, 'bear_time_stop': 13, 'bear_use_sma': True, 'bear_use_ema': False, 'bear_use_atr': False, 'bear_use_adx': False, 'bear_use_spike': False, 'bear_rsi_required': False, 'sideways_strategy': 'breakout', 'sideways_bb_std_mult': 1.999314950326651, 'sideways_rsi_os': 22, 'sideways_rsi_ob': 60, 'sideways_adx_thresh': 27.58048694361308, 'sideways_atr_min_pct': 0.01939472228652609, 'sideways_atr_max_pct': 0.08372421199857047, 'sideways_tp_mult': 2.3518195064878338, 'sideways_tsl_mult': 0.5002222362364148, 'sideways_time_stop': 266, 'sideways_use_sma': False, 'sideways_use_ema': False, 'sideways_use_atr': False, 'sideways_use_adx': False, 'sideways_use_spike': False, 'sideways_rsi_required': True}.
[I 2025-08-30 16:31:53,286] Trial 441 finished with values: [-1000000000.0, 1000000000.0] and parameters: {'p_sma': 6, 'p_std': 5, 'p_atr': 19, 'p_adx': 26, 'rsi_period': 20, 'ema1': 6, 'ema2': 13, 'slip_atr_k': 0.1519106134625864, 'slip_spread_k': 0.9149476059870659, 'spread_hl_frac': 0.01835276031171293, 'bb_std_mult': 3.180438827513065, 'rsi_os': 24, 'rsi_ob': 89, 'vol_spike': 0.0043862490774850505, 'adx_thresh': 13.214421032574931, 'atr_min_pct': 0.011486938675021945, 'atr_max_pct': 0.010057083687708981, 'tp_mult': 1.4742807826213924, 'tsl_mult': 0.38555203319697895, 'strategy': 'mean_reversion', 'time_stop': 290, 'use_sma': True, 'use_atr': False, 'use_adx': True, 'use_ema': False, 'use_spike': False, 'rsi_required': True, 'edge_k': 1.4949579777350168, 'edge_cap': 0.742851136670764, 'bull_strategy': 'mean_reversion', 'bull_bb_std_mult': 1.9734658501160567, 'bull_rsi_os': 13, 'bull_rsi_ob': 49, 'bull_adx_thresh': 19.51009891906231, 'bull_atr_min_pct': 0.02520307803401054, 'bull_atr_max_pct': 0.12981577430902183, 'bull_tp_mult': 1.7948223297951533, 'bull_tsl_mult': 0.3373078113957989, 'bull_time_stop': 256, 'bull_use_sma': False, 'bull_use_ema': True, 'bull_use_atr': True, 'bull_use_adx': True, 'bull_use_spike': False, 'bull_rsi_required': False, 'bear_strategy': 'mean_reversion', 'bear_bb_std_mult': 2.246320599120831, 'bear_rsi_os': 14, 'bear_rsi_ob': 53, 'bear_adx_thresh': 27.841900220489816, 'bear_atr_min_pct': 0.021309075627002325, 'bear_atr_max_pct': 0.090828215379653, 'bear_tp_mult': 2.1750281813324785, 'bear_tsl_mult': 0.08942124743215096, 'bear_time_stop': 213, 'bear_use_sma': True, 'bear_use_ema': False, 'bear_use_atr': False, 'bear_use_adx': True, 'bear_use_spike': False, 'bear_rsi_required': True, 'sideways_strategy': 'mean_reversion', 'sideways_bb_std_mult': 0.8058111165618296, 'sideways_rsi_os': 26, 'sideways_rsi_ob': 91, 'sideways_adx_thresh': 19.223902109772517, 'sideways_atr_min_pct': 0.0036512245943690277, 'sideways_atr_max_pct': 0.101017637206946, 'sideways_tp_mult': 1.438627449069408, 'sideways_tsl_mult': 0.494841376188415, 'sideways_time_stop': 230, 'sideways_use_sma': False, 'sideways_use_ema': False, 'sideways_use_atr': False, 'sideways_use_adx': False, 'sideways_use_spike': True, 'sideways_rsi_required': True}.
[I 2025-08-30 16:32:32,036] Trial 440 finished with values: [-1000000000.0, 1000000000.0] and parameters: {'p_sma': 51, 'p_std': 60, 'p_atr': 24, 'p_adx': 11, 'rsi_period': 21, 'ema1': 14, 'ema2': 13, 'slip_atr_k': 0.08039030459647169, 'slip_spread_k': 0.7724028376782264, 'spread_hl_frac': 0.016167600746593725, 'bb_std_mult': 3.119222481275884, 'rsi_os': 37, 'rsi_ob': 89, 'vol_spike': 0.11493281224798049, 'adx_thresh': 12.99123957442005, 'atr_min_pct': 0.019402092930123297, 'atr_max_pct': 0.1327260147866104, 'tp_mult': 2.855658594024083, 'tsl_mult': 0.8487945723834627, 'strategy': 'mean_reversion', 'time_stop': 30, 'use_sma': True, 'use_atr': True, 'use_adx': True, 'use_ema': False, 'use_spike': False, 'rsi_required': True, 'edge_k': 1.4905013917275463, 'edge_cap': 0.5996003061963434, 'bull_strategy': 'mean_reversion', 'bull_bb_std_mult': 0.5022794906375998, 'bull_rsi_os': 13, 'bull_rsi_ob': 67, 'bull_adx_thresh': 22.943424758404003, 'bull_atr_min_pct': 0.022585696378738956, 'bull_atr_max_pct': 0.138847934537692, 'bull_tp_mult': 2.196147723462058, 'bull_tsl_mult': 0.6235157940135351, 'bull_time_stop': 113, 'bull_use_sma': False, 'bull_use_ema': True, 'bull_use_atr': True, 'bull_use_adx': True, 'bull_use_spike': False, 'bull_rsi_required': False, 'bear_strategy': 'mean_reversion', 'bear_bb_std_mult': 1.5239556620083181, 'bear_rsi_os': 44, 'bear_rsi_ob': 70, 'bear_adx_thresh': 12.951363915473488, 'bear_atr_min_pct': 0.02108100929271033, 'bear_atr_max_pct': 0.08499782821568036, 'bear_tp_mult': 2.161352113656223, 'bear_tsl_mult': 0.6452550181289566, 'bear_time_stop': 218, 'bear_use_sma': True, 'bear_use_ema': False, 'bear_use_atr': False, 'bear_use_adx': False, 'bear_use_spike': False, 'bear_rsi_required': False, 'sideways_strategy': 'breakout', 'sideways_bb_std_mult': 1.7074985941849832, 'sideways_rsi_os': 9, 'sideways_rsi_ob': 51, 'sideways_adx_thresh': 17.638885922614328, 'sideways_atr_min_pct': 0.0034598133516481914, 'sideways_atr_max_pct': 0.12831627871405707, 'sideways_tp_mult': 1.6599809490023827, 'sideways_tsl_mult': 0.5035000731427512, 'sideways_time_stop': 122, 'sideways_use_sma': False, 'sideways_use_ema': False, 'sideways_use_atr': False, 'sideways_use_adx': False, 'sideways_use_spike': False, 'sideways_rsi_required': True}.
