[I 2025-08-30 16:38:54,167] Trial 478 finished with values: [-1000000000.0, 1000000000.0] and parameters: {'p_sma': 12, 'p_std': 55, 'p_atr': 22, 'p_adx': 23, 'rsi_period': 17, 'ema1': 25, 'ema2': 14, 'slip_atr_k': 0.016175741342759207, 'slip_spread_k': 0.6308281931889658, 'spread_hl_frac': 0.010525093776322346, 'bb_std_mult': 2.8999772296625523, 'rsi_os': 34, 'rsi_ob': 92, 'vol_spike': 0.23145441472435851, 'adx_thresh': 13.193892532703897, 'atr_min_pct': 0.019963565842245533, 'atr_max_pct': 0.06314006181143406, 'tp_mult': 2.888079183381145, 'tsl_mult': 0.22022954094648667, 'strategy': 'breakout', 'time_stop': 10, 'use_sma': False, 'use_atr': True, 'use_adx': False, 'use_ema': False, 'use_spike': False, 'rsi_required': True, 'edge_k': 1.468786445382756, 'edge_cap': 0.8270668426203516, 'bull_strategy': 'mean_reversion', 'bull_bb_std_mult': 1.791004314942668, 'bull_rsi_os': 26, 'bull_rsi_ob': 60, 'bull_adx_thresh': 22.543524138291893, 'bull_atr_min_pct': 0.02230289211781786, 'bull_atr_max_pct': 0.14254728900563984, 'bull_tp_mult': 1.1486804214995348, 'bull_tsl_mult': 0.27594091647520874, 'bull_time_stop': 168, 'bull_use_sma': True, 'bull_use_ema': True, 'bull_use_atr': False, 'bull_use_adx': False, 'bull_use_spike': False, 'bull_rsi_required': False, 'bear_strategy': 'mean_reversion', 'bear_bb_std_mult': 2.0724172009524326, 'bear_rsi_os': 53, 'bear_rsi_ob': 76, 'bear_adx_thresh': 20.78073211955078, 'bear_atr_min_pct': 0.021398924651760826, 'bear_atr_max_pct': 0.12955336191691152, 'bear_tp_mult': 2.6666038759255057, 'bear_tsl_mult': 0.6595793651706728, 'bear_time_stop': 241, 'bear_use_sma': True, 'bear_use_ema': True, 'bear_use_atr': True, 'bear_use_adx': False, 'bear_use_spike': False, 'bear_rsi_required': False, 'sideways_strategy': 'breakout', 'sideways_bb_std_mult': 1.0139088387689934, 'sideways_rsi_os': 29, 'sideways_rsi_ob': 88, 'sideways_adx_thresh': 17.79949519760083, 'sideways_atr_min_pct': 0.004481013082581243, 'sideways_atr_max_pct': 0.1399652439671737, 'sideways_tp_mult': 1.9152981589493638, 'sideways_tsl_mult': 0.8284907499811832, 'sideways_time_stop': 220, 'sideways_use_sma': True, 'sideways_use_ema': False, 'sideways_use_atr': False, 'sideways_use_adx': False, 'sideways_use_spike': False, 'sideways_rsi_required': True}.
[I 2025-08-30 16:38:55,056] Trial 479 finished with values: [-1000000000.0, 1000000000.0] and parameters: {'p_sma': 12, 'p_std': 55, 'p_atr': 13, 'p_adx': 25, 'rsi_period': 17, 'ema1': 26, 'ema2': 52, 'slip_atr_k': 0.010973871664635518, 'slip_spread_k': 0.4371197601489705, 'spread_hl_frac': 0.04019023743462744, 'bb_std_mult': 1.3956619548424543, 'rsi_os': 50, 'rsi_ob': 76, 'vol_spike': 0.2307082252300921, 'adx_thresh': 14.59104851976575, 'atr_min_pct': 0.017984224865310823, 'atr_max_pct': 0.14061683626368968, 'tp_mult': 2.838452652784658, 'tsl_mult': 0.51644101383644, 'strategy': 'breakout', 'time_stop': 139, 'use_sma': False, 'use_atr': True, 'use_adx': False, 'use_ema': False, 'use_spike': True, 'rsi_required': True, 'edge_k': 1.4722617477333182, 'edge_cap': 0.9770828988609956, 'bull_strategy': 'mean_reversion', 'bull_bb_std_mult': 1.8171246210139935, 'bull_rsi_os': 29, 'bull_rsi_ob': 50, 'bull_adx_thresh': 22.454078462394925, 'bull_atr_min_pct': 0.021545304558869324, 'bull_atr_max_pct': 0.1411788680123079, 'bull_tp_mult': 2.2519800801361836, 'bull_tsl_mult': 0.25789136208084185, 'bull_time_stop': 165, 'bull_use_sma': True, 'bull_use_ema': True, 'bull_use_atr': False, 'bull_use_adx': False, 'bull_use_spike': False, 'bull_rsi_required': False, 'bear_strategy': 'mean_reversion', 'bear_bb_std_mult': 2.08996410097158, 'bear_rsi_os': 12, 'bear_rsi_ob': 75, 'bear_adx_thresh': 23.327524961125498, 'bear_atr_min_pct': 0.004857071483425755, 'bear_atr_max_pct': 0.08994321092786373, 'bear_tp_mult': 2.6713064272192524, 'bear_tsl_mult': 0.8040268874142809, 'bear_time_stop': 239, 'bear_use_sma': True, 'bear_use_ema': False, 'bear_use_atr': False, 'bear_use_adx': False, 'bear_use_spike': False, 'bear_rsi_required': False, 'sideways_strategy': 'breakout', 'sideways_bb_std_mult': 2.0594599234436477, 'sideways_rsi_os': 32, 'sideways_rsi_ob': 88, 'sideways_adx_thresh': 17.297092099540592, 'sideways_atr_min_pct': 0.010673639633252418, 'sideways_atr_max_pct': 0.03742401860494001, 'sideways_tp_mult': 1.5394272592593055, 'sideways_tsl_mult': 0.42534881368845523, 'sideways_time_stop': 131, 'sideways_use_sma': True, 'sideways_use_ema': False, 'sideways_use_atr': False, 'sideways_use_adx': False, 'sideways_use_spike': False, 'sideways_rsi_required': True}.
[I 2025-08-30 16:38:55,516] Trial 477 finished with values: [-0.05378605491186772, 0.053706482606787564] and parameters: {'p_sma': 35, 'p_std': 55, 'p_atr': 22, 'p_adx': 23, 'rsi_period': 18, 'ema1': 25, 'ema2': 14, 'slip_atr_k': 0.01693282386547829, 'slip_spread_k': 0.6398081382966905, 'spread_hl_frac': 0.006974989961512874, 'bb_std_mult': 2.9127655549126703, 'rsi_os': 34, 'rsi_ob': 59, 'vol_spike': 0.0002329722309667092, 'adx_thresh': 22.662310473074644, 'atr_min_pct': 0.01700599991208588, 'atr_max_pct': 0.13085557309240534, 'tp_mult': 2.8941748997859666, 'tsl_mult': 0.4263884387094574, 'strategy': 'breakout', 'time_stop': 5, 'use_sma': False, 'use_atr': True, 'use_adx': False, 'use_ema': False, 'use_spike': False, 'rsi_required': True, 'edge_k': 1.4778761806004723, 'edge_cap': 0.5496055212058156, 'bull_strategy': 'mean_reversion', 'bull_bb_std_mult': 1.808495430463309, 'bull_rsi_os': 11, 'bull_rsi_ob': 60, 'bull_adx_thresh': 22.53764961883786, 'bull_atr_min_pct': 0.02222300680789566, 'bull_atr_max_pct': 0.14159568097337305, 'bull_tp_mult': 1.0747623890595996, 'bull_tsl_mult': 0.27813171847443424, 'bull_time_stop': 245, 'bull_use_sma': True, 'bull_use_ema': True, 'bull_use_atr': False, 'bull_use_adx': False, 'bull_use_spike': False, 'bull_rsi_required': False, 'bear_strategy': 'mean_reversion', 'bear_bb_std_mult': 2.0676330567731744, 'bear_rsi_os': 35, 'bear_rsi_ob': 76, 'bear_adx_thresh': 20.795778858382214, 'bear_atr_min_pct': 0.021512064844499367, 'bear_atr_max_pct': 0.09062822347880554, 'bear_tp_mult': 1.3229496002638337, 'bear_tsl_mult': 0.8053968699287493, 'bear_time_stop': 241, 'bear_use_sma': True, 'bear_use_ema': True, 'bear_use_atr': True, 'bear_use_adx': False, 'bear_use_spike': False, 'bear_rsi_required': False, 'sideways_strategy': 'breakout', 'sideways_bb_std_mult': 2.0432852541612023, 'sideways_rsi_os': 32, 'sideways_rsi_ob': 90, 'sideways_adx_thresh': 9.24492070511338, 'sideways_atr_min_pct': 0.0013824286798186632, 'sideways_atr_max_pct': 0.08651529448147212, 'sideways_tp_mult': 1.4254360326192916, 'sideways_tsl_mult': 0.8433976619150589, 'sideways_time_stop': 142, 'sideways_use_sma': True, 'sideways_use_ema': False, 'sideways_use_atr': False, 'sideways_use_adx': False, 'sideways_use_spike': False, 'sideways_rsi_required': True}.
[I 2025-08-30 16:38:55,974] Trial 480 finished with values: [-1000000000.0, 1000000000.0] and parameters: {'p_sma': 33, 'p_std': 31, 'p_atr': 13, 'p_adx': 23, 'rsi_period': 17, 'ema1': 25, 'ema2': 15, 'slip_atr_k': 5.480888293538794e-05, 'slip_spread_k': 0.6431097276096662, 'spread_hl_frac': 0.006790105993078065, 'bb_std_mult': 1.8363583905253544, 'rsi_os': 43, 'rsi_ob': 89, 'vol_spike': 0.016870071965883554, 'adx_thresh': 11.790544219498383, 'atr_min_pct': 0.01807688685893319, 'atr_max_pct': 0.03728495602651685, 'tp_mult': 2.8464386583195185, 'tsl_mult': 0.72855165068507, 'strategy': 'breakout', 'time_stop': 139, 'use_sma': False, 'use_atr': True, 'use_adx': False, 'use_ema': False, 'use_spike': True, 'rsi_required': True, 'edge_k': 1.4127630032109757, 'edge_cap': 0.13888665131554867, 'bull_strategy': 'mean_reversion', 'bull_bb_std_mult': 1.8126913860320681, 'bull_rsi_os': 10, 'bull_rsi_ob': 51, 'bull_adx_thresh': 22.380955498959967, 'bull_atr_min_pct': 0.026562401402187567, 'bull_atr_max_pct': 0.14188512851195575, 'bull_tp_mult': 2.045223920173042, 'bull_tsl_mult': 0.31392938748695554, 'bull_time_stop': 81, 'bull_use_sma': True, 'bull_use_ema': True, 'bull_use_atr': False, 'bull_use_adx': False, 'bull_use_spike': True, 'bull_rsi_required': False, 'bear_strategy': 'mean_reversion', 'bear_bb_std_mult': 2.980172868123146, 'bear_rsi_os': 35, 'bear_rsi_ob': 55, 'bear_adx_thresh': 11.195138923296092, 'bear_atr_min_pct': 0.004487694342327915, 'bear_atr_max_pct': 0.08901374547419165, 'bear_tp_mult': 1.3197165433075322, 'bear_tsl_mult': 0.6738843281203893, 'bear_time_stop': 239, 'bear_use_sma': True, 'bear_use_ema': False, 'bear_use_atr': False, 'bear_use_adx': False, 'bear_use_spike': False, 'bear_rsi_required': False, 'sideways_strategy': 'breakout', 'sideways_bb_std_mult': 1.9890722645606465, 'sideways_rsi_os': 30, 'sideways_rsi_ob': 88, 'sideways_adx_thresh': 9.247772727761982, 'sideways_atr_min_pct': 0.022291792555277596, 'sideways_atr_max_pct': 0.038248426799938506, 'sideways_tp_mult': 2.0926542054130968, 'sideways_tsl_mult': 0.19601629116383834, 'sideways_time_stop': 142, 'sideways_use_sma': True, 'sideways_use_ema': False, 'sideways_use_atr': True, 'sideways_use_adx': False, 'sideways_use_spike': False, 'sideways_rsi_required': True}.
[I 2025-08-30 16:38:56,661] Trial 484 finished with values: [-1000000000.0, 1000000000.0] and parameters: {'p_sma': 44, 'p_std': 57, 'p_atr': 18, 'p_adx': 27, 'rsi_period': 20, 'ema1': 27, 'ema2': 44, 'slip_atr_k': 0.009593415559522882, 'slip_spread_k': 0.6137470470425685, 'spread_hl_frac': 0.017793177134576395, 'bb_std_mult': 3.508202966353864, 'rsi_os': 36, 'rsi_ob': 49, 'vol_spike': 0.023291431296172692, 'adx_thresh': 12.111046936695713, 'atr_min_pct': 0.013750413746894048, 'atr_max_pct': 0.06710438051970583, 'tp_mult': 2.9876768200427493, 'tsl_mult': 0.5539717616072872, 'strategy': 'mean_reversion', 'time_stop': 296, 'use_sma': False, 'use_atr': False, 'use_adx': True, 'use_ema': False, 'use_spike': False, 'rsi_required': False, 'edge_k': 1.6306595279514977, 'edge_cap': 0.34331996814266996, 'bull_strategy': 'breakout', 'bull_bb_std_mult': 1.9018975717538926, 'bull_rsi_os': 12, 'bull_rsi_ob': 50, 'bull_adx_thresh': 21.587924932962014, 'bull_atr_min_pct': 0.020853657740958414, 'bull_atr_max_pct': 0.0158109718868069, 'bull_tp_mult': 1.2140559769992616, 'bull_tsl_mult': 0.3390817022140018, 'bull_time_stop': 94, 'bull_use_sma': False, 'bull_use_ema': False, 'bull_use_atr': True, 'bull_use_adx': True, 'bull_use_spike': True, 'bull_rsi_required': True, 'bear_strategy': 'mean_reversion', 'bear_bb_std_mult': 1.9386652303464065, 'bear_rsi_os': 13, 'bear_rsi_ob': 56, 'bear_adx_thresh': 30.238273373977623, 'bear_atr_min_pct': 0.01946873348991188, 'bear_atr_max_pct': 0.0974668093748308, 'bear_tp_mult': 2.105678370437549, 'bear_tsl_mult': 0.7190722422420148, 'bear_time_stop': 217, 'bear_use_sma': False, 'bear_use_ema': False, 'bear_use_atr': False, 'bear_use_adx': True, 'bear_use_spike': True, 'bear_rsi_required': True, 'sideways_strategy': 'mean_reversion', 'sideways_bb_std_mult': 0.7446058968848055, 'sideways_rsi_os': 27, 'sideways_rsi_ob': 91, 'sideways_adx_thresh': 13.50795930376739, 'sideways_atr_min_pct': 0.000809897956895339, 'sideways_atr_max_pct': 0.12929628957048855, 'sideways_tp_mult': 1.4458648124103755, 'sideways_tsl_mult': 0.9717050679016394, 'sideways_time_stop': 230, 'sideways_use_sma': False, 'sideways_use_ema': False, 'sideways_use_atr': True, 'sideways_use_adx': True, 'sideways_use_spike': True, 'sideways_rsi_required': False}.
[I 2025-08-30 16:38:56,928] Trial 485 finished with values: [-1000000000.0, 1000000000.0] and parameters: {'p_sma': 9, 'p_std': 52, 'p_atr': 28, 'p_adx': 22, 'rsi_period': 69, 'ema1': 26, 'ema2': 56, 'slip_atr_k': 0.22055148476844855, 'slip_spread_k': 0.6973808613162051, 'spread_hl_frac': 0.035322007205808637, 'bb_std_mult': 2.7074236974260177, 'rsi_os': 35, 'rsi_ob': 89, 'vol_spike': 0.014963684054576118, 'adx_thresh': 12.71341821767666, 'atr_min_pct': 0.01979053093641531, 'atr_max_pct': 0.013016419757209699, 'tp_mult': 2.6696328929853124, 'tsl_mult': 0.4726401866132387, 'strategy': 'mean_reversion', 'time_stop': 65, 'use_sma': False, 'use_atr': False, 'use_adx': True, 'use_ema': True, 'use_spike': False, 'rsi_required': False, 'edge_k': 0.511530051202651, 'edge_cap': 0.6518430125165896, 'bull_strategy': 'mean_reversion', 'bull_bb_std_mult': 2.010456888139271, 'bull_rsi_os': 33, 'bull_rsi_ob': 58, 'bull_adx_thresh': 21.770518093771226, 'bull_atr_min_pct': 0.01994770719872784, 'bull_atr_max_pct': 0.13676614126593992, 'bull_tp_mult': 2.4124390793862407, 'bull_tsl_mult': 0.4232371378766388, 'bull_time_stop': 176, 'bull_use_sma': False, 'bull_use_ema': True, 'bull_use_atr': True, 'bull_use_adx': True, 'bull_use_spike': False, 'bull_rsi_required': True, 'bear_strategy': 'breakout', 'bear_bb_std_mult': 3.290369090496645, 'bear_rsi_os': 41, 'bear_rsi_ob': 90, 'bear_adx_thresh': 14.952316668233891, 'bear_atr_min_pct': 0.022337994759195078, 'bear_atr_max_pct': 0.013229798865301484, 'bear_tp_mult': 2.1518985105064488, 'bear_tsl_mult': 0.6337394607433987, 'bear_time_stop': 128, 'bear_use_sma': True, 'bear_use_ema': False, 'bear_use_atr': False, 'bear_use_adx': True, 'bear_use_spike': True, 'bear_rsi_required': True, 'sideways_strategy': 'mean_reversion', 'sideways_bb_std_mult': 1.7404167679843279, 'sideways_rsi_os': 49, 'sideways_rsi_ob': 93, 'sideways_adx_thresh': 16.054938917432754, 'sideways_atr_min_pct': 0.001588463875585422, 'sideways_atr_max_pct': 0.02212800529134347, 'sideways_tp_mult': 1.026614227925835, 'sideways_tsl_mult': 0.47280268740105424, 'sideways_time_stop': 278, 'sideways_use_sma': True, 'sideways_use_ema': True, 'sideways_use_atr': False, 'sideways_use_adx': False, 'sideways_use_spike': True, 'sideways_rsi_required': True}.
[I 2025-08-30 16:39:36,159] Trial 481 finished with values: [-1000000000.0, 1000000000.0] and parameters: {'p_sma': 56, 'p_std': 8, 'p_atr': 24, 'p_adx': 23, 'rsi_period': 17, 'ema1': 26, 'ema2': 54, 'slip_atr_k': 0.2199543467141936, 'slip_spread_k': 0.43552039575733736, 'spread_hl_frac': 0.017564230453637437, 'bb_std_mult': 3.1078307957173865, 'rsi_os': 35, 'rsi_ob': 89, 'vol_spike': 0.016382924006840244, 'adx_thresh': 11.671271130267426, 'atr_min_pct': 0.018181390690090334, 'atr_max_pct': 0.091125290082551, 'tp_mult': 2.829966530432307, 'tsl_mult': 0.5190056773453589, 'strategy': 'mean_reversion', 'time_stop': 139, 'use_sma': False, 'use_atr': True, 'use_adx': True, 'use_ema': False, 'use_spike': True, 'rsi_required': True, 'edge_k': 1.6364129178158875, 'edge_cap': 0.6545800964637838, 'bull_strategy': 'mean_reversion', 'bull_bb_std_mult': 1.8411473438685926, 'bull_rsi_os': 10, 'bull_rsi_ob': 55, 'bull_adx_thresh': 21.74654896822466, 'bull_atr_min_pct': 0.02091136220936389, 'bull_atr_max_pct': 0.11630329613574136, 'bull_tp_mult': 2.048893830926199, 'bull_tsl_mult': 0.4212325676268883, 'bull_time_stop': 84, 'bull_use_sma': False, 'bull_use_ema': True, 'bull_use_atr': True, 'bull_use_adx': True, 'bull_use_spike': True, 'bull_rsi_required': True, 'bear_strategy': 'mean_reversion', 'bear_bb_std_mult': 1.9522873257578877, 'bear_rsi_os': 13, 'bear_rsi_ob': 75, 'bear_adx_thresh': 11.158923134337819, 'bear_atr_min_pct': 0.01976031245574919, 'bear_atr_max_pct': 0.08866617634461715, 'bear_tp_mult': 2.8496841405198614, 'bear_tsl_mult': 0.42207799594275663, 'bear_time_stop': 216, 'bear_use_sma': True, 'bear_use_ema': False, 'bear_use_atr': False, 'bear_use_adx': False, 'bear_use_spike': False, 'bear_rsi_required': False, 'sideways_strategy': 'breakout', 'sideways_bb_std_mult': 1.948875814911021, 'sideways_rsi_os': 32, 'sideways_rsi_ob': 90, 'sideways_adx_thresh': 13.615032639555068, 'sideways_atr_min_pct': 0.026738032849365906, 'sideways_atr_max_pct': 0.13048116340591803, 'sideways_tp_mult': 2.070776738596476, 'sideways_tsl_mult': 0.4218631571636907, 'sideways_time_stop': 132, 'sideways_use_sma': True, 'sideways_use_ema': False, 'sideways_use_atr': True, 'sideways_use_adx': False, 'sideways_use_spike': False, 'sideways_rsi_required': True}.
[I 2025-08-30 16:39:37,129] Trial 483 finished with values: [-1000000000.0, 1000000000.0] and parameters: {'p_sma': 49, 'p_std': 31, 'p_atr': 24, 'p_adx': 22, 'rsi_period': 44, 'ema1': 29, 'ema2': 19, 'slip_atr_k': 0.16735956776558186, 'slip_spread_k': 0.6141328105553865, 'spread_hl_frac': 0.017486178481675784, 'bb_std_mult': 3.079505045948482, 'rsi_os': 35, 'rsi_ob': 89, 'vol_spike': 0.2770900250724424, 'adx_thresh': 11.74352542107467, 'atr_min_pct': 0.025557005564668243, 'atr_max_pct': 0.09279307277493021, 'tp_mult': 2.665656070983106, 'tsl_mult': 0.1958511719643936, 'strategy': 'mean_reversion', 'time_stop': 20, 'use_sma': False, 'use_atr': False, 'use_adx': True, 'use_ema': False, 'use_spike': True, 'rsi_required': False, 'edge_k': 1.4090731316984317, 'edge_cap': 0.34955432205344217, 'bull_strategy': 'mean_reversion', 'bull_bb_std_mult': 2.3435417886111676, 'bull_rsi_os': 10, 'bull_rsi_ob': 55, 'bull_adx_thresh': 16.619003390727304, 'bull_atr_min_pct': 0.022918655336750186, 'bull_atr_max_pct': 0.08312812667591023, 'bull_tp_mult': 1.3636365301653963, 'bull_tsl_mult': 0.31568850166884527, 'bull_time_stop': 106, 'bull_use_sma': False, 'bull_use_ema': True, 'bull_use_atr': True, 'bull_use_adx': True, 'bull_use_spike': True, 'bull_rsi_required': True, 'bear_strategy': 'mean_reversion', 'bear_bb_std_mult': 1.946208702991116, 'bear_rsi_os': 41, 'bear_rsi_ob': 78, 'bear_adx_thresh': 13.087695289184385, 'bear_atr_min_pct': 0.019798574440588, 'bear_atr_max_pct': 0.09744267520202879, 'bear_tp_mult': 2.130505403388906, 'bear_tsl_mult': 0.6812725138578708, 'bear_time_stop': 218, 'bear_use_sma': True, 'bear_use_ema': False, 'bear_use_atr': False, 'bear_use_adx': True, 'bear_use_spike': True, 'bear_rsi_required': True, 'sideways_strategy': 'mean_reversion', 'sideways_bb_std_mult': 0.6917084708543821, 'sideways_rsi_os': 8, 'sideways_rsi_ob': 91, 'sideways_adx_thresh': 15.952387564605383, 'sideways_atr_min_pct': 0.01789109154496797, 'sideways_atr_max_pct': 0.0415372114170236, 'sideways_tp_mult': 1.0139336534766974, 'sideways_tsl_mult': 0.46421907132859336, 'sideways_time_stop': 230, 'sideways_use_sma': True, 'sideways_use_ema': False, 'sideways_use_atr': True, 'sideways_use_adx': False, 'sideways_use_spike': True, 'sideways_rsi_required': True}.
[I 2025-08-30 16:39:37,975] Trial 482 finished with values: [-1000000000.0, 1000000000.0] and parameters: {'p_sma': 9, 'p_std': 52, 'p_atr': 24, 'p_adx': 22, 'rsi_period': 20, 'ema1': 27, 'ema2': 54, 'slip_atr_k': 0.11496440959239519, 'slip_spread_k': 0.611910010322376, 'spread_hl_frac': 0.006685960863067813, 'bb_std_mult': 1.777471892391931, 'rsi_os': 35, 'rsi_ob': 89, 'vol_spike': 0.10685719277171553, 'adx_thresh': 11.835027160619696, 'atr_min_pct': 0.017775842940781498, 'atr_max_pct': 0.1341210962389496, 'tp_mult': 2.9927079609405784, 'tsl_mult': 0.8029440738184408, 'strategy': 'mean_reversion', 'time_stop': 5, 'use_sma': False, 'use_atr': False, 'use_adx': True, 'use_ema': False, 'use_spike': False, 'rsi_required': False, 'edge_k': 1.658512334288498, 'edge_cap': 0.5839869714694363, 'bull_strategy': 'mean_reversion', 'bull_bb_std_mult': 1.8791355988233562, 'bull_rsi_os': 31, 'bull_rsi_ob': 55, 'bull_adx_thresh': 16.45960012265033, 'bull_atr_min_pct': 0.026138987788047952, 'bull_atr_max_pct': 0.08291659814111527, 'bull_tp_mult': 2.6670381523598268, 'bull_tsl_mult': 0.31829321866616334, 'bull_time_stop': 291, 'bull_use_sma': False, 'bull_use_ema': True, 'bull_use_atr': True, 'bull_use_adx': True, 'bull_use_spike': True, 'bull_rsi_required': True, 'bear_strategy': 'mean_reversion', 'bear_bb_std_mult': 3.215912566352098, 'bear_rsi_os': 13, 'bear_rsi_ob': 83, 'bear_adx_thresh': 8.148914313941319, 'bear_atr_min_pct': 0.01967081316962624, 'bear_atr_max_pct': 0.1124594677441488, 'bear_tp_mult': 2.852153564843981, 'bear_tsl_mult': 0.6797287482218598, 'bear_time_stop': 90, 'bear_use_sma': True, 'bear_use_ema': False, 'bear_use_atr': False, 'bear_use_adx': True, 'bear_use_spike': True, 'bear_rsi_required': True, 'sideways_strategy': 'mean_reversion', 'sideways_bb_std_mult': 1.766180871092626, 'sideways_rsi_os': 30, 'sideways_rsi_ob': 90, 'sideways_adx_thresh': 16.307767732052778, 'sideways_atr_min_pct': 0.0015191571579451174, 'sideways_atr_max_pct': 0.04126550652172233, 'sideways_tp_mult': 1.4417473245726413, 'sideways_tsl_mult': 0.8522180436462716, 'sideways_time_stop': 229, 'sideways_use_sma': True, 'sideways_use_ema': False, 'sideways_use_atr': True, 'sideways_use_adx': False, 'sideways_use_spike': True, 'sideways_rsi_required': True}.
