[I 2025-08-30 17:28:49,394] Trial 773 finished with values: [-1000000000.0, 1000000000.0] and parameters: {'p_sma': 10, 'p_std': 21, 'p_atr': 15, 'p_adx': 8, 'rsi_period': 38, 'ema1': 19, 'ema2': 13, 'slip_atr_k': 0.10025774170722322, 'slip_spread_k': 0.12508260307840804, 'spread_hl_frac': 0.03696318859087943, 'bb_std_mult': 3.117471486193553, 'rsi_os': 34, 'rsi_ob': 86, 'vol_spike': 0.0999071632729931, 'adx_thresh': 30.948444086443004, 'atr_min_pct': 0.0188566039131069, 'atr_max_pct': 0.06837857928588349, 'tp_mult': 1.6350419504971514, 'tsl_mult': 0.04116797442389536, 'strategy': 'mean_reversion', 'time_stop': 227, 'use_sma': False, 'use_atr': True, 'use_adx': True, 'use_ema': True, 'use_spike': False, 'rsi_required': True, 'edge_k': 0.17162277483049815, 'edge_cap': 0.7364925619520484, 'bull_strategy': 'mean_reversion', 'bull_bb_std_mult': 1.8278012581460439, 'bull_rsi_os': 10, 'bull_rsi_ob': 78, 'bull_adx_thresh': 33.36055676030394, 'bull_atr_min_pct': 0.004034522161270896, 'bull_atr_max_pct': 0.013307800488689639, 'bull_tp_mult': 2.7886177030944133, 'bull_tsl_mult': 0.9745580009100931, 'bull_time_stop': 83, 'bull_use_sma': True, 'bull_use_ema': False, 'bull_use_atr': False, 'bull_use_adx': True, 'bull_use_spike': True, 'bull_rsi_required': True, 'bear_strategy': 'breakout', 'bear_bb_std_mult': 2.662538408301523, 'bear_rsi_os': 14, 'bear_rsi_ob': 76, 'bear_adx_thresh': 13.406936336241309, 'bear_atr_min_pct': 0.0028745204750644914, 'bear_atr_max_pct': 0.039883956377636184, 'bear_tp_mult': 2.178976349370689, 'bear_tsl_mult': 0.10864878034956449, 'bear_time_stop': 153, 'bear_use_sma': True, 'bear_use_ema': True, 'bear_use_atr': False, 'bear_use_adx': False, 'bear_use_spike': False, 'bear_rsi_required': False, 'sideways_strategy': 'mean_reversion', 'sideways_bb_std_mult': 0.7918282161395737, 'sideways_rsi_os': 31, 'sideways_rsi_ob': 92, 'sideways_adx_thresh': 11.120865910557391, 'sideways_atr_min_pct': 0.005159542448277266, 'sideways_atr_max_pct': 0.07494597683236537, 'sideways_tp_mult': 2.9448044004087452, 'sideways_tsl_mult': 0.4380359450985958, 'sideways_time_stop': 290, 'sideways_use_sma': False, 'sideways_use_ema': False, 'sideways_use_atr': True, 'sideways_use_adx': False, 'sideways_use_spike': False, 'sideways_rsi_required': False}.
[I 2025-08-30 17:28:50,874] Trial 774 finished with values: [-0.04680000089244096, 0.046753069981178376] and parameters: {'p_sma': 53, 'p_std': 28, 'p_atr': 15, 'p_adx': 8, 'rsi_period': 45, 'ema1': 19, 'ema2': 13, 'slip_atr_k': 0.006126289412124884, 'slip_spread_k': 0.19543285280315498, 'spread_hl_frac': 0.011965496949383106, 'bb_std_mult': 3.079596125135912, 'rsi_os': 9, 'rsi_ob': 76, 'vol_spike': 0.10141378990994658, 'adx_thresh': 11.306109463957254, 'atr_min_pct': 0.006768026465017231, 'atr_max_pct': 0.14194020022972537, 'tp_mult': 2.6442729655072235, 'tsl_mult': 0.09937234033589343, 'strategy': 'mean_reversion', 'time_stop': 23, 'use_sma': False, 'use_atr': True, 'use_adx': True, 'use_ema': True, 'use_spike': True, 'rsi_required': True, 'edge_k': 0.8615813890771014, 'edge_cap': 0.1434721003122626, 'bull_strategy': 'breakout', 'bull_bb_std_mult': 0.7359542859488752, 'bull_rsi_os': 32, 'bull_rsi_ob': 78, 'bull_adx_thresh': 33.43210731841697, 'bull_atr_min_pct': 0.00814349287165419, 'bull_atr_max_pct': 0.018999308269846645, 'bull_tp_mult': 2.274583397967781, 'bull_tsl_mult': 0.977858002829161, 'bull_time_stop': 289, 'bull_use_sma': True, 'bull_use_ema': False, 'bull_use_atr': False, 'bull_use_adx': True, 'bull_use_spike': True, 'bull_rsi_required': True, 'bear_strategy': 'breakout', 'bear_bb_std_mult': 2.8997896092736006, 'bear_rsi_os': 14, 'bear_rsi_ob': 76, 'bear_adx_thresh': 30.759070057580217, 'bear_atr_min_pct': 0.014221255741664537, 'bear_atr_max_pct': 0.11169339563909911, 'bear_tp_mult': 2.1389928141508463, 'bear_tsl_mult': 0.6902319460217461, 'bear_time_stop': 152, 'bear_use_sma': True, 'bear_use_ema': True, 'bear_use_atr': True, 'bear_use_adx': False, 'bear_use_spike': False, 'bear_rsi_required': False, 'sideways_strategy': 'breakout', 'sideways_bb_std_mult': 0.7849992442986684, 'sideways_rsi_os': 47, 'sideways_rsi_ob': 92, 'sideways_adx_thresh': 12.261802428186469, 'sideways_atr_min_pct': 0.002012368122084743, 'sideways_atr_max_pct': 0.06146796742853632, 'sideways_tp_mult': 2.994945287609678, 'sideways_tsl_mult': 0.6591246416281523, 'sideways_time_stop': 58, 'sideways_use_sma': True, 'sideways_use_ema': True, 'sideways_use_atr': True, 'sideways_use_adx': False, 'sideways_use_spike': True, 'sideways_rsi_required': False}.
[I 2025-08-30 17:28:52,878] Trial 776 finished with values: [-1000000000.0, 1000000000.0] and parameters: {'p_sma': 10, 'p_std': 9, 'p_atr': 15, 'p_adx': 8, 'rsi_period': 20, 'ema1': 21, 'ema2': 50, 'slip_atr_k': 0.12875828222687352, 'slip_spread_k': 0.8292648602374247, 'spread_hl_frac': 0.01813687762440909, 'bb_std_mult': 3.1912137456049203, 'rsi_os': 32, 'rsi_ob': 86, 'vol_spike': 0.07931073047181428, 'adx_thresh': 21.04197907173878, 'atr_min_pct': 0.020227624834256722, 'atr_max_pct': 0.14219075314828122, 'tp_mult': 2.6520879241802207, 'tsl_mult': 0.03812849039056032, 'strategy': 'mean_reversion', 'time_stop': 38, 'use_sma': False, 'use_atr': True, 'use_adx': True, 'use_ema': False, 'use_spike': False, 'rsi_required': True, 'edge_k': 0.8083114379721974, 'edge_cap': 0.8767507626877121, 'bull_strategy': 'mean_reversion', 'bull_bb_std_mult': 2.4588259499943774, 'bull_rsi_os': 8, 'bull_rsi_ob': 52, 'bull_adx_thresh': 11.3300208718939, 'bull_atr_min_pct': 0.007779107258838669, 'bull_atr_max_pct': 0.103834263748241, 'bull_tp_mult': 2.775253629656109, 'bull_tsl_mult': 0.4414538113895752, 'bull_time_stop': 131, 'bull_use_sma': True, 'bull_use_ema': True, 'bull_use_atr': False, 'bull_use_adx': True, 'bull_use_spike': True, 'bull_rsi_required': True, 'bear_strategy': 'mean_reversion', 'bear_bb_std_mult': 2.9207036218508544, 'bear_rsi_os': 16, 'bear_rsi_ob': 76, 'bear_adx_thresh': 30.68482175455952, 'bear_atr_min_pct': 0.020804358610629382, 'bear_atr_max_pct': 0.04084629812309833, 'bear_tp_mult': 1.3674568718472992, 'bear_tsl_mult': 0.5752672917938133, 'bear_time_stop': 37, 'bear_use_sma': False, 'bear_use_ema': False, 'bear_use_atr': False, 'bear_use_adx': False, 'bear_use_spike': False, 'bear_rsi_required': False, 'sideways_strategy': 'mean_reversion', 'sideways_bb_std_mult': 0.8127099498664329, 'sideways_rsi_os': 20, 'sideways_rsi_ob': 45, 'sideways_adx_thresh': 11.185149334517948, 'sideways_atr_min_pct': 0.003140805759483864, 'sideways_atr_max_pct': 0.10466044163229332, 'sideways_tp_mult': 2.959498575213959, 'sideways_tsl_mult': 0.439997211383175, 'sideways_time_stop': 83, 'sideways_use_sma': False, 'sideways_use_ema': False, 'sideways_use_atr': False, 'sideways_use_adx': False, 'sideways_use_spike': False, 'sideways_rsi_required': True}.
[I 2025-08-30 17:29:30,130] Trial 777 finished with values: [-1000000000.0, 1000000000.0] and parameters: {'p_sma': 7, 'p_std': 17, 'p_atr': 15, 'p_adx': 12, 'rsi_period': 25, 'ema1': 17, 'ema2': 37, 'slip_atr_k': 0.005762921344256975, 'slip_spread_k': 0.19056855384442473, 'spread_hl_frac': 0.0031326357258673818, 'bb_std_mult': 3.2096220143930028, 'rsi_os': 16, 'rsi_ob': 71, 'vol_spike': 0.0801414554256655, 'adx_thresh': 30.96143115376632, 'atr_min_pct': 0.020053319837915674, 'atr_max_pct': 0.1476933421092787, 'tp_mult': 2.659951726246693, 'tsl_mult': 0.6240845515456948, 'strategy': 'mean_reversion', 'time_stop': 37, 'use_sma': True, 'use_atr': False, 'use_adx': False, 'use_ema': False, 'use_spike': False, 'rsi_required': True, 'edge_k': 0.8276393232838248, 'edge_cap': 0.7294079166466232, 'bull_strategy': 'breakout', 'bull_bb_std_mult': 1.4774921236031098, 'bull_rsi_os': 9, 'bull_rsi_ob': 81, 'bull_adx_thresh': 33.88969766021337, 'bull_atr_min_pct': 0.00880865564562833, 'bull_atr_max_pct': 0.01380596081195748, 'bull_tp_mult': 2.2097809261009096, 'bull_tsl_mult': 0.9733285069025099, 'bull_time_stop': 288, 'bull_use_sma': True, 'bull_use_ema': True, 'bull_use_atr': False, 'bull_use_adx': False, 'bull_use_spike': False, 'bull_rsi_required': False, 'bear_strategy': 'mean_reversion', 'bear_bb_std_mult': 0.7912612305549607, 'bear_rsi_os': 16, 'bear_rsi_ob': 95, 'bear_adx_thresh': 22.83003993195659, 'bear_atr_min_pct': 0.0028236020020934918, 'bear_atr_max_pct': 0.10803628181278306, 'bear_tp_mult': 2.6621356514887133, 'bear_tsl_mult': 0.6371197985176204, 'bear_time_stop': 195, 'bear_use_sma': False, 'bear_use_ema': False, 'bear_use_atr': False, 'bear_use_adx': True, 'bear_use_spike': True, 'bear_rsi_required': True, 'sideways_strategy': 'breakout', 'sideways_bb_std_mult': 0.8538478183744627, 'sideways_rsi_os': 45, 'sideways_rsi_ob': 92, 'sideways_adx_thresh': 12.21569235358123, 'sideways_atr_min_pct': 0.020187566284904552, 'sideways_atr_max_pct': 0.1047192276685282, 'sideways_tp_mult': 2.952670205690054, 'sideways_tsl_mult': 0.29009803806579615, 'sideways_time_stop': 81, 'sideways_use_sma': True, 'sideways_use_ema': False, 'sideways_use_atr': False, 'sideways_use_adx': False, 'sideways_use_spike': False, 'sideways_rsi_required': True}.
[I 2025-08-30 17:29:33,308] Trial 779 finished with values: [-1000000000.0, 1000000000.0] and parameters: {'p_sma': 5, 'p_std': 9, 'p_atr': 8, 'p_adx': 8, 'rsi_period': 20, 'ema1': 17, 'ema2': 40, 'slip_atr_k': 0.010346389950778091, 'slip_spread_k': 0.814551954159714, 'spread_hl_frac': 0.01863530675268972, 'bb_std_mult': 3.2105306861643683, 'rsi_os': 16, 'rsi_ob': 56, 'vol_spike': 0.08160182288061846, 'adx_thresh': 27.315955880112607, 'atr_min_pct': 0.022605623045173554, 'atr_max_pct': 0.03684496621653642, 'tp_mult': 2.8529554105192094, 'tsl_mult': 0.6237506648026822, 'strategy': 'mean_reversion', 'time_stop': 125, 'use_sma': True, 'use_atr': False, 'use_adx': False, 'use_ema': False, 'use_spike': False, 'rsi_required': True, 'edge_k': 0.7652504418787809, 'edge_cap': 0.9583337264120266, 'bull_strategy': 'mean_reversion', 'bull_bb_std_mult': 1.9375136191893738, 'bull_rsi_os': 9, 'bull_rsi_ob': 52, 'bull_adx_thresh': 34.98002757570976, 'bull_atr_min_pct': 0.022128662315538897, 'bull_atr_max_pct': 0.14369808610885962, 'bull_tp_mult': 2.5649378681658903, 'bull_tsl_mult': 0.7786677637900306, 'bull_time_stop': 129, 'bull_use_sma': True, 'bull_use_ema': True, 'bull_use_atr': False, 'bull_use_adx': False, 'bull_use_spike': False, 'bull_rsi_required': False, 'bear_strategy': 'mean_reversion', 'bear_bb_std_mult': 1.390305472668992, 'bear_rsi_os': 16, 'bear_rsi_ob': 50, 'bear_adx_thresh': 32.5226671248363, 'bear_atr_min_pct': 0.020887633212707146, 'bear_atr_max_pct': 0.10698661122279998, 'bear_tp_mult': 2.9586270102912318, 'bear_tsl_mult': 0.5705495374455524, 'bear_time_stop': 195, 'bear_use_sma': False, 'bear_use_ema': False, 'bear_use_atr': False, 'bear_use_adx': True, 'bear_use_spike': True, 'bear_rsi_required': True, 'sideways_strategy': 'breakout', 'sideways_bb_std_mult': 0.8683709597265573, 'sideways_rsi_os': 30, 'sideways_rsi_ob': 49, 'sideways_adx_thresh': 10.059871734101348, 'sideways_atr_min_pct': 0.0032753394277682275, 'sideways_atr_max_pct': 0.04297448983206878, 'sideways_tp_mult': 1.8058744116428467, 'sideways_tsl_mult': 0.5802544356236989, 'sideways_time_stop': 271, 'sideways_use_sma': True, 'sideways_use_ema': False, 'sideways_use_atr': False, 'sideways_use_adx': True, 'sideways_use_spike': False, 'sideways_rsi_required': True}.
[I 2025-08-30 17:29:33,789] Trial 780 finished with values: [-1000000000.0, 1000000000.0] and parameters: {'p_sma': 55, 'p_std': 19, 'p_atr': 9, 'p_adx': 30, 'rsi_period': 25, 'ema1': 17, 'ema2': 40, 'slip_atr_k': 0.00022898336343602638, 'slip_spread_k': 0.15287980691230693, 'spread_hl_frac': 0.0026972844702622192, 'bb_std_mult': 2.648711839501346, 'rsi_os': 32, 'rsi_ob': 84, 'vol_spike': 0.09083672432645011, 'adx_thresh': 27.386348668422418, 'atr_min_pct': 0.020504895298044293, 'atr_max_pct': 0.14756722638323302, 'tp_mult': 2.8363507996452624, 'tsl_mult': 0.981929914742433, 'strategy': 'breakout', 'time_stop': 31, 'use_sma': True, 'use_atr': False, 'use_adx': False, 'use_ema': False, 'use_spike': False, 'rsi_required': False, 'edge_k': 0.7295208085287057, 'edge_cap': 0.5306802363136838, 'bull_strategy': 'mean_reversion', 'bull_bb_std_mult': 1.9366647828300902, 'bull_rsi_os': 50, 'bull_rsi_ob': 53, 'bull_adx_thresh': 10.31255815820458, 'bull_atr_min_pct': 0.022219921373299204, 'bull_atr_max_pct': 0.14187978522802777, 'bull_tp_mult': 2.1992401072564034, 'bull_tsl_mult': 0.7723582638286376, 'bull_time_stop': 64, 'bull_use_sma': True, 'bull_use_ema': True, 'bull_use_atr': False, 'bull_use_adx': False, 'bull_use_spike': False, 'bull_rsi_required': False, 'bear_strategy': 'mean_reversion', 'bear_bb_std_mult': 1.3675985703707212, 'bear_rsi_os': 16, 'bear_rsi_ob': 90, 'bear_adx_thresh': 23.11591360776448, 'bear_atr_min_pct': 0.029988311408443782, 'bear_atr_max_pct': 0.06916074074535601, 'bear_tp_mult': 2.3796448350842594, 'bear_tsl_mult': 0.6341532194715703, 'bear_time_stop': 193, 'bear_use_sma': False, 'bear_use_ema': False, 'bear_use_atr': False, 'bear_use_adx': True, 'bear_use_spike': True, 'bear_rsi_required': True, 'sideways_strategy': 'breakout', 'sideways_bb_std_mult': 0.887000858713417, 'sideways_rsi_os': 14, 'sideways_rsi_ob': 93, 'sideways_adx_thresh': 10.04530661470015, 'sideways_atr_min_pct': 0.001179290372062527, 'sideways_atr_max_pct': 0.11835494223620799, 'sideways_tp_mult': 2.9295131917318336, 'sideways_tsl_mult': 0.4929842421666787, 'sideways_time_stop': 272, 'sideways_use_sma': True, 'sideways_use_ema': False, 'sideways_use_atr': False, 'sideways_use_adx': True, 'sideways_use_spike': False, 'sideways_rsi_required': True}.
[I 2025-08-30 17:29:33,975] Trial 778 finished with values: [-1000000000.0, 1000000000.0] and parameters: {'p_sma': 5, 'p_std': 17, 'p_atr': 13, 'p_adx': 12, 'rsi_period': 61, 'ema1': 17, 'ema2': 18, 'slip_atr_k': 0.12721223112033148, 'slip_spread_k': 0.8036448753615801, 'spread_hl_frac': 2.5727486741622396e-05, 'bb_std_mult': 1.559400962894285, 'rsi_os': 32, 'rsi_ob': 51, 'vol_spike': 0.08034142976272746, 'adx_thresh': 10.662190482936154, 'atr_min_pct': 0.020070821262621684, 'atr_max_pct': 0.14737918453318435, 'tp_mult': 1.0106825022196433, 'tsl_mult': 0.6269245052272351, 'strategy': 'mean_reversion', 'time_stop': 38, 'use_sma': True, 'use_atr': False, 'use_adx': False, 'use_ema': False, 'use_spike': True, 'rsi_required': True, 'edge_k': 0.8515617561726849, 'edge_cap': 0.8906027690846461, 'bull_strategy': 'breakout', 'bull_bb_std_mult': 0.5827027449731188, 'bull_rsi_os': 8, 'bull_rsi_ob': 53, 'bull_adx_thresh': 34.46899329111135, 'bull_atr_min_pct': 0.022200457466389156, 'bull_atr_max_pct': 0.017409353233304753, 'bull_tp_mult': 2.269275585855687, 'bull_tsl_mult': 0.8190942640986932, 'bull_time_stop': 63, 'bull_use_sma': True, 'bull_use_ema': True, 'bull_use_atr': False, 'bull_use_adx': False, 'bull_use_spike': False, 'bull_rsi_required': False, 'bear_strategy': 'mean_reversion', 'bear_bb_std_mult': 2.918891443682199, 'bear_rsi_os': 16, 'bear_rsi_ob': 48, 'bear_adx_thresh': 29.161862863299543, 'bear_atr_min_pct': 0.021339256782819754, 'bear_atr_max_pct': 0.10809616054504331, 'bear_tp_mult': 2.520466085041918, 'bear_tsl_mult': 0.5742458395104688, 'bear_time_stop': 191, 'bear_use_sma': False, 'bear_use_ema': False, 'bear_use_atr': True, 'bear_use_adx': True, 'bear_use_spike': True, 'bear_rsi_required': True, 'sideways_strategy': 'breakout', 'sideways_bb_std_mult': 0.8628735384668031, 'sideways_rsi_os': 33, 'sideways_rsi_ob': 49, 'sideways_adx_thresh': 12.290004594222095, 'sideways_atr_min_pct': 0.0019864488032058343, 'sideways_atr_max_pct': 0.02969552249213766, 'sideways_tp_mult': 1.7441660245122215, 'sideways_tsl_mult': 0.07454934131278468, 'sideways_time_stop': 59, 'sideways_use_sma': True, 'sideways_use_ema': True, 'sideways_use_atr': False, 'sideways_use_adx': False, 'sideways_use_spike': True, 'sideways_rsi_required': True}.
[I 2025-08-30 17:29:35,024] Trial 783 finished with values: [-1000000000.0, 1000000000.0] and parameters: {'p_sma': 35, 'p_std': 22, 'p_atr': 16, 'p_adx': 9, 'rsi_period': 62, 'ema1': 20, 'ema2': 42, 'slip_atr_k': 0.018705089582376332, 'slip_spread_k': 0.20409616162648267, 'spread_hl_frac': 0.01691160241542198, 'bb_std_mult': 3.4558345307204856, 'rsi_os': 33, 'rsi_ob': 46, 'vol_spike': 0.2495503092951845, 'adx_thresh': 19.116620039958338, 'atr_min_pct': 0.019566503834277747, 'atr_max_pct': 0.14575860751544711, 'tp_mult': 1.0438432334030923, 'tsl_mult': 0.9348316513211866, 'strategy': 'mean_reversion', 'time_stop': 29, 'use_sma': False, 'use_atr': True, 'use_adx': True, 'use_ema': False, 'use_spike': True, 'rsi_required': True, 'edge_k': 0.3937807043803241, 'edge_cap': 0.8578111415166599, 'bull_strategy': 'mean_reversion', 'bull_bb_std_mult': 1.7123272366421507, 'bull_rsi_os': 11, 'bull_rsi_ob': 66, 'bull_adx_thresh': 8.279402973098948, 'bull_atr_min_pct': 0.025278325277727116, 'bull_atr_max_pct': 0.05532771399083014, 'bull_tp_mult': 1.9764482910254868, 'bull_tsl_mult': 0.1878264759406319, 'bull_time_stop': 74, 'bull_use_sma': True, 'bull_use_ema': True, 'bull_use_atr': False, 'bull_use_adx': True, 'bull_use_spike': False, 'bull_rsi_required': False, 'bear_strategy': 'mean_reversion', 'bear_bb_std_mult': 1.191949681342889, 'bear_rsi_os': 13, 'bear_rsi_ob': 58, 'bear_adx_thresh': 19.42635126187052, 'bear_atr_min_pct': 0.009155823777673698, 'bear_atr_max_pct': 0.10334968870616278, 'bear_tp_mult': 2.2439828165278684, 'bear_tsl_mult': 0.30532084810489246, 'bear_time_stop': 202, 'bear_use_sma': True, 'bear_use_ema': False, 'bear_use_atr': True, 'bear_use_adx': False, 'bear_use_spike': False, 'bear_rsi_required': False, 'sideways_strategy': 'breakout', 'sideways_bb_std_mult': 0.5859772069831092, 'sideways_rsi_os': 6, 'sideways_rsi_ob': 75, 'sideways_adx_thresh': 11.82569570899282, 'sideways_atr_min_pct': 0.015172679701129607, 'sideways_atr_max_pct': 0.02842296818099114, 'sideways_tp_mult': 1.1458515685577182, 'sideways_tsl_mult': 0.9821785190993884, 'sideways_time_stop': 38, 'sideways_use_sma': True, 'sideways_use_ema': True, 'sideways_use_atr': False, 'sideways_use_adx': False, 'sideways_use_spike': True, 'sideways_rsi_required': True}.
[I 2025-08-30 17:30:15,206] Trial 784 finished with values: [-1000000000.0, 1000000000.0] and parameters: {'p_sma': 7, 'p_std': 23, 'p_atr': 16, 'p_adx': 9, 'rsi_period': 34, 'ema1': 18, 'ema2': 10, 'slip_atr_k': 0.016406960007011678, 'slip_spread_k': 0.20133233266216705, 'spread_hl_frac': 0.01699249566741897, 'bb_std_mult': 3.2766295603896176, 'rsi_os': 26, 'rsi_ob': 83, 'vol_spike': 0.2448382684646115, 'adx_thresh': 9.428880776768679, 'atr_min_pct': 0.025869225832450382, 'atr_max_pct': 0.1449400023654367, 'tp_mult': 2.7673707730184804, 'tsl_mult': 0.5779314841166886, 'strategy': 'breakout', 'time_stop': 29, 'use_sma': False, 'use_atr': True, 'use_adx': True, 'use_ema': False, 'use_spike': False, 'rsi_required': False, 'edge_k': 0.3396204881964495, 'edge_cap': 0.28067980160246064, 'bull_strategy': 'mean_reversion', 'bull_bb_std_mult': 3.1308849726888424, 'bull_rsi_os': 38, 'bull_rsi_ob': 54, 'bull_adx_thresh': 32.07606707235253, 'bull_atr_min_pct': 0.025307497241349425, 'bull_atr_max_pct': 0.042092958178271064, 'bull_tp_mult': 2.414637488155676, 'bull_tsl_mult': 0.8644084931587986, 'bull_time_stop': 75, 'bull_use_sma': True, 'bull_use_ema': True, 'bull_use_atr': False, 'bull_use_adx': True, 'bull_use_spike': False, 'bull_rsi_required': False, 'bear_strategy': 'mean_reversion', 'bear_bb_std_mult': 1.242158386635574, 'bear_rsi_os': 15, 'bear_rsi_ob': 60, 'bear_adx_thresh': 19.774368367431723, 'bear_atr_min_pct': 0.023478138386101223, 'bear_atr_max_pct': 0.10350819169636792, 'bear_tp_mult': 2.2676362101001666, 'bear_tsl_mult': 0.3737808264007164, 'bear_time_stop': 146, 'bear_use_sma': True, 'bear_use_ema': False, 'bear_use_atr': False, 'bear_use_adx': False, 'bear_use_spike': False, 'bear_rsi_required': False, 'sideways_strategy': 'breakout', 'sideways_bb_std_mult': 0.5453367753698205, 'sideways_rsi_os': 36, 'sideways_rsi_ob': 75, 'sideways_adx_thresh': 26.005688284442577, 'sideways_atr_min_pct': 0.01771147469424753, 'sideways_atr_max_pct': 0.12259175262888744, 'sideways_tp_mult': 2.410378065230918, 'sideways_tsl_mult': 0.4600810082612382, 'sideways_time_stop': 277, 'sideways_use_sma': True, 'sideways_use_ema': False, 'sideways_use_atr': False, 'sideways_use_adx': False, 'sideways_use_spike': False, 'sideways_rsi_required': True}.
