[I 2025-08-30 16:06:29,754] Trial 290 finished with values: [-1000000000.0, 1000000000.0] and parameters: {'p_sma': 5, 'p_std': 57, 'p_atr': 24, 'p_adx': 24, 'rsi_period': 17, 'ema1': 18, 'ema2': 11, 'slip_atr_k': 0.006958688904436799, 'slip_spread_k': 0.6156903695250862, 'spread_hl_frac': 0.01644151581988467, 'bb_std_mult': 3.1233065036762553, 'rsi_os': 35, 'rsi_ob': 87, 'vol_spike': 0.006308862801035901, 'adx_thresh': 12.600618620710298, 'atr_min_pct': 0.0192975946699453, 'atr_max_pct': 0.13450743674693255, 'tp_mult': 2.7188006027279137, 'tsl_mult': 0.4893423488938801, 'strategy': 'mean_reversion', 'time_stop': 133, 'use_sma': False, 'use_atr': True, 'use_adx': True, 'use_ema': False, 'use_spike': False, 'rsi_required': True, 'edge_k': 1.5158648843085683, 'edge_cap': 0.1931379548895676, 'bull_strategy': 'mean_reversion', 'bull_bb_std_mult': 1.9096245500975482, 'bull_rsi_os': 12, 'bull_rsi_ob': 52, 'bull_adx_thresh': 22.243409516603553, 'bull_atr_min_pct': 0.021212648845510544, 'bull_atr_max_pct': 0.14114426668613067, 'bull_tp_mult': 1.2258515021981637, 'bull_tsl_mult': 0.2976926129221226, 'bull_time_stop': 269, 'bull_use_sma': False, 'bull_use_ema': True, 'bull_use_atr': True, 'bull_use_adx': True, 'bull_use_spike': False, 'bull_rsi_required': False, 'bear_strategy': 'mean_reversion', 'bear_bb_std_mult': 1.1365107937086176, 'bear_rsi_os': 13, 'bear_rsi_ob': 77, 'bear_adx_thresh': 13.87199675600952, 'bear_atr_min_pct': 0.022223889300584092, 'bear_atr_max_pct': 0.02165319350981712, 'bear_tp_mult': 2.214329980220932, 'bear_tsl_mult': 0.6394250177487518, 'bear_time_stop': 236, 'bear_use_sma': True, 'bear_use_ema': True, 'bear_use_atr': False, 'bear_use_adx': False, 'bear_use_spike': False, 'bear_rsi_required': False, 'sideways_strategy': 'breakout', 'sideways_bb_std_mult': 2.1266907218802076, 'sideways_rsi_os': 28, 'sideways_rsi_ob': 90, 'sideways_adx_thresh': 16.971734940146074, 'sideways_atr_min_pct': 0.0014237939850571088, 'sideways_atr_max_pct': 0.14233043269415044, 'sideways_tp_mult': 1.4588948652360896, 'sideways_tsl_mult': 0.49764142806990114, 'sideways_time_stop': 207, 'sideways_use_sma': True, 'sideways_use_ema': False, 'sideways_use_atr': False, 'sideways_use_adx': False, 'sideways_use_spike': False, 'sideways_rsi_required': True}.
[I 2025-08-30 16:06:29,977] Trial 287 finished with values: [-0.012300776251301437, 0.012199660798814824] and parameters: {'p_sma': 10, 'p_std': 26, 'p_atr': 27, 'p_adx': 24, 'rsi_period': 19, 'ema1': 18, 'ema2': 11, 'slip_atr_k': 0.006405165292344525, 'slip_spread_k': 0.6444014961420379, 'spread_hl_frac': 0.018479940342189864, 'bb_std_mult': 3.3302582950969155, 'rsi_os': 34, 'rsi_ob': 87, 'vol_spike': 0.005355686491597721, 'adx_thresh': 12.491836135779998, 'atr_min_pct': 0.019288605866317053, 'atr_max_pct': 0.13549080925130996, 'tp_mult': 2.90464300675421, 'tsl_mult': 0.47285822488713153, 'strategy': 'mean_reversion', 'time_stop': 106, 'use_sma': False, 'use_atr': True, 'use_adx': True, 'use_ema': False, 'use_spike': False, 'rsi_required': True, 'edge_k': 1.6137648503613362, 'edge_cap': 0.20992396591222473, 'bull_strategy': 'mean_reversion', 'bull_bb_std_mult': 1.966758632415433, 'bull_rsi_os': 13, 'bull_rsi_ob': 52, 'bull_adx_thresh': 22.727051936483978, 'bull_atr_min_pct': 0.021214863043864985, 'bull_atr_max_pct': 0.141060497095211, 'bull_tp_mult': 1.2413542451599595, 'bull_tsl_mult': 0.26107154854724646, 'bull_time_stop': 58, 'bull_use_sma': False, 'bull_use_ema': False, 'bull_use_atr': True, 'bull_use_adx': True, 'bull_use_spike': True, 'bull_rsi_required': False, 'bear_strategy': 'mean_reversion', 'bear_bb_std_mult': 1.9836659386979718, 'bear_rsi_os': 12, 'bear_rsi_ob': 79, 'bear_adx_thresh': 13.92838648241746, 'bear_atr_min_pct': 0.02170195717346861, 'bear_atr_max_pct': 0.05781861334298358, 'bear_tp_mult': 2.1743594820014542, 'bear_tsl_mult': 0.6504521605605627, 'bear_time_stop': 219, 'bear_use_sma': True, 'bear_use_ema': True, 'bear_use_atr': False, 'bear_use_adx': True, 'bear_use_spike': False, 'bear_rsi_required': True, 'sideways_strategy': 'breakout', 'sideways_bb_std_mult': 1.9967222157594893, 'sideways_rsi_os': 26, 'sideways_rsi_ob': 62, 'sideways_adx_thresh': 17.961745279855336, 'sideways_atr_min_pct': 0.0012026365005607304, 'sideways_atr_max_pct': 0.14132849783216112, 'sideways_tp_mult': 1.456891946515647, 'sideways_tsl_mult': 0.5147399883807432, 'sideways_time_stop': 197, 'sideways_use_sma': True, 'sideways_use_ema': False, 'sideways_use_atr': True, 'sideways_use_adx': False, 'sideways_use_spike': True, 'sideways_rsi_required': True}.
[I 2025-08-30 16:06:30,225] Trial 288 finished with values: [-1000000000.0, 1000000000.0] and parameters: {'p_sma': 5, 'p_std': 38, 'p_atr': 23, 'p_adx': 24, 'rsi_period': 20, 'ema1': 26, 'ema2': 10, 'slip_atr_k': 0.005754886068008069, 'slip_spread_k': 0.5525474206797488, 'spread_hl_frac': 0.01865462914827036, 'bb_std_mult': 3.1242182919980874, 'rsi_os': 33, 'rsi_ob': 87, 'vol_spike': 0.006961317958816143, 'adx_thresh': 12.437287619775741, 'atr_min_pct': 0.019456638773593604, 'atr_max_pct': 0.1348198256428689, 'tp_mult': 2.7584001420098847, 'tsl_mult': 0.4659168843337191, 'strategy': 'mean_reversion', 'time_stop': 9, 'use_sma': False, 'use_atr': True, 'use_adx': True, 'use_ema': False, 'use_spike': False, 'rsi_required': True, 'edge_k': 1.505753377696076, 'edge_cap': 0.6492928160940296, 'bull_strategy': 'mean_reversion', 'bull_bb_std_mult': 1.9381726640177444, 'bull_rsi_os': 45, 'bull_rsi_ob': 49, 'bull_adx_thresh': 21.774653889178516, 'bull_atr_min_pct': 0.021138089745252407, 'bull_atr_max_pct': 0.14135177214811198, 'bull_tp_mult': 1.1932745138694578, 'bull_tsl_mult': 0.26039839780397156, 'bull_time_stop': 272, 'bull_use_sma': False, 'bull_use_ema': False, 'bull_use_atr': True, 'bull_use_adx': True, 'bull_use_spike': True, 'bull_rsi_required': False, 'bear_strategy': 'mean_reversion', 'bear_bb_std_mult': 2.0064339928623713, 'bear_rsi_os': 13, 'bear_rsi_ob': 67, 'bear_adx_thresh': 13.751736691498932, 'bear_atr_min_pct': 0.022084080875540313, 'bear_atr_max_pct': 0.035130754169395366, 'bear_tp_mult': 2.195904029028351, 'bear_tsl_mult': 0.6422929949189606, 'bear_time_stop': 232, 'bear_use_sma': True, 'bear_use_ema': True, 'bear_use_atr': False, 'bear_use_adx': False, 'bear_use_spike': False, 'bear_rsi_required': False, 'sideways_strategy': 'breakout', 'sideways_bb_std_mult': 1.9661912609001557, 'sideways_rsi_os': 27, 'sideways_rsi_ob': 90, 'sideways_adx_thresh': 16.88130566156801, 'sideways_atr_min_pct': 0.0013512272158339486, 'sideways_atr_max_pct': 0.1414373025604859, 'sideways_tp_mult': 1.4588441867923811, 'sideways_tsl_mult': 0.4946203425071333, 'sideways_time_stop': 207, 'sideways_use_sma': True, 'sideways_use_ema': False, 'sideways_use_atr': True, 'sideways_use_adx': False, 'sideways_use_spike': True, 'sideways_rsi_required': True}.
[I 2025-08-30 16:07:14,087] Trial 293 finished with values: [-1000000000.0, 1000000000.0] and parameters: {'p_sma': 9, 'p_std': 56, 'p_atr': 28, 'p_adx': 25, 'rsi_period': 22, 'ema1': 26, 'ema2': 14, 'slip_atr_k': 0.008103771049015735, 'slip_spread_k': 0.645212768001849, 'spread_hl_frac': 0.018557120147716946, 'bb_std_mult': 3.1352446384436368, 'rsi_os': 33, 'rsi_ob': 88, 'vol_spike': 0.006332714690134465, 'adx_thresh': 13.863650081111924, 'atr_min_pct': 0.01730541854357838, 'atr_max_pct': 0.12676898082295213, 'tp_mult': 2.783036117017458, 'tsl_mult': 0.47075031277651447, 'strategy': 'mean_reversion', 'time_stop': 82, 'use_sma': False, 'use_atr': True, 'use_adx': True, 'use_ema': False, 'use_spike': False, 'rsi_required': True, 'edge_k': 1.4531977499363598, 'edge_cap': 0.656856351469202, 'bull_strategy': 'mean_reversion', 'bull_bb_std_mult': 1.917007251749629, 'bull_rsi_os': 11, 'bull_rsi_ob': 49, 'bull_adx_thresh': 21.85514756131552, 'bull_atr_min_pct': 0.02093136739586404, 'bull_atr_max_pct': 0.14435695876890933, 'bull_tp_mult': 1.3604323593120329, 'bull_tsl_mult': 0.25473055634872704, 'bull_time_stop': 67, 'bull_use_sma': False, 'bull_use_ema': False, 'bull_use_atr': True, 'bull_use_adx': True, 'bull_use_spike': False, 'bull_rsi_required': False, 'bear_strategy': 'mean_reversion', 'bear_bb_std_mult': 2.0760451604425074, 'bear_rsi_os': 10, 'bear_rsi_ob': 48, 'bear_adx_thresh': 12.983687296292228, 'bear_atr_min_pct': 0.021013887074985374, 'bear_atr_max_pct': 0.09564253645984026, 'bear_tp_mult': 2.1814103686555133, 'bear_tsl_mult': 0.6664115303859242, 'bear_time_stop': 220, 'bear_use_sma': True, 'bear_use_ema': False, 'bear_use_atr': False, 'bear_use_adx': True, 'bear_use_spike': False, 'bear_rsi_required': True, 'sideways_strategy': 'mean_reversion', 'sideways_bb_std_mult': 1.9702913746047115, 'sideways_rsi_os': 26, 'sideways_rsi_ob': 69, 'sideways_adx_thresh': 16.771035960465227, 'sideways_atr_min_pct': 0.018807873681848677, 'sideways_atr_max_pct': 0.13726589534514033, 'sideways_tp_mult': 1.394098726796741, 'sideways_tsl_mult': 0.5129453556512918, 'sideways_time_stop': 207, 'sideways_use_sma': True, 'sideways_use_ema': False, 'sideways_use_atr': True, 'sideways_use_adx': False, 'sideways_use_spike': False, 'sideways_rsi_required': True}.
[I 2025-08-30 16:07:15,524] Trial 292 finished with values: [-0.03869183941738208, 0.03862977374745185] and parameters: {'p_sma': 8, 'p_std': 60, 'p_atr': 26, 'p_adx': 25, 'rsi_period': 22, 'ema1': 26, 'ema2': 13, 'slip_atr_k': 0.18678428509388934, 'slip_spread_k': 0.6485132287252495, 'spread_hl_frac': 0.01882452463858624, 'bb_std_mult': 3.1345552248467015, 'rsi_os': 33, 'rsi_ob': 95, 'vol_spike': 0.006142304112303958, 'adx_thresh': 10.993952949860631, 'atr_min_pct': 0.01731170677270347, 'atr_max_pct': 0.13635009296413744, 'tp_mult': 2.7944366715826203, 'tsl_mult': 0.4723822914091361, 'strategy': 'mean_reversion', 'time_stop': 18, 'use_sma': False, 'use_atr': True, 'use_adx': True, 'use_ema': False, 'use_spike': False, 'rsi_required': True, 'edge_k': 1.4710508387404195, 'edge_cap': 0.649622930678012, 'bull_strategy': 'mean_reversion', 'bull_bb_std_mult': 1.9635777280291786, 'bull_rsi_os': 7, 'bull_rsi_ob': 49, 'bull_adx_thresh': 21.81831176450544, 'bull_atr_min_pct': 0.021754990127262314, 'bull_atr_max_pct': 0.14448011006298847, 'bull_tp_mult': 1.2866252854010602, 'bull_tsl_mult': 0.25201772108840437, 'bull_time_stop': 58, 'bull_use_sma': False, 'bull_use_ema': False, 'bull_use_atr': True, 'bull_use_adx': True, 'bull_use_spike': False, 'bull_rsi_required': False, 'bear_strategy': 'mean_reversion', 'bear_bb_std_mult': 2.0569379859041756, 'bear_rsi_os': 12, 'bear_rsi_ob': 54, 'bear_adx_thresh': 22.288106913137696, 'bear_atr_min_pct': 0.021072664167072513, 'bear_atr_max_pct': 0.030044938484612954, 'bear_tp_mult': 2.195934651571847, 'bear_tsl_mult': 0.6665833310446989, 'bear_time_stop': 220, 'bear_use_sma': True, 'bear_use_ema': False, 'bear_use_atr': False, 'bear_use_adx': False, 'bear_use_spike': False, 'bear_rsi_required': False, 'sideways_strategy': 'mean_reversion', 'sideways_bb_std_mult': 1.9489807051747619, 'sideways_rsi_os': 26, 'sideways_rsi_ob': 46, 'sideways_adx_thresh': 16.828615776612065, 'sideways_atr_min_pct': 0.00126549725746198, 'sideways_atr_max_pct': 0.12677806063841207, 'sideways_tp_mult': 1.3724750208298528, 'sideways_tsl_mult': 0.42101723228190874, 'sideways_time_stop': 206, 'sideways_use_sma': True, 'sideways_use_ema': False, 'sideways_use_atr': True, 'sideways_use_adx': False, 'sideways_use_spike': False, 'sideways_rsi_required': True}.
[I 2025-08-30 16:07:15,545] Trial 294 finished with values: [-1000000000.0, 1000000000.0] and parameters: {'p_sma': 9, 'p_std': 60, 'p_atr': 28, 'p_adx': 25, 'rsi_period': 22, 'ema1': 9, 'ema2': 14, 'slip_atr_k': 0.009689833625965212, 'slip_spread_k': 0.647508553851174, 'spread_hl_frac': 0.020239236005777664, 'bb_std_mult': 3.196648477323404, 'rsi_os': 33, 'rsi_ob': 90, 'vol_spike': 0.006055273569324683, 'adx_thresh': 11.186075431355377, 'atr_min_pct': 0.017257274003631466, 'atr_max_pct': 0.028499131983401704, 'tp_mult': 2.6138986169397236, 'tsl_mult': 0.1475206498636194, 'strategy': 'mean_reversion', 'time_stop': 106, 'use_sma': False, 'use_atr': True, 'use_adx': True, 'use_ema': False, 'use_spike': False, 'rsi_required': True, 'edge_k': 1.4439915281433453, 'edge_cap': 0.25125958040252777, 'bull_strategy': 'mean_reversion', 'bull_bb_std_mult': 1.8980128057184928, 'bull_rsi_os': 7, 'bull_rsi_ob': 51, 'bull_adx_thresh': 20.14673995458517, 'bull_atr_min_pct': 0.022024454873690587, 'bull_atr_max_pct': 0.13780501141580162, 'bull_tp_mult': 1.1363695561104663, 'bull_tsl_mult': 0.2420626683464108, 'bull_time_stop': 285, 'bull_use_sma': False, 'bull_use_ema': True, 'bull_use_atr': True, 'bull_use_adx': True, 'bull_use_spike': False, 'bull_rsi_required': False, 'bear_strategy': 'mean_reversion', 'bear_bb_std_mult': 2.0608695252615963, 'bear_rsi_os': 10, 'bear_rsi_ob': 54, 'bear_adx_thresh': 12.857318849537005, 'bear_atr_min_pct': 0.021070523822296863, 'bear_atr_max_pct': 0.031238105859680357, 'bear_tp_mult': 2.196797050984118, 'bear_tsl_mult': 0.6702553841283773, 'bear_time_stop': 221, 'bear_use_sma': True, 'bear_use_ema': False, 'bear_use_atr': False, 'bear_use_adx': True, 'bear_use_spike': False, 'bear_rsi_required': True, 'sideways_strategy': 'mean_reversion', 'sideways_bb_std_mult': 2.1830349425377062, 'sideways_rsi_os': 26, 'sideways_rsi_ob': 69, 'sideways_adx_thresh': 16.74699037509232, 'sideways_atr_min_pct': 0.001495654992067759, 'sideways_atr_max_pct': 0.1363703378250641, 'sideways_tp_mult': 1.3903893839022121, 'sideways_tsl_mult': 0.41964140747115874, 'sideways_time_stop': 198, 'sideways_use_sma': True, 'sideways_use_ema': False, 'sideways_use_atr': False, 'sideways_use_adx': False, 'sideways_use_spike': False, 'sideways_rsi_required': True}.
[I 2025-08-30 16:07:15,940] Trial 291 finished with values: [-1000000000.0, 1000000000.0] and parameters: {'p_sma': 8, 'p_std': 56, 'p_atr': 10, 'p_adx': 24, 'rsi_period': 21, 'ema1': 21, 'ema2': 14, 'slip_atr_k': 0.0038662323059145422, 'slip_spread_k': 0.6118548498311724, 'spread_hl_frac': 0.016500948488007844, 'bb_std_mult': 3.1522935543986432, 'rsi_os': 33, 'rsi_ob': 86, 'vol_spike': 0.005273185854959184, 'adx_thresh': 11.102398066240493, 'atr_min_pct': 0.017112115846957904, 'atr_max_pct': 0.12697106594147467, 'tp_mult': 2.7556144391788, 'tsl_mult': 0.47429542936979024, 'strategy': 'mean_reversion', 'time_stop': 197, 'use_sma': False, 'use_atr': True, 'use_adx': True, 'use_ema': False, 'use_spike': False, 'rsi_required': True, 'edge_k': 1.4646578064857816, 'edge_cap': 0.6506347583744078, 'bull_strategy': 'mean_reversion', 'bull_bb_std_mult': 1.915977596058343, 'bull_rsi_os': 7, 'bull_rsi_ob': 52, 'bull_adx_thresh': 22.005059220106748, 'bull_atr_min_pct': 0.021110842145678186, 'bull_atr_max_pct': 0.139160650017599, 'bull_tp_mult': 1.2150133399850054, 'bull_tsl_mult': 0.29299015072800355, 'bull_time_stop': 66, 'bull_use_sma': False, 'bull_use_ema': True, 'bull_use_atr': True, 'bull_use_adx': True, 'bull_use_spike': False, 'bull_rsi_required': False, 'bear_strategy': 'mean_reversion', 'bear_bb_std_mult': 2.05174723073494, 'bear_rsi_os': 13, 'bear_rsi_ob': 54, 'bear_adx_thresh': 13.08749141889145, 'bear_atr_min_pct': 0.02110561869876693, 'bear_atr_max_pct': 0.09787214751102814, 'bear_tp_mult': 2.1973985045707485, 'bear_tsl_mult': 0.6634964610010604, 'bear_time_stop': 222, 'bear_use_sma': True, 'bear_use_ema': False, 'bear_use_atr': False, 'bear_use_adx': False, 'bear_use_spike': False, 'bear_rsi_required': False, 'sideways_strategy': 'mean_reversion', 'sideways_bb_std_mult': 2.071112680493244, 'sideways_rsi_os': 27, 'sideways_rsi_ob': 69, 'sideways_adx_thresh': 17.20900240104681, 'sideways_atr_min_pct': 0.024668575420406208, 'sideways_atr_max_pct': 0.12538854756253323, 'sideways_tp_mult': 1.3634203084916934, 'sideways_tsl_mult': 0.42257179463528366, 'sideways_time_stop': 209, 'sideways_use_sma': True, 'sideways_use_ema': False, 'sideways_use_atr': False, 'sideways_use_adx': False, 'sideways_use_spike': False, 'sideways_rsi_required': True}.
[I 2025-08-30 16:07:58,170] Trial 297 finished with values: [-1000000000.0, 1000000000.0] and parameters: {'p_sma': 6, 'p_std': 57, 'p_atr': 27, 'p_adx': 23, 'rsi_period': 19, 'ema1': 8, 'ema2': 10, 'slip_atr_k': 0.00010153712972697012, 'slip_spread_k': 0.6058460309685693, 'spread_hl_frac': 0.014833380692891043, 'bb_std_mult': 3.1728660066662933, 'rsi_os': 35, 'rsi_ob': 93, 'vol_spike': 0.0007258057763669945, 'adx_thresh': 13.173255898774698, 'atr_min_pct': 0.018206342201495376, 'atr_max_pct': 0.08770745052256974, 'tp_mult': 2.9358863925421312, 'tsl_mult': 0.2668587108952014, 'strategy': 'mean_reversion', 'time_stop': 167, 'use_sma': False, 'use_atr': True, 'use_adx': True, 'use_ema': True, 'use_spike': False, 'rsi_required': True, 'edge_k': 1.6307584390725904, 'edge_cap': 0.2123959607090351, 'bull_strategy': 'mean_reversion', 'bull_bb_std_mult': 2.0758739411800944, 'bull_rsi_os': 55, 'bull_rsi_ob': 53, 'bull_adx_thresh': 22.785288115111427, 'bull_atr_min_pct': 0.020200419428873687, 'bull_atr_max_pct': 0.13508949689377037, 'bull_tp_mult': 2.2484569320300634, 'bull_tsl_mult': 0.2915465387542637, 'bull_time_stop': 69, 'bull_use_sma': False, 'bull_use_ema': True, 'bull_use_atr': True, 'bull_use_adx': True, 'bull_use_spike': False, 'bull_rsi_required': False, 'bear_strategy': 'breakout', 'bear_bb_std_mult': 1.5070446235790618, 'bear_rsi_os': 11, 'bear_rsi_ob': 79, 'bear_adx_thresh': 12.580718752763355, 'bear_atr_min_pct': 0.02265899311137857, 'bear_atr_max_pct': 0.06024268823200895, 'bear_tp_mult': 2.0848282733400776, 'bear_tsl_mult': 0.6238053796854285, 'bear_time_stop': 228, 'bear_use_sma': True, 'bear_use_ema': False, 'bear_use_atr': False, 'bear_use_adx': False, 'bear_use_spike': False, 'bear_rsi_required': False, 'sideways_strategy': 'breakout', 'sideways_bb_std_mult': 2.075128853097047, 'sideways_rsi_os': 28, 'sideways_rsi_ob': 91, 'sideways_adx_thresh': 18.236356580200216, 'sideways_atr_min_pct': 0.0017488305370159454, 'sideways_atr_max_pct': 0.14341828876338403, 'sideways_tp_mult': 1.4334552927111466, 'sideways_tsl_mult': 0.45621894325583845, 'sideways_time_stop': 276, 'sideways_use_sma': False, 'sideways_use_ema': False, 'sideways_use_atr': False, 'sideways_use_adx': False, 'sideways_use_spike': False, 'sideways_rsi_required': True}.
[I 2025-08-30 16:07:59,061] Trial 298 finished with values: [-1000000000.0, 1000000000.0] and parameters: {'p_sma': 10, 'p_std': 57, 'p_atr': 27, 'p_adx': 23, 'rsi_period': 19, 'ema1': 16, 'ema2': 10, 'slip_atr_k': 0.23885216001398724, 'slip_spread_k': 0.5619467010675755, 'spread_hl_frac': 0.014955899574926861, 'bb_std_mult': 3.5968284589259683, 'rsi_os': 35, 'rsi_ob': 90, 'vol_spike': 0.16100260541422823, 'adx_thresh': 12.928013208541051, 'atr_min_pct': 0.01817164927400117, 'atr_max_pct': 0.12955378689378733, 'tp_mult': 2.933121630393446, 'tsl_mult': 0.27397428050235745, 'strategy': 'mean_reversion', 'time_stop': 173, 'use_sma': False, 'use_atr': False, 'use_adx': True, 'use_ema': True, 'use_spike': False, 'rsi_required': True, 'edge_k': 1.6338782137427115, 'edge_cap': 0.6074386642369134, 'bull_strategy': 'mean_reversion', 'bull_bb_std_mult': 1.8632971222200974, 'bull_rsi_os': 16, 'bull_rsi_ob': 47, 'bull_adx_thresh': 22.58039412923208, 'bull_atr_min_pct': 0.01995536459286201, 'bull_atr_max_pct': 0.1325387959623856, 'bull_tp_mult': 1.3301608658505084, 'bull_tsl_mult': 0.2939591332831822, 'bull_time_stop': 49, 'bull_use_sma': False, 'bull_use_ema': True, 'bull_use_atr': True, 'bull_use_adx': True, 'bull_use_spike': False, 'bull_rsi_required': False, 'bear_strategy': 'breakout', 'bear_bb_std_mult': 1.613654219723069, 'bear_rsi_os': 11, 'bear_rsi_ob': 79, 'bear_adx_thresh': 14.242817649032945, 'bear_atr_min_pct': 0.022697086563376722, 'bear_atr_max_pct': 0.09259314560079257, 'bear_tp_mult': 2.100866389915454, 'bear_tsl_mult': 0.6235600318586089, 'bear_time_stop': 230, 'bear_use_sma': True, 'bear_use_ema': False, 'bear_use_atr': False, 'bear_use_adx': False, 'bear_use_spike': False, 'bear_rsi_required': False, 'sideways_strategy': 'breakout', 'sideways_bb_std_mult': 2.2156635104986444, 'sideways_rsi_os': 28, 'sideways_rsi_ob': 79, 'sideways_adx_thresh': 17.732493503475474, 'sideways_atr_min_pct': 0.001860755770411609, 'sideways_atr_max_pct': 0.12104256790449076, 'sideways_tp_mult': 1.4407683647440062, 'sideways_tsl_mult': 0.45306360403312396, 'sideways_time_stop': 277, 'sideways_use_sma': False, 'sideways_use_ema': False, 'sideways_use_atr': False, 'sideways_use_adx': False, 'sideways_use_spike': False, 'sideways_rsi_required': True}.
