[I 2025-08-30 17:04:05,221] Trial 619 finished with values: [-0.023433377445769454, 0.02336462760388372] and parameters: {'p_sma': 37, 'p_std': 16, 'p_atr': 16, 'p_adx': 8, 'rsi_period': 22, 'ema1': 18, 'ema2': 34, 'slip_atr_k': 0.009170544404511372, 'slip_spread_k': 0.27664820550396624, 'spread_hl_frac': 0.02041586921304553, 'bb_std_mult': 1.0335872542345936, 'rsi_os': 33, 'rsi_ob': 85, 'vol_spike': 0.12247111971740103, 'adx_thresh': 10.994045675078526, 'atr_min_pct': 0.0019450972118940577, 'atr_max_pct': 0.14383300731891643, 'tp_mult': 2.8213850910932954, 'tsl_mult': 0.9175853068642323, 'strategy': 'breakout', 'time_stop': 35, 'use_sma': False, 'use_atr': True, 'use_adx': True, 'use_ema': True, 'use_spike': False, 'rsi_required': False, 'edge_k': 0.4409271812471943, 'edge_cap': 0.8458920067132495, 'bull_strategy': 'mean_reversion', 'bull_bb_std_mult': 2.7807174990524475, 'bull_rsi_os': 8, 'bull_rsi_ob': 53, 'bull_adx_thresh': 34.19592869347561, 'bull_atr_min_pct': 0.023079123698288847, 'bull_atr_max_pct': 0.09770158242991112, 'bull_tp_mult': 2.243940309725202, 'bull_tsl_mult': 0.8178386321127595, 'bull_time_stop': 295, 'bull_use_sma': True, 'bull_use_ema': True, 'bull_use_atr': False, 'bull_use_adx': True, 'bull_use_spike': True, 'bull_rsi_required': False, 'bear_strategy': 'breakout', 'bear_bb_std_mult': 1.3509141404265415, 'bear_rsi_os': 16, 'bear_rsi_ob': 67, 'bear_adx_thresh': 11.333927975147432, 'bear_atr_min_pct': 0.019829488296111517, 'bear_atr_max_pct': 0.10328184758157644, 'bear_tp_mult': 2.140588749495648, 'bear_tsl_mult': 0.5825973857583508, 'bear_time_stop': 210, 'bear_use_sma': True, 'bear_use_ema': False, 'bear_use_atr': False, 'bear_use_adx': False, 'bear_use_spike': True, 'bear_rsi_required': False, 'sideways_strategy': 'breakout', 'sideways_bb_std_mult': 0.7026124068604795, 'sideways_rsi_os': 35, 'sideways_rsi_ob': 93, 'sideways_adx_thresh': 9.03364533181605, 'sideways_atr_min_pct': 0.0026623747139305418, 'sideways_atr_max_pct': 0.09963268413476456, 'sideways_tp_mult': 2.997249134108112, 'sideways_tsl_mult': 0.4201063055500489, 'sideways_time_stop': 289, 'sideways_use_sma': True, 'sideways_use_ema': False, 'sideways_use_atr': True, 'sideways_use_adx': False, 'sideways_use_spike': False, 'sideways_rsi_required': True}.
[I 2025-08-30 17:04:05,529] Trial 621 finished with values: [-0.04980476309410953, 0.049764478595034294] and parameters: {'p_sma': 57, 'p_std': 22, 'p_atr': 16, 'p_adx': 10, 'rsi_period': 22, 'ema1': 19, 'ema2': 12, 'slip_atr_k': 0.17243281309652966, 'slip_spread_k': 0.1405059380376933, 'spread_hl_frac': 0.041834087264733394, 'bb_std_mult': 2.0542982571273356, 'rsi_os': 32, 'rsi_ob': 85, 'vol_spike': 0.1225880854291799, 'adx_thresh': 11.052362842607396, 'atr_min_pct': 0.024971763625795736, 'atr_max_pct': 0.14990368282238042, 'tp_mult': 2.814607032642018, 'tsl_mult': 0.9472938349381619, 'strategy': 'mean_reversion', 'time_stop': 34, 'use_sma': True, 'use_atr': True, 'use_adx': True, 'use_ema': False, 'use_spike': False, 'rsi_required': True, 'edge_k': 0.43834803515397447, 'edge_cap': 0.8868072460589265, 'bull_strategy': 'mean_reversion', 'bull_bb_std_mult': 1.8606830981483429, 'bull_rsi_os': 43, 'bull_rsi_ob': 54, 'bull_adx_thresh': 33.721772192916944, 'bull_atr_min_pct': 0.021743232198743603, 'bull_atr_max_pct': 0.11421620708594574, 'bull_tp_mult': 2.2436139770137866, 'bull_tsl_mult': 0.7789954267018894, 'bull_time_stop': 85, 'bull_use_sma': True, 'bull_use_ema': True, 'bull_use_atr': False, 'bull_use_adx': True, 'bull_use_spike': True, 'bull_rsi_required': False, 'bear_strategy': 'mean_reversion', 'bear_bb_std_mult': 1.4736810562051903, 'bear_rsi_os': 18, 'bear_rsi_ob': 74, 'bear_adx_thresh': 12.09495792360567, 'bear_atr_min_pct': 0.019140241668776738, 'bear_atr_max_pct': 0.10392955842404777, 'bear_tp_mult': 2.8972723445706916, 'bear_tsl_mult': 0.5802667377722017, 'bear_time_stop': 205, 'bear_use_sma': False, 'bear_use_ema': True, 'bear_use_atr': False, 'bear_use_adx': True, 'bear_use_spike': False, 'bear_rsi_required': False, 'sideways_strategy': 'breakout', 'sideways_bb_std_mult': 0.8748277504924017, 'sideways_rsi_os': 31, 'sideways_rsi_ob': 93, 'sideways_adx_thresh': 11.459037319018968, 'sideways_atr_min_pct': 0.0015533847952426065, 'sideways_atr_max_pct': 0.09254792979418838, 'sideways_tp_mult': 2.873908295272293, 'sideways_tsl_mult': 0.39892883199770496, 'sideways_time_stop': 287, 'sideways_use_sma': True, 'sideways_use_ema': False, 'sideways_use_atr': False, 'sideways_use_adx': True, 'sideways_use_spike': False, 'sideways_rsi_required': True}.
[I 2025-08-30 17:04:50,423] Trial 626 finished with values: [-1000000000.0, 1000000000.0] and parameters: {'p_sma': 5, 'p_std': 20, 'p_atr': 16, 'p_adx': 12, 'rsi_period': 23, 'ema1': 18, 'ema2': 10, 'slip_atr_k': 0.014573803919336315, 'slip_spread_k': 0.07404549739188049, 'spread_hl_frac': 0.00386489948945698, 'bb_std_mult': 1.2282828009905709, 'rsi_os': 31, 'rsi_ob': 86, 'vol_spike': 0.05218807045485709, 'adx_thresh': 9.410661893397437, 'atr_min_pct': 0.02054833860760451, 'atr_max_pct': 0.14465643163407257, 'tp_mult': 1.634088466147791, 'tsl_mult': 0.9632706034711374, 'strategy': 'mean_reversion', 'time_stop': 43, 'use_sma': False, 'use_atr': False, 'use_adx': False, 'use_ema': False, 'use_spike': False, 'rsi_required': True, 'edge_k': 0.6228417600711345, 'edge_cap': 0.8121512602467279, 'bull_strategy': 'breakout', 'bull_bb_std_mult': 2.0161869533862924, 'bull_rsi_os': 15, 'bull_rsi_ob': 53, 'bull_adx_thresh': 34.98244783867215, 'bull_atr_min_pct': 0.023890491609182152, 'bull_atr_max_pct': 0.02881234065389325, 'bull_tp_mult': 2.2973582422994867, 'bull_tsl_mult': 0.8484694551590539, 'bull_time_stop': 78, 'bull_use_sma': True, 'bull_use_ema': False, 'bull_use_atr': False, 'bull_use_adx': False, 'bull_use_spike': False, 'bull_rsi_required': False, 'bear_strategy': 'mean_reversion', 'bear_bb_std_mult': 1.2693984322039973, 'bear_rsi_os': 15, 'bear_rsi_ob': 74, 'bear_adx_thresh': 22.373794110745408, 'bear_atr_min_pct': 0.019176287158894707, 'bear_atr_max_pct': 0.11332337705255456, 'bear_tp_mult': 1.4125574334596602, 'bear_tsl_mult': 0.4800612471671119, 'bear_time_stop': 212, 'bear_use_sma': True, 'bear_use_ema': False, 'bear_use_atr': False, 'bear_use_adx': False, 'bear_use_spike': False, 'bear_rsi_required': False, 'sideways_strategy': 'mean_reversion', 'sideways_bb_std_mult': 0.8233887983687295, 'sideways_rsi_os': 30, 'sideways_rsi_ob': 66, 'sideways_adx_thresh': 12.455062420290792, 'sideways_atr_min_pct': 0.019312133583454818, 'sideways_atr_max_pct': 0.09509486334955217, 'sideways_tp_mult': 2.9311108605743157, 'sideways_tsl_mult': 0.6473323764485733, 'sideways_time_stop': 279, 'sideways_use_sma': False, 'sideways_use_ema': False, 'sideways_use_atr': False, 'sideways_use_adx': False, 'sideways_use_spike': False, 'sideways_rsi_required': False}.
[I 2025-08-30 17:04:51,231] Trial 624 finished with values: [-0.03571946321845121, 0.0356274723738115] and parameters: {'p_sma': 54, 'p_std': 23, 'p_atr': 16, 'p_adx': 12, 'rsi_period': 24, 'ema1': 19, 'ema2': 10, 'slip_atr_k': 0.03546073839321408, 'slip_spread_k': 0.14782711425859302, 'spread_hl_frac': 0.017607120771870044, 'bb_std_mult': 3.2262043422327196, 'rsi_os': 31, 'rsi_ob': 86, 'vol_spike': 0.05581245356029977, 'adx_thresh': 11.349277507816048, 'atr_min_pct': 0.019656263621767537, 'atr_max_pct': 0.14403376471889812, 'tp_mult': 2.748826564858668, 'tsl_mult': 0.9161678526957975, 'strategy': 'mean_reversion', 'time_stop': 40, 'use_sma': False, 'use_atr': False, 'use_adx': True, 'use_ema': False, 'use_spike': False, 'rsi_required': True, 'edge_k': 0.5160182445094794, 'edge_cap': 0.8720510229232268, 'bull_strategy': 'breakout', 'bull_bb_std_mult': 2.51396728422891, 'bull_rsi_os': 14, 'bull_rsi_ob': 53, 'bull_adx_thresh': 33.224200426135326, 'bull_atr_min_pct': 0.024011656096454004, 'bull_atr_max_pct': 0.14572256627920807, 'bull_tp_mult': 2.2822897776584607, 'bull_tsl_mult': 0.7726692411014895, 'bull_time_stop': 85, 'bull_use_sma': True, 'bull_use_ema': True, 'bull_use_atr': False, 'bull_use_adx': True, 'bull_use_spike': False, 'bull_rsi_required': False, 'bear_strategy': 'mean_reversion', 'bear_bb_std_mult': 1.3363808857954742, 'bear_rsi_os': 20, 'bear_rsi_ob': 71, 'bear_adx_thresh': 22.277194180103766, 'bear_atr_min_pct': 0.02017798031837091, 'bear_atr_max_pct': 0.10998810666794946, 'bear_tp_mult': 2.1323791221505863, 'bear_tsl_mult': 0.9147925255238873, 'bear_time_stop': 211, 'bear_use_sma': False, 'bear_use_ema': False, 'bear_use_atr': False, 'bear_use_adx': False, 'bear_use_spike': False, 'bear_rsi_required': False, 'sideways_strategy': 'breakout', 'sideways_bb_std_mult': 0.8480410953368862, 'sideways_rsi_os': 30, 'sideways_rsi_ob': 93, 'sideways_adx_thresh': 11.288557558996173, 'sideways_atr_min_pct': 0.0014137995735306347, 'sideways_atr_max_pct': 0.09815237797644484, 'sideways_tp_mult': 2.9382039253994474, 'sideways_tsl_mult': 0.6836096394305178, 'sideways_time_stop': 277, 'sideways_use_sma': False, 'sideways_use_ema': False, 'sideways_use_atr': False, 'sideways_use_adx': True, 'sideways_use_spike': False, 'sideways_rsi_required': False}.
[I 2025-08-30 17:04:51,618] Trial 625 finished with values: [-0.014425688250356283, 0.01430358373018523] and parameters: {'p_sma': 7, 'p_std': 21, 'p_atr': 16, 'p_adx': 12, 'rsi_period': 24, 'ema1': 19, 'ema2': 10, 'slip_atr_k': 0.17158152645312863, 'slip_spread_k': 0.06755083812507497, 'spread_hl_frac': 0.01811922034947905, 'bb_std_mult': 1.943700436687554, 'rsi_os': 31, 'rsi_ob': 86, 'vol_spike': 0.05762462758870013, 'adx_thresh': 9.580999164078618, 'atr_min_pct': 0.019670407892094916, 'atr_max_pct': 0.14996498331018263, 'tp_mult': 1.280058953450478, 'tsl_mult': 0.9439811275318881, 'strategy': 'mean_reversion', 'time_stop': 40, 'use_sma': False, 'use_atr': False, 'use_adx': True, 'use_ema': False, 'use_spike': False, 'rsi_required': True, 'edge_k': 0.514462313233273, 'edge_cap': 0.8222428596255287, 'bull_strategy': 'breakout', 'bull_bb_std_mult': 1.105254311003544, 'bull_rsi_os': 43, 'bull_rsi_ob': 53, 'bull_adx_thresh': 33.254615660254785, 'bull_atr_min_pct': 0.02176777983105832, 'bull_atr_max_pct': 0.11399879721979406, 'bull_tp_mult': 2.291030334217516, 'bull_tsl_mult': 0.7551393673877426, 'bull_time_stop': 65, 'bull_use_sma': True, 'bull_use_ema': False, 'bull_use_atr': False, 'bull_use_adx': True, 'bull_use_spike': False, 'bull_rsi_required': False, 'bear_strategy': 'mean_reversion', 'bear_bb_std_mult': 1.2097780322723226, 'bear_rsi_os': 15, 'bear_rsi_ob': 74, 'bear_adx_thresh': 22.197189806766694, 'bear_atr_min_pct': 0.01922046580151974, 'bear_atr_max_pct': 0.1096138246623461, 'bear_tp_mult': 2.814007517671318, 'bear_tsl_mult': 0.6451574870030051, 'bear_time_stop': 213, 'bear_use_sma': False, 'bear_use_ema': True, 'bear_use_atr': False, 'bear_use_adx': False, 'bear_use_spike': False, 'bear_rsi_required': False, 'sideways_strategy': 'breakout', 'sideways_bb_std_mult': 0.8486970748678303, 'sideways_rsi_os': 30, 'sideways_rsi_ob': 83, 'sideways_adx_thresh': 11.276671101317904, 'sideways_atr_min_pct': 0.0014682691960873505, 'sideways_atr_max_pct': 0.094513937010516, 'sideways_tp_mult': 2.93074889657706, 'sideways_tsl_mult': 0.6368380232243519, 'sideways_time_stop': 277, 'sideways_use_sma': False, 'sideways_use_ema': False, 'sideways_use_atr': False, 'sideways_use_adx': True, 'sideways_use_spike': False, 'sideways_rsi_required': False}.
[I 2025-08-30 17:04:51,826] Trial 623 finished with values: [-0.03397774774267326, 0.033957710525657166] and parameters: {'p_sma': 37, 'p_std': 22, 'p_atr': 16, 'p_adx': 10, 'rsi_period': 23, 'ema1': 19, 'ema2': 12, 'slip_atr_k': 0.006969239901701351, 'slip_spread_k': 0.06571087902481061, 'spread_hl_frac': 0.017832132526619957, 'bb_std_mult': 3.1461993906964394, 'rsi_os': 31, 'rsi_ob': 86, 'vol_spike': 0.16894558581274707, 'adx_thresh': 9.353122760613857, 'atr_min_pct': 0.007884846200690979, 'atr_max_pct': 0.14997582695747913, 'tp_mult': 2.7376622226857923, 'tsl_mult': 0.9380877303058357, 'strategy': 'mean_reversion', 'time_stop': 36, 'use_sma': False, 'use_atr': True, 'use_adx': True, 'use_ema': False, 'use_spike': False, 'rsi_required': True, 'edge_k': 0.5102520706662778, 'edge_cap': 0.8155714795992378, 'bull_strategy': 'breakout', 'bull_bb_std_mult': 1.843933098006997, 'bull_rsi_os': 50, 'bull_rsi_ob': 53, 'bull_adx_thresh': 33.60573509356989, 'bull_atr_min_pct': 0.02409311852037802, 'bull_atr_max_pct': 0.11303049834713104, 'bull_tp_mult': 2.2912881381346417, 'bull_tsl_mult': 0.7773836140051495, 'bull_time_stop': 85, 'bull_use_sma': True, 'bull_use_ema': True, 'bull_use_atr': False, 'bull_use_adx': True, 'bull_use_spike': True, 'bull_rsi_required': False, 'bear_strategy': 'mean_reversion', 'bear_bb_std_mult': 1.3373814327109874, 'bear_rsi_os': 18, 'bear_rsi_ob': 88, 'bear_adx_thresh': 19.921321264385824, 'bear_atr_min_pct': 0.019451593937581748, 'bear_atr_max_pct': 0.10394798272758372, 'bear_tp_mult': 1.4551855020960356, 'bear_tsl_mult': 0.623353627775999, 'bear_time_stop': 212, 'bear_use_sma': False, 'bear_use_ema': True, 'bear_use_atr': False, 'bear_use_adx': True, 'bear_use_spike': False, 'bear_rsi_required': False, 'sideways_strategy': 'breakout', 'sideways_bb_std_mult': 0.8302125857422874, 'sideways_rsi_os': 30, 'sideways_rsi_ob': 93, 'sideways_adx_thresh': 12.07039502150185, 'sideways_atr_min_pct': 0.0015207932241828714, 'sideways_atr_max_pct': 0.10789134594363049, 'sideways_tp_mult': 2.880177277872407, 'sideways_tsl_mult': 0.41828968395142513, 'sideways_time_stop': 290, 'sideways_use_sma': False, 'sideways_use_ema': False, 'sideways_use_atr': False, 'sideways_use_adx': True, 'sideways_use_spike': False, 'sideways_rsi_required': True}.
[I 2025-08-30 17:05:34,854] Trial 630 finished with values: [-1000000000.0, 1000000000.0] and parameters: {'p_sma': 9, 'p_std': 25, 'p_atr': 17, 'p_adx': 9, 'rsi_period': 22, 'ema1': 17, 'ema2': 14, 'slip_atr_k': 0.1614765725358128, 'slip_spread_k': 0.3118653402010265, 'spread_hl_frac': 0.01988567289992903, 'bb_std_mult': 2.706662235875889, 'rsi_os': 45, 'rsi_ob': 84, 'vol_spike': 0.03916589374835057, 'adx_thresh': 10.405071393108688, 'atr_min_pct': 0.020529437926396405, 'atr_max_pct': 0.1465589973927431, 'tp_mult': 2.878359808577573, 'tsl_mult': 0.9121427667787596, 'strategy': 'mean_reversion', 'time_stop': 27, 'use_sma': False, 'use_atr': True, 'use_adx': False, 'use_ema': False, 'use_spike': True, 'rsi_required': True, 'edge_k': 0.865324989744243, 'edge_cap': 0.9277398416529723, 'bull_strategy': 'mean_reversion', 'bull_bb_std_mult': 2.153264633638439, 'bull_rsi_os': 6, 'bull_rsi_ob': 54, 'bull_adx_thresh': 34.633122801780395, 'bull_atr_min_pct': 0.022426518427541564, 'bull_atr_max_pct': 0.09422376742741917, 'bull_tp_mult': 2.227227740812662, 'bull_tsl_mult': 0.747015525825391, 'bull_time_stop': 71, 'bull_use_sma': True, 'bull_use_ema': True, 'bull_use_atr': False, 'bull_use_adx': False, 'bull_use_spike': False, 'bull_rsi_required': False, 'bear_strategy': 'mean_reversion', 'bear_bb_std_mult': 0.8548024572283002, 'bear_rsi_os': 38, 'bear_rsi_ob': 65, 'bear_adx_thresh': 12.506856499426082, 'bear_atr_min_pct': 0.009783616887912926, 'bear_atr_max_pct': 0.10777789214369952, 'bear_tp_mult': 1.2326792352061955, 'bear_tsl_mult': 0.8892802613152132, 'bear_time_stop': 197, 'bear_use_sma': True, 'bear_use_ema': False, 'bear_use_atr': False, 'bear_use_adx': False, 'bear_use_spike': False, 'bear_rsi_required': True, 'sideways_strategy': 'mean_reversion', 'sideways_bb_std_mult': 0.6065072260045454, 'sideways_rsi_os': 33, 'sideways_rsi_ob': 89, 'sideways_adx_thresh': 10.141201218876107, 'sideways_atr_min_pct': 0.011417951139071292, 'sideways_atr_max_pct': 0.10577954484787619, 'sideways_tp_mult': 2.955910696945052, 'sideways_tsl_mult': 0.4611926721461095, 'sideways_time_stop': 271, 'sideways_use_sma': True, 'sideways_use_ema': False, 'sideways_use_atr': False, 'sideways_use_adx': False, 'sideways_use_spike': False, 'sideways_rsi_required': True}.
[I 2025-08-30 17:05:35,270] Trial 628 finished with values: [-1000000000.0, 1000000000.0] and parameters: {'p_sma': 7, 'p_std': 21, 'p_atr': 17, 'p_adx': 9, 'rsi_period': 24, 'ema1': 17, 'ema2': 11, 'slip_atr_k': 0.10130366184873403, 'slip_spread_k': 0.3149162024418174, 'spread_hl_frac': 0.019228410844187006, 'bb_std_mult': 2.694876206035805, 'rsi_os': 33, 'rsi_ob': 84, 'vol_spike': 0.04109135718589731, 'adx_thresh': 10.369375953177867, 'atr_min_pct': 0.019165769276467074, 'atr_max_pct': 0.14672087708442685, 'tp_mult': 2.7103854912616545, 'tsl_mult': 0.9408673929209799, 'strategy': 'mean_reversion', 'time_stop': 26, 'use_sma': False, 'use_atr': True, 'use_adx': True, 'use_ema': False, 'use_spike': True, 'rsi_required': True, 'edge_k': 0.5229405533945225, 'edge_cap': 0.7465166405913378, 'bull_strategy': 'mean_reversion', 'bull_bb_std_mult': 3.5678727569722763, 'bull_rsi_os': 30, 'bull_rsi_ob': 54, 'bull_adx_thresh': 34.62170350924214, 'bull_atr_min_pct': 0.021710438443123356, 'bull_atr_max_pct': 0.14938723459955328, 'bull_tp_mult': 2.1992624151332136, 'bull_tsl_mult': 0.7448048087849615, 'bull_time_stop': 125, 'bull_use_sma': True, 'bull_use_ema': False, 'bull_use_atr': False, 'bull_use_adx': True, 'bull_use_spike': False, 'bull_rsi_required': False, 'bear_strategy': 'mean_reversion', 'bear_bb_std_mult': 0.8455692571294231, 'bear_rsi_os': 46, 'bear_rsi_ob': 75, 'bear_adx_thresh': 12.53261500502678, 'bear_atr_min_pct': 0.009988658044508955, 'bear_atr_max_pct': 0.10869557316864839, 'bear_tp_mult': 2.1766106982361104, 'bear_tsl_mult': 0.617372175274268, 'bear_time_stop': 197, 'bear_use_sma': True, 'bear_use_ema': False, 'bear_use_atr': False, 'bear_use_adx': False, 'bear_use_spike': False, 'bear_rsi_required': True, 'sideways_strategy': 'breakout', 'sideways_bb_std_mult': 0.7748954511091791, 'sideways_rsi_os': 33, 'sideways_rsi_ob': 87, 'sideways_adx_thresh': 10.316164261060598, 'sideways_atr_min_pct': 0.0021364418625115372, 'sideways_atr_max_pct': 0.10423060064945194, 'sideways_tp_mult': 2.9632187427833787, 'sideways_tsl_mult': 0.45445813539287416, 'sideways_time_stop': 270, 'sideways_use_sma': True, 'sideways_use_ema': False, 'sideways_use_atr': False, 'sideways_use_adx': False, 'sideways_use_spike': False, 'sideways_rsi_required': True}.
[I 2025-08-30 17:05:35,466] Trial 627 finished with values: [-1000000000.0, 1000000000.0] and parameters: {'p_sma': 9, 'p_std': 23, 'p_atr': 16, 'p_adx': 7, 'rsi_period': 24, 'ema1': 19, 'ema2': 45, 'slip_atr_k': 0.07324292395653353, 'slip_spread_k': 0.18998398781617773, 'spread_hl_frac': 0.017897364104154472, 'bb_std_mult': 1.961526574928836, 'rsi_os': 20, 'rsi_ob': 86, 'vol_spike': 0.16806955962382483, 'adx_thresh': 10.015646458411517, 'atr_min_pct': 0.01947287888629853, 'atr_max_pct': 0.14751488045398495, 'tp_mult': 2.749040625668577, 'tsl_mult': 0.9157847784652327, 'strategy': 'mean_reversion', 'time_stop': 25, 'use_sma': False, 'use_atr': False, 'use_adx': True, 'use_ema': False, 'use_spike': True, 'rsi_required': True, 'edge_k': 0.831850026257768, 'edge_cap': 0.7668762094410344, 'bull_strategy': 'breakout', 'bull_bb_std_mult': 1.1317498593677613, 'bull_rsi_os': 6, 'bull_rsi_ob': 53, 'bull_adx_thresh': 33.322121805294785, 'bull_atr_min_pct': 0.022266629558169753, 'bull_atr_max_pct': 0.14480278856397005, 'bull_tp_mult': 2.28625132252595, 'bull_tsl_mult': 0.7611666780201206, 'bull_time_stop': 64, 'bull_use_sma': True, 'bull_use_ema': True, 'bull_use_atr': False, 'bull_use_adx': True, 'bull_use_spike': False, 'bull_rsi_required': False, 'bear_strategy': 'mean_reversion', 'bear_bb_std_mult': 0.857855530418691, 'bear_rsi_os': 36, 'bear_rsi_ob': 76, 'bear_adx_thresh': 26.672603413310362, 'bear_atr_min_pct': 0.01901774532623213, 'bear_atr_max_pct': 0.11052323320558997, 'bear_tp_mult': 2.160506448010133, 'bear_tsl_mult': 0.6197700454607553, 'bear_time_stop': 199, 'bear_use_sma': True, 'bear_use_ema': False, 'bear_use_atr': False, 'bear_use_adx': False, 'bear_use_spike': False, 'bear_rsi_required': True, 'sideways_strategy': 'breakout', 'sideways_bb_std_mult': 0.7835194179595371, 'sideways_rsi_os': 30, 'sideways_rsi_ob': 95, 'sideways_adx_thresh': 11.880931501753485, 'sideways_atr_min_pct': 0.0021920434311454374, 'sideways_atr_max_pct': 0.10502379811690044, 'sideways_tp_mult': 2.9597222301168276, 'sideways_tsl_mult': 0.4567804339426351, 'sideways_time_stop': 276, 'sideways_use_sma': False, 'sideways_use_ema': False, 'sideways_use_atr': False, 'sideways_use_adx': False, 'sideways_use_spike': False, 'sideways_rsi_required': True}.
