[I 2025-08-30 15:13:25,502] Trial 18 finished with values: [-0.0639210049764426, 0.06382556462641943] and parameters: {'p_sma': 42, 'p_std': 20, 'p_atr': 29, 'p_adx': 11, 'rsi_period': 46, 'ema1': 13, 'ema2': 24, 'slip_atr_k': 0.17646431988495337, 'slip_spread_k': 0.9690824333746757, 'spread_hl_frac': 0.008765225658117822, 'bb_std_mult': 0.6616509254937684, 'rsi_os': 44, 'rsi_ob': 83, 'vol_spike': 0.11683249832944055, 'adx_thresh': 26.086406909882648, 'atr_min_pct': 0.011501009167515468, 'atr_max_pct': 0.056930342596295536, 'tp_mult': 2.2869703929109004, 'tsl_mult': 0.15039642920549262, 'strategy': 'mean_reversion', 'time_stop': 5, 'use_sma': True, 'use_atr': True, 'use_adx': True, 'use_ema': False, 'use_spike': False, 'rsi_required': True, 'edge_k': 0.02545448224311586, 'edge_cap': 0.9448542172865524, 'bull_strategy': 'mean_reversion', 'bull_bb_std_mult': 2.4994354210392786, 'bull_rsi_os': 38, 'bull_rsi_ob': 54, 'bull_adx_thresh': 23.573781385874, 'bull_atr_min_pct': 1.2097294627699817e-06, 'bull_atr_max_pct': 0.01569964350072177, 'bull_tp_mult': 1.6905318677447485, 'bull_tsl_mult': 0.3267262819101955, 'bull_time_stop': 174, 'bull_use_sma': True, 'bull_use_ema': False, 'bull_use_atr': False, 'bull_use_adx': False, 'bull_use_spike': False, 'bull_rsi_required': True, 'bear_strategy': 'mean_reversion', 'bear_bb_std_mult': 2.605839079185272, 'bear_rsi_os': 34, 'bear_rsi_ob': 81, 'bear_adx_thresh': 34.78444357919143, 'bear_atr_min_pct': 0.0015249568793428477, 'bear_atr_max_pct': 0.1482762707533422, 'bear_tp_mult': 2.990035039261922, 'bear_tsl_mult': 0.9915034273346786, 'bear_time_stop': 290, 'bear_use_sma': False, 'bear_use_ema': False, 'bear_use_atr': True, 'bear_use_adx': True, 'bear_use_spike': True, 'bear_rsi_required': True, 'sideways_strategy': 'mean_reversion', 'sideways_bb_std_mult': 1.8022065785510346, 'sideways_rsi_os': 13, 'sideways_rsi_ob': 52, 'sideways_adx_thresh': 13.501927954964582, 'sideways_atr_min_pct': 0.019651279781001785, 'sideways_atr_max_pct': 0.14880860584210936, 'sideways_tp_mult': 2.2820519362120604, 'sideways_tsl_mult': 0.16343160311218824, 'sideways_time_stop': 13, 'sideways_use_sma': False, 'sideways_use_ema': True, 'sideways_use_atr': False, 'sideways_use_adx': False, 'sideways_use_spike': True, 'sideways_rsi_required': False}.
[I 2025-08-30 15:13:29,133] Trial 19 finished with values: [-1000000000.0, 1000000000.0] and parameters: {'p_sma': 40, 'p_std': 18, 'p_atr': 24, 'p_adx': 11, 'rsi_period': 40, 'ema1': 13, 'ema2': 53, 'slip_atr_k': 0.17551298154351422, 'slip_spread_k': 0.18544823303479324, 'spread_hl_frac': 0.014948305704665535, 'bb_std_mult': 0.8843694679606917, 'rsi_os': 9, 'rsi_ob': 84, 'vol_spike': 0.12657067104914604, 'adx_thresh': 34.79886589600213, 'atr_min_pct': 0.012373419239489546, 'atr_max_pct': 0.06244001580409645, 'tp_mult': 2.355905051004126, 'tsl_mult': 0.9739176150489495, 'strategy': 'breakout', 'time_stop': 245, 'use_sma': True, 'use_atr': False, 'use_adx': True, 'use_ema': True, 'use_spike': False, 'rsi_required': True, 'edge_k': 0.37214660951441747, 'edge_cap': 0.9974932972431174, 'bull_strategy': 'mean_reversion', 'bull_bb_std_mult': 3.022711039688839, 'bull_rsi_os': 39, 'bull_rsi_ob': 73, 'bull_adx_thresh': 22.485567745123504, 'bull_atr_min_pct': 0.0068061418408212815, 'bull_atr_max_pct': 0.019342787119642824, 'bull_tp_mult': 2.636207401000886, 'bull_tsl_mult': 0.3437438708479539, 'bull_time_stop': 174, 'bull_use_sma': False, 'bull_use_ema': True, 'bull_use_atr': False, 'bull_use_adx': False, 'bull_use_spike': False, 'bull_rsi_required': True, 'bear_strategy': 'breakout', 'bear_bb_std_mult': 1.5273611835331122, 'bear_rsi_os': 35, 'bear_rsi_ob': 83, 'bear_adx_thresh': 11.689959846121361, 'bear_atr_min_pct': 0.012935185267010728, 'bear_atr_max_pct': 0.13704004522162025, 'bear_tp_mult': 2.9496133363126735, 'bear_tsl_mult': 0.9998005332889591, 'bear_time_stop': 53, 'bear_use_sma': False, 'bear_use_ema': False, 'bear_use_atr': True, 'bear_use_adx': True, 'bear_use_spike': True, 'bear_rsi_required': True, 'sideways_strategy': 'mean_reversion', 'sideways_bb_std_mult': 1.9749927165075323, 'sideways_rsi_os': 15, 'sideways_rsi_ob': 88, 'sideways_adx_thresh': 5.5137622012572916, 'sideways_atr_min_pct': 0.0013431517719726602, 'sideways_atr_max_pct': 0.14904784727841777, 'sideways_tp_mult': 1.1990917201651505, 'sideways_tsl_mult': 0.1689986349550312, 'sideways_time_stop': 13, 'sideways_use_sma': False, 'sideways_use_ema': True, 'sideways_use_atr': False, 'sideways_use_adx': False, 'sideways_use_spike': True, 'sideways_rsi_required': False}.
[I 2025-08-30 15:13:29,678] Trial 20 finished with values: [-1000000000.0, 1000000000.0] and parameters: {'p_sma': 23, 'p_std': 17, 'p_atr': 30, 'p_adx': 10, 'rsi_period': 40, 'ema1': 27, 'ema2': 54, 'slip_atr_k': 0.18826536563340043, 'slip_spread_k': 0.1635243961925624, 'spread_hl_frac': 0.013483939924734012, 'bb_std_mult': 0.9001508703070285, 'rsi_os': 7, 'rsi_ob': 86, 'vol_spike': 0.11763534161625708, 'adx_thresh': 33.28571403803031, 'atr_min_pct': 0.013171554837734021, 'atr_max_pct': 0.07074041587169981, 'tp_mult': 2.2508514911022344, 'tsl_mult': 0.26437543165150523, 'strategy': 'breakout', 'time_stop': 236, 'use_sma': True, 'use_atr': False, 'use_adx': True, 'use_ema': True, 'use_spike': False, 'rsi_required': True, 'edge_k': 0.37913749122510043, 'edge_cap': 0.998311632141795, 'bull_strategy': 'mean_reversion', 'bull_bb_std_mult': 2.897491051689394, 'bull_rsi_os': 38, 'bull_rsi_ob': 75, 'bull_adx_thresh': 23.628626541713054, 'bull_atr_min_pct': 0.00015541541093731966, 'bull_atr_max_pct': 0.015458341773771353, 'bull_tp_mult': 2.665359323983929, 'bull_tsl_mult': 0.1696268091793717, 'bull_time_stop': 168, 'bull_use_sma': False, 'bull_use_ema': True, 'bull_use_atr': False, 'bull_use_adx': False, 'bull_use_spike': False, 'bull_rsi_required': True, 'bear_strategy': 'breakout', 'bear_bb_std_mult': 2.5014110632951696, 'bear_rsi_os': 36, 'bear_rsi_ob': 81, 'bear_adx_thresh': 32.370612047882716, 'bear_atr_min_pct': 0.012185795979207365, 'bear_atr_max_pct': 0.14724295577362248, 'bear_tp_mult': 2.9153126346312863, 'bear_tsl_mult': 0.9903795225974305, 'bear_time_stop': 218, 'bear_use_sma': False, 'bear_use_ema': False, 'bear_use_atr': True, 'bear_use_adx': True, 'bear_use_spike': True, 'bear_rsi_required': True, 'sideways_strategy': 'mean_reversion', 'sideways_bb_std_mult': 2.1542970437884565, 'sideways_rsi_os': 36, 'sideways_rsi_ob': 89, 'sideways_adx_thresh': 5.875963808988547, 'sideways_atr_min_pct': 0.0006646631835046481, 'sideways_atr_max_pct': 0.14325506224768342, 'sideways_tp_mult': 1.0509161873258503, 'sideways_tsl_mult': 0.06041931704364896, 'sideways_time_stop': 15, 'sideways_use_sma': False, 'sideways_use_ema': True, 'sideways_use_atr': False, 'sideways_use_adx': False, 'sideways_use_spike': True, 'sideways_rsi_required': False}.
[I 2025-08-30 15:14:10,140] Trial 21 finished with values: [-1000000000.0, 1000000000.0] and parameters: {'p_sma': 22, 'p_std': 15, 'p_atr': 25, 'p_adx': 11, 'rsi_period': 15, 'ema1': 26, 'ema2': 22, 'slip_atr_k': 0.16740506037784925, 'slip_spread_k': 0.1929421622074948, 'spread_hl_frac': 0.01513279506228983, 'bb_std_mult': 0.819680907160275, 'rsi_os': 10, 'rsi_ob': 85, 'vol_spike': 0.13886752203616393, 'adx_thresh': 29.897692618113858, 'atr_min_pct': 0.007098444243100389, 'atr_max_pct': 0.07236315510448048, 'tp_mult': 2.2243845084266654, 'tsl_mult': 0.6960823837600696, 'strategy': 'breakout', 'time_stop': 229, 'use_sma': True, 'use_atr': False, 'use_adx': True, 'use_ema': True, 'use_spike': False, 'rsi_required': True, 'edge_k': 0.36549001153317434, 'edge_cap': 0.9926465230676474, 'bull_strategy': 'mean_reversion', 'bull_bb_std_mult': 2.9095680023184096, 'bull_rsi_os': 40, 'bull_rsi_ob': 73, 'bull_adx_thresh': 22.654324556214913, 'bull_atr_min_pct': 0.0006377394590657247, 'bull_atr_max_pct': 0.032392281153137706, 'bull_tp_mult': 2.7168251763761737, 'bull_tsl_mult': 0.1476332253722738, 'bull_time_stop': 169, 'bull_use_sma': False, 'bull_use_ema': True, 'bull_use_atr': False, 'bull_use_adx': False, 'bull_use_spike': False, 'bull_rsi_required': True, 'bear_strategy': 'breakout', 'bear_bb_std_mult': 2.413489036761831, 'bear_rsi_os': 34, 'bear_rsi_ob': 78, 'bear_adx_thresh': 16.365023039142407, 'bear_atr_min_pct': 0.01209726485437099, 'bear_atr_max_pct': 0.12002957063738603, 'bear_tp_mult': 2.7461781161917322, 'bear_tsl_mult': 0.8158413416383761, 'bear_time_stop': 199, 'bear_use_sma': False, 'bear_use_ema': False, 'bear_use_atr': True, 'bear_use_adx': True, 'bear_use_spike': True, 'bear_rsi_required': True, 'sideways_strategy': 'mean_reversion', 'sideways_bb_std_mult': 2.0813163467659646, 'sideways_rsi_os': 15, 'sideways_rsi_ob': 88, 'sideways_adx_thresh': 12.890695984131812, 'sideways_atr_min_pct': 0.019579880911138624, 'sideways_atr_max_pct': 0.1062538985012792, 'sideways_tp_mult': 2.274599072305076, 'sideways_tsl_mult': 0.14347929063455322, 'sideways_time_stop': 5, 'sideways_use_sma': False, 'sideways_use_ema': True, 'sideways_use_atr': False, 'sideways_use_adx': False, 'sideways_use_spike': True, 'sideways_rsi_required': False}.
[I 2025-08-30 15:14:11,384] Trial 22 finished with values: [-1000000000.0, 1000000000.0] and parameters: {'p_sma': 26, 'p_std': 14, 'p_atr': 24, 'p_adx': 10, 'rsi_period': 38, 'ema1': 26, 'ema2': 54, 'slip_atr_k': 0.18116393333749528, 'slip_spread_k': 0.1740722348981926, 'spread_hl_frac': 0.009307154576840511, 'bb_std_mult': 0.9924053294196282, 'rsi_os': 37, 'rsi_ob': 85, 'vol_spike': 0.13082404289572563, 'adx_thresh': 29.042802835815706, 'atr_min_pct': 0.006732933100884684, 'atr_max_pct': 0.07342884457294722, 'tp_mult': 1.4308050250684894, 'tsl_mult': 0.6714155165206307, 'strategy': 'breakout', 'time_stop': 231, 'use_sma': True, 'use_atr': False, 'use_adx': True, 'use_ema': True, 'use_spike': False, 'rsi_required': True, 'edge_k': 0.3334158119794617, 'edge_cap': 0.9564259746998979, 'bull_strategy': 'mean_reversion', 'bull_bb_std_mult': 2.9996492596310094, 'bull_rsi_os': 37, 'bull_rsi_ob': 75, 'bull_adx_thresh': 23.708306246694093, 'bull_atr_min_pct': 0.0003095955020989104, 'bull_atr_max_pct': 0.03027266231665501, 'bull_tp_mult': 1.7388287505925915, 'bull_tsl_mult': 0.18391910841500775, 'bull_time_stop': 183, 'bull_use_sma': False, 'bull_use_ema': True, 'bull_use_atr': False, 'bull_use_adx': False, 'bull_use_spike': False, 'bull_rsi_required': True, 'bear_strategy': 'breakout', 'bear_bb_std_mult': 2.4091297117479127, 'bear_rsi_os': 35, 'bear_rsi_ob': 80, 'bear_adx_thresh': 17.54364786714611, 'bear_atr_min_pct': 0.013315145665658105, 'bear_atr_max_pct': 0.12682519275130483, 'bear_tp_mult': 2.3423975123701077, 'bear_tsl_mult': 0.8296108849971853, 'bear_time_stop': 169, 'bear_use_sma': False, 'bear_use_ema': False, 'bear_use_atr': True, 'bear_use_adx': True, 'bear_use_spike': True, 'bear_rsi_required': True, 'sideways_strategy': 'mean_reversion', 'sideways_bb_std_mult': 2.7008309426362427, 'sideways_rsi_os': 14, 'sideways_rsi_ob': 86, 'sideways_adx_thresh': 5.037351164271627, 'sideways_atr_min_pct': 0.017064863609419084, 'sideways_atr_max_pct': 0.10578607313431468, 'sideways_tp_mult': 2.3306004225022683, 'sideways_tsl_mult': 0.15915020517758827, 'sideways_time_stop': 102, 'sideways_use_sma': False, 'sideways_use_ema': True, 'sideways_use_atr': False, 'sideways_use_adx': False, 'sideways_use_spike': True, 'sideways_rsi_required': False}.
[I 2025-08-30 15:14:16,322] Trial 24 finished with values: [-1000000000.0, 1000000000.0] and parameters: {'p_sma': 45, 'p_std': 13, 'p_atr': 10, 'p_adx': 10, 'rsi_period': 13, 'ema1': 25, 'ema2': 22, 'slip_atr_k': 0.2039072729868316, 'slip_spread_k': 0.2818966782185163, 'spread_hl_frac': 0.007973348968259632, 'bb_std_mult': 1.784379888595715, 'rsi_os': 37, 'rsi_ob': 89, 'vol_spike': 0.23775968947245205, 'adx_thresh': 29.757703641939216, 'atr_min_pct': 0.007478143602041173, 'atr_max_pct': 0.03818440514736759, 'tp_mult': 1.478743144511486, 'tsl_mult': 0.6695685350845685, 'strategy': 'breakout', 'time_stop': 7, 'use_sma': True, 'use_atr': False, 'use_adx': True, 'use_ema': True, 'use_spike': False, 'rsi_required': True, 'edge_k': 0.8349868920010738, 'edge_cap': 0.8470130466144276, 'bull_strategy': 'mean_reversion', 'bull_bb_std_mult': 2.26380418280576, 'bull_rsi_os': 52, 'bull_rsi_ob': 54, 'bull_adx_thresh': 22.739418537048202, 'bull_atr_min_pct': 0.006962263153668121, 'bull_atr_max_pct': 0.03212394481764428, 'bull_tp_mult': 1.7741844459361982, 'bull_tsl_mult': 0.4019985248841805, 'bull_time_stop': 87, 'bull_use_sma': False, 'bull_use_ema': True, 'bull_use_atr': False, 'bull_use_adx': False, 'bull_use_spike': False, 'bull_rsi_required': True, 'bear_strategy': 'breakout', 'bear_bb_std_mult': 1.925554421270668, 'bear_rsi_os': 20, 'bear_rsi_ob': 77, 'bear_adx_thresh': 18.443644330158904, 'bear_atr_min_pct': 0.020872309988250848, 'bear_atr_max_pct': 0.11744305076452201, 'bear_tp_mult': 2.7103029075137504, 'bear_tsl_mult': 0.8293442877288943, 'bear_time_stop': 183, 'bear_use_sma': False, 'bear_use_ema': False, 'bear_use_atr': True, 'bear_use_adx': True, 'bear_use_spike': True, 'bear_rsi_required': True, 'sideways_strategy': 'mean_reversion', 'sideways_bb_std_mult': 2.792635576803775, 'sideways_rsi_os': 5, 'sideways_rsi_ob': 89, 'sideways_adx_thresh': 12.280189929147241, 'sideways_atr_min_pct': 0.01827469815533517, 'sideways_atr_max_pct': 0.049832972908269865, 'sideways_tp_mult': 2.3126304496320396, 'sideways_tsl_mult': 0.16041991296205046, 'sideways_time_stop': 98, 'sideways_use_sma': False, 'sideways_use_ema': True, 'sideways_use_atr': False, 'sideways_use_adx': False, 'sideways_use_spike': True, 'sideways_rsi_required': False}.
[I 2025-08-30 15:14:16,720] Trial 23 finished with values: [-1000000000.0, 1000000000.0] and parameters: {'p_sma': 18, 'p_std': 13, 'p_atr': 24, 'p_adx': 10, 'rsi_period': 15, 'ema1': 25, 'ema2': 39, 'slip_atr_k': 0.1839808755062114, 'slip_spread_k': 0.3097510401816518, 'spread_hl_frac': 0.006646053775271513, 'bb_std_mult': 1.9485880074252355, 'rsi_os': 37, 'rsi_ob': 85, 'vol_spike': 0.24260062003671146, 'adx_thresh': 29.393265076689218, 'atr_min_pct': 0.005986693943863247, 'atr_max_pct': 0.034214857667221515, 'tp_mult': 2.7973328544857603, 'tsl_mult': 0.6644908773565404, 'strategy': 'breakout', 'time_stop': 12, 'use_sma': True, 'use_atr': False, 'use_adx': True, 'use_ema': True, 'use_spike': False, 'rsi_required': True, 'edge_k': 0.873259171960352, 'edge_cap': 0.9191886803472757, 'bull_strategy': 'mean_reversion', 'bull_bb_std_mult': 2.2310010361628305, 'bull_rsi_os': 36, 'bull_rsi_ob': 78, 'bull_adx_thresh': 24.122499953012994, 'bull_atr_min_pct': 0.00046981868038468814, 'bull_atr_max_pct': 0.034965787768435314, 'bull_tp_mult': 1.754903532594214, 'bull_tsl_mult': 0.17756212916963973, 'bull_time_stop': 85, 'bull_use_sma': False, 'bull_use_ema': True, 'bull_use_atr': False, 'bull_use_adx': False, 'bull_use_spike': False, 'bull_rsi_required': True, 'bear_strategy': 'breakout', 'bear_bb_std_mult': 2.426604944131321, 'bear_rsi_os': 34, 'bear_rsi_ob': 79, 'bear_adx_thresh': 17.789102266226884, 'bear_atr_min_pct': 0.020658121260173325, 'bear_atr_max_pct': 0.11571198907907285, 'bear_tp_mult': 2.3268001623784196, 'bear_tsl_mult': 0.7192900214372578, 'bear_time_stop': 190, 'bear_use_sma': False, 'bear_use_ema': False, 'bear_use_atr': True, 'bear_use_adx': True, 'bear_use_spike': True, 'bear_rsi_required': True, 'sideways_strategy': 'mean_reversion', 'sideways_bb_std_mult': 2.8724749414045685, 'sideways_rsi_os': 13, 'sideways_rsi_ob': 55, 'sideways_adx_thresh': 12.389112525114218, 'sideways_atr_min_pct': 0.019731796130107157, 'sideways_atr_max_pct': 0.10421114452056919, 'sideways_tp_mult': 2.4539826742536963, 'sideways_tsl_mult': 0.15982224193400668, 'sideways_time_stop': 101, 'sideways_use_sma': False, 'sideways_use_ema': True, 'sideways_use_atr': False, 'sideways_use_adx': False, 'sideways_use_spike': True, 'sideways_rsi_required': False}.
[I 2025-08-30 15:14:56,693] Trial 25 finished with values: [-1000000000.0, 1000000000.0] and parameters: {'p_sma': 46, 'p_std': 26, 'p_atr': 10, 'p_adx': 10, 'rsi_period': 13, 'ema1': 24, 'ema2': 41, 'slip_atr_k': 0.2067885680297115, 'slip_spread_k': 0.2921522546274555, 'spread_hl_frac': 0.007143423421229526, 'bb_std_mult': 1.9773194185110812, 'rsi_os': 36, 'rsi_ob': 90, 'vol_spike': 0.23983371753725108, 'adx_thresh': 25.898578938497412, 'atr_min_pct': 0.008128575395778218, 'atr_max_pct': 0.03335938678662508, 'tp_mult': 1.4849319733906465, 'tsl_mult': 0.6606661588539948, 'strategy': 'breakout', 'time_stop': 67, 'use_sma': True, 'use_atr': False, 'use_adx': True, 'use_ema': True, 'use_spike': False, 'rsi_required': True, 'edge_k': 0.8099156532369438, 'edge_cap': 0.8523309819649842, 'bull_strategy': 'mean_reversion', 'bull_bb_std_mult': 2.2932462874116624, 'bull_rsi_os': 55, 'bull_rsi_ob': 55, 'bull_adx_thresh': 14.421760590823517, 'bull_atr_min_pct': 0.007567315500660629, 'bull_atr_max_pct': 0.03423716740433004, 'bull_tp_mult': 2.982891303083598, 'bull_tsl_mult': 0.4336099209994935, 'bull_time_stop': 99, 'bull_use_sma': False, 'bull_use_ema': True, 'bull_use_atr': False, 'bull_use_adx': False, 'bull_use_spike': False, 'bull_rsi_required': True, 'bear_strategy': 'breakout', 'bear_bb_std_mult': 1.8040499372287244, 'bear_rsi_os': 20, 'bear_rsi_ob': 52, 'bear_adx_thresh': 19.30399886928368, 'bear_atr_min_pct': 0.023343275895591563, 'bear_atr_max_pct': 0.11080150086904939, 'bear_tp_mult': 2.3904930904271167, 'bear_tsl_mult': 0.8364787383164318, 'bear_time_stop': 154, 'bear_use_sma': False, 'bear_use_ema': False, 'bear_use_atr': True, 'bear_use_adx': True, 'bear_use_spike': True, 'bear_rsi_required': True, 'sideways_strategy': 'mean_reversion', 'sideways_bb_std_mult': 2.867392738719106, 'sideways_rsi_os': 5, 'sideways_rsi_ob': 90, 'sideways_adx_thresh': 12.20950970770678, 'sideways_atr_min_pct': 0.01723483339883453, 'sideways_atr_max_pct': 0.047606077470059974, 'sideways_tp_mult': 2.3172296812963427, 'sideways_tsl_mult': 0.2519042886979792, 'sideways_time_stop': 98, 'sideways_use_sma': False, 'sideways_use_ema': True, 'sideways_use_atr': False, 'sideways_use_adx': False, 'sideways_use_spike': True, 'sideways_rsi_required': False}.
[I 2025-08-30 15:14:57,773] Trial 26 finished with values: [-1000000000.0, 1000000000.0] and parameters: {'p_sma': 45, 'p_std': 25, 'p_atr': 10, 'p_adx': 9, 'rsi_period': 14, 'ema1': 17, 'ema2': 41, 'slip_atr_k': 0.21432216415014327, 'slip_spread_k': 0.3045277291439983, 'spread_hl_frac': 0.006841214628469129, 'bb_std_mult': 2.0380902853994876, 'rsi_os': 24, 'rsi_ob': 90, 'vol_spike': 0.23875652497876526, 'adx_thresh': 25.38519657286695, 'atr_min_pct': 0.016370810557833307, 'atr_max_pct': 0.03211068000037143, 'tp_mult': 2.789180887317507, 'tsl_mult': 0.4243550901979297, 'strategy': 'breakout', 'time_stop': 86, 'use_sma': True, 'use_atr': True, 'use_adx': True, 'use_ema': True, 'use_spike': False, 'rsi_required': True, 'edge_k': 0.9259459692187638, 'edge_cap': 0.8657794958997262, 'bull_strategy': 'mean_reversion', 'bull_bb_std_mult': 2.198218842267317, 'bull_rsi_os': 55, 'bull_rsi_ob': 56, 'bull_adx_thresh': 19.851893131746074, 'bull_atr_min_pct': 0.007552270702324195, 'bull_atr_max_pct': 0.03906695369019349, 'bull_tp_mult': 2.9907799295804516, 'bull_tsl_mult': 0.4239309232811252, 'bull_time_stop': 92, 'bull_use_sma': False, 'bull_use_ema': True, 'bull_use_atr': False, 'bull_use_adx': False, 'bull_use_spike': False, 'bull_rsi_required': True, 'bear_strategy': 'breakout', 'bear_bb_std_mult': 1.9384294945345195, 'bear_rsi_os': 20, 'bear_rsi_ob': 55, 'bear_adx_thresh': 21.157513521860967, 'bear_atr_min_pct': 0.020612911763949495, 'bear_atr_max_pct': 0.1038910657286265, 'bear_tp_mult': 2.7560655432950516, 'bear_tsl_mult': 0.6982036848273729, 'bear_time_stop': 90, 'bear_use_sma': False, 'bear_use_ema': False, 'bear_use_atr': True, 'bear_use_adx': True, 'bear_use_spike': True, 'bear_rsi_required': True, 'sideways_strategy': 'mean_reversion', 'sideways_bb_std_mult': 3.0523869604105007, 'sideways_rsi_os': 5, 'sideways_rsi_ob': 92, 'sideways_adx_thresh': 12.41284277204291, 'sideways_atr_min_pct': 0.00974623422218715, 'sideways_atr_max_pct': 0.05107778005822941, 'sideways_tp_mult': 1.838451381083822, 'sideways_tsl_mult': 0.24616758193628338, 'sideways_time_stop': 40, 'sideways_use_sma': False, 'sideways_use_ema': True, 'sideways_use_atr': False, 'sideways_use_adx': False, 'sideways_use_spike': True, 'sideways_rsi_required': False}.
