[I 2025-08-30 15:56:44,800] Trial 235 finished with values: [-0.017534051099795556, 0.017545831614159246] and parameters: {'p_sma': 47, 'p_std': 59, 'p_atr': 24, 'p_adx': 15, 'rsi_period': 59, 'ema1': 10, 'ema2': 59, 'slip_atr_k': 0.008911215912620687, 'slip_spread_k': 0.02177960514136505, 'spread_hl_frac': 0.04835880720148214, 'bb_std_mult': 3.049647882849513, 'rsi_os': 52, 'rsi_ob': 53, 'vol_spike': 0.19012811929443876, 'adx_thresh': 25.088391756679606, 'atr_min_pct': 0.021848244367420937, 'atr_max_pct': 0.14109234083547717, 'tp_mult': 1.0980650127547367, 'tsl_mult': 0.1175516206353166, 'strategy': 'breakout', 'time_stop': 26, 'use_sma': False, 'use_atr': True, 'use_adx': False, 'use_ema': False, 'use_spike': True, 'rsi_required': False, 'edge_k': 1.8715012371187787, 'edge_cap': 0.5804909737495578, 'bull_strategy': 'breakout', 'bull_bb_std_mult': 1.810948181172888, 'bull_rsi_os': 10, 'bull_rsi_ob': 75, 'bull_adx_thresh': 13.30875484103567, 'bull_atr_min_pct': 0.0006436870480146225, 'bull_atr_max_pct': 0.13272985097617557, 'bull_tp_mult': 1.6449561002259587, 'bull_tsl_mult': 0.33593061091546533, 'bull_time_stop': 109, 'bull_use_sma': True, 'bull_use_ema': True, 'bull_use_atr': False, 'bull_use_adx': False, 'bull_use_spike': False, 'bull_rsi_required': True, 'bear_strategy': 'mean_reversion', 'bear_bb_std_mult': 2.14643747062297, 'bear_rsi_os': 15, 'bear_rsi_ob': 74, 'bear_adx_thresh': 5.619565209524886, 'bear_atr_min_pct': 0.028519289638692973, 'bear_atr_max_pct': 0.091404543928613, 'bear_tp_mult': 2.6976675421124163, 'bear_tsl_mult': 0.5306196935091491, 'bear_time_stop': 94, 'bear_use_sma': False, 'bear_use_ema': False, 'bear_use_atr': False, 'bear_use_adx': False, 'bear_use_spike': True, 'bear_rsi_required': False, 'sideways_strategy': 'mean_reversion', 'sideways_bb_std_mult': 3.1238688940627894, 'sideways_rsi_os': 46, 'sideways_rsi_ob': 92, 'sideways_adx_thresh': 16.27690065401261, 'sideways_atr_min_pct': 0.010091956326584441, 'sideways_atr_max_pct': 0.14433372131996325, 'sideways_tp_mult': 2.162831451584538, 'sideways_tsl_mult': 0.7985877080355815, 'sideways_time_stop': 216, 'sideways_use_sma': True, 'sideways_use_ema': False, 'sideways_use_atr': False, 'sideways_use_adx': True, 'sideways_use_spike': False, 'sideways_rsi_required': True}.
[I 2025-08-30 15:56:45,187] Trial 234 finished with values: [-1000000000.0, 1000000000.0] and parameters: {'p_sma': 18, 'p_std': 59, 'p_atr': 24, 'p_adx': 15, 'rsi_period': 31, 'ema1': 10, 'ema2': 58, 'slip_atr_k': 0.17202429773104652, 'slip_spread_k': 0.018278782303943177, 'spread_hl_frac': 0.028956856185831957, 'bb_std_mult': 3.505495973365101, 'rsi_os': 52, 'rsi_ob': 56, 'vol_spike': 0.018122531372493533, 'adx_thresh': 26.551845983521716, 'atr_min_pct': 0.021061002645953418, 'atr_max_pct': 0.1413059337948891, 'tp_mult': 1.1144304669219218, 'tsl_mult': 0.44667922154561923, 'strategy': 'breakout', 'time_stop': 25, 'use_sma': False, 'use_atr': True, 'use_adx': False, 'use_ema': False, 'use_spike': True, 'rsi_required': False, 'edge_k': 1.8518900662442894, 'edge_cap': 0.5230497335490987, 'bull_strategy': 'breakout', 'bull_bb_std_mult': 2.6394108220490202, 'bull_rsi_os': 10, 'bull_rsi_ob': 52, 'bull_adx_thresh': 13.312369680776895, 'bull_atr_min_pct': 0.0006697332407764616, 'bull_atr_max_pct': 0.13256811902949453, 'bull_tp_mult': 1.7127708909502606, 'bull_tsl_mult': 0.3810898185787222, 'bull_time_stop': 80, 'bull_use_sma': True, 'bull_use_ema': False, 'bull_use_atr': False, 'bull_use_adx': False, 'bull_use_spike': False, 'bull_rsi_required': True, 'bear_strategy': 'mean_reversion', 'bear_bb_std_mult': 0.7446107371314838, 'bear_rsi_os': 15, 'bear_rsi_ob': 74, 'bear_adx_thresh': 13.765917651889467, 'bear_atr_min_pct': 0.007240740675990725, 'bear_atr_max_pct': 0.09173282099091093, 'bear_tp_mult': 2.720021146681948, 'bear_tsl_mult': 0.08027707794919686, 'bear_time_stop': 93, 'bear_use_sma': False, 'bear_use_ema': False, 'bear_use_atr': False, 'bear_use_adx': False, 'bear_use_spike': True, 'bear_rsi_required': False, 'sideways_strategy': 'mean_reversion', 'sideways_bb_std_mult': 2.702970930339813, 'sideways_rsi_os': 29, 'sideways_rsi_ob': 92, 'sideways_adx_thresh': 5.96500235961561, 'sideways_atr_min_pct': 0.010126870799270882, 'sideways_atr_max_pct': 0.14421435780174488, 'sideways_tp_mult': 2.9084843523427697, 'sideways_tsl_mult': 0.7955084397989565, 'sideways_time_stop': 211, 'sideways_use_sma': True, 'sideways_use_ema': False, 'sideways_use_atr': False, 'sideways_use_adx': True, 'sideways_use_spike': False, 'sideways_rsi_required': True}.
[I 2025-08-30 15:56:45,969] Trial 233 finished with values: [-1000000000.0, 1000000000.0] and parameters: {'p_sma': 15, 'p_std': 59, 'p_atr': 26, 'p_adx': 25, 'rsi_period': 25, 'ema1': 19, 'ema2': 58, 'slip_atr_k': 0.009112610130201086, 'slip_spread_k': 0.5438601421317242, 'spread_hl_frac': 0.011718081471954751, 'bb_std_mult': 0.6963750911972617, 'rsi_os': 39, 'rsi_ob': 56, 'vol_spike': 0.016935724769488545, 'adx_thresh': 28.778633482435033, 'atr_min_pct': 0.020857702674957304, 'atr_max_pct': 0.024877201788889976, 'tp_mult': 1.3037356730693477, 'tsl_mult': 0.4394886649949063, 'strategy': 'breakout', 'time_stop': 13, 'use_sma': False, 'use_atr': True, 'use_adx': False, 'use_ema': False, 'use_spike': True, 'rsi_required': False, 'edge_k': 1.9993449945469168, 'edge_cap': 0.23791363776676322, 'bull_strategy': 'mean_reversion', 'bull_bb_std_mult': 0.8085056421275465, 'bull_rsi_os': 15, 'bull_rsi_ob': 75, 'bull_adx_thresh': 22.02530651813627, 'bull_atr_min_pct': 0.01052393812482096, 'bull_atr_max_pct': 0.13281049229916017, 'bull_tp_mult': 1.5755525983917122, 'bull_tsl_mult': 0.6329692869167098, 'bull_time_stop': 229, 'bull_use_sma': True, 'bull_use_ema': False, 'bull_use_atr': False, 'bull_use_adx': False, 'bull_use_spike': False, 'bull_rsi_required': True, 'bear_strategy': 'mean_reversion', 'bear_bb_std_mult': 2.1644032966633278, 'bear_rsi_os': 13, 'bear_rsi_ob': 72, 'bear_adx_thresh': 27.577942028156997, 'bear_atr_min_pct': 0.02307081482805133, 'bear_atr_max_pct': 0.09123400826858567, 'bear_tp_mult': 2.928825074381795, 'bear_tsl_mult': 0.5778332273776041, 'bear_time_stop': 244, 'bear_use_sma': False, 'bear_use_ema': False, 'bear_use_atr': False, 'bear_use_adx': False, 'bear_use_spike': True, 'bear_rsi_required': False, 'sideways_strategy': 'breakout', 'sideways_bb_std_mult': 3.129423674786503, 'sideways_rsi_os': 41, 'sideways_rsi_ob': 92, 'sideways_adx_thresh': 13.61228256949337, 'sideways_atr_min_pct': 0.0079033233861667, 'sideways_atr_max_pct': 0.14654747140483476, 'sideways_tp_mult': 2.9076988113009987, 'sideways_tsl_mult': 0.8038349828930279, 'sideways_time_stop': 214, 'sideways_use_sma': True, 'sideways_use_ema': False, 'sideways_use_atr': True, 'sideways_use_adx': True, 'sideways_use_spike': True, 'sideways_rsi_required': True}.
[I 2025-08-30 15:57:25,365] Trial 239 finished with values: [-1000000000.0, 1000000000.0] and parameters: {'p_sma': 17, 'p_std': 58, 'p_atr': 25, 'p_adx': 15, 'rsi_period': 25, 'ema1': 18, 'ema2': 58, 'slip_atr_k': 0.007865227459996495, 'slip_spread_k': 0.006517220011958266, 'spread_hl_frac': 0.005556235681856148, 'bb_std_mult': 1.2652251660897693, 'rsi_os': 39, 'rsi_ob': 53, 'vol_spike': 0.19108758722841046, 'adx_thresh': 24.780544180570455, 'atr_min_pct': 0.022062028898938612, 'atr_max_pct': 0.025983515142185526, 'tp_mult': 1.1981060530232512, 'tsl_mult': 0.1272785193035862, 'strategy': 'breakout', 'time_stop': 14, 'use_sma': True, 'use_atr': True, 'use_adx': False, 'use_ema': False, 'use_spike': True, 'rsi_required': False, 'edge_k': 1.8845855936977514, 'edge_cap': 0.5824100249786258, 'bull_strategy': 'breakout', 'bull_bb_std_mult': 0.5632478894236135, 'bull_rsi_os': 11, 'bull_rsi_ob': 75, 'bull_adx_thresh': 30.43685117718809, 'bull_atr_min_pct': 2.808641775323172e-05, 'bull_atr_max_pct': 0.14259653999021116, 'bull_tp_mult': 1.654958794839704, 'bull_tsl_mult': 0.5985851867073464, 'bull_time_stop': 67, 'bull_use_sma': True, 'bull_use_ema': True, 'bull_use_atr': False, 'bull_use_adx': False, 'bull_use_spike': False, 'bull_rsi_required': True, 'bear_strategy': 'mean_reversion', 'bear_bb_std_mult': 2.873289870409367, 'bear_rsi_os': 19, 'bear_rsi_ob': 76, 'bear_adx_thresh': 12.640028689910848, 'bear_atr_min_pct': 0.027268986077438093, 'bear_atr_max_pct': 0.06943940340668163, 'bear_tp_mult': 2.224876896518386, 'bear_tsl_mult': 0.530256158599777, 'bear_time_stop': 244, 'bear_use_sma': False, 'bear_use_ema': False, 'bear_use_atr': False, 'bear_use_adx': True, 'bear_use_spike': True, 'bear_rsi_required': True, 'sideways_strategy': 'breakout', 'sideways_bb_std_mult': 3.1386063488557308, 'sideways_rsi_os': 17, 'sideways_rsi_ob': 77, 'sideways_adx_thresh': 14.748188728900931, 'sideways_atr_min_pct': 0.0012479750763409229, 'sideways_atr_max_pct': 0.14393574289528102, 'sideways_tp_mult': 2.176297454575126, 'sideways_tsl_mult': 0.7513634216239796, 'sideways_time_stop': 83, 'sideways_use_sma': True, 'sideways_use_ema': False, 'sideways_use_atr': False, 'sideways_use_adx': True, 'sideways_use_spike': False, 'sideways_rsi_required': True}.
[I 2025-08-30 15:57:26,047] Trial 238 finished with values: [-1000000000.0, 1000000000.0] and parameters: {'p_sma': 18, 'p_std': 58, 'p_atr': 25, 'p_adx': 15, 'rsi_period': 59, 'ema1': 26, 'ema2': 59, 'slip_atr_k': 0.17464387738076015, 'slip_spread_k': 0.017703539254642575, 'spread_hl_frac': 0.045586652070833754, 'bb_std_mult': 3.0749537846200843, 'rsi_os': 39, 'rsi_ob': 53, 'vol_spike': 0.010327210830826798, 'adx_thresh': 26.774406974115273, 'atr_min_pct': 0.021877869948385118, 'atr_max_pct': 0.13849077069377025, 'tp_mult': 2.343307350388227, 'tsl_mult': 0.12288979011179868, 'strategy': 'breakout', 'time_stop': 21, 'use_sma': True, 'use_atr': True, 'use_adx': False, 'use_ema': False, 'use_spike': True, 'rsi_required': False, 'edge_k': 1.8871881842407217, 'edge_cap': 0.6142325385394928, 'bull_strategy': 'breakout', 'bull_bb_std_mult': 0.5818540035682007, 'bull_rsi_os': 11, 'bull_rsi_ob': 57, 'bull_adx_thresh': 30.011621918430034, 'bull_atr_min_pct': 0.0006648101763591951, 'bull_atr_max_pct': 0.1416765022707005, 'bull_tp_mult': 1.4048005828477672, 'bull_tsl_mult': 0.9621094537375263, 'bull_time_stop': 69, 'bull_use_sma': True, 'bull_use_ema': True, 'bull_use_atr': False, 'bull_use_adx': False, 'bull_use_spike': False, 'bull_rsi_required': True, 'bear_strategy': 'mean_reversion', 'bear_bb_std_mult': 2.161734168797649, 'bear_rsi_os': 18, 'bear_rsi_ob': 73, 'bear_adx_thresh': 12.45015061597771, 'bear_atr_min_pct': 0.028838163071704326, 'bear_atr_max_pct': 0.09885896335400053, 'bear_tp_mult': 2.224380672486704, 'bear_tsl_mult': 0.5326183526644155, 'bear_time_stop': 93, 'bear_use_sma': False, 'bear_use_ema': False, 'bear_use_atr': False, 'bear_use_adx': True, 'bear_use_spike': True, 'bear_rsi_required': True, 'sideways_strategy': 'breakout', 'sideways_bb_std_mult': 2.673537942285648, 'sideways_rsi_os': 18, 'sideways_rsi_ob': 77, 'sideways_adx_thresh': 13.583725339900361, 'sideways_atr_min_pct': 0.026622987874378525, 'sideways_atr_max_pct': 0.1451042593274972, 'sideways_tp_mult': 2.3423272967471345, 'sideways_tsl_mult': 0.7561784823420342, 'sideways_time_stop': 231, 'sideways_use_sma': True, 'sideways_use_ema': False, 'sideways_use_atr': False, 'sideways_use_adx': True, 'sideways_use_spike': False, 'sideways_rsi_required': True}.
[I 2025-08-30 15:57:26,411] Trial 237 finished with values: [-1000000000.0, 1000000000.0] and parameters: {'p_sma': 17, 'p_std': 58, 'p_atr': 24, 'p_adx': 25, 'rsi_period': 59, 'ema1': 26, 'ema2': 59, 'slip_atr_k': 0.00952171149256164, 'slip_spread_k': 0.022506974830172586, 'spread_hl_frac': 0.048242506317240745, 'bb_std_mult': 3.056249697736506, 'rsi_os': 39, 'rsi_ob': 55, 'vol_spike': 0.010934462047429625, 'adx_thresh': 27.878150101248682, 'atr_min_pct': 0.0218574016889544, 'atr_max_pct': 0.13849520679537905, 'tp_mult': 1.0981526281808829, 'tsl_mult': 0.5124425318346245, 'strategy': 'breakout', 'time_stop': 21, 'use_sma': True, 'use_atr': True, 'use_adx': False, 'use_ema': False, 'use_spike': True, 'rsi_required': False, 'edge_k': 1.8806842623619888, 'edge_cap': 0.5809253848284962, 'bull_strategy': 'breakout', 'bull_bb_std_mult': 2.332570467864907, 'bull_rsi_os': 11, 'bull_rsi_ob': 57, 'bull_adx_thresh': 30.160871339991495, 'bull_atr_min_pct': 0.0005466753531425022, 'bull_atr_max_pct': 0.09475982431481016, 'bull_tp_mult': 1.4190272356287619, 'bull_tsl_mult': 0.7653763030161775, 'bull_time_stop': 79, 'bull_use_sma': True, 'bull_use_ema': True, 'bull_use_atr': False, 'bull_use_adx': False, 'bull_use_spike': False, 'bull_rsi_required': True, 'bear_strategy': 'mean_reversion', 'bear_bb_std_mult': 2.1573558852301917, 'bear_rsi_os': 18, 'bear_rsi_ob': 73, 'bear_adx_thresh': 12.501438891121854, 'bear_atr_min_pct': 0.00836610496155649, 'bear_atr_max_pct': 0.09941523864561741, 'bear_tp_mult': 2.2392841157875973, 'bear_tsl_mult': 0.5267939914299976, 'bear_time_stop': 94, 'bear_use_sma': False, 'bear_use_ema': False, 'bear_use_atr': False, 'bear_use_adx': True, 'bear_use_spike': True, 'bear_rsi_required': True, 'sideways_strategy': 'mean_reversion', 'sideways_bb_std_mult': 3.1295859402526487, 'sideways_rsi_os': 32, 'sideways_rsi_ob': 95, 'sideways_adx_thresh': 32.54011448754427, 'sideways_atr_min_pct': 0.026481112633442116, 'sideways_atr_max_pct': 0.14420823222946746, 'sideways_tp_mult': 2.5679180773440686, 'sideways_tsl_mult': 0.7622220484457664, 'sideways_time_stop': 217, 'sideways_use_sma': True, 'sideways_use_ema': False, 'sideways_use_atr': False, 'sideways_use_adx': True, 'sideways_use_spike': False, 'sideways_rsi_required': True}.
[I 2025-08-30 15:57:26,651] Trial 240 finished with values: [-1000000000.0, 1000000000.0] and parameters: {'p_sma': 17, 'p_std': 58, 'p_atr': 25, 'p_adx': 26, 'rsi_period': 59, 'ema1': 26, 'ema2': 59, 'slip_atr_k': 0.14385163271063417, 'slip_spread_k': 0.35021317309903743, 'spread_hl_frac': 0.045792586871994875, 'bb_std_mult': 3.039539246722541, 'rsi_os': 39, 'rsi_ob': 53, 'vol_spike': 0.00889721008199647, 'adx_thresh': 9.656750638253843, 'atr_min_pct': 0.022039373868909272, 'atr_max_pct': 0.11902039274660037, 'tp_mult': 1.537896261661766, 'tsl_mult': 0.47641411920380955, 'strategy': 'breakout', 'time_stop': 19, 'use_sma': True, 'use_atr': True, 'use_adx': False, 'use_ema': True, 'use_spike': True, 'rsi_required': False, 'edge_k': 1.896124808041147, 'edge_cap': 0.6105118132276796, 'bull_strategy': 'breakout', 'bull_bb_std_mult': 2.337018785310954, 'bull_rsi_os': 11, 'bull_rsi_ob': 73, 'bull_adx_thresh': 30.081256409761465, 'bull_atr_min_pct': 0.0012806921685426368, 'bull_atr_max_pct': 0.14229156771168736, 'bull_tp_mult': 1.6417547496132168, 'bull_tsl_mult': 0.3376286032268614, 'bull_time_stop': 128, 'bull_use_sma': True, 'bull_use_ema': True, 'bull_use_atr': False, 'bull_use_adx': False, 'bull_use_spike': False, 'bull_rsi_required': True, 'bear_strategy': 'breakout', 'bear_bb_std_mult': 2.0760695551094237, 'bear_rsi_os': 19, 'bear_rsi_ob': 78, 'bear_adx_thresh': 12.479017046926813, 'bear_atr_min_pct': 0.028735840578707563, 'bear_atr_max_pct': 0.06984530012900783, 'bear_tp_mult': 2.2341668493011837, 'bear_tsl_mult': 0.536194454676331, 'bear_time_stop': 127, 'bear_use_sma': False, 'bear_use_ema': False, 'bear_use_atr': False, 'bear_use_adx': True, 'bear_use_spike': True, 'bear_rsi_required': True, 'sideways_strategy': 'breakout', 'sideways_bb_std_mult': 3.0016540562979728, 'sideways_rsi_os': 32, 'sideways_rsi_ob': 76, 'sideways_adx_thresh': 12.61546025299344, 'sideways_atr_min_pct': 0.0010978473841771863, 'sideways_atr_max_pct': 0.14985021111656105, 'sideways_tp_mult': 2.5649081910613245, 'sideways_tsl_mult': 0.7691282822390254, 'sideways_time_stop': 149, 'sideways_use_sma': True, 'sideways_use_ema': False, 'sideways_use_atr': False, 'sideways_use_adx': True, 'sideways_use_spike': False, 'sideways_rsi_required': True}.
[I 2025-08-30 15:58:06,961] Trial 242 finished with values: [-1000000000.0, 1000000000.0] and parameters: {'p_sma': 50, 'p_std': 60, 'p_atr': 25, 'p_adx': 23, 'rsi_period': 32, 'ema1': 26, 'ema2': 59, 'slip_atr_k': 0.022016617159133445, 'slip_spread_k': 0.04590179855598796, 'spread_hl_frac': 0.04771959226202723, 'bb_std_mult': 3.323623273773287, 'rsi_os': 55, 'rsi_ob': 52, 'vol_spike': 0.005001532508679946, 'adx_thresh': 27.886432887649477, 'atr_min_pct': 0.022939736721514416, 'atr_max_pct': 0.12748102933651312, 'tp_mult': 1.885056713663776, 'tsl_mult': 0.48591935082456156, 'strategy': 'breakout', 'time_stop': 39, 'use_sma': False, 'use_atr': True, 'use_adx': False, 'use_ema': True, 'use_spike': True, 'rsi_required': False, 'edge_k': 1.9478484478412605, 'edge_cap': 0.6265350292678554, 'bull_strategy': 'breakout', 'bull_bb_std_mult': 1.8042886208153226, 'bull_rsi_os': 13, 'bull_rsi_ob': 73, 'bull_adx_thresh': 19.739428625352048, 'bull_atr_min_pct': 0.02827280290642235, 'bull_atr_max_pct': 0.14802139070372466, 'bull_tp_mult': 1.1811758561690535, 'bull_tsl_mult': 0.3314636607914419, 'bull_time_stop': 127, 'bull_use_sma': True, 'bull_use_ema': True, 'bull_use_atr': False, 'bull_use_adx': False, 'bull_use_spike': False, 'bull_rsi_required': True, 'bear_strategy': 'breakout', 'bear_bb_std_mult': 2.0807534028023245, 'bear_rsi_os': 16, 'bear_rsi_ob': 78, 'bear_adx_thresh': 13.236719647223108, 'bear_atr_min_pct': 0.0018981093195122832, 'bear_atr_max_pct': 0.08936224299554171, 'bear_tp_mult': 2.2886280486955624, 'bear_tsl_mult': 0.5555930111304254, 'bear_time_stop': 129, 'bear_use_sma': False, 'bear_use_ema': False, 'bear_use_atr': False, 'bear_use_adx': False, 'bear_use_spike': True, 'bear_rsi_required': False, 'sideways_strategy': 'breakout', 'sideways_bb_std_mult': 3.008033641636016, 'sideways_rsi_os': 46, 'sideways_rsi_ob': 90, 'sideways_adx_thresh': 16.39024548340779, 'sideways_atr_min_pct': 0.02416791353754978, 'sideways_atr_max_pct': 0.14977674967713234, 'sideways_tp_mult': 2.5556847477279545, 'sideways_tsl_mult': 0.7335394428632734, 'sideways_time_stop': 221, 'sideways_use_sma': True, 'sideways_use_ema': False, 'sideways_use_atr': False, 'sideways_use_adx': True, 'sideways_use_spike': False, 'sideways_rsi_required': True}.
[I 2025-08-30 15:58:07,455] Trial 241 finished with values: [-1000000000.0, 1000000000.0] and parameters: {'p_sma': 52, 'p_std': 58, 'p_atr': 25, 'p_adx': 21, 'rsi_period': 32, 'ema1': 26, 'ema2': 59, 'slip_atr_k': 0.22104145152939506, 'slip_spread_k': 0.0008585521477834776, 'spread_hl_frac': 0.0476372891744031, 'bb_std_mult': 3.0165174704033975, 'rsi_os': 41, 'rsi_ob': 54, 'vol_spike': 0.10059230230624971, 'adx_thresh': 27.82642931093933, 'atr_min_pct': 0.021986654457607474, 'atr_max_pct': 0.138202306044696, 'tp_mult': 2.569039628939948, 'tsl_mult': 0.5020677295200211, 'strategy': 'breakout', 'time_stop': 20, 'use_sma': True, 'use_atr': True, 'use_adx': False, 'use_ema': True, 'use_spike': True, 'rsi_required': False, 'edge_k': 1.7946229633186386, 'edge_cap': 0.6234100248823811, 'bull_strategy': 'breakout', 'bull_bb_std_mult': 3.588662755098432, 'bull_rsi_os': 13, 'bull_rsi_ob': 73, 'bull_adx_thresh': 29.827845717395498, 'bull_atr_min_pct': 0.0013702656884451376, 'bull_atr_max_pct': 0.09529540310866179, 'bull_tp_mult': 1.4275479917546599, 'bull_tsl_mult': 0.7749951672551656, 'bull_time_stop': 75, 'bull_use_sma': True, 'bull_use_ema': True, 'bull_use_atr': False, 'bull_use_adx': False, 'bull_use_spike': False, 'bull_rsi_required': True, 'bear_strategy': 'breakout', 'bear_bb_std_mult': 2.1342090123459307, 'bear_rsi_os': 17, 'bear_rsi_ob': 78, 'bear_adx_thresh': 15.252618308613972, 'bear_atr_min_pct': 0.028792907879853148, 'bear_atr_max_pct': 0.1007287428036373, 'bear_tp_mult': 2.294116475483146, 'bear_tsl_mult': 0.024191824375564774, 'bear_time_stop': 262, 'bear_use_sma': False, 'bear_use_ema': False, 'bear_use_atr': False, 'bear_use_adx': True, 'bear_use_spike': True, 'bear_rsi_required': True, 'sideways_strategy': 'breakout', 'sideways_bb_std_mult': 3.003762290836552, 'sideways_rsi_os': 46, 'sideways_rsi_ob': 95, 'sideways_adx_thresh': 15.931504242199404, 'sideways_atr_min_pct': 0.026493134519941106, 'sideways_atr_max_pct': 0.14986950079683564, 'sideways_tp_mult': 2.5690940178314046, 'sideways_tsl_mult': 0.7590074280019505, 'sideways_time_stop': 5, 'sideways_use_sma': True, 'sideways_use_ema': False, 'sideways_use_atr': False, 'sideways_use_adx': True, 'sideways_use_spike': False, 'sideways_rsi_required': True}.
