[I 2025-08-30 17:01:03,319] Trial 606 finished with values: [-1000000000.0, 1000000000.0] and parameters: {'p_sma': 7, 'p_std': 20, 'p_atr': 15, 'p_adx': 12, 'rsi_period': 26, 'ema1': 19, 'ema2': 15, 'slip_atr_k': 0.08017243896900683, 'slip_spread_k': 0.10856406820919068, 'spread_hl_frac': 0.020254666692905748, 'bb_std_mult': 2.1476189854816337, 'rsi_os': 32, 'rsi_ob': 85, 'vol_spike': 0.08895290595829679, 'adx_thresh': 10.759743060031946, 'atr_min_pct': 0.01964363820861345, 'atr_max_pct': 0.14510405668675272, 'tp_mult': 2.8341649838182366, 'tsl_mult': 0.9445379973324372, 'strategy': 'mean_reversion', 'time_stop': 30, 'use_sma': False, 'use_atr': True, 'use_adx': True, 'use_ema': False, 'use_spike': False, 'rsi_required': True, 'edge_k': 0.6502295492610484, 'edge_cap': 0.8273768658593281, 'bull_strategy': 'mean_reversion', 'bull_bb_std_mult': 1.2875889739285091, 'bull_rsi_os': 7, 'bull_rsi_ob': 54, 'bull_adx_thresh': 34.97058542883424, 'bull_atr_min_pct': 0.022794703886745593, 'bull_atr_max_pct': 0.044810761568165894, 'bull_tp_mult': 2.35094590244691, 'bull_tsl_mult': 0.8020249053005861, 'bull_time_stop': 217, 'bull_use_sma': True, 'bull_use_ema': False, 'bull_use_atr': False, 'bull_use_adx': True, 'bull_use_spike': True, 'bull_rsi_required': False, 'bear_strategy': 'mean_reversion', 'bear_bb_std_mult': 0.5763858038455121, 'bear_rsi_os': 16, 'bear_rsi_ob': 85, 'bear_adx_thresh': 11.100531907526797, 'bear_atr_min_pct': 0.017941592859097553, 'bear_atr_max_pct': 0.11150983474445163, 'bear_tp_mult': 2.1241427660797627, 'bear_tsl_mult': 0.02380804130493408, 'bear_time_stop': 203, 'bear_use_sma': True, 'bear_use_ema': True, 'bear_use_atr': False, 'bear_use_adx': True, 'bear_use_spike': False, 'bear_rsi_required': False, 'sideways_strategy': 'breakout', 'sideways_bb_std_mult': 0.6905357046553162, 'sideways_rsi_os': 34, 'sideways_rsi_ob': 90, 'sideways_adx_thresh': 11.70988200253662, 'sideways_atr_min_pct': 0.002479295529357421, 'sideways_atr_max_pct': 0.10545650791907855, 'sideways_tp_mult': 2.990068877255697, 'sideways_tsl_mult': 0.4415836938741463, 'sideways_time_stop': 285, 'sideways_use_sma': False, 'sideways_use_ema': False, 'sideways_use_atr': True, 'sideways_use_adx': False, 'sideways_use_spike': False, 'sideways_rsi_required': False}.
[I 2025-08-30 17:01:04,253] Trial 605 finished with values: [-1000000000.0, 1000000000.0] and parameters: {'p_sma': 31, 'p_std': 18, 'p_atr': 15, 'p_adx': 12, 'rsi_period': 26, 'ema1': 19, 'ema2': 14, 'slip_atr_k': 0.04252461142320334, 'slip_spread_k': 0.12584314184455725, 'spread_hl_frac': 0.018694139939864345, 'bb_std_mult': 2.162474991056301, 'rsi_os': 31, 'rsi_ob': 85, 'vol_spike': 0.05876037906860981, 'adx_thresh': 10.451107960467438, 'atr_min_pct': 0.009760757574439172, 'atr_max_pct': 0.14603977384466552, 'tp_mult': 2.841822415482501, 'tsl_mult': 0.9056570428132432, 'strategy': 'mean_reversion', 'time_stop': 54, 'use_sma': False, 'use_atr': True, 'use_adx': True, 'use_ema': False, 'use_spike': False, 'rsi_required': True, 'edge_k': 0.676617418479205, 'edge_cap': 0.9174841558366792, 'bull_strategy': 'mean_reversion', 'bull_bb_std_mult': 1.4783373443869987, 'bull_rsi_os': 14, 'bull_rsi_ob': 54, 'bull_adx_thresh': 33.76914148482449, 'bull_atr_min_pct': 0.02280428254809481, 'bull_atr_max_pct': 0.14153692760885053, 'bull_tp_mult': 2.3312232704849754, 'bull_tsl_mult': 0.8165658119997584, 'bull_time_stop': 59, 'bull_use_sma': True, 'bull_use_ema': False, 'bull_use_atr': False, 'bull_use_adx': True, 'bull_use_spike': True, 'bull_rsi_required': False, 'bear_strategy': 'mean_reversion', 'bear_bb_std_mult': 1.2287016172754577, 'bear_rsi_os': 19, 'bear_rsi_ob': 53, 'bear_adx_thresh': 11.133924600354566, 'bear_atr_min_pct': 0.017886588721557482, 'bear_atr_max_pct': 0.1121339993533239, 'bear_tp_mult': 2.062582038755866, 'bear_tsl_mult': 0.24259757571264207, 'bear_time_stop': 202, 'bear_use_sma': True, 'bear_use_ema': True, 'bear_use_atr': False, 'bear_use_adx': True, 'bear_use_spike': False, 'bear_rsi_required': False, 'sideways_strategy': 'breakout', 'sideways_bb_std_mult': 0.7862528106018934, 'sideways_rsi_os': 34, 'sideways_rsi_ob': 90, 'sideways_adx_thresh': 11.627695252515583, 'sideways_atr_min_pct': 0.029892945109110766, 'sideways_atr_max_pct': 0.10773797208625913, 'sideways_tp_mult': 2.99083094261413, 'sideways_tsl_mult': 0.44750269884028865, 'sideways_time_stop': 286, 'sideways_use_sma': False, 'sideways_use_ema': False, 'sideways_use_atr': True, 'sideways_use_adx': False, 'sideways_use_spike': False, 'sideways_rsi_required': False}.
[I 2025-08-30 17:01:05,083] Trial 604 finished with values: [-1000000000.0, 1000000000.0] and parameters: {'p_sma': 7, 'p_std': 20, 'p_atr': 15, 'p_adx': 8, 'rsi_period': 27, 'ema1': 18, 'ema2': 11, 'slip_atr_k': 0.08075012016339551, 'slip_spread_k': 0.11110712257706172, 'spread_hl_frac': 0.0019064156840738963, 'bb_std_mult': 3.137676254242028, 'rsi_os': 33, 'rsi_ob': 85, 'vol_spike': 0.03848520784116495, 'adx_thresh': 10.745085426826499, 'atr_min_pct': 0.024070273235196955, 'atr_max_pct': 0.1450591056662175, 'tp_mult': 2.230800506680078, 'tsl_mult': 0.9629598069983326, 'strategy': 'mean_reversion', 'time_stop': 30, 'use_sma': False, 'use_atr': True, 'use_adx': True, 'use_ema': False, 'use_spike': False, 'rsi_required': True, 'edge_k': 0.6831091961706401, 'edge_cap': 0.7561470393768829, 'bull_strategy': 'breakout', 'bull_bb_std_mult': 1.4648575649347415, 'bull_rsi_os': 7, 'bull_rsi_ob': 57, 'bull_adx_thresh': 33.95503787342399, 'bull_atr_min_pct': 0.02203823884407984, 'bull_atr_max_pct': 0.14537856766509732, 'bull_tp_mult': 2.3203786758766993, 'bull_tsl_mult': 0.7660493825101513, 'bull_time_stop': 59, 'bull_use_sma': True, 'bull_use_ema': True, 'bull_use_atr': False, 'bull_use_adx': True, 'bull_use_spike': True, 'bull_rsi_required': False, 'bear_strategy': 'mean_reversion', 'bear_bb_std_mult': 1.662028593779024, 'bear_rsi_os': 15, 'bear_rsi_ob': 61, 'bear_adx_thresh': 10.21069360746744, 'bear_atr_min_pct': 0.01546091398314172, 'bear_atr_max_pct': 0.11010535670863245, 'bear_tp_mult': 2.5285601566760043, 'bear_tsl_mult': 0.6299627184850322, 'bear_time_stop': 201, 'bear_use_sma': False, 'bear_use_ema': True, 'bear_use_atr': False, 'bear_use_adx': True, 'bear_use_spike': False, 'bear_rsi_required': False, 'sideways_strategy': 'breakout', 'sideways_bb_std_mult': 1.1648486593334946, 'sideways_rsi_os': 31, 'sideways_rsi_ob': 77, 'sideways_adx_thresh': 11.741026464868122, 'sideways_atr_min_pct': 0.001895878386570881, 'sideways_atr_max_pct': 0.0910673940274841, 'sideways_tp_mult': 2.991230597152809, 'sideways_tsl_mult': 0.4406142275701388, 'sideways_time_stop': 286, 'sideways_use_sma': False, 'sideways_use_ema': False, 'sideways_use_atr': True, 'sideways_use_adx': True, 'sideways_use_spike': False, 'sideways_rsi_required': True}.
[I 2025-08-30 17:01:05,940] Trial 603 finished with values: [-0.03210352104864611, 0.03197706504166936] and parameters: {'p_sma': 49, 'p_std': 17, 'p_atr': 15, 'p_adx': 7, 'rsi_period': 26, 'ema1': 19, 'ema2': 56, 'slip_atr_k': 0.19444338089491953, 'slip_spread_k': 0.11550972711330874, 'spread_hl_frac': 0.019873464475412814, 'bb_std_mult': 2.176435658854423, 'rsi_os': 31, 'rsi_ob': 84, 'vol_spike': 0.0972447451168246, 'adx_thresh': 8.14478366696123, 'atr_min_pct': 0.02402730965909216, 'atr_max_pct': 0.146347433074302, 'tp_mult': 1.5513051542664493, 'tsl_mult': 0.7627523434115852, 'strategy': 'mean_reversion', 'time_stop': 28, 'use_sma': False, 'use_atr': True, 'use_adx': True, 'use_ema': True, 'use_spike': False, 'rsi_required': True, 'edge_k': 0.685625401651516, 'edge_cap': 0.9999989716446451, 'bull_strategy': 'breakout', 'bull_bb_std_mult': 1.8862206973266997, 'bull_rsi_os': 8, 'bull_rsi_ob': 57, 'bull_adx_thresh': 33.89122939450875, 'bull_atr_min_pct': 0.022041664404809366, 'bull_atr_max_pct': 0.1417514705676591, 'bull_tp_mult': 2.3341915936125996, 'bull_tsl_mult': 0.7658325534588211, 'bull_time_stop': 170, 'bull_use_sma': True, 'bull_use_ema': True, 'bull_use_atr': False, 'bull_use_adx': True, 'bull_use_spike': False, 'bull_rsi_required': False, 'bear_strategy': 'breakout', 'bear_bb_std_mult': 1.234692108513526, 'bear_rsi_os': 17, 'bear_rsi_ob': 76, 'bear_adx_thresh': 10.26132784016876, 'bear_atr_min_pct': 0.019688800652201854, 'bear_atr_max_pct': 0.11170275114659302, 'bear_tp_mult': 2.961957485218223, 'bear_tsl_mult': 0.023818330953406297, 'bear_time_stop': 209, 'bear_use_sma': False, 'bear_use_ema': True, 'bear_use_atr': True, 'bear_use_adx': True, 'bear_use_spike': False, 'bear_rsi_required': False, 'sideways_strategy': 'breakout', 'sideways_bb_std_mult': 1.0468391337074876, 'sideways_rsi_os': 31, 'sideways_rsi_ob': 94, 'sideways_adx_thresh': 11.503550416612761, 'sideways_atr_min_pct': 0.0020172638707922153, 'sideways_atr_max_pct': 0.10584880355793713, 'sideways_tp_mult': 2.9139602357913117, 'sideways_tsl_mult': 0.4343822904484519, 'sideways_time_stop': 294, 'sideways_use_sma': False, 'sideways_use_ema': True, 'sideways_use_atr': False, 'sideways_use_adx': True, 'sideways_use_spike': False, 'sideways_rsi_required': True}.
[I 2025-08-30 17:01:50,378] Trial 610 finished with values: [-0.03609310231875773, 0.03606241219141758] and parameters: {'p_sma': 52, 'p_std': 22, 'p_atr': 14, 'p_adx': 8, 'rsi_period': 29, 'ema1': 18, 'ema2': 43, 'slip_atr_k': 0.00908909010523207, 'slip_spread_k': 0.30178617004692915, 'spread_hl_frac': 0.01804045534515218, 'bb_std_mult': 3.475421213809705, 'rsi_os': 32, 'rsi_ob': 86, 'vol_spike': 0.04775989793068912, 'adx_thresh': 10.7879757740212, 'atr_min_pct': 0.015337826970339809, 'atr_max_pct': 0.1447423526977052, 'tp_mult': 1.0129316160803339, 'tsl_mult': 0.8978898431627295, 'strategy': 'mean_reversion', 'time_stop': 37, 'use_sma': True, 'use_atr': True, 'use_adx': True, 'use_ema': False, 'use_spike': True, 'rsi_required': True, 'edge_k': 0.3461996092645514, 'edge_cap': 0.8060593633768711, 'bull_strategy': 'mean_reversion', 'bull_bb_std_mult': 1.97121464706339, 'bull_rsi_os': 19, 'bull_rsi_ob': 54, 'bull_adx_thresh': 33.05807657599054, 'bull_atr_min_pct': 0.022780116840580632, 'bull_atr_max_pct': 0.01029040072102197, 'bull_tp_mult': 2.2167732323099876, 'bull_tsl_mult': 0.8342848783900543, 'bull_time_stop': 53, 'bull_use_sma': True, 'bull_use_ema': True, 'bull_use_atr': False, 'bull_use_adx': True, 'bull_use_spike': False, 'bull_rsi_required': False, 'bear_strategy': 'mean_reversion', 'bear_bb_std_mult': 1.1440210903526096, 'bear_rsi_os': 17, 'bear_rsi_ob': 64, 'bear_adx_thresh': 11.81404101489706, 'bear_atr_min_pct': 0.01687245402465496, 'bear_atr_max_pct': 0.1055090948848645, 'bear_tp_mult': 1.5488001406839191, 'bear_tsl_mult': 0.19796389074686022, 'bear_time_stop': 211, 'bear_use_sma': True, 'bear_use_ema': False, 'bear_use_atr': False, 'bear_use_adx': False, 'bear_use_spike': False, 'bear_rsi_required': False, 'sideways_strategy': 'breakout', 'sideways_bb_std_mult': 0.5476240901908357, 'sideways_rsi_os': 33, 'sideways_rsi_ob': 73, 'sideways_adx_thresh': 10.35107824281434, 'sideways_atr_min_pct': 0.001626576776698263, 'sideways_atr_max_pct': 0.09745662714617963, 'sideways_tp_mult': 2.9303773570616167, 'sideways_tsl_mult': 0.9309083907014171, 'sideways_time_stop': 271, 'sideways_use_sma': True, 'sideways_use_ema': False, 'sideways_use_atr': False, 'sideways_use_adx': False, 'sideways_use_spike': False, 'sideways_rsi_required': True}.
[I 2025-08-30 17:01:50,369] Trial 609 finished with values: [-1000000000.0, 1000000000.0] and parameters: {'p_sma': 36, 'p_std': 22, 'p_atr': 14, 'p_adx': 7, 'rsi_period': 24, 'ema1': 17, 'ema2': 10, 'slip_atr_k': 0.13807386311456038, 'slip_spread_k': 0.16678477629298866, 'spread_hl_frac': 0.018383480004870764, 'bb_std_mult': 1.1014099207962509, 'rsi_os': 32, 'rsi_ob': 86, 'vol_spike': 0.06922419400803372, 'adx_thresh': 10.903903604890251, 'atr_min_pct': 0.01922820287582227, 'atr_max_pct': 0.14481032885695727, 'tp_mult': 2.676527723323992, 'tsl_mult': 0.8971854582528593, 'strategy': 'mean_reversion', 'time_stop': 37, 'use_sma': True, 'use_atr': True, 'use_adx': True, 'use_ema': False, 'use_spike': False, 'rsi_required': True, 'edge_k': 0.3525859815961222, 'edge_cap': 0.8053557669360043, 'bull_strategy': 'mean_reversion', 'bull_bb_std_mult': 1.873991185140308, 'bull_rsi_os': 16, 'bull_rsi_ob': 56, 'bull_adx_thresh': 34.02102376852365, 'bull_atr_min_pct': 0.02206352325681975, 'bull_atr_max_pct': 0.14205491078376553, 'bull_tp_mult': 2.2180383767393614, 'bull_tsl_mult': 0.8351827895868892, 'bull_time_stop': 82, 'bull_use_sma': True, 'bull_use_ema': True, 'bull_use_atr': False, 'bull_use_adx': True, 'bull_use_spike': False, 'bull_rsi_required': False, 'bear_strategy': 'mean_reversion', 'bear_bb_std_mult': 1.1415823165512273, 'bear_rsi_os': 17, 'bear_rsi_ob': 73, 'bear_adx_thresh': 11.82235056505348, 'bear_atr_min_pct': 0.024185599766420512, 'bear_atr_max_pct': 0.10632892656142802, 'bear_tp_mult': 1.357123763362047, 'bear_tsl_mult': 0.63395207522911, 'bear_time_stop': 210, 'bear_use_sma': True, 'bear_use_ema': False, 'bear_use_atr': False, 'bear_use_adx': False, 'bear_use_spike': False, 'bear_rsi_required': False, 'sideways_strategy': 'breakout', 'sideways_bb_std_mult': 0.8445535587556081, 'sideways_rsi_os': 33, 'sideways_rsi_ob': 64, 'sideways_adx_thresh': 12.57681991338022, 'sideways_atr_min_pct': 0.02850702954009697, 'sideways_atr_max_pct': 0.09520469713578206, 'sideways_tp_mult': 2.9118224940255573, 'sideways_tsl_mult': 0.4092277345885441, 'sideways_time_stop': 272, 'sideways_use_sma': True, 'sideways_use_ema': False, 'sideways_use_atr': False, 'sideways_use_adx': False, 'sideways_use_spike': False, 'sideways_rsi_required': True}.
[I 2025-08-30 17:01:50,795] Trial 608 finished with values: [-1000000000.0, 1000000000.0] and parameters: {'p_sma': 8, 'p_std': 20, 'p_atr': 14, 'p_adx': 7, 'rsi_period': 25, 'ema1': 18, 'ema2': 10, 'slip_atr_k': 0.017577597802565917, 'slip_spread_k': 0.16367133345723509, 'spread_hl_frac': 0.02683948955465399, 'bb_std_mult': 1.6984402130795373, 'rsi_os': 32, 'rsi_ob': 86, 'vol_spike': 0.09615786586979061, 'adx_thresh': 10.79824715302125, 'atr_min_pct': 0.018957040697635163, 'atr_max_pct': 0.14516031826815248, 'tp_mult': 1.8006722360788847, 'tsl_mult': 0.9707156654151513, 'strategy': 'mean_reversion', 'time_stop': 38, 'use_sma': True, 'use_atr': True, 'use_adx': True, 'use_ema': False, 'use_spike': False, 'rsi_required': True, 'edge_k': 0.34821419960880373, 'edge_cap': 0.8012825217889576, 'bull_strategy': 'breakout', 'bull_bb_std_mult': 1.8931602741269058, 'bull_rsi_os': 8, 'bull_rsi_ob': 57, 'bull_adx_thresh': 32.82234696433221, 'bull_atr_min_pct': 0.021856157371135904, 'bull_atr_max_pct': 0.14447812990216208, 'bull_tp_mult': 2.2215976099671586, 'bull_tsl_mult': 0.7699305724661516, 'bull_time_stop': 203, 'bull_use_sma': True, 'bull_use_ema': True, 'bull_use_atr': False, 'bull_use_adx': True, 'bull_use_spike': False, 'bull_rsi_required': False, 'bear_strategy': 'mean_reversion', 'bear_bb_std_mult': 1.632092513099846, 'bear_rsi_os': 17, 'bear_rsi_ob': 76, 'bear_adx_thresh': 11.730076266224351, 'bear_atr_min_pct': 0.02439084879118736, 'bear_atr_max_pct': 0.10974368130345447, 'bear_tp_mult': 2.1829929737245144, 'bear_tsl_mult': 0.634824579415242, 'bear_time_stop': 206, 'bear_use_sma': False, 'bear_use_ema': False, 'bear_use_atr': False, 'bear_use_adx': False, 'bear_use_spike': False, 'bear_rsi_required': False, 'sideways_strategy': 'breakout', 'sideways_bb_std_mult': 0.5498095946346396, 'sideways_rsi_os': 31, 'sideways_rsi_ob': 73, 'sideways_adx_thresh': 12.734148618788467, 'sideways_atr_min_pct': 0.028561390268533507, 'sideways_atr_max_pct': 0.09461477550458891, 'sideways_tp_mult': 2.9069828342401656, 'sideways_tsl_mult': 0.0659949213936023, 'sideways_time_stop': 272, 'sideways_use_sma': True, 'sideways_use_ema': False, 'sideways_use_atr': False, 'sideways_use_adx': True, 'sideways_use_spike': False, 'sideways_rsi_required': True}.
[I 2025-08-30 17:01:51,407] Trial 607 finished with values: [-0.019737608299550957, 0.019721207052692535] and parameters: {'p_sma': 52, 'p_std': 18, 'p_atr': 19, 'p_adx': 11, 'rsi_period': 29, 'ema1': 18, 'ema2': 14, 'slip_atr_k': 0.018149066825768254, 'slip_spread_k': 0.12285593803258221, 'spread_hl_frac': 0.009975881189789893, 'bb_std_mult': 3.1743834727900837, 'rsi_os': 33, 'rsi_ob': 86, 'vol_spike': 0.09695114091993337, 'adx_thresh': 11.015422340384324, 'atr_min_pct': 0.00988533130603753, 'atr_max_pct': 0.14498004564203426, 'tp_mult': 1.5554043325194273, 'tsl_mult': 0.9050938943240545, 'strategy': 'mean_reversion', 'time_stop': 38, 'use_sma': False, 'use_atr': True, 'use_adx': True, 'use_ema': False, 'use_spike': False, 'rsi_required': True, 'edge_k': 0.6883818052652366, 'edge_cap': 0.7673703509239324, 'bull_strategy': 'breakout', 'bull_bb_std_mult': 0.8753252162349776, 'bull_rsi_os': 14, 'bull_rsi_ob': 54, 'bull_adx_thresh': 32.92769660341856, 'bull_atr_min_pct': 0.02262803702087999, 'bull_atr_max_pct': 0.14282439982242168, 'bull_tp_mult': 2.3169626453335215, 'bull_tsl_mult': 0.8386395923485799, 'bull_time_stop': 58, 'bull_use_sma': True, 'bull_use_ema': True, 'bull_use_atr': False, 'bull_use_adx': True, 'bull_use_spike': False, 'bull_rsi_required': False, 'bear_strategy': 'mean_reversion', 'bear_bb_std_mult': 0.9254844233746871, 'bear_rsi_os': 17, 'bear_rsi_ob': 60, 'bear_adx_thresh': 10.192719412527566, 'bear_atr_min_pct': 0.016869133563441628, 'bear_atr_max_pct': 0.10995360976635414, 'bear_tp_mult': 2.065584499625055, 'bear_tsl_mult': 0.6241388095924711, 'bear_time_stop': 201, 'bear_use_sma': True, 'bear_use_ema': False, 'bear_use_atr': False, 'bear_use_adx': False, 'bear_use_spike': False, 'bear_rsi_required': False, 'sideways_strategy': 'breakout', 'sideways_bb_std_mult': 0.7707021613938678, 'sideways_rsi_os': 31, 'sideways_rsi_ob': 63, 'sideways_adx_thresh': 11.51162278519207, 'sideways_atr_min_pct': 0.0017855760348689017, 'sideways_atr_max_pct': 0.09589602139980201, 'sideways_tp_mult': 2.908522717881249, 'sideways_tsl_mult': 0.44785370520051165, 'sideways_time_stop': 272, 'sideways_use_sma': False, 'sideways_use_ema': False, 'sideways_use_atr': False, 'sideways_use_adx': False, 'sideways_use_spike': False, 'sideways_rsi_required': True}.
[I 2025-08-30 17:02:35,762] Trial 612 finished with values: [-1000000000.0, 1000000000.0] and parameters: {'p_sma': 6, 'p_std': 25, 'p_atr': 19, 'p_adx': 11, 'rsi_period': 23, 'ema1': 17, 'ema2': 28, 'slip_atr_k': 0.11963058272875475, 'slip_spread_k': 0.0830716552751407, 'spread_hl_frac': 0.029584565320402358, 'bb_std_mult': 2.325649207933548, 'rsi_os': 33, 'rsi_ob': 87, 'vol_spike': 0.11117593239939635, 'adx_thresh': 10.207914891952305, 'atr_min_pct': 0.019904216871637934, 'atr_max_pct': 0.14738996015843128, 'tp_mult': 2.1490445327073138, 'tsl_mult': 0.9998776922209758, 'strategy': 'mean_reversion', 'time_stop': 29, 'use_sma': False, 'use_atr': False, 'use_adx': False, 'use_ema': False, 'use_spike': False, 'rsi_required': True, 'edge_k': 0.77987561223594, 'edge_cap': 0.9534183988640406, 'bull_strategy': 'mean_reversion', 'bull_bb_std_mult': 0.8263015836718359, 'bull_rsi_os': 14, 'bull_rsi_ob': 55, 'bull_adx_thresh': 34.927942343368095, 'bull_atr_min_pct': 0.024717954024776327, 'bull_atr_max_pct': 0.015672395502198164, 'bull_tp_mult': 2.296216075499233, 'bull_tsl_mult': 0.7976488203588448, 'bull_time_stop': 14, 'bull_use_sma': True, 'bull_use_ema': False, 'bull_use_atr': False, 'bull_use_adx': False, 'bull_use_spike': False, 'bull_rsi_required': False, 'bear_strategy': 'mean_reversion', 'bear_bb_std_mult': 0.9196179222809723, 'bear_rsi_os': 15, 'bear_rsi_ob': 75, 'bear_adx_thresh': 12.404416300031748, 'bear_atr_min_pct': 0.018687103520696483, 'bear_atr_max_pct': 0.11563809044260978, 'bear_tp_mult': 2.042592780006543, 'bear_tsl_mult': 0.3129609351259028, 'bear_time_stop': 187, 'bear_use_sma': True, 'bear_use_ema': False, 'bear_use_atr': False, 'bear_use_adx': False, 'bear_use_spike': False, 'bear_rsi_required': True, 'sideways_strategy': 'breakout', 'sideways_bb_std_mult': 0.6321535869351551, 'sideways_rsi_os': 32, 'sideways_rsi_ob': 63, 'sideways_adx_thresh': 10.820942652655722, 'sideways_atr_min_pct': 0.009869251278138211, 'sideways_atr_max_pct': 0.10285118380887821, 'sideways_tp_mult': 2.9459247473994252, 'sideways_tsl_mult': 0.34023867875176417, 'sideways_time_stop': 280, 'sideways_use_sma': True, 'sideways_use_ema': False, 'sideways_use_atr': False, 'sideways_use_adx': False, 'sideways_use_spike': False, 'sideways_rsi_required': False}.
