[I 2025-08-30 15:53:54,328] Trial 216 finished with values: [-1000000000.0, 1000000000.0] and parameters: {'p_sma': 19, 'p_std': 56, 'p_atr': 12, 'p_adx': 14, 'rsi_period': 30, 'ema1': 27, 'ema2': 56, 'slip_atr_k': 0.019237620971900137, 'slip_spread_k': 0.2399221239982537, 'spread_hl_frac': 0.0138685563426993, 'bb_std_mult': 3.119904389212065, 'rsi_os': 25, 'rsi_ob': 53, 'vol_spike': 0.04811074308885531, 'adx_thresh': 26.256615116226534, 'atr_min_pct': 0.021999350497031278, 'atr_max_pct': 0.13874133696766866, 'tp_mult': 2.843242163547177, 'tsl_mult': 0.24601475729175837, 'strategy': 'breakout', 'time_stop': 16, 'use_sma': False, 'use_atr': True, 'use_adx': False, 'use_ema': False, 'use_spike': True, 'rsi_required': False, 'edge_k': 1.642512291261279, 'edge_cap': 0.8055312768107674, 'bull_strategy': 'breakout', 'bull_bb_std_mult': 1.9102304093517053, 'bull_rsi_os': 9, 'bull_rsi_ob': 76, 'bull_adx_thresh': 29.315849198810838, 'bull_atr_min_pct': 0.0010753082317577383, 'bull_atr_max_pct': 0.12908055929854445, 'bull_tp_mult': 1.27107460777292, 'bull_tsl_mult': 0.8508787932297927, 'bull_time_stop': 194, 'bull_use_sma': True, 'bull_use_ema': False, 'bull_use_atr': False, 'bull_use_adx': False, 'bull_use_spike': False, 'bull_rsi_required': True, 'bear_strategy': 'mean_reversion', 'bear_bb_std_mult': 2.1005095560358904, 'bear_rsi_os': 15, 'bear_rsi_ob': 66, 'bear_adx_thresh': 14.995216460681823, 'bear_atr_min_pct': 0.005117532376826049, 'bear_atr_max_pct': 0.04681833455029512, 'bear_tp_mult': 2.256250514012532, 'bear_tsl_mult': 0.2123283463206927, 'bear_time_stop': 105, 'bear_use_sma': False, 'bear_use_ema': False, 'bear_use_atr': False, 'bear_use_adx': True, 'bear_use_spike': True, 'bear_rsi_required': True, 'sideways_strategy': 'breakout', 'sideways_bb_std_mult': 3.0130282635725374, 'sideways_rsi_os': 12, 'sideways_rsi_ob': 92, 'sideways_adx_thresh': 14.855576363960996, 'sideways_atr_min_pct': 0.0027877553796801175, 'sideways_atr_max_pct': 0.146124089297873, 'sideways_tp_mult': 2.411239815659519, 'sideways_tsl_mult': 0.6536629047238486, 'sideways_time_stop': 223, 'sideways_use_sma': True, 'sideways_use_ema': False, 'sideways_use_atr': False, 'sideways_use_adx': True, 'sideways_use_spike': False, 'sideways_rsi_required': True}.
[I 2025-08-30 15:53:55,049] Trial 215 finished with values: [-0.012975713720418725, 0.013128226376459756] and parameters: {'p_sma': 18, 'p_std': 60, 'p_atr': 25, 'p_adx': 14, 'rsi_period': 30, 'ema1': 26, 'ema2': 45, 'slip_atr_k': 0.03947803691284059, 'slip_spread_k': 0.04467102102994028, 'spread_hl_frac': 0.013770533905494674, 'bb_std_mult': 3.0919129743243645, 'rsi_os': 17, 'rsi_ob': 54, 'vol_spike': 0.014545545496905538, 'adx_thresh': 26.41909058694283, 'atr_min_pct': 0.020687522802091678, 'atr_max_pct': 0.1313988755277747, 'tp_mult': 1.1662049931235676, 'tsl_mult': 0.46126365488827664, 'strategy': 'breakout', 'time_stop': 19, 'use_sma': False, 'use_atr': True, 'use_adx': False, 'use_ema': False, 'use_spike': True, 'rsi_required': False, 'edge_k': 1.8724321617434307, 'edge_cap': 0.5358045753129049, 'bull_strategy': 'breakout', 'bull_bb_std_mult': 1.893890354971505, 'bull_rsi_os': 13, 'bull_rsi_ob': 76, 'bull_adx_thresh': 28.82827578347811, 'bull_atr_min_pct': 0.0009762258173258639, 'bull_atr_max_pct': 0.10665714685790006, 'bull_tp_mult': 1.6969387882697318, 'bull_tsl_mult': 0.32583446672915195, 'bull_time_stop': 227, 'bull_use_sma': True, 'bull_use_ema': False, 'bull_use_atr': False, 'bull_use_adx': False, 'bull_use_spike': True, 'bull_rsi_required': True, 'bear_strategy': 'mean_reversion', 'bear_bb_std_mult': 1.9847583262420692, 'bear_rsi_os': 15, 'bear_rsi_ob': 71, 'bear_adx_thresh': 14.828500976071336, 'bear_atr_min_pct': 0.02294818555487902, 'bear_atr_max_pct': 0.037455959676262696, 'bear_tp_mult': 1.3416854594509486, 'bear_tsl_mult': 0.24433462570335923, 'bear_time_stop': 277, 'bear_use_sma': False, 'bear_use_ema': False, 'bear_use_atr': False, 'bear_use_adx': True, 'bear_use_spike': True, 'bear_rsi_required': True, 'sideways_strategy': 'breakout', 'sideways_bb_std_mult': 2.9987572747525078, 'sideways_rsi_os': 31, 'sideways_rsi_ob': 92, 'sideways_adx_thresh': 14.933881081907266, 'sideways_atr_min_pct': 0.0025424063797644257, 'sideways_atr_max_pct': 0.14527615457869228, 'sideways_tp_mult': 2.429861733383503, 'sideways_tsl_mult': 0.6297195121416083, 'sideways_time_stop': 221, 'sideways_use_sma': True, 'sideways_use_ema': False, 'sideways_use_atr': False, 'sideways_use_adx': True, 'sideways_use_spike': False, 'sideways_rsi_required': True}.
[I 2025-08-30 15:53:55,322] Trial 218 finished with values: [-1000000000.0, 1000000000.0] and parameters: {'p_sma': 19, 'p_std': 56, 'p_atr': 12, 'p_adx': 15, 'rsi_period': 26, 'ema1': 26, 'ema2': 59, 'slip_atr_k': 0.19257776536818372, 'slip_spread_k': 0.035857977011614944, 'spread_hl_frac': 0.0030034296866792085, 'bb_std_mult': 3.114503444023421, 'rsi_os': 39, 'rsi_ob': 53, 'vol_spike': 0.1248686640975372, 'adx_thresh': 27.571180900480936, 'atr_min_pct': 0.019838709490839185, 'atr_max_pct': 0.13983457815366657, 'tp_mult': 1.2108769483472321, 'tsl_mult': 0.231188667878511, 'strategy': 'breakout', 'time_stop': 16, 'use_sma': True, 'use_atr': True, 'use_adx': False, 'use_ema': False, 'use_spike': True, 'rsi_required': False, 'edge_k': 1.899731148900018, 'edge_cap': 0.5435901568098084, 'bull_strategy': 'breakout', 'bull_bb_std_mult': 1.881649971411644, 'bull_rsi_os': 10, 'bull_rsi_ob': 74, 'bull_adx_thresh': 29.18245080410267, 'bull_atr_min_pct': 0.0010669532545310415, 'bull_atr_max_pct': 0.138550884576851, 'bull_tp_mult': 1.1486076853639209, 'bull_tsl_mult': 0.8360041691580944, 'bull_time_stop': 73, 'bull_use_sma': True, 'bull_use_ema': True, 'bull_use_atr': False, 'bull_use_adx': False, 'bull_use_spike': False, 'bull_rsi_required': True, 'bear_strategy': 'mean_reversion', 'bear_bb_std_mult': 2.120374706974822, 'bear_rsi_os': 18, 'bear_rsi_ob': 76, 'bear_adx_thresh': 13.65169492466901, 'bear_atr_min_pct': 0.005380764001407062, 'bear_atr_max_pct': 0.047124344256959605, 'bear_tp_mult': 1.2185086581611375, 'bear_tsl_mult': 0.24804847757481802, 'bear_time_stop': 72, 'bear_use_sma': False, 'bear_use_ema': False, 'bear_use_atr': False, 'bear_use_adx': False, 'bear_use_spike': True, 'bear_rsi_required': False, 'sideways_strategy': 'breakout', 'sideways_bb_std_mult': 2.986691937271074, 'sideways_rsi_os': 12, 'sideways_rsi_ob': 92, 'sideways_adx_thresh': 33.9616099236391, 'sideways_atr_min_pct': 0.0027348097550403713, 'sideways_atr_max_pct': 0.14647517795436932, 'sideways_tp_mult': 2.506833185718757, 'sideways_tsl_mult': 0.781793584423418, 'sideways_time_stop': 136, 'sideways_use_sma': True, 'sideways_use_ema': False, 'sideways_use_atr': False, 'sideways_use_adx': True, 'sideways_use_spike': False, 'sideways_rsi_required': True}.
[I 2025-08-30 15:53:55,503] Trial 219 finished with values: [-1000000000.0, 1000000000.0] and parameters: {'p_sma': 19, 'p_std': 59, 'p_atr': 25, 'p_adx': 14, 'rsi_period': 31, 'ema1': 27, 'ema2': 59, 'slip_atr_k': 0.19281582623909377, 'slip_spread_k': 0.2426162981048956, 'spread_hl_frac': 0.0008822585948771132, 'bb_std_mult': 3.03225651957512, 'rsi_os': 23, 'rsi_ob': 53, 'vol_spike': 0.125242391963937, 'adx_thresh': 27.004591389913593, 'atr_min_pct': 0.01964915769737763, 'atr_max_pct': 0.10599627625925083, 'tp_mult': 1.2289241011436942, 'tsl_mult': 0.45770914656291795, 'strategy': 'breakout', 'time_stop': 19, 'use_sma': False, 'use_atr': True, 'use_adx': False, 'use_ema': False, 'use_spike': True, 'rsi_required': False, 'edge_k': 1.8394574667501296, 'edge_cap': 0.8010120837409278, 'bull_strategy': 'breakout', 'bull_bb_std_mult': 1.8668367743161087, 'bull_rsi_os': 9, 'bull_rsi_ob': 74, 'bull_adx_thresh': 30.21141923516452, 'bull_atr_min_pct': 0.0010687491851595747, 'bull_atr_max_pct': 0.12959198518578194, 'bull_tp_mult': 1.2814946282805362, 'bull_tsl_mult': 0.8496613765480391, 'bull_time_stop': 285, 'bull_use_sma': True, 'bull_use_ema': True, 'bull_use_atr': False, 'bull_use_adx': False, 'bull_use_spike': False, 'bull_rsi_required': True, 'bear_strategy': 'mean_reversion', 'bear_bb_std_mult': 1.9539965077561596, 'bear_rsi_os': 18, 'bear_rsi_ob': 76, 'bear_adx_thresh': 13.556469149307187, 'bear_atr_min_pct': 0.02894585030481031, 'bear_atr_max_pct': 0.09481710726916188, 'bear_tp_mult': 1.255991477237477, 'bear_tsl_mult': 0.20406131740771377, 'bear_time_stop': 106, 'bear_use_sma': False, 'bear_use_ema': False, 'bear_use_atr': False, 'bear_use_adx': True, 'bear_use_spike': True, 'bear_rsi_required': True, 'sideways_strategy': 'breakout', 'sideways_bb_std_mult': 2.9590961516325534, 'sideways_rsi_os': 6, 'sideways_rsi_ob': 94, 'sideways_adx_thresh': 14.970450939448318, 'sideways_atr_min_pct': 0.0037395699455113323, 'sideways_atr_max_pct': 0.14619525110320825, 'sideways_tp_mult': 2.9931379981598565, 'sideways_tsl_mult': 0.6674256949519329, 'sideways_time_stop': 115, 'sideways_use_sma': True, 'sideways_use_ema': False, 'sideways_use_atr': False, 'sideways_use_adx': True, 'sideways_use_spike': False, 'sideways_rsi_required': True}.
[I 2025-08-30 15:54:37,168] Trial 222 finished with values: [-1000000000.0, 1000000000.0] and parameters: {'p_sma': 17, 'p_std': 60, 'p_atr': 26, 'p_adx': 15, 'rsi_period': 32, 'ema1': 16, 'ema2': 58, 'slip_atr_k': 0.01366232734495567, 'slip_spread_k': 0.5098340019074329, 'spread_hl_frac': 0.046416496283520556, 'bb_std_mult': 3.0543985151255937, 'rsi_os': 35, 'rsi_ob': 54, 'vol_spike': 0.20038934413380416, 'adx_thresh': 29.597254100819903, 'atr_min_pct': 0.021278862606788716, 'atr_max_pct': 0.090481547177771, 'tp_mult': 2.0222476241110083, 'tsl_mult': 0.17520677632572873, 'strategy': 'breakout', 'time_stop': 32, 'use_sma': False, 'use_atr': True, 'use_adx': False, 'use_ema': False, 'use_spike': True, 'rsi_required': False, 'edge_k': 1.9731121072947293, 'edge_cap': 0.5553545902545047, 'bull_strategy': 'breakout', 'bull_bb_std_mult': 1.7897269481395477, 'bull_rsi_os': 13, 'bull_rsi_ob': 49, 'bull_adx_thresh': 30.222400393596953, 'bull_atr_min_pct': 0.029017225476616976, 'bull_atr_max_pct': 0.14564397490607547, 'bull_tp_mult': 1.3247336696108087, 'bull_tsl_mult': 0.07776127249347103, 'bull_time_stop': 224, 'bull_use_sma': True, 'bull_use_ema': True, 'bull_use_atr': False, 'bull_use_adx': False, 'bull_use_spike': False, 'bull_rsi_required': True, 'bear_strategy': 'mean_reversion', 'bear_bb_std_mult': 1.9973289425230072, 'bear_rsi_os': 16, 'bear_rsi_ob': 74, 'bear_adx_thresh': 13.025996363692691, 'bear_atr_min_pct': 0.02745409385805954, 'bear_atr_max_pct': 0.09025402667763806, 'bear_tp_mult': 2.5342949998271163, 'bear_tsl_mult': 0.5835000797626811, 'bear_time_stop': 268, 'bear_use_sma': False, 'bear_use_ema': False, 'bear_use_atr': False, 'bear_use_adx': False, 'bear_use_spike': True, 'bear_rsi_required': False, 'sideways_strategy': 'breakout', 'sideways_bb_std_mult': 3.033757612711752, 'sideways_rsi_os': 31, 'sideways_rsi_ob': 93, 'sideways_adx_thresh': 30.932914095207423, 'sideways_atr_min_pct': 0.02159940974683791, 'sideways_atr_max_pct': 0.14063338568777073, 'sideways_tp_mult': 2.0555351285249297, 'sideways_tsl_mult': 0.7631436077416957, 'sideways_time_stop': 124, 'sideways_use_sma': True, 'sideways_use_ema': False, 'sideways_use_atr': False, 'sideways_use_adx': True, 'sideways_use_spike': False, 'sideways_rsi_required': True}.
[I 2025-08-30 15:54:37,708] Trial 223 finished with values: [-1000000000.0, 1000000000.0] and parameters: {'p_sma': 54, 'p_std': 57, 'p_atr': 7, 'p_adx': 15, 'rsi_period': 32, 'ema1': 17, 'ema2': 58, 'slip_atr_k': 0.014817377053588002, 'slip_spread_k': 0.06465346254950116, 'spread_hl_frac': 0.03715512099022542, 'bb_std_mult': 3.001464868375282, 'rsi_os': 35, 'rsi_ob': 54, 'vol_spike': 0.013158479694616036, 'adx_thresh': 27.428894343009766, 'atr_min_pct': 0.02130731797032143, 'atr_max_pct': 0.06864307763341704, 'tp_mult': 1.165500615148293, 'tsl_mult': 0.4607197432517057, 'strategy': 'breakout', 'time_stop': 33, 'use_sma': False, 'use_atr': True, 'use_adx': False, 'use_ema': False, 'use_spike': True, 'rsi_required': False, 'edge_k': 1.9827951992780422, 'edge_cap': 0.4397083412832574, 'bull_strategy': 'breakout', 'bull_bb_std_mult': 1.8137403574019697, 'bull_rsi_os': 12, 'bull_rsi_ob': 49, 'bull_adx_thresh': 28.6694912053048, 'bull_atr_min_pct': 0.0069760780578999385, 'bull_atr_max_pct': 0.11918066196867423, 'bull_tp_mult': 1.231255698225919, 'bull_tsl_mult': 0.7183175297306775, 'bull_time_stop': 71, 'bull_use_sma': True, 'bull_use_ema': True, 'bull_use_atr': False, 'bull_use_adx': False, 'bull_use_spike': False, 'bull_rsi_required': True, 'bear_strategy': 'mean_reversion', 'bear_bb_std_mult': 2.025119859095382, 'bear_rsi_os': 16, 'bear_rsi_ob': 74, 'bear_adx_thresh': 12.974798387199192, 'bear_atr_min_pct': 0.029254606422543333, 'bear_atr_max_pct': 0.037526323446091914, 'bear_tp_mult': 2.3199889170686987, 'bear_tsl_mult': 0.1569903179644469, 'bear_time_stop': 267, 'bear_use_sma': False, 'bear_use_ema': False, 'bear_use_atr': False, 'bear_use_adx': False, 'bear_use_spike': True, 'bear_rsi_required': False, 'sideways_strategy': 'breakout', 'sideways_bb_std_mult': 3.071359870271935, 'sideways_rsi_os': 31, 'sideways_rsi_ob': 93, 'sideways_adx_thresh': 7.016685239074262, 'sideways_atr_min_pct': 0.01650063017220469, 'sideways_atr_max_pct': 0.14121713132249747, 'sideways_tp_mult': 2.5444356713611236, 'sideways_tsl_mult': 0.6968388667792516, 'sideways_time_stop': 188, 'sideways_use_sma': True, 'sideways_use_ema': False, 'sideways_use_atr': False, 'sideways_use_adx': True, 'sideways_use_spike': False, 'sideways_rsi_required': True}.
[I 2025-08-30 15:54:38,053] Trial 221 finished with values: [-1000000000.0, 1000000000.0] and parameters: {'p_sma': 55, 'p_std': 59, 'p_atr': 10, 'p_adx': 15, 'rsi_period': 32, 'ema1': 26, 'ema2': 59, 'slip_atr_k': 0.013432243136273211, 'slip_spread_k': 0.06151500803161691, 'spread_hl_frac': 0.003735575615219238, 'bb_std_mult': 3.047982750199962, 'rsi_os': 23, 'rsi_ob': 54, 'vol_spike': 0.20344585619251712, 'adx_thresh': 27.594132588054126, 'atr_min_pct': 0.019699162020352556, 'atr_max_pct': 0.0744859850008844, 'tp_mult': 1.2032151814343264, 'tsl_mult': 0.4556103763363466, 'strategy': 'breakout', 'time_stop': 22, 'use_sma': True, 'use_atr': True, 'use_adx': False, 'use_ema': False, 'use_spike': True, 'rsi_required': False, 'edge_k': 1.971292131545742, 'edge_cap': 0.5529682388622273, 'bull_strategy': 'breakout', 'bull_bb_std_mult': 1.8896283434488024, 'bull_rsi_os': 12, 'bull_rsi_ob': 74, 'bull_adx_thresh': 29.016467562937407, 'bull_atr_min_pct': 0.02911301446764127, 'bull_atr_max_pct': 0.1371077103343607, 'bull_tp_mult': 1.3126819311066298, 'bull_tsl_mult': 0.30071455157566734, 'bull_time_stop': 163, 'bull_use_sma': True, 'bull_use_ema': True, 'bull_use_atr': False, 'bull_use_adx': False, 'bull_use_spike': False, 'bull_rsi_required': True, 'bear_strategy': 'mean_reversion', 'bear_bb_std_mult': 1.9692365360667492, 'bear_rsi_os': 18, 'bear_rsi_ob': 76, 'bear_adx_thresh': 13.525682184565209, 'bear_atr_min_pct': 0.029165047543441226, 'bear_atr_max_pct': 0.0949987808630764, 'bear_tp_mult': 1.230565222508782, 'bear_tsl_mult': 0.6669724198737923, 'bear_time_stop': 265, 'bear_use_sma': False, 'bear_use_ema': False, 'bear_use_atr': False, 'bear_use_adx': False, 'bear_use_spike': True, 'bear_rsi_required': False, 'sideways_strategy': 'breakout', 'sideways_bb_std_mult': 3.083224193348203, 'sideways_rsi_os': 31, 'sideways_rsi_ob': 94, 'sideways_adx_thresh': 14.16056994769885, 'sideways_atr_min_pct': 0.02019098327394478, 'sideways_atr_max_pct': 0.14209951958869635, 'sideways_tp_mult': 2.527775605807291, 'sideways_tsl_mult': 0.6100775947963936, 'sideways_time_stop': 218, 'sideways_use_sma': True, 'sideways_use_ema': False, 'sideways_use_atr': False, 'sideways_use_adx': True, 'sideways_use_spike': False, 'sideways_rsi_required': True}.
[I 2025-08-30 15:54:38,337] Trial 220 finished with values: [-1000000000.0, 1000000000.0] and parameters: {'p_sma': 18, 'p_std': 57, 'p_atr': 25, 'p_adx': 15, 'rsi_period': 24, 'ema1': 17, 'ema2': 59, 'slip_atr_k': 0.1926764778893985, 'slip_spread_k': 0.26072655409312384, 'spread_hl_frac': 0.003260174452550453, 'bb_std_mult': 3.022350397414524, 'rsi_os': 23, 'rsi_ob': 54, 'vol_spike': 0.02661237981845616, 'adx_thresh': 27.490226916295875, 'atr_min_pct': 0.0198947528965615, 'atr_max_pct': 0.07341912986415702, 'tp_mult': 1.215685651911564, 'tsl_mult': 0.20744062564558752, 'strategy': 'breakout', 'time_stop': 32, 'use_sma': True, 'use_atr': True, 'use_adx': False, 'use_ema': False, 'use_spike': True, 'rsi_required': False, 'edge_k': 1.9219572799143532, 'edge_cap': 0.4198845874914587, 'bull_strategy': 'breakout', 'bull_bb_std_mult': 1.8477330483080923, 'bull_rsi_os': 12, 'bull_rsi_ob': 74, 'bull_adx_thresh': 28.823911695621753, 'bull_atr_min_pct': 0.0008030024306393479, 'bull_atr_max_pct': 0.1372478001606887, 'bull_tp_mult': 1.1226824685948529, 'bull_tsl_mult': 0.3210642754869911, 'bull_time_stop': 74, 'bull_use_sma': True, 'bull_use_ema': True, 'bull_use_atr': False, 'bull_use_adx': False, 'bull_use_spike': False, 'bull_rsi_required': True, 'bear_strategy': 'mean_reversion', 'bear_bb_std_mult': 1.9633725896411391, 'bear_rsi_os': 18, 'bear_rsi_ob': 76, 'bear_adx_thresh': 13.534451125954895, 'bear_atr_min_pct': 0.02915059407183463, 'bear_atr_max_pct': 0.09502977340037196, 'bear_tp_mult': 2.3243537947505106, 'bear_tsl_mult': 0.7372262874224036, 'bear_time_stop': 266, 'bear_use_sma': False, 'bear_use_ema': False, 'bear_use_atr': False, 'bear_use_adx': False, 'bear_use_spike': True, 'bear_rsi_required': False, 'sideways_strategy': 'breakout', 'sideways_bb_std_mult': 3.071460040579896, 'sideways_rsi_os': 31, 'sideways_rsi_ob': 93, 'sideways_adx_thresh': 15.367151905530443, 'sideways_atr_min_pct': 0.003719176566424477, 'sideways_atr_max_pct': 0.14258234164779282, 'sideways_tp_mult': 2.083499497207362, 'sideways_tsl_mult': 0.6112625054128932, 'sideways_time_stop': 191, 'sideways_use_sma': True, 'sideways_use_ema': False, 'sideways_use_atr': False, 'sideways_use_adx': True, 'sideways_use_spike': False, 'sideways_rsi_required': True}.
[I 2025-08-30 15:54:39,068] Trial 226 finished with values: [-1000000000.0, 1000000000.0] and parameters: {'p_sma': 16, 'p_std': 57, 'p_atr': 25, 'p_adx': 14, 'rsi_period': 29, 'ema1': 21, 'ema2': 60, 'slip_atr_k': 0.01112552927704396, 'slip_spread_k': 0.3844977977118894, 'spread_hl_frac': 0.01290246849273787, 'bb_std_mult': 2.964931861703014, 'rsi_os': 37, 'rsi_ob': 51, 'vol_spike': 0.026289350409649435, 'adx_thresh': 26.803736796256405, 'atr_min_pct': 0.022577959251171963, 'atr_max_pct': 0.021653560275575266, 'tp_mult': 1.1238327227413507, 'tsl_mult': 0.041481194413228506, 'strategy': 'breakout', 'time_stop': 5, 'use_sma': False, 'use_atr': True, 'use_adx': False, 'use_ema': False, 'use_spike': True, 'rsi_required': False, 'edge_k': 1.926821356927393, 'edge_cap': 0.7380346075076036, 'bull_strategy': 'breakout', 'bull_bb_std_mult': 1.7610502083608683, 'bull_rsi_os': 7, 'bull_rsi_ob': 76, 'bull_adx_thresh': 5.743409929791397, 'bull_atr_min_pct': 0.00042812342369671517, 'bull_atr_max_pct': 0.11442526180785656, 'bull_tp_mult': 1.499202610023484, 'bull_tsl_mult': 0.32744727988892547, 'bull_time_stop': 250, 'bull_use_sma': True, 'bull_use_ema': True, 'bull_use_atr': False, 'bull_use_adx': False, 'bull_use_spike': True, 'bull_rsi_required': True, 'bear_strategy': 'mean_reversion', 'bear_bb_std_mult': 3.57210467529099, 'bear_rsi_os': 17, 'bear_rsi_ob': 77, 'bear_adx_thresh': 14.302748512030927, 'bear_atr_min_pct': 0.028096682956545032, 'bear_atr_max_pct': 0.08709417483966496, 'bear_tp_mult': 2.2644508707863085, 'bear_tsl_mult': 0.5487827210371303, 'bear_time_stop': 275, 'bear_use_sma': False, 'bear_use_ema': True, 'bear_use_atr': False, 'bear_use_adx': False, 'bear_use_spike': True, 'bear_rsi_required': False, 'sideways_strategy': 'breakout', 'sideways_bb_std_mult': 3.5919450146166843, 'sideways_rsi_os': 30, 'sideways_rsi_ob': 91, 'sideways_adx_thresh': 15.641110104586678, 'sideways_atr_min_pct': 0.002100934333820572, 'sideways_atr_max_pct': 0.1493655693864408, 'sideways_tp_mult': 2.42553122542973, 'sideways_tsl_mult': 0.7116169856203878, 'sideways_time_stop': 276, 'sideways_use_sma': True, 'sideways_use_ema': False, 'sideways_use_atr': True, 'sideways_use_adx': True, 'sideways_use_spike': True, 'sideways_rsi_required': True}.
