[I 2025-08-30 16:26:16,080] Trial 405 finished with values: [-1000000000.0, 1000000000.0] and parameters: {'p_sma': 12, 'p_std': 58, 'p_atr': 21, 'p_adx': 20, 'rsi_period': 51, 'ema1': 27, 'ema2': 11, 'slip_atr_k': 0.009185334090645383, 'slip_spread_k': 0.45002012188377893, 'spread_hl_frac': 0.034955632916419364, 'bb_std_mult': 2.3554195391526576, 'rsi_os': 36, 'rsi_ob': 85, 'vol_spike': 0.009756521790254857, 'adx_thresh': 5.213989630294245, 'atr_min_pct': 0.025394865086800368, 'atr_max_pct': 0.1402307272259582, 'tp_mult': 2.376451483474283, 'tsl_mult': 0.23615611767463301, 'strategy': 'mean_reversion', 'time_stop': 285, 'use_sma': False, 'use_atr': True, 'use_adx': True, 'use_ema': False, 'use_spike': False, 'rsi_required': True, 'edge_k': 0.6772672457581437, 'edge_cap': 0.585703626152694, 'bull_strategy': 'mean_reversion', 'bull_bb_std_mult': 1.7345155710123357, 'bull_rsi_os': 12, 'bull_rsi_ob': 54, 'bull_adx_thresh': 5.903899000266881, 'bull_atr_min_pct': 0.01963464711104202, 'bull_atr_max_pct': 0.01013540995232462, 'bull_tp_mult': 1.3268267523178738, 'bull_tsl_mult': 0.3095904353562134, 'bull_time_stop': 88, 'bull_use_sma': False, 'bull_use_ema': True, 'bull_use_atr': True, 'bull_use_adx': True, 'bull_use_spike': False, 'bull_rsi_required': False, 'bear_strategy': 'mean_reversion', 'bear_bb_std_mult': 1.0818339562747643, 'bear_rsi_os': 13, 'bear_rsi_ob': 58, 'bear_adx_thresh': 12.588825389702311, 'bear_atr_min_pct': 0.02181629247235674, 'bear_atr_max_pct': 0.03299865422305519, 'bear_tp_mult': 2.293997062607034, 'bear_tsl_mult': 0.6448951486278989, 'bear_time_stop': 229, 'bear_use_sma': True, 'bear_use_ema': False, 'bear_use_atr': False, 'bear_use_adx': False, 'bear_use_spike': False, 'bear_rsi_required': False, 'sideways_strategy': 'breakout', 'sideways_bb_std_mult': 1.8516874078378653, 'sideways_rsi_os': 19, 'sideways_rsi_ob': 59, 'sideways_adx_thresh': 17.998774867359725, 'sideways_atr_min_pct': 0.017421720612389315, 'sideways_atr_max_pct': 0.06808781343092273, 'sideways_tp_mult': 1.4614562522564334, 'sideways_tsl_mult': 0.5121328780737614, 'sideways_time_stop': 256, 'sideways_use_sma': True, 'sideways_use_ema': False, 'sideways_use_atr': False, 'sideways_use_adx': False, 'sideways_use_spike': False, 'sideways_rsi_required': True}.
[I 2025-08-30 16:26:16,741] Trial 406 finished with values: [-1000000000.0, 1000000000.0] and parameters: {'p_sma': 40, 'p_std': 58, 'p_atr': 24, 'p_adx': 24, 'rsi_period': 24, 'ema1': 8, 'ema2': 18, 'slip_atr_k': 0.13952896283651828, 'slip_spread_k': 0.605667996680856, 'spread_hl_frac': 0.015622018411889668, 'bb_std_mult': 1.4502629341174038, 'rsi_os': 21, 'rsi_ob': 95, 'vol_spike': 0.01079406125280348, 'adx_thresh': 8.879878690207422, 'atr_min_pct': 0.0293622241214003, 'atr_max_pct': 0.13036039493384463, 'tp_mult': 2.3798999938164593, 'tsl_mult': 0.9063914160571342, 'strategy': 'mean_reversion', 'time_stop': 17, 'use_sma': False, 'use_atr': True, 'use_adx': True, 'use_ema': False, 'use_spike': False, 'rsi_required': True, 'edge_k': 1.364104467754017, 'edge_cap': 0.58834954016715, 'bull_strategy': 'mean_reversion', 'bull_bb_std_mult': 1.73605553584926, 'bull_rsi_os': 8, 'bull_rsi_ob': 50, 'bull_adx_thresh': 15.543451097287669, 'bull_atr_min_pct': 0.00884684033547525, 'bull_atr_max_pct': 0.13555023942162014, 'bull_tp_mult': 1.3260117052058458, 'bull_tsl_mult': 0.4770547749711847, 'bull_time_stop': 69, 'bull_use_sma': False, 'bull_use_ema': True, 'bull_use_atr': True, 'bull_use_adx': True, 'bull_use_spike': False, 'bull_rsi_required': False, 'bear_strategy': 'mean_reversion', 'bear_bb_std_mult': 0.7233727233032368, 'bear_rsi_os': 36, 'bear_rsi_ob': 85, 'bear_adx_thresh': 12.604891877840805, 'bear_atr_min_pct': 0.002371387794531483, 'bear_atr_max_pct': 0.10326489740140188, 'bear_tp_mult': 2.257602929119226, 'bear_tsl_mult': 0.6928048730476324, 'bear_time_stop': 230, 'bear_use_sma': True, 'bear_use_ema': True, 'bear_use_atr': True, 'bear_use_adx': False, 'bear_use_spike': False, 'bear_rsi_required': False, 'sideways_strategy': 'breakout', 'sideways_bb_std_mult': 0.8707562615481113, 'sideways_rsi_os': 27, 'sideways_rsi_ob': 91, 'sideways_adx_thresh': 24.574551383564504, 'sideways_atr_min_pct': 0.0209893327838574, 'sideways_atr_max_pct': 0.13555743063141135, 'sideways_tp_mult': 2.083292075590609, 'sideways_tsl_mult': 0.4957577769237921, 'sideways_time_stop': 258, 'sideways_use_sma': True, 'sideways_use_ema': False, 'sideways_use_atr': False, 'sideways_use_adx': False, 'sideways_use_spike': False, 'sideways_rsi_required': False}.
[I 2025-08-30 16:26:17,231] Trial 407 finished with values: [-1000000000.0, 1000000000.0] and parameters: {'p_sma': 31, 'p_std': 58, 'p_atr': 21, 'p_adx': 24, 'rsi_period': 21, 'ema1': 25, 'ema2': 10, 'slip_atr_k': 0.005090671369624699, 'slip_spread_k': 0.6033344571911922, 'spread_hl_frac': 0.01658710144576459, 'bb_std_mult': 1.441981053396134, 'rsi_os': 43, 'rsi_ob': 89, 'vol_spike': 0.01133411397954175, 'adx_thresh': 12.525587238261961, 'atr_min_pct': 0.017896298439784814, 'atr_max_pct': 0.07950028824728024, 'tp_mult': 2.879066944168145, 'tsl_mult': 0.207785145800351, 'strategy': 'mean_reversion', 'time_stop': 17, 'use_sma': False, 'use_atr': False, 'use_adx': True, 'use_ema': False, 'use_spike': False, 'rsi_required': True, 'edge_k': 1.3710746553833373, 'edge_cap': 0.6822561479205742, 'bull_strategy': 'mean_reversion', 'bull_bb_std_mult': 1.0720220129384026, 'bull_rsi_os': 10, 'bull_rsi_ob': 50, 'bull_adx_thresh': 20.785036560018874, 'bull_atr_min_pct': 0.009442791009505024, 'bull_atr_max_pct': 0.14236277269278452, 'bull_tp_mult': 1.3306982929505606, 'bull_tsl_mult': 0.6446300529120728, 'bull_time_stop': 73, 'bull_use_sma': False, 'bull_use_ema': False, 'bull_use_atr': True, 'bull_use_adx': True, 'bull_use_spike': True, 'bull_rsi_required': False, 'bear_strategy': 'mean_reversion', 'bear_bb_std_mult': 1.973420964450478, 'bear_rsi_os': 14, 'bear_rsi_ob': 77, 'bear_adx_thresh': 14.819122707883738, 'bear_atr_min_pct': 0.02183727178225168, 'bear_atr_max_pct': 0.09354920571072718, 'bear_tp_mult': 1.24876251029412, 'bear_tsl_mult': 0.6066069575843152, 'bear_time_stop': 230, 'bear_use_sma': True, 'bear_use_ema': True, 'bear_use_atr': True, 'bear_use_adx': False, 'bear_use_spike': False, 'bear_rsi_required': False, 'sideways_strategy': 'mean_reversion', 'sideways_bb_std_mult': 2.181504273496661, 'sideways_rsi_os': 27, 'sideways_rsi_ob': 92, 'sideways_adx_thresh': 17.559346647505276, 'sideways_atr_min_pct': 0.004127304318681276, 'sideways_atr_max_pct': 0.0529578910808891, 'sideways_tp_mult': 1.8347470737545128, 'sideways_tsl_mult': 0.6034723323657296, 'sideways_time_stop': 282, 'sideways_use_sma': True, 'sideways_use_ema': False, 'sideways_use_atr': False, 'sideways_use_adx': False, 'sideways_use_spike': True, 'sideways_rsi_required': False}.
[I 2025-08-30 16:26:17,233] Trial 408 finished with values: [-1000000000.0, 1000000000.0] and parameters: {'p_sma': 7, 'p_std': 44, 'p_atr': 25, 'p_adx': 24, 'rsi_period': 79, 'ema1': 25, 'ema2': 11, 'slip_atr_k': 0.1642244543096539, 'slip_spread_k': 0.6868387091874402, 'spread_hl_frac': 0.039355016519061245, 'bb_std_mult': 2.1373233345643157, 'rsi_os': 34, 'rsi_ob': 60, 'vol_spike': 0.007760030058750046, 'adx_thresh': 9.037579393216987, 'atr_min_pct': 0.020334590866053482, 'atr_max_pct': 0.13027289598806577, 'tp_mult': 1.5751695818167772, 'tsl_mult': 0.6965792571170588, 'strategy': 'mean_reversion', 'time_stop': 15, 'use_sma': False, 'use_atr': False, 'use_adx': True, 'use_ema': False, 'use_spike': False, 'rsi_required': True, 'edge_k': 1.3924699091880548, 'edge_cap': 0.6920626001186874, 'bull_strategy': 'mean_reversion', 'bull_bb_std_mult': 1.082292568130053, 'bull_rsi_os': 10, 'bull_rsi_ob': 54, 'bull_adx_thresh': 18.775203990628757, 'bull_atr_min_pct': 0.009147023807126616, 'bull_atr_max_pct': 0.14422040719472295, 'bull_tp_mult': 1.3399890058681467, 'bull_tsl_mult': 0.30405322914883304, 'bull_time_stop': 74, 'bull_use_sma': False, 'bull_use_ema': False, 'bull_use_atr': True, 'bull_use_adx': True, 'bull_use_spike': True, 'bull_rsi_required': False, 'bear_strategy': 'mean_reversion', 'bear_bb_std_mult': 1.7008749890762556, 'bear_rsi_os': 26, 'bear_rsi_ob': 77, 'bear_adx_thresh': 11.960201948452138, 'bear_atr_min_pct': 0.020770404595186226, 'bear_atr_max_pct': 0.10353011691090262, 'bear_tp_mult': 1.0616296048425355, 'bear_tsl_mult': 0.6989836439530287, 'bear_time_stop': 247, 'bear_use_sma': True, 'bear_use_ema': True, 'bear_use_atr': True, 'bear_use_adx': False, 'bear_use_spike': False, 'bear_rsi_required': False, 'sideways_strategy': 'mean_reversion', 'sideways_bb_std_mult': 1.8358446582203236, 'sideways_rsi_os': 34, 'sideways_rsi_ob': 91, 'sideways_adx_thresh': 17.43504989523287, 'sideways_atr_min_pct': 0.0016863095739235254, 'sideways_atr_max_pct': 0.14391518674313988, 'sideways_tp_mult': 2.1822795613570407, 'sideways_tsl_mult': 0.6028959680806628, 'sideways_time_stop': 77, 'sideways_use_sma': True, 'sideways_use_ema': False, 'sideways_use_atr': False, 'sideways_use_adx': False, 'sideways_use_spike': True, 'sideways_rsi_required': False}.
[I 2025-08-30 16:26:18,053] Trial 412 finished with values: [-1000000000.0, 1000000000.0] and parameters: {'p_sma': 8, 'p_std': 16, 'p_atr': 27, 'p_adx': 25, 'rsi_period': 21, 'ema1': 24, 'ema2': 39, 'slip_atr_k': 0.016353749052961407, 'slip_spread_k': 0.622399851474617, 'spread_hl_frac': 0.022954423568325295, 'bb_std_mult': 1.6285887893149897, 'rsi_os': 31, 'rsi_ob': 48, 'vol_spike': 0.07611079814476192, 'adx_thresh': 13.49078683204963, 'atr_min_pct': 0.02385712955507304, 'atr_max_pct': 0.1359981863213026, 'tp_mult': 2.7908595301781207, 'tsl_mult': 0.7397425739160244, 'strategy': 'mean_reversion', 'time_stop': 154, 'use_sma': False, 'use_atr': True, 'use_adx': True, 'use_ema': True, 'use_spike': False, 'rsi_required': True, 'edge_k': 1.4809436052566343, 'edge_cap': 0.5002334451244341, 'bull_strategy': 'mean_reversion', 'bull_bb_std_mult': 1.9822956197964874, 'bull_rsi_os': 6, 'bull_rsi_ob': 60, 'bull_adx_thresh': 22.28772467404942, 'bull_atr_min_pct': 0.0037704484656811855, 'bull_atr_max_pct': 0.12875111007295656, 'bull_tp_mult': 2.027626907213501, 'bull_tsl_mult': 0.2735585389600686, 'bull_time_stop': 170, 'bull_use_sma': False, 'bull_use_ema': True, 'bull_use_atr': True, 'bull_use_adx': True, 'bull_use_spike': False, 'bull_rsi_required': False, 'bear_strategy': 'breakout', 'bear_bb_std_mult': 2.1914548492878656, 'bear_rsi_os': 8, 'bear_rsi_ob': 75, 'bear_adx_thresh': 28.844912752054697, 'bear_atr_min_pct': 0.020295267352021154, 'bear_atr_max_pct': 0.07611201258365108, 'bear_tp_mult': 2.7388226906135245, 'bear_tsl_mult': 0.6713098590905152, 'bear_time_stop': 210, 'bear_use_sma': True, 'bear_use_ema': False, 'bear_use_atr': False, 'bear_use_adx': False, 'bear_use_spike': False, 'bear_rsi_required': True, 'sideways_strategy': 'breakout', 'sideways_bb_std_mult': 2.1032171661792276, 'sideways_rsi_os': 24, 'sideways_rsi_ob': 93, 'sideways_adx_thresh': 28.740478086303163, 'sideways_atr_min_pct': 0.0027786044268076245, 'sideways_atr_max_pct': 0.14180129655921164, 'sideways_tp_mult': 1.3694671404665328, 'sideways_tsl_mult': 0.45646132739748424, 'sideways_time_stop': 226, 'sideways_use_sma': False, 'sideways_use_ema': True, 'sideways_use_atr': True, 'sideways_use_adx': False, 'sideways_use_spike': False, 'sideways_rsi_required': True}.
[I 2025-08-30 16:27:02,664] Trial 409 finished with values: [-1000000000.0, 1000000000.0] and parameters: {'p_sma': 7, 'p_std': 12, 'p_atr': 25, 'p_adx': 24, 'rsi_period': 21, 'ema1': 8, 'ema2': 39, 'slip_atr_k': 0.1833949914405316, 'slip_spread_k': 0.31945044383905796, 'spread_hl_frac': 0.039594304719910586, 'bb_std_mult': 3.0540699564373863, 'rsi_os': 31, 'rsi_ob': 89, 'vol_spike': 0.05349460486117974, 'adx_thresh': 8.007206018358866, 'atr_min_pct': 0.02029960134949659, 'atr_max_pct': 0.13522703768671965, 'tp_mult': 1.5574961590769205, 'tsl_mult': 0.5024273996671077, 'strategy': 'mean_reversion', 'time_stop': 16, 'use_sma': False, 'use_atr': False, 'use_adx': True, 'use_ema': False, 'use_spike': False, 'rsi_required': True, 'edge_k': 1.3932460798862736, 'edge_cap': 0.6841935708437065, 'bull_strategy': 'mean_reversion', 'bull_bb_std_mult': 1.0848661731251346, 'bull_rsi_os': 10, 'bull_rsi_ob': 50, 'bull_adx_thresh': 22.573069417933233, 'bull_atr_min_pct': 0.021738247455977147, 'bull_atr_max_pct': 0.12959631534397686, 'bull_tp_mult': 1.429196485997633, 'bull_tsl_mult': 0.6472247950548145, 'bull_time_stop': 73, 'bull_use_sma': False, 'bull_use_ema': False, 'bull_use_atr': True, 'bull_use_adx': True, 'bull_use_spike': True, 'bull_rsi_required': False, 'bear_strategy': 'mean_reversion', 'bear_bb_std_mult': 1.9469359244649838, 'bear_rsi_os': 30, 'bear_rsi_ob': 77, 'bear_adx_thresh': 28.910032172830583, 'bear_atr_min_pct': 0.020682804727991548, 'bear_atr_max_pct': 0.0928952581112831, 'bear_tp_mult': 2.246853352548414, 'bear_tsl_mult': 0.6935527615930204, 'bear_time_stop': 232, 'bear_use_sma': True, 'bear_use_ema': True, 'bear_use_atr': True, 'bear_use_adx': False, 'bear_use_spike': False, 'bear_rsi_required': False, 'sideways_strategy': 'mean_reversion', 'sideways_bb_std_mult': 2.162631366327907, 'sideways_rsi_os': 27, 'sideways_rsi_ob': 92, 'sideways_adx_thresh': 15.970582974545225, 'sideways_atr_min_pct': 0.002820453078426085, 'sideways_atr_max_pct': 0.1440713999000137, 'sideways_tp_mult': 1.5039002989036057, 'sideways_tsl_mult': 0.4523781791717648, 'sideways_time_stop': 227, 'sideways_use_sma': False, 'sideways_use_ema': False, 'sideways_use_atr': False, 'sideways_use_adx': False, 'sideways_use_spike': True, 'sideways_rsi_required': False}.
[I 2025-08-30 16:27:03,205] Trial 413 finished with values: [-0.009236752016010152, 0.010396115853466665] and parameters: {'p_sma': 10, 'p_std': 56, 'p_atr': 25, 'p_adx': 26, 'rsi_period': 20, 'ema1': 26, 'ema2': 42, 'slip_atr_k': 0.020166194499826602, 'slip_spread_k': 0.3268821281172477, 'spread_hl_frac': 0.009863584555566896, 'bb_std_mult': 2.9581843678748254, 'rsi_os': 33, 'rsi_ob': 89, 'vol_spike': 0.005229597181229651, 'adx_thresh': 8.14428267720159, 'atr_min_pct': 0.01915346441033145, 'atr_max_pct': 0.04210305918895456, 'tp_mult': 2.5454120761811656, 'tsl_mult': 0.5099743335048288, 'strategy': 'mean_reversion', 'time_stop': 10, 'use_sma': False, 'use_atr': True, 'use_adx': True, 'use_ema': False, 'use_spike': False, 'rsi_required': True, 'edge_k': 0.013038461149133318, 'edge_cap': 0.9724914514866767, 'bull_strategy': 'mean_reversion', 'bull_bb_std_mult': 1.8821519761120147, 'bull_rsi_os': 30, 'bull_rsi_ob': 51, 'bull_adx_thresh': 7.636181142914928, 'bull_atr_min_pct': 0.020971547677223822, 'bull_atr_max_pct': 0.13233238633583205, 'bull_tp_mult': 2.358818723956321, 'bull_tsl_mult': 0.10523030607148587, 'bull_time_stop': 56, 'bull_use_sma': False, 'bull_use_ema': True, 'bull_use_atr': True, 'bull_use_adx': True, 'bull_use_spike': False, 'bull_rsi_required': False, 'bear_strategy': 'mean_reversion', 'bear_bb_std_mult': 3.433969486858385, 'bear_rsi_os': 39, 'bear_rsi_ob': 50, 'bear_adx_thresh': 14.559593106132033, 'bear_atr_min_pct': 0.018381934125700824, 'bear_atr_max_pct': 0.07999615975010659, 'bear_tp_mult': 2.129631016583188, 'bear_tsl_mult': 0.6098512634646961, 'bear_time_stop': 193, 'bear_use_sma': True, 'bear_use_ema': False, 'bear_use_atr': False, 'bear_use_adx': False, 'bear_use_spike': False, 'bear_rsi_required': False, 'sideways_strategy': 'breakout', 'sideways_bb_std_mult': 2.0352937503499735, 'sideways_rsi_os': 29, 'sideways_rsi_ob': 62, 'sideways_adx_thresh': 11.809624015090456, 'sideways_atr_min_pct': 0.0017101524127751935, 'sideways_atr_max_pct': 0.06300180721566848, 'sideways_tp_mult': 1.5047182715833127, 'sideways_tsl_mult': 0.564830364276347, 'sideways_time_stop': 218, 'sideways_use_sma': False, 'sideways_use_ema': False, 'sideways_use_atr': False, 'sideways_use_adx': False, 'sideways_use_spike': False, 'sideways_rsi_required': True}.
[I 2025-08-30 16:27:03,868] Trial 410 finished with values: [-1000000000.0, 1000000000.0] and parameters: {'p_sma': 8, 'p_std': 12, 'p_atr': 25, 'p_adx': 26, 'rsi_period': 46, 'ema1': 10, 'ema2': 42, 'slip_atr_k': 0.004331699246338828, 'slip_spread_k': 0.6876339205655211, 'spread_hl_frac': 0.017425392141836055, 'bb_std_mult': 1.5705184257698608, 'rsi_os': 33, 'rsi_ob': 89, 'vol_spike': 0.08037430045142319, 'adx_thresh': 13.484695691396862, 'atr_min_pct': 0.018549728437066367, 'atr_max_pct': 0.031474216563220206, 'tp_mult': 2.8764087465039054, 'tsl_mult': 0.5119230603424165, 'strategy': 'mean_reversion', 'time_stop': 99, 'use_sma': False, 'use_atr': False, 'use_adx': True, 'use_ema': True, 'use_spike': False, 'rsi_required': True, 'edge_k': 1.4980452140618818, 'edge_cap': 0.6860067761290978, 'bull_strategy': 'mean_reversion', 'bull_bb_std_mult': 1.0289790938189376, 'bull_rsi_os': 10, 'bull_rsi_ob': 64, 'bull_adx_thresh': 19.049344403203047, 'bull_atr_min_pct': 0.021992900653773895, 'bull_atr_max_pct': 0.14338311647337537, 'bull_tp_mult': 1.431698505298659, 'bull_tsl_mult': 0.2997093056921458, 'bull_time_stop': 75, 'bull_use_sma': False, 'bull_use_ema': False, 'bull_use_atr': True, 'bull_use_adx': True, 'bull_use_spike': True, 'bull_rsi_required': False, 'bear_strategy': 'breakout', 'bear_bb_std_mult': 2.8118273088989616, 'bear_rsi_os': 14, 'bear_rsi_ob': 77, 'bear_adx_thresh': 14.600921914397581, 'bear_atr_min_pct': 0.020734731170198722, 'bear_atr_max_pct': 0.09325902192090171, 'bear_tp_mult': 2.2145181362531168, 'bear_tsl_mult': 0.669624721333673, 'bear_time_stop': 208, 'bear_use_sma': True, 'bear_use_ema': True, 'bear_use_atr': True, 'bear_use_adx': False, 'bear_use_spike': False, 'bear_rsi_required': False, 'sideways_strategy': 'mean_reversion', 'sideways_bb_std_mult': 2.1692058096254536, 'sideways_rsi_os': 27, 'sideways_rsi_ob': 62, 'sideways_adx_thresh': 16.02416074843557, 'sideways_atr_min_pct': 0.0016374961563677282, 'sideways_atr_max_pct': 0.14444068647094982, 'sideways_tp_mult': 1.8373377957734365, 'sideways_tsl_mult': 0.6033556642871036, 'sideways_time_stop': 218, 'sideways_use_sma': False, 'sideways_use_ema': True, 'sideways_use_atr': False, 'sideways_use_adx': False, 'sideways_use_spike': True, 'sideways_rsi_required': False}.
[I 2025-08-30 16:27:04,541] Trial 411 finished with values: [-1000000000.0, 1000000000.0] and parameters: {'p_sma': 7, 'p_std': 56, 'p_atr': 25, 'p_adx': 26, 'rsi_period': 79, 'ema1': 24, 'ema2': 40, 'slip_atr_k': 0.20206277890830054, 'slip_spread_k': 0.32020147278477523, 'spread_hl_frac': 0.009731481655280958, 'bb_std_mult': 1.6173739746237055, 'rsi_os': 31, 'rsi_ob': 60, 'vol_spike': 0.005078855635633067, 'adx_thresh': 13.614024159737324, 'atr_min_pct': 0.019316356350743708, 'atr_max_pct': 0.1349667948916778, 'tp_mult': 2.7016390023169965, 'tsl_mult': 0.43910333160294823, 'strategy': 'mean_reversion', 'time_stop': 9, 'use_sma': False, 'use_atr': False, 'use_adx': True, 'use_ema': True, 'use_spike': False, 'rsi_required': True, 'edge_k': 1.675765067594027, 'edge_cap': 0.9666343658445313, 'bull_strategy': 'mean_reversion', 'bull_bb_std_mult': 1.9543558118206876, 'bull_rsi_os': 9, 'bull_rsi_ob': 56, 'bull_adx_thresh': 18.657619675650928, 'bull_atr_min_pct': 0.021694778403827185, 'bull_atr_max_pct': 0.127350869517711, 'bull_tp_mult': 1.4376350468697892, 'bull_tsl_mult': 0.30084394951514987, 'bull_time_stop': 174, 'bull_use_sma': False, 'bull_use_ema': False, 'bull_use_atr': True, 'bull_use_adx': True, 'bull_use_spike': True, 'bull_rsi_required': False, 'bear_strategy': 'breakout', 'bear_bb_std_mult': 2.7976551350457783, 'bear_rsi_os': 49, 'bear_rsi_ob': 76, 'bear_adx_thresh': 21.381592417261963, 'bear_atr_min_pct': 0.017544131347638343, 'bear_atr_max_pct': 0.08345858209340529, 'bear_tp_mult': 2.7324424849112714, 'bear_tsl_mult': 0.6992323680829579, 'bear_time_stop': 248, 'bear_use_sma': True, 'bear_use_ema': False, 'bear_use_atr': False, 'bear_use_adx': False, 'bear_use_spike': False, 'bear_rsi_required': False, 'sideways_strategy': 'mean_reversion', 'sideways_bb_std_mult': 2.1132990841034696, 'sideways_rsi_os': 48, 'sideways_rsi_ob': 73, 'sideways_adx_thresh': 17.078589982031357, 'sideways_atr_min_pct': 0.0018085723651096524, 'sideways_atr_max_pct': 0.0772285538761715, 'sideways_tp_mult': 2.1625468149340796, 'sideways_tsl_mult': 0.45180671318005816, 'sideways_time_stop': 186, 'sideways_use_sma': False, 'sideways_use_ema': True, 'sideways_use_atr': False, 'sideways_use_adx': False, 'sideways_use_spike': True, 'sideways_rsi_required': True}.
