[I 2025-08-30 16:01:08,713] Trial 259 finished with values: [-1000000000.0, 1000000000.0] and parameters: {'p_sma': 17, 'p_std': 56, 'p_atr': 24, 'p_adx': 15, 'rsi_period': 63, 'ema1': 25, 'ema2': 59, 'slip_atr_k': 0.010251886117490852, 'slip_spread_k': 0.49358447551789597, 'spread_hl_frac': 0.04630688013405512, 'bb_std_mult': 3.0621491648299166, 'rsi_os': 21, 'rsi_ob': 53, 'vol_spike': 0.01132808813168373, 'adx_thresh': 28.062199735927212, 'atr_min_pct': 0.020400789510475588, 'atr_max_pct': 0.1355574638359008, 'tp_mult': 2.6612073936433625, 'tsl_mult': 0.08234246193424194, 'strategy': 'breakout', 'time_stop': 58, 'use_sma': True, 'use_atr': True, 'use_adx': False, 'use_ema': True, 'use_spike': True, 'rsi_required': False, 'edge_k': 1.9880836192086586, 'edge_cap': 0.6553314393226276, 'bull_strategy': 'breakout', 'bull_bb_std_mult': 2.849378406757216, 'bull_rsi_os': 9, 'bull_rsi_ob': 59, 'bull_adx_thresh': 30.48897184307541, 'bull_atr_min_pct': 0.0013385533911936115, 'bull_atr_max_pct': 0.11348098150788266, 'bull_tp_mult': 1.5963788196868882, 'bull_tsl_mult': 0.39085943418318075, 'bull_time_stop': 63, 'bull_use_sma': True, 'bull_use_ema': True, 'bull_use_atr': False, 'bull_use_adx': False, 'bull_use_spike': False, 'bull_rsi_required': False, 'bear_strategy': 'breakout', 'bear_bb_std_mult': 2.1101064346104175, 'bear_rsi_os': 18, 'bear_rsi_ob': 52, 'bear_adx_thresh': 16.552170990701295, 'bear_atr_min_pct': 0.003324645851546985, 'bear_atr_max_pct': 0.08167179784972918, 'bear_tp_mult': 2.291605548697683, 'bear_tsl_mult': 0.4395936715999616, 'bear_time_stop': 255, 'bear_use_sma': False, 'bear_use_ema': False, 'bear_use_atr': False, 'bear_use_adx': True, 'bear_use_spike': True, 'bear_rsi_required': True, 'sideways_strategy': 'breakout', 'sideways_bb_std_mult': 3.1842574184060197, 'sideways_rsi_os': 33, 'sideways_rsi_ob': 72, 'sideways_adx_thresh': 14.095269725809574, 'sideways_atr_min_pct': 0.0018090770150163546, 'sideways_atr_max_pct': 0.1429793959649128, 'sideways_tp_mult': 2.6142135920798366, 'sideways_tsl_mult': 0.276046898663296, 'sideways_time_stop': 220, 'sideways_use_sma': True, 'sideways_use_ema': False, 'sideways_use_atr': False, 'sideways_use_adx': True, 'sideways_use_spike': False, 'sideways_rsi_required': True}.
[I 2025-08-30 16:01:55,563] Trial 264 finished with values: [-1000000000.0, 1000000000.0] and parameters: {'p_sma': 18, 'p_std': 54, 'p_atr': 25, 'p_adx': 14, 'rsi_period': 32, 'ema1': 25, 'ema2': 18, 'slip_atr_k': 0.09203724272352902, 'slip_spread_k': 0.024734575497446135, 'spread_hl_frac': 0.048073069683872746, 'bb_std_mult': 2.575300798021101, 'rsi_os': 25, 'rsi_ob': 50, 'vol_spike': 0.15411862183495917, 'adx_thresh': 30.038578629770573, 'atr_min_pct': 0.02185772317835784, 'atr_max_pct': 0.13738440373448968, 'tp_mult': 2.66184044914195, 'tsl_mult': 0.4951132946001202, 'strategy': 'breakout', 'time_stop': 160, 'use_sma': False, 'use_atr': True, 'use_adx': False, 'use_ema': True, 'use_spike': True, 'rsi_required': False, 'edge_k': 1.2769049160347572, 'edge_cap': 0.278216298076737, 'bull_strategy': 'breakout', 'bull_bb_std_mult': 1.2157937799430045, 'bull_rsi_os': 14, 'bull_rsi_ob': 78, 'bull_adx_thresh': 31.47516764015833, 'bull_atr_min_pct': 0.027163060498054493, 'bull_atr_max_pct': 0.11290048998644647, 'bull_tp_mult': 1.4641767012368296, 'bull_tsl_mult': 0.3189694984520465, 'bull_time_stop': 148, 'bull_use_sma': True, 'bull_use_ema': True, 'bull_use_atr': False, 'bull_use_adx': False, 'bull_use_spike': False, 'bull_rsi_required': False, 'bear_strategy': 'breakout', 'bear_bb_std_mult': 2.141042747035066, 'bear_rsi_os': 17, 'bear_rsi_ob': 58, 'bear_adx_thresh': 14.949519275854952, 'bear_atr_min_pct': 0.028867818870647245, 'bear_atr_max_pct': 0.06517145961203483, 'bear_tp_mult': 2.2994477666085302, 'bear_tsl_mult': 0.3015151197683599, 'bear_time_stop': 254, 'bear_use_sma': False, 'bear_use_ema': True, 'bear_use_atr': False, 'bear_use_adx': False, 'bear_use_spike': True, 'bear_rsi_required': False, 'sideways_strategy': 'mean_reversion', 'sideways_bb_std_mult': 2.585003220626263, 'sideways_rsi_os': 23, 'sideways_rsi_ob': 90, 'sideways_adx_thresh': 15.625104702531088, 'sideways_atr_min_pct': 0.0016839775149314722, 'sideways_atr_max_pct': 0.14384209984129612, 'sideways_tp_mult': 2.6436833207769475, 'sideways_tsl_mult': 0.7196668098568784, 'sideways_time_stop': 219, 'sideways_use_sma': True, 'sideways_use_ema': False, 'sideways_use_atr': False, 'sideways_use_adx': True, 'sideways_use_spike': False, 'sideways_rsi_required': True}.
[I 2025-08-30 16:01:57,086] Trial 263 finished with values: [-1000000000.0, 1000000000.0] and parameters: {'p_sma': 18, 'p_std': 28, 'p_atr': 14, 'p_adx': 15, 'rsi_period': 47, 'ema1': 25, 'ema2': 10, 'slip_atr_k': 0.20057284846921622, 'slip_spread_k': 0.02143620087345982, 'spread_hl_frac': 0.026658398476917446, 'bb_std_mult': 3.019033094949094, 'rsi_os': 40, 'rsi_ob': 45, 'vol_spike': 0.011665048231393705, 'adx_thresh': 27.93635615874587, 'atr_min_pct': 0.022251753535968782, 'atr_max_pct': 0.06703056281282126, 'tp_mult': 1.1377150385688433, 'tsl_mult': 0.4943786963364066, 'strategy': 'breakout', 'time_stop': 20, 'use_sma': False, 'use_atr': True, 'use_adx': False, 'use_ema': False, 'use_spike': True, 'rsi_required': False, 'edge_k': 1.04174661178989, 'edge_cap': 0.5885894682502141, 'bull_strategy': 'breakout', 'bull_bb_std_mult': 1.7498847839427254, 'bull_rsi_os': 49, 'bull_rsi_ob': 66, 'bull_adx_thresh': 31.462631175251097, 'bull_atr_min_pct': 0.007564934860013131, 'bull_atr_max_pct': 0.09717076922810468, 'bull_tp_mult': 1.5516336056420674, 'bull_tsl_mult': 0.32233761650991277, 'bull_time_stop': 200, 'bull_use_sma': True, 'bull_use_ema': True, 'bull_use_atr': False, 'bull_use_adx': False, 'bull_use_spike': True, 'bull_rsi_required': False, 'bear_strategy': 'mean_reversion', 'bear_bb_std_mult': 2.1697185928880414, 'bear_rsi_os': 16, 'bear_rsi_ob': 72, 'bear_adx_thresh': 16.428814849135406, 'bear_atr_min_pct': 0.015806036427535877, 'bear_atr_max_pct': 0.09730936802388665, 'bear_tp_mult': 2.314032959891979, 'bear_tsl_mult': 0.45921350550230083, 'bear_time_stop': 259, 'bear_use_sma': False, 'bear_use_ema': True, 'bear_use_atr': False, 'bear_use_adx': False, 'bear_use_spike': True, 'bear_rsi_required': False, 'sideways_strategy': 'breakout', 'sideways_bb_std_mult': 2.970733752127364, 'sideways_rsi_os': 31, 'sideways_rsi_ob': 52, 'sideways_adx_thresh': 7.906757049077868, 'sideways_atr_min_pct': 0.0008051954401348414, 'sideways_atr_max_pct': 0.10932929383131695, 'sideways_tp_mult': 2.5206883566058194, 'sideways_tsl_mult': 0.26888735194607777, 'sideways_time_stop': 219, 'sideways_use_sma': True, 'sideways_use_ema': False, 'sideways_use_atr': True, 'sideways_use_adx': True, 'sideways_use_spike': True, 'sideways_rsi_required': True}.
[I 2025-08-30 16:01:57,499] Trial 262 finished with values: [-0.03309330570991531, 0.032975840626510065] and parameters: {'p_sma': 17, 'p_std': 47, 'p_atr': 25, 'p_adx': 15, 'rsi_period': 11, 'ema1': 25, 'ema2': 57, 'slip_atr_k': 0.24825334458793893, 'slip_spread_k': 0.021428057644213364, 'spread_hl_frac': 0.00969537630603362, 'bb_std_mult': 2.6067741614696525, 'rsi_os': 40, 'rsi_ob': 51, 'vol_spike': 0.1542107872921088, 'adx_thresh': 27.97191445358761, 'atr_min_pct': 0.021620004476654714, 'atr_max_pct': 0.14916151553893817, 'tp_mult': 1.147739899774572, 'tsl_mult': 0.49297840127548764, 'strategy': 'breakout', 'time_stop': 160, 'use_sma': False, 'use_atr': True, 'use_adx': False, 'use_ema': False, 'use_spike': True, 'rsi_required': False, 'edge_k': 1.9977920339394093, 'edge_cap': 0.5957011966137412, 'bull_strategy': 'breakout', 'bull_bb_std_mult': 1.7489342106977857, 'bull_rsi_os': 9, 'bull_rsi_ob': 59, 'bull_adx_thresh': 30.284746542242495, 'bull_atr_min_pct': 0.026868644599244262, 'bull_atr_max_pct': 0.11412101446990042, 'bull_tp_mult': 1.594040897636302, 'bull_tsl_mult': 0.8688285417408054, 'bull_time_stop': 218, 'bull_use_sma': True, 'bull_use_ema': True, 'bull_use_atr': False, 'bull_use_adx': False, 'bull_use_spike': True, 'bull_rsi_required': True, 'bear_strategy': 'mean_reversion', 'bear_bb_std_mult': 2.130241149220763, 'bear_rsi_os': 16, 'bear_rsi_ob': 52, 'bear_adx_thresh': 14.039221262261927, 'bear_atr_min_pct': 0.0190982395685036, 'bear_atr_max_pct': 0.08381947613674257, 'bear_tp_mult': 1.1140946490228694, 'bear_tsl_mult': 0.377118564422725, 'bear_time_stop': 139, 'bear_use_sma': False, 'bear_use_ema': True, 'bear_use_atr': False, 'bear_use_adx': False, 'bear_use_spike': True, 'bear_rsi_required': False, 'sideways_strategy': 'breakout', 'sideways_bb_std_mult': 2.591701320190372, 'sideways_rsi_os': 22, 'sideways_rsi_ob': 90, 'sideways_adx_thresh': 7.355926031576445, 'sideways_atr_min_pct': 0.0017539826815485798, 'sideways_atr_max_pct': 0.1415282198537462, 'sideways_tp_mult': 2.495769850508639, 'sideways_tsl_mult': 0.28578968455557874, 'sideways_time_stop': 220, 'sideways_use_sma': True, 'sideways_use_ema': False, 'sideways_use_atr': True, 'sideways_use_adx': True, 'sideways_use_spike': True, 'sideways_rsi_required': True}.
[I 2025-08-30 16:01:57,499] Trial 265 finished with values: [-1000000000.0, 1000000000.0] and parameters: {'p_sma': 45, 'p_std': 58, 'p_atr': 14, 'p_adx': 14, 'rsi_period': 55, 'ema1': 26, 'ema2': 60, 'slip_atr_k': 0.021230752669098206, 'slip_spread_k': 0.7879018464680776, 'spread_hl_frac': 0.015722267962478165, 'bb_std_mult': 2.355053656729175, 'rsi_os': 40, 'rsi_ob': 50, 'vol_spike': 0.06089303456291377, 'adx_thresh': 27.231115768172828, 'atr_min_pct': 0.02166706802061394, 'atr_max_pct': 0.14269587008288595, 'tp_mult': 1.2419309045683504, 'tsl_mult': 0.48547546345490333, 'strategy': 'breakout', 'time_stop': 19, 'use_sma': False, 'use_atr': True, 'use_adx': False, 'use_ema': False, 'use_spike': True, 'rsi_required': False, 'edge_k': 1.9397258197809284, 'edge_cap': 0.5865892769029629, 'bull_strategy': 'breakout', 'bull_bb_std_mult': 1.8123649676431712, 'bull_rsi_os': 14, 'bull_rsi_ob': 77, 'bull_adx_thresh': 31.410995741256336, 'bull_atr_min_pct': 0.007581809594750017, 'bull_atr_max_pct': 0.12465552544745798, 'bull_tp_mult': 1.5497691882890605, 'bull_tsl_mult': 0.570491235027834, 'bull_time_stop': 45, 'bull_use_sma': True, 'bull_use_ema': True, 'bull_use_atr': False, 'bull_use_adx': False, 'bull_use_spike': True, 'bull_rsi_required': True, 'bear_strategy': 'mean_reversion', 'bear_bb_std_mult': 2.1825878392433684, 'bear_rsi_os': 17, 'bear_rsi_ob': 58, 'bear_adx_thresh': 29.39963264672423, 'bear_atr_min_pct': 0.0072351332697959845, 'bear_atr_max_pct': 0.08717894636949915, 'bear_tp_mult': 1.1918879695964435, 'bear_tsl_mult': 0.5499453020102775, 'bear_time_stop': 277, 'bear_use_sma': False, 'bear_use_ema': True, 'bear_use_atr': False, 'bear_use_adx': False, 'bear_use_spike': True, 'bear_rsi_required': False, 'sideways_strategy': 'mean_reversion', 'sideways_bb_std_mult': 3.03308100567868, 'sideways_rsi_os': 23, 'sideways_rsi_ob': 94, 'sideways_adx_thresh': 15.563827151039007, 'sideways_atr_min_pct': 0.027474993387632516, 'sideways_atr_max_pct': 0.14709792305007635, 'sideways_tp_mult': 2.6621491790296075, 'sideways_tsl_mult': 0.8009959195121097, 'sideways_time_stop': 221, 'sideways_use_sma': True, 'sideways_use_ema': False, 'sideways_use_atr': True, 'sideways_use_adx': True, 'sideways_use_spike': True, 'sideways_rsi_required': True}.
[I 2025-08-30 16:02:43,046] Trial 269 finished with values: [-1000000000.0, 1000000000.0] and parameters: {'p_sma': 14, 'p_std': 57, 'p_atr': 26, 'p_adx': 30, 'rsi_period': 28, 'ema1': 27, 'ema2': 60, 'slip_atr_k': 0.16302605642901516, 'slip_spread_k': 0.21646876690540812, 'spread_hl_frac': 0.044169645884858735, 'bb_std_mult': 3.467652303478288, 'rsi_os': 15, 'rsi_ob': 88, 'vol_spike': 0.005986277177199295, 'adx_thresh': 7.526368009534723, 'atr_min_pct': 0.013652903621447094, 'atr_max_pct': 0.14289293486351803, 'tp_mult': 2.4533562240372055, 'tsl_mult': 0.45979473732388026, 'strategy': 'mean_reversion', 'time_stop': 5, 'use_sma': False, 'use_atr': False, 'use_adx': True, 'use_ema': False, 'use_spike': True, 'rsi_required': False, 'edge_k': 1.7272382107896056, 'edge_cap': 0.6457083421553887, 'bull_strategy': 'mean_reversion', 'bull_bb_std_mult': 2.425739475323948, 'bull_rsi_os': 39, 'bull_rsi_ob': 74, 'bull_adx_thresh': 17.73516087141118, 'bull_atr_min_pct': 0.0004915821456518747, 'bull_atr_max_pct': 0.1292330621078229, 'bull_tp_mult': 1.2003416604421355, 'bull_tsl_mult': 0.9886271246221179, 'bull_time_stop': 81, 'bull_use_sma': True, 'bull_use_ema': False, 'bull_use_atr': False, 'bull_use_adx': True, 'bull_use_spike': False, 'bull_rsi_required': True, 'bear_strategy': 'mean_reversion', 'bear_bb_std_mult': 1.959766099121635, 'bear_rsi_os': 19, 'bear_rsi_ob': 77, 'bear_adx_thresh': 12.516103859199069, 'bear_atr_min_pct': 0.028560404095565928, 'bear_atr_max_pct': 0.09002515829361778, 'bear_tp_mult': 1.042678236991439, 'bear_tsl_mult': 0.06901633086754438, 'bear_time_stop': 191, 'bear_use_sma': False, 'bear_use_ema': False, 'bear_use_atr': False, 'bear_use_adx': False, 'bear_use_spike': True, 'bear_rsi_required': False, 'sideways_strategy': 'breakout', 'sideways_bb_std_mult': 0.7376522890188983, 'sideways_rsi_os': 29, 'sideways_rsi_ob': 93, 'sideways_adx_thresh': 31.75854814161624, 'sideways_atr_min_pct': 0.002552903550654087, 'sideways_atr_max_pct': 0.14797424924083566, 'sideways_tp_mult': 2.3966950153428357, 'sideways_tsl_mult': 0.399730251595772, 'sideways_time_stop': 232, 'sideways_use_sma': False, 'sideways_use_ema': False, 'sideways_use_atr': False, 'sideways_use_adx': True, 'sideways_use_spike': False, 'sideways_rsi_required': True}.
[I 2025-08-30 16:02:43,071] Trial 267 finished with values: [-1000000000.0, 1000000000.0] and parameters: {'p_sma': 20, 'p_std': 57, 'p_atr': 25, 'p_adx': 28, 'rsi_period': 28, 'ema1': 21, 'ema2': 41, 'slip_atr_k': 0.022974812879166515, 'slip_spread_k': 0.7867225194282994, 'spread_hl_frac': 0.04379399863680634, 'bb_std_mult': 2.8390080016410093, 'rsi_os': 14, 'rsi_ob': 51, 'vol_spike': 0.23056264474566907, 'adx_thresh': 27.283295410545957, 'atr_min_pct': 0.02148891231688811, 'atr_max_pct': 0.14998270052884619, 'tp_mult': 1.9957515940045523, 'tsl_mult': 0.45694438654102093, 'strategy': 'breakout', 'time_stop': 5, 'use_sma': False, 'use_atr': False, 'use_adx': True, 'use_ema': False, 'use_spike': True, 'rsi_required': False, 'edge_k': 1.919677713192118, 'edge_cap': 0.5759346400554602, 'bull_strategy': 'breakout', 'bull_bb_std_mult': 1.5979423241745763, 'bull_rsi_os': 13, 'bull_rsi_ob': 76, 'bull_adx_thresh': 29.378029471907386, 'bull_atr_min_pct': 0.00993833653199378, 'bull_atr_max_pct': 0.12499786837903458, 'bull_tp_mult': 1.8735481826225857, 'bull_tsl_mult': 0.5566030529551768, 'bull_time_stop': 215, 'bull_use_sma': True, 'bull_use_ema': True, 'bull_use_atr': False, 'bull_use_adx': True, 'bull_use_spike': False, 'bull_rsi_required': True, 'bear_strategy': 'mean_reversion', 'bear_bb_std_mult': 1.9238645222778799, 'bear_rsi_os': 29, 'bear_rsi_ob': 49, 'bear_adx_thresh': 14.072432355637709, 'bear_atr_min_pct': 0.007225176167032213, 'bear_atr_max_pct': 0.08808078382689617, 'bear_tp_mult': 1.1755768899328654, 'bear_tsl_mult': 0.39059775595358137, 'bear_time_stop': 278, 'bear_use_sma': False, 'bear_use_ema': False, 'bear_use_atr': False, 'bear_use_adx': False, 'bear_use_spike': True, 'bear_rsi_required': False, 'sideways_strategy': 'mean_reversion', 'sideways_bb_std_mult': 1.4426620634679264, 'sideways_rsi_os': 27, 'sideways_rsi_ob': 94, 'sideways_adx_thresh': 28.472810408529092, 'sideways_atr_min_pct': 0.0025193348588783446, 'sideways_atr_max_pct': 0.1474726496243793, 'sideways_tp_mult': 2.486106745378515, 'sideways_tsl_mult': 0.7926634012671123, 'sideways_time_stop': 223, 'sideways_use_sma': False, 'sideways_use_ema': False, 'sideways_use_atr': False, 'sideways_use_adx': True, 'sideways_use_spike': False, 'sideways_rsi_required': True}.
[I 2025-08-30 16:02:43,925] Trial 268 finished with values: [-0.016145224838943206, 0.016057050249905582] and parameters: {'p_sma': 21, 'p_std': 57, 'p_atr': 26, 'p_adx': 26, 'rsi_period': 28, 'ema1': 27, 'ema2': 41, 'slip_atr_k': 0.004595796151342034, 'slip_spread_k': 0.0028848002098130756, 'spread_hl_frac': 0.04757829835463799, 'bb_std_mult': 2.9165163299248724, 'rsi_os': 37, 'rsi_ob': 52, 'vol_spike': 0.23636990277485417, 'adx_thresh': 7.557026218091487, 'atr_min_pct': 0.020963459705317686, 'atr_max_pct': 0.14257787252421936, 'tp_mult': 1.993336457361311, 'tsl_mult': 0.46079964675866303, 'strategy': 'mean_reversion', 'time_stop': 8, 'use_sma': False, 'use_atr': False, 'use_adx': True, 'use_ema': False, 'use_spike': True, 'rsi_required': False, 'edge_k': 1.4840330487624103, 'edge_cap': 0.6387793778850118, 'bull_strategy': 'mean_reversion', 'bull_bb_std_mult': 2.4064957263621483, 'bull_rsi_os': 11, 'bull_rsi_ob': 76, 'bull_adx_thresh': 29.46076654607429, 'bull_atr_min_pct': 2.6600971407605284e-05, 'bull_atr_max_pct': 0.12942296600885655, 'bull_tp_mult': 1.2049868526172374, 'bull_tsl_mult': 0.1262615344377767, 'bull_time_stop': 271, 'bull_use_sma': True, 'bull_use_ema': False, 'bull_use_atr': False, 'bull_use_adx': True, 'bull_use_spike': False, 'bull_rsi_required': True, 'bear_strategy': 'mean_reversion', 'bear_bb_std_mult': 1.0276028040829048, 'bear_rsi_os': 19, 'bear_rsi_ob': 77, 'bear_adx_thresh': 28.271534985457286, 'bear_atr_min_pct': 0.02432173480353088, 'bear_atr_max_pct': 0.10583026454955465, 'bear_tp_mult': 2.8744687245595886, 'bear_tsl_mult': 0.0740003074074913, 'bear_time_stop': 225, 'bear_use_sma': False, 'bear_use_ema': False, 'bear_use_atr': False, 'bear_use_adx': False, 'bear_use_spike': True, 'bear_rsi_required': False, 'sideways_strategy': 'breakout', 'sideways_bb_std_mult': 3.126373670867203, 'sideways_rsi_os': 27, 'sideways_rsi_ob': 93, 'sideways_adx_thresh': 9.817965449722399, 'sideways_atr_min_pct': 0.0009583930544862948, 'sideways_atr_max_pct': 0.14710494986813963, 'sideways_tp_mult': 2.394976731453485, 'sideways_tsl_mult': 0.47208952078695116, 'sideways_time_stop': 275, 'sideways_use_sma': False, 'sideways_use_ema': False, 'sideways_use_atr': False, 'sideways_use_adx': True, 'sideways_use_spike': False, 'sideways_rsi_required': True}.
[I 2025-08-30 16:02:44,818] Trial 266 finished with values: [-1000000000.0, 1000000000.0] and parameters: {'p_sma': 14, 'p_std': 47, 'p_atr': 14, 'p_adx': 27, 'rsi_period': 56, 'ema1': 26, 'ema2': 60, 'slip_atr_k': 0.16101679361430388, 'slip_spread_k': 0.0012116252808964788, 'spread_hl_frac': 0.026626729220573863, 'bb_std_mult': 1.092127389441871, 'rsi_os': 39, 'rsi_ob': 51, 'vol_spike': 0.03345802399665605, 'adx_thresh': 7.254133568292396, 'atr_min_pct': 0.016328770226072032, 'atr_max_pct': 0.14198337272300018, 'tp_mult': 1.8476001075748547, 'tsl_mult': 0.18522883444074212, 'strategy': 'breakout', 'time_stop': 20, 'use_sma': False, 'use_atr': False, 'use_adx': False, 'use_ema': False, 'use_spike': True, 'rsi_required': False, 'edge_k': 0.7361717159197454, 'edge_cap': 0.3472378310256432, 'bull_strategy': 'breakout', 'bull_bb_std_mult': 1.791552536738516, 'bull_rsi_os': 39, 'bull_rsi_ob': 76, 'bull_adx_thresh': 8.287295318441306, 'bull_atr_min_pct': 0.005068278577825347, 'bull_atr_max_pct': 0.12358869824609824, 'bull_tp_mult': 1.8462626635576944, 'bull_tsl_mult': 0.5626375728171384, 'bull_time_stop': 44, 'bull_use_sma': True, 'bull_use_ema': True, 'bull_use_atr': False, 'bull_use_adx': False, 'bull_use_spike': True, 'bull_rsi_required': True, 'bear_strategy': 'mean_reversion', 'bear_bb_std_mult': 0.9608449182862473, 'bear_rsi_os': 29, 'bear_rsi_ob': 70, 'bear_adx_thresh': 5.540922275406956, 'bear_atr_min_pct': 0.007488671847884739, 'bear_atr_max_pct': 0.08762194266651593, 'bear_tp_mult': 2.26043244037276, 'bear_tsl_mult': 0.5144913831993774, 'bear_time_stop': 66, 'bear_use_sma': False, 'bear_use_ema': True, 'bear_use_atr': False, 'bear_use_adx': False, 'bear_use_spike': True, 'bear_rsi_required': False, 'sideways_strategy': 'breakout', 'sideways_bb_std_mult': 3.0483160341904494, 'sideways_rsi_os': 31, 'sideways_rsi_ob': 94, 'sideways_adx_thresh': 14.749639854918884, 'sideways_atr_min_pct': 0.0007419291698261283, 'sideways_atr_max_pct': 0.14785270969252418, 'sideways_tp_mult': 2.4013119869936093, 'sideways_tsl_mult': 0.8034796454150417, 'sideways_time_stop': 141, 'sideways_use_sma': False, 'sideways_use_ema': False, 'sideways_use_atr': True, 'sideways_use_adx': True, 'sideways_use_spike': True, 'sideways_rsi_required': True}.
