[I 2025-08-30 17:21:33,673] Trial 727 finished with values: [-1000000000.0, 1000000000.0] and parameters: {'p_sma': 38, 'p_std': 34, 'p_atr': 16, 'p_adx': 13, 'rsi_period': 58, 'ema1': 18, 'ema2': 41, 'slip_atr_k': 0.2400155990310419, 'slip_spread_k': 0.3823998683061769, 'spread_hl_frac': 0.0279647736252484, 'bb_std_mult': 3.2202203546177963, 'rsi_os': 46, 'rsi_ob': 83, 'vol_spike': 0.08233042483088544, 'adx_thresh': 23.90185068578997, 'atr_min_pct': 0.005235208566007484, 'atr_max_pct': 0.11382514109806094, 'tp_mult': 2.630991755926419, 'tsl_mult': 0.13275202192091495, 'strategy': 'mean_reversion', 'time_stop': 193, 'use_sma': False, 'use_atr': True, 'use_adx': True, 'use_ema': False, 'use_spike': False, 'rsi_required': True, 'edge_k': 0.4537212808547554, 'edge_cap': 0.8163300424364869, 'bull_strategy': 'mean_reversion', 'bull_bb_std_mult': 3.203827078064865, 'bull_rsi_os': 13, 'bull_rsi_ob': 52, 'bull_adx_thresh': 8.921381642602618, 'bull_atr_min_pct': 0.022608276161135324, 'bull_atr_max_pct': 0.13914228060779726, 'bull_tp_mult': 2.3276728838555534, 'bull_tsl_mult': 0.14472289148301448, 'bull_time_stop': 65, 'bull_use_sma': True, 'bull_use_ema': True, 'bull_use_atr': False, 'bull_use_adx': True, 'bull_use_spike': False, 'bull_rsi_required': False, 'bear_strategy': 'mean_reversion', 'bear_bb_std_mult': 1.3269963911043365, 'bear_rsi_os': 29, 'bear_rsi_ob': 52, 'bear_adx_thresh': 27.83170030657318, 'bear_atr_min_pct': 0.0207117942597642, 'bear_atr_max_pct': 0.11890017142595596, 'bear_tp_mult': 2.5651287682200516, 'bear_tsl_mult': 0.36283298134476943, 'bear_time_stop': 188, 'bear_use_sma': True, 'bear_use_ema': False, 'bear_use_atr': False, 'bear_use_adx': False, 'bear_use_spike': False, 'bear_rsi_required': False, 'sideways_strategy': 'breakout', 'sideways_bb_std_mult': 2.7905685919411303, 'sideways_rsi_os': 30, 'sideways_rsi_ob': 74, 'sideways_adx_thresh': 11.962178146925975, 'sideways_atr_min_pct': 0.016960255381511604, 'sideways_atr_max_pct': 0.09832527161284944, 'sideways_tp_mult': 2.921670595312294, 'sideways_tsl_mult': 0.460867179825183, 'sideways_time_stop': 280, 'sideways_use_sma': True, 'sideways_use_ema': False, 'sideways_use_atr': False, 'sideways_use_adx': False, 'sideways_use_spike': False, 'sideways_rsi_required': True}.
[I 2025-08-30 17:21:34,552] Trial 730 finished with values: [-1000000000.0, 1000000000.0] and parameters: {'p_sma': 56, 'p_std': 24, 'p_atr': 16, 'p_adx': 13, 'rsi_period': 84, 'ema1': 17, 'ema2': 11, 'slip_atr_k': 0.14488036241345442, 'slip_spread_k': 0.23794070720949845, 'spread_hl_frac': 0.019086131564825293, 'bb_std_mult': 3.033671986021067, 'rsi_os': 30, 'rsi_ob': 87, 'vol_spike': 0.28128294413766985, 'adx_thresh': 30.37835832457161, 'atr_min_pct': 0.020078889322508897, 'atr_max_pct': 0.14729921428564702, 'tp_mult': 2.5814920323094275, 'tsl_mult': 0.9211838001964189, 'strategy': 'mean_reversion', 'time_stop': 241, 'use_sma': False, 'use_atr': True, 'use_adx': True, 'use_ema': False, 'use_spike': False, 'rsi_required': True, 'edge_k': 0.8544833884412442, 'edge_cap': 0.8077286223292295, 'bull_strategy': 'mean_reversion', 'bull_bb_std_mult': 2.805114005877469, 'bull_rsi_os': 21, 'bull_rsi_ob': 79, 'bull_adx_thresh': 11.863507954973434, 'bull_atr_min_pct': 0.026812722395485725, 'bull_atr_max_pct': 0.09069939309323946, 'bull_tp_mult': 2.5985664837169993, 'bull_tsl_mult': 0.11367113747266999, 'bull_time_stop': 295, 'bull_use_sma': True, 'bull_use_ema': True, 'bull_use_atr': False, 'bull_use_adx': True, 'bull_use_spike': False, 'bull_rsi_required': False, 'bear_strategy': 'mean_reversion', 'bear_bb_std_mult': 1.3251308264625972, 'bear_rsi_os': 15, 'bear_rsi_ob': 70, 'bear_adx_thresh': 11.561119621814145, 'bear_atr_min_pct': 0.020868623237308547, 'bear_atr_max_pct': 0.10541040259612026, 'bear_tp_mult': 2.1914046915433314, 'bear_tsl_mult': 0.6136155156533684, 'bear_time_stop': 102, 'bear_use_sma': True, 'bear_use_ema': False, 'bear_use_atr': False, 'bear_use_adx': False, 'bear_use_spike': False, 'bear_rsi_required': False, 'sideways_strategy': 'breakout', 'sideways_bb_std_mult': 0.8191407300901835, 'sideways_rsi_os': 23, 'sideways_rsi_ob': 92, 'sideways_adx_thresh': 10.70493116137927, 'sideways_atr_min_pct': 0.003244122255151521, 'sideways_atr_max_pct': 0.02066547481301015, 'sideways_tp_mult': 1.94206101464678, 'sideways_tsl_mult': 0.7658120383592527, 'sideways_time_stop': 289, 'sideways_use_sma': True, 'sideways_use_ema': False, 'sideways_use_atr': False, 'sideways_use_adx': False, 'sideways_use_spike': False, 'sideways_rsi_required': True}.
[I 2025-08-30 17:21:35,544] Trial 732 finished with values: [-1000000000.0, 1000000000.0] and parameters: {'p_sma': 14, 'p_std': 30, 'p_atr': 15, 'p_adx': 13, 'rsi_period': 22, 'ema1': 17, 'ema2': 48, 'slip_atr_k': 0.14538240368458089, 'slip_spread_k': 0.3782771502218547, 'spread_hl_frac': 0.015889779904375245, 'bb_std_mult': 3.1618426614098154, 'rsi_os': 34, 'rsi_ob': 87, 'vol_spike': 0.07722804442056425, 'adx_thresh': 30.25526650669492, 'atr_min_pct': 0.0249248151296833, 'atr_max_pct': 0.022028886659738747, 'tp_mult': 2.685840559671452, 'tsl_mult': 0.9235628931525868, 'strategy': 'mean_reversion', 'time_stop': 300, 'use_sma': False, 'use_atr': True, 'use_adx': True, 'use_ema': False, 'use_spike': False, 'rsi_required': True, 'edge_k': 0.8762365590362704, 'edge_cap': 0.9511931969813844, 'bull_strategy': 'mean_reversion', 'bull_bb_std_mult': 2.390483036835417, 'bull_rsi_os': 42, 'bull_rsi_ob': 55, 'bull_adx_thresh': 12.679396583533041, 'bull_atr_min_pct': 0.003609362023121232, 'bull_atr_max_pct': 0.14029191971449614, 'bull_tp_mult': 1.9557678027424328, 'bull_tsl_mult': 0.7991417361721185, 'bull_time_stop': 76, 'bull_use_sma': True, 'bull_use_ema': True, 'bull_use_atr': False, 'bull_use_adx': True, 'bull_use_spike': False, 'bull_rsi_required': False, 'bear_strategy': 'mean_reversion', 'bear_bb_std_mult': 0.984438809246633, 'bear_rsi_os': 47, 'bear_rsi_ob': 59, 'bear_adx_thresh': 31.353116730968537, 'bear_atr_min_pct': 0.019645531723996107, 'bear_atr_max_pct': 0.10796696339730971, 'bear_tp_mult': 2.192988241802323, 'bear_tsl_mult': 0.6124800838986986, 'bear_time_stop': 210, 'bear_use_sma': True, 'bear_use_ema': False, 'bear_use_atr': False, 'bear_use_adx': False, 'bear_use_spike': False, 'bear_rsi_required': False, 'sideways_strategy': 'mean_reversion', 'sideways_bb_std_mult': 0.8313495695456166, 'sideways_rsi_os': 32, 'sideways_rsi_ob': 89, 'sideways_adx_thresh': 10.663379454920541, 'sideways_atr_min_pct': 0.002354250286559091, 'sideways_atr_max_pct': 0.1078939150373815, 'sideways_tp_mult': 2.8746984017395816, 'sideways_tsl_mult': 0.7581650342754995, 'sideways_time_stop': 288, 'sideways_use_sma': False, 'sideways_use_ema': False, 'sideways_use_atr': False, 'sideways_use_adx': False, 'sideways_use_spike': False, 'sideways_rsi_required': True}.
[I 2025-08-30 17:22:12,751] Trial 731 finished with values: [-1000000000.0, 1000000000.0] and parameters: {'p_sma': 36, 'p_std': 24, 'p_atr': 16, 'p_adx': 8, 'rsi_period': 22, 'ema1': 17, 'ema2': 12, 'slip_atr_k': 0.2400058836550521, 'slip_spread_k': 0.20528661656051952, 'spread_hl_frac': 0.02008531733163553, 'bb_std_mult': 3.028172349038248, 'rsi_os': 34, 'rsi_ob': 64, 'vol_spike': 0.07759345648522552, 'adx_thresh': 23.968787675179456, 'atr_min_pct': 0.020187413351109396, 'atr_max_pct': 0.14553275261130838, 'tp_mult': 2.6747001968422377, 'tsl_mult': 0.9252697167296905, 'strategy': 'mean_reversion', 'time_stop': 169, 'use_sma': False, 'use_atr': True, 'use_adx': True, 'use_ema': False, 'use_spike': False, 'rsi_required': True, 'edge_k': 1.1986091875449352, 'edge_cap': 0.819193752266639, 'bull_strategy': 'mean_reversion', 'bull_bb_std_mult': 2.7933425922318618, 'bull_rsi_os': 21, 'bull_rsi_ob': 55, 'bull_adx_thresh': 33.301102444579875, 'bull_atr_min_pct': 0.021249183525127197, 'bull_atr_max_pct': 0.13716968487947878, 'bull_tp_mult': 2.354387387149531, 'bull_tsl_mult': 0.801427764234063, 'bull_time_stop': 159, 'bull_use_sma': True, 'bull_use_ema': True, 'bull_use_atr': False, 'bull_use_adx': True, 'bull_use_spike': False, 'bull_rsi_required': False, 'bear_strategy': 'mean_reversion', 'bear_bb_std_mult': 2.5274378408334206, 'bear_rsi_os': 15, 'bear_rsi_ob': 74, 'bear_adx_thresh': 29.920840857687462, 'bear_atr_min_pct': 0.01948488119932674, 'bear_atr_max_pct': 0.11148675875576093, 'bear_tp_mult': 1.720573901428111, 'bear_tsl_mult': 0.6134990461948792, 'bear_time_stop': 210, 'bear_use_sma': True, 'bear_use_ema': False, 'bear_use_atr': False, 'bear_use_adx': False, 'bear_use_spike': False, 'bear_rsi_required': False, 'sideways_strategy': 'mean_reversion', 'sideways_bb_std_mult': 0.8304108274652521, 'sideways_rsi_os': 32, 'sideways_rsi_ob': 89, 'sideways_adx_thresh': 10.620565468781718, 'sideways_atr_min_pct': 0.0021810121644788147, 'sideways_atr_max_pct': 0.09749907564359558, 'sideways_tp_mult': 2.8731234834854726, 'sideways_tsl_mult': 0.4119534600517217, 'sideways_time_stop': 287, 'sideways_use_sma': False, 'sideways_use_ema': False, 'sideways_use_atr': False, 'sideways_use_adx': False, 'sideways_use_spike': False, 'sideways_rsi_required': True}.
[I 2025-08-30 17:22:13,172] Trial 733 finished with values: [-1000000000.0, 1000000000.0] and parameters: {'p_sma': 7, 'p_std': 14, 'p_atr': 15, 'p_adx': 30, 'rsi_period': 51, 'ema1': 29, 'ema2': 11, 'slip_atr_k': 0.016497332010248805, 'slip_spread_k': 0.2058742121048432, 'spread_hl_frac': 0.019701462587411983, 'bb_std_mult': 2.7228007591504877, 'rsi_os': 34, 'rsi_ob': 73, 'vol_spike': 0.0778451314208235, 'adx_thresh': 11.130764288058423, 'atr_min_pct': 0.01785857943164768, 'atr_max_pct': 0.14413177681693862, 'tp_mult': 2.9363009803356372, 'tsl_mult': 0.9965065119417007, 'strategy': 'mean_reversion', 'time_stop': 23, 'use_sma': False, 'use_atr': True, 'use_adx': True, 'use_ema': False, 'use_spike': False, 'rsi_required': True, 'edge_k': 0.30862402059753624, 'edge_cap': 0.1640929615719242, 'bull_strategy': 'mean_reversion', 'bull_bb_std_mult': 2.3858512983303233, 'bull_rsi_os': 23, 'bull_rsi_ob': 79, 'bull_adx_thresh': 11.939030100926075, 'bull_atr_min_pct': 0.0046128305955153714, 'bull_atr_max_pct': 0.09096641267188499, 'bull_tp_mult': 2.1930143067543066, 'bull_tsl_mult': 0.7936503916002176, 'bull_time_stop': 107, 'bull_use_sma': True, 'bull_use_ema': True, 'bull_use_atr': False, 'bull_use_adx': True, 'bull_use_spike': False, 'bull_rsi_required': False, 'bear_strategy': 'mean_reversion', 'bear_bb_std_mult': 0.9909734735265266, 'bear_rsi_os': 15, 'bear_rsi_ob': 45, 'bear_adx_thresh': 29.971194884209304, 'bear_atr_min_pct': 0.00833328662456859, 'bear_atr_max_pct': 0.11237993012110653, 'bear_tp_mult': 2.185250446319416, 'bear_tsl_mult': 0.6093204580782056, 'bear_time_stop': 211, 'bear_use_sma': True, 'bear_use_ema': False, 'bear_use_atr': False, 'bear_use_adx': False, 'bear_use_spike': False, 'bear_rsi_required': False, 'sideways_strategy': 'mean_reversion', 'sideways_bb_std_mult': 0.8277500029588121, 'sideways_rsi_os': 32, 'sideways_rsi_ob': 84, 'sideways_adx_thresh': 11.039736637456379, 'sideways_atr_min_pct': 0.01286129643044648, 'sideways_atr_max_pct': 0.020556652455863515, 'sideways_tp_mult': 2.875364789906791, 'sideways_tsl_mult': 0.43423725677680136, 'sideways_time_stop': 17, 'sideways_use_sma': False, 'sideways_use_ema': False, 'sideways_use_atr': False, 'sideways_use_adx': False, 'sideways_use_spike': False, 'sideways_rsi_required': True}.
[I 2025-08-30 17:22:13,569] Trial 734 finished with values: [-1000000000.0, 1000000000.0] and parameters: {'p_sma': 5, 'p_std': 12, 'p_atr': 15, 'p_adx': 8, 'rsi_period': 22, 'ema1': 17, 'ema2': 12, 'slip_atr_k': 0.018802627813099406, 'slip_spread_k': 0.2083043091229283, 'spread_hl_frac': 0.015689472208513223, 'bb_std_mult': 1.4793476231134601, 'rsi_os': 34, 'rsi_ob': 74, 'vol_spike': 0.07437789618109658, 'adx_thresh': 11.162174989305107, 'atr_min_pct': 0.02469866906990371, 'atr_max_pct': 0.14437830216945882, 'tp_mult': 1.5730864915138945, 'tsl_mult': 0.024271572256994, 'strategy': 'mean_reversion', 'time_stop': 93, 'use_sma': False, 'use_atr': True, 'use_adx': True, 'use_ema': False, 'use_spike': False, 'rsi_required': True, 'edge_k': 0.9290190397830881, 'edge_cap': 0.8470742996323604, 'bull_strategy': 'mean_reversion', 'bull_bb_std_mult': 2.3968858519936598, 'bull_rsi_os': 43, 'bull_rsi_ob': 71, 'bull_adx_thresh': 33.6432276350754, 'bull_atr_min_pct': 0.00913392708669943, 'bull_atr_max_pct': 0.1427745875270154, 'bull_tp_mult': 2.1109069377901197, 'bull_tsl_mult': 0.848261780928182, 'bull_time_stop': 75, 'bull_use_sma': True, 'bull_use_ema': True, 'bull_use_atr': False, 'bull_use_adx': True, 'bull_use_spike': False, 'bull_rsi_required': True, 'bear_strategy': 'mean_reversion', 'bear_bb_std_mult': 1.0798864293547745, 'bear_rsi_os': 41, 'bear_rsi_ob': 90, 'bear_adx_thresh': 9.530178361172753, 'bear_atr_min_pct': 0.020007637434728973, 'bear_atr_max_pct': 0.01719519419072002, 'bear_tp_mult': 1.7296164071299773, 'bear_tsl_mult': 0.542697929743074, 'bear_time_stop': 210, 'bear_use_sma': True, 'bear_use_ema': True, 'bear_use_atr': False, 'bear_use_adx': False, 'bear_use_spike': False, 'bear_rsi_required': False, 'sideways_strategy': 'mean_reversion', 'sideways_bb_std_mult': 0.9259609048602216, 'sideways_rsi_os': 53, 'sideways_rsi_ob': 91, 'sideways_adx_thresh': 25.431617605161037, 'sideways_atr_min_pct': 0.01280861999698598, 'sideways_atr_max_pct': 0.1075351083572324, 'sideways_tp_mult': 2.8641968092515744, 'sideways_tsl_mult': 0.413027173618816, 'sideways_time_stop': 30, 'sideways_use_sma': False, 'sideways_use_ema': False, 'sideways_use_atr': True, 'sideways_use_adx': False, 'sideways_use_spike': False, 'sideways_rsi_required': False}.
[I 2025-08-30 17:22:14,773] Trial 735 finished with values: [-1000000000.0, 1000000000.0] and parameters: {'p_sma': 7, 'p_std': 12, 'p_atr': 15, 'p_adx': 7, 'rsi_period': 23, 'ema1': 17, 'ema2': 46, 'slip_atr_k': 0.228623304957145, 'slip_spread_k': 0.20597607144096128, 'spread_hl_frac': 0.019682288786557263, 'bb_std_mult': 1.4772290091758253, 'rsi_os': 32, 'rsi_ob': 74, 'vol_spike': 0.09852235459069242, 'adx_thresh': 11.013487019920237, 'atr_min_pct': 0.0208379141532505, 'atr_max_pct': 0.14423232320510793, 'tp_mult': 2.930719346052861, 'tsl_mult': 0.9508681295940156, 'strategy': 'mean_reversion', 'time_stop': 106, 'use_sma': False, 'use_atr': True, 'use_adx': True, 'use_ema': False, 'use_spike': False, 'rsi_required': True, 'edge_k': 1.200993343388495, 'edge_cap': 0.06762343710147939, 'bull_strategy': 'mean_reversion', 'bull_bb_std_mult': 1.686992990930519, 'bull_rsi_os': 9, 'bull_rsi_ob': 80, 'bull_adx_thresh': 9.782908903857237, 'bull_atr_min_pct': 0.024533093131999324, 'bull_atr_max_pct': 0.1429801829169103, 'bull_tp_mult': 2.1948845155700347, 'bull_tsl_mult': 0.8153605776810651, 'bull_time_stop': 147, 'bull_use_sma': True, 'bull_use_ema': True, 'bull_use_atr': False, 'bull_use_adx': True, 'bull_use_spike': False, 'bull_rsi_required': True, 'bear_strategy': 'mean_reversion', 'bear_bb_std_mult': 1.072754786356611, 'bear_rsi_os': 41, 'bear_rsi_ob': 74, 'bear_adx_thresh': 10.906226685478016, 'bear_atr_min_pct': 0.008805783784250076, 'bear_atr_max_pct': 0.11309034128010391, 'bear_tp_mult': 1.7189709036096859, 'bear_tsl_mult': 0.5875540225300385, 'bear_time_stop': 204, 'bear_use_sma': True, 'bear_use_ema': True, 'bear_use_atr': False, 'bear_use_adx': False, 'bear_use_spike': False, 'bear_rsi_required': False, 'sideways_strategy': 'mean_reversion', 'sideways_bb_std_mult': 0.9107338010101147, 'sideways_rsi_os': 33, 'sideways_rsi_ob': 93, 'sideways_adx_thresh': 11.206733839608242, 'sideways_atr_min_pct': 0.012678480574728623, 'sideways_atr_max_pct': 0.09161322205170834, 'sideways_tp_mult': 2.9367263165178006, 'sideways_tsl_mult': 0.22008616348053922, 'sideways_time_stop': 120, 'sideways_use_sma': False, 'sideways_use_ema': False, 'sideways_use_atr': True, 'sideways_use_adx': False, 'sideways_use_spike': False, 'sideways_rsi_required': False}.
[I 2025-08-30 17:22:52,131] Trial 739 finished with values: [-1000000000.0, 1000000000.0] and parameters: {'p_sma': 9, 'p_std': 21, 'p_atr': 12, 'p_adx': 9, 'rsi_period': 74, 'ema1': 18, 'ema2': 36, 'slip_atr_k': 0.1673545997957181, 'slip_spread_k': 0.4621669651098346, 'spread_hl_frac': 0.017025436771897384, 'bb_std_mult': 3.157152036003282, 'rsi_os': 13, 'rsi_ob': 55, 'vol_spike': 0.11536682801167492, 'adx_thresh': 12.057139217868023, 'atr_min_pct': 0.016964767556333818, 'atr_max_pct': 0.1497291905482938, 'tp_mult': 2.7908501301066986, 'tsl_mult': 0.1888736795001167, 'strategy': 'breakout', 'time_stop': 142, 'use_sma': False, 'use_atr': True, 'use_adx': True, 'use_ema': True, 'use_spike': False, 'rsi_required': False, 'edge_k': 0.5532725004071659, 'edge_cap': 0.8864557515856155, 'bull_strategy': 'mean_reversion', 'bull_bb_std_mult': 3.4114397007444364, 'bull_rsi_os': 39, 'bull_rsi_ob': 65, 'bull_adx_thresh': 34.36513156410095, 'bull_atr_min_pct': 0.007303796546058357, 'bull_atr_max_pct': 0.06887307942486515, 'bull_tp_mult': 2.5330425611300984, 'bull_tsl_mult': 0.7282341839912668, 'bull_time_stop': 225, 'bull_use_sma': True, 'bull_use_ema': False, 'bull_use_atr': False, 'bull_use_adx': True, 'bull_use_spike': True, 'bull_rsi_required': False, 'bear_strategy': 'breakout', 'bear_bb_std_mult': 0.5397781970372978, 'bear_rsi_os': 14, 'bear_rsi_ob': 47, 'bear_adx_thresh': 13.090824845441439, 'bear_atr_min_pct': 0.001871262441260185, 'bear_atr_max_pct': 0.10361475014884494, 'bear_tp_mult': 2.052464100178841, 'bear_tsl_mult': 0.04134253362359841, 'bear_time_stop': 30, 'bear_use_sma': False, 'bear_use_ema': False, 'bear_use_atr': False, 'bear_use_adx': False, 'bear_use_spike': True, 'bear_rsi_required': True, 'sideways_strategy': 'breakout', 'sideways_bb_std_mult': 0.6264178734571942, 'sideways_rsi_os': 31, 'sideways_rsi_ob': 92, 'sideways_adx_thresh': 5.913201385155549, 'sideways_atr_min_pct': 0.0218481904179973, 'sideways_atr_max_pct': 0.10082996006582678, 'sideways_tp_mult': 2.770716245775729, 'sideways_tsl_mult': 0.8589081223779154, 'sideways_time_stop': 267, 'sideways_use_sma': True, 'sideways_use_ema': False, 'sideways_use_atr': False, 'sideways_use_adx': True, 'sideways_use_spike': False, 'sideways_rsi_required': True}.
[I 2025-08-30 17:22:53,188] Trial 737 finished with values: [-1000000000.0, 1000000000.0] and parameters: {'p_sma': 23, 'p_std': 21, 'p_atr': 30, 'p_adx': 7, 'rsi_period': 37, 'ema1': 14, 'ema2': 35, 'slip_atr_k': 0.01811702607926796, 'slip_spread_k': 0.1237959847876754, 'spread_hl_frac': 0.01698569502655001, 'bb_std_mult': 1.4853399250468162, 'rsi_os': 32, 'rsi_ob': 79, 'vol_spike': 0.09814490263525266, 'adx_thresh': 31.498834278518952, 'atr_min_pct': 0.021022742626029236, 'atr_max_pct': 0.1444517312166126, 'tp_mult': 1.5670243480166923, 'tsl_mult': 0.6115014822222599, 'strategy': 'mean_reversion', 'time_stop': 106, 'use_sma': False, 'use_atr': True, 'use_adx': True, 'use_ema': False, 'use_spike': False, 'rsi_required': True, 'edge_k': 0.5289290069341199, 'edge_cap': 0.9145853971126406, 'bull_strategy': 'mean_reversion', 'bull_bb_std_mult': 2.966336579047335, 'bull_rsi_os': 9, 'bull_rsi_ob': 71, 'bull_adx_thresh': 34.485452754303836, 'bull_atr_min_pct': 0.02175761784523972, 'bull_atr_max_pct': 0.14308957227705157, 'bull_tp_mult': 2.2777136606902624, 'bull_tsl_mult': 0.72428597672003, 'bull_time_stop': 183, 'bull_use_sma': True, 'bull_use_ema': True, 'bull_use_atr': False, 'bull_use_adx': True, 'bull_use_spike': False, 'bull_rsi_required': True, 'bear_strategy': 'mean_reversion', 'bear_bb_std_mult': 0.8924663473691088, 'bear_rsi_os': 14, 'bear_rsi_ob': 72, 'bear_adx_thresh': 9.418112196215931, 'bear_atr_min_pct': 0.016259363867060173, 'bear_atr_max_pct': 0.10304766439135261, 'bear_tp_mult': 1.4915662252865967, 'bear_tsl_mult': 0.5834700997960245, 'bear_time_stop': 204, 'bear_use_sma': True, 'bear_use_ema': True, 'bear_use_atr': False, 'bear_use_adx': False, 'bear_use_spike': False, 'bear_rsi_required': False, 'sideways_strategy': 'breakout', 'sideways_bb_std_mult': 3.5289828619962056, 'sideways_rsi_os': 41, 'sideways_rsi_ob': 93, 'sideways_adx_thresh': 31.846384272684105, 'sideways_atr_min_pct': 0.006698788599300218, 'sideways_atr_max_pct': 0.0921343988765558, 'sideways_tp_mult': 2.965669831606673, 'sideways_tsl_mult': 0.4014103821569704, 'sideways_time_stop': 268, 'sideways_use_sma': True, 'sideways_use_ema': False, 'sideways_use_atr': True, 'sideways_use_adx': False, 'sideways_use_spike': False, 'sideways_rsi_required': False}.
