[I 2025-08-30 15:26:57,509] Trial 88 finished with values: [-1000000000.0, 1000000000.0] and parameters: {'p_sma': 41, 'p_std': 60, 'p_atr': 28, 'p_adx': 15, 'rsi_period': 65, 'ema1': 30, 'ema2': 58, 'slip_atr_k': 0.155765554393407, 'slip_spread_k': 0.03899464618330295, 'spread_hl_frac': 0.04826372046573098, 'bb_std_mult': 3.4266246880685065, 'rsi_os': 22, 'rsi_ob': 54, 'vol_spike': 0.2785112304595666, 'adx_thresh': 11.559746337952562, 'atr_min_pct': 0.013020701087946368, 'atr_max_pct': 0.07719714379270043, 'tp_mult': 1.7567622345813465, 'tsl_mult': 0.6473571739886241, 'strategy': 'breakout', 'time_stop': 262, 'use_sma': False, 'use_atr': False, 'use_adx': False, 'use_ema': True, 'use_spike': False, 'rsi_required': False, 'edge_k': 0.853571098526707, 'edge_cap': 0.7981124939490774, 'bull_strategy': 'mean_reversion', 'bull_bb_std_mult': 2.9008947123910724, 'bull_rsi_os': 38, 'bull_rsi_ob': 63, 'bull_adx_thresh': 7.718858412091883, 'bull_atr_min_pct': 0.01704790930641229, 'bull_atr_max_pct': 0.12249934765185543, 'bull_tp_mult': 1.6468941899427214, 'bull_tsl_mult': 0.21278949705557942, 'bull_time_stop': 230, 'bull_use_sma': False, 'bull_use_ema': True, 'bull_use_atr': False, 'bull_use_adx': False, 'bull_use_spike': True, 'bull_rsi_required': True, 'bear_strategy': 'breakout', 'bear_bb_std_mult': 2.3155409582554185, 'bear_rsi_os': 22, 'bear_rsi_ob': 68, 'bear_adx_thresh': 12.301507026317147, 'bear_atr_min_pct': 0.02765378615624278, 'bear_atr_max_pct': 0.043220006943940514, 'bear_tp_mult': 1.565266087811574, 'bear_tsl_mult': 0.9018825844357294, 'bear_time_stop': 23, 'bear_use_sma': False, 'bear_use_ema': False, 'bear_use_atr': False, 'bear_use_adx': True, 'bear_use_spike': True, 'bear_rsi_required': True, 'sideways_strategy': 'breakout', 'sideways_bb_std_mult': 2.415362287959838, 'sideways_rsi_os': 36, 'sideways_rsi_ob': 55, 'sideways_adx_thresh': 7.705879841598975, 'sideways_atr_min_pct': 0.006033095772114704, 'sideways_atr_max_pct': 0.12683632614167617, 'sideways_tp_mult': 1.217880489076358, 'sideways_tsl_mult': 0.11063565569943554, 'sideways_time_stop': 165, 'sideways_use_sma': True, 'sideways_use_ema': False, 'sideways_use_atr': False, 'sideways_use_adx': False, 'sideways_use_spike': True, 'sideways_rsi_required': False}.
[I 2025-08-30 15:27:43,454] Trial 91 finished with values: [-1000000000.0, 1000000000.0] and parameters: {'p_sma': 53, 'p_std': 18, 'p_atr': 30, 'p_adx': 26, 'rsi_period': 65, 'ema1': 29, 'ema2': 42, 'slip_atr_k': 0.18203646734103485, 'slip_spread_k': 0.8620738839686076, 'spread_hl_frac': 0.04434212730531543, 'bb_std_mult': 1.7077523263194978, 'rsi_os': 22, 'rsi_ob': 65, 'vol_spike': 0.2704932544601796, 'adx_thresh': 23.047859122998915, 'atr_min_pct': 0.018099470555782815, 'atr_max_pct': 0.08341069578686051, 'tp_mult': 2.0525541586988183, 'tsl_mult': 0.5240471886784733, 'strategy': 'mean_reversion', 'time_stop': 192, 'use_sma': False, 'use_atr': False, 'use_adx': True, 'use_ema': False, 'use_spike': False, 'rsi_required': True, 'edge_k': 0.7342097663343754, 'edge_cap': 0.9131738398021241, 'bull_strategy': 'breakout', 'bull_bb_std_mult': 3.516269161960591, 'bull_rsi_os': 22, 'bull_rsi_ob': 56, 'bull_adx_thresh': 12.36352590131255, 'bull_atr_min_pct': 0.017051814291407265, 'bull_atr_max_pct': 0.05274270016754082, 'bull_tp_mult': 2.8238525319891044, 'bull_tsl_mult': 0.1392368205638203, 'bull_time_stop': 184, 'bull_use_sma': False, 'bull_use_ema': True, 'bull_use_atr': True, 'bull_use_adx': True, 'bull_use_spike': True, 'bull_rsi_required': True, 'bear_strategy': 'mean_reversion', 'bear_bb_std_mult': 2.8122132381915947, 'bear_rsi_os': 11, 'bear_rsi_ob': 68, 'bear_adx_thresh': 31.888984693401376, 'bear_atr_min_pct': 0.027754162642743628, 'bear_atr_max_pct': 0.13335457490952835, 'bear_tp_mult': 1.0862913300346455, 'bear_tsl_mult': 0.8872691352547967, 'bear_time_stop': 26, 'bear_use_sma': True, 'bear_use_ema': False, 'bear_use_atr': True, 'bear_use_adx': False, 'bear_use_spike': False, 'bear_rsi_required': False, 'sideways_strategy': 'breakout', 'sideways_bb_std_mult': 1.7850403003952584, 'sideways_rsi_os': 13, 'sideways_rsi_ob': 73, 'sideways_adx_thresh': 18.719252516869446, 'sideways_atr_min_pct': 0.006251545183181665, 'sideways_atr_max_pct': 0.08828780916273561, 'sideways_tp_mult': 2.4999374334955142, 'sideways_tsl_mult': 0.029942548634100646, 'sideways_time_stop': 163, 'sideways_use_sma': False, 'sideways_use_ema': True, 'sideways_use_atr': True, 'sideways_use_adx': False, 'sideways_use_spike': False, 'sideways_rsi_required': False}.
[I 2025-08-30 15:28:01,703] Trial 92 finished with values: [-1000000000.0, 1000000000.0] and parameters: {'p_sma': 35, 'p_std': 46, 'p_atr': 30, 'p_adx': 15, 'rsi_period': 27, 'ema1': 30, 'ema2': 34, 'slip_atr_k': 0.14385994641124106, 'slip_spread_k': 0.08452862302668473, 'spread_hl_frac': 0.04200168644618441, 'bb_std_mult': 1.7025866748563874, 'rsi_os': 22, 'rsi_ob': 60, 'vol_spike': 0.12762337104552868, 'adx_thresh': 20.54802220986455, 'atr_min_pct': 0.009270673260281822, 'atr_max_pct': 0.08369179325851961, 'tp_mult': 2.052794811474003, 'tsl_mult': 0.189953959898446, 'strategy': 'mean_reversion', 'time_stop': 279, 'use_sma': True, 'use_atr': False, 'use_adx': True, 'use_ema': False, 'use_spike': False, 'rsi_required': True, 'edge_k': 1.1055519083074092, 'edge_cap': 0.6209829285522592, 'bull_strategy': 'breakout', 'bull_bb_std_mult': 3.135761264572492, 'bull_rsi_os': 22, 'bull_rsi_ob': 57, 'bull_adx_thresh': 12.161416698935811, 'bull_atr_min_pct': 0.013763550130180484, 'bull_atr_max_pct': 0.1447326138725221, 'bull_tp_mult': 2.816196841961348, 'bull_tsl_mult': 0.5142838041121106, 'bull_time_stop': 265, 'bull_use_sma': False, 'bull_use_ema': True, 'bull_use_atr': True, 'bull_use_adx': True, 'bull_use_spike': False, 'bull_rsi_required': True, 'bear_strategy': 'mean_reversion', 'bear_bb_std_mult': 2.7987671197852846, 'bear_rsi_os': 28, 'bear_rsi_ob': 68, 'bear_adx_thresh': 31.69413007804545, 'bear_atr_min_pct': 0.017423176652314923, 'bear_atr_max_pct': 0.05385205998493889, 'bear_tp_mult': 1.4831888703327998, 'bear_tsl_mult': 0.32885795596939593, 'bear_time_stop': 287, 'bear_use_sma': True, 'bear_use_ema': True, 'bear_use_atr': True, 'bear_use_adx': False, 'bear_use_spike': False, 'bear_rsi_required': False, 'sideways_strategy': 'mean_reversion', 'sideways_bb_std_mult': 1.792596905653252, 'sideways_rsi_os': 37, 'sideways_rsi_ob': 56, 'sideways_adx_thresh': 7.537278756130673, 'sideways_atr_min_pct': 0.010747767933972266, 'sideways_atr_max_pct': 0.025654282009400106, 'sideways_tp_mult': 1.2798138366125444, 'sideways_tsl_mult': 0.06390931664869054, 'sideways_time_stop': 282, 'sideways_use_sma': False, 'sideways_use_ema': True, 'sideways_use_atr': False, 'sideways_use_adx': False, 'sideways_use_spike': False, 'sideways_rsi_required': False}.
[I 2025-08-30 15:28:02,263] Trial 93 finished with values: [-1000000000.0, 1000000000.0] and parameters: {'p_sma': 48, 'p_std': 36, 'p_atr': 30, 'p_adx': 19, 'rsi_period': 32, 'ema1': 27, 'ema2': 49, 'slip_atr_k': 0.1453978944175467, 'slip_spread_k': 0.9121196809093329, 'spread_hl_frac': 0.04186917348227058, 'bb_std_mult': 3.138817253466415, 'rsi_os': 36, 'rsi_ob': 70, 'vol_spike': 0.2684425915186496, 'adx_thresh': 34.44997566203439, 'atr_min_pct': 0.011093460381314302, 'atr_max_pct': 0.0853234301185697, 'tp_mult': 2.1831743454449586, 'tsl_mult': 0.8861139832625162, 'strategy': 'mean_reversion', 'time_stop': 290, 'use_sma': True, 'use_atr': False, 'use_adx': True, 'use_ema': False, 'use_spike': False, 'rsi_required': True, 'edge_k': 0.5010062812300313, 'edge_cap': 0.6262015173417738, 'bull_strategy': 'breakout', 'bull_bb_std_mult': 3.10032441312023, 'bull_rsi_os': 31, 'bull_rsi_ob': 56, 'bull_adx_thresh': 12.703027208277849, 'bull_atr_min_pct': 0.015928210624040835, 'bull_atr_max_pct': 0.031543706661042566, 'bull_tp_mult': 2.6398350474187584, 'bull_tsl_mult': 0.2760595086804579, 'bull_time_stop': 245, 'bull_use_sma': False, 'bull_use_ema': True, 'bull_use_atr': True, 'bull_use_adx': True, 'bull_use_spike': False, 'bull_rsi_required': False, 'bear_strategy': 'mean_reversion', 'bear_bb_std_mult': 2.6994728147533404, 'bear_rsi_os': 31, 'bear_rsi_ob': 90, 'bear_adx_thresh': 31.66430917468569, 'bear_atr_min_pct': 0.02555427175345225, 'bear_atr_max_pct': 0.019889191221727345, 'bear_tp_mult': 1.487558648635134, 'bear_tsl_mult': 0.8794804332573354, 'bear_time_stop': 66, 'bear_use_sma': True, 'bear_use_ema': True, 'bear_use_atr': True, 'bear_use_adx': False, 'bear_use_spike': False, 'bear_rsi_required': False, 'sideways_strategy': 'mean_reversion', 'sideways_bb_std_mult': 2.0667881622302757, 'sideways_rsi_os': 16, 'sideways_rsi_ob': 71, 'sideways_adx_thresh': 19.194761533872562, 'sideways_atr_min_pct': 0.011151732148964939, 'sideways_atr_max_pct': 0.025978766646496072, 'sideways_tp_mult': 1.3104927994034552, 'sideways_tsl_mult': 0.7628383871974584, 'sideways_time_stop': 156, 'sideways_use_sma': False, 'sideways_use_ema': True, 'sideways_use_atr': False, 'sideways_use_adx': False, 'sideways_use_spike': False, 'sideways_rsi_required': False}.
[I 2025-08-30 15:28:02,710] Trial 94 finished with values: [-1000000000.0, 1000000000.0] and parameters: {'p_sma': 36, 'p_std': 5, 'p_atr': 30, 'p_adx': 19, 'rsi_period': 58, 'ema1': 27, 'ema2': 48, 'slip_atr_k': 0.23034354353638964, 'slip_spread_k': 0.9157613254093651, 'spread_hl_frac': 0.022644314618973208, 'bb_std_mult': 1.609749040654735, 'rsi_os': 36, 'rsi_ob': 60, 'vol_spike': 0.21990904049466994, 'adx_thresh': 34.30679064737131, 'atr_min_pct': 0.011057042578412573, 'atr_max_pct': 0.049565163679735735, 'tp_mult': 2.058944005960599, 'tsl_mult': 0.8892463917375495, 'strategy': 'mean_reversion', 'time_stop': 13, 'use_sma': True, 'use_atr': False, 'use_adx': True, 'use_ema': False, 'use_spike': False, 'rsi_required': True, 'edge_k': 0.47961551691111154, 'edge_cap': 0.6357934012321321, 'bull_strategy': 'breakout', 'bull_bb_std_mult': 3.0961592583905397, 'bull_rsi_os': 30, 'bull_rsi_ob': 48, 'bull_adx_thresh': 12.52908253615945, 'bull_atr_min_pct': 0.015788592851262512, 'bull_atr_max_pct': 0.0623898452674196, 'bull_tp_mult': 1.4870429181212907, 'bull_tsl_mult': 0.2667771657034578, 'bull_time_stop': 240, 'bull_use_sma': False, 'bull_use_ema': True, 'bull_use_atr': True, 'bull_use_adx': True, 'bull_use_spike': False, 'bull_rsi_required': False, 'bear_strategy': 'mean_reversion', 'bear_bb_std_mult': 3.0571979044682127, 'bear_rsi_os': 29, 'bear_rsi_ob': 94, 'bear_adx_thresh': 32.64457399750912, 'bear_atr_min_pct': 0.016212987989174726, 'bear_atr_max_pct': 0.14649259862938482, 'bear_tp_mult': 2.097060457737122, 'bear_tsl_mult': 0.8358657859248992, 'bear_time_stop': 181, 'bear_use_sma': True, 'bear_use_ema': True, 'bear_use_atr': True, 'bear_use_adx': False, 'bear_use_spike': False, 'bear_rsi_required': False, 'sideways_strategy': 'mean_reversion', 'sideways_bb_std_mult': 2.5050764612943146, 'sideways_rsi_os': 13, 'sideways_rsi_ob': 53, 'sideways_adx_thresh': 18.16894099840446, 'sideways_atr_min_pct': 0.01426813251228094, 'sideways_atr_max_pct': 0.04339054963528345, 'sideways_tp_mult': 1.0705086496456624, 'sideways_tsl_mult': 0.07527913829489241, 'sideways_time_stop': 156, 'sideways_use_sma': False, 'sideways_use_ema': True, 'sideways_use_atr': False, 'sideways_use_adx': False, 'sideways_use_spike': False, 'sideways_rsi_required': False}.
[I 2025-08-30 15:28:32,850] Trial 95 finished with values: [-1000000000.0, 1000000000.0] and parameters: {'p_sma': 35, 'p_std': 37, 'p_atr': 30, 'p_adx': 19, 'rsi_period': 33, 'ema1': 27, 'ema2': 49, 'slip_atr_k': 0.08398647067435595, 'slip_spread_k': 0.9075113945434787, 'spread_hl_frac': 0.042253566694863964, 'bb_std_mult': 1.6066679712580512, 'rsi_os': 32, 'rsi_ob': 70, 'vol_spike': 0.048370555378498326, 'adx_thresh': 34.28429764189154, 'atr_min_pct': 0.009154335206088155, 'atr_max_pct': 0.07049567967169494, 'tp_mult': 2.8290724634256996, 'tsl_mult': 0.8964490068961357, 'strategy': 'mean_reversion', 'time_stop': 289, 'use_sma': True, 'use_atr': False, 'use_adx': True, 'use_ema': False, 'use_spike': True, 'rsi_required': True, 'edge_k': 0.6890066677655711, 'edge_cap': 0.2210279364388837, 'bull_strategy': 'breakout', 'bull_bb_std_mult': 3.0914869446959226, 'bull_rsi_os': 30, 'bull_rsi_ob': 71, 'bull_adx_thresh': 10.029809378519161, 'bull_atr_min_pct': 0.011940403280226511, 'bull_atr_max_pct': 0.018058152508916077, 'bull_tp_mult': 2.6846916791249127, 'bull_tsl_mult': 0.28336281489478066, 'bull_time_stop': 244, 'bull_use_sma': False, 'bull_use_ema': True, 'bull_use_atr': True, 'bull_use_adx': True, 'bull_use_spike': False, 'bull_rsi_required': False, 'bear_strategy': 'mean_reversion', 'bear_bb_std_mult': 1.5726935076123125, 'bear_rsi_os': 31, 'bear_rsi_ob': 94, 'bear_adx_thresh': 31.326816550597428, 'bear_atr_min_pct': 0.016822368845670427, 'bear_atr_max_pct': 0.028645204589202854, 'bear_tp_mult': 1.7659918067612839, 'bear_tsl_mult': 0.8390589305698026, 'bear_time_stop': 289, 'bear_use_sma': True, 'bear_use_ema': True, 'bear_use_atr': True, 'bear_use_adx': False, 'bear_use_spike': False, 'bear_rsi_required': False, 'sideways_strategy': 'mean_reversion', 'sideways_bb_std_mult': 2.736444354581849, 'sideways_rsi_os': 7, 'sideways_rsi_ob': 77, 'sideways_adx_thresh': 20.671669627143867, 'sideways_atr_min_pct': 0.014354024605789944, 'sideways_atr_max_pct': 0.04237496030363753, 'sideways_tp_mult': 2.906831016402506, 'sideways_tsl_mult': 0.7663427059024751, 'sideways_time_stop': 12, 'sideways_use_sma': False, 'sideways_use_ema': True, 'sideways_use_atr': False, 'sideways_use_adx': False, 'sideways_use_spike': False, 'sideways_rsi_required': False}.
[I 2025-08-30 15:28:52,170] Trial 96 finished with values: [-1000000000.0, 1000000000.0] and parameters: {'p_sma': 37, 'p_std': 6, 'p_atr': 13, 'p_adx': 29, 'rsi_period': 13, 'ema1': 27, 'ema2': 48, 'slip_atr_k': 0.19790952244095766, 'slip_spread_k': 0.9135975105543013, 'spread_hl_frac': 0.021221610895031884, 'bb_std_mult': 1.6117905473131002, 'rsi_os': 38, 'rsi_ob': 70, 'vol_spike': 0.22187893430461075, 'adx_thresh': 24.23629146858989, 'atr_min_pct': 0.02100113947881268, 'atr_max_pct': 0.04871753180465807, 'tp_mult': 1.0117190623789991, 'tsl_mult': 0.8850086017006144, 'strategy': 'mean_reversion', 'time_stop': 290, 'use_sma': True, 'use_atr': False, 'use_adx': True, 'use_ema': False, 'use_spike': True, 'rsi_required': True, 'edge_k': 0.478549164094911, 'edge_cap': 0.9545408429346257, 'bull_strategy': 'breakout', 'bull_bb_std_mult': 3.277218264827639, 'bull_rsi_os': 29, 'bull_rsi_ob': 48, 'bull_adx_thresh': 10.274992468353325, 'bull_atr_min_pct': 0.01583400488516711, 'bull_atr_max_pct': 0.017809548102326274, 'bull_tp_mult': 2.6718121911749257, 'bull_tsl_mult': 0.7533399889789625, 'bull_time_stop': 245, 'bull_use_sma': True, 'bull_use_ema': True, 'bull_use_atr': True, 'bull_use_adx': True, 'bull_use_spike': False, 'bull_rsi_required': False, 'bear_strategy': 'mean_reversion', 'bear_bb_std_mult': 0.5288825535020465, 'bear_rsi_os': 31, 'bear_rsi_ob': 94, 'bear_adx_thresh': 34.165015036062314, 'bear_atr_min_pct': 0.02529476924218725, 'bear_atr_max_pct': 0.1462767331665338, 'bear_tp_mult': 2.1061050905330263, 'bear_tsl_mult': 0.20043444564089952, 'bear_time_stop': 167, 'bear_use_sma': True, 'bear_use_ema': True, 'bear_use_atr': True, 'bear_use_adx': False, 'bear_use_spike': False, 'bear_rsi_required': False, 'sideways_strategy': 'mean_reversion', 'sideways_bb_std_mult': 2.0312814407815023, 'sideways_rsi_os': 48, 'sideways_rsi_ob': 51, 'sideways_adx_thresh': 20.811115340444815, 'sideways_atr_min_pct': 0.01405276263278488, 'sideways_atr_max_pct': 0.10968091860576264, 'sideways_tp_mult': 1.3529251757864111, 'sideways_tsl_mult': 0.18663024356071475, 'sideways_time_stop': 96, 'sideways_use_sma': False, 'sideways_use_ema': True, 'sideways_use_atr': False, 'sideways_use_adx': True, 'sideways_use_spike': False, 'sideways_rsi_required': False}.
[I 2025-08-30 15:28:52,440] Trial 98 finished with values: [-0.033122978685087956, 0.03303727789521847] and parameters: {'p_sma': 32, 'p_std': 43, 'p_atr': 8, 'p_adx': 11, 'rsi_period': 43, 'ema1': 28, 'ema2': 54, 'slip_atr_k': 0.24229903179378434, 'slip_spread_k': 0.943825945890694, 'spread_hl_frac': 0.04557828090670937, 'bb_std_mult': 1.188189727889665, 'rsi_os': 32, 'rsi_ob': 78, 'vol_spike': 0.25054233354520894, 'adx_thresh': 32.270661462725336, 'atr_min_pct': 0.011958868342017367, 'atr_max_pct': 0.04054136466784335, 'tp_mult': 2.783480768393268, 'tsl_mult': 0.9316578960413386, 'strategy': 'mean_reversion', 'time_stop': 292, 'use_sma': True, 'use_atr': True, 'use_adx': True, 'use_ema': False, 'use_spike': True, 'rsi_required': True, 'edge_k': 0.6749877345317307, 'edge_cap': 0.9963963387605577, 'bull_strategy': 'breakout', 'bull_bb_std_mult': 3.2765480516336303, 'bull_rsi_os': 36, 'bull_rsi_ob': 71, 'bull_adx_thresh': 9.486670523482745, 'bull_atr_min_pct': 0.001330750562471372, 'bull_atr_max_pct': 0.01766362364461467, 'bull_tp_mult': 1.8818053682197369, 'bull_tsl_mult': 0.7487929101038255, 'bull_time_stop': 11, 'bull_use_sma': True, 'bull_use_ema': False, 'bull_use_atr': True, 'bull_use_adx': True, 'bull_use_spike': False, 'bull_rsi_required': False, 'bear_strategy': 'mean_reversion', 'bear_bb_std_mult': 0.5513378404942213, 'bear_rsi_os': 40, 'bear_rsi_ob': 77, 'bear_adx_thresh': 30.73053899500342, 'bear_atr_min_pct': 0.016440613619179124, 'bear_atr_max_pct': 0.023914136397114004, 'bear_tp_mult': 1.7664040469477122, 'bear_tsl_mult': 0.7914561567365649, 'bear_time_stop': 36, 'bear_use_sma': True, 'bear_use_ema': True, 'bear_use_atr': True, 'bear_use_adx': False, 'bear_use_spike': False, 'bear_rsi_required': False, 'sideways_strategy': 'breakout', 'sideways_bb_std_mult': 2.738042198358618, 'sideways_rsi_os': 26, 'sideways_rsi_ob': 77, 'sideways_adx_thresh': 29.762159513661498, 'sideways_atr_min_pct': 0.012643838556344017, 'sideways_atr_max_pct': 0.06502746528483161, 'sideways_tp_mult': 1.3544940007911013, 'sideways_tsl_mult': 0.18489705516612887, 'sideways_time_stop': 105, 'sideways_use_sma': False, 'sideways_use_ema': True, 'sideways_use_atr': True, 'sideways_use_adx': True, 'sideways_use_spike': False, 'sideways_rsi_required': False}.
[I 2025-08-30 15:28:52,557] Trial 97 finished with values: [-1000000000.0, 1000000000.0] and parameters: {'p_sma': 32, 'p_std': 6, 'p_atr': 8, 'p_adx': 9, 'rsi_period': 43, 'ema1': 26, 'ema2': 48, 'slip_atr_k': 0.2293240072704044, 'slip_spread_k': 0.931972428834425, 'spread_hl_frac': 0.010312142542974911, 'bb_std_mult': 2.683127915321699, 'rsi_os': 29, 'rsi_ob': 78, 'vol_spike': 0.23321589424720252, 'adx_thresh': 32.2845479053746, 'atr_min_pct': 0.012020367153606918, 'atr_max_pct': 0.05601694719338635, 'tp_mult': 2.9847538435512644, 'tsl_mult': 0.9323523618636379, 'strategy': 'mean_reversion', 'time_stop': 19, 'use_sma': True, 'use_atr': True, 'use_adx': True, 'use_ema': False, 'use_spike': True, 'rsi_required': True, 'edge_k': 0.6711682584306764, 'edge_cap': 0.23277276575215194, 'bull_strategy': 'breakout', 'bull_bb_std_mult': 1.9161158459511283, 'bull_rsi_os': 29, 'bull_rsi_ob': 70, 'bull_adx_thresh': 10.174675166286635, 'bull_atr_min_pct': 0.011905539203498159, 'bull_atr_max_pct': 0.05858195212044058, 'bull_tp_mult': 1.903367191740678, 'bull_tsl_mult': 0.7365674633212793, 'bull_time_stop': 203, 'bull_use_sma': True, 'bull_use_ema': False, 'bull_use_atr': True, 'bull_use_adx': True, 'bull_use_spike': False, 'bull_rsi_required': False, 'bear_strategy': 'mean_reversion', 'bear_bb_std_mult': 0.6023074885076414, 'bear_rsi_os': 27, 'bear_rsi_ob': 93, 'bear_adx_thresh': 32.64894325527631, 'bear_atr_min_pct': 0.016451485892383478, 'bear_atr_max_pct': 0.0710395388431026, 'bear_tp_mult': 1.3002167963325757, 'bear_tsl_mult': 0.2246126720076863, 'bear_time_stop': 175, 'bear_use_sma': True, 'bear_use_ema': True, 'bear_use_atr': True, 'bear_use_adx': False, 'bear_use_spike': False, 'bear_rsi_required': False, 'sideways_strategy': 'breakout', 'sideways_bb_std_mult': 2.6100349358419104, 'sideways_rsi_os': 7, 'sideways_rsi_ob': 91, 'sideways_adx_thresh': 20.737333637136782, 'sideways_atr_min_pct': 0.02817719497225734, 'sideways_atr_max_pct': 0.042921849816312675, 'sideways_tp_mult': 1.083168496211189, 'sideways_tsl_mult': 0.07561125171205152, 'sideways_time_stop': 106, 'sideways_use_sma': False, 'sideways_use_ema': True, 'sideways_use_atr': False, 'sideways_use_adx': True, 'sideways_use_spike': False, 'sideways_rsi_required': False}.
