[I 2025-08-30 15:18:47,375] Trial 45 finished with values: [-1000000000.0, 1000000000.0] and parameters: {'p_sma': 60, 'p_std': 20, 'p_atr': 26, 'p_adx': 30, 'rsi_period': 63, 'ema1': 19, 'ema2': 60, 'slip_atr_k': 0.15632286523281796, 'slip_spread_k': 0.7718557246742827, 'spread_hl_frac': 0.04913265271388061, 'bb_std_mult': 2.784064461888244, 'rsi_os': 30, 'rsi_ob': 63, 'vol_spike': 0.25453058521482863, 'adx_thresh': 12.698027593568423, 'atr_min_pct': 0.004399884814117573, 'atr_max_pct': 0.0659847823649346, 'tp_mult': 2.653714517506169, 'tsl_mult': 0.9263843744157825, 'strategy': 'mean_reversion', 'time_stop': 250, 'use_sma': True, 'use_atr': True, 'use_adx': True, 'use_ema': False, 'use_spike': False, 'rsi_required': True, 'edge_k': 0.7178926016629379, 'edge_cap': 0.8214324995659055, 'bull_strategy': 'breakout', 'bull_bb_std_mult': 3.2840548566786563, 'bull_rsi_os': 35, 'bull_rsi_ob': 58, 'bull_adx_thresh': 13.386650754734685, 'bull_atr_min_pct': 0.016211240269031334, 'bull_atr_max_pct': 0.045914592220633293, 'bull_tp_mult': 2.120620783599947, 'bull_tsl_mult': 0.004606542462070151, 'bull_time_stop': 268, 'bull_use_sma': False, 'bull_use_ema': False, 'bull_use_atr': True, 'bull_use_adx': True, 'bull_use_spike': False, 'bull_rsi_required': False, 'bear_strategy': 'mean_reversion', 'bear_bb_std_mult': 0.9013315645584014, 'bear_rsi_os': 25, 'bear_rsi_ob': 91, 'bear_adx_thresh': 32.74792137950494, 'bear_atr_min_pct': 0.005712331321593961, 'bear_atr_max_pct': 0.08172749611432048, 'bear_tp_mult': 1.208843128360729, 'bear_tsl_mult': 0.6352358885491433, 'bear_time_stop': 41, 'bear_use_sma': True, 'bear_use_ema': True, 'bear_use_atr': True, 'bear_use_adx': False, 'bear_use_spike': False, 'bear_rsi_required': False, 'sideways_strategy': 'breakout', 'sideways_bb_std_mult': 2.6365622623567315, 'sideways_rsi_os': 31, 'sideways_rsi_ob': 58, 'sideways_adx_thresh': 21.18990608482048, 'sideways_atr_min_pct': 0.014494739893304394, 'sideways_atr_max_pct': 0.06389962517212841, 'sideways_tp_mult': 1.3346320286317908, 'sideways_tsl_mult': 0.20796152517941646, 'sideways_time_stop': 223, 'sideways_use_sma': False, 'sideways_use_ema': True, 'sideways_use_atr': False, 'sideways_use_adx': False, 'sideways_use_spike': False, 'sideways_rsi_required': False}.
[I 2025-08-30 15:18:49,950] Trial 49 finished with values: [-1000000000.0, 1000000000.0] and parameters: {'p_sma': 28, 'p_std': 50, 'p_atr': 29, 'p_adx': 17, 'rsi_period': 78, 'ema1': 22, 'ema2': 32, 'slip_atr_k': 0.03438102044412421, 'slip_spread_k': 0.916638257091532, 'spread_hl_frac': 0.03919895855618529, 'bb_std_mult': 2.990034734515201, 'rsi_os': 52, 'rsi_ob': 82, 'vol_spike': 0.15536348495267882, 'adx_thresh': 33.947479837205606, 'atr_min_pct': 0.010661702972316271, 'atr_max_pct': 0.01095571881340629, 'tp_mult': 1.873527169851503, 'tsl_mult': 0.8269534549914539, 'strategy': 'mean_reversion', 'time_stop': 169, 'use_sma': False, 'use_atr': False, 'use_adx': False, 'use_ema': False, 'use_spike': False, 'rsi_required': False, 'edge_k': 1.2079545060679147, 'edge_cap': 0.8924244805028532, 'bull_strategy': 'breakout', 'bull_bb_std_mult': 0.930774491674424, 'bull_rsi_os': 30, 'bull_rsi_ob': 85, 'bull_adx_thresh': 17.778694858010375, 'bull_atr_min_pct': 0.022637857001257665, 'bull_atr_max_pct': 0.017320750963678792, 'bull_tp_mult': 1.8694439043911977, 'bull_tsl_mult': 0.7188487957954818, 'bull_time_stop': 15, 'bull_use_sma': False, 'bull_use_ema': True, 'bull_use_atr': True, 'bull_use_adx': True, 'bull_use_spike': True, 'bull_rsi_required': False, 'bear_strategy': 'mean_reversion', 'bear_bb_std_mult': 0.7901934916270399, 'bear_rsi_os': 43, 'bear_rsi_ob': 64, 'bear_adx_thresh': 25.53282426833413, 'bear_atr_min_pct': 0.019668314523344502, 'bear_atr_max_pct': 0.06756605807666251, 'bear_tp_mult': 2.169039248539629, 'bear_tsl_mult': 0.7632344862096674, 'bear_time_stop': 21, 'bear_use_sma': True, 'bear_use_ema': True, 'bear_use_atr': True, 'bear_use_adx': False, 'bear_use_spike': False, 'bear_rsi_required': False, 'sideways_strategy': 'breakout', 'sideways_bb_std_mult': 0.5674696030505162, 'sideways_rsi_os': 49, 'sideways_rsi_ob': 45, 'sideways_adx_thresh': 29.829343905347553, 'sideways_atr_min_pct': 0.02720957232013653, 'sideways_atr_max_pct': 0.01767019583930858, 'sideways_tp_mult': 1.1326938937395017, 'sideways_tsl_mult': 0.45797307416232114, 'sideways_time_stop': 85, 'sideways_use_sma': True, 'sideways_use_ema': False, 'sideways_use_atr': True, 'sideways_use_adx': False, 'sideways_use_spike': False, 'sideways_rsi_required': False}.
[I 2025-08-30 15:18:56,959] Trial 47 finished with values: [-1000000000.0, 1000000000.0] and parameters: {'p_sma': 38, 'p_std': 8, 'p_atr': 26, 'p_adx': 15, 'rsi_period': 68, 'ema1': 19, 'ema2': 53, 'slip_atr_k': 0.009389951921140144, 'slip_spread_k': 0.933864837321046, 'spread_hl_frac': 0.03956366209577594, 'bb_std_mult': 1.3985441562126943, 'rsi_os': 28, 'rsi_ob': 63, 'vol_spike': 0.15409516125971764, 'adx_thresh': 34.875648374851934, 'atr_min_pct': 0.00502340659319399, 'atr_max_pct': 0.0660939976311234, 'tp_mult': 2.6268273231475536, 'tsl_mult': 0.9166553386041778, 'strategy': 'mean_reversion', 'time_stop': 255, 'use_sma': False, 'use_atr': True, 'use_adx': False, 'use_ema': False, 'use_spike': False, 'rsi_required': False, 'edge_k': 0.7091375363618204, 'edge_cap': 0.7128126244302578, 'bull_strategy': 'breakout', 'bull_bb_std_mult': 0.5271327044315799, 'bull_rsi_os': 30, 'bull_rsi_ob': 86, 'bull_adx_thresh': 6.3146846000544326, 'bull_atr_min_pct': 0.016569137671217916, 'bull_atr_max_pct': 0.04468097927784273, 'bull_tp_mult': 2.079133047074358, 'bull_tsl_mult': 0.0030750132483436388, 'bull_time_stop': 272, 'bull_use_sma': False, 'bull_use_ema': True, 'bull_use_atr': True, 'bull_use_adx': True, 'bull_use_spike': False, 'bull_rsi_required': False, 'bear_strategy': 'mean_reversion', 'bear_bb_std_mult': 0.753494435587645, 'bear_rsi_os': 26, 'bear_rsi_ob': 91, 'bear_adx_thresh': 25.286481180308453, 'bear_atr_min_pct': 0.00375555319905483, 'bear_atr_max_pct': 0.06588932552352918, 'bear_tp_mult': 2.110078358621336, 'bear_tsl_mult': 0.59346902805781, 'bear_time_stop': 47, 'bear_use_sma': True, 'bear_use_ema': True, 'bear_use_atr': True, 'bear_use_adx': False, 'bear_use_spike': False, 'bear_rsi_required': False, 'sideways_strategy': 'breakout', 'sideways_bb_std_mult': 0.5046069092270833, 'sideways_rsi_os': 29, 'sideways_rsi_ob': 59, 'sideways_adx_thresh': 21.073487634729215, 'sideways_atr_min_pct': 0.014963394278557607, 'sideways_atr_max_pct': 0.11907083367120544, 'sideways_tp_mult': 1.325807901866093, 'sideways_tsl_mult': 0.21760724509136614, 'sideways_time_stop': 214, 'sideways_use_sma': False, 'sideways_use_ema': False, 'sideways_use_atr': False, 'sideways_use_adx': False, 'sideways_use_spike': False, 'sideways_rsi_required': False}.
[I 2025-08-30 15:19:00,210] Trial 46 finished with values: [-1000000000.0, 1000000000.0] and parameters: {'p_sma': 50, 'p_std': 9, 'p_atr': 26, 'p_adx': 18, 'rsi_period': 83, 'ema1': 19, 'ema2': 59, 'slip_atr_k': 0.11067378083800714, 'slip_spread_k': 0.9163063662021873, 'spread_hl_frac': 0.03291650263774067, 'bb_std_mult': 2.8546690073461445, 'rsi_os': 28, 'rsi_ob': 62, 'vol_spike': 0.2563686433175836, 'adx_thresh': 13.197939301146961, 'atr_min_pct': 0.02202345594440142, 'atr_max_pct': 0.06566507697214786, 'tp_mult': 2.6520164978611147, 'tsl_mult': 0.9050825160747975, 'strategy': 'mean_reversion', 'time_stop': 254, 'use_sma': False, 'use_atr': False, 'use_adx': True, 'use_ema': False, 'use_spike': False, 'rsi_required': True, 'edge_k': 0.6613455640339094, 'edge_cap': 0.821610935500334, 'bull_strategy': 'breakout', 'bull_bb_std_mult': 3.340573962104047, 'bull_rsi_os': 19, 'bull_rsi_ob': 85, 'bull_adx_thresh': 12.98493776889121, 'bull_atr_min_pct': 0.017201251478275267, 'bull_atr_max_pct': 0.04361323933572773, 'bull_tp_mult': 1.8792115306728798, 'bull_tsl_mult': 0.2933121193636803, 'bull_time_stop': 280, 'bull_use_sma': False, 'bull_use_ema': False, 'bull_use_atr': True, 'bull_use_adx': True, 'bull_use_spike': False, 'bull_rsi_required': False, 'bear_strategy': 'mean_reversion', 'bear_bb_std_mult': 0.9175622460154789, 'bear_rsi_os': 26, 'bear_rsi_ob': 91, 'bear_adx_thresh': 29.868878607669373, 'bear_atr_min_pct': 0.005173490260821985, 'bear_atr_max_pct': 0.13819353666251177, 'bear_tp_mult': 1.234398557927434, 'bear_tsl_mult': 0.5841335005208037, 'bear_time_stop': 39, 'bear_use_sma': True, 'bear_use_ema': True, 'bear_use_atr': True, 'bear_use_adx': False, 'bear_use_spike': False, 'bear_rsi_required': False, 'sideways_strategy': 'breakout', 'sideways_bb_std_mult': 0.5059958012270016, 'sideways_rsi_os': 30, 'sideways_rsi_ob': 59, 'sideways_adx_thresh': 18.454792364305266, 'sideways_atr_min_pct': 0.015512890703717367, 'sideways_atr_max_pct': 0.06202784131850461, 'sideways_tp_mult': 1.312089836571767, 'sideways_tsl_mult': 0.21788086108206445, 'sideways_time_stop': 233, 'sideways_use_sma': False, 'sideways_use_ema': True, 'sideways_use_atr': False, 'sideways_use_adx': False, 'sideways_use_spike': False, 'sideways_rsi_required': False}.
[I 2025-08-30 15:19:00,558] Trial 48 finished with values: [-1000000000.0, 1000000000.0] and parameters: {'p_sma': 30, 'p_std': 49, 'p_atr': 29, 'p_adx': 14, 'rsi_period': 68, 'ema1': 20, 'ema2': 32, 'slip_atr_k': 0.10908998326998816, 'slip_spread_k': 0.92707062562065, 'spread_hl_frac': 0.03330504684765257, 'bb_std_mult': 2.833061092737187, 'rsi_os': 30, 'rsi_ob': 61, 'vol_spike': 0.15597266831872694, 'adx_thresh': 34.91542133675375, 'atr_min_pct': 0.00568885864277582, 'atr_max_pct': 0.06337711797754526, 'tp_mult': 1.8696110666318344, 'tsl_mult': 0.8276216974419366, 'strategy': 'mean_reversion', 'time_stop': 257, 'use_sma': False, 'use_atr': False, 'use_adx': False, 'use_ema': False, 'use_spike': False, 'rsi_required': False, 'edge_k': 0.24772072041448995, 'edge_cap': 0.7310574034289109, 'bull_strategy': 'breakout', 'bull_bb_std_mult': 0.5982863153710121, 'bull_rsi_os': 19, 'bull_rsi_ob': 85, 'bull_adx_thresh': 13.502621372895183, 'bull_atr_min_pct': 0.01642372663812036, 'bull_atr_max_pct': 0.018538372194606335, 'bull_tp_mult': 1.598716468086201, 'bull_tsl_mult': 0.3022425284955851, 'bull_time_stop': 271, 'bull_use_sma': False, 'bull_use_ema': True, 'bull_use_atr': True, 'bull_use_adx': True, 'bull_use_spike': False, 'bull_rsi_required': False, 'bear_strategy': 'mean_reversion', 'bear_bb_std_mult': 0.7871366602144625, 'bear_rsi_os': 32, 'bear_rsi_ob': 62, 'bear_adx_thresh': 25.690167446445724, 'bear_atr_min_pct': 0.02159108587437262, 'bear_atr_max_pct': 0.0692790721587106, 'bear_tp_mult': 2.1673191067722763, 'bear_tsl_mult': 0.6623002163494093, 'bear_time_stop': 19, 'bear_use_sma': True, 'bear_use_ema': True, 'bear_use_atr': True, 'bear_use_adx': False, 'bear_use_spike': False, 'bear_rsi_required': False, 'sideways_strategy': 'breakout', 'sideways_bb_std_mult': 2.6497801736684785, 'sideways_rsi_os': 33, 'sideways_rsi_ob': 58, 'sideways_adx_thresh': 21.335623731073266, 'sideways_atr_min_pct': 0.026829447834703105, 'sideways_atr_max_pct': 0.014373341797168107, 'sideways_tp_mult': 2.9871230420771466, 'sideways_tsl_mult': 0.3158818360416773, 'sideways_time_stop': 298, 'sideways_use_sma': False, 'sideways_use_ema': False, 'sideways_use_atr': False, 'sideways_use_adx': False, 'sideways_use_spike': False, 'sideways_rsi_required': False}.
[I 2025-08-30 15:19:34,692] Trial 50 finished with values: [-1000000000.0, 1000000000.0] and parameters: {'p_sma': 31, 'p_std': 39, 'p_atr': 27, 'p_adx': 14, 'rsi_period': 70, 'ema1': 7, 'ema2': 47, 'slip_atr_k': 0.009157677357917421, 'slip_spread_k': 0.9733506303251458, 'spread_hl_frac': 0.033384469016317, 'bb_std_mult': 1.4492437911722251, 'rsi_os': 40, 'rsi_ob': 77, 'vol_spike': 0.2864475864777459, 'adx_thresh': 5.21879030836876, 'atr_min_pct': 0.0054806352576379745, 'atr_max_pct': 0.04311096384366574, 'tp_mult': 2.134982296075464, 'tsl_mult': 0.9322094047603582, 'strategy': 'mean_reversion', 'time_stop': 283, 'use_sma': False, 'use_atr': False, 'use_adx': False, 'use_ema': False, 'use_spike': False, 'rsi_required': False, 'edge_k': 0.2935623971445521, 'edge_cap': 0.7165371279894617, 'bull_strategy': 'breakout', 'bull_bb_std_mult': 1.7426382260679867, 'bull_rsi_os': 18, 'bull_rsi_ob': 65, 'bull_adx_thresh': 7.317084913487818, 'bull_atr_min_pct': 0.014389637848365234, 'bull_atr_max_pct': 0.057493753223462854, 'bull_tp_mult': 1.5605909498242503, 'bull_tsl_mult': 0.2872542217790813, 'bull_time_stop': 191, 'bull_use_sma': False, 'bull_use_ema': True, 'bull_use_atr': True, 'bull_use_adx': True, 'bull_use_spike': False, 'bull_rsi_required': False, 'bear_strategy': 'mean_reversion', 'bear_bb_std_mult': 1.3686729600151701, 'bear_rsi_os': 31, 'bear_rsi_ob': 50, 'bear_adx_thresh': 29.293313643716196, 'bear_atr_min_pct': 0.007206352959579912, 'bear_atr_max_pct': 0.1399427865986337, 'bear_tp_mult': 1.9375154499384173, 'bear_tsl_mult': 0.5605692914050882, 'bear_time_stop': 47, 'bear_use_sma': True, 'bear_use_ema': True, 'bear_use_atr': True, 'bear_use_adx': False, 'bear_use_spike': False, 'bear_rsi_required': False, 'sideways_strategy': 'breakout', 'sideways_bb_std_mult': 1.0725779681665566, 'sideways_rsi_os': 24, 'sideways_rsi_ob': 74, 'sideways_adx_thresh': 34.781917899317406, 'sideways_atr_min_pct': 0.00734411839325936, 'sideways_atr_max_pct': 0.12056114471701684, 'sideways_tp_mult': 1.301227141329641, 'sideways_tsl_mult': 0.004067696351177638, 'sideways_time_stop': 143, 'sideways_use_sma': False, 'sideways_use_ema': False, 'sideways_use_atr': False, 'sideways_use_adx': False, 'sideways_use_spike': False, 'sideways_rsi_required': False}.
[I 2025-08-30 15:19:50,044] Trial 51 finished with values: [-1000000000.0, 1000000000.0] and parameters: {'p_sma': 31, 'p_std': 39, 'p_atr': 29, 'p_adx': 12, 'rsi_period': 47, 'ema1': 7, 'ema2': 47, 'slip_atr_k': 0.11528348020729577, 'slip_spread_k': 0.6512102426505576, 'spread_hl_frac': 0.03333894104591342, 'bb_std_mult': 2.416268070836024, 'rsi_os': 24, 'rsi_ob': 55, 'vol_spike': 0.28911181456932133, 'adx_thresh': 12.688729595295996, 'atr_min_pct': 0.02536088575556613, 'atr_max_pct': 0.0784976034750745, 'tp_mult': 1.0613312619040551, 'tsl_mult': 0.01833771772460341, 'strategy': 'mean_reversion', 'time_stop': 285, 'use_sma': False, 'use_atr': False, 'use_adx': True, 'use_ema': False, 'use_spike': False, 'rsi_required': True, 'edge_k': 0.44149761447794034, 'edge_cap': 0.4046632805564752, 'bull_strategy': 'breakout', 'bull_bb_std_mult': 1.8228548900287322, 'bull_rsi_os': 19, 'bull_rsi_ob': 63, 'bull_adx_thresh': 27.185675747065446, 'bull_atr_min_pct': 0.014441446954964486, 'bull_atr_max_pct': 0.06508954921602257, 'bull_tp_mult': 1.5545160877048538, 'bull_tsl_mult': 0.30226856786424566, 'bull_time_stop': 192, 'bull_use_sma': False, 'bull_use_ema': True, 'bull_use_atr': True, 'bull_use_adx': True, 'bull_use_spike': True, 'bull_rsi_required': False, 'bear_strategy': 'mean_reversion', 'bear_bb_std_mult': 3.294705195478519, 'bear_rsi_os': 28, 'bear_rsi_ob': 85, 'bear_adx_thresh': 29.012360389484392, 'bear_atr_min_pct': 0.029932324072402754, 'bear_atr_max_pct': 0.13739829735164275, 'bear_tp_mult': 1.8786597571992423, 'bear_tsl_mult': 0.5489840203792469, 'bear_time_stop': 15, 'bear_use_sma': True, 'bear_use_ema': True, 'bear_use_atr': False, 'bear_use_adx': False, 'bear_use_spike': False, 'bear_rsi_required': False, 'sideways_strategy': 'breakout', 'sideways_bb_std_mult': 0.8337001562313804, 'sideways_rsi_os': 46, 'sideways_rsi_ob': 72, 'sideways_adx_thresh': 25.912609904238142, 'sideways_atr_min_pct': 0.007936192556386522, 'sideways_atr_max_pct': 0.035095885188006555, 'sideways_tp_mult': 1.1200936985953267, 'sideways_tsl_mult': 0.7652069096905267, 'sideways_time_stop': 147, 'sideways_use_sma': True, 'sideways_use_ema': True, 'sideways_use_atr': True, 'sideways_use_adx': False, 'sideways_use_spike': False, 'sideways_rsi_required': False}.
[I 2025-08-30 15:19:51,141] Trial 53 finished with values: [-1000000000.0, 1000000000.0] and parameters: {'p_sma': 31, 'p_std': 16, 'p_atr': 27, 'p_adx': 9, 'rsi_period': 46, 'ema1': 15, 'ema2': 47, 'slip_atr_k': 0.1254118132413607, 'slip_spread_k': 0.9952905891308266, 'spread_hl_frac': 0.044881264021678746, 'bb_std_mult': 1.385151403919155, 'rsi_os': 41, 'rsi_ob': 54, 'vol_spike': 0.28419521971784306, 'adx_thresh': 7.494242989114001, 'atr_min_pct': 0.024808711221298296, 'atr_max_pct': 0.1151111904195958, 'tp_mult': 2.1243496666127784, 'tsl_mult': 0.07635917823551991, 'strategy': 'mean_reversion', 'time_stop': 136, 'use_sma': True, 'use_atr': False, 'use_adx': True, 'use_ema': False, 'use_spike': True, 'rsi_required': True, 'edge_k': 0.445588033919014, 'edge_cap': 0.6549410038721513, 'bull_strategy': 'breakout', 'bull_bb_std_mult': 1.159006558700089, 'bull_rsi_os': 16, 'bull_rsi_ob': 51, 'bull_adx_thresh': 25.31730214897054, 'bull_atr_min_pct': 0.01404359808990262, 'bull_atr_max_pct': 0.073833517486368, 'bull_tp_mult': 1.0445989785489471, 'bull_tsl_mult': 0.7585354215780654, 'bull_time_stop': 246, 'bull_use_sma': False, 'bull_use_ema': True, 'bull_use_atr': True, 'bull_use_adx': True, 'bull_use_spike': True, 'bull_rsi_required': False, 'bear_strategy': 'mean_reversion', 'bear_bb_std_mult': 3.2160548418952137, 'bear_rsi_os': 45, 'bear_rsi_ob': 48, 'bear_adx_thresh': 5.0582745395201325, 'bear_atr_min_pct': 0.029490693566920897, 'bear_atr_max_pct': 0.09652839093936083, 'bear_tp_mult': 1.8936809909207497, 'bear_tsl_mult': 0.7776094732520381, 'bear_time_stop': 280, 'bear_use_sma': True, 'bear_use_ema': True, 'bear_use_atr': False, 'bear_use_adx': False, 'bear_use_spike': False, 'bear_rsi_required': False, 'sideways_strategy': 'breakout', 'sideways_bb_std_mult': 0.7194605124895741, 'sideways_rsi_os': 24, 'sideways_rsi_ob': 72, 'sideways_adx_thresh': 34.651348338994175, 'sideways_atr_min_pct': 0.005587418568612486, 'sideways_atr_max_pct': 0.08713862282918947, 'sideways_tp_mult': 1.4585760178384122, 'sideways_tsl_mult': 0.0059120629996113755, 'sideways_time_stop': 140, 'sideways_use_sma': True, 'sideways_use_ema': True, 'sideways_use_atr': True, 'sideways_use_adx': True, 'sideways_use_spike': False, 'sideways_rsi_required': True}.
[I 2025-08-30 15:19:51,428] Trial 52 finished with values: [-1000000000.0, 1000000000.0] and parameters: {'p_sma': 31, 'p_std': 16, 'p_atr': 29, 'p_adx': 12, 'rsi_period': 46, 'ema1': 15, 'ema2': 46, 'slip_atr_k': 0.07122784298491461, 'slip_spread_k': 0.994252049608784, 'spread_hl_frac': 0.04530898845131242, 'bb_std_mult': 2.161226731723527, 'rsi_os': 24, 'rsi_ob': 78, 'vol_spike': 0.28732368480598697, 'adx_thresh': 30.70789863708547, 'atr_min_pct': 0.02571405308950655, 'atr_max_pct': 0.042211530227322755, 'tp_mult': 2.1333705621165757, 'tsl_mult': 0.054676219462273246, 'strategy': 'mean_reversion', 'time_stop': 135, 'use_sma': True, 'use_atr': False, 'use_adx': False, 'use_ema': False, 'use_spike': True, 'rsi_required': False, 'edge_k': 0.3146512521719125, 'edge_cap': 0.428894991744568, 'bull_strategy': 'breakout', 'bull_bb_std_mult': 1.8678491853290187, 'bull_rsi_os': 14, 'bull_rsi_ob': 51, 'bull_adx_thresh': 27.158365220566647, 'bull_atr_min_pct': 0.014506447329275121, 'bull_atr_max_pct': 0.13548691707060667, 'bull_tp_mult': 1.0230428093661015, 'bull_tsl_mult': 0.3079839987517018, 'bull_time_stop': 193, 'bull_use_sma': False, 'bull_use_ema': True, 'bull_use_atr': True, 'bull_use_adx': True, 'bull_use_spike': True, 'bull_rsi_required': False, 'bear_strategy': 'mean_reversion', 'bear_bb_std_mult': 3.340597879872182, 'bear_rsi_os': 32, 'bear_rsi_ob': 50, 'bear_adx_thresh': 6.315019587847258, 'bear_atr_min_pct': 0.00796474660238985, 'bear_atr_max_pct': 0.0580331709950231, 'bear_tp_mult': 1.949128590627738, 'bear_tsl_mult': 0.7656235490929576, 'bear_time_stop': 17, 'bear_use_sma': True, 'bear_use_ema': True, 'bear_use_atr': False, 'bear_use_adx': False, 'bear_use_spike': False, 'bear_rsi_required': False, 'sideways_strategy': 'breakout', 'sideways_bb_std_mult': 3.320644692409047, 'sideways_rsi_os': 34, 'sideways_rsi_ob': 72, 'sideways_adx_thresh': 34.86846757350997, 'sideways_atr_min_pct': 0.0071700905321457255, 'sideways_atr_max_pct': 0.033413262983144836, 'sideways_tp_mult': 2.9302965803620666, 'sideways_tsl_mult': 0.33796370444541185, 'sideways_time_stop': 156, 'sideways_use_sma': True, 'sideways_use_ema': False, 'sideways_use_atr': True, 'sideways_use_adx': False, 'sideways_use_spike': False, 'sideways_rsi_required': True}.
