[I 2025-08-30 17:15:20,097] Trial 684 finished with values: [-1000000000.0, 1000000000.0] and parameters: {'p_sma': 5, 'p_std': 22, 'p_atr': 16, 'p_adx': 9, 'rsi_period': 24, 'ema1': 11, 'ema2': 11, 'slip_atr_k': 0.037865882053687905, 'slip_spread_k': 0.17404071231600116, 'spread_hl_frac': 0.040950873423681505, 'bb_std_mult': 0.7624538684177857, 'rsi_os': 32, 'rsi_ob': 46, 'vol_spike': 0.08551250567614975, 'adx_thresh': 32.02679666771866, 'atr_min_pct': 0.014441634963791009, 'atr_max_pct': 0.03467341091137507, 'tp_mult': 2.739209789433126, 'tsl_mult': 0.8803390361421833, 'strategy': 'breakout', 'time_stop': 33, 'use_sma': True, 'use_atr': True, 'use_adx': True, 'use_ema': False, 'use_spike': False, 'rsi_required': False, 'edge_k': 0.7948285826403582, 'edge_cap': 0.9295993306412622, 'bull_strategy': 'breakout', 'bull_bb_std_mult': 1.79618550114181, 'bull_rsi_os': 12, 'bull_rsi_ob': 52, 'bull_adx_thresh': 34.40362574392216, 'bull_atr_min_pct': 0.0033851947573065415, 'bull_atr_max_pct': 0.10464950942141496, 'bull_tp_mult': 2.241695633349653, 'bull_tsl_mult': 0.8006950181809461, 'bull_time_stop': 71, 'bull_use_sma': True, 'bull_use_ema': True, 'bull_use_atr': False, 'bull_use_adx': True, 'bull_use_spike': True, 'bull_rsi_required': False, 'bear_strategy': 'mean_reversion', 'bear_bb_std_mult': 0.7570851706873749, 'bear_rsi_os': 18, 'bear_rsi_ob': 74, 'bear_adx_thresh': 12.591197855458176, 'bear_atr_min_pct': 0.013656472924522415, 'bear_atr_max_pct': 0.12263439138086218, 'bear_tp_mult': 2.240594803135451, 'bear_tsl_mult': 0.6667776196929633, 'bear_time_stop': 208, 'bear_use_sma': True, 'bear_use_ema': False, 'bear_use_atr': False, 'bear_use_adx': True, 'bear_use_spike': True, 'bear_rsi_required': True, 'sideways_strategy': 'breakout', 'sideways_bb_std_mult': 0.7184794778549148, 'sideways_rsi_os': 33, 'sideways_rsi_ob': 53, 'sideways_adx_thresh': 11.769096343973974, 'sideways_atr_min_pct': 0.010293237688288678, 'sideways_atr_max_pct': 0.0929324704400045, 'sideways_tp_mult': 2.962897395708832, 'sideways_tsl_mult': 0.9398838063831944, 'sideways_time_stop': 283, 'sideways_use_sma': True, 'sideways_use_ema': False, 'sideways_use_atr': False, 'sideways_use_adx': False, 'sideways_use_spike': False, 'sideways_rsi_required': True}.
[I 2025-08-30 17:15:20,895] Trial 685 finished with values: [-1000000000.0, 1000000000.0] and parameters: {'p_sma': 5, 'p_std': 19, 'p_atr': 15, 'p_adx': 8, 'rsi_period': 24, 'ema1': 18, 'ema2': 35, 'slip_atr_k': 0.040021747868192445, 'slip_spread_k': 0.14939741334042683, 'spread_hl_frac': 0.017022069009549418, 'bb_std_mult': 2.018548400326431, 'rsi_os': 8, 'rsi_ob': 84, 'vol_spike': 0.0845776093976819, 'adx_thresh': 23.38704382029696, 'atr_min_pct': 0.019860902335760714, 'atr_max_pct': 0.14343270834714555, 'tp_mult': 1.5227299129502017, 'tsl_mult': 0.8817422831498002, 'strategy': 'breakout', 'time_stop': 133, 'use_sma': True, 'use_atr': True, 'use_adx': True, 'use_ema': True, 'use_spike': True, 'rsi_required': False, 'edge_k': 0.08488225551114592, 'edge_cap': 0.9386791510664705, 'bull_strategy': 'breakout', 'bull_bb_std_mult': 1.8350258467294287, 'bull_rsi_os': 9, 'bull_rsi_ob': 85, 'bull_adx_thresh': 32.89647698371828, 'bull_atr_min_pct': 0.007696021585397746, 'bull_atr_max_pct': 0.012532373687819731, 'bull_tp_mult': 2.1439582450121453, 'bull_tsl_mult': 0.7976776782360571, 'bull_time_stop': 45, 'bull_use_sma': True, 'bull_use_ema': False, 'bull_use_atr': False, 'bull_use_adx': True, 'bull_use_spike': True, 'bull_rsi_required': False, 'bear_strategy': 'breakout', 'bear_bb_std_mult': 0.784006602778679, 'bear_rsi_os': 18, 'bear_rsi_ob': 74, 'bear_adx_thresh': 12.895876646099667, 'bear_atr_min_pct': 0.01989142258186985, 'bear_atr_max_pct': 0.11281846075081588, 'bear_tp_mult': 2.212250972204078, 'bear_tsl_mult': 0.8646814218075691, 'bear_time_stop': 207, 'bear_use_sma': True, 'bear_use_ema': False, 'bear_use_atr': True, 'bear_use_adx': True, 'bear_use_spike': True, 'bear_rsi_required': True, 'sideways_strategy': 'breakout', 'sideways_bb_std_mult': 0.8253841752048464, 'sideways_rsi_os': 51, 'sideways_rsi_ob': 93, 'sideways_adx_thresh': 9.977200859944558, 'sideways_atr_min_pct': 0.004475086595724875, 'sideways_atr_max_pct': 0.09016297314817318, 'sideways_tp_mult': 2.806946604304305, 'sideways_tsl_mult': 0.36015556971341894, 'sideways_time_stop': 283, 'sideways_use_sma': True, 'sideways_use_ema': True, 'sideways_use_atr': False, 'sideways_use_adx': False, 'sideways_use_spike': True, 'sideways_rsi_required': True}.
[I 2025-08-30 17:15:21,078] Trial 686 finished with values: [-1000000000.0, 1000000000.0] and parameters: {'p_sma': 5, 'p_std': 19, 'p_atr': 15, 'p_adx': 10, 'rsi_period': 25, 'ema1': 19, 'ema2': 23, 'slip_atr_k': 0.23415452257248687, 'slip_spread_k': 0.17657201353439467, 'spread_hl_frac': 0.03189423460585274, 'bb_std_mult': 3.25510211545993, 'rsi_os': 8, 'rsi_ob': 84, 'vol_spike': 0.109341213793178, 'adx_thresh': 17.869754634218058, 'atr_min_pct': 0.019733731973404403, 'atr_max_pct': 0.14305262602270116, 'tp_mult': 2.7214570535140057, 'tsl_mult': 0.9487682735801573, 'strategy': 'breakout', 'time_stop': 188, 'use_sma': True, 'use_atr': True, 'use_adx': True, 'use_ema': True, 'use_spike': True, 'rsi_required': False, 'edge_k': 0.5785591324716175, 'edge_cap': 0.9354555114300347, 'bull_strategy': 'breakout', 'bull_bb_std_mult': 1.777118265242232, 'bull_rsi_os': 9, 'bull_rsi_ob': 52, 'bull_adx_thresh': 34.358003333423305, 'bull_atr_min_pct': 0.021800767070862707, 'bull_atr_max_pct': 0.0430838718550107, 'bull_tp_mult': 2.148044199616731, 'bull_tsl_mult': 0.8016470475375796, 'bull_time_stop': 140, 'bull_use_sma': True, 'bull_use_ema': False, 'bull_use_atr': False, 'bull_use_adx': True, 'bull_use_spike': True, 'bull_rsi_required': True, 'bear_strategy': 'breakout', 'bear_bb_std_mult': 1.1448947590141927, 'bear_rsi_os': 42, 'bear_rsi_ob': 92, 'bear_adx_thresh': 12.877868402055935, 'bear_atr_min_pct': 0.025009302913922695, 'bear_atr_max_pct': 0.12162542337756967, 'bear_tp_mult': 2.0791683153518252, 'bear_tsl_mult': 0.6523394100252969, 'bear_time_stop': 206, 'bear_use_sma': False, 'bear_use_ema': False, 'bear_use_atr': True, 'bear_use_adx': True, 'bear_use_spike': True, 'bear_rsi_required': True, 'sideways_strategy': 'breakout', 'sideways_bb_std_mult': 0.7245540337905663, 'sideways_rsi_os': 33, 'sideways_rsi_ob': 93, 'sideways_adx_thresh': 10.142490963097094, 'sideways_atr_min_pct': 0.009446028013290789, 'sideways_atr_max_pct': 0.09317586862621512, 'sideways_tp_mult': 2.96339910684032, 'sideways_tsl_mult': 0.46254250549749043, 'sideways_time_stop': 282, 'sideways_use_sma': True, 'sideways_use_ema': True, 'sideways_use_atr': True, 'sideways_use_adx': True, 'sideways_use_spike': True, 'sideways_rsi_required': False}.
[I 2025-08-30 17:15:22,065] Trial 690 finished with values: [-1000000000.0, 1000000000.0] and parameters: {'p_sma': 10, 'p_std': 21, 'p_atr': 16, 'p_adx': 10, 'rsi_period': 63, 'ema1': 18, 'ema2': 56, 'slip_atr_k': 0.187667284476477, 'slip_spread_k': 0.14712830879936176, 'spread_hl_frac': 0.019671025837491214, 'bb_std_mult': 3.1687332109135156, 'rsi_os': 19, 'rsi_ob': 87, 'vol_spike': 0.09338180301243508, 'adx_thresh': 19.8974810214255, 'atr_min_pct': 0.02443725734842962, 'atr_max_pct': 0.01872502362189714, 'tp_mult': 1.9229299721705961, 'tsl_mult': 0.9211225233775446, 'strategy': 'mean_reversion', 'time_stop': 74, 'use_sma': False, 'use_atr': True, 'use_adx': True, 'use_ema': False, 'use_spike': False, 'rsi_required': True, 'edge_k': 0.46062940658439333, 'edge_cap': 0.7393493570710161, 'bull_strategy': 'mean_reversion', 'bull_bb_std_mult': 1.7383225925121342, 'bull_rsi_os': 11, 'bull_rsi_ob': 88, 'bull_adx_thresh': 34.99751729673185, 'bull_atr_min_pct': 0.027229852220051545, 'bull_atr_max_pct': 0.14452283276388436, 'bull_tp_mult': 2.2328683276192947, 'bull_tsl_mult': 0.8278069233497204, 'bull_time_stop': 5, 'bull_use_sma': True, 'bull_use_ema': True, 'bull_use_atr': False, 'bull_use_adx': True, 'bull_use_spike': False, 'bull_rsi_required': True, 'bear_strategy': 'mean_reversion', 'bear_bb_std_mult': 1.541542437527409, 'bear_rsi_os': 52, 'bear_rsi_ob': 75, 'bear_adx_thresh': 10.611258214888213, 'bear_atr_min_pct': 0.018576775972390394, 'bear_atr_max_pct': 0.07020837578660365, 'bear_tp_mult': 2.038666073411666, 'bear_tsl_mult': 0.517447065042244, 'bear_time_stop': 85, 'bear_use_sma': False, 'bear_use_ema': False, 'bear_use_atr': False, 'bear_use_adx': False, 'bear_use_spike': False, 'bear_rsi_required': False, 'sideways_strategy': 'breakout', 'sideways_bb_std_mult': 0.8792898600297409, 'sideways_rsi_os': 32, 'sideways_rsi_ob': 57, 'sideways_adx_thresh': 33.87559551047533, 'sideways_atr_min_pct': 0.002590586203760857, 'sideways_atr_max_pct': 0.10582405561181822, 'sideways_tp_mult': 2.9407572714094448, 'sideways_tsl_mult': 0.16853394285418838, 'sideways_time_stop': 277, 'sideways_use_sma': True, 'sideways_use_ema': False, 'sideways_use_atr': True, 'sideways_use_adx': True, 'sideways_use_spike': False, 'sideways_rsi_required': False}.
[I 2025-08-30 17:16:01,809] Trial 689 finished with values: [-1000000000.0, 1000000000.0] and parameters: {'p_sma': 10, 'p_std': 19, 'p_atr': 7, 'p_adx': 10, 'rsi_period': 77, 'ema1': 19, 'ema2': 30, 'slip_atr_k': 0.18726116081949823, 'slip_spread_k': 0.13999996635579703, 'spread_hl_frac': 0.031866311046241824, 'bb_std_mult': 3.268883726052821, 'rsi_os': 30, 'rsi_ob': 87, 'vol_spike': 0.11041494782883393, 'adx_thresh': 20.937757672879172, 'atr_min_pct': 0.019234321720894308, 'atr_max_pct': 0.0979311697411408, 'tp_mult': 2.8828480594442714, 'tsl_mult': 0.9432868762557569, 'strategy': 'mean_reversion', 'time_stop': 32, 'use_sma': False, 'use_atr': True, 'use_adx': True, 'use_ema': True, 'use_spike': True, 'rsi_required': True, 'edge_k': 0.4447635765690271, 'edge_cap': 0.904429025314519, 'bull_strategy': 'mean_reversion', 'bull_bb_std_mult': 1.7271078473735804, 'bull_rsi_os': 41, 'bull_rsi_ob': 56, 'bull_adx_thresh': 33.62879137634265, 'bull_atr_min_pct': 0.022002719521950837, 'bull_atr_max_pct': 0.14100972054000063, 'bull_tp_mult': 2.1559754451214346, 'bull_tsl_mult': 0.8387905988108422, 'bull_time_stop': 288, 'bull_use_sma': True, 'bull_use_ema': False, 'bull_use_atr': False, 'bull_use_adx': True, 'bull_use_spike': False, 'bull_rsi_required': True, 'bear_strategy': 'breakout', 'bear_bb_std_mult': 1.1500100991699922, 'bear_rsi_os': 26, 'bear_rsi_ob': 71, 'bear_adx_thresh': 30.500075408764612, 'bear_atr_min_pct': 0.017203276801606063, 'bear_atr_max_pct': 0.0668644860403295, 'bear_tp_mult': 2.0849739453711824, 'bear_tsl_mult': 0.6517010103910218, 'bear_time_stop': 107, 'bear_use_sma': False, 'bear_use_ema': False, 'bear_use_atr': True, 'bear_use_adx': False, 'bear_use_spike': False, 'bear_rsi_required': False, 'sideways_strategy': 'breakout', 'sideways_bb_std_mult': 0.9049455565211695, 'sideways_rsi_os': 32, 'sideways_rsi_ob': 70, 'sideways_adx_thresh': 10.413965090526622, 'sideways_atr_min_pct': 0.002605238710847923, 'sideways_atr_max_pct': 0.10604026733582418, 'sideways_tp_mult': 2.9533525391370015, 'sideways_tsl_mult': 0.4072321527173755, 'sideways_time_stop': 277, 'sideways_use_sma': True, 'sideways_use_ema': True, 'sideways_use_atr': True, 'sideways_use_adx': True, 'sideways_use_spike': True, 'sideways_rsi_required': False}.
[I 2025-08-30 17:16:02,007] Trial 688 finished with values: [-1000000000.0, 1000000000.0] and parameters: {'p_sma': 10, 'p_std': 19, 'p_atr': 15, 'p_adx': 10, 'rsi_period': 63, 'ema1': 19, 'ema2': 23, 'slip_atr_k': 0.013695791654337288, 'slip_spread_k': 0.15217873027181822, 'spread_hl_frac': 0.016120913382993346, 'bb_std_mult': 3.2562327181548767, 'rsi_os': 19, 'rsi_ob': 84, 'vol_spike': 0.10851364057548579, 'adx_thresh': 33.33108883189444, 'atr_min_pct': 0.019755927510129813, 'atr_max_pct': 0.14294113522280424, 'tp_mult': 1.904815658750043, 'tsl_mult': 0.9401203325771883, 'strategy': 'mean_reversion', 'time_stop': 25, 'use_sma': True, 'use_atr': True, 'use_adx': True, 'use_ema': True, 'use_spike': True, 'rsi_required': True, 'edge_k': 0.24427466527768904, 'edge_cap': 0.900691884325392, 'bull_strategy': 'breakout', 'bull_bb_std_mult': 1.824692701108749, 'bull_rsi_os': 9, 'bull_rsi_ob': 70, 'bull_adx_thresh': 32.91453802647019, 'bull_atr_min_pct': 0.021943035858269833, 'bull_atr_max_pct': 0.14488722280355637, 'bull_tp_mult': 2.419102220452218, 'bull_tsl_mult': 0.8272758293886046, 'bull_time_stop': 42, 'bull_use_sma': True, 'bull_use_ema': False, 'bull_use_atr': False, 'bull_use_adx': True, 'bull_use_spike': False, 'bull_rsi_required': True, 'bear_strategy': 'breakout', 'bear_bb_std_mult': 3.3057432735503656, 'bear_rsi_os': 47, 'bear_rsi_ob': 75, 'bear_adx_thresh': 13.120040651335461, 'bear_atr_min_pct': 0.0073958383716471844, 'bear_atr_max_pct': 0.06566223095478747, 'bear_tp_mult': 1.0313099851793885, 'bear_tsl_mult': 0.6411332409960461, 'bear_time_stop': 85, 'bear_use_sma': False, 'bear_use_ema': False, 'bear_use_atr': True, 'bear_use_adx': True, 'bear_use_spike': False, 'bear_rsi_required': True, 'sideways_strategy': 'breakout', 'sideways_bb_std_mult': 0.7263259269691531, 'sideways_rsi_os': 32, 'sideways_rsi_ob': 70, 'sideways_adx_thresh': 10.136245697023273, 'sideways_atr_min_pct': 0.014754133731193417, 'sideways_atr_max_pct': 0.09856476223044014, 'sideways_tp_mult': 2.960910076863966, 'sideways_tsl_mult': 0.40636944589224, 'sideways_time_stop': 279, 'sideways_use_sma': True, 'sideways_use_ema': True, 'sideways_use_atr': True, 'sideways_use_adx': True, 'sideways_use_spike': True, 'sideways_rsi_required': False}.
[I 2025-08-30 17:16:02,428] Trial 687 finished with values: [-1000000000.0, 1000000000.0] and parameters: {'p_sma': 10, 'p_std': 21, 'p_atr': 16, 'p_adx': 10, 'rsi_period': 38, 'ema1': 19, 'ema2': 15, 'slip_atr_k': 0.23305721583228334, 'slip_spread_k': 0.14867316347859355, 'spread_hl_frac': 0.01952760256127172, 'bb_std_mult': 0.7860555549760166, 'rsi_os': 30, 'rsi_ob': 72, 'vol_spike': 0.08505709686818057, 'adx_thresh': 18.18548713325679, 'atr_min_pct': 0.019141140902061572, 'atr_max_pct': 0.03500467326389, 'tp_mult': 1.270845175937813, 'tsl_mult': 0.8906156279025872, 'strategy': 'breakout', 'time_stop': 31, 'use_sma': True, 'use_atr': True, 'use_adx': True, 'use_ema': True, 'use_spike': True, 'rsi_required': False, 'edge_k': 0.07798812266645427, 'edge_cap': 0.9074539406273772, 'bull_strategy': 'breakout', 'bull_bb_std_mult': 3.152307394874374, 'bull_rsi_os': 11, 'bull_rsi_ob': 52, 'bull_adx_thresh': 34.98274752157587, 'bull_atr_min_pct': 0.027407170134970453, 'bull_atr_max_pct': 0.1445910711352207, 'bull_tp_mult': 2.1521020142924128, 'bull_tsl_mult': 0.8305569473620328, 'bull_time_stop': 140, 'bull_use_sma': True, 'bull_use_ema': False, 'bull_use_atr': False, 'bull_use_adx': True, 'bull_use_spike': True, 'bull_rsi_required': True, 'bear_strategy': 'breakout', 'bear_bb_std_mult': 0.7648129758620629, 'bear_rsi_os': 26, 'bear_rsi_ob': 75, 'bear_adx_thresh': 12.980180116956317, 'bear_atr_min_pct': 0.007469639918442943, 'bear_atr_max_pct': 0.11057351308092678, 'bear_tp_mult': 2.07973048345549, 'bear_tsl_mult': 0.6602623748401966, 'bear_time_stop': 207, 'bear_use_sma': False, 'bear_use_ema': False, 'bear_use_atr': True, 'bear_use_adx': True, 'bear_use_spike': True, 'bear_rsi_required': True, 'sideways_strategy': 'breakout', 'sideways_bb_std_mult': 0.7253951130323351, 'sideways_rsi_os': 32, 'sideways_rsi_ob': 90, 'sideways_adx_thresh': 10.051166173272382, 'sideways_atr_min_pct': 0.0026302669111539128, 'sideways_atr_max_pct': 0.10649692928416252, 'sideways_tp_mult': 2.9679703537678566, 'sideways_tsl_mult': 0.4707528867917907, 'sideways_time_stop': 283, 'sideways_use_sma': True, 'sideways_use_ema': True, 'sideways_use_atr': True, 'sideways_use_adx': True, 'sideways_use_spike': True, 'sideways_rsi_required': False}.
[I 2025-08-30 17:16:03,014] Trial 691 finished with values: [-1000000000.0, 1000000000.0] and parameters: {'p_sma': 7, 'p_std': 21, 'p_atr': 7, 'p_adx': 11, 'rsi_period': 22, 'ema1': 19, 'ema2': 15, 'slip_atr_k': 0.013350743790754932, 'slip_spread_k': 0.19737662756564506, 'spread_hl_frac': 0.01834262738215854, 'bb_std_mult': 3.108947774224505, 'rsi_os': 42, 'rsi_ob': 78, 'vol_spike': 0.10594506062839648, 'adx_thresh': 9.18041623302711, 'atr_min_pct': 0.019131311691278942, 'atr_max_pct': 0.08652607413968524, 'tp_mult': 2.439468899920416, 'tsl_mult': 0.900049065151318, 'strategy': 'mean_reversion', 'time_stop': 24, 'use_sma': False, 'use_atr': False, 'use_adx': False, 'use_ema': False, 'use_spike': False, 'rsi_required': True, 'edge_k': 1.1579315931502845, 'edge_cap': 0.9045357403993368, 'bull_strategy': 'mean_reversion', 'bull_bb_std_mult': 1.8542118120161228, 'bull_rsi_os': 41, 'bull_rsi_ob': 70, 'bull_adx_thresh': 28.488848943642328, 'bull_atr_min_pct': 0.002569774060764817, 'bull_atr_max_pct': 0.14585524394140312, 'bull_tp_mult': 2.328784993064314, 'bull_tsl_mult': 0.8383812182745942, 'bull_time_stop': 236, 'bull_use_sma': True, 'bull_use_ema': True, 'bull_use_atr': False, 'bull_use_adx': False, 'bull_use_spike': False, 'bull_rsi_required': False, 'bear_strategy': 'mean_reversion', 'bear_bb_std_mult': 1.3055065173736928, 'bear_rsi_os': 27, 'bear_rsi_ob': 75, 'bear_adx_thresh': 11.363002728108206, 'bear_atr_min_pct': 0.007556372892396828, 'bear_atr_max_pct': 0.06058340751255774, 'bear_tp_mult': 2.151303499406361, 'bear_tsl_mult': 0.6381918864361111, 'bear_time_stop': 165, 'bear_use_sma': True, 'bear_use_ema': False, 'bear_use_atr': False, 'bear_use_adx': False, 'bear_use_spike': False, 'bear_rsi_required': False, 'sideways_strategy': 'breakout', 'sideways_bb_std_mult': 0.7160463722537509, 'sideways_rsi_os': 17, 'sideways_rsi_ob': 90, 'sideways_adx_thresh': 13.523189508350493, 'sideways_atr_min_pct': 0.001681042132782947, 'sideways_atr_max_pct': 0.09817426721620426, 'sideways_tp_mult': 2.869821506352363, 'sideways_tsl_mult': 0.6196419905519521, 'sideways_time_stop': 267, 'sideways_use_sma': True, 'sideways_use_ema': False, 'sideways_use_atr': False, 'sideways_use_adx': False, 'sideways_use_spike': False, 'sideways_rsi_required': True}.
[I 2025-08-30 17:16:03,905] Trial 692 finished with values: [-1000000000.0, 1000000000.0] and parameters: {'p_sma': 7, 'p_std': 20, 'p_atr': 16, 'p_adx': 8, 'rsi_period': 22, 'ema1': 13, 'ema2': 15, 'slip_atr_k': 0.004924030576548256, 'slip_spread_k': 0.18681185144126916, 'spread_hl_frac': 0.018473093758330894, 'bb_std_mult': 2.467767006631506, 'rsi_os': 55, 'rsi_ob': 78, 'vol_spike': 0.10338134358982637, 'adx_thresh': 28.58983316329187, 'atr_min_pct': 0.018070184235529675, 'atr_max_pct': 0.14730776703298334, 'tp_mult': 2.4341091823629197, 'tsl_mult': 0.8906101081982558, 'strategy': 'mean_reversion', 'time_stop': 42, 'use_sma': False, 'use_atr': False, 'use_adx': False, 'use_ema': False, 'use_spike': False, 'rsi_required': True, 'edge_k': 0.8531417479411063, 'edge_cap': 0.8355414951244439, 'bull_strategy': 'mean_reversion', 'bull_bb_std_mult': 1.9274079900487011, 'bull_rsi_os': 35, 'bull_rsi_ob': 54, 'bull_adx_thresh': 34.99679755847641, 'bull_atr_min_pct': 0.023706172464636764, 'bull_atr_max_pct': 0.12141275702832982, 'bull_tp_mult': 2.8098588336151833, 'bull_tsl_mult': 0.7719584203276847, 'bull_time_stop': 218, 'bull_use_sma': True, 'bull_use_ema': True, 'bull_use_atr': False, 'bull_use_adx': False, 'bull_use_spike': False, 'bull_rsi_required': False, 'bear_strategy': 'mean_reversion', 'bear_bb_std_mult': 1.2687209508504609, 'bear_rsi_os': 16, 'bear_rsi_ob': 82, 'bear_adx_thresh': 33.95511889949398, 'bear_atr_min_pct': 0.015807616448669702, 'bear_atr_max_pct': 0.10003918475936822, 'bear_tp_mult': 2.989371092271907, 'bear_tsl_mult': 0.5775155870461989, 'bear_time_stop': 166, 'bear_use_sma': True, 'bear_use_ema': False, 'bear_use_atr': False, 'bear_use_adx': False, 'bear_use_spike': False, 'bear_rsi_required': False, 'sideways_strategy': 'breakout', 'sideways_bb_std_mult': 0.7216094489263496, 'sideways_rsi_os': 18, 'sideways_rsi_ob': 91, 'sideways_adx_thresh': 13.375695705129068, 'sideways_atr_min_pct': 0.0057832838598554474, 'sideways_atr_max_pct': 0.12165764981437388, 'sideways_tp_mult': 2.857516067963524, 'sideways_tsl_mult': 0.4734738938581083, 'sideways_time_stop': 266, 'sideways_use_sma': True, 'sideways_use_ema': False, 'sideways_use_atr': False, 'sideways_use_adx': False, 'sideways_use_spike': False, 'sideways_rsi_required': True}.
