[I 2025-08-30 15:41:39,155] Trial 161 finished with values: [-1000000000.0, 1000000000.0] and parameters: {'p_sma': 18, 'p_std': 23, 'p_atr': 22, 'p_adx': 16, 'rsi_period': 39, 'ema1': 23, 'ema2': 30, 'slip_atr_k': 0.03413272249875175, 'slip_spread_k': 0.04863772630948413, 'spread_hl_frac': 0.04901558744901627, 'bb_std_mult': 2.8540963779770867, 'rsi_os': 39, 'rsi_ob': 77, 'vol_spike': 0.08789561899024495, 'adx_thresh': 21.39989307040275, 'atr_min_pct': 0.007805559610109379, 'atr_max_pct': 0.14707639476726234, 'tp_mult': 1.2095293980612543, 'tsl_mult': 0.5303715262210488, 'strategy': 'breakout', 'time_stop': 45, 'use_sma': False, 'use_atr': True, 'use_adx': False, 'use_ema': True, 'use_spike': True, 'rsi_required': False, 'edge_k': 0.265713289646075, 'edge_cap': 0.7600040412841172, 'bull_strategy': 'mean_reversion', 'bull_bb_std_mult': 1.4807181504636366, 'bull_rsi_os': 21, 'bull_rsi_ob': 81, 'bull_adx_thresh': 34.42435377294814, 'bull_atr_min_pct': 0.003961964003028277, 'bull_atr_max_pct': 0.06836360859666919, 'bull_tp_mult': 2.686163349693151, 'bull_tsl_mult': 0.34840190287316397, 'bull_time_stop': 51, 'bull_use_sma': True, 'bull_use_ema': True, 'bull_use_atr': False, 'bull_use_adx': False, 'bull_use_spike': False, 'bull_rsi_required': True, 'bear_strategy': 'breakout', 'bear_bb_std_mult': 2.319530565937198, 'bear_rsi_os': 50, 'bear_rsi_ob': 82, 'bear_adx_thresh': 10.367642750577966, 'bear_atr_min_pct': 0.02718905202766644, 'bear_atr_max_pct': 0.07389024401372672, 'bear_tp_mult': 2.0512840762877564, 'bear_tsl_mult': 0.5736290545867327, 'bear_time_stop': 282, 'bear_use_sma': False, 'bear_use_ema': False, 'bear_use_atr': True, 'bear_use_adx': True, 'bear_use_spike': True, 'bear_rsi_required': True, 'sideways_strategy': 'breakout', 'sideways_bb_std_mult': 3.3594108764391883, 'sideways_rsi_os': 25, 'sideways_rsi_ob': 92, 'sideways_adx_thresh': 14.484996879561676, 'sideways_atr_min_pct': 0.0025362128058713453, 'sideways_atr_max_pct': 0.10063420412145153, 'sideways_tp_mult': 2.8525927818159036, 'sideways_tsl_mult': 0.8671398373084459, 'sideways_time_stop': 215, 'sideways_use_sma': True, 'sideways_use_ema': True, 'sideways_use_atr': False, 'sideways_use_adx': True, 'sideways_use_spike': False, 'sideways_rsi_required': False}.
[I 2025-08-30 15:42:40,041] Trial 164 finished with values: [-0.014380024667199565, 0.01436902485009499] and parameters: {'p_sma': 19, 'p_std': 17, 'p_atr': 23, 'p_adx': 17, 'rsi_period': 42, 'ema1': 25, 'ema2': 40, 'slip_atr_k': 0.023192808767353745, 'slip_spread_k': 0.02219647813560827, 'spread_hl_frac': 0.0471960677690828, 'bb_std_mult': 3.0675311004371277, 'rsi_os': 40, 'rsi_ob': 81, 'vol_spike': 0.03111519868044271, 'adx_thresh': 23.229070215332616, 'atr_min_pct': 0.0075541971499978825, 'atr_max_pct': 0.14206059255200765, 'tp_mult': 1.2076537236762455, 'tsl_mult': 0.5442554100786134, 'strategy': 'breakout', 'time_stop': 260, 'use_sma': False, 'use_atr': True, 'use_adx': False, 'use_ema': True, 'use_spike': True, 'rsi_required': False, 'edge_k': 0.13611061525969526, 'edge_cap': 0.6439784136560893, 'bull_strategy': 'breakout', 'bull_bb_std_mult': 1.6566835582383344, 'bull_rsi_os': 24, 'bull_rsi_ob': 79, 'bull_adx_thresh': 33.4958899391893, 'bull_atr_min_pct': 0.0037619911734425235, 'bull_atr_max_pct': 0.06022866920888599, 'bull_tp_mult': 2.6439409650302363, 'bull_tsl_mult': 0.343365190782412, 'bull_time_stop': 70, 'bull_use_sma': True, 'bull_use_ema': True, 'bull_use_atr': False, 'bull_use_adx': False, 'bull_use_spike': True, 'bull_rsi_required': True, 'bear_strategy': 'breakout', 'bear_bb_std_mult': 2.340487241571985, 'bear_rsi_os': 50, 'bear_rsi_ob': 84, 'bear_adx_thresh': 8.374301667237365, 'bear_atr_min_pct': 0.02523964321542231, 'bear_atr_max_pct': 0.08366421570669282, 'bear_tp_mult': 2.141313969877372, 'bear_tsl_mult': 0.5744837312162226, 'bear_time_stop': 275, 'bear_use_sma': False, 'bear_use_ema': False, 'bear_use_atr': True, 'bear_use_adx': False, 'bear_use_spike': True, 'bear_rsi_required': False, 'sideways_strategy': 'breakout', 'sideways_bb_std_mult': 3.245825705715395, 'sideways_rsi_os': 30, 'sideways_rsi_ob': 93, 'sideways_adx_thresh': 15.746826418880014, 'sideways_atr_min_pct': 0.0006165051920348381, 'sideways_atr_max_pct': 0.09191522549087719, 'sideways_tp_mult': 2.97138640620281, 'sideways_tsl_mult': 0.9543761438175175, 'sideways_time_stop': 250, 'sideways_use_sma': True, 'sideways_use_ema': True, 'sideways_use_atr': False, 'sideways_use_adx': True, 'sideways_use_spike': True, 'sideways_rsi_required': True}.
[I 2025-08-30 15:42:40,050] Trial 163 finished with values: [-0.01626490885341647, 0.016344984744574766] and parameters: {'p_sma': 19, 'p_std': 17, 'p_atr': 23, 'p_adx': 17, 'rsi_period': 43, 'ema1': 25, 'ema2': 42, 'slip_atr_k': 0.02280027206585055, 'slip_spread_k': 0.01918297349520757, 'spread_hl_frac': 0.04743044107860024, 'bb_std_mult': 2.7835295927559374, 'rsi_os': 40, 'rsi_ob': 81, 'vol_spike': 0.031166590321910173, 'adx_thresh': 23.02743619724725, 'atr_min_pct': 0.008017693289298716, 'atr_max_pct': 0.1419878282789404, 'tp_mult': 1.2189609512201482, 'tsl_mult': 0.5398146963818821, 'strategy': 'breakout', 'time_stop': 262, 'use_sma': False, 'use_atr': True, 'use_adx': False, 'use_ema': True, 'use_spike': True, 'rsi_required': False, 'edge_k': 0.11563987217664684, 'edge_cap': 0.6454355997445979, 'bull_strategy': 'breakout', 'bull_bb_std_mult': 1.6379857654703178, 'bull_rsi_os': 25, 'bull_rsi_ob': 79, 'bull_adx_thresh': 33.47908077157913, 'bull_atr_min_pct': 0.0007458260772734194, 'bull_atr_max_pct': 0.05874548624968922, 'bull_tp_mult': 2.4395820806021047, 'bull_tsl_mult': 0.3171711543930655, 'bull_time_stop': 82, 'bull_use_sma': True, 'bull_use_ema': True, 'bull_use_atr': False, 'bull_use_adx': False, 'bull_use_spike': True, 'bull_rsi_required': True, 'bear_strategy': 'breakout', 'bear_bb_std_mult': 2.3343928463339614, 'bear_rsi_os': 50, 'bear_rsi_ob': 79, 'bear_adx_thresh': 8.512146933139867, 'bear_atr_min_pct': 0.028417370076570955, 'bear_atr_max_pct': 0.08333861919614623, 'bear_tp_mult': 2.1493767836903914, 'bear_tsl_mult': 0.5719677458858774, 'bear_time_stop': 275, 'bear_use_sma': False, 'bear_use_ema': False, 'bear_use_atr': True, 'bear_use_adx': False, 'bear_use_spike': True, 'bear_rsi_required': False, 'sideways_strategy': 'breakout', 'sideways_bb_std_mult': 3.274971103908155, 'sideways_rsi_os': 28, 'sideways_rsi_ob': 93, 'sideways_adx_thresh': 14.650196747081484, 'sideways_atr_min_pct': 0.00045339997957779426, 'sideways_atr_max_pct': 0.09143324235733832, 'sideways_tp_mult': 2.9536553894892505, 'sideways_tsl_mult': 0.9259745212386029, 'sideways_time_stop': 251, 'sideways_use_sma': True, 'sideways_use_ema': True, 'sideways_use_atr': False, 'sideways_use_adx': True, 'sideways_use_spike': True, 'sideways_rsi_required': True}.
[I 2025-08-30 15:42:40,537] Trial 166 finished with values: [-1000000000.0, 1000000000.0] and parameters: {'p_sma': 20, 'p_std': 17, 'p_atr': 23, 'p_adx': 17, 'rsi_period': 43, 'ema1': 24, 'ema2': 43, 'slip_atr_k': 0.02360155698534057, 'slip_spread_k': 0.02171715658092206, 'spread_hl_frac': 0.04765640526969519, 'bb_std_mult': 2.7867394338349087, 'rsi_os': 42, 'rsi_ob': 79, 'vol_spike': 0.029907304452018533, 'adx_thresh': 23.396306940607612, 'atr_min_pct': 0.008908594614754248, 'atr_max_pct': 0.14147824902032877, 'tp_mult': 1.11113878006127, 'tsl_mult': 0.5115098652561938, 'strategy': 'breakout', 'time_stop': 257, 'use_sma': False, 'use_atr': True, 'use_adx': False, 'use_ema': True, 'use_spike': True, 'rsi_required': False, 'edge_k': 0.13900209947950753, 'edge_cap': 0.7224061053311515, 'bull_strategy': 'breakout', 'bull_bb_std_mult': 1.6032768684623586, 'bull_rsi_os': 24, 'bull_rsi_ob': 79, 'bull_adx_thresh': 31.89598662102979, 'bull_atr_min_pct': 0.0007915341738647827, 'bull_atr_max_pct': 0.05657353377726186, 'bull_tp_mult': 2.642919166169088, 'bull_tsl_mult': 0.34236025102327544, 'bull_time_stop': 81, 'bull_use_sma': True, 'bull_use_ema': True, 'bull_use_atr': False, 'bull_use_adx': False, 'bull_use_spike': True, 'bull_rsi_required': True, 'bear_strategy': 'breakout', 'bear_bb_std_mult': 2.3485835286930747, 'bear_rsi_os': 51, 'bear_rsi_ob': 84, 'bear_adx_thresh': 8.310732732836414, 'bear_atr_min_pct': 0.025315062259339233, 'bear_atr_max_pct': 0.08358314853616049, 'bear_tp_mult': 2.1395706287695435, 'bear_tsl_mult': 0.5330437170184303, 'bear_time_stop': 254, 'bear_use_sma': False, 'bear_use_ema': False, 'bear_use_atr': True, 'bear_use_adx': False, 'bear_use_spike': True, 'bear_rsi_required': False, 'sideways_strategy': 'mean_reversion', 'sideways_bb_std_mult': 3.2291168692455523, 'sideways_rsi_os': 30, 'sideways_rsi_ob': 95, 'sideways_adx_thresh': 17.17879498400884, 'sideways_atr_min_pct': 0.0006570649338176614, 'sideways_atr_max_pct': 0.09617785614650957, 'sideways_tp_mult': 2.958345655160098, 'sideways_tsl_mult': 0.9341178710218361, 'sideways_time_stop': 260, 'sideways_use_sma': True, 'sideways_use_ema': True, 'sideways_use_atr': True, 'sideways_use_adx': True, 'sideways_use_spike': True, 'sideways_rsi_required': False}.
[I 2025-08-30 15:42:40,539] Trial 165 finished with values: [-1000000000.0, 1000000000.0] and parameters: {'p_sma': 21, 'p_std': 17, 'p_atr': 23, 'p_adx': 17, 'rsi_period': 43, 'ema1': 25, 'ema2': 43, 'slip_atr_k': 0.02283740960805144, 'slip_spread_k': 0.027946880450607607, 'spread_hl_frac': 0.04738399733979472, 'bb_std_mult': 3.05202317172907, 'rsi_os': 38, 'rsi_ob': 81, 'vol_spike': 0.0570292158450516, 'adx_thresh': 23.495333686137393, 'atr_min_pct': 0.008006013999039018, 'atr_max_pct': 0.14151419839331345, 'tp_mult': 1.2097214927388587, 'tsl_mult': 0.5217339483498936, 'strategy': 'breakout', 'time_stop': 272, 'use_sma': False, 'use_atr': True, 'use_adx': False, 'use_ema': True, 'use_spike': True, 'rsi_required': False, 'edge_k': 0.23858237543062666, 'edge_cap': 0.6827169751809202, 'bull_strategy': 'breakout', 'bull_bb_std_mult': 1.6504203817072711, 'bull_rsi_os': 24, 'bull_rsi_ob': 79, 'bull_adx_thresh': 33.45403381149737, 'bull_atr_min_pct': 0.003675719733662524, 'bull_atr_max_pct': 0.05852446881841342, 'bull_tp_mult': 2.4381349049288223, 'bull_tsl_mult': 0.3353787400477913, 'bull_time_stop': 71, 'bull_use_sma': True, 'bull_use_ema': True, 'bull_use_atr': False, 'bull_use_adx': False, 'bull_use_spike': True, 'bull_rsi_required': True, 'bear_strategy': 'breakout', 'bear_bb_std_mult': 2.3394282834667948, 'bear_rsi_os': 50, 'bear_rsi_ob': 79, 'bear_adx_thresh': 12.604742401903618, 'bear_atr_min_pct': 0.02831330999045087, 'bear_atr_max_pct': 0.0831549579399351, 'bear_tp_mult': 2.144771386317162, 'bear_tsl_mult': 0.5313222834985436, 'bear_time_stop': 255, 'bear_use_sma': False, 'bear_use_ema': False, 'bear_use_atr': True, 'bear_use_adx': False, 'bear_use_spike': True, 'bear_rsi_required': False, 'sideways_strategy': 'mean_reversion', 'sideways_bb_std_mult': 3.262358687802212, 'sideways_rsi_os': 28, 'sideways_rsi_ob': 95, 'sideways_adx_thresh': 14.627287936627273, 'sideways_atr_min_pct': 0.002854474235319305, 'sideways_atr_max_pct': 0.0961966431658937, 'sideways_tp_mult': 2.9673128363412724, 'sideways_tsl_mult': 0.9418357541655333, 'sideways_time_stop': 239, 'sideways_use_sma': True, 'sideways_use_ema': True, 'sideways_use_atr': True, 'sideways_use_adx': True, 'sideways_use_spike': True, 'sideways_rsi_required': False}.
[I 2025-08-30 15:43:40,345] Trial 170 finished with values: [-0.02212327068817832, 0.022109200909040807] and parameters: {'p_sma': 16, 'p_std': 18, 'p_atr': 21, 'p_adx': 17, 'rsi_period': 45, 'ema1': 22, 'ema2': 35, 'slip_atr_k': 0.003620833806429146, 'slip_spread_k': 0.07254031787903674, 'spread_hl_frac': 0.048435938554527554, 'bb_std_mult': 2.698535764331325, 'rsi_os': 40, 'rsi_ob': 50, 'vol_spike': 0.02093222411479536, 'adx_thresh': 25.07066282590357, 'atr_min_pct': 0.006752270029734976, 'atr_max_pct': 0.13764727797161605, 'tp_mult': 1.1453129775179351, 'tsl_mult': 0.5387467545983736, 'strategy': 'breakout', 'time_stop': 247, 'use_sma': False, 'use_atr': True, 'use_adx': False, 'use_ema': False, 'use_spike': True, 'rsi_required': False, 'edge_k': 0.2254639710202807, 'edge_cap': 0.6566599049355654, 'bull_strategy': 'breakout', 'bull_bb_std_mult': 1.5542584389851886, 'bull_rsi_os': 23, 'bull_rsi_ob': 78, 'bull_adx_thresh': 32.05013859842471, 'bull_atr_min_pct': 0.0007569441880877669, 'bull_atr_max_pct': 0.05310778701355559, 'bull_tp_mult': 2.5005845611463795, 'bull_tsl_mult': 0.025404264354489392, 'bull_time_stop': 63, 'bull_use_sma': True, 'bull_use_ema': False, 'bull_use_atr': False, 'bull_use_adx': False, 'bull_use_spike': False, 'bull_rsi_required': True, 'bear_strategy': 'mean_reversion', 'bear_bb_std_mult': 2.2092750628758884, 'bear_rsi_os': 54, 'bear_rsi_ob': 77, 'bear_adx_thresh': 12.074125275084807, 'bear_atr_min_pct': 0.026002163995427523, 'bear_atr_max_pct': 0.08651317070320044, 'bear_tp_mult': 2.196590475410561, 'bear_tsl_mult': 0.603121891932459, 'bear_time_stop': 274, 'bear_use_sma': False, 'bear_use_ema': False, 'bear_use_atr': True, 'bear_use_adx': False, 'bear_use_spike': True, 'bear_rsi_required': False, 'sideways_strategy': 'breakout', 'sideways_bb_std_mult': 3.09164011628003, 'sideways_rsi_os': 31, 'sideways_rsi_ob': 90, 'sideways_adx_thresh': 15.851126955389251, 'sideways_atr_min_pct': 0.0016784200582434692, 'sideways_atr_max_pct': 0.09307632853872032, 'sideways_tp_mult': 2.743960313276891, 'sideways_tsl_mult': 0.9003172660717598, 'sideways_time_stop': 242, 'sideways_use_sma': True, 'sideways_use_ema': False, 'sideways_use_atr': False, 'sideways_use_adx': True, 'sideways_use_spike': False, 'sideways_rsi_required': True}.
[I 2025-08-30 15:43:40,917] Trial 167 finished with values: [-0.018266289705480943, 0.01826135787516132] and parameters: {'p_sma': 20, 'p_std': 17, 'p_atr': 24, 'p_adx': 17, 'rsi_period': 44, 'ema1': 25, 'ema2': 35, 'slip_atr_k': 0.022785462833905566, 'slip_spread_k': 0.021743349694940368, 'spread_hl_frac': 0.04714785393874536, 'bb_std_mult': 2.7528592547723867, 'rsi_os': 42, 'rsi_ob': 80, 'vol_spike': 0.02130501323560576, 'adx_thresh': 23.49975201823829, 'atr_min_pct': 0.008880350587547872, 'atr_max_pct': 0.14009942261503822, 'tp_mult': 1.111680357993107, 'tsl_mult': 0.5070108783693534, 'strategy': 'breakout', 'time_stop': 114, 'use_sma': False, 'use_atr': True, 'use_adx': False, 'use_ema': False, 'use_spike': True, 'rsi_required': False, 'edge_k': 0.22779132769459357, 'edge_cap': 0.6542171920224672, 'bull_strategy': 'breakout', 'bull_bb_std_mult': 1.6586330017431594, 'bull_rsi_os': 25, 'bull_rsi_ob': 79, 'bull_adx_thresh': 33.4741568580262, 'bull_atr_min_pct': 0.0004909717102682141, 'bull_atr_max_pct': 0.0599747542073315, 'bull_tp_mult': 2.5105860366614654, 'bull_tsl_mult': 0.5712156065936449, 'bull_time_stop': 79, 'bull_use_sma': True, 'bull_use_ema': False, 'bull_use_atr': False, 'bull_use_adx': False, 'bull_use_spike': True, 'bull_rsi_required': True, 'bear_strategy': 'mean_reversion', 'bear_bb_std_mult': 2.3737428488940844, 'bear_rsi_os': 51, 'bear_rsi_ob': 79, 'bear_adx_thresh': 12.214830527775339, 'bear_atr_min_pct': 0.028103012042868556, 'bear_atr_max_pct': 0.08401645880567649, 'bear_tp_mult': 2.1554859070258754, 'bear_tsl_mult': 0.53155616559988, 'bear_time_stop': 255, 'bear_use_sma': False, 'bear_use_ema': False, 'bear_use_atr': True, 'bear_use_adx': False, 'bear_use_spike': True, 'bear_rsi_required': False, 'sideways_strategy': 'mean_reversion', 'sideways_bb_std_mult': 3.245978580346862, 'sideways_rsi_os': 30, 'sideways_rsi_ob': 95, 'sideways_adx_thresh': 15.650994642582354, 'sideways_atr_min_pct': 0.00014551502559528775, 'sideways_atr_max_pct': 0.09604169863697018, 'sideways_tp_mult': 2.7242320498564094, 'sideways_tsl_mult': 0.9350685586610048, 'sideways_time_stop': 260, 'sideways_use_sma': True, 'sideways_use_ema': False, 'sideways_use_atr': True, 'sideways_use_adx': True, 'sideways_use_spike': True, 'sideways_rsi_required': True}.
[I 2025-08-30 15:43:41,234] Trial 169 finished with values: [-0.04611155154229496, 0.046048221908791896] and parameters: {'p_sma': 23, 'p_std': 18, 'p_atr': 21, 'p_adx': 19, 'rsi_period': 45, 'ema1': 22, 'ema2': 35, 'slip_atr_k': 0.01108686686197405, 'slip_spread_k': 0.07845676225527917, 'spread_hl_frac': 0.04851505460826118, 'bb_std_mult': 2.6916284414624205, 'rsi_os': 40, 'rsi_ob': 79, 'vol_spike': 0.019495507109161075, 'adx_thresh': 22.823861682200608, 'atr_min_pct': 0.006768708614507161, 'atr_max_pct': 0.13692701187172945, 'tp_mult': 1.1432496757560862, 'tsl_mult': 0.5518069151297513, 'strategy': 'breakout', 'time_stop': 247, 'use_sma': False, 'use_atr': True, 'use_adx': False, 'use_ema': False, 'use_spike': True, 'rsi_required': False, 'edge_k': 0.2122592689873803, 'edge_cap': 0.6520081732130276, 'bull_strategy': 'breakout', 'bull_bb_std_mult': 1.5483204679520692, 'bull_rsi_os': 25, 'bull_rsi_ob': 77, 'bull_adx_thresh': 17.977847263730986, 'bull_atr_min_pct': 0.0003684985075532673, 'bull_atr_max_pct': 0.060686738849149525, 'bull_tp_mult': 2.505170589712186, 'bull_tsl_mult': 0.5639717143603405, 'bull_time_stop': 61, 'bull_use_sma': True, 'bull_use_ema': False, 'bull_use_atr': False, 'bull_use_adx': False, 'bull_use_spike': False, 'bull_rsi_required': True, 'bear_strategy': 'mean_reversion', 'bear_bb_std_mult': 2.405038950725861, 'bear_rsi_os': 54, 'bear_rsi_ob': 80, 'bear_adx_thresh': 11.812771021555887, 'bear_atr_min_pct': 0.02578369833938661, 'bear_atr_max_pct': 0.07956470195101074, 'bear_tp_mult': 2.201357025254822, 'bear_tsl_mult': 0.596907348081648, 'bear_time_stop': 276, 'bear_use_sma': False, 'bear_use_ema': False, 'bear_use_atr': True, 'bear_use_adx': False, 'bear_use_spike': True, 'bear_rsi_required': False, 'sideways_strategy': 'breakout', 'sideways_bb_std_mult': 3.0899292521852746, 'sideways_rsi_os': 31, 'sideways_rsi_ob': 92, 'sideways_adx_thresh': 15.420588009312208, 'sideways_atr_min_pct': 0.000331690792229515, 'sideways_atr_max_pct': 0.09130794471534584, 'sideways_tp_mult': 2.79804933116177, 'sideways_tsl_mult': 0.903028210774927, 'sideways_time_stop': 243, 'sideways_use_sma': True, 'sideways_use_ema': False, 'sideways_use_atr': False, 'sideways_use_adx': True, 'sideways_use_spike': False, 'sideways_rsi_required': True}.
[I 2025-08-30 15:43:41,483] Trial 168 finished with values: [-0.018487407295436964, 0.0184825073405628] and parameters: {'p_sma': 20, 'p_std': 17, 'p_atr': 24, 'p_adx': 17, 'rsi_period': 44, 'ema1': 25, 'ema2': 35, 'slip_atr_k': 0.022761884606191454, 'slip_spread_k': 0.018414662816945596, 'spread_hl_frac': 0.048695217467837594, 'bb_std_mult': 2.7019369267264883, 'rsi_os': 42, 'rsi_ob': 80, 'vol_spike': 0.0196723019090165, 'adx_thresh': 25.212971915801205, 'atr_min_pct': 0.008807593282817102, 'atr_max_pct': 0.14251974096424422, 'tp_mult': 1.1209536694606057, 'tsl_mult': 0.5090383688399445, 'strategy': 'breakout', 'time_stop': 255, 'use_sma': False, 'use_atr': True, 'use_adx': False, 'use_ema': False, 'use_spike': True, 'rsi_required': False, 'edge_k': 0.320162423661544, 'edge_cap': 0.7176138252112857, 'bull_strategy': 'breakout', 'bull_bb_std_mult': 1.6350788719959433, 'bull_rsi_os': 25, 'bull_rsi_ob': 79, 'bull_adx_thresh': 31.888092211427843, 'bull_atr_min_pct': 0.0003689051798847951, 'bull_atr_max_pct': 0.06059036156607045, 'bull_tp_mult': 2.5540227254660555, 'bull_tsl_mult': 0.3390230976555417, 'bull_time_stop': 79, 'bull_use_sma': True, 'bull_use_ema': False, 'bull_use_atr': False, 'bull_use_adx': False, 'bull_use_spike': True, 'bull_rsi_required': True, 'bear_strategy': 'mean_reversion', 'bear_bb_std_mult': 2.376862647757814, 'bear_rsi_os': 11, 'bear_rsi_ob': 79, 'bear_adx_thresh': 8.460023499735009, 'bear_atr_min_pct': 0.02822787689714726, 'bear_atr_max_pct': 0.08261888457509713, 'bear_tp_mult': 2.145881616912385, 'bear_tsl_mult': 0.597373213920226, 'bear_time_stop': 256, 'bear_use_sma': False, 'bear_use_ema': False, 'bear_use_atr': True, 'bear_use_adx': False, 'bear_use_spike': True, 'bear_rsi_required': False, 'sideways_strategy': 'mean_reversion', 'sideways_bb_std_mult': 3.25975740273483, 'sideways_rsi_os': 30, 'sideways_rsi_ob': 95, 'sideways_adx_thresh': 15.71341038040991, 'sideways_atr_min_pct': 0.0005199159755384954, 'sideways_atr_max_pct': 0.09605749450114337, 'sideways_tp_mult': 2.94404225596813, 'sideways_tsl_mult': 0.9492843395936554, 'sideways_time_stop': 241, 'sideways_use_sma': True, 'sideways_use_ema': False, 'sideways_use_atr': True, 'sideways_use_adx': True, 'sideways_use_spike': True, 'sideways_rsi_required': True}.
