[I 2025-08-30 16:20:09,607] Trial 369 finished with values: [-1000000000.0, 1000000000.0] and parameters: {'p_sma': 49, 'p_std': 55, 'p_atr': 26, 'p_adx': 22, 'rsi_period': 22, 'ema1': 26, 'ema2': 12, 'slip_atr_k': 0.08373056065513176, 'slip_spread_k': 0.582679432726997, 'spread_hl_frac': 0.038042484941521515, 'bb_std_mult': 3.1001139642662143, 'rsi_os': 35, 'rsi_ob': 87, 'vol_spike': 0.011087286123354868, 'adx_thresh': 14.518416662613088, 'atr_min_pct': 0.02471514157700487, 'atr_max_pct': 0.14040694185886013, 'tp_mult': 1.355207651139108, 'tsl_mult': 0.5024578616279218, 'strategy': 'mean_reversion', 'time_stop': 164, 'use_sma': True, 'use_atr': True, 'use_adx': True, 'use_ema': False, 'use_spike': False, 'rsi_required': True, 'edge_k': 0.7545341962968884, 'edge_cap': 0.9996309055260832, 'bull_strategy': 'mean_reversion', 'bull_bb_std_mult': 1.3258079559581029, 'bull_rsi_os': 13, 'bull_rsi_ob': 49, 'bull_adx_thresh': 16.12720054731669, 'bull_atr_min_pct': 0.020046668079612192, 'bull_atr_max_pct': 0.13930090848181534, 'bull_tp_mult': 1.474027128036208, 'bull_tsl_mult': 0.15127164223772238, 'bull_time_stop': 76, 'bull_use_sma': False, 'bull_use_ema': True, 'bull_use_atr': True, 'bull_use_adx': True, 'bull_use_spike': False, 'bull_rsi_required': False, 'bear_strategy': 'mean_reversion', 'bear_bb_std_mult': 2.023491803273651, 'bear_rsi_os': 34, 'bear_rsi_ob': 56, 'bear_adx_thresh': 20.357015281712158, 'bear_atr_min_pct': 0.020942475602702328, 'bear_atr_max_pct': 0.042386285737538054, 'bear_tp_mult': 2.182075437523186, 'bear_tsl_mult': 0.685092309305195, 'bear_time_stop': 221, 'bear_use_sma': True, 'bear_use_ema': False, 'bear_use_atr': True, 'bear_use_adx': True, 'bear_use_spike': False, 'bear_rsi_required': True, 'sideways_strategy': 'breakout', 'sideways_bb_std_mult': 2.1912567528349998, 'sideways_rsi_os': 11, 'sideways_rsi_ob': 92, 'sideways_adx_thresh': 33.67343005063277, 'sideways_atr_min_pct': 0.0016633132893916517, 'sideways_atr_max_pct': 0.01920413720456452, 'sideways_tp_mult': 1.3952101170696602, 'sideways_tsl_mult': 0.5889545487653788, 'sideways_time_stop': 223, 'sideways_use_sma': True, 'sideways_use_ema': False, 'sideways_use_atr': True, 'sideways_use_adx': False, 'sideways_use_spike': False, 'sideways_rsi_required': True}.
[I 2025-08-30 16:20:10,706] Trial 370 finished with values: [-0.028344828619175644, 0.028306324141493224] and parameters: {'p_sma': 59, 'p_std': 41, 'p_atr': 11, 'p_adx': 25, 'rsi_period': 22, 'ema1': 16, 'ema2': 29, 'slip_atr_k': 0.07191159896133056, 'slip_spread_k': 0.592465761852108, 'spread_hl_frac': 0.018914462512914964, 'bb_std_mult': 1.9279293913109048, 'rsi_os': 35, 'rsi_ob': 87, 'vol_spike': 0.2072338631696068, 'adx_thresh': 14.51457024546283, 'atr_min_pct': 0.004605204677331887, 'atr_max_pct': 0.14187443749084677, 'tp_mult': 2.2621849337034607, 'tsl_mult': 0.7890121736506085, 'strategy': 'mean_reversion', 'time_stop': 30, 'use_sma': True, 'use_atr': True, 'use_adx': True, 'use_ema': False, 'use_spike': False, 'rsi_required': True, 'edge_k': 0.784953708874761, 'edge_cap': 0.8476925619796959, 'bull_strategy': 'mean_reversion', 'bull_bb_std_mult': 3.1436733264399264, 'bull_rsi_os': 10, 'bull_rsi_ob': 48, 'bull_adx_thresh': 23.76948754709154, 'bull_atr_min_pct': 0.02005477762184873, 'bull_atr_max_pct': 0.13761467661065951, 'bull_tp_mult': 1.9754890931920293, 'bull_tsl_mult': 0.9255549904153093, 'bull_time_stop': 163, 'bull_use_sma': False, 'bull_use_ema': True, 'bull_use_atr': True, 'bull_use_adx': True, 'bull_use_spike': False, 'bull_rsi_required': False, 'bear_strategy': 'mean_reversion', 'bear_bb_std_mult': 2.025966808507437, 'bear_rsi_os': 33, 'bear_rsi_ob': 86, 'bear_adx_thresh': 20.230956356995428, 'bear_atr_min_pct': 0.022757665532703773, 'bear_atr_max_pct': 0.08668062177099409, 'bear_tp_mult': 2.1664901040329765, 'bear_tsl_mult': 0.6850963786954137, 'bear_time_stop': 221, 'bear_use_sma': True, 'bear_use_ema': False, 'bear_use_atr': True, 'bear_use_adx': True, 'bear_use_spike': False, 'bear_rsi_required': False, 'sideways_strategy': 'breakout', 'sideways_bb_std_mult': 2.189387338362243, 'sideways_rsi_os': 27, 'sideways_rsi_ob': 92, 'sideways_adx_thresh': 17.78271594634477, 'sideways_atr_min_pct': 0.0017049644345608443, 'sideways_atr_max_pct': 0.058426729935259866, 'sideways_tp_mult': 1.2244220028935673, 'sideways_tsl_mult': 0.5387827037035402, 'sideways_time_stop': 214, 'sideways_use_sma': True, 'sideways_use_ema': False, 'sideways_use_atr': False, 'sideways_use_adx': False, 'sideways_use_spike': False, 'sideways_rsi_required': True}.
[I 2025-08-30 16:20:51,692] Trial 373 finished with values: [-1000000000.0, 1000000000.0] and parameters: {'p_sma': 24, 'p_std': 59, 'p_atr': 11, 'p_adx': 25, 'rsi_period': 54, 'ema1': 18, 'ema2': 13, 'slip_atr_k': 0.22929570464080534, 'slip_spread_k': 0.6650807042797939, 'spread_hl_frac': 0.008253579807454232, 'bb_std_mult': 3.015110444777445, 'rsi_os': 45, 'rsi_ob': 58, 'vol_spike': 0.09322669260064717, 'adx_thresh': 19.248524720429767, 'atr_min_pct': 0.02675265023919419, 'atr_max_pct': 0.08500352207154094, 'tp_mult': 2.868037504893604, 'tsl_mult': 0.42865329893443954, 'strategy': 'mean_reversion', 'time_stop': 146, 'use_sma': False, 'use_atr': True, 'use_adx': True, 'use_ema': False, 'use_spike': False, 'rsi_required': True, 'edge_k': 1.4194693524608242, 'edge_cap': 0.6709768766232355, 'bull_strategy': 'mean_reversion', 'bull_bb_std_mult': 1.1493650627317278, 'bull_rsi_os': 11, 'bull_rsi_ob': 63, 'bull_adx_thresh': 8.461692888005963, 'bull_atr_min_pct': 0.019425186704120054, 'bull_atr_max_pct': 0.1347202260251148, 'bull_tp_mult': 1.7479064748415123, 'bull_tsl_mult': 0.24036806354037624, 'bull_time_stop': 180, 'bull_use_sma': False, 'bull_use_ema': False, 'bull_use_atr': True, 'bull_use_adx': True, 'bull_use_spike': False, 'bull_rsi_required': False, 'bear_strategy': 'mean_reversion', 'bear_bb_std_mult': 3.1753728207503324, 'bear_rsi_os': 11, 'bear_rsi_ob': 60, 'bear_adx_thresh': 13.348406730850662, 'bear_atr_min_pct': 0.01612949616795765, 'bear_atr_max_pct': 0.09493457421248665, 'bear_tp_mult': 2.27084438276927, 'bear_tsl_mult': 0.3227530974033895, 'bear_time_stop': 228, 'bear_use_sma': True, 'bear_use_ema': False, 'bear_use_atr': True, 'bear_use_adx': False, 'bear_use_spike': False, 'bear_rsi_required': False, 'sideways_strategy': 'breakout', 'sideways_bb_std_mult': 0.775300054319942, 'sideways_rsi_os': 30, 'sideways_rsi_ob': 88, 'sideways_adx_thresh': 34.42371784966191, 'sideways_atr_min_pct': 0.028548617300124042, 'sideways_atr_max_pct': 0.14317359840600496, 'sideways_tp_mult': 1.4517267824014601, 'sideways_tsl_mult': 0.3101161350735576, 'sideways_time_stop': 210, 'sideways_use_sma': True, 'sideways_use_ema': False, 'sideways_use_atr': False, 'sideways_use_adx': False, 'sideways_use_spike': False, 'sideways_rsi_required': True}.
[I 2025-08-30 16:20:53,051] Trial 374 finished with values: [-1000000000.0, 1000000000.0] and parameters: {'p_sma': 35, 'p_std': 59, 'p_atr': 10, 'p_adx': 28, 'rsi_period': 54, 'ema1': 25, 'ema2': 50, 'slip_atr_k': 0.1683051687692612, 'slip_spread_k': 0.8623968308121777, 'spread_hl_frac': 0.01768783449999311, 'bb_std_mult': 1.2611292410183774, 'rsi_os': 26, 'rsi_ob': 90, 'vol_spike': 0.018034360051938897, 'adx_thresh': 10.306225870276188, 'atr_min_pct': 0.0270724149803166, 'atr_max_pct': 0.13682188461024059, 'tp_mult': 2.8803483819846294, 'tsl_mult': 0.43617650351191556, 'strategy': 'mean_reversion', 'time_stop': 115, 'use_sma': False, 'use_atr': True, 'use_adx': True, 'use_ema': False, 'use_spike': False, 'rsi_required': True, 'edge_k': 1.4329105172270644, 'edge_cap': 0.886774303278081, 'bull_strategy': 'mean_reversion', 'bull_bb_std_mult': 2.773444678350269, 'bull_rsi_os': 11, 'bull_rsi_ob': 50, 'bull_adx_thresh': 19.841763612182913, 'bull_atr_min_pct': 0.02850976520721941, 'bull_atr_max_pct': 0.14170703456339664, 'bull_tp_mult': 1.373926384245977, 'bull_tsl_mult': 0.3119460047947967, 'bull_time_stop': 71, 'bull_use_sma': False, 'bull_use_ema': False, 'bull_use_atr': True, 'bull_use_adx': True, 'bull_use_spike': False, 'bull_rsi_required': False, 'bear_strategy': 'mean_reversion', 'bear_bb_std_mult': 2.176821552959789, 'bear_rsi_os': 28, 'bear_rsi_ob': 68, 'bear_adx_thresh': 15.261894640073432, 'bear_atr_min_pct': 0.001599826154498163, 'bear_atr_max_pct': 0.09466750375125448, 'bear_tp_mult': 2.2550769475049957, 'bear_tsl_mult': 0.6553370750301657, 'bear_time_stop': 23, 'bear_use_sma': True, 'bear_use_ema': False, 'bear_use_atr': False, 'bear_use_adx': False, 'bear_use_spike': False, 'bear_rsi_required': False, 'sideways_strategy': 'breakout', 'sideways_bb_std_mult': 1.976700501115106, 'sideways_rsi_os': 49, 'sideways_rsi_ob': 88, 'sideways_adx_thresh': 31.96009242509728, 'sideways_atr_min_pct': 0.003538399243970351, 'sideways_atr_max_pct': 0.08255699558878506, 'sideways_tp_mult': 1.4584171831299193, 'sideways_tsl_mult': 0.5012530055805391, 'sideways_time_stop': 154, 'sideways_use_sma': True, 'sideways_use_ema': False, 'sideways_use_atr': False, 'sideways_use_adx': False, 'sideways_use_spike': False, 'sideways_rsi_required': True}.
[I 2025-08-30 16:20:53,062] Trial 371 finished with values: [-1000000000.0, 1000000000.0] and parameters: {'p_sma': 24, 'p_std': 25, 'p_atr': 11, 'p_adx': 28, 'rsi_period': 16, 'ema1': 25, 'ema2': 48, 'slip_atr_k': 0.07518525851984917, 'slip_spread_k': 0.3733009773522321, 'spread_hl_frac': 0.03743272259462347, 'bb_std_mult': 3.1187859217473792, 'rsi_os': 48, 'rsi_ob': 87, 'vol_spike': 0.012568211230433352, 'adx_thresh': 13.203005173659026, 'atr_min_pct': 0.027016261417621604, 'atr_max_pct': 0.08635318789373213, 'tp_mult': 2.2644824724403327, 'tsl_mult': 0.09221177289844268, 'strategy': 'mean_reversion', 'time_stop': 165, 'use_sma': True, 'use_atr': True, 'use_adx': True, 'use_ema': False, 'use_spike': False, 'rsi_required': True, 'edge_k': 0.7679643569083621, 'edge_cap': 0.6702994067992847, 'bull_strategy': 'mean_reversion', 'bull_bb_std_mult': 3.1535971419723294, 'bull_rsi_os': 13, 'bull_rsi_ob': 84, 'bull_adx_thresh': 12.804408400888644, 'bull_atr_min_pct': 0.019931074668746718, 'bull_atr_max_pct': 0.13767646879183662, 'bull_tp_mult': 1.4665597153052126, 'bull_tsl_mult': 0.7631855968838182, 'bull_time_stop': 211, 'bull_use_sma': False, 'bull_use_ema': True, 'bull_use_atr': True, 'bull_use_adx': True, 'bull_use_spike': False, 'bull_rsi_required': False, 'bear_strategy': 'mean_reversion', 'bear_bb_std_mult': 3.1630228179200808, 'bear_rsi_os': 55, 'bear_rsi_ob': 60, 'bear_adx_thresh': 15.180994864449524, 'bear_atr_min_pct': 0.005123937226864012, 'bear_atr_max_pct': 0.08503770594375654, 'bear_tp_mult': 2.26703916969197, 'bear_tsl_mult': 0.6809174511317349, 'bear_time_stop': 224, 'bear_use_sma': True, 'bear_use_ema': False, 'bear_use_atr': True, 'bear_use_adx': True, 'bear_use_spike': False, 'bear_rsi_required': False, 'sideways_strategy': 'breakout', 'sideways_bb_std_mult': 1.8790990216071362, 'sideways_rsi_os': 10, 'sideways_rsi_ob': 58, 'sideways_adx_thresh': 26.048604603338433, 'sideways_atr_min_pct': 0.0016799889630628182, 'sideways_atr_max_pct': 0.14651025675827944, 'sideways_tp_mult': 1.7936493557360245, 'sideways_tsl_mult': 0.5840855501366968, 'sideways_time_stop': 214, 'sideways_use_sma': True, 'sideways_use_ema': False, 'sideways_use_atr': False, 'sideways_use_adx': False, 'sideways_use_spike': False, 'sideways_rsi_required': True}.
[I 2025-08-30 16:20:53,063] Trial 372 finished with values: [-1000000000.0, 1000000000.0] and parameters: {'p_sma': 25, 'p_std': 59, 'p_atr': 11, 'p_adx': 25, 'rsi_period': 82, 'ema1': 18, 'ema2': 50, 'slip_atr_k': 0.004111693435127172, 'slip_spread_k': 0.6660341587504093, 'spread_hl_frac': 0.038235016693908865, 'bb_std_mult': 3.0486106795799466, 'rsi_os': 35, 'rsi_ob': 58, 'vol_spike': 0.09159491018085832, 'adx_thresh': 12.163427872343306, 'atr_min_pct': 0.019436667362894094, 'atr_max_pct': 0.08553204617387616, 'tp_mult': 2.2603587009167376, 'tsl_mult': 0.5835683485409374, 'strategy': 'mean_reversion', 'time_stop': 21, 'use_sma': False, 'use_atr': True, 'use_adx': True, 'use_ema': False, 'use_spike': False, 'rsi_required': True, 'edge_k': 1.4175844270379505, 'edge_cap': 0.5934802332765747, 'bull_strategy': 'mean_reversion', 'bull_bb_std_mult': 2.739337235474158, 'bull_rsi_os': 11, 'bull_rsi_ob': 65, 'bull_adx_thresh': 23.77053770112026, 'bull_atr_min_pct': 0.01391226858374858, 'bull_atr_max_pct': 0.13640758894884794, 'bull_tp_mult': 2.393384982272946, 'bull_tsl_mult': 0.2974666103875845, 'bull_time_stop': 71, 'bull_use_sma': False, 'bull_use_ema': True, 'bull_use_atr': True, 'bull_use_adx': True, 'bull_use_spike': False, 'bull_rsi_required': False, 'bear_strategy': 'mean_reversion', 'bear_bb_std_mult': 3.512343525021274, 'bear_rsi_os': 55, 'bear_rsi_ob': 63, 'bear_adx_thresh': 14.864860599629141, 'bear_atr_min_pct': 0.014822423899244624, 'bear_atr_max_pct': 0.07178939826235062, 'bear_tp_mult': 2.2815575626757885, 'bear_tsl_mult': 0.6742505814087533, 'bear_time_stop': 227, 'bear_use_sma': True, 'bear_use_ema': False, 'bear_use_atr': True, 'bear_use_adx': False, 'bear_use_spike': False, 'bear_rsi_required': False, 'sideways_strategy': 'breakout', 'sideways_bb_std_mult': 2.1968099781024115, 'sideways_rsi_os': 10, 'sideways_rsi_ob': 49, 'sideways_adx_thresh': 17.77330627147592, 'sideways_atr_min_pct': 0.001576082340058457, 'sideways_atr_max_pct': 0.07966521623043274, 'sideways_tp_mult': 1.4001179762724165, 'sideways_tsl_mult': 0.5348235151662292, 'sideways_time_stop': 153, 'sideways_use_sma': True, 'sideways_use_ema': False, 'sideways_use_atr': False, 'sideways_use_adx': False, 'sideways_use_spike': False, 'sideways_rsi_required': True}.
[I 2025-08-30 16:21:43,072] Trial 375 finished with values: [-1000000000.0, 1000000000.0] and parameters: {'p_sma': 7, 'p_std': 25, 'p_atr': 25, 'p_adx': 9, 'rsi_period': 16, 'ema1': 20, 'ema2': 12, 'slip_atr_k': 0.1728566874439492, 'slip_spread_k': 0.7660538749379421, 'spread_hl_frac': 0.017500863297230197, 'bb_std_mult': 0.7996879497079685, 'rsi_os': 37, 'rsi_ob': 88, 'vol_spike': 0.2630647211543763, 'adx_thresh': 15.561353649750483, 'atr_min_pct': 0.019214919428880366, 'atr_max_pct': 0.02724355086447297, 'tp_mult': 2.6097582408868116, 'tsl_mult': 0.4110697154672687, 'strategy': 'mean_reversion', 'time_stop': 21, 'use_sma': False, 'use_atr': True, 'use_adx': True, 'use_ema': False, 'use_spike': False, 'rsi_required': True, 'edge_k': 0.9705558698746983, 'edge_cap': 0.37666408401443974, 'bull_strategy': 'mean_reversion', 'bull_bb_std_mult': 1.8441697653757787, 'bull_rsi_os': 16, 'bull_rsi_ob': 55, 'bull_adx_thresh': 20.010990780967116, 'bull_atr_min_pct': 0.010937970370869554, 'bull_atr_max_pct': 0.14142609982150622, 'bull_tp_mult': 1.1379747496235697, 'bull_tsl_mult': 0.861701474800256, 'bull_time_stop': 70, 'bull_use_sma': False, 'bull_use_ema': True, 'bull_use_atr': True, 'bull_use_adx': True, 'bull_use_spike': False, 'bull_rsi_required': False, 'bear_strategy': 'mean_reversion', 'bear_bb_std_mult': 0.5609886330356542, 'bear_rsi_os': 28, 'bear_rsi_ob': 67, 'bear_adx_thresh': 7.444184382468393, 'bear_atr_min_pct': 0.021418511291423, 'bear_atr_max_pct': 0.09177891353438486, 'bear_tp_mult': 2.4579208855586527, 'bear_tsl_mult': 0.9200862183486045, 'bear_time_stop': 236, 'bear_use_sma': True, 'bear_use_ema': False, 'bear_use_atr': False, 'bear_use_adx': False, 'bear_use_spike': False, 'bear_rsi_required': False, 'sideways_strategy': 'breakout', 'sideways_bb_std_mult': 2.0785144276968244, 'sideways_rsi_os': 24, 'sideways_rsi_ob': 89, 'sideways_adx_thresh': 26.162511852405473, 'sideways_atr_min_pct': 0.0024366442928909194, 'sideways_atr_max_pct': 0.14740248233416348, 'sideways_tp_mult': 1.883403187637578, 'sideways_tsl_mult': 0.41106169004946863, 'sideways_time_stop': 155, 'sideways_use_sma': True, 'sideways_use_ema': False, 'sideways_use_atr': False, 'sideways_use_adx': False, 'sideways_use_spike': False, 'sideways_rsi_required': True}.
[I 2025-08-30 16:21:44,295] Trial 376 finished with values: [-1000000000.0, 1000000000.0] and parameters: {'p_sma': 7, 'p_std': 56, 'p_atr': 15, 'p_adx': 24, 'rsi_period': 49, 'ema1': 27, 'ema2': 12, 'slip_atr_k': 0.23495000642456249, 'slip_spread_k': 0.22427459798480887, 'spread_hl_frac': 0.017021386312358572, 'bb_std_mult': 1.6860271538395672, 'rsi_os': 37, 'rsi_ob': 95, 'vol_spike': 0.005944971064815485, 'adx_thresh': 32.07472442928585, 'atr_min_pct': 0.01840202640240001, 'atr_max_pct': 0.026770307832328616, 'tp_mult': 2.595962313080384, 'tsl_mult': 0.4069736705605742, 'strategy': 'mean_reversion', 'time_stop': 10, 'use_sma': False, 'use_atr': False, 'use_adx': True, 'use_ema': True, 'use_spike': False, 'rsi_required': True, 'edge_k': 1.5091287911618423, 'edge_cap': 0.7164377165127466, 'bull_strategy': 'mean_reversion', 'bull_bb_std_mult': 1.8521536666746732, 'bull_rsi_os': 55, 'bull_rsi_ob': 45, 'bull_adx_thresh': 21.16344598028788, 'bull_atr_min_pct': 0.010785120998753117, 'bull_atr_max_pct': 0.06453836753600795, 'bull_tp_mult': 1.2765412973043921, 'bull_tsl_mult': 0.2594562037252843, 'bull_time_stop': 83, 'bull_use_sma': False, 'bull_use_ema': True, 'bull_use_atr': True, 'bull_use_adx': True, 'bull_use_spike': True, 'bull_rsi_required': False, 'bear_strategy': 'breakout', 'bear_bb_std_mult': 2.071692072366464, 'bear_rsi_os': 9, 'bear_rsi_ob': 50, 'bear_adx_thresh': 12.021790547985765, 'bear_atr_min_pct': 0.011190416997325233, 'bear_atr_max_pct': 0.13513629467126775, 'bear_tp_mult': 2.694562618165314, 'bear_tsl_mult': 0.9351235760789707, 'bear_time_stop': 9, 'bear_use_sma': True, 'bear_use_ema': False, 'bear_use_atr': False, 'bear_use_adx': False, 'bear_use_spike': False, 'bear_rsi_required': False, 'sideways_strategy': 'mean_reversion', 'sideways_bb_std_mult': 1.3681000168707214, 'sideways_rsi_os': 26, 'sideways_rsi_ob': 90, 'sideways_adx_thresh': 16.20785042853869, 'sideways_atr_min_pct': 0.002973305247836711, 'sideways_atr_max_pct': 0.13863034854014245, 'sideways_tp_mult': 1.5281785019802285, 'sideways_tsl_mult': 0.026398144207717245, 'sideways_time_stop': 27, 'sideways_use_sma': False, 'sideways_use_ema': True, 'sideways_use_atr': False, 'sideways_use_adx': False, 'sideways_use_spike': True, 'sideways_rsi_required': True}.
[I 2025-08-30 16:21:44,830] Trial 377 finished with values: [-1000000000.0, 1000000000.0] and parameters: {'p_sma': 7, 'p_std': 58, 'p_atr': 25, 'p_adx': 21, 'rsi_period': 25, 'ema1': 28, 'ema2': 12, 'slip_atr_k': 0.23795489854409418, 'slip_spread_k': 0.6295970891262382, 'spread_hl_frac': 0.004255763007398737, 'bb_std_mult': 2.9669842301550258, 'rsi_os': 37, 'rsi_ob': 90, 'vol_spike': 0.00515994220102745, 'adx_thresh': 11.49986128613888, 'atr_min_pct': 0.019451576211445137, 'atr_max_pct': 0.1283030349805636, 'tp_mult': 2.590486892758964, 'tsl_mult': 0.99601537940057, 'strategy': 'mean_reversion', 'time_stop': 175, 'use_sma': False, 'use_atr': False, 'use_adx': True, 'use_ema': True, 'use_spike': False, 'rsi_required': True, 'edge_k': 1.608897749166825, 'edge_cap': 0.6327248946119978, 'bull_strategy': 'mean_reversion', 'bull_bb_std_mult': 1.8587808687813296, 'bull_rsi_os': 55, 'bull_rsi_ob': 45, 'bull_adx_thresh': 20.845559328337636, 'bull_atr_min_pct': 0.004739006792790157, 'bull_atr_max_pct': 0.12818603193226757, 'bull_tp_mult': 1.153121887730517, 'bull_tsl_mult': 0.26252204381620264, 'bull_time_stop': 101, 'bull_use_sma': False, 'bull_use_ema': True, 'bull_use_atr': True, 'bull_use_adx': True, 'bull_use_spike': True, 'bull_rsi_required': False, 'bear_strategy': 'breakout', 'bear_bb_std_mult': 1.8005190823755282, 'bear_rsi_os': 15, 'bear_rsi_ob': 89, 'bear_adx_thresh': 30.54677189467271, 'bear_atr_min_pct': 0.011190678462845691, 'bear_atr_max_pct': 0.09179906938575895, 'bear_tp_mult': 2.214529272187689, 'bear_tsl_mult': 0.6348987796330448, 'bear_time_stop': 235, 'bear_use_sma': True, 'bear_use_ema': False, 'bear_use_atr': False, 'bear_use_adx': False, 'bear_use_spike': False, 'bear_rsi_required': False, 'sideways_strategy': 'mean_reversion', 'sideways_bb_std_mult': 2.0859081026658726, 'sideways_rsi_os': 35, 'sideways_rsi_ob': 90, 'sideways_adx_thresh': 16.154759517975602, 'sideways_atr_min_pct': 0.002734345942208535, 'sideways_atr_max_pct': 0.055472328035557614, 'sideways_tp_mult': 1.4251752549052268, 'sideways_tsl_mult': 0.4384294296425189, 'sideways_time_stop': 207, 'sideways_use_sma': False, 'sideways_use_ema': True, 'sideways_use_atr': False, 'sideways_use_adx': False, 'sideways_use_spike': True, 'sideways_rsi_required': True}.
