[I 2025-08-30 16:07:59,077] Trial 296 finished with values: [-1000000000.0, 1000000000.0] and parameters: {'p_sma': 6, 'p_std': 57, 'p_atr': 27, 'p_adx': 23, 'rsi_period': 15, 'ema1': 16, 'ema2': 10, 'slip_atr_k': 0.0986055089715903, 'slip_spread_k': 0.6013194910632118, 'spread_hl_frac': 0.014921696189900557, 'bb_std_mult': 3.1921857495550285, 'rsi_os': 35, 'rsi_ob': 93, 'vol_spike': 7.609745176370705e-05, 'adx_thresh': 13.147865213886584, 'atr_min_pct': 0.018070743720060355, 'atr_max_pct': 0.1290472412443322, 'tp_mult': 2.9344431803711766, 'tsl_mult': 0.27883978288998756, 'strategy': 'mean_reversion', 'time_stop': 63, 'use_sma': False, 'use_atr': True, 'use_adx': True, 'use_ema': True, 'use_spike': False, 'rsi_required': True, 'edge_k': 1.625692463019624, 'edge_cap': 0.6049919402579831, 'bull_strategy': 'mean_reversion', 'bull_bb_std_mult': 1.8683038952606517, 'bull_rsi_os': 54, 'bull_rsi_ob': 53, 'bull_adx_thresh': 21.269080894669056, 'bull_atr_min_pct': 0.020105018000789225, 'bull_atr_max_pct': 0.13359392930077146, 'bull_tp_mult': 1.3908112619281472, 'bull_tsl_mult': 0.29619444848489745, 'bull_time_stop': 69, 'bull_use_sma': False, 'bull_use_ema': True, 'bull_use_atr': True, 'bull_use_adx': True, 'bull_use_spike': False, 'bull_rsi_required': False, 'bear_strategy': 'breakout', 'bear_bb_std_mult': 2.9106492662976216, 'bear_rsi_os': 11, 'bear_rsi_ob': 79, 'bear_adx_thresh': 28.197502179182482, 'bear_atr_min_pct': 0.022707557749884196, 'bear_atr_max_pct': 0.09901132381599603, 'bear_tp_mult': 2.2224079643151655, 'bear_tsl_mult': 0.6290027325278438, 'bear_time_stop': 225, 'bear_use_sma': True, 'bear_use_ema': False, 'bear_use_atr': False, 'bear_use_adx': False, 'bear_use_spike': False, 'bear_rsi_required': False, 'sideways_strategy': 'breakout', 'sideways_bb_std_mult': 2.0713640341819173, 'sideways_rsi_os': 28, 'sideways_rsi_ob': 56, 'sideways_adx_thresh': 18.22934672529306, 'sideways_atr_min_pct': 0.0019106772867261697, 'sideways_atr_max_pct': 0.05802203789480102, 'sideways_tp_mult': 1.4297355536743264, 'sideways_tsl_mult': 0.45954348651051546, 'sideways_time_stop': 212, 'sideways_use_sma': False, 'sideways_use_ema': False, 'sideways_use_atr': False, 'sideways_use_adx': False, 'sideways_use_spike': False, 'sideways_rsi_required': True}.
[I 2025-08-30 16:07:59,446] Trial 295 finished with values: [-0.023204787635934143, 0.02315614303251889] and parameters: {'p_sma': 8, 'p_std': 60, 'p_atr': 27, 'p_adx': 23, 'rsi_period': 19, 'ema1': 20, 'ema2': 13, 'slip_atr_k': 0.0007280733281546242, 'slip_spread_k': 0.5961291821672529, 'spread_hl_frac': 0.014935991767674045, 'bb_std_mult': 3.212842082255335, 'rsi_os': 35, 'rsi_ob': 90, 'vol_spike': 0.00037026530948233136, 'adx_thresh': 13.193255473986701, 'atr_min_pct': 0.01864902764029103, 'atr_max_pct': 0.12885292011282945, 'tp_mult': 2.6203212112132923, 'tsl_mult': 0.681371770365607, 'strategy': 'mean_reversion', 'time_stop': 198, 'use_sma': False, 'use_atr': True, 'use_adx': True, 'use_ema': True, 'use_spike': False, 'rsi_required': True, 'edge_k': 1.4354409089437103, 'edge_cap': 0.2554841425979347, 'bull_strategy': 'mean_reversion', 'bull_bb_std_mult': 2.094356809311159, 'bull_rsi_os': 15, 'bull_rsi_ob': 51, 'bull_adx_thresh': 22.591327147737694, 'bull_atr_min_pct': 0.020290164052338067, 'bull_atr_max_pct': 0.13446978082858974, 'bull_tp_mult': 1.2338525962847848, 'bull_tsl_mult': 0.29435002158682155, 'bull_time_stop': 140, 'bull_use_sma': False, 'bull_use_ema': True, 'bull_use_atr': True, 'bull_use_adx': True, 'bull_use_spike': False, 'bull_rsi_required': False, 'bear_strategy': 'breakout', 'bear_bb_std_mult': 1.5172608702963322, 'bear_rsi_os': 11, 'bear_rsi_ob': 79, 'bear_adx_thresh': 12.657221521011083, 'bear_atr_min_pct': 0.0227471312604649, 'bear_atr_max_pct': 0.030599570349884322, 'bear_tp_mult': 2.188554471809379, 'bear_tsl_mult': 0.666386366108767, 'bear_time_stop': 221, 'bear_use_sma': True, 'bear_use_ema': False, 'bear_use_atr': False, 'bear_use_adx': False, 'bear_use_spike': False, 'bear_rsi_required': False, 'sideways_strategy': 'mean_reversion', 'sideways_bb_std_mult': 2.2468229033572245, 'sideways_rsi_os': 28, 'sideways_rsi_ob': 47, 'sideways_adx_thresh': 18.03613891783576, 'sideways_atr_min_pct': 0.0014214768668544106, 'sideways_atr_max_pct': 0.05201805153071118, 'sideways_tp_mult': 1.4938606379243773, 'sideways_tsl_mult': 0.45611232887500275, 'sideways_time_stop': 199, 'sideways_use_sma': True, 'sideways_use_ema': False, 'sideways_use_atr': False, 'sideways_use_adx': False, 'sideways_use_spike': False, 'sideways_rsi_required': True}.
[I 2025-08-30 16:08:41,800] Trial 299 finished with values: [-1000000000.0, 1000000000.0] and parameters: {'p_sma': 10, 'p_std': 58, 'p_atr': 27, 'p_adx': 23, 'rsi_period': 15, 'ema1': 22, 'ema2': 11, 'slip_atr_k': 0.13714609953752538, 'slip_spread_k': 0.5610428205479288, 'spread_hl_frac': 0.015368422061395094, 'bb_std_mult': 3.544269131166367, 'rsi_os': 35, 'rsi_ob': 90, 'vol_spike': 0.16343427073935096, 'adx_thresh': 13.02510170161211, 'atr_min_pct': 0.01844795382656926, 'atr_max_pct': 0.06183977587189192, 'tp_mult': 2.910771427682878, 'tsl_mult': 0.4488208571245666, 'strategy': 'mean_reversion', 'time_stop': 19, 'use_sma': False, 'use_atr': False, 'use_adx': True, 'use_ema': True, 'use_spike': False, 'rsi_required': True, 'edge_k': 1.5689994272103795, 'edge_cap': 0.608274548739648, 'bull_strategy': 'mean_reversion', 'bull_bb_std_mult': 1.8614333521938127, 'bull_rsi_os': 11, 'bull_rsi_ob': 48, 'bull_adx_thresh': 21.157184386616247, 'bull_atr_min_pct': 0.0200510249952551, 'bull_atr_max_pct': 0.13420748009532474, 'bull_tp_mult': 1.4124140511520102, 'bull_tsl_mult': 0.2985064293274078, 'bull_time_stop': 49, 'bull_use_sma': False, 'bull_use_ema': True, 'bull_use_atr': True, 'bull_use_adx': True, 'bull_use_spike': True, 'bull_rsi_required': False, 'bear_strategy': 'breakout', 'bear_bb_std_mult': 1.9666985533108163, 'bear_rsi_os': 12, 'bear_rsi_ob': 77, 'bear_adx_thresh': 20.88433243573435, 'bear_atr_min_pct': 0.021652121510919196, 'bear_atr_max_pct': 0.14450036951152206, 'bear_tp_mult': 2.1318926422379123, 'bear_tsl_mult': 0.6429650938608905, 'bear_time_stop': 230, 'bear_use_sma': True, 'bear_use_ema': False, 'bear_use_atr': False, 'bear_use_adx': False, 'bear_use_spike': False, 'bear_rsi_required': False, 'sideways_strategy': 'breakout', 'sideways_bb_std_mult': 2.2269214295739, 'sideways_rsi_os': 39, 'sideways_rsi_ob': 62, 'sideways_adx_thresh': 30.656969676352904, 'sideways_atr_min_pct': 0.0020308385330370547, 'sideways_atr_max_pct': 0.01378906584085128, 'sideways_tp_mult': 1.4928965710221622, 'sideways_tsl_mult': 0.45821365087386795, 'sideways_time_stop': 212, 'sideways_use_sma': True, 'sideways_use_ema': False, 'sideways_use_atr': False, 'sideways_use_adx': False, 'sideways_use_spike': True, 'sideways_rsi_required': True}.
[I 2025-08-30 16:08:42,488] Trial 300 finished with values: [-1000000000.0, 1000000000.0] and parameters: {'p_sma': 11, 'p_std': 29, 'p_atr': 23, 'p_adx': 24, 'rsi_period': 17, 'ema1': 12, 'ema2': 12, 'slip_atr_k': 0.009717121481349515, 'slip_spread_k': 0.5854660498495836, 'spread_hl_frac': 0.016814655931381622, 'bb_std_mult': 2.481519606882459, 'rsi_os': 35, 'rsi_ob': 89, 'vol_spike': 0.11820191890247149, 'adx_thresh': 14.072404072745869, 'atr_min_pct': 0.01916072201050017, 'atr_max_pct': 0.060458698393851484, 'tp_mult': 2.891270350965777, 'tsl_mult': 0.44949416342683246, 'strategy': 'mean_reversion', 'time_stop': 183, 'use_sma': True, 'use_atr': True, 'use_adx': True, 'use_ema': False, 'use_spike': False, 'rsi_required': True, 'edge_k': 1.575576283151626, 'edge_cap': 0.6357649513158387, 'bull_strategy': 'mean_reversion', 'bull_bb_std_mult': 2.1110196297537356, 'bull_rsi_os': 42, 'bull_rsi_ob': 51, 'bull_adx_thresh': 19.762655166502228, 'bull_atr_min_pct': 0.019079985804857962, 'bull_atr_max_pct': 0.13550017150943433, 'bull_tp_mult': 1.396306374441075, 'bull_tsl_mult': 0.2662156564540889, 'bull_time_stop': 138, 'bull_use_sma': False, 'bull_use_ema': True, 'bull_use_atr': True, 'bull_use_adx': True, 'bull_use_spike': True, 'bull_rsi_required': False, 'bear_strategy': 'mean_reversion', 'bear_bb_std_mult': 1.9691537904137604, 'bear_rsi_os': 13, 'bear_rsi_ob': 77, 'bear_adx_thresh': 21.084964755706338, 'bear_atr_min_pct': 0.02169301378202452, 'bear_atr_max_pct': 0.1449879516869773, 'bear_tp_mult': 2.1480708759895926, 'bear_tsl_mult': 0.6480543565474988, 'bear_time_stop': 212, 'bear_use_sma': True, 'bear_use_ema': False, 'bear_use_atr': False, 'bear_use_adx': True, 'bear_use_spike': False, 'bear_rsi_required': True, 'sideways_strategy': 'breakout', 'sideways_bb_std_mult': 2.1438347745092243, 'sideways_rsi_os': 16, 'sideways_rsi_ob': 48, 'sideways_adx_thresh': 8.379100926647316, 'sideways_atr_min_pct': 0.0004192926641553552, 'sideways_atr_max_pct': 0.01492891396431796, 'sideways_tp_mult': 1.4878400535159781, 'sideways_tsl_mult': 0.5114866687504853, 'sideways_time_stop': 200, 'sideways_use_sma': True, 'sideways_use_ema': False, 'sideways_use_atr': False, 'sideways_use_adx': False, 'sideways_use_spike': True, 'sideways_rsi_required': True}.
[I 2025-08-30 16:08:43,111] Trial 301 finished with values: [-0.023211976114167143, 0.02318796499027281] and parameters: {'p_sma': 8, 'p_std': 58, 'p_atr': 23, 'p_adx': 24, 'rsi_period': 20, 'ema1': 7, 'ema2': 12, 'slip_atr_k': 0.227347011491826, 'slip_spread_k': 0.5294046225970439, 'spread_hl_frac': 0.016949019915357383, 'bb_std_mult': 2.204591021741084, 'rsi_os': 35, 'rsi_ob': 90, 'vol_spike': 0.2380326569679583, 'adx_thresh': 11.852360471758624, 'atr_min_pct': 0.01960894365457937, 'atr_max_pct': 0.05978226995082085, 'tp_mult': 2.9837013777057577, 'tsl_mult': 0.6857876400930643, 'strategy': 'mean_reversion', 'time_stop': 119, 'use_sma': True, 'use_atr': True, 'use_adx': True, 'use_ema': False, 'use_spike': False, 'rsi_required': True, 'edge_k': 1.5738509031530117, 'edge_cap': 0.5636208393658317, 'bull_strategy': 'mean_reversion', 'bull_bb_std_mult': 2.096550253637768, 'bull_rsi_os': 43, 'bull_rsi_ob': 48, 'bull_adx_thresh': 19.92636069327443, 'bull_atr_min_pct': 0.018736620825879992, 'bull_atr_max_pct': 0.13527008573726965, 'bull_tp_mult': 1.413548757138992, 'bull_tsl_mult': 0.28050348395582714, 'bull_time_stop': 159, 'bull_use_sma': False, 'bull_use_ema': True, 'bull_use_atr': True, 'bull_use_adx': True, 'bull_use_spike': True, 'bull_rsi_required': False, 'bear_strategy': 'mean_reversion', 'bear_bb_std_mult': 1.9783985152904269, 'bear_rsi_os': 13, 'bear_rsi_ob': 77, 'bear_adx_thresh': 12.035714600488262, 'bear_atr_min_pct': 0.021786415568193218, 'bear_atr_max_pct': 0.14734980447960327, 'bear_tp_mult': 2.1561576262731497, 'bear_tsl_mult': 0.6866634993583853, 'bear_time_stop': 215, 'bear_use_sma': True, 'bear_use_ema': False, 'bear_use_atr': False, 'bear_use_adx': True, 'bear_use_spike': False, 'bear_rsi_required': True, 'sideways_strategy': 'breakout', 'sideways_bb_std_mult': 2.173719406674582, 'sideways_rsi_os': 24, 'sideways_rsi_ob': 54, 'sideways_adx_thresh': 8.722195058894384, 'sideways_atr_min_pct': 0.00042451174290572427, 'sideways_atr_max_pct': 0.01604537698452528, 'sideways_tp_mult': 1.4912856068788989, 'sideways_tsl_mult': 0.5289125862502009, 'sideways_time_stop': 198, 'sideways_use_sma': True, 'sideways_use_ema': False, 'sideways_use_atr': False, 'sideways_use_adx': False, 'sideways_use_spike': True, 'sideways_rsi_required': True}.
[I 2025-08-30 16:08:43,372] Trial 302 finished with values: [-1000000000.0, 0.1739068676655974] and parameters: {'p_sma': 11, 'p_std': 29, 'p_atr': 28, 'p_adx': 25, 'rsi_period': 16, 'ema1': 7, 'ema2': 12, 'slip_atr_k': 0.14748747155896433, 'slip_spread_k': 0.5424009033842289, 'spread_hl_frac': 0.019627780331808824, 'bb_std_mult': 3.0987730717073316, 'rsi_os': 36, 'rsi_ob': 89, 'vol_spike': 0.14070229281161784, 'adx_thresh': 13.769826389429733, 'atr_min_pct': 0.019705692476820823, 'atr_max_pct': 0.06127830918221508, 'tp_mult': 2.6899414946044007, 'tsl_mult': 0.6342206576097514, 'strategy': 'mean_reversion', 'time_stop': 17, 'use_sma': True, 'use_atr': False, 'use_adx': True, 'use_ema': False, 'use_spike': False, 'rsi_required': True, 'edge_k': 1.5503024938005308, 'edge_cap': 0.6798236619859813, 'bull_strategy': 'mean_reversion', 'bull_bb_std_mult': 1.86412672590527, 'bull_rsi_os': 42, 'bull_rsi_ob': 48, 'bull_adx_thresh': 21.018704571983115, 'bull_atr_min_pct': 0.01896745705212101, 'bull_atr_max_pct': 0.13738716328183428, 'bull_tp_mult': 1.4220828407877013, 'bull_tsl_mult': 0.2745871503782415, 'bull_time_stop': 61, 'bull_use_sma': False, 'bull_use_ema': True, 'bull_use_atr': True, 'bull_use_adx': True, 'bull_use_spike': True, 'bull_rsi_required': False, 'bear_strategy': 'mean_reversion', 'bear_bb_std_mult': 1.7051745943419174, 'bear_rsi_os': 14, 'bear_rsi_ob': 77, 'bear_adx_thresh': 11.894368260457037, 'bear_atr_min_pct': 0.021821540941465316, 'bear_atr_max_pct': 0.09013653756204341, 'bear_tp_mult': 2.140151220336404, 'bear_tsl_mult': 0.7168147976065735, 'bear_time_stop': 213, 'bear_use_sma': True, 'bear_use_ema': True, 'bear_use_atr': False, 'bear_use_adx': True, 'bear_use_spike': False, 'bear_rsi_required': True, 'sideways_strategy': 'breakout', 'sideways_bb_std_mult': 2.1370283640456256, 'sideways_rsi_os': 44, 'sideways_rsi_ob': 92, 'sideways_adx_thresh': 16.426432036863115, 'sideways_atr_min_pct': 0.0003146219932177027, 'sideways_atr_max_pct': 0.1436899323980058, 'sideways_tp_mult': 1.4738131976534374, 'sideways_tsl_mult': 0.5418665484538231, 'sideways_time_stop': 214, 'sideways_use_sma': True, 'sideways_use_ema': False, 'sideways_use_atr': False, 'sideways_use_adx': False, 'sideways_use_spike': True, 'sideways_rsi_required': True}.
[I 2025-08-30 16:09:25,163] Trial 305 finished with values: [-1000000000.0, 1000000000.0] and parameters: {'p_sma': 6, 'p_std': 55, 'p_atr': 13, 'p_adx': 24, 'rsi_period': 23, 'ema1': 25, 'ema2': 11, 'slip_atr_k': 0.07581586833933539, 'slip_spread_k': 0.6220840892393068, 'spread_hl_frac': 0.01801113730486331, 'bb_std_mult': 3.093492366056869, 'rsi_os': 27, 'rsi_ob': 88, 'vol_spike': 0.010365007354056046, 'adx_thresh': 14.695602354401796, 'atr_min_pct': 0.018930973868093205, 'atr_max_pct': 0.1368363646451817, 'tp_mult': 2.816591568673888, 'tsl_mult': 0.6125380255880936, 'strategy': 'mean_reversion', 'time_stop': 5, 'use_sma': False, 'use_atr': True, 'use_adx': True, 'use_ema': False, 'use_spike': False, 'rsi_required': True, 'edge_k': 1.513846197472008, 'edge_cap': 0.6228533235889414, 'bull_strategy': 'mean_reversion', 'bull_bb_std_mult': 3.476854623729987, 'bull_rsi_os': 12, 'bull_rsi_ob': 49, 'bull_adx_thresh': 20.43210991230092, 'bull_atr_min_pct': 0.020744199793495347, 'bull_atr_max_pct': 0.14323075405068722, 'bull_tp_mult': 1.2650512426050446, 'bull_tsl_mult': 0.07202811614842752, 'bull_time_stop': 249, 'bull_use_sma': False, 'bull_use_ema': False, 'bull_use_atr': True, 'bull_use_adx': True, 'bull_use_spike': False, 'bull_rsi_required': False, 'bear_strategy': 'mean_reversion', 'bear_bb_std_mult': 3.5248238029279184, 'bear_rsi_os': 13, 'bear_rsi_ob': 69, 'bear_adx_thresh': 13.444740882968043, 'bear_atr_min_pct': 0.020556366598474846, 'bear_atr_max_pct': 0.11708811782411666, 'bear_tp_mult': 2.2313760158484883, 'bear_tsl_mult': 0.6584592205709906, 'bear_time_stop': 237, 'bear_use_sma': True, 'bear_use_ema': True, 'bear_use_atr': False, 'bear_use_adx': False, 'bear_use_spike': False, 'bear_rsi_required': False, 'sideways_strategy': 'breakout', 'sideways_bb_std_mult': 2.017989624761196, 'sideways_rsi_os': 26, 'sideways_rsi_ob': 94, 'sideways_adx_thresh': 16.466301028583253, 'sideways_atr_min_pct': 0.02814422599670082, 'sideways_atr_max_pct': 0.045560391827723236, 'sideways_tp_mult': 1.546602667274601, 'sideways_tsl_mult': 0.4812106245210805, 'sideways_time_stop': 188, 'sideways_use_sma': True, 'sideways_use_ema': False, 'sideways_use_atr': True, 'sideways_use_adx': False, 'sideways_use_spike': False, 'sideways_rsi_required': False}.
[I 2025-08-30 16:09:26,069] Trial 304 finished with values: [-1000000000.0, 1000000000.0] and parameters: {'p_sma': 8, 'p_std': 44, 'p_atr': 28, 'p_adx': 25, 'rsi_period': 17, 'ema1': 5, 'ema2': 12, 'slip_atr_k': 0.14511880313093078, 'slip_spread_k': 0.6306646148690971, 'spread_hl_frac': 0.01955744465306664, 'bb_std_mult': 3.0960917146565476, 'rsi_os': 36, 'rsi_ob': 93, 'vol_spike': 0.2365092543530682, 'adx_thresh': 12.207060061344661, 'atr_min_pct': 0.019284525056603583, 'atr_max_pct': 0.13660705986789595, 'tp_mult': 2.821476099474588, 'tsl_mult': 0.5031337164606845, 'strategy': 'mean_reversion', 'time_stop': 16, 'use_sma': True, 'use_atr': True, 'use_adx': True, 'use_ema': False, 'use_spike': False, 'rsi_required': True, 'edge_k': 1.6912201649227494, 'edge_cap': 0.6707545668058524, 'bull_strategy': 'mean_reversion', 'bull_bb_std_mult': 1.956585092259275, 'bull_rsi_os': 12, 'bull_rsi_ob': 49, 'bull_adx_thresh': 20.140355389475797, 'bull_atr_min_pct': 0.020843508461522213, 'bull_atr_max_pct': 0.1308101303631221, 'bull_tp_mult': 2.3033565604507933, 'bull_tsl_mult': 0.27426025668474285, 'bull_time_stop': 61, 'bull_use_sma': False, 'bull_use_ema': False, 'bull_use_atr': True, 'bull_use_adx': True, 'bull_use_spike': False, 'bull_rsi_required': False, 'bear_strategy': 'mean_reversion', 'bear_bb_std_mult': 1.4105730463373494, 'bear_rsi_os': 13, 'bear_rsi_ob': 61, 'bear_adx_thresh': 12.015722971037947, 'bear_atr_min_pct': 0.02195977044921281, 'bear_atr_max_pct': 0.09090492749322752, 'bear_tp_mult': 2.2456339258977835, 'bear_tsl_mult': 0.7175488904417602, 'bear_time_stop': 217, 'bear_use_sma': True, 'bear_use_ema': True, 'bear_use_atr': False, 'bear_use_adx': True, 'bear_use_spike': False, 'bear_rsi_required': True, 'sideways_strategy': 'breakout', 'sideways_bb_std_mult': 2.02105647850126, 'sideways_rsi_os': 44, 'sideways_rsi_ob': 58, 'sideways_adx_thresh': 16.625383422107827, 'sideways_atr_min_pct': 0.016581435843742776, 'sideways_atr_max_pct': 0.03952019796899917, 'sideways_tp_mult': 1.539551587255781, 'sideways_tsl_mult': 0.5363643425391369, 'sideways_time_stop': 212, 'sideways_use_sma': True, 'sideways_use_ema': False, 'sideways_use_atr': True, 'sideways_use_adx': False, 'sideways_use_spike': False, 'sideways_rsi_required': False}.
[I 2025-08-30 16:09:27,358] Trial 306 finished with values: [-1000000000.0, 1000000000.0] and parameters: {'p_sma': 6, 'p_std': 40, 'p_atr': 28, 'p_adx': 24, 'rsi_period': 21, 'ema1': 25, 'ema2': 11, 'slip_atr_k': 0.00844529766847906, 'slip_spread_k': 0.6163554120240262, 'spread_hl_frac': 0.017712445064816642, 'bb_std_mult': 3.337033979521191, 'rsi_os': 34, 'rsi_ob': 92, 'vol_spike': 0.008299185601441127, 'adx_thresh': 14.62667179531748, 'atr_min_pct': 0.019126593814871397, 'atr_max_pct': 0.08329640893026699, 'tp_mult': 2.8156494614551546, 'tsl_mult': 0.3237174073102004, 'strategy': 'mean_reversion', 'time_stop': 10, 'use_sma': False, 'use_atr': True, 'use_adx': True, 'use_ema': False, 'use_spike': False, 'rsi_required': True, 'edge_k': 1.5219618387802027, 'edge_cap': 0.6697119837785837, 'bull_strategy': 'mean_reversion', 'bull_bb_std_mult': 1.9629600242411605, 'bull_rsi_os': 12, 'bull_rsi_ob': 49, 'bull_adx_thresh': 20.487748795887867, 'bull_atr_min_pct': 0.020731463257219536, 'bull_atr_max_pct': 0.13016603487316566, 'bull_tp_mult': 1.2643287991947454, 'bull_tsl_mult': 0.3048268304461578, 'bull_time_stop': 254, 'bull_use_sma': False, 'bull_use_ema': False, 'bull_use_atr': True, 'bull_use_adx': True, 'bull_use_spike': False, 'bull_rsi_required': False, 'bear_strategy': 'mean_reversion', 'bear_bb_std_mult': 1.404505391236838, 'bear_rsi_os': 13, 'bear_rsi_ob': 69, 'bear_adx_thresh': 13.263120045989327, 'bear_atr_min_pct': 0.020733244803696572, 'bear_atr_max_pct': 0.09268688211500493, 'bear_tp_mult': 2.2342984383598057, 'bear_tsl_mult': 0.6529008193930825, 'bear_time_stop': 238, 'bear_use_sma': True, 'bear_use_ema': True, 'bear_use_atr': False, 'bear_use_adx': False, 'bear_use_spike': False, 'bear_rsi_required': False, 'sideways_strategy': 'breakout', 'sideways_bb_std_mult': 2.026279295713405, 'sideways_rsi_os': 25, 'sideways_rsi_ob': 94, 'sideways_adx_thresh': 16.385245851005134, 'sideways_atr_min_pct': 0.008414523039129356, 'sideways_atr_max_pct': 0.04017667915180642, 'sideways_tp_mult': 1.405090749052268, 'sideways_tsl_mult': 0.47841611383618887, 'sideways_time_stop': 79, 'sideways_use_sma': True, 'sideways_use_ema': False, 'sideways_use_atr': True, 'sideways_use_adx': False, 'sideways_use_spike': False, 'sideways_rsi_required': False}.
