[I 2025-08-30 17:25:44,895] Trial 754 finished with values: [-1000000000.0, 1000000000.0] and parameters: {'p_sma': 9, 'p_std': 18, 'p_atr': 14, 'p_adx': 12, 'rsi_period': 70, 'ema1': 29, 'ema2': 11, 'slip_atr_k': 0.2136047224645155, 'slip_spread_k': 0.8950545228654043, 'spread_hl_frac': 0.008641168847818896, 'bb_std_mult': 2.232851915339662, 'rsi_os': 22, 'rsi_ob': 65, 'vol_spike': 0.19735543969892091, 'adx_thresh': 34.29711170956634, 'atr_min_pct': 0.0023757596740770423, 'atr_max_pct': 0.053171284306561595, 'tp_mult': 1.3465519978489628, 'tsl_mult': 0.9127307414038252, 'strategy': 'mean_reversion', 'time_stop': 255, 'use_sma': False, 'use_atr': True, 'use_adx': True, 'use_ema': False, 'use_spike': False, 'rsi_required': True, 'edge_k': 0.6970040301692189, 'edge_cap': 0.9402136957794607, 'bull_strategy': 'mean_reversion', 'bull_bb_std_mult': 1.8902340008674243, 'bull_rsi_os': 19, 'bull_rsi_ob': 54, 'bull_adx_thresh': 27.50039259919624, 'bull_atr_min_pct': 0.025943111102642732, 'bull_atr_max_pct': 0.13618553603503689, 'bull_tp_mult': 2.2696675884834856, 'bull_tsl_mult': 0.8098759336596271, 'bull_time_stop': 261, 'bull_use_sma': True, 'bull_use_ema': True, 'bull_use_atr': False, 'bull_use_adx': True, 'bull_use_spike': False, 'bull_rsi_required': True, 'bear_strategy': 'mean_reversion', 'bear_bb_std_mult': 3.5622435937736245, 'bear_rsi_os': 51, 'bear_rsi_ob': 78, 'bear_adx_thresh': 8.38640114985147, 'bear_atr_min_pct': 0.016976483888436117, 'bear_atr_max_pct': 0.07323675861128762, 'bear_tp_mult': 1.1589548713744438, 'bear_tsl_mult': 0.5621942952235245, 'bear_time_stop': 180, 'bear_use_sma': True, 'bear_use_ema': True, 'bear_use_atr': False, 'bear_use_adx': False, 'bear_use_spike': False, 'bear_rsi_required': False, 'sideways_strategy': 'mean_reversion', 'sideways_bb_std_mult': 0.7875354550582236, 'sideways_rsi_os': 30, 'sideways_rsi_ob': 71, 'sideways_adx_thresh': 24.506875694342465, 'sideways_atr_min_pct': 0.0016829388463483453, 'sideways_atr_max_pct': 0.10222332667979765, 'sideways_tp_mult': 2.159456772315482, 'sideways_tsl_mult': 0.45854627824321154, 'sideways_time_stop': 264, 'sideways_use_sma': False, 'sideways_use_ema': False, 'sideways_use_atr': True, 'sideways_use_adx': False, 'sideways_use_spike': False, 'sideways_rsi_required': False}.
[I 2025-08-30 17:25:47,804] Trial 757 finished with values: [-1000000000.0, 1000000000.0] and parameters: {'p_sma': 6, 'p_std': 44, 'p_atr': 15, 'p_adx': 16, 'rsi_period': 24, 'ema1': 16, 'ema2': 10, 'slip_atr_k': 0.0236968957725676, 'slip_spread_k': 0.9717032497640214, 'spread_hl_frac': 0.017488870532111428, 'bb_std_mult': 2.032367122771638, 'rsi_os': 41, 'rsi_ob': 86, 'vol_spike': 0.1143911752712901, 'adx_thresh': 11.974613131343629, 'atr_min_pct': 0.0022921240411928993, 'atr_max_pct': 0.1421578830945016, 'tp_mult': 2.7962746227184, 'tsl_mult': 0.2517291688218806, 'strategy': 'mean_reversion', 'time_stop': 267, 'use_sma': False, 'use_atr': True, 'use_adx': True, 'use_ema': True, 'use_spike': False, 'rsi_required': True, 'edge_k': 0.33394930354129343, 'edge_cap': 0.9021230534896143, 'bull_strategy': 'mean_reversion', 'bull_bb_std_mult': 1.9660268054597854, 'bull_rsi_os': 10, 'bull_rsi_ob': 83, 'bull_adx_thresh': 28.10390713272126, 'bull_atr_min_pct': 0.022880500677107826, 'bull_atr_max_pct': 0.13735211377811274, 'bull_tp_mult': 2.6429176678192294, 'bull_tsl_mult': 0.5126925301584969, 'bull_time_stop': 76, 'bull_use_sma': True, 'bull_use_ema': False, 'bull_use_atr': False, 'bull_use_adx': True, 'bull_use_spike': False, 'bull_rsi_required': True, 'bear_strategy': 'breakout', 'bear_bb_std_mult': 1.2099379954680969, 'bear_rsi_os': 18, 'bear_rsi_ob': 75, 'bear_adx_thresh': 33.622291977816616, 'bear_atr_min_pct': 0.018592502306908055, 'bear_atr_max_pct': 0.05102703718980008, 'bear_tp_mult': 2.1533236465881886, 'bear_tsl_mult': 0.670774248934231, 'bear_time_stop': 110, 'bear_use_sma': True, 'bear_use_ema': True, 'bear_use_atr': False, 'bear_use_adx': False, 'bear_use_spike': False, 'bear_rsi_required': False, 'sideways_strategy': 'breakout', 'sideways_bb_std_mult': 0.6379970628785245, 'sideways_rsi_os': 32, 'sideways_rsi_ob': 69, 'sideways_adx_thresh': 13.021852713556939, 'sideways_atr_min_pct': 0.029956199553022547, 'sideways_atr_max_pct': 0.10206667208931595, 'sideways_tp_mult': 2.8252967379764704, 'sideways_tsl_mult': 0.4510552738278246, 'sideways_time_stop': 158, 'sideways_use_sma': True, 'sideways_use_ema': False, 'sideways_use_atr': True, 'sideways_use_adx': False, 'sideways_use_spike': False, 'sideways_rsi_required': False}.
[I 2025-08-30 17:25:48,487] Trial 760 finished with values: [-1000000000.0, 1000000000.0] and parameters: {'p_sma': 39, 'p_std': 23, 'p_atr': 9, 'p_adx': 16, 'rsi_period': 24, 'ema1': 16, 'ema2': 10, 'slip_atr_k': 0.02422195537735334, 'slip_spread_k': 0.43124183254354304, 'spread_hl_frac': 0.017495691931286996, 'bb_std_mult': 3.1449634588969344, 'rsi_os': 54, 'rsi_ob': 84, 'vol_spike': 0.09357041023150547, 'adx_thresh': 10.943323437014696, 'atr_min_pct': 0.020387769738574445, 'atr_max_pct': 0.08762115024486584, 'tp_mult': 1.4256241088499055, 'tsl_mult': 0.6746464336405749, 'strategy': 'mean_reversion', 'time_stop': 34, 'use_sma': True, 'use_atr': False, 'use_adx': False, 'use_ema': True, 'use_spike': True, 'rsi_required': True, 'edge_k': 0.6826557040953265, 'edge_cap': 0.83323076097613, 'bull_strategy': 'breakout', 'bull_bb_std_mult': 1.0284321060115278, 'bull_rsi_os': 55, 'bull_rsi_ob': 88, 'bull_adx_thresh': 7.3244750991816225, 'bull_atr_min_pct': 0.013467937630391199, 'bull_atr_max_pct': 0.032984400034284156, 'bull_tp_mult': 1.7422760311580614, 'bull_tsl_mult': 0.6540492837895162, 'bull_time_stop': 38, 'bull_use_sma': True, 'bull_use_ema': False, 'bull_use_atr': False, 'bull_use_adx': False, 'bull_use_spike': False, 'bull_rsi_required': False, 'bear_strategy': 'breakout', 'bear_bb_std_mult': 1.0397020404920372, 'bear_rsi_os': 18, 'bear_rsi_ob': 75, 'bear_adx_thresh': 11.200157696360055, 'bear_atr_min_pct': 0.026712055770175436, 'bear_atr_max_pct': 0.10613316352041702, 'bear_tp_mult': 2.304757886655133, 'bear_tsl_mult': 0.6199650828047066, 'bear_time_stop': 113, 'bear_use_sma': True, 'bear_use_ema': False, 'bear_use_atr': True, 'bear_use_adx': True, 'bear_use_spike': True, 'bear_rsi_required': True, 'sideways_strategy': 'breakout', 'sideways_bb_std_mult': 2.571295803354592, 'sideways_rsi_os': 21, 'sideways_rsi_ob': 72, 'sideways_adx_thresh': 12.860017682834663, 'sideways_atr_min_pct': 0.010594201987893547, 'sideways_atr_max_pct': 0.1273864595412217, 'sideways_tp_mult': 2.963821881687384, 'sideways_tsl_mult': 0.4473749773667479, 'sideways_time_stop': 286, 'sideways_use_sma': True, 'sideways_use_ema': True, 'sideways_use_atr': False, 'sideways_use_adx': False, 'sideways_use_spike': True, 'sideways_rsi_required': True}.
[I 2025-08-30 17:26:32,210] Trial 758 finished with values: [-1000000000.0, 1000000000.0] and parameters: {'p_sma': 6, 'p_std': 23, 'p_atr': 16, 'p_adx': 10, 'rsi_period': 11, 'ema1': 23, 'ema2': 10, 'slip_atr_k': 0.021771272052185764, 'slip_spread_k': 0.14572884174720185, 'spread_hl_frac': 0.008525497746328058, 'bb_std_mult': 3.1570386857988137, 'rsi_os': 34, 'rsi_ob': 86, 'vol_spike': 0.2258704409254138, 'adx_thresh': 12.062011246541097, 'atr_min_pct': 0.014540147249477157, 'atr_max_pct': 0.06105530798797302, 'tp_mult': 1.3527810544076724, 'tsl_mult': 0.675610386494529, 'strategy': 'mean_reversion', 'time_stop': 75, 'use_sma': False, 'use_atr': False, 'use_adx': False, 'use_ema': True, 'use_spike': False, 'rsi_required': True, 'edge_k': 0.6814292050793306, 'edge_cap': 0.8407860568486893, 'bull_strategy': 'mean_reversion', 'bull_bb_std_mult': 1.984744327393597, 'bull_rsi_os': 46, 'bull_rsi_ob': 52, 'bull_adx_thresh': 16.370162462971006, 'bull_atr_min_pct': 0.022824914192992242, 'bull_atr_max_pct': 0.032624586174004586, 'bull_tp_mult': 1.7446067210659606, 'bull_tsl_mult': 0.8469788040603061, 'bull_time_stop': 214, 'bull_use_sma': True, 'bull_use_ema': False, 'bull_use_atr': False, 'bull_use_adx': False, 'bull_use_spike': False, 'bull_rsi_required': False, 'bear_strategy': 'breakout', 'bear_bb_std_mult': 1.0239992138776532, 'bear_rsi_os': 15, 'bear_rsi_ob': 94, 'bear_adx_thresh': 11.253802428860684, 'bear_atr_min_pct': 0.018484754829016882, 'bear_atr_max_pct': 0.1409182466382382, 'bear_tp_mult': 2.1413501316295367, 'bear_tsl_mult': 0.6667900438954224, 'bear_time_stop': 206, 'bear_use_sma': True, 'bear_use_ema': False, 'bear_use_atr': False, 'bear_use_adx': True, 'bear_use_spike': True, 'bear_rsi_required': True, 'sideways_strategy': 'breakout', 'sideways_bb_std_mult': 0.6347813477857756, 'sideways_rsi_os': 32, 'sideways_rsi_ob': 91, 'sideways_adx_thresh': 12.672098234326405, 'sideways_atr_min_pct': 0.002707090196804392, 'sideways_atr_max_pct': 0.10184235110065641, 'sideways_tp_mult': 2.965820374561823, 'sideways_tsl_mult': 0.48448928865391966, 'sideways_time_stop': 263, 'sideways_use_sma': True, 'sideways_use_ema': False, 'sideways_use_atr': False, 'sideways_use_adx': False, 'sideways_use_spike': False, 'sideways_rsi_required': True}.
[I 2025-08-30 17:26:34,877] Trial 759 finished with values: [-1000000000.0, 1000000000.0] and parameters: {'p_sma': 6, 'p_std': 22, 'p_atr': 11, 'p_adx': 10, 'rsi_period': 11, 'ema1': 18, 'ema2': 11, 'slip_atr_k': 0.02145147384191825, 'slip_spread_k': 0.14345985902843783, 'spread_hl_frac': 0.01777827203362329, 'bb_std_mult': 2.468978732041022, 'rsi_os': 15, 'rsi_ob': 88, 'vol_spike': 0.26024471576744435, 'adx_thresh': 33.358096102022046, 'atr_min_pct': 0.0043338267258798725, 'atr_max_pct': 0.10726382474323401, 'tp_mult': 2.773976003304788, 'tsl_mult': 0.8737809820940707, 'strategy': 'mean_reversion', 'time_stop': 32, 'use_sma': True, 'use_atr': False, 'use_adx': False, 'use_ema': False, 'use_spike': True, 'rsi_required': True, 'edge_k': 0.9087660009312102, 'edge_cap': 0.8437175773037108, 'bull_strategy': 'breakout', 'bull_bb_std_mult': 1.9622751402005503, 'bull_rsi_os': 37, 'bull_rsi_ob': 54, 'bull_adx_thresh': 7.299707865883393, 'bull_atr_min_pct': 0.022399493008874328, 'bull_atr_max_pct': 0.022357080974296346, 'bull_tp_mult': 2.257056152426413, 'bull_tsl_mult': 0.5108902463468441, 'bull_time_stop': 51, 'bull_use_sma': True, 'bull_use_ema': True, 'bull_use_atr': False, 'bull_use_adx': False, 'bull_use_spike': False, 'bull_rsi_required': False, 'bear_strategy': 'mean_reversion', 'bear_bb_std_mult': 1.0369849987969515, 'bear_rsi_os': 22, 'bear_rsi_ob': 75, 'bear_adx_thresh': 12.270464229188953, 'bear_atr_min_pct': 0.026905850932029105, 'bear_atr_max_pct': 0.10562558369599014, 'bear_tp_mult': 1.4228625905576455, 'bear_tsl_mult': 0.6176952196115124, 'bear_time_stop': 180, 'bear_use_sma': True, 'bear_use_ema': False, 'bear_use_atr': True, 'bear_use_adx': True, 'bear_use_spike': True, 'bear_rsi_required': True, 'sideways_strategy': 'breakout', 'sideways_bb_std_mult': 0.6517249321856527, 'sideways_rsi_os': 32, 'sideways_rsi_ob': 76, 'sideways_adx_thresh': 10.517529761567701, 'sideways_atr_min_pct': 0.0024815770499560684, 'sideways_atr_max_pct': 0.06657096494230225, 'sideways_tp_mult': 2.294851623494263, 'sideways_tsl_mult': 0.8279757179860544, 'sideways_time_stop': 101, 'sideways_use_sma': True, 'sideways_use_ema': True, 'sideways_use_atr': False, 'sideways_use_adx': False, 'sideways_use_spike': True, 'sideways_rsi_required': True}.
[I 2025-08-30 17:26:37,472] Trial 761 finished with values: [-1000000000.0, 1000000000.0] and parameters: {'p_sma': 6, 'p_std': 48, 'p_atr': 17, 'p_adx': 29, 'rsi_period': 24, 'ema1': 18, 'ema2': 13, 'slip_atr_k': 0.183064536539018, 'slip_spread_k': 0.445930819179139, 'spread_hl_frac': 0.01946748748594251, 'bb_std_mult': 2.548072948860073, 'rsi_os': 29, 'rsi_ob': 84, 'vol_spike': 0.0930186811026957, 'adx_thresh': 23.026167466599485, 'atr_min_pct': 0.014455475425813758, 'atr_max_pct': 0.06208810876930565, 'tp_mult': 2.1500131463012635, 'tsl_mult': 0.8447484160612382, 'strategy': 'breakout', 'time_stop': 33, 'use_sma': True, 'use_atr': False, 'use_adx': False, 'use_ema': False, 'use_spike': True, 'rsi_required': True, 'edge_k': 0.9935831460183829, 'edge_cap': 0.8321353664387465, 'bull_strategy': 'breakout', 'bull_bb_std_mult': 1.0255991961109159, 'bull_rsi_os': 36, 'bull_rsi_ob': 52, 'bull_adx_thresh': 34.42750110465918, 'bull_atr_min_pct': 0.02118597495990703, 'bull_atr_max_pct': 0.05928456364315962, 'bull_tp_mult': 2.2280113949776434, 'bull_tsl_mult': 0.057722397072117126, 'bull_time_stop': 52, 'bull_use_sma': True, 'bull_use_ema': True, 'bull_use_atr': False, 'bull_use_adx': False, 'bull_use_spike': False, 'bull_rsi_required': False, 'bear_strategy': 'mean_reversion', 'bear_bb_std_mult': 1.1288837888323884, 'bear_rsi_os': 31, 'bear_rsi_ob': 74, 'bear_adx_thresh': 11.23513492128364, 'bear_atr_min_pct': 0.02396732991246331, 'bear_atr_max_pct': 0.1060006166341292, 'bear_tp_mult': 1.419294277308175, 'bear_tsl_mult': 0.626060979487147, 'bear_time_stop': 208, 'bear_use_sma': True, 'bear_use_ema': False, 'bear_use_atr': True, 'bear_use_adx': True, 'bear_use_spike': True, 'bear_rsi_required': True, 'sideways_strategy': 'breakout', 'sideways_bb_std_mult': 2.581099955036746, 'sideways_rsi_os': 32, 'sideways_rsi_ob': 80, 'sideways_adx_thresh': 10.671171702641905, 'sideways_atr_min_pct': 0.0024785029872472883, 'sideways_atr_max_pct': 0.08909974319003933, 'sideways_tp_mult': 1.2090933322619803, 'sideways_tsl_mult': 0.40610828264911947, 'sideways_time_stop': 105, 'sideways_use_sma': True, 'sideways_use_ema': True, 'sideways_use_atr': False, 'sideways_use_adx': False, 'sideways_use_spike': True, 'sideways_rsi_required': True}.
[I 2025-08-30 17:26:37,911] Trial 762 finished with values: [-1000000000.0, 1000000000.0] and parameters: {'p_sma': 57, 'p_std': 22, 'p_atr': 20, 'p_adx': 29, 'rsi_period': 80, 'ema1': 23, 'ema2': 13, 'slip_atr_k': 0.008646376479164403, 'slip_spread_k': 0.2186958250447493, 'spread_hl_frac': 0.01917657090719748, 'bb_std_mult': 3.1897024069633373, 'rsi_os': 32, 'rsi_ob': 88, 'vol_spike': 0.26083598083512816, 'adx_thresh': 11.332947367832723, 'atr_min_pct': 0.017535433219839587, 'atr_max_pct': 0.06183703311195114, 'tp_mult': 2.1542538533469093, 'tsl_mult': 0.8504743273206746, 'strategy': 'breakout', 'time_stop': 30, 'use_sma': True, 'use_atr': False, 'use_adx': False, 'use_ema': False, 'use_spike': False, 'rsi_required': False, 'edge_k': 0.778101814654875, 'edge_cap': 0.3303367626803114, 'bull_strategy': 'mean_reversion', 'bull_bb_std_mult': 2.029191118232334, 'bull_rsi_os': 13, 'bull_rsi_ob': 52, 'bull_adx_thresh': 34.285457550218325, 'bull_atr_min_pct': 0.0022294878502568897, 'bull_atr_max_pct': 0.14119318540537196, 'bull_tp_mult': 2.2318756792634007, 'bull_tsl_mult': 0.05127691857665584, 'bull_time_stop': 49, 'bull_use_sma': True, 'bull_use_ema': True, 'bull_use_atr': False, 'bull_use_adx': False, 'bull_use_spike': False, 'bull_rsi_required': False, 'bear_strategy': 'mean_reversion', 'bear_bb_std_mult': 2.4677274946962635, 'bear_rsi_os': 15, 'bear_rsi_ob': 74, 'bear_adx_thresh': 12.570103374653506, 'bear_atr_min_pct': 0.017961738819959692, 'bear_atr_max_pct': 0.10463824054062458, 'bear_tp_mult': 1.0524581925319736, 'bear_tsl_mult': 0.6318324530846553, 'bear_time_stop': 208, 'bear_use_sma': True, 'bear_use_ema': False, 'bear_use_atr': False, 'bear_use_adx': True, 'bear_use_spike': True, 'bear_rsi_required': True, 'sideways_strategy': 'breakout', 'sideways_bb_std_mult': 0.8425218273740076, 'sideways_rsi_os': 15, 'sideways_rsi_ob': 62, 'sideways_adx_thresh': 10.6615106992078, 'sideways_atr_min_pct': 0.0025199413778378386, 'sideways_atr_max_pct': 0.11215151419832195, 'sideways_tp_mult': 2.717599697801286, 'sideways_tsl_mult': 0.22862503256447592, 'sideways_time_stop': 24, 'sideways_use_sma': True, 'sideways_use_ema': False, 'sideways_use_atr': False, 'sideways_use_adx': False, 'sideways_use_spike': False, 'sideways_rsi_required': True}.
[I 2025-08-30 17:27:21,806] Trial 765 finished with values: [-1000000000.0, 1000000000.0] and parameters: {'p_sma': 49, 'p_std': 21, 'p_atr': 17, 'p_adx': 9, 'rsi_period': 80, 'ema1': 17, 'ema2': 44, 'slip_atr_k': 0.009393183673929264, 'slip_spread_k': 0.2219401673441585, 'spread_hl_frac': 0.0157492171676432, 'bb_std_mult': 1.351844583499784, 'rsi_os': 31, 'rsi_ob': 95, 'vol_spike': 0.07106028853945358, 'adx_thresh': 9.969320483772691, 'atr_min_pct': 0.017562168519397278, 'atr_max_pct': 0.10213399660238091, 'tp_mult': 2.9374743611322316, 'tsl_mult': 0.3674682856978363, 'strategy': 'breakout', 'time_stop': 38, 'use_sma': False, 'use_atr': True, 'use_adx': True, 'use_ema': False, 'use_spike': False, 'rsi_required': False, 'edge_k': 0.29030361858993603, 'edge_cap': 0.18456492766183608, 'bull_strategy': 'mean_reversion', 'bull_bb_std_mult': 2.026399825290823, 'bull_rsi_os': 13, 'bull_rsi_ob': 53, 'bull_adx_thresh': 34.479819870739675, 'bull_atr_min_pct': 0.021519781910400496, 'bull_atr_max_pct': 0.14192938237346234, 'bull_tp_mult': 2.1153997777733644, 'bull_tsl_mult': 0.7472559995014606, 'bull_time_stop': 241, 'bull_use_sma': True, 'bull_use_ema': True, 'bull_use_atr': False, 'bull_use_adx': True, 'bull_use_spike': True, 'bull_rsi_required': False, 'bear_strategy': 'mean_reversion', 'bear_bb_std_mult': 1.7747408283217005, 'bear_rsi_os': 8, 'bear_rsi_ob': 69, 'bear_adx_thresh': 12.165409872097495, 'bear_atr_min_pct': 0.004605211468327992, 'bear_atr_max_pct': 0.1150861063007734, 'bear_tp_mult': 2.752927652342756, 'bear_tsl_mult': 0.5990010658908845, 'bear_time_stop': 189, 'bear_use_sma': False, 'bear_use_ema': False, 'bear_use_atr': False, 'bear_use_adx': False, 'bear_use_spike': False, 'bear_rsi_required': False, 'sideways_strategy': 'breakout', 'sideways_bb_std_mult': 0.9419118562639406, 'sideways_rsi_os': 52, 'sideways_rsi_ob': 83, 'sideways_adx_thresh': 32.49818055735737, 'sideways_atr_min_pct': 0.009808882251046848, 'sideways_atr_max_pct': 0.0243062246247379, 'sideways_tp_mult': 2.674307716626222, 'sideways_tsl_mult': 0.3433900096010273, 'sideways_time_stop': 275, 'sideways_use_sma': True, 'sideways_use_ema': False, 'sideways_use_atr': False, 'sideways_use_adx': True, 'sideways_use_spike': False, 'sideways_rsi_required': True}.
[I 2025-08-30 17:27:22,647] Trial 766 finished with values: [-1000000000.0, 1000000000.0] and parameters: {'p_sma': 11, 'p_std': 33, 'p_atr': 30, 'p_adx': 9, 'rsi_period': 20, 'ema1': 17, 'ema2': 44, 'slip_atr_k': 0.010072375073669444, 'slip_spread_k': 0.996832061039187, 'spread_hl_frac': 0.015427024214063792, 'bb_std_mult': 0.8723244149587921, 'rsi_os': 31, 'rsi_ob': 80, 'vol_spike': 0.0828464964662606, 'adx_thresh': 29.72442847139652, 'atr_min_pct': 0.013045165090621992, 'atr_max_pct': 0.1017209837447676, 'tp_mult': 2.255479500422604, 'tsl_mult': 0.9527599685802577, 'strategy': 'mean_reversion', 'time_stop': 41, 'use_sma': False, 'use_atr': True, 'use_adx': True, 'use_ema': False, 'use_spike': False, 'rsi_required': False, 'edge_k': 0.48312222826206885, 'edge_cap': 0.7833410096354858, 'bull_strategy': 'mean_reversion', 'bull_bb_std_mult': 2.156188524289159, 'bull_rsi_os': 11, 'bull_rsi_ob': 55, 'bull_adx_thresh': 14.09725754976964, 'bull_atr_min_pct': 0.01017899581376844, 'bull_atr_max_pct': 0.14291518659448493, 'bull_tp_mult': 2.2984674165583034, 'bull_tsl_mult': 0.7459824767584043, 'bull_time_stop': 243, 'bull_use_sma': True, 'bull_use_ema': True, 'bull_use_atr': False, 'bull_use_adx': True, 'bull_use_spike': True, 'bull_rsi_required': False, 'bear_strategy': 'mean_reversion', 'bear_bb_std_mult': 1.7639665345342843, 'bear_rsi_os': 8, 'bear_rsi_ob': 76, 'bear_adx_thresh': 13.255877402584725, 'bear_atr_min_pct': 0.021661602711736682, 'bear_atr_max_pct': 0.11671123676110567, 'bear_tp_mult': 2.1014177089978787, 'bear_tsl_mult': 0.7723419840995203, 'bear_time_stop': 201, 'bear_use_sma': False, 'bear_use_ema': False, 'bear_use_atr': False, 'bear_use_adx': False, 'bear_use_spike': False, 'bear_rsi_required': False, 'sideways_strategy': 'breakout', 'sideways_bb_std_mult': 0.9313639902341349, 'sideways_rsi_os': 34, 'sideways_rsi_ob': 91, 'sideways_adx_thresh': 11.776250576106083, 'sideways_atr_min_pct': 0.026840991784811544, 'sideways_atr_max_pct': 0.09772138420250336, 'sideways_tp_mult': 2.0799646241817773, 'sideways_tsl_mult': 0.360882350617798, 'sideways_time_stop': 300, 'sideways_use_sma': True, 'sideways_use_ema': False, 'sideways_use_atr': False, 'sideways_use_adx': True, 'sideways_use_spike': False, 'sideways_rsi_required': True}.
