[I 2025-08-30 15:58:07,918] Trial 243 finished with values: [-1000000000.0, 1000000000.0] and parameters: {'p_sma': 58, 'p_std': 60, 'p_atr': 27, 'p_adx': 23, 'rsi_period': 32, 'ema1': 27, 'ema2': 60, 'slip_atr_k': 0.020016463536744585, 'slip_spread_k': 0.7206148522277352, 'spread_hl_frac': 0.047126378945793544, 'bb_std_mult': 2.9512578821456863, 'rsi_os': 41, 'rsi_ob': 50, 'vol_spike': 0.0663919543348782, 'adx_thresh': 9.631734374305122, 'atr_min_pct': 0.017514932520706485, 'atr_max_pct': 0.14526130248938124, 'tp_mult': 1.8923833816096696, 'tsl_mult': 0.4734052207802328, 'strategy': 'breakout', 'time_stop': 39, 'use_sma': False, 'use_atr': True, 'use_adx': False, 'use_ema': True, 'use_spike': True, 'rsi_required': False, 'edge_k': 1.810674701374561, 'edge_cap': 0.6209099330974666, 'bull_strategy': 'breakout', 'bull_bb_std_mult': 1.7865555750374116, 'bull_rsi_os': 13, 'bull_rsi_ob': 73, 'bull_adx_thresh': 31.045840823219745, 'bull_atr_min_pct': 0.001389261400165237, 'bull_atr_max_pct': 0.12089000417363711, 'bull_tp_mult': 1.6216942495620756, 'bull_tsl_mult': 0.34260601620255915, 'bull_time_stop': 71, 'bull_use_sma': True, 'bull_use_ema': True, 'bull_use_atr': False, 'bull_use_adx': False, 'bull_use_spike': False, 'bull_rsi_required': False, 'bear_strategy': 'breakout', 'bear_bb_std_mult': 2.0720825453863996, 'bear_rsi_os': 16, 'bear_rsi_ob': 78, 'bear_adx_thresh': 5.704978381007937, 'bear_atr_min_pct': 0.02935673579278711, 'bear_atr_max_pct': 0.0888105241577888, 'bear_tp_mult': 2.41564390274128, 'bear_tsl_mult': 0.5550319484206062, 'bear_time_stop': 262, 'bear_use_sma': False, 'bear_use_ema': True, 'bear_use_atr': False, 'bear_use_adx': False, 'bear_use_spike': True, 'bear_rsi_required': False, 'sideways_strategy': 'breakout', 'sideways_bb_std_mult': 3.0011221104828216, 'sideways_rsi_os': 10, 'sideways_rsi_ob': 75, 'sideways_adx_thresh': 15.898432702186406, 'sideways_atr_min_pct': 0.0013719657705015867, 'sideways_atr_max_pct': 0.14811471771742696, 'sideways_tp_mult': 1.740123404351532, 'sideways_tsl_mult': 0.7298251754215492, 'sideways_time_stop': 171, 'sideways_use_sma': True, 'sideways_use_ema': False, 'sideways_use_atr': False, 'sideways_use_adx': True, 'sideways_use_spike': False, 'sideways_rsi_required': True}.
[I 2025-08-30 15:58:08,378] Trial 244 finished with values: [-0.010976483185699881, 0.010874167145505704] and parameters: {'p_sma': 20, 'p_std': 53, 'p_atr': 25, 'p_adx': 22, 'rsi_period': 32, 'ema1': 27, 'ema2': 60, 'slip_atr_k': 0.023614536102639375, 'slip_spread_k': 0.000202048207891927, 'spread_hl_frac': 0.047103150707004174, 'bb_std_mult': 2.946685605246056, 'rsi_os': 9, 'rsi_ob': 52, 'vol_spike': 0.0027124955431910864, 'adx_thresh': 27.278613158671778, 'atr_min_pct': 0.014634303044327168, 'atr_max_pct': 0.12696793278558166, 'tp_mult': 1.6894924275900434, 'tsl_mult': 0.5030193402671634, 'strategy': 'breakout', 'time_stop': 5, 'use_sma': False, 'use_atr': True, 'use_adx': False, 'use_ema': False, 'use_spike': True, 'rsi_required': False, 'edge_k': 1.8020553074776595, 'edge_cap': 0.6221069172915935, 'bull_strategy': 'breakout', 'bull_bb_std_mult': 1.7858504809370275, 'bull_rsi_os': 13, 'bull_rsi_ob': 62, 'bull_adx_thresh': 30.78593036568656, 'bull_atr_min_pct': 0.001689160519435288, 'bull_atr_max_pct': 0.14900905912708498, 'bull_tp_mult': 1.1729117283309705, 'bull_tsl_mult': 0.3393421415354386, 'bull_time_stop': 261, 'bull_use_sma': True, 'bull_use_ema': True, 'bull_use_atr': False, 'bull_use_adx': False, 'bull_use_spike': True, 'bull_rsi_required': False, 'bear_strategy': 'mean_reversion', 'bear_bb_std_mult': 0.9252266174383128, 'bear_rsi_os': 6, 'bear_rsi_ob': 75, 'bear_adx_thresh': 15.212624382369793, 'bear_atr_min_pct': 0.029437580023308558, 'bear_atr_max_pct': 0.015340877285170626, 'bear_tp_mult': 2.6215590479517035, 'bear_tsl_mult': 0.5964112758426892, 'bear_time_stop': 176, 'bear_use_sma': False, 'bear_use_ema': True, 'bear_use_atr': False, 'bear_use_adx': False, 'bear_use_spike': True, 'bear_rsi_required': False, 'sideways_strategy': 'breakout', 'sideways_bb_std_mult': 3.04223507402268, 'sideways_rsi_os': 30, 'sideways_rsi_ob': 90, 'sideways_adx_thresh': 15.748466547883957, 'sideways_atr_min_pct': 0.0015944767837437496, 'sideways_atr_max_pct': 0.1473305010116702, 'sideways_tp_mult': 1.7435865167480522, 'sideways_tsl_mult': 0.7078261802224302, 'sideways_time_stop': 229, 'sideways_use_sma': True, 'sideways_use_ema': False, 'sideways_use_atr': False, 'sideways_use_adx': True, 'sideways_use_spike': False, 'sideways_rsi_required': True}.
[I 2025-08-30 15:58:52,518] Trial 245 finished with values: [-1000000000.0, 1000000000.0] and parameters: {'p_sma': 21, 'p_std': 60, 'p_atr': 24, 'p_adx': 21, 'rsi_period': 33, 'ema1': 27, 'ema2': 60, 'slip_atr_k': 0.01625697278926211, 'slip_spread_k': 0.00694812062944359, 'spread_hl_frac': 0.04694175172510136, 'bb_std_mult': 2.954841029117024, 'rsi_os': 36, 'rsi_ob': 94, 'vol_spike': 0.0014832298563673026, 'adx_thresh': 27.20290368792358, 'atr_min_pct': 0.021302685281624035, 'atr_max_pct': 0.06379413416349938, 'tp_mult': 2.1590056092900434, 'tsl_mult': 0.304692553546417, 'strategy': 'breakout', 'time_stop': 5, 'use_sma': False, 'use_atr': True, 'use_adx': False, 'use_ema': False, 'use_spike': True, 'rsi_required': False, 'edge_k': 1.7895833960693177, 'edge_cap': 0.6008539047868402, 'bull_strategy': 'breakout', 'bull_bb_std_mult': 1.776945620780891, 'bull_rsi_os': 10, 'bull_rsi_ob': 77, 'bull_adx_thresh': 20.818143382188293, 'bull_atr_min_pct': 0.0016041071711720993, 'bull_atr_max_pct': 0.09991272843430812, 'bull_tp_mult': 1.3499917252630687, 'bull_tsl_mult': 0.36188000194894065, 'bull_time_stop': 73, 'bull_use_sma': True, 'bull_use_ema': True, 'bull_use_atr': False, 'bull_use_adx': False, 'bull_use_spike': True, 'bull_rsi_required': False, 'bear_strategy': 'mean_reversion', 'bear_bb_std_mult': 0.8866950771909115, 'bear_rsi_os': 37, 'bear_rsi_ob': 75, 'bear_adx_thresh': 13.814350222678817, 'bear_atr_min_pct': 0.029523772888240266, 'bear_atr_max_pct': 0.08876548641553528, 'bear_tp_mult': 2.3011295151375295, 'bear_tsl_mult': 0.5986910695556555, 'bear_time_stop': 260, 'bear_use_sma': False, 'bear_use_ema': True, 'bear_use_atr': False, 'bear_use_adx': False, 'bear_use_spike': True, 'bear_rsi_required': False, 'sideways_strategy': 'breakout', 'sideways_bb_std_mult': 3.056146833392913, 'sideways_rsi_os': 10, 'sideways_rsi_ob': 93, 'sideways_adx_thresh': 15.959368882985519, 'sideways_atr_min_pct': 0.0016074039605172541, 'sideways_atr_max_pct': 0.14703438556893633, 'sideways_tp_mult': 2.4963510046757396, 'sideways_tsl_mult': 0.6995884996591791, 'sideways_time_stop': 231, 'sideways_use_sma': True, 'sideways_use_ema': False, 'sideways_use_atr': False, 'sideways_use_adx': True, 'sideways_use_spike': False, 'sideways_rsi_required': True}.
[I 2025-08-30 15:58:53,326] Trial 248 finished with values: [-1000000000.0, 1000000000.0] and parameters: {'p_sma': 39, 'p_std': 53, 'p_atr': 8, 'p_adx': 29, 'rsi_period': 33, 'ema1': 11, 'ema2': 60, 'slip_atr_k': 0.014147763767622975, 'slip_spread_k': 0.02638379171389012, 'spread_hl_frac': 0.023300015976944137, 'bb_std_mult': 0.5954396327235745, 'rsi_os': 9, 'rsi_ob': 94, 'vol_spike': 0.0003246716643338747, 'adx_thresh': 8.389044087260354, 'atr_min_pct': 0.021241096439639246, 'atr_max_pct': 0.1423428524010756, 'tp_mult': 1.1828955444159532, 'tsl_mult': 0.41525820267261165, 'strategy': 'breakout', 'time_stop': 9, 'use_sma': False, 'use_atr': True, 'use_adx': False, 'use_ema': False, 'use_spike': True, 'rsi_required': False, 'edge_k': 1.9579957404309725, 'edge_cap': 0.6415043531030151, 'bull_strategy': 'breakout', 'bull_bb_std_mult': 1.7629947868864528, 'bull_rsi_os': 10, 'bull_rsi_ob': 76, 'bull_adx_thresh': 30.719618410604138, 'bull_atr_min_pct': 0.0008117776722478302, 'bull_atr_max_pct': 0.10771103819023034, 'bull_tp_mult': 1.366376298430954, 'bull_tsl_mult': 0.35999519158806637, 'bull_time_stop': 188, 'bull_use_sma': True, 'bull_use_ema': True, 'bull_use_atr': False, 'bull_use_adx': False, 'bull_use_spike': True, 'bull_rsi_required': False, 'bear_strategy': 'mean_reversion', 'bear_bb_std_mult': 0.8808202366553182, 'bear_rsi_os': 17, 'bear_rsi_ob': 75, 'bear_adx_thresh': 6.771434915288191, 'bear_atr_min_pct': 0.01786838737526451, 'bear_atr_max_pct': 0.0920683970422375, 'bear_tp_mult': 2.3367699507851833, 'bear_tsl_mult': 0.5910413651998272, 'bear_time_stop': 175, 'bear_use_sma': False, 'bear_use_ema': True, 'bear_use_atr': False, 'bear_use_adx': False, 'bear_use_spike': True, 'bear_rsi_required': False, 'sideways_strategy': 'breakout', 'sideways_bb_std_mult': 3.0966498540663276, 'sideways_rsi_os': 29, 'sideways_rsi_ob': 93, 'sideways_adx_thresh': 15.19233881031114, 'sideways_atr_min_pct': 0.013779983969632767, 'sideways_atr_max_pct': 0.14662544554365348, 'sideways_tp_mult': 1.852356848066199, 'sideways_tsl_mult': 0.7009689289265801, 'sideways_time_stop': 162, 'sideways_use_sma': True, 'sideways_use_ema': False, 'sideways_use_atr': False, 'sideways_use_adx': True, 'sideways_use_spike': False, 'sideways_rsi_required': True}.
[I 2025-08-30 15:58:53,357] Trial 246 finished with values: [-1000000000.0, 1000000000.0] and parameters: {'p_sma': 19, 'p_std': 53, 'p_atr': 27, 'p_adx': 16, 'rsi_period': 30, 'ema1': 27, 'ema2': 60, 'slip_atr_k': 0.016138647312903435, 'slip_spread_k': 0.0007993516636700562, 'spread_hl_frac': 0.04664364304717057, 'bb_std_mult': 2.9409631770982405, 'rsi_os': 8, 'rsi_ob': 52, 'vol_spike': 0.2157650203224281, 'adx_thresh': 8.62055038970653, 'atr_min_pct': 0.021237970170943987, 'atr_max_pct': 0.09496979354231623, 'tp_mult': 2.997258269203919, 'tsl_mult': 0.470963252519281, 'strategy': 'breakout', 'time_stop': 6, 'use_sma': False, 'use_atr': True, 'use_adx': False, 'use_ema': False, 'use_spike': True, 'rsi_required': False, 'edge_k': 1.949748944609653, 'edge_cap': 0.5964314369543697, 'bull_strategy': 'breakout', 'bull_bb_std_mult': 1.7605639481677378, 'bull_rsi_os': 10, 'bull_rsi_ob': 62, 'bull_adx_thresh': 31.230160610659194, 'bull_atr_min_pct': 1.4399318186609231e-05, 'bull_atr_max_pct': 0.1070961198826201, 'bull_tp_mult': 1.362376523690974, 'bull_tsl_mult': 0.34970510429642065, 'bull_time_stop': 73, 'bull_use_sma': True, 'bull_use_ema': True, 'bull_use_atr': False, 'bull_use_adx': False, 'bull_use_spike': True, 'bull_rsi_required': False, 'bear_strategy': 'mean_reversion', 'bear_bb_std_mult': 0.8867864122958349, 'bear_rsi_os': 6, 'bear_rsi_ob': 75, 'bear_adx_thresh': 13.606251938174207, 'bear_atr_min_pct': 0.028208206447660915, 'bear_atr_max_pct': 0.0886949291894787, 'bear_tp_mult': 2.6195144390543814, 'bear_tsl_mult': 0.5984872214183049, 'bear_time_stop': 177, 'bear_use_sma': False, 'bear_use_ema': True, 'bear_use_atr': False, 'bear_use_adx': False, 'bear_use_spike': True, 'bear_rsi_required': False, 'sideways_strategy': 'mean_reversion', 'sideways_bb_std_mult': 2.508361123203873, 'sideways_rsi_os': 38, 'sideways_rsi_ob': 93, 'sideways_adx_thresh': 15.199483130508797, 'sideways_atr_min_pct': 0.021010373218524964, 'sideways_atr_max_pct': 0.1472134878064928, 'sideways_tp_mult': 1.822262641493841, 'sideways_tsl_mult': 0.7050139438619359, 'sideways_time_stop': 172, 'sideways_use_sma': True, 'sideways_use_ema': False, 'sideways_use_atr': False, 'sideways_use_adx': True, 'sideways_use_spike': False, 'sideways_rsi_required': True}.
[I 2025-08-30 15:58:54,072] Trial 247 finished with values: [-1000000000.0, 1000000000.0] and parameters: {'p_sma': 39, 'p_std': 56, 'p_atr': 8, 'p_adx': 16, 'rsi_period': 30, 'ema1': 27, 'ema2': 60, 'slip_atr_k': 0.014679253502060815, 'slip_spread_k': 0.00111067338170238, 'spread_hl_frac': 0.018989815277208884, 'bb_std_mult': 2.9381122313421675, 'rsi_os': 17, 'rsi_ob': 95, 'vol_spike': 0.11072308353530008, 'adx_thresh': 27.004662482983615, 'atr_min_pct': 0.021397098428611983, 'atr_max_pct': 0.09570524361667163, 'tp_mult': 2.272196384574163, 'tsl_mult': 0.005413352983349107, 'strategy': 'breakout', 'time_stop': 6, 'use_sma': False, 'use_atr': True, 'use_adx': False, 'use_ema': False, 'use_spike': True, 'rsi_required': False, 'edge_k': 1.956703395579269, 'edge_cap': 0.5914399893234872, 'bull_strategy': 'breakout', 'bull_bb_std_mult': 1.6701764919307343, 'bull_rsi_os': 10, 'bull_rsi_ob': 77, 'bull_adx_thresh': 30.895333532501052, 'bull_atr_min_pct': 0.013447400433123997, 'bull_atr_max_pct': 0.10274084256282408, 'bull_tp_mult': 1.349746365908541, 'bull_tsl_mult': 0.35283217615422297, 'bull_time_stop': 77, 'bull_use_sma': True, 'bull_use_ema': True, 'bull_use_atr': False, 'bull_use_adx': False, 'bull_use_spike': True, 'bull_rsi_required': True, 'bear_strategy': 'mean_reversion', 'bear_bb_std_mult': 3.373632197170267, 'bear_rsi_os': 20, 'bear_rsi_ob': 75, 'bear_adx_thresh': 13.931432132282747, 'bear_atr_min_pct': 0.028249337977329047, 'bear_atr_max_pct': 0.015175902658236276, 'bear_tp_mult': 2.319621113298869, 'bear_tsl_mult': 0.5988272126190237, 'bear_time_stop': 172, 'bear_use_sma': False, 'bear_use_ema': True, 'bear_use_atr': False, 'bear_use_adx': False, 'bear_use_spike': True, 'bear_rsi_required': False, 'sideways_strategy': 'mean_reversion', 'sideways_bb_std_mult': 3.0834898150737304, 'sideways_rsi_os': 44, 'sideways_rsi_ob': 93, 'sideways_adx_thresh': 15.140060066331381, 'sideways_atr_min_pct': 0.013755086194175146, 'sideways_atr_max_pct': 0.01062002334483704, 'sideways_tp_mult': 1.8653446545398082, 'sideways_tsl_mult': 0.694346823537316, 'sideways_time_stop': 129, 'sideways_use_sma': True, 'sideways_use_ema': False, 'sideways_use_atr': True, 'sideways_use_adx': True, 'sideways_use_spike': True, 'sideways_rsi_required': True}.
[I 2025-08-30 15:59:37,130] Trial 249 finished with values: [-1000000000.0, 1000000000.0] and parameters: {'p_sma': 19, 'p_std': 54, 'p_atr': 8, 'p_adx': 16, 'rsi_period': 30, 'ema1': 13, 'ema2': 60, 'slip_atr_k': 0.013362508436856223, 'slip_spread_k': 0.038181219360500146, 'spread_hl_frac': 0.0016986009609712485, 'bb_std_mult': 2.9879251216933036, 'rsi_os': 38, 'rsi_ob': 52, 'vol_spike': 0.012827334558035539, 'adx_thresh': 8.478846941437642, 'atr_min_pct': 0.02132068917152595, 'atr_max_pct': 0.12421711545326172, 'tp_mult': 1.6813571967175356, 'tsl_mult': 0.006871547054971727, 'strategy': 'breakout', 'time_stop': 137, 'use_sma': False, 'use_atr': True, 'use_adx': False, 'use_ema': False, 'use_spike': True, 'rsi_required': False, 'edge_k': 1.9545842638172817, 'edge_cap': 0.6372625789986207, 'bull_strategy': 'breakout', 'bull_bb_std_mult': 1.6728674243515087, 'bull_rsi_os': 9, 'bull_rsi_ob': 76, 'bull_adx_thresh': 30.87939985412403, 'bull_atr_min_pct': 0.0113015735466265, 'bull_atr_max_pct': 0.1498761467672894, 'bull_tp_mult': 1.250227237267373, 'bull_tsl_mult': 0.3022534122498334, 'bull_time_stop': 188, 'bull_use_sma': True, 'bull_use_ema': True, 'bull_use_atr': False, 'bull_use_adx': False, 'bull_use_spike': False, 'bull_rsi_required': True, 'bear_strategy': 'mean_reversion', 'bear_bb_std_mult': 0.5019911887719846, 'bear_rsi_os': 17, 'bear_rsi_ob': 76, 'bear_adx_thresh': 13.067243750824018, 'bear_atr_min_pct': 0.02775833167770888, 'bear_atr_max_pct': 0.01822705273049973, 'bear_tp_mult': 2.3424722726236147, 'bear_tsl_mult': 0.5638071333688637, 'bear_time_stop': 151, 'bear_use_sma': False, 'bear_use_ema': False, 'bear_use_atr': False, 'bear_use_adx': False, 'bear_use_spike': True, 'bear_rsi_required': False, 'sideways_strategy': 'mean_reversion', 'sideways_bb_std_mult': 3.1054614060082537, 'sideways_rsi_os': 20, 'sideways_rsi_ob': 48, 'sideways_adx_thresh': 15.003663645871434, 'sideways_atr_min_pct': 0.01373249041900428, 'sideways_atr_max_pct': 0.1470999843035925, 'sideways_tp_mult': 1.9916505264789799, 'sideways_tsl_mult': 0.7770176519222329, 'sideways_time_stop': 226, 'sideways_use_sma': True, 'sideways_use_ema': False, 'sideways_use_atr': False, 'sideways_use_adx': True, 'sideways_use_spike': False, 'sideways_rsi_required': True}.
[I 2025-08-30 15:59:39,033] Trial 251 finished with values: [-1000000000.0, 1000000000.0] and parameters: {'p_sma': 16, 'p_std': 57, 'p_atr': 25, 'p_adx': 16, 'rsi_period': 30, 'ema1': 6, 'ema2': 59, 'slip_atr_k': 0.0659454650029625, 'slip_spread_k': 0.30625403691303754, 'spread_hl_frac': 0.04866352861774214, 'bb_std_mult': 3.001425455975423, 'rsi_os': 38, 'rsi_ob': 54, 'vol_spike': 0.14859755979949973, 'adx_thresh': 27.078024262262215, 'atr_min_pct': 0.014742100194593525, 'atr_max_pct': 0.14527615833034943, 'tp_mult': 1.6912619893179008, 'tsl_mult': 0.4451506985016969, 'strategy': 'breakout', 'time_stop': 15, 'use_sma': False, 'use_atr': True, 'use_adx': False, 'use_ema': False, 'use_spike': True, 'rsi_required': False, 'edge_k': 1.843929391310346, 'edge_cap': 0.6330655338392756, 'bull_strategy': 'mean_reversion', 'bull_bb_std_mult': 1.6825099783692523, 'bull_rsi_os': 12, 'bull_rsi_ob': 75, 'bull_adx_thresh': 18.630624649811317, 'bull_atr_min_pct': 0.0018672790386802737, 'bull_atr_max_pct': 0.07304340054730445, 'bull_tp_mult': 1.2550840299197232, 'bull_tsl_mult': 0.9353814833653096, 'bull_time_stop': 87, 'bull_use_sma': True, 'bull_use_ema': True, 'bull_use_atr': False, 'bull_use_adx': False, 'bull_use_spike': False, 'bull_rsi_required': True, 'bear_strategy': 'mean_reversion', 'bear_bb_std_mult': 3.484793638262932, 'bear_rsi_os': 20, 'bear_rsi_ob': 69, 'bear_adx_thresh': 13.09753230117489, 'bear_atr_min_pct': 0.029944405387351294, 'bear_atr_max_pct': 0.018518769009947242, 'bear_tp_mult': 2.9940893142274785, 'bear_tsl_mult': 0.5632325462440705, 'bear_time_stop': 271, 'bear_use_sma': False, 'bear_use_ema': False, 'bear_use_atr': False, 'bear_use_adx': False, 'bear_use_spike': True, 'bear_rsi_required': False, 'sideways_strategy': 'breakout', 'sideways_bb_std_mult': 3.059112052156647, 'sideways_rsi_os': 31, 'sideways_rsi_ob': 82, 'sideways_adx_thresh': 34.99629991410989, 'sideways_atr_min_pct': 0.0028677123774666306, 'sideways_atr_max_pct': 0.03764339824059369, 'sideways_tp_mult': 2.1003758233589824, 'sideways_tsl_mult': 0.7738143398925738, 'sideways_time_stop': 227, 'sideways_use_sma': True, 'sideways_use_ema': False, 'sideways_use_atr': True, 'sideways_use_adx': True, 'sideways_use_spike': True, 'sideways_rsi_required': True}.
[I 2025-08-30 15:59:39,037] Trial 250 finished with values: [-1000000000.0, 1000000000.0] and parameters: {'p_sma': 19, 'p_std': 56, 'p_atr': 11, 'p_adx': 16, 'rsi_period': 30, 'ema1': 16, 'ema2': 60, 'slip_atr_k': 0.005269533587140073, 'slip_spread_k': 0.6909611669833764, 'spread_hl_frac': 0.049831107851519035, 'bb_std_mult': 2.9936133025472347, 'rsi_os': 38, 'rsi_ob': 52, 'vol_spike': 0.01189131909942713, 'adx_thresh': 26.905162960889974, 'atr_min_pct': 0.02022517377822402, 'atr_max_pct': 0.09337794817334322, 'tp_mult': 1.6944263542074463, 'tsl_mult': 0.44478462974342337, 'strategy': 'breakout', 'time_stop': 13, 'use_sma': False, 'use_atr': True, 'use_adx': False, 'use_ema': False, 'use_spike': True, 'rsi_required': False, 'edge_k': 1.9541177829084135, 'edge_cap': 0.639082250522676, 'bull_strategy': 'mean_reversion', 'bull_bb_std_mult': 1.6676393568584016, 'bull_rsi_os': 12, 'bull_rsi_ob': 76, 'bull_adx_thresh': 31.03597822102201, 'bull_atr_min_pct': 6.612520525044728e-05, 'bull_atr_max_pct': 0.10129203314353684, 'bull_tp_mult': 1.2433881871613621, 'bull_tsl_mult': 0.9127188057941995, 'bull_time_stop': 88, 'bull_use_sma': True, 'bull_use_ema': True, 'bull_use_atr': False, 'bull_use_adx': False, 'bull_use_spike': False, 'bull_rsi_required': True, 'bear_strategy': 'mean_reversion', 'bear_bb_std_mult': 1.0723825618000826, 'bear_rsi_os': 20, 'bear_rsi_ob': 76, 'bear_adx_thresh': 13.352808730668094, 'bear_atr_min_pct': 0.028393115377690358, 'bear_atr_max_pct': 0.09424196378483153, 'bear_tp_mult': 2.3881731661212005, 'bear_tsl_mult': 0.5669688349051922, 'bear_time_stop': 119, 'bear_use_sma': False, 'bear_use_ema': False, 'bear_use_atr': False, 'bear_use_adx': False, 'bear_use_spike': True, 'bear_rsi_required': False, 'sideways_strategy': 'mean_reversion', 'sideways_bb_std_mult': 2.5140411371698064, 'sideways_rsi_os': 20, 'sideways_rsi_ob': 90, 'sideways_adx_thresh': 14.43155744166479, 'sideways_atr_min_pct': 0.02890663453372502, 'sideways_atr_max_pct': 0.13627884746475108, 'sideways_tp_mult': 2.130251993662238, 'sideways_tsl_mult': 0.7781831713135984, 'sideways_time_stop': 227, 'sideways_use_sma': True, 'sideways_use_ema': False, 'sideways_use_atr': True, 'sideways_use_adx': True, 'sideways_use_spike': True, 'sideways_rsi_required': True}.
