[I 2025-08-30 17:02:36,245] Trial 613 finished with values: [-1000000000.0, 1000000000.0] and parameters: {'p_sma': 6, 'p_std': 24, 'p_atr': 19, 'p_adx': 11, 'rsi_period': 22, 'ema1': 17, 'ema2': 20, 'slip_atr_k': 0.015701982843814268, 'slip_spread_k': 0.20812036086620614, 'spread_hl_frac': 0.018767911856287876, 'bb_std_mult': 3.1605073481048147, 'rsi_os': 33, 'rsi_ob': 87, 'vol_spike': 0.07613485452631963, 'adx_thresh': 10.09559865033366, 'atr_min_pct': 0.02006106326548587, 'atr_max_pct': 0.14712831064605258, 'tp_mult': 2.689487808264957, 'tsl_mult': 0.9356628341305594, 'strategy': 'mean_reversion', 'time_stop': 28, 'use_sma': False, 'use_atr': False, 'use_adx': False, 'use_ema': False, 'use_spike': False, 'rsi_required': True, 'edge_k': 0.7588964559668057, 'edge_cap': 0.9507338059097662, 'bull_strategy': 'mean_reversion', 'bull_bb_std_mult': 0.8817845870932486, 'bull_rsi_os': 14, 'bull_rsi_ob': 55, 'bull_adx_thresh': 34.92236073934552, 'bull_atr_min_pct': 0.0225408322308179, 'bull_atr_max_pct': 0.12038681808244028, 'bull_tp_mult': 2.2805539742545307, 'bull_tsl_mult': 0.7965493221834549, 'bull_time_stop': 63, 'bull_use_sma': True, 'bull_use_ema': False, 'bull_use_atr': False, 'bull_use_adx': False, 'bull_use_spike': False, 'bull_rsi_required': False, 'bear_strategy': 'mean_reversion', 'bear_bb_std_mult': 0.9310769290261702, 'bear_rsi_os': 15, 'bear_rsi_ob': 93, 'bear_adx_thresh': 12.37331040760601, 'bear_atr_min_pct': 0.016119005056579504, 'bear_atr_max_pct': 0.11555271046408452, 'bear_tp_mult': 1.6385287951555452, 'bear_tsl_mult': 0.7880472885180887, 'bear_time_stop': 199, 'bear_use_sma': True, 'bear_use_ema': False, 'bear_use_atr': False, 'bear_use_adx': False, 'bear_use_spike': False, 'bear_rsi_required': True, 'sideways_strategy': 'breakout', 'sideways_bb_std_mult': 0.6415378484660722, 'sideways_rsi_os': 32, 'sideways_rsi_ob': 47, 'sideways_adx_thresh': 10.976697436893506, 'sideways_atr_min_pct': 0.01789216002526302, 'sideways_atr_max_pct': 0.10374328445564897, 'sideways_tp_mult': 2.949916395557145, 'sideways_tsl_mult': 0.6183136512743815, 'sideways_time_stop': 281, 'sideways_use_sma': True, 'sideways_use_ema': False, 'sideways_use_atr': False, 'sideways_use_adx': False, 'sideways_use_spike': False, 'sideways_rsi_required': False}.
[I 2025-08-30 17:02:36,370] Trial 614 finished with values: [-1000000000.0, 1000000000.0] and parameters: {'p_sma': 21, 'p_std': 20, 'p_atr': 18, 'p_adx': 10, 'rsi_period': 22, 'ema1': 17, 'ema2': 13, 'slip_atr_k': 0.1829131355239608, 'slip_spread_k': 0.2087357879638293, 'spread_hl_frac': 0.018702163150206765, 'bb_std_mult': 0.5203810098324471, 'rsi_os': 29, 'rsi_ob': 87, 'vol_spike': 0.13494721936194, 'adx_thresh': 10.397870743859379, 'atr_min_pct': 3.180523260993759e-05, 'atr_max_pct': 0.14813685771336224, 'tp_mult': 1.4903919777195387, 'tsl_mult': 0.9319781301113348, 'strategy': 'mean_reversion', 'time_stop': 28, 'use_sma': False, 'use_atr': False, 'use_adx': False, 'use_ema': False, 'use_spike': True, 'rsi_required': True, 'edge_k': 0.788393641322301, 'edge_cap': 0.7321081860171823, 'bull_strategy': 'mean_reversion', 'bull_bb_std_mult': 0.5447852454517326, 'bull_rsi_os': 44, 'bull_rsi_ob': 55, 'bull_adx_thresh': 34.44497792264829, 'bull_atr_min_pct': 0.022440689459252615, 'bull_atr_max_pct': 0.01585410309434203, 'bull_tp_mult': 2.2867802228651666, 'bull_tsl_mult': 0.7937321438663411, 'bull_time_stop': 130, 'bull_use_sma': True, 'bull_use_ema': False, 'bull_use_atr': False, 'bull_use_adx': False, 'bull_use_spike': False, 'bull_rsi_required': False, 'bear_strategy': 'mean_reversion', 'bear_bb_std_mult': 1.3931733548463665, 'bear_rsi_os': 15, 'bear_rsi_ob': 75, 'bear_adx_thresh': 12.486067633525197, 'bear_atr_min_pct': 0.01991850189839591, 'bear_atr_max_pct': 0.10647882544644392, 'bear_tp_mult': 2.201520134429197, 'bear_tsl_mult': 0.6076435261922812, 'bear_time_stop': 186, 'bear_use_sma': True, 'bear_use_ema': False, 'bear_use_atr': False, 'bear_use_adx': False, 'bear_use_spike': False, 'bear_rsi_required': True, 'sideways_strategy': 'mean_reversion', 'sideways_bb_std_mult': 0.9405668890238218, 'sideways_rsi_os': 32, 'sideways_rsi_ob': 91, 'sideways_adx_thresh': 10.812434031990446, 'sideways_atr_min_pct': 0.024336674506647143, 'sideways_atr_max_pct': 0.101593631804915, 'sideways_tp_mult': 2.950666844622802, 'sideways_tsl_mult': 0.3389744026196213, 'sideways_time_stop': 263, 'sideways_use_sma': True, 'sideways_use_ema': False, 'sideways_use_atr': False, 'sideways_use_adx': False, 'sideways_use_spike': False, 'sideways_rsi_required': False}.
[I 2025-08-30 17:02:36,370] Trial 611 finished with values: [-0.013576829455889117, 0.013535025332432704] and parameters: {'p_sma': 38, 'p_std': 25, 'p_atr': 16, 'p_adx': 11, 'rsi_period': 22, 'ema1': 18, 'ema2': 28, 'slip_atr_k': 0.017687362301924376, 'slip_spread_k': 0.20893645661885707, 'spread_hl_frac': 0.026915345706441447, 'bb_std_mult': 3.155718451926406, 'rsi_os': 33, 'rsi_ob': 87, 'vol_spike': 0.1348107480605205, 'adx_thresh': 10.448286373176408, 'atr_min_pct': 9.465457228849915e-05, 'atr_max_pct': 0.1475087524674678, 'tp_mult': 2.1663205686621363, 'tsl_mult': 0.9293433335472309, 'strategy': 'mean_reversion', 'time_stop': 34, 'use_sma': False, 'use_atr': False, 'use_adx': True, 'use_ema': False, 'use_spike': False, 'rsi_required': True, 'edge_k': 0.755163480213508, 'edge_cap': 0.7693228933699147, 'bull_strategy': 'mean_reversion', 'bull_bb_std_mult': 1.9373590493302526, 'bull_rsi_os': 14, 'bull_rsi_ob': 55, 'bull_adx_thresh': 34.477460248898474, 'bull_atr_min_pct': 0.022711468980574617, 'bull_atr_max_pct': 0.0175631594343831, 'bull_tp_mult': 2.2892925083243134, 'bull_tsl_mult': 0.7855183146474966, 'bull_time_stop': 63, 'bull_use_sma': True, 'bull_use_ema': True, 'bull_use_atr': False, 'bull_use_adx': True, 'bull_use_spike': False, 'bull_rsi_required': False, 'bear_strategy': 'mean_reversion', 'bear_bb_std_mult': 1.7172716563626627, 'bear_rsi_os': 15, 'bear_rsi_ob': 75, 'bear_adx_thresh': 12.399289013693915, 'bear_atr_min_pct': 0.01888651407375864, 'bear_atr_max_pct': 0.10835411403225395, 'bear_tp_mult': 1.899601582642999, 'bear_tsl_mult': 0.6405576459583758, 'bear_time_stop': 204, 'bear_use_sma': True, 'bear_use_ema': False, 'bear_use_atr': False, 'bear_use_adx': False, 'bear_use_spike': False, 'bear_rsi_required': True, 'sideways_strategy': 'breakout', 'sideways_bb_std_mult': 0.78905163339181, 'sideways_rsi_os': 32, 'sideways_rsi_ob': 92, 'sideways_adx_thresh': 10.799778509938067, 'sideways_atr_min_pct': 0.0029905057231625716, 'sideways_atr_max_pct': 0.10280855849658682, 'sideways_tp_mult': 2.9604161280256567, 'sideways_tsl_mult': 0.45065791551766354, 'sideways_time_stop': 297, 'sideways_use_sma': True, 'sideways_use_ema': False, 'sideways_use_atr': False, 'sideways_use_adx': False, 'sideways_use_spike': False, 'sideways_rsi_required': True}.
[I 2025-08-30 17:03:22,517] Trial 615 finished with values: [-1000000000.0, 1000000000.0] and parameters: {'p_sma': 21, 'p_std': 24, 'p_atr': 18, 'p_adx': 9, 'rsi_period': 23, 'ema1': 17, 'ema2': 37, 'slip_atr_k': 0.010916184641606553, 'slip_spread_k': 0.2029594726494301, 'spread_hl_frac': 0.024538756463182966, 'bb_std_mult': 1.4330822290855063, 'rsi_os': 31, 'rsi_ob': 87, 'vol_spike': 0.15676827339274005, 'adx_thresh': 10.356308263354528, 'atr_min_pct': 0.028259308311710155, 'atr_max_pct': 0.14785950916256357, 'tp_mult': 2.8832959760179895, 'tsl_mult': 0.9293537804103228, 'strategy': 'mean_reversion', 'time_stop': 50, 'use_sma': False, 'use_atr': True, 'use_adx': True, 'use_ema': False, 'use_spike': True, 'rsi_required': True, 'edge_k': 0.5650187427098247, 'edge_cap': 0.9153239126409748, 'bull_strategy': 'mean_reversion', 'bull_bb_std_mult': 1.932499700313177, 'bull_rsi_os': 5, 'bull_rsi_ob': 53, 'bull_adx_thresh': 34.98356130037194, 'bull_atr_min_pct': 0.022391261201252885, 'bull_atr_max_pct': 0.0708938788124921, 'bull_tp_mult': 2.1685787880002785, 'bull_tsl_mult': 0.7938362849832483, 'bull_time_stop': 155, 'bull_use_sma': True, 'bull_use_ema': True, 'bull_use_atr': False, 'bull_use_adx': True, 'bull_use_spike': False, 'bull_rsi_required': True, 'bear_strategy': 'mean_reversion', 'bear_bb_std_mult': 1.036255912784985, 'bear_rsi_os': 15, 'bear_rsi_ob': 76, 'bear_adx_thresh': 12.38285393353039, 'bear_atr_min_pct': 0.02002982906254957, 'bear_atr_max_pct': 0.106885409990026, 'bear_tp_mult': 2.2056985136172442, 'bear_tsl_mult': 0.10787447030685637, 'bear_time_stop': 199, 'bear_use_sma': True, 'bear_use_ema': False, 'bear_use_atr': True, 'bear_use_adx': False, 'bear_use_spike': False, 'bear_rsi_required': True, 'sideways_strategy': 'mean_reversion', 'sideways_bb_std_mult': 0.8316311250500186, 'sideways_rsi_os': 32, 'sideways_rsi_ob': 92, 'sideways_adx_thresh': 11.019967248756693, 'sideways_atr_min_pct': 0.009289493450241403, 'sideways_atr_max_pct': 0.10217588988331833, 'sideways_tp_mult': 2.954486696371133, 'sideways_tsl_mult': 0.9995441501250354, 'sideways_time_stop': 281, 'sideways_use_sma': True, 'sideways_use_ema': True, 'sideways_use_atr': False, 'sideways_use_adx': False, 'sideways_use_spike': True, 'sideways_rsi_required': True}.
[I 2025-08-30 17:03:23,157] Trial 617 finished with values: [-1000000000.0, 1000000000.0] and parameters: {'p_sma': 8, 'p_std': 26, 'p_atr': 16, 'p_adx': 8, 'rsi_period': 22, 'ema1': 18, 'ema2': 46, 'slip_atr_k': 0.1470536303993422, 'slip_spread_k': 0.2607339079894476, 'spread_hl_frac': 0.025017055682056036, 'bb_std_mult': 1.0344523482239607, 'rsi_os': 33, 'rsi_ob': 84, 'vol_spike': 0.15879035859224194, 'adx_thresh': 11.120545755986827, 'atr_min_pct': 0.028355089553883803, 'atr_max_pct': 0.14771069477290197, 'tp_mult': 2.867147458257166, 'tsl_mult': 0.9206364969571961, 'strategy': 'breakout', 'time_stop': 49, 'use_sma': False, 'use_atr': True, 'use_adx': True, 'use_ema': True, 'use_spike': False, 'rsi_required': False, 'edge_k': 0.5763735931229248, 'edge_cap': 0.7828445751232036, 'bull_strategy': 'mean_reversion', 'bull_bb_std_mult': 2.039843099991828, 'bull_rsi_os': 5, 'bull_rsi_ob': 53, 'bull_adx_thresh': 34.98410235144924, 'bull_atr_min_pct': 0.02307536987056061, 'bull_atr_max_pct': 0.10687926147028728, 'bull_tp_mult': 2.2461028712841644, 'bull_tsl_mult': 0.7376982299309242, 'bull_time_stop': 78, 'bull_use_sma': True, 'bull_use_ema': True, 'bull_use_atr': False, 'bull_use_adx': True, 'bull_use_spike': False, 'bull_rsi_required': True, 'bear_strategy': 'breakout', 'bear_bb_std_mult': 1.044835442298394, 'bear_rsi_os': 16, 'bear_rsi_ob': 73, 'bear_adx_thresh': 11.118104207773337, 'bear_atr_min_pct': 0.01971276856313914, 'bear_atr_max_pct': 0.1071017799894813, 'bear_tp_mult': 1.7570583996761209, 'bear_tsl_mult': 0.640662675608743, 'bear_time_stop': 210, 'bear_use_sma': True, 'bear_use_ema': False, 'bear_use_atr': True, 'bear_use_adx': False, 'bear_use_spike': True, 'bear_rsi_required': False, 'sideways_strategy': 'breakout', 'sideways_bb_std_mult': 0.7148249921564375, 'sideways_rsi_os': 31, 'sideways_rsi_ob': 92, 'sideways_adx_thresh': 10.268633922553466, 'sideways_atr_min_pct': 0.00275209523983292, 'sideways_atr_max_pct': 0.09904373230485684, 'sideways_tp_mult': 2.821989156072203, 'sideways_tsl_mult': 0.8944723328405553, 'sideways_time_stop': 298, 'sideways_use_sma': True, 'sideways_use_ema': True, 'sideways_use_atr': True, 'sideways_use_adx': False, 'sideways_use_spike': True, 'sideways_rsi_required': True}.
[I 2025-08-30 17:03:23,378] Trial 616 finished with values: [-1000000000.0, 1000000000.0] and parameters: {'p_sma': 8, 'p_std': 19, 'p_atr': 18, 'p_adx': 8, 'rsi_period': 47, 'ema1': 18, 'ema2': 13, 'slip_atr_k': 0.21645355790432882, 'slip_spread_k': 0.2645290816394399, 'spread_hl_frac': 0.020447563867478875, 'bb_std_mult': 1.4732768466478228, 'rsi_os': 29, 'rsi_ob': 87, 'vol_spike': 0.14889742549565005, 'adx_thresh': 10.404106481936978, 'atr_min_pct': 0.022728696306337517, 'atr_max_pct': 0.1480940905818881, 'tp_mult': 1.4728533242763742, 'tsl_mult': 0.8662344987862913, 'strategy': 'breakout', 'time_stop': 43, 'use_sma': False, 'use_atr': True, 'use_adx': True, 'use_ema': True, 'use_spike': True, 'rsi_required': False, 'edge_k': 0.5616107634382483, 'edge_cap': 0.847244538154995, 'bull_strategy': 'mean_reversion', 'bull_bb_std_mult': 2.8135052150650637, 'bull_rsi_os': 8, 'bull_rsi_ob': 53, 'bull_adx_thresh': 34.361213243134806, 'bull_atr_min_pct': 0.023146814626284522, 'bull_atr_max_pct': 0.07019790648814225, 'bull_tp_mult': 2.171111950249661, 'bull_tsl_mult': 0.8130422780754667, 'bull_time_stop': 113, 'bull_use_sma': True, 'bull_use_ema': True, 'bull_use_atr': False, 'bull_use_adx': True, 'bull_use_spike': False, 'bull_rsi_required': True, 'bear_strategy': 'breakout', 'bear_bb_std_mult': 1.7297952810276995, 'bear_rsi_os': 16, 'bear_rsi_ob': 76, 'bear_adx_thresh': 11.422024500565689, 'bear_atr_min_pct': 0.025419373187534837, 'bear_atr_max_pct': 0.10705268357745999, 'bear_tp_mult': 1.8912166779488377, 'bear_tsl_mult': 0.6062377203278236, 'bear_time_stop': 204, 'bear_use_sma': True, 'bear_use_ema': False, 'bear_use_atr': True, 'bear_use_adx': False, 'bear_use_spike': True, 'bear_rsi_required': False, 'sideways_strategy': 'mean_reversion', 'sideways_bb_std_mult': 0.9404584656759382, 'sideways_rsi_os': 32, 'sideways_rsi_ob': 92, 'sideways_adx_thresh': 10.412150352313851, 'sideways_atr_min_pct': 0.0029085075398271047, 'sideways_atr_max_pct': 0.1001174260191614, 'sideways_tp_mult': 2.999303754830714, 'sideways_tsl_mult': 0.4542835373027238, 'sideways_time_stop': 263, 'sideways_use_sma': True, 'sideways_use_ema': True, 'sideways_use_atr': True, 'sideways_use_adx': False, 'sideways_use_spike': True, 'sideways_rsi_required': True}.
[I 2025-08-30 17:03:23,395] Trial 618 finished with values: [-1000000000.0, 1000000000.0] and parameters: {'p_sma': 27, 'p_std': 19, 'p_atr': 16, 'p_adx': 8, 'rsi_period': 22, 'ema1': 18, 'ema2': 16, 'slip_atr_k': 0.13015329117201546, 'slip_spread_k': 0.28845092929720517, 'spread_hl_frac': 0.03191979405910341, 'bb_std_mult': 3.3055510119500466, 'rsi_os': 33, 'rsi_ob': 85, 'vol_spike': 0.14918617962014807, 'adx_thresh': 11.160171942626494, 'atr_min_pct': 0.01888354190976482, 'atr_max_pct': 0.14723600476357393, 'tp_mult': 2.0033589318165026, 'tsl_mult': 0.9216434885105184, 'strategy': 'breakout', 'time_stop': 32, 'use_sma': False, 'use_atr': True, 'use_adx': True, 'use_ema': True, 'use_spike': False, 'rsi_required': False, 'edge_k': 0.5751952447001382, 'edge_cap': 0.911063175153874, 'bull_strategy': 'mean_reversion', 'bull_bb_std_mult': 1.954060080300405, 'bull_rsi_os': 8, 'bull_rsi_ob': 53, 'bull_adx_thresh': 34.25685075005735, 'bull_atr_min_pct': 0.023155421369058408, 'bull_atr_max_pct': 0.09879176766540435, 'bull_tp_mult': 2.260121254015831, 'bull_tsl_mult': 0.8167861894399777, 'bull_time_stop': 156, 'bull_use_sma': True, 'bull_use_ema': True, 'bull_use_atr': False, 'bull_use_adx': True, 'bull_use_spike': False, 'bull_rsi_required': True, 'bear_strategy': 'breakout', 'bear_bb_std_mult': 1.0359241226074625, 'bear_rsi_os': 16, 'bear_rsi_ob': 55, 'bear_adx_thresh': 5.145614448966969, 'bear_atr_min_pct': 0.019946332369714184, 'bear_atr_max_pct': 0.10203956036693851, 'bear_tp_mult': 1.749057697113133, 'bear_tsl_mult': 0.644855242604066, 'bear_time_stop': 210, 'bear_use_sma': True, 'bear_use_ema': False, 'bear_use_atr': True, 'bear_use_adx': False, 'bear_use_spike': True, 'bear_rsi_required': False, 'sideways_strategy': 'breakout', 'sideways_bb_std_mult': 0.6945427592207394, 'sideways_rsi_os': 35, 'sideways_rsi_ob': 92, 'sideways_adx_thresh': 9.24685323050535, 'sideways_atr_min_pct': 0.012968921033461606, 'sideways_atr_max_pct': 0.09699935130047325, 'sideways_tp_mult': 2.8219475698742817, 'sideways_tsl_mult': 0.5984028311744607, 'sideways_time_stop': 298, 'sideways_use_sma': True, 'sideways_use_ema': True, 'sideways_use_atr': True, 'sideways_use_adx': False, 'sideways_use_spike': True, 'sideways_rsi_required': True}.
[I 2025-08-30 17:04:04,411] Trial 620 finished with values: [-1000000000.0, 1000000000.0] and parameters: {'p_sma': 60, 'p_std': 18, 'p_atr': 16, 'p_adx': 13, 'rsi_period': 22, 'ema1': 18, 'ema2': 52, 'slip_atr_k': 0.009682982210959534, 'slip_spread_k': 0.28750758196217663, 'spread_hl_frac': 0.038518085858629876, 'bb_std_mult': 3.394379723254937, 'rsi_os': 32, 'rsi_ob': 85, 'vol_spike': 0.14657862946502773, 'adx_thresh': 11.087000842910971, 'atr_min_pct': 0.018906605956738275, 'atr_max_pct': 0.1437480765302817, 'tp_mult': 2.0052137610404257, 'tsl_mult': 0.9498643895005583, 'strategy': 'mean_reversion', 'time_stop': 32, 'use_sma': True, 'use_atr': True, 'use_adx': True, 'use_ema': False, 'use_spike': False, 'rsi_required': True, 'edge_k': 0.43887044726006486, 'edge_cap': 0.8913548570290933, 'bull_strategy': 'mean_reversion', 'bull_bb_std_mult': 1.9623727169917657, 'bull_rsi_os': 8, 'bull_rsi_ob': 54, 'bull_adx_thresh': 34.1547515080944, 'bull_atr_min_pct': 0.021926860560494203, 'bull_atr_max_pct': 0.13995017956435135, 'bull_tp_mult': 2.2576565494228977, 'bull_tsl_mult': 0.8143380250532962, 'bull_time_stop': 71, 'bull_use_sma': True, 'bull_use_ema': True, 'bull_use_atr': False, 'bull_use_adx': True, 'bull_use_spike': True, 'bull_rsi_required': False, 'bear_strategy': 'mean_reversion', 'bear_bb_std_mult': 1.4750316290274286, 'bear_rsi_os': 16, 'bear_rsi_ob': 76, 'bear_adx_thresh': 11.53400068842376, 'bear_atr_min_pct': 0.018887462100620277, 'bear_atr_max_pct': 0.10187859063695501, 'bear_tp_mult': 1.8974420858233743, 'bear_tsl_mult': 0.5829313886037947, 'bear_time_stop': 205, 'bear_use_sma': True, 'bear_use_ema': False, 'bear_use_atr': False, 'bear_use_adx': True, 'bear_use_spike': False, 'bear_rsi_required': False, 'sideways_strategy': 'breakout', 'sideways_bb_std_mult': 0.6989355559004506, 'sideways_rsi_os': 33, 'sideways_rsi_ob': 79, 'sideways_adx_thresh': 9.339757227102199, 'sideways_atr_min_pct': 0.004079068970027824, 'sideways_atr_max_pct': 0.09248466806122793, 'sideways_tp_mult': 2.887067197058551, 'sideways_tsl_mult': 0.5860225937789152, 'sideways_time_stop': 290, 'sideways_use_sma': True, 'sideways_use_ema': False, 'sideways_use_atr': False, 'sideways_use_adx': False, 'sideways_use_spike': False, 'sideways_rsi_required': True}.
[I 2025-08-30 17:04:05,027] Trial 622 finished with values: [-1000000000.0, 1000000000.0] and parameters: {'p_sma': 60, 'p_std': 22, 'p_atr': 16, 'p_adx': 10, 'rsi_period': 22, 'ema1': 19, 'ema2': 12, 'slip_atr_k': 0.23625131598448756, 'slip_spread_k': 0.18306476380707212, 'spread_hl_frac': 0.006009249195168938, 'bb_std_mult': 3.1375390008042836, 'rsi_os': 32, 'rsi_ob': 85, 'vol_spike': 0.17471141058022469, 'adx_thresh': 9.558341269124826, 'atr_min_pct': 0.021534230910906362, 'atr_max_pct': 0.1434492085040936, 'tp_mult': 2.826893668897039, 'tsl_mult': 0.9453051038528163, 'strategy': 'mean_reversion', 'time_stop': 34, 'use_sma': True, 'use_atr': True, 'use_adx': True, 'use_ema': False, 'use_spike': False, 'rsi_required': True, 'edge_k': 0.4627984223556386, 'edge_cap': 0.8939556066064409, 'bull_strategy': 'mean_reversion', 'bull_bb_std_mult': 1.863808528919769, 'bull_rsi_os': 34, 'bull_rsi_ob': 54, 'bull_adx_thresh': 33.81280456838608, 'bull_atr_min_pct': 0.02191263373509264, 'bull_atr_max_pct': 0.14063279047400737, 'bull_tp_mult': 2.244059198073378, 'bull_tsl_mult': 0.7859005983476536, 'bull_time_stop': 300, 'bull_use_sma': True, 'bull_use_ema': True, 'bull_use_atr': False, 'bull_use_adx': True, 'bull_use_spike': True, 'bull_rsi_required': False, 'bear_strategy': 'mean_reversion', 'bear_bb_std_mult': 1.547362020659803, 'bear_rsi_os': 18, 'bear_rsi_ob': 88, 'bear_adx_thresh': 19.952657849299555, 'bear_atr_min_pct': 0.01971381571437445, 'bear_atr_max_pct': 0.10337218213266573, 'bear_tp_mult': 1.451484024291704, 'bear_tsl_mult': 0.5802638908349208, 'bear_time_stop': 193, 'bear_use_sma': False, 'bear_use_ema': True, 'bear_use_atr': False, 'bear_use_adx': True, 'bear_use_spike': False, 'bear_rsi_required': False, 'sideways_strategy': 'breakout', 'sideways_bb_std_mult': 0.7720224348932127, 'sideways_rsi_os': 31, 'sideways_rsi_ob': 59, 'sideways_adx_thresh': 12.19293590633196, 'sideways_atr_min_pct': 0.004328924764070428, 'sideways_atr_max_pct': 0.1073815926674092, 'sideways_tp_mult': 2.876347848273632, 'sideways_tsl_mult': 0.42489689199897834, 'sideways_time_stop': 288, 'sideways_use_sma': True, 'sideways_use_ema': False, 'sideways_use_atr': False, 'sideways_use_adx': True, 'sideways_use_spike': False, 'sideways_rsi_required': True}.
