[I 2025-08-30 15:15:02,392] Trial 28 finished with values: [-1000000000.0, 1000000000.0] and parameters: {'p_sma': 14, 'p_std': 28, 'p_atr': 18, 'p_adx': 25, 'rsi_period': 7, 'ema1': 17, 'ema2': 41, 'slip_atr_k': 0.2399509933814538, 'slip_spread_k': 0.5997325582732371, 'spread_hl_frac': 0.028300841940909885, 'bb_std_mult': 1.2465924353514808, 'rsi_os': 24, 'rsi_ob': 45, 'vol_spike': 0.2165111542900104, 'adx_thresh': 24.253210909011273, 'atr_min_pct': 0.01501007789157993, 'atr_max_pct': 0.1041961323950808, 'tp_mult': 2.0257383822474226, 'tsl_mult': 0.39612819318001946, 'strategy': 'breakout', 'time_stop': 87, 'use_sma': True, 'use_atr': True, 'use_adx': True, 'use_ema': True, 'use_spike': False, 'rsi_required': True, 'edge_k': 1.5272345196050812, 'edge_cap': 0.7821567136763926, 'bull_strategy': 'mean_reversion', 'bull_bb_std_mult': 1.4207663917578628, 'bull_rsi_os': 45, 'bull_rsi_ob': 89, 'bull_adx_thresh': 15.59659441311689, 'bull_atr_min_pct': 0.012104428393685541, 'bull_atr_max_pct': 0.14813860542324098, 'bull_tp_mult': 2.999412435372673, 'bull_tsl_mult': 0.48352625816747186, 'bull_time_stop': 137, 'bull_use_sma': False, 'bull_use_ema': True, 'bull_use_atr': False, 'bull_use_adx': False, 'bull_use_spike': False, 'bull_rsi_required': True, 'bear_strategy': 'breakout', 'bear_bb_std_mult': 1.0880973253348105, 'bear_rsi_os': 49, 'bear_rsi_ob': 56, 'bear_adx_thresh': 22.10798449208199, 'bear_atr_min_pct': 0.024629196943622006, 'bear_atr_max_pct': 0.1049566241812015, 'bear_tp_mult': 2.5268697528275696, 'bear_tsl_mult': 0.8928320327894003, 'bear_time_stop': 240, 'bear_use_sma': False, 'bear_use_ema': False, 'bear_use_atr': True, 'bear_use_adx': True, 'bear_use_spike': True, 'bear_rsi_required': True, 'sideways_strategy': 'mean_reversion', 'sideways_bb_std_mult': 3.5944408462696025, 'sideways_rsi_os': 9, 'sideways_rsi_ob': 92, 'sideways_adx_thresh': 9.043730125122277, 'sideways_atr_min_pct': 0.009280599234194283, 'sideways_atr_max_pct': 0.132623825517659, 'sideways_tp_mult': 1.8864472496756381, 'sideways_tsl_mult': 0.2661015063993416, 'sideways_time_stop': 40, 'sideways_use_sma': False, 'sideways_use_ema': True, 'sideways_use_atr': False, 'sideways_use_adx': False, 'sideways_use_spike': True, 'sideways_rsi_required': False}.
[I 2025-08-30 15:15:02,747] Trial 27 finished with values: [-1000000000.0, 1000000000.0] and parameters: {'p_sma': 14, 'p_std': 27, 'p_atr': 19, 'p_adx': 25, 'rsi_period': 7, 'ema1': 18, 'ema2': 42, 'slip_atr_k': 0.24441380743116148, 'slip_spread_k': 0.599231716064625, 'spread_hl_frac': 0.027682231433122432, 'bb_std_mult': 1.9320656513485233, 'rsi_os': 47, 'rsi_ob': 95, 'vol_spike': 0.23404247704405093, 'adx_thresh': 25.48802343682343, 'atr_min_pct': 0.01724672258436821, 'atr_max_pct': 0.04019659481222088, 'tp_mult': 2.801333318848343, 'tsl_mult': 0.39193159134491384, 'strategy': 'breakout', 'time_stop': 89, 'use_sma': True, 'use_atr': True, 'use_adx': True, 'use_ema': True, 'use_spike': False, 'rsi_required': True, 'edge_k': 0.8878085534366222, 'edge_cap': 0.8578729186996286, 'bull_strategy': 'mean_reversion', 'bull_bb_std_mult': 2.2520068517577676, 'bull_rsi_os': 55, 'bull_rsi_ob': 81, 'bull_adx_thresh': 15.733306226981869, 'bull_atr_min_pct': 0.012031484858957612, 'bull_atr_max_pct': 0.024674576377312928, 'bull_tp_mult': 2.9878615780911204, 'bull_tsl_mult': 0.4478803897211726, 'bull_time_stop': 138, 'bull_use_sma': False, 'bull_use_ema': True, 'bull_use_atr': False, 'bull_use_adx': False, 'bull_use_spike': False, 'bull_rsi_required': True, 'bear_strategy': 'breakout', 'bear_bb_std_mult': 1.969171615664251, 'bear_rsi_os': 49, 'bear_rsi_ob': 55, 'bear_adx_thresh': 21.279928732422587, 'bear_atr_min_pct': 0.024173785378135693, 'bear_atr_max_pct': 0.10241084353822141, 'bear_tp_mult': 2.4409410706236834, 'bear_tsl_mult': 0.7184497989866936, 'bear_time_stop': 140, 'bear_use_sma': False, 'bear_use_ema': False, 'bear_use_atr': True, 'bear_use_adx': True, 'bear_use_spike': True, 'bear_rsi_required': True, 'sideways_strategy': 'mean_reversion', 'sideways_bb_std_mult': 3.0628391966876594, 'sideways_rsi_os': 10, 'sideways_rsi_ob': 92, 'sideways_adx_thresh': 14.890068775049478, 'sideways_atr_min_pct': 0.01029765241213952, 'sideways_atr_max_pct': 0.13499296181854123, 'sideways_tp_mult': 1.852573844198563, 'sideways_tsl_mult': 0.2821523886061306, 'sideways_time_stop': 36, 'sideways_use_sma': False, 'sideways_use_ema': True, 'sideways_use_atr': False, 'sideways_use_adx': False, 'sideways_use_spike': True, 'sideways_rsi_required': False}.
[I 2025-08-30 15:15:42,057] Trial 29 finished with values: [-1000000000.0, 1000000000.0] and parameters: {'p_sma': 13, 'p_std': 24, 'p_atr': 18, 'p_adx': 25, 'rsi_period': 7, 'ema1': 17, 'ema2': 26, 'slip_atr_k': 0.24887888841616657, 'slip_spread_k': 0.5778245467216347, 'spread_hl_frac': 0.029220174853433183, 'bb_std_mult': 1.2138444479551225, 'rsi_os': 48, 'rsi_ob': 95, 'vol_spike': 0.21504374299362874, 'adx_thresh': 31.66499124356888, 'atr_min_pct': 0.016200949391483928, 'atr_max_pct': 0.10364444133231362, 'tp_mult': 1.9912808145108338, 'tsl_mult': 0.3653894594485513, 'strategy': 'breakout', 'time_stop': 99, 'use_sma': False, 'use_atr': True, 'use_adx': True, 'use_ema': True, 'use_spike': False, 'rsi_required': False, 'edge_k': 1.6158121983119378, 'edge_cap': 0.7709152985449965, 'bull_strategy': 'mean_reversion', 'bull_bb_std_mult': 1.3331686467429766, 'bull_rsi_os': 44, 'bull_rsi_ob': 90, 'bull_adx_thresh': 20.451658397908897, 'bull_atr_min_pct': 0.01261270951645661, 'bull_atr_max_pct': 0.023511793500194417, 'bull_tp_mult': 2.4938720313659175, 'bull_tsl_mult': 0.5921603783859406, 'bull_time_stop': 154, 'bull_use_sma': True, 'bull_use_ema': False, 'bull_use_atr': False, 'bull_use_adx': False, 'bull_use_spike': False, 'bull_rsi_required': True, 'bear_strategy': 'breakout', 'bear_bb_std_mult': 0.8997295968668471, 'bear_rsi_os': 13, 'bear_rsi_ob': 88, 'bear_adx_thresh': 21.81378099495494, 'bear_atr_min_pct': 0.02635636166525703, 'bear_atr_max_pct': 0.09959756211114845, 'bear_tp_mult': 2.8276049156143994, 'bear_tsl_mult': 0.6775089029986667, 'bear_time_stop': 221, 'bear_use_sma': False, 'bear_use_ema': False, 'bear_use_atr': True, 'bear_use_adx': True, 'bear_use_spike': True, 'bear_rsi_required': True, 'sideways_strategy': 'mean_reversion', 'sideways_bb_std_mult': 2.4479343271603375, 'sideways_rsi_os': 10, 'sideways_rsi_ob': 78, 'sideways_adx_thresh': 7.986391296695121, 'sideways_atr_min_pct': 0.008753898489572903, 'sideways_atr_max_pct': 0.13412086677814233, 'sideways_tp_mult': 1.8662831157286646, 'sideways_tsl_mult': 0.9925629353910341, 'sideways_time_stop': 38, 'sideways_use_sma': False, 'sideways_use_ema': False, 'sideways_use_atr': False, 'sideways_use_adx': False, 'sideways_use_spike': True, 'sideways_rsi_required': False}.
[I 2025-08-30 15:15:46,534] Trial 30 finished with values: [-1000000000.0, 1000000000.0] and parameters: {'p_sma': 12, 'p_std': 22, 'p_atr': 18, 'p_adx': 24, 'rsi_period': 33, 'ema1': 12, 'ema2': 28, 'slip_atr_k': 0.24444807510766461, 'slip_spread_k': 0.595070751099411, 'spread_hl_frac': 0.030010037608682948, 'bb_std_mult': 1.236080820273834, 'rsi_os': 11, 'rsi_ob': 45, 'vol_spike': 0.09418235478012624, 'adx_thresh': 31.23129092399076, 'atr_min_pct': 0.01951565934599541, 'atr_max_pct': 0.10363870571047562, 'tp_mult': 1.9933311540839889, 'tsl_mult': 0.26047930642940165, 'strategy': 'breakout', 'time_stop': 208, 'use_sma': False, 'use_atr': True, 'use_adx': True, 'use_ema': True, 'use_spike': False, 'rsi_required': False, 'edge_k': 0.17469789922368567, 'edge_cap': 0.794354540771254, 'bull_strategy': 'mean_reversion', 'bull_bb_std_mult': 1.512591663059462, 'bull_rsi_os': 45, 'bull_rsi_ob': 89, 'bull_adx_thresh': 16.712742773290827, 'bull_atr_min_pct': 0.012653218247389793, 'bull_atr_max_pct': 0.02168930410613061, 'bull_tp_mult': 2.490369298384964, 'bull_tsl_mult': 0.6043946994661662, 'bull_time_stop': 148, 'bull_use_sma': True, 'bull_use_ema': False, 'bull_use_atr': False, 'bull_use_adx': False, 'bull_use_spike': False, 'bull_rsi_required': True, 'bear_strategy': 'breakout', 'bear_bb_std_mult': 1.039893414745877, 'bear_rsi_os': 48, 'bear_rsi_ob': 87, 'bear_adx_thresh': 14.24604779525745, 'bear_atr_min_pct': 0.025734340120341946, 'bear_atr_max_pct': 0.03860473247373665, 'bear_tp_mult': 2.825542957269659, 'bear_tsl_mult': 0.92523912695717, 'bear_time_stop': 139, 'bear_use_sma': False, 'bear_use_ema': False, 'bear_use_atr': True, 'bear_use_adx': True, 'bear_use_spike': True, 'bear_rsi_required': True, 'sideways_strategy': 'mean_reversion', 'sideways_bb_std_mult': 3.5835328989464044, 'sideways_rsi_os': 11, 'sideways_rsi_ob': 78, 'sideways_adx_thresh': 15.796225340927908, 'sideways_atr_min_pct': 0.006783222703094043, 'sideways_atr_max_pct': 0.13363189652984553, 'sideways_tp_mult': 1.5543174475516173, 'sideways_tsl_mult': 0.9750908790569668, 'sideways_time_stop': 36, 'sideways_use_sma': False, 'sideways_use_ema': False, 'sideways_use_atr': False, 'sideways_use_adx': False, 'sideways_use_spike': True, 'sideways_rsi_required': False}.
[I 2025-08-30 15:15:49,072] Trial 31 finished with values: [-1000000000.0, 1000000000.0] and parameters: {'p_sma': 6, 'p_std': 10, 'p_atr': 16, 'p_adx': 12, 'rsi_period': 31, 'ema1': 11, 'ema2': 29, 'slip_atr_k': 0.1447663297878659, 'slip_spread_k': 0.06616427338108659, 'spread_hl_frac': 0.018088080343920725, 'bb_std_mult': 1.1284653543851162, 'rsi_os': 49, 'rsi_ob': 94, 'vol_spike': 0.17493447053210884, 'adx_thresh': 32.11871622212146, 'atr_min_pct': 0.019101611331935296, 'atr_max_pct': 0.08364834468611272, 'tp_mult': 2.1519800207243285, 'tsl_mult': 0.23566607516616234, 'strategy': 'breakout', 'time_stop': 207, 'use_sma': False, 'use_atr': False, 'use_adx': True, 'use_ema': True, 'use_spike': False, 'rsi_required': False, 'edge_k': 1.679636611104868, 'edge_cap': 0.48230264518247845, 'bull_strategy': 'mean_reversion', 'bull_bb_std_mult': 2.7142349276500477, 'bull_rsi_os': 44, 'bull_rsi_ob': 81, 'bull_adx_thresh': 19.972731821504166, 'bull_atr_min_pct': 0.012976506740197229, 'bull_atr_max_pct': 0.02382992642266485, 'bull_tp_mult': 2.7781522786386144, 'bull_tsl_mult': 0.5897308557143907, 'bull_time_stop': 53, 'bull_use_sma': True, 'bull_use_ema': False, 'bull_use_atr': False, 'bull_use_adx': False, 'bull_use_spike': False, 'bull_rsi_required': True, 'bear_strategy': 'breakout', 'bear_bb_std_mult': 1.5726071769561372, 'bear_rsi_os': 13, 'bear_rsi_ob': 87, 'bear_adx_thresh': 14.303941267730664, 'bear_atr_min_pct': 0.004733722779505966, 'bear_atr_max_pct': 0.052970283906245814, 'bear_tp_mult': 2.8162764926584503, 'bear_tsl_mult': 0.9106450711799852, 'bear_time_stop': 299, 'bear_use_sma': False, 'bear_use_ema': False, 'bear_use_atr': True, 'bear_use_adx': True, 'bear_use_spike': True, 'bear_rsi_required': True, 'sideways_strategy': 'mean_reversion', 'sideways_bb_std_mult': 2.4627760539252455, 'sideways_rsi_os': 11, 'sideways_rsi_ob': 78, 'sideways_adx_thresh': 15.231968746902963, 'sideways_atr_min_pct': 0.006334428980319636, 'sideways_atr_max_pct': 0.09396473574251861, 'sideways_tp_mult': 1.6032038827503976, 'sideways_tsl_mult': 0.9928650338145528, 'sideways_time_stop': 34, 'sideways_use_sma': False, 'sideways_use_ema': False, 'sideways_use_atr': False, 'sideways_use_adx': False, 'sideways_use_spike': True, 'sideways_rsi_required': False}.
[I 2025-08-30 15:15:49,916] Trial 32 finished with values: [-1000000000.0, 1000000000.0] and parameters: {'p_sma': 36, 'p_std': 10, 'p_atr': 17, 'p_adx': 13, 'rsi_period': 31, 'ema1': 14, 'ema2': 51, 'slip_atr_k': 0.1365730144089365, 'slip_spread_k': 0.8160639465225568, 'spread_hl_frac': 0.01944000027920872, 'bb_std_mult': 2.258307616895199, 'rsi_os': 33, 'rsi_ob': 76, 'vol_spike': 0.29636471966520317, 'adx_thresh': 32.062925699917244, 'atr_min_pct': 0.010066656253612843, 'atr_max_pct': 0.045935764824434344, 'tp_mult': 2.528490198958674, 'tsl_mult': 0.8624542031775903, 'strategy': 'breakout', 'time_stop': 199, 'use_sma': False, 'use_atr': False, 'use_adx': True, 'use_ema': False, 'use_spike': False, 'rsi_required': False, 'edge_k': 1.6580803419824846, 'edge_cap': 0.7540090180584935, 'bull_strategy': 'mean_reversion', 'bull_bb_std_mult': 2.7639387591757516, 'bull_rsi_os': 44, 'bull_rsi_ob': 90, 'bull_adx_thresh': 11.816253931656284, 'bull_atr_min_pct': 0.016028899359415535, 'bull_atr_max_pct': 0.06846150057334675, 'bull_tp_mult': 2.4765973169243205, 'bull_tsl_mult': 0.5880033978981003, 'bull_time_stop': 156, 'bull_use_sma': True, 'bull_use_ema': False, 'bull_use_atr': False, 'bull_use_adx': False, 'bull_use_spike': False, 'bull_rsi_required': True, 'bear_strategy': 'mean_reversion', 'bear_bb_std_mult': 1.5309415300780205, 'bear_rsi_os': 13, 'bear_rsi_ob': 87, 'bear_adx_thresh': 13.728716303406808, 'bear_atr_min_pct': 0.018413701076468992, 'bear_atr_max_pct': 0.036447390219717865, 'bear_tp_mult': 2.7943241440003357, 'bear_tsl_mult': 0.9315701647230903, 'bear_time_stop': 25, 'bear_use_sma': False, 'bear_use_ema': True, 'bear_use_atr': True, 'bear_use_adx': True, 'bear_use_spike': True, 'bear_rsi_required': True, 'sideways_strategy': 'mean_reversion', 'sideways_bb_std_mult': 1.5003277141055325, 'sideways_rsi_os': 55, 'sideways_rsi_ob': 78, 'sideways_adx_thresh': 19.83376590962471, 'sideways_atr_min_pct': 0.0042566198716111805, 'sideways_atr_max_pct': 0.09417096782557755, 'sideways_tp_mult': 1.5164965435961124, 'sideways_tsl_mult': 0.9839880542771655, 'sideways_time_stop': 75, 'sideways_use_sma': False, 'sideways_use_ema': False, 'sideways_use_atr': False, 'sideways_use_adx': False, 'sideways_use_spike': True, 'sideways_rsi_required': False}.
[I 2025-08-30 15:16:25,769] Trial 33 finished with values: [-1000000000.0, 1000000000.0] and parameters: {'p_sma': 34, 'p_std': 11, 'p_atr': 28, 'p_adx': 13, 'rsi_period': 31, 'ema1': 12, 'ema2': 57, 'slip_atr_k': 0.14959012452663423, 'slip_spread_k': 0.8774189725181771, 'spread_hl_frac': 0.01834171608963103, 'bb_std_mult': 0.5774570111564028, 'rsi_os': 33, 'rsi_ob': 75, 'vol_spike': 0.29611068821828107, 'adx_thresh': 32.046381340033506, 'atr_min_pct': 0.02002778031427295, 'atr_max_pct': 0.04892924858819907, 'tp_mult': 2.53233721775143, 'tsl_mult': 0.8849007425992506, 'strategy': 'mean_reversion', 'time_stop': 203, 'use_sma': False, 'use_atr': False, 'use_adx': False, 'use_ema': False, 'use_spike': False, 'rsi_required': False, 'edge_k': 0.18490147223853193, 'edge_cap': 0.28644464976043915, 'bull_strategy': 'breakout', 'bull_bb_std_mult': 3.2517815113141477, 'bull_rsi_os': 32, 'bull_rsi_ob': 80, 'bull_adx_thresh': 11.426328515006013, 'bull_atr_min_pct': 0.016002201843892346, 'bull_atr_max_pct': 0.07903134318610915, 'bull_tp_mult': 2.556740370686724, 'bull_tsl_mult': 0.24178097775451374, 'bull_time_stop': 54, 'bull_use_sma': True, 'bull_use_ema': False, 'bull_use_atr': True, 'bull_use_adx': True, 'bull_use_spike': False, 'bull_rsi_required': False, 'bear_strategy': 'mean_reversion', 'bear_bb_std_mult': 1.5313672289002007, 'bear_rsi_os': 29, 'bear_rsi_ob': 85, 'bear_adx_thresh': 14.14033111062144, 'bear_atr_min_pct': 0.016716018196616465, 'bear_atr_max_pct': 0.04585451677237198, 'bear_tp_mult': 2.8602155803605838, 'bear_tsl_mult': 0.9056347730957461, 'bear_time_stop': 296, 'bear_use_sma': True, 'bear_use_ema': True, 'bear_use_atr': True, 'bear_use_adx': False, 'bear_use_spike': False, 'bear_rsi_required': False, 'sideways_strategy': 'breakout', 'sideways_bb_std_mult': 1.5686388051620184, 'sideways_rsi_os': 54, 'sideways_rsi_ob': 85, 'sideways_adx_thresh': 20.941073671296834, 'sideways_atr_min_pct': 0.00428413019538098, 'sideways_atr_max_pct': 0.08024796385870274, 'sideways_tp_mult': 1.6903396339467873, 'sideways_tsl_mult': 0.3881201140013837, 'sideways_time_stop': 234, 'sideways_use_sma': False, 'sideways_use_ema': False, 'sideways_use_atr': True, 'sideways_use_adx': False, 'sideways_use_spike': False, 'sideways_rsi_required': False}.
[I 2025-08-30 15:16:32,549] Trial 34 finished with values: [-1000000000.0, 1000000000.0] and parameters: {'p_sma': 35, 'p_std': 10, 'p_atr': 30, 'p_adx': 8, 'rsi_period': 22, 'ema1': 28, 'ema2': 51, 'slip_atr_k': 0.22473550022024824, 'slip_spread_k': 0.848748744801125, 'spread_hl_frac': 0.019935866283115125, 'bb_std_mult': 0.5445344114184585, 'rsi_os': 33, 'rsi_ob': 74, 'vol_spike': 0.18102343817785801, 'adx_thresh': 32.66345120534874, 'atr_min_pct': 0.012079709019408379, 'atr_max_pct': 0.048268130575081364, 'tp_mult': 2.362099470464085, 'tsl_mult': 0.19952556910845753, 'strategy': 'mean_reversion', 'time_stop': 298, 'use_sma': True, 'use_atr': False, 'use_adx': True, 'use_ema': False, 'use_spike': False, 'rsi_required': True, 'edge_k': 0.5389531933123056, 'edge_cap': 0.4731397228145504, 'bull_strategy': 'mean_reversion', 'bull_bb_std_mult': 2.5710945978206996, 'bull_rsi_os': 33, 'bull_rsi_ob': 92, 'bull_adx_thresh': 11.394851455531906, 'bull_atr_min_pct': 0.0093352203291287, 'bull_atr_max_pct': 0.010303667683724814, 'bull_tp_mult': 2.8048298136757746, 'bull_tsl_mult': 0.35573118053801334, 'bull_time_stop': 109, 'bull_use_sma': False, 'bull_use_ema': True, 'bull_use_atr': True, 'bull_use_adx': False, 'bull_use_spike': False, 'bull_rsi_required': True, 'bear_strategy': 'mean_reversion', 'bear_bb_std_mult': 1.4711050963515686, 'bear_rsi_os': 30, 'bear_rsi_ob': 95, 'bear_adx_thresh': 34.34178569299228, 'bear_atr_min_pct': 0.016841923743533542, 'bear_atr_max_pct': 0.14875589672500703, 'bear_tp_mult': 2.9984335069962214, 'bear_tsl_mult': 0.9171454058320008, 'bear_time_stop': 25, 'bear_use_sma': False, 'bear_use_ema': True, 'bear_use_atr': True, 'bear_use_adx': True, 'bear_use_spike': True, 'bear_rsi_required': True, 'sideways_strategy': 'mean_reversion', 'sideways_bb_std_mult': 2.274619175737538, 'sideways_rsi_os': 18, 'sideways_rsi_ob': 69, 'sideways_adx_thresh': 19.666601517508056, 'sideways_atr_min_pct': 0.003938132709916123, 'sideways_atr_max_pct': 0.09668385624816306, 'sideways_tp_mult': 1.6928251693253764, 'sideways_tsl_mult': 0.08410886304756773, 'sideways_time_stop': 69, 'sideways_use_sma': False, 'sideways_use_ema': True, 'sideways_use_atr': False, 'sideways_use_adx': False, 'sideways_use_spike': False, 'sideways_rsi_required': False}.
[I 2025-08-30 15:16:34,084] Trial 35 finished with values: [-0.02698115825502978, 0.02706910847750113] and parameters: {'p_sma': 34, 'p_std': 5, 'p_atr': 30, 'p_adx': 8, 'rsi_period': 20, 'ema1': 28, 'ema2': 52, 'slip_atr_k': 0.22728945557234595, 'slip_spread_k': 0.8807420065457817, 'spread_hl_frac': 0.04278844182463212, 'bb_std_mult': 1.6376406791755378, 'rsi_os': 33, 'rsi_ob': 75, 'vol_spike': 0.2940009496770426, 'adx_thresh': 34.874517377767404, 'atr_min_pct': 0.011327542835188234, 'atr_max_pct': 0.047198108639092934, 'tp_mult': 2.4951791309207776, 'tsl_mult': 0.9135564557905469, 'strategy': 'mean_reversion', 'time_stop': 293, 'use_sma': True, 'use_atr': False, 'use_adx': True, 'use_ema': False, 'use_spike': False, 'rsi_required': True, 'edge_k': 0.556832360500054, 'edge_cap': 0.9466984523832332, 'bull_strategy': 'breakout', 'bull_bb_std_mult': 3.2388813609735445, 'bull_rsi_os': 33, 'bull_rsi_ob': 92, 'bull_adx_thresh': 10.582956914331572, 'bull_atr_min_pct': 0.01620807962529435, 'bull_atr_max_pct': 0.010022426095180968, 'bull_tp_mult': 2.799615466492478, 'bull_tsl_mult': 0.3508202848740618, 'bull_time_stop': 204, 'bull_use_sma': False, 'bull_use_ema': True, 'bull_use_atr': True, 'bull_use_adx': True, 'bull_use_spike': False, 'bull_rsi_required': False, 'bear_strategy': 'mean_reversion', 'bear_bb_std_mult': 1.3709278953090078, 'bear_rsi_os': 31, 'bear_rsi_ob': 92, 'bear_adx_thresh': 32.53036083905644, 'bear_atr_min_pct': 0.01698223976188612, 'bear_atr_max_pct': 0.13245418597632003, 'bear_tp_mult': 1.724127242474967, 'bear_tsl_mult': 0.891524266948049, 'bear_time_stop': 27, 'bear_use_sma': True, 'bear_use_ema': True, 'bear_use_atr': True, 'bear_use_adx': False, 'bear_use_spike': False, 'bear_rsi_required': False, 'sideways_strategy': 'breakout', 'sideways_bb_std_mult': 2.2171402251998287, 'sideways_rsi_os': 55, 'sideways_rsi_ob': 70, 'sideways_adx_thresh': 19.432143439425367, 'sideways_atr_min_pct': 0.0030021207228052593, 'sideways_atr_max_pct': 0.07781571585552542, 'sideways_tp_mult': 1.1872544365900874, 'sideways_tsl_mult': 0.10541038560206167, 'sideways_time_stop': 72, 'sideways_use_sma': False, 'sideways_use_ema': True, 'sideways_use_atr': False, 'sideways_use_adx': False, 'sideways_use_spike': False, 'sideways_rsi_required': False}.
