[I 2025-08-30 15:46:55,336] Trial 180 finished with values: [-1000000000.0, 1000000000.0] and parameters: {'p_sma': 12, 'p_std': 20, 'p_atr': 26, 'p_adx': 29, 'rsi_period': 31, 'ema1': 24, 'ema2': 34, 'slip_atr_k': 0.011572859290390806, 'slip_spread_k': 0.02181037108013831, 'spread_hl_frac': 0.02057379405352456, 'bb_std_mult': 2.9572378552802547, 'rsi_os': 47, 'rsi_ob': 64, 'vol_spike': 0.006030722560162105, 'adx_thresh': 20.776316702709895, 'atr_min_pct': 0.028815727695455325, 'atr_max_pct': 0.12920185107871465, 'tp_mult': 1.014050621811897, 'tsl_mult': 0.4156869034379409, 'strategy': 'breakout', 'time_stop': 115, 'use_sma': False, 'use_atr': True, 'use_adx': False, 'use_ema': False, 'use_spike': True, 'rsi_required': False, 'edge_k': 0.3643020694859045, 'edge_cap': 0.5678275331260002, 'bull_strategy': 'mean_reversion', 'bull_bb_std_mult': 2.0319294602708036, 'bull_rsi_os': 19, 'bull_rsi_ob': 74, 'bull_adx_thresh': 20.25268581510374, 'bull_atr_min_pct': 0.003989837725384326, 'bull_atr_max_pct': 0.05153969150439396, 'bull_tp_mult': 2.549058914417163, 'bull_tsl_mult': 0.42412326987029514, 'bull_time_stop': 77, 'bull_use_sma': True, 'bull_use_ema': True, 'bull_use_atr': False, 'bull_use_adx': False, 'bull_use_spike': False, 'bull_rsi_required': True, 'bear_strategy': 'mean_reversion', 'bear_bb_std_mult': 2.249516770910972, 'bear_rsi_os': 15, 'bear_rsi_ob': 81, 'bear_adx_thresh': 13.152259876219823, 'bear_atr_min_pct': 0.0299400297966568, 'bear_atr_max_pct': 0.0943856119200336, 'bear_tp_mult': 2.3432545580445567, 'bear_tsl_mult': 0.5095790111425681, 'bear_time_stop': 262, 'bear_use_sma': False, 'bear_use_ema': False, 'bear_use_atr': False, 'bear_use_adx': False, 'bear_use_spike': True, 'bear_rsi_required': False, 'sideways_strategy': 'mean_reversion', 'sideways_bb_std_mult': 3.1593574156870674, 'sideways_rsi_os': 27, 'sideways_rsi_ob': 87, 'sideways_adx_thresh': 13.049873659706666, 'sideways_atr_min_pct': 0.000977491313463471, 'sideways_atr_max_pct': 0.09043517790812375, 'sideways_tp_mult': 1.666987289182428, 'sideways_tsl_mult': 0.9275397880392406, 'sideways_time_stop': 233, 'sideways_use_sma': True, 'sideways_use_ema': False, 'sideways_use_atr': False, 'sideways_use_adx': True, 'sideways_use_spike': False, 'sideways_rsi_required': True}.
[I 2025-08-30 15:46:55,772] Trial 182 finished with values: [-0.014142645749566474, 0.014065761285762311] and parameters: {'p_sma': 11, 'p_std': 21, 'p_atr': 26, 'p_adx': 16, 'rsi_period': 37, 'ema1': 26, 'ema2': 33, 'slip_atr_k': 0.012045479555491194, 'slip_spread_k': 0.034243695013663866, 'spread_hl_frac': 0.016828524344399742, 'bb_std_mult': 3.0121909507475673, 'rsi_os': 48, 'rsi_ob': 61, 'vol_spike': 0.0033164219901506697, 'adx_thresh': 21.142548922778634, 'atr_min_pct': 0.0260073891482053, 'atr_max_pct': 0.14912404031898185, 'tp_mult': 1.0110650579503586, 'tsl_mult': 0.410420966707979, 'strategy': 'breakout', 'time_stop': 266, 'use_sma': False, 'use_atr': True, 'use_adx': False, 'use_ema': True, 'use_spike': True, 'rsi_required': False, 'edge_k': 0.144350806134241, 'edge_cap': 0.6335073254233016, 'bull_strategy': 'mean_reversion', 'bull_bb_std_mult': 1.7350318343047069, 'bull_rsi_os': 20, 'bull_rsi_ob': 65, 'bull_adx_thresh': 31.96110331489492, 'bull_atr_min_pct': 0.006749452117390271, 'bull_atr_max_pct': 0.05488618522514342, 'bull_tp_mult': 2.427906624748274, 'bull_tsl_mult': 0.4457984618056331, 'bull_time_stop': 104, 'bull_use_sma': True, 'bull_use_ema': True, 'bull_use_atr': False, 'bull_use_adx': False, 'bull_use_spike': True, 'bull_rsi_required': True, 'bear_strategy': 'breakout', 'bear_bb_std_mult': 2.2878507995444766, 'bear_rsi_os': 15, 'bear_rsi_ob': 81, 'bear_adx_thresh': 14.528877251334736, 'bear_atr_min_pct': 0.02854824134508256, 'bear_atr_max_pct': 0.08793003940489169, 'bear_tp_mult': 2.3549692186220215, 'bear_tsl_mult': 0.51890616594174, 'bear_time_stop': 294, 'bear_use_sma': False, 'bear_use_ema': False, 'bear_use_atr': False, 'bear_use_adx': False, 'bear_use_spike': True, 'bear_rsi_required': False, 'sideways_strategy': 'breakout', 'sideways_bb_std_mult': 3.187727731872146, 'sideways_rsi_os': 33, 'sideways_rsi_ob': 86, 'sideways_adx_thresh': 28.883780308053044, 'sideways_atr_min_pct': 0.0008397909059778553, 'sideways_atr_max_pct': 0.08836337300302234, 'sideways_tp_mult': 1.7353237721880006, 'sideways_tsl_mult': 0.9579905311306772, 'sideways_time_stop': 204, 'sideways_use_sma': True, 'sideways_use_ema': False, 'sideways_use_atr': True, 'sideways_use_adx': True, 'sideways_use_spike': True, 'sideways_rsi_required': True}.
[I 2025-08-30 15:46:56,032] Trial 181 finished with values: [-1000000000.0, 1000000000.0] and parameters: {'p_sma': 11, 'p_std': 24, 'p_atr': 26, 'p_adx': 16, 'rsi_period': 35, 'ema1': 24, 'ema2': 34, 'slip_atr_k': 0.005856318162204727, 'slip_spread_k': 0.031059605062651558, 'spread_hl_frac': 0.0193048741072189, 'bb_std_mult': 2.9627655672820716, 'rsi_os': 43, 'rsi_ob': 64, 'vol_spike': 0.001072238828664974, 'adx_thresh': 20.980624046000095, 'atr_min_pct': 0.026243890912345184, 'atr_max_pct': 0.1338179385721232, 'tp_mult': 1.0606942430303994, 'tsl_mult': 0.42520734065828747, 'strategy': 'breakout', 'time_stop': 267, 'use_sma': False, 'use_atr': True, 'use_adx': False, 'use_ema': True, 'use_spike': True, 'rsi_required': False, 'edge_k': 0.2720725836522148, 'edge_cap': 0.6344558425253775, 'bull_strategy': 'mean_reversion', 'bull_bb_std_mult': 2.073233192360665, 'bull_rsi_os': 26, 'bull_rsi_ob': 74, 'bull_adx_thresh': 31.39370199798378, 'bull_atr_min_pct': 0.0021598611482982837, 'bull_atr_max_pct': 0.05639751611449471, 'bull_tp_mult': 2.4332858954842673, 'bull_tsl_mult': 0.44078548539516393, 'bull_time_stop': 77, 'bull_use_sma': True, 'bull_use_ema': True, 'bull_use_atr': False, 'bull_use_adx': False, 'bull_use_spike': True, 'bull_rsi_required': True, 'bear_strategy': 'breakout', 'bear_bb_std_mult': 2.2788172448479838, 'bear_rsi_os': 16, 'bear_rsi_ob': 81, 'bear_adx_thresh': 14.784769816945264, 'bear_atr_min_pct': 0.02842302488427563, 'bear_atr_max_pct': 0.09600935384769577, 'bear_tp_mult': 2.3992989457852363, 'bear_tsl_mult': 0.5049437553947993, 'bear_time_stop': 261, 'bear_use_sma': False, 'bear_use_ema': False, 'bear_use_atr': False, 'bear_use_adx': False, 'bear_use_spike': True, 'bear_rsi_required': False, 'sideways_strategy': 'breakout', 'sideways_bb_std_mult': 3.193801149237843, 'sideways_rsi_os': 28, 'sideways_rsi_ob': 87, 'sideways_adx_thresh': 13.843552324771709, 'sideways_atr_min_pct': 0.0008255321861315177, 'sideways_atr_max_pct': 0.09803861903069282, 'sideways_tp_mult': 1.6678515487091436, 'sideways_tsl_mult': 0.9594006997242284, 'sideways_time_stop': 202, 'sideways_use_sma': True, 'sideways_use_ema': False, 'sideways_use_atr': False, 'sideways_use_adx': True, 'sideways_use_spike': False, 'sideways_rsi_required': True}.
[I 2025-08-30 15:47:45,694] Trial 185 finished with values: [-1000000000.0, 1000000000.0] and parameters: {'p_sma': 17, 'p_std': 24, 'p_atr': 26, 'p_adx': 15, 'rsi_period': 37, 'ema1': 26, 'ema2': 33, 'slip_atr_k': 0.011734329735701916, 'slip_spread_k': 0.03587498450308335, 'spread_hl_frac': 0.046802195757190246, 'bb_std_mult': 2.977173690082477, 'rsi_os': 38, 'rsi_ob': 60, 'vol_spike': 0.013575438476439394, 'adx_thresh': 21.989443909110914, 'atr_min_pct': 0.02176506645359306, 'atr_max_pct': 0.1489772769623097, 'tp_mult': 1.067663182113493, 'tsl_mult': 0.4574205879537891, 'strategy': 'breakout', 'time_stop': 264, 'use_sma': False, 'use_atr': True, 'use_adx': False, 'use_ema': True, 'use_spike': True, 'rsi_required': False, 'edge_k': 0.2561954459423762, 'edge_cap': 0.6338104684814617, 'bull_strategy': 'breakout', 'bull_bb_std_mult': 1.6712457154323108, 'bull_rsi_os': 26, 'bull_rsi_ob': 59, 'bull_adx_thresh': 31.89147027449706, 'bull_atr_min_pct': 0.0021439565787829246, 'bull_atr_max_pct': 0.055556697245621546, 'bull_tp_mult': 2.6173073079181965, 'bull_tsl_mult': 0.3887601066088239, 'bull_time_stop': 86, 'bull_use_sma': True, 'bull_use_ema': True, 'bull_use_atr': False, 'bull_use_adx': False, 'bull_use_spike': False, 'bull_rsi_required': True, 'bear_strategy': 'breakout', 'bear_bb_std_mult': 2.8661912400026357, 'bear_rsi_os': 12, 'bear_rsi_ob': 81, 'bear_adx_thresh': 10.993461763297145, 'bear_atr_min_pct': 0.028349351447985307, 'bear_atr_max_pct': 0.0874939094466286, 'bear_tp_mult': 2.2499483095141, 'bear_tsl_mult': 0.573482258094932, 'bear_time_stop': 290, 'bear_use_sma': False, 'bear_use_ema': False, 'bear_use_atr': False, 'bear_use_adx': False, 'bear_use_spike': True, 'bear_rsi_required': False, 'sideways_strategy': 'breakout', 'sideways_bb_std_mult': 3.295190573581327, 'sideways_rsi_os': 33, 'sideways_rsi_ob': 84, 'sideways_adx_thresh': 28.921137639570468, 'sideways_atr_min_pct': 0.02887039716826703, 'sideways_atr_max_pct': 0.09698025302839713, 'sideways_tp_mult': 1.918285087705743, 'sideways_tsl_mult': 0.8813289293391608, 'sideways_time_stop': 290, 'sideways_use_sma': True, 'sideways_use_ema': False, 'sideways_use_atr': False, 'sideways_use_adx': True, 'sideways_use_spike': False, 'sideways_rsi_required': True}.
[I 2025-08-30 15:47:46,607] Trial 183 finished with values: [-1000000000.0, 1000000000.0] and parameters: {'p_sma': 12, 'p_std': 23, 'p_atr': 26, 'p_adx': 16, 'rsi_period': 37, 'ema1': 24, 'ema2': 34, 'slip_atr_k': 0.012906595210151795, 'slip_spread_k': 0.03128311660970168, 'spread_hl_frac': 0.021418065681606882, 'bb_std_mult': 2.9369268271726767, 'rsi_os': 42, 'rsi_ob': 59, 'vol_spike': 0.001017120745458431, 'adx_thresh': 21.045975969284065, 'atr_min_pct': 0.02645728777992699, 'atr_max_pct': 0.13365171492206204, 'tp_mult': 1.0125953831624572, 'tsl_mult': 0.3959140674988483, 'strategy': 'breakout', 'time_stop': 263, 'use_sma': False, 'use_atr': True, 'use_adx': False, 'use_ema': True, 'use_spike': True, 'rsi_required': False, 'edge_k': 0.25586039167029423, 'edge_cap': 0.6385733108881858, 'bull_strategy': 'mean_reversion', 'bull_bb_std_mult': 2.5925306023159087, 'bull_rsi_os': 26, 'bull_rsi_ob': 65, 'bull_adx_thresh': 19.398519262280622, 'bull_atr_min_pct': 0.001960521463950168, 'bull_atr_max_pct': 0.055735851798806135, 'bull_tp_mult': 2.428745046473637, 'bull_tsl_mult': 0.4478581994678927, 'bull_time_stop': 86, 'bull_use_sma': True, 'bull_use_ema': True, 'bull_use_atr': False, 'bull_use_adx': False, 'bull_use_spike': False, 'bull_rsi_required': True, 'bear_strategy': 'breakout', 'bear_bb_std_mult': 2.2658999292229707, 'bear_rsi_os': 15, 'bear_rsi_ob': 81, 'bear_adx_thresh': 10.878206002341082, 'bear_atr_min_pct': 0.02836450807703515, 'bear_atr_max_pct': 0.09485728639286202, 'bear_tp_mult': 2.347955608827153, 'bear_tsl_mult': 0.5094233688213582, 'bear_time_stop': 98, 'bear_use_sma': False, 'bear_use_ema': False, 'bear_use_atr': False, 'bear_use_adx': False, 'bear_use_spike': True, 'bear_rsi_required': False, 'sideways_strategy': 'breakout', 'sideways_bb_std_mult': 3.026810119135458, 'sideways_rsi_os': 32, 'sideways_rsi_ob': 87, 'sideways_adx_thresh': 10.80950740705572, 'sideways_atr_min_pct': 0.002301133046417846, 'sideways_atr_max_pct': 0.09798899493786599, 'sideways_tp_mult': 1.917007344388834, 'sideways_tsl_mult': 0.8137855578029696, 'sideways_time_stop': 220, 'sideways_use_sma': True, 'sideways_use_ema': False, 'sideways_use_atr': False, 'sideways_use_adx': True, 'sideways_use_spike': False, 'sideways_rsi_required': True}.
[I 2025-08-30 15:47:47,428] Trial 184 finished with values: [-0.012409831151981798, 0.012358988252498362] and parameters: {'p_sma': 15, 'p_std': 24, 'p_atr': 26, 'p_adx': 15, 'rsi_period': 35, 'ema1': 22, 'ema2': 33, 'slip_atr_k': 0.005965602202898643, 'slip_spread_k': 0.036080396997245204, 'spread_hl_frac': 0.01302915930958478, 'bb_std_mult': 2.9843030308962843, 'rsi_os': 42, 'rsi_ob': 59, 'vol_spike': 0.013465212966235922, 'adx_thresh': 21.320040467420103, 'atr_min_pct': 0.02597141983336041, 'atr_max_pct': 0.13399565460082208, 'tp_mult': 1.1111259534883338, 'tsl_mult': 0.4483290994218414, 'strategy': 'breakout', 'time_stop': 265, 'use_sma': False, 'use_atr': True, 'use_adx': False, 'use_ema': True, 'use_spike': True, 'rsi_required': False, 'edge_k': 0.2717037330914666, 'edge_cap': 0.6399080213118742, 'bull_strategy': 'breakout', 'bull_bb_std_mult': 2.6257592294191214, 'bull_rsi_os': 26, 'bull_rsi_ob': 66, 'bull_adx_thresh': 31.926780839280056, 'bull_atr_min_pct': 0.0005321260663855442, 'bull_atr_max_pct': 0.055233362987768465, 'bull_tp_mult': 2.6268197562363613, 'bull_tsl_mult': 0.5231215830640588, 'bull_time_stop': 87, 'bull_use_sma': True, 'bull_use_ema': True, 'bull_use_atr': False, 'bull_use_adx': False, 'bull_use_spike': False, 'bull_rsi_required': True, 'bear_strategy': 'breakout', 'bear_bb_std_mult': 2.243190970754126, 'bear_rsi_os': 20, 'bear_rsi_ob': 81, 'bear_adx_thresh': 10.843075658655575, 'bear_atr_min_pct': 0.02841536940676192, 'bear_atr_max_pct': 0.0973075039013604, 'bear_tp_mult': 2.4184564685720913, 'bear_tsl_mult': 0.5746901563666633, 'bear_time_stop': 274, 'bear_use_sma': False, 'bear_use_ema': False, 'bear_use_atr': False, 'bear_use_adx': False, 'bear_use_spike': True, 'bear_rsi_required': False, 'sideways_strategy': 'breakout', 'sideways_bb_std_mult': 3.278085016520682, 'sideways_rsi_os': 32, 'sideways_rsi_ob': 89, 'sideways_adx_thresh': 11.70670318211846, 'sideways_atr_min_pct': 0.002001110717050729, 'sideways_atr_max_pct': 0.09777164343567575, 'sideways_tp_mult': 2.7919562416816213, 'sideways_tsl_mult': 0.8974645737770022, 'sideways_time_stop': 220, 'sideways_use_sma': True, 'sideways_use_ema': False, 'sideways_use_atr': False, 'sideways_use_adx': True, 'sideways_use_spike': False, 'sideways_rsi_required': True}.
[I 2025-08-30 15:47:47,796] Trial 186 finished with values: [-1000000000.0, 1000000000.0] and parameters: {'p_sma': 15, 'p_std': 21, 'p_atr': 26, 'p_adx': 16, 'rsi_period': 37, 'ema1': 26, 'ema2': 33, 'slip_atr_k': 0.013138261479059027, 'slip_spread_k': 0.029917890655850585, 'spread_hl_frac': 0.046796013882011524, 'bb_std_mult': 2.7920921801914487, 'rsi_os': 38, 'rsi_ob': 59, 'vol_spike': 0.02848103345409085, 'adx_thresh': 22.13462527247183, 'atr_min_pct': 0.022358671430242782, 'atr_max_pct': 0.1497308104701251, 'tp_mult': 1.1197661771797975, 'tsl_mult': 0.4551045040698136, 'strategy': 'breakout', 'time_stop': 261, 'use_sma': False, 'use_atr': True, 'use_adx': False, 'use_ema': True, 'use_spike': True, 'rsi_required': False, 'edge_k': 0.2507308242199078, 'edge_cap': 0.5995471007848604, 'bull_strategy': 'breakout', 'bull_bb_std_mult': 1.673371649013879, 'bull_rsi_os': 20, 'bull_rsi_ob': 60, 'bull_adx_thresh': 32.08308731903964, 'bull_atr_min_pct': 0.0008918776419188862, 'bull_atr_max_pct': 0.054111393244744836, 'bull_tp_mult': 1.2096652755925938, 'bull_tsl_mult': 0.3901883982293691, 'bull_time_stop': 88, 'bull_use_sma': True, 'bull_use_ema': True, 'bull_use_atr': False, 'bull_use_adx': False, 'bull_use_spike': False, 'bull_rsi_required': True, 'bear_strategy': 'breakout', 'bear_bb_std_mult': 2.264534481987608, 'bear_rsi_os': 21, 'bear_rsi_ob': 83, 'bear_adx_thresh': 26.205244200305142, 'bear_atr_min_pct': 0.028748493338301682, 'bear_atr_max_pct': 0.09309451882179816, 'bear_tp_mult': 2.236297769789828, 'bear_tsl_mult': 0.5742551042550351, 'bear_time_stop': 274, 'bear_use_sma': False, 'bear_use_ema': False, 'bear_use_atr': False, 'bear_use_adx': False, 'bear_use_spike': True, 'bear_rsi_required': False, 'sideways_strategy': 'breakout', 'sideways_bb_std_mult': 3.0068454525411794, 'sideways_rsi_os': 33, 'sideways_rsi_ob': 89, 'sideways_adx_thresh': 28.991705236520836, 'sideways_atr_min_pct': 0.0024065467091639444, 'sideways_atr_max_pct': 0.09497358574902405, 'sideways_tp_mult': 1.9936863241132785, 'sideways_tsl_mult': 0.8936494974521307, 'sideways_time_stop': 220, 'sideways_use_sma': True, 'sideways_use_ema': False, 'sideways_use_atr': False, 'sideways_use_adx': True, 'sideways_use_spike': False, 'sideways_rsi_required': True}.
[I 2025-08-30 15:48:43,118] Trial 188 finished with values: [-1000000000.0, 1000000000.0] and parameters: {'p_sma': 15, 'p_std': 22, 'p_atr': 25, 'p_adx': 25, 'rsi_period': 39, 'ema1': 26, 'ema2': 33, 'slip_atr_k': 0.02068319402083125, 'slip_spread_k': 0.002205374160483424, 'spread_hl_frac': 0.012141512389473742, 'bb_std_mult': 2.7816657666508946, 'rsi_os': 37, 'rsi_ob': 66, 'vol_spike': 0.031954478275106744, 'adx_thresh': 19.162276258413236, 'atr_min_pct': 0.023196052216492007, 'atr_max_pct': 0.14031341657590807, 'tp_mult': 1.115497629111347, 'tsl_mult': 0.48903762361205655, 'strategy': 'breakout', 'time_stop': 63, 'use_sma': False, 'use_atr': True, 'use_adx': False, 'use_ema': False, 'use_spike': True, 'rsi_required': False, 'edge_k': 0.14414967851530397, 'edge_cap': 0.6113951333929805, 'bull_strategy': 'breakout', 'bull_bb_std_mult': 1.7352659158038755, 'bull_rsi_os': 24, 'bull_rsi_ob': 62, 'bull_adx_thresh': 32.18532184631043, 'bull_atr_min_pct': 0.0027909965386676725, 'bull_atr_max_pct': 0.04590919005125666, 'bull_tp_mult': 2.639549424168701, 'bull_tsl_mult': 0.3956062603349266, 'bull_time_stop': 73, 'bull_use_sma': True, 'bull_use_ema': True, 'bull_use_atr': False, 'bull_use_adx': False, 'bull_use_spike': False, 'bull_rsi_required': True, 'bear_strategy': 'mean_reversion', 'bear_bb_std_mult': 3.4490589849450393, 'bear_rsi_os': 20, 'bear_rsi_ob': 83, 'bear_adx_thresh': 14.205858017496766, 'bear_atr_min_pct': 0.029062758559973277, 'bear_atr_max_pct': 0.09785360349978453, 'bear_tp_mult': 2.2784796413168498, 'bear_tsl_mult': 0.5736948808744267, 'bear_time_stop': 271, 'bear_use_sma': False, 'bear_use_ema': False, 'bear_use_atr': False, 'bear_use_adx': False, 'bear_use_spike': True, 'bear_rsi_required': False, 'sideways_strategy': 'breakout', 'sideways_bb_std_mult': 3.4470131952686276, 'sideways_rsi_os': 30, 'sideways_rsi_ob': 89, 'sideways_adx_thresh': 11.667280507535619, 'sideways_atr_min_pct': 0.0040419188733994, 'sideways_atr_max_pct': 0.08456284965908546, 'sideways_tp_mult': 2.7835283369622177, 'sideways_tsl_mult': 0.8892180218839882, 'sideways_time_stop': 252, 'sideways_use_sma': True, 'sideways_use_ema': False, 'sideways_use_atr': True, 'sideways_use_adx': True, 'sideways_use_spike': True, 'sideways_rsi_required': True}.
[I 2025-08-30 15:48:43,126] Trial 189 finished with values: [-1000000000.0, 1000000000.0] and parameters: {'p_sma': 15, 'p_std': 21, 'p_atr': 25, 'p_adx': 18, 'rsi_period': 39, 'ema1': 26, 'ema2': 33, 'slip_atr_k': 0.006775824366512995, 'slip_spread_k': 0.015410180413833772, 'spread_hl_frac': 0.009908498634069838, 'bb_std_mult': 2.777226624463133, 'rsi_os': 37, 'rsi_ob': 66, 'vol_spike': 0.02972020882296346, 'adx_thresh': 20.049366873536872, 'atr_min_pct': 0.02343779603061817, 'atr_max_pct': 0.1416060218584161, 'tp_mult': 1.1100034983360938, 'tsl_mult': 0.4950624032563838, 'strategy': 'breakout', 'time_stop': 280, 'use_sma': False, 'use_atr': True, 'use_adx': False, 'use_ema': False, 'use_spike': True, 'rsi_required': False, 'edge_k': 1.5216908727340204, 'edge_cap': 0.6052072381349298, 'bull_strategy': 'breakout', 'bull_bb_std_mult': 1.7756146531231565, 'bull_rsi_os': 24, 'bull_rsi_ob': 67, 'bull_adx_thresh': 32.30892888952573, 'bull_atr_min_pct': 0.000934216544073876, 'bull_atr_max_pct': 0.045658515574301, 'bull_tp_mult': 1.2026737126731366, 'bull_tsl_mult': 0.40443609892032767, 'bull_time_stop': 102, 'bull_use_sma': True, 'bull_use_ema': True, 'bull_use_atr': False, 'bull_use_adx': False, 'bull_use_spike': False, 'bull_rsi_required': True, 'bear_strategy': 'mean_reversion', 'bear_bb_std_mult': 0.811884010711162, 'bear_rsi_os': 20, 'bear_rsi_ob': 82, 'bear_adx_thresh': 14.036263588932652, 'bear_atr_min_pct': 0.02899278683022937, 'bear_atr_max_pct': 0.09346280034777296, 'bear_tp_mult': 2.278645539370458, 'bear_tsl_mult': 0.48259940993489325, 'bear_time_stop': 272, 'bear_use_sma': False, 'bear_use_ema': False, 'bear_use_atr': False, 'bear_use_adx': False, 'bear_use_spike': True, 'bear_rsi_required': False, 'sideways_strategy': 'breakout', 'sideways_bb_std_mult': 3.429599841497721, 'sideways_rsi_os': 30, 'sideways_rsi_ob': 89, 'sideways_adx_thresh': 28.17517807537538, 'sideways_atr_min_pct': 0.027889674029055452, 'sideways_atr_max_pct': 0.08712650595627605, 'sideways_tp_mult': 2.784932367457355, 'sideways_tsl_mult': 0.8952945567367936, 'sideways_time_stop': 218, 'sideways_use_sma': True, 'sideways_use_ema': False, 'sideways_use_atr': True, 'sideways_use_adx': True, 'sideways_use_spike': True, 'sideways_rsi_required': True}.
