[I 2025-08-30 16:55:53,290] Trial 575 finished with values: [-1000000000.0, 1000000000.0] and parameters: {'p_sma': 7, 'p_std': 22, 'p_atr': 16, 'p_adx': 7, 'rsi_period': 26, 'ema1': 19, 'ema2': 11, 'slip_atr_k': 0.018316072901075856, 'slip_spread_k': 0.15028047503993064, 'spread_hl_frac': 0.020240001500333747, 'bb_std_mult': 3.303836630807428, 'rsi_os': 31, 'rsi_ob': 82, 'vol_spike': 0.0820502149869129, 'adx_thresh': 9.6252022731082, 'atr_min_pct': 0.02085918638458006, 'atr_max_pct': 0.14767989027804462, 'tp_mult': 2.7941195467535196, 'tsl_mult': 0.9053011482164248, 'strategy': 'breakout', 'time_stop': 42, 'use_sma': False, 'use_atr': True, 'use_adx': False, 'use_ema': False, 'use_spike': False, 'rsi_required': False, 'edge_k': 0.7243905622882032, 'edge_cap': 0.8863645789859035, 'bull_strategy': 'breakout', 'bull_bb_std_mult': 2.0341966360031276, 'bull_rsi_os': 52, 'bull_rsi_ob': 64, 'bull_adx_thresh': 34.39528120473428, 'bull_atr_min_pct': 0.02282484143099823, 'bull_atr_max_pct': 0.14850357609210196, 'bull_tp_mult': 2.1665839351885223, 'bull_tsl_mult': 0.8575657211621753, 'bull_time_stop': 241, 'bull_use_sma': True, 'bull_use_ema': False, 'bull_use_atr': False, 'bull_use_adx': False, 'bull_use_spike': False, 'bull_rsi_required': False, 'bear_strategy': 'mean_reversion', 'bear_bb_std_mult': 0.8909392640126537, 'bear_rsi_os': 17, 'bear_rsi_ob': 73, 'bear_adx_thresh': 10.767288539075535, 'bear_atr_min_pct': 0.016617085191530982, 'bear_atr_max_pct': 0.1079854892369369, 'bear_tp_mult': 2.1297987289290496, 'bear_tsl_mult': 0.5926035646372513, 'bear_time_stop': 198, 'bear_use_sma': False, 'bear_use_ema': False, 'bear_use_atr': False, 'bear_use_adx': False, 'bear_use_spike': True, 'bear_rsi_required': True, 'sideways_strategy': 'mean_reversion', 'sideways_bb_std_mult': 0.8158732756439773, 'sideways_rsi_os': 33, 'sideways_rsi_ob': 78, 'sideways_adx_thresh': 10.940214418565061, 'sideways_atr_min_pct': 0.003087321942246454, 'sideways_atr_max_pct': 0.10216959880750509, 'sideways_tp_mult': 2.9467918046958292, 'sideways_tsl_mult': 0.39347527426874357, 'sideways_time_stop': 282, 'sideways_use_sma': True, 'sideways_use_ema': False, 'sideways_use_atr': False, 'sideways_use_adx': True, 'sideways_use_spike': True, 'sideways_rsi_required': False}.
[I 2025-08-30 16:55:53,987] Trial 577 finished with values: [-1000000000.0, 1000000000.0] and parameters: {'p_sma': 6, 'p_std': 22, 'p_atr': 16, 'p_adx': 10, 'rsi_period': 12, 'ema1': 19, 'ema2': 12, 'slip_atr_k': 0.016583639137638446, 'slip_spread_k': 0.20875911782785012, 'spread_hl_frac': 0.020839290591107774, 'bb_std_mult': 3.3593847096722147, 'rsi_os': 32, 'rsi_ob': 83, 'vol_spike': 0.08348301116847116, 'adx_thresh': 8.36293984730057, 'atr_min_pct': 0.021122227864177813, 'atr_max_pct': 0.14933391846347882, 'tp_mult': 2.7855292032454932, 'tsl_mult': 0.8405324069897755, 'strategy': 'breakout', 'time_stop': 44, 'use_sma': False, 'use_atr': False, 'use_adx': False, 'use_ema': False, 'use_spike': False, 'rsi_required': False, 'edge_k': 0.7110636622972214, 'edge_cap': 0.8384786191408443, 'bull_strategy': 'breakout', 'bull_bb_std_mult': 2.093631764833736, 'bull_rsi_os': 12, 'bull_rsi_ob': 61, 'bull_adx_thresh': 34.318295734224016, 'bull_atr_min_pct': 0.023005822150874728, 'bull_atr_max_pct': 0.14611491604355364, 'bull_tp_mult': 2.1694133282444885, 'bull_tsl_mult': 0.866153100375989, 'bull_time_stop': 78, 'bull_use_sma': True, 'bull_use_ema': False, 'bull_use_atr': False, 'bull_use_adx': False, 'bull_use_spike': True, 'bull_rsi_required': False, 'bear_strategy': 'mean_reversion', 'bear_bb_std_mult': 1.4029828394478805, 'bear_rsi_os': 17, 'bear_rsi_ob': 74, 'bear_adx_thresh': 11.042941018566513, 'bear_atr_min_pct': 0.018242605447399748, 'bear_atr_max_pct': 0.10781990144629072, 'bear_tp_mult': 2.1041950487442946, 'bear_tsl_mult': 0.5994866506756391, 'bear_time_stop': 200, 'bear_use_sma': False, 'bear_use_ema': False, 'bear_use_atr': False, 'bear_use_adx': False, 'bear_use_spike': True, 'bear_rsi_required': True, 'sideways_strategy': 'mean_reversion', 'sideways_bb_std_mult': 0.6638202725022209, 'sideways_rsi_os': 33, 'sideways_rsi_ob': 94, 'sideways_adx_thresh': 10.690589599787968, 'sideways_atr_min_pct': 0.002984456887982237, 'sideways_atr_max_pct': 0.10116497999461839, 'sideways_tp_mult': 2.929749867178791, 'sideways_tsl_mult': 0.4166537614355091, 'sideways_time_stop': 274, 'sideways_use_sma': False, 'sideways_use_ema': False, 'sideways_use_atr': True, 'sideways_use_adx': True, 'sideways_use_spike': True, 'sideways_rsi_required': False}.
[I 2025-08-30 16:55:54,121] Trial 578 finished with values: [-1000000000.0, 1000000000.0] and parameters: {'p_sma': 6, 'p_std': 23, 'p_atr': 13, 'p_adx': 7, 'rsi_period': 28, 'ema1': 19, 'ema2': 12, 'slip_atr_k': 0.0323078902784371, 'slip_spread_k': 0.12516115372180858, 'spread_hl_frac': 0.02011841575330858, 'bb_std_mult': 3.294247849542545, 'rsi_os': 31, 'rsi_ob': 82, 'vol_spike': 0.08395343612552279, 'adx_thresh': 8.351234548389648, 'atr_min_pct': 0.020507523378322182, 'atr_max_pct': 0.14724136544791294, 'tp_mult': 2.7924322269026294, 'tsl_mult': 0.9001937535667849, 'strategy': 'breakout', 'time_stop': 37, 'use_sma': False, 'use_atr': False, 'use_adx': False, 'use_ema': False, 'use_spike': False, 'rsi_required': False, 'edge_k': 0.7394276069499575, 'edge_cap': 0.8048856570517384, 'bull_strategy': 'breakout', 'bull_bb_std_mult': 2.100880491626568, 'bull_rsi_os': 12, 'bull_rsi_ob': 61, 'bull_adx_thresh': 34.1530403076548, 'bull_atr_min_pct': 0.022793722478648776, 'bull_atr_max_pct': 0.14694340658452917, 'bull_tp_mult': 2.1803276386215633, 'bull_tsl_mult': 0.7049179781447577, 'bull_time_stop': 76, 'bull_use_sma': True, 'bull_use_ema': False, 'bull_use_atr': False, 'bull_use_adx': False, 'bull_use_spike': False, 'bull_rsi_required': True, 'bear_strategy': 'mean_reversion', 'bear_bb_std_mult': 1.283493124224204, 'bear_rsi_os': 17, 'bear_rsi_ob': 74, 'bear_adx_thresh': 10.893632430253835, 'bear_atr_min_pct': 0.016211613716326845, 'bear_atr_max_pct': 0.11103555918017172, 'bear_tp_mult': 2.106079026141001, 'bear_tsl_mult': 0.6080263332735784, 'bear_time_stop': 203, 'bear_use_sma': False, 'bear_use_ema': True, 'bear_use_atr': False, 'bear_use_adx': False, 'bear_use_spike': True, 'bear_rsi_required': True, 'sideways_strategy': 'mean_reversion', 'sideways_bb_std_mult': 1.482464702664136, 'sideways_rsi_os': 32, 'sideways_rsi_ob': 94, 'sideways_adx_thresh': 10.60736778629881, 'sideways_atr_min_pct': 0.002825019143960354, 'sideways_atr_max_pct': 0.0981087062809134, 'sideways_tp_mult': 2.9248814941779218, 'sideways_tsl_mult': 0.42594362509820716, 'sideways_time_stop': 275, 'sideways_use_sma': False, 'sideways_use_ema': False, 'sideways_use_atr': False, 'sideways_use_adx': True, 'sideways_use_spike': True, 'sideways_rsi_required': False}.
[I 2025-08-30 16:56:40,362] Trial 582 finished with values: [-0.008841791606430727, 0.008727295783346873] and parameters: {'p_sma': 8, 'p_std': 19, 'p_atr': 14, 'p_adx': 11, 'rsi_period': 26, 'ema1': 21, 'ema2': 10, 'slip_atr_k': 0.026882436979600372, 'slip_spread_k': 0.2413139752364342, 'spread_hl_frac': 0.02185527104686605, 'bb_std_mult': 3.2327675226450387, 'rsi_os': 32, 'rsi_ob': 85, 'vol_spike': 0.11137882188210069, 'adx_thresh': 6.972056068827019, 'atr_min_pct': 0.020282855110064214, 'atr_max_pct': 0.14793716038485621, 'tp_mult': 2.6989713012556282, 'tsl_mult': 0.7443244449469639, 'strategy': 'mean_reversion', 'time_stop': 37, 'use_sma': True, 'use_atr': True, 'use_adx': True, 'use_ema': True, 'use_spike': True, 'rsi_required': True, 'edge_k': 0.810385719582033, 'edge_cap': 0.8483223170619116, 'bull_strategy': 'mean_reversion', 'bull_bb_std_mult': 1.9592474907049042, 'bull_rsi_os': 43, 'bull_rsi_ob': 59, 'bull_adx_thresh': 34.92905881416133, 'bull_atr_min_pct': 0.022414525811057982, 'bull_atr_max_pct': 0.1450192917793277, 'bull_tp_mult': 2.231226198426458, 'bull_tsl_mult': 0.7695670521126894, 'bull_time_stop': 71, 'bull_use_sma': True, 'bull_use_ema': True, 'bull_use_atr': False, 'bull_use_adx': True, 'bull_use_spike': False, 'bull_rsi_required': True, 'bear_strategy': 'breakout', 'bear_bb_std_mult': 1.0934455938566499, 'bear_rsi_os': 16, 'bear_rsi_ob': 71, 'bear_adx_thresh': 11.604129424178275, 'bear_atr_min_pct': 0.017277349185751235, 'bear_atr_max_pct': 0.11090503510453477, 'bear_tp_mult': 2.1499899304600256, 'bear_tsl_mult': 0.616544792591884, 'bear_time_stop': 195, 'bear_use_sma': True, 'bear_use_ema': True, 'bear_use_atr': True, 'bear_use_adx': True, 'bear_use_spike': False, 'bear_rsi_required': False, 'sideways_strategy': 'breakout', 'sideways_bb_std_mult': 0.5466859911121216, 'sideways_rsi_os': 32, 'sideways_rsi_ob': 92, 'sideways_adx_thresh': 11.646605548671108, 'sideways_atr_min_pct': 0.0019293026640086746, 'sideways_atr_max_pct': 0.09590064563662497, 'sideways_tp_mult': 2.8792005403024175, 'sideways_tsl_mult': 0.37954507368601936, 'sideways_time_stop': 289, 'sideways_use_sma': True, 'sideways_use_ema': True, 'sideways_use_atr': False, 'sideways_use_adx': False, 'sideways_use_spike': False, 'sideways_rsi_required': True}.
[I 2025-08-30 16:56:40,378] Trial 580 finished with values: [-1000000000.0, 1000000000.0] and parameters: {'p_sma': 8, 'p_std': 23, 'p_atr': 14, 'p_adx': 9, 'rsi_period': 27, 'ema1': 20, 'ema2': 10, 'slip_atr_k': 0.03128367880046766, 'slip_spread_k': 0.218639533572635, 'spread_hl_frac': 0.019671097594658144, 'bb_std_mult': 3.242563033872939, 'rsi_os': 32, 'rsi_ob': 83, 'vol_spike': 0.10658223411222528, 'adx_thresh': 7.664780397944714, 'atr_min_pct': 0.02114980792404218, 'atr_max_pct': 0.14770562046228616, 'tp_mult': 2.6921881115511863, 'tsl_mult': 0.7514882338344882, 'strategy': 'mean_reversion', 'time_stop': 37, 'use_sma': False, 'use_atr': False, 'use_adx': True, 'use_ema': True, 'use_spike': True, 'rsi_required': True, 'edge_k': 0.3581995637130973, 'edge_cap': 0.8370283982897551, 'bull_strategy': 'mean_reversion', 'bull_bb_std_mult': 2.0791720005317913, 'bull_rsi_os': 12, 'bull_rsi_ob': 59, 'bull_adx_thresh': 34.195983642211445, 'bull_atr_min_pct': 0.02293226240279476, 'bull_atr_max_pct': 0.14476915162297463, 'bull_tp_mult': 2.209261058041928, 'bull_tsl_mult': 0.7079133678248051, 'bull_time_stop': 78, 'bull_use_sma': True, 'bull_use_ema': True, 'bull_use_atr': False, 'bull_use_adx': True, 'bull_use_spike': False, 'bull_rsi_required': True, 'bear_strategy': 'breakout', 'bear_bb_std_mult': 1.3124530933473713, 'bear_rsi_os': 16, 'bear_rsi_ob': 74, 'bear_adx_thresh': 11.508853763513802, 'bear_atr_min_pct': 0.018380207867776444, 'bear_atr_max_pct': 0.11151896288585378, 'bear_tp_mult': 2.112683133612729, 'bear_tsl_mult': 0.6179929432926886, 'bear_time_stop': 194, 'bear_use_sma': True, 'bear_use_ema': True, 'bear_use_atr': True, 'bear_use_adx': True, 'bear_use_spike': False, 'bear_rsi_required': False, 'sideways_strategy': 'breakout', 'sideways_bb_std_mult': 1.1515350939496374, 'sideways_rsi_os': 32, 'sideways_rsi_ob': 60, 'sideways_adx_thresh': 10.233452379835743, 'sideways_atr_min_pct': 0.002440887533757977, 'sideways_atr_max_pct': 0.09615605732204927, 'sideways_tp_mult': 2.88882582113513, 'sideways_tsl_mult': 0.42414532847649017, 'sideways_time_stop': 291, 'sideways_use_sma': False, 'sideways_use_ema': True, 'sideways_use_atr': False, 'sideways_use_adx': False, 'sideways_use_spike': False, 'sideways_rsi_required': True}.
[I 2025-08-30 16:56:41,059] Trial 581 finished with values: [-1000000000.0, 1000000000.0] and parameters: {'p_sma': 8, 'p_std': 23, 'p_atr': 14, 'p_adx': 9, 'rsi_period': 31, 'ema1': 16, 'ema2': 32, 'slip_atr_k': 0.025764212513726133, 'slip_spread_k': 0.240329952959477, 'spread_hl_frac': 0.019847984144356158, 'bb_std_mult': 3.2305632851561734, 'rsi_os': 31, 'rsi_ob': 81, 'vol_spike': 0.11440587658603357, 'adx_thresh': 7.570052315839365, 'atr_min_pct': 0.020100822795064695, 'atr_max_pct': 0.1475449578211092, 'tp_mult': 2.7554000981421116, 'tsl_mult': 0.8832362010883602, 'strategy': 'mean_reversion', 'time_stop': 35, 'use_sma': True, 'use_atr': False, 'use_adx': True, 'use_ema': True, 'use_spike': True, 'rsi_required': True, 'edge_k': 0.8131111887662716, 'edge_cap': 0.9338684530121715, 'bull_strategy': 'mean_reversion', 'bull_bb_std_mult': 2.093133797365426, 'bull_rsi_os': 41, 'bull_rsi_ob': 63, 'bull_adx_thresh': 34.93361661761152, 'bull_atr_min_pct': 0.02289173915582502, 'bull_atr_max_pct': 0.14352560108069, 'bull_tp_mult': 2.2182941143960258, 'bull_tsl_mult': 0.7121834548581857, 'bull_time_stop': 89, 'bull_use_sma': True, 'bull_use_ema': True, 'bull_use_atr': False, 'bull_use_adx': True, 'bull_use_spike': False, 'bull_rsi_required': True, 'bear_strategy': 'breakout', 'bear_bb_std_mult': 1.551680211919857, 'bear_rsi_os': 16, 'bear_rsi_ob': 75, 'bear_adx_thresh': 11.316350280343208, 'bear_atr_min_pct': 0.01914924306136493, 'bear_atr_max_pct': 0.11224190346292992, 'bear_tp_mult': 2.119266699138293, 'bear_tsl_mult': 0.6146261972896392, 'bear_time_stop': 204, 'bear_use_sma': True, 'bear_use_ema': True, 'bear_use_atr': True, 'bear_use_adx': True, 'bear_use_spike': False, 'bear_rsi_required': False, 'sideways_strategy': 'breakout', 'sideways_bb_std_mult': 0.5822782764659244, 'sideways_rsi_os': 32, 'sideways_rsi_ob': 92, 'sideways_adx_thresh': 10.166371591612666, 'sideways_atr_min_pct': 0.0025396797197117524, 'sideways_atr_max_pct': 0.09636164644003703, 'sideways_tp_mult': 2.885688046901179, 'sideways_tsl_mult': 0.42902873433318073, 'sideways_time_stop': 272, 'sideways_use_sma': True, 'sideways_use_ema': True, 'sideways_use_atr': False, 'sideways_use_adx': False, 'sideways_use_spike': False, 'sideways_rsi_required': True}.
[I 2025-08-30 16:56:41,533] Trial 579 finished with values: [-1000000000.0, 1000000000.0] and parameters: {'p_sma': 8, 'p_std': 22, 'p_atr': 14, 'p_adx': 7, 'rsi_period': 28, 'ema1': 19, 'ema2': 39, 'slip_atr_k': 0.015925520642727297, 'slip_spread_k': 0.23408574989631614, 'spread_hl_frac': 0.019734683391366893, 'bb_std_mult': 3.3198569118705445, 'rsi_os': 32, 'rsi_ob': 82, 'vol_spike': 0.11058176891891515, 'adx_thresh': 7.774966761166176, 'atr_min_pct': 0.021175164070476694, 'atr_max_pct': 0.14751002598485308, 'tp_mult': 2.79179886682181, 'tsl_mult': 0.8850805285938435, 'strategy': 'breakout', 'time_stop': 37, 'use_sma': False, 'use_atr': False, 'use_adx': False, 'use_ema': True, 'use_spike': False, 'rsi_required': False, 'edge_k': 0.6341598151130473, 'edge_cap': 0.8404539849248444, 'bull_strategy': 'mean_reversion', 'bull_bb_std_mult': 1.9719522102655596, 'bull_rsi_os': 12, 'bull_rsi_ob': 61, 'bull_adx_thresh': 34.1630070030676, 'bull_atr_min_pct': 0.022740544019698463, 'bull_atr_max_pct': 0.1450292710947869, 'bull_tp_mult': 2.1867545397309605, 'bull_tsl_mult': 0.7107408621984531, 'bull_time_stop': 94, 'bull_use_sma': True, 'bull_use_ema': True, 'bull_use_atr': False, 'bull_use_adx': False, 'bull_use_spike': False, 'bull_rsi_required': True, 'bear_strategy': 'breakout', 'bear_bb_std_mult': 1.2884186122931223, 'bear_rsi_os': 16, 'bear_rsi_ob': 74, 'bear_adx_thresh': 11.519897055107256, 'bear_atr_min_pct': 0.01816620131794224, 'bear_atr_max_pct': 0.11310118316497118, 'bear_tp_mult': 2.1190019435961838, 'bear_tsl_mult': 0.588910602482827, 'bear_time_stop': 203, 'bear_use_sma': True, 'bear_use_ema': True, 'bear_use_atr': True, 'bear_use_adx': True, 'bear_use_spike': True, 'bear_rsi_required': True, 'sideways_strategy': 'mean_reversion', 'sideways_bb_std_mult': 0.8154587189776361, 'sideways_rsi_os': 32, 'sideways_rsi_ob': 65, 'sideways_adx_thresh': 10.676299618443226, 'sideways_atr_min_pct': 0.0023522846726808954, 'sideways_atr_max_pct': 0.09771178499162457, 'sideways_tp_mult': 2.8975822969665335, 'sideways_tsl_mult': 0.4271904236595687, 'sideways_time_stop': 274, 'sideways_use_sma': True, 'sideways_use_ema': True, 'sideways_use_atr': False, 'sideways_use_adx': False, 'sideways_use_spike': True, 'sideways_rsi_required': True}.
[I 2025-08-30 16:57:28,182] Trial 585 finished with values: [-0.019736861583827925, 0.019627302892426993] and parameters: {'p_sma': 35, 'p_std': 19, 'p_atr': 15, 'p_adx': 7, 'rsi_period': 25, 'ema1': 18, 'ema2': 29, 'slip_atr_k': 0.01611132442807101, 'slip_spread_k': 0.176490383110815, 'spread_hl_frac': 0.019539940661307178, 'bb_std_mult': 3.24492416574991, 'rsi_os': 32, 'rsi_ob': 86, 'vol_spike': 0.09671809988760743, 'adx_thresh': 9.07769938803811, 'atr_min_pct': 0.019694493908876086, 'atr_max_pct': 0.14994972555530375, 'tp_mult': 2.7527678508608022, 'tsl_mult': 0.9916473315234149, 'strategy': 'mean_reversion', 'time_stop': 33, 'use_sma': True, 'use_atr': True, 'use_adx': True, 'use_ema': False, 'use_spike': False, 'rsi_required': True, 'edge_k': 0.6163523327885119, 'edge_cap': 0.7783667561254282, 'bull_strategy': 'mean_reversion', 'bull_bb_std_mult': 1.984251402381624, 'bull_rsi_os': 16, 'bull_rsi_ob': 57, 'bull_adx_thresh': 34.92220853926828, 'bull_atr_min_pct': 0.022320302194846594, 'bull_atr_max_pct': 0.14446683751944908, 'bull_tp_mult': 2.324823123819185, 'bull_tsl_mult': 0.8053886673657286, 'bull_time_stop': 97, 'bull_use_sma': True, 'bull_use_ema': True, 'bull_use_atr': False, 'bull_use_adx': True, 'bull_use_spike': True, 'bull_rsi_required': False, 'bear_strategy': 'mean_reversion', 'bear_bb_std_mult': 1.071109659954558, 'bear_rsi_os': 16, 'bear_rsi_ob': 72, 'bear_adx_thresh': 11.689508787387066, 'bear_atr_min_pct': 0.017372184250720096, 'bear_atr_max_pct': 0.10511747743537593, 'bear_tp_mult': 2.1414992797233783, 'bear_tsl_mult': 0.5777711468608967, 'bear_time_stop': 206, 'bear_use_sma': True, 'bear_use_ema': False, 'bear_use_atr': False, 'bear_use_adx': False, 'bear_use_spike': False, 'bear_rsi_required': False, 'sideways_strategy': 'breakout', 'sideways_bb_std_mult': 0.8775868857755973, 'sideways_rsi_os': 31, 'sideways_rsi_ob': 93, 'sideways_adx_thresh': 11.412893147612378, 'sideways_atr_min_pct': 0.0022227107887738684, 'sideways_atr_max_pct': 0.09923898670564936, 'sideways_tp_mult': 2.9888600089233575, 'sideways_tsl_mult': 0.42984000866113753, 'sideways_time_stop': 286, 'sideways_use_sma': True, 'sideways_use_ema': False, 'sideways_use_atr': True, 'sideways_use_adx': False, 'sideways_use_spike': False, 'sideways_rsi_required': True}.
[I 2025-08-30 16:57:28,181] Trial 586 finished with values: [-1000000000.0, 1000000000.0] and parameters: {'p_sma': 6, 'p_std': 20, 'p_atr': 15, 'p_adx': 8, 'rsi_period': 25, 'ema1': 18, 'ema2': 10, 'slip_atr_k': 0.014634671143687883, 'slip_spread_k': 0.1778861890467049, 'spread_hl_frac': 0.018727634052564977, 'bb_std_mult': 3.217222783895323, 'rsi_os': 32, 'rsi_ob': 86, 'vol_spike': 0.11975507678752548, 'adx_thresh': 10.09598208707056, 'atr_min_pct': 0.02000580534121695, 'atr_max_pct': 0.14999733310696642, 'tp_mult': 2.8135053293999577, 'tsl_mult': 0.9913029650750679, 'strategy': 'mean_reversion', 'time_stop': 32, 'use_sma': True, 'use_atr': True, 'use_adx': True, 'use_ema': False, 'use_spike': False, 'rsi_required': True, 'edge_k': 0.664801906839979, 'edge_cap': 0.7826583557050558, 'bull_strategy': 'mean_reversion', 'bull_bb_std_mult': 1.9565039203775938, 'bull_rsi_os': 5, 'bull_rsi_ob': 56, 'bull_adx_thresh': 34.983486685747664, 'bull_atr_min_pct': 0.023784651185211444, 'bull_atr_max_pct': 0.14982424567895128, 'bull_tp_mult': 2.3060560536710106, 'bull_tsl_mult': 0.8154172069374603, 'bull_time_stop': 209, 'bull_use_sma': True, 'bull_use_ema': True, 'bull_use_atr': False, 'bull_use_adx': True, 'bull_use_spike': True, 'bull_rsi_required': False, 'bear_strategy': 'mean_reversion', 'bear_bb_std_mult': 1.094206431886438, 'bear_rsi_os': 18, 'bear_rsi_ob': 72, 'bear_adx_thresh': 11.832694895018115, 'bear_atr_min_pct': 0.017756194927086206, 'bear_atr_max_pct': 0.10470090403679318, 'bear_tp_mult': 2.1578900656482904, 'bear_tsl_mult': 0.6265005307828592, 'bear_time_stop': 194, 'bear_use_sma': True, 'bear_use_ema': False, 'bear_use_atr': False, 'bear_use_adx': False, 'bear_use_spike': False, 'bear_rsi_required': False, 'sideways_strategy': 'breakout', 'sideways_bb_std_mult': 0.9114983752331165, 'sideways_rsi_os': 31, 'sideways_rsi_ob': 92, 'sideways_adx_thresh': 12.150367432265423, 'sideways_atr_min_pct': 0.018384386847365458, 'sideways_atr_max_pct': 0.09310255551903136, 'sideways_tp_mult': 2.9955267988727234, 'sideways_tsl_mult': 0.4251429527827473, 'sideways_time_stop': 286, 'sideways_use_sma': True, 'sideways_use_ema': False, 'sideways_use_atr': True, 'sideways_use_adx': False, 'sideways_use_spike': False, 'sideways_rsi_required': True}.
