[I 2025-08-30 16:51:13,783] Trial 549 finished with values: [-1000000000.0, 1000000000.0] and parameters: {'p_sma': 31, 'p_std': 8, 'p_atr': 11, 'p_adx': 25, 'rsi_period': 14, 'ema1': 26, 'ema2': 12, 'slip_atr_k': 7.545918666793019e-05, 'slip_spread_k': 0.2139710530271946, 'spread_hl_frac': 0.01919020014412817, 'bb_std_mult': 2.5209942345629863, 'rsi_os': 35, 'rsi_ob': 80, 'vol_spike': 0.010810192584290593, 'adx_thresh': 12.241502796984141, 'atr_min_pct': 0.025782418342125628, 'atr_max_pct': 0.13604379155411983, 'tp_mult': 2.5790300140294673, 'tsl_mult': 0.46137694273030994, 'strategy': 'mean_reversion', 'time_stop': 11, 'use_sma': False, 'use_atr': True, 'use_adx': True, 'use_ema': False, 'use_spike': False, 'rsi_required': True, 'edge_k': 1.5624598178946079, 'edge_cap': 0.6291639113741495, 'bull_strategy': 'mean_reversion', 'bull_bb_std_mult': 1.7246796213992364, 'bull_rsi_os': 12, 'bull_rsi_ob': 51, 'bull_adx_thresh': 21.65126629364929, 'bull_atr_min_pct': 0.004365777706560695, 'bull_atr_max_pct': 0.12543031779779776, 'bull_tp_mult': 2.9565104176500423, 'bull_tsl_mult': 0.28728717407259796, 'bull_time_stop': 274, 'bull_use_sma': False, 'bull_use_ema': True, 'bull_use_atr': True, 'bull_use_adx': True, 'bull_use_spike': False, 'bull_rsi_required': True, 'bear_strategy': 'mean_reversion', 'bear_bb_std_mult': 2.117423466813814, 'bear_rsi_os': 39, 'bear_rsi_ob': 63, 'bear_adx_thresh': 31.931456645250996, 'bear_atr_min_pct': 0.023607680056042617, 'bear_atr_max_pct': 0.09527706831271676, 'bear_tp_mult': 2.2150994971142337, 'bear_tsl_mult': 0.654345976555217, 'bear_time_stop': 232, 'bear_use_sma': True, 'bear_use_ema': False, 'bear_use_atr': False, 'bear_use_adx': False, 'bear_use_spike': False, 'bear_rsi_required': False, 'sideways_strategy': 'breakout', 'sideways_bb_std_mult': 2.1625994293062876, 'sideways_rsi_os': 29, 'sideways_rsi_ob': 91, 'sideways_adx_thresh': 9.964456708120736, 'sideways_atr_min_pct': 0.021865711852601784, 'sideways_atr_max_pct': 0.14069260317933258, 'sideways_tp_mult': 1.488863584547751, 'sideways_tsl_mult': 0.10124478819738825, 'sideways_time_stop': 215, 'sideways_use_sma': True, 'sideways_use_ema': False, 'sideways_use_atr': False, 'sideways_use_adx': False, 'sideways_use_spike': False, 'sideways_rsi_required': True}.
[I 2025-08-30 16:51:15,035] Trial 553 finished with values: [-1000000000.0, 1000000000.0] and parameters: {'p_sma': 6, 'p_std': 45, 'p_atr': 20, 'p_adx': 19, 'rsi_period': 23, 'ema1': 20, 'ema2': 50, 'slip_atr_k': 0.047378964524448244, 'slip_spread_k': 0.5208563898815842, 'spread_hl_frac': 0.017673705463387496, 'bb_std_mult': 1.3594593618015591, 'rsi_os': 37, 'rsi_ob': 49, 'vol_spike': 9.885793020534891e-05, 'adx_thresh': 17.802279239947012, 'atr_min_pct': 0.011079842249513548, 'atr_max_pct': 0.1444227889617018, 'tp_mult': 1.840511157943579, 'tsl_mult': 0.7177423171836012, 'strategy': 'mean_reversion', 'time_stop': 69, 'use_sma': True, 'use_atr': False, 'use_adx': True, 'use_ema': True, 'use_spike': False, 'rsi_required': False, 'edge_k': 1.8082955228488773, 'edge_cap': 0.3969256957146247, 'bull_strategy': 'mean_reversion', 'bull_bb_std_mult': 2.0260635284108672, 'bull_rsi_os': 42, 'bull_rsi_ob': 46, 'bull_adx_thresh': 12.19906936383973, 'bull_atr_min_pct': 0.02144629347013906, 'bull_atr_max_pct': 0.01285013573407938, 'bull_tp_mult': 1.0631877523263502, 'bull_tsl_mult': 0.32651513709310576, 'bull_time_stop': 46, 'bull_use_sma': True, 'bull_use_ema': True, 'bull_use_atr': False, 'bull_use_adx': True, 'bull_use_spike': False, 'bull_rsi_required': False, 'bear_strategy': 'breakout', 'bear_bb_std_mult': 1.3453137813099305, 'bear_rsi_os': 27, 'bear_rsi_ob': 77, 'bear_adx_thresh': 19.08312560327304, 'bear_atr_min_pct': 0.021423040332064734, 'bear_atr_max_pct': 0.13946554550689252, 'bear_tp_mult': 1.0135912198878645, 'bear_tsl_mult': 0.5037194781763747, 'bear_time_stop': 133, 'bear_use_sma': True, 'bear_use_ema': True, 'bear_use_atr': True, 'bear_use_adx': True, 'bear_use_spike': True, 'bear_rsi_required': True, 'sideways_strategy': 'mean_reversion', 'sideways_bb_std_mult': 2.556857696423168, 'sideways_rsi_os': 7, 'sideways_rsi_ob': 81, 'sideways_adx_thresh': 16.190047341361932, 'sideways_atr_min_pct': 0.023938656876291133, 'sideways_atr_max_pct': 0.14511517799276105, 'sideways_tp_mult': 1.2282394210624916, 'sideways_tsl_mult': 0.17010148535708186, 'sideways_time_stop': 269, 'sideways_use_sma': True, 'sideways_use_ema': True, 'sideways_use_atr': False, 'sideways_use_adx': False, 'sideways_use_spike': True, 'sideways_rsi_required': True}.
[I 2025-08-30 16:51:15,096] Trial 552 finished with values: [-1000000000.0, 1000000000.0] and parameters: {'p_sma': 10, 'p_std': 7, 'p_atr': 20, 'p_adx': 29, 'rsi_period': 77, 'ema1': 26, 'ema2': 12, 'slip_atr_k': 0.14620175071473576, 'slip_spread_k': 0.35183124919504616, 'spread_hl_frac': 0.004955871950262397, 'bb_std_mult': 2.773348404444315, 'rsi_os': 13, 'rsi_ob': 49, 'vol_spike': 4.56475712557222e-05, 'adx_thresh': 13.466242782207235, 'atr_min_pct': 0.01764834287436838, 'atr_max_pct': 0.08474958578834796, 'tp_mult': 2.660653996588257, 'tsl_mult': 0.7127770763739308, 'strategy': 'mean_reversion', 'time_stop': 278, 'use_sma': True, 'use_atr': True, 'use_adx': True, 'use_ema': True, 'use_spike': False, 'rsi_required': True, 'edge_k': 1.5645251065104562, 'edge_cap': 0.5864434723975515, 'bull_strategy': 'mean_reversion', 'bull_bb_std_mult': 1.7726913715536476, 'bull_rsi_os': 33, 'bull_rsi_ob': 48, 'bull_adx_thresh': 20.326603745356152, 'bull_atr_min_pct': 0.02133717683032709, 'bull_atr_max_pct': 0.062443693248215054, 'bull_tp_mult': 1.603131593191575, 'bull_tsl_mult': 0.32408738433529105, 'bull_time_stop': 45, 'bull_use_sma': True, 'bull_use_ema': True, 'bull_use_atr': False, 'bull_use_adx': True, 'bull_use_spike': False, 'bull_rsi_required': True, 'bear_strategy': 'breakout', 'bear_bb_std_mult': 2.3901109014844732, 'bear_rsi_os': 54, 'bear_rsi_ob': 48, 'bear_adx_thresh': 13.883033821550644, 'bear_atr_min_pct': 0.02138138070052182, 'bear_atr_max_pct': 0.09572951003537775, 'bear_tp_mult': 1.3857327148501226, 'bear_tsl_mult': 0.6149178070686483, 'bear_time_stop': 238, 'bear_use_sma': True, 'bear_use_ema': True, 'bear_use_atr': True, 'bear_use_adx': True, 'bear_use_spike': False, 'bear_rsi_required': False, 'sideways_strategy': 'breakout', 'sideways_bb_std_mult': 2.0111428510154337, 'sideways_rsi_os': 7, 'sideways_rsi_ob': 81, 'sideways_adx_thresh': 16.319452652913093, 'sideways_atr_min_pct': 0.00734194367941873, 'sideways_atr_max_pct': 0.14104460135417432, 'sideways_tp_mult': 1.4806527801301512, 'sideways_tsl_mult': 0.18257282700593913, 'sideways_time_stop': 204, 'sideways_use_sma': True, 'sideways_use_ema': True, 'sideways_use_atr': False, 'sideways_use_adx': False, 'sideways_use_spike': False, 'sideways_rsi_required': True}.
[I 2025-08-30 16:51:15,180] Trial 551 finished with values: [-1000000000.0, 1000000000.0] and parameters: {'p_sma': 44, 'p_std': 30, 'p_atr': 26, 'p_adx': 23, 'rsi_period': 23, 'ema1': 14, 'ema2': 47, 'slip_atr_k': 0.22550734885451557, 'slip_spread_k': 0.5204760936349297, 'spread_hl_frac': 0.019219598015244976, 'bb_std_mult': 3.1184976343698834, 'rsi_os': 12, 'rsi_ob': 49, 'vol_spike': 0.18251692665671868, 'adx_thresh': 13.360844843122345, 'atr_min_pct': 0.01748512776769052, 'atr_max_pct': 0.1359712171998734, 'tp_mult': 2.676875455481586, 'tsl_mult': 0.5201526131354597, 'strategy': 'mean_reversion', 'time_stop': 12, 'use_sma': False, 'use_atr': True, 'use_adx': True, 'use_ema': False, 'use_spike': False, 'rsi_required': True, 'edge_k': 1.5768674627869508, 'edge_cap': 0.5897212419774253, 'bull_strategy': 'mean_reversion', 'bull_bb_std_mult': 2.021489893578364, 'bull_rsi_os': 22, 'bull_rsi_ob': 46, 'bull_adx_thresh': 21.401368446105806, 'bull_atr_min_pct': 0.01770546195702467, 'bull_atr_max_pct': 0.14312542463641217, 'bull_tp_mult': 1.7678270669572973, 'bull_tsl_mult': 0.2780232681249347, 'bull_time_stop': 276, 'bull_use_sma': True, 'bull_use_ema': True, 'bull_use_atr': False, 'bull_use_adx': True, 'bull_use_spike': False, 'bull_rsi_required': False, 'bear_strategy': 'mean_reversion', 'bear_bb_std_mult': 1.7528965074449057, 'bear_rsi_os': 25, 'bear_rsi_ob': 77, 'bear_adx_thresh': 31.85473891501954, 'bear_atr_min_pct': 0.021397276652657126, 'bear_atr_max_pct': 0.0950468151000831, 'bear_tp_mult': 2.1988051884556734, 'bear_tsl_mult': 0.1573377153839276, 'bear_time_stop': 239, 'bear_use_sma': True, 'bear_use_ema': False, 'bear_use_atr': False, 'bear_use_adx': False, 'bear_use_spike': False, 'bear_rsi_required': False, 'sideways_strategy': 'breakout', 'sideways_bb_std_mult': 2.013389323664013, 'sideways_rsi_os': 43, 'sideways_rsi_ob': 93, 'sideways_adx_thresh': 28.029943468742168, 'sideways_atr_min_pct': 0.001245388982667643, 'sideways_atr_max_pct': 0.142585111330789, 'sideways_tp_mult': 2.7686330364606024, 'sideways_tsl_mult': 0.42614807421062256, 'sideways_time_stop': 205, 'sideways_use_sma': True, 'sideways_use_ema': False, 'sideways_use_atr': False, 'sideways_use_adx': False, 'sideways_use_spike': False, 'sideways_rsi_required': True}.
[I 2025-08-30 16:51:59,974] Trial 550 finished with values: [-1000000000.0, 1000000000.0] and parameters: {'p_sma': 6, 'p_std': 56, 'p_atr': 25, 'p_adx': 27, 'rsi_period': 20, 'ema1': 26, 'ema2': 12, 'slip_atr_k': 0.23820088944262335, 'slip_spread_k': 0.3521008957254822, 'spread_hl_frac': 0.01935750269232641, 'bb_std_mult': 1.3550963309000084, 'rsi_os': 5, 'rsi_ob': 79, 'vol_spike': 0.005262456737941496, 'adx_thresh': 13.126264144241288, 'atr_min_pct': 0.01750340824473275, 'atr_max_pct': 0.1361963926665621, 'tp_mult': 1.739304265378186, 'tsl_mult': 0.4433448546885955, 'strategy': 'mean_reversion', 'time_stop': 278, 'use_sma': False, 'use_atr': True, 'use_adx': True, 'use_ema': False, 'use_spike': False, 'rsi_required': True, 'edge_k': 1.8244316549855735, 'edge_cap': 0.6641974409746032, 'bull_strategy': 'mean_reversion', 'bull_bb_std_mult': 2.13146709601681, 'bull_rsi_os': 28, 'bull_rsi_ob': 87, 'bull_adx_thresh': 33.599616512884715, 'bull_atr_min_pct': 0.021432783416834314, 'bull_atr_max_pct': 0.13289787433198522, 'bull_tp_mult': 1.5676982429477069, 'bull_tsl_mult': 0.3306556907202053, 'bull_time_stop': 144, 'bull_use_sma': False, 'bull_use_ema': True, 'bull_use_atr': True, 'bull_use_adx': True, 'bull_use_spike': False, 'bull_rsi_required': False, 'bear_strategy': 'mean_reversion', 'bear_bb_std_mult': 3.5199024933737064, 'bear_rsi_os': 13, 'bear_rsi_ob': 77, 'bear_adx_thresh': 13.360378820500369, 'bear_atr_min_pct': 0.021431694055347585, 'bear_atr_max_pct': 0.13918616311605386, 'bear_tp_mult': 2.1385838484326203, 'bear_tsl_mult': 0.15240417771961462, 'bear_time_stop': 227, 'bear_use_sma': True, 'bear_use_ema': False, 'bear_use_atr': False, 'bear_use_adx': False, 'bear_use_spike': False, 'bear_rsi_required': False, 'sideways_strategy': 'breakout', 'sideways_bb_std_mult': 2.024243338191131, 'sideways_rsi_os': 29, 'sideways_rsi_ob': 81, 'sideways_adx_thresh': 16.99668220299489, 'sideways_atr_min_pct': 0.02206136043120046, 'sideways_atr_max_pct': 0.1411870086252895, 'sideways_tp_mult': 1.463662318853274, 'sideways_tsl_mult': 0.21052133717390298, 'sideways_time_stop': 96, 'sideways_use_sma': True, 'sideways_use_ema': False, 'sideways_use_atr': False, 'sideways_use_adx': False, 'sideways_use_spike': False, 'sideways_rsi_required': True}.
[I 2025-08-30 16:52:04,011] Trial 554 finished with values: [-0.12576817073330326, 0.12570275407363574] and parameters: {'p_sma': 40, 'p_std': 58, 'p_atr': 25, 'p_adx': 22, 'rsi_period': 20, 'ema1': 26, 'ema2': 11, 'slip_atr_k': 0.24273315540799473, 'slip_spread_k': 0.35036635357563195, 'spread_hl_frac': 0.042340728514369826, 'bb_std_mult': 2.77920283277029, 'rsi_os': 36, 'rsi_ob': 91, 'vol_spike': 0.007178723230607511, 'adx_thresh': 13.425923413136385, 'atr_min_pct': 0.017451332933460045, 'atr_max_pct': 0.13668560650382522, 'tp_mult': 1.7410312162262365, 'tsl_mult': 0.5262292823589432, 'strategy': 'mean_reversion', 'time_stop': 145, 'use_sma': False, 'use_atr': True, 'use_adx': True, 'use_ema': False, 'use_spike': False, 'rsi_required': True, 'edge_k': 1.4398725522563598, 'edge_cap': 0.5876620015518342, 'bull_strategy': 'mean_reversion', 'bull_bb_std_mult': 3.1149062457580934, 'bull_rsi_os': 28, 'bull_rsi_ob': 48, 'bull_adx_thresh': 33.742607711385226, 'bull_atr_min_pct': 0.019202414291788008, 'bull_atr_max_pct': 0.13332671289712322, 'bull_tp_mult': 1.5618126569085045, 'bull_tsl_mult': 0.14012582663673695, 'bull_time_stop': 144, 'bull_use_sma': True, 'bull_use_ema': True, 'bull_use_atr': False, 'bull_use_adx': True, 'bull_use_spike': True, 'bull_rsi_required': False, 'bear_strategy': 'mean_reversion', 'bear_bb_std_mult': 1.7594917793757858, 'bear_rsi_os': 49, 'bear_rsi_ob': 46, 'bear_adx_thresh': 13.874622941242404, 'bear_atr_min_pct': 0.003879315526193401, 'bear_atr_max_pct': 0.11465593899393682, 'bear_tp_mult': 2.1443953775135633, 'bear_tsl_mult': 0.6088862190515608, 'bear_time_stop': 222, 'bear_use_sma': True, 'bear_use_ema': False, 'bear_use_atr': False, 'bear_use_adx': False, 'bear_use_spike': False, 'bear_rsi_required': False, 'sideways_strategy': 'breakout', 'sideways_bb_std_mult': 2.0171282253837353, 'sideways_rsi_os': 42, 'sideways_rsi_ob': 93, 'sideways_adx_thresh': 28.02914597940576, 'sideways_atr_min_pct': 0.0010191745119866316, 'sideways_atr_max_pct': 0.14283198161083852, 'sideways_tp_mult': 1.662356582718329, 'sideways_tsl_mult': 0.4288024473513263, 'sideways_time_stop': 205, 'sideways_use_sma': True, 'sideways_use_ema': False, 'sideways_use_atr': True, 'sideways_use_adx': False, 'sideways_use_spike': False, 'sideways_rsi_required': True}.
[I 2025-08-30 16:52:04,411] Trial 555 finished with values: [-1000000000.0, 1000000000.0] and parameters: {'p_sma': 44, 'p_std': 58, 'p_atr': 25, 'p_adx': 22, 'rsi_period': 42, 'ema1': 22, 'ema2': 11, 'slip_atr_k': 0.15380072914960913, 'slip_spread_k': 0.630427314408277, 'spread_hl_frac': 0.0202696005381814, 'bb_std_mult': 3.1130300931348174, 'rsi_os': 34, 'rsi_ob': 93, 'vol_spike': 0.18113844065398693, 'adx_thresh': 13.390001249257992, 'atr_min_pct': 0.0008390128385773396, 'atr_max_pct': 0.1423588439966688, 'tp_mult': 1.734973292088353, 'tsl_mult': 0.8630886091992596, 'strategy': 'mean_reversion', 'time_stop': 146, 'use_sma': False, 'use_atr': True, 'use_adx': True, 'use_ema': False, 'use_spike': False, 'rsi_required': True, 'edge_k': 0.002209143771200406, 'edge_cap': 0.12548664912271335, 'bull_strategy': 'breakout', 'bull_bb_std_mult': 3.1096454966960945, 'bull_rsi_os': 10, 'bull_rsi_ob': 93, 'bull_adx_thresh': 33.8525358716948, 'bull_atr_min_pct': 0.019576794402168213, 'bull_atr_max_pct': 0.13315014213030643, 'bull_tp_mult': 2.6806364045414117, 'bull_tsl_mult': 0.27389668484969143, 'bull_time_stop': 63, 'bull_use_sma': False, 'bull_use_ema': False, 'bull_use_atr': True, 'bull_use_adx': True, 'bull_use_spike': True, 'bull_rsi_required': False, 'bear_strategy': 'mean_reversion', 'bear_bb_std_mult': 0.7232295491562091, 'bear_rsi_os': 13, 'bear_rsi_ob': 70, 'bear_adx_thresh': 24.06959681065662, 'bear_atr_min_pct': 0.004089283347180334, 'bear_atr_max_pct': 0.09391226584544476, 'bear_tp_mult': 2.1928109505669537, 'bear_tsl_mult': 0.15406155684130873, 'bear_time_stop': 221, 'bear_use_sma': False, 'bear_use_ema': False, 'bear_use_atr': False, 'bear_use_adx': False, 'bear_use_spike': False, 'bear_rsi_required': False, 'sideways_strategy': 'breakout', 'sideways_bb_std_mult': 1.9042787689888612, 'sideways_rsi_os': 26, 'sideways_rsi_ob': 93, 'sideways_adx_thresh': 13.0795601792855, 'sideways_atr_min_pct': 0.0008512106519431721, 'sideways_atr_max_pct': 0.14338618061901104, 'sideways_tp_mult': 1.66962983260975, 'sideways_tsl_mult': 0.4722384941992008, 'sideways_time_stop': 207, 'sideways_use_sma': False, 'sideways_use_ema': False, 'sideways_use_atr': True, 'sideways_use_adx': True, 'sideways_use_spike': False, 'sideways_rsi_required': False}.
[I 2025-08-30 16:52:04,707] Trial 556 finished with values: [-1000000000.0, 1000000000.0] and parameters: {'p_sma': 5, 'p_std': 59, 'p_atr': 25, 'p_adx': 26, 'rsi_period': 20, 'ema1': 10, 'ema2': 52, 'slip_atr_k': 0.19902543572998013, 'slip_spread_k': 0.6310530297039639, 'spread_hl_frac': 0.016752419954263246, 'bb_std_mult': 2.9815965558234896, 'rsi_os': 34, 'rsi_ob': 94, 'vol_spike': 0.2581997238298375, 'adx_thresh': 11.955150576133605, 'atr_min_pct': 0.01843286674424925, 'atr_max_pct': 0.062454237874470894, 'tp_mult': 2.918026156461963, 'tsl_mult': 0.4855133883842279, 'strategy': 'breakout', 'time_stop': 290, 'use_sma': False, 'use_atr': False, 'use_adx': True, 'use_ema': False, 'use_spike': False, 'rsi_required': False, 'edge_k': 1.7330532347042853, 'edge_cap': 0.49186282743423165, 'bull_strategy': 'breakout', 'bull_bb_std_mult': 1.8148879015852613, 'bull_rsi_os': 10, 'bull_rsi_ob': 87, 'bull_adx_thresh': 25.071967359342228, 'bull_atr_min_pct': 0.019458899665366007, 'bull_atr_max_pct': 0.13430834893938548, 'bull_tp_mult': 1.377768316227339, 'bull_tsl_mult': 0.2581945707209764, 'bull_time_stop': 222, 'bull_use_sma': False, 'bull_use_ema': False, 'bull_use_atr': True, 'bull_use_adx': True, 'bull_use_spike': True, 'bull_rsi_required': False, 'bear_strategy': 'mean_reversion', 'bear_bb_std_mult': 1.0208447145639794, 'bear_rsi_os': 16, 'bear_rsi_ob': 46, 'bear_adx_thresh': 21.53944267288521, 'bear_atr_min_pct': 0.0041976153862333335, 'bear_atr_max_pct': 0.05859887274877583, 'bear_tp_mult': 1.065427133994099, 'bear_tsl_mult': 0.8872915406046151, 'bear_time_stop': 220, 'bear_use_sma': False, 'bear_use_ema': False, 'bear_use_atr': False, 'bear_use_adx': False, 'bear_use_spike': True, 'bear_rsi_required': True, 'sideways_strategy': 'mean_reversion', 'sideways_bb_std_mult': 1.0721582791335276, 'sideways_rsi_os': 26, 'sideways_rsi_ob': 70, 'sideways_adx_thresh': 13.091936530461869, 'sideways_atr_min_pct': 0.014389533198889259, 'sideways_atr_max_pct': 0.14595650440234986, 'sideways_tp_mult': 1.4706603883973908, 'sideways_tsl_mult': 0.048693070801109906, 'sideways_time_stop': 211, 'sideways_use_sma': False, 'sideways_use_ema': False, 'sideways_use_atr': True, 'sideways_use_adx': True, 'sideways_use_spike': True, 'sideways_rsi_required': False}.
[I 2025-08-30 16:52:54,222] Trial 557 finished with values: [-1000000000.0, 1000000000.0] and parameters: {'p_sma': 25, 'p_std': 51, 'p_atr': 21, 'p_adx': 22, 'rsi_period': 19, 'ema1': 10, 'ema2': 15, 'slip_atr_k': 0.15499807029740278, 'slip_spread_k': 0.41341968695481646, 'spread_hl_frac': 0.01696600498389593, 'bb_std_mult': 3.0830276905226692, 'rsi_os': 55, 'rsi_ob': 94, 'vol_spike': 0.009225269109881112, 'adx_thresh': 34.99916481433946, 'atr_min_pct': 0.018640527699832862, 'atr_max_pct': 0.14238311264615036, 'tp_mult': 1.3780306059029899, 'tsl_mult': 0.8212146206720055, 'strategy': 'breakout', 'time_stop': 26, 'use_sma': False, 'use_atr': False, 'use_adx': False, 'use_ema': False, 'use_spike': False, 'rsi_required': False, 'edge_k': 0.26328084251004646, 'edge_cap': 0.23035945506811462, 'bull_strategy': 'breakout', 'bull_bb_std_mult': 1.8152106461332482, 'bull_rsi_os': 37, 'bull_rsi_ob': 71, 'bull_adx_thresh': 22.423100753855138, 'bull_atr_min_pct': 0.020538590121867144, 'bull_atr_max_pct': 0.1101927074152685, 'bull_tp_mult': 1.3977591666213038, 'bull_tsl_mult': 0.9159188891873598, 'bull_time_stop': 284, 'bull_use_sma': False, 'bull_use_ema': False, 'bull_use_atr': True, 'bull_use_adx': False, 'bull_use_spike': True, 'bull_rsi_required': False, 'bear_strategy': 'mean_reversion', 'bear_bb_std_mult': 2.02129940956305, 'bear_rsi_os': 13, 'bear_rsi_ob': 79, 'bear_adx_thresh': 12.77597073211362, 'bear_atr_min_pct': 0.023042427977979302, 'bear_atr_max_pct': 0.11460090294158948, 'bear_tp_mult': 2.150167261154993, 'bear_tsl_mult': 0.9502849721882893, 'bear_time_stop': 42, 'bear_use_sma': False, 'bear_use_ema': False, 'bear_use_atr': False, 'bear_use_adx': False, 'bear_use_spike': True, 'bear_rsi_required': True, 'sideways_strategy': 'mean_reversion', 'sideways_bb_std_mult': 2.084478091638183, 'sideways_rsi_os': 26, 'sideways_rsi_ob': 93, 'sideways_adx_thresh': 17.474868580410835, 'sideways_atr_min_pct': 0.002413268375883868, 'sideways_atr_max_pct': 0.1467126312608195, 'sideways_tp_mult': 2.309796111730703, 'sideways_tsl_mult': 0.24380194172161307, 'sideways_time_stop': 233, 'sideways_use_sma': False, 'sideways_use_ema': False, 'sideways_use_atr': True, 'sideways_use_adx': True, 'sideways_use_spike': True, 'sideways_rsi_required': False}.
