[I 2025-08-30 15:32:57,742] Trial 117 finished with values: [-1000000000.0, 1000000000.0] and parameters: {'p_sma': 30, 'p_std': 22, 'p_atr': 16, 'p_adx': 12, 'rsi_period': 56, 'ema1': 14, 'ema2': 35, 'slip_atr_k': 0.10112945782355778, 'slip_spread_k': 0.9995718383312442, 'spread_hl_frac': 0.04800442182369195, 'bb_std_mult': 2.2616582462219186, 'rsi_os': 34, 'rsi_ob': 82, 'vol_spike': 0.29575861200621667, 'adx_thresh': 17.64813598134816, 'atr_min_pct': 0.00044972635319133003, 'atr_max_pct': 0.040384137726569715, 'tp_mult': 1.4683796854850955, 'tsl_mult': 0.8095632860645252, 'strategy': 'mean_reversion', 'time_stop': 190, 'use_sma': False, 'use_atr': False, 'use_adx': True, 'use_ema': False, 'use_spike': True, 'rsi_required': False, 'edge_k': 0.3589488763204042, 'edge_cap': 0.12470395834577344, 'bull_strategy': 'breakout', 'bull_bb_std_mult': 1.2955268942146874, 'bull_rsi_os': 29, 'bull_rsi_ob': 93, 'bull_adx_thresh': 26.112025419282347, 'bull_atr_min_pct': 0.024781206437334974, 'bull_atr_max_pct': 0.024154834999214985, 'bull_tp_mult': 2.0583762646018204, 'bull_tsl_mult': 0.16964094126891244, 'bull_time_stop': 19, 'bull_use_sma': True, 'bull_use_ema': True, 'bull_use_atr': False, 'bull_use_adx': True, 'bull_use_spike': False, 'bull_rsi_required': True, 'bear_strategy': 'mean_reversion', 'bear_bb_std_mult': 1.8870635208891207, 'bear_rsi_os': 49, 'bear_rsi_ob': 54, 'bear_adx_thresh': 20.727337714376713, 'bear_atr_min_pct': 0.012561369776928417, 'bear_atr_max_pct': 0.12681341735526036, 'bear_tp_mult': 1.544889464902051, 'bear_tsl_mult': 0.28181308532724036, 'bear_time_stop': 157, 'bear_use_sma': False, 'bear_use_ema': False, 'bear_use_atr': True, 'bear_use_adx': False, 'bear_use_spike': True, 'bear_rsi_required': False, 'sideways_strategy': 'breakout', 'sideways_bb_std_mult': 1.3475403487870854, 'sideways_rsi_os': 51, 'sideways_rsi_ob': 57, 'sideways_adx_thresh': 19.19394531209686, 'sideways_atr_min_pct': 0.00429179457644359, 'sideways_atr_max_pct': 0.06422856472806794, 'sideways_tp_mult': 2.4584543088108024, 'sideways_tsl_mult': 0.19852722090113206, 'sideways_time_stop': 31, 'sideways_use_sma': False, 'sideways_use_ema': True, 'sideways_use_atr': False, 'sideways_use_adx': True, 'sideways_use_spike': False, 'sideways_rsi_required': False}.
[I 2025-08-30 15:33:15,720] Trial 118 finished with values: [-1000000000.0, 1000000000.0] and parameters: {'p_sma': 31, 'p_std': 21, 'p_atr': 21, 'p_adx': 12, 'rsi_period': 81, 'ema1': 6, 'ema2': 27, 'slip_atr_k': 0.06968978148804496, 'slip_spread_k': 0.9951113968390872, 'spread_hl_frac': 0.047965939826596034, 'bb_std_mult': 2.22426742609863, 'rsi_os': 30, 'rsi_ob': 82, 'vol_spike': 0.2946294644878499, 'adx_thresh': 17.91772070499846, 'atr_min_pct': 0.004310239276246157, 'atr_max_pct': 0.039282953540218594, 'tp_mult': 1.4979144828662811, 'tsl_mult': 0.7501628744928847, 'strategy': 'mean_reversion', 'time_stop': 187, 'use_sma': False, 'use_atr': True, 'use_adx': True, 'use_ema': False, 'use_spike': True, 'rsi_required': True, 'edge_k': 0.9908992873288761, 'edge_cap': 0.16250168729854003, 'bull_strategy': 'breakout', 'bull_bb_std_mult': 1.6980811195017844, 'bull_rsi_os': 46, 'bull_rsi_ob': 94, 'bull_adx_thresh': 26.434762823684697, 'bull_atr_min_pct': 0.024833685507247676, 'bull_atr_max_pct': 0.02398310851339312, 'bull_tp_mult': 2.3275833783929945, 'bull_tsl_mult': 0.18540769589362208, 'bull_time_stop': 18, 'bull_use_sma': False, 'bull_use_ema': False, 'bull_use_atr': False, 'bull_use_adx': True, 'bull_use_spike': False, 'bull_rsi_required': True, 'bear_strategy': 'mean_reversion', 'bear_bb_std_mult': 1.875073685443362, 'bear_rsi_os': 55, 'bear_rsi_ob': 88, 'bear_adx_thresh': 17.155961231983163, 'bear_atr_min_pct': 0.008743366329484501, 'bear_atr_max_pct': 0.12621259107614083, 'bear_tp_mult': 1.435482131858072, 'bear_tsl_mult': 0.32464077883547543, 'bear_time_stop': 221, 'bear_use_sma': False, 'bear_use_ema': False, 'bear_use_atr': True, 'bear_use_adx': True, 'bear_use_spike': True, 'bear_rsi_required': True, 'sideways_strategy': 'breakout', 'sideways_bb_std_mult': 1.4952453325307236, 'sideways_rsi_os': 51, 'sideways_rsi_ob': 57, 'sideways_adx_thresh': 19.20788062505512, 'sideways_atr_min_pct': 0.004803695187057439, 'sideways_atr_max_pct': 0.050114299804860186, 'sideways_tp_mult': 2.758797320811076, 'sideways_tsl_mult': 0.1970207794094156, 'sideways_time_stop': 31, 'sideways_use_sma': False, 'sideways_use_ema': True, 'sideways_use_atr': False, 'sideways_use_adx': True, 'sideways_use_spike': False, 'sideways_rsi_required': False}.
[I 2025-08-30 15:33:17,308] Trial 120 finished with values: [-1000000000.0, 1000000000.0] and parameters: {'p_sma': 28, 'p_std': 18, 'p_atr': 18, 'p_adx': 16, 'rsi_period': 81, 'ema1': 30, 'ema2': 33, 'slip_atr_k': 0.07342973927702116, 'slip_spread_k': 0.998384137409719, 'spread_hl_frac': 0.047985155096653624, 'bb_std_mult': 2.409877769611731, 'rsi_os': 28, 'rsi_ob': 82, 'vol_spike': 0.01600498555063201, 'adx_thresh': 18.770125057122062, 'atr_min_pct': 0.004261858805529766, 'atr_max_pct': 0.03875074449846726, 'tp_mult': 1.1546394130864432, 'tsl_mult': 0.4443541490410183, 'strategy': 'mean_reversion', 'time_stop': 186, 'use_sma': False, 'use_atr': True, 'use_adx': True, 'use_ema': False, 'use_spike': False, 'rsi_required': True, 'edge_k': 1.9982924844513992, 'edge_cap': 0.11794680355873013, 'bull_strategy': 'breakout', 'bull_bb_std_mult': 1.2773621582389276, 'bull_rsi_os': 7, 'bull_rsi_ob': 94, 'bull_adx_thresh': 27.495075073985344, 'bull_atr_min_pct': 0.025073271551826194, 'bull_atr_max_pct': 0.030426075617811292, 'bull_tp_mult': 2.3343983811406943, 'bull_tsl_mult': 0.09089257465985054, 'bull_time_stop': 43, 'bull_use_sma': False, 'bull_use_ema': False, 'bull_use_atr': True, 'bull_use_adx': True, 'bull_use_spike': False, 'bull_rsi_required': True, 'bear_strategy': 'mean_reversion', 'bear_bb_std_mult': 2.1481703092908973, 'bear_rsi_os': 52, 'bear_rsi_ob': 95, 'bear_adx_thresh': 20.53325968963392, 'bear_atr_min_pct': 0.012922514041596556, 'bear_atr_max_pct': 0.13550763244359298, 'bear_tp_mult': 2.655863799340394, 'bear_tsl_mult': 0.5998648762830436, 'bear_time_stop': 183, 'bear_use_sma': True, 'bear_use_ema': False, 'bear_use_atr': True, 'bear_use_adx': False, 'bear_use_spike': False, 'bear_rsi_required': False, 'sideways_strategy': 'breakout', 'sideways_bb_std_mult': 1.3338734398238221, 'sideways_rsi_os': 51, 'sideways_rsi_ob': 50, 'sideways_adx_thresh': 20.099488115538612, 'sideways_atr_min_pct': 0.015054978197681554, 'sideways_atr_max_pct': 0.05202043327496184, 'sideways_tp_mult': 2.8649308098220034, 'sideways_tsl_mult': 0.853111457035994, 'sideways_time_stop': 26, 'sideways_use_sma': False, 'sideways_use_ema': True, 'sideways_use_atr': True, 'sideways_use_adx': False, 'sideways_use_spike': False, 'sideways_rsi_required': True}.
[I 2025-08-30 15:33:18,187] Trial 119 finished with values: [-1000000000.0, 1000000000.0] and parameters: {'p_sma': 30, 'p_std': 21, 'p_atr': 16, 'p_adx': 14, 'rsi_period': 82, 'ema1': 14, 'ema2': 35, 'slip_atr_k': 0.07448482735882472, 'slip_spread_k': 0.9309702286740776, 'spread_hl_frac': 0.03869293275845462, 'bb_std_mult': 1.9711191761510438, 'rsi_os': 34, 'rsi_ob': 82, 'vol_spike': 0.2980242575919703, 'adx_thresh': 18.768214642128974, 'atr_min_pct': 0.0011988447981432435, 'atr_max_pct': 0.03935341347444829, 'tp_mult': 1.536063309228715, 'tsl_mult': 0.7541194582051639, 'strategy': 'mean_reversion', 'time_stop': 149, 'use_sma': False, 'use_atr': True, 'use_adx': True, 'use_ema': False, 'use_spike': False, 'rsi_required': True, 'edge_k': 0.337997151562902, 'edge_cap': 0.1205753168034884, 'bull_strategy': 'breakout', 'bull_bb_std_mult': 1.3054977848957054, 'bull_rsi_os': 47, 'bull_rsi_ob': 94, 'bull_adx_thresh': 31.21909072736745, 'bull_atr_min_pct': 0.025224230076521623, 'bull_atr_max_pct': 0.02911914352914821, 'bull_tp_mult': 2.1499453500727355, 'bull_tsl_mult': 0.15228749273551442, 'bull_time_stop': 15, 'bull_use_sma': False, 'bull_use_ema': False, 'bull_use_atr': True, 'bull_use_adx': True, 'bull_use_spike': False, 'bull_rsi_required': True, 'bear_strategy': 'mean_reversion', 'bear_bb_std_mult': 2.1153006678696866, 'bear_rsi_os': 55, 'bear_rsi_ob': 88, 'bear_adx_thresh': 17.63455998707646, 'bear_atr_min_pct': 0.012612467271410594, 'bear_atr_max_pct': 0.13539576721432098, 'bear_tp_mult': 1.5423632374795122, 'bear_tsl_mult': 0.34481631069976315, 'bear_time_stop': 216, 'bear_use_sma': False, 'bear_use_ema': False, 'bear_use_atr': True, 'bear_use_adx': False, 'bear_use_spike': True, 'bear_rsi_required': False, 'sideways_strategy': 'breakout', 'sideways_bb_std_mult': 1.3987960756095297, 'sideways_rsi_os': 50, 'sideways_rsi_ob': 51, 'sideways_adx_thresh': 15.099489592996012, 'sideways_atr_min_pct': 0.007174686201072261, 'sideways_atr_max_pct': 0.0626043093701388, 'sideways_tp_mult': 2.4452211886606783, 'sideways_tsl_mult': 0.19554566933527387, 'sideways_time_stop': 53, 'sideways_use_sma': False, 'sideways_use_ema': True, 'sideways_use_atr': True, 'sideways_use_adx': False, 'sideways_use_spike': False, 'sideways_rsi_required': False}.
[I 2025-08-30 15:33:48,900] Trial 121 finished with values: [-1000000000.0, 1000000000.0] and parameters: {'p_sma': 28, 'p_std': 16, 'p_atr': 21, 'p_adx': 16, 'rsi_period': 84, 'ema1': 7, 'ema2': 27, 'slip_atr_k': 0.06910631620652806, 'slip_spread_k': 0.1505818419313112, 'spread_hl_frac': 0.027014903106756964, 'bb_std_mult': 0.5135060752727574, 'rsi_os': 30, 'rsi_ob': 79, 'vol_spike': 0.062206400519997346, 'adx_thresh': 18.556484087031244, 'atr_min_pct': 0.0038812978293775776, 'atr_max_pct': 0.0474377023412558, 'tp_mult': 1.1095741683751261, 'tsl_mult': 0.7876768555095734, 'strategy': 'mean_reversion', 'time_stop': 123, 'use_sma': False, 'use_atr': True, 'use_adx': True, 'use_ema': False, 'use_spike': False, 'rsi_required': True, 'edge_k': 1.2059991504384429, 'edge_cap': 0.051108863886735904, 'bull_strategy': 'breakout', 'bull_bb_std_mult': 0.6507991055514184, 'bull_rsi_os': 50, 'bull_rsi_ob': 88, 'bull_adx_thresh': 27.645245977007622, 'bull_atr_min_pct': 0.025368250417344022, 'bull_atr_max_pct': 0.02908447143344544, 'bull_tp_mult': 2.131737655352639, 'bull_tsl_mult': 0.11173045481164934, 'bull_time_stop': 5, 'bull_use_sma': False, 'bull_use_ema': False, 'bull_use_atr': True, 'bull_use_adx': True, 'bull_use_spike': False, 'bull_rsi_required': True, 'bear_strategy': 'mean_reversion', 'bear_bb_std_mult': 1.7982982584885334, 'bear_rsi_os': 52, 'bear_rsi_ob': 49, 'bear_adx_thresh': 16.776579638697488, 'bear_atr_min_pct': 0.013756327894421959, 'bear_atr_max_pct': 0.12990495533597995, 'bear_tp_mult': 2.3173739389059107, 'bear_tsl_mult': 0.356733904873955, 'bear_time_stop': 219, 'bear_use_sma': True, 'bear_use_ema': False, 'bear_use_atr': True, 'bear_use_adx': False, 'bear_use_spike': False, 'bear_rsi_required': False, 'sideways_strategy': 'breakout', 'sideways_bb_std_mult': 1.1407774374367403, 'sideways_rsi_os': 19, 'sideways_rsi_ob': 50, 'sideways_adx_thresh': 20.28496637167391, 'sideways_atr_min_pct': 0.01029878070255588, 'sideways_atr_max_pct': 0.059337348102592766, 'sideways_tp_mult': 2.153120645827485, 'sideways_tsl_mult': 0.16022701973070225, 'sideways_time_stop': 49, 'sideways_use_sma': False, 'sideways_use_ema': False, 'sideways_use_atr': True, 'sideways_use_adx': False, 'sideways_use_spike': False, 'sideways_rsi_required': True}.
[I 2025-08-30 15:33:59,212] Trial 122 finished with values: [-1000000000.0, 1000000000.0] and parameters: {'p_sma': 29, 'p_std': 17, 'p_atr': 18, 'p_adx': 14, 'rsi_period': 74, 'ema1': 30, 'ema2': 17, 'slip_atr_k': 0.11586878099957726, 'slip_spread_k': 0.5199113034045709, 'spread_hl_frac': 0.027272208818108892, 'bb_std_mult': 2.3646552675805945, 'rsi_os': 28, 'rsi_ob': 86, 'vol_spike': 0.03525246054973674, 'adx_thresh': 15.606121257823292, 'atr_min_pct': 0.005282617016920839, 'atr_max_pct': 0.11592183767231988, 'tp_mult': 1.1379835722731588, 'tsl_mult': 0.7882042336962983, 'strategy': 'mean_reversion', 'time_stop': 142, 'use_sma': False, 'use_atr': True, 'use_adx': True, 'use_ema': False, 'use_spike': False, 'rsi_required': True, 'edge_k': 0.05397265015171793, 'edge_cap': 0.12013264132946211, 'bull_strategy': 'breakout', 'bull_bb_std_mult': 0.6412644406835301, 'bull_rsi_os': 53, 'bull_rsi_ob': 89, 'bull_adx_thresh': 27.29286490031475, 'bull_atr_min_pct': 0.02724818401041092, 'bull_atr_max_pct': 0.02904566050306314, 'bull_tp_mult': 2.456476605408383, 'bull_tsl_mult': 0.10277676253658258, 'bull_time_stop': 46, 'bull_use_sma': False, 'bull_use_ema': False, 'bull_use_atr': True, 'bull_use_adx': True, 'bull_use_spike': False, 'bull_rsi_required': True, 'bear_strategy': 'mean_reversion', 'bear_bb_std_mult': 2.1434971347471574, 'bear_rsi_os': 51, 'bear_rsi_ob': 73, 'bear_adx_thresh': 18.121905387700465, 'bear_atr_min_pct': 0.013360534707986954, 'bear_atr_max_pct': 0.13584243578800134, 'bear_tp_mult': 2.3010464349636512, 'bear_tsl_mult': 0.3640304902871867, 'bear_time_stop': 187, 'bear_use_sma': True, 'bear_use_ema': False, 'bear_use_atr': True, 'bear_use_adx': False, 'bear_use_spike': False, 'bear_rsi_required': False, 'sideways_strategy': 'breakout', 'sideways_bb_std_mult': 0.8018307957938409, 'sideways_rsi_os': 53, 'sideways_rsi_ob': 49, 'sideways_adx_thresh': 15.31887256469183, 'sideways_atr_min_pct': 0.011522187026027315, 'sideways_atr_max_pct': 0.06298422163392063, 'sideways_tp_mult': 2.899643903048413, 'sideways_tsl_mult': 0.16095949781914748, 'sideways_time_stop': 54, 'sideways_use_sma': False, 'sideways_use_ema': False, 'sideways_use_atr': True, 'sideways_use_adx': False, 'sideways_use_spike': False, 'sideways_rsi_required': True}.
[I 2025-08-30 15:33:59,771] Trial 124 finished with values: [-1000000000.0, 1000000000.0] and parameters: {'p_sma': 34, 'p_std': 15, 'p_atr': 18, 'p_adx': 14, 'rsi_period': 74, 'ema1': 29, 'ema2': 16, 'slip_atr_k': 0.11514249363617886, 'slip_spread_k': 0.5271700504648867, 'spread_hl_frac': 0.02805670618953315, 'bb_std_mult': 3.591885983821389, 'rsi_os': 30, 'rsi_ob': 86, 'vol_spike': 0.2795841228228649, 'adx_thresh': 16.556767250847486, 'atr_min_pct': 0.00536825800120826, 'atr_max_pct': 0.05138957205012975, 'tp_mult': 1.2449755709136905, 'tsl_mult': 0.7883265716219705, 'strategy': 'mean_reversion', 'time_stop': 127, 'use_sma': False, 'use_atr': False, 'use_adx': True, 'use_ema': False, 'use_spike': False, 'rsi_required': True, 'edge_k': 1.2502020503350986, 'edge_cap': 0.16651244580613056, 'bull_strategy': 'breakout', 'bull_bb_std_mult': 1.9427529489754114, 'bull_rsi_os': 54, 'bull_rsi_ob': 89, 'bull_adx_thresh': 33.10581559182286, 'bull_atr_min_pct': 0.026776314774781654, 'bull_atr_max_pct': 0.03358417566977986, 'bull_tp_mult': 1.9330813484284795, 'bull_tsl_mult': 0.11702258540301508, 'bull_time_stop': 5, 'bull_use_sma': False, 'bull_use_ema': True, 'bull_use_atr': True, 'bull_use_adx': True, 'bull_use_spike': False, 'bull_rsi_required': True, 'bear_strategy': 'mean_reversion', 'bear_bb_std_mult': 1.771351229609428, 'bear_rsi_os': 40, 'bear_rsi_ob': 70, 'bear_adx_thresh': 18.081117424059535, 'bear_atr_min_pct': 0.01397682127931123, 'bear_atr_max_pct': 0.14067167883547435, 'bear_tp_mult': 2.3665185897195595, 'bear_tsl_mult': 0.5240073262059889, 'bear_time_stop': 189, 'bear_use_sma': True, 'bear_use_ema': False, 'bear_use_atr': True, 'bear_use_adx': False, 'bear_use_spike': False, 'bear_rsi_required': False, 'sideways_strategy': 'breakout', 'sideways_bb_std_mult': 1.1490803283269686, 'sideways_rsi_os': 53, 'sideways_rsi_ob': 63, 'sideways_adx_thresh': 27.32533472990808, 'sideways_atr_min_pct': 0.019280617744508302, 'sideways_atr_max_pct': 0.07644461993791114, 'sideways_tp_mult': 2.5877981236131444, 'sideways_tsl_mult': 0.1480262187484808, 'sideways_time_stop': 53, 'sideways_use_sma': False, 'sideways_use_ema': False, 'sideways_use_atr': False, 'sideways_use_adx': False, 'sideways_use_spike': False, 'sideways_rsi_required': True}.
[I 2025-08-30 15:33:59,772] Trial 123 finished with values: [-1000000000.0, 1000000000.0] and parameters: {'p_sma': 57, 'p_std': 15, 'p_atr': 23, 'p_adx': 24, 'rsi_period': 74, 'ema1': 28, 'ema2': 16, 'slip_atr_k': 0.12980409205550117, 'slip_spread_k': 0.14837713032618033, 'spread_hl_frac': 0.039142852132460076, 'bb_std_mult': 2.070240816377135, 'rsi_os': 35, 'rsi_ob': 79, 'vol_spike': 0.11693302692568153, 'adx_thresh': 16.79732248548951, 'atr_min_pct': 0.0037378635738139214, 'atr_max_pct': 0.11618807917709245, 'tp_mult': 1.555608182282071, 'tsl_mult': 0.6793661789946914, 'strategy': 'mean_reversion', 'time_stop': 128, 'use_sma': False, 'use_atr': False, 'use_adx': True, 'use_ema': False, 'use_spike': False, 'rsi_required': True, 'edge_k': 0.2785007055387194, 'edge_cap': 0.1701189077875258, 'bull_strategy': 'breakout', 'bull_bb_std_mult': 0.6739757544108221, 'bull_rsi_os': 50, 'bull_rsi_ob': 88, 'bull_adx_thresh': 33.07308861809942, 'bull_atr_min_pct': 0.020927069880757203, 'bull_atr_max_pct': 0.028376992482709112, 'bull_tp_mult': 1.9275605533510747, 'bull_tsl_mult': 0.2515816191659327, 'bull_time_stop': 5, 'bull_use_sma': False, 'bull_use_ema': True, 'bull_use_atr': True, 'bull_use_adx': True, 'bull_use_spike': False, 'bull_rsi_required': True, 'bear_strategy': 'mean_reversion', 'bear_bb_std_mult': 1.796354438780575, 'bear_rsi_os': 40, 'bear_rsi_ob': 50, 'bear_adx_thresh': 18.037795420675767, 'bear_atr_min_pct': 0.013576964156033607, 'bear_atr_max_pct': 0.14115493745381585, 'bear_tp_mult': 1.6987576801428326, 'bear_tsl_mult': 0.36177646823145077, 'bear_time_stop': 241, 'bear_use_sma': True, 'bear_use_ema': False, 'bear_use_atr': True, 'bear_use_adx': False, 'bear_use_spike': False, 'bear_rsi_required': False, 'sideways_strategy': 'breakout', 'sideways_bb_std_mult': 1.1102726161856362, 'sideways_rsi_os': 19, 'sideways_rsi_ob': 46, 'sideways_adx_thresh': 15.330881891481528, 'sideways_atr_min_pct': 0.011625479292110002, 'sideways_atr_max_pct': 0.06332181126130408, 'sideways_tp_mult': 2.1193261570549415, 'sideways_tsl_mult': 0.1495207058558723, 'sideways_time_stop': 19, 'sideways_use_sma': False, 'sideways_use_ema': False, 'sideways_use_atr': True, 'sideways_use_adx': False, 'sideways_use_spike': False, 'sideways_rsi_required': True}.
[I 2025-08-30 15:34:39,511] Trial 125 finished with values: [-1000000000.0, 1000000000.0] and parameters: {'p_sma': 5, 'p_std': 14, 'p_atr': 15, 'p_adx': 14, 'rsi_period': 70, 'ema1': 29, 'ema2': 18, 'slip_atr_k': 0.11501169197152342, 'slip_spread_k': 0.47209188444219025, 'spread_hl_frac': 0.005474560553262113, 'bb_std_mult': 1.53385132051888, 'rsi_os': 35, 'rsi_ob': 84, 'vol_spike': 0.03958582040171822, 'adx_thresh': 15.381313096660085, 'atr_min_pct': 0.005044985196703742, 'atr_max_pct': 0.05344588352681999, 'tp_mult': 1.3144425355478941, 'tsl_mult': 0.6823756309840999, 'strategy': 'mean_reversion', 'time_stop': 247, 'use_sma': False, 'use_atr': False, 'use_adx': True, 'use_ema': True, 'use_spike': False, 'rsi_required': True, 'edge_k': 0.5030071034930247, 'edge_cap': 0.16424677376865343, 'bull_strategy': 'breakout', 'bull_bb_std_mult': 0.5172288714510991, 'bull_rsi_os': 25, 'bull_rsi_ob': 91, 'bull_adx_thresh': 29.239222162304735, 'bull_atr_min_pct': 0.027673758540491672, 'bull_atr_max_pct': 0.020175607060309186, 'bull_tp_mult': 1.9334302624684256, 'bull_tsl_mult': 0.20646623991348226, 'bull_time_stop': 27, 'bull_use_sma': False, 'bull_use_ema': True, 'bull_use_atr': True, 'bull_use_adx': True, 'bull_use_spike': True, 'bull_rsi_required': True, 'bear_strategy': 'breakout', 'bear_bb_std_mult': 1.7643580160055443, 'bear_rsi_os': 39, 'bear_rsi_ob': 91, 'bear_adx_thresh': 15.642190632843082, 'bear_atr_min_pct': 0.00678130860087547, 'bear_atr_max_pct': 0.11208884412487669, 'bear_tp_mult': 1.708042574195535, 'bear_tsl_mult': 0.4699066421820252, 'bear_time_stop': 110, 'bear_use_sma': True, 'bear_use_ema': False, 'bear_use_atr': True, 'bear_use_adx': False, 'bear_use_spike': False, 'bear_rsi_required': False, 'sideways_strategy': 'breakout', 'sideways_bb_std_mult': 0.9981959884482938, 'sideways_rsi_os': 53, 'sideways_rsi_ob': 53, 'sideways_adx_thresh': 17.351601362819068, 'sideways_atr_min_pct': 0.0260929250541201, 'sideways_atr_max_pct': 0.0757737216790496, 'sideways_tp_mult': 2.2713871794093454, 'sideways_tsl_mult': 0.05201022174189498, 'sideways_time_stop': 223, 'sideways_use_sma': False, 'sideways_use_ema': False, 'sideways_use_atr': False, 'sideways_use_adx': False, 'sideways_use_spike': True, 'sideways_rsi_required': False}.
