[I 2025-08-30 17:10:59,592] Trial 658 finished with values: [-1000000000.0, 1000000000.0] and parameters: {'p_sma': 50, 'p_std': 21, 'p_atr': 15, 'p_adx': 8, 'rsi_period': 60, 'ema1': 18, 'ema2': 10, 'slip_atr_k': 0.17932858098221865, 'slip_spread_k': 0.17776347766572376, 'spread_hl_frac': 0.01766320458058935, 'bb_std_mult': 3.2255203162728288, 'rsi_os': 23, 'rsi_ob': 73, 'vol_spike': 0.09555040097119821, 'adx_thresh': 11.309395011037672, 'atr_min_pct': 0.011350844018992478, 'atr_max_pct': 0.05448866447916786, 'tp_mult': 2.748346433168053, 'tsl_mult': 0.916979600948486, 'strategy': 'mean_reversion', 'time_stop': 159, 'use_sma': False, 'use_atr': True, 'use_adx': True, 'use_ema': False, 'use_spike': False, 'rsi_required': True, 'edge_k': 0.20002120101769583, 'edge_cap': 0.9227093963978598, 'bull_strategy': 'mean_reversion', 'bull_bb_std_mult': 2.026432292272808, 'bull_rsi_os': 13, 'bull_rsi_ob': 82, 'bull_adx_thresh': 34.40763327044613, 'bull_atr_min_pct': 0.021570011882455414, 'bull_atr_max_pct': 0.05985678737965248, 'bull_tp_mult': 2.2126380964794836, 'bull_tsl_mult': 0.8043174254039538, 'bull_time_stop': 25, 'bull_use_sma': True, 'bull_use_ema': True, 'bull_use_atr': False, 'bull_use_adx': True, 'bull_use_spike': False, 'bull_rsi_required': False, 'bear_strategy': 'mean_reversion', 'bear_bb_std_mult': 1.3865273889586784, 'bear_rsi_os': 45, 'bear_rsi_ob': 50, 'bear_adx_thresh': 27.37818639292181, 'bear_atr_min_pct': 0.014964335920509662, 'bear_atr_max_pct': 0.10460463968710088, 'bear_tp_mult': 2.2340046928422694, 'bear_tsl_mult': 0.5643701194458023, 'bear_time_stop': 195, 'bear_use_sma': True, 'bear_use_ema': False, 'bear_use_atr': False, 'bear_use_adx': True, 'bear_use_spike': True, 'bear_rsi_required': False, 'sideways_strategy': 'breakout', 'sideways_bb_std_mult': 0.844942819889625, 'sideways_rsi_os': 37, 'sideways_rsi_ob': 93, 'sideways_adx_thresh': 10.44413022229829, 'sideways_atr_min_pct': 0.015696541239801614, 'sideways_atr_max_pct': 0.09450295049484468, 'sideways_tp_mult': 2.933675862274543, 'sideways_tsl_mult': 0.4033803900686054, 'sideways_time_stop': 277, 'sideways_use_sma': False, 'sideways_use_ema': False, 'sideways_use_atr': False, 'sideways_use_adx': False, 'sideways_use_spike': False, 'sideways_rsi_required': True}.
[I 2025-08-30 17:11:00,714] Trial 657 finished with values: [-1000000000.0, 1000000000.0] and parameters: {'p_sma': 50, 'p_std': 23, 'p_atr': 15, 'p_adx': 7, 'rsi_period': 82, 'ema1': 18, 'ema2': 10, 'slip_atr_k': 0.008809350283966793, 'slip_spread_k': 0.2758609229924101, 'spread_hl_frac': 0.017080368091318292, 'bb_std_mult': 1.666233965796239, 'rsi_os': 21, 'rsi_ob': 83, 'vol_spike': 0.10640618600249441, 'adx_thresh': 33.8099471277818, 'atr_min_pct': 0.02926789159705509, 'atr_max_pct': 0.1458277937519326, 'tp_mult': 2.7624007926155314, 'tsl_mult': 0.9805149511938934, 'strategy': 'mean_reversion', 'time_stop': 295, 'use_sma': False, 'use_atr': True, 'use_adx': True, 'use_ema': False, 'use_spike': False, 'rsi_required': True, 'edge_k': 0.901730971810822, 'edge_cap': 0.9211258898570026, 'bull_strategy': 'mean_reversion', 'bull_bb_std_mult': 1.2265591142108951, 'bull_rsi_os': 9, 'bull_rsi_ob': 53, 'bull_adx_thresh': 34.30319890679604, 'bull_atr_min_pct': 0.0246498639507715, 'bull_atr_max_pct': 0.03959959253484117, 'bull_tp_mult': 2.202781178936595, 'bull_tsl_mult': 0.78735873551058, 'bull_time_stop': 181, 'bull_use_sma': True, 'bull_use_ema': True, 'bull_use_atr': False, 'bull_use_adx': True, 'bull_use_spike': False, 'bull_rsi_required': False, 'bear_strategy': 'mean_reversion', 'bear_bb_std_mult': 1.0412382161597549, 'bear_rsi_os': 50, 'bear_rsi_ob': 74, 'bear_adx_thresh': 11.683182089327167, 'bear_atr_min_pct': 0.020751388824521065, 'bear_atr_max_pct': 0.11421053930355379, 'bear_tp_mult': 2.505500841739456, 'bear_tsl_mult': 0.46997490033568384, 'bear_time_stop': 207, 'bear_use_sma': True, 'bear_use_ema': False, 'bear_use_atr': False, 'bear_use_adx': True, 'bear_use_spike': True, 'bear_rsi_required': False, 'sideways_strategy': 'breakout', 'sideways_bb_std_mult': 0.8404891849853106, 'sideways_rsi_os': 32, 'sideways_rsi_ob': 92, 'sideways_adx_thresh': 10.495704245317398, 'sideways_atr_min_pct': 0.002694922430797191, 'sideways_atr_max_pct': 0.10328513552748274, 'sideways_tp_mult': 2.9270440695402242, 'sideways_tsl_mult': 0.6921247442248072, 'sideways_time_stop': 265, 'sideways_use_sma': False, 'sideways_use_ema': False, 'sideways_use_atr': False, 'sideways_use_adx': False, 'sideways_use_spike': False, 'sideways_rsi_required': True}.
[I 2025-08-30 17:11:01,167] Trial 656 finished with values: [-1000000000.0, 1000000000.0] and parameters: {'p_sma': 8, 'p_std': 22, 'p_atr': 17, 'p_adx': 7, 'rsi_period': 82, 'ema1': 18, 'ema2': 53, 'slip_atr_k': 0.06212073834033324, 'slip_spread_k': 0.29993104491731537, 'spread_hl_frac': 0.017518276974620304, 'bb_std_mult': 1.6624442909065937, 'rsi_os': 30, 'rsi_ob': 87, 'vol_spike': 0.08201207666172174, 'adx_thresh': 11.30571908761774, 'atr_min_pct': 0.023162842271612322, 'atr_max_pct': 0.14536592587895153, 'tp_mult': 2.7553974105238677, 'tsl_mult': 0.922211041441541, 'strategy': 'mean_reversion', 'time_stop': 297, 'use_sma': False, 'use_atr': True, 'use_adx': True, 'use_ema': True, 'use_spike': False, 'rsi_required': True, 'edge_k': 0.8813037752532042, 'edge_cap': 0.8268618670320276, 'bull_strategy': 'mean_reversion', 'bull_bb_std_mult': 1.2149435959530914, 'bull_rsi_os': 13, 'bull_rsi_ob': 53, 'bull_adx_thresh': 34.343012019803076, 'bull_atr_min_pct': 0.021498180112832107, 'bull_atr_max_pct': 0.053811368090783004, 'bull_tp_mult': 2.312029450590605, 'bull_tsl_mult': 0.7939579072375313, 'bull_time_stop': 241, 'bull_use_sma': True, 'bull_use_ema': True, 'bull_use_atr': False, 'bull_use_adx': True, 'bull_use_spike': False, 'bull_rsi_required': True, 'bear_strategy': 'breakout', 'bear_bb_std_mult': 1.5882330740542545, 'bear_rsi_os': 45, 'bear_rsi_ob': 77, 'bear_adx_thresh': 21.24187826257088, 'bear_atr_min_pct': 0.006711301624765124, 'bear_atr_max_pct': 0.11313463787157729, 'bear_tp_mult': 1.5754007339717016, 'bear_tsl_mult': 0.33154419799910934, 'bear_time_stop': 191, 'bear_use_sma': False, 'bear_use_ema': False, 'bear_use_atr': False, 'bear_use_adx': True, 'bear_use_spike': True, 'bear_rsi_required': False, 'sideways_strategy': 'breakout', 'sideways_bb_std_mult': 0.8323780217454919, 'sideways_rsi_os': 44, 'sideways_rsi_ob': 93, 'sideways_adx_thresh': 8.724831786183445, 'sideways_atr_min_pct': 0.008350656707633583, 'sideways_atr_max_pct': 0.1029386662128107, 'sideways_tp_mult': 2.927130989802763, 'sideways_tsl_mult': 0.0030437985063788142, 'sideways_time_stop': 279, 'sideways_use_sma': True, 'sideways_use_ema': False, 'sideways_use_atr': True, 'sideways_use_adx': True, 'sideways_use_spike': False, 'sideways_rsi_required': False}.
[I 2025-08-30 17:11:01,518] Trial 660 finished with values: [-1000000000.0, 1000000000.0] and parameters: {'p_sma': 6, 'p_std': 21, 'p_atr': 16, 'p_adx': 10, 'rsi_period': 60, 'ema1': 19, 'ema2': 44, 'slip_atr_k': 0.008729368550743808, 'slip_spread_k': 0.1721702587022818, 'spread_hl_frac': 0.017735108270615883, 'bb_std_mult': 1.6489736006256441, 'rsi_os': 47, 'rsi_ob': 83, 'vol_spike': 0.10692260255588015, 'adx_thresh': 11.34503428335242, 'atr_min_pct': 0.023133287689919062, 'atr_max_pct': 0.14525297087990008, 'tp_mult': 2.7974127439320298, 'tsl_mult': 0.9792229593630951, 'strategy': 'mean_reversion', 'time_stop': 40, 'use_sma': False, 'use_atr': True, 'use_adx': True, 'use_ema': False, 'use_spike': False, 'rsi_required': True, 'edge_k': 0.8910720130302914, 'edge_cap': 0.9256726822938469, 'bull_strategy': 'mean_reversion', 'bull_bb_std_mult': 3.597325056615066, 'bull_rsi_os': 9, 'bull_rsi_ob': 82, 'bull_adx_thresh': 34.38539397225514, 'bull_atr_min_pct': 0.02208231468107761, 'bull_atr_max_pct': 0.08388094783998537, 'bull_tp_mult': 2.0797018441337176, 'bull_tsl_mult': 0.7837817672773643, 'bull_time_stop': 68, 'bull_use_sma': True, 'bull_use_ema': True, 'bull_use_atr': False, 'bull_use_adx': True, 'bull_use_spike': False, 'bull_rsi_required': False, 'bear_strategy': 'mean_reversion', 'bear_bb_std_mult': 1.0488585380168263, 'bear_rsi_os': 32, 'bear_rsi_ob': 72, 'bear_adx_thresh': 27.197151403902197, 'bear_atr_min_pct': 0.017550794998479672, 'bear_atr_max_pct': 0.10513796502020419, 'bear_tp_mult': 2.2242234938278056, 'bear_tsl_mult': 0.5930443809217284, 'bear_time_stop': 215, 'bear_use_sma': True, 'bear_use_ema': False, 'bear_use_atr': False, 'bear_use_adx': False, 'bear_use_spike': False, 'bear_rsi_required': False, 'sideways_strategy': 'breakout', 'sideways_bb_std_mult': 0.8137636894767097, 'sideways_rsi_os': 30, 'sideways_rsi_ob': 67, 'sideways_adx_thresh': 11.00609801485963, 'sideways_atr_min_pct': 0.008418209759978154, 'sideways_atr_max_pct': 0.08792804670699605, 'sideways_tp_mult': 2.891893174019745, 'sideways_tsl_mult': 0.004562950372079877, 'sideways_time_stop': 270, 'sideways_use_sma': True, 'sideways_use_ema': False, 'sideways_use_atr': False, 'sideways_use_adx': False, 'sideways_use_spike': False, 'sideways_rsi_required': True}.
[I 2025-08-30 17:11:02,684] Trial 663 finished with values: [-1000000000.0, 1000000000.0] and parameters: {'p_sma': 29, 'p_std': 20, 'p_atr': 16, 'p_adx': 10, 'rsi_period': 23, 'ema1': 17, 'ema2': 25, 'slip_atr_k': 0.008980843305550936, 'slip_spread_k': 0.19766530513403155, 'spread_hl_frac': 0.019745572204685334, 'bb_std_mult': 3.0887923138143076, 'rsi_os': 31, 'rsi_ob': 84, 'vol_spike': 0.09907578232455447, 'adx_thresh': 8.631780897689032, 'atr_min_pct': 0.019595951881946915, 'atr_max_pct': 0.012160710743884626, 'tp_mult': 2.8536331241785517, 'tsl_mult': 0.9768807882569998, 'strategy': 'mean_reversion', 'time_stop': 39, 'use_sma': False, 'use_atr': False, 'use_adx': False, 'use_ema': False, 'use_spike': False, 'rsi_required': True, 'edge_k': 0.4200870010891683, 'edge_cap': 0.8993494059528393, 'bull_strategy': 'breakout', 'bull_bb_std_mult': 3.5988946517432545, 'bull_rsi_os': 27, 'bull_rsi_ob': 53, 'bull_adx_thresh': 33.66372694703405, 'bull_atr_min_pct': 0.02219818043049607, 'bull_atr_max_pct': 0.14706969538840314, 'bull_tp_mult': 2.1442682879489556, 'bull_tsl_mult': 0.8238613463698019, 'bull_time_stop': 81, 'bull_use_sma': True, 'bull_use_ema': False, 'bull_use_atr': False, 'bull_use_adx': False, 'bull_use_spike': False, 'bull_rsi_required': False, 'bear_strategy': 'mean_reversion', 'bear_bb_std_mult': 1.0665401065205558, 'bear_rsi_os': 14, 'bear_rsi_ob': 45, 'bear_adx_thresh': 11.41818894006677, 'bear_atr_min_pct': 0.01771989751631492, 'bear_atr_max_pct': 0.10573295304415922, 'bear_tp_mult': 1.3311433733645446, 'bear_tsl_mult': 0.6273282278451378, 'bear_time_stop': 159, 'bear_use_sma': True, 'bear_use_ema': True, 'bear_use_atr': False, 'bear_use_adx': False, 'bear_use_spike': False, 'bear_rsi_required': False, 'sideways_strategy': 'breakout', 'sideways_bb_std_mult': 0.6630188705458409, 'sideways_rsi_os': 38, 'sideways_rsi_ob': 90, 'sideways_adx_thresh': 11.397491149889243, 'sideways_atr_min_pct': 0.0010261914824291354, 'sideways_atr_max_pct': 0.09849710014800445, 'sideways_tp_mult': 2.87595713486877, 'sideways_tsl_mult': 0.8468603756289559, 'sideways_time_stop': 287, 'sideways_use_sma': True, 'sideways_use_ema': False, 'sideways_use_atr': False, 'sideways_use_adx': False, 'sideways_use_spike': False, 'sideways_rsi_required': True}.
[I 2025-08-30 17:11:46,436] Trial 661 finished with values: [-1000000000.0, 1000000000.0] and parameters: {'p_sma': 29, 'p_std': 21, 'p_atr': 16, 'p_adx': 10, 'rsi_period': 23, 'ema1': 19, 'ema2': 10, 'slip_atr_k': 0.16503149991085653, 'slip_spread_k': 0.1829297323321149, 'spread_hl_frac': 0.018128519899351322, 'bb_std_mult': 1.7337968987020065, 'rsi_os': 32, 'rsi_ob': 56, 'vol_spike': 0.10379833205645109, 'adx_thresh': 9.873392049275369, 'atr_min_pct': 0.019678058228393767, 'atr_max_pct': 0.11474344856630637, 'tp_mult': 2.8039794151106845, 'tsl_mult': 0.9784687788102557, 'strategy': 'mean_reversion', 'time_stop': 24, 'use_sma': False, 'use_atr': True, 'use_adx': False, 'use_ema': False, 'use_spike': False, 'rsi_required': True, 'edge_k': 0.4794787645640907, 'edge_cap': 0.8126675126627371, 'bull_strategy': 'mean_reversion', 'bull_bb_std_mult': 1.2144386143233818, 'bull_rsi_os': 9, 'bull_rsi_ob': 53, 'bull_adx_thresh': 34.99854976427183, 'bull_atr_min_pct': 0.02462988269826255, 'bull_atr_max_pct': 0.04759555708267495, 'bull_tp_mult': 2.2665839148768234, 'bull_tsl_mult': 0.8306953089316137, 'bull_time_stop': 68, 'bull_use_sma': True, 'bull_use_ema': True, 'bull_use_atr': False, 'bull_use_adx': False, 'bull_use_spike': False, 'bull_rsi_required': False, 'bear_strategy': 'mean_reversion', 'bear_bb_std_mult': 1.0769304622021543, 'bear_rsi_os': 17, 'bear_rsi_ob': 66, 'bear_adx_thresh': 11.328072465091175, 'bear_atr_min_pct': 0.006436971214486787, 'bear_atr_max_pct': 0.10121468300488062, 'bear_tp_mult': 1.61100306443023, 'bear_tsl_mult': 0.8262225166922337, 'bear_time_stop': 59, 'bear_use_sma': True, 'bear_use_ema': False, 'bear_use_atr': False, 'bear_use_adx': False, 'bear_use_spike': False, 'bear_rsi_required': False, 'sideways_strategy': 'breakout', 'sideways_bb_std_mult': 0.6761515885697413, 'sideways_rsi_os': 15, 'sideways_rsi_ob': 67, 'sideways_adx_thresh': 10.994498104654511, 'sideways_atr_min_pct': 0.0027040256728976045, 'sideways_atr_max_pct': 0.10495939349484917, 'sideways_tp_mult': 2.898700591498729, 'sideways_tsl_mult': 0.42772726211438167, 'sideways_time_stop': 285, 'sideways_use_sma': True, 'sideways_use_ema': False, 'sideways_use_atr': False, 'sideways_use_adx': False, 'sideways_use_spike': False, 'sideways_rsi_required': True}.
[I 2025-08-30 17:11:46,422] Trial 662 finished with values: [-1000000000.0, 1000000000.0] and parameters: {'p_sma': 29, 'p_std': 21, 'p_atr': 16, 'p_adx': 10, 'rsi_period': 23, 'ema1': 19, 'ema2': 21, 'slip_atr_k': 0.02577021321337908, 'slip_spread_k': 0.19399862956390443, 'spread_hl_frac': 0.018299708704539546, 'bb_std_mult': 3.0929949803851136, 'rsi_os': 31, 'rsi_ob': 84, 'vol_spike': 0.08678248007267765, 'adx_thresh': 24.352094219043245, 'atr_min_pct': 0.0027033226307641694, 'atr_max_pct': 0.14295641401565734, 'tp_mult': 2.856288100368531, 'tsl_mult': 0.9387267059012527, 'strategy': 'mean_reversion', 'time_stop': 40, 'use_sma': False, 'use_atr': False, 'use_adx': False, 'use_ema': False, 'use_spike': False, 'rsi_required': True, 'edge_k': 0.488757693317, 'edge_cap': 0.8129462631774789, 'bull_strategy': 'breakout', 'bull_bb_std_mult': 1.9918445462087793, 'bull_rsi_os': 10, 'bull_rsi_ob': 52, 'bull_adx_thresh': 34.916763375352275, 'bull_atr_min_pct': 0.022224079230590187, 'bull_atr_max_pct': 0.1469277527332113, 'bull_tp_mult': 2.393486683195677, 'bull_tsl_mult': 0.8717192899643824, 'bull_time_stop': 9, 'bull_use_sma': True, 'bull_use_ema': True, 'bull_use_atr': False, 'bull_use_adx': False, 'bull_use_spike': False, 'bull_rsi_required': False, 'bear_strategy': 'mean_reversion', 'bear_bb_std_mult': 1.0446429061222515, 'bear_rsi_os': 32, 'bear_rsi_ob': 56, 'bear_adx_thresh': 11.39273962592485, 'bear_atr_min_pct': 0.007867661610086337, 'bear_atr_max_pct': 0.11889894675315042, 'bear_tp_mult': 1.6006240910592562, 'bear_tsl_mult': 0.6181751762765564, 'bear_time_stop': 213, 'bear_use_sma': True, 'bear_use_ema': False, 'bear_use_atr': False, 'bear_use_adx': False, 'bear_use_spike': False, 'bear_rsi_required': False, 'sideways_strategy': 'breakout', 'sideways_bb_std_mult': 0.7743757015059359, 'sideways_rsi_os': 30, 'sideways_rsi_ob': 67, 'sideways_adx_thresh': 8.567170645368428, 'sideways_atr_min_pct': 0.0050829457359607925, 'sideways_atr_max_pct': 0.09886213927690153, 'sideways_tp_mult': 2.8924461490696, 'sideways_tsl_mult': 0.4309156060211146, 'sideways_time_stop': 270, 'sideways_use_sma': True, 'sideways_use_ema': False, 'sideways_use_atr': False, 'sideways_use_adx': False, 'sideways_use_spike': False, 'sideways_rsi_required': True}.
[I 2025-08-30 17:11:46,744] Trial 664 finished with values: [-1000000000.0, 1000000000.0] and parameters: {'p_sma': 6, 'p_std': 21, 'p_atr': 16, 'p_adx': 10, 'rsi_period': 23, 'ema1': 17, 'ema2': 33, 'slip_atr_k': 0.029150089614225674, 'slip_spread_k': 0.20363329940398234, 'spread_hl_frac': 0.03754452001920814, 'bb_std_mult': 3.4148527627169436, 'rsi_os': 31, 'rsi_ob': 56, 'vol_spike': 0.0883648138397241, 'adx_thresh': 21.907702847383323, 'atr_min_pct': 0.01944110473648333, 'atr_max_pct': 0.0784485175683048, 'tp_mult': 2.8684791610335316, 'tsl_mult': 0.9358972189776541, 'strategy': 'mean_reversion', 'time_stop': 25, 'use_sma': False, 'use_atr': False, 'use_adx': False, 'use_ema': False, 'use_spike': False, 'rsi_required': True, 'edge_k': 0.9975261447637083, 'edge_cap': 0.8045844356319555, 'bull_strategy': 'breakout', 'bull_bb_std_mult': 1.7317747921376223, 'bull_rsi_os': 11, 'bull_rsi_ob': 52, 'bull_adx_thresh': 34.89405308591583, 'bull_atr_min_pct': 0.02333455096407037, 'bull_atr_max_pct': 0.14741412815387983, 'bull_tp_mult': 2.131334663929918, 'bull_tsl_mult': 0.822668316402793, 'bull_time_stop': 83, 'bull_use_sma': True, 'bull_use_ema': False, 'bull_use_atr': False, 'bull_use_adx': False, 'bull_use_spike': True, 'bull_rsi_required': False, 'bear_strategy': 'mean_reversion', 'bear_bb_std_mult': 1.4668277287587417, 'bear_rsi_os': 7, 'bear_rsi_ob': 56, 'bear_adx_thresh': 23.64665671320327, 'bear_atr_min_pct': 0.023771673206521887, 'bear_atr_max_pct': 0.10125459745570252, 'bear_tp_mult': 1.2915424503778326, 'bear_tsl_mult': 0.37699074083244477, 'bear_time_stop': 59, 'bear_use_sma': True, 'bear_use_ema': True, 'bear_use_atr': False, 'bear_use_adx': False, 'bear_use_spike': False, 'bear_rsi_required': False, 'sideways_strategy': 'breakout', 'sideways_bb_std_mult': 0.6880771765819385, 'sideways_rsi_os': 11, 'sideways_rsi_ob': 90, 'sideways_adx_thresh': 11.600126265790212, 'sideways_atr_min_pct': 0.01834524335364024, 'sideways_atr_max_pct': 0.09823724004408851, 'sideways_tp_mult': 2.8638105864728414, 'sideways_tsl_mult': 0.8397141479289123, 'sideways_time_stop': 286, 'sideways_use_sma': True, 'sideways_use_ema': False, 'sideways_use_atr': False, 'sideways_use_adx': False, 'sideways_use_spike': False, 'sideways_rsi_required': True}.
[I 2025-08-30 17:11:47,896] Trial 665 finished with values: [-1000000000.0, 1000000000.0] and parameters: {'p_sma': 6, 'p_std': 21, 'p_atr': 16, 'p_adx': 8, 'rsi_period': 21, 'ema1': 19, 'ema2': 33, 'slip_atr_k': 0.04607748180723953, 'slip_spread_k': 0.20263696214581517, 'spread_hl_frac': 0.01847082874665545, 'bb_std_mult': 2.091331077023049, 'rsi_os': 32, 'rsi_ob': 64, 'vol_spike': 0.08707808437566308, 'adx_thresh': 21.527547871218477, 'atr_min_pct': 0.02077442654454256, 'atr_max_pct': 0.08254236382738375, 'tp_mult': 2.6861650111907855, 'tsl_mult': 0.9404574137531064, 'strategy': 'breakout', 'time_stop': 215, 'use_sma': False, 'use_atr': False, 'use_adx': False, 'use_ema': False, 'use_spike': False, 'rsi_required': False, 'edge_k': 0.7943237966424918, 'edge_cap': 0.8030658997078419, 'bull_strategy': 'mean_reversion', 'bull_bb_std_mult': 1.549875657185342, 'bull_rsi_os': 11, 'bull_rsi_ob': 52, 'bull_adx_thresh': 33.00865350471823, 'bull_atr_min_pct': 0.023238202769490287, 'bull_atr_max_pct': 0.14177555090773575, 'bull_tp_mult': 2.403606085560474, 'bull_tsl_mult': 0.7347364450631191, 'bull_time_stop': 74, 'bull_use_sma': True, 'bull_use_ema': True, 'bull_use_atr': False, 'bull_use_adx': False, 'bull_use_spike': True, 'bull_rsi_required': False, 'bear_strategy': 'mean_reversion', 'bear_bb_std_mult': 1.509796976179285, 'bear_rsi_os': 17, 'bear_rsi_ob': 86, 'bear_adx_thresh': 31.111973554199043, 'bear_atr_min_pct': 0.02395459362679786, 'bear_atr_max_pct': 0.10111375524362963, 'bear_tp_mult': 2.1348584362233476, 'bear_tsl_mult': 0.6319109497370644, 'bear_time_stop': 59, 'bear_use_sma': True, 'bear_use_ema': False, 'bear_use_atr': False, 'bear_use_adx': False, 'bear_use_spike': False, 'bear_rsi_required': False, 'sideways_strategy': 'breakout', 'sideways_bb_std_mult': 0.7312938175124537, 'sideways_rsi_os': 12, 'sideways_rsi_ob': 82, 'sideways_adx_thresh': 12.440586477834373, 'sideways_atr_min_pct': 0.010856097497813553, 'sideways_atr_max_pct': 0.10738252934650203, 'sideways_tp_mult': 2.8332389639144084, 'sideways_tsl_mult': 0.977583188768785, 'sideways_time_stop': 258, 'sideways_use_sma': True, 'sideways_use_ema': False, 'sideways_use_atr': False, 'sideways_use_adx': False, 'sideways_use_spike': False, 'sideways_rsi_required': True}.
