[I 2025-08-30 17:42:28,886] Trial 863 finished with values: [-1000000000.0, 1000000000.0] and parameters: {'p_sma': 6, 'p_std': 19, 'p_atr': 18, 'p_adx': 7, 'rsi_period': 19, 'ema1': 17, 'ema2': 28, 'slip_atr_k': 0.10880115984549166, 'slip_spread_k': 0.7104579881937614, 'spread_hl_frac': 0.016934144086160546, 'bb_std_mult': 3.0793522229766706, 'rsi_os': 33, 'rsi_ob': 85, 'vol_spike': 0.10081000479288867, 'adx_thresh': 17.78653664183441, 'atr_min_pct': 0.005907287411734073, 'atr_max_pct': 0.05420974736416519, 'tp_mult': 2.8008214756168, 'tsl_mult': 0.9191844993494444, 'strategy': 'mean_reversion', 'time_stop': 22, 'use_sma': False, 'use_atr': True, 'use_adx': False, 'use_ema': True, 'use_spike': False, 'rsi_required': True, 'edge_k': 0.7773218632835033, 'edge_cap': 0.5204384478846857, 'bull_strategy': 'mean_reversion', 'bull_bb_std_mult': 2.1019710157972384, 'bull_rsi_os': 9, 'bull_rsi_ob': 55, 'bull_adx_thresh': 7.8265916856903335, 'bull_atr_min_pct': 0.021735369220300713, 'bull_atr_max_pct': 0.12394686390583214, 'bull_tp_mult': 1.8978263481995168, 'bull_tsl_mult': 0.162939272474455, 'bull_time_stop': 69, 'bull_use_sma': True, 'bull_use_ema': False, 'bull_use_atr': False, 'bull_use_adx': True, 'bull_use_spike': False, 'bull_rsi_required': False, 'bear_strategy': 'breakout', 'bear_bb_std_mult': 2.84040633201204, 'bear_rsi_os': 14, 'bear_rsi_ob': 52, 'bear_adx_thresh': 12.224249396598521, 'bear_atr_min_pct': 0.007061954235540475, 'bear_atr_max_pct': 0.06974068643114725, 'bear_tp_mult': 2.195882665844164, 'bear_tsl_mult': 0.6182634422312394, 'bear_time_stop': 198, 'bear_use_sma': True, 'bear_use_ema': False, 'bear_use_atr': False, 'bear_use_adx': False, 'bear_use_spike': False, 'bear_rsi_required': False, 'sideways_strategy': 'breakout', 'sideways_bb_std_mult': 0.7564577699067392, 'sideways_rsi_os': 31, 'sideways_rsi_ob': 92, 'sideways_adx_thresh': 10.796554003912362, 'sideways_atr_min_pct': 0.004578614478555865, 'sideways_atr_max_pct': 0.037446955830221965, 'sideways_tp_mult': 1.2018732985248, 'sideways_tsl_mult': 0.16494977113365128, 'sideways_time_stop': 186, 'sideways_use_sma': True, 'sideways_use_ema': False, 'sideways_use_atr': False, 'sideways_use_adx': False, 'sideways_use_spike': False, 'sideways_rsi_required': True}.
[I 2025-08-30 17:42:30,177] Trial 868 finished with values: [-1000000000.0, 1000000000.0] and parameters: {'p_sma': 54, 'p_std': 20, 'p_atr': 17, 'p_adx': 8, 'rsi_period': 59, 'ema1': 18, 'ema2': 43, 'slip_atr_k': 0.015400366357294321, 'slip_spread_k': 0.15645848590826633, 'spread_hl_frac': 0.0113216506923624, 'bb_std_mult': 2.9757997071565634, 'rsi_os': 43, 'rsi_ob': 47, 'vol_spike': 0.04761529368354865, 'adx_thresh': 11.120158583529564, 'atr_min_pct': 0.0179080641711641, 'atr_max_pct': 0.14429016920570972, 'tp_mult': 2.757140301036741, 'tsl_mult': 0.9477706031023465, 'strategy': 'mean_reversion', 'time_stop': 34, 'use_sma': False, 'use_atr': True, 'use_adx': True, 'use_ema': False, 'use_spike': False, 'rsi_required': True, 'edge_k': 1.1841450066062071, 'edge_cap': 0.9483224735290322, 'bull_strategy': 'mean_reversion', 'bull_bb_std_mult': 2.94520251495078, 'bull_rsi_os': 12, 'bull_rsi_ob': 87, 'bull_adx_thresh': 34.1229230017063, 'bull_atr_min_pct': 0.02760020505592311, 'bull_atr_max_pct': 0.03883843873308021, 'bull_tp_mult': 2.2340553864513506, 'bull_tsl_mult': 0.14241125134159716, 'bull_time_stop': 47, 'bull_use_sma': True, 'bull_use_ema': True, 'bull_use_atr': False, 'bull_use_adx': True, 'bull_use_spike': False, 'bull_rsi_required': False, 'bear_strategy': 'mean_reversion', 'bear_bb_std_mult': 1.4238597106781872, 'bear_rsi_os': 15, 'bear_rsi_ob': 86, 'bear_adx_thresh': 23.10651972741918, 'bear_atr_min_pct': 0.02114845313088388, 'bear_atr_max_pct': 0.10568489312626644, 'bear_tp_mult': 2.18705475969337, 'bear_tsl_mult': 0.8162894712197541, 'bear_time_stop': 209, 'bear_use_sma': True, 'bear_use_ema': False, 'bear_use_atr': False, 'bear_use_adx': False, 'bear_use_spike': False, 'bear_rsi_required': False, 'sideways_strategy': 'mean_reversion', 'sideways_bb_std_mult': 0.8109304699408887, 'sideways_rsi_os': 22, 'sideways_rsi_ob': 77, 'sideways_adx_thresh': 12.893195544704447, 'sideways_atr_min_pct': 0.003406982751412938, 'sideways_atr_max_pct': 0.09794920494629998, 'sideways_tp_mult': 1.622135031747105, 'sideways_tsl_mult': 0.47416980861232316, 'sideways_time_stop': 102, 'sideways_use_sma': True, 'sideways_use_ema': False, 'sideways_use_atr': False, 'sideways_use_adx': False, 'sideways_use_spike': False, 'sideways_rsi_required': True}.
[I 2025-08-30 17:43:02,731] Trial 865 finished with values: [-0.008993338314497334, 0.00892869693196202] and parameters: {'p_sma': 6, 'p_std': 44, 'p_atr': 16, 'p_adx': 7, 'rsi_period': 28, 'ema1': 17, 'ema2': 58, 'slip_atr_k': 0.015548921849145317, 'slip_spread_k': 0.1380744383299939, 'spread_hl_frac': 0.007718221381923036, 'bb_std_mult': 2.9895442006050867, 'rsi_os': 5, 'rsi_ob': 86, 'vol_spike': 0.21766639910247076, 'adx_thresh': 20.490076146344997, 'atr_min_pct': 0.01782249143066782, 'atr_max_pct': 0.14172567681038253, 'tp_mult': 2.5851435053705374, 'tsl_mult': 0.9452376458436863, 'strategy': 'mean_reversion', 'time_stop': 33, 'use_sma': False, 'use_atr': True, 'use_adx': True, 'use_ema': True, 'use_spike': False, 'rsi_required': True, 'edge_k': 0.715756875688201, 'edge_cap': 0.9445218325705645, 'bull_strategy': 'mean_reversion', 'bull_bb_std_mult': 3.17700251340691, 'bull_rsi_os': 45, 'bull_rsi_ob': 55, 'bull_adx_thresh': 34.95209989310601, 'bull_atr_min_pct': 0.02140535509202551, 'bull_atr_max_pct': 0.08940545021499557, 'bull_tp_mult': 2.24208045600837, 'bull_tsl_mult': 0.03577565851948861, 'bull_time_stop': 47, 'bull_use_sma': True, 'bull_use_ema': False, 'bull_use_atr': False, 'bull_use_adx': True, 'bull_use_spike': False, 'bull_rsi_required': False, 'bear_strategy': 'breakout', 'bear_bb_std_mult': 3.5976931411089037, 'bear_rsi_os': 5, 'bear_rsi_ob': 74, 'bear_adx_thresh': 20.459851923189927, 'bear_atr_min_pct': 0.02125580275028384, 'bear_atr_max_pct': 0.0322648411510156, 'bear_tp_mult': 2.2371178276749766, 'bear_tsl_mult': 0.5698715521621072, 'bear_time_stop': 209, 'bear_use_sma': True, 'bear_use_ema': False, 'bear_use_atr': False, 'bear_use_adx': False, 'bear_use_spike': False, 'bear_rsi_required': False, 'sideways_strategy': 'breakout', 'sideways_bb_std_mult': 1.0507299857534407, 'sideways_rsi_os': 31, 'sideways_rsi_ob': 93, 'sideways_adx_thresh': 23.456841957905354, 'sideways_atr_min_pct': 0.001179553773000884, 'sideways_atr_max_pct': 0.0977012050635003, 'sideways_tp_mult': 2.9998596971144997, 'sideways_tsl_mult': 0.8265749794447971, 'sideways_time_stop': 274, 'sideways_use_sma': True, 'sideways_use_ema': False, 'sideways_use_atr': False, 'sideways_use_adx': False, 'sideways_use_spike': False, 'sideways_rsi_required': True}.
[I 2025-08-30 17:43:03,869] Trial 866 finished with values: [-1000000000.0, 1000000000.0] and parameters: {'p_sma': 54, 'p_std': 44, 'p_atr': 29, 'p_adx': 11, 'rsi_period': 59, 'ema1': 17, 'ema2': 47, 'slip_atr_k': 0.01509333403869683, 'slip_spread_k': 0.156218215036779, 'spread_hl_frac': 0.017172097057038285, 'bb_std_mult': 2.620472040326005, 'rsi_os': 26, 'rsi_ob': 86, 'vol_spike': 0.046924976985251665, 'adx_thresh': 11.875756974014525, 'atr_min_pct': 0.025331012445449927, 'atr_max_pct': 0.0643972635677906, 'tp_mult': 2.763235020523572, 'tsl_mult': 0.7688738772436701, 'strategy': 'mean_reversion', 'time_stop': 24, 'use_sma': False, 'use_atr': True, 'use_adx': True, 'use_ema': False, 'use_spike': False, 'rsi_required': True, 'edge_k': 1.1647369215618295, 'edge_cap': 0.7948424569391723, 'bull_strategy': 'mean_reversion', 'bull_bb_std_mult': 3.145522875021535, 'bull_rsi_os': 16, 'bull_rsi_ob': 55, 'bull_adx_thresh': 25.070702114074287, 'bull_atr_min_pct': 0.02166443121975085, 'bull_atr_max_pct': 0.10327627383368697, 'bull_tp_mult': 2.2324133380458395, 'bull_tsl_mult': 0.8022660064127317, 'bull_time_stop': 85, 'bull_use_sma': True, 'bull_use_ema': True, 'bull_use_atr': False, 'bull_use_adx': True, 'bull_use_spike': False, 'bull_rsi_required': False, 'bear_strategy': 'mean_reversion', 'bear_bb_std_mult': 1.2178033663241576, 'bear_rsi_os': 14, 'bear_rsi_ob': 52, 'bear_adx_thresh': 20.311553446335203, 'bear_atr_min_pct': 0.021244135597748987, 'bear_atr_max_pct': 0.10576704420538025, 'bear_tp_mult': 2.204413765828733, 'bear_tsl_mult': 0.5105383522487132, 'bear_time_stop': 209, 'bear_use_sma': True, 'bear_use_ema': False, 'bear_use_atr': False, 'bear_use_adx': False, 'bear_use_spike': False, 'bear_rsi_required': False, 'sideways_strategy': 'mean_reversion', 'sideways_bb_std_mult': 0.8339213276903257, 'sideways_rsi_os': 22, 'sideways_rsi_ob': 92, 'sideways_adx_thresh': 34.954924226058324, 'sideways_atr_min_pct': 7.905843248913057e-05, 'sideways_atr_max_pct': 0.09823460762441351, 'sideways_tp_mult': 2.855919927749708, 'sideways_tsl_mult': 0.8386908875121504, 'sideways_time_stop': 280, 'sideways_use_sma': True, 'sideways_use_ema': False, 'sideways_use_atr': False, 'sideways_use_adx': False, 'sideways_use_spike': False, 'sideways_rsi_required': True}.
[I 2025-08-30 17:43:03,874] Trial 867 finished with values: [-1000000000.0, 1000000000.0] and parameters: {'p_sma': 41, 'p_std': 17, 'p_atr': 16, 'p_adx': 8, 'rsi_period': 28, 'ema1': 17, 'ema2': 43, 'slip_atr_k': 0.20195923288904205, 'slip_spread_k': 0.15987121469670915, 'spread_hl_frac': 0.017034133585185015, 'bb_std_mult': 2.9702375645922574, 'rsi_os': 35, 'rsi_ob': 86, 'vol_spike': 0.10949349611039119, 'adx_thresh': 32.92496153969671, 'atr_min_pct': 0.017530848715933096, 'atr_max_pct': 0.14354880516872676, 'tp_mult': 2.192021442374437, 'tsl_mult': 0.7714584457368525, 'strategy': 'mean_reversion', 'time_stop': 33, 'use_sma': False, 'use_atr': True, 'use_adx': False, 'use_ema': False, 'use_spike': False, 'rsi_required': True, 'edge_k': 0.688895717612439, 'edge_cap': 0.7996457738656454, 'bull_strategy': 'mean_reversion', 'bull_bb_std_mult': 1.641463292532616, 'bull_rsi_os': 12, 'bull_rsi_ob': 51, 'bull_adx_thresh': 34.09117932570494, 'bull_atr_min_pct': 0.021591149410591395, 'bull_atr_max_pct': 0.08832539694704211, 'bull_tp_mult': 2.2458715353322942, 'bull_tsl_mult': 0.7877208019371721, 'bull_time_stop': 126, 'bull_use_sma': True, 'bull_use_ema': True, 'bull_use_atr': False, 'bull_use_adx': True, 'bull_use_spike': False, 'bull_rsi_required': False, 'bear_strategy': 'mean_reversion', 'bear_bb_std_mult': 1.2129283783171438, 'bear_rsi_os': 15, 'bear_rsi_ob': 95, 'bear_adx_thresh': 27.151984666666586, 'bear_atr_min_pct': 0.021170763981561695, 'bear_atr_max_pct': 0.10569044304598574, 'bear_tp_mult': 2.1874511670070826, 'bear_tsl_mult': 0.572798998277875, 'bear_time_stop': 209, 'bear_use_sma': True, 'bear_use_ema': False, 'bear_use_atr': False, 'bear_use_adx': False, 'bear_use_spike': False, 'bear_rsi_required': False, 'sideways_strategy': 'mean_reversion', 'sideways_bb_std_mult': 3.263150579628554, 'sideways_rsi_os': 22, 'sideways_rsi_ob': 93, 'sideways_adx_thresh': 10.342818471216908, 'sideways_atr_min_pct': 0.003513413638225365, 'sideways_atr_max_pct': 0.03794967302958292, 'sideways_tp_mult': 2.594498775355758, 'sideways_tsl_mult': 0.8151682567660806, 'sideways_time_stop': 106, 'sideways_use_sma': True, 'sideways_use_ema': False, 'sideways_use_atr': False, 'sideways_use_adx': False, 'sideways_use_spike': False, 'sideways_rsi_required': True}.
[I 2025-08-30 17:43:06,826] Trial 869 finished with values: [-1000000000.0, 1000000000.0] and parameters: {'p_sma': 50, 'p_std': 23, 'p_atr': 14, 'p_adx': 8, 'rsi_period': 22, 'ema1': 18, 'ema2': 46, 'slip_atr_k': 0.034779359510989635, 'slip_spread_k': 0.19082317776040067, 'spread_hl_frac': 0.018805687226268554, 'bb_std_mult': 3.1953820867276477, 'rsi_os': 34, 'rsi_ob': 86, 'vol_spike': 0.07449718732219082, 'adx_thresh': 28.957443667536097, 'atr_min_pct': 0.01900536157755846, 'atr_max_pct': 0.14210096826572083, 'tp_mult': 1.8464477610790655, 'tsl_mult': 0.05441139220662261, 'strategy': 'mean_reversion', 'time_stop': 271, 'use_sma': False, 'use_atr': True, 'use_adx': True, 'use_ema': False, 'use_spike': False, 'rsi_required': True, 'edge_k': 0.6388848005739718, 'edge_cap': 0.901510977493813, 'bull_strategy': 'mean_reversion', 'bull_bb_std_mult': 1.1955376425325506, 'bull_rsi_os': 11, 'bull_rsi_ob': 52, 'bull_adx_thresh': 33.987347519675694, 'bull_atr_min_pct': 0.021618984363476573, 'bull_atr_max_pct': 0.022163259972289254, 'bull_tp_mult': 2.9267860871291895, 'bull_tsl_mult': 0.07324521735664585, 'bull_time_stop': 190, 'bull_use_sma': True, 'bull_use_ema': True, 'bull_use_atr': False, 'bull_use_adx': True, 'bull_use_spike': False, 'bull_rsi_required': False, 'bear_strategy': 'mean_reversion', 'bear_bb_std_mult': 0.8475560503820585, 'bear_rsi_os': 52, 'bear_rsi_ob': 74, 'bear_adx_thresh': 13.748944685539263, 'bear_atr_min_pct': 0.02204944006744549, 'bear_atr_max_pct': 0.025447762227380225, 'bear_tp_mult': 1.3686317222992495, 'bear_tsl_mult': 0.6633038719348222, 'bear_time_stop': 221, 'bear_use_sma': True, 'bear_use_ema': False, 'bear_use_atr': False, 'bear_use_adx': False, 'bear_use_spike': False, 'bear_rsi_required': False, 'sideways_strategy': 'mean_reversion', 'sideways_bb_std_mult': 0.7049901656686106, 'sideways_rsi_os': 17, 'sideways_rsi_ob': 93, 'sideways_adx_thresh': 11.532878445858646, 'sideways_atr_min_pct': 0.0021292554031868607, 'sideways_atr_max_pct': 0.04992214631724433, 'sideways_tp_mult': 2.6086834187128773, 'sideways_tsl_mult': 0.8288551010601937, 'sideways_time_stop': 287, 'sideways_use_sma': True, 'sideways_use_ema': False, 'sideways_use_atr': False, 'sideways_use_adx': False, 'sideways_use_spike': False, 'sideways_rsi_required': True}.
[I 2025-08-30 17:43:43,453] Trial 870 finished with values: [-1000000000.0, 1000000000.0] and parameters: {'p_sma': 8, 'p_std': 8, 'p_atr': 8, 'p_adx': 11, 'rsi_period': 22, 'ema1': 18, 'ema2': 23, 'slip_atr_k': 0.17734207940411742, 'slip_spread_k': 0.18678786373769973, 'spread_hl_frac': 0.02986483187333129, 'bb_std_mult': 2.6158360189589227, 'rsi_os': 40, 'rsi_ob': 87, 'vol_spike': 0.11174623426400941, 'adx_thresh': 12.355737676423335, 'atr_min_pct': 0.02045369435024187, 'atr_max_pct': 0.07223566564395803, 'tp_mult': 2.3374055493685213, 'tsl_mult': 0.9420427765573378, 'strategy': 'mean_reversion', 'time_stop': 293, 'use_sma': False, 'use_atr': True, 'use_adx': True, 'use_ema': False, 'use_spike': False, 'rsi_required': False, 'edge_k': 0.6953601482502711, 'edge_cap': 0.8142116199271707, 'bull_strategy': 'mean_reversion', 'bull_bb_std_mult': 3.143381038540568, 'bull_rsi_os': 16, 'bull_rsi_ob': 58, 'bull_adx_thresh': 29.000858390431038, 'bull_atr_min_pct': 0.021949023391119035, 'bull_atr_max_pct': 0.08994116247768114, 'bull_tp_mult': 2.239929357859641, 'bull_tsl_mult': 0.38054771984609415, 'bull_time_stop': 22, 'bull_use_sma': True, 'bull_use_ema': True, 'bull_use_atr': False, 'bull_use_adx': True, 'bull_use_spike': True, 'bull_rsi_required': False, 'bear_strategy': 'mean_reversion', 'bear_bb_std_mult': 1.6859003113807238, 'bear_rsi_os': 52, 'bear_rsi_ob': 77, 'bear_adx_thresh': 13.685636056502723, 'bear_atr_min_pct': 0.02219854642662956, 'bear_atr_max_pct': 0.10827485319069118, 'bear_tp_mult': 2.099076111567903, 'bear_tsl_mult': 0.3776221258783515, 'bear_time_stop': 218, 'bear_use_sma': True, 'bear_use_ema': False, 'bear_use_atr': False, 'bear_use_adx': False, 'bear_use_spike': True, 'bear_rsi_required': False, 'sideways_strategy': 'mean_reversion', 'sideways_bb_std_mult': 3.2668477103096873, 'sideways_rsi_os': 51, 'sideways_rsi_ob': 93, 'sideways_adx_thresh': 25.503878076961957, 'sideways_atr_min_pct': 0.0022509076397456435, 'sideways_atr_max_pct': 0.10939615014181382, 'sideways_tp_mult': 2.3165149899073696, 'sideways_tsl_mult': 0.5793313109333268, 'sideways_time_stop': 286, 'sideways_use_sma': True, 'sideways_use_ema': False, 'sideways_use_atr': False, 'sideways_use_adx': False, 'sideways_use_spike': False, 'sideways_rsi_required': True}.
[I 2025-08-30 17:43:44,838] Trial 871 finished with values: [-1000000000.0, 1000000000.0] and parameters: {'p_sma': 8, 'p_std': 46, 'p_atr': 16, 'p_adx': 7, 'rsi_period': 22, 'ema1': 18, 'ema2': 12, 'slip_atr_k': 0.02572512713818828, 'slip_spread_k': 0.3675832365760242, 'spread_hl_frac': 0.009836568356754975, 'bb_std_mult': 1.9084228685560158, 'rsi_os': 34, 'rsi_ob': 64, 'vol_spike': 0.08136426719537214, 'adx_thresh': 12.099555071932913, 'atr_min_pct': 0.02035260651828142, 'atr_max_pct': 0.14094042942040935, 'tp_mult': 2.884989923768608, 'tsl_mult': 0.8984019496112473, 'strategy': 'mean_reversion', 'time_stop': 39, 'use_sma': False, 'use_atr': False, 'use_adx': True, 'use_ema': False, 'use_spike': False, 'rsi_required': False, 'edge_k': 0.45698555554549414, 'edge_cap': 0.9056269003688601, 'bull_strategy': 'mean_reversion', 'bull_bb_std_mult': 1.8364420224437923, 'bull_rsi_os': 26, 'bull_rsi_ob': 63, 'bull_adx_thresh': 7.049152041138562, 'bull_atr_min_pct': 0.02388248232942325, 'bull_atr_max_pct': 0.14299782552603899, 'bull_tp_mult': 2.3264002197728724, 'bull_tsl_mult': 0.04337815614170071, 'bull_time_stop': 193, 'bull_use_sma': True, 'bull_use_ema': True, 'bull_use_atr': False, 'bull_use_adx': False, 'bull_use_spike': True, 'bull_rsi_required': False, 'bear_strategy': 'mean_reversion', 'bear_bb_std_mult': 1.6946638818353517, 'bear_rsi_os': 48, 'bear_rsi_ob': 64, 'bear_adx_thresh': 26.237769893527165, 'bear_atr_min_pct': 0.022161594205769675, 'bear_atr_max_pct': 0.032763003482608515, 'bear_tp_mult': 1.3630117265846662, 'bear_tsl_mult': 0.38855749329316336, 'bear_time_stop': 215, 'bear_use_sma': True, 'bear_use_ema': False, 'bear_use_atr': False, 'bear_use_adx': True, 'bear_use_spike': True, 'bear_rsi_required': True, 'sideways_strategy': 'breakout', 'sideways_bb_std_mult': 0.6568700712162989, 'sideways_rsi_os': 32, 'sideways_rsi_ob': 61, 'sideways_adx_thresh': 11.500103818676518, 'sideways_atr_min_pct': 0.002182828441633834, 'sideways_atr_max_pct': 0.0931437452666593, 'sideways_tp_mult': 2.316856141282352, 'sideways_tsl_mult': 0.4390168760775477, 'sideways_time_stop': 88, 'sideways_use_sma': True, 'sideways_use_ema': False, 'sideways_use_atr': False, 'sideways_use_adx': False, 'sideways_use_spike': True, 'sideways_rsi_required': True}.
[I 2025-08-30 17:43:45,279] Trial 873 finished with values: [-1000000000.0, 1000000000.0] and parameters: {'p_sma': 13, 'p_std': 14, 'p_atr': 16, 'p_adx': 29, 'rsi_period': 50, 'ema1': 18, 'ema2': 12, 'slip_atr_k': 0.02745807842796537, 'slip_spread_k': 0.9999049316305287, 'spread_hl_frac': 0.02761090678649827, 'bb_std_mult': 3.104107644601366, 'rsi_os': 15, 'rsi_ob': 87, 'vol_spike': 0.2931374382609634, 'adx_thresh': 12.462089247395907, 'atr_min_pct': 0.020612876220632636, 'atr_max_pct': 0.14991348088193973, 'tp_mult': 2.871040475027624, 'tsl_mult': 0.8839043756595147, 'strategy': 'mean_reversion', 'time_stop': 121, 'use_sma': False, 'use_atr': False, 'use_adx': True, 'use_ema': False, 'use_spike': False, 'rsi_required': False, 'edge_k': 0.4612622596347491, 'edge_cap': 0.897261343912803, 'bull_strategy': 'mean_reversion', 'bull_bb_std_mult': 1.2887971552834179, 'bull_rsi_os': 32, 'bull_rsi_ob': 56, 'bull_adx_thresh': 34.41584789228318, 'bull_atr_min_pct': 0.023532964557339237, 'bull_atr_max_pct': 0.030785570861499648, 'bull_tp_mult': 2.3457520187740792, 'bull_tsl_mult': 0.8270845460610264, 'bull_time_stop': 204, 'bull_use_sma': True, 'bull_use_ema': True, 'bull_use_atr': False, 'bull_use_adx': False, 'bull_use_spike': True, 'bull_rsi_required': False, 'bear_strategy': 'mean_reversion', 'bear_bb_std_mult': 1.0273300126102274, 'bear_rsi_os': 37, 'bear_rsi_ob': 77, 'bear_adx_thresh': 10.91132098799825, 'bear_atr_min_pct': 0.02229067519724083, 'bear_atr_max_pct': 0.05301469624513595, 'bear_tp_mult': 2.0934311029401576, 'bear_tsl_mult': 0.5953212730727739, 'bear_time_stop': 182, 'bear_use_sma': True, 'bear_use_ema': False, 'bear_use_atr': False, 'bear_use_adx': True, 'bear_use_spike': True, 'bear_rsi_required': True, 'sideways_strategy': 'breakout', 'sideways_bb_std_mult': 0.6834154553189139, 'sideways_rsi_os': 29, 'sideways_rsi_ob': 61, 'sideways_adx_thresh': 9.60887145132824, 'sideways_atr_min_pct': 0.0014274776415312315, 'sideways_atr_max_pct': 0.1093700148887489, 'sideways_tp_mult': 2.9998572962977565, 'sideways_tsl_mult': 0.44809827854790724, 'sideways_time_stop': 274, 'sideways_use_sma': True, 'sideways_use_ema': False, 'sideways_use_atr': False, 'sideways_use_adx': True, 'sideways_use_spike': True, 'sideways_rsi_required': True}.
