[I 2025-09-01 14:55:14,568] Trial 603 finished with values: [-0.033846872336271594, 0.0339593552592492] and parameters: {'p_sma': 29, 'p_std': 27, 'p_atr': 29, 'p_adx': 7, 'rsi_period': 82, 'ema1': 9, 'ema2': 15, 'slip_atr_k': 0.013112681943960428, 'slip_spread_k': 0.44717417567808054, 'spread_hl_frac': 0.015451659753374161, 'bb_std_mult': 1.1375378312599085, 'rsi_os': 9, 'rsi_ob': 53, 'vol_spike': 0.16827367636767265, 'adx_thresh': 6.0734810183497006, 'atr_min_pct': 0.0031644402321792334, 'atr_max_pct': 0.026807109058095628, 'tp_mult': 1.4499921221152825, 'tsl_mult': 0.7437331739588504, 'strategy': 'mean_reversion', 'time_stop': 254, 'use_sma': False, 'use_atr': False, 'use_adx': True, 'use_ema': True, 'use_spike': True, 'rsi_required': False, 'edge_k': 1.9361990673332279, 'edge_cap': 0.9574887524569928, 'bull_strategy': 'breakout', 'bull_bb_std_mult': 1.55011156388623, 'bull_rsi_os': 14, 'bull_rsi_ob': 45, 'bull_adx_thresh': 9.108054455899191, 'bull_atr_min_pct': 0.0012233574262239689, 'bull_atr_max_pct': 0.04393304031919451, 'bull_tp_mult': 2.232764648596351, 'bull_tsl_mult': 0.9075022294385832, 'bull_time_stop': 153, 'bull_use_sma': False, 'bull_use_ema': True, 'bull_use_atr': True, 'bull_use_adx': True, 'bull_use_spike': True, 'bull_rsi_required': True, 'bear_strategy': 'mean_reversion', 'bear_bb_std_mult': 0.50118911840161, 'bear_rsi_os': 32, 'bear_rsi_ob': 61, 'bear_adx_thresh': 21.745620418262504, 'bear_atr_min_pct': 0.010187984502433245, 'bear_atr_max_pct': 0.10659369881143385, 'bear_tp_mult': 2.565257142587624, 'bear_tsl_mult': 0.18447012839231614, 'bear_time_stop': 87, 'bear_use_sma': False, 'bear_use_ema': True, 'bear_use_atr': False, 'bear_use_adx': True, 'bear_use_spike': False, 'bear_rsi_required': False, 'sideways_strategy': 'mean_reversion', 'sideways_bb_std_mult': 3.276829475255713, 'sideways_rsi_os': 39, 'sideways_rsi_ob': 79, 'sideways_adx_thresh': 5.90559443409486, 'sideways_atr_min_pct': 0.003795693320638413, 'sideways_atr_max_pct': 0.11492249190355687, 'sideways_tp_mult': 1.1401133860025572, 'sideways_tsl_mult': 0.35325714109057893, 'sideways_time_stop': 69, 'sideways_use_sma': False, 'sideways_use_ema': True, 'sideways_use_atr': False, 'sideways_use_adx': True, 'sideways_use_spike': False, 'sideways_rsi_required': False}.
[I 2025-09-01 14:55:59,326] Trial 606 finished with values: [-0.038677908909700465, 0.03861061660887648] and parameters: {'p_sma': 51, 'p_std': 41, 'p_atr': 29, 'p_adx': 8, 'rsi_period': 77, 'ema1': 10, 'ema2': 57, 'slip_atr_k': 0.013489947305218589, 'slip_spread_k': 0.583473962149769, 'spread_hl_frac': 0.014181552898457654, 'bb_std_mult': 3.4428011629082413, 'rsi_os': 23, 'rsi_ob': 54, 'vol_spike': 0.006270856127931185, 'adx_thresh': 5.536707904772924, 'atr_min_pct': 0.005888404948362392, 'atr_max_pct': 0.027455351318914384, 'tp_mult': 2.8783858696786653, 'tsl_mult': 0.7008856029682761, 'strategy': 'mean_reversion', 'time_stop': 96, 'use_sma': True, 'use_atr': False, 'use_adx': True, 'use_ema': False, 'use_spike': True, 'rsi_required': True, 'edge_k': 0.1819765981098322, 'edge_cap': 0.9147398915446285, 'bull_strategy': 'breakout', 'bull_bb_std_mult': 1.0329173083030052, 'bull_rsi_os': 11, 'bull_rsi_ob': 78, 'bull_adx_thresh': 11.253084157111624, 'bull_atr_min_pct': 0.0011049272740837456, 'bull_atr_max_pct': 0.1316619626167405, 'bull_tp_mult': 1.5983823651211722, 'bull_tsl_mult': 0.9094735335647188, 'bull_time_stop': 150, 'bull_use_sma': True, 'bull_use_ema': False, 'bull_use_atr': True, 'bull_use_adx': True, 'bull_use_spike': True, 'bull_rsi_required': False, 'bear_strategy': 'mean_reversion', 'bear_bb_std_mult': 2.6790551827479603, 'bear_rsi_os': 36, 'bear_rsi_ob': 82, 'bear_adx_thresh': 9.019495878760353, 'bear_atr_min_pct': 0.004735027361016401, 'bear_atr_max_pct': 0.11373982673058497, 'bear_tp_mult': 2.9328564195642643, 'bear_tsl_mult': 0.5075335521763418, 'bear_time_stop': 89, 'bear_use_sma': False, 'bear_use_ema': False, 'bear_use_atr': False, 'bear_use_adx': True, 'bear_use_spike': True, 'bear_rsi_required': False, 'sideways_strategy': 'mean_reversion', 'sideways_bb_std_mult': 1.6219325205756456, 'sideways_rsi_os': 39, 'sideways_rsi_ob': 67, 'sideways_adx_thresh': 6.571415983243066, 'sideways_atr_min_pct': 0.010560635617811908, 'sideways_atr_max_pct': 0.1109240854680648, 'sideways_tp_mult': 2.341903028824591, 'sideways_tsl_mult': 0.39665481855045226, 'sideways_time_stop': 67, 'sideways_use_sma': True, 'sideways_use_ema': False, 'sideways_use_atr': True, 'sideways_use_adx': True, 'sideways_use_spike': False, 'sideways_rsi_required': True}.
[I 2025-09-01 14:55:59,357] Trial 604 finished with values: [-1000000000.0, 1000000000.0] and parameters: {'p_sma': 29, 'p_std': 27, 'p_atr': 23, 'p_adx': 24, 'rsi_period': 81, 'ema1': 9, 'ema2': 57, 'slip_atr_k': 0.05062719647319315, 'slip_spread_k': 0.37551573807295613, 'spread_hl_frac': 0.015573615935338125, 'bb_std_mult': 3.4330339481485312, 'rsi_os': 22, 'rsi_ob': 53, 'vol_spike': 0.11494327247375372, 'adx_thresh': 5.0139748143888845, 'atr_min_pct': 0.013559979397256667, 'atr_max_pct': 0.02411665460500955, 'tp_mult': 1.4619096832896514, 'tsl_mult': 0.4674900395915827, 'strategy': 'mean_reversion', 'time_stop': 63, 'use_sma': True, 'use_atr': False, 'use_adx': True, 'use_ema': True, 'use_spike': True, 'rsi_required': True, 'edge_k': 0.17259938297550725, 'edge_cap': 0.4137101610613724, 'bull_strategy': 'breakout', 'bull_bb_std_mult': 2.4816573071723833, 'bull_rsi_os': 11, 'bull_rsi_ob': 78, 'bull_adx_thresh': 11.312435841846419, 'bull_atr_min_pct': 0.01319154792412833, 'bull_atr_max_pct': 0.044223862653095636, 'bull_tp_mult': 1.6972784186554124, 'bull_tsl_mult': 0.46619754688476195, 'bull_time_stop': 151, 'bull_use_sma': True, 'bull_use_ema': True, 'bull_use_atr': True, 'bull_use_adx': True, 'bull_use_spike': True, 'bull_rsi_required': True, 'bear_strategy': 'mean_reversion', 'bear_bb_std_mult': 2.8955989324423994, 'bear_rsi_os': 32, 'bear_rsi_ob': 60, 'bear_adx_thresh': 8.999632211730908, 'bear_atr_min_pct': 0.02164534967757048, 'bear_atr_max_pct': 0.024622590391204246, 'bear_tp_mult': 2.0386657890825415, 'bear_tsl_mult': 0.17349179193908087, 'bear_time_stop': 86, 'bear_use_sma': False, 'bear_use_ema': False, 'bear_use_atr': False, 'bear_use_adx': True, 'bear_use_spike': True, 'bear_rsi_required': False, 'sideways_strategy': 'mean_reversion', 'sideways_bb_std_mult': 3.075333931562973, 'sideways_rsi_os': 14, 'sideways_rsi_ob': 79, 'sideways_adx_thresh': 6.831248532659387, 'sideways_atr_min_pct': 0.02599365537822896, 'sideways_atr_max_pct': 0.0579210313495509, 'sideways_tp_mult': 1.3687028824620286, 'sideways_tsl_mult': 0.4721752438766302, 'sideways_time_stop': 72, 'sideways_use_sma': True, 'sideways_use_ema': False, 'sideways_use_atr': True, 'sideways_use_adx': True, 'sideways_use_spike': False, 'sideways_rsi_required': False}.
[I 2025-09-01 14:55:59,817] Trial 607 finished with values: [-1000000000.0, 1000000000.0] and parameters: {'p_sma': 40, 'p_std': 59, 'p_atr': 13, 'p_adx': 8, 'rsi_period': 77, 'ema1': 10, 'ema2': 57, 'slip_atr_k': 0.10305046544967894, 'slip_spread_k': 0.5850079812749531, 'spread_hl_frac': 0.04770148856211232, 'bb_std_mult': 3.444238578761144, 'rsi_os': 19, 'rsi_ob': 55, 'vol_spike': 0.11506955862982607, 'adx_thresh': 5.553097674797579, 'atr_min_pct': 0.012457650834214047, 'atr_max_pct': 0.03126443404481173, 'tp_mult': 2.1062129586149254, 'tsl_mult': 0.6946763927132363, 'strategy': 'mean_reversion', 'time_stop': 191, 'use_sma': True, 'use_atr': False, 'use_adx': True, 'use_ema': False, 'use_spike': False, 'rsi_required': True, 'edge_k': 0.9903428470112682, 'edge_cap': 0.9170090466990902, 'bull_strategy': 'breakout', 'bull_bb_std_mult': 3.0233916591548105, 'bull_rsi_os': 11, 'bull_rsi_ob': 78, 'bull_adx_thresh': 11.198611423695965, 'bull_atr_min_pct': 0.013152507716491313, 'bull_atr_max_pct': 0.13121277886795119, 'bull_tp_mult': 1.6059515313075903, 'bull_tsl_mult': 0.7278238755374029, 'bull_time_stop': 168, 'bull_use_sma': True, 'bull_use_ema': False, 'bull_use_atr': False, 'bull_use_adx': True, 'bull_use_spike': True, 'bull_rsi_required': False, 'bear_strategy': 'mean_reversion', 'bear_bb_std_mult': 2.7128583452300883, 'bear_rsi_os': 6, 'bear_rsi_ob': 67, 'bear_adx_thresh': 9.8935918262195, 'bear_atr_min_pct': 0.004344927857848628, 'bear_atr_max_pct': 0.11363324262755978, 'bear_tp_mult': 2.9603426983723855, 'bear_tsl_mult': 0.532440232933563, 'bear_time_stop': 92, 'bear_use_sma': False, 'bear_use_ema': False, 'bear_use_atr': False, 'bear_use_adx': True, 'bear_use_spike': True, 'bear_rsi_required': False, 'sideways_strategy': 'breakout', 'sideways_bb_std_mult': 1.2878491550794045, 'sideways_rsi_os': 32, 'sideways_rsi_ob': 67, 'sideways_adx_thresh': 25.964299496449442, 'sideways_atr_min_pct': 0.0045398447252768415, 'sideways_atr_max_pct': 0.10153445604017236, 'sideways_tp_mult': 1.3668811002498862, 'sideways_tsl_mult': 0.4978972999715625, 'sideways_time_stop': 133, 'sideways_use_sma': True, 'sideways_use_ema': False, 'sideways_use_atr': True, 'sideways_use_adx': True, 'sideways_use_spike': False, 'sideways_rsi_required': True}.
[I 2025-09-01 14:55:59,817] Trial 605 finished with values: [-1000000000.0, 1000000000.0] and parameters: {'p_sma': 29, 'p_std': 28, 'p_atr': 25, 'p_adx': 19, 'rsi_period': 77, 'ema1': 21, 'ema2': 57, 'slip_atr_k': 0.24944409107963933, 'slip_spread_k': 0.5810947145108945, 'spread_hl_frac': 0.04794092797379246, 'bb_std_mult': 3.443798981941605, 'rsi_os': 48, 'rsi_ob': 54, 'vol_spike': 0.19243566406040374, 'adx_thresh': 5.558589740649582, 'atr_min_pct': 0.013264354888331546, 'atr_max_pct': 0.05025965696819951, 'tp_mult': 2.1469334178777144, 'tsl_mult': 0.4683138655870169, 'strategy': 'mean_reversion', 'time_stop': 130, 'use_sma': True, 'use_atr': False, 'use_adx': True, 'use_ema': False, 'use_spike': True, 'rsi_required': True, 'edge_k': 0.18458584398397265, 'edge_cap': 0.419291610195072, 'bull_strategy': 'breakout', 'bull_bb_std_mult': 1.039980384978927, 'bull_rsi_os': 11, 'bull_rsi_ob': 78, 'bull_adx_thresh': 11.215250232679322, 'bull_atr_min_pct': 0.013164521271465907, 'bull_atr_max_pct': 0.13295669204596755, 'bull_tp_mult': 1.014329906397284, 'bull_tsl_mult': 0.4609961360698558, 'bull_time_stop': 152, 'bull_use_sma': True, 'bull_use_ema': True, 'bull_use_atr': True, 'bull_use_adx': True, 'bull_use_spike': True, 'bull_rsi_required': False, 'bear_strategy': 'mean_reversion', 'bear_bb_std_mult': 2.7036275560295917, 'bear_rsi_os': 36, 'bear_rsi_ob': 61, 'bear_adx_thresh': 8.95587941048461, 'bear_atr_min_pct': 0.004515752760522315, 'bear_atr_max_pct': 0.019425654030507375, 'bear_tp_mult': 1.461584899311562, 'bear_tsl_mult': 0.17850534608458166, 'bear_time_stop': 87, 'bear_use_sma': False, 'bear_use_ema': False, 'bear_use_atr': False, 'bear_use_adx': True, 'bear_use_spike': True, 'bear_rsi_required': False, 'sideways_strategy': 'mean_reversion', 'sideways_bb_std_mult': 3.2655564499022907, 'sideways_rsi_os': 40, 'sideways_rsi_ob': 89, 'sideways_adx_thresh': 25.929218539025815, 'sideways_atr_min_pct': 0.017004389093719423, 'sideways_atr_max_pct': 0.10165814337427084, 'sideways_tp_mult': 1.3738567372672121, 'sideways_tsl_mult': 0.38790645282999336, 'sideways_time_stop': 281, 'sideways_use_sma': True, 'sideways_use_ema': False, 'sideways_use_atr': True, 'sideways_use_adx': True, 'sideways_use_spike': False, 'sideways_rsi_required': False}.
[I 2025-09-01 14:56:47,364] Trial 610 finished with values: [-1000000000.0, 1000000000.0] and parameters: {'p_sma': 27, 'p_std': 55, 'p_atr': 26, 'p_adx': 8, 'rsi_period': 35, 'ema1': 8, 'ema2': 59, 'slip_atr_k': 0.016747583849437468, 'slip_spread_k': 0.527684108846447, 'spread_hl_frac': 0.0102098512429008, 'bb_std_mult': 1.395913158565064, 'rsi_os': 43, 'rsi_ob': 51, 'vol_spike': 0.04414295286768913, 'adx_thresh': 17.86749937462428, 'atr_min_pct': 0.011097783976108947, 'atr_max_pct': 0.09213119952844388, 'tp_mult': 2.589761170950348, 'tsl_mult': 0.396043019544486, 'strategy': 'breakout', 'time_stop': 142, 'use_sma': True, 'use_atr': True, 'use_adx': True, 'use_ema': True, 'use_spike': False, 'rsi_required': True, 'edge_k': 0.2789699900814881, 'edge_cap': 0.9347302472317813, 'bull_strategy': 'breakout', 'bull_bb_std_mult': 3.2393422706063286, 'bull_rsi_os': 36, 'bull_rsi_ob': 76, 'bull_adx_thresh': 30.326046784992354, 'bull_atr_min_pct': 0.0117603178340225, 'bull_atr_max_pct': 0.1250941197847346, 'bull_tp_mult': 1.5537209829230507, 'bull_tsl_mult': 0.5214810017607694, 'bull_time_stop': 173, 'bull_use_sma': False, 'bull_use_ema': True, 'bull_use_atr': False, 'bull_use_adx': False, 'bull_use_spike': False, 'bull_rsi_required': True, 'bear_strategy': 'breakout', 'bear_bb_std_mult': 2.1791367873867333, 'bear_rsi_os': 39, 'bear_rsi_ob': 57, 'bear_adx_thresh': 32.38203355297877, 'bear_atr_min_pct': 0.028499289238638332, 'bear_atr_max_pct': 0.11718129840128945, 'bear_tp_mult': 2.1424961808498098, 'bear_tsl_mult': 0.13632464615286002, 'bear_time_stop': 103, 'bear_use_sma': False, 'bear_use_ema': False, 'bear_use_atr': True, 'bear_use_adx': False, 'bear_use_spike': True, 'bear_rsi_required': False, 'sideways_strategy': 'breakout', 'sideways_bb_std_mult': 2.2545065460823968, 'sideways_rsi_os': 29, 'sideways_rsi_ob': 88, 'sideways_adx_thresh': 24.730202244687664, 'sideways_atr_min_pct': 0.006651995165780848, 'sideways_atr_max_pct': 0.012884623359524519, 'sideways_tp_mult': 2.3698924820867684, 'sideways_tsl_mult': 0.6873228247583311, 'sideways_time_stop': 252, 'sideways_use_sma': True, 'sideways_use_ema': True, 'sideways_use_atr': True, 'sideways_use_adx': True, 'sideways_use_spike': True, 'sideways_rsi_required': False}.
[I 2025-09-01 14:56:47,693] Trial 611 finished with values: [-0.014667190256244966, 0.014415646191552256] and parameters: {'p_sma': 27, 'p_std': 22, 'p_atr': 26, 'p_adx': 8, 'rsi_period': 35, 'ema1': 6, 'ema2': 59, 'slip_atr_k': 0.22829012111441815, 'slip_spread_k': 0.534718045179253, 'spread_hl_frac': 0.0317594790054502, 'bb_std_mult': 3.242529045047247, 'rsi_os': 43, 'rsi_ob': 51, 'vol_spike': 0.06567354897528672, 'adx_thresh': 26.702817657534258, 'atr_min_pct': 0.011058634631447925, 'atr_max_pct': 0.037540692533024535, 'tp_mult': 1.737491114593326, 'tsl_mult': 0.653515627135872, 'strategy': 'breakout', 'time_stop': 111, 'use_sma': True, 'use_atr': True, 'use_adx': True, 'use_ema': True, 'use_spike': False, 'rsi_required': True, 'edge_k': 0.27467710603056783, 'edge_cap': 0.2900858174142712, 'bull_strategy': 'breakout', 'bull_bb_std_mult': 3.4176399594318276, 'bull_rsi_os': 55, 'bull_rsi_ob': 83, 'bull_adx_thresh': 11.963692521731419, 'bull_atr_min_pct': 0.0034792668029614716, 'bull_atr_max_pct': 0.12617595531647063, 'bull_tp_mult': 1.9272904683128889, 'bull_tsl_mult': 0.515228862678476, 'bull_time_stop': 164, 'bull_use_sma': False, 'bull_use_ema': True, 'bull_use_atr': False, 'bull_use_adx': False, 'bull_use_spike': False, 'bull_rsi_required': True, 'bear_strategy': 'breakout', 'bear_bb_std_mult': 2.6107271819039397, 'bear_rsi_os': 34, 'bear_rsi_ob': 56, 'bear_adx_thresh': 24.48491669956703, 'bear_atr_min_pct': 0.016275779809975233, 'bear_atr_max_pct': 0.11786172941623303, 'bear_tp_mult': 1.3245782272972517, 'bear_tsl_mult': 0.12933139809593794, 'bear_time_stop': 216, 'bear_use_sma': False, 'bear_use_ema': False, 'bear_use_atr': True, 'bear_use_adx': False, 'bear_use_spike': True, 'bear_rsi_required': False, 'sideways_strategy': 'breakout', 'sideways_bb_std_mult': 1.9269503580842118, 'sideways_rsi_os': 50, 'sideways_rsi_ob': 92, 'sideways_adx_thresh': 24.783333044909053, 'sideways_atr_min_pct': 0.004587934018988294, 'sideways_atr_max_pct': 0.11288001331465664, 'sideways_tp_mult': 1.4279058365458674, 'sideways_tsl_mult': 0.3725528914149098, 'sideways_time_stop': 253, 'sideways_use_sma': True, 'sideways_use_ema': True, 'sideways_use_atr': True, 'sideways_use_adx': True, 'sideways_use_spike': True, 'sideways_rsi_required': False}.
[I 2025-09-01 14:56:48,006] Trial 608 finished with values: [-1000000000.0, 1000000000.0] and parameters: {'p_sma': 45, 'p_std': 21, 'p_atr': 25, 'p_adx': 8, 'rsi_period': 41, 'ema1': 10, 'ema2': 56, 'slip_atr_k': 0.008672308850886457, 'slip_spread_k': 0.17558914469219905, 'spread_hl_frac': 0.04745523678404418, 'bb_std_mult': 3.5485167739414356, 'rsi_os': 26, 'rsi_ob': 95, 'vol_spike': 0.06618340417634014, 'adx_thresh': 9.965428809816837, 'atr_min_pct': 0.01249855983599036, 'atr_max_pct': 0.03180752271610582, 'tp_mult': 2.678938406498742, 'tsl_mult': 0.8800179640703085, 'strategy': 'breakout', 'time_stop': 138, 'use_sma': True, 'use_atr': False, 'use_adx': True, 'use_ema': False, 'use_spike': False, 'rsi_required': True, 'edge_k': 0.9901359723403338, 'edge_cap': 0.9415585510803152, 'bull_strategy': 'breakout', 'bull_bb_std_mult': 2.9967500032057903, 'bull_rsi_os': 13, 'bull_rsi_ob': 77, 'bull_adx_thresh': 11.877756928901706, 'bull_atr_min_pct': 0.011833734977510307, 'bull_atr_max_pct': 0.06963829282941739, 'bull_tp_mult': 1.907257894096185, 'bull_tsl_mult': 0.5119727431698454, 'bull_time_stop': 176, 'bull_use_sma': False, 'bull_use_ema': True, 'bull_use_atr': False, 'bull_use_adx': True, 'bull_use_spike': False, 'bull_rsi_required': False, 'bear_strategy': 'breakout', 'bear_bb_std_mult': 2.1845664435055423, 'bear_rsi_os': 35, 'bear_rsi_ob': 85, 'bear_adx_thresh': 7.045192707216212, 'bear_atr_min_pct': 0.015576642630377707, 'bear_atr_max_pct': 0.08935945726194248, 'bear_tp_mult': 2.1454659830285636, 'bear_tsl_mult': 0.12409288850790857, 'bear_time_stop': 231, 'bear_use_sma': False, 'bear_use_ema': False, 'bear_use_atr': True, 'bear_use_adx': False, 'bear_use_spike': True, 'bear_rsi_required': False, 'sideways_strategy': 'breakout', 'sideways_bb_std_mult': 3.0408789094391797, 'sideways_rsi_os': 11, 'sideways_rsi_ob': 88, 'sideways_adx_thresh': 25.711694369854474, 'sideways_atr_min_pct': 0.006485776592057544, 'sideways_atr_max_pct': 0.11273376146856792, 'sideways_tp_mult': 1.4819747558005048, 'sideways_tsl_mult': 0.4310230741759926, 'sideways_time_stop': 47, 'sideways_use_sma': True, 'sideways_use_ema': True, 'sideways_use_atr': True, 'sideways_use_adx': True, 'sideways_use_spike': True, 'sideways_rsi_required': False}.
[I 2025-09-01 14:56:48,379] Trial 609 finished with values: [-1000000000.0, 1000000000.0] and parameters: {'p_sma': 55, 'p_std': 21, 'p_atr': 25, 'p_adx': 21, 'rsi_period': 80, 'ema1': 6, 'ema2': 25, 'slip_atr_k': 0.19491486216455128, 'slip_spread_k': 0.5327967230489149, 'spread_hl_frac': 0.047356739245497034, 'bb_std_mult': 3.540341517507191, 'rsi_os': 43, 'rsi_ob': 55, 'vol_spike': 0.12062529401723834, 'adx_thresh': 5.557158019824224, 'atr_min_pct': 0.012705719810230528, 'atr_max_pct': 0.03736737272219909, 'tp_mult': 1.7642587891069275, 'tsl_mult': 0.8609585758280112, 'strategy': 'breakout', 'time_stop': 193, 'use_sma': True, 'use_atr': False, 'use_adx': True, 'use_ema': False, 'use_spike': False, 'rsi_required': True, 'edge_k': 0.6724458547207544, 'edge_cap': 0.942324322233285, 'bull_strategy': 'breakout', 'bull_bb_std_mult': 3.0202270082100244, 'bull_rsi_os': 55, 'bull_rsi_ob': 57, 'bull_adx_thresh': 19.797587315586995, 'bull_atr_min_pct': 0.01300777427951391, 'bull_atr_max_pct': 0.12650401146323229, 'bull_tp_mult': 1.894696891801466, 'bull_tsl_mult': 0.7209119533446859, 'bull_time_stop': 168, 'bull_use_sma': False, 'bull_use_ema': True, 'bull_use_atr': False, 'bull_use_adx': True, 'bull_use_spike': False, 'bull_rsi_required': False, 'bear_strategy': 'breakout', 'bear_bb_std_mult': 2.610987807713341, 'bear_rsi_os': 35, 'bear_rsi_ob': 85, 'bear_adx_thresh': 7.122671763490744, 'bear_atr_min_pct': 0.0142361414159464, 'bear_atr_max_pct': 0.019590449829320566, 'bear_tp_mult': 1.242505005853261, 'bear_tsl_mult': 0.5388155273903955, 'bear_time_stop': 76, 'bear_use_sma': False, 'bear_use_ema': False, 'bear_use_atr': True, 'bear_use_adx': False, 'bear_use_spike': True, 'bear_rsi_required': False, 'sideways_strategy': 'breakout', 'sideways_bb_std_mult': 2.9467439934883695, 'sideways_rsi_os': 21, 'sideways_rsi_ob': 88, 'sideways_adx_thresh': 26.077259251626778, 'sideways_atr_min_pct': 0.006701250221282123, 'sideways_atr_max_pct': 0.049223491517646815, 'sideways_tp_mult': 2.447241980309204, 'sideways_tsl_mult': 0.3888005430244419, 'sideways_time_stop': 253, 'sideways_use_sma': True, 'sideways_use_ema': True, 'sideways_use_atr': True, 'sideways_use_adx': True, 'sideways_use_spike': True, 'sideways_rsi_required': False}.
