[I 2025-09-01 14:02:29,881] Trial 243 finished with values: [-1000000000.0, 1000000000.0] and parameters: {'p_sma': 12, 'p_std': 10, 'p_atr': 25, 'p_adx': 27, 'rsi_period': 25, 'ema1': 7, 'ema2': 29, 'slip_atr_k': 0.087675829580664, 'slip_spread_k': 0.11674622694499892, 'spread_hl_frac': 0.010426145492778701, 'bb_std_mult': 1.9007941759240248, 'rsi_os': 43, 'rsi_ob': 76, 'vol_spike': 0.2928953573440989, 'adx_thresh': 7.24146237022477, 'atr_min_pct': 0.009293066156918337, 'atr_max_pct': 0.012675799531035963, 'tp_mult': 2.040790135404592, 'tsl_mult': 0.05784181854374425, 'strategy': 'breakout', 'time_stop': 89, 'use_sma': False, 'use_atr': True, 'use_adx': False, 'use_ema': False, 'use_spike': True, 'rsi_required': False, 'edge_k': 1.2059338524699876, 'edge_cap': 0.16974574038199527, 'bull_strategy': 'mean_reversion', 'bull_bb_std_mult': 1.2666835049262515, 'bull_rsi_os': 28, 'bull_rsi_ob': 60, 'bull_adx_thresh': 12.308704886095828, 'bull_atr_min_pct': 0.014102738032720113, 'bull_atr_max_pct': 0.12000552240785664, 'bull_tp_mult': 2.30872058674904, 'bull_tsl_mult': 0.26682336541702767, 'bull_time_stop': 82, 'bull_use_sma': False, 'bull_use_ema': True, 'bull_use_atr': False, 'bull_use_adx': True, 'bull_use_spike': False, 'bull_rsi_required': False, 'bear_strategy': 'breakout', 'bear_bb_std_mult': 2.8922760244169967, 'bear_rsi_os': 15, 'bear_rsi_ob': 53, 'bear_adx_thresh': 32.22520251825396, 'bear_atr_min_pct': 0.02378658503364558, 'bear_atr_max_pct': 0.06885729268998196, 'bear_tp_mult': 1.9089709924836835, 'bear_tsl_mult': 0.21538535539482057, 'bear_time_stop': 42, 'bear_use_sma': True, 'bear_use_ema': True, 'bear_use_atr': False, 'bear_use_adx': True, 'bear_use_spike': False, 'bear_rsi_required': True, 'sideways_strategy': 'breakout', 'sideways_bb_std_mult': 2.1230553178981606, 'sideways_rsi_os': 38, 'sideways_rsi_ob': 48, 'sideways_adx_thresh': 29.212973595095498, 'sideways_atr_min_pct': 0.0079612426560718, 'sideways_atr_max_pct': 0.08828448464599956, 'sideways_tp_mult': 2.8569418270761, 'sideways_tsl_mult': 0.7273702397422623, 'sideways_time_stop': 255, 'sideways_use_sma': False, 'sideways_use_ema': False, 'sideways_use_atr': False, 'sideways_use_adx': False, 'sideways_use_spike': False, 'sideways_rsi_required': True}.
[I 2025-09-01 14:02:32,468] Trial 244 finished with values: [-1000000000.0, 1000000000.0] and parameters: {'p_sma': 11, 'p_std': 10, 'p_atr': 21, 'p_adx': 27, 'rsi_period': 61, 'ema1': 25, 'ema2': 27, 'slip_atr_k': 0.045745900806160936, 'slip_spread_k': 0.4878705489172214, 'spread_hl_frac': 0.009055562634628563, 'bb_std_mult': 1.7401212835864388, 'rsi_os': 45, 'rsi_ob': 76, 'vol_spike': 0.2589677250375656, 'adx_thresh': 7.525000863166449, 'atr_min_pct': 0.016879858084504182, 'atr_max_pct': 0.13454880605055153, 'tp_mult': 1.9922659078885587, 'tsl_mult': 0.6630067875890646, 'strategy': 'breakout', 'time_stop': 90, 'use_sma': False, 'use_atr': True, 'use_adx': False, 'use_ema': False, 'use_spike': True, 'rsi_required': False, 'edge_k': 1.2920348014024383, 'edge_cap': 0.20751119588348005, 'bull_strategy': 'breakout', 'bull_bb_std_mult': 1.3412277880874646, 'bull_rsi_os': 20, 'bull_rsi_ob': 50, 'bull_adx_thresh': 10.165135443800882, 'bull_atr_min_pct': 0.012102808986433112, 'bull_atr_max_pct': 0.12914593554888107, 'bull_tp_mult': 1.4208691104888247, 'bull_tsl_mult': 0.8250726572223539, 'bull_time_stop': 84, 'bull_use_sma': False, 'bull_use_ema': True, 'bull_use_atr': False, 'bull_use_adx': True, 'bull_use_spike': False, 'bull_rsi_required': False, 'bear_strategy': 'breakout', 'bear_bb_std_mult': 2.9710348651873812, 'bear_rsi_os': 55, 'bear_rsi_ob': 53, 'bear_adx_thresh': 15.350865058674568, 'bear_atr_min_pct': 0.0062510357711360685, 'bear_atr_max_pct': 0.068463208331509, 'bear_tp_mult': 1.8713119888203344, 'bear_tsl_mult': 0.20582034353851186, 'bear_time_stop': 275, 'bear_use_sma': True, 'bear_use_ema': True, 'bear_use_atr': False, 'bear_use_adx': True, 'bear_use_spike': False, 'bear_rsi_required': True, 'sideways_strategy': 'breakout', 'sideways_bb_std_mult': 0.8700874932516031, 'sideways_rsi_os': 10, 'sideways_rsi_ob': 51, 'sideways_adx_thresh': 27.86324656508365, 'sideways_atr_min_pct': 0.028132583163632686, 'sideways_atr_max_pct': 0.12067774134661041, 'sideways_tp_mult': 2.869411283377196, 'sideways_tsl_mult': 0.7763254041470703, 'sideways_time_stop': 194, 'sideways_use_sma': False, 'sideways_use_ema': True, 'sideways_use_atr': True, 'sideways_use_adx': False, 'sideways_use_spike': False, 'sideways_rsi_required': False}.
[I 2025-09-01 14:02:33,042] Trial 245 finished with values: [-1000000000.0, 1000000000.0] and parameters: {'p_sma': 11, 'p_std': 26, 'p_atr': 22, 'p_adx': 9, 'rsi_period': 30, 'ema1': 22, 'ema2': 26, 'slip_atr_k': 0.011253162110821122, 'slip_spread_k': 0.48542078227348034, 'spread_hl_frac': 0.009002191996911066, 'bb_std_mult': 0.9645396642135766, 'rsi_os': 45, 'rsi_ob': 75, 'vol_spike': 0.09608633646190955, 'adx_thresh': 27.0545914358402, 'atr_min_pct': 0.003692012477429167, 'atr_max_pct': 0.01627642228179671, 'tp_mult': 1.98801184473049, 'tsl_mult': 0.8956564152464972, 'strategy': 'breakout', 'time_stop': 92, 'use_sma': False, 'use_atr': True, 'use_adx': False, 'use_ema': False, 'use_spike': True, 'rsi_required': False, 'edge_k': 1.2829781290896751, 'edge_cap': 0.239570787002106, 'bull_strategy': 'breakout', 'bull_bb_std_mult': 1.2688225173676966, 'bull_rsi_os': 47, 'bull_rsi_ob': 52, 'bull_adx_thresh': 34.131446637609315, 'bull_atr_min_pct': 0.012215207558353876, 'bull_atr_max_pct': 0.1277163574809288, 'bull_tp_mult': 1.5366108697189893, 'bull_tsl_mult': 0.544658724708918, 'bull_time_stop': 156, 'bull_use_sma': False, 'bull_use_ema': False, 'bull_use_atr': False, 'bull_use_adx': False, 'bull_use_spike': False, 'bull_rsi_required': False, 'bear_strategy': 'breakout', 'bear_bb_std_mult': 2.940718502991246, 'bear_rsi_os': 15, 'bear_rsi_ob': 46, 'bear_adx_thresh': 5.622814574643394, 'bear_atr_min_pct': 0.023490352630500297, 'bear_atr_max_pct': 0.01022044230765054, 'bear_tp_mult': 1.8550070503312381, 'bear_tsl_mult': 0.21008568651277124, 'bear_time_stop': 295, 'bear_use_sma': False, 'bear_use_ema': True, 'bear_use_atr': True, 'bear_use_adx': True, 'bear_use_spike': False, 'bear_rsi_required': True, 'sideways_strategy': 'breakout', 'sideways_bb_std_mult': 2.61227351833056, 'sideways_rsi_os': 11, 'sideways_rsi_ob': 95, 'sideways_adx_thresh': 29.195663152065368, 'sideways_atr_min_pct': 0.016029931714085188, 'sideways_atr_max_pct': 0.12049129676531653, 'sideways_tp_mult': 1.0107757331966225, 'sideways_tsl_mult': 0.7732218194524381, 'sideways_time_stop': 135, 'sideways_use_sma': False, 'sideways_use_ema': True, 'sideways_use_atr': True, 'sideways_use_adx': False, 'sideways_use_spike': True, 'sideways_rsi_required': False}.
[I 2025-09-01 14:02:33,574] Trial 246 finished with values: [-1000000000.0, 1000000000.0] and parameters: {'p_sma': 11, 'p_std': 43, 'p_atr': 7, 'p_adx': 26, 'rsi_period': 30, 'ema1': 8, 'ema2': 27, 'slip_atr_k': 0.009528168437788448, 'slip_spread_k': 0.12754495687769685, 'spread_hl_frac': 0.008775369566102711, 'bb_std_mult': 1.9149176437899265, 'rsi_os': 45, 'rsi_ob': 74, 'vol_spike': 0.26130313617940015, 'adx_thresh': 23.944215244193053, 'atr_min_pct': 0.023802083949365276, 'atr_max_pct': 0.01711126515850453, 'tp_mult': 1.0105679267608436, 'tsl_mult': 0.6640055203226364, 'strategy': 'breakout', 'time_stop': 85, 'use_sma': True, 'use_atr': True, 'use_adx': True, 'use_ema': False, 'use_spike': True, 'rsi_required': False, 'edge_k': 1.8838164248398526, 'edge_cap': 0.7204396682116578, 'bull_strategy': 'breakout', 'bull_bb_std_mult': 2.5674944919178344, 'bull_rsi_os': 12, 'bull_rsi_ob': 54, 'bull_adx_thresh': 34.34183053359536, 'bull_atr_min_pct': 0.012045539110308378, 'bull_atr_max_pct': 0.12909290218937353, 'bull_tp_mult': 1.534041781944146, 'bull_tsl_mult': 0.5314979784017535, 'bull_time_stop': 102, 'bull_use_sma': False, 'bull_use_ema': False, 'bull_use_atr': False, 'bull_use_adx': False, 'bull_use_spike': False, 'bull_rsi_required': True, 'bear_strategy': 'breakout', 'bear_bb_std_mult': 2.9510005912067343, 'bear_rsi_os': 44, 'bear_rsi_ob': 46, 'bear_adx_thresh': 5.7153584076292985, 'bear_atr_min_pct': 0.023663111692223793, 'bear_atr_max_pct': 0.010910254561564636, 'bear_tp_mult': 1.8679919434871595, 'bear_tsl_mult': 0.2060045865265519, 'bear_time_stop': 50, 'bear_use_sma': False, 'bear_use_ema': False, 'bear_use_atr': True, 'bear_use_adx': False, 'bear_use_spike': True, 'bear_rsi_required': False, 'sideways_strategy': 'breakout', 'sideways_bb_std_mult': 0.8565336894669909, 'sideways_rsi_os': 11, 'sideways_rsi_ob': 48, 'sideways_adx_thresh': 29.123479912333337, 'sideways_atr_min_pct': 0.02286305755937347, 'sideways_atr_max_pct': 0.12149665145974106, 'sideways_tp_mult': 2.2561469080336636, 'sideways_tsl_mult': 0.9491151933416053, 'sideways_time_stop': 91, 'sideways_use_sma': True, 'sideways_use_ema': True, 'sideways_use_atr': True, 'sideways_use_adx': False, 'sideways_use_spike': True, 'sideways_rsi_required': False}.
[I 2025-09-01 14:02:33,751] Trial 248 finished with values: [-1000000000.0, 1000000000.0] and parameters: {'p_sma': 32, 'p_std': 42, 'p_atr': 12, 'p_adx': 26, 'rsi_period': 30, 'ema1': 8, 'ema2': 26, 'slip_atr_k': 0.009014424115022696, 'slip_spread_k': 0.5851358386812249, 'spread_hl_frac': 0.009061390065885333, 'bb_std_mult': 2.07620214729883, 'rsi_os': 44, 'rsi_ob': 74, 'vol_spike': 0.09579080406608353, 'adx_thresh': 14.576052114081842, 'atr_min_pct': 0.023483447235784917, 'atr_max_pct': 0.02107498009077368, 'tp_mult': 1.8928565778506046, 'tsl_mult': 0.9024803977423209, 'strategy': 'mean_reversion', 'time_stop': 228, 'use_sma': True, 'use_atr': False, 'use_adx': True, 'use_ema': True, 'use_spike': True, 'rsi_required': True, 'edge_k': 0.1379371016954799, 'edge_cap': 0.24185820480516854, 'bull_strategy': 'breakout', 'bull_bb_std_mult': 2.1590350536092284, 'bull_rsi_os': 13, 'bull_rsi_ob': 55, 'bull_adx_thresh': 33.89043602753648, 'bull_atr_min_pct': 0.011500076743857928, 'bull_atr_max_pct': 0.13158818408122214, 'bull_tp_mult': 1.5219111352285102, 'bull_tsl_mult': 0.538408266002806, 'bull_time_stop': 300, 'bull_use_sma': False, 'bull_use_ema': False, 'bull_use_atr': True, 'bull_use_adx': False, 'bull_use_spike': True, 'bull_rsi_required': True, 'bear_strategy': 'mean_reversion', 'bear_bb_std_mult': 2.5682504560716137, 'bear_rsi_os': 16, 'bear_rsi_ob': 54, 'bear_adx_thresh': 29.904635357105793, 'bear_atr_min_pct': 0.004466643176864013, 'bear_atr_max_pct': 0.012708944871340763, 'bear_tp_mult': 1.9927902048484993, 'bear_tsl_mult': 0.16965371883621264, 'bear_time_stop': 51, 'bear_use_sma': False, 'bear_use_ema': False, 'bear_use_atr': True, 'bear_use_adx': False, 'bear_use_spike': True, 'bear_rsi_required': False, 'sideways_strategy': 'mean_reversion', 'sideways_bb_std_mult': 3.4296461283392805, 'sideways_rsi_os': 35, 'sideways_rsi_ob': 85, 'sideways_adx_thresh': 27.92397609598367, 'sideways_atr_min_pct': 0.015198170670026158, 'sideways_atr_max_pct': 0.09297198713531821, 'sideways_tp_mult': 2.5380122773869593, 'sideways_tsl_mult': 0.7540973929524175, 'sideways_time_stop': 167, 'sideways_use_sma': True, 'sideways_use_ema': True, 'sideways_use_atr': True, 'sideways_use_adx': True, 'sideways_use_spike': True, 'sideways_rsi_required': False}.
[I 2025-09-01 14:03:10,162] Trial 249 finished with values: [-0.0031050084301125214, 0.0046043905996110334] and parameters: {'p_sma': 29, 'p_std': 53, 'p_atr': 7, 'p_adx': 14, 'rsi_period': 37, 'ema1': 29, 'ema2': 50, 'slip_atr_k': 0.003992069842719337, 'slip_spread_k': 0.7739365518707505, 'spread_hl_frac': 0.025392343901992683, 'bb_std_mult': 1.1297519105091531, 'rsi_os': 32, 'rsi_ob': 74, 'vol_spike': 0.10952343493782205, 'adx_thresh': 5.872154652589142, 'atr_min_pct': 0.012172632441810608, 'atr_max_pct': 0.021815031131162097, 'tp_mult': 1.7322725966415655, 'tsl_mult': 0.797943189214919, 'strategy': 'mean_reversion', 'time_stop': 249, 'use_sma': True, 'use_atr': False, 'use_adx': True, 'use_ema': True, 'use_spike': True, 'rsi_required': True, 'edge_k': 1.5327190605237089, 'edge_cap': 0.8401736659185632, 'bull_strategy': 'breakout', 'bull_bb_std_mult': 2.739751455368902, 'bull_rsi_os': 13, 'bull_rsi_ob': 55, 'bull_adx_thresh': 10.451678013562036, 'bull_atr_min_pct': 0.011321760051524275, 'bull_atr_max_pct': 0.1315858230960854, 'bull_tp_mult': 1.4881571372808131, 'bull_tsl_mult': 0.5722778420954893, 'bull_time_stop': 103, 'bull_use_sma': False, 'bull_use_ema': False, 'bull_use_atr': True, 'bull_use_adx': False, 'bull_use_spike': True, 'bull_rsi_required': True, 'bear_strategy': 'mean_reversion', 'bear_bb_std_mult': 2.5955178886582306, 'bear_rsi_os': 35, 'bear_rsi_ob': 54, 'bear_adx_thresh': 5.991358763628029, 'bear_atr_min_pct': 0.004293443750176626, 'bear_atr_max_pct': 0.11557579073283941, 'bear_tp_mult': 2.0009669408818143, 'bear_tsl_mult': 0.345167901937749, 'bear_time_stop': 92, 'bear_use_sma': False, 'bear_use_ema': False, 'bear_use_atr': True, 'bear_use_adx': False, 'bear_use_spike': True, 'bear_rsi_required': False, 'sideways_strategy': 'mean_reversion', 'sideways_bb_std_mult': 0.7254129972638632, 'sideways_rsi_os': 34, 'sideways_rsi_ob': 87, 'sideways_adx_thresh': 28.1047350418229, 'sideways_atr_min_pct': 0.015201351978861756, 'sideways_atr_max_pct': 0.11761493877101308, 'sideways_tp_mult': 2.2583510976227936, 'sideways_tsl_mult': 0.7465834204627756, 'sideways_time_stop': 200, 'sideways_use_sma': True, 'sideways_use_ema': True, 'sideways_use_atr': True, 'sideways_use_adx': True, 'sideways_use_spike': True, 'sideways_rsi_required': False}.
[I 2025-09-01 14:03:10,567] Trial 247 finished with values: [-1000000000.0, 1000000000.0] and parameters: {'p_sma': 11, 'p_std': 42, 'p_atr': 24, 'p_adx': 28, 'rsi_period': 30, 'ema1': 25, 'ema2': 27, 'slip_atr_k': 0.009584236299295317, 'slip_spread_k': 0.35950841382307086, 'spread_hl_frac': 0.008656224792450075, 'bb_std_mult': 1.6303235498627495, 'rsi_os': 45, 'rsi_ob': 74, 'vol_spike': 0.09652370669937316, 'adx_thresh': 13.857222251308917, 'atr_min_pct': 0.002829065665272792, 'atr_max_pct': 0.1363316699858198, 'tp_mult': 1.989818486311475, 'tsl_mult': 0.740247372406797, 'strategy': 'mean_reversion', 'time_stop': 228, 'use_sma': True, 'use_atr': False, 'use_adx': True, 'use_ema': True, 'use_spike': True, 'rsi_required': True, 'edge_k': 1.1355730545543943, 'edge_cap': 0.843661011041518, 'bull_strategy': 'breakout', 'bull_bb_std_mult': 2.579246578837086, 'bull_rsi_os': 20, 'bull_rsi_ob': 54, 'bull_adx_thresh': 34.00348300053899, 'bull_atr_min_pct': 0.012040421413783912, 'bull_atr_max_pct': 0.13076490819238848, 'bull_tp_mult': 1.4795806516684975, 'bull_tsl_mult': 0.8318704988552589, 'bull_time_stop': 101, 'bull_use_sma': False, 'bull_use_ema': False, 'bull_use_atr': True, 'bull_use_adx': False, 'bull_use_spike': True, 'bull_rsi_required': True, 'bear_strategy': 'mean_reversion', 'bear_bb_std_mult': 3.0558608568439243, 'bear_rsi_os': 44, 'bear_rsi_ob': 54, 'bear_adx_thresh': 6.161216800817762, 'bear_atr_min_pct': 0.004281919535533134, 'bear_atr_max_pct': 0.07661360501161384, 'bear_tp_mult': 1.8607898462296395, 'bear_tsl_mult': 0.1698087454173704, 'bear_time_stop': 92, 'bear_use_sma': False, 'bear_use_ema': False, 'bear_use_atr': True, 'bear_use_adx': False, 'bear_use_spike': True, 'bear_rsi_required': False, 'sideways_strategy': 'breakout', 'sideways_bb_std_mult': 2.0011009855742543, 'sideways_rsi_os': 10, 'sideways_rsi_ob': 95, 'sideways_adx_thresh': 28.046652505029225, 'sideways_atr_min_pct': 0.02821811411620441, 'sideways_atr_max_pct': 0.12030028224479423, 'sideways_tp_mult': 2.3916399734241316, 'sideways_tsl_mult': 0.7726468557953734, 'sideways_time_stop': 133, 'sideways_use_sma': True, 'sideways_use_ema': True, 'sideways_use_atr': True, 'sideways_use_adx': True, 'sideways_use_spike': True, 'sideways_rsi_required': False}.
[I 2025-09-01 14:03:12,951] Trial 250 finished with values: [0.0056530483522037045, 0.004981685607396319] and parameters: {'p_sma': 29, 'p_std': 27, 'p_atr': 24, 'p_adx': 7, 'rsi_period': 83, 'ema1': 8, 'ema2': 58, 'slip_atr_k': 0.0006613320356134958, 'slip_spread_k': 0.5307205963700885, 'spread_hl_frac': 0.009847623128526953, 'bb_std_mult': 3.5444352347794608, 'rsi_os': 44, 'rsi_ob': 52, 'vol_spike': 0.1081531563962068, 'adx_thresh': 5.9454252865973345, 'atr_min_pct': 0.012118773856725103, 'atr_max_pct': 0.020986879372384526, 'tp_mult': 1.4045193212819975, 'tsl_mult': 0.7118732768937763, 'strategy': 'mean_reversion', 'time_stop': 106, 'use_sma': True, 'use_atr': False, 'use_adx': True, 'use_ema': True, 'use_spike': True, 'rsi_required': True, 'edge_k': 0.28473846349611953, 'edge_cap': 0.9913889987804977, 'bull_strategy': 'breakout', 'bull_bb_std_mult': 3.2240044649028636, 'bull_rsi_os': 17, 'bull_rsi_ob': 79, 'bull_adx_thresh': 10.455576542875178, 'bull_atr_min_pct': 0.011409848871348405, 'bull_atr_max_pct': 0.1313083278514078, 'bull_tp_mult': 1.4875173107825588, 'bull_tsl_mult': 0.5698350761573798, 'bull_time_stop': 148, 'bull_use_sma': False, 'bull_use_ema': True, 'bull_use_atr': True, 'bull_use_adx': True, 'bull_use_spike': True, 'bull_rsi_required': True, 'bear_strategy': 'mean_reversion', 'bear_bb_std_mult': 2.585335393473459, 'bear_rsi_os': 36, 'bear_rsi_ob': 54, 'bear_adx_thresh': 6.16566227649929, 'bear_atr_min_pct': 0.0028851598584864165, 'bear_atr_max_pct': 0.11534875569691923, 'bear_tp_mult': 1.9800061655411105, 'bear_tsl_mult': 0.1700008662397164, 'bear_time_stop': 58, 'bear_use_sma': False, 'bear_use_ema': False, 'bear_use_atr': False, 'bear_use_adx': False, 'bear_use_spike': True, 'bear_rsi_required': False, 'sideways_strategy': 'mean_reversion', 'sideways_bb_std_mult': 3.428572573015021, 'sideways_rsi_os': 34, 'sideways_rsi_ob': 88, 'sideways_adx_thresh': 26.34196795170609, 'sideways_atr_min_pct': 0.004709739632785967, 'sideways_atr_max_pct': 0.11698622378093625, 'sideways_tp_mult': 2.3731380750575086, 'sideways_tsl_mult': 0.4209561413401266, 'sideways_time_stop': 243, 'sideways_use_sma': True, 'sideways_use_ema': True, 'sideways_use_atr': True, 'sideways_use_adx': True, 'sideways_use_spike': False, 'sideways_rsi_required': False}.
[I 2025-09-01 14:03:13,353] Trial 251 finished with values: [-1000000000.0, 1000000000.0] and parameters: {'p_sma': 9, 'p_std': 58, 'p_atr': 29, 'p_adx': 7, 'rsi_period': 66, 'ema1': 20, 'ema2': 58, 'slip_atr_k': 0.0007179719381266029, 'slip_spread_k': 0.35871484142817855, 'spread_hl_frac': 0.04188606096567359, 'bb_std_mult': 1.9983565437208817, 'rsi_os': 46, 'rsi_ob': 77, 'vol_spike': 0.11624003242458522, 'adx_thresh': 8.725348695294812, 'atr_min_pct': 0.016096202863890536, 'atr_max_pct': 0.11022061922259332, 'tp_mult': 2.8748229729651555, 'tsl_mult': 0.07992477696862185, 'strategy': 'mean_reversion', 'time_stop': 108, 'use_sma': True, 'use_atr': False, 'use_adx': False, 'use_ema': True, 'use_spike': True, 'rsi_required': True, 'edge_k': 1.5187902057396159, 'edge_cap': 0.9841062911984672, 'bull_strategy': 'breakout', 'bull_bb_std_mult': 0.8680753577760396, 'bull_rsi_os': 17, 'bull_rsi_ob': 67, 'bull_adx_thresh': 9.890900466302645, 'bull_atr_min_pct': 0.010275999462022654, 'bull_atr_max_pct': 0.12334227108254106, 'bull_tp_mult': 1.4895560665619274, 'bull_tsl_mult': 0.5741188521874181, 'bull_time_stop': 107, 'bull_use_sma': True, 'bull_use_ema': True, 'bull_use_atr': True, 'bull_use_adx': True, 'bull_use_spike': True, 'bull_rsi_required': False, 'bear_strategy': 'mean_reversion', 'bear_bb_std_mult': 3.0612047571553305, 'bear_rsi_os': 13, 'bear_rsi_ob': 54, 'bear_adx_thresh': 6.331568794946687, 'bear_atr_min_pct': 0.002713742990931011, 'bear_atr_max_pct': 0.07570892291316876, 'bear_tp_mult': 2.928409195958561, 'bear_tsl_mult': 0.35017195693902525, 'bear_time_stop': 59, 'bear_use_sma': False, 'bear_use_ema': True, 'bear_use_atr': False, 'bear_use_adx': True, 'bear_use_spike': False, 'bear_rsi_required': True, 'sideways_strategy': 'breakout', 'sideways_bb_std_mult': 1.9930932314003567, 'sideways_rsi_os': 33, 'sideways_rsi_ob': 87, 'sideways_adx_thresh': 25.514731252741257, 'sideways_atr_min_pct': 0.014055501492471525, 'sideways_atr_max_pct': 0.05725468090087274, 'sideways_tp_mult': 2.672697075825762, 'sideways_tsl_mult': 0.5067462234857889, 'sideways_time_stop': 200, 'sideways_use_sma': False, 'sideways_use_ema': True, 'sideways_use_atr': True, 'sideways_use_adx': True, 'sideways_use_spike': False, 'sideways_rsi_required': False}.
