[I 2025-09-01 13:42:14,397] Trial 95 finished with values: [-0.10209992197126738, 0.10240698499968238] and parameters: {'p_sma': 55, 'p_std': 8, 'p_atr': 25, 'p_adx': 7, 'rsi_period': 28, 'ema1': 10, 'ema2': 42, 'slip_atr_k': 0.021016153242453577, 'slip_spread_k': 0.9664941773920163, 'spread_hl_frac': 0.0057736042391662735, 'bb_std_mult': 1.8701126788981335, 'rsi_os': 46, 'rsi_ob': 84, 'vol_spike': 0.10613849302744684, 'adx_thresh': 23.034332322220433, 'atr_min_pct': 0.018031351801302813, 'atr_max_pct': 0.12159627248215353, 'tp_mult': 1.940369102051168, 'tsl_mult': 0.0856332873752556, 'strategy': 'breakout', 'time_stop': 176, 'use_sma': True, 'use_atr': True, 'use_adx': True, 'use_ema': False, 'use_spike': True, 'rsi_required': False, 'edge_k': 0.45735134359097984, 'edge_cap': 0.17061301589031427, 'bull_strategy': 'breakout', 'bull_bb_std_mult': 2.5252961865032297, 'bull_rsi_os': 20, 'bull_rsi_ob': 51, 'bull_adx_thresh': 32.97069039423575, 'bull_atr_min_pct': 0.028201502693879082, 'bull_atr_max_pct': 0.12694139257517048, 'bull_tp_mult': 1.0197700175532147, 'bull_tsl_mult': 0.5609250866260016, 'bull_time_stop': 101, 'bull_use_sma': False, 'bull_use_ema': True, 'bull_use_atr': False, 'bull_use_adx': True, 'bull_use_spike': False, 'bull_rsi_required': False, 'bear_strategy': 'breakout', 'bear_bb_std_mult': 2.684646585032238, 'bear_rsi_os': 22, 'bear_rsi_ob': 52, 'bear_adx_thresh': 7.756573179715025, 'bear_atr_min_pct': 0.0009690711506496709, 'bear_atr_max_pct': 0.0755360090281785, 'bear_tp_mult': 1.9235194178539647, 'bear_tsl_mult': 0.8856975984925883, 'bear_time_stop': 257, 'bear_use_sma': False, 'bear_use_ema': False, 'bear_use_atr': False, 'bear_use_adx': True, 'bear_use_spike': False, 'bear_rsi_required': True, 'sideways_strategy': 'breakout', 'sideways_bb_std_mult': 2.041802862801064, 'sideways_rsi_os': 31, 'sideways_rsi_ob': 59, 'sideways_adx_thresh': 34.03362637501068, 'sideways_atr_min_pct': 0.016562276382013536, 'sideways_atr_max_pct': 0.10877375727211505, 'sideways_tp_mult': 1.1998782688496838, 'sideways_tsl_mult': 0.37683817868955083, 'sideways_time_stop': 257, 'sideways_use_sma': False, 'sideways_use_ema': True, 'sideways_use_atr': True, 'sideways_use_adx': False, 'sideways_use_spike': False, 'sideways_rsi_required': False}.
[I 2025-09-01 13:42:57,249] Trial 100 finished with values: [-1000000000.0, 1000000000.0] and parameters: {'p_sma': 11, 'p_std': 32, 'p_atr': 14, 'p_adx': 30, 'rsi_period': 28, 'ema1': 15, 'ema2': 44, 'slip_atr_k': 0.07432173605237757, 'slip_spread_k': 0.5002450043181619, 'spread_hl_frac': 0.006501596232819779, 'bb_std_mult': 3.2406378843755514, 'rsi_os': 7, 'rsi_ob': 45, 'vol_spike': 0.10619076481134251, 'adx_thresh': 33.732359711086616, 'atr_min_pct': 0.014341152585834648, 'atr_max_pct': 0.027933171868018955, 'tp_mult': 1.0267248641989717, 'tsl_mult': 0.07063194160835552, 'strategy': 'breakout', 'time_stop': 268, 'use_sma': True, 'use_atr': False, 'use_adx': False, 'use_ema': False, 'use_spike': False, 'rsi_required': False, 'edge_k': 1.2296645690414976, 'edge_cap': 0.13143879822566729, 'bull_strategy': 'breakout', 'bull_bb_std_mult': 1.4705040230185995, 'bull_rsi_os': 17, 'bull_rsi_ob': 58, 'bull_adx_thresh': 5.924927463393473, 'bull_atr_min_pct': 0.01867206329434387, 'bull_atr_max_pct': 0.14663143004659845, 'bull_tp_mult': 1.4654127386593698, 'bull_tsl_mult': 0.5001546590461374, 'bull_time_stop': 27, 'bull_use_sma': True, 'bull_use_ema': True, 'bull_use_atr': False, 'bull_use_adx': True, 'bull_use_spike': False, 'bull_rsi_required': True, 'bear_strategy': 'breakout', 'bear_bb_std_mult': 2.9499859986690726, 'bear_rsi_os': 38, 'bear_rsi_ob': 91, 'bear_adx_thresh': 6.998188725018539, 'bear_atr_min_pct': 0.0017194626083337702, 'bear_atr_max_pct': 0.141526155980126, 'bear_tp_mult': 2.685974113428491, 'bear_tsl_mult': 0.07214116432151704, 'bear_time_stop': 28, 'bear_use_sma': False, 'bear_use_ema': True, 'bear_use_atr': False, 'bear_use_adx': False, 'bear_use_spike': False, 'bear_rsi_required': True, 'sideways_strategy': 'mean_reversion', 'sideways_bb_std_mult': 0.5002910237699654, 'sideways_rsi_os': 40, 'sideways_rsi_ob': 53, 'sideways_adx_thresh': 28.86179685895309, 'sideways_atr_min_pct': 0.005494834214740667, 'sideways_atr_max_pct': 0.10814325563484889, 'sideways_tp_mult': 2.3304203938849226, 'sideways_tsl_mult': 0.3788241084744086, 'sideways_time_stop': 52, 'sideways_use_sma': True, 'sideways_use_ema': True, 'sideways_use_atr': True, 'sideways_use_adx': True, 'sideways_use_spike': False, 'sideways_rsi_required': False}.
[I 2025-09-01 13:42:57,251] Trial 102 finished with values: [-1000000000.0, 1000000000.0] and parameters: {'p_sma': 8, 'p_std': 28, 'p_atr': 25, 'p_adx': 27, 'rsi_period': 64, 'ema1': 6, 'ema2': 17, 'slip_atr_k': 0.15300314153859615, 'slip_spread_k': 0.4598157247726791, 'spread_hl_frac': 0.005015113666688737, 'bb_std_mult': 2.7411997017437595, 'rsi_os': 46, 'rsi_ob': 91, 'vol_spike': 0.1062718240942368, 'adx_thresh': 16.649479271479166, 'atr_min_pct': 0.01652330075468535, 'atr_max_pct': 0.1406528667027947, 'tp_mult': 2.259046124933593, 'tsl_mult': 0.06896365691796581, 'strategy': 'breakout', 'time_stop': 267, 'use_sma': False, 'use_atr': True, 'use_adx': False, 'use_ema': False, 'use_spike': True, 'rsi_required': False, 'edge_k': 1.0236309087573043, 'edge_cap': 0.1410289529381667, 'bull_strategy': 'breakout', 'bull_bb_std_mult': 2.5406108124498674, 'bull_rsi_os': 13, 'bull_rsi_ob': 83, 'bull_adx_thresh': 9.854447555138728, 'bull_atr_min_pct': 0.003483478693150693, 'bull_atr_max_pct': 0.14752715974109945, 'bull_tp_mult': 1.5582630498141705, 'bull_tsl_mult': 0.6215949010541961, 'bull_time_stop': 268, 'bull_use_sma': False, 'bull_use_ema': True, 'bull_use_atr': False, 'bull_use_adx': True, 'bull_use_spike': True, 'bull_rsi_required': False, 'bear_strategy': 'breakout', 'bear_bb_std_mult': 3.254338588564565, 'bear_rsi_os': 55, 'bear_rsi_ob': 54, 'bear_adx_thresh': 5.990975507244787, 'bear_atr_min_pct': 0.007033614775104667, 'bear_atr_max_pct': 0.0526900702153173, 'bear_tp_mult': 2.67503561135934, 'bear_tsl_mult': 0.8444317718860737, 'bear_time_stop': 67, 'bear_use_sma': False, 'bear_use_ema': True, 'bear_use_atr': True, 'bear_use_adx': True, 'bear_use_spike': False, 'bear_rsi_required': True, 'sideways_strategy': 'breakout', 'sideways_bb_std_mult': 0.8835184977959257, 'sideways_rsi_os': 35, 'sideways_rsi_ob': 89, 'sideways_adx_thresh': 25.646038211013927, 'sideways_atr_min_pct': 0.010364097275372299, 'sideways_atr_max_pct': 0.10139808011344059, 'sideways_tp_mult': 2.6396570149319976, 'sideways_tsl_mult': 0.65631390177244, 'sideways_time_stop': 222, 'sideways_use_sma': False, 'sideways_use_ema': True, 'sideways_use_atr': True, 'sideways_use_adx': False, 'sideways_use_spike': False, 'sideways_rsi_required': False}.
[I 2025-09-01 13:42:57,776] Trial 101 finished with values: [-1000000000.0, 1000000000.0] and parameters: {'p_sma': 9, 'p_std': 28, 'p_atr': 25, 'p_adx': 27, 'rsi_period': 23, 'ema1': 12, 'ema2': 44, 'slip_atr_k': 0.06772113804934578, 'slip_spread_k': 0.7014622883398867, 'spread_hl_frac': 0.0048021283717097855, 'bb_std_mult': 3.1996948090423123, 'rsi_os': 46, 'rsi_ob': 49, 'vol_spike': 0.1288718754471933, 'adx_thresh': 21.48388823631723, 'atr_min_pct': 0.014157176009817217, 'atr_max_pct': 0.139954067055484, 'tp_mult': 1.1166557600774205, 'tsl_mult': 0.06627205678302589, 'strategy': 'breakout', 'time_stop': 178, 'use_sma': False, 'use_atr': True, 'use_adx': False, 'use_ema': False, 'use_spike': False, 'rsi_required': False, 'edge_k': 1.1557427695587372, 'edge_cap': 0.13351987819488925, 'bull_strategy': 'breakout', 'bull_bb_std_mult': 0.5949109407894796, 'bull_rsi_os': 38, 'bull_rsi_ob': 45, 'bull_adx_thresh': 25.345838108914265, 'bull_atr_min_pct': 0.0032336892916080082, 'bull_atr_max_pct': 0.148698169075219, 'bull_tp_mult': 1.1656957646217543, 'bull_tsl_mult': 0.6269003713224272, 'bull_time_stop': 270, 'bull_use_sma': True, 'bull_use_ema': True, 'bull_use_atr': False, 'bull_use_adx': True, 'bull_use_spike': True, 'bull_rsi_required': False, 'bear_strategy': 'breakout', 'bear_bb_std_mult': 2.724091943487156, 'bear_rsi_os': 27, 'bear_rsi_ob': 75, 'bear_adx_thresh': 6.959484066505512, 'bear_atr_min_pct': 0.0020798008342635503, 'bear_atr_max_pct': 0.06741056255563094, 'bear_tp_mult': 2.726131418573168, 'bear_tsl_mult': 0.1672553763783627, 'bear_time_stop': 94, 'bear_use_sma': False, 'bear_use_ema': True, 'bear_use_atr': False, 'bear_use_adx': True, 'bear_use_spike': False, 'bear_rsi_required': True, 'sideways_strategy': 'breakout', 'sideways_bb_std_mult': 1.425581521926352, 'sideways_rsi_os': 35, 'sideways_rsi_ob': 65, 'sideways_adx_thresh': 28.849107655859406, 'sideways_atr_min_pct': 0.010082991132356556, 'sideways_atr_max_pct': 0.015613680359138099, 'sideways_tp_mult': 1.3043141422920081, 'sideways_tsl_mult': 0.4882059911876349, 'sideways_time_stop': 222, 'sideways_use_sma': False, 'sideways_use_ema': True, 'sideways_use_atr': True, 'sideways_use_adx': False, 'sideways_use_spike': False, 'sideways_rsi_required': False}.
[I 2025-09-01 13:42:58,158] Trial 103 finished with values: [-0.04308364519087737, 0.04324372742357142] and parameters: {'p_sma': 9, 'p_std': 5, 'p_atr': 9, 'p_adx': 27, 'rsi_period': 23, 'ema1': 6, 'ema2': 17, 'slip_atr_k': 0.014528082670581796, 'slip_spread_k': 0.72687460199332, 'spread_hl_frac': 0.018580863321110166, 'bb_std_mult': 3.1774515969334605, 'rsi_os': 40, 'rsi_ob': 91, 'vol_spike': 0.0685730771004909, 'adx_thresh': 21.402454831259092, 'atr_min_pct': 0.014117074288606729, 'atr_max_pct': 0.13917181569789666, 'tp_mult': 1.6913876289657699, 'tsl_mult': 0.05490693703087171, 'strategy': 'breakout', 'time_stop': 140, 'use_sma': False, 'use_atr': False, 'use_adx': False, 'use_ema': False, 'use_spike': True, 'rsi_required': False, 'edge_k': 1.0011333036561876, 'edge_cap': 0.466535298114948, 'bull_strategy': 'breakout', 'bull_bb_std_mult': 0.5910926043493567, 'bull_rsi_os': 15, 'bull_rsi_ob': 46, 'bull_adx_thresh': 19.578705034309444, 'bull_atr_min_pct': 0.0035699488991414088, 'bull_atr_max_pct': 0.02729349702389649, 'bull_tp_mult': 1.4780317212964935, 'bull_tsl_mult': 0.6685948944857629, 'bull_time_stop': 11, 'bull_use_sma': False, 'bull_use_ema': True, 'bull_use_atr': False, 'bull_use_adx': True, 'bull_use_spike': True, 'bull_rsi_required': False, 'bear_strategy': 'breakout', 'bear_bb_std_mult': 3.523362599073364, 'bear_rsi_os': 39, 'bear_rsi_ob': 54, 'bear_adx_thresh': 6.004130887557425, 'bear_atr_min_pct': 0.002826805096558209, 'bear_atr_max_pct': 0.12443991268600649, 'bear_tp_mult': 2.651449548993588, 'bear_tsl_mult': 0.19525161746435335, 'bear_time_stop': 28, 'bear_use_sma': False, 'bear_use_ema': True, 'bear_use_atr': True, 'bear_use_adx': True, 'bear_use_spike': False, 'bear_rsi_required': True, 'sideways_strategy': 'breakout', 'sideways_bb_std_mult': 1.146778085948901, 'sideways_rsi_os': 35, 'sideways_rsi_ob': 64, 'sideways_adx_thresh': 28.966908420954518, 'sideways_atr_min_pct': 0.007925175829722703, 'sideways_atr_max_pct': 0.11872788532373124, 'sideways_tp_mult': 2.299570277616165, 'sideways_tsl_mult': 0.6837813385270674, 'sideways_time_stop': 76, 'sideways_use_sma': False, 'sideways_use_ema': True, 'sideways_use_atr': True, 'sideways_use_adx': True, 'sideways_use_spike': False, 'sideways_rsi_required': False}.
[I 2025-09-01 13:43:37,391] Trial 107 finished with values: [-1000000000.0, 1000000000.0] and parameters: {'p_sma': 6, 'p_std': 21, 'p_atr': 22, 'p_adx': 11, 'rsi_period': 26, 'ema1': 7, 'ema2': 39, 'slip_atr_k': 0.007312406927782428, 'slip_spread_k': 0.2006004736295614, 'spread_hl_frac': 0.03994566531375715, 'bb_std_mult': 1.9925958228545153, 'rsi_os': 29, 'rsi_ob': 71, 'vol_spike': 0.211026777832337, 'adx_thresh': 18.864826215786, 'atr_min_pct': 0.015465985588386183, 'atr_max_pct': 0.031218678077800967, 'tp_mult': 2.079899361172088, 'tsl_mult': 0.134586551428987, 'strategy': 'breakout', 'time_stop': 78, 'use_sma': True, 'use_atr': True, 'use_adx': True, 'use_ema': False, 'use_spike': True, 'rsi_required': True, 'edge_k': 1.3699447345475446, 'edge_cap': 0.23753448267939176, 'bull_strategy': 'breakout', 'bull_bb_std_mult': 3.4127620258241738, 'bull_rsi_os': 33, 'bull_rsi_ob': 88, 'bull_adx_thresh': 11.133690409698545, 'bull_atr_min_pct': 0.022288864447571666, 'bull_atr_max_pct': 0.09458769908871074, 'bull_tp_mult': 1.3033880743063957, 'bull_tsl_mult': 0.97421357270162, 'bull_time_stop': 53, 'bull_use_sma': False, 'bull_use_ema': True, 'bull_use_atr': False, 'bull_use_adx': True, 'bull_use_spike': False, 'bull_rsi_required': False, 'bear_strategy': 'mean_reversion', 'bear_bb_std_mult': 0.5843718840089676, 'bear_rsi_os': 10, 'bear_rsi_ob': 86, 'bear_adx_thresh': 5.819907011360798, 'bear_atr_min_pct': 0.00814175853780205, 'bear_atr_max_pct': 0.1110274984542643, 'bear_tp_mult': 1.789409221205834, 'bear_tsl_mult': 0.4083272773269051, 'bear_time_stop': 48, 'bear_use_sma': False, 'bear_use_ema': False, 'bear_use_atr': False, 'bear_use_adx': True, 'bear_use_spike': False, 'bear_rsi_required': True, 'sideways_strategy': 'breakout', 'sideways_bb_std_mult': 1.0304827058941544, 'sideways_rsi_os': 12, 'sideways_rsi_ob': 80, 'sideways_adx_thresh': 29.926257482141608, 'sideways_atr_min_pct': 0.015753506752441998, 'sideways_atr_max_pct': 0.12499240957019833, 'sideways_tp_mult': 2.5475620927629476, 'sideways_tsl_mult': 0.8848092458099084, 'sideways_time_stop': 157, 'sideways_use_sma': False, 'sideways_use_ema': True, 'sideways_use_atr': False, 'sideways_use_adx': False, 'sideways_use_spike': False, 'sideways_rsi_required': False}.
[I 2025-09-01 13:43:37,763] Trial 105 finished with values: [-1000000000.0, 1000000000.0] and parameters: {'p_sma': 9, 'p_std': 5, 'p_atr': 10, 'p_adx': 16, 'rsi_period': 25, 'ema1': 7, 'ema2': 50, 'slip_atr_k': 0.006058326678852992, 'slip_spread_k': 0.5301330978009181, 'spread_hl_frac': 0.018589879158831913, 'bb_std_mult': 1.9951443185805562, 'rsi_os': 17, 'rsi_ob': 62, 'vol_spike': 0.12567822025796346, 'adx_thresh': 21.714483123406563, 'atr_min_pct': 0.015756325242565396, 'atr_max_pct': 0.03221685180438487, 'tp_mult': 1.6976617562024663, 'tsl_mult': 0.13113551863033723, 'strategy': 'breakout', 'time_stop': 138, 'use_sma': False, 'use_atr': True, 'use_adx': False, 'use_ema': False, 'use_spike': True, 'rsi_required': True, 'edge_k': 1.365951360062108, 'edge_cap': 0.4831253017709908, 'bull_strategy': 'breakout', 'bull_bb_std_mult': 3.451863232249309, 'bull_rsi_os': 38, 'bull_rsi_ob': 71, 'bull_adx_thresh': 11.11423627201586, 'bull_atr_min_pct': 0.02214682781446206, 'bull_atr_max_pct': 0.12074830593175322, 'bull_tp_mult': 1.6846682168614615, 'bull_tsl_mult': 0.6680263848086133, 'bull_time_stop': 6, 'bull_use_sma': False, 'bull_use_ema': True, 'bull_use_atr': False, 'bull_use_adx': True, 'bull_use_spike': True, 'bull_rsi_required': False, 'bear_strategy': 'breakout', 'bear_bb_std_mult': 3.024813683741163, 'bear_rsi_os': 28, 'bear_rsi_ob': 75, 'bear_adx_thresh': 5.685700551611258, 'bear_atr_min_pct': 0.008144802453052115, 'bear_atr_max_pct': 0.06819941518242914, 'bear_tp_mult': 1.5413883575207206, 'bear_tsl_mult': 0.18916179770369113, 'bear_time_stop': 183, 'bear_use_sma': False, 'bear_use_ema': True, 'bear_use_atr': True, 'bear_use_adx': True, 'bear_use_spike': False, 'bear_rsi_required': True, 'sideways_strategy': 'breakout', 'sideways_bb_std_mult': 1.1776965379082094, 'sideways_rsi_os': 54, 'sideways_rsi_ob': 70, 'sideways_adx_thresh': 33.00023474057187, 'sideways_atr_min_pct': 0.024017004392729135, 'sideways_atr_max_pct': 0.12375880969800054, 'sideways_tp_mult': 2.6858871998863165, 'sideways_tsl_mult': 0.9614915403018709, 'sideways_time_stop': 159, 'sideways_use_sma': False, 'sideways_use_ema': True, 'sideways_use_atr': True, 'sideways_use_adx': False, 'sideways_use_spike': False, 'sideways_rsi_required': False}.
[I 2025-09-01 13:43:38,366] Trial 104 finished with values: [-1000000000.0, 1000000000.0] and parameters: {'p_sma': 6, 'p_std': 14, 'p_atr': 10, 'p_adx': 16, 'rsi_period': 25, 'ema1': 24, 'ema2': 51, 'slip_atr_k': 0.015751006785726065, 'slip_spread_k': 0.7277181923827254, 'spread_hl_frac': 0.018640846752323116, 'bb_std_mult': 1.9834518578815286, 'rsi_os': 15, 'rsi_ob': 53, 'vol_spike': 0.12808703857195353, 'adx_thresh': 21.79202077617275, 'atr_min_pct': 0.01974333825974221, 'atr_max_pct': 0.031004977462303823, 'tp_mult': 2.0784732513204083, 'tsl_mult': 0.13046612770962307, 'strategy': 'breakout', 'time_stop': 134, 'use_sma': False, 'use_atr': True, 'use_adx': False, 'use_ema': False, 'use_spike': True, 'rsi_required': True, 'edge_k': 1.2765297290268742, 'edge_cap': 0.23037147310246453, 'bull_strategy': 'breakout', 'bull_bb_std_mult': 1.1544765790435565, 'bull_rsi_os': 15, 'bull_rsi_ob': 45, 'bull_adx_thresh': 10.907617597132509, 'bull_atr_min_pct': 0.01984867762923443, 'bull_atr_max_pct': 0.08737139618801548, 'bull_tp_mult': 2.927064671081108, 'bull_tsl_mult': 0.5029415353383099, 'bull_time_stop': 55, 'bull_use_sma': False, 'bull_use_ema': True, 'bull_use_atr': False, 'bull_use_adx': True, 'bull_use_spike': True, 'bull_rsi_required': False, 'bear_strategy': 'breakout', 'bear_bb_std_mult': 2.7700280492250533, 'bear_rsi_os': 47, 'bear_rsi_ob': 75, 'bear_adx_thresh': 5.731153726932407, 'bear_atr_min_pct': 0.008225467365493627, 'bear_atr_max_pct': 0.06796456139660621, 'bear_tp_mult': 1.8752193735631761, 'bear_tsl_mult': 0.20603914293562406, 'bear_time_stop': 160, 'bear_use_sma': False, 'bear_use_ema': True, 'bear_use_atr': True, 'bear_use_adx': True, 'bear_use_spike': False, 'bear_rsi_required': True, 'sideways_strategy': 'breakout', 'sideways_bb_std_mult': 1.0329916922622238, 'sideways_rsi_os': 12, 'sideways_rsi_ob': 81, 'sideways_adx_thresh': 29.978778622938016, 'sideways_atr_min_pct': 0.012175252858514505, 'sideways_atr_max_pct': 0.015354139568276859, 'sideways_tp_mult': 1.903641571521326, 'sideways_tsl_mult': 0.4984016815512805, 'sideways_time_stop': 277, 'sideways_use_sma': False, 'sideways_use_ema': True, 'sideways_use_atr': True, 'sideways_use_adx': False, 'sideways_use_spike': False, 'sideways_rsi_required': False}.
[I 2025-09-01 13:43:38,702] Trial 106 finished with values: [-1000000000.0, 1000000000.0] and parameters: {'p_sma': 34, 'p_std': 12, 'p_atr': 9, 'p_adx': 11, 'rsi_period': 26, 'ema1': 24, 'ema2': 36, 'slip_atr_k': 0.016156990297816108, 'slip_spread_k': 0.19620738042047242, 'spread_hl_frac': 0.008256157787209794, 'bb_std_mult': 2.00201878152178, 'rsi_os': 29, 'rsi_ob': 75, 'vol_spike': 0.21885488810346848, 'adx_thresh': 26.534452317399538, 'atr_min_pct': 0.01577286681680759, 'atr_max_pct': 0.1046447659121012, 'tp_mult': 1.993701906050096, 'tsl_mult': 0.030003931778007385, 'strategy': 'breakout', 'time_stop': 142, 'use_sma': True, 'use_atr': True, 'use_adx': False, 'use_ema': False, 'use_spike': True, 'rsi_required': True, 'edge_k': 1.3525646369940387, 'edge_cap': 0.7259887226151304, 'bull_strategy': 'breakout', 'bull_bb_std_mult': 3.4809602697842745, 'bull_rsi_os': 34, 'bull_rsi_ob': 71, 'bull_adx_thresh': 16.966630586563184, 'bull_atr_min_pct': 0.01994487712599425, 'bull_atr_max_pct': 0.028586953110082983, 'bull_tp_mult': 2.5488711072383037, 'bull_tsl_mult': 0.6635726787563688, 'bull_time_stop': 93, 'bull_use_sma': False, 'bull_use_ema': True, 'bull_use_atr': False, 'bull_use_adx': True, 'bull_use_spike': False, 'bull_rsi_required': False, 'bear_strategy': 'breakout', 'bear_bb_std_mult': 3.0624883324668217, 'bear_rsi_os': 10, 'bear_rsi_ob': 84, 'bear_adx_thresh': 5.673395563161028, 'bear_atr_min_pct': 0.009347206075093296, 'bear_atr_max_pct': 0.11887337063624998, 'bear_tp_mult': 1.5486682039885558, 'bear_tsl_mult': 0.4193103424840651, 'bear_time_stop': 180, 'bear_use_sma': False, 'bear_use_ema': True, 'bear_use_atr': True, 'bear_use_adx': True, 'bear_use_spike': False, 'bear_rsi_required': True, 'sideways_strategy': 'breakout', 'sideways_bb_std_mult': 1.184422785334179, 'sideways_rsi_os': 28, 'sideways_rsi_ob': 79, 'sideways_adx_thresh': 30.202516996268184, 'sideways_atr_min_pct': 0.008329044341212465, 'sideways_atr_max_pct': 0.11920076264888856, 'sideways_tp_mult': 1.952735561642113, 'sideways_tsl_mult': 0.9600162083038328, 'sideways_time_stop': 74, 'sideways_use_sma': False, 'sideways_use_ema': True, 'sideways_use_atr': True, 'sideways_use_adx': True, 'sideways_use_spike': False, 'sideways_rsi_required': False}.
