[I 2025-09-01 14:52:29,424] Trial 581 finished with values: [-1000000000.0, 1000000000.0] and parameters: {'p_sma': 28, 'p_std': 28, 'p_atr': 27, 'p_adx': 7, 'rsi_period': 46, 'ema1': 11, 'ema2': 41, 'slip_atr_k': 0.012214174017575324, 'slip_spread_k': 0.567513583469277, 'spread_hl_frac': 0.009890053991537444, 'bb_std_mult': 1.753173010402471, 'rsi_os': 35, 'rsi_ob': 81, 'vol_spike': 0.1094122275979365, 'adx_thresh': 5.568270546436698, 'atr_min_pct': 0.010080287320087504, 'atr_max_pct': 0.02994963848616109, 'tp_mult': 1.4041955558310708, 'tsl_mult': 0.6954792477053993, 'strategy': 'mean_reversion', 'time_stop': 175, 'use_sma': False, 'use_atr': False, 'use_adx': False, 'use_ema': True, 'use_spike': True, 'rsi_required': False, 'edge_k': 0.15120194870452208, 'edge_cap': 0.9311533461716066, 'bull_strategy': 'breakout', 'bull_bb_std_mult': 2.133172376927746, 'bull_rsi_os': 31, 'bull_rsi_ob': 75, 'bull_adx_thresh': 11.500087305437228, 'bull_atr_min_pct': 0.021393775261799294, 'bull_atr_max_pct': 0.12456720986079199, 'bull_tp_mult': 1.4786091880821106, 'bull_tsl_mult': 0.43472333895955156, 'bull_time_stop': 159, 'bull_use_sma': False, 'bull_use_ema': True, 'bull_use_atr': True, 'bull_use_adx': True, 'bull_use_spike': True, 'bull_rsi_required': True, 'bear_strategy': 'mean_reversion', 'bear_bb_std_mult': 2.4803674547066756, 'bear_rsi_os': 35, 'bear_rsi_ob': 58, 'bear_adx_thresh': 6.929823384599499, 'bear_atr_min_pct': 0.0036421610792151853, 'bear_atr_max_pct': 0.0976572330378217, 'bear_tp_mult': 2.403634865104934, 'bear_tsl_mult': 0.7624459855754298, 'bear_time_stop': 66, 'bear_use_sma': True, 'bear_use_ema': True, 'bear_use_atr': False, 'bear_use_adx': False, 'bear_use_spike': False, 'bear_rsi_required': False, 'sideways_strategy': 'mean_reversion', 'sideways_bb_std_mult': 3.422681585295554, 'sideways_rsi_os': 31, 'sideways_rsi_ob': 72, 'sideways_adx_thresh': 22.689292935375978, 'sideways_atr_min_pct': 0.0013053128759042583, 'sideways_atr_max_pct': 0.10465656290953416, 'sideways_tp_mult': 2.1323086659513772, 'sideways_tsl_mult': 0.4386870349182252, 'sideways_time_stop': 124, 'sideways_use_sma': False, 'sideways_use_ema': True, 'sideways_use_atr': False, 'sideways_use_adx': False, 'sideways_use_spike': False, 'sideways_rsi_required': False}.
[I 2025-09-01 14:52:33,357] Trial 586 finished with values: [-1000000000.0, 1000000000.0] and parameters: {'p_sma': 19, 'p_std': 26, 'p_atr': 25, 'p_adx': 9, 'rsi_period': 79, 'ema1': 18, 'ema2': 37, 'slip_atr_k': 0.006880845336704177, 'slip_spread_k': 0.5274727835984078, 'spread_hl_frac': 4.068973920555441e-05, 'bb_std_mult': 3.3936924047982484, 'rsi_os': 20, 'rsi_ob': 57, 'vol_spike': 0.11751764770975773, 'adx_thresh': 5.561516726711977, 'atr_min_pct': 0.012364534079592567, 'atr_max_pct': 0.08153208777839863, 'tp_mult': 1.4089077709859323, 'tsl_mult': 0.6559960198778608, 'strategy': 'mean_reversion', 'time_stop': 115, 'use_sma': True, 'use_atr': False, 'use_adx': True, 'use_ema': True, 'use_spike': False, 'rsi_required': True, 'edge_k': 1.5709585784671947, 'edge_cap': 0.9435392426434043, 'bull_strategy': 'breakout', 'bull_bb_std_mult': 1.8539599683846184, 'bull_rsi_os': 13, 'bull_rsi_ob': 65, 'bull_adx_thresh': 5.066988581277782, 'bull_atr_min_pct': 0.02542154745717323, 'bull_atr_max_pct': 0.1240107547478436, 'bull_tp_mult': 2.037161206036969, 'bull_tsl_mult': 0.42678960223477586, 'bull_time_stop': 168, 'bull_use_sma': True, 'bull_use_ema': True, 'bull_use_atr': False, 'bull_use_adx': True, 'bull_use_spike': True, 'bull_rsi_required': True, 'bear_strategy': 'mean_reversion', 'bear_bb_std_mult': 2.521865161505876, 'bear_rsi_os': 35, 'bear_rsi_ob': 58, 'bear_adx_thresh': 25.171785645909345, 'bear_atr_min_pct': 0.0037533900875148726, 'bear_atr_max_pct': 0.031987188279824295, 'bear_tp_mult': 2.400016288182453, 'bear_tsl_mult': 0.7505211103680596, 'bear_time_stop': 82, 'bear_use_sma': False, 'bear_use_ema': False, 'bear_use_atr': False, 'bear_use_adx': True, 'bear_use_spike': True, 'bear_rsi_required': False, 'sideways_strategy': 'breakout', 'sideways_bb_std_mult': 3.1072336802329144, 'sideways_rsi_os': 31, 'sideways_rsi_ob': 89, 'sideways_adx_thresh': 22.620001726846404, 'sideways_atr_min_pct': 0.0008210090006777523, 'sideways_atr_max_pct': 0.09709386969208407, 'sideways_tp_mult': 2.3627987405697826, 'sideways_tsl_mult': 0.09844911497287884, 'sideways_time_stop': 270, 'sideways_use_sma': True, 'sideways_use_ema': False, 'sideways_use_atr': True, 'sideways_use_adx': True, 'sideways_use_spike': False, 'sideways_rsi_required': False}.
[I 2025-09-01 14:52:44,512] Trial 587 finished with values: [-0.016930417598466918, 0.017589253360202818] and parameters: {'p_sma': 29, 'p_std': 8, 'p_atr': 21, 'p_adx': 7, 'rsi_period': 77, 'ema1': 9, 'ema2': 58, 'slip_atr_k': 0.13963367305400629, 'slip_spread_k': 0.9792341092306995, 'spread_hl_frac': 0.008907016193993894, 'bb_std_mult': 2.145778214555916, 'rsi_os': 43, 'rsi_ob': 57, 'vol_spike': 0.048639934868556514, 'adx_thresh': 24.5814549942299, 'atr_min_pct': 0.002073674482457658, 'atr_max_pct': 0.04341431825967804, 'tp_mult': 1.405989411095785, 'tsl_mult': 0.6081542300860505, 'strategy': 'mean_reversion', 'time_stop': 112, 'use_sma': True, 'use_atr': False, 'use_adx': True, 'use_ema': True, 'use_spike': False, 'rsi_required': True, 'edge_k': 0.3960431232357816, 'edge_cap': 0.1649011377115221, 'bull_strategy': 'breakout', 'bull_bb_std_mult': 2.656399480033297, 'bull_rsi_os': 13, 'bull_rsi_ob': 84, 'bull_adx_thresh': 10.807708191506384, 'bull_atr_min_pct': 0.00851882576396603, 'bull_atr_max_pct': 0.12026513707552444, 'bull_tp_mult': 1.7831558960677916, 'bull_tsl_mult': 0.5452656759241646, 'bull_time_stop': 110, 'bull_use_sma': True, 'bull_use_ema': False, 'bull_use_atr': False, 'bull_use_adx': True, 'bull_use_spike': False, 'bull_rsi_required': True, 'bear_strategy': 'mean_reversion', 'bear_bb_std_mult': 2.5591582288266186, 'bear_rsi_os': 35, 'bear_rsi_ob': 57, 'bear_adx_thresh': 6.875982918705546, 'bear_atr_min_pct': 0.0033764837962851502, 'bear_atr_max_pct': 0.10643156889179975, 'bear_tp_mult': 2.05338492870958, 'bear_tsl_mult': 0.1185913701478974, 'bear_time_stop': 292, 'bear_use_sma': False, 'bear_use_ema': False, 'bear_use_atr': False, 'bear_use_adx': True, 'bear_use_spike': True, 'bear_rsi_required': False, 'sideways_strategy': 'breakout', 'sideways_bb_std_mult': 1.5350087859348864, 'sideways_rsi_os': 24, 'sideways_rsi_ob': 89, 'sideways_adx_thresh': 25.128808694999357, 'sideways_atr_min_pct': 0.02981656857953091, 'sideways_atr_max_pct': 0.11376148315187935, 'sideways_tp_mult': 1.7286362973557785, 'sideways_tsl_mult': 0.4029732985748888, 'sideways_time_stop': 272, 'sideways_use_sma': True, 'sideways_use_ema': False, 'sideways_use_atr': True, 'sideways_use_adx': True, 'sideways_use_spike': False, 'sideways_rsi_required': False}.
[I 2025-09-01 14:53:05,108] Trial 588 finished with values: [-0.028744415745866503, 0.029288149919944752] and parameters: {'p_sma': 19, 'p_std': 37, 'p_atr': 21, 'p_adx': 7, 'rsi_period': 45, 'ema1': 23, 'ema2': 58, 'slip_atr_k': 0.020976302426431784, 'slip_spread_k': 0.549938561158703, 'spread_hl_frac': 0.007649684878936627, 'bb_std_mult': 3.5050266204162384, 'rsi_os': 30, 'rsi_ob': 54, 'vol_spike': 0.095962903527434, 'adx_thresh': 5.744361678135855, 'atr_min_pct': 0.01557982667873856, 'atr_max_pct': 0.12749170590750358, 'tp_mult': 1.403202885163913, 'tsl_mult': 0.6878095802385618, 'strategy': 'breakout', 'time_stop': 113, 'use_sma': True, 'use_atr': False, 'use_adx': True, 'use_ema': False, 'use_spike': False, 'rsi_required': True, 'edge_k': 1.4312689483891656, 'edge_cap': 0.9513268044937975, 'bull_strategy': 'breakout', 'bull_bb_std_mult': 2.1638366289621853, 'bull_rsi_os': 6, 'bull_rsi_ob': 76, 'bull_adx_thresh': 10.529151729956787, 'bull_atr_min_pct': 0.029058083038119263, 'bull_atr_max_pct': 0.12775967040607814, 'bull_tp_mult': 1.6634203910649916, 'bull_tsl_mult': 0.0011964099224210378, 'bull_time_stop': 151, 'bull_use_sma': True, 'bull_use_ema': False, 'bull_use_atr': False, 'bull_use_adx': True, 'bull_use_spike': False, 'bull_rsi_required': False, 'bear_strategy': 'breakout', 'bear_bb_std_mult': 2.0957635261397702, 'bear_rsi_os': 25, 'bear_rsi_ob': 57, 'bear_adx_thresh': 12.90597198870484, 'bear_atr_min_pct': 0.0065475420559764404, 'bear_atr_max_pct': 0.12261980893666277, 'bear_tp_mult': 2.034030315469804, 'bear_tsl_mult': 0.15449247740244268, 'bear_time_stop': 66, 'bear_use_sma': False, 'bear_use_ema': False, 'bear_use_atr': True, 'bear_use_adx': True, 'bear_use_spike': True, 'bear_rsi_required': False, 'sideways_strategy': 'breakout', 'sideways_bb_std_mult': 2.928049779362931, 'sideways_rsi_os': 32, 'sideways_rsi_ob': 59, 'sideways_adx_thresh': 25.158185509730718, 'sideways_atr_min_pct': 0.0015289152132049043, 'sideways_atr_max_pct': 0.09009401377756542, 'sideways_tp_mult': 2.498533371151117, 'sideways_tsl_mult': 0.9085713549876457, 'sideways_time_stop': 125, 'sideways_use_sma': True, 'sideways_use_ema': False, 'sideways_use_atr': True, 'sideways_use_adx': True, 'sideways_use_spike': False, 'sideways_rsi_required': True}.
[I 2025-09-01 14:53:06,645] Trial 589 finished with values: [-0.015198957790555134, 0.015284958583998264] and parameters: {'p_sma': 19, 'p_std': 36, 'p_atr': 25, 'p_adx': 8, 'rsi_period': 38, 'ema1': 9, 'ema2': 19, 'slip_atr_k': 0.021356071026974642, 'slip_spread_k': 0.4885139795939958, 'spread_hl_frac': 0.007616898570687714, 'bb_std_mult': 3.4889245525020383, 'rsi_os': 29, 'rsi_ob': 46, 'vol_spike': 0.13095261230896554, 'adx_thresh': 24.66437245149746, 'atr_min_pct': 0.0019658328974723263, 'atr_max_pct': 0.03808403038824245, 'tp_mult': 1.3740516009090737, 'tsl_mult': 0.7571122143555211, 'strategy': 'breakout', 'time_stop': 27, 'use_sma': True, 'use_atr': False, 'use_adx': True, 'use_ema': False, 'use_spike': False, 'rsi_required': True, 'edge_k': 0.3928309086927836, 'edge_cap': 0.3713467491192013, 'bull_strategy': 'breakout', 'bull_bb_std_mult': 3.2081303214811245, 'bull_rsi_os': 12, 'bull_rsi_ob': 84, 'bull_adx_thresh': 10.651159908123832, 'bull_atr_min_pct': 0.014515175579538441, 'bull_atr_max_pct': 0.11987516069040066, 'bull_tp_mult': 1.7950254495824995, 'bull_tsl_mult': 0.5496666297953923, 'bull_time_stop': 25, 'bull_use_sma': True, 'bull_use_ema': False, 'bull_use_atr': False, 'bull_use_adx': True, 'bull_use_spike': False, 'bull_rsi_required': False, 'bear_strategy': 'breakout', 'bear_bb_std_mult': 2.5484905479285254, 'bear_rsi_os': 34, 'bear_rsi_ob': 57, 'bear_adx_thresh': 8.922855592699342, 'bear_atr_min_pct': 0.02929233283585702, 'bear_atr_max_pct': 0.03159134493627292, 'bear_tp_mult': 2.4419221055007965, 'bear_tsl_mult': 0.155890680444957, 'bear_time_stop': 294, 'bear_use_sma': False, 'bear_use_ema': False, 'bear_use_atr': True, 'bear_use_adx': True, 'bear_use_spike': True, 'bear_rsi_required': False, 'sideways_strategy': 'breakout', 'sideways_bb_std_mult': 2.942084187358187, 'sideways_rsi_os': 32, 'sideways_rsi_ob': 59, 'sideways_adx_thresh': 24.321273778529033, 'sideways_atr_min_pct': 0.002180417350897241, 'sideways_atr_max_pct': 0.09709687546760433, 'sideways_tp_mult': 2.4601590572394314, 'sideways_tsl_mult': 0.41103505426261144, 'sideways_time_stop': 275, 'sideways_use_sma': True, 'sideways_use_ema': False, 'sideways_use_atr': True, 'sideways_use_adx': True, 'sideways_use_spike': False, 'sideways_rsi_required': True}.
[I 2025-09-01 14:53:10,849] Trial 590 finished with values: [-1000000000.0, 1000000000.0] and parameters: {'p_sma': 24, 'p_std': 31, 'p_atr': 25, 'p_adx': 25, 'rsi_period': 37, 'ema1': 12, 'ema2': 14, 'slip_atr_k': 0.11182339191297613, 'slip_spread_k': 0.4968844160134405, 'spread_hl_frac': 0.010969991482629553, 'bb_std_mult': 3.512488270685365, 'rsi_os': 9, 'rsi_ob': 54, 'vol_spike': 0.09612900578996998, 'adx_thresh': 6.036396040908252, 'atr_min_pct': 0.024230982625455304, 'atr_max_pct': 0.14495209978398038, 'tp_mult': 1.3762941983033685, 'tsl_mult': 0.32869684887261486, 'strategy': 'breakout', 'time_stop': 248, 'use_sma': True, 'use_atr': True, 'use_adx': True, 'use_ema': False, 'use_spike': False, 'rsi_required': True, 'edge_k': 0.3813724266225037, 'edge_cap': 0.3735744863013165, 'bull_strategy': 'breakout', 'bull_bb_std_mult': 2.008185020141782, 'bull_rsi_os': 12, 'bull_rsi_ob': 59, 'bull_adx_thresh': 13.2289293663042, 'bull_atr_min_pct': 0.009364118225268236, 'bull_atr_max_pct': 0.12036859896210267, 'bull_tp_mult': 1.6649538996886708, 'bull_tsl_mult': 0.24565462689078804, 'bull_time_stop': 152, 'bull_use_sma': True, 'bull_use_ema': False, 'bull_use_atr': False, 'bull_use_adx': True, 'bull_use_spike': False, 'bull_rsi_required': False, 'bear_strategy': 'breakout', 'bear_bb_std_mult': 3.521559392923116, 'bear_rsi_os': 34, 'bear_rsi_ob': 75, 'bear_adx_thresh': 31.511974252408777, 'bear_atr_min_pct': 0.012475748678413294, 'bear_atr_max_pct': 0.12377705765886476, 'bear_tp_mult': 1.9291339118080624, 'bear_tsl_mult': 0.15297253365751023, 'bear_time_stop': 88, 'bear_use_sma': False, 'bear_use_ema': False, 'bear_use_atr': True, 'bear_use_adx': False, 'bear_use_spike': True, 'bear_rsi_required': False, 'sideways_strategy': 'breakout', 'sideways_bb_std_mult': 3.2072375933096104, 'sideways_rsi_os': 45, 'sideways_rsi_ob': 59, 'sideways_adx_thresh': 25.03909509251149, 'sideways_atr_min_pct': 0.003962702586753127, 'sideways_atr_max_pct': 0.1497887895571774, 'sideways_tp_mult': 2.4786216578471723, 'sideways_tsl_mult': 0.40603627056298863, 'sideways_time_stop': 62, 'sideways_use_sma': True, 'sideways_use_ema': False, 'sideways_use_atr': True, 'sideways_use_adx': True, 'sideways_use_spike': True, 'sideways_rsi_required': True}.
[I 2025-09-01 14:53:32,944] Trial 591 finished with values: [-1000000000.0, 1000000000.0] and parameters: {'p_sma': 17, 'p_std': 37, 'p_atr': 26, 'p_adx': 8, 'rsi_period': 64, 'ema1': 8, 'ema2': 56, 'slip_atr_k': 0.020212926247027425, 'slip_spread_k': 0.49115860126066624, 'spread_hl_frac': 0.011052388470396577, 'bb_std_mult': 3.505082116479949, 'rsi_os': 28, 'rsi_ob': 65, 'vol_spike': 0.09652515171928566, 'adx_thresh': 20.032454491897322, 'atr_min_pct': 0.012505228683139476, 'atr_max_pct': 0.09703659891958415, 'tp_mult': 1.3605008226534498, 'tsl_mult': 0.3398709655091272, 'strategy': 'breakout', 'time_stop': 154, 'use_sma': True, 'use_atr': True, 'use_adx': True, 'use_ema': False, 'use_spike': True, 'rsi_required': True, 'edge_k': 0.0637468290370182, 'edge_cap': 0.959225365532368, 'bull_strategy': 'breakout', 'bull_bb_std_mult': 3.0823937260073766, 'bull_rsi_os': 53, 'bull_rsi_ob': 77, 'bull_adx_thresh': 13.35412625804659, 'bull_atr_min_pct': 0.012495223532687111, 'bull_atr_max_pct': 0.12786827149051794, 'bull_tp_mult': 2.744271893833112, 'bull_tsl_mult': 0.1280823883251262, 'bull_time_stop': 282, 'bull_use_sma': False, 'bull_use_ema': False, 'bull_use_atr': True, 'bull_use_adx': True, 'bull_use_spike': False, 'bull_rsi_required': False, 'bear_strategy': 'breakout', 'bear_bb_std_mult': 2.6223606403966015, 'bear_rsi_os': 34, 'bear_rsi_ob': 55, 'bear_adx_thresh': 26.865185537735016, 'bear_atr_min_pct': 0.02746850360510973, 'bear_atr_max_pct': 0.010231936768591243, 'bear_tp_mult': 1.9226650299848573, 'bear_tsl_mult': 0.1538041113665124, 'bear_time_stop': 70, 'bear_use_sma': False, 'bear_use_ema': False, 'bear_use_atr': True, 'bear_use_adx': False, 'bear_use_spike': True, 'bear_rsi_required': False, 'sideways_strategy': 'mean_reversion', 'sideways_bb_std_mult': 1.4553010927901486, 'sideways_rsi_os': 7, 'sideways_rsi_ob': 46, 'sideways_adx_thresh': 32.214986925473184, 'sideways_atr_min_pct': 0.023460537020443942, 'sideways_atr_max_pct': 0.025199080954086163, 'sideways_tp_mult': 2.482590271374444, 'sideways_tsl_mult': 0.41934739031977886, 'sideways_time_stop': 245, 'sideways_use_sma': True, 'sideways_use_ema': True, 'sideways_use_atr': True, 'sideways_use_adx': True, 'sideways_use_spike': True, 'sideways_rsi_required': True}.
[I 2025-09-01 14:53:45,426] Trial 592 finished with values: [-0.1260806482356367, 0.12611584151015467] and parameters: {'p_sma': 30, 'p_std': 25, 'p_atr': 26, 'p_adx': 8, 'rsi_period': 18, 'ema1': 9, 'ema2': 19, 'slip_atr_k': 0.016668069317007983, 'slip_spread_k': 0.5134522628415291, 'spread_hl_frac': 0.011375977616817724, 'bb_std_mult': 3.515811832932349, 'rsi_os': 15, 'rsi_ob': 54, 'vol_spike': 0.1242177551098486, 'adx_thresh': 32.240177738481286, 'atr_min_pct': 0.009405473960932536, 'atr_max_pct': 0.03462746786267884, 'tp_mult': 1.5956350047288939, 'tsl_mult': 0.7775856377111696, 'strategy': 'breakout', 'time_stop': 103, 'use_sma': True, 'use_atr': True, 'use_adx': True, 'use_ema': True, 'use_spike': True, 'rsi_required': True, 'edge_k': 1.88700201023204, 'edge_cap': 0.9769644192303661, 'bull_strategy': 'breakout', 'bull_bb_std_mult': 3.079901231685309, 'bull_rsi_os': 12, 'bull_rsi_ob': 91, 'bull_adx_thresh': 13.179528407954189, 'bull_atr_min_pct': 1.7307404024719322e-05, 'bull_atr_max_pct': 0.12956186198933228, 'bull_tp_mult': 1.660398451845663, 'bull_tsl_mult': 0.49183430147759777, 'bull_time_stop': 300, 'bull_use_sma': False, 'bull_use_ema': True, 'bull_use_atr': True, 'bull_use_adx': False, 'bull_use_spike': True, 'bull_rsi_required': True, 'bear_strategy': 'breakout', 'bear_bb_std_mult': 1.3049581111763717, 'bear_rsi_os': 17, 'bear_rsi_ob': 55, 'bear_adx_thresh': 8.332477227139906, 'bear_atr_min_pct': 0.0014922038904137203, 'bear_atr_max_pct': 0.11180709019409392, 'bear_tp_mult': 2.123472762994916, 'bear_tsl_mult': 0.09278966731707236, 'bear_time_stop': 175, 'bear_use_sma': False, 'bear_use_ema': False, 'bear_use_atr': True, 'bear_use_adx': False, 'bear_use_spike': True, 'bear_rsi_required': False, 'sideways_strategy': 'mean_reversion', 'sideways_bb_std_mult': 3.210119940028258, 'sideways_rsi_os': 28, 'sideways_rsi_ob': 88, 'sideways_adx_thresh': 24.07737793426913, 'sideways_atr_min_pct': 0.004083398062114402, 'sideways_atr_max_pct': 0.11042784306404903, 'sideways_tp_mult': 2.4497668929633325, 'sideways_tsl_mult': 0.8410967496623265, 'sideways_time_stop': 174, 'sideways_use_sma': True, 'sideways_use_ema': True, 'sideways_use_atr': True, 'sideways_use_adx': True, 'sideways_use_spike': True, 'sideways_rsi_required': True}.
[I 2025-09-01 14:53:46,577] Trial 593 finished with values: [-0.08936646181419672, 0.08956574858741087] and parameters: {'p_sma': 30, 'p_std': 25, 'p_atr': 26, 'p_adx': 8, 'rsi_period': 16, 'ema1': 25, 'ema2': 12, 'slip_atr_k': 0.24473847661671808, 'slip_spread_k': 0.5462099125709974, 'spread_hl_frac': 0.010632686662529239, 'bb_std_mult': 3.5996845473315116, 'rsi_os': 15, 'rsi_ob': 79, 'vol_spike': 0.1583834067084806, 'adx_thresh': 19.598541122417735, 'atr_min_pct': 0.00934977005812728, 'atr_max_pct': 0.09730114015611, 'tp_mult': 1.3454665356630735, 'tsl_mult': 0.7123235663403025, 'strategy': 'mean_reversion', 'time_stop': 104, 'use_sma': True, 'use_atr': True, 'use_adx': True, 'use_ema': True, 'use_spike': True, 'rsi_required': True, 'edge_k': 1.8520364391043052, 'edge_cap': 0.9780262037086186, 'bull_strategy': 'mean_reversion', 'bull_bb_std_mult': 0.5041659551836881, 'bull_rsi_os': 15, 'bull_rsi_ob': 77, 'bull_adx_thresh': 13.254440553014053, 'bull_atr_min_pct': 0.012369882649311166, 'bull_atr_max_pct': 0.12863528811882952, 'bull_tp_mult': 2.7525632941902964, 'bull_tsl_mult': 0.48450160477095083, 'bull_time_stop': 64, 'bull_use_sma': False, 'bull_use_ema': True, 'bull_use_atr': True, 'bull_use_adx': False, 'bull_use_spike': True, 'bull_rsi_required': True, 'bear_strategy': 'mean_reversion', 'bear_bb_std_mult': 2.387070504095117, 'bear_rsi_os': 27, 'bear_rsi_ob': 55, 'bear_adx_thresh': 27.11521966130816, 'bear_atr_min_pct': 0.0013609616009164693, 'bear_atr_max_pct': 0.053970134321424404, 'bear_tp_mult': 2.227310355957068, 'bear_tsl_mult': 0.7107402825820823, 'bear_time_stop': 188, 'bear_use_sma': False, 'bear_use_ema': False, 'bear_use_atr': False, 'bear_use_adx': False, 'bear_use_spike': True, 'bear_rsi_required': False, 'sideways_strategy': 'mean_reversion', 'sideways_bb_std_mult': 0.9928712608274832, 'sideways_rsi_os': 43, 'sideways_rsi_ob': 92, 'sideways_adx_thresh': 24.27053937451913, 'sideways_atr_min_pct': 0.021339475321473195, 'sideways_atr_max_pct': 0.06793924400487014, 'sideways_tp_mult': 2.4093336722162366, 'sideways_tsl_mult': 0.8379632302874627, 'sideways_time_stop': 248, 'sideways_use_sma': True, 'sideways_use_ema': True, 'sideways_use_atr': True, 'sideways_use_adx': True, 'sideways_use_spike': True, 'sideways_rsi_required': False}.
