[I 2025-09-01 13:34:51,247] Trial 47 finished with values: [0.002822499946301571, 0.004146582176969237] and parameters: {'p_sma': 53, 'p_std': 52, 'p_atr': 15, 'p_adx': 26, 'rsi_period': 28, 'ema1': 5, 'ema2': 28, 'slip_atr_k': 0.004145806554636084, 'slip_spread_k': 0.1339761648413137, 'spread_hl_frac': 0.03761278156757558, 'bb_std_mult': 2.093505214938408, 'rsi_os': 43, 'rsi_ob': 66, 'vol_spike': 0.008968502286929289, 'adx_thresh': 19.26095972947785, 'atr_min_pct': 0.015475393552243803, 'atr_max_pct': 0.04080134527051653, 'tp_mult': 1.7958447157744863, 'tsl_mult': 0.6094610748175835, 'strategy': 'mean_reversion', 'time_stop': 107, 'use_sma': False, 'use_atr': True, 'use_adx': False, 'use_ema': False, 'use_spike': True, 'rsi_required': True, 'edge_k': 1.229181370987182, 'edge_cap': 0.2890096038823799, 'bull_strategy': 'breakout', 'bull_bb_std_mult': 1.2462516375785162, 'bull_rsi_os': 20, 'bull_rsi_ob': 56, 'bull_adx_thresh': 30.979687910013862, 'bull_atr_min_pct': 0.01387993603480129, 'bull_atr_max_pct': 0.011208951322916078, 'bull_tp_mult': 2.5345649964643617, 'bull_tsl_mult': 0.874183491560723, 'bull_time_stop': 197, 'bull_use_sma': False, 'bull_use_ema': True, 'bull_use_atr': False, 'bull_use_adx': True, 'bull_use_spike': False, 'bull_rsi_required': True, 'bear_strategy': 'mean_reversion', 'bear_bb_std_mult': 2.926634340204576, 'bear_rsi_os': 26, 'bear_rsi_ob': 54, 'bear_adx_thresh': 19.4037159245166, 'bear_atr_min_pct': 0.0027030832091938586, 'bear_atr_max_pct': 0.05663459558363124, 'bear_tp_mult': 2.326560741432363, 'bear_tsl_mult': 0.7695051564147014, 'bear_time_stop': 51, 'bear_use_sma': False, 'bear_use_ema': False, 'bear_use_atr': False, 'bear_use_adx': True, 'bear_use_spike': False, 'bear_rsi_required': True, 'sideways_strategy': 'breakout', 'sideways_bb_std_mult': 2.6009711028112426, 'sideways_rsi_os': 27, 'sideways_rsi_ob': 90, 'sideways_adx_thresh': 24.957267837360263, 'sideways_atr_min_pct': 0.017132855915303488, 'sideways_atr_max_pct': 0.0705305765864293, 'sideways_tp_mult': 2.5903197786651657, 'sideways_tsl_mult': 0.6218733611778522, 'sideways_time_stop': 267, 'sideways_use_sma': True, 'sideways_use_ema': False, 'sideways_use_atr': False, 'sideways_use_adx': True, 'sideways_use_spike': False, 'sideways_rsi_required': False}.
[I 2025-09-01 13:34:51,633] Trial 44 finished with values: [-1000000000.0, 1000000000.0] and parameters: {'p_sma': 53, 'p_std': 24, 'p_atr': 15, 'p_adx': 12, 'rsi_period': 26, 'ema1': 5, 'ema2': 28, 'slip_atr_k': 0.006024793111443593, 'slip_spread_k': 0.4344717682481554, 'spread_hl_frac': 0.03175549186454735, 'bb_std_mult': 1.7917980605984556, 'rsi_os': 34, 'rsi_ob': 65, 'vol_spike': 0.01094151706045278, 'adx_thresh': 25.269853388480712, 'atr_min_pct': 0.016142171277583977, 'atr_max_pct': 0.020897469342955055, 'tp_mult': 1.810656439549626, 'tsl_mult': 0.6102816779737343, 'strategy': 'mean_reversion', 'time_stop': 107, 'use_sma': True, 'use_atr': True, 'use_adx': True, 'use_ema': True, 'use_spike': True, 'rsi_required': True, 'edge_k': 1.201801315049067, 'edge_cap': 0.22359079539710552, 'bull_strategy': 'breakout', 'bull_bb_std_mult': 3.2782168866701538, 'bull_rsi_os': 19, 'bull_rsi_ob': 56, 'bull_adx_thresh': 31.04192025471582, 'bull_atr_min_pct': 0.013774564983763511, 'bull_atr_max_pct': 0.09004400262115084, 'bull_tp_mult': 2.506294425504508, 'bull_tsl_mult': 0.8419824022580997, 'bull_time_stop': 250, 'bull_use_sma': True, 'bull_use_ema': False, 'bull_use_atr': False, 'bull_use_adx': False, 'bull_use_spike': False, 'bull_rsi_required': True, 'bear_strategy': 'mean_reversion', 'bear_bb_std_mult': 2.962878030457755, 'bear_rsi_os': 12, 'bear_rsi_ob': 53, 'bear_adx_thresh': 12.564043582630754, 'bear_atr_min_pct': 0.01923878601889109, 'bear_atr_max_pct': 0.1031575477483153, 'bear_tp_mult': 2.3488638784424394, 'bear_tsl_mult': 0.8265009801576084, 'bear_time_stop': 23, 'bear_use_sma': False, 'bear_use_ema': False, 'bear_use_atr': True, 'bear_use_adx': True, 'bear_use_spike': True, 'bear_rsi_required': True, 'sideways_strategy': 'breakout', 'sideways_bb_std_mult': 2.9529003353130565, 'sideways_rsi_os': 27, 'sideways_rsi_ob': 91, 'sideways_adx_thresh': 19.765925427422495, 'sideways_atr_min_pct': 0.020389302917550763, 'sideways_atr_max_pct': 0.04518471088779975, 'sideways_tp_mult': 2.5992175663390658, 'sideways_tsl_mult': 0.7510621136714841, 'sideways_time_stop': 267, 'sideways_use_sma': False, 'sideways_use_ema': False, 'sideways_use_atr': False, 'sideways_use_adx': False, 'sideways_use_spike': False, 'sideways_rsi_required': False}.
[I 2025-09-01 13:34:51,963] Trial 45 finished with values: [-1000000000.0, 1000000000.0] and parameters: {'p_sma': 43, 'p_std': 37, 'p_atr': 30, 'p_adx': 12, 'rsi_period': 25, 'ema1': 28, 'ema2': 29, 'slip_atr_k': 0.004068092192578351, 'slip_spread_k': 0.12144039649896204, 'spread_hl_frac': 0.031059891272694245, 'bb_std_mult': 2.0470218307346415, 'rsi_os': 35, 'rsi_ob': 63, 'vol_spike': 0.0030545338055447124, 'adx_thresh': 19.340403829320053, 'atr_min_pct': 0.01598788152216206, 'atr_max_pct': 0.022841891389257702, 'tp_mult': 1.7911193892052422, 'tsl_mult': 0.6321676202159803, 'strategy': 'mean_reversion', 'time_stop': 109, 'use_sma': False, 'use_atr': True, 'use_adx': False, 'use_ema': False, 'use_spike': True, 'rsi_required': True, 'edge_k': 0.40017661192759335, 'edge_cap': 0.22523675830537726, 'bull_strategy': 'breakout', 'bull_bb_std_mult': 1.2384104907825122, 'bull_rsi_os': 19, 'bull_rsi_ob': 56, 'bull_adx_thresh': 30.706330327862112, 'bull_atr_min_pct': 0.013901631431217025, 'bull_atr_max_pct': 0.11909280870486201, 'bull_tp_mult': 1.3561032258769838, 'bull_tsl_mult': 0.8695533325512034, 'bull_time_stop': 193, 'bull_use_sma': False, 'bull_use_ema': False, 'bull_use_atr': False, 'bull_use_adx': False, 'bull_use_spike': False, 'bull_rsi_required': True, 'bear_strategy': 'breakout', 'bear_bb_std_mult': 2.935632544489205, 'bear_rsi_os': 26, 'bear_rsi_ob': 54, 'bear_adx_thresh': 26.540330266290816, 'bear_atr_min_pct': 0.025913516027071596, 'bear_atr_max_pct': 0.10909480130830727, 'bear_tp_mult': 2.3246360226745564, 'bear_tsl_mult': 0.5395323875374515, 'bear_time_stop': 145, 'bear_use_sma': False, 'bear_use_ema': False, 'bear_use_atr': False, 'bear_use_adx': True, 'bear_use_spike': False, 'bear_rsi_required': True, 'sideways_strategy': 'breakout', 'sideways_bb_std_mult': 0.5049938713063121, 'sideways_rsi_os': 27, 'sideways_rsi_ob': 92, 'sideways_adx_thresh': 25.303866646318873, 'sideways_atr_min_pct': 0.02112344206015086, 'sideways_atr_max_pct': 0.07080230846382782, 'sideways_tp_mult': 2.604723249275809, 'sideways_tsl_mult': 0.7339040302639658, 'sideways_time_stop': 262, 'sideways_use_sma': False, 'sideways_use_ema': False, 'sideways_use_atr': False, 'sideways_use_adx': False, 'sideways_use_spike': False, 'sideways_rsi_required': False}.
[I 2025-09-01 13:34:52,287] Trial 48 finished with values: [-1000000000.0, 1000000000.0] and parameters: {'p_sma': 36, 'p_std': 53, 'p_atr': 15, 'p_adx': 13, 'rsi_period': 28, 'ema1': 10, 'ema2': 27, 'slip_atr_k': 0.19603466529507804, 'slip_spread_k': 0.2841191781264517, 'spread_hl_frac': 0.03714699630038315, 'bb_std_mult': 2.365804057725065, 'rsi_os': 52, 'rsi_ob': 63, 'vol_spike': 0.007780267324234397, 'adx_thresh': 19.31496612165142, 'atr_min_pct': 0.020184830815381742, 'atr_max_pct': 0.06269620717988014, 'tp_mult': 2.103998653168289, 'tsl_mult': 0.07227928510657461, 'strategy': 'mean_reversion', 'time_stop': 109, 'use_sma': False, 'use_atr': True, 'use_adx': False, 'use_ema': False, 'use_spike': True, 'rsi_required': True, 'edge_k': 1.7229149648456148, 'edge_cap': 0.8228097844701492, 'bull_strategy': 'breakout', 'bull_bb_std_mult': 2.0131856988176224, 'bull_rsi_os': 15, 'bull_rsi_ob': 45, 'bull_adx_thresh': 30.04242231328742, 'bull_atr_min_pct': 0.00560259009470006, 'bull_atr_max_pct': 0.036378693099225, 'bull_tp_mult': 2.5353062729852134, 'bull_tsl_mult': 0.6040343664588644, 'bull_time_stop': 193, 'bull_use_sma': True, 'bull_use_ema': True, 'bull_use_atr': False, 'bull_use_adx': True, 'bull_use_spike': False, 'bull_rsi_required': False, 'bear_strategy': 'mean_reversion', 'bear_bb_std_mult': 2.958283462672016, 'bear_rsi_os': 11, 'bear_rsi_ob': 78, 'bear_adx_thresh': 26.876201302856646, 'bear_atr_min_pct': 0.026426265716366425, 'bear_atr_max_pct': 0.1073645003728339, 'bear_tp_mult': 2.3776128179552853, 'bear_tsl_mult': 0.5052097573114767, 'bear_time_stop': 50, 'bear_use_sma': False, 'bear_use_ema': False, 'bear_use_atr': True, 'bear_use_adx': True, 'bear_use_spike': False, 'bear_rsi_required': True, 'sideways_strategy': 'mean_reversion', 'sideways_bb_std_mult': 0.6206061436842719, 'sideways_rsi_os': 39, 'sideways_rsi_ob': 87, 'sideways_adx_thresh': 14.24782625071063, 'sideways_atr_min_pct': 0.01700485325660816, 'sideways_atr_max_pct': 0.10597911042567862, 'sideways_tp_mult': 1.825057311706069, 'sideways_tsl_mult': 0.6269477846051308, 'sideways_time_stop': 37, 'sideways_use_sma': True, 'sideways_use_ema': True, 'sideways_use_atr': False, 'sideways_use_adx': True, 'sideways_use_spike': False, 'sideways_rsi_required': False}.
[I 2025-09-01 13:35:31,522] Trial 52 finished with values: [-1000000000.0, 1000000000.0] and parameters: {'p_sma': 19, 'p_std': 60, 'p_atr': 18, 'p_adx': 26, 'rsi_period': 22, 'ema1': 14, 'ema2': 22, 'slip_atr_k': 0.12133711241632228, 'slip_spread_k': 0.007613693659360432, 'spread_hl_frac': 0.027406613453618524, 'bb_std_mult': 2.329373889667688, 'rsi_os': 43, 'rsi_ob': 47, 'vol_spike': 0.16346647916854287, 'adx_thresh': 28.18160622475917, 'atr_min_pct': 0.02013800612726244, 'atr_max_pct': 0.03978895049228087, 'tp_mult': 1.6509158832358248, 'tsl_mult': 0.481497350999341, 'strategy': 'breakout', 'time_stop': 248, 'use_sma': True, 'use_atr': True, 'use_adx': False, 'use_ema': False, 'use_spike': False, 'rsi_required': False, 'edge_k': 0.7818930958930432, 'edge_cap': 0.29169025592771775, 'bull_strategy': 'mean_reversion', 'bull_bb_std_mult': 2.7196958439399554, 'bull_rsi_os': 38, 'bull_rsi_ob': 50, 'bull_adx_thresh': 20.91331119261186, 'bull_atr_min_pct': 0.007034478683309822, 'bull_atr_max_pct': 0.14426114978540222, 'bull_tp_mult': 1.7412110396647973, 'bull_tsl_mult': 0.7007494822769965, 'bull_time_stop': 78, 'bull_use_sma': False, 'bull_use_ema': True, 'bull_use_atr': False, 'bull_use_adx': True, 'bull_use_spike': True, 'bull_rsi_required': False, 'bear_strategy': 'breakout', 'bear_bb_std_mult': 0.5129268963741411, 'bear_rsi_os': 49, 'bear_rsi_ob': 89, 'bear_adx_thresh': 9.791949009216456, 'bear_atr_min_pct': 0.015002677722754126, 'bear_atr_max_pct': 0.05678258622454112, 'bear_tp_mult': 2.7910259295693143, 'bear_tsl_mult': 0.4229494709908942, 'bear_time_stop': 212, 'bear_use_sma': True, 'bear_use_ema': True, 'bear_use_atr': False, 'bear_use_adx': True, 'bear_use_spike': False, 'bear_rsi_required': True, 'sideways_strategy': 'mean_reversion', 'sideways_bb_std_mult': 3.2392961144944437, 'sideways_rsi_os': 41, 'sideways_rsi_ob': 52, 'sideways_adx_thresh': 7.622729840687672, 'sideways_atr_min_pct': 0.010941436444993562, 'sideways_atr_max_pct': 0.020955183453546078, 'sideways_tp_mult': 1.274997903462559, 'sideways_tsl_mult': 0.8354069694749926, 'sideways_time_stop': 22, 'sideways_use_sma': True, 'sideways_use_ema': True, 'sideways_use_atr': True, 'sideways_use_adx': True, 'sideways_use_spike': False, 'sideways_rsi_required': False}.
[I 2025-09-01 13:35:31,917] Trial 50 finished with values: [-1000000000.0, 1000000000.0] and parameters: {'p_sma': 36, 'p_std': 37, 'p_atr': 30, 'p_adx': 26, 'rsi_period': 21, 'ema1': 10, 'ema2': 43, 'slip_atr_k': 0.2035362327280087, 'slip_spread_k': 0.006180889164665804, 'spread_hl_frac': 0.03721907639622804, 'bb_std_mult': 2.3131738419445678, 'rsi_os': 53, 'rsi_ob': 67, 'vol_spike': 0.038300043669421274, 'adx_thresh': 19.49862318650254, 'atr_min_pct': 0.020450022625476384, 'atr_max_pct': 0.03910807744129589, 'tp_mult': 1.6064258770798427, 'tsl_mult': 0.7508150797091779, 'strategy': 'breakout', 'time_stop': 239, 'use_sma': False, 'use_atr': True, 'use_adx': False, 'use_ema': False, 'use_spike': True, 'rsi_required': True, 'edge_k': 1.8001026164653533, 'edge_cap': 0.6752823417490413, 'bull_strategy': 'breakout', 'bull_bb_std_mult': 1.9383142252335683, 'bull_rsi_os': 27, 'bull_rsi_ob': 50, 'bull_adx_thresh': 34.67515255935477, 'bull_atr_min_pct': 0.006686952924590865, 'bull_atr_max_pct': 0.034102150047249806, 'bull_tp_mult': 1.756863879709757, 'bull_tsl_mult': 0.6084494251702092, 'bull_time_stop': 200, 'bull_use_sma': False, 'bull_use_ema': True, 'bull_use_atr': False, 'bull_use_adx': True, 'bull_use_spike': False, 'bull_rsi_required': False, 'bear_strategy': 'mean_reversion', 'bear_bb_std_mult': 3.2176569915933277, 'bear_rsi_os': 45, 'bear_rsi_ob': 77, 'bear_adx_thresh': 9.949760158006516, 'bear_atr_min_pct': 0.026981653998017316, 'bear_atr_max_pct': 0.05796673779209863, 'bear_tp_mult': 2.9079304831707518, 'bear_tsl_mult': 0.4676197612843055, 'bear_time_stop': 103, 'bear_use_sma': True, 'bear_use_ema': True, 'bear_use_atr': False, 'bear_use_adx': True, 'bear_use_spike': False, 'bear_rsi_required': True, 'sideways_strategy': 'mean_reversion', 'sideways_bb_std_mult': 0.5614800791615455, 'sideways_rsi_os': 41, 'sideways_rsi_ob': 87, 'sideways_adx_thresh': 15.058150395184676, 'sideways_atr_min_pct': 0.017146769359286575, 'sideways_atr_max_pct': 0.07370472371254819, 'sideways_tp_mult': 1.3682610777547828, 'sideways_tsl_mult': 0.8185759204010417, 'sideways_time_stop': 19, 'sideways_use_sma': True, 'sideways_use_ema': True, 'sideways_use_atr': False, 'sideways_use_adx': True, 'sideways_use_spike': False, 'sideways_rsi_required': False}.
[I 2025-09-01 13:35:32,394] Trial 49 finished with values: [-1000000000.0, 1000000000.0] and parameters: {'p_sma': 18, 'p_std': 36, 'p_atr': 30, 'p_adx': 26, 'rsi_period': 22, 'ema1': 28, 'ema2': 44, 'slip_atr_k': 0.2061893423003665, 'slip_spread_k': 0.12753860933113953, 'spread_hl_frac': 0.020812823708864683, 'bb_std_mult': 3.0498131709304763, 'rsi_os': 43, 'rsi_ob': 68, 'vol_spike': 0.051544686403822024, 'adx_thresh': 5.098002232821781, 'atr_min_pct': 0.00010295813752764053, 'atr_max_pct': 0.041886158580392484, 'tp_mult': 2.0967277104434956, 'tsl_mult': 0.07827156338023658, 'strategy': 'breakout', 'time_stop': 250, 'use_sma': False, 'use_atr': True, 'use_adx': False, 'use_ema': False, 'use_spike': True, 'rsi_required': True, 'edge_k': 0.3743483046122872, 'edge_cap': 0.7449343375707731, 'bull_strategy': 'breakout', 'bull_bb_std_mult': 1.959268124914208, 'bull_rsi_os': 28, 'bull_rsi_ob': 50, 'bull_adx_thresh': 6.8478655060717895, 'bull_atr_min_pct': 0.0062941698792441485, 'bull_atr_max_pct': 0.03279158717019665, 'bull_tp_mult': 1.7167030179322107, 'bull_tsl_mult': 0.4233514621715545, 'bull_time_stop': 194, 'bull_use_sma': False, 'bull_use_ema': True, 'bull_use_atr': False, 'bull_use_adx': True, 'bull_use_spike': False, 'bull_rsi_required': False, 'bear_strategy': 'mean_reversion', 'bear_bb_std_mult': 2.348582507489964, 'bear_rsi_os': 25, 'bear_rsi_ob': 77, 'bear_adx_thresh': 26.432838380919698, 'bear_atr_min_pct': 0.002590945332519098, 'bear_atr_max_pct': 0.05497131310003826, 'bear_tp_mult': 2.7496702294156505, 'bear_tsl_mult': 0.5208014582515424, 'bear_time_stop': 52, 'bear_use_sma': True, 'bear_use_ema': True, 'bear_use_atr': False, 'bear_use_adx': True, 'bear_use_spike': False, 'bear_rsi_required': True, 'sideways_strategy': 'mean_reversion', 'sideways_bb_std_mult': 0.616565460055634, 'sideways_rsi_os': 40, 'sideways_rsi_ob': 88, 'sideways_adx_thresh': 14.645990809943406, 'sideways_atr_min_pct': 0.017379874344368603, 'sideways_atr_max_pct': 0.09011389482022822, 'sideways_tp_mult': 1.8689175612142621, 'sideways_tsl_mult': 0.830606306513432, 'sideways_time_stop': 37, 'sideways_use_sma': True, 'sideways_use_ema': True, 'sideways_use_atr': False, 'sideways_use_adx': True, 'sideways_use_spike': False, 'sideways_rsi_required': False}.
[I 2025-09-01 13:35:32,404] Trial 51 finished with values: [-1000000000.0, 1000000000.0] and parameters: {'p_sma': 60, 'p_std': 31, 'p_atr': 12, 'p_adx': 26, 'rsi_period': 21, 'ema1': 10, 'ema2': 53, 'slip_atr_k': 0.19454698154113415, 'slip_spread_k': 0.010928304528949051, 'spread_hl_frac': 0.0378284616380522, 'bb_std_mult': 2.347475421370067, 'rsi_os': 43, 'rsi_ob': 46, 'vol_spike': 0.053771233416364465, 'adx_thresh': 28.07232077076632, 'atr_min_pct': 0.020549065454851276, 'atr_max_pct': 0.03916864258024931, 'tp_mult': 1.0130255018465597, 'tsl_mult': 0.7559665954151582, 'strategy': 'breakout', 'time_stop': 252, 'use_sma': False, 'use_atr': True, 'use_adx': False, 'use_ema': False, 'use_spike': False, 'rsi_required': True, 'edge_k': 1.7996625890695057, 'edge_cap': 0.8299648682087365, 'bull_strategy': 'mean_reversion', 'bull_bb_std_mult': 1.9015483341019557, 'bull_rsi_os': 9, 'bull_rsi_ob': 49, 'bull_adx_thresh': 33.987227888551125, 'bull_atr_min_pct': 0.006590997978014764, 'bull_atr_max_pct': 0.01124586201083412, 'bull_tp_mult': 1.7266129775293733, 'bull_tsl_mult': 0.6096730425040111, 'bull_time_stop': 61, 'bull_use_sma': True, 'bull_use_ema': True, 'bull_use_atr': False, 'bull_use_adx': True, 'bull_use_spike': True, 'bull_rsi_required': False, 'bear_strategy': 'mean_reversion', 'bear_bb_std_mult': 2.3440791649652093, 'bear_rsi_os': 43, 'bear_rsi_ob': 89, 'bear_adx_thresh': 10.196292700576677, 'bear_atr_min_pct': 0.0023459856212521943, 'bear_atr_max_pct': 0.05814768180394068, 'bear_tp_mult': 1.9313126060379076, 'bear_tsl_mult': 0.46074924782289844, 'bear_time_stop': 213, 'bear_use_sma': True, 'bear_use_ema': True, 'bear_use_atr': True, 'bear_use_adx': True, 'bear_use_spike': False, 'bear_rsi_required': True, 'sideways_strategy': 'mean_reversion', 'sideways_bb_std_mult': 0.6552250100463579, 'sideways_rsi_os': 39, 'sideways_rsi_ob': 88, 'sideways_adx_thresh': 9.131842307706863, 'sideways_atr_min_pct': 0.017248926015616433, 'sideways_atr_max_pct': 0.09052287020790951, 'sideways_tp_mult': 1.4418925683110402, 'sideways_tsl_mult': 0.8353107816636994, 'sideways_time_stop': 37, 'sideways_use_sma': True, 'sideways_use_ema': True, 'sideways_use_atr': True, 'sideways_use_adx': True, 'sideways_use_spike': False, 'sideways_rsi_required': False}.
[I 2025-09-01 13:35:32,726] Trial 53 finished with values: [-1000000000.0, 1000000000.0] and parameters: {'p_sma': 53, 'p_std': 31, 'p_atr': 9, 'p_adx': 17, 'rsi_period': 78, 'ema1': 7, 'ema2': 54, 'slip_atr_k': 0.2170778995260471, 'slip_spread_k': 0.998950349462099, 'spread_hl_frac': 0.02097843105119268, 'bb_std_mult': 1.4837900847345449, 'rsi_os': 17, 'rsi_ob': 67, 'vol_spike': 0.06317719474966052, 'adx_thresh': 5.399415269430431, 'atr_min_pct': 0.022018873484125255, 'atr_max_pct': 0.010849857392494692, 'tp_mult': 1.987670578638814, 'tsl_mult': 0.7277335186201171, 'strategy': 'breakout', 'time_stop': 34, 'use_sma': True, 'use_atr': False, 'use_adx': False, 'use_ema': False, 'use_spike': True, 'rsi_required': False, 'edge_k': 1.4822163750632757, 'edge_cap': 0.691875713706821, 'bull_strategy': 'mean_reversion', 'bull_bb_std_mult': 3.58212589242448, 'bull_rsi_os': 29, 'bull_rsi_ob': 59, 'bull_adx_thresh': 34.299795897241154, 'bull_atr_min_pct': 0.002707704668839477, 'bull_atr_max_pct': 0.01565281315993569, 'bull_tp_mult': 1.2058211069931726, 'bull_tsl_mult': 0.5292508218456016, 'bull_time_stop': 59, 'bull_use_sma': True, 'bull_use_ema': True, 'bull_use_atr': True, 'bull_use_adx': True, 'bull_use_spike': False, 'bull_rsi_required': False, 'bear_strategy': 'mean_reversion', 'bear_bb_std_mult': 2.35513559389268, 'bear_rsi_os': 45, 'bear_rsi_ob': 72, 'bear_adx_thresh': 7.190229617257874, 'bear_atr_min_pct': 0.003738869951348039, 'bear_atr_max_pct': 0.07489052940136073, 'bear_tp_mult': 1.955031142842907, 'bear_tsl_mult': 0.22959100270001942, 'bear_time_stop': 110, 'bear_use_sma': True, 'bear_use_ema': True, 'bear_use_atr': False, 'bear_use_adx': False, 'bear_use_spike': False, 'bear_rsi_required': False, 'sideways_strategy': 'breakout', 'sideways_bb_std_mult': 1.2156420293214234, 'sideways_rsi_os': 9, 'sideways_rsi_ob': 82, 'sideways_adx_thresh': 17.906103855346814, 'sideways_atr_min_pct': 0.01646163319137917, 'sideways_atr_max_pct': 0.09117779212066174, 'sideways_tp_mult': 1.392108539014059, 'sideways_tsl_mult': 0.10164678085858259, 'sideways_time_stop': 96, 'sideways_use_sma': True, 'sideways_use_ema': True, 'sideways_use_atr': True, 'sideways_use_adx': True, 'sideways_use_spike': True, 'sideways_rsi_required': True}.
