[I 2025-09-01 13:48:52,050] Trial 145 finished with values: [-1000000000.0, 1000000000.0] and parameters: {'p_sma': 23, 'p_std': 29, 'p_atr': 7, 'p_adx': 25, 'rsi_period': 27, 'ema1': 16, 'ema2': 41, 'slip_atr_k': 0.14802647031527463, 'slip_spread_k': 0.5424601904080374, 'spread_hl_frac': 0.026409548250005042, 'bb_std_mult': 2.8583766726854627, 'rsi_os': 9, 'rsi_ob': 77, 'vol_spike': 0.10191317856194577, 'adx_thresh': 21.95282599262581, 'atr_min_pct': 0.018260746660465364, 'atr_max_pct': 0.01534815932089506, 'tp_mult': 1.297593233573172, 'tsl_mult': 0.06534323112461804, 'strategy': 'breakout', 'time_stop': 85, 'use_sma': True, 'use_atr': True, 'use_adx': False, 'use_ema': False, 'use_spike': True, 'rsi_required': False, 'edge_k': 0.7204692166225313, 'edge_cap': 0.24834787169556816, 'bull_strategy': 'mean_reversion', 'bull_bb_std_mult': 0.9642535455482422, 'bull_rsi_os': 20, 'bull_rsi_ob': 54, 'bull_adx_thresh': 11.431031069093962, 'bull_atr_min_pct': 0.02692043580835718, 'bull_atr_max_pct': 0.13314435917183567, 'bull_tp_mult': 1.5562783542633012, 'bull_tsl_mult': 0.05071543256139599, 'bull_time_stop': 83, 'bull_use_sma': False, 'bull_use_ema': True, 'bull_use_atr': True, 'bull_use_adx': True, 'bull_use_spike': False, 'bull_rsi_required': False, 'bear_strategy': 'breakout', 'bear_bb_std_mult': 2.5501540473813336, 'bear_rsi_os': 17, 'bear_rsi_ob': 66, 'bear_adx_thresh': 10.348813998622152, 'bear_atr_min_pct': 0.013824260440343693, 'bear_atr_max_pct': 0.018978409730640466, 'bear_tp_mult': 1.7371866249571817, 'bear_tsl_mult': 0.18714302268737018, 'bear_time_stop': 55, 'bear_use_sma': False, 'bear_use_ema': True, 'bear_use_atr': False, 'bear_use_adx': True, 'bear_use_spike': False, 'bear_rsi_required': True, 'sideways_strategy': 'breakout', 'sideways_bb_std_mult': 3.599616394444803, 'sideways_rsi_os': 37, 'sideways_rsi_ob': 83, 'sideways_adx_thresh': 25.99392145321164, 'sideways_atr_min_pct': 0.007227032330494075, 'sideways_atr_max_pct': 0.12090135275792312, 'sideways_tp_mult': 1.0700631603322703, 'sideways_tsl_mult': 0.7861635291755625, 'sideways_time_stop': 246, 'sideways_use_sma': False, 'sideways_use_ema': True, 'sideways_use_atr': False, 'sideways_use_adx': False, 'sideways_use_spike': False, 'sideways_rsi_required': False}.
[I 2025-09-01 13:49:29,185] Trial 147 finished with values: [-1000000000.0, 1000000000.0] and parameters: {'p_sma': 11, 'p_std': 10, 'p_atr': 7, 'p_adx': 26, 'rsi_period': 55, 'ema1': 7, 'ema2': 45, 'slip_atr_k': 0.24617779912030693, 'slip_spread_k': 0.5330425472161867, 'spread_hl_frac': 0.026461053273033587, 'bb_std_mult': 2.042858920794205, 'rsi_os': 14, 'rsi_ob': 67, 'vol_spike': 0.2700339319330786, 'adx_thresh': 20.81892973730696, 'atr_min_pct': 0.018287490584843948, 'atr_max_pct': 0.14438796771659146, 'tp_mult': 1.3003261284013683, 'tsl_mult': 0.0023500906351070494, 'strategy': 'breakout', 'time_stop': 66, 'use_sma': True, 'use_atr': True, 'use_adx': False, 'use_ema': False, 'use_spike': True, 'rsi_required': False, 'edge_k': 1.1266743979623755, 'edge_cap': 0.24492440652321423, 'bull_strategy': 'mean_reversion', 'bull_bb_std_mult': 1.3093735812295537, 'bull_rsi_os': 19, 'bull_rsi_ob': 55, 'bull_adx_thresh': 10.769484098002057, 'bull_atr_min_pct': 0.027083666457687606, 'bull_atr_max_pct': 0.1386962345219098, 'bull_tp_mult': 1.5574449236327312, 'bull_tsl_mult': 0.6188696089927722, 'bull_time_stop': 89, 'bull_use_sma': False, 'bull_use_ema': True, 'bull_use_atr': True, 'bull_use_adx': True, 'bull_use_spike': False, 'bull_rsi_required': False, 'bear_strategy': 'breakout', 'bear_bb_std_mult': 2.603827215293863, 'bear_rsi_os': 50, 'bear_rsi_ob': 89, 'bear_adx_thresh': 6.255618419592517, 'bear_atr_min_pct': 0.004380220517337876, 'bear_atr_max_pct': 0.06887754580578509, 'bear_tp_mult': 1.8537083361537907, 'bear_tsl_mult': 0.19098171313282286, 'bear_time_stop': 156, 'bear_use_sma': False, 'bear_use_ema': True, 'bear_use_atr': True, 'bear_use_adx': True, 'bear_use_spike': False, 'bear_rsi_required': True, 'sideways_strategy': 'breakout', 'sideways_bb_std_mult': 0.5662688270207721, 'sideways_rsi_os': 55, 'sideways_rsi_ob': 55, 'sideways_adx_thresh': 10.508319289114173, 'sideways_atr_min_pct': 0.01935967728384378, 'sideways_atr_max_pct': 0.10682768603374859, 'sideways_tp_mult': 2.762727815547912, 'sideways_tsl_mult': 0.7863162824273122, 'sideways_time_stop': 246, 'sideways_use_sma': False, 'sideways_use_ema': True, 'sideways_use_atr': False, 'sideways_use_adx': False, 'sideways_use_spike': False, 'sideways_rsi_required': False}.
[I 2025-09-01 13:49:29,539] Trial 144 finished with values: [-1000000000.0, 1000000000.0] and parameters: {'p_sma': 10, 'p_std': 10, 'p_atr': 7, 'p_adx': 25, 'rsi_period': 50, 'ema1': 12, 'ema2': 38, 'slip_atr_k': 0.24717768329701534, 'slip_spread_k': 0.5510234022509493, 'spread_hl_frac': 0.03846061434450519, 'bb_std_mult': 2.9018522965541544, 'rsi_os': 8, 'rsi_ob': 77, 'vol_spike': 0.1209203270797137, 'adx_thresh': 21.901500279559514, 'atr_min_pct': 0.018325944699216626, 'atr_max_pct': 0.06602588777287305, 'tp_mult': 1.2371506907835312, 'tsl_mult': 0.0585362534477018, 'strategy': 'breakout', 'time_stop': 55, 'use_sma': True, 'use_atr': True, 'use_adx': False, 'use_ema': False, 'use_spike': True, 'rsi_required': False, 'edge_k': 0.12330799652153035, 'edge_cap': 0.15343291452704882, 'bull_strategy': 'mean_reversion', 'bull_bb_std_mult': 0.6945285682911251, 'bull_rsi_os': 20, 'bull_rsi_ob': 55, 'bull_adx_thresh': 7.42288152210105, 'bull_atr_min_pct': 0.027601656812911598, 'bull_atr_max_pct': 0.13828993800161232, 'bull_tp_mult': 2.841954307618259, 'bull_tsl_mult': 0.6154544513938298, 'bull_time_stop': 64, 'bull_use_sma': False, 'bull_use_ema': True, 'bull_use_atr': True, 'bull_use_adx': True, 'bull_use_spike': False, 'bull_rsi_required': False, 'bear_strategy': 'breakout', 'bear_bb_std_mult': 3.210966928651196, 'bear_rsi_os': 8, 'bear_rsi_ob': 66, 'bear_adx_thresh': 27.58668427216989, 'bear_atr_min_pct': 0.023635076498798264, 'bear_atr_max_pct': 0.019244207222858356, 'bear_tp_mult': 1.7417086182251622, 'bear_tsl_mult': 0.8623651316250973, 'bear_time_stop': 52, 'bear_use_sma': False, 'bear_use_ema': True, 'bear_use_atr': False, 'bear_use_adx': True, 'bear_use_spike': False, 'bear_rsi_required': True, 'sideways_strategy': 'breakout', 'sideways_bb_std_mult': 3.553307911565188, 'sideways_rsi_os': 37, 'sideways_rsi_ob': 69, 'sideways_adx_thresh': 32.786543682900614, 'sideways_atr_min_pct': 0.019350603306970426, 'sideways_atr_max_pct': 0.12100523900802156, 'sideways_tp_mult': 1.3282420075451369, 'sideways_tsl_mult': 0.8844054761937296, 'sideways_time_stop': 248, 'sideways_use_sma': False, 'sideways_use_ema': True, 'sideways_use_atr': False, 'sideways_use_adx': False, 'sideways_use_spike': False, 'sideways_rsi_required': False}.
[I 2025-09-01 13:49:29,891] Trial 146 finished with values: [-1000000000.0, 1000000000.0] and parameters: {'p_sma': 52, 'p_std': 23, 'p_atr': 22, 'p_adx': 26, 'rsi_period': 51, 'ema1': 7, 'ema2': 29, 'slip_atr_k': 0.2409210498436184, 'slip_spread_k': 0.5575949463150994, 'spread_hl_frac': 0.03942483173064656, 'bb_std_mult': 1.6870240871447, 'rsi_os': 19, 'rsi_ob': 77, 'vol_spike': 0.1024033138029319, 'adx_thresh': 24.11750880345255, 'atr_min_pct': 0.018372603573114887, 'atr_max_pct': 0.0797745351524915, 'tp_mult': 1.2842508708145495, 'tsl_mult': 0.0845968909237354, 'strategy': 'breakout', 'time_stop': 53, 'use_sma': True, 'use_atr': True, 'use_adx': False, 'use_ema': False, 'use_spike': True, 'rsi_required': False, 'edge_k': 1.1164171606885587, 'edge_cap': 0.2442582690214885, 'bull_strategy': 'mean_reversion', 'bull_bb_std_mult': 1.3573542610796248, 'bull_rsi_os': 20, 'bull_rsi_ob': 55, 'bull_adx_thresh': 10.583841292190383, 'bull_atr_min_pct': 0.027269834878511683, 'bull_atr_max_pct': 0.01711343619564673, 'bull_tp_mult': 1.5520299297952909, 'bull_tsl_mult': 0.03847461550143361, 'bull_time_stop': 87, 'bull_use_sma': False, 'bull_use_ema': True, 'bull_use_atr': False, 'bull_use_adx': True, 'bull_use_spike': False, 'bull_rsi_required': False, 'bear_strategy': 'breakout', 'bear_bb_std_mult': 0.5105914161102985, 'bear_rsi_os': 17, 'bear_rsi_ob': 53, 'bear_adx_thresh': 6.284875093390312, 'bear_atr_min_pct': 0.013360940690678598, 'bear_atr_max_pct': 0.06998250471081095, 'bear_tp_mult': 1.859029542487986, 'bear_tsl_mult': 0.19599452691850397, 'bear_time_stop': 52, 'bear_use_sma': False, 'bear_use_ema': True, 'bear_use_atr': False, 'bear_use_adx': True, 'bear_use_spike': False, 'bear_rsi_required': True, 'sideways_strategy': 'breakout', 'sideways_bb_std_mult': 0.8071325506011531, 'sideways_rsi_os': 39, 'sideways_rsi_ob': 68, 'sideways_adx_thresh': 10.9372886136577, 'sideways_atr_min_pct': 0.01938805776431793, 'sideways_atr_max_pct': 0.08171830608193764, 'sideways_tp_mult': 1.3562383091425247, 'sideways_tsl_mult': 0.7789630303233286, 'sideways_time_stop': 245, 'sideways_use_sma': False, 'sideways_use_ema': True, 'sideways_use_atr': False, 'sideways_use_adx': False, 'sideways_use_spike': False, 'sideways_rsi_required': False}.
[I 2025-09-01 13:49:30,149] Trial 148 finished with values: [-1000000000.0, 1000000000.0] and parameters: {'p_sma': 53, 'p_std': 51, 'p_atr': 7, 'p_adx': 26, 'rsi_period': 74, 'ema1': 7, 'ema2': 15, 'slip_atr_k': 0.025901660799262385, 'slip_spread_k': 0.49886005045287096, 'spread_hl_frac': 0.005809382738862957, 'bb_std_mult': 2.161162082666887, 'rsi_os': 47, 'rsi_ob': 69, 'vol_spike': 0.22896327212078754, 'adx_thresh': 24.33725714430176, 'atr_min_pct': 0.01594663210542128, 'atr_max_pct': 0.14502728303166917, 'tp_mult': 1.9362908686802545, 'tsl_mult': 0.003362209624821866, 'strategy': 'breakout', 'time_stop': 103, 'use_sma': True, 'use_atr': True, 'use_adx': False, 'use_ema': False, 'use_spike': True, 'rsi_required': False, 'edge_k': 1.1344994284019543, 'edge_cap': 0.3296036975752488, 'bull_strategy': 'mean_reversion', 'bull_bb_std_mult': 1.353842690573826, 'bull_rsi_os': 14, 'bull_rsi_ob': 55, 'bull_adx_thresh': 10.597810254409728, 'bull_atr_min_pct': 0.006687310812369052, 'bull_atr_max_pct': 0.11030247517031061, 'bull_tp_mult': 1.4503223064982793, 'bull_tsl_mult': 0.11613691330561043, 'bull_time_stop': 88, 'bull_use_sma': False, 'bull_use_ema': False, 'bull_use_atr': False, 'bull_use_adx': True, 'bull_use_spike': False, 'bull_rsi_required': False, 'bear_strategy': 'breakout', 'bear_bb_std_mult': 3.2323930005162245, 'bear_rsi_os': 8, 'bear_rsi_ob': 53, 'bear_adx_thresh': 6.2028799796861644, 'bear_atr_min_pct': 0.023849691174720505, 'bear_atr_max_pct': 0.069828812311628, 'bear_tp_mult': 1.8599934073507776, 'bear_tsl_mult': 0.8629230990682162, 'bear_time_stop': 41, 'bear_use_sma': False, 'bear_use_ema': True, 'bear_use_atr': True, 'bear_use_adx': True, 'bear_use_spike': False, 'bear_rsi_required': True, 'sideways_strategy': 'breakout', 'sideways_bb_std_mult': 0.5514941625908228, 'sideways_rsi_os': 39, 'sideways_rsi_ob': 84, 'sideways_adx_thresh': 11.390671015201258, 'sideways_atr_min_pct': 0.016144616718302057, 'sideways_atr_max_pct': 0.14013701193176745, 'sideways_tp_mult': 1.375345683201705, 'sideways_tsl_mult': 0.4103335344862771, 'sideways_time_stop': 248, 'sideways_use_sma': False, 'sideways_use_ema': True, 'sideways_use_atr': False, 'sideways_use_adx': False, 'sideways_use_spike': False, 'sideways_rsi_required': True}.
[I 2025-09-01 13:50:07,180] Trial 152 finished with values: [-1000000000.0, 1000000000.0] and parameters: {'p_sma': 7, 'p_std': 59, 'p_atr': 24, 'p_adx': 28, 'rsi_period': 33, 'ema1': 9, 'ema2': 26, 'slip_atr_k': 0.018591211717843156, 'slip_spread_k': 0.09430195652052326, 'spread_hl_frac': 0.0014881483447130063, 'bb_std_mult': 2.015238489012944, 'rsi_os': 17, 'rsi_ob': 58, 'vol_spike': 0.04775860252284066, 'adx_thresh': 15.491000805155805, 'atr_min_pct': 0.013481416781501847, 'atr_max_pct': 0.026938378228522953, 'tp_mult': 1.8656881298391144, 'tsl_mult': 0.1452586149541037, 'strategy': 'mean_reversion', 'time_stop': 114, 'use_sma': False, 'use_atr': True, 'use_adx': True, 'use_ema': True, 'use_spike': True, 'rsi_required': False, 'edge_k': 1.2491730978754385, 'edge_cap': 0.2799267942749023, 'bull_strategy': 'breakout', 'bull_bb_std_mult': 2.949830065797457, 'bull_rsi_os': 24, 'bull_rsi_ob': 69, 'bull_adx_thresh': 8.407799870572635, 'bull_atr_min_pct': 0.018242821373551737, 'bull_atr_max_pct': 0.12576611500518783, 'bull_tp_mult': 2.335741322191854, 'bull_tsl_mult': 0.580327065259555, 'bull_time_stop': 99, 'bull_use_sma': False, 'bull_use_ema': False, 'bull_use_atr': False, 'bull_use_adx': True, 'bull_use_spike': True, 'bull_rsi_required': False, 'bear_strategy': 'breakout', 'bear_bb_std_mult': 1.4487126598722002, 'bear_rsi_os': 10, 'bear_rsi_ob': 55, 'bear_adx_thresh': 5.54381393628077, 'bear_atr_min_pct': 0.0036060400156812653, 'bear_atr_max_pct': 0.0259436139536936, 'bear_tp_mult': 2.183544622722568, 'bear_tsl_mult': 0.8175930313569383, 'bear_time_stop': 29, 'bear_use_sma': True, 'bear_use_ema': False, 'bear_use_atr': False, 'bear_use_adx': False, 'bear_use_spike': True, 'bear_rsi_required': False, 'sideways_strategy': 'breakout', 'sideways_bb_std_mult': 2.8182628169866035, 'sideways_rsi_os': 34, 'sideways_rsi_ob': 71, 'sideways_adx_thresh': 5.744028801115897, 'sideways_atr_min_pct': 0.0206320598027664, 'sideways_atr_max_pct': 0.11216108429687915, 'sideways_tp_mult': 2.100762653734193, 'sideways_tsl_mult': 0.14804311966139494, 'sideways_time_stop': 236, 'sideways_use_sma': True, 'sideways_use_ema': False, 'sideways_use_atr': True, 'sideways_use_adx': False, 'sideways_use_spike': False, 'sideways_rsi_required': True}.
[I 2025-09-01 13:50:09,203] Trial 151 finished with values: [-0.049305788414413465, 0.049551094594957365] and parameters: {'p_sma': 21, 'p_std': 52, 'p_atr': 20, 'p_adx': 27, 'rsi_period': 20, 'ema1': 8, 'ema2': 60, 'slip_atr_k': 0.02616844100501303, 'slip_spread_k': 0.4975950519551, 'spread_hl_frac': 0.00588599555092137, 'bb_std_mult': 2.184640509860779, 'rsi_os': 30, 'rsi_ob': 59, 'vol_spike': 0.0495589550212364, 'adx_thresh': 8.091146226065044, 'atr_min_pct': 0.02412476825715011, 'atr_max_pct': 0.025516090161372584, 'tp_mult': 1.9421463585014833, 'tsl_mult': 0.9951183146926328, 'strategy': 'mean_reversion', 'time_stop': 75, 'use_sma': False, 'use_atr': True, 'use_adx': True, 'use_ema': True, 'use_spike': True, 'rsi_required': False, 'edge_k': 1.243781264182355, 'edge_cap': 0.5254054087281582, 'bull_strategy': 'breakout', 'bull_bb_std_mult': 1.2102634058640158, 'bull_rsi_os': 24, 'bull_rsi_ob': 51, 'bull_adx_thresh': 11.661463294814107, 'bull_atr_min_pct': 0.004724112660485771, 'bull_atr_max_pct': 0.0982361654739408, 'bull_tp_mult': 2.682821612774009, 'bull_tsl_mult': 0.10914722655196774, 'bull_time_stop': 99, 'bull_use_sma': False, 'bull_use_ema': False, 'bull_use_atr': False, 'bull_use_adx': True, 'bull_use_spike': True, 'bull_rsi_required': False, 'bear_strategy': 'breakout', 'bear_bb_std_mult': 2.8586219403040776, 'bear_rsi_os': 10, 'bear_rsi_ob': 51, 'bear_adx_thresh': 18.586980160048093, 'bear_atr_min_pct': 0.0005449052450259536, 'bear_atr_max_pct': 0.05804979845160132, 'bear_tp_mult': 2.0363927768510544, 'bear_tsl_mult': 0.4382183858603328, 'bear_time_stop': 42, 'bear_use_sma': False, 'bear_use_ema': False, 'bear_use_atr': True, 'bear_use_adx': True, 'bear_use_spike': True, 'bear_rsi_required': True, 'sideways_strategy': 'breakout', 'sideways_bb_std_mult': 2.584157693605524, 'sideways_rsi_os': 6, 'sideways_rsi_ob': 84, 'sideways_adx_thresh': 26.86444680866966, 'sideways_atr_min_pct': 0.0239408966633955, 'sideways_atr_max_pct': 0.13938759262412664, 'sideways_tp_mult': 1.1462388098236953, 'sideways_tsl_mult': 0.7009775383807698, 'sideways_time_stop': 168, 'sideways_use_sma': True, 'sideways_use_ema': True, 'sideways_use_atr': True, 'sideways_use_adx': False, 'sideways_use_spike': False, 'sideways_rsi_required': True}.
[I 2025-09-01 13:50:10,638] Trial 149 finished with values: [-1000000000.0, 1000000000.0] and parameters: {'p_sma': 48, 'p_std': 60, 'p_atr': 20, 'p_adx': 27, 'rsi_period': 25, 'ema1': 7, 'ema2': 29, 'slip_atr_k': 0.01675358346333964, 'slip_spread_k': 0.4975667376611173, 'spread_hl_frac': 0.036452206744966485, 'bb_std_mult': 2.160612291514241, 'rsi_os': 47, 'rsi_ob': 78, 'vol_spike': 0.15503435873328666, 'adx_thresh': 8.280263007211563, 'atr_min_pct': 0.024151595186681814, 'atr_max_pct': 0.026680860528471618, 'tp_mult': 1.945012868409986, 'tsl_mult': 0.08354568771521427, 'strategy': 'breakout', 'time_stop': 98, 'use_sma': True, 'use_atr': True, 'use_adx': True, 'use_ema': False, 'use_spike': True, 'rsi_required': False, 'edge_k': 0.9632627194703455, 'edge_cap': 0.28964030043293865, 'bull_strategy': 'breakout', 'bull_bb_std_mult': 1.3588583253254525, 'bull_rsi_os': 23, 'bull_rsi_ob': 51, 'bull_adx_thresh': 8.596423823547276, 'bull_atr_min_pct': 0.00648341674923847, 'bull_atr_max_pct': 0.11017443102876237, 'bull_tp_mult': 1.4458871716990207, 'bull_tsl_mult': 0.5689725693229121, 'bull_time_stop': 164, 'bull_use_sma': False, 'bull_use_ema': False, 'bull_use_atr': False, 'bull_use_adx': True, 'bull_use_spike': False, 'bull_rsi_required': False, 'bear_strategy': 'breakout', 'bear_bb_std_mult': 2.862663686267653, 'bear_rsi_os': 8, 'bear_rsi_ob': 77, 'bear_adx_thresh': 5.5902408947655156, 'bear_atr_min_pct': 0.007392287278773037, 'bear_atr_max_pct': 0.027795342217523812, 'bear_tp_mult': 2.040849025280109, 'bear_tsl_mult': 0.11695494494493458, 'bear_time_stop': 43, 'bear_use_sma': False, 'bear_use_ema': False, 'bear_use_atr': False, 'bear_use_adx': True, 'bear_use_spike': False, 'bear_rsi_required': True, 'sideways_strategy': 'breakout', 'sideways_bb_std_mult': 0.7983686083489112, 'sideways_rsi_os': 39, 'sideways_rsi_ob': 85, 'sideways_adx_thresh': 11.611784124646812, 'sideways_atr_min_pct': 0.024713409958294234, 'sideways_atr_max_pct': 0.13936510422409726, 'sideways_tp_mult': 2.8775548960870654, 'sideways_tsl_mult': 0.6919385536808014, 'sideways_time_stop': 236, 'sideways_use_sma': True, 'sideways_use_ema': True, 'sideways_use_atr': True, 'sideways_use_adx': False, 'sideways_use_spike': False, 'sideways_rsi_required': True}.
[I 2025-09-01 13:50:11,385] Trial 150 finished with values: [-1000000000.0, 1000000000.0] and parameters: {'p_sma': 53, 'p_std': 56, 'p_atr': 21, 'p_adx': 27, 'rsi_period': 24, 'ema1': 7, 'ema2': 20, 'slip_atr_k': 0.0254587844687685, 'slip_spread_k': 0.4994258454068503, 'spread_hl_frac': 0.03671807172715468, 'bb_std_mult': 1.6729216830423606, 'rsi_os': 19, 'rsi_ob': 59, 'vol_spike': 0.2097045242609506, 'adx_thresh': 24.06094675066312, 'atr_min_pct': 0.01699162410502052, 'atr_max_pct': 0.026924202632823545, 'tp_mult': 1.6363658415999354, 'tsl_mult': 0.0897594569402465, 'strategy': 'mean_reversion', 'time_stop': 75, 'use_sma': False, 'use_atr': True, 'use_adx': True, 'use_ema': True, 'use_spike': True, 'rsi_required': False, 'edge_k': 1.2421393586441072, 'edge_cap': 0.3222606978521183, 'bull_strategy': 'breakout', 'bull_bb_std_mult': 1.3565083668558175, 'bull_rsi_os': 5, 'bull_rsi_ob': 51, 'bull_adx_thresh': 10.668118537947164, 'bull_atr_min_pct': 0.007095868715969988, 'bull_atr_max_pct': 0.031775214823844475, 'bull_tp_mult': 1.4431297004490897, 'bull_tsl_mult': 0.576119457448293, 'bull_time_stop': 169, 'bull_use_sma': False, 'bull_use_ema': False, 'bull_use_atr': False, 'bull_use_adx': True, 'bull_use_spike': True, 'bull_rsi_required': False, 'bear_strategy': 'breakout', 'bear_bb_std_mult': 2.090973151275795, 'bear_rsi_os': 10, 'bear_rsi_ob': 51, 'bear_adx_thresh': 22.25116152901416, 'bear_atr_min_pct': 0.02129687671444192, 'bear_atr_max_pct': 0.07137621263310202, 'bear_tp_mult': 2.201932976228779, 'bear_tsl_mult': 0.12820256198272986, 'bear_time_stop': 177, 'bear_use_sma': False, 'bear_use_ema': False, 'bear_use_atr': False, 'bear_use_adx': True, 'bear_use_spike': True, 'bear_rsi_required': True, 'sideways_strategy': 'breakout', 'sideways_bb_std_mult': 0.812362156572277, 'sideways_rsi_os': 39, 'sideways_rsi_ob': 84, 'sideways_adx_thresh': 26.534661668682304, 'sideways_atr_min_pct': 0.0025861088225791664, 'sideways_atr_max_pct': 0.13946006736814365, 'sideways_tp_mult': 2.0833765032645095, 'sideways_tsl_mult': 0.14163749967380496, 'sideways_time_stop': 239, 'sideways_use_sma': True, 'sideways_use_ema': True, 'sideways_use_atr': True, 'sideways_use_adx': False, 'sideways_use_spike': False, 'sideways_rsi_required': True}.
