[I 2025-09-01 14:48:33,552] Trial 558 finished with values: [-0.02864899309197322, 0.029079343021897432] and parameters: {'p_sma': 27, 'p_std': 14, 'p_atr': 28, 'p_adx': 8, 'rsi_period': 58, 'ema1': 19, 'ema2': 59, 'slip_atr_k': 0.15235032919625272, 'slip_spread_k': 0.5677061847832534, 'spread_hl_frac': 0.01877314560514235, 'bb_std_mult': 3.583543880648655, 'rsi_os': 6, 'rsi_ob': 54, 'vol_spike': 0.1402692972370076, 'adx_thresh': 5.000808450270383, 'atr_min_pct': 0.010614251797806675, 'atr_max_pct': 0.03235994718749941, 'tp_mult': 1.6255963866418677, 'tsl_mult': 0.29229954870198444, 'strategy': 'mean_reversion', 'time_stop': 268, 'use_sma': True, 'use_atr': False, 'use_adx': False, 'use_ema': True, 'use_spike': True, 'rsi_required': True, 'edge_k': 0.696091069169734, 'edge_cap': 0.9592818968164186, 'bull_strategy': 'mean_reversion', 'bull_bb_std_mult': 1.64940386688178, 'bull_rsi_os': 14, 'bull_rsi_ob': 80, 'bull_adx_thresh': 9.601812474272982, 'bull_atr_min_pct': 0.013199502975543618, 'bull_atr_max_pct': 0.127004185826822, 'bull_tp_mult': 1.5345795751788887, 'bull_tsl_mult': 0.44187854353768297, 'bull_time_stop': 137, 'bull_use_sma': True, 'bull_use_ema': True, 'bull_use_atr': True, 'bull_use_adx': False, 'bull_use_spike': True, 'bull_rsi_required': True, 'bear_strategy': 'mean_reversion', 'bear_bb_std_mult': 2.3878328745963, 'bear_rsi_os': 35, 'bear_rsi_ob': 57, 'bear_adx_thresh': 9.352006747884044, 'bear_atr_min_pct': 0.002852605903547874, 'bear_atr_max_pct': 0.10834806095538141, 'bear_tp_mult': 2.0854417965450875, 'bear_tsl_mult': 0.8758003279696694, 'bear_time_stop': 81, 'bear_use_sma': False, 'bear_use_ema': False, 'bear_use_atr': False, 'bear_use_adx': False, 'bear_use_spike': False, 'bear_rsi_required': False, 'sideways_strategy': 'mean_reversion', 'sideways_bb_std_mult': 2.990925271548852, 'sideways_rsi_os': 31, 'sideways_rsi_ob': 89, 'sideways_adx_thresh': 23.47388914753796, 'sideways_atr_min_pct': 0.00254474217835537, 'sideways_atr_max_pct': 0.14127654695936526, 'sideways_tp_mult': 2.4506931478446385, 'sideways_tsl_mult': 0.41843792456027207, 'sideways_time_stop': 267, 'sideways_use_sma': True, 'sideways_use_ema': False, 'sideways_use_atr': True, 'sideways_use_adx': False, 'sideways_use_spike': False, 'sideways_rsi_required': False}.
[I 2025-09-01 14:49:14,968] Trial 559 finished with values: [-1000000000.0, 1000000000.0] and parameters: {'p_sma': 27, 'p_std': 28, 'p_atr': 27, 'p_adx': 8, 'rsi_period': 58, 'ema1': 14, 'ema2': 59, 'slip_atr_k': 0.010117998048914445, 'slip_spread_k': 0.7601367110044287, 'spread_hl_frac': 0.013378086386655753, 'bb_std_mult': 3.55691936264622, 'rsi_os': 5, 'rsi_ob': 48, 'vol_spike': 0.1407895987381565, 'adx_thresh': 5.554152634142086, 'atr_min_pct': 0.00988620428059098, 'atr_max_pct': 0.031544363203230695, 'tp_mult': 1.8118861339801426, 'tsl_mult': 0.29075598147779025, 'strategy': 'breakout', 'time_stop': 265, 'use_sma': True, 'use_atr': False, 'use_adx': False, 'use_ema': True, 'use_spike': True, 'rsi_required': True, 'edge_k': 0.1745706397794366, 'edge_cap': 0.7330995304514064, 'bull_strategy': 'breakout', 'bull_bb_std_mult': 3.3831465526683884, 'bull_rsi_os': 37, 'bull_rsi_ob': 47, 'bull_adx_thresh': 11.727583039925682, 'bull_atr_min_pct': 0.013607439336466519, 'bull_atr_max_pct': 0.03264622246556405, 'bull_tp_mult': 1.0483969932863813, 'bull_tsl_mult': 0.6911773900846229, 'bull_time_stop': 135, 'bull_use_sma': True, 'bull_use_ema': True, 'bull_use_atr': True, 'bull_use_adx': False, 'bull_use_spike': True, 'bull_rsi_required': True, 'bear_strategy': 'breakout', 'bear_bb_std_mult': 1.9175120633510152, 'bear_rsi_os': 35, 'bear_rsi_ob': 54, 'bear_adx_thresh': 20.315908072437, 'bear_atr_min_pct': 0.020444960169551288, 'bear_atr_max_pct': 0.11508643682530287, 'bear_tp_mult': 2.0733231776979766, 'bear_tsl_mult': 0.4507390418404789, 'bear_time_stop': 131, 'bear_use_sma': False, 'bear_use_ema': False, 'bear_use_atr': True, 'bear_use_adx': False, 'bear_use_spike': True, 'bear_rsi_required': False, 'sideways_strategy': 'mean_reversion', 'sideways_bb_std_mult': 3.118366347487311, 'sideways_rsi_os': 31, 'sideways_rsi_ob': 90, 'sideways_adx_thresh': 19.260772377498583, 'sideways_atr_min_pct': 0.023066525077828616, 'sideways_atr_max_pct': 0.09351245464021338, 'sideways_tp_mult': 1.6965646924171391, 'sideways_tsl_mult': 0.3364777629115853, 'sideways_time_stop': 138, 'sideways_use_sma': True, 'sideways_use_ema': False, 'sideways_use_atr': True, 'sideways_use_adx': True, 'sideways_use_spike': False, 'sideways_rsi_required': False}.
[I 2025-09-01 14:49:15,535] Trial 561 finished with values: [-1000000000.0, 1000000000.0] and parameters: {'p_sma': 6, 'p_std': 28, 'p_atr': 27, 'p_adx': 8, 'rsi_period': 12, 'ema1': 15, 'ema2': 17, 'slip_atr_k': 0.007538050950240824, 'slip_spread_k': 0.5481940860390332, 'spread_hl_frac': 0.012218437327933594, 'bb_std_mult': 3.597718503037211, 'rsi_os': 41, 'rsi_ob': 52, 'vol_spike': 0.11018800547605635, 'adx_thresh': 5.03984307704578, 'atr_min_pct': 0.010005540382134116, 'atr_max_pct': 0.03265138983874943, 'tp_mult': 1.8095598557399688, 'tsl_mult': 0.14141533870132145, 'strategy': 'breakout', 'time_stop': 182, 'use_sma': True, 'use_atr': True, 'use_adx': False, 'use_ema': True, 'use_spike': True, 'rsi_required': True, 'edge_k': 0.21726494926603332, 'edge_cap': 0.9835172079037372, 'bull_strategy': 'breakout', 'bull_bb_std_mult': 1.6525040715092234, 'bull_rsi_os': 15, 'bull_rsi_ob': 47, 'bull_adx_thresh': 9.335243658455491, 'bull_atr_min_pct': 0.013152219429248376, 'bull_atr_max_pct': 0.1264469221579552, 'bull_tp_mult': 1.4796242485852145, 'bull_tsl_mult': 0.6940834568860254, 'bull_time_stop': 163, 'bull_use_sma': True, 'bull_use_ema': True, 'bull_use_atr': True, 'bull_use_adx': False, 'bull_use_spike': True, 'bull_rsi_required': True, 'bear_strategy': 'breakout', 'bear_bb_std_mult': 2.407488005044429, 'bear_rsi_os': 17, 'bear_rsi_ob': 72, 'bear_adx_thresh': 7.375012923055916, 'bear_atr_min_pct': 0.01868684603070688, 'bear_atr_max_pct': 0.11459263300609854, 'bear_tp_mult': 2.076734227968473, 'bear_tsl_mult': 0.9276790437711384, 'bear_time_stop': 133, 'bear_use_sma': False, 'bear_use_ema': False, 'bear_use_atr': True, 'bear_use_adx': False, 'bear_use_spike': True, 'bear_rsi_required': False, 'sideways_strategy': 'mean_reversion', 'sideways_bb_std_mult': 1.0666936335911275, 'sideways_rsi_os': 30, 'sideways_rsi_ob': 92, 'sideways_adx_thresh': 23.49339275430072, 'sideways_atr_min_pct': 0.018427009295955744, 'sideways_atr_max_pct': 0.03017266972521096, 'sideways_tp_mult': 2.3736516487843984, 'sideways_tsl_mult': 0.36855368397454863, 'sideways_time_stop': 264, 'sideways_use_sma': True, 'sideways_use_ema': False, 'sideways_use_atr': True, 'sideways_use_adx': True, 'sideways_use_spike': True, 'sideways_rsi_required': True}.
[I 2025-09-01 14:49:16,087] Trial 560 finished with values: [0.0014012866723707162, 0.005473511832097389] and parameters: {'p_sma': 27, 'p_std': 29, 'p_atr': 22, 'p_adx': 8, 'rsi_period': 76, 'ema1': 9, 'ema2': 47, 'slip_atr_k': 0.007965017553835324, 'slip_spread_k': 0.5645940861826992, 'spread_hl_frac': 0.013091413363943809, 'bb_std_mult': 3.58120254725325, 'rsi_os': 5, 'rsi_ob': 52, 'vol_spike': 0.11449870229754144, 'adx_thresh': 5.0085338718972885, 'atr_min_pct': 0.01331225351408001, 'atr_max_pct': 0.03262521377055691, 'tp_mult': 1.550350939964689, 'tsl_mult': 0.6781176151807258, 'strategy': 'breakout', 'time_stop': 5, 'use_sma': True, 'use_atr': False, 'use_adx': False, 'use_ema': True, 'use_spike': True, 'rsi_required': True, 'edge_k': 0.344205765544655, 'edge_cap': 0.9654488196610997, 'bull_strategy': 'breakout', 'bull_bb_std_mult': 3.344990425986776, 'bull_rsi_os': 38, 'bull_rsi_ob': 80, 'bull_adx_thresh': 11.09916756123976, 'bull_atr_min_pct': 0.004850243208051486, 'bull_atr_max_pct': 0.12655373561491978, 'bull_tp_mult': 1.5891388154969286, 'bull_tsl_mult': 0.5485419233487224, 'bull_time_stop': 162, 'bull_use_sma': True, 'bull_use_ema': True, 'bull_use_atr': True, 'bull_use_adx': False, 'bull_use_spike': True, 'bull_rsi_required': True, 'bear_strategy': 'breakout', 'bear_bb_std_mult': 0.7410980723664775, 'bear_rsi_os': 46, 'bear_rsi_ob': 54, 'bear_adx_thresh': 33.70186708698045, 'bear_atr_min_pct': 0.0031103217093596943, 'bear_atr_max_pct': 0.11552074028062302, 'bear_tp_mult': 2.0700365666018112, 'bear_tsl_mult': 0.14069734983712012, 'bear_time_stop': 219, 'bear_use_sma': False, 'bear_use_ema': False, 'bear_use_atr': True, 'bear_use_adx': False, 'bear_use_spike': True, 'bear_rsi_required': False, 'sideways_strategy': 'mean_reversion', 'sideways_bb_std_mult': 1.0671314898830393, 'sideways_rsi_os': 30, 'sideways_rsi_ob': 91, 'sideways_adx_thresh': 24.98538468525432, 'sideways_atr_min_pct': 0.0027807076212750075, 'sideways_atr_max_pct': 0.11691704848756554, 'sideways_tp_mult': 2.0863992931915267, 'sideways_tsl_mult': 0.367107345868439, 'sideways_time_stop': 266, 'sideways_use_sma': True, 'sideways_use_ema': False, 'sideways_use_atr': True, 'sideways_use_adx': True, 'sideways_use_spike': True, 'sideways_rsi_required': False}.
[I 2025-09-01 14:49:16,312] Trial 562 finished with values: [-1000000000.0, 1000000000.0] and parameters: {'p_sma': 30, 'p_std': 21, 'p_atr': 27, 'p_adx': 8, 'rsi_period': 76, 'ema1': 9, 'ema2': 50, 'slip_atr_k': 0.022027381680787647, 'slip_spread_k': 0.5437717838647592, 'spread_hl_frac': 0.043580664591095636, 'bb_std_mult': 3.4909314431706013, 'rsi_os': 37, 'rsi_ob': 52, 'vol_spike': 0.24838353503025173, 'adx_thresh': 11.39455315772608, 'atr_min_pct': 0.02558235241733356, 'atr_max_pct': 0.033924375738892974, 'tp_mult': 1.8088845460637093, 'tsl_mult': 0.6674415463044197, 'strategy': 'breakout', 'time_stop': 115, 'use_sma': True, 'use_atr': True, 'use_adx': True, 'use_ema': True, 'use_spike': True, 'rsi_required': False, 'edge_k': 0.34183267455599653, 'edge_cap': 0.8301003157427662, 'bull_strategy': 'breakout', 'bull_bb_std_mult': 3.0787927074198587, 'bull_rsi_os': 15, 'bull_rsi_ob': 90, 'bull_adx_thresh': 21.525749346008585, 'bull_atr_min_pct': 0.01206714201085618, 'bull_atr_max_pct': 0.014687433880216524, 'bull_tp_mult': 1.7271919907831899, 'bull_tsl_mult': 0.41063402196224963, 'bull_time_stop': 207, 'bull_use_sma': True, 'bull_use_ema': True, 'bull_use_atr': True, 'bull_use_adx': False, 'bull_use_spike': True, 'bull_rsi_required': True, 'bear_strategy': 'breakout', 'bear_bb_std_mult': 0.7331177470333581, 'bear_rsi_os': 8, 'bear_rsi_ob': 54, 'bear_adx_thresh': 7.415938792691418, 'bear_atr_min_pct': 0.017130700044396267, 'bear_atr_max_pct': 0.11423054414714146, 'bear_tp_mult': 1.3661695275837014, 'bear_tsl_mult': 0.6516824896256783, 'bear_time_stop': 87, 'bear_use_sma': False, 'bear_use_ema': True, 'bear_use_atr': True, 'bear_use_adx': False, 'bear_use_spike': True, 'bear_rsi_required': False, 'sideways_strategy': 'mean_reversion', 'sideways_bb_std_mult': 3.168490252895009, 'sideways_rsi_os': 30, 'sideways_rsi_ob': 91, 'sideways_adx_thresh': 24.713813622856197, 'sideways_atr_min_pct': 0.01100635890361476, 'sideways_atr_max_pct': 0.11609742545683766, 'sideways_tp_mult': 1.0544380826626054, 'sideways_tsl_mult': 0.37025546268594944, 'sideways_time_stop': 286, 'sideways_use_sma': False, 'sideways_use_ema': False, 'sideways_use_atr': True, 'sideways_use_adx': True, 'sideways_use_spike': True, 'sideways_rsi_required': True}.
[I 2025-09-01 14:49:57,228] Trial 565 finished with values: [-1000000000.0, 1000000000.0] and parameters: {'p_sma': 30, 'p_std': 27, 'p_atr': 29, 'p_adx': 16, 'rsi_period': 74, 'ema1': 9, 'ema2': 10, 'slip_atr_k': 0.015190701795962363, 'slip_spread_k': 0.8116593221007868, 'spread_hl_frac': 0.0018602659817104142, 'bb_std_mult': 3.4554590117154844, 'rsi_os': 11, 'rsi_ob': 56, 'vol_spike': 0.1542351398926914, 'adx_thresh': 6.0417154133952575, 'atr_min_pct': 0.011944388255018043, 'atr_max_pct': 0.027108097827877743, 'tp_mult': 1.8700685037477274, 'tsl_mult': 0.21592972993724746, 'strategy': 'mean_reversion', 'time_stop': 217, 'use_sma': False, 'use_atr': True, 'use_adx': True, 'use_ema': False, 'use_spike': True, 'rsi_required': False, 'edge_k': 0.24270394592538744, 'edge_cap': 0.8276580529190561, 'bull_strategy': 'breakout', 'bull_bb_std_mult': 3.5292543121106386, 'bull_rsi_os': 51, 'bull_rsi_ob': 78, 'bull_adx_thresh': 16.991766726558673, 'bull_atr_min_pct': 0.012008265730633315, 'bull_atr_max_pct': 0.06444375366606207, 'bull_tp_mult': 1.6864143072448536, 'bull_tsl_mult': 0.48361948335542215, 'bull_time_stop': 210, 'bull_use_sma': False, 'bull_use_ema': False, 'bull_use_atr': True, 'bull_use_adx': True, 'bull_use_spike': True, 'bull_rsi_required': False, 'bear_strategy': 'mean_reversion', 'bear_bb_std_mult': 2.5181109645167026, 'bear_rsi_os': 33, 'bear_rsi_ob': 58, 'bear_adx_thresh': 22.386735632826795, 'bear_atr_min_pct': 0.007843364900528043, 'bear_atr_max_pct': 0.11247741289878763, 'bear_tp_mult': 2.1660512579610685, 'bear_tsl_mult': 0.1382341211239916, 'bear_time_stop': 87, 'bear_use_sma': False, 'bear_use_ema': True, 'bear_use_atr': False, 'bear_use_adx': False, 'bear_use_spike': True, 'bear_rsi_required': True, 'sideways_strategy': 'mean_reversion', 'sideways_bb_std_mult': 2.983291883711217, 'sideways_rsi_os': 51, 'sideways_rsi_ob': 88, 'sideways_adx_thresh': 15.00633337592073, 'sideways_atr_min_pct': 0.01157659669480344, 'sideways_atr_max_pct': 0.11529684425625401, 'sideways_tp_mult': 1.914221309947032, 'sideways_tsl_mult': 0.39387427716997386, 'sideways_time_stop': 51, 'sideways_use_sma': False, 'sideways_use_ema': True, 'sideways_use_atr': False, 'sideways_use_adx': True, 'sideways_use_spike': False, 'sideways_rsi_required': True}.
[I 2025-09-01 14:49:57,791] Trial 563 finished with values: [-1000000000.0, 1000000000.0] and parameters: {'p_sma': 30, 'p_std': 43, 'p_atr': 26, 'p_adx': 8, 'rsi_period': 12, 'ema1': 9, 'ema2': 11, 'slip_atr_k': 0.02159849220353336, 'slip_spread_k': 0.5373987173600316, 'spread_hl_frac': 0.012162429514441332, 'bb_std_mult': 3.455596828720696, 'rsi_os': 41, 'rsi_ob': 52, 'vol_spike': 0.1143655279165971, 'adx_thresh': 6.112398886504287, 'atr_min_pct': 0.011724055138576998, 'atr_max_pct': 0.14984865262562663, 'tp_mult': 1.4418110235596493, 'tsl_mult': 0.6802126641310046, 'strategy': 'breakout', 'time_stop': 114, 'use_sma': True, 'use_atr': True, 'use_adx': True, 'use_ema': False, 'use_spike': True, 'rsi_required': False, 'edge_k': 0.23045544726565512, 'edge_cap': 0.9810512328789593, 'bull_strategy': 'breakout', 'bull_bb_std_mult': 3.030802674425811, 'bull_rsi_os': 15, 'bull_rsi_ob': 78, 'bull_adx_thresh': 11.039955775044854, 'bull_atr_min_pct': 0.012123479377530196, 'bull_atr_max_pct': 0.12614682098505203, 'bull_tp_mult': 1.7207715592499118, 'bull_tsl_mult': 0.5171531030614019, 'bull_time_stop': 162, 'bull_use_sma': False, 'bull_use_ema': True, 'bull_use_atr': True, 'bull_use_adx': True, 'bull_use_spike': True, 'bull_rsi_required': True, 'bear_strategy': 'breakout', 'bear_bb_std_mult': 0.7560550176495644, 'bear_rsi_os': 46, 'bear_rsi_ob': 46, 'bear_adx_thresh': 7.2133229129069205, 'bear_atr_min_pct': 0.008889528361895991, 'bear_atr_max_pct': 0.11238921796175091, 'bear_tp_mult': 2.854756421082793, 'bear_tsl_mult': 0.6558284247494756, 'bear_time_stop': 88, 'bear_use_sma': False, 'bear_use_ema': True, 'bear_use_atr': True, 'bear_use_adx': False, 'bear_use_spike': True, 'bear_rsi_required': False, 'sideways_strategy': 'mean_reversion', 'sideways_bb_std_mult': 2.9921342696100734, 'sideways_rsi_os': 30, 'sideways_rsi_ob': 91, 'sideways_adx_thresh': 24.773411722361512, 'sideways_atr_min_pct': 0.01840653622970432, 'sideways_atr_max_pct': 0.13042454521038374, 'sideways_tp_mult': 2.3834867073088497, 'sideways_tsl_mult': 0.3686773935462896, 'sideways_time_stop': 26, 'sideways_use_sma': False, 'sideways_use_ema': True, 'sideways_use_atr': False, 'sideways_use_adx': True, 'sideways_use_spike': True, 'sideways_rsi_required': True}.
[I 2025-09-01 14:49:58,231] Trial 566 finished with values: [-1000000000.0, 1000000000.0] and parameters: {'p_sma': 36, 'p_std': 46, 'p_atr': 26, 'p_adx': 16, 'rsi_period': 8, 'ema1': 26, 'ema2': 23, 'slip_atr_k': 0.004120455063995679, 'slip_spread_k': 0.5309865119589726, 'spread_hl_frac': 0.008004829011387857, 'bb_std_mult': 3.4492348710409946, 'rsi_os': 44, 'rsi_ob': 51, 'vol_spike': 0.1001637782782356, 'adx_thresh': 7.372845369409098, 'atr_min_pct': 0.006301374897295861, 'atr_max_pct': 0.02677379260056533, 'tp_mult': 1.356008387740913, 'tsl_mult': 0.6795964046171004, 'strategy': 'mean_reversion', 'time_stop': 108, 'use_sma': False, 'use_atr': False, 'use_adx': True, 'use_ema': False, 'use_spike': True, 'rsi_required': False, 'edge_k': 0.24431944289979418, 'edge_cap': 0.5516344401797741, 'bull_strategy': 'breakout', 'bull_bb_std_mult': 0.6574754055393717, 'bull_rsi_os': 11, 'bull_rsi_ob': 78, 'bull_adx_thresh': 11.837163738638242, 'bull_atr_min_pct': 0.006516309637895977, 'bull_atr_max_pct': 0.12980224160474602, 'bull_tp_mult': 1.678630094102294, 'bull_tsl_mult': 0.5168501871274633, 'bull_time_stop': 172, 'bull_use_sma': False, 'bull_use_ema': False, 'bull_use_atr': True, 'bull_use_adx': True, 'bull_use_spike': False, 'bull_rsi_required': False, 'bear_strategy': 'mean_reversion', 'bear_bb_std_mult': 2.5171269048499174, 'bear_rsi_os': 48, 'bear_rsi_ob': 59, 'bear_adx_thresh': 24.008794388581144, 'bear_atr_min_pct': 0.0010576331396763509, 'bear_atr_max_pct': 0.044928885136706447, 'bear_tp_mult': 2.1632353204433423, 'bear_tsl_mult': 0.25209631486799944, 'bear_time_stop': 140, 'bear_use_sma': True, 'bear_use_ema': True, 'bear_use_atr': False, 'bear_use_adx': False, 'bear_use_spike': True, 'bear_rsi_required': True, 'sideways_strategy': 'mean_reversion', 'sideways_bb_std_mult': 2.9799749376374005, 'sideways_rsi_os': 28, 'sideways_rsi_ob': 87, 'sideways_adx_thresh': 7.469154486533705, 'sideways_atr_min_pct': 0.003428287758273326, 'sideways_atr_max_pct': 0.12990397941150986, 'sideways_tp_mult': 1.9219338927991403, 'sideways_tsl_mult': 0.3926734182775558, 'sideways_time_stop': 99, 'sideways_use_sma': False, 'sideways_use_ema': True, 'sideways_use_atr': False, 'sideways_use_adx': True, 'sideways_use_spike': False, 'sideways_rsi_required': False}.
[I 2025-09-01 14:49:58,241] Trial 564 finished with values: [-1000000000.0, 1000000000.0] and parameters: {'p_sma': 37, 'p_std': 27, 'p_atr': 29, 'p_adx': 8, 'rsi_period': 76, 'ema1': 9, 'ema2': 48, 'slip_atr_k': 0.004086952516744348, 'slip_spread_k': 0.6227568590962891, 'spread_hl_frac': 0.046362701875231054, 'bb_std_mult': 3.4567027895804174, 'rsi_os': 37, 'rsi_ob': 56, 'vol_spike': 0.11504194618133468, 'adx_thresh': 6.064216288056332, 'atr_min_pct': 0.011870262181090444, 'atr_max_pct': 0.03453339571905417, 'tp_mult': 2.6549057551206956, 'tsl_mult': 0.6757327418288531, 'strategy': 'mean_reversion', 'time_stop': 114, 'use_sma': False, 'use_atr': False, 'use_adx': True, 'use_ema': False, 'use_spike': True, 'rsi_required': False, 'edge_k': 0.34086451615187113, 'edge_cap': 0.8871197223833397, 'bull_strategy': 'breakout', 'bull_bb_std_mult': 2.3986435504154264, 'bull_rsi_os': 40, 'bull_rsi_ob': 78, 'bull_adx_thresh': 11.128796837199666, 'bull_atr_min_pct': 0.011760556930778343, 'bull_atr_max_pct': 0.10584319960154137, 'bull_tp_mult': 1.7278768894690222, 'bull_tsl_mult': 0.5066355872648343, 'bull_time_stop': 172, 'bull_use_sma': False, 'bull_use_ema': True, 'bull_use_atr': True, 'bull_use_adx': True, 'bull_use_spike': True, 'bull_rsi_required': False, 'bear_strategy': 'mean_reversion', 'bear_bb_std_mult': 0.7243762651797816, 'bear_rsi_os': 34, 'bear_rsi_ob': 59, 'bear_adx_thresh': 22.467933521473178, 'bear_atr_min_pct': 0.003031441847857657, 'bear_atr_max_pct': 0.10034187857881294, 'bear_tp_mult': 2.1760229412698124, 'bear_tsl_mult': 0.1390089779277827, 'bear_time_stop': 32, 'bear_use_sma': False, 'bear_use_ema': True, 'bear_use_atr': False, 'bear_use_adx': False, 'bear_use_spike': True, 'bear_rsi_required': True, 'sideways_strategy': 'mean_reversion', 'sideways_bb_std_mult': 2.9729729580263866, 'sideways_rsi_os': 30, 'sideways_rsi_ob': 91, 'sideways_adx_thresh': 24.729169143131838, 'sideways_atr_min_pct': 0.003468324058762588, 'sideways_atr_max_pct': 0.11618363833403715, 'sideways_tp_mult': 1.3128335173894645, 'sideways_tsl_mult': 0.38797150301468775, 'sideways_time_stop': 285, 'sideways_use_sma': False, 'sideways_use_ema': True, 'sideways_use_atr': False, 'sideways_use_adx': True, 'sideways_use_spike': True, 'sideways_rsi_required': False}.
