[I 2025-09-01 14:39:03,954] Trial 495 finished with values: [-0.05206152408710607, 0.051949819860129205] and parameters: {'p_sma': 44, 'p_std': 27, 'p_atr': 25, 'p_adx': 8, 'rsi_period': 49, 'ema1': 20, 'ema2': 15, 'slip_atr_k': 0.02767011318055159, 'slip_spread_k': 0.5389710547787713, 'spread_hl_frac': 0.007251984902491054, 'bb_std_mult': 1.3928771503637503, 'rsi_os': 38, 'rsi_ob': 52, 'vol_spike': 0.119574794035806, 'adx_thresh': 5.524993164632181, 'atr_min_pct': 0.010229407834421493, 'atr_max_pct': 0.03850141915191503, 'tp_mult': 1.3853590602758792, 'tsl_mult': 0.44707083110021956, 'strategy': 'mean_reversion', 'time_stop': 115, 'use_sma': False, 'use_atr': False, 'use_adx': True, 'use_ema': True, 'use_spike': True, 'rsi_required': True, 'edge_k': 0.9625495399769921, 'edge_cap': 0.05200237269405694, 'bull_strategy': 'breakout', 'bull_bb_std_mult': 3.3440880280697804, 'bull_rsi_os': 10, 'bull_rsi_ob': 79, 'bull_adx_thresh': 9.88546037388156, 'bull_atr_min_pct': 0.0005212195846358309, 'bull_atr_max_pct': 0.07047802136646907, 'bull_tp_mult': 1.4982894643220825, 'bull_tsl_mult': 0.45845214894125536, 'bull_time_stop': 144, 'bull_use_sma': False, 'bull_use_ema': True, 'bull_use_atr': True, 'bull_use_adx': False, 'bull_use_spike': True, 'bull_rsi_required': True, 'bear_strategy': 'mean_reversion', 'bear_bb_std_mult': 1.3616921261056005, 'bear_rsi_os': 37, 'bear_rsi_ob': 58, 'bear_adx_thresh': 7.6600923309720965, 'bear_atr_min_pct': 0.004136477925962159, 'bear_atr_max_pct': 0.04247749811843339, 'bear_tp_mult': 1.9655446820336875, 'bear_tsl_mult': 0.6161671716441666, 'bear_time_stop': 144, 'bear_use_sma': False, 'bear_use_ema': False, 'bear_use_atr': False, 'bear_use_adx': False, 'bear_use_spike': True, 'bear_rsi_required': False, 'sideways_strategy': 'mean_reversion', 'sideways_bb_std_mult': 2.8216194543892668, 'sideways_rsi_os': 28, 'sideways_rsi_ob': 88, 'sideways_adx_thresh': 19.62007715955502, 'sideways_atr_min_pct': 0.010682708923905292, 'sideways_atr_max_pct': 0.014127335368089633, 'sideways_tp_mult': 1.6566813107069525, 'sideways_tsl_mult': 0.3488398015626879, 'sideways_time_stop': 250, 'sideways_use_sma': True, 'sideways_use_ema': True, 'sideways_use_atr': True, 'sideways_use_adx': True, 'sideways_use_spike': False, 'sideways_rsi_required': False}.
[I 2025-09-01 14:39:42,521] Trial 496 finished with values: [-0.03146459336102414, 0.03139738189286699] and parameters: {'p_sma': 38, 'p_std': 42, 'p_atr': 28, 'p_adx': 8, 'rsi_period': 79, 'ema1': 13, 'ema2': 54, 'slip_atr_k': 0.02944879340199022, 'slip_spread_k': 0.5169761303733581, 'spread_hl_frac': 0.006763617792873736, 'bb_std_mult': 3.494298988209645, 'rsi_os': 40, 'rsi_ob': 52, 'vol_spike': 0.12022649145704493, 'adx_thresh': 5.575634074183819, 'atr_min_pct': 0.009510716881844898, 'atr_max_pct': 0.037712449448976705, 'tp_mult': 2.2519942669585595, 'tsl_mult': 0.5702958844990977, 'strategy': 'mean_reversion', 'time_stop': 116, 'use_sma': False, 'use_atr': False, 'use_adx': True, 'use_ema': True, 'use_spike': True, 'rsi_required': True, 'edge_k': 0.17582962732970864, 'edge_cap': 0.9436106393396693, 'bull_strategy': 'breakout', 'bull_bb_std_mult': 3.3211030421633194, 'bull_rsi_os': 13, 'bull_rsi_ob': 68, 'bull_adx_thresh': 15.981400766173774, 'bull_atr_min_pct': 0.0004945342399692212, 'bull_atr_max_pct': 0.13003138160146469, 'bull_tp_mult': 1.5047423606799462, 'bull_tsl_mult': 0.5299208270694855, 'bull_time_stop': 148, 'bull_use_sma': False, 'bull_use_ema': True, 'bull_use_atr': True, 'bull_use_adx': False, 'bull_use_spike': True, 'bull_rsi_required': True, 'bear_strategy': 'mean_reversion', 'bear_bb_std_mult': 2.3120477499049006, 'bear_rsi_os': 21, 'bear_rsi_ob': 57, 'bear_adx_thresh': 21.7939456235121, 'bear_atr_min_pct': 0.027125386606370927, 'bear_atr_max_pct': 0.10313717804463463, 'bear_tp_mult': 1.1582958852591043, 'bear_tsl_mult': 0.6167319305848068, 'bear_time_stop': 135, 'bear_use_sma': False, 'bear_use_ema': False, 'bear_use_atr': False, 'bear_use_adx': False, 'bear_use_spike': False, 'bear_rsi_required': False, 'sideways_strategy': 'mean_reversion', 'sideways_bb_std_mult': 3.0362266282506902, 'sideways_rsi_os': 10, 'sideways_rsi_ob': 90, 'sideways_adx_thresh': 27.124361200186232, 'sideways_atr_min_pct': 0.003085476978308672, 'sideways_atr_max_pct': 0.10580808880919501, 'sideways_tp_mult': 2.427947342144773, 'sideways_tsl_mult': 0.3916657582218327, 'sideways_time_stop': 288, 'sideways_use_sma': True, 'sideways_use_ema': True, 'sideways_use_atr': False, 'sideways_use_adx': True, 'sideways_use_spike': False, 'sideways_rsi_required': False}.
[I 2025-09-01 14:39:43,459] Trial 497 finished with values: [-1000000000.0, 1000000000.0] and parameters: {'p_sma': 29, 'p_std': 37, 'p_atr': 25, 'p_adx': 17, 'rsi_period': 81, 'ema1': 25, 'ema2': 22, 'slip_atr_k': 0.02836487748483331, 'slip_spread_k': 0.536974379921135, 'spread_hl_frac': 0.03657488674367267, 'bb_std_mult': 2.670778480296048, 'rsi_os': 30, 'rsi_ob': 83, 'vol_spike': 0.12003190782529552, 'adx_thresh': 8.865999755671366, 'atr_min_pct': 0.009756693921540166, 'atr_max_pct': 0.03761658704989191, 'tp_mult': 1.3763730159444543, 'tsl_mult': 0.3122459425516236, 'strategy': 'mean_reversion', 'time_stop': 181, 'use_sma': False, 'use_atr': False, 'use_adx': True, 'use_ema': True, 'use_spike': True, 'rsi_required': True, 'edge_k': 1.4422331897482812, 'edge_cap': 0.945905586567234, 'bull_strategy': 'breakout', 'bull_bb_std_mult': 3.33216385846042, 'bull_rsi_os': 9, 'bull_rsi_ob': 63, 'bull_adx_thresh': 11.208140431863873, 'bull_atr_min_pct': 0.012713319346148713, 'bull_atr_max_pct': 0.11771497022910797, 'bull_tp_mult': 1.5027130618278333, 'bull_tsl_mult': 0.5151127591985147, 'bull_time_stop': 7, 'bull_use_sma': False, 'bull_use_ema': False, 'bull_use_atr': True, 'bull_use_adx': False, 'bull_use_spike': True, 'bull_rsi_required': True, 'bear_strategy': 'mean_reversion', 'bear_bb_std_mult': 2.675980966035437, 'bear_rsi_os': 5, 'bear_rsi_ob': 58, 'bear_adx_thresh': 20.167330768107433, 'bear_atr_min_pct': 0.026883858191607483, 'bear_atr_max_pct': 0.10573674579214033, 'bear_tp_mult': 1.9574225292334482, 'bear_tsl_mult': 0.07271162599637487, 'bear_time_stop': 159, 'bear_use_sma': False, 'bear_use_ema': False, 'bear_use_atr': False, 'bear_use_adx': False, 'bear_use_spike': False, 'bear_rsi_required': False, 'sideways_strategy': 'mean_reversion', 'sideways_bb_std_mult': 2.7742671089133557, 'sideways_rsi_os': 30, 'sideways_rsi_ob': 88, 'sideways_adx_thresh': 33.94362482918771, 'sideways_atr_min_pct': 0.028372447413593616, 'sideways_atr_max_pct': 0.02722807617084868, 'sideways_tp_mult': 2.4106062006865248, 'sideways_tsl_mult': 0.3770874363140261, 'sideways_time_stop': 247, 'sideways_use_sma': True, 'sideways_use_ema': True, 'sideways_use_atr': False, 'sideways_use_adx': True, 'sideways_use_spike': False, 'sideways_rsi_required': False}.
[I 2025-09-01 14:39:44,424] Trial 499 finished with values: [-1000000000.0, 1000000000.0] and parameters: {'p_sma': 29, 'p_std': 49, 'p_atr': 16, 'p_adx': 7, 'rsi_period': 81, 'ema1': 30, 'ema2': 54, 'slip_atr_k': 0.24204486934622685, 'slip_spread_k': 0.06119640592370118, 'spread_hl_frac': 0.011134399845629507, 'bb_std_mult': 2.5320525508154588, 'rsi_os': 47, 'rsi_ob': 63, 'vol_spike': 0.10782014941592127, 'adx_thresh': 10.711807683528141, 'atr_min_pct': 0.009602569743043493, 'atr_max_pct': 0.03755943136967974, 'tp_mult': 1.4178891870421535, 'tsl_mult': 0.4960419188311149, 'strategy': 'mean_reversion', 'time_stop': 160, 'use_sma': True, 'use_atr': True, 'use_adx': True, 'use_ema': True, 'use_spike': False, 'rsi_required': True, 'edge_k': 0.1859133733578194, 'edge_cap': 0.9681430864927829, 'bull_strategy': 'mean_reversion', 'bull_bb_std_mult': 3.2689684821211533, 'bull_rsi_os': 46, 'bull_rsi_ob': 79, 'bull_adx_thresh': 11.341793855469744, 'bull_atr_min_pct': 0.01279547000581418, 'bull_atr_max_pct': 0.06380345515281349, 'bull_tp_mult': 1.595483096183912, 'bull_tsl_mult': 0.48305969267341736, 'bull_time_stop': 160, 'bull_use_sma': False, 'bull_use_ema': False, 'bull_use_atr': False, 'bull_use_adx': False, 'bull_use_spike': True, 'bull_rsi_required': True, 'bear_strategy': 'mean_reversion', 'bear_bb_std_mult': 2.6710100646949484, 'bear_rsi_os': 5, 'bear_rsi_ob': 57, 'bear_adx_thresh': 7.656082419532908, 'bear_atr_min_pct': 0.012695319787663348, 'bear_atr_max_pct': 0.05221025041443637, 'bear_tp_mult': 2.0214796136745137, 'bear_tsl_mult': 0.16834097951056828, 'bear_time_stop': 97, 'bear_use_sma': False, 'bear_use_ema': False, 'bear_use_atr': False, 'bear_use_adx': True, 'bear_use_spike': False, 'bear_rsi_required': True, 'sideways_strategy': 'breakout', 'sideways_bb_std_mult': 2.422969302904548, 'sideways_rsi_os': 30, 'sideways_rsi_ob': 95, 'sideways_adx_thresh': 26.229269457073237, 'sideways_atr_min_pct': 0.006135151419922581, 'sideways_atr_max_pct': 0.10124528014931308, 'sideways_tp_mult': 2.4170174490887786, 'sideways_tsl_mult': 0.3949208384599099, 'sideways_time_stop': 270, 'sideways_use_sma': True, 'sideways_use_ema': True, 'sideways_use_atr': False, 'sideways_use_adx': True, 'sideways_use_spike': False, 'sideways_rsi_required': False}.
[I 2025-09-01 14:39:45,024] Trial 498 finished with values: [-0.048741208101106936, 0.04911258786919445] and parameters: {'p_sma': 29, 'p_std': 27, 'p_atr': 24, 'p_adx': 8, 'rsi_period': 40, 'ema1': 9, 'ema2': 22, 'slip_atr_k': 0.13191558804894202, 'slip_spread_k': 0.06378016678153775, 'spread_hl_frac': 0.011401067323038546, 'bb_std_mult': 1.5628510385622902, 'rsi_os': 29, 'rsi_ob': 53, 'vol_spike': 0.18765719553783677, 'adx_thresh': 6.506628237825315, 'atr_min_pct': 0.009355056062012828, 'atr_max_pct': 0.038475080417427844, 'tp_mult': 2.194822836411898, 'tsl_mult': 0.6245370811236021, 'strategy': 'mean_reversion', 'time_stop': 162, 'use_sma': True, 'use_atr': False, 'use_adx': True, 'use_ema': True, 'use_spike': True, 'rsi_required': True, 'edge_k': 0.1905964841730009, 'edge_cap': 0.9687971805046497, 'bull_strategy': 'mean_reversion', 'bull_bb_std_mult': 0.9813976822428341, 'bull_rsi_os': 10, 'bull_rsi_ob': 68, 'bull_adx_thresh': 11.27246280394326, 'bull_atr_min_pct': 0.016115955561116155, 'bull_atr_max_pct': 0.1309039471767512, 'bull_tp_mult': 1.5952806781375273, 'bull_tsl_mult': 0.21472604717684596, 'bull_time_stop': 5, 'bull_use_sma': False, 'bull_use_ema': False, 'bull_use_atr': True, 'bull_use_adx': False, 'bull_use_spike': True, 'bull_rsi_required': True, 'bear_strategy': 'mean_reversion', 'bear_bb_std_mult': 2.3035538066607457, 'bear_rsi_os': 40, 'bear_rsi_ob': 58, 'bear_adx_thresh': 24.203315835232488, 'bear_atr_min_pct': 0.0032061466285493827, 'bear_atr_max_pct': 0.10420457441183298, 'bear_tp_mult': 1.9851608401439256, 'bear_tsl_mult': 0.07188479672363945, 'bear_time_stop': 98, 'bear_use_sma': False, 'bear_use_ema': False, 'bear_use_atr': False, 'bear_use_adx': False, 'bear_use_spike': False, 'bear_rsi_required': True, 'sideways_strategy': 'mean_reversion', 'sideways_bb_std_mult': 2.870767620832525, 'sideways_rsi_os': 30, 'sideways_rsi_ob': 91, 'sideways_adx_thresh': 33.9223631837897, 'sideways_atr_min_pct': 0.006123715492528789, 'sideways_atr_max_pct': 0.03341574223210749, 'sideways_tp_mult': 2.295222642813108, 'sideways_tsl_mult': 0.39541538451796765, 'sideways_time_stop': 255, 'sideways_use_sma': True, 'sideways_use_ema': True, 'sideways_use_atr': False, 'sideways_use_adx': True, 'sideways_use_spike': False, 'sideways_rsi_required': False}.
[I 2025-09-01 14:40:22,335] Trial 501 finished with values: [-1000000000.0, 1000000000.0] and parameters: {'p_sma': 31, 'p_std': 25, 'p_atr': 27, 'p_adx': 7, 'rsi_period': 39, 'ema1': 9, 'ema2': 58, 'slip_atr_k': 0.14118768979440596, 'slip_spread_k': 0.616405003938645, 'spread_hl_frac': 0.011326992547932832, 'bb_std_mult': 3.364768765954424, 'rsi_os': 47, 'rsi_ob': 70, 'vol_spike': 0.029138464799145267, 'adx_thresh': 6.609675108684721, 'atr_min_pct': 0.011904360243503094, 'atr_max_pct': 0.1063561812031423, 'tp_mult': 1.4154044964906851, 'tsl_mult': 0.7845303196022769, 'strategy': 'mean_reversion', 'time_stop': 162, 'use_sma': True, 'use_atr': True, 'use_adx': True, 'use_ema': True, 'use_spike': False, 'rsi_required': True, 'edge_k': 1.8988539004966807, 'edge_cap': 0.0891429569369318, 'bull_strategy': 'mean_reversion', 'bull_bb_std_mult': 3.257090980695102, 'bull_rsi_os': 46, 'bull_rsi_ob': 79, 'bull_adx_thresh': 31.01234884201429, 'bull_atr_min_pct': 0.010021283457390114, 'bull_atr_max_pct': 0.130984826794572, 'bull_tp_mult': 1.5997472634148049, 'bull_tsl_mult': 0.4801074770276206, 'bull_time_stop': 159, 'bull_use_sma': False, 'bull_use_ema': False, 'bull_use_atr': False, 'bull_use_adx': True, 'bull_use_spike': True, 'bull_rsi_required': True, 'bear_strategy': 'mean_reversion', 'bear_bb_std_mult': 1.5376891922559954, 'bear_rsi_os': 46, 'bear_rsi_ob': 79, 'bear_adx_thresh': 9.668354717493452, 'bear_atr_min_pct': 0.023333908353101437, 'bear_atr_max_pct': 0.0522716267393719, 'bear_tp_mult': 2.0043426825696784, 'bear_tsl_mult': 0.5228479005955883, 'bear_time_stop': 97, 'bear_use_sma': True, 'bear_use_ema': False, 'bear_use_atr': False, 'bear_use_adx': True, 'bear_use_spike': True, 'bear_rsi_required': True, 'sideways_strategy': 'breakout', 'sideways_bb_std_mult': 2.87714399097442, 'sideways_rsi_os': 29, 'sideways_rsi_ob': 91, 'sideways_adx_thresh': 26.344919673539277, 'sideways_atr_min_pct': 0.005902619797894245, 'sideways_atr_max_pct': 0.1011847543086519, 'sideways_tp_mult': 2.3014494647597465, 'sideways_tsl_mult': 0.26973055303891, 'sideways_time_stop': 5, 'sideways_use_sma': True, 'sideways_use_ema': True, 'sideways_use_atr': True, 'sideways_use_adx': False, 'sideways_use_spike': True, 'sideways_rsi_required': False}.
[I 2025-09-01 14:40:23,107] Trial 502 finished with values: [-1000000000.0, 1000000000.0] and parameters: {'p_sma': 31, 'p_std': 14, 'p_atr': 27, 'p_adx': 8, 'rsi_period': 78, 'ema1': 9, 'ema2': 46, 'slip_atr_k': 0.12863424350314223, 'slip_spread_k': 0.6147520127516535, 'spread_hl_frac': 0.02733342886604951, 'bb_std_mult': 1.6208238476985288, 'rsi_os': 42, 'rsi_ob': 53, 'vol_spike': 0.02847542595289608, 'adx_thresh': 31.6357687806522, 'atr_min_pct': 0.011851174579473246, 'atr_max_pct': 0.03124571478234603, 'tp_mult': 1.3533767016400355, 'tsl_mult': 0.7849717822200163, 'strategy': 'mean_reversion', 'time_stop': 121, 'use_sma': True, 'use_atr': False, 'use_adx': True, 'use_ema': True, 'use_spike': True, 'rsi_required': True, 'edge_k': 0.2958637292443821, 'edge_cap': 0.9734748717593201, 'bull_strategy': 'mean_reversion', 'bull_bb_std_mult': 0.9885663544800734, 'bull_rsi_os': 47, 'bull_rsi_ob': 78, 'bull_adx_thresh': 13.00621695868956, 'bull_atr_min_pct': 0.015825641287844, 'bull_atr_max_pct': 0.13188718246020406, 'bull_tp_mult': 1.6617565681364812, 'bull_tsl_mult': 0.4608019871743444, 'bull_time_stop': 154, 'bull_use_sma': False, 'bull_use_ema': True, 'bull_use_atr': True, 'bull_use_adx': True, 'bull_use_spike': True, 'bull_rsi_required': True, 'bear_strategy': 'mean_reversion', 'bear_bb_std_mult': 2.567573934312577, 'bear_rsi_os': 28, 'bear_rsi_ob': 80, 'bear_adx_thresh': 9.879133070422256, 'bear_atr_min_pct': 0.023452517141110987, 'bear_atr_max_pct': 0.11201226704063696, 'bear_tp_mult': 2.092932416685661, 'bear_tsl_mult': 0.5398056267689849, 'bear_time_stop': 249, 'bear_use_sma': True, 'bear_use_ema': False, 'bear_use_atr': False, 'bear_use_adx': False, 'bear_use_spike': True, 'bear_rsi_required': True, 'sideways_strategy': 'mean_reversion', 'sideways_bb_std_mult': 2.8751109607217717, 'sideways_rsi_os': 29, 'sideways_rsi_ob': 91, 'sideways_adx_thresh': 23.78924302050279, 'sideways_atr_min_pct': 0.004568304183622899, 'sideways_atr_max_pct': 0.11120693303785126, 'sideways_tp_mult': 2.1818962035891287, 'sideways_tsl_mult': 0.42267556009605095, 'sideways_time_stop': 255, 'sideways_use_sma': True, 'sideways_use_ema': True, 'sideways_use_atr': True, 'sideways_use_adx': False, 'sideways_use_spike': True, 'sideways_rsi_required': False}.
[I 2025-09-01 14:40:24,011] Trial 503 finished with values: [-1000000000.0, 1000000000.0] and parameters: {'p_sma': 24, 'p_std': 25, 'p_atr': 27, 'p_adx': 7, 'rsi_period': 43, 'ema1': 7, 'ema2': 58, 'slip_atr_k': 0.012375577953954277, 'slip_spread_k': 0.019406975140841554, 'spread_hl_frac': 0.008507522573972782, 'bb_std_mult': 3.5922665787128225, 'rsi_os': 42, 'rsi_ob': 55, 'vol_spike': 0.10262777308816455, 'adx_thresh': 31.739847787406124, 'atr_min_pct': 0.013647132479678595, 'atr_max_pct': 0.03138770187237037, 'tp_mult': 1.3550854805151447, 'tsl_mult': 0.6758882192808868, 'strategy': 'mean_reversion', 'time_stop': 123, 'use_sma': True, 'use_atr': True, 'use_adx': True, 'use_ema': True, 'use_spike': False, 'rsi_required': True, 'edge_k': 0.22909679169275718, 'edge_cap': 0.8771103853328857, 'bull_strategy': 'breakout', 'bull_bb_std_mult': 3.4128525270362466, 'bull_rsi_os': 50, 'bull_rsi_ob': 71, 'bull_adx_thresh': 30.653877188316503, 'bull_atr_min_pct': 0.02208615369798885, 'bull_atr_max_pct': 0.10252926086057981, 'bull_tp_mult': 1.6507828351590148, 'bull_tsl_mult': 0.8569554052995441, 'bull_time_stop': 154, 'bull_use_sma': False, 'bull_use_ema': True, 'bull_use_atr': False, 'bull_use_adx': True, 'bull_use_spike': True, 'bull_rsi_required': True, 'bear_strategy': 'mean_reversion', 'bear_bb_std_mult': 2.7427622962176716, 'bear_rsi_os': 28, 'bear_rsi_ob': 80, 'bear_adx_thresh': 7.3522129124246405, 'bear_atr_min_pct': 0.01082568205392517, 'bear_atr_max_pct': 0.013130985253111377, 'bear_tp_mult': 2.0941647778906725, 'bear_tsl_mult': 0.10235231490340321, 'bear_time_stop': 250, 'bear_use_sma': True, 'bear_use_ema': False, 'bear_use_atr': False, 'bear_use_adx': True, 'bear_use_spike': True, 'bear_rsi_required': False, 'sideways_strategy': 'breakout', 'sideways_bb_std_mult': 3.041613184693923, 'sideways_rsi_os': 46, 'sideways_rsi_ob': 91, 'sideways_adx_thresh': 23.241651295368232, 'sideways_atr_min_pct': 0.004368882426344787, 'sideways_atr_max_pct': 0.11116078562121307, 'sideways_tp_mult': 1.875790316687873, 'sideways_tsl_mult': 0.3506880148066664, 'sideways_time_stop': 278, 'sideways_use_sma': False, 'sideways_use_ema': True, 'sideways_use_atr': True, 'sideways_use_adx': False, 'sideways_use_spike': True, 'sideways_rsi_required': False}.
[I 2025-09-01 14:40:24,434] Trial 500 finished with values: [-0.04220985684137102, 0.04243026546080059] and parameters: {'p_sma': 31, 'p_std': 25, 'p_atr': 24, 'p_adx': 7, 'rsi_period': 81, 'ema1': 19, 'ema2': 49, 'slip_atr_k': 0.13149430496635653, 'slip_spread_k': 0.5559089741749419, 'spread_hl_frac': 0.008495348074939653, 'bb_std_mult': 3.5985223395585284, 'rsi_os': 47, 'rsi_ob': 53, 'vol_spike': 0.1878604011891019, 'adx_thresh': 31.481222869895205, 'atr_min_pct': 0.012110757065281379, 'atr_max_pct': 0.03523898947743795, 'tp_mult': 1.4086465516683366, 'tsl_mult': 0.7287228455111298, 'strategy': 'mean_reversion', 'time_stop': 155, 'use_sma': True, 'use_atr': True, 'use_adx': True, 'use_ema': True, 'use_spike': False, 'rsi_required': True, 'edge_k': 0.21681441543750773, 'edge_cap': 0.0884247096130949, 'bull_strategy': 'mean_reversion', 'bull_bb_std_mult': 2.1078154633371793, 'bull_rsi_os': 46, 'bull_rsi_ob': 59, 'bull_adx_thresh': 11.966031159692225, 'bull_atr_min_pct': 0.0230386504089662, 'bull_atr_max_pct': 0.10242752143925934, 'bull_tp_mult': 1.5919262877978249, 'bull_tsl_mult': 0.3187731163605964, 'bull_time_stop': 132, 'bull_use_sma': False, 'bull_use_ema': False, 'bull_use_atr': False, 'bull_use_adx': True, 'bull_use_spike': True, 'bull_rsi_required': True, 'bear_strategy': 'mean_reversion', 'bear_bb_std_mult': 1.5604977983473534, 'bear_rsi_os': 40, 'bear_rsi_ob': 57, 'bear_adx_thresh': 31.781978738676017, 'bear_atr_min_pct': 0.003220987642450136, 'bear_atr_max_pct': 0.11169140970682077, 'bear_tp_mult': 1.3279042748376528, 'bear_tsl_mult': 0.16599273953064592, 'bear_time_stop': 100, 'bear_use_sma': True, 'bear_use_ema': False, 'bear_use_atr': False, 'bear_use_adx': True, 'bear_use_spike': True, 'bear_rsi_required': True, 'sideways_strategy': 'breakout', 'sideways_bb_std_mult': 3.593274637699692, 'sideways_rsi_os': 29, 'sideways_rsi_ob': 91, 'sideways_adx_thresh': 26.301794256402253, 'sideways_atr_min_pct': 0.0045045863205683285, 'sideways_atr_max_pct': 0.09106716500491771, 'sideways_tp_mult': 1.7555783732758228, 'sideways_tsl_mult': 0.4640893560412326, 'sideways_time_stop': 11, 'sideways_use_sma': True, 'sideways_use_ema': True, 'sideways_use_atr': True, 'sideways_use_adx': False, 'sideways_use_spike': True, 'sideways_rsi_required': False}.
