[I 2025-09-01 13:52:44,640] Trial 168 finished with values: [-0.02959275426546959, 0.030519580998331453] and parameters: {'p_sma': 13, 'p_std': 42, 'p_atr': 9, 'p_adx': 27, 'rsi_period': 25, 'ema1': 28, 'ema2': 52, 'slip_atr_k': 0.010104210521039969, 'slip_spread_k': 0.47071515201348035, 'spread_hl_frac': 0.011620358441472743, 'bb_std_mult': 1.9592730207769165, 'rsi_os': 46, 'rsi_ob': 70, 'vol_spike': 0.28952269953436427, 'adx_thresh': 9.926292216322857, 'atr_min_pct': 0.017680643127021962, 'atr_max_pct': 0.13239460660573088, 'tp_mult': 1.9915372236276399, 'tsl_mult': 0.12553084425258243, 'strategy': 'mean_reversion', 'time_stop': 91, 'use_sma': True, 'use_atr': False, 'use_adx': True, 'use_ema': False, 'use_spike': False, 'rsi_required': False, 'edge_k': 1.6829299282127759, 'edge_cap': 0.7397722266203113, 'bull_strategy': 'mean_reversion', 'bull_bb_std_mult': 1.430687199244322, 'bull_rsi_os': 17, 'bull_rsi_ob': 72, 'bull_adx_thresh': 10.267151634882403, 'bull_atr_min_pct': 0.012420113908283506, 'bull_atr_max_pct': 0.06175154424284559, 'bull_tp_mult': 1.4962706415164948, 'bull_tsl_mult': 0.6070322552223273, 'bull_time_stop': 90, 'bull_use_sma': True, 'bull_use_ema': False, 'bull_use_atr': True, 'bull_use_adx': True, 'bull_use_spike': True, 'bull_rsi_required': True, 'bear_strategy': 'breakout', 'bear_bb_std_mult': 3.1063855032654337, 'bear_rsi_os': 13, 'bear_rsi_ob': 62, 'bear_adx_thresh': 11.879054613456097, 'bear_atr_min_pct': 6.003945359268209e-05, 'bear_atr_max_pct': 0.0629065530006176, 'bear_tp_mult': 1.9870602735046532, 'bear_tsl_mult': 0.1736321285364991, 'bear_time_stop': 8, 'bear_use_sma': False, 'bear_use_ema': False, 'bear_use_atr': False, 'bear_use_adx': True, 'bear_use_spike': True, 'bear_rsi_required': True, 'sideways_strategy': 'breakout', 'sideways_bb_std_mult': 2.702704621054517, 'sideways_rsi_os': 48, 'sideways_rsi_ob': 86, 'sideways_adx_thresh': 30.34214459707618, 'sideways_atr_min_pct': 0.0008305395598696922, 'sideways_atr_max_pct': 0.11506741438598181, 'sideways_tp_mult': 2.6695497949365583, 'sideways_tsl_mult': 0.43720459152934993, 'sideways_time_stop': 241, 'sideways_use_sma': True, 'sideways_use_ema': True, 'sideways_use_atr': False, 'sideways_use_adx': False, 'sideways_use_spike': False, 'sideways_rsi_required': True}.
[I 2025-09-01 13:52:45,156] Trial 175 finished with values: [-1000000000.0, 1000000000.0] and parameters: {'p_sma': 11, 'p_std': 22, 'p_atr': 8, 'p_adx': 26, 'rsi_period': 29, 'ema1': 21, 'ema2': 23, 'slip_atr_k': 0.19097080244874903, 'slip_spread_k': 0.8204398409818179, 'spread_hl_frac': 0.01042042017047839, 'bb_std_mult': 1.7416241520252356, 'rsi_os': 47, 'rsi_ob': 47, 'vol_spike': 0.2575477598938272, 'adx_thresh': 23.06583321786559, 'atr_min_pct': 0.017689361345099474, 'atr_max_pct': 0.01598451143012084, 'tp_mult': 1.4559852517853527, 'tsl_mult': 0.5905887748626922, 'strategy': 'breakout', 'time_stop': 99, 'use_sma': True, 'use_atr': True, 'use_adx': False, 'use_ema': False, 'use_spike': True, 'rsi_required': False, 'edge_k': 0.06254599980467879, 'edge_cap': 0.837494543858593, 'bull_strategy': 'breakout', 'bull_bb_std_mult': 2.4918038201115738, 'bull_rsi_os': 15, 'bull_rsi_ob': 52, 'bull_adx_thresh': 25.14660708264958, 'bull_atr_min_pct': 0.016233418385791443, 'bull_atr_max_pct': 0.13462372273235168, 'bull_tp_mult': 1.4253228151907473, 'bull_tsl_mult': 0.5199458314745412, 'bull_time_stop': 149, 'bull_use_sma': False, 'bull_use_ema': True, 'bull_use_atr': False, 'bull_use_adx': True, 'bull_use_spike': False, 'bull_rsi_required': False, 'bear_strategy': 'mean_reversion', 'bear_bb_std_mult': 1.1595108377940617, 'bear_rsi_os': 37, 'bear_rsi_ob': 55, 'bear_adx_thresh': 26.992242486763175, 'bear_atr_min_pct': 0.003893722544748061, 'bear_atr_max_pct': 0.06796678583955901, 'bear_tp_mult': 1.891095333786268, 'bear_tsl_mult': 0.14488270232946512, 'bear_time_stop': 240, 'bear_use_sma': True, 'bear_use_ema': True, 'bear_use_atr': False, 'bear_use_adx': True, 'bear_use_spike': False, 'bear_rsi_required': True, 'sideways_strategy': 'breakout', 'sideways_bb_std_mult': 3.1907897264936267, 'sideways_rsi_os': 51, 'sideways_rsi_ob': 85, 'sideways_adx_thresh': 29.690131795974334, 'sideways_atr_min_pct': 0.00010418031297002549, 'sideways_atr_max_pct': 0.056148716741772395, 'sideways_tp_mult': 2.5918278957194754, 'sideways_tsl_mult': 0.7539991592695625, 'sideways_time_stop': 30, 'sideways_use_sma': False, 'sideways_use_ema': False, 'sideways_use_atr': True, 'sideways_use_adx': True, 'sideways_use_spike': False, 'sideways_rsi_required': False}.
[I 2025-09-01 13:53:23,874] Trial 172 finished with values: [-1000000000.0, 1000000000.0] and parameters: {'p_sma': 11, 'p_std': 38, 'p_atr': 19, 'p_adx': 26, 'rsi_period': 18, 'ema1': 29, 'ema2': 58, 'slip_atr_k': 0.21863913981816702, 'slip_spread_k': 0.5319652830359323, 'spread_hl_frac': 0.01083938191736386, 'bb_std_mult': 2.3801455786141297, 'rsi_os': 46, 'rsi_ob': 85, 'vol_spike': 0.24093868196659202, 'adx_thresh': 20.541914957994774, 'atr_min_pct': 0.008772658119092148, 'atr_max_pct': 0.07464808256711815, 'tp_mult': 1.4285668454895935, 'tsl_mult': 0.21897132905377842, 'strategy': 'breakout', 'time_stop': 291, 'use_sma': True, 'use_atr': True, 'use_adx': False, 'use_ema': False, 'use_spike': False, 'rsi_required': False, 'edge_k': 1.2218883706348582, 'edge_cap': 0.06910958106886711, 'bull_strategy': 'breakout', 'bull_bb_std_mult': 2.4734555077150486, 'bull_rsi_os': 16, 'bull_rsi_ob': 56, 'bull_adx_thresh': 31.21715371943116, 'bull_atr_min_pct': 0.0162882014602693, 'bull_atr_max_pct': 0.03959131191668158, 'bull_tp_mult': 2.37730573386103, 'bull_tsl_mult': 0.5250254714113798, 'bull_time_stop': 103, 'bull_use_sma': False, 'bull_use_ema': False, 'bull_use_atr': False, 'bull_use_adx': True, 'bull_use_spike': False, 'bull_rsi_required': False, 'bear_strategy': 'breakout', 'bear_bb_std_mult': 1.1680836713008411, 'bear_rsi_os': 15, 'bear_rsi_ob': 94, 'bear_adx_thresh': 5.018903889586262, 'bear_atr_min_pct': 0.00425016175513568, 'bear_atr_max_pct': 0.0631328070768232, 'bear_tp_mult': 1.6346602970606718, 'bear_tsl_mult': 0.5194068151429132, 'bear_time_stop': 35, 'bear_use_sma': True, 'bear_use_ema': True, 'bear_use_atr': False, 'bear_use_adx': True, 'bear_use_spike': False, 'bear_rsi_required': True, 'sideways_strategy': 'breakout', 'sideways_bb_std_mult': 0.7237800173416744, 'sideways_rsi_os': 31, 'sideways_rsi_ob': 85, 'sideways_adx_thresh': 9.435789058568467, 'sideways_atr_min_pct': 0.013087149322234901, 'sideways_atr_max_pct': 0.1270477455624246, 'sideways_tp_mult': 2.593224679886362, 'sideways_tsl_mult': 0.7525238374484935, 'sideways_time_stop': 241, 'sideways_use_sma': True, 'sideways_use_ema': False, 'sideways_use_atr': True, 'sideways_use_adx': False, 'sideways_use_spike': False, 'sideways_rsi_required': True}.
[I 2025-09-01 13:53:25,377] Trial 173 finished with values: [-0.030564117098575316, 0.030814410246309116] and parameters: {'p_sma': 11, 'p_std': 22, 'p_atr': 9, 'p_adx': 26, 'rsi_period': 30, 'ema1': 8, 'ema2': 23, 'slip_atr_k': 0.19113669378225928, 'slip_spread_k': 0.8113417145582769, 'spread_hl_frac': 0.03042913588803305, 'bb_std_mult': 0.5925672457362465, 'rsi_os': 46, 'rsi_ob': 62, 'vol_spike': 0.10518210678063142, 'adx_thresh': 16.717611390228175, 'atr_min_pct': 0.008814878199596357, 'atr_max_pct': 0.10331266381452821, 'tp_mult': 2.1316092596616034, 'tsl_mult': 0.22563996700295605, 'strategy': 'breakout', 'time_stop': 97, 'use_sma': True, 'use_atr': True, 'use_adx': False, 'use_ema': False, 'use_spike': False, 'rsi_required': False, 'edge_k': 1.5071533988570243, 'edge_cap': 0.40404849797536124, 'bull_strategy': 'breakout', 'bull_bb_std_mult': 1.410978746555646, 'bull_rsi_os': 16, 'bull_rsi_ob': 52, 'bull_adx_thresh': 22.42700738947247, 'bull_atr_min_pct': 0.004162170247166717, 'bull_atr_max_pct': 0.13416646520035108, 'bull_tp_mult': 1.1352508541288864, 'bull_tsl_mult': 0.5891428987970004, 'bull_time_stop': 243, 'bull_use_sma': False, 'bull_use_ema': False, 'bull_use_atr': False, 'bull_use_adx': True, 'bull_use_spike': False, 'bull_rsi_required': False, 'bear_strategy': 'breakout', 'bear_bb_std_mult': 2.25626676021293, 'bear_rsi_os': 14, 'bear_rsi_ob': 57, 'bear_adx_thresh': 5.009123492668598, 'bear_atr_min_pct': 0.003953456102766262, 'bear_atr_max_pct': 0.10644507151058166, 'bear_tp_mult': 1.2747105418001392, 'bear_tsl_mult': 0.5365762442533997, 'bear_time_stop': 85, 'bear_use_sma': True, 'bear_use_ema': True, 'bear_use_atr': False, 'bear_use_adx': True, 'bear_use_spike': False, 'bear_rsi_required': True, 'sideways_strategy': 'breakout', 'sideways_bb_std_mult': 0.5206137213099518, 'sideways_rsi_os': 26, 'sideways_rsi_ob': 85, 'sideways_adx_thresh': 30.060703177761802, 'sideways_atr_min_pct': 0.013222862587896149, 'sideways_atr_max_pct': 0.054218723475324866, 'sideways_tp_mult': 2.585770321487453, 'sideways_tsl_mult': 0.7498247480470751, 'sideways_time_stop': 175, 'sideways_use_sma': True, 'sideways_use_ema': False, 'sideways_use_atr': True, 'sideways_use_adx': False, 'sideways_use_spike': False, 'sideways_rsi_required': True}.
[I 2025-09-01 13:53:25,649] Trial 174 finished with values: [-0.012718337666321577, 0.015017714806086477] and parameters: {'p_sma': 11, 'p_std': 22, 'p_atr': 8, 'p_adx': 27, 'rsi_period': 23, 'ema1': 30, 'ema2': 23, 'slip_atr_k': 0.08468176978172787, 'slip_spread_k': 0.5370258611069529, 'spread_hl_frac': 0.010323213215809576, 'bb_std_mult': 1.91302480676906, 'rsi_os': 46, 'rsi_ob': 46, 'vol_spike': 0.2578757214004269, 'adx_thresh': 34.21924079713061, 'atr_min_pct': 0.008851542818046645, 'atr_max_pct': 0.019459823453160198, 'tp_mult': 1.9220842661421116, 'tsl_mult': 0.025295108240403073, 'strategy': 'breakout', 'time_stop': 261, 'use_sma': True, 'use_atr': True, 'use_adx': False, 'use_ema': False, 'use_spike': False, 'rsi_required': False, 'edge_k': 1.2203578100042467, 'edge_cap': 0.066087659881438, 'bull_strategy': 'breakout', 'bull_bb_std_mult': 2.1829548140078856, 'bull_rsi_os': 16, 'bull_rsi_ob': 52, 'bull_adx_thresh': 30.441661372467525, 'bull_atr_min_pct': 0.002029809175877681, 'bull_atr_max_pct': 0.05679532112329948, 'bull_tp_mult': 1.4176343073952524, 'bull_tsl_mult': 0.9993719901169018, 'bull_time_stop': 256, 'bull_use_sma': False, 'bull_use_ema': False, 'bull_use_atr': False, 'bull_use_adx': True, 'bull_use_spike': False, 'bull_rsi_required': False, 'bear_strategy': 'breakout', 'bear_bb_std_mult': 2.2442375756648487, 'bear_rsi_os': 39, 'bear_rsi_ob': 54, 'bear_adx_thresh': 12.014121366852883, 'bear_atr_min_pct': 0.003788989070800383, 'bear_atr_max_pct': 0.0628635271832571, 'bear_tp_mult': 1.2112981628894577, 'bear_tsl_mult': 0.6268839398231123, 'bear_time_stop': 36, 'bear_use_sma': True, 'bear_use_ema': True, 'bear_use_atr': False, 'bear_use_adx': True, 'bear_use_spike': False, 'bear_rsi_required': True, 'sideways_strategy': 'breakout', 'sideways_bb_std_mult': 0.7441166848650612, 'sideways_rsi_os': 47, 'sideways_rsi_ob': 85, 'sideways_adx_thresh': 29.954400838022373, 'sideways_atr_min_pct': 0.013302189691226419, 'sideways_atr_max_pct': 0.12676596235812027, 'sideways_tp_mult': 2.6735870091842235, 'sideways_tsl_mult': 0.757382385926784, 'sideways_time_stop': 240, 'sideways_use_sma': False, 'sideways_use_ema': False, 'sideways_use_atr': True, 'sideways_use_adx': False, 'sideways_use_spike': False, 'sideways_rsi_required': True}.
[I 2025-09-01 13:53:26,393] Trial 176 finished with values: [-0.03375972337838484, 0.033978202082543124] and parameters: {'p_sma': 58, 'p_std': 7, 'p_atr': 28, 'p_adx': 28, 'rsi_period': 23, 'ema1': 7, 'ema2': 25, 'slip_atr_k': 0.006417956545936555, 'slip_spread_k': 0.531980515733084, 'spread_hl_frac': 0.04535529470344786, 'bb_std_mult': 1.9065760744620466, 'rsi_os': 38, 'rsi_ob': 45, 'vol_spike': 0.08557555008307631, 'adx_thresh': 7.3194234045372415, 'atr_min_pct': 0.016661000773831036, 'atr_max_pct': 0.114280247989586, 'tp_mult': 1.9147455575409282, 'tsl_mult': 0.018871941756616994, 'strategy': 'breakout', 'time_stop': 257, 'use_sma': False, 'use_atr': True, 'use_adx': False, 'use_ema': False, 'use_spike': True, 'rsi_required': True, 'edge_k': 1.222158665423212, 'edge_cap': 0.549439147369237, 'bull_strategy': 'breakout', 'bull_bb_std_mult': 2.3920048212646616, 'bull_rsi_os': 16, 'bull_rsi_ob': 56, 'bull_adx_thresh': 26.860734101803665, 'bull_atr_min_pct': 0.0019817122515624983, 'bull_atr_max_pct': 0.051367320160365534, 'bull_tp_mult': 1.386429627240172, 'bull_tsl_mult': 0.5844559165282999, 'bull_time_stop': 242, 'bull_use_sma': False, 'bull_use_ema': True, 'bull_use_atr': False, 'bull_use_adx': True, 'bull_use_spike': False, 'bull_rsi_required': False, 'bear_strategy': 'breakout', 'bear_bb_std_mult': 0.7996582530134175, 'bear_rsi_os': 14, 'bear_rsi_ob': 51, 'bear_adx_thresh': 15.878454452472342, 'bear_atr_min_pct': 0.015641469141534123, 'bear_atr_max_pct': 0.07454521854599563, 'bear_tp_mult': 2.7592795776311303, 'bear_tsl_mult': 0.20203865315120745, 'bear_time_stop': 51, 'bear_use_sma': False, 'bear_use_ema': True, 'bear_use_atr': False, 'bear_use_adx': True, 'bear_use_spike': False, 'bear_rsi_required': True, 'sideways_strategy': 'mean_reversion', 'sideways_bb_std_mult': 0.6781120295653403, 'sideways_rsi_os': 38, 'sideways_rsi_ob': 77, 'sideways_adx_thresh': 15.975889737081411, 'sideways_atr_min_pct': 0.029127929263678954, 'sideways_atr_max_pct': 0.12174679838893317, 'sideways_tp_mult': 1.7785852463010299, 'sideways_tsl_mult': 0.3580237019995841, 'sideways_time_stop': 236, 'sideways_use_sma': False, 'sideways_use_ema': True, 'sideways_use_atr': True, 'sideways_use_adx': False, 'sideways_use_spike': True, 'sideways_rsi_required': False}.
[I 2025-09-01 13:54:05,950] Trial 180 finished with values: [-1000000000.0, 1000000000.0] and parameters: {'p_sma': 26, 'p_std': 27, 'p_atr': 30, 'p_adx': 24, 'rsi_period': 34, 'ema1': 25, 'ema2': 29, 'slip_atr_k': 0.08441688478072848, 'slip_spread_k': 0.5158456664553706, 'spread_hl_frac': 0.013539523016014259, 'bb_std_mult': 2.05245824433495, 'rsi_os': 48, 'rsi_ob': 93, 'vol_spike': 0.15304071242857675, 'adx_thresh': 34.53919935269253, 'atr_min_pct': 0.010680460232063399, 'atr_max_pct': 0.019962599564959403, 'tp_mult': 2.050226017093707, 'tsl_mult': 0.9502594027844795, 'strategy': 'breakout', 'time_stop': 7, 'use_sma': False, 'use_atr': False, 'use_adx': False, 'use_ema': True, 'use_spike': True, 'rsi_required': True, 'edge_k': 1.1574020204052349, 'edge_cap': 0.2848997766717105, 'bull_strategy': 'breakout', 'bull_bb_std_mult': 1.265770400564786, 'bull_rsi_os': 18, 'bull_rsi_ob': 49, 'bull_adx_thresh': 11.99163919461312, 'bull_atr_min_pct': 0.023580983199970124, 'bull_atr_max_pct': 0.10776289482513024, 'bull_tp_mult': 2.270844523683166, 'bull_tsl_mult': 0.999095876837392, 'bull_time_stop': 259, 'bull_use_sma': False, 'bull_use_ema': True, 'bull_use_atr': True, 'bull_use_adx': False, 'bull_use_spike': False, 'bull_rsi_required': False, 'bear_strategy': 'mean_reversion', 'bear_bb_std_mult': 2.981169917161, 'bear_rsi_os': 44, 'bear_rsi_ob': 68, 'bear_adx_thresh': 14.773879699855083, 'bear_atr_min_pct': 0.005186642891311602, 'bear_atr_max_pct': 0.12097465170283528, 'bear_tp_mult': 2.6197162071376026, 'bear_tsl_mult': 0.6230696639384077, 'bear_time_stop': 144, 'bear_use_sma': False, 'bear_use_ema': True, 'bear_use_atr': False, 'bear_use_adx': False, 'bear_use_spike': False, 'bear_rsi_required': True, 'sideways_strategy': 'breakout', 'sideways_bb_std_mult': 1.571522599937421, 'sideways_rsi_os': 36, 'sideways_rsi_ob': 88, 'sideways_adx_thresh': 28.030070070162033, 'sideways_atr_min_pct': 0.01725775597695598, 'sideways_atr_max_pct': 0.07149746297811896, 'sideways_tp_mult': 2.2938866846567505, 'sideways_tsl_mult': 0.7763944693552185, 'sideways_time_stop': 253, 'sideways_use_sma': False, 'sideways_use_ema': True, 'sideways_use_atr': True, 'sideways_use_adx': True, 'sideways_use_spike': False, 'sideways_rsi_required': False}.
[I 2025-09-01 13:54:06,379] Trial 179 finished with values: [-1000000000.0, 1000000000.0] and parameters: {'p_sma': 8, 'p_std': 49, 'p_atr': 28, 'p_adx': 24, 'rsi_period': 34, 'ema1': 7, 'ema2': 30, 'slip_atr_k': 0.004775355636420925, 'slip_spread_k': 0.6464641595457665, 'spread_hl_frac': 0.025019260487408653, 'bb_std_mult': 2.049665650438828, 'rsi_os': 44, 'rsi_ob': 50, 'vol_spike': 0.08579413865567537, 'adx_thresh': 13.648832797649312, 'atr_min_pct': 0.020518093635833484, 'atr_max_pct': 0.1499147691943636, 'tp_mult': 1.914892044554194, 'tsl_mult': 0.02174128783291253, 'strategy': 'breakout', 'time_stop': 80, 'use_sma': False, 'use_atr': False, 'use_adx': False, 'use_ema': True, 'use_spike': True, 'rsi_required': True, 'edge_k': 1.2675425777403182, 'edge_cap': 0.2884669443897216, 'bull_strategy': 'breakout', 'bull_bb_std_mult': 1.273857900854371, 'bull_rsi_os': 43, 'bull_rsi_ob': 53, 'bull_adx_thresh': 11.897604968631777, 'bull_atr_min_pct': 0.01928067193515945, 'bull_atr_max_pct': 0.05198720666228414, 'bull_tp_mult': 2.273282642909588, 'bull_tsl_mult': 0.3779796026145553, 'bull_time_stop': 96, 'bull_use_sma': False, 'bull_use_ema': True, 'bull_use_atr': True, 'bull_use_adx': True, 'bull_use_spike': False, 'bull_rsi_required': False, 'bear_strategy': 'mean_reversion', 'bear_bb_std_mult': 3.1597939228467604, 'bear_rsi_os': 39, 'bear_rsi_ob': 79, 'bear_adx_thresh': 15.90448500242709, 'bear_atr_min_pct': 0.004781784336918437, 'bear_atr_max_pct': 0.12210703592179424, 'bear_tp_mult': 1.8877420845625277, 'bear_tsl_mult': 0.20236589896206372, 'bear_time_stop': 51, 'bear_use_sma': False, 'bear_use_ema': True, 'bear_use_atr': False, 'bear_use_adx': False, 'bear_use_spike': False, 'bear_rsi_required': True, 'sideways_strategy': 'mean_reversion', 'sideways_bb_std_mult': 1.5606668583384964, 'sideways_rsi_os': 20, 'sideways_rsi_ob': 88, 'sideways_adx_thresh': 28.08039080660373, 'sideways_atr_min_pct': 0.017619323886337364, 'sideways_atr_max_pct': 0.12024053045762295, 'sideways_tp_mult': 2.276808540495968, 'sideways_tsl_mult': 0.7725496244570192, 'sideways_time_stop': 93, 'sideways_use_sma': False, 'sideways_use_ema': True, 'sideways_use_atr': True, 'sideways_use_adx': True, 'sideways_use_spike': True, 'sideways_rsi_required': False}.
[I 2025-09-01 13:54:06,602] Trial 178 finished with values: [-0.004358930950749906, 0.004634090281166694] and parameters: {'p_sma': 25, 'p_std': 49, 'p_atr': 7, 'p_adx': 28, 'rsi_period': 23, 'ema1': 7, 'ema2': 29, 'slip_atr_k': 0.08591573218688148, 'slip_spread_k': 0.9697136208152601, 'spread_hl_frac': 0.009488628196120109, 'bb_std_mult': 2.0579342189929726, 'rsi_os': 52, 'rsi_ob': 93, 'vol_spike': 0.15209979319459663, 'adx_thresh': 21.757518635353193, 'atr_min_pct': 0.016388605768659054, 'atr_max_pct': 0.018465921171579486, 'tp_mult': 1.926738220539713, 'tsl_mult': 0.5304673107944184, 'strategy': 'breakout', 'time_stop': 261, 'use_sma': False, 'use_atr': True, 'use_adx': False, 'use_ema': False, 'use_spike': True, 'rsi_required': True, 'edge_k': 1.1551671799046248, 'edge_cap': 0.38686478397071233, 'bull_strategy': 'breakout', 'bull_bb_std_mult': 1.2635003430110503, 'bull_rsi_os': 33, 'bull_rsi_ob': 75, 'bull_adx_thresh': 27.085433531468787, 'bull_atr_min_pct': 0.001962833763262702, 'bull_atr_max_pct': 0.050730900181962, 'bull_tp_mult': 2.288891940061373, 'bull_tsl_mult': 0.3738493846396561, 'bull_time_stop': 273, 'bull_use_sma': False, 'bull_use_ema': True, 'bull_use_atr': False, 'bull_use_adx': False, 'bull_use_spike': False, 'bull_rsi_required': False, 'bear_strategy': 'breakout', 'bear_bb_std_mult': 3.305996567117658, 'bear_rsi_os': 28, 'bear_rsi_ob': 90, 'bear_adx_thresh': 6.961367363700185, 'bear_atr_min_pct': 0.005693730677274339, 'bear_atr_max_pct': 0.12098075827309746, 'bear_tp_mult': 2.933451771474207, 'bear_tsl_mult': 0.6055195257122905, 'bear_time_stop': 146, 'bear_use_sma': False, 'bear_use_ema': True, 'bear_use_atr': False, 'bear_use_adx': True, 'bear_use_spike': False, 'bear_rsi_required': False, 'sideways_strategy': 'mean_reversion', 'sideways_bb_std_mult': 1.172908933389003, 'sideways_rsi_os': 19, 'sideways_rsi_ob': 88, 'sideways_adx_thresh': 28.16733613909333, 'sideways_atr_min_pct': 0.016065013017901548, 'sideways_atr_max_pct': 0.12024673259326035, 'sideways_tp_mult': 2.2655001941016395, 'sideways_tsl_mult': 0.5290118767256923, 'sideways_time_stop': 228, 'sideways_use_sma': False, 'sideways_use_ema': True, 'sideways_use_atr': True, 'sideways_use_adx': False, 'sideways_use_spike': True, 'sideways_rsi_required': False}.
