[I 2025-09-01 13:28:39,119] Trial 12 finished with values: [-1000000000.0, 1000000000.0] and parameters: {'p_sma': 18, 'p_std': 5, 'p_atr': 10, 'p_adx': 19, 'rsi_period': 45, 'ema1': 30, 'ema2': 55, 'slip_atr_k': 0.16437586841568086, 'slip_spread_k': 0.7105212646193559, 'spread_hl_frac': 0.04176727190503192, 'bb_std_mult': 0.5836477930569853, 'rsi_os': 44, 'rsi_ob': 90, 'vol_spike': 0.0908452994280593, 'adx_thresh': 10.444086023119524, 'atr_min_pct': 0.024830189728959513, 'atr_max_pct': 0.013971568511761016, 'tp_mult': 2.9217070704895796, 'tsl_mult': 0.7523060901951151, 'strategy': 'breakout', 'time_stop': 174, 'use_sma': False, 'use_atr': False, 'use_adx': False, 'use_ema': True, 'use_spike': False, 'rsi_required': True, 'edge_k': 1.4492600506779572, 'edge_cap': 0.9448968219008153, 'bull_strategy': 'mean_reversion', 'bull_bb_std_mult': 3.4683173810721217, 'bull_rsi_os': 9, 'bull_rsi_ob': 62, 'bull_adx_thresh': 13.993730995602277, 'bull_atr_min_pct': 0.02546483844646826, 'bull_atr_max_pct': 0.05951230343274038, 'bull_tp_mult': 2.747833011654122, 'bull_tsl_mult': 0.09718497449566199, 'bull_time_stop': 214, 'bull_use_sma': True, 'bull_use_ema': True, 'bull_use_atr': True, 'bull_use_adx': False, 'bull_use_spike': False, 'bull_rsi_required': False, 'bear_strategy': 'mean_reversion', 'bear_bb_std_mult': 0.8265277186760405, 'bear_rsi_os': 51, 'bear_rsi_ob': 80, 'bear_adx_thresh': 21.665131179700534, 'bear_atr_min_pct': 0.013835112796537869, 'bear_atr_max_pct': 0.12143796806444178, 'bear_tp_mult': 1.093152482721127, 'bear_tsl_mult': 0.4177924668547621, 'bear_time_stop': 88, 'bear_use_sma': True, 'bear_use_ema': False, 'bear_use_atr': False, 'bear_use_adx': True, 'bear_use_spike': True, 'bear_rsi_required': False, 'sideways_strategy': 'breakout', 'sideways_bb_std_mult': 2.189276351439976, 'sideways_rsi_os': 21, 'sideways_rsi_ob': 95, 'sideways_adx_thresh': 29.44973150999027, 'sideways_atr_min_pct': 0.010516188132627446, 'sideways_atr_max_pct': 0.07355234943490571, 'sideways_tp_mult': 1.6896310865952828, 'sideways_tsl_mult': 0.4930732647632263, 'sideways_time_stop': 72, 'sideways_use_sma': False, 'sideways_use_ema': True, 'sideways_use_atr': True, 'sideways_use_adx': True, 'sideways_use_spike': True, 'sideways_rsi_required': False}.
[I 2025-09-01 13:28:39,526] Trial 7 finished with values: [-1000000000.0, 1000000000.0] and parameters: {'p_sma': 40, 'p_std': 55, 'p_atr': 20, 'p_adx': 26, 'rsi_period': 76, 'ema1': 11, 'ema2': 49, 'slip_atr_k': 0.03885050212168609, 'slip_spread_k': 0.05563820837739786, 'spread_hl_frac': 0.004849936053535931, 'bb_std_mult': 2.2891599788088115, 'rsi_os': 17, 'rsi_ob': 50, 'vol_spike': 0.10149970818741615, 'adx_thresh': 6.47560007698044, 'atr_min_pct': 0.007952878492207082, 'atr_max_pct': 0.03469374837403542, 'tp_mult': 1.1051732018002627, 'tsl_mult': 0.12799829160321596, 'strategy': 'breakout', 'time_stop': 151, 'use_sma': False, 'use_atr': True, 'use_adx': False, 'use_ema': False, 'use_spike': True, 'rsi_required': True, 'edge_k': 1.675400108658974, 'edge_cap': 0.43578472358402104, 'bull_strategy': 'mean_reversion', 'bull_bb_std_mult': 2.119841345963603, 'bull_rsi_os': 55, 'bull_rsi_ob': 83, 'bull_adx_thresh': 34.90471433108147, 'bull_atr_min_pct': 0.01643266211718463, 'bull_atr_max_pct': 0.08326141845300916, 'bull_tp_mult': 2.808181316979309, 'bull_tsl_mult': 0.6359186860566329, 'bull_time_stop': 18, 'bull_use_sma': False, 'bull_use_ema': False, 'bull_use_atr': True, 'bull_use_adx': True, 'bull_use_spike': False, 'bull_rsi_required': True, 'bear_strategy': 'mean_reversion', 'bear_bb_std_mult': 2.6218919422114877, 'bear_rsi_os': 26, 'bear_rsi_ob': 46, 'bear_adx_thresh': 9.228982121550226, 'bear_atr_min_pct': 0.02424920753869885, 'bear_atr_max_pct': 0.06365209153933304, 'bear_tp_mult': 2.470189570323572, 'bear_tsl_mult': 0.1428203744776705, 'bear_time_stop': 281, 'bear_use_sma': True, 'bear_use_ema': False, 'bear_use_atr': False, 'bear_use_adx': False, 'bear_use_spike': False, 'bear_rsi_required': False, 'sideways_strategy': 'mean_reversion', 'sideways_bb_std_mult': 1.156434998220147, 'sideways_rsi_os': 11, 'sideways_rsi_ob': 54, 'sideways_adx_thresh': 16.446610951875833, 'sideways_atr_min_pct': 0.01871753015914041, 'sideways_atr_max_pct': 0.018964153731176162, 'sideways_tp_mult': 1.5253280210553717, 'sideways_tsl_mult': 0.17056505113557385, 'sideways_time_stop': 276, 'sideways_use_sma': True, 'sideways_use_ema': False, 'sideways_use_atr': False, 'sideways_use_adx': True, 'sideways_use_spike': True, 'sideways_rsi_required': True}.
[I 2025-09-01 13:29:16,458] Trial 10 finished with values: [-1000000000.0, 1000000000.0] and parameters: {'p_sma': 59, 'p_std': 17, 'p_atr': 23, 'p_adx': 25, 'rsi_period': 59, 'ema1': 21, 'ema2': 60, 'slip_atr_k': 0.17154863216584534, 'slip_spread_k': 0.8867275217023292, 'spread_hl_frac': 0.01516279775270908, 'bb_std_mult': 3.257389172343225, 'rsi_os': 19, 'rsi_ob': 92, 'vol_spike': 0.2507251547642788, 'adx_thresh': 26.369886006894287, 'atr_min_pct': 0.0009417510179098909, 'atr_max_pct': 0.08872437290687955, 'tp_mult': 2.9749628819833047, 'tsl_mult': 0.43190789863757106, 'strategy': 'breakout', 'time_stop': 10, 'use_sma': False, 'use_atr': False, 'use_adx': True, 'use_ema': False, 'use_spike': False, 'rsi_required': True, 'edge_k': 1.7704605922696481, 'edge_cap': 0.5140008994822328, 'bull_strategy': 'mean_reversion', 'bull_bb_std_mult': 1.983357394956249, 'bull_rsi_os': 52, 'bull_rsi_ob': 79, 'bull_adx_thresh': 15.860074383104362, 'bull_atr_min_pct': 0.006943535461292523, 'bull_atr_max_pct': 0.042059850647131164, 'bull_tp_mult': 1.2326400937114501, 'bull_tsl_mult': 0.6487438549838181, 'bull_time_stop': 163, 'bull_use_sma': False, 'bull_use_ema': False, 'bull_use_atr': False, 'bull_use_adx': True, 'bull_use_spike': True, 'bull_rsi_required': True, 'bear_strategy': 'breakout', 'bear_bb_std_mult': 1.3730676508920683, 'bear_rsi_os': 41, 'bear_rsi_ob': 91, 'bear_adx_thresh': 17.791313918805326, 'bear_atr_min_pct': 0.0013388230463183047, 'bear_atr_max_pct': 0.05190471928359318, 'bear_tp_mult': 1.3832462288845275, 'bear_tsl_mult': 0.600968785166107, 'bear_time_stop': 208, 'bear_use_sma': True, 'bear_use_ema': False, 'bear_use_atr': True, 'bear_use_adx': True, 'bear_use_spike': True, 'bear_rsi_required': True, 'sideways_strategy': 'mean_reversion', 'sideways_bb_std_mult': 1.7407495600164415, 'sideways_rsi_os': 52, 'sideways_rsi_ob': 63, 'sideways_adx_thresh': 20.89828427724094, 'sideways_atr_min_pct': 0.0186841320583899, 'sideways_atr_max_pct': 0.0634581281175495, 'sideways_tp_mult': 2.5611797453921583, 'sideways_tsl_mult': 0.19941828002153317, 'sideways_time_stop': 76, 'sideways_use_sma': True, 'sideways_use_ema': True, 'sideways_use_atr': False, 'sideways_use_adx': True, 'sideways_use_spike': False, 'sideways_rsi_required': False}.
[I 2025-09-01 13:29:16,884] Trial 9 finished with values: [-0.28874740622279127, 0.28875330358887613] and parameters: {'p_sma': 57, 'p_std': 49, 'p_atr': 19, 'p_adx': 10, 'rsi_period': 69, 'ema1': 14, 'ema2': 40, 'slip_atr_k': 0.2376093859318234, 'slip_spread_k': 0.7197479208439611, 'spread_hl_frac': 0.029632447567749534, 'bb_std_mult': 0.6965721416350569, 'rsi_os': 5, 'rsi_ob': 88, 'vol_spike': 0.05041092633691039, 'adx_thresh': 9.945834486552748, 'atr_min_pct': 0.02121994329001559, 'atr_max_pct': 0.06977657700418938, 'tp_mult': 1.6318392188049158, 'tsl_mult': 0.6565229535167805, 'strategy': 'mean_reversion', 'time_stop': 269, 'use_sma': True, 'use_atr': True, 'use_adx': True, 'use_ema': True, 'use_spike': True, 'rsi_required': True, 'edge_k': 0.6346824593988534, 'edge_cap': 0.7075113184754429, 'bull_strategy': 'mean_reversion', 'bull_bb_std_mult': 1.8808148799779794, 'bull_rsi_os': 22, 'bull_rsi_ob': 56, 'bull_adx_thresh': 27.125988810529627, 'bull_atr_min_pct': 0.005433717962770143, 'bull_atr_max_pct': 0.02643197520153174, 'bull_tp_mult': 1.1782681940334234, 'bull_tsl_mult': 0.21784084176141016, 'bull_time_stop': 162, 'bull_use_sma': False, 'bull_use_ema': False, 'bull_use_atr': False, 'bull_use_adx': False, 'bull_use_spike': False, 'bull_rsi_required': True, 'bear_strategy': 'breakout', 'bear_bb_std_mult': 2.7279775583542936, 'bear_rsi_os': 38, 'bear_rsi_ob': 74, 'bear_adx_thresh': 20.76555055584203, 'bear_atr_min_pct': 0.028982356617772796, 'bear_atr_max_pct': 0.1168128573910285, 'bear_tp_mult': 2.142216692273554, 'bear_tsl_mult': 0.1645366184901509, 'bear_time_stop': 184, 'bear_use_sma': True, 'bear_use_ema': False, 'bear_use_atr': False, 'bear_use_adx': True, 'bear_use_spike': True, 'bear_rsi_required': False, 'sideways_strategy': 'breakout', 'sideways_bb_std_mult': 3.3170702095999327, 'sideways_rsi_os': 29, 'sideways_rsi_ob': 53, 'sideways_adx_thresh': 18.775235742230606, 'sideways_atr_min_pct': 0.0002385675213110161, 'sideways_atr_max_pct': 0.05800393157515789, 'sideways_tp_mult': 2.414264829856745, 'sideways_tsl_mult': 0.5104459658865662, 'sideways_time_stop': 182, 'sideways_use_sma': True, 'sideways_use_ema': False, 'sideways_use_atr': False, 'sideways_use_adx': True, 'sideways_use_spike': True, 'sideways_rsi_required': True}.
[I 2025-09-01 13:29:18,952] Trial 13 finished with values: [-0.09179462323418697, 0.09183976501180699] and parameters: {'p_sma': 39, 'p_std': 39, 'p_atr': 17, 'p_adx': 25, 'rsi_period': 8, 'ema1': 5, 'ema2': 40, 'slip_atr_k': 0.0042083223452697854, 'slip_spread_k': 0.49028607773767696, 'spread_hl_frac': 0.0023900344128285206, 'bb_std_mult': 1.4096445714912598, 'rsi_os': 39, 'rsi_ob': 63, 'vol_spike': 0.23101741399366255, 'adx_thresh': 28.529058816998507, 'atr_min_pct': 0.010173432138161357, 'atr_max_pct': 0.04546520207483182, 'tp_mult': 1.7298223506872532, 'tsl_mult': 0.09244857671824153, 'strategy': 'breakout', 'time_stop': 126, 'use_sma': True, 'use_atr': True, 'use_adx': False, 'use_ema': False, 'use_spike': True, 'rsi_required': False, 'edge_k': 0.858621150603718, 'edge_cap': 0.4221130314280268, 'bull_strategy': 'breakout', 'bull_bb_std_mult': 0.7397574766203685, 'bull_rsi_os': 54, 'bull_rsi_ob': 47, 'bull_adx_thresh': 5.99351741588603, 'bull_atr_min_pct': 0.0005191793954312102, 'bull_atr_max_pct': 0.11618225301476788, 'bull_tp_mult': 1.1322677884017174, 'bull_tsl_mult': 0.7301898605943754, 'bull_time_stop': 128, 'bull_use_sma': False, 'bull_use_ema': True, 'bull_use_atr': False, 'bull_use_adx': True, 'bull_use_spike': False, 'bull_rsi_required': False, 'bear_strategy': 'breakout', 'bear_bb_std_mult': 2.784508681789367, 'bear_rsi_os': 10, 'bear_rsi_ob': 60, 'bear_adx_thresh': 13.697571321968162, 'bear_atr_min_pct': 0.0010986001489970958, 'bear_atr_max_pct': 0.050337069005445115, 'bear_tp_mult': 1.6695670169526489, 'bear_tsl_mult': 0.000545857612922751, 'bear_time_stop': 122, 'bear_use_sma': False, 'bear_use_ema': True, 'bear_use_atr': False, 'bear_use_adx': True, 'bear_use_spike': False, 'bear_rsi_required': True, 'sideways_strategy': 'breakout', 'sideways_bb_std_mult': 0.6336262172372545, 'sideways_rsi_os': 55, 'sideways_rsi_ob': 81, 'sideways_adx_thresh': 24.52038478200261, 'sideways_atr_min_pct': 0.020046124956764083, 'sideways_atr_max_pct': 0.14475470222283604, 'sideways_tp_mult': 2.95778014823769, 'sideways_tsl_mult': 0.0314818520518404, 'sideways_time_stop': 203, 'sideways_use_sma': True, 'sideways_use_ema': True, 'sideways_use_atr': True, 'sideways_use_adx': True, 'sideways_use_spike': False, 'sideways_rsi_required': False}.
[I 2025-09-01 13:29:19,330] Trial 14 finished with values: [-0.18069039973504697, 0.1807127028491573] and parameters: {'p_sma': 6, 'p_std': 39, 'p_atr': 17, 'p_adx': 7, 'rsi_period': 8, 'ema1': 22, 'ema2': 39, 'slip_atr_k': 0.24863424147974472, 'slip_spread_k': 0.9936166679638581, 'spread_hl_frac': 0.018825174467609826, 'bb_std_mult': 1.3473689935861826, 'rsi_os': 28, 'rsi_ob': 68, 'vol_spike': 0.18131790436898665, 'adx_thresh': 34.34281331559947, 'atr_min_pct': 0.011299927395692314, 'atr_max_pct': 0.14786542401540842, 'tp_mult': 2.4062207278463985, 'tsl_mult': 0.9955059145177536, 'strategy': 'mean_reversion', 'time_stop': 17, 'use_sma': True, 'use_atr': True, 'use_adx': True, 'use_ema': False, 'use_spike': True, 'rsi_required': False, 'edge_k': 0.8714384735557072, 'edge_cap': 0.06690172490890633, 'bull_strategy': 'breakout', 'bull_bb_std_mult': 0.8927943707368531, 'bull_rsi_os': 52, 'bull_rsi_ob': 50, 'bull_adx_thresh': 5.462480949992273, 'bull_atr_min_pct': 0.002863478286030858, 'bull_atr_max_pct': 0.14892944569027647, 'bull_tp_mult': 1.0303629599078632, 'bull_tsl_mult': 0.9987829594554661, 'bull_time_stop': 128, 'bull_use_sma': True, 'bull_use_ema': False, 'bull_use_atr': False, 'bull_use_adx': False, 'bull_use_spike': False, 'bull_rsi_required': False, 'bear_strategy': 'breakout', 'bear_bb_std_mult': 2.4638503627884454, 'bear_rsi_os': 5, 'bear_rsi_ob': 57, 'bear_adx_thresh': 33.59319324277598, 'bear_atr_min_pct': 0.0006482963458398633, 'bear_atr_max_pct': 0.04675249311146487, 'bear_tp_mult': 1.5777585830416623, 'bear_tsl_mult': 0.010834076598675468, 'bear_time_stop': 111, 'bear_use_sma': False, 'bear_use_ema': True, 'bear_use_atr': True, 'bear_use_adx': True, 'bear_use_spike': False, 'bear_rsi_required': True, 'sideways_strategy': 'breakout', 'sideways_bb_std_mult': 3.497996796656558, 'sideways_rsi_os': 55, 'sideways_rsi_ob': 47, 'sideways_adx_thresh': 6.415403859834251, 'sideways_atr_min_pct': 0.00035723365274132647, 'sideways_atr_max_pct': 0.1450633130792756, 'sideways_tp_mult': 2.983920046830727, 'sideways_tsl_mult': 0.9773180469768447, 'sideways_time_stop': 211, 'sideways_use_sma': True, 'sideways_use_ema': True, 'sideways_use_atr': True, 'sideways_use_adx': True, 'sideways_use_spike': True, 'sideways_rsi_required': True}.
[I 2025-09-01 13:29:56,611] Trial 16 finished with values: [-0.039104101332289254, 0.039539818290509995] and parameters: {'p_sma': 7, 'p_std': 43, 'p_atr': 16, 'p_adx': 7, 'rsi_period': 38, 'ema1': 10, 'ema2': 39, 'slip_atr_k': 0.24626953129650345, 'slip_spread_k': 0.6607810924430606, 'spread_hl_frac': 0.0007494648257056098, 'bb_std_mult': 1.4629882238262426, 'rsi_os': 34, 'rsi_ob': 66, 'vol_spike': 0.000547786435360513, 'adx_thresh': 27.00554028616905, 'atr_min_pct': 0.014711019381927594, 'atr_max_pct': 0.0643986471506856, 'tp_mult': 1.7528784882557726, 'tsl_mult': 0.6614569845323119, 'strategy': 'mean_reversion', 'time_stop': 299, 'use_sma': True, 'use_atr': True, 'use_adx': True, 'use_ema': True, 'use_spike': True, 'rsi_required': False, 'edge_k': 0.8526594848006648, 'edge_cap': 0.7193955652598467, 'bull_strategy': 'breakout', 'bull_bb_std_mult': 1.066052492248828, 'bull_rsi_os': 21, 'bull_rsi_ob': 47, 'bull_adx_thresh': 28.02460284270539, 'bull_atr_min_pct': 0.00036416564017987055, 'bull_atr_max_pct': 0.11425200978646818, 'bull_tp_mult': 1.0308572108955092, 'bull_tsl_mult': 0.26173358276410436, 'bull_time_stop': 128, 'bull_use_sma': False, 'bull_use_ema': False, 'bull_use_atr': False, 'bull_use_adx': False, 'bull_use_spike': False, 'bull_rsi_required': True, 'bear_strategy': 'breakout', 'bear_bb_std_mult': 2.48500563511339, 'bear_rsi_os': 15, 'bear_rsi_ob': 62, 'bear_adx_thresh': 15.033299779770793, 'bear_atr_min_pct': 0.0297165505531237, 'bear_atr_max_pct': 0.10668794914419781, 'bear_tp_mult': 1.7711859235771876, 'bear_tsl_mult': 0.030857699756180523, 'bear_time_stop': 126, 'bear_use_sma': False, 'bear_use_ema': False, 'bear_use_atr': False, 'bear_use_adx': True, 'bear_use_spike': True, 'bear_rsi_required': True, 'sideways_strategy': 'breakout', 'sideways_bb_std_mult': 3.5026360096474565, 'sideways_rsi_os': 37, 'sideways_rsi_ob': 48, 'sideways_adx_thresh': 24.156056952435247, 'sideways_atr_min_pct': 0.002083449351689729, 'sideways_atr_max_pct': 0.14287042586792006, 'sideways_tp_mult': 2.991133760987227, 'sideways_tsl_mult': 0.7817871542418929, 'sideways_time_stop': 206, 'sideways_use_sma': True, 'sideways_use_ema': False, 'sideways_use_atr': False, 'sideways_use_adx': True, 'sideways_use_spike': True, 'sideways_rsi_required': True}.
[I 2025-09-01 13:29:58,888] Trial 15 finished with values: [-0.0601894898393861, 0.060119839040201295] and parameters: {'p_sma': 5, 'p_std': 41, 'p_atr': 16, 'p_adx': 8, 'rsi_period': 8, 'ema1': 6, 'ema2': 41, 'slip_atr_k': 0.24702087422364316, 'slip_spread_k': 0.5225034640399167, 'spread_hl_frac': 0.002216799825228436, 'bb_std_mult': 1.2463440471627019, 'rsi_os': 29, 'rsi_ob': 69, 'vol_spike': 0.14984590116858817, 'adx_thresh': 34.93119980550256, 'atr_min_pct': 0.01174967329342582, 'atr_max_pct': 0.13962765294218007, 'tp_mult': 2.5246567421390034, 'tsl_mult': 0.9962753431410201, 'strategy': 'mean_reversion', 'time_stop': 298, 'use_sma': True, 'use_atr': True, 'use_adx': True, 'use_ema': True, 'use_spike': True, 'rsi_required': False, 'edge_k': 0.9610108300152554, 'edge_cap': 0.053951731662030045, 'bull_strategy': 'breakout', 'bull_bb_std_mult': 0.5649150060429655, 'bull_rsi_os': 45, 'bull_rsi_ob': 47, 'bull_adx_thresh': 5.768226537462809, 'bull_atr_min_pct': 0.0009068918447714507, 'bull_atr_max_pct': 0.1394181796781626, 'bull_tp_mult': 1.0559557049126194, 'bull_tsl_mult': 0.30463133371784845, 'bull_time_stop': 123, 'bull_use_sma': True, 'bull_use_ema': True, 'bull_use_atr': False, 'bull_use_adx': False, 'bull_use_spike': False, 'bull_rsi_required': False, 'bear_strategy': 'breakout', 'bear_bb_std_mult': 2.289928432501356, 'bear_rsi_os': 6, 'bear_rsi_ob': 62, 'bear_adx_thresh': 34.00380267248075, 'bear_atr_min_pct': 0.028845490590331348, 'bear_atr_max_pct': 0.04200539693145914, 'bear_tp_mult': 1.6553977584015778, 'bear_tsl_mult': 0.008871633319994021, 'bear_time_stop': 113, 'bear_use_sma': False, 'bear_use_ema': True, 'bear_use_atr': False, 'bear_use_adx': True, 'bear_use_spike': False, 'bear_rsi_required': True, 'sideways_strategy': 'breakout', 'sideways_bb_std_mult': 3.464409238584641, 'sideways_rsi_os': 50, 'sideways_rsi_ob': 81, 'sideways_adx_thresh': 5.378430680103969, 'sideways_atr_min_pct': 0.0005192799522765138, 'sideways_atr_max_pct': 0.14253487562901906, 'sideways_tp_mult': 2.996472934877364, 'sideways_tsl_mult': 0.01720209231657166, 'sideways_time_stop': 215, 'sideways_use_sma': True, 'sideways_use_ema': True, 'sideways_use_atr': True, 'sideways_use_adx': True, 'sideways_use_spike': True, 'sideways_rsi_required': True}.
[I 2025-09-01 13:29:59,502] Trial 17 finished with values: [-0.0030750687721027292, 0.00780131538585132] and parameters: {'p_sma': 5, 'p_std': 43, 'p_atr': 17, 'p_adx': 25, 'rsi_period': 24, 'ema1': 5, 'ema2': 40, 'slip_atr_k': 0.00012915153937377577, 'slip_spread_k': 0.525633610896881, 'spread_hl_frac': 0.0008293310214464514, 'bb_std_mult': 1.6188067087707525, 'rsi_os': 38, 'rsi_ob': 65, 'vol_spike': 0.18905789226666447, 'adx_thresh': 34.43394170233454, 'atr_min_pct': 0.011806544539992934, 'atr_max_pct': 0.0604757995059958, 'tp_mult': 1.730218835604442, 'tsl_mult': 0.053107579531394444, 'strategy': 'breakout', 'time_stop': 103, 'use_sma': True, 'use_atr': True, 'use_adx': False, 'use_ema': False, 'use_spike': True, 'rsi_required': False, 'edge_k': 0.8177497699261734, 'edge_cap': 0.28981966419941074, 'bull_strategy': 'breakout', 'bull_bb_std_mult': 1.1025382592918107, 'bull_rsi_os': 20, 'bull_rsi_ob': 45, 'bull_adx_thresh': 5.944982065257221, 'bull_atr_min_pct': 0.0007460778808172712, 'bull_atr_max_pct': 0.11971452445944464, 'bull_tp_mult': 1.0925352661779364, 'bull_tsl_mult': 0.9509999592546697, 'bull_time_stop': 125, 'bull_use_sma': False, 'bull_use_ema': True, 'bull_use_atr': False, 'bull_use_adx': True, 'bull_use_spike': False, 'bull_rsi_required': False, 'bear_strategy': 'breakout', 'bear_bb_std_mult': 2.559864314709545, 'bear_rsi_os': 6, 'bear_rsi_ob': 61, 'bear_adx_thresh': 14.821873704633653, 'bear_atr_min_pct': 0.0005659339190476953, 'bear_atr_max_pct': 0.044280669803107214, 'bear_tp_mult': 1.8186233502246005, 'bear_tsl_mult': 0.0005425051791040358, 'bear_time_stop': 124, 'bear_use_sma': False, 'bear_use_ema': True, 'bear_use_atr': False, 'bear_use_adx': True, 'bear_use_spike': False, 'bear_rsi_required': True, 'sideways_strategy': 'breakout', 'sideways_bb_std_mult': 0.5646571805173346, 'sideways_rsi_os': 39, 'sideways_rsi_ob': 83, 'sideways_adx_thresh': 24.387553832134802, 'sideways_atr_min_pct': 0.022276894866437434, 'sideways_atr_max_pct': 0.1494649930819382, 'sideways_tp_mult': 2.9857789514370214, 'sideways_tsl_mult': 0.02074849924890379, 'sideways_time_stop': 207, 'sideways_use_sma': True, 'sideways_use_ema': True, 'sideways_use_atr': True, 'sideways_use_adx': True, 'sideways_use_spike': False, 'sideways_rsi_required': False}.
