[I 2025-09-01 13:44:59,863] Trial 117 finished with values: [-1000000000.0, 1000000000.0] and parameters: {'p_sma': 41, 'p_std': 30, 'p_atr': 17, 'p_adx': 28, 'rsi_period': 30, 'ema1': 14, 'ema2': 40, 'slip_atr_k': 0.2277451163031288, 'slip_spread_k': 0.3787594148193152, 'spread_hl_frac': 0.01107569227700313, 'bb_std_mult': 2.108732630528966, 'rsi_os': 39, 'rsi_ob': 71, 'vol_spike': 0.09190759324627566, 'adx_thresh': 20.603057091689227, 'atr_min_pct': 0.028270098080782076, 'atr_max_pct': 0.01776145617730528, 'tp_mult': 1.7509625596660179, 'tsl_mult': 0.6874241379010635, 'strategy': 'breakout', 'time_stop': 194, 'use_sma': True, 'use_atr': True, 'use_adx': False, 'use_ema': False, 'use_spike': True, 'rsi_required': False, 'edge_k': 0.2068784664305725, 'edge_cap': 0.8653328704094462, 'bull_strategy': 'breakout', 'bull_bb_std_mult': 1.8835357990566637, 'bull_rsi_os': 30, 'bull_rsi_ob': 58, 'bull_adx_thresh': 29.855275714615367, 'bull_atr_min_pct': 0.023671714408992586, 'bull_atr_max_pct': 0.059226063654162886, 'bull_tp_mult': 1.9628126260701015, 'bull_tsl_mult': 0.5572841466425917, 'bull_time_stop': 124, 'bull_use_sma': False, 'bull_use_ema': True, 'bull_use_atr': False, 'bull_use_adx': True, 'bull_use_spike': True, 'bull_rsi_required': False, 'bear_strategy': 'breakout', 'bear_bb_std_mult': 2.4060508009707045, 'bear_rsi_os': 35, 'bear_rsi_ob': 59, 'bear_adx_thresh': 8.13187245022634, 'bear_atr_min_pct': 0.021669993996492408, 'bear_atr_max_pct': 0.014848346976138627, 'bear_tp_mult': 2.0375145645405244, 'bear_tsl_mult': 0.7486248283317591, 'bear_time_stop': 135, 'bear_use_sma': False, 'bear_use_ema': True, 'bear_use_atr': False, 'bear_use_adx': True, 'bear_use_spike': False, 'bear_rsi_required': True, 'sideways_strategy': 'mean_reversion', 'sideways_bb_std_mult': 3.136801747599158, 'sideways_rsi_os': 36, 'sideways_rsi_ob': 91, 'sideways_adx_thresh': 22.33243334540107, 'sideways_atr_min_pct': 0.026019191206532937, 'sideways_atr_max_pct': 0.11617720432211923, 'sideways_tp_mult': 2.6424472739930214, 'sideways_tsl_mult': 0.7638739442314824, 'sideways_time_stop': 140, 'sideways_use_sma': False, 'sideways_use_ema': True, 'sideways_use_atr': True, 'sideways_use_adx': False, 'sideways_use_spike': False, 'sideways_rsi_required': False}.
[I 2025-09-01 13:45:35,556] Trial 118 finished with values: [-1000000000.0, 1000000000.0] and parameters: {'p_sma': 46, 'p_std': 17, 'p_atr': 7, 'p_adx': 13, 'rsi_period': 67, 'ema1': 13, 'ema2': 54, 'slip_atr_k': 0.005387241506677274, 'slip_spread_k': 0.39354565710308137, 'spread_hl_frac': 0.021701851445442344, 'bb_std_mult': 2.111265495734347, 'rsi_os': 20, 'rsi_ob': 94, 'vol_spike': 0.1919052111842534, 'adx_thresh': 22.436295604471844, 'atr_min_pct': 0.0003070208129016018, 'atr_max_pct': 0.01801811288577665, 'tp_mult': 2.581597528950102, 'tsl_mult': 0.6661801061158196, 'strategy': 'breakout', 'time_stop': 102, 'use_sma': True, 'use_atr': True, 'use_adx': False, 'use_ema': False, 'use_spike': True, 'rsi_required': False, 'edge_k': 1.1886692192430348, 'edge_cap': 0.26925926278059015, 'bull_strategy': 'breakout', 'bull_bb_std_mult': 1.8485882863220793, 'bull_rsi_os': 18, 'bull_rsi_ob': 49, 'bull_adx_thresh': 32.24274511276893, 'bull_atr_min_pct': 0.01677853227034299, 'bull_atr_max_pct': 0.13734788111961604, 'bull_tp_mult': 1.4434505859510298, 'bull_tsl_mult': 0.5405879842104834, 'bull_time_stop': 69, 'bull_use_sma': False, 'bull_use_ema': True, 'bull_use_atr': False, 'bull_use_adx': True, 'bull_use_spike': True, 'bull_rsi_required': False, 'bear_strategy': 'breakout', 'bear_bb_std_mult': 1.85759990955902, 'bear_rsi_os': 35, 'bear_rsi_ob': 51, 'bear_adx_thresh': 9.432544265176238, 'bear_atr_min_pct': 0.028977281634259087, 'bear_atr_max_pct': 0.05955010180259918, 'bear_tp_mult': 1.7996180728107305, 'bear_tsl_mult': 0.93053788603866, 'bear_time_stop': 140, 'bear_use_sma': False, 'bear_use_ema': True, 'bear_use_atr': False, 'bear_use_adx': True, 'bear_use_spike': False, 'bear_rsi_required': True, 'sideways_strategy': 'breakout', 'sideways_bb_std_mult': 1.9737703304661955, 'sideways_rsi_os': 36, 'sideways_rsi_ob': 47, 'sideways_adx_thresh': 12.190531316599976, 'sideways_atr_min_pct': 0.01737612413609991, 'sideways_atr_max_pct': 0.11724470114577927, 'sideways_tp_mult': 2.6392679005214927, 'sideways_tsl_mult': 0.665615916844865, 'sideways_time_stop': 251, 'sideways_use_sma': False, 'sideways_use_ema': True, 'sideways_use_atr': True, 'sideways_use_adx': True, 'sideways_use_spike': False, 'sideways_rsi_required': False}.
[I 2025-09-01 13:45:35,956] Trial 121 finished with values: [-1000000000.0, 1000000000.0] and parameters: {'p_sma': 45, 'p_std': 27, 'p_atr': 7, 'p_adx': 10, 'rsi_period': 14, 'ema1': 20, 'ema2': 12, 'slip_atr_k': 0.0049231393926656465, 'slip_spread_k': 0.5541226038836572, 'spread_hl_frac': 0.012666594261001557, 'bb_std_mult': 3.066196356717306, 'rsi_os': 45, 'rsi_ob': 82, 'vol_spike': 0.1916243059592578, 'adx_thresh': 14.065140952192127, 'atr_min_pct': 0.007988793798312292, 'atr_max_pct': 0.012842005825624475, 'tp_mult': 1.9048275506005055, 'tsl_mult': 0.8451302818549085, 'strategy': 'breakout', 'time_stop': 102, 'use_sma': False, 'use_atr': True, 'use_adx': False, 'use_ema': False, 'use_spike': True, 'rsi_required': True, 'edge_k': 0.8316911093488153, 'edge_cap': 0.26402463694584744, 'bull_strategy': 'breakout', 'bull_bb_std_mult': 0.8637629260723596, 'bull_rsi_os': 19, 'bull_rsi_ob': 49, 'bull_adx_thresh': 32.05619377473623, 'bull_atr_min_pct': 0.00953736003128101, 'bull_atr_max_pct': 0.10573940152390596, 'bull_tp_mult': 1.5359746774510477, 'bull_tsl_mult': 0.6261740052635639, 'bull_time_stop': 84, 'bull_use_sma': False, 'bull_use_ema': True, 'bull_use_atr': False, 'bull_use_adx': True, 'bull_use_spike': False, 'bull_rsi_required': False, 'bear_strategy': 'breakout', 'bear_bb_std_mult': 2.5768502482352917, 'bear_rsi_os': 43, 'bear_rsi_ob': 50, 'bear_adx_thresh': 9.432007374552096, 'bear_atr_min_pct': 0.02785828351873678, 'bear_atr_max_pct': 0.08731572037833432, 'bear_tp_mult': 2.966580930021169, 'bear_tsl_mult': 0.5445917620794395, 'bear_time_stop': 59, 'bear_use_sma': False, 'bear_use_ema': True, 'bear_use_atr': True, 'bear_use_adx': True, 'bear_use_spike': False, 'bear_rsi_required': True, 'sideways_strategy': 'breakout', 'sideways_bb_std_mult': 1.9277697422715694, 'sideways_rsi_os': 7, 'sideways_rsi_ob': 86, 'sideways_adx_thresh': 8.294234663057859, 'sideways_atr_min_pct': 0.0174897593590303, 'sideways_atr_max_pct': 0.07805027630078805, 'sideways_tp_mult': 1.6040256605902163, 'sideways_tsl_mult': 0.8132576999622393, 'sideways_time_stop': 252, 'sideways_use_sma': False, 'sideways_use_ema': True, 'sideways_use_atr': True, 'sideways_use_adx': False, 'sideways_use_spike': False, 'sideways_rsi_required': False}.
[I 2025-09-01 13:45:36,136] Trial 120 finished with values: [-0.02461554901642249, 0.024697806543249354] and parameters: {'p_sma': 45, 'p_std': 47, 'p_atr': 7, 'p_adx': 25, 'rsi_period': 22, 'ema1': 10, 'ema2': 20, 'slip_atr_k': 0.22950024890089488, 'slip_spread_k': 0.3019623728978866, 'spread_hl_frac': 0.0037939382063344393, 'bb_std_mult': 2.116339577950498, 'rsi_os': 19, 'rsi_ob': 62, 'vol_spike': 0.031320764868441694, 'adx_thresh': 29.1240478038167, 'atr_min_pct': 0.008853875301876627, 'atr_max_pct': 0.018629463281243444, 'tp_mult': 1.4940013357691195, 'tsl_mult': 0.8648099100832738, 'strategy': 'breakout', 'time_stop': 192, 'use_sma': False, 'use_atr': True, 'use_adx': False, 'use_ema': False, 'use_spike': True, 'rsi_required': True, 'edge_k': 1.2197074810301798, 'edge_cap': 0.8093766498908279, 'bull_strategy': 'breakout', 'bull_bb_std_mult': 1.8568352092438103, 'bull_rsi_os': 19, 'bull_rsi_ob': 49, 'bull_adx_thresh': 29.74527508607627, 'bull_atr_min_pct': 0.0016809573062770405, 'bull_atr_max_pct': 0.10594631922421927, 'bull_tp_mult': 1.9394316660044097, 'bull_tsl_mult': 0.5525416858668355, 'bull_time_stop': 77, 'bull_use_sma': False, 'bull_use_ema': True, 'bull_use_atr': False, 'bull_use_adx': True, 'bull_use_spike': False, 'bull_rsi_required': False, 'bear_strategy': 'breakout', 'bear_bb_std_mult': 1.2058004137028808, 'bear_rsi_os': 31, 'bear_rsi_ob': 70, 'bear_adx_thresh': 23.626981421390738, 'bear_atr_min_pct': 0.015590549246277561, 'bear_atr_max_pct': 0.05926882592669275, 'bear_tp_mult': 2.994318942119625, 'bear_tsl_mult': 0.7474298201895899, 'bear_time_stop': 129, 'bear_use_sma': False, 'bear_use_ema': True, 'bear_use_atr': False, 'bear_use_adx': True, 'bear_use_spike': False, 'bear_rsi_required': True, 'sideways_strategy': 'breakout', 'sideways_bb_std_mult': 2.1141142058639963, 'sideways_rsi_os': 48, 'sideways_rsi_ob': 86, 'sideways_adx_thresh': 11.732178377970946, 'sideways_atr_min_pct': 0.017331436905355976, 'sideways_atr_max_pct': 0.0413427321396946, 'sideways_tp_mult': 2.2180121591742594, 'sideways_tsl_mult': 0.8137744212095859, 'sideways_time_stop': 30, 'sideways_use_sma': False, 'sideways_use_ema': True, 'sideways_use_atr': True, 'sideways_use_adx': False, 'sideways_use_spike': False, 'sideways_rsi_required': False}.
[I 2025-09-01 13:45:36,294] Trial 119 finished with values: [-1000000000.0, 1000000000.0] and parameters: {'p_sma': 58, 'p_std': 17, 'p_atr': 7, 'p_adx': 13, 'rsi_period': 23, 'ema1': 14, 'ema2': 38, 'slip_atr_k': 0.16227847597725453, 'slip_spread_k': 0.5251623153655414, 'spread_hl_frac': 0.011137606185647617, 'bb_std_mult': 0.6338850211607512, 'rsi_os': 45, 'rsi_ob': 89, 'vol_spike': 0.09362682466898978, 'adx_thresh': 23.607028110163935, 'atr_min_pct': 0.007781852207689465, 'atr_max_pct': 0.017489795207950545, 'tp_mult': 1.8930626321251027, 'tsl_mult': 0.8436890183236878, 'strategy': 'breakout', 'time_stop': 191, 'use_sma': False, 'use_atr': True, 'use_adx': False, 'use_ema': False, 'use_spike': True, 'rsi_required': True, 'edge_k': 0.3279863049635141, 'edge_cap': 0.26698639935864144, 'bull_strategy': 'breakout', 'bull_bb_std_mult': 0.9066856381203574, 'bull_rsi_os': 19, 'bull_rsi_ob': 56, 'bull_adx_thresh': 29.57106946497746, 'bull_atr_min_pct': 0.016794619121301254, 'bull_atr_max_pct': 0.05803907494562198, 'bull_tp_mult': 1.5199266656064132, 'bull_tsl_mult': 0.5549704145939246, 'bull_time_stop': 79, 'bull_use_sma': False, 'bull_use_ema': True, 'bull_use_atr': False, 'bull_use_adx': True, 'bull_use_spike': False, 'bull_rsi_required': False, 'bear_strategy': 'breakout', 'bear_bb_std_mult': 1.8779807239305273, 'bear_rsi_os': 31, 'bear_rsi_ob': 50, 'bear_adx_thresh': 9.516349137402944, 'bear_atr_min_pct': 0.028856391536489674, 'bear_atr_max_pct': 0.07379361451975247, 'bear_tp_mult': 2.0229760344550844, 'bear_tsl_mult': 0.7743773439409494, 'bear_time_stop': 128, 'bear_use_sma': False, 'bear_use_ema': True, 'bear_use_atr': False, 'bear_use_adx': True, 'bear_use_spike': False, 'bear_rsi_required': True, 'sideways_strategy': 'breakout', 'sideways_bb_std_mult': 1.6221866217291088, 'sideways_rsi_os': 36, 'sideways_rsi_ob': 47, 'sideways_adx_thresh': 8.627443301099648, 'sideways_atr_min_pct': 0.015839484761321538, 'sideways_atr_max_pct': 0.07729787342755313, 'sideways_tp_mult': 1.6037411906072319, 'sideways_tsl_mult': 0.8098292458839187, 'sideways_time_stop': 214, 'sideways_use_sma': False, 'sideways_use_ema': True, 'sideways_use_atr': True, 'sideways_use_adx': False, 'sideways_use_spike': False, 'sideways_rsi_required': False}.
[I 2025-09-01 13:46:15,452] Trial 122 finished with values: [-1000000000.0, 1000000000.0] and parameters: {'p_sma': 11, 'p_std': 21, 'p_atr': 8, 'p_adx': 23, 'rsi_period': 7, 'ema1': 8, 'ema2': 12, 'slip_atr_k': 0.11513334045384993, 'slip_spread_k': 0.3098527307645139, 'spread_hl_frac': 0.003942262421749503, 'bb_std_mult': 3.0603143466473597, 'rsi_os': 45, 'rsi_ob': 58, 'vol_spike': 0.23101786649690703, 'adx_thresh': 29.097684262557177, 'atr_min_pct': 0.02293820881727783, 'atr_max_pct': 0.027354079797841917, 'tp_mult': 1.4053567297423886, 'tsl_mult': 0.15060150909963194, 'strategy': 'breakout', 'time_stop': 259, 'use_sma': False, 'use_atr': False, 'use_adx': False, 'use_ema': False, 'use_spike': True, 'rsi_required': True, 'edge_k': 0.325970990411789, 'edge_cap': 0.8171436192154364, 'bull_strategy': 'breakout', 'bull_bb_std_mult': 3.236976026481282, 'bull_rsi_os': 44, 'bull_rsi_ob': 56, 'bull_adx_thresh': 14.551823202480671, 'bull_atr_min_pct': 0.009425376476757053, 'bull_atr_max_pct': 0.106419661577202, 'bull_tp_mult': 2.242660847107926, 'bull_tsl_mult': 0.6280802065283599, 'bull_time_stop': 85, 'bull_use_sma': False, 'bull_use_ema': True, 'bull_use_atr': False, 'bull_use_adx': True, 'bull_use_spike': False, 'bull_rsi_required': False, 'bear_strategy': 'breakout', 'bear_bb_std_mult': 1.263126372456528, 'bear_rsi_os': 11, 'bear_rsi_ob': 50, 'bear_adx_thresh': 19.43921660214506, 'bear_atr_min_pct': 0.011980231499409133, 'bear_atr_max_pct': 0.0448094556650703, 'bear_tp_mult': 2.994500621278986, 'bear_tsl_mult': 0.9944967228211816, 'bear_time_stop': 46, 'bear_use_sma': False, 'bear_use_ema': True, 'bear_use_atr': True, 'bear_use_adx': True, 'bear_use_spike': False, 'bear_rsi_required': True, 'sideways_strategy': 'breakout', 'sideways_bb_std_mult': 0.8741295819937135, 'sideways_rsi_os': 39, 'sideways_rsi_ob': 86, 'sideways_adx_thresh': 26.152292873035496, 'sideways_atr_min_pct': 0.012967788448826102, 'sideways_atr_max_pct': 0.03335609375484119, 'sideways_tp_mult': 1.610189253212115, 'sideways_tsl_mult': 0.8231805093532535, 'sideways_time_stop': 16, 'sideways_use_sma': False, 'sideways_use_ema': True, 'sideways_use_atr': True, 'sideways_use_adx': False, 'sideways_use_spike': False, 'sideways_rsi_required': False}.
[I 2025-09-01 13:46:16,233] Trial 125 finished with values: [-0.01791877895445526, 0.01768357534741642] and parameters: {'p_sma': 11, 'p_std': 47, 'p_atr': 8, 'p_adx': 23, 'rsi_period': 38, 'ema1': 10, 'ema2': 19, 'slip_atr_k': 0.24406965418616783, 'slip_spread_k': 0.23783011541564236, 'spread_hl_frac': 0.0456574757602535, 'bb_std_mult': 3.3605890303817167, 'rsi_os': 41, 'rsi_ob': 58, 'vol_spike': 0.2661711296408014, 'adx_thresh': 9.807233926452792, 'atr_min_pct': 0.026480698993022907, 'atr_max_pct': 0.08677423224119353, 'tp_mult': 1.5231090230735247, 'tsl_mult': 0.39803986066709973, 'strategy': 'breakout', 'time_stop': 65, 'use_sma': True, 'use_atr': False, 'use_adx': False, 'use_ema': False, 'use_spike': True, 'rsi_required': False, 'edge_k': 1.2173084778327694, 'edge_cap': 0.6615863782732238, 'bull_strategy': 'breakout', 'bull_bb_std_mult': 1.6441837840635145, 'bull_rsi_os': 44, 'bull_rsi_ob': 53, 'bull_adx_thresh': 10.26484492064241, 'bull_atr_min_pct': 0.001540525611619643, 'bull_atr_max_pct': 0.06400146622709352, 'bull_tp_mult': 1.2649909023628683, 'bull_tsl_mult': 0.923059201283982, 'bull_time_stop': 284, 'bull_use_sma': False, 'bull_use_ema': True, 'bull_use_atr': False, 'bull_use_adx': True, 'bull_use_spike': False, 'bull_rsi_required': True, 'bear_strategy': 'breakout', 'bear_bb_std_mult': 2.0778536212051195, 'bear_rsi_os': 11, 'bear_rsi_ob': 54, 'bear_adx_thresh': 18.765635695722988, 'bear_atr_min_pct': 0.01703572631952435, 'bear_atr_max_pct': 0.09498184741718901, 'bear_tp_mult': 2.1815327574196783, 'bear_tsl_mult': 0.17715376932891877, 'bear_time_stop': 49, 'bear_use_sma': False, 'bear_use_ema': True, 'bear_use_atr': False, 'bear_use_adx': True, 'bear_use_spike': False, 'bear_rsi_required': True, 'sideways_strategy': 'breakout', 'sideways_bb_std_mult': 2.2465424863580523, 'sideways_rsi_os': 39, 'sideways_rsi_ob': 86, 'sideways_adx_thresh': 25.986122684129214, 'sideways_atr_min_pct': 0.011101369164703024, 'sideways_atr_max_pct': 0.13192367530676502, 'sideways_tp_mult': 2.5191460397294443, 'sideways_tsl_mult': 0.8430585817888402, 'sideways_time_stop': 236, 'sideways_use_sma': False, 'sideways_use_ema': True, 'sideways_use_atr': True, 'sideways_use_adx': False, 'sideways_use_spike': False, 'sideways_rsi_required': False}.
[I 2025-09-01 13:46:16,497] Trial 124 finished with values: [-0.022802346135352147, 0.023317345174940208] and parameters: {'p_sma': 11, 'p_std': 21, 'p_atr': 8, 'p_adx': 27, 'rsi_period': 41, 'ema1': 8, 'ema2': 20, 'slip_atr_k': 0.093039252686603, 'slip_spread_k': 0.5202281753100847, 'spread_hl_frac': 0.02420779874631037, 'bb_std_mult': 3.358354796632483, 'rsi_os': 41, 'rsi_ob': 58, 'vol_spike': 0.23456345440452475, 'adx_thresh': 23.901115480094226, 'atr_min_pct': 0.025833223008677336, 'atr_max_pct': 0.027712735194253768, 'tp_mult': 1.472761995117548, 'tsl_mult': 0.9269715630759107, 'strategy': 'breakout', 'time_stop': 73, 'use_sma': True, 'use_atr': False, 'use_adx': False, 'use_ema': False, 'use_spike': True, 'rsi_required': False, 'edge_k': 1.2776085804478121, 'edge_cap': 0.07662218555126815, 'bull_strategy': 'breakout', 'bull_bb_std_mult': 3.2580661546962277, 'bull_rsi_os': 44, 'bull_rsi_ob': 56, 'bull_adx_thresh': 10.435042127628321, 'bull_atr_min_pct': 0.001755861427777958, 'bull_atr_max_pct': 0.11945594946377093, 'bull_tp_mult': 1.4016915238321788, 'bull_tsl_mult': 0.6473625826994804, 'bull_time_stop': 76, 'bull_use_sma': False, 'bull_use_ema': True, 'bull_use_atr': False, 'bull_use_adx': True, 'bull_use_spike': False, 'bull_rsi_required': True, 'bear_strategy': 'breakout', 'bear_bb_std_mult': 2.636571950099126, 'bear_rsi_os': 11, 'bear_rsi_ob': 56, 'bear_adx_thresh': 5.062309715473349, 'bear_atr_min_pct': 0.016443201944562273, 'bear_atr_max_pct': 0.0735147072983341, 'bear_tp_mult': 2.842486079009307, 'bear_tsl_mult': 0.17036772791963234, 'bear_time_stop': 44, 'bear_use_sma': False, 'bear_use_ema': True, 'bear_use_atr': False, 'bear_use_adx': True, 'bear_use_spike': False, 'bear_rsi_required': True, 'sideways_strategy': 'breakout', 'sideways_bb_std_mult': 2.11490325464359, 'sideways_rsi_os': 39, 'sideways_rsi_ob': 86, 'sideways_adx_thresh': 30.998558828791097, 'sideways_atr_min_pct': 0.01317701007450076, 'sideways_atr_max_pct': 0.13122854634626147, 'sideways_tp_mult': 2.456426371893915, 'sideways_tsl_mult': 0.8435763638961619, 'sideways_time_stop': 15, 'sideways_use_sma': False, 'sideways_use_ema': True, 'sideways_use_atr': True, 'sideways_use_adx': False, 'sideways_use_spike': False, 'sideways_rsi_required': False}.
[I 2025-09-01 13:46:16,711] Trial 123 finished with values: [-1000000000.0, 1000000000.0] and parameters: {'p_sma': 60, 'p_std': 47, 'p_atr': 8, 'p_adx': 23, 'rsi_period': 7, 'ema1': 10, 'ema2': 19, 'slip_atr_k': 0.12104768548031881, 'slip_spread_k': 0.24763005000316485, 'spread_hl_frac': 0.0038977723657410415, 'bb_std_mult': 1.7537050450655338, 'rsi_os': 41, 'rsi_ob': 74, 'vol_spike': 0.07152620164765536, 'adx_thresh': 28.911302472702808, 'atr_min_pct': 0.01663913547089821, 'atr_max_pct': 0.08882988780699805, 'tp_mult': 2.2842363750253667, 'tsl_mult': 0.5174334856704609, 'strategy': 'breakout', 'time_stop': 68, 'use_sma': True, 'use_atr': False, 'use_adx': False, 'use_ema': False, 'use_spike': True, 'rsi_required': True, 'edge_k': 1.4070183942421224, 'edge_cap': 0.05211398727304173, 'bull_strategy': 'breakout', 'bull_bb_std_mult': 1.6194363726446923, 'bull_rsi_os': 19, 'bull_rsi_ob': 53, 'bull_adx_thresh': 10.268491065406508, 'bull_atr_min_pct': 0.005782352239764107, 'bull_atr_max_pct': 0.08073274651629297, 'bull_tp_mult': 2.436576388251895, 'bull_tsl_mult': 0.46056990669692494, 'bull_time_stop': 77, 'bull_use_sma': False, 'bull_use_ema': True, 'bull_use_atr': False, 'bull_use_adx': True, 'bull_use_spike': False, 'bull_rsi_required': True, 'bear_strategy': 'breakout', 'bear_bb_std_mult': 1.2192257554674732, 'bear_rsi_os': 32, 'bear_rsi_ob': 91, 'bear_adx_thresh': 19.591171500675998, 'bear_atr_min_pct': 0.012242626547255268, 'bear_atr_max_pct': 0.09244715208366779, 'bear_tp_mult': 1.8841989809622712, 'bear_tsl_mult': 0.9917785744715681, 'bear_time_stop': 86, 'bear_use_sma': False, 'bear_use_ema': True, 'bear_use_atr': False, 'bear_use_adx': True, 'bear_use_spike': False, 'bear_rsi_required': True, 'sideways_strategy': 'breakout', 'sideways_bb_std_mult': 0.8795317328951443, 'sideways_rsi_os': 48, 'sideways_rsi_ob': 62, 'sideways_adx_thresh': 15.685834913660116, 'sideways_atr_min_pct': 0.012787451776664379, 'sideways_atr_max_pct': 0.13162431518107096, 'sideways_tp_mult': 2.514186419100123, 'sideways_tsl_mult': 0.8465328454515452, 'sideways_time_stop': 240, 'sideways_use_sma': False, 'sideways_use_ema': True, 'sideways_use_atr': True, 'sideways_use_adx': False, 'sideways_use_spike': False, 'sideways_rsi_required': False}.
