[I 2025-09-01 15:08:38,764] Trial 682 finished with values: [-1000000000.0, 1000000000.0] and parameters: {'p_sma': 20, 'p_std': 30, 'p_atr': 24, 'p_adx': 9, 'rsi_period': 33, 'ema1': 10, 'ema2': 15, 'slip_atr_k': 0.14706450272773047, 'slip_spread_k': 0.737444506768371, 'spread_hl_frac': 0.009360152939553687, 'bb_std_mult': 3.567917154682024, 'rsi_os': 43, 'rsi_ob': 56, 'vol_spike': 0.12185262194819156, 'adx_thresh': 25.20995069326555, 'atr_min_pct': 0.011447427073057213, 'atr_max_pct': 0.11184647846555774, 'tp_mult': 2.1536939373012456, 'tsl_mult': 0.686080669925275, 'strategy': 'mean_reversion', 'time_stop': 251, 'use_sma': True, 'use_atr': True, 'use_adx': True, 'use_ema': True, 'use_spike': False, 'rsi_required': True, 'edge_k': 0.19990360806323476, 'edge_cap': 0.8848739887761462, 'bull_strategy': 'breakout', 'bull_bb_std_mult': 3.109717590264624, 'bull_rsi_os': 13, 'bull_rsi_ob': 82, 'bull_adx_thresh': 11.501686196326325, 'bull_atr_min_pct': 0.010108297127882741, 'bull_atr_max_pct': 0.12421102697620709, 'bull_tp_mult': 1.638580921759611, 'bull_tsl_mult': 0.8490584967455832, 'bull_time_stop': 296, 'bull_use_sma': False, 'bull_use_ema': False, 'bull_use_atr': False, 'bull_use_adx': True, 'bull_use_spike': True, 'bull_rsi_required': True, 'bear_strategy': 'mean_reversion', 'bear_bb_std_mult': 3.4744872605125456, 'bear_rsi_os': 35, 'bear_rsi_ob': 57, 'bear_adx_thresh': 23.924335221566356, 'bear_atr_min_pct': 0.012120460420750653, 'bear_atr_max_pct': 0.04357444924036723, 'bear_tp_mult': 2.1544233176924776, 'bear_tsl_mult': 0.9350979212725254, 'bear_time_stop': 251, 'bear_use_sma': True, 'bear_use_ema': False, 'bear_use_atr': False, 'bear_use_adx': True, 'bear_use_spike': True, 'bear_rsi_required': True, 'sideways_strategy': 'breakout', 'sideways_bb_std_mult': 3.5039186714084183, 'sideways_rsi_os': 17, 'sideways_rsi_ob': 93, 'sideways_adx_thresh': 34.03890623068882, 'sideways_atr_min_pct': 0.005464446607157938, 'sideways_atr_max_pct': 0.06860006645570252, 'sideways_tp_mult': 2.3274757383449227, 'sideways_tsl_mult': 0.3359510768811602, 'sideways_time_stop': 149, 'sideways_use_sma': False, 'sideways_use_ema': True, 'sideways_use_atr': True, 'sideways_use_adx': True, 'sideways_use_spike': False, 'sideways_rsi_required': False}.
[I 2025-09-01 15:08:39,273] Trial 684 finished with values: [-1000000000.0, 1000000000.0] and parameters: {'p_sma': 31, 'p_std': 18, 'p_atr': 25, 'p_adx': 8, 'rsi_period': 81, 'ema1': 10, 'ema2': 34, 'slip_atr_k': 0.013850602207923224, 'slip_spread_k': 0.7768774700355152, 'spread_hl_frac': 0.04326741527861436, 'bb_std_mult': 3.549507011083224, 'rsi_os': 43, 'rsi_ob': 65, 'vol_spike': 0.10250909551200342, 'adx_thresh': 25.3848314678189, 'atr_min_pct': 0.011503467909794063, 'atr_max_pct': 0.056096752660587126, 'tp_mult': 1.3648169583779348, 'tsl_mult': 0.6905303281633203, 'strategy': 'breakout', 'time_stop': 118, 'use_sma': False, 'use_atr': False, 'use_adx': True, 'use_ema': False, 'use_spike': True, 'rsi_required': True, 'edge_k': 1.6070887936359473, 'edge_cap': 0.9662085688287002, 'bull_strategy': 'breakout', 'bull_bb_std_mult': 1.8913938529280871, 'bull_rsi_os': 11, 'bull_rsi_ob': 76, 'bull_adx_thresh': 11.404429610481033, 'bull_atr_min_pct': 0.010981230831688652, 'bull_atr_max_pct': 0.015397245603487557, 'bull_tp_mult': 1.6405734699187917, 'bull_tsl_mult': 0.10330227839817469, 'bull_time_stop': 158, 'bull_use_sma': False, 'bull_use_ema': True, 'bull_use_atr': True, 'bull_use_adx': True, 'bull_use_spike': True, 'bull_rsi_required': True, 'bear_strategy': 'breakout', 'bear_bb_std_mult': 2.954715710192277, 'bear_rsi_os': 38, 'bear_rsi_ob': 88, 'bear_adx_thresh': 7.539091544529825, 'bear_atr_min_pct': 0.0019691844757299707, 'bear_atr_max_pct': 0.055121018426716156, 'bear_tp_mult': 2.1421940832844197, 'bear_tsl_mult': 0.15268116501474374, 'bear_time_stop': 96, 'bear_use_sma': True, 'bear_use_ema': False, 'bear_use_atr': True, 'bear_use_adx': False, 'bear_use_spike': True, 'bear_rsi_required': False, 'sideways_strategy': 'mean_reversion', 'sideways_bb_std_mult': 3.0502402022975152, 'sideways_rsi_os': 54, 'sideways_rsi_ob': 89, 'sideways_adx_thresh': 24.48715928925598, 'sideways_atr_min_pct': 0.00552525302515737, 'sideways_atr_max_pct': 0.09997113400430419, 'sideways_tp_mult': 1.4566373873314176, 'sideways_tsl_mult': 0.19848857541034243, 'sideways_time_stop': 291, 'sideways_use_sma': True, 'sideways_use_ema': True, 'sideways_use_atr': True, 'sideways_use_adx': True, 'sideways_use_spike': False, 'sideways_rsi_required': False}.
[I 2025-09-01 15:09:27,749] Trial 689 finished with values: [-1000000000.0, 1000000000.0] and parameters: {'p_sma': 29, 'p_std': 40, 'p_atr': 27, 'p_adx': 8, 'rsi_period': 74, 'ema1': 8, 'ema2': 57, 'slip_atr_k': 0.01785505970915171, 'slip_spread_k': 0.5542262376648637, 'spread_hl_frac': 0.016751194556200194, 'bb_std_mult': 0.5619230796621406, 'rsi_os': 41, 'rsi_ob': 82, 'vol_spike': 0.21085251630259444, 'adx_thresh': 9.206730606485916, 'atr_min_pct': 0.024187348940448973, 'atr_max_pct': 0.038441099159611525, 'tp_mult': 1.4246513049734542, 'tsl_mult': 0.6733958234399752, 'strategy': 'mean_reversion', 'time_stop': 110, 'use_sma': True, 'use_atr': False, 'use_adx': True, 'use_ema': True, 'use_spike': True, 'rsi_required': True, 'edge_k': 0.1738926573238268, 'edge_cap': 0.9442280954157112, 'bull_strategy': 'mean_reversion', 'bull_bb_std_mult': 2.0517392751695844, 'bull_rsi_os': 38, 'bull_rsi_ob': 78, 'bull_adx_thresh': 12.997457408151469, 'bull_atr_min_pct': 0.01776059238119508, 'bull_atr_max_pct': 0.13721238903317928, 'bull_tp_mult': 1.5173076137864563, 'bull_tsl_mult': 0.4578347860542788, 'bull_time_stop': 153, 'bull_use_sma': True, 'bull_use_ema': True, 'bull_use_atr': True, 'bull_use_adx': False, 'bull_use_spike': True, 'bull_rsi_required': False, 'bear_strategy': 'mean_reversion', 'bear_bb_std_mult': 3.332063791442737, 'bear_rsi_os': 35, 'bear_rsi_ob': 81, 'bear_adx_thresh': 20.691007576746458, 'bear_atr_min_pct': 0.005034923628930122, 'bear_atr_max_pct': 0.11586745291407317, 'bear_tp_mult': 1.147656020979489, 'bear_tsl_mult': 0.1108637984212429, 'bear_time_stop': 84, 'bear_use_sma': False, 'bear_use_ema': False, 'bear_use_atr': False, 'bear_use_adx': False, 'bear_use_spike': False, 'bear_rsi_required': False, 'sideways_strategy': 'mean_reversion', 'sideways_bb_std_mult': 0.6109030022706816, 'sideways_rsi_os': 34, 'sideways_rsi_ob': 45, 'sideways_adx_thresh': 26.848210095892945, 'sideways_atr_min_pct': 0.002815883771130217, 'sideways_atr_max_pct': 0.0886173983267116, 'sideways_tp_mult': 2.4598717174890643, 'sideways_tsl_mult': 0.36502607335209525, 'sideways_time_stop': 219, 'sideways_use_sma': True, 'sideways_use_ema': False, 'sideways_use_atr': True, 'sideways_use_adx': False, 'sideways_use_spike': False, 'sideways_rsi_required': True}.
[I 2025-09-01 15:09:28,705] Trial 688 finished with values: [-1000000000.0, 1000000000.0] and parameters: {'p_sma': 29, 'p_std': 10, 'p_atr': 30, 'p_adx': 8, 'rsi_period': 74, 'ema1': 24, 'ema2': 57, 'slip_atr_k': 0.013334896632629635, 'slip_spread_k': 0.555973256205021, 'spread_hl_frac': 0.043266854438527805, 'bb_std_mult': 3.300611039313475, 'rsi_os': 45, 'rsi_ob': 53, 'vol_spike': 0.13129155171959442, 'adx_thresh': 5.553500617065812, 'atr_min_pct': 0.015773866704193097, 'atr_max_pct': 0.039464381201920806, 'tp_mult': 1.4243827387598247, 'tsl_mult': 0.5113143038299888, 'strategy': 'mean_reversion', 'time_stop': 209, 'use_sma': False, 'use_atr': False, 'use_adx': True, 'use_ema': False, 'use_spike': True, 'rsi_required': True, 'edge_k': 1.92112689780947, 'edge_cap': 0.9655018731836921, 'bull_strategy': 'breakout', 'bull_bb_std_mult': 1.869961437241181, 'bull_rsi_os': 44, 'bull_rsi_ob': 76, 'bull_adx_thresh': 10.260462439303868, 'bull_atr_min_pct': 0.011011499175458742, 'bull_atr_max_pct': 0.0463189024788583, 'bull_tp_mult': 1.720033115561642, 'bull_tsl_mult': 0.4516113636163412, 'bull_time_stop': 155, 'bull_use_sma': False, 'bull_use_ema': True, 'bull_use_atr': True, 'bull_use_adx': True, 'bull_use_spike': True, 'bull_rsi_required': False, 'bear_strategy': 'mean_reversion', 'bear_bb_std_mult': 3.3465808994285147, 'bear_rsi_os': 5, 'bear_rsi_ob': 56, 'bear_adx_thresh': 6.560537093525674, 'bear_atr_min_pct': 0.002707984304231443, 'bear_atr_max_pct': 0.05483318162019038, 'bear_tp_mult': 2.10891540401599, 'bear_tsl_mult': 0.10854195390635435, 'bear_time_stop': 84, 'bear_use_sma': False, 'bear_use_ema': False, 'bear_use_atr': False, 'bear_use_adx': False, 'bear_use_spike': False, 'bear_rsi_required': False, 'sideways_strategy': 'mean_reversion', 'sideways_bb_std_mult': 1.6545611335614359, 'sideways_rsi_os': 21, 'sideways_rsi_ob': 90, 'sideways_adx_thresh': 26.972192279679202, 'sideways_atr_min_pct': 0.0026952047780334477, 'sideways_atr_max_pct': 0.0990266242779788, 'sideways_tp_mult': 2.4594181883174726, 'sideways_tsl_mult': 0.167499153176845, 'sideways_time_stop': 131, 'sideways_use_sma': True, 'sideways_use_ema': True, 'sideways_use_atr': True, 'sideways_use_adx': False, 'sideways_use_spike': False, 'sideways_rsi_required': False}.
[I 2025-09-01 15:09:29,314] Trial 687 finished with values: [-1000000000.0, 1000000000.0] and parameters: {'p_sma': 29, 'p_std': 40, 'p_atr': 25, 'p_adx': 9, 'rsi_period': 80, 'ema1': 10, 'ema2': 58, 'slip_atr_k': 0.13192702881955876, 'slip_spread_k': 0.015125268215569587, 'spread_hl_frac': 0.03251969739357317, 'bb_std_mult': 3.5959823885026516, 'rsi_os': 42, 'rsi_ob': 52, 'vol_spike': 0.25594992880610734, 'adx_thresh': 15.148786278360824, 'atr_min_pct': 0.011812514842171645, 'atr_max_pct': 0.05589459312066364, 'tp_mult': 1.4311880241214758, 'tsl_mult': 0.8122022627054152, 'strategy': 'mean_reversion', 'time_stop': 94, 'use_sma': False, 'use_atr': False, 'use_adx': True, 'use_ema': True, 'use_spike': True, 'rsi_required': True, 'edge_k': 0.16638188417628286, 'edge_cap': 0.1285417867474956, 'bull_strategy': 'breakout', 'bull_bb_std_mult': 2.3315649716432754, 'bull_rsi_os': 43, 'bull_rsi_ob': 77, 'bull_adx_thresh': 24.56353439694934, 'bull_atr_min_pct': 0.007076120413519151, 'bull_atr_max_pct': 0.13550487826746385, 'bull_tp_mult': 1.5045323787475773, 'bull_tsl_mult': 0.23965286892086324, 'bull_time_stop': 151, 'bull_use_sma': False, 'bull_use_ema': True, 'bull_use_atr': True, 'bull_use_adx': True, 'bull_use_spike': True, 'bull_rsi_required': True, 'bear_strategy': 'mean_reversion', 'bear_bb_std_mult': 2.0980008724078316, 'bear_rsi_os': 38, 'bear_rsi_ob': 56, 'bear_adx_thresh': 23.991215177706223, 'bear_atr_min_pct': 0.02904058581991873, 'bear_atr_max_pct': 0.09425078239745302, 'bear_tp_mult': 1.159303961323198, 'bear_tsl_mult': 0.6673101364723177, 'bear_time_stop': 85, 'bear_use_sma': False, 'bear_use_ema': False, 'bear_use_atr': False, 'bear_use_adx': False, 'bear_use_spike': False, 'bear_rsi_required': False, 'sideways_strategy': 'mean_reversion', 'sideways_bb_std_mult': 1.1090591703682091, 'sideways_rsi_os': 34, 'sideways_rsi_ob': 78, 'sideways_adx_thresh': 27.188197296658476, 'sideways_atr_min_pct': 0.028574474424496267, 'sideways_atr_max_pct': 0.10042869545012015, 'sideways_tp_mult': 2.3757004142678477, 'sideways_tsl_mult': 0.9228116696643143, 'sideways_time_stop': 220, 'sideways_use_sma': True, 'sideways_use_ema': True, 'sideways_use_atr': True, 'sideways_use_adx': False, 'sideways_use_spike': False, 'sideways_rsi_required': False}.
[I 2025-09-01 15:09:29,619] Trial 686 finished with values: [-1000000000.0, 1000000000.0] and parameters: {'p_sma': 57, 'p_std': 30, 'p_atr': 30, 'p_adx': 15, 'rsi_period': 81, 'ema1': 15, 'ema2': 58, 'slip_atr_k': 0.013872136691284247, 'slip_spread_k': 0.7849772833437595, 'spread_hl_frac': 0.023191807136288017, 'bb_std_mult': 2.167144723507312, 'rsi_os': 42, 'rsi_ob': 59, 'vol_spike': 0.0935417050154202, 'adx_thresh': 9.38272377174819, 'atr_min_pct': 0.02423499699178866, 'atr_max_pct': 0.11163769340703841, 'tp_mult': 1.355469629897225, 'tsl_mult': 0.8198068631892967, 'strategy': 'mean_reversion', 'time_stop': 54, 'use_sma': True, 'use_atr': True, 'use_adx': True, 'use_ema': True, 'use_spike': True, 'rsi_required': True, 'edge_k': 0.16296131165592342, 'edge_cap': 0.9478787025755879, 'bull_strategy': 'breakout', 'bull_bb_std_mult': 3.102039692402666, 'bull_rsi_os': 43, 'bull_rsi_ob': 76, 'bull_adx_thresh': 26.434386584733343, 'bull_atr_min_pct': 0.010838663967529421, 'bull_atr_max_pct': 0.13751112061336263, 'bull_tp_mult': 1.5616990888814524, 'bull_tsl_mult': 0.5819801950149732, 'bull_time_stop': 157, 'bull_use_sma': False, 'bull_use_ema': True, 'bull_use_atr': True, 'bull_use_adx': True, 'bull_use_spike': True, 'bull_rsi_required': True, 'bear_strategy': 'mean_reversion', 'bear_bb_std_mult': 3.496241020393489, 'bear_rsi_os': 20, 'bear_rsi_ob': 71, 'bear_adx_thresh': 30.311481127804434, 'bear_atr_min_pct': 0.015127198268254679, 'bear_atr_max_pct': 0.11578773245385451, 'bear_tp_mult': 2.110035395546987, 'bear_tsl_mult': 0.10773885118892733, 'bear_time_stop': 82, 'bear_use_sma': True, 'bear_use_ema': False, 'bear_use_atr': False, 'bear_use_adx': False, 'bear_use_spike': False, 'bear_rsi_required': False, 'sideways_strategy': 'mean_reversion', 'sideways_bb_std_mult': 2.63168556981074, 'sideways_rsi_os': 17, 'sideways_rsi_ob': 91, 'sideways_adx_thresh': 27.015369252917, 'sideways_atr_min_pct': 0.005514958433295968, 'sideways_atr_max_pct': 0.10662040434442717, 'sideways_tp_mult': 2.447793967104323, 'sideways_tsl_mult': 0.35943450035162655, 'sideways_time_stop': 102, 'sideways_use_sma': True, 'sideways_use_ema': True, 'sideways_use_atr': True, 'sideways_use_adx': True, 'sideways_use_spike': False, 'sideways_rsi_required': False}.
[I 2025-09-01 15:09:30,827] Trial 692 finished with values: [-1000000000.0, 1000000000.0] and parameters: {'p_sma': 27, 'p_std': 27, 'p_atr': 26, 'p_adx': 7, 'rsi_period': 50, 'ema1': 16, 'ema2': 56, 'slip_atr_k': 0.009839780239163681, 'slip_spread_k': 0.6283071871130516, 'spread_hl_frac': 0.008103522402191346, 'bb_std_mult': 3.401724820722547, 'rsi_os': 47, 'rsi_ob': 49, 'vol_spike': 0.10909933911844677, 'adx_thresh': 24.179602287816753, 'atr_min_pct': 0.019504636114409245, 'atr_max_pct': 0.1463508748832008, 'tp_mult': 2.288241929013889, 'tsl_mult': 0.4060881140751908, 'strategy': 'mean_reversion', 'time_stop': 103, 'use_sma': True, 'use_atr': False, 'use_adx': True, 'use_ema': True, 'use_spike': True, 'rsi_required': False, 'edge_k': 0.26942227908397354, 'edge_cap': 0.847523844029982, 'bull_strategy': 'mean_reversion', 'bull_bb_std_mult': 3.172598246085326, 'bull_rsi_os': 46, 'bull_rsi_ob': 80, 'bull_adx_thresh': 8.804505282621582, 'bull_atr_min_pct': 0.0017459693193884046, 'bull_atr_max_pct': 0.12900534988664178, 'bull_tp_mult': 1.592060015357246, 'bull_tsl_mult': 0.5042477073432767, 'bull_time_stop': 107, 'bull_use_sma': True, 'bull_use_ema': True, 'bull_use_atr': True, 'bull_use_adx': False, 'bull_use_spike': True, 'bull_rsi_required': True, 'bear_strategy': 'mean_reversion', 'bear_bb_std_mult': 2.7089957056143064, 'bear_rsi_os': 27, 'bear_rsi_ob': 59, 'bear_adx_thresh': 8.82897920454869, 'bear_atr_min_pct': 0.026762777924602216, 'bear_atr_max_pct': 0.11191835590498272, 'bear_tp_mult': 2.366512288703769, 'bear_tsl_mult': 0.42086901239331254, 'bear_time_stop': 201, 'bear_use_sma': False, 'bear_use_ema': True, 'bear_use_atr': False, 'bear_use_adx': False, 'bear_use_spike': True, 'bear_rsi_required': False, 'sideways_strategy': 'mean_reversion', 'sideways_bb_std_mult': 3.176823793828338, 'sideways_rsi_os': 26, 'sideways_rsi_ob': 86, 'sideways_adx_thresh': 26.026494082889766, 'sideways_atr_min_pct': 0.0038682391261625603, 'sideways_atr_max_pct': 0.11166249034254846, 'sideways_tp_mult': 1.8000671526795364, 'sideways_tsl_mult': 0.029418525840995136, 'sideways_time_stop': 267, 'sideways_use_sma': True, 'sideways_use_ema': False, 'sideways_use_atr': False, 'sideways_use_adx': True, 'sideways_use_spike': False, 'sideways_rsi_required': True}.
[I 2025-09-01 15:10:17,850] Trial 690 finished with values: [-1000000000.0, 1000000000.0] and parameters: {'p_sma': 27, 'p_std': 24, 'p_atr': 26, 'p_adx': 9, 'rsi_period': 53, 'ema1': 16, 'ema2': 58, 'slip_atr_k': 0.009850701831994962, 'slip_spread_k': 0.26561523932517717, 'spread_hl_frac': 0.023224996265599106, 'bb_std_mult': 2.1742675677429313, 'rsi_os': 23, 'rsi_ob': 52, 'vol_spike': 0.09003370483205568, 'adx_thresh': 5.554367727567412, 'atr_min_pct': 0.010783208669082748, 'atr_max_pct': 0.024642658852011196, 'tp_mult': 1.6217617106013904, 'tsl_mult': 0.5287410848024271, 'strategy': 'mean_reversion', 'time_stop': 97, 'use_sma': True, 'use_atr': False, 'use_adx': True, 'use_ema': True, 'use_spike': True, 'rsi_required': True, 'edge_k': 0.27631891576876394, 'edge_cap': 0.9997716236332201, 'bull_strategy': 'breakout', 'bull_bb_std_mult': 2.9654355187125745, 'bull_rsi_os': 43, 'bull_rsi_ob': 77, 'bull_adx_thresh': 8.915672373725386, 'bull_atr_min_pct': 0.011504258289612967, 'bull_atr_max_pct': 0.1302274166327262, 'bull_tp_mult': 1.5602726933197681, 'bull_tsl_mult': 0.4381978901591256, 'bull_time_stop': 227, 'bull_use_sma': False, 'bull_use_ema': True, 'bull_use_atr': True, 'bull_use_adx': True, 'bull_use_spike': True, 'bull_rsi_required': True, 'bear_strategy': 'mean_reversion', 'bear_bb_std_mult': 1.4896789467795728, 'bear_rsi_os': 33, 'bear_rsi_ob': 56, 'bear_adx_thresh': 6.8364035497565965, 'bear_atr_min_pct': 0.002830935336920114, 'bear_atr_max_pct': 0.028858396378997973, 'bear_tp_mult': 1.0105721433705845, 'bear_tsl_mult': 0.4350396857379496, 'bear_time_stop': 87, 'bear_use_sma': False, 'bear_use_ema': True, 'bear_use_atr': False, 'bear_use_adx': False, 'bear_use_spike': True, 'bear_rsi_required': False, 'sideways_strategy': 'mean_reversion', 'sideways_bb_std_mult': 1.6638109868822462, 'sideways_rsi_os': 12, 'sideways_rsi_ob': 92, 'sideways_adx_thresh': 15.658514648255188, 'sideways_atr_min_pct': 0.011050732140583455, 'sideways_atr_max_pct': 0.1099135371789989, 'sideways_tp_mult': 1.513708225959737, 'sideways_tsl_mult': 0.9135935615572631, 'sideways_time_stop': 121, 'sideways_use_sma': True, 'sideways_use_ema': True, 'sideways_use_atr': False, 'sideways_use_adx': True, 'sideways_use_spike': False, 'sideways_rsi_required': False}.
[I 2025-09-01 15:10:17,853] Trial 693 finished with values: [-1000000000.0, 1000000000.0] and parameters: {'p_sma': 27, 'p_std': 27, 'p_atr': 26, 'p_adx': 7, 'rsi_period': 83, 'ema1': 9, 'ema2': 56, 'slip_atr_k': 0.033388512847920035, 'slip_spread_k': 0.32951094559035177, 'spread_hl_frac': 0.02138570980407442, 'bb_std_mult': 3.405169498122411, 'rsi_os': 5, 'rsi_ob': 54, 'vol_spike': 0.11182862009645865, 'adx_thresh': 6.003188837500675, 'atr_min_pct': 0.022294510835985278, 'atr_max_pct': 0.14563422034046186, 'tp_mult': 1.4914199396893624, 'tsl_mult': 0.31014986339384937, 'strategy': 'mean_reversion', 'time_stop': 126, 'use_sma': True, 'use_atr': False, 'use_adx': True, 'use_ema': True, 'use_spike': True, 'rsi_required': False, 'edge_k': 0.2675001440506918, 'edge_cap': 0.9960693973051975, 'bull_strategy': 'mean_reversion', 'bull_bb_std_mult': 3.1742217131533024, 'bull_rsi_os': 16, 'bull_rsi_ob': 80, 'bull_adx_thresh': 20.298646884187644, 'bull_atr_min_pct': 0.015159846550892987, 'bull_atr_max_pct': 0.1306241445148132, 'bull_tp_mult': 1.5967722587241484, 'bull_tsl_mult': 0.43457875199196533, 'bull_time_stop': 229, 'bull_use_sma': True, 'bull_use_ema': True, 'bull_use_atr': True, 'bull_use_adx': False, 'bull_use_spike': True, 'bull_rsi_required': True, 'bear_strategy': 'mean_reversion', 'bear_bb_std_mult': 2.535814186096707, 'bear_rsi_os': 10, 'bear_rsi_ob': 59, 'bear_adx_thresh': 13.796362988515483, 'bear_atr_min_pct': 0.016060264611237107, 'bear_atr_max_pct': 0.11138920534916075, 'bear_tp_mult': 1.9449633403445497, 'bear_tsl_mult': 0.9838037254583593, 'bear_time_stop': 27, 'bear_use_sma': False, 'bear_use_ema': True, 'bear_use_atr': False, 'bear_use_adx': False, 'bear_use_spike': True, 'bear_rsi_required': False, 'sideways_strategy': 'mean_reversion', 'sideways_bb_std_mult': 3.187820326911585, 'sideways_rsi_os': 51, 'sideways_rsi_ob': 95, 'sideways_adx_thresh': 30.631478820958556, 'sideways_atr_min_pct': 0.0040766738827123575, 'sideways_atr_max_pct': 0.1107566958929064, 'sideways_tp_mult': 1.1543064197303667, 'sideways_tsl_mult': 0.48121977353440554, 'sideways_time_stop': 267, 'sideways_use_sma': True, 'sideways_use_ema': False, 'sideways_use_atr': False, 'sideways_use_adx': True, 'sideways_use_spike': False, 'sideways_rsi_required': True}.
