[I 2025-09-01 13:58:05,052] Trial 208 finished with values: [-1000000000.0, 1000000000.0] and parameters: {'p_sma': 12, 'p_std': 28, 'p_atr': 7, 'p_adx': 16, 'rsi_period': 28, 'ema1': 20, 'ema2': 56, 'slip_atr_k': 0.011142309484803827, 'slip_spread_k': 0.33173170846284455, 'spread_hl_frac': 0.008697070953898189, 'bb_std_mult': 1.5732969610956815, 'rsi_os': 44, 'rsi_ob': 73, 'vol_spike': 0.013540766444540248, 'adx_thresh': 29.797960027873163, 'atr_min_pct': 0.007786130255724718, 'atr_max_pct': 0.0656589435509763, 'tp_mult': 1.9332330123895909, 'tsl_mult': 0.610087539368266, 'strategy': 'breakout', 'time_stop': 79, 'use_sma': False, 'use_atr': True, 'use_adx': False, 'use_ema': False, 'use_spike': True, 'rsi_required': False, 'edge_k': 1.997640881089168, 'edge_cap': 0.2694003219528907, 'bull_strategy': 'mean_reversion', 'bull_bb_std_mult': 1.092459658086652, 'bull_rsi_os': 20, 'bull_rsi_ob': 53, 'bull_adx_thresh': 11.214593277866479, 'bull_atr_min_pct': 0.012168111633182177, 'bull_atr_max_pct': 0.08253605619430465, 'bull_tp_mult': 1.4655102302802412, 'bull_tsl_mult': 0.30604199025229184, 'bull_time_stop': 88, 'bull_use_sma': False, 'bull_use_ema': False, 'bull_use_atr': False, 'bull_use_adx': True, 'bull_use_spike': False, 'bull_rsi_required': False, 'bear_strategy': 'breakout', 'bear_bb_std_mult': 3.0785127697823347, 'bear_rsi_os': 40, 'bear_rsi_ob': 84, 'bear_adx_thresh': 24.073197355113592, 'bear_atr_min_pct': 0.017040601635750444, 'bear_atr_max_pct': 0.06645250442420413, 'bear_tp_mult': 1.3801104467514165, 'bear_tsl_mult': 0.8392365680932103, 'bear_time_stop': 186, 'bear_use_sma': False, 'bear_use_ema': True, 'bear_use_atr': True, 'bear_use_adx': True, 'bear_use_spike': True, 'bear_rsi_required': True, 'sideways_strategy': 'mean_reversion', 'sideways_bb_std_mult': 2.3733677971808604, 'sideways_rsi_os': 17, 'sideways_rsi_ob': 87, 'sideways_adx_thresh': 28.911017467140148, 'sideways_atr_min_pct': 0.013817410447934603, 'sideways_atr_max_pct': 0.11482811342685814, 'sideways_tp_mult': 2.5576470750063978, 'sideways_tsl_mult': 0.0925981940004107, 'sideways_time_stop': 239, 'sideways_use_sma': False, 'sideways_use_ema': True, 'sideways_use_atr': False, 'sideways_use_adx': False, 'sideways_use_spike': False, 'sideways_rsi_required': True}.
[I 2025-09-01 13:58:05,054] Trial 207 finished with values: [-1000000000.0, 1000000000.0] and parameters: {'p_sma': 9, 'p_std': 6, 'p_atr': 8, 'p_adx': 20, 'rsi_period': 28, 'ema1': 27, 'ema2': 26, 'slip_atr_k': 0.17013783149403663, 'slip_spread_k': 0.5355841087821329, 'spread_hl_frac': 0.023840107882863545, 'bb_std_mult': 1.1280231900376445, 'rsi_os': 44, 'rsi_ob': 73, 'vol_spike': 0.2690457268764565, 'adx_thresh': 8.977972994684526, 'atr_min_pct': 0.011536505558778486, 'atr_max_pct': 0.08613845890734538, 'tp_mult': 2.651336114296468, 'tsl_mult': 0.534470942740056, 'strategy': 'breakout', 'time_stop': 82, 'use_sma': False, 'use_atr': True, 'use_adx': False, 'use_ema': False, 'use_spike': True, 'rsi_required': False, 'edge_k': 1.1450330651732363, 'edge_cap': 0.22226256004789383, 'bull_strategy': 'mean_reversion', 'bull_bb_std_mult': 1.3064213789509942, 'bull_rsi_os': 15, 'bull_rsi_ob': 85, 'bull_adx_thresh': 11.372054061305027, 'bull_atr_min_pct': 0.012196098260319897, 'bull_atr_max_pct': 0.1052915294419259, 'bull_tp_mult': 2.015563678818441, 'bull_tsl_mult': 0.9408845345704562, 'bull_time_stop': 13, 'bull_use_sma': False, 'bull_use_ema': False, 'bull_use_atr': False, 'bull_use_adx': True, 'bull_use_spike': False, 'bull_rsi_required': False, 'bear_strategy': 'breakout', 'bear_bb_std_mult': 2.915114905126074, 'bear_rsi_os': 13, 'bear_rsi_ob': 83, 'bear_adx_thresh': 24.435901751426965, 'bear_atr_min_pct': 0.0033452165850013614, 'bear_atr_max_pct': 0.06628151279164193, 'bear_tp_mult': 1.340579956270166, 'bear_tsl_mult': 0.8014138568102149, 'bear_time_stop': 46, 'bear_use_sma': False, 'bear_use_ema': True, 'bear_use_atr': True, 'bear_use_adx': True, 'bear_use_spike': False, 'bear_rsi_required': True, 'sideways_strategy': 'breakout', 'sideways_bb_std_mult': 3.5020183461483505, 'sideways_rsi_os': 14, 'sideways_rsi_ob': 87, 'sideways_adx_thresh': 28.91769757529379, 'sideways_atr_min_pct': 0.023382844840130257, 'sideways_atr_max_pct': 0.11565947431294642, 'sideways_tp_mult': 2.1822770005564087, 'sideways_tsl_mult': 0.738049504807628, 'sideways_time_stop': 240, 'sideways_use_sma': False, 'sideways_use_ema': True, 'sideways_use_atr': False, 'sideways_use_adx': False, 'sideways_use_spike': False, 'sideways_rsi_required': True}.
[I 2025-09-01 13:58:05,458] Trial 209 finished with values: [-1000000000.0, 1000000000.0] and parameters: {'p_sma': 7, 'p_std': 13, 'p_atr': 7, 'p_adx': 15, 'rsi_period': 28, 'ema1': 14, 'ema2': 56, 'slip_atr_k': 0.009578814741682637, 'slip_spread_k': 0.5421648016467493, 'spread_hl_frac': 0.00254544326959779, 'bb_std_mult': 1.8067791603518333, 'rsi_os': 44, 'rsi_ob': 73, 'vol_spike': 0.21164657282964675, 'adx_thresh': 22.1596020960901, 'atr_min_pct': 0.007711656057586244, 'atr_max_pct': 0.08643508715266923, 'tp_mult': 1.8987407866039725, 'tsl_mult': 0.00013009250160777447, 'strategy': 'mean_reversion', 'time_stop': 25, 'use_sma': False, 'use_atr': False, 'use_adx': False, 'use_ema': True, 'use_spike': True, 'rsi_required': True, 'edge_k': 1.2144587902140105, 'edge_cap': 0.2113629566777846, 'bull_strategy': 'mean_reversion', 'bull_bb_std_mult': 3.0962571481589882, 'bull_rsi_os': 20, 'bull_rsi_ob': 79, 'bull_adx_thresh': 17.565896706781775, 'bull_atr_min_pct': 0.010669975464994198, 'bull_atr_max_pct': 0.1459787738946322, 'bull_tp_mult': 2.022772462718992, 'bull_tsl_mult': 0.36129314701061666, 'bull_time_stop': 11, 'bull_use_sma': False, 'bull_use_ema': False, 'bull_use_atr': True, 'bull_use_adx': False, 'bull_use_spike': True, 'bull_rsi_required': False, 'bear_strategy': 'mean_reversion', 'bear_bb_std_mult': 1.3188029161398793, 'bear_rsi_os': 13, 'bear_rsi_ob': 92, 'bear_adx_thresh': 24.29616146028279, 'bear_atr_min_pct': 0.016795891218414336, 'bear_atr_max_pct': 0.14404998065441976, 'bear_tp_mult': 1.9575247638996263, 'bear_tsl_mult': 0.13640120858361332, 'bear_time_stop': 44, 'bear_use_sma': False, 'bear_use_ema': True, 'bear_use_atr': True, 'bear_use_adx': True, 'bear_use_spike': True, 'bear_rsi_required': True, 'sideways_strategy': 'mean_reversion', 'sideways_bb_std_mult': 1.147016076141438, 'sideways_rsi_os': 37, 'sideways_rsi_ob': 71, 'sideways_adx_thresh': 29.101106840209283, 'sideways_atr_min_pct': 0.013671781019901378, 'sideways_atr_max_pct': 0.11536873486657448, 'sideways_tp_mult': 1.208946802016905, 'sideways_tsl_mult': 0.09416844816601105, 'sideways_time_stop': 132, 'sideways_use_sma': False, 'sideways_use_ema': True, 'sideways_use_atr': False, 'sideways_use_adx': True, 'sideways_use_spike': True, 'sideways_rsi_required': True}.
[I 2025-09-01 13:58:05,948] Trial 210 finished with values: [-1000000000.0, 1000000000.0] and parameters: {'p_sma': 28, 'p_std': 6, 'p_atr': 7, 'p_adx': 20, 'rsi_period': 29, 'ema1': 15, 'ema2': 28, 'slip_atr_k': 0.015133533209933865, 'slip_spread_k': 0.2536115000638006, 'spread_hl_frac': 0.009262695385140244, 'bb_std_mult': 1.8184996257761197, 'rsi_os': 48, 'rsi_ob': 74, 'vol_spike': 0.23686932693693627, 'adx_thresh': 21.926951696049304, 'atr_min_pct': 0.02987829606750949, 'atr_max_pct': 0.08658736434082658, 'tp_mult': 2.6136670555173214, 'tsl_mult': 0.13076787658283578, 'strategy': 'mean_reversion', 'time_stop': 25, 'use_sma': False, 'use_atr': False, 'use_adx': True, 'use_ema': True, 'use_spike': False, 'rsi_required': True, 'edge_k': 1.215060970539317, 'edge_cap': 0.1936693648077661, 'bull_strategy': 'mean_reversion', 'bull_bb_std_mult': 1.14970924187836, 'bull_rsi_os': 8, 'bull_rsi_ob': 73, 'bull_adx_thresh': 10.014690967342078, 'bull_atr_min_pct': 0.010825365084121425, 'bull_atr_max_pct': 0.14562491500257446, 'bull_tp_mult': 1.463844812391815, 'bull_tsl_mult': 0.9545189880782344, 'bull_time_stop': 5, 'bull_use_sma': False, 'bull_use_ema': False, 'bull_use_atr': True, 'bull_use_adx': True, 'bull_use_spike': True, 'bull_rsi_required': False, 'bear_strategy': 'mean_reversion', 'bear_bb_std_mult': 3.097676822913293, 'bear_rsi_os': 13, 'bear_rsi_ob': 52, 'bear_adx_thresh': 7.29615935648514, 'bear_atr_min_pct': 0.0033351348021053145, 'bear_atr_max_pct': 0.14416146774805266, 'bear_tp_mult': 1.954690594971652, 'bear_tsl_mult': 0.1363399986938978, 'bear_time_stop': 218, 'bear_use_sma': False, 'bear_use_ema': False, 'bear_use_atr': True, 'bear_use_adx': True, 'bear_use_spike': True, 'bear_rsi_required': True, 'sideways_strategy': 'breakout', 'sideways_bb_std_mult': 1.11348107975528, 'sideways_rsi_os': 13, 'sideways_rsi_ob': 79, 'sideways_adx_thresh': 8.765887476208047, 'sideways_atr_min_pct': 0.004870163987269237, 'sideways_atr_max_pct': 0.11580027789097447, 'sideways_tp_mult': 1.2114892479385135, 'sideways_tsl_mult': 0.1049699124096824, 'sideways_time_stop': 213, 'sideways_use_sma': False, 'sideways_use_ema': True, 'sideways_use_atr': False, 'sideways_use_adx': True, 'sideways_use_spike': False, 'sideways_rsi_required': True}.
[I 2025-09-01 13:58:06,930] Trial 211 finished with values: [-1000000000.0, 1000000000.0] and parameters: {'p_sma': 44, 'p_std': 13, 'p_atr': 19, 'p_adx': 27, 'rsi_period': 24, 'ema1': 7, 'ema2': 46, 'slip_atr_k': 0.14898644348602436, 'slip_spread_k': 0.4923898697102032, 'spread_hl_frac': 0.0023261399872790516, 'bb_std_mult': 3.2913630050145293, 'rsi_os': 22, 'rsi_ob': 71, 'vol_spike': 0.20561993846352022, 'adx_thresh': 28.33397214356925, 'atr_min_pct': 0.018609585436368398, 'atr_max_pct': 0.015036437757761608, 'tp_mult': 2.0584780059609136, 'tsl_mult': 0.12829966884673444, 'strategy': 'mean_reversion', 'time_stop': 12, 'use_sma': True, 'use_atr': False, 'use_adx': True, 'use_ema': True, 'use_spike': False, 'rsi_required': True, 'edge_k': 0.676986547927606, 'edge_cap': 0.18635642724611978, 'bull_strategy': 'breakout', 'bull_bb_std_mult': 1.14901270881122, 'bull_rsi_os': 17, 'bull_rsi_ob': 55, 'bull_adx_thresh': 15.399132447886792, 'bull_atr_min_pct': 0.010697991582955086, 'bull_atr_max_pct': 0.13183543352702223, 'bull_tp_mult': 1.423945959470949, 'bull_tsl_mult': 0.07806614817291485, 'bull_time_stop': 289, 'bull_use_sma': False, 'bull_use_ema': True, 'bull_use_atr': True, 'bull_use_adx': True, 'bull_use_spike': True, 'bull_rsi_required': False, 'bear_strategy': 'mean_reversion', 'bear_bb_std_mult': 2.734771801154885, 'bear_rsi_os': 12, 'bear_rsi_ob': 81, 'bear_adx_thresh': 7.409454696112309, 'bear_atr_min_pct': 0.011465282751518518, 'bear_atr_max_pct': 0.07208614137084147, 'bear_tp_mult': 2.492470335343317, 'bear_tsl_mult': 0.6941619889411215, 'bear_time_stop': 118, 'bear_use_sma': False, 'bear_use_ema': False, 'bear_use_atr': False, 'bear_use_adx': True, 'bear_use_spike': True, 'bear_rsi_required': True, 'sideways_strategy': 'breakout', 'sideways_bb_std_mult': 0.5747210495504267, 'sideways_rsi_os': 5, 'sideways_rsi_ob': 79, 'sideways_adx_thresh': 12.602507459194808, 'sideways_atr_min_pct': 0.025235808459111272, 'sideways_atr_max_pct': 0.11953267493410487, 'sideways_tp_mult': 2.7569615526162625, 'sideways_tsl_mult': 0.9775386919217635, 'sideways_time_stop': 34, 'sideways_use_sma': False, 'sideways_use_ema': True, 'sideways_use_atr': True, 'sideways_use_adx': True, 'sideways_use_spike': True, 'sideways_rsi_required': False}.
[I 2025-09-01 13:58:06,969] Trial 212 finished with values: [-1000000000.0, 1000000000.0] and parameters: {'p_sma': 9, 'p_std': 54, 'p_atr': 7, 'p_adx': 27, 'rsi_period': 24, 'ema1': 7, 'ema2': 46, 'slip_atr_k': 0.015676379453061235, 'slip_spread_k': 0.5040358984155098, 'spread_hl_frac': 0.0092364891735057, 'bb_std_mult': 1.8123903234632373, 'rsi_os': 42, 'rsi_ob': 71, 'vol_spike': 0.15894565178213244, 'adx_thresh': 21.553569195032175, 'atr_min_pct': 0.028321565791891434, 'atr_max_pct': 0.015020697927134785, 'tp_mult': 1.8929611582282728, 'tsl_mult': 0.07383081909664416, 'strategy': 'mean_reversion', 'time_stop': 103, 'use_sma': True, 'use_atr': False, 'use_adx': True, 'use_ema': True, 'use_spike': False, 'rsi_required': True, 'edge_k': 1.2284152232365797, 'edge_cap': 0.19073942756844314, 'bull_strategy': 'breakout', 'bull_bb_std_mult': 1.9561540149925085, 'bull_rsi_os': 17, 'bull_rsi_ob': 55, 'bull_adx_thresh': 10.083229372231644, 'bull_atr_min_pct': 0.010992946982761735, 'bull_atr_max_pct': 0.14053454008562172, 'bull_tp_mult': 1.4087918532676218, 'bull_tsl_mult': 0.5749609508253061, 'bull_time_stop': 97, 'bull_use_sma': False, 'bull_use_ema': True, 'bull_use_atr': True, 'bull_use_adx': True, 'bull_use_spike': True, 'bull_rsi_required': False, 'bear_strategy': 'mean_reversion', 'bear_bb_std_mult': 1.0830920530574666, 'bear_rsi_os': 12, 'bear_rsi_ob': 52, 'bear_adx_thresh': 26.28155773843211, 'bear_atr_min_pct': 0.004921149102359353, 'bear_atr_max_pct': 0.14108896023525325, 'bear_tp_mult': 1.8823219249448118, 'bear_tsl_mult': 0.13407138811698072, 'bear_time_stop': 219, 'bear_use_sma': False, 'bear_use_ema': False, 'bear_use_atr': False, 'bear_use_adx': True, 'bear_use_spike': True, 'bear_rsi_required': True, 'sideways_strategy': 'breakout', 'sideways_bb_std_mult': 0.5782683337107474, 'sideways_rsi_os': 8, 'sideways_rsi_ob': 84, 'sideways_adx_thresh': 18.892449418109596, 'sideways_atr_min_pct': 0.01586249195253714, 'sideways_atr_max_pct': 0.11867608614749829, 'sideways_tp_mult': 2.7575745256410142, 'sideways_tsl_mult': 0.033103500308273415, 'sideways_time_stop': 53, 'sideways_use_sma': False, 'sideways_use_ema': True, 'sideways_use_atr': True, 'sideways_use_adx': True, 'sideways_use_spike': True, 'sideways_rsi_required': False}.
[I 2025-09-01 13:58:06,975] Trial 214 finished with values: [-1000000000.0, 1000000000.0] and parameters: {'p_sma': 60, 'p_std': 24, 'p_atr': 7, 'p_adx': 27, 'rsi_period': 24, 'ema1': 7, 'ema2': 28, 'slip_atr_k': 0.0003396702896793643, 'slip_spread_k': 0.5015890566785107, 'spread_hl_frac': 0.009811098307542397, 'bb_std_mult': 0.677496784692843, 'rsi_os': 21, 'rsi_ob': 71, 'vol_spike': 0.22777756743357724, 'adx_thresh': 22.802460294301714, 'atr_min_pct': 0.01770279859477595, 'atr_max_pct': 0.015972962324238206, 'tp_mult': 2.821359701333181, 'tsl_mult': 0.07381074593622579, 'strategy': 'breakout', 'time_stop': 104, 'use_sma': True, 'use_atr': True, 'use_adx': True, 'use_ema': False, 'use_spike': False, 'rsi_required': False, 'edge_k': 0.0032253658413960995, 'edge_cap': 0.24886137556745339, 'bull_strategy': 'breakout', 'bull_bb_std_mult': 2.652750005275248, 'bull_rsi_os': 18, 'bull_rsi_ob': 55, 'bull_adx_thresh': 10.011414784953462, 'bull_atr_min_pct': 0.00993936969351491, 'bull_atr_max_pct': 0.043944807359707086, 'bull_tp_mult': 2.129333758227711, 'bull_tsl_mult': 0.6094167872252355, 'bull_time_stop': 100, 'bull_use_sma': False, 'bull_use_ema': True, 'bull_use_atr': False, 'bull_use_adx': True, 'bull_use_spike': False, 'bull_rsi_required': False, 'bear_strategy': 'breakout', 'bear_bb_std_mult': 2.725487928352979, 'bear_rsi_os': 11, 'bear_rsi_ob': 53, 'bear_adx_thresh': 5.374370004807737, 'bear_atr_min_pct': 0.004834883204839086, 'bear_atr_max_pct': 0.07234961710166993, 'bear_tp_mult': 1.588387794938598, 'bear_tsl_mult': 0.7625709687295333, 'bear_time_stop': 56, 'bear_use_sma': False, 'bear_use_ema': False, 'bear_use_atr': False, 'bear_use_adx': True, 'bear_use_spike': False, 'bear_rsi_required': False, 'sideways_strategy': 'breakout', 'sideways_bb_std_mult': 0.5834795519828375, 'sideways_rsi_os': 8, 'sideways_rsi_ob': 84, 'sideways_adx_thresh': 18.667484396846742, 'sideways_atr_min_pct': 0.0024757435200712663, 'sideways_atr_max_pct': 0.035276286445540005, 'sideways_tp_mult': 2.750003773647635, 'sideways_tsl_mult': 0.7624956245895924, 'sideways_time_stop': 259, 'sideways_use_sma': False, 'sideways_use_ema': True, 'sideways_use_atr': True, 'sideways_use_adx': False, 'sideways_use_spike': False, 'sideways_rsi_required': False}.
[I 2025-09-01 13:58:40,820] Trial 213 finished with values: [-1000000000.0, 1000000000.0] and parameters: {'p_sma': 34, 'p_std': 24, 'p_atr': 18, 'p_adx': 8, 'rsi_period': 24, 'ema1': 7, 'ema2': 30, 'slip_atr_k': 0.01709876991684412, 'slip_spread_k': 0.26106890886557405, 'spread_hl_frac': 0.009675389429655767, 'bb_std_mult': 3.2667837614219, 'rsi_os': 48, 'rsi_ob': 71, 'vol_spike': 0.035445663651959, 'adx_thresh': 21.724978776989964, 'atr_min_pct': 0.006688467132191197, 'atr_max_pct': 0.015265608790724094, 'tp_mult': 2.82010570508285, 'tsl_mult': 0.10982627000197415, 'strategy': 'mean_reversion', 'time_stop': 164, 'use_sma': True, 'use_atr': False, 'use_adx': True, 'use_ema': True, 'use_spike': False, 'rsi_required': True, 'edge_k': 1.2377884165832018, 'edge_cap': 0.192850071777448, 'bull_strategy': 'breakout', 'bull_bb_std_mult': 1.9717164652247936, 'bull_rsi_os': 8, 'bull_rsi_ob': 73, 'bull_adx_thresh': 24.42282826892532, 'bull_atr_min_pct': 0.00992858674596818, 'bull_atr_max_pct': 0.14041070489700608, 'bull_tp_mult': 1.9041870245105434, 'bull_tsl_mult': 0.5738576685486426, 'bull_time_stop': 176, 'bull_use_sma': False, 'bull_use_ema': True, 'bull_use_atr': True, 'bull_use_adx': True, 'bull_use_spike': True, 'bull_rsi_required': False, 'bear_strategy': 'mean_reversion', 'bear_bb_std_mult': 1.0823910844177949, 'bear_rsi_os': 11, 'bear_rsi_ob': 52, 'bear_adx_thresh': 26.187709141178306, 'bear_atr_min_pct': 0.004774150764518268, 'bear_atr_max_pct': 0.061187158603754996, 'bear_tp_mult': 1.6758728343573361, 'bear_tsl_mult': 0.9655074972429794, 'bear_time_stop': 56, 'bear_use_sma': False, 'bear_use_ema': False, 'bear_use_atr': False, 'bear_use_adx': True, 'bear_use_spike': False, 'bear_rsi_required': True, 'sideways_strategy': 'breakout', 'sideways_bb_std_mult': 0.5813653440736902, 'sideways_rsi_os': 34, 'sideways_rsi_ob': 79, 'sideways_adx_thresh': 16.5557065033232, 'sideways_atr_min_pct': 0.015690906490325493, 'sideways_atr_max_pct': 0.1185192374502653, 'sideways_tp_mult': 2.43899119879789, 'sideways_tsl_mult': 0.783213332978745, 'sideways_time_stop': 55, 'sideways_use_sma': False, 'sideways_use_ema': True, 'sideways_use_atr': True, 'sideways_use_adx': True, 'sideways_use_spike': False, 'sideways_rsi_required': False}.
[I 2025-09-01 13:58:44,411] Trial 216 finished with values: [-1000000000.0, 1000000000.0] and parameters: {'p_sma': 21, 'p_std': 24, 'p_atr': 22, 'p_adx': 27, 'rsi_period': 44, 'ema1': 8, 'ema2': 29, 'slip_atr_k': 0.003361043854593176, 'slip_spread_k': 0.9832930185724738, 'spread_hl_frac': 0.00989872394688857, 'bb_std_mult': 1.3776166241248315, 'rsi_os': 45, 'rsi_ob': 76, 'vol_spike': 0.11230115122805415, 'adx_thresh': 22.672389254196432, 'atr_min_pct': 0.00689211082069884, 'atr_max_pct': 0.06866088721610138, 'tp_mult': 1.987807690927018, 'tsl_mult': 0.05080955885683192, 'strategy': 'breakout', 'time_stop': 164, 'use_sma': True, 'use_atr': True, 'use_adx': False, 'use_ema': False, 'use_spike': True, 'rsi_required': False, 'edge_k': 0.6176287526257852, 'edge_cap': 0.6488678164260927, 'bull_strategy': 'breakout', 'bull_bb_std_mult': 2.0802585784825633, 'bull_rsi_os': 18, 'bull_rsi_ob': 52, 'bull_adx_thresh': 10.473943001426466, 'bull_atr_min_pct': 0.0099512879817869, 'bull_atr_max_pct': 0.10108971187775259, 'bull_tp_mult': 2.862907259716956, 'bull_tsl_mult': 0.6154043319817811, 'bull_time_stop': 114, 'bull_use_sma': False, 'bull_use_ema': True, 'bull_use_atr': False, 'bull_use_adx': False, 'bull_use_spike': False, 'bull_rsi_required': False, 'bear_strategy': 'breakout', 'bear_bb_std_mult': 2.3417805566260297, 'bear_rsi_os': 14, 'bear_rsi_ob': 63, 'bear_adx_thresh': 5.40293194816294, 'bear_atr_min_pct': 0.029381120042226982, 'bear_atr_max_pct': 0.0991799732685339, 'bear_tp_mult': 1.8726745710258046, 'bear_tsl_mult': 0.7670362899221104, 'bear_time_stop': 56, 'bear_use_sma': True, 'bear_use_ema': True, 'bear_use_atr': False, 'bear_use_adx': True, 'bear_use_spike': False, 'bear_rsi_required': False, 'sideways_strategy': 'breakout', 'sideways_bb_std_mult': 0.8057510485238657, 'sideways_rsi_os': 34, 'sideways_rsi_ob': 86, 'sideways_adx_thresh': 28.147985376573168, 'sideways_atr_min_pct': 0.02220573373283517, 'sideways_atr_max_pct': 0.036115216124219904, 'sideways_tp_mult': 2.4296779192280438, 'sideways_tsl_mult': 0.9151436541913052, 'sideways_time_stop': 257, 'sideways_use_sma': False, 'sideways_use_ema': False, 'sideways_use_atr': True, 'sideways_use_adx': False, 'sideways_use_spike': False, 'sideways_rsi_required': False}.
