[I 2025-09-01 13:47:32,135] Trial 135 finished with values: [-0.036596623426638275, 0.036026363670125114] and parameters: {'p_sma': 14, 'p_std': 25, 'p_atr': 27, 'p_adx': 22, 'rsi_period': 26, 'ema1': 8, 'ema2': 32, 'slip_atr_k': 0.2103554641811495, 'slip_spread_k': 0.7946278224189973, 'spread_hl_frac': 0.045911356440103655, 'bb_std_mult': 1.9399597461410019, 'rsi_os': 46, 'rsi_ob': 66, 'vol_spike': 0.1709110570544255, 'adx_thresh': 23.309172346008822, 'atr_min_pct': 0.01736460065852369, 'atr_max_pct': 0.09874720719546023, 'tp_mult': 2.826644380379565, 'tsl_mult': 0.19258327457536803, 'strategy': 'mean_reversion', 'time_stop': 79, 'use_sma': False, 'use_atr': True, 'use_adx': False, 'use_ema': True, 'use_spike': False, 'rsi_required': False, 'edge_k': 1.2153956273411146, 'edge_cap': 0.9350375173093693, 'bull_strategy': 'breakout', 'bull_bb_std_mult': 1.2594392736686626, 'bull_rsi_os': 53, 'bull_rsi_ob': 89, 'bull_adx_thresh': 10.056793930640964, 'bull_atr_min_pct': 0.015729138257445124, 'bull_atr_max_pct': 0.11647664259094195, 'bull_tp_mult': 1.4803707221492306, 'bull_tsl_mult': 0.9225274549188504, 'bull_time_stop': 186, 'bull_use_sma': True, 'bull_use_ema': True, 'bull_use_atr': False, 'bull_use_adx': False, 'bull_use_spike': True, 'bull_rsi_required': False, 'bear_strategy': 'breakout', 'bear_bb_std_mult': 2.768688453387893, 'bear_rsi_os': 11, 'bear_rsi_ob': 52, 'bear_adx_thresh': 25.722876003299888, 'bear_atr_min_pct': 0.0030318544185014, 'bear_atr_max_pct': 0.11294893148519425, 'bear_tp_mult': 1.8538161560243491, 'bear_tsl_mult': 0.21612914660474086, 'bear_time_stop': 41, 'bear_use_sma': True, 'bear_use_ema': True, 'bear_use_atr': False, 'bear_use_adx': True, 'bear_use_spike': True, 'bear_rsi_required': False, 'sideways_strategy': 'mean_reversion', 'sideways_bb_std_mult': 0.6864724277603319, 'sideways_rsi_os': 23, 'sideways_rsi_ob': 50, 'sideways_adx_thresh': 6.4666792299632245, 'sideways_atr_min_pct': 0.0167782290938067, 'sideways_atr_max_pct': 0.14594489733382743, 'sideways_tp_mult': 2.700747122945247, 'sideways_tsl_mult': 0.6212555982224673, 'sideways_time_stop': 255, 'sideways_use_sma': False, 'sideways_use_ema': True, 'sideways_use_atr': True, 'sideways_use_adx': False, 'sideways_use_spike': True, 'sideways_rsi_required': False}.
[I 2025-09-01 13:48:11,230] Trial 137 finished with values: [-1000000000.0, 1000000000.0] and parameters: {'p_sma': 14, 'p_std': 25, 'p_atr': 8, 'p_adx': 9, 'rsi_period': 26, 'ema1': 8, 'ema2': 33, 'slip_atr_k': 0.0008410376070266223, 'slip_spread_k': 0.7637431210539013, 'spread_hl_frac': 0.010878052456087044, 'bb_std_mult': 0.905029821069661, 'rsi_os': 50, 'rsi_ob': 52, 'vol_spike': 0.18071821802005433, 'adx_thresh': 27.70084563112872, 'atr_min_pct': 0.01757041612700031, 'atr_max_pct': 0.02085517016483051, 'tp_mult': 2.3479427130634423, 'tsl_mult': 0.19639996244809926, 'strategy': 'breakout', 'time_stop': 94, 'use_sma': True, 'use_atr': True, 'use_adx': True, 'use_ema': False, 'use_spike': False, 'rsi_required': False, 'edge_k': 1.2200361312031278, 'edge_cap': 0.22076696349804673, 'bull_strategy': 'breakout', 'bull_bb_std_mult': 1.5559431156503138, 'bull_rsi_os': 18, 'bull_rsi_ob': 52, 'bull_adx_thresh': 9.179568795067974, 'bull_atr_min_pct': 0.011777689237685865, 'bull_atr_max_pct': 0.13119337352898924, 'bull_tp_mult': 1.3621933489984295, 'bull_tsl_mult': 0.3384962806505435, 'bull_time_stop': 106, 'bull_use_sma': True, 'bull_use_ema': True, 'bull_use_atr': False, 'bull_use_adx': False, 'bull_use_spike': False, 'bull_rsi_required': False, 'bear_strategy': 'breakout', 'bear_bb_std_mult': 2.7849335761581866, 'bear_rsi_os': 24, 'bear_rsi_ob': 52, 'bear_adx_thresh': 5.163655705898149, 'bear_atr_min_pct': 0.025515915541656064, 'bear_atr_max_pct': 0.0741769373951173, 'bear_tp_mult': 1.9812939171318384, 'bear_tsl_mult': 0.22301087120744173, 'bear_time_stop': 275, 'bear_use_sma': True, 'bear_use_ema': False, 'bear_use_atr': False, 'bear_use_adx': True, 'bear_use_spike': False, 'bear_rsi_required': False, 'sideways_strategy': 'mean_reversion', 'sideways_bb_std_mult': 0.9759259281020737, 'sideways_rsi_os': 41, 'sideways_rsi_ob': 86, 'sideways_adx_thresh': 20.72273278862798, 'sideways_atr_min_pct': 0.01513044586948654, 'sideways_atr_max_pct': 0.02360306936525279, 'sideways_tp_mult': 2.4520358452356503, 'sideways_tsl_mult': 0.7574943942002216, 'sideways_time_stop': 67, 'sideways_use_sma': True, 'sideways_use_ema': True, 'sideways_use_atr': True, 'sideways_use_adx': False, 'sideways_use_spike': True, 'sideways_rsi_required': False}.
[I 2025-09-01 13:48:11,672] Trial 136 finished with values: [-1000000000.0, 1000000000.0] and parameters: {'p_sma': 12, 'p_std': 25, 'p_atr': 8, 'p_adx': 22, 'rsi_period': 22, 'ema1': 8, 'ema2': 33, 'slip_atr_k': 0.0002819163783386591, 'slip_spread_k': 0.13861077424353674, 'spread_hl_frac': 0.009467331828476163, 'bb_std_mult': 1.9128013383596412, 'rsi_os': 11, 'rsi_ob': 52, 'vol_spike': 0.16610549418681084, 'adx_thresh': 23.11430131970527, 'atr_min_pct': 0.0023675703754384766, 'atr_max_pct': 0.09608198653874384, 'tp_mult': 2.0256473678453943, 'tsl_mult': 0.6181079581588387, 'strategy': 'mean_reversion', 'time_stop': 82, 'use_sma': False, 'use_atr': True, 'use_adx': False, 'use_ema': True, 'use_spike': False, 'rsi_required': False, 'edge_k': 1.1937620518804144, 'edge_cap': 0.6656278522755397, 'bull_strategy': 'mean_reversion', 'bull_bb_std_mult': 1.519396391452051, 'bull_rsi_os': 54, 'bull_rsi_ob': 89, 'bull_adx_thresh': 10.007468270844718, 'bull_atr_min_pct': 0.011699212945187684, 'bull_atr_max_pct': 0.11495044239462025, 'bull_tp_mult': 1.4820571909183338, 'bull_tsl_mult': 0.3273918305118081, 'bull_time_stop': 101, 'bull_use_sma': True, 'bull_use_ema': True, 'bull_use_atr': False, 'bull_use_adx': False, 'bull_use_spike': True, 'bull_rsi_required': False, 'bear_strategy': 'breakout', 'bear_bb_std_mult': 2.153203555882231, 'bear_rsi_os': 18, 'bear_rsi_ob': 93, 'bear_adx_thresh': 5.1171358474950805, 'bear_atr_min_pct': 0.0030330578269450476, 'bear_atr_max_pct': 0.11179623745791965, 'bear_tp_mult': 1.4158902289414226, 'bear_tsl_mult': 0.2198471847314306, 'bear_time_stop': 248, 'bear_use_sma': True, 'bear_use_ema': True, 'bear_use_atr': False, 'bear_use_adx': True, 'bear_use_spike': True, 'bear_rsi_required': False, 'sideways_strategy': 'mean_reversion', 'sideways_bb_std_mult': 1.7727848394115382, 'sideways_rsi_os': 41, 'sideways_rsi_ob': 50, 'sideways_adx_thresh': 17.136835732034644, 'sideways_atr_min_pct': 0.016968637791459337, 'sideways_atr_max_pct': 0.04109673100770944, 'sideways_tp_mult': 2.8433857287132316, 'sideways_tsl_mult': 0.7580478895039477, 'sideways_time_stop': 67, 'sideways_use_sma': False, 'sideways_use_ema': True, 'sideways_use_atr': True, 'sideways_use_adx': False, 'sideways_use_spike': True, 'sideways_rsi_required': False}.
[I 2025-09-01 13:48:11,921] Trial 139 finished with values: [-1000000000.0, 1000000000.0] and parameters: {'p_sma': 8, 'p_std': 28, 'p_atr': 9, 'p_adx': 9, 'rsi_period': 84, 'ema1': 7, 'ema2': 34, 'slip_atr_k': 0.001053758829602736, 'slip_spread_k': 0.9670605471625551, 'spread_hl_frac': 0.024173221079687567, 'bb_std_mult': 0.8233897613952101, 'rsi_os': 36, 'rsi_ob': 87, 'vol_spike': 0.14797098861239805, 'adx_thresh': 21.26955088450464, 'atr_min_pct': 0.0022877537326084427, 'atr_max_pct': 0.12860663204995101, 'tp_mult': 2.023188575384864, 'tsl_mult': 0.29466375219546603, 'strategy': 'breakout', 'time_stop': 98, 'use_sma': True, 'use_atr': True, 'use_adx': True, 'use_ema': False, 'use_spike': False, 'rsi_required': True, 'edge_k': 1.164431667009138, 'edge_cap': 0.665870343080752, 'bull_strategy': 'breakout', 'bull_bb_std_mult': 1.5249599723030416, 'bull_rsi_os': 18, 'bull_rsi_ob': 59, 'bull_adx_thresh': 8.970297798793258, 'bull_atr_min_pct': 0.012058585345847453, 'bull_atr_max_pct': 0.08837172506715874, 'bull_tp_mult': 1.362540367104648, 'bull_tsl_mult': 0.3355896501029384, 'bull_time_stop': 212, 'bull_use_sma': True, 'bull_use_ema': True, 'bull_use_atr': False, 'bull_use_adx': False, 'bull_use_spike': False, 'bull_rsi_required': False, 'bear_strategy': 'breakout', 'bear_bb_std_mult': 0.6527473603727578, 'bear_rsi_os': 41, 'bear_rsi_ob': 48, 'bear_adx_thresh': 7.2647838266105, 'bear_atr_min_pct': 0.02571678276006919, 'bear_atr_max_pct': 0.07511413972858022, 'bear_tp_mult': 1.928996651136438, 'bear_tsl_mult': 0.11738822560833254, 'bear_time_stop': 60, 'bear_use_sma': False, 'bear_use_ema': False, 'bear_use_atr': False, 'bear_use_adx': True, 'bear_use_spike': False, 'bear_rsi_required': True, 'sideways_strategy': 'mean_reversion', 'sideways_bb_std_mult': 3.433459249408693, 'sideways_rsi_os': 45, 'sideways_rsi_ob': 86, 'sideways_adx_thresh': 17.635351401409082, 'sideways_atr_min_pct': 0.015243331508489291, 'sideways_atr_max_pct': 0.04187527898757594, 'sideways_tp_mult': 2.461076313968018, 'sideways_tsl_mult': 0.9267866935001516, 'sideways_time_stop': 28, 'sideways_use_sma': True, 'sideways_use_ema': True, 'sideways_use_atr': True, 'sideways_use_adx': False, 'sideways_use_spike': True, 'sideways_rsi_required': False}.
[I 2025-09-01 13:48:12,133] Trial 138 finished with values: [-1000000000.0, 1000000000.0] and parameters: {'p_sma': 8, 'p_std': 28, 'p_atr': 9, 'p_adx': 21, 'rsi_period': 69, 'ema1': 8, 'ema2': 35, 'slip_atr_k': 0.004095240424173417, 'slip_spread_k': 0.48523441943890305, 'spread_hl_frac': 0.00940366862035578, 'bb_std_mult': 2.5633412883355784, 'rsi_os': 36, 'rsi_ob': 87, 'vol_spike': 0.17986627704717859, 'adx_thresh': 27.699725389486453, 'atr_min_pct': 0.004389391521927339, 'atr_max_pct': 0.02014223029168654, 'tp_mult': 2.0148061481175756, 'tsl_mult': 0.9206562676944401, 'strategy': 'mean_reversion', 'time_stop': 94, 'use_sma': False, 'use_atr': True, 'use_adx': True, 'use_ema': True, 'use_spike': False, 'rsi_required': True, 'edge_k': 1.1605760954576887, 'edge_cap': 0.10431306815195424, 'bull_strategy': 'breakout', 'bull_bb_std_mult': 1.3901511088645573, 'bull_rsi_os': 7, 'bull_rsi_ob': 89, 'bull_adx_thresh': 9.20414081478141, 'bull_atr_min_pct': 0.023179295118861597, 'bull_atr_max_pct': 0.04725483800055618, 'bull_tp_mult': 1.3485094796473451, 'bull_tsl_mult': 0.515461159697458, 'bull_time_stop': 107, 'bull_use_sma': True, 'bull_use_ema': True, 'bull_use_atr': False, 'bull_use_adx': False, 'bull_use_spike': True, 'bull_rsi_required': False, 'bear_strategy': 'breakout', 'bear_bb_std_mult': 2.7807982994658857, 'bear_rsi_os': 24, 'bear_rsi_ob': 52, 'bear_adx_thresh': 20.94795527295404, 'bear_atr_min_pct': 0.010213959917901867, 'bear_atr_max_pct': 0.10309601889435428, 'bear_tp_mult': 1.9719432891300988, 'bear_tsl_mult': 0.21851413809361747, 'bear_time_stop': 251, 'bear_use_sma': True, 'bear_use_ema': False, 'bear_use_atr': False, 'bear_use_adx': True, 'bear_use_spike': False, 'bear_rsi_required': False, 'sideways_strategy': 'mean_reversion', 'sideways_bb_std_mult': 1.2531059052467892, 'sideways_rsi_os': 41, 'sideways_rsi_ob': 86, 'sideways_adx_thresh': 18.076547430252294, 'sideways_atr_min_pct': 0.014906884153514464, 'sideways_atr_max_pct': 0.10083998429606379, 'sideways_tp_mult': 2.226354748123585, 'sideways_tsl_mult': 0.7667803622489983, 'sideways_time_stop': 25, 'sideways_use_sma': True, 'sideways_use_ema': True, 'sideways_use_atr': True, 'sideways_use_adx': False, 'sideways_use_spike': True, 'sideways_rsi_required': False}.
[I 2025-09-01 13:48:50,567] Trial 143 finished with values: [-1000000000.0, 1000000000.0] and parameters: {'p_sma': 12, 'p_std': 27, 'p_atr': 29, 'p_adx': 29, 'rsi_period': 31, 'ema1': 11, 'ema2': 18, 'slip_atr_k': 0.012154685900016398, 'slip_spread_k': 0.44763995535112644, 'spread_hl_frac': 0.012393668052511329, 'bb_std_mult': 3.4681318845741553, 'rsi_os': 54, 'rsi_ob': 82, 'vol_spike': 0.08207146564319454, 'adx_thresh': 30.527060095089233, 'atr_min_pct': 0.019297039678840153, 'atr_max_pct': 0.11750684272666798, 'tp_mult': 2.6905400228545204, 'tsl_mult': 0.4638515409401462, 'strategy': 'breakout', 'time_stop': 87, 'use_sma': True, 'use_atr': False, 'use_adx': False, 'use_ema': False, 'use_spike': True, 'rsi_required': False, 'edge_k': 0.6572899202544598, 'edge_cap': 0.8040149827073134, 'bull_strategy': 'breakout', 'bull_bb_std_mult': 1.433002647322846, 'bull_rsi_os': 17, 'bull_rsi_ob': 57, 'bull_adx_thresh': 12.868771227028729, 'bull_atr_min_pct': 0.01340441545284725, 'bull_atr_max_pct': 0.12305614213046731, 'bull_tp_mult': 2.174006165103007, 'bull_tsl_mult': 0.5407495447356655, 'bull_time_stop': 73, 'bull_use_sma': False, 'bull_use_ema': False, 'bull_use_atr': False, 'bull_use_adx': True, 'bull_use_spike': False, 'bull_rsi_required': True, 'bear_strategy': 'mean_reversion', 'bear_bb_std_mult': 3.5261215832521957, 'bear_rsi_os': 14, 'bear_rsi_ob': 58, 'bear_adx_thresh': 16.73159690017447, 'bear_atr_min_pct': 0.010936143622960807, 'bear_atr_max_pct': 0.07937531996795222, 'bear_tp_mult': 2.0940727043694363, 'bear_tsl_mult': 0.2675171976244421, 'bear_time_stop': 77, 'bear_use_sma': False, 'bear_use_ema': True, 'bear_use_atr': False, 'bear_use_adx': False, 'bear_use_spike': False, 'bear_rsi_required': True, 'sideways_strategy': 'breakout', 'sideways_bb_std_mult': 1.1044156565407357, 'sideways_rsi_os': 43, 'sideways_rsi_ob': 83, 'sideways_adx_thresh': 29.32781389311288, 'sideways_atr_min_pct': 0.0056964778470318216, 'sideways_atr_max_pct': 0.09657489549624858, 'sideways_tp_mult': 1.4441014270971952, 'sideways_tsl_mult': 0.7329869917834906, 'sideways_time_stop': 232, 'sideways_use_sma': False, 'sideways_use_ema': False, 'sideways_use_atr': True, 'sideways_use_adx': True, 'sideways_use_spike': False, 'sideways_rsi_required': True}.
[I 2025-09-01 13:48:50,912] Trial 142 finished with values: [-1000000000.0, 1000000000.0] and parameters: {'p_sma': 44, 'p_std': 27, 'p_atr': 29, 'p_adx': 29, 'rsi_period': 31, 'ema1': 13, 'ema2': 31, 'slip_atr_k': 0.010198467575118964, 'slip_spread_k': 0.8508974035685553, 'spread_hl_frac': 0.014602607535500783, 'bb_std_mult': 1.3054355720291073, 'rsi_os': 42, 'rsi_ob': 89, 'vol_spike': 0.07295325245465127, 'adx_thresh': 22.59932347681741, 'atr_min_pct': 0.004330714114292575, 'atr_max_pct': 0.01027715078241651, 'tp_mult': 2.2074261714633274, 'tsl_mult': 0.9161815786548728, 'strategy': 'breakout', 'time_stop': 102, 'use_sma': True, 'use_atr': False, 'use_adx': False, 'use_ema': False, 'use_spike': True, 'rsi_required': True, 'edge_k': 0.5952501028041448, 'edge_cap': 0.8064436260161176, 'bull_strategy': 'breakout', 'bull_bb_std_mult': 1.7092308412318489, 'bull_rsi_os': 17, 'bull_rsi_ob': 78, 'bull_adx_thresh': 12.89715156708534, 'bull_atr_min_pct': 0.024854731049306477, 'bull_atr_max_pct': 0.04574972696988628, 'bull_tp_mult': 1.622395765542545, 'bull_tsl_mult': 0.6512958794454062, 'bull_time_stop': 115, 'bull_use_sma': False, 'bull_use_ema': True, 'bull_use_atr': False, 'bull_use_adx': True, 'bull_use_spike': False, 'bull_rsi_required': True, 'bear_strategy': 'mean_reversion', 'bear_bb_std_mult': 1.7411143903592712, 'bear_rsi_os': 14, 'bear_rsi_ob': 87, 'bear_adx_thresh': 29.810104601496572, 'bear_atr_min_pct': 0.010238969931831092, 'bear_atr_max_pct': 0.10302211928633556, 'bear_tp_mult': 1.8032643484304665, 'bear_tsl_mult': 0.0016497236815567473, 'bear_time_stop': 76, 'bear_use_sma': False, 'bear_use_ema': True, 'bear_use_atr': False, 'bear_use_adx': False, 'bear_use_spike': False, 'bear_rsi_required': True, 'sideways_strategy': 'breakout', 'sideways_bb_std_mult': 0.7653328264321015, 'sideways_rsi_os': 9, 'sideways_rsi_ob': 85, 'sideways_adx_thresh': 29.43513486176748, 'sideways_atr_min_pct': 0.014305305423317908, 'sideways_atr_max_pct': 0.10068234023961058, 'sideways_tp_mult': 1.466062043184806, 'sideways_tsl_mult': 0.7343279213698732, 'sideways_time_stop': 231, 'sideways_use_sma': False, 'sideways_use_ema': False, 'sideways_use_atr': True, 'sideways_use_adx': True, 'sideways_use_spike': False, 'sideways_rsi_required': False}.
[I 2025-09-01 13:48:51,281] Trial 140 finished with values: [-0.01440814293819681, 0.014658408502575613] and parameters: {'p_sma': 23, 'p_std': 29, 'p_atr': 9, 'p_adx': 29, 'rsi_period': 32, 'ema1': 7, 'ema2': 18, 'slip_atr_k': 0.010063294953606198, 'slip_spread_k': 0.4872906456447753, 'spread_hl_frac': 0.02505807605643158, 'bb_std_mult': 2.8805191940957178, 'rsi_os': 36, 'rsi_ob': 89, 'vol_spike': 0.04903846331520045, 'adx_thresh': 30.510186445281043, 'atr_min_pct': 0.0034076841811425153, 'atr_max_pct': 0.055638102799566866, 'tp_mult': 2.2114852284985016, 'tsl_mult': 0.93643831407292, 'strategy': 'breakout', 'time_stop': 85, 'use_sma': True, 'use_atr': True, 'use_adx': True, 'use_ema': False, 'use_spike': True, 'rsi_required': True, 'edge_k': 1.1468871462224854, 'edge_cap': 0.6850870078763431, 'bull_strategy': 'mean_reversion', 'bull_bb_std_mult': 1.4127490301886192, 'bull_rsi_os': 28, 'bull_rsi_ob': 55, 'bull_adx_thresh': 12.685112394209405, 'bull_atr_min_pct': 0.01353334998221225, 'bull_atr_max_pct': 0.123880348041603, 'bull_tp_mult': 2.1579630147081623, 'bull_tsl_mult': 0.51601295856451, 'bull_time_stop': 211, 'bull_use_sma': False, 'bull_use_ema': True, 'bull_use_atr': False, 'bull_use_adx': True, 'bull_use_spike': False, 'bull_rsi_required': True, 'bear_strategy': 'breakout', 'bear_bb_std_mult': 1.7071858019488495, 'bear_rsi_os': 8, 'bear_rsi_ob': 66, 'bear_adx_thresh': 7.249154708931667, 'bear_atr_min_pct': 7.588401491672239e-05, 'bear_atr_max_pct': 0.07798502694503434, 'bear_tp_mult': 2.0896327247979714, 'bear_tsl_mult': 0.12481260455253718, 'bear_time_stop': 254, 'bear_use_sma': False, 'bear_use_ema': False, 'bear_use_atr': False, 'bear_use_adx': False, 'bear_use_spike': False, 'bear_rsi_required': True, 'sideways_strategy': 'breakout', 'sideways_bb_std_mult': 1.2540058770979976, 'sideways_rsi_os': 43, 'sideways_rsi_ob': 83, 'sideways_adx_thresh': 29.58936754494411, 'sideways_atr_min_pct': 0.01910718630270551, 'sideways_atr_max_pct': 0.1400494207562167, 'sideways_tp_mult': 1.5006800471871728, 'sideways_tsl_mult': 0.7267564029905949, 'sideways_time_stop': 30, 'sideways_use_sma': True, 'sideways_use_ema': False, 'sideways_use_atr': True, 'sideways_use_adx': True, 'sideways_use_spike': False, 'sideways_rsi_required': False}.
[I 2025-09-01 13:48:51,591] Trial 141 finished with values: [-1000000000.0, 1000000000.0] and parameters: {'p_sma': 10, 'p_std': 29, 'p_atr': 29, 'p_adx': 29, 'rsi_period': 51, 'ema1': 11, 'ema2': 35, 'slip_atr_k': 0.07688019811914024, 'slip_spread_k': 0.8508861080053571, 'spread_hl_frac': 0.01254521297199523, 'bb_std_mult': 2.8919900139100476, 'rsi_os': 54, 'rsi_ob': 83, 'vol_spike': 0.08160801845506942, 'adx_thresh': 25.89207900134995, 'atr_min_pct': 0.027248791887349695, 'atr_max_pct': 0.08079178842249789, 'tp_mult': 2.1214446774728657, 'tsl_mult': 0.4710389977497528, 'strategy': 'breakout', 'time_stop': 88, 'use_sma': True, 'use_atr': False, 'use_adx': False, 'use_ema': False, 'use_spike': True, 'rsi_required': True, 'edge_k': 0.7351427294772318, 'edge_cap': 0.10444977528444427, 'bull_strategy': 'breakout', 'bull_bb_std_mult': 1.4192989902490702, 'bull_rsi_os': 28, 'bull_rsi_ob': 78, 'bull_adx_thresh': 7.535912662252169, 'bull_atr_min_pct': 0.014753824294337333, 'bull_atr_max_pct': 0.01922110409199687, 'bull_tp_mult': 1.6274762758198926, 'bull_tsl_mult': 0.6483235233467108, 'bull_time_stop': 300, 'bull_use_sma': False, 'bull_use_ema': True, 'bull_use_atr': False, 'bull_use_adx': True, 'bull_use_spike': False, 'bull_rsi_required': True, 'bear_strategy': 'mean_reversion', 'bear_bb_std_mult': 3.5353960324947593, 'bear_rsi_os': 14, 'bear_rsi_ob': 81, 'bear_adx_thresh': 10.338787126623764, 'bear_atr_min_pct': 0.013586411483938073, 'bear_atr_max_pct': 0.07941147319142193, 'bear_tp_mult': 1.9804340212124614, 'bear_tsl_mult': 0.26776835041777247, 'bear_time_stop': 72, 'bear_use_sma': False, 'bear_use_ema': True, 'bear_use_atr': False, 'bear_use_adx': False, 'bear_use_spike': False, 'bear_rsi_required': True, 'sideways_strategy': 'breakout', 'sideways_bb_std_mult': 1.2626757296453959, 'sideways_rsi_os': 9, 'sideways_rsi_ob': 69, 'sideways_adx_thresh': 29.574748854106826, 'sideways_atr_min_pct': 0.005837355864233841, 'sideways_atr_max_pct': 0.09588763042985413, 'sideways_tp_mult': 1.4953001300475472, 'sideways_tsl_mult': 0.7309585319922703, 'sideways_time_stop': 186, 'sideways_use_sma': False, 'sideways_use_ema': False, 'sideways_use_atr': True, 'sideways_use_adx': True, 'sideways_use_spike': False, 'sideways_rsi_required': False}.
