[I 2025-09-01 14:26:57,634] Trial 408 finished with values: [-1000000000.0, 1000000000.0] and parameters: {'p_sma': 31, 'p_std': 15, 'p_atr': 25, 'p_adx': 23, 'rsi_period': 18, 'ema1': 11, 'ema2': 16, 'slip_atr_k': 0.010874081186190996, 'slip_spread_k': 0.956354532612419, 'spread_hl_frac': 0.007594692863399848, 'bb_std_mult': 2.2433747359488567, 'rsi_os': 8, 'rsi_ob': 59, 'vol_spike': 0.039726725560743206, 'adx_thresh': 31.352927668344044, 'atr_min_pct': 0.005399653323488246, 'atr_max_pct': 0.1428198439492773, 'tp_mult': 1.171078416556078, 'tsl_mult': 0.6546414596169852, 'strategy': 'mean_reversion', 'time_stop': 132, 'use_sma': True, 'use_atr': False, 'use_adx': True, 'use_ema': True, 'use_spike': True, 'rsi_required': True, 'edge_k': 0.3347483441586753, 'edge_cap': 0.9369387951845661, 'bull_strategy': 'breakout', 'bull_bb_std_mult': 3.2952061870667153, 'bull_rsi_os': 51, 'bull_rsi_ob': 58, 'bull_adx_thresh': 32.286866719357135, 'bull_atr_min_pct': 0.012635750717716413, 'bull_atr_max_pct': 0.12940959128756116, 'bull_tp_mult': 1.6988006214217735, 'bull_tsl_mult': 0.664119741283418, 'bull_time_stop': 198, 'bull_use_sma': False, 'bull_use_ema': True, 'bull_use_atr': True, 'bull_use_adx': True, 'bull_use_spike': True, 'bull_rsi_required': True, 'bear_strategy': 'mean_reversion', 'bear_bb_std_mult': 1.3700453579843295, 'bear_rsi_os': 34, 'bear_rsi_ob': 86, 'bear_adx_thresh': 6.79072443844084, 'bear_atr_min_pct': 0.018495061744205385, 'bear_atr_max_pct': 0.02021360824384097, 'bear_tp_mult': 1.9664087056044102, 'bear_tsl_mult': 0.08931506139294818, 'bear_time_stop': 215, 'bear_use_sma': True, 'bear_use_ema': False, 'bear_use_atr': False, 'bear_use_adx': False, 'bear_use_spike': True, 'bear_rsi_required': False, 'sideways_strategy': 'mean_reversion', 'sideways_bb_std_mult': 3.0507819121499544, 'sideways_rsi_os': 29, 'sideways_rsi_ob': 90, 'sideways_adx_thresh': 25.450672184488432, 'sideways_atr_min_pct': 0.0037317217843894053, 'sideways_atr_max_pct': 0.058445304309059545, 'sideways_tp_mult': 1.101948291743379, 'sideways_tsl_mult': 0.10783196217244373, 'sideways_time_stop': 265, 'sideways_use_sma': True, 'sideways_use_ema': True, 'sideways_use_atr': False, 'sideways_use_adx': True, 'sideways_use_spike': False, 'sideways_rsi_required': True}.
[I 2025-09-01 14:26:58,168] Trial 407 finished with values: [-1000000000.0, 1000000000.0] and parameters: {'p_sma': 31, 'p_std': 30, 'p_atr': 25, 'p_adx': 8, 'rsi_period': 11, 'ema1': 11, 'ema2': 57, 'slip_atr_k': 0.010338815623433074, 'slip_spread_k': 0.2116355145075705, 'spread_hl_frac': 0.007000123286634304, 'bb_std_mult': 3.3077705845347443, 'rsi_os': 42, 'rsi_ob': 54, 'vol_spike': 0.12839707030016229, 'adx_thresh': 5.007345019590259, 'atr_min_pct': 0.010489023011645438, 'atr_max_pct': 0.1123657135761216, 'tp_mult': 2.7475870872898365, 'tsl_mult': 0.22475590999011008, 'strategy': 'mean_reversion', 'time_stop': 132, 'use_sma': True, 'use_atr': False, 'use_adx': True, 'use_ema': True, 'use_spike': True, 'rsi_required': True, 'edge_k': 0.32763536142395144, 'edge_cap': 0.9343117323084698, 'bull_strategy': 'breakout', 'bull_bb_std_mult': 3.2961962943545027, 'bull_rsi_os': 43, 'bull_rsi_ob': 75, 'bull_adx_thresh': 13.622175632901001, 'bull_atr_min_pct': 0.0293619312457925, 'bull_atr_max_pct': 0.0634326324490076, 'bull_tp_mult': 1.5310665737120195, 'bull_tsl_mult': 0.49956534891043375, 'bull_time_stop': 205, 'bull_use_sma': False, 'bull_use_ema': True, 'bull_use_atr': True, 'bull_use_adx': True, 'bull_use_spike': True, 'bull_rsi_required': True, 'bear_strategy': 'mean_reversion', 'bear_bb_std_mult': 2.456841230725583, 'bear_rsi_os': 7, 'bear_rsi_ob': 72, 'bear_adx_thresh': 6.744861127150859, 'bear_atr_min_pct': 0.01842604809268754, 'bear_atr_max_pct': 0.01948757468353935, 'bear_tp_mult': 2.4301773146995376, 'bear_tsl_mult': 0.8702183531676307, 'bear_time_stop': 97, 'bear_use_sma': True, 'bear_use_ema': False, 'bear_use_atr': False, 'bear_use_adx': False, 'bear_use_spike': True, 'bear_rsi_required': False, 'sideways_strategy': 'mean_reversion', 'sideways_bb_std_mult': 3.1354107458882967, 'sideways_rsi_os': 29, 'sideways_rsi_ob': 90, 'sideways_adx_thresh': 16.64458057465475, 'sideways_atr_min_pct': 0.00519204444519444, 'sideways_atr_max_pct': 0.10663108544324203, 'sideways_tp_mult': 1.367785342418207, 'sideways_tsl_mult': 0.10763719834259006, 'sideways_time_stop': 267, 'sideways_use_sma': True, 'sideways_use_ema': True, 'sideways_use_atr': True, 'sideways_use_adx': True, 'sideways_use_spike': False, 'sideways_rsi_required': False}.
[I 2025-09-01 14:26:58,636] Trial 405 finished with values: [-1000000000.0, 1000000000.0] and parameters: {'p_sma': 54, 'p_std': 15, 'p_atr': 25, 'p_adx': 7, 'rsi_period': 78, 'ema1': 11, 'ema2': 14, 'slip_atr_k': 0.023547120741840465, 'slip_spread_k': 0.5267062915666997, 'spread_hl_frac': 0.008714365605672004, 'bb_std_mult': 3.11542569891376, 'rsi_os': 8, 'rsi_ob': 52, 'vol_spike': 0.11305787963063718, 'adx_thresh': 6.591474435025092, 'atr_min_pct': 0.010383280834348203, 'atr_max_pct': 0.025833599706985618, 'tp_mult': 1.2613100597558726, 'tsl_mult': 0.6910511402108035, 'strategy': 'mean_reversion', 'time_stop': 271, 'use_sma': True, 'use_atr': False, 'use_adx': True, 'use_ema': True, 'use_spike': True, 'rsi_required': True, 'edge_k': 0.331193498845165, 'edge_cap': 0.9656598040658158, 'bull_strategy': 'breakout', 'bull_bb_std_mult': 3.4054681305297017, 'bull_rsi_os': 15, 'bull_rsi_ob': 79, 'bull_adx_thresh': 11.18074730073313, 'bull_atr_min_pct': 0.025566693776268305, 'bull_atr_max_pct': 0.13262792154598735, 'bull_tp_mult': 1.5819942393869602, 'bull_tsl_mult': 0.6669993573973135, 'bull_time_stop': 62, 'bull_use_sma': False, 'bull_use_ema': True, 'bull_use_atr': True, 'bull_use_adx': True, 'bull_use_spike': True, 'bull_rsi_required': True, 'bear_strategy': 'mean_reversion', 'bear_bb_std_mult': 2.0897714471556004, 'bear_rsi_os': 55, 'bear_rsi_ob': 72, 'bear_adx_thresh': 19.53320591162122, 'bear_atr_min_pct': 0.021907609568383, 'bear_atr_max_pct': 0.12035169959615476, 'bear_tp_mult': 2.141364184534055, 'bear_tsl_mult': 0.9600539993796716, 'bear_time_stop': 90, 'bear_use_sma': True, 'bear_use_ema': False, 'bear_use_atr': False, 'bear_use_adx': False, 'bear_use_spike': True, 'bear_rsi_required': False, 'sideways_strategy': 'mean_reversion', 'sideways_bb_std_mult': 3.5186239128891046, 'sideways_rsi_os': 31, 'sideways_rsi_ob': 88, 'sideways_adx_thresh': 25.53338973737277, 'sideways_atr_min_pct': 0.011149857138452996, 'sideways_atr_max_pct': 0.10654373757140982, 'sideways_tp_mult': 2.442043017169284, 'sideways_tsl_mult': 0.31840682770581746, 'sideways_time_stop': 125, 'sideways_use_sma': True, 'sideways_use_ema': True, 'sideways_use_atr': False, 'sideways_use_adx': True, 'sideways_use_spike': True, 'sideways_rsi_required': False}.
[I 2025-09-01 14:26:58,909] Trial 406 finished with values: [-0.05879930277696077, 0.05833287818629132] and parameters: {'p_sma': 31, 'p_std': 23, 'p_atr': 25, 'p_adx': 8, 'rsi_period': 81, 'ema1': 11, 'ema2': 57, 'slip_atr_k': 0.062592221598191, 'slip_spread_k': 0.9585967917815478, 'spread_hl_frac': 0.030820356453827972, 'bb_std_mult': 3.1523567114359707, 'rsi_os': 8, 'rsi_ob': 56, 'vol_spike': 0.12493004026106344, 'adx_thresh': 27.47166589441832, 'atr_min_pct': 0.013531665368621815, 'atr_max_pct': 0.03397400036050923, 'tp_mult': 1.261498016189581, 'tsl_mult': 0.7177429026337558, 'strategy': 'mean_reversion', 'time_stop': 273, 'use_sma': True, 'use_atr': False, 'use_adx': True, 'use_ema': True, 'use_spike': True, 'rsi_required': True, 'edge_k': 0.32335083246031704, 'edge_cap': 0.6564582140408729, 'bull_strategy': 'breakout', 'bull_bb_std_mult': 2.0132508320950158, 'bull_rsi_os': 15, 'bull_rsi_ob': 76, 'bull_adx_thresh': 32.6098254404321, 'bull_atr_min_pct': 0.012481040092386089, 'bull_atr_max_pct': 0.12970013650219897, 'bull_tp_mult': 2.889176210710593, 'bull_tsl_mult': 0.5074003638952818, 'bull_time_stop': 132, 'bull_use_sma': False, 'bull_use_ema': True, 'bull_use_atr': True, 'bull_use_adx': True, 'bull_use_spike': True, 'bull_rsi_required': True, 'bear_strategy': 'mean_reversion', 'bear_bb_std_mult': 2.4785673613288597, 'bear_rsi_os': 47, 'bear_rsi_ob': 86, 'bear_adx_thresh': 7.276766247357732, 'bear_atr_min_pct': 0.0032365318956274086, 'bear_atr_max_pct': 0.02000319160479682, 'bear_tp_mult': 2.4207155905552216, 'bear_tsl_mult': 0.8668506716932561, 'bear_time_stop': 214, 'bear_use_sma': True, 'bear_use_ema': False, 'bear_use_atr': False, 'bear_use_adx': False, 'bear_use_spike': True, 'bear_rsi_required': False, 'sideways_strategy': 'mean_reversion', 'sideways_bb_std_mult': 2.8211264602024433, 'sideways_rsi_os': 31, 'sideways_rsi_ob': 90, 'sideways_adx_thresh': 25.52783151446849, 'sideways_atr_min_pct': 0.005565340689356389, 'sideways_atr_max_pct': 0.08630620520795522, 'sideways_tp_mult': 1.1711247536316614, 'sideways_tsl_mult': 0.38847386999604794, 'sideways_time_stop': 266, 'sideways_use_sma': True, 'sideways_use_ema': True, 'sideways_use_atr': False, 'sideways_use_adx': True, 'sideways_use_spike': True, 'sideways_rsi_required': False}.
[I 2025-09-01 14:26:59,727] Trial 411 finished with values: [-1000000000.0, 1000000000.0] and parameters: {'p_sma': 27, 'p_std': 25, 'p_atr': 26, 'p_adx': 8, 'rsi_period': 82, 'ema1': 20, 'ema2': 59, 'slip_atr_k': 0.061115911035603945, 'slip_spread_k': 0.5614752829495092, 'spread_hl_frac': 0.036827013337350764, 'bb_std_mult': 3.3945584517465814, 'rsi_os': 44, 'rsi_ob': 50, 'vol_spike': 0.10876285274129749, 'adx_thresh': 29.35978193628783, 'atr_min_pct': 0.0027420284106991887, 'atr_max_pct': 0.10330819311529832, 'tp_mult': 1.3942631031353534, 'tsl_mult': 0.8845575080527948, 'strategy': 'mean_reversion', 'time_stop': 144, 'use_sma': True, 'use_atr': False, 'use_adx': True, 'use_ema': True, 'use_spike': True, 'rsi_required': True, 'edge_k': 0.198723664368685, 'edge_cap': 0.992982101138433, 'bull_strategy': 'mean_reversion', 'bull_bb_std_mult': 3.002652675334617, 'bull_rsi_os': 33, 'bull_rsi_ob': 72, 'bull_adx_thresh': 23.014581122404834, 'bull_atr_min_pct': 0.015476506017710275, 'bull_atr_max_pct': 0.1272637270117149, 'bull_tp_mult': 2.799125195951698, 'bull_tsl_mult': 0.42544672137545897, 'bull_time_stop': 166, 'bull_use_sma': False, 'bull_use_ema': True, 'bull_use_atr': True, 'bull_use_adx': True, 'bull_use_spike': True, 'bull_rsi_required': True, 'bear_strategy': 'mean_reversion', 'bear_bb_std_mult': 2.5532945539196623, 'bear_rsi_os': 5, 'bear_rsi_ob': 57, 'bear_adx_thresh': 7.392554718879625, 'bear_atr_min_pct': 0.01233483183356726, 'bear_atr_max_pct': 0.1457738359251452, 'bear_tp_mult': 1.091971811968721, 'bear_tsl_mult': 0.15671591011669694, 'bear_time_stop': 81, 'bear_use_sma': False, 'bear_use_ema': False, 'bear_use_atr': False, 'bear_use_adx': False, 'bear_use_spike': True, 'bear_rsi_required': False, 'sideways_strategy': 'mean_reversion', 'sideways_bb_std_mult': 3.241240854143712, 'sideways_rsi_os': 33, 'sideways_rsi_ob': 49, 'sideways_adx_thresh': 26.3421929677988, 'sideways_atr_min_pct': 0.0046491493473207034, 'sideways_atr_max_pct': 0.02876107283802703, 'sideways_tp_mult': 1.9339225334468717, 'sideways_tsl_mult': 0.38337444979554325, 'sideways_time_stop': 66, 'sideways_use_sma': True, 'sideways_use_ema': True, 'sideways_use_atr': True, 'sideways_use_adx': True, 'sideways_use_spike': False, 'sideways_rsi_required': False}.
[I 2025-09-01 14:26:59,742] Trial 409 finished with values: [-1000000000.0, 1000000000.0] and parameters: {'p_sma': 25, 'p_std': 30, 'p_atr': 28, 'p_adx': 8, 'rsi_period': 11, 'ema1': 8, 'ema2': 54, 'slip_atr_k': 0.14995708810053113, 'slip_spread_k': 0.31216964043378614, 'spread_hl_frac': 0.031010381238206795, 'bb_std_mult': 3.0949544593503235, 'rsi_os': 28, 'rsi_ob': 49, 'vol_spike': 0.12618787761026387, 'adx_thresh': 13.480613497304025, 'atr_min_pct': 0.013352768273058903, 'atr_max_pct': 0.11259732852048654, 'tp_mult': 1.3774141257370758, 'tsl_mult': 0.7239881210803039, 'strategy': 'mean_reversion', 'time_stop': 217, 'use_sma': True, 'use_atr': False, 'use_adx': True, 'use_ema': True, 'use_spike': True, 'rsi_required': True, 'edge_k': 0.1945626242260334, 'edge_cap': 0.6665101484479423, 'bull_strategy': 'breakout', 'bull_bb_std_mult': 3.006319374893949, 'bull_rsi_os': 29, 'bull_rsi_ob': 71, 'bull_adx_thresh': 11.156901850360937, 'bull_atr_min_pct': 0.013514746280535148, 'bull_atr_max_pct': 0.13311784145480562, 'bull_tp_mult': 1.52825170654166, 'bull_tsl_mult': 0.5032102303246823, 'bull_time_stop': 206, 'bull_use_sma': False, 'bull_use_ema': True, 'bull_use_atr': True, 'bull_use_adx': True, 'bull_use_spike': True, 'bull_rsi_required': True, 'bear_strategy': 'mean_reversion', 'bear_bb_std_mult': 2.1141303659014303, 'bear_rsi_os': 37, 'bear_rsi_ob': 57, 'bear_adx_thresh': 7.238511143171872, 'bear_atr_min_pct': 0.0006695869215228474, 'bear_atr_max_pct': 0.11035658679974436, 'bear_tp_mult': 2.0780978072784, 'bear_tsl_mult': 0.1603433286840562, 'bear_time_stop': 96, 'bear_use_sma': False, 'bear_use_ema': False, 'bear_use_atr': False, 'bear_use_adx': False, 'bear_use_spike': True, 'bear_rsi_required': False, 'sideways_strategy': 'mean_reversion', 'sideways_bb_std_mult': 2.286302179229162, 'sideways_rsi_os': 33, 'sideways_rsi_ob': 90, 'sideways_adx_thresh': 16.77712687628044, 'sideways_atr_min_pct': 0.004627020434313358, 'sideways_atr_max_pct': 0.11700321467014112, 'sideways_tp_mult': 2.5461182120087624, 'sideways_tsl_mult': 0.31748812816069577, 'sideways_time_stop': 42, 'sideways_use_sma': True, 'sideways_use_ema': True, 'sideways_use_atr': True, 'sideways_use_adx': True, 'sideways_use_spike': False, 'sideways_rsi_required': False}.
[I 2025-09-01 14:26:59,747] Trial 410 finished with values: [-1000000000.0, 1000000000.0] and parameters: {'p_sma': 27, 'p_std': 50, 'p_atr': 26, 'p_adx': 9, 'rsi_period': 81, 'ema1': 8, 'ema2': 54, 'slip_atr_k': 0.005870321185153042, 'slip_spread_k': 0.31707996170604635, 'spread_hl_frac': 0.004446879578176259, 'bb_std_mult': 3.371280843179707, 'rsi_os': 44, 'rsi_ob': 49, 'vol_spike': 0.11018336226161171, 'adx_thresh': 7.075602306948726, 'atr_min_pct': 0.013464233967362883, 'atr_max_pct': 0.1026161831803783, 'tp_mult': 1.3790868883312615, 'tsl_mult': 0.720677908417711, 'strategy': 'mean_reversion', 'time_stop': 106, 'use_sma': True, 'use_atr': False, 'use_adx': True, 'use_ema': True, 'use_spike': True, 'rsi_required': True, 'edge_k': 0.19068583751555387, 'edge_cap': 0.0850307796473177, 'bull_strategy': 'breakout', 'bull_bb_std_mult': 3.2091265531092033, 'bull_rsi_os': 13, 'bull_rsi_ob': 79, 'bull_adx_thresh': 23.914884088161497, 'bull_atr_min_pct': 0.011010169762938482, 'bull_atr_max_pct': 0.1333480136717456, 'bull_tp_mult': 2.999304808430382, 'bull_tsl_mult': 0.38938849957250277, 'bull_time_stop': 164, 'bull_use_sma': False, 'bull_use_ema': True, 'bull_use_atr': True, 'bull_use_adx': True, 'bull_use_spike': True, 'bull_rsi_required': True, 'bear_strategy': 'mean_reversion', 'bear_bb_std_mult': 2.62132609426366, 'bear_rsi_os': 37, 'bear_rsi_ob': 95, 'bear_adx_thresh': 7.448790794606487, 'bear_atr_min_pct': 0.003073425214240563, 'bear_atr_max_pct': 0.1101272993540983, 'bear_tp_mult': 1.0971211381744344, 'bear_tsl_mult': 0.15997078282608088, 'bear_time_stop': 82, 'bear_use_sma': False, 'bear_use_ema': False, 'bear_use_atr': False, 'bear_use_adx': False, 'bear_use_spike': True, 'bear_rsi_required': False, 'sideways_strategy': 'mean_reversion', 'sideways_bb_std_mult': 2.873255812853186, 'sideways_rsi_os': 33, 'sideways_rsi_ob': 90, 'sideways_adx_thresh': 25.921880579466674, 'sideways_atr_min_pct': 0.004756962851710678, 'sideways_atr_max_pct': 0.11635093616936101, 'sideways_tp_mult': 2.3847509199110832, 'sideways_tsl_mult': 0.32848000414865064, 'sideways_time_stop': 273, 'sideways_use_sma': True, 'sideways_use_ema': True, 'sideways_use_atr': True, 'sideways_use_adx': True, 'sideways_use_spike': False, 'sideways_rsi_required': False}.
[I 2025-09-01 14:26:59,771] Trial 412 finished with values: [-1000000000.0, 1000000000.0] and parameters: {'p_sma': 33, 'p_std': 9, 'p_atr': 26, 'p_adx': 30, 'rsi_period': 82, 'ema1': 8, 'ema2': 59, 'slip_atr_k': 0.004185570236883873, 'slip_spread_k': 0.3053576413693291, 'spread_hl_frac': 0.004392132692161231, 'bb_std_mult': 3.3825041646000216, 'rsi_os': 28, 'rsi_ob': 50, 'vol_spike': 0.10793434670465686, 'adx_thresh': 9.358299024237416, 'atr_min_pct': 0.009500703002428139, 'atr_max_pct': 0.1035915853198, 'tp_mult': 2.8083705949508966, 'tsl_mult': 0.65050076283779, 'strategy': 'mean_reversion', 'time_stop': 100, 'use_sma': False, 'use_atr': False, 'use_adx': True, 'use_ema': True, 'use_spike': True, 'rsi_required': True, 'edge_k': 0.19453563903210433, 'edge_cap': 0.9129307196772524, 'bull_strategy': 'mean_reversion', 'bull_bb_std_mult': 2.129086242222159, 'bull_rsi_os': 11, 'bull_rsi_ob': 78, 'bull_adx_thresh': 17.207754630205255, 'bull_atr_min_pct': 0.01116389449363407, 'bull_atr_max_pct': 0.1350536369657216, 'bull_tp_mult': 1.633482105616619, 'bull_tsl_mult': 0.4243598374223424, 'bull_time_stop': 245, 'bull_use_sma': False, 'bull_use_ema': True, 'bull_use_atr': True, 'bull_use_adx': False, 'bull_use_spike': True, 'bull_rsi_required': True, 'bear_strategy': 'mean_reversion', 'bear_bb_std_mult': 1.0353600865253636, 'bear_rsi_os': 37, 'bear_rsi_ob': 65, 'bear_adx_thresh': 7.45741523189729, 'bear_atr_min_pct': 0.0009410870102470152, 'bear_atr_max_pct': 0.14662699354852166, 'bear_tp_mult': 2.0817662776858015, 'bear_tsl_mult': 0.15935280613332914, 'bear_time_stop': 172, 'bear_use_sma': False, 'bear_use_ema': False, 'bear_use_atr': False, 'bear_use_adx': False, 'bear_use_spike': True, 'bear_rsi_required': False, 'sideways_strategy': 'mean_reversion', 'sideways_bb_std_mult': 2.260634541172923, 'sideways_rsi_os': 26, 'sideways_rsi_ob': 69, 'sideways_adx_thresh': 15.832519568693915, 'sideways_atr_min_pct': 0.0046759864882496335, 'sideways_atr_max_pct': 0.11661803731208024, 'sideways_tp_mult': 2.39485403857778, 'sideways_tsl_mult': 0.17046452148267627, 'sideways_time_stop': 272, 'sideways_use_sma': True, 'sideways_use_ema': True, 'sideways_use_atr': True, 'sideways_use_adx': True, 'sideways_use_spike': False, 'sideways_rsi_required': True}.
[I 2025-09-01 14:27:00,612] Trial 413 finished with values: [-1000000000.0, 1000000000.0] and parameters: {'p_sma': 59, 'p_std': 26, 'p_atr': 26, 'p_adx': 9, 'rsi_period': 71, 'ema1': 8, 'ema2': 37, 'slip_atr_k': 0.005143246150458494, 'slip_spread_k': 0.3065277815116046, 'spread_hl_frac': 0.004456343830892216, 'bb_std_mult': 2.684037886672759, 'rsi_os': 52, 'rsi_ob': 54, 'vol_spike': 0.15870910645418493, 'adx_thresh': 5.00199986449438, 'atr_min_pct': 0.00953164870277209, 'atr_max_pct': 0.03677452995457428, 'tp_mult': 1.0462162847324925, 'tsl_mult': 0.6563118476971899, 'strategy': 'mean_reversion', 'time_stop': 106, 'use_sma': False, 'use_atr': False, 'use_adx': True, 'use_ema': True, 'use_spike': True, 'rsi_required': True, 'edge_k': 0.251309815097078, 'edge_cap': 0.9190101009160929, 'bull_strategy': 'breakout', 'bull_bb_std_mult': 3.2261764053809046, 'bull_rsi_os': 27, 'bull_rsi_ob': 78, 'bull_adx_thresh': 23.738241439801293, 'bull_atr_min_pct': 0.01114597381254503, 'bull_atr_max_pct': 0.13474002858196188, 'bull_tp_mult': 1.6603845997570013, 'bull_tsl_mult': 0.43543909761953653, 'bull_time_stop': 161, 'bull_use_sma': True, 'bull_use_ema': True, 'bull_use_atr': True, 'bull_use_adx': False, 'bull_use_spike': True, 'bull_rsi_required': True, 'bear_strategy': 'mean_reversion', 'bear_bb_std_mult': 1.0430833301526696, 'bear_rsi_os': 37, 'bear_rsi_ob': 82, 'bear_adx_thresh': 8.835532676109711, 'bear_atr_min_pct': 0.0011387722989893336, 'bear_atr_max_pct': 0.10948794442436609, 'bear_tp_mult': 1.2612134128481198, 'bear_tsl_mult': 0.10561407894830234, 'bear_time_stop': 97, 'bear_use_sma': False, 'bear_use_ema': False, 'bear_use_atr': True, 'bear_use_adx': False, 'bear_use_spike': True, 'bear_rsi_required': False, 'sideways_strategy': 'mean_reversion', 'sideways_bb_std_mult': 2.9618690599743704, 'sideways_rsi_os': 54, 'sideways_rsi_ob': 68, 'sideways_adx_thresh': 24.55756198814757, 'sideways_atr_min_pct': 0.0009827715511200302, 'sideways_atr_max_pct': 0.112468149115691, 'sideways_tp_mult': 2.3835561190651564, 'sideways_tsl_mult': 0.362061726707553, 'sideways_time_stop': 273, 'sideways_use_sma': True, 'sideways_use_ema': True, 'sideways_use_atr': True, 'sideways_use_adx': True, 'sideways_use_spike': False, 'sideways_rsi_required': True}.
