[I 2025-09-01 15:11:38,672] Trial 701 finished with values: [-0.029490527242305276, 0.02953726419583553] and parameters: {'p_sma': 30, 'p_std': 14, 'p_atr': 25, 'p_adx': 8, 'rsi_period': 79, 'ema1': 9, 'ema2': 45, 'slip_atr_k': 0.0036341442409962253, 'slip_spread_k': 0.4938723006539029, 'spread_hl_frac': 0.03738957490009291, 'bb_std_mult': 3.334267988825932, 'rsi_os': 45, 'rsi_ob': 54, 'vol_spike': 0.20535444196063485, 'adx_thresh': 17.690044079004014, 'atr_min_pct': 0.012317341541372113, 'atr_max_pct': 0.07874569713735313, 'tp_mult': 1.2950466925654405, 'tsl_mult': 0.15282150289870672, 'strategy': 'mean_reversion', 'time_stop': 107, 'use_sma': False, 'use_atr': False, 'use_adx': True, 'use_ema': True, 'use_spike': True, 'rsi_required': True, 'edge_k': 0.22060565048092545, 'edge_cap': 0.9660027819878604, 'bull_strategy': 'mean_reversion', 'bull_bb_std_mult': 0.8062755071501404, 'bull_rsi_os': 14, 'bull_rsi_ob': 67, 'bull_adx_thresh': 13.241035062962776, 'bull_atr_min_pct': 0.02790713682088613, 'bull_atr_max_pct': 0.036391801899683295, 'bull_tp_mult': 1.078009800528886, 'bull_tsl_mult': 0.47324496649949827, 'bull_time_stop': 202, 'bull_use_sma': True, 'bull_use_ema': True, 'bull_use_atr': True, 'bull_use_adx': False, 'bull_use_spike': True, 'bull_rsi_required': True, 'bear_strategy': 'mean_reversion', 'bear_bb_std_mult': 2.4388307418837902, 'bear_rsi_os': 55, 'bear_rsi_ob': 55, 'bear_adx_thresh': 9.018861778434974, 'bear_atr_min_pct': 0.0035015840755923517, 'bear_atr_max_pct': 0.10974250113915629, 'bear_tp_mult': 2.2113032293911496, 'bear_tsl_mult': 0.7335310831777125, 'bear_time_stop': 288, 'bear_use_sma': True, 'bear_use_ema': False, 'bear_use_atr': False, 'bear_use_adx': False, 'bear_use_spike': True, 'bear_rsi_required': False, 'sideways_strategy': 'mean_reversion', 'sideways_bb_std_mult': 3.0589032727567016, 'sideways_rsi_os': 33, 'sideways_rsi_ob': 90, 'sideways_adx_thresh': 13.446818810384858, 'sideways_atr_min_pct': 0.003399439071614085, 'sideways_atr_max_pct': 0.11466389282764516, 'sideways_tp_mult': 2.387398066304423, 'sideways_tsl_mult': 0.37494437976513695, 'sideways_time_stop': 279, 'sideways_use_sma': True, 'sideways_use_ema': False, 'sideways_use_atr': True, 'sideways_use_adx': False, 'sideways_use_spike': False, 'sideways_rsi_required': True}.
[I 2025-09-01 15:11:39,211] Trial 699 finished with values: [0.0065071218766177275, 0.0033058889314594494] and parameters: {'p_sma': 23, 'p_std': 27, 'p_atr': 17, 'p_adx': 24, 'rsi_period': 69, 'ema1': 8, 'ema2': 56, 'slip_atr_k': 7.610973757367703e-05, 'slip_spread_k': 0.47889087287107585, 'spread_hl_frac': 0.03720545360886375, 'bb_std_mult': 1.508993571769108, 'rsi_os': 14, 'rsi_ob': 80, 'vol_spike': 0.12493152560410165, 'adx_thresh': 5.001409671169141, 'atr_min_pct': 0.009343656587534683, 'atr_max_pct': 0.13991393739431385, 'tp_mult': 1.3835580525168705, 'tsl_mult': 0.1467343798628784, 'strategy': 'mean_reversion', 'time_stop': 114, 'use_sma': False, 'use_atr': True, 'use_adx': True, 'use_ema': True, 'use_spike': True, 'rsi_required': True, 'edge_k': 0.22820398845073583, 'edge_cap': 0.43491032797914614, 'bull_strategy': 'breakout', 'bull_bb_std_mult': 3.2079569863942705, 'bull_rsi_os': 13, 'bull_rsi_ob': 50, 'bull_adx_thresh': 23.525573125808897, 'bull_atr_min_pct': 0.02859440010981322, 'bull_atr_max_pct': 0.12526342346400504, 'bull_tp_mult': 1.3660602333290588, 'bull_tsl_mult': 0.4734813353353069, 'bull_time_stop': 59, 'bull_use_sma': True, 'bull_use_ema': True, 'bull_use_atr': True, 'bull_use_adx': True, 'bull_use_spike': True, 'bull_rsi_required': True, 'bear_strategy': 'mean_reversion', 'bear_bb_std_mult': 2.8110281733349045, 'bear_rsi_os': 35, 'bear_rsi_ob': 55, 'bear_adx_thresh': 28.186992752460572, 'bear_atr_min_pct': 0.003469875755872256, 'bear_atr_max_pct': 0.10228626626719059, 'bear_tp_mult': 2.0712355414993295, 'bear_tsl_mult': 0.0838808440905236, 'bear_time_stop': 125, 'bear_use_sma': True, 'bear_use_ema': False, 'bear_use_atr': False, 'bear_use_adx': True, 'bear_use_spike': True, 'bear_rsi_required': False, 'sideways_strategy': 'mean_reversion', 'sideways_bb_std_mult': 2.3953254585743333, 'sideways_rsi_os': 33, 'sideways_rsi_ob': 89, 'sideways_adx_thresh': 23.786600438986863, 'sideways_atr_min_pct': 0.023048223411330605, 'sideways_atr_max_pct': 0.09442716718937325, 'sideways_tp_mult': 1.0140105673494848, 'sideways_tsl_mult': 0.7970752743405831, 'sideways_time_stop': 257, 'sideways_use_sma': False, 'sideways_use_ema': False, 'sideways_use_atr': True, 'sideways_use_adx': False, 'sideways_use_spike': False, 'sideways_rsi_required': True}.
[I 2025-09-01 15:11:42,059] Trial 704 finished with values: [-1000000000.0, 1000000000.0] and parameters: {'p_sma': 34, 'p_std': 27, 'p_atr': 26, 'p_adx': 23, 'rsi_period': 77, 'ema1': 9, 'ema2': 60, 'slip_atr_k': 0.04692669166467521, 'slip_spread_k': 0.3959605461439787, 'spread_hl_frac': 0.008303610947606926, 'bb_std_mult': 2.2444199686050563, 'rsi_os': 41, 'rsi_ob': 80, 'vol_spike': 0.11272311847979526, 'adx_thresh': 7.680222836301203, 'atr_min_pct': 0.011147039014364356, 'atr_max_pct': 0.04191922558948205, 'tp_mult': 1.1593423587722393, 'tsl_mult': 0.7302983600575692, 'strategy': 'mean_reversion', 'time_stop': 102, 'use_sma': True, 'use_atr': False, 'use_adx': True, 'use_ema': True, 'use_spike': True, 'rsi_required': True, 'edge_k': 0.22911915964661309, 'edge_cap': 0.9647428773115581, 'bull_strategy': 'breakout', 'bull_bb_std_mult': 3.2234174218814804, 'bull_rsi_os': 15, 'bull_rsi_ob': 81, 'bull_adx_thresh': 10.825580772967793, 'bull_atr_min_pct': 0.012357215020611956, 'bull_atr_max_pct': 0.12776907643178462, 'bull_tp_mult': 2.777060613371138, 'bull_tsl_mult': 0.5055810902646747, 'bull_time_stop': 200, 'bull_use_sma': False, 'bull_use_ema': True, 'bull_use_atr': True, 'bull_use_adx': False, 'bull_use_spike': True, 'bull_rsi_required': True, 'bear_strategy': 'mean_reversion', 'bear_bb_std_mult': 1.3486967888242196, 'bear_rsi_os': 16, 'bear_rsi_ob': 55, 'bear_adx_thresh': 7.1972251785813395, 'bear_atr_min_pct': 0.003225492386689983, 'bear_atr_max_pct': 0.11002500259137861, 'bear_tp_mult': 2.304603640999488, 'bear_tsl_mult': 0.2725105451308855, 'bear_time_stop': 65, 'bear_use_sma': True, 'bear_use_ema': False, 'bear_use_atr': False, 'bear_use_adx': False, 'bear_use_spike': True, 'bear_rsi_required': False, 'sideways_strategy': 'mean_reversion', 'sideways_bb_std_mult': 2.985247978410203, 'sideways_rsi_os': 32, 'sideways_rsi_ob': 89, 'sideways_adx_thresh': 12.997618116633362, 'sideways_atr_min_pct': 0.0021189260715855293, 'sideways_atr_max_pct': 0.11721028670919148, 'sideways_tp_mult': 2.4345713811581216, 'sideways_tsl_mult': 0.4334352524495846, 'sideways_time_stop': 44, 'sideways_use_sma': True, 'sideways_use_ema': True, 'sideways_use_atr': True, 'sideways_use_adx': True, 'sideways_use_spike': False, 'sideways_rsi_required': True}.
[I 2025-09-01 15:12:18,988] Trial 708 finished with values: [-0.06266290585745082, 0.06299247898919659] and parameters: {'p_sma': 35, 'p_std': 23, 'p_atr': 28, 'p_adx': 10, 'rsi_period': 75, 'ema1': 10, 'ema2': 57, 'slip_atr_k': 0.02667793330577844, 'slip_spread_k': 0.40407338141633586, 'spread_hl_frac': 0.007165100012810473, 'bb_std_mult': 3.578493827385932, 'rsi_os': 14, 'rsi_ob': 56, 'vol_spike': 0.1427210239562287, 'adx_thresh': 8.215471901124731, 'atr_min_pct': 0.013249430409521567, 'atr_max_pct': 0.049905390944502276, 'tp_mult': 1.5578952425812767, 'tsl_mult': 0.7644141991975895, 'strategy': 'mean_reversion', 'time_stop': 180, 'use_sma': False, 'use_atr': False, 'use_adx': True, 'use_ema': True, 'use_spike': True, 'rsi_required': True, 'edge_k': 0.13592918586007344, 'edge_cap': 0.9829882948385537, 'bull_strategy': 'breakout', 'bull_bb_std_mult': 3.3817181601717228, 'bull_rsi_os': 50, 'bull_rsi_ob': 82, 'bull_adx_thresh': 8.65716190877499, 'bull_atr_min_pct': 0.015237758564752579, 'bull_atr_max_pct': 0.1351067258789626, 'bull_tp_mult': 1.4830946419162678, 'bull_tsl_mult': 0.8813433423261166, 'bull_time_stop': 173, 'bull_use_sma': True, 'bull_use_ema': True, 'bull_use_atr': True, 'bull_use_adx': True, 'bull_use_spike': True, 'bull_rsi_required': True, 'bear_strategy': 'mean_reversion', 'bear_bb_std_mult': 2.765446992277746, 'bear_rsi_os': 38, 'bear_rsi_ob': 81, 'bear_adx_thresh': 7.732199155048955, 'bear_atr_min_pct': 0.00021145669027400164, 'bear_atr_max_pct': 0.0177551342132573, 'bear_tp_mult': 2.178486650059631, 'bear_tsl_mult': 0.31008060480397176, 'bear_time_stop': 76, 'bear_use_sma': True, 'bear_use_ema': False, 'bear_use_atr': False, 'bear_use_adx': False, 'bear_use_spike': True, 'bear_rsi_required': False, 'sideways_strategy': 'mean_reversion', 'sideways_bb_std_mult': 2.8715965674796635, 'sideways_rsi_os': 55, 'sideways_rsi_ob': 93, 'sideways_adx_thresh': 22.486296145134286, 'sideways_atr_min_pct': 0.0026084578675427917, 'sideways_atr_max_pct': 0.12026521420704711, 'sideways_tp_mult': 1.3845945637901802, 'sideways_tsl_mult': 0.476580712857036, 'sideways_time_stop': 288, 'sideways_use_sma': True, 'sideways_use_ema': False, 'sideways_use_atr': False, 'sideways_use_adx': True, 'sideways_use_spike': False, 'sideways_rsi_required': False}.
[I 2025-09-01 15:12:20,318] Trial 707 finished with values: [-0.08400460059901449, 0.08388864865441914] and parameters: {'p_sma': 34, 'p_std': 23, 'p_atr': 28, 'p_adx': 10, 'rsi_period': 76, 'ema1': 10, 'ema2': 57, 'slip_atr_k': 0.0284371250428833, 'slip_spread_k': 0.40423002768104166, 'spread_hl_frac': 0.008486100363618116, 'bb_std_mult': 3.5968933618721333, 'rsi_os': 14, 'rsi_ob': 55, 'vol_spike': 0.13639343173439594, 'adx_thresh': 8.164958077460367, 'atr_min_pct': 0.013132932358552675, 'atr_max_pct': 0.05047238291714473, 'tp_mult': 1.7035129470419683, 'tsl_mult': 0.7642827000662904, 'strategy': 'mean_reversion', 'time_stop': 183, 'use_sma': False, 'use_atr': False, 'use_adx': True, 'use_ema': True, 'use_spike': True, 'rsi_required': True, 'edge_k': 0.11200620889890378, 'edge_cap': 0.9913003533958731, 'bull_strategy': 'breakout', 'bull_bb_std_mult': 3.3550867759530663, 'bull_rsi_os': 50, 'bull_rsi_ob': 82, 'bull_adx_thresh': 13.511943841017128, 'bull_atr_min_pct': 0.014434752439920697, 'bull_atr_max_pct': 0.13980680226901207, 'bull_tp_mult': 1.4604600739749218, 'bull_tsl_mult': 0.8943456310024123, 'bull_time_stop': 171, 'bull_use_sma': True, 'bull_use_ema': True, 'bull_use_atr': True, 'bull_use_adx': True, 'bull_use_spike': True, 'bull_rsi_required': True, 'bear_strategy': 'mean_reversion', 'bear_bb_std_mult': 2.112418908931828, 'bear_rsi_os': 38, 'bear_rsi_ob': 84, 'bear_adx_thresh': 7.427351110258733, 'bear_atr_min_pct': 0.0002145218782004278, 'bear_atr_max_pct': 0.021581377181774664, 'bear_tp_mult': 2.2084004936812818, 'bear_tsl_mult': 0.29606974675343317, 'bear_time_stop': 73, 'bear_use_sma': True, 'bear_use_ema': False, 'bear_use_atr': False, 'bear_use_adx': False, 'bear_use_spike': True, 'bear_rsi_required': False, 'sideways_strategy': 'mean_reversion', 'sideways_bb_std_mult': 2.868217228945767, 'sideways_rsi_os': 54, 'sideways_rsi_ob': 92, 'sideways_adx_thresh': 22.69258368479986, 'sideways_atr_min_pct': 0.0022348785318464627, 'sideways_atr_max_pct': 0.12011347666731376, 'sideways_tp_mult': 1.3523666221748278, 'sideways_tsl_mult': 0.5012225079219342, 'sideways_time_stop': 297, 'sideways_use_sma': True, 'sideways_use_ema': False, 'sideways_use_atr': False, 'sideways_use_adx': True, 'sideways_use_spike': False, 'sideways_rsi_required': False}.
[I 2025-09-01 15:12:20,887] Trial 706 finished with values: [-0.04451436024188682, 0.044514186962467304] and parameters: {'p_sma': 34, 'p_std': 31, 'p_atr': 26, 'p_adx': 7, 'rsi_period': 77, 'ema1': 27, 'ema2': 21, 'slip_atr_k': 0.048225385737222085, 'slip_spread_k': 0.400150570810555, 'spread_hl_frac': 0.008585208919598184, 'bb_std_mult': 3.430795253918315, 'rsi_os': 49, 'rsi_ob': 51, 'vol_spike': 0.11384320571976968, 'adx_thresh': 5.563754147113254, 'atr_min_pct': 0.011357746379574476, 'atr_max_pct': 0.09457995641310196, 'tp_mult': 1.395747991909578, 'tsl_mult': 0.707748974967223, 'strategy': 'mean_reversion', 'time_stop': 230, 'use_sma': True, 'use_atr': False, 'use_adx': True, 'use_ema': True, 'use_spike': True, 'rsi_required': True, 'edge_k': 0.1193390932922554, 'edge_cap': 0.48281606872705357, 'bull_strategy': 'breakout', 'bull_bb_std_mult': 3.17497283493682, 'bull_rsi_os': 12, 'bull_rsi_ob': 81, 'bull_adx_thresh': 11.010357707698882, 'bull_atr_min_pct': 0.012234970978799397, 'bull_atr_max_pct': 0.05747407574524407, 'bull_tp_mult': 1.7245741049119823, 'bull_tsl_mult': 0.6536054879110225, 'bull_time_stop': 273, 'bull_use_sma': False, 'bull_use_ema': True, 'bull_use_atr': True, 'bull_use_adx': True, 'bull_use_spike': True, 'bull_rsi_required': True, 'bear_strategy': 'mean_reversion', 'bear_bb_std_mult': 1.3379800891600766, 'bear_rsi_os': 47, 'bear_rsi_ob': 55, 'bear_adx_thresh': 7.241630365975451, 'bear_atr_min_pct': 0.0027071303006435273, 'bear_atr_max_pct': 0.10233055701804297, 'bear_tp_mult': 1.5930155473507397, 'bear_tsl_mult': 0.33579414052507617, 'bear_time_stop': 75, 'bear_use_sma': False, 'bear_use_ema': False, 'bear_use_atr': False, 'bear_use_adx': False, 'bear_use_spike': True, 'bear_rsi_required': True, 'sideways_strategy': 'mean_reversion', 'sideways_bb_std_mult': 1.3081470992035398, 'sideways_rsi_os': 30, 'sideways_rsi_ob': 92, 'sideways_adx_thresh': 5.452693094018066, 'sideways_atr_min_pct': 0.023069642157327916, 'sideways_atr_max_pct': 0.1190939957138067, 'sideways_tp_mult': 2.428947323224214, 'sideways_tsl_mult': 0.3999968300970197, 'sideways_time_stop': 253, 'sideways_use_sma': True, 'sideways_use_ema': True, 'sideways_use_atr': True, 'sideways_use_adx': True, 'sideways_use_spike': False, 'sideways_rsi_required': False}.
[I 2025-09-01 15:12:21,387] Trial 705 finished with values: [-1000000000.0, 1000000000.0] and parameters: {'p_sma': 7, 'p_std': 31, 'p_atr': 21, 'p_adx': 23, 'rsi_period': 77, 'ema1': 30, 'ema2': 54, 'slip_atr_k': 0.08023923178980477, 'slip_spread_k': 0.5104198605187255, 'spread_hl_frac': 0.008468059198818007, 'bb_std_mult': 3.3165302895153825, 'rsi_os': 19, 'rsi_ob': 80, 'vol_spike': 0.11298775230987473, 'adx_thresh': 5.814186912873297, 'atr_min_pct': 0.007723212105367082, 'atr_max_pct': 0.04332800249073467, 'tp_mult': 2.8937017213868, 'tsl_mult': 0.7026323219747849, 'strategy': 'mean_reversion', 'time_stop': 231, 'use_sma': True, 'use_atr': False, 'use_adx': True, 'use_ema': True, 'use_spike': True, 'rsi_required': True, 'edge_k': 0.11161603468140911, 'edge_cap': 0.9604321675939869, 'bull_strategy': 'mean_reversion', 'bull_bb_std_mult': 1.6135049758450877, 'bull_rsi_os': 12, 'bull_rsi_ob': 81, 'bull_adx_thresh': 11.10706053904288, 'bull_atr_min_pct': 0.025056468992826205, 'bull_atr_max_pct': 0.1259826274566839, 'bull_tp_mult': 2.9541606903857254, 'bull_tsl_mult': 0.7028405622384399, 'bull_time_stop': 179, 'bull_use_sma': False, 'bull_use_ema': True, 'bull_use_atr': True, 'bull_use_adx': False, 'bull_use_spike': True, 'bull_rsi_required': True, 'bear_strategy': 'mean_reversion', 'bear_bb_std_mult': 2.3369982392280195, 'bear_rsi_os': 49, 'bear_rsi_ob': 55, 'bear_adx_thresh': 7.092116692541749, 'bear_atr_min_pct': 0.020071171712586152, 'bear_atr_max_pct': 0.12062783357125081, 'bear_tp_mult': 2.23533310752011, 'bear_tsl_mult': 0.33847025214300386, 'bear_time_stop': 287, 'bear_use_sma': False, 'bear_use_ema': False, 'bear_use_atr': False, 'bear_use_adx': False, 'bear_use_spike': True, 'bear_rsi_required': False, 'sideways_strategy': 'mean_reversion', 'sideways_bb_std_mult': 3.157736010421599, 'sideways_rsi_os': 30, 'sideways_rsi_ob': 91, 'sideways_adx_thresh': 33.53963838439012, 'sideways_atr_min_pct': 0.0030946008217653236, 'sideways_atr_max_pct': 0.0549097717431857, 'sideways_tp_mult': 2.4317168036095427, 'sideways_tsl_mult': 0.4301220223159429, 'sideways_time_stop': 255, 'sideways_use_sma': True, 'sideways_use_ema': True, 'sideways_use_atr': True, 'sideways_use_adx': True, 'sideways_use_spike': False, 'sideways_rsi_required': False}.
[I 2025-09-01 15:12:55,332] Trial 712 finished with values: [-0.11263429470739161, 0.11260832622535714] and parameters: {'p_sma': 36, 'p_std': 24, 'p_atr': 28, 'p_adx': 9, 'rsi_period': 77, 'ema1': 11, 'ema2': 56, 'slip_atr_k': 0.02614556379217381, 'slip_spread_k': 0.3753369326060999, 'spread_hl_frac': 0.0061898889879118055, 'bb_std_mult': 3.5903936715445326, 'rsi_os': 12, 'rsi_ob': 54, 'vol_spike': 0.08921743021827219, 'adx_thresh': 7.816177655056047, 'atr_min_pct': 0.01295369817511101, 'atr_max_pct': 0.0454296360129222, 'tp_mult': 1.6218029155974922, 'tsl_mult': 0.7830175120184552, 'strategy': 'mean_reversion', 'time_stop': 163, 'use_sma': False, 'use_atr': False, 'use_adx': True, 'use_ema': True, 'use_spike': True, 'rsi_required': True, 'edge_k': 0.1713256764496468, 'edge_cap': 0.9985227363079549, 'bull_strategy': 'breakout', 'bull_bb_std_mult': 3.2844733635979453, 'bull_rsi_os': 49, 'bull_rsi_ob': 82, 'bull_adx_thresh': 7.754389253942818, 'bull_atr_min_pct': 0.014828491306897533, 'bull_atr_max_pct': 0.012243939859580385, 'bull_tp_mult': 1.5286811188853815, 'bull_tsl_mult': 0.6056747027789539, 'bull_time_stop': 180, 'bull_use_sma': True, 'bull_use_ema': False, 'bull_use_atr': True, 'bull_use_adx': True, 'bull_use_spike': True, 'bull_rsi_required': True, 'bear_strategy': 'mean_reversion', 'bear_bb_std_mult': 2.2095776496603166, 'bear_rsi_os': 31, 'bear_rsi_ob': 83, 'bear_adx_thresh': 8.14004470546192, 'bear_atr_min_pct': 0.0001254520877433207, 'bear_atr_max_pct': 0.11810074050134052, 'bear_tp_mult': 2.1655797990614167, 'bear_tsl_mult': 0.29380765348631027, 'bear_time_stop': 89, 'bear_use_sma': True, 'bear_use_ema': False, 'bear_use_atr': False, 'bear_use_adx': False, 'bear_use_spike': True, 'bear_rsi_required': False, 'sideways_strategy': 'mean_reversion', 'sideways_bb_std_mult': 2.7889140807697244, 'sideways_rsi_os': 55, 'sideways_rsi_ob': 93, 'sideways_adx_thresh': 22.99935622672238, 'sideways_atr_min_pct': 0.0015682534450064721, 'sideways_atr_max_pct': 0.11648397610239783, 'sideways_tp_mult': 1.4086978044955878, 'sideways_tsl_mult': 0.4720591938615381, 'sideways_time_stop': 285, 'sideways_use_sma': True, 'sideways_use_ema': False, 'sideways_use_atr': False, 'sideways_use_adx': True, 'sideways_use_spike': False, 'sideways_rsi_required': False}.
[I 2025-09-01 15:12:55,537] Trial 711 finished with values: [-0.10612883593003497, 0.10610181013016488] and parameters: {'p_sma': 36, 'p_std': 23, 'p_atr': 28, 'p_adx': 9, 'rsi_period': 77, 'ema1': 11, 'ema2': 56, 'slip_atr_k': 0.029190345513766786, 'slip_spread_k': 0.4240127681089175, 'spread_hl_frac': 0.009406424361177243, 'bb_std_mult': 3.5936518630596668, 'rsi_os': 20, 'rsi_ob': 55, 'vol_spike': 0.13499311968950267, 'adx_thresh': 7.3672254741060925, 'atr_min_pct': 0.01296623623013128, 'atr_max_pct': 0.04568292547540531, 'tp_mult': 1.2431369853589327, 'tsl_mult': 0.7821451791184342, 'strategy': 'mean_reversion', 'time_stop': 185, 'use_sma': False, 'use_atr': False, 'use_adx': True, 'use_ema': True, 'use_spike': True, 'rsi_required': True, 'edge_k': 0.149693665133264, 'edge_cap': 0.9967857450993738, 'bull_strategy': 'breakout', 'bull_bb_std_mult': 3.297972161092817, 'bull_rsi_os': 49, 'bull_rsi_ob': 84, 'bull_adx_thresh': 8.795219144662676, 'bull_atr_min_pct': 0.014683303252138789, 'bull_atr_max_pct': 0.13745511721967268, 'bull_tp_mult': 1.4955428403441902, 'bull_tsl_mult': 0.5882138396533315, 'bull_time_stop': 176, 'bull_use_sma': True, 'bull_use_ema': False, 'bull_use_atr': True, 'bull_use_adx': True, 'bull_use_spike': True, 'bull_rsi_required': True, 'bear_strategy': 'mean_reversion', 'bear_bb_std_mult': 2.2101225295996056, 'bear_rsi_os': 32, 'bear_rsi_ob': 82, 'bear_adx_thresh': 8.09947791704716, 'bear_atr_min_pct': 0.00020191069109186431, 'bear_atr_max_pct': 0.018491713021588724, 'bear_tp_mult': 2.159635519121037, 'bear_tsl_mult': 0.31724608678284766, 'bear_time_stop': 80, 'bear_use_sma': True, 'bear_use_ema': False, 'bear_use_atr': False, 'bear_use_adx': False, 'bear_use_spike': True, 'bear_rsi_required': False, 'sideways_strategy': 'mean_reversion', 'sideways_bb_std_mult': 2.7899541138466994, 'sideways_rsi_os': 55, 'sideways_rsi_ob': 91, 'sideways_adx_thresh': 22.991331111190462, 'sideways_atr_min_pct': 0.0016203093203413037, 'sideways_atr_max_pct': 0.11719092011069919, 'sideways_tp_mult': 1.4057422172417506, 'sideways_tsl_mult': 0.48115357398292036, 'sideways_time_stop': 294, 'sideways_use_sma': True, 'sideways_use_ema': False, 'sideways_use_atr': False, 'sideways_use_adx': True, 'sideways_use_spike': False, 'sideways_rsi_required': False}.
