[I 2025-09-01 15:06:58,919] Trial 676 finished with values: [-1000000000.0, 1000000000.0] and parameters: {'p_sma': 43, 'p_std': 26, 'p_atr': 26, 'p_adx': 11, 'rsi_period': 80, 'ema1': 20, 'ema2': 47, 'slip_atr_k': 0.053376684725904566, 'slip_spread_k': 0.08972129524760303, 'spread_hl_frac': 0.007274538867023846, 'bb_std_mult': 3.4350022372348565, 'rsi_os': 43, 'rsi_ob': 88, 'vol_spike': 0.15444348743680084, 'adx_thresh': 5.019257025167505, 'atr_min_pct': 0.013393068968782383, 'atr_max_pct': 0.03603374272349955, 'tp_mult': 2.8475649075466962, 'tsl_mult': 0.7134662111641765, 'strategy': 'mean_reversion', 'time_stop': 106, 'use_sma': True, 'use_atr': False, 'use_adx': True, 'use_ema': True, 'use_spike': True, 'rsi_required': True, 'edge_k': 0.3047565706299956, 'edge_cap': 0.9244620026370632, 'bull_strategy': 'breakout', 'bull_bb_std_mult': 2.3956052501002607, 'bull_rsi_os': 40, 'bull_rsi_ob': 79, 'bull_adx_thresh': 25.407258009927183, 'bull_atr_min_pct': 0.011911488738398401, 'bull_atr_max_pct': 0.12721246382556692, 'bull_tp_mult': 2.650354259431887, 'bull_tsl_mult': 0.40892357600419027, 'bull_time_stop': 135, 'bull_use_sma': True, 'bull_use_ema': True, 'bull_use_atr': True, 'bull_use_adx': False, 'bull_use_spike': True, 'bull_rsi_required': True, 'bear_strategy': 'mean_reversion', 'bear_bb_std_mult': 2.5721215332824583, 'bear_rsi_os': 34, 'bear_rsi_ob': 60, 'bear_adx_thresh': 8.004384169479913, 'bear_atr_min_pct': 0.019013674140124733, 'bear_atr_max_pct': 0.12804758204063393, 'bear_tp_mult': 2.1804838244388014, 'bear_tsl_mult': 0.706553524742003, 'bear_time_stop': 89, 'bear_use_sma': False, 'bear_use_ema': False, 'bear_use_atr': False, 'bear_use_adx': False, 'bear_use_spike': True, 'bear_rsi_required': False, 'sideways_strategy': 'mean_reversion', 'sideways_bb_std_mult': 3.1008823544690998, 'sideways_rsi_os': 30, 'sideways_rsi_ob': 58, 'sideways_adx_thresh': 25.52420534530386, 'sideways_atr_min_pct': 0.020065999784625053, 'sideways_atr_max_pct': 0.1065117688548397, 'sideways_tp_mult': 1.7460131562560361, 'sideways_tsl_mult': 0.3987067165281173, 'sideways_time_stop': 249, 'sideways_use_sma': True, 'sideways_use_ema': False, 'sideways_use_atr': True, 'sideways_use_adx': True, 'sideways_use_spike': False, 'sideways_rsi_required': False}.
[I 2025-09-01 15:06:59,439] Trial 677 finished with values: [-1000000000.0, 1000000000.0] and parameters: {'p_sma': 25, 'p_std': 26, 'p_atr': 18, 'p_adx': 11, 'rsi_period': 78, 'ema1': 12, 'ema2': 47, 'slip_atr_k': 0.057230539300795163, 'slip_spread_k': 0.6109439181714609, 'spread_hl_frac': 0.00896544852238411, 'bb_std_mult': 3.4723095427989557, 'rsi_os': 29, 'rsi_ob': 88, 'vol_spike': 0.1397300190323198, 'adx_thresh': 7.22290617117404, 'atr_min_pct': 0.02515465327458169, 'atr_max_pct': 0.03621192109001852, 'tp_mult': 2.235648220168178, 'tsl_mult': 0.7134414896357025, 'strategy': 'mean_reversion', 'time_stop': 106, 'use_sma': True, 'use_atr': False, 'use_adx': True, 'use_ema': True, 'use_spike': False, 'rsi_required': True, 'edge_k': 0.20949156396491264, 'edge_cap': 0.9154316371960649, 'bull_strategy': 'breakout', 'bull_bb_std_mult': 2.4419592502294942, 'bull_rsi_os': 17, 'bull_rsi_ob': 74, 'bull_adx_thresh': 7.380098782232782, 'bull_atr_min_pct': 0.01179636781778843, 'bull_atr_max_pct': 0.12788689068400955, 'bull_tp_mult': 1.6311627315211261, 'bull_tsl_mult': 0.4814184569847644, 'bull_time_stop': 145, 'bull_use_sma': True, 'bull_use_ema': True, 'bull_use_atr': False, 'bull_use_adx': False, 'bull_use_spike': True, 'bull_rsi_required': True, 'bear_strategy': 'mean_reversion', 'bear_bb_std_mult': 2.5869534320070984, 'bear_rsi_os': 34, 'bear_rsi_ob': 60, 'bear_adx_thresh': 15.278254114497745, 'bear_atr_min_pct': 0.020963162576894324, 'bear_atr_max_pct': 0.11882568689068386, 'bear_tp_mult': 2.0789443243592927, 'bear_tsl_mult': 0.17819214842742, 'bear_time_stop': 78, 'bear_use_sma': False, 'bear_use_ema': False, 'bear_use_atr': False, 'bear_use_adx': False, 'bear_use_spike': True, 'bear_rsi_required': False, 'sideways_strategy': 'breakout', 'sideways_bb_std_mult': 3.111428195246317, 'sideways_rsi_os': 30, 'sideways_rsi_ob': 58, 'sideways_adx_thresh': 25.645708147587563, 'sideways_atr_min_pct': 0.00332534303200221, 'sideways_atr_max_pct': 0.04061109161857614, 'sideways_tp_mult': 2.6705842235770554, 'sideways_tsl_mult': 0.4902302734616586, 'sideways_time_stop': 261, 'sideways_use_sma': True, 'sideways_use_ema': False, 'sideways_use_atr': True, 'sideways_use_adx': True, 'sideways_use_spike': False, 'sideways_rsi_required': False}.
[I 2025-09-01 15:07:00,478] Trial 674 finished with values: [-1000000000.0, 1000000000.0] and parameters: {'p_sma': 14, 'p_std': 22, 'p_atr': 16, 'p_adx': 7, 'rsi_period': 77, 'ema1': 8, 'ema2': 11, 'slip_atr_k': 0.0074444623647385326, 'slip_spread_k': 0.6026016561692082, 'spread_hl_frac': 0.011793331216391301, 'bb_std_mult': 1.0052809925512014, 'rsi_os': 44, 'rsi_ob': 78, 'vol_spike': 0.08397717037506466, 'adx_thresh': 6.0056735392315925, 'atr_min_pct': 0.005734735211449307, 'atr_max_pct': 0.033875907573818184, 'tp_mult': 2.8533330864205806, 'tsl_mult': 0.48672674753392614, 'strategy': 'mean_reversion', 'time_stop': 138, 'use_sma': True, 'use_atr': False, 'use_adx': True, 'use_ema': True, 'use_spike': True, 'rsi_required': False, 'edge_k': 0.30396724318819446, 'edge_cap': 0.6073928370783823, 'bull_strategy': 'breakout', 'bull_bb_std_mult': 3.2326629261170785, 'bull_rsi_os': 17, 'bull_rsi_ob': 76, 'bull_adx_thresh': 25.49535005515068, 'bull_atr_min_pct': 0.01220763404434257, 'bull_atr_max_pct': 0.12723715586936454, 'bull_tp_mult': 2.0753649188915717, 'bull_tsl_mult': 0.05206114782571358, 'bull_time_stop': 135, 'bull_use_sma': False, 'bull_use_ema': True, 'bull_use_atr': True, 'bull_use_adx': False, 'bull_use_spike': True, 'bull_rsi_required': True, 'bear_strategy': 'mean_reversion', 'bear_bb_std_mult': 2.568964845696888, 'bear_rsi_os': 34, 'bear_rsi_ob': 54, 'bear_adx_thresh': 8.267926597944244, 'bear_atr_min_pct': 0.0038363661615958785, 'bear_atr_max_pct': 0.02554827445251172, 'bear_tp_mult': 2.0115391919654058, 'bear_tsl_mult': 0.29420831996902364, 'bear_time_stop': 260, 'bear_use_sma': False, 'bear_use_ema': True, 'bear_use_atr': False, 'bear_use_adx': False, 'bear_use_spike': True, 'bear_rsi_required': False, 'sideways_strategy': 'mean_reversion', 'sideways_bb_std_mult': 3.109302997305207, 'sideways_rsi_os': 29, 'sideways_rsi_ob': 75, 'sideways_adx_thresh': 7.6483429495203, 'sideways_atr_min_pct': 0.021749476119896534, 'sideways_atr_max_pct': 0.05758049439520272, 'sideways_tp_mult': 1.7558614515541098, 'sideways_tsl_mult': 0.7000055246586954, 'sideways_time_stop': 249, 'sideways_use_sma': True, 'sideways_use_ema': True, 'sideways_use_atr': True, 'sideways_use_adx': True, 'sideways_use_spike': False, 'sideways_rsi_required': True}.
[I 2025-09-01 15:07:50,481] Trial 680 finished with values: [-1000000000.0, 1000000000.0] and parameters: {'p_sma': 35, 'p_std': 28, 'p_atr': 12, 'p_adx': 29, 'rsi_period': 13, 'ema1': 9, 'ema2': 54, 'slip_atr_k': 0.026062457767666695, 'slip_spread_k': 0.5236999404723798, 'spread_hl_frac': 0.04585066036264083, 'bb_std_mult': 0.8204213270961542, 'rsi_os': 25, 'rsi_ob': 55, 'vol_spike': 0.11640956613543463, 'adx_thresh': 5.947194706322437, 'atr_min_pct': 0.009981295909626674, 'atr_max_pct': 0.03159668725687254, 'tp_mult': 1.318259863037254, 'tsl_mult': 0.6194581095739833, 'strategy': 'mean_reversion', 'time_stop': 123, 'use_sma': True, 'use_atr': False, 'use_adx': False, 'use_ema': True, 'use_spike': True, 'rsi_required': True, 'edge_k': 0.24893514318643375, 'edge_cap': 0.9828854031013579, 'bull_strategy': 'mean_reversion', 'bull_bb_std_mult': 3.219279422009079, 'bull_rsi_os': 12, 'bull_rsi_ob': 87, 'bull_adx_thresh': 34.946219529645134, 'bull_atr_min_pct': 0.01276202312003467, 'bull_atr_max_pct': 0.03388087785432291, 'bull_tp_mult': 1.7739420045872707, 'bull_tsl_mult': 0.508110020111335, 'bull_time_stop': 121, 'bull_use_sma': False, 'bull_use_ema': True, 'bull_use_atr': True, 'bull_use_adx': True, 'bull_use_spike': False, 'bull_rsi_required': False, 'bear_strategy': 'mean_reversion', 'bear_bb_std_mult': 1.4281120689115467, 'bear_rsi_os': 41, 'bear_rsi_ob': 55, 'bear_adx_thresh': 11.793907245854925, 'bear_atr_min_pct': 0.007556572758600946, 'bear_atr_max_pct': 0.10899086946782892, 'bear_tp_mult': 1.4770130885067656, 'bear_tsl_mult': 0.308020263351802, 'bear_time_stop': 279, 'bear_use_sma': False, 'bear_use_ema': False, 'bear_use_atr': False, 'bear_use_adx': True, 'bear_use_spike': True, 'bear_rsi_required': False, 'sideways_strategy': 'mean_reversion', 'sideways_bb_std_mult': 2.921856395898937, 'sideways_rsi_os': 32, 'sideways_rsi_ob': 91, 'sideways_adx_thresh': 11.965729152318758, 'sideways_atr_min_pct': 0.008356008384717907, 'sideways_atr_max_pct': 0.11587370262151026, 'sideways_tp_mult': 1.3044376995580524, 'sideways_tsl_mult': 0.4177862898430685, 'sideways_time_stop': 139, 'sideways_use_sma': False, 'sideways_use_ema': True, 'sideways_use_atr': False, 'sideways_use_adx': True, 'sideways_use_spike': True, 'sideways_rsi_required': False}.
[I 2025-09-01 15:07:51,767] Trial 679 finished with values: [-1000000000.0, 1000000000.0] and parameters: {'p_sma': 25, 'p_std': 28, 'p_atr': 18, 'p_adx': 18, 'rsi_period': 80, 'ema1': 9, 'ema2': 54, 'slip_atr_k': 0.024678444586920555, 'slip_spread_k': 0.5070555250308817, 'spread_hl_frac': 0.034026007755084416, 'bb_std_mult': 1.1880803428251263, 'rsi_os': 41, 'rsi_ob': 94, 'vol_spike': 0.11783193538237202, 'adx_thresh': 7.2642335007989685, 'atr_min_pct': 0.010154781819687715, 'atr_max_pct': 0.0337559698991245, 'tp_mult': 1.429525997882553, 'tsl_mult': 0.6312395962910374, 'strategy': 'mean_reversion', 'time_stop': 9, 'use_sma': True, 'use_atr': False, 'use_adx': False, 'use_ema': True, 'use_spike': False, 'rsi_required': True, 'edge_k': 0.21167879636069997, 'edge_cap': 0.985964565376403, 'bull_strategy': 'breakout', 'bull_bb_std_mult': 3.4386157480924098, 'bull_rsi_os': 17, 'bull_rsi_ob': 74, 'bull_adx_thresh': 19.53707681494042, 'bull_atr_min_pct': 0.01286954229244732, 'bull_atr_max_pct': 0.1146696742874331, 'bull_tp_mult': 1.8072283422839512, 'bull_tsl_mult': 0.47495127338630166, 'bull_time_stop': 143, 'bull_use_sma': False, 'bull_use_ema': True, 'bull_use_atr': False, 'bull_use_adx': True, 'bull_use_spike': False, 'bull_rsi_required': True, 'bear_strategy': 'mean_reversion', 'bear_bb_std_mult': 2.506037875170152, 'bear_rsi_os': 35, 'bear_rsi_ob': 54, 'bear_adx_thresh': 15.446743598213668, 'bear_atr_min_pct': 0.003906383107092548, 'bear_atr_max_pct': 0.024660783042944674, 'bear_tp_mult': 2.0600735111566846, 'bear_tsl_mult': 0.07606326179909836, 'bear_time_stop': 79, 'bear_use_sma': False, 'bear_use_ema': False, 'bear_use_atr': False, 'bear_use_adx': True, 'bear_use_spike': True, 'bear_rsi_required': False, 'sideways_strategy': 'breakout', 'sideways_bb_std_mult': 2.8917586475751555, 'sideways_rsi_os': 10, 'sideways_rsi_ob': 88, 'sideways_adx_thresh': 24.141264189523472, 'sideways_atr_min_pct': 0.02670054989300901, 'sideways_atr_max_pct': 0.06790562067710189, 'sideways_tp_mult': 1.3314504632585835, 'sideways_tsl_mult': 0.4207137587407573, 'sideways_time_stop': 150, 'sideways_use_sma': False, 'sideways_use_ema': True, 'sideways_use_atr': True, 'sideways_use_adx': True, 'sideways_use_spike': True, 'sideways_rsi_required': False}.
[I 2025-09-01 15:07:52,285] Trial 681 finished with values: [-0.03927187945153743, 0.03941157933615267] and parameters: {'p_sma': 36, 'p_std': 30, 'p_atr': 26, 'p_adx': 9, 'rsi_period': 44, 'ema1': 9, 'ema2': 56, 'slip_atr_k': 0.14810764589348377, 'slip_spread_k': 0.1880947781369527, 'spread_hl_frac': 0.009641894900071807, 'bb_std_mult': 1.4527743631484062, 'rsi_os': 25, 'rsi_ob': 55, 'vol_spike': 0.11762485622009328, 'adx_thresh': 6.6208081630278715, 'atr_min_pct': 0.010037523506165208, 'atr_max_pct': 0.11828190968368135, 'tp_mult': 1.30423388555357, 'tsl_mult': 0.630518481391799, 'strategy': 'mean_reversion', 'time_stop': 249, 'use_sma': True, 'use_atr': True, 'use_adx': False, 'use_ema': True, 'use_spike': True, 'rsi_required': True, 'edge_k': 0.2453151431460529, 'edge_cap': 0.49952093277266, 'bull_strategy': 'mean_reversion', 'bull_bb_std_mult': 3.4300370684606647, 'bull_rsi_os': 53, 'bull_rsi_ob': 87, 'bull_adx_thresh': 11.945916362007363, 'bull_atr_min_pct': 0.009900242224371423, 'bull_atr_max_pct': 0.12482287840573783, 'bull_tp_mult': 1.7757769677204838, 'bull_tsl_mult': 0.9243983241589612, 'bull_time_stop': 184, 'bull_use_sma': False, 'bull_use_ema': False, 'bull_use_atr': True, 'bull_use_adx': True, 'bull_use_spike': False, 'bull_rsi_required': False, 'bear_strategy': 'mean_reversion', 'bear_bb_std_mult': 2.4630091356019492, 'bear_rsi_os': 41, 'bear_rsi_ob': 50, 'bear_adx_thresh': 9.984139016152298, 'bear_atr_min_pct': 0.0036504087563042813, 'bear_atr_max_pct': 0.10883521068746553, 'bear_tp_mult': 2.764571705988015, 'bear_tsl_mult': 0.5157983674115154, 'bear_time_stop': 153, 'bear_use_sma': False, 'bear_use_ema': False, 'bear_use_atr': False, 'bear_use_adx': True, 'bear_use_spike': True, 'bear_rsi_required': True, 'sideways_strategy': 'mean_reversion', 'sideways_bb_std_mult': 2.9377641912452614, 'sideways_rsi_os': 32, 'sideways_rsi_ob': 93, 'sideways_adx_thresh': 19.32419737313108, 'sideways_atr_min_pct': 0.004931719903102783, 'sideways_atr_max_pct': 0.11547999662709457, 'sideways_tp_mult': 1.3070759747662255, 'sideways_tsl_mult': 0.08974757504773212, 'sideways_time_stop': 196, 'sideways_use_sma': False, 'sideways_use_ema': True, 'sideways_use_atr': False, 'sideways_use_adx': True, 'sideways_use_spike': True, 'sideways_rsi_required': False}.
[I 2025-09-01 15:07:52,890] Trial 678 finished with values: [-1000000000.0, 1000000000.0] and parameters: {'p_sma': 20, 'p_std': 28, 'p_atr': 18, 'p_adx': 25, 'rsi_period': 78, 'ema1': 12, 'ema2': 51, 'slip_atr_k': 0.14831074043033637, 'slip_spread_k': 0.5253490804232462, 'spread_hl_frac': 0.009392807863220084, 'bb_std_mult': 2.51302245663134, 'rsi_os': 25, 'rsi_ob': 55, 'vol_spike': 0.11765848342147725, 'adx_thresh': 7.2293949438759455, 'atr_min_pct': 0.010260578387480427, 'atr_max_pct': 0.03116895830521206, 'tp_mult': 2.1560679657106934, 'tsl_mult': 0.6331162525432508, 'strategy': 'mean_reversion', 'time_stop': 251, 'use_sma': True, 'use_atr': False, 'use_adx': False, 'use_ema': True, 'use_spike': False, 'rsi_required': True, 'edge_k': 0.2053575297252414, 'edge_cap': 0.9855530938580206, 'bull_strategy': 'breakout', 'bull_bb_std_mult': 3.176158416867467, 'bull_rsi_os': 24, 'bull_rsi_ob': 85, 'bull_adx_thresh': 12.064541591515443, 'bull_atr_min_pct': 0.012701592422112037, 'bull_atr_max_pct': 0.015210661151540227, 'bull_tp_mult': 1.6347035546492876, 'bull_tsl_mult': 0.484085179669279, 'bull_time_stop': 143, 'bull_use_sma': False, 'bull_use_ema': True, 'bull_use_atr': False, 'bull_use_adx': True, 'bull_use_spike': False, 'bull_rsi_required': True, 'bear_strategy': 'mean_reversion', 'bear_bb_std_mult': 2.500335274619167, 'bear_rsi_os': 40, 'bear_rsi_ob': 54, 'bear_adx_thresh': 9.833065904473642, 'bear_atr_min_pct': 0.010691376530024516, 'bear_atr_max_pct': 0.023847458656312333, 'bear_tp_mult': 1.6437631347742976, 'bear_tsl_mult': 0.366069288336153, 'bear_time_stop': 261, 'bear_use_sma': False, 'bear_use_ema': False, 'bear_use_atr': False, 'bear_use_adx': True, 'bear_use_spike': True, 'bear_rsi_required': False, 'sideways_strategy': 'breakout', 'sideways_bb_std_mult': 2.8968284137297964, 'sideways_rsi_os': 9, 'sideways_rsi_ob': 75, 'sideways_adx_thresh': 19.32296214308155, 'sideways_atr_min_pct': 0.026634960768722866, 'sideways_atr_max_pct': 0.050240352874441924, 'sideways_tp_mult': 1.4570265009974868, 'sideways_tsl_mult': 0.6926643000685514, 'sideways_time_stop': 263, 'sideways_use_sma': False, 'sideways_use_ema': True, 'sideways_use_atr': True, 'sideways_use_adx': True, 'sideways_use_spike': True, 'sideways_rsi_required': False}.
[I 2025-09-01 15:08:37,439] Trial 685 finished with values: [-1000000000.0, 1000000000.0] and parameters: {'p_sma': 31, 'p_std': 25, 'p_atr': 24, 'p_adx': 8, 'rsi_period': 81, 'ema1': 21, 'ema2': 34, 'slip_atr_k': 0.013720596199237507, 'slip_spread_k': 0.5515872198893761, 'spread_hl_frac': 0.005591960531849384, 'bb_std_mult': 3.5271449792554788, 'rsi_os': 32, 'rsi_ob': 54, 'vol_spike': 0.10057228321992809, 'adx_thresh': 26.32544699309085, 'atr_min_pct': 0.012827842476291615, 'atr_max_pct': 0.07584232079441547, 'tp_mult': 1.352083237881376, 'tsl_mult': 0.6902221305469829, 'strategy': 'breakout', 'time_stop': 119, 'use_sma': False, 'use_atr': False, 'use_adx': True, 'use_ema': False, 'use_spike': True, 'rsi_required': True, 'edge_k': 1.6061937439736713, 'edge_cap': 0.9620760587572995, 'bull_strategy': 'breakout', 'bull_bb_std_mult': 3.33584989252208, 'bull_rsi_os': 13, 'bull_rsi_ob': 82, 'bull_adx_thresh': 11.240879738709733, 'bull_atr_min_pct': 0.018895289863601027, 'bull_atr_max_pct': 0.1423303671563138, 'bull_tp_mult': 1.2803680637817472, 'bull_tsl_mult': 0.7423172590411454, 'bull_time_stop': 167, 'bull_use_sma': True, 'bull_use_ema': False, 'bull_use_atr': True, 'bull_use_adx': True, 'bull_use_spike': True, 'bull_rsi_required': True, 'bear_strategy': 'breakout', 'bear_bb_std_mult': 2.41965457346102, 'bear_rsi_os': 23, 'bear_rsi_ob': 76, 'bear_adx_thresh': 7.489043018667468, 'bear_atr_min_pct': 0.001881541790982773, 'bear_atr_max_pct': 0.020152480381246177, 'bear_tp_mult': 2.8233646021197294, 'bear_tsl_mult': 0.15267745462666593, 'bear_time_stop': 93, 'bear_use_sma': True, 'bear_use_ema': False, 'bear_use_atr': True, 'bear_use_adx': False, 'bear_use_spike': True, 'bear_rsi_required': True, 'sideways_strategy': 'mean_reversion', 'sideways_bb_std_mult': 3.0497671752200133, 'sideways_rsi_os': 29, 'sideways_rsi_ob': 89, 'sideways_adx_thresh': 24.40523457391409, 'sideways_atr_min_pct': 0.0044664165695452, 'sideways_atr_max_pct': 0.0254970104002403, 'sideways_tp_mult': 2.3295121178021563, 'sideways_tsl_mult': 0.33861162754308294, 'sideways_time_stop': 290, 'sideways_use_sma': True, 'sideways_use_ema': False, 'sideways_use_atr': True, 'sideways_use_adx': True, 'sideways_use_spike': False, 'sideways_rsi_required': False}.
[I 2025-09-01 15:08:38,251] Trial 683 finished with values: [-1000000000.0, 1000000000.0] and parameters: {'p_sma': 56, 'p_std': 30, 'p_atr': 26, 'p_adx': 25, 'rsi_period': 81, 'ema1': 15, 'ema2': 15, 'slip_atr_k': 0.15633125303840248, 'slip_spread_k': 0.7438452549547654, 'spread_hl_frac': 0.009605642976269563, 'bb_std_mult': 3.5550486068459763, 'rsi_os': 43, 'rsi_ob': 56, 'vol_spike': 0.10116052682531798, 'adx_thresh': 6.656536120864767, 'atr_min_pct': 0.002681663490202447, 'atr_max_pct': 0.12380629536191681, 'tp_mult': 1.3567209670663514, 'tsl_mult': 0.6890355684941006, 'strategy': 'breakout', 'time_stop': 119, 'use_sma': True, 'use_atr': True, 'use_adx': True, 'use_ema': True, 'use_spike': True, 'rsi_required': True, 'edge_k': 0.24696249184185018, 'edge_cap': 0.8873046427317035, 'bull_strategy': 'breakout', 'bull_bb_std_mult': 3.105861025901651, 'bull_rsi_os': 12, 'bull_rsi_ob': 85, 'bull_adx_thresh': 11.902668418506641, 'bull_atr_min_pct': 0.009890529750677005, 'bull_atr_max_pct': 0.12389890031672546, 'bull_tp_mult': 1.6432365725735698, 'bull_tsl_mult': 0.5845459685081821, 'bull_time_stop': 158, 'bull_use_sma': False, 'bull_use_ema': False, 'bull_use_atr': True, 'bull_use_adx': True, 'bull_use_spike': True, 'bull_rsi_required': True, 'bear_strategy': 'breakout', 'bear_bb_std_mult': 1.8927081110463464, 'bear_rsi_os': 32, 'bear_rsi_ob': 57, 'bear_adx_thresh': 7.5074406518268395, 'bear_atr_min_pct': 0.0018284343017655764, 'bear_atr_max_pct': 0.05129237157145551, 'bear_tp_mult': 2.759977841252525, 'bear_tsl_mult': 0.15541006885640352, 'bear_time_stop': 94, 'bear_use_sma': True, 'bear_use_ema': False, 'bear_use_atr': True, 'bear_use_adx': False, 'bear_use_spike': True, 'bear_rsi_required': True, 'sideways_strategy': 'mean_reversion', 'sideways_bb_std_mult': 2.646312309053724, 'sideways_rsi_os': 24, 'sideways_rsi_ob': 91, 'sideways_adx_thresh': 24.67182989462861, 'sideways_atr_min_pct': 0.004834597759578454, 'sideways_atr_max_pct': 0.10811001201645369, 'sideways_tp_mult': 1.4467363156271318, 'sideways_tsl_mult': 0.34193850626107514, 'sideways_time_stop': 195, 'sideways_use_sma': True, 'sideways_use_ema': True, 'sideways_use_atr': False, 'sideways_use_adx': True, 'sideways_use_spike': False, 'sideways_rsi_required': False}.
