[I 2025-09-01 14:23:44,532] Trial 387 finished with values: [-1000000000.0, 1000000000.0] and parameters: {'p_sma': 30, 'p_std': 27, 'p_atr': 15, 'p_adx': 20, 'rsi_period': 64, 'ema1': 28, 'ema2': 36, 'slip_atr_k': 0.13511500227566464, 'slip_spread_k': 0.5507983637005568, 'spread_hl_frac': 0.040440920685486166, 'bb_std_mult': 3.5931754716309507, 'rsi_os': 42, 'rsi_ob': 92, 'vol_spike': 0.1841259021745068, 'adx_thresh': 5.721154564386642, 'atr_min_pct': 0.012291927597181897, 'atr_max_pct': 0.038235294638585826, 'tp_mult': 1.4348948051132746, 'tsl_mult': 0.2918728558519329, 'strategy': 'mean_reversion', 'time_stop': 102, 'use_sma': True, 'use_atr': False, 'use_adx': True, 'use_ema': True, 'use_spike': True, 'rsi_required': True, 'edge_k': 0.41913986313483365, 'edge_cap': 0.9213457137138862, 'bull_strategy': 'breakout', 'bull_bb_std_mult': 3.0762656223460794, 'bull_rsi_os': 6, 'bull_rsi_ob': 73, 'bull_adx_thresh': 29.18751572992236, 'bull_atr_min_pct': 0.01147200879792486, 'bull_atr_max_pct': 0.05049404577294643, 'bull_tp_mult': 1.775006150311356, 'bull_tsl_mult': 0.43845779115036204, 'bull_time_stop': 44, 'bull_use_sma': False, 'bull_use_ema': True, 'bull_use_atr': True, 'bull_use_adx': True, 'bull_use_spike': True, 'bull_rsi_required': True, 'bear_strategy': 'mean_reversion', 'bear_bb_std_mult': 2.4343850151036097, 'bear_rsi_os': 22, 'bear_rsi_ob': 58, 'bear_adx_thresh': 6.940541096085576, 'bear_atr_min_pct': 0.00293083937891406, 'bear_atr_max_pct': 0.10133825480520178, 'bear_tp_mult': 2.8456625980703456, 'bear_tsl_mult': 0.06109422449915164, 'bear_time_stop': 94, 'bear_use_sma': False, 'bear_use_ema': False, 'bear_use_atr': False, 'bear_use_adx': False, 'bear_use_spike': True, 'bear_rsi_required': False, 'sideways_strategy': 'mean_reversion', 'sideways_bb_std_mult': 3.0155469568150104, 'sideways_rsi_os': 23, 'sideways_rsi_ob': 89, 'sideways_adx_thresh': 26.992007561669894, 'sideways_atr_min_pct': 0.010237745356328758, 'sideways_atr_max_pct': 0.11514951572662294, 'sideways_tp_mult': 1.607150731955748, 'sideways_tsl_mult': 0.39548595356670085, 'sideways_time_stop': 258, 'sideways_use_sma': True, 'sideways_use_ema': True, 'sideways_use_atr': True, 'sideways_use_adx': True, 'sideways_use_spike': False, 'sideways_rsi_required': False}.
[I 2025-09-01 14:24:23,869] Trial 391 finished with values: [-0.011167018993312516, 0.011290527938190716] and parameters: {'p_sma': 20, 'p_std': 28, 'p_atr': 25, 'p_adx': 8, 'rsi_period': 82, 'ema1': 9, 'ema2': 60, 'slip_atr_k': 0.0071612594542863044, 'slip_spread_k': 0.401476781408023, 'spread_hl_frac': 0.026682646932949167, 'bb_std_mult': 2.907354523930456, 'rsi_os': 18, 'rsi_ob': 87, 'vol_spike': 0.11829401241185102, 'adx_thresh': 10.239753451949102, 'atr_min_pct': 0.004448964911307612, 'atr_max_pct': 0.03474334613783899, 'tp_mult': 2.8596865365608233, 'tsl_mult': 0.5650148711067483, 'strategy': 'mean_reversion', 'time_stop': 151, 'use_sma': True, 'use_atr': False, 'use_adx': True, 'use_ema': True, 'use_spike': True, 'rsi_required': True, 'edge_k': 0.2596124069443215, 'edge_cap': 0.5575449992164806, 'bull_strategy': 'breakout', 'bull_bb_std_mult': 3.235964271955437, 'bull_rsi_os': 11, 'bull_rsi_ob': 77, 'bull_adx_thresh': 12.235532866786592, 'bull_atr_min_pct': 0.008055126477446956, 'bull_atr_max_pct': 0.11732434605063155, 'bull_tp_mult': 2.562546998213219, 'bull_tsl_mult': 0.35347537321522915, 'bull_time_stop': 158, 'bull_use_sma': True, 'bull_use_ema': True, 'bull_use_atr': True, 'bull_use_adx': False, 'bull_use_spike': True, 'bull_rsi_required': True, 'bear_strategy': 'mean_reversion', 'bear_bb_std_mult': 1.2246460945550584, 'bear_rsi_os': 50, 'bear_rsi_ob': 59, 'bear_adx_thresh': 17.752424643007828, 'bear_atr_min_pct': 0.0034984299284679023, 'bear_atr_max_pct': 0.11285951010493865, 'bear_tp_mult': 1.9728896178492534, 'bear_tsl_mult': 0.9994213494624147, 'bear_time_stop': 114, 'bear_use_sma': True, 'bear_use_ema': False, 'bear_use_atr': False, 'bear_use_adx': False, 'bear_use_spike': True, 'bear_rsi_required': False, 'sideways_strategy': 'mean_reversion', 'sideways_bb_std_mult': 3.108327014727458, 'sideways_rsi_os': 30, 'sideways_rsi_ob': 91, 'sideways_adx_thresh': 26.075750586793145, 'sideways_atr_min_pct': 0.0029082420048257398, 'sideways_atr_max_pct': 0.10658514908003026, 'sideways_tp_mult': 1.8249562862696385, 'sideways_tsl_mult': 0.2949182209725591, 'sideways_time_stop': 279, 'sideways_use_sma': True, 'sideways_use_ema': False, 'sideways_use_atr': True, 'sideways_use_adx': True, 'sideways_use_spike': True, 'sideways_rsi_required': False}.
[I 2025-09-01 14:24:24,457] Trial 390 finished with values: [-0.033560964623829515, 0.033780896972069804] and parameters: {'p_sma': 27, 'p_std': 26, 'p_atr': 28, 'p_adx': 8, 'rsi_period': 82, 'ema1': 9, 'ema2': 60, 'slip_atr_k': 0.007226070105111088, 'slip_spread_k': 0.5441745276829737, 'spread_hl_frac': 0.008200403254857096, 'bb_std_mult': 3.5954252444972616, 'rsi_os': 23, 'rsi_ob': 68, 'vol_spike': 0.11871644409965387, 'adx_thresh': 5.570807408247313, 'atr_min_pct': 0.004649023446615542, 'atr_max_pct': 0.0365440580360165, 'tp_mult': 1.3557177756136407, 'tsl_mult': 0.6689489391546108, 'strategy': 'mean_reversion', 'time_stop': 110, 'use_sma': True, 'use_atr': False, 'use_adx': True, 'use_ema': True, 'use_spike': True, 'rsi_required': True, 'edge_k': 0.17487389301510958, 'edge_cap': 0.8851892845931845, 'bull_strategy': 'breakout', 'bull_bb_std_mult': 3.2312509957753575, 'bull_rsi_os': 10, 'bull_rsi_ob': 77, 'bull_adx_thresh': 12.136460773202733, 'bull_atr_min_pct': 0.00928069232440748, 'bull_atr_max_pct': 0.09079280208671714, 'bull_tp_mult': 1.6016297533376713, 'bull_tsl_mult': 0.47331301382382973, 'bull_time_stop': 43, 'bull_use_sma': False, 'bull_use_ema': True, 'bull_use_atr': True, 'bull_use_adx': False, 'bull_use_spike': True, 'bull_rsi_required': True, 'bear_strategy': 'mean_reversion', 'bear_bb_std_mult': 2.5828563305916425, 'bear_rsi_os': 50, 'bear_rsi_ob': 55, 'bear_adx_thresh': 14.321381012447567, 'bear_atr_min_pct': 0.0029939284018849484, 'bear_atr_max_pct': 0.01310918678470662, 'bear_tp_mult': 2.836868645770216, 'bear_tsl_mult': 0.07958441947686802, 'bear_time_stop': 237, 'bear_use_sma': True, 'bear_use_ema': False, 'bear_use_atr': False, 'bear_use_adx': False, 'bear_use_spike': True, 'bear_rsi_required': False, 'sideways_strategy': 'mean_reversion', 'sideways_bb_std_mult': 3.116456703025427, 'sideways_rsi_os': 23, 'sideways_rsi_ob': 89, 'sideways_adx_thresh': 23.899988136944053, 'sideways_atr_min_pct': 0.0031233508047645384, 'sideways_atr_max_pct': 0.14756834418115264, 'sideways_tp_mult': 2.4751260976301577, 'sideways_tsl_mult': 0.2845369907165395, 'sideways_time_stop': 279, 'sideways_use_sma': True, 'sideways_use_ema': True, 'sideways_use_atr': True, 'sideways_use_adx': True, 'sideways_use_spike': False, 'sideways_rsi_required': False}.
[I 2025-09-01 14:24:25,163] Trial 389 finished with values: [-1000000000.0, 1000000000.0] and parameters: {'p_sma': 45, 'p_std': 7, 'p_atr': 28, 'p_adx': 8, 'rsi_period': 54, 'ema1': 28, 'ema2': 52, 'slip_atr_k': 0.13475059131080785, 'slip_spread_k': 0.5611795216158958, 'spread_hl_frac': 0.02346440069415314, 'bb_std_mult': 3.593232332898173, 'rsi_os': 35, 'rsi_ob': 51, 'vol_spike': 0.12022644206563422, 'adx_thresh': 5.003216286105124, 'atr_min_pct': 0.00447165730439179, 'atr_max_pct': 0.06138663186130476, 'tp_mult': 1.3647664202393521, 'tsl_mult': 0.6781509278314763, 'strategy': 'mean_reversion', 'time_stop': 101, 'use_sma': True, 'use_atr': False, 'use_adx': True, 'use_ema': True, 'use_spike': True, 'rsi_required': True, 'edge_k': 0.26820914909283816, 'edge_cap': 0.8907686923343052, 'bull_strategy': 'breakout', 'bull_bb_std_mult': 3.2695037909012443, 'bull_rsi_os': 10, 'bull_rsi_ob': 78, 'bull_adx_thresh': 12.167274324033096, 'bull_atr_min_pct': 0.009333695043990831, 'bull_atr_max_pct': 0.09197944801159039, 'bull_tp_mult': 1.759784535855364, 'bull_tsl_mult': 0.4772412577050591, 'bull_time_stop': 224, 'bull_use_sma': False, 'bull_use_ema': True, 'bull_use_atr': True, 'bull_use_adx': True, 'bull_use_spike': True, 'bull_rsi_required': True, 'bear_strategy': 'mean_reversion', 'bear_bb_std_mult': 2.5874712918394613, 'bear_rsi_os': 37, 'bear_rsi_ob': 58, 'bear_adx_thresh': 31.370894340114937, 'bear_atr_min_pct': 0.017626647113686646, 'bear_atr_max_pct': 0.11274432546077454, 'bear_tp_mult': 1.0185387530400383, 'bear_tsl_mult': 0.8102429179037782, 'bear_time_stop': 93, 'bear_use_sma': True, 'bear_use_ema': False, 'bear_use_atr': False, 'bear_use_adx': False, 'bear_use_spike': True, 'bear_rsi_required': False, 'sideways_strategy': 'mean_reversion', 'sideways_bb_std_mult': 3.0993967782792833, 'sideways_rsi_os': 21, 'sideways_rsi_ob': 54, 'sideways_adx_thresh': 26.82170472544174, 'sideways_atr_min_pct': 0.0033617254857111235, 'sideways_atr_max_pct': 0.11532530478605751, 'sideways_tp_mult': 2.494899436761619, 'sideways_tsl_mult': 0.3973455229931527, 'sideways_time_stop': 260, 'sideways_use_sma': True, 'sideways_use_ema': True, 'sideways_use_atr': True, 'sideways_use_adx': True, 'sideways_use_spike': True, 'sideways_rsi_required': False}.
[I 2025-09-01 14:24:25,609] Trial 388 finished with values: [-1000000000.0, 1000000000.0] and parameters: {'p_sma': 51, 'p_std': 25, 'p_atr': 25, 'p_adx': 16, 'rsi_period': 62, 'ema1': 9, 'ema2': 56, 'slip_atr_k': 0.00710876149632979, 'slip_spread_k': 0.5454104553948332, 'spread_hl_frac': 0.023429727219201286, 'bb_std_mult': 3.4587885017300817, 'rsi_os': 35, 'rsi_ob': 51, 'vol_spike': 0.11897022777644631, 'adx_thresh': 6.286244271535166, 'atr_min_pct': 0.014566973175571018, 'atr_max_pct': 0.039201614478644724, 'tp_mult': 1.4267074093196301, 'tsl_mult': 0.6750359777768651, 'strategy': 'mean_reversion', 'time_stop': 254, 'use_sma': True, 'use_atr': False, 'use_adx': True, 'use_ema': True, 'use_spike': True, 'rsi_required': True, 'edge_k': 0.17647366070627252, 'edge_cap': 0.9210303163201126, 'bull_strategy': 'breakout', 'bull_bb_std_mult': 3.0338882104610896, 'bull_rsi_os': 10, 'bull_rsi_ob': 88, 'bull_adx_thresh': 29.026266969546327, 'bull_atr_min_pct': 0.005019891502573981, 'bull_atr_max_pct': 0.05155219714695254, 'bull_tp_mult': 2.567947575109932, 'bull_tsl_mult': 0.4720708115036701, 'bull_time_stop': 267, 'bull_use_sma': False, 'bull_use_ema': True, 'bull_use_atr': True, 'bull_use_adx': True, 'bull_use_spike': True, 'bull_rsi_required': True, 'bear_strategy': 'mean_reversion', 'bear_bb_std_mult': 2.581614804435759, 'bear_rsi_os': 34, 'bear_rsi_ob': 55, 'bear_adx_thresh': 17.56674648180651, 'bear_atr_min_pct': 0.01735930008998761, 'bear_atr_max_pct': 0.11279728082173086, 'bear_tp_mult': 1.971702187696995, 'bear_tsl_mult': 0.8060281614048861, 'bear_time_stop': 93, 'bear_use_sma': True, 'bear_use_ema': False, 'bear_use_atr': False, 'bear_use_adx': False, 'bear_use_spike': True, 'bear_rsi_required': False, 'sideways_strategy': 'mean_reversion', 'sideways_bb_std_mult': 2.9838409535546906, 'sideways_rsi_os': 23, 'sideways_rsi_ob': 89, 'sideways_adx_thresh': 23.87752702134294, 'sideways_atr_min_pct': 0.003008599913074091, 'sideways_atr_max_pct': 0.11559659111148927, 'sideways_tp_mult': 2.4661705230231856, 'sideways_tsl_mult': 0.6372155672385684, 'sideways_time_stop': 117, 'sideways_use_sma': True, 'sideways_use_ema': True, 'sideways_use_atr': True, 'sideways_use_adx': True, 'sideways_use_spike': True, 'sideways_rsi_required': False}.
[I 2025-09-01 14:24:26,278] Trial 395 finished with values: [-1000000000.0, 1000000000.0] and parameters: {'p_sma': 43, 'p_std': 29, 'p_atr': 26, 'p_adx': 7, 'rsi_period': 76, 'ema1': 25, 'ema2': 40, 'slip_atr_k': 0.012262946500670781, 'slip_spread_k': 0.4338877399849449, 'spread_hl_frac': 0.00956601595585945, 'bb_std_mult': 3.4575171752486447, 'rsi_os': 40, 'rsi_ob': 45, 'vol_spike': 0.10272172039009797, 'adx_thresh': 16.124549842007553, 'atr_min_pct': 0.010211399786845871, 'atr_max_pct': 0.131171429862248, 'tp_mult': 2.341497366885502, 'tsl_mult': 0.7016879063366792, 'strategy': 'mean_reversion', 'time_stop': 5, 'use_sma': False, 'use_atr': False, 'use_adx': True, 'use_ema': True, 'use_spike': False, 'rsi_required': True, 'edge_k': 1.8265438946595878, 'edge_cap': 0.5212254620502852, 'bull_strategy': 'mean_reversion', 'bull_bb_std_mult': 3.349702678681445, 'bull_rsi_os': 15, 'bull_rsi_ob': 79, 'bull_adx_thresh': 11.604449449486353, 'bull_atr_min_pct': 0.010884952918765472, 'bull_atr_max_pct': 0.020839975888837868, 'bull_tp_mult': 1.0532049654697944, 'bull_tsl_mult': 0.41872537599495985, 'bull_time_stop': 157, 'bull_use_sma': True, 'bull_use_ema': True, 'bull_use_atr': True, 'bull_use_adx': True, 'bull_use_spike': True, 'bull_rsi_required': True, 'bear_strategy': 'mean_reversion', 'bear_bb_std_mult': 1.7990003991799166, 'bear_rsi_os': 29, 'bear_rsi_ob': 56, 'bear_adx_thresh': 7.390171144382778, 'bear_atr_min_pct': 0.0013928549613076069, 'bear_atr_max_pct': 0.10708967620825048, 'bear_tp_mult': 2.096055396804478, 'bear_tsl_mult': 0.13218305331922944, 'bear_time_stop': 79, 'bear_use_sma': False, 'bear_use_ema': False, 'bear_use_atr': False, 'bear_use_adx': False, 'bear_use_spike': True, 'bear_rsi_required': False, 'sideways_strategy': 'mean_reversion', 'sideways_bb_std_mult': 3.048660877731026, 'sideways_rsi_os': 16, 'sideways_rsi_ob': 78, 'sideways_adx_thresh': 21.295306465694832, 'sideways_atr_min_pct': 0.028681220181452326, 'sideways_atr_max_pct': 0.10300692236962429, 'sideways_tp_mult': 1.5290786303430994, 'sideways_tsl_mult': 0.3441559088217083, 'sideways_time_stop': 264, 'sideways_use_sma': True, 'sideways_use_ema': False, 'sideways_use_atr': False, 'sideways_use_adx': True, 'sideways_use_spike': False, 'sideways_rsi_required': True}.
[I 2025-09-01 14:25:02,097] Trial 392 finished with values: [-1000000000.0, 1000000000.0] and parameters: {'p_sma': 28, 'p_std': 36, 'p_atr': 26, 'p_adx': 16, 'rsi_period': 61, 'ema1': 24, 'ema2': 40, 'slip_atr_k': 0.04582419516101796, 'slip_spread_k': 0.6043738344976377, 'spread_hl_frac': 0.007594597980600373, 'bb_std_mult': 3.4789020321986777, 'rsi_os': 22, 'rsi_ob': 68, 'vol_spike': 0.104461708737913, 'adx_thresh': 16.578769303140234, 'atr_min_pct': 0.029882392248102095, 'atr_max_pct': 0.14990701431245035, 'tp_mult': 1.3564428644276907, 'tsl_mult': 0.6738780109578738, 'strategy': 'mean_reversion', 'time_stop': 109, 'use_sma': True, 'use_atr': False, 'use_adx': True, 'use_ema': True, 'use_spike': True, 'rsi_required': True, 'edge_k': 0.17557484917409544, 'edge_cap': 0.8816247822819789, 'bull_strategy': 'breakout', 'bull_bb_std_mult': 3.3411585556165653, 'bull_rsi_os': 48, 'bull_rsi_ob': 76, 'bull_adx_thresh': 12.117071658680993, 'bull_atr_min_pct': 0.009522164705835438, 'bull_atr_max_pct': 0.09179004777420142, 'bull_tp_mult': 1.6050819601726205, 'bull_tsl_mult': 0.48207119225175477, 'bull_time_stop': 221, 'bull_use_sma': False, 'bull_use_ema': True, 'bull_use_atr': True, 'bull_use_adx': True, 'bull_use_spike': True, 'bull_rsi_required': True, 'bear_strategy': 'mean_reversion', 'bear_bb_std_mult': 3.563552452887093, 'bear_rsi_os': 29, 'bear_rsi_ob': 55, 'bear_adx_thresh': 22.323928236676487, 'bear_atr_min_pct': 0.0027645328986508574, 'bear_atr_max_pct': 0.10707815616533123, 'bear_tp_mult': 2.082600290802814, 'bear_tsl_mult': 0.645672822226536, 'bear_time_stop': 271, 'bear_use_sma': True, 'bear_use_ema': False, 'bear_use_atr': False, 'bear_use_adx': False, 'bear_use_spike': True, 'bear_rsi_required': False, 'sideways_strategy': 'mean_reversion', 'sideways_bb_std_mult': 2.0862914671469164, 'sideways_rsi_os': 16, 'sideways_rsi_ob': 46, 'sideways_adx_thresh': 24.02097959200186, 'sideways_atr_min_pct': 0.003198011387914373, 'sideways_atr_max_pct': 0.10399192857888667, 'sideways_tp_mult': 2.488681570921425, 'sideways_tsl_mult': 0.34203348611017315, 'sideways_time_stop': 106, 'sideways_use_sma': True, 'sideways_use_ema': True, 'sideways_use_atr': True, 'sideways_use_adx': True, 'sideways_use_spike': False, 'sideways_rsi_required': False}.
[I 2025-09-01 14:25:02,398] Trial 393 finished with values: [-1000000000.0, 1000000000.0] and parameters: {'p_sma': 51, 'p_std': 21, 'p_atr': 26, 'p_adx': 16, 'rsi_period': 75, 'ema1': 24, 'ema2': 52, 'slip_atr_k': 0.012381062690233171, 'slip_spread_k': 0.9301846401495193, 'spread_hl_frac': 0.011479128661919469, 'bb_std_mult': 3.4641410811533353, 'rsi_os': 40, 'rsi_ob': 82, 'vol_spike': 0.10460386314250548, 'adx_thresh': 6.902548367075356, 'atr_min_pct': 0.021215740543563285, 'atr_max_pct': 0.13835727319211233, 'tp_mult': 1.2681042945381684, 'tsl_mult': 0.3914024671172943, 'strategy': 'mean_reversion', 'time_stop': 236, 'use_sma': True, 'use_atr': False, 'use_adx': True, 'use_ema': True, 'use_spike': True, 'rsi_required': True, 'edge_k': 0.2578983939684487, 'edge_cap': 0.9884211605397368, 'bull_strategy': 'breakout', 'bull_bb_std_mult': 0.8107315828228085, 'bull_rsi_os': 15, 'bull_rsi_ob': 82, 'bull_adx_thresh': 11.917297095696862, 'bull_atr_min_pct': 0.028291320898107805, 'bull_atr_max_pct': 0.017830132214301075, 'bull_tp_mult': 2.7690191478229726, 'bull_tsl_mult': 0.043045614867589066, 'bull_time_stop': 233, 'bull_use_sma': False, 'bull_use_ema': True, 'bull_use_atr': True, 'bull_use_adx': True, 'bull_use_spike': True, 'bull_rsi_required': True, 'bear_strategy': 'mean_reversion', 'bear_bb_std_mult': 2.2363601159874276, 'bear_rsi_os': 25, 'bear_rsi_ob': 57, 'bear_adx_thresh': 31.182747841070917, 'bear_atr_min_pct': 0.0015480777864456414, 'bear_atr_max_pct': 0.11120360945495077, 'bear_tp_mult': 2.55626794092121, 'bear_tsl_mult': 0.8082269267957076, 'bear_time_stop': 92, 'bear_use_sma': False, 'bear_use_ema': False, 'bear_use_atr': False, 'bear_use_adx': False, 'bear_use_spike': True, 'bear_rsi_required': False, 'sideways_strategy': 'mean_reversion', 'sideways_bb_std_mult': 1.6417159196127553, 'sideways_rsi_os': 18, 'sideways_rsi_ob': 54, 'sideways_adx_thresh': 26.06162066036485, 'sideways_atr_min_pct': 0.024133167155649206, 'sideways_atr_max_pct': 0.10395751240121888, 'sideways_tp_mult': 2.0694739409771765, 'sideways_tsl_mult': 0.35515005448486836, 'sideways_time_stop': 259, 'sideways_use_sma': True, 'sideways_use_ema': True, 'sideways_use_atr': False, 'sideways_use_adx': True, 'sideways_use_spike': False, 'sideways_rsi_required': True}.
[I 2025-09-01 14:25:02,952] Trial 396 finished with values: [-1000000000.0, 1000000000.0] and parameters: {'p_sma': 22, 'p_std': 27, 'p_atr': 26, 'p_adx': 8, 'rsi_period': 80, 'ema1': 13, 'ema2': 10, 'slip_atr_k': 0.041837399296539485, 'slip_spread_k': 0.5996127876872445, 'spread_hl_frac': 0.011535131187291959, 'bb_std_mult': 3.394497004465526, 'rsi_os': 22, 'rsi_ob': 57, 'vol_spike': 0.09414398290307144, 'adx_thresh': 7.3657743978158585, 'atr_min_pct': 0.011930164070009205, 'atr_max_pct': 0.0909872156209221, 'tp_mult': 1.3184983668087138, 'tsl_mult': 0.6564093012781169, 'strategy': 'mean_reversion', 'time_stop': 123, 'use_sma': True, 'use_atr': False, 'use_adx': True, 'use_ema': True, 'use_spike': True, 'rsi_required': True, 'edge_k': 1.9631605611613347, 'edge_cap': 0.9773385749173054, 'bull_strategy': 'breakout', 'bull_bb_std_mult': 3.1487070285231034, 'bull_rsi_os': 48, 'bull_rsi_ob': 82, 'bull_adx_thresh': 12.81352275703302, 'bull_atr_min_pct': 0.02848828972916391, 'bull_atr_max_pct': 0.12474246151789671, 'bull_tp_mult': 1.6351245408641464, 'bull_tsl_mult': 0.809275088825854, 'bull_time_stop': 179, 'bull_use_sma': False, 'bull_use_ema': False, 'bull_use_atr': True, 'bull_use_adx': True, 'bull_use_spike': True, 'bull_rsi_required': True, 'bear_strategy': 'mean_reversion', 'bear_bb_std_mult': 2.2495964596985174, 'bear_rsi_os': 24, 'bear_rsi_ob': 47, 'bear_adx_thresh': 7.9414123281887035, 'bear_atr_min_pct': 0.0025881206910555463, 'bear_atr_max_pct': 0.10786810892041639, 'bear_tp_mult': 2.0769067382733692, 'bear_tsl_mult': 0.12563739118118733, 'bear_time_stop': 99, 'bear_use_sma': False, 'bear_use_ema': False, 'bear_use_atr': True, 'bear_use_adx': False, 'bear_use_spike': True, 'bear_rsi_required': False, 'sideways_strategy': 'mean_reversion', 'sideways_bb_std_mult': 3.0072438139587243, 'sideways_rsi_os': 51, 'sideways_rsi_ob': 67, 'sideways_adx_thresh': 7.680320808936786, 'sideways_atr_min_pct': 0.0044758797326843215, 'sideways_atr_max_pct': 0.10820692918632246, 'sideways_tp_mult': 2.3321534604023544, 'sideways_tsl_mult': 0.030491444461746786, 'sideways_time_stop': 108, 'sideways_use_sma': True, 'sideways_use_ema': True, 'sideways_use_atr': True, 'sideways_use_adx': True, 'sideways_use_spike': False, 'sideways_rsi_required': True}.
