[I 2025-09-01 14:09:07,466] Trial 288 finished with values: [0.0009553927476122492, 0.005739794766912832] and parameters: {'p_sma': 31, 'p_std': 52, 'p_atr': 27, 'p_adx': 9, 'rsi_period': 81, 'ema1': 11, 'ema2': 56, 'slip_atr_k': 0.013818057522631426, 'slip_spread_k': 0.5880425148215458, 'spread_hl_frac': 0.007292382799391016, 'bb_std_mult': 3.4307628403943573, 'rsi_os': 41, 'rsi_ob': 55, 'vol_spike': 0.10181094493371981, 'adx_thresh': 6.841396772427773, 'atr_min_pct': 0.010237944042126725, 'atr_max_pct': 0.03674419655632293, 'tp_mult': 1.2971209622107613, 'tsl_mult': 0.6785309699012403, 'strategy': 'mean_reversion', 'time_stop': 126, 'use_sma': True, 'use_atr': False, 'use_adx': True, 'use_ema': True, 'use_spike': True, 'rsi_required': True, 'edge_k': 0.22083442773710965, 'edge_cap': 0.9983158646900888, 'bull_strategy': 'breakout', 'bull_bb_std_mult': 3.202811351756966, 'bull_rsi_os': 11, 'bull_rsi_ob': 76, 'bull_adx_thresh': 12.964381679562724, 'bull_atr_min_pct': 0.0140032874624531, 'bull_atr_max_pct': 0.1333297562825279, 'bull_tp_mult': 1.5862335133286232, 'bull_tsl_mult': 0.44053917753342847, 'bull_time_stop': 168, 'bull_use_sma': False, 'bull_use_ema': True, 'bull_use_atr': True, 'bull_use_adx': True, 'bull_use_spike': True, 'bull_rsi_required': True, 'bear_strategy': 'mean_reversion', 'bear_bb_std_mult': 2.4194345634783287, 'bear_rsi_os': 37, 'bear_rsi_ob': 59, 'bear_adx_thresh': 8.577326658368774, 'bear_atr_min_pct': 0.002731714181281881, 'bear_atr_max_pct': 0.11415627137839289, 'bear_tp_mult': 2.2180623280194007, 'bear_tsl_mult': 0.3055604168127618, 'bear_time_stop': 98, 'bear_use_sma': False, 'bear_use_ema': False, 'bear_use_atr': False, 'bear_use_adx': False, 'bear_use_spike': True, 'bear_rsi_required': False, 'sideways_strategy': 'mean_reversion', 'sideways_bb_std_mult': 3.0107251757722135, 'sideways_rsi_os': 30, 'sideways_rsi_ob': 93, 'sideways_adx_thresh': 24.390938784742417, 'sideways_atr_min_pct': 0.002615729105551883, 'sideways_atr_max_pct': 0.10735461103957651, 'sideways_tp_mult': 2.467726036288909, 'sideways_tsl_mult': 0.42202040885164904, 'sideways_time_stop': 281, 'sideways_use_sma': True, 'sideways_use_ema': True, 'sideways_use_atr': True, 'sideways_use_adx': True, 'sideways_use_spike': False, 'sideways_rsi_required': False}.
[I 2025-09-01 14:09:08,369] Trial 287 finished with values: [0.0032179078429925845, 0.006384538013181503] and parameters: {'p_sma': 31, 'p_std': 30, 'p_atr': 27, 'p_adx': 9, 'rsi_period': 81, 'ema1': 11, 'ema2': 56, 'slip_atr_k': 0.022817118008165414, 'slip_spread_k': 0.5912158688835232, 'spread_hl_frac': 0.012640773976364162, 'bb_std_mult': 3.4171257400238817, 'rsi_os': 41, 'rsi_ob': 55, 'vol_spike': 0.10147687572842615, 'adx_thresh': 6.6661094583972025, 'atr_min_pct': 0.009740223055971404, 'atr_max_pct': 0.036649501216596936, 'tp_mult': 1.3166126060932088, 'tsl_mult': 0.6824987540534926, 'strategy': 'mean_reversion', 'time_stop': 125, 'use_sma': True, 'use_atr': False, 'use_adx': True, 'use_ema': True, 'use_spike': True, 'rsi_required': True, 'edge_k': 0.21768218864947092, 'edge_cap': 0.9921127886701123, 'bull_strategy': 'breakout', 'bull_bb_std_mult': 3.226610396261893, 'bull_rsi_os': 11, 'bull_rsi_ob': 80, 'bull_adx_thresh': 13.565224495888266, 'bull_atr_min_pct': 0.01426689628678907, 'bull_atr_max_pct': 0.1331199182676616, 'bull_tp_mult': 1.6087140178253665, 'bull_tsl_mult': 0.44279068013235146, 'bull_time_stop': 172, 'bull_use_sma': False, 'bull_use_ema': True, 'bull_use_atr': True, 'bull_use_adx': True, 'bull_use_spike': True, 'bull_rsi_required': True, 'bear_strategy': 'mean_reversion', 'bear_bb_std_mult': 2.4194866420144825, 'bear_rsi_os': 36, 'bear_rsi_ob': 59, 'bear_adx_thresh': 8.775307444708483, 'bear_atr_min_pct': 0.0027638862614445497, 'bear_atr_max_pct': 0.11403146772904531, 'bear_tp_mult': 2.1744138152804378, 'bear_tsl_mult': 0.29501495663883137, 'bear_time_stop': 95, 'bear_use_sma': False, 'bear_use_ema': False, 'bear_use_atr': False, 'bear_use_adx': False, 'bear_use_spike': True, 'bear_rsi_required': False, 'sideways_strategy': 'mean_reversion', 'sideways_bb_std_mult': 3.0173867909526875, 'sideways_rsi_os': 30, 'sideways_rsi_ob': 93, 'sideways_adx_thresh': 23.518509702459845, 'sideways_atr_min_pct': 0.002590109133811593, 'sideways_atr_max_pct': 0.1055149455760939, 'sideways_tp_mult': 2.488130314016105, 'sideways_tsl_mult': 0.43320249753365303, 'sideways_time_stop': 281, 'sideways_use_sma': True, 'sideways_use_ema': True, 'sideways_use_atr': True, 'sideways_use_adx': True, 'sideways_use_spike': False, 'sideways_rsi_required': False}.
[I 2025-09-01 14:09:08,816] Trial 290 finished with values: [-1000000000.0, 1000000000.0] and parameters: {'p_sma': 29, 'p_std': 29, 'p_atr': 25, 'p_adx': 9, 'rsi_period': 81, 'ema1': 10, 'ema2': 55, 'slip_atr_k': 0.014360838186864639, 'slip_spread_k': 0.6212619314051617, 'spread_hl_frac': 0.04972483010171977, 'bb_std_mult': 3.3416599774169695, 'rsi_os': 42, 'rsi_ob': 54, 'vol_spike': 0.11414706558214903, 'adx_thresh': 5.886790843478156, 'atr_min_pct': 0.01031095029609512, 'atr_max_pct': 0.03701401935652732, 'tp_mult': 1.29127755352153, 'tsl_mult': 0.6417688607096019, 'strategy': 'mean_reversion', 'time_stop': 122, 'use_sma': True, 'use_atr': False, 'use_adx': True, 'use_ema': True, 'use_spike': True, 'rsi_required': True, 'edge_k': 0.21955267245990306, 'edge_cap': 0.9781822996095579, 'bull_strategy': 'breakout', 'bull_bb_std_mult': 3.3618798794549907, 'bull_rsi_os': 12, 'bull_rsi_ob': 76, 'bull_adx_thresh': 13.388337669573538, 'bull_atr_min_pct': 0.011965447355231066, 'bull_atr_max_pct': 0.13362944475644842, 'bull_tp_mult': 1.5917362779689366, 'bull_tsl_mult': 0.484413557926988, 'bull_time_stop': 153, 'bull_use_sma': False, 'bull_use_ema': True, 'bull_use_atr': True, 'bull_use_adx': True, 'bull_use_spike': True, 'bull_rsi_required': True, 'bear_strategy': 'mean_reversion', 'bear_bb_std_mult': 2.4212968108839905, 'bear_rsi_os': 33, 'bear_rsi_ob': 58, 'bear_adx_thresh': 8.605937042253915, 'bear_atr_min_pct': 0.0030653921041985245, 'bear_atr_max_pct': 0.11511302217629997, 'bear_tp_mult': 2.190877033735032, 'bear_tsl_mult': 0.3175523005771108, 'bear_time_stop': 96, 'bear_use_sma': False, 'bear_use_ema': False, 'bear_use_atr': False, 'bear_use_adx': False, 'bear_use_spike': True, 'bear_rsi_required': False, 'sideways_strategy': 'mean_reversion', 'sideways_bb_std_mult': 2.8795368814745794, 'sideways_rsi_os': 28, 'sideways_rsi_ob': 93, 'sideways_adx_thresh': 25.39521404019957, 'sideways_atr_min_pct': 0.0018284691801449767, 'sideways_atr_max_pct': 0.10798401733403537, 'sideways_tp_mult': 2.4855095786123718, 'sideways_tsl_mult': 0.4361869565714833, 'sideways_time_stop': 270, 'sideways_use_sma': True, 'sideways_use_ema': True, 'sideways_use_atr': True, 'sideways_use_adx': True, 'sideways_use_spike': False, 'sideways_rsi_required': False}.
[I 2025-09-01 14:09:50,771] Trial 294 finished with values: [0.002616895721980761, 0.0035022549516156073] and parameters: {'p_sma': 30, 'p_std': 31, 'p_atr': 28, 'p_adx': 7, 'rsi_period': 80, 'ema1': 10, 'ema2': 60, 'slip_atr_k': 0.01337777194392015, 'slip_spread_k': 0.5750576580360942, 'spread_hl_frac': 0.007029013882853628, 'bb_std_mult': 3.4595328765747473, 'rsi_os': 41, 'rsi_ob': 51, 'vol_spike': 0.10829496532542958, 'adx_thresh': 6.38484445890774, 'atr_min_pct': 0.009682394542339946, 'atr_max_pct': 0.038803705735189126, 'tp_mult': 1.4591705729451012, 'tsl_mult': 0.6662453833028549, 'strategy': 'mean_reversion', 'time_stop': 136, 'use_sma': True, 'use_atr': False, 'use_adx': True, 'use_ema': True, 'use_spike': True, 'rsi_required': True, 'edge_k': 0.17353990456954207, 'edge_cap': 0.966309810857498, 'bull_strategy': 'breakout', 'bull_bb_std_mult': 3.0858674690319376, 'bull_rsi_os': 13, 'bull_rsi_ob': 79, 'bull_adx_thresh': 12.240313271771791, 'bull_atr_min_pct': 0.011732408834719646, 'bull_atr_max_pct': 0.13028206357666486, 'bull_tp_mult': 1.7117878590796902, 'bull_tsl_mult': 0.4582799359008142, 'bull_time_stop': 166, 'bull_use_sma': False, 'bull_use_ema': True, 'bull_use_atr': True, 'bull_use_adx': True, 'bull_use_spike': True, 'bull_rsi_required': True, 'bear_strategy': 'mean_reversion', 'bear_bb_std_mult': 2.572798019264986, 'bear_rsi_os': 37, 'bear_rsi_ob': 60, 'bear_adx_thresh': 9.717541143737673, 'bear_atr_min_pct': 0.002916050265539979, 'bear_atr_max_pct': 0.10885815768760113, 'bear_tp_mult': 2.235096177154076, 'bear_tsl_mult': 0.33431307197771454, 'bear_time_stop': 105, 'bear_use_sma': False, 'bear_use_ema': False, 'bear_use_atr': False, 'bear_use_adx': False, 'bear_use_spike': True, 'bear_rsi_required': False, 'sideways_strategy': 'mean_reversion', 'sideways_bb_std_mult': 3.035182762185697, 'sideways_rsi_os': 29, 'sideways_rsi_ob': 90, 'sideways_adx_thresh': 23.662388909299235, 'sideways_atr_min_pct': 0.003440602634670402, 'sideways_atr_max_pct': 0.10826687355358132, 'sideways_tp_mult': 2.4717188158344494, 'sideways_tsl_mult': 0.32518886300009564, 'sideways_time_stop': 277, 'sideways_use_sma': True, 'sideways_use_ema': True, 'sideways_use_atr': False, 'sideways_use_adx': True, 'sideways_use_spike': False, 'sideways_rsi_required': False}.
[I 2025-09-01 14:09:50,757] Trial 292 finished with values: [-1000000000.0, 1000000000.0] and parameters: {'p_sma': 29, 'p_std': 28, 'p_atr': 25, 'p_adx': 7, 'rsi_period': 80, 'ema1': 10, 'ema2': 54, 'slip_atr_k': 0.03271949312030892, 'slip_spread_k': 0.568495201198902, 'spread_hl_frac': 0.008105196010544697, 'bb_std_mult': 3.3007968319896914, 'rsi_os': 40, 'rsi_ob': 54, 'vol_spike': 0.11145835615939628, 'adx_thresh': 6.365337811774547, 'atr_min_pct': 0.009674034547192506, 'atr_max_pct': 0.038731222730087445, 'tp_mult': 1.4447636472459002, 'tsl_mult': 0.6440068456813114, 'strategy': 'mean_reversion', 'time_stop': 116, 'use_sma': True, 'use_atr': False, 'use_adx': True, 'use_ema': True, 'use_spike': True, 'rsi_required': True, 'edge_k': 0.21964943965318737, 'edge_cap': 0.9763658107515345, 'bull_strategy': 'breakout', 'bull_bb_std_mult': 3.0772810674448348, 'bull_rsi_os': 14, 'bull_rsi_ob': 75, 'bull_adx_thresh': 13.609369293861768, 'bull_atr_min_pct': 0.012245209699148642, 'bull_atr_max_pct': 0.13025073304350343, 'bull_tp_mult': 1.5807994087902295, 'bull_tsl_mult': 0.47449427072751543, 'bull_time_stop': 152, 'bull_use_sma': False, 'bull_use_ema': True, 'bull_use_atr': True, 'bull_use_adx': True, 'bull_use_spike': True, 'bull_rsi_required': True, 'bear_strategy': 'mean_reversion', 'bear_bb_std_mult': 2.427040739924352, 'bear_rsi_os': 33, 'bear_rsi_ob': 58, 'bear_adx_thresh': 8.426331890441373, 'bear_atr_min_pct': 0.003136718827052938, 'bear_atr_max_pct': 0.10756508751062518, 'bear_tp_mult': 2.222635071126911, 'bear_tsl_mult': 0.3297556321279641, 'bear_time_stop': 95, 'bear_use_sma': False, 'bear_use_ema': False, 'bear_use_atr': False, 'bear_use_adx': False, 'bear_use_spike': True, 'bear_rsi_required': False, 'sideways_strategy': 'mean_reversion', 'sideways_bb_std_mult': 3.052102657962455, 'sideways_rsi_os': 28, 'sideways_rsi_ob': 90, 'sideways_adx_thresh': 23.413659743149843, 'sideways_atr_min_pct': 0.003654623268505772, 'sideways_atr_max_pct': 0.1030353748165983, 'sideways_tp_mult': 2.4729399311497016, 'sideways_tsl_mult': 0.33641463585388093, 'sideways_time_stop': 276, 'sideways_use_sma': True, 'sideways_use_ema': True, 'sideways_use_atr': True, 'sideways_use_adx': True, 'sideways_use_spike': False, 'sideways_rsi_required': False}.
[I 2025-09-01 14:09:51,519] Trial 291 finished with values: [-1000000000.0, 1000000000.0] and parameters: {'p_sma': 29, 'p_std': 30, 'p_atr': 25, 'p_adx': 7, 'rsi_period': 80, 'ema1': 9, 'ema2': 55, 'slip_atr_k': 0.03229458354389113, 'slip_spread_k': 0.6256617233225186, 'spread_hl_frac': 0.007155902137236753, 'bb_std_mult': 3.3185414074779533, 'rsi_os': 42, 'rsi_ob': 54, 'vol_spike': 0.11363861106253202, 'adx_thresh': 5.805179140075032, 'atr_min_pct': 0.009850545230051239, 'atr_max_pct': 0.03736865566632774, 'tp_mult': 1.342132347026868, 'tsl_mult': 0.6428687559674349, 'strategy': 'mean_reversion', 'time_stop': 118, 'use_sma': True, 'use_atr': False, 'use_adx': True, 'use_ema': True, 'use_spike': True, 'rsi_required': True, 'edge_k': 0.2102922427003908, 'edge_cap': 0.9737319023927007, 'bull_strategy': 'breakout', 'bull_bb_std_mult': 3.0727802404199207, 'bull_rsi_os': 11, 'bull_rsi_ob': 77, 'bull_adx_thresh': 7.744513157762813, 'bull_atr_min_pct': 0.011893510085143031, 'bull_atr_max_pct': 0.13084739451945182, 'bull_tp_mult': 1.5810020900156545, 'bull_tsl_mult': 0.48602944102059475, 'bull_time_stop': 152, 'bull_use_sma': False, 'bull_use_ema': True, 'bull_use_atr': True, 'bull_use_adx': True, 'bull_use_spike': True, 'bull_rsi_required': True, 'bear_strategy': 'mean_reversion', 'bear_bb_std_mult': 2.5826110142450562, 'bear_rsi_os': 33, 'bear_rsi_ob': 58, 'bear_adx_thresh': 9.550969828380213, 'bear_atr_min_pct': 0.0030225617229358093, 'bear_atr_max_pct': 0.10768067568574113, 'bear_tp_mult': 2.1506408738355516, 'bear_tsl_mult': 0.31222979859566913, 'bear_time_stop': 95, 'bear_use_sma': False, 'bear_use_ema': False, 'bear_use_atr': False, 'bear_use_adx': False, 'bear_use_spike': True, 'bear_rsi_required': False, 'sideways_strategy': 'mean_reversion', 'sideways_bb_std_mult': 3.0286513680896334, 'sideways_rsi_os': 29, 'sideways_rsi_ob': 90, 'sideways_adx_thresh': 23.21997208041593, 'sideways_atr_min_pct': 0.003308381808266039, 'sideways_atr_max_pct': 0.10301108417012023, 'sideways_tp_mult': 2.486922821981383, 'sideways_tsl_mult': 0.33720493724323475, 'sideways_time_stop': 271, 'sideways_use_sma': True, 'sideways_use_ema': True, 'sideways_use_atr': True, 'sideways_use_adx': True, 'sideways_use_spike': False, 'sideways_rsi_required': False}.
[I 2025-09-01 14:09:51,955] Trial 293 finished with values: [-0.0011507493276381453, 0.004200024064111951] and parameters: {'p_sma': 29, 'p_std': 52, 'p_atr': 25, 'p_adx': 7, 'rsi_period': 80, 'ema1': 10, 'ema2': 59, 'slip_atr_k': 0.033808611530186265, 'slip_spread_k': 0.5702936160399085, 'spread_hl_frac': 0.007295373733777611, 'bb_std_mult': 3.453299607041574, 'rsi_os': 40, 'rsi_ob': 54, 'vol_spike': 0.1147239704650624, 'adx_thresh': 6.363756562043753, 'atr_min_pct': 0.010612040490746143, 'atr_max_pct': 0.038221741632241624, 'tp_mult': 1.4469472532029042, 'tsl_mult': 0.6353338612137565, 'strategy': 'mean_reversion', 'time_stop': 118, 'use_sma': True, 'use_atr': False, 'use_adx': True, 'use_ema': True, 'use_spike': True, 'rsi_required': True, 'edge_k': 0.21762017763047004, 'edge_cap': 0.9780475357565912, 'bull_strategy': 'breakout', 'bull_bb_std_mult': 3.1058799003942013, 'bull_rsi_os': 11, 'bull_rsi_ob': 75, 'bull_adx_thresh': 13.739477490563772, 'bull_atr_min_pct': 0.011793079440702849, 'bull_atr_max_pct': 0.1296654769188325, 'bull_tp_mult': 1.725068761703468, 'bull_tsl_mult': 0.48780970724670014, 'bull_time_stop': 153, 'bull_use_sma': False, 'bull_use_ema': True, 'bull_use_atr': True, 'bull_use_adx': True, 'bull_use_spike': True, 'bull_rsi_required': True, 'bear_strategy': 'mean_reversion', 'bear_bb_std_mult': 2.451711903184575, 'bear_rsi_os': 37, 'bear_rsi_ob': 58, 'bear_adx_thresh': 9.498486920614972, 'bear_atr_min_pct': 0.002998828626436485, 'bear_atr_max_pct': 0.10769827373219801, 'bear_tp_mult': 2.242624147064664, 'bear_tsl_mult': 0.27000059100463897, 'bear_time_stop': 95, 'bear_use_sma': False, 'bear_use_ema': False, 'bear_use_atr': False, 'bear_use_adx': False, 'bear_use_spike': True, 'bear_rsi_required': False, 'sideways_strategy': 'mean_reversion', 'sideways_bb_std_mult': 3.0484540337098607, 'sideways_rsi_os': 29, 'sideways_rsi_ob': 90, 'sideways_adx_thresh': 25.428458908295635, 'sideways_atr_min_pct': 0.003519736465229183, 'sideways_atr_max_pct': 0.10671907853263651, 'sideways_tp_mult': 2.489250031860707, 'sideways_tsl_mult': 0.354958969507985, 'sideways_time_stop': 269, 'sideways_use_sma': True, 'sideways_use_ema': True, 'sideways_use_atr': False, 'sideways_use_adx': True, 'sideways_use_spike': False, 'sideways_rsi_required': False}.
[I 2025-09-01 14:10:42,321] Trial 297 finished with values: [-0.007040095188478368, 0.009136182531606467] and parameters: {'p_sma': 30, 'p_std': 31, 'p_atr': 28, 'p_adx': 8, 'rsi_period': 82, 'ema1': 10, 'ema2': 59, 'slip_atr_k': 0.013905476171077387, 'slip_spread_k': 0.5697465247657458, 'spread_hl_frac': 0.009090363969772215, 'bb_std_mult': 3.4579054952645607, 'rsi_os': 42, 'rsi_ob': 51, 'vol_spike': 0.11414837338564005, 'adx_thresh': 6.543040504817421, 'atr_min_pct': 0.009996574247227129, 'atr_max_pct': 0.030982270933126926, 'tp_mult': 1.4676155762285525, 'tsl_mult': 0.6712818372487283, 'strategy': 'mean_reversion', 'time_stop': 136, 'use_sma': True, 'use_atr': False, 'use_adx': True, 'use_ema': True, 'use_spike': True, 'rsi_required': True, 'edge_k': 0.14916931701938807, 'edge_cap': 0.8971072402657971, 'bull_strategy': 'breakout', 'bull_bb_std_mult': 3.1551424107123642, 'bull_rsi_os': 10, 'bull_rsi_ob': 79, 'bull_adx_thresh': 12.20123152283966, 'bull_atr_min_pct': 0.011448962468694517, 'bull_atr_max_pct': 0.1295880973481518, 'bull_tp_mult': 1.7160804348080225, 'bull_tsl_mult': 0.45774742054560724, 'bull_time_stop': 165, 'bull_use_sma': False, 'bull_use_ema': True, 'bull_use_atr': True, 'bull_use_adx': True, 'bull_use_spike': True, 'bull_rsi_required': True, 'bear_strategy': 'mean_reversion', 'bear_bb_std_mult': 2.632002625797328, 'bear_rsi_os': 38, 'bear_rsi_ob': 60, 'bear_adx_thresh': 9.73564092778514, 'bear_atr_min_pct': 0.001073697852182189, 'bear_atr_max_pct': 0.11092320431717079, 'bear_tp_mult': 2.1067651320195657, 'bear_tsl_mult': 0.27476290168793804, 'bear_time_stop': 105, 'bear_use_sma': False, 'bear_use_ema': False, 'bear_use_atr': False, 'bear_use_adx': False, 'bear_use_spike': True, 'bear_rsi_required': False, 'sideways_strategy': 'mean_reversion', 'sideways_bb_std_mult': 3.1349436781881996, 'sideways_rsi_os': 30, 'sideways_rsi_ob': 90, 'sideways_adx_thresh': 25.54093676658281, 'sideways_atr_min_pct': 0.003605503809055785, 'sideways_atr_max_pct': 0.10744166946866916, 'sideways_tp_mult': 2.462483655134351, 'sideways_tsl_mult': 0.36075003804263756, 'sideways_time_stop': 281, 'sideways_use_sma': True, 'sideways_use_ema': True, 'sideways_use_atr': False, 'sideways_use_adx': True, 'sideways_use_spike': False, 'sideways_rsi_required': False}.
[I 2025-09-01 14:10:43,555] Trial 298 finished with values: [-0.0023122566634303787, 0.006810657697878883] and parameters: {'p_sma': 30, 'p_std': 52, 'p_atr': 26, 'p_adx': 7, 'rsi_period': 82, 'ema1': 10, 'ema2': 59, 'slip_atr_k': 0.0134358778551768, 'slip_spread_k': 0.5695358047825135, 'spread_hl_frac': 0.015844333759207692, 'bb_std_mult': 3.43415799855773, 'rsi_os': 41, 'rsi_ob': 51, 'vol_spike': 0.11518543543147483, 'adx_thresh': 6.466478431172673, 'atr_min_pct': 0.010048216315048332, 'atr_max_pct': 0.03482609660518366, 'tp_mult': 1.2634954558749594, 'tsl_mult': 0.6674405910901005, 'strategy': 'mean_reversion', 'time_stop': 137, 'use_sma': True, 'use_atr': False, 'use_adx': True, 'use_ema': True, 'use_spike': True, 'rsi_required': True, 'edge_k': 0.15676118276740203, 'edge_cap': 0.9031829671661904, 'bull_strategy': 'mean_reversion', 'bull_bb_std_mult': 3.1231243409868465, 'bull_rsi_os': 10, 'bull_rsi_ob': 80, 'bull_adx_thresh': 12.256435595789435, 'bull_atr_min_pct': 0.011691665107554953, 'bull_atr_max_pct': 0.13097883289026002, 'bull_tp_mult': 1.7046162146521389, 'bull_tsl_mult': 0.4533713060623906, 'bull_time_stop': 166, 'bull_use_sma': False, 'bull_use_ema': True, 'bull_use_atr': True, 'bull_use_adx': True, 'bull_use_spike': True, 'bull_rsi_required': True, 'bear_strategy': 'mean_reversion', 'bear_bb_std_mult': 2.320148091309015, 'bear_rsi_os': 37, 'bear_rsi_ob': 60, 'bear_adx_thresh': 9.944636127693535, 'bear_atr_min_pct': 0.0008523026623037256, 'bear_atr_max_pct': 0.11807310625446699, 'bear_tp_mult': 2.1044943116390487, 'bear_tsl_mult': 0.27783135503538275, 'bear_time_stop': 101, 'bear_use_sma': False, 'bear_use_ema': False, 'bear_use_atr': False, 'bear_use_adx': False, 'bear_use_spike': True, 'bear_rsi_required': False, 'sideways_strategy': 'mean_reversion', 'sideways_bb_std_mult': 3.082479468751971, 'sideways_rsi_os': 29, 'sideways_rsi_ob': 90, 'sideways_adx_thresh': 25.263678758714928, 'sideways_atr_min_pct': 0.004654736287036563, 'sideways_atr_max_pct': 0.10807359602279958, 'sideways_tp_mult': 2.4616168230279163, 'sideways_tsl_mult': 0.3576988450793467, 'sideways_time_stop': 266, 'sideways_use_sma': True, 'sideways_use_ema': True, 'sideways_use_atr': False, 'sideways_use_adx': True, 'sideways_use_spike': False, 'sideways_rsi_required': False}.
