[I 2025-09-01 14:03:13,973] Trial 254 finished with values: [-1000000000.0, 1000000000.0] and parameters: {'p_sma': 30, 'p_std': 27, 'p_atr': 29, 'p_adx': 7, 'rsi_period': 67, 'ema1': 8, 'ema2': 59, 'slip_atr_k': 0.00028675589408607566, 'slip_spread_k': 0.5234661085031987, 'spread_hl_frac': 0.012787782631755193, 'bb_std_mult': 3.443291627841292, 'rsi_os': 42, 'rsi_ob': 46, 'vol_spike': 0.11356325438074044, 'adx_thresh': 6.501054535690718, 'atr_min_pct': 0.013151738850055878, 'atr_max_pct': 0.02438831324390597, 'tp_mult': 1.2518850090493996, 'tsl_mult': 0.7099162629236178, 'strategy': 'mean_reversion', 'time_stop': 107, 'use_sma': True, 'use_atr': False, 'use_adx': True, 'use_ema': True, 'use_spike': True, 'rsi_required': True, 'edge_k': 0.15963327702415964, 'edge_cap': 0.9753048684717771, 'bull_strategy': 'breakout', 'bull_bb_std_mult': 3.5099062948994257, 'bull_rsi_os': 15, 'bull_rsi_ob': 79, 'bull_adx_thresh': 10.45587820337758, 'bull_atr_min_pct': 0.011172176357573293, 'bull_atr_max_pct': 0.12581751319429244, 'bull_tp_mult': 1.583380018563372, 'bull_tsl_mult': 0.5674542247513394, 'bull_time_stop': 145, 'bull_use_sma': False, 'bull_use_ema': True, 'bull_use_atr': True, 'bull_use_adx': True, 'bull_use_spike': True, 'bull_rsi_required': True, 'bear_strategy': 'mean_reversion', 'bear_bb_std_mult': 2.5959212433147103, 'bear_rsi_os': 36, 'bear_rsi_ob': 56, 'bear_adx_thresh': 7.178948127607682, 'bear_atr_min_pct': 0.0028150939940346487, 'bear_atr_max_pct': 0.11822998378107055, 'bear_tp_mult': 2.022498643798631, 'bear_tsl_mult': 0.15744215911135426, 'bear_time_stop': 59, 'bear_use_sma': False, 'bear_use_ema': False, 'bear_use_atr': False, 'bear_use_adx': False, 'bear_use_spike': True, 'bear_rsi_required': False, 'sideways_strategy': 'mean_reversion', 'sideways_bb_std_mult': 3.2821398612066215, 'sideways_rsi_os': 32, 'sideways_rsi_ob': 90, 'sideways_adx_thresh': 25.732782451063173, 'sideways_atr_min_pct': 0.0030645170278157446, 'sideways_atr_max_pct': 0.11377256873372288, 'sideways_tp_mult': 2.371021099472776, 'sideways_tsl_mult': 0.4192325772836529, 'sideways_time_stop': 243, 'sideways_use_sma': True, 'sideways_use_ema': True, 'sideways_use_atr': True, 'sideways_use_adx': True, 'sideways_use_spike': False, 'sideways_rsi_required': False}.
[I 2025-09-01 14:03:14,334] Trial 256 finished with values: [-1000000000.0, 1000000000.0] and parameters: {'p_sma': 29, 'p_std': 25, 'p_atr': 26, 'p_adx': 8, 'rsi_period': 82, 'ema1': 9, 'ema2': 54, 'slip_atr_k': 0.004300648183864584, 'slip_spread_k': 0.5355507862079837, 'spread_hl_frac': 0.009981214366835118, 'bb_std_mult': 3.518939820500884, 'rsi_os': 44, 'rsi_ob': 50, 'vol_spike': 0.10982296877321554, 'adx_thresh': 5.883013267028146, 'atr_min_pct': 0.011725701960615308, 'atr_max_pct': 0.023804628721382108, 'tp_mult': 1.4045494976032942, 'tsl_mult': 0.7606497917657546, 'strategy': 'mean_reversion', 'time_stop': 116, 'use_sma': True, 'use_atr': False, 'use_adx': True, 'use_ema': True, 'use_spike': True, 'rsi_required': True, 'edge_k': 0.29379997269383984, 'edge_cap': 0.9523621903063718, 'bull_strategy': 'breakout', 'bull_bb_std_mult': 3.2594826553693284, 'bull_rsi_os': 16, 'bull_rsi_ob': 80, 'bull_adx_thresh': 9.85428346251701, 'bull_atr_min_pct': 0.01147709552804314, 'bull_atr_max_pct': 0.13281250537752842, 'bull_tp_mult': 1.4873363631598047, 'bull_tsl_mult': 0.6271522660312322, 'bull_time_stop': 150, 'bull_use_sma': False, 'bull_use_ema': True, 'bull_use_atr': True, 'bull_use_adx': True, 'bull_use_spike': True, 'bull_rsi_required': True, 'bear_strategy': 'mean_reversion', 'bear_bb_std_mult': 2.457361876111466, 'bear_rsi_os': 38, 'bear_rsi_ob': 56, 'bear_adx_thresh': 7.033636068359936, 'bear_atr_min_pct': 0.0018255077265478918, 'bear_atr_max_pct': 0.11648063867629888, 'bear_tp_mult': 2.001562568615754, 'bear_tsl_mult': 0.1892167858261198, 'bear_time_stop': 75, 'bear_use_sma': False, 'bear_use_ema': False, 'bear_use_atr': False, 'bear_use_adx': False, 'bear_use_spike': True, 'bear_rsi_required': False, 'sideways_strategy': 'mean_reversion', 'sideways_bb_std_mult': 3.0984635273949044, 'sideways_rsi_os': 33, 'sideways_rsi_ob': 88, 'sideways_adx_thresh': 25.7395087282214, 'sideways_atr_min_pct': 0.004416069372352027, 'sideways_atr_max_pct': 0.11569784576453697, 'sideways_tp_mult': 2.3252659367636577, 'sideways_tsl_mult': 0.47071644664978746, 'sideways_time_stop': 239, 'sideways_use_sma': True, 'sideways_use_ema': True, 'sideways_use_atr': True, 'sideways_use_adx': True, 'sideways_use_spike': False, 'sideways_rsi_required': False}.
[I 2025-09-01 14:03:49,857] Trial 253 finished with values: [-0.001592203459483299, 0.005011826344025855] and parameters: {'p_sma': 9, 'p_std': 52, 'p_atr': 20, 'p_adx': 7, 'rsi_period': 9, 'ema1': 8, 'ema2': 60, 'slip_atr_k': 0.0007183980005736189, 'slip_spread_k': 0.5299081530102273, 'spread_hl_frac': 0.04186966168667092, 'bb_std_mult': 1.847250945996482, 'rsi_os': 8, 'rsi_ob': 51, 'vol_spike': 0.11554723623677635, 'adx_thresh': 6.091978189130613, 'atr_min_pct': 0.01628481929364862, 'atr_max_pct': 0.024072464059849856, 'tp_mult': 2.4186165474106813, 'tsl_mult': 0.07714075094439372, 'strategy': 'breakout', 'time_stop': 105, 'use_sma': True, 'use_atr': True, 'use_adx': False, 'use_ema': False, 'use_spike': True, 'rsi_required': False, 'edge_k': 1.7690794441674487, 'edge_cap': 0.9258998843056667, 'bull_strategy': 'breakout', 'bull_bb_std_mult': 3.5310662813833327, 'bull_rsi_os': 17, 'bull_rsi_ob': 52, 'bull_adx_thresh': 10.474237389632806, 'bull_atr_min_pct': 0.010122761806834444, 'bull_atr_max_pct': 0.12335036694884298, 'bull_tp_mult': 1.3457104725653455, 'bull_tsl_mult': 0.5716948106091361, 'bull_time_stop': 149, 'bull_use_sma': False, 'bull_use_ema': True, 'bull_use_atr': False, 'bull_use_adx': True, 'bull_use_spike': False, 'bull_rsi_required': False, 'bear_strategy': 'breakout', 'bear_bb_std_mult': 2.2053997365932787, 'bear_rsi_os': 19, 'bear_rsi_ob': 49, 'bear_adx_thresh': 6.899000397148039, 'bear_atr_min_pct': 0.0029873987571971848, 'bear_atr_max_pct': 0.06456291584135837, 'bear_tp_mult': 1.9472579071558846, 'bear_tsl_mult': 0.34846812165151286, 'bear_time_stop': 60, 'bear_use_sma': False, 'bear_use_ema': True, 'bear_use_atr': False, 'bear_use_adx': True, 'bear_use_spike': False, 'bear_rsi_required': True, 'sideways_strategy': 'breakout', 'sideways_bb_std_mult': 0.7218488836209191, 'sideways_rsi_os': 34, 'sideways_rsi_ob': 73, 'sideways_adx_thresh': 6.663765358707122, 'sideways_atr_min_pct': 0.0028892435346651937, 'sideways_atr_max_pct': 0.11713271672025599, 'sideways_tp_mult': 2.0488543476467775, 'sideways_tsl_mult': 0.7016936736979847, 'sideways_time_stop': 243, 'sideways_use_sma': False, 'sideways_use_ema': True, 'sideways_use_atr': True, 'sideways_use_adx': False, 'sideways_use_spike': False, 'sideways_rsi_required': False}.
[I 2025-09-01 14:03:50,366] Trial 255 finished with values: [0.005939959923554339, 0.0037683704761547567] and parameters: {'p_sma': 29, 'p_std': 27, 'p_atr': 26, 'p_adx': 8, 'rsi_period': 79, 'ema1': 8, 'ema2': 55, 'slip_atr_k': 0.0043796233164999695, 'slip_spread_k': 0.5384908230513694, 'spread_hl_frac': 0.009729302481670454, 'bb_std_mult': 3.5289117313688525, 'rsi_os': 44, 'rsi_ob': 52, 'vol_spike': 0.10829562291632092, 'adx_thresh': 6.365479700895452, 'atr_min_pct': 0.012449462628554203, 'atr_max_pct': 0.02444509977533641, 'tp_mult': 1.3885016818326523, 'tsl_mult': 0.6999918604997056, 'strategy': 'mean_reversion', 'time_stop': 112, 'use_sma': True, 'use_atr': False, 'use_adx': True, 'use_ema': True, 'use_spike': True, 'rsi_required': True, 'edge_k': 0.20817687457080203, 'edge_cap': 0.953516924076262, 'bull_strategy': 'breakout', 'bull_bb_std_mult': 2.720381131182018, 'bull_rsi_os': 15, 'bull_rsi_ob': 78, 'bull_adx_thresh': 10.693768269705197, 'bull_atr_min_pct': 0.011200494612894935, 'bull_atr_max_pct': 0.1258948050740526, 'bull_tp_mult': 1.6048107414887176, 'bull_tsl_mult': 0.5684667765057821, 'bull_time_stop': 149, 'bull_use_sma': False, 'bull_use_ema': True, 'bull_use_atr': True, 'bull_use_adx': True, 'bull_use_spike': True, 'bull_rsi_required': True, 'bear_strategy': 'mean_reversion', 'bear_bb_std_mult': 2.5754693662560975, 'bear_rsi_os': 36, 'bear_rsi_ob': 56, 'bear_adx_thresh': 7.0799032431807705, 'bear_atr_min_pct': 0.002744575533059145, 'bear_atr_max_pct': 0.11548061219770915, 'bear_tp_mult': 2.057741347717488, 'bear_tsl_mult': 0.1875687299764621, 'bear_time_stop': 80, 'bear_use_sma': False, 'bear_use_ema': False, 'bear_use_atr': False, 'bear_use_adx': False, 'bear_use_spike': True, 'bear_rsi_required': False, 'sideways_strategy': 'mean_reversion', 'sideways_bb_std_mult': 3.075816312380563, 'sideways_rsi_os': 32, 'sideways_rsi_ob': 88, 'sideways_adx_thresh': 26.223122524524868, 'sideways_atr_min_pct': 0.003972630413499989, 'sideways_atr_max_pct': 0.11355428822566493, 'sideways_tp_mult': 2.3668617070892677, 'sideways_tsl_mult': 0.3850527787112628, 'sideways_time_stop': 242, 'sideways_use_sma': True, 'sideways_use_ema': True, 'sideways_use_atr': True, 'sideways_use_adx': True, 'sideways_use_spike': False, 'sideways_rsi_required': False}.
[I 2025-09-01 14:03:50,532] Trial 252 finished with values: [-1000000000.0, 1000000000.0] and parameters: {'p_sma': 9, 'p_std': 27, 'p_atr': 20, 'p_adx': 7, 'rsi_period': 53, 'ema1': 13, 'ema2': 14, 'slip_atr_k': 0.00025050800827984814, 'slip_spread_k': 0.6569893420556575, 'spread_hl_frac': 0.030988790917140113, 'bb_std_mult': 1.9948031522075222, 'rsi_os': 32, 'rsi_ob': 74, 'vol_spike': 0.11433819187120929, 'adx_thresh': 5.913696290258308, 'atr_min_pct': 0.01639503246302678, 'atr_max_pct': 0.1088849106701348, 'tp_mult': 2.7652292395626445, 'tsl_mult': 0.0747615019715165, 'strategy': 'mean_reversion', 'time_stop': 103, 'use_sma': True, 'use_atr': False, 'use_adx': False, 'use_ema': True, 'use_spike': True, 'rsi_required': True, 'edge_k': 1.142060747735024, 'edge_cap': 0.9179937352974925, 'bull_strategy': 'breakout', 'bull_bb_std_mult': 1.3882283763246293, 'bull_rsi_os': 17, 'bull_rsi_ob': 67, 'bull_adx_thresh': 10.10787646576479, 'bull_atr_min_pct': 0.010242929625382001, 'bull_atr_max_pct': 0.12560471131870019, 'bull_tp_mult': 1.4759158003605817, 'bull_tsl_mult': 0.22521255363964748, 'bull_time_stop': 107, 'bull_use_sma': False, 'bull_use_ema': True, 'bull_use_atr': True, 'bull_use_adx': True, 'bull_use_spike': True, 'bull_rsi_required': False, 'bear_strategy': 'mean_reversion', 'bear_bb_std_mult': 3.0677638520742456, 'bear_rsi_os': 48, 'bear_rsi_ob': 95, 'bear_adx_thresh': 13.105412896798533, 'bear_atr_min_pct': 0.029954112553441593, 'bear_atr_max_pct': 0.12913376886550137, 'bear_tp_mult': 1.952810933076498, 'bear_tsl_mult': 0.9045675048811506, 'bear_time_stop': 79, 'bear_use_sma': False, 'bear_use_ema': True, 'bear_use_atr': False, 'bear_use_adx': True, 'bear_use_spike': False, 'bear_rsi_required': True, 'sideways_strategy': 'breakout', 'sideways_bb_std_mult': 0.6480116390913586, 'sideways_rsi_os': 32, 'sideways_rsi_ob': 87, 'sideways_adx_thresh': 30.174461464883343, 'sideways_atr_min_pct': 0.004965229340164367, 'sideways_atr_max_pct': 0.06270354840517264, 'sideways_tp_mult': 2.7104218272891045, 'sideways_tsl_mult': 0.5331927216142025, 'sideways_time_stop': 242, 'sideways_use_sma': False, 'sideways_use_ema': True, 'sideways_use_atr': True, 'sideways_use_adx': True, 'sideways_use_spike': False, 'sideways_rsi_required': False}.
[I 2025-09-01 14:03:52,236] Trial 257 finished with values: [0.006193016085851433, 0.005647959692665592] and parameters: {'p_sma': 28, 'p_std': 27, 'p_atr': 26, 'p_adx': 8, 'rsi_period': 78, 'ema1': 8, 'ema2': 58, 'slip_atr_k': 0.003814041493486627, 'slip_spread_k': 0.5054227954046996, 'spread_hl_frac': 0.009735948306234313, 'bb_std_mult': 3.566253008379081, 'rsi_os': 44, 'rsi_ob': 52, 'vol_spike': 0.12176725770082535, 'adx_thresh': 5.369354369791536, 'atr_min_pct': 0.011780506146855317, 'atr_max_pct': 0.026701520290904876, 'tp_mult': 1.3925852264469567, 'tsl_mult': 0.717768501629405, 'strategy': 'mean_reversion', 'time_stop': 106, 'use_sma': True, 'use_atr': False, 'use_adx': True, 'use_ema': True, 'use_spike': True, 'rsi_required': True, 'edge_k': 0.5634306292602087, 'edge_cap': 0.9656732048509423, 'bull_strategy': 'breakout', 'bull_bb_std_mult': 3.186000251760067, 'bull_rsi_os': 14, 'bull_rsi_ob': 78, 'bull_adx_thresh': 10.671121022279813, 'bull_atr_min_pct': 0.012678918424875384, 'bull_atr_max_pct': 0.1276639497362364, 'bull_tp_mult': 1.5378480864427373, 'bull_tsl_mult': 0.5894727069519208, 'bull_time_stop': 149, 'bull_use_sma': False, 'bull_use_ema': True, 'bull_use_atr': True, 'bull_use_adx': True, 'bull_use_spike': True, 'bull_rsi_required': True, 'bear_strategy': 'mean_reversion', 'bear_bb_std_mult': 2.5241009187637786, 'bear_rsi_os': 35, 'bear_rsi_ob': 55, 'bear_adx_thresh': 6.779220006832702, 'bear_atr_min_pct': 0.0023871507157002645, 'bear_atr_max_pct': 0.11051696166590054, 'bear_tp_mult': 2.0363857078102194, 'bear_tsl_mult': 0.12884153441227494, 'bear_time_stop': 69, 'bear_use_sma': False, 'bear_use_ema': False, 'bear_use_atr': False, 'bear_use_adx': False, 'bear_use_spike': True, 'bear_rsi_required': False, 'sideways_strategy': 'mean_reversion', 'sideways_bb_std_mult': 3.3279633670081257, 'sideways_rsi_os': 34, 'sideways_rsi_ob': 90, 'sideways_adx_thresh': 26.34821719983045, 'sideways_atr_min_pct': 0.004904570027914569, 'sideways_atr_max_pct': 0.11728481379314476, 'sideways_tp_mult': 2.4127334949909107, 'sideways_tsl_mult': 0.34655357603556325, 'sideways_time_stop': 250, 'sideways_use_sma': True, 'sideways_use_ema': True, 'sideways_use_atr': True, 'sideways_use_adx': True, 'sideways_use_spike': False, 'sideways_rsi_required': False}.
[I 2025-09-01 14:03:52,936] Trial 258 finished with values: [-1000000000.0, 1000000000.0] and parameters: {'p_sma': 29, 'p_std': 27, 'p_atr': 20, 'p_adx': 7, 'rsi_period': 84, 'ema1': 8, 'ema2': 60, 'slip_atr_k': 0.004728537818603721, 'slip_spread_k': 0.5759554515173562, 'spread_hl_frac': 0.009914414424591995, 'bb_std_mult': 3.5401396407798025, 'rsi_os': 44, 'rsi_ob': 48, 'vol_spike': 0.11965205255674419, 'adx_thresh': 6.601045821522353, 'atr_min_pct': 0.012405818061532264, 'atr_max_pct': 0.021851849078583077, 'tp_mult': 1.3332233905979722, 'tsl_mult': 0.7010897949929614, 'strategy': 'mean_reversion', 'time_stop': 115, 'use_sma': True, 'use_atr': False, 'use_adx': True, 'use_ema': True, 'use_spike': True, 'rsi_required': True, 'edge_k': 0.34110878123373156, 'edge_cap': 0.9830948541520912, 'bull_strategy': 'breakout', 'bull_bb_std_mult': 2.931420367113373, 'bull_rsi_os': 17, 'bull_rsi_ob': 84, 'bull_adx_thresh': 10.695414025924515, 'bull_atr_min_pct': 0.012627223279786071, 'bull_atr_max_pct': 0.1263637537283698, 'bull_tp_mult': 1.5528242712444074, 'bull_tsl_mult': 0.5828057092589484, 'bull_time_stop': 129, 'bull_use_sma': False, 'bull_use_ema': True, 'bull_use_atr': True, 'bull_use_adx': True, 'bull_use_spike': True, 'bull_rsi_required': True, 'bear_strategy': 'mean_reversion', 'bear_bb_std_mult': 2.6148133420282544, 'bear_rsi_os': 37, 'bear_rsi_ob': 55, 'bear_adx_thresh': 6.608865448733297, 'bear_atr_min_pct': 0.002411429062333952, 'bear_atr_max_pct': 0.1158814505629456, 'bear_tp_mult': 2.073005321009362, 'bear_tsl_mult': 0.171397813002662, 'bear_time_stop': 69, 'bear_use_sma': False, 'bear_use_ema': False, 'bear_use_atr': False, 'bear_use_adx': False, 'bear_use_spike': True, 'bear_rsi_required': False, 'sideways_strategy': 'mean_reversion', 'sideways_bb_std_mult': 3.5385794359510996, 'sideways_rsi_os': 34, 'sideways_rsi_ob': 90, 'sideways_adx_thresh': 26.10262548600632, 'sideways_atr_min_pct': 0.013227364376122555, 'sideways_atr_max_pct': 0.11664165684762584, 'sideways_tp_mult': 2.341609769679183, 'sideways_tsl_mult': 0.39190256702413556, 'sideways_time_stop': 251, 'sideways_use_sma': True, 'sideways_use_ema': True, 'sideways_use_atr': True, 'sideways_use_adx': True, 'sideways_use_spike': False, 'sideways_rsi_required': False}.
[I 2025-09-01 14:04:32,106] Trial 261 finished with values: [0.0010534364021972387, 0.007661837456344294] and parameters: {'p_sma': 28, 'p_std': 28, 'p_atr': 25, 'p_adx': 9, 'rsi_period': 78, 'ema1': 8, 'ema2': 58, 'slip_atr_k': 0.014152935298500332, 'slip_spread_k': 0.49944776240307437, 'spread_hl_frac': 0.010084921381757296, 'bb_std_mult': 3.565544730837873, 'rsi_os': 43, 'rsi_ob': 52, 'vol_spike': 0.12164366476465825, 'adx_thresh': 5.358334762131082, 'atr_min_pct': 0.012188044355993823, 'atr_max_pct': 0.03420671385737045, 'tp_mult': 1.3608697245411385, 'tsl_mult': 0.7054021458826624, 'strategy': 'mean_reversion', 'time_stop': 121, 'use_sma': True, 'use_atr': False, 'use_adx': True, 'use_ema': True, 'use_spike': True, 'rsi_required': True, 'edge_k': 0.2747868898766135, 'edge_cap': 0.9571582318223835, 'bull_strategy': 'breakout', 'bull_bb_std_mult': 2.7425299451132785, 'bull_rsi_os': 14, 'bull_rsi_ob': 77, 'bull_adx_thresh': 10.883104286645558, 'bull_atr_min_pct': 0.012560277101047077, 'bull_atr_max_pct': 0.12547965373671197, 'bull_tp_mult': 1.61676265211173, 'bull_tsl_mult': 0.5869949255372389, 'bull_time_stop': 152, 'bull_use_sma': False, 'bull_use_ema': True, 'bull_use_atr': True, 'bull_use_adx': True, 'bull_use_spike': True, 'bull_rsi_required': True, 'bear_strategy': 'mean_reversion', 'bear_bb_std_mult': 2.3940458176670876, 'bear_rsi_os': 35, 'bear_rsi_ob': 57, 'bear_adx_thresh': 7.688288627442493, 'bear_atr_min_pct': 0.00205799206471661, 'bear_atr_max_pct': 0.1150328276276049, 'bear_tp_mult': 2.078770932283058, 'bear_tsl_mult': 0.11872847971934566, 'bear_time_stop': 86, 'bear_use_sma': False, 'bear_use_ema': False, 'bear_use_atr': False, 'bear_use_adx': False, 'bear_use_spike': True, 'bear_rsi_required': False, 'sideways_strategy': 'mean_reversion', 'sideways_bb_std_mult': 3.3454986309051176, 'sideways_rsi_os': 31, 'sideways_rsi_ob': 92, 'sideways_adx_thresh': 26.319640852089798, 'sideways_atr_min_pct': 0.004208275799449101, 'sideways_atr_max_pct': 0.11338895822020076, 'sideways_tp_mult': 2.41533871665269, 'sideways_tsl_mult': 0.3904482000765988, 'sideways_time_stop': 259, 'sideways_use_sma': True, 'sideways_use_ema': True, 'sideways_use_atr': True, 'sideways_use_adx': True, 'sideways_use_spike': False, 'sideways_rsi_required': False}.
[I 2025-09-01 14:04:32,527] Trial 259 finished with values: [-0.004662103510309157, 0.010690803993790077] and parameters: {'p_sma': 28, 'p_std': 27, 'p_atr': 20, 'p_adx': 8, 'rsi_period': 84, 'ema1': 8, 'ema2': 55, 'slip_atr_k': 0.019654889876117805, 'slip_spread_k': 0.5806566628697942, 'spread_hl_frac': 0.011664439749814143, 'bb_std_mult': 3.567486267334567, 'rsi_os': 42, 'rsi_ob': 51, 'vol_spike': 0.10899665021187618, 'adx_thresh': 5.551611495073615, 'atr_min_pct': 0.01221758723194802, 'atr_max_pct': 0.027422037116578382, 'tp_mult': 1.3733619402968698, 'tsl_mult': 0.7110514666517712, 'strategy': 'mean_reversion', 'time_stop': 118, 'use_sma': True, 'use_atr': False, 'use_adx': True, 'use_ema': True, 'use_spike': True, 'rsi_required': True, 'edge_k': 0.20296833620524501, 'edge_cap': 0.9273156365746059, 'bull_strategy': 'breakout', 'bull_bb_std_mult': 2.743958033013867, 'bull_rsi_os': 14, 'bull_rsi_ob': 77, 'bull_adx_thresh': 10.628479552689663, 'bull_atr_min_pct': 0.011012245406868607, 'bull_atr_max_pct': 0.1258125972425742, 'bull_tp_mult': 1.8439007808330934, 'bull_tsl_mult': 0.5018757070651336, 'bull_time_stop': 146, 'bull_use_sma': False, 'bull_use_ema': True, 'bull_use_atr': True, 'bull_use_adx': True, 'bull_use_spike': True, 'bull_rsi_required': True, 'bear_strategy': 'mean_reversion', 'bear_bb_std_mult': 2.5185239023619532, 'bear_rsi_os': 35, 'bear_rsi_ob': 62, 'bear_adx_thresh': 8.21797197045229, 'bear_atr_min_pct': 0.0016771873536014406, 'bear_atr_max_pct': 0.12032898270677873, 'bear_tp_mult': 2.0912580752361025, 'bear_tsl_mult': 0.24563449627982942, 'bear_time_stop': 84, 'bear_use_sma': False, 'bear_use_ema': False, 'bear_use_atr': False, 'bear_use_adx': False, 'bear_use_spike': True, 'bear_rsi_required': False, 'sideways_strategy': 'mean_reversion', 'sideways_bb_std_mult': 3.2122331967664626, 'sideways_rsi_os': 30, 'sideways_rsi_ob': 90, 'sideways_adx_thresh': 26.317339381638583, 'sideways_atr_min_pct': 0.00496302709908627, 'sideways_atr_max_pct': 0.09976746823953372, 'sideways_tp_mult': 2.347103747755211, 'sideways_tsl_mult': 0.39457771773247285, 'sideways_time_stop': 250, 'sideways_use_sma': True, 'sideways_use_ema': True, 'sideways_use_atr': True, 'sideways_use_adx': True, 'sideways_use_spike': False, 'sideways_rsi_required': False}.
