[I 2025-09-01 14:51:23,093] Trial 573 finished with values: [-1000000000.0, 1000000000.0] and parameters: {'p_sma': 33, 'p_std': 44, 'p_atr': 9, 'p_adx': 10, 'rsi_period': 50, 'ema1': 17, 'ema2': 55, 'slip_atr_k': 0.16774536297063466, 'slip_spread_k': 0.5996524156311697, 'spread_hl_frac': 0.01101538799535189, 'bb_std_mult': 3.5175194807800043, 'rsi_os': 7, 'rsi_ob': 53, 'vol_spike': 0.09161765783839573, 'adx_thresh': 5.525831083298708, 'atr_min_pct': 0.011110382490557399, 'atr_max_pct': 0.07439618784959255, 'tp_mult': 1.3395455750848875, 'tsl_mult': 0.726870241526534, 'strategy': 'mean_reversion', 'time_stop': 129, 'use_sma': True, 'use_atr': False, 'use_adx': True, 'use_ema': True, 'use_spike': True, 'rsi_required': True, 'edge_k': 0.26988132508390555, 'edge_cap': 0.9498632557327548, 'bull_strategy': 'mean_reversion', 'bull_bb_std_mult': 3.269061632853823, 'bull_rsi_os': 8, 'bull_rsi_ob': 77, 'bull_adx_thresh': 18.43883388041021, 'bull_atr_min_pct': 0.011203810473871196, 'bull_atr_max_pct': 0.08995389013901249, 'bull_tp_mult': 1.5724227463586915, 'bull_tsl_mult': 0.47669698199545835, 'bull_time_stop': 154, 'bull_use_sma': False, 'bull_use_ema': True, 'bull_use_atr': True, 'bull_use_adx': True, 'bull_use_spike': True, 'bull_rsi_required': True, 'bear_strategy': 'mean_reversion', 'bear_bb_std_mult': 2.424344305521516, 'bear_rsi_os': 36, 'bear_rsi_ob': 79, 'bear_adx_thresh': 8.338409379950669, 'bear_atr_min_pct': 0.014642771998885357, 'bear_atr_max_pct': 0.10958169710291689, 'bear_tp_mult': 2.0251780524454044, 'bear_tsl_mult': 0.09078767604202018, 'bear_time_stop': 77, 'bear_use_sma': False, 'bear_use_ema': False, 'bear_use_atr': False, 'bear_use_adx': False, 'bear_use_spike': True, 'bear_rsi_required': False, 'sideways_strategy': 'mean_reversion', 'sideways_bb_std_mult': 2.683631874756332, 'sideways_rsi_os': 13, 'sideways_rsi_ob': 92, 'sideways_adx_thresh': 25.753446758874635, 'sideways_atr_min_pct': 0.004946333961751412, 'sideways_atr_max_pct': 0.10725798958421802, 'sideways_tp_mult': 2.576700058100754, 'sideways_tsl_mult': 0.6690182956765085, 'sideways_time_stop': 252, 'sideways_use_sma': True, 'sideways_use_ema': True, 'sideways_use_atr': True, 'sideways_use_adx': True, 'sideways_use_spike': False, 'sideways_rsi_required': False}.
[I 2025-09-01 14:52:00,356] Trial 580 finished with values: [-1000000000.0, 1000000000.0] and parameters: {'p_sma': 31, 'p_std': 12, 'p_atr': 14, 'p_adx': 8, 'rsi_period': 82, 'ema1': 10, 'ema2': 54, 'slip_atr_k': 0.02416171703550333, 'slip_spread_k': 0.396765492570601, 'spread_hl_frac': 0.048865088128198286, 'bb_std_mult': 3.4127871384866375, 'rsi_os': 41, 'rsi_ob': 55, 'vol_spike': 0.17966372812535647, 'adx_thresh': 15.573670973933655, 'atr_min_pct': 0.013172704831885174, 'atr_max_pct': 0.04853343014593014, 'tp_mult': 1.2707007624792304, 'tsl_mult': 0.699699201593897, 'strategy': 'breakout', 'time_stop': 122, 'use_sma': True, 'use_atr': True, 'use_adx': True, 'use_ema': False, 'use_spike': True, 'rsi_required': True, 'edge_k': 0.1322087827507583, 'edge_cap': 0.9700924433535729, 'bull_strategy': 'breakout', 'bull_bb_std_mult': 3.599851580973392, 'bull_rsi_os': 14, 'bull_rsi_ob': 79, 'bull_adx_thresh': 6.6748916871682695, 'bull_atr_min_pct': 0.007508477899954659, 'bull_atr_max_pct': 0.13296273892806945, 'bull_tp_mult': 2.540721870734035, 'bull_tsl_mult': 0.9285196683695981, 'bull_time_stop': 166, 'bull_use_sma': True, 'bull_use_ema': False, 'bull_use_atr': True, 'bull_use_adx': False, 'bull_use_spike': False, 'bull_rsi_required': False, 'bear_strategy': 'breakout', 'bear_bb_std_mult': 1.6267924253078292, 'bear_rsi_os': 33, 'bear_rsi_ob': 70, 'bear_adx_thresh': 7.699442880854469, 'bear_atr_min_pct': 0.0027404070883201817, 'bear_atr_max_pct': 0.11696627064408162, 'bear_tp_mult': 1.066932631351134, 'bear_tsl_mult': 0.591466392369692, 'bear_time_stop': 105, 'bear_use_sma': False, 'bear_use_ema': False, 'bear_use_atr': True, 'bear_use_adx': False, 'bear_use_spike': True, 'bear_rsi_required': True, 'sideways_strategy': 'mean_reversion', 'sideways_bb_std_mult': 3.0462929453188616, 'sideways_rsi_os': 34, 'sideways_rsi_ob': 51, 'sideways_adx_thresh': 26.388140664672825, 'sideways_atr_min_pct': 0.0028126440220042495, 'sideways_atr_max_pct': 0.11958839974531653, 'sideways_tp_mult': 2.431200820733357, 'sideways_tsl_mult': 0.30460381677438986, 'sideways_time_stop': 244, 'sideways_use_sma': True, 'sideways_use_ema': False, 'sideways_use_atr': True, 'sideways_use_adx': True, 'sideways_use_spike': True, 'sideways_rsi_required': True}.
[I 2025-09-01 14:52:00,365] Trial 579 finished with values: [-1000000000.0, 1000000000.0] and parameters: {'p_sma': 31, 'p_std': 12, 'p_atr': 14, 'p_adx': 15, 'rsi_period': 56, 'ema1': 10, 'ema2': 57, 'slip_atr_k': 0.031201161126580237, 'slip_spread_k': 0.08287301364707828, 'spread_hl_frac': 0.008408366194087386, 'bb_std_mult': 3.292916252523087, 'rsi_os': 41, 'rsi_ob': 55, 'vol_spike': 0.02205689321680271, 'adx_thresh': 6.481313514254307, 'atr_min_pct': 0.003855836722333004, 'atr_max_pct': 0.13465449808060195, 'tp_mult': 1.2819512927391785, 'tsl_mult': 0.9957008065465579, 'strategy': 'breakout', 'time_stop': 102, 'use_sma': True, 'use_atr': True, 'use_adx': True, 'use_ema': False, 'use_spike': True, 'rsi_required': True, 'edge_k': 0.76279397025829, 'edge_cap': 0.9728593657103, 'bull_strategy': 'breakout', 'bull_bb_std_mult': 3.085080508615088, 'bull_rsi_os': 54, 'bull_rsi_ob': 79, 'bull_adx_thresh': 7.0365212823771275, 'bull_atr_min_pct': 0.020182041961887623, 'bull_atr_max_pct': 0.061968354114532664, 'bull_tp_mult': 2.9605138182021626, 'bull_tsl_mult': 0.21077140376292763, 'bull_time_stop': 160, 'bull_use_sma': True, 'bull_use_ema': False, 'bull_use_atr': True, 'bull_use_adx': False, 'bull_use_spike': False, 'bull_rsi_required': False, 'bear_strategy': 'breakout', 'bear_bb_std_mult': 2.7481347028904954, 'bear_rsi_os': 33, 'bear_rsi_ob': 48, 'bear_adx_thresh': 7.627861277541069, 'bear_atr_min_pct': 0.013310952783363163, 'bear_atr_max_pct': 0.10517268319771292, 'bear_tp_mult': 1.9511366478518883, 'bear_tsl_mult': 0.17896563522233327, 'bear_time_stop': 83, 'bear_use_sma': False, 'bear_use_ema': False, 'bear_use_atr': True, 'bear_use_adx': False, 'bear_use_spike': True, 'bear_rsi_required': True, 'sideways_strategy': 'mean_reversion', 'sideways_bb_std_mult': 3.0516318233321926, 'sideways_rsi_os': 29, 'sideways_rsi_ob': 51, 'sideways_adx_thresh': 23.802036742374053, 'sideways_atr_min_pct': 0.0038390031053314906, 'sideways_atr_max_pct': 0.11956758108451004, 'sideways_tp_mult': 1.348212976263654, 'sideways_tsl_mult': 0.3172961066703748, 'sideways_time_stop': 206, 'sideways_use_sma': True, 'sideways_use_ema': False, 'sideways_use_atr': True, 'sideways_use_adx': True, 'sideways_use_spike': True, 'sideways_rsi_required': True}.
[I 2025-09-01 14:52:00,366] Trial 577 finished with values: [-1000000000.0, 1000000000.0] and parameters: {'p_sma': 31, 'p_std': 29, 'p_atr': 14, 'p_adx': 8, 'rsi_period': 49, 'ema1': 24, 'ema2': 57, 'slip_atr_k': 0.16731814959729804, 'slip_spread_k': 0.27327071414022047, 'spread_hl_frac': 0.04933001476023913, 'bb_std_mult': 2.6360800918967855, 'rsi_os': 39, 'rsi_ob': 83, 'vol_spike': 0.23606741701673573, 'adx_thresh': 6.551559074817362, 'atr_min_pct': 0.010869224354845367, 'atr_max_pct': 0.1063412904115695, 'tp_mult': 2.830177318974932, 'tsl_mult': 0.7062744086081297, 'strategy': 'mean_reversion', 'time_stop': 243, 'use_sma': True, 'use_atr': False, 'use_adx': True, 'use_ema': True, 'use_spike': True, 'rsi_required': True, 'edge_k': 0.19933280063269126, 'edge_cap': 0.14015097109058172, 'bull_strategy': 'mean_reversion', 'bull_bb_std_mult': 3.3073986231155215, 'bull_rsi_os': 49, 'bull_rsi_ob': 77, 'bull_adx_thresh': 12.717570168274756, 'bull_atr_min_pct': 0.01662612071484294, 'bull_atr_max_pct': 0.132839804918763, 'bull_tp_mult': 1.188847063465274, 'bull_tsl_mult': 0.062390048246771634, 'bull_time_stop': 156, 'bull_use_sma': False, 'bull_use_ema': True, 'bull_use_atr': True, 'bull_use_adx': False, 'bull_use_spike': True, 'bull_rsi_required': True, 'bear_strategy': 'mean_reversion', 'bear_bb_std_mult': 1.6395039994682952, 'bear_rsi_os': 44, 'bear_rsi_ob': 56, 'bear_adx_thresh': 29.626670007552512, 'bear_atr_min_pct': 0.02999787585145563, 'bear_atr_max_pct': 0.049100848829420125, 'bear_tp_mult': 1.9980307307493699, 'bear_tsl_mult': 0.8175971627222831, 'bear_time_stop': 101, 'bear_use_sma': False, 'bear_use_ema': False, 'bear_use_atr': False, 'bear_use_adx': False, 'bear_use_spike': True, 'bear_rsi_required': True, 'sideways_strategy': 'mean_reversion', 'sideways_bb_std_mult': 3.0536619706742263, 'sideways_rsi_os': 34, 'sideways_rsi_ob': 88, 'sideways_adx_thresh': 9.176340925997842, 'sideways_atr_min_pct': 0.004423217502707241, 'sideways_atr_max_pct': 0.11991790215634307, 'sideways_tp_mult': 1.193734943956941, 'sideways_tsl_mult': 0.3097893532662501, 'sideways_time_stop': 206, 'sideways_use_sma': True, 'sideways_use_ema': True, 'sideways_use_atr': True, 'sideways_use_adx': True, 'sideways_use_spike': False, 'sideways_rsi_required': False}.
[I 2025-09-01 14:52:00,772] Trial 578 finished with values: [-0.0800593925824078, 0.08016939385426536] and parameters: {'p_sma': 31, 'p_std': 29, 'p_atr': 27, 'p_adx': 12, 'rsi_period': 82, 'ema1': 10, 'ema2': 54, 'slip_atr_k': 0.016259287972615364, 'slip_spread_k': 0.5734887539598776, 'spread_hl_frac': 0.03299066739621172, 'bb_std_mult': 0.7769444555866558, 'rsi_os': 42, 'rsi_ob': 55, 'vol_spike': 0.1809927335330065, 'adx_thresh': 6.463074086161777, 'atr_min_pct': 0.010306583010375084, 'atr_max_pct': 0.030619575441659583, 'tp_mult': 1.2748326385907358, 'tsl_mult': 0.6966159400231152, 'strategy': 'mean_reversion', 'time_stop': 134, 'use_sma': True, 'use_atr': True, 'use_adx': True, 'use_ema': True, 'use_spike': True, 'rsi_required': True, 'edge_k': 0.2750918804766964, 'edge_cap': 0.9518309655450743, 'bull_strategy': 'breakout', 'bull_bb_std_mult': 2.999134351123419, 'bull_rsi_os': 10, 'bull_rsi_ob': 79, 'bull_adx_thresh': 12.666353070383366, 'bull_atr_min_pct': 0.0019285471768037462, 'bull_atr_max_pct': 0.09069979467367577, 'bull_tp_mult': 2.539054623110667, 'bull_tsl_mult': 0.8777892035960226, 'bull_time_stop': 157, 'bull_use_sma': False, 'bull_use_ema': True, 'bull_use_atr': True, 'bull_use_adx': False, 'bull_use_spike': True, 'bull_rsi_required': True, 'bear_strategy': 'mean_reversion', 'bear_bb_std_mult': 2.4207151480818037, 'bear_rsi_os': 51, 'bear_rsi_ob': 55, 'bear_adx_thresh': 7.915605441863168, 'bear_atr_min_pct': 0.0025702414690909735, 'bear_atr_max_pct': 0.11677960822276853, 'bear_tp_mult': 1.9642676053238017, 'bear_tsl_mult': 0.5596546247337323, 'bear_time_stop': 94, 'bear_use_sma': False, 'bear_use_ema': False, 'bear_use_atr': False, 'bear_use_adx': False, 'bear_use_spike': True, 'bear_rsi_required': True, 'sideways_strategy': 'mean_reversion', 'sideways_bb_std_mult': 3.4260452989901378, 'sideways_rsi_os': 29, 'sideways_rsi_ob': 65, 'sideways_adx_thresh': 26.294372218661348, 'sideways_atr_min_pct': 0.006050286213650358, 'sideways_atr_max_pct': 0.03490561927912238, 'sideways_tp_mult': 2.2865298444303526, 'sideways_tsl_mult': 0.2638122703946959, 'sideways_time_stop': 225, 'sideways_use_sma': True, 'sideways_use_ema': True, 'sideways_use_atr': True, 'sideways_use_adx': True, 'sideways_use_spike': True, 'sideways_rsi_required': False}.
[I 2025-09-01 14:52:01,694] Trial 582 finished with values: [-1000000000.0, 1000000000.0] and parameters: {'p_sma': 28, 'p_std': 28, 'p_atr': 27, 'p_adx': 29, 'rsi_period': 69, 'ema1': 11, 'ema2': 60, 'slip_atr_k': 0.012320907208331027, 'slip_spread_k': 0.8832775820536265, 'spread_hl_frac': 0.009706204756969853, 'bb_std_mult': 0.6864063614394487, 'rsi_os': 35, 'rsi_ob': 50, 'vol_spike': 0.10892725837069216, 'adx_thresh': 5.524693249751232, 'atr_min_pct': 0.02993767881201978, 'atr_max_pct': 0.030979187793039566, 'tp_mult': 1.505360339190702, 'tsl_mult': 0.6330851135435023, 'strategy': 'mean_reversion', 'time_stop': 294, 'use_sma': False, 'use_atr': False, 'use_adx': False, 'use_ema': True, 'use_spike': True, 'rsi_required': False, 'edge_k': 0.270946001160671, 'edge_cap': 0.9275031082679804, 'bull_strategy': 'breakout', 'bull_bb_std_mult': 3.1678123501577704, 'bull_rsi_os': 10, 'bull_rsi_ob': 75, 'bull_adx_thresh': 11.848946628858204, 'bull_atr_min_pct': 0.01273632785349608, 'bull_atr_max_pct': 0.04820032054491006, 'bull_tp_mult': 1.5221818579940365, 'bull_tsl_mult': 0.3180949006688723, 'bull_time_stop': 248, 'bull_use_sma': False, 'bull_use_ema': True, 'bull_use_atr': True, 'bull_use_adx': True, 'bull_use_spike': True, 'bull_rsi_required': True, 'bear_strategy': 'mean_reversion', 'bear_bb_std_mult': 2.6572747169209805, 'bear_rsi_os': 35, 'bear_rsi_ob': 86, 'bear_adx_thresh': 14.326757217218976, 'bear_atr_min_pct': 0.0008687916024441595, 'bear_atr_max_pct': 0.07865656498234558, 'bear_tp_mult': 2.1025375985031753, 'bear_tsl_mult': 0.2951484871441078, 'bear_time_stop': 91, 'bear_use_sma': True, 'bear_use_ema': True, 'bear_use_atr': False, 'bear_use_adx': False, 'bear_use_spike': False, 'bear_rsi_required': False, 'sideways_strategy': 'mean_reversion', 'sideways_bb_std_mult': 3.4704312567009263, 'sideways_rsi_os': 54, 'sideways_rsi_ob': 47, 'sideways_adx_thresh': 5.046518829973202, 'sideways_atr_min_pct': 0.012802657913268773, 'sideways_atr_max_pct': 0.10502295607817924, 'sideways_tp_mult': 2.8424003288479613, 'sideways_tsl_mult': 0.5376298822269364, 'sideways_time_stop': 226, 'sideways_use_sma': False, 'sideways_use_ema': True, 'sideways_use_atr': False, 'sideways_use_adx': False, 'sideways_use_spike': False, 'sideways_rsi_required': False}.
[I 2025-09-01 14:52:01,702] Trial 583 finished with values: [-1000000000.0, 1000000000.0] and parameters: {'p_sma': 28, 'p_std': 27, 'p_atr': 27, 'p_adx': 29, 'rsi_period': 81, 'ema1': 8, 'ema2': 46, 'slip_atr_k': 0.12043887081703404, 'slip_spread_k': 0.5741830868297115, 'spread_hl_frac': 0.03343229550337092, 'bb_std_mult': 3.1896035057775967, 'rsi_os': 35, 'rsi_ob': 50, 'vol_spike': 0.10923551862096065, 'adx_thresh': 25.65542142060787, 'atr_min_pct': 0.01030413464960677, 'atr_max_pct': 0.029202406969197094, 'tp_mult': 2.27284787038489, 'tsl_mult': 0.633936641621071, 'strategy': 'mean_reversion', 'time_stop': 116, 'use_sma': False, 'use_atr': False, 'use_adx': False, 'use_ema': True, 'use_spike': True, 'rsi_required': False, 'edge_k': 1.7130187557295469, 'edge_cap': 0.3373966218686361, 'bull_strategy': 'breakout', 'bull_bb_std_mult': 2.9123625667298385, 'bull_rsi_os': 10, 'bull_rsi_ob': 87, 'bull_adx_thresh': 11.810170349880002, 'bull_atr_min_pct': 0.02120255025812456, 'bull_atr_max_pct': 0.0492739946329417, 'bull_tp_mult': 1.8373663705745562, 'bull_tsl_mult': 0.41986831069121244, 'bull_time_stop': 267, 'bull_use_sma': False, 'bull_use_ema': True, 'bull_use_atr': True, 'bull_use_adx': True, 'bull_use_spike': True, 'bull_rsi_required': True, 'bear_strategy': 'mean_reversion', 'bear_bb_std_mult': 2.486268155508781, 'bear_rsi_os': 51, 'bear_rsi_ob': 58, 'bear_adx_thresh': 14.643410664471238, 'bear_atr_min_pct': 0.010974893930145845, 'bear_atr_max_pct': 0.11187427711486346, 'bear_tp_mult': 1.1892926724296253, 'bear_tsl_mult': 0.13671262746008503, 'bear_time_stop': 119, 'bear_use_sma': True, 'bear_use_ema': True, 'bear_use_atr': False, 'bear_use_adx': False, 'bear_use_spike': False, 'bear_rsi_required': False, 'sideways_strategy': 'mean_reversion', 'sideways_bb_std_mult': 3.1156516684987907, 'sideways_rsi_os': 31, 'sideways_rsi_ob': 72, 'sideways_adx_thresh': 14.520416904232128, 'sideways_atr_min_pct': 0.006074770447381517, 'sideways_atr_max_pct': 0.03487073672046147, 'sideways_tp_mult': 2.3404007100870663, 'sideways_tsl_mult': 0.5294068272807765, 'sideways_time_stop': 261, 'sideways_use_sma': False, 'sideways_use_ema': True, 'sideways_use_atr': False, 'sideways_use_adx': False, 'sideways_use_spike': False, 'sideways_rsi_required': False}.
[I 2025-09-01 14:52:02,594] Trial 585 finished with values: [-1000000000.0, 1000000000.0] and parameters: {'p_sma': 47, 'p_std': 19, 'p_atr': 26, 'p_adx': 9, 'rsi_period': 81, 'ema1': 22, 'ema2': 24, 'slip_atr_k': 0.11949399281289134, 'slip_spread_k': 0.5295242096328119, 'spread_hl_frac': 0.011634512057578855, 'bb_std_mult': 3.4013755337435176, 'rsi_os': 51, 'rsi_ob': 51, 'vol_spike': 0.118015655099563, 'adx_thresh': 5.011683429202072, 'atr_min_pct': 5.2598460108556344e-05, 'atr_max_pct': 0.024180667824518276, 'tp_mult': 2.359336551253374, 'tsl_mult': 0.6599989890142347, 'strategy': 'mean_reversion', 'time_stop': 177, 'use_sma': False, 'use_atr': False, 'use_adx': True, 'use_ema': True, 'use_spike': True, 'rsi_required': True, 'edge_k': 0.15813174371423622, 'edge_cap': 0.44787901388203877, 'bull_strategy': 'breakout', 'bull_bb_std_mult': 3.3522662753126555, 'bull_rsi_os': 13, 'bull_rsi_ob': 65, 'bull_adx_thresh': 11.57205880403714, 'bull_atr_min_pct': 0.013675742817020817, 'bull_atr_max_pct': 0.12411612270473733, 'bull_tp_mult': 2.1781316916640305, 'bull_tsl_mult': 0.40795158216691, 'bull_time_stop': 164, 'bull_use_sma': False, 'bull_use_ema': True, 'bull_use_atr': True, 'bull_use_adx': True, 'bull_use_spike': True, 'bull_rsi_required': True, 'bear_strategy': 'mean_reversion', 'bear_bb_std_mult': 2.493418117330317, 'bear_rsi_os': 37, 'bear_rsi_ob': 58, 'bear_adx_thresh': 7.026657708446846, 'bear_atr_min_pct': 0.0037806279818121055, 'bear_atr_max_pct': 0.11209469428657078, 'bear_tp_mult': 1.1934843552998573, 'bear_tsl_mult': 0.1316171502949987, 'bear_time_stop': 121, 'bear_use_sma': True, 'bear_use_ema': False, 'bear_use_atr': False, 'bear_use_adx': False, 'bear_use_spike': True, 'bear_rsi_required': False, 'sideways_strategy': 'mean_reversion', 'sideways_bb_std_mult': 3.121141149851674, 'sideways_rsi_os': 31, 'sideways_rsi_ob': 82, 'sideways_adx_thresh': 22.92157784247638, 'sideways_atr_min_pct': 0.008483824718347962, 'sideways_atr_max_pct': 0.10350723822897187, 'sideways_tp_mult': 2.3674660256206472, 'sideways_tsl_mult': 0.09782275722453937, 'sideways_time_stop': 266, 'sideways_use_sma': True, 'sideways_use_ema': True, 'sideways_use_atr': False, 'sideways_use_adx': True, 'sideways_use_spike': False, 'sideways_rsi_required': False}.
[I 2025-09-01 14:52:28,706] Trial 584 finished with values: [-1000000000.0, 1000000000.0] and parameters: {'p_sma': 28, 'p_std': 26, 'p_atr': 26, 'p_adx': 9, 'rsi_period': 73, 'ema1': 11, 'ema2': 37, 'slip_atr_k': 0.009809531445745617, 'slip_spread_k': 0.9955288512440709, 'spread_hl_frac': 0.009819650787645611, 'bb_std_mult': 0.7128648893386305, 'rsi_os': 17, 'rsi_ob': 58, 'vol_spike': 0.11844712690120802, 'adx_thresh': 25.762168634331466, 'atr_min_pct': 0.02984024387712831, 'atr_max_pct': 0.08060741019073348, 'tp_mult': 2.256755852356443, 'tsl_mult': 0.6603571763616347, 'strategy': 'mean_reversion', 'time_stop': 294, 'use_sma': False, 'use_atr': False, 'use_adx': False, 'use_ema': True, 'use_spike': True, 'rsi_required': False, 'edge_k': 1.7163245601401176, 'edge_cap': 0.931358986956634, 'bull_strategy': 'breakout', 'bull_bb_std_mult': 3.150412404886738, 'bull_rsi_os': 31, 'bull_rsi_ob': 65, 'bull_adx_thresh': 11.821522492658302, 'bull_atr_min_pct': 0.022361527358295177, 'bull_atr_max_pct': 0.12386939945615129, 'bull_tp_mult': 2.031996397640012, 'bull_tsl_mult': 0.4253537272876192, 'bull_time_stop': 247, 'bull_use_sma': False, 'bull_use_ema': True, 'bull_use_atr': True, 'bull_use_adx': True, 'bull_use_spike': True, 'bull_rsi_required': True, 'bear_strategy': 'mean_reversion', 'bear_bb_std_mult': 2.6667511495559393, 'bear_rsi_os': 35, 'bear_rsi_ob': 58, 'bear_adx_thresh': 14.279853350954461, 'bear_atr_min_pct': 0.000694391702080889, 'bear_atr_max_pct': 0.09812724795523933, 'bear_tp_mult': 2.058296023936564, 'bear_tsl_mult': 0.2918596998035118, 'bear_time_stop': 83, 'bear_use_sma': True, 'bear_use_ema': True, 'bear_use_atr': False, 'bear_use_adx': False, 'bear_use_spike': False, 'bear_rsi_required': False, 'sideways_strategy': 'mean_reversion', 'sideways_bb_std_mult': 3.118592068211182, 'sideways_rsi_os': 31, 'sideways_rsi_ob': 82, 'sideways_adx_thresh': 22.920869524980006, 'sideways_atr_min_pct': 0.003522602911421781, 'sideways_atr_max_pct': 0.10484865060375148, 'sideways_tp_mult': 1.7793272142749075, 'sideways_tsl_mult': 0.5385576320863773, 'sideways_time_stop': 262, 'sideways_use_sma': False, 'sideways_use_ema': True, 'sideways_use_atr': False, 'sideways_use_adx': False, 'sideways_use_spike': False, 'sideways_rsi_required': False}.
