[I 2025-09-01 14:12:15,362] Trial 304 finished with values: [-0.007556532488078527, 0.00930262484100727] and parameters: {'p_sma': 26, 'p_std': 27, 'p_atr': 26, 'p_adx': 9, 'rsi_period': 76, 'ema1': 9, 'ema2': 57, 'slip_atr_k': 0.12158426767404419, 'slip_spread_k': 0.5538468000039745, 'spread_hl_frac': 0.02253736154301099, 'bb_std_mult': 3.52049034616185, 'rsi_os': 40, 'rsi_ob': 53, 'vol_spike': 0.21571530317530258, 'adx_thresh': 5.586804957421218, 'atr_min_pct': 0.011382183006026114, 'atr_max_pct': 0.039423889371774476, 'tp_mult': 1.5033487279979363, 'tsl_mult': 0.6291699105909697, 'strategy': 'mean_reversion', 'time_stop': 125, 'use_sma': True, 'use_atr': False, 'use_adx': True, 'use_ema': True, 'use_spike': False, 'rsi_required': True, 'edge_k': 0.2580157634369073, 'edge_cap': 0.9246007407164888, 'bull_strategy': 'breakout', 'bull_bb_std_mult': 3.412044789444339, 'bull_rsi_os': 14, 'bull_rsi_ob': 77, 'bull_adx_thresh': 12.51122829877068, 'bull_atr_min_pct': 0.01790641910941007, 'bull_atr_max_pct': 0.12661720124055678, 'bull_tp_mult': 1.6531908493967284, 'bull_tsl_mult': 0.5012445123942035, 'bull_time_stop': 161, 'bull_use_sma': False, 'bull_use_ema': False, 'bull_use_atr': True, 'bull_use_adx': True, 'bull_use_spike': True, 'bull_rsi_required': True, 'bear_strategy': 'mean_reversion', 'bear_bb_std_mult': 2.454229550089428, 'bear_rsi_os': 36, 'bear_rsi_ob': 56, 'bear_adx_thresh': 7.183736810825874, 'bear_atr_min_pct': 0.0033022965775587744, 'bear_atr_max_pct': 0.10646559120792391, 'bear_tp_mult': 2.1741180453530062, 'bear_tsl_mult': 0.33715634273143746, 'bear_time_stop': 88, 'bear_use_sma': False, 'bear_use_ema': False, 'bear_use_atr': False, 'bear_use_adx': False, 'bear_use_spike': True, 'bear_rsi_required': False, 'sideways_strategy': 'mean_reversion', 'sideways_bb_std_mult': 2.922029952939548, 'sideways_rsi_os': 32, 'sideways_rsi_ob': 89, 'sideways_adx_thresh': 25.597589211286568, 'sideways_atr_min_pct': 0.004616489272528174, 'sideways_atr_max_pct': 0.10980969185541967, 'sideways_tp_mult': 2.3020666927883284, 'sideways_tsl_mult': 0.4477868418673129, 'sideways_time_stop': 268, 'sideways_use_sma': True, 'sideways_use_ema': True, 'sideways_use_atr': True, 'sideways_use_adx': True, 'sideways_use_spike': False, 'sideways_rsi_required': False}.
[I 2025-09-01 14:12:15,734] Trial 306 finished with values: [-0.027764992552690493, 0.028818898391510986] and parameters: {'p_sma': 26, 'p_std': 27, 'p_atr': 25, 'p_adx': 9, 'rsi_period': 75, 'ema1': 9, 'ema2': 57, 'slip_atr_k': 0.22080532361880995, 'slip_spread_k': 0.5863401597647231, 'spread_hl_frac': 0.022651900178297456, 'bb_std_mult': 3.522843550518107, 'rsi_os': 44, 'rsi_ob': 53, 'vol_spike': 0.0925773031902607, 'adx_thresh': 7.364495036000815, 'atr_min_pct': 0.012813805066340708, 'atr_max_pct': 0.0382285560810322, 'tp_mult': 1.5091153130306103, 'tsl_mult': 0.6049798413341793, 'strategy': 'mean_reversion', 'time_stop': 122, 'use_sma': True, 'use_atr': False, 'use_adx': True, 'use_ema': True, 'use_spike': False, 'rsi_required': True, 'edge_k': 0.2523203068155703, 'edge_cap': 0.9656492469619194, 'bull_strategy': 'breakout', 'bull_bb_std_mult': 3.2011386414657013, 'bull_rsi_os': 14, 'bull_rsi_ob': 75, 'bull_adx_thresh': 8.329377821834031, 'bull_atr_min_pct': 0.011039437943941207, 'bull_atr_max_pct': 0.1269545556544579, 'bull_tp_mult': 1.633318243317466, 'bull_tsl_mult': 0.5013327157731069, 'bull_time_stop': 163, 'bull_use_sma': False, 'bull_use_ema': False, 'bull_use_atr': True, 'bull_use_adx': True, 'bull_use_spike': True, 'bull_rsi_required': True, 'bear_strategy': 'mean_reversion', 'bear_bb_std_mult': 2.5600239999657344, 'bear_rsi_os': 36, 'bear_rsi_ob': 56, 'bear_adx_thresh': 7.36104223269296, 'bear_atr_min_pct': 0.0031024124015022496, 'bear_atr_max_pct': 0.10741686676027512, 'bear_tp_mult': 2.1766655418830374, 'bear_tsl_mult': 0.3349922765110192, 'bear_time_stop': 89, 'bear_use_sma': False, 'bear_use_ema': False, 'bear_use_atr': False, 'bear_use_adx': False, 'bear_use_spike': True, 'bear_rsi_required': False, 'sideways_strategy': 'mean_reversion', 'sideways_bb_std_mult': 2.923625911545276, 'sideways_rsi_os': 32, 'sideways_rsi_ob': 89, 'sideways_adx_thresh': 25.71981778275568, 'sideways_atr_min_pct': 0.0024680181039121816, 'sideways_atr_max_pct': 0.1111488398846221, 'sideways_tp_mult': 2.273986959948854, 'sideways_tsl_mult': 0.4527784121262642, 'sideways_time_stop': 255, 'sideways_use_sma': True, 'sideways_use_ema': True, 'sideways_use_atr': True, 'sideways_use_adx': True, 'sideways_use_spike': True, 'sideways_rsi_required': False}.
[I 2025-09-01 14:12:56,257] Trial 311 finished with values: [-0.017637478220213, 0.018656034730505446] and parameters: {'p_sma': 29, 'p_std': 25, 'p_atr': 26, 'p_adx': 8, 'rsi_period': 80, 'ema1': 10, 'ema2': 55, 'slip_atr_k': 0.012315976324486172, 'slip_spread_k': 0.6395597697306944, 'spread_hl_frac': 0.007784778915267363, 'bb_std_mult': 3.206468467545164, 'rsi_os': 44, 'rsi_ob': 54, 'vol_spike': 0.11708002102170101, 'adx_thresh': 5.116168056544919, 'atr_min_pct': 0.013697029631574324, 'atr_max_pct': 0.032686594189853806, 'tp_mult': 1.3616697128824693, 'tsl_mult': 0.650349879909391, 'strategy': 'mean_reversion', 'time_stop': 114, 'use_sma': True, 'use_atr': False, 'use_adx': True, 'use_ema': True, 'use_spike': True, 'rsi_required': True, 'edge_k': 0.20920614439501709, 'edge_cap': 0.9549468663515346, 'bull_strategy': 'breakout', 'bull_bb_std_mult': 3.0507881030706763, 'bull_rsi_os': 12, 'bull_rsi_ob': 79, 'bull_adx_thresh': 21.791689583329497, 'bull_atr_min_pct': 0.013821740512551558, 'bull_atr_max_pct': 0.02111057130967397, 'bull_tp_mult': 1.5978862909726035, 'bull_tsl_mult': 0.4778732650730779, 'bull_time_stop': 149, 'bull_use_sma': False, 'bull_use_ema': True, 'bull_use_atr': True, 'bull_use_adx': False, 'bull_use_spike': True, 'bull_rsi_required': True, 'bear_strategy': 'mean_reversion', 'bear_bb_std_mult': 2.642202235962332, 'bear_rsi_os': 37, 'bear_rsi_ob': 59, 'bear_adx_thresh': 8.933242579757316, 'bear_atr_min_pct': 0.0014530985449067112, 'bear_atr_max_pct': 0.11142848593595099, 'bear_tp_mult': 2.0803506637050306, 'bear_tsl_mult': 0.46094684885270876, 'bear_time_stop': 96, 'bear_use_sma': True, 'bear_use_ema': False, 'bear_use_atr': False, 'bear_use_adx': False, 'bear_use_spike': True, 'bear_rsi_required': False, 'sideways_strategy': 'mean_reversion', 'sideways_bb_std_mult': 3.0401987003015716, 'sideways_rsi_os': 28, 'sideways_rsi_ob': 91, 'sideways_adx_thresh': 24.7679881984702, 'sideways_atr_min_pct': 0.003704601124319169, 'sideways_atr_max_pct': 0.10175339409469016, 'sideways_tp_mult': 2.3453253237312714, 'sideways_tsl_mult': 0.4016317232588787, 'sideways_time_stop': 256, 'sideways_use_sma': True, 'sideways_use_ema': False, 'sideways_use_atr': True, 'sideways_use_adx': True, 'sideways_use_spike': False, 'sideways_rsi_required': False}.
[I 2025-09-01 14:12:57,300] Trial 308 finished with values: [-0.044332962842029366, 0.04472509779411677] and parameters: {'p_sma': 28, 'p_std': 27, 'p_atr': 26, 'p_adx': 9, 'rsi_period': 76, 'ema1': 9, 'ema2': 57, 'slip_atr_k': 0.22075559139831838, 'slip_spread_k': 0.7780817323269975, 'spread_hl_frac': 0.007621568134417386, 'bb_std_mult': 3.247442587998975, 'rsi_os': 44, 'rsi_ob': 53, 'vol_spike': 0.10937422454117318, 'adx_thresh': 5.050095566093117, 'atr_min_pct': 0.013096949915468017, 'atr_max_pct': 0.04576586199063004, 'tp_mult': 1.3727129548244328, 'tsl_mult': 0.6129096464171873, 'strategy': 'mean_reversion', 'time_stop': 116, 'use_sma': True, 'use_atr': False, 'use_adx': True, 'use_ema': True, 'use_spike': True, 'rsi_required': True, 'edge_k': 0.20517425956507085, 'edge_cap': 0.9581280055418692, 'bull_strategy': 'breakout', 'bull_bb_std_mult': 3.2217495212593388, 'bull_rsi_os': 12, 'bull_rsi_ob': 79, 'bull_adx_thresh': 8.600133928675126, 'bull_atr_min_pct': 0.02105872863348652, 'bull_atr_max_pct': 0.1276388712902754, 'bull_tp_mult': 1.5828001353541068, 'bull_tsl_mult': 0.46809535048969203, 'bull_time_stop': 151, 'bull_use_sma': False, 'bull_use_ema': True, 'bull_use_atr': True, 'bull_use_adx': True, 'bull_use_spike': True, 'bull_rsi_required': True, 'bear_strategy': 'mean_reversion', 'bear_bb_std_mult': 2.632553113198701, 'bear_rsi_os': 36, 'bear_rsi_ob': 56, 'bear_adx_thresh': 7.302263380083586, 'bear_atr_min_pct': 0.0015654387550379527, 'bear_atr_max_pct': 0.1084464884358361, 'bear_tp_mult': 2.1747391017332385, 'bear_tsl_mult': 0.10100458088185812, 'bear_time_stop': 87, 'bear_use_sma': True, 'bear_use_ema': False, 'bear_use_atr': False, 'bear_use_adx': False, 'bear_use_spike': True, 'bear_rsi_required': False, 'sideways_strategy': 'mean_reversion', 'sideways_bb_std_mult': 2.9428495828782233, 'sideways_rsi_os': 32, 'sideways_rsi_ob': 89, 'sideways_adx_thresh': 25.750791299726973, 'sideways_atr_min_pct': 0.002456641881539274, 'sideways_atr_max_pct': 0.11206108209497358, 'sideways_tp_mult': 2.312537534427102, 'sideways_tsl_mult': 0.4014027679822406, 'sideways_time_stop': 255, 'sideways_use_sma': True, 'sideways_use_ema': True, 'sideways_use_atr': True, 'sideways_use_adx': True, 'sideways_use_spike': False, 'sideways_rsi_required': False}.
[I 2025-09-01 14:12:57,511] Trial 309 finished with values: [-0.001219590824808603, 0.0069518056358982535] and parameters: {'p_sma': 31, 'p_std': 27, 'p_atr': 26, 'p_adx': 8, 'rsi_period': 79, 'ema1': 9, 'ema2': 57, 'slip_atr_k': 0.012000822619216976, 'slip_spread_k': 0.77019531424363, 'spread_hl_frac': 0.044752153050403726, 'bb_std_mult': 3.25531299416819, 'rsi_os': 30, 'rsi_ob': 52, 'vol_spike': 0.27611600389373975, 'adx_thresh': 5.5503212291990645, 'atr_min_pct': 0.01278557272650824, 'atr_max_pct': 0.03339466871282633, 'tp_mult': 1.511897494782092, 'tsl_mult': 0.6285130080238088, 'strategy': 'mean_reversion', 'time_stop': 278, 'use_sma': True, 'use_atr': False, 'use_adx': True, 'use_ema': True, 'use_spike': True, 'rsi_required': True, 'edge_k': 0.20396709710889865, 'edge_cap': 0.9530906449703452, 'bull_strategy': 'breakout', 'bull_bb_std_mult': 2.987549401740441, 'bull_rsi_os': 12, 'bull_rsi_ob': 79, 'bull_adx_thresh': 12.660245864277165, 'bull_atr_min_pct': 0.01823190319093985, 'bull_atr_max_pct': 0.1277137010676715, 'bull_tp_mult': 1.5725253637556036, 'bull_tsl_mult': 0.47363254663644405, 'bull_time_stop': 136, 'bull_use_sma': False, 'bull_use_ema': True, 'bull_use_atr': True, 'bull_use_adx': True, 'bull_use_spike': True, 'bull_rsi_required': True, 'bear_strategy': 'mean_reversion', 'bear_bb_std_mult': 2.6439036557631552, 'bear_rsi_os': 36, 'bear_rsi_ob': 59, 'bear_adx_thresh': 31.07475343406607, 'bear_atr_min_pct': 0.0033982221816064593, 'bear_atr_max_pct': 0.10803151794611658, 'bear_tp_mult': 2.174158057413399, 'bear_tsl_mult': 0.3760312149121131, 'bear_time_stop': 86, 'bear_use_sma': True, 'bear_use_ema': False, 'bear_use_atr': False, 'bear_use_adx': False, 'bear_use_spike': True, 'bear_rsi_required': False, 'sideways_strategy': 'mean_reversion', 'sideways_bb_std_mult': 3.056872435622895, 'sideways_rsi_os': 30, 'sideways_rsi_ob': 90, 'sideways_adx_thresh': 25.68363881220861, 'sideways_atr_min_pct': 0.002635603809755746, 'sideways_atr_max_pct': 0.11350718998330189, 'sideways_tp_mult': 2.337822394905752, 'sideways_tsl_mult': 0.433061888978323, 'sideways_time_stop': 255, 'sideways_use_sma': True, 'sideways_use_ema': True, 'sideways_use_atr': True, 'sideways_use_adx': True, 'sideways_use_spike': False, 'sideways_rsi_required': False}.
[I 2025-09-01 14:12:58,112] Trial 310 finished with values: [-0.003101544513806176, 0.010719120927936893] and parameters: {'p_sma': 29, 'p_std': 25, 'p_atr': 25, 'p_adx': 8, 'rsi_period': 79, 'ema1': 10, 'ema2': 54, 'slip_atr_k': 0.014324181376720962, 'slip_spread_k': 0.5918466549621104, 'spread_hl_frac': 0.011041423375553257, 'bb_std_mult': 3.5083485104468646, 'rsi_os': 8, 'rsi_ob': 54, 'vol_spike': 0.19856711869929078, 'adx_thresh': 5.106337299507148, 'atr_min_pct': 0.013581416910967618, 'atr_max_pct': 0.03242750418493905, 'tp_mult': 1.3672754709307091, 'tsl_mult': 0.6525034202143981, 'strategy': 'mean_reversion', 'time_stop': 277, 'use_sma': True, 'use_atr': False, 'use_adx': True, 'use_ema': True, 'use_spike': True, 'rsi_required': True, 'edge_k': 0.21295025940187415, 'edge_cap': 0.9515217103505665, 'bull_strategy': 'breakout', 'bull_bb_std_mult': 2.982745387238646, 'bull_rsi_os': 12, 'bull_rsi_ob': 79, 'bull_adx_thresh': 8.566842673507725, 'bull_atr_min_pct': 0.01115083237287424, 'bull_atr_max_pct': 0.019612840030320662, 'bull_tp_mult': 1.5682777180244971, 'bull_tsl_mult': 0.48149083193712455, 'bull_time_stop': 149, 'bull_use_sma': False, 'bull_use_ema': True, 'bull_use_atr': True, 'bull_use_adx': True, 'bull_use_spike': True, 'bull_rsi_required': True, 'bear_strategy': 'mean_reversion', 'bear_bb_std_mult': 2.6522809068069746, 'bear_rsi_os': 36, 'bear_rsi_ob': 59, 'bear_adx_thresh': 9.173998223041421, 'bear_atr_min_pct': 0.0014734005417559497, 'bear_atr_max_pct': 0.10871230739293546, 'bear_tp_mult': 2.254755450250314, 'bear_tsl_mult': 0.381707886301453, 'bear_time_stop': 87, 'bear_use_sma': True, 'bear_use_ema': False, 'bear_use_atr': False, 'bear_use_adx': False, 'bear_use_spike': True, 'bear_rsi_required': False, 'sideways_strategy': 'mean_reversion', 'sideways_bb_std_mult': 3.046077449744972, 'sideways_rsi_os': 28, 'sideways_rsi_ob': 91, 'sideways_adx_thresh': 25.745198714471286, 'sideways_atr_min_pct': 0.0025861909055095145, 'sideways_atr_max_pct': 0.031156348922651803, 'sideways_tp_mult': 2.5076663362777203, 'sideways_tsl_mult': 0.40834127836607476, 'sideways_time_stop': 256, 'sideways_use_sma': True, 'sideways_use_ema': True, 'sideways_use_atr': True, 'sideways_use_adx': True, 'sideways_use_spike': True, 'sideways_rsi_required': False}.
[I 2025-09-01 14:12:58,753] Trial 313 finished with values: [-1000000000.0, 1000000000.0] and parameters: {'p_sma': 29, 'p_std': 29, 'p_atr': 27, 'p_adx': 8, 'rsi_period': 79, 'ema1': 10, 'ema2': 53, 'slip_atr_k': 0.011543644058794723, 'slip_spread_k': 0.5811965886177777, 'spread_hl_frac': 0.04450834024433961, 'bb_std_mult': 3.4821806330053966, 'rsi_os': 18, 'rsi_ob': 50, 'vol_spike': 0.013811688833724939, 'adx_thresh': 6.204268862501964, 'atr_min_pct': 0.011034066701720809, 'atr_max_pct': 0.029651712200719525, 'tp_mult': 1.30121504063081, 'tsl_mult': 0.6974099461617339, 'strategy': 'mean_reversion', 'time_stop': 109, 'use_sma': False, 'use_atr': False, 'use_adx': True, 'use_ema': True, 'use_spike': True, 'rsi_required': True, 'edge_k': 0.3172882754563432, 'edge_cap': 0.9850999490414089, 'bull_strategy': 'breakout', 'bull_bb_std_mult': 3.1222080840797, 'bull_rsi_os': 15, 'bull_rsi_ob': 78, 'bull_adx_thresh': 14.97121915614223, 'bull_atr_min_pct': 0.007587158884195905, 'bull_atr_max_pct': 0.13198833555073536, 'bull_tp_mult': 1.559524578825179, 'bull_tsl_mult': 0.44350265381013537, 'bull_time_stop': 138, 'bull_use_sma': False, 'bull_use_ema': True, 'bull_use_atr': True, 'bull_use_adx': True, 'bull_use_spike': True, 'bull_rsi_required': True, 'bear_strategy': 'mean_reversion', 'bear_bb_std_mult': 2.5510896174328543, 'bear_rsi_os': 32, 'bear_rsi_ob': 57, 'bear_adx_thresh': 8.192447903246354, 'bear_atr_min_pct': 0.002221760022828205, 'bear_atr_max_pct': 0.1131991644254081, 'bear_tp_mult': 2.2539838818807936, 'bear_tsl_mult': 0.674769293749645, 'bear_time_stop': 108, 'bear_use_sma': False, 'bear_use_ema': False, 'bear_use_atr': False, 'bear_use_adx': False, 'bear_use_spike': True, 'bear_rsi_required': False, 'sideways_strategy': 'mean_reversion', 'sideways_bb_std_mult': 3.061227479844495, 'sideways_rsi_os': 30, 'sideways_rsi_ob': 93, 'sideways_adx_thresh': 24.809991069826598, 'sideways_atr_min_pct': 0.0029619796335247552, 'sideways_atr_max_pct': 0.11331070323593039, 'sideways_tp_mult': 2.509347679364182, 'sideways_tsl_mult': 0.4152115616066308, 'sideways_time_stop': 273, 'sideways_use_sma': True, 'sideways_use_ema': True, 'sideways_use_atr': True, 'sideways_use_adx': True, 'sideways_use_spike': False, 'sideways_rsi_required': True}.
[I 2025-09-01 14:12:58,761] Trial 312 finished with values: [-1000000000.0, 1000000000.0] and parameters: {'p_sma': 31, 'p_std': 35, 'p_atr': 26, 'p_adx': 8, 'rsi_period': 80, 'ema1': 9, 'ema2': 54, 'slip_atr_k': 0.016823473906252544, 'slip_spread_k': 0.5458420391443577, 'spread_hl_frac': 0.010994135139750536, 'bb_std_mult': 3.2989385111575245, 'rsi_os': 44, 'rsi_ob': 49, 'vol_spike': 0.27618452573498486, 'adx_thresh': 6.116997762733114, 'atr_min_pct': 0.011229926072736348, 'atr_max_pct': 0.03037348426804418, 'tp_mult': 1.35499912764205, 'tsl_mult': 0.6731959130376184, 'strategy': 'mean_reversion', 'time_stop': 117, 'use_sma': False, 'use_atr': False, 'use_adx': True, 'use_ema': True, 'use_spike': True, 'rsi_required': True, 'edge_k': 0.29909293605882437, 'edge_cap': 0.9987154381881113, 'bull_strategy': 'breakout', 'bull_bb_std_mult': 3.10918514105935, 'bull_rsi_os': 15, 'bull_rsi_ob': 82, 'bull_adx_thresh': 13.241779531104653, 'bull_atr_min_pct': 0.028601342939952215, 'bull_atr_max_pct': 0.0348737269916862, 'bull_tp_mult': 1.5667245961053597, 'bull_tsl_mult': 0.4376678490600963, 'bull_time_stop': 151, 'bull_use_sma': False, 'bull_use_ema': True, 'bull_use_atr': True, 'bull_use_adx': True, 'bull_use_spike': True, 'bull_rsi_required': True, 'bear_strategy': 'mean_reversion', 'bear_bb_std_mult': 2.626992599336458, 'bear_rsi_os': 39, 'bear_rsi_ob': 58, 'bear_adx_thresh': 8.306191331638884, 'bear_atr_min_pct': 0.0016749734798790523, 'bear_atr_max_pct': 0.10883081919044194, 'bear_tp_mult': 2.2505939766539824, 'bear_tsl_mult': 0.9799638558789499, 'bear_time_stop': 86, 'bear_use_sma': True, 'bear_use_ema': False, 'bear_use_atr': False, 'bear_use_adx': False, 'bear_use_spike': True, 'bear_rsi_required': False, 'sideways_strategy': 'mean_reversion', 'sideways_bb_std_mult': 3.0095523627614233, 'sideways_rsi_os': 30, 'sideways_rsi_ob': 94, 'sideways_adx_thresh': 25.680269221254076, 'sideways_atr_min_pct': 0.003218704359268226, 'sideways_atr_max_pct': 0.020389776663189148, 'sideways_tp_mult': 2.5177706345808457, 'sideways_tsl_mult': 0.42681018837592344, 'sideways_time_stop': 48, 'sideways_use_sma': True, 'sideways_use_ema': True, 'sideways_use_atr': True, 'sideways_use_adx': True, 'sideways_use_spike': False, 'sideways_rsi_required': True}.
[I 2025-09-01 14:13:39,407] Trial 315 finished with values: [-0.06407064039759658, 0.06484749921914053] and parameters: {'p_sma': 31, 'p_std': 29, 'p_atr': 27, 'p_adx': 8, 'rsi_period': 79, 'ema1': 9, 'ema2': 55, 'slip_atr_k': 0.1760778828162216, 'slip_spread_k': 0.5498948358684297, 'spread_hl_frac': 0.009585499673797513, 'bb_std_mult': 3.4590089751888393, 'rsi_os': 33, 'rsi_ob': 52, 'vol_spike': 0.017324265978500064, 'adx_thresh': 6.13786529694056, 'atr_min_pct': 0.01107336917625744, 'atr_max_pct': 0.029773517828751293, 'tp_mult': 1.2777091197115211, 'tsl_mult': 0.6913350418888191, 'strategy': 'mean_reversion', 'time_stop': 105, 'use_sma': False, 'use_atr': False, 'use_adx': True, 'use_ema': True, 'use_spike': True, 'rsi_required': True, 'edge_k': 0.3118043406141454, 'edge_cap': 0.9842662822641272, 'bull_strategy': 'breakout', 'bull_bb_std_mult': 3.105744591250027, 'bull_rsi_os': 13, 'bull_rsi_ob': 78, 'bull_adx_thresh': 13.189118853417474, 'bull_atr_min_pct': 0.011978935412489827, 'bull_atr_max_pct': 0.1332131270839749, 'bull_tp_mult': 1.6079627304790152, 'bull_tsl_mult': 0.4366459886712095, 'bull_time_stop': 155, 'bull_use_sma': True, 'bull_use_ema': True, 'bull_use_atr': True, 'bull_use_adx': False, 'bull_use_spike': True, 'bull_rsi_required': True, 'bear_strategy': 'mean_reversion', 'bear_bb_std_mult': 2.536686113893079, 'bear_rsi_os': 39, 'bear_rsi_ob': 57, 'bear_adx_thresh': 7.883275523977906, 'bear_atr_min_pct': 0.0022497682842304773, 'bear_atr_max_pct': 0.12333074918694258, 'bear_tp_mult': 2.0092617936852495, 'bear_tsl_mult': 0.546165410528427, 'bear_time_stop': 98, 'bear_use_sma': False, 'bear_use_ema': False, 'bear_use_atr': False, 'bear_use_adx': False, 'bear_use_spike': True, 'bear_rsi_required': False, 'sideways_strategy': 'mean_reversion', 'sideways_bb_std_mult': 2.9838623140014593, 'sideways_rsi_os': 31, 'sideways_rsi_ob': 93, 'sideways_adx_thresh': 22.505976651266508, 'sideways_atr_min_pct': 0.0037591461975508126, 'sideways_atr_max_pct': 0.10760130939891811, 'sideways_tp_mult': 2.054794746163678, 'sideways_tsl_mult': 0.3425080723686065, 'sideways_time_stop': 275, 'sideways_use_sma': True, 'sideways_use_ema': False, 'sideways_use_atr': False, 'sideways_use_adx': True, 'sideways_use_spike': False, 'sideways_rsi_required': True}.
