2025-09-01 13:27:20,573 WARNING: DATA SANITY: Extreme jumps >20*ATR200: 42
[I 2025-09-01 13:27:20,600] A new study created in memory with name: no-name-e01c6881-4186-4ba5-8010-ff8023d256ca
[I 2025-09-01 13:27:58,470] Trial 3 finished with values: [-1000000000.0, 1000000000.0] and parameters: {'p_sma': 26, 'p_std': 22, 'p_atr': 12, 'p_adx': 22, 'rsi_period': 80, 'ema1': 19, 'ema2': 57, 'slip_atr_k': 0.1325740007262396, 'slip_spread_k': 0.019957780998671737, 'spread_hl_frac': 0.017614319991904905, 'bb_std_mult': 0.6395301269582306, 'rsi_os': 36, 'rsi_ob': 84, 'vol_spike': 0.027530938494299773, 'adx_thresh': 33.66284030939837, 'atr_min_pct': 0.018694103688145225, 'atr_max_pct': 0.08002861828140591, 'tp_mult': 2.2061510749932047, 'tsl_mult': 0.49613431636893734, 'strategy': 'mean_reversion', 'time_stop': 189, 'use_sma': True, 'use_atr': False, 'use_adx': False, 'use_ema': False, 'use_spike': True, 'rsi_required': True, 'edge_k': 1.99557256359937, 'edge_cap': 0.7866055792765464, 'bull_strategy': 'mean_reversion', 'bull_bb_std_mult': 3.1036742603474585, 'bull_rsi_os': 32, 'bull_rsi_ob': 58, 'bull_adx_thresh': 23.577867234809908, 'bull_atr_min_pct': 0.017620072459091758, 'bull_atr_max_pct': 0.09709375973420176, 'bull_tp_mult': 1.8774590349278, 'bull_tsl_mult': 0.40689875814742527, 'bull_time_stop': 61, 'bull_use_sma': False, 'bull_use_ema': True, 'bull_use_atr': True, 'bull_use_adx': True, 'bull_use_spike': True, 'bull_rsi_required': False, 'bear_strategy': 'mean_reversion', 'bear_bb_std_mult': 1.6478302284085826, 'bear_rsi_os': 33, 'bear_rsi_ob': 48, 'bear_adx_thresh': 7.514079166404601, 'bear_atr_min_pct': 0.010644949958186477, 'bear_atr_max_pct': 0.021289443354158454, 'bear_tp_mult': 2.188117620145648, 'bear_tsl_mult': 0.8759832020648505, 'bear_time_stop': 19, 'bear_use_sma': True, 'bear_use_ema': False, 'bear_use_atr': False, 'bear_use_adx': False, 'bear_use_spike': True, 'bear_rsi_required': False, 'sideways_strategy': 'mean_reversion', 'sideways_bb_std_mult': 2.056880853329296, 'sideways_rsi_os': 8, 'sideways_rsi_ob': 90, 'sideways_adx_thresh': 11.894846629644034, 'sideways_atr_min_pct': 0.029539396395879797, 'sideways_atr_max_pct': 0.026123290381350507, 'sideways_tp_mult': 2.2607659956095914, 'sideways_tsl_mult': 0.4815283212119762, 'sideways_time_stop': 10, 'sideways_use_sma': True, 'sideways_use_ema': True, 'sideways_use_atr': False, 'sideways_use_adx': True, 'sideways_use_spike': False, 'sideways_rsi_required': True}.
[I 2025-09-01 13:27:59,275] Trial 2 finished with values: [-1000000000.0, 1000000000.0] and parameters: {'p_sma': 54, 'p_std': 56, 'p_atr': 9, 'p_adx': 14, 'rsi_period': 75, 'ema1': 29, 'ema2': 17, 'slip_atr_k': 0.13500766129496103, 'slip_spread_k': 0.7086398337195031, 'spread_hl_frac': 0.04770952093774733, 'bb_std_mult': 2.8778743221279535, 'rsi_os': 5, 'rsi_ob': 54, 'vol_spike': 0.054751508009839335, 'adx_thresh': 14.504416019912599, 'atr_min_pct': 0.005044895900165358, 'atr_max_pct': 0.08482989086348594, 'tp_mult': 2.847515562171251, 'tsl_mult': 0.20081797581856853, 'strategy': 'breakout', 'time_stop': 147, 'use_sma': False, 'use_atr': False, 'use_adx': False, 'use_ema': True, 'use_spike': False, 'rsi_required': True, 'edge_k': 0.15563784802821923, 'edge_cap': 0.8492148016195813, 'bull_strategy': 'breakout', 'bull_bb_std_mult': 2.136260418588519, 'bull_rsi_os': 7, 'bull_rsi_ob': 91, 'bull_adx_thresh': 18.244222191790147, 'bull_atr_min_pct': 0.028962940858338417, 'bull_atr_max_pct': 0.03769343833415297, 'bull_tp_mult': 2.2474601846102793, 'bull_tsl_mult': 0.08352025962324428, 'bull_time_stop': 207, 'bull_use_sma': False, 'bull_use_ema': True, 'bull_use_atr': True, 'bull_use_adx': True, 'bull_use_spike': True, 'bull_rsi_required': True, 'bear_strategy': 'breakout', 'bear_bb_std_mult': 0.5879145191015246, 'bear_rsi_os': 20, 'bear_rsi_ob': 88, 'bear_adx_thresh': 24.776740178427215, 'bear_atr_min_pct': 0.00994884752235534, 'bear_atr_max_pct': 0.08051194645564728, 'bear_tp_mult': 2.7793634463469443, 'bear_tsl_mult': 0.9230471012020639, 'bear_time_stop': 215, 'bear_use_sma': True, 'bear_use_ema': False, 'bear_use_atr': True, 'bear_use_adx': False, 'bear_use_spike': False, 'bear_rsi_required': False, 'sideways_strategy': 'breakout', 'sideways_bb_std_mult': 2.568546140568733, 'sideways_rsi_os': 28, 'sideways_rsi_ob': 73, 'sideways_adx_thresh': 25.91238153319659, 'sideways_atr_min_pct': 0.009893157514502744, 'sideways_atr_max_pct': 0.032147783279476885, 'sideways_tp_mult': 1.1617988104615793, 'sideways_tsl_mult': 0.397415615934133, 'sideways_time_stop': 8, 'sideways_use_sma': False, 'sideways_use_ema': False, 'sideways_use_atr': False, 'sideways_use_adx': True, 'sideways_use_spike': True, 'sideways_rsi_required': False}.
[I 2025-09-01 13:27:59,546] Trial 0 finished with values: [-1000000000.0, 1000000000.0] and parameters: {'p_sma': 27, 'p_std': 36, 'p_atr': 22, 'p_adx': 21, 'rsi_period': 13, 'ema1': 9, 'ema2': 19, 'slip_atr_k': 0.15072030313148255, 'slip_spread_k': 0.06571194804297176, 'spread_hl_frac': 0.04703097206669564, 'bb_std_mult': 1.119823471252583, 'rsi_os': 51, 'rsi_ob': 45, 'vol_spike': 0.2414417970864451, 'adx_thresh': 29.190599630989574, 'atr_min_pct': 0.0016135326595042364, 'atr_max_pct': 0.0472060355275872, 'tp_mult': 1.712571216882712, 'tsl_mult': 0.2852072508616619, 'strategy': 'breakout', 'time_stop': 186, 'use_sma': True, 'use_atr': False, 'use_adx': False, 'use_ema': True, 'use_spike': False, 'rsi_required': True, 'edge_k': 1.0733318004887922, 'edge_cap': 0.4570822643950524, 'bull_strategy': 'breakout', 'bull_bb_std_mult': 0.6499962804429995, 'bull_rsi_os': 31, 'bull_rsi_ob': 62, 'bull_adx_thresh': 7.978013198853389, 'bull_atr_min_pct': 0.013899866037504174, 'bull_atr_max_pct': 0.014738013897542562, 'bull_tp_mult': 2.9952562515503245, 'bull_tsl_mult': 0.7299608533076629, 'bull_time_stop': 56, 'bull_use_sma': False, 'bull_use_ema': True, 'bull_use_atr': False, 'bull_use_adx': True, 'bull_use_spike': False, 'bull_rsi_required': False, 'bear_strategy': 'breakout', 'bear_bb_std_mult': 2.147481194256033, 'bear_rsi_os': 40, 'bear_rsi_ob': 80, 'bear_adx_thresh': 9.985172838118148, 'bear_atr_min_pct': 0.00969796073686955, 'bear_atr_max_pct': 0.09064181549897062, 'bear_tp_mult': 2.376471382881383, 'bear_tsl_mult': 0.36459675659653745, 'bear_time_stop': 271, 'bear_use_sma': True, 'bear_use_ema': True, 'bear_use_atr': False, 'bear_use_adx': False, 'bear_use_spike': False, 'bear_rsi_required': True, 'sideways_strategy': 'mean_reversion', 'sideways_bb_std_mult': 1.1726174712454105, 'sideways_rsi_os': 27, 'sideways_rsi_ob': 81, 'sideways_adx_thresh': 28.556732725130303, 'sideways_atr_min_pct': 0.02677377737946995, 'sideways_atr_max_pct': 0.07384478515573385, 'sideways_tp_mult': 1.1919410145212743, 'sideways_tsl_mult': 0.15626944468162718, 'sideways_time_stop': 27, 'sideways_use_sma': True, 'sideways_use_ema': True, 'sideways_use_atr': True, 'sideways_use_adx': True, 'sideways_use_spike': False, 'sideways_rsi_required': False}.
[I 2025-09-01 13:27:59,902] Trial 1 finished with values: [-1000000000.0, 1000000000.0] and parameters: {'p_sma': 49, 'p_std': 20, 'p_atr': 23, 'p_adx': 29, 'rsi_period': 75, 'ema1': 30, 'ema2': 57, 'slip_atr_k': 0.04679791465964514, 'slip_spread_k': 0.007238323793395729, 'spread_hl_frac': 0.019490209719527463, 'bb_std_mult': 2.5688758873076796, 'rsi_os': 27, 'rsi_ob': 76, 'vol_spike': 0.14595416823843332, 'adx_thresh': 13.497025968582621, 'atr_min_pct': 0.028263051490138538, 'atr_max_pct': 0.13642092028528444, 'tp_mult': 2.48451369833305, 'tsl_mult': 0.837419928512267, 'strategy': 'mean_reversion', 'time_stop': 15, 'use_sma': True, 'use_atr': False, 'use_adx': True, 'use_ema': True, 'use_spike': True, 'rsi_required': False, 'edge_k': 0.29608689729738513, 'edge_cap': 0.27128964199445205, 'bull_strategy': 'mean_reversion', 'bull_bb_std_mult': 1.6657753392945756, 'bull_rsi_os': 40, 'bull_rsi_ob': 45, 'bull_adx_thresh': 12.897293178219208, 'bull_atr_min_pct': 0.013910964162156234, 'bull_atr_max_pct': 0.14930701402006002, 'bull_tp_mult': 2.649308475754929, 'bull_tsl_mult': 0.4589239867816258, 'bull_time_stop': 277, 'bull_use_sma': True, 'bull_use_ema': False, 'bull_use_atr': False, 'bull_use_adx': False, 'bull_use_spike': True, 'bull_rsi_required': False, 'bear_strategy': 'breakout', 'bear_bb_std_mult': 1.6184851086410301, 'bear_rsi_os': 55, 'bear_rsi_ob': 76, 'bear_adx_thresh': 31.4303018013568, 'bear_atr_min_pct': 0.025355774409780082, 'bear_atr_max_pct': 0.017284597404713345, 'bear_tp_mult': 2.6885977791322895, 'bear_tsl_mult': 0.5635072750466266, 'bear_time_stop': 245, 'bear_use_sma': True, 'bear_use_ema': True, 'bear_use_atr': False, 'bear_use_adx': True, 'bear_use_spike': False, 'bear_rsi_required': False, 'sideways_strategy': 'mean_reversion', 'sideways_bb_std_mult': 1.2843632184606473, 'sideways_rsi_os': 49, 'sideways_rsi_ob': 64, 'sideways_adx_thresh': 8.365852889607341, 'sideways_atr_min_pct': 0.0069021330257623146, 'sideways_atr_max_pct': 0.01542049643448876, 'sideways_tp_mult': 1.8921500608692725, 'sideways_tsl_mult': 0.6303705882437254, 'sideways_time_stop': 296, 'sideways_use_sma': True, 'sideways_use_ema': True, 'sideways_use_atr': True, 'sideways_use_adx': True, 'sideways_use_spike': True, 'sideways_rsi_required': True}.
[I 2025-09-01 13:28:37,921] Trial 4 finished with values: [-1000000000.0, 1000000000.0] and parameters: {'p_sma': 25, 'p_std': 55, 'p_atr': 23, 'p_adx': 9, 'rsi_period': 13, 'ema1': 26, 'ema2': 51, 'slip_atr_k': 0.11435073171622659, 'slip_spread_k': 0.17657421498987136, 'spread_hl_frac': 0.03499191172486609, 'bb_std_mult': 1.8038461808298794, 'rsi_os': 22, 'rsi_ob': 45, 'vol_spike': 0.2909452478323409, 'adx_thresh': 21.890875404987362, 'atr_min_pct': 0.002505201721751883, 'atr_max_pct': 0.04470805201043577, 'tp_mult': 1.1133394751634988, 'tsl_mult': 0.36740557780566274, 'strategy': 'breakout', 'time_stop': 50, 'use_sma': True, 'use_atr': False, 'use_adx': False, 'use_ema': False, 'use_spike': False, 'rsi_required': False, 'edge_k': 0.5120540360516401, 'edge_cap': 0.39694244067975276, 'bull_strategy': 'mean_reversion', 'bull_bb_std_mult': 2.17964569166979, 'bull_rsi_os': 37, 'bull_rsi_ob': 57, 'bull_adx_thresh': 31.815504676196493, 'bull_atr_min_pct': 0.02481271268486214, 'bull_atr_max_pct': 0.0873844922674739, 'bull_tp_mult': 1.7382533735242658, 'bull_tsl_mult': 0.8199939921191695, 'bull_time_stop': 49, 'bull_use_sma': True, 'bull_use_ema': True, 'bull_use_atr': False, 'bull_use_adx': False, 'bull_use_spike': False, 'bull_rsi_required': True, 'bear_strategy': 'mean_reversion', 'bear_bb_std_mult': 3.312506636162812, 'bear_rsi_os': 24, 'bear_rsi_ob': 71, 'bear_adx_thresh': 24.803397762503586, 'bear_atr_min_pct': 0.017786294651231545, 'bear_atr_max_pct': 0.14099625358445225, 'bear_tp_mult': 1.306761542261164, 'bear_tsl_mult': 0.7243916600789508, 'bear_time_stop': 261, 'bear_use_sma': False, 'bear_use_ema': True, 'bear_use_atr': False, 'bear_use_adx': True, 'bear_use_spike': False, 'bear_rsi_required': True, 'sideways_strategy': 'mean_reversion', 'sideways_bb_std_mult': 1.261469241915924, 'sideways_rsi_os': 42, 'sideways_rsi_ob': 56, 'sideways_adx_thresh': 34.44957686219071, 'sideways_atr_min_pct': 0.027658125347334257, 'sideways_atr_max_pct': 0.04265580152832759, 'sideways_tp_mult': 1.6928858337062194, 'sideways_tsl_mult': 0.9718730859343976, 'sideways_time_stop': 147, 'sideways_use_sma': True, 'sideways_use_ema': False, 'sideways_use_atr': True, 'sideways_use_adx': False, 'sideways_use_spike': False, 'sideways_rsi_required': False}.
[I 2025-09-01 13:28:38,131] Trial 8 finished with values: [-1000000000.0, 1000000000.0] and parameters: {'p_sma': 20, 'p_std': 59, 'p_atr': 28, 'p_adx': 30, 'rsi_period': 72, 'ema1': 6, 'ema2': 27, 'slip_atr_k': 0.07018430946386109, 'slip_spread_k': 0.11192140984992616, 'spread_hl_frac': 0.03871407956260814, 'bb_std_mult': 3.3517972585814233, 'rsi_os': 52, 'rsi_ob': 84, 'vol_spike': 0.29780145450715356, 'adx_thresh': 17.82670923543375, 'atr_min_pct': 0.026087025172996554, 'atr_max_pct': 0.10365253221321684, 'tp_mult': 2.8527400017357727, 'tsl_mult': 0.21195946846451208, 'strategy': 'mean_reversion', 'time_stop': 258, 'use_sma': True, 'use_atr': True, 'use_adx': True, 'use_ema': False, 'use_spike': True, 'rsi_required': True, 'edge_k': 1.5635641692482598, 'edge_cap': 0.060334411957354415, 'bull_strategy': 'breakout', 'bull_bb_std_mult': 3.004329707822141, 'bull_rsi_os': 28, 'bull_rsi_ob': 75, 'bull_adx_thresh': 11.81115820209106, 'bull_atr_min_pct': 0.02330020098648809, 'bull_atr_max_pct': 0.020177580167851997, 'bull_tp_mult': 2.6172992475643913, 'bull_tsl_mult': 0.9002873702241116, 'bull_time_stop': 65, 'bull_use_sma': True, 'bull_use_ema': False, 'bull_use_atr': True, 'bull_use_adx': False, 'bull_use_spike': True, 'bull_rsi_required': True, 'bear_strategy': 'breakout', 'bear_bb_std_mult': 1.5221038681788754, 'bear_rsi_os': 55, 'bear_rsi_ob': 93, 'bear_adx_thresh': 24.892870280969053, 'bear_atr_min_pct': 0.029550826021158633, 'bear_atr_max_pct': 0.0971204527118941, 'bear_tp_mult': 1.1462368858115992, 'bear_tsl_mult': 0.5182359919550029, 'bear_time_stop': 17, 'bear_use_sma': False, 'bear_use_ema': True, 'bear_use_atr': False, 'bear_use_adx': False, 'bear_use_spike': False, 'bear_rsi_required': False, 'sideways_strategy': 'mean_reversion', 'sideways_bb_std_mult': 2.7799417915851854, 'sideways_rsi_os': 30, 'sideways_rsi_ob': 72, 'sideways_adx_thresh': 22.269451189575612, 'sideways_atr_min_pct': 0.01075404105702265, 'sideways_atr_max_pct': 0.040755576413465625, 'sideways_tp_mult': 1.1833117547982728, 'sideways_tsl_mult': 0.5758328222178828, 'sideways_time_stop': 124, 'sideways_use_sma': False, 'sideways_use_ema': False, 'sideways_use_atr': False, 'sideways_use_adx': False, 'sideways_use_spike': True, 'sideways_rsi_required': False}.
[I 2025-09-01 13:28:38,638] Trial 6 finished with values: [-1000000000.0, 1000000000.0] and parameters: {'p_sma': 56, 'p_std': 16, 'p_atr': 29, 'p_adx': 19, 'rsi_period': 75, 'ema1': 16, 'ema2': 59, 'slip_atr_k': 0.19326778180921972, 'slip_spread_k': 0.9224761705367899, 'spread_hl_frac': 0.010307850144665199, 'bb_std_mult': 3.3811943663480237, 'rsi_os': 54, 'rsi_ob': 57, 'vol_spike': 0.19989621551074505, 'adx_thresh': 18.29848531890968, 'atr_min_pct': 0.02803132995596356, 'atr_max_pct': 0.1017975372747396, 'tp_mult': 2.0214436000525353, 'tsl_mult': 0.5693833326491201, 'strategy': 'breakout', 'time_stop': 273, 'use_sma': False, 'use_atr': False, 'use_adx': False, 'use_ema': True, 'use_spike': False, 'rsi_required': False, 'edge_k': 0.20583223182582966, 'edge_cap': 0.5836110136803299, 'bull_strategy': 'mean_reversion', 'bull_bb_std_mult': 3.3895516435513997, 'bull_rsi_os': 13, 'bull_rsi_ob': 68, 'bull_adx_thresh': 27.2840625152732, 'bull_atr_min_pct': 0.014777839537064276, 'bull_atr_max_pct': 0.06873780668463421, 'bull_tp_mult': 1.7476107754544736, 'bull_tsl_mult': 0.13881211403006255, 'bull_time_stop': 6, 'bull_use_sma': False, 'bull_use_ema': False, 'bull_use_atr': True, 'bull_use_adx': True, 'bull_use_spike': True, 'bull_rsi_required': False, 'bear_strategy': 'mean_reversion', 'bear_bb_std_mult': 1.0777172571809508, 'bear_rsi_os': 36, 'bear_rsi_ob': 71, 'bear_adx_thresh': 17.201374021710087, 'bear_atr_min_pct': 0.01715285649707003, 'bear_atr_max_pct': 0.12480630115365374, 'bear_tp_mult': 2.456042362913085, 'bear_tsl_mult': 0.45531943980050293, 'bear_time_stop': 244, 'bear_use_sma': True, 'bear_use_ema': False, 'bear_use_atr': True, 'bear_use_adx': False, 'bear_use_spike': True, 'bear_rsi_required': False, 'sideways_strategy': 'breakout', 'sideways_bb_std_mult': 0.5057887081477517, 'sideways_rsi_os': 16, 'sideways_rsi_ob': 67, 'sideways_adx_thresh': 16.908457225530302, 'sideways_atr_min_pct': 0.029720432253032666, 'sideways_atr_max_pct': 0.08449486592154719, 'sideways_tp_mult': 1.9934286627574813, 'sideways_tsl_mult': 0.4723625302177449, 'sideways_time_stop': 86, 'sideways_use_sma': True, 'sideways_use_ema': False, 'sideways_use_atr': False, 'sideways_use_adx': False, 'sideways_use_spike': False, 'sideways_rsi_required': False}.
[I 2025-09-01 13:28:39,008] Trial 5 finished with values: [-1000000000.0, 1000000000.0] and parameters: {'p_sma': 15, 'p_std': 33, 'p_atr': 13, 'p_adx': 16, 'rsi_period': 62, 'ema1': 28, 'ema2': 60, 'slip_atr_k': 0.1156047364616268, 'slip_spread_k': 0.32605505096500864, 'spread_hl_frac': 0.026471256744179623, 'bb_std_mult': 2.993101232956289, 'rsi_os': 9, 'rsi_ob': 48, 'vol_spike': 0.03438995369002592, 'adx_thresh': 18.451332624597853, 'atr_min_pct': 0.021553577874388902, 'atr_max_pct': 0.10351508036379507, 'tp_mult': 1.3601086912883744, 'tsl_mult': 0.8788710921113996, 'strategy': 'breakout', 'time_stop': 198, 'use_sma': True, 'use_atr': False, 'use_adx': True, 'use_ema': True, 'use_spike': False, 'rsi_required': True, 'edge_k': 1.5162312929900825, 'edge_cap': 0.6296310347641464, 'bull_strategy': 'breakout', 'bull_bb_std_mult': 0.5117734929710226, 'bull_rsi_os': 11, 'bull_rsi_ob': 91, 'bull_adx_thresh': 15.449892019723832, 'bull_atr_min_pct': 0.028588323346300293, 'bull_atr_max_pct': 0.018761251042540616, 'bull_tp_mult': 2.86686156631181, 'bull_tsl_mult': 0.06770783470445951, 'bull_time_stop': 230, 'bull_use_sma': False, 'bull_use_ema': False, 'bull_use_atr': True, 'bull_use_adx': False, 'bull_use_spike': True, 'bull_rsi_required': True, 'bear_strategy': 'breakout', 'bear_bb_std_mult': 0.5999340026436634, 'bear_rsi_os': 34, 'bear_rsi_ob': 57, 'bear_adx_thresh': 26.75487980630698, 'bear_atr_min_pct': 0.005252144740067955, 'bear_atr_max_pct': 0.012386507054907715, 'bear_tp_mult': 2.8018928336996742, 'bear_tsl_mult': 0.28395191143310006, 'bear_time_stop': 188, 'bear_use_sma': False, 'bear_use_ema': True, 'bear_use_atr': True, 'bear_use_adx': False, 'bear_use_spike': True, 'bear_rsi_required': True, 'sideways_strategy': 'mean_reversion', 'sideways_bb_std_mult': 3.242839339388859, 'sideways_rsi_os': 42, 'sideways_rsi_ob': 92, 'sideways_adx_thresh': 32.60185808710865, 'sideways_atr_min_pct': 0.021777116093456037, 'sideways_atr_max_pct': 0.12092714333577143, 'sideways_tp_mult': 1.1486347754837767, 'sideways_tsl_mult': 0.3130987811244017, 'sideways_time_stop': 219, 'sideways_use_sma': False, 'sideways_use_ema': False, 'sideways_use_atr': True, 'sideways_use_adx': False, 'sideways_use_spike': False, 'sideways_rsi_required': True}.
[I 2025-09-01 13:28:39,062] Trial 11 finished with values: [-1000000000.0, 1000000000.0] and parameters: {'p_sma': 17, 'p_std': 47, 'p_atr': 24, 'p_adx': 19, 'rsi_period': 56, 'ema1': 14, 'ema2': 19, 'slip_atr_k': 0.2131895969546631, 'slip_spread_k': 0.3211640825675438, 'spread_hl_frac': 0.0285094449601642, 'bb_std_mult': 3.2718096585904273, 'rsi_os': 14, 'rsi_ob': 50, 'vol_spike': 0.03972589760338787, 'adx_thresh': 6.5372331252926905, 'atr_min_pct': 0.013984584116482431, 'atr_max_pct': 0.04564221231246991, 'tp_mult': 1.4649728500929453, 'tsl_mult': 0.4361676862108348, 'strategy': 'mean_reversion', 'time_stop': 90, 'use_sma': False, 'use_atr': True, 'use_adx': True, 'use_ema': True, 'use_spike': False, 'rsi_required': True, 'edge_k': 0.2672961742903841, 'edge_cap': 0.2557783310210489, 'bull_strategy': 'mean_reversion', 'bull_bb_std_mult': 2.8895360332765043, 'bull_rsi_os': 30, 'bull_rsi_ob': 78, 'bull_adx_thresh': 22.745842427795278, 'bull_atr_min_pct': 0.00852142282023989, 'bull_atr_max_pct': 0.05309922381627146, 'bull_tp_mult': 1.6724636828663424, 'bull_tsl_mult': 0.46164508312199626, 'bull_time_stop': 264, 'bull_use_sma': True, 'bull_use_ema': True, 'bull_use_atr': False, 'bull_use_adx': True, 'bull_use_spike': False, 'bull_rsi_required': False, 'bear_strategy': 'mean_reversion', 'bear_bb_std_mult': 3.3060788311990965, 'bear_rsi_os': 52, 'bear_rsi_ob': 75, 'bear_adx_thresh': 10.802071732816591, 'bear_atr_min_pct': 0.02084315504926318, 'bear_atr_max_pct': 0.08401184352655658, 'bear_tp_mult': 2.518791941330919, 'bear_tsl_mult': 0.7840823829624934, 'bear_time_stop': 180, 'bear_use_sma': True, 'bear_use_ema': True, 'bear_use_atr': True, 'bear_use_adx': False, 'bear_use_spike': True, 'bear_rsi_required': False, 'sideways_strategy': 'mean_reversion', 'sideways_bb_std_mult': 1.3088383210541175, 'sideways_rsi_os': 14, 'sideways_rsi_ob': 95, 'sideways_adx_thresh': 14.933908713329096, 'sideways_atr_min_pct': 0.00035558993951989245, 'sideways_atr_max_pct': 0.11144141585766008, 'sideways_tp_mult': 1.5401356493930316, 'sideways_tsl_mult': 0.3601630315611428, 'sideways_time_stop': 42, 'sideways_use_sma': False, 'sideways_use_ema': True, 'sideways_use_atr': True, 'sideways_use_adx': False, 'sideways_use_spike': False, 'sideways_rsi_required': True}.
