[I 2025-09-01 14:04:32,822] Trial 262 finished with values: [-0.0012859871211537977, 0.006812634114913428] and parameters: {'p_sma': 27, 'p_std': 28, 'p_atr': 27, 'p_adx': 8, 'rsi_period': 77, 'ema1': 8, 'ema2': 58, 'slip_atr_k': 0.01669754441005391, 'slip_spread_k': 0.5054534555625099, 'spread_hl_frac': 0.011455008457774035, 'bb_std_mult': 3.5621371588370874, 'rsi_os': 43, 'rsi_ob': 52, 'vol_spike': 0.12143318539507549, 'adx_thresh': 5.242637582475263, 'atr_min_pct': 0.010950194223141255, 'atr_max_pct': 0.031214303350495236, 'tp_mult': 1.4001015427947725, 'tsl_mult': 0.7397251783179577, 'strategy': 'mean_reversion', 'time_stop': 112, 'use_sma': True, 'use_atr': False, 'use_adx': True, 'use_ema': True, 'use_spike': True, 'rsi_required': True, 'edge_k': 0.5317772949874457, 'edge_cap': 0.9563808940388845, 'bull_strategy': 'breakout', 'bull_bb_std_mult': 2.701435833886822, 'bull_rsi_os': 14, 'bull_rsi_ob': 78, 'bull_adx_thresh': 10.945102320714232, 'bull_atr_min_pct': 0.01304248164883793, 'bull_atr_max_pct': 0.12283457225267333, 'bull_tp_mult': 1.638067425788246, 'bull_tsl_mult': 0.6140296931120441, 'bull_time_stop': 160, 'bull_use_sma': False, 'bull_use_ema': True, 'bull_use_atr': True, 'bull_use_adx': True, 'bull_use_spike': True, 'bull_rsi_required': True, 'bear_strategy': 'mean_reversion', 'bear_bb_std_mult': 2.3533346093323133, 'bear_rsi_os': 35, 'bear_rsi_ob': 57, 'bear_adx_thresh': 7.945875377972266, 'bear_atr_min_pct': 0.0021621839188668414, 'bear_atr_max_pct': 0.12055121101497371, 'bear_tp_mult': 2.1046229985971583, 'bear_tsl_mult': 0.08888025794867127, 'bear_time_stop': 83, 'bear_use_sma': False, 'bear_use_ema': False, 'bear_use_atr': False, 'bear_use_adx': False, 'bear_use_spike': True, 'bear_rsi_required': False, 'sideways_strategy': 'mean_reversion', 'sideways_bb_std_mult': 2.9699562408937554, 'sideways_rsi_os': 31, 'sideways_rsi_ob': 92, 'sideways_adx_thresh': 26.327627957227122, 'sideways_atr_min_pct': 0.00519728057310488, 'sideways_atr_max_pct': 0.11328151067578897, 'sideways_tp_mult': 2.4169373068110938, 'sideways_tsl_mult': 0.37339467920480646, 'sideways_time_stop': 260, 'sideways_use_sma': True, 'sideways_use_ema': True, 'sideways_use_atr': True, 'sideways_use_adx': True, 'sideways_use_spike': False, 'sideways_rsi_required': False}.
[I 2025-09-01 14:04:33,172] Trial 260 finished with values: [0.0011485433538704903, 0.0057922016770956585] and parameters: {'p_sma': 28, 'p_std': 28, 'p_atr': 25, 'p_adx': 8, 'rsi_period': 80, 'ema1': 8, 'ema2': 55, 'slip_atr_k': 0.020525723915130176, 'slip_spread_k': 0.5814560351401644, 'spread_hl_frac': 0.011583426675213821, 'bb_std_mult': 3.5242375810895434, 'rsi_os': 42, 'rsi_ob': 53, 'vol_spike': 0.10539178878127685, 'adx_thresh': 5.132772152072826, 'atr_min_pct': 0.012262679387226298, 'atr_max_pct': 0.03381802382315856, 'tp_mult': 1.3803523767263208, 'tsl_mult': 0.6927948038407786, 'strategy': 'mean_reversion', 'time_stop': 123, 'use_sma': True, 'use_atr': False, 'use_adx': True, 'use_ema': True, 'use_spike': True, 'rsi_required': True, 'edge_k': 0.20634212106480324, 'edge_cap': 0.9398474984283115, 'bull_strategy': 'breakout', 'bull_bb_std_mult': 2.7290544635107366, 'bull_rsi_os': 13, 'bull_rsi_ob': 77, 'bull_adx_thresh': 10.867636072466045, 'bull_atr_min_pct': 0.010954683698334558, 'bull_atr_max_pct': 0.12636092851334393, 'bull_tp_mult': 1.683327045154954, 'bull_tsl_mult': 0.49165751491886345, 'bull_time_stop': 147, 'bull_use_sma': False, 'bull_use_ema': True, 'bull_use_atr': True, 'bull_use_adx': True, 'bull_use_spike': True, 'bull_rsi_required': True, 'bear_strategy': 'mean_reversion', 'bear_bb_std_mult': 2.4903607139469077, 'bear_rsi_os': 35, 'bear_rsi_ob': 60, 'bear_adx_thresh': 8.397529052932041, 'bear_atr_min_pct': 0.0020508560369483677, 'bear_atr_max_pct': 0.11539325825770083, 'bear_tp_mult': 2.1031670885318245, 'bear_tsl_mult': 0.2783393128465329, 'bear_time_stop': 86, 'bear_use_sma': False, 'bear_use_ema': False, 'bear_use_atr': False, 'bear_use_adx': False, 'bear_use_spike': True, 'bear_rsi_required': False, 'sideways_strategy': 'mean_reversion', 'sideways_bb_std_mult': 2.9621644368524485, 'sideways_rsi_os': 30, 'sideways_rsi_ob': 90, 'sideways_adx_thresh': 26.54611423824029, 'sideways_atr_min_pct': 0.004086408184250182, 'sideways_atr_max_pct': 0.10568392308640996, 'sideways_tp_mult': 2.349711550228248, 'sideways_tsl_mult': 0.3939540844918059, 'sideways_time_stop': 251, 'sideways_use_sma': True, 'sideways_use_ema': True, 'sideways_use_atr': True, 'sideways_use_adx': True, 'sideways_use_spike': False, 'sideways_rsi_required': False}.
[I 2025-09-01 14:05:10,328] Trial 266 finished with values: [-1000000000.0, 1000000000.0] and parameters: {'p_sma': 27, 'p_std': 28, 'p_atr': 26, 'p_adx': 8, 'rsi_period': 78, 'ema1': 7, 'ema2': 58, 'slip_atr_k': 0.015175164295567018, 'slip_spread_k': 0.5028199795473629, 'spread_hl_frac': 0.011131615802080209, 'bb_std_mult': 3.584064174431626, 'rsi_os': 43, 'rsi_ob': 52, 'vol_spike': 0.1208487695742289, 'adx_thresh': 5.194283466316845, 'atr_min_pct': 0.011336653974948378, 'atr_max_pct': 0.027369694489385005, 'tp_mult': 1.4060405093480755, 'tsl_mult': 0.6897149243181149, 'strategy': 'mean_reversion', 'time_stop': 121, 'use_sma': True, 'use_atr': False, 'use_adx': True, 'use_ema': True, 'use_spike': True, 'rsi_required': True, 'edge_k': 0.19425159043571938, 'edge_cap': 0.9563337528769066, 'bull_strategy': 'breakout', 'bull_bb_std_mult': 2.7191227651699035, 'bull_rsi_os': 14, 'bull_rsi_ob': 77, 'bull_adx_thresh': 10.932168825295042, 'bull_atr_min_pct': 0.0129903596557245, 'bull_atr_max_pct': 0.12382389496239211, 'bull_tp_mult': 1.6543267537124222, 'bull_tsl_mult': 0.6139193191778216, 'bull_time_stop': 151, 'bull_use_sma': False, 'bull_use_ema': True, 'bull_use_atr': True, 'bull_use_adx': True, 'bull_use_spike': True, 'bull_rsi_required': True, 'bear_strategy': 'mean_reversion', 'bear_bb_std_mult': 2.4739828286711796, 'bear_rsi_os': 33, 'bear_rsi_ob': 57, 'bear_adx_thresh': 8.243238913276507, 'bear_atr_min_pct': 0.0020891131095953936, 'bear_atr_max_pct': 0.11053023795865939, 'bear_tp_mult': 2.098895849234808, 'bear_tsl_mult': 0.09214208913102084, 'bear_time_stop': 83, 'bear_use_sma': False, 'bear_use_ema': False, 'bear_use_atr': False, 'bear_use_adx': False, 'bear_use_spike': True, 'bear_rsi_required': False, 'sideways_strategy': 'mean_reversion', 'sideways_bb_std_mult': 3.3177350722406196, 'sideways_rsi_os': 31, 'sideways_rsi_ob': 92, 'sideways_adx_thresh': 26.49462371216957, 'sideways_atr_min_pct': 0.005322635190944183, 'sideways_atr_max_pct': 0.10778801542409093, 'sideways_tp_mult': 2.394843479377366, 'sideways_tsl_mult': 0.3490682813273588, 'sideways_time_stop': 254, 'sideways_use_sma': True, 'sideways_use_ema': True, 'sideways_use_atr': True, 'sideways_use_adx': True, 'sideways_use_spike': False, 'sideways_rsi_required': False}.
[I 2025-09-01 14:05:10,932] Trial 265 finished with values: [-0.0020122884798587926, 0.007138916636145587] and parameters: {'p_sma': 27, 'p_std': 28, 'p_atr': 26, 'p_adx': 8, 'rsi_period': 77, 'ema1': 7, 'ema2': 58, 'slip_atr_k': 0.014806423415574825, 'slip_spread_k': 0.5031183753264796, 'spread_hl_frac': 0.010914669518992746, 'bb_std_mult': 3.5958848159863073, 'rsi_os': 43, 'rsi_ob': 52, 'vol_spike': 0.12018011387794762, 'adx_thresh': 5.644110054412148, 'atr_min_pct': 0.012254500083403546, 'atr_max_pct': 0.032544201275638125, 'tp_mult': 1.4229924814759403, 'tsl_mult': 0.7160113651734844, 'strategy': 'mean_reversion', 'time_stop': 117, 'use_sma': True, 'use_atr': False, 'use_adx': True, 'use_ema': True, 'use_spike': True, 'rsi_required': True, 'edge_k': 0.19141368844950016, 'edge_cap': 0.9375358309625197, 'bull_strategy': 'breakout', 'bull_bb_std_mult': 2.789633059888633, 'bull_rsi_os': 14, 'bull_rsi_ob': 78, 'bull_adx_thresh': 10.902275013637311, 'bull_atr_min_pct': 0.013437260155761415, 'bull_atr_max_pct': 0.12344067010833773, 'bull_tp_mult': 1.6701995595165438, 'bull_tsl_mult': 0.6200272494438469, 'bull_time_stop': 161, 'bull_use_sma': False, 'bull_use_ema': True, 'bull_use_atr': True, 'bull_use_adx': True, 'bull_use_spike': True, 'bull_rsi_required': True, 'bear_strategy': 'mean_reversion', 'bear_bb_std_mult': 2.523501947509921, 'bear_rsi_os': 34, 'bear_rsi_ob': 57, 'bear_adx_thresh': 7.783841790614378, 'bear_atr_min_pct': 0.0019401855404109886, 'bear_atr_max_pct': 0.11011006322247921, 'bear_tp_mult': 2.103294888868321, 'bear_tsl_mult': 0.09882119508188474, 'bear_time_stop': 83, 'bear_use_sma': False, 'bear_use_ema': False, 'bear_use_atr': False, 'bear_use_adx': False, 'bear_use_spike': True, 'bear_rsi_required': False, 'sideways_strategy': 'mean_reversion', 'sideways_bb_std_mult': 3.2046921199495166, 'sideways_rsi_os': 31, 'sideways_rsi_ob': 91, 'sideways_adx_thresh': 26.45674238122064, 'sideways_atr_min_pct': 0.005149884300549041, 'sideways_atr_max_pct': 0.11062173854814594, 'sideways_tp_mult': 2.4116848182025348, 'sideways_tsl_mult': 0.3805348474965383, 'sideways_time_stop': 257, 'sideways_use_sma': True, 'sideways_use_ema': True, 'sideways_use_atr': True, 'sideways_use_adx': True, 'sideways_use_spike': False, 'sideways_rsi_required': False}.
[I 2025-09-01 14:05:11,385] Trial 264 finished with values: [0.0030953904909800656, 0.0065529011000232465] and parameters: {'p_sma': 28, 'p_std': 28, 'p_atr': 26, 'p_adx': 8, 'rsi_period': 78, 'ema1': 8, 'ema2': 57, 'slip_atr_k': 0.015582121141801165, 'slip_spread_k': 0.5042263177763728, 'spread_hl_frac': 0.010518845482674496, 'bb_std_mult': 3.593282998775077, 'rsi_os': 43, 'rsi_ob': 52, 'vol_spike': 0.12160152439310877, 'adx_thresh': 5.216912182376774, 'atr_min_pct': 0.011094228999711516, 'atr_max_pct': 0.03132322385142647, 'tp_mult': 1.4115584278538402, 'tsl_mult': 0.6831880642167409, 'strategy': 'mean_reversion', 'time_stop': 119, 'use_sma': True, 'use_atr': False, 'use_adx': True, 'use_ema': True, 'use_spike': True, 'rsi_required': True, 'edge_k': 0.5298155347601141, 'edge_cap': 0.9537231300189469, 'bull_strategy': 'breakout', 'bull_bb_std_mult': 2.8081517573172112, 'bull_rsi_os': 14, 'bull_rsi_ob': 77, 'bull_adx_thresh': 10.903971393729856, 'bull_atr_min_pct': 0.013178165463236236, 'bull_atr_max_pct': 0.1240997900538351, 'bull_tp_mult': 1.6474284309015794, 'bull_tsl_mult': 0.620164856208587, 'bull_time_stop': 152, 'bull_use_sma': False, 'bull_use_ema': True, 'bull_use_atr': True, 'bull_use_adx': True, 'bull_use_spike': True, 'bull_rsi_required': True, 'bear_strategy': 'mean_reversion', 'bear_bb_std_mult': 2.538817957317992, 'bear_rsi_os': 35, 'bear_rsi_ob': 58, 'bear_adx_thresh': 7.978493213753936, 'bear_atr_min_pct': 0.002163221534834999, 'bear_atr_max_pct': 0.12129557619661277, 'bear_tp_mult': 2.10190839426935, 'bear_tsl_mult': 0.12488539104428471, 'bear_time_stop': 83, 'bear_use_sma': False, 'bear_use_ema': False, 'bear_use_atr': False, 'bear_use_adx': False, 'bear_use_spike': True, 'bear_rsi_required': False, 'sideways_strategy': 'mean_reversion', 'sideways_bb_std_mult': 3.220868810920489, 'sideways_rsi_os': 30, 'sideways_rsi_ob': 91, 'sideways_adx_thresh': 26.450954850076588, 'sideways_atr_min_pct': 0.005180322105342297, 'sideways_atr_max_pct': 0.10756684152352346, 'sideways_tp_mult': 2.4035309794487927, 'sideways_tsl_mult': 0.36743844916749624, 'sideways_time_stop': 256, 'sideways_use_sma': True, 'sideways_use_ema': True, 'sideways_use_atr': True, 'sideways_use_adx': True, 'sideways_use_spike': False, 'sideways_rsi_required': False}.
[I 2025-09-01 14:05:11,718] Trial 263 finished with values: [-0.003407681936283602, 0.008819502044425762] and parameters: {'p_sma': 27, 'p_std': 28, 'p_atr': 26, 'p_adx': 8, 'rsi_period': 77, 'ema1': 8, 'ema2': 58, 'slip_atr_k': 0.01543115357141441, 'slip_spread_k': 0.4976887821079741, 'spread_hl_frac': 0.010836136247030519, 'bb_std_mult': 3.5806909636351287, 'rsi_os': 43, 'rsi_ob': 52, 'vol_spike': 0.12076741809984956, 'adx_thresh': 5.492641277761967, 'atr_min_pct': 0.010923777932081102, 'atr_max_pct': 0.032834974564162685, 'tp_mult': 1.4133542918901496, 'tsl_mult': 0.7950510549220542, 'strategy': 'mean_reversion', 'time_stop': 121, 'use_sma': True, 'use_atr': False, 'use_adx': True, 'use_ema': True, 'use_spike': True, 'rsi_required': True, 'edge_k': 0.5529810243223832, 'edge_cap': 0.9431801050746458, 'bull_strategy': 'breakout', 'bull_bb_std_mult': 2.718160173289708, 'bull_rsi_os': 13, 'bull_rsi_ob': 78, 'bull_adx_thresh': 10.916400357235275, 'bull_atr_min_pct': 0.013519789435830029, 'bull_atr_max_pct': 0.12296773534005466, 'bull_tp_mult': 1.6407005431223671, 'bull_tsl_mult': 0.612447693513452, 'bull_time_stop': 146, 'bull_use_sma': False, 'bull_use_ema': True, 'bull_use_atr': True, 'bull_use_adx': True, 'bull_use_spike': True, 'bull_rsi_required': True, 'bear_strategy': 'mean_reversion', 'bear_bb_std_mult': 2.4882029952245652, 'bear_rsi_os': 35, 'bear_rsi_ob': 57, 'bear_adx_thresh': 7.934240473849567, 'bear_atr_min_pct': 0.0020432669491519655, 'bear_atr_max_pct': 0.11093319529100683, 'bear_tp_mult': 2.077110827200815, 'bear_tsl_mult': 0.1040829867395927, 'bear_time_stop': 74, 'bear_use_sma': False, 'bear_use_ema': False, 'bear_use_atr': False, 'bear_use_adx': False, 'bear_use_spike': True, 'bear_rsi_required': False, 'sideways_strategy': 'mean_reversion', 'sideways_bb_std_mult': 3.2500874682298395, 'sideways_rsi_os': 32, 'sideways_rsi_ob': 92, 'sideways_adx_thresh': 26.32751893899156, 'sideways_atr_min_pct': 0.004133171399779645, 'sideways_atr_max_pct': 0.10991191531306332, 'sideways_tp_mult': 2.4097809345107457, 'sideways_tsl_mult': 0.3562950839244187, 'sideways_time_stop': 259, 'sideways_use_sma': True, 'sideways_use_ema': True, 'sideways_use_atr': True, 'sideways_use_adx': True, 'sideways_use_spike': False, 'sideways_rsi_required': False}.
[I 2025-09-01 14:05:50,728] Trial 267 finished with values: [0.005514042428901522, 0.0051498131793621645] and parameters: {'p_sma': 28, 'p_std': 25, 'p_atr': 26, 'p_adx': 8, 'rsi_period': 78, 'ema1': 8, 'ema2': 57, 'slip_atr_k': 0.005633999100934185, 'slip_spread_k': 0.4990843329925362, 'spread_hl_frac': 0.00997615351674033, 'bb_std_mult': 3.4709496139391023, 'rsi_os': 43, 'rsi_ob': 51, 'vol_spike': 0.10794998167421124, 'adx_thresh': 5.225095999249877, 'atr_min_pct': 0.011957793179675153, 'atr_max_pct': 0.03193760595995552, 'tp_mult': 1.3652716991527558, 'tsl_mult': 0.7141492302778021, 'strategy': 'mean_reversion', 'time_stop': 110, 'use_sma': True, 'use_atr': False, 'use_adx': True, 'use_ema': True, 'use_spike': True, 'rsi_required': True, 'edge_k': 0.25362505974442817, 'edge_cap': 0.938239001870272, 'bull_strategy': 'breakout', 'bull_bb_std_mult': 2.7640704969892465, 'bull_rsi_os': 12, 'bull_rsi_ob': 78, 'bull_adx_thresh': 11.674314259510805, 'bull_atr_min_pct': 0.013412187233843808, 'bull_atr_max_pct': 0.12743619087937938, 'bull_tp_mult': 1.618746458975775, 'bull_tsl_mult': 0.6009774967158872, 'bull_time_stop': 162, 'bull_use_sma': False, 'bull_use_ema': True, 'bull_use_atr': True, 'bull_use_adx': True, 'bull_use_spike': True, 'bull_rsi_required': True, 'bear_strategy': 'mean_reversion', 'bear_bb_std_mult': 2.5222047316900644, 'bear_rsi_os': 35, 'bear_rsi_ob': 57, 'bear_adx_thresh': 7.953486409035046, 'bear_atr_min_pct': 0.0028021341882710753, 'bear_atr_max_pct': 0.12283232478659536, 'bear_tp_mult': 2.0478766153281875, 'bear_tsl_mult': 0.11967932856159469, 'bear_time_stop': 79, 'bear_use_sma': False, 'bear_use_ema': False, 'bear_use_atr': False, 'bear_use_adx': False, 'bear_use_spike': True, 'bear_rsi_required': False, 'sideways_strategy': 'mean_reversion', 'sideways_bb_std_mult': 3.3409999514744086, 'sideways_rsi_os': 30, 'sideways_rsi_ob': 91, 'sideways_adx_thresh': 26.408728690604185, 'sideways_atr_min_pct': 0.004160356131173355, 'sideways_atr_max_pct': 0.11037004880982178, 'sideways_tp_mult': 2.4257532549461382, 'sideways_tsl_mult': 0.3877154186582313, 'sideways_time_stop': 259, 'sideways_use_sma': True, 'sideways_use_ema': True, 'sideways_use_atr': True, 'sideways_use_adx': True, 'sideways_use_spike': False, 'sideways_rsi_required': False}.
[I 2025-09-01 14:05:51,410] Trial 269 finished with values: [-0.0011600027784587352, 0.008744074575216454] and parameters: {'p_sma': 27, 'p_std': 26, 'p_atr': 26, 'p_adx': 8, 'rsi_period': 78, 'ema1': 8, 'ema2': 57, 'slip_atr_k': 0.02042927548974344, 'slip_spread_k': 0.4960112390270156, 'spread_hl_frac': 0.009855020650425534, 'bb_std_mult': 3.5600040927209102, 'rsi_os': 43, 'rsi_ob': 53, 'vol_spike': 0.10668440150288266, 'adx_thresh': 5.0486995750499775, 'atr_min_pct': 0.011753872987838936, 'atr_max_pct': 0.0345057137579007, 'tp_mult': 1.3751367693469803, 'tsl_mult': 0.7127651938209908, 'strategy': 'mean_reversion', 'time_stop': 110, 'use_sma': True, 'use_atr': False, 'use_adx': True, 'use_ema': True, 'use_spike': True, 'rsi_required': True, 'edge_k': 0.5391318083170407, 'edge_cap': 0.9450164222132573, 'bull_strategy': 'breakout', 'bull_bb_std_mult': 3.02961906661057, 'bull_rsi_os': 12, 'bull_rsi_ob': 78, 'bull_adx_thresh': 11.636917603647602, 'bull_atr_min_pct': 0.013480188517599134, 'bull_atr_max_pct': 0.127651274723448, 'bull_tp_mult': 1.5860439582253618, 'bull_tsl_mult': 0.6011839067108405, 'bull_time_stop': 142, 'bull_use_sma': False, 'bull_use_ema': True, 'bull_use_atr': True, 'bull_use_adx': True, 'bull_use_spike': True, 'bull_rsi_required': True, 'bear_strategy': 'mean_reversion', 'bear_bb_std_mult': 2.5264328135220935, 'bear_rsi_os': 35, 'bear_rsi_ob': 56, 'bear_adx_thresh': 7.755834269917416, 'bear_atr_min_pct': 0.0018778921680650657, 'bear_atr_max_pct': 0.10468267515020799, 'bear_tp_mult': 2.019759498854236, 'bear_tsl_mult': 0.1214649686183247, 'bear_time_stop': 80, 'bear_use_sma': False, 'bear_use_ema': False, 'bear_use_atr': False, 'bear_use_adx': False, 'bear_use_spike': True, 'bear_rsi_required': False, 'sideways_strategy': 'mean_reversion', 'sideways_bb_std_mult': 3.2181961484595925, 'sideways_rsi_os': 32, 'sideways_rsi_ob': 91, 'sideways_adx_thresh': 24.85744719106308, 'sideways_atr_min_pct': 0.004092675231749544, 'sideways_atr_max_pct': 0.1130211674513797, 'sideways_tp_mult': 2.431319776092773, 'sideways_tsl_mult': 0.38269323861004617, 'sideways_time_stop': 261, 'sideways_use_sma': True, 'sideways_use_ema': True, 'sideways_use_atr': True, 'sideways_use_adx': True, 'sideways_use_spike': False, 'sideways_rsi_required': False}.
[I 2025-09-01 14:05:51,929] Trial 268 finished with values: [-0.0011531344785633557, 0.008741656350786166] and parameters: {'p_sma': 27, 'p_std': 26, 'p_atr': 26, 'p_adx': 8, 'rsi_period': 78, 'ema1': 6, 'ema2': 57, 'slip_atr_k': 0.020432478397313786, 'slip_spread_k': 0.48613787434479094, 'spread_hl_frac': 0.009989840273559364, 'bb_std_mult': 3.4785953998080723, 'rsi_os': 43, 'rsi_ob': 51, 'vol_spike': 0.10711940751238401, 'adx_thresh': 5.005284212805975, 'atr_min_pct': 0.012162061639514611, 'atr_max_pct': 0.031924737320529965, 'tp_mult': 1.3823875440398823, 'tsl_mult': 0.711955279428897, 'strategy': 'mean_reversion', 'time_stop': 116, 'use_sma': True, 'use_atr': False, 'use_adx': True, 'use_ema': True, 'use_spike': True, 'rsi_required': True, 'edge_k': 0.2820836753366161, 'edge_cap': 0.9353016455547106, 'bull_strategy': 'breakout', 'bull_bb_std_mult': 2.790011962990776, 'bull_rsi_os': 13, 'bull_rsi_ob': 77, 'bull_adx_thresh': 11.727324469245715, 'bull_atr_min_pct': 0.013065466296915082, 'bull_atr_max_pct': 0.1283241002194289, 'bull_tp_mult': 1.6136101554198587, 'bull_tsl_mult': 0.6267591652575866, 'bull_time_stop': 163, 'bull_use_sma': False, 'bull_use_ema': True, 'bull_use_atr': True, 'bull_use_adx': True, 'bull_use_spike': True, 'bull_rsi_required': True, 'bear_strategy': 'mean_reversion', 'bear_bb_std_mult': 2.508283147805045, 'bear_rsi_os': 35, 'bear_rsi_ob': 57, 'bear_adx_thresh': 7.803593216568751, 'bear_atr_min_pct': 0.0018797037224470522, 'bear_atr_max_pct': 0.11199726077927546, 'bear_tp_mult': 2.056050897425144, 'bear_tsl_mult': 0.12847592317809783, 'bear_time_stop': 80, 'bear_use_sma': False, 'bear_use_ema': False, 'bear_use_atr': False, 'bear_use_adx': False, 'bear_use_spike': True, 'bear_rsi_required': False, 'sideways_strategy': 'mean_reversion', 'sideways_bb_std_mult': 3.209754022578148, 'sideways_rsi_os': 31, 'sideways_rsi_ob': 91, 'sideways_adx_thresh': 26.287193140746773, 'sideways_atr_min_pct': 0.004267538338222989, 'sideways_atr_max_pct': 0.11189896886235359, 'sideways_tp_mult': 2.432477633591928, 'sideways_tsl_mult': 0.3754978968432166, 'sideways_time_stop': 261, 'sideways_use_sma': True, 'sideways_use_ema': True, 'sideways_use_atr': True, 'sideways_use_adx': True, 'sideways_use_spike': False, 'sideways_rsi_required': False}.
