[I 2025-09-01 13:54:06,907] Trial 177 finished with values: [-1000000000.0, 1000000000.0] and parameters: {'p_sma': 6, 'p_std': 28, 'p_atr': 8, 'p_adx': 27, 'rsi_period': 22, 'ema1': 7, 'ema2': 30, 'slip_atr_k': 0.0049132941126701826, 'slip_spread_k': 0.510171767277744, 'spread_hl_frac': 0.013863161991528868, 'bb_std_mult': 0.5793441918317115, 'rsi_os': 44, 'rsi_ob': 67, 'vol_spike': 0.08780260634333564, 'adx_thresh': 32.777702753467246, 'atr_min_pct': 0.027248372267784555, 'atr_max_pct': 0.12596912841764027, 'tp_mult': 1.9187595892806002, 'tsl_mult': 0.9522395003032881, 'strategy': 'breakout', 'time_stop': 255, 'use_sma': False, 'use_atr': True, 'use_adx': False, 'use_ema': False, 'use_spike': True, 'rsi_required': True, 'edge_k': 1.827553354569264, 'edge_cap': 0.3944395035790637, 'bull_strategy': 'breakout', 'bull_bb_std_mult': 1.4967412590345601, 'bull_rsi_os': 18, 'bull_rsi_ob': 50, 'bull_adx_thresh': 20.312253552934873, 'bull_atr_min_pct': 0.019160339790467613, 'bull_atr_max_pct': 0.14925462555553118, 'bull_tp_mult': 1.1985132007227293, 'bull_tsl_mult': 0.9867639249842988, 'bull_time_stop': 98, 'bull_use_sma': False, 'bull_use_ema': True, 'bull_use_atr': False, 'bull_use_adx': False, 'bull_use_spike': False, 'bull_rsi_required': False, 'bear_strategy': 'breakout', 'bear_bb_std_mult': 2.259757554084476, 'bear_rsi_os': 34, 'bear_rsi_ob': 51, 'bear_adx_thresh': 8.741758882178804, 'bear_atr_min_pct': 0.004832575328105186, 'bear_atr_max_pct': 0.07358109561092872, 'bear_tp_mult': 2.9285550067417487, 'bear_tsl_mult': 0.19819470899248265, 'bear_time_stop': 50, 'bear_use_sma': False, 'bear_use_ema': True, 'bear_use_atr': False, 'bear_use_adx': True, 'bear_use_spike': False, 'bear_rsi_required': True, 'sideways_strategy': 'mean_reversion', 'sideways_bb_std_mult': 1.5639126309890663, 'sideways_rsi_os': 19, 'sideways_rsi_ob': 89, 'sideways_adx_thresh': 18.71981859044787, 'sideways_atr_min_pct': 0.028831950471881564, 'sideways_atr_max_pct': 0.1207900007925908, 'sideways_tp_mult': 2.7902475606478925, 'sideways_tsl_mult': 0.3562228822906086, 'sideways_time_stop': 176, 'sideways_use_sma': False, 'sideways_use_ema': True, 'sideways_use_atr': True, 'sideways_use_adx': False, 'sideways_use_spike': True, 'sideways_rsi_required': False}.
[I 2025-09-01 13:54:07,447] Trial 181 finished with values: [-1000000000.0, 1000000000.0] and parameters: {'p_sma': 8, 'p_std': 32, 'p_atr': 13, 'p_adx': 30, 'rsi_period': 25, 'ema1': 16, 'ema2': 31, 'slip_atr_k': 0.005301172191873588, 'slip_spread_k': 0.5713911083815947, 'spread_hl_frac': 0.009258259109976774, 'bb_std_mult': 2.5145366684886716, 'rsi_os': 44, 'rsi_ob': 90, 'vol_spike': 0.1653108991045367, 'adx_thresh': 32.63889637597263, 'atr_min_pct': 0.020235920157527443, 'atr_max_pct': 0.014509995472418097, 'tp_mult': 2.101732473436294, 'tsl_mult': 0.7234933265427778, 'strategy': 'breakout', 'time_stop': 39, 'use_sma': True, 'use_atr': True, 'use_adx': False, 'use_ema': False, 'use_spike': True, 'rsi_required': False, 'edge_k': 1.8300905958041176, 'edge_cap': 0.31359051316097, 'bull_strategy': 'breakout', 'bull_bb_std_mult': 2.3053784082163418, 'bull_rsi_os': 7, 'bull_rsi_ob': 76, 'bull_adx_thresh': 30.619172552422732, 'bull_atr_min_pct': 0.0006340348100378826, 'bull_atr_max_pct': 0.11327165521764093, 'bull_tp_mult': 1.7873657548992454, 'bull_tsl_mult': 0.6402009602620125, 'bull_time_stop': 98, 'bull_use_sma': False, 'bull_use_ema': True, 'bull_use_atr': False, 'bull_use_adx': True, 'bull_use_spike': False, 'bull_rsi_required': False, 'bear_strategy': 'breakout', 'bear_bb_std_mult': 3.0228452341467227, 'bear_rsi_os': 34, 'bear_rsi_ob': 78, 'bear_adx_thresh': 7.006028590025393, 'bear_atr_min_pct': 0.003186639024435363, 'bear_atr_max_pct': 0.05955210780882058, 'bear_tp_mult': 1.8853056860822082, 'bear_tsl_mult': 0.906609234711411, 'bear_time_stop': 47, 'bear_use_sma': False, 'bear_use_ema': True, 'bear_use_atr': True, 'bear_use_adx': True, 'bear_use_spike': False, 'bear_rsi_required': False, 'sideways_strategy': 'breakout', 'sideways_bb_std_mult': 1.2040192167644996, 'sideways_rsi_os': 15, 'sideways_rsi_ob': 73, 'sideways_adx_thresh': 26.914409116638573, 'sideways_atr_min_pct': 0.017802584114384623, 'sideways_atr_max_pct': 0.11613961215189796, 'sideways_tp_mult': 1.250333087338475, 'sideways_tsl_mult': 0.724679321031608, 'sideways_time_stop': 261, 'sideways_use_sma': False, 'sideways_use_ema': True, 'sideways_use_atr': True, 'sideways_use_adx': False, 'sideways_use_spike': False, 'sideways_rsi_required': False}.
[I 2025-09-01 13:54:46,054] Trial 183 finished with values: [-1000000000.0, 1000000000.0] and parameters: {'p_sma': 18, 'p_std': 36, 'p_atr': 8, 'p_adx': 27, 'rsi_period': 22, 'ema1': 5, 'ema2': 26, 'slip_atr_k': 0.005205290489183107, 'slip_spread_k': 0.44740496028803917, 'spread_hl_frac': 0.00926148063100272, 'bb_std_mult': 2.7235081798453695, 'rsi_os': 31, 'rsi_ob': 90, 'vol_spike': 0.1978450814472268, 'adx_thresh': 14.788706438893131, 'atr_min_pct': 0.0005920412859160267, 'atr_max_pct': 0.1272288213368753, 'tp_mult': 1.9624940858392088, 'tsl_mult': 0.15458476610710387, 'strategy': 'breakout', 'time_stop': 204, 'use_sma': True, 'use_atr': True, 'use_adx': False, 'use_ema': False, 'use_spike': True, 'rsi_required': False, 'edge_k': 1.174574443725984, 'edge_cap': 0.3792242448966632, 'bull_strategy': 'breakout', 'bull_bb_std_mult': 2.174661646217456, 'bull_rsi_os': 21, 'bull_rsi_ob': 61, 'bull_adx_thresh': 9.720430167836351, 'bull_atr_min_pct': 0.022783896929645345, 'bull_atr_max_pct': 0.1497593625048587, 'bull_tp_mult': 1.8594009058611314, 'bull_tsl_mult': 0.5452630335686018, 'bull_time_stop': 200, 'bull_use_sma': False, 'bull_use_ema': True, 'bull_use_atr': False, 'bull_use_adx': True, 'bull_use_spike': False, 'bull_rsi_required': True, 'bear_strategy': 'breakout', 'bear_bb_std_mult': 3.3278593614343057, 'bear_rsi_os': 27, 'bear_rsi_ob': 90, 'bear_adx_thresh': 6.806813179310142, 'bear_atr_min_pct': 0.00456182233772953, 'bear_atr_max_pct': 0.04836245276231758, 'bear_tp_mult': 1.951958654970879, 'bear_tsl_mult': 0.44548759608050514, 'bear_time_stop': 293, 'bear_use_sma': False, 'bear_use_ema': True, 'bear_use_atr': True, 'bear_use_adx': True, 'bear_use_spike': False, 'bear_rsi_required': False, 'sideways_strategy': 'breakout', 'sideways_bb_std_mult': 1.183603187862258, 'sideways_rsi_os': 33, 'sideways_rsi_ob': 46, 'sideways_adx_thresh': 29.292612883840018, 'sideways_atr_min_pct': 0.015991076023164998, 'sideways_atr_max_pct': 0.010427401687013019, 'sideways_tp_mult': 2.8088429961111454, 'sideways_tsl_mult': 0.7287868020766864, 'sideways_time_stop': 160, 'sideways_use_sma': False, 'sideways_use_ema': True, 'sideways_use_atr': True, 'sideways_use_adx': False, 'sideways_use_spike': False, 'sideways_rsi_required': False}.
[I 2025-09-01 13:54:46,434] Trial 184 finished with values: [-1000000000.0, 1000000000.0] and parameters: {'p_sma': 32, 'p_std': 32, 'p_atr': 7, 'p_adx': 27, 'rsi_period': 25, 'ema1': 8, 'ema2': 27, 'slip_atr_k': 0.012915957899275717, 'slip_spread_k': 0.5689460915035447, 'spread_hl_frac': 6.288398341527945e-05, 'bb_std_mult': 2.53207721143796, 'rsi_os': 31, 'rsi_ob': 83, 'vol_spike': 0.0751564382746099, 'adx_thresh': 21.61229550047481, 'atr_min_pct': 0.017694778542571416, 'atr_max_pct': 0.023567847061788764, 'tp_mult': 2.10493179159272, 'tsl_mult': 0.15263232062553558, 'strategy': 'breakout', 'time_stop': 212, 'use_sma': True, 'use_atr': True, 'use_adx': False, 'use_ema': False, 'use_spike': True, 'rsi_required': False, 'edge_k': 1.1927128275816476, 'edge_cap': 0.31197528834913973, 'bull_strategy': 'breakout', 'bull_bb_std_mult': 3.52757422274785, 'bull_rsi_os': 49, 'bull_rsi_ob': 52, 'bull_adx_thresh': 9.61788217064503, 'bull_atr_min_pct': 0.024906220792772764, 'bull_atr_max_pct': 0.11282211512100665, 'bull_tp_mult': 1.802017192767351, 'bull_tsl_mult': 0.6349185613606021, 'bull_time_stop': 199, 'bull_use_sma': True, 'bull_use_ema': True, 'bull_use_atr': False, 'bull_use_adx': True, 'bull_use_spike': False, 'bull_rsi_required': True, 'bear_strategy': 'breakout', 'bear_bb_std_mult': 3.336416951634164, 'bear_rsi_os': 12, 'bear_rsi_ob': 54, 'bear_adx_thresh': 6.559973995067527, 'bear_atr_min_pct': 0.005770683611628892, 'bear_atr_max_pct': 0.06680740563257376, 'bear_tp_mult': 1.9440579798107231, 'bear_tsl_mult': 0.14807820339535058, 'bear_time_stop': 96, 'bear_use_sma': False, 'bear_use_ema': True, 'bear_use_atr': True, 'bear_use_adx': True, 'bear_use_spike': False, 'bear_rsi_required': False, 'sideways_strategy': 'breakout', 'sideways_bb_std_mult': 0.8427557443070267, 'sideways_rsi_os': 36, 'sideways_rsi_ob': 83, 'sideways_adx_thresh': 29.353595607454178, 'sideways_atr_min_pct': 0.01515327305418543, 'sideways_atr_max_pct': 0.11690097420801376, 'sideways_tp_mult': 2.0351154818903394, 'sideways_tsl_mult': 0.726705928756929, 'sideways_time_stop': 191, 'sideways_use_sma': False, 'sideways_use_ema': True, 'sideways_use_atr': True, 'sideways_use_adx': False, 'sideways_use_spike': False, 'sideways_rsi_required': False}.
[I 2025-09-01 13:54:46,483] Trial 182 finished with values: [-0.03741871936459962, 0.03777582166640009] and parameters: {'p_sma': 19, 'p_std': 28, 'p_atr': 8, 'p_adx': 27, 'rsi_period': 25, 'ema1': 19, 'ema2': 27, 'slip_atr_k': 0.05096304725616449, 'slip_spread_k': 0.14842501657380885, 'spread_hl_frac': 0.009068233917115679, 'bb_std_mult': 2.541674192705859, 'rsi_os': 16, 'rsi_ob': 67, 'vol_spike': 0.18571149179838103, 'adx_thresh': 21.284787145777425, 'atr_min_pct': 0.02730877211751284, 'atr_max_pct': 0.029516484947900753, 'tp_mult': 2.0333370162528293, 'tsl_mult': 0.14994196183592673, 'strategy': 'breakout', 'time_stop': 67, 'use_sma': True, 'use_atr': True, 'use_adx': False, 'use_ema': False, 'use_spike': True, 'rsi_required': False, 'edge_k': 1.1837629119838313, 'edge_cap': 0.32061264565404946, 'bull_strategy': 'breakout', 'bull_bb_std_mult': 1.3334373802514696, 'bull_rsi_os': 49, 'bull_rsi_ob': 50, 'bull_adx_thresh': 9.20692234638163, 'bull_atr_min_pct': 0.0005822581856553596, 'bull_atr_max_pct': 0.08590625200436626, 'bull_tp_mult': 1.5021814778907012, 'bull_tsl_mult': 0.6396397311225313, 'bull_time_stop': 86, 'bull_use_sma': False, 'bull_use_ema': True, 'bull_use_atr': False, 'bull_use_adx': True, 'bull_use_spike': False, 'bull_rsi_required': True, 'bear_strategy': 'breakout', 'bear_bb_std_mult': 0.8924523297011107, 'bear_rsi_os': 27, 'bear_rsi_ob': 54, 'bear_adx_thresh': 6.579076013976819, 'bear_atr_min_pct': 0.004533521259197036, 'bear_atr_max_pct': 0.06863808499270684, 'bear_tp_mult': 1.177012020327519, 'bear_tsl_mult': 0.1545285930202116, 'bear_time_stop': 46, 'bear_use_sma': False, 'bear_use_ema': True, 'bear_use_atr': True, 'bear_use_adx': True, 'bear_use_spike': False, 'bear_rsi_required': False, 'sideways_strategy': 'breakout', 'sideways_bb_std_mult': 0.9778190377076239, 'sideways_rsi_os': 33, 'sideways_rsi_ob': 83, 'sideways_adx_thresh': 29.25324444166097, 'sideways_atr_min_pct': 0.015522494638145947, 'sideways_atr_max_pct': 0.11112764783629982, 'sideways_tp_mult': 2.8091404371570525, 'sideways_tsl_mult': 0.725914129199965, 'sideways_time_stop': 43, 'sideways_use_sma': False, 'sideways_use_ema': True, 'sideways_use_atr': True, 'sideways_use_adx': False, 'sideways_use_spike': False, 'sideways_rsi_required': False}.
[I 2025-09-01 13:54:46,857] Trial 185 finished with values: [-1000000000.0, 1000000000.0] and parameters: {'p_sma': 42, 'p_std': 26, 'p_atr': 16, 'p_adx': 27, 'rsi_period': 26, 'ema1': 19, 'ema2': 26, 'slip_atr_k': 0.07942494572795851, 'slip_spread_k': 0.4833766540978164, 'spread_hl_frac': 0.02025907091597689, 'bb_std_mult': 1.9194089821977296, 'rsi_os': 43, 'rsi_ob': 54, 'vol_spike': 0.14516307514623647, 'adx_thresh': 21.654544283513516, 'atr_min_pct': 0.016236151825370852, 'atr_max_pct': 0.02193535001423895, 'tp_mult': 1.973636256173238, 'tsl_mult': 0.6364582781657555, 'strategy': 'breakout', 'time_stop': 215, 'use_sma': True, 'use_atr': True, 'use_adx': False, 'use_ema': False, 'use_spike': True, 'rsi_required': False, 'edge_k': 1.1773730476027657, 'edge_cap': 0.2553128148089366, 'bull_strategy': 'breakout', 'bull_bb_std_mult': 1.3534189409053785, 'bull_rsi_os': 32, 'bull_rsi_ob': 68, 'bull_adx_thresh': 9.441730137610895, 'bull_atr_min_pct': 0.022503872925897006, 'bull_atr_max_pct': 0.06766574600627978, 'bull_tp_mult': 1.4675588697515451, 'bull_tsl_mult': 0.5599370739566699, 'bull_time_stop': 275, 'bull_use_sma': True, 'bull_use_ema': True, 'bull_use_atr': False, 'bull_use_adx': True, 'bull_use_spike': False, 'bull_rsi_required': True, 'bear_strategy': 'breakout', 'bear_bb_std_mult': 2.649645365127339, 'bear_rsi_os': 12, 'bear_rsi_ob': 91, 'bear_adx_thresh': 5.925066467824049, 'bear_atr_min_pct': 0.004413605084887598, 'bear_atr_max_pct': 0.0494050021786904, 'bear_tp_mult': 1.2037785525242222, 'bear_tsl_mult': 0.15039112132923957, 'bear_time_stop': 151, 'bear_use_sma': False, 'bear_use_ema': True, 'bear_use_atr': False, 'bear_use_adx': True, 'bear_use_spike': False, 'bear_rsi_required': True, 'sideways_strategy': 'breakout', 'sideways_bb_std_mult': 0.8365484312755926, 'sideways_rsi_os': 38, 'sideways_rsi_ob': 83, 'sideways_adx_thresh': 29.322248233748418, 'sideways_atr_min_pct': 0.015289012489228176, 'sideways_atr_max_pct': 0.11161277195496104, 'sideways_tp_mult': 2.9521120677997716, 'sideways_tsl_mult': 0.8340070603521033, 'sideways_time_stop': 160, 'sideways_use_sma': False, 'sideways_use_ema': True, 'sideways_use_atr': True, 'sideways_use_adx': False, 'sideways_use_spike': False, 'sideways_rsi_required': False}.
[I 2025-09-01 13:55:25,278] Trial 186 finished with values: [-1000000000.0, 1000000000.0] and parameters: {'p_sma': 36, 'p_std': 26, 'p_atr': 16, 'p_adx': 13, 'rsi_period': 55, 'ema1': 19, 'ema2': 29, 'slip_atr_k': 0.09331280046132392, 'slip_spread_k': 0.15179473190844256, 'spread_hl_frac': 0.04266212421376762, 'bb_std_mult': 1.9145985324930528, 'rsi_os': 47, 'rsi_ob': 81, 'vol_spike': 0.24544926372632458, 'adx_thresh': 23.281829585631286, 'atr_min_pct': 0.00576853157467464, 'atr_max_pct': 0.029410445070080202, 'tp_mult': 1.0838285209132952, 'tsl_mult': 0.8225935093556199, 'strategy': 'breakout', 'time_stop': 89, 'use_sma': True, 'use_atr': True, 'use_adx': True, 'use_ema': False, 'use_spike': True, 'rsi_required': False, 'edge_k': 0.774503434249555, 'edge_cap': 0.23436206152453645, 'bull_strategy': 'mean_reversion', 'bull_bb_std_mult': 1.3409343169257244, 'bull_rsi_os': 32, 'bull_rsi_ob': 68, 'bull_adx_thresh': 10.831158814726487, 'bull_atr_min_pct': 0.005349894620512599, 'bull_atr_max_pct': 0.05666088854697185, 'bull_tp_mult': 1.4518629549331568, 'bull_tsl_mult': 0.5725630334443654, 'bull_time_stop': 225, 'bull_use_sma': True, 'bull_use_ema': False, 'bull_use_atr': False, 'bull_use_adx': True, 'bull_use_spike': False, 'bull_rsi_required': False, 'bear_strategy': 'breakout', 'bear_bb_std_mult': 2.658848732875585, 'bear_rsi_os': 13, 'bear_rsi_ob': 54, 'bear_adx_thresh': 5.916011320941169, 'bear_atr_min_pct': 0.00541650221347259, 'bear_atr_max_pct': 0.01434390757607705, 'bear_tp_mult': 2.0240179533021054, 'bear_tsl_mult': 0.17136331421401307, 'bear_time_stop': 56, 'bear_use_sma': False, 'bear_use_ema': True, 'bear_use_atr': False, 'bear_use_adx': False, 'bear_use_spike': False, 'bear_rsi_required': True, 'sideways_strategy': 'breakout', 'sideways_bb_std_mult': 0.9926308432937363, 'sideways_rsi_os': 22, 'sideways_rsi_ob': 58, 'sideways_adx_thresh': 28.371698322834785, 'sideways_atr_min_pct': 0.014282694797987765, 'sideways_atr_max_pct': 0.05017600549604491, 'sideways_tp_mult': 2.9485163154237544, 'sideways_tsl_mult': 0.5220078158858036, 'sideways_time_stop': 5, 'sideways_use_sma': True, 'sideways_use_ema': False, 'sideways_use_atr': False, 'sideways_use_adx': False, 'sideways_use_spike': False, 'sideways_rsi_required': True}.
[I 2025-09-01 13:55:26,279] Trial 189 finished with values: [-1000000000.0, 1000000000.0] and parameters: {'p_sma': 12, 'p_std': 12, 'p_atr': 7, 'p_adx': 28, 'rsi_period': 76, 'ema1': 30, 'ema2': 29, 'slip_atr_k': 0.09376478719107573, 'slip_spread_k': 0.9585692518379221, 'spread_hl_frac': 0.006524460253909322, 'bb_std_mult': 0.7430843672551544, 'rsi_os': 12, 'rsi_ob': 81, 'vol_spike': 0.11701951508808343, 'adx_thresh': 17.83619762249339, 'atr_min_pct': 0.005931806046626411, 'atr_max_pct': 0.048974537384812056, 'tp_mult': 1.0695312880880339, 'tsl_mult': 0.56170945728495, 'strategy': 'mean_reversion', 'time_stop': 242, 'use_sma': True, 'use_atr': False, 'use_adx': True, 'use_ema': True, 'use_spike': False, 'rsi_required': False, 'edge_k': 1.1132974428868616, 'edge_cap': 0.1703719865979722, 'bull_strategy': 'mean_reversion', 'bull_bb_std_mult': 1.1615222182097031, 'bull_rsi_os': 29, 'bull_rsi_ob': 54, 'bull_adx_thresh': 10.829435728046017, 'bull_atr_min_pct': 0.005226899771852168, 'bull_atr_max_pct': 0.10355279225298344, 'bull_tp_mult': 1.4179902650033693, 'bull_tsl_mult': 0.7913840491285952, 'bull_time_stop': 226, 'bull_use_sma': False, 'bull_use_ema': False, 'bull_use_atr': True, 'bull_use_adx': False, 'bull_use_spike': True, 'bull_rsi_required': False, 'bear_strategy': 'mean_reversion', 'bear_bb_std_mult': 3.4930759156797495, 'bear_rsi_os': 42, 'bear_rsi_ob': 88, 'bear_adx_thresh': 33.09312141658964, 'bear_atr_min_pct': 0.003544742457826525, 'bear_atr_max_pct': 0.06932318952140706, 'bear_tp_mult': 2.015453322551575, 'bear_tsl_mult': 0.1727949552835309, 'bear_time_stop': 55, 'bear_use_sma': True, 'bear_use_ema': True, 'bear_use_atr': False, 'bear_use_adx': False, 'bear_use_spike': True, 'bear_rsi_required': True, 'sideways_strategy': 'breakout', 'sideways_bb_std_mult': 0.7152957873732373, 'sideways_rsi_os': 53, 'sideways_rsi_ob': 86, 'sideways_adx_thresh': 21.621502515394553, 'sideways_atr_min_pct': 0.013986111831986022, 'sideways_atr_max_pct': 0.049076693986427264, 'sideways_tp_mult': 2.707586139251918, 'sideways_tsl_mult': 0.47838850720429216, 'sideways_time_stop': 236, 'sideways_use_sma': True, 'sideways_use_ema': False, 'sideways_use_atr': False, 'sideways_use_adx': True, 'sideways_use_spike': False, 'sideways_rsi_required': True}.
[I 2025-09-01 13:55:26,666] Trial 187 finished with values: [-1000000000.0, 1000000000.0] and parameters: {'p_sma': 10, 'p_std': 26, 'p_atr': 16, 'p_adx': 28, 'rsi_period': 76, 'ema1': 8, 'ema2': 37, 'slip_atr_k': 0.07890622101419814, 'slip_spread_k': 0.47633633121950697, 'spread_hl_frac': 0.04294271853431584, 'bb_std_mult': 1.907771248026662, 'rsi_os': 43, 'rsi_ob': 54, 'vol_spike': 0.14582996284175723, 'adx_thresh': 22.96287878968198, 'atr_min_pct': 0.016312283480213283, 'atr_max_pct': 0.0290176317183213, 'tp_mult': 1.074186896739789, 'tsl_mult': 0.06248321703299783, 'strategy': 'breakout', 'time_stop': 274, 'use_sma': True, 'use_atr': True, 'use_adx': True, 'use_ema': False, 'use_spike': True, 'rsi_required': False, 'edge_k': 0.5615544237294119, 'edge_cap': 0.25808581671034125, 'bull_strategy': 'mean_reversion', 'bull_bb_std_mult': 1.3797389662296504, 'bull_rsi_os': 19, 'bull_rsi_ob': 68, 'bull_adx_thresh': 10.902561026470913, 'bull_atr_min_pct': 0.014947424627964542, 'bull_atr_max_pct': 0.05508013994233267, 'bull_tp_mult': 1.4293172419541935, 'bull_tsl_mult': 0.3994425775920726, 'bull_time_stop': 86, 'bull_use_sma': True, 'bull_use_ema': False, 'bull_use_atr': False, 'bull_use_adx': True, 'bull_use_spike': False, 'bull_rsi_required': False, 'bear_strategy': 'breakout', 'bear_bb_std_mult': 1.573451172128674, 'bear_rsi_os': 13, 'bear_rsi_ob': 45, 'bear_adx_thresh': 32.83863577341957, 'bear_atr_min_pct': 0.005313131870175019, 'bear_atr_max_pct': 0.068992929148799, 'bear_tp_mult': 2.350090832442432, 'bear_tsl_mult': 0.15609697401507872, 'bear_time_stop': 268, 'bear_use_sma': False, 'bear_use_ema': True, 'bear_use_atr': False, 'bear_use_adx': False, 'bear_use_spike': False, 'bear_rsi_required': True, 'sideways_strategy': 'breakout', 'sideways_bb_std_mult': 0.9520236640444102, 'sideways_rsi_os': 38, 'sideways_rsi_ob': 86, 'sideways_adx_thresh': 28.754799943514357, 'sideways_atr_min_pct': 0.016259335630033983, 'sideways_atr_max_pct': 0.11201822330620483, 'sideways_tp_mult': 2.7084768309656364, 'sideways_tsl_mult': 0.8284270916929477, 'sideways_time_stop': 6, 'sideways_use_sma': True, 'sideways_use_ema': False, 'sideways_use_atr': False, 'sideways_use_adx': False, 'sideways_use_spike': False, 'sideways_rsi_required': True}.
