[I 2025-09-01 14:46:00,344] Trial 538 finished with values: [-1000000000.0, 1000000000.0] and parameters: {'p_sma': 28, 'p_std': 26, 'p_atr': 20, 'p_adx': 8, 'rsi_period': 54, 'ema1': 9, 'ema2': 57, 'slip_atr_k': 0.03633068045070026, 'slip_spread_k': 0.04085515936363521, 'spread_hl_frac': 0.00891235455079132, 'bb_std_mult': 3.4800933435266423, 'rsi_os': 42, 'rsi_ob': 61, 'vol_spike': 0.11826602756101284, 'adx_thresh': 5.547356733183604, 'atr_min_pct': 0.012079696200155627, 'atr_max_pct': 0.03228883850172675, 'tp_mult': 2.5316698621555487, 'tsl_mult': 0.6209225014837283, 'strategy': 'breakout', 'time_stop': 120, 'use_sma': True, 'use_atr': False, 'use_adx': False, 'use_ema': True, 'use_spike': True, 'rsi_required': True, 'edge_k': 0.21527562913492598, 'edge_cap': 0.4317779823113176, 'bull_strategy': 'breakout', 'bull_bb_std_mult': 3.2962432067788856, 'bull_rsi_os': 16, 'bull_rsi_ob': 78, 'bull_adx_thresh': 13.960486700953437, 'bull_atr_min_pct': 0.013636080662111319, 'bull_atr_max_pct': 0.1292153463847321, 'bull_tp_mult': 2.355038563220933, 'bull_tsl_mult': 0.2339000961523493, 'bull_time_stop': 233, 'bull_use_sma': False, 'bull_use_ema': True, 'bull_use_atr': True, 'bull_use_adx': True, 'bull_use_spike': True, 'bull_rsi_required': True, 'bear_strategy': 'breakout', 'bear_bb_std_mult': 2.338306301869292, 'bear_rsi_os': 37, 'bear_rsi_ob': 62, 'bear_adx_thresh': 7.06743510355488, 'bear_atr_min_pct': 0.0037013147879738674, 'bear_atr_max_pct': 0.1109797414173091, 'bear_tp_mult': 1.4134258241252322, 'bear_tsl_mult': 0.028232231966685062, 'bear_time_stop': 85, 'bear_use_sma': False, 'bear_use_ema': False, 'bear_use_atr': True, 'bear_use_adx': False, 'bear_use_spike': True, 'bear_rsi_required': False, 'sideways_strategy': 'mean_reversion', 'sideways_bb_std_mult': 3.0679347853305736, 'sideways_rsi_os': 31, 'sideways_rsi_ob': 91, 'sideways_adx_thresh': 23.956636475945178, 'sideways_atr_min_pct': 0.003974073977302394, 'sideways_atr_max_pct': 0.11460648274798951, 'sideways_tp_mult': 1.5922343083913504, 'sideways_tsl_mult': 0.9361432402932139, 'sideways_time_stop': 253, 'sideways_use_sma': True, 'sideways_use_ema': True, 'sideways_use_atr': True, 'sideways_use_adx': False, 'sideways_use_spike': False, 'sideways_rsi_required': False}.
[I 2025-09-01 14:46:00,463] Trial 539 finished with values: [-1000000000.0, 1000000000.0] and parameters: {'p_sma': 28, 'p_std': 39, 'p_atr': 27, 'p_adx': 29, 'rsi_period': 54, 'ema1': 22, 'ema2': 57, 'slip_atr_k': 0.017494051052869847, 'slip_spread_k': 0.20434598382300145, 'spread_hl_frac': 0.008610967715281118, 'bb_std_mult': 3.4723756046821803, 'rsi_os': 42, 'rsi_ob': 60, 'vol_spike': 0.12211997206626764, 'adx_thresh': 5.432866258185363, 'atr_min_pct': 0.012249899425616237, 'atr_max_pct': 0.14671401419244995, 'tp_mult': 1.4554169383434516, 'tsl_mult': 0.6882122611146547, 'strategy': 'breakout', 'time_stop': 117, 'use_sma': True, 'use_atr': False, 'use_adx': False, 'use_ema': True, 'use_spike': True, 'rsi_required': True, 'edge_k': 0.22279288160742217, 'edge_cap': 0.9134450189991274, 'bull_strategy': 'breakout', 'bull_bb_std_mult': 3.295071068793403, 'bull_rsi_os': 16, 'bull_rsi_ob': 78, 'bull_adx_thresh': 11.511908369301299, 'bull_atr_min_pct': 0.009809523977487196, 'bull_atr_max_pct': 0.041657391545420336, 'bull_tp_mult': 2.8938351834264533, 'bull_tsl_mult': 0.466797361546221, 'bull_time_stop': 234, 'bull_use_sma': False, 'bull_use_ema': True, 'bull_use_atr': True, 'bull_use_adx': True, 'bull_use_spike': True, 'bull_rsi_required': True, 'bear_strategy': 'breakout', 'bear_bb_std_mult': 2.337847007661672, 'bear_rsi_os': 37, 'bear_rsi_ob': 67, 'bear_adx_thresh': 6.746578549413456, 'bear_atr_min_pct': 0.0035834913967791367, 'bear_atr_max_pct': 0.1104854157014236, 'bear_tp_mult': 1.7166237919438032, 'bear_tsl_mult': 0.27678321113284343, 'bear_time_stop': 20, 'bear_use_sma': False, 'bear_use_ema': False, 'bear_use_atr': True, 'bear_use_adx': False, 'bear_use_spike': True, 'bear_rsi_required': False, 'sideways_strategy': 'mean_reversion', 'sideways_bb_std_mult': 3.0838710750401424, 'sideways_rsi_os': 22, 'sideways_rsi_ob': 68, 'sideways_adx_thresh': 17.812648642993757, 'sideways_atr_min_pct': 0.003639409597692392, 'sideways_atr_max_pct': 0.11366065688320828, 'sideways_tp_mult': 2.424326546110598, 'sideways_tsl_mult': 0.17576754173656423, 'sideways_time_stop': 293, 'sideways_use_sma': True, 'sideways_use_ema': True, 'sideways_use_atr': True, 'sideways_use_adx': False, 'sideways_use_spike': False, 'sideways_rsi_required': False}.
[I 2025-09-01 14:46:37,322] Trial 544 finished with values: [-1000000000.0, 1000000000.0] and parameters: {'p_sma': 31, 'p_std': 48, 'p_atr': 16, 'p_adx': 7, 'rsi_period': 10, 'ema1': 12, 'ema2': 55, 'slip_atr_k': 0.01673715068959338, 'slip_spread_k': 0.20305194781816438, 'spread_hl_frac': 0.00045127541474498586, 'bb_std_mult': 3.0502313559366305, 'rsi_os': 38, 'rsi_ob': 53, 'vol_spike': 0.125623665959716, 'adx_thresh': 16.673485814091745, 'atr_min_pct': 0.010811697755159907, 'atr_max_pct': 0.03752652773640637, 'tp_mult': 1.3257502030767583, 'tsl_mult': 0.4165077316113557, 'strategy': 'mean_reversion', 'time_stop': 289, 'use_sma': True, 'use_atr': False, 'use_adx': True, 'use_ema': True, 'use_spike': True, 'rsi_required': True, 'edge_k': 1.0592187090286915, 'edge_cap': 0.6959795268026161, 'bull_strategy': 'mean_reversion', 'bull_bb_std_mult': 3.3721605642523036, 'bull_rsi_os': 22, 'bull_rsi_ob': 66, 'bull_adx_thresh': 12.952217772520026, 'bull_atr_min_pct': 0.010282894837777804, 'bull_atr_max_pct': 0.12461788599939874, 'bull_tp_mult': 1.58365060609923, 'bull_tsl_mult': 0.46475818223369725, 'bull_time_stop': 167, 'bull_use_sma': False, 'bull_use_ema': True, 'bull_use_atr': True, 'bull_use_adx': True, 'bull_use_spike': True, 'bull_rsi_required': True, 'bear_strategy': 'mean_reversion', 'bear_bb_std_mult': 2.469330402341355, 'bear_rsi_os': 39, 'bear_rsi_ob': 58, 'bear_adx_thresh': 19.377303929728665, 'bear_atr_min_pct': 0.026360998083972645, 'bear_atr_max_pct': 0.026834182743512874, 'bear_tp_mult': 2.0342290936953953, 'bear_tsl_mult': 0.08710871921944147, 'bear_time_stop': 171, 'bear_use_sma': False, 'bear_use_ema': False, 'bear_use_atr': False, 'bear_use_adx': False, 'bear_use_spike': True, 'bear_rsi_required': True, 'sideways_strategy': 'mean_reversion', 'sideways_bb_std_mult': 1.362041928545271, 'sideways_rsi_os': 34, 'sideways_rsi_ob': 90, 'sideways_adx_thresh': 27.28193784806421, 'sideways_atr_min_pct': 0.005609491133098575, 'sideways_atr_max_pct': 0.05176202950590324, 'sideways_tp_mult': 2.3268844572546445, 'sideways_tsl_mult': 0.17850687953215832, 'sideways_time_stop': 264, 'sideways_use_sma': True, 'sideways_use_ema': True, 'sideways_use_atr': True, 'sideways_use_adx': True, 'sideways_use_spike': False, 'sideways_rsi_required': False}.
[I 2025-09-01 14:46:37,892] Trial 543 finished with values: [-1000000000.0, 1000000000.0] and parameters: {'p_sma': 30, 'p_std': 7, 'p_atr': 24, 'p_adx': 7, 'rsi_period': 84, 'ema1': 9, 'ema2': 57, 'slip_atr_k': 0.017468413491155257, 'slip_spread_k': 0.5526172916026966, 'spread_hl_frac': 0.008746134243776958, 'bb_std_mult': 3.5469727204562114, 'rsi_os': 27, 'rsi_ob': 53, 'vol_spike': 0.05325895467254691, 'adx_thresh': 6.346323830911416, 'atr_min_pct': 0.011809451164863623, 'atr_max_pct': 0.03647336460065603, 'tp_mult': 1.3213481755044805, 'tsl_mult': 0.4184973215757586, 'strategy': 'mean_reversion', 'time_stop': 278, 'use_sma': True, 'use_atr': False, 'use_adx': True, 'use_ema': True, 'use_spike': True, 'rsi_required': True, 'edge_k': 1.0708203485262262, 'edge_cap': 0.1035482803706283, 'bull_strategy': 'mean_reversion', 'bull_bb_std_mult': 3.255001472805683, 'bull_rsi_os': 16, 'bull_rsi_ob': 81, 'bull_adx_thresh': 13.272157768111509, 'bull_atr_min_pct': 0.027924900732370833, 'bull_atr_max_pct': 0.12996361916792873, 'bull_tp_mult': 1.2313769809724535, 'bull_tsl_mult': 0.468810064647199, 'bull_time_stop': 170, 'bull_use_sma': False, 'bull_use_ema': True, 'bull_use_atr': True, 'bull_use_adx': True, 'bull_use_spike': True, 'bull_rsi_required': True, 'bear_strategy': 'mean_reversion', 'bear_bb_std_mult': 2.4593427711660976, 'bear_rsi_os': 39, 'bear_rsi_ob': 57, 'bear_adx_thresh': 19.212988724025877, 'bear_atr_min_pct': 0.02603459442979375, 'bear_atr_max_pct': 0.027859219254159892, 'bear_tp_mult': 1.5025234800456526, 'bear_tsl_mult': 0.9057809138322613, 'bear_time_stop': 103, 'bear_use_sma': False, 'bear_use_ema': False, 'bear_use_atr': False, 'bear_use_adx': False, 'bear_use_spike': True, 'bear_rsi_required': False, 'sideways_strategy': 'mean_reversion', 'sideways_bb_std_mult': 3.0654866615724767, 'sideways_rsi_os': 8, 'sideways_rsi_ob': 90, 'sideways_adx_thresh': 26.60359761217958, 'sideways_atr_min_pct': 0.005723376216893575, 'sideways_atr_max_pct': 0.10853096351089236, 'sideways_tp_mult': 2.437829082154405, 'sideways_tsl_mult': 0.926770939410592, 'sideways_time_stop': 300, 'sideways_use_sma': True, 'sideways_use_ema': True, 'sideways_use_atr': True, 'sideways_use_adx': True, 'sideways_use_spike': False, 'sideways_rsi_required': False}.
[I 2025-09-01 14:46:38,218] Trial 545 finished with values: [-1000000000.0, 1000000000.0] and parameters: {'p_sma': 31, 'p_std': 28, 'p_atr': 12, 'p_adx': 7, 'rsi_period': 84, 'ema1': 29, 'ema2': 55, 'slip_atr_k': 0.020975579455432092, 'slip_spread_k': 0.5481265584656014, 'spread_hl_frac': 0.011053765570552385, 'bb_std_mult': 3.543933309777314, 'rsi_os': 40, 'rsi_ob': 53, 'vol_spike': 0.1108743255525515, 'adx_thresh': 16.480526721903143, 'atr_min_pct': 0.011034182720695758, 'atr_max_pct': 0.036706173702400986, 'tp_mult': 1.3275696964841732, 'tsl_mult': 0.9681900429607457, 'strategy': 'mean_reversion', 'time_stop': 188, 'use_sma': True, 'use_atr': False, 'use_adx': True, 'use_ema': True, 'use_spike': True, 'rsi_required': True, 'edge_k': 0.597444365958149, 'edge_cap': 0.6989542469316866, 'bull_strategy': 'mean_reversion', 'bull_bb_std_mult': 3.1387298595517925, 'bull_rsi_os': 44, 'bull_rsi_ob': 81, 'bull_adx_thresh': 13.17018929273317, 'bull_atr_min_pct': 0.011904747871414614, 'bull_atr_max_pct': 0.1240530938086758, 'bull_tp_mult': 1.1550951012858728, 'bull_tsl_mult': 0.8017583986955097, 'bull_time_stop': 165, 'bull_use_sma': False, 'bull_use_ema': True, 'bull_use_atr': True, 'bull_use_adx': True, 'bull_use_spike': True, 'bull_rsi_required': True, 'bear_strategy': 'mean_reversion', 'bear_bb_std_mult': 2.453622240060739, 'bear_rsi_os': 35, 'bear_rsi_ob': 58, 'bear_adx_thresh': 8.060788136095805, 'bear_atr_min_pct': 0.026292137781629726, 'bear_atr_max_pct': 0.1383099849737724, 'bear_tp_mult': 1.660090645071905, 'bear_tsl_mult': 0.08899827947797684, 'bear_time_stop': 72, 'bear_use_sma': False, 'bear_use_ema': True, 'bear_use_atr': False, 'bear_use_adx': False, 'bear_use_spike': True, 'bear_rsi_required': True, 'sideways_strategy': 'mean_reversion', 'sideways_bb_std_mult': 2.913081504861408, 'sideways_rsi_os': 20, 'sideways_rsi_ob': 90, 'sideways_adx_thresh': 24.839480128634538, 'sideways_atr_min_pct': 0.005439261759883788, 'sideways_atr_max_pct': 0.05318394953180375, 'sideways_tp_mult': 2.3139937926715684, 'sideways_tsl_mult': 0.5270684015403589, 'sideways_time_stop': 262, 'sideways_use_sma': False, 'sideways_use_ema': True, 'sideways_use_atr': True, 'sideways_use_adx': True, 'sideways_use_spike': False, 'sideways_rsi_required': False}.
[I 2025-09-01 14:46:38,430] Trial 542 finished with values: [-1000000000.0, 1000000000.0] and parameters: {'p_sma': 31, 'p_std': 26, 'p_atr': 27, 'p_adx': 7, 'rsi_period': 84, 'ema1': 9, 'ema2': 57, 'slip_atr_k': 0.018250775575610313, 'slip_spread_k': 0.03549361144445867, 'spread_hl_frac': 0.008736245219088817, 'bb_std_mult': 3.0758684596893424, 'rsi_os': 49, 'rsi_ob': 50, 'vol_spike': 0.13274317013788703, 'adx_thresh': 16.439822926012145, 'atr_min_pct': 0.011004462982892892, 'atr_max_pct': 0.03641202029036432, 'tp_mult': 1.4735148726599956, 'tsl_mult': 0.650764817285657, 'strategy': 'breakout', 'time_stop': 277, 'use_sma': True, 'use_atr': False, 'use_adx': False, 'use_ema': True, 'use_spike': True, 'rsi_required': True, 'edge_k': 1.0552098484939518, 'edge_cap': 0.7116733425065804, 'bull_strategy': 'breakout', 'bull_bb_std_mult': 3.261178847454062, 'bull_rsi_os': 13, 'bull_rsi_ob': 81, 'bull_adx_thresh': 24.872026005633572, 'bull_atr_min_pct': 0.02982431306747984, 'bull_atr_max_pct': 0.1288051974496831, 'bull_tp_mult': 2.6783989245145023, 'bull_tsl_mult': 0.4638894395391877, 'bull_time_stop': 234, 'bull_use_sma': False, 'bull_use_ema': True, 'bull_use_atr': True, 'bull_use_adx': True, 'bull_use_spike': True, 'bull_rsi_required': True, 'bear_strategy': 'breakout', 'bear_bb_std_mult': 2.471540979239758, 'bear_rsi_os': 38, 'bear_rsi_ob': 62, 'bear_adx_thresh': 6.764398264974786, 'bear_atr_min_pct': 0.004609897505860773, 'bear_atr_max_pct': 0.036312630642576844, 'bear_tp_mult': 1.7037635533562183, 'bear_tsl_mult': 0.2782995755288616, 'bear_time_stop': 72, 'bear_use_sma': False, 'bear_use_ema': False, 'bear_use_atr': True, 'bear_use_adx': False, 'bear_use_spike': True, 'bear_rsi_required': False, 'sideways_strategy': 'mean_reversion', 'sideways_bb_std_mult': 3.0853863635702847, 'sideways_rsi_os': 8, 'sideways_rsi_ob': 92, 'sideways_adx_thresh': 24.29608814030809, 'sideways_atr_min_pct': 0.01958436007829163, 'sideways_atr_max_pct': 0.10802131329385757, 'sideways_tp_mult': 2.3301514987138416, 'sideways_tsl_mult': 0.5957803154858584, 'sideways_time_stop': 183, 'sideways_use_sma': True, 'sideways_use_ema': True, 'sideways_use_atr': True, 'sideways_use_adx': True, 'sideways_use_spike': False, 'sideways_rsi_required': False}.
[I 2025-09-01 14:47:13,718] Trial 547 finished with values: [-1000000000.0, 1000000000.0] and parameters: {'p_sma': 50, 'p_std': 19, 'p_atr': 14, 'p_adx': 8, 'rsi_period': 78, 'ema1': 29, 'ema2': 44, 'slip_atr_k': 0.08159887401118122, 'slip_spread_k': 0.5754590531355409, 'spread_hl_frac': 0.010641162403062242, 'bb_std_mult': 3.258031918858186, 'rsi_os': 40, 'rsi_ob': 55, 'vol_spike': 0.1312201762216302, 'adx_thresh': 6.075193135915267, 'atr_min_pct': 0.011191303032830387, 'atr_max_pct': 0.04400693416829551, 'tp_mult': 1.5076439984730878, 'tsl_mult': 0.651322317671359, 'strategy': 'mean_reversion', 'time_stop': 51, 'use_sma': False, 'use_atr': False, 'use_adx': True, 'use_ema': True, 'use_spike': True, 'rsi_required': True, 'edge_k': 0.6323701729118875, 'edge_cap': 0.39996341229327925, 'bull_strategy': 'breakout', 'bull_bb_std_mult': 1.5288159243588821, 'bull_rsi_os': 21, 'bull_rsi_ob': 89, 'bull_adx_thresh': 24.969972375559266, 'bull_atr_min_pct': 0.011803218688544262, 'bull_atr_max_pct': 0.1343137259971697, 'bull_tp_mult': 1.2936967199058425, 'bull_tsl_mult': 0.8306505522756326, 'bull_time_stop': 153, 'bull_use_sma': True, 'bull_use_ema': False, 'bull_use_atr': True, 'bull_use_adx': False, 'bull_use_spike': False, 'bull_rsi_required': True, 'bear_strategy': 'mean_reversion', 'bear_bb_std_mult': 2.608944683344264, 'bear_rsi_os': 24, 'bear_rsi_ob': 76, 'bear_adx_thresh': 28.771184389150836, 'bear_atr_min_pct': 0.0030502167622340004, 'bear_atr_max_pct': 0.10553423834921208, 'bear_tp_mult': 1.6585350803166756, 'bear_tsl_mult': 0.38154515743477446, 'bear_time_stop': 111, 'bear_use_sma': False, 'bear_use_ema': True, 'bear_use_atr': False, 'bear_use_adx': False, 'bear_use_spike': True, 'bear_rsi_required': False, 'sideways_strategy': 'mean_reversion', 'sideways_bb_std_mult': 2.8076847472049287, 'sideways_rsi_os': 12, 'sideways_rsi_ob': 88, 'sideways_adx_thresh': 15.478102155447488, 'sideways_atr_min_pct': 0.00480022937375327, 'sideways_atr_max_pct': 0.10949637116647347, 'sideways_tp_mult': 2.996652735742585, 'sideways_tsl_mult': 0.13128168239305804, 'sideways_time_stop': 276, 'sideways_use_sma': False, 'sideways_use_ema': False, 'sideways_use_atr': False, 'sideways_use_adx': True, 'sideways_use_spike': False, 'sideways_rsi_required': True}.
[I 2025-09-01 14:47:14,270] Trial 548 finished with values: [-0.007988786743088339, 0.011798996088184485] and parameters: {'p_sma': 56, 'p_std': 27, 'p_atr': 25, 'p_adx': 24, 'rsi_period': 78, 'ema1': 7, 'ema2': 58, 'slip_atr_k': 0.005320480411642579, 'slip_spread_k': 0.5820926246950713, 'spread_hl_frac': 0.03933477428960991, 'bb_std_mult': 3.411754527807724, 'rsi_os': 48, 'rsi_ob': 55, 'vol_spike': 0.2814729073211223, 'adx_thresh': 6.620699221083811, 'atr_min_pct': 0.009661842957378031, 'atr_max_pct': 0.03229033468889016, 'tp_mult': 1.0626820275827282, 'tsl_mult': 0.6487534788750445, 'strategy': 'mean_reversion', 'time_stop': 38, 'use_sma': False, 'use_atr': True, 'use_adx': True, 'use_ema': True, 'use_spike': True, 'rsi_required': True, 'edge_k': 0.2959835659399779, 'edge_cap': 0.9353878190482103, 'bull_strategy': 'breakout', 'bull_bb_std_mult': 2.526053119696745, 'bull_rsi_os': 21, 'bull_rsi_ob': 63, 'bull_adx_thresh': 12.272535429458207, 'bull_atr_min_pct': 0.01286002677026178, 'bull_atr_max_pct': 0.13325184746565047, 'bull_tp_mult': 2.589517843608577, 'bull_tsl_mult': 0.4920668334261925, 'bull_time_stop': 152, 'bull_use_sma': True, 'bull_use_ema': False, 'bull_use_atr': True, 'bull_use_adx': False, 'bull_use_spike': False, 'bull_rsi_required': True, 'bear_strategy': 'mean_reversion', 'bear_bb_std_mult': 2.6336114298997004, 'bear_rsi_os': 36, 'bear_rsi_ob': 76, 'bear_adx_thresh': 9.67722344270468, 'bear_atr_min_pct': 0.002165901914479603, 'bear_atr_max_pct': 0.0365660543092384, 'bear_tp_mult': 2.1217535722980787, 'bear_tsl_mult': 0.22156708307688583, 'bear_time_stop': 238, 'bear_use_sma': False, 'bear_use_ema': False, 'bear_use_atr': False, 'bear_use_adx': False, 'bear_use_spike': True, 'bear_rsi_required': False, 'sideways_strategy': 'mean_reversion', 'sideways_bb_std_mult': 2.809887720747809, 'sideways_rsi_os': 32, 'sideways_rsi_ob': 94, 'sideways_adx_thresh': 33.1800758762059, 'sideways_atr_min_pct': 0.009852717406935253, 'sideways_atr_max_pct': 0.09957649404243116, 'sideways_tp_mult': 2.48315003248054, 'sideways_tsl_mult': 0.3869556221580423, 'sideways_time_stop': 248, 'sideways_use_sma': True, 'sideways_use_ema': False, 'sideways_use_atr': False, 'sideways_use_adx': True, 'sideways_use_spike': True, 'sideways_rsi_required': True}.
[I 2025-09-01 14:47:14,384] Trial 549 finished with values: [-1000000000.0, 1000000000.0] and parameters: {'p_sma': 58, 'p_std': 33, 'p_atr': 25, 'p_adx': 23, 'rsi_period': 78, 'ema1': 7, 'ema2': 58, 'slip_atr_k': 0.004026009215687762, 'slip_spread_k': 0.43204151986855965, 'spread_hl_frac': 0.03776787565610524, 'bb_std_mult': 3.278369593879415, 'rsi_os': 8, 'rsi_ob': 70, 'vol_spike': 0.09936911853719874, 'adx_thresh': 29.357015127105267, 'atr_min_pct': 0.0088235074450911, 'atr_max_pct': 0.05372515936294947, 'tp_mult': 1.0500314786108271, 'tsl_mult': 0.7164520125216383, 'strategy': 'mean_reversion', 'time_stop': 36, 'use_sma': False, 'use_atr': True, 'use_adx': True, 'use_ema': True, 'use_spike': False, 'rsi_required': False, 'edge_k': 0.30454631447696917, 'edge_cap': 0.650101125227158, 'bull_strategy': 'breakout', 'bull_bb_std_mult': 2.2641785295010615, 'bull_rsi_os': 21, 'bull_rsi_ob': 75, 'bull_adx_thresh': 11.224788745037939, 'bull_atr_min_pct': 0.010709034890193656, 'bull_atr_max_pct': 0.13265998314424024, 'bull_tp_mult': 1.585755826912119, 'bull_tsl_mult': 0.49339503879006114, 'bull_time_stop': 126, 'bull_use_sma': True, 'bull_use_ema': False, 'bull_use_atr': False, 'bull_use_adx': False, 'bull_use_spike': False, 'bull_rsi_required': True, 'bear_strategy': 'mean_reversion', 'bear_bb_std_mult': 2.6260299889215335, 'bear_rsi_os': 36, 'bear_rsi_ob': 59, 'bear_adx_thresh': 10.726848549790864, 'bear_atr_min_pct': 0.0020567077250664757, 'bear_atr_max_pct': 0.10604030594694101, 'bear_tp_mult': 2.274237737821963, 'bear_tsl_mult': 0.22358421047509036, 'bear_time_stop': 111, 'bear_use_sma': True, 'bear_use_ema': True, 'bear_use_atr': False, 'bear_use_adx': True, 'bear_use_spike': True, 'bear_rsi_required': False, 'sideways_strategy': 'breakout', 'sideways_bb_std_mult': 2.780619473707237, 'sideways_rsi_os': 55, 'sideways_rsi_ob': 94, 'sideways_adx_thresh': 20.00287020594492, 'sideways_atr_min_pct': 0.004820907486683375, 'sideways_atr_max_pct': 0.0990196977030854, 'sideways_tp_mult': 2.998010766745301, 'sideways_tsl_mult': 0.48380004321062353, 'sideways_time_stop': 276, 'sideways_use_sma': False, 'sideways_use_ema': False, 'sideways_use_atr': False, 'sideways_use_adx': True, 'sideways_use_spike': True, 'sideways_rsi_required': True}.
