[I 2025-09-01 15:16:20,342] Trial 729 finished with values: [-1000000000.0, 1000000000.0] and parameters: {'p_sma': 35, 'p_std': 25, 'p_atr': 28, 'p_adx': 8, 'rsi_period': 76, 'ema1': 10, 'ema2': 59, 'slip_atr_k': 0.006550510267131026, 'slip_spread_k': 0.5508033305347232, 'spread_hl_frac': 0.007620779026663041, 'bb_std_mult': 3.2152094612486515, 'rsi_os': 21, 'rsi_ob': 55, 'vol_spike': 0.10074738814688997, 'adx_thresh': 6.814422035433778, 'atr_min_pct': 0.012543262526265173, 'atr_max_pct': 0.041132802346999155, 'tp_mult': 1.3258020418339624, 'tsl_mult': 0.7075979934316173, 'strategy': 'mean_reversion', 'time_stop': 146, 'use_sma': False, 'use_atr': False, 'use_adx': True, 'use_ema': True, 'use_spike': True, 'rsi_required': True, 'edge_k': 0.2297595031372354, 'edge_cap': 0.9869339345491809, 'bull_strategy': 'breakout', 'bull_bb_std_mult': 3.268694694871454, 'bull_rsi_os': 25, 'bull_rsi_ob': 80, 'bull_adx_thresh': 14.013592359680324, 'bull_atr_min_pct': 0.012864662089104334, 'bull_atr_max_pct': 0.12957863718234183, 'bull_tp_mult': 1.8186088302051329, 'bull_tsl_mult': 0.6325394836686985, 'bull_time_stop': 158, 'bull_use_sma': True, 'bull_use_ema': True, 'bull_use_atr': True, 'bull_use_adx': True, 'bull_use_spike': True, 'bull_rsi_required': True, 'bear_strategy': 'mean_reversion', 'bear_bb_std_mult': 2.1646925019831635, 'bear_rsi_os': 31, 'bear_rsi_ob': 83, 'bear_adx_thresh': 8.128785941076897, 'bear_atr_min_pct': 0.000590455278855308, 'bear_atr_max_pct': 0.019772222025242463, 'bear_tp_mult': 2.0690721893397965, 'bear_tsl_mult': 0.24023125290332537, 'bear_time_stop': 82, 'bear_use_sma': True, 'bear_use_ema': False, 'bear_use_atr': False, 'bear_use_adx': False, 'bear_use_spike': True, 'bear_rsi_required': False, 'sideways_strategy': 'mean_reversion', 'sideways_bb_std_mult': 2.9179613848928097, 'sideways_rsi_os': 50, 'sideways_rsi_ob': 89, 'sideways_adx_thresh': 22.50037344714729, 'sideways_atr_min_pct': 0.004369873531729876, 'sideways_atr_max_pct': 0.10889447918601299, 'sideways_tp_mult': 1.328722765028528, 'sideways_tsl_mult': 0.509154803443809, 'sideways_time_stop': 280, 'sideways_use_sma': True, 'sideways_use_ema': True, 'sideways_use_atr': True, 'sideways_use_adx': True, 'sideways_use_spike': True, 'sideways_rsi_required': False}.
[I 2025-09-01 15:16:20,970] Trial 731 finished with values: [-0.0027269292457944294, 0.008542026767107224] and parameters: {'p_sma': 29, 'p_std': 23, 'p_atr': 28, 'p_adx': 7, 'rsi_period': 75, 'ema1': 9, 'ema2': 57, 'slip_atr_k': 0.012683350797493172, 'slip_spread_k': 0.5483134377680844, 'spread_hl_frac': 0.011631763716602364, 'bb_std_mult': 3.217871380667006, 'rsi_os': 12, 'rsi_ob': 55, 'vol_spike': 0.06105450278179649, 'adx_thresh': 6.847969820741255, 'atr_min_pct': 0.01242744667081449, 'atr_max_pct': 0.03844833550960315, 'tp_mult': 2.500779851818796, 'tsl_mult': 0.7116689094734744, 'strategy': 'mean_reversion', 'time_stop': 98, 'use_sma': False, 'use_atr': False, 'use_adx': True, 'use_ema': True, 'use_spike': True, 'rsi_required': True, 'edge_k': 0.22995187570831477, 'edge_cap': 0.9993920619302301, 'bull_strategy': 'breakout', 'bull_bb_std_mult': 3.2746642123540797, 'bull_rsi_os': 25, 'bull_rsi_ob': 84, 'bull_adx_thresh': 8.655867536436968, 'bull_atr_min_pct': 0.01488353451459074, 'bull_atr_max_pct': 0.1363821760958356, 'bull_tp_mult': 1.7443572853489966, 'bull_tsl_mult': 0.848364133861796, 'bull_time_stop': 79, 'bull_use_sma': False, 'bull_use_ema': True, 'bull_use_atr': True, 'bull_use_adx': True, 'bull_use_spike': True, 'bull_rsi_required': True, 'bear_strategy': 'mean_reversion', 'bear_bb_std_mult': 1.9921583343490827, 'bear_rsi_os': 35, 'bear_rsi_ob': 83, 'bear_adx_thresh': 8.201399353107911, 'bear_atr_min_pct': 0.0011259354271135628, 'bear_atr_max_pct': 0.015506445478253222, 'bear_tp_mult': 2.0555846346208626, 'bear_tsl_mult': 0.25718635828913805, 'bear_time_stop': 81, 'bear_use_sma': True, 'bear_use_ema': False, 'bear_use_atr': False, 'bear_use_adx': False, 'bear_use_spike': True, 'bear_rsi_required': False, 'sideways_strategy': 'mean_reversion', 'sideways_bb_std_mult': 2.944763529721093, 'sideways_rsi_os': 28, 'sideways_rsi_ob': 93, 'sideways_adx_thresh': 23.90218781020077, 'sideways_atr_min_pct': 0.004389823188486203, 'sideways_atr_max_pct': 0.10884608815077547, 'sideways_tp_mult': 1.106466769209082, 'sideways_tsl_mult': 0.4964277273372638, 'sideways_time_stop': 287, 'sideways_use_sma': True, 'sideways_use_ema': True, 'sideways_use_atr': True, 'sideways_use_adx': True, 'sideways_use_spike': False, 'sideways_rsi_required': False}.
[I 2025-09-01 15:16:21,527] Trial 732 finished with values: [-1000000000.0, 1000000000.0] and parameters: {'p_sma': 35, 'p_std': 22, 'p_atr': 28, 'p_adx': 7, 'rsi_period': 78, 'ema1': 9, 'ema2': 57, 'slip_atr_k': 0.01442932427769936, 'slip_spread_k': 0.6386374221645592, 'spread_hl_frac': 0.011348285514137264, 'bb_std_mult': 3.599880589173025, 'rsi_os': 23, 'rsi_ob': 55, 'vol_spike': 0.10312798445487877, 'adx_thresh': 6.8016608725559795, 'atr_min_pct': 0.012108578317574106, 'atr_max_pct': 0.03697831026723812, 'tp_mult': 2.657596747012001, 'tsl_mult': 0.7209136458621072, 'strategy': 'mean_reversion', 'time_stop': 101, 'use_sma': False, 'use_atr': False, 'use_adx': True, 'use_ema': True, 'use_spike': True, 'rsi_required': True, 'edge_k': 0.2300672860938539, 'edge_cap': 0.951317948010086, 'bull_strategy': 'breakout', 'bull_bb_std_mult': 3.2566745672205437, 'bull_rsi_os': 27, 'bull_rsi_ob': 80, 'bull_adx_thresh': 14.081098454829545, 'bull_atr_min_pct': 0.015542208386741996, 'bull_atr_max_pct': 0.12954144401477372, 'bull_tp_mult': 1.7943623667671367, 'bull_tsl_mult': 0.900348921583604, 'bull_time_stop': 168, 'bull_use_sma': False, 'bull_use_ema': True, 'bull_use_atr': True, 'bull_use_adx': True, 'bull_use_spike': True, 'bull_rsi_required': True, 'bear_strategy': 'mean_reversion', 'bear_bb_std_mult': 2.6932920049633897, 'bear_rsi_os': 31, 'bear_rsi_ob': 83, 'bear_adx_thresh': 5.896244238725341, 'bear_atr_min_pct': 0.001316016823122618, 'bear_atr_max_pct': 0.09985083313241937, 'bear_tp_mult': 2.0577669667841456, 'bear_tsl_mult': 0.295211252311725, 'bear_time_stop': 93, 'bear_use_sma': True, 'bear_use_ema': False, 'bear_use_atr': False, 'bear_use_adx': False, 'bear_use_spike': True, 'bear_rsi_required': False, 'sideways_strategy': 'mean_reversion', 'sideways_bb_std_mult': 2.9742379493176734, 'sideways_rsi_os': 28, 'sideways_rsi_ob': 93, 'sideways_adx_thresh': 22.601386965065075, 'sideways_atr_min_pct': 0.004340708373031922, 'sideways_atr_max_pct': 0.12074624725552127, 'sideways_tp_mult': 1.0880853563302502, 'sideways_tsl_mult': 0.49025120402824746, 'sideways_time_stop': 279, 'sideways_use_sma': True, 'sideways_use_ema': True, 'sideways_use_atr': True, 'sideways_use_adx': True, 'sideways_use_spike': True, 'sideways_rsi_required': False}.
[I 2025-09-01 15:16:22,056] Trial 730 finished with values: [0.00029270316303176003, 0.0067209736573547165] and parameters: {'p_sma': 29, 'p_std': 25, 'p_atr': 28, 'p_adx': 8, 'rsi_period': 75, 'ema1': 10, 'ema2': 59, 'slip_atr_k': 0.00848786590573772, 'slip_spread_k': 0.4487165236465725, 'spread_hl_frac': 0.00853725447660992, 'bb_std_mult': 3.5968021278789504, 'rsi_os': 10, 'rsi_ob': 56, 'vol_spike': 0.10334054023303761, 'adx_thresh': 6.669570768581176, 'atr_min_pct': 0.012358861384250238, 'atr_max_pct': 0.042240976752690465, 'tp_mult': 2.522043143786445, 'tsl_mult': 0.7373259695402992, 'strategy': 'mean_reversion', 'time_stop': 145, 'use_sma': False, 'use_atr': False, 'use_adx': True, 'use_ema': True, 'use_spike': True, 'rsi_required': True, 'edge_k': 0.23374998338194436, 'edge_cap': 0.9836662413249262, 'bull_strategy': 'breakout', 'bull_bb_std_mult': 3.2616107093394193, 'bull_rsi_os': 25, 'bull_rsi_ob': 84, 'bull_adx_thresh': 8.348657715129214, 'bull_atr_min_pct': 0.015067552563059378, 'bull_atr_max_pct': 0.046564995336945025, 'bull_tp_mult': 1.8122456796290773, 'bull_tsl_mult': 0.8766820261743025, 'bull_time_stop': 167, 'bull_use_sma': True, 'bull_use_ema': True, 'bull_use_atr': True, 'bull_use_adx': True, 'bull_use_spike': True, 'bull_rsi_required': True, 'bear_strategy': 'mean_reversion', 'bear_bb_std_mult': 2.036493910572586, 'bear_rsi_os': 35, 'bear_rsi_ob': 74, 'bear_adx_thresh': 7.951703023521595, 'bear_atr_min_pct': 0.0008022848480565101, 'bear_atr_max_pct': 0.014939985091493318, 'bear_tp_mult': 2.0654662536306136, 'bear_tsl_mult': 0.2967522495280051, 'bear_time_stop': 97, 'bear_use_sma': True, 'bear_use_ema': False, 'bear_use_atr': False, 'bear_use_adx': False, 'bear_use_spike': True, 'bear_rsi_required': False, 'sideways_strategy': 'mean_reversion', 'sideways_bb_std_mult': 2.9197075753596446, 'sideways_rsi_os': 28, 'sideways_rsi_ob': 89, 'sideways_adx_thresh': 24.065749151069372, 'sideways_atr_min_pct': 0.0021620194932010805, 'sideways_atr_max_pct': 0.11726188944731199, 'sideways_tp_mult': 1.404892088944219, 'sideways_tsl_mult': 0.4945538339213983, 'sideways_time_stop': 280, 'sideways_use_sma': True, 'sideways_use_ema': True, 'sideways_use_atr': True, 'sideways_use_adx': True, 'sideways_use_spike': True, 'sideways_rsi_required': False}.
