[I 2025-09-01 14:10:44,953] Trial 296 finished with values: [-0.005517055967363738, 0.010868706879408243] and parameters: {'p_sma': 30, 'p_std': 52, 'p_atr': 28, 'p_adx': 8, 'rsi_period': 83, 'ema1': 10, 'ema2': 59, 'slip_atr_k': 0.029879238487391865, 'slip_spread_k': 0.5658719267484189, 'spread_hl_frac': 0.007403741870805891, 'bb_std_mult': 3.44816961176669, 'rsi_os': 42, 'rsi_ob': 51, 'vol_spike': 0.11372881385319478, 'adx_thresh': 6.398368449282009, 'atr_min_pct': 0.009904221272581754, 'atr_max_pct': 0.03517243348932153, 'tp_mult': 1.336878504920557, 'tsl_mult': 0.6585350270340624, 'strategy': 'mean_reversion', 'time_stop': 136, 'use_sma': True, 'use_atr': False, 'use_adx': True, 'use_ema': True, 'use_spike': True, 'rsi_required': True, 'edge_k': 0.16917102483464602, 'edge_cap': 0.8991608735393628, 'bull_strategy': 'breakout', 'bull_bb_std_mult': 3.150494691852133, 'bull_rsi_os': 11, 'bull_rsi_ob': 81, 'bull_adx_thresh': 7.770274499944725, 'bull_atr_min_pct': 0.011677350029261487, 'bull_atr_max_pct': 0.12963258546535292, 'bull_tp_mult': 1.710587470059153, 'bull_tsl_mult': 0.4645592950334806, 'bull_time_stop': 173, 'bull_use_sma': False, 'bull_use_ema': True, 'bull_use_atr': True, 'bull_use_adx': True, 'bull_use_spike': True, 'bull_rsi_required': True, 'bear_strategy': 'mean_reversion', 'bear_bb_std_mult': 2.569830094785784, 'bear_rsi_os': 38, 'bear_rsi_ob': 58, 'bear_adx_thresh': 9.857283476415656, 'bear_atr_min_pct': 0.0010367280240366967, 'bear_atr_max_pct': 0.11105205740023492, 'bear_tp_mult': 2.120988379800329, 'bear_tsl_mult': 0.26454517149725537, 'bear_time_stop': 101, 'bear_use_sma': False, 'bear_use_ema': False, 'bear_use_atr': False, 'bear_use_adx': False, 'bear_use_spike': True, 'bear_rsi_required': False, 'sideways_strategy': 'mean_reversion', 'sideways_bb_std_mult': 3.1198671353557885, 'sideways_rsi_os': 29, 'sideways_rsi_ob': 90, 'sideways_adx_thresh': 25.36860818252397, 'sideways_atr_min_pct': 0.0034413356476586136, 'sideways_atr_max_pct': 0.10444906110171343, 'sideways_tp_mult': 2.4711225537051926, 'sideways_tsl_mult': 0.36415841834951196, 'sideways_time_stop': 279, 'sideways_use_sma': True, 'sideways_use_ema': True, 'sideways_use_atr': False, 'sideways_use_adx': True, 'sideways_use_spike': False, 'sideways_rsi_required': False}.
[I 2025-09-01 14:10:44,965] Trial 295 finished with values: [-0.008083229183298846, 0.014134305138943737] and parameters: {'p_sma': 30, 'p_std': 30, 'p_atr': 28, 'p_adx': 8, 'rsi_period': 83, 'ema1': 10, 'ema2': 59, 'slip_atr_k': 0.013038297952948657, 'slip_spread_k': 0.5690871900753685, 'spread_hl_frac': 0.008984642648913858, 'bb_std_mult': 3.46956839045245, 'rsi_os': 41, 'rsi_ob': 51, 'vol_spike': 0.11363552722085118, 'adx_thresh': 6.459770770063109, 'atr_min_pct': 0.009451153660496885, 'atr_max_pct': 0.03592924621400634, 'tp_mult': 1.3459833306058935, 'tsl_mult': 0.6618487717201885, 'strategy': 'mean_reversion', 'time_stop': 138, 'use_sma': True, 'use_atr': False, 'use_adx': True, 'use_ema': True, 'use_spike': True, 'rsi_required': True, 'edge_k': 0.15232235955035178, 'edge_cap': 0.9767514516486169, 'bull_strategy': 'breakout', 'bull_bb_std_mult': 3.1459056413672712, 'bull_rsi_os': 11, 'bull_rsi_ob': 79, 'bull_adx_thresh': 7.399484771364882, 'bull_atr_min_pct': 0.011542448663647894, 'bull_atr_max_pct': 0.13041043482404402, 'bull_tp_mult': 1.689867182888582, 'bull_tsl_mult': 0.45414143771390597, 'bull_time_stop': 166, 'bull_use_sma': False, 'bull_use_ema': True, 'bull_use_atr': True, 'bull_use_adx': True, 'bull_use_spike': True, 'bull_rsi_required': True, 'bear_strategy': 'mean_reversion', 'bear_bb_std_mult': 2.5895176612286566, 'bear_rsi_os': 37, 'bear_rsi_ob': 58, 'bear_adx_thresh': 9.24052660723137, 'bear_atr_min_pct': 0.0007697531895317841, 'bear_atr_max_pct': 0.11094259928187146, 'bear_tp_mult': 2.1214008826693136, 'bear_tsl_mult': 0.28269930386953457, 'bear_time_stop': 99, 'bear_use_sma': False, 'bear_use_ema': False, 'bear_use_atr': False, 'bear_use_adx': False, 'bear_use_spike': True, 'bear_rsi_required': False, 'sideways_strategy': 'mean_reversion', 'sideways_bb_std_mult': 3.1297542568482326, 'sideways_rsi_os': 29, 'sideways_rsi_ob': 90, 'sideways_adx_thresh': 25.196760753114607, 'sideways_atr_min_pct': 0.003644337100657282, 'sideways_atr_max_pct': 0.1084991080601388, 'sideways_tp_mult': 2.480457937264454, 'sideways_tsl_mult': 0.35948061154118705, 'sideways_time_stop': 279, 'sideways_use_sma': True, 'sideways_use_ema': True, 'sideways_use_atr': False, 'sideways_use_adx': True, 'sideways_use_spike': False, 'sideways_rsi_required': False}.
[I 2025-09-01 14:10:45,566] Trial 300 finished with values: [-1000000000.0, 1000000000.0] and parameters: {'p_sma': 33, 'p_std': 30, 'p_atr': 27, 'p_adx': 8, 'rsi_period': 83, 'ema1': 9, 'ema2': 57, 'slip_atr_k': 0.07251783798447567, 'slip_spread_k': 0.5629228000337247, 'spread_hl_frac': 0.008519170317316676, 'bb_std_mult': 3.4020213925264393, 'rsi_os': 16, 'rsi_ob': 50, 'vol_spike': 0.09958982085440438, 'adx_thresh': 5.734304250993889, 'atr_min_pct': 0.010798222079018286, 'atr_max_pct': 0.03444767034900281, 'tp_mult': 1.4411289393395421, 'tsl_mult': 0.6899089219924646, 'strategy': 'mean_reversion', 'time_stop': 114, 'use_sma': False, 'use_atr': False, 'use_adx': True, 'use_ema': True, 'use_spike': True, 'rsi_required': True, 'edge_k': 0.1794242092566221, 'edge_cap': 0.9652192282468091, 'bull_strategy': 'mean_reversion', 'bull_bb_std_mult': 3.2996131667533657, 'bull_rsi_os': 11, 'bull_rsi_ob': 81, 'bull_adx_thresh': 14.045124242946056, 'bull_atr_min_pct': 0.012258927351602734, 'bull_atr_max_pct': 0.12923225746002667, 'bull_tp_mult': 1.6401151373202776, 'bull_tsl_mult': 0.4884432433215763, 'bull_time_stop': 179, 'bull_use_sma': False, 'bull_use_ema': True, 'bull_use_atr': True, 'bull_use_adx': True, 'bull_use_spike': True, 'bull_rsi_required': True, 'bear_strategy': 'mean_reversion', 'bear_bb_std_mult': 2.4585791652139233, 'bear_rsi_os': 34, 'bear_rsi_ob': 56, 'bear_adx_thresh': 7.264290995193972, 'bear_atr_min_pct': 0.002617155559910562, 'bear_atr_max_pct': 0.09979581230867544, 'bear_tp_mult': 2.0313916574232596, 'bear_tsl_mult': 0.05787339309394324, 'bear_time_stop': 90, 'bear_use_sma': False, 'bear_use_ema': False, 'bear_use_atr': True, 'bear_use_adx': False, 'bear_use_spike': True, 'bear_rsi_required': False, 'sideways_strategy': 'mean_reversion', 'sideways_bb_std_mult': 3.125539199725752, 'sideways_rsi_os': 30, 'sideways_rsi_ob': 89, 'sideways_adx_thresh': 23.862490887109434, 'sideways_atr_min_pct': 0.0027868323112327474, 'sideways_atr_max_pct': 0.10925474673865175, 'sideways_tp_mult': 2.3688736305845155, 'sideways_tsl_mult': 0.40730553571102296, 'sideways_time_stop': 264, 'sideways_use_sma': True, 'sideways_use_ema': True, 'sideways_use_atr': True, 'sideways_use_adx': True, 'sideways_use_spike': False, 'sideways_rsi_required': True}.
[I 2025-09-01 14:11:29,024] Trial 301 finished with values: [-0.002623819894404744, 0.007818429017506904] and parameters: {'p_sma': 33, 'p_std': 33, 'p_atr': 27, 'p_adx': 7, 'rsi_period': 80, 'ema1': 9, 'ema2': 56, 'slip_atr_k': 0.0721918068123181, 'slip_spread_k': 0.6004385157007099, 'spread_hl_frac': 0.010890222528891803, 'bb_std_mult': 3.379571089871313, 'rsi_os': 44, 'rsi_ob': 54, 'vol_spike': 0.1019235623160941, 'adx_thresh': 5.790029131250153, 'atr_min_pct': 0.01058631061988054, 'atr_max_pct': 0.02974154238493469, 'tp_mult': 1.4291733127732702, 'tsl_mult': 0.6933349287310674, 'strategy': 'mean_reversion', 'time_stop': 106, 'use_sma': False, 'use_atr': False, 'use_adx': True, 'use_ema': True, 'use_spike': True, 'rsi_required': True, 'edge_k': 0.3498311405381178, 'edge_cap': 0.9627800715411511, 'bull_strategy': 'mean_reversion', 'bull_bb_std_mult': 3.278903040644157, 'bull_rsi_os': 13, 'bull_rsi_ob': 79, 'bull_adx_thresh': 14.0250027190719, 'bull_atr_min_pct': 0.029681120377527393, 'bull_atr_max_pct': 0.12601408934962866, 'bull_tp_mult': 1.5633105535904417, 'bull_tsl_mult': 0.4810043633350508, 'bull_time_stop': 157, 'bull_use_sma': True, 'bull_use_ema': True, 'bull_use_atr': True, 'bull_use_adx': True, 'bull_use_spike': True, 'bull_rsi_required': True, 'bear_strategy': 'mean_reversion', 'bear_bb_std_mult': 2.500867134268999, 'bear_rsi_os': 34, 'bear_rsi_ob': 57, 'bear_adx_thresh': 8.350869047979604, 'bear_atr_min_pct': 0.0025416294784923106, 'bear_atr_max_pct': 0.10261832928721687, 'bear_tp_mult': 2.0338995740686467, 'bear_tsl_mult': 0.35755485623288064, 'bear_time_stop': 91, 'bear_use_sma': False, 'bear_use_ema': False, 'bear_use_atr': True, 'bear_use_adx': False, 'bear_use_spike': True, 'bear_rsi_required': False, 'sideways_strategy': 'mean_reversion', 'sideways_bb_std_mult': 3.0143971180548923, 'sideways_rsi_os': 30, 'sideways_rsi_ob': 89, 'sideways_adx_thresh': 23.662717554381608, 'sideways_atr_min_pct': 0.005742895322882179, 'sideways_atr_max_pct': 0.1052661743910423, 'sideways_tp_mult': 2.3821559109686246, 'sideways_tsl_mult': 0.40460910052936044, 'sideways_time_stop': 265, 'sideways_use_sma': True, 'sideways_use_ema': True, 'sideways_use_atr': True, 'sideways_use_adx': True, 'sideways_use_spike': False, 'sideways_rsi_required': True}.
[I 2025-09-01 14:11:29,035] Trial 303 finished with values: [-1000000000.0, 1000000000.0] and parameters: {'p_sma': 32, 'p_std': 33, 'p_atr': 27, 'p_adx': 7, 'rsi_period': 80, 'ema1': 9, 'ema2': 56, 'slip_atr_k': 0.24919389996281202, 'slip_spread_k': 0.6127031002894548, 'spread_hl_frac': 0.03506696079697209, 'bb_std_mult': 3.3951513721255733, 'rsi_os': 26, 'rsi_ob': 56, 'vol_spike': 0.10102828220044655, 'adx_thresh': 5.004854115883033, 'atr_min_pct': 0.01132466516511838, 'atr_max_pct': 0.042237068958860396, 'tp_mult': 1.4409370394085315, 'tsl_mult': 0.691539884299282, 'strategy': 'mean_reversion', 'time_stop': 107, 'use_sma': True, 'use_atr': False, 'use_adx': True, 'use_ema': True, 'use_spike': True, 'rsi_required': True, 'edge_k': 0.3142871051691705, 'edge_cap': 0.9850629317237617, 'bull_strategy': 'mean_reversion', 'bull_bb_std_mult': 3.2787637251495907, 'bull_rsi_os': 14, 'bull_rsi_ob': 77, 'bull_adx_thresh': 13.089154259248946, 'bull_atr_min_pct': 0.01243320923007644, 'bull_atr_max_pct': 0.1327086406480003, 'bull_tp_mult': 1.557813285559421, 'bull_tsl_mult': 0.44379668333968625, 'bull_time_stop': 156, 'bull_use_sma': True, 'bull_use_ema': True, 'bull_use_atr': True, 'bull_use_adx': True, 'bull_use_spike': True, 'bull_rsi_required': True, 'bear_strategy': 'mean_reversion', 'bear_bb_std_mult': 2.67758950776555, 'bear_rsi_os': 34, 'bear_rsi_ob': 59, 'bear_adx_thresh': 8.408248974639335, 'bear_atr_min_pct': 0.0030925215149041323, 'bear_atr_max_pct': 0.1173490795585544, 'bear_tp_mult': 2.0457982307548463, 'bear_tsl_mult': 0.09582657231208778, 'bear_time_stop': 109, 'bear_use_sma': False, 'bear_use_ema': False, 'bear_use_atr': True, 'bear_use_adx': False, 'bear_use_spike': True, 'bear_rsi_required': False, 'sideways_strategy': 'mean_reversion', 'sideways_bb_std_mult': 3.0049036068133828, 'sideways_rsi_os': 32, 'sideways_rsi_ob': 90, 'sideways_adx_thresh': 24.83922631331243, 'sideways_atr_min_pct': 0.005610316249549739, 'sideways_atr_max_pct': 0.10518697395769908, 'sideways_tp_mult': 2.3831590241584686, 'sideways_tsl_mult': 0.3189633122854756, 'sideways_time_stop': 263, 'sideways_use_sma': True, 'sideways_use_ema': True, 'sideways_use_atr': True, 'sideways_use_adx': True, 'sideways_use_spike': False, 'sideways_rsi_required': False}.
[I 2025-09-01 14:11:29,606] Trial 299 finished with values: [-1000000000.0, 1000000000.0] and parameters: {'p_sma': 30, 'p_std': 52, 'p_atr': 26, 'p_adx': 7, 'rsi_period': 83, 'ema1': 9, 'ema2': 60, 'slip_atr_k': 0.06519129569673121, 'slip_spread_k': 0.5651858539123192, 'spread_hl_frac': 0.008868787647405018, 'bb_std_mult': 3.3940254452562413, 'rsi_os': 41, 'rsi_ob': 56, 'vol_spike': 0.10211877505800296, 'adx_thresh': 5.753009197077284, 'atr_min_pct': 0.010713947024672084, 'atr_max_pct': 0.04260404283929763, 'tp_mult': 1.4481502132069732, 'tsl_mult': 0.6581216133508833, 'strategy': 'mean_reversion', 'time_stop': 114, 'use_sma': True, 'use_atr': False, 'use_adx': True, 'use_ema': True, 'use_spike': True, 'rsi_required': True, 'edge_k': 0.11279254271741557, 'edge_cap': 0.9115276076374292, 'bull_strategy': 'mean_reversion', 'bull_bb_std_mult': 3.30707949188994, 'bull_rsi_os': 13, 'bull_rsi_ob': 80, 'bull_adx_thresh': 13.885712210256605, 'bull_atr_min_pct': 0.011656604770215944, 'bull_atr_max_pct': 0.13217123325084612, 'bull_tp_mult': 1.7149425621476289, 'bull_tsl_mult': 0.45207422323590346, 'bull_time_stop': 172, 'bull_use_sma': False, 'bull_use_ema': True, 'bull_use_atr': True, 'bull_use_adx': True, 'bull_use_spike': True, 'bull_rsi_required': True, 'bear_strategy': 'mean_reversion', 'bear_bb_std_mult': 2.4787381162750566, 'bear_rsi_os': 34, 'bear_rsi_ob': 60, 'bear_adx_thresh': 8.375939093120293, 'bear_atr_min_pct': 0.002527596665363742, 'bear_atr_max_pct': 0.11724625130615034, 'bear_tp_mult': 2.0484946946145985, 'bear_tsl_mult': 0.0552754298970434, 'bear_time_stop': 103, 'bear_use_sma': False, 'bear_use_ema': False, 'bear_use_atr': True, 'bear_use_adx': False, 'bear_use_spike': True, 'bear_rsi_required': False, 'sideways_strategy': 'mean_reversion', 'sideways_bb_std_mult': 3.108942909002259, 'sideways_rsi_os': 29, 'sideways_rsi_ob': 90, 'sideways_adx_thresh': 25.040033505535526, 'sideways_atr_min_pct': 0.004753181124042915, 'sideways_atr_max_pct': 0.10465434219391727, 'sideways_tp_mult': 2.510820021374554, 'sideways_tsl_mult': 0.36048115419244986, 'sideways_time_stop': 264, 'sideways_use_sma': True, 'sideways_use_ema': True, 'sideways_use_atr': False, 'sideways_use_adx': True, 'sideways_use_spike': False, 'sideways_rsi_required': False}.
[I 2025-09-01 14:11:30,049] Trial 302 finished with values: [-1000000000.0, 1000000000.0] and parameters: {'p_sma': 32, 'p_std': 57, 'p_atr': 27, 'p_adx': 7, 'rsi_period': 80, 'ema1': 9, 'ema2': 56, 'slip_atr_k': 0.15691836111830343, 'slip_spread_k': 0.5904925405661272, 'spread_hl_frac': 0.025891587012472527, 'bb_std_mult': 3.378801564273797, 'rsi_os': 39, 'rsi_ob': 56, 'vol_spike': 0.09954766640670662, 'adx_thresh': 5.6239182969306505, 'atr_min_pct': 0.010698002486105024, 'atr_max_pct': 0.030201425037192257, 'tp_mult': 1.4410605382448924, 'tsl_mult': 0.6925768648666156, 'strategy': 'mean_reversion', 'time_stop': 107, 'use_sma': False, 'use_atr': False, 'use_adx': True, 'use_ema': True, 'use_spike': True, 'rsi_required': True, 'edge_k': 0.36683778876580936, 'edge_cap': 0.9681705448059953, 'bull_strategy': 'mean_reversion', 'bull_bb_std_mult': 3.280591963070337, 'bull_rsi_os': 13, 'bull_rsi_ob': 77, 'bull_adx_thresh': 13.977513894939108, 'bull_atr_min_pct': 0.012279791847238096, 'bull_atr_max_pct': 0.12597631729833267, 'bull_tp_mult': 1.6545178713053397, 'bull_tsl_mult': 0.4902201028747349, 'bull_time_stop': 157, 'bull_use_sma': True, 'bull_use_ema': True, 'bull_use_atr': True, 'bull_use_adx': True, 'bull_use_spike': True, 'bull_rsi_required': True, 'bear_strategy': 'mean_reversion', 'bear_bb_std_mult': 2.4679692423965194, 'bear_rsi_os': 34, 'bear_rsi_ob': 56, 'bear_adx_thresh': 8.308518994530353, 'bear_atr_min_pct': 0.002410918197185352, 'bear_atr_max_pct': 0.10144327891434393, 'bear_tp_mult': 2.043515584659226, 'bear_tsl_mult': 0.0674821910568656, 'bear_time_stop': 89, 'bear_use_sma': False, 'bear_use_ema': False, 'bear_use_atr': True, 'bear_use_adx': False, 'bear_use_spike': True, 'bear_rsi_required': False, 'sideways_strategy': 'mean_reversion', 'sideways_bb_std_mult': 2.920097850239792, 'sideways_rsi_os': 30, 'sideways_rsi_ob': 89, 'sideways_adx_thresh': 23.64955941437418, 'sideways_atr_min_pct': 0.0014177454257660628, 'sideways_atr_max_pct': 0.10995897733941887, 'sideways_tp_mult': 2.3852431815118855, 'sideways_tsl_mult': 0.31606855689345537, 'sideways_time_stop': 265, 'sideways_use_sma': True, 'sideways_use_ema': True, 'sideways_use_atr': True, 'sideways_use_adx': True, 'sideways_use_spike': False, 'sideways_rsi_required': True}.
[I 2025-09-01 14:12:13,621] Trial 307 finished with values: [-1000000000.0, 1000000000.0] and parameters: {'p_sma': 26, 'p_std': 18, 'p_atr': 25, 'p_adx': 9, 'rsi_period': 75, 'ema1': 10, 'ema2': 57, 'slip_atr_k': 0.16377422653826434, 'slip_spread_k': 0.5551818511719799, 'spread_hl_frac': 0.014688387200796817, 'bb_std_mult': 3.5045903760999835, 'rsi_os': 13, 'rsi_ob': 53, 'vol_spike': 0.21632816358101808, 'adx_thresh': 7.8593421216557715, 'atr_min_pct': 0.011536542509710427, 'atr_max_pct': 0.038358013250535755, 'tp_mult': 1.2267773949072867, 'tsl_mult': 0.6765209935855772, 'strategy': 'mean_reversion', 'time_stop': 124, 'use_sma': True, 'use_atr': False, 'use_adx': True, 'use_ema': True, 'use_spike': False, 'rsi_required': True, 'edge_k': 0.2638427614918175, 'edge_cap': 0.985949461327226, 'bull_strategy': 'breakout', 'bull_bb_std_mult': 3.4341402220718313, 'bull_rsi_os': 14, 'bull_rsi_ob': 75, 'bull_adx_thresh': 12.25191199486806, 'bull_atr_min_pct': 0.024236237832984987, 'bull_atr_max_pct': 0.13579275744741356, 'bull_tp_mult': 1.6468328029357013, 'bull_tsl_mult': 0.4209690548133323, 'bull_time_stop': 162, 'bull_use_sma': False, 'bull_use_ema': False, 'bull_use_atr': True, 'bull_use_adx': False, 'bull_use_spike': True, 'bull_rsi_required': True, 'bear_strategy': 'mean_reversion', 'bear_bb_std_mult': 2.563274799029207, 'bear_rsi_os': 32, 'bear_rsi_ob': 57, 'bear_adx_thresh': 7.276315599214429, 'bear_atr_min_pct': 0.0030628019469164155, 'bear_atr_max_pct': 0.11293950938520099, 'bear_tp_mult': 2.082490913777737, 'bear_tsl_mult': 0.3346133340157533, 'bear_time_stop': 93, 'bear_use_sma': False, 'bear_use_ema': False, 'bear_use_atr': False, 'bear_use_adx': False, 'bear_use_spike': True, 'bear_rsi_required': False, 'sideways_strategy': 'mean_reversion', 'sideways_bb_std_mult': 2.8699219730851513, 'sideways_rsi_os': 32, 'sideways_rsi_ob': 92, 'sideways_adx_thresh': 24.27555915340124, 'sideways_atr_min_pct': 0.0046244593677601305, 'sideways_atr_max_pct': 0.09802690989664417, 'sideways_tp_mult': 2.277963624853727, 'sideways_tsl_mult': 0.459822328656112, 'sideways_time_stop': 286, 'sideways_use_sma': True, 'sideways_use_ema': False, 'sideways_use_atr': True, 'sideways_use_adx': True, 'sideways_use_spike': True, 'sideways_rsi_required': False}.
[I 2025-09-01 14:12:14,922] Trial 305 finished with values: [-0.013745266022934577, 0.015253398059894181] and parameters: {'p_sma': 29, 'p_std': 28, 'p_atr': 26, 'p_adx': 9, 'rsi_period': 76, 'ema1': 9, 'ema2': 60, 'slip_atr_k': 0.15950731449540334, 'slip_spread_k': 0.5538194138071947, 'spread_hl_frac': 0.006431394720903018, 'bb_std_mult': 3.438930790942698, 'rsi_os': 39, 'rsi_ob': 53, 'vol_spike': 0.10837905945034886, 'adx_thresh': 7.188971517160176, 'atr_min_pct': 0.012651447697870322, 'atr_max_pct': 0.03881293552961459, 'tp_mult': 1.3015020112862254, 'tsl_mult': 0.610010463891955, 'strategy': 'mean_reversion', 'time_stop': 126, 'use_sma': True, 'use_atr': False, 'use_adx': True, 'use_ema': True, 'use_spike': False, 'rsi_required': True, 'edge_k': 0.2743422184019581, 'edge_cap': 0.9219258104744266, 'bull_strategy': 'breakout', 'bull_bb_std_mult': 3.181071931156184, 'bull_rsi_os': 14, 'bull_rsi_ob': 77, 'bull_adx_thresh': 12.308763752669126, 'bull_atr_min_pct': 0.02059296062701055, 'bull_atr_max_pct': 0.13687494826252078, 'bull_tp_mult': 1.6518083858709962, 'bull_tsl_mult': 0.42084875721347187, 'bull_time_stop': 161, 'bull_use_sma': False, 'bull_use_ema': False, 'bull_use_atr': True, 'bull_use_adx': True, 'bull_use_spike': True, 'bull_rsi_required': True, 'bear_strategy': 'mean_reversion', 'bear_bb_std_mult': 2.4706304121081675, 'bear_rsi_os': 36, 'bear_rsi_ob': 56, 'bear_adx_thresh': 7.213006876778165, 'bear_atr_min_pct': 0.003223701085054073, 'bear_atr_max_pct': 0.10723877518766858, 'bear_tp_mult': 2.1676447095291485, 'bear_tsl_mult': 0.022629332071945063, 'bear_time_stop': 92, 'bear_use_sma': False, 'bear_use_ema': False, 'bear_use_atr': False, 'bear_use_adx': False, 'bear_use_spike': True, 'bear_rsi_required': False, 'sideways_strategy': 'mean_reversion', 'sideways_bb_std_mult': 2.9248235963521196, 'sideways_rsi_os': 32, 'sideways_rsi_ob': 92, 'sideways_adx_thresh': 24.534568122570686, 'sideways_atr_min_pct': 0.004634919349858673, 'sideways_atr_max_pct': 0.10966586160670375, 'sideways_tp_mult': 2.300039776335852, 'sideways_tsl_mult': 0.4600062240257528, 'sideways_time_stop': 265, 'sideways_use_sma': True, 'sideways_use_ema': True, 'sideways_use_atr': True, 'sideways_use_adx': True, 'sideways_use_spike': False, 'sideways_rsi_required': False}.
