[I 2025-09-01 14:38:16,599] Trial 487 finished with values: [-0.018333156231893355, 0.019963737900311] and parameters: {'p_sma': 36, 'p_std': 26, 'p_atr': 26, 'p_adx': 22, 'rsi_period': 84, 'ema1': 10, 'ema2': 60, 'slip_atr_k': 0.01911463801123514, 'slip_spread_k': 0.36472077522483604, 'spread_hl_frac': 0.001732075302246238, 'bb_std_mult': 0.7381852063753811, 'rsi_os': 43, 'rsi_ob': 54, 'vol_spike': 0.1252264867270224, 'adx_thresh': 6.544794682526531, 'atr_min_pct': 0.0067036191276016975, 'atr_max_pct': 0.026333485561224557, 'tp_mult': 1.328408860661634, 'tsl_mult': 0.7077459118418252, 'strategy': 'mean_reversion', 'time_stop': 108, 'use_sma': True, 'use_atr': False, 'use_adx': True, 'use_ema': True, 'use_spike': False, 'rsi_required': True, 'edge_k': 0.25525403252773915, 'edge_cap': 0.38991465909014067, 'bull_strategy': 'breakout', 'bull_bb_std_mult': 3.164612379327145, 'bull_rsi_os': 22, 'bull_rsi_ob': 78, 'bull_adx_thresh': 11.04573410747084, 'bull_atr_min_pct': 0.011543838187075928, 'bull_atr_max_pct': 0.12462418560658449, 'bull_tp_mult': 2.487453192949617, 'bull_tsl_mult': 0.40036661745664703, 'bull_time_stop': 173, 'bull_use_sma': False, 'bull_use_ema': True, 'bull_use_atr': False, 'bull_use_adx': True, 'bull_use_spike': True, 'bull_rsi_required': False, 'bear_strategy': 'mean_reversion', 'bear_bb_std_mult': 1.7592642168044366, 'bear_rsi_os': 52, 'bear_rsi_ob': 56, 'bear_adx_thresh': 22.70197086840875, 'bear_atr_min_pct': 0.0033553194422494227, 'bear_atr_max_pct': 0.1154228434667306, 'bear_tp_mult': 2.5748159017894796, 'bear_tsl_mult': 0.08721818697999595, 'bear_time_stop': 104, 'bear_use_sma': False, 'bear_use_ema': False, 'bear_use_atr': False, 'bear_use_adx': True, 'bear_use_spike': True, 'bear_rsi_required': False, 'sideways_strategy': 'mean_reversion', 'sideways_bb_std_mult': 1.6653612616803453, 'sideways_rsi_os': 33, 'sideways_rsi_ob': 82, 'sideways_adx_thresh': 14.52387871967252, 'sideways_atr_min_pct': 0.005326215127252224, 'sideways_atr_max_pct': 0.09690659844017566, 'sideways_tp_mult': 2.4841752994713895, 'sideways_tsl_mult': 0.41469291095724176, 'sideways_time_stop': 281, 'sideways_use_sma': True, 'sideways_use_ema': True, 'sideways_use_atr': True, 'sideways_use_adx': True, 'sideways_use_spike': False, 'sideways_rsi_required': False}.
[I 2025-09-01 14:38:17,066] Trial 488 finished with values: [-1000000000.0, 1000000000.0] and parameters: {'p_sma': 28, 'p_std': 26, 'p_atr': 12, 'p_adx': 9, 'rsi_period': 84, 'ema1': 8, 'ema2': 56, 'slip_atr_k': 0.02144105570501574, 'slip_spread_k': 0.5937631353685512, 'spread_hl_frac': 0.01494234360881885, 'bb_std_mult': 1.1959221116411007, 'rsi_os': 10, 'rsi_ob': 54, 'vol_spike': 0.12414842122768142, 'adx_thresh': 6.374727992633419, 'atr_min_pct': 0.0024278418609996657, 'atr_max_pct': 0.025750343315593255, 'tp_mult': 1.792547122918311, 'tsl_mult': 0.7099693791989004, 'strategy': 'breakout', 'time_stop': 216, 'use_sma': True, 'use_atr': False, 'use_adx': False, 'use_ema': True, 'use_spike': False, 'rsi_required': True, 'edge_k': 0.25979986240107716, 'edge_cap': 0.9640503301914022, 'bull_strategy': 'breakout', 'bull_bb_std_mult': 3.130226761882024, 'bull_rsi_os': 45, 'bull_rsi_ob': 77, 'bull_adx_thresh': 22.34590593591073, 'bull_atr_min_pct': 0.0184063646425836, 'bull_atr_max_pct': 0.12489362321358319, 'bull_tp_mult': 1.6982620280578111, 'bull_tsl_mult': 0.6484887635867644, 'bull_time_stop': 173, 'bull_use_sma': False, 'bull_use_ema': True, 'bull_use_atr': False, 'bull_use_adx': True, 'bull_use_spike': False, 'bull_rsi_required': False, 'bear_strategy': 'breakout', 'bear_bb_std_mult': 1.7439192089104414, 'bear_rsi_os': 34, 'bear_rsi_ob': 65, 'bear_adx_thresh': 14.988612635938544, 'bear_atr_min_pct': 0.012092814009442406, 'bear_atr_max_pct': 0.13523778739989534, 'bear_tp_mult': 2.0422084908174614, 'bear_tsl_mult': 0.37298578176441405, 'bear_time_stop': 103, 'bear_use_sma': False, 'bear_use_ema': False, 'bear_use_atr': True, 'bear_use_adx': True, 'bear_use_spike': True, 'bear_rsi_required': False, 'sideways_strategy': 'mean_reversion', 'sideways_bb_std_mult': 3.1460115868868783, 'sideways_rsi_os': 33, 'sideways_rsi_ob': 69, 'sideways_adx_thresh': 26.004500881331882, 'sideways_atr_min_pct': 0.005360792069888876, 'sideways_atr_max_pct': 0.07733507611163914, 'sideways_tp_mult': 2.478729046644319, 'sideways_tsl_mult': 0.4073335329943586, 'sideways_time_stop': 159, 'sideways_use_sma': True, 'sideways_use_ema': True, 'sideways_use_atr': True, 'sideways_use_adx': True, 'sideways_use_spike': False, 'sideways_rsi_required': False}.
[I 2025-09-01 14:38:17,586] Trial 489 finished with values: [-1000000000.0, 1000000000.0] and parameters: {'p_sma': 7, 'p_std': 26, 'p_atr': 29, 'p_adx': 9, 'rsi_period': 74, 'ema1': 11, 'ema2': 56, 'slip_atr_k': 0.01365335535393282, 'slip_spread_k': 0.561214258469458, 'spread_hl_frac': 0.0136980185627255, 'bb_std_mult': 2.8394984581771054, 'rsi_os': 10, 'rsi_ob': 56, 'vol_spike': 0.1272748927585652, 'adx_thresh': 7.097030836375776, 'atr_min_pct': 0.010973191141288266, 'atr_max_pct': 0.13072710292167872, 'tp_mult': 1.3337128905308842, 'tsl_mult': 0.3395308719232217, 'strategy': 'breakout', 'time_stop': 106, 'use_sma': True, 'use_atr': False, 'use_adx': False, 'use_ema': False, 'use_spike': True, 'rsi_required': True, 'edge_k': 1.687839122976267, 'edge_cap': 0.9233025922340563, 'bull_strategy': 'breakout', 'bull_bb_std_mult': 1.8330896902394647, 'bull_rsi_os': 16, 'bull_rsi_ob': 77, 'bull_adx_thresh': 22.151889454348996, 'bull_atr_min_pct': 0.013963497876049745, 'bull_atr_max_pct': 0.0484206090565819, 'bull_tp_mult': 1.7044078397583315, 'bull_tsl_mult': 0.6797519812613497, 'bull_time_stop': 174, 'bull_use_sma': False, 'bull_use_ema': True, 'bull_use_atr': True, 'bull_use_adx': True, 'bull_use_spike': False, 'bull_rsi_required': False, 'bear_strategy': 'breakout', 'bear_bb_std_mult': 1.7450482819824504, 'bear_rsi_os': 33, 'bear_rsi_ob': 56, 'bear_adx_thresh': 14.430318663624208, 'bear_atr_min_pct': 0.0034297271913025637, 'bear_atr_max_pct': 0.11508795319148088, 'bear_tp_mult': 2.066147601848926, 'bear_tsl_mult': 0.12993662554251784, 'bear_time_stop': 84, 'bear_use_sma': False, 'bear_use_ema': False, 'bear_use_atr': True, 'bear_use_adx': False, 'bear_use_spike': True, 'bear_rsi_required': False, 'sideways_strategy': 'mean_reversion', 'sideways_bb_std_mult': 3.1338164334309044, 'sideways_rsi_os': 31, 'sideways_rsi_ob': 56, 'sideways_adx_thresh': 25.428803098854882, 'sideways_atr_min_pct': 0.004985508251644696, 'sideways_atr_max_pct': 0.11488479928367236, 'sideways_tp_mult': 2.346361880546171, 'sideways_tsl_mult': 0.45729658028798803, 'sideways_time_stop': 78, 'sideways_use_sma': True, 'sideways_use_ema': True, 'sideways_use_atr': True, 'sideways_use_adx': True, 'sideways_use_spike': False, 'sideways_rsi_required': False}.
[I 2025-09-01 14:38:18,505] Trial 485 finished with values: [-1000000000.0, 1000000000.0] and parameters: {'p_sma': 6, 'p_std': 17, 'p_atr': 26, 'p_adx': 9, 'rsi_period': 60, 'ema1': 8, 'ema2': 55, 'slip_atr_k': 0.019215412222357453, 'slip_spread_k': 0.7137871075971045, 'spread_hl_frac': 0.010154948010709, 'bb_std_mult': 3.4382470111978316, 'rsi_os': 50, 'rsi_ob': 54, 'vol_spike': 0.11094908463526124, 'adx_thresh': 13.722911154792207, 'atr_min_pct': 0.011437638995757886, 'atr_max_pct': 0.02689814111955772, 'tp_mult': 1.4532455412462146, 'tsl_mult': 0.6860640500547867, 'strategy': 'breakout', 'time_stop': 103, 'use_sma': True, 'use_atr': True, 'use_adx': False, 'use_ema': True, 'use_spike': True, 'rsi_required': False, 'edge_k': 0.2701411375319867, 'edge_cap': 0.9839529682487871, 'bull_strategy': 'breakout', 'bull_bb_std_mult': 3.1840226531265605, 'bull_rsi_os': 12, 'bull_rsi_ob': 77, 'bull_adx_thresh': 22.089222258775504, 'bull_atr_min_pct': 0.007901789287864034, 'bull_atr_max_pct': 0.12490283838008633, 'bull_tp_mult': 2.392067115644936, 'bull_tsl_mult': 0.15650658959842972, 'bull_time_stop': 182, 'bull_use_sma': False, 'bull_use_ema': True, 'bull_use_atr': True, 'bull_use_adx': True, 'bull_use_spike': False, 'bull_rsi_required': False, 'bear_strategy': 'breakout', 'bear_bb_std_mult': 2.435693925350066, 'bear_rsi_os': 34, 'bear_rsi_ob': 55, 'bear_adx_thresh': 8.056083350736513, 'bear_atr_min_pct': 0.021581923150132534, 'bear_atr_max_pct': 0.10916264722444406, 'bear_tp_mult': 2.0678486693222644, 'bear_tsl_mult': 0.09491163773176248, 'bear_time_stop': 92, 'bear_use_sma': False, 'bear_use_ema': True, 'bear_use_atr': True, 'bear_use_adx': False, 'bear_use_spike': True, 'bear_rsi_required': True, 'sideways_strategy': 'breakout', 'sideways_bb_std_mult': 2.2231922244072475, 'sideways_rsi_os': 31, 'sideways_rsi_ob': 54, 'sideways_adx_thresh': 22.481338685327565, 'sideways_atr_min_pct': 0.005071005931639565, 'sideways_atr_max_pct': 0.11332698646209365, 'sideways_tp_mult': 1.9560760379681117, 'sideways_tsl_mult': 0.4947247235649186, 'sideways_time_stop': 259, 'sideways_use_sma': False, 'sideways_use_ema': True, 'sideways_use_atr': False, 'sideways_use_adx': False, 'sideways_use_spike': True, 'sideways_rsi_required': True}.
[I 2025-09-01 14:38:19,415] Trial 491 finished with values: [-1000000000.0, 1000000000.0] and parameters: {'p_sma': 5, 'p_std': 30, 'p_atr': 29, 'p_adx': 14, 'rsi_period': 75, 'ema1': 9, 'ema2': 41, 'slip_atr_k': 7.612304131226523e-05, 'slip_spread_k': 0.4465366039836646, 'spread_hl_frac': 0.03374044275536313, 'bb_std_mult': 3.177957354921536, 'rsi_os': 33, 'rsi_ob': 50, 'vol_spike': 0.2607795718993668, 'adx_thresh': 7.668819845362436, 'atr_min_pct': 0.011133347799377588, 'atr_max_pct': 0.13024154666897392, 'tp_mult': 2.307940187999185, 'tsl_mult': 0.9755595103956103, 'strategy': 'mean_reversion', 'time_stop': 225, 'use_sma': True, 'use_atr': False, 'use_adx': True, 'use_ema': False, 'use_spike': True, 'rsi_required': False, 'edge_k': 1.8017531442018409, 'edge_cap': 0.9200908555572683, 'bull_strategy': 'breakout', 'bull_bb_std_mult': 3.054366618267967, 'bull_rsi_os': 38, 'bull_rsi_ob': 81, 'bull_adx_thresh': 12.44232114887533, 'bull_atr_min_pct': 0.014154675325525294, 'bull_atr_max_pct': 0.13531066921714702, 'bull_tp_mult': 1.2672648238282607, 'bull_tsl_mult': 0.8214179122650779, 'bull_time_stop': 158, 'bull_use_sma': True, 'bull_use_ema': True, 'bull_use_atr': True, 'bull_use_adx': True, 'bull_use_spike': True, 'bull_rsi_required': True, 'bear_strategy': 'mean_reversion', 'bear_bb_std_mult': 2.516741072069618, 'bear_rsi_os': 33, 'bear_rsi_ob': 55, 'bear_adx_thresh': 30.624247793212625, 'bear_atr_min_pct': 0.002330544509869713, 'bear_atr_max_pct': 0.11787579643612009, 'bear_tp_mult': 2.1358886822377796, 'bear_tsl_mult': 0.13012498585854693, 'bear_time_stop': 84, 'bear_use_sma': True, 'bear_use_ema': True, 'bear_use_atr': False, 'bear_use_adx': False, 'bear_use_spike': True, 'bear_rsi_required': False, 'sideways_strategy': 'mean_reversion', 'sideways_bb_std_mult': 3.126050922628403, 'sideways_rsi_os': 43, 'sideways_rsi_ob': 74, 'sideways_adx_thresh': 25.414311920707412, 'sideways_atr_min_pct': 0.0037614937043626974, 'sideways_atr_max_pct': 0.11483322789640495, 'sideways_tp_mult': 2.3464609045483256, 'sideways_tsl_mult': 0.48878718048497, 'sideways_time_stop': 297, 'sideways_use_sma': False, 'sideways_use_ema': False, 'sideways_use_atr': True, 'sideways_use_adx': True, 'sideways_use_spike': False, 'sideways_rsi_required': True}.
[I 2025-09-01 14:38:19,513] Trial 492 finished with values: [-1000000000.0, 1000000000.0] and parameters: {'p_sma': 32, 'p_std': 30, 'p_atr': 26, 'p_adx': 24, 'rsi_period': 60, 'ema1': 23, 'ema2': 43, 'slip_atr_k': 0.12373322454791343, 'slip_spread_k': 0.5664201142494255, 'spread_hl_frac': 0.04868278530053834, 'bb_std_mult': 3.4281740501082796, 'rsi_os': 45, 'rsi_ob': 49, 'vol_spike': 0.11070123802579929, 'adx_thresh': 5.8449412294570235, 'atr_min_pct': 0.00848603747906098, 'atr_max_pct': 0.06693375476398566, 'tp_mult': 2.6159112173064774, 'tsl_mult': 0.5451901913295444, 'strategy': 'mean_reversion', 'time_stop': 144, 'use_sma': True, 'use_atr': False, 'use_adx': True, 'use_ema': True, 'use_spike': True, 'rsi_required': False, 'edge_k': 0.15016342818213357, 'edge_cap': 0.9448365556007553, 'bull_strategy': 'breakout', 'bull_bb_std_mult': 3.2195812217080606, 'bull_rsi_os': 28, 'bull_rsi_ob': 81, 'bull_adx_thresh': 17.63045487881234, 'bull_atr_min_pct': 0.007988628776168856, 'bull_atr_max_pct': 0.13488143847940925, 'bull_tp_mult': 1.5901155106650173, 'bull_tsl_mult': 0.41470130110982223, 'bull_time_stop': 146, 'bull_use_sma': True, 'bull_use_ema': True, 'bull_use_atr': True, 'bull_use_adx': True, 'bull_use_spike': True, 'bull_rsi_required': True, 'bear_strategy': 'mean_reversion', 'bear_bb_std_mult': 2.3873750263182267, 'bear_rsi_os': 35, 'bear_rsi_ob': 60, 'bear_adx_thresh': 8.11509623647124, 'bear_atr_min_pct': 0.0023705561315177943, 'bear_atr_max_pct': 0.029714600230317044, 'bear_tp_mult': 2.145044216422572, 'bear_tsl_mult': 0.17194861693284974, 'bear_time_stop': 112, 'bear_use_sma': True, 'bear_use_ema': True, 'bear_use_atr': False, 'bear_use_adx': False, 'bear_use_spike': True, 'bear_rsi_required': False, 'sideways_strategy': 'mean_reversion', 'sideways_bb_std_mult': 2.9814488915268886, 'sideways_rsi_os': 27, 'sideways_rsi_ob': 89, 'sideways_adx_thresh': 12.26372123210523, 'sideways_atr_min_pct': 0.003613435880177982, 'sideways_atr_max_pct': 0.10823964913887106, 'sideways_tp_mult': 1.960181401579174, 'sideways_tsl_mult': 0.4994208159288361, 'sideways_time_stop': 101, 'sideways_use_sma': False, 'sideways_use_ema': False, 'sideways_use_atr': True, 'sideways_use_adx': False, 'sideways_use_spike': False, 'sideways_rsi_required': True}.
[I 2025-09-01 14:38:58,898] Trial 490 finished with values: [-1000000000.0, 1000000000.0] and parameters: {'p_sma': 28, 'p_std': 26, 'p_atr': 29, 'p_adx': 9, 'rsi_period': 75, 'ema1': 8, 'ema2': 16, 'slip_atr_k': 4.197398135450878e-05, 'slip_spread_k': 0.5968773976634464, 'spread_hl_frac': 0.032418118628557244, 'bb_std_mult': 3.1584956010781218, 'rsi_os': 45, 'rsi_ob': 50, 'vol_spike': 0.2599598342853009, 'adx_thresh': 7.2834670940916615, 'atr_min_pct': 0.011367019365799468, 'atr_max_pct': 0.06655450323702611, 'tp_mult': 2.3173459119402677, 'tsl_mult': 0.6632288459971191, 'strategy': 'breakout', 'time_stop': 133, 'use_sma': True, 'use_atr': False, 'use_adx': False, 'use_ema': False, 'use_spike': True, 'rsi_required': True, 'edge_k': 0.32097775470722, 'edge_cap': 0.9647235964087527, 'bull_strategy': 'breakout', 'bull_bb_std_mult': 3.0309593652310896, 'bull_rsi_os': 16, 'bull_rsi_ob': 81, 'bull_adx_thresh': 9.97280614221365, 'bull_atr_min_pct': 0.013795116084481727, 'bull_atr_max_pct': 0.13387631510865824, 'bull_tp_mult': 1.7956191486619346, 'bull_tsl_mult': 0.4171848145572225, 'bull_time_stop': 157, 'bull_use_sma': False, 'bull_use_ema': True, 'bull_use_atr': True, 'bull_use_adx': True, 'bull_use_spike': False, 'bull_rsi_required': True, 'bear_strategy': 'breakout', 'bear_bb_std_mult': 1.3763860792418305, 'bear_rsi_os': 35, 'bear_rsi_ob': 55, 'bear_adx_thresh': 8.195793238412978, 'bear_atr_min_pct': 0.0026095325842270907, 'bear_atr_max_pct': 0.11450388659698069, 'bear_tp_mult': 1.6145864140244892, 'bear_tsl_mult': 0.12274844063000301, 'bear_time_stop': 84, 'bear_use_sma': False, 'bear_use_ema': False, 'bear_use_atr': True, 'bear_use_adx': False, 'bear_use_spike': True, 'bear_rsi_required': False, 'sideways_strategy': 'mean_reversion', 'sideways_bb_std_mult': 3.112412456121179, 'sideways_rsi_os': 27, 'sideways_rsi_ob': 51, 'sideways_adx_thresh': 25.459789571197263, 'sideways_atr_min_pct': 0.0037865795535435734, 'sideways_atr_max_pct': 0.11551606643846704, 'sideways_tp_mult': 2.34405679977754, 'sideways_tsl_mult': 0.35073388355975516, 'sideways_time_stop': 156, 'sideways_use_sma': True, 'sideways_use_ema': True, 'sideways_use_atr': True, 'sideways_use_adx': True, 'sideways_use_spike': False, 'sideways_rsi_required': True}.
[I 2025-09-01 14:39:00,124] Trial 493 finished with values: [-0.0024439548427662716, 0.006614812297291319] and parameters: {'p_sma': 38, 'p_std': 42, 'p_atr': 26, 'p_adx': 10, 'rsi_period': 79, 'ema1': 9, 'ema2': 10, 'slip_atr_k': 0.00019611942558419963, 'slip_spread_k': 0.5714474834449754, 'spread_hl_frac': 0.00669135041937434, 'bb_std_mult': 3.4756521129480005, 'rsi_os': 6, 'rsi_ob': 52, 'vol_spike': 0.16833692419849747, 'adx_thresh': 5.877309385908394, 'atr_min_pct': 0.01037846947580083, 'atr_max_pct': 0.04270074371497891, 'tp_mult': 2.6220246590120073, 'tsl_mult': 0.8782881125040938, 'strategy': 'mean_reversion', 'time_stop': 142, 'use_sma': False, 'use_atr': False, 'use_adx': True, 'use_ema': False, 'use_spike': True, 'rsi_required': True, 'edge_k': 1.8266353981696988, 'edge_cap': 0.05281457087387542, 'bull_strategy': 'breakout', 'bull_bb_std_mult': 3.0242779350652027, 'bull_rsi_os': 13, 'bull_rsi_ob': 87, 'bull_adx_thresh': 17.46371712362651, 'bull_atr_min_pct': 0.011954183356230044, 'bull_atr_max_pct': 0.13568059542844924, 'bull_tp_mult': 2.0931467559882364, 'bull_tsl_mult': 0.4168897017221893, 'bull_time_stop': 146, 'bull_use_sma': True, 'bull_use_ema': True, 'bull_use_atr': True, 'bull_use_adx': True, 'bull_use_spike': True, 'bull_rsi_required': True, 'bear_strategy': 'mean_reversion', 'bear_bb_std_mult': 2.5210938330118995, 'bear_rsi_os': 37, 'bear_rsi_ob': 83, 'bear_adx_thresh': 28.377490208178784, 'bear_atr_min_pct': 0.002306447535582746, 'bear_atr_max_pct': 0.04123819565786629, 'bear_tp_mult': 1.6005835344755868, 'bear_tsl_mult': 0.12670481205545225, 'bear_time_stop': 115, 'bear_use_sma': True, 'bear_use_ema': False, 'bear_use_atr': False, 'bear_use_adx': False, 'bear_use_spike': True, 'bear_rsi_required': False, 'sideways_strategy': 'mean_reversion', 'sideways_bb_std_mult': 2.9792860468658726, 'sideways_rsi_os': 55, 'sideways_rsi_ob': 89, 'sideways_adx_thresh': 27.218303116358122, 'sideways_atr_min_pct': 0.0036833724735795994, 'sideways_atr_max_pct': 0.10895176327592258, 'sideways_tp_mult': 2.440725470545404, 'sideways_tsl_mult': 0.1933050917500196, 'sideways_time_stop': 288, 'sideways_use_sma': True, 'sideways_use_ema': False, 'sideways_use_atr': True, 'sideways_use_adx': True, 'sideways_use_spike': False, 'sideways_rsi_required': False}.
[I 2025-09-01 14:39:03,482] Trial 494 finished with values: [-0.06859997166469334, 0.06871353533650433] and parameters: {'p_sma': 32, 'p_std': 21, 'p_atr': 28, 'p_adx': 8, 'rsi_period': 63, 'ema1': 25, 'ema2': 16, 'slip_atr_k': 0.10092689401915746, 'slip_spread_k': 0.22502160047053898, 'spread_hl_frac': 0.04516766838913448, 'bb_std_mult': 3.4829923755047556, 'rsi_os': 45, 'rsi_ob': 90, 'vol_spike': 0.11048960070101195, 'adx_thresh': 5.649239508967387, 'atr_min_pct': 0.010232203909252882, 'atr_max_pct': 0.054289710050757965, 'tp_mult': 1.382402201411016, 'tsl_mult': 0.45799904525146046, 'strategy': 'mean_reversion', 'time_stop': 131, 'use_sma': False, 'use_atr': False, 'use_adx': True, 'use_ema': True, 'use_spike': True, 'rsi_required': True, 'edge_k': 0.953233413948307, 'edge_cap': 0.9494121533993607, 'bull_strategy': 'breakout', 'bull_bb_std_mult': 2.3546204393646653, 'bull_rsi_os': 9, 'bull_rsi_ob': 79, 'bull_adx_thresh': 9.675207235727436, 'bull_atr_min_pct': 0.0014464082616519446, 'bull_atr_max_pct': 0.11859518775663377, 'bull_tp_mult': 2.0964385541084023, 'bull_tsl_mult': 0.41807165760530907, 'bull_time_stop': 142, 'bull_use_sma': True, 'bull_use_ema': True, 'bull_use_atr': True, 'bull_use_adx': True, 'bull_use_spike': True, 'bull_rsi_required': True, 'bear_strategy': 'mean_reversion', 'bear_bb_std_mult': 2.3808228176070756, 'bear_rsi_os': 37, 'bear_rsi_ob': 63, 'bear_adx_thresh': 16.338018611439658, 'bear_atr_min_pct': 0.004035132277035343, 'bear_atr_max_pct': 0.0415604618586695, 'bear_tp_mult': 1.6139533275623483, 'bear_tsl_mult': 0.625163491299472, 'bear_time_stop': 159, 'bear_use_sma': False, 'bear_use_ema': False, 'bear_use_atr': False, 'bear_use_adx': False, 'bear_use_spike': True, 'bear_rsi_required': False, 'sideways_strategy': 'mean_reversion', 'sideways_bb_std_mult': 3.4738416744305427, 'sideways_rsi_os': 27, 'sideways_rsi_ob': 58, 'sideways_adx_thresh': 12.572746828703263, 'sideways_atr_min_pct': 0.022889366135523597, 'sideways_atr_max_pct': 0.10810479691459837, 'sideways_tp_mult': 1.6517627873981033, 'sideways_tsl_mult': 0.24448613331232882, 'sideways_time_stop': 246, 'sideways_use_sma': True, 'sideways_use_ema': False, 'sideways_use_atr': True, 'sideways_use_adx': True, 'sideways_use_spike': False, 'sideways_rsi_required': False}.
