[I 2025-09-01 13:40:50,629] Trial 90 finished with values: [-1000000000.0, 1000000000.0] and parameters: {'p_sma': 31, 'p_std': 19, 'p_atr': 28, 'p_adx': 25, 'rsi_period': 20, 'ema1': 18, 'ema2': 47, 'slip_atr_k': 0.05926269069636883, 'slip_spread_k': 0.6005058858891472, 'spread_hl_frac': 0.015537815674192528, 'bb_std_mult': 0.8228946871825289, 'rsi_os': 44, 'rsi_ob': 65, 'vol_spike': 0.13331937762151616, 'adx_thresh': 20.29177521387357, 'atr_min_pct': 0.01681659681427265, 'atr_max_pct': 0.015211875385000032, 'tp_mult': 2.1636330121006955, 'tsl_mult': 0.016585528605438583, 'strategy': 'mean_reversion', 'time_stop': 162, 'use_sma': True, 'use_atr': True, 'use_adx': False, 'use_ema': True, 'use_spike': True, 'rsi_required': True, 'edge_k': 1.5391354115778184, 'edge_cap': 0.771388473408969, 'bull_strategy': 'mean_reversion', 'bull_bb_std_mult': 1.310284924160972, 'bull_rsi_os': 26, 'bull_rsi_ob': 61, 'bull_adx_thresh': 26.50013978809335, 'bull_atr_min_pct': 0.025458249366250598, 'bull_atr_max_pct': 0.07216710309388931, 'bull_tp_mult': 2.0766687774058283, 'bull_tsl_mult': 0.5833861312623457, 'bull_time_stop': 109, 'bull_use_sma': False, 'bull_use_ema': False, 'bull_use_atr': True, 'bull_use_adx': False, 'bull_use_spike': False, 'bull_rsi_required': False, 'bear_strategy': 'mean_reversion', 'bear_bb_std_mult': 3.121506073590017, 'bear_rsi_os': 41, 'bear_rsi_ob': 56, 'bear_adx_thresh': 28.24990245381443, 'bear_atr_min_pct': 0.004330145536133994, 'bear_atr_max_pct': 0.08433889022619705, 'bear_tp_mult': 1.6375963847872543, 'bear_tsl_mult': 0.32060884968491576, 'bear_time_stop': 56, 'bear_use_sma': True, 'bear_use_ema': True, 'bear_use_atr': False, 'bear_use_adx': True, 'bear_use_spike': True, 'bear_rsi_required': False, 'sideways_strategy': 'breakout', 'sideways_bb_std_mult': 1.834113338412554, 'sideways_rsi_os': 42, 'sideways_rsi_ob': 87, 'sideways_adx_thresh': 23.47737837724439, 'sideways_atr_min_pct': 0.0038873793236552327, 'sideways_atr_max_pct': 0.11521317436997422, 'sideways_tp_mult': 2.6000754990386743, 'sideways_tsl_mult': 0.9121152459491062, 'sideways_time_stop': 244, 'sideways_use_sma': False, 'sideways_use_ema': False, 'sideways_use_atr': False, 'sideways_use_adx': False, 'sideways_use_spike': True, 'sideways_rsi_required': True}.
[I 2025-09-01 13:41:30,134] Trial 92 finished with values: [-1000000000.0, 1000000000.0] and parameters: {'p_sma': 46, 'p_std': 24, 'p_atr': 29, 'p_adx': 26, 'rsi_period': 32, 'ema1': 17, 'ema2': 33, 'slip_atr_k': 0.05750697241714425, 'slip_spread_k': 0.5963896272664988, 'spread_hl_frac': 0.011822550845483098, 'bb_std_mult': 2.424720086647616, 'rsi_os': 47, 'rsi_ob': 64, 'vol_spike': 0.08129188665105098, 'adx_thresh': 34.99451478002183, 'atr_min_pct': 0.004237992718283521, 'atr_max_pct': 0.013469030022905795, 'tp_mult': 2.17091681637712, 'tsl_mult': 0.003351277830359725, 'strategy': 'mean_reversion', 'time_stop': 166, 'use_sma': True, 'use_atr': True, 'use_adx': True, 'use_ema': True, 'use_spike': True, 'rsi_required': False, 'edge_k': 0.10034408948850337, 'edge_cap': 0.7658065540982496, 'bull_strategy': 'mean_reversion', 'bull_bb_std_mult': 3.0869481337856226, 'bull_rsi_os': 7, 'bull_rsi_ob': 48, 'bull_adx_thresh': 13.464674404281075, 'bull_atr_min_pct': 0.025797945310971515, 'bull_atr_max_pct': 0.14288095158672076, 'bull_tp_mult': 2.085491413245337, 'bull_tsl_mult': 0.47511694120770337, 'bull_time_stop': 55, 'bull_use_sma': False, 'bull_use_ema': False, 'bull_use_atr': True, 'bull_use_adx': False, 'bull_use_spike': True, 'bull_rsi_required': True, 'bear_strategy': 'mean_reversion', 'bear_bb_std_mult': 3.1577403871658407, 'bear_rsi_os': 6, 'bear_rsi_ob': 57, 'bear_adx_thresh': 24.145254360559118, 'bear_atr_min_pct': 0.004288673563636652, 'bear_atr_max_pct': 0.06062851007226, 'bear_tp_mult': 1.8414372162241068, 'bear_tsl_mult': 0.6472482729487432, 'bear_time_stop': 55, 'bear_use_sma': True, 'bear_use_ema': False, 'bear_use_atr': False, 'bear_use_adx': True, 'bear_use_spike': True, 'bear_rsi_required': False, 'sideways_strategy': 'breakout', 'sideways_bb_std_mult': 3.3880887340119257, 'sideways_rsi_os': 42, 'sideways_rsi_ob': 83, 'sideways_adx_thresh': 21.383652461221295, 'sideways_atr_min_pct': 0.0031579676665720886, 'sideways_atr_max_pct': 0.11490975331085201, 'sideways_tp_mult': 2.606906791859007, 'sideways_tsl_mult': 0.033938846193608985, 'sideways_time_stop': 244, 'sideways_use_sma': False, 'sideways_use_ema': False, 'sideways_use_atr': False, 'sideways_use_adx': False, 'sideways_use_spike': True, 'sideways_rsi_required': True}.
[I 2025-09-01 13:41:30,617] Trial 93 finished with values: [-1000000000.0, 1000000000.0] and parameters: {'p_sma': 16, 'p_std': 24, 'p_atr': 27, 'p_adx': 26, 'rsi_period': 19, 'ema1': 17, 'ema2': 46, 'slip_atr_k': 0.053724035701849936, 'slip_spread_k': 0.6113756977445036, 'spread_hl_frac': 0.015795755149663658, 'bb_std_mult': 1.8642827350332551, 'rsi_os': 47, 'rsi_ob': 64, 'vol_spike': 0.044567841872406436, 'adx_thresh': 22.895402912292617, 'atr_min_pct': 0.010541216243771204, 'atr_max_pct': 0.12251408232276693, 'tp_mult': 1.9585364112367307, 'tsl_mult': 0.0001085561162166293, 'strategy': 'mean_reversion', 'time_stop': 213, 'use_sma': True, 'use_atr': True, 'use_adx': True, 'use_ema': True, 'use_spike': True, 'rsi_required': False, 'edge_k': 0.38543847512331486, 'edge_cap': 0.3217255617467828, 'bull_strategy': 'mean_reversion', 'bull_bb_std_mult': 1.3080737846006683, 'bull_rsi_os': 26, 'bull_rsi_ob': 48, 'bull_adx_thresh': 24.02192587949756, 'bull_atr_min_pct': 0.02738324651051502, 'bull_atr_max_pct': 0.13967580081169262, 'bull_tp_mult': 1.9008703376235134, 'bull_tsl_mult': 0.5758352164971035, 'bull_time_stop': 101, 'bull_use_sma': False, 'bull_use_ema': False, 'bull_use_atr': True, 'bull_use_adx': False, 'bull_use_spike': False, 'bull_rsi_required': False, 'bear_strategy': 'breakout', 'bear_bb_std_mult': 3.1227981000019023, 'bear_rsi_os': 12, 'bear_rsi_ob': 49, 'bear_adx_thresh': 28.02819222857765, 'bear_atr_min_pct': 0.004726534113795033, 'bear_atr_max_pct': 0.0683486160417845, 'bear_tp_mult': 1.8285013364387999, 'bear_tsl_mult': 0.32198298597069713, 'bear_time_stop': 55, 'bear_use_sma': True, 'bear_use_ema': False, 'bear_use_atr': False, 'bear_use_adx': True, 'bear_use_spike': True, 'bear_rsi_required': False, 'sideways_strategy': 'breakout', 'sideways_bb_std_mult': 0.7168824374255574, 'sideways_rsi_os': 42, 'sideways_rsi_ob': 77, 'sideways_adx_thresh': 29.14683498732606, 'sideways_atr_min_pct': 0.003418053448884243, 'sideways_atr_max_pct': 0.052321817903633855, 'sideways_tp_mult': 2.5840977659448594, 'sideways_tsl_mult': 0.799525232358024, 'sideways_time_stop': 246, 'sideways_use_sma': False, 'sideways_use_ema': False, 'sideways_use_atr': True, 'sideways_use_adx': False, 'sideways_use_spike': True, 'sideways_rsi_required': True}.
[I 2025-09-01 13:41:31,028] Trial 94 finished with values: [-0.08350765852733077, 0.08372245592536684] and parameters: {'p_sma': 12, 'p_std': 24, 'p_atr': 11, 'p_adx': 9, 'rsi_period': 32, 'ema1': 10, 'ema2': 42, 'slip_atr_k': 0.022130518380828135, 'slip_spread_k': 0.43603167824938543, 'spread_hl_frac': 0.011888887451677021, 'bb_std_mult': 1.8611593416414072, 'rsi_os': 47, 'rsi_ob': 68, 'vol_spike': 0.08066175756533689, 'adx_thresh': 25.575774533868753, 'atr_min_pct': 0.00705160123961567, 'atr_max_pct': 0.12553561978768168, 'tp_mult': 1.9391363863375402, 'tsl_mult': 0.10039190617649982, 'strategy': 'mean_reversion', 'time_stop': 230, 'use_sma': True, 'use_atr': True, 'use_adx': True, 'use_ema': True, 'use_spike': True, 'rsi_required': False, 'edge_k': 0.44487114429343766, 'edge_cap': 0.17325635748487023, 'bull_strategy': 'breakout', 'bull_bb_std_mult': 3.0362974773640343, 'bull_rsi_os': 20, 'bull_rsi_ob': 48, 'bull_adx_thresh': 13.181659821517927, 'bull_atr_min_pct': 0.004621002002217756, 'bull_atr_max_pct': 0.14095279802499233, 'bull_tp_mult': 2.6421660680427754, 'bull_tsl_mult': 0.47010016064551846, 'bull_time_stop': 100, 'bull_use_sma': False, 'bull_use_ema': False, 'bull_use_atr': True, 'bull_use_adx': False, 'bull_use_spike': False, 'bull_rsi_required': False, 'bear_strategy': 'breakout', 'bear_bb_std_mult': 3.1662943876876293, 'bear_rsi_os': 12, 'bear_rsi_ob': 49, 'bear_adx_thresh': 30.850226876478835, 'bear_atr_min_pct': 0.0009994011808919, 'bear_atr_max_pct': 0.07761879031870594, 'bear_tp_mult': 1.8293790805110897, 'bear_tsl_mult': 0.023508938243838984, 'bear_time_stop': 65, 'bear_use_sma': True, 'bear_use_ema': False, 'bear_use_atr': False, 'bear_use_adx': True, 'bear_use_spike': True, 'bear_rsi_required': False, 'sideways_strategy': 'breakout', 'sideways_bb_std_mult': 2.0538540730261237, 'sideways_rsi_os': 33, 'sideways_rsi_ob': 59, 'sideways_adx_thresh': 17.870119564030734, 'sideways_atr_min_pct': 0.016396627867207216, 'sideways_atr_max_pct': 0.05000513062564148, 'sideways_tp_mult': 1.5836311189476568, 'sideways_tsl_mult': 0.061347521379852055, 'sideways_time_stop': 196, 'sideways_use_sma': False, 'sideways_use_ema': False, 'sideways_use_atr': True, 'sideways_use_adx': False, 'sideways_use_spike': True, 'sideways_rsi_required': True}.
[I 2025-09-01 13:41:31,367] Trial 91 finished with values: [-1000000000.0, 1000000000.0] and parameters: {'p_sma': 16, 'p_std': 9, 'p_atr': 20, 'p_adx': 25, 'rsi_period': 20, 'ema1': 17, 'ema2': 34, 'slip_atr_k': 0.008378483645657513, 'slip_spread_k': 0.603389686253073, 'spread_hl_frac': 0.011176224134309265, 'bb_std_mult': 2.4607203174492507, 'rsi_os': 44, 'rsi_ob': 68, 'vol_spike': 0.12157292945218316, 'adx_thresh': 22.934229681576113, 'atr_min_pct': 0.011048630309151364, 'atr_max_pct': 0.014286750797561771, 'tp_mult': 2.1788504106888817, 'tsl_mult': 0.021082917916253316, 'strategy': 'mean_reversion', 'time_stop': 232, 'use_sma': True, 'use_atr': True, 'use_adx': False, 'use_ema': True, 'use_spike': True, 'rsi_required': True, 'edge_k': 1.0995915207458953, 'edge_cap': 0.7697572205513539, 'bull_strategy': 'mean_reversion', 'bull_bb_std_mult': 2.2246671022965847, 'bull_rsi_os': 26, 'bull_rsi_ob': 48, 'bull_adx_thresh': 26.25492969750909, 'bull_atr_min_pct': 0.02558667330077976, 'bull_atr_max_pct': 0.07136668812063812, 'bull_tp_mult': 1.3385303350230384, 'bull_tsl_mult': 0.5810820147647136, 'bull_time_stop': 110, 'bull_use_sma': False, 'bull_use_ema': False, 'bull_use_atr': True, 'bull_use_adx': False, 'bull_use_spike': False, 'bull_rsi_required': False, 'bear_strategy': 'mean_reversion', 'bear_bb_std_mult': 3.150049192928647, 'bear_rsi_os': 23, 'bear_rsi_ob': 57, 'bear_adx_thresh': 28.44615502585603, 'bear_atr_min_pct': 0.0035200642550984648, 'bear_atr_max_pct': 0.08476257644170831, 'bear_tp_mult': 1.9191839563565531, 'bear_tsl_mult': 0.08903454058993444, 'bear_time_stop': 55, 'bear_use_sma': True, 'bear_use_ema': True, 'bear_use_atr': False, 'bear_use_adx': True, 'bear_use_spike': True, 'bear_rsi_required': False, 'sideways_strategy': 'breakout', 'sideways_bb_std_mult': 2.5067129979066625, 'sideways_rsi_os': 42, 'sideways_rsi_ob': 87, 'sideways_adx_thresh': 23.32671315058899, 'sideways_atr_min_pct': 0.01800032769495347, 'sideways_atr_max_pct': 0.020147511199118277, 'sideways_tp_mult': 1.2339284437361597, 'sideways_tsl_mult': 0.00200918339587286, 'sideways_time_stop': 247, 'sideways_use_sma': False, 'sideways_use_ema': False, 'sideways_use_atr': False, 'sideways_use_adx': False, 'sideways_use_spike': True, 'sideways_rsi_required': True}.
[I 2025-09-01 13:41:31,737] Trial 96 finished with values: [-1000000000.0, 1000000000.0] and parameters: {'p_sma': 39, 'p_std': 8, 'p_atr': 19, 'p_adx': 29, 'rsi_period': 49, 'ema1': 30, 'ema2': 10, 'slip_atr_k': 0.022244179252979054, 'slip_spread_k': 0.42211751494080935, 'spread_hl_frac': 0.04782490784259452, 'bb_std_mult': 1.6936848237057762, 'rsi_os': 53, 'rsi_ob': 68, 'vol_spike': 0.29707991539223527, 'adx_thresh': 25.334824111374076, 'atr_min_pct': 0.01792563244616513, 'atr_max_pct': 0.01008915650216819, 'tp_mult': 1.352083575619662, 'tsl_mult': 0.1414688968790856, 'strategy': 'breakout', 'time_stop': 236, 'use_sma': True, 'use_atr': True, 'use_adx': False, 'use_ema': False, 'use_spike': True, 'rsi_required': False, 'edge_k': 0.45931020336087847, 'edge_cap': 0.16971699644250576, 'bull_strategy': 'breakout', 'bull_bb_std_mult': 2.237524162343992, 'bull_rsi_os': 20, 'bull_rsi_ob': 55, 'bull_adx_thresh': 23.189371554195798, 'bull_atr_min_pct': 0.0054820439955093805, 'bull_atr_max_pct': 0.12728127660127214, 'bull_tp_mult': 1.394403289728916, 'bull_tsl_mult': 0.5540992134774171, 'bull_time_stop': 65, 'bull_use_sma': False, 'bull_use_ema': True, 'bull_use_atr': False, 'bull_use_adx': True, 'bull_use_spike': False, 'bull_rsi_required': False, 'bear_strategy': 'breakout', 'bear_bb_std_mult': 2.480692561359557, 'bear_rsi_os': 17, 'bear_rsi_ob': 70, 'bear_adx_thresh': 7.451621183936149, 'bear_atr_min_pct': 0.0032336719133195047, 'bear_atr_max_pct': 0.07690473649045873, 'bear_tp_mult': 1.9309042804879135, 'bear_tsl_mult': 0.03009104061157508, 'bear_time_stop': 72, 'bear_use_sma': False, 'bear_use_ema': True, 'bear_use_atr': False, 'bear_use_adx': True, 'bear_use_spike': False, 'bear_rsi_required': True, 'sideways_strategy': 'mean_reversion', 'sideways_bb_std_mult': 2.0364146748378724, 'sideways_rsi_os': 31, 'sideways_rsi_ob': 59, 'sideways_adx_thresh': 30.555879325263152, 'sideways_atr_min_pct': 0.016415075286838103, 'sideways_atr_max_pct': 0.1328033339088298, 'sideways_tp_mult': 2.6859022230459875, 'sideways_tsl_mult': 0.4639166506105069, 'sideways_time_stop': 197, 'sideways_use_sma': False, 'sideways_use_ema': True, 'sideways_use_atr': True, 'sideways_use_adx': False, 'sideways_use_spike': False, 'sideways_rsi_required': False}.
[I 2025-09-01 13:42:12,920] Trial 97 finished with values: [-0.016613068158728872, 0.016769996920839365] and parameters: {'p_sma': 40, 'p_std': 8, 'p_atr': 20, 'p_adx': 29, 'rsi_period': 28, 'ema1': 30, 'ema2': 10, 'slip_atr_k': 0.007601936275422527, 'slip_spread_k': 0.5286837724485675, 'spread_hl_frac': 0.04774446533287385, 'bb_std_mult': 1.0927362896981525, 'rsi_os': 40, 'rsi_ob': 84, 'vol_spike': 0.07064712604012813, 'adx_thresh': 21.581926836037418, 'atr_min_pct': 0.017805939095810335, 'atr_max_pct': 0.1105753343088681, 'tp_mult': 1.1157046410046247, 'tsl_mult': 0.1495759899619348, 'strategy': 'breakout', 'time_stop': 142, 'use_sma': True, 'use_atr': True, 'use_adx': False, 'use_ema': False, 'use_spike': False, 'rsi_required': False, 'edge_k': 1.1033384091940575, 'edge_cap': 0.47072086723314416, 'bull_strategy': 'breakout', 'bull_bb_std_mult': 2.228561907469168, 'bull_rsi_os': 17, 'bull_rsi_ob': 93, 'bull_adx_thresh': 9.926103911749099, 'bull_atr_min_pct': 0.01863529573563192, 'bull_atr_max_pct': 0.14669495344442116, 'bull_tp_mult': 1.400134413917996, 'bull_tsl_mult': 0.6249848094178214, 'bull_time_stop': 5, 'bull_use_sma': True, 'bull_use_ema': True, 'bull_use_atr': False, 'bull_use_adx': True, 'bull_use_spike': False, 'bull_rsi_required': False, 'bear_strategy': 'breakout', 'bear_bb_std_mult': 2.9663469770802733, 'bear_rsi_os': 17, 'bear_rsi_ob': 54, 'bear_adx_thresh': 7.926559234025872, 'bear_atr_min_pct': 0.0030464653957060096, 'bear_atr_max_pct': 0.13509736803222044, 'bear_tp_mult': 1.922422724684189, 'bear_tsl_mult': 0.8713959755187761, 'bear_time_stop': 69, 'bear_use_sma': False, 'bear_use_ema': True, 'bear_use_atr': False, 'bear_use_adx': True, 'bear_use_spike': False, 'bear_rsi_required': True, 'sideways_strategy': 'mean_reversion', 'sideways_bb_std_mult': 0.5601102843096636, 'sideways_rsi_os': 32, 'sideways_rsi_ob': 66, 'sideways_adx_thresh': 28.93734712888177, 'sideways_atr_min_pct': 0.029989375018605595, 'sideways_atr_max_pct': 0.016131018767721356, 'sideways_tp_mult': 2.948597791961971, 'sideways_tsl_mult': 0.4956634191168767, 'sideways_time_stop': 258, 'sideways_use_sma': False, 'sideways_use_ema': True, 'sideways_use_atr': True, 'sideways_use_adx': False, 'sideways_use_spike': False, 'sideways_rsi_required': False}.
[I 2025-09-01 13:42:13,612] Trial 99 finished with values: [-0.05493562602690605, 0.05521635416216191] and parameters: {'p_sma': 20, 'p_std': 31, 'p_atr': 23, 'p_adx': 30, 'rsi_period': 29, 'ema1': 15, 'ema2': 27, 'slip_atr_k': 0.0067502607470192565, 'slip_spread_k': 0.5272750671783223, 'spread_hl_frac': 0.006513921420440897, 'bb_std_mult': 1.0931348674819783, 'rsi_os': 40, 'rsi_ob': 84, 'vol_spike': 0.10839610402855111, 'adx_thresh': 33.66737026383434, 'atr_min_pct': 0.020906097715801836, 'atr_max_pct': 0.11277372898050803, 'tp_mult': 1.0463654316959046, 'tsl_mult': 0.07762369218434961, 'strategy': 'breakout', 'time_stop': 43, 'use_sma': True, 'use_atr': False, 'use_adx': False, 'use_ema': False, 'use_spike': False, 'rsi_required': False, 'edge_k': 1.214970226840272, 'edge_cap': 0.3016975734435771, 'bull_strategy': 'breakout', 'bull_bb_std_mult': 1.4725150745083153, 'bull_rsi_os': 17, 'bull_rsi_ob': 51, 'bull_adx_thresh': 6.062982797347573, 'bull_atr_min_pct': 0.018840437878942747, 'bull_atr_max_pct': 0.11235243701846856, 'bull_tp_mult': 2.32939825344636, 'bull_tsl_mult': 0.605132371210969, 'bull_time_stop': 83, 'bull_use_sma': True, 'bull_use_ema': True, 'bull_use_atr': False, 'bull_use_adx': True, 'bull_use_spike': False, 'bull_rsi_required': True, 'bear_strategy': 'breakout', 'bear_bb_std_mult': 2.966911066208414, 'bear_rsi_os': 52, 'bear_rsi_ob': 52, 'bear_adx_thresh': 18.058002347771154, 'bear_atr_min_pct': 0.000216383479283439, 'bear_atr_max_pct': 0.13719375285192018, 'bear_tp_mult': 1.266856088713649, 'bear_tsl_mult': 0.07684186938846235, 'bear_time_stop': 262, 'bear_use_sma': False, 'bear_use_ema': True, 'bear_use_atr': False, 'bear_use_adx': False, 'bear_use_spike': False, 'bear_rsi_required': True, 'sideways_strategy': 'mean_reversion', 'sideways_bb_std_mult': 0.5453289045153545, 'sideways_rsi_os': 40, 'sideways_rsi_ob': 45, 'sideways_adx_thresh': 34.06860303500407, 'sideways_atr_min_pct': 0.013184263064229986, 'sideways_atr_max_pct': 0.026779497331006902, 'sideways_tp_mult': 2.9643631087386315, 'sideways_tsl_mult': 0.5825994146305826, 'sideways_time_stop': 258, 'sideways_use_sma': True, 'sideways_use_ema': True, 'sideways_use_atr': True, 'sideways_use_adx': True, 'sideways_use_spike': False, 'sideways_rsi_required': False}.
[I 2025-09-01 13:42:14,074] Trial 98 finished with values: [-0.08256747892074834, 0.08332186235060711] and parameters: {'p_sma': 55, 'p_std': 31, 'p_atr': 19, 'p_adx': 29, 'rsi_period': 28, 'ema1': 12, 'ema2': 27, 'slip_atr_k': 0.0676251877780377, 'slip_spread_k': 0.4970609866219546, 'spread_hl_frac': 0.047337480330388704, 'bb_std_mult': 1.0845826089083515, 'rsi_os': 7, 'rsi_ob': 84, 'vol_spike': 0.24099866569429132, 'adx_thresh': 14.973253370133694, 'atr_min_pct': 0.017867373812100035, 'atr_max_pct': 0.11192160342098975, 'tp_mult': 1.1719267768353427, 'tsl_mult': 0.9717423769551287, 'strategy': 'breakout', 'time_stop': 298, 'use_sma': True, 'use_atr': True, 'use_adx': False, 'use_ema': False, 'use_spike': False, 'rsi_required': False, 'edge_k': 1.1590713246828104, 'edge_cap': 0.27330466661822955, 'bull_strategy': 'breakout', 'bull_bb_std_mult': 1.4906176384384435, 'bull_rsi_os': 17, 'bull_rsi_ob': 51, 'bull_adx_thresh': 6.1590121663594175, 'bull_atr_min_pct': 0.005032178738402322, 'bull_atr_max_pct': 0.12775141685407707, 'bull_tp_mult': 1.4013414485220772, 'bull_tsl_mult': 0.5518203448275534, 'bull_time_stop': 24, 'bull_use_sma': True, 'bull_use_ema': True, 'bull_use_atr': False, 'bull_use_adx': True, 'bull_use_spike': False, 'bull_rsi_required': True, 'bear_strategy': 'breakout', 'bear_bb_std_mult': 2.493698255156567, 'bear_rsi_os': 17, 'bear_rsi_ob': 52, 'bear_adx_thresh': 7.581650861809106, 'bear_atr_min_pct': 0.0017138866007921812, 'bear_atr_max_pct': 0.13944712672267395, 'bear_tp_mult': 2.5819053268405763, 'bear_tsl_mult': 0.8926591658318784, 'bear_time_stop': 265, 'bear_use_sma': False, 'bear_use_ema': True, 'bear_use_atr': False, 'bear_use_adx': False, 'bear_use_spike': False, 'bear_rsi_required': True, 'sideways_strategy': 'mean_reversion', 'sideways_bb_std_mult': 1.438231944786175, 'sideways_rsi_os': 32, 'sideways_rsi_ob': 95, 'sideways_adx_thresh': 31.913390262520807, 'sideways_atr_min_pct': 0.013372723707159492, 'sideways_atr_max_pct': 0.10898679143924428, 'sideways_tp_mult': 2.7083281862009647, 'sideways_tsl_mult': 0.4389804298684164, 'sideways_time_stop': 259, 'sideways_use_sma': True, 'sideways_use_ema': True, 'sideways_use_atr': True, 'sideways_use_adx': False, 'sideways_use_spike': False, 'sideways_rsi_required': False}.
