[I 2025-09-01 13:59:59,630] Trial 224 finished with values: [-1000000000.0, 1000000000.0] and parameters: {'p_sma': 54, 'p_std': 27, 'p_atr': 7, 'p_adx': 28, 'rsi_period': 21, 'ema1': 9, 'ema2': 28, 'slip_atr_k': 0.0007705835655050114, 'slip_spread_k': 0.526394820402074, 'spread_hl_frac': 0.029053329526650185, 'bb_std_mult': 2.044635796029502, 'rsi_os': 28, 'rsi_ob': 74, 'vol_spike': 0.1392600736649458, 'adx_thresh': 23.296590304629145, 'atr_min_pct': 0.02235992492124832, 'atr_max_pct': 0.07897321893361109, 'tp_mult': 1.6598078830674627, 'tsl_mult': 0.053514449770718495, 'strategy': 'breakout', 'time_stop': 94, 'use_sma': True, 'use_atr': True, 'use_adx': False, 'use_ema': False, 'use_spike': True, 'rsi_required': False, 'edge_k': 1.179681233944787, 'edge_cap': 0.29797604367256014, 'bull_strategy': 'mean_reversion', 'bull_bb_std_mult': 1.2240575718489883, 'bull_rsi_os': 16, 'bull_rsi_ob': 54, 'bull_adx_thresh': 10.71369329280555, 'bull_atr_min_pct': 0.013047702071056896, 'bull_atr_max_pct': 0.10952017694577337, 'bull_tp_mult': 1.3765991023735564, 'bull_tsl_mult': 0.01665196254658341, 'bull_time_stop': 90, 'bull_use_sma': False, 'bull_use_ema': False, 'bull_use_atr': False, 'bull_use_adx': True, 'bull_use_spike': False, 'bull_rsi_required': False, 'bear_strategy': 'breakout', 'bear_bb_std_mult': 1.426211733802488, 'bear_rsi_os': 14, 'bear_rsi_ob': 51, 'bear_adx_thresh': 5.745520121354945, 'bear_atr_min_pct': 0.005684135016773647, 'bear_atr_max_pct': 0.06980569918164894, 'bear_tp_mult': 2.295763608669999, 'bear_tsl_mult': 0.19969910166544236, 'bear_time_stop': 50, 'bear_use_sma': False, 'bear_use_ema': True, 'bear_use_atr': False, 'bear_use_adx': True, 'bear_use_spike': False, 'bear_rsi_required': True, 'sideways_strategy': 'breakout', 'sideways_bb_std_mult': 0.7688869525133178, 'sideways_rsi_os': 40, 'sideways_rsi_ob': 88, 'sideways_adx_thresh': 29.815803972376305, 'sideways_atr_min_pct': 0.015181159520086803, 'sideways_atr_max_pct': 0.12248496665472283, 'sideways_tp_mult': 1.9957925526515419, 'sideways_tsl_mult': 0.7452786484121254, 'sideways_time_stop': 79, 'sideways_use_sma': False, 'sideways_use_ema': True, 'sideways_use_atr': False, 'sideways_use_adx': False, 'sideways_use_spike': True, 'sideways_rsi_required': True}.
[I 2025-09-01 14:00:37,258] Trial 226 finished with values: [-1000000000.0, 1000000000.0] and parameters: {'p_sma': 10, 'p_std': 26, 'p_atr': 12, 'p_adx': 28, 'rsi_period': 39, 'ema1': 23, 'ema2': 27, 'slip_atr_k': 0.2159977964084646, 'slip_spread_k': 0.020252719678969744, 'spread_hl_frac': 0.00675945720111952, 'bb_std_mult': 1.9831376934484606, 'rsi_os': 14, 'rsi_ob': 72, 'vol_spike': 0.2233192460589309, 'adx_thresh': 23.39191305740149, 'atr_min_pct': 0.005083409423869681, 'atr_max_pct': 0.08042692421360546, 'tp_mult': 1.9344885344206932, 'tsl_mult': 0.025703608186010817, 'strategy': 'breakout', 'time_stop': 86, 'use_sma': True, 'use_atr': True, 'use_adx': False, 'use_ema': False, 'use_spike': True, 'rsi_required': False, 'edge_k': 1.6436420256221977, 'edge_cap': 0.2983511284989683, 'bull_strategy': 'mean_reversion', 'bull_bb_std_mult': 1.3035674498351728, 'bull_rsi_os': 15, 'bull_rsi_ob': 63, 'bull_adx_thresh': 30.400132977894177, 'bull_atr_min_pct': 0.011937611904808942, 'bull_atr_max_pct': 0.11427719932796042, 'bull_tp_mult': 2.5857681058041253, 'bull_tsl_mult': 0.5813322273656973, 'bull_time_stop': 92, 'bull_use_sma': False, 'bull_use_ema': False, 'bull_use_atr': False, 'bull_use_adx': True, 'bull_use_spike': False, 'bull_rsi_required': False, 'bear_strategy': 'breakout', 'bear_bb_std_mult': 1.9387907023282789, 'bear_rsi_os': 14, 'bear_rsi_ob': 56, 'bear_adx_thresh': 34.16395542042544, 'bear_atr_min_pct': 0.015463750254431252, 'bear_atr_max_pct': 0.0676835496168559, 'bear_tp_mult': 2.303339266028081, 'bear_tsl_mult': 0.6257559539429922, 'bear_time_stop': 65, 'bear_use_sma': True, 'bear_use_ema': True, 'bear_use_atr': False, 'bear_use_adx': True, 'bear_use_spike': False, 'bear_rsi_required': True, 'sideways_strategy': 'breakout', 'sideways_bb_std_mult': 0.8500420622242483, 'sideways_rsi_os': 40, 'sideways_rsi_ob': 88, 'sideways_adx_thresh': 29.735092859564617, 'sideways_atr_min_pct': 0.010564696453177976, 'sideways_atr_max_pct': 0.14579481876472655, 'sideways_tp_mult': 1.397989317320492, 'sideways_tsl_mult': 0.7557480496626824, 'sideways_time_stop': 153, 'sideways_use_sma': False, 'sideways_use_ema': True, 'sideways_use_atr': False, 'sideways_use_adx': False, 'sideways_use_spike': True, 'sideways_rsi_required': True}.
[I 2025-09-01 14:00:37,274] Trial 228 finished with values: [-1000000000.0, 1000000000.0] and parameters: {'p_sma': 12, 'p_std': 39, 'p_atr': 30, 'p_adx': 21, 'rsi_period': 26, 'ema1': 10, 'ema2': 28, 'slip_atr_k': 0.2357642605931025, 'slip_spread_k': 0.5571946783859411, 'spread_hl_frac': 0.03599990454151789, 'bb_std_mult': 1.9760682223977883, 'rsi_os': 6, 'rsi_ob': 72, 'vol_spike': 0.13887490331647773, 'adx_thresh': 22.242372980943575, 'atr_min_pct': 0.01594673098153519, 'atr_max_pct': 0.01880449354099161, 'tp_mult': 1.5599601859420698, 'tsl_mult': 0.024540104035876645, 'strategy': 'breakout', 'time_stop': 96, 'use_sma': False, 'use_atr': True, 'use_adx': False, 'use_ema': False, 'use_spike': True, 'rsi_required': False, 'edge_k': 1.27585891978495, 'edge_cap': 0.8604110968595433, 'bull_strategy': 'breakout', 'bull_bb_std_mult': 1.2947521194822569, 'bull_rsi_os': 17, 'bull_rsi_ob': 46, 'bull_adx_thresh': 11.662911514957838, 'bull_atr_min_pct': 0.012523498930275812, 'bull_atr_max_pct': 0.012660321433820287, 'bull_tp_mult': 1.4448309200958667, 'bull_tsl_mult': 0.5599171110973664, 'bull_time_stop': 99, 'bull_use_sma': False, 'bull_use_ema': True, 'bull_use_atr': False, 'bull_use_adx': True, 'bull_use_spike': False, 'bull_rsi_required': False, 'bear_strategy': 'breakout', 'bear_bb_std_mult': 3.11529676731163, 'bear_rsi_os': 13, 'bear_rsi_ob': 53, 'bear_adx_thresh': 34.17376273657297, 'bear_atr_min_pct': 0.005475670387222094, 'bear_atr_max_pct': 0.05281285745387404, 'bear_tp_mult': 2.246704128130694, 'bear_tsl_mult': 0.5672475575578576, 'bear_time_stop': 65, 'bear_use_sma': False, 'bear_use_ema': True, 'bear_use_atr': True, 'bear_use_adx': True, 'bear_use_spike': False, 'bear_rsi_required': True, 'sideways_strategy': 'breakout', 'sideways_bb_std_mult': 0.7019507856750024, 'sideways_rsi_os': 37, 'sideways_rsi_ob': 86, 'sideways_adx_thresh': 27.731902466955994, 'sideways_atr_min_pct': 0.010689116053635445, 'sideways_atr_max_pct': 0.08156660802054058, 'sideways_tp_mult': 2.9930258533831915, 'sideways_tsl_mult': 0.7154131712051113, 'sideways_time_stop': 292, 'sideways_use_sma': False, 'sideways_use_ema': True, 'sideways_use_atr': True, 'sideways_use_adx': False, 'sideways_use_spike': True, 'sideways_rsi_required': False}.
[I 2025-09-01 14:00:37,765] Trial 229 finished with values: [-0.028864738655168365, 0.030050313396526675] and parameters: {'p_sma': 38, 'p_std': 40, 'p_atr': 7, 'p_adx': 26, 'rsi_period': 26, 'ema1': 16, 'ema2': 27, 'slip_atr_k': 0.10127112033678824, 'slip_spread_k': 0.5566126298549141, 'spread_hl_frac': 0.007730559586002685, 'bb_std_mult': 1.9609598006176303, 'rsi_os': 40, 'rsi_ob': 73, 'vol_spike': 0.29446971039186737, 'adx_thresh': 22.44586898581216, 'atr_min_pct': 0.0032344954999030777, 'atr_max_pct': 0.040067932529074986, 'tp_mult': 1.572000602450904, 'tsl_mult': 0.020838799329906253, 'strategy': 'mean_reversion', 'time_stop': 200, 'use_sma': False, 'use_atr': True, 'use_adx': True, 'use_ema': False, 'use_spike': True, 'rsi_required': False, 'edge_k': 0.4843605672534931, 'edge_cap': 0.6828722563348869, 'bull_strategy': 'breakout', 'bull_bb_std_mult': 1.323013637933301, 'bull_rsi_os': 17, 'bull_rsi_ob': 90, 'bull_adx_thresh': 11.584632353167967, 'bull_atr_min_pct': 0.010491111606467974, 'bull_atr_max_pct': 0.013264539010997806, 'bull_tp_mult': 1.443447335289727, 'bull_tsl_mult': 0.1401722205197271, 'bull_time_stop': 83, 'bull_use_sma': False, 'bull_use_ema': True, 'bull_use_atr': False, 'bull_use_adx': True, 'bull_use_spike': True, 'bull_rsi_required': False, 'bear_strategy': 'breakout', 'bear_bb_std_mult': 2.8640133621485484, 'bear_rsi_os': 13, 'bear_rsi_ob': 53, 'bear_adx_thresh': 5.004956985936459, 'bear_atr_min_pct': 0.0037799019390443293, 'bear_atr_max_pct': 0.06627038853245262, 'bear_tp_mult': 1.9641029320263146, 'bear_tsl_mult': 0.18056870558327737, 'bear_time_stop': 63, 'bear_use_sma': True, 'bear_use_ema': False, 'bear_use_atr': True, 'bear_use_adx': True, 'bear_use_spike': True, 'bear_rsi_required': False, 'sideways_strategy': 'breakout', 'sideways_bb_std_mult': 0.6806324153590858, 'sideways_rsi_os': 27, 'sideways_rsi_ob': 63, 'sideways_adx_thresh': 28.42913427030136, 'sideways_atr_min_pct': 0.01660913204703714, 'sideways_atr_max_pct': 0.08243340692309806, 'sideways_tp_mult': 2.9872860976148425, 'sideways_tsl_mult': 0.2045152168734053, 'sideways_time_stop': 200, 'sideways_use_sma': False, 'sideways_use_ema': True, 'sideways_use_atr': True, 'sideways_use_adx': True, 'sideways_use_spike': False, 'sideways_rsi_required': False}.
[I 2025-09-01 14:00:38,194] Trial 227 finished with values: [-1000000000.0, 1000000000.0] and parameters: {'p_sma': 37, 'p_std': 26, 'p_atr': 17, 'p_adx': 28, 'rsi_period': 26, 'ema1': 23, 'ema2': 27, 'slip_atr_k': 0.006433981021375457, 'slip_spread_k': 0.5602277525186309, 'spread_hl_frac': 0.008700999365396174, 'bb_std_mult': 2.00754825677431, 'rsi_os': 47, 'rsi_ob': 72, 'vol_spike': 0.0920036603768763, 'adx_thresh': 22.34519853106672, 'atr_min_pct': 0.018356076950623766, 'atr_max_pct': 0.08019915694867938, 'tp_mult': 2.2455982295799775, 'tsl_mult': 0.07066822959831892, 'strategy': 'breakout', 'time_stop': 47, 'use_sma': False, 'use_atr': True, 'use_adx': False, 'use_ema': False, 'use_spike': True, 'rsi_required': False, 'edge_k': 1.1950312693097187, 'edge_cap': 0.880647825577479, 'bull_strategy': 'breakout', 'bull_bb_std_mult': 1.2958494873697992, 'bull_rsi_os': 16, 'bull_rsi_ob': 63, 'bull_adx_thresh': 10.562562507776825, 'bull_atr_min_pct': 0.012261219714301703, 'bull_atr_max_pct': 0.1102377029159384, 'bull_tp_mult': 1.4413105068702028, 'bull_tsl_mult': 0.5657796521341951, 'bull_time_stop': 79, 'bull_use_sma': False, 'bull_use_ema': False, 'bull_use_atr': False, 'bull_use_adx': True, 'bull_use_spike': False, 'bull_rsi_required': False, 'bear_strategy': 'breakout', 'bear_bb_std_mult': 3.12759264860087, 'bear_rsi_os': 13, 'bear_rsi_ob': 87, 'bear_adx_thresh': 5.743256539168307, 'bear_atr_min_pct': 0.0055512023053200105, 'bear_atr_max_pct': 0.06761443892374959, 'bear_tp_mult': 2.4139737290372016, 'bear_tsl_mult': 0.5671510286023893, 'bear_time_stop': 67, 'bear_use_sma': True, 'bear_use_ema': True, 'bear_use_atr': True, 'bear_use_adx': True, 'bear_use_spike': False, 'bear_rsi_required': True, 'sideways_strategy': 'breakout', 'sideways_bb_std_mult': 0.6882793034589734, 'sideways_rsi_os': 37, 'sideways_rsi_ob': 74, 'sideways_adx_thresh': 9.727370232830816, 'sideways_atr_min_pct': 0.01652013101224997, 'sideways_atr_max_pct': 0.14504112734904567, 'sideways_tp_mult': 1.7390705188452071, 'sideways_tsl_mult': 0.7553539292505016, 'sideways_time_stop': 181, 'sideways_use_sma': False, 'sideways_use_ema': True, 'sideways_use_atr': True, 'sideways_use_adx': False, 'sideways_use_spike': True, 'sideways_rsi_required': False}.
[I 2025-09-01 14:00:38,835] Trial 233 finished with values: [-1000000000.0, 1000000000.0] and parameters: {'p_sma': 5, 'p_std': 28, 'p_atr': 9, 'p_adx': 10, 'rsi_period': 29, 'ema1': 6, 'ema2': 30, 'slip_atr_k': 0.13390032560869114, 'slip_spread_k': 0.8715511918503773, 'spread_hl_frac': 0.037834172592983294, 'bb_std_mult': 2.8115488175146224, 'rsi_os': 51, 'rsi_ob': 73, 'vol_spike': 0.102975212383856, 'adx_thresh': 11.457393607037917, 'atr_min_pct': 0.025166958877417267, 'atr_max_pct': 0.11621518689364349, 'tp_mult': 1.4781294274383834, 'tsl_mult': 0.3819996208376832, 'strategy': 'mean_reversion', 'time_stop': 131, 'use_sma': True, 'use_atr': False, 'use_adx': True, 'use_ema': True, 'use_spike': True, 'rsi_required': True, 'edge_k': 0.08701878642124294, 'edge_cap': 0.27573889477451075, 'bull_strategy': 'breakout', 'bull_bb_std_mult': 1.3564384036030825, 'bull_rsi_os': 30, 'bull_rsi_ob': 51, 'bull_adx_thresh': 27.305091594230856, 'bull_atr_min_pct': 0.010593834660089776, 'bull_atr_max_pct': 0.08769113994625645, 'bull_tp_mult': 2.977900772060367, 'bull_tsl_mult': 0.13294590928341354, 'bull_time_stop': 75, 'bull_use_sma': False, 'bull_use_ema': True, 'bull_use_atr': True, 'bull_use_adx': True, 'bull_use_spike': True, 'bull_rsi_required': False, 'bear_strategy': 'mean_reversion', 'bear_bb_std_mult': 3.3722476592027495, 'bear_rsi_os': 10, 'bear_rsi_ob': 53, 'bear_adx_thresh': 6.613889058688233, 'bear_atr_min_pct': 0.003698300322711248, 'bear_atr_max_pct': 0.06285931592948199, 'bear_tp_mult': 1.8110055490234684, 'bear_tsl_mult': 0.18016204234870206, 'bear_time_stop': 130, 'bear_use_sma': False, 'bear_use_ema': False, 'bear_use_atr': False, 'bear_use_adx': True, 'bear_use_spike': True, 'bear_rsi_required': False, 'sideways_strategy': 'mean_reversion', 'sideways_bb_std_mult': 0.850956742069916, 'sideways_rsi_os': 35, 'sideways_rsi_ob': 94, 'sideways_adx_thresh': 28.53850256887926, 'sideways_atr_min_pct': 0.0036870454965993726, 'sideways_atr_max_pct': 0.11738939702770215, 'sideways_tp_mult': 2.7405820912405185, 'sideways_tsl_mult': 0.8123276286490644, 'sideways_time_stop': 109, 'sideways_use_sma': False, 'sideways_use_ema': False, 'sideways_use_atr': True, 'sideways_use_adx': True, 'sideways_use_spike': False, 'sideways_rsi_required': False}.
[I 2025-09-01 14:00:38,851] Trial 231 finished with values: [-1000000000.0, 1000000000.0] and parameters: {'p_sma': 8, 'p_std': 25, 'p_atr': 18, 'p_adx': 10, 'rsi_period': 48, 'ema1': 16, 'ema2': 30, 'slip_atr_k': 0.007406581450673522, 'slip_spread_k': 0.4861513731227716, 'spread_hl_frac': 0.03797843887655034, 'bb_std_mult': 1.925876842318407, 'rsi_os': 51, 'rsi_ob': 76, 'vol_spike': 0.10511229366933188, 'adx_thresh': 33.39170468453719, 'atr_min_pct': 0.01744588818928242, 'atr_max_pct': 0.04053314714122175, 'tp_mult': 1.8547599613312584, 'tsl_mult': 0.49522020226996155, 'strategy': 'mean_reversion', 'time_stop': 190, 'use_sma': False, 'use_atr': False, 'use_adx': True, 'use_ema': True, 'use_spike': True, 'rsi_required': True, 'edge_k': 0.3686194444056998, 'edge_cap': 0.614672599962735, 'bull_strategy': 'breakout', 'bull_bb_std_mult': 1.3554737652907625, 'bull_rsi_os': 5, 'bull_rsi_ob': 90, 'bull_adx_thresh': 27.135121565917817, 'bull_atr_min_pct': 0.010396446581169864, 'bull_atr_max_pct': 0.02924723809663294, 'bull_tp_mult': 1.4683295148028306, 'bull_tsl_mult': 0.8610116002899009, 'bull_time_stop': 77, 'bull_use_sma': False, 'bull_use_ema': True, 'bull_use_atr': True, 'bull_use_adx': False, 'bull_use_spike': True, 'bull_rsi_required': False, 'bear_strategy': 'mean_reversion', 'bear_bb_std_mult': 3.4521426287357526, 'bear_rsi_os': 23, 'bear_rsi_ob': 54, 'bear_adx_thresh': 5.013900475100235, 'bear_atr_min_pct': 0.004244442410749163, 'bear_atr_max_pct': 0.07491309430102193, 'bear_tp_mult': 1.8148402754919164, 'bear_tsl_mult': 0.18217393508816793, 'bear_time_stop': 60, 'bear_use_sma': False, 'bear_use_ema': False, 'bear_use_atr': True, 'bear_use_adx': True, 'bear_use_spike': True, 'bear_rsi_required': False, 'sideways_strategy': 'mean_reversion', 'sideways_bb_std_mult': 0.6737095325521535, 'sideways_rsi_os': 27, 'sideways_rsi_ob': 45, 'sideways_adx_thresh': 28.435797108532434, 'sideways_atr_min_pct': 0.016871814809739268, 'sideways_atr_max_pct': 0.10330970372138841, 'sideways_tp_mult': 2.110396383650852, 'sideways_tsl_mult': 0.8110267728323963, 'sideways_time_stop': 184, 'sideways_use_sma': False, 'sideways_use_ema': True, 'sideways_use_atr': True, 'sideways_use_adx': True, 'sideways_use_spike': False, 'sideways_rsi_required': False}.
[I 2025-09-01 14:01:12,824] Trial 232 finished with values: [-1000000000.0, 1000000000.0] and parameters: {'p_sma': 5, 'p_std': 16, 'p_atr': 7, 'p_adx': 26, 'rsi_period': 48, 'ema1': 6, 'ema2': 30, 'slip_atr_k': 0.12890144779160298, 'slip_spread_k': 0.6229484626430711, 'spread_hl_frac': 0.03939907173833422, 'bb_std_mult': 1.9089043158083787, 'rsi_os': 46, 'rsi_ob': 75, 'vol_spike': 0.12424131101357358, 'adx_thresh': 11.27698138818099, 'atr_min_pct': 0.0009160442260714649, 'atr_max_pct': 0.12331394292493672, 'tp_mult': 1.9695157839695414, 'tsl_mult': 0.09935492468756005, 'strategy': 'mean_reversion', 'time_stop': 131, 'use_sma': True, 'use_atr': False, 'use_adx': True, 'use_ema': True, 'use_spike': True, 'rsi_required': True, 'edge_k': 1.1127223902738472, 'edge_cap': 0.27873154747848305, 'bull_strategy': 'breakout', 'bull_bb_std_mult': 1.8029641220882524, 'bull_rsi_os': 22, 'bull_rsi_ob': 95, 'bull_adx_thresh': 26.9668008009512, 'bull_atr_min_pct': 0.01074395189532388, 'bull_atr_max_pct': 0.0378733871075735, 'bull_tp_mult': 1.7172707409125747, 'bull_tsl_mult': 0.132481192038937, 'bull_time_stop': 266, 'bull_use_sma': False, 'bull_use_ema': True, 'bull_use_atr': True, 'bull_use_adx': True, 'bull_use_spike': True, 'bull_rsi_required': False, 'bear_strategy': 'mean_reversion', 'bear_bb_std_mult': 3.4547076926330837, 'bear_rsi_os': 10, 'bear_rsi_ob': 67, 'bear_adx_thresh': 12.300680718352098, 'bear_atr_min_pct': 0.0037676927346274943, 'bear_atr_max_pct': 0.06319762063096065, 'bear_tp_mult': 1.8123522829457268, 'bear_tsl_mult': 0.17991474836165336, 'bear_time_stop': 61, 'bear_use_sma': False, 'bear_use_ema': False, 'bear_use_atr': False, 'bear_use_adx': True, 'bear_use_spike': True, 'bear_rsi_required': False, 'sideways_strategy': 'mean_reversion', 'sideways_bb_std_mult': 0.8441173098900099, 'sideways_rsi_os': 51, 'sideways_rsi_ob': 86, 'sideways_adx_thresh': 28.538544635858884, 'sideways_atr_min_pct': 0.013539300017931305, 'sideways_atr_max_pct': 0.06663388292715547, 'sideways_tp_mult': 2.3207947273722533, 'sideways_tsl_mult': 0.20528053281915587, 'sideways_time_stop': 61, 'sideways_use_sma': False, 'sideways_use_ema': False, 'sideways_use_atr': True, 'sideways_use_adx': True, 'sideways_use_spike': False, 'sideways_rsi_required': False}.
[I 2025-09-01 14:01:13,870] Trial 230 finished with values: [-1000000000.0, 1000000000.0] and parameters: {'p_sma': 38, 'p_std': 25, 'p_atr': 18, 'p_adx': 10, 'rsi_period': 32, 'ema1': 26, 'ema2': 30, 'slip_atr_k': 0.13069537203735512, 'slip_spread_k': 0.0733649568782449, 'spread_hl_frac': 0.017885245175602887, 'bb_std_mult': 1.9512734719160758, 'rsi_os': 47, 'rsi_ob': 72, 'vol_spike': 0.12416409672825528, 'adx_thresh': 20.956328930213044, 'atr_min_pct': 0.01743918922784966, 'atr_max_pct': 0.11509481138411132, 'tp_mult': 1.4877547377480846, 'tsl_mult': 0.09033741102734512, 'strategy': 'mean_reversion', 'time_stop': 187, 'use_sma': False, 'use_atr': False, 'use_adx': True, 'use_ema': True, 'use_spike': True, 'rsi_required': True, 'edge_k': 0.3730766816417699, 'edge_cap': 0.7524819542374952, 'bull_strategy': 'breakout', 'bull_bb_std_mult': 1.8058156735375774, 'bull_rsi_os': 52, 'bull_rsi_ob': 95, 'bull_adx_thresh': 31.589635584240852, 'bull_atr_min_pct': 0.010484523661850407, 'bull_atr_max_pct': 0.03833989372029004, 'bull_tp_mult': 1.474960332246022, 'bull_tsl_mult': 0.5604958515799097, 'bull_time_stop': 60, 'bull_use_sma': False, 'bull_use_ema': True, 'bull_use_atr': True, 'bull_use_adx': False, 'bull_use_spike': True, 'bull_rsi_required': False, 'bear_strategy': 'mean_reversion', 'bear_bb_std_mult': 0.9467478738780886, 'bear_rsi_os': 10, 'bear_rsi_ob': 66, 'bear_adx_thresh': 29.054623097576545, 'bear_atr_min_pct': 0.018070704097022897, 'bear_atr_max_pct': 0.06360763489119875, 'bear_tp_mult': 2.632755181408324, 'bear_tsl_mult': 0.1548318265822089, 'bear_time_stop': 139, 'bear_use_sma': False, 'bear_use_ema': False, 'bear_use_atr': True, 'bear_use_adx': True, 'bear_use_spike': True, 'bear_rsi_required': False, 'sideways_strategy': 'mean_reversion', 'sideways_bb_std_mult': 0.6855809203992628, 'sideways_rsi_os': 28, 'sideways_rsi_ob': 63, 'sideways_adx_thresh': 28.459178904519625, 'sideways_atr_min_pct': 0.01663994507651976, 'sideways_atr_max_pct': 0.11773743167737086, 'sideways_tp_mult': 1.7353322747159357, 'sideways_tsl_mult': 0.6789814462218728, 'sideways_time_stop': 247, 'sideways_use_sma': False, 'sideways_use_ema': True, 'sideways_use_atr': True, 'sideways_use_adx': True, 'sideways_use_spike': False, 'sideways_rsi_required': False}.
