[I 2025-09-01 13:56:48,014] Trial 196 finished with values: [-1000000000.0, 1000000000.0] and parameters: {'p_sma': 13, 'p_std': 23, 'p_atr': 7, 'p_adx': 26, 'rsi_period': 68, 'ema1': 10, 'ema2': 24, 'slip_atr_k': 0.005249900204244659, 'slip_spread_k': 0.5453416850560671, 'spread_hl_frac': 0.008129814384748878, 'bb_std_mult': 2.9933619915451786, 'rsi_os': 55, 'rsi_ob': 66, 'vol_spike': 0.2841987661261167, 'adx_thresh': 22.525352036382216, 'atr_min_pct': 0.017252169559120515, 'atr_max_pct': 0.018177330619309977, 'tp_mult': 2.709226572235647, 'tsl_mult': 0.306816211002531, 'strategy': 'breakout', 'time_stop': 111, 'use_sma': True, 'use_atr': True, 'use_adx': False, 'use_ema': False, 'use_spike': True, 'rsi_required': False, 'edge_k': 1.2625601760153742, 'edge_cap': 0.1444389495362785, 'bull_strategy': 'breakout', 'bull_bb_std_mult': 1.460606708463362, 'bull_rsi_os': 42, 'bull_rsi_ob': 51, 'bull_adx_thresh': 25.74775534390433, 'bull_atr_min_pct': 0.02609601460659104, 'bull_atr_max_pct': 0.12254727033876456, 'bull_tp_mult': 2.208681501370688, 'bull_tsl_mult': 0.5948176266723942, 'bull_time_stop': 209, 'bull_use_sma': False, 'bull_use_ema': True, 'bull_use_atr': False, 'bull_use_adx': True, 'bull_use_spike': False, 'bull_rsi_required': False, 'bear_strategy': 'breakout', 'bear_bb_std_mult': 2.8026213516847527, 'bear_rsi_os': 15, 'bear_rsi_ob': 50, 'bear_adx_thresh': 13.623453016998592, 'bear_atr_min_pct': 0.004927686065299157, 'bear_atr_max_pct': 0.07314675154384959, 'bear_tp_mult': 1.922103993346018, 'bear_tsl_mult': 0.11422124891274853, 'bear_time_stop': 70, 'bear_use_sma': False, 'bear_use_ema': True, 'bear_use_atr': False, 'bear_use_adx': True, 'bear_use_spike': False, 'bear_rsi_required': False, 'sideways_strategy': 'breakout', 'sideways_bb_std_mult': 2.79070468153718, 'sideways_rsi_os': 24, 'sideways_rsi_ob': 85, 'sideways_adx_thresh': 22.766458988424947, 'sideways_atr_min_pct': 0.014794973544650552, 'sideways_atr_max_pct': 0.11988235046337552, 'sideways_tp_mult': 2.481548137507333, 'sideways_tsl_mult': 0.7682327382942749, 'sideways_time_stop': 226, 'sideways_use_sma': False, 'sideways_use_ema': True, 'sideways_use_atr': True, 'sideways_use_adx': False, 'sideways_use_spike': False, 'sideways_rsi_required': False}.
[I 2025-09-01 13:56:48,587] Trial 198 finished with values: [-1000000000.0, 1000000000.0] and parameters: {'p_sma': 13, 'p_std': 27, 'p_atr': 14, 'p_adx': 26, 'rsi_period': 82, 'ema1': 7, 'ema2': 24, 'slip_atr_k': 0.17643648511223947, 'slip_spread_k': 0.9066726917348933, 'spread_hl_frac': 0.007912250181336504, 'bb_std_mult': 2.649016581328113, 'rsi_os': 52, 'rsi_ob': 88, 'vol_spike': 0.28285063583958336, 'adx_thresh': 23.79263195802915, 'atr_min_pct': 0.017098372205685112, 'atr_max_pct': 0.018921991479108575, 'tp_mult': 1.8276710777942367, 'tsl_mult': 0.45097894481139933, 'strategy': 'breakout', 'time_stop': 31, 'use_sma': True, 'use_atr': True, 'use_adx': False, 'use_ema': False, 'use_spike': True, 'rsi_required': False, 'edge_k': 1.2768878580032734, 'edge_cap': 0.14870581397548654, 'bull_strategy': 'breakout', 'bull_bb_std_mult': 2.860335302926491, 'bull_rsi_os': 39, 'bull_rsi_ob': 56, 'bull_adx_thresh': 11.736591605988131, 'bull_atr_min_pct': 0.010265922400693243, 'bull_atr_max_pct': 0.09673359847547709, 'bull_tp_mult': 1.4960238267877854, 'bull_tsl_mult': 0.5867417401222425, 'bull_time_stop': 92, 'bull_use_sma': False, 'bull_use_ema': True, 'bull_use_atr': False, 'bull_use_adx': True, 'bull_use_spike': False, 'bull_rsi_required': False, 'bear_strategy': 'breakout', 'bear_bb_std_mult': 2.802106358833558, 'bear_rsi_os': 15, 'bear_rsi_ob': 53, 'bear_adx_thresh': 6.241004146801463, 'bear_atr_min_pct': 0.014449816206299277, 'bear_atr_max_pct': 0.044151065462842795, 'bear_tp_mult': 2.863639590245567, 'bear_tsl_mult': 0.11409998028123852, 'bear_time_stop': 124, 'bear_use_sma': False, 'bear_use_ema': True, 'bear_use_atr': True, 'bear_use_adx': True, 'bear_use_spike': False, 'bear_rsi_required': False, 'sideways_strategy': 'breakout', 'sideways_bb_std_mult': 1.2882253465037405, 'sideways_rsi_os': 36, 'sideways_rsi_ob': 60, 'sideways_adx_thresh': 30.079254315961418, 'sideways_atr_min_pct': 0.014735930382918086, 'sideways_atr_max_pct': 0.06169911619710068, 'sideways_tp_mult': 2.485637714405201, 'sideways_tsl_mult': 0.6987435729979911, 'sideways_time_stop': 231, 'sideways_use_sma': False, 'sideways_use_ema': True, 'sideways_use_atr': True, 'sideways_use_adx': False, 'sideways_use_spike': False, 'sideways_rsi_required': False}.
[I 2025-09-01 13:56:49,161] Trial 200 finished with values: [-1000000000.0, 1000000000.0] and parameters: {'p_sma': 11, 'p_std': 28, 'p_atr': 24, 'p_adx': 27, 'rsi_period': 42, 'ema1': 8, 'ema2': 32, 'slip_atr_k': 0.1251089109502102, 'slip_spread_k': 0.5128311276507946, 'spread_hl_frac': 0.011072511270027402, 'bb_std_mult': 0.8683901898463688, 'rsi_os': 34, 'rsi_ob': 83, 'vol_spike': 0.06827870921425977, 'adx_thresh': 23.786349568425223, 'atr_min_pct': 0.019567767375579536, 'atr_max_pct': 0.020239186755523334, 'tp_mult': 2.5378156382839188, 'tsl_mult': 0.173522700387704, 'strategy': 'breakout', 'time_stop': 122, 'use_sma': True, 'use_atr': True, 'use_adx': False, 'use_ema': False, 'use_spike': True, 'rsi_required': False, 'edge_k': 0.4224863503393512, 'edge_cap': 0.11460294928459545, 'bull_strategy': 'breakout', 'bull_bb_std_mult': 2.9186021659449732, 'bull_rsi_os': 39, 'bull_rsi_ob': 57, 'bull_adx_thresh': 19.590427927471026, 'bull_atr_min_pct': 0.011503335884524683, 'bull_atr_max_pct': 0.11776538324969077, 'bull_tp_mult': 2.199616413977344, 'bull_tsl_mult': 0.5423237936813597, 'bull_time_stop': 140, 'bull_use_sma': False, 'bull_use_ema': True, 'bull_use_atr': False, 'bull_use_adx': True, 'bull_use_spike': False, 'bull_rsi_required': True, 'bear_strategy': 'breakout', 'bear_bb_std_mult': 3.186548820709696, 'bear_rsi_os': 30, 'bear_rsi_ob': 55, 'bear_adx_thresh': 6.250522863971207, 'bear_atr_min_pct': 0.02263574691338893, 'bear_atr_max_pct': 0.07281556614676066, 'bear_tp_mult': 1.532019848078791, 'bear_tsl_mult': 0.07487439703966366, 'bear_time_stop': 283, 'bear_use_sma': False, 'bear_use_ema': True, 'bear_use_atr': False, 'bear_use_adx': True, 'bear_use_spike': False, 'bear_rsi_required': True, 'sideways_strategy': 'breakout', 'sideways_bb_std_mult': 0.5051575068712141, 'sideways_rsi_os': 47, 'sideways_rsi_ob': 87, 'sideways_adx_thresh': 5.041138463778065, 'sideways_atr_min_pct': 0.008728846715672525, 'sideways_atr_max_pct': 0.07545449482317942, 'sideways_tp_mult': 1.1283887979399103, 'sideways_tsl_mult': 0.3034157897508111, 'sideways_time_stop': 252, 'sideways_use_sma': False, 'sideways_use_ema': True, 'sideways_use_atr': True, 'sideways_use_adx': False, 'sideways_use_spike': False, 'sideways_rsi_required': False}.
[I 2025-09-01 13:56:49,771] Trial 201 finished with values: [-1000000000.0, 1000000000.0] and parameters: {'p_sma': 11, 'p_std': 29, 'p_atr': 8, 'p_adx': 19, 'rsi_period': 23, 'ema1': 24, 'ema2': 32, 'slip_atr_k': 0.03424401281655132, 'slip_spread_k': 0.6868795711755071, 'spread_hl_frac': 0.010944162538000199, 'bb_std_mult': 3.3817865642018643, 'rsi_os': 10, 'rsi_ob': 79, 'vol_spike': 0.1320854595153107, 'adx_thresh': 20.53800203486214, 'atr_min_pct': 0.01556278857942667, 'atr_max_pct': 0.013418668027981837, 'tp_mult': 1.9625128640084195, 'tsl_mult': 0.1788482918287811, 'strategy': 'breakout', 'time_stop': 76, 'use_sma': True, 'use_atr': True, 'use_adx': False, 'use_ema': False, 'use_spike': True, 'rsi_required': False, 'edge_k': 0.17176636212750274, 'edge_cap': 0.20303700581212875, 'bull_strategy': 'breakout', 'bull_bb_std_mult': 2.7776820654310574, 'bull_rsi_os': 35, 'bull_rsi_ob': 65, 'bull_adx_thresh': 21.303340694203428, 'bull_atr_min_pct': 0.01170034814058041, 'bull_atr_max_pct': 0.11764217235388617, 'bull_tp_mult': 1.5881908141956083, 'bull_tsl_mult': 0.54822781803665, 'bull_time_stop': 31, 'bull_use_sma': True, 'bull_use_ema': True, 'bull_use_atr': False, 'bull_use_adx': True, 'bull_use_spike': False, 'bull_rsi_required': True, 'bear_strategy': 'breakout', 'bear_bb_std_mult': 3.1921638172612625, 'bear_rsi_os': 32, 'bear_rsi_ob': 54, 'bear_adx_thresh': 5.971484808353187, 'bear_atr_min_pct': 0.01885011960085086, 'bear_atr_max_pct': 0.06606310275199304, 'bear_tp_mult': 1.464633931765798, 'bear_tsl_mult': 0.18501835003518607, 'bear_time_stop': 39, 'bear_use_sma': True, 'bear_use_ema': True, 'bear_use_atr': False, 'bear_use_adx': False, 'bear_use_spike': False, 'bear_rsi_required': True, 'sideways_strategy': 'breakout', 'sideways_bb_std_mult': 0.6643451620382791, 'sideways_rsi_os': 47, 'sideways_rsi_ob': 54, 'sideways_adx_thresh': 27.875488633196955, 'sideways_atr_min_pct': 0.01557282685852721, 'sideways_atr_max_pct': 0.09182050024861876, 'sideways_tp_mult': 1.142182567586982, 'sideways_tsl_mult': 0.31456204145720396, 'sideways_time_stop': 250, 'sideways_use_sma': True, 'sideways_use_ema': False, 'sideways_use_atr': True, 'sideways_use_adx': False, 'sideways_use_spike': False, 'sideways_rsi_required': False}.
[I 2025-09-01 13:56:49,967] Trial 205 finished with values: [-1000000000.0, 1000000000.0] and parameters: {'p_sma': 48, 'p_std': 25, 'p_atr': 7, 'p_adx': 27, 'rsi_period': 26, 'ema1': 9, 'ema2': 28, 'slip_atr_k': 0.04148193613292636, 'slip_spread_k': 0.2905411358626828, 'spread_hl_frac': 0.04418586757346124, 'bb_std_mult': 2.116876822315682, 'rsi_os': 45, 'rsi_ob': 58, 'vol_spike': 0.12368872076479184, 'adx_thresh': 15.705662848606279, 'atr_min_pct': 0.026299677677166445, 'atr_max_pct': 0.025021846355277197, 'tp_mult': 1.998342752193268, 'tsl_mult': 0.01694859179601678, 'strategy': 'breakout', 'time_stop': 88, 'use_sma': True, 'use_atr': False, 'use_adx': True, 'use_ema': True, 'use_spike': True, 'rsi_required': True, 'edge_k': 1.9323149041424736, 'edge_cap': 0.23317221442010752, 'bull_strategy': 'breakout', 'bull_bb_std_mult': 3.1785202739586045, 'bull_rsi_os': 17, 'bull_rsi_ob': 52, 'bull_adx_thresh': 8.760282989672733, 'bull_atr_min_pct': 0.010886376673043619, 'bull_atr_max_pct': 0.13643044966199278, 'bull_tp_mult': 1.3991643944715544, 'bull_tsl_mult': 0.571542671392213, 'bull_time_stop': 132, 'bull_use_sma': True, 'bull_use_ema': True, 'bull_use_atr': True, 'bull_use_adx': False, 'bull_use_spike': False, 'bull_rsi_required': False, 'bear_strategy': 'breakout', 'bear_bb_std_mult': 3.2441502763104584, 'bear_rsi_os': 11, 'bear_rsi_ob': 74, 'bear_adx_thresh': 5.068776644105638, 'bear_atr_min_pct': 0.004098079550804235, 'bear_atr_max_pct': 0.0891870863470771, 'bear_tp_mult': 1.963472539719122, 'bear_tsl_mult': 0.36431926207555737, 'bear_time_stop': 54, 'bear_use_sma': True, 'bear_use_ema': True, 'bear_use_atr': False, 'bear_use_adx': True, 'bear_use_spike': False, 'bear_rsi_required': True, 'sideways_strategy': 'breakout', 'sideways_bb_std_mult': 0.8947826129588538, 'sideways_rsi_os': 34, 'sideways_rsi_ob': 85, 'sideways_adx_thresh': 5.946145288592344, 'sideways_atr_min_pct': 0.026290184421257884, 'sideways_atr_max_pct': 0.016482319763665487, 'sideways_tp_mult': 2.9093175960259536, 'sideways_tsl_mult': 0.5852019481529065, 'sideways_time_stop': 246, 'sideways_use_sma': False, 'sideways_use_ema': True, 'sideways_use_atr': True, 'sideways_use_adx': False, 'sideways_use_spike': False, 'sideways_rsi_required': False}.
[I 2025-09-01 13:57:26,179] Trial 204 finished with values: [0.0011607168223495279, 0.006085498896643547] and parameters: {'p_sma': 47, 'p_std': 30, 'p_atr': 8, 'p_adx': 19, 'rsi_period': 23, 'ema1': 7, 'ema2': 28, 'slip_atr_k': 0.007087585077303969, 'slip_spread_k': 0.5349516465244265, 'spread_hl_frac': 0.00910786560742387, 'bb_std_mult': 2.090095523254972, 'rsi_os': 45, 'rsi_ob': 78, 'vol_spike': 0.037461139471379676, 'adx_thresh': 20.720006511209228, 'atr_min_pct': 0.01282011809190901, 'atr_max_pct': 0.06622684295324024, 'tp_mult': 1.9490129189991516, 'tsl_mult': 0.01089055089796627, 'strategy': 'breakout', 'time_stop': 90, 'use_sma': True, 'use_atr': True, 'use_adx': True, 'use_ema': False, 'use_spike': True, 'rsi_required': False, 'edge_k': 1.2022703817643956, 'edge_cap': 0.2302989295570271, 'bull_strategy': 'breakout', 'bull_bb_std_mult': 2.0738957420358037, 'bull_rsi_os': 35, 'bull_rsi_ob': 65, 'bull_adx_thresh': 21.225290154559595, 'bull_atr_min_pct': 0.012211843088375869, 'bull_atr_max_pct': 0.0830102488426854, 'bull_tp_mult': 2.0180190222003818, 'bull_tsl_mult': 0.3621857341718506, 'bull_time_stop': 115, 'bull_use_sma': True, 'bull_use_ema': True, 'bull_use_atr': False, 'bull_use_adx': False, 'bull_use_spike': False, 'bull_rsi_required': True, 'bear_strategy': 'breakout', 'bear_bb_std_mult': 1.3595855044891603, 'bear_rsi_os': 11, 'bear_rsi_ob': 55, 'bear_adx_thresh': 5.467043339889973, 'bear_atr_min_pct': 0.004105741363075068, 'bear_atr_max_pct': 0.09010034743249574, 'bear_tp_mult': 1.3449723783776517, 'bear_tsl_mult': 0.18542840053001747, 'bear_time_stop': 210, 'bear_use_sma': True, 'bear_use_ema': True, 'bear_use_atr': False, 'bear_use_adx': False, 'bear_use_spike': False, 'bear_rsi_required': True, 'sideways_strategy': 'breakout', 'sideways_bb_std_mult': 0.65419367531462, 'sideways_rsi_os': 34, 'sideways_rsi_ob': 55, 'sideways_adx_thresh': 28.237143191496617, 'sideways_atr_min_pct': 0.02648228921749205, 'sideways_atr_max_pct': 0.09052668501494486, 'sideways_tp_mult': 1.1879987632970028, 'sideways_tsl_mult': 0.7405399207243929, 'sideways_time_stop': 245, 'sideways_use_sma': False, 'sideways_use_ema': False, 'sideways_use_atr': True, 'sideways_use_adx': False, 'sideways_use_spike': False, 'sideways_rsi_required': False}.
[I 2025-09-01 13:57:26,658] Trial 202 finished with values: [-1000000000.0, 1000000000.0] and parameters: {'p_sma': 11, 'p_std': 29, 'p_atr': 23, 'p_adx': 19, 'rsi_period': 26, 'ema1': 28, 'ema2': 32, 'slip_atr_k': 7.046691174188331e-07, 'slip_spread_k': 0.2937655395896429, 'spread_hl_frac': 0.01058718234136321, 'bb_std_mult': 2.0980547302141033, 'rsi_os': 35, 'rsi_ob': 95, 'vol_spike': 0.13183016032956069, 'adx_thresh': 21.130733400163077, 'atr_min_pct': 0.015607555585502919, 'atr_max_pct': 0.024531214652306194, 'tp_mult': 2.541846476578829, 'tsl_mult': 0.17792494679375975, 'strategy': 'breakout', 'time_stop': 89, 'use_sma': True, 'use_atr': True, 'use_adx': False, 'use_ema': False, 'use_spike': True, 'rsi_required': False, 'edge_k': 1.1394321425621594, 'edge_cap': 0.22802575416759466, 'bull_strategy': 'breakout', 'bull_bb_std_mult': 3.3774514008465544, 'bull_rsi_os': 46, 'bull_rsi_ob': 65, 'bull_adx_thresh': 18.98085510725912, 'bull_atr_min_pct': 0.011702486527315089, 'bull_atr_max_pct': 0.1373365795420216, 'bull_tp_mult': 1.3954352703533663, 'bull_tsl_mult': 0.5443722684403927, 'bull_time_stop': 32, 'bull_use_sma': True, 'bull_use_ema': True, 'bull_use_atr': False, 'bull_use_adx': True, 'bull_use_spike': False, 'bull_rsi_required': True, 'bear_strategy': 'breakout', 'bear_bb_std_mult': 2.9027744152343007, 'bear_rsi_os': 12, 'bear_rsi_ob': 55, 'bear_adx_thresh': 6.1571881870829746, 'bear_atr_min_pct': 0.0043458113738794124, 'bear_atr_max_pct': 0.09023520632744672, 'bear_tp_mult': 2.073034263013429, 'bear_tsl_mult': 0.18353444534035662, 'bear_time_stop': 211, 'bear_use_sma': True, 'bear_use_ema': True, 'bear_use_atr': False, 'bear_use_adx': False, 'bear_use_spike': False, 'bear_rsi_required': True, 'sideways_strategy': 'breakout', 'sideways_bb_std_mult': 0.653778675279069, 'sideways_rsi_os': 49, 'sideways_rsi_ob': 55, 'sideways_adx_thresh': 28.181334077432826, 'sideways_atr_min_pct': 0.026379299373021706, 'sideways_atr_max_pct': 0.01709558177158907, 'sideways_tp_mult': 1.9119120395150717, 'sideways_tsl_mult': 0.7453416101898263, 'sideways_time_stop': 252, 'sideways_use_sma': True, 'sideways_use_ema': False, 'sideways_use_atr': True, 'sideways_use_adx': False, 'sideways_use_spike': False, 'sideways_rsi_required': False}.
[I 2025-09-01 13:57:26,871] Trial 203 finished with values: [-1000000000.0, 1000000000.0] and parameters: {'p_sma': 11, 'p_std': 28, 'p_atr': 23, 'p_adx': 19, 'rsi_period': 26, 'ema1': 28, 'ema2': 32, 'slip_atr_k': 0.1683156923438478, 'slip_spread_k': 0.5155493281460155, 'spread_hl_frac': 0.01122215669728966, 'bb_std_mult': 3.395640030130762, 'rsi_os': 37, 'rsi_ob': 48, 'vol_spike': 0.2668848957624429, 'adx_thresh': 16.205473294303157, 'atr_min_pct': 0.019757870144828348, 'atr_max_pct': 0.023977342455769945, 'tp_mult': 1.9551577348560865, 'tsl_mult': 0.190862220675041, 'strategy': 'breakout', 'time_stop': 75, 'use_sma': True, 'use_atr': True, 'use_adx': False, 'use_ema': False, 'use_spike': True, 'rsi_required': False, 'edge_k': 1.936943301351003, 'edge_cap': 0.7845875320034277, 'bull_strategy': 'breakout', 'bull_bb_std_mult': 1.085690773095701, 'bull_rsi_os': 35, 'bull_rsi_ob': 85, 'bull_adx_thresh': 29.364039244862816, 'bull_atr_min_pct': 0.011950808546407779, 'bull_atr_max_pct': 0.13622171301272984, 'bull_tp_mult': 2.4708027240604324, 'bull_tsl_mult': 0.5539306006753009, 'bull_time_stop': 69, 'bull_use_sma': True, 'bull_use_ema': True, 'bull_use_atr': False, 'bull_use_adx': True, 'bull_use_spike': False, 'bull_rsi_required': True, 'bear_strategy': 'breakout', 'bear_bb_std_mult': 3.1832948513530575, 'bear_rsi_os': 31, 'bear_rsi_ob': 55, 'bear_adx_thresh': 6.054092364278241, 'bear_atr_min_pct': 0.022363332787825756, 'bear_atr_max_pct': 0.0948360467510694, 'bear_tp_mult': 1.3685610073995416, 'bear_tsl_mult': 0.07204971715476922, 'bear_time_stop': 38, 'bear_use_sma': True, 'bear_use_ema': True, 'bear_use_atr': False, 'bear_use_adx': False, 'bear_use_spike': False, 'bear_rsi_required': True, 'sideways_strategy': 'breakout', 'sideways_bb_std_mult': 1.6771553299127522, 'sideways_rsi_os': 47, 'sideways_rsi_ob': 87, 'sideways_adx_thresh': 34.69820461551862, 'sideways_atr_min_pct': 0.00906701939250266, 'sideways_atr_max_pct': 0.015172417737943228, 'sideways_tp_mult': 2.9018328661583808, 'sideways_tsl_mult': 0.739336796198536, 'sideways_time_stop': 251, 'sideways_use_sma': True, 'sideways_use_ema': False, 'sideways_use_atr': True, 'sideways_use_adx': False, 'sideways_use_spike': False, 'sideways_rsi_required': False}.
[I 2025-09-01 13:57:27,478] Trial 206 finished with values: [-1000000000.0, 1000000000.0] and parameters: {'p_sma': 12, 'p_std': 30, 'p_atr': 8, 'p_adx': 14, 'rsi_period': 27, 'ema1': 8, 'ema2': 48, 'slip_atr_k': 0.008080485543305161, 'slip_spread_k': 0.0998623969525762, 'spread_hl_frac': 0.023926260433515045, 'bb_std_mult': 2.013737167093824, 'rsi_os': 44, 'rsi_ob': 86, 'vol_spike': 0.2702550351887473, 'adx_thresh': 29.588567164122207, 'atr_min_pct': 0.012744831819714593, 'atr_max_pct': 0.1201493657209187, 'tp_mult': 1.9602537632955708, 'tsl_mult': 0.5352428636141318, 'strategy': 'breakout', 'time_stop': 91, 'use_sma': False, 'use_atr': True, 'use_adx': False, 'use_ema': False, 'use_spike': True, 'rsi_required': False, 'edge_k': 0.32104222039094366, 'edge_cap': 0.27724276804992004, 'bull_strategy': 'breakout', 'bull_bb_std_mult': 3.1000971161342115, 'bull_rsi_os': 20, 'bull_rsi_ob': 76, 'bull_adx_thresh': 11.214132486156172, 'bull_atr_min_pct': 0.012493132492675973, 'bull_atr_max_pct': 0.10745473712040585, 'bull_tp_mult': 2.027375922909139, 'bull_tsl_mult': 0.7329282139593755, 'bull_time_stop': 87, 'bull_use_sma': False, 'bull_use_ema': True, 'bull_use_atr': False, 'bull_use_adx': False, 'bull_use_spike': False, 'bull_rsi_required': False, 'bear_strategy': 'breakout', 'bear_bb_std_mult': 2.950711580422741, 'bear_rsi_os': 14, 'bear_rsi_ob': 85, 'bear_adx_thresh': 18.92611665802516, 'bear_atr_min_pct': 0.012686030432415181, 'bear_atr_max_pct': 0.030168329379310965, 'bear_tp_mult': 1.3595165228784176, 'bear_tsl_mult': 0.193802655117615, 'bear_time_stop': 210, 'bear_use_sma': False, 'bear_use_ema': True, 'bear_use_atr': True, 'bear_use_adx': True, 'bear_use_spike': False, 'bear_rsi_required': True, 'sideways_strategy': 'mean_reversion', 'sideways_bb_std_mult': 2.3630580783412656, 'sideways_rsi_os': 37, 'sideways_rsi_ob': 87, 'sideways_adx_thresh': 29.050444823675, 'sideways_atr_min_pct': 0.009600954719555205, 'sideways_atr_max_pct': 0.14943628587791116, 'sideways_tp_mult': 2.562247836266057, 'sideways_tsl_mult': 0.7365796695320295, 'sideways_time_stop': 240, 'sideways_use_sma': False, 'sideways_use_ema': True, 'sideways_use_atr': True, 'sideways_use_adx': False, 'sideways_use_spike': True, 'sideways_rsi_required': False}.
