[I 2025-09-01 14:21:45,399] Trial 368 finished with values: [-1000000000.0, 1000000000.0] and parameters: {'p_sma': 30, 'p_std': 44, 'p_atr': 13, 'p_adx': 9, 'rsi_period': 79, 'ema1': 14, 'ema2': 59, 'slip_atr_k': 0.030417926532215898, 'slip_spread_k': 0.6211597147454159, 'spread_hl_frac': 0.006556232935487898, 'bb_std_mult': 3.064927393419649, 'rsi_os': 43, 'rsi_ob': 53, 'vol_spike': 0.13148159903113404, 'adx_thresh': 25.708328220974508, 'atr_min_pct': 0.010725264871236281, 'atr_max_pct': 0.08345245233365635, 'tp_mult': 2.718158466679839, 'tsl_mult': 0.6379311568804087, 'strategy': 'mean_reversion', 'time_stop': 211, 'use_sma': True, 'use_atr': False, 'use_adx': True, 'use_ema': True, 'use_spike': True, 'rsi_required': True, 'edge_k': 0.28822312825991786, 'edge_cap': 0.9809101333867629, 'bull_strategy': 'mean_reversion', 'bull_bb_std_mult': 3.101471733352355, 'bull_rsi_os': 53, 'bull_rsi_ob': 59, 'bull_adx_thresh': 6.318074185221233, 'bull_atr_min_pct': 0.012180483053259127, 'bull_atr_max_pct': 0.03995387240149157, 'bull_tp_mult': 2.1845480188723916, 'bull_tsl_mult': 0.4942325254108305, 'bull_time_stop': 36, 'bull_use_sma': True, 'bull_use_ema': True, 'bull_use_atr': True, 'bull_use_adx': True, 'bull_use_spike': True, 'bull_rsi_required': True, 'bear_strategy': 'mean_reversion', 'bear_bb_std_mult': 2.367405247558732, 'bear_rsi_os': 36, 'bear_rsi_ob': 57, 'bear_adx_thresh': 18.38344646332761, 'bear_atr_min_pct': 0.01931332560855917, 'bear_atr_max_pct': 0.038789786296959394, 'bear_tp_mult': 2.5920980646699903, 'bear_tsl_mult': 0.4684728493495885, 'bear_time_stop': 98, 'bear_use_sma': False, 'bear_use_ema': False, 'bear_use_atr': True, 'bear_use_adx': False, 'bear_use_spike': True, 'bear_rsi_required': False, 'sideways_strategy': 'mean_reversion', 'sideways_bb_std_mult': 2.982479071025953, 'sideways_rsi_os': 33, 'sideways_rsi_ob': 90, 'sideways_adx_thresh': 22.81479034323974, 'sideways_atr_min_pct': 0.004385998302869824, 'sideways_atr_max_pct': 0.11288266560539839, 'sideways_tp_mult': 1.7823179105818945, 'sideways_tsl_mult': 0.6149822634231438, 'sideways_time_stop': 259, 'sideways_use_sma': True, 'sideways_use_ema': False, 'sideways_use_atr': True, 'sideways_use_adx': True, 'sideways_use_spike': True, 'sideways_rsi_required': False}.
[I 2025-09-01 14:21:45,939] Trial 371 finished with values: [-1000000000.0, 1000000000.0] and parameters: {'p_sma': 34, 'p_std': 35, 'p_atr': 25, 'p_adx': 9, 'rsi_period': 79, 'ema1': 10, 'ema2': 59, 'slip_atr_k': 0.014512498020196864, 'slip_spread_k': 0.6264974609868919, 'spread_hl_frac': 0.04587475315048266, 'bb_std_mult': 3.490289825061919, 'rsi_os': 41, 'rsi_ob': 60, 'vol_spike': 0.12862666791891061, 'adx_thresh': 32.27349345205372, 'atr_min_pct': 0.009172932700994486, 'atr_max_pct': 0.0416683216345653, 'tp_mult': 2.955946107266407, 'tsl_mult': 0.6556201106288196, 'strategy': 'mean_reversion', 'time_stop': 105, 'use_sma': True, 'use_atr': False, 'use_adx': True, 'use_ema': True, 'use_spike': False, 'rsi_required': True, 'edge_k': 0.3036231437953211, 'edge_cap': 0.9769821168496257, 'bull_strategy': 'mean_reversion', 'bull_bb_std_mult': 0.5038129290037561, 'bull_rsi_os': 12, 'bull_rsi_ob': 69, 'bull_adx_thresh': 15.579959057310408, 'bull_atr_min_pct': 0.011960714044881464, 'bull_atr_max_pct': 0.13574906387993144, 'bull_tp_mult': 2.3639295367621433, 'bull_tsl_mult': 0.6903619087694988, 'bull_time_stop': 35, 'bull_use_sma': False, 'bull_use_ema': True, 'bull_use_atr': True, 'bull_use_adx': True, 'bull_use_spike': True, 'bull_rsi_required': True, 'bear_strategy': 'mean_reversion', 'bear_bb_std_mult': 0.5224047305122603, 'bear_rsi_os': 36, 'bear_rsi_ob': 65, 'bear_adx_thresh': 7.006895977755937, 'bear_atr_min_pct': 0.013605809637903095, 'bear_atr_max_pct': 0.09655280024398966, 'bear_tp_mult': 2.5981338044993816, 'bear_tsl_mult': 0.4677452909047699, 'bear_time_stop': 289, 'bear_use_sma': False, 'bear_use_ema': False, 'bear_use_atr': False, 'bear_use_adx': False, 'bear_use_spike': True, 'bear_rsi_required': False, 'sideways_strategy': 'mean_reversion', 'sideways_bb_std_mult': 3.0541112122456817, 'sideways_rsi_os': 32, 'sideways_rsi_ob': 56, 'sideways_adx_thresh': 22.8352922112293, 'sideways_atr_min_pct': 0.0020875620373983967, 'sideways_atr_max_pct': 0.10811875092173824, 'sideways_tp_mult': 2.396476138063136, 'sideways_tsl_mult': 0.22999556131688592, 'sideways_time_stop': 155, 'sideways_use_sma': True, 'sideways_use_ema': True, 'sideways_use_atr': True, 'sideways_use_adx': True, 'sideways_use_spike': False, 'sideways_rsi_required': False}.
[I 2025-09-01 14:21:46,243] Trial 370 finished with values: [-0.0074301538438213965, 0.011714652254008502] and parameters: {'p_sma': 34, 'p_std': 60, 'p_atr': 25, 'p_adx': 9, 'rsi_period': 79, 'ema1': 23, 'ema2': 56, 'slip_atr_k': 0.01549844154596894, 'slip_spread_k': 0.8654496472411093, 'spread_hl_frac': 0.04888837341689807, 'bb_std_mult': 3.2160487339151826, 'rsi_os': 41, 'rsi_ob': 60, 'vol_spike': 0.13611312090307354, 'adx_thresh': 5.002487432258265, 'atr_min_pct': 0.010550915861973022, 'atr_max_pct': 0.027763981567600692, 'tp_mult': 2.94843715671011, 'tsl_mult': 0.6362955981492209, 'strategy': 'mean_reversion', 'time_stop': 109, 'use_sma': True, 'use_atr': False, 'use_adx': True, 'use_ema': True, 'use_spike': True, 'rsi_required': True, 'edge_k': 0.30469028499736084, 'edge_cap': 0.9739043635573403, 'bull_strategy': 'mean_reversion', 'bull_bb_std_mult': 2.3177113818365327, 'bull_rsi_os': 42, 'bull_rsi_ob': 76, 'bull_adx_thresh': 31.654426950221733, 'bull_atr_min_pct': 0.02759920279712655, 'bull_atr_max_pct': 0.13460855688878307, 'bull_tp_mult': 1.656033436961218, 'bull_tsl_mult': 0.497410784212236, 'bull_time_stop': 162, 'bull_use_sma': False, 'bull_use_ema': True, 'bull_use_atr': True, 'bull_use_adx': True, 'bull_use_spike': True, 'bull_rsi_required': True, 'bear_strategy': 'mean_reversion', 'bear_bb_std_mult': 2.4635409668974555, 'bear_rsi_os': 36, 'bear_rsi_ob': 80, 'bear_adx_thresh': 12.681712650770471, 'bear_atr_min_pct': 0.0017478415602376882, 'bear_atr_max_pct': 0.09844293841282896, 'bear_tp_mult': 2.0894983070219753, 'bear_tsl_mult': 0.14636187611451856, 'bear_time_stop': 99, 'bear_use_sma': False, 'bear_use_ema': False, 'bear_use_atr': True, 'bear_use_adx': False, 'bear_use_spike': True, 'bear_rsi_required': False, 'sideways_strategy': 'mean_reversion', 'sideways_bb_std_mult': 3.045584782536329, 'sideways_rsi_os': 20, 'sideways_rsi_ob': 90, 'sideways_adx_thresh': 25.156472360401896, 'sideways_atr_min_pct': 0.022032298276995793, 'sideways_atr_max_pct': 0.14166200957811764, 'sideways_tp_mult': 2.3953218848037316, 'sideways_tsl_mult': 0.3694939276900693, 'sideways_time_stop': 162, 'sideways_use_sma': True, 'sideways_use_ema': True, 'sideways_use_atr': True, 'sideways_use_adx': True, 'sideways_use_spike': True, 'sideways_rsi_required': False}.
[I 2025-09-01 14:21:46,887] Trial 373 finished with values: [-1000000000.0, 1000000000.0] and parameters: {'p_sma': 34, 'p_std': 57, 'p_atr': 30, 'p_adx': 24, 'rsi_period': 75, 'ema1': 9, 'ema2': 56, 'slip_atr_k': 0.016077893765697075, 'slip_spread_k': 0.5300980341951445, 'spread_hl_frac': 0.0461256304435256, 'bb_std_mult': 3.2009910270490165, 'rsi_os': 50, 'rsi_ob': 54, 'vol_spike': 0.12117439578943252, 'adx_thresh': 5.630402028887269, 'atr_min_pct': 0.008974044260432272, 'atr_max_pct': 0.029079008531481917, 'tp_mult': 1.3452077282399115, 'tsl_mult': 0.658270272282321, 'strategy': 'mean_reversion', 'time_stop': 108, 'use_sma': True, 'use_atr': False, 'use_adx': True, 'use_ema': True, 'use_spike': False, 'rsi_required': True, 'edge_k': 0.22098756114278695, 'edge_cap': 0.4204710533885779, 'bull_strategy': 'breakout', 'bull_bb_std_mult': 3.252831681305434, 'bull_rsi_os': 14, 'bull_rsi_ob': 78, 'bull_adx_thresh': 19.490225732847904, 'bull_atr_min_pct': 0.0030150658375742104, 'bull_atr_max_pct': 0.127424312393839, 'bull_tp_mult': 2.385701123303508, 'bull_tsl_mult': 0.7353149388431205, 'bull_time_stop': 161, 'bull_use_sma': False, 'bull_use_ema': True, 'bull_use_atr': True, 'bull_use_adx': True, 'bull_use_spike': True, 'bull_rsi_required': True, 'bear_strategy': 'mean_reversion', 'bear_bb_std_mult': 1.1459316122266117, 'bear_rsi_os': 20, 'bear_rsi_ob': 56, 'bear_adx_thresh': 12.892241474147431, 'bear_atr_min_pct': 0.008738561132427275, 'bear_atr_max_pct': 0.10647546308268613, 'bear_tp_mult': 2.8818434477981434, 'bear_tsl_mult': 0.15130494308737796, 'bear_time_stop': 77, 'bear_use_sma': False, 'bear_use_ema': False, 'bear_use_atr': False, 'bear_use_adx': False, 'bear_use_spike': True, 'bear_rsi_required': False, 'sideways_strategy': 'mean_reversion', 'sideways_bb_std_mult': 3.1833398092266583, 'sideways_rsi_os': 32, 'sideways_rsi_ob': 56, 'sideways_adx_thresh': 26.813983541464708, 'sideways_atr_min_pct': 0.006038857015912463, 'sideways_atr_max_pct': 0.09584729151107547, 'sideways_tp_mult': 2.393193024203977, 'sideways_tsl_mult': 0.36668956859256796, 'sideways_time_stop': 186, 'sideways_use_sma': True, 'sideways_use_ema': True, 'sideways_use_atr': True, 'sideways_use_adx': True, 'sideways_use_spike': False, 'sideways_rsi_required': False}.
[I 2025-09-01 14:21:46,894] Trial 375 finished with values: [-1000000000.0, 1000000000.0] and parameters: {'p_sma': 56, 'p_std': 29, 'p_atr': 30, 'p_adx': 10, 'rsi_period': 7, 'ema1': 9, 'ema2': 57, 'slip_atr_k': 0.18936013743404526, 'slip_spread_k': 0.6867855681220008, 'spread_hl_frac': 0.0030751446788669576, 'bb_std_mult': 3.4090725652736444, 'rsi_os': 50, 'rsi_ob': 54, 'vol_spike': 0.23817830579598748, 'adx_thresh': 5.642479087795095, 'atr_min_pct': 0.0061786056380853, 'atr_max_pct': 0.10588348093092129, 'tp_mult': 2.217521609232753, 'tsl_mult': 0.42187170625430076, 'strategy': 'mean_reversion', 'time_stop': 121, 'use_sma': True, 'use_atr': False, 'use_adx': True, 'use_ema': True, 'use_spike': False, 'rsi_required': True, 'edge_k': 0.21678626242679305, 'edge_cap': 0.41720771069510154, 'bull_strategy': 'breakout', 'bull_bb_std_mult': 3.2993125409561177, 'bull_rsi_os': 14, 'bull_rsi_ob': 78, 'bull_adx_thresh': 34.90190516020348, 'bull_atr_min_pct': 0.002891081960775364, 'bull_atr_max_pct': 0.03094485448336417, 'bull_tp_mult': 2.4815135825040384, 'bull_tsl_mult': 0.7775957205196538, 'bull_time_stop': 54, 'bull_use_sma': False, 'bull_use_ema': True, 'bull_use_atr': True, 'bull_use_adx': False, 'bull_use_spike': True, 'bull_rsi_required': True, 'bear_strategy': 'mean_reversion', 'bear_bb_std_mult': 0.6651457026981731, 'bear_rsi_os': 38, 'bear_rsi_ob': 56, 'bear_adx_thresh': 7.930759594753304, 'bear_atr_min_pct': 0.016209667690806034, 'bear_atr_max_pct': 0.10554810060317124, 'bear_tp_mult': 2.0459204291158906, 'bear_tsl_mult': 0.08962996615650834, 'bear_time_stop': 24, 'bear_use_sma': False, 'bear_use_ema': False, 'bear_use_atr': False, 'bear_use_adx': False, 'bear_use_spike': True, 'bear_rsi_required': False, 'sideways_strategy': 'mean_reversion', 'sideways_bb_std_mult': 3.1772487862167664, 'sideways_rsi_os': 30, 'sideways_rsi_ob': 89, 'sideways_adx_thresh': 12.052041471757526, 'sideways_atr_min_pct': 0.004605584701906486, 'sideways_atr_max_pct': 0.041062103207342965, 'sideways_tp_mult': 1.8877598710283674, 'sideways_tsl_mult': 0.4065309305461237, 'sideways_time_stop': 186, 'sideways_use_sma': True, 'sideways_use_ema': True, 'sideways_use_atr': True, 'sideways_use_adx': True, 'sideways_use_spike': False, 'sideways_rsi_required': True}.
[I 2025-09-01 14:21:47,627] Trial 376 finished with values: [-1000000000.0, 1000000000.0] and parameters: {'p_sma': 28, 'p_std': 30, 'p_atr': 26, 'p_adx': 10, 'rsi_period': 81, 'ema1': 18, 'ema2': 54, 'slip_atr_k': 0.22581696616291164, 'slip_spread_k': 0.5289947581436225, 'spread_hl_frac': 0.03335534509775041, 'bb_std_mult': 3.417337193585811, 'rsi_os': 53, 'rsi_ob': 47, 'vol_spike': 0.09865555411885941, 'adx_thresh': 5.0209392790470915, 'atr_min_pct': 0.009921663690674494, 'atr_max_pct': 0.07645560261778948, 'tp_mult': 1.4194446905225429, 'tsl_mult': 0.956565455768198, 'strategy': 'mean_reversion', 'time_stop': 33, 'use_sma': True, 'use_atr': False, 'use_adx': True, 'use_ema': True, 'use_spike': True, 'rsi_required': True, 'edge_k': 0.24595120028742737, 'edge_cap': 0.9404096507095338, 'bull_strategy': 'breakout', 'bull_bb_std_mult': 3.1479995758691643, 'bull_rsi_os': 15, 'bull_rsi_ob': 77, 'bull_adx_thresh': 12.295802298812847, 'bull_atr_min_pct': 0.010092813630198627, 'bull_atr_max_pct': 0.12662347113366343, 'bull_tp_mult': 1.5460150235526693, 'bull_tsl_mult': 0.4340564833025436, 'bull_time_stop': 56, 'bull_use_sma': False, 'bull_use_ema': True, 'bull_use_atr': True, 'bull_use_adx': False, 'bull_use_spike': True, 'bull_rsi_required': True, 'bear_strategy': 'mean_reversion', 'bear_bb_std_mult': 2.732414798323719, 'bear_rsi_os': 38, 'bear_rsi_ob': 92, 'bear_adx_thresh': 7.649051495996217, 'bear_atr_min_pct': 0.002821162272212613, 'bear_atr_max_pct': 0.04658411860550239, 'bear_tp_mult': 2.0436689468047775, 'bear_tsl_mult': 0.09700693530846849, 'bear_time_stop': 203, 'bear_use_sma': False, 'bear_use_ema': False, 'bear_use_atr': False, 'bear_use_adx': False, 'bear_use_spike': True, 'bear_rsi_required': False, 'sideways_strategy': 'mean_reversion', 'sideways_bb_std_mult': 3.119025447715428, 'sideways_rsi_os': 30, 'sideways_rsi_ob': 81, 'sideways_adx_thresh': 32.2670062358531, 'sideways_atr_min_pct': 0.00871972235399349, 'sideways_atr_max_pct': 0.039451108055820285, 'sideways_tp_mult': 2.0180136056411415, 'sideways_tsl_mult': 0.25605373950560495, 'sideways_time_stop': 271, 'sideways_use_sma': True, 'sideways_use_ema': True, 'sideways_use_atr': True, 'sideways_use_adx': True, 'sideways_use_spike': False, 'sideways_rsi_required': True}.
[I 2025-09-01 14:22:18,578] Trial 374 finished with values: [-0.04887434539752322, 0.04870241290580649] and parameters: {'p_sma': 27, 'p_std': 29, 'p_atr': 26, 'p_adx': 7, 'rsi_period': 81, 'ema1': 17, 'ema2': 53, 'slip_atr_k': 0.18559023778223405, 'slip_spread_k': 0.06914282772533198, 'spread_hl_frac': 0.010813319328414698, 'bb_std_mult': 3.431725577160034, 'rsi_os': 39, 'rsi_ob': 54, 'vol_spike': 0.23827156533189608, 'adx_thresh': 33.46492034692419, 'atr_min_pct': 0.009850388066575101, 'atr_max_pct': 0.028104346126469063, 'tp_mult': 1.346645044239145, 'tsl_mult': 0.7004191546965967, 'strategy': 'mean_reversion', 'time_stop': 42, 'use_sma': True, 'use_atr': False, 'use_adx': True, 'use_ema': True, 'use_spike': True, 'rsi_required': True, 'edge_k': 0.2148227473108864, 'edge_cap': 0.9334386150941173, 'bull_strategy': 'breakout', 'bull_bb_std_mult': 3.29598007876362, 'bull_rsi_os': 14, 'bull_rsi_ob': 78, 'bull_adx_thresh': 13.402667650493537, 'bull_atr_min_pct': 0.010440626365776414, 'bull_atr_max_pct': 0.12824921752597865, 'bull_tp_mult': 1.565755442329925, 'bull_tsl_mult': 0.2505687583643953, 'bull_time_stop': 163, 'bull_use_sma': False, 'bull_use_ema': True, 'bull_use_atr': True, 'bull_use_adx': True, 'bull_use_spike': True, 'bull_rsi_required': True, 'bear_strategy': 'mean_reversion', 'bear_bb_std_mult': 2.5108138558595696, 'bear_rsi_os': 38, 'bear_rsi_ob': 56, 'bear_adx_thresh': 12.502623065408363, 'bear_atr_min_pct': 0.0015087726058002596, 'bear_atr_max_pct': 0.09800939298113592, 'bear_tp_mult': 2.0547786132058468, 'bear_tsl_mult': 0.14723020116756408, 'bear_time_stop': 247, 'bear_use_sma': False, 'bear_use_ema': False, 'bear_use_atr': False, 'bear_use_adx': False, 'bear_use_spike': True, 'bear_rsi_required': False, 'sideways_strategy': 'mean_reversion', 'sideways_bb_std_mult': 3.193625649915284, 'sideways_rsi_os': 30, 'sideways_rsi_ob': 60, 'sideways_adx_thresh': 12.358234967163952, 'sideways_atr_min_pct': 0.0059640935087381065, 'sideways_atr_max_pct': 0.14222914350398658, 'sideways_tp_mult': 2.38428680078535, 'sideways_tsl_mult': 0.38134321998148496, 'sideways_time_stop': 174, 'sideways_use_sma': True, 'sideways_use_ema': True, 'sideways_use_atr': True, 'sideways_use_adx': True, 'sideways_use_spike': False, 'sideways_rsi_required': True}.
[I 2025-09-01 14:22:19,614] Trial 372 finished with values: [-0.01232847976881657, 0.01213668671062374] and parameters: {'p_sma': 28, 'p_std': 57, 'p_atr': 13, 'p_adx': 18, 'rsi_period': 7, 'ema1': 17, 'ema2': 59, 'slip_atr_k': 0.2029414436221245, 'slip_spread_k': 0.6909540339020296, 'spread_hl_frac': 0.03465239122145505, 'bb_std_mult': 3.2362709847186073, 'rsi_os': 41, 'rsi_ob': 54, 'vol_spike': 0.1363931865186899, 'adx_thresh': 17.0506841623196, 'atr_min_pct': 0.009021787389152085, 'atr_max_pct': 0.05444456141878944, 'tp_mult': 1.5211285550853817, 'tsl_mult': 0.9636300615463547, 'strategy': 'mean_reversion', 'time_stop': 63, 'use_sma': True, 'use_atr': False, 'use_adx': True, 'use_ema': True, 'use_spike': False, 'rsi_required': True, 'edge_k': 0.21730144690862455, 'edge_cap': 0.9767904206684634, 'bull_strategy': 'breakout', 'bull_bb_std_mult': 1.923541359931022, 'bull_rsi_os': 53, 'bull_rsi_ob': 76, 'bull_adx_thresh': 13.316241732863558, 'bull_atr_min_pct': 0.0030174332561300095, 'bull_atr_max_pct': 0.12571539941019094, 'bull_tp_mult': 2.1827448920350077, 'bull_tsl_mult': 0.9115297264639007, 'bull_time_stop': 166, 'bull_use_sma': False, 'bull_use_ema': True, 'bull_use_atr': True, 'bull_use_adx': True, 'bull_use_spike': True, 'bull_rsi_required': True, 'bear_strategy': 'mean_reversion', 'bear_bb_std_mult': 0.5009423827004, 'bear_rsi_os': 38, 'bear_rsi_ob': 83, 'bear_adx_thresh': 13.138650627702894, 'bear_atr_min_pct': 0.011623309359715735, 'bear_atr_max_pct': 0.10613558553509714, 'bear_tp_mult': 2.054967754058234, 'bear_tsl_mult': 0.15074357451957643, 'bear_time_stop': 100, 'bear_use_sma': False, 'bear_use_ema': False, 'bear_use_atr': False, 'bear_use_adx': False, 'bear_use_spike': True, 'bear_rsi_required': False, 'sideways_strategy': 'mean_reversion', 'sideways_bb_std_mult': 3.1777375777840295, 'sideways_rsi_os': 32, 'sideways_rsi_ob': 61, 'sideways_adx_thresh': 32.92606852314986, 'sideways_atr_min_pct': 0.023332739898094146, 'sideways_atr_max_pct': 0.038870468922852765, 'sideways_tp_mult': 2.376884187414818, 'sideways_tsl_mult': 0.3623865194507483, 'sideways_time_stop': 269, 'sideways_use_sma': True, 'sideways_use_ema': True, 'sideways_use_atr': True, 'sideways_use_adx': True, 'sideways_use_spike': False, 'sideways_rsi_required': False}.
[I 2025-09-01 14:22:21,867] Trial 377 finished with values: [-1000000000.0, 1000000000.0] and parameters: {'p_sma': 28, 'p_std': 28, 'p_atr': 17, 'p_adx': 11, 'rsi_period': 81, 'ema1': 10, 'ema2': 58, 'slip_atr_k': 0.20139669607906457, 'slip_spread_k': 0.5774054387711667, 'spread_hl_frac': 0.01080137150718268, 'bb_std_mult': 3.323376591312418, 'rsi_os': 11, 'rsi_ob': 52, 'vol_spike': 0.11211603971724454, 'adx_thresh': 33.5298533295295, 'atr_min_pct': 0.009932851352849955, 'atr_max_pct': 0.07566365807461907, 'tp_mult': 2.4879369430493945, 'tsl_mult': 0.7050842519992304, 'strategy': 'mean_reversion', 'time_stop': 62, 'use_sma': True, 'use_atr': False, 'use_adx': True, 'use_ema': True, 'use_spike': True, 'rsi_required': True, 'edge_k': 0.6263283835846769, 'edge_cap': 0.9395332095545106, 'bull_strategy': 'breakout', 'bull_bb_std_mult': 3.161880318352164, 'bull_rsi_os': 23, 'bull_rsi_ob': 92, 'bull_adx_thresh': 13.639475259738159, 'bull_atr_min_pct': 0.018692479739627493, 'bull_atr_max_pct': 0.12604049541665685, 'bull_tp_mult': 1.5465037526386345, 'bull_tsl_mult': 0.8464846184674225, 'bull_time_stop': 149, 'bull_use_sma': False, 'bull_use_ema': False, 'bull_use_atr': True, 'bull_use_adx': True, 'bull_use_spike': True, 'bull_rsi_required': True, 'bear_strategy': 'mean_reversion', 'bear_bb_std_mult': 2.5317656635526125, 'bear_rsi_os': 31, 'bear_rsi_ob': 92, 'bear_adx_thresh': 6.679624229487096, 'bear_atr_min_pct': 0.01125866474588677, 'bear_atr_max_pct': 0.050500160855500686, 'bear_tp_mult': 2.059366628530038, 'bear_tsl_mult': 0.10710932106859691, 'bear_time_stop': 168, 'bear_use_sma': False, 'bear_use_ema': False, 'bear_use_atr': False, 'bear_use_adx': False, 'bear_use_spike': True, 'bear_rsi_required': False, 'sideways_strategy': 'mean_reversion', 'sideways_bb_std_mult': 2.8051328870797096, 'sideways_rsi_os': 28, 'sideways_rsi_ob': 81, 'sideways_adx_thresh': 24.768173579024438, 'sideways_atr_min_pct': 0.003920738653249874, 'sideways_atr_max_pct': 0.09983530417216799, 'sideways_tp_mult': 2.525444029646195, 'sideways_tsl_mult': 0.32169237646630233, 'sideways_time_stop': 271, 'sideways_use_sma': True, 'sideways_use_ema': True, 'sideways_use_atr': False, 'sideways_use_adx': True, 'sideways_use_spike': False, 'sideways_rsi_required': True}.
