[I 2025-09-01 14:31:43,835] Trial 442 finished with values: [-1000000000.0, 1000000000.0] and parameters: {'p_sma': 60, 'p_std': 41, 'p_atr': 27, 'p_adx': 12, 'rsi_period': 79, 'ema1': 10, 'ema2': 39, 'slip_atr_k': 0.23073862120508076, 'slip_spread_k': 0.7424793322072991, 'spread_hl_frac': 0.03523742264903872, 'bb_std_mult': 0.7969623210198451, 'rsi_os': 39, 'rsi_ob': 55, 'vol_spike': 0.24608509120916855, 'adx_thresh': 32.909741472817124, 'atr_min_pct': 0.007900076006041066, 'atr_max_pct': 0.09307233708774831, 'tp_mult': 1.4639030566588795, 'tsl_mult': 0.20753696242255804, 'strategy': 'mean_reversion', 'time_stop': 107, 'use_sma': True, 'use_atr': False, 'use_adx': True, 'use_ema': True, 'use_spike': True, 'rsi_required': True, 'edge_k': 0.23922225717337453, 'edge_cap': 0.3282603827037459, 'bull_strategy': 'breakout', 'bull_bb_std_mult': 2.3558299294044525, 'bull_rsi_os': 32, 'bull_rsi_ob': 90, 'bull_adx_thresh': 12.842252641293799, 'bull_atr_min_pct': 0.01100513547282414, 'bull_atr_max_pct': 0.06004166376898126, 'bull_tp_mult': 1.2335005723605308, 'bull_tsl_mult': 0.7592783130499778, 'bull_time_stop': 126, 'bull_use_sma': False, 'bull_use_ema': False, 'bull_use_atr': True, 'bull_use_adx': True, 'bull_use_spike': True, 'bull_rsi_required': True, 'bear_strategy': 'mean_reversion', 'bear_bb_std_mult': 2.610042056700436, 'bear_rsi_os': 18, 'bear_rsi_ob': 61, 'bear_adx_thresh': 34.06850864765296, 'bear_atr_min_pct': 0.0023173401042999534, 'bear_atr_max_pct': 0.047576979172199954, 'bear_tp_mult': 2.0134851870083263, 'bear_tsl_mult': 0.0931100680053026, 'bear_time_stop': 97, 'bear_use_sma': False, 'bear_use_ema': False, 'bear_use_atr': False, 'bear_use_adx': False, 'bear_use_spike': True, 'bear_rsi_required': False, 'sideways_strategy': 'mean_reversion', 'sideways_bb_std_mult': 2.5876428236285673, 'sideways_rsi_os': 32, 'sideways_rsi_ob': 92, 'sideways_adx_thresh': 24.815531133964406, 'sideways_atr_min_pct': 0.003424439840427574, 'sideways_atr_max_pct': 0.13306695450896106, 'sideways_tp_mult': 1.717718606386415, 'sideways_tsl_mult': 0.38397461614358297, 'sideways_time_stop': 259, 'sideways_use_sma': True, 'sideways_use_ema': True, 'sideways_use_atr': True, 'sideways_use_adx': True, 'sideways_use_spike': True, 'sideways_rsi_required': True}.
[I 2025-09-01 14:31:43,855] Trial 440 finished with values: [-0.008090721187833716, 0.011075479517557281] and parameters: {'p_sma': 27, 'p_std': 12, 'p_atr': 11, 'p_adx': 8, 'rsi_period': 75, 'ema1': 8, 'ema2': 56, 'slip_atr_k': 0.020472045608545826, 'slip_spread_k': 0.7369483330993268, 'spread_hl_frac': 0.02060343958088503, 'bb_std_mult': 1.3262945978356497, 'rsi_os': 40, 'rsi_ob': 51, 'vol_spike': 0.10716712024657939, 'adx_thresh': 8.468241153863758, 'atr_min_pct': 0.011543447299284994, 'atr_max_pct': 0.1331515141251374, 'tp_mult': 1.2969046603349645, 'tsl_mult': 0.27395800397957837, 'strategy': 'mean_reversion', 'time_stop': 108, 'use_sma': True, 'use_atr': False, 'use_adx': True, 'use_ema': True, 'use_spike': True, 'rsi_required': True, 'edge_k': 0.08550756507435933, 'edge_cap': 0.32947460515734234, 'bull_strategy': 'breakout', 'bull_bb_std_mult': 2.4629840673576986, 'bull_rsi_os': 11, 'bull_rsi_ob': 77, 'bull_adx_thresh': 5.0406783297746856, 'bull_atr_min_pct': 0.011053216283895906, 'bull_atr_max_pct': 0.057302996930664596, 'bull_tp_mult': 1.629670499861542, 'bull_tsl_mult': 0.719420652231351, 'bull_time_stop': 162, 'bull_use_sma': False, 'bull_use_ema': True, 'bull_use_atr': True, 'bull_use_adx': True, 'bull_use_spike': True, 'bull_rsi_required': True, 'bear_strategy': 'mean_reversion', 'bear_bb_std_mult': 0.8886799430760779, 'bear_rsi_os': 35, 'bear_rsi_ob': 58, 'bear_adx_thresh': 7.450828336891952, 'bear_atr_min_pct': 0.0014646762999638984, 'bear_atr_max_pct': 0.11420366561885077, 'bear_tp_mult': 2.01567155903825, 'bear_tsl_mult': 0.08542892953303834, 'bear_time_stop': 96, 'bear_use_sma': True, 'bear_use_ema': False, 'bear_use_atr': False, 'bear_use_adx': False, 'bear_use_spike': True, 'bear_rsi_required': False, 'sideways_strategy': 'mean_reversion', 'sideways_bb_std_mult': 2.9078798839192124, 'sideways_rsi_os': 32, 'sideways_rsi_ob': 90, 'sideways_adx_thresh': 19.600761045216178, 'sideways_atr_min_pct': 0.021487091698114396, 'sideways_atr_max_pct': 0.13377491387095347, 'sideways_tp_mult': 1.5273811373738575, 'sideways_tsl_mult': 0.3840919614846549, 'sideways_time_stop': 283, 'sideways_use_sma': True, 'sideways_use_ema': True, 'sideways_use_atr': False, 'sideways_use_adx': True, 'sideways_use_spike': True, 'sideways_rsi_required': False}.
[I 2025-09-01 14:31:44,256] Trial 443 finished with values: [-1000000000.0, 1000000000.0] and parameters: {'p_sma': 30, 'p_std': 30, 'p_atr': 11, 'p_adx': 8, 'rsi_period': 47, 'ema1': 14, 'ema2': 36, 'slip_atr_k': 0.05405498210315776, 'slip_spread_k': 0.07944244744038059, 'spread_hl_frac': 0.011528604240034088, 'bb_std_mult': 2.487578985674055, 'rsi_os': 36, 'rsi_ob': 91, 'vol_spike': 0.11478841215272406, 'adx_thresh': 5.6763738234398415, 'atr_min_pct': 0.01140461818726179, 'atr_max_pct': 0.09430548679183105, 'tp_mult': 1.4731891573060365, 'tsl_mult': 0.5572487506659151, 'strategy': 'mean_reversion', 'time_stop': 107, 'use_sma': True, 'use_atr': False, 'use_adx': True, 'use_ema': True, 'use_spike': True, 'rsi_required': True, 'edge_k': 0.20983997681582522, 'edge_cap': 0.9580659569923868, 'bull_strategy': 'breakout', 'bull_bb_std_mult': 2.9541935213119275, 'bull_rsi_os': 14, 'bull_rsi_ob': 64, 'bull_adx_thresh': 25.433356621996467, 'bull_atr_min_pct': 0.013840877866356485, 'bull_atr_max_pct': 0.1278781737805896, 'bull_tp_mult': 1.5349787289377284, 'bull_tsl_mult': 0.7451397372602111, 'bull_time_stop': 164, 'bull_use_sma': False, 'bull_use_ema': False, 'bull_use_atr': True, 'bull_use_adx': True, 'bull_use_spike': True, 'bull_rsi_required': True, 'bear_strategy': 'mean_reversion', 'bear_bb_std_mult': 2.430958926457963, 'bear_rsi_os': 18, 'bear_rsi_ob': 58, 'bear_adx_thresh': 7.049821811703396, 'bear_atr_min_pct': 0.01658481724054296, 'bear_atr_max_pct': 0.09624489502177867, 'bear_tp_mult': 2.000026479639289, 'bear_tsl_mult': 0.8377558518531869, 'bear_time_stop': 97, 'bear_use_sma': False, 'bear_use_ema': False, 'bear_use_atr': True, 'bear_use_adx': False, 'bear_use_spike': True, 'bear_rsi_required': False, 'sideways_strategy': 'mean_reversion', 'sideways_bb_std_mult': 1.8830728936797116, 'sideways_rsi_os': 48, 'sideways_rsi_ob': 57, 'sideways_adx_thresh': 24.96437467357987, 'sideways_atr_min_pct': 0.00347633604765693, 'sideways_atr_max_pct': 0.02488475389924106, 'sideways_tp_mult': 1.551823142015076, 'sideways_tsl_mult': 0.4157093802901166, 'sideways_time_stop': 283, 'sideways_use_sma': True, 'sideways_use_ema': True, 'sideways_use_atr': True, 'sideways_use_adx': True, 'sideways_use_spike': True, 'sideways_rsi_required': True}.
[I 2025-09-01 14:32:21,469] Trial 445 finished with values: [-1000000000.0, 1000000000.0] and parameters: {'p_sma': 30, 'p_std': 28, 'p_atr': 26, 'p_adx': 8, 'rsi_period': 79, 'ema1': 29, 'ema2': 54, 'slip_atr_k': 0.016875701460585868, 'slip_spread_k': 0.18663511447191272, 'spread_hl_frac': 0.028026542332848087, 'bb_std_mult': 1.6513997425232834, 'rsi_os': 16, 'rsi_ob': 82, 'vol_spike': 0.12432194367957311, 'adx_thresh': 5.714313570261165, 'atr_min_pct': 0.027811655817865922, 'atr_max_pct': 0.03747330647215716, 'tp_mult': 1.4338835409287887, 'tsl_mult': 0.6358875571898129, 'strategy': 'mean_reversion', 'time_stop': 119, 'use_sma': False, 'use_atr': False, 'use_adx': True, 'use_ema': True, 'use_spike': True, 'rsi_required': True, 'edge_k': 1.5978953873471147, 'edge_cap': 0.9524945827144261, 'bull_strategy': 'mean_reversion', 'bull_bb_std_mult': 3.4749846703979257, 'bull_rsi_os': 14, 'bull_rsi_ob': 79, 'bull_adx_thresh': 13.131180399539211, 'bull_atr_min_pct': 0.01954088298275548, 'bull_atr_max_pct': 0.12222283012209757, 'bull_tp_mult': 1.9086950382991847, 'bull_tsl_mult': 0.4970902157733642, 'bull_time_stop': 170, 'bull_use_sma': False, 'bull_use_ema': True, 'bull_use_atr': True, 'bull_use_adx': True, 'bull_use_spike': True, 'bull_rsi_required': True, 'bear_strategy': 'mean_reversion', 'bear_bb_std_mult': 2.6871600762036087, 'bear_rsi_os': 34, 'bear_rsi_ob': 58, 'bear_adx_thresh': 22.121435882058126, 'bear_atr_min_pct': 0.01673224042508674, 'bear_atr_max_pct': 0.08971741111740222, 'bear_tp_mult': 1.9387341447457747, 'bear_tsl_mult': 0.829076700755589, 'bear_time_stop': 243, 'bear_use_sma': False, 'bear_use_ema': False, 'bear_use_atr': True, 'bear_use_adx': False, 'bear_use_spike': True, 'bear_rsi_required': False, 'sideways_strategy': 'mean_reversion', 'sideways_bb_std_mult': 1.873259294577906, 'sideways_rsi_os': 28, 'sideways_rsi_ob': 62, 'sideways_adx_thresh': 25.056449182486325, 'sideways_atr_min_pct': 0.004279345885877414, 'sideways_atr_max_pct': 0.10299313196648516, 'sideways_tp_mult': 1.6731828755136005, 'sideways_tsl_mult': 0.41683075711040163, 'sideways_time_stop': 260, 'sideways_use_sma': True, 'sideways_use_ema': True, 'sideways_use_atr': True, 'sideways_use_adx': True, 'sideways_use_spike': False, 'sideways_rsi_required': True}.
[I 2025-09-01 14:32:22,204] Trial 447 finished with values: [-0.021597818182587658, 0.024181960371214516] and parameters: {'p_sma': 46, 'p_std': 28, 'p_atr': 26, 'p_adx': 8, 'rsi_period': 79, 'ema1': 9, 'ema2': 12, 'slip_atr_k': 0.24926974521610248, 'slip_spread_k': 0.9957124273612296, 'spread_hl_frac': 0.008815989502209513, 'bb_std_mult': 1.4376815057104393, 'rsi_os': 31, 'rsi_ob': 54, 'vol_spike': 0.12934099153337683, 'adx_thresh': 6.350239775127605, 'atr_min_pct': 0.009921855392109578, 'atr_max_pct': 0.030979116331678498, 'tp_mult': 1.4183337245237242, 'tsl_mult': 0.4707647900929805, 'strategy': 'mean_reversion', 'time_stop': 117, 'use_sma': False, 'use_atr': False, 'use_adx': True, 'use_ema': True, 'use_spike': True, 'rsi_required': True, 'edge_k': 1.4552778256299748, 'edge_cap': 0.949792281774278, 'bull_strategy': 'mean_reversion', 'bull_bb_std_mult': 3.0487336387851927, 'bull_rsi_os': 23, 'bull_rsi_ob': 79, 'bull_adx_thresh': 13.600446753431005, 'bull_atr_min_pct': 0.024673363443089798, 'bull_atr_max_pct': 0.12427700559332752, 'bull_tp_mult': 1.5974755828781275, 'bull_tsl_mult': 0.43070361037487503, 'bull_time_stop': 171, 'bull_use_sma': False, 'bull_use_ema': True, 'bull_use_atr': True, 'bull_use_adx': True, 'bull_use_spike': True, 'bull_rsi_required': True, 'bear_strategy': 'mean_reversion', 'bear_bb_std_mult': 1.0956363167997312, 'bear_rsi_os': 34, 'bear_rsi_ob': 67, 'bear_adx_thresh': 26.275842290346198, 'bear_atr_min_pct': 0.0029778915528049957, 'bear_atr_max_pct': 0.10924469816801397, 'bear_tp_mult': 2.122166580747139, 'bear_tsl_mult': 0.7522621867492463, 'bear_time_stop': 243, 'bear_use_sma': False, 'bear_use_ema': False, 'bear_use_atr': True, 'bear_use_adx': False, 'bear_use_spike': True, 'bear_rsi_required': False, 'sideways_strategy': 'mean_reversion', 'sideways_bb_std_mult': 3.0875939069117897, 'sideways_rsi_os': 28, 'sideways_rsi_ob': 88, 'sideways_adx_thresh': 25.469702923736286, 'sideways_atr_min_pct': 0.004109037137499582, 'sideways_atr_max_pct': 0.10327879759433703, 'sideways_tp_mult': 2.553475649649643, 'sideways_tsl_mult': 0.25891988409096534, 'sideways_time_stop': 165, 'sideways_use_sma': True, 'sideways_use_ema': True, 'sideways_use_atr': True, 'sideways_use_adx': True, 'sideways_use_spike': False, 'sideways_rsi_required': False}.
[I 2025-09-01 14:32:22,216] Trial 446 finished with values: [-1000000000.0, 1000000000.0] and parameters: {'p_sma': 19, 'p_std': 30, 'p_atr': 26, 'p_adx': 8, 'rsi_period': 79, 'ema1': 29, 'ema2': 13, 'slip_atr_k': 0.054079099666203875, 'slip_spread_k': 0.5402304606276261, 'spread_hl_frac': 0.0008445407912415631, 'bb_std_mult': 3.3402969783963674, 'rsi_os': 14, 'rsi_ob': 82, 'vol_spike': 0.13596084968634006, 'adx_thresh': 5.717351336088935, 'atr_min_pct': 0.02270330336624356, 'atr_max_pct': 0.029910569192771578, 'tp_mult': 1.6557281313969252, 'tsl_mult': 0.6843498783126926, 'strategy': 'mean_reversion', 'time_stop': 117, 'use_sma': False, 'use_atr': False, 'use_adx': True, 'use_ema': True, 'use_spike': True, 'rsi_required': True, 'edge_k': 1.5008172374126494, 'edge_cap': 0.9996152482594648, 'bull_strategy': 'mean_reversion', 'bull_bb_std_mult': 3.249379323704567, 'bull_rsi_os': 23, 'bull_rsi_ob': 79, 'bull_adx_thresh': 10.554189239509798, 'bull_atr_min_pct': 0.008733176503599688, 'bull_atr_max_pct': 0.08038244791155805, 'bull_tp_mult': 1.8243601426460043, 'bull_tsl_mult': 0.5066204075062954, 'bull_time_stop': 170, 'bull_use_sma': False, 'bull_use_ema': True, 'bull_use_atr': True, 'bull_use_adx': True, 'bull_use_spike': True, 'bull_rsi_required': True, 'bear_strategy': 'mean_reversion', 'bear_bb_std_mult': 2.676846787978743, 'bear_rsi_os': 34, 'bear_rsi_ob': 45, 'bear_adx_thresh': 6.921610964356158, 'bear_atr_min_pct': 0.003098026088553616, 'bear_atr_max_pct': 0.10079356664885297, 'bear_tp_mult': 1.953496757626287, 'bear_tsl_mult': 0.11736007034038093, 'bear_time_stop': 5, 'bear_use_sma': False, 'bear_use_ema': False, 'bear_use_atr': True, 'bear_use_adx': False, 'bear_use_spike': True, 'bear_rsi_required': False, 'sideways_strategy': 'mean_reversion', 'sideways_bb_std_mult': 1.8578914352694265, 'sideways_rsi_os': 13, 'sideways_rsi_ob': 88, 'sideways_adx_thresh': 11.511706517715776, 'sideways_atr_min_pct': 0.004217719757047341, 'sideways_atr_max_pct': 0.10320082497947362, 'sideways_tp_mult': 1.5818290850155785, 'sideways_tsl_mult': 0.6563847917506948, 'sideways_time_stop': 270, 'sideways_use_sma': True, 'sideways_use_ema': True, 'sideways_use_atr': True, 'sideways_use_adx': True, 'sideways_use_spike': False, 'sideways_rsi_required': True}.
[I 2025-09-01 14:32:22,550] Trial 444 finished with values: [-1000000000.0, 1000000000.0] and parameters: {'p_sma': 30, 'p_std': 28, 'p_atr': 26, 'p_adx': 8, 'rsi_period': 79, 'ema1': 10, 'ema2': 38, 'slip_atr_k': 0.2314989594813161, 'slip_spread_k': 0.19339478731705256, 'spread_hl_frac': 0.0220858282772933, 'bb_std_mult': 1.3416526993188516, 'rsi_os': 16, 'rsi_ob': 55, 'vol_spike': 0.13343308665392833, 'adx_thresh': 8.422741824384936, 'atr_min_pct': 0.02768363834289169, 'atr_max_pct': 0.07836476497127466, 'tp_mult': 2.360623164260611, 'tsl_mult': 0.6364634213506999, 'strategy': 'mean_reversion', 'time_stop': 117, 'use_sma': False, 'use_atr': False, 'use_adx': True, 'use_ema': True, 'use_spike': True, 'rsi_required': True, 'edge_k': 1.5847125649282021, 'edge_cap': 0.5053338549887065, 'bull_strategy': 'mean_reversion', 'bull_bb_std_mult': 3.457597536843992, 'bull_rsi_os': 11, 'bull_rsi_ob': 75, 'bull_adx_thresh': 13.2296783160125, 'bull_atr_min_pct': 0.011338088630994411, 'bull_atr_max_pct': 0.07978692578595034, 'bull_tp_mult': 1.9175854322237393, 'bull_tsl_mult': 0.3522514007304772, 'bull_time_stop': 124, 'bull_use_sma': False, 'bull_use_ema': True, 'bull_use_atr': True, 'bull_use_adx': True, 'bull_use_spike': True, 'bull_rsi_required': True, 'bear_strategy': 'mean_reversion', 'bear_bb_std_mult': 2.677796460708374, 'bear_rsi_os': 35, 'bear_rsi_ob': 58, 'bear_adx_thresh': 7.332129856899584, 'bear_atr_min_pct': 0.02846971241390468, 'bear_atr_max_pct': 0.12977083941947687, 'bear_tp_mult': 1.9496681894504544, 'bear_tsl_mult': 0.008952574831424531, 'bear_time_stop': 78, 'bear_use_sma': False, 'bear_use_ema': False, 'bear_use_atr': True, 'bear_use_adx': False, 'bear_use_spike': True, 'bear_rsi_required': False, 'sideways_strategy': 'mean_reversion', 'sideways_bb_std_mult': 3.0861764872806425, 'sideways_rsi_os': 32, 'sideways_rsi_ob': 88, 'sideways_adx_thresh': 24.9833282299045, 'sideways_atr_min_pct': 0.003523334308069885, 'sideways_atr_max_pct': 0.10320717269651661, 'sideways_tp_mult': 2.560102427309183, 'sideways_tsl_mult': 0.35321757736007997, 'sideways_time_stop': 270, 'sideways_use_sma': True, 'sideways_use_ema': True, 'sideways_use_atr': True, 'sideways_use_adx': True, 'sideways_use_spike': True, 'sideways_rsi_required': True}.
[I 2025-09-01 14:32:57,694] Trial 448 finished with values: [-1000000000.0, 1000000000.0] and parameters: {'p_sma': 46, 'p_std': 53, 'p_atr': 28, 'p_adx': 8, 'rsi_period': 36, 'ema1': 9, 'ema2': 58, 'slip_atr_k': 0.008466531726878876, 'slip_spread_k': 0.5425626347579663, 'spread_hl_frac': 0.008652204824371724, 'bb_std_mult': 0.9740356929197709, 'rsi_os': 42, 'rsi_ob': 69, 'vol_spike': 0.1315782041454399, 'adx_thresh': 6.5512630973274515, 'atr_min_pct': 0.020657255336159152, 'atr_max_pct': 0.03083495039239533, 'tp_mult': 1.4118627766932286, 'tsl_mult': 0.7488383885768534, 'strategy': 'mean_reversion', 'time_stop': 97, 'use_sma': False, 'use_atr': False, 'use_adx': True, 'use_ema': True, 'use_spike': True, 'rsi_required': True, 'edge_k': 1.8600978610722638, 'edge_cap': 0.9997526529869272, 'bull_strategy': 'mean_reversion', 'bull_bb_std_mult': 3.052214242966785, 'bull_rsi_os': 14, 'bull_rsi_ob': 79, 'bull_adx_thresh': 16.45143099779464, 'bull_atr_min_pct': 0.011901309165146286, 'bull_atr_max_pct': 0.12542253608199647, 'bull_tp_mult': 1.6812548486309407, 'bull_tsl_mult': 0.860400107614087, 'bull_time_stop': 148, 'bull_use_sma': True, 'bull_use_ema': True, 'bull_use_atr': True, 'bull_use_adx': True, 'bull_use_spike': True, 'bull_rsi_required': True, 'bear_strategy': 'mean_reversion', 'bear_bb_std_mult': 2.4709566738885695, 'bear_rsi_os': 39, 'bear_rsi_ob': 55, 'bear_adx_thresh': 26.310913201763693, 'bear_atr_min_pct': 0.008267507389820041, 'bear_atr_max_pct': 0.1183525668581294, 'bear_tp_mult': 2.656135417544456, 'bear_tsl_mult': 0.006496800502962752, 'bear_time_stop': 79, 'bear_use_sma': False, 'bear_use_ema': False, 'bear_use_atr': False, 'bear_use_adx': False, 'bear_use_spike': True, 'bear_rsi_required': False, 'sideways_strategy': 'mean_reversion', 'sideways_bb_std_mult': 3.083353688499561, 'sideways_rsi_os': 31, 'sideways_rsi_ob': 88, 'sideways_adx_thresh': 31.544945833096893, 'sideways_atr_min_pct': 0.017872770890581858, 'sideways_atr_max_pct': 0.1178083676784213, 'sideways_tp_mult': 1.897296609743248, 'sideways_tsl_mult': 0.6560883379142058, 'sideways_time_stop': 267, 'sideways_use_sma': True, 'sideways_use_ema': False, 'sideways_use_atr': True, 'sideways_use_adx': True, 'sideways_use_spike': False, 'sideways_rsi_required': False}.
[I 2025-09-01 14:32:58,447] Trial 450 finished with values: [-0.020882072771201243, 0.023669054994126703] and parameters: {'p_sma': 21, 'p_std': 53, 'p_atr': 28, 'p_adx': 9, 'rsi_period': 81, 'ema1': 26, 'ema2': 59, 'slip_atr_k': 0.00924472849125429, 'slip_spread_k': 0.5212139158726695, 'spread_hl_frac': 0.04321326508672408, 'bb_std_mult': 3.511071503000057, 'rsi_os': 42, 'rsi_ob': 53, 'vol_spike': 0.11181719644908394, 'adx_thresh': 6.867701460796207, 'atr_min_pct': 0.02065095224504051, 'atr_max_pct': 0.07021824382229902, 'tp_mult': 2.3649406669526196, 'tsl_mult': 0.3279375478121731, 'strategy': 'mean_reversion', 'time_stop': 99, 'use_sma': True, 'use_atr': False, 'use_adx': True, 'use_ema': True, 'use_spike': True, 'rsi_required': True, 'edge_k': 0.2704818031339891, 'edge_cap': 0.11841166934734076, 'bull_strategy': 'breakout', 'bull_bb_std_mult': 3.1476398803827466, 'bull_rsi_os': 12, 'bull_rsi_ob': 74, 'bull_adx_thresh': 12.259221205119815, 'bull_atr_min_pct': 0.006493557073902163, 'bull_atr_max_pct': 0.10461701972900556, 'bull_tp_mult': 1.9878920613110802, 'bull_tsl_mult': 0.1750807100940583, 'bull_time_stop': 291, 'bull_use_sma': True, 'bull_use_ema': True, 'bull_use_atr': True, 'bull_use_adx': False, 'bull_use_spike': True, 'bull_rsi_required': True, 'bear_strategy': 'mean_reversion', 'bear_bb_std_mult': 2.182845116922408, 'bear_rsi_os': 49, 'bear_rsi_ob': 81, 'bear_adx_thresh': 8.534517541879387, 'bear_atr_min_pct': 0.002546518735679124, 'bear_atr_max_pct': 0.14972321696719826, 'bear_tp_mult': 2.65880037808782, 'bear_tsl_mult': 0.1417526042283792, 'bear_time_stop': 78, 'bear_use_sma': True, 'bear_use_ema': False, 'bear_use_atr': False, 'bear_use_adx': False, 'bear_use_spike': True, 'bear_rsi_required': False, 'sideways_strategy': 'mean_reversion', 'sideways_bb_std_mult': 3.0151465985694683, 'sideways_rsi_os': 31, 'sideways_rsi_ob': 91, 'sideways_adx_thresh': 26.07712143072387, 'sideways_atr_min_pct': 0.004776193907196539, 'sideways_atr_max_pct': 0.10838925397376402, 'sideways_tp_mult': 2.000918977971118, 'sideways_tsl_mult': 0.34894872680644357, 'sideways_time_stop': 269, 'sideways_use_sma': True, 'sideways_use_ema': False, 'sideways_use_atr': False, 'sideways_use_adx': True, 'sideways_use_spike': False, 'sideways_rsi_required': False}.
