[I 2025-09-01 14:13:40,940] Trial 314 finished with values: [-0.019957812428725852, 0.021571960604586663] and parameters: {'p_sma': 29, 'p_std': 31, 'p_atr': 27, 'p_adx': 8, 'rsi_period': 79, 'ema1': 10, 'ema2': 53, 'slip_atr_k': 0.06039176537440191, 'slip_spread_k': 0.5782771944721031, 'spread_hl_frac': 0.011746988943626234, 'bb_std_mult': 3.4863843931024263, 'rsi_os': 33, 'rsi_ob': 55, 'vol_spike': 0.19958154554918175, 'adx_thresh': 6.035584992285898, 'atr_min_pct': 0.011342460920964465, 'atr_max_pct': 0.029146334167057825, 'tp_mult': 1.2875109104284217, 'tsl_mult': 0.6910487022554781, 'strategy': 'mean_reversion', 'time_stop': 106, 'use_sma': False, 'use_atr': False, 'use_adx': True, 'use_ema': True, 'use_spike': True, 'rsi_required': True, 'edge_k': 0.28705634731531043, 'edge_cap': 0.984282226591193, 'bull_strategy': 'breakout', 'bull_bb_std_mult': 3.108075774033711, 'bull_rsi_os': 9, 'bull_rsi_ob': 76, 'bull_adx_thresh': 6.780127323353522, 'bull_atr_min_pct': 0.011190995728480533, 'bull_atr_max_pct': 0.12227214969369311, 'bull_tp_mult': 1.7647465626661067, 'bull_tsl_mult': 0.4499029151807897, 'bull_time_stop': 156, 'bull_use_sma': True, 'bull_use_ema': True, 'bull_use_atr': True, 'bull_use_adx': True, 'bull_use_spike': True, 'bull_rsi_required': True, 'bear_strategy': 'mean_reversion', 'bear_bb_std_mult': 2.5442360933561363, 'bear_rsi_os': 39, 'bear_rsi_ob': 57, 'bear_adx_thresh': 8.06804334707397, 'bear_atr_min_pct': 0.002367319871856066, 'bear_atr_max_pct': 0.12281595252407942, 'bear_tp_mult': 2.00774178580736, 'bear_tsl_mult': 0.29524666615940104, 'bear_time_stop': 108, 'bear_use_sma': False, 'bear_use_ema': False, 'bear_use_atr': False, 'bear_use_adx': False, 'bear_use_spike': True, 'bear_rsi_required': False, 'sideways_strategy': 'mean_reversion', 'sideways_bb_std_mult': 3.0004061200039587, 'sideways_rsi_os': 31, 'sideways_rsi_ob': 93, 'sideways_adx_thresh': 24.7789114207964, 'sideways_atr_min_pct': 0.00377287722310527, 'sideways_atr_max_pct': 0.10760386845781407, 'sideways_tp_mult': 2.507529867017824, 'sideways_tsl_mult': 0.3315217484757439, 'sideways_time_stop': 48, 'sideways_use_sma': True, 'sideways_use_ema': True, 'sideways_use_atr': False, 'sideways_use_adx': True, 'sideways_use_spike': True, 'sideways_rsi_required': True}.
[I 2025-09-01 14:13:43,043] Trial 316 finished with values: [0.003220303882919051, 0.003828115008751225] and parameters: {'p_sma': 28, 'p_std': 60, 'p_atr': 26, 'p_adx': 8, 'rsi_period': 81, 'ema1': 9, 'ema2': 58, 'slip_atr_k': 0.018490476040136237, 'slip_spread_k': 0.5461985810785583, 'spread_hl_frac': 0.011840243658859616, 'bb_std_mult': 3.32535253695783, 'rsi_os': 42, 'rsi_ob': 55, 'vol_spike': 0.1074873582064917, 'adx_thresh': 6.13244585087527, 'atr_min_pct': 0.010365171753638165, 'atr_max_pct': 0.028504652386429973, 'tp_mult': 1.3959335012528609, 'tsl_mult': 0.6690733805676419, 'strategy': 'mean_reversion', 'time_stop': 106, 'use_sma': True, 'use_atr': False, 'use_adx': True, 'use_ema': True, 'use_spike': True, 'rsi_required': True, 'edge_k': 0.3024985534786244, 'edge_cap': 0.9885661011208348, 'bull_strategy': 'breakout', 'bull_bb_std_mult': 3.0850056687227334, 'bull_rsi_os': 15, 'bull_rsi_ob': 76, 'bull_adx_thresh': 22.61727410211082, 'bull_atr_min_pct': 0.011879196195474446, 'bull_atr_max_pct': 0.12232251694970882, 'bull_tp_mult': 2.810506203140397, 'bull_tsl_mult': 0.4103301176641851, 'bull_time_stop': 156, 'bull_use_sma': True, 'bull_use_ema': True, 'bull_use_atr': True, 'bull_use_adx': False, 'bull_use_spike': True, 'bull_rsi_required': True, 'bear_strategy': 'mean_reversion', 'bear_bb_std_mult': 2.302745616540786, 'bear_rsi_os': 37, 'bear_rsi_ob': 58, 'bear_adx_thresh': 17.983600702921287, 'bear_atr_min_pct': 0.0024007323354437965, 'bear_atr_max_pct': 0.1238982443016816, 'bear_tp_mult': 2.00683012162025, 'bear_tsl_mult': 0.29644213331411445, 'bear_time_stop': 96, 'bear_use_sma': False, 'bear_use_ema': False, 'bear_use_atr': False, 'bear_use_adx': False, 'bear_use_spike': True, 'bear_rsi_required': False, 'sideways_strategy': 'mean_reversion', 'sideways_bb_std_mult': 2.991506865926874, 'sideways_rsi_os': 31, 'sideways_rsi_ob': 94, 'sideways_adx_thresh': 22.603183091757195, 'sideways_atr_min_pct': 0.0036851593251284844, 'sideways_atr_max_pct': 0.10714076543625385, 'sideways_tp_mult': 2.4472393853840324, 'sideways_tsl_mult': 0.34370001497421415, 'sideways_time_stop': 272, 'sideways_use_sma': True, 'sideways_use_ema': False, 'sideways_use_atr': False, 'sideways_use_adx': True, 'sideways_use_spike': False, 'sideways_rsi_required': False}.
[I 2025-09-01 14:13:43,407] Trial 317 finished with values: [-0.008739651267890225, 0.010625444416688994] and parameters: {'p_sma': 25, 'p_std': 59, 'p_atr': 27, 'p_adx': 7, 'rsi_period': 82, 'ema1': 9, 'ema2': 58, 'slip_atr_k': 0.1098343333875362, 'slip_spread_k': 0.835519460699852, 'spread_hl_frac': 0.0011866716042231544, 'bb_std_mult': 3.4447059280110266, 'rsi_os': 42, 'rsi_ob': 52, 'vol_spike': 0.10838204774865969, 'adx_thresh': 7.048109718725069, 'atr_min_pct': 0.010329498981435752, 'atr_max_pct': 0.028504652273550875, 'tp_mult': 1.3113354246619977, 'tsl_mult': 0.6955304307639956, 'strategy': 'mean_reversion', 'time_stop': 109, 'use_sma': True, 'use_atr': False, 'use_adx': True, 'use_ema': True, 'use_spike': True, 'rsi_required': True, 'edge_k': 0.29020167172377304, 'edge_cap': 0.9808234619248353, 'bull_strategy': 'breakout', 'bull_bb_std_mult': 3.2084083238119474, 'bull_rsi_os': 13, 'bull_rsi_ob': 76, 'bull_adx_thresh': 16.238291972633238, 'bull_atr_min_pct': 0.012210289309719227, 'bull_atr_max_pct': 0.12314312989759447, 'bull_tp_mult': 1.6103907647149815, 'bull_tsl_mult': 0.4441628669151297, 'bull_time_stop': 182, 'bull_use_sma': True, 'bull_use_ema': True, 'bull_use_atr': True, 'bull_use_adx': False, 'bull_use_spike': True, 'bull_rsi_required': True, 'bear_strategy': 'mean_reversion', 'bear_bb_std_mult': 2.3642166126809414, 'bear_rsi_os': 38, 'bear_rsi_ob': 57, 'bear_adx_thresh': 10.531837054424555, 'bear_atr_min_pct': 0.0023116068692810845, 'bear_atr_max_pct': 0.11569533075578337, 'bear_tp_mult': 2.012456365742665, 'bear_tsl_mult': 0.09187696910023288, 'bear_time_stop': 101, 'bear_use_sma': False, 'bear_use_ema': False, 'bear_use_atr': False, 'bear_use_adx': False, 'bear_use_spike': True, 'bear_rsi_required': False, 'sideways_strategy': 'mean_reversion', 'sideways_bb_std_mult': 3.1524755384346665, 'sideways_rsi_os': 31, 'sideways_rsi_ob': 91, 'sideways_adx_thresh': 22.543208055435574, 'sideways_atr_min_pct': 0.003817313573992233, 'sideways_atr_max_pct': 0.10700684234102473, 'sideways_tp_mult': 2.44873259030808, 'sideways_tsl_mult': 0.3341879031489865, 'sideways_time_stop': 271, 'sideways_use_sma': True, 'sideways_use_ema': False, 'sideways_use_atr': False, 'sideways_use_adx': True, 'sideways_use_spike': False, 'sideways_rsi_required': False}.
[I 2025-09-01 14:14:25,513] Trial 319 finished with values: [-1000000000.0, 1000000000.0] and parameters: {'p_sma': 28, 'p_std': 59, 'p_atr': 25, 'p_adx': 7, 'rsi_period': 81, 'ema1': 9, 'ema2': 58, 'slip_atr_k': 0.10815090551529327, 'slip_spread_k': 0.8384582085204848, 'spread_hl_frac': 0.00922596726918, 'bb_std_mult': 3.317778829090859, 'rsi_os': 24, 'rsi_ob': 52, 'vol_spike': 0.185650656242738, 'adx_thresh': 6.610587268630293, 'atr_min_pct': 0.009493487597974134, 'atr_max_pct': 0.03528062944995509, 'tp_mult': 1.2049899192544857, 'tsl_mult': 0.7536821354271711, 'strategy': 'mean_reversion', 'time_stop': 113, 'use_sma': True, 'use_atr': False, 'use_adx': True, 'use_ema': True, 'use_spike': True, 'rsi_required': True, 'edge_k': 0.23775430603460224, 'edge_cap': 0.9341501291110145, 'bull_strategy': 'breakout', 'bull_bb_std_mult': 3.367553487840146, 'bull_rsi_os': 15, 'bull_rsi_ob': 80, 'bull_adx_thresh': 11.813833295646639, 'bull_atr_min_pct': 0.01252578053623721, 'bull_atr_max_pct': 0.12477576916236792, 'bull_tp_mult': 2.815787466371834, 'bull_tsl_mult': 0.5028692823092035, 'bull_time_stop': 169, 'bull_use_sma': False, 'bull_use_ema': True, 'bull_use_atr': True, 'bull_use_adx': False, 'bull_use_spike': True, 'bull_rsi_required': True, 'bear_strategy': 'mean_reversion', 'bear_bb_std_mult': 2.321718614537218, 'bear_rsi_os': 34, 'bear_rsi_ob': 60, 'bear_adx_thresh': 10.570989353182739, 'bear_atr_min_pct': 0.018890371929929074, 'bear_atr_max_pct': 0.11565956516340982, 'bear_tp_mult': 1.5022040156886605, 'bear_tsl_mult': 0.0905110582647893, 'bear_time_stop': 95, 'bear_use_sma': False, 'bear_use_ema': False, 'bear_use_atr': False, 'bear_use_adx': False, 'bear_use_spike': True, 'bear_rsi_required': False, 'sideways_strategy': 'mean_reversion', 'sideways_bb_std_mult': 2.8510111395966913, 'sideways_rsi_os': 33, 'sideways_rsi_ob': 91, 'sideways_adx_thresh': 25.17373837764893, 'sideways_atr_min_pct': 0.005490739185421296, 'sideways_atr_max_pct': 0.11343228721796823, 'sideways_tp_mult': 2.4526007622740473, 'sideways_tsl_mult': 0.3912732234437556, 'sideways_time_stop': 144, 'sideways_use_sma': True, 'sideways_use_ema': False, 'sideways_use_atr': True, 'sideways_use_adx': True, 'sideways_use_spike': False, 'sideways_rsi_required': False}.
[I 2025-09-01 14:14:26,751] Trial 320 finished with values: [-1000000000.0, 1000000000.0] and parameters: {'p_sma': 28, 'p_std': 25, 'p_atr': 28, 'p_adx': 7, 'rsi_period': 82, 'ema1': 9, 'ema2': 58, 'slip_atr_k': 0.1394971801763028, 'slip_spread_k': 0.6110518858481329, 'spread_hl_frac': 0.04702941774742575, 'bb_std_mult': 3.362655270683097, 'rsi_os': 24, 'rsi_ob': 52, 'vol_spike': 0.09108720798020399, 'adx_thresh': 6.673405734033685, 'atr_min_pct': 0.009516397166057022, 'atr_max_pct': 0.05766360121791911, 'tp_mult': 1.4079040326864538, 'tsl_mult': 0.7335064386568487, 'strategy': 'mean_reversion', 'time_stop': 38, 'use_sma': True, 'use_atr': False, 'use_adx': True, 'use_ema': True, 'use_spike': True, 'rsi_required': True, 'edge_k': 0.23724850075907755, 'edge_cap': 0.9372713176681019, 'bull_strategy': 'breakout', 'bull_bb_std_mult': 3.1845562257770195, 'bull_rsi_os': 15, 'bull_rsi_ob': 81, 'bull_adx_thresh': 12.019694629127356, 'bull_atr_min_pct': 0.024857860124064865, 'bull_atr_max_pct': 0.1245987635660848, 'bull_tp_mult': 1.6767702434588974, 'bull_tsl_mult': 0.41278429812448914, 'bull_time_stop': 183, 'bull_use_sma': False, 'bull_use_ema': True, 'bull_use_atr': True, 'bull_use_adx': True, 'bull_use_spike': True, 'bull_rsi_required': True, 'bear_strategy': 'mean_reversion', 'bear_bb_std_mult': 2.316422632041421, 'bear_rsi_os': 34, 'bear_rsi_ob': 58, 'bear_adx_thresh': 7.421191701279861, 'bear_atr_min_pct': 0.027106995385265426, 'bear_atr_max_pct': 0.11485989997159034, 'bear_tp_mult': 2.059549794788686, 'bear_tsl_mult': 0.09442427621175822, 'bear_time_stop': 78, 'bear_use_sma': False, 'bear_use_ema': False, 'bear_use_atr': False, 'bear_use_adx': False, 'bear_use_spike': True, 'bear_rsi_required': False, 'sideways_strategy': 'mean_reversion', 'sideways_bb_std_mult': 2.755564732213544, 'sideways_rsi_os': 27, 'sideways_rsi_ob': 91, 'sideways_adx_thresh': 24.149159033949083, 'sideways_atr_min_pct': 0.005072805719611017, 'sideways_atr_max_pct': 0.01310579896859533, 'sideways_tp_mult': 2.4098857905605118, 'sideways_tsl_mult': 0.3704593277777893, 'sideways_time_stop': 261, 'sideways_use_sma': True, 'sideways_use_ema': True, 'sideways_use_atr': True, 'sideways_use_adx': True, 'sideways_use_spike': False, 'sideways_rsi_required': False}.
[I 2025-09-01 14:14:27,450] Trial 321 finished with values: [-1000000000.0, 1000000000.0] and parameters: {'p_sma': 28, 'p_std': 46, 'p_atr': 25, 'p_adx': 7, 'rsi_period': 81, 'ema1': 10, 'ema2': 58, 'slip_atr_k': 0.040473326247868785, 'slip_spread_k': 0.5408933463370124, 'spread_hl_frac': 0.029868020247654583, 'bb_std_mult': 3.3598882999523396, 'rsi_os': 10, 'rsi_ob': 54, 'vol_spike': 0.0966718443658248, 'adx_thresh': 6.725830331755366, 'atr_min_pct': 0.009206437084617675, 'atr_max_pct': 0.034309823414917624, 'tp_mult': 1.4061078636023523, 'tsl_mult': 0.7338430216176599, 'strategy': 'mean_reversion', 'time_stop': 148, 'use_sma': True, 'use_atr': False, 'use_adx': True, 'use_ema': True, 'use_spike': True, 'rsi_required': True, 'edge_k': 0.2292923670514555, 'edge_cap': 0.9265847396697546, 'bull_strategy': 'breakout', 'bull_bb_std_mult': 3.335478215278442, 'bull_rsi_os': 15, 'bull_rsi_ob': 80, 'bull_adx_thresh': 17.2531456627764, 'bull_atr_min_pct': 0.01267109288690816, 'bull_atr_max_pct': 0.12928397035915912, 'bull_tp_mult': 1.6773727976682171, 'bull_tsl_mult': 0.5020710914441437, 'bull_time_stop': 169, 'bull_use_sma': False, 'bull_use_ema': True, 'bull_use_atr': True, 'bull_use_adx': True, 'bull_use_spike': True, 'bull_rsi_required': True, 'bear_strategy': 'mean_reversion', 'bear_bb_std_mult': 2.4827348140692553, 'bear_rsi_os': 33, 'bear_rsi_ob': 80, 'bear_adx_thresh': 7.073577674572662, 'bear_atr_min_pct': 0.00346843900503538, 'bear_atr_max_pct': 0.11220957162665751, 'bear_tp_mult': 1.5016957745866377, 'bear_tsl_mult': 0.25847430548879613, 'bear_time_stop': 77, 'bear_use_sma': False, 'bear_use_ema': False, 'bear_use_atr': False, 'bear_use_adx': False, 'bear_use_spike': True, 'bear_rsi_required': False, 'sideways_strategy': 'mean_reversion', 'sideways_bb_std_mult': 2.8338022163878933, 'sideways_rsi_os': 29, 'sideways_rsi_ob': 71, 'sideways_adx_thresh': 24.1450825419944, 'sideways_atr_min_pct': 0.004855681745911765, 'sideways_atr_max_pct': 0.11255017581318541, 'sideways_tp_mult': 2.4095091680546967, 'sideways_tsl_mult': 0.37768736284374455, 'sideways_time_stop': 144, 'sideways_use_sma': True, 'sideways_use_ema': True, 'sideways_use_atr': True, 'sideways_use_adx': True, 'sideways_use_spike': False, 'sideways_rsi_required': False}.
[I 2025-09-01 14:14:27,450] Trial 318 finished with values: [-1000000000.0, 1000000000.0] and parameters: {'p_sma': 28, 'p_std': 46, 'p_atr': 25, 'p_adx': 7, 'rsi_period': 82, 'ema1': 10, 'ema2': 58, 'slip_atr_k': 0.025355684379831184, 'slip_spread_k': 0.6107446054093163, 'spread_hl_frac': 0.029875400924060692, 'bb_std_mult': 3.3456278021217076, 'rsi_os': 42, 'rsi_ob': 52, 'vol_spike': 0.10735205367114402, 'adx_thresh': 5.655293901402901, 'atr_min_pct': 0.009411420640240328, 'atr_max_pct': 0.03540075496070214, 'tp_mult': 1.415300176506057, 'tsl_mult': 0.7422911609873943, 'strategy': 'mean_reversion', 'time_stop': 248, 'use_sma': True, 'use_atr': False, 'use_adx': True, 'use_ema': True, 'use_spike': True, 'rsi_required': True, 'edge_k': 0.23967948132581154, 'edge_cap': 0.9372260071114759, 'bull_strategy': 'breakout', 'bull_bb_std_mult': 3.3487039807102748, 'bull_rsi_os': 9, 'bull_rsi_ob': 76, 'bull_adx_thresh': 25.536335083015462, 'bull_atr_min_pct': 0.011121485047894104, 'bull_atr_max_pct': 0.12261748380593485, 'bull_tp_mult': 1.7567113105422145, 'bull_tsl_mult': 0.49689275697833357, 'bull_time_stop': 182, 'bull_use_sma': True, 'bull_use_ema': True, 'bull_use_atr': True, 'bull_use_adx': True, 'bull_use_spike': True, 'bull_rsi_required': True, 'bear_strategy': 'mean_reversion', 'bear_bb_std_mult': 2.3065613790065136, 'bear_rsi_os': 38, 'bear_rsi_ob': 79, 'bear_adx_thresh': 6.873740945034312, 'bear_atr_min_pct': 0.014346475719646135, 'bear_atr_max_pct': 0.1162952190219339, 'bear_tp_mult': 2.0848861249277633, 'bear_tsl_mult': 0.08443452774593833, 'bear_time_stop': 95, 'bear_use_sma': False, 'bear_use_ema': False, 'bear_use_atr': False, 'bear_use_adx': False, 'bear_use_spike': True, 'bear_rsi_required': False, 'sideways_strategy': 'mean_reversion', 'sideways_bb_std_mult': 3.167848308006661, 'sideways_rsi_os': 31, 'sideways_rsi_ob': 91, 'sideways_adx_thresh': 24.1040962199022, 'sideways_atr_min_pct': 0.005231429764972404, 'sideways_atr_max_pct': 0.10704341267226385, 'sideways_tp_mult': 2.447023756421524, 'sideways_tsl_mult': 0.37663615667321976, 'sideways_time_stop': 100, 'sideways_use_sma': True, 'sideways_use_ema': True, 'sideways_use_atr': False, 'sideways_use_adx': True, 'sideways_use_spike': True, 'sideways_rsi_required': False}.
[I 2025-09-01 14:14:28,208] Trial 325 finished with values: [-1000000000.0, 1000000000.0] and parameters: {'p_sma': 30, 'p_std': 28, 'p_atr': 26, 'p_adx': 9, 'rsi_period': 77, 'ema1': 29, 'ema2': 56, 'slip_atr_k': 0.009866755076916586, 'slip_spread_k': 0.5620312271986357, 'spread_hl_frac': 0.008381448691111758, 'bb_std_mult': 3.5235637870790413, 'rsi_os': 54, 'rsi_ob': 55, 'vol_spike': 0.1155779486302005, 'adx_thresh': 5.021940819453899, 'atr_min_pct': 0.011898463326710377, 'atr_max_pct': 0.07400780277999237, 'tp_mult': 1.3571337842922722, 'tsl_mult': 0.6713149406033737, 'strategy': 'mean_reversion', 'time_stop': 119, 'use_sma': True, 'use_atr': False, 'use_adx': True, 'use_ema': True, 'use_spike': False, 'rsi_required': True, 'edge_k': 0.09603165632254951, 'edge_cap': 0.971843044287707, 'bull_strategy': 'mean_reversion', 'bull_bb_std_mult': 3.234453487115336, 'bull_rsi_os': 13, 'bull_rsi_ob': 77, 'bull_adx_thresh': 22.69677979834092, 'bull_atr_min_pct': 0.013618871618339867, 'bull_atr_max_pct': 0.12924824087988557, 'bull_tp_mult': 2.5183294256327216, 'bull_tsl_mult': 0.4681921852466257, 'bull_time_stop': 157, 'bull_use_sma': False, 'bull_use_ema': False, 'bull_use_atr': True, 'bull_use_adx': True, 'bull_use_spike': True, 'bull_rsi_required': True, 'bear_strategy': 'mean_reversion', 'bear_bb_std_mult': 2.4015519695768646, 'bear_rsi_os': 35, 'bear_rsi_ob': 58, 'bear_adx_thresh': 34.92118633797392, 'bear_atr_min_pct': 0.00261829306230129, 'bear_atr_max_pct': 0.11938190042220144, 'bear_tp_mult': 2.336520104910888, 'bear_tsl_mult': 0.11602169720786903, 'bear_time_stop': 83, 'bear_use_sma': False, 'bear_use_ema': False, 'bear_use_atr': True, 'bear_use_adx': False, 'bear_use_spike': True, 'bear_rsi_required': False, 'sideways_strategy': 'mean_reversion', 'sideways_bb_std_mult': 3.0922136298666603, 'sideways_rsi_os': 29, 'sideways_rsi_ob': 89, 'sideways_adx_thresh': 25.054603486088816, 'sideways_atr_min_pct': 0.006194230120274336, 'sideways_atr_max_pct': 0.11019545655130486, 'sideways_tp_mult': 1.6361054717001866, 'sideways_tsl_mult': 0.40013590755180845, 'sideways_time_stop': 260, 'sideways_use_sma': True, 'sideways_use_ema': True, 'sideways_use_atr': True, 'sideways_use_adx': True, 'sideways_use_spike': False, 'sideways_rsi_required': False}.
[I 2025-09-01 14:15:08,616] Trial 322 finished with values: [-1000000000.0, 1000000000.0] and parameters: {'p_sma': 28, 'p_std': 28, 'p_atr': 26, 'p_adx': 10, 'rsi_period': 77, 'ema1': 27, 'ema2': 56, 'slip_atr_k': 0.008941226416635532, 'slip_spread_k': 0.6135608475965335, 'spread_hl_frac': 0.01064877117594014, 'bb_std_mult': 3.529025298282936, 'rsi_os': 42, 'rsi_ob': 54, 'vol_spike': 0.11709543197380295, 'adx_thresh': 5.618707400516351, 'atr_min_pct': 0.011743761127928312, 'atr_max_pct': 0.03404336561608065, 'tp_mult': 1.402717594729366, 'tsl_mult': 0.6731600578776192, 'strategy': 'mean_reversion', 'time_stop': 248, 'use_sma': True, 'use_atr': False, 'use_adx': True, 'use_ema': True, 'use_spike': True, 'rsi_required': True, 'edge_k': 0.07438201519302515, 'edge_cap': 0.9172131228922962, 'bull_strategy': 'breakout', 'bull_bb_std_mult': 3.2509710804010146, 'bull_rsi_os': 14, 'bull_rsi_ob': 77, 'bull_adx_thresh': 11.993927318065897, 'bull_atr_min_pct': 0.0037118993356962046, 'bull_atr_max_pct': 0.1283754605696852, 'bull_tp_mult': 1.677065086619608, 'bull_tsl_mult': 0.405220495835826, 'bull_time_stop': 173, 'bull_use_sma': False, 'bull_use_ema': True, 'bull_use_atr': True, 'bull_use_adx': True, 'bull_use_spike': True, 'bull_rsi_required': True, 'bear_strategy': 'mean_reversion', 'bear_bb_std_mult': 2.4167427895376616, 'bear_rsi_os': 37, 'bear_rsi_ob': 74, 'bear_adx_thresh': 6.976772973107252, 'bear_atr_min_pct': 0.027009906335218534, 'bear_atr_max_pct': 0.1179582417250373, 'bear_tp_mult': 2.080713703145233, 'bear_tsl_mult': 0.11812572398205151, 'bear_time_stop': 76, 'bear_use_sma': False, 'bear_use_ema': False, 'bear_use_atr': False, 'bear_use_adx': False, 'bear_use_spike': True, 'bear_rsi_required': False, 'sideways_strategy': 'mean_reversion', 'sideways_bb_std_mult': 3.090332011725773, 'sideways_rsi_os': 29, 'sideways_rsi_ob': 90, 'sideways_adx_thresh': 24.437497748773875, 'sideways_atr_min_pct': 0.005072171554553956, 'sideways_atr_max_pct': 0.051769712702233135, 'sideways_tp_mult': 2.4159437547473575, 'sideways_tsl_mult': 0.36942856215447106, 'sideways_time_stop': 260, 'sideways_use_sma': True, 'sideways_use_ema': True, 'sideways_use_atr': True, 'sideways_use_adx': True, 'sideways_use_spike': False, 'sideways_rsi_required': False}.
