[I 2025-09-01 14:05:52,262] Trial 270 finished with values: [-0.0006738547689656427, 0.008984808918005235] and parameters: {'p_sma': 28, 'p_std': 26, 'p_atr': 26, 'p_adx': 8, 'rsi_period': 78, 'ema1': 8, 'ema2': 58, 'slip_atr_k': 0.018956741188916423, 'slip_spread_k': 0.4955778828715331, 'spread_hl_frac': 0.010041472495632385, 'bb_std_mult': 3.5154085787186258, 'rsi_os': 43, 'rsi_ob': 53, 'vol_spike': 0.10790101543252155, 'adx_thresh': 5.17668988394834, 'atr_min_pct': 0.012078645251303182, 'atr_max_pct': 0.03297065569582361, 'tp_mult': 1.3794782922991278, 'tsl_mult': 0.7141022237892427, 'strategy': 'mean_reversion', 'time_stop': 110, 'use_sma': True, 'use_atr': False, 'use_adx': True, 'use_ema': True, 'use_spike': True, 'rsi_required': True, 'edge_k': 0.25593779286439694, 'edge_cap': 0.9309561337433807, 'bull_strategy': 'breakout', 'bull_bb_std_mult': 2.7252616923615385, 'bull_rsi_os': 13, 'bull_rsi_ob': 78, 'bull_adx_thresh': 11.726847327109937, 'bull_atr_min_pct': 0.012745812060329756, 'bull_atr_max_pct': 0.12681705165260462, 'bull_tp_mult': 1.682290685924296, 'bull_tsl_mult': 0.5985707369943986, 'bull_time_stop': 159, 'bull_use_sma': False, 'bull_use_ema': True, 'bull_use_atr': True, 'bull_use_adx': True, 'bull_use_spike': True, 'bull_rsi_required': True, 'bear_strategy': 'mean_reversion', 'bear_bb_std_mult': 2.5172025266109603, 'bear_rsi_os': 35, 'bear_rsi_ob': 58, 'bear_adx_thresh': 7.795986490220792, 'bear_atr_min_pct': 0.001604723883934408, 'bear_atr_max_pct': 0.10550285533118076, 'bear_tp_mult': 2.049013680567909, 'bear_tsl_mult': 0.12787056779403475, 'bear_time_stop': 89, 'bear_use_sma': False, 'bear_use_ema': False, 'bear_use_atr': False, 'bear_use_adx': False, 'bear_use_spike': True, 'bear_rsi_required': False, 'sideways_strategy': 'mean_reversion', 'sideways_bb_std_mult': 3.217363395166675, 'sideways_rsi_os': 31, 'sideways_rsi_ob': 91, 'sideways_adx_thresh': 25.12864514227786, 'sideways_atr_min_pct': 0.0039757238641127185, 'sideways_atr_max_pct': 0.11136931890274905, 'sideways_tp_mult': 2.4341686234259985, 'sideways_tsl_mult': 0.3775447106483995, 'sideways_time_stop': 261, 'sideways_use_sma': True, 'sideways_use_ema': True, 'sideways_use_atr': True, 'sideways_use_adx': True, 'sideways_use_spike': False, 'sideways_rsi_required': False}.
[I 2025-09-01 14:06:30,584] Trial 273 finished with values: [-0.001503889768296185, 0.00929004927102253] and parameters: {'p_sma': 27, 'p_std': 26, 'p_atr': 26, 'p_adx': 8, 'rsi_period': 78, 'ema1': 9, 'ema2': 58, 'slip_atr_k': 0.01863968121593759, 'slip_spread_k': 0.5011929918844046, 'spread_hl_frac': 0.009740721957318458, 'bb_std_mult': 3.503466767270595, 'rsi_os': 43, 'rsi_ob': 53, 'vol_spike': 0.1083261303108288, 'adx_thresh': 5.135933551597185, 'atr_min_pct': 0.010972371547712701, 'atr_max_pct': 0.028998170861315828, 'tp_mult': 1.385106222888416, 'tsl_mult': 0.7234415913419088, 'strategy': 'mean_reversion', 'time_stop': 111, 'use_sma': True, 'use_atr': False, 'use_adx': True, 'use_ema': True, 'use_spike': True, 'rsi_required': True, 'edge_k': 0.27337344930001656, 'edge_cap': 0.945638457354239, 'bull_strategy': 'breakout', 'bull_bb_std_mult': 3.201765788504545, 'bull_rsi_os': 12, 'bull_rsi_ob': 78, 'bull_adx_thresh': 11.814511519276778, 'bull_atr_min_pct': 0.013239004752289302, 'bull_atr_max_pct': 0.12741130731992847, 'bull_tp_mult': 1.632821531187974, 'bull_tsl_mult': 0.5986399638542972, 'bull_time_stop': 144, 'bull_use_sma': False, 'bull_use_ema': True, 'bull_use_atr': True, 'bull_use_adx': True, 'bull_use_spike': True, 'bull_rsi_required': True, 'bear_strategy': 'mean_reversion', 'bear_bb_std_mult': 2.5286857187635943, 'bear_rsi_os': 35, 'bear_rsi_ob': 57, 'bear_adx_thresh': 7.818146313705966, 'bear_atr_min_pct': 0.001985219486958937, 'bear_atr_max_pct': 0.10912669258426419, 'bear_tp_mult': 2.0584858258116814, 'bear_tsl_mult': 0.125830356926455, 'bear_time_stop': 82, 'bear_use_sma': False, 'bear_use_ema': False, 'bear_use_atr': False, 'bear_use_adx': False, 'bear_use_spike': True, 'bear_rsi_required': False, 'sideways_strategy': 'mean_reversion', 'sideways_bb_std_mult': 3.2466545635315582, 'sideways_rsi_os': 30, 'sideways_rsi_ob': 91, 'sideways_adx_thresh': 26.246551043946447, 'sideways_atr_min_pct': 0.004175152888207, 'sideways_atr_max_pct': 0.10989481220178535, 'sideways_tp_mult': 2.428025064679874, 'sideways_tsl_mult': 0.3936873049319545, 'sideways_time_stop': 260, 'sideways_use_sma': True, 'sideways_use_ema': True, 'sideways_use_atr': True, 'sideways_use_adx': True, 'sideways_use_spike': False, 'sideways_rsi_required': False}.
[I 2025-09-01 14:06:31,466] Trial 272 finished with values: [0.00034949288538999035, 0.006726219210951655] and parameters: {'p_sma': 26, 'p_std': 26, 'p_atr': 26, 'p_adx': 8, 'rsi_period': 80, 'ema1': 8, 'ema2': 57, 'slip_atr_k': 0.019358701538329783, 'slip_spread_k': 0.5034354014182989, 'spread_hl_frac': 0.009727087599065168, 'bb_std_mult': 3.4700121147854106, 'rsi_os': 42, 'rsi_ob': 53, 'vol_spike': 0.10805637446420967, 'adx_thresh': 5.274625579211579, 'atr_min_pct': 0.011836269692031748, 'atr_max_pct': 0.031868321058802225, 'tp_mult': 1.3872751240307586, 'tsl_mult': 0.7394560721616625, 'strategy': 'mean_reversion', 'time_stop': 112, 'use_sma': True, 'use_atr': False, 'use_adx': True, 'use_ema': True, 'use_spike': True, 'rsi_required': True, 'edge_k': 0.2370535952836711, 'edge_cap': 0.9378639088765514, 'bull_strategy': 'breakout', 'bull_bb_std_mult': 3.142633002796031, 'bull_rsi_os': 13, 'bull_rsi_ob': 78, 'bull_adx_thresh': 11.93089312955283, 'bull_atr_min_pct': 0.013010551310131842, 'bull_atr_max_pct': 0.12872284452118404, 'bull_tp_mult': 1.6145208460129878, 'bull_tsl_mult': 0.5984641022189251, 'bull_time_stop': 145, 'bull_use_sma': False, 'bull_use_ema': True, 'bull_use_atr': True, 'bull_use_adx': True, 'bull_use_spike': True, 'bull_rsi_required': True, 'bear_strategy': 'mean_reversion', 'bear_bb_std_mult': 2.5053185574724406, 'bear_rsi_os': 35, 'bear_rsi_ob': 58, 'bear_adx_thresh': 7.934629019744055, 'bear_atr_min_pct': 0.0016478496898499739, 'bear_atr_max_pct': 0.10592640897079478, 'bear_tp_mult': 2.067980193798601, 'bear_tsl_mult': 0.12145685747059563, 'bear_time_stop': 89, 'bear_use_sma': False, 'bear_use_ema': False, 'bear_use_atr': False, 'bear_use_adx': False, 'bear_use_spike': True, 'bear_rsi_required': False, 'sideways_strategy': 'mean_reversion', 'sideways_bb_std_mult': 3.174403373652647, 'sideways_rsi_os': 31, 'sideways_rsi_ob': 90, 'sideways_adx_thresh': 26.29708335300352, 'sideways_atr_min_pct': 0.004025714704365875, 'sideways_atr_max_pct': 0.11058636266508462, 'sideways_tp_mult': 2.4035355176664455, 'sideways_tsl_mult': 0.3935918293627778, 'sideways_time_stop': 262, 'sideways_use_sma': True, 'sideways_use_ema': True, 'sideways_use_atr': True, 'sideways_use_adx': True, 'sideways_use_spike': False, 'sideways_rsi_required': False}.
[I 2025-09-01 14:06:31,913] Trial 274 finished with values: [-0.0006098026244101273, 0.009241305648498494] and parameters: {'p_sma': 28, 'p_std': 26, 'p_atr': 26, 'p_adx': 8, 'rsi_period': 78, 'ema1': 6, 'ema2': 55, 'slip_atr_k': 0.018327748281015355, 'slip_spread_k': 0.5593482944809466, 'spread_hl_frac': 0.009834899786058188, 'bb_std_mult': 3.4897215581929952, 'rsi_os': 43, 'rsi_ob': 53, 'vol_spike': 0.10952001547784483, 'adx_thresh': 5.216853475710256, 'atr_min_pct': 0.012000919910762617, 'atr_max_pct': 0.030416380098478753, 'tp_mult': 1.400563310854662, 'tsl_mult': 0.7121700400401445, 'strategy': 'mean_reversion', 'time_stop': 112, 'use_sma': True, 'use_atr': False, 'use_adx': True, 'use_ema': True, 'use_spike': True, 'rsi_required': True, 'edge_k': 0.26732206839302364, 'edge_cap': 0.9349039843779671, 'bull_strategy': 'breakout', 'bull_bb_std_mult': 2.674057470459429, 'bull_rsi_os': 13, 'bull_rsi_ob': 78, 'bull_adx_thresh': 11.824632173247913, 'bull_atr_min_pct': 0.013172114476957977, 'bull_atr_max_pct': 0.1275198909610163, 'bull_tp_mult': 1.5983499011170423, 'bull_tsl_mult': 0.47197537701415576, 'bull_time_stop': 143, 'bull_use_sma': False, 'bull_use_ema': True, 'bull_use_atr': True, 'bull_use_adx': True, 'bull_use_spike': True, 'bull_rsi_required': True, 'bear_strategy': 'mean_reversion', 'bear_bb_std_mult': 2.5225549461173102, 'bear_rsi_os': 35, 'bear_rsi_ob': 57, 'bear_adx_thresh': 7.825302996015767, 'bear_atr_min_pct': 0.0017367553080701445, 'bear_atr_max_pct': 0.10970728265471558, 'bear_tp_mult': 2.0506816194224373, 'bear_tsl_mult': 0.12251741528789759, 'bear_time_stop': 89, 'bear_use_sma': False, 'bear_use_ema': False, 'bear_use_atr': False, 'bear_use_adx': False, 'bear_use_spike': True, 'bear_rsi_required': False, 'sideways_strategy': 'mean_reversion', 'sideways_bb_std_mult': 3.1986838392306702, 'sideways_rsi_os': 30, 'sideways_rsi_ob': 91, 'sideways_adx_thresh': 25.0673414567625, 'sideways_atr_min_pct': 0.004261835639308978, 'sideways_atr_max_pct': 0.1103315749495505, 'sideways_tp_mult': 2.4209948675062996, 'sideways_tsl_mult': 0.3774829778116982, 'sideways_time_stop': 249, 'sideways_use_sma': True, 'sideways_use_ema': True, 'sideways_use_atr': True, 'sideways_use_adx': True, 'sideways_use_spike': False, 'sideways_rsi_required': False}.
[I 2025-09-01 14:06:32,182] Trial 271 finished with values: [0.002084867661538148, 0.007278466517168168] and parameters: {'p_sma': 28, 'p_std': 26, 'p_atr': 26, 'p_adx': 8, 'rsi_period': 78, 'ema1': 8, 'ema2': 57, 'slip_atr_k': 0.021426524497209352, 'slip_spread_k': 0.5018871329333083, 'spread_hl_frac': 0.00991001126522906, 'bb_std_mult': 3.492358526575434, 'rsi_os': 43, 'rsi_ob': 53, 'vol_spike': 0.10757420147570784, 'adx_thresh': 5.062354836125833, 'atr_min_pct': 0.011844512165228376, 'atr_max_pct': 0.032159206412798805, 'tp_mult': 1.394802827485114, 'tsl_mult': 0.7372069940216118, 'strategy': 'mean_reversion', 'time_stop': 112, 'use_sma': True, 'use_atr': False, 'use_adx': True, 'use_ema': True, 'use_spike': True, 'rsi_required': True, 'edge_k': 0.23837916001554843, 'edge_cap': 0.9396612592984243, 'bull_strategy': 'breakout', 'bull_bb_std_mult': 2.760016628927262, 'bull_rsi_os': 13, 'bull_rsi_ob': 78, 'bull_adx_thresh': 10.83073789809359, 'bull_atr_min_pct': 0.012980184162290619, 'bull_atr_max_pct': 0.12804294451001214, 'bull_tp_mult': 1.612622553594537, 'bull_tsl_mult': 0.596143698493639, 'bull_time_stop': 143, 'bull_use_sma': False, 'bull_use_ema': True, 'bull_use_atr': True, 'bull_use_adx': True, 'bull_use_spike': True, 'bull_rsi_required': True, 'bear_strategy': 'mean_reversion', 'bear_bb_std_mult': 2.5099544891259655, 'bear_rsi_os': 35, 'bear_rsi_ob': 58, 'bear_adx_thresh': 7.743373974968633, 'bear_atr_min_pct': 0.0022800739244638085, 'bear_atr_max_pct': 0.10992513528704842, 'bear_tp_mult': 2.122452940178069, 'bear_tsl_mult': 0.1109570316921766, 'bear_time_stop': 80, 'bear_use_sma': False, 'bear_use_ema': False, 'bear_use_atr': False, 'bear_use_adx': False, 'bear_use_spike': True, 'bear_rsi_required': False, 'sideways_strategy': 'mean_reversion', 'sideways_bb_std_mult': 3.222395683757594, 'sideways_rsi_os': 31, 'sideways_rsi_ob': 91, 'sideways_adx_thresh': 26.31936306292093, 'sideways_atr_min_pct': 0.004144674328644889, 'sideways_atr_max_pct': 0.11135915601861568, 'sideways_tp_mult': 2.4179867711155953, 'sideways_tsl_mult': 0.3821438369276556, 'sideways_time_stop': 249, 'sideways_use_sma': True, 'sideways_use_ema': True, 'sideways_use_atr': True, 'sideways_use_adx': True, 'sideways_use_spike': False, 'sideways_rsi_required': False}.
[I 2025-09-01 14:07:09,386] Trial 278 finished with values: [0.0024470879775122523, 0.004687495031500998] and parameters: {'p_sma': 30, 'p_std': 25, 'p_atr': 26, 'p_adx': 9, 'rsi_period': 80, 'ema1': 7, 'ema2': 56, 'slip_atr_k': 0.005389008344641118, 'slip_spread_k': 0.5547397128629676, 'spread_hl_frac': 0.012641946434709133, 'bb_std_mult': 3.4640334706057105, 'rsi_os': 44, 'rsi_ob': 51, 'vol_spike': 0.10406272517503155, 'adx_thresh': 6.184252441194495, 'atr_min_pct': 0.011891585586277387, 'atr_max_pct': 0.03255333676243158, 'tp_mult': 1.3270431183031688, 'tsl_mult': 0.680807165359991, 'strategy': 'mean_reversion', 'time_stop': 116, 'use_sma': True, 'use_atr': False, 'use_adx': True, 'use_ema': True, 'use_spike': True, 'rsi_required': True, 'edge_k': 0.2348031476811565, 'edge_cap': 0.997263467500182, 'bull_strategy': 'breakout', 'bull_bb_std_mult': 2.8055017653808045, 'bull_rsi_os': 12, 'bull_rsi_ob': 79, 'bull_adx_thresh': 9.126487334808658, 'bull_atr_min_pct': 0.011688706896826143, 'bull_atr_max_pct': 0.1270873287143721, 'bull_tp_mult': 1.594857158543163, 'bull_tsl_mult': 0.47308826250963687, 'bull_time_stop': 155, 'bull_use_sma': False, 'bull_use_ema': True, 'bull_use_atr': True, 'bull_use_adx': True, 'bull_use_spike': True, 'bull_rsi_required': True, 'bear_strategy': 'mean_reversion', 'bear_bb_std_mult': 2.5706596516807774, 'bear_rsi_os': 34, 'bear_rsi_ob': 58, 'bear_adx_thresh': 7.141825927340842, 'bear_atr_min_pct': 0.0025738068603799744, 'bear_atr_max_pct': 0.11586938805679156, 'bear_tp_mult': 2.0529685276987526, 'bear_tsl_mult': 0.2836503580988153, 'bear_time_stop': 90, 'bear_use_sma': False, 'bear_use_ema': False, 'bear_use_atr': False, 'bear_use_adx': False, 'bear_use_spike': True, 'bear_rsi_required': False, 'sideways_strategy': 'mean_reversion', 'sideways_bb_std_mult': 3.0694556281759255, 'sideways_rsi_os': 31, 'sideways_rsi_ob': 89, 'sideways_adx_thresh': 25.381534920540844, 'sideways_atr_min_pct': 0.003300675996845111, 'sideways_atr_max_pct': 0.11331825956085391, 'sideways_tp_mult': 2.297749411453378, 'sideways_tsl_mult': 0.3620628984058364, 'sideways_time_stop': 248, 'sideways_use_sma': True, 'sideways_use_ema': True, 'sideways_use_atr': True, 'sideways_use_adx': True, 'sideways_use_spike': False, 'sideways_rsi_required': False}.
[I 2025-09-01 14:07:10,046] Trial 276 finished with values: [0.00650574554852934, 0.003048956646773523] and parameters: {'p_sma': 29, 'p_std': 28, 'p_atr': 26, 'p_adx': 8, 'rsi_period': 80, 'ema1': 9, 'ema2': 57, 'slip_atr_k': 0.012217888296795409, 'slip_spread_k': 0.5592950526642972, 'spread_hl_frac': 0.00969093924551107, 'bb_std_mult': 3.4767419023868893, 'rsi_os': 43, 'rsi_ob': 53, 'vol_spike': 0.11152569607652489, 'adx_thresh': 5.141351175999586, 'atr_min_pct': 0.010857944776323493, 'atr_max_pct': 0.03376113718449038, 'tp_mult': 1.3915005163922292, 'tsl_mult': 0.6847957038621121, 'strategy': 'mean_reversion', 'time_stop': 112, 'use_sma': True, 'use_atr': False, 'use_adx': True, 'use_ema': True, 'use_spike': True, 'rsi_required': True, 'edge_k': 0.24312699051658226, 'edge_cap': 0.9582543558417759, 'bull_strategy': 'breakout', 'bull_bb_std_mult': 3.1887731813308178, 'bull_rsi_os': 13, 'bull_rsi_ob': 78, 'bull_adx_thresh': 11.89275075345056, 'bull_atr_min_pct': 0.011638067342548325, 'bull_atr_max_pct': 0.1281702746833006, 'bull_tp_mult': 1.6166154589857389, 'bull_tsl_mult': 0.46703616012455623, 'bull_time_stop': 156, 'bull_use_sma': False, 'bull_use_ema': True, 'bull_use_atr': True, 'bull_use_adx': True, 'bull_use_spike': True, 'bull_rsi_required': True, 'bear_strategy': 'mean_reversion', 'bear_bb_std_mult': 2.5183289568390386, 'bear_rsi_os': 35, 'bear_rsi_ob': 57, 'bear_adx_thresh': 7.791114191603144, 'bear_atr_min_pct': 0.0024025586956304044, 'bear_atr_max_pct': 0.11046629121952184, 'bear_tp_mult': 2.043040839822377, 'bear_tsl_mult': 0.12572918094366514, 'bear_time_stop': 90, 'bear_use_sma': False, 'bear_use_ema': False, 'bear_use_atr': False, 'bear_use_adx': False, 'bear_use_spike': True, 'bear_rsi_required': False, 'sideways_strategy': 'mean_reversion', 'sideways_bb_std_mult': 3.0638084048395924, 'sideways_rsi_os': 31, 'sideways_rsi_ob': 90, 'sideways_adx_thresh': 25.276662831242746, 'sideways_atr_min_pct': 0.004149179570849119, 'sideways_atr_max_pct': 0.1102406571487859, 'sideways_tp_mult': 2.426437800473273, 'sideways_tsl_mult': 0.3792528841345889, 'sideways_time_stop': 261, 'sideways_use_sma': True, 'sideways_use_ema': True, 'sideways_use_atr': True, 'sideways_use_adx': True, 'sideways_use_spike': False, 'sideways_rsi_required': False}.
[I 2025-09-01 14:07:10,499] Trial 275 finished with values: [0.0018587618121466143, 0.006234288036143402] and parameters: {'p_sma': 28, 'p_std': 26, 'p_atr': 25, 'p_adx': 8, 'rsi_period': 80, 'ema1': 9, 'ema2': 56, 'slip_atr_k': 0.014220292434704011, 'slip_spread_k': 0.5491764046883123, 'spread_hl_frac': 0.00982552337959844, 'bb_std_mult': 3.4663370376241636, 'rsi_os': 43, 'rsi_ob': 53, 'vol_spike': 0.10681826179837137, 'adx_thresh': 5.254788474826537, 'atr_min_pct': 0.011082296123721452, 'atr_max_pct': 0.03142567030765206, 'tp_mult': 1.3866162429700961, 'tsl_mult': 0.7226922669207034, 'strategy': 'mean_reversion', 'time_stop': 112, 'use_sma': True, 'use_atr': False, 'use_adx': True, 'use_ema': True, 'use_spike': True, 'rsi_required': True, 'edge_k': 0.2871613055047397, 'edge_cap': 0.9419076056348449, 'bull_strategy': 'breakout', 'bull_bb_std_mult': 2.7098580861273183, 'bull_rsi_os': 12, 'bull_rsi_ob': 78, 'bull_adx_thresh': 11.89790371203917, 'bull_atr_min_pct': 0.013760066942879031, 'bull_atr_max_pct': 0.12811479977878154, 'bull_tp_mult': 1.6239783678245863, 'bull_tsl_mult': 0.5944210521947884, 'bull_time_stop': 159, 'bull_use_sma': False, 'bull_use_ema': True, 'bull_use_atr': True, 'bull_use_adx': True, 'bull_use_spike': True, 'bull_rsi_required': True, 'bear_strategy': 'mean_reversion', 'bear_bb_std_mult': 2.530280437474782, 'bear_rsi_os': 35, 'bear_rsi_ob': 58, 'bear_adx_thresh': 7.6793499631047535, 'bear_atr_min_pct': 0.002731621810949622, 'bear_atr_max_pct': 0.11050504177202787, 'bear_tp_mult': 2.0506584595766792, 'bear_tsl_mult': 0.12063462514941721, 'bear_time_stop': 79, 'bear_use_sma': False, 'bear_use_ema': False, 'bear_use_atr': False, 'bear_use_adx': False, 'bear_use_spike': True, 'bear_rsi_required': False, 'sideways_strategy': 'mean_reversion', 'sideways_bb_std_mult': 3.052505881995555, 'sideways_rsi_os': 30, 'sideways_rsi_ob': 91, 'sideways_adx_thresh': 24.703141380139872, 'sideways_atr_min_pct': 0.004061115164547649, 'sideways_atr_max_pct': 0.11080476398317833, 'sideways_tp_mult': 2.4169314209498136, 'sideways_tsl_mult': 0.37438601522796994, 'sideways_time_stop': 261, 'sideways_use_sma': True, 'sideways_use_ema': True, 'sideways_use_atr': True, 'sideways_use_adx': True, 'sideways_use_spike': False, 'sideways_rsi_required': False}.
[I 2025-09-01 14:07:10,906] Trial 277 finished with values: [0.00798380764337292, 0.004297556777089453] and parameters: {'p_sma': 29, 'p_std': 26, 'p_atr': 27, 'p_adx': 8, 'rsi_period': 79, 'ema1': 9, 'ema2': 57, 'slip_atr_k': 0.005025168880607788, 'slip_spread_k': 0.5548619310567691, 'spread_hl_frac': 0.00961913528994124, 'bb_std_mult': 3.4647429013829267, 'rsi_os': 44, 'rsi_ob': 53, 'vol_spike': 0.10385797566917711, 'adx_thresh': 5.905173792927502, 'atr_min_pct': 0.011963827137998437, 'atr_max_pct': 0.02957775710357315, 'tp_mult': 1.3349615264588908, 'tsl_mult': 0.6797150345590073, 'strategy': 'mean_reversion', 'time_stop': 113, 'use_sma': True, 'use_atr': False, 'use_adx': True, 'use_ema': True, 'use_spike': True, 'rsi_required': True, 'edge_k': 0.25468032577377164, 'edge_cap': 0.996377006490442, 'bull_strategy': 'breakout', 'bull_bb_std_mult': 3.2101941298952306, 'bull_rsi_os': 14, 'bull_rsi_ob': 78, 'bull_adx_thresh': 8.946647886774093, 'bull_atr_min_pct': 0.012812511062128303, 'bull_atr_max_pct': 0.12807480938545987, 'bull_tp_mult': 1.594347234159328, 'bull_tsl_mult': 0.5868146828127054, 'bull_time_stop': 159, 'bull_use_sma': False, 'bull_use_ema': True, 'bull_use_atr': True, 'bull_use_adx': True, 'bull_use_spike': True, 'bull_rsi_required': True, 'bear_strategy': 'mean_reversion', 'bear_bb_std_mult': 2.547565947795333, 'bear_rsi_os': 36, 'bear_rsi_ob': 57, 'bear_adx_thresh': 7.546501164105622, 'bear_atr_min_pct': 0.0029301264014554474, 'bear_atr_max_pct': 0.1145440800617141, 'bear_tp_mult': 2.1416570824507, 'bear_tsl_mult': 0.2937656533043226, 'bear_time_stop': 90, 'bear_use_sma': False, 'bear_use_ema': False, 'bear_use_atr': False, 'bear_use_adx': False, 'bear_use_spike': True, 'bear_rsi_required': False, 'sideways_strategy': 'mean_reversion', 'sideways_bb_std_mult': 2.9555757525544544, 'sideways_rsi_os': 30, 'sideways_rsi_ob': 91, 'sideways_adx_thresh': 25.132253155755148, 'sideways_atr_min_pct': 0.003287782428887068, 'sideways_atr_max_pct': 0.11240525945613906, 'sideways_tp_mult': 2.4309783088712607, 'sideways_tsl_mult': 0.41567929463279374, 'sideways_time_stop': 248, 'sideways_use_sma': True, 'sideways_use_ema': True, 'sideways_use_atr': True, 'sideways_use_adx': True, 'sideways_use_spike': False, 'sideways_rsi_required': False}.
