[I 2025-09-01 14:49:59,333] Trial 568 finished with values: [-1000000000.0, 1000000000.0] and parameters: {'p_sma': 25, 'p_std': 46, 'p_atr': 26, 'p_adx': 7, 'rsi_period': 80, 'ema1': 28, 'ema2': 23, 'slip_atr_k': 0.0641400615313836, 'slip_spread_k': 0.6175282923172986, 'spread_hl_frac': 0.015014437277824935, 'bb_std_mult': 2.5544911266786747, 'rsi_os': 43, 'rsi_ob': 49, 'vol_spike': 0.28946752519004904, 'adx_thresh': 7.386793792874468, 'atr_min_pct': 0.008084487589468742, 'atr_max_pct': 0.12372544024799578, 'tp_mult': 2.4039036363523976, 'tsl_mult': 0.8432990809983583, 'strategy': 'mean_reversion', 'time_stop': 107, 'use_sma': False, 'use_atr': False, 'use_adx': True, 'use_ema': True, 'use_spike': True, 'rsi_required': True, 'edge_k': 1.3950130621012942, 'edge_cap': 0.9049194131039995, 'bull_strategy': 'breakout', 'bull_bb_std_mult': 3.2240264102288037, 'bull_rsi_os': 11, 'bull_rsi_ob': 67, 'bull_adx_thresh': 13.959802093611811, 'bull_atr_min_pct': 0.01057710869187589, 'bull_atr_max_pct': 0.13000668420926248, 'bull_tp_mult': 1.6406399352089487, 'bull_tsl_mult': 0.9990398790630157, 'bull_time_stop': 172, 'bull_use_sma': False, 'bull_use_ema': False, 'bull_use_atr': True, 'bull_use_adx': True, 'bull_use_spike': False, 'bull_rsi_required': False, 'bear_strategy': 'mean_reversion', 'bear_bb_std_mult': 3.220696156721818, 'bear_rsi_os': 34, 'bear_rsi_ob': 59, 'bear_adx_thresh': 8.449756232280453, 'bear_atr_min_pct': 0.024670549727012908, 'bear_atr_max_pct': 0.09401185204200067, 'bear_tp_mult': 2.001292603094409, 'bear_tsl_mult': 0.06464731120160289, 'bear_time_stop': 226, 'bear_use_sma': True, 'bear_use_ema': False, 'bear_use_atr': False, 'bear_use_adx': False, 'bear_use_spike': True, 'bear_rsi_required': False, 'sideways_strategy': 'mean_reversion', 'sideways_bb_std_mult': 2.9100157379683287, 'sideways_rsi_os': 32, 'sideways_rsi_ob': 87, 'sideways_adx_thresh': 26.91905765874507, 'sideways_atr_min_pct': 0.003571811430656323, 'sideways_atr_max_pct': 0.10918838133597097, 'sideways_tp_mult': 2.4897027818215016, 'sideways_tsl_mult': 0.2158945702275904, 'sideways_time_stop': 96, 'sideways_use_sma': True, 'sideways_use_ema': True, 'sideways_use_atr': True, 'sideways_use_adx': True, 'sideways_use_spike': False, 'sideways_rsi_required': False}.
[I 2025-09-01 14:50:39,577] Trial 567 finished with values: [-1000000000.0, 1000000000.0] and parameters: {'p_sma': 37, 'p_std': 30, 'p_atr': 26, 'p_adx': 7, 'rsi_period': 80, 'ema1': 27, 'ema2': 56, 'slip_atr_k': 0.0004409209833049687, 'slip_spread_k': 0.6268111019428702, 'spread_hl_frac': 0.020493911685494158, 'bb_std_mult': 3.360046263032279, 'rsi_os': 46, 'rsi_ob': 51, 'vol_spike': 0.07287781821859803, 'adx_thresh': 7.037462435200623, 'atr_min_pct': 0.011611867870285682, 'atr_max_pct': 0.04237708084202367, 'tp_mult': 2.421426307556125, 'tsl_mult': 0.518615279619344, 'strategy': 'mean_reversion', 'time_stop': 107, 'use_sma': False, 'use_atr': False, 'use_adx': True, 'use_ema': True, 'use_spike': True, 'rsi_required': True, 'edge_k': 0.105452865204819, 'edge_cap': 0.8966017844321834, 'bull_strategy': 'breakout', 'bull_bb_std_mult': 1.0863377009600859, 'bull_rsi_os': 13, 'bull_rsi_ob': 78, 'bull_adx_thresh': 14.010403259724596, 'bull_atr_min_pct': 0.011253191081881988, 'bull_atr_max_pct': 0.10796496584973064, 'bull_tp_mult': 1.627450690584967, 'bull_tsl_mult': 0.5045018282433827, 'bull_time_stop': 147, 'bull_use_sma': False, 'bull_use_ema': True, 'bull_use_atr': True, 'bull_use_adx': True, 'bull_use_spike': False, 'bull_rsi_required': True, 'bear_strategy': 'mean_reversion', 'bear_bb_std_mult': 2.5638160871198283, 'bear_rsi_os': 34, 'bear_rsi_ob': 93, 'bear_adx_thresh': 6.250868684239788, 'bear_atr_min_pct': 0.024687392637636415, 'bear_atr_max_pct': 0.10131206735839725, 'bear_tp_mult': 2.8547029261589705, 'bear_tsl_mult': 0.2524664553565788, 'bear_time_stop': 28, 'bear_use_sma': True, 'bear_use_ema': False, 'bear_use_atr': False, 'bear_use_adx': False, 'bear_use_spike': True, 'bear_rsi_required': False, 'sideways_strategy': 'mean_reversion', 'sideways_bb_std_mult': 2.8640463540905654, 'sideways_rsi_os': 28, 'sideways_rsi_ob': 87, 'sideways_adx_thresh': 13.687917507838158, 'sideways_atr_min_pct': 0.003284118564494564, 'sideways_atr_max_pct': 0.02254503042981145, 'sideways_tp_mult': 2.407123781192339, 'sideways_tsl_mult': 0.4545204332238575, 'sideways_time_stop': 255, 'sideways_use_sma': True, 'sideways_use_ema': True, 'sideways_use_atr': False, 'sideways_use_adx': True, 'sideways_use_spike': False, 'sideways_rsi_required': False}.
[I 2025-09-01 14:50:42,214] Trial 569 finished with values: [-0.03993409191881381, 0.03976236560739254] and parameters: {'p_sma': 25, 'p_std': 23, 'p_atr': 24, 'p_adx': 18, 'rsi_period': 80, 'ema1': 28, 'ema2': 56, 'slip_atr_k': 0.21096694460275225, 'slip_spread_k': 0.5925467572048844, 'spread_hl_frac': 0.024165855594275715, 'bb_std_mult': 2.69108054042026, 'rsi_os': 43, 'rsi_ob': 54, 'vol_spike': 0.12392641927449191, 'adx_thresh': 8.602178207974443, 'atr_min_pct': 0.01459658375389914, 'atr_max_pct': 0.08624946402734211, 'tp_mult': 1.4562572137660836, 'tsl_mult': 0.8390498014605119, 'strategy': 'mean_reversion', 'time_stop': 167, 'use_sma': True, 'use_atr': False, 'use_adx': True, 'use_ema': True, 'use_spike': False, 'rsi_required': True, 'edge_k': 1.6759788421015744, 'edge_cap': 0.931222945312895, 'bull_strategy': 'breakout', 'bull_bb_std_mult': 3.2280592053989827, 'bull_rsi_os': 48, 'bull_rsi_ob': 74, 'bull_adx_thresh': 13.8741396690187, 'bull_atr_min_pct': 0.010523401167923455, 'bull_atr_max_pct': 0.0950029067562208, 'bull_tp_mult': 1.6287610254725735, 'bull_tsl_mult': 0.4555220492416273, 'bull_time_stop': 149, 'bull_use_sma': False, 'bull_use_ema': True, 'bull_use_atr': False, 'bull_use_adx': True, 'bull_use_spike': True, 'bull_rsi_required': True, 'bear_strategy': 'mean_reversion', 'bear_bb_std_mult': 2.596052594923951, 'bear_rsi_os': 36, 'bear_rsi_ob': 65, 'bear_adx_thresh': 6.219399081951369, 'bear_atr_min_pct': 0.0020251217008944618, 'bear_atr_max_pct': 0.10437765165293268, 'bear_tp_mult': 2.3240071327000793, 'bear_tsl_mult': 0.06675928632615794, 'bear_time_stop': 93, 'bear_use_sma': True, 'bear_use_ema': False, 'bear_use_atr': False, 'bear_use_adx': True, 'bear_use_spike': True, 'bear_rsi_required': False, 'sideways_strategy': 'breakout', 'sideways_bb_std_mult': 2.397410056109063, 'sideways_rsi_os': 33, 'sideways_rsi_ob': 90, 'sideways_adx_thresh': 13.76435908405885, 'sideways_atr_min_pct': 0.005266536690973443, 'sideways_atr_max_pct': 0.1051895823232994, 'sideways_tp_mult': 2.4120640305081644, 'sideways_tsl_mult': 0.5084678249304259, 'sideways_time_stop': 37, 'sideways_use_sma': True, 'sideways_use_ema': True, 'sideways_use_atr': True, 'sideways_use_adx': True, 'sideways_use_spike': False, 'sideways_rsi_required': False}.
[I 2025-09-01 14:50:42,656] Trial 570 finished with values: [-0.010735188055555178, 0.011274181602192016] and parameters: {'p_sma': 33, 'p_std': 30, 'p_atr': 18, 'p_adx': 7, 'rsi_period': 80, 'ema1': 5, 'ema2': 56, 'slip_atr_k': 0.014755373503303802, 'slip_spread_k': 0.6001953191975086, 'spread_hl_frac': 0.026381476531563884, 'bb_std_mult': 1.0276558521213734, 'rsi_os': 46, 'rsi_ob': 77, 'vol_spike': 0.12558694242775836, 'adx_thresh': 30.148136045565252, 'atr_min_pct': 0.011224580936225758, 'atr_max_pct': 0.1401933818698846, 'tp_mult': 2.1817296988678683, 'tsl_mult': 0.8401541285182521, 'strategy': 'mean_reversion', 'time_stop': 94, 'use_sma': True, 'use_atr': False, 'use_adx': True, 'use_ema': True, 'use_spike': False, 'rsi_required': True, 'edge_k': 1.014547139476177, 'edge_cap': 0.9455728681367311, 'bull_strategy': 'breakout', 'bull_bb_std_mult': 0.8550539684311764, 'bull_rsi_os': 27, 'bull_rsi_ob': 74, 'bull_adx_thresh': 13.912575685195531, 'bull_atr_min_pct': 0.010398428296960971, 'bull_atr_max_pct': 0.12237274442582909, 'bull_tp_mult': 1.6302357807314594, 'bull_tsl_mult': 0.1541060710255674, 'bull_time_stop': 147, 'bull_use_sma': False, 'bull_use_ema': True, 'bull_use_atr': False, 'bull_use_adx': True, 'bull_use_spike': True, 'bull_rsi_required': True, 'bear_strategy': 'mean_reversion', 'bear_bb_std_mult': 3.3268336669566576, 'bear_rsi_os': 36, 'bear_rsi_ob': 65, 'bear_adx_thresh': 6.332979792634232, 'bear_atr_min_pct': 0.001852030576687575, 'bear_atr_max_pct': 0.10282027243875666, 'bear_tp_mult': 2.7366983017316846, 'bear_tsl_mult': 0.9983849577685797, 'bear_time_stop': 94, 'bear_use_sma': True, 'bear_use_ema': False, 'bear_use_atr': False, 'bear_use_adx': True, 'bear_use_spike': True, 'bear_rsi_required': False, 'sideways_strategy': 'breakout', 'sideways_bb_std_mult': 2.120018371267789, 'sideways_rsi_os': 17, 'sideways_rsi_ob': 90, 'sideways_adx_thresh': 27.068019123680017, 'sideways_atr_min_pct': 0.004893133605425129, 'sideways_atr_max_pct': 0.07512300486508815, 'sideways_tp_mult': 2.5007645539028593, 'sideways_tsl_mult': 0.4629786005232148, 'sideways_time_stop': 37, 'sideways_use_sma': True, 'sideways_use_ema': True, 'sideways_use_atr': True, 'sideways_use_adx': True, 'sideways_use_spike': False, 'sideways_rsi_required': False}.
[I 2025-09-01 14:50:43,292] Trial 571 finished with values: [-0.08435805512850458, 0.08452397493013993] and parameters: {'p_sma': 32, 'p_std': 23, 'p_atr': 24, 'p_adx': 11, 'rsi_period': 52, 'ema1': 10, 'ema2': 55, 'slip_atr_k': 0.23580474345955932, 'slip_spread_k': 0.5901071411288389, 'spread_hl_frac': 0.02585756671895913, 'bb_std_mult': 3.339335449130026, 'rsi_os': 46, 'rsi_ob': 77, 'vol_spike': 0.09276111921308725, 'adx_thresh': 5.602849073112027, 'atr_min_pct': 0.026746384269758193, 'atr_max_pct': 0.03754238764384894, 'tp_mult': 1.4392886766402182, 'tsl_mult': 0.7625239650167224, 'strategy': 'mean_reversion', 'time_stop': 94, 'use_sma': True, 'use_atr': False, 'use_adx': True, 'use_ema': True, 'use_spike': False, 'rsi_required': True, 'edge_k': 0.9271638112997479, 'edge_cap': 0.9997011770364119, 'bull_strategy': 'breakout', 'bull_bb_std_mult': 3.2477881045256045, 'bull_rsi_os': 47, 'bull_rsi_ob': 49, 'bull_adx_thresh': 10.073912779163042, 'bull_atr_min_pct': 0.01541736493871408, 'bull_atr_max_pct': 0.1357097305245127, 'bull_tp_mult': 1.5876751917273177, 'bull_tsl_mult': 0.45473532165987435, 'bull_time_stop': 147, 'bull_use_sma': False, 'bull_use_ema': True, 'bull_use_atr': False, 'bull_use_adx': True, 'bull_use_spike': True, 'bull_rsi_required': True, 'bear_strategy': 'mean_reversion', 'bear_bb_std_mult': 2.5914636395477335, 'bear_rsi_os': 36, 'bear_rsi_ob': 78, 'bear_adx_thresh': 6.233414787812007, 'bear_atr_min_pct': 0.001797484976318973, 'bear_atr_max_pct': 0.10254615090065772, 'bear_tp_mult': 2.0473488640346833, 'bear_tsl_mult': 0.10180909620993281, 'bear_time_stop': 78, 'bear_use_sma': False, 'bear_use_ema': False, 'bear_use_atr': False, 'bear_use_adx': True, 'bear_use_spike': True, 'bear_rsi_required': False, 'sideways_strategy': 'breakout', 'sideways_bb_std_mult': 2.6954520627354976, 'sideways_rsi_os': 48, 'sideways_rsi_ob': 90, 'sideways_adx_thresh': 25.51257762612833, 'sideways_atr_min_pct': 0.005087479498050844, 'sideways_atr_max_pct': 0.10834586831302767, 'sideways_tp_mult': 2.5820043954279797, 'sideways_tsl_mult': 0.573836153090423, 'sideways_time_stop': 252, 'sideways_use_sma': True, 'sideways_use_ema': True, 'sideways_use_atr': True, 'sideways_use_adx': True, 'sideways_use_spike': False, 'sideways_rsi_required': False}.
[I 2025-09-01 14:50:44,350] Trial 574 finished with values: [-1000000000.0, 1000000000.0] and parameters: {'p_sma': 29, 'p_std': 32, 'p_atr': 19, 'p_adx': 10, 'rsi_period': 33, 'ema1': 17, 'ema2': 57, 'slip_atr_k': 0.23610734863227645, 'slip_spread_k': 0.5545354023512369, 'spread_hl_frac': 0.0451564754235507, 'bb_std_mult': 3.5265505166141597, 'rsi_os': 55, 'rsi_ob': 53, 'vol_spike': 0.10423749200226717, 'adx_thresh': 12.568503678262728, 'atr_min_pct': 0.02123114070503231, 'atr_max_pct': 0.09361782911544327, 'tp_mult': 1.1813191705919999, 'tsl_mult': 0.8003127817888763, 'strategy': 'mean_reversion', 'time_stop': 226, 'use_sma': True, 'use_atr': False, 'use_adx': True, 'use_ema': True, 'use_spike': True, 'rsi_required': True, 'edge_k': 0.9289234907595783, 'edge_cap': 0.9986308148442156, 'bull_strategy': 'mean_reversion', 'bull_bb_std_mult': 3.2584893111931446, 'bull_rsi_os': 13, 'bull_rsi_ob': 80, 'bull_adx_thresh': 10.119466203557458, 'bull_atr_min_pct': 0.018131082810863883, 'bull_atr_max_pct': 0.05272850948399066, 'bull_tp_mult': 1.5779781866553209, 'bull_tsl_mult': 0.46010406082351674, 'bull_time_stop': 17, 'bull_use_sma': False, 'bull_use_ema': True, 'bull_use_atr': True, 'bull_use_adx': True, 'bull_use_spike': True, 'bull_rsi_required': True, 'bear_strategy': 'mean_reversion', 'bear_bb_std_mult': 1.1969007827131681, 'bear_rsi_os': 49, 'bear_rsi_ob': 79, 'bear_adx_thresh': 8.483518971065699, 'bear_atr_min_pct': 0.0040703221516112335, 'bear_atr_max_pct': 0.10868303210522419, 'bear_tp_mult': 2.042552042529679, 'bear_tsl_mult': 0.1029187958725131, 'bear_time_stop': 77, 'bear_use_sma': False, 'bear_use_ema': False, 'bear_use_atr': False, 'bear_use_adx': False, 'bear_use_spike': False, 'bear_rsi_required': False, 'sideways_strategy': 'mean_reversion', 'sideways_bb_std_mult': 2.707175355595176, 'sideways_rsi_os': 32, 'sideways_rsi_ob': 92, 'sideways_adx_thresh': 25.6252658696149, 'sideways_atr_min_pct': 0.004480879787791118, 'sideways_atr_max_pct': 0.10930474261006279, 'sideways_tp_mult': 1.5054715464285648, 'sideways_tsl_mult': 0.6299547426044224, 'sideways_time_stop': 80, 'sideways_use_sma': True, 'sideways_use_ema': True, 'sideways_use_atr': True, 'sideways_use_adx': True, 'sideways_use_spike': False, 'sideways_rsi_required': False}.
[I 2025-09-01 14:51:21,390] Trial 576 finished with values: [-1000000000.0, 1000000000.0] and parameters: {'p_sma': 29, 'p_std': 27, 'p_atr': 25, 'p_adx': 9, 'rsi_period': 78, 'ema1': 8, 'ema2': 58, 'slip_atr_k': 0.20629866140571224, 'slip_spread_k': 0.24822155324045625, 'spread_hl_frac': 0.028102261764105442, 'bb_std_mult': 2.803895058949974, 'rsi_os': 44, 'rsi_ob': 53, 'vol_spike': 0.10597047888940994, 'adx_thresh': 33.35841793420984, 'atr_min_pct': 0.009705932973035626, 'atr_max_pct': 0.03523822051026988, 'tp_mult': 1.6893526849399314, 'tsl_mult': 0.7263816876218594, 'strategy': 'mean_reversion', 'time_stop': 78, 'use_sma': True, 'use_atr': False, 'use_adx': False, 'use_ema': True, 'use_spike': True, 'rsi_required': True, 'edge_k': 1.7826374643099183, 'edge_cap': 0.629324178923547, 'bull_strategy': 'breakout', 'bull_bb_std_mult': 3.110144942013431, 'bull_rsi_os': 28, 'bull_rsi_ob': 69, 'bull_adx_thresh': 32.522522905237956, 'bull_atr_min_pct': 0.011456810111490488, 'bull_atr_max_pct': 0.021580917420278067, 'bull_tp_mult': 1.9546587488535367, 'bull_tsl_mult': 0.4809025186045389, 'bull_time_stop': 120, 'bull_use_sma': True, 'bull_use_ema': False, 'bull_use_atr': True, 'bull_use_adx': True, 'bull_use_spike': True, 'bull_rsi_required': True, 'bear_strategy': 'mean_reversion', 'bear_bb_std_mult': 2.166501100132979, 'bear_rsi_os': 38, 'bear_rsi_ob': 61, 'bear_adx_thresh': 10.198811814180104, 'bear_atr_min_pct': 0.019682819849320986, 'bear_atr_max_pct': 0.05682535781658319, 'bear_tp_mult': 2.12071339378993, 'bear_tsl_mult': 0.3127016027273782, 'bear_time_stop': 164, 'bear_use_sma': False, 'bear_use_ema': False, 'bear_use_atr': False, 'bear_use_adx': False, 'bear_use_spike': True, 'bear_rsi_required': False, 'sideways_strategy': 'mean_reversion', 'sideways_bb_std_mult': 3.18417810144145, 'sideways_rsi_os': 33, 'sideways_rsi_ob': 62, 'sideways_adx_thresh': 31.19121311267869, 'sideways_atr_min_pct': 0.004096802557817225, 'sideways_atr_max_pct': 0.11268999485856088, 'sideways_tp_mult': 1.8655186027746704, 'sideways_tsl_mult': 0.34488215913995396, 'sideways_time_stop': 271, 'sideways_use_sma': True, 'sideways_use_ema': False, 'sideways_use_atr': True, 'sideways_use_adx': False, 'sideways_use_spike': False, 'sideways_rsi_required': True}.
[I 2025-09-01 14:51:22,377] Trial 575 finished with values: [-1000000000.0, 1000000000.0] and parameters: {'p_sma': 42, 'p_std': 5, 'p_atr': 9, 'p_adx': 10, 'rsi_period': 78, 'ema1': 24, 'ema2': 58, 'slip_atr_k': 0.01041666628397412, 'slip_spread_k': 0.23979746859483603, 'spread_hl_frac': 0.010393252892686075, 'bb_std_mult': 2.7925685093426345, 'rsi_os': 44, 'rsi_ob': 53, 'vol_spike': 0.10322140164169569, 'adx_thresh': 12.464216440920502, 'atr_min_pct': 0.010975802282833513, 'atr_max_pct': 0.05706472964376338, 'tp_mult': 1.341404322856204, 'tsl_mult': 0.7326124546914526, 'strategy': 'mean_reversion', 'time_stop': 21, 'use_sma': True, 'use_atr': False, 'use_adx': False, 'use_ema': True, 'use_spike': True, 'rsi_required': True, 'edge_k': 0.20417122934222376, 'edge_cap': 0.63006508881542, 'bull_strategy': 'mean_reversion', 'bull_bb_std_mult': 2.588705661909076, 'bull_rsi_os': 28, 'bull_rsi_ob': 77, 'bull_adx_thresh': 32.59698979287711, 'bull_atr_min_pct': 0.018771687866002452, 'bull_atr_max_pct': 0.13079609626552882, 'bull_tp_mult': 1.326110062763887, 'bull_tsl_mult': 0.4783669406440624, 'bull_time_stop': 155, 'bull_use_sma': False, 'bull_use_ema': True, 'bull_use_atr': True, 'bull_use_adx': True, 'bull_use_spike': True, 'bull_rsi_required': True, 'bear_strategy': 'mean_reversion', 'bear_bb_std_mult': 3.1530655911850376, 'bear_rsi_os': 38, 'bear_rsi_ob': 56, 'bear_adx_thresh': 16.304763177256078, 'bear_atr_min_pct': 0.019667811113764113, 'bear_atr_max_pct': 0.05851469984127794, 'bear_tp_mult': 1.9999647691658624, 'bear_tsl_mult': 0.15108375985242917, 'bear_time_stop': 101, 'bear_use_sma': False, 'bear_use_ema': False, 'bear_use_atr': False, 'bear_use_adx': False, 'bear_use_spike': False, 'bear_rsi_required': False, 'sideways_strategy': 'mean_reversion', 'sideways_bb_std_mult': 1.1921121107187942, 'sideways_rsi_os': 47, 'sideways_rsi_ob': 95, 'sideways_adx_thresh': 24.143043301131254, 'sideways_atr_min_pct': 0.004395064107845793, 'sideways_atr_max_pct': 0.11285524450411295, 'sideways_tp_mult': 1.1911966986852875, 'sideways_tsl_mult': 0.6666184888401178, 'sideways_time_stop': 149, 'sideways_use_sma': True, 'sideways_use_ema': True, 'sideways_use_atr': True, 'sideways_use_adx': False, 'sideways_use_spike': False, 'sideways_rsi_required': False}.
[I 2025-09-01 14:51:22,876] Trial 572 finished with values: [-0.03740603221672212, 0.03758075947646268] and parameters: {'p_sma': 32, 'p_std': 26, 'p_atr': 17, 'p_adx': 19, 'rsi_period': 79, 'ema1': 10, 'ema2': 57, 'slip_atr_k': 0.01690462643243376, 'slip_spread_k': 0.5974888568661222, 'spread_hl_frac': 0.02702228642939842, 'bb_std_mult': 2.6849956492371128, 'rsi_os': 43, 'rsi_ob': 53, 'vol_spike': 0.23661326019015355, 'adx_thresh': 30.15039766147432, 'atr_min_pct': 0.0111483367212166, 'atr_max_pct': 0.036258702957474326, 'tp_mult': 1.4317171111676716, 'tsl_mult': 0.8032828673192358, 'strategy': 'mean_reversion', 'time_stop': 225, 'use_sma': True, 'use_atr': False, 'use_adx': True, 'use_ema': True, 'use_spike': False, 'rsi_required': True, 'edge_k': 0.20380141725381687, 'edge_cap': 0.9993238259366312, 'bull_strategy': 'mean_reversion', 'bull_bb_std_mult': 3.248452309013571, 'bull_rsi_os': 49, 'bull_rsi_ob': 80, 'bull_adx_thresh': 12.643182815869181, 'bull_atr_min_pct': 0.018250689292780443, 'bull_atr_max_pct': 0.09373081974354205, 'bull_tp_mult': 1.5786847254893024, 'bull_tsl_mult': 0.4584930402417089, 'bull_time_stop': 155, 'bull_use_sma': False, 'bull_use_ema': True, 'bull_use_atr': False, 'bull_use_adx': True, 'bull_use_spike': True, 'bull_rsi_required': True, 'bear_strategy': 'mean_reversion', 'bear_bb_std_mult': 2.8203032426268075, 'bear_rsi_os': 44, 'bear_rsi_ob': 57, 'bear_adx_thresh': 29.606466219346892, 'bear_atr_min_pct': 0.00221964686759858, 'bear_atr_max_pct': 0.1090594971957868, 'bear_tp_mult': 2.119753839008338, 'bear_tsl_mult': 0.8191634637298444, 'bear_time_stop': 94, 'bear_use_sma': False, 'bear_use_ema': False, 'bear_use_atr': False, 'bear_use_adx': True, 'bear_use_spike': True, 'bear_rsi_required': False, 'sideways_strategy': 'breakout', 'sideways_bb_std_mult': 2.711143947965441, 'sideways_rsi_os': 47, 'sideways_rsi_ob': 90, 'sideways_adx_thresh': 25.620656063506118, 'sideways_atr_min_pct': 0.004867323580348739, 'sideways_atr_max_pct': 0.110621940303737, 'sideways_tp_mult': 2.2821224819444024, 'sideways_tsl_mult': 0.3384573812109423, 'sideways_time_stop': 254, 'sideways_use_sma': True, 'sideways_use_ema': True, 'sideways_use_atr': True, 'sideways_use_adx': True, 'sideways_use_spike': False, 'sideways_rsi_required': False}.
