[I 2025-09-01 14:28:55,771] Trial 426 finished with values: [-0.004447403425445584, 0.00929070444958217] and parameters: {'p_sma': 28, 'p_std': 25, 'p_atr': 26, 'p_adx': 7, 'rsi_period': 34, 'ema1': 10, 'ema2': 55, 'slip_atr_k': 0.012530984812717187, 'slip_spread_k': 0.5993834675756383, 'spread_hl_frac': 0.015695250415754734, 'bb_std_mult': 2.838996884124371, 'rsi_os': 41, 'rsi_ob': 55, 'vol_spike': 0.01980467191299179, 'adx_thresh': 28.23722827540434, 'atr_min_pct': 0.011962822842238575, 'atr_max_pct': 0.02755102483501493, 'tp_mult': 1.4639244082571115, 'tsl_mult': 0.6348659994042326, 'strategy': 'mean_reversion', 'time_stop': 108, 'use_sma': True, 'use_atr': False, 'use_adx': True, 'use_ema': True, 'use_spike': True, 'rsi_required': True, 'edge_k': 0.2231800067596182, 'edge_cap': 0.9810190200350938, 'bull_strategy': 'mean_reversion', 'bull_bb_std_mult': 0.8911656856987971, 'bull_rsi_os': 13, 'bull_rsi_ob': 76, 'bull_adx_thresh': 11.771422460370287, 'bull_atr_min_pct': 0.013299962495298304, 'bull_atr_max_pct': 0.1300580984677403, 'bull_tp_mult': 2.9402885784900734, 'bull_tsl_mult': 0.41256331507574745, 'bull_time_stop': 176, 'bull_use_sma': False, 'bull_use_ema': False, 'bull_use_atr': True, 'bull_use_adx': True, 'bull_use_spike': True, 'bull_rsi_required': True, 'bear_strategy': 'mean_reversion', 'bear_bb_std_mult': 2.498758185225557, 'bear_rsi_os': 33, 'bear_rsi_ob': 79, 'bear_adx_thresh': 14.972111270079203, 'bear_atr_min_pct': 0.0028668252727338927, 'bear_atr_max_pct': 0.10638508580046957, 'bear_tp_mult': 1.2018441235575108, 'bear_tsl_mult': 0.14117180897467882, 'bear_time_stop': 282, 'bear_use_sma': False, 'bear_use_ema': False, 'bear_use_atr': False, 'bear_use_adx': False, 'bear_use_spike': True, 'bear_rsi_required': False, 'sideways_strategy': 'mean_reversion', 'sideways_bb_std_mult': 3.02988097107166, 'sideways_rsi_os': 29, 'sideways_rsi_ob': 91, 'sideways_adx_thresh': 26.256690291957394, 'sideways_atr_min_pct': 0.029871122013310165, 'sideways_atr_max_pct': 0.03655557475634666, 'sideways_tp_mult': 2.369161231941996, 'sideways_tsl_mult': 0.377538076632299, 'sideways_time_stop': 250, 'sideways_use_sma': True, 'sideways_use_ema': True, 'sideways_use_atr': True, 'sideways_use_adx': True, 'sideways_use_spike': False, 'sideways_rsi_required': False}.
[I 2025-09-01 14:28:56,639] Trial 424 finished with values: [-0.005549497711963003, 0.007982678129026918] and parameters: {'p_sma': 28, 'p_std': 29, 'p_atr': 15, 'p_adx': 18, 'rsi_period': 34, 'ema1': 9, 'ema2': 21, 'slip_atr_k': 0.011875871499665172, 'slip_spread_k': 0.5957064154248711, 'spread_hl_frac': 0.007971753128053035, 'bb_std_mult': 3.526424442371194, 'rsi_os': 41, 'rsi_ob': 56, 'vol_spike': 0.118878422047315, 'adx_thresh': 6.152470203155605, 'atr_min_pct': 0.011855632974593409, 'atr_max_pct': 0.044549121473035184, 'tp_mult': 2.3991360957633105, 'tsl_mult': 0.526687342244407, 'strategy': 'mean_reversion', 'time_stop': 241, 'use_sma': True, 'use_atr': False, 'use_adx': True, 'use_ema': True, 'use_spike': True, 'rsi_required': True, 'edge_k': 0.2367702768701127, 'edge_cap': 0.7708366316821686, 'bull_strategy': 'mean_reversion', 'bull_bb_std_mult': 1.8840255147291463, 'bull_rsi_os': 13, 'bull_rsi_ob': 76, 'bull_adx_thresh': 15.680937634803314, 'bull_atr_min_pct': 0.0133682292001502, 'bull_atr_max_pct': 0.13023015324654594, 'bull_tp_mult': 1.7222783170353797, 'bull_tsl_mult': 0.40765892220863137, 'bull_time_stop': 178, 'bull_use_sma': False, 'bull_use_ema': True, 'bull_use_atr': True, 'bull_use_adx': True, 'bull_use_spike': True, 'bull_rsi_required': True, 'bear_strategy': 'mean_reversion', 'bear_bb_std_mult': 2.51276670461835, 'bear_rsi_os': 36, 'bear_rsi_ob': 57, 'bear_adx_thresh': 6.556534474299129, 'bear_atr_min_pct': 0.0027692662497305854, 'bear_atr_max_pct': 0.13701672184589958, 'bear_tp_mult': 2.1087665300581495, 'bear_tsl_mult': 0.13904063799703076, 'bear_time_stop': 156, 'bear_use_sma': False, 'bear_use_ema': False, 'bear_use_atr': False, 'bear_use_adx': False, 'bear_use_spike': True, 'bear_rsi_required': False, 'sideways_strategy': 'mean_reversion', 'sideways_bb_std_mult': 3.5721465313727476, 'sideways_rsi_os': 29, 'sideways_rsi_ob': 91, 'sideways_adx_thresh': 23.486760287130416, 'sideways_atr_min_pct': 0.004300899377797421, 'sideways_atr_max_pct': 0.09956577793530526, 'sideways_tp_mult': 2.2499507554296296, 'sideways_tsl_mult': 0.4755044385696566, 'sideways_time_stop': 149, 'sideways_use_sma': True, 'sideways_use_ema': True, 'sideways_use_atr': True, 'sideways_use_adx': True, 'sideways_use_spike': True, 'sideways_rsi_required': False}.
[I 2025-09-01 14:28:57,407] Trial 425 finished with values: [-1000000000.0, 1000000000.0] and parameters: {'p_sma': 57, 'p_std': 29, 'p_atr': 28, 'p_adx': 7, 'rsi_period': 59, 'ema1': 9, 'ema2': 55, 'slip_atr_k': 0.011947214100639382, 'slip_spread_k': 0.04328881470176782, 'spread_hl_frac': 0.0382648215598552, 'bb_std_mult': 3.523044272072182, 'rsi_os': 41, 'rsi_ob': 56, 'vol_spike': 0.11761302682845172, 'adx_thresh': 8.06200348752115, 'atr_min_pct': 0.010085465005155426, 'atr_max_pct': 0.045675385836303636, 'tp_mult': 1.3309775339667897, 'tsl_mult': 0.7040667572278706, 'strategy': 'mean_reversion', 'time_stop': 186, 'use_sma': True, 'use_atr': False, 'use_adx': True, 'use_ema': True, 'use_spike': True, 'rsi_required': True, 'edge_k': 0.2242944120581605, 'edge_cap': 0.978121404685893, 'bull_strategy': 'mean_reversion', 'bull_bb_std_mult': 3.590969113796933, 'bull_rsi_os': 13, 'bull_rsi_ob': 76, 'bull_adx_thresh': 11.970176738855839, 'bull_atr_min_pct': 0.014543427002665378, 'bull_atr_max_pct': 0.12264013769089498, 'bull_tp_mult': 1.7250225657655047, 'bull_tsl_mult': 0.5215221736680564, 'bull_time_stop': 177, 'bull_use_sma': False, 'bull_use_ema': True, 'bull_use_atr': True, 'bull_use_adx': True, 'bull_use_spike': True, 'bull_rsi_required': True, 'bear_strategy': 'mean_reversion', 'bear_bb_std_mult': 2.48916290472738, 'bear_rsi_os': 19, 'bear_rsi_ob': 57, 'bear_adx_thresh': 6.691777967184547, 'bear_atr_min_pct': 0.002758673329050974, 'bear_atr_max_pct': 0.14013528191279198, 'bear_tp_mult': 2.9991832436511254, 'bear_tsl_mult': 0.13927627748530874, 'bear_time_stop': 89, 'bear_use_sma': False, 'bear_use_ema': False, 'bear_use_atr': False, 'bear_use_adx': False, 'bear_use_spike': True, 'bear_rsi_required': False, 'sideways_strategy': 'mean_reversion', 'sideways_bb_std_mult': 3.0483816519189992, 'sideways_rsi_os': 29, 'sideways_rsi_ob': 52, 'sideways_adx_thresh': 26.178617434840433, 'sideways_atr_min_pct': 0.0044296441080790335, 'sideways_atr_max_pct': 0.10130973295368091, 'sideways_tp_mult': 2.2474003404282397, 'sideways_tsl_mult': 0.40603538789943805, 'sideways_time_stop': 8, 'sideways_use_sma': True, 'sideways_use_ema': True, 'sideways_use_atr': True, 'sideways_use_adx': True, 'sideways_use_spike': True, 'sideways_rsi_required': False}.
[I 2025-09-01 14:28:57,781] Trial 423 finished with values: [-1000000000.0, 1000000000.0] and parameters: {'p_sma': 57, 'p_std': 38, 'p_atr': 24, 'p_adx': 7, 'rsi_period': 77, 'ema1': 25, 'ema2': 57, 'slip_atr_k': 0.012235942945345355, 'slip_spread_k': 0.6083107178865444, 'spread_hl_frac': 0.008575601387489888, 'bb_std_mult': 3.5270060834304915, 'rsi_os': 45, 'rsi_ob': 79, 'vol_spike': 0.020217368154073004, 'adx_thresh': 5.621916924089317, 'atr_min_pct': 0.010136162892771276, 'atr_max_pct': 0.045396107687356996, 'tp_mult': 1.8242865807754707, 'tsl_mult': 0.8460255269637329, 'strategy': 'mean_reversion', 'time_stop': 117, 'use_sma': True, 'use_atr': False, 'use_adx': True, 'use_ema': True, 'use_spike': False, 'rsi_required': True, 'edge_k': 1.7430556422784917, 'edge_cap': 0.9597660144336883, 'bull_strategy': 'mean_reversion', 'bull_bb_std_mult': 1.675662067480778, 'bull_rsi_os': 13, 'bull_rsi_ob': 83, 'bull_adx_thresh': 11.858669572469353, 'bull_atr_min_pct': 0.007389465559201782, 'bull_atr_max_pct': 0.13106024519122705, 'bull_tp_mult': 2.239053680238446, 'bull_tsl_mult': 0.9325250655415549, 'bull_time_stop': 187, 'bull_use_sma': False, 'bull_use_ema': True, 'bull_use_atr': True, 'bull_use_adx': True, 'bull_use_spike': True, 'bull_rsi_required': True, 'bear_strategy': 'mean_reversion', 'bear_bb_std_mult': 2.513523581680958, 'bear_rsi_os': 43, 'bear_rsi_ob': 57, 'bear_adx_thresh': 10.258524405615848, 'bear_atr_min_pct': 0.01025061243485327, 'bear_atr_max_pct': 0.12376924870895359, 'bear_tp_mult': 1.2098607464440487, 'bear_tsl_mult': 0.13549268035237128, 'bear_time_stop': 102, 'bear_use_sma': True, 'bear_use_ema': False, 'bear_use_atr': False, 'bear_use_adx': False, 'bear_use_spike': True, 'bear_rsi_required': False, 'sideways_strategy': 'mean_reversion', 'sideways_bb_std_mult': 3.0111432644674028, 'sideways_rsi_os': 32, 'sideways_rsi_ob': 75, 'sideways_adx_thresh': 26.726001778192654, 'sideways_atr_min_pct': 0.0026494113511135306, 'sideways_atr_max_pct': 0.10548271398879869, 'sideways_tp_mult': 2.4138011508595807, 'sideways_tsl_mult': 0.4036791983926647, 'sideways_time_stop': 263, 'sideways_use_sma': True, 'sideways_use_ema': True, 'sideways_use_atr': True, 'sideways_use_adx': True, 'sideways_use_spike': True, 'sideways_rsi_required': False}.
[I 2025-09-01 14:29:36,828] Trial 428 finished with values: [-1000000000.0, 1000000000.0] and parameters: {'p_sma': 32, 'p_std': 31, 'p_atr': 24, 'p_adx': 7, 'rsi_period': 53, 'ema1': 18, 'ema2': 59, 'slip_atr_k': 0.010260727001424375, 'slip_spread_k': 0.5517193237702713, 'spread_hl_frac': 0.038717619971150904, 'bb_std_mult': 1.069513635034349, 'rsi_os': 44, 'rsi_ob': 66, 'vol_spike': 0.17784253508995, 'adx_thresh': 6.732019827934007, 'atr_min_pct': 0.011078905109917842, 'atr_max_pct': 0.02923299754062956, 'tp_mult': 2.164015522602051, 'tsl_mult': 0.810785244655263, 'strategy': 'mean_reversion', 'time_stop': 158, 'use_sma': True, 'use_atr': False, 'use_adx': True, 'use_ema': True, 'use_spike': True, 'rsi_required': True, 'edge_k': 0.30346116282420804, 'edge_cap': 0.8524152208535729, 'bull_strategy': 'breakout', 'bull_bb_std_mult': 1.5787742320900628, 'bull_rsi_os': 49, 'bull_rsi_ob': 79, 'bull_adx_thresh': 11.7210733222953, 'bull_atr_min_pct': 0.012498698184855194, 'bull_atr_max_pct': 0.0881102908042752, 'bull_tp_mult': 1.0132571837225643, 'bull_tsl_mult': 0.5158609368013461, 'bull_time_stop': 167, 'bull_use_sma': False, 'bull_use_ema': True, 'bull_use_atr': True, 'bull_use_adx': True, 'bull_use_spike': True, 'bull_rsi_required': True, 'bear_strategy': 'mean_reversion', 'bear_bb_std_mult': 1.5975952869268708, 'bear_rsi_os': 42, 'bear_rsi_ob': 58, 'bear_adx_thresh': 10.36508970281398, 'bear_atr_min_pct': 0.014162444466202403, 'bear_atr_max_pct': 0.11325845314060923, 'bear_tp_mult': 1.7374519957808663, 'bear_tsl_mult': 0.5823464760973607, 'bear_time_stop': 133, 'bear_use_sma': False, 'bear_use_ema': False, 'bear_use_atr': False, 'bear_use_adx': False, 'bear_use_spike': True, 'bear_rsi_required': False, 'sideways_strategy': 'mean_reversion', 'sideways_bb_std_mult': 1.731079671092436, 'sideways_rsi_os': 31, 'sideways_rsi_ob': 47, 'sideways_adx_thresh': 5.681532046082989, 'sideways_atr_min_pct': 0.003280843259804713, 'sideways_atr_max_pct': 0.07968209528267632, 'sideways_tp_mult': 2.4210886952126875, 'sideways_tsl_mult': 0.07419312718724463, 'sideways_time_stop': 285, 'sideways_use_sma': True, 'sideways_use_ema': True, 'sideways_use_atr': True, 'sideways_use_adx': True, 'sideways_use_spike': False, 'sideways_rsi_required': False}.
[I 2025-09-01 14:29:37,415] Trial 430 finished with values: [-0.00497356550988115, 0.010485722797023395] and parameters: {'p_sma': 32, 'p_std': 31, 'p_atr': 26, 'p_adx': 21, 'rsi_period': 52, 'ema1': 10, 'ema2': 51, 'slip_atr_k': 0.028740228710139978, 'slip_spread_k': 0.5729861726740169, 'spread_hl_frac': 0.016985239991943964, 'bb_std_mult': 1.047396994408692, 'rsi_os': 44, 'rsi_ob': 61, 'vol_spike': 0.0852281674903797, 'adx_thresh': 6.748592467184955, 'atr_min_pct': 0.010948954567520843, 'atr_max_pct': 0.028570238349970183, 'tp_mult': 1.7008659129833292, 'tsl_mult': 0.6852992548005861, 'strategy': 'mean_reversion', 'time_stop': 111, 'use_sma': False, 'use_atr': False, 'use_adx': True, 'use_ema': True, 'use_spike': True, 'rsi_required': True, 'edge_k': 0.2837600121298157, 'edge_cap': 0.933460178390883, 'bull_strategy': 'breakout', 'bull_bb_std_mult': 3.3231371619500187, 'bull_rsi_os': 49, 'bull_rsi_ob': 67, 'bull_adx_thresh': 21.477342921780654, 'bull_atr_min_pct': 0.011620980624991676, 'bull_atr_max_pct': 0.11515375352869983, 'bull_tp_mult': 2.5156196973500533, 'bull_tsl_mult': 0.4464866804070253, 'bull_time_stop': 168, 'bull_use_sma': False, 'bull_use_ema': False, 'bull_use_atr': True, 'bull_use_adx': True, 'bull_use_spike': True, 'bull_rsi_required': True, 'bear_strategy': 'mean_reversion', 'bear_bb_std_mult': 2.6475822923640813, 'bear_rsi_os': 31, 'bear_rsi_ob': 63, 'bear_adx_thresh': 9.427987326439434, 'bear_atr_min_pct': 0.001936049178360851, 'bear_atr_max_pct': 0.11454135095375231, 'bear_tp_mult': 2.0695708506242, 'bear_tsl_mult': 0.07840954721651514, 'bear_time_stop': 83, 'bear_use_sma': False, 'bear_use_ema': False, 'bear_use_atr': True, 'bear_use_adx': False, 'bear_use_spike': True, 'bear_rsi_required': False, 'sideways_strategy': 'mean_reversion', 'sideways_bb_std_mult': 3.38119083203225, 'sideways_rsi_os': 46, 'sideways_rsi_ob': 89, 'sideways_adx_thresh': 20.548108604992002, 'sideways_atr_min_pct': 0.008432145856003603, 'sideways_atr_max_pct': 0.14943888759421337, 'sideways_tp_mult': 1.7693914546110474, 'sideways_tsl_mult': 0.38515500950304055, 'sideways_time_stop': 294, 'sideways_use_sma': True, 'sideways_use_ema': True, 'sideways_use_atr': True, 'sideways_use_adx': True, 'sideways_use_spike': False, 'sideways_rsi_required': True}.
[I 2025-09-01 14:29:37,874] Trial 427 finished with values: [-0.10369452978417992, 0.10359221636982097] and parameters: {'p_sma': 57, 'p_std': 29, 'p_atr': 23, 'p_adx': 7, 'rsi_period': 77, 'ema1': 9, 'ema2': 21, 'slip_atr_k': 0.02816714251628299, 'slip_spread_k': 0.5491881626256749, 'spread_hl_frac': 0.007972490363660758, 'bb_std_mult': 3.2684725666083976, 'rsi_os': 45, 'rsi_ob': 84, 'vol_spike': 0.1783444609254794, 'adx_thresh': 6.239688978722843, 'atr_min_pct': 0.010882684265111874, 'atr_max_pct': 0.04390607396179072, 'tp_mult': 2.234905786642085, 'tsl_mult': 0.8472023978694294, 'strategy': 'mean_reversion', 'time_stop': 243, 'use_sma': True, 'use_atr': False, 'use_adx': True, 'use_ema': True, 'use_spike': True, 'rsi_required': True, 'edge_k': 0.27637986136329423, 'edge_cap': 0.9378957901035522, 'bull_strategy': 'mean_reversion', 'bull_bb_std_mult': 3.3141355238129195, 'bull_rsi_os': 13, 'bull_rsi_ob': 77, 'bull_adx_thresh': 11.672086234718968, 'bull_atr_min_pct': 0.021104693621821265, 'bull_atr_max_pct': 0.07382266345582571, 'bull_tp_mult': 1.5520966147500692, 'bull_tsl_mult': 0.45018001879369707, 'bull_time_stop': 23, 'bull_use_sma': False, 'bull_use_ema': True, 'bull_use_atr': True, 'bull_use_adx': True, 'bull_use_spike': True, 'bull_rsi_required': True, 'bear_strategy': 'mean_reversion', 'bear_bb_std_mult': 2.3016456926222126, 'bear_rsi_os': 53, 'bear_rsi_ob': 84, 'bear_adx_thresh': 10.18235533016568, 'bear_atr_min_pct': 0.001922696727363268, 'bear_atr_max_pct': 0.10351010757242532, 'bear_tp_mult': 1.687739651407571, 'bear_tsl_mult': 0.11381504308562962, 'bear_time_stop': 102, 'bear_use_sma': False, 'bear_use_ema': False, 'bear_use_atr': False, 'bear_use_adx': False, 'bear_use_spike': True, 'bear_rsi_required': False, 'sideways_strategy': 'mean_reversion', 'sideways_bb_std_mult': 1.7446729893245363, 'sideways_rsi_os': 44, 'sideways_rsi_ob': 52, 'sideways_adx_thresh': 25.18331202243557, 'sideways_atr_min_pct': 0.025536069313007857, 'sideways_atr_max_pct': 0.10626599893384311, 'sideways_tp_mult': 2.415910161469656, 'sideways_tsl_mult': 0.4513957283510953, 'sideways_time_stop': 148, 'sideways_use_sma': True, 'sideways_use_ema': True, 'sideways_use_atr': True, 'sideways_use_adx': True, 'sideways_use_spike': False, 'sideways_rsi_required': False}.
[I 2025-09-01 14:29:38,474] Trial 429 finished with values: [-0.050270448615328145, 0.050136355949607574] and parameters: {'p_sma': 32, 'p_std': 26, 'p_atr': 26, 'p_adx': 21, 'rsi_period': 77, 'ema1': 10, 'ema2': 51, 'slip_atr_k': 0.20554816416721827, 'slip_spread_k': 0.915412963930575, 'spread_hl_frac': 0.005788093324834291, 'bb_std_mult': 3.436408247707637, 'rsi_os': 44, 'rsi_ob': 53, 'vol_spike': 0.08339605296946127, 'adx_thresh': 5.003320753375493, 'atr_min_pct': 0.010800931665271274, 'atr_max_pct': 0.03437349500641481, 'tp_mult': 2.6561871415219533, 'tsl_mult': 0.7697055275681424, 'strategy': 'mean_reversion', 'time_stop': 113, 'use_sma': True, 'use_atr': False, 'use_adx': True, 'use_ema': True, 'use_spike': True, 'rsi_required': True, 'edge_k': 1.9099806573619351, 'edge_cap': 0.9317642153997379, 'bull_strategy': 'breakout', 'bull_bb_std_mult': 3.2738228825272992, 'bull_rsi_os': 39, 'bull_rsi_ob': 83, 'bull_adx_thresh': 19.800058998201084, 'bull_atr_min_pct': 0.0009119044796778025, 'bull_atr_max_pct': 0.11493003165836949, 'bull_tp_mult': 1.568881294874965, 'bull_tsl_mult': 0.7838186473700306, 'bull_time_stop': 155, 'bull_use_sma': False, 'bull_use_ema': True, 'bull_use_atr': True, 'bull_use_adx': True, 'bull_use_spike': True, 'bull_rsi_required': True, 'bear_strategy': 'mean_reversion', 'bear_bb_std_mult': 1.95587494439785, 'bear_rsi_os': 43, 'bear_rsi_ob': 90, 'bear_adx_thresh': 7.768605467200129, 'bear_atr_min_pct': 0.01038285512124671, 'bear_atr_max_pct': 0.013945561021183314, 'bear_tp_mult': 1.6742303142492236, 'bear_tsl_mult': 0.11285579237748201, 'bear_time_stop': 103, 'bear_use_sma': False, 'bear_use_ema': False, 'bear_use_atr': False, 'bear_use_adx': False, 'bear_use_spike': True, 'bear_rsi_required': False, 'sideways_strategy': 'mean_reversion', 'sideways_bb_std_mult': 3.3508063597998854, 'sideways_rsi_os': 6, 'sideways_rsi_ob': 89, 'sideways_adx_thresh': 25.16448652875357, 'sideways_atr_min_pct': 0.024990911568699984, 'sideways_atr_max_pct': 0.09470928967825579, 'sideways_tp_mult': 2.4200687471619777, 'sideways_tsl_mult': 0.0800503302822057, 'sideways_time_stop': 92, 'sideways_use_sma': True, 'sideways_use_ema': True, 'sideways_use_atr': True, 'sideways_use_adx': True, 'sideways_use_spike': False, 'sideways_rsi_required': False}.
[I 2025-09-01 14:30:15,091] Trial 434 finished with values: [-0.007602564043768134, 0.012843291863124022] and parameters: {'p_sma': 28, 'p_std': 27, 'p_atr': 18, 'p_adx': 9, 'rsi_period': 79, 'ema1': 9, 'ema2': 60, 'slip_atr_k': 0.10526512397650095, 'slip_spread_k': 0.6386105531850863, 'spread_hl_frac': 0.010402665641969063, 'bb_std_mult': 2.929393708262278, 'rsi_os': 32, 'rsi_ob': 53, 'vol_spike': 0.1010561671524621, 'adx_thresh': 5.780635567726758, 'atr_min_pct': 0.012461884225719857, 'atr_max_pct': 0.03954882100023682, 'tp_mult': 1.3766530323753638, 'tsl_mult': 0.7349877399719922, 'strategy': 'mean_reversion', 'time_stop': 98, 'use_sma': False, 'use_atr': False, 'use_adx': True, 'use_ema': True, 'use_spike': True, 'rsi_required': True, 'edge_k': 1.0111298826715456, 'edge_cap': 0.8203925151107218, 'bull_strategy': 'breakout', 'bull_bb_std_mult': 3.1648633784059372, 'bull_rsi_os': 6, 'bull_rsi_ob': 80, 'bull_adx_thresh': 29.788098768508846, 'bull_atr_min_pct': 0.010591299317549084, 'bull_atr_max_pct': 0.12763537131362374, 'bull_tp_mult': 1.5854984799064762, 'bull_tsl_mult': 0.48349933808364864, 'bull_time_stop': 138, 'bull_use_sma': True, 'bull_use_ema': False, 'bull_use_atr': True, 'bull_use_adx': False, 'bull_use_spike': True, 'bull_rsi_required': True, 'bear_strategy': 'mean_reversion', 'bear_bb_std_mult': 1.4685101515707784, 'bear_rsi_os': 36, 'bear_rsi_ob': 75, 'bear_adx_thresh': 21.307207704668155, 'bear_atr_min_pct': 0.0035709408800685114, 'bear_atr_max_pct': 0.11113097565210492, 'bear_tp_mult': 1.9587517629837434, 'bear_tsl_mult': 0.36293109611021557, 'bear_time_stop': 188, 'bear_use_sma': True, 'bear_use_ema': False, 'bear_use_atr': True, 'bear_use_adx': False, 'bear_use_spike': True, 'bear_rsi_required': False, 'sideways_strategy': 'mean_reversion', 'sideways_bb_std_mult': 3.103390816403549, 'sideways_rsi_os': 52, 'sideways_rsi_ob': 95, 'sideways_adx_thresh': 17.37924801895572, 'sideways_atr_min_pct': 0.005938729691229534, 'sideways_atr_max_pct': 0.10770270654564876, 'sideways_tp_mult': 2.4790537827160923, 'sideways_tsl_mult': 0.4291200076461014, 'sideways_time_stop': 278, 'sideways_use_sma': True, 'sideways_use_ema': False, 'sideways_use_atr': False, 'sideways_use_adx': True, 'sideways_use_spike': False, 'sideways_rsi_required': True}.
