[I 2025-09-01 15:05:27,887] Trial 669 finished with values: [-0.010740195011235132, 0.013329489610865688] and parameters: {'p_sma': 28, 'p_std': 28, 'p_atr': 13, 'p_adx': 8, 'rsi_period': 63, 'ema1': 19, 'ema2': 58, 'slip_atr_k': 0.019971854147181743, 'slip_spread_k': 0.538482827695673, 'spread_hl_frac': 0.0072165168238079525, 'bb_std_mult': 3.347210413746534, 'rsi_os': 42, 'rsi_ob': 51, 'vol_spike': 0.11893477772516513, 'adx_thresh': 5.0260742494087305, 'atr_min_pct': 0.010191018022056679, 'atr_max_pct': 0.059702951839951696, 'tp_mult': 1.2673621711908034, 'tsl_mult': 0.9241714113964785, 'strategy': 'breakout', 'time_stop': 18, 'use_sma': False, 'use_atr': False, 'use_adx': True, 'use_ema': True, 'use_spike': True, 'rsi_required': True, 'edge_k': 0.1496966719561419, 'edge_cap': 0.973814129035811, 'bull_strategy': 'mean_reversion', 'bull_bb_std_mult': 1.6955479740895478, 'bull_rsi_os': 15, 'bull_rsi_ob': 77, 'bull_adx_thresh': 10.13059369902603, 'bull_atr_min_pct': 0.01467656817686931, 'bull_atr_max_pct': 0.06520784845908176, 'bull_tp_mult': 1.3266786327009792, 'bull_tsl_mult': 0.46258082652344307, 'bull_time_stop': 269, 'bull_use_sma': False, 'bull_use_ema': True, 'bull_use_atr': True, 'bull_use_adx': True, 'bull_use_spike': True, 'bull_rsi_required': False, 'bear_strategy': 'breakout', 'bear_bb_std_mult': 2.4397669078902986, 'bear_rsi_os': 45, 'bear_rsi_ob': 55, 'bear_adx_thresh': 25.32429378456011, 'bear_atr_min_pct': 0.0020665713386083173, 'bear_atr_max_pct': 0.10442058915133585, 'bear_tp_mult': 2.1198317780490483, 'bear_tsl_mult': 0.5840305677731937, 'bear_time_stop': 11, 'bear_use_sma': False, 'bear_use_ema': False, 'bear_use_atr': True, 'bear_use_adx': True, 'bear_use_spike': False, 'bear_rsi_required': False, 'sideways_strategy': 'mean_reversion', 'sideways_bb_std_mult': 3.2048309086198454, 'sideways_rsi_os': 48, 'sideways_rsi_ob': 91, 'sideways_adx_thresh': 26.64506488903337, 'sideways_atr_min_pct': 0.005246279229219299, 'sideways_atr_max_pct': 0.11181031679328733, 'sideways_tp_mult': 2.531016283038077, 'sideways_tsl_mult': 0.5616198288305064, 'sideways_time_stop': 266, 'sideways_use_sma': True, 'sideways_use_ema': True, 'sideways_use_atr': True, 'sideways_use_adx': False, 'sideways_use_spike': False, 'sideways_rsi_required': False}.
[I 2025-09-01 15:05:28,665] Trial 666 finished with values: [-1000000000.0, 1000000000.0] and parameters: {'p_sma': 30, 'p_std': 32, 'p_atr': 27, 'p_adx': 9, 'rsi_period': 82, 'ema1': 10, 'ema2': 57, 'slip_atr_k': 0.07326533920624392, 'slip_spread_k': 0.5723210516849373, 'spread_hl_frac': 0.009971462527003367, 'bb_std_mult': 3.394423908000656, 'rsi_os': 42, 'rsi_ob': 51, 'vol_spike': 0.11038235134542296, 'adx_thresh': 5.37450304280297, 'atr_min_pct': 0.012344853130417133, 'atr_max_pct': 0.04143074725592512, 'tp_mult': 1.2533503637154166, 'tsl_mult': 0.7870556040028829, 'strategy': 'breakout', 'time_stop': 103, 'use_sma': False, 'use_atr': False, 'use_adx': False, 'use_ema': True, 'use_spike': True, 'rsi_required': True, 'edge_k': 0.8797414098040789, 'edge_cap': 0.9547714717205664, 'bull_strategy': 'breakout', 'bull_bb_std_mult': 0.6082404953726233, 'bull_rsi_os': 13, 'bull_rsi_ob': 80, 'bull_adx_thresh': 12.466792337399312, 'bull_atr_min_pct': 0.008470714814054564, 'bull_atr_max_pct': 0.13320920226344676, 'bull_tp_mult': 2.7180762521600803, 'bull_tsl_mult': 0.1394092617324632, 'bull_time_stop': 148, 'bull_use_sma': False, 'bull_use_ema': False, 'bull_use_atr': True, 'bull_use_adx': True, 'bull_use_spike': False, 'bull_rsi_required': True, 'bear_strategy': 'breakout', 'bear_bb_std_mult': 2.2978623549964086, 'bear_rsi_os': 35, 'bear_rsi_ob': 45, 'bear_adx_thresh': 23.046603310423055, 'bear_atr_min_pct': 0.02296666954241523, 'bear_atr_max_pct': 0.10542789035179584, 'bear_tp_mult': 1.9640745202196936, 'bear_tsl_mult': 0.5764029617577918, 'bear_time_stop': 88, 'bear_use_sma': False, 'bear_use_ema': False, 'bear_use_atr': True, 'bear_use_adx': False, 'bear_use_spike': False, 'bear_rsi_required': False, 'sideways_strategy': 'mean_reversion', 'sideways_bb_std_mult': 3.2407768280389933, 'sideways_rsi_os': 31, 'sideways_rsi_ob': 87, 'sideways_adx_thresh': 24.97258184487195, 'sideways_atr_min_pct': 0.013641245686474922, 'sideways_atr_max_pct': 0.11137959879646972, 'sideways_tp_mult': 2.5534420267450786, 'sideways_tsl_mult': 0.274090569720063, 'sideways_time_stop': 272, 'sideways_use_sma': True, 'sideways_use_ema': True, 'sideways_use_atr': False, 'sideways_use_adx': False, 'sideways_use_spike': True, 'sideways_rsi_required': False}.
[I 2025-09-01 15:05:28,931] Trial 668 finished with values: [-1000000000.0, 1000000000.0] and parameters: {'p_sma': 28, 'p_std': 7, 'p_atr': 20, 'p_adx': 8, 'rsi_period': 82, 'ema1': 19, 'ema2': 58, 'slip_atr_k': 0.02055222299824535, 'slip_spread_k': 0.29733982590435876, 'spread_hl_frac': 0.009346491045258394, 'bb_std_mult': 2.3338081344027484, 'rsi_os': 10, 'rsi_ob': 51, 'vol_spike': 0.23216204303065133, 'adx_thresh': 14.119286395848633, 'atr_min_pct': 0.014964033372341472, 'atr_max_pct': 0.03511399013405478, 'tp_mult': 2.5611448118802467, 'tsl_mult': 0.6757503678017142, 'strategy': 'breakout', 'time_stop': 119, 'use_sma': False, 'use_atr': False, 'use_adx': True, 'use_ema': True, 'use_spike': True, 'rsi_required': True, 'edge_k': 0.13816645301154118, 'edge_cap': 0.9753960809459739, 'bull_strategy': 'mean_reversion', 'bull_bb_std_mult': 0.6116302274098746, 'bull_rsi_os': 15, 'bull_rsi_ob': 77, 'bull_adx_thresh': 12.326989882497715, 'bull_atr_min_pct': 0.013576375007536839, 'bull_atr_max_pct': 0.061452639048732285, 'bull_tp_mult': 1.55508039373946, 'bull_tsl_mult': 0.1946303974937758, 'bull_time_stop': 48, 'bull_use_sma': False, 'bull_use_ema': True, 'bull_use_atr': True, 'bull_use_adx': True, 'bull_use_spike': True, 'bull_rsi_required': False, 'bear_strategy': 'breakout', 'bear_bb_std_mult': 0.6182165261391523, 'bear_rsi_os': 50, 'bear_rsi_ob': 68, 'bear_adx_thresh': 12.448120361299885, 'bear_atr_min_pct': 0.02284500245876915, 'bear_atr_max_pct': 0.10496907686417922, 'bear_tp_mult': 2.1136529701137636, 'bear_tsl_mult': 0.13078188471761296, 'bear_time_stop': 116, 'bear_use_sma': False, 'bear_use_ema': False, 'bear_use_atr': True, 'bear_use_adx': True, 'bear_use_spike': False, 'bear_rsi_required': False, 'sideways_strategy': 'mean_reversion', 'sideways_bb_std_mult': 1.2370325908864972, 'sideways_rsi_os': 48, 'sideways_rsi_ob': 47, 'sideways_adx_thresh': 24.825480844819502, 'sideways_atr_min_pct': 0.023755048273384698, 'sideways_atr_max_pct': 0.1121945493282215, 'sideways_tp_mult': 1.0404711990431847, 'sideways_tsl_mult': 0.4064170360379644, 'sideways_time_stop': 235, 'sideways_use_sma': True, 'sideways_use_ema': True, 'sideways_use_atr': True, 'sideways_use_adx': False, 'sideways_use_spike': False, 'sideways_rsi_required': False}.
[I 2025-09-01 15:05:29,159] Trial 667 finished with values: [-1000000000.0, 1000000000.0] and parameters: {'p_sma': 28, 'p_std': 38, 'p_atr': 27, 'p_adx': 8, 'rsi_period': 82, 'ema1': 17, 'ema2': 36, 'slip_atr_k': 0.018912036704825316, 'slip_spread_k': 0.5726711937342087, 'spread_hl_frac': 0.04053824088676703, 'bb_std_mult': 3.3685773219724284, 'rsi_os': 38, 'rsi_ob': 51, 'vol_spike': 0.1935352128431006, 'adx_thresh': 5.019562477093472, 'atr_min_pct': 0.010542717090643167, 'atr_max_pct': 0.13631718269975157, 'tp_mult': 1.3958830177811286, 'tsl_mult': 0.6805362276725351, 'strategy': 'breakout', 'time_stop': 98, 'use_sma': False, 'use_atr': False, 'use_adx': True, 'use_ema': True, 'use_spike': True, 'rsi_required': True, 'edge_k': 0.9002299977806494, 'edge_cap': 0.973281037571451, 'bull_strategy': 'mean_reversion', 'bull_bb_std_mult': 3.267744345035152, 'bull_rsi_os': 9, 'bull_rsi_ob': 78, 'bull_adx_thresh': 6.201944116607457, 'bull_atr_min_pct': 0.010946501166923145, 'bull_atr_max_pct': 0.038932691897868514, 'bull_tp_mult': 1.670655090161239, 'bull_tsl_mult': 0.1478472385580798, 'bull_time_stop': 160, 'bull_use_sma': False, 'bull_use_ema': True, 'bull_use_atr': True, 'bull_use_adx': True, 'bull_use_spike': True, 'bull_rsi_required': False, 'bear_strategy': 'breakout', 'bear_bb_std_mult': 0.9538571411407089, 'bear_rsi_os': 8, 'bear_rsi_ob': 78, 'bear_adx_thresh': 5.960016781700552, 'bear_atr_min_pct': 0.008726282012915669, 'bear_atr_max_pct': 0.015094831314275763, 'bear_tp_mult': 2.635868512183797, 'bear_tsl_mult': 0.23758167225014698, 'bear_time_stop': 269, 'bear_use_sma': False, 'bear_use_ema': False, 'bear_use_atr': True, 'bear_use_adx': False, 'bear_use_spike': False, 'bear_rsi_required': False, 'sideways_strategy': 'mean_reversion', 'sideways_bb_std_mult': 3.2403060279719065, 'sideways_rsi_os': 32, 'sideways_rsi_ob': 87, 'sideways_adx_thresh': 26.254814806201214, 'sideways_atr_min_pct': 0.001978511139349762, 'sideways_atr_max_pct': 0.11071496132116568, 'sideways_tp_mult': 2.5469131401961977, 'sideways_tsl_mult': 0.8603524138042753, 'sideways_time_stop': 210, 'sideways_use_sma': True, 'sideways_use_ema': True, 'sideways_use_atr': True, 'sideways_use_adx': False, 'sideways_use_spike': True, 'sideways_rsi_required': False}.
[I 2025-09-01 15:06:10,401] Trial 672 finished with values: [-1000000000.0, 1000000000.0] and parameters: {'p_sma': 8, 'p_std': 27, 'p_atr': 25, 'p_adx': 7, 'rsi_period': 17, 'ema1': 8, 'ema2': 60, 'slip_atr_k': 0.18954214915439813, 'slip_spread_k': 0.5339274623142384, 'spread_hl_frac': 0.029690960255490007, 'bb_std_mult': 3.5967122221811114, 'rsi_os': 48, 'rsi_ob': 53, 'vol_spike': 0.19170598388868243, 'adx_thresh': 5.978884420100842, 'atr_min_pct': 0.011284530537915963, 'atr_max_pct': 0.13557953157097954, 'tp_mult': 1.4101570507689567, 'tsl_mult': 0.6583898071607461, 'strategy': 'mean_reversion', 'time_stop': 113, 'use_sma': True, 'use_atr': False, 'use_adx': True, 'use_ema': False, 'use_spike': True, 'rsi_required': False, 'edge_k': 0.7448269450164778, 'edge_cap': 0.9400476205793946, 'bull_strategy': 'breakout', 'bull_bb_std_mult': 3.266325639073855, 'bull_rsi_os': 14, 'bull_rsi_ob': 78, 'bull_adx_thresh': 6.241301902072022, 'bull_atr_min_pct': 0.029300102442756645, 'bull_atr_max_pct': 0.07932475942013249, 'bull_tp_mult': 1.671265758088318, 'bull_tsl_mult': 0.4617478904084581, 'bull_time_stop': 163, 'bull_use_sma': False, 'bull_use_ema': True, 'bull_use_atr': True, 'bull_use_adx': True, 'bull_use_spike': True, 'bull_rsi_required': True, 'bear_strategy': 'mean_reversion', 'bear_bb_std_mult': 0.9861199633975655, 'bear_rsi_os': 37, 'bear_rsi_ob': 58, 'bear_adx_thresh': 6.127497966219713, 'bear_atr_min_pct': 0.0022671391256298685, 'bear_atr_max_pct': 0.015339202477575597, 'bear_tp_mult': 2.522258171489269, 'bear_tsl_mult': 0.4621590663647134, 'bear_time_stop': 227, 'bear_use_sma': True, 'bear_use_ema': True, 'bear_use_atr': False, 'bear_use_adx': False, 'bear_use_spike': True, 'bear_rsi_required': False, 'sideways_strategy': 'mean_reversion', 'sideways_bb_std_mult': 2.9843336481016642, 'sideways_rsi_os': 35, 'sideways_rsi_ob': 49, 'sideways_adx_thresh': 23.231581121912274, 'sideways_atr_min_pct': 0.010158191206834722, 'sideways_atr_max_pct': 0.11812512566849973, 'sideways_tp_mult': 2.4712748664612434, 'sideways_tsl_mult': 0.0009954570894606385, 'sideways_time_stop': 28, 'sideways_use_sma': True, 'sideways_use_ema': True, 'sideways_use_atr': True, 'sideways_use_adx': True, 'sideways_use_spike': False, 'sideways_rsi_required': True}.
[I 2025-09-01 15:06:11,086] Trial 670 finished with values: [-1000000000.0, 1000000000.0] and parameters: {'p_sma': 17, 'p_std': 22, 'p_atr': 16, 'p_adx': 7, 'rsi_period': 31, 'ema1': 8, 'ema2': 32, 'slip_atr_k': 0.0039050081671026683, 'slip_spread_k': 0.5602983634176805, 'spread_hl_frac': 0.011929478944199465, 'bb_std_mult': 1.0028790060665875, 'rsi_os': 38, 'rsi_ob': 53, 'vol_spike': 0.1048240533161224, 'adx_thresh': 28.547620974144863, 'atr_min_pct': 0.012113371534209317, 'atr_max_pct': 0.13684413533347062, 'tp_mult': 1.401543786238653, 'tsl_mult': 0.25190950343372653, 'strategy': 'mean_reversion', 'time_stop': 187, 'use_sma': False, 'use_atr': False, 'use_adx': True, 'use_ema': True, 'use_spike': True, 'rsi_required': False, 'edge_k': 0.7140339847506778, 'edge_cap': 0.6065353627786063, 'bull_strategy': 'breakout', 'bull_bb_std_mult': 3.2625245487611547, 'bull_rsi_os': 14, 'bull_rsi_ob': 78, 'bull_adx_thresh': 6.079820815317989, 'bull_atr_min_pct': 0.00827593767793248, 'bull_atr_max_pct': 0.08115991311517787, 'bull_tp_mult': 1.5515162169736594, 'bull_tsl_mult': 0.305948202921992, 'bull_time_stop': 31, 'bull_use_sma': False, 'bull_use_ema': True, 'bull_use_atr': True, 'bull_use_adx': True, 'bull_use_spike': True, 'bull_rsi_required': True, 'bear_strategy': 'mean_reversion', 'bear_bb_std_mult': 0.9415345858386301, 'bear_rsi_os': 50, 'bear_rsi_ob': 78, 'bear_adx_thresh': 6.251566961181468, 'bear_atr_min_pct': 0.0023817086688445524, 'bear_atr_max_pct': 0.01614885911347881, 'bear_tp_mult': 2.0141362007560706, 'bear_tsl_mult': 0.1322624134103618, 'bear_time_stop': 228, 'bear_use_sma': False, 'bear_use_ema': True, 'bear_use_atr': False, 'bear_use_adx': False, 'bear_use_spike': False, 'bear_rsi_required': False, 'sideways_strategy': 'mean_reversion', 'sideways_bb_std_mult': 1.980582648511593, 'sideways_rsi_os': 19, 'sideways_rsi_ob': 89, 'sideways_adx_thresh': 24.933904112394437, 'sideways_atr_min_pct': 0.021755897359477184, 'sideways_atr_max_pct': 0.021850097039850157, 'sideways_tp_mult': 1.5704337659877594, 'sideways_tsl_mult': 0.27364288675662934, 'sideways_time_stop': 238, 'sideways_use_sma': True, 'sideways_use_ema': True, 'sideways_use_atr': True, 'sideways_use_adx': False, 'sideways_use_spike': False, 'sideways_rsi_required': True}.
[I 2025-09-01 15:06:11,645] Trial 673 finished with values: [-1000000000.0, 1000000000.0] and parameters: {'p_sma': 29, 'p_std': 57, 'p_atr': 21, 'p_adx': 7, 'rsi_period': 76, 'ema1': 7, 'ema2': 17, 'slip_atr_k': 0.004587737189542557, 'slip_spread_k': 0.05795185713357409, 'spread_hl_frac': 0.011772052411444802, 'bb_std_mult': 0.9976625299854656, 'rsi_os': 44, 'rsi_ob': 53, 'vol_spike': 0.10513031868550027, 'adx_thresh': 5.967779734895264, 'atr_min_pct': 0.011080877347048518, 'atr_max_pct': 0.03242015556367977, 'tp_mult': 1.3455563926356129, 'tsl_mult': 0.6563010375800099, 'strategy': 'mean_reversion', 'time_stop': 112, 'use_sma': True, 'use_atr': False, 'use_adx': True, 'use_ema': False, 'use_spike': True, 'rsi_required': False, 'edge_k': 0.721538527740055, 'edge_cap': 0.6807827878192324, 'bull_strategy': 'breakout', 'bull_bb_std_mult': 3.335084492922419, 'bull_rsi_os': 14, 'bull_rsi_ob': 75, 'bull_adx_thresh': 16.94785428127216, 'bull_atr_min_pct': 0.012318856055952947, 'bull_atr_max_pct': 0.08133240814998056, 'bull_tp_mult': 2.075487373907724, 'bull_tsl_mult': 0.38243014059498415, 'bull_time_stop': 30, 'bull_use_sma': False, 'bull_use_ema': True, 'bull_use_atr': True, 'bull_use_adx': True, 'bull_use_spike': True, 'bull_rsi_required': True, 'bear_strategy': 'mean_reversion', 'bear_bb_std_mult': 3.256990542709003, 'bear_rsi_os': 37, 'bear_rsi_ob': 58, 'bear_adx_thresh': 27.472813362777167, 'bear_atr_min_pct': 0.002395538346536253, 'bear_atr_max_pct': 0.03430986984780348, 'bear_tp_mult': 2.0159111377578145, 'bear_tsl_mult': 0.0330778181122538, 'bear_time_stop': 226, 'bear_use_sma': True, 'bear_use_ema': True, 'bear_use_atr': False, 'bear_use_adx': False, 'bear_use_spike': True, 'bear_rsi_required': False, 'sideways_strategy': 'mean_reversion', 'sideways_bb_std_mult': 2.9981785095080777, 'sideways_rsi_os': 29, 'sideways_rsi_ob': 49, 'sideways_adx_thresh': 23.425503409908178, 'sideways_atr_min_pct': 0.02164464980358191, 'sideways_atr_max_pct': 0.11947285929105678, 'sideways_tp_mult': 1.9596457894610766, 'sideways_tsl_mult': 0.38438036365936973, 'sideways_time_stop': 285, 'sideways_use_sma': True, 'sideways_use_ema': True, 'sideways_use_atr': True, 'sideways_use_adx': True, 'sideways_use_spike': False, 'sideways_rsi_required': True}.
[I 2025-09-01 15:06:11,948] Trial 671 finished with values: [-1000000000.0, 1000000000.0] and parameters: {'p_sma': 45, 'p_std': 56, 'p_atr': 25, 'p_adx': 19, 'rsi_period': 76, 'ema1': 7, 'ema2': 60, 'slip_atr_k': 0.006531212071273567, 'slip_spread_k': 0.048171946422491785, 'spread_hl_frac': 0.012050560897340648, 'bb_std_mult': 3.444593246230952, 'rsi_os': 44, 'rsi_ob': 53, 'vol_spike': 0.1913602587688054, 'adx_thresh': 28.505207400331052, 'atr_min_pct': 0.014431263257452916, 'atr_max_pct': 0.13355669698881778, 'tp_mult': 1.5072867541503308, 'tsl_mult': 0.25261486867573335, 'strategy': 'mean_reversion', 'time_stop': 113, 'use_sma': True, 'use_atr': False, 'use_adx': True, 'use_ema': False, 'use_spike': True, 'rsi_required': False, 'edge_k': 0.2929640474125463, 'edge_cap': 0.9400685538259786, 'bull_strategy': 'breakout', 'bull_bb_std_mult': 2.6708580565820403, 'bull_rsi_os': 14, 'bull_rsi_ob': 79, 'bull_adx_thresh': 11.565402698013505, 'bull_atr_min_pct': 0.01086402596621799, 'bull_atr_max_pct': 0.07828149671839975, 'bull_tp_mult': 1.6837455689789647, 'bull_tsl_mult': 0.8213823024424665, 'bull_time_stop': 162, 'bull_use_sma': False, 'bull_use_ema': True, 'bull_use_atr': True, 'bull_use_adx': True, 'bull_use_spike': True, 'bull_rsi_required': True, 'bear_strategy': 'mean_reversion', 'bear_bb_std_mult': 0.9718837502482314, 'bear_rsi_os': 37, 'bear_rsi_ob': 58, 'bear_adx_thresh': 8.170034784625686, 'bear_atr_min_pct': 0.01893725634055691, 'bear_atr_max_pct': 0.013564545034170691, 'bear_tp_mult': 2.9034364004995608, 'bear_tsl_mult': 0.7780389184954375, 'bear_time_stop': 87, 'bear_use_sma': True, 'bear_use_ema': True, 'bear_use_atr': False, 'bear_use_adx': False, 'bear_use_spike': True, 'bear_rsi_required': False, 'sideways_strategy': 'mean_reversion', 'sideways_bb_std_mult': 2.989728304701002, 'sideways_rsi_os': 35, 'sideways_rsi_ob': 49, 'sideways_adx_thresh': 23.34899986805402, 'sideways_atr_min_pct': 0.0035828932405812517, 'sideways_atr_max_pct': 0.05787223672297327, 'sideways_tp_mult': 2.8754353786045543, 'sideways_tsl_mult': 0.38129695222553334, 'sideways_time_stop': 8, 'sideways_use_sma': True, 'sideways_use_ema': True, 'sideways_use_atr': True, 'sideways_use_adx': True, 'sideways_use_spike': False, 'sideways_rsi_required': True}.
[I 2025-09-01 15:06:58,535] Trial 675 finished with values: [-0.00849260419925535, 0.013476287069156772] and parameters: {'p_sma': 38, 'p_std': 26, 'p_atr': 26, 'p_adx': 8, 'rsi_period': 78, 'ema1': 20, 'ema2': 56, 'slip_atr_k': 0.10044348071386058, 'slip_spread_k': 0.6030277596655486, 'spread_hl_frac': 0.0073449557533531995, 'bb_std_mult': 3.465550359517572, 'rsi_os': 20, 'rsi_ob': 84, 'vol_spike': 0.21979011873831794, 'adx_thresh': 8.304200626138465, 'atr_min_pct': 0.009125009984330157, 'atr_max_pct': 0.03629571332373586, 'tp_mult': 1.5315964050582467, 'tsl_mult': 0.7162715413065344, 'strategy': 'mean_reversion', 'time_stop': 138, 'use_sma': True, 'use_atr': False, 'use_adx': True, 'use_ema': True, 'use_spike': True, 'rsi_required': True, 'edge_k': 0.29145129005500614, 'edge_cap': 0.9164169115326773, 'bull_strategy': 'breakout', 'bull_bb_std_mult': 1.5708939668220443, 'bull_rsi_os': 11, 'bull_rsi_ob': 79, 'bull_adx_thresh': 25.45208868010465, 'bull_atr_min_pct': 0.011936987742642895, 'bull_atr_max_pct': 0.12715739753012606, 'bull_tp_mult': 2.196548777067324, 'bull_tsl_mult': 0.40869809378985994, 'bull_time_stop': 135, 'bull_use_sma': True, 'bull_use_ema': True, 'bull_use_atr': True, 'bull_use_adx': False, 'bull_use_spike': True, 'bull_rsi_required': True, 'bear_strategy': 'mean_reversion', 'bear_bb_std_mult': 2.593810733390626, 'bear_rsi_os': 34, 'bear_rsi_ob': 60, 'bear_adx_thresh': 8.256858489130199, 'bear_atr_min_pct': 0.0004884585802848857, 'bear_atr_max_pct': 0.11570101283711517, 'bear_tp_mult': 1.0540265414548786, 'bear_tsl_mult': 0.39947390913398473, 'bear_time_stop': 70, 'bear_use_sma': False, 'bear_use_ema': False, 'bear_use_atr': False, 'bear_use_adx': False, 'bear_use_spike': True, 'bear_rsi_required': False, 'sideways_strategy': 'mean_reversion', 'sideways_bb_std_mult': 3.1117640386320318, 'sideways_rsi_os': 30, 'sideways_rsi_ob': 53, 'sideways_adx_thresh': 25.79818937412507, 'sideways_atr_min_pct': 0.003437034111120612, 'sideways_atr_max_pct': 0.04001185462074846, 'sideways_tp_mult': 2.6677882288087558, 'sideways_tsl_mult': 0.380973693304973, 'sideways_time_stop': 249, 'sideways_use_sma': True, 'sideways_use_ema': False, 'sideways_use_atr': True, 'sideways_use_adx': True, 'sideways_use_spike': False, 'sideways_rsi_required': False}.
