[I 2025-09-01 14:20:29,260] Trial 362 finished with values: [-1000000000.0, 1000000000.0] and parameters: {'p_sma': 27, 'p_std': 29, 'p_atr': 23, 'p_adx': 7, 'rsi_period': 76, 'ema1': 9, 'ema2': 59, 'slip_atr_k': 0.07918082118275144, 'slip_spread_k': 0.5673114293404434, 'spread_hl_frac': 0.0001452097121098228, 'bb_std_mult': 1.3363124405994276, 'rsi_os': 15, 'rsi_ob': 94, 'vol_spike': 0.05650391286219389, 'adx_thresh': 5.596004159404446, 'atr_min_pct': 0.022041820492932393, 'atr_max_pct': 0.035869211861731067, 'tp_mult': 1.4217290876166921, 'tsl_mult': 0.4815616868331381, 'strategy': 'mean_reversion', 'time_stop': 105, 'use_sma': True, 'use_atr': False, 'use_adx': True, 'use_ema': True, 'use_spike': False, 'rsi_required': True, 'edge_k': 0.23371180729518146, 'edge_cap': 0.9053474837046365, 'bull_strategy': 'breakout', 'bull_bb_std_mult': 3.0906268288487415, 'bull_rsi_os': 55, 'bull_rsi_ob': 75, 'bull_adx_thresh': 12.094248848124774, 'bull_atr_min_pct': 0.011715520930960684, 'bull_atr_max_pct': 0.07262958520388074, 'bull_tp_mult': 1.9073244658279656, 'bull_tsl_mult': 0.43912408593445273, 'bull_time_stop': 167, 'bull_use_sma': False, 'bull_use_ema': True, 'bull_use_atr': True, 'bull_use_adx': False, 'bull_use_spike': True, 'bull_rsi_required': True, 'bear_strategy': 'mean_reversion', 'bear_bb_std_mult': 2.436293016089623, 'bear_rsi_os': 26, 'bear_rsi_ob': 87, 'bear_adx_thresh': 16.832931413763713, 'bear_atr_min_pct': 0.025534753491963123, 'bear_atr_max_pct': 0.018336949975960914, 'bear_tp_mult': 2.373011236304046, 'bear_tsl_mult': 0.13063026761897675, 'bear_time_stop': 193, 'bear_use_sma': True, 'bear_use_ema': False, 'bear_use_atr': False, 'bear_use_adx': False, 'bear_use_spike': True, 'bear_rsi_required': False, 'sideways_strategy': 'mean_reversion', 'sideways_bb_std_mult': 2.941946962299411, 'sideways_rsi_os': 13, 'sideways_rsi_ob': 53, 'sideways_adx_thresh': 23.45688616501759, 'sideways_atr_min_pct': 0.004121651358375387, 'sideways_atr_max_pct': 0.06491573141535034, 'sideways_tp_mult': 1.4826751805588252, 'sideways_tsl_mult': 0.35428095294619455, 'sideways_time_stop': 71, 'sideways_use_sma': True, 'sideways_use_ema': True, 'sideways_use_atr': True, 'sideways_use_adx': True, 'sideways_use_spike': False, 'sideways_rsi_required': False}.
[I 2025-09-01 14:20:29,600] Trial 360 finished with values: [-1000000000.0, 1000000000.0] and parameters: {'p_sma': 27, 'p_std': 25, 'p_atr': 24, 'p_adx': 7, 'rsi_period': 45, 'ema1': 5, 'ema2': 11, 'slip_atr_k': 0.012800280389182558, 'slip_spread_k': 0.5664938388553066, 'spread_hl_frac': 0.03168009236039187, 'bb_std_mult': 3.483783321463556, 'rsi_os': 16, 'rsi_ob': 53, 'vol_spike': 0.1648324256659074, 'adx_thresh': 5.742380564117549, 'atr_min_pct': 0.022030457680556136, 'atr_max_pct': 0.036299776263841683, 'tp_mult': 1.4524849953367052, 'tsl_mult': 0.7506277792986193, 'strategy': 'mean_reversion', 'time_stop': 49, 'use_sma': True, 'use_atr': False, 'use_adx': True, 'use_ema': True, 'use_spike': False, 'rsi_required': True, 'edge_k': 0.2342147187679413, 'edge_cap': 0.9076417653915159, 'bull_strategy': 'breakout', 'bull_bb_std_mult': 3.3731211239378913, 'bull_rsi_os': 31, 'bull_rsi_ob': 71, 'bull_adx_thresh': 12.71837041354301, 'bull_atr_min_pct': 0.02192906727989635, 'bull_atr_max_pct': 0.01018684820648395, 'bull_tp_mult': 2.105475373732271, 'bull_tsl_mult': 0.4865939293708945, 'bull_time_stop': 174, 'bull_use_sma': False, 'bull_use_ema': True, 'bull_use_atr': True, 'bull_use_adx': True, 'bull_use_spike': True, 'bull_rsi_required': True, 'bear_strategy': 'mean_reversion', 'bear_bb_std_mult': 1.6542234353321363, 'bear_rsi_os': 35, 'bear_rsi_ob': 73, 'bear_adx_thresh': 6.936097443116786, 'bear_atr_min_pct': 0.02294580956193796, 'bear_atr_max_pct': 0.03288749469820819, 'bear_tp_mult': 2.373320940482894, 'bear_tsl_mult': 0.07324070117878305, 'bear_time_stop': 230, 'bear_use_sma': True, 'bear_use_ema': False, 'bear_use_atr': False, 'bear_use_adx': False, 'bear_use_spike': True, 'bear_rsi_required': False, 'sideways_strategy': 'mean_reversion', 'sideways_bb_std_mult': 2.202146262854001, 'sideways_rsi_os': 33, 'sideways_rsi_ob': 88, 'sideways_adx_thresh': 23.549193509496533, 'sideways_atr_min_pct': 0.003125764432534658, 'sideways_atr_max_pct': 0.10449693086159194, 'sideways_tp_mult': 1.468549886351556, 'sideways_tsl_mult': 0.3797886428354195, 'sideways_time_stop': 295, 'sideways_use_sma': True, 'sideways_use_ema': True, 'sideways_use_atr': True, 'sideways_use_adx': True, 'sideways_use_spike': False, 'sideways_rsi_required': False}.
[I 2025-09-01 14:20:29,616] Trial 361 finished with values: [-0.029214728429212133, 0.031968580813729136] and parameters: {'p_sma': 31, 'p_std': 50, 'p_atr': 26, 'p_adx': 7, 'rsi_period': 45, 'ema1': 5, 'ema2': 16, 'slip_atr_k': 0.15241677301654105, 'slip_spread_k': 0.5640791370818158, 'spread_hl_frac': 0.010470781419967034, 'bb_std_mult': 3.373676625026021, 'rsi_os': 8, 'rsi_ob': 94, 'vol_spike': 0.05890914917057868, 'adx_thresh': 5.004074478125209, 'atr_min_pct': 0.02678321387290749, 'atr_max_pct': 0.09451306113434176, 'tp_mult': 1.7791126247904783, 'tsl_mult': 0.49331447706079046, 'strategy': 'mean_reversion', 'time_stop': 51, 'use_sma': True, 'use_atr': False, 'use_adx': True, 'use_ema': True, 'use_spike': False, 'rsi_required': True, 'edge_k': 0.8908809165152778, 'edge_cap': 0.9035291285558189, 'bull_strategy': 'breakout', 'bull_bb_std_mult': 3.347918046383667, 'bull_rsi_os': 12, 'bull_rsi_ob': 79, 'bull_adx_thresh': 12.741629207849162, 'bull_atr_min_pct': 0.021759016805012403, 'bull_atr_max_pct': 0.1181861389626953, 'bull_tp_mult': 2.4477943207544555, 'bull_tsl_mult': 0.48048322886474026, 'bull_time_stop': 17, 'bull_use_sma': False, 'bull_use_ema': True, 'bull_use_atr': True, 'bull_use_adx': True, 'bull_use_spike': True, 'bull_rsi_required': True, 'bear_strategy': 'mean_reversion', 'bear_bb_std_mult': 2.421490768977605, 'bear_rsi_os': 35, 'bear_rsi_ob': 73, 'bear_adx_thresh': 16.935767838332566, 'bear_atr_min_pct': 0.0011019935837327727, 'bear_atr_max_pct': 0.1093458298920389, 'bear_tp_mult': 1.3099273703216923, 'bear_tsl_mult': 0.07381523921263183, 'bear_time_stop': 195, 'bear_use_sma': True, 'bear_use_ema': False, 'bear_use_atr': False, 'bear_use_adx': False, 'bear_use_spike': True, 'bear_rsi_required': False, 'sideways_strategy': 'mean_reversion', 'sideways_bb_std_mult': 3.2603710676108446, 'sideways_rsi_os': 49, 'sideways_rsi_ob': 49, 'sideways_adx_thresh': 8.921692651843522, 'sideways_atr_min_pct': 0.0031439933157251633, 'sideways_atr_max_pct': 0.10568232735886596, 'sideways_tp_mult': 2.5482726761970476, 'sideways_tsl_mult': 0.3200500475635868, 'sideways_time_stop': 268, 'sideways_use_sma': True, 'sideways_use_ema': True, 'sideways_use_atr': True, 'sideways_use_adx': True, 'sideways_use_spike': False, 'sideways_rsi_required': False}.
[I 2025-09-01 14:20:30,224] Trial 365 finished with values: [-1000000000.0, 1000000000.0] and parameters: {'p_sma': 41, 'p_std': 17, 'p_atr': 27, 'p_adx': 8, 'rsi_period': 12, 'ema1': 9, 'ema2': 55, 'slip_atr_k': 0.008751290135633213, 'slip_spread_k': 0.5490615123620924, 'spread_hl_frac': 0.009984708352757176, 'bb_std_mult': 3.298479264698126, 'rsi_os': 37, 'rsi_ob': 50, 'vol_spike': 0.11601937002636845, 'adx_thresh': 6.6016417748862235, 'atr_min_pct': 0.011583935149693544, 'atr_max_pct': 0.11925606843816679, 'tp_mult': 1.391829619135034, 'tsl_mult': 0.6880754983171042, 'strategy': 'mean_reversion', 'time_stop': 102, 'use_sma': True, 'use_atr': False, 'use_adx': True, 'use_ema': True, 'use_spike': True, 'rsi_required': True, 'edge_k': 0.2708443822013927, 'edge_cap': 0.8303889369968236, 'bull_strategy': 'breakout', 'bull_bb_std_mult': 2.993156837503263, 'bull_rsi_os': 13, 'bull_rsi_ob': 79, 'bull_adx_thresh': 11.350338973676411, 'bull_atr_min_pct': 0.011349242931633769, 'bull_atr_max_pct': 0.12829454069471416, 'bull_tp_mult': 1.5939173706539305, 'bull_tsl_mult': 0.45473208891896566, 'bull_time_stop': 147, 'bull_use_sma': False, 'bull_use_ema': False, 'bull_use_atr': True, 'bull_use_adx': False, 'bull_use_spike': True, 'bull_rsi_required': True, 'bear_strategy': 'mean_reversion', 'bear_bb_std_mult': 1.8692888620712491, 'bear_rsi_os': 36, 'bear_rsi_ob': 79, 'bear_adx_thresh': 25.899379719415133, 'bear_atr_min_pct': 0.027730551611252756, 'bear_atr_max_pct': 0.054310301516665604, 'bear_tp_mult': 2.961647092602203, 'bear_tsl_mult': 0.11735392479155603, 'bear_time_stop': 279, 'bear_use_sma': False, 'bear_use_ema': False, 'bear_use_atr': False, 'bear_use_adx': False, 'bear_use_spike': True, 'bear_rsi_required': False, 'sideways_strategy': 'mean_reversion', 'sideways_bb_std_mult': 1.4976109161054574, 'sideways_rsi_os': 30, 'sideways_rsi_ob': 92, 'sideways_adx_thresh': 25.77696288800705, 'sideways_atr_min_pct': 0.005108279075137377, 'sideways_atr_max_pct': 0.10908354660638447, 'sideways_tp_mult': 2.4244348728764775, 'sideways_tsl_mult': 0.44072362894003125, 'sideways_time_stop': 300, 'sideways_use_sma': True, 'sideways_use_ema': True, 'sideways_use_atr': True, 'sideways_use_adx': True, 'sideways_use_spike': False, 'sideways_rsi_required': True}.
[I 2025-09-01 14:21:08,009] Trial 363 finished with values: [-1000000000.0, 1000000000.0] and parameters: {'p_sma': 31, 'p_std': 39, 'p_atr': 27, 'p_adx': 8, 'rsi_period': 83, 'ema1': 11, 'ema2': 38, 'slip_atr_k': 0.01033840036503442, 'slip_spread_k': 0.5757348275723301, 'spread_hl_frac': 0.03733963924260161, 'bb_std_mult': 3.385287974137433, 'rsi_os': 43, 'rsi_ob': 53, 'vol_spike': 0.2232006231658401, 'adx_thresh': 6.156532874530119, 'atr_min_pct': 0.011437768216332144, 'atr_max_pct': 0.11972358649335568, 'tp_mult': 1.3918862594436214, 'tsl_mult': 0.6911153508582174, 'strategy': 'mean_reversion', 'time_stop': 10, 'use_sma': True, 'use_atr': False, 'use_adx': True, 'use_ema': True, 'use_spike': True, 'rsi_required': True, 'edge_k': 0.8848232853684409, 'edge_cap': 0.9309731694150463, 'bull_strategy': 'breakout', 'bull_bb_std_mult': 2.962378327139623, 'bull_rsi_os': 37, 'bull_rsi_ob': 79, 'bull_adx_thresh': 11.353476432767732, 'bull_atr_min_pct': 0.011270896476032907, 'bull_atr_max_pct': 0.033868096637344185, 'bull_tp_mult': 1.2096728284478537, 'bull_tsl_mult': 0.47119814273207594, 'bull_time_stop': 16, 'bull_use_sma': False, 'bull_use_ema': False, 'bull_use_atr': True, 'bull_use_adx': True, 'bull_use_spike': True, 'bull_rsi_required': True, 'bear_strategy': 'mean_reversion', 'bear_bb_std_mult': 1.3137093011473717, 'bear_rsi_os': 6, 'bear_rsi_ob': 64, 'bear_adx_thresh': 30.47027719533027, 'bear_atr_min_pct': 0.0009543519120581558, 'bear_atr_max_pct': 0.1094994810465891, 'bear_tp_mult': 1.978882527087852, 'bear_tsl_mult': 0.11410247318855583, 'bear_time_stop': 88, 'bear_use_sma': False, 'bear_use_ema': False, 'bear_use_atr': False, 'bear_use_adx': False, 'bear_use_spike': True, 'bear_rsi_required': False, 'sideways_strategy': 'mean_reversion', 'sideways_bb_std_mult': 2.5589099937090003, 'sideways_rsi_os': 49, 'sideways_rsi_ob': 92, 'sideways_adx_thresh': 19.15302956029308, 'sideways_atr_min_pct': 0.0037233025315879863, 'sideways_atr_max_pct': 0.10904150608928186, 'sideways_tp_mult': 2.4377705850749645, 'sideways_tsl_mult': 0.4405985474978053, 'sideways_time_stop': 256, 'sideways_use_sma': True, 'sideways_use_ema': True, 'sideways_use_atr': True, 'sideways_use_adx': True, 'sideways_use_spike': False, 'sideways_rsi_required': True}.
[I 2025-09-01 14:21:08,301] Trial 364 finished with values: [-1000000000.0, 1000000000.0] and parameters: {'p_sma': 39, 'p_std': 26, 'p_atr': 27, 'p_adx': 8, 'rsi_period': 51, 'ema1': 9, 'ema2': 55, 'slip_atr_k': 0.009772889842784288, 'slip_spread_k': 0.5531159710887715, 'spread_hl_frac': 0.009763734783025332, 'bb_std_mult': 3.385328509815037, 'rsi_os': 37, 'rsi_ob': 52, 'vol_spike': 0.11672469359778917, 'adx_thresh': 6.228169219966855, 'atr_min_pct': 0.011583561112105973, 'atr_max_pct': 0.033590560706739984, 'tp_mult': 1.3900341967620924, 'tsl_mult': 0.6850474526955467, 'strategy': 'mean_reversion', 'time_stop': 12, 'use_sma': True, 'use_atr': False, 'use_adx': True, 'use_ema': True, 'use_spike': True, 'rsi_required': True, 'edge_k': 1.6612177785184108, 'edge_cap': 0.44720752964427013, 'bull_strategy': 'breakout', 'bull_bb_std_mult': 3.172901455165846, 'bull_rsi_os': 38, 'bull_rsi_ob': 79, 'bull_adx_thresh': 11.947738866546533, 'bull_atr_min_pct': 0.010034378444232963, 'bull_atr_max_pct': 0.08580288881319917, 'bull_tp_mult': 1.5894507905962592, 'bull_tsl_mult': 0.45252865164865114, 'bull_time_stop': 292, 'bull_use_sma': False, 'bull_use_ema': False, 'bull_use_atr': True, 'bull_use_adx': False, 'bull_use_spike': True, 'bull_rsi_required': True, 'bear_strategy': 'mean_reversion', 'bear_bb_std_mult': 0.7567386210779097, 'bear_rsi_os': 53, 'bear_rsi_ob': 78, 'bear_adx_thresh': 30.11203988745136, 'bear_atr_min_pct': 0.027679116620662907, 'bear_atr_max_pct': 0.10965408542646518, 'bear_tp_mult': 1.9948535299124526, 'bear_tsl_mult': 0.6907709286511, 'bear_time_stop': 138, 'bear_use_sma': False, 'bear_use_ema': False, 'bear_use_atr': False, 'bear_use_adx': False, 'bear_use_spike': True, 'bear_rsi_required': False, 'sideways_strategy': 'mean_reversion', 'sideways_bb_std_mult': 1.8291564113345258, 'sideways_rsi_os': 30, 'sideways_rsi_ob': 92, 'sideways_adx_thresh': 25.856380217062682, 'sideways_atr_min_pct': 0.0054769267208860765, 'sideways_atr_max_pct': 0.060533427218790035, 'sideways_tp_mult': 2.436133379463792, 'sideways_tsl_mult': 0.44286722425447433, 'sideways_time_stop': 95, 'sideways_use_sma': True, 'sideways_use_ema': True, 'sideways_use_atr': True, 'sideways_use_adx': True, 'sideways_use_spike': False, 'sideways_rsi_required': True}.
[I 2025-09-01 14:21:08,725] Trial 366 finished with values: [0.006050698960280876, 0.0038280823544727983] and parameters: {'p_sma': 39, 'p_std': 54, 'p_atr': 27, 'p_adx': 15, 'rsi_period': 83, 'ema1': 9, 'ema2': 55, 'slip_atr_k': 0.01027442552011751, 'slip_spread_k': 0.5533905045279761, 'spread_hl_frac': 0.009887477810030167, 'bb_std_mult': 2.2911723998893474, 'rsi_os': 43, 'rsi_ob': 53, 'vol_spike': 0.13443844695333754, 'adx_thresh': 6.200677737492492, 'atr_min_pct': 0.011543274843482724, 'atr_max_pct': 0.03343390608323795, 'tp_mult': 1.3900881189466172, 'tsl_mult': 0.6933648179302563, 'strategy': 'mean_reversion', 'time_stop': 104, 'use_sma': True, 'use_atr': False, 'use_adx': True, 'use_ema': True, 'use_spike': True, 'rsi_required': True, 'edge_k': 0.28385121201149666, 'edge_cap': 0.9298868893282995, 'bull_strategy': 'breakout', 'bull_bb_std_mult': 2.9464144464717554, 'bull_rsi_os': 24, 'bull_rsi_ob': 79, 'bull_adx_thresh': 6.302879214071799, 'bull_atr_min_pct': 0.011150261695174758, 'bull_atr_max_pct': 0.08526220929698675, 'bull_tp_mult': 2.375457698770335, 'bull_tsl_mult': 0.4562067256789722, 'bull_time_stop': 146, 'bull_use_sma': False, 'bull_use_ema': False, 'bull_use_atr': True, 'bull_use_adx': False, 'bull_use_spike': True, 'bull_rsi_required': True, 'bear_strategy': 'mean_reversion', 'bear_bb_std_mult': 1.3130389564258071, 'bear_rsi_os': 36, 'bear_rsi_ob': 79, 'bear_adx_thresh': 20.759485412656776, 'bear_atr_min_pct': 0.001731156132000585, 'bear_atr_max_pct': 0.0961938865437415, 'bear_tp_mult': 2.572058014307405, 'bear_tsl_mult': 0.11167241226990371, 'bear_time_stop': 137, 'bear_use_sma': False, 'bear_use_ema': False, 'bear_use_atr': False, 'bear_use_adx': False, 'bear_use_spike': True, 'bear_rsi_required': False, 'sideways_strategy': 'mean_reversion', 'sideways_bb_std_mult': 3.0514514354604882, 'sideways_rsi_os': 30, 'sideways_rsi_ob': 92, 'sideways_adx_thresh': 22.755271785211438, 'sideways_atr_min_pct': 0.00515842506480869, 'sideways_atr_max_pct': 0.14221066923147366, 'sideways_tp_mult': 2.426808383643152, 'sideways_tsl_mult': 0.4428832996302666, 'sideways_time_stop': 155, 'sideways_use_sma': True, 'sideways_use_ema': True, 'sideways_use_atr': True, 'sideways_use_adx': True, 'sideways_use_spike': False, 'sideways_rsi_required': True}.
[I 2025-09-01 14:21:09,164] Trial 367 finished with values: [-1000000000.0, 1000000000.0] and parameters: {'p_sma': 30, 'p_std': 60, 'p_atr': 28, 'p_adx': 9, 'rsi_period': 50, 'ema1': 11, 'ema2': 56, 'slip_atr_k': 0.03552100161529487, 'slip_spread_k': 0.8562142839541937, 'spread_hl_frac': 0.0070206476878845936, 'bb_std_mult': 2.3018464922908746, 'rsi_os': 21, 'rsi_ob': 56, 'vol_spike': 0.11717683899632311, 'adx_thresh': 6.169640358141523, 'atr_min_pct': 0.010789667447128887, 'atr_max_pct': 0.0346284055517924, 'tp_mult': 2.406426409336613, 'tsl_mult': 0.6284887383206024, 'strategy': 'mean_reversion', 'time_stop': 189, 'use_sma': True, 'use_atr': False, 'use_adx': True, 'use_ema': True, 'use_spike': True, 'rsi_required': True, 'edge_k': 1.6066786302755944, 'edge_cap': 0.6266546801674613, 'bull_strategy': 'mean_reversion', 'bull_bb_std_mult': 0.9912991480044449, 'bull_rsi_os': 42, 'bull_rsi_ob': 77, 'bull_adx_thresh': 11.74543604594672, 'bull_atr_min_pct': 0.012255680109200605, 'bull_atr_max_pct': 0.13111624663469043, 'bull_tp_mult': 1.6465920304600796, 'bull_tsl_mult': 0.46741161163854117, 'bull_time_stop': 162, 'bull_use_sma': False, 'bull_use_ema': True, 'bull_use_atr': True, 'bull_use_adx': True, 'bull_use_spike': True, 'bull_rsi_required': True, 'bear_strategy': 'mean_reversion', 'bear_bb_std_mult': 1.3106357914162199, 'bear_rsi_os': 6, 'bear_rsi_ob': 80, 'bear_adx_thresh': 8.361412586079894, 'bear_atr_min_pct': 0.029340813255621063, 'bear_atr_max_pct': 0.10277461854006553, 'bear_tp_mult': 1.9809825613932621, 'bear_tsl_mult': 0.011408473079287537, 'bear_time_stop': 88, 'bear_use_sma': False, 'bear_use_ema': False, 'bear_use_atr': True, 'bear_use_adx': False, 'bear_use_spike': True, 'bear_rsi_required': False, 'sideways_strategy': 'mean_reversion', 'sideways_bb_std_mult': 1.7835090556976645, 'sideways_rsi_os': 33, 'sideways_rsi_ob': 90, 'sideways_adx_thresh': 25.184302936468608, 'sideways_atr_min_pct': 0.0036611782503928577, 'sideways_atr_max_pct': 0.11267738719408708, 'sideways_tp_mult': 2.1358678265693567, 'sideways_tsl_mult': 0.934293697071322, 'sideways_time_stop': 257, 'sideways_use_sma': True, 'sideways_use_ema': True, 'sideways_use_atr': True, 'sideways_use_adx': True, 'sideways_use_spike': True, 'sideways_rsi_required': False}.
[I 2025-09-01 14:21:44,865] Trial 369 finished with values: [-1000000000.0, 1000000000.0] and parameters: {'p_sma': 30, 'p_std': 13, 'p_atr': 22, 'p_adx': 9, 'rsi_period': 79, 'ema1': 16, 'ema2': 13, 'slip_atr_k': 0.03035832394972545, 'slip_spread_k': 0.6269827938659813, 'spread_hl_frac': 0.008471944566882977, 'bb_std_mult': 3.4963437351840656, 'rsi_os': 43, 'rsi_ob': 56, 'vol_spike': 0.11208329517099953, 'adx_thresh': 25.550737851578976, 'atr_min_pct': 0.010717670852853094, 'atr_max_pct': 0.04156705673445461, 'tp_mult': 2.7800428681605007, 'tsl_mult': 0.6279761667684479, 'strategy': 'mean_reversion', 'time_stop': 210, 'use_sma': True, 'use_atr': False, 'use_adx': True, 'use_ema': True, 'use_spike': True, 'rsi_required': True, 'edge_k': 0.29334065244036633, 'edge_cap': 0.6262233748355662, 'bull_strategy': 'mean_reversion', 'bull_bb_std_mult': 0.9382695947397084, 'bull_rsi_os': 12, 'bull_rsi_ob': 69, 'bull_adx_thresh': 33.40425399509872, 'bull_atr_min_pct': 0.012165578351876158, 'bull_atr_max_pct': 0.13523020653997186, 'bull_tp_mult': 1.6530409535596586, 'bull_tsl_mult': 0.49890989845824757, 'bull_time_stop': 27, 'bull_use_sma': True, 'bull_use_ema': True, 'bull_use_atr': True, 'bull_use_adx': True, 'bull_use_spike': True, 'bull_rsi_required': True, 'bear_strategy': 'mean_reversion', 'bear_bb_std_mult': 2.2970926969658696, 'bear_rsi_os': 36, 'bear_rsi_ob': 48, 'bear_adx_thresh': 8.306358483372291, 'bear_atr_min_pct': 0.02937740757392699, 'bear_atr_max_pct': 0.039801509139435615, 'bear_tp_mult': 2.1102622498929136, 'bear_tsl_mult': 0.47239045012850295, 'bear_time_stop': 101, 'bear_use_sma': False, 'bear_use_ema': False, 'bear_use_atr': True, 'bear_use_adx': False, 'bear_use_spike': True, 'bear_rsi_required': False, 'sideways_strategy': 'mean_reversion', 'sideways_bb_std_mult': 2.978272027615444, 'sideways_rsi_os': 32, 'sideways_rsi_ob': 90, 'sideways_adx_thresh': 22.857698796431265, 'sideways_atr_min_pct': 0.01166678406637896, 'sideways_atr_max_pct': 0.112501380019495, 'sideways_tp_mult': 2.217360008411093, 'sideways_tsl_mult': 0.5108994468454106, 'sideways_time_stop': 153, 'sideways_use_sma': True, 'sideways_use_ema': False, 'sideways_use_atr': True, 'sideways_use_adx': True, 'sideways_use_spike': True, 'sideways_rsi_required': False}.
