[I 2025-09-01 14:34:59,343] Trial 468 finished with values: [-0.039268216458651306, 0.04070124264794193] and parameters: {'p_sma': 53, 'p_std': 58, 'p_atr': 21, 'p_adx': 10, 'rsi_period': 14, 'ema1': 10, 'ema2': 58, 'slip_atr_k': 0.017844890195351615, 'slip_spread_k': 0.6439277470673922, 'spread_hl_frac': 0.0073105226111822965, 'bb_std_mult': 0.6509780912178593, 'rsi_os': 12, 'rsi_ob': 53, 'vol_spike': 0.12403921597125704, 'adx_thresh': 34.0860122652204, 'atr_min_pct': 0.0016083076512737257, 'atr_max_pct': 0.0324268261346901, 'tp_mult': 1.526412442234582, 'tsl_mult': 0.6494066093253794, 'strategy': 'breakout', 'time_stop': 71, 'use_sma': True, 'use_atr': False, 'use_adx': True, 'use_ema': False, 'use_spike': True, 'rsi_required': True, 'edge_k': 0.6593628859399074, 'edge_cap': 0.9649236690053217, 'bull_strategy': 'breakout', 'bull_bb_std_mult': 2.1765177463615912, 'bull_rsi_os': 12, 'bull_rsi_ob': 48, 'bull_adx_thresh': 13.65587169778177, 'bull_atr_min_pct': 0.012276013469853598, 'bull_atr_max_pct': 0.13145624594730093, 'bull_tp_mult': 1.566746445757144, 'bull_tsl_mult': 0.9576647124150948, 'bull_time_stop': 139, 'bull_use_sma': False, 'bull_use_ema': True, 'bull_use_atr': True, 'bull_use_adx': True, 'bull_use_spike': True, 'bull_rsi_required': False, 'bear_strategy': 'breakout', 'bear_bb_std_mult': 0.9767549964672035, 'bear_rsi_os': 30, 'bear_rsi_ob': 69, 'bear_adx_thresh': 18.552589159059664, 'bear_atr_min_pct': 0.0009787535957349034, 'bear_atr_max_pct': 0.1062089968038667, 'bear_tp_mult': 2.780632341958767, 'bear_tsl_mult': 0.18326412834124278, 'bear_time_stop': 98, 'bear_use_sma': False, 'bear_use_ema': False, 'bear_use_atr': False, 'bear_use_adx': False, 'bear_use_spike': True, 'bear_rsi_required': False, 'sideways_strategy': 'mean_reversion', 'sideways_bb_std_mult': 3.1945744444548603, 'sideways_rsi_os': 32, 'sideways_rsi_ob': 90, 'sideways_adx_thresh': 27.107879461322845, 'sideways_atr_min_pct': 0.00644250183270445, 'sideways_atr_max_pct': 0.10648525592439824, 'sideways_tp_mult': 2.9403649527283657, 'sideways_tsl_mult': 0.5663724528132544, 'sideways_time_stop': 262, 'sideways_use_sma': True, 'sideways_use_ema': True, 'sideways_use_atr': False, 'sideways_use_adx': True, 'sideways_use_spike': False, 'sideways_rsi_required': True}.
[I 2025-09-01 14:35:41,598] Trial 471 finished with values: [-1000000000.0, 1000000000.0] and parameters: {'p_sma': 33, 'p_std': 40, 'p_atr': 26, 'p_adx': 15, 'rsi_period': 74, 'ema1': 27, 'ema2': 59, 'slip_atr_k': 0.08691757134806795, 'slip_spread_k': 0.6703439274864229, 'spread_hl_frac': 0.009313029072329511, 'bb_std_mult': 3.4657229304863146, 'rsi_os': 23, 'rsi_ob': 53, 'vol_spike': 0.2270488941217207, 'adx_thresh': 34.13941272780889, 'atr_min_pct': 0.0014653398821312547, 'atr_max_pct': 0.040338016714951505, 'tp_mult': 1.1458523781144536, 'tsl_mult': 0.6452858374397354, 'strategy': 'mean_reversion', 'time_stop': 136, 'use_sma': True, 'use_atr': False, 'use_adx': True, 'use_ema': False, 'use_spike': True, 'rsi_required': True, 'edge_k': 0.30412181003988675, 'edge_cap': 0.9781621676187111, 'bull_strategy': 'breakout', 'bull_bb_std_mult': 1.9628935347075873, 'bull_rsi_os': 43, 'bull_rsi_ob': 77, 'bull_adx_thresh': 13.707810258284749, 'bull_atr_min_pct': 0.012125554370856096, 'bull_atr_max_pct': 0.04416286215764641, 'bull_tp_mult': 1.1915040986516832, 'bull_tsl_mult': 0.4178857309307139, 'bull_time_stop': 165, 'bull_use_sma': False, 'bull_use_ema': False, 'bull_use_atr': True, 'bull_use_adx': True, 'bull_use_spike': True, 'bull_rsi_required': True, 'bear_strategy': 'mean_reversion', 'bear_bb_std_mult': 2.3554793399834497, 'bear_rsi_os': 30, 'bear_rsi_ob': 56, 'bear_adx_thresh': 18.441119294173735, 'bear_atr_min_pct': 0.0018295032416074893, 'bear_atr_max_pct': 0.14184339864452766, 'bear_tp_mult': 2.762229996665497, 'bear_tsl_mult': 0.18508045650545352, 'bear_time_stop': 98, 'bear_use_sma': False, 'bear_use_ema': False, 'bear_use_atr': False, 'bear_use_adx': False, 'bear_use_spike': False, 'bear_rsi_required': False, 'sideways_strategy': 'breakout', 'sideways_bb_std_mult': 3.2039342596995546, 'sideways_rsi_os': 32, 'sideways_rsi_ob': 91, 'sideways_adx_thresh': 15.303087775254562, 'sideways_atr_min_pct': 0.0270653407393647, 'sideways_atr_max_pct': 0.13837437549888298, 'sideways_tp_mult': 2.32020058447927, 'sideways_tsl_mult': 0.33000121327797227, 'sideways_time_stop': 30, 'sideways_use_sma': True, 'sideways_use_ema': True, 'sideways_use_atr': True, 'sideways_use_adx': True, 'sideways_use_spike': False, 'sideways_rsi_required': False}.
[I 2025-09-01 14:35:42,326] Trial 472 finished with values: [-1000000000.0, 1000000000.0] and parameters: {'p_sma': 27, 'p_std': 32, 'p_atr': 26, 'p_adx': 7, 'rsi_period': 81, 'ema1': 8, 'ema2': 59, 'slip_atr_k': 0.0076253383918747, 'slip_spread_k': 0.5744130864972707, 'spread_hl_frac': 0.01951175922296606, 'bb_std_mult': 3.4659061323977705, 'rsi_os': 41, 'rsi_ob': 65, 'vol_spike': 0.27463277615339843, 'adx_thresh': 7.3900109338783935, 'atr_min_pct': 0.011063710557248585, 'atr_max_pct': 0.027209935246469356, 'tp_mult': 1.320454137337945, 'tsl_mult': 0.5964621623275577, 'strategy': 'mean_reversion', 'time_stop': 110, 'use_sma': True, 'use_atr': False, 'use_adx': True, 'use_ema': False, 'use_spike': True, 'rsi_required': True, 'edge_k': 0.13243245729924957, 'edge_cap': 0.610206031572617, 'bull_strategy': 'breakout', 'bull_bb_std_mult': 3.02278924847667, 'bull_rsi_os': 5, 'bull_rsi_ob': 78, 'bull_adx_thresh': 10.881975255444377, 'bull_atr_min_pct': 0.016547415315213095, 'bull_atr_max_pct': 0.13565796995369608, 'bull_tp_mult': 1.680681625592313, 'bull_tsl_mult': 0.3719936346339586, 'bull_time_stop': 164, 'bull_use_sma': False, 'bull_use_ema': False, 'bull_use_atr': True, 'bull_use_adx': True, 'bull_use_spike': True, 'bull_rsi_required': True, 'bear_strategy': 'mean_reversion', 'bear_bb_std_mult': 2.348200645862969, 'bear_rsi_os': 39, 'bear_rsi_ob': 55, 'bear_adx_thresh': 9.47220290990211, 'bear_atr_min_pct': 0.01913872437830296, 'bear_atr_max_pct': 0.11198789762083028, 'bear_tp_mult': 2.9639062153868547, 'bear_tsl_mult': 0.1307508804719638, 'bear_time_stop': 85, 'bear_use_sma': False, 'bear_use_ema': False, 'bear_use_atr': False, 'bear_use_adx': False, 'bear_use_spike': False, 'bear_rsi_required': False, 'sideways_strategy': 'breakout', 'sideways_bb_std_mult': 3.0923430722395926, 'sideways_rsi_os': 32, 'sideways_rsi_ob': 92, 'sideways_adx_thresh': 6.184276994614832, 'sideways_atr_min_pct': 0.02681020218516289, 'sideways_atr_max_pct': 0.11400816440048138, 'sideways_tp_mult': 2.388817205881841, 'sideways_tsl_mult': 0.34036012021805834, 'sideways_time_stop': 61, 'sideways_use_sma': True, 'sideways_use_ema': True, 'sideways_use_atr': True, 'sideways_use_adx': True, 'sideways_use_spike': False, 'sideways_rsi_required': False}.
[I 2025-09-01 14:35:43,782] Trial 470 finished with values: [-0.05530829192539821, 0.055245070301621096] and parameters: {'p_sma': 33, 'p_std': 26, 'p_atr': 26, 'p_adx': 15, 'rsi_period': 16, 'ema1': 23, 'ema2': 59, 'slip_atr_k': 0.08799209926636588, 'slip_spread_k': 0.6210071201965512, 'spread_hl_frac': 0.01784017981384777, 'bb_std_mult': 3.014259616589216, 'rsi_os': 23, 'rsi_ob': 80, 'vol_spike': 0.10754420083923774, 'adx_thresh': 25.13275709676921, 'atr_min_pct': 0.010837600416760167, 'atr_max_pct': 0.04005308986876252, 'tp_mult': 2.134858510317746, 'tsl_mult': 0.6381121396317215, 'strategy': 'mean_reversion', 'time_stop': 111, 'use_sma': True, 'use_atr': False, 'use_adx': True, 'use_ema': False, 'use_spike': True, 'rsi_required': True, 'edge_k': 0.3167923894062461, 'edge_cap': 0.9626880177287264, 'bull_strategy': 'breakout', 'bull_bb_std_mult': 1.9689563533107521, 'bull_rsi_os': 37, 'bull_rsi_ob': 48, 'bull_adx_thresh': 13.595655882991627, 'bull_atr_min_pct': 0.012353474914049926, 'bull_atr_max_pct': 0.13085045323122468, 'bull_tp_mult': 1.510486110443113, 'bull_tsl_mult': 0.496248997303826, 'bull_time_stop': 164, 'bull_use_sma': False, 'bull_use_ema': True, 'bull_use_atr': True, 'bull_use_adx': True, 'bull_use_spike': True, 'bull_rsi_required': False, 'bear_strategy': 'mean_reversion', 'bear_bb_std_mult': 3.598046757884389, 'bear_rsi_os': 30, 'bear_rsi_ob': 70, 'bear_adx_thresh': 9.186707140943945, 'bear_atr_min_pct': 0.0017983714308452987, 'bear_atr_max_pct': 0.10654923613477252, 'bear_tp_mult': 2.1776999213859627, 'bear_tsl_mult': 0.1297194809410333, 'bear_time_stop': 175, 'bear_use_sma': False, 'bear_use_ema': False, 'bear_use_atr': False, 'bear_use_adx': False, 'bear_use_spike': True, 'bear_rsi_required': False, 'sideways_strategy': 'breakout', 'sideways_bb_std_mult': 1.2490688230073232, 'sideways_rsi_os': 32, 'sideways_rsi_ob': 92, 'sideways_adx_thresh': 6.558906073587947, 'sideways_atr_min_pct': 0.01138957934851608, 'sideways_atr_max_pct': 0.07331986447686877, 'sideways_tp_mult': 1.3100193560230635, 'sideways_tsl_mult': 0.33154381615824624, 'sideways_time_stop': 255, 'sideways_use_sma': True, 'sideways_use_ema': True, 'sideways_use_atr': True, 'sideways_use_adx': True, 'sideways_use_spike': False, 'sideways_rsi_required': True}.
[I 2025-09-01 14:35:44,241] Trial 469 finished with values: [-0.09400923375134151, 0.09417418597045155] and parameters: {'p_sma': 34, 'p_std': 23, 'p_atr': 13, 'p_adx': 18, 'rsi_period': 19, 'ema1': 8, 'ema2': 35, 'slip_atr_k': 0.22284111137586304, 'slip_spread_k': 0.6425184122392753, 'spread_hl_frac': 0.01774007658248473, 'bb_std_mult': 3.3386511347485195, 'rsi_os': 20, 'rsi_ob': 53, 'vol_spike': 0.273156216739454, 'adx_thresh': 25.130927436748145, 'atr_min_pct': 0.010585624513751234, 'atr_max_pct': 0.04010386759902437, 'tp_mult': 1.1429842993391, 'tsl_mult': 0.6463429072314972, 'strategy': 'mean_reversion', 'time_stop': 102, 'use_sma': True, 'use_atr': False, 'use_adx': True, 'use_ema': False, 'use_spike': True, 'rsi_required': True, 'edge_k': 0.10337765016719255, 'edge_cap': 0.47446365150719083, 'bull_strategy': 'breakout', 'bull_bb_std_mult': 3.2832248585990604, 'bull_rsi_os': 5, 'bull_rsi_ob': 77, 'bull_adx_thresh': 13.401913958959685, 'bull_atr_min_pct': 0.012361921058043549, 'bull_atr_max_pct': 0.13210142743947303, 'bull_tp_mult': 1.6036941883469733, 'bull_tsl_mult': 0.4970117002692219, 'bull_time_stop': 166, 'bull_use_sma': False, 'bull_use_ema': True, 'bull_use_atr': True, 'bull_use_adx': True, 'bull_use_spike': True, 'bull_rsi_required': False, 'bear_strategy': 'mean_reversion', 'bear_bb_std_mult': 2.605897943981722, 'bear_rsi_os': 30, 'bear_rsi_ob': 59, 'bear_adx_thresh': 18.485102661170423, 'bear_atr_min_pct': 0.0019448981017146014, 'bear_atr_max_pct': 0.09294912147958066, 'bear_tp_mult': 1.7648972527885083, 'bear_tsl_mult': 0.48661688360448835, 'bear_time_stop': 98, 'bear_use_sma': False, 'bear_use_ema': False, 'bear_use_atr': False, 'bear_use_adx': False, 'bear_use_spike': True, 'bear_rsi_required': False, 'sideways_strategy': 'mean_reversion', 'sideways_bb_std_mult': 3.1886722894171644, 'sideways_rsi_os': 30, 'sideways_rsi_ob': 92, 'sideways_adx_thresh': 8.095950435852794, 'sideways_atr_min_pct': 0.027013272984683482, 'sideways_atr_max_pct': 0.1300959255443383, 'sideways_tp_mult': 1.424911599789322, 'sideways_tsl_mult': 0.12416871422996728, 'sideways_time_stop': 32, 'sideways_use_sma': True, 'sideways_use_ema': True, 'sideways_use_atr': True, 'sideways_use_adx': True, 'sideways_use_spike': False, 'sideways_rsi_required': True}.
[I 2025-09-01 14:36:23,338] Trial 474 finished with values: [-1000000000.0, 1000000000.0] and parameters: {'p_sma': 25, 'p_std': 36, 'p_atr': 17, 'p_adx': 20, 'rsi_period': 80, 'ema1': 10, 'ema2': 33, 'slip_atr_k': 0.02125835738078584, 'slip_spread_k': 0.6017759842926149, 'spread_hl_frac': 0.01160187777460377, 'bb_std_mult': 3.3823504212128714, 'rsi_os': 44, 'rsi_ob': 51, 'vol_spike': 0.10828374696407378, 'adx_thresh': 30.51558307291641, 'atr_min_pct': 0.013995119925373401, 'atr_max_pct': 0.14454330615803931, 'tp_mult': 1.6050517406333729, 'tsl_mult': 0.6557068916612554, 'strategy': 'mean_reversion', 'time_stop': 112, 'use_sma': True, 'use_atr': False, 'use_adx': True, 'use_ema': True, 'use_spike': False, 'rsi_required': True, 'edge_k': 0.09698974400332674, 'edge_cap': 0.6400921975562401, 'bull_strategy': 'breakout', 'bull_bb_std_mult': 3.2647345347043215, 'bull_rsi_os': 11, 'bull_rsi_ob': 66, 'bull_adx_thresh': 15.223816963911604, 'bull_atr_min_pct': 0.011002751444655597, 'bull_atr_max_pct': 0.021379044902768263, 'bull_tp_mult': 2.6116253042543054, 'bull_tsl_mult': 0.10423970227081975, 'bull_time_stop': 227, 'bull_use_sma': True, 'bull_use_ema': True, 'bull_use_atr': False, 'bull_use_adx': True, 'bull_use_spike': True, 'bull_rsi_required': True, 'bear_strategy': 'mean_reversion', 'bear_bb_std_mult': 2.609621358124688, 'bear_rsi_os': 34, 'bear_rsi_ob': 88, 'bear_adx_thresh': 7.70096755911981, 'bear_atr_min_pct': 0.020899418233116477, 'bear_atr_max_pct': 0.1211475311213965, 'bear_tp_mult': 1.985459012499894, 'bear_tsl_mult': 0.07573781520513545, 'bear_time_stop': 94, 'bear_use_sma': False, 'bear_use_ema': False, 'bear_use_atr': False, 'bear_use_adx': True, 'bear_use_spike': True, 'bear_rsi_required': False, 'sideways_strategy': 'mean_reversion', 'sideways_bb_std_mult': 1.048256591258271, 'sideways_rsi_os': 34, 'sideways_rsi_ob': 70, 'sideways_adx_thresh': 26.479074813743015, 'sideways_atr_min_pct': 0.020718489866114558, 'sideways_atr_max_pct': 0.06980749313084182, 'sideways_tp_mult': 2.4558767817109888, 'sideways_tsl_mult': 0.39415053659004634, 'sideways_time_stop': 260, 'sideways_use_sma': True, 'sideways_use_ema': False, 'sideways_use_atr': True, 'sideways_use_adx': True, 'sideways_use_spike': False, 'sideways_rsi_required': False}.
[I 2025-09-01 14:36:24,036] Trial 475 finished with values: [-1000000000.0, 1000000000.0] and parameters: {'p_sma': 28, 'p_std': 35, 'p_atr': 25, 'p_adx': 9, 'rsi_period': 80, 'ema1': 18, 'ema2': 56, 'slip_atr_k': 0.06844944467660777, 'slip_spread_k': 0.1126516028425606, 'spread_hl_frac': 0.010330828433668466, 'bb_std_mult': 3.3732204369884413, 'rsi_os': 43, 'rsi_ob': 51, 'vol_spike': 0.11423973491005723, 'adx_thresh': 9.377202186490049, 'atr_min_pct': 0.01992174720772289, 'atr_max_pct': 0.033034820410842096, 'tp_mult': 1.2541009785808044, 'tsl_mult': 0.6143415170774454, 'strategy': 'mean_reversion', 'time_stop': 102, 'use_sma': True, 'use_atr': False, 'use_adx': True, 'use_ema': True, 'use_spike': False, 'rsi_required': True, 'edge_k': 0.2592655813566451, 'edge_cap': 0.9266521398613159, 'bull_strategy': 'breakout', 'bull_bb_std_mult': 3.296111018694619, 'bull_rsi_os': 32, 'bull_rsi_ob': 80, 'bull_adx_thresh': 15.14837574868438, 'bull_atr_min_pct': 0.011037175718737005, 'bull_atr_max_pct': 0.018018340546507354, 'bull_tp_mult': 1.6112241384565247, 'bull_tsl_mult': 0.11790853744218205, 'bull_time_stop': 158, 'bull_use_sma': True, 'bull_use_ema': True, 'bull_use_atr': False, 'bull_use_adx': True, 'bull_use_spike': True, 'bull_rsi_required': True, 'bear_strategy': 'mean_reversion', 'bear_bb_std_mult': 2.6224510715003717, 'bear_rsi_os': 32, 'bear_rsi_ob': 89, 'bear_adx_thresh': 7.577822451951494, 'bear_atr_min_pct': 0.0027024472812925133, 'bear_atr_max_pct': 0.02499402802671978, 'bear_tp_mult': 2.069104721337309, 'bear_tsl_mult': 0.491073171506688, 'bear_time_stop': 81, 'bear_use_sma': True, 'bear_use_ema': False, 'bear_use_atr': False, 'bear_use_adx': True, 'bear_use_spike': True, 'bear_rsi_required': False, 'sideways_strategy': 'mean_reversion', 'sideways_bb_std_mult': 2.924956140661591, 'sideways_rsi_os': 12, 'sideways_rsi_ob': 47, 'sideways_adx_thresh': 7.9688470992689275, 'sideways_atr_min_pct': 0.004111317188263774, 'sideways_atr_max_pct': 0.11839310825848773, 'sideways_tp_mult': 2.436638064192449, 'sideways_tsl_mult': 0.3946235591695476, 'sideways_time_stop': 253, 'sideways_use_sma': True, 'sideways_use_ema': False, 'sideways_use_atr': True, 'sideways_use_adx': True, 'sideways_use_spike': False, 'sideways_rsi_required': False}.
[I 2025-09-01 14:36:24,061] Trial 473 finished with values: [-1000000000.0, 1000000000.0] and parameters: {'p_sma': 27, 'p_std': 31, 'p_atr': 17, 'p_adx': 9, 'rsi_period': 68, 'ema1': 18, 'ema2': 35, 'slip_atr_k': 0.2246147017370272, 'slip_spread_k': 0.5760012899477434, 'spread_hl_frac': 0.019438129096009532, 'bb_std_mult': 2.195806463035753, 'rsi_os': 44, 'rsi_ob': 67, 'vol_spike': 0.15267508678371894, 'adx_thresh': 15.529274867520757, 'atr_min_pct': 0.00015259929636981737, 'atr_max_pct': 0.039104938591479885, 'tp_mult': 2.1408603909250816, 'tsl_mult': 0.5989660754879192, 'strategy': 'mean_reversion', 'time_stop': 110, 'use_sma': True, 'use_atr': False, 'use_adx': True, 'use_ema': True, 'use_spike': True, 'rsi_required': True, 'edge_k': 0.07972623468214679, 'edge_cap': 0.6149387019226673, 'bull_strategy': 'breakout', 'bull_bb_std_mult': 3.2840773052544074, 'bull_rsi_os': 11, 'bull_rsi_ob': 78, 'bull_adx_thresh': 28.419229756413706, 'bull_atr_min_pct': 0.026289803355664006, 'bull_atr_max_pct': 0.12284326053587927, 'bull_tp_mult': 1.6835045259064951, 'bull_tsl_mult': 0.4934256170607638, 'bull_time_stop': 165, 'bull_use_sma': True, 'bull_use_ema': True, 'bull_use_atr': True, 'bull_use_adx': True, 'bull_use_spike': True, 'bull_rsi_required': True, 'bear_strategy': 'mean_reversion', 'bear_bb_std_mult': 2.616906285062144, 'bear_rsi_os': 32, 'bear_rsi_ob': 58, 'bear_adx_thresh': 9.227458972247513, 'bear_atr_min_pct': 0.019422139956554133, 'bear_atr_max_pct': 0.11133988517824613, 'bear_tp_mult': 1.7681597083311895, 'bear_tsl_mult': 0.11841216295465642, 'bear_time_stop': 87, 'bear_use_sma': False, 'bear_use_ema': False, 'bear_use_atr': False, 'bear_use_adx': False, 'bear_use_spike': True, 'bear_rsi_required': False, 'sideways_strategy': 'mean_reversion', 'sideways_bb_std_mult': 3.1003854872229573, 'sideways_rsi_os': 31, 'sideways_rsi_ob': 92, 'sideways_adx_thresh': 8.239159793522907, 'sideways_atr_min_pct': 0.0043341771280518806, 'sideways_atr_max_pct': 0.11356089706915551, 'sideways_tp_mult': 1.0109714468855455, 'sideways_tsl_mult': 0.42905981078109, 'sideways_time_stop': 220, 'sideways_use_sma': True, 'sideways_use_ema': False, 'sideways_use_atr': True, 'sideways_use_adx': True, 'sideways_use_spike': False, 'sideways_rsi_required': False}.
[I 2025-09-01 14:36:24,408] Trial 476 finished with values: [-1000000000.0, 1000000000.0] and parameters: {'p_sma': 25, 'p_std': 30, 'p_atr': 22, 'p_adx': 8, 'rsi_period': 68, 'ema1': 22, 'ema2': 57, 'slip_atr_k': 0.06945350779041254, 'slip_spread_k': 0.583065430590301, 'spread_hl_frac': 0.011863174937034773, 'bb_std_mult': 3.2491628696261734, 'rsi_os': 44, 'rsi_ob': 59, 'vol_spike': 0.11393091215425266, 'adx_thresh': 28.8415846221636, 'atr_min_pct': 0.02011199997112167, 'atr_max_pct': 0.034445888810886054, 'tp_mult': 1.5737907785773122, 'tsl_mult': 0.8088338028557317, 'strategy': 'mean_reversion', 'time_stop': 22, 'use_sma': True, 'use_atr': False, 'use_adx': True, 'use_ema': True, 'use_spike': False, 'rsi_required': True, 'edge_k': 1.5399039849066827, 'edge_cap': 0.9371415676144255, 'bull_strategy': 'breakout', 'bull_bb_std_mult': 3.1292535952628278, 'bull_rsi_os': 32, 'bull_rsi_ob': 80, 'bull_adx_thresh': 8.032985386730218, 'bull_atr_min_pct': 0.011130625813094097, 'bull_atr_max_pct': 0.12208390556065803, 'bull_tp_mult': 1.6323237525579488, 'bull_tsl_mult': 0.5301965921034139, 'bull_time_stop': 228, 'bull_use_sma': True, 'bull_use_ema': True, 'bull_use_atr': False, 'bull_use_adx': False, 'bull_use_spike': True, 'bull_rsi_required': True, 'bear_strategy': 'mean_reversion', 'bear_bb_std_mult': 2.557531814832659, 'bear_rsi_os': 34, 'bear_rsi_ob': 58, 'bear_adx_thresh': 7.731359597512741, 'bear_atr_min_pct': 0.015707573141573474, 'bear_atr_max_pct': 0.11273788048998486, 'bear_tp_mult': 1.9750713016913166, 'bear_tsl_mult': 0.9528646262057519, 'bear_time_stop': 70, 'bear_use_sma': True, 'bear_use_ema': False, 'bear_use_atr': False, 'bear_use_adx': True, 'bear_use_spike': True, 'bear_rsi_required': False, 'sideways_strategy': 'mean_reversion', 'sideways_bb_std_mult': 2.904375613406894, 'sideways_rsi_os': 34, 'sideways_rsi_ob': 89, 'sideways_adx_thresh': 26.59906843160396, 'sideways_atr_min_pct': 0.0042550157013429004, 'sideways_atr_max_pct': 0.11763272394668663, 'sideways_tp_mult': 2.044161252486766, 'sideways_tsl_mult': 0.4299076725621939, 'sideways_time_stop': 251, 'sideways_use_sma': True, 'sideways_use_ema': False, 'sideways_use_atr': True, 'sideways_use_adx': True, 'sideways_use_spike': False, 'sideways_rsi_required': False}.
