[I 2025-09-01 14:34:10,555] Trial 456 finished with values: [-1000000000.0, 1000000000.0] and parameters: {'p_sma': 16, 'p_std': 5, 'p_atr': 27, 'p_adx': 7, 'rsi_period': 83, 'ema1': 9, 'ema2': 57, 'slip_atr_k': 0.02626635355422828, 'slip_spread_k': 0.5658267469223426, 'spread_hl_frac': 0.002831157459827087, 'bb_std_mult': 3.4053552890106795, 'rsi_os': 5, 'rsi_ob': 54, 'vol_spike': 0.03395156829191426, 'adx_thresh': 6.077762074605209, 'atr_min_pct': 0.009208621319389647, 'atr_max_pct': 0.09904937213239201, 'tp_mult': 1.3775004641609025, 'tsl_mult': 0.6711220082597598, 'strategy': 'mean_reversion', 'time_stop': 58, 'use_sma': True, 'use_atr': False, 'use_adx': True, 'use_ema': True, 'use_spike': False, 'rsi_required': True, 'edge_k': 1.9994944916599515, 'edge_cap': 0.9007906563282757, 'bull_strategy': 'breakout', 'bull_bb_std_mult': 3.359302480233295, 'bull_rsi_os': 16, 'bull_rsi_ob': 82, 'bull_adx_thresh': 11.59392023060713, 'bull_atr_min_pct': 0.01347845762844451, 'bull_atr_max_pct': 0.13375683677799252, 'bull_tp_mult': 2.1534557915340695, 'bull_tsl_mult': 0.9814674146636024, 'bull_time_stop': 158, 'bull_use_sma': False, 'bull_use_ema': False, 'bull_use_atr': True, 'bull_use_adx': True, 'bull_use_spike': True, 'bull_rsi_required': True, 'bear_strategy': 'mean_reversion', 'bear_bb_std_mult': 2.5522931262422146, 'bear_rsi_os': 38, 'bear_rsi_ob': 57, 'bear_adx_thresh': 29.157245713059524, 'bear_atr_min_pct': 0.007233448041238214, 'bear_atr_max_pct': 0.010956711791995206, 'bear_tp_mult': 2.100179502527309, 'bear_tsl_mult': 0.6715464839559556, 'bear_time_stop': 91, 'bear_use_sma': False, 'bear_use_ema': False, 'bear_use_atr': False, 'bear_use_adx': False, 'bear_use_spike': True, 'bear_rsi_required': False, 'sideways_strategy': 'mean_reversion', 'sideways_bb_std_mult': 3.148443499780027, 'sideways_rsi_os': 21, 'sideways_rsi_ob': 89, 'sideways_adx_thresh': 25.76455039473942, 'sideways_atr_min_pct': 0.019068822342902324, 'sideways_atr_max_pct': 0.111211857966734, 'sideways_tp_mult': 2.407392866033083, 'sideways_tsl_mult': 0.31054510161449644, 'sideways_time_stop': 275, 'sideways_use_sma': True, 'sideways_use_ema': True, 'sideways_use_atr': True, 'sideways_use_adx': True, 'sideways_use_spike': False, 'sideways_rsi_required': False}.
[I 2025-09-01 14:34:11,329] Trial 457 finished with values: [-1000000000.0, 1000000000.0] and parameters: {'p_sma': 31, 'p_std': 29, 'p_atr': 30, 'p_adx': 8, 'rsi_period': 83, 'ema1': 9, 'ema2': 57, 'slip_atr_k': 0.0350675000111791, 'slip_spread_k': 0.7927868261315854, 'spread_hl_frac': 0.02624809581397978, 'bb_std_mult': 3.4294246846887706, 'rsi_os': 44, 'rsi_ob': 88, 'vol_spike': 0.10488997806266852, 'adx_thresh': 6.0758651034234274, 'atr_min_pct': 0.009884574029611083, 'atr_max_pct': 0.08924903479637213, 'tp_mult': 1.382810921523521, 'tsl_mult': 0.6740340440169799, 'strategy': 'mean_reversion', 'time_stop': 57, 'use_sma': True, 'use_atr': False, 'use_adx': True, 'use_ema': True, 'use_spike': False, 'rsi_required': True, 'edge_k': 0.19293853785803292, 'edge_cap': 0.898019358522339, 'bull_strategy': 'breakout', 'bull_bb_std_mult': 3.3498667944586518, 'bull_rsi_os': 15, 'bull_rsi_ob': 85, 'bull_adx_thresh': 11.391620819399598, 'bull_atr_min_pct': 0.014486185833337618, 'bull_atr_max_pct': 0.04050091812527946, 'bull_tp_mult': 1.0997273442519293, 'bull_tsl_mult': 0.7074155495900913, 'bull_time_stop': 68, 'bull_use_sma': False, 'bull_use_ema': True, 'bull_use_atr': True, 'bull_use_adx': True, 'bull_use_spike': True, 'bull_rsi_required': True, 'bear_strategy': 'mean_reversion', 'bear_bb_std_mult': 2.5588559277642213, 'bear_rsi_os': 26, 'bear_rsi_ob': 87, 'bear_adx_thresh': 7.967350436327597, 'bear_atr_min_pct': 0.00383917708552355, 'bear_atr_max_pct': 0.1106412505253152, 'bear_tp_mult': 2.111027724118645, 'bear_tsl_mult': 0.2569423788790254, 'bear_time_stop': 88, 'bear_use_sma': False, 'bear_use_ema': False, 'bear_use_atr': False, 'bear_use_adx': False, 'bear_use_spike': True, 'bear_rsi_required': False, 'sideways_strategy': 'mean_reversion', 'sideways_bb_std_mult': 3.287993229637218, 'sideways_rsi_os': 50, 'sideways_rsi_ob': 94, 'sideways_adx_thresh': 25.788300632725754, 'sideways_atr_min_pct': 0.023653616514488787, 'sideways_atr_max_pct': 0.08429716306030226, 'sideways_tp_mult': 2.4392263925961957, 'sideways_tsl_mult': 0.3046850702965935, 'sideways_time_stop': 291, 'sideways_use_sma': True, 'sideways_use_ema': True, 'sideways_use_atr': True, 'sideways_use_adx': True, 'sideways_use_spike': False, 'sideways_rsi_required': False}.
[I 2025-09-01 14:34:13,980] Trial 461 finished with values: [-1000000000.0, 1000000000.0] and parameters: {'p_sma': 31, 'p_std': 27, 'p_atr': 26, 'p_adx': 17, 'rsi_period': 78, 'ema1': 15, 'ema2': 56, 'slip_atr_k': 0.003215622606784792, 'slip_spread_k': 0.786841395445963, 'spread_hl_frac': 0.009533074559555722, 'bb_std_mult': 3.5994110171162186, 'rsi_os': 43, 'rsi_ob': 52, 'vol_spike': 0.0927904918424605, 'adx_thresh': 6.113139639572339, 'atr_min_pct': 0.011595346122313827, 'atr_max_pct': 0.03660404552757328, 'tp_mult': 1.4308314964537319, 'tsl_mult': 0.6801479474044646, 'strategy': 'mean_reversion', 'time_stop': 104, 'use_sma': True, 'use_atr': False, 'use_adx': True, 'use_ema': True, 'use_spike': True, 'rsi_required': True, 'edge_k': 0.24184952930801357, 'edge_cap': 0.9669108616530028, 'bull_strategy': 'breakout', 'bull_bb_std_mult': 0.7501728671497057, 'bull_rsi_os': 10, 'bull_rsi_ob': 80, 'bull_adx_thresh': 12.549647146923533, 'bull_atr_min_pct': 0.014673753042532546, 'bull_atr_max_pct': 0.12717387338280375, 'bull_tp_mult': 1.0978628226856353, 'bull_tsl_mult': 0.4529003676162265, 'bull_time_stop': 149, 'bull_use_sma': False, 'bull_use_ema': True, 'bull_use_atr': True, 'bull_use_adx': True, 'bull_use_spike': True, 'bull_rsi_required': False, 'bear_strategy': 'mean_reversion', 'bear_bb_std_mult': 2.454236785473226, 'bear_rsi_os': 35, 'bear_rsi_ob': 93, 'bear_adx_thresh': 27.693830899865254, 'bear_atr_min_pct': 0.02443224575019745, 'bear_atr_max_pct': 0.016883357498606852, 'bear_tp_mult': 2.3489046564935756, 'bear_tsl_mult': 0.04878391243646431, 'bear_time_stop': 262, 'bear_use_sma': False, 'bear_use_ema': False, 'bear_use_atr': False, 'bear_use_adx': False, 'bear_use_spike': True, 'bear_rsi_required': True, 'sideways_strategy': 'mean_reversion', 'sideways_bb_std_mult': 1.9933969096790274, 'sideways_rsi_os': 29, 'sideways_rsi_ob': 93, 'sideways_adx_thresh': 9.560131693449431, 'sideways_atr_min_pct': 0.018877651645338472, 'sideways_atr_max_pct': 0.11186588783692626, 'sideways_tp_mult': 2.491248438955416, 'sideways_tsl_mult': 0.3682157111659191, 'sideways_time_stop': 247, 'sideways_use_sma': True, 'sideways_use_ema': True, 'sideways_use_atr': True, 'sideways_use_adx': True, 'sideways_use_spike': False, 'sideways_rsi_required': True}.
[I 2025-09-01 14:34:15,769] Trial 462 finished with values: [-1000000000.0, 1000000000.0] and parameters: {'p_sma': 31, 'p_std': 13, 'p_atr': 26, 'p_adx': 7, 'rsi_period': 80, 'ema1': 5, 'ema2': 55, 'slip_atr_k': 0.01537493005345418, 'slip_spread_k': 0.5180123624439883, 'spread_hl_frac': 0.008137687540880742, 'bb_std_mult': 3.326205926221929, 'rsi_os': 7, 'rsi_ob': 57, 'vol_spike': 0.09199980362735667, 'adx_thresh': 6.060785821518229, 'atr_min_pct': 0.012030166113402015, 'atr_max_pct': 0.036910883001776425, 'tp_mult': 2.424693470925403, 'tsl_mult': 0.6935140277649906, 'strategy': 'mean_reversion', 'time_stop': 150, 'use_sma': False, 'use_atr': True, 'use_adx': True, 'use_ema': True, 'use_spike': True, 'rsi_required': True, 'edge_k': 0.0005695226380107998, 'edge_cap': 0.9436705295987414, 'bull_strategy': 'breakout', 'bull_bb_std_mult': 0.7230562980921273, 'bull_rsi_os': 14, 'bull_rsi_ob': 82, 'bull_adx_thresh': 12.393660694945325, 'bull_atr_min_pct': 0.010701882901188101, 'bull_atr_max_pct': 0.12091613032787521, 'bull_tp_mult': 1.642160863990307, 'bull_tsl_mult': 0.45241609215959344, 'bull_time_stop': 251, 'bull_use_sma': False, 'bull_use_ema': True, 'bull_use_atr': True, 'bull_use_adx': True, 'bull_use_spike': True, 'bull_rsi_required': True, 'bear_strategy': 'mean_reversion', 'bear_bb_std_mult': 2.468116950889486, 'bear_rsi_os': 7, 'bear_rsi_ob': 59, 'bear_adx_thresh': 34.81369692691043, 'bear_atr_min_pct': 0.02585619345637911, 'bear_atr_max_pct': 0.08143587435023192, 'bear_tp_mult': 2.035767481060906, 'bear_tsl_mult': 0.10794841067766758, 'bear_time_stop': 166, 'bear_use_sma': False, 'bear_use_ema': False, 'bear_use_atr': False, 'bear_use_adx': False, 'bear_use_spike': True, 'bear_rsi_required': True, 'sideways_strategy': 'mean_reversion', 'sideways_bb_std_mult': 2.985635401090355, 'sideways_rsi_os': 29, 'sideways_rsi_ob': 66, 'sideways_adx_thresh': 23.847420568338627, 'sideways_atr_min_pct': 0.012453628340949667, 'sideways_atr_max_pct': 0.030925186885278268, 'sideways_tp_mult': 2.4939213380003293, 'sideways_tsl_mult': 0.4056758309453396, 'sideways_time_stop': 246, 'sideways_use_sma': True, 'sideways_use_ema': True, 'sideways_use_atr': True, 'sideways_use_adx': True, 'sideways_use_spike': True, 'sideways_rsi_required': False}.
[I 2025-09-01 14:34:16,233] Trial 463 finished with values: [-1000000000.0, 1000000000.0] and parameters: {'p_sma': 37, 'p_std': 47, 'p_atr': 29, 'p_adx': 11, 'rsi_period': 78, 'ema1': 11, 'ema2': 55, 'slip_atr_k': 0.18202206634825413, 'slip_spread_k': 0.5192266360030999, 'spread_hl_frac': 0.008129145023962184, 'bb_std_mult': 3.4690818145242095, 'rsi_os': 18, 'rsi_ob': 48, 'vol_spike': 0.09812075289212208, 'adx_thresh': 12.92047722117179, 'atr_min_pct': 0.021521839516609652, 'atr_max_pct': 0.05012204886432907, 'tp_mult': 1.4403799210633768, 'tsl_mult': 0.6996653484584333, 'strategy': 'mean_reversion', 'time_stop': 291, 'use_sma': False, 'use_atr': True, 'use_adx': False, 'use_ema': True, 'use_spike': True, 'rsi_required': False, 'edge_k': 0.2459395156575078, 'edge_cap': 0.5386434681021209, 'bull_strategy': 'breakout', 'bull_bb_std_mult': 3.219137824575159, 'bull_rsi_os': 13, 'bull_rsi_ob': 80, 'bull_adx_thresh': 12.672447333711537, 'bull_atr_min_pct': 0.005532327918721002, 'bull_atr_max_pct': 0.0536105964546808, 'bull_tp_mult': 1.1184625893491837, 'bull_tsl_mult': 0.45001764698449903, 'bull_time_stop': 149, 'bull_use_sma': False, 'bull_use_ema': True, 'bull_use_atr': True, 'bull_use_adx': True, 'bull_use_spike': False, 'bull_rsi_required': True, 'bear_strategy': 'mean_reversion', 'bear_bb_std_mult': 2.464740796603184, 'bear_rsi_os': 20, 'bear_rsi_ob': 49, 'bear_adx_thresh': 10.965568210163623, 'bear_atr_min_pct': 6.389236203176683e-05, 'bear_atr_max_pct': 0.08123096881933922, 'bear_tp_mult': 2.336000392171833, 'bear_tsl_mult': 0.10438528159567637, 'bear_time_stop': 296, 'bear_use_sma': False, 'bear_use_ema': True, 'bear_use_atr': True, 'bear_use_adx': False, 'bear_use_spike': True, 'bear_rsi_required': True, 'sideways_strategy': 'mean_reversion', 'sideways_bb_std_mult': 2.9631789417713392, 'sideways_rsi_os': 34, 'sideways_rsi_ob': 66, 'sideways_adx_thresh': 23.70882682654782, 'sideways_atr_min_pct': 0.01214943010439689, 'sideways_atr_max_pct': 0.08888746567388646, 'sideways_tp_mult': 1.3691936482711862, 'sideways_tsl_mult': 0.9266999777218274, 'sideways_time_stop': 207, 'sideways_use_sma': False, 'sideways_use_ema': True, 'sideways_use_atr': True, 'sideways_use_adx': False, 'sideways_use_spike': True, 'sideways_rsi_required': False}.
[I 2025-09-01 14:34:16,595] Trial 467 finished with values: [-1000000000.0, 1000000000.0] and parameters: {'p_sma': 29, 'p_std': 27, 'p_atr': 10, 'p_adx': 8, 'rsi_period': 65, 'ema1': 16, 'ema2': 53, 'slip_atr_k': 0.012675647099254587, 'slip_spread_k': 0.5441173716951337, 'spread_hl_frac': 0.010700856248816592, 'bb_std_mult': 3.5183738247356002, 'rsi_os': 43, 'rsi_ob': 55, 'vol_spike': 0.11410354534774685, 'adx_thresh': 5.629244551994364, 'atr_min_pct': 0.02934832281412889, 'atr_max_pct': 0.02773656262459554, 'tp_mult': 1.488286768924354, 'tsl_mult': 0.23470036823979945, 'strategy': 'breakout', 'time_stop': 125, 'use_sma': True, 'use_atr': False, 'use_adx': False, 'use_ema': True, 'use_spike': True, 'rsi_required': False, 'edge_k': 0.3727523326549219, 'edge_cap': 0.8690774743215786, 'bull_strategy': 'mean_reversion', 'bull_bb_std_mult': 2.5532290406795024, 'bull_rsi_os': 48, 'bull_rsi_ob': 76, 'bull_adx_thresh': 9.446073844317848, 'bull_atr_min_pct': 0.00970870754137673, 'bull_atr_max_pct': 0.12603890954812652, 'bull_tp_mult': 1.7380270285995114, 'bull_tsl_mult': 0.9139395737281752, 'bull_time_stop': 261, 'bull_use_sma': True, 'bull_use_ema': True, 'bull_use_atr': False, 'bull_use_adx': False, 'bull_use_spike': False, 'bull_rsi_required': True, 'bear_strategy': 'breakout', 'bear_bb_std_mult': 0.7987216663790229, 'bear_rsi_os': 35, 'bear_rsi_ob': 74, 'bear_adx_thresh': 6.408061485324263, 'bear_atr_min_pct': 0.0031213765442244666, 'bear_atr_max_pct': 0.11642972821094753, 'bear_tp_mult': 2.228131303839522, 'bear_tsl_mult': 0.23512018094402673, 'bear_time_stop': 272, 'bear_use_sma': True, 'bear_use_ema': True, 'bear_use_atr': True, 'bear_use_adx': True, 'bear_use_spike': False, 'bear_rsi_required': False, 'sideways_strategy': 'mean_reversion', 'sideways_bb_std_mult': 3.041981503623858, 'sideways_rsi_os': 31, 'sideways_rsi_ob': 90, 'sideways_adx_thresh': 22.843496227734562, 'sideways_atr_min_pct': 0.0035452403650793546, 'sideways_atr_max_pct': 0.10502762195420497, 'sideways_tp_mult': 2.287620073859017, 'sideways_tsl_mult': 0.8484877737200498, 'sideways_time_stop': 116, 'sideways_use_sma': False, 'sideways_use_ema': False, 'sideways_use_atr': False, 'sideways_use_adx': False, 'sideways_use_spike': False, 'sideways_rsi_required': False}.
[I 2025-09-01 14:34:53,299] Trial 466 finished with values: [-0.07430004875899199, 0.07454059052968383] and parameters: {'p_sma': 29, 'p_std': 47, 'p_atr': 21, 'p_adx': 11, 'rsi_period': 13, 'ema1': 10, 'ema2': 54, 'slip_atr_k': 0.012072266778345693, 'slip_spread_k': 0.5414289466893111, 'spread_hl_frac': 0.0109468620440727, 'bb_std_mult': 3.4844895339048536, 'rsi_os': 12, 'rsi_ob': 50, 'vol_spike': 0.09755930653232799, 'adx_thresh': 12.06333052045234, 'atr_min_pct': 0.029349072419666673, 'atr_max_pct': 0.0509451937195214, 'tp_mult': 2.562186278776042, 'tsl_mult': 0.6985373897866715, 'strategy': 'breakout', 'time_stop': 126, 'use_sma': False, 'use_atr': True, 'use_adx': False, 'use_ema': True, 'use_spike': True, 'rsi_required': False, 'edge_k': 0.36241257480489286, 'edge_cap': 0.5318525420832276, 'bull_strategy': 'mean_reversion', 'bull_bb_std_mult': 3.2326987438479726, 'bull_rsi_os': 13, 'bull_rsi_ob': 76, 'bull_adx_thresh': 14.462882602760827, 'bull_atr_min_pct': 0.020712633222284556, 'bull_atr_max_pct': 0.010271591294792562, 'bull_tp_mult': 1.567801027665549, 'bull_tsl_mult': 0.48744701856146294, 'bull_time_stop': 140, 'bull_use_sma': True, 'bull_use_ema': True, 'bull_use_atr': False, 'bull_use_adx': False, 'bull_use_spike': False, 'bull_rsi_required': True, 'bear_strategy': 'breakout', 'bear_bb_std_mult': 1.1855231725984874, 'bear_rsi_os': 54, 'bear_rsi_ob': 56, 'bear_adx_thresh': 6.697039986601286, 'bear_atr_min_pct': 0.0007075745840505413, 'bear_atr_max_pct': 0.03746324397918353, 'bear_tp_mult': 2.052161876102422, 'bear_tsl_mult': 0.4341657564883856, 'bear_time_stop': 222, 'bear_use_sma': True, 'bear_use_ema': True, 'bear_use_atr': True, 'bear_use_adx': True, 'bear_use_spike': True, 'bear_rsi_required': False, 'sideways_strategy': 'mean_reversion', 'sideways_bb_std_mult': 2.9609145410677176, 'sideways_rsi_os': 52, 'sideways_rsi_ob': 75, 'sideways_adx_thresh': 21.36992707903788, 'sideways_atr_min_pct': 0.0036393227501329865, 'sideways_atr_max_pct': 0.10661750652129512, 'sideways_tp_mult': 2.1528300816634927, 'sideways_tsl_mult': 0.3668108500379381, 'sideways_time_stop': 119, 'sideways_use_sma': False, 'sideways_use_ema': False, 'sideways_use_atr': False, 'sideways_use_adx': False, 'sideways_use_spike': True, 'sideways_rsi_required': False}.
[I 2025-09-01 14:34:55,808] Trial 465 finished with values: [-0.01691856001746639, 0.018273488630155325] and parameters: {'p_sma': 29, 'p_std': 23, 'p_atr': 13, 'p_adx': 11, 'rsi_period': 19, 'ema1': 11, 'ema2': 48, 'slip_atr_k': 0.015047884117173333, 'slip_spread_k': 0.5327546928611144, 'spread_hl_frac': 0.007879668541283134, 'bb_std_mult': 3.3099171181934013, 'rsi_os': 27, 'rsi_ob': 57, 'vol_spike': 0.09700747786629552, 'adx_thresh': 5.571349462952352, 'atr_min_pct': 0.012115562586457572, 'atr_max_pct': 0.04928508796728087, 'tp_mult': 1.5175166128685096, 'tsl_mult': 0.6959226829258401, 'strategy': 'breakout', 'time_stop': 124, 'use_sma': False, 'use_atr': True, 'use_adx': False, 'use_ema': True, 'use_spike': True, 'rsi_required': False, 'edge_k': 0.0003800027785845206, 'edge_cap': 0.5319854960047342, 'bull_strategy': 'mean_reversion', 'bull_bb_std_mult': 3.211167707359603, 'bull_rsi_os': 52, 'bull_rsi_ob': 76, 'bull_adx_thresh': 14.4566755134924, 'bull_atr_min_pct': 0.009792372557728432, 'bull_atr_max_pct': 0.1421514631547818, 'bull_tp_mult': 1.7472402605881614, 'bull_tsl_mult': 0.015851098112716844, 'bull_time_stop': 139, 'bull_use_sma': False, 'bull_use_ema': True, 'bull_use_atr': True, 'bull_use_adx': False, 'bull_use_spike': False, 'bull_rsi_required': True, 'bear_strategy': 'breakout', 'bear_bb_std_mult': 0.7893774640312732, 'bear_rsi_os': 35, 'bear_rsi_ob': 59, 'bear_adx_thresh': 6.471209463627902, 'bear_atr_min_pct': 0.003200615755558418, 'bear_atr_max_pct': 0.11557013856949408, 'bear_tp_mult': 2.031396064680506, 'bear_tsl_mult': 0.22995877205740306, 'bear_time_stop': 223, 'bear_use_sma': True, 'bear_use_ema': True, 'bear_use_atr': True, 'bear_use_adx': False, 'bear_use_spike': True, 'bear_rsi_required': True, 'sideways_strategy': 'mean_reversion', 'sideways_bb_std_mult': 2.766208395362607, 'sideways_rsi_os': 30, 'sideways_rsi_ob': 67, 'sideways_adx_thresh': 32.531006552013025, 'sideways_atr_min_pct': 0.012201173224493359, 'sideways_atr_max_pct': 0.04592500633678866, 'sideways_tp_mult': 1.3654153195634755, 'sideways_tsl_mult': 0.4027945579923006, 'sideways_time_stop': 262, 'sideways_use_sma': False, 'sideways_use_ema': True, 'sideways_use_atr': False, 'sideways_use_adx': False, 'sideways_use_spike': True, 'sideways_rsi_required': False}.
[I 2025-09-01 14:34:57,185] Trial 464 finished with values: [-0.0836788950496059, 0.08435491491320452] and parameters: {'p_sma': 52, 'p_std': 22, 'p_atr': 13, 'p_adx': 19, 'rsi_period': 14, 'ema1': 5, 'ema2': 56, 'slip_atr_k': 0.0032749195839829603, 'slip_spread_k': 0.6136338711849685, 'spread_hl_frac': 0.04674292665210109, 'bb_std_mult': 3.3038890111771226, 'rsi_os': 18, 'rsi_ob': 55, 'vol_spike': 0.0928563100951707, 'adx_thresh': 11.903514743760976, 'atr_min_pct': 0.012295405649584016, 'atr_max_pct': 0.03609147551001224, 'tp_mult': 1.5177471651524364, 'tsl_mult': 0.6920457361990393, 'strategy': 'breakout', 'time_stop': 165, 'use_sma': False, 'use_atr': True, 'use_adx': False, 'use_ema': True, 'use_spike': True, 'rsi_required': False, 'edge_k': 0.35424188338556184, 'edge_cap': 0.5374765393190458, 'bull_strategy': 'breakout', 'bull_bb_std_mult': 2.2034383672881677, 'bull_rsi_os': 13, 'bull_rsi_ob': 48, 'bull_adx_thresh': 14.491727335446853, 'bull_atr_min_pct': 0.02042637576967969, 'bull_atr_max_pct': 0.010011805593797218, 'bull_tp_mult': 1.7542835541639559, 'bull_tsl_mult': 0.4554464619001342, 'bull_time_stop': 149, 'bull_use_sma': False, 'bull_use_ema': True, 'bull_use_atr': True, 'bull_use_adx': True, 'bull_use_spike': False, 'bull_rsi_required': False, 'bear_strategy': 'breakout', 'bear_bb_std_mult': 2.4748248512740223, 'bear_rsi_os': 35, 'bear_rsi_ob': 59, 'bear_adx_thresh': 6.402058166404826, 'bear_atr_min_pct': 0.000751932576992571, 'bear_atr_max_pct': 0.1082183333584239, 'bear_tp_mult': 2.195731071068933, 'bear_tsl_mult': 0.9196977323092532, 'bear_time_stop': 273, 'bear_use_sma': False, 'bear_use_ema': True, 'bear_use_atr': True, 'bear_use_adx': False, 'bear_use_spike': True, 'bear_rsi_required': True, 'sideways_strategy': 'mean_reversion', 'sideways_bb_std_mult': 1.2355433240277711, 'sideways_rsi_os': 30, 'sideways_rsi_ob': 90, 'sideways_adx_thresh': 32.5522975159147, 'sideways_atr_min_pct': 0.0013525270331696333, 'sideways_atr_max_pct': 0.10571391631019307, 'sideways_tp_mult': 1.4135674271193117, 'sideways_tsl_mult': 0.8578003090663251, 'sideways_time_stop': 117, 'sideways_use_sma': False, 'sideways_use_ema': True, 'sideways_use_atr': False, 'sideways_use_adx': False, 'sideways_use_spike': True, 'sideways_rsi_required': True}.
