[I 2025-09-01 15:01:03,181] Trial 641 finished with values: [-1000000000.0, 1000000000.0] and parameters: {'p_sma': 28, 'p_std': 27, 'p_atr': 28, 'p_adx': 8, 'rsi_period': 79, 'ema1': 8, 'ema2': 57, 'slip_atr_k': 0.24056270503025054, 'slip_spread_k': 0.2817947422591008, 'spread_hl_frac': 0.009040620427814642, 'bb_std_mult': 3.464047962426724, 'rsi_os': 44, 'rsi_ob': 53, 'vol_spike': 0.11497533822792547, 'adx_thresh': 6.172021884816539, 'atr_min_pct': 0.009547587983994386, 'atr_max_pct': 0.05101461001368534, 'tp_mult': 1.3204593123637554, 'tsl_mult': 0.8183606369059554, 'strategy': 'mean_reversion', 'time_stop': 107, 'use_sma': True, 'use_atr': False, 'use_adx': True, 'use_ema': True, 'use_spike': True, 'rsi_required': True, 'edge_k': 0.21633532509045678, 'edge_cap': 0.6538296076930682, 'bull_strategy': 'breakout', 'bull_bb_std_mult': 2.907277787146687, 'bull_rsi_os': 16, 'bull_rsi_ob': 81, 'bull_adx_thresh': 9.516201319619633, 'bull_atr_min_pct': 0.02348944800034345, 'bull_atr_max_pct': 0.13155465009231998, 'bull_tp_mult': 2.310977780944625, 'bull_tsl_mult': 0.5016320820731653, 'bull_time_stop': 152, 'bull_use_sma': False, 'bull_use_ema': True, 'bull_use_atr': True, 'bull_use_adx': True, 'bull_use_spike': False, 'bull_rsi_required': True, 'bear_strategy': 'mean_reversion', 'bear_bb_std_mult': 2.4944988094015215, 'bear_rsi_os': 34, 'bear_rsi_ob': 83, 'bear_adx_thresh': 16.088209290004727, 'bear_atr_min_pct': 0.023950827158069864, 'bear_atr_max_pct': 0.11101087516476844, 'bear_tp_mult': 1.9703456614192543, 'bear_tsl_mult': 0.8618531135177674, 'bear_time_stop': 80, 'bear_use_sma': False, 'bear_use_ema': False, 'bear_use_atr': False, 'bear_use_adx': True, 'bear_use_spike': True, 'bear_rsi_required': True, 'sideways_strategy': 'mean_reversion', 'sideways_bb_std_mult': 3.0625704778347966, 'sideways_rsi_os': 32, 'sideways_rsi_ob': 73, 'sideways_adx_thresh': 26.806342883657816, 'sideways_atr_min_pct': 0.02929738083961054, 'sideways_atr_max_pct': 0.10968195787523169, 'sideways_tp_mult': 2.373006510389847, 'sideways_tsl_mult': 0.47078532663381967, 'sideways_time_stop': 250, 'sideways_use_sma': True, 'sideways_use_ema': True, 'sideways_use_atr': True, 'sideways_use_adx': True, 'sideways_use_spike': False, 'sideways_rsi_required': True}.
[I 2025-09-01 15:01:03,900] Trial 642 finished with values: [-1000000000.0, 1000000000.0] and parameters: {'p_sma': 28, 'p_std': 24, 'p_atr': 11, 'p_adx': 8, 'rsi_period': 79, 'ema1': 8, 'ema2': 57, 'slip_atr_k': 0.023782413360729678, 'slip_spread_k': 0.5504385788227006, 'spread_hl_frac': 0.04997907033585278, 'bb_std_mult': 3.4616505605287884, 'rsi_os': 43, 'rsi_ob': 66, 'vol_spike': 0.17339622092527043, 'adx_thresh': 6.148134851998604, 'atr_min_pct': 0.0066864183666588296, 'atr_max_pct': 0.05091179858044422, 'tp_mult': 1.3262345759327843, 'tsl_mult': 0.6420632668052788, 'strategy': 'breakout', 'time_stop': 116, 'use_sma': True, 'use_atr': False, 'use_adx': True, 'use_ema': True, 'use_spike': True, 'rsi_required': True, 'edge_k': 1.6282044050655964, 'edge_cap': 0.18314142338947204, 'bull_strategy': 'breakout', 'bull_bb_std_mult': 3.195796959790509, 'bull_rsi_os': 44, 'bull_rsi_ob': 76, 'bull_adx_thresh': 9.327030492475906, 'bull_atr_min_pct': 0.011419482564852396, 'bull_atr_max_pct': 0.13132686726413376, 'bull_tp_mult': 1.6016932607248897, 'bull_tsl_mult': 0.5635161368641901, 'bull_time_stop': 154, 'bull_use_sma': False, 'bull_use_ema': True, 'bull_use_atr': True, 'bull_use_adx': True, 'bull_use_spike': False, 'bull_rsi_required': True, 'bear_strategy': 'breakout', 'bear_bb_std_mult': 2.4947201157158014, 'bear_rsi_os': 34, 'bear_rsi_ob': 84, 'bear_adx_thresh': 21.27139811871588, 'bear_atr_min_pct': 0.02383272516405449, 'bear_atr_max_pct': 0.11214478320147865, 'bear_tp_mult': 2.273230528329184, 'bear_tsl_mult': 0.12256759944446642, 'bear_time_stop': 167, 'bear_use_sma': False, 'bear_use_ema': False, 'bear_use_atr': True, 'bear_use_adx': True, 'bear_use_spike': True, 'bear_rsi_required': True, 'sideways_strategy': 'mean_reversion', 'sideways_bb_std_mult': 3.056885765813102, 'sideways_rsi_os': 31, 'sideways_rsi_ob': 90, 'sideways_adx_thresh': 27.555995724625355, 'sideways_atr_min_pct': 0.0002542831385796227, 'sideways_atr_max_pct': 0.11037162043824972, 'sideways_tp_mult': 2.5629166413922175, 'sideways_tsl_mult': 0.3632503776557901, 'sideways_time_stop': 277, 'sideways_use_sma': True, 'sideways_use_ema': True, 'sideways_use_atr': True, 'sideways_use_adx': True, 'sideways_use_spike': False, 'sideways_rsi_required': True}.
[I 2025-09-01 15:01:04,575] Trial 639 finished with values: [-1000000000.0, 1000000000.0] and parameters: {'p_sma': 30, 'p_std': 29, 'p_atr': 25, 'p_adx': 24, 'rsi_period': 79, 'ema1': 18, 'ema2': 22, 'slip_atr_k': 0.00011152815609676014, 'slip_spread_k': 0.5462449811578379, 'spread_hl_frac': 0.010473901628396782, 'bb_std_mult': 0.612418204062378, 'rsi_os': 13, 'rsi_ob': 93, 'vol_spike': 0.07455905944251452, 'adx_thresh': 33.12642146600851, 'atr_min_pct': 0.009738321203278756, 'atr_max_pct': 0.052696140407756095, 'tp_mult': 1.3294688830889065, 'tsl_mult': 0.6442564041923199, 'strategy': 'mean_reversion', 'time_stop': 107, 'use_sma': True, 'use_atr': False, 'use_adx': True, 'use_ema': True, 'use_spike': False, 'rsi_required': False, 'edge_k': 0.08908095402793426, 'edge_cap': 0.18255180920096026, 'bull_strategy': 'breakout', 'bull_bb_std_mult': 2.8986188813086606, 'bull_rsi_os': 7, 'bull_rsi_ob': 92, 'bull_adx_thresh': 21.425777891546282, 'bull_atr_min_pct': 0.010314919198989745, 'bull_atr_max_pct': 0.06683233095830439, 'bull_tp_mult': 2.3103699336108265, 'bull_tsl_mult': 0.5643072382704111, 'bull_time_stop': 166, 'bull_use_sma': False, 'bull_use_ema': False, 'bull_use_atr': False, 'bull_use_adx': True, 'bull_use_spike': True, 'bull_rsi_required': True, 'bear_strategy': 'mean_reversion', 'bear_bb_std_mult': 2.5262817683186323, 'bear_rsi_os': 47, 'bear_rsi_ob': 64, 'bear_adx_thresh': 33.05905404089944, 'bear_atr_min_pct': 0.0028633124544253964, 'bear_atr_max_pct': 0.1073211609683137, 'bear_tp_mult': 2.033256647457217, 'bear_tsl_mult': 0.12624741771779463, 'bear_time_stop': 37, 'bear_use_sma': True, 'bear_use_ema': True, 'bear_use_atr': False, 'bear_use_adx': False, 'bear_use_spike': False, 'bear_rsi_required': True, 'sideways_strategy': 'breakout', 'sideways_bb_std_mult': 1.36056807262958, 'sideways_rsi_os': 41, 'sideways_rsi_ob': 90, 'sideways_adx_thresh': 32.9685297302061, 'sideways_atr_min_pct': 0.004697371521799854, 'sideways_atr_max_pct': 0.09252166438419024, 'sideways_tp_mult': 2.4794625164583524, 'sideways_tsl_mult': 0.41575883484094517, 'sideways_time_stop': 278, 'sideways_use_sma': False, 'sideways_use_ema': True, 'sideways_use_atr': True, 'sideways_use_adx': False, 'sideways_use_spike': True, 'sideways_rsi_required': False}.
[I 2025-09-01 15:01:04,587] Trial 640 finished with values: [-0.0595167517162567, 0.059379282245430924] and parameters: {'p_sma': 28, 'p_std': 27, 'p_atr': 11, 'p_adx': 8, 'rsi_period': 72, 'ema1': 25, 'ema2': 57, 'slip_atr_k': 0.02363623137685554, 'slip_spread_k': 0.5461487508388803, 'spread_hl_frac': 0.009170959015392612, 'bb_std_mult': 3.395451753291355, 'rsi_os': 43, 'rsi_ob': 66, 'vol_spike': 0.02589494635447953, 'adx_thresh': 33.802156755412376, 'atr_min_pct': 0.010078773514942201, 'atr_max_pct': 0.08750021778473886, 'tp_mult': 2.7200937487986887, 'tsl_mult': 0.6403278609341518, 'strategy': 'mean_reversion', 'time_stop': 108, 'use_sma': True, 'use_atr': False, 'use_adx': True, 'use_ema': True, 'use_spike': False, 'rsi_required': True, 'edge_k': 1.8045163249157783, 'edge_cap': 0.9682906453353639, 'bull_strategy': 'breakout', 'bull_bb_std_mult': 1.1181721488750456, 'bull_rsi_os': 16, 'bull_rsi_ob': 77, 'bull_adx_thresh': 21.00504715901282, 'bull_atr_min_pct': 0.003961960976157102, 'bull_atr_max_pct': 0.12539429755479695, 'bull_tp_mult': 1.6974006016267527, 'bull_tsl_mult': 0.49224661670647313, 'bull_time_stop': 185, 'bull_use_sma': False, 'bull_use_ema': False, 'bull_use_atr': False, 'bull_use_adx': True, 'bull_use_spike': True, 'bull_rsi_required': True, 'bear_strategy': 'mean_reversion', 'bear_bb_std_mult': 2.4945170731489346, 'bear_rsi_os': 48, 'bear_rsi_ob': 83, 'bear_adx_thresh': 7.775631598568161, 'bear_atr_min_pct': 0.002800422624102656, 'bear_atr_max_pct': 0.06068426945372907, 'bear_tp_mult': 1.9478096611709879, 'bear_tsl_mult': 0.26269812424698097, 'bear_time_stop': 92, 'bear_use_sma': True, 'bear_use_ema': False, 'bear_use_atr': False, 'bear_use_adx': True, 'bear_use_spike': True, 'bear_rsi_required': True, 'sideways_strategy': 'breakout', 'sideways_bb_std_mult': 1.4089731652383857, 'sideways_rsi_os': 31, 'sideways_rsi_ob': 94, 'sideways_adx_thresh': 27.485588928303372, 'sideways_atr_min_pct': 0.02549845916343414, 'sideways_atr_max_pct': 0.11016071510207684, 'sideways_tp_mult': 2.484849270963472, 'sideways_tsl_mult': 0.469507649300697, 'sideways_time_stop': 111, 'sideways_use_sma': False, 'sideways_use_ema': True, 'sideways_use_atr': True, 'sideways_use_adx': True, 'sideways_use_spike': False, 'sideways_rsi_required': True}.
[I 2025-09-01 15:01:43,927] Trial 646 finished with values: [-0.012596720096897607, 0.01257481805582244] and parameters: {'p_sma': 29, 'p_std': 28, 'p_atr': 27, 'p_adx': 22, 'rsi_period': 7, 'ema1': 9, 'ema2': 58, 'slip_atr_k': 0.10847377259107156, 'slip_spread_k': 0.8134341443409375, 'spread_hl_frac': 0.04435774087909292, 'bb_std_mult': 2.584036438654307, 'rsi_os': 42, 'rsi_ob': 55, 'vol_spike': 0.0337974244182119, 'adx_thresh': 29.521822208995538, 'atr_min_pct': 0.01194184322938264, 'atr_max_pct': 0.12868574889116796, 'tp_mult': 1.4974205608828224, 'tsl_mult': 0.23365971541083036, 'strategy': 'breakout', 'time_stop': 149, 'use_sma': True, 'use_atr': True, 'use_adx': True, 'use_ema': False, 'use_spike': True, 'rsi_required': True, 'edge_k': 0.14583651508299506, 'edge_cap': 0.9999522512012442, 'bull_strategy': 'breakout', 'bull_bb_std_mult': 3.1846098428431118, 'bull_rsi_os': 39, 'bull_rsi_ob': 75, 'bull_adx_thresh': 7.818644613952934, 'bull_atr_min_pct': 0.00941670838974962, 'bull_atr_max_pct': 0.020259075661298483, 'bull_tp_mult': 2.8600592285855377, 'bull_tsl_mult': 0.4648255917754876, 'bull_time_stop': 175, 'bull_use_sma': True, 'bull_use_ema': True, 'bull_use_atr': True, 'bull_use_adx': False, 'bull_use_spike': True, 'bull_rsi_required': True, 'bear_strategy': 'breakout', 'bear_bb_std_mult': 3.5921326166472785, 'bear_rsi_os': 37, 'bear_rsi_ob': 54, 'bear_adx_thresh': 7.511767310505663, 'bear_atr_min_pct': 0.013035827844209074, 'bear_atr_max_pct': 0.09086913629768195, 'bear_tp_mult': 2.0973025591508203, 'bear_tsl_mult': 0.6320327270809551, 'bear_time_stop': 97, 'bear_use_sma': False, 'bear_use_ema': False, 'bear_use_atr': True, 'bear_use_adx': False, 'bear_use_spike': True, 'bear_rsi_required': False, 'sideways_strategy': 'mean_reversion', 'sideways_bb_std_mult': 3.2009340670392827, 'sideways_rsi_os': 46, 'sideways_rsi_ob': 65, 'sideways_adx_thresh': 21.34536757883329, 'sideways_atr_min_pct': 0.003821376627662717, 'sideways_atr_max_pct': 0.10122341896126857, 'sideways_tp_mult': 2.727545698428011, 'sideways_tsl_mult': 0.39552772475253745, 'sideways_time_stop': 55, 'sideways_use_sma': True, 'sideways_use_ema': False, 'sideways_use_atr': True, 'sideways_use_adx': True, 'sideways_use_spike': False, 'sideways_rsi_required': False}.
[I 2025-09-01 15:01:43,930] Trial 645 finished with values: [-1000000000.0, 1000000000.0] and parameters: {'p_sma': 39, 'p_std': 13, 'p_atr': 27, 'p_adx': 22, 'rsi_period': 83, 'ema1': 13, 'ema2': 60, 'slip_atr_k': 0.008085400083293906, 'slip_spread_k': 0.7596774358573657, 'spread_hl_frac': 0.007850255553184894, 'bb_std_mult': 1.6543859105384031, 'rsi_os': 34, 'rsi_ob': 55, 'vol_spike': 0.1351716018348142, 'adx_thresh': 5.635144980772873, 'atr_min_pct': 0.0011940719679954682, 'atr_max_pct': 0.1292222078563982, 'tp_mult': 2.200033538645971, 'tsl_mult': 0.723140141928346, 'strategy': 'mean_reversion', 'time_stop': 149, 'use_sma': True, 'use_atr': True, 'use_adx': True, 'use_ema': True, 'use_spike': True, 'rsi_required': True, 'edge_k': 0.5251041511276912, 'edge_cap': 0.4557238465384938, 'bull_strategy': 'breakout', 'bull_bb_std_mult': 0.9345304780125872, 'bull_rsi_os': 13, 'bull_rsi_ob': 77, 'bull_adx_thresh': 12.161720064495523, 'bull_atr_min_pct': 0.009255633706194784, 'bull_atr_max_pct': 0.019449285113112058, 'bull_tp_mult': 1.6917548362084387, 'bull_tsl_mult': 0.4798226412778845, 'bull_time_stop': 175, 'bull_use_sma': True, 'bull_use_ema': True, 'bull_use_atr': True, 'bull_use_adx': False, 'bull_use_spike': True, 'bull_rsi_required': True, 'bear_strategy': 'mean_reversion', 'bear_bb_std_mult': 2.75632608428083, 'bear_rsi_os': 25, 'bear_rsi_ob': 56, 'bear_adx_thresh': 7.512796749789782, 'bear_atr_min_pct': 0.0023904307927687194, 'bear_atr_max_pct': 0.06072270887384653, 'bear_tp_mult': 2.078409758890883, 'bear_tsl_mult': 0.887649922870864, 'bear_time_stop': 94, 'bear_use_sma': False, 'bear_use_ema': False, 'bear_use_atr': False, 'bear_use_adx': False, 'bear_use_spike': True, 'bear_rsi_required': False, 'sideways_strategy': 'mean_reversion', 'sideways_bb_std_mult': 3.1579628296441227, 'sideways_rsi_os': 27, 'sideways_rsi_ob': 94, 'sideways_adx_thresh': 31.793106612412025, 'sideways_atr_min_pct': 0.007480897714386951, 'sideways_atr_max_pct': 0.031082627532166493, 'sideways_tp_mult': 2.7228068310467997, 'sideways_tsl_mult': 0.049884764522739045, 'sideways_time_stop': 55, 'sideways_use_sma': True, 'sideways_use_ema': False, 'sideways_use_atr': True, 'sideways_use_adx': True, 'sideways_use_spike': False, 'sideways_rsi_required': False}.
[I 2025-09-01 15:01:44,717] Trial 643 finished with values: [-0.14025437910849892, 0.14019564510879173] and parameters: {'p_sma': 42, 'p_std': 54, 'p_atr': 27, 'p_adx': 8, 'rsi_period': 82, 'ema1': 18, 'ema2': 58, 'slip_atr_k': 0.0033779018806175034, 'slip_spread_k': 0.4179649388946073, 'spread_hl_frac': 0.010387154681808843, 'bb_std_mult': 2.9462285217995765, 'rsi_os': 43, 'rsi_ob': 90, 'vol_spike': 0.07520580317923493, 'adx_thresh': 11.415117712999393, 'atr_min_pct': 0.012931179796925693, 'atr_max_pct': 0.12838194294095828, 'tp_mult': 1.8804730624046808, 'tsl_mult': 0.6495386747166337, 'strategy': 'breakout', 'time_stop': 117, 'use_sma': True, 'use_atr': False, 'use_adx': True, 'use_ema': True, 'use_spike': True, 'rsi_required': True, 'edge_k': 0.08246611687868298, 'edge_cap': 0.9658841763266853, 'bull_strategy': 'breakout', 'bull_bb_std_mult': 1.1350217211563747, 'bull_rsi_os': 13, 'bull_rsi_ob': 76, 'bull_adx_thresh': 21.24554823154157, 'bull_atr_min_pct': 0.011368535252791523, 'bull_atr_max_pct': 0.1245364760439964, 'bull_tp_mult': 1.6914152042924815, 'bull_tsl_mult': 0.9438471901430958, 'bull_time_stop': 155, 'bull_use_sma': True, 'bull_use_ema': True, 'bull_use_atr': True, 'bull_use_adx': True, 'bull_use_spike': True, 'bull_rsi_required': True, 'bear_strategy': 'breakout', 'bear_bb_std_mult': 1.160336069686445, 'bear_rsi_os': 34, 'bear_rsi_ob': 56, 'bear_adx_thresh': 7.865587749424394, 'bear_atr_min_pct': 0.016996326458931666, 'bear_atr_max_pct': 0.11293083113365644, 'bear_tp_mult': 2.077500993468236, 'bear_tsl_mult': 0.12357601192518947, 'bear_time_stop': 92, 'bear_use_sma': True, 'bear_use_ema': False, 'bear_use_atr': True, 'bear_use_adx': False, 'bear_use_spike': True, 'bear_rsi_required': True, 'sideways_strategy': 'mean_reversion', 'sideways_bb_std_mult': 2.8735715272802307, 'sideways_rsi_os': 46, 'sideways_rsi_ob': 56, 'sideways_adx_thresh': 31.701383192552754, 'sideways_atr_min_pct': 0.00044458685535979543, 'sideways_atr_max_pct': 0.1097106023878592, 'sideways_tp_mult': 1.4118019868764131, 'sideways_tsl_mult': 0.3687604394845613, 'sideways_time_stop': 262, 'sideways_use_sma': True, 'sideways_use_ema': False, 'sideways_use_atr': True, 'sideways_use_adx': True, 'sideways_use_spike': False, 'sideways_rsi_required': False}.
[I 2025-09-01 15:01:44,727] Trial 644 finished with values: [-0.08209868267737397, 0.08197454265302045] and parameters: {'p_sma': 29, 'p_std': 28, 'p_atr': 12, 'p_adx': 7, 'rsi_period': 7, 'ema1': 9, 'ema2': 21, 'slip_atr_k': 9.160438522038371e-05, 'slip_spread_k': 0.41458375868105213, 'spread_hl_frac': 0.008006312493558638, 'bb_std_mult': 2.9095389451868536, 'rsi_os': 34, 'rsi_ob': 91, 'vol_spike': 0.07525662689332871, 'adx_thresh': 29.47620679436396, 'atr_min_pct': 0.026334606994146997, 'atr_max_pct': 0.12989290682475987, 'tp_mult': 1.8429717824595508, 'tsl_mult': 0.723085800296885, 'strategy': 'mean_reversion', 'time_stop': 221, 'use_sma': True, 'use_atr': True, 'use_adx': True, 'use_ema': True, 'use_spike': False, 'rsi_required': True, 'edge_k': 0.07292480861972475, 'edge_cap': 0.3495253685943556, 'bull_strategy': 'breakout', 'bull_bb_std_mult': 3.3152804763683053, 'bull_rsi_os': 5, 'bull_rsi_ob': 77, 'bull_adx_thresh': 21.45326970827969, 'bull_atr_min_pct': 0.004287115383245168, 'bull_atr_max_pct': 0.09675882056568483, 'bull_tp_mult': 2.863095804545395, 'bull_tsl_mult': 0.8899174306527662, 'bull_time_stop': 175, 'bull_use_sma': True, 'bull_use_ema': True, 'bull_use_atr': True, 'bull_use_adx': False, 'bull_use_spike': True, 'bull_rsi_required': True, 'bear_strategy': 'mean_reversion', 'bear_bb_std_mult': 2.1259963281442023, 'bear_rsi_os': 37, 'bear_rsi_ob': 56, 'bear_adx_thresh': 5.936490786410577, 'bear_atr_min_pct': 0.0027027056403567122, 'bear_atr_max_pct': 0.04872262182141776, 'bear_tp_mult': 2.090735120598266, 'bear_tsl_mult': 0.2685869010841116, 'bear_time_stop': 92, 'bear_use_sma': True, 'bear_use_ema': False, 'bear_use_atr': False, 'bear_use_adx': False, 'bear_use_spike': True, 'bear_rsi_required': False, 'sideways_strategy': 'mean_reversion', 'sideways_bb_std_mult': 3.137561999265075, 'sideways_rsi_os': 41, 'sideways_rsi_ob': 66, 'sideways_adx_thresh': 23.5293787550763, 'sideways_atr_min_pct': 0.002292371042734674, 'sideways_atr_max_pct': 0.12252564909241608, 'sideways_tp_mult': 2.492153125804993, 'sideways_tsl_mult': 0.40243207188522817, 'sideways_time_stop': 263, 'sideways_use_sma': True, 'sideways_use_ema': False, 'sideways_use_atr': True, 'sideways_use_adx': True, 'sideways_use_spike': False, 'sideways_rsi_required': False}.
[I 2025-09-01 15:01:45,718] Trial 648 finished with values: [-1000000000.0, 1000000000.0] and parameters: {'p_sma': 15, 'p_std': 25, 'p_atr': 10, 'p_adx': 7, 'rsi_period': 10, 'ema1': 9, 'ema2': 55, 'slip_atr_k': 0.01721061715354022, 'slip_spread_k': 0.5929632283831764, 'spread_hl_frac': 0.024791022636292574, 'bb_std_mult': 3.50934190418372, 'rsi_os': 44, 'rsi_ob': 46, 'vol_spike': 0.1619620947382515, 'adx_thresh': 11.908278967928805, 'atr_min_pct': 0.026369819939928225, 'atr_max_pct': 0.03371018473623494, 'tp_mult': 1.7156197518419372, 'tsl_mult': 0.7136037962305223, 'strategy': 'mean_reversion', 'time_stop': 116, 'use_sma': True, 'use_atr': False, 'use_adx': True, 'use_ema': True, 'use_spike': True, 'rsi_required': True, 'edge_k': 1.1007501440833278, 'edge_cap': 0.31365451552076684, 'bull_strategy': 'mean_reversion', 'bull_bb_std_mult': 3.30177092172939, 'bull_rsi_os': 12, 'bull_rsi_ob': 79, 'bull_adx_thresh': 33.166906784309795, 'bull_atr_min_pct': 0.01987229891930785, 'bull_atr_max_pct': 0.12567709500267119, 'bull_tp_mult': 1.5245579543971832, 'bull_tsl_mult': 0.9748994212419142, 'bull_time_stop': 155, 'bull_use_sma': False, 'bull_use_ema': True, 'bull_use_atr': True, 'bull_use_adx': True, 'bull_use_spike': True, 'bull_rsi_required': False, 'bear_strategy': 'mean_reversion', 'bear_bb_std_mult': 2.403961885842749, 'bear_rsi_os': 35, 'bear_rsi_ob': 56, 'bear_adx_thresh': 18.752222840041785, 'bear_atr_min_pct': 0.028018294012555085, 'bear_atr_max_pct': 0.04703053451501136, 'bear_tp_mult': 2.135127083923372, 'bear_tsl_mult': 0.16283297982147432, 'bear_time_stop': 108, 'bear_use_sma': False, 'bear_use_ema': False, 'bear_use_atr': False, 'bear_use_adx': False, 'bear_use_spike': True, 'bear_rsi_required': False, 'sideways_strategy': 'mean_reversion', 'sideways_bb_std_mult': 2.159839339071629, 'sideways_rsi_os': 33, 'sideways_rsi_ob': 88, 'sideways_adx_thresh': 16.609027466273513, 'sideways_atr_min_pct': 0.027576161123269684, 'sideways_atr_max_pct': 0.12290294995892256, 'sideways_tp_mult': 1.404348587722597, 'sideways_tsl_mult': 0.9498924591015223, 'sideways_time_stop': 263, 'sideways_use_sma': True, 'sideways_use_ema': True, 'sideways_use_atr': False, 'sideways_use_adx': True, 'sideways_use_spike': False, 'sideways_rsi_required': False}.
