[I 2025-09-01 13:36:52,069] Trial 62 finished with values: [-0.027271958036357846, 0.027026690664536345] and parameters: {'p_sma': 13, 'p_std': 22, 'p_atr': 11, 'p_adx': 24, 'rsi_period': 42, 'ema1': 9, 'ema2': 49, 'slip_atr_k': 0.009332883809947021, 'slip_spread_k': 0.06520696704252243, 'spread_hl_frac': 0.0023588076642529687, 'bb_std_mult': 2.624080952116821, 'rsi_os': 45, 'rsi_ob': 70, 'vol_spike': 0.08991898746954104, 'adx_thresh': 22.47384597036876, 'atr_min_pct': 0.00860460712368681, 'atr_max_pct': 0.09763011493439352, 'tp_mult': 2.508258006448533, 'tsl_mult': 0.943218841936071, 'strategy': 'breakout', 'time_stop': 96, 'use_sma': True, 'use_atr': True, 'use_adx': False, 'use_ema': False, 'use_spike': True, 'rsi_required': False, 'edge_k': 1.3888987600965228, 'edge_cap': 0.11566735681615856, 'bull_strategy': 'mean_reversion', 'bull_bb_std_mult': 1.1458111811247589, 'bull_rsi_os': 31, 'bull_rsi_ob': 90, 'bull_adx_thresh': 20.48728852912235, 'bull_atr_min_pct': 0.02806693544637903, 'bull_atr_max_pct': 0.11670061382102703, 'bull_tp_mult': 1.2824797121721931, 'bull_tsl_mult': 0.24055182107482914, 'bull_time_stop': 136, 'bull_use_sma': True, 'bull_use_ema': True, 'bull_use_atr': False, 'bull_use_adx': True, 'bull_use_spike': True, 'bull_rsi_required': False, 'bear_strategy': 'breakout', 'bear_bb_std_mult': 2.771292130079147, 'bear_rsi_os': 5, 'bear_rsi_ob': 57, 'bear_adx_thresh': 14.30985535900457, 'bear_atr_min_pct': 0.00029584197185335975, 'bear_atr_max_pct': 0.06552420776529815, 'bear_tp_mult': 1.6072953544438526, 'bear_tsl_mult': 0.14784254373546074, 'bear_time_stop': 130, 'bear_use_sma': False, 'bear_use_ema': True, 'bear_use_atr': False, 'bear_use_adx': True, 'bear_use_spike': False, 'bear_rsi_required': True, 'sideways_strategy': 'breakout', 'sideways_bb_std_mult': 1.4315862680572804, 'sideways_rsi_os': 36, 'sideways_rsi_ob': 58, 'sideways_adx_thresh': 32.64802600144512, 'sideways_atr_min_pct': 0.014366371701174222, 'sideways_atr_max_pct': 0.06561097037366247, 'sideways_tp_mult': 2.6397940863533504, 'sideways_tsl_mult': 0.5140506969324238, 'sideways_time_stop': 151, 'sideways_use_sma': True, 'sideways_use_ema': True, 'sideways_use_atr': False, 'sideways_use_adx': True, 'sideways_use_spike': False, 'sideways_rsi_required': False}.
[I 2025-09-01 13:36:52,406] Trial 64 finished with values: [-1000000000.0, 1000000000.0] and parameters: {'p_sma': 13, 'p_std': 23, 'p_atr': 16, 'p_adx': 27, 'rsi_period': 72, 'ema1': 9, 'ema2': 26, 'slip_atr_k': 0.0109702703905159, 'slip_spread_k': 0.06251618119566038, 'spread_hl_frac': 0.001386271930094411, 'bb_std_mult': 2.650196622254758, 'rsi_os': 41, 'rsi_ob': 74, 'vol_spike': 0.0247441623966885, 'adx_thresh': 23.009737948858824, 'atr_min_pct': 0.017369230035401438, 'atr_max_pct': 0.05870573033522363, 'tp_mult': 1.5371226500238628, 'tsl_mult': 0.2146848871809445, 'strategy': 'breakout', 'time_stop': 96, 'use_sma': True, 'use_atr': True, 'use_adx': False, 'use_ema': False, 'use_spike': True, 'rsi_required': False, 'edge_k': 1.2373912577460715, 'edge_cap': 0.10640546999762318, 'bull_strategy': 'mean_reversion', 'bull_bb_std_mult': 1.145120783797105, 'bull_rsi_os': 14, 'bull_rsi_ob': 47, 'bull_adx_thresh': 20.415281373264037, 'bull_atr_min_pct': 0.018216149691816085, 'bull_atr_max_pct': 0.11360511276181232, 'bull_tp_mult': 1.2690501692660854, 'bull_tsl_mult': 0.24612167939358426, 'bull_time_stop': 128, 'bull_use_sma': True, 'bull_use_ema': True, 'bull_use_atr': False, 'bull_use_adx': True, 'bull_use_spike': True, 'bull_rsi_required': False, 'bear_strategy': 'breakout', 'bear_bb_std_mult': 3.208708785408927, 'bear_rsi_os': 54, 'bear_rsi_ob': 58, 'bear_adx_thresh': 16.14747012140523, 'bear_atr_min_pct': 0.010030109313296731, 'bear_atr_max_pct': 0.06364800278263406, 'bear_tp_mult': 1.7607102251252162, 'bear_tsl_mult': 0.14940908406167677, 'bear_time_stop': 135, 'bear_use_sma': False, 'bear_use_ema': True, 'bear_use_atr': False, 'bear_use_adx': True, 'bear_use_spike': False, 'bear_rsi_required': True, 'sideways_strategy': 'breakout', 'sideways_bb_std_mult': 1.8508155521938792, 'sideways_rsi_os': 18, 'sideways_rsi_ob': 72, 'sideways_adx_thresh': 24.1852573716111, 'sideways_atr_min_pct': 0.014440426650799195, 'sideways_atr_max_pct': 0.10568935156126166, 'sideways_tp_mult': 2.666906385359078, 'sideways_tsl_mult': 0.5418916912836701, 'sideways_time_stop': 204, 'sideways_use_sma': True, 'sideways_use_ema': True, 'sideways_use_atr': False, 'sideways_use_adx': True, 'sideways_use_spike': False, 'sideways_rsi_required': False}.
[I 2025-09-01 13:37:32,584] Trial 66 finished with values: [-1000000000.0, 1000000000.0] and parameters: {'p_sma': 16, 'p_std': 18, 'p_atr': 7, 'p_adx': 24, 'rsi_period': 35, 'ema1': 9, 'ema2': 26, 'slip_atr_k': 0.029602398395639717, 'slip_spread_k': 0.5831152485674359, 'spread_hl_frac': 0.025291126322603788, 'bb_std_mult': 2.1358094275796575, 'rsi_os': 45, 'rsi_ob': 76, 'vol_spike': 0.12120439922499823, 'adx_thresh': 24.75949217086658, 'atr_min_pct': 0.019466369123270846, 'atr_max_pct': 0.1472002130925448, 'tp_mult': 2.0780543828018168, 'tsl_mult': 0.12155800064005168, 'strategy': 'breakout', 'time_stop': 95, 'use_sma': False, 'use_atr': True, 'use_adx': False, 'use_ema': False, 'use_spike': False, 'rsi_required': False, 'edge_k': 1.250463662137555, 'edge_cap': 0.2058334819691629, 'bull_strategy': 'breakout', 'bull_bb_std_mult': 1.3526430334875752, 'bull_rsi_os': 10, 'bull_rsi_ob': 91, 'bull_adx_thresh': 12.549053975685808, 'bull_atr_min_pct': 0.02420641281127095, 'bull_atr_max_pct': 0.13042992784132496, 'bull_tp_mult': 2.6575431779776024, 'bull_tsl_mult': 0.7807147732469832, 'bull_time_stop': 166, 'bull_use_sma': False, 'bull_use_ema': True, 'bull_use_atr': True, 'bull_use_adx': True, 'bull_use_spike': False, 'bull_rsi_required': False, 'bear_strategy': 'breakout', 'bear_bb_std_mult': 0.9782485543529214, 'bear_rsi_os': 20, 'bear_rsi_ob': 55, 'bear_adx_thresh': 16.636691799453867, 'bear_atr_min_pct': 0.014829047072956089, 'bear_atr_max_pct': 0.06499802045167981, 'bear_tp_mult': 1.886925328902947, 'bear_tsl_mult': 0.2932840285888576, 'bear_time_stop': 228, 'bear_use_sma': False, 'bear_use_ema': True, 'bear_use_atr': True, 'bear_use_adx': True, 'bear_use_spike': False, 'bear_rsi_required': True, 'sideways_strategy': 'breakout', 'sideways_bb_std_mult': 0.7111202434131862, 'sideways_rsi_os': 19, 'sideways_rsi_ob': 86, 'sideways_adx_thresh': 26.77566875025331, 'sideways_atr_min_pct': 0.018829524541157473, 'sideways_atr_max_pct': 0.10421383478392086, 'sideways_tp_mult': 2.738285567573875, 'sideways_tsl_mult': 0.5325682940283244, 'sideways_time_stop': 274, 'sideways_use_sma': True, 'sideways_use_ema': True, 'sideways_use_atr': True, 'sideways_use_adx': True, 'sideways_use_spike': False, 'sideways_rsi_required': False}.
[I 2025-09-01 13:37:33,194] Trial 67 finished with values: [-1000000000.0, 1000000000.0] and parameters: {'p_sma': 13, 'p_std': 56, 'p_atr': 9, 'p_adx': 24, 'rsi_period': 36, 'ema1': 9, 'ema2': 22, 'slip_atr_k': 0.010197732055255362, 'slip_spread_k': 0.07020590153164918, 'spread_hl_frac': 0.0032770397210430714, 'bb_std_mult': 1.3219620504000544, 'rsi_os': 45, 'rsi_ob': 77, 'vol_spike': 0.08945677190805455, 'adx_thresh': 24.727811666377068, 'atr_min_pct': 0.019232443642154512, 'atr_max_pct': 0.089317867298445, 'tp_mult': 2.0361920768003974, 'tsl_mult': 0.5837551209026088, 'strategy': 'breakout', 'time_stop': 96, 'use_sma': False, 'use_atr': True, 'use_adx': False, 'use_ema': False, 'use_spike': False, 'rsi_required': False, 'edge_k': 1.041897918944105, 'edge_cap': 0.9785639200503125, 'bull_strategy': 'breakout', 'bull_bb_std_mult': 0.8006290432797698, 'bull_rsi_os': 14, 'bull_rsi_ob': 48, 'bull_adx_thresh': 12.507342095165875, 'bull_atr_min_pct': 0.024333688488069938, 'bull_atr_max_pct': 0.13076098747115297, 'bull_tp_mult': 1.572856251434202, 'bull_tsl_mult': 0.77983742728891, 'bull_time_stop': 294, 'bull_use_sma': False, 'bull_use_ema': True, 'bull_use_atr': True, 'bull_use_adx': True, 'bull_use_spike': False, 'bull_rsi_required': False, 'bear_strategy': 'breakout', 'bear_bb_std_mult': 0.9198165716983189, 'bear_rsi_os': 13, 'bear_rsi_ob': 55, 'bear_adx_thresh': 18.24390180845466, 'bear_atr_min_pct': 0.011951833751427807, 'bear_atr_max_pct': 0.06465505398476235, 'bear_tp_mult': 1.8665119592234507, 'bear_tsl_mult': 0.27417610470342935, 'bear_time_stop': 166, 'bear_use_sma': False, 'bear_use_ema': True, 'bear_use_atr': True, 'bear_use_adx': True, 'bear_use_spike': False, 'bear_rsi_required': True, 'sideways_strategy': 'breakout', 'sideways_bb_std_mult': 0.9244410316586872, 'sideways_rsi_os': 18, 'sideways_rsi_ob': 80, 'sideways_adx_thresh': 26.69333864998964, 'sideways_atr_min_pct': 0.01627920904599383, 'sideways_atr_max_pct': 0.10309970092899907, 'sideways_tp_mult': 2.7415944300495902, 'sideways_tsl_mult': 0.6404867532756742, 'sideways_time_stop': 149, 'sideways_use_sma': True, 'sideways_use_ema': True, 'sideways_use_atr': True, 'sideways_use_adx': True, 'sideways_use_spike': False, 'sideways_rsi_required': False}.
[I 2025-09-01 13:37:33,691] Trial 65 finished with values: [-0.05143253426848626, 0.05134470482537102] and parameters: {'p_sma': 42, 'p_std': 58, 'p_atr': 16, 'p_adx': 24, 'rsi_period': 35, 'ema1': 9, 'ema2': 26, 'slip_atr_k': 0.10826663304725836, 'slip_spread_k': 0.5815755671242375, 'spread_hl_frac': 0.026371516587518885, 'bb_std_mult': 2.123005161771545, 'rsi_os': 45, 'rsi_ob': 70, 'vol_spike': 0.024667266931986398, 'adx_thresh': 27.3135808854848, 'atr_min_pct': 0.009781923033377191, 'atr_max_pct': 0.05790657959534903, 'tp_mult': 1.7980969534210067, 'tsl_mult': 0.20760082300440774, 'strategy': 'breakout', 'time_stop': 101, 'use_sma': False, 'use_atr': True, 'use_adx': False, 'use_ema': False, 'use_spike': True, 'rsi_required': False, 'edge_k': 1.266290381128694, 'edge_cap': 0.9968829113315387, 'bull_strategy': 'mean_reversion', 'bull_bb_std_mult': 2.1073382803636194, 'bull_rsi_os': 14, 'bull_rsi_ob': 91, 'bull_adx_thresh': 20.81675081145252, 'bull_atr_min_pct': 0.021450298707431394, 'bull_atr_max_pct': 0.1312719398066062, 'bull_tp_mult': 1.5646586502845254, 'bull_tsl_mult': 0.5325247699949154, 'bull_time_stop': 219, 'bull_use_sma': True, 'bull_use_ema': True, 'bull_use_atr': False, 'bull_use_adx': True, 'bull_use_spike': True, 'bull_rsi_required': False, 'bear_strategy': 'breakout', 'bear_bb_std_mult': 0.9598185075150638, 'bear_rsi_os': 33, 'bear_rsi_ob': 58, 'bear_adx_thresh': 34.89248721118474, 'bear_atr_min_pct': 0.009762719731202834, 'bear_atr_max_pct': 0.0643961180045368, 'bear_tp_mult': 1.611298060014144, 'bear_tsl_mult': 0.28253555291210286, 'bear_time_stop': 169, 'bear_use_sma': False, 'bear_use_ema': True, 'bear_use_atr': True, 'bear_use_adx': True, 'bear_use_spike': False, 'bear_rsi_required': True, 'sideways_strategy': 'breakout', 'sideways_bb_std_mult': 3.5711418179699352, 'sideways_rsi_os': 46, 'sideways_rsi_ob': 49, 'sideways_adx_thresh': 26.374549792764512, 'sideways_atr_min_pct': 0.0019038621192339726, 'sideways_atr_max_pct': 0.03792019907712794, 'sideways_tp_mult': 1.9576320270100662, 'sideways_tsl_mult': 0.5195452437969779, 'sideways_time_stop': 218, 'sideways_use_sma': True, 'sideways_use_ema': True, 'sideways_use_atr': False, 'sideways_use_adx': True, 'sideways_use_spike': False, 'sideways_rsi_required': False}.
[I 2025-09-01 13:37:33,702] Trial 68 finished with values: [-1000000000.0, 1000000000.0] and parameters: {'p_sma': 7, 'p_std': 58, 'p_atr': 7, 'p_adx': 25, 'rsi_period': 35, 'ema1': 8, 'ema2': 21, 'slip_atr_k': 0.032008161374573005, 'slip_spread_k': 0.4165890106382491, 'spread_hl_frac': 0.0025127869905492185, 'bb_std_mult': 0.5249122164708455, 'rsi_os': 46, 'rsi_ob': 77, 'vol_spike': 0.09124127893643372, 'adx_thresh': 21.074253656702464, 'atr_min_pct': 0.019046937412856145, 'atr_max_pct': 0.1477375138566019, 'tp_mult': 1.2899415592057228, 'tsl_mult': 0.5916705033587731, 'strategy': 'breakout', 'time_stop': 118, 'use_sma': False, 'use_atr': True, 'use_adx': False, 'use_ema': False, 'use_spike': False, 'rsi_required': False, 'edge_k': 1.0592622123928308, 'edge_cap': 0.9994424159986603, 'bull_strategy': 'breakout', 'bull_bb_std_mult': 1.377072193296483, 'bull_rsi_os': 9, 'bull_rsi_ob': 81, 'bull_adx_thresh': 7.091711529340373, 'bull_atr_min_pct': 0.024143596933041786, 'bull_atr_max_pct': 0.024980192050527435, 'bull_tp_mult': 2.753759231146114, 'bull_tsl_mult': 0.341708163413924, 'bull_time_stop': 220, 'bull_use_sma': False, 'bull_use_ema': True, 'bull_use_atr': True, 'bull_use_adx': True, 'bull_use_spike': False, 'bull_rsi_required': False, 'bear_strategy': 'mean_reversion', 'bear_bb_std_mult': 3.154636275638206, 'bear_rsi_os': 13, 'bear_rsi_ob': 55, 'bear_adx_thresh': 5.258029569959357, 'bear_atr_min_pct': 0.01473611409983356, 'bear_atr_max_pct': 0.06711567393145398, 'bear_tp_mult': 1.8685939763263142, 'bear_tsl_mult': 0.2892131248047842, 'bear_time_stop': 227, 'bear_use_sma': False, 'bear_use_ema': True, 'bear_use_atr': True, 'bear_use_adx': False, 'bear_use_spike': False, 'bear_rsi_required': True, 'sideways_strategy': 'breakout', 'sideways_bb_std_mult': 0.9374784242703669, 'sideways_rsi_os': 50, 'sideways_rsi_ob': 85, 'sideways_adx_thresh': 26.511092978134542, 'sideways_atr_min_pct': 0.01587004818189519, 'sideways_atr_max_pct': 0.12588508560370507, 'sideways_tp_mult': 2.7284855102074066, 'sideways_tsl_mult': 0.160535931279447, 'sideways_time_stop': 268, 'sideways_use_sma': False, 'sideways_use_ema': True, 'sideways_use_atr': True, 'sideways_use_adx': False, 'sideways_use_spike': False, 'sideways_rsi_required': False}.
[I 2025-09-01 13:38:11,708] Trial 72 finished with values: [-1000000000.0, 1000000000.0] and parameters: {'p_sma': 12, 'p_std': 26, 'p_atr': 9, 'p_adx': 8, 'rsi_period': 60, 'ema1': 13, 'ema2': 59, 'slip_atr_k': 0.23834672640369697, 'slip_spread_k': 0.6295989937809354, 'spread_hl_frac': 0.029616658495164636, 'bb_std_mult': 3.53864358861167, 'rsi_os': 51, 'rsi_ob': 95, 'vol_spike': 0.11432895434811244, 'adx_thresh': 18.336675262532285, 'atr_min_pct': 0.008738905416106408, 'atr_max_pct': 0.029388654163706326, 'tp_mult': 2.472464971306663, 'tsl_mult': 0.6828027173838983, 'strategy': 'breakout', 'time_stop': 60, 'use_sma': True, 'use_atr': False, 'use_adx': False, 'use_ema': False, 'use_spike': True, 'rsi_required': True, 'edge_k': 1.1490165771284184, 'edge_cap': 0.2511975944095556, 'bull_strategy': 'breakout', 'bull_bb_std_mult': 2.7170675841995653, 'bull_rsi_os': 18, 'bull_rsi_ob': 89, 'bull_adx_thresh': 5.209395242121363, 'bull_atr_min_pct': 0.012857166036769802, 'bull_atr_max_pct': 0.12464619491192135, 'bull_tp_mult': 2.2179794851699954, 'bull_tsl_mult': 0.42650936296305353, 'bull_time_stop': 87, 'bull_use_sma': False, 'bull_use_ema': True, 'bull_use_atr': False, 'bull_use_adx': True, 'bull_use_spike': False, 'bull_rsi_required': False, 'bear_strategy': 'mean_reversion', 'bear_bb_std_mult': 3.43699886037472, 'bear_rsi_os': 16, 'bear_rsi_ob': 51, 'bear_adx_thresh': 22.045704687441635, 'bear_atr_min_pct': 0.02287621903670489, 'bear_atr_max_pct': 0.010700947786902351, 'bear_tp_mult': 2.5875390414214428, 'bear_tsl_mult': 0.8136686515463254, 'bear_time_stop': 102, 'bear_use_sma': True, 'bear_use_ema': True, 'bear_use_atr': False, 'bear_use_adx': False, 'bear_use_spike': False, 'bear_rsi_required': False, 'sideways_strategy': 'mean_reversion', 'sideways_bb_std_mult': 1.145856526713616, 'sideways_rsi_os': 44, 'sideways_rsi_ob': 76, 'sideways_adx_thresh': 30.275378533556868, 'sideways_atr_min_pct': 0.012403843268247127, 'sideways_atr_max_pct': 0.047399360371375786, 'sideways_tp_mult': 2.4002033929761235, 'sideways_tsl_mult': 0.7001263733975293, 'sideways_time_stop': 252, 'sideways_use_sma': False, 'sideways_use_ema': True, 'sideways_use_atr': True, 'sideways_use_adx': False, 'sideways_use_spike': False, 'sideways_rsi_required': False}.
[I 2025-09-01 13:38:12,089] Trial 70 finished with values: [-1000000000.0, 1000000000.0] and parameters: {'p_sma': 7, 'p_std': 26, 'p_atr': 7, 'p_adx': 8, 'rsi_period': 84, 'ema1': 21, 'ema2': 21, 'slip_atr_k': 0.0005575208638678303, 'slip_spread_k': 0.6311685296784275, 'spread_hl_frac': 0.009045434389173223, 'bb_std_mult': 0.5182366322351577, 'rsi_os': 32, 'rsi_ob': 70, 'vol_spike': 0.08617518541490879, 'adx_thresh': 21.048238965814175, 'atr_min_pct': 0.024596762709530408, 'atr_max_pct': 0.10007925949865215, 'tp_mult': 2.1578880571174874, 'tsl_mult': 0.04433182920969692, 'strategy': 'breakout', 'time_stop': 60, 'use_sma': True, 'use_atr': False, 'use_adx': False, 'use_ema': False, 'use_spike': True, 'rsi_required': True, 'edge_k': 0.16387830627786992, 'edge_cap': 0.2564221458251253, 'bull_strategy': 'breakout', 'bull_bb_std_mult': 2.1133286074643176, 'bull_rsi_os': 20, 'bull_rsi_ob': 52, 'bull_adx_thresh': 20.967833269406594, 'bull_atr_min_pct': 0.010491453854604229, 'bull_atr_max_pct': 0.12394467793725211, 'bull_tp_mult': 2.153074960730616, 'bull_tsl_mult': 0.4218088019399179, 'bull_time_stop': 82, 'bull_use_sma': False, 'bull_use_ema': True, 'bull_use_atr': False, 'bull_use_adx': True, 'bull_use_spike': False, 'bull_rsi_required': False, 'bear_strategy': 'mean_reversion', 'bear_bb_std_mult': 1.7107534932347135, 'bear_rsi_os': 11, 'bear_rsi_ob': 51, 'bear_adx_thresh': 5.187618564314131, 'bear_atr_min_pct': 0.022989659405998484, 'bear_atr_max_pct': 0.07036521863005206, 'bear_tp_mult': 2.2346654383634332, 'bear_tsl_mult': 0.1827257311565716, 'bear_time_stop': 97, 'bear_use_sma': False, 'bear_use_ema': True, 'bear_use_atr': False, 'bear_use_adx': False, 'bear_use_spike': False, 'bear_rsi_required': True, 'sideways_strategy': 'mean_reversion', 'sideways_bb_std_mult': 1.0523271148855493, 'sideways_rsi_os': 50, 'sideways_rsi_ob': 50, 'sideways_adx_thresh': 9.850152149815548, 'sideways_atr_min_pct': 0.02242497900500234, 'sideways_atr_max_pct': 0.06916813518688933, 'sideways_tp_mult': 2.0171554129381297, 'sideways_tsl_mult': 0.18281177516695457, 'sideways_time_stop': 7, 'sideways_use_sma': False, 'sideways_use_ema': True, 'sideways_use_atr': True, 'sideways_use_adx': False, 'sideways_use_spike': False, 'sideways_rsi_required': False}.
[I 2025-09-01 13:38:12,109] Trial 71 finished with values: [-1000000000.0, 1000000000.0] and parameters: {'p_sma': 11, 'p_std': 26, 'p_atr': 9, 'p_adx': 17, 'rsi_period': 60, 'ema1': 13, 'ema2': 14, 'slip_atr_k': 0.0718741079050061, 'slip_spread_k': 0.4802407858781187, 'spread_hl_frac': 0.030068184604240288, 'bb_std_mult': 1.95947981364786, 'rsi_os': 31, 'rsi_ob': 87, 'vol_spike': 0.11249348429080905, 'adx_thresh': 18.461315193751453, 'atr_min_pct': 0.024819404640044458, 'atr_max_pct': 0.029779934270861855, 'tp_mult': 2.5375089103878734, 'tsl_mult': 0.04343873002217056, 'strategy': 'breakout', 'time_stop': 61, 'use_sma': True, 'use_atr': False, 'use_adx': False, 'use_ema': False, 'use_spike': True, 'rsi_required': True, 'edge_k': 1.126737631660304, 'edge_cap': 0.18767755544341025, 'bull_strategy': 'breakout', 'bull_bb_std_mult': 3.157149979503896, 'bull_rsi_os': 18, 'bull_rsi_ob': 52, 'bull_adx_thresh': 15.583152475275583, 'bull_atr_min_pct': 0.01276341718555202, 'bull_atr_max_pct': 0.12132830617472094, 'bull_tp_mult': 1.645555182477981, 'bull_tsl_mult': 0.42252407299320505, 'bull_time_stop': 79, 'bull_use_sma': False, 'bull_use_ema': True, 'bull_use_atr': False, 'bull_use_adx': True, 'bull_use_spike': False, 'bull_rsi_required': False, 'bear_strategy': 'mean_reversion', 'bear_bb_std_mult': 3.441503798678453, 'bear_rsi_os': 11, 'bear_rsi_ob': 68, 'bear_adx_thresh': 21.450305037449674, 'bear_atr_min_pct': 0.02793291225192654, 'bear_atr_max_pct': 0.010390777490703496, 'bear_tp_mult': 2.2757343631666793, 'bear_tsl_mult': 0.7555450983073477, 'bear_time_stop': 60, 'bear_use_sma': True, 'bear_use_ema': True, 'bear_use_atr': False, 'bear_use_adx': False, 'bear_use_spike': False, 'bear_rsi_required': False, 'sideways_strategy': 'mean_reversion', 'sideways_bb_std_mult': 1.1079240963997026, 'sideways_rsi_os': 44, 'sideways_rsi_ob': 64, 'sideways_adx_thresh': 34.94762734411596, 'sideways_atr_min_pct': 0.0228560190292173, 'sideways_atr_max_pct': 0.04526422115340164, 'sideways_tp_mult': 1.7479443574642046, 'sideways_tsl_mult': 0.1977538958482522, 'sideways_time_stop': 252, 'sideways_use_sma': False, 'sideways_use_ema': True, 'sideways_use_atr': True, 'sideways_use_adx': False, 'sideways_use_spike': False, 'sideways_rsi_required': False}.
