[I 2025-09-01 13:58:44,786] Trial 217 finished with values: [-0.0023406532486031084, 0.005496202143055848] and parameters: {'p_sma': 33, 'p_std': 25, 'p_atr': 18, 'p_adx': 17, 'rsi_period': 63, 'ema1': 8, 'ema2': 29, 'slip_atr_k': 0.005281938378440466, 'slip_spread_k': 0.991252132289393, 'spread_hl_frac': 0.00641039590328419, 'bb_std_mult': 1.4086095242425567, 'rsi_os': 45, 'rsi_ob': 75, 'vol_spike': 0.09111947783589136, 'adx_thresh': 11.221403123495856, 'atr_min_pct': 0.016613183857886037, 'atr_max_pct': 0.021672651494989703, 'tp_mult': 2.0068124742512805, 'tsl_mult': 0.10669712343115373, 'strategy': 'breakout', 'time_stop': 263, 'use_sma': True, 'use_atr': True, 'use_adx': False, 'use_ema': False, 'use_spike': True, 'rsi_required': False, 'edge_k': 1.343091900026878, 'edge_cap': 0.8666218364658167, 'bull_strategy': 'breakout', 'bull_bb_std_mult': 1.3075462709625705, 'bull_rsi_os': 19, 'bull_rsi_ob': 87, 'bull_adx_thresh': 30.487246104178006, 'bull_atr_min_pct': 0.009624957210120551, 'bull_atr_max_pct': 0.10092542938050839, 'bull_tp_mult': 2.8539076721217094, 'bull_tsl_mult': 0.6169548307237523, 'bull_time_stop': 110, 'bull_use_sma': False, 'bull_use_ema': True, 'bull_use_atr': False, 'bull_use_adx': False, 'bull_use_spike': False, 'bull_rsi_required': True, 'bear_strategy': 'breakout', 'bear_bb_std_mult': 2.345597851909846, 'bear_rsi_os': 16, 'bear_rsi_ob': 51, 'bear_adx_thresh': 22.969934670170424, 'bear_atr_min_pct': 0.004020431657200903, 'bear_atr_max_pct': 0.06223164277115962, 'bear_tp_mult': 1.8719095606905256, 'bear_tsl_mult': 0.9671828359607288, 'bear_time_stop': 60, 'bear_use_sma': True, 'bear_use_ema': True, 'bear_use_atr': False, 'bear_use_adx': False, 'bear_use_spike': False, 'bear_rsi_required': False, 'sideways_strategy': 'breakout', 'sideways_bb_std_mult': 0.7764316843294129, 'sideways_rsi_os': 36, 'sideways_rsi_ob': 85, 'sideways_adx_thresh': 28.058634114839172, 'sideways_atr_min_pct': 0.024500086584685863, 'sideways_atr_max_pct': 0.08126613933916095, 'sideways_tp_mult': 2.6252609743746826, 'sideways_tsl_mult': 0.7805992320283246, 'sideways_time_stop': 245, 'sideways_use_sma': True, 'sideways_use_ema': False, 'sideways_use_atr': True, 'sideways_use_adx': False, 'sideways_use_spike': False, 'sideways_rsi_required': False}.
[I 2025-09-01 13:58:44,989] Trial 215 finished with values: [-1000000000.0, 1000000000.0] and parameters: {'p_sma': 25, 'p_std': 55, 'p_atr': 8, 'p_adx': 27, 'rsi_period': 44, 'ema1': 8, 'ema2': 29, 'slip_atr_k': 0.19765911302015898, 'slip_spread_k': 0.9886557454222887, 'spread_hl_frac': 0.027751661600629276, 'bb_std_mult': 1.961000073581624, 'rsi_os': 42, 'rsi_ob': 75, 'vol_spike': 0.16190443469878943, 'adx_thresh': 22.913956567531905, 'atr_min_pct': 0.01769158743215885, 'atr_max_pct': 0.09958642515738615, 'tp_mult': 2.0016863778302714, 'tsl_mult': 0.07411672303612843, 'strategy': 'breakout', 'time_stop': 173, 'use_sma': True, 'use_atr': True, 'use_adx': False, 'use_ema': False, 'use_spike': False, 'rsi_required': False, 'edge_k': 0.00913009261340525, 'edge_cap': 0.2573779709740783, 'bull_strategy': 'breakout', 'bull_bb_std_mult': 2.629572824201798, 'bull_rsi_os': 18, 'bull_rsi_ob': 52, 'bull_adx_thresh': 9.994048557949686, 'bull_atr_min_pct': 0.009512097635517705, 'bull_atr_max_pct': 0.061582219481386, 'bull_tp_mult': 2.852385064737449, 'bull_tsl_mult': 0.6179666632778754, 'bull_time_stop': 46, 'bull_use_sma': False, 'bull_use_ema': True, 'bull_use_atr': False, 'bull_use_adx': False, 'bull_use_spike': False, 'bull_rsi_required': False, 'bear_strategy': 'breakout', 'bear_bb_std_mult': 3.2751683943717413, 'bear_rsi_os': 11, 'bear_rsi_ob': 69, 'bear_adx_thresh': 5.108575226063481, 'bear_atr_min_pct': 0.00466753430749941, 'bear_atr_max_pct': 0.08353648944420435, 'bear_tp_mult': 1.8777494621356006, 'bear_tsl_mult': 0.5975711691037366, 'bear_time_stop': 55, 'bear_use_sma': False, 'bear_use_ema': True, 'bear_use_atr': False, 'bear_use_adx': True, 'bear_use_spike': False, 'bear_rsi_required': False, 'sideways_strategy': 'breakout', 'sideways_bb_std_mult': 1.3937978245046567, 'sideways_rsi_os': 36, 'sideways_rsi_ob': 85, 'sideways_adx_thresh': 28.187498805725216, 'sideways_atr_min_pct': 0.015624778675584775, 'sideways_atr_max_pct': 0.027679300333967295, 'sideways_tp_mult': 2.639443818481296, 'sideways_tsl_mult': 0.7879830136337236, 'sideways_time_stop': 245, 'sideways_use_sma': False, 'sideways_use_ema': True, 'sideways_use_atr': True, 'sideways_use_adx': False, 'sideways_use_spike': False, 'sideways_rsi_required': False}.
[I 2025-09-01 13:59:20,302] Trial 218 finished with values: [-1000000000.0, 1000000000.0] and parameters: {'p_sma': 21, 'p_std': 31, 'p_atr': 8, 'p_adx': 23, 'rsi_period': 63, 'ema1': 8, 'ema2': 29, 'slip_atr_k': 0.00819558893341561, 'slip_spread_k': 0.051236480732079426, 'spread_hl_frac': 0.021807566517121582, 'bb_std_mult': 1.4299732238734628, 'rsi_os': 45, 'rsi_ob': 75, 'vol_spike': 0.11018635662875009, 'adx_thresh': 24.375841447058406, 'atr_min_pct': 0.017598997872594474, 'atr_max_pct': 0.022014369601527056, 'tp_mult': 2.441270938457214, 'tsl_mult': 0.09322666765616744, 'strategy': 'breakout', 'time_stop': 296, 'use_sma': True, 'use_atr': True, 'use_adx': False, 'use_ema': False, 'use_spike': True, 'rsi_required': False, 'edge_k': 1.3346821212995104, 'edge_cap': 0.6411112711010195, 'bull_strategy': 'breakout', 'bull_bb_std_mult': 1.306448167768933, 'bull_rsi_os': 19, 'bull_rsi_ob': 52, 'bull_adx_thresh': 9.304951898400088, 'bull_atr_min_pct': 0.012847270412858654, 'bull_atr_max_pct': 0.06362940990780694, 'bull_tp_mult': 2.4208579761115883, 'bull_tsl_mult': 0.5110149416847156, 'bull_time_stop': 48, 'bull_use_sma': True, 'bull_use_ema': True, 'bull_use_atr': False, 'bull_use_adx': False, 'bull_use_spike': False, 'bull_rsi_required': True, 'bear_strategy': 'breakout', 'bear_bb_std_mult': 3.2709985938226076, 'bear_rsi_os': 16, 'bear_rsi_ob': 54, 'bear_adx_thresh': 19.866110669148703, 'bear_atr_min_pct': 0.004020593963795626, 'bear_atr_max_pct': 0.10768002490705068, 'bear_tp_mult': 1.8748740324174875, 'bear_tsl_mult': 0.16129360615543448, 'bear_time_stop': 61, 'bear_use_sma': True, 'bear_use_ema': True, 'bear_use_atr': False, 'bear_use_adx': False, 'bear_use_spike': False, 'bear_rsi_required': False, 'sideways_strategy': 'mean_reversion', 'sideways_bb_std_mult': 1.3982973784498878, 'sideways_rsi_os': 35, 'sideways_rsi_ob': 85, 'sideways_adx_thresh': 15.04875752599251, 'sideways_atr_min_pct': 0.01544369190793746, 'sideways_atr_max_pct': 0.12895851310542078, 'sideways_tp_mult': 2.674315683408359, 'sideways_tsl_mult': 0.7080825755031575, 'sideways_time_stop': 300, 'sideways_use_sma': True, 'sideways_use_ema': False, 'sideways_use_atr': True, 'sideways_use_adx': False, 'sideways_use_spike': False, 'sideways_rsi_required': False}.
[I 2025-09-01 13:59:20,790] Trial 221 finished with values: [-1000000000.0, 1000000000.0] and parameters: {'p_sma': 14, 'p_std': 27, 'p_atr': 8, 'p_adx': 12, 'rsi_period': 74, 'ema1': 9, 'ema2': 12, 'slip_atr_k': 0.20802980997406706, 'slip_spread_k': 0.048281903964062234, 'spread_hl_frac': 0.004963225172371789, 'bb_std_mult': 1.8764621245788962, 'rsi_os': 25, 'rsi_ob': 74, 'vol_spike': 0.1162363008002344, 'adx_thresh': 13.115703428091148, 'atr_min_pct': 0.016659656450199987, 'atr_max_pct': 0.021693365894452466, 'tp_mult': 2.0288608936318515, 'tsl_mult': 0.04335425493668518, 'strategy': 'breakout', 'time_stop': 93, 'use_sma': True, 'use_atr': True, 'use_adx': False, 'use_ema': False, 'use_spike': True, 'rsi_required': False, 'edge_k': 1.091134194484314, 'edge_cap': 0.23834624810274163, 'bull_strategy': 'breakout', 'bull_bb_std_mult': 1.403970017545433, 'bull_rsi_os': 19, 'bull_rsi_ob': 53, 'bull_adx_thresh': 9.48157840463495, 'bull_atr_min_pct': 0.011266903747350475, 'bull_atr_max_pct': 0.0777925542268686, 'bull_tp_mult': 1.2466441331943972, 'bull_tsl_mult': 0.5236179254603329, 'bull_time_stop': 258, 'bull_use_sma': True, 'bull_use_ema': True, 'bull_use_atr': False, 'bull_use_adx': True, 'bull_use_spike': False, 'bull_rsi_required': True, 'bear_strategy': 'breakout', 'bear_bb_std_mult': 3.004544993244158, 'bear_rsi_os': 37, 'bear_rsi_ob': 76, 'bear_adx_thresh': 6.564669705791001, 'bear_atr_min_pct': 0.004213199518946092, 'bear_atr_max_pct': 0.10803758269659382, 'bear_tp_mult': 1.2905760625416183, 'bear_tsl_mult': 0.16538476270526783, 'bear_time_stop': 162, 'bear_use_sma': False, 'bear_use_ema': True, 'bear_use_atr': False, 'bear_use_adx': False, 'bear_use_spike': False, 'bear_rsi_required': True, 'sideways_strategy': 'mean_reversion', 'sideways_bb_std_mult': 0.7517711043957154, 'sideways_rsi_os': 37, 'sideways_rsi_ob': 77, 'sideways_adx_thresh': 27.168203991874847, 'sideways_atr_min_pct': 0.014443583837280092, 'sideways_atr_max_pct': 0.12108322305994945, 'sideways_tp_mult': 1.8076519072999246, 'sideways_tsl_mult': 0.39749635062255356, 'sideways_time_stop': 117, 'sideways_use_sma': True, 'sideways_use_ema': False, 'sideways_use_atr': True, 'sideways_use_adx': False, 'sideways_use_spike': False, 'sideways_rsi_required': False}.
[I 2025-09-01 13:59:21,193] Trial 219 finished with values: [-1000000000.0, 1000000000.0] and parameters: {'p_sma': 10, 'p_std': 30, 'p_atr': 15, 'p_adx': 17, 'rsi_period': 12, 'ema1': 8, 'ema2': 27, 'slip_atr_k': 0.008150578739501766, 'slip_spread_k': 0.4623386039494978, 'spread_hl_frac': 0.04673159649398662, 'bb_std_mult': 1.8824426594937673, 'rsi_os': 45, 'rsi_ob': 75, 'vol_spike': 0.11771710078841187, 'adx_thresh': 24.713764387639294, 'atr_min_pct': 0.016663058153371806, 'atr_max_pct': 0.02176266006933985, 'tp_mult': 2.0123102734715905, 'tsl_mult': 0.41344387395876575, 'strategy': 'breakout', 'time_stop': 292, 'use_sma': True, 'use_atr': True, 'use_adx': False, 'use_ema': False, 'use_spike': True, 'rsi_required': False, 'edge_k': 1.3417331573346347, 'edge_cap': 0.25924329765038157, 'bull_strategy': 'breakout', 'bull_bb_std_mult': 1.3972663228445579, 'bull_rsi_os': 19, 'bull_rsi_ob': 53, 'bull_adx_thresh': 9.478476591306082, 'bull_atr_min_pct': 0.011330410569439222, 'bull_atr_max_pct': 0.024579232396556842, 'bull_tp_mult': 2.3998822762625567, 'bull_tsl_mult': 0.5933008010805777, 'bull_time_stop': 252, 'bull_use_sma': True, 'bull_use_ema': True, 'bull_use_atr': False, 'bull_use_adx': False, 'bull_use_spike': False, 'bull_rsi_required': True, 'bear_strategy': 'breakout', 'bear_bb_std_mult': 3.268860357842944, 'bear_rsi_os': 21, 'bear_rsi_ob': 76, 'bear_adx_thresh': 27.39120546835259, 'bear_atr_min_pct': 0.024846603977596443, 'bear_atr_max_pct': 0.08261928217418141, 'bear_tp_mult': 1.9153554941495003, 'bear_tsl_mult': 0.1668031144146121, 'bear_time_stop': 164, 'bear_use_sma': False, 'bear_use_ema': True, 'bear_use_atr': False, 'bear_use_adx': False, 'bear_use_spike': False, 'bear_rsi_required': True, 'sideways_strategy': 'mean_reversion', 'sideways_bb_std_mult': 0.9126967492548872, 'sideways_rsi_os': 36, 'sideways_rsi_ob': 89, 'sideways_adx_thresh': 21.85990067748444, 'sideways_atr_min_pct': 0.014346651773642527, 'sideways_atr_max_pct': 0.025692741684916955, 'sideways_tp_mult': 2.6434226743147486, 'sideways_tsl_mult': 0.06399263754196621, 'sideways_time_stop': 245, 'sideways_use_sma': True, 'sideways_use_ema': True, 'sideways_use_atr': True, 'sideways_use_adx': False, 'sideways_use_spike': False, 'sideways_rsi_required': False}.
[I 2025-09-01 13:59:21,441] Trial 220 finished with values: [-1000000000.0, 1000000000.0] and parameters: {'p_sma': 25, 'p_std': 27, 'p_atr': 8, 'p_adx': 17, 'rsi_period': 79, 'ema1': 9, 'ema2': 12, 'slip_atr_k': 0.0001744209964876837, 'slip_spread_k': 0.4586968604272376, 'spread_hl_frac': 0.027210874487623608, 'bb_std_mult': 1.474473085853989, 'rsi_os': 28, 'rsi_ob': 75, 'vol_spike': 0.07649231843987019, 'adx_thresh': 31.00221146857363, 'atr_min_pct': 0.016694321160742653, 'atr_max_pct': 0.09940528461063508, 'tp_mult': 2.011262033916024, 'tsl_mult': 0.04334528107316327, 'strategy': 'breakout', 'time_stop': 293, 'use_sma': True, 'use_atr': True, 'use_adx': False, 'use_ema': False, 'use_spike': True, 'rsi_required': False, 'edge_k': 1.3379468834917256, 'edge_cap': 0.2574022650118113, 'bull_strategy': 'breakout', 'bull_bb_std_mult': 1.40610906548875, 'bull_rsi_os': 19, 'bull_rsi_ob': 53, 'bull_adx_thresh': 9.100793562968185, 'bull_atr_min_pct': 0.013104451284556515, 'bull_atr_max_pct': 0.06456940728590671, 'bull_tp_mult': 1.3505921725982313, 'bull_tsl_mult': 0.6871663110698971, 'bull_time_stop': 258, 'bull_use_sma': True, 'bull_use_ema': True, 'bull_use_atr': False, 'bull_use_adx': True, 'bull_use_spike': False, 'bull_rsi_required': True, 'bear_strategy': 'breakout', 'bear_bb_std_mult': 3.018885589376077, 'bear_rsi_os': 15, 'bear_rsi_ob': 54, 'bear_adx_thresh': 21.64934394739125, 'bear_atr_min_pct': 0.024867203259392297, 'bear_atr_max_pct': 0.11430836308056988, 'bear_tp_mult': 1.9134532624425005, 'bear_tsl_mult': 0.39784498070231206, 'bear_time_stop': 172, 'bear_use_sma': False, 'bear_use_ema': True, 'bear_use_atr': False, 'bear_use_adx': False, 'bear_use_spike': False, 'bear_rsi_required': True, 'sideways_strategy': 'breakout', 'sideways_bb_std_mult': 0.7708014157972525, 'sideways_rsi_os': 35, 'sideways_rsi_ob': 85, 'sideways_adx_thresh': 21.786450459536134, 'sideways_atr_min_pct': 0.015306929716643013, 'sideways_atr_max_pct': 0.027683031430219197, 'sideways_tp_mult': 2.64135908099301, 'sideways_tsl_mult': 0.4428886430560133, 'sideways_time_stop': 242, 'sideways_use_sma': True, 'sideways_use_ema': False, 'sideways_use_atr': True, 'sideways_use_adx': False, 'sideways_use_spike': False, 'sideways_rsi_required': False}.
[I 2025-09-01 13:59:58,247] Trial 222 finished with values: [-1000000000.0, 1000000000.0] and parameters: {'p_sma': 14, 'p_std': 27, 'p_atr': 7, 'p_adx': 29, 'rsi_period': 74, 'ema1': 9, 'ema2': 43, 'slip_atr_k': 0.003804341647528733, 'slip_spread_k': 0.4590652848785366, 'spread_hl_frac': 0.0047947084379080995, 'bb_std_mult': 2.0474025494501027, 'rsi_os': 45, 'rsi_ob': 74, 'vol_spike': 0.07843716541889817, 'adx_thresh': 30.89759704776862, 'atr_min_pct': 0.016708276784730865, 'atr_max_pct': 0.10582529372930666, 'tp_mult': 2.05445666847274, 'tsl_mult': 0.048900631030604186, 'strategy': 'breakout', 'time_stop': 92, 'use_sma': True, 'use_atr': True, 'use_adx': False, 'use_ema': False, 'use_spike': True, 'rsi_required': False, 'edge_k': 1.1633038082993843, 'edge_cap': 0.2325233207637845, 'bull_strategy': 'breakout', 'bull_bb_std_mult': 1.1951864124961933, 'bull_rsi_os': 21, 'bull_rsi_ob': 53, 'bull_adx_thresh': 18.3076958459091, 'bull_atr_min_pct': 0.01160371388793683, 'bull_atr_max_pct': 0.12759436321105455, 'bull_tp_mult': 1.3779862835419134, 'bull_tsl_mult': 0.4370024996982621, 'bull_time_stop': 89, 'bull_use_sma': False, 'bull_use_ema': True, 'bull_use_atr': False, 'bull_use_adx': True, 'bull_use_spike': False, 'bull_rsi_required': True, 'bear_strategy': 'breakout', 'bear_bb_std_mult': 3.004063712541341, 'bear_rsi_os': 53, 'bear_rsi_ob': 51, 'bear_adx_thresh': 22.768982177511944, 'bear_atr_min_pct': 0.026072795403635357, 'bear_atr_max_pct': 0.07083095817718073, 'bear_tp_mult': 2.725146068684022, 'bear_tsl_mult': 0.3263366994431097, 'bear_time_stop': 48, 'bear_use_sma': False, 'bear_use_ema': True, 'bear_use_atr': False, 'bear_use_adx': False, 'bear_use_spike': False, 'bear_rsi_required': True, 'sideways_strategy': 'breakout', 'sideways_bb_std_mult': 0.7676366587745734, 'sideways_rsi_os': 54, 'sideways_rsi_ob': 89, 'sideways_adx_thresh': 26.937678244620813, 'sideways_atr_min_pct': 0.006264293280083726, 'sideways_atr_max_pct': 0.12247411513107499, 'sideways_tp_mult': 1.2962093012763642, 'sideways_tsl_mult': 0.06282889551963566, 'sideways_time_stop': 235, 'sideways_use_sma': True, 'sideways_use_ema': True, 'sideways_use_atr': True, 'sideways_use_adx': False, 'sideways_use_spike': False, 'sideways_rsi_required': False}.
[I 2025-09-01 13:59:58,666] Trial 223 finished with values: [-1000000000.0, 1000000000.0] and parameters: {'p_sma': 10, 'p_std': 27, 'p_atr': 7, 'p_adx': 29, 'rsi_period': 20, 'ema1': 9, 'ema2': 25, 'slip_atr_k': 7.414146418680554e-05, 'slip_spread_k': 0.4538503404003972, 'spread_hl_frac': 0.006636121606036195, 'bb_std_mult': 2.045553019924849, 'rsi_os': 15, 'rsi_ob': 74, 'vol_spike': 0.07933674107804843, 'adx_thresh': 23.47144618395399, 'atr_min_pct': 0.0048376197106244495, 'atr_max_pct': 0.1298746194513729, 'tp_mult': 1.9381172893512375, 'tsl_mult': 0.0298643344387869, 'strategy': 'breakout', 'time_stop': 234, 'use_sma': True, 'use_atr': True, 'use_adx': False, 'use_ema': False, 'use_spike': True, 'rsi_required': False, 'edge_k': 1.1443583159608923, 'edge_cap': 0.22143668949774142, 'bull_strategy': 'mean_reversion', 'bull_bb_std_mult': 1.1995527690312127, 'bull_rsi_os': 55, 'bull_rsi_ob': 82, 'bull_adx_thresh': 30.14734761243347, 'bull_atr_min_pct': 0.011458577746200873, 'bull_atr_max_pct': 0.12163443201065068, 'bull_tp_mult': 1.3760010758725327, 'bull_tsl_mult': 0.589954981687103, 'bull_time_stop': 89, 'bull_use_sma': False, 'bull_use_ema': False, 'bull_use_atr': False, 'bull_use_adx': True, 'bull_use_spike': False, 'bull_rsi_required': False, 'bear_strategy': 'breakout', 'bear_bb_std_mult': 1.439256016209182, 'bear_rsi_os': 21, 'bear_rsi_ob': 58, 'bear_adx_thresh': 21.705525918500214, 'bear_atr_min_pct': 0.024918635951659555, 'bear_atr_max_pct': 0.0789687959170779, 'bear_tp_mult': 1.9340321877816846, 'bear_tsl_mult': 0.6323593807111396, 'bear_time_stop': 227, 'bear_use_sma': False, 'bear_use_ema': True, 'bear_use_atr': False, 'bear_use_adx': True, 'bear_use_spike': False, 'bear_rsi_required': True, 'sideways_strategy': 'breakout', 'sideways_bb_std_mult': 0.7892821879366945, 'sideways_rsi_os': 45, 'sideways_rsi_ob': 89, 'sideways_adx_thresh': 29.722158211057753, 'sideways_atr_min_pct': 0.014021471731176967, 'sideways_atr_max_pct': 0.12227848774345582, 'sideways_tp_mult': 2.525355157940749, 'sideways_tsl_mult': 0.4505672378255305, 'sideways_time_stop': 236, 'sideways_use_sma': False, 'sideways_use_ema': True, 'sideways_use_atr': False, 'sideways_use_adx': False, 'sideways_use_spike': False, 'sideways_rsi_required': True}.
[I 2025-09-01 13:59:59,438] Trial 225 finished with values: [-1000000000.0, 1000000000.0] and parameters: {'p_sma': 10, 'p_std': 26, 'p_atr': 7, 'p_adx': 28, 'rsi_period': 21, 'ema1': 8, 'ema2': 27, 'slip_atr_k': 0.14416335010829473, 'slip_spread_k': 0.525687591042767, 'spread_hl_frac': 0.028908276466069284, 'bb_std_mult': 2.0230515687671082, 'rsi_os': 47, 'rsi_ob': 74, 'vol_spike': 0.09033314052607748, 'adx_thresh': 23.428180484170806, 'atr_min_pct': 0.01848119728300858, 'atr_max_pct': 0.08087818565175499, 'tp_mult': 1.9391316420027727, 'tsl_mult': 0.0655203382654169, 'strategy': 'breakout', 'time_stop': 84, 'use_sma': True, 'use_atr': True, 'use_adx': False, 'use_ema': False, 'use_spike': True, 'rsi_required': False, 'edge_k': 1.172833380575231, 'edge_cap': 0.5470182144679894, 'bull_strategy': 'mean_reversion', 'bull_bb_std_mult': 1.2270777648949915, 'bull_rsi_os': 16, 'bull_rsi_ob': 87, 'bull_adx_thresh': 10.641964770224604, 'bull_atr_min_pct': 0.011851231407825518, 'bull_atr_max_pct': 0.1266316048243062, 'bull_tp_mult': 2.5971429289284904, 'bull_tsl_mult': 0.5853995049872486, 'bull_time_stop': 91, 'bull_use_sma': False, 'bull_use_ema': False, 'bull_use_atr': False, 'bull_use_adx': True, 'bull_use_spike': False, 'bull_rsi_required': False, 'bear_strategy': 'breakout', 'bear_bb_std_mult': 1.417369405857356, 'bear_rsi_os': 14, 'bear_rsi_ob': 51, 'bear_adx_thresh': 5.607108592134673, 'bear_atr_min_pct': 0.005793472935922802, 'bear_atr_max_pct': 0.07021723338823205, 'bear_tp_mult': 1.9906138512489875, 'bear_tsl_mult': 0.20448168922654802, 'bear_time_stop': 49, 'bear_use_sma': True, 'bear_use_ema': True, 'bear_use_atr': False, 'bear_use_adx': True, 'bear_use_spike': False, 'bear_rsi_required': True, 'sideways_strategy': 'breakout', 'sideways_bb_std_mult': 0.7156255535290642, 'sideways_rsi_os': 40, 'sideways_rsi_ob': 61, 'sideways_adx_thresh': 29.45301442871406, 'sideways_atr_min_pct': 0.006525559112465114, 'sideways_atr_max_pct': 0.1448670958452054, 'sideways_tp_mult': 2.7991598942766576, 'sideways_tsl_mult': 0.7508518501150087, 'sideways_time_stop': 235, 'sideways_use_sma': False, 'sideways_use_ema': True, 'sideways_use_atr': False, 'sideways_use_adx': False, 'sideways_use_spike': True, 'sideways_rsi_required': True}.
