[I 2025-09-01 14:44:48,599] Trial 532 finished with values: [-0.026307149660055096, 0.026111314452191944] and parameters: {'p_sma': 26, 'p_std': 28, 'p_atr': 15, 'p_adx': 21, 'rsi_period': 77, 'ema1': 10, 'ema2': 59, 'slip_atr_k': 0.21884616301663334, 'slip_spread_k': 0.4759474740162193, 'spread_hl_frac': 0.00743795807926045, 'bb_std_mult': 2.3852510285324593, 'rsi_os': 22, 'rsi_ob': 67, 'vol_spike': 0.14884792990006832, 'adx_thresh': 5.455543766882956, 'atr_min_pct': 0.022443747232979462, 'atr_max_pct': 0.024577764608774866, 'tp_mult': 2.575158612090258, 'tsl_mult': 0.9081551154638288, 'strategy': 'mean_reversion', 'time_stop': 97, 'use_sma': False, 'use_atr': True, 'use_adx': True, 'use_ema': False, 'use_spike': False, 'rsi_required': False, 'edge_k': 0.35518932925844876, 'edge_cap': 0.9751634984147949, 'bull_strategy': 'breakout', 'bull_bb_std_mult': 2.8295838660855153, 'bull_rsi_os': 24, 'bull_rsi_ob': 79, 'bull_adx_thresh': 11.724043764439488, 'bull_atr_min_pct': 0.011366159607493133, 'bull_atr_max_pct': 0.06797957368006902, 'bull_tp_mult': 1.772275190780579, 'bull_tsl_mult': 0.43332696252456615, 'bull_time_stop': 179, 'bull_use_sma': False, 'bull_use_ema': False, 'bull_use_atr': False, 'bull_use_adx': False, 'bull_use_spike': True, 'bull_rsi_required': False, 'bear_strategy': 'mean_reversion', 'bear_bb_std_mult': 1.4520884226435498, 'bear_rsi_os': 35, 'bear_rsi_ob': 55, 'bear_adx_thresh': 15.316759395383489, 'bear_atr_min_pct': 0.00254918407175026, 'bear_atr_max_pct': 0.0919141545310921, 'bear_tp_mult': 1.9860450018485305, 'bear_tsl_mult': 0.31146031332585, 'bear_time_stop': 87, 'bear_use_sma': False, 'bear_use_ema': False, 'bear_use_atr': False, 'bear_use_adx': True, 'bear_use_spike': True, 'bear_rsi_required': False, 'sideways_strategy': 'breakout', 'sideways_bb_std_mult': 3.132170112268139, 'sideways_rsi_os': 32, 'sideways_rsi_ob': 89, 'sideways_adx_thresh': 8.787323201061119, 'sideways_atr_min_pct': 0.002337461254992421, 'sideways_atr_max_pct': 0.11718766577245862, 'sideways_tp_mult': 2.3416446759000973, 'sideways_tsl_mult': 0.0031836300292994446, 'sideways_time_stop': 259, 'sideways_use_sma': True, 'sideways_use_ema': True, 'sideways_use_atr': True, 'sideways_use_adx': True, 'sideways_use_spike': True, 'sideways_rsi_required': False}.
[I 2025-09-01 14:44:48,840] Trial 530 finished with values: [-0.08927815021369911, 0.0894904204136685] and parameters: {'p_sma': 26, 'p_std': 24, 'p_atr': 26, 'p_adx': 10, 'rsi_period': 83, 'ema1': 10, 'ema2': 33, 'slip_atr_k': 0.1769165632272633, 'slip_spread_k': 0.9008499558759011, 'spread_hl_frac': 0.04253557704704178, 'bb_std_mult': 0.8223820413433383, 'rsi_os': 44, 'rsi_ob': 89, 'vol_spike': 0.1740057083790054, 'adx_thresh': 14.39785396618557, 'atr_min_pct': 0.013950980304867288, 'atr_max_pct': 0.06025667274121324, 'tp_mult': 2.9615281120626813, 'tsl_mult': 0.7076999333128818, 'strategy': 'mean_reversion', 'time_stop': 98, 'use_sma': False, 'use_atr': True, 'use_adx': True, 'use_ema': False, 'use_spike': False, 'rsi_required': False, 'edge_k': 0.25338611092161717, 'edge_cap': 0.9796635127880116, 'bull_strategy': 'breakout', 'bull_bb_std_mult': 3.054336198571983, 'bull_rsi_os': 52, 'bull_rsi_ob': 77, 'bull_adx_thresh': 12.29472957174443, 'bull_atr_min_pct': 0.017276932240222382, 'bull_atr_max_pct': 0.14951536096280876, 'bull_tp_mult': 2.4456689647395295, 'bull_tsl_mult': 0.02776903567061867, 'bull_time_stop': 180, 'bull_use_sma': False, 'bull_use_ema': False, 'bull_use_atr': False, 'bull_use_adx': True, 'bull_use_spike': True, 'bull_rsi_required': False, 'bear_strategy': 'mean_reversion', 'bear_bb_std_mult': 3.4421438912781497, 'bear_rsi_os': 42, 'bear_rsi_ob': 55, 'bear_adx_thresh': 6.162845276585701, 'bear_atr_min_pct': 0.0025854111610885957, 'bear_atr_max_pct': 0.11608193188834394, 'bear_tp_mult': 1.9734864536372796, 'bear_tsl_mult': 0.1629814007740844, 'bear_time_stop': 102, 'bear_use_sma': False, 'bear_use_ema': False, 'bear_use_atr': False, 'bear_use_adx': True, 'bear_use_spike': True, 'bear_rsi_required': False, 'sideways_strategy': 'breakout', 'sideways_bb_std_mult': 3.1358033085919566, 'sideways_rsi_os': 28, 'sideways_rsi_ob': 89, 'sideways_adx_thresh': 23.092291761676407, 'sideways_atr_min_pct': 0.001982170478672314, 'sideways_atr_max_pct': 0.08644350294953707, 'sideways_tp_mult': 2.9150759726473594, 'sideways_tsl_mult': 0.40567021462916264, 'sideways_time_stop': 213, 'sideways_use_sma': False, 'sideways_use_ema': True, 'sideways_use_atr': True, 'sideways_use_adx': True, 'sideways_use_spike': True, 'sideways_rsi_required': False}.
[I 2025-09-01 14:44:49,329] Trial 533 finished with values: [-0.019976752259689645, 0.020884692835839328] and parameters: {'p_sma': 18, 'p_std': 23, 'p_atr': 15, 'p_adx': 9, 'rsi_period': 77, 'ema1': 8, 'ema2': 59, 'slip_atr_k': 0.10698709592467179, 'slip_spread_k': 0.5604452680902011, 'spread_hl_frac': 0.040838997149765625, 'bb_std_mult': 3.420895370933017, 'rsi_os': 44, 'rsi_ob': 66, 'vol_spike': 0.09577454879406805, 'adx_thresh': 14.838902579829572, 'atr_min_pct': 0.010320836897880494, 'atr_max_pct': 0.11036318707922546, 'tp_mult': 2.969825841110942, 'tsl_mult': 0.7104716852631453, 'strategy': 'mean_reversion', 'time_stop': 111, 'use_sma': False, 'use_atr': False, 'use_adx': True, 'use_ema': False, 'use_spike': True, 'rsi_required': False, 'edge_k': 0.26134353681086686, 'edge_cap': 0.9773675186376286, 'bull_strategy': 'breakout', 'bull_bb_std_mult': 2.820788513444289, 'bull_rsi_os': 52, 'bull_rsi_ob': 70, 'bull_adx_thresh': 33.73666580742926, 'bull_atr_min_pct': 0.011322806891265646, 'bull_atr_max_pct': 0.09863151749912798, 'bull_tp_mult': 1.6567356522813417, 'bull_tsl_mult': 0.4318316663964453, 'bull_time_stop': 189, 'bull_use_sma': False, 'bull_use_ema': False, 'bull_use_atr': True, 'bull_use_adx': False, 'bull_use_spike': True, 'bull_rsi_required': False, 'bear_strategy': 'mean_reversion', 'bear_bb_std_mult': 2.571100886310486, 'bear_rsi_os': 35, 'bear_rsi_ob': 59, 'bear_adx_thresh': 8.666484313185043, 'bear_atr_min_pct': 0.002451644012686594, 'bear_atr_max_pct': 0.09824362662067374, 'bear_tp_mult': 2.003355091359628, 'bear_tsl_mult': 0.8538904775041274, 'bear_time_stop': 75, 'bear_use_sma': True, 'bear_use_ema': False, 'bear_use_atr': False, 'bear_use_adx': False, 'bear_use_spike': False, 'bear_rsi_required': False, 'sideways_strategy': 'mean_reversion', 'sideways_bb_std_mult': 0.5022215965866312, 'sideways_rsi_os': 45, 'sideways_rsi_ob': 78, 'sideways_adx_thresh': 16.23077160607112, 'sideways_atr_min_pct': 0.0017256820975376803, 'sideways_atr_max_pct': 0.11936674267905835, 'sideways_tp_mult': 1.398289898316073, 'sideways_tsl_mult': 0.40533763003677986, 'sideways_time_stop': 165, 'sideways_use_sma': True, 'sideways_use_ema': True, 'sideways_use_atr': True, 'sideways_use_adx': True, 'sideways_use_spike': True, 'sideways_rsi_required': False}.
[I 2025-09-01 14:45:24,320] Trial 536 finished with values: [0.0012354323097221176, 0.00584001540785019] and parameters: {'p_sma': 40, 'p_std': 22, 'p_atr': 19, 'p_adx': 8, 'rsi_period': 80, 'ema1': 8, 'ema2': 57, 'slip_atr_k': 0.009906488218284543, 'slip_spread_k': 0.7690531264312334, 'spread_hl_frac': 0.03167510900053298, 'bb_std_mult': 3.333541648367472, 'rsi_os': 24, 'rsi_ob': 54, 'vol_spike': 0.10467211030578595, 'adx_thresh': 27.92823818733852, 'atr_min_pct': 0.010283389411115786, 'atr_max_pct': 0.04075624272034009, 'tp_mult': 1.4018733844741307, 'tsl_mult': 0.770609568676743, 'strategy': 'mean_reversion', 'time_stop': 112, 'use_sma': True, 'use_atr': False, 'use_adx': True, 'use_ema': True, 'use_spike': True, 'rsi_required': True, 'edge_k': 0.2857498284136105, 'edge_cap': 0.9233360653690298, 'bull_strategy': 'breakout', 'bull_bb_std_mult': 1.7493878707313835, 'bull_rsi_os': 14, 'bull_rsi_ob': 79, 'bull_adx_thresh': 10.473010314952804, 'bull_atr_min_pct': 0.005871799663100226, 'bull_atr_max_pct': 0.13307972160602646, 'bull_tp_mult': 1.6593859789280876, 'bull_tsl_mult': 0.34279700487486275, 'bull_time_stop': 144, 'bull_use_sma': False, 'bull_use_ema': True, 'bull_use_atr': True, 'bull_use_adx': False, 'bull_use_spike': True, 'bull_rsi_required': True, 'bear_strategy': 'mean_reversion', 'bear_bb_std_mult': 2.706392400489533, 'bear_rsi_os': 32, 'bear_rsi_ob': 74, 'bear_adx_thresh': 12.186035558895469, 'bear_atr_min_pct': 0.0014281201353675069, 'bear_atr_max_pct': 0.10329493623536178, 'bear_tp_mult': 2.1029030011391754, 'bear_tsl_mult': 0.4106178616909195, 'bear_time_stop': 92, 'bear_use_sma': True, 'bear_use_ema': False, 'bear_use_atr': False, 'bear_use_adx': False, 'bear_use_spike': False, 'bear_rsi_required': False, 'sideways_strategy': 'mean_reversion', 'sideways_bb_std_mult': 3.2332979617510578, 'sideways_rsi_os': 26, 'sideways_rsi_ob': 90, 'sideways_adx_thresh': 25.34492928885949, 'sideways_atr_min_pct': 0.0032076774650585684, 'sideways_atr_max_pct': 0.13658857903955252, 'sideways_tp_mult': 1.3870997677316075, 'sideways_tsl_mult': 0.3542461896615078, 'sideways_time_stop': 264, 'sideways_use_sma': True, 'sideways_use_ema': True, 'sideways_use_atr': False, 'sideways_use_adx': True, 'sideways_use_spike': False, 'sideways_rsi_required': True}.
[I 2025-09-01 14:45:24,322] Trial 535 finished with values: [-1000000000.0, 1000000000.0] and parameters: {'p_sma': 52, 'p_std': 58, 'p_atr': 25, 'p_adx': 9, 'rsi_period': 80, 'ema1': 9, 'ema2': 40, 'slip_atr_k': 0.009765675668939523, 'slip_spread_k': 0.33705358605063157, 'spread_hl_frac': 0.01135532071320052, 'bb_std_mult': 3.3571056427791905, 'rsi_os': 46, 'rsi_ob': 54, 'vol_spike': 0.10754495456769067, 'adx_thresh': 14.671029621036082, 'atr_min_pct': 0.010175886101017767, 'atr_max_pct': 0.04115943265398256, 'tp_mult': 1.3929818474237572, 'tsl_mult': 0.37669160189803297, 'strategy': 'mean_reversion', 'time_stop': 109, 'use_sma': True, 'use_atr': False, 'use_adx': True, 'use_ema': True, 'use_spike': True, 'rsi_required': True, 'edge_k': 0.25825533268681916, 'edge_cap': 0.8924321471919613, 'bull_strategy': 'breakout', 'bull_bb_std_mult': 1.7508371638210887, 'bull_rsi_os': 14, 'bull_rsi_ob': 79, 'bull_adx_thresh': 10.555763871630123, 'bull_atr_min_pct': 0.015123483942000486, 'bull_atr_max_pct': 0.05610067292202356, 'bull_tp_mult': 1.6582279397210746, 'bull_tsl_mult': 0.36399067687962694, 'bull_time_stop': 142, 'bull_use_sma': False, 'bull_use_ema': True, 'bull_use_atr': True, 'bull_use_adx': True, 'bull_use_spike': True, 'bull_rsi_required': True, 'bear_strategy': 'mean_reversion', 'bear_bb_std_mult': 2.575267602117705, 'bear_rsi_os': 9, 'bear_rsi_ob': 87, 'bear_adx_thresh': 8.79303082631459, 'bear_atr_min_pct': 0.0014881651860990204, 'bear_atr_max_pct': 0.11595523900078035, 'bear_tp_mult': 2.030503249609312, 'bear_tsl_mult': 0.07845605929883717, 'bear_time_stop': 92, 'bear_use_sma': True, 'bear_use_ema': False, 'bear_use_atr': False, 'bear_use_adx': False, 'bear_use_spike': False, 'bear_rsi_required': False, 'sideways_strategy': 'mean_reversion', 'sideways_bb_std_mult': 2.9267005172506972, 'sideways_rsi_os': 29, 'sideways_rsi_ob': 48, 'sideways_adx_thresh': 25.410295785625078, 'sideways_atr_min_pct': 0.003182497050348541, 'sideways_atr_max_pct': 0.10782013433019247, 'sideways_tp_mult': 1.409404357279671, 'sideways_tsl_mult': 0.3545354173320731, 'sideways_time_stop': 89, 'sideways_use_sma': True, 'sideways_use_ema': True, 'sideways_use_atr': False, 'sideways_use_adx': True, 'sideways_use_spike': False, 'sideways_rsi_required': True}.
[I 2025-09-01 14:45:24,760] Trial 537 finished with values: [-0.036265388470110294, 0.03597151051367459] and parameters: {'p_sma': 29, 'p_std': 26, 'p_atr': 20, 'p_adx': 9, 'rsi_period': 35, 'ema1': 9, 'ema2': 40, 'slip_atr_k': 0.009326537797303247, 'slip_spread_k': 0.5138601578493089, 'spread_hl_frac': 0.012165058827150462, 'bb_std_mult': 3.354017677515095, 'rsi_os': 45, 'rsi_ob': 54, 'vol_spike': 0.10495120238228695, 'adx_thresh': 28.163121558354426, 'atr_min_pct': 0.012301083903555315, 'atr_max_pct': 0.1204769118858848, 'tp_mult': 1.7502454747051497, 'tsl_mult': 0.6213201479021094, 'strategy': 'mean_reversion', 'time_stop': 107, 'use_sma': True, 'use_atr': False, 'use_adx': True, 'use_ema': True, 'use_spike': True, 'rsi_required': True, 'edge_k': 0.20882889043734326, 'edge_cap': 0.9165252357390974, 'bull_strategy': 'breakout', 'bull_bb_std_mult': 3.3022414383219303, 'bull_rsi_os': 7, 'bull_rsi_ob': 79, 'bull_adx_thresh': 10.767821675664125, 'bull_atr_min_pct': 0.012578178999456674, 'bull_atr_max_pct': 0.05535979572634113, 'bull_tp_mult': 2.888239035283965, 'bull_tsl_mult': 0.5148740615817697, 'bull_time_stop': 145, 'bull_use_sma': False, 'bull_use_ema': True, 'bull_use_atr': True, 'bull_use_adx': True, 'bull_use_spike': True, 'bull_rsi_required': True, 'bear_strategy': 'mean_reversion', 'bear_bb_std_mult': 2.736360456878694, 'bear_rsi_os': 37, 'bear_rsi_ob': 56, 'bear_adx_thresh': 12.165846120937031, 'bear_atr_min_pct': 0.0013413087736356556, 'bear_atr_max_pct': 0.10292052487131316, 'bear_tp_mult': 2.9348730131994056, 'bear_tsl_mult': 0.4124361351217277, 'bear_time_stop': 92, 'bear_use_sma': True, 'bear_use_ema': False, 'bear_use_atr': False, 'bear_use_adx': False, 'bear_use_spike': False, 'bear_rsi_required': False, 'sideways_strategy': 'mean_reversion', 'sideways_bb_std_mult': 3.240426431821196, 'sideways_rsi_os': 31, 'sideways_rsi_ob': 72, 'sideways_adx_thresh': 25.390668980774787, 'sideways_atr_min_pct': 0.003195099026185324, 'sideways_atr_max_pct': 0.1141079624681359, 'sideways_tp_mult': 2.4258483171034757, 'sideways_tsl_mult': 0.3485161609588683, 'sideways_time_stop': 254, 'sideways_use_sma': True, 'sideways_use_ema': True, 'sideways_use_atr': False, 'sideways_use_adx': False, 'sideways_use_spike': False, 'sideways_rsi_required': True}.
[I 2025-09-01 14:45:25,110] Trial 534 finished with values: [-0.07623858631646108, 0.07638656716610952] and parameters: {'p_sma': 26, 'p_std': 40, 'p_atr': 15, 'p_adx': 9, 'rsi_period': 79, 'ema1': 8, 'ema2': 33, 'slip_atr_k': 0.010974604083480664, 'slip_spread_k': 0.4696610904586376, 'spread_hl_frac': 0.041226566188003105, 'bb_std_mult': 2.3848914588821737, 'rsi_os': 44, 'rsi_ob': 60, 'vol_spike': 0.1468177629826524, 'adx_thresh': 28.15163484614884, 'atr_min_pct': 0.013854771517228151, 'atr_max_pct': 0.11002342130472408, 'tp_mult': 2.9607398584151285, 'tsl_mult': 0.9093197203583676, 'strategy': 'mean_reversion', 'time_stop': 110, 'use_sma': True, 'use_atr': False, 'use_adx': True, 'use_ema': False, 'use_spike': True, 'rsi_required': True, 'edge_k': 0.2569141544870299, 'edge_cap': 0.9761122542187101, 'bull_strategy': 'breakout', 'bull_bb_std_mult': 2.982704605599815, 'bull_rsi_os': 24, 'bull_rsi_ob': 79, 'bull_adx_thresh': 20.976619843688486, 'bull_atr_min_pct': 0.017374816066010136, 'bull_atr_max_pct': 0.0409421352313862, 'bull_tp_mult': 1.8823322146592283, 'bull_tsl_mult': 0.36031144776717394, 'bull_time_stop': 188, 'bull_use_sma': False, 'bull_use_ema': True, 'bull_use_atr': True, 'bull_use_adx': False, 'bull_use_spike': True, 'bull_rsi_required': False, 'bear_strategy': 'mean_reversion', 'bear_bb_std_mult': 2.560733147728057, 'bear_rsi_os': 53, 'bear_rsi_ob': 87, 'bear_adx_thresh': 8.691408150249465, 'bear_atr_min_pct': 0.0014884377233711742, 'bear_atr_max_pct': 0.11097522678414724, 'bear_tp_mult': 1.0136313887087032, 'bear_tsl_mult': 0.02906569926123287, 'bear_time_stop': 86, 'bear_use_sma': True, 'bear_use_ema': False, 'bear_use_atr': False, 'bear_use_adx': False, 'bear_use_spike': False, 'bear_rsi_required': False, 'sideways_strategy': 'mean_reversion', 'sideways_bb_std_mult': 3.22843967977423, 'sideways_rsi_os': 24, 'sideways_rsi_ob': 78, 'sideways_adx_thresh': 23.057725315233817, 'sideways_atr_min_pct': 0.0031770139283671334, 'sideways_atr_max_pct': 0.13681625685200846, 'sideways_tp_mult': 2.8934818025029885, 'sideways_tsl_mult': 0.3566411756141204, 'sideways_time_stop': 294, 'sideways_use_sma': True, 'sideways_use_ema': True, 'sideways_use_atr': True, 'sideways_use_adx': True, 'sideways_use_spike': True, 'sideways_rsi_required': False}.
[I 2025-09-01 14:45:59,270] Trial 541 finished with values: [-1000000000.0, 1000000000.0] and parameters: {'p_sma': 28, 'p_std': 29, 'p_atr': 27, 'p_adx': 8, 'rsi_period': 62, 'ema1': 6, 'ema2': 58, 'slip_atr_k': 0.03754840864262601, 'slip_spread_k': 0.5815938103177896, 'spread_hl_frac': 0.022422627596635693, 'bb_std_mult': 3.471099156631554, 'rsi_os': 42, 'rsi_ob': 61, 'vol_spike': 0.11762635407590898, 'adx_thresh': 5.039684124590379, 'atr_min_pct': 0.002852869518471586, 'atr_max_pct': 0.032571361699674464, 'tp_mult': 2.534196592137721, 'tsl_mult': 0.6855140151484058, 'strategy': 'breakout', 'time_stop': 119, 'use_sma': True, 'use_atr': False, 'use_adx': False, 'use_ema': True, 'use_spike': True, 'rsi_required': True, 'edge_k': 0.15793609464464914, 'edge_cap': 0.9992836751080392, 'bull_strategy': 'breakout', 'bull_bb_std_mult': 3.1731583501649188, 'bull_rsi_os': 12, 'bull_rsi_ob': 77, 'bull_adx_thresh': 28.744541897544025, 'bull_atr_min_pct': 0.026860547330274202, 'bull_atr_max_pct': 0.12669204663522704, 'bull_tp_mult': 1.5131320232250962, 'bull_tsl_mult': 0.7639771203937695, 'bull_time_stop': 158, 'bull_use_sma': True, 'bull_use_ema': True, 'bull_use_atr': True, 'bull_use_adx': True, 'bull_use_spike': True, 'bull_rsi_required': True, 'bear_strategy': 'breakout', 'bear_bb_std_mult': 2.329956240507772, 'bear_rsi_os': 37, 'bear_rsi_ob': 82, 'bear_adx_thresh': 21.04914062075462, 'bear_atr_min_pct': 0.0036563909039084293, 'bear_atr_max_pct': 0.1100454512516654, 'bear_tp_mult': 1.4235693216719483, 'bear_tsl_mult': 0.9774928156858511, 'bear_time_stop': 151, 'bear_use_sma': False, 'bear_use_ema': False, 'bear_use_atr': True, 'bear_use_adx': False, 'bear_use_spike': True, 'bear_rsi_required': False, 'sideways_strategy': 'mean_reversion', 'sideways_bb_std_mult': 1.9367538729041849, 'sideways_rsi_os': 15, 'sideways_rsi_ob': 91, 'sideways_adx_thresh': 18.21559157722054, 'sideways_atr_min_pct': 0.004242004371922264, 'sideways_atr_max_pct': 0.10355110821425047, 'sideways_tp_mult': 1.5808951967651674, 'sideways_tsl_mult': 0.22854199851202484, 'sideways_time_stop': 282, 'sideways_use_sma': True, 'sideways_use_ema': False, 'sideways_use_atr': True, 'sideways_use_adx': False, 'sideways_use_spike': False, 'sideways_rsi_required': False}.
[I 2025-09-01 14:46:00,063] Trial 540 finished with values: [-1000000000.0, 1000000000.0] and parameters: {'p_sma': 28, 'p_std': 39, 'p_atr': 27, 'p_adx': 8, 'rsi_period': 75, 'ema1': 13, 'ema2': 13, 'slip_atr_k': 0.048814672070692414, 'slip_spread_k': 0.6336472077715626, 'spread_hl_frac': 0.02225756941637018, 'bb_std_mult': 3.478597377975163, 'rsi_os': 42, 'rsi_ob': 50, 'vol_spike': 0.1189972680177361, 'adx_thresh': 26.799281027778544, 'atr_min_pct': 0.021658170213820934, 'atr_max_pct': 0.03315636143217471, 'tp_mult': 1.474147929400378, 'tsl_mult': 0.6864742226197302, 'strategy': 'breakout', 'time_stop': 120, 'use_sma': True, 'use_atr': False, 'use_adx': False, 'use_ema': True, 'use_spike': True, 'rsi_required': True, 'edge_k': 0.06032982412813423, 'edge_cap': 0.8035804332995968, 'bull_strategy': 'breakout', 'bull_bb_std_mult': 3.1865433845914963, 'bull_rsi_os': 31, 'bull_rsi_ob': 93, 'bull_adx_thresh': 11.81668894392391, 'bull_atr_min_pct': 0.009646758690338028, 'bull_atr_max_pct': 0.12832321713827613, 'bull_tp_mult': 2.6947969667850202, 'bull_tsl_mult': 0.8701322792543877, 'bull_time_stop': 158, 'bull_use_sma': True, 'bull_use_ema': True, 'bull_use_atr': True, 'bull_use_adx': True, 'bull_use_spike': True, 'bull_rsi_required': True, 'bear_strategy': 'breakout', 'bear_bb_std_mult': 2.3603761079517223, 'bear_rsi_os': 54, 'bear_rsi_ob': 62, 'bear_adx_thresh': 6.92812470675724, 'bear_atr_min_pct': 0.00454671511681534, 'bear_atr_max_pct': 0.11086785924207783, 'bear_tp_mult': 2.072132964139249, 'bear_tsl_mult': 0.10422526762440237, 'bear_time_stop': 84, 'bear_use_sma': False, 'bear_use_ema': False, 'bear_use_atr': True, 'bear_use_adx': False, 'bear_use_spike': True, 'bear_rsi_required': False, 'sideways_strategy': 'mean_reversion', 'sideways_bb_std_mult': 3.0849399119673433, 'sideways_rsi_os': 22, 'sideways_rsi_ob': 92, 'sideways_adx_thresh': 24.088362086151488, 'sideways_atr_min_pct': 0.01969600637382423, 'sideways_atr_max_pct': 0.10301358632064538, 'sideways_tp_mult': 2.3551359433257235, 'sideways_tsl_mult': 0.4538905854627085, 'sideways_time_stop': 200, 'sideways_use_sma': True, 'sideways_use_ema': False, 'sideways_use_atr': True, 'sideways_use_adx': True, 'sideways_use_spike': False, 'sideways_rsi_required': False}.
