[I 2025-09-01 14:25:03,153] Trial 394 finished with values: [-0.04125046948077449, 0.041060477560502476] and parameters: {'p_sma': 29, 'p_std': 29, 'p_atr': 26, 'p_adx': 17, 'rsi_period': 76, 'ema1': 15, 'ema2': 47, 'slip_atr_k': 0.04715396292207191, 'slip_spread_k': 0.43270223984380907, 'spread_hl_frac': 0.019959096081763043, 'bb_std_mult': 3.4611168433620083, 'rsi_os': 41, 'rsi_ob': 55, 'vol_spike': 0.2087252823924639, 'adx_thresh': 16.170948612082697, 'atr_min_pct': 0.014560217171916641, 'atr_max_pct': 0.030296908602533017, 'tp_mult': 2.680206813857591, 'tsl_mult': 0.3917177473460152, 'strategy': 'mean_reversion', 'time_stop': 168, 'use_sma': False, 'use_atr': False, 'use_adx': True, 'use_ema': True, 'use_spike': True, 'rsi_required': True, 'edge_k': 0.35030374857185254, 'edge_cap': 0.7191855020764971, 'bull_strategy': 'mean_reversion', 'bull_bb_std_mult': 2.22885598008156, 'bull_rsi_os': 12, 'bull_rsi_ob': 47, 'bull_adx_thresh': 12.840487826579748, 'bull_atr_min_pct': 0.010726042128738912, 'bull_atr_max_pct': 0.12442957836529307, 'bull_tp_mult': 1.0796926239527098, 'bull_tsl_mult': 0.04638168218085492, 'bull_time_stop': 158, 'bull_use_sma': False, 'bull_use_ema': True, 'bull_use_atr': True, 'bull_use_adx': True, 'bull_use_spike': True, 'bull_rsi_required': True, 'bear_strategy': 'mean_reversion', 'bear_bb_std_mult': 1.8136989237012244, 'bear_rsi_os': 40, 'bear_rsi_ob': 68, 'bear_adx_thresh': 15.779398439804059, 'bear_atr_min_pct': 0.001555766672119106, 'bear_atr_max_pct': 0.10786798236197227, 'bear_tp_mult': 1.4085583427558892, 'bear_tsl_mult': 0.44158711273982687, 'bear_time_stop': 104, 'bear_use_sma': False, 'bear_use_ema': False, 'bear_use_atr': False, 'bear_use_adx': False, 'bear_use_spike': True, 'bear_rsi_required': False, 'sideways_strategy': 'mean_reversion', 'sideways_bb_std_mult': 2.059451038182712, 'sideways_rsi_os': 55, 'sideways_rsi_ob': 91, 'sideways_adx_thresh': 24.50639234611695, 'sideways_atr_min_pct': 0.0074473903693180795, 'sideways_atr_max_pct': 0.04359482532495962, 'sideways_tp_mult': 2.3265526122414726, 'sideways_tsl_mult': 0.03642881691550526, 'sideways_time_stop': 107, 'sideways_use_sma': True, 'sideways_use_ema': True, 'sideways_use_atr': False, 'sideways_use_adx': True, 'sideways_use_spike': False, 'sideways_rsi_required': True}.
[I 2025-09-01 14:25:41,421] Trial 400 finished with values: [0.0024351641982396366, 0.005464506536894302] and parameters: {'p_sma': 31, 'p_std': 25, 'p_atr': 27, 'p_adx': 9, 'rsi_period': 80, 'ema1': 26, 'ema2': 18, 'slip_atr_k': 0.02393366656699287, 'slip_spread_k': 0.5809645224234881, 'spread_hl_frac': 0.00976983075442244, 'bb_std_mult': 0.6258385948113985, 'rsi_os': 26, 'rsi_ob': 53, 'vol_spike': 0.2916699495923373, 'adx_thresh': 5.575140930597821, 'atr_min_pct': 0.005466102374518606, 'atr_max_pct': 0.04393339249313941, 'tp_mult': 1.4245192569736, 'tsl_mult': 0.7682881513967539, 'strategy': 'mean_reversion', 'time_stop': 115, 'use_sma': True, 'use_atr': False, 'use_adx': True, 'use_ema': True, 'use_spike': False, 'rsi_required': True, 'edge_k': 0.5835603559519515, 'edge_cap': 0.7382460832494613, 'bull_strategy': 'breakout', 'bull_bb_std_mult': 2.032364530363889, 'bull_rsi_os': 13, 'bull_rsi_ob': 78, 'bull_adx_thresh': 5.615414196613665, 'bull_atr_min_pct': 0.013531421515969321, 'bull_atr_max_pct': 0.132976652912476, 'bull_tp_mult': 2.9029277343994204, 'bull_tsl_mult': 0.44963480904577535, 'bull_time_stop': 152, 'bull_use_sma': True, 'bull_use_ema': False, 'bull_use_atr': True, 'bull_use_adx': False, 'bull_use_spike': True, 'bull_rsi_required': True, 'bear_strategy': 'mean_reversion', 'bear_bb_std_mult': 2.678035862964933, 'bear_rsi_os': 33, 'bear_rsi_ob': 61, 'bear_adx_thresh': 8.174794982488239, 'bear_atr_min_pct': 0.002059195170904371, 'bear_atr_max_pct': 0.1159843177200185, 'bear_tp_mult': 2.0261314762177314, 'bear_tsl_mult': 0.8791910444820559, 'bear_time_stop': 179, 'bear_use_sma': False, 'bear_use_ema': False, 'bear_use_atr': False, 'bear_use_adx': False, 'bear_use_spike': True, 'bear_rsi_required': False, 'sideways_strategy': 'mean_reversion', 'sideways_bb_std_mult': 3.2940203889299893, 'sideways_rsi_os': 32, 'sideways_rsi_ob': 92, 'sideways_adx_thresh': 18.385332601198343, 'sideways_atr_min_pct': 0.005156514680357306, 'sideways_atr_max_pct': 0.11238820249025852, 'sideways_tp_mult': 2.427844364606284, 'sideways_tsl_mult': 0.16094380000539554, 'sideways_time_stop': 192, 'sideways_use_sma': True, 'sideways_use_ema': False, 'sideways_use_atr': True, 'sideways_use_adx': True, 'sideways_use_spike': False, 'sideways_rsi_required': False}.
[I 2025-09-01 14:25:43,628] Trial 399 finished with values: [-0.11613984438832481, 0.11567355749830141] and parameters: {'p_sma': 31, 'p_std': 18, 'p_atr': 27, 'p_adx': 9, 'rsi_period': 69, 'ema1': 19, 'ema2': 18, 'slip_atr_k': 0.11306680910128133, 'slip_spread_k': 0.5791680455929077, 'spread_hl_frac': 0.010006518725403134, 'bb_std_mult': 0.6847907681097847, 'rsi_os': 44, 'rsi_ob': 53, 'vol_spike': 0.11333778071146365, 'adx_thresh': 5.552779986597806, 'atr_min_pct': 0.01135139609339455, 'atr_max_pct': 0.03571464313405056, 'tp_mult': 1.4106151709622647, 'tsl_mult': 0.2533456167300632, 'strategy': 'mean_reversion', 'time_stop': 192, 'use_sma': True, 'use_atr': False, 'use_adx': True, 'use_ema': True, 'use_spike': False, 'rsi_required': True, 'edge_k': 0.05379763053673406, 'edge_cap': 0.759812968949275, 'bull_strategy': 'breakout', 'bull_bb_std_mult': 3.186152151611704, 'bull_rsi_os': 13, 'bull_rsi_ob': 91, 'bull_adx_thresh': 18.221306996273736, 'bull_atr_min_pct': 0.01183977607155892, 'bull_atr_max_pct': 0.13194724268668828, 'bull_tp_mult': 2.0628684522514034, 'bull_tsl_mult': 0.31398033836549066, 'bull_time_stop': 153, 'bull_use_sma': True, 'bull_use_ema': False, 'bull_use_atr': True, 'bull_use_adx': False, 'bull_use_spike': True, 'bull_rsi_required': True, 'bear_strategy': 'mean_reversion', 'bear_bb_std_mult': 2.7346407867801763, 'bear_rsi_os': 52, 'bear_rsi_ob': 60, 'bear_adx_thresh': 23.740527101718012, 'bear_atr_min_pct': 0.0021592051915952284, 'bear_atr_max_pct': 0.11689903763491577, 'bear_tp_mult': 2.027836322356107, 'bear_tsl_mult': 0.6034541599915999, 'bear_time_stop': 86, 'bear_use_sma': False, 'bear_use_ema': False, 'bear_use_atr': False, 'bear_use_adx': False, 'bear_use_spike': True, 'bear_rsi_required': False, 'sideways_strategy': 'mean_reversion', 'sideways_bb_std_mult': 2.3933336021767264, 'sideways_rsi_os': 32, 'sideways_rsi_ob': 92, 'sideways_adx_thresh': 10.012516240358467, 'sideways_atr_min_pct': 0.002181116362574651, 'sideways_atr_max_pct': 0.11208165478928643, 'sideways_tp_mult': 2.420136290504043, 'sideways_tsl_mult': 0.14693180022505087, 'sideways_time_stop': 252, 'sideways_use_sma': True, 'sideways_use_ema': False, 'sideways_use_atr': True, 'sideways_use_adx': True, 'sideways_use_spike': False, 'sideways_rsi_required': False}.
[I 2025-09-01 14:25:43,628] Trial 397 finished with values: [0.0004175578365679389, 0.007138855986133406] and parameters: {'p_sma': 29, 'p_std': 18, 'p_atr': 27, 'p_adx': 9, 'rsi_period': 80, 'ema1': 13, 'ema2': 57, 'slip_atr_k': 0.01722569482732393, 'slip_spread_k': 0.58584693597515, 'spread_hl_frac': 0.03256175731782683, 'bb_std_mult': 3.025000517667452, 'rsi_os': 45, 'rsi_ob': 55, 'vol_spike': 0.09321629424932162, 'adx_thresh': 5.58416209689959, 'atr_min_pct': 0.011643501601454444, 'atr_max_pct': 0.03013154120072721, 'tp_mult': 1.3050300991104262, 'tsl_mult': 0.7621822610675888, 'strategy': 'mean_reversion', 'time_stop': 123, 'use_sma': False, 'use_atr': False, 'use_adx': True, 'use_ema': True, 'use_spike': True, 'rsi_required': True, 'edge_k': 1.9634417847143548, 'edge_cap': 0.7171466024852696, 'bull_strategy': 'mean_reversion', 'bull_bb_std_mult': 3.1546441602772397, 'bull_rsi_os': 12, 'bull_rsi_ob': 64, 'bull_adx_thresh': 12.763103917133055, 'bull_atr_min_pct': 0.01193168100015306, 'bull_atr_max_pct': 0.1424321425505512, 'bull_tp_mult': 1.69852573306557, 'bull_tsl_mult': 0.44860771275183414, 'bull_time_stop': 139, 'bull_use_sma': True, 'bull_use_ema': False, 'bull_use_atr': True, 'bull_use_adx': False, 'bull_use_spike': True, 'bull_rsi_required': True, 'bear_strategy': 'mean_reversion', 'bear_bb_std_mult': 2.711267425930342, 'bear_rsi_os': 33, 'bear_rsi_ob': 68, 'bear_adx_thresh': 8.210712386956398, 'bear_atr_min_pct': 0.001813310292578876, 'bear_atr_max_pct': 0.11716234200818046, 'bear_tp_mult': 2.4877919112017746, 'bear_tsl_mult': 0.1255712270106617, 'bear_time_stop': 126, 'bear_use_sma': False, 'bear_use_ema': False, 'bear_use_atr': True, 'bear_use_adx': False, 'bear_use_spike': True, 'bear_rsi_required': False, 'sideways_strategy': 'mean_reversion', 'sideways_bb_std_mult': 3.3111436873675117, 'sideways_rsi_os': 9, 'sideways_rsi_ob': 92, 'sideways_adx_thresh': 18.294920846719297, 'sideways_atr_min_pct': 0.0019034678301986423, 'sideways_atr_max_pct': 0.1087081728121599, 'sideways_tp_mult': 2.3321999093813903, 'sideways_tsl_mult': 0.043726215146533964, 'sideways_time_stop': 192, 'sideways_use_sma': True, 'sideways_use_ema': True, 'sideways_use_atr': True, 'sideways_use_adx': True, 'sideways_use_spike': False, 'sideways_rsi_required': False}.
[I 2025-09-01 14:25:44,262] Trial 398 finished with values: [-0.04246146526706984, 0.0421342052419689] and parameters: {'p_sma': 29, 'p_std': 27, 'p_atr': 27, 'p_adx': 13, 'rsi_period': 15, 'ema1': 10, 'ema2': 47, 'slip_atr_k': 0.018806544334318977, 'slip_spread_k': 0.5787296366663884, 'spread_hl_frac': 0.009887037803630217, 'bb_std_mult': 3.4077748968096175, 'rsi_os': 42, 'rsi_ob': 53, 'vol_spike': 0.09528584311066096, 'adx_thresh': 6.189678080940148, 'atr_min_pct': 0.011457513370542391, 'atr_max_pct': 0.02979062058581674, 'tp_mult': 1.3108098143746634, 'tsl_mult': 0.7651683964051705, 'strategy': 'mean_reversion', 'time_stop': 122, 'use_sma': False, 'use_atr': False, 'use_adx': True, 'use_ema': True, 'use_spike': True, 'rsi_required': True, 'edge_k': 1.9521574815857776, 'edge_cap': 0.733218721549895, 'bull_strategy': 'mean_reversion', 'bull_bb_std_mult': 2.874532582612898, 'bull_rsi_os': 12, 'bull_rsi_ob': 46, 'bull_adx_thresh': 18.137123128908218, 'bull_atr_min_pct': 0.005894428540989679, 'bull_atr_max_pct': 0.12404655068637124, 'bull_tp_mult': 1.653600689264031, 'bull_tsl_mult': 0.8114661760854595, 'bull_time_stop': 153, 'bull_use_sma': True, 'bull_use_ema': False, 'bull_use_atr': True, 'bull_use_adx': False, 'bull_use_spike': True, 'bull_rsi_required': True, 'bear_strategy': 'mean_reversion', 'bear_bb_std_mult': 2.7398163781409015, 'bear_rsi_os': 40, 'bear_rsi_ob': 59, 'bear_adx_thresh': 8.092996215105726, 'bear_atr_min_pct': 0.0021661175154966124, 'bear_atr_max_pct': 0.11521047624880303, 'bear_tp_mult': 2.0275056935837563, 'bear_tsl_mult': 0.6013738607620438, 'bear_time_stop': 104, 'bear_use_sma': False, 'bear_use_ema': False, 'bear_use_atr': True, 'bear_use_adx': False, 'bear_use_spike': True, 'bear_rsi_required': False, 'sideways_strategy': 'mean_reversion', 'sideways_bb_std_mult': 2.6694300130688235, 'sideways_rsi_os': 9, 'sideways_rsi_ob': 91, 'sideways_adx_thresh': 34.779120230765294, 'sideways_atr_min_pct': 0.0021456569221403794, 'sideways_atr_max_pct': 0.10933988450642225, 'sideways_tp_mult': 2.3196925694598978, 'sideways_tsl_mult': 0.048619572574994496, 'sideways_time_stop': 253, 'sideways_use_sma': True, 'sideways_use_ema': True, 'sideways_use_atr': True, 'sideways_use_adx': True, 'sideways_use_spike': False, 'sideways_rsi_required': False}.
[I 2025-09-01 14:26:18,876] Trial 401 finished with values: [-0.10318144747630487, 0.10306017029458815] and parameters: {'p_sma': 48, 'p_std': 28, 'p_atr': 16, 'p_adx': 9, 'rsi_period': 42, 'ema1': 10, 'ema2': 18, 'slip_atr_k': 0.019094664517192703, 'slip_spread_k': 0.5771823323357376, 'spread_hl_frac': 0.014292727341745524, 'bb_std_mult': 3.5368280085389987, 'rsi_os': 17, 'rsi_ob': 53, 'vol_spike': 0.1958465677713308, 'adx_thresh': 6.119214184523239, 'atr_min_pct': 0.011456161386576028, 'atr_max_pct': 0.043395790161780634, 'tp_mult': 1.447545677373118, 'tsl_mult': 0.7025505677761584, 'strategy': 'mean_reversion', 'time_stop': 122, 'use_sma': False, 'use_atr': False, 'use_adx': True, 'use_ema': True, 'use_spike': False, 'rsi_required': True, 'edge_k': 1.3911154077149055, 'edge_cap': 0.7419160361340882, 'bull_strategy': 'breakout', 'bull_bb_std_mult': 2.909921689526177, 'bull_rsi_os': 14, 'bull_rsi_ob': 46, 'bull_adx_thresh': 24.858562691625078, 'bull_atr_min_pct': 0.011771578217311004, 'bull_atr_max_pct': 0.04297092318316529, 'bull_tp_mult': 2.0616798101787355, 'bull_tsl_mult': 0.8788717422832061, 'bull_time_stop': 152, 'bull_use_sma': True, 'bull_use_ema': False, 'bull_use_atr': True, 'bull_use_adx': False, 'bull_use_spike': True, 'bull_rsi_required': True, 'bear_strategy': 'mean_reversion', 'bear_bb_std_mult': 2.6826185659199004, 'bear_rsi_os': 45, 'bear_rsi_ob': 61, 'bear_adx_thresh': 9.29413177340969, 'bear_atr_min_pct': 0.0037088711788636443, 'bear_atr_max_pct': 0.11688474316738791, 'bear_tp_mult': 2.015128731303716, 'bear_tsl_mult': 0.6994882470359064, 'bear_time_stop': 126, 'bear_use_sma': False, 'bear_use_ema': False, 'bear_use_atr': True, 'bear_use_adx': False, 'bear_use_spike': True, 'bear_rsi_required': False, 'sideways_strategy': 'mean_reversion', 'sideways_bb_std_mult': 2.503824902795454, 'sideways_rsi_os': 46, 'sideways_rsi_ob': 92, 'sideways_adx_thresh': 17.988133672678842, 'sideways_atr_min_pct': 0.0019185624652084915, 'sideways_atr_max_pct': 0.11334610986170622, 'sideways_tp_mult': 2.3621168502265615, 'sideways_tsl_mult': 0.8688553619965556, 'sideways_time_stop': 250, 'sideways_use_sma': True, 'sideways_use_ema': False, 'sideways_use_atr': True, 'sideways_use_adx': True, 'sideways_use_spike': False, 'sideways_rsi_required': False}.
[I 2025-09-01 14:26:20,495] Trial 402 finished with values: [0.0002673181146948256, 0.00656510113607136] and parameters: {'p_sma': 48, 'p_std': 24, 'p_atr': 12, 'p_adx': 7, 'rsi_period': 78, 'ema1': 26, 'ema2': 45, 'slip_atr_k': 0.02213959111331927, 'slip_spread_k': 0.5284518376259898, 'spread_hl_frac': 0.008905094000359612, 'bb_std_mult': 2.436440709251242, 'rsi_os': 26, 'rsi_ob': 95, 'vol_spike': 0.2913598748494153, 'adx_thresh': 6.39501702001032, 'atr_min_pct': 0.008385621701034154, 'atr_max_pct': 0.09657046941664438, 'tp_mult': 2.9045898472406533, 'tsl_mult': 0.6851327608912181, 'strategy': 'mean_reversion', 'time_stop': 115, 'use_sma': True, 'use_atr': False, 'use_adx': True, 'use_ema': True, 'use_spike': False, 'rsi_required': True, 'edge_k': 0.9523284093333453, 'edge_cap': 0.9694464431275759, 'bull_strategy': 'breakout', 'bull_bb_std_mult': 3.39798959543329, 'bull_rsi_os': 46, 'bull_rsi_ob': 45, 'bull_adx_thresh': 11.470774563901308, 'bull_atr_min_pct': 0.02575975491816381, 'bull_atr_max_pct': 0.11969356583235465, 'bull_tp_mult': 2.282704742152115, 'bull_tsl_mult': 0.8806962829898712, 'bull_time_stop': 150, 'bull_use_sma': False, 'bull_use_ema': True, 'bull_use_atr': True, 'bull_use_adx': True, 'bull_use_spike': True, 'bull_rsi_required': True, 'bear_strategy': 'mean_reversion', 'bear_bb_std_mult': 2.3476281704219883, 'bear_rsi_os': 36, 'bear_rsi_ob': 56, 'bear_adx_thresh': 29.568236312058822, 'bear_atr_min_pct': 0.0038512758656807293, 'bear_atr_max_pct': 0.12034058462148899, 'bear_tp_mult': 2.1397211061101644, 'bear_tsl_mult': 0.5254168069675728, 'bear_time_stop': 89, 'bear_use_sma': False, 'bear_use_ema': False, 'bear_use_atr': False, 'bear_use_adx': False, 'bear_use_spike': True, 'bear_rsi_required': False, 'sideways_strategy': 'mean_reversion', 'sideways_bb_std_mult': 2.1745470876099, 'sideways_rsi_os': 33, 'sideways_rsi_ob': 88, 'sideways_adx_thresh': 13.990128695279175, 'sideways_atr_min_pct': 0.026698373937604096, 'sideways_atr_max_pct': 0.02344026602360052, 'sideways_tp_mult': 2.441371715454858, 'sideways_tsl_mult': 0.42174129580503494, 'sideways_time_stop': 204, 'sideways_use_sma': True, 'sideways_use_ema': False, 'sideways_use_atr': True, 'sideways_use_adx': True, 'sideways_use_spike': True, 'sideways_rsi_required': False}.
[I 2025-09-01 14:26:21,281] Trial 404 finished with values: [-1000000000.0, 1000000000.0] and parameters: {'p_sma': 54, 'p_std': 48, 'p_atr': 12, 'p_adx': 7, 'rsi_period': 78, 'ema1': 10, 'ema2': 14, 'slip_atr_k': 0.025390028590222657, 'slip_spread_k': 0.5278136150588889, 'spread_hl_frac': 0.008437689621203668, 'bb_std_mult': 2.4252613241077334, 'rsi_os': 26, 'rsi_ob': 52, 'vol_spike': 0.23087265927465406, 'adx_thresh': 27.26537695388167, 'atr_min_pct': 0.025341237587504742, 'atr_max_pct': 0.025966796411892163, 'tp_mult': 1.4627066824798616, 'tsl_mult': 0.7026156753906393, 'strategy': 'mean_reversion', 'time_stop': 203, 'use_sma': True, 'use_atr': False, 'use_adx': True, 'use_ema': True, 'use_spike': False, 'rsi_required': True, 'edge_k': 1.6995902005285655, 'edge_cap': 0.9701878661897178, 'bull_strategy': 'breakout', 'bull_bb_std_mult': 3.402117399791534, 'bull_rsi_os': 46, 'bull_rsi_ob': 77, 'bull_adx_thresh': 11.159106134027502, 'bull_atr_min_pct': 0.01656236567139882, 'bull_atr_max_pct': 0.11960485853208067, 'bull_tp_mult': 1.5768712449187055, 'bull_tsl_mult': 0.4541344998697676, 'bull_time_stop': 132, 'bull_use_sma': False, 'bull_use_ema': True, 'bull_use_atr': True, 'bull_use_adx': True, 'bull_use_spike': True, 'bull_rsi_required': True, 'bear_strategy': 'mean_reversion', 'bear_bb_std_mult': 2.337012061252043, 'bear_rsi_os': 45, 'bear_rsi_ob': 56, 'bear_adx_thresh': 19.337951868554303, 'bear_atr_min_pct': 0.022073815707847593, 'bear_atr_max_pct': 0.02333737932803821, 'bear_tp_mult': 1.6225248110212123, 'bear_tsl_mult': 0.7028900778833136, 'bear_time_stop': 261, 'bear_use_sma': True, 'bear_use_ema': False, 'bear_use_atr': False, 'bear_use_adx': False, 'bear_use_spike': True, 'bear_rsi_required': False, 'sideways_strategy': 'mean_reversion', 'sideways_bb_std_mult': 2.816413944707132, 'sideways_rsi_os': 31, 'sideways_rsi_ob': 62, 'sideways_adx_thresh': 25.367417027205178, 'sideways_atr_min_pct': 0.005605979806123722, 'sideways_atr_max_pct': 0.04819753694153796, 'sideways_tp_mult': 2.4433529006052637, 'sideways_tsl_mult': 0.42289812238188923, 'sideways_time_stop': 57, 'sideways_use_sma': True, 'sideways_use_ema': False, 'sideways_use_atr': False, 'sideways_use_adx': True, 'sideways_use_spike': True, 'sideways_rsi_required': False}.
[I 2025-09-01 14:26:21,743] Trial 403 finished with values: [-0.0028178891022371255, 0.01118910935401941] and parameters: {'p_sma': 27, 'p_std': 43, 'p_atr': 29, 'p_adx': 7, 'rsi_period': 78, 'ema1': 10, 'ema2': 45, 'slip_atr_k': 0.02356884094996209, 'slip_spread_k': 0.5230345541451387, 'spread_hl_frac': 0.014296825723124183, 'bb_std_mult': 3.532428511276287, 'rsi_os': 25, 'rsi_ob': 95, 'vol_spike': 0.19343616060655344, 'adx_thresh': 27.35960781730615, 'atr_min_pct': 0.0011061957299507274, 'atr_max_pct': 0.025715616388739586, 'tp_mult': 1.243198830239264, 'tsl_mult': 0.7008004876596441, 'strategy': 'mean_reversion', 'time_stop': 115, 'use_sma': True, 'use_atr': False, 'use_adx': True, 'use_ema': True, 'use_spike': False, 'rsi_required': True, 'edge_k': 1.3902824282678168, 'edge_cap': 0.9667302152360496, 'bull_strategy': 'breakout', 'bull_bb_std_mult': 2.8857291350161454, 'bull_rsi_os': 15, 'bull_rsi_ob': 45, 'bull_adx_thresh': 5.802844539520107, 'bull_atr_min_pct': 0.029208839665055414, 'bull_atr_max_pct': 0.11904110638533735, 'bull_tp_mult': 1.5744806331272327, 'bull_tsl_mult': 0.4574525626328066, 'bull_time_stop': 149, 'bull_use_sma': False, 'bull_use_ema': True, 'bull_use_atr': True, 'bull_use_adx': True, 'bull_use_spike': True, 'bull_rsi_required': True, 'bear_strategy': 'mean_reversion', 'bear_bb_std_mult': 2.4848847719540874, 'bear_rsi_os': 47, 'bear_rsi_ob': 89, 'bear_adx_thresh': 33.56961575803328, 'bear_atr_min_pct': 0.0036208482093166355, 'bear_atr_max_pct': 0.1321037962813849, 'bear_tp_mult': 2.133459488764581, 'bear_tsl_mult': 0.5104435031743599, 'bear_time_stop': 87, 'bear_use_sma': False, 'bear_use_ema': False, 'bear_use_atr': False, 'bear_use_adx': False, 'bear_use_spike': True, 'bear_rsi_required': False, 'sideways_strategy': 'mean_reversion', 'sideways_bb_std_mult': 3.4662885521416102, 'sideways_rsi_os': 31, 'sideways_rsi_ob': 88, 'sideways_adx_thresh': 34.94984687093124, 'sideways_atr_min_pct': 0.00530256935711023, 'sideways_atr_max_pct': 0.013503291696500969, 'sideways_tp_mult': 2.451787222716268, 'sideways_tsl_mult': 0.42999820755912943, 'sideways_time_stop': 127, 'sideways_use_sma': True, 'sideways_use_ema': False, 'sideways_use_atr': True, 'sideways_use_adx': True, 'sideways_use_spike': True, 'sideways_rsi_required': False}.
