[I 2025-09-01 13:51:27,783] Trial 159 finished with values: [-1000000000.0, 1000000000.0] and parameters: {'p_sma': 10, 'p_std': 45, 'p_atr': 27, 'p_adx': 7, 'rsi_period': 58, 'ema1': 26, 'ema2': 28, 'slip_atr_k': 0.23068347189408853, 'slip_spread_k': 0.23232036928202815, 'spread_hl_frac': 0.04876218243135087, 'bb_std_mult': 1.8417220454691572, 'rsi_os': 45, 'rsi_ob': 69, 'vol_spike': 0.1428083059191623, 'adx_thresh': 31.78596874141558, 'atr_min_pct': 0.019093711566713377, 'atr_max_pct': 0.0546541582107636, 'tp_mult': 2.995347879267893, 'tsl_mult': 0.8686704595810546, 'strategy': 'breakout', 'time_stop': 222, 'use_sma': True, 'use_atr': True, 'use_adx': False, 'use_ema': True, 'use_spike': True, 'rsi_required': False, 'edge_k': 1.5737013188078655, 'edge_cap': 0.9519233306605055, 'bull_strategy': 'breakout', 'bull_bb_std_mult': 1.281693062696712, 'bull_rsi_os': 10, 'bull_rsi_ob': 94, 'bull_adx_thresh': 11.326018115597343, 'bull_atr_min_pct': 0.008281124461079448, 'bull_atr_max_pct': 0.1444924093444879, 'bull_tp_mult': 2.9239511382845524, 'bull_tsl_mult': 0.7490574156213339, 'bull_time_stop': 75, 'bull_use_sma': False, 'bull_use_ema': True, 'bull_use_atr': False, 'bull_use_adx': True, 'bull_use_spike': False, 'bull_rsi_required': False, 'bear_strategy': 'breakout', 'bear_bb_std_mult': 1.6651057904252784, 'bear_rsi_os': 12, 'bear_rsi_ob': 53, 'bear_adx_thresh': 30.702581664663406, 'bear_atr_min_pct': 0.005794023621866614, 'bear_atr_max_pct': 0.07720203550984403, 'bear_tp_mult': 1.1258729292929606, 'bear_tsl_mult': 0.9287663288271633, 'bear_time_stop': 105, 'bear_use_sma': False, 'bear_use_ema': True, 'bear_use_atr': True, 'bear_use_adx': False, 'bear_use_spike': False, 'bear_rsi_required': False, 'sideways_strategy': 'breakout', 'sideways_bb_std_mult': 1.0845047918454462, 'sideways_rsi_os': 37, 'sideways_rsi_ob': 52, 'sideways_adx_thresh': 7.209244364081599, 'sideways_atr_min_pct': 0.01203882422456386, 'sideways_atr_max_pct': 0.11827214421004052, 'sideways_tp_mult': 1.8591848013106542, 'sideways_tsl_mult': 0.6758619046633524, 'sideways_time_stop': 104, 'sideways_use_sma': False, 'sideways_use_ema': True, 'sideways_use_atr': True, 'sideways_use_adx': False, 'sideways_use_spike': False, 'sideways_rsi_required': False}.
[I 2025-09-01 13:51:28,246] Trial 161 finished with values: [-0.0776416442795862, 0.0776696213632325] and parameters: {'p_sma': 15, 'p_std': 45, 'p_atr': 7, 'p_adx': 18, 'rsi_period': 21, 'ema1': 9, 'ema2': 31, 'slip_atr_k': 0.15541318703872653, 'slip_spread_k': 0.23651656161209372, 'spread_hl_frac': 0.008324249056726298, 'bb_std_mult': 1.84031766832319, 'rsi_os': 45, 'rsi_ob': 64, 'vol_spike': 0.12262626289520707, 'adx_thresh': 23.473717182191997, 'atr_min_pct': 0.01901877757108401, 'atr_max_pct': 0.061296816039001716, 'tp_mult': 1.8629172798639466, 'tsl_mult': 0.04733962158269265, 'strategy': 'breakout', 'time_stop': 104, 'use_sma': True, 'use_atr': True, 'use_adx': False, 'use_ema': False, 'use_spike': True, 'rsi_required': False, 'edge_k': 1.0740171177222815, 'edge_cap': 0.4683392087465379, 'bull_strategy': 'breakout', 'bull_bb_std_mult': 1.1978570875495607, 'bull_rsi_os': 19, 'bull_rsi_ob': 81, 'bull_adx_thresh': 9.461506376286195, 'bull_atr_min_pct': 0.013469797013220246, 'bull_atr_max_pct': 0.1290144418054955, 'bull_tp_mult': 1.3228567226175103, 'bull_tsl_mult': 0.16904473468655734, 'bull_time_stop': 159, 'bull_use_sma': False, 'bull_use_ema': True, 'bull_use_atr': False, 'bull_use_adx': True, 'bull_use_spike': False, 'bull_rsi_required': False, 'bear_strategy': 'breakout', 'bear_bb_std_mult': 2.9310657716614568, 'bear_rsi_os': 21, 'bear_rsi_ob': 53, 'bear_adx_thresh': 7.6887026945024965, 'bear_atr_min_pct': 0.002120016502353614, 'bear_atr_max_pct': 0.03430065494614533, 'bear_tp_mult': 1.0121656830174217, 'bear_tsl_mult': 0.09033633617503187, 'bear_time_stop': 68, 'bear_use_sma': False, 'bear_use_ema': True, 'bear_use_atr': True, 'bear_use_adx': False, 'bear_use_spike': False, 'bear_rsi_required': False, 'sideways_strategy': 'breakout', 'sideways_bb_std_mult': 2.4584257197826207, 'sideways_rsi_os': 37, 'sideways_rsi_ob': 52, 'sideways_adx_thresh': 28.722369968350304, 'sideways_atr_min_pct': 0.01232446395401473, 'sideways_atr_max_pct': 0.11863985617089383, 'sideways_tp_mult': 1.6843300282221707, 'sideways_tsl_mult': 0.7056615952034548, 'sideways_time_stop': 124, 'sideways_use_sma': False, 'sideways_use_ema': True, 'sideways_use_atr': True, 'sideways_use_adx': False, 'sideways_use_spike': False, 'sideways_rsi_required': False}.
[I 2025-09-01 13:52:03,948] Trial 165 finished with values: [-1000000000.0, 1000000000.0] and parameters: {'p_sma': 15, 'p_std': 20, 'p_atr': 7, 'p_adx': 15, 'rsi_period': 27, 'ema1': 21, 'ema2': 27, 'slip_atr_k': 6.055868500916858e-05, 'slip_spread_k': 0.43052281415740357, 'spread_hl_frac': 0.007248936455863934, 'bb_std_mult': 1.9837866398597346, 'rsi_os': 27, 'rsi_ob': 75, 'vol_spike': 0.13063978641299087, 'adx_thresh': 22.371912393071714, 'atr_min_pct': 0.022854085292279017, 'atr_max_pct': 0.10875434306554961, 'tp_mult': 1.1260503453036628, 'tsl_mult': 0.029539002138721935, 'strategy': 'mean_reversion', 'time_stop': 225, 'use_sma': True, 'use_atr': True, 'use_adx': False, 'use_ema': False, 'use_spike': True, 'rsi_required': False, 'edge_k': 1.7250353786739994, 'edge_cap': 0.46636875345336787, 'bull_strategy': 'mean_reversion', 'bull_bb_std_mult': 1.1986843294013845, 'bull_rsi_os': 51, 'bull_rsi_ob': 54, 'bull_adx_thresh': 34.99347325679052, 'bull_atr_min_pct': 0.021864333740150576, 'bull_atr_max_pct': 0.01381115186336622, 'bull_tp_mult': 2.4960742349459295, 'bull_tsl_mult': 0.816637442726841, 'bull_time_stop': 105, 'bull_use_sma': False, 'bull_use_ema': True, 'bull_use_atr': False, 'bull_use_adx': True, 'bull_use_spike': True, 'bull_rsi_required': False, 'bear_strategy': 'breakout', 'bear_bb_std_mult': 2.7102683591111942, 'bear_rsi_os': 54, 'bear_rsi_ob': 52, 'bear_adx_thresh': 17.20357622189742, 'bear_atr_min_pct': 0.008884692320746443, 'bear_atr_max_pct': 0.1344557765942596, 'bear_tp_mult': 1.801047309749886, 'bear_tsl_mult': 0.9477508158576082, 'bear_time_stop': 60, 'bear_use_sma': False, 'bear_use_ema': False, 'bear_use_atr': False, 'bear_use_adx': True, 'bear_use_spike': True, 'bear_rsi_required': True, 'sideways_strategy': 'breakout', 'sideways_bb_std_mult': 3.3566809442916012, 'sideways_rsi_os': 32, 'sideways_rsi_ob': 87, 'sideways_adx_thresh': 27.59998660866265, 'sideways_atr_min_pct': 0.027185993755581558, 'sideways_atr_max_pct': 0.12260007975950525, 'sideways_tp_mult': 2.746845960576886, 'sideways_tsl_mult': 0.8007524079998487, 'sideways_time_stop': 82, 'sideways_use_sma': False, 'sideways_use_ema': True, 'sideways_use_atr': False, 'sideways_use_adx': False, 'sideways_use_spike': False, 'sideways_rsi_required': False}.
[I 2025-09-01 13:52:04,882] Trial 164 finished with values: [-1000000000.0, 1000000000.0] and parameters: {'p_sma': 40, 'p_std': 19, 'p_atr': 7, 'p_adx': 7, 'rsi_period': 27, 'ema1': 18, 'ema2': 28, 'slip_atr_k': 0.16991830116667195, 'slip_spread_k': 0.4231207348107806, 'spread_hl_frac': 0.007257708433153064, 'bb_std_mult': 2.018953227306784, 'rsi_os': 27, 'rsi_ob': 70, 'vol_spike': 0.09527553316717433, 'adx_thresh': 31.604744596931745, 'atr_min_pct': 0.015027102532361853, 'atr_max_pct': 0.0232850468893242, 'tp_mult': 1.9922433636945025, 'tsl_mult': 0.12198406565151126, 'strategy': 'mean_reversion', 'time_stop': 92, 'use_sma': True, 'use_atr': True, 'use_adx': False, 'use_ema': True, 'use_spike': True, 'rsi_required': False, 'edge_k': 1.465085876176751, 'edge_cap': 0.5004300887395394, 'bull_strategy': 'mean_reversion', 'bull_bb_std_mult': 1.1983211518776102, 'bull_rsi_os': 21, 'bull_rsi_ob': 94, 'bull_adx_thresh': 10.401487192160978, 'bull_atr_min_pct': 0.021513592297684892, 'bull_atr_max_pct': 0.12906537916198235, 'bull_tp_mult': 2.112348048878769, 'bull_tsl_mult': 0.1666609187036952, 'bull_time_stop': 220, 'bull_use_sma': False, 'bull_use_ema': True, 'bull_use_atr': False, 'bull_use_adx': True, 'bull_use_spike': True, 'bull_rsi_required': False, 'bear_strategy': 'breakout', 'bear_bb_std_mult': 1.8042289863497847, 'bear_rsi_os': 54, 'bear_rsi_ob': 52, 'bear_adx_thresh': 5.773270463408234, 'bear_atr_min_pct': 0.006900852137406147, 'bear_atr_max_pct': 0.0659763677095502, 'bear_tp_mult': 2.2811061491872837, 'bear_tsl_mult': 0.38969668121354006, 'bear_time_stop': 60, 'bear_use_sma': False, 'bear_use_ema': False, 'bear_use_atr': False, 'bear_use_adx': True, 'bear_use_spike': True, 'bear_rsi_required': True, 'sideways_strategy': 'breakout', 'sideways_bb_std_mult': 2.466194134209031, 'sideways_rsi_os': 36, 'sideways_rsi_ob': 86, 'sideways_adx_thresh': 27.727649120195004, 'sideways_atr_min_pct': 0.014603332565589837, 'sideways_atr_max_pct': 0.1154946655732588, 'sideways_tp_mult': 1.686884409136879, 'sideways_tsl_mult': 0.7143799246384356, 'sideways_time_stop': 102, 'sideways_use_sma': False, 'sideways_use_ema': True, 'sideways_use_atr': False, 'sideways_use_adx': False, 'sideways_use_spike': False, 'sideways_rsi_required': False}.
[I 2025-09-01 13:52:06,297] Trial 166 finished with values: [-0.05864562297149456, 0.06060507870677775] and parameters: {'p_sma': 40, 'p_std': 20, 'p_atr': 7, 'p_adx': 12, 'rsi_period': 27, 'ema1': 18, 'ema2': 16, 'slip_atr_k': 0.000813314030139012, 'slip_spread_k': 0.42195630539647166, 'spread_hl_frac': 0.022401303301878416, 'bb_std_mult': 1.9663784319977426, 'rsi_os': 43, 'rsi_ob': 76, 'vol_spike': 0.1185080220684065, 'adx_thresh': 22.247780903299944, 'atr_min_pct': 0.0150039404392784, 'atr_max_pct': 0.022396634734338342, 'tp_mult': 2.0005843895532207, 'tsl_mult': 0.7036256287992539, 'strategy': 'mean_reversion', 'time_stop': 93, 'use_sma': True, 'use_atr': False, 'use_adx': False, 'use_ema': False, 'use_spike': True, 'rsi_required': False, 'edge_k': 1.706740301631092, 'edge_cap': 0.6019864038059402, 'bull_strategy': 'mean_reversion', 'bull_bb_std_mult': 2.786591131238178, 'bull_rsi_os': 19, 'bull_rsi_ob': 54, 'bull_adx_thresh': 33.81621731956804, 'bull_atr_min_pct': 0.013583788460929593, 'bull_atr_max_pct': 0.1210329305097728, 'bull_tp_mult': 2.5971966962459256, 'bull_tsl_mult': 0.5637050062362773, 'bull_time_stop': 92, 'bull_use_sma': False, 'bull_use_ema': True, 'bull_use_atr': False, 'bull_use_adx': True, 'bull_use_spike': True, 'bull_rsi_required': False, 'bear_strategy': 'breakout', 'bear_bb_std_mult': 1.3008972327049104, 'bear_rsi_os': 13, 'bear_rsi_ob': 61, 'bear_adx_thresh': 12.829706153939052, 'bear_atr_min_pct': 0.0011322218361299401, 'bear_atr_max_pct': 0.03557336688877937, 'bear_tp_mult': 1.8274740116185884, 'bear_tsl_mult': 0.17392174361927154, 'bear_time_stop': 58, 'bear_use_sma': False, 'bear_use_ema': False, 'bear_use_atr': False, 'bear_use_adx': True, 'bear_use_spike': True, 'bear_rsi_required': True, 'sideways_strategy': 'breakout', 'sideways_bb_std_mult': 3.3543174110210345, 'sideways_rsi_os': 34, 'sideways_rsi_ob': 87, 'sideways_adx_thresh': 27.551011420305464, 'sideways_atr_min_pct': 0.027223273804262395, 'sideways_atr_max_pct': 0.02999685873916072, 'sideways_tp_mult': 2.7267479854279424, 'sideways_tsl_mult': 0.7986156272265454, 'sideways_time_stop': 251, 'sideways_use_sma': True, 'sideways_use_ema': True, 'sideways_use_atr': False, 'sideways_use_adx': False, 'sideways_use_spike': False, 'sideways_rsi_required': False}.
[I 2025-09-01 13:52:06,331] Trial 167 finished with values: [-0.057296741529180184, 0.058414723004923716] and parameters: {'p_sma': 40, 'p_std': 19, 'p_atr': 14, 'p_adx': 17, 'rsi_period': 27, 'ema1': 23, 'ema2': 27, 'slip_atr_k': 1.4116599535907897e-05, 'slip_spread_k': 0.4767324791643289, 'spread_hl_frac': 0.011331161924050452, 'bb_std_mult': 1.9690706578562378, 'rsi_os': 24, 'rsi_ob': 75, 'vol_spike': 0.09621943630347131, 'adx_thresh': 9.992435358981496, 'atr_min_pct': 0.016009465853483743, 'atr_max_pct': 0.1365859689500875, 'tp_mult': 1.7862073494239705, 'tsl_mult': 0.11302322755422117, 'strategy': 'mean_reversion', 'time_stop': 93, 'use_sma': True, 'use_atr': False, 'use_adx': True, 'use_ema': False, 'use_spike': True, 'rsi_required': False, 'edge_k': 1.1699276927970041, 'edge_cap': 0.6991775816545234, 'bull_strategy': 'mean_reversion', 'bull_bb_std_mult': 1.4283348417002684, 'bull_rsi_os': 51, 'bull_rsi_ob': 54, 'bull_adx_thresh': 10.26962532501601, 'bull_atr_min_pct': 0.0028940992943940445, 'bull_atr_max_pct': 0.036055868961240245, 'bull_tp_mult': 1.5139362591768395, 'bull_tsl_mult': 0.6082346777878603, 'bull_time_stop': 93, 'bull_use_sma': False, 'bull_use_ema': True, 'bull_use_atr': False, 'bull_use_adx': True, 'bull_use_spike': True, 'bull_rsi_required': True, 'bear_strategy': 'breakout', 'bear_bb_std_mult': 3.0910056651498827, 'bear_rsi_os': 15, 'bear_rsi_ob': 61, 'bear_adx_thresh': 17.61364772801251, 'bear_atr_min_pct': 6.480492823715545e-05, 'bear_atr_max_pct': 0.13652049781884634, 'bear_tp_mult': 1.8101947825879128, 'bear_tsl_mult': 0.6832204070057222, 'bear_time_stop': 48, 'bear_use_sma': False, 'bear_use_ema': False, 'bear_use_atr': False, 'bear_use_adx': True, 'bear_use_spike': True, 'bear_rsi_required': True, 'sideways_strategy': 'breakout', 'sideways_bb_std_mult': 1.3661152861603005, 'sideways_rsi_os': 34, 'sideways_rsi_ob': 87, 'sideways_adx_thresh': 30.419289048319747, 'sideways_atr_min_pct': 0.014641793003027774, 'sideways_atr_max_pct': 0.12250381968662591, 'sideways_tp_mult': 2.6579400802099715, 'sideways_tsl_mult': 0.7955413203245627, 'sideways_time_stop': 272, 'sideways_use_sma': True, 'sideways_use_ema': True, 'sideways_use_atr': False, 'sideways_use_adx': False, 'sideways_use_spike': False, 'sideways_rsi_required': False}.
[I 2025-09-01 13:52:43,789] Trial 171 finished with values: [-1000000000.0, 1000000000.0] and parameters: {'p_sma': 56, 'p_std': 41, 'p_atr': 15, 'p_adx': 14, 'rsi_period': 24, 'ema1': 8, 'ema2': 53, 'slip_atr_k': 0.011108435549765353, 'slip_spread_k': 0.5574798350006741, 'spread_hl_frac': 0.009340016476301363, 'bb_std_mult': 3.599420509708589, 'rsi_os': 21, 'rsi_ob': 78, 'vol_spike': 0.0068725821669735065, 'adx_thresh': 24.81239112536371, 'atr_min_pct': 0.003328178424576382, 'atr_max_pct': 0.013144325225988934, 'tp_mult': 1.5848424314257556, 'tsl_mult': 0.16598579233071264, 'strategy': 'breakout', 'time_stop': 114, 'use_sma': False, 'use_atr': True, 'use_adx': True, 'use_ema': False, 'use_spike': False, 'rsi_required': True, 'edge_k': 1.1945971359527214, 'edge_cap': 0.12575658053944383, 'bull_strategy': 'breakout', 'bull_bb_std_mult': 1.073168765332497, 'bull_rsi_os': 17, 'bull_rsi_ob': 52, 'bull_adx_thresh': 23.943789503696387, 'bull_atr_min_pct': 0.012561967475718708, 'bull_atr_max_pct': 0.07771607248680731, 'bull_tp_mult': 1.394681149651383, 'bull_tsl_mult': 0.4854314658699079, 'bull_time_stop': 83, 'bull_use_sma': True, 'bull_use_ema': False, 'bull_use_atr': True, 'bull_use_adx': False, 'bull_use_spike': False, 'bull_rsi_required': True, 'bear_strategy': 'mean_reversion', 'bear_bb_std_mult': 3.0443104944729082, 'bear_rsi_os': 19, 'bear_rsi_ob': 47, 'bear_adx_thresh': 6.368248348443377, 'bear_atr_min_pct': 0.00774718096263263, 'bear_atr_max_pct': 0.07325552891724339, 'bear_tp_mult': 1.9871808837349212, 'bear_tsl_mult': 0.7894575283012122, 'bear_time_stop': 11, 'bear_use_sma': True, 'bear_use_ema': True, 'bear_use_atr': False, 'bear_use_adx': True, 'bear_use_spike': False, 'bear_rsi_required': True, 'sideways_strategy': 'mean_reversion', 'sideways_bb_std_mult': 2.6839269277166258, 'sideways_rsi_os': 11, 'sideways_rsi_ob': 82, 'sideways_adx_thresh': 14.236228076149096, 'sideways_atr_min_pct': 0.000932434290342005, 'sideways_atr_max_pct': 0.11316723237091174, 'sideways_tp_mult': 1.96285992606648, 'sideways_tsl_mult': 0.18208201208718566, 'sideways_time_stop': 243, 'sideways_use_sma': False, 'sideways_use_ema': False, 'sideways_use_atr': True, 'sideways_use_adx': True, 'sideways_use_spike': True, 'sideways_rsi_required': True}.
[I 2025-09-01 13:52:43,817] Trial 170 finished with values: [-0.005811317842980279, 0.005660712345529307] and parameters: {'p_sma': 11, 'p_std': 38, 'p_atr': 15, 'p_adx': 26, 'rsi_period': 23, 'ema1': 21, 'ema2': 23, 'slip_atr_k': 0.010267274174060573, 'slip_spread_k': 0.8191865079451521, 'spread_hl_frac': 0.011711563542569695, 'bb_std_mult': 0.5814127944718066, 'rsi_os': 22, 'rsi_ob': 46, 'vol_spike': 0.2428883441840094, 'adx_thresh': 24.70594030744525, 'atr_min_pct': 0.01783287871937022, 'atr_max_pct': 0.11482267080819052, 'tp_mult': 2.109499940300145, 'tsl_mult': 0.1607004845620323, 'strategy': 'breakout', 'time_stop': 212, 'use_sma': True, 'use_atr': False, 'use_adx': True, 'use_ema': False, 'use_spike': False, 'rsi_required': True, 'edge_k': 1.1853637739587761, 'edge_cap': 0.6899630191598419, 'bull_strategy': 'breakout', 'bull_bb_std_mult': 1.441379402124267, 'bull_rsi_os': 17, 'bull_rsi_ob': 76, 'bull_adx_thresh': 10.15198101337618, 'bull_atr_min_pct': 0.0022693841849947376, 'bull_atr_max_pct': 0.03762276197928095, 'bull_tp_mult': 1.5022087580981254, 'bull_tsl_mult': 0.6084033212463239, 'bull_time_stop': 258, 'bull_use_sma': True, 'bull_use_ema': False, 'bull_use_atr': True, 'bull_use_adx': False, 'bull_use_spike': False, 'bull_rsi_required': True, 'bear_strategy': 'mean_reversion', 'bear_bb_std_mult': 2.2502217039831267, 'bear_rsi_os': 37, 'bear_rsi_ob': 94, 'bear_adx_thresh': 5.033979934395315, 'bear_atr_min_pct': 0.007603011250299396, 'bear_atr_max_pct': 0.07314161010597679, 'bear_tp_mult': 1.2462160246551015, 'bear_tsl_mult': 0.6149701173145775, 'bear_time_stop': 286, 'bear_use_sma': True, 'bear_use_ema': True, 'bear_use_atr': False, 'bear_use_adx': True, 'bear_use_spike': False, 'bear_rsi_required': True, 'sideways_strategy': 'breakout', 'sideways_bb_std_mult': 1.4007663163613646, 'sideways_rsi_os': 19, 'sideways_rsi_ob': 85, 'sideways_adx_thresh': 30.20194044442466, 'sideways_atr_min_pct': 0.009611772709856237, 'sideways_atr_max_pct': 0.07277880112744621, 'sideways_tp_mult': 2.5975170096569187, 'sideways_tsl_mult': 0.7629455033079777, 'sideways_time_stop': 241, 'sideways_use_sma': True, 'sideways_use_ema': False, 'sideways_use_atr': True, 'sideways_use_adx': True, 'sideways_use_spike': True, 'sideways_rsi_required': True}.
[I 2025-09-01 13:52:44,114] Trial 169 finished with values: [-0.024687670422484764, 0.024798701718015948] and parameters: {'p_sma': 57, 'p_std': 36, 'p_atr': 30, 'p_adx': 26, 'rsi_period': 18, 'ema1': 28, 'ema2': 52, 'slip_atr_k': 0.011938964072639287, 'slip_spread_k': 0.46907703228291975, 'spread_hl_frac': 0.011537064302235776, 'bb_std_mult': 1.9179525249471094, 'rsi_os': 38, 'rsi_ob': 73, 'vol_spike': 0.0015310361883036638, 'adx_thresh': 32.81493025610944, 'atr_min_pct': 0.016287386049691207, 'atr_max_pct': 0.13642034436064587, 'tp_mult': 1.8029996707360496, 'tsl_mult': 0.7290471798790394, 'strategy': 'breakout', 'time_stop': 97, 'use_sma': True, 'use_atr': False, 'use_adx': True, 'use_ema': False, 'use_spike': False, 'rsi_required': False, 'edge_k': 1.1725837617944654, 'edge_cap': 0.5439875403264878, 'bull_strategy': 'breakout', 'bull_bb_std_mult': 1.4379337512098154, 'bull_rsi_os': 16, 'bull_rsi_ob': 72, 'bull_adx_thresh': 30.857344749483993, 'bull_atr_min_pct': 0.012422158713723264, 'bull_atr_max_pct': 0.14947457599279507, 'bull_tp_mult': 1.8595420222190842, 'bull_tsl_mult': 0.3946241970388907, 'bull_time_stop': 89, 'bull_use_sma': True, 'bull_use_ema': False, 'bull_use_atr': True, 'bull_use_adx': False, 'bull_use_spike': False, 'bull_rsi_required': True, 'bear_strategy': 'breakout', 'bear_bb_std_mult': 0.7999845032865713, 'bear_rsi_os': 15, 'bear_rsi_ob': 62, 'bear_adx_thresh': 5.002816885447171, 'bear_atr_min_pct': 0.0012854390047268736, 'bear_atr_max_pct': 0.074074281853649, 'bear_tp_mult': 1.9931660309347412, 'bear_tsl_mult': 0.5116764798331612, 'bear_time_stop': 9, 'bear_use_sma': True, 'bear_use_ema': True, 'bear_use_atr': False, 'bear_use_adx': True, 'bear_use_spike': False, 'bear_rsi_required': True, 'sideways_strategy': 'breakout', 'sideways_bb_std_mult': 0.7107016995679616, 'sideways_rsi_os': 34, 'sideways_rsi_ob': 85, 'sideways_adx_thresh': 30.095375845937212, 'sideways_atr_min_pct': 0.013016561613583211, 'sideways_atr_max_pct': 0.056610228472074725, 'sideways_tp_mult': 2.602813255482415, 'sideways_tsl_mult': 0.7540130720433899, 'sideways_time_stop': 241, 'sideways_use_sma': True, 'sideways_use_ema': False, 'sideways_use_atr': True, 'sideways_use_adx': False, 'sideways_use_spike': True, 'sideways_rsi_required': True}.
