[I 2025-09-01 15:03:19,881] Trial 659 finished with values: [-1000000000.0, 1000000000.0] and parameters: {'p_sma': 33, 'p_std': 35, 'p_atr': 28, 'p_adx': 16, 'rsi_period': 77, 'ema1': 9, 'ema2': 59, 'slip_atr_k': 0.012769552126494494, 'slip_spread_k': 0.70357184625361, 'spread_hl_frac': 0.0015032824444081647, 'bb_std_mult': 3.5430564566756773, 'rsi_os': 55, 'rsi_ob': 54, 'vol_spike': 0.11760982752375344, 'adx_thresh': 6.450530636696199, 'atr_min_pct': 0.010566924870531706, 'atr_max_pct': 0.1042476422687458, 'tp_mult': 2.0805995956624606, 'tsl_mult': 0.7437898316194356, 'strategy': 'mean_reversion', 'time_stop': 300, 'use_sma': True, 'use_atr': False, 'use_adx': True, 'use_ema': True, 'use_spike': False, 'rsi_required': True, 'edge_k': 0.24449339011279314, 'edge_cap': 0.9997586147871753, 'bull_strategy': 'breakout', 'bull_bb_std_mult': 3.070992905550485, 'bull_rsi_os': 50, 'bull_rsi_ob': 81, 'bull_adx_thresh': 31.853070044327314, 'bull_atr_min_pct': 0.021942534244695597, 'bull_atr_max_pct': 0.12219323709515281, 'bull_tp_mult': 1.4739742390438928, 'bull_tsl_mult': 0.4945510983927406, 'bull_time_stop': 170, 'bull_use_sma': True, 'bull_use_ema': True, 'bull_use_atr': False, 'bull_use_adx': False, 'bull_use_spike': True, 'bull_rsi_required': True, 'bear_strategy': 'mean_reversion', 'bear_bb_std_mult': 1.5568759674500796, 'bear_rsi_os': 36, 'bear_rsi_ob': 75, 'bear_adx_thresh': 8.660378037388048, 'bear_atr_min_pct': 0.0021048448940999506, 'bear_atr_max_pct': 0.08777145559181922, 'bear_tp_mult': 2.0538617983125254, 'bear_tsl_mult': 0.14237306635394278, 'bear_time_stop': 88, 'bear_use_sma': True, 'bear_use_ema': False, 'bear_use_atr': False, 'bear_use_adx': False, 'bear_use_spike': True, 'bear_rsi_required': False, 'sideways_strategy': 'breakout', 'sideways_bb_std_mult': 2.9554809818059953, 'sideways_rsi_os': 28, 'sideways_rsi_ob': 92, 'sideways_adx_thresh': 22.36213993499194, 'sideways_atr_min_pct': 0.004838389052403587, 'sideways_atr_max_pct': 0.10746976579817541, 'sideways_tp_mult': 2.419721580791676, 'sideways_tsl_mult': 0.3929831727657906, 'sideways_time_stop': 77, 'sideways_use_sma': False, 'sideways_use_ema': False, 'sideways_use_atr': True, 'sideways_use_adx': True, 'sideways_use_spike': False, 'sideways_rsi_required': False}.
[I 2025-09-01 15:04:00,726] Trial 657 finished with values: [-0.007378468800858573, 0.010128201532311086] and parameters: {'p_sma': 33, 'p_std': 29, 'p_atr': 28, 'p_adx': 16, 'rsi_period': 80, 'ema1': 28, 'ema2': 56, 'slip_atr_k': 0.012836029038684534, 'slip_spread_k': 0.5638192951298221, 'spread_hl_frac': 0.008639032322563675, 'bb_std_mult': 2.4242855551324385, 'rsi_os': 42, 'rsi_ob': 54, 'vol_spike': 0.0962606870121451, 'adx_thresh': 6.528205255906946, 'atr_min_pct': 0.02826192428385344, 'atr_max_pct': 0.10391327454814352, 'tp_mult': 2.435579591941866, 'tsl_mult': 0.7344839601988152, 'strategy': 'mean_reversion', 'time_stop': 92, 'use_sma': True, 'use_atr': False, 'use_adx': True, 'use_ema': True, 'use_spike': False, 'rsi_required': True, 'edge_k': 1.4571869921166403, 'edge_cap': 0.9841795156883104, 'bull_strategy': 'breakout', 'bull_bb_std_mult': 2.560509811949335, 'bull_rsi_os': 27, 'bull_rsi_ob': 78, 'bull_adx_thresh': 8.433800796365842, 'bull_atr_min_pct': 0.021960923186831013, 'bull_atr_max_pct': 0.12298405329453369, 'bull_tp_mult': 1.1289952799481853, 'bull_tsl_mult': 0.4898239908603886, 'bull_time_stop': 238, 'bull_use_sma': True, 'bull_use_ema': True, 'bull_use_atr': False, 'bull_use_adx': False, 'bull_use_spike': True, 'bull_rsi_required': True, 'bear_strategy': 'mean_reversion', 'bear_bb_std_mult': 1.588603524335442, 'bear_rsi_os': 36, 'bear_rsi_ob': 49, 'bear_adx_thresh': 8.863622506558206, 'bear_atr_min_pct': 0.0013496070773582605, 'bear_atr_max_pct': 0.11259480227650226, 'bear_tp_mult': 1.8270511995450678, 'bear_tsl_mult': 0.14663489652785897, 'bear_time_stop': 139, 'bear_use_sma': True, 'bear_use_ema': False, 'bear_use_atr': False, 'bear_use_adx': False, 'bear_use_spike': True, 'bear_rsi_required': False, 'sideways_strategy': 'breakout', 'sideways_bb_std_mult': 2.7754510690675844, 'sideways_rsi_os': 49, 'sideways_rsi_ob': 92, 'sideways_adx_thresh': 17.786027858917844, 'sideways_atr_min_pct': 0.02500464771732933, 'sideways_atr_max_pct': 0.10781368809582532, 'sideways_tp_mult': 2.407466124187645, 'sideways_tsl_mult': 0.38287841368938935, 'sideways_time_stop': 255, 'sideways_use_sma': False, 'sideways_use_ema': False, 'sideways_use_atr': True, 'sideways_use_adx': True, 'sideways_use_spike': False, 'sideways_rsi_required': False}.
[I 2025-09-01 15:04:01,832] Trial 658 finished with values: [-0.015386427509581746, 0.016995620772171868] and parameters: {'p_sma': 33, 'p_std': 44, 'p_atr': 28, 'p_adx': 16, 'rsi_period': 56, 'ema1': 9, 'ema2': 59, 'slip_atr_k': 0.01218924656261659, 'slip_spread_k': 0.7026099510209833, 'spread_hl_frac': 0.028281660942168576, 'bb_std_mult': 3.5360524882357716, 'rsi_os': 18, 'rsi_ob': 54, 'vol_spike': 0.29994106848521035, 'adx_thresh': 6.437153873276042, 'atr_min_pct': 0.008592947885056157, 'atr_max_pct': 0.022589844018634418, 'tp_mult': 2.0734197866443904, 'tsl_mult': 0.7451420360509269, 'strategy': 'mean_reversion', 'time_stop': 112, 'use_sma': True, 'use_atr': False, 'use_adx': True, 'use_ema': True, 'use_spike': False, 'rsi_required': True, 'edge_k': 1.4665708727001225, 'edge_cap': 0.5848999196187217, 'bull_strategy': 'breakout', 'bull_bb_std_mult': 3.0385798578627043, 'bull_rsi_os': 10, 'bull_rsi_ob': 64, 'bull_adx_thresh': 28.0739883689316, 'bull_atr_min_pct': 0.020694161284969308, 'bull_atr_max_pct': 0.025551069805164077, 'bull_tp_mult': 1.4825337876429796, 'bull_tsl_mult': 0.5273540005191122, 'bull_time_stop': 112, 'bull_use_sma': True, 'bull_use_ema': True, 'bull_use_atr': False, 'bull_use_adx': False, 'bull_use_spike': True, 'bull_rsi_required': True, 'bear_strategy': 'mean_reversion', 'bear_bb_std_mult': 3.1240629194440963, 'bear_rsi_os': 36, 'bear_rsi_ob': 91, 'bear_adx_thresh': 8.819990590034996, 'bear_atr_min_pct': 0.0013094463309342276, 'bear_atr_max_pct': 0.08673009602074529, 'bear_tp_mult': 2.056783729126897, 'bear_tsl_mult': 0.34505181527454565, 'bear_time_stop': 192, 'bear_use_sma': True, 'bear_use_ema': False, 'bear_use_atr': False, 'bear_use_adx': False, 'bear_use_spike': True, 'bear_rsi_required': False, 'sideways_strategy': 'breakout', 'sideways_bb_std_mult': 2.8369261579778184, 'sideways_rsi_os': 28, 'sideways_rsi_ob': 63, 'sideways_adx_thresh': 23.944964713985136, 'sideways_atr_min_pct': 0.004684668455237928, 'sideways_atr_max_pct': 0.0837154539668705, 'sideways_tp_mult': 2.411213223161414, 'sideways_tsl_mult': 0.35957061251867506, 'sideways_time_stop': 256, 'sideways_use_sma': False, 'sideways_use_ema': False, 'sideways_use_atr': True, 'sideways_use_adx': True, 'sideways_use_spike': False, 'sideways_rsi_required': False}.
[I 2025-09-01 15:04:02,274] Trial 660 finished with values: [-0.05790533742661841, 0.05913638193055127] and parameters: {'p_sma': 59, 'p_std': 35, 'p_atr': 29, 'p_adx': 16, 'rsi_period': 66, 'ema1': 9, 'ema2': 56, 'slip_atr_k': 0.2239294065976304, 'slip_spread_k': 0.14286014647949424, 'spread_hl_frac': 0.00820563326334183, 'bb_std_mult': 3.525263884041217, 'rsi_os': 18, 'rsi_ob': 58, 'vol_spike': 0.0979931773884373, 'adx_thresh': 6.507999068640418, 'atr_min_pct': 0.008701242848892234, 'atr_max_pct': 0.028033313221612934, 'tp_mult': 1.4567825185262246, 'tsl_mult': 0.706765828032951, 'strategy': 'mean_reversion', 'time_stop': 30, 'use_sma': True, 'use_atr': False, 'use_adx': True, 'use_ema': True, 'use_spike': False, 'rsi_required': True, 'edge_k': 1.7539993934950182, 'edge_cap': 0.27086793077569266, 'bull_strategy': 'breakout', 'bull_bb_std_mult': 3.050666154212997, 'bull_rsi_os': 10, 'bull_rsi_ob': 81, 'bull_adx_thresh': 14.322262187977024, 'bull_atr_min_pct': 0.0026193754927788925, 'bull_atr_max_pct': 0.12145607506054064, 'bull_tp_mult': 1.455611717108992, 'bull_tsl_mult': 0.49000227756440967, 'bull_time_stop': 170, 'bull_use_sma': True, 'bull_use_ema': True, 'bull_use_atr': False, 'bull_use_adx': False, 'bull_use_spike': True, 'bull_rsi_required': True, 'bear_strategy': 'mean_reversion', 'bear_bb_std_mult': 1.5957720875446422, 'bear_rsi_os': 31, 'bear_rsi_ob': 57, 'bear_adx_thresh': 7.201111377772031, 'bear_atr_min_pct': 0.0013796671402809448, 'bear_atr_max_pct': 0.11241781277903008, 'bear_tp_mult': 2.0522423203223226, 'bear_tsl_mult': 0.14556752334399659, 'bear_time_stop': 191, 'bear_use_sma': True, 'bear_use_ema': False, 'bear_use_atr': False, 'bear_use_adx': False, 'bear_use_spike': True, 'bear_rsi_required': True, 'sideways_strategy': 'breakout', 'sideways_bb_std_mult': 3.045330352759911, 'sideways_rsi_os': 28, 'sideways_rsi_ob': 92, 'sideways_adx_thresh': 17.60890371576955, 'sideways_atr_min_pct': 0.02495419341639822, 'sideways_atr_max_pct': 0.1084288798264713, 'sideways_tp_mult': 2.409466781317477, 'sideways_tsl_mult': 0.3573517056729203, 'sideways_time_stop': 256, 'sideways_use_sma': False, 'sideways_use_ema': False, 'sideways_use_atr': True, 'sideways_use_adx': True, 'sideways_use_spike': False, 'sideways_rsi_required': False}.
[I 2025-09-01 15:04:02,838] Trial 661 finished with values: [0.0010342349270375806, 0.005348806995503574] and parameters: {'p_sma': 60, 'p_std': 29, 'p_atr': 28, 'p_adx': 7, 'rsi_period': 80, 'ema1': 9, 'ema2': 57, 'slip_atr_k': 0.005635854044133104, 'slip_spread_k': 0.14645179119445956, 'spread_hl_frac': 0.008603474706374802, 'bb_std_mult': 3.5092379496042296, 'rsi_os': 43, 'rsi_ob': 57, 'vol_spike': 0.09877838773985514, 'adx_thresh': 5.689399124837932, 'atr_min_pct': 0.018829188008386916, 'atr_max_pct': 0.029201257994155273, 'tp_mult': 1.4591004338573526, 'tsl_mult': 0.3583303644738257, 'strategy': 'mean_reversion', 'time_stop': 121, 'use_sma': True, 'use_atr': True, 'use_adx': True, 'use_ema': True, 'use_spike': False, 'rsi_required': True, 'edge_k': 0.2405457055763523, 'edge_cap': 0.27069979279108725, 'bull_strategy': 'breakout', 'bull_bb_std_mult': 3.0129226333299752, 'bull_rsi_os': 32, 'bull_rsi_ob': 64, 'bull_adx_thresh': 13.608554348047294, 'bull_atr_min_pct': 0.012518557557052577, 'bull_atr_max_pct': 0.11900656359063419, 'bull_tp_mult': 1.5891563075079953, 'bull_tsl_mult': 0.5305677115527025, 'bull_time_stop': 156, 'bull_use_sma': True, 'bull_use_ema': True, 'bull_use_atr': False, 'bull_use_adx': True, 'bull_use_spike': True, 'bull_rsi_required': True, 'bear_strategy': 'mean_reversion', 'bear_bb_std_mult': 2.215718156243941, 'bear_rsi_os': 34, 'bear_rsi_ob': 57, 'bear_adx_thresh': 7.140782714816833, 'bear_atr_min_pct': 0.0012617685570184343, 'bear_atr_max_pct': 0.11279748435973311, 'bear_tp_mult': 1.2782027646556733, 'bear_tsl_mult': 0.8025107820128856, 'bear_time_stop': 207, 'bear_use_sma': False, 'bear_use_ema': False, 'bear_use_atr': False, 'bear_use_adx': False, 'bear_use_spike': True, 'bear_rsi_required': True, 'sideways_strategy': 'breakout', 'sideways_bb_std_mult': 2.829295727866777, 'sideways_rsi_os': 23, 'sideways_rsi_ob': 90, 'sideways_adx_thresh': 17.96522314619154, 'sideways_atr_min_pct': 0.003995154715191339, 'sideways_atr_max_pct': 0.015654972610406076, 'sideways_tp_mult': 2.215884147217508, 'sideways_tsl_mult': 0.3555248840667858, 'sideways_time_stop': 259, 'sideways_use_sma': False, 'sideways_use_ema': False, 'sideways_use_atr': True, 'sideways_use_adx': True, 'sideways_use_spike': False, 'sideways_rsi_required': False}.
[I 2025-09-01 15:04:44,368] Trial 662 finished with values: [-1000000000.0, 1000000000.0] and parameters: {'p_sma': 30, 'p_std': 26, 'p_atr': 29, 'p_adx': 12, 'rsi_period': 79, 'ema1': 9, 'ema2': 41, 'slip_atr_k': 0.1148812772790594, 'slip_spread_k': 0.8715389844581765, 'spread_hl_frac': 0.01089861032173896, 'bb_std_mult': 3.5060160179856226, 'rsi_os': 45, 'rsi_ob': 86, 'vol_spike': 0.28931523321031993, 'adx_thresh': 5.566906418056549, 'atr_min_pct': 0.010860873582113087, 'atr_max_pct': 0.027610750480864147, 'tp_mult': 1.4409263596450086, 'tsl_mult': 0.7041646606521951, 'strategy': 'mean_reversion', 'time_stop': 110, 'use_sma': True, 'use_atr': True, 'use_adx': False, 'use_ema': True, 'use_spike': True, 'rsi_required': True, 'edge_k': 0.4361244521064236, 'edge_cap': 0.2655766020364257, 'bull_strategy': 'breakout', 'bull_bb_std_mult': 0.8579200591457041, 'bull_rsi_os': 22, 'bull_rsi_ob': 59, 'bull_adx_thresh': 14.526944174412314, 'bull_atr_min_pct': 0.016847857104961627, 'bull_atr_max_pct': 0.11921444515768365, 'bull_tp_mult': 1.593168102823052, 'bull_tsl_mult': 0.5240220337143808, 'bull_time_stop': 154, 'bull_use_sma': False, 'bull_use_ema': False, 'bull_use_atr': True, 'bull_use_adx': True, 'bull_use_spike': False, 'bull_rsi_required': True, 'bear_strategy': 'mean_reversion', 'bear_bb_std_mult': 2.6349337414802836, 'bear_rsi_os': 17, 'bear_rsi_ob': 63, 'bear_adx_thresh': 6.947277865071136, 'bear_atr_min_pct': 1.4972226840318209e-05, 'bear_atr_max_pct': 0.11379032526429954, 'bear_tp_mult': 1.2808633412345476, 'bear_tsl_mult': 0.11348358847136075, 'bear_time_stop': 98, 'bear_use_sma': False, 'bear_use_ema': False, 'bear_use_atr': False, 'bear_use_adx': False, 'bear_use_spike': True, 'bear_rsi_required': True, 'sideways_strategy': 'mean_reversion', 'sideways_bb_std_mult': 3.044634142371552, 'sideways_rsi_os': 31, 'sideways_rsi_ob': 90, 'sideways_adx_thresh': 24.003304580700256, 'sideways_atr_min_pct': 0.004404519613677126, 'sideways_atr_max_pct': 0.08387016446938311, 'sideways_tp_mult': 1.8615386850072553, 'sideways_tsl_mult': 0.44840156521921765, 'sideways_time_stop': 245, 'sideways_use_sma': True, 'sideways_use_ema': True, 'sideways_use_atr': False, 'sideways_use_adx': True, 'sideways_use_spike': False, 'sideways_rsi_required': False}.
[I 2025-09-01 15:04:45,936] Trial 664 finished with values: [-1000000000.0, 1000000000.0] and parameters: {'p_sma': 24, 'p_std': 60, 'p_atr': 26, 'p_adx': 23, 'rsi_period': 39, 'ema1': 10, 'ema2': 57, 'slip_atr_k': 0.024718097592592102, 'slip_spread_k': 0.8367788120491494, 'spread_hl_frac': 0.010253275717935231, 'bb_std_mult': 3.492879756514434, 'rsi_os': 5, 'rsi_ob': 55, 'vol_spike': 0.11007672691048322, 'adx_thresh': 5.488269634961906, 'atr_min_pct': 0.011044560093510701, 'atr_max_pct': 0.04048741740662447, 'tp_mult': 1.3618300154332397, 'tsl_mult': 0.7872565381754234, 'strategy': 'mean_reversion', 'time_stop': 240, 'use_sma': True, 'use_atr': True, 'use_adx': True, 'use_ema': True, 'use_spike': True, 'rsi_required': True, 'edge_k': 1.384484050387546, 'edge_cap': 0.9532355380606853, 'bull_strategy': 'breakout', 'bull_bb_std_mult': 3.1427275201437657, 'bull_rsi_os': 13, 'bull_rsi_ob': 71, 'bull_adx_thresh': 13.352233632730302, 'bull_atr_min_pct': 0.027172592467545213, 'bull_atr_max_pct': 0.13204533276587352, 'bull_tp_mult': 1.5897070863002007, 'bull_tsl_mult': 0.2608589793643382, 'bull_time_stop': 194, 'bull_use_sma': False, 'bull_use_ema': False, 'bull_use_atr': True, 'bull_use_adx': True, 'bull_use_spike': False, 'bull_rsi_required': True, 'bear_strategy': 'mean_reversion', 'bear_bb_std_mult': 2.225342728522233, 'bear_rsi_os': 32, 'bear_rsi_ob': 80, 'bear_adx_thresh': 34.24318514108129, 'bear_atr_min_pct': 0.00320996348195847, 'bear_atr_max_pct': 0.09929432101041478, 'bear_tp_mult': 1.9486820440591126, 'bear_tsl_mult': 0.11617303058215679, 'bear_time_stop': 98, 'bear_use_sma': False, 'bear_use_ema': False, 'bear_use_atr': False, 'bear_use_adx': False, 'bear_use_spike': True, 'bear_rsi_required': True, 'sideways_strategy': 'mean_reversion', 'sideways_bb_std_mult': 3.1036511628414525, 'sideways_rsi_os': 31, 'sideways_rsi_ob': 90, 'sideways_adx_thresh': 20.57558621207196, 'sideways_atr_min_pct': 0.003946324225858034, 'sideways_atr_max_pct': 0.014953380552322565, 'sideways_tp_mult': 1.859527508878844, 'sideways_tsl_mult': 0.449851471464804, 'sideways_time_stop': 273, 'sideways_use_sma': True, 'sideways_use_ema': True, 'sideways_use_atr': False, 'sideways_use_adx': True, 'sideways_use_spike': True, 'sideways_rsi_required': False}.
[I 2025-09-01 15:04:46,145] Trial 663 finished with values: [-1000000000.0, 1000000000.0] and parameters: {'p_sma': 30, 'p_std': 31, 'p_atr': 29, 'p_adx': 9, 'rsi_period': 79, 'ema1': 10, 'ema2': 41, 'slip_atr_k': 0.20543421512639243, 'slip_spread_k': 0.13247586769002978, 'spread_hl_frac': 0.010559404134439272, 'bb_std_mult': 1.602460000772813, 'rsi_os': 45, 'rsi_ob': 81, 'vol_spike': 0.1096118871471404, 'adx_thresh': 5.4422798945665924, 'atr_min_pct': 0.004099812963256549, 'atr_max_pct': 0.0479002421920383, 'tp_mult': 1.4714420352488409, 'tsl_mult': 0.7908211804492861, 'strategy': 'mean_reversion', 'time_stop': 124, 'use_sma': True, 'use_atr': True, 'use_adx': False, 'use_ema': True, 'use_spike': True, 'rsi_required': True, 'edge_k': 0.4250782504203595, 'edge_cap': 0.9557384529644739, 'bull_strategy': 'breakout', 'bull_bb_std_mult': 3.1421124528491533, 'bull_rsi_os': 22, 'bull_rsi_ob': 80, 'bull_adx_thresh': 15.4807091505104, 'bull_atr_min_pct': 0.011668411293641904, 'bull_atr_max_pct': 0.13299074580344422, 'bull_tp_mult': 1.6109055037288367, 'bull_tsl_mult': 0.4265459252104452, 'bull_time_stop': 154, 'bull_use_sma': False, 'bull_use_ema': False, 'bull_use_atr': True, 'bull_use_adx': True, 'bull_use_spike': True, 'bull_rsi_required': True, 'bear_strategy': 'mean_reversion', 'bear_bb_std_mult': 2.3047730794934753, 'bear_rsi_os': 31, 'bear_rsi_ob': 63, 'bear_adx_thresh': 32.141688768761895, 'bear_atr_min_pct': 0.003053985693410577, 'bear_atr_max_pct': 0.14113335014363748, 'bear_tp_mult': 2.336651193338604, 'bear_tsl_mult': 0.5589352369454315, 'bear_time_stop': 99, 'bear_use_sma': False, 'bear_use_ema': False, 'bear_use_atr': False, 'bear_use_adx': False, 'bear_use_spike': True, 'bear_rsi_required': True, 'sideways_strategy': 'mean_reversion', 'sideways_bb_std_mult': 3.042971372332215, 'sideways_rsi_os': 31, 'sideways_rsi_ob': 90, 'sideways_adx_thresh': 20.36384017704526, 'sideways_atr_min_pct': 0.021013854074108204, 'sideways_atr_max_pct': 0.07883769698791933, 'sideways_tp_mult': 2.2050379711110533, 'sideways_tsl_mult': 0.44479668662650107, 'sideways_time_stop': 274, 'sideways_use_sma': True, 'sideways_use_ema': True, 'sideways_use_atr': False, 'sideways_use_adx': True, 'sideways_use_spike': False, 'sideways_rsi_required': False}.
[I 2025-09-01 15:04:46,394] Trial 665 finished with values: [-0.0414866231548604, 0.041644626287148045] and parameters: {'p_sma': 30, 'p_std': 38, 'p_atr': 27, 'p_adx': 9, 'rsi_period': 77, 'ema1': 10, 'ema2': 43, 'slip_atr_k': 0.203327744163088, 'slip_spread_k': 0.5698748133563656, 'spread_hl_frac': 0.010450488493704778, 'bb_std_mult': 2.7393127017602255, 'rsi_os': 8, 'rsi_ob': 86, 'vol_spike': 0.11072640469416661, 'adx_thresh': 5.5022852731492415, 'atr_min_pct': 0.012431121383185173, 'atr_max_pct': 0.04754406382374448, 'tp_mult': 1.3818820062504649, 'tsl_mult': 0.698549012920324, 'strategy': 'mean_reversion', 'time_stop': 102, 'use_sma': True, 'use_atr': True, 'use_adx': False, 'use_ema': True, 'use_spike': True, 'rsi_required': True, 'edge_k': 0.8717781249377135, 'edge_cap': 0.9536087235982802, 'bull_strategy': 'breakout', 'bull_bb_std_mult': 3.145160705312007, 'bull_rsi_os': 22, 'bull_rsi_ob': 80, 'bull_adx_thresh': 12.950683130330566, 'bull_atr_min_pct': 0.011574135696757507, 'bull_atr_max_pct': 0.13283799659153647, 'bull_tp_mult': 1.5958185952555313, 'bull_tsl_mult': 0.4302063478991007, 'bull_time_stop': 150, 'bull_use_sma': False, 'bull_use_ema': False, 'bull_use_atr': True, 'bull_use_adx': True, 'bull_use_spike': False, 'bull_rsi_required': True, 'bear_strategy': 'mean_reversion', 'bear_bb_std_mult': 2.666683671332616, 'bear_rsi_os': 39, 'bear_rsi_ob': 53, 'bear_adx_thresh': 23.408193555666536, 'bear_atr_min_pct': 0.00316366570379039, 'bear_atr_max_pct': 0.13999740157097232, 'bear_tp_mult': 1.9776589723637716, 'bear_tsl_mult': 0.11895761926130505, 'bear_time_stop': 178, 'bear_use_sma': False, 'bear_use_ema': False, 'bear_use_atr': False, 'bear_use_adx': False, 'bear_use_spike': True, 'bear_rsi_required': False, 'sideways_strategy': 'mean_reversion', 'sideways_bb_std_mult': 3.1397758794261277, 'sideways_rsi_os': 32, 'sideways_rsi_ob': 89, 'sideways_adx_thresh': 26.129752449526997, 'sideways_atr_min_pct': 0.002361533132953896, 'sideways_atr_max_pct': 0.138400353327942, 'sideways_tp_mult': 2.5664722407648024, 'sideways_tsl_mult': 0.4239888192640809, 'sideways_time_stop': 274, 'sideways_use_sma': True, 'sideways_use_ema': True, 'sideways_use_atr': False, 'sideways_use_adx': True, 'sideways_use_spike': True, 'sideways_rsi_required': False}.
