[I 2025-09-01 14:22:24,667] Trial 378 finished with values: [-1000000000.0, 1000000000.0] and parameters: {'p_sma': 32, 'p_std': 28, 'p_atr': 26, 'p_adx': 7, 'rsi_period': 77, 'ema1': 10, 'ema2': 58, 'slip_atr_k': 0.16820766873334497, 'slip_spread_k': 0.09744907243790879, 'spread_hl_frac': 0.010551390549242158, 'bb_std_mult': 3.343750164463365, 'rsi_os': 43, 'rsi_ob': 52, 'vol_spike': 0.06678737216247127, 'adx_thresh': 5.629797377198344, 'atr_min_pct': 0.01324907386107928, 'atr_max_pct': 0.03237684491547783, 'tp_mult': 1.5544222417249633, 'tsl_mult': 0.4547510833447343, 'strategy': 'mean_reversion', 'time_stop': 116, 'use_sma': False, 'use_atr': False, 'use_adx': True, 'use_ema': True, 'use_spike': True, 'rsi_required': True, 'edge_k': 0.3413854592474147, 'edge_cap': 0.9588504070606154, 'bull_strategy': 'breakout', 'bull_bb_std_mult': 3.1894539649845406, 'bull_rsi_os': 24, 'bull_rsi_ob': 80, 'bull_adx_thresh': 28.300608468389562, 'bull_atr_min_pct': 0.010788972533333826, 'bull_atr_max_pct': 0.12916192661106954, 'bull_tp_mult': 1.595980382815008, 'bull_tsl_mult': 0.252618062843447, 'bull_time_stop': 143, 'bull_use_sma': False, 'bull_use_ema': False, 'bull_use_atr': True, 'bull_use_adx': True, 'bull_use_spike': True, 'bull_rsi_required': True, 'bear_strategy': 'mean_reversion', 'bear_bb_std_mult': 2.517199015487595, 'bear_rsi_os': 32, 'bear_rsi_ob': 45, 'bear_adx_thresh': 21.44418737806323, 'bear_atr_min_pct': 0.001720651405754125, 'bear_atr_max_pct': 0.11276397889551895, 'bear_tp_mult': 2.1295261302522657, 'bear_tsl_mult': 0.7720701445207476, 'bear_time_stop': 85, 'bear_use_sma': False, 'bear_use_ema': False, 'bear_use_atr': False, 'bear_use_adx': False, 'bear_use_spike': True, 'bear_rsi_required': False, 'sideways_strategy': 'mean_reversion', 'sideways_bb_std_mult': 3.1052155580988163, 'sideways_rsi_os': 28, 'sideways_rsi_ob': 91, 'sideways_adx_thresh': 24.02836638788252, 'sideways_atr_min_pct': 0.003921561121283879, 'sideways_atr_max_pct': 0.10740458931536694, 'sideways_tp_mult': 1.0448041366784238, 'sideways_tsl_mult': 0.1850751156440925, 'sideways_time_stop': 171, 'sideways_use_sma': True, 'sideways_use_ema': True, 'sideways_use_atr': False, 'sideways_use_adx': True, 'sideways_use_spike': False, 'sideways_rsi_required': False}.
[I 2025-09-01 14:23:00,518] Trial 382 finished with values: [-0.006179116744062796, 0.012028402539495484] and parameters: {'p_sma': 32, 'p_std': 24, 'p_atr': 14, 'p_adx': 8, 'rsi_period': 56, 'ema1': 22, 'ema2': 57, 'slip_atr_k': 0.022083214931910494, 'slip_spread_k': 0.40925639346157666, 'spread_hl_frac': 0.005059394505966128, 'bb_std_mult': 0.7243906910043869, 'rsi_os': 30, 'rsi_ob': 53, 'vol_spike': 0.022763065506711477, 'adx_thresh': 6.72965150693287, 'atr_min_pct': 0.001961103007035059, 'atr_max_pct': 0.03277095969616535, 'tp_mult': 1.1318507242386, 'tsl_mult': 0.6712272544289668, 'strategy': 'mean_reversion', 'time_stop': 130, 'use_sma': False, 'use_atr': False, 'use_adx': True, 'use_ema': True, 'use_spike': True, 'rsi_required': True, 'edge_k': 0.9887042917365039, 'edge_cap': 0.9199949152769618, 'bull_strategy': 'breakout', 'bull_bb_std_mult': 2.506077750361016, 'bull_rsi_os': 34, 'bull_rsi_ob': 80, 'bull_adx_thresh': 16.615306174696137, 'bull_atr_min_pct': 0.012782198359710803, 'bull_atr_max_pct': 0.13155401340415487, 'bull_tp_mult': 1.8088557671952528, 'bull_tsl_mult': 0.15234806128995543, 'bull_time_stop': 150, 'bull_use_sma': True, 'bull_use_ema': True, 'bull_use_atr': True, 'bull_use_adx': False, 'bull_use_spike': True, 'bull_rsi_required': True, 'bear_strategy': 'mean_reversion', 'bear_bb_std_mult': 2.6296818545801597, 'bear_rsi_os': 34, 'bear_rsi_ob': 63, 'bear_adx_thresh': 9.87250273969522, 'bear_atr_min_pct': 0.0024139598379292913, 'bear_atr_max_pct': 0.11029439864175312, 'bear_tp_mult': 2.101098229786103, 'bear_tsl_mult': 0.6693458623405382, 'bear_time_stop': 88, 'bear_use_sma': True, 'bear_use_ema': False, 'bear_use_atr': False, 'bear_use_adx': False, 'bear_use_spike': True, 'bear_rsi_required': False, 'sideways_strategy': 'mean_reversion', 'sideways_bb_std_mult': 2.8783057928187548, 'sideways_rsi_os': 12, 'sideways_rsi_ob': 88, 'sideways_adx_thresh': 25.81977625231333, 'sideways_atr_min_pct': 0.021020334658892505, 'sideways_atr_max_pct': 0.05291270443472286, 'sideways_tp_mult': 2.3256736833803773, 'sideways_tsl_mult': 0.3472924321369222, 'sideways_time_stop': 258, 'sideways_use_sma': True, 'sideways_use_ema': False, 'sideways_use_atr': True, 'sideways_use_adx': True, 'sideways_use_spike': False, 'sideways_rsi_required': False}.
[I 2025-09-01 14:23:01,489] Trial 381 finished with values: [0.0028960456332005613, 0.005901872677729027] and parameters: {'p_sma': 37, 'p_std': 18, 'p_atr': 26, 'p_adx': 8, 'rsi_period': 83, 'ema1': 9, 'ema2': 57, 'slip_atr_k': 0.021945957028191285, 'slip_spread_k': 0.38196606892889784, 'spread_hl_frac': 0.0017017237171497446, 'bb_std_mult': 3.5430202025400352, 'rsi_os': 23, 'rsi_ob': 52, 'vol_spike': 0.10832174071203605, 'adx_thresh': 34.93241933786652, 'atr_min_pct': 0.013197850283545615, 'atr_max_pct': 0.12381223919766758, 'tp_mult': 1.2052670016198606, 'tsl_mult': 0.7333233060185897, 'strategy': 'mean_reversion', 'time_stop': 114, 'use_sma': False, 'use_atr': False, 'use_adx': True, 'use_ema': True, 'use_spike': True, 'rsi_required': True, 'edge_k': 0.3469088441167355, 'edge_cap': 0.7342668127977992, 'bull_strategy': 'breakout', 'bull_bb_std_mult': 3.062263670855755, 'bull_rsi_os': 8, 'bull_rsi_ob': 80, 'bull_adx_thresh': 16.798100384514523, 'bull_atr_min_pct': 0.029079729084253658, 'bull_atr_max_pct': 0.13081782784135393, 'bull_tp_mult': 1.601221036873734, 'bull_tsl_mult': 0.045778565882434286, 'bull_time_stop': 142, 'bull_use_sma': False, 'bull_use_ema': False, 'bull_use_atr': True, 'bull_use_adx': True, 'bull_use_spike': True, 'bull_rsi_required': True, 'bear_strategy': 'mean_reversion', 'bear_bb_std_mult': 2.6806763945564276, 'bear_rsi_os': 35, 'bear_rsi_ob': 58, 'bear_adx_thresh': 21.440608837856765, 'bear_atr_min_pct': 0.0025836693859655527, 'bear_atr_max_pct': 0.1133270309681689, 'bear_tp_mult': 2.7874827784013867, 'bear_tsl_mult': 0.7815313801481542, 'bear_time_stop': 86, 'bear_use_sma': True, 'bear_use_ema': False, 'bear_use_atr': False, 'bear_use_adx': False, 'bear_use_spike': True, 'bear_rsi_required': False, 'sideways_strategy': 'mean_reversion', 'sideways_bb_std_mult': 3.0991932733074763, 'sideways_rsi_os': 55, 'sideways_rsi_ob': 88, 'sideways_adx_thresh': 25.990744315686808, 'sideways_atr_min_pct': 0.0051626453191248875, 'sideways_atr_max_pct': 0.10710113141413209, 'sideways_tp_mult': 1.7029943635499256, 'sideways_tsl_mult': 0.34756971842079015, 'sideways_time_stop': 215, 'sideways_use_sma': True, 'sideways_use_ema': True, 'sideways_use_atr': False, 'sideways_use_adx': True, 'sideways_use_spike': False, 'sideways_rsi_required': False}.
[I 2025-09-01 14:23:01,835] Trial 380 finished with values: [-1000000000.0, 1000000000.0] and parameters: {'p_sma': 37, 'p_std': 54, 'p_atr': 17, 'p_adx': 11, 'rsi_period': 77, 'ema1': 21, 'ema2': 58, 'slip_atr_k': 0.2377708346359847, 'slip_spread_k': 0.580682342281518, 'spread_hl_frac': 0.028399449058566763, 'bb_std_mult': 3.335449967301127, 'rsi_os': 43, 'rsi_ob': 63, 'vol_spike': 0.2494985589603978, 'adx_thresh': 34.94673853538725, 'atr_min_pct': 0.01291888151586278, 'atr_max_pct': 0.0325561834410709, 'tp_mult': 2.1859273871143854, 'tsl_mult': 0.3247785919464826, 'strategy': 'mean_reversion', 'time_stop': 117, 'use_sma': False, 'use_atr': False, 'use_adx': True, 'use_ema': True, 'use_spike': True, 'rsi_required': True, 'edge_k': 1.4820492965889431, 'edge_cap': 0.9535687114580431, 'bull_strategy': 'breakout', 'bull_bb_std_mult': 3.1961809717932854, 'bull_rsi_os': 24, 'bull_rsi_ob': 80, 'bull_adx_thresh': 11.371163478852912, 'bull_atr_min_pct': 0.01283444015590576, 'bull_atr_max_pct': 0.13102092430051768, 'bull_tp_mult': 1.5313765676957796, 'bull_tsl_mult': 0.1826465065306624, 'bull_time_stop': 150, 'bull_use_sma': False, 'bull_use_ema': False, 'bull_use_atr': True, 'bull_use_adx': True, 'bull_use_spike': True, 'bull_rsi_required': True, 'bear_strategy': 'mean_reversion', 'bear_bb_std_mult': 2.6601289322990875, 'bear_rsi_os': 32, 'bear_rsi_ob': 57, 'bear_adx_thresh': 9.827165315999906, 'bear_atr_min_pct': 0.021035200245245675, 'bear_atr_max_pct': 0.050623379248221884, 'bear_tp_mult': 2.64514921033282, 'bear_tsl_mult': 0.7673191634621324, 'bear_time_stop': 86, 'bear_use_sma': False, 'bear_use_ema': False, 'bear_use_atr': False, 'bear_use_adx': False, 'bear_use_spike': True, 'bear_rsi_required': False, 'sideways_strategy': 'mean_reversion', 'sideways_bb_std_mult': 2.9028193867537433, 'sideways_rsi_os': 28, 'sideways_rsi_ob': 64, 'sideways_adx_thresh': 24.809922365318613, 'sideways_atr_min_pct': 0.004237330236666718, 'sideways_atr_max_pct': 0.05481670073323544, 'sideways_tp_mult': 2.515845128261885, 'sideways_tsl_mult': 0.9111405033965151, 'sideways_time_stop': 23, 'sideways_use_sma': True, 'sideways_use_ema': True, 'sideways_use_atr': False, 'sideways_use_adx': True, 'sideways_use_spike': False, 'sideways_rsi_required': False}.
[I 2025-09-01 14:23:01,835] Trial 379 finished with values: [-1000000000.0, 1000000000.0] and parameters: {'p_sma': 32, 'p_std': 31, 'p_atr': 21, 'p_adx': 8, 'rsi_period': 83, 'ema1': 10, 'ema2': 58, 'slip_atr_k': 0.23609295522793358, 'slip_spread_k': 0.3738179459459281, 'spread_hl_frac': 0.001879382954963503, 'bb_std_mult': 1.2569172316453034, 'rsi_os': 11, 'rsi_ob': 52, 'vol_spike': 0.1121084096080874, 'adx_thresh': 11.867914874046631, 'atr_min_pct': 0.012406884005744618, 'atr_max_pct': 0.054981217302032835, 'tp_mult': 1.6681859030971897, 'tsl_mult': 0.7376373025769327, 'strategy': 'mean_reversion', 'time_stop': 119, 'use_sma': False, 'use_atr': False, 'use_adx': True, 'use_ema': True, 'use_spike': True, 'rsi_required': True, 'edge_k': 0.6297553032350498, 'edge_cap': 0.9530376811008672, 'bull_strategy': 'breakout', 'bull_bb_std_mult': 3.083335611039677, 'bull_rsi_os': 9, 'bull_rsi_ob': 80, 'bull_adx_thresh': 22.05219394675356, 'bull_atr_min_pct': 0.01898776640689603, 'bull_atr_max_pct': 0.07860758126495512, 'bull_tp_mult': 1.5353501167962915, 'bull_tsl_mult': 0.8405089581355318, 'bull_time_stop': 143, 'bull_use_sma': False, 'bull_use_ema': False, 'bull_use_atr': True, 'bull_use_adx': True, 'bull_use_spike': True, 'bull_rsi_required': True, 'bear_strategy': 'mean_reversion', 'bear_bb_std_mult': 2.5328925544017404, 'bear_rsi_os': 32, 'bear_rsi_ob': 83, 'bear_adx_thresh': 20.613483716140408, 'bear_atr_min_pct': 0.011235844565363253, 'bear_atr_max_pct': 0.11348691369462394, 'bear_tp_mult': 2.144570737619988, 'bear_tsl_mult': 0.12113275198848608, 'bear_time_stop': 85, 'bear_use_sma': False, 'bear_use_ema': False, 'bear_use_atr': False, 'bear_use_adx': False, 'bear_use_spike': True, 'bear_rsi_required': False, 'sideways_strategy': 'mean_reversion', 'sideways_bb_std_mult': 2.9226254251258634, 'sideways_rsi_os': 28, 'sideways_rsi_ob': 51, 'sideways_adx_thresh': 24.741511615886445, 'sideways_atr_min_pct': 0.019984389572420845, 'sideways_atr_max_pct': 0.06903925512322924, 'sideways_tp_mult': 2.531843921635619, 'sideways_tsl_mult': 0.9988622257487653, 'sideways_time_stop': 268, 'sideways_use_sma': True, 'sideways_use_ema': True, 'sideways_use_atr': False, 'sideways_use_adx': True, 'sideways_use_spike': False, 'sideways_rsi_required': False}.
[I 2025-09-01 14:23:02,775] Trial 386 finished with values: [-1000000000.0, 1000000000.0] and parameters: {'p_sma': 17, 'p_std': 41, 'p_atr': 27, 'p_adx': 15, 'rsi_period': 84, 'ema1': 9, 'ema2': 55, 'slip_atr_k': 0.1269649772927609, 'slip_spread_k': 0.3906511075203778, 'spread_hl_frac': 0.012522660812899558, 'bb_std_mult': 3.548183548174264, 'rsi_os': 19, 'rsi_ob': 50, 'vol_spike': 0.031101243353328062, 'adx_thresh': 30.2456901221763, 'atr_min_pct': 0.011151108173606017, 'atr_max_pct': 0.12383862461931902, 'tp_mult': 2.555730270649631, 'tsl_mult': 0.35343183719837235, 'strategy': 'mean_reversion', 'time_stop': 126, 'use_sma': True, 'use_atr': False, 'use_adx': True, 'use_ema': True, 'use_spike': False, 'rsi_required': True, 'edge_k': 0.1278614353519863, 'edge_cap': 0.9876071759105266, 'bull_strategy': 'mean_reversion', 'bull_bb_std_mult': 3.5147271013214416, 'bull_rsi_os': 8, 'bull_rsi_ob': 62, 'bull_adx_thresh': 12.745659726132349, 'bull_atr_min_pct': 0.01439810628209903, 'bull_atr_max_pct': 0.12215479884724714, 'bull_tp_mult': 1.6321767635766913, 'bull_tsl_mult': 0.1156828902449839, 'bull_time_stop': 170, 'bull_use_sma': True, 'bull_use_ema': True, 'bull_use_atr': True, 'bull_use_adx': True, 'bull_use_spike': True, 'bull_rsi_required': True, 'bear_strategy': 'mean_reversion', 'bear_bb_std_mult': 2.402029500325635, 'bear_rsi_os': 35, 'bear_rsi_ob': 75, 'bear_adx_thresh': 8.752538754373868, 'bear_atr_min_pct': 0.000674463085044554, 'bear_atr_max_pct': 0.11716311454390368, 'bear_tp_mult': 1.1680546565044152, 'bear_tsl_mult': 0.5545262968558582, 'bear_time_stop': 149, 'bear_use_sma': False, 'bear_use_ema': False, 'bear_use_atr': True, 'bear_use_adx': False, 'bear_use_spike': True, 'bear_rsi_required': False, 'sideways_strategy': 'mean_reversion', 'sideways_bb_std_mult': 1.9422160155618338, 'sideways_rsi_os': 42, 'sideways_rsi_ob': 65, 'sideways_adx_thresh': 25.39350599812733, 'sideways_atr_min_pct': 0.006863480565247413, 'sideways_atr_max_pct': 0.10966660877601768, 'sideways_tp_mult': 2.4357510053658347, 'sideways_tsl_mult': 0.4111164581884877, 'sideways_time_stop': 252, 'sideways_use_sma': True, 'sideways_use_ema': False, 'sideways_use_atr': True, 'sideways_use_adx': True, 'sideways_use_spike': False, 'sideways_rsi_required': False}.
[I 2025-09-01 14:23:41,899] Trial 385 finished with values: [-0.01620609157261621, 0.01612676405141477] and parameters: {'p_sma': 30, 'p_std': 11, 'p_atr': 10, 'p_adx': 15, 'rsi_period': 84, 'ema1': 9, 'ema2': 55, 'slip_atr_k': 0.12484354814607954, 'slip_spread_k': 0.34695699113160017, 'spread_hl_frac': 0.012885285151426364, 'bb_std_mult': 3.5227035837238154, 'rsi_os': 21, 'rsi_ob': 90, 'vol_spike': 0.09814820913523241, 'adx_thresh': 5.656749426740052, 'atr_min_pct': 0.011067748926185053, 'atr_max_pct': 0.12562284961179437, 'tp_mult': 1.4900704513063143, 'tsl_mult': 0.2932340147125534, 'strategy': 'mean_reversion', 'time_stop': 103, 'use_sma': True, 'use_atr': False, 'use_adx': True, 'use_ema': True, 'use_spike': False, 'rsi_required': True, 'edge_k': 0.4305430160341066, 'edge_cap': 0.9867132495191657, 'bull_strategy': 'mean_reversion', 'bull_bb_std_mult': 3.532812380764679, 'bull_rsi_os': 12, 'bull_rsi_ob': 66, 'bull_adx_thresh': 20.45828421247725, 'bull_atr_min_pct': 0.022735015018791275, 'bull_atr_max_pct': 0.05564890751449068, 'bull_tp_mult': 1.665687662378914, 'bull_tsl_mult': 0.4440367254690472, 'bull_time_stop': 169, 'bull_use_sma': True, 'bull_use_ema': True, 'bull_use_atr': True, 'bull_use_adx': True, 'bull_use_spike': True, 'bull_rsi_required': True, 'bear_strategy': 'mean_reversion', 'bear_bb_std_mult': 2.4461941559323828, 'bear_rsi_os': 22, 'bear_rsi_ob': 58, 'bear_adx_thresh': 8.580269151811518, 'bear_atr_min_pct': 0.0007295928282721514, 'bear_atr_max_pct': 0.10305167141298262, 'bear_tp_mult': 2.0125287165436205, 'bear_tsl_mult': 0.13210444678739663, 'bear_time_stop': 73, 'bear_use_sma': False, 'bear_use_ema': False, 'bear_use_atr': True, 'bear_use_adx': False, 'bear_use_spike': True, 'bear_rsi_required': False, 'sideways_strategy': 'mean_reversion', 'sideways_bb_std_mult': 3.051911153761713, 'sideways_rsi_os': 42, 'sideways_rsi_ob': 65, 'sideways_adx_thresh': 25.442476459533207, 'sideways_atr_min_pct': 0.004870724393587478, 'sideways_atr_max_pct': 0.11068378945069458, 'sideways_tp_mult': 2.4430280397652746, 'sideways_tsl_mult': 0.41241176960722276, 'sideways_time_stop': 35, 'sideways_use_sma': True, 'sideways_use_ema': False, 'sideways_use_atr': True, 'sideways_use_adx': True, 'sideways_use_spike': False, 'sideways_rsi_required': False}.
[I 2025-09-01 14:23:42,905] Trial 384 finished with values: [-1000000000.0, 1000000000.0] and parameters: {'p_sma': 17, 'p_std': 30, 'p_atr': 27, 'p_adx': 20, 'rsi_period': 84, 'ema1': 9, 'ema2': 55, 'slip_atr_k': 0.06922679478800803, 'slip_spread_k': 0.38554634934556087, 'spread_hl_frac': 0.008940798624375223, 'bb_std_mult': 0.9293801769039831, 'rsi_os': 21, 'rsi_ob': 89, 'vol_spike': 0.18474442384647624, 'adx_thresh': 6.2072261154627775, 'atr_min_pct': 0.012339528555347654, 'atr_max_pct': 0.07194907174325488, 'tp_mult': 1.201390352240875, 'tsl_mult': 0.5083314474488082, 'strategy': 'mean_reversion', 'time_stop': 220, 'use_sma': False, 'use_atr': False, 'use_adx': True, 'use_ema': True, 'use_spike': True, 'rsi_required': True, 'edge_k': 0.4233319144257227, 'edge_cap': 0.9570814842559761, 'bull_strategy': 'breakout', 'bull_bb_std_mult': 3.107786522788795, 'bull_rsi_os': 13, 'bull_rsi_ob': 75, 'bull_adx_thresh': 11.426387687051657, 'bull_atr_min_pct': 0.022555835369628737, 'bull_atr_max_pct': 0.05057951085530929, 'bull_tp_mult': 1.6853438113018235, 'bull_tsl_mult': 0.9733143581745158, 'bull_time_stop': 266, 'bull_use_sma': False, 'bull_use_ema': True, 'bull_use_atr': True, 'bull_use_adx': True, 'bull_use_spike': True, 'bull_rsi_required': True, 'bear_strategy': 'mean_reversion', 'bear_bb_std_mult': 2.4410790307485963, 'bear_rsi_os': 22, 'bear_rsi_ob': 57, 'bear_adx_thresh': 8.766586522193595, 'bear_atr_min_pct': 0.02426742281769588, 'bear_atr_max_pct': 0.0922933909947309, 'bear_tp_mult': 2.02179207471047, 'bear_tsl_mult': 0.7338472220865471, 'bear_time_stop': 151, 'bear_use_sma': False, 'bear_use_ema': False, 'bear_use_atr': True, 'bear_use_adx': False, 'bear_use_spike': True, 'bear_rsi_required': False, 'sideways_strategy': 'mean_reversion', 'sideways_bb_std_mult': 2.9454078952615346, 'sideways_rsi_os': 42, 'sideways_rsi_ob': 89, 'sideways_adx_thresh': 24.881750125782943, 'sideways_atr_min_pct': 0.0051657976341336655, 'sideways_atr_max_pct': 0.018689731679966355, 'sideways_tp_mult': 1.6279802360530058, 'sideways_tsl_mult': 0.6392571923647141, 'sideways_time_stop': 216, 'sideways_use_sma': True, 'sideways_use_ema': True, 'sideways_use_atr': False, 'sideways_use_adx': True, 'sideways_use_spike': False, 'sideways_rsi_required': False}.
[I 2025-09-01 14:23:43,685] Trial 383 finished with values: [-1000000000.0, 1000000000.0] and parameters: {'p_sma': 37, 'p_std': 31, 'p_atr': 10, 'p_adx': 8, 'rsi_period': 84, 'ema1': 9, 'ema2': 56, 'slip_atr_k': 0.13921827605672374, 'slip_spread_k': 0.5516992287131677, 'spread_hl_frac': 0.023231208699592852, 'bb_std_mult': 3.5433826894208234, 'rsi_os': 43, 'rsi_ob': 51, 'vol_spike': 0.11093622417507734, 'adx_thresh': 5.024599042354812, 'atr_min_pct': 0.027830573498522998, 'atr_max_pct': 0.03846907855904647, 'tp_mult': 1.4851476266654626, 'tsl_mult': 0.7327591009564564, 'strategy': 'mean_reversion', 'time_stop': 114, 'use_sma': True, 'use_atr': False, 'use_adx': True, 'use_ema': True, 'use_spike': True, 'rsi_required': True, 'edge_k': 0.1174831980671133, 'edge_cap': 0.9588869456979077, 'bull_strategy': 'breakout', 'bull_bb_std_mult': 3.0705774076447447, 'bull_rsi_os': 13, 'bull_rsi_ob': 88, 'bull_adx_thresh': 22.380739404424688, 'bull_atr_min_pct': 0.00486892204169607, 'bull_atr_max_pct': 0.12300036054269413, 'bull_tp_mult': 1.769191594995529, 'bull_tsl_mult': 0.0005321714358234586, 'bull_time_stop': 171, 'bull_use_sma': False, 'bull_use_ema': True, 'bull_use_atr': True, 'bull_use_adx': True, 'bull_use_spike': True, 'bull_rsi_required': True, 'bear_strategy': 'mean_reversion', 'bear_bb_std_mult': 2.4215355386371087, 'bear_rsi_os': 35, 'bear_rsi_ob': 58, 'bear_adx_thresh': 27.890057602140246, 'bear_atr_min_pct': 0.01742361250178765, 'bear_atr_max_pct': 0.10293476239304228, 'bear_tp_mult': 2.7939612546085923, 'bear_tsl_mult': 0.730813211254626, 'bear_time_stop': 72, 'bear_use_sma': False, 'bear_use_ema': False, 'bear_use_atr': False, 'bear_use_adx': False, 'bear_use_spike': True, 'bear_rsi_required': False, 'sideways_strategy': 'mean_reversion', 'sideways_bb_std_mult': 2.9540138879432623, 'sideways_rsi_os': 42, 'sideways_rsi_ob': 89, 'sideways_adx_thresh': 6.321545065654133, 'sideways_atr_min_pct': 0.010051410069393744, 'sideways_atr_max_pct': 0.010534504547978676, 'sideways_tp_mult': 1.7077607181905765, 'sideways_tsl_mult': 0.389814313365602, 'sideways_time_stop': 25, 'sideways_use_sma': True, 'sideways_use_ema': True, 'sideways_use_atr': True, 'sideways_use_adx': True, 'sideways_use_spike': True, 'sideways_rsi_required': False}.
