[I 2025-09-01 13:50:11,972] Trial 154 finished with values: [-1000000000.0, 1000000000.0] and parameters: {'p_sma': 13, 'p_std': 30, 'p_atr': 8, 'p_adx': 27, 'rsi_period': 28, 'ema1': 20, 'ema2': 20, 'slip_atr_k': 0.006836648966072476, 'slip_spread_k': 0.46479872566171904, 'spread_hl_frac': 0.010022320727252072, 'bb_std_mult': 2.739921493008344, 'rsi_os': 43, 'rsi_ob': 80, 'vol_spike': 0.1342918231915223, 'adx_thresh': 11.418507090888163, 'atr_min_pct': 0.01690029148572639, 'atr_max_pct': 0.01634093648690826, 'tp_mult': 2.066509728267939, 'tsl_mult': 0.7709289353638529, 'strategy': 'breakout', 'time_stop': 124, 'use_sma': True, 'use_atr': False, 'use_adx': True, 'use_ema': False, 'use_spike': True, 'rsi_required': False, 'edge_k': 0.9504042736889416, 'edge_cap': 0.20849397787820395, 'bull_strategy': 'breakout', 'bull_bb_std_mult': 1.1347283485993689, 'bull_rsi_os': 40, 'bull_rsi_ob': 52, 'bull_adx_thresh': 8.405542889938747, 'bull_atr_min_pct': 0.010958026447493906, 'bull_atr_max_pct': 0.031160829298391916, 'bull_tp_mult': 1.3973478870816287, 'bull_tsl_mult': 0.24196700787015352, 'bull_time_stop': 21, 'bull_use_sma': True, 'bull_use_ema': True, 'bull_use_atr': False, 'bull_use_adx': False, 'bull_use_spike': False, 'bull_rsi_required': True, 'bear_strategy': 'mean_reversion', 'bear_bb_std_mult': 1.9792299446820063, 'bear_rsi_os': 16, 'bear_rsi_ob': 56, 'bear_adx_thresh': 22.402021962581724, 'bear_atr_min_pct': 0.02127006786812946, 'bear_atr_max_pct': 0.07187966076247482, 'bear_tp_mult': 2.530678931369384, 'bear_tsl_mult': 0.13019485808472725, 'bear_time_stop': 175, 'bear_use_sma': False, 'bear_use_ema': True, 'bear_use_atr': False, 'bear_use_adx': True, 'bear_use_spike': False, 'bear_rsi_required': True, 'sideways_strategy': 'breakout', 'sideways_bb_std_mult': 0.6227239726377349, 'sideways_rsi_os': 36, 'sideways_rsi_ob': 75, 'sideways_adx_thresh': 28.000031975372487, 'sideways_atr_min_pct': 0.018210710762914077, 'sideways_atr_max_pct': 0.05963822027990316, 'sideways_tp_mult': 2.885750865756533, 'sideways_tsl_mult': 0.7445861561767078, 'sideways_time_stop': 222, 'sideways_use_sma': False, 'sideways_use_ema': True, 'sideways_use_atr': True, 'sideways_use_adx': True, 'sideways_use_spike': True, 'sideways_rsi_required': False}.
[I 2025-09-01 13:50:12,038] Trial 155 finished with values: [-1000000000.0, 1000000000.0] and parameters: {'p_sma': 30, 'p_std': 30, 'p_atr': 8, 'p_adx': 16, 'rsi_period': 28, 'ema1': 25, 'ema2': 18, 'slip_atr_k': 0.007400464099056011, 'slip_spread_k': 0.522892643721413, 'spread_hl_frac': 0.010300486549920456, 'bb_std_mult': 2.0992703652145925, 'rsi_os': 5, 'rsi_ob': 80, 'vol_spike': 0.1122776025232161, 'adx_thresh': 22.542051097180494, 'atr_min_pct': 0.017023892816922563, 'atr_max_pct': 0.016422708118265687, 'tp_mult': 2.0616832371743414, 'tsl_mult': 0.34660216140917144, 'strategy': 'mean_reversion', 'time_stop': 94, 'use_sma': True, 'use_atr': False, 'use_adx': False, 'use_ema': False, 'use_spike': True, 'rsi_required': True, 'edge_k': 1.3250526981503543, 'edge_cap': 0.2146691311110506, 'bull_strategy': 'breakout', 'bull_bb_std_mult': 2.6463995674982366, 'bull_rsi_os': 36, 'bull_rsi_ob': 53, 'bull_adx_thresh': 12.314976747457296, 'bull_atr_min_pct': 0.0100461896706569, 'bull_atr_max_pct': 0.03228129683941211, 'bull_tp_mult': 1.9477197908785173, 'bull_tsl_mult': 0.5468875581142946, 'bull_time_stop': 80, 'bull_use_sma': True, 'bull_use_ema': True, 'bull_use_atr': False, 'bull_use_adx': False, 'bull_use_spike': True, 'bull_rsi_required': True, 'bear_strategy': 'mean_reversion', 'bear_bb_std_mult': 2.006879346829123, 'bear_rsi_os': 16, 'bear_rsi_ob': 82, 'bear_adx_thresh': 5.0015512497139945, 'bear_atr_min_pct': 0.021957941096048206, 'bear_atr_max_pct': 0.07155425847291241, 'bear_tp_mult': 2.4082559779526402, 'bear_tsl_mult': 0.13522776593194274, 'bear_time_stop': 63, 'bear_use_sma': False, 'bear_use_ema': True, 'bear_use_atr': False, 'bear_use_adx': True, 'bear_use_spike': True, 'bear_rsi_required': True, 'sideways_strategy': 'mean_reversion', 'sideways_bb_std_mult': 0.6353391808797477, 'sideways_rsi_os': 34, 'sideways_rsi_ob': 91, 'sideways_adx_thresh': 12.609214352117409, 'sideways_atr_min_pct': 0.013489024874637032, 'sideways_atr_max_pct': 0.08606043888772814, 'sideways_tp_mult': 2.8217689170533777, 'sideways_tsl_mult': 0.7372500360474613, 'sideways_time_stop': 256, 'sideways_use_sma': False, 'sideways_use_ema': True, 'sideways_use_atr': True, 'sideways_use_adx': True, 'sideways_use_spike': True, 'sideways_rsi_required': False}.
[I 2025-09-01 13:50:47,768] Trial 156 finished with values: [-1000000000.0, 1000000000.0] and parameters: {'p_sma': 12, 'p_std': 31, 'p_atr': 8, 'p_adx': 28, 'rsi_period': 29, 'ema1': 8, 'ema2': 22, 'slip_atr_k': 0.006944271523750448, 'slip_spread_k': 0.5210572402441433, 'spread_hl_frac': 0.0323262060728922, 'bb_std_mult': 0.9898775117280989, 'rsi_os': 44, 'rsi_ob': 76, 'vol_spike': 0.11221956181635782, 'adx_thresh': 22.855605053447405, 'atr_min_pct': 0.016530619979597642, 'atr_max_pct': 0.01854315853675782, 'tp_mult': 2.0792593353275524, 'tsl_mult': 0.3470642571315452, 'strategy': 'breakout', 'time_stop': 245, 'use_sma': True, 'use_atr': False, 'use_adx': False, 'use_ema': False, 'use_spike': False, 'rsi_required': True, 'edge_k': 1.3293184836485774, 'edge_cap': 0.5689285426558598, 'bull_strategy': 'breakout', 'bull_bb_std_mult': 1.1221003060647758, 'bull_rsi_os': 31, 'bull_rsi_ob': 53, 'bull_adx_thresh': 28.251014731793596, 'bull_atr_min_pct': 0.00894343597682596, 'bull_atr_max_pct': 0.10341541518099445, 'bull_tp_mult': 1.9387074608869934, 'bull_tsl_mult': 0.23130616090695283, 'bull_time_stop': 21, 'bull_use_sma': True, 'bull_use_ema': True, 'bull_use_atr': True, 'bull_use_adx': False, 'bull_use_spike': False, 'bull_rsi_required': True, 'bear_strategy': 'mean_reversion', 'bear_bb_std_mult': 3.390205080645497, 'bear_rsi_os': 13, 'bear_rsi_ob': 56, 'bear_adx_thresh': 6.932892929309993, 'bear_atr_min_pct': 0.026704935120131217, 'bear_atr_max_pct': 0.06180104040321045, 'bear_tp_mult': 1.9329511648508573, 'bear_tsl_mult': 0.5670914779974295, 'bear_time_stop': 191, 'bear_use_sma': True, 'bear_use_ema': True, 'bear_use_atr': False, 'bear_use_adx': True, 'bear_use_spike': False, 'bear_rsi_required': True, 'sideways_strategy': 'mean_reversion', 'sideways_bb_std_mult': 0.9260449879639514, 'sideways_rsi_os': 35, 'sideways_rsi_ob': 75, 'sideways_adx_thresh': 23.867883981597846, 'sideways_atr_min_pct': 0.022421408863561965, 'sideways_atr_max_pct': 0.03796969057566215, 'sideways_tp_mult': 2.625403708216625, 'sideways_tsl_mult': 0.08595009683951438, 'sideways_time_stop': 295, 'sideways_use_sma': False, 'sideways_use_ema': False, 'sideways_use_atr': True, 'sideways_use_adx': True, 'sideways_use_spike': True, 'sideways_rsi_required': False}.
[I 2025-09-01 13:50:49,531] Trial 153 finished with values: [-0.0138868872310568, 0.014307549233229348] and parameters: {'p_sma': 31, 'p_std': 38, 'p_atr': 8, 'p_adx': 7, 'rsi_period': 24, 'ema1': 30, 'ema2': 29, 'slip_atr_k': 0.006894494331574935, 'slip_spread_k': 0.4232347952005654, 'spread_hl_frac': 0.048375309651845014, 'bb_std_mult': 3.597347143117153, 'rsi_os': 31, 'rsi_ob': 64, 'vol_spike': 0.1420701102030224, 'adx_thresh': 31.53085973131168, 'atr_min_pct': 0.017030715750367374, 'atr_max_pct': 0.13515965910850802, 'tp_mult': 2.0932768043525476, 'tsl_mult': 0.9897125171609635, 'strategy': 'mean_reversion', 'time_stop': 96, 'use_sma': True, 'use_atr': False, 'use_adx': True, 'use_ema': True, 'use_spike': True, 'rsi_required': True, 'edge_k': 0.5114383506702618, 'edge_cap': 0.38099246161049616, 'bull_strategy': 'breakout', 'bull_bb_std_mult': 3.5646778674529473, 'bull_rsi_os': 32, 'bull_rsi_ob': 51, 'bull_adx_thresh': 11.31847929285413, 'bull_atr_min_pct': 0.0028842009020349016, 'bull_atr_max_pct': 0.09727941792431526, 'bull_tp_mult': 1.94479305245388, 'bull_tsl_mult': 0.2151771779359712, 'bull_time_stop': 165, 'bull_use_sma': False, 'bull_use_ema': True, 'bull_use_atr': False, 'bull_use_adx': True, 'bull_use_spike': True, 'bull_rsi_required': True, 'bear_strategy': 'mean_reversion', 'bear_bb_std_mult': 2.9833351524178124, 'bear_rsi_os': 37, 'bear_rsi_ob': 51, 'bear_adx_thresh': 7.478607105988523, 'bear_atr_min_pct': 0.020876242383270148, 'bear_atr_max_pct': 0.13426951674133286, 'bear_tp_mult': 1.9354663306343105, 'bear_tsl_mult': 0.09249822278792841, 'bear_time_stop': 65, 'bear_use_sma': False, 'bear_use_ema': False, 'bear_use_atr': False, 'bear_use_adx': True, 'bear_use_spike': True, 'bear_rsi_required': True, 'sideways_strategy': 'breakout', 'sideways_bb_std_mult': 0.666067007843422, 'sideways_rsi_os': 32, 'sideways_rsi_ob': 75, 'sideways_adx_thresh': 26.845561751038698, 'sideways_atr_min_pct': 0.02452267459739365, 'sideways_atr_max_pct': 0.12491914622683263, 'sideways_tp_mult': 1.1690999708754877, 'sideways_tsl_mult': 0.6793928192022715, 'sideways_time_stop': 170, 'sideways_use_sma': True, 'sideways_use_ema': True, 'sideways_use_atr': True, 'sideways_use_adx': True, 'sideways_use_spike': False, 'sideways_rsi_required': False}.
[I 2025-09-01 13:50:49,565] Trial 157 finished with values: [-1000000000.0, 1000000000.0] and parameters: {'p_sma': 30, 'p_std': 26, 'p_atr': 23, 'p_adx': 8, 'rsi_period': 24, 'ema1': 8, 'ema2': 10, 'slip_atr_k': 0.2281605175721727, 'slip_spread_k': 0.6984066987459263, 'spread_hl_frac': 0.032267729339135465, 'bb_std_mult': 2.081388353119401, 'rsi_os': 6, 'rsi_ob': 72, 'vol_spike': 0.11090934517325263, 'adx_thresh': 12.438728995955021, 'atr_min_pct': 0.01759297129636865, 'atr_max_pct': 0.019273762171566095, 'tp_mult': 1.982954265155666, 'tsl_mult': 0.26125607560919684, 'strategy': 'breakout', 'time_stop': 281, 'use_sma': True, 'use_atr': True, 'use_adx': False, 'use_ema': False, 'use_spike': False, 'rsi_required': True, 'edge_k': 1.597468678441412, 'edge_cap': 0.2217935783721086, 'bull_strategy': 'breakout', 'bull_bb_std_mult': 3.5994190185975556, 'bull_rsi_os': 37, 'bull_rsi_ob': 53, 'bull_adx_thresh': 28.250332776833766, 'bull_atr_min_pct': 0.015832113025574447, 'bull_atr_max_pct': 0.022963004857613913, 'bull_tp_mult': 2.9472988536430944, 'bull_tsl_mult': 0.6855834359718611, 'bull_time_stop': 75, 'bull_use_sma': True, 'bull_use_ema': True, 'bull_use_atr': True, 'bull_use_adx': False, 'bull_use_spike': False, 'bull_rsi_required': True, 'bear_strategy': 'mean_reversion', 'bear_bb_std_mult': 2.9976648155759906, 'bear_rsi_os': 12, 'bear_rsi_ob': 54, 'bear_adx_thresh': 7.128736905451024, 'bear_atr_min_pct': 0.005523145965659136, 'bear_atr_max_pct': 0.07679004389358969, 'bear_tp_mult': 1.939447508575375, 'bear_tsl_mult': 0.15734707411791787, 'bear_time_stop': 58, 'bear_use_sma': True, 'bear_use_ema': True, 'bear_use_atr': False, 'bear_use_adx': False, 'bear_use_spike': False, 'bear_rsi_required': False, 'sideways_strategy': 'mean_reversion', 'sideways_bb_std_mult': 0.9005561871157028, 'sideways_rsi_os': 35, 'sideways_rsi_ob': 91, 'sideways_adx_thresh': 31.974108343237347, 'sideways_atr_min_pct': 0.004513239823418837, 'sideways_atr_max_pct': 0.08565976126356986, 'sideways_tp_mult': 1.8654852077073214, 'sideways_tsl_mult': 0.21193092313236817, 'sideways_time_stop': 256, 'sideways_use_sma': False, 'sideways_use_ema': False, 'sideways_use_atr': True, 'sideways_use_adx': True, 'sideways_use_spike': True, 'sideways_rsi_required': False}.
[I 2025-09-01 13:50:50,417] Trial 158 finished with values: [-1000000000.0, 1000000000.0] and parameters: {'p_sma': 9, 'p_std': 24, 'p_atr': 7, 'p_adx': 28, 'rsi_period': 37, 'ema1': 8, 'ema2': 41, 'slip_atr_k': 0.22419976478876105, 'slip_spread_k': 0.2254941414423195, 'spread_hl_frac': 0.031478231678602434, 'bb_std_mult': 1.020600173745238, 'rsi_os': 45, 'rsi_ob': 72, 'vol_spike': 0.12509562392422435, 'adx_thresh': 12.268151775746922, 'atr_min_pct': 0.019164865377436453, 'atr_max_pct': 0.06159342988789844, 'tp_mult': 2.995899920649782, 'tsl_mult': 0.26008492458047505, 'strategy': 'breakout', 'time_stop': 84, 'use_sma': True, 'use_atr': True, 'use_adx': False, 'use_ema': False, 'use_spike': False, 'rsi_required': True, 'edge_k': 1.0516493050319156, 'edge_cap': 0.36958908482275343, 'bull_strategy': 'breakout', 'bull_bb_std_mult': 1.288771656869027, 'bull_rsi_os': 18, 'bull_rsi_ob': 85, 'bull_adx_thresh': 13.442407426352386, 'bull_atr_min_pct': 0.020670077458341995, 'bull_atr_max_pct': 0.14191875528485126, 'bull_tp_mult': 2.025159933961107, 'bull_tsl_mult': 0.5335025074297218, 'bull_time_stop': 39, 'bull_use_sma': False, 'bull_use_ema': True, 'bull_use_atr': True, 'bull_use_adx': True, 'bull_use_spike': False, 'bull_rsi_required': False, 'bear_strategy': 'breakout', 'bear_bb_std_mult': 3.418187659408112, 'bear_rsi_os': 12, 'bear_rsi_ob': 55, 'bear_adx_thresh': 28.917512955366153, 'bear_atr_min_pct': 0.0023821404456517018, 'bear_atr_max_pct': 0.125357747574344, 'bear_tp_mult': 1.928191782506343, 'bear_tsl_mult': 0.17220098498956926, 'bear_time_stop': 192, 'bear_use_sma': True, 'bear_use_ema': True, 'bear_use_atr': False, 'bear_use_adx': False, 'bear_use_spike': False, 'bear_rsi_required': False, 'sideways_strategy': 'mean_reversion', 'sideways_bb_std_mult': 3.008320752158255, 'sideways_rsi_os': 35, 'sideways_rsi_ob': 89, 'sideways_adx_thresh': 7.5829322535612285, 'sideways_atr_min_pct': 0.01226511822112954, 'sideways_atr_max_pct': 0.11766643119534699, 'sideways_tp_mult': 2.359893682205266, 'sideways_tsl_mult': 0.048140192436193, 'sideways_time_stop': 138, 'sideways_use_sma': False, 'sideways_use_ema': False, 'sideways_use_atr': True, 'sideways_use_adx': False, 'sideways_use_spike': False, 'sideways_rsi_required': False}.
[I 2025-09-01 13:50:50,951] Trial 160 finished with values: [-1000000000.0, 1000000000.0] and parameters: {'p_sma': 9, 'p_std': 24, 'p_atr': 27, 'p_adx': 18, 'rsi_period': 58, 'ema1': 9, 'ema2': 25, 'slip_atr_k': 0.15859742081955347, 'slip_spread_k': 0.2243180988268253, 'spread_hl_frac': 0.04860781419604193, 'bb_std_mult': 1.8671972963316574, 'rsi_os': 45, 'rsi_ob': 64, 'vol_spike': 0.13986667815714987, 'adx_thresh': 23.59750459438325, 'atr_min_pct': 0.018997233575807907, 'atr_max_pct': 0.012733636577280485, 'tp_mult': 2.883332590242185, 'tsl_mult': 0.8831370647780065, 'strategy': 'breakout', 'time_stop': 84, 'use_sma': True, 'use_atr': True, 'use_adx': False, 'use_ema': False, 'use_spike': True, 'rsi_required': False, 'edge_k': 1.0541458824220236, 'edge_cap': 0.9681406796194245, 'bull_strategy': 'breakout', 'bull_bb_std_mult': 1.3014517391705842, 'bull_rsi_os': 10, 'bull_rsi_ob': 81, 'bull_adx_thresh': 11.213676365289533, 'bull_atr_min_pct': 0.008180877307166927, 'bull_atr_max_pct': 0.14251551502533993, 'bull_tp_mult': 1.3248671105500271, 'bull_tsl_mult': 0.2724443130529659, 'bull_time_stop': 40, 'bull_use_sma': False, 'bull_use_ema': True, 'bull_use_atr': False, 'bull_use_adx': True, 'bull_use_spike': False, 'bull_rsi_required': False, 'bear_strategy': 'breakout', 'bear_bb_std_mult': 2.929497885135366, 'bear_rsi_os': 6, 'bear_rsi_ob': 84, 'bear_adx_thresh': 7.736056170826037, 'bear_atr_min_pct': 0.0025749021100474247, 'bear_atr_max_pct': 0.1259426190055638, 'bear_tp_mult': 1.9029992554849544, 'bear_tsl_mult': 0.09421564979505442, 'bear_time_stop': 67, 'bear_use_sma': False, 'bear_use_ema': True, 'bear_use_atr': True, 'bear_use_adx': False, 'bear_use_spike': False, 'bear_rsi_required': False, 'sideways_strategy': 'breakout', 'sideways_bb_std_mult': 1.1073410833499586, 'sideways_rsi_os': 37, 'sideways_rsi_ob': 53, 'sideways_adx_thresh': 28.898767723769403, 'sideways_atr_min_pct': 0.015697621143459486, 'sideways_atr_max_pct': 0.11925644662612826, 'sideways_tp_mult': 2.368375289790227, 'sideways_tsl_mult': 0.276380364381097, 'sideways_time_stop': 229, 'sideways_use_sma': False, 'sideways_use_ema': True, 'sideways_use_atr': True, 'sideways_use_adx': False, 'sideways_use_spike': False, 'sideways_rsi_required': False}.
[I 2025-09-01 13:51:26,320] Trial 163 finished with values: [-1000000000.0, 1000000000.0] and parameters: {'p_sma': 16, 'p_std': 44, 'p_atr': 17, 'p_adx': 10, 'rsi_period': 61, 'ema1': 9, 'ema2': 31, 'slip_atr_k': 0.014114896026281649, 'slip_spread_k': 0.5908263192962555, 'spread_hl_frac': 0.008617554261224373, 'bb_std_mult': 1.8387424782202553, 'rsi_os': 49, 'rsi_ob': 92, 'vol_spike': 0.29916732613582653, 'adx_thresh': 29.99909490227084, 'atr_min_pct': 0.009698958636925152, 'atr_max_pct': 0.021335794647540814, 'tp_mult': 1.8849819696707792, 'tsl_mult': 0.04048310621285314, 'strategy': 'breakout', 'time_stop': 104, 'use_sma': False, 'use_atr': True, 'use_adx': False, 'use_ema': True, 'use_spike': True, 'rsi_required': False, 'edge_k': 0.5125360282945639, 'edge_cap': 0.42704879774771876, 'bull_strategy': 'breakout', 'bull_bb_std_mult': 3.173291623753869, 'bull_rsi_os': 45, 'bull_rsi_ob': 87, 'bull_adx_thresh': 9.679993133669145, 'bull_atr_min_pct': 0.019529189091019167, 'bull_atr_max_pct': 0.11914849122588671, 'bull_tp_mult': 1.6879027391244315, 'bull_tsl_mult': 0.5950058932220188, 'bull_time_stop': 111, 'bull_use_sma': False, 'bull_use_ema': True, 'bull_use_atr': False, 'bull_use_adx': True, 'bull_use_spike': False, 'bull_rsi_required': False, 'bear_strategy': 'breakout', 'bear_bb_std_mult': 1.6609430456019483, 'bear_rsi_os': 29, 'bear_rsi_ob': 53, 'bear_adx_thresh': 30.38807248015258, 'bear_atr_min_pct': 0.028002879850511662, 'bear_atr_max_pct': 0.09941010617815452, 'bear_tp_mult': 1.068624817816803, 'bear_tsl_mult': 0.4832676456203879, 'bear_time_stop': 108, 'bear_use_sma': False, 'bear_use_ema': True, 'bear_use_atr': True, 'bear_use_adx': True, 'bear_use_spike': False, 'bear_rsi_required': True, 'sideways_strategy': 'breakout', 'sideways_bb_std_mult': 1.0458835747118742, 'sideways_rsi_os': 17, 'sideways_rsi_ob': 57, 'sideways_adx_thresh': 28.570027999684672, 'sideways_atr_min_pct': 0.014044598609022504, 'sideways_atr_max_pct': 0.12498696668761342, 'sideways_tp_mult': 2.2080346010996514, 'sideways_tsl_mult': 0.676310855051618, 'sideways_time_stop': 219, 'sideways_use_sma': False, 'sideways_use_ema': True, 'sideways_use_atr': True, 'sideways_use_adx': False, 'sideways_use_spike': False, 'sideways_rsi_required': False}.
[I 2025-09-01 13:51:27,080] Trial 162 finished with values: [-1000000000.0, 1000000000.0] and parameters: {'p_sma': 12, 'p_std': 45, 'p_atr': 27, 'p_adx': 21, 'rsi_period': 58, 'ema1': 9, 'ema2': 25, 'slip_atr_k': 0.10061417591203234, 'slip_spread_k': 0.3086928800946979, 'spread_hl_frac': 0.008127726805226181, 'bb_std_mult': 2.3002347531406886, 'rsi_os': 42, 'rsi_ob': 64, 'vol_spike': 0.13658636506187416, 'adx_thresh': 21.30098779823544, 'atr_min_pct': 0.028853782136336395, 'atr_max_pct': 0.03739655442123044, 'tp_mult': 2.9183786789251087, 'tsl_mult': 0.5031021955286249, 'strategy': 'breakout', 'time_stop': 105, 'use_sma': False, 'use_atr': True, 'use_adx': False, 'use_ema': True, 'use_spike': True, 'rsi_required': False, 'edge_k': 1.0758967713803904, 'edge_cap': 0.16119721808934917, 'bull_strategy': 'breakout', 'bull_bb_std_mult': 3.3328158785565454, 'bull_rsi_os': 11, 'bull_rsi_ob': 50, 'bull_adx_thresh': 11.252722296195392, 'bull_atr_min_pct': 0.008510134202680535, 'bull_atr_max_pct': 0.12971229552914837, 'bull_tp_mult': 1.328474796801542, 'bull_tsl_mult': 0.16369091309895767, 'bull_time_stop': 187, 'bull_use_sma': False, 'bull_use_ema': True, 'bull_use_atr': False, 'bull_use_adx': True, 'bull_use_spike': False, 'bull_rsi_required': False, 'bear_strategy': 'breakout', 'bear_bb_std_mult': 2.411752265435504, 'bear_rsi_os': 5, 'bear_rsi_ob': 49, 'bear_adx_thresh': 5.752520569343624, 'bear_atr_min_pct': 0.006617384748136109, 'bear_atr_max_pct': 0.06597738522435137, 'bear_tp_mult': 1.1350915830194088, 'bear_tsl_mult': 0.4837714980498351, 'bear_time_stop': 20, 'bear_use_sma': False, 'bear_use_ema': True, 'bear_use_atr': True, 'bear_use_adx': True, 'bear_use_spike': False, 'bear_rsi_required': True, 'sideways_strategy': 'breakout', 'sideways_bb_std_mult': 1.041546995526888, 'sideways_rsi_os': 37, 'sideways_rsi_ob': 87, 'sideways_adx_thresh': 28.79953882410265, 'sideways_atr_min_pct': 0.015607978113406383, 'sideways_atr_max_pct': 0.12491291774620285, 'sideways_tp_mult': 1.6579849032346015, 'sideways_tsl_mult': 0.2746121187187943, 'sideways_time_stop': 122, 'sideways_use_sma': False, 'sideways_use_ema': True, 'sideways_use_atr': True, 'sideways_use_adx': False, 'sideways_use_spike': False, 'sideways_rsi_required': False}.
