[I 2025-09-01 14:53:53,561] Trial 594 finished with values: [-1000000000.0, 1000000000.0] and parameters: {'p_sma': 30, 'p_std': 50, 'p_atr': 12, 'p_adx': 8, 'rsi_period': 79, 'ema1': 8, 'ema2': 52, 'slip_atr_k': 0.003851186128094746, 'slip_spread_k': 0.34680820792449385, 'spread_hl_frac': 0.0029160906365742027, 'bb_std_mult': 1.52669603759836, 'rsi_os': 45, 'rsi_ob': 52, 'vol_spike': 0.1271134958462957, 'adx_thresh': 5.005389909549411, 'atr_min_pct': 0.009286919737631478, 'atr_max_pct': 0.03421619985319684, 'tp_mult': 1.3133904562227425, 'tsl_mult': 0.15809464671029566, 'strategy': 'mean_reversion', 'time_stop': 103, 'use_sma': True, 'use_atr': True, 'use_adx': True, 'use_ema': True, 'use_spike': True, 'rsi_required': True, 'edge_k': 1.8704983596057354, 'edge_cap': 0.9768490842202223, 'bull_strategy': 'mean_reversion', 'bull_bb_std_mult': 0.5117305068600408, 'bull_rsi_os': 25, 'bull_rsi_ob': 80, 'bull_adx_thresh': 7.670898413221778, 'bull_atr_min_pct': 0.012189666154698664, 'bull_atr_max_pct': 0.08007460050126246, 'bull_tp_mult': 1.6179569478347724, 'bull_tsl_mult': 0.49143182744738617, 'bull_time_stop': 144, 'bull_use_sma': False, 'bull_use_ema': True, 'bull_use_atr': True, 'bull_use_adx': False, 'bull_use_spike': True, 'bull_rsi_required': True, 'bear_strategy': 'mean_reversion', 'bear_bb_std_mult': 2.3731283446757394, 'bear_rsi_os': 9, 'bear_rsi_ob': 45, 'bear_adx_thresh': 8.44201647130998, 'bear_atr_min_pct': 0.0014351395208435898, 'bear_atr_max_pct': 0.012268697743519241, 'bear_tp_mult': 2.2441023070696344, 'bear_tsl_mult': 0.07910918745146539, 'bear_time_stop': 98, 'bear_use_sma': False, 'bear_use_ema': False, 'bear_use_atr': False, 'bear_use_adx': False, 'bear_use_spike': True, 'bear_rsi_required': True, 'sideways_strategy': 'mean_reversion', 'sideways_bb_std_mult': 3.017178223685374, 'sideways_rsi_os': 29, 'sideways_rsi_ob': 69, 'sideways_adx_thresh': 10.835943393788984, 'sideways_atr_min_pct': 0.003026393387336197, 'sideways_atr_max_pct': 0.04441878533612298, 'sideways_tp_mult': 2.4131781051710846, 'sideways_tsl_mult': 0.37427877518850383, 'sideways_time_stop': 247, 'sideways_use_sma': True, 'sideways_use_ema': True, 'sideways_use_atr': True, 'sideways_use_adx': True, 'sideways_use_spike': True, 'sideways_rsi_required': False}.
[I 2025-09-01 14:54:24,695] Trial 595 finished with values: [-0.0018580014448044135, 0.007266403293281174] and parameters: {'p_sma': 44, 'p_std': 49, 'p_atr': 26, 'p_adx': 17, 'rsi_period': 79, 'ema1': 30, 'ema2': 52, 'slip_atr_k': 0.00605515030161519, 'slip_spread_k': 0.9300417056291703, 'spread_hl_frac': 0.008706904935215792, 'bb_std_mult': 3.3454380230672247, 'rsi_os': 45, 'rsi_ob': 52, 'vol_spike': 0.20894915208301135, 'adx_thresh': 7.7639448391249655, 'atr_min_pct': 0.011601395696946503, 'atr_max_pct': 0.03467297126131613, 'tp_mult': 1.496943156491053, 'tsl_mult': 0.7182339090772031, 'strategy': 'mean_reversion', 'time_stop': 104, 'use_sma': True, 'use_atr': False, 'use_adx': True, 'use_ema': True, 'use_spike': True, 'rsi_required': True, 'edge_k': 0.2507080639131856, 'edge_cap': 0.9803876732473282, 'bull_strategy': 'mean_reversion', 'bull_bb_std_mult': 0.505281838881992, 'bull_rsi_os': 45, 'bull_rsi_ob': 80, 'bull_adx_thresh': 12.177085243347344, 'bull_atr_min_pct': 0.011585796657839095, 'bull_atr_max_pct': 0.13678072290677834, 'bull_tp_mult': 2.6403009515050924, 'bull_tsl_mult': 0.17329534346872288, 'bull_time_stop': 36, 'bull_use_sma': False, 'bull_use_ema': True, 'bull_use_atr': True, 'bull_use_adx': False, 'bull_use_spike': True, 'bull_rsi_required': True, 'bear_strategy': 'mean_reversion', 'bear_bb_std_mult': 2.3995036651633885, 'bear_rsi_os': 37, 'bear_rsi_ob': 56, 'bear_adx_thresh': 8.484922270339018, 'bear_atr_min_pct': 0.0016834549603958909, 'bear_atr_max_pct': 0.13397002695037685, 'bear_tp_mult': 2.1018675797317083, 'bear_tsl_mult': 0.10011509363966814, 'bear_time_stop': 106, 'bear_use_sma': False, 'bear_use_ema': False, 'bear_use_atr': False, 'bear_use_adx': False, 'bear_use_spike': True, 'bear_rsi_required': True, 'sideways_strategy': 'mean_reversion', 'sideways_bb_std_mult': 3.023544189406392, 'sideways_rsi_os': 28, 'sideways_rsi_ob': 75, 'sideways_adx_thresh': 10.434155096916212, 'sideways_atr_min_pct': 0.005544791628234348, 'sideways_atr_max_pct': 0.04510202979930612, 'sideways_tp_mult': 2.4129824826865516, 'sideways_tsl_mult': 0.9785568171694123, 'sideways_time_stop': 260, 'sideways_use_sma': True, 'sideways_use_ema': True, 'sideways_use_atr': True, 'sideways_use_adx': True, 'sideways_use_spike': False, 'sideways_rsi_required': False}.
[I 2025-09-01 14:54:27,276] Trial 596 finished with values: [-0.004764634274061819, 0.011067297250223783] and parameters: {'p_sma': 29, 'p_std': 24, 'p_atr': 30, 'p_adx': 22, 'rsi_period': 79, 'ema1': 8, 'ema2': 43, 'slip_atr_k': 0.043373315932452625, 'slip_spread_k': 0.3501215392781003, 'spread_hl_frac': 0.009114792834158123, 'bb_std_mult': 1.5641032558875563, 'rsi_os': 45, 'rsi_ob': 92, 'vol_spike': 0.10267793168993937, 'adx_thresh': 7.923644600632569, 'atr_min_pct': 0.011630147305591951, 'atr_max_pct': 0.0341908405849571, 'tp_mult': 1.3202840758058563, 'tsl_mult': 0.5541984067924615, 'strategy': 'mean_reversion', 'time_stop': 123, 'use_sma': True, 'use_atr': False, 'use_adx': True, 'use_ema': True, 'use_spike': True, 'rsi_required': True, 'edge_k': 0.2506676348931915, 'edge_cap': 0.9829049208621932, 'bull_strategy': 'mean_reversion', 'bull_bb_std_mult': 3.323903757436629, 'bull_rsi_os': 16, 'bull_rsi_ob': 79, 'bull_adx_thresh': 23.940028321700797, 'bull_atr_min_pct': 0.01105481220400937, 'bull_atr_max_pct': 0.11331209660349295, 'bull_tp_mult': 1.6129745840873364, 'bull_tsl_mult': 0.17740648131955677, 'bull_time_stop': 65, 'bull_use_sma': False, 'bull_use_ema': True, 'bull_use_atr': True, 'bull_use_adx': False, 'bull_use_spike': True, 'bull_rsi_required': True, 'bear_strategy': 'mean_reversion', 'bear_bb_std_mult': 1.4965460835263271, 'bear_rsi_os': 37, 'bear_rsi_ob': 88, 'bear_adx_thresh': 23.141682317957127, 'bear_atr_min_pct': 0.002575955145070491, 'bear_atr_max_pct': 0.13500482251510937, 'bear_tp_mult': 2.0963534221301146, 'bear_tsl_mult': 0.6873335547065857, 'bear_time_stop': 183, 'bear_use_sma': False, 'bear_use_ema': False, 'bear_use_atr': False, 'bear_use_adx': False, 'bear_use_spike': True, 'bear_rsi_required': True, 'sideways_strategy': 'mean_reversion', 'sideways_bb_std_mult': 2.995734593070396, 'sideways_rsi_os': 33, 'sideways_rsi_ob': 91, 'sideways_adx_thresh': 27.454498762516497, 'sideways_atr_min_pct': 0.0030008767740923696, 'sideways_atr_max_pct': 0.04437268295821412, 'sideways_tp_mult': 2.4164363833689158, 'sideways_tsl_mult': 0.8051672159413042, 'sideways_time_stop': 15, 'sideways_use_sma': True, 'sideways_use_ema': True, 'sideways_use_atr': True, 'sideways_use_adx': True, 'sideways_use_spike': False, 'sideways_rsi_required': False}.
[I 2025-09-01 14:54:28,469] Trial 597 finished with values: [-0.017464415667178712, 0.020530913810452894] and parameters: {'p_sma': 27, 'p_std': 50, 'p_atr': 28, 'p_adx': 9, 'rsi_period': 20, 'ema1': 30, 'ema2': 59, 'slip_atr_k': 0.006154399585502938, 'slip_spread_k': 0.6891822653009222, 'spread_hl_frac': 0.002944374175823397, 'bb_std_mult': 3.3574915876719835, 'rsi_os': 45, 'rsi_ob': 87, 'vol_spike': 0.11258311711485941, 'adx_thresh': 7.851038752581319, 'atr_min_pct': 0.011479395015493667, 'atr_max_pct': 0.03452483840184058, 'tp_mult': 2.7919743319617565, 'tsl_mult': 0.26717244366401316, 'strategy': 'mean_reversion', 'time_stop': 122, 'use_sma': True, 'use_atr': False, 'use_adx': True, 'use_ema': True, 'use_spike': True, 'rsi_required': True, 'edge_k': 0.2425209527260861, 'edge_cap': 0.9113626942909987, 'bull_strategy': 'mean_reversion', 'bull_bb_std_mult': 3.306863188642313, 'bull_rsi_os': 45, 'bull_rsi_ob': 79, 'bull_adx_thresh': 15.792775983288472, 'bull_atr_min_pct': 0.011167847669224351, 'bull_atr_max_pct': 0.13588254478938525, 'bull_tp_mult': 1.5093219528602906, 'bull_tsl_mult': 0.6346977503409, 'bull_time_stop': 142, 'bull_use_sma': False, 'bull_use_ema': True, 'bull_use_atr': True, 'bull_use_adx': True, 'bull_use_spike': True, 'bull_rsi_required': True, 'bear_strategy': 'mean_reversion', 'bear_bb_std_mult': 1.1061430321032608, 'bear_rsi_os': 37, 'bear_rsi_ob': 89, 'bear_adx_thresh': 17.138412299146403, 'bear_atr_min_pct': 0.0024412815728693388, 'bear_atr_max_pct': 0.013914967391394611, 'bear_tp_mult': 2.085435933916497, 'bear_tsl_mult': 0.6822345155462958, 'bear_time_stop': 97, 'bear_use_sma': False, 'bear_use_ema': False, 'bear_use_atr': False, 'bear_use_adx': False, 'bear_use_spike': True, 'bear_rsi_required': True, 'sideways_strategy': 'mean_reversion', 'sideways_bb_std_mult': 1.7691856034764666, 'sideways_rsi_os': 33, 'sideways_rsi_ob': 74, 'sideways_adx_thresh': 10.479109522223844, 'sideways_atr_min_pct': 0.00541010625576962, 'sideways_atr_max_pct': 0.1078698393094976, 'sideways_tp_mult': 2.4117010629346, 'sideways_tsl_mult': 0.970948608937515, 'sideways_time_stop': 259, 'sideways_use_sma': True, 'sideways_use_ema': True, 'sideways_use_atr': True, 'sideways_use_adx': True, 'sideways_use_spike': False, 'sideways_rsi_required': False}.
[I 2025-09-01 14:54:33,143] Trial 598 finished with values: [-1000000000.0, 1000000000.0] and parameters: {'p_sma': 26, 'p_std': 29, 'p_atr': 28, 'p_adx': 9, 'rsi_period': 75, 'ema1': 13, 'ema2': 42, 'slip_atr_k': 0.027264900603790436, 'slip_spread_k': 0.4068401884447874, 'spread_hl_frac': 0.008948243819446512, 'bb_std_mult': 3.342475851471367, 'rsi_os': 42, 'rsi_ob': 51, 'vol_spike': 0.014753762561855205, 'adx_thresh': 7.799793741231483, 'atr_min_pct': 0.011675634926658816, 'atr_max_pct': 0.11631247835784275, 'tp_mult': 1.4754383866140757, 'tsl_mult': 0.6758898067433272, 'strategy': 'mean_reversion', 'time_stop': 120, 'use_sma': True, 'use_atr': False, 'use_adx': True, 'use_ema': True, 'use_spike': True, 'rsi_required': True, 'edge_k': 0.23770577137393717, 'edge_cap': 0.7529780196125295, 'bull_strategy': 'breakout', 'bull_bb_std_mult': 3.3153311312301432, 'bull_rsi_os': 14, 'bull_rsi_ob': 79, 'bull_adx_thresh': 24.07222653604891, 'bull_atr_min_pct': 0.011079641691359577, 'bull_atr_max_pct': 0.08469171853847443, 'bull_tp_mult': 1.5640859649580467, 'bull_tsl_mult': 0.636180943647631, 'bull_time_stop': 159, 'bull_use_sma': False, 'bull_use_ema': True, 'bull_use_atr': True, 'bull_use_adx': True, 'bull_use_spike': True, 'bull_rsi_required': True, 'bear_strategy': 'mean_reversion', 'bear_bb_std_mult': 2.459967519095199, 'bear_rsi_os': 23, 'bear_rsi_ob': 90, 'bear_adx_thresh': 16.959568391646705, 'bear_atr_min_pct': 0.002469220035860373, 'bear_atr_max_pct': 0.14594853225030813, 'bear_tp_mult': 1.9992633652954441, 'bear_tsl_mult': 0.11878111980158507, 'bear_time_stop': 199, 'bear_use_sma': True, 'bear_use_ema': False, 'bear_use_atr': False, 'bear_use_adx': False, 'bear_use_spike': True, 'bear_rsi_required': True, 'sideways_strategy': 'mean_reversion', 'sideways_bb_std_mult': 2.8881125521070627, 'sideways_rsi_os': 33, 'sideways_rsi_ob': 90, 'sideways_adx_thresh': 15.99150614585556, 'sideways_atr_min_pct': 0.005587336816962063, 'sideways_atr_max_pct': 0.10756172553209738, 'sideways_tp_mult': 2.5430918091600914, 'sideways_tsl_mult': 0.8727848080830737, 'sideways_time_stop': 16, 'sideways_use_sma': True, 'sideways_use_ema': True, 'sideways_use_atr': True, 'sideways_use_adx': True, 'sideways_use_spike': False, 'sideways_rsi_required': False}.
[I 2025-09-01 14:54:33,741] Trial 600 finished with values: [-1000000000.0, 1000000000.0] and parameters: {'p_sma': 15, 'p_std': 29, 'p_atr': 27, 'p_adx': 9, 'rsi_period': 20, 'ema1': 9, 'ema2': 55, 'slip_atr_k': 0.028293171774219722, 'slip_spread_k': 0.5608395739405387, 'spread_hl_frac': 0.005031506659644268, 'bb_std_mult': 3.4199133943103215, 'rsi_os': 52, 'rsi_ob': 62, 'vol_spike': 0.014729065838090444, 'adx_thresh': 6.712467949041784, 'atr_min_pct': 0.010638402338436012, 'atr_max_pct': 0.03941656457516171, 'tp_mult': 1.5370213238780541, 'tsl_mult': 0.6738371153551772, 'strategy': 'mean_reversion', 'time_stop': 120, 'use_sma': False, 'use_atr': False, 'use_adx': False, 'use_ema': True, 'use_spike': True, 'rsi_required': False, 'edge_k': 0.32494851030701655, 'edge_cap': 0.8714689694276965, 'bull_strategy': 'breakout', 'bull_bb_std_mult': 3.1982733628675555, 'bull_rsi_os': 50, 'bull_rsi_ob': 82, 'bull_adx_thresh': 12.347763932687563, 'bull_atr_min_pct': 0.009926994911163344, 'bull_atr_max_pct': 0.14507673272436675, 'bull_tp_mult': 1.5106110993205015, 'bull_tsl_mult': 0.4501059977892719, 'bull_time_stop': 163, 'bull_use_sma': False, 'bull_use_ema': True, 'bull_use_atr': True, 'bull_use_adx': True, 'bull_use_spike': True, 'bull_rsi_required': True, 'bear_strategy': 'mean_reversion', 'bear_bb_std_mult': 1.0590708639486832, 'bear_rsi_os': 33, 'bear_rsi_ob': 95, 'bear_adx_thresh': 28.05018473381429, 'bear_atr_min_pct': 0.002772576860476905, 'bear_atr_max_pct': 0.14539983486870742, 'bear_tp_mult': 1.9939406300418714, 'bear_tsl_mult': 0.7858217220154275, 'bear_time_stop': 148, 'bear_use_sma': True, 'bear_use_ema': True, 'bear_use_atr': False, 'bear_use_adx': False, 'bear_use_spike': False, 'bear_rsi_required': False, 'sideways_strategy': 'mean_reversion', 'sideways_bb_std_mult': 2.869836315087009, 'sideways_rsi_os': 30, 'sideways_rsi_ob': 93, 'sideways_adx_thresh': 26.54783380275004, 'sideways_atr_min_pct': 0.02880343970468985, 'sideways_atr_max_pct': 0.1068234236970175, 'sideways_tp_mult': 2.785283833200216, 'sideways_tsl_mult': 0.38095970690386327, 'sideways_time_stop': 257, 'sideways_use_sma': False, 'sideways_use_ema': True, 'sideways_use_atr': False, 'sideways_use_adx': False, 'sideways_use_spike': False, 'sideways_rsi_required': False}.
[I 2025-09-01 14:55:11,363] Trial 601 finished with values: [-1000000000.0, 1000000000.0] and parameters: {'p_sma': 34, 'p_std': 10, 'p_atr': 11, 'p_adx': 7, 'rsi_period': 82, 'ema1': 19, 'ema2': 35, 'slip_atr_k': 0.028615493596577904, 'slip_spread_k': 0.558443722667431, 'spread_hl_frac': 0.03748469862491838, 'bb_std_mult': 1.2529565687195054, 'rsi_os': 42, 'rsi_ob': 62, 'vol_spike': 0.10608711922925962, 'adx_thresh': 6.003350013602329, 'atr_min_pct': 0.010554086733755104, 'atr_max_pct': 0.06289298989130944, 'tp_mult': 1.5344812920388167, 'tsl_mult': 0.43534493346112313, 'strategy': 'mean_reversion', 'time_stop': 111, 'use_sma': False, 'use_atr': False, 'use_adx': False, 'use_ema': True, 'use_spike': True, 'rsi_required': False, 'edge_k': 0.30253131598706695, 'edge_cap': 0.9564810186843654, 'bull_strategy': 'breakout', 'bull_bb_std_mult': 3.1729485075205366, 'bull_rsi_os': 14, 'bull_rsi_ob': 72, 'bull_adx_thresh': 12.475807398999947, 'bull_atr_min_pct': 0.00998900739697675, 'bull_atr_max_pct': 0.03898083738847832, 'bull_tp_mult': 2.9987373453979314, 'bull_tsl_mult': 0.9625587905748789, 'bull_time_stop': 255, 'bull_use_sma': False, 'bull_use_ema': True, 'bull_use_atr': True, 'bull_use_adx': True, 'bull_use_spike': True, 'bull_rsi_required': True, 'bear_strategy': 'mean_reversion', 'bear_bb_std_mult': 0.5336763859120968, 'bear_rsi_os': 29, 'bear_rsi_ob': 59, 'bear_adx_thresh': 7.709306605467721, 'bear_atr_min_pct': 0.0030057362889695117, 'bear_atr_max_pct': 0.10853981880152387, 'bear_tp_mult': 1.9908166195391654, 'bear_tsl_mult': 0.35791905826502607, 'bear_time_stop': 276, 'bear_use_sma': True, 'bear_use_ema': True, 'bear_use_atr': False, 'bear_use_adx': False, 'bear_use_spike': False, 'bear_rsi_required': False, 'sideways_strategy': 'mean_reversion', 'sideways_bb_std_mult': 3.161348601360145, 'sideways_rsi_os': 19, 'sideways_rsi_ob': 90, 'sideways_adx_thresh': 12.911671398462197, 'sideways_atr_min_pct': 0.0036950488406756305, 'sideways_atr_max_pct': 0.12313813235158581, 'sideways_tp_mult': 1.8243201327150433, 'sideways_tsl_mult': 0.3560914498070746, 'sideways_time_stop': 266, 'sideways_use_sma': False, 'sideways_use_ema': True, 'sideways_use_atr': False, 'sideways_use_adx': False, 'sideways_use_spike': False, 'sideways_rsi_required': False}.
[I 2025-09-01 14:55:11,916] Trial 599 finished with values: [-1000000000.0, 1000000000.0] and parameters: {'p_sma': 29, 'p_std': 27, 'p_atr': 28, 'p_adx': 9, 'rsi_period': 20, 'ema1': 9, 'ema2': 34, 'slip_atr_k': 0.027887214019741452, 'slip_spread_k': 0.5555851159724495, 'spread_hl_frac': 0.009171237985742018, 'bb_std_mult': 0.8626985294025966, 'rsi_os': 42, 'rsi_ob': 53, 'vol_spike': 0.10119379776863321, 'adx_thresh': 6.8191220989979495, 'atr_min_pct': 0.0151262518995002, 'atr_max_pct': 0.06267197995231517, 'tp_mult': 1.4601283867720973, 'tsl_mult': 0.6861061656558649, 'strategy': 'mean_reversion', 'time_stop': 119, 'use_sma': False, 'use_atr': False, 'use_adx': True, 'use_ema': True, 'use_spike': True, 'rsi_required': False, 'edge_k': 0.220175304626415, 'edge_cap': 0.8686931780295024, 'bull_strategy': 'breakout', 'bull_bb_std_mult': 2.323467990056352, 'bull_rsi_os': 16, 'bull_rsi_ob': 79, 'bull_adx_thresh': 12.330078860839736, 'bull_atr_min_pct': 0.011073649121091999, 'bull_atr_max_pct': 0.08421564786913716, 'bull_tp_mult': 1.506695837881045, 'bull_tsl_mult': 0.1010607186474039, 'bull_time_stop': 158, 'bull_use_sma': False, 'bull_use_ema': True, 'bull_use_atr': True, 'bull_use_adx': True, 'bull_use_spike': True, 'bull_rsi_required': True, 'bear_strategy': 'mean_reversion', 'bear_bb_std_mult': 2.889511784105479, 'bear_rsi_os': 41, 'bear_rsi_ob': 90, 'bear_adx_thresh': 7.858395384951991, 'bear_atr_min_pct': 0.0025338971957949864, 'bear_atr_max_pct': 0.14662590317983573, 'bear_tp_mult': 2.0037843011800005, 'bear_tsl_mult': 0.11435218916408116, 'bear_time_stop': 5, 'bear_use_sma': True, 'bear_use_ema': True, 'bear_use_atr': False, 'bear_use_adx': False, 'bear_use_spike': False, 'bear_rsi_required': False, 'sideways_strategy': 'mean_reversion', 'sideways_bb_std_mult': 2.878407434361752, 'sideways_rsi_os': 33, 'sideways_rsi_ob': 91, 'sideways_adx_thresh': 16.173098609196213, 'sideways_atr_min_pct': 0.026206363713722793, 'sideways_atr_max_pct': 0.10737763793462979, 'sideways_tp_mult': 2.53679061567755, 'sideways_tsl_mult': 0.022717321528319068, 'sideways_time_stop': 257, 'sideways_use_sma': False, 'sideways_use_ema': True, 'sideways_use_atr': False, 'sideways_use_adx': False, 'sideways_use_spike': False, 'sideways_rsi_required': False}.
[I 2025-09-01 14:55:13,769] Trial 602 finished with values: [-1000000000.0, 1000000000.0] and parameters: {'p_sma': 34, 'p_std': 27, 'p_atr': 16, 'p_adx': 7, 'rsi_period': 82, 'ema1': 9, 'ema2': 55, 'slip_atr_k': 0.00038737799239605374, 'slip_spread_k': 0.5631076545542799, 'spread_hl_frac': 0.005876771543132815, 'bb_std_mult': 1.0885240114962462, 'rsi_os': 33, 'rsi_ob': 68, 'vol_spike': 0.10698541381567697, 'adx_thresh': 6.90872557895406, 'atr_min_pct': 0.013642605162147388, 'atr_max_pct': 0.03981948508509198, 'tp_mult': 1.4431006596203515, 'tsl_mult': 0.4372736585413703, 'strategy': 'mean_reversion', 'time_stop': 110, 'use_sma': False, 'use_atr': False, 'use_adx': False, 'use_ema': True, 'use_spike': True, 'rsi_required': False, 'edge_k': 0.3178308698583568, 'edge_cap': 0.5980891157832766, 'bull_strategy': 'breakout', 'bull_bb_std_mult': 3.1878890083179896, 'bull_rsi_os': 41, 'bull_rsi_ob': 82, 'bull_adx_thresh': 8.524745721680274, 'bull_atr_min_pct': 0.010177080645672413, 'bull_atr_max_pct': 0.1448542826270512, 'bull_tp_mult': 1.7044763430395236, 'bull_tsl_mult': 0.2882384780316382, 'bull_time_stop': 196, 'bull_use_sma': False, 'bull_use_ema': True, 'bull_use_atr': True, 'bull_use_adx': True, 'bull_use_spike': True, 'bull_rsi_required': True, 'bear_strategy': 'mean_reversion', 'bear_bb_std_mult': 0.5543412934705483, 'bear_rsi_os': 33, 'bear_rsi_ob': 60, 'bear_adx_thresh': 7.75682768224584, 'bear_atr_min_pct': 0.0030268389921691537, 'bear_atr_max_pct': 0.10823141229163084, 'bear_tp_mult': 1.9772106675161931, 'bear_tsl_mult': 0.17994544817835129, 'bear_time_stop': 265, 'bear_use_sma': True, 'bear_use_ema': True, 'bear_use_atr': False, 'bear_use_adx': False, 'bear_use_spike': False, 'bear_rsi_required': False, 'sideways_strategy': 'mean_reversion', 'sideways_bb_std_mult': 3.141262789785481, 'sideways_rsi_os': 30, 'sideways_rsi_ob': 89, 'sideways_adx_thresh': 30.593848981710885, 'sideways_atr_min_pct': 0.020585533687521675, 'sideways_atr_max_pct': 0.11551852990563957, 'sideways_tp_mult': 2.78163583328075, 'sideways_tsl_mult': 0.35458787800541114, 'sideways_time_stop': 267, 'sideways_use_sma': False, 'sideways_use_ema': True, 'sideways_use_atr': False, 'sideways_use_adx': False, 'sideways_use_spike': False, 'sideways_rsi_required': False}.
