[I 2025-09-01 13:43:39,113] Trial 109 finished with values: [-1000000000.0, 1000000000.0] and parameters: {'p_sma': 35, 'p_std': 14, 'p_atr': 8, 'p_adx': 26, 'rsi_period': 81, 'ema1': 9, 'ema2': 36, 'slip_atr_k': 0.13833659942632473, 'slip_spread_k': 0.644806809828786, 'spread_hl_frac': 0.008754028864232937, 'bb_std_mult': 2.249612531247408, 'rsi_os': 50, 'rsi_ob': 55, 'vol_spike': 0.1396186776379537, 'adx_thresh': 17.361398521196577, 'atr_min_pct': 0.021387716287514964, 'atr_max_pct': 0.10721189746373495, 'tp_mult': 2.7922059372480064, 'tsl_mult': 0.09751302784226529, 'strategy': 'mean_reversion', 'time_stop': 89, 'use_sma': True, 'use_atr': True, 'use_adx': False, 'use_ema': True, 'use_spike': True, 'rsi_required': False, 'edge_k': 1.1282913828205774, 'edge_cap': 0.08934614206393993, 'bull_strategy': 'mean_reversion', 'bull_bb_std_mult': 1.170276398520922, 'bull_rsi_os': 22, 'bull_rsi_ob': 64, 'bull_adx_thresh': 16.294289540630317, 'bull_atr_min_pct': 0.02981045392149597, 'bull_atr_max_pct': 0.10924773799183096, 'bull_tp_mult': 2.5399102474349213, 'bull_tsl_mult': 0.49605642802547434, 'bull_time_stop': 204, 'bull_use_sma': False, 'bull_use_ema': False, 'bull_use_atr': True, 'bull_use_adx': True, 'bull_use_spike': False, 'bull_rsi_required': False, 'bear_strategy': 'breakout', 'bear_bb_std_mult': 1.556518710474732, 'bear_rsi_os': 46, 'bear_rsi_ob': 47, 'bear_adx_thresh': 6.55403461164741, 'bear_atr_min_pct': 0.010510600023790978, 'bear_atr_max_pct': 0.055493056882287825, 'bear_tp_mult': 1.1651846884374013, 'bear_tsl_mult': 0.1425243444727043, 'bear_time_stop': 116, 'bear_use_sma': False, 'bear_use_ema': True, 'bear_use_atr': False, 'bear_use_adx': True, 'bear_use_spike': True, 'bear_rsi_required': True, 'sideways_strategy': 'breakout', 'sideways_bb_std_mult': 1.3530845582048565, 'sideways_rsi_os': 21, 'sideways_rsi_ob': 81, 'sideways_adx_thresh': 27.196959108865407, 'sideways_atr_min_pct': 0.01180648352234075, 'sideways_atr_max_pct': 0.06073935629396867, 'sideways_tp_mult': 1.448028312939569, 'sideways_tsl_mult': 0.23756600835564506, 'sideways_time_stop': 280, 'sideways_use_sma': False, 'sideways_use_ema': False, 'sideways_use_atr': True, 'sideways_use_adx': False, 'sideways_use_spike': False, 'sideways_rsi_required': True}.
[I 2025-09-01 13:44:16,881] Trial 108 finished with values: [-1000000000.0, 1000000000.0] and parameters: {'p_sma': 34, 'p_std': 54, 'p_atr': 21, 'p_adx': 26, 'rsi_period': 75, 'ema1': 9, 'ema2': 37, 'slip_atr_k': 0.1356912217795327, 'slip_spread_k': 0.5675252789974151, 'spread_hl_frac': 0.008622234526476924, 'bb_std_mult': 2.223215603221323, 'rsi_os': 43, 'rsi_ob': 76, 'vol_spike': 0.11614140011035112, 'adx_thresh': 26.6699446301037, 'atr_min_pct': 0.021635177781343044, 'atr_max_pct': 0.02184526973803814, 'tp_mult': 1.9973868940966912, 'tsl_mult': 0.03057668127744252, 'strategy': 'mean_reversion', 'time_stop': 26, 'use_sma': True, 'use_atr': True, 'use_adx': False, 'use_ema': True, 'use_spike': True, 'rsi_required': False, 'edge_k': 1.0805205041221382, 'edge_cap': 0.7162900969822011, 'bull_strategy': 'mean_reversion', 'bull_bb_std_mult': 1.123075585575116, 'bull_rsi_os': 11, 'bull_rsi_ob': 64, 'bull_adx_thresh': 17.073564866848653, 'bull_atr_min_pct': 0.020253707522960414, 'bull_atr_max_pct': 0.08482543248884722, 'bull_tp_mult': 2.5667872066047086, 'bull_tsl_mult': 0.504941222589609, 'bull_time_stop': 237, 'bull_use_sma': False, 'bull_use_ema': False, 'bull_use_atr': True, 'bull_use_adx': True, 'bull_use_spike': False, 'bull_rsi_required': False, 'bear_strategy': 'breakout', 'bear_bb_std_mult': 2.908748739084921, 'bear_rsi_os': 13, 'bear_rsi_ob': 55, 'bear_adx_thresh': 8.244214056266985, 'bear_atr_min_pct': 0.0092072487219086, 'bear_atr_max_pct': 0.05516529698854933, 'bear_tp_mult': 1.094644138646692, 'bear_tsl_mult': 0.13900971412326832, 'bear_time_stop': 120, 'bear_use_sma': False, 'bear_use_ema': True, 'bear_use_atr': False, 'bear_use_adx': True, 'bear_use_spike': True, 'bear_rsi_required': True, 'sideways_strategy': 'breakout', 'sideways_bb_std_mult': 1.317771667336141, 'sideways_rsi_os': 15, 'sideways_rsi_ob': 82, 'sideways_adx_thresh': 19.733111174291967, 'sideways_atr_min_pct': 0.029950185574606318, 'sideways_atr_max_pct': 0.08749177423387784, 'sideways_tp_mult': 2.738856137488483, 'sideways_tsl_mult': 0.7174907289730991, 'sideways_time_stop': 274, 'sideways_use_sma': False, 'sideways_use_ema': False, 'sideways_use_atr': True, 'sideways_use_adx': False, 'sideways_use_spike': False, 'sideways_rsi_required': True}.
[I 2025-09-01 13:44:18,663] Trial 111 finished with values: [-1000000000.0, 1000000000.0] and parameters: {'p_sma': 51, 'p_std': 35, 'p_atr': 11, 'p_adx': 18, 'rsi_period': 79, 'ema1': 9, 'ema2': 56, 'slip_atr_k': 0.037050722480575574, 'slip_spread_k': 0.033533045065715084, 'spread_hl_frac': 0.0442533076359838, 'bb_std_mult': 2.2435234594921956, 'rsi_os': 43, 'rsi_ob': 86, 'vol_spike': 0.13648356005741197, 'adx_thresh': 23.5852676658467, 'atr_min_pct': 0.021432792609642697, 'atr_max_pct': 0.04316984303305116, 'tp_mult': 2.754799782750957, 'tsl_mult': 0.09488584246480641, 'strategy': 'mean_reversion', 'time_stop': 126, 'use_sma': True, 'use_atr': False, 'use_adx': True, 'use_ema': True, 'use_spike': True, 'rsi_required': False, 'edge_k': 1.0722382571798976, 'edge_cap': 0.3402917626272295, 'bull_strategy': 'mean_reversion', 'bull_bb_std_mult': 2.0174430154801497, 'bull_rsi_os': 22, 'bull_rsi_ob': 92, 'bull_adx_thresh': 11.743710891909945, 'bull_atr_min_pct': 0.010966335594337944, 'bull_atr_max_pct': 0.11588989702476106, 'bull_tp_mult': 1.59758267398462, 'bull_tsl_mult': 0.5775978326072385, 'bull_time_stop': 230, 'bull_use_sma': False, 'bull_use_ema': False, 'bull_use_atr': True, 'bull_use_adx': False, 'bull_use_spike': False, 'bull_rsi_required': True, 'bear_strategy': 'mean_reversion', 'bear_bb_std_mult': 2.909643239821126, 'bear_rsi_os': 13, 'bear_rsi_ob': 55, 'bear_adx_thresh': 6.608236979349791, 'bear_atr_min_pct': 0.006306993336433253, 'bear_atr_max_pct': 0.025763956658810497, 'bear_tp_mult': 2.0999944861784, 'bear_tsl_mult': 0.14278387596616957, 'bear_time_stop': 76, 'bear_use_sma': True, 'bear_use_ema': False, 'bear_use_atr': False, 'bear_use_adx': False, 'bear_use_spike': True, 'bear_rsi_required': False, 'sideways_strategy': 'breakout', 'sideways_bb_std_mult': 0.753068842104371, 'sideways_rsi_os': 38, 'sideways_rsi_ob': 89, 'sideways_adx_thresh': 15.436896502025673, 'sideways_atr_min_pct': 0.018399452110441545, 'sideways_atr_max_pct': 0.12744794854467972, 'sideways_tp_mult': 2.132886651159678, 'sideways_tsl_mult': 0.7184956254664223, 'sideways_time_stop': 87, 'sideways_use_sma': True, 'sideways_use_ema': False, 'sideways_use_atr': False, 'sideways_use_adx': False, 'sideways_use_spike': True, 'sideways_rsi_required': True}.
[I 2025-09-01 13:44:19,726] Trial 110 finished with values: [-1000000000.0, 1000000000.0] and parameters: {'p_sma': 12, 'p_std': 43, 'p_atr': 13, 'p_adx': 26, 'rsi_period': 80, 'ema1': 9, 'ema2': 15, 'slip_atr_k': 0.13851785493586055, 'slip_spread_k': 0.0886658995293566, 'spread_hl_frac': 0.008443414698374561, 'bb_std_mult': 1.6010053974776441, 'rsi_os': 43, 'rsi_ob': 66, 'vol_spike': 0.11635503587145761, 'adx_thresh': 6.56585738315942, 'atr_min_pct': 0.018750682524093697, 'atr_max_pct': 0.044970726925590794, 'tp_mult': 2.007842455985195, 'tsl_mult': 0.031618521456480406, 'strategy': 'mean_reversion', 'time_stop': 283, 'use_sma': True, 'use_atr': True, 'use_adx': False, 'use_ema': True, 'use_spike': True, 'rsi_required': False, 'edge_k': 1.1126336725191033, 'edge_cap': 0.35576244311846417, 'bull_strategy': 'mean_reversion', 'bull_bb_std_mult': 1.2030553732395983, 'bull_rsi_os': 22, 'bull_rsi_ob': 55, 'bull_adx_thresh': 18.521935142256183, 'bull_atr_min_pct': 0.010950818807637616, 'bull_atr_max_pct': 0.10087986010761416, 'bull_tp_mult': 1.7829036899741535, 'bull_tsl_mult': 0.5917487751953431, 'bull_time_stop': 235, 'bull_use_sma': False, 'bull_use_ema': False, 'bull_use_atr': True, 'bull_use_adx': False, 'bull_use_spike': False, 'bull_rsi_required': False, 'bear_strategy': 'mean_reversion', 'bear_bb_std_mult': 1.514180965109711, 'bear_rsi_os': 13, 'bear_rsi_ob': 64, 'bear_adx_thresh': 6.76203584179597, 'bear_atr_min_pct': 0.006101392134088279, 'bear_atr_max_pct': 0.06323832384557217, 'bear_tp_mult': 2.4004607555277833, 'bear_tsl_mult': 0.13222402673673428, 'bear_time_stop': 36, 'bear_use_sma': True, 'bear_use_ema': True, 'bear_use_atr': False, 'bear_use_adx': False, 'bear_use_spike': True, 'bear_rsi_required': False, 'sideways_strategy': 'breakout', 'sideways_bb_std_mult': 0.5949282093732695, 'sideways_rsi_os': 38, 'sideways_rsi_ob': 89, 'sideways_adx_thresh': 19.34914958113295, 'sideways_atr_min_pct': 0.027824618371301273, 'sideways_atr_max_pct': 0.12787660229390985, 'sideways_tp_mult': 2.925930810783119, 'sideways_tsl_mult': 0.7168227768856741, 'sideways_time_stop': 88, 'sideways_use_sma': True, 'sideways_use_ema': False, 'sideways_use_atr': False, 'sideways_use_adx': True, 'sideways_use_spike': True, 'sideways_rsi_required': True}.
[I 2025-09-01 13:44:20,056] Trial 112 finished with values: [-1000000000.0, 1000000000.0] and parameters: {'p_sma': 13, 'p_std': 54, 'p_atr': 11, 'p_adx': 26, 'rsi_period': 72, 'ema1': 5, 'ema2': 15, 'slip_atr_k': 0.1866144741800892, 'slip_spread_k': 0.03949890071134482, 'spread_hl_frac': 0.009977778229535196, 'bb_std_mult': 1.4026374425741719, 'rsi_os': 48, 'rsi_ob': 86, 'vol_spike': 0.01762059435216673, 'adx_thresh': 24.55535572871076, 'atr_min_pct': 0.018590890735446036, 'atr_max_pct': 0.04471286919696119, 'tp_mult': 1.9088291531808017, 'tsl_mult': 0.03403325649664529, 'strategy': 'mean_reversion', 'time_stop': 156, 'use_sma': True, 'use_atr': False, 'use_adx': True, 'use_ema': True, 'use_spike': False, 'rsi_required': False, 'edge_k': 0.7206941289472294, 'edge_cap': 0.34554590465421653, 'bull_strategy': 'mean_reversion', 'bull_bb_std_mult': 0.5023726253055809, 'bull_rsi_os': 24, 'bull_rsi_ob': 93, 'bull_adx_thresh': 7.9483953276815935, 'bull_atr_min_pct': 0.013376677517556015, 'bull_atr_max_pct': 0.09954123964243368, 'bull_tp_mult': 2.7944239750621085, 'bull_tsl_mult': 0.5959965431582921, 'bull_time_stop': 117, 'bull_use_sma': True, 'bull_use_ema': False, 'bull_use_atr': False, 'bull_use_adx': False, 'bull_use_spike': False, 'bull_rsi_required': True, 'bear_strategy': 'mean_reversion', 'bear_bb_std_mult': 3.3757190595780844, 'bear_rsi_os': 13, 'bear_rsi_ob': 64, 'bear_adx_thresh': 25.435832230147334, 'bear_atr_min_pct': 0.0060983499621311615, 'bear_atr_max_pct': 0.0346491025040621, 'bear_tp_mult': 2.503140990357442, 'bear_tsl_mult': 0.22230839480919432, 'bear_time_stop': 38, 'bear_use_sma': True, 'bear_use_ema': False, 'bear_use_atr': False, 'bear_use_adx': False, 'bear_use_spike': True, 'bear_rsi_required': False, 'sideways_strategy': 'mean_reversion', 'sideways_bb_std_mult': 0.658709134602171, 'sideways_rsi_os': 16, 'sideways_rsi_ob': 84, 'sideways_adx_thresh': 19.41140993434992, 'sideways_atr_min_pct': 0.014424152511293788, 'sideways_atr_max_pct': 0.13456497442187854, 'sideways_tp_mult': 2.939071053927813, 'sideways_tsl_mult': 0.713705922062585, 'sideways_time_stop': 113, 'sideways_use_sma': True, 'sideways_use_ema': True, 'sideways_use_atr': False, 'sideways_use_adx': False, 'sideways_use_spike': True, 'sideways_rsi_required': True}.
[I 2025-09-01 13:44:58,179] Trial 115 finished with values: [-1000000000.0, 1000000000.0] and parameters: {'p_sma': 15, 'p_std': 26, 'p_atr': 12, 'p_adx': 28, 'rsi_period': 10, 'ema1': 27, 'ema2': 48, 'slip_atr_k': 0.18424840235102466, 'slip_spread_k': 0.3468182833812121, 'spread_hl_frac': 0.00998735835127708, 'bb_std_mult': 1.453297619597189, 'rsi_os': 48, 'rsi_ob': 69, 'vol_spike': 0.15002146185950593, 'adx_thresh': 22.47759169029129, 'atr_min_pct': 0.017357815192780793, 'atr_max_pct': 0.07201438287207805, 'tp_mult': 2.67804292932605, 'tsl_mult': 0.052144384465633506, 'strategy': 'breakout', 'time_stop': 155, 'use_sma': True, 'use_atr': True, 'use_adx': True, 'use_ema': False, 'use_spike': False, 'rsi_required': False, 'edge_k': 1.2565686090816923, 'edge_cap': 0.30395503590487505, 'bull_strategy': 'breakout', 'bull_bb_std_mult': 1.666297573482106, 'bull_rsi_os': 42, 'bull_rsi_ob': 53, 'bull_adx_thresh': 8.141358457670535, 'bull_atr_min_pct': 0.014271683065823448, 'bull_atr_max_pct': 0.010373489773698966, 'bull_tp_mult': 2.781311504496295, 'bull_tsl_mult': 0.599544991418184, 'bull_time_stop': 135, 'bull_use_sma': True, 'bull_use_ema': True, 'bull_use_atr': False, 'bull_use_adx': True, 'bull_use_spike': False, 'bull_rsi_required': False, 'bear_strategy': 'breakout', 'bear_bb_std_mult': 3.331940264830406, 'bear_rsi_os': 16, 'bear_rsi_ob': 79, 'bear_adx_thresh': 5.046706925391919, 'bear_atr_min_pct': 0.005020567593309516, 'bear_atr_max_pct': 0.0824050465783513, 'bear_tp_mult': 1.965697636328329, 'bear_tsl_mult': 0.10850081679286681, 'bear_time_stop': 65, 'bear_use_sma': True, 'bear_use_ema': False, 'bear_use_atr': False, 'bear_use_adx': True, 'bear_use_spike': False, 'bear_rsi_required': False, 'sideways_strategy': 'mean_reversion', 'sideways_bb_std_mult': 2.9078170149685274, 'sideways_rsi_os': 52, 'sideways_rsi_ob': 93, 'sideways_adx_thresh': 24.893113063522403, 'sideways_atr_min_pct': 0.0146078799643396, 'sideways_atr_max_pct': 0.09430359014568097, 'sideways_tp_mult': 2.404147965581313, 'sideways_tsl_mult': 0.7866952365643856, 'sideways_time_stop': 227, 'sideways_use_sma': False, 'sideways_use_ema': True, 'sideways_use_atr': True, 'sideways_use_adx': False, 'sideways_use_spike': False, 'sideways_rsi_required': False}.
[I 2025-09-01 13:44:58,648] Trial 116 finished with values: [-1000000000.0, 1000000000.0] and parameters: {'p_sma': 18, 'p_std': 30, 'p_atr': 17, 'p_adx': 28, 'rsi_period': 30, 'ema1': 27, 'ema2': 59, 'slip_atr_k': 0.18109453902456896, 'slip_spread_k': 0.46414328101309477, 'spread_hl_frac': 0.007022538102032362, 'bb_std_mult': 1.1892437544539325, 'rsi_os': 48, 'rsi_ob': 71, 'vol_spike': 0.08744521906286408, 'adx_thresh': 32.17635957300851, 'atr_min_pct': 0.01723179148731424, 'atr_max_pct': 0.07167155938912534, 'tp_mult': 2.1211475444767607, 'tsl_mult': 0.9145183914059022, 'strategy': 'breakout', 'time_stop': 148, 'use_sma': True, 'use_atr': True, 'use_adx': True, 'use_ema': False, 'use_spike': False, 'rsi_required': False, 'edge_k': 1.7303223235705842, 'edge_cap': 0.30320708755439696, 'bull_strategy': 'breakout', 'bull_bb_std_mult': 1.011035495032439, 'bull_rsi_os': 47, 'bull_rsi_ob': 58, 'bull_adx_thresh': 21.714748963075657, 'bull_atr_min_pct': 0.00740996489344152, 'bull_atr_max_pct': 0.020745958079015005, 'bull_tp_mult': 1.3452518733370362, 'bull_tsl_mult': 0.3899855985810978, 'bull_time_stop': 123, 'bull_use_sma': True, 'bull_use_ema': True, 'bull_use_atr': False, 'bull_use_adx': True, 'bull_use_spike': False, 'bull_rsi_required': False, 'bear_strategy': 'breakout', 'bear_bb_std_mult': 3.2669566411069098, 'bear_rsi_os': 15, 'bear_rsi_ob': 95, 'bear_adx_thresh': 8.175294701031481, 'bear_atr_min_pct': 0.005001667609938028, 'bear_atr_max_pct': 0.07103008258421656, 'bear_tp_mult': 1.957325226730304, 'bear_tsl_mult': 0.4803483441946209, 'bear_time_stop': 220, 'bear_use_sma': False, 'bear_use_ema': False, 'bear_use_atr': False, 'bear_use_adx': True, 'bear_use_spike': False, 'bear_rsi_required': True, 'sideways_strategy': 'mean_reversion', 'sideways_bb_std_mult': 3.1345504007802045, 'sideways_rsi_os': 33, 'sideways_rsi_ob': 94, 'sideways_adx_thresh': 24.612137961377876, 'sideways_atr_min_pct': 0.01535412112215293, 'sideways_atr_max_pct': 0.11373837096223091, 'sideways_tp_mult': 2.4082512699671224, 'sideways_tsl_mult': 0.7742412286698563, 'sideways_time_stop': 226, 'sideways_use_sma': False, 'sideways_use_ema': True, 'sideways_use_atr': True, 'sideways_use_adx': False, 'sideways_use_spike': False, 'sideways_rsi_required': False}.
[I 2025-09-01 13:44:59,488] Trial 113 finished with values: [-1000000000.0, 1000000000.0] and parameters: {'p_sma': 13, 'p_std': 37, 'p_atr': 15, 'p_adx': 28, 'rsi_period': 11, 'ema1': 11, 'ema2': 55, 'slip_atr_k': 0.1795232817310603, 'slip_spread_k': 0.3778457774689566, 'spread_hl_frac': 0.014631301063794528, 'bb_std_mult': 1.2047755237311093, 'rsi_os': 48, 'rsi_ob': 94, 'vol_spike': 0.018130381925303446, 'adx_thresh': 6.868863141152197, 'atr_min_pct': 0.018684930671071454, 'atr_max_pct': 0.043234273787445654, 'tp_mult': 2.5856350442840688, 'tsl_mult': 0.6851417800694588, 'strategy': 'breakout', 'time_stop': 151, 'use_sma': True, 'use_atr': False, 'use_adx': True, 'use_ema': False, 'use_spike': False, 'rsi_required': False, 'edge_k': 0.21026439213613146, 'edge_cap': 0.8679789298240399, 'bull_strategy': 'breakout', 'bull_bb_std_mult': 2.02920620699285, 'bull_rsi_os': 47, 'bull_rsi_ob': 55, 'bull_adx_thresh': 7.978542487944416, 'bull_atr_min_pct': 0.01454261089964747, 'bull_atr_max_pct': 0.10160201864968997, 'bull_tp_mult': 2.7286843678990937, 'bull_tsl_mult': 0.5969683958274545, 'bull_time_stop': 142, 'bull_use_sma': True, 'bull_use_ema': True, 'bull_use_atr': False, 'bull_use_adx': False, 'bull_use_spike': False, 'bull_rsi_required': True, 'bear_strategy': 'mean_reversion', 'bear_bb_std_mult': 2.2656209614819383, 'bear_rsi_os': 8, 'bear_rsi_ob': 64, 'bear_adx_thresh': 6.620599841917172, 'bear_atr_min_pct': 0.005041340568680742, 'bear_atr_max_pct': 0.06219588576904423, 'bear_tp_mult': 1.6804507056649571, 'bear_tsl_mult': 0.1013722078504425, 'bear_time_stop': 222, 'bear_use_sma': True, 'bear_use_ema': False, 'bear_use_atr': False, 'bear_use_adx': False, 'bear_use_spike': False, 'bear_rsi_required': False, 'sideways_strategy': 'mean_reversion', 'sideways_bb_std_mult': 2.906468299524768, 'sideways_rsi_os': 38, 'sideways_rsi_ob': 84, 'sideways_adx_thresh': 25.205386613293314, 'sideways_atr_min_pct': 0.028181162188042244, 'sideways_atr_max_pct': 0.12748555698968173, 'sideways_tp_mult': 2.8202414025834663, 'sideways_tsl_mult': 0.5597236848687696, 'sideways_time_stop': 113, 'sideways_use_sma': True, 'sideways_use_ema': True, 'sideways_use_atr': False, 'sideways_use_adx': True, 'sideways_use_spike': True, 'sideways_rsi_required': False}.
[I 2025-09-01 13:44:59,499] Trial 114 finished with values: [-0.02985287888747168, 0.029706003959366314] and parameters: {'p_sma': 13, 'p_std': 30, 'p_atr': 17, 'p_adx': 28, 'rsi_period': 68, 'ema1': 10, 'ema2': 15, 'slip_atr_k': 0.18962979434297794, 'slip_spread_k': 0.08616504410562242, 'spread_hl_frac': 0.007760859798987369, 'bb_std_mult': 0.6373932664946405, 'rsi_os': 41, 'rsi_ob': 66, 'vol_spike': 0.2263432852075235, 'adx_thresh': 22.380331981686602, 'atr_min_pct': 0.0171328650812568, 'atr_max_pct': 0.01814772013928306, 'tp_mult': 1.7395404313448022, 'tsl_mult': 0.8835294770974829, 'strategy': 'breakout', 'time_stop': 153, 'use_sma': True, 'use_atr': True, 'use_adx': True, 'use_ema': False, 'use_spike': False, 'rsi_required': False, 'edge_k': 1.8825677841470765, 'edge_cap': 0.867185547183913, 'bull_strategy': 'breakout', 'bull_bb_std_mult': 1.8797858678332022, 'bull_rsi_os': 40, 'bull_rsi_ob': 55, 'bull_adx_thresh': 8.379198485858543, 'bull_atr_min_pct': 0.0014562188712702196, 'bull_atr_max_pct': 0.10132165428345825, 'bull_tp_mult': 2.8634263907549946, 'bull_tsl_mult': 0.6023745598406862, 'bull_time_stop': 115, 'bull_use_sma': True, 'bull_use_ema': True, 'bull_use_atr': False, 'bull_use_adx': False, 'bull_use_spike': False, 'bull_rsi_required': False, 'bear_strategy': 'breakout', 'bear_bb_std_mult': 3.2857263156474126, 'bear_rsi_os': 16, 'bear_rsi_ob': 64, 'bear_adx_thresh': 5.054642822304577, 'bear_atr_min_pct': 0.02159334869721532, 'bear_atr_max_pct': 0.08175690138002178, 'bear_tp_mult': 2.407843993057569, 'bear_tsl_mult': 0.10641179360426169, 'bear_time_stop': 35, 'bear_use_sma': True, 'bear_use_ema': False, 'bear_use_atr': False, 'bear_use_adx': True, 'bear_use_spike': False, 'bear_rsi_required': False, 'sideways_strategy': 'mean_reversion', 'sideways_bb_std_mult': 2.833462509733706, 'sideways_rsi_os': 6, 'sideways_rsi_ob': 91, 'sideways_adx_thresh': 25.19033200096827, 'sideways_atr_min_pct': 0.014633767495440727, 'sideways_atr_max_pct': 0.09468272026072713, 'sideways_tp_mult': 2.398960569724898, 'sideways_tsl_mult': 0.6650210404940144, 'sideways_time_stop': 228, 'sideways_use_sma': False, 'sideways_use_ema': True, 'sideways_use_atr': True, 'sideways_use_adx': False, 'sideways_use_spike': True, 'sideways_rsi_required': False}.
