[I 2025-09-01 14:32:58,889] Trial 451 finished with values: [-0.010937703484589112, 0.01336917138021702] and parameters: {'p_sma': 22, 'p_std': 53, 'p_atr': 28, 'p_adx': 23, 'rsi_period': 81, 'ema1': 19, 'ema2': 58, 'slip_atr_k': 0.19137804379819007, 'slip_spread_k': 0.58488912359965, 'spread_hl_frac': 0.00702231739919881, 'bb_std_mult': 3.491806583047271, 'rsi_os': 42, 'rsi_ob': 69, 'vol_spike': 0.06415480418973664, 'adx_thresh': 6.87878272390191, 'atr_min_pct': 0.010529015852378613, 'atr_max_pct': 0.04194631329756986, 'tp_mult': 1.3478878409638826, 'tsl_mult': 0.3724650876989567, 'strategy': 'mean_reversion', 'time_stop': 44, 'use_sma': True, 'use_atr': False, 'use_adx': True, 'use_ema': True, 'use_spike': True, 'rsi_required': True, 'edge_k': 0.2807040701154472, 'edge_cap': 0.37269083856816776, 'bull_strategy': 'breakout', 'bull_bb_std_mult': 3.143429003427245, 'bull_rsi_os': 12, 'bull_rsi_ob': 78, 'bull_adx_thresh': 12.300435501427534, 'bull_atr_min_pct': 0.011914494354653905, 'bull_atr_max_pct': 0.12911958727035788, 'bull_tp_mult': 2.826152268966754, 'bull_tsl_mult': 0.5235039256491341, 'bull_time_stop': 137, 'bull_use_sma': True, 'bull_use_ema': True, 'bull_use_atr': True, 'bull_use_adx': False, 'bull_use_spike': True, 'bull_rsi_required': True, 'bear_strategy': 'mean_reversion', 'bear_bb_std_mult': 2.2869108050918636, 'bear_rsi_os': 37, 'bear_rsi_ob': 81, 'bear_adx_thresh': 8.653942392540012, 'bear_atr_min_pct': 0.002379217250305159, 'bear_atr_max_pct': 0.11789252956043014, 'bear_tp_mult': 2.6642531388794883, 'bear_tsl_mult': 0.5593745856577704, 'bear_time_stop': 108, 'bear_use_sma': True, 'bear_use_ema': False, 'bear_use_atr': False, 'bear_use_adx': False, 'bear_use_spike': True, 'bear_rsi_required': False, 'sideways_strategy': 'mean_reversion', 'sideways_bb_std_mult': 2.3559383394994535, 'sideways_rsi_os': 33, 'sideways_rsi_ob': 91, 'sideways_adx_thresh': 13.51039685290652, 'sideways_atr_min_pct': 0.004819979568637666, 'sideways_atr_max_pct': 0.05094172131548353, 'sideways_tp_mult': 1.2243053802061579, 'sideways_tsl_mult': 0.2202970518607178, 'sideways_time_stop': 256, 'sideways_use_sma': True, 'sideways_use_ema': False, 'sideways_use_atr': False, 'sideways_use_adx': True, 'sideways_use_spike': False, 'sideways_rsi_required': False}.
[I 2025-09-01 14:32:59,250] Trial 449 finished with values: [-1000000000.0, 1000000000.0] and parameters: {'p_sma': 29, 'p_std': 20, 'p_atr': 16, 'p_adx': 9, 'rsi_period': 77, 'ema1': 9, 'ema2': 58, 'slip_atr_k': 0.00887207758506614, 'slip_spread_k': 0.5900895819126872, 'spread_hl_frac': 0.029330431003034462, 'bb_std_mult': 0.9720420437631592, 'rsi_os': 42, 'rsi_ob': 53, 'vol_spike': 0.21375047258616295, 'adx_thresh': 6.623020845192259, 'atr_min_pct': 0.013143464903995353, 'atr_max_pct': 0.07020926071407735, 'tp_mult': 1.34317689594428, 'tsl_mult': 0.7374635141936844, 'strategy': 'mean_reversion', 'time_stop': 43, 'use_sma': True, 'use_atr': False, 'use_adx': True, 'use_ema': True, 'use_spike': True, 'rsi_required': True, 'edge_k': 0.7845161135431651, 'edge_cap': 0.3636050133555251, 'bull_strategy': 'breakout', 'bull_bb_std_mult': 0.5692958395687389, 'bull_rsi_os': 12, 'bull_rsi_ob': 74, 'bull_adx_thresh': 16.631393449753958, 'bull_atr_min_pct': 0.011562274653760848, 'bull_atr_max_pct': 0.07718976103831499, 'bull_tp_mult': 1.6767148635673121, 'bull_tsl_mult': 0.18934629348949378, 'bull_time_stop': 148, 'bull_use_sma': True, 'bull_use_ema': True, 'bull_use_atr': True, 'bull_use_adx': False, 'bull_use_spike': True, 'bull_rsi_required': True, 'bear_strategy': 'mean_reversion', 'bear_bb_std_mult': 3.4830407487705677, 'bear_rsi_os': 24, 'bear_rsi_ob': 78, 'bear_adx_thresh': 8.092782006469486, 'bear_atr_min_pct': 0.0021683721363069414, 'bear_atr_max_pct': 0.12946552155861146, 'bear_tp_mult': 2.524044005887657, 'bear_tsl_mult': 0.00474178975638212, 'bear_time_stop': 76, 'bear_use_sma': True, 'bear_use_ema': False, 'bear_use_atr': False, 'bear_use_adx': False, 'bear_use_spike': True, 'bear_rsi_required': False, 'sideways_strategy': 'mean_reversion', 'sideways_bb_std_mult': 3.015468341849351, 'sideways_rsi_os': 31, 'sideways_rsi_ob': 91, 'sideways_adx_thresh': 23.168180870746227, 'sideways_atr_min_pct': 0.004783967396900078, 'sideways_atr_max_pct': 0.11750597381804205, 'sideways_tp_mult': 2.363339085824907, 'sideways_tsl_mult': 0.4437371101886193, 'sideways_time_stop': 268, 'sideways_use_sma': True, 'sideways_use_ema': False, 'sideways_use_atr': False, 'sideways_use_adx': True, 'sideways_use_spike': False, 'sideways_rsi_required': False}.
[I 2025-09-01 14:33:35,983] Trial 452 finished with values: [-0.017013359328717725, 0.017505737190204457] and parameters: {'p_sma': 28, 'p_std': 19, 'p_atr': 27, 'p_adx': 9, 'rsi_period': 76, 'ema1': 17, 'ema2': 59, 'slip_atr_k': 0.016506639485190308, 'slip_spread_k': 0.5905101613188118, 'spread_hl_frac': 0.049872924348429215, 'bb_std_mult': 3.4928578771458687, 'rsi_os': 45, 'rsi_ob': 53, 'vol_spike': 0.2037646519571007, 'adx_thresh': 5.412373654233579, 'atr_min_pct': 0.0106868401556342, 'atr_max_pct': 0.06945495504963284, 'tp_mult': 1.349599921174243, 'tsl_mult': 0.72653751639219, 'strategy': 'mean_reversion', 'time_stop': 44, 'use_sma': True, 'use_atr': False, 'use_adx': True, 'use_ema': True, 'use_spike': True, 'rsi_required': True, 'edge_k': 0.29876481929026044, 'edge_cap': 0.12369883735261544, 'bull_strategy': 'breakout', 'bull_bb_std_mult': 3.1478737858861168, 'bull_rsi_os': 25, 'bull_rsi_ob': 73, 'bull_adx_thresh': 12.273758894708998, 'bull_atr_min_pct': 0.011834181095668164, 'bull_atr_max_pct': 0.13026950715182734, 'bull_tp_mult': 2.659733112751277, 'bull_tsl_mult': 0.19539776303259937, 'bull_time_stop': 51, 'bull_use_sma': True, 'bull_use_ema': False, 'bull_use_atr': True, 'bull_use_adx': False, 'bull_use_spike': True, 'bull_rsi_required': True, 'bear_strategy': 'mean_reversion', 'bear_bb_std_mult': 0.611795912932076, 'bear_rsi_os': 37, 'bear_rsi_ob': 81, 'bear_adx_thresh': 15.972304783577822, 'bear_atr_min_pct': 0.002353749231951181, 'bear_atr_max_pct': 0.14955455082506974, 'bear_tp_mult': 2.054258283275928, 'bear_tsl_mult': 0.981267396134661, 'bear_time_stop': 108, 'bear_use_sma': True, 'bear_use_ema': False, 'bear_use_atr': False, 'bear_use_adx': False, 'bear_use_spike': True, 'bear_rsi_required': False, 'sideways_strategy': 'mean_reversion', 'sideways_bb_std_mult': 1.5771134050439153, 'sideways_rsi_os': 18, 'sideways_rsi_ob': 49, 'sideways_adx_thresh': 13.309876872858903, 'sideways_atr_min_pct': 0.004587459097876178, 'sideways_atr_max_pct': 0.021084103525952205, 'sideways_tp_mult': 1.2241684696939368, 'sideways_tsl_mult': 0.48563871461925534, 'sideways_time_stop': 257, 'sideways_use_sma': True, 'sideways_use_ema': False, 'sideways_use_atr': False, 'sideways_use_adx': True, 'sideways_use_spike': False, 'sideways_rsi_required': False}.
[I 2025-09-01 14:33:37,564] Trial 455 finished with values: [-1000000000.0, 1000000000.0] and parameters: {'p_sma': 16, 'p_std': 44, 'p_atr': 27, 'p_adx': 7, 'rsi_period': 38, 'ema1': 10, 'ema2': 57, 'slip_atr_k': 0.02541129981128159, 'slip_spread_k': 0.27641756164636333, 'spread_hl_frac': 0.010141388738319275, 'bb_std_mult': 3.392953303648598, 'rsi_os': 46, 'rsi_ob': 54, 'vol_spike': 0.05249915557995864, 'adx_thresh': 5.009527810322264, 'atr_min_pct': 0.009010081492931246, 'atr_max_pct': 0.10861564509308143, 'tp_mult': 1.1935440568016207, 'tsl_mult': 0.7192968209465455, 'strategy': 'mean_reversion', 'time_stop': 265, 'use_sma': True, 'use_atr': False, 'use_adx': True, 'use_ema': True, 'use_spike': False, 'rsi_required': True, 'edge_k': 1.6451924028835183, 'edge_cap': 0.06499968144547552, 'bull_strategy': 'breakout', 'bull_bb_std_mult': 1.0441113618140336, 'bull_rsi_os': 27, 'bull_rsi_ob': 78, 'bull_adx_thresh': 20.67620707934171, 'bull_atr_min_pct': 0.013212637904917654, 'bull_atr_max_pct': 0.1328034156738476, 'bull_tp_mult': 1.6077090869262922, 'bull_tsl_mult': 0.29261006065916767, 'bull_time_stop': 156, 'bull_use_sma': False, 'bull_use_ema': False, 'bull_use_atr': True, 'bull_use_adx': True, 'bull_use_spike': True, 'bull_rsi_required': True, 'bear_strategy': 'mean_reversion', 'bear_bb_std_mult': 1.8849051381834965, 'bear_rsi_os': 36, 'bear_rsi_ob': 57, 'bear_adx_thresh': 9.167466243295664, 'bear_atr_min_pct': 0.00706568080896184, 'bear_atr_max_pct': 0.10585809459633265, 'bear_tp_mult': 2.043484114195119, 'bear_tsl_mult': 0.12105217445258336, 'bear_time_stop': 91, 'bear_use_sma': False, 'bear_use_ema': False, 'bear_use_atr': False, 'bear_use_adx': False, 'bear_use_spike': True, 'bear_rsi_required': False, 'sideways_strategy': 'mean_reversion', 'sideways_bb_std_mult': 2.843953443102738, 'sideways_rsi_os': 27, 'sideways_rsi_ob': 89, 'sideways_adx_thresh': 18.85228872801369, 'sideways_atr_min_pct': 0.0028385623213085876, 'sideways_atr_max_pct': 0.1115600777329579, 'sideways_tp_mult': 2.400145829303052, 'sideways_tsl_mult': 0.47529276457255143, 'sideways_time_stop': 51, 'sideways_use_sma': True, 'sideways_use_ema': True, 'sideways_use_atr': True, 'sideways_use_adx': True, 'sideways_use_spike': False, 'sideways_rsi_required': False}.
[I 2025-09-01 14:33:37,969] Trial 453 finished with values: [-0.027533755364242296, 0.027427458771922493] and parameters: {'p_sma': 28, 'p_std': 29, 'p_atr': 30, 'p_adx': 13, 'rsi_period': 76, 'ema1': 9, 'ema2': 53, 'slip_atr_k': 0.19294953629146977, 'slip_spread_k': 0.001011530594754395, 'spread_hl_frac': 0.029205530489011252, 'bb_std_mult': 3.389378681259487, 'rsi_os': 45, 'rsi_ob': 54, 'vol_spike': 0.20217904826247257, 'adx_thresh': 5.476788616799547, 'atr_min_pct': 0.013030091337199567, 'atr_max_pct': 0.0891478472527444, 'tp_mult': 1.3481337238938653, 'tsl_mult': 0.719249257360807, 'strategy': 'mean_reversion', 'time_stop': 34, 'use_sma': True, 'use_atr': False, 'use_adx': True, 'use_ema': True, 'use_spike': False, 'rsi_required': True, 'edge_k': 0.4985996760049452, 'edge_cap': 0.9268385312181462, 'bull_strategy': 'breakout', 'bull_bb_std_mult': 3.1975738180550968, 'bull_rsi_os': 51, 'bull_rsi_ob': 78, 'bull_adx_thresh': 26.72336753100978, 'bull_atr_min_pct': 0.0023331571435805144, 'bull_atr_max_pct': 0.12953277526519674, 'bull_tp_mult': 2.140061415774677, 'bull_tsl_mult': 0.3013792738451046, 'bull_time_stop': 158, 'bull_use_sma': False, 'bull_use_ema': False, 'bull_use_atr': True, 'bull_use_adx': True, 'bull_use_spike': True, 'bull_rsi_required': True, 'bear_strategy': 'mean_reversion', 'bear_bb_std_mult': 2.565572644288779, 'bear_rsi_os': 37, 'bear_rsi_ob': 57, 'bear_adx_thresh': 20.69859160908768, 'bear_atr_min_pct': 0.007148421316587612, 'bear_atr_max_pct': 0.11134829122524006, 'bear_tp_mult': 1.4515581940421365, 'bear_tsl_mult': 0.12030241839950329, 'bear_time_stop': 233, 'bear_use_sma': True, 'bear_use_ema': False, 'bear_use_atr': False, 'bear_use_adx': False, 'bear_use_spike': True, 'bear_rsi_required': False, 'sideways_strategy': 'mean_reversion', 'sideways_bb_std_mult': 2.854283000631339, 'sideways_rsi_os': 33, 'sideways_rsi_ob': 73, 'sideways_adx_thresh': 13.062431397924662, 'sideways_atr_min_pct': 0.0028960986747125755, 'sideways_atr_max_pct': 0.02006854219739472, 'sideways_tp_mult': 2.358653900499018, 'sideways_tsl_mult': 0.44256308819044304, 'sideways_time_stop': 255, 'sideways_use_sma': True, 'sideways_use_ema': True, 'sideways_use_atr': True, 'sideways_use_adx': True, 'sideways_use_spike': False, 'sideways_rsi_required': False}.
[I 2025-09-01 14:33:38,230] Trial 454 finished with values: [-1000000000.0, 1000000000.0] and parameters: {'p_sma': 28, 'p_std': 8, 'p_atr': 27, 'p_adx': 9, 'rsi_period': 76, 'ema1': 9, 'ema2': 57, 'slip_atr_k': 0.02434796499871089, 'slip_spread_k': 0.3422813805335879, 'spread_hl_frac': 0.02915735669853852, 'bb_std_mult': 3.4207182947737533, 'rsi_os': 44, 'rsi_ob': 54, 'vol_spike': 0.12074306027892831, 'adx_thresh': 5.010198404060507, 'atr_min_pct': 0.008906008759265765, 'atr_max_pct': 0.08911982478682043, 'tp_mult': 1.212948338838247, 'tsl_mult': 0.7179552023248713, 'strategy': 'mean_reversion', 'time_stop': 113, 'use_sma': True, 'use_atr': False, 'use_adx': True, 'use_ema': True, 'use_spike': False, 'rsi_required': True, 'edge_k': 0.31111119759369976, 'edge_cap': 0.700234723316064, 'bull_strategy': 'breakout', 'bull_bb_std_mult': 3.3565736272823914, 'bull_rsi_os': 25, 'bull_rsi_ob': 88, 'bull_adx_thresh': 11.42390466973753, 'bull_atr_min_pct': 0.012128865467487692, 'bull_atr_max_pct': 0.06636595016729661, 'bull_tp_mult': 1.6082133163247307, 'bull_tsl_mult': 0.42977779056061605, 'bull_time_stop': 51, 'bull_use_sma': False, 'bull_use_ema': False, 'bull_use_atr': True, 'bull_use_adx': True, 'bull_use_spike': True, 'bull_rsi_required': True, 'bear_strategy': 'mean_reversion', 'bear_bb_std_mult': 0.6200492980517953, 'bear_rsi_os': 36, 'bear_rsi_ob': 78, 'bear_adx_thresh': 23.457158546363242, 'bear_atr_min_pct': 0.007125559803603524, 'bear_atr_max_pct': 0.11077119990848959, 'bear_tp_mult': 2.107390873953153, 'bear_tsl_mult': 0.2616052653647744, 'bear_time_stop': 233, 'bear_use_sma': False, 'bear_use_ema': False, 'bear_use_atr': False, 'bear_use_adx': False, 'bear_use_spike': True, 'bear_rsi_required': False, 'sideways_strategy': 'mean_reversion', 'sideways_bb_std_mult': 3.282168154667011, 'sideways_rsi_os': 22, 'sideways_rsi_ob': 49, 'sideways_adx_thresh': 25.711191270135092, 'sideways_atr_min_pct': 0.023951807330526823, 'sideways_atr_max_pct': 0.01910984997080209, 'sideways_tp_mult': 2.359598443182043, 'sideways_tsl_mult': 0.45019197328468097, 'sideways_time_stop': 277, 'sideways_use_sma': True, 'sideways_use_ema': True, 'sideways_use_atr': True, 'sideways_use_adx': True, 'sideways_use_spike': False, 'sideways_rsi_required': False}.
[I 2025-09-01 14:33:38,989] Trial 459 finished with values: [-1000000000.0, 1000000000.0] and parameters: {'p_sma': 43, 'p_std': 33, 'p_atr': 25, 'p_adx': 24, 'rsi_period': 83, 'ema1': 12, 'ema2': 11, 'slip_atr_k': 0.033323825085402235, 'slip_spread_k': 0.5635385411481123, 'spread_hl_frac': 0.011582629573108233, 'bb_std_mult': 3.546382217609989, 'rsi_os': 54, 'rsi_ob': 88, 'vol_spike': 0.10482752395381732, 'adx_thresh': 7.682084232914436, 'atr_min_pct': 0.009871630605731223, 'atr_max_pct': 0.05974383905223085, 'tp_mult': 1.398461444092248, 'tsl_mult': 0.6677134463891896, 'strategy': 'mean_reversion', 'time_stop': 127, 'use_sma': True, 'use_atr': False, 'use_adx': False, 'use_ema': True, 'use_spike': True, 'rsi_required': True, 'edge_k': 0.202143356298346, 'edge_cap': 0.40796890480982856, 'bull_strategy': 'breakout', 'bull_bb_std_mult': 3.260182026218371, 'bull_rsi_os': 15, 'bull_rsi_ob': 58, 'bull_adx_thresh': 11.531301593151689, 'bull_atr_min_pct': 0.027378303363715616, 'bull_atr_max_pct': 0.032656361138276704, 'bull_tp_mult': 1.5200628499790376, 'bull_tsl_mult': 0.9857806023817919, 'bull_time_stop': 161, 'bull_use_sma': False, 'bull_use_ema': True, 'bull_use_atr': True, 'bull_use_adx': True, 'bull_use_spike': True, 'bull_rsi_required': True, 'bear_strategy': 'mean_reversion', 'bear_bb_std_mult': 2.3846836095405357, 'bear_rsi_os': 32, 'bear_rsi_ob': 46, 'bear_adx_thresh': 7.987529975364499, 'bear_atr_min_pct': 0.0037062126785339846, 'bear_atr_max_pct': 0.10794132918349202, 'bear_tp_mult': 2.1103092781644435, 'bear_tsl_mult': 0.14807547637290888, 'bear_time_stop': 120, 'bear_use_sma': False, 'bear_use_ema': False, 'bear_use_atr': False, 'bear_use_adx': False, 'bear_use_spike': True, 'bear_rsi_required': False, 'sideways_strategy': 'mean_reversion', 'sideways_bb_std_mult': 3.1406148414031767, 'sideways_rsi_os': 54, 'sideways_rsi_ob': 64, 'sideways_adx_thresh': 16.274772786039264, 'sideways_atr_min_pct': 0.005851931527066066, 'sideways_atr_max_pct': 0.10877601341009341, 'sideways_tp_mult': 1.8302738277290003, 'sideways_tsl_mult': 0.01203933976324445, 'sideways_time_stop': 263, 'sideways_use_sma': True, 'sideways_use_ema': True, 'sideways_use_atr': True, 'sideways_use_adx': False, 'sideways_use_spike': True, 'sideways_rsi_required': False}.
[I 2025-09-01 14:33:38,999] Trial 458 finished with values: [-1000000000.0, 1000000000.0] and parameters: {'p_sma': 31, 'p_std': 25, 'p_atr': 25, 'p_adx': 8, 'rsi_period': 83, 'ema1': 12, 'ema2': 19, 'slip_atr_k': 0.15789095886023086, 'slip_spread_k': 0.5664506906262754, 'spread_hl_frac': 0.041458787802340344, 'bb_std_mult': 3.5524368441986978, 'rsi_os': 54, 'rsi_ob': 52, 'vol_spike': 0.12057444204984691, 'adx_thresh': 32.1176379212403, 'atr_min_pct': 0.009805144461180602, 'atr_max_pct': 0.11705330528301783, 'tp_mult': 1.3937544124755807, 'tsl_mult': 0.6687651600154552, 'strategy': 'mean_reversion', 'time_stop': 112, 'use_sma': True, 'use_atr': False, 'use_adx': True, 'use_ema': True, 'use_spike': True, 'rsi_required': True, 'edge_k': 0.18822515687995509, 'edge_cap': 0.9037862897449559, 'bull_strategy': 'breakout', 'bull_bb_std_mult': 1.7557816481097714, 'bull_rsi_os': 15, 'bull_rsi_ob': 58, 'bull_adx_thresh': 11.736747910738638, 'bull_atr_min_pct': 0.02752874295883269, 'bull_atr_max_pct': 0.08527139671686589, 'bull_tp_mult': 1.5673061458830573, 'bull_tsl_mult': 0.40138863994453544, 'bull_time_stop': 66, 'bull_use_sma': False, 'bull_use_ema': True, 'bull_use_atr': True, 'bull_use_adx': True, 'bull_use_spike': True, 'bull_rsi_required': True, 'bear_strategy': 'mean_reversion', 'bear_bb_std_mult': 1.2585464967576596, 'bear_rsi_os': 26, 'bear_rsi_ob': 55, 'bear_adx_thresh': 29.32860159438445, 'bear_atr_min_pct': 0.0037219386999522764, 'bear_atr_max_pct': 0.010970497496311663, 'bear_tp_mult': 2.09797971826176, 'bear_tsl_mult': 0.14597429933458486, 'bear_time_stop': 89, 'bear_use_sma': False, 'bear_use_ema': False, 'bear_use_atr': False, 'bear_use_adx': False, 'bear_use_spike': True, 'bear_rsi_required': False, 'sideways_strategy': 'mean_reversion', 'sideways_bb_std_mult': 3.265838119953509, 'sideways_rsi_os': 15, 'sideways_rsi_ob': 80, 'sideways_adx_thresh': 25.709555283528324, 'sideways_atr_min_pct': 0.007556461913769549, 'sideways_atr_max_pct': 0.1092906128142453, 'sideways_tp_mult': 2.42047767108376, 'sideways_tsl_mult': 0.6174809254225526, 'sideways_time_stop': 195, 'sideways_use_sma': True, 'sideways_use_ema': True, 'sideways_use_atr': True, 'sideways_use_adx': True, 'sideways_use_spike': False, 'sideways_rsi_required': False}.
[I 2025-09-01 14:33:39,696] Trial 460 finished with values: [-1000000000.0, 1000000000.0] and parameters: {'p_sma': 35, 'p_std': 25, 'p_atr': 24, 'p_adx': 8, 'rsi_period': 81, 'ema1': 15, 'ema2': 17, 'slip_atr_k': 0.15444289442144882, 'slip_spread_k': 0.7928555461623972, 'spread_hl_frac': 0.009675772183983786, 'bb_std_mult': 3.5914974056709386, 'rsi_os': 55, 'rsi_ob': 52, 'vol_spike': 0.11382506545783108, 'adx_thresh': 19.248618744103048, 'atr_min_pct': 0.01146277883080599, 'atr_max_pct': 0.1224937265534033, 'tp_mult': 1.39543168451214, 'tsl_mult': 0.904550132519961, 'strategy': 'mean_reversion', 'time_stop': 56, 'use_sma': True, 'use_atr': False, 'use_adx': True, 'use_ema': True, 'use_spike': True, 'rsi_required': True, 'edge_k': 0.24603670647340917, 'edge_cap': 0.8971379401646615, 'bull_strategy': 'breakout', 'bull_bb_std_mult': 3.089529282269641, 'bull_rsi_os': 9, 'bull_rsi_ob': 85, 'bull_adx_thresh': 10.39597543679058, 'bull_atr_min_pct': 0.01540268081260669, 'bull_atr_max_pct': 0.09931080090674937, 'bull_tp_mult': 1.6525834934089707, 'bull_tsl_mult': 0.7079973125991992, 'bull_time_stop': 11, 'bull_use_sma': False, 'bull_use_ema': True, 'bull_use_atr': True, 'bull_use_adx': True, 'bull_use_spike': True, 'bull_rsi_required': False, 'bear_strategy': 'mean_reversion', 'bear_bb_std_mult': 1.2580302727575745, 'bear_rsi_os': 26, 'bear_rsi_ob': 91, 'bear_adx_thresh': 27.71459127074719, 'bear_atr_min_pct': 0.0015593054444619848, 'bear_atr_max_pct': 0.1037985619306594, 'bear_tp_mult': 1.3892124494064437, 'bear_tsl_mult': 0.037652326895052116, 'bear_time_stop': 290, 'bear_use_sma': False, 'bear_use_ema': False, 'bear_use_atr': False, 'bear_use_adx': False, 'bear_use_spike': True, 'bear_rsi_required': False, 'sideways_strategy': 'mean_reversion', 'sideways_bb_std_mult': 1.98740376244604, 'sideways_rsi_os': 11, 'sideways_rsi_ob': 93, 'sideways_adx_thresh': 24.463697485601134, 'sideways_atr_min_pct': 0.003995558609455223, 'sideways_atr_max_pct': 0.11085793785183973, 'sideways_tp_mult': 2.442650813187084, 'sideways_tsl_mult': 0.5989292565882535, 'sideways_time_stop': 87, 'sideways_use_sma': True, 'sideways_use_ema': True, 'sideways_use_atr': True, 'sideways_use_adx': True, 'sideways_use_spike': False, 'sideways_rsi_required': True}.
