[I 2025-09-01 14:19:11,122] Trial 353 finished with values: [-0.021528066482757624, 0.021406861264372835] and parameters: {'p_sma': 32, 'p_std': 9, 'p_atr': 26, 'p_adx': 12, 'rsi_period': 76, 'ema1': 12, 'ema2': 54, 'slip_atr_k': 0.02334329208045384, 'slip_spread_k': 0.7996940594712361, 'spread_hl_frac': 0.035971691049869144, 'bb_std_mult': 2.3864888581634167, 'rsi_os': 26, 'rsi_ob': 52, 'vol_spike': 0.008120413941576116, 'adx_thresh': 6.285400812861781, 'atr_min_pct': 0.00014700061357659708, 'atr_max_pct': 0.14108305885626599, 'tp_mult': 2.4476831906678864, 'tsl_mult': 0.8316029873906594, 'strategy': 'mean_reversion', 'time_stop': 155, 'use_sma': False, 'use_atr': False, 'use_adx': True, 'use_ema': True, 'use_spike': True, 'rsi_required': True, 'edge_k': 0.2491946741943582, 'edge_cap': 0.9703620682359853, 'bull_strategy': 'mean_reversion', 'bull_bb_std_mult': 3.2041511853430613, 'bull_rsi_os': 50, 'bull_rsi_ob': 80, 'bull_adx_thresh': 12.333601889924793, 'bull_atr_min_pct': 0.004408941607010898, 'bull_atr_max_pct': 0.058902225882112524, 'bull_tp_mult': 1.6161883692505885, 'bull_tsl_mult': 0.46311695099234157, 'bull_time_stop': 248, 'bull_use_sma': True, 'bull_use_ema': True, 'bull_use_atr': True, 'bull_use_adx': True, 'bull_use_spike': True, 'bull_rsi_required': True, 'bear_strategy': 'mean_reversion', 'bear_bb_std_mult': 2.039611069328327, 'bear_rsi_os': 36, 'bear_rsi_ob': 71, 'bear_adx_thresh': 19.036699701319122, 'bear_atr_min_pct': 0.019975939501181476, 'bear_atr_max_pct': 0.08617714663127359, 'bear_tp_mult': 2.065986632662135, 'bear_tsl_mult': 0.4943663004651345, 'bear_time_stop': 159, 'bear_use_sma': True, 'bear_use_ema': False, 'bear_use_atr': True, 'bear_use_adx': False, 'bear_use_spike': True, 'bear_rsi_required': False, 'sideways_strategy': 'mean_reversion', 'sideways_bb_std_mult': 2.850179567626193, 'sideways_rsi_os': 45, 'sideways_rsi_ob': 58, 'sideways_adx_thresh': 23.66065704819893, 'sideways_atr_min_pct': 0.0034675308861180565, 'sideways_atr_max_pct': 0.11021884857599522, 'sideways_tp_mult': 1.979315865792959, 'sideways_tsl_mult': 0.3415118084542677, 'sideways_time_stop': 276, 'sideways_use_sma': True, 'sideways_use_ema': False, 'sideways_use_atr': False, 'sideways_use_adx': True, 'sideways_use_spike': False, 'sideways_rsi_required': False}.
[I 2025-09-01 14:19:11,899] Trial 351 finished with values: [-1000000000.0, 1000000000.0] and parameters: {'p_sma': 33, 'p_std': 20, 'p_atr': 16, 'p_adx': 22, 'rsi_period': 70, 'ema1': 12, 'ema2': 58, 'slip_atr_k': 0.02412524849083094, 'slip_spread_k': 0.026003848477150704, 'spread_hl_frac': 0.04351718725158475, 'bb_std_mult': 3.595704090859859, 'rsi_os': 13, 'rsi_ob': 52, 'vol_spike': 0.007219033084902793, 'adx_thresh': 8.74278209938724, 'atr_min_pct': 0.011259939715861299, 'atr_max_pct': 0.04353080883463705, 'tp_mult': 2.2790588166848615, 'tsl_mult': 0.8234428041185039, 'strategy': 'mean_reversion', 'time_stop': 178, 'use_sma': False, 'use_atr': False, 'use_adx': True, 'use_ema': True, 'use_spike': True, 'rsi_required': True, 'edge_k': 0.1804249924370233, 'edge_cap': 0.9686574624525318, 'bull_strategy': 'mean_reversion', 'bull_bb_std_mult': 2.4140843340378257, 'bull_rsi_os': 45, 'bull_rsi_ob': 81, 'bull_adx_thresh': 26.12231569059343, 'bull_atr_min_pct': 0.0199879498309333, 'bull_atr_max_pct': 0.024107966227590927, 'bull_tp_mult': 1.55385437138644, 'bull_tsl_mult': 0.3307249222087456, 'bull_time_stop': 192, 'bull_use_sma': True, 'bull_use_ema': True, 'bull_use_atr': True, 'bull_use_adx': True, 'bull_use_spike': True, 'bull_rsi_required': True, 'bear_strategy': 'mean_reversion', 'bear_bb_std_mult': 1.5306653704258344, 'bear_rsi_os': 41, 'bear_rsi_ob': 69, 'bear_adx_thresh': 27.30614686863302, 'bear_atr_min_pct': 0.01514498910501611, 'bear_atr_max_pct': 0.02105962237030742, 'bear_tp_mult': 2.064605871126042, 'bear_tsl_mult': 0.41954111376036185, 'bear_time_stop': 83, 'bear_use_sma': True, 'bear_use_ema': False, 'bear_use_atr': True, 'bear_use_adx': False, 'bear_use_spike': True, 'bear_rsi_required': False, 'sideways_strategy': 'mean_reversion', 'sideways_bb_std_mult': 3.1317784204141583, 'sideways_rsi_os': 6, 'sideways_rsi_ob': 91, 'sideways_adx_thresh': 14.831368437707802, 'sideways_atr_min_pct': 0.025559538040458088, 'sideways_atr_max_pct': 0.1362328921010254, 'sideways_tp_mult': 1.4067876834251516, 'sideways_tsl_mult': 0.5592613984849734, 'sideways_time_stop': 272, 'sideways_use_sma': True, 'sideways_use_ema': False, 'sideways_use_atr': False, 'sideways_use_adx': True, 'sideways_use_spike': True, 'sideways_rsi_required': False}.
[I 2025-09-01 14:19:12,521] Trial 350 finished with values: [-0.03480535435992804, 0.03465659420060056] and parameters: {'p_sma': 24, 'p_std': 29, 'p_atr': 26, 'p_adx': 21, 'rsi_period': 82, 'ema1': 29, 'ema2': 49, 'slip_atr_k': 0.02033479564591313, 'slip_spread_k': 0.6044066030124698, 'spread_hl_frac': 0.042335884445567046, 'bb_std_mult': 2.716343882856478, 'rsi_os': 11, 'rsi_ob': 51, 'vol_spike': 0.12163151653033703, 'adx_thresh': 7.610949504076747, 'atr_min_pct': 0.009784908020394757, 'atr_max_pct': 0.052193361324276995, 'tp_mult': 2.4503042824066705, 'tsl_mult': 0.8261982615004593, 'strategy': 'mean_reversion', 'time_stop': 222, 'use_sma': False, 'use_atr': False, 'use_adx': True, 'use_ema': True, 'use_spike': True, 'rsi_required': True, 'edge_k': 0.15606012493616134, 'edge_cap': 0.9542388124813649, 'bull_strategy': 'mean_reversion', 'bull_bb_std_mult': 3.17165150728177, 'bull_rsi_os': 50, 'bull_rsi_ob': 81, 'bull_adx_thresh': 26.25705068384606, 'bull_atr_min_pct': 0.017128077780293172, 'bull_atr_max_pct': 0.1363200586316042, 'bull_tp_mult': 2.6923496945626315, 'bull_tsl_mult': 0.38234182781707965, 'bull_time_stop': 216, 'bull_use_sma': True, 'bull_use_ema': False, 'bull_use_atr': True, 'bull_use_adx': True, 'bull_use_spike': True, 'bull_rsi_required': True, 'bear_strategy': 'mean_reversion', 'bear_bb_std_mult': 2.030462014550549, 'bear_rsi_os': 41, 'bear_rsi_ob': 69, 'bear_adx_thresh': 7.500353597908215, 'bear_atr_min_pct': 0.0021735415867761825, 'bear_atr_max_pct': 0.100338321267636, 'bear_tp_mult': 2.765524247277312, 'bear_tsl_mult': 0.03857902444216482, 'bear_time_stop': 108, 'bear_use_sma': True, 'bear_use_ema': False, 'bear_use_atr': True, 'bear_use_adx': False, 'bear_use_spike': True, 'bear_rsi_required': False, 'sideways_strategy': 'mean_reversion', 'sideways_bb_std_mult': 3.152313457656189, 'sideways_rsi_os': 45, 'sideways_rsi_ob': 58, 'sideways_adx_thresh': 14.895895215446085, 'sideways_atr_min_pct': 0.018530490583497063, 'sideways_atr_max_pct': 0.09839034102999893, 'sideways_tp_mult': 1.3261245488219948, 'sideways_tsl_mult': 0.5350496677816303, 'sideways_time_stop': 275, 'sideways_use_sma': True, 'sideways_use_ema': False, 'sideways_use_atr': False, 'sideways_use_adx': True, 'sideways_use_spike': True, 'sideways_rsi_required': True}.
[I 2025-09-01 14:19:48,975] Trial 355 finished with values: [-1000000000.0, 1000000000.0] and parameters: {'p_sma': 52, 'p_std': 27, 'p_atr': 19, 'p_adx': 21, 'rsi_period': 16, 'ema1': 26, 'ema2': 49, 'slip_atr_k': 0.017903699830772918, 'slip_spread_k': 0.7040759879256175, 'spread_hl_frac': 0.024901030498345727, 'bb_std_mult': 3.5985981308751276, 'rsi_os': 29, 'rsi_ob': 55, 'vol_spike': 0.1249672954604811, 'adx_thresh': 8.910593687357956, 'atr_min_pct': 0.008619888101577038, 'atr_max_pct': 0.03774360572226366, 'tp_mult': 2.275812153710344, 'tsl_mult': 0.5872231345458057, 'strategy': 'mean_reversion', 'time_stop': 111, 'use_sma': False, 'use_atr': False, 'use_adx': True, 'use_ema': True, 'use_spike': True, 'rsi_required': True, 'edge_k': 0.18225138477824154, 'edge_cap': 0.6002171942849416, 'bull_strategy': 'breakout', 'bull_bb_std_mult': 2.419834984097786, 'bull_rsi_os': 45, 'bull_rsi_ob': 74, 'bull_adx_thresh': 11.734349580427091, 'bull_atr_min_pct': 0.020050491654998434, 'bull_atr_max_pct': 0.07510041104541752, 'bull_tp_mult': 2.6889928539431205, 'bull_tsl_mult': 0.3330260335012417, 'bull_time_stop': 157, 'bull_use_sma': True, 'bull_use_ema': True, 'bull_use_atr': True, 'bull_use_adx': True, 'bull_use_spike': True, 'bull_rsi_required': True, 'bear_strategy': 'mean_reversion', 'bear_bb_std_mult': 2.5281368695369064, 'bear_rsi_os': 23, 'bear_rsi_ob': 82, 'bear_adx_thresh': 7.643611055499964, 'bear_atr_min_pct': 0.01534686065239401, 'bear_atr_max_pct': 0.022351876512526153, 'bear_tp_mult': 1.564858492204964, 'bear_tsl_mult': 0.14100327735667292, 'bear_time_stop': 108, 'bear_use_sma': True, 'bear_use_ema': False, 'bear_use_atr': False, 'bear_use_adx': False, 'bear_use_spike': True, 'bear_rsi_required': False, 'sideways_strategy': 'mean_reversion', 'sideways_bb_std_mult': 3.038572572904104, 'sideways_rsi_os': 27, 'sideways_rsi_ob': 46, 'sideways_adx_thresh': 22.068849747961806, 'sideways_atr_min_pct': 0.027424320117292005, 'sideways_atr_max_pct': 0.11667576874211483, 'sideways_tp_mult': 1.3409235564436346, 'sideways_tsl_mult': 0.544818722470606, 'sideways_time_stop': 129, 'sideways_use_sma': True, 'sideways_use_ema': False, 'sideways_use_atr': False, 'sideways_use_adx': True, 'sideways_use_spike': False, 'sideways_rsi_required': False}.
[I 2025-09-01 14:19:49,911] Trial 354 finished with values: [-1000000000.0, 1000000000.0] and parameters: {'p_sma': 29, 'p_std': 27, 'p_atr': 19, 'p_adx': 22, 'rsi_period': 80, 'ema1': 15, 'ema2': 47, 'slip_atr_k': 0.01757393744440666, 'slip_spread_k': 0.16884585233559668, 'spread_hl_frac': 0.03894536673458244, 'bb_std_mult': 3.5238918866315716, 'rsi_os': 5, 'rsi_ob': 55, 'vol_spike': 0.027254310422835312, 'adx_thresh': 7.170131975330088, 'atr_min_pct': 0.007256393847043542, 'atr_max_pct': 0.14769921015733012, 'tp_mult': 2.290495557593031, 'tsl_mult': 0.7159812146571926, 'strategy': 'mean_reversion', 'time_stop': 114, 'use_sma': False, 'use_atr': False, 'use_adx': True, 'use_ema': True, 'use_spike': True, 'rsi_required': True, 'edge_k': 0.1884872925298382, 'edge_cap': 0.5882913300638829, 'bull_strategy': 'breakout', 'bull_bb_std_mult': 3.2066792923698397, 'bull_rsi_os': 26, 'bull_rsi_ob': 47, 'bull_adx_thresh': 26.210033155188906, 'bull_atr_min_pct': 0.010885950642117729, 'bull_atr_max_pct': 0.02360038898087593, 'bull_tp_mult': 2.135919760764422, 'bull_tsl_mult': 0.5174778141200553, 'bull_time_stop': 154, 'bull_use_sma': True, 'bull_use_ema': True, 'bull_use_atr': True, 'bull_use_adx': True, 'bull_use_spike': True, 'bull_rsi_required': True, 'bear_strategy': 'mean_reversion', 'bear_bb_std_mult': 0.86574620794773, 'bear_rsi_os': 30, 'bear_rsi_ob': 94, 'bear_adx_thresh': 7.490866663121468, 'bear_atr_min_pct': 0.0023863890604528884, 'bear_atr_max_pct': 0.0938775292551947, 'bear_tp_mult': 2.1016803836046765, 'bear_tsl_mult': 0.039479892244730086, 'bear_time_stop': 82, 'bear_use_sma': True, 'bear_use_ema': False, 'bear_use_atr': False, 'bear_use_adx': False, 'bear_use_spike': True, 'bear_rsi_required': False, 'sideways_strategy': 'mean_reversion', 'sideways_bb_std_mult': 3.063954660992798, 'sideways_rsi_os': 27, 'sideways_rsi_ob': 89, 'sideways_adx_thresh': 18.1952649369399, 'sideways_atr_min_pct': 0.018682302681822346, 'sideways_atr_max_pct': 0.1358151705009768, 'sideways_tp_mult': 1.349638541777418, 'sideways_tsl_mult': 0.5442755884305952, 'sideways_time_stop': 261, 'sideways_use_sma': True, 'sideways_use_ema': False, 'sideways_use_atr': False, 'sideways_use_adx': True, 'sideways_use_spike': False, 'sideways_rsi_required': False}.
[I 2025-09-01 14:19:50,636] Trial 356 finished with values: [-1000000000.0, 1000000000.0] and parameters: {'p_sma': 29, 'p_std': 27, 'p_atr': 19, 'p_adx': 23, 'rsi_period': 80, 'ema1': 20, 'ema2': 41, 'slip_atr_k': 0.18037528110382672, 'slip_spread_k': 0.16340052250804032, 'spread_hl_frac': 0.003720502784520253, 'bb_std_mult': 3.5074610901801377, 'rsi_os': 6, 'rsi_ob': 55, 'vol_spike': 0.12165948454512991, 'adx_thresh': 6.995693093458261, 'atr_min_pct': 0.02473956122177451, 'atr_max_pct': 0.0585031929190183, 'tp_mult': 2.6057303827595515, 'tsl_mult': 0.584421294724698, 'strategy': 'mean_reversion', 'time_stop': 300, 'use_sma': False, 'use_atr': False, 'use_adx': True, 'use_ema': True, 'use_spike': True, 'rsi_required': True, 'edge_k': 0.2711860704157527, 'edge_cap': 0.4846698264639544, 'bull_strategy': 'breakout', 'bull_bb_std_mult': 0.6937695162005004, 'bull_rsi_os': 26, 'bull_rsi_ob': 86, 'bull_adx_thresh': 14.484008338316567, 'bull_atr_min_pct': 0.00870948138134879, 'bull_atr_max_pct': 0.12551322592858813, 'bull_tp_mult': 1.7289478474736668, 'bull_tsl_mult': 0.5177689856710834, 'bull_time_stop': 155, 'bull_use_sma': False, 'bull_use_ema': True, 'bull_use_atr': True, 'bull_use_adx': True, 'bull_use_spike': True, 'bull_rsi_required': True, 'bear_strategy': 'mean_reversion', 'bear_bb_std_mult': 2.5392498445608234, 'bear_rsi_os': 34, 'bear_rsi_ob': 82, 'bear_adx_thresh': 32.444429207355874, 'bear_atr_min_pct': 0.0022287484254200863, 'bear_atr_max_pct': 0.10960252383770083, 'bear_tp_mult': 1.7100283459330343, 'bear_tsl_mult': 0.13672739191947683, 'bear_time_stop': 106, 'bear_use_sma': True, 'bear_use_ema': False, 'bear_use_atr': False, 'bear_use_adx': False, 'bear_use_spike': True, 'bear_rsi_required': False, 'sideways_strategy': 'mean_reversion', 'sideways_bb_std_mult': 3.054587195007012, 'sideways_rsi_os': 31, 'sideways_rsi_ob': 80, 'sideways_adx_thresh': 22.180467553445986, 'sideways_atr_min_pct': 5.705844464206494e-05, 'sideways_atr_max_pct': 0.07895822122703015, 'sideways_tp_mult': 1.3288119198937711, 'sideways_tsl_mult': 0.46732594788312254, 'sideways_time_stop': 263, 'sideways_use_sma': True, 'sideways_use_ema': True, 'sideways_use_atr': False, 'sideways_use_adx': True, 'sideways_use_spike': False, 'sideways_rsi_required': False}.
[I 2025-09-01 14:19:50,812] Trial 357 finished with values: [-0.042297199581273204, 0.04530002134386509] and parameters: {'p_sma': 29, 'p_std': 27, 'p_atr': 25, 'p_adx': 30, 'rsi_period': 59, 'ema1': 9, 'ema2': 42, 'slip_atr_k': 0.1196308930699037, 'slip_spread_k': 0.5978830824590653, 'spread_hl_frac': 0.016870419850120076, 'bb_std_mult': 1.5150353309648161, 'rsi_os': 6, 'rsi_ob': 55, 'vol_spike': 0.12481547722717172, 'adx_thresh': 28.72229399193136, 'atr_min_pct': 0.007404618175899201, 'atr_max_pct': 0.03682368889048818, 'tp_mult': 2.60289464708689, 'tsl_mult': 0.7214704029237629, 'strategy': 'mean_reversion', 'time_stop': 112, 'use_sma': False, 'use_atr': False, 'use_adx': True, 'use_ema': True, 'use_spike': True, 'rsi_required': True, 'edge_k': 0.3013273870769008, 'edge_cap': 0.5895844321141887, 'bull_strategy': 'breakout', 'bull_bb_std_mult': 3.248521228166153, 'bull_rsi_os': 26, 'bull_rsi_ob': 79, 'bull_adx_thresh': 23.526722952672543, 'bull_atr_min_pct': 2.0028437799406162e-05, 'bull_atr_max_pct': 0.12150436777942854, 'bull_tp_mult': 1.7137669589454945, 'bull_tsl_mult': 0.4092967086238678, 'bull_time_stop': 154, 'bull_use_sma': False, 'bull_use_ema': True, 'bull_use_atr': True, 'bull_use_adx': True, 'bull_use_spike': True, 'bull_rsi_required': True, 'bear_strategy': 'mean_reversion', 'bear_bb_std_mult': 2.611981693730085, 'bear_rsi_os': 34, 'bear_rsi_ob': 88, 'bear_adx_thresh': 9.022174020675045, 'bear_atr_min_pct': 0.00335862402715963, 'bear_atr_max_pct': 0.10889253634787771, 'bear_tp_mult': 1.5875303868460584, 'bear_tsl_mult': 0.5324510064187838, 'bear_time_stop': 81, 'bear_use_sma': True, 'bear_use_ema': False, 'bear_use_atr': False, 'bear_use_adx': False, 'bear_use_spike': True, 'bear_rsi_required': False, 'sideways_strategy': 'mean_reversion', 'sideways_bb_std_mult': 2.6830222559799544, 'sideways_rsi_os': 31, 'sideways_rsi_ob': 70, 'sideways_adx_thresh': 22.11562619634107, 'sideways_atr_min_pct': 0.00010205442578955018, 'sideways_atr_max_pct': 0.1152804049158065, 'sideways_tp_mult': 1.2858505090879313, 'sideways_tsl_mult': 0.467097041623766, 'sideways_time_stop': 263, 'sideways_use_sma': True, 'sideways_use_ema': True, 'sideways_use_atr': False, 'sideways_use_adx': True, 'sideways_use_spike': False, 'sideways_rsi_required': False}.
[I 2025-09-01 14:19:51,458] Trial 358 finished with values: [-1000000000.0, 1000000000.0] and parameters: {'p_sma': 29, 'p_std': 26, 'p_atr': 26, 'p_adx': 8, 'rsi_period': 40, 'ema1': 9, 'ema2': 42, 'slip_atr_k': 0.01408595270102316, 'slip_spread_k': 0.5987318797203939, 'spread_hl_frac': 0.008414156264577784, 'bb_std_mult': 1.0333779380927053, 'rsi_os': 5, 'rsi_ob': 49, 'vol_spike': 0.299992318264226, 'adx_thresh': 27.869348695976548, 'atr_min_pct': 0.024555077306761736, 'atr_max_pct': 0.14707991689115724, 'tp_mult': 1.4539338442647185, 'tsl_mult': 0.7207025819962074, 'strategy': 'mean_reversion', 'time_stop': 118, 'use_sma': True, 'use_atr': False, 'use_adx': True, 'use_ema': True, 'use_spike': True, 'rsi_required': True, 'edge_k': 1.4325432681074663, 'edge_cap': 0.49418144608391157, 'bull_strategy': 'breakout', 'bull_bb_std_mult': 3.2415413538580196, 'bull_rsi_os': 26, 'bull_rsi_ob': 86, 'bull_adx_thresh': 14.61500244365039, 'bull_atr_min_pct': 0.006897296213196085, 'bull_atr_max_pct': 0.015859576458526814, 'bull_tp_mult': 2.984568285624085, 'bull_tsl_mult': 0.5168499180610469, 'bull_time_stop': 156, 'bull_use_sma': False, 'bull_use_ema': True, 'bull_use_atr': True, 'bull_use_adx': True, 'bull_use_spike': True, 'bull_rsi_required': True, 'bear_strategy': 'mean_reversion', 'bear_bb_std_mult': 1.6297280274441892, 'bear_rsi_os': 34, 'bear_rsi_ob': 90, 'bear_adx_thresh': 9.058805443481218, 'bear_atr_min_pct': 0.0033696361946232004, 'bear_atr_max_pct': 0.10838220935609219, 'bear_tp_mult': 1.1333506898253716, 'bear_tsl_mult': 0.11194791087337251, 'bear_time_stop': 121, 'bear_use_sma': True, 'bear_use_ema': False, 'bear_use_atr': False, 'bear_use_adx': False, 'bear_use_spike': True, 'bear_rsi_required': False, 'sideways_strategy': 'mean_reversion', 'sideways_bb_std_mult': 3.2920029918582334, 'sideways_rsi_os': 31, 'sideways_rsi_ob': 88, 'sideways_adx_thresh': 17.129428653248432, 'sideways_atr_min_pct': 0.003093751000305566, 'sideways_atr_max_pct': 0.10441539788424112, 'sideways_tp_mult': 1.2711888819773662, 'sideways_tsl_mult': 0.37862808899838435, 'sideways_time_stop': 265, 'sideways_use_sma': True, 'sideways_use_ema': True, 'sideways_use_atr': True, 'sideways_use_adx': True, 'sideways_use_spike': False, 'sideways_rsi_required': False}.
[I 2025-09-01 14:20:29,035] Trial 359 finished with values: [-0.024145356217406655, 0.025827009664860373] and parameters: {'p_sma': 59, 'p_std': 48, 'p_atr': 24, 'p_adx': 13, 'rsi_period': 40, 'ema1': 24, 'ema2': 42, 'slip_atr_k': 0.11728279045795906, 'slip_spread_k': 0.5957498502853235, 'spread_hl_frac': 0.00804662534115508, 'bb_std_mult': 1.5206392106371824, 'rsi_os': 18, 'rsi_ob': 53, 'vol_spike': 0.12600932553072025, 'adx_thresh': 19.03702873554345, 'atr_min_pct': 0.02674989834560677, 'atr_max_pct': 0.057178287484265636, 'tp_mult': 1.463236451750976, 'tsl_mult': 0.7046425519560554, 'strategy': 'mean_reversion', 'time_stop': 119, 'use_sma': True, 'use_atr': False, 'use_adx': True, 'use_ema': True, 'use_spike': True, 'rsi_required': True, 'edge_k': 0.9131817366936527, 'edge_cap': 0.528317901969463, 'bull_strategy': 'breakout', 'bull_bb_std_mult': 0.7664428817540454, 'bull_rsi_os': 30, 'bull_rsi_ob': 86, 'bull_adx_thresh': 15.006124834219573, 'bull_atr_min_pct': 0.02992711369629076, 'bull_atr_max_pct': 0.12126351195764098, 'bull_tp_mult': 1.6967575837084632, 'bull_tsl_mult': 0.4119378366736029, 'bull_time_stop': 175, 'bull_use_sma': False, 'bull_use_ema': True, 'bull_use_atr': True, 'bull_use_adx': True, 'bull_use_spike': True, 'bull_rsi_required': True, 'bear_strategy': 'mean_reversion', 'bear_bb_std_mult': 2.6162201554385662, 'bear_rsi_os': 34, 'bear_rsi_ob': 73, 'bear_adx_thresh': 16.60288317239747, 'bear_atr_min_pct': 0.003189572596713694, 'bear_atr_max_pct': 0.14884298078460367, 'bear_tp_mult': 1.4559623893973193, 'bear_tsl_mult': 0.9157271536282149, 'bear_time_stop': 225, 'bear_use_sma': True, 'bear_use_ema': False, 'bear_use_atr': False, 'bear_use_adx': False, 'bear_use_spike': True, 'bear_rsi_required': False, 'sideways_strategy': 'mean_reversion', 'sideways_bb_std_mult': 3.424708521888724, 'sideways_rsi_os': 31, 'sideways_rsi_ob': 90, 'sideways_adx_thresh': 9.141120725517967, 'sideways_atr_min_pct': 0.004194954150536748, 'sideways_atr_max_pct': 0.1149095520367256, 'sideways_tp_mult': 1.2828826832715408, 'sideways_tsl_mult': 0.46272893983267666, 'sideways_time_stop': 264, 'sideways_use_sma': True, 'sideways_use_ema': True, 'sideways_use_atr': True, 'sideways_use_adx': True, 'sideways_use_spike': False, 'sideways_rsi_required': False}.
