[I 2025-09-01 14:43:26,849] Trial 521 finished with values: [-1000000000.0, 1000000000.0] and parameters: {'p_sma': 29, 'p_std': 9, 'p_atr': 10, 'p_adx': 8, 'rsi_period': 79, 'ema1': 9, 'ema2': 20, 'slip_atr_k': 0.14703990006765705, 'slip_spread_k': 0.2922690458077247, 'spread_hl_frac': 0.010467885409579217, 'bb_std_mult': 0.5169957554038513, 'rsi_os': 7, 'rsi_ob': 56, 'vol_spike': 0.23167314809596481, 'adx_thresh': 6.800410461959, 'atr_min_pct': 0.010407560738187136, 'atr_max_pct': 0.04645409802866296, 'tp_mult': 1.240262062172265, 'tsl_mult': 0.6464103752812408, 'strategy': 'breakout', 'time_stop': 127, 'use_sma': True, 'use_atr': False, 'use_adx': False, 'use_ema': True, 'use_spike': True, 'rsi_required': True, 'edge_k': 0.2738253373434012, 'edge_cap': 0.9976450789049638, 'bull_strategy': 'breakout', 'bull_bb_std_mult': 3.4508831023080355, 'bull_rsi_os': 11, 'bull_rsi_ob': 75, 'bull_adx_thresh': 11.689809345494572, 'bull_atr_min_pct': 0.011929673732606585, 'bull_atr_max_pct': 0.08345618432543911, 'bull_tp_mult': 1.677602640779659, 'bull_tsl_mult': 0.47634556047567667, 'bull_time_stop': 197, 'bull_use_sma': False, 'bull_use_ema': True, 'bull_use_atr': True, 'bull_use_adx': True, 'bull_use_spike': True, 'bull_rsi_required': True, 'bear_strategy': 'breakout', 'bear_bb_std_mult': 2.496844024319684, 'bear_rsi_os': 36, 'bear_rsi_ob': 57, 'bear_adx_thresh': 7.61000598443446, 'bear_atr_min_pct': 0.01607191156249194, 'bear_atr_max_pct': 0.08824294942717961, 'bear_tp_mult': 2.814390542155067, 'bear_tsl_mult': 0.05369889635817893, 'bear_time_stop': 266, 'bear_use_sma': True, 'bear_use_ema': False, 'bear_use_atr': True, 'bear_use_adx': False, 'bear_use_spike': True, 'bear_rsi_required': False, 'sideways_strategy': 'mean_reversion', 'sideways_bb_std_mult': 2.9951959371429555, 'sideways_rsi_os': 18, 'sideways_rsi_ob': 92, 'sideways_adx_thresh': 20.963265732471488, 'sideways_atr_min_pct': 0.0048748733324019446, 'sideways_atr_max_pct': 0.14682725633404342, 'sideways_tp_mult': 2.374175589204163, 'sideways_tsl_mult': 0.29679979426360437, 'sideways_time_stop': 244, 'sideways_use_sma': True, 'sideways_use_ema': True, 'sideways_use_atr': False, 'sideways_use_adx': False, 'sideways_use_spike': False, 'sideways_rsi_required': True}.
[I 2025-09-01 14:43:26,868] Trial 523 finished with values: [-1000000000.0, 1000000000.0] and parameters: {'p_sma': 15, 'p_std': 60, 'p_atr': 27, 'p_adx': 19, 'rsi_period': 71, 'ema1': 8, 'ema2': 56, 'slip_atr_k': 0.20028886916350158, 'slip_spread_k': 0.6800185279056477, 'spread_hl_frac': 0.030415599056417345, 'bb_std_mult': 3.2996435113928175, 'rsi_os': 21, 'rsi_ob': 54, 'vol_spike': 0.004573275689421258, 'adx_thresh': 5.464703630595564, 'atr_min_pct': 0.008282546310435747, 'atr_max_pct': 0.07698069780643696, 'tp_mult': 1.2307546629015746, 'tsl_mult': 0.8120561247137739, 'strategy': 'mean_reversion', 'time_stop': 128, 'use_sma': True, 'use_atr': False, 'use_adx': True, 'use_ema': True, 'use_spike': True, 'rsi_required': True, 'edge_k': 0.2949658710282266, 'edge_cap': 0.9980230234573468, 'bull_strategy': 'breakout', 'bull_bb_std_mult': 3.3964177470950405, 'bull_rsi_os': 43, 'bull_rsi_ob': 80, 'bull_adx_thresh': 13.138536993170552, 'bull_atr_min_pct': 0.01307561828157965, 'bull_atr_max_pct': 0.07592631106309206, 'bull_tp_mult': 1.5331338277126365, 'bull_tsl_mult': 0.13186365643817916, 'bull_time_stop': 150, 'bull_use_sma': False, 'bull_use_ema': False, 'bull_use_atr': True, 'bull_use_adx': True, 'bull_use_spike': True, 'bull_rsi_required': True, 'bear_strategy': 'mean_reversion', 'bear_bb_std_mult': 1.8603256216930544, 'bear_rsi_os': 45, 'bear_rsi_ob': 57, 'bear_adx_thresh': 7.425151506364547, 'bear_atr_min_pct': 0.013939235909087348, 'bear_atr_max_pct': 0.11339879391621673, 'bear_tp_mult': 2.1634110970456844, 'bear_tsl_mult': 0.10986120906344221, 'bear_time_stop': 96, 'bear_use_sma': False, 'bear_use_ema': False, 'bear_use_atr': False, 'bear_use_adx': False, 'bear_use_spike': True, 'bear_rsi_required': False, 'sideways_strategy': 'mean_reversion', 'sideways_bb_std_mult': 1.607807439710384, 'sideways_rsi_os': 50, 'sideways_rsi_ob': 74, 'sideways_adx_thresh': 10.013993121653206, 'sideways_atr_min_pct': 0.005117043758397445, 'sideways_atr_max_pct': 0.10885553442870902, 'sideways_tp_mult': 2.434242999658842, 'sideways_tsl_mult': 0.3846566045710902, 'sideways_time_stop': 261, 'sideways_use_sma': True, 'sideways_use_ema': True, 'sideways_use_atr': True, 'sideways_use_adx': False, 'sideways_use_spike': False, 'sideways_rsi_required': False}.
[I 2025-09-01 14:43:27,718] Trial 522 finished with values: [-1000000000.0, 1000000000.0] and parameters: {'p_sma': 32, 'p_std': 56, 'p_atr': 25, 'p_adx': 13, 'rsi_period': 51, 'ema1': 26, 'ema2': 56, 'slip_atr_k': 0.09725746545827783, 'slip_spread_k': 0.16033075968414345, 'spread_hl_frac': 0.03576875080626288, 'bb_std_mult': 1.678838202390461, 'rsi_os': 14, 'rsi_ob': 57, 'vol_spike': 0.11229122466188424, 'adx_thresh': 5.0076329440158265, 'atr_min_pct': 0.00495068587042098, 'atr_max_pct': 0.08498174396165459, 'tp_mult': 1.230336542620791, 'tsl_mult': 0.6398281837608755, 'strategy': 'mean_reversion', 'time_stop': 208, 'use_sma': True, 'use_atr': False, 'use_adx': True, 'use_ema': True, 'use_spike': True, 'rsi_required': True, 'edge_k': 0.8885145466200294, 'edge_cap': 0.8541624477278372, 'bull_strategy': 'breakout', 'bull_bb_std_mult': 3.4592591942591526, 'bull_rsi_os': 11, 'bull_rsi_ob': 80, 'bull_adx_thresh': 5.785999488279311, 'bull_atr_min_pct': 0.0194587079018989, 'bull_atr_max_pct': 0.07576496580987907, 'bull_tp_mult': 1.5421814932587936, 'bull_tsl_mult': 0.48121642341152077, 'bull_time_stop': 153, 'bull_use_sma': False, 'bull_use_ema': True, 'bull_use_atr': True, 'bull_use_adx': True, 'bull_use_spike': True, 'bull_rsi_required': True, 'bear_strategy': 'mean_reversion', 'bear_bb_std_mult': 2.4868638644635794, 'bear_rsi_os': 23, 'bear_rsi_ob': 89, 'bear_adx_thresh': 7.43224825778659, 'bear_atr_min_pct': 0.003553015689911317, 'bear_atr_max_pct': 0.1077335304739415, 'bear_tp_mult': 2.1488611989893505, 'bear_tsl_mult': 0.12036943207398505, 'bear_time_stop': 94, 'bear_use_sma': False, 'bear_use_ema': False, 'bear_use_atr': False, 'bear_use_adx': False, 'bear_use_spike': True, 'bear_rsi_required': False, 'sideways_strategy': 'mean_reversion', 'sideways_bb_std_mult': 1.8038772470827866, 'sideways_rsi_os': 30, 'sideways_rsi_ob': 64, 'sideways_adx_thresh': 9.94935047040661, 'sideways_atr_min_pct': 0.021953856693878292, 'sideways_atr_max_pct': 0.10946804741944471, 'sideways_tp_mult': 1.332820959741165, 'sideways_tsl_mult': 0.3819623181066707, 'sideways_time_stop': 243, 'sideways_use_sma': True, 'sideways_use_ema': True, 'sideways_use_atr': True, 'sideways_use_adx': False, 'sideways_use_spike': False, 'sideways_rsi_required': False}.
[I 2025-09-01 14:44:10,131] Trial 527 finished with values: [-1000000000.0, 1000000000.0] and parameters: {'p_sma': 23, 'p_std': 16, 'p_atr': 18, 'p_adx': 13, 'rsi_period': 81, 'ema1': 16, 'ema2': 53, 'slip_atr_k': 0.07579133234577165, 'slip_spread_k': 0.5436727809711394, 'spread_hl_frac': 0.013806581512264915, 'bb_std_mult': 1.4537535135846946, 'rsi_os': 43, 'rsi_ob': 53, 'vol_spike': 0.11178787955786447, 'adx_thresh': 5.875284863651221, 'atr_min_pct': 0.01148907204160976, 'atr_max_pct': 0.028565962300038855, 'tp_mult': 1.4795484988482905, 'tsl_mult': 0.6689188553427541, 'strategy': 'mean_reversion', 'time_stop': 108, 'use_sma': True, 'use_atr': False, 'use_adx': True, 'use_ema': True, 'use_spike': True, 'rsi_required': True, 'edge_k': 0.18522476554460304, 'edge_cap': 0.9590967725290096, 'bull_strategy': 'mean_reversion', 'bull_bb_std_mult': 3.1792779155350543, 'bull_rsi_os': 13, 'bull_rsi_ob': 76, 'bull_adx_thresh': 7.331089962640398, 'bull_atr_min_pct': 0.010943725285775842, 'bull_atr_max_pct': 0.1381638051544673, 'bull_tp_mult': 2.000171866954595, 'bull_tsl_mult': 0.48950796849025574, 'bull_time_stop': 287, 'bull_use_sma': True, 'bull_use_ema': True, 'bull_use_atr': True, 'bull_use_adx': True, 'bull_use_spike': False, 'bull_rsi_required': True, 'bear_strategy': 'mean_reversion', 'bear_bb_std_mult': 0.8441081417541412, 'bear_rsi_os': 34, 'bear_rsi_ob': 64, 'bear_adx_thresh': 30.13137564217355, 'bear_atr_min_pct': 0.028805091589321898, 'bear_atr_max_pct': 0.014609762258277507, 'bear_tp_mult': 1.1280719091526858, 'bear_tsl_mult': 0.12389332502687787, 'bear_time_stop': 180, 'bear_use_sma': False, 'bear_use_ema': True, 'bear_use_atr': False, 'bear_use_adx': False, 'bear_use_spike': True, 'bear_rsi_required': True, 'sideways_strategy': 'mean_reversion', 'sideways_bb_std_mult': 2.053096651912326, 'sideways_rsi_os': 30, 'sideways_rsi_ob': 88, 'sideways_adx_thresh': 24.743006915252003, 'sideways_atr_min_pct': 0.022275267725431917, 'sideways_atr_max_pct': 0.016851001729486587, 'sideways_tp_mult': 2.532517896342449, 'sideways_tsl_mult': 0.37512673430326, 'sideways_time_stop': 271, 'sideways_use_sma': True, 'sideways_use_ema': False, 'sideways_use_atr': True, 'sideways_use_adx': True, 'sideways_use_spike': False, 'sideways_rsi_required': False}.
[I 2025-09-01 14:44:10,686] Trial 526 finished with values: [-1000000000.0, 1000000000.0] and parameters: {'p_sma': 32, 'p_std': 30, 'p_atr': 26, 'p_adx': 7, 'rsi_period': 81, 'ema1': 9, 'ema2': 53, 'slip_atr_k': 0.09679786252954653, 'slip_spread_k': 0.8549603655359059, 'spread_hl_frac': 0.009648045421675086, 'bb_std_mult': 0.6259664789226456, 'rsi_os': 14, 'rsi_ob': 52, 'vol_spike': 0.06770539929162653, 'adx_thresh': 5.733675674116243, 'atr_min_pct': 0.02338908933138912, 'atr_max_pct': 0.029839312854110775, 'tp_mult': 1.3604056477540825, 'tsl_mult': 0.48085322324981666, 'strategy': 'mean_reversion', 'time_stop': 207, 'use_sma': True, 'use_atr': False, 'use_adx': True, 'use_ema': True, 'use_spike': True, 'rsi_required': True, 'edge_k': 0.5425393555878684, 'edge_cap': 0.9540907282752958, 'bull_strategy': 'mean_reversion', 'bull_bb_std_mult': 0.5485354514017267, 'bull_rsi_os': 14, 'bull_rsi_ob': 82, 'bull_adx_thresh': 12.529332107860935, 'bull_atr_min_pct': 0.019259667985130367, 'bull_atr_max_pct': 0.08724994898205511, 'bull_tp_mult': 1.5743922142244537, 'bull_tsl_mult': 0.0854834525216771, 'bull_time_stop': 113, 'bull_use_sma': True, 'bull_use_ema': True, 'bull_use_atr': True, 'bull_use_adx': True, 'bull_use_spike': False, 'bull_rsi_required': True, 'bear_strategy': 'mean_reversion', 'bear_bb_std_mult': 2.1453279525374045, 'bear_rsi_os': 34, 'bear_rsi_ob': 54, 'bear_adx_thresh': 34.470475957144636, 'bear_atr_min_pct': 0.0032845729057647175, 'bear_atr_max_pct': 0.03327084588211665, 'bear_tp_mult': 2.0492626511078265, 'bear_tsl_mult': 0.13224014567413409, 'bear_time_stop': 123, 'bear_use_sma': False, 'bear_use_ema': True, 'bear_use_atr': False, 'bear_use_adx': False, 'bear_use_spike': True, 'bear_rsi_required': True, 'sideways_strategy': 'mean_reversion', 'sideways_bb_std_mult': 3.029468762485791, 'sideways_rsi_os': 30, 'sideways_rsi_ob': 88, 'sideways_adx_thresh': 24.819715881271062, 'sideways_atr_min_pct': 0.008891572748403215, 'sideways_atr_max_pct': 0.11076134749671171, 'sideways_tp_mult': 2.5209104892131675, 'sideways_tsl_mult': 0.36988137112347336, 'sideways_time_stop': 270, 'sideways_use_sma': True, 'sideways_use_ema': False, 'sideways_use_atr': True, 'sideways_use_adx': True, 'sideways_use_spike': False, 'sideways_rsi_required': False}.
[I 2025-09-01 14:44:10,878] Trial 525 finished with values: [-1000000000.0, 1000000000.0] and parameters: {'p_sma': 23, 'p_std': 30, 'p_atr': 26, 'p_adx': 7, 'rsi_period': 81, 'ema1': 16, 'ema2': 53, 'slip_atr_k': 0.07466063492255208, 'slip_spread_k': 0.9440193605184809, 'spread_hl_frac': 0.034804702443424665, 'bb_std_mult': 3.537047829306202, 'rsi_os': 43, 'rsi_ob': 52, 'vol_spike': 0.03905355535225566, 'adx_thresh': 30.93682627376853, 'atr_min_pct': 0.005296324871266996, 'atr_max_pct': 0.029863673237620708, 'tp_mult': 1.0912636479953477, 'tsl_mult': 0.6700853799614324, 'strategy': 'mean_reversion', 'time_stop': 174, 'use_sma': True, 'use_atr': False, 'use_adx': True, 'use_ema': True, 'use_spike': True, 'rsi_required': True, 'edge_k': 0.1840087741465281, 'edge_cap': 0.9529504122438714, 'bull_strategy': 'mean_reversion', 'bull_bb_std_mult': 0.565923320555846, 'bull_rsi_os': 13, 'bull_rsi_ob': 82, 'bull_adx_thresh': 29.45483298121021, 'bull_atr_min_pct': 0.010851072998737056, 'bull_atr_max_pct': 0.1380485405174069, 'bull_tp_mult': 1.5705946616977038, 'bull_tsl_mult': 0.9207145859960392, 'bull_time_stop': 158, 'bull_use_sma': True, 'bull_use_ema': True, 'bull_use_atr': True, 'bull_use_adx': True, 'bull_use_spike': False, 'bull_rsi_required': True, 'bear_strategy': 'mean_reversion', 'bear_bb_std_mult': 2.809900370490695, 'bear_rsi_os': 34, 'bear_rsi_ob': 68, 'bear_adx_thresh': 23.41059877608, 'bear_atr_min_pct': 0.017927281476334073, 'bear_atr_max_pct': 0.10646689270062298, 'bear_tp_mult': 2.0597404226886002, 'bear_tsl_mult': 0.13979767624877612, 'bear_time_stop': 209, 'bear_use_sma': False, 'bear_use_ema': True, 'bear_use_atr': False, 'bear_use_adx': False, 'bear_use_spike': True, 'bear_rsi_required': True, 'sideways_strategy': 'mean_reversion', 'sideways_bb_std_mult': 0.9638113133835222, 'sideways_rsi_os': 30, 'sideways_rsi_ob': 81, 'sideways_adx_thresh': 11.068851882305466, 'sideways_atr_min_pct': 0.024539080339662296, 'sideways_atr_max_pct': 0.03698041800187706, 'sideways_tp_mult': 2.524129771603807, 'sideways_tsl_mult': 0.43162104704812226, 'sideways_time_stop': 129, 'sideways_use_sma': True, 'sideways_use_ema': False, 'sideways_use_atr': True, 'sideways_use_adx': True, 'sideways_use_spike': False, 'sideways_rsi_required': False}.
[I 2025-09-01 14:44:11,085] Trial 528 finished with values: [-1000000000.0, 1000000000.0] and parameters: {'p_sma': 35, 'p_std': 30, 'p_atr': 26, 'p_adx': 17, 'rsi_period': 81, 'ema1': 10, 'ema2': 53, 'slip_atr_k': 0.17907877496756788, 'slip_spread_k': 0.8570923091440978, 'spread_hl_frac': 0.034577574067547065, 'bb_std_mult': 1.4801466548757398, 'rsi_os': 32, 'rsi_ob': 87, 'vol_spike': 0.03694653472082468, 'adx_thresh': 6.117180041010432, 'atr_min_pct': 0.011358204994297997, 'atr_max_pct': 0.02951700439111213, 'tp_mult': 1.334255958985746, 'tsl_mult': 0.6689269587027344, 'strategy': 'mean_reversion', 'time_stop': 194, 'use_sma': True, 'use_atr': True, 'use_adx': True, 'use_ema': True, 'use_spike': False, 'rsi_required': True, 'edge_k': 0.20092139896763767, 'edge_cap': 0.9488757262954588, 'bull_strategy': 'mean_reversion', 'bull_bb_std_mult': 0.8040790602443859, 'bull_rsi_os': 29, 'bull_rsi_ob': 76, 'bull_adx_thresh': 23.408498480098547, 'bull_atr_min_pct': 0.0034124805675099946, 'bull_atr_max_pct': 0.1380673171992675, 'bull_tp_mult': 2.4605868046563413, 'bull_tsl_mult': 0.5319918232522405, 'bull_time_stop': 167, 'bull_use_sma': True, 'bull_use_ema': True, 'bull_use_atr': False, 'bull_use_adx': True, 'bull_use_spike': False, 'bull_rsi_required': True, 'bear_strategy': 'mean_reversion', 'bear_bb_std_mult': 3.4273599343547203, 'bear_rsi_os': 34, 'bear_rsi_ob': 73, 'bear_adx_thresh': 6.323026529570264, 'bear_atr_min_pct': 0.017950244572866533, 'bear_atr_max_pct': 0.11054276553956187, 'bear_tp_mult': 1.128377109665426, 'bear_tsl_mult': 0.13725216774680482, 'bear_time_stop': 104, 'bear_use_sma': False, 'bear_use_ema': True, 'bear_use_atr': False, 'bear_use_adx': True, 'bear_use_spike': True, 'bear_rsi_required': True, 'sideways_strategy': 'breakout', 'sideways_bb_std_mult': 3.0252802526616716, 'sideways_rsi_os': 32, 'sideways_rsi_ob': 81, 'sideways_adx_thresh': 17.020835532408352, 'sideways_atr_min_pct': 0.02497116279878222, 'sideways_atr_max_pct': 0.11243859443355449, 'sideways_tp_mult': 2.542630902874906, 'sideways_tsl_mult': 0.4326206754960543, 'sideways_time_stop': 271, 'sideways_use_sma': False, 'sideways_use_ema': False, 'sideways_use_atr': True, 'sideways_use_adx': True, 'sideways_use_spike': False, 'sideways_rsi_required': False}.
[I 2025-09-01 14:44:11,952] Trial 529 finished with values: [-1000000000.0, 1000000000.0] and parameters: {'p_sma': 35, 'p_std': 28, 'p_atr': 26, 'p_adx': 21, 'rsi_period': 83, 'ema1': 10, 'ema2': 58, 'slip_atr_k': 0.21823676984950263, 'slip_spread_k': 0.5697647092578542, 'spread_hl_frac': 0.009577988284788248, 'bb_std_mult': 3.5394369443235694, 'rsi_os': 19, 'rsi_ob': 52, 'vol_spike': 0.1290981485390442, 'adx_thresh': 6.317842667650387, 'atr_min_pct': 0.02852300230641578, 'atr_max_pct': 0.024085831302522225, 'tp_mult': 2.857758154310222, 'tsl_mult': 0.18479857649454928, 'strategy': 'mean_reversion', 'time_stop': 101, 'use_sma': False, 'use_atr': True, 'use_adx': True, 'use_ema': True, 'use_spike': False, 'rsi_required': False, 'edge_k': 0.3523793272971945, 'edge_cap': 0.9473299281688717, 'bull_strategy': 'breakout', 'bull_bb_std_mult': 3.0629974514001312, 'bull_rsi_os': 13, 'bull_rsi_ob': 82, 'bull_adx_thresh': 12.424981508647504, 'bull_atr_min_pct': 0.01247395453220857, 'bull_atr_max_pct': 0.11239377136764563, 'bull_tp_mult': 2.2016370803673446, 'bull_tsl_mult': 0.533781299416717, 'bull_time_stop': 181, 'bull_use_sma': False, 'bull_use_ema': True, 'bull_use_atr': False, 'bull_use_adx': True, 'bull_use_spike': False, 'bull_rsi_required': True, 'bear_strategy': 'mean_reversion', 'bear_bb_std_mult': 2.0534300500723317, 'bear_rsi_os': 42, 'bear_rsi_ob': 55, 'bear_adx_thresh': 15.538000244216732, 'bear_atr_min_pct': 0.02403459144535526, 'bear_atr_max_pct': 0.14258842951266548, 'bear_tp_mult': 1.9736686285232745, 'bear_tsl_mult': 0.15874092742317336, 'bear_time_stop': 210, 'bear_use_sma': False, 'bear_use_ema': True, 'bear_use_atr': False, 'bear_use_adx': True, 'bear_use_spike': True, 'bear_rsi_required': False, 'sideways_strategy': 'breakout', 'sideways_bb_std_mult': 3.0299164090364954, 'sideways_rsi_os': 32, 'sideways_rsi_ob': 89, 'sideways_adx_thresh': 26.69502148448628, 'sideways_atr_min_pct': 0.01735161894749699, 'sideways_atr_max_pct': 0.11191679951876836, 'sideways_tp_mult': 2.5127800838817462, 'sideways_tsl_mult': 0.43246292352459176, 'sideways_time_stop': 112, 'sideways_use_sma': False, 'sideways_use_ema': True, 'sideways_use_atr': True, 'sideways_use_adx': True, 'sideways_use_spike': False, 'sideways_rsi_required': False}.
[I 2025-09-01 14:44:48,105] Trial 531 finished with values: [-1000000000.0, 1000000000.0] and parameters: {'p_sma': 45, 'p_std': 24, 'p_atr': 26, 'p_adx': 10, 'rsi_period': 77, 'ema1': 21, 'ema2': 60, 'slip_atr_k': 0.0177950744630391, 'slip_spread_k': 0.5625221852694463, 'spread_hl_frac': 0.007352278655537731, 'bb_std_mult': 3.4178611976584325, 'rsi_os': 17, 'rsi_ob': 89, 'vol_spike': 0.09803280839040779, 'adx_thresh': 19.303320904639598, 'atr_min_pct': 0.022569472372668747, 'atr_max_pct': 0.10092683260358323, 'tp_mult': 1.3748921261348033, 'tsl_mult': 0.7385840829897281, 'strategy': 'mean_reversion', 'time_stop': 98, 'use_sma': False, 'use_atr': True, 'use_adx': True, 'use_ema': False, 'use_spike': False, 'rsi_required': False, 'edge_k': 1.6315417793802405, 'edge_cap': 0.7612416228678247, 'bull_strategy': 'breakout', 'bull_bb_std_mult': 2.8186649680646143, 'bull_rsi_os': 12, 'bull_rsi_ob': 77, 'bull_adx_thresh': 22.894132332988878, 'bull_atr_min_pct': 0.011387273778693653, 'bull_atr_max_pct': 0.14979867995026055, 'bull_tp_mult': 1.752542854924476, 'bull_tsl_mult': 0.01923098958795777, 'bull_time_stop': 178, 'bull_use_sma': False, 'bull_use_ema': False, 'bull_use_atr': False, 'bull_use_adx': True, 'bull_use_spike': True, 'bull_rsi_required': False, 'bear_strategy': 'mean_reversion', 'bear_bb_std_mult': 2.036599271188225, 'bear_rsi_os': 7, 'bear_rsi_ob': 49, 'bear_adx_thresh': 11.38398675389273, 'bear_atr_min_pct': 0.0026772558411785998, 'bear_atr_max_pct': 0.14313750179348234, 'bear_tp_mult': 1.9716189920762892, 'bear_tsl_mult': 0.5060114308649822, 'bear_time_stop': 280, 'bear_use_sma': False, 'bear_use_ema': False, 'bear_use_atr': False, 'bear_use_adx': True, 'bear_use_spike': True, 'bear_rsi_required': False, 'sideways_strategy': 'breakout', 'sideways_bb_std_mult': 0.5037102305877759, 'sideways_rsi_os': 28, 'sideways_rsi_ob': 55, 'sideways_adx_thresh': 16.975999294424554, 'sideways_atr_min_pct': 0.0179341054945359, 'sideways_atr_max_pct': 0.1182199272836453, 'sideways_tp_mult': 1.4914655587214787, 'sideways_tsl_mult': 0.40357334738666095, 'sideways_time_stop': 256, 'sideways_use_sma': False, 'sideways_use_ema': True, 'sideways_use_atr': True, 'sideways_use_adx': True, 'sideways_use_spike': True, 'sideways_rsi_required': False}.
