[I 2025-09-01 13:46:52,417] Trial 129 finished with values: [-0.05089201124055853, 0.05081525423078662] and parameters: {'p_sma': 38, 'p_std': 23, 'p_atr': 7, 'p_adx': 25, 'rsi_period': 63, 'ema1': 22, 'ema2': 20, 'slip_atr_k': 0.09020570190083453, 'slip_spread_k': 0.4760464143955259, 'spread_hl_frac': 0.034143121689864324, 'bb_std_mult': 3.339737944812332, 'rsi_os': 33, 'rsi_ob': 61, 'vol_spike': 0.1553496912620915, 'adx_thresh': 24.133130479714648, 'atr_min_pct': 0.01993998518314543, 'atr_max_pct': 0.0246508883195238, 'tp_mult': 1.5379438550662574, 'tsl_mult': 0.3885254943072759, 'strategy': 'breakout', 'time_stop': 89, 'use_sma': True, 'use_atr': True, 'use_adx': False, 'use_ema': False, 'use_spike': True, 'rsi_required': False, 'edge_k': 1.853203468556595, 'edge_cap': 0.07779805558311681, 'bull_strategy': 'breakout', 'bull_bb_std_mult': 1.3984241857351274, 'bull_rsi_os': 16, 'bull_rsi_ob': 53, 'bull_adx_thresh': 13.732634854886204, 'bull_atr_min_pct': 0.001316981328155404, 'bull_atr_max_pct': 0.11963811501228308, 'bull_tp_mult': 1.3952868731015418, 'bull_tsl_mult': 0.19280397231130442, 'bull_time_stop': 96, 'bull_use_sma': False, 'bull_use_ema': True, 'bull_use_atr': False, 'bull_use_adx': True, 'bull_use_spike': False, 'bull_rsi_required': False, 'bear_strategy': 'mean_reversion', 'bear_bb_std_mult': 2.997009924668514, 'bear_rsi_os': 52, 'bear_rsi_ob': 54, 'bear_adx_thresh': 31.89390601358479, 'bear_atr_min_pct': 0.01649627727674537, 'bear_atr_max_pct': 0.14658559035112484, 'bear_tp_mult': 1.3377812200838846, 'bear_tsl_mult': 0.18319454534321084, 'bear_time_stop': 234, 'bear_use_sma': False, 'bear_use_ema': True, 'bear_use_atr': False, 'bear_use_adx': False, 'bear_use_spike': False, 'bear_rsi_required': True, 'sideways_strategy': 'breakout', 'sideways_bb_std_mult': 2.3227047298167003, 'sideways_rsi_os': 26, 'sideways_rsi_ob': 66, 'sideways_adx_thresh': 27.191659295287877, 'sideways_atr_min_pct': 0.021560092491667487, 'sideways_atr_max_pct': 0.13554467948601776, 'sideways_tp_mult': 1.7393220638504172, 'sideways_tsl_mult': 0.6896370266536797, 'sideways_time_stop': 236, 'sideways_use_sma': True, 'sideways_use_ema': False, 'sideways_use_atr': True, 'sideways_use_adx': True, 'sideways_use_spike': False, 'sideways_rsi_required': False}.
[I 2025-09-01 13:46:53,190] Trial 128 finished with values: [-0.025447854203121456, 0.02601039365792549] and parameters: {'p_sma': 10, 'p_std': 23, 'p_atr': 8, 'p_adx': 27, 'rsi_period': 47, 'ema1': 10, 'ema2': 20, 'slip_atr_k': 0.09068573847872007, 'slip_spread_k': 0.8891211890070057, 'spread_hl_frac': 0.03407713309498681, 'bb_std_mult': 1.9257003581242385, 'rsi_os': 37, 'rsi_ob': 62, 'vol_spike': 0.07175036323554967, 'adx_thresh': 11.147322895969227, 'atr_min_pct': 0.016272638137722787, 'atr_max_pct': 0.0911438221677479, 'tp_mult': 1.5312526397688235, 'tsl_mult': 0.54116960071583, 'strategy': 'breakout', 'time_stop': 87, 'use_sma': True, 'use_atr': False, 'use_adx': False, 'use_ema': False, 'use_spike': True, 'rsi_required': False, 'edge_k': 1.2818789440509342, 'edge_cap': 0.05227358489008943, 'bull_strategy': 'breakout', 'bull_bb_std_mult': 1.618541150395746, 'bull_rsi_os': 16, 'bull_rsi_ob': 53, 'bull_adx_thresh': 13.66749782625915, 'bull_atr_min_pct': 0.0010017746598528013, 'bull_atr_max_pct': 0.07841520762224238, 'bull_tp_mult': 1.4154376724350881, 'bull_tsl_mult': 0.5341979862654478, 'bull_time_stop': 285, 'bull_use_sma': False, 'bull_use_ema': True, 'bull_use_atr': False, 'bull_use_adx': True, 'bull_use_spike': False, 'bull_rsi_required': False, 'bear_strategy': 'mean_reversion', 'bear_bb_std_mult': 2.094796020281953, 'bear_rsi_os': 51, 'bear_rsi_ob': 56, 'bear_adx_thresh': 31.873402548559607, 'bear_atr_min_pct': 0.016173651684543083, 'bear_atr_max_pct': 0.11339888859845952, 'bear_tp_mult': 1.88078874062498, 'bear_tsl_mult': 0.16729619936850018, 'bear_time_stop': 235, 'bear_use_sma': False, 'bear_use_ema': True, 'bear_use_atr': False, 'bear_use_adx': False, 'bear_use_spike': False, 'bear_rsi_required': True, 'sideways_strategy': 'breakout', 'sideways_bb_std_mult': 0.6707382456667715, 'sideways_rsi_os': 26, 'sideways_rsi_ob': 51, 'sideways_adx_thresh': 5.854525436231432, 'sideways_atr_min_pct': 0.021746984302186835, 'sideways_atr_max_pct': 0.03933779212493504, 'sideways_tp_mult': 1.6771057321735157, 'sideways_tsl_mult': 0.33941173614075787, 'sideways_time_stop': 264, 'sideways_use_sma': True, 'sideways_use_ema': False, 'sideways_use_atr': True, 'sideways_use_adx': True, 'sideways_use_spike': False, 'sideways_rsi_required': False}.
[I 2025-09-01 13:46:53,682] Trial 126 finished with values: [-0.03314345487274517, 0.033055378036672106] and parameters: {'p_sma': 27, 'p_std': 47, 'p_atr': 8, 'p_adx': 27, 'rsi_period': 47, 'ema1': 10, 'ema2': 21, 'slip_atr_k': 0.12150002998527791, 'slip_spread_k': 0.5769583077625484, 'spread_hl_frac': 0.034239600716403557, 'bb_std_mult': 3.3271616381169897, 'rsi_os': 41, 'rsi_ob': 74, 'vol_spike': 0.25297134456151105, 'adx_thresh': 25.03738873188716, 'atr_min_pct': 0.006248949963937905, 'atr_max_pct': 0.022870049998980173, 'tp_mult': 1.8249851027380544, 'tsl_mult': 0.19276534748867696, 'strategy': 'breakout', 'time_stop': 72, 'use_sma': True, 'use_atr': True, 'use_adx': False, 'use_ema': False, 'use_spike': True, 'rsi_required': False, 'edge_k': 1.4182050056204991, 'edge_cap': 0.6176687393303842, 'bull_strategy': 'breakout', 'bull_bb_std_mult': 1.6272066929062177, 'bull_rsi_os': 16, 'bull_rsi_ob': 53, 'bull_adx_thresh': 6.791945135522756, 'bull_atr_min_pct': 0.0012421568231410444, 'bull_atr_max_pct': 0.08051774648557135, 'bull_tp_mult': 1.4210890489776846, 'bull_tsl_mult': 0.5693549433109554, 'bull_time_stop': 94, 'bull_use_sma': False, 'bull_use_ema': True, 'bull_use_atr': True, 'bull_use_adx': True, 'bull_use_spike': False, 'bull_rsi_required': True, 'bear_strategy': 'breakout', 'bear_bb_std_mult': 0.8701761585932375, 'bear_rsi_os': 15, 'bear_rsi_ob': 54, 'bear_adx_thresh': 31.60914397575663, 'bear_atr_min_pct': 0.01586071317176993, 'bear_atr_max_pct': 0.0963710136537803, 'bear_tp_mult': 1.9061609569426494, 'bear_tsl_mult': 0.35163250517876576, 'bear_time_stop': 50, 'bear_use_sma': False, 'bear_use_ema': True, 'bear_use_atr': False, 'bear_use_adx': True, 'bear_use_spike': False, 'bear_rsi_required': True, 'sideways_strategy': 'breakout', 'sideways_bb_std_mult': 1.5166985157498396, 'sideways_rsi_os': 33, 'sideways_rsi_ob': 62, 'sideways_adx_thresh': 30.9093793084755, 'sideways_atr_min_pct': 0.021480438757896257, 'sideways_atr_max_pct': 0.13105797670117034, 'sideways_tp_mult': 2.5195446228417966, 'sideways_tsl_mult': 0.3396061125941382, 'sideways_time_stop': 265, 'sideways_use_sma': True, 'sideways_use_ema': False, 'sideways_use_atr': True, 'sideways_use_adx': False, 'sideways_use_spike': True, 'sideways_rsi_required': False}.
[I 2025-09-01 13:46:54,046] Trial 127 finished with values: [-0.05958747388020125, 0.05966376084665936] and parameters: {'p_sma': 38, 'p_std': 48, 'p_atr': 7, 'p_adx': 27, 'rsi_period': 41, 'ema1': 10, 'ema2': 25, 'slip_atr_k': 0.01201412259164857, 'slip_spread_k': 0.9063601295801366, 'spread_hl_frac': 0.03411837733824005, 'bb_std_mult': 1.7994134202785041, 'rsi_os': 33, 'rsi_ob': 74, 'vol_spike': 0.03275305966093994, 'adx_thresh': 9.430997546407273, 'atr_min_pct': 0.016650666888182706, 'atr_max_pct': 0.08781959579172502, 'tp_mult': 2.4697251846108443, 'tsl_mult': 0.40810882017411276, 'strategy': 'breakout', 'time_stop': 89, 'use_sma': True, 'use_atr': True, 'use_adx': False, 'use_ema': False, 'use_spike': True, 'rsi_required': False, 'edge_k': 1.886880961646081, 'edge_cap': 0.1925115935173905, 'bull_strategy': 'breakout', 'bull_bb_std_mult': 1.6232990620924623, 'bull_rsi_os': 16, 'bull_rsi_ob': 50, 'bull_adx_thresh': 16.014980292459907, 'bull_atr_min_pct': 0.005952648823557609, 'bull_atr_max_pct': 0.11195309626335562, 'bull_tp_mult': 1.4147110194186465, 'bull_tsl_mult': 0.4512263217716618, 'bull_time_stop': 95, 'bull_use_sma': False, 'bull_use_ema': True, 'bull_use_atr': True, 'bull_use_adx': True, 'bull_use_spike': False, 'bull_rsi_required': True, 'bear_strategy': 'breakout', 'bear_bb_std_mult': 3.2037329698362047, 'bear_rsi_os': 15, 'bear_rsi_ob': 54, 'bear_adx_thresh': 31.45254110563828, 'bear_atr_min_pct': 0.0069268754360826065, 'bear_atr_max_pct': 0.14700854345551814, 'bear_tp_mult': 1.8952197264595543, 'bear_tsl_mult': 0.16602843869840914, 'bear_time_stop': 204, 'bear_use_sma': False, 'bear_use_ema': True, 'bear_use_atr': False, 'bear_use_adx': True, 'bear_use_spike': False, 'bear_rsi_required': True, 'sideways_strategy': 'breakout', 'sideways_bb_std_mult': 2.1414822929058683, 'sideways_rsi_os': 33, 'sideways_rsi_ob': 62, 'sideways_adx_thresh': 27.254236974994605, 'sideways_atr_min_pct': 0.0007872080176691502, 'sideways_atr_max_pct': 0.13553166098231204, 'sideways_tp_mult': 2.523238650323705, 'sideways_tsl_mult': 0.6946531429823672, 'sideways_time_stop': 265, 'sideways_use_sma': False, 'sideways_use_ema': True, 'sideways_use_atr': True, 'sideways_use_adx': False, 'sideways_use_spike': False, 'sideways_rsi_required': False}.
[I 2025-09-01 13:46:54,414] Trial 132 finished with values: [-1000000000.0, 1000000000.0] and parameters: {'p_sma': 10, 'p_std': 34, 'p_atr': 7, 'p_adx': 19, 'rsi_period': 39, 'ema1': 6, 'ema2': 23, 'slip_atr_k': 0.10469526325020584, 'slip_spread_k': 0.5050860859534756, 'spread_hl_frac': 0.028176179032726997, 'bb_std_mult': 1.7906034804134567, 'rsi_os': 44, 'rsi_ob': 62, 'vol_spike': 0.04274173102161838, 'adx_thresh': 19.828593830213666, 'atr_min_pct': 0.02566442888383537, 'atr_max_pct': 0.013857353267377203, 'tp_mult': 1.9671393022469679, 'tsl_mult': 0.4065987296472231, 'strategy': 'breakout', 'time_stop': 109, 'use_sma': True, 'use_atr': False, 'use_adx': False, 'use_ema': False, 'use_spike': True, 'rsi_required': False, 'edge_k': 1.2825254390006944, 'edge_cap': 0.18478954954757576, 'bull_strategy': 'mean_reversion', 'bull_bb_std_mult': 1.32485575592962, 'bull_rsi_os': 21, 'bull_rsi_ob': 51, 'bull_adx_thresh': 12.23004200376791, 'bull_atr_min_pct': 0.021068387913459274, 'bull_atr_max_pct': 0.06631761108930626, 'bull_tp_mult': 1.3002790502179347, 'bull_tsl_mult': 0.85414239285084, 'bull_time_stop': 254, 'bull_use_sma': False, 'bull_use_ema': False, 'bull_use_atr': False, 'bull_use_adx': True, 'bull_use_spike': False, 'bull_rsi_required': False, 'bear_strategy': 'mean_reversion', 'bear_bb_std_mult': 1.013588445049278, 'bear_rsi_os': 12, 'bear_rsi_ob': 70, 'bear_adx_thresh': 23.531146247437327, 'bear_atr_min_pct': 0.019485662859716927, 'bear_atr_max_pct': 0.06537733650205593, 'bear_tp_mult': 2.8123815557055094, 'bear_tsl_mult': 0.15704416973356902, 'bear_time_stop': 65, 'bear_use_sma': False, 'bear_use_ema': True, 'bear_use_atr': True, 'bear_use_adx': False, 'bear_use_spike': False, 'bear_rsi_required': True, 'sideways_strategy': 'breakout', 'sideways_bb_std_mult': 2.254392909115155, 'sideways_rsi_os': 31, 'sideways_rsi_ob': 88, 'sideways_adx_thresh': 31.655024055193834, 'sideways_atr_min_pct': 0.009111332393965083, 'sideways_atr_max_pct': 0.06561455831759505, 'sideways_tp_mult': 2.7758783347340508, 'sideways_tsl_mult': 0.29620556054874414, 'sideways_time_stop': 46, 'sideways_use_sma': False, 'sideways_use_ema': True, 'sideways_use_atr': False, 'sideways_use_adx': True, 'sideways_use_spike': False, 'sideways_rsi_required': True}.
[I 2025-09-01 13:46:54,431] Trial 130 finished with values: [-1000000000.0, 1000000000.0] and parameters: {'p_sma': 10, 'p_std': 34, 'p_atr': 7, 'p_adx': 27, 'rsi_period': 46, 'ema1': 6, 'ema2': 23, 'slip_atr_k': 0.2008547342372816, 'slip_spread_k': 0.5748469483023156, 'spread_hl_frac': 0.007507904982086442, 'bb_std_mult': 1.8009061584212582, 'rsi_os': 23, 'rsi_ob': 56, 'vol_spike': 0.06293191425676356, 'adx_thresh': 19.67968784168071, 'atr_min_pct': 0.02559509996975771, 'atr_max_pct': 0.02314341608778403, 'tp_mult': 2.4375735778424126, 'tsl_mult': 0.11382060770868574, 'strategy': 'breakout', 'time_stop': 109, 'use_sma': True, 'use_atr': True, 'use_adx': False, 'use_ema': False, 'use_spike': True, 'rsi_required': False, 'edge_k': 1.2863549382479054, 'edge_cap': 0.18534063720620939, 'bull_strategy': 'breakout', 'bull_bb_std_mult': 1.103514175727695, 'bull_rsi_os': 13, 'bull_rsi_ob': 74, 'bull_adx_thresh': 6.726430767030262, 'bull_atr_min_pct': 0.0017440188781892418, 'bull_atr_max_pct': 0.09311443433332639, 'bull_tp_mult': 1.2675905310059141, 'bull_tsl_mult': 0.08201483339851612, 'bull_time_stop': 91, 'bull_use_sma': False, 'bull_use_ema': True, 'bull_use_atr': True, 'bull_use_adx': True, 'bull_use_spike': False, 'bull_rsi_required': False, 'bear_strategy': 'breakout', 'bear_bb_std_mult': 2.6551976000146986, 'bear_rsi_os': 43, 'bear_rsi_ob': 56, 'bear_adx_thresh': 34.83807012518341, 'bear_atr_min_pct': 0.017608300701594887, 'bear_atr_max_pct': 0.07077418044926782, 'bear_tp_mult': 2.822673139726429, 'bear_tsl_mult': 0.6651313226388692, 'bear_time_stop': 49, 'bear_use_sma': False, 'bear_use_ema': True, 'bear_use_atr': True, 'bear_use_adx': True, 'bear_use_spike': False, 'bear_rsi_required': True, 'sideways_strategy': 'breakout', 'sideways_bb_std_mult': 2.247703487953429, 'sideways_rsi_os': 29, 'sideways_rsi_ob': 88, 'sideways_adx_thresh': 30.90313032101559, 'sideways_atr_min_pct': 0.020092077264111476, 'sideways_atr_max_pct': 0.11207577078554469, 'sideways_tp_mult': 2.563651158541369, 'sideways_tsl_mult': 0.3319935093178541, 'sideways_time_stop': 263, 'sideways_use_sma': False, 'sideways_use_ema': True, 'sideways_use_atr': True, 'sideways_use_adx': False, 'sideways_use_spike': False, 'sideways_rsi_required': False}.
[I 2025-09-01 13:47:29,910] Trial 131 finished with values: [-1000000000.0, 1000000000.0] and parameters: {'p_sma': 27, 'p_std': 32, 'p_atr': 7, 'p_adx': 27, 'rsi_period': 47, 'ema1': 6, 'ema2': 25, 'slip_atr_k': 0.20270962096932493, 'slip_spread_k': 0.8828246442305667, 'spread_hl_frac': 0.04295962123110475, 'bb_std_mult': 1.9419442218100809, 'rsi_os': 44, 'rsi_ob': 48, 'vol_spike': 0.030411869315829718, 'adx_thresh': 19.732906668711678, 'atr_min_pct': 0.025605893550379455, 'atr_max_pct': 0.08408450949207301, 'tp_mult': 1.4950228803319157, 'tsl_mult': 0.1653734219584569, 'strategy': 'breakout', 'time_stop': 108, 'use_sma': True, 'use_atr': True, 'use_adx': False, 'use_ema': False, 'use_spike': True, 'rsi_required': False, 'edge_k': 1.2825040549151427, 'edge_cap': 0.18900616640506462, 'bull_strategy': 'breakout', 'bull_bb_std_mult': 1.2423026399589476, 'bull_rsi_os': 15, 'bull_rsi_ob': 83, 'bull_adx_thresh': 11.896027483319097, 'bull_atr_min_pct': 0.007883300492710613, 'bull_atr_max_pct': 0.09330047840737199, 'bull_tp_mult': 1.2801061088487997, 'bull_tsl_mult': 0.8872669519686635, 'bull_time_stop': 284, 'bull_use_sma': False, 'bull_use_ema': False, 'bull_use_atr': True, 'bull_use_adx': True, 'bull_use_spike': False, 'bull_rsi_required': False, 'bear_strategy': 'breakout', 'bear_bb_std_mult': 3.079893807392665, 'bear_rsi_os': 12, 'bear_rsi_ob': 70, 'bear_adx_thresh': 25.74889101866442, 'bear_atr_min_pct': 0.019678943406573172, 'bear_atr_max_pct': 0.06634205463210399, 'bear_tp_mult': 2.8216963514359383, 'bear_tsl_mult': 0.1660753516713001, 'bear_time_stop': 203, 'bear_use_sma': False, 'bear_use_ema': True, 'bear_use_atr': True, 'bear_use_adx': True, 'bear_use_spike': False, 'bear_rsi_required': True, 'sideways_strategy': 'breakout', 'sideways_bb_std_mult': 2.1185282760011432, 'sideways_rsi_os': 29, 'sideways_rsi_ob': 88, 'sideways_adx_thresh': 30.78170154704707, 'sideways_atr_min_pct': 0.011100196554381447, 'sideways_atr_max_pct': 0.06778389926703483, 'sideways_tp_mult': 2.561519416670718, 'sideways_tsl_mult': 0.6253595645198073, 'sideways_time_stop': 264, 'sideways_use_sma': False, 'sideways_use_ema': False, 'sideways_use_atr': False, 'sideways_use_adx': False, 'sideways_use_spike': False, 'sideways_rsi_required': True}.
[I 2025-09-01 13:47:30,364] Trial 133 finished with values: [-1000000000.0, 1000000000.0] and parameters: {'p_sma': 11, 'p_std': 34, 'p_atr': 8, 'p_adx': 19, 'rsi_period': 22, 'ema1': 6, 'ema2': 32, 'slip_atr_k': 0.20287513455720274, 'slip_spread_k': 0.5188230242348619, 'spread_hl_frac': 0.02880136686995873, 'bb_std_mult': 1.9169220325601712, 'rsi_os': 44, 'rsi_ob': 56, 'vol_spike': 0.05897298235112732, 'adx_thresh': 10.706473494511362, 'atr_min_pct': 0.016199675344728534, 'atr_max_pct': 0.09464471697333818, 'tp_mult': 1.9619803970109886, 'tsl_mult': 0.5497390327372685, 'strategy': 'mean_reversion', 'time_stop': 111, 'use_sma': False, 'use_atr': False, 'use_adx': False, 'use_ema': True, 'use_spike': True, 'rsi_required': False, 'edge_k': 1.2937106930883733, 'edge_cap': 0.9227692485955774, 'bull_strategy': 'mean_reversion', 'bull_bb_std_mult': 1.2526051983232123, 'bull_rsi_os': 14, 'bull_rsi_ob': 74, 'bull_adx_thresh': 9.674336970364871, 'bull_atr_min_pct': 0.029102426729094095, 'bull_atr_max_pct': 0.11662846584318251, 'bull_tp_mult': 1.2795112508306812, 'bull_tsl_mult': 0.8774142343699768, 'bull_time_stop': 176, 'bull_use_sma': False, 'bull_use_ema': False, 'bull_use_atr': False, 'bull_use_adx': True, 'bull_use_spike': True, 'bull_rsi_required': False, 'bear_strategy': 'mean_reversion', 'bear_bb_std_mult': 1.044439648305117, 'bear_rsi_os': 11, 'bear_rsi_ob': 70, 'bear_adx_thresh': 24.039685612375916, 'bear_atr_min_pct': 0.0198784733499147, 'bear_atr_max_pct': 0.06431604605242185, 'bear_tp_mult': 1.4137934662043028, 'bear_tsl_mult': 0.1569626576228669, 'bear_time_stop': 68, 'bear_use_sma': False, 'bear_use_ema': True, 'bear_use_atr': True, 'bear_use_adx': False, 'bear_use_spike': True, 'bear_rsi_required': True, 'sideways_strategy': 'breakout', 'sideways_bb_std_mult': 1.7762058334701607, 'sideways_rsi_os': 29, 'sideways_rsi_ob': 50, 'sideways_adx_thresh': 28.455056169563647, 'sideways_atr_min_pct': 0.013754263277038218, 'sideways_atr_max_pct': 0.12391249858989, 'sideways_tp_mult': 2.988925433448397, 'sideways_tsl_mult': 0.9969461664462852, 'sideways_time_stop': 55, 'sideways_use_sma': False, 'sideways_use_ema': True, 'sideways_use_atr': False, 'sideways_use_adx': True, 'sideways_use_spike': False, 'sideways_rsi_required': True}.
[I 2025-09-01 13:47:31,839] Trial 134 finished with values: [-1000000000.0, 1000000000.0] and parameters: {'p_sma': 14, 'p_std': 26, 'p_atr': 8, 'p_adx': 22, 'rsi_period': 44, 'ema1': 23, 'ema2': 33, 'slip_atr_k': 0.21247741967268044, 'slip_spread_k': 0.789082268418176, 'spread_hl_frac': 0.007484947317305786, 'bb_std_mult': 1.8859851141699293, 'rsi_os': 46, 'rsi_ob': 56, 'vol_spike': 0.27912104773825724, 'adx_thresh': 5.850715705393128, 'atr_min_pct': 0.014907902281890161, 'atr_max_pct': 0.04780128561951082, 'tp_mult': 2.0628487565675133, 'tsl_mult': 0.10726655019130149, 'strategy': 'breakout', 'time_stop': 79, 'use_sma': True, 'use_atr': True, 'use_adx': False, 'use_ema': False, 'use_spike': False, 'rsi_required': False, 'edge_k': 1.205314654520222, 'edge_cap': 0.40638628417193723, 'bull_strategy': 'breakout', 'bull_bb_std_mult': 1.2447706180996163, 'bull_rsi_os': 54, 'bull_rsi_ob': 83, 'bull_adx_thresh': 9.630495592706664, 'bull_atr_min_pct': 0.012792283464900118, 'bull_atr_max_pct': 0.09277468394829884, 'bull_tp_mult': 1.4800519466819542, 'bull_tsl_mult': 0.9452170503830183, 'bull_time_stop': 287, 'bull_use_sma': False, 'bull_use_ema': True, 'bull_use_atr': False, 'bull_use_adx': False, 'bull_use_spike': False, 'bull_rsi_required': False, 'bear_strategy': 'breakout', 'bear_bb_std_mult': 2.1685266063970636, 'bear_rsi_os': 11, 'bear_rsi_ob': 56, 'bear_adx_thresh': 34.08108397294674, 'bear_atr_min_pct': 0.017655710230463653, 'bear_atr_max_pct': 0.11295162594598898, 'bear_tp_mult': 1.439452776332767, 'bear_tsl_mult': 0.6500109708910565, 'bear_time_stop': 277, 'bear_use_sma': True, 'bear_use_ema': True, 'bear_use_atr': False, 'bear_use_adx': True, 'bear_use_spike': True, 'bear_rsi_required': False, 'sideways_strategy': 'breakout', 'sideways_bb_std_mult': 0.9751123506207229, 'sideways_rsi_os': 21, 'sideways_rsi_ob': 50, 'sideways_adx_thresh': 28.33673922151108, 'sideways_atr_min_pct': 0.01681257412448444, 'sideways_atr_max_pct': 0.023390447225685534, 'sideways_tp_mult': 2.695332634943465, 'sideways_tsl_mult': 0.7521016805620303, 'sideways_time_stop': 241, 'sideways_use_sma': False, 'sideways_use_ema': True, 'sideways_use_atr': True, 'sideways_use_adx': False, 'sideways_use_spike': False, 'sideways_rsi_required': False}.
