[I 2025-09-01 14:01:15,553] Trial 234 finished with values: [-0.0030548600072177745, 0.010543337933455962] and parameters: {'p_sma': 11, 'p_std': 16, 'p_atr': 25, 'p_adx': 9, 'rsi_period': 27, 'ema1': 8, 'ema2': 28, 'slip_atr_k': 0.05504863045212345, 'slip_spread_k': 0.11917417743923525, 'spread_hl_frac': 0.017651026573395165, 'bb_std_mult': 1.901864649855003, 'rsi_os': 46, 'rsi_ob': 76, 'vol_spike': 0.12396590978356403, 'adx_thresh': 14.27725242419968, 'atr_min_pct': 0.0009912790639583849, 'atr_max_pct': 0.04045137182014627, 'tp_mult': 1.9752242582366633, 'tsl_mult': 0.10282354452084291, 'strategy': 'mean_reversion', 'time_stop': 199, 'use_sma': True, 'use_atr': True, 'use_adx': True, 'use_ema': False, 'use_spike': False, 'rsi_required': False, 'edge_k': 1.2403646291389636, 'edge_cap': 0.7482836894062175, 'bull_strategy': 'breakout', 'bull_bb_std_mult': 1.8093494290998182, 'bull_rsi_os': 22, 'bull_rsi_ob': 95, 'bull_adx_thresh': 11.33176901989886, 'bull_atr_min_pct': 0.010642337707056549, 'bull_atr_max_pct': 0.13219960118970656, 'bull_tp_mult': 1.4944407178009116, 'bull_tsl_mult': 0.6032215010161439, 'bull_time_stop': 97, 'bull_use_sma': False, 'bull_use_ema': True, 'bull_use_atr': False, 'bull_use_adx': False, 'bull_use_spike': True, 'bull_rsi_required': False, 'bear_strategy': 'mean_reversion', 'bear_bb_std_mult': 2.1065924900448763, 'bear_rsi_os': 44, 'bear_rsi_ob': 67, 'bear_adx_thresh': 5.190661271805285, 'bear_atr_min_pct': 0.004210205286828854, 'bear_atr_max_pct': 0.07425716491714218, 'bear_tp_mult': 1.9508426890358208, 'bear_tsl_mult': 0.14962070152641133, 'bear_time_stop': 60, 'bear_use_sma': False, 'bear_use_ema': False, 'bear_use_atr': False, 'bear_use_adx': True, 'bear_use_spike': True, 'bear_rsi_required': False, 'sideways_strategy': 'breakout', 'sideways_bb_std_mult': 0.8117490124292115, 'sideways_rsi_os': 51, 'sideways_rsi_ob': 63, 'sideways_adx_thresh': 8.062670234262924, 'sideways_atr_min_pct': 0.014651770925692656, 'sideways_atr_max_pct': 0.12000812692756183, 'sideways_tp_mult': 2.333536352763617, 'sideways_tsl_mult': 0.20742847404579356, 'sideways_time_stop': 62, 'sideways_use_sma': False, 'sideways_use_ema': True, 'sideways_use_atr': True, 'sideways_use_adx': True, 'sideways_use_spike': False, 'sideways_rsi_required': False}.
[I 2025-09-01 14:01:16,567] Trial 235 finished with values: [-1000000000.0, 1000000000.0] and parameters: {'p_sma': 46, 'p_std': 16, 'p_atr': 13, 'p_adx': 26, 'rsi_period': 27, 'ema1': 8, 'ema2': 28, 'slip_atr_k': 0.10311428860780215, 'slip_spread_k': 0.516255299480398, 'spread_hl_frac': 0.008045094469631456, 'bb_std_mult': 1.9473611489952272, 'rsi_os': 46, 'rsi_ob': 73, 'vol_spike': 0.06299680191844456, 'adx_thresh': 22.663469447168627, 'atr_min_pct': 0.010191729335557601, 'atr_max_pct': 0.1431684857310195, 'tp_mult': 1.970472643371748, 'tsl_mult': 0.09850295570363396, 'strategy': 'breakout', 'time_stop': 98, 'use_sma': True, 'use_atr': True, 'use_adx': False, 'use_ema': False, 'use_spike': False, 'rsi_required': False, 'edge_k': 1.2418594571583619, 'edge_cap': 0.6937973730406992, 'bull_strategy': 'breakout', 'bull_bb_std_mult': 0.5578194125214737, 'bull_rsi_os': 52, 'bull_rsi_ob': 54, 'bull_adx_thresh': 5.132518925549478, 'bull_atr_min_pct': 0.01099207173710161, 'bull_atr_max_pct': 0.04912525762271025, 'bull_tp_mult': 1.7515831252226273, 'bull_tsl_mult': 0.6032077740071393, 'bull_time_stop': 192, 'bull_use_sma': True, 'bull_use_ema': True, 'bull_use_atr': False, 'bull_use_adx': True, 'bull_use_spike': False, 'bull_rsi_required': False, 'bear_strategy': 'breakout', 'bear_bb_std_mult': 0.942345215549844, 'bear_rsi_os': 25, 'bear_rsi_ob': 66, 'bear_adx_thresh': 29.172836848915033, 'bear_atr_min_pct': 0.017879904043128666, 'bear_atr_max_pct': 0.1331701480873561, 'bear_tp_mult': 1.2357108803598327, 'bear_tsl_mult': 0.15586186057749002, 'bear_time_stop': 253, 'bear_use_sma': False, 'bear_use_ema': True, 'bear_use_atr': False, 'bear_use_adx': True, 'bear_use_spike': False, 'bear_rsi_required': True, 'sideways_strategy': 'breakout', 'sideways_bb_std_mult': 0.8024128890457458, 'sideways_rsi_os': 36, 'sideways_rsi_ob': 86, 'sideways_adx_thresh': 33.503538443314696, 'sideways_atr_min_pct': 0.014563294189336566, 'sideways_atr_max_pct': 0.11948800150896714, 'sideways_tp_mult': 1.0711370257055775, 'sideways_tsl_mult': 0.7743423095699941, 'sideways_time_stop': 245, 'sideways_use_sma': False, 'sideways_use_ema': True, 'sideways_use_atr': True, 'sideways_use_adx': False, 'sideways_use_spike': False, 'sideways_rsi_required': False}.
[I 2025-09-01 14:01:54,012] Trial 236 finished with values: [-1000000000.0, 1000000000.0] and parameters: {'p_sma': 47, 'p_std': 49, 'p_atr': 7, 'p_adx': 26, 'rsi_period': 23, 'ema1': 8, 'ema2': 28, 'slip_atr_k': 0.10238548081613957, 'slip_spread_k': 0.5133398665624358, 'spread_hl_frac': 0.008211426865168223, 'bb_std_mult': 1.9711166348660072, 'rsi_os': 9, 'rsi_ob': 73, 'vol_spike': 0.03993234134814362, 'adx_thresh': 22.708087512252877, 'atr_min_pct': 0.01732771392253058, 'atr_max_pct': 0.01860560488619917, 'tp_mult': 2.9312120988461396, 'tsl_mult': 0.8582762502681585, 'strategy': 'breakout', 'time_stop': 100, 'use_sma': True, 'use_atr': True, 'use_adx': False, 'use_ema': False, 'use_spike': False, 'rsi_required': False, 'edge_k': 0.4729734553796556, 'edge_cap': 0.5751737884229978, 'bull_strategy': 'breakout', 'bull_bb_std_mult': 2.2931577658619355, 'bull_rsi_os': 18, 'bull_rsi_ob': 75, 'bull_adx_thresh': 5.556551992771968, 'bull_atr_min_pct': 0.02900700271490029, 'bull_atr_max_pct': 0.07518957820144367, 'bull_tp_mult': 1.0191176296392408, 'bull_tsl_mult': 0.8014451653466909, 'bull_time_stop': 278, 'bull_use_sma': True, 'bull_use_ema': True, 'bull_use_atr': False, 'bull_use_adx': False, 'bull_use_spike': False, 'bull_rsi_required': False, 'bear_strategy': 'breakout', 'bear_bb_std_mult': 1.8191622713258346, 'bear_rsi_os': 12, 'bear_rsi_ob': 59, 'bear_adx_thresh': 14.577671762735532, 'bear_atr_min_pct': 0.004999005462919687, 'bear_atr_max_pct': 0.06578161170289916, 'bear_tp_mult': 2.4487848967790904, 'bear_tsl_mult': 0.14644159986384814, 'bear_time_stop': 254, 'bear_use_sma': False, 'bear_use_ema': True, 'bear_use_atr': False, 'bear_use_adx': True, 'bear_use_spike': False, 'bear_rsi_required': True, 'sideways_strategy': 'breakout', 'sideways_bb_std_mult': 0.7842423414788611, 'sideways_rsi_os': 36, 'sideways_rsi_ob': 86, 'sideways_adx_thresh': 27.49250594427953, 'sideways_atr_min_pct': 0.02098580552780013, 'sideways_atr_max_pct': 0.07124909298620645, 'sideways_tp_mult': 2.8130568150677173, 'sideways_tsl_mult': 0.6870185712129542, 'sideways_time_stop': 247, 'sideways_use_sma': False, 'sideways_use_ema': True, 'sideways_use_atr': True, 'sideways_use_adx': False, 'sideways_use_spike': False, 'sideways_rsi_required': False}.
[I 2025-09-01 14:01:54,014] Trial 239 finished with values: [-1000000000.0, 1000000000.0] and parameters: {'p_sma': 42, 'p_std': 50, 'p_atr': 7, 'p_adx': 27, 'rsi_period': 23, 'ema1': 8, 'ema2': 26, 'slip_atr_k': 0.11481812163812655, 'slip_spread_k': 0.941489849511407, 'spread_hl_frac': 0.03321834221598363, 'bb_std_mult': 2.0973824907103307, 'rsi_os': 45, 'rsi_ob': 74, 'vol_spike': 0.02517733583591135, 'adx_thresh': 22.01236929983805, 'atr_min_pct': 0.0020288103413155963, 'atr_max_pct': 0.01985499155931069, 'tp_mult': 2.3335489120742685, 'tsl_mult': 0.8573891277333276, 'strategy': 'breakout', 'time_stop': 198, 'use_sma': True, 'use_atr': True, 'use_adx': False, 'use_ema': False, 'use_spike': False, 'rsi_required': False, 'edge_k': 0.7890304660027219, 'edge_cap': 0.5089910636477949, 'bull_strategy': 'breakout', 'bull_bb_std_mult': 3.3162082887511013, 'bull_rsi_os': 18, 'bull_rsi_ob': 51, 'bull_adx_thresh': 11.237507845821742, 'bull_atr_min_pct': 0.02794916246736804, 'bull_atr_max_pct': 0.124083644154185, 'bull_tp_mult': 1.31104972338512, 'bull_tsl_mult': 0.06125960789271717, 'bull_time_stop': 274, 'bull_use_sma': False, 'bull_use_ema': True, 'bull_use_atr': False, 'bull_use_adx': True, 'bull_use_spike': False, 'bull_rsi_required': True, 'bear_strategy': 'breakout', 'bear_bb_std_mult': 2.1062624584299154, 'bear_rsi_os': 12, 'bear_rsi_ob': 60, 'bear_adx_thresh': 6.363779216016416, 'bear_atr_min_pct': 0.005086972112752794, 'bear_atr_max_pct': 0.037109936998912345, 'bear_tp_mult': 1.9591036902659549, 'bear_tsl_mult': 0.49948461365714697, 'bear_time_stop': 54, 'bear_use_sma': False, 'bear_use_ema': True, 'bear_use_atr': False, 'bear_use_adx': False, 'bear_use_spike': False, 'bear_rsi_required': True, 'sideways_strategy': 'breakout', 'sideways_bb_std_mult': 0.7512263243675057, 'sideways_rsi_os': 20, 'sideways_rsi_ob': 57, 'sideways_adx_thresh': 8.125215122191996, 'sideways_atr_min_pct': 0.02462004701760731, 'sideways_atr_max_pct': 0.11301317839300735, 'sideways_tp_mult': 1.5035063164300047, 'sideways_tsl_mult': 0.8636611972399499, 'sideways_time_stop': 240, 'sideways_use_sma': True, 'sideways_use_ema': True, 'sideways_use_atr': True, 'sideways_use_adx': False, 'sideways_use_spike': False, 'sideways_rsi_required': False}.
[I 2025-09-01 14:01:54,202] Trial 238 finished with values: [-1000000000.0, 1000000000.0] and parameters: {'p_sma': 51, 'p_std': 29, 'p_atr': 8, 'p_adx': 27, 'rsi_period': 27, 'ema1': 17, 'ema2': 28, 'slip_atr_k': 0.052332463046267666, 'slip_spread_k': 0.7215433454196455, 'spread_hl_frac': 0.011770768817259226, 'bb_std_mult': 1.2489437182068281, 'rsi_os': 39, 'rsi_ob': 73, 'vol_spike': 0.12988918877455724, 'adx_thresh': 34.161194095987405, 'atr_min_pct': 0.0178649063096877, 'atr_max_pct': 0.019316240653554348, 'tp_mult': 2.3195833122001424, 'tsl_mult': 0.981289566577656, 'strategy': 'breakout', 'time_stop': 99, 'use_sma': True, 'use_atr': True, 'use_adx': False, 'use_ema': False, 'use_spike': False, 'rsi_required': False, 'edge_k': 0.4765685411725973, 'edge_cap': 0.6826850205566297, 'bull_strategy': 'breakout', 'bull_bb_std_mult': 3.3006216229430647, 'bull_rsi_os': 18, 'bull_rsi_ob': 93, 'bull_adx_thresh': 11.27142378226676, 'bull_atr_min_pct': 0.011246085511314001, 'bull_atr_max_pct': 0.12461175828908, 'bull_tp_mult': 1.0457981604009094, 'bull_tsl_mult': 0.7589015979793505, 'bull_time_stop': 277, 'bull_use_sma': True, 'bull_use_ema': True, 'bull_use_atr': False, 'bull_use_adx': True, 'bull_use_spike': False, 'bull_rsi_required': True, 'bear_strategy': 'breakout', 'bear_bb_std_mult': 0.6546644086903741, 'bear_rsi_os': 28, 'bear_rsi_ob': 52, 'bear_adx_thresh': 16.42499495231577, 'bear_atr_min_pct': 0.005098917726272266, 'bear_atr_max_pct': 0.07241586526646081, 'bear_tp_mult': 2.164126688877887, 'bear_tsl_mult': 0.1410586117749317, 'bear_time_stop': 54, 'bear_use_sma': False, 'bear_use_ema': True, 'bear_use_atr': False, 'bear_use_adx': False, 'bear_use_spike': False, 'bear_rsi_required': True, 'sideways_strategy': 'breakout', 'sideways_bb_std_mult': 0.8069990724337958, 'sideways_rsi_os': 36, 'sideways_rsi_ob': 86, 'sideways_adx_thresh': 31.340101659138874, 'sideways_atr_min_pct': 0.01447754745065355, 'sideways_atr_max_pct': 0.10923983396274775, 'sideways_tp_mult': 1.500796381373185, 'sideways_tsl_mult': 0.16361344770069763, 'sideways_time_stop': 71, 'sideways_use_sma': True, 'sideways_use_ema': True, 'sideways_use_atr': True, 'sideways_use_adx': False, 'sideways_use_spike': False, 'sideways_rsi_required': False}.
[I 2025-09-01 14:01:54,328] Trial 237 finished with values: [-1000000000.0, 1000000000.0] and parameters: {'p_sma': 42, 'p_std': 29, 'p_atr': 7, 'p_adx': 27, 'rsi_period': 25, 'ema1': 17, 'ema2': 28, 'slip_atr_k': 0.005547173454995141, 'slip_spread_k': 0.5129109931318948, 'spread_hl_frac': 0.03310844216538905, 'bb_std_mult': 2.1626149827938317, 'rsi_os': 53, 'rsi_ob': 73, 'vol_spike': 0.15179552898091714, 'adx_thresh': 22.593191541357587, 'atr_min_pct': 0.013329058082400275, 'atr_max_pct': 0.01865796008643922, 'tp_mult': 2.092343967961713, 'tsl_mult': 0.01353062794744659, 'strategy': 'breakout', 'time_stop': 100, 'use_sma': True, 'use_atr': True, 'use_adx': False, 'use_ema': False, 'use_spike': False, 'rsi_required': False, 'edge_k': 1.2371882845220212, 'edge_cap': 0.4400057659742622, 'bull_strategy': 'breakout', 'bull_bb_std_mult': 1.5189109746577145, 'bull_rsi_os': 18, 'bull_rsi_ob': 93, 'bull_adx_thresh': 11.174720455880053, 'bull_atr_min_pct': 0.009117066617430917, 'bull_atr_max_pct': 0.09085581695530463, 'bull_tp_mult': 1.1001958262533862, 'bull_tsl_mult': 0.6002295385641329, 'bull_time_stop': 96, 'bull_use_sma': True, 'bull_use_ema': True, 'bull_use_atr': False, 'bull_use_adx': True, 'bull_use_spike': False, 'bull_rsi_required': False, 'bear_strategy': 'breakout', 'bear_bb_std_mult': 2.85059222661626, 'bear_rsi_os': 12, 'bear_rsi_ob': 55, 'bear_adx_thresh': 23.3350127251039, 'bear_atr_min_pct': 0.02064670997946464, 'bear_atr_max_pct': 0.07262280154962719, 'bear_tp_mult': 1.955498688876214, 'bear_tsl_mult': 0.1493215505505919, 'bear_time_stop': 254, 'bear_use_sma': False, 'bear_use_ema': True, 'bear_use_atr': False, 'bear_use_adx': True, 'bear_use_spike': False, 'bear_rsi_required': True, 'sideways_strategy': 'breakout', 'sideways_bb_std_mult': 0.7629408611847684, 'sideways_rsi_os': 36, 'sideways_rsi_ob': 86, 'sideways_adx_thresh': 17.380585705824128, 'sideways_atr_min_pct': 0.014821480652146293, 'sideways_atr_max_pct': 0.07013187635713618, 'sideways_tp_mult': 1.5010327332451938, 'sideways_tsl_mult': 0.7288142525666772, 'sideways_time_stop': 223, 'sideways_use_sma': False, 'sideways_use_ema': True, 'sideways_use_atr': True, 'sideways_use_adx': False, 'sideways_use_spike': False, 'sideways_rsi_required': False}.
[I 2025-09-01 14:01:55,003] Trial 241 finished with values: [-1000000000.0, 1000000000.0] and parameters: {'p_sma': 12, 'p_std': 29, 'p_atr': 8, 'p_adx': 27, 'rsi_period': 25, 'ema1': 7, 'ema2': 29, 'slip_atr_k': 0.003927450300019699, 'slip_spread_k': 0.5421974549955153, 'spread_hl_frac': 0.010600913487454495, 'bb_std_mult': 1.868376170459468, 'rsi_os': 43, 'rsi_ob': 76, 'vol_spike': 0.13008858949772292, 'adx_thresh': 21.687749092478516, 'atr_min_pct': 0.01798015400838528, 'atr_max_pct': 0.012470359616564633, 'tp_mult': 1.2248850460964826, 'tsl_mult': 0.05171112266607667, 'strategy': 'breakout', 'time_stop': 261, 'use_sma': True, 'use_atr': True, 'use_adx': False, 'use_ema': False, 'use_spike': True, 'rsi_required': False, 'edge_k': 1.2087038031141735, 'edge_cap': 0.1705418723228853, 'bull_strategy': 'mean_reversion', 'bull_bb_std_mult': 1.5017585766628219, 'bull_rsi_os': 17, 'bull_rsi_ob': 61, 'bull_adx_thresh': 28.864637128671795, 'bull_atr_min_pct': 0.011361060751547521, 'bull_atr_max_pct': 0.12012141420828466, 'bull_tp_mult': 1.4151254227584749, 'bull_tsl_mult': 0.7649418153618794, 'bull_time_stop': 97, 'bull_use_sma': False, 'bull_use_ema': True, 'bull_use_atr': False, 'bull_use_adx': True, 'bull_use_spike': False, 'bull_rsi_required': False, 'bear_strategy': 'breakout', 'bear_bb_std_mult': 2.863992550333496, 'bear_rsi_os': 42, 'bear_rsi_ob': 52, 'bear_adx_thresh': 5.046551068204766, 'bear_atr_min_pct': 0.004433845996039191, 'bear_atr_max_pct': 0.07240118249407221, 'bear_tp_mult': 1.9060474379231809, 'bear_tsl_mult': 0.4303210030490856, 'bear_time_stop': 42, 'bear_use_sma': True, 'bear_use_ema': True, 'bear_use_atr': False, 'bear_use_adx': True, 'bear_use_spike': False, 'bear_rsi_required': True, 'sideways_strategy': 'breakout', 'sideways_bb_std_mult': 2.535581246872123, 'sideways_rsi_os': 38, 'sideways_rsi_ob': 84, 'sideways_adx_thresh': 31.018156343911617, 'sideways_atr_min_pct': 0.015070736302376073, 'sideways_atr_max_pct': 0.12622965997922908, 'sideways_tp_mult': 2.5982786045313593, 'sideways_tsl_mult': 0.7244288055481014, 'sideways_time_stop': 21, 'sideways_use_sma': False, 'sideways_use_ema': False, 'sideways_use_atr': False, 'sideways_use_adx': False, 'sideways_use_spike': False, 'sideways_rsi_required': True}.
[I 2025-09-01 14:01:55,080] Trial 240 finished with values: [-1000000000.0, 1000000000.0] and parameters: {'p_sma': 58, 'p_std': 28, 'p_atr': 8, 'p_adx': 27, 'rsi_period': 25, 'ema1': 7, 'ema2': 29, 'slip_atr_k': 0.04837518772430016, 'slip_spread_k': 0.7210215471543847, 'spread_hl_frac': 0.011748907378831872, 'bb_std_mult': 1.7375792193289874, 'rsi_os': 43, 'rsi_ob': 76, 'vol_spike': 0.13158051059724837, 'adx_thresh': 17.174532768406355, 'atr_min_pct': 0.01794964563531145, 'atr_max_pct': 0.012302331979070907, 'tp_mult': 2.0891803911073095, 'tsl_mult': 0.05961342419585007, 'strategy': 'breakout', 'time_stop': 89, 'use_sma': True, 'use_atr': True, 'use_adx': False, 'use_ema': False, 'use_spike': True, 'rsi_required': False, 'edge_k': 1.219099461372913, 'edge_cap': 0.21130083932320548, 'bull_strategy': 'mean_reversion', 'bull_bb_std_mult': 1.7222988208511953, 'bull_rsi_os': 44, 'bull_rsi_ob': 49, 'bull_adx_thresh': 14.386484870335082, 'bull_atr_min_pct': 0.009303782370366302, 'bull_atr_max_pct': 0.12028256421814953, 'bull_tp_mult': 1.4039476851460602, 'bull_tsl_mult': 0.27383953248221593, 'bull_time_stop': 84, 'bull_use_sma': False, 'bull_use_ema': True, 'bull_use_atr': False, 'bull_use_adx': True, 'bull_use_spike': False, 'bull_rsi_required': False, 'bear_strategy': 'breakout', 'bear_bb_std_mult': 2.8525825762870345, 'bear_rsi_os': 28, 'bear_rsi_ob': 93, 'bear_adx_thresh': 15.32181614694364, 'bear_atr_min_pct': 0.02835010271219786, 'bear_atr_max_pct': 0.07232431157579218, 'bear_tp_mult': 2.1385486113077334, 'bear_tsl_mult': 0.13051563907649558, 'bear_time_stop': 112, 'bear_use_sma': True, 'bear_use_ema': True, 'bear_use_atr': False, 'bear_use_adx': True, 'bear_use_spike': False, 'bear_rsi_required': True, 'sideways_strategy': 'breakout', 'sideways_bb_std_mult': 0.8826949318707238, 'sideways_rsi_os': 43, 'sideways_rsi_ob': 68, 'sideways_adx_thresh': 30.763818471831318, 'sideways_atr_min_pct': 0.007835484676541587, 'sideways_atr_max_pct': 0.08867285818359273, 'sideways_tp_mult': 2.586088305890141, 'sideways_tsl_mult': 0.7302040324840592, 'sideways_time_stop': 232, 'sideways_use_sma': False, 'sideways_use_ema': False, 'sideways_use_atr': False, 'sideways_use_adx': False, 'sideways_use_spike': False, 'sideways_rsi_required': True}.
[I 2025-09-01 14:02:29,494] Trial 242 finished with values: [-1000000000.0, 1000000000.0] and parameters: {'p_sma': 11, 'p_std': 28, 'p_atr': 8, 'p_adx': 27, 'rsi_period': 25, 'ema1': 22, 'ema2': 26, 'slip_atr_k': 0.08895127205118708, 'slip_spread_k': 0.5455821697486632, 'spread_hl_frac': 0.010576688102564697, 'bb_std_mult': 1.7103600865330422, 'rsi_os': 23, 'rsi_ob': 75, 'vol_spike': 0.24789367060190237, 'adx_thresh': 26.885656026392155, 'atr_min_pct': 0.0036631956809115573, 'atr_max_pct': 0.012475323941009291, 'tp_mult': 2.047364499797368, 'tsl_mult': 0.03964236645703867, 'strategy': 'breakout', 'time_stop': 90, 'use_sma': False, 'use_atr': True, 'use_adx': False, 'use_ema': False, 'use_spike': True, 'rsi_required': False, 'edge_k': 1.280767432820096, 'edge_cap': 0.21096429953317009, 'bull_strategy': 'mean_reversion', 'bull_bb_std_mult': 1.7234549676965258, 'bull_rsi_os': 28, 'bull_rsi_ob': 61, 'bull_adx_thresh': 12.130665204836767, 'bull_atr_min_pct': 0.01411471687957594, 'bull_atr_max_pct': 0.12065807317420915, 'bull_tp_mult': 1.410435953952119, 'bull_tsl_mult': 0.27357922495045817, 'bull_time_stop': 84, 'bull_use_sma': False, 'bull_use_ema': True, 'bull_use_atr': False, 'bull_use_adx': True, 'bull_use_spike': False, 'bull_rsi_required': False, 'bear_strategy': 'breakout', 'bear_bb_std_mult': 0.8254760433114439, 'bear_rsi_os': 15, 'bear_rsi_ob': 71, 'bear_adx_thresh': 5.023035783447616, 'bear_atr_min_pct': 0.0064632364877920115, 'bear_atr_max_pct': 0.06866265702713789, 'bear_tp_mult': 1.9061547221694775, 'bear_tsl_mult': 0.7342751848818886, 'bear_time_stop': 200, 'bear_use_sma': True, 'bear_use_ema': True, 'bear_use_atr': False, 'bear_use_adx': True, 'bear_use_spike': False, 'bear_rsi_required': True, 'sideways_strategy': 'breakout', 'sideways_bb_std_mult': 2.638393836051592, 'sideways_rsi_os': 38, 'sideways_rsi_ob': 82, 'sideways_adx_thresh': 29.053021382883735, 'sideways_atr_min_pct': 0.015877580040624697, 'sideways_atr_max_pct': 0.12668737670871857, 'sideways_tp_mult': 2.5980034362054143, 'sideways_tsl_mult': 0.7192078206297295, 'sideways_time_stop': 233, 'sideways_use_sma': False, 'sideways_use_ema': False, 'sideways_use_atr': False, 'sideways_use_adx': False, 'sideways_use_spike': False, 'sideways_rsi_required': True}.
