[I 2025-09-01 13:29:59,972] Trial 18 finished with values: [-0.014541114117092024, 0.016673661865350867] and parameters: {'p_sma': 7, 'p_std': 42, 'p_atr': 15, 'p_adx': 24, 'rsi_period': 26, 'ema1': 5, 'ema2': 37, 'slip_atr_k': 0.004783984988978868, 'slip_spread_k': 0.5101009823329355, 'spread_hl_frac': 0.000658579273312497, 'bb_std_mult': 1.571930934888531, 'rsi_os': 37, 'rsi_ob': 64, 'vol_spike': 0.1889919237766854, 'adx_thresh': 34.67071895508243, 'atr_min_pct': 0.011107252580575953, 'atr_max_pct': 0.015168332285553022, 'tp_mult': 1.8871719212114215, 'tsl_mult': 0.01662819386431827, 'strategy': 'breakout', 'time_stop': 95, 'use_sma': True, 'use_atr': True, 'use_adx': False, 'use_ema': False, 'use_spike': True, 'rsi_required': False, 'edge_k': 0.9527371329494134, 'edge_cap': 0.10152570990576193, 'bull_strategy': 'breakout', 'bull_bb_std_mult': 1.0187747101175202, 'bull_rsi_os': 46, 'bull_rsi_ob': 45, 'bull_adx_thresh': 5.578044868940966, 'bull_atr_min_pct': 0.0007224121706807566, 'bull_atr_max_pct': 0.11757656216400174, 'bull_tp_mult': 1.5112961181866296, 'bull_tsl_mult': 0.9861419251031245, 'bull_time_stop': 108, 'bull_use_sma': False, 'bull_use_ema': True, 'bull_use_atr': False, 'bull_use_adx': True, 'bull_use_spike': False, 'bull_rsi_required': False, 'bear_strategy': 'breakout', 'bear_bb_std_mult': 2.7472564359068077, 'bear_rsi_os': 7, 'bear_rsi_ob': 61, 'bear_adx_thresh': 13.369924475195585, 'bear_atr_min_pct': 0.0009032713958723837, 'bear_atr_max_pct': 0.03909324534064066, 'bear_tp_mult': 1.6813135773784689, 'bear_tsl_mult': 0.03969946112298316, 'bear_time_stop': 130, 'bear_use_sma': False, 'bear_use_ema': True, 'bear_use_atr': False, 'bear_use_adx': True, 'bear_use_spike': False, 'bear_rsi_required': True, 'sideways_strategy': 'breakout', 'sideways_bb_std_mult': 0.540326659284895, 'sideways_rsi_os': 40, 'sideways_rsi_ob': 86, 'sideways_adx_thresh': 24.097575190879134, 'sideways_atr_min_pct': 0.023765321782631642, 'sideways_atr_max_pct': 0.14927333540791637, 'sideways_tp_mult': 2.8610331840301177, 'sideways_tsl_mult': 0.7788951600601428, 'sideways_time_stop': 227, 'sideways_use_sma': True, 'sideways_use_ema': True, 'sideways_use_atr': True, 'sideways_use_adx': True, 'sideways_use_spike': False, 'sideways_rsi_required': False}.
[I 2025-09-01 13:30:38,907] Trial 19 finished with values: [-0.02525039332169232, 0.025245949705535092] and parameters: {'p_sma': 40, 'p_std': 40, 'p_atr': 15, 'p_adx': 13, 'rsi_period': 32, 'ema1': 5, 'ema2': 30, 'slip_atr_k': 0.009817069163669395, 'slip_spread_k': 0.5612509762257064, 'spread_hl_frac': 0.0008423104480310938, 'bb_std_mult': 1.7297547418292174, 'rsi_os': 35, 'rsi_ob': 64, 'vol_spike': 0.003188340965055337, 'adx_thresh': 24.772005294376264, 'atr_min_pct': 0.016156740938667254, 'atr_max_pct': 0.06151872419088846, 'tp_mult': 1.8520216115296262, 'tsl_mult': 0.6513256651376653, 'strategy': 'mean_reversion', 'time_stop': 300, 'use_sma': True, 'use_atr': True, 'use_adx': True, 'use_ema': True, 'use_spike': True, 'rsi_required': False, 'edge_k': 1.1592602107714305, 'edge_cap': 0.989422732614156, 'bull_strategy': 'breakout', 'bull_bb_std_mult': 1.2398160846920538, 'bull_rsi_os': 18, 'bull_rsi_ob': 46, 'bull_adx_thresh': 29.745107483251513, 'bull_atr_min_pct': 0.0005316139945112619, 'bull_atr_max_pct': 0.1148948658395841, 'bull_tp_mult': 1.5092725907421047, 'bull_tsl_mult': 0.269541081481554, 'bull_time_stop': 114, 'bull_use_sma': False, 'bull_use_ema': False, 'bull_use_atr': False, 'bull_use_adx': False, 'bull_use_spike': False, 'bull_rsi_required': True, 'bear_strategy': 'breakout', 'bear_bb_std_mult': 2.9232504711423455, 'bear_rsi_os': 11, 'bear_rsi_ob': 63, 'bear_adx_thresh': 13.587028575923334, 'bear_atr_min_pct': 0.02403764855437719, 'bear_atr_max_pct': 0.10677978390675506, 'bear_tp_mult': 1.7029434043333809, 'bear_tsl_mult': 0.03670439373938271, 'bear_time_stop': 131, 'bear_use_sma': False, 'bear_use_ema': False, 'bear_use_atr': False, 'bear_use_adx': True, 'bear_use_spike': True, 'bear_rsi_required': True, 'sideways_strategy': 'breakout', 'sideways_bb_std_mult': 2.9226779285933278, 'sideways_rsi_os': 37, 'sideways_rsi_ob': 46, 'sideways_adx_thresh': 25.524268472217038, 'sideways_atr_min_pct': 0.0062513804320488775, 'sideways_atr_max_pct': 0.14538946398639488, 'sideways_tp_mult': 2.9451421579908637, 'sideways_tsl_mult': 0.765853777521436, 'sideways_time_stop': 247, 'sideways_use_sma': True, 'sideways_use_ema': False, 'sideways_use_atr': False, 'sideways_use_adx': True, 'sideways_use_spike': True, 'sideways_rsi_required': True}.
[I 2025-09-01 13:30:39,454] Trial 21 finished with values: [-1000000000.0, 1000000000.0] and parameters: {'p_sma': 12, 'p_std': 25, 'p_atr': 7, 'p_adx': 27, 'rsi_period': 29, 'ema1': 10, 'ema2': 30, 'slip_atr_k': 0.08368513585764739, 'slip_spread_k': 0.5433912177203085, 'spread_hl_frac': 0.010501361119202727, 'bb_std_mult': 1.9031674475847367, 'rsi_os': 37, 'rsi_ob': 76, 'vol_spike': 0.19120039198719763, 'adx_thresh': 30.85047497316081, 'atr_min_pct': 0.016570326567346035, 'atr_max_pct': 0.06400258746047727, 'tp_mult': 2.0331452236388423, 'tsl_mult': 0.037209786919243704, 'strategy': 'breakout', 'time_stop': 85, 'use_sma': True, 'use_atr': True, 'use_adx': False, 'use_ema': False, 'use_spike': True, 'rsi_required': False, 'edge_k': 1.2537105679218783, 'edge_cap': 0.2258669850375173, 'bull_strategy': 'breakout', 'bull_bb_std_mult': 1.2945392140673693, 'bull_rsi_os': 18, 'bull_rsi_ob': 53, 'bull_adx_thresh': 9.492260360000374, 'bull_atr_min_pct': 0.010385833466514853, 'bull_atr_max_pct': 0.12206222146053249, 'bull_tp_mult': 1.4666597012500031, 'bull_tsl_mult': 0.9747350847081515, 'bull_time_stop': 102, 'bull_use_sma': False, 'bull_use_ema': True, 'bull_use_atr': False, 'bull_use_adx': True, 'bull_use_spike': False, 'bull_rsi_required': False, 'bear_strategy': 'breakout', 'bear_bb_std_mult': 3.5986022140352842, 'bear_rsi_os': 15, 'bear_rsi_ob': 65, 'bear_adx_thresh': 5.3389349798158605, 'bear_atr_min_pct': 0.004564461698663303, 'bear_atr_max_pct': 0.03151897023413916, 'bear_tp_mult': 1.8994047835817247, 'bear_tsl_mult': 0.1574262801269991, 'bear_time_stop': 63, 'bear_use_sma': False, 'bear_use_ema': True, 'bear_use_atr': False, 'bear_use_adx': True, 'bear_use_spike': False, 'bear_rsi_required': True, 'sideways_strategy': 'breakout', 'sideways_bb_std_mult': 0.8015967341413861, 'sideways_rsi_os': 36, 'sideways_rsi_ob': 86, 'sideways_adx_thresh': 26.57406474815726, 'sideways_atr_min_pct': 0.023693570644443912, 'sideways_atr_max_pct': 0.12019149135382523, 'sideways_tp_mult': 2.6898706778051964, 'sideways_tsl_mult': 0.7833102127262794, 'sideways_time_stop': 257, 'sideways_use_sma': False, 'sideways_use_ema': True, 'sideways_use_atr': True, 'sideways_use_adx': False, 'sideways_use_spike': False, 'sideways_rsi_required': False}.
[I 2025-09-01 13:30:39,754] Trial 20 finished with values: [-0.012969848942022688, 0.012785090805790048] and parameters: {'p_sma': 10, 'p_std': 46, 'p_atr': 14, 'p_adx': 12, 'rsi_period': 30, 'ema1': 10, 'ema2': 30, 'slip_atr_k': 0.09223646296564175, 'slip_spread_k': 0.5608233024774999, 'spread_hl_frac': 0.007958763882146499, 'bb_std_mult': 1.866108054257243, 'rsi_os': 35, 'rsi_ob': 73, 'vol_spike': 0.00375198262294391, 'adx_thresh': 23.548110664119385, 'atr_min_pct': 0.016257866638817762, 'atr_max_pct': 0.06327158600512926, 'tp_mult': 1.999357187950624, 'tsl_mult': 0.6630296293891242, 'strategy': 'mean_reversion', 'time_stop': 298, 'use_sma': True, 'use_atr': True, 'use_adx': True, 'use_ema': True, 'use_spike': True, 'rsi_required': False, 'edge_k': 1.1966914134847293, 'edge_cap': 0.9489564003095265, 'bull_strategy': 'breakout', 'bull_bb_std_mult': 1.2711726171784752, 'bull_rsi_os': 19, 'bull_rsi_ob': 70, 'bull_adx_thresh': 29.184283881027568, 'bull_atr_min_pct': 0.0008628805284327387, 'bull_atr_max_pct': 0.12136538631250383, 'bull_tp_mult': 1.3884317818203744, 'bull_tsl_mult': 0.30678553164230216, 'bull_time_stop': 101, 'bull_use_sma': False, 'bull_use_ema': False, 'bull_use_atr': False, 'bull_use_adx': False, 'bull_use_spike': False, 'bull_rsi_required': True, 'bear_strategy': 'breakout', 'bear_bb_std_mult': 2.0881278051833143, 'bear_rsi_os': 15, 'bear_rsi_ob': 64, 'bear_adx_thresh': 15.052461622370465, 'bear_atr_min_pct': 0.02405391710154396, 'bear_atr_max_pct': 0.14089997549292702, 'bear_tp_mult': 1.9035338483384372, 'bear_tsl_mult': 0.2521119620966342, 'bear_time_stop': 67, 'bear_use_sma': False, 'bear_use_ema': False, 'bear_use_atr': False, 'bear_use_adx': True, 'bear_use_spike': True, 'bear_rsi_required': True, 'sideways_strategy': 'breakout', 'sideways_bb_std_mult': 2.9720187270614873, 'sideways_rsi_os': 37, 'sideways_rsi_ob': 46, 'sideways_adx_thresh': 24.76711256594974, 'sideways_atr_min_pct': 0.006026190169929366, 'sideways_atr_max_pct': 0.11548669839405648, 'sideways_tp_mult': 2.6882944362736856, 'sideways_tsl_mult': 0.7725084214946076, 'sideways_time_stop': 253, 'sideways_use_sma': True, 'sideways_use_ema': False, 'sideways_use_atr': False, 'sideways_use_adx': True, 'sideways_use_spike': True, 'sideways_rsi_required': True}.
[I 2025-09-01 13:30:40,090] Trial 22 finished with values: [0.004862642801191086, 0.0035283478511398737] and parameters: {'p_sma': 11, 'p_std': 27, 'p_atr': 7, 'p_adx': 27, 'rsi_period': 26, 'ema1': 8, 'ema2': 28, 'slip_atr_k': 0.0010672923619355307, 'slip_spread_k': 0.5164759482815775, 'spread_hl_frac': 0.009419617379129488, 'bb_std_mult': 1.965952814768433, 'rsi_os': 45, 'rsi_ob': 74, 'vol_spike': 0.11458275503408451, 'adx_thresh': 22.61077406283431, 'atr_min_pct': 0.017385688117201314, 'atr_max_pct': 0.018896474338573034, 'tp_mult': 1.9844863680720717, 'tsl_mult': 0.054408754816095556, 'strategy': 'breakout', 'time_stop': 94, 'use_sma': True, 'use_atr': True, 'use_adx': False, 'use_ema': False, 'use_spike': True, 'rsi_required': False, 'edge_k': 1.2055922311284162, 'edge_cap': 0.23143924659121812, 'bull_strategy': 'breakout', 'bull_bb_std_mult': 1.309762052196895, 'bull_rsi_os': 18, 'bull_rsi_ob': 53, 'bull_adx_thresh': 10.439216140487208, 'bull_atr_min_pct': 0.011310616040399686, 'bull_atr_max_pct': 0.12446429304448856, 'bull_tp_mult': 1.4277785716342513, 'bull_tsl_mult': 0.5770529062863504, 'bull_time_stop': 92, 'bull_use_sma': False, 'bull_use_ema': True, 'bull_use_atr': False, 'bull_use_adx': True, 'bull_use_spike': False, 'bull_rsi_required': False, 'bear_strategy': 'breakout', 'bear_bb_std_mult': 3.0114498940167005, 'bear_rsi_os': 13, 'bear_rsi_ob': 53, 'bear_adx_thresh': 5.457980399124784, 'bear_atr_min_pct': 0.004736920512292637, 'bear_atr_max_pct': 0.06955878844872981, 'bear_tp_mult': 1.9116970802181652, 'bear_tsl_mult': 0.1649229158618385, 'bear_time_stop': 55, 'bear_use_sma': False, 'bear_use_ema': True, 'bear_use_atr': False, 'bear_use_adx': True, 'bear_use_spike': False, 'bear_rsi_required': True, 'sideways_strategy': 'breakout', 'sideways_bb_std_mult': 0.7658659863855539, 'sideways_rsi_os': 36, 'sideways_rsi_ob': 86, 'sideways_adx_thresh': 28.659935587406714, 'sideways_atr_min_pct': 0.015002235378701413, 'sideways_atr_max_pct': 0.11958299499091386, 'sideways_tp_mult': 2.6955029917701645, 'sideways_tsl_mult': 0.7452655188813236, 'sideways_time_stop': 243, 'sideways_use_sma': False, 'sideways_use_ema': True, 'sideways_use_atr': True, 'sideways_use_adx': False, 'sideways_use_spike': False, 'sideways_rsi_required': False}.
[I 2025-09-01 13:31:18,359] Trial 26 finished with values: [-1000000000.0, 1000000000.0] and parameters: {'p_sma': 33, 'p_std': 30, 'p_atr': 7, 'p_adx': 28, 'rsi_period': 21, 'ema1': 13, 'ema2': 11, 'slip_atr_k': 0.08474819886743473, 'slip_spread_k': 0.3820408747000712, 'spread_hl_frac': 0.008894899579230689, 'bb_std_mult': 2.176805405030647, 'rsi_os': 45, 'rsi_ob': 75, 'vol_spike': 0.1072261299677618, 'adx_thresh': 22.031264276555717, 'atr_min_pct': 0.020336673158852313, 'atr_max_pct': 0.026590402527920463, 'tp_mult': 2.231271564690418, 'tsl_mult': 0.30432668170050536, 'strategy': 'breakout', 'time_stop': 75, 'use_sma': False, 'use_atr': True, 'use_adx': False, 'use_ema': False, 'use_spike': True, 'rsi_required': False, 'edge_k': 1.2999538368645998, 'edge_cap': 0.19262354023138623, 'bull_strategy': 'breakout', 'bull_bb_std_mult': 1.5593318026959493, 'bull_rsi_os': 15, 'bull_rsi_ob': 68, 'bull_adx_thresh': 19.516471804707322, 'bull_atr_min_pct': 0.020153319104008662, 'bull_atr_max_pct': 0.10077810613329803, 'bull_tp_mult': 2.1500782603104494, 'bull_tsl_mult': 0.5763239427090687, 'bull_time_stop': 85, 'bull_use_sma': False, 'bull_use_ema': True, 'bull_use_atr': False, 'bull_use_adx': True, 'bull_use_spike': False, 'bull_rsi_required': False, 'bear_strategy': 'mean_reversion', 'bear_bb_std_mult': 3.0926262972337817, 'bear_rsi_os': 17, 'bear_rsi_ob': 51, 'bear_adx_thresh': 5.269000081509035, 'bear_atr_min_pct': 0.006550751829171525, 'bear_atr_max_pct': 0.070615704656149, 'bear_tp_mult': 2.9832380163090635, 'bear_tsl_mult': 0.25355808565285803, 'bear_time_stop': 55, 'bear_use_sma': False, 'bear_use_ema': True, 'bear_use_atr': True, 'bear_use_adx': True, 'bear_use_spike': False, 'bear_rsi_required': True, 'sideways_strategy': 'breakout', 'sideways_bb_std_mult': 1.7171994885752866, 'sideways_rsi_os': 22, 'sideways_rsi_ob': 76, 'sideways_adx_thresh': 31.419748503282264, 'sideways_atr_min_pct': 0.01550065005503592, 'sideways_atr_max_pct': 0.09979189435328793, 'sideways_tp_mult': 2.232692251854167, 'sideways_tsl_mult': 0.6762218526540072, 'sideways_time_stop': 171, 'sideways_use_sma': False, 'sideways_use_ema': True, 'sideways_use_atr': True, 'sideways_use_adx': False, 'sideways_use_spike': False, 'sideways_rsi_required': False}.
[I 2025-09-01 13:31:18,373] Trial 23 finished with values: [-1000000000.0, 1000000000.0] and parameters: {'p_sma': 12, 'p_std': 29, 'p_atr': 26, 'p_adx': 27, 'rsi_period': 26, 'ema1': 8, 'ema2': 29, 'slip_atr_k': 0.08250381747337693, 'slip_spread_k': 0.3895763361214611, 'spread_hl_frac': 0.009014252478893297, 'bb_std_mult': 1.994051963653678, 'rsi_os': 46, 'rsi_ob': 78, 'vol_spike': 0.18585114650985174, 'adx_thresh': 31.2275293388997, 'atr_min_pct': 0.00590125536725655, 'atr_max_pct': 0.01598719073949862, 'tp_mult': 2.055145965373658, 'tsl_mult': 0.008254627391794306, 'strategy': 'breakout', 'time_stop': 93, 'use_sma': True, 'use_atr': True, 'use_adx': False, 'use_ema': False, 'use_spike': True, 'rsi_required': False, 'edge_k': 1.2764887275220669, 'edge_cap': 0.2664511490100482, 'bull_strategy': 'breakout', 'bull_bb_std_mult': 1.4240058085902016, 'bull_rsi_os': 17, 'bull_rsi_ob': 53, 'bull_adx_thresh': 9.873426712075966, 'bull_atr_min_pct': 0.009128820925144077, 'bull_atr_max_pct': 0.12552737952655624, 'bull_tp_mult': 1.361826763804232, 'bull_tsl_mult': 0.9781932790839373, 'bull_time_stop': 90, 'bull_use_sma': False, 'bull_use_ema': True, 'bull_use_atr': False, 'bull_use_adx': True, 'bull_use_spike': False, 'bull_rsi_required': False, 'bear_strategy': 'breakout', 'bear_bb_std_mult': 1.9190713260549896, 'bear_rsi_os': 17, 'bear_rsi_ob': 52, 'bear_adx_thresh': 6.145980729447068, 'bear_atr_min_pct': 0.00466668629605398, 'bear_atr_max_pct': 0.030089055617775248, 'bear_tp_mult': 1.890756109465317, 'bear_tsl_mult': 0.191060032551994, 'bear_time_stop': 61, 'bear_use_sma': False, 'bear_use_ema': True, 'bear_use_atr': False, 'bear_use_adx': True, 'bear_use_spike': False, 'bear_rsi_required': True, 'sideways_strategy': 'breakout', 'sideways_bb_std_mult': 0.826846536448429, 'sideways_rsi_os': 36, 'sideways_rsi_ob': 86, 'sideways_adx_thresh': 30.67664544788055, 'sideways_atr_min_pct': 0.023960547820408906, 'sideways_atr_max_pct': 0.12346808576061077, 'sideways_tp_mult': 2.7089312860961, 'sideways_tsl_mult': 0.2698186769541053, 'sideways_time_stop': 165, 'sideways_use_sma': False, 'sideways_use_ema': True, 'sideways_use_atr': True, 'sideways_use_adx': False, 'sideways_use_spike': False, 'sideways_rsi_required': False}.
[I 2025-09-01 13:31:18,744] Trial 24 finished with values: [-1000000000.0, 1000000000.0] and parameters: {'p_sma': 11, 'p_std': 29, 'p_atr': 13, 'p_adx': 23, 'rsi_period': 25, 'ema1': 8, 'ema2': 11, 'slip_atr_k': 0.0016099422490743545, 'slip_spread_k': 0.39843476024549573, 'spread_hl_frac': 0.006735820410438596, 'bb_std_mult': 2.19990825678794, 'rsi_os': 45, 'rsi_ob': 60, 'vol_spike': 0.12303998230725095, 'adx_thresh': 24.00697684312766, 'atr_min_pct': 0.006642872740028878, 'atr_max_pct': 0.019950865978737575, 'tp_mult': 1.4320611884663201, 'tsl_mult': 0.0043366269272770985, 'strategy': 'breakout', 'time_stop': 99, 'use_sma': True, 'use_atr': True, 'use_adx': False, 'use_ema': False, 'use_spike': True, 'rsi_required': False, 'edge_k': 0.5132459826995526, 'edge_cap': 0.33740770249317587, 'bull_strategy': 'breakout', 'bull_bb_std_mult': 1.3988117491490173, 'bull_rsi_os': 16, 'bull_rsi_ob': 52, 'bull_adx_thresh': 18.860077209764455, 'bull_atr_min_pct': 0.020051540563172276, 'bull_atr_max_pct': 0.1286752432319173, 'bull_tp_mult': 1.3694608349497717, 'bull_tsl_mult': 0.559684669811118, 'bull_time_stop': 90, 'bull_use_sma': False, 'bull_use_ema': True, 'bull_use_atr': False, 'bull_use_adx': True, 'bull_use_spike': False, 'bull_rsi_required': False, 'bear_strategy': 'breakout', 'bear_bb_std_mult': 1.9242639509191033, 'bear_rsi_os': 12, 'bear_rsi_ob': 52, 'bear_adx_thresh': 13.484126423286531, 'bear_atr_min_pct': 0.005135420651964439, 'bear_atr_max_pct': 0.06902220603589537, 'bear_tp_mult': 1.9812298495257985, 'bear_tsl_mult': 0.26669251700761615, 'bear_time_stop': 149, 'bear_use_sma': False, 'bear_use_ema': True, 'bear_use_atr': False, 'bear_use_adx': True, 'bear_use_spike': False, 'bear_rsi_required': True, 'sideways_strategy': 'breakout', 'sideways_bb_std_mult': 1.7474652532169477, 'sideways_rsi_os': 43, 'sideways_rsi_ob': 75, 'sideways_adx_thresh': 28.72536533779951, 'sideways_atr_min_pct': 0.015532554368208558, 'sideways_atr_max_pct': 0.1284573170920174, 'sideways_tp_mult': 2.7233896131650384, 'sideways_tsl_mult': 0.26074860695767105, 'sideways_time_stop': 165, 'sideways_use_sma': True, 'sideways_use_ema': True, 'sideways_use_atr': True, 'sideways_use_adx': True, 'sideways_use_spike': False, 'sideways_rsi_required': False}.
[I 2025-09-01 13:31:19,083] Trial 25 finished with values: [-1000000000.0, 1000000000.0] and parameters: {'p_sma': 9, 'p_std': 48, 'p_atr': 13, 'p_adx': 23, 'rsi_period': 22, 'ema1': 8, 'ema2': 46, 'slip_atr_k': 0.03667050580926342, 'slip_spread_k': 0.3809941360227109, 'spread_hl_frac': 0.007374537423814985, 'bb_std_mult': 2.213481462004057, 'rsi_os': 47, 'rsi_ob': 59, 'vol_spike': 0.1208068775400354, 'adx_thresh': 22.141399772606768, 'atr_min_pct': 0.007178998005372571, 'atr_max_pct': 0.011806937676402902, 'tp_mult': 1.433890994492267, 'tsl_mult': 0.014079743903326718, 'strategy': 'breakout', 'time_stop': 108, 'use_sma': True, 'use_atr': True, 'use_adx': False, 'use_ema': False, 'use_spike': True, 'rsi_required': False, 'edge_k': 0.6380812707524548, 'edge_cap': 0.1696652452192636, 'bull_strategy': 'breakout', 'bull_bb_std_mult': 1.4669994186082504, 'bull_rsi_os': 24, 'bull_rsi_ob': 52, 'bull_adx_thresh': 19.409851643281094, 'bull_atr_min_pct': 0.003882465160695152, 'bull_atr_max_pct': 0.09964976483304724, 'bull_tp_mult': 1.2904630078285098, 'bull_tsl_mult': 0.5574541854378254, 'bull_time_stop': 183, 'bull_use_sma': False, 'bull_use_ema': True, 'bull_use_atr': False, 'bull_use_adx': True, 'bull_use_spike': False, 'bull_rsi_required': False, 'bear_strategy': 'breakout', 'bear_bb_std_mult': 1.8806748158877642, 'bear_rsi_os': 10, 'bear_rsi_ob': 54, 'bear_adx_thresh': 17.396864356496504, 'bear_atr_min_pct': 0.005166041389216213, 'bear_atr_max_pct': 0.069199279927591, 'bear_tp_mult': 1.9910804915440459, 'bear_tsl_mult': 0.2442456179415793, 'bear_time_stop': 64, 'bear_use_sma': False, 'bear_use_ema': True, 'bear_use_atr': False, 'bear_use_adx': True, 'bear_use_spike': False, 'bear_rsi_required': True, 'sideways_strategy': 'breakout', 'sideways_bb_std_mult': 1.7108435259704748, 'sideways_rsi_os': 44, 'sideways_rsi_ob': 78, 'sideways_adx_thresh': 29.42490660751392, 'sideways_atr_min_pct': 0.015436613904602927, 'sideways_atr_max_pct': 0.126038985961162, 'sideways_tp_mult': 2.72027895281495, 'sideways_tsl_mult': 0.25527259263690494, 'sideways_time_stop': 165, 'sideways_use_sma': True, 'sideways_use_ema': True, 'sideways_use_atr': True, 'sideways_use_adx': True, 'sideways_use_spike': False, 'sideways_rsi_required': False}.
