[I 2025-09-01 14:07:48,649] Trial 280 finished with values: [-0.002917190811345116, 0.00740827730164217] and parameters: {'p_sma': 30, 'p_std': 30, 'p_atr': 27, 'p_adx': 8, 'rsi_period': 80, 'ema1': 12, 'ema2': 57, 'slip_atr_k': 0.02576870966352875, 'slip_spread_k': 0.6054010898585377, 'spread_hl_frac': 0.019535054281089183, 'bb_std_mult': 3.443314479216632, 'rsi_os': 42, 'rsi_ob': 53, 'vol_spike': 0.10507878322704928, 'adx_thresh': 6.1739336443412025, 'atr_min_pct': 0.010355742045405406, 'atr_max_pct': 0.03708072190451929, 'tp_mult': 1.4476955458418486, 'tsl_mult': 0.659834525737771, 'strategy': 'mean_reversion', 'time_stop': 109, 'use_sma': False, 'use_atr': False, 'use_adx': True, 'use_ema': True, 'use_spike': False, 'rsi_required': True, 'edge_k': 0.2517696397235553, 'edge_cap': 0.9619377984828037, 'bull_strategy': 'mean_reversion', 'bull_bb_std_mult': 3.130963728271105, 'bull_rsi_os': 11, 'bull_rsi_ob': 79, 'bull_adx_thresh': 13.096433732290247, 'bull_atr_min_pct': 0.012643138029138003, 'bull_atr_max_pct': 0.13106581661051295, 'bull_tp_mult': 1.6835514163601548, 'bull_tsl_mult': 0.46838609682692744, 'bull_time_stop': 159, 'bull_use_sma': True, 'bull_use_ema': False, 'bull_use_atr': True, 'bull_use_adx': False, 'bull_use_spike': True, 'bull_rsi_required': True, 'bear_strategy': 'mean_reversion', 'bear_bb_std_mult': 2.3803165990901687, 'bear_rsi_os': 34, 'bear_rsi_ob': 58, 'bear_adx_thresh': 8.577094037805905, 'bear_atr_min_pct': 0.0010685408614584226, 'bear_atr_max_pct': 0.10495074527643324, 'bear_tp_mult': 2.127200120962032, 'bear_tsl_mult': 0.07352992343978021, 'bear_time_stop': 101, 'bear_use_sma': True, 'bear_use_ema': False, 'bear_use_atr': True, 'bear_use_adx': False, 'bear_use_spike': True, 'bear_rsi_required': False, 'sideways_strategy': 'mean_reversion', 'sideways_bb_std_mult': 3.0536356635761996, 'sideways_rsi_os': 29, 'sideways_rsi_ob': 93, 'sideways_adx_thresh': 24.80357156691263, 'sideways_atr_min_pct': 0.0034091392804054856, 'sideways_atr_max_pct': 0.10630858828119316, 'sideways_tp_mult': 2.4567122784132884, 'sideways_tsl_mult': 0.3820922541982546, 'sideways_time_stop': 272, 'sideways_use_sma': True, 'sideways_use_ema': False, 'sideways_use_atr': False, 'sideways_use_adx': True, 'sideways_use_spike': True, 'sideways_rsi_required': True}.
[I 2025-09-01 14:07:49,505] Trial 281 finished with values: [-0.005383429031783793, 0.008001646066697635] and parameters: {'p_sma': 30, 'p_std': 30, 'p_atr': 27, 'p_adx': 9, 'rsi_period': 80, 'ema1': 14, 'ema2': 56, 'slip_atr_k': 0.027619886669751806, 'slip_spread_k': 0.602196697035225, 'spread_hl_frac': 0.02059705312087487, 'bb_std_mult': 3.4137972968119006, 'rsi_os': 40, 'rsi_ob': 54, 'vol_spike': 0.10235917606651794, 'adx_thresh': 6.1422749087747945, 'atr_min_pct': 0.010368696220124176, 'atr_max_pct': 0.0374940261420715, 'tp_mult': 1.3232828260119265, 'tsl_mult': 0.6806900982079194, 'strategy': 'mean_reversion', 'time_stop': 126, 'use_sma': False, 'use_atr': False, 'use_adx': True, 'use_ema': True, 'use_spike': False, 'rsi_required': True, 'edge_k': 0.24356461266456444, 'edge_cap': 0.9652510478612328, 'bull_strategy': 'mean_reversion', 'bull_bb_std_mult': 3.155543621613286, 'bull_rsi_os': 11, 'bull_rsi_ob': 79, 'bull_adx_thresh': 12.964955793380314, 'bull_atr_min_pct': 0.012589969292022139, 'bull_atr_max_pct': 0.13089018222943857, 'bull_tp_mult': 1.6748047789260356, 'bull_tsl_mult': 0.45566477949340317, 'bull_time_stop': 159, 'bull_use_sma': True, 'bull_use_ema': False, 'bull_use_atr': True, 'bull_use_adx': False, 'bull_use_spike': True, 'bull_rsi_required': True, 'bear_strategy': 'mean_reversion', 'bear_bb_std_mult': 2.3726770715182957, 'bear_rsi_os': 36, 'bear_rsi_ob': 59, 'bear_adx_thresh': 9.076139422772995, 'bear_atr_min_pct': 0.0012640812360261763, 'bear_atr_max_pct': 0.10471648608341771, 'bear_tp_mult': 2.051741850879535, 'bear_tsl_mult': 0.07727910987443588, 'bear_time_stop': 100, 'bear_use_sma': True, 'bear_use_ema': False, 'bear_use_atr': True, 'bear_use_adx': False, 'bear_use_spike': True, 'bear_rsi_required': False, 'sideways_strategy': 'mean_reversion', 'sideways_bb_std_mult': 3.0862857334545453, 'sideways_rsi_os': 29, 'sideways_rsi_ob': 91, 'sideways_adx_thresh': 24.01730293776518, 'sideways_atr_min_pct': 0.003195309747962326, 'sideways_atr_max_pct': 0.10476458729900083, 'sideways_tp_mult': 2.4351623690073314, 'sideways_tsl_mult': 0.4088651534345574, 'sideways_time_stop': 271, 'sideways_use_sma': True, 'sideways_use_ema': False, 'sideways_use_atr': False, 'sideways_use_adx': True, 'sideways_use_spike': True, 'sideways_rsi_required': True}.
[I 2025-09-01 14:07:50,393] Trial 279 finished with values: [0.007305184352004446, 0.004490628245291084] and parameters: {'p_sma': 30, 'p_std': 25, 'p_atr': 27, 'p_adx': 8, 'rsi_period': 79, 'ema1': 7, 'ema2': 55, 'slip_atr_k': 0.004861019260500717, 'slip_spread_k': 0.5552901880884948, 'spread_hl_frac': 0.009441758604173076, 'bb_std_mult': 3.4484633066471257, 'rsi_os': 49, 'rsi_ob': 53, 'vol_spike': 0.10397789738592464, 'adx_thresh': 6.192145103885518, 'atr_min_pct': 0.012542280168774988, 'atr_max_pct': 0.02665090015143647, 'tp_mult': 1.3349430822487443, 'tsl_mult': 0.6831432361858973, 'strategy': 'mean_reversion', 'time_stop': 108, 'use_sma': True, 'use_atr': False, 'use_adx': True, 'use_ema': True, 'use_spike': True, 'rsi_required': True, 'edge_k': 0.2521746175853228, 'edge_cap': 0.9663481192948905, 'bull_strategy': 'breakout', 'bull_bb_std_mult': 2.8157988660357294, 'bull_rsi_os': 13, 'bull_rsi_ob': 79, 'bull_adx_thresh': 9.039472778287836, 'bull_atr_min_pct': 0.012681390683828949, 'bull_atr_max_pct': 0.12878543653756147, 'bull_tp_mult': 1.578858583906772, 'bull_tsl_mult': 0.6647348872485306, 'bull_time_stop': 138, 'bull_use_sma': False, 'bull_use_ema': True, 'bull_use_atr': True, 'bull_use_adx': True, 'bull_use_spike': True, 'bull_rsi_required': True, 'bear_strategy': 'mean_reversion', 'bear_bb_std_mult': 2.55181048792784, 'bear_rsi_os': 36, 'bear_rsi_ob': 58, 'bear_adx_thresh': 7.237408977121274, 'bear_atr_min_pct': 0.002931137930264157, 'bear_atr_max_pct': 0.114587739860281, 'bear_tp_mult': 2.1174125474038394, 'bear_tsl_mult': 0.28056881907465675, 'bear_time_stop': 77, 'bear_use_sma': False, 'bear_use_ema': False, 'bear_use_atr': False, 'bear_use_adx': False, 'bear_use_spike': True, 'bear_rsi_required': False, 'sideways_strategy': 'mean_reversion', 'sideways_bb_std_mult': 3.08154929150827, 'sideways_rsi_os': 31, 'sideways_rsi_ob': 89, 'sideways_adx_thresh': 24.959385120961624, 'sideways_atr_min_pct': 0.0037045603622337165, 'sideways_atr_max_pct': 0.11299591443580279, 'sideways_tp_mult': 2.3786344199725606, 'sideways_tsl_mult': 0.3696739537063494, 'sideways_time_stop': 247, 'sideways_use_sma': True, 'sideways_use_ema': True, 'sideways_use_atr': True, 'sideways_use_adx': True, 'sideways_use_spike': False, 'sideways_rsi_required': False}.
[I 2025-09-01 14:07:50,889] Trial 282 finished with values: [0.003503989319685097, 0.003493523389007518] and parameters: {'p_sma': 29, 'p_std': 29, 'p_atr': 27, 'p_adx': 9, 'rsi_period': 80, 'ema1': 11, 'ema2': 57, 'slip_atr_k': 0.02629887764227328, 'slip_spread_k': 0.6036119160595652, 'spread_hl_frac': 0.011754067000931774, 'bb_std_mult': 3.432501199888773, 'rsi_os': 42, 'rsi_ob': 55, 'vol_spike': 0.09920121535280066, 'adx_thresh': 6.226237706408857, 'atr_min_pct': 0.010173556092569341, 'atr_max_pct': 0.03758495692157438, 'tp_mult': 1.3172196590347331, 'tsl_mult': 0.67610759505738, 'strategy': 'mean_reversion', 'time_stop': 116, 'use_sma': True, 'use_atr': False, 'use_adx': True, 'use_ema': True, 'use_spike': True, 'rsi_required': True, 'edge_k': 0.22865147647148118, 'edge_cap': 0.9915984819970594, 'bull_strategy': 'breakout', 'bull_bb_std_mult': 3.132537896379805, 'bull_rsi_os': 11, 'bull_rsi_ob': 80, 'bull_adx_thresh': 12.605430571954216, 'bull_atr_min_pct': 0.012696288751428416, 'bull_atr_max_pct': 0.13079482166459463, 'bull_tp_mult': 1.6481435032745735, 'bull_tsl_mult': 0.4478524542571442, 'bull_time_stop': 160, 'bull_use_sma': False, 'bull_use_ema': True, 'bull_use_atr': True, 'bull_use_adx': True, 'bull_use_spike': True, 'bull_rsi_required': True, 'bear_strategy': 'mean_reversion', 'bear_bb_std_mult': 2.372567429233999, 'bear_rsi_os': 34, 'bear_rsi_ob': 59, 'bear_adx_thresh': 8.82560451537745, 'bear_atr_min_pct': 0.00273012174982967, 'bear_atr_max_pct': 0.11429272960282236, 'bear_tp_mult': 2.128374095702565, 'bear_tsl_mult': 0.2979443232964733, 'bear_time_stop': 100, 'bear_use_sma': False, 'bear_use_ema': False, 'bear_use_atr': False, 'bear_use_adx': False, 'bear_use_spike': True, 'bear_rsi_required': False, 'sideways_strategy': 'mean_reversion', 'sideways_bb_std_mult': 3.0640761324250496, 'sideways_rsi_os': 29, 'sideways_rsi_ob': 93, 'sideways_adx_thresh': 24.196668054717147, 'sideways_atr_min_pct': 0.002989511109640382, 'sideways_atr_max_pct': 0.1058553382465188, 'sideways_tp_mult': 2.448536420154416, 'sideways_tsl_mult': 0.42137525029244977, 'sideways_time_stop': 269, 'sideways_use_sma': True, 'sideways_use_ema': True, 'sideways_use_atr': True, 'sideways_use_adx': True, 'sideways_use_spike': False, 'sideways_rsi_required': False}.
[I 2025-09-01 14:08:28,486] Trial 283 finished with values: [-0.0010432481043332054, 0.00676171616718183] and parameters: {'p_sma': 29, 'p_std': 31, 'p_atr': 27, 'p_adx': 9, 'rsi_period': 82, 'ema1': 11, 'ema2': 56, 'slip_atr_k': 0.021623424992276135, 'slip_spread_k': 0.583416111952159, 'spread_hl_frac': 0.01250148042346131, 'bb_std_mult': 3.4156517369508848, 'rsi_os': 42, 'rsi_ob': 55, 'vol_spike': 0.10358613400137784, 'adx_thresh': 6.187791455181613, 'atr_min_pct': 0.010702939035847006, 'atr_max_pct': 0.03425767337505968, 'tp_mult': 1.3270906895000845, 'tsl_mult': 0.6219535988252234, 'strategy': 'mean_reversion', 'time_stop': 128, 'use_sma': True, 'use_atr': False, 'use_adx': True, 'use_ema': True, 'use_spike': True, 'rsi_required': True, 'edge_k': 0.23369984534716146, 'edge_cap': 0.9989107175354701, 'bull_strategy': 'breakout', 'bull_bb_std_mult': 3.2155434886161802, 'bull_rsi_os': 13, 'bull_rsi_ob': 76, 'bull_adx_thresh': 12.67995169248596, 'bull_atr_min_pct': 0.012825376075987322, 'bull_atr_max_pct': 0.12930448085544746, 'bull_tp_mult': 1.6678063445919078, 'bull_tsl_mult': 0.42236697034825543, 'bull_time_stop': 169, 'bull_use_sma': False, 'bull_use_ema': True, 'bull_use_atr': True, 'bull_use_adx': True, 'bull_use_spike': True, 'bull_rsi_required': True, 'bear_strategy': 'mean_reversion', 'bear_bb_std_mult': 2.4327087608793727, 'bear_rsi_os': 36, 'bear_rsi_ob': 59, 'bear_adx_thresh': 8.709856564459065, 'bear_atr_min_pct': 0.0027770930478474534, 'bear_atr_max_pct': 0.11415475288435054, 'bear_tp_mult': 2.133554516402944, 'bear_tsl_mult': 0.2993859363382898, 'bear_time_stop': 98, 'bear_use_sma': False, 'bear_use_ema': False, 'bear_use_atr': False, 'bear_use_adx': False, 'bear_use_spike': True, 'bear_rsi_required': False, 'sideways_strategy': 'mean_reversion', 'sideways_bb_std_mult': 2.974560506035599, 'sideways_rsi_os': 31, 'sideways_rsi_ob': 92, 'sideways_adx_thresh': 24.145192511108032, 'sideways_atr_min_pct': 0.002902380769224988, 'sideways_atr_max_pct': 0.10707589620597917, 'sideways_tp_mult': 2.460051945240927, 'sideways_tsl_mult': 0.4206917465993784, 'sideways_time_stop': 274, 'sideways_use_sma': True, 'sideways_use_ema': True, 'sideways_use_atr': True, 'sideways_use_adx': True, 'sideways_use_spike': False, 'sideways_rsi_required': False}.
[I 2025-09-01 14:08:28,514] Trial 284 finished with values: [0.0009010533517759267, 0.007788446136903817] and parameters: {'p_sma': 31, 'p_std': 29, 'p_atr': 27, 'p_adx': 9, 'rsi_period': 81, 'ema1': 11, 'ema2': 56, 'slip_atr_k': 0.022769565721582757, 'slip_spread_k': 0.5902452205729132, 'spread_hl_frac': 0.012547178816817113, 'bb_std_mult': 3.4664785903067634, 'rsi_os': 42, 'rsi_ob': 55, 'vol_spike': 0.10372132015986733, 'adx_thresh': 5.790114377756332, 'atr_min_pct': 0.011183434470354692, 'atr_max_pct': 0.03260625058094787, 'tp_mult': 1.3274795233299557, 'tsl_mult': 0.6814043533836923, 'strategy': 'mean_reversion', 'time_stop': 118, 'use_sma': True, 'use_atr': False, 'use_adx': True, 'use_ema': True, 'use_spike': True, 'rsi_required': True, 'edge_k': 0.30033293550869755, 'edge_cap': 0.9968210887045524, 'bull_strategy': 'breakout', 'bull_bb_std_mult': 3.223412284392406, 'bull_rsi_os': 12, 'bull_rsi_ob': 76, 'bull_adx_thresh': 12.728615701435412, 'bull_atr_min_pct': 0.013982964587173923, 'bull_atr_max_pct': 0.13365039160602762, 'bull_tp_mult': 1.6171230157738001, 'bull_tsl_mult': 0.42004826338136175, 'bull_time_stop': 171, 'bull_use_sma': False, 'bull_use_ema': True, 'bull_use_atr': True, 'bull_use_adx': True, 'bull_use_spike': True, 'bull_rsi_required': True, 'bear_strategy': 'mean_reversion', 'bear_bb_std_mult': 2.590419099965572, 'bear_rsi_os': 36, 'bear_rsi_ob': 58, 'bear_adx_thresh': 8.805644357983441, 'bear_atr_min_pct': 0.0026383410179718716, 'bear_atr_max_pct': 0.11410353114146536, 'bear_tp_mult': 2.1456420944328705, 'bear_tsl_mult': 0.30799327937657106, 'bear_time_stop': 94, 'bear_use_sma': False, 'bear_use_ema': False, 'bear_use_atr': False, 'bear_use_adx': False, 'bear_use_spike': True, 'bear_rsi_required': False, 'sideways_strategy': 'mean_reversion', 'sideways_bb_std_mult': 2.983755241688361, 'sideways_rsi_os': 31, 'sideways_rsi_ob': 93, 'sideways_adx_thresh': 24.329601512163663, 'sideways_atr_min_pct': 0.0029642885483249044, 'sideways_atr_max_pct': 0.10873868389218, 'sideways_tp_mult': 2.3741682540396445, 'sideways_tsl_mult': 0.4192822265684663, 'sideways_time_stop': 267, 'sideways_use_sma': True, 'sideways_use_ema': True, 'sideways_use_atr': True, 'sideways_use_adx': True, 'sideways_use_spike': False, 'sideways_rsi_required': False}.
[I 2025-09-01 14:08:28,791] Trial 285 finished with values: [0.002805267041995574, 0.005579316587869168] and parameters: {'p_sma': 29, 'p_std': 29, 'p_atr': 27, 'p_adx': 9, 'rsi_period': 81, 'ema1': 10, 'ema2': 56, 'slip_atr_k': 0.021565302353009838, 'slip_spread_k': 0.5868634637694125, 'spread_hl_frac': 0.012335395888052924, 'bb_std_mult': 3.4050529845343838, 'rsi_os': 41, 'rsi_ob': 55, 'vol_spike': 0.09989972004317565, 'adx_thresh': 6.667476850012022, 'atr_min_pct': 0.011183259913849592, 'atr_max_pct': 0.035040434963303044, 'tp_mult': 1.3172233929270685, 'tsl_mult': 0.6699582512419033, 'strategy': 'mean_reversion', 'time_stop': 124, 'use_sma': True, 'use_atr': False, 'use_adx': True, 'use_ema': True, 'use_spike': True, 'rsi_required': True, 'edge_k': 0.3138254450533439, 'edge_cap': 0.9932883482331332, 'bull_strategy': 'breakout', 'bull_bb_std_mult': 3.2214071054397024, 'bull_rsi_os': 12, 'bull_rsi_ob': 80, 'bull_adx_thresh': 7.805286778827828, 'bull_atr_min_pct': 0.013932949117384984, 'bull_atr_max_pct': 0.13468682953036035, 'bull_tp_mult': 1.6250778947528042, 'bull_tsl_mult': 0.4288501403253009, 'bull_time_stop': 167, 'bull_use_sma': False, 'bull_use_ema': True, 'bull_use_atr': True, 'bull_use_adx': True, 'bull_use_spike': True, 'bull_rsi_required': True, 'bear_strategy': 'mean_reversion', 'bear_bb_std_mult': 2.4251233903057234, 'bear_rsi_os': 36, 'bear_rsi_ob': 58, 'bear_adx_thresh': 9.056183835845268, 'bear_atr_min_pct': 0.002690094876576571, 'bear_atr_max_pct': 0.11404572653932477, 'bear_tp_mult': 2.134168479424179, 'bear_tsl_mult': 0.28226820045325995, 'bear_time_stop': 92, 'bear_use_sma': False, 'bear_use_ema': False, 'bear_use_atr': False, 'bear_use_adx': False, 'bear_use_spike': True, 'bear_rsi_required': False, 'sideways_strategy': 'mean_reversion', 'sideways_bb_std_mult': 2.9520553663151228, 'sideways_rsi_os': 30, 'sideways_rsi_ob': 93, 'sideways_adx_thresh': 24.353171371286162, 'sideways_atr_min_pct': 0.0024277248515812773, 'sideways_atr_max_pct': 0.10454986457143399, 'sideways_tp_mult': 2.471785769953154, 'sideways_tsl_mult': 0.4245815165498413, 'sideways_time_stop': 268, 'sideways_use_sma': True, 'sideways_use_ema': True, 'sideways_use_atr': True, 'sideways_use_adx': True, 'sideways_use_spike': False, 'sideways_rsi_required': False}.
[I 2025-09-01 14:08:29,178] Trial 286 finished with values: [0.0008468608376099862, 0.0078096837909441205] and parameters: {'p_sma': 31, 'p_std': 29, 'p_atr': 27, 'p_adx': 9, 'rsi_period': 81, 'ema1': 11, 'ema2': 57, 'slip_atr_k': 0.02295547944014114, 'slip_spread_k': 0.5904333309217938, 'spread_hl_frac': 0.012696055836030706, 'bb_std_mult': 3.4158372889736666, 'rsi_os': 41, 'rsi_ob': 55, 'vol_spike': 0.09959743570288401, 'adx_thresh': 6.826777553161006, 'atr_min_pct': 0.011407301238685769, 'atr_max_pct': 0.035237504250159694, 'tp_mult': 1.3180748296114635, 'tsl_mult': 0.6781696744665218, 'strategy': 'mean_reversion', 'time_stop': 128, 'use_sma': True, 'use_atr': False, 'use_adx': True, 'use_ema': True, 'use_spike': True, 'rsi_required': True, 'edge_k': 0.31408488582929184, 'edge_cap': 0.9990747323033253, 'bull_strategy': 'breakout', 'bull_bb_std_mult': 3.2320265235322063, 'bull_rsi_os': 12, 'bull_rsi_ob': 80, 'bull_adx_thresh': 12.534359612500493, 'bull_atr_min_pct': 0.014281861829571191, 'bull_atr_max_pct': 0.13451098769254555, 'bull_tp_mult': 1.6174137712270829, 'bull_tsl_mult': 0.43402294243366496, 'bull_time_stop': 167, 'bull_use_sma': False, 'bull_use_ema': True, 'bull_use_atr': True, 'bull_use_adx': True, 'bull_use_spike': True, 'bull_rsi_required': True, 'bear_strategy': 'mean_reversion', 'bear_bb_std_mult': 2.6002104395636008, 'bear_rsi_os': 36, 'bear_rsi_ob': 59, 'bear_adx_thresh': 9.107545833138296, 'bear_atr_min_pct': 0.0026412885925520186, 'bear_atr_max_pct': 0.11377879852175928, 'bear_tp_mult': 2.161558187856137, 'bear_tsl_mult': 0.3006065793189823, 'bear_time_stop': 90, 'bear_use_sma': False, 'bear_use_ema': False, 'bear_use_atr': False, 'bear_use_adx': False, 'bear_use_spike': True, 'bear_rsi_required': False, 'sideways_strategy': 'mean_reversion', 'sideways_bb_std_mult': 2.9594939184816034, 'sideways_rsi_os': 30, 'sideways_rsi_ob': 92, 'sideways_adx_thresh': 24.47794790659308, 'sideways_atr_min_pct': 0.002397919838175333, 'sideways_atr_max_pct': 0.106316558716613, 'sideways_tp_mult': 2.375496763014799, 'sideways_tsl_mult': 0.41469872543325936, 'sideways_time_stop': 268, 'sideways_use_sma': True, 'sideways_use_ema': True, 'sideways_use_atr': True, 'sideways_use_adx': True, 'sideways_use_spike': False, 'sideways_rsi_required': False}.
[I 2025-09-01 14:09:06,284] Trial 289 finished with values: [-1000000000.0, 1000000000.0] and parameters: {'p_sma': 31, 'p_std': 29, 'p_atr': 28, 'p_adx': 9, 'rsi_period': 81, 'ema1': 10, 'ema2': 56, 'slip_atr_k': 0.022395326583433274, 'slip_spread_k': 0.5953290920326629, 'spread_hl_frac': 0.013215352329928645, 'bb_std_mult': 3.3616431325144767, 'rsi_os': 41, 'rsi_ob': 55, 'vol_spike': 0.10142444911545087, 'adx_thresh': 6.959345568442465, 'atr_min_pct': 0.011327870678616665, 'atr_max_pct': 0.03634026085426412, 'tp_mult': 1.2754885802621345, 'tsl_mult': 0.6824543386134997, 'strategy': 'mean_reversion', 'time_stop': 123, 'use_sma': True, 'use_atr': False, 'use_adx': True, 'use_ema': True, 'use_spike': True, 'rsi_required': True, 'edge_k': 0.29839278146489295, 'edge_cap': 0.9977698702309509, 'bull_strategy': 'breakout', 'bull_bb_std_mult': 3.238488196332257, 'bull_rsi_os': 12, 'bull_rsi_ob': 80, 'bull_adx_thresh': 12.521762383804695, 'bull_atr_min_pct': 0.014152943256382469, 'bull_atr_max_pct': 0.13416001541292671, 'bull_tp_mult': 1.6149841390582533, 'bull_tsl_mult': 0.44442047042488975, 'bull_time_stop': 154, 'bull_use_sma': False, 'bull_use_ema': True, 'bull_use_atr': True, 'bull_use_adx': True, 'bull_use_spike': True, 'bull_rsi_required': True, 'bear_strategy': 'mean_reversion', 'bear_bb_std_mult': 2.425397773184199, 'bear_rsi_os': 33, 'bear_rsi_ob': 59, 'bear_adx_thresh': 8.723639396957314, 'bear_atr_min_pct': 0.0026718913009469818, 'bear_atr_max_pct': 0.11440472712108236, 'bear_tp_mult': 2.203898128132427, 'bear_tsl_mult': 0.2812572537431396, 'bear_time_stop': 90, 'bear_use_sma': False, 'bear_use_ema': False, 'bear_use_atr': False, 'bear_use_adx': False, 'bear_use_spike': True, 'bear_rsi_required': False, 'sideways_strategy': 'mean_reversion', 'sideways_bb_std_mult': 2.8907045472217265, 'sideways_rsi_os': 30, 'sideways_rsi_ob': 93, 'sideways_adx_thresh': 24.51979701634479, 'sideways_atr_min_pct': 0.0021383642206965763, 'sideways_atr_max_pct': 0.10567063546796152, 'sideways_tp_mult': 2.3718756518532578, 'sideways_tsl_mult': 0.42665652024411416, 'sideways_time_stop': 267, 'sideways_use_sma': True, 'sideways_use_ema': True, 'sideways_use_atr': True, 'sideways_use_adx': True, 'sideways_use_spike': False, 'sideways_rsi_required': False}.
