[I 2025-09-01 13:38:12,337] Trial 69 finished with values: [-1000000000.0, 1000000000.0] and parameters: {'p_sma': 7, 'p_std': 25, 'p_atr': 9, 'p_adx': 25, 'rsi_period': 36, 'ema1': 8, 'ema2': 22, 'slip_atr_k': 0.23514323438506177, 'slip_spread_k': 0.40640043299998013, 'spread_hl_frac': 0.0036398834656254106, 'bb_std_mult': 1.968222317934769, 'rsi_os': 51, 'rsi_ob': 77, 'vol_spike': 0.11192292140092783, 'adx_thresh': 20.709402255150373, 'atr_min_pct': 0.01928695930514292, 'atr_max_pct': 0.096496222758403, 'tp_mult': 2.5143676017236483, 'tsl_mult': 0.05020125305804968, 'strategy': 'breakout', 'time_stop': 159, 'use_sma': False, 'use_atr': False, 'use_adx': False, 'use_ema': False, 'use_spike': False, 'rsi_required': True, 'edge_k': 1.0360215945482865, 'edge_cap': 0.9740846552349182, 'bull_strategy': 'breakout', 'bull_bb_std_mult': 2.098837770273443, 'bull_rsi_os': 18, 'bull_rsi_ob': 95, 'bull_adx_thresh': 5.080741384139333, 'bull_atr_min_pct': 0.020826317450370363, 'bull_atr_max_pct': 0.12419949252300298, 'bull_tp_mult': 1.5229876458359428, 'bull_tsl_mult': 0.43174946493333705, 'bull_time_stop': 295, 'bull_use_sma': False, 'bull_use_ema': True, 'bull_use_atr': False, 'bull_use_adx': True, 'bull_use_spike': False, 'bull_rsi_required': False, 'bear_strategy': 'mean_reversion', 'bear_bb_std_mult': 1.7716216826306614, 'bear_rsi_os': 11, 'bear_rsi_ob': 51, 'bear_adx_thresh': 5.064037332059739, 'bear_atr_min_pct': 0.011686577061980782, 'bear_atr_max_pct': 0.07198140958598395, 'bear_tp_mult': 2.247675445972583, 'bear_tsl_mult': 0.18021914318252102, 'bear_time_stop': 169, 'bear_use_sma': False, 'bear_use_ema': True, 'bear_use_atr': True, 'bear_use_adx': False, 'bear_use_spike': False, 'bear_rsi_required': True, 'sideways_strategy': 'breakout', 'sideways_bb_std_mult': 0.9547623251326338, 'sideways_rsi_os': 50, 'sideways_rsi_ob': 80, 'sideways_adx_thresh': 10.204185982357176, 'sideways_atr_min_pct': 0.015854297902587463, 'sideways_atr_max_pct': 0.12491080617223257, 'sideways_tp_mult': 2.041571682270584, 'sideways_tsl_mult': 0.6414627786898697, 'sideways_time_stop': 151, 'sideways_use_sma': False, 'sideways_use_ema': True, 'sideways_use_atr': True, 'sideways_use_adx': False, 'sideways_use_spike': False, 'sideways_rsi_required': False}.
[I 2025-09-01 13:38:52,221] Trial 73 finished with values: [-1000000000.0, 1000000000.0] and parameters: {'p_sma': 11, 'p_std': 22, 'p_atr': 22, 'p_adx': 18, 'rsi_period': 24, 'ema1': 29, 'ema2': 13, 'slip_atr_k': 0.026512251485664287, 'slip_spread_k': 0.8409048773948407, 'spread_hl_frac': 0.03547020516569956, 'bb_std_mult': 1.9285744116005454, 'rsi_os': 49, 'rsi_ob': 60, 'vol_spike': 0.06621446355264897, 'adx_thresh': 27.007233481807507, 'atr_min_pct': 0.005404553723692591, 'atr_max_pct': 0.03513375164091585, 'tp_mult': 1.9441444880287726, 'tsl_mult': 0.47698721836365177, 'strategy': 'breakout', 'time_stop': 118, 'use_sma': True, 'use_atr': True, 'use_adx': False, 'use_ema': True, 'use_spike': True, 'rsi_required': False, 'edge_k': 0.7999321405958566, 'edge_cap': 0.380104387432792, 'bull_strategy': 'breakout', 'bull_bb_std_mult': 1.773792168213113, 'bull_rsi_os': 18, 'bull_rsi_ob': 74, 'bull_adx_thresh': 10.218101052542051, 'bull_atr_min_pct': 0.028371129550061498, 'bull_atr_max_pct': 0.10614885774924203, 'bull_tp_mult': 1.6475315309933747, 'bull_tsl_mult': 0.004361910086343235, 'bull_time_stop': 72, 'bull_use_sma': False, 'bull_use_ema': True, 'bull_use_atr': False, 'bull_use_adx': True, 'bull_use_spike': False, 'bull_rsi_required': True, 'bear_strategy': 'breakout', 'bear_bb_std_mult': 3.457428569231215, 'bear_rsi_os': 19, 'bear_rsi_ob': 68, 'bear_adx_thresh': 8.933349505077533, 'bear_atr_min_pct': 0.00392517264767853, 'bear_atr_max_pct': 0.020994283449785982, 'bear_tp_mult': 1.2150743480246926, 'bear_tsl_mult': 0.12513767535178633, 'bear_time_stop': 61, 'bear_use_sma': False, 'bear_use_ema': True, 'bear_use_atr': False, 'bear_use_adx': True, 'bear_use_spike': True, 'bear_rsi_required': True, 'sideways_strategy': 'breakout', 'sideways_bb_std_mult': 1.4651095555640776, 'sideways_rsi_os': 37, 'sideways_rsi_ob': 57, 'sideways_adx_thresh': 13.441289015365072, 'sideways_atr_min_pct': 0.013851295417002044, 'sideways_atr_max_pct': 0.07830497092049363, 'sideways_tp_mult': 1.7902826483535166, 'sideways_tsl_mult': 0.2255907104232544, 'sideways_time_stop': 237, 'sideways_use_sma': False, 'sideways_use_ema': True, 'sideways_use_atr': True, 'sideways_use_adx': False, 'sideways_use_spike': False, 'sideways_rsi_required': True}.
[I 2025-09-01 13:38:52,963] Trial 75 finished with values: [-1000000000.0, 1000000000.0] and parameters: {'p_sma': 57, 'p_std': 22, 'p_atr': 10, 'p_adx': 15, 'rsi_period': 19, 'ema1': 29, 'ema2': 28, 'slip_atr_k': 0.026888346244915137, 'slip_spread_k': 0.5419683463329851, 'spread_hl_frac': 0.02000326594930745, 'bb_std_mult': 1.7415350605022455, 'rsi_os': 49, 'rsi_ob': 60, 'vol_spike': 0.12745483584625467, 'adx_thresh': 29.310835807642476, 'atr_min_pct': 0.015287915839552533, 'atr_max_pct': 0.03542182941932744, 'tp_mult': 2.9570835468196184, 'tsl_mult': 0.32436843867853715, 'strategy': 'breakout', 'time_stop': 117, 'use_sma': True, 'use_atr': True, 'use_adx': False, 'use_ema': True, 'use_spike': True, 'rsi_required': False, 'edge_k': 1.950127484106325, 'edge_cap': 0.3703665589661366, 'bull_strategy': 'breakout', 'bull_bb_std_mult': 0.9427808033192191, 'bull_rsi_os': 5, 'bull_rsi_ob': 54, 'bull_adx_thresh': 27.684711738114895, 'bull_atr_min_pct': 0.015227228728681295, 'bull_atr_max_pct': 0.04773317107671228, 'bull_tp_mult': 1.0904596011750574, 'bull_tsl_mult': 0.6869770448335948, 'bull_time_stop': 73, 'bull_use_sma': False, 'bull_use_ema': True, 'bull_use_atr': False, 'bull_use_adx': False, 'bull_use_spike': False, 'bull_rsi_required': True, 'bear_strategy': 'breakout', 'bear_bb_std_mult': 2.0685483944619145, 'bear_rsi_os': 19, 'bear_rsi_ob': 86, 'bear_adx_thresh': 9.007219565884643, 'bear_atr_min_pct': 0.024516852462017895, 'bear_atr_max_pct': 0.07199598980403939, 'bear_tp_mult': 2.001734061816279, 'bear_tsl_mult': 0.11743831045622945, 'bear_time_stop': 300, 'bear_use_sma': False, 'bear_use_ema': True, 'bear_use_atr': False, 'bear_use_adx': True, 'bear_use_spike': True, 'bear_rsi_required': True, 'sideways_strategy': 'breakout', 'sideways_bb_std_mult': 0.7338255983998339, 'sideways_rsi_os': 34, 'sideways_rsi_ob': 84, 'sideways_adx_thresh': 13.14137878774575, 'sideways_atr_min_pct': 0.013681817781078536, 'sideways_atr_max_pct': 0.1290974092293409, 'sideways_tp_mult': 2.4896608357852767, 'sideways_tsl_mult': 0.7945501784671035, 'sideways_time_stop': 285, 'sideways_use_sma': False, 'sideways_use_ema': True, 'sideways_use_atr': False, 'sideways_use_adx': False, 'sideways_use_spike': True, 'sideways_rsi_required': True}.
[I 2025-09-01 13:38:53,292] Trial 76 finished with values: [-1000000000.0, 1000000000.0] and parameters: {'p_sma': 14, 'p_std': 22, 'p_atr': 13, 'p_adx': 15, 'rsi_period': 24, 'ema1': 15, 'ema2': 28, 'slip_atr_k': 0.16249516491700805, 'slip_spread_k': 0.5459147590757345, 'spread_hl_frac': 0.03536839200709306, 'bb_std_mult': 2.251698568235025, 'rsi_os': 25, 'rsi_ob': 60, 'vol_spike': 0.14232835917804215, 'adx_thresh': 9.39183031514663, 'atr_min_pct': 0.005274604566190827, 'atr_max_pct': 0.035088981436068534, 'tp_mult': 2.3096978370245997, 'tsl_mult': 0.3370892721014037, 'strategy': 'breakout', 'time_stop': 118, 'use_sma': True, 'use_atr': True, 'use_adx': True, 'use_ema': True, 'use_spike': True, 'rsi_required': False, 'edge_k': 1.9898227548450513, 'edge_cap': 0.38728870170178176, 'bull_strategy': 'mean_reversion', 'bull_bb_std_mult': 1.7648335142378786, 'bull_rsi_os': 49, 'bull_rsi_ob': 54, 'bull_adx_thresh': 28.623901540840222, 'bull_atr_min_pct': 0.015235427197773774, 'bull_atr_max_pct': 0.10413053205874985, 'bull_tp_mult': 1.308976012552396, 'bull_tsl_mult': 0.031634986182613234, 'bull_time_stop': 103, 'bull_use_sma': False, 'bull_use_ema': True, 'bull_use_atr': False, 'bull_use_adx': False, 'bull_use_spike': False, 'bull_rsi_required': True, 'bear_strategy': 'breakout', 'bear_bb_std_mult': 2.0285459390218934, 'bear_rsi_os': 49, 'bear_rsi_ob': 61, 'bear_adx_thresh': 9.07474928256023, 'bear_atr_min_pct': 0.02468160982237257, 'bear_atr_max_pct': 0.09306134671646113, 'bear_tp_mult': 1.7718186495295243, 'bear_tsl_mult': 0.13008349564174557, 'bear_time_stop': 43, 'bear_use_sma': False, 'bear_use_ema': False, 'bear_use_atr': False, 'bear_use_adx': True, 'bear_use_spike': True, 'bear_rsi_required': True, 'sideways_strategy': 'breakout', 'sideways_bb_std_mult': 1.2321798134003485, 'sideways_rsi_os': 37, 'sideways_rsi_ob': 56, 'sideways_adx_thresh': 13.405323410439497, 'sideways_atr_min_pct': 0.013869065445690384, 'sideways_atr_max_pct': 0.12917802360448277, 'sideways_tp_mult': 2.5124905353626468, 'sideways_tsl_mult': 0.6053418700074493, 'sideways_time_stop': 115, 'sideways_use_sma': False, 'sideways_use_ema': True, 'sideways_use_atr': False, 'sideways_use_adx': False, 'sideways_use_spike': True, 'sideways_rsi_required': True}.
[I 2025-09-01 13:38:53,583] Trial 74 finished with values: [-1000000000.0, 1000000000.0] and parameters: {'p_sma': 14, 'p_std': 29, 'p_atr': 24, 'p_adx': 28, 'rsi_period': 24, 'ema1': 29, 'ema2': 28, 'slip_atr_k': 0.12844218747445496, 'slip_spread_k': 0.5528376564856186, 'spread_hl_frac': 0.01578796041805574, 'bb_std_mult': 1.7484335395592103, 'rsi_os': 49, 'rsi_ob': 81, 'vol_spike': 0.14082595884086083, 'adx_thresh': 20.135158934804956, 'atr_min_pct': 0.01523078990706692, 'atr_max_pct': 0.017836854104716898, 'tp_mult': 2.9591099077288305, 'tsl_mult': 0.3197512743677394, 'strategy': 'breakout', 'time_stop': 118, 'use_sma': True, 'use_atr': True, 'use_adx': False, 'use_ema': True, 'use_spike': True, 'rsi_required': False, 'edge_k': 1.9650691971229706, 'edge_cap': 0.8886138200495552, 'bull_strategy': 'breakout', 'bull_bb_std_mult': 1.776262489456498, 'bull_rsi_os': 48, 'bull_rsi_ob': 54, 'bull_adx_thresh': 27.42676785189589, 'bull_atr_min_pct': 0.015644799692514415, 'bull_atr_max_pct': 0.1144335789296562, 'bull_tp_mult': 1.087903390062086, 'bull_tsl_mult': 0.003227997845750785, 'bull_time_stop': 67, 'bull_use_sma': False, 'bull_use_ema': True, 'bull_use_atr': False, 'bull_use_adx': False, 'bull_use_spike': False, 'bull_rsi_required': True, 'bear_strategy': 'breakout', 'bear_bb_std_mult': 3.0645760283991557, 'bear_rsi_os': 20, 'bear_rsi_ob': 60, 'bear_adx_thresh': 8.578756337734811, 'bear_atr_min_pct': 0.024707205506156894, 'bear_atr_max_pct': 0.07320253254078854, 'bear_tp_mult': 1.749178116570257, 'bear_tsl_mult': 0.17502819272287212, 'bear_time_stop': 44, 'bear_use_sma': False, 'bear_use_ema': True, 'bear_use_atr': False, 'bear_use_adx': True, 'bear_use_spike': True, 'bear_rsi_required': True, 'sideways_strategy': 'breakout', 'sideways_bb_std_mult': 1.4964047192783925, 'sideways_rsi_os': 37, 'sideways_rsi_ob': 90, 'sideways_adx_thresh': 13.468554219226146, 'sideways_atr_min_pct': 0.014146693326743436, 'sideways_atr_max_pct': 0.12975782803449293, 'sideways_tp_mult': 2.4817253805704813, 'sideways_tsl_mult': 0.6080338276275039, 'sideways_time_stop': 210, 'sideways_use_sma': False, 'sideways_use_ema': True, 'sideways_use_atr': False, 'sideways_use_adx': False, 'sideways_use_spike': True, 'sideways_rsi_required': True}.
[I 2025-09-01 13:38:53,937] Trial 78 finished with values: [-1000000000.0, 1000000000.0] and parameters: {'p_sma': 14, 'p_std': 30, 'p_atr': 8, 'p_adx': 28, 'rsi_period': 27, 'ema1': 5, 'ema2': 34, 'slip_atr_k': 0.008959275751657761, 'slip_spread_k': 0.9327025944614324, 'spread_hl_frac': 0.008425095285159761, 'bb_std_mult': 1.5509595433276369, 'rsi_os': 26, 'rsi_ob': 82, 'vol_spike': 0.15791394038058648, 'adx_thresh': 22.291133760412322, 'atr_min_pct': 0.029219624909956346, 'atr_max_pct': 0.016948767275874986, 'tp_mult': 1.7490143027541243, 'tsl_mult': 0.8068508368815218, 'strategy': 'mean_reversion', 'time_stop': 288, 'use_sma': True, 'use_atr': True, 'use_adx': True, 'use_ema': False, 'use_spike': True, 'rsi_required': False, 'edge_k': 0.269305863806394, 'edge_cap': 0.917303397476158, 'bull_strategy': 'mean_reversion', 'bull_bb_std_mult': 1.4709541446473446, 'bull_rsi_os': 51, 'bull_rsi_ob': 57, 'bull_adx_thresh': 9.060519297076997, 'bull_atr_min_pct': 0.0011167610291331516, 'bull_atr_max_pct': 0.09568894985504162, 'bull_tp_mult': 1.3759978965831223, 'bull_tsl_mult': 0.14234496060845936, 'bull_time_stop': 280, 'bull_use_sma': True, 'bull_use_ema': False, 'bull_use_atr': True, 'bull_use_adx': False, 'bull_use_spike': True, 'bull_rsi_required': False, 'bear_strategy': 'breakout', 'bear_bb_std_mult': 3.0026565159333174, 'bear_rsi_os': 49, 'bear_rsi_ob': 73, 'bear_adx_thresh': 20.397560007517697, 'bear_atr_min_pct': 0.0016017995009027148, 'bear_atr_max_pct': 0.11711597373076542, 'bear_tp_mult': 2.1291374244006396, 'bear_tsl_mult': 0.5895218681442, 'bear_time_stop': 44, 'bear_use_sma': False, 'bear_use_ema': False, 'bear_use_atr': False, 'bear_use_adx': True, 'bear_use_spike': False, 'bear_rsi_required': True, 'sideways_strategy': 'breakout', 'sideways_bb_std_mult': 1.2740403184194595, 'sideways_rsi_os': 37, 'sideways_rsi_ob': 90, 'sideways_adx_thresh': 16.563747009728154, 'sideways_atr_min_pct': 0.018045125045177572, 'sideways_atr_max_pct': 0.13933604766151206, 'sideways_tp_mult': 2.7835163515569383, 'sideways_tsl_mult': 0.8534250734739595, 'sideways_time_stop': 207, 'sideways_use_sma': False, 'sideways_use_ema': True, 'sideways_use_atr': True, 'sideways_use_adx': False, 'sideways_use_spike': True, 'sideways_rsi_required': False}.
[I 2025-09-01 13:39:30,656] Trial 79 finished with values: [-0.0498846604126002, 0.049769999354341427] and parameters: {'p_sma': 20, 'p_std': 29, 'p_atr': 8, 'p_adx': 28, 'rsi_period': 43, 'ema1': 5, 'ema2': 30, 'slip_atr_k': 0.1306640289557375, 'slip_spread_k': 0.6691830750591748, 'spread_hl_frac': 0.007754926074130229, 'bb_std_mult': 1.8501412911415362, 'rsi_os': 27, 'rsi_ob': 92, 'vol_spike': 0.159141009098663, 'adx_thresh': 21.908122530136982, 'atr_min_pct': 0.013852942052722878, 'atr_max_pct': 0.08322661628824617, 'tp_mult': 1.8914658949716783, 'tsl_mult': 0.7972243974861486, 'strategy': 'mean_reversion', 'time_stop': 5, 'use_sma': True, 'use_atr': True, 'use_adx': True, 'use_ema': False, 'use_spike': True, 'rsi_required': False, 'edge_k': 0.925832625922355, 'edge_cap': 0.15299724661773295, 'bull_strategy': 'mean_reversion', 'bull_bb_std_mult': 2.6106006284918517, 'bull_rsi_os': 40, 'bull_rsi_ob': 57, 'bull_adx_thresh': 8.949780670807506, 'bull_atr_min_pct': 0.00030373417319352544, 'bull_atr_max_pct': 0.1451032502964027, 'bull_tp_mult': 1.3760750574613927, 'bull_tsl_mult': 0.7462197884527841, 'bull_time_stop': 179, 'bull_use_sma': True, 'bull_use_ema': False, 'bull_use_atr': True, 'bull_use_adx': True, 'bull_use_spike': True, 'bull_rsi_required': False, 'bear_strategy': 'breakout', 'bear_bb_std_mult': 3.03918870630334, 'bear_rsi_os': 16, 'bear_rsi_ob': 73, 'bear_adx_thresh': 7.515997056538907, 'bear_atr_min_pct': 0.02989737988625167, 'bear_atr_max_pct': 0.08052889052261644, 'bear_tp_mult': 1.7211306262794281, 'bear_tsl_mult': 0.6127086254121406, 'bear_time_stop': 33, 'bear_use_sma': True, 'bear_use_ema': False, 'bear_use_atr': False, 'bear_use_adx': True, 'bear_use_spike': False, 'bear_rsi_required': False, 'sideways_strategy': 'breakout', 'sideways_bb_std_mult': 1.6104523216842022, 'sideways_rsi_os': 34, 'sideways_rsi_ob': 90, 'sideways_adx_thresh': 5.310824755216142, 'sideways_atr_min_pct': 0.019601729139294453, 'sideways_atr_max_pct': 0.14264192410483398, 'sideways_tp_mult': 2.1603000380246327, 'sideways_tsl_mult': 0.8639350731612322, 'sideways_time_stop': 207, 'sideways_use_sma': False, 'sideways_use_ema': False, 'sideways_use_atr': True, 'sideways_use_adx': False, 'sideways_use_spike': False, 'sideways_rsi_required': False}.
[I 2025-09-01 13:39:31,142] Trial 80 finished with values: [-0.04117757025739177, 0.04101482303998995] and parameters: {'p_sma': 17, 'p_std': 33, 'p_atr': 12, 'p_adx': 28, 'rsi_period': 10, 'ema1': 27, 'ema2': 49, 'slip_atr_k': 0.18312713765481037, 'slip_spread_k': 0.3595640595388446, 'spread_hl_frac': 0.007581273827486904, 'bb_std_mult': 1.525472953644654, 'rsi_os': 23, 'rsi_ob': 72, 'vol_spike': 0.12725178234465614, 'adx_thresh': 22.13163671624402, 'atr_min_pct': 0.029526893983347437, 'atr_max_pct': 0.07141599398712298, 'tp_mult': 1.760523305657774, 'tsl_mult': 0.11426022690351395, 'strategy': 'mean_reversion', 'time_stop': 145, 'use_sma': True, 'use_atr': True, 'use_adx': True, 'use_ema': False, 'use_spike': False, 'rsi_required': False, 'edge_k': 0.9198921614791008, 'edge_cap': 0.30802773913241704, 'bull_strategy': 'mean_reversion', 'bull_bb_std_mult': 1.0340254296093299, 'bull_rsi_os': 41, 'bull_rsi_ob': 80, 'bull_adx_thresh': 8.706698166962356, 'bull_atr_min_pct': 7.702458011538474e-06, 'bull_atr_max_pct': 0.0970728331035404, 'bull_tp_mult': 2.8771952522065356, 'bull_tsl_mult': 0.13716984218517775, 'bull_time_stop': 122, 'bull_use_sma': True, 'bull_use_ema': False, 'bull_use_atr': True, 'bull_use_adx': True, 'bull_use_spike': True, 'bull_rsi_required': False, 'bear_strategy': 'breakout', 'bear_bb_std_mult': 3.298324203385585, 'bear_rsi_os': 16, 'bear_rsi_ob': 73, 'bear_adx_thresh': 20.302744377912997, 'bear_atr_min_pct': 0.008515737603565526, 'bear_atr_max_pct': 0.08053616386580131, 'bear_tp_mult': 2.1326649745814827, 'bear_tsl_mult': 0.5813392148879843, 'bear_time_stop': 32, 'bear_use_sma': True, 'bear_use_ema': False, 'bear_use_atr': False, 'bear_use_adx': True, 'bear_use_spike': False, 'bear_rsi_required': False, 'sideways_strategy': 'mean_reversion', 'sideways_bb_std_mult': 1.697729173482158, 'sideways_rsi_os': 53, 'sideways_rsi_ob': 92, 'sideways_adx_thresh': 24.6563431511456, 'sideways_atr_min_pct': 0.025900470321100308, 'sideways_atr_max_pct': 0.11420046934003059, 'sideways_tp_mult': 2.6451324137973975, 'sideways_tsl_mult': 0.6630495770910984, 'sideways_time_stop': 226, 'sideways_use_sma': False, 'sideways_use_ema': False, 'sideways_use_atr': True, 'sideways_use_adx': False, 'sideways_use_spike': False, 'sideways_rsi_required': False}.
[I 2025-09-01 13:39:31,719] Trial 81 finished with values: [-0.02186803035637186, 0.021755322909834268] and parameters: {'p_sma': 17, 'p_std': 33, 'p_atr': 12, 'p_adx': 22, 'rsi_period': 56, 'ema1': 18, 'ema2': 50, 'slip_atr_k': 0.05411551811548353, 'slip_spread_k': 0.6673725723391404, 'spread_hl_frac': 0.010092492201347699, 'bb_std_mult': 1.8635067140519446, 'rsi_os': 41, 'rsi_ob': 73, 'vol_spike': 0.17771198019570358, 'adx_thresh': 13.268821655699846, 'atr_min_pct': 0.012435034887701462, 'atr_max_pct': 0.02440938166633394, 'tp_mult': 2.1699255998894955, 'tsl_mult': 0.24734444012022133, 'strategy': 'mean_reversion', 'time_stop': 6, 'use_sma': True, 'use_atr': True, 'use_adx': False, 'use_ema': False, 'use_spike': False, 'rsi_required': False, 'edge_k': 0.9220945425458584, 'edge_cap': 0.13848644433312535, 'bull_strategy': 'breakout', 'bull_bb_std_mult': 2.628014706645797, 'bull_rsi_os': 54, 'bull_rsi_ob': 65, 'bull_adx_thresh': 19.009606894657068, 'bull_atr_min_pct': 3.0347281080381205e-06, 'bull_atr_max_pct': 0.04161155689713039, 'bull_tp_mult': 1.931122643715552, 'bull_tsl_mult': 0.5207646868068683, 'bull_time_stop': 121, 'bull_use_sma': True, 'bull_use_ema': False, 'bull_use_atr': True, 'bull_use_adx': True, 'bull_use_spike': True, 'bull_rsi_required': False, 'bear_strategy': 'breakout', 'bear_bb_std_mult': 1.2442163337535868, 'bear_rsi_os': 17, 'bear_rsi_ob': 53, 'bear_adx_thresh': 11.620011851927769, 'bear_atr_min_pct': 0.008478899134669746, 'bear_atr_max_pct': 0.08123232358461215, 'bear_tp_mult': 1.4227400850686878, 'bear_tsl_mult': 0.24760960294837564, 'bear_time_stop': 31, 'bear_use_sma': True, 'bear_use_ema': True, 'bear_use_atr': False, 'bear_use_adx': True, 'bear_use_spike': False, 'bear_rsi_required': False, 'sideways_strategy': 'mean_reversion', 'sideways_bb_std_mult': 1.627449061084389, 'sideways_rsi_os': 54, 'sideways_rsi_ob': 92, 'sideways_adx_thresh': 5.003673202191436, 'sideways_atr_min_pct': 0.019606179379983095, 'sideways_atr_max_pct': 0.11361032445476235, 'sideways_tp_mult': 1.1171019771090065, 'sideways_tsl_mult': 0.001421344321212159, 'sideways_time_stop': 225, 'sideways_use_sma': False, 'sideways_use_ema': False, 'sideways_use_atr': True, 'sideways_use_adx': False, 'sideways_use_spike': False, 'sideways_rsi_required': False}.
