[I 2025-09-01 13:33:22,176] Trial 36 finished with values: [-1000000000.0, 1000000000.0] and parameters: {'p_sma': 29, 'p_std': 20, 'p_atr': 14, 'p_adx': 28, 'rsi_period': 34, 'ema1': 9, 'ema2': 19, 'slip_atr_k': 0.022353284323258227, 'slip_spread_k': 0.6008419121788113, 'spread_hl_frac': 0.044448075304867544, 'bb_std_mult': 2.8120657368307893, 'rsi_os': 25, 'rsi_ob': 85, 'vol_spike': 0.17097732475958338, 'adx_thresh': 12.118043941771218, 'atr_min_pct': 0.018572816631107558, 'atr_max_pct': 0.05240363328920512, 'tp_mult': 1.5916536082382944, 'tsl_mult': 0.5410982966377376, 'strategy': 'mean_reversion', 'time_stop': 131, 'use_sma': True, 'use_atr': False, 'use_adx': False, 'use_ema': False, 'use_spike': True, 'rsi_required': True, 'edge_k': 0.023195113273570933, 'edge_cap': 0.11052072093077926, 'bull_strategy': 'mean_reversion', 'bull_bb_std_mult': 1.6936349945479328, 'bull_rsi_os': 46, 'bull_rsi_ob': 58, 'bull_adx_thresh': 16.957001246284022, 'bull_atr_min_pct': 0.02284362681942915, 'bull_atr_max_pct': 0.10803276985766178, 'bull_tp_mult': 1.48564149343794, 'bull_tsl_mult': 0.6662119625989897, 'bull_time_stop': 106, 'bull_use_sma': False, 'bull_use_ema': True, 'bull_use_atr': False, 'bull_use_adx': True, 'bull_use_spike': False, 'bull_rsi_required': False, 'bear_strategy': 'breakout', 'bear_bb_std_mult': 3.3905860142819453, 'bear_rsi_os': 7, 'bear_rsi_ob': 82, 'bear_adx_thresh': 15.731084214684508, 'bear_atr_min_pct': 0.002871020507681033, 'bear_atr_max_pct': 0.08227176131878346, 'bear_tp_mult': 1.7870135565856538, 'bear_tsl_mult': 0.6864303092843228, 'bear_time_stop': 78, 'bear_use_sma': True, 'bear_use_ema': False, 'bear_use_atr': False, 'bear_use_adx': False, 'bear_use_spike': False, 'bear_rsi_required': False, 'sideways_strategy': 'mean_reversion', 'sideways_bb_std_mult': 1.5769335096056842, 'sideways_rsi_os': 39, 'sideways_rsi_ob': 61, 'sideways_adx_thresh': 22.570901875285138, 'sideways_atr_min_pct': 0.023237641889139987, 'sideways_atr_max_pct': 0.13265796323452403, 'sideways_tp_mult': 1.023201387867771, 'sideways_tsl_mult': 0.5595018952577815, 'sideways_time_stop': 231, 'sideways_use_sma': False, 'sideways_use_ema': True, 'sideways_use_atr': False, 'sideways_use_adx': False, 'sideways_use_spike': False, 'sideways_rsi_required': False}.
[I 2025-09-01 13:33:22,690] Trial 35 finished with values: [-1000000000.0, 1000000000.0] and parameters: {'p_sma': 49, 'p_std': 33, 'p_atr': 21, 'p_adx': 24, 'rsi_period': 32, 'ema1': 25, 'ema2': 32, 'slip_atr_k': 0.019567717173206902, 'slip_spread_k': 0.8258760681224604, 'spread_hl_frac': 0.04297364120097405, 'bb_std_mult': 0.9214447282466809, 'rsi_os': 55, 'rsi_ob': 95, 'vol_spike': 0.25287632813470085, 'adx_thresh': 15.50398050408939, 'atr_min_pct': 0.0184418149744105, 'atr_max_pct': 0.0516055284166366, 'tp_mult': 2.169795374568796, 'tsl_mult': 0.2646561389670674, 'strategy': 'breakout', 'time_stop': 131, 'use_sma': True, 'use_atr': False, 'use_adx': False, 'use_ema': False, 'use_spike': True, 'rsi_required': False, 'edge_k': 0.03146033214251531, 'edge_cap': 0.3517999777079688, 'bull_strategy': 'breakout', 'bull_bb_std_mult': 1.6891168639335585, 'bull_rsi_os': 45, 'bull_rsi_ob': 65, 'bull_adx_thresh': 11.446181319872466, 'bull_atr_min_pct': 0.022653272841476096, 'bull_atr_max_pct': 0.10984716533295666, 'bull_tp_mult': 1.9718475786677923, 'bull_tsl_mult': 0.002519057155562221, 'bull_time_stop': 146, 'bull_use_sma': False, 'bull_use_ema': True, 'bull_use_atr': False, 'bull_use_adx': True, 'bull_use_spike': False, 'bull_rsi_required': False, 'bear_strategy': 'breakout', 'bear_bb_std_mult': 2.194209658007288, 'bear_rsi_os': 8, 'bear_rsi_ob': 83, 'bear_adx_thresh': 29.57902892716524, 'bear_atr_min_pct': 0.016639433303048477, 'bear_atr_max_pct': 0.1412551041892427, 'bear_tp_mult': 1.8220521772774585, 'bear_tsl_mult': 0.08536449332991286, 'bear_time_stop': 88, 'bear_use_sma': False, 'bear_use_ema': True, 'bear_use_atr': False, 'bear_use_adx': True, 'bear_use_spike': False, 'bear_rsi_required': True, 'sideways_strategy': 'mean_reversion', 'sideways_bb_std_mult': 1.523189711195309, 'sideways_rsi_os': 40, 'sideways_rsi_ob': 84, 'sideways_adx_thresh': 10.99908974059777, 'sideways_atr_min_pct': 0.0065360835848385975, 'sideways_atr_max_pct': 0.0836513975686514, 'sideways_tp_mult': 1.0102307561057255, 'sideways_tsl_mult': 0.7178614053855203, 'sideways_time_stop': 227, 'sideways_use_sma': False, 'sideways_use_ema': True, 'sideways_use_atr': True, 'sideways_use_adx': False, 'sideways_use_spike': False, 'sideways_rsi_required': False}.
[I 2025-09-01 13:33:23,088] Trial 37 finished with values: [-1000000000.0, 1000000000.0] and parameters: {'p_sma': 29, 'p_std': 20, 'p_atr': 20, 'p_adx': 28, 'rsi_period': 33, 'ema1': 25, 'ema2': 19, 'slip_atr_k': 0.018230522294336592, 'slip_spread_k': 0.7879074655623151, 'spread_hl_frac': 0.04132566431133535, 'bb_std_mult': 1.663343060604706, 'rsi_os': 25, 'rsi_ob': 75, 'vol_spike': 0.13363251180723784, 'adx_thresh': 11.838407628650081, 'atr_min_pct': 0.017202465293577184, 'atr_max_pct': 0.050785168058642235, 'tp_mult': 1.8991173842738913, 'tsl_mult': 0.5540256413741308, 'strategy': 'mean_reversion', 'time_stop': 128, 'use_sma': True, 'use_atr': False, 'use_adx': False, 'use_ema': False, 'use_spike': True, 'rsi_required': True, 'edge_k': 0.012563669361185137, 'edge_cap': 0.4931535441025504, 'bull_strategy': 'mean_reversion', 'bull_bb_std_mult': 0.9004543145046766, 'bull_rsi_os': 43, 'bull_rsi_ob': 71, 'bull_adx_thresh': 14.166362641841534, 'bull_atr_min_pct': 0.016536954539497897, 'bull_atr_max_pct': 0.11162653929574, 'bull_tp_mult': 1.8520611908429654, 'bull_tsl_mult': 0.17433422437580554, 'bull_time_stop': 108, 'bull_use_sma': False, 'bull_use_ema': True, 'bull_use_atr': False, 'bull_use_adx': True, 'bull_use_spike': False, 'bull_rsi_required': False, 'bear_strategy': 'breakout', 'bear_bb_std_mult': 2.507929889649727, 'bear_rsi_os': 7, 'bear_rsi_ob': 50, 'bear_adx_thresh': 19.41254881544081, 'bear_atr_min_pct': 0.017137923792700207, 'bear_atr_max_pct': 0.07806989926368837, 'bear_tp_mult': 1.8231190412077194, 'bear_tsl_mult': 0.6621757520707217, 'bear_time_stop': 7, 'bear_use_sma': True, 'bear_use_ema': False, 'bear_use_atr': False, 'bear_use_adx': False, 'bear_use_spike': False, 'bear_rsi_required': False, 'sideways_strategy': 'mean_reversion', 'sideways_bb_std_mult': 1.9594649375261917, 'sideways_rsi_os': 5, 'sideways_rsi_ob': 61, 'sideways_adx_thresh': 23.384204291540684, 'sideways_atr_min_pct': 0.00820203142054025, 'sideways_atr_max_pct': 0.1335374335351744, 'sideways_tp_mult': 1.0188850161897367, 'sideways_tsl_mult': 0.5972842771644327, 'sideways_time_stop': 226, 'sideways_use_sma': False, 'sideways_use_ema': True, 'sideways_use_atr': False, 'sideways_use_adx': False, 'sideways_use_spike': False, 'sideways_rsi_required': False}.
[I 2025-09-01 13:33:23,518] Trial 39 finished with values: [-1000000000.0, 1000000000.0] and parameters: {'p_sma': 28, 'p_std': 18, 'p_atr': 14, 'p_adx': 24, 'rsi_period': 52, 'ema1': 9, 'ema2': 35, 'slip_atr_k': 0.021059321899407665, 'slip_spread_k': 0.5741487905283575, 'spread_hl_frac': 0.04989088568674793, 'bb_std_mult': 2.806527504935646, 'rsi_os': 38, 'rsi_ob': 75, 'vol_spike': 0.22029281099606215, 'adx_thresh': 11.861647169252288, 'atr_min_pct': 0.029970306350868208, 'atr_max_pct': 0.053016315012053415, 'tp_mult': 2.3843150401152746, 'tsl_mult': 0.8968526616085145, 'strategy': 'breakout', 'time_stop': 34, 'use_sma': True, 'use_atr': False, 'use_adx': False, 'use_ema': True, 'use_spike': True, 'rsi_required': False, 'edge_k': 0.9783550738778846, 'edge_cap': 0.12041797280881178, 'bull_strategy': 'mean_reversion', 'bull_bb_std_mult': 0.9622934721952432, 'bull_rsi_os': 21, 'bull_rsi_ob': 67, 'bull_adx_thresh': 14.055539139149301, 'bull_atr_min_pct': 0.01611007320239013, 'bull_atr_max_pct': 0.10821892282228865, 'bull_tp_mult': 1.8296254093867144, 'bull_tsl_mult': 0.6690133339836113, 'bull_time_stop': 47, 'bull_use_sma': False, 'bull_use_ema': True, 'bull_use_atr': False, 'bull_use_adx': True, 'bull_use_spike': False, 'bull_rsi_required': False, 'bear_strategy': 'breakout', 'bear_bb_std_mult': 2.6055022516329434, 'bear_rsi_os': 18, 'bear_rsi_ob': 82, 'bear_adx_thresh': 15.4025382506389, 'bear_atr_min_pct': 0.016079028514664466, 'bear_atr_max_pct': 0.08467515834534031, 'bear_tp_mult': 2.060062629806946, 'bear_tsl_mult': 0.20514663279267342, 'bear_time_stop': 80, 'bear_use_sma': True, 'bear_use_ema': True, 'bear_use_atr': False, 'bear_use_adx': True, 'bear_use_spike': True, 'bear_rsi_required': False, 'sideways_strategy': 'mean_reversion', 'sideways_bb_std_mult': 1.5504689509846996, 'sideways_rsi_os': 32, 'sideways_rsi_ob': 69, 'sideways_adx_thresh': 31.259149302653107, 'sideways_atr_min_pct': 0.0039536751267478295, 'sideways_atr_max_pct': 0.08231869034760224, 'sideways_tp_mult': 2.83715573071351, 'sideways_tsl_mult': 0.4122525330292518, 'sideways_time_stop': 130, 'sideways_use_sma': False, 'sideways_use_ema': True, 'sideways_use_atr': True, 'sideways_use_adx': False, 'sideways_use_spike': True, 'sideways_rsi_required': True}.
[I 2025-09-01 13:34:07,383] Trial 42 finished with values: [-1000000000.0, 1000000000.0] and parameters: {'p_sma': 37, 'p_std': 28, 'p_atr': 26, 'p_adx': 11, 'rsi_period': 52, 'ema1': 19, 'ema2': 37, 'slip_atr_k': 0.14321712016286992, 'slip_spread_k': 0.3280552151615516, 'spread_hl_frac': 0.049630352702927434, 'bb_std_mult': 1.9203992738244364, 'rsi_os': 39, 'rsi_ob': 54, 'vol_spike': 0.2169972500567953, 'adx_thresh': 23.387054526367226, 'atr_min_pct': 0.00950121647764161, 'atr_max_pct': 0.09349821093043575, 'tp_mult': 1.2267454571295626, 'tsl_mult': 0.8691006382121897, 'strategy': 'breakout', 'time_stop': 169, 'use_sma': True, 'use_atr': True, 'use_adx': True, 'use_ema': True, 'use_spike': False, 'rsi_required': False, 'edge_k': 0.9831627318996574, 'edge_cap': 0.5970686405542225, 'bull_strategy': 'breakout', 'bull_bb_std_mult': 2.27731175433599, 'bull_rsi_os': 13, 'bull_rsi_ob': 85, 'bull_adx_thresh': 24.920446998242713, 'bull_atr_min_pct': 0.026585135563625566, 'bull_atr_max_pct': 0.07903220674957784, 'bull_tp_mult': 1.5862078436953657, 'bull_tsl_mult': 0.4920292532330753, 'bull_time_stop': 49, 'bull_use_sma': False, 'bull_use_ema': False, 'bull_use_atr': True, 'bull_use_adx': False, 'bull_use_spike': True, 'bull_rsi_required': True, 'bear_strategy': 'breakout', 'bear_bb_std_mult': 2.7255709009661135, 'bear_rsi_os': 13, 'bear_rsi_ob': 59, 'bear_adx_thresh': 22.86812565834256, 'bear_atr_min_pct': 0.020742366754879622, 'bear_atr_max_pct': 0.038703801915558646, 'bear_tp_mult': 2.3217918859226585, 'bear_tsl_mult': 0.953213364647996, 'bear_time_stop': 243, 'bear_use_sma': False, 'bear_use_ema': True, 'bear_use_atr': False, 'bear_use_adx': True, 'bear_use_spike': True, 'bear_rsi_required': False, 'sideways_strategy': 'breakout', 'sideways_bb_std_mult': 2.920681876305288, 'sideways_rsi_os': 32, 'sideways_rsi_ob': 67, 'sideways_adx_thresh': 31.244588079730157, 'sideways_atr_min_pct': 0.02705180273341798, 'sideways_atr_max_pct': 0.012272310448077861, 'sideways_tp_mult': 2.822776442724812, 'sideways_tsl_mult': 0.38965230656816835, 'sideways_time_stop': 190, 'sideways_use_sma': False, 'sideways_use_ema': False, 'sideways_use_atr': True, 'sideways_use_adx': False, 'sideways_use_spike': True, 'sideways_rsi_required': True}.
[I 2025-09-01 13:34:07,726] Trial 41 finished with values: [-1000000000.0, 1000000000.0] and parameters: {'p_sma': 43, 'p_std': 28, 'p_atr': 26, 'p_adx': 15, 'rsi_period': 82, 'ema1': 19, 'ema2': 37, 'slip_atr_k': 0.14219953458588408, 'slip_spread_k': 0.6619694984583285, 'spread_hl_frac': 0.04997222788258331, 'bb_std_mult': 1.686534745055572, 'rsi_os': 38, 'rsi_ob': 55, 'vol_spike': 0.13386029898856497, 'adx_thresh': 26.079191375729952, 'atr_min_pct': 0.0031124461930376983, 'atr_max_pct': 0.0752959430464214, 'tp_mult': 2.3938286552973547, 'tsl_mult': 0.3764607207717735, 'strategy': 'breakout', 'time_stop': 72, 'use_sma': True, 'use_atr': False, 'use_adx': True, 'use_ema': True, 'use_spike': False, 'rsi_required': False, 'edge_k': 1.5605620580430744, 'edge_cap': 0.9030255713399864, 'bull_strategy': 'mean_reversion', 'bull_bb_std_mult': 1.0695727894771494, 'bull_rsi_os': 12, 'bull_rsi_ob': 86, 'bull_adx_thresh': 14.144065059813865, 'bull_atr_min_pct': 0.016409320672467864, 'bull_atr_max_pct': 0.12275273967821955, 'bull_tp_mult': 2.999543799208431, 'bull_tsl_mult': 0.4504698262400352, 'bull_time_stop': 43, 'bull_use_sma': False, 'bull_use_ema': False, 'bull_use_atr': True, 'bull_use_adx': False, 'bull_use_spike': True, 'bull_rsi_required': True, 'bear_strategy': 'breakout', 'bear_bb_std_mult': 2.5887498754776885, 'bear_rsi_os': 18, 'bear_rsi_ob': 49, 'bear_adx_thresh': 9.893878952797952, 'bear_atr_min_pct': 0.021559406280996285, 'bear_atr_max_pct': 0.02487120075114757, 'bear_tp_mult': 2.6064188831036432, 'bear_tsl_mult': 0.9990217566466086, 'bear_time_stop': 239, 'bear_use_sma': True, 'bear_use_ema': True, 'bear_use_atr': False, 'bear_use_adx': False, 'bear_use_spike': True, 'bear_rsi_required': False, 'sideways_strategy': 'breakout', 'sideways_bb_std_mult': 2.047699609459043, 'sideways_rsi_os': 32, 'sideways_rsi_ob': 69, 'sideways_adx_thresh': 30.964106395569033, 'sideways_atr_min_pct': 0.02521038087086078, 'sideways_atr_max_pct': 0.010924917261401393, 'sideways_tp_mult': 2.814638809501397, 'sideways_tsl_mult': 0.4208290355942549, 'sideways_time_stop': 125, 'sideways_use_sma': False, 'sideways_use_ema': False, 'sideways_use_atr': True, 'sideways_use_adx': False, 'sideways_use_spike': True, 'sideways_rsi_required': True}.
[I 2025-09-01 13:34:08,054] Trial 43 finished with values: [-1000000000.0, 1000000000.0] and parameters: {'p_sma': 15, 'p_std': 27, 'p_atr': 12, 'p_adx': 10, 'rsi_period': 13, 'ema1': 7, 'ema2': 14, 'slip_atr_k': 0.1440228024443809, 'slip_spread_k': 0.4377903342763538, 'spread_hl_frac': 0.03316535704394259, 'bb_std_mult': 1.8846965980607084, 'rsi_os': 10, 'rsi_ob': 78, 'vol_spike': 0.02201064203384409, 'adx_thresh': 23.591130012554583, 'atr_min_pct': 0.0028125168561254684, 'atr_max_pct': 0.07700659375627569, 'tp_mult': 1.2328994822421828, 'tsl_mult': 0.3717279241324196, 'strategy': 'breakout', 'time_stop': 70, 'use_sma': True, 'use_atr': True, 'use_adx': True, 'use_ema': True, 'use_spike': False, 'rsi_required': False, 'edge_k': 1.619801738770724, 'edge_cap': 0.5684961163673787, 'bull_strategy': 'breakout', 'bull_bb_std_mult': 2.249244796451016, 'bull_rsi_os': 12, 'bull_rsi_ob': 85, 'bull_adx_thresh': 25.992485164989933, 'bull_atr_min_pct': 0.02666929648141532, 'bull_atr_max_pct': 0.09201373680004508, 'bull_tp_mult': 2.940997341998174, 'bull_tsl_mult': 0.4849900206880565, 'bull_time_stop': 263, 'bull_use_sma': True, 'bull_use_ema': False, 'bull_use_atr': True, 'bull_use_adx': False, 'bull_use_spike': True, 'bull_rsi_required': True, 'bear_strategy': 'mean_reversion', 'bear_bb_std_mult': 1.1031563252219283, 'bear_rsi_os': 14, 'bear_rsi_ob': 59, 'bear_adx_thresh': 12.518369357015562, 'bear_atr_min_pct': 0.019942651835274425, 'bear_atr_max_pct': 0.03271687008311807, 'bear_tp_mult': 1.2287021892157628, 'bear_tsl_mult': 0.8907080025079492, 'bear_time_stop': 248, 'bear_use_sma': False, 'bear_use_ema': True, 'bear_use_atr': True, 'bear_use_adx': False, 'bear_use_spike': True, 'bear_rsi_required': True, 'sideways_strategy': 'breakout', 'sideways_bb_std_mult': 3.0196412709390903, 'sideways_rsi_os': 19, 'sideways_rsi_ob': 90, 'sideways_adx_thresh': 20.01177534172805, 'sideways_atr_min_pct': 0.026915417817138024, 'sideways_atr_max_pct': 0.054440364238694666, 'sideways_tp_mult': 2.079635571482854, 'sideways_tsl_mult': 0.8100610248139348, 'sideways_time_stop': 187, 'sideways_use_sma': False, 'sideways_use_ema': False, 'sideways_use_atr': True, 'sideways_use_adx': False, 'sideways_use_spike': True, 'sideways_rsi_required': True}.
[I 2025-09-01 13:34:08,484] Trial 40 finished with values: [-1000000000.0, 1000000000.0] and parameters: {'p_sma': 15, 'p_std': 27, 'p_atr': 26, 'p_adx': 12, 'rsi_period': 48, 'ema1': 19, 'ema2': 36, 'slip_atr_k': 0.15236048291349064, 'slip_spread_k': 0.45648376471122404, 'spread_hl_frac': 0.032318437176624915, 'bb_std_mult': 1.6375946781680628, 'rsi_os': 38, 'rsi_ob': 75, 'vol_spike': 0.1340340704215947, 'adx_thresh': 26.196934577181477, 'atr_min_pct': 0.0037618212957038176, 'atr_max_pct': 0.07668595769012991, 'tp_mult': 2.3864102185492073, 'tsl_mult': 0.36889764645374656, 'strategy': 'breakout', 'time_stop': 68, 'use_sma': True, 'use_atr': False, 'use_adx': True, 'use_ema': True, 'use_spike': False, 'rsi_required': False, 'edge_k': 0.9801732454367837, 'edge_cap': 0.5936254531433812, 'bull_strategy': 'mean_reversion', 'bull_bb_std_mult': 3.2830963132595468, 'bull_rsi_os': 12, 'bull_rsi_ob': 68, 'bull_adx_thresh': 12.994238047161934, 'bull_atr_min_pct': 0.029560300060664606, 'bull_atr_max_pct': 0.09065111524544062, 'bull_tp_mult': 1.617885793746403, 'bull_tsl_mult': 0.8925589409496345, 'bull_time_stop': 48, 'bull_use_sma': False, 'bull_use_ema': False, 'bull_use_atr': True, 'bull_use_adx': False, 'bull_use_spike': True, 'bull_rsi_required': True, 'bear_strategy': 'breakout', 'bear_bb_std_mult': 2.580166713893433, 'bear_rsi_os': 18, 'bear_rsi_ob': 49, 'bear_adx_thresh': 12.146356241885483, 'bear_atr_min_pct': 0.011224730147290527, 'bear_atr_max_pct': 0.03131645010763688, 'bear_tp_mult': 2.0524303901607777, 'bear_tsl_mult': 0.9676872233049361, 'bear_time_stop': 164, 'bear_use_sma': True, 'bear_use_ema': True, 'bear_use_atr': False, 'bear_use_adx': False, 'bear_use_spike': True, 'bear_rsi_required': False, 'sideways_strategy': 'breakout', 'sideways_bb_std_mult': 1.9261284424191827, 'sideways_rsi_os': 34, 'sideways_rsi_ob': 67, 'sideways_adx_thresh': 31.304800124031118, 'sideways_atr_min_pct': 0.004523854136962676, 'sideways_atr_max_pct': 0.0577911748548451, 'sideways_tp_mult': 2.8081025490331903, 'sideways_tsl_mult': 0.0759606800179376, 'sideways_time_stop': 131, 'sideways_use_sma': False, 'sideways_use_ema': False, 'sideways_use_atr': True, 'sideways_use_adx': False, 'sideways_use_spike': True, 'sideways_rsi_required': True}.
[I 2025-09-01 13:34:50,524] Trial 46 finished with values: [-1000000000.0, 1000000000.0] and parameters: {'p_sma': 25, 'p_std': 23, 'p_atr': 8, 'p_adx': 26, 'rsi_period': 65, 'ema1': 5, 'ema2': 29, 'slip_atr_k': 0.0018186960511691018, 'slip_spread_k': 0.5401776633736816, 'spread_hl_frac': 0.016848698652797048, 'bb_std_mult': 2.042464855223001, 'rsi_os': 34, 'rsi_ob': 65, 'vol_spike': 0.20449765703771527, 'adx_thresh': 25.585165299198056, 'atr_min_pct': 0.015646683621175137, 'atr_max_pct': 0.021542020971792968, 'tp_mult': 1.871931417648256, 'tsl_mult': 0.6463769947331399, 'strategy': 'mean_reversion', 'time_stop': 154, 'use_sma': False, 'use_atr': True, 'use_adx': False, 'use_ema': False, 'use_spike': True, 'rsi_required': True, 'edge_k': 1.185453541400459, 'edge_cap': 0.23066005093282096, 'bull_strategy': 'breakout', 'bull_bb_std_mult': 1.2574823983467978, 'bull_rsi_os': 19, 'bull_rsi_ob': 56, 'bull_adx_thresh': 31.29385243001053, 'bull_atr_min_pct': 0.014157537326882448, 'bull_atr_max_pct': 0.07488717026163359, 'bull_tp_mult': 1.3292925801095998, 'bull_tsl_mult': 0.9043917990811379, 'bull_time_stop': 235, 'bull_use_sma': False, 'bull_use_ema': False, 'bull_use_atr': False, 'bull_use_adx': False, 'bull_use_spike': False, 'bull_rsi_required': True, 'bear_strategy': 'breakout', 'bear_bb_std_mult': 2.8979989962679125, 'bear_rsi_os': 26, 'bear_rsi_ob': 53, 'bear_adx_thresh': 19.04000781544198, 'bear_atr_min_pct': 0.023177526413830835, 'bear_atr_max_pct': 0.01513275427164193, 'bear_tp_mult': 1.6932017980712868, 'bear_tsl_mult': 0.30687387871261496, 'bear_time_stop': 149, 'bear_use_sma': False, 'bear_use_ema': False, 'bear_use_atr': False, 'bear_use_adx': True, 'bear_use_spike': False, 'bear_rsi_required': True, 'sideways_strategy': 'breakout', 'sideways_bb_std_mult': 2.686575724855844, 'sideways_rsi_os': 28, 'sideways_rsi_ob': 93, 'sideways_adx_thresh': 25.25045473268794, 'sideways_atr_min_pct': 0.021031048440021367, 'sideways_atr_max_pct': 0.029699992211832713, 'sideways_tp_mult': 2.6167670660193165, 'sideways_tsl_mult': 0.7216255699746695, 'sideways_time_stop': 258, 'sideways_use_sma': False, 'sideways_use_ema': False, 'sideways_use_atr': False, 'sideways_use_adx': False, 'sideways_use_spike': False, 'sideways_rsi_required': False}.
