[I 2025-09-01 15:01:45,780] Trial 649 finished with values: [-1000000000.0, 1000000000.0] and parameters: {'p_sma': 31, 'p_std': 25, 'p_atr': 26, 'p_adx': 20, 'rsi_period': 43, 'ema1': 10, 'ema2': 55, 'slip_atr_k': 0.01634679049542303, 'slip_spread_k': 0.5886625522171981, 'spread_hl_frac': 0.011598020078168651, 'bb_std_mult': 3.2617097252992386, 'rsi_os': 50, 'rsi_ob': 51, 'vol_spike': 0.2798418549734075, 'adx_thresh': 5.780294137238656, 'atr_min_pct': 0.010668584926075315, 'atr_max_pct': 0.03361104377400195, 'tp_mult': 2.773626516883906, 'tsl_mult': 0.6799577586467345, 'strategy': 'mean_reversion', 'time_stop': 73, 'use_sma': False, 'use_atr': False, 'use_adx': False, 'use_ema': True, 'use_spike': True, 'rsi_required': True, 'edge_k': 1.9987875901660563, 'edge_cap': 0.1576813093421257, 'bull_strategy': 'mean_reversion', 'bull_bb_std_mult': 3.1264568815430946, 'bull_rsi_os': 11, 'bull_rsi_ob': 67, 'bull_adx_thresh': 13.442602440963535, 'bull_atr_min_pct': 0.012893619659015972, 'bull_atr_max_pct': 0.13625761203460948, 'bull_tp_mult': 1.528909599876224, 'bull_tsl_mult': 0.2763051063647628, 'bull_time_stop': 20, 'bull_use_sma': False, 'bull_use_ema': True, 'bull_use_atr': True, 'bull_use_adx': True, 'bull_use_spike': False, 'bull_rsi_required': False, 'bear_strategy': 'mean_reversion', 'bear_bb_std_mult': 2.4026378006438533, 'bear_rsi_os': 35, 'bear_rsi_ob': 58, 'bear_adx_thresh': 26.401277937324274, 'bear_atr_min_pct': 0.018338400400974137, 'bear_atr_max_pct': 0.10274776375463615, 'bear_tp_mult': 1.7389090017684659, 'bear_tsl_mult': 0.17113885378590976, 'bear_time_stop': 109, 'bear_use_sma': False, 'bear_use_ema': False, 'bear_use_atr': False, 'bear_use_adx': False, 'bear_use_spike': False, 'bear_rsi_required': False, 'sideways_strategy': 'mean_reversion', 'sideways_bb_std_mult': 3.0244496570094825, 'sideways_rsi_os': 33, 'sideways_rsi_ob': 88, 'sideways_adx_thresh': 16.746460954447485, 'sideways_atr_min_pct': 0.01770559662115948, 'sideways_atr_max_pct': 0.1136083254880478, 'sideways_tp_mult': 2.3653549021255147, 'sideways_tsl_mult': 0.8197343625602207, 'sideways_time_stop': 268, 'sideways_use_sma': True, 'sideways_use_ema': True, 'sideways_use_atr': False, 'sideways_use_adx': False, 'sideways_use_spike': True, 'sideways_rsi_required': False}.
[I 2025-09-01 15:02:23,393] Trial 647 finished with values: [-1000000000.0, 1000000000.0] and parameters: {'p_sma': 31, 'p_std': 23, 'p_atr': 26, 'p_adx': 20, 'rsi_period': 81, 'ema1': 27, 'ema2': 55, 'slip_atr_k': 0.016443291722863462, 'slip_spread_k': 0.5901870664110637, 'spread_hl_frac': 0.018849922001994143, 'bb_std_mult': 3.2415041036954046, 'rsi_os': 44, 'rsi_ob': 90, 'vol_spike': 0.0563913397695739, 'adx_thresh': 27.443645567010638, 'atr_min_pct': 0.012955969165598043, 'atr_max_pct': 0.0330436124464233, 'tp_mult': 1.8425967499524893, 'tsl_mult': 0.9725894461430544, 'strategy': 'mean_reversion', 'time_stop': 48, 'use_sma': True, 'use_atr': False, 'use_adx': True, 'use_ema': True, 'use_spike': True, 'rsi_required': True, 'edge_k': 1.9750760503509537, 'edge_cap': 0.3138059791426887, 'bull_strategy': 'mean_reversion', 'bull_bb_std_mult': 3.302274289127794, 'bull_rsi_os': 12, 'bull_rsi_ob': 79, 'bull_adx_thresh': 12.212515246176629, 'bull_atr_min_pct': 0.011354152067772658, 'bull_atr_max_pct': 0.12618961308982668, 'bull_tp_mult': 1.2085546804372918, 'bull_tsl_mult': 0.8840429982127982, 'bull_time_stop': 129, 'bull_use_sma': False, 'bull_use_ema': True, 'bull_use_atr': True, 'bull_use_adx': True, 'bull_use_spike': True, 'bull_rsi_required': False, 'bear_strategy': 'mean_reversion', 'bear_bb_std_mult': 2.394362862204928, 'bear_rsi_os': 27, 'bear_rsi_ob': 56, 'bear_adx_thresh': 8.08129590343713, 'bear_atr_min_pct': 0.0171607400217528, 'bear_atr_max_pct': 0.11765052979300242, 'bear_tp_mult': 1.1005428738805225, 'bear_tsl_mult': 0.16177912702763833, 'bear_time_stop': 106, 'bear_use_sma': False, 'bear_use_ema': False, 'bear_use_atr': False, 'bear_use_adx': False, 'bear_use_spike': True, 'bear_rsi_required': False, 'sideways_strategy': 'mean_reversion', 'sideways_bb_std_mult': 3.3608929086155195, 'sideways_rsi_os': 5, 'sideways_rsi_ob': 56, 'sideways_adx_thresh': 15.280388504594523, 'sideways_atr_min_pct': 0.012884399940189882, 'sideways_atr_max_pct': 0.11340469262625771, 'sideways_tp_mult': 1.4138603739263516, 'sideways_tsl_mult': 0.8957946529900258, 'sideways_time_stop': 262, 'sideways_use_sma': True, 'sideways_use_ema': True, 'sideways_use_atr': False, 'sideways_use_adx': True, 'sideways_use_spike': False, 'sideways_rsi_required': False}.
[I 2025-09-01 15:02:24,313] Trial 650 finished with values: [-1000000000.0, 1000000000.0] and parameters: {'p_sma': 31, 'p_std': 52, 'p_atr': 26, 'p_adx': 13, 'rsi_period': 52, 'ema1': 10, 'ema2': 55, 'slip_atr_k': 0.01594690775508888, 'slip_spread_k': 0.5919997939125534, 'spread_hl_frac': 0.013688102235840886, 'bb_std_mult': 3.1987771717263938, 'rsi_os': 16, 'rsi_ob': 63, 'vol_spike': 0.05396228819199804, 'adx_thresh': 20.55001080474894, 'atr_min_pct': 0.025608646152673012, 'atr_max_pct': 0.10769928751753992, 'tp_mult': 2.365236178786411, 'tsl_mult': 0.6838700202181046, 'strategy': 'mean_reversion', 'time_stop': 287, 'use_sma': False, 'use_atr': False, 'use_adx': False, 'use_ema': True, 'use_spike': True, 'rsi_required': True, 'edge_k': 0.6339156905340231, 'edge_cap': 0.391394080682326, 'bull_strategy': 'mean_reversion', 'bull_bb_std_mult': 3.134008752041212, 'bull_rsi_os': 37, 'bull_rsi_ob': 83, 'bull_adx_thresh': 10.75586123034915, 'bull_atr_min_pct': 0.01307429275141594, 'bull_atr_max_pct': 0.13592317738232224, 'bull_tp_mult': 1.5393467528701013, 'bull_tsl_mult': 0.4454744121316619, 'bull_time_stop': 129, 'bull_use_sma': False, 'bull_use_ema': True, 'bull_use_atr': True, 'bull_use_adx': True, 'bull_use_spike': False, 'bull_rsi_required': False, 'bear_strategy': 'mean_reversion', 'bear_bb_std_mult': 0.8658146377808651, 'bear_rsi_os': 35, 'bear_rsi_ob': 58, 'bear_adx_thresh': 9.382537835468959, 'bear_atr_min_pct': 0.0279733044308842, 'bear_atr_max_pct': 0.10356015553531597, 'bear_tp_mult': 1.3711619066529181, 'bear_tsl_mult': 0.16520736866984934, 'bear_time_stop': 146, 'bear_use_sma': False, 'bear_use_ema': False, 'bear_use_atr': False, 'bear_use_adx': False, 'bear_use_spike': False, 'bear_rsi_required': False, 'sideways_strategy': 'mean_reversion', 'sideways_bb_std_mult': 2.1580263464957112, 'sideways_rsi_os': 33, 'sideways_rsi_ob': 70, 'sideways_adx_thresh': 25.09656273593734, 'sideways_atr_min_pct': 0.003870160190360122, 'sideways_atr_max_pct': 0.11381853635382155, 'sideways_tp_mult': 2.3554944579266963, 'sideways_tsl_mult': 0.4308246848195822, 'sideways_time_stop': 268, 'sideways_use_sma': True, 'sideways_use_ema': True, 'sideways_use_atr': False, 'sideways_use_adx': False, 'sideways_use_spike': True, 'sideways_rsi_required': False}.
[I 2025-09-01 15:02:28,156] Trial 652 finished with values: [-1000000000.0, 1000000000.0] and parameters: {'p_sma': 27, 'p_std': 42, 'p_atr': 26, 'p_adx': 8, 'rsi_period': 75, 'ema1': 11, 'ema2': 58, 'slip_atr_k': 0.00871297604446841, 'slip_spread_k': 0.5308674443982226, 'spread_hl_frac': 0.013219701830200749, 'bb_std_mult': 1.2939014116107765, 'rsi_os': 40, 'rsi_ob': 52, 'vol_spike': 0.05425723034971845, 'adx_thresh': 27.366852842682782, 'atr_min_pct': 0.020786233973695348, 'atr_max_pct': 0.06706789918893796, 'tp_mult': 1.3802791500547014, 'tsl_mult': 0.7573669903424968, 'strategy': 'mean_reversion', 'time_stop': 132, 'use_sma': False, 'use_atr': False, 'use_adx': True, 'use_ema': False, 'use_spike': True, 'rsi_required': True, 'edge_k': 0.3597397867042662, 'edge_cap': 0.960573268797709, 'bull_strategy': 'breakout', 'bull_bb_std_mult': 3.206578706986531, 'bull_rsi_os': 35, 'bull_rsi_ob': 83, 'bull_adx_thresh': 10.902068486684596, 'bull_atr_min_pct': 0.011019179331941785, 'bull_atr_max_pct': 0.052546283534138954, 'bull_tp_mult': 1.6132039247828451, 'bull_tsl_mult': 0.4467822684794269, 'bull_time_stop': 147, 'bull_use_sma': False, 'bull_use_ema': True, 'bull_use_atr': True, 'bull_use_adx': True, 'bull_use_spike': True, 'bull_rsi_required': True, 'bear_strategy': 'mean_reversion', 'bear_bb_std_mult': 3.027132097026832, 'bear_rsi_os': 33, 'bear_rsi_ob': 58, 'bear_adx_thresh': 9.43567805824094, 'bear_atr_min_pct': 0.006092747085442579, 'bear_atr_max_pct': 0.0799796228907401, 'bear_tp_mult': 1.9894702578225458, 'bear_tsl_mult': 0.08607810317255257, 'bear_time_stop': 82, 'bear_use_sma': False, 'bear_use_ema': False, 'bear_use_atr': False, 'bear_use_adx': False, 'bear_use_spike': True, 'bear_rsi_required': False, 'sideways_strategy': 'mean_reversion', 'sideways_bb_std_mult': 3.3153288764098345, 'sideways_rsi_os': 34, 'sideways_rsi_ob': 69, 'sideways_adx_thresh': 24.9663278683057, 'sideways_atr_min_pct': 0.005932221528607521, 'sideways_atr_max_pct': 0.010313460430428953, 'sideways_tp_mult': 1.6795823638396743, 'sideways_tsl_mult': 0.8861126021475192, 'sideways_time_stop': 161, 'sideways_use_sma': True, 'sideways_use_ema': True, 'sideways_use_atr': True, 'sideways_use_adx': True, 'sideways_use_spike': False, 'sideways_rsi_required': True}.
[I 2025-09-01 15:02:29,067] Trial 651 finished with values: [-1000000000.0, 1000000000.0] and parameters: {'p_sma': 50, 'p_std': 24, 'p_atr': 26, 'p_adx': 30, 'rsi_period': 81, 'ema1': 11, 'ema2': 55, 'slip_atr_k': 0.06610388137317214, 'slip_spread_k': 0.5273386195583609, 'spread_hl_frac': 0.01872395605739908, 'bb_std_mult': 3.3073188172994916, 'rsi_os': 40, 'rsi_ob': 52, 'vol_spike': 0.1273551944159329, 'adx_thresh': 20.58681692539976, 'atr_min_pct': 0.020901394377467793, 'atr_max_pct': 0.14258803435869394, 'tp_mult': 2.6309971094861933, 'tsl_mult': 0.6842959138590727, 'strategy': 'mean_reversion', 'time_stop': 69, 'use_sma': False, 'use_atr': False, 'use_adx': False, 'use_ema': False, 'use_spike': True, 'rsi_required': True, 'edge_k': 0.201431437771389, 'edge_cap': 0.15156655241924816, 'bull_strategy': 'mean_reversion', 'bull_bb_std_mult': 2.229636924818492, 'bull_rsi_os': 48, 'bull_rsi_ob': 72, 'bull_adx_thresh': 10.719690379207238, 'bull_atr_min_pct': 0.013622907782162293, 'bull_atr_max_pct': 0.10445165210716435, 'bull_tp_mult': 1.8473123418364545, 'bull_tsl_mult': 0.44568334660875364, 'bull_time_stop': 146, 'bull_use_sma': False, 'bull_use_ema': True, 'bull_use_atr': True, 'bull_use_adx': True, 'bull_use_spike': False, 'bull_rsi_required': False, 'bear_strategy': 'mean_reversion', 'bear_bb_std_mult': 3.024915277243154, 'bear_rsi_os': 36, 'bear_rsi_ob': 93, 'bear_adx_thresh': 10.443636102949693, 'bear_atr_min_pct': 0.01827105135597098, 'bear_atr_max_pct': 0.1186989477237406, 'bear_tp_mult': 2.9941405469761833, 'bear_tsl_mult': 0.0852941928503674, 'bear_time_stop': 73, 'bear_use_sma': False, 'bear_use_ema': False, 'bear_use_atr': False, 'bear_use_adx': False, 'bear_use_spike': False, 'bear_rsi_required': False, 'sideways_strategy': 'mean_reversion', 'sideways_bb_std_mult': 2.951896138303303, 'sideways_rsi_os': 13, 'sideways_rsi_ob': 89, 'sideways_adx_thresh': 25.507943768273652, 'sideways_atr_min_pct': 0.0030875620659766706, 'sideways_atr_max_pct': 0.11339148863910312, 'sideways_tp_mult': 2.351921302267529, 'sideways_tsl_mult': 0.5214967430743209, 'sideways_time_stop': 271, 'sideways_use_sma': True, 'sideways_use_ema': True, 'sideways_use_atr': True, 'sideways_use_adx': False, 'sideways_use_spike': True, 'sideways_rsi_required': True}.
[I 2025-09-01 15:03:18,038] Trial 656 finished with values: [-1000000000.0, 1000000000.0] and parameters: {'p_sma': 29, 'p_std': 27, 'p_atr': 27, 'p_adx': 25, 'rsi_period': 84, 'ema1': 8, 'ema2': 13, 'slip_atr_k': 0.17337967911697408, 'slip_spread_k': 0.5037978457616501, 'spread_hl_frac': 0.00623863594699852, 'bb_std_mult': 3.4353811468002293, 'rsi_os': 45, 'rsi_ob': 53, 'vol_spike': 0.11474981825562641, 'adx_thresh': 19.003194118524753, 'atr_min_pct': 0.011712289153727134, 'atr_max_pct': 0.03768358246422314, 'tp_mult': 1.0104233530824502, 'tsl_mult': 0.6105101346173849, 'strategy': 'breakout', 'time_stop': 157, 'use_sma': True, 'use_atr': True, 'use_adx': True, 'use_ema': True, 'use_spike': True, 'rsi_required': False, 'edge_k': 0.32117525240964045, 'edge_cap': 0.9318694603470873, 'bull_strategy': 'breakout', 'bull_bb_std_mult': 3.2126082614283598, 'bull_rsi_os': 15, 'bull_rsi_ob': 49, 'bull_adx_thresh': 11.727711396079211, 'bull_atr_min_pct': 0.007407364923495585, 'bull_atr_max_pct': 0.130506463019402, 'bull_tp_mult': 1.6357887727383436, 'bull_tsl_mult': 0.2191531062307775, 'bull_time_stop': 261, 'bull_use_sma': False, 'bull_use_ema': False, 'bull_use_atr': True, 'bull_use_adx': False, 'bull_use_spike': True, 'bull_rsi_required': True, 'bear_strategy': 'breakout', 'bear_bb_std_mult': 1.274650592177831, 'bear_rsi_os': 52, 'bear_rsi_ob': 60, 'bear_adx_thresh': 6.732902204727733, 'bear_atr_min_pct': 0.0038477667279009546, 'bear_atr_max_pct': 0.1102016516246192, 'bear_tp_mult': 2.0114881273289225, 'bear_tsl_mult': 0.10443421509559896, 'bear_time_stop': 81, 'bear_use_sma': True, 'bear_use_ema': True, 'bear_use_atr': True, 'bear_use_adx': True, 'bear_use_spike': True, 'bear_rsi_required': False, 'sideways_strategy': 'mean_reversion', 'sideways_bb_std_mult': 1.5469120157699074, 'sideways_rsi_os': 15, 'sideways_rsi_ob': 50, 'sideways_adx_thresh': 14.300744682216154, 'sideways_atr_min_pct': 0.0038208006536924874, 'sideways_atr_max_pct': 0.10285935868034651, 'sideways_tp_mult': 2.935145556664158, 'sideways_tsl_mult': 0.37589351191787335, 'sideways_time_stop': 284, 'sideways_use_sma': True, 'sideways_use_ema': True, 'sideways_use_atr': True, 'sideways_use_adx': True, 'sideways_use_spike': False, 'sideways_rsi_required': False}.
[I 2025-09-01 15:03:18,298] Trial 654 finished with values: [-1000000000.0, 1000000000.0] and parameters: {'p_sma': 27, 'p_std': 48, 'p_atr': 15, 'p_adx': 30, 'rsi_period': 75, 'ema1': 29, 'ema2': 48, 'slip_atr_k': 0.009292311529272148, 'slip_spread_k': 0.5632779920763855, 'spread_hl_frac': 0.004085991713184255, 'bb_std_mult': 3.4297048012100166, 'rsi_os': 40, 'rsi_ob': 52, 'vol_spike': 0.1281699725245152, 'adx_thresh': 32.50711295544669, 'atr_min_pct': 0.011787361443670066, 'atr_max_pct': 0.06847317977557787, 'tp_mult': 1.1968563466923183, 'tsl_mult': 0.659037209316164, 'strategy': 'breakout', 'time_stop': 130, 'use_sma': True, 'use_atr': False, 'use_adx': True, 'use_ema': False, 'use_spike': True, 'rsi_required': False, 'edge_k': 0.36569769603511604, 'edge_cap': 0.7379319715630596, 'bull_strategy': 'breakout', 'bull_bb_std_mult': 3.198787840225257, 'bull_rsi_os': 48, 'bull_rsi_ob': 94, 'bull_adx_thresh': 11.522456686243451, 'bull_atr_min_pct': 0.025757837711585994, 'bull_atr_max_pct': 0.12936860491518862, 'bull_tp_mult': 2.2575431120813496, 'bull_tsl_mult': 0.4687407281366023, 'bull_time_stop': 161, 'bull_use_sma': False, 'bull_use_ema': True, 'bull_use_atr': True, 'bull_use_adx': True, 'bull_use_spike': True, 'bull_rsi_required': True, 'bear_strategy': 'breakout', 'bear_bb_std_mult': 2.53660510897855, 'bear_rsi_os': 33, 'bear_rsi_ob': 55, 'bear_adx_thresh': 18.05955745160642, 'bear_atr_min_pct': 0.005350146215422189, 'bear_atr_max_pct': 0.10937897252401318, 'bear_tp_mult': 2.992068235082364, 'bear_tsl_mult': 0.09101702638608207, 'bear_time_stop': 20, 'bear_use_sma': False, 'bear_use_ema': True, 'bear_use_atr': True, 'bear_use_adx': True, 'bear_use_spike': True, 'bear_rsi_required': False, 'sideways_strategy': 'mean_reversion', 'sideways_bb_std_mult': 1.7093323161737775, 'sideways_rsi_os': 25, 'sideways_rsi_ob': 68, 'sideways_adx_thresh': 25.643436409448775, 'sideways_atr_min_pct': 0.003022938731136792, 'sideways_atr_max_pct': 0.07468182945331149, 'sideways_tp_mult': 2.91992251201933, 'sideways_tsl_mult': 0.3197857532508329, 'sideways_time_stop': 253, 'sideways_use_sma': True, 'sideways_use_ema': True, 'sideways_use_atr': True, 'sideways_use_adx': True, 'sideways_use_spike': False, 'sideways_rsi_required': True}.
[I 2025-09-01 15:03:18,329] Trial 655 finished with values: [-1000000000.0, 1000000000.0] and parameters: {'p_sma': 29, 'p_std': 47, 'p_atr': 9, 'p_adx': 30, 'rsi_period': 84, 'ema1': 8, 'ema2': 44, 'slip_atr_k': 0.1739524423186976, 'slip_spread_k': 0.6687199903295085, 'spread_hl_frac': 0.009493858765654289, 'bb_std_mult': 3.436298771613643, 'rsi_os': 27, 'rsi_ob': 53, 'vol_spike': 0.12656197572236505, 'adx_thresh': 18.89629913255484, 'atr_min_pct': 0.011689013351610553, 'atr_max_pct': 0.03774333776629167, 'tp_mult': 1.209720518859452, 'tsl_mult': 0.6594017559076174, 'strategy': 'breakout', 'time_stop': 115, 'use_sma': True, 'use_atr': False, 'use_adx': True, 'use_ema': False, 'use_spike': True, 'rsi_required': False, 'edge_k': 0.19798210555641318, 'edge_cap': 0.9260309301136771, 'bull_strategy': 'breakout', 'bull_bb_std_mult': 2.9583780887522857, 'bull_rsi_os': 48, 'bull_rsi_ob': 86, 'bull_adx_thresh': 12.234797180748874, 'bull_atr_min_pct': 0.012010286168249645, 'bull_atr_max_pct': 0.12930527774749206, 'bull_tp_mult': 1.6540150628792265, 'bull_tsl_mult': 0.4687175499479687, 'bull_time_stop': 162, 'bull_use_sma': False, 'bull_use_ema': False, 'bull_use_atr': True, 'bull_use_adx': True, 'bull_use_spike': True, 'bull_rsi_required': True, 'bear_strategy': 'breakout', 'bear_bb_std_mult': 2.557568386927592, 'bear_rsi_os': 33, 'bear_rsi_ob': 86, 'bear_adx_thresh': 17.803000312350154, 'bear_atr_min_pct': 0.004211702155042124, 'bear_atr_max_pct': 0.10952121121698424, 'bear_tp_mult': 2.160288883051582, 'bear_tsl_mult': 0.09823485858369017, 'bear_time_stop': 75, 'bear_use_sma': False, 'bear_use_ema': True, 'bear_use_atr': True, 'bear_use_adx': True, 'bear_use_spike': True, 'bear_rsi_required': False, 'sideways_strategy': 'mean_reversion', 'sideways_bb_std_mult': 1.5425051601357174, 'sideways_rsi_os': 7, 'sideways_rsi_ob': 90, 'sideways_adx_thresh': 9.51711521108601, 'sideways_atr_min_pct': 0.0029940474270364155, 'sideways_atr_max_pct': 0.10323358643829827, 'sideways_tp_mult': 2.410749978048154, 'sideways_tsl_mult': 0.31639021174500936, 'sideways_time_stop': 248, 'sideways_use_sma': True, 'sideways_use_ema': True, 'sideways_use_atr': True, 'sideways_use_adx': True, 'sideways_use_spike': False, 'sideways_rsi_required': True}.
[I 2025-09-01 15:03:18,701] Trial 653 finished with values: [-1000000000.0, 1000000000.0] and parameters: {'p_sma': 27, 'p_std': 43, 'p_atr': 23, 'p_adx': 8, 'rsi_period': 84, 'ema1': 11, 'ema2': 59, 'slip_atr_k': 0.010138063599509972, 'slip_spread_k': 0.3785463725471005, 'spread_hl_frac': 0.01339389769967606, 'bb_std_mult': 3.348993336310065, 'rsi_os': 16, 'rsi_ob': 52, 'vol_spike': 0.14653191009901145, 'adx_thresh': 17.232835477168088, 'atr_min_pct': 0.004994679743372822, 'atr_max_pct': 0.024575998308674803, 'tp_mult': 1.3849652905676828, 'tsl_mult': 0.7505475968581575, 'strategy': 'mean_reversion', 'time_stop': 288, 'use_sma': False, 'use_atr': False, 'use_adx': True, 'use_ema': False, 'use_spike': True, 'rsi_required': False, 'edge_k': 0.3615714721744313, 'edge_cap': 0.9303611864961369, 'bull_strategy': 'breakout', 'bull_bb_std_mult': 3.2045704223725506, 'bull_rsi_os': 48, 'bull_rsi_ob': 83, 'bull_adx_thresh': 10.774287848977231, 'bull_atr_min_pct': 0.025863098596062072, 'bull_atr_max_pct': 0.1283999389480876, 'bull_tp_mult': 1.6446983859402171, 'bull_tsl_mult': 0.4470384136097071, 'bull_time_stop': 240, 'bull_use_sma': False, 'bull_use_ema': True, 'bull_use_atr': True, 'bull_use_adx': True, 'bull_use_spike': True, 'bull_rsi_required': True, 'bear_strategy': 'mean_reversion', 'bear_bb_std_mult': 1.246815525030084, 'bear_rsi_os': 36, 'bear_rsi_ob': 73, 'bear_adx_thresh': 17.929650364994558, 'bear_atr_min_pct': 0.00587715126586442, 'bear_atr_max_pct': 0.10995984722496802, 'bear_tp_mult': 1.375441862623304, 'bear_tsl_mult': 0.09051091021526095, 'bear_time_stop': 83, 'bear_use_sma': False, 'bear_use_ema': True, 'bear_use_atr': False, 'bear_use_adx': True, 'bear_use_spike': False, 'bear_rsi_required': False, 'sideways_strategy': 'mean_reversion', 'sideways_bb_std_mult': 2.9448721393811987, 'sideways_rsi_os': 14, 'sideways_rsi_ob': 63, 'sideways_adx_thresh': 22.102072548432055, 'sideways_atr_min_pct': 0.005821746356754786, 'sideways_atr_max_pct': 0.11640487127299538, 'sideways_tp_mult': 1.2384477989579772, 'sideways_tsl_mult': 0.3168637941139949, 'sideways_time_stop': 251, 'sideways_use_sma': True, 'sideways_use_ema': True, 'sideways_use_atr': True, 'sideways_use_adx': False, 'sideways_use_spike': True, 'sideways_rsi_required': True}.
