[I 2025-09-01 14:27:00,690] Trial 415 finished with values: [-1000000000.0, 1000000000.0] and parameters: {'p_sma': 30, 'p_std': 27, 'p_atr': 27, 'p_adx': 30, 'rsi_period': 49, 'ema1': 16, 'ema2': 58, 'slip_atr_k': 0.2441253096834371, 'slip_spread_k': 0.5593205338374402, 'spread_hl_frac': 0.010958969382849943, 'bb_std_mult': 2.350211776401291, 'rsi_os': 52, 'rsi_ob': 54, 'vol_spike': 0.15983970162373082, 'adx_thresh': 18.645717383410442, 'atr_min_pct': 0.009499463076809416, 'atr_max_pct': 0.036694691510419666, 'tp_mult': 1.507441667584151, 'tsl_mult': 0.65144136323387, 'strategy': 'mean_reversion', 'time_stop': 101, 'use_sma': False, 'use_atr': False, 'use_adx': True, 'use_ema': True, 'use_spike': True, 'rsi_required': True, 'edge_k': 0.2647035311451955, 'edge_cap': 0.9158534606964897, 'bull_strategy': 'mean_reversion', 'bull_bb_std_mult': 3.124801173275977, 'bull_rsi_os': 11, 'bull_rsi_ob': 78, 'bull_adx_thresh': 13.934456130887508, 'bull_atr_min_pct': 0.026857237656630284, 'bull_atr_max_pct': 0.1261762855660471, 'bull_tp_mult': 1.9651812050185966, 'bull_tsl_mult': 0.43266255710820983, 'bull_time_stop': 160, 'bull_use_sma': True, 'bull_use_ema': False, 'bull_use_atr': True, 'bull_use_adx': False, 'bull_use_spike': True, 'bull_rsi_required': True, 'bear_strategy': 'mean_reversion', 'bear_bb_std_mult': 0.7168399105480114, 'bear_rsi_os': 35, 'bear_rsi_ob': 76, 'bear_adx_thresh': 8.814480709585501, 'bear_atr_min_pct': 0.0024316988821541886, 'bear_atr_max_pct': 0.03159075148106003, 'bear_tp_mult': 2.297049637872983, 'bear_tsl_mult': 0.10370745426753106, 'bear_time_stop': 180, 'bear_use_sma': False, 'bear_use_ema': False, 'bear_use_atr': True, 'bear_use_adx': False, 'bear_use_spike': True, 'bear_rsi_required': False, 'sideways_strategy': 'mean_reversion', 'sideways_bb_std_mult': 2.9755855128193893, 'sideways_rsi_os': 30, 'sideways_rsi_ob': 77, 'sideways_adx_thresh': 33.416825767949156, 'sideways_atr_min_pct': 0.0035977701534280412, 'sideways_atr_max_pct': 0.11302383988764308, 'sideways_tp_mult': 1.402573225628647, 'sideways_tsl_mult': 0.3659575288401555, 'sideways_time_stop': 256, 'sideways_use_sma': True, 'sideways_use_ema': True, 'sideways_use_atr': True, 'sideways_use_adx': True, 'sideways_use_spike': False, 'sideways_rsi_required': True}.
[I 2025-09-01 14:27:35,184] Trial 416 finished with values: [-0.016242686505271386, 0.015997411336048702] and parameters: {'p_sma': 30, 'p_std': 28, 'p_atr': 27, 'p_adx': 9, 'rsi_period': 73, 'ema1': 22, 'ema2': 58, 'slip_atr_k': 0.09631227209064804, 'slip_spread_k': 0.5621537247623758, 'spread_hl_frac': 0.011249307667671403, 'bb_std_mult': 1.5833881374064172, 'rsi_os': 42, 'rsi_ob': 54, 'vol_spike': 0.1685997294701858, 'adx_thresh': 18.598921109029796, 'atr_min_pct': 0.012667154446252014, 'atr_max_pct': 0.03668215505870122, 'tp_mult': 1.5259577540844613, 'tsl_mult': 0.7474691272553491, 'strategy': 'mean_reversion', 'time_stop': 25, 'use_sma': False, 'use_atr': False, 'use_adx': True, 'use_ema': True, 'use_spike': True, 'rsi_required': True, 'edge_k': 0.5875866088987678, 'edge_cap': 0.9999917554053878, 'bull_strategy': 'breakout', 'bull_bb_std_mult': 3.1235374254093187, 'bull_rsi_os': 34, 'bull_rsi_ob': 78, 'bull_adx_thresh': 14.173357553273984, 'bull_atr_min_pct': 0.010135357376891847, 'bull_atr_max_pct': 0.1264484696506242, 'bull_tp_mult': 1.680204396122034, 'bull_tsl_mult': 0.07190861087635558, 'bull_time_stop': 161, 'bull_use_sma': True, 'bull_use_ema': False, 'bull_use_atr': True, 'bull_use_adx': False, 'bull_use_spike': True, 'bull_rsi_required': True, 'bear_strategy': 'mean_reversion', 'bear_bb_std_mult': 1.7051914388675895, 'bear_rsi_os': 35, 'bear_rsi_ob': 55, 'bear_adx_thresh': 11.957683508785609, 'bear_atr_min_pct': 0.0023255987991239006, 'bear_atr_max_pct': 0.03516252737325911, 'bear_tp_mult': 2.7047600261965474, 'bear_tsl_mult': 0.09042571867542593, 'bear_time_stop': 72, 'bear_use_sma': False, 'bear_use_ema': False, 'bear_use_atr': True, 'bear_use_adx': False, 'bear_use_spike': True, 'bear_rsi_required': False, 'sideways_strategy': 'mean_reversion', 'sideways_bb_std_mult': 2.9614020667522443, 'sideways_rsi_os': 14, 'sideways_rsi_ob': 77, 'sideways_adx_thresh': 24.47138507704807, 'sideways_atr_min_pct': 0.022714632450136957, 'sideways_atr_max_pct': 0.11335656197970052, 'sideways_tp_mult': 1.3883409907959041, 'sideways_tsl_mult': 0.36051946471054314, 'sideways_time_stop': 255, 'sideways_use_sma': True, 'sideways_use_ema': True, 'sideways_use_atr': True, 'sideways_use_adx': True, 'sideways_use_spike': False, 'sideways_rsi_required': True}.
[I 2025-09-01 14:27:35,924] Trial 414 finished with values: [-1000000000.0, 1000000000.0] and parameters: {'p_sma': 30, 'p_std': 34, 'p_atr': 26, 'p_adx': 9, 'rsi_period': 72, 'ema1': 8, 'ema2': 56, 'slip_atr_k': 0.005484778583012719, 'slip_spread_k': 0.3650360807070273, 'spread_hl_frac': 0.04793040402156691, 'bb_std_mult': 0.574304071810428, 'rsi_os': 42, 'rsi_ob': 54, 'vol_spike': 0.11400279906213293, 'adx_thresh': 7.1446226906200705, 'atr_min_pct': 0.01275811570730467, 'atr_max_pct': 0.03570057435747551, 'tp_mult': 1.5819594203090475, 'tsl_mult': 0.9963891010072419, 'strategy': 'mean_reversion', 'time_stop': 104, 'use_sma': False, 'use_atr': False, 'use_adx': True, 'use_ema': True, 'use_spike': True, 'rsi_required': True, 'edge_k': 0.2573016605832844, 'edge_cap': 0.9138476374731852, 'bull_strategy': 'breakout', 'bull_bb_std_mult': 3.2119302347644103, 'bull_rsi_os': 41, 'bull_rsi_ob': 78, 'bull_adx_thresh': 31.23298750965184, 'bull_atr_min_pct': 0.011498386001062415, 'bull_atr_max_pct': 0.06996381306932672, 'bull_tp_mult': 1.632707082318954, 'bull_tsl_mult': 0.3880454868884284, 'bull_time_stop': 119, 'bull_use_sma': True, 'bull_use_ema': True, 'bull_use_atr': True, 'bull_use_adx': False, 'bull_use_spike': True, 'bull_rsi_required': True, 'bear_strategy': 'mean_reversion', 'bear_bb_std_mult': 2.6043646597039625, 'bear_rsi_os': 33, 'bear_rsi_ob': 55, 'bear_adx_thresh': 8.808821296852617, 'bear_atr_min_pct': 0.02010426378741321, 'bear_atr_max_pct': 0.10445037096402501, 'bear_tp_mult': 1.5387057472402956, 'bear_tsl_mult': 0.09814866241373377, 'bear_time_stop': 15, 'bear_use_sma': False, 'bear_use_ema': False, 'bear_use_atr': True, 'bear_use_adx': False, 'bear_use_spike': True, 'bear_rsi_required': False, 'sideways_strategy': 'mean_reversion', 'sideways_bb_std_mult': 2.9061792235871087, 'sideways_rsi_os': 25, 'sideways_rsi_ob': 59, 'sideways_adx_thresh': 15.526743687334864, 'sideways_atr_min_pct': 0.0009393802406324342, 'sideways_atr_max_pct': 0.11355083246801784, 'sideways_tp_mult': 2.1886884750799425, 'sideways_tsl_mult': 0.3613942448916034, 'sideways_time_stop': 254, 'sideways_use_sma': True, 'sideways_use_ema': True, 'sideways_use_atr': True, 'sideways_use_adx': True, 'sideways_use_spike': False, 'sideways_rsi_required': True}.
[I 2025-09-01 14:27:38,346] Trial 418 finished with values: [-0.01782867410197908, 0.020389787932753024] and parameters: {'p_sma': 36, 'p_std': 28, 'p_atr': 21, 'p_adx': 24, 'rsi_period': 73, 'ema1': 23, 'ema2': 56, 'slip_atr_k': 0.08161610835541777, 'slip_spread_k': 0.8924396414697309, 'spread_hl_frac': 0.012216251278233352, 'bb_std_mult': 0.5694985902000627, 'rsi_os': 38, 'rsi_ob': 86, 'vol_spike': 0.21937749126344838, 'adx_thresh': 19.878952395322862, 'atr_min_pct': 0.02612452960419917, 'atr_max_pct': 0.04028811741620999, 'tp_mult': 1.3421044710097376, 'tsl_mult': 0.6753714573116489, 'strategy': 'mean_reversion', 'time_stop': 111, 'use_sma': True, 'use_atr': False, 'use_adx': True, 'use_ema': True, 'use_spike': True, 'rsi_required': True, 'edge_k': 0.13571536003968732, 'edge_cap': 0.9985492223565868, 'bull_strategy': 'breakout', 'bull_bb_std_mult': 3.1171564460976553, 'bull_rsi_os': 41, 'bull_rsi_ob': 81, 'bull_adx_thresh': 33.270119554862106, 'bull_atr_min_pct': 0.024101872889508966, 'bull_atr_max_pct': 0.03661530359899114, 'bull_tp_mult': 1.6137584558150688, 'bull_tsl_mult': 0.46167493359870776, 'bull_time_stop': 144, 'bull_use_sma': False, 'bull_use_ema': True, 'bull_use_atr': True, 'bull_use_adx': True, 'bull_use_spike': True, 'bull_rsi_required': True, 'bear_strategy': 'mean_reversion', 'bear_bb_std_mult': 2.378318951978026, 'bear_rsi_os': 34, 'bear_rsi_ob': 55, 'bear_adx_thresh': 11.704534633295104, 'bear_atr_min_pct': 0.0018917800936980515, 'bear_atr_max_pct': 0.11394843214411346, 'bear_tp_mult': 1.9846658417450547, 'bear_tsl_mult': 0.059066186017156075, 'bear_time_stop': 75, 'bear_use_sma': False, 'bear_use_ema': False, 'bear_use_atr': False, 'bear_use_adx': False, 'bear_use_spike': True, 'bear_rsi_required': False, 'sideways_strategy': 'mean_reversion', 'sideways_bb_std_mult': 3.084675321892026, 'sideways_rsi_os': 25, 'sideways_rsi_ob': 93, 'sideways_adx_thresh': 24.835182679306097, 'sideways_atr_min_pct': 0.0038566723128246098, 'sideways_atr_max_pct': 0.10954588353602636, 'sideways_tp_mult': 2.504298834522625, 'sideways_tsl_mult': 0.5185503384750441, 'sideways_time_stop': 138, 'sideways_use_sma': True, 'sideways_use_ema': False, 'sideways_use_atr': False, 'sideways_use_adx': True, 'sideways_use_spike': False, 'sideways_rsi_required': False}.
[I 2025-09-01 14:27:38,726] Trial 417 finished with values: [-1000000000.0, 1000000000.0] and parameters: {'p_sma': 30, 'p_std': 28, 'p_atr': 29, 'p_adx': 8, 'rsi_period': 80, 'ema1': 30, 'ema2': 58, 'slip_atr_k': 0.17165954108735187, 'slip_spread_k': 0.8140768265514859, 'spread_hl_frac': 0.010911979400122396, 'bb_std_mult': 2.346856793839442, 'rsi_os': 42, 'rsi_ob': 52, 'vol_spike': 3.274089284227566e-05, 'adx_thresh': 19.970507576163815, 'atr_min_pct': 0.01078272205306383, 'atr_max_pct': 0.12809379348001657, 'tp_mult': 1.4252383460944067, 'tsl_mult': 0.6177494562195112, 'strategy': 'mean_reversion', 'time_stop': 284, 'use_sma': True, 'use_atr': False, 'use_adx': True, 'use_ema': True, 'use_spike': True, 'rsi_required': True, 'edge_k': 0.5858132928827633, 'edge_cap': 0.45628501807569194, 'bull_strategy': 'breakout', 'bull_bb_std_mult': 3.1139829015051674, 'bull_rsi_os': 34, 'bull_rsi_ob': 81, 'bull_adx_thresh': 12.412449386389067, 'bull_atr_min_pct': 0.010031976065579661, 'bull_atr_max_pct': 0.03701349866695045, 'bull_tp_mult': 1.16639916160783, 'bull_tsl_mult': 0.46379684197878446, 'bull_time_stop': 144, 'bull_use_sma': True, 'bull_use_ema': False, 'bull_use_atr': True, 'bull_use_adx': True, 'bull_use_spike': True, 'bull_rsi_required': True, 'bear_strategy': 'mean_reversion', 'bear_bb_std_mult': 2.644764463562699, 'bear_rsi_os': 35, 'bear_rsi_ob': 62, 'bear_adx_thresh': 8.266884589959401, 'bear_atr_min_pct': 0.02028302932177315, 'bear_atr_max_pct': 0.05689433535685978, 'bear_tp_mult': 1.987329754285332, 'bear_tsl_mult': 0.05893943047469635, 'bear_time_stop': 76, 'bear_use_sma': False, 'bear_use_ema': False, 'bear_use_atr': False, 'bear_use_adx': False, 'bear_use_spike': True, 'bear_rsi_required': False, 'sideways_strategy': 'mean_reversion', 'sideways_bb_std_mult': 3.078031630055867, 'sideways_rsi_os': 30, 'sideways_rsi_ob': 77, 'sideways_adx_thresh': 33.62315763795058, 'sideways_atr_min_pct': 0.003600019114126236, 'sideways_atr_max_pct': 0.07360332790918675, 'sideways_tp_mult': 2.504853010078691, 'sideways_tsl_mult': 0.5130551914024967, 'sideways_time_stop': 257, 'sideways_use_sma': True, 'sideways_use_ema': False, 'sideways_use_atr': True, 'sideways_use_adx': True, 'sideways_use_spike': False, 'sideways_rsi_required': False}.
[I 2025-09-01 14:28:14,319] Trial 419 finished with values: [-1000000000.0, 1000000000.0] and parameters: {'p_sma': 29, 'p_std': 56, 'p_atr': 22, 'p_adx': 8, 'rsi_period': 80, 'ema1': 14, 'ema2': 56, 'slip_atr_k': 0.01528571542395235, 'slip_spread_k': 0.6178603420770665, 'spread_hl_frac': 0.009459523251021394, 'bb_std_mult': 1.2020127329920247, 'rsi_os': 43, 'rsi_ob': 52, 'vol_spike': 0.1003414834401684, 'adx_thresh': 5.6874408129516985, 'atr_min_pct': 0.025983828408902267, 'atr_max_pct': 0.033336674935399886, 'tp_mult': 2.9986434526239147, 'tsl_mult': 0.6845827345596367, 'strategy': 'mean_reversion', 'time_stop': 283, 'use_sma': True, 'use_atr': False, 'use_adx': True, 'use_ema': True, 'use_spike': True, 'rsi_required': True, 'edge_k': 0.12081368193970944, 'edge_cap': 0.9509715734426893, 'bull_strategy': 'breakout', 'bull_bb_std_mult': 3.2338622158564942, 'bull_rsi_os': 14, 'bull_rsi_ob': 81, 'bull_adx_thresh': 33.2565263397553, 'bull_atr_min_pct': 0.017823302568806033, 'bull_atr_max_pct': 0.03559868020515501, 'bull_tp_mult': 1.8528377466052415, 'bull_tsl_mult': 0.47222784037319837, 'bull_time_stop': 144, 'bull_use_sma': False, 'bull_use_ema': True, 'bull_use_atr': True, 'bull_use_adx': True, 'bull_use_spike': True, 'bull_rsi_required': True, 'bear_strategy': 'mean_reversion', 'bear_bb_std_mult': 2.3884832544947567, 'bear_rsi_os': 34, 'bear_rsi_ob': 59, 'bear_adx_thresh': 8.261496339176277, 'bear_atr_min_pct': 0.007745487659766849, 'bear_atr_max_pct': 0.055668688904373285, 'bear_tp_mult': 1.5343517246321254, 'bear_tsl_mult': 0.39569884344946676, 'bear_time_stop': 111, 'bear_use_sma': False, 'bear_use_ema': False, 'bear_use_atr': False, 'bear_use_adx': False, 'bear_use_spike': True, 'bear_rsi_required': False, 'sideways_strategy': 'mean_reversion', 'sideways_bb_std_mult': 3.1507207767812404, 'sideways_rsi_os': 25, 'sideways_rsi_ob': 93, 'sideways_adx_thresh': 25.054715311336814, 'sideways_atr_min_pct': 0.0038676944981418607, 'sideways_atr_max_pct': 0.10992720594185752, 'sideways_tp_mult': 2.1124166635942285, 'sideways_tsl_mult': 0.5117364243243168, 'sideways_time_stop': 17, 'sideways_use_sma': True, 'sideways_use_ema': False, 'sideways_use_atr': False, 'sideways_use_adx': True, 'sideways_use_spike': False, 'sideways_rsi_required': False}.
[I 2025-09-01 14:28:15,435] Trial 421 finished with values: [-1000000000.0, 1000000000.0] and parameters: {'p_sma': 39, 'p_std': 45, 'p_atr': 27, 'p_adx': 8, 'rsi_period': 80, 'ema1': 30, 'ema2': 57, 'slip_atr_k': 0.016102966776047105, 'slip_spread_k': 0.14642340333648773, 'spread_hl_frac': 0.009230956709961071, 'bb_std_mult': 2.5787762495608115, 'rsi_os': 43, 'rsi_ob': 52, 'vol_spike': 0.28589680366666037, 'adx_thresh': 5.549468056855517, 'atr_min_pct': 0.01050754384499488, 'atr_max_pct': 0.0327410146671263, 'tp_mult': 1.4309296825514615, 'tsl_mult': 0.6030176351141733, 'strategy': 'mean_reversion', 'time_stop': 117, 'use_sma': True, 'use_atr': False, 'use_adx': True, 'use_ema': True, 'use_spike': False, 'rsi_required': True, 'edge_k': 0.8474530903325467, 'edge_cap': 0.46003440512413424, 'bull_strategy': 'breakout', 'bull_bb_std_mult': 1.6871156459845562, 'bull_rsi_os': 36, 'bull_rsi_ob': 74, 'bull_adx_thresh': 12.638211080767947, 'bull_atr_min_pct': 0.01761414401355592, 'bull_atr_max_pct': 0.013843218789122716, 'bull_tp_mult': 2.2303077980174755, 'bull_tsl_mult': 0.48900444334463583, 'bull_time_stop': 281, 'bull_use_sma': False, 'bull_use_ema': True, 'bull_use_atr': True, 'bull_use_adx': True, 'bull_use_spike': True, 'bull_rsi_required': True, 'bear_strategy': 'mean_reversion', 'bear_bb_std_mult': 2.540784672715505, 'bear_rsi_os': 27, 'bear_rsi_ob': 59, 'bear_adx_thresh': 8.368638200657845, 'bear_atr_min_pct': 0.013100019245093223, 'bear_atr_max_pct': 0.04285883057624741, 'bear_tp_mult': 2.0376425339899704, 'bear_tsl_mult': 0.4015022952532567, 'bear_time_stop': 8, 'bear_use_sma': True, 'bear_use_ema': False, 'bear_use_atr': False, 'bear_use_adx': False, 'bear_use_spike': True, 'bear_rsi_required': False, 'sideways_strategy': 'mean_reversion', 'sideways_bb_std_mult': 3.018334750701605, 'sideways_rsi_os': 32, 'sideways_rsi_ob': 45, 'sideways_adx_thresh': 26.833985693322788, 'sideways_atr_min_pct': 0.002766644458482722, 'sideways_atr_max_pct': 0.11052220199157733, 'sideways_tp_mult': 2.1039222316779274, 'sideways_tsl_mult': 0.5808461259221577, 'sideways_time_stop': 262, 'sideways_use_sma': True, 'sideways_use_ema': False, 'sideways_use_atr': True, 'sideways_use_adx': True, 'sideways_use_spike': True, 'sideways_rsi_required': False}.
[I 2025-09-01 14:28:15,782] Trial 420 finished with values: [-1000000000.0, 1000000000.0] and parameters: {'p_sma': 29, 'p_std': 38, 'p_atr': 27, 'p_adx': 8, 'rsi_period': 80, 'ema1': 9, 'ema2': 57, 'slip_atr_k': 0.1760432259370305, 'slip_spread_k': 0.13388185677604741, 'spread_hl_frac': 0.00948896670109299, 'bb_std_mult': 3.5108178889621144, 'rsi_os': 45, 'rsi_ob': 63, 'vol_spike': 0.2788606273944919, 'adx_thresh': 5.606729744647645, 'atr_min_pct': 0.02606154053178664, 'atr_max_pct': 0.04039431804735004, 'tp_mult': 1.421932171167547, 'tsl_mult': 0.6739944014758448, 'strategy': 'mean_reversion', 'time_stop': 282, 'use_sma': True, 'use_atr': False, 'use_adx': True, 'use_ema': True, 'use_spike': False, 'rsi_required': True, 'edge_k': 0.36930500196337274, 'edge_cap': 0.9540996872522817, 'bull_strategy': 'breakout', 'bull_bb_std_mult': 3.232122372639534, 'bull_rsi_os': 36, 'bull_rsi_ob': 94, 'bull_adx_thresh': 12.577185678333212, 'bull_atr_min_pct': 0.012088881024917581, 'bull_atr_max_pct': 0.036456328008884535, 'bull_tp_mult': 1.612159008885175, 'bull_tsl_mult': 0.9393929612645942, 'bull_time_stop': 145, 'bull_use_sma': False, 'bull_use_ema': True, 'bull_use_atr': True, 'bull_use_adx': True, 'bull_use_spike': True, 'bull_rsi_required': True, 'bear_strategy': 'mean_reversion', 'bear_bb_std_mult': 2.3866226223150484, 'bear_rsi_os': 34, 'bear_rsi_ob': 59, 'bear_adx_thresh': 8.230081356023002, 'bear_atr_min_pct': 0.026482278920771395, 'bear_atr_max_pct': 0.08669064661147878, 'bear_tp_mult': 1.9967882410520177, 'bear_tsl_mult': 0.12827860582380943, 'bear_time_stop': 112, 'bear_use_sma': True, 'bear_use_ema': False, 'bear_use_atr': False, 'bear_use_adx': False, 'bear_use_spike': True, 'bear_rsi_required': False, 'sideways_strategy': 'mean_reversion', 'sideways_bb_std_mult': 3.147100395613941, 'sideways_rsi_os': 50, 'sideways_rsi_ob': 45, 'sideways_adx_thresh': 26.750933985344194, 'sideways_atr_min_pct': 0.00394099457904994, 'sideways_atr_max_pct': 0.1104202000592444, 'sideways_tp_mult': 2.514385442228666, 'sideways_tsl_mult': 0.5143683215951438, 'sideways_time_stop': 74, 'sideways_use_sma': True, 'sideways_use_ema': False, 'sideways_use_atr': False, 'sideways_use_adx': True, 'sideways_use_spike': False, 'sideways_rsi_required': False}.
[I 2025-09-01 14:28:16,684] Trial 422 finished with values: [-1000000000.0, 1000000000.0] and parameters: {'p_sma': 26, 'p_std': 22, 'p_atr': 28, 'p_adx': 8, 'rsi_period': 66, 'ema1': 9, 'ema2': 57, 'slip_atr_k': 0.016209305265982858, 'slip_spread_k': 0.2610656331395079, 'spread_hl_frac': 0.00957342000954821, 'bb_std_mult': 2.590445175945371, 'rsi_os': 34, 'rsi_ob': 56, 'vol_spike': 0.2851476311171766, 'adx_thresh': 6.111158726018693, 'atr_min_pct': 0.010251534583534276, 'atr_max_pct': 0.0317367095714944, 'tp_mult': 1.3388895805770458, 'tsl_mult': 0.9274212635978433, 'strategy': 'mean_reversion', 'time_stop': 186, 'use_sma': True, 'use_atr': False, 'use_adx': True, 'use_ema': True, 'use_spike': False, 'rsi_required': True, 'edge_k': 0.3849898075721796, 'edge_cap': 0.9529550299542078, 'bull_strategy': 'breakout', 'bull_bb_std_mult': 3.57779309621608, 'bull_rsi_os': 14, 'bull_rsi_ob': 60, 'bull_adx_thresh': 13.01911203826423, 'bull_atr_min_pct': 0.012345393143352522, 'bull_atr_max_pct': 0.013450736905264618, 'bull_tp_mult': 1.7150523298789966, 'bull_tsl_mult': 0.4862219811394892, 'bull_time_stop': 282, 'bull_use_sma': False, 'bull_use_ema': True, 'bull_use_atr': True, 'bull_use_adx': True, 'bull_use_spike': True, 'bull_rsi_required': True, 'bear_strategy': 'mean_reversion', 'bear_bb_std_mult': 2.542411107602749, 'bear_rsi_os': 36, 'bear_rsi_ob': 57, 'bear_adx_thresh': 6.677192802883459, 'bear_atr_min_pct': 0.025203734505037614, 'bear_atr_max_pct': 0.12375527225103128, 'bear_tp_mult': 2.0257327027943814, 'bear_tsl_mult': 0.13448847611413742, 'bear_time_stop': 142, 'bear_use_sma': True, 'bear_use_ema': False, 'bear_use_atr': False, 'bear_use_adx': False, 'bear_use_spike': True, 'bear_rsi_required': False, 'sideways_strategy': 'mean_reversion', 'sideways_bb_std_mult': 3.159318569048281, 'sideways_rsi_os': 32, 'sideways_rsi_ob': 45, 'sideways_adx_thresh': 23.430446459216274, 'sideways_atr_min_pct': 0.00253949485139595, 'sideways_atr_max_pct': 0.09906745243238095, 'sideways_tp_mult': 2.2416172230133053, 'sideways_tsl_mult': 0.4046539266084844, 'sideways_time_stop': 73, 'sideways_use_sma': True, 'sideways_use_ema': True, 'sideways_use_atr': False, 'sideways_use_adx': True, 'sideways_use_spike': True, 'sideways_rsi_required': False}.
