[I 2025-09-01 14:42:06,072] Trial 516 finished with values: [-1000000000.0, 1000000000.0] and parameters: {'p_sma': 20, 'p_std': 34, 'p_atr': 26, 'p_adx': 8, 'rsi_period': 9, 'ema1': 24, 'ema2': 59, 'slip_atr_k': 0.023023528987648346, 'slip_spread_k': 0.5327471013805523, 'spread_hl_frac': 0.047471048681958124, 'bb_std_mult': 3.3932256140449097, 'rsi_os': 5, 'rsi_ob': 53, 'vol_spike': 0.2091063848538769, 'adx_thresh': 9.80994885965302, 'atr_min_pct': 0.003513297263591564, 'atr_max_pct': 0.1259395353975307, 'tp_mult': 1.5584674251646333, 'tsl_mult': 0.3573416523930265, 'strategy': 'mean_reversion', 'time_stop': 14, 'use_sma': True, 'use_atr': True, 'use_adx': True, 'use_ema': True, 'use_spike': False, 'rsi_required': True, 'edge_k': 0.7510375942336385, 'edge_cap': 0.9595745576078962, 'bull_strategy': 'breakout', 'bull_bb_std_mult': 2.972803727860916, 'bull_rsi_os': 40, 'bull_rsi_ob': 65, 'bull_adx_thresh': 12.652535777713735, 'bull_atr_min_pct': 0.01055608694142546, 'bull_atr_max_pct': 0.045694529974440574, 'bull_tp_mult': 1.6093863196433276, 'bull_tsl_mult': 0.4913481488484109, 'bull_time_stop': 152, 'bull_use_sma': False, 'bull_use_ema': False, 'bull_use_atr': False, 'bull_use_adx': False, 'bull_use_spike': True, 'bull_rsi_required': True, 'bear_strategy': 'mean_reversion', 'bear_bb_std_mult': 2.4470706865659286, 'bear_rsi_os': 33, 'bear_rsi_ob': 59, 'bear_adx_thresh': 7.92448268666369, 'bear_atr_min_pct': 0.025292993976221805, 'bear_atr_max_pct': 0.1324616698198229, 'bear_tp_mult': 2.20280531112889, 'bear_tsl_mult': 0.1150698741196843, 'bear_time_stop': 15, 'bear_use_sma': False, 'bear_use_ema': False, 'bear_use_atr': False, 'bear_use_adx': True, 'bear_use_spike': False, 'bear_rsi_required': False, 'sideways_strategy': 'breakout', 'sideways_bb_std_mult': 3.2370680263834615, 'sideways_rsi_os': 40, 'sideways_rsi_ob': 76, 'sideways_adx_thresh': 21.898513028462787, 'sideways_atr_min_pct': 0.026104841623006872, 'sideways_atr_max_pct': 0.1124074870907832, 'sideways_tp_mult': 2.462868048811921, 'sideways_tsl_mult': 0.35103110726433795, 'sideways_time_stop': 274, 'sideways_use_sma': True, 'sideways_use_ema': False, 'sideways_use_atr': True, 'sideways_use_adx': True, 'sideways_use_spike': False, 'sideways_rsi_required': False}.
[I 2025-09-01 14:42:07,794] Trial 513 finished with values: [-1000000000.0, 1000000000.0] and parameters: {'p_sma': 39, 'p_std': 27, 'p_atr': 28, 'p_adx': 20, 'rsi_period': 82, 'ema1': 11, 'ema2': 38, 'slip_atr_k': 0.023693295889558545, 'slip_spread_k': 0.5203898031239106, 'spread_hl_frac': 0.009488014585682514, 'bb_std_mult': 3.5078453144910107, 'rsi_os': 40, 'rsi_ob': 53, 'vol_spike': 0.10312230632004142, 'adx_thresh': 6.123634447840835, 'atr_min_pct': 0.027098876439071114, 'atr_max_pct': 0.035199703145370916, 'tp_mult': 2.685275074380413, 'tsl_mult': 0.6928100263527667, 'strategy': 'mean_reversion', 'time_stop': 102, 'use_sma': False, 'use_atr': False, 'use_adx': True, 'use_ema': True, 'use_spike': True, 'rsi_required': True, 'edge_k': 0.1455527005980281, 'edge_cap': 0.9335544496787214, 'bull_strategy': 'breakout', 'bull_bb_std_mult': 3.2573336288381856, 'bull_rsi_os': 12, 'bull_rsi_ob': 57, 'bull_adx_thresh': 20.365586422000042, 'bull_atr_min_pct': 0.021447488884657005, 'bull_atr_max_pct': 0.12156444570373474, 'bull_tp_mult': 1.623382011508385, 'bull_tsl_mult': 0.44944874005716684, 'bull_time_stop': 253, 'bull_use_sma': False, 'bull_use_ema': True, 'bull_use_atr': True, 'bull_use_adx': False, 'bull_use_spike': True, 'bull_rsi_required': True, 'bear_strategy': 'mean_reversion', 'bear_bb_std_mult': 2.410360933966515, 'bear_rsi_os': 33, 'bear_rsi_ob': 60, 'bear_adx_thresh': 8.112985653192247, 'bear_atr_min_pct': 0.029778358249510122, 'bear_atr_max_pct': 0.02236813613946699, 'bear_tp_mult': 2.0717574192840646, 'bear_tsl_mult': 0.7480345203958786, 'bear_time_stop': 300, 'bear_use_sma': False, 'bear_use_ema': False, 'bear_use_atr': False, 'bear_use_adx': False, 'bear_use_spike': False, 'bear_rsi_required': False, 'sideways_strategy': 'mean_reversion', 'sideways_bb_std_mult': 1.1338359791777628, 'sideways_rsi_os': 33, 'sideways_rsi_ob': 90, 'sideways_adx_thresh': 21.83733745204644, 'sideways_atr_min_pct': 0.00046055258575778725, 'sideways_atr_max_pct': 0.08126571504011686, 'sideways_tp_mult': 2.467352524711754, 'sideways_tsl_mult': 0.32699110470188764, 'sideways_time_stop': 190, 'sideways_use_sma': True, 'sideways_use_ema': True, 'sideways_use_atr': True, 'sideways_use_adx': True, 'sideways_use_spike': False, 'sideways_rsi_required': False}.
[I 2025-09-01 14:42:08,406] Trial 514 finished with values: [-0.020693534157062876, 0.02175851153437029] and parameters: {'p_sma': 30, 'p_std': 27, 'p_atr': 28, 'p_adx': 20, 'rsi_period': 37, 'ema1': 11, 'ema2': 58, 'slip_atr_k': 0.04241517812852458, 'slip_spread_k': 0.5356937106327431, 'spread_hl_frac': 0.016441778581720447, 'bb_std_mult': 3.478791276015402, 'rsi_os': 41, 'rsi_ob': 85, 'vol_spike': 0.013567933961461082, 'adx_thresh': 6.136825017193754, 'atr_min_pct': 0.0007782592898163618, 'atr_max_pct': 0.14165473809923848, 'tp_mult': 1.414787343021084, 'tsl_mult': 0.6872500464670489, 'strategy': 'mean_reversion', 'time_stop': 66, 'use_sma': False, 'use_atr': False, 'use_adx': True, 'use_ema': True, 'use_spike': True, 'rsi_required': True, 'edge_k': 0.12523484974858817, 'edge_cap': 0.928892218298432, 'bull_strategy': 'breakout', 'bull_bb_std_mult': 3.1215836083886463, 'bull_rsi_os': 12, 'bull_rsi_ob': 83, 'bull_adx_thresh': 12.810086464772398, 'bull_atr_min_pct': 0.024145413994540704, 'bull_atr_max_pct': 0.02456934189581557, 'bull_tp_mult': 1.62549442947212, 'bull_tsl_mult': 0.449836815958103, 'bull_time_stop': 59, 'bull_use_sma': False, 'bull_use_ema': True, 'bull_use_atr': True, 'bull_use_adx': False, 'bull_use_spike': True, 'bull_rsi_required': True, 'bear_strategy': 'mean_reversion', 'bear_bb_std_mult': 0.6899192155441207, 'bear_rsi_os': 33, 'bear_rsi_ob': 92, 'bear_adx_thresh': 8.257595417341294, 'bear_atr_min_pct': 0.0008646308992747355, 'bear_atr_max_pct': 0.10690139136950531, 'bear_tp_mult': 2.2331562594522123, 'bear_tsl_mult': 0.7811162250724113, 'bear_time_stop': 13, 'bear_use_sma': False, 'bear_use_ema': False, 'bear_use_atr': False, 'bear_use_adx': False, 'bear_use_spike': False, 'bear_rsi_required': False, 'sideways_strategy': 'mean_reversion', 'sideways_bb_std_mult': 2.9404222558259883, 'sideways_rsi_os': 34, 'sideways_rsi_ob': 76, 'sideways_adx_thresh': 24.051180795839674, 'sideways_atr_min_pct': 0.008034770128236935, 'sideways_atr_max_pct': 0.10520463685344424, 'sideways_tp_mult': 2.4728797267687264, 'sideways_tsl_mult': 0.35868495630431235, 'sideways_time_stop': 251, 'sideways_use_sma': True, 'sideways_use_ema': True, 'sideways_use_atr': True, 'sideways_use_adx': True, 'sideways_use_spike': False, 'sideways_rsi_required': False}.
[I 2025-09-01 14:42:08,838] Trial 515 finished with values: [-1000000000.0, 1000000000.0] and parameters: {'p_sma': 30, 'p_std': 27, 'p_atr': 26, 'p_adx': 20, 'rsi_period': 83, 'ema1': 11, 'ema2': 38, 'slip_atr_k': 0.05797897610166898, 'slip_spread_k': 0.10117723209898799, 'spread_hl_frac': 0.009080902624418397, 'bb_std_mult': 0.9098035390837294, 'rsi_os': 9, 'rsi_ob': 85, 'vol_spike': 0.10038281031728016, 'adx_thresh': 7.073424619470328, 'atr_min_pct': 0.010897455246279993, 'atr_max_pct': 0.0631582236980194, 'tp_mult': 1.4282598508761908, 'tsl_mult': 0.685279998339538, 'strategy': 'mean_reversion', 'time_stop': 120, 'use_sma': False, 'use_atr': True, 'use_adx': True, 'use_ema': True, 'use_spike': True, 'rsi_required': True, 'edge_k': 0.4034810053427695, 'edge_cap': 0.9639420900775939, 'bull_strategy': 'breakout', 'bull_bb_std_mult': 3.227104095974183, 'bull_rsi_os': 48, 'bull_rsi_ob': 83, 'bull_adx_thresh': 30.004058530100938, 'bull_atr_min_pct': 0.010328127267082144, 'bull_atr_max_pct': 0.024521585260248405, 'bull_tp_mult': 1.6222436424221915, 'bull_tsl_mult': 0.4600861812539356, 'bull_time_stop': 219, 'bull_use_sma': False, 'bull_use_ema': True, 'bull_use_atr': True, 'bull_use_adx': False, 'bull_use_spike': True, 'bull_rsi_required': True, 'bear_strategy': 'mean_reversion', 'bear_bb_std_mult': 2.418221230603782, 'bear_rsi_os': 33, 'bear_rsi_ob': 60, 'bear_adx_thresh': 17.458524984362988, 'bear_atr_min_pct': 0.0007264088716794983, 'bear_atr_max_pct': 0.02226825774573607, 'bear_tp_mult': 2.201418374948645, 'bear_tsl_mult': 0.14379588107991764, 'bear_time_stop': 82, 'bear_use_sma': False, 'bear_use_ema': False, 'bear_use_atr': False, 'bear_use_adx': False, 'bear_use_spike': False, 'bear_rsi_required': False, 'sideways_strategy': 'mean_reversion', 'sideways_bb_std_mult': 2.318465082940299, 'sideways_rsi_os': 33, 'sideways_rsi_ob': 53, 'sideways_adx_thresh': 5.4431581785570256, 'sideways_atr_min_pct': 0.007938113740887742, 'sideways_atr_max_pct': 0.06431120237556448, 'sideways_tp_mult': 2.4720352381412587, 'sideways_tsl_mult': 0.9895227858792354, 'sideways_time_stop': 189, 'sideways_use_sma': True, 'sideways_use_ema': True, 'sideways_use_atr': True, 'sideways_use_adx': True, 'sideways_use_spike': False, 'sideways_rsi_required': False}.
[I 2025-09-01 14:42:45,480] Trial 520 finished with values: [-0.03840935078773222, 0.03817207040618721] and parameters: {'p_sma': 43, 'p_std': 24, 'p_atr': 11, 'p_adx': 23, 'rsi_period': 46, 'ema1': 9, 'ema2': 55, 'slip_atr_k': 0.18647787241050925, 'slip_spread_k': 0.5975068838230762, 'spread_hl_frac': 0.02108671935776601, 'bb_std_mult': 3.5982837938214725, 'rsi_os': 45, 'rsi_ob': 47, 'vol_spike': 0.11512867270128754, 'adx_thresh': 5.47898751794758, 'atr_min_pct': 0.011629830252056, 'atr_max_pct': 0.11458443962962712, 'tp_mult': 1.3595896260835056, 'tsl_mult': 0.7063943580611016, 'strategy': 'breakout', 'time_stop': 115, 'use_sma': True, 'use_atr': False, 'use_adx': False, 'use_ema': False, 'use_spike': False, 'rsi_required': True, 'edge_k': 0.23210815701436854, 'edge_cap': 0.9810871147228118, 'bull_strategy': 'mean_reversion', 'bull_bb_std_mult': 3.311070931403629, 'bull_rsi_os': 35, 'bull_rsi_ob': 78, 'bull_adx_thresh': 11.009017742169684, 'bull_atr_min_pct': 0.025054069909870275, 'bull_atr_max_pct': 0.12410115104210981, 'bull_tp_mult': 1.70268567691351, 'bull_tsl_mult': 0.3949650057153541, 'bull_time_stop': 162, 'bull_use_sma': True, 'bull_use_ema': False, 'bull_use_atr': False, 'bull_use_adx': True, 'bull_use_spike': True, 'bull_rsi_required': False, 'bear_strategy': 'breakout', 'bear_bb_std_mult': 2.64460258715682, 'bear_rsi_os': 36, 'bear_rsi_ob': 58, 'bear_adx_thresh': 9.049342481955922, 'bear_atr_min_pct': 0.0028779118573889107, 'bear_atr_max_pct': 0.1099955316083551, 'bear_tp_mult': 2.6175814444946885, 'bear_tsl_mult': 0.19414503415936735, 'bear_time_stop': 106, 'bear_use_sma': True, 'bear_use_ema': False, 'bear_use_atr': True, 'bear_use_adx': True, 'bear_use_spike': True, 'bear_rsi_required': True, 'sideways_strategy': 'breakout', 'sideways_bb_std_mult': 3.0908600126221346, 'sideways_rsi_os': 53, 'sideways_rsi_ob': 93, 'sideways_adx_thresh': 25.95353356193417, 'sideways_atr_min_pct': 0.003993097343982538, 'sideways_atr_max_pct': 0.11369597667135584, 'sideways_tp_mult': 2.3958738958262247, 'sideways_tsl_mult': 0.3813146602315883, 'sideways_time_stop': 57, 'sideways_use_sma': True, 'sideways_use_ema': False, 'sideways_use_atr': False, 'sideways_use_adx': True, 'sideways_use_spike': True, 'sideways_rsi_required': True}.
[I 2025-09-01 14:42:45,927] Trial 519 finished with values: [-1000000000.0, 1000000000.0] and parameters: {'p_sma': 29, 'p_std': 32, 'p_atr': 27, 'p_adx': 8, 'rsi_period': 79, 'ema1': 27, 'ema2': 57, 'slip_atr_k': 0.05898638601437761, 'slip_spread_k': 0.6019399633013836, 'spread_hl_frac': 0.010464360304386572, 'bb_std_mult': 1.2770760557946448, 'rsi_os': 53, 'rsi_ob': 93, 'vol_spike': 0.22357839352403053, 'adx_thresh': 7.297945440729677, 'atr_min_pct': 0.007255658806124714, 'atr_max_pct': 0.0473216640619609, 'tp_mult': 2.4651642745398625, 'tsl_mult': 0.8692485389004138, 'strategy': 'breakout', 'time_stop': 118, 'use_sma': True, 'use_atr': True, 'use_adx': False, 'use_ema': False, 'use_spike': True, 'rsi_required': True, 'edge_k': 0.2358360766972154, 'edge_cap': 0.98465301045765, 'bull_strategy': 'mean_reversion', 'bull_bb_std_mult': 3.1958158758353314, 'bull_rsi_os': 35, 'bull_rsi_ob': 78, 'bull_adx_thresh': 10.63333078151508, 'bull_atr_min_pct': 0.012078314553017805, 'bull_atr_max_pct': 0.12903710492865753, 'bull_tp_mult': 1.6827615114556114, 'bull_tsl_mult': 0.38553540872838865, 'bull_time_stop': 220, 'bull_use_sma': True, 'bull_use_ema': True, 'bull_use_atr': True, 'bull_use_adx': True, 'bull_use_spike': True, 'bull_rsi_required': False, 'bear_strategy': 'breakout', 'bear_bb_std_mult': 2.635536169697881, 'bear_rsi_os': 36, 'bear_rsi_ob': 58, 'bear_adx_thresh': 33.3234358537144, 'bear_atr_min_pct': 0.028018749175387797, 'bear_atr_max_pct': 0.1137909507295096, 'bear_tp_mult': 2.4981020090784534, 'bear_tsl_mult': 0.1918671115942887, 'bear_time_stop': 80, 'bear_use_sma': True, 'bear_use_ema': False, 'bear_use_atr': True, 'bear_use_adx': False, 'bear_use_spike': True, 'bear_rsi_required': True, 'sideways_strategy': 'mean_reversion', 'sideways_bb_std_mult': 3.0828985550792583, 'sideways_rsi_os': 52, 'sideways_rsi_ob': 93, 'sideways_adx_thresh': 26.03453466771907, 'sideways_atr_min_pct': 0.0039624421463453985, 'sideways_atr_max_pct': 0.06630481414043715, 'sideways_tp_mult': 2.384358813142585, 'sideways_tsl_mult': 0.4423867084822358, 'sideways_time_stop': 67, 'sideways_use_sma': True, 'sideways_use_ema': False, 'sideways_use_atr': False, 'sideways_use_adx': True, 'sideways_use_spike': True, 'sideways_rsi_required': True}.
[I 2025-09-01 14:42:46,256] Trial 518 finished with values: [-1000000000.0, 1000000000.0] and parameters: {'p_sma': 30, 'p_std': 56, 'p_atr': 10, 'p_adx': 8, 'rsi_period': 79, 'ema1': 9, 'ema2': 20, 'slip_atr_k': 0.18729690880406122, 'slip_spread_k': 0.604995198117451, 'spread_hl_frac': 0.010586938631016627, 'bb_std_mult': 1.695728402389849, 'rsi_os': 36, 'rsi_ob': 47, 'vol_spike': 0.08842397304188389, 'adx_thresh': 6.938944851579777, 'atr_min_pct': 0.007252078620556242, 'atr_max_pct': 0.056102407190047554, 'tp_mult': 1.432437554754116, 'tsl_mult': 0.7066518642801161, 'strategy': 'breakout', 'time_stop': 113, 'use_sma': True, 'use_atr': False, 'use_adx': False, 'use_ema': False, 'use_spike': True, 'rsi_required': True, 'edge_k': 0.2323025142928514, 'edge_cap': 0.49668976932983655, 'bull_strategy': 'breakout', 'bull_bb_std_mult': 1.9013571089389851, 'bull_rsi_os': 11, 'bull_rsi_ob': 78, 'bull_adx_thresh': 19.244048598874475, 'bull_atr_min_pct': 0.011894058203266647, 'bull_atr_max_pct': 0.1243522356822868, 'bull_tp_mult': 2.7863319421865684, 'bull_tsl_mult': 0.3893297042790142, 'bull_time_stop': 59, 'bull_use_sma': False, 'bull_use_ema': True, 'bull_use_atr': True, 'bull_use_adx': True, 'bull_use_spike': True, 'bull_rsi_required': False, 'bear_strategy': 'breakout', 'bear_bb_std_mult': 2.5190135485686054, 'bear_rsi_os': 35, 'bear_rsi_ob': 95, 'bear_adx_thresh': 9.215516968863525, 'bear_atr_min_pct': 0.008366935914787875, 'bear_atr_max_pct': 0.10876633264527383, 'bear_tp_mult': 2.38185535525837, 'bear_tsl_mult': 0.6851636672488974, 'bear_time_stop': 81, 'bear_use_sma': True, 'bear_use_ema': False, 'bear_use_atr': True, 'bear_use_adx': False, 'bear_use_spike': True, 'bear_rsi_required': False, 'sideways_strategy': 'mean_reversion', 'sideways_bb_std_mult': 2.9661475185910686, 'sideways_rsi_os': 52, 'sideways_rsi_ob': 93, 'sideways_adx_thresh': 25.856354181180475, 'sideways_atr_min_pct': 0.00416175833685073, 'sideways_atr_max_pct': 0.06356352653602863, 'sideways_tp_mult': 2.3887385177329756, 'sideways_tsl_mult': 0.2916454388331132, 'sideways_time_stop': 251, 'sideways_use_sma': True, 'sideways_use_ema': True, 'sideways_use_atr': False, 'sideways_use_adx': True, 'sideways_use_spike': True, 'sideways_rsi_required': True}.
[I 2025-09-01 14:42:46,455] Trial 517 finished with values: [-1000000000.0, 1000000000.0] and parameters: {'p_sma': 47, 'p_std': 9, 'p_atr': 27, 'p_adx': 8, 'rsi_period': 71, 'ema1': 11, 'ema2': 55, 'slip_atr_k': 0.19775108010349995, 'slip_spread_k': 0.5165049042345056, 'spread_hl_frac': 0.009268917366069381, 'bb_std_mult': 0.5186270066761711, 'rsi_os': 41, 'rsi_ob': 85, 'vol_spike': 0.11544962505031153, 'adx_thresh': 32.85608915942177, 'atr_min_pct': 0.0007474423446036157, 'atr_max_pct': 0.035697128400692384, 'tp_mult': 2.4684781531541256, 'tsl_mult': 0.6953974698768861, 'strategy': 'breakout', 'time_stop': 120, 'use_sma': True, 'use_atr': False, 'use_adx': False, 'use_ema': True, 'use_spike': True, 'rsi_required': True, 'edge_k': 0.3949693443170369, 'edge_cap': 0.9356811452649045, 'bull_strategy': 'breakout', 'bull_bb_std_mult': 3.2393746888930703, 'bull_rsi_os': 49, 'bull_rsi_ob': 57, 'bull_adx_thresh': 13.032530730867268, 'bull_atr_min_pct': 0.02870241371032186, 'bull_atr_max_pct': 0.07628528153363437, 'bull_tp_mult': 1.6237631488616031, 'bull_tsl_mult': 0.46999778888400107, 'bull_time_stop': 162, 'bull_use_sma': False, 'bull_use_ema': True, 'bull_use_atr': True, 'bull_use_adx': False, 'bull_use_spike': True, 'bull_rsi_required': True, 'bear_strategy': 'breakout', 'bear_bb_std_mult': 1.6692289126928006, 'bear_rsi_os': 36, 'bear_rsi_ob': 92, 'bear_adx_thresh': 13.41613619790477, 'bear_atr_min_pct': 0.0026814700616743467, 'bear_atr_max_pct': 0.0222362224705741, 'bear_tp_mult': 2.1389339531857883, 'bear_tsl_mult': 0.19053684982352453, 'bear_time_stop': 81, 'bear_use_sma': True, 'bear_use_ema': False, 'bear_use_atr': True, 'bear_use_adx': False, 'bear_use_spike': True, 'bear_rsi_required': False, 'sideways_strategy': 'mean_reversion', 'sideways_bb_std_mult': 2.9573279381303332, 'sideways_rsi_os': 16, 'sideways_rsi_ob': 59, 'sideways_adx_thresh': 24.25402533579102, 'sideways_atr_min_pct': 0.020364558908458348, 'sideways_atr_max_pct': 0.14623601263152697, 'sideways_tp_mult': 2.3984345949634127, 'sideways_tsl_mult': 0.28674679526503444, 'sideways_time_stop': 171, 'sideways_use_sma': True, 'sideways_use_ema': True, 'sideways_use_atr': False, 'sideways_use_adx': True, 'sideways_use_spike': False, 'sideways_rsi_required': True}.
[I 2025-09-01 14:43:26,846] Trial 524 finished with values: [-1000000000.0, 1000000000.0] and parameters: {'p_sma': 28, 'p_std': 28, 'p_atr': 25, 'p_adx': 18, 'rsi_period': 76, 'ema1': 7, 'ema2': 56, 'slip_atr_k': 0.11732064533438288, 'slip_spread_k': 0.16231678454262305, 'spread_hl_frac': 0.0035030738142770163, 'bb_std_mult': 3.4406347079292607, 'rsi_os': 42, 'rsi_ob': 56, 'vol_spike': 0.1219910507235409, 'adx_thresh': 20.426494808566005, 'atr_min_pct': 0.012417975766838847, 'atr_max_pct': 0.07742058705846673, 'tp_mult': 1.2310626562141083, 'tsl_mult': 0.6294834859530194, 'strategy': 'mean_reversion', 'time_stop': 258, 'use_sma': True, 'use_atr': False, 'use_adx': True, 'use_ema': True, 'use_spike': False, 'rsi_required': False, 'edge_k': 0.858976614532553, 'edge_cap': 0.8451314324622675, 'bull_strategy': 'breakout', 'bull_bb_std_mult': 3.468017125823327, 'bull_rsi_os': 14, 'bull_rsi_ob': 91, 'bull_adx_thresh': 11.405492854076147, 'bull_atr_min_pct': 0.01303239045758835, 'bull_atr_max_pct': 0.13210230739222711, 'bull_tp_mult': 1.8217102329920292, 'bull_tsl_mult': 0.2607049136739401, 'bull_time_stop': 151, 'bull_use_sma': False, 'bull_use_ema': False, 'bull_use_atr': False, 'bull_use_adx': True, 'bull_use_spike': True, 'bull_rsi_required': True, 'bear_strategy': 'mean_reversion', 'bear_bb_std_mult': 1.8455644324074159, 'bear_rsi_os': 31, 'bear_rsi_ob': 57, 'bear_adx_thresh': 7.55225942677625, 'bear_atr_min_pct': 0.004046243805053089, 'bear_atr_max_pct': 0.11322921387846752, 'bear_tp_mult': 2.0145293044303805, 'bear_tsl_mult': 0.05353202378506042, 'bear_time_stop': 95, 'bear_use_sma': False, 'bear_use_ema': False, 'bear_use_atr': False, 'bear_use_adx': True, 'bear_use_spike': True, 'bear_rsi_required': False, 'sideways_strategy': 'breakout', 'sideways_bb_std_mult': 3.170042922451505, 'sideways_rsi_os': 49, 'sideways_rsi_ob': 90, 'sideways_adx_thresh': 20.968256797291158, 'sideways_atr_min_pct': 0.004723721446701915, 'sideways_atr_max_pct': 0.04816079991471613, 'sideways_tp_mult': 2.434867618607392, 'sideways_tsl_mult': 0.4083989162055447, 'sideways_time_stop': 280, 'sideways_use_sma': False, 'sideways_use_ema': True, 'sideways_use_atr': True, 'sideways_use_adx': False, 'sideways_use_spike': False, 'sideways_rsi_required': False}.
