[I 2025-09-01 14:47:14,395] Trial 546 finished with values: [-1000000000.0, 1000000000.0] and parameters: {'p_sma': 60, 'p_std': 33, 'p_atr': 25, 'p_adx': 23, 'rsi_period': 84, 'ema1': 9, 'ema2': 36, 'slip_atr_k': 0.004159825497921972, 'slip_spread_k': 0.43500360471857114, 'spread_hl_frac': 0.010954357854794318, 'bb_std_mult': 3.541965061439309, 'rsi_os': 40, 'rsi_ob': 79, 'vol_spike': 0.21842371177673842, 'adx_thresh': 6.70550174457377, 'atr_min_pct': 0.008930787703086179, 'atr_max_pct': 0.0353600016248746, 'tp_mult': 1.054678849034198, 'tsl_mult': 0.6536205598191012, 'strategy': 'mean_reversion', 'time_stop': 135, 'use_sma': False, 'use_atr': False, 'use_adx': True, 'use_ema': True, 'use_spike': True, 'rsi_required': True, 'edge_k': 0.30187689013855257, 'edge_cap': 0.9374707854208352, 'bull_strategy': 'breakout', 'bull_bb_std_mult': 0.9339067170134085, 'bull_rsi_os': 13, 'bull_rsi_ob': 81, 'bull_adx_thresh': 12.32300143855403, 'bull_atr_min_pct': 0.011733436875856778, 'bull_atr_max_pct': 0.13097439771785296, 'bull_tp_mult': 2.5992053298540716, 'bull_tsl_mult': 0.7962460246730537, 'bull_time_stop': 125, 'bull_use_sma': False, 'bull_use_ema': False, 'bull_use_atr': True, 'bull_use_adx': True, 'bull_use_spike': False, 'bull_rsi_required': True, 'bear_strategy': 'mean_reversion', 'bear_bb_std_mult': 2.5229407853265755, 'bear_rsi_os': 24, 'bear_rsi_ob': 56, 'bear_adx_thresh': 8.165175142859615, 'bear_atr_min_pct': 0.0022034213371542404, 'bear_atr_max_pct': 0.13849214521036854, 'bear_tp_mult': 2.075424878213308, 'bear_tsl_mult': 0.21475482137707314, 'bear_time_stop': 111, 'bear_use_sma': False, 'bear_use_ema': True, 'bear_use_atr': False, 'bear_use_adx': False, 'bear_use_spike': True, 'bear_rsi_required': False, 'sideways_strategy': 'mean_reversion', 'sideways_bb_std_mult': 2.930250254616071, 'sideways_rsi_os': 32, 'sideways_rsi_ob': 50, 'sideways_adx_thresh': 24.570165165168532, 'sideways_atr_min_pct': 0.004811909457653726, 'sideways_atr_max_pct': 0.0549189272934328, 'sideways_tp_mult': 2.965093435818047, 'sideways_tsl_mult': 0.6041113184519439, 'sideways_time_stop': 276, 'sideways_use_sma': False, 'sideways_use_ema': True, 'sideways_use_atr': False, 'sideways_use_adx': True, 'sideways_use_spike': False, 'sideways_rsi_required': False}.
[I 2025-09-01 14:47:55,928] Trial 551 finished with values: [-1000000000.0, 1000000000.0] and parameters: {'p_sma': 29, 'p_std': 31, 'p_atr': 26, 'p_adx': 25, 'rsi_period': 82, 'ema1': 10, 'ema2': 56, 'slip_atr_k': 0.02469803970864889, 'slip_spread_k': 0.5093024500023782, 'spread_hl_frac': 0.005465876515813515, 'bb_std_mult': 2.473630911177109, 'rsi_os': 43, 'rsi_ob': 52, 'vol_spike': 0.08836188531888552, 'adx_thresh': 9.089552695354637, 'atr_min_pct': 0.012593866588248162, 'atr_max_pct': 0.11834890225310898, 'tp_mult': 1.3796443048025826, 'tsl_mult': 0.5745301702132316, 'strategy': 'mean_reversion', 'time_stop': 104, 'use_sma': True, 'use_atr': False, 'use_adx': True, 'use_ema': False, 'use_spike': False, 'rsi_required': True, 'edge_k': 1.359234030101661, 'edge_cap': 0.9654930158846542, 'bull_strategy': 'breakout', 'bull_bb_std_mult': 3.092329944756019, 'bull_rsi_os': 12, 'bull_rsi_ob': 76, 'bull_adx_thresh': 31.605901504649513, 'bull_atr_min_pct': 0.011107251382883956, 'bull_atr_max_pct': 0.11652807708079313, 'bull_tp_mult': 1.708784000970554, 'bull_tsl_mult': 0.7403836436572405, 'bull_time_stop': 29, 'bull_use_sma': False, 'bull_use_ema': True, 'bull_use_atr': False, 'bull_use_adx': True, 'bull_use_spike': True, 'bull_rsi_required': False, 'bear_strategy': 'mean_reversion', 'bear_bb_std_mult': 2.566832337265829, 'bear_rsi_os': 21, 'bear_rsi_ob': 69, 'bear_adx_thresh': 7.826667745587095, 'bear_atr_min_pct': 0.021221355882914624, 'bear_atr_max_pct': 0.1142311698559814, 'bear_tp_mult': 1.9305414384914685, 'bear_tsl_mult': 0.12000952509014765, 'bear_time_stop': 99, 'bear_use_sma': True, 'bear_use_ema': False, 'bear_use_atr': False, 'bear_use_adx': True, 'bear_use_spike': True, 'bear_rsi_required': True, 'sideways_strategy': 'breakout', 'sideways_bb_std_mult': 3.15999929324558, 'sideways_rsi_os': 29, 'sideways_rsi_ob': 70, 'sideways_adx_thresh': 26.055810922638205, 'sideways_atr_min_pct': 0.02778452557923583, 'sideways_atr_max_pct': 0.11128416398301641, 'sideways_tp_mult': 1.4524544032752311, 'sideways_tsl_mult': 0.0634213834776447, 'sideways_time_stop': 220, 'sideways_use_sma': True, 'sideways_use_ema': True, 'sideways_use_atr': True, 'sideways_use_adx': True, 'sideways_use_spike': False, 'sideways_rsi_required': False}.
[I 2025-09-01 14:47:57,831] Trial 552 finished with values: [-1000000000.0, 1000000000.0] and parameters: {'p_sma': 29, 'p_std': 29, 'p_atr': 26, 'p_adx': 14, 'rsi_period': 65, 'ema1': 10, 'ema2': 18, 'slip_atr_k': 0.1723892791927179, 'slip_spread_k': 0.5097870614330456, 'spread_hl_frac': 0.009920363518876756, 'bb_std_mult': 2.475134034063673, 'rsi_os': 31, 'rsi_ob': 64, 'vol_spike': 0.2645600284582722, 'adx_thresh': 5.005775643994227, 'atr_min_pct': 0.011493035833312081, 'atr_max_pct': 0.13739792922561833, 'tp_mult': 1.3941075790378914, 'tsl_mult': 0.7421254992985142, 'strategy': 'mean_reversion', 'time_stop': 103, 'use_sma': True, 'use_atr': False, 'use_adx': True, 'use_ema': False, 'use_spike': False, 'rsi_required': True, 'edge_k': 0.5031122010712263, 'edge_cap': 0.3094697026901502, 'bull_strategy': 'breakout', 'bull_bb_std_mult': 3.198331329683493, 'bull_rsi_os': 33, 'bull_rsi_ob': 76, 'bull_adx_thresh': 8.346230330588728, 'bull_atr_min_pct': 0.01255855717179201, 'bull_atr_max_pct': 0.01788737735279814, 'bull_tp_mult': 1.6122446719465882, 'bull_tsl_mult': 0.6483118618544201, 'bull_time_stop': 160, 'bull_use_sma': False, 'bull_use_ema': True, 'bull_use_atr': False, 'bull_use_adx': True, 'bull_use_spike': True, 'bull_rsi_required': False, 'bear_strategy': 'mean_reversion', 'bear_bb_std_mult': 2.5441452239143936, 'bear_rsi_os': 31, 'bear_rsi_ob': 69, 'bear_adx_thresh': 30.986575097612707, 'bear_atr_min_pct': 0.0030954156480684464, 'bear_atr_max_pct': 0.11969523382119213, 'bear_tp_mult': 1.9424111478378705, 'bear_tsl_mult': 0.11224398513942387, 'bear_time_stop': 257, 'bear_use_sma': True, 'bear_use_ema': False, 'bear_use_atr': False, 'bear_use_adx': True, 'bear_use_spike': True, 'bear_rsi_required': True, 'sideways_strategy': 'breakout', 'sideways_bb_std_mult': 3.326197368465885, 'sideways_rsi_os': 43, 'sideways_rsi_ob': 91, 'sideways_adx_thresh': 25.96855028888139, 'sideways_atr_min_pct': 0.028021750683043738, 'sideways_atr_max_pct': 0.08356254588485047, 'sideways_tp_mult': 1.4455678328346209, 'sideways_tsl_mult': 0.3779260397404818, 'sideways_time_stop': 259, 'sideways_use_sma': True, 'sideways_use_ema': True, 'sideways_use_atr': True, 'sideways_use_adx': True, 'sideways_use_spike': False, 'sideways_rsi_required': False}.
[I 2025-09-01 14:47:57,841] Trial 553 finished with values: [-1000000000.0, 1000000000.0] and parameters: {'p_sma': 54, 'p_std': 31, 'p_atr': 30, 'p_adx': 14, 'rsi_period': 82, 'ema1': 10, 'ema2': 56, 'slip_atr_k': 0.09206659267688203, 'slip_spread_k': 0.5252155535659742, 'spread_hl_frac': 0.009668335846963187, 'bb_std_mult': 3.4147261006821275, 'rsi_os': 31, 'rsi_ob': 94, 'vol_spike': 0.26596255518869794, 'adx_thresh': 7.855451385319351, 'atr_min_pct': 0.012676209361136507, 'atr_max_pct': 0.02887913234705397, 'tp_mult': 1.3715852457278406, 'tsl_mult': 0.24226037383847787, 'strategy': 'mean_reversion', 'time_stop': 200, 'use_sma': True, 'use_atr': False, 'use_adx': True, 'use_ema': False, 'use_spike': False, 'rsi_required': True, 'edge_k': 1.5410806170636995, 'edge_cap': 0.511084425441022, 'bull_strategy': 'breakout', 'bull_bb_std_mult': 2.9390373452660556, 'bull_rsi_os': 12, 'bull_rsi_ob': 76, 'bull_adx_thresh': 34.86904234756389, 'bull_atr_min_pct': 0.012456052768768615, 'bull_atr_max_pct': 0.11980059312949574, 'bull_tp_mult': 2.292530561832547, 'bull_tsl_mult': 0.6571442175921264, 'bull_time_stop': 262, 'bull_use_sma': False, 'bull_use_ema': True, 'bull_use_atr': False, 'bull_use_adx': True, 'bull_use_spike': True, 'bull_rsi_required': False, 'bear_strategy': 'mean_reversion', 'bear_bb_std_mult': 0.9353758393064044, 'bear_rsi_os': 19, 'bear_rsi_ob': 83, 'bear_adx_thresh': 7.803702345223105, 'bear_atr_min_pct': 0.00038286935417218386, 'bear_atr_max_pct': 0.11988553108562033, 'bear_tp_mult': 1.2834519937880875, 'bear_tsl_mult': 0.11618526160652584, 'bear_time_stop': 99, 'bear_use_sma': True, 'bear_use_ema': False, 'bear_use_atr': False, 'bear_use_adx': True, 'bear_use_spike': True, 'bear_rsi_required': True, 'sideways_strategy': 'breakout', 'sideways_bb_std_mult': 3.3316213896673696, 'sideways_rsi_os': 29, 'sideways_rsi_ob': 57, 'sideways_adx_thresh': 25.793112830303038, 'sideways_atr_min_pct': 0.0038518726175389385, 'sideways_atr_max_pct': 0.11228993258527761, 'sideways_tp_mult': 2.3914807482881506, 'sideways_tsl_mult': 0.06602739455822049, 'sideways_time_stop': 258, 'sideways_use_sma': True, 'sideways_use_ema': True, 'sideways_use_atr': True, 'sideways_use_adx': True, 'sideways_use_spike': False, 'sideways_rsi_required': False}.
[I 2025-09-01 14:47:57,842] Trial 550 finished with values: [-0.006451887717706106, 0.006733471803246678] and parameters: {'p_sma': 33, 'p_std': 54, 'p_atr': 25, 'p_adx': 22, 'rsi_period': 82, 'ema1': 7, 'ema2': 58, 'slip_atr_k': 0.02590670291317687, 'slip_spread_k': 0.6552559676185873, 'spread_hl_frac': 0.010027538348445685, 'bb_std_mult': 2.8815737630627094, 'rsi_os': 43, 'rsi_ob': 64, 'vol_spike': 0.1638615823805072, 'adx_thresh': 10.238045023903098, 'atr_min_pct': 0.009092846398295737, 'atr_max_pct': 0.053261055300664294, 'tp_mult': 1.3760237448109847, 'tsl_mult': 0.5769221411666086, 'strategy': 'mean_reversion', 'time_stop': 36, 'use_sma': False, 'use_atr': True, 'use_adx': True, 'use_ema': True, 'use_spike': False, 'rsi_required': False, 'edge_k': 0.30110778075309313, 'edge_cap': 0.938728118397392, 'bull_strategy': 'breakout', 'bull_bb_std_mult': 2.27370194209696, 'bull_rsi_os': 12, 'bull_rsi_ob': 63, 'bull_adx_thresh': 12.344477157530534, 'bull_atr_min_pct': 0.0025348481394201205, 'bull_atr_max_pct': 0.0724281939481704, 'bull_tp_mult': 2.605154517217696, 'bull_tsl_mult': 0.4954357392959642, 'bull_time_stop': 150, 'bull_use_sma': False, 'bull_use_ema': False, 'bull_use_atr': False, 'bull_use_adx': True, 'bull_use_spike': False, 'bull_rsi_required': True, 'bear_strategy': 'mean_reversion', 'bear_bb_std_mult': 0.9898950763475538, 'bear_rsi_os': 20, 'bear_rsi_ob': 91, 'bear_adx_thresh': 8.117212684166432, 'bear_atr_min_pct': 0.002048572015632644, 'bear_atr_max_pct': 0.11907206802510975, 'bear_tp_mult': 1.5549258583365906, 'bear_tsl_mult': 0.11615546952545687, 'bear_time_stop': 97, 'bear_use_sma': True, 'bear_use_ema': False, 'bear_use_atr': False, 'bear_use_adx': True, 'bear_use_spike': True, 'bear_rsi_required': False, 'sideways_strategy': 'breakout', 'sideways_bb_std_mult': 2.559369964031736, 'sideways_rsi_os': 41, 'sideways_rsi_ob': 61, 'sideways_adx_thresh': 26.323806553237745, 'sideways_atr_min_pct': 0.009754502839185582, 'sideways_atr_max_pct': 0.11196855032916077, 'sideways_tp_mult': 2.2016811903788236, 'sideways_tsl_mult': 0.4807589916963901, 'sideways_time_stop': 248, 'sideways_use_sma': True, 'sideways_use_ema': True, 'sideways_use_atr': False, 'sideways_use_adx': True, 'sideways_use_spike': True, 'sideways_rsi_required': True}.
[I 2025-09-01 14:47:58,733] Trial 554 finished with values: [-1000000000.0, 1000000000.0] and parameters: {'p_sma': 30, 'p_std': 25, 'p_atr': 26, 'p_adx': 9, 'rsi_period': 80, 'ema1': 8, 'ema2': 54, 'slip_atr_k': 0.031032323428315647, 'slip_spread_k': 0.6574899122319641, 'spread_hl_frac': 0.009446574361434139, 'bb_std_mult': 3.392338947935402, 'rsi_os': 44, 'rsi_ob': 45, 'vol_spike': 0.19707119521307798, 'adx_thresh': 18.384234358671293, 'atr_min_pct': 0.019279773680823807, 'atr_max_pct': 0.028321582954680024, 'tp_mult': 1.4138005947365875, 'tsl_mult': 0.745644023475095, 'strategy': 'mean_reversion', 'time_stop': 71, 'use_sma': True, 'use_atr': False, 'use_adx': True, 'use_ema': True, 'use_spike': True, 'rsi_required': False, 'edge_k': 0.4745242953121076, 'edge_cap': 0.4804069937650102, 'bull_strategy': 'breakout', 'bull_bb_std_mult': 3.1969582568903743, 'bull_rsi_os': 33, 'bull_rsi_ob': 77, 'bull_adx_thresh': 25.96538011432424, 'bull_atr_min_pct': 0.01244343954914862, 'bull_atr_max_pct': 0.027621586867351902, 'bull_tp_mult': 1.6220405835134943, 'bull_tsl_mult': 0.9526520940598813, 'bull_time_stop': 73, 'bull_use_sma': False, 'bull_use_ema': True, 'bull_use_atr': True, 'bull_use_adx': True, 'bull_use_spike': True, 'bull_rsi_required': True, 'bear_strategy': 'mean_reversion', 'bear_bb_std_mult': 2.2619950603971892, 'bear_rsi_os': 31, 'bear_rsi_ob': 84, 'bear_adx_thresh': 17.97996855588647, 'bear_atr_min_pct': 0.00010405260376168462, 'bear_atr_max_pct': 0.0164892758916277, 'bear_tp_mult': 2.5365799131354043, 'bear_tsl_mult': 0.16407631039434023, 'bear_time_stop': 257, 'bear_use_sma': False, 'bear_use_ema': False, 'bear_use_atr': False, 'bear_use_adx': False, 'bear_use_spike': False, 'bear_rsi_required': False, 'sideways_strategy': 'mean_reversion', 'sideways_bb_std_mult': 2.549374119148097, 'sideways_rsi_os': 33, 'sideways_rsi_ob': 57, 'sideways_adx_thresh': 25.547664099332437, 'sideways_atr_min_pct': 0.003989335722103344, 'sideways_atr_max_pct': 0.07148058056550617, 'sideways_tp_mult': 2.2284196308157793, 'sideways_tsl_mult': 0.39059705796205163, 'sideways_time_stop': 259, 'sideways_use_sma': True, 'sideways_use_ema': True, 'sideways_use_atr': True, 'sideways_use_adx': False, 'sideways_use_spike': False, 'sideways_rsi_required': False}.
[I 2025-09-01 14:48:31,816] Trial 556 finished with values: [-1000000000.0, 1000000000.0] and parameters: {'p_sma': 21, 'p_std': 25, 'p_atr': 28, 'p_adx': 9, 'rsi_period': 79, 'ema1': 20, 'ema2': 31, 'slip_atr_k': 0.013017466357844672, 'slip_spread_k': 0.13901374038187764, 'spread_hl_frac': 0.007504283902915655, 'bb_std_mult': 2.2799300421018147, 'rsi_os': 45, 'rsi_ob': 91, 'vol_spike': 0.08024021769478223, 'adx_thresh': 5.866415640546627, 'atr_min_pct': 0.010626341731017412, 'atr_max_pct': 0.040113198263982575, 'tp_mult': 2.2265691160376075, 'tsl_mult': 0.7110371452608196, 'strategy': 'mean_reversion', 'time_stop': 125, 'use_sma': True, 'use_atr': False, 'use_adx': True, 'use_ema': True, 'use_spike': True, 'rsi_required': True, 'edge_k': 1.4881544621426546, 'edge_cap': 0.9621890058598221, 'bull_strategy': 'mean_reversion', 'bull_bb_std_mult': 3.147127096153387, 'bull_rsi_os': 14, 'bull_rsi_ob': 73, 'bull_adx_thresh': 27.983525095300962, 'bull_atr_min_pct': 0.010748963460041054, 'bull_atr_max_pct': 0.12262590541428033, 'bull_tp_mult': 1.534583331297477, 'bull_tsl_mult': 0.43026569180330027, 'bull_time_stop': 139, 'bull_use_sma': False, 'bull_use_ema': True, 'bull_use_atr': True, 'bull_use_adx': True, 'bull_use_spike': True, 'bull_rsi_required': True, 'bear_strategy': 'mean_reversion', 'bear_bb_std_mult': 2.28178315095448, 'bear_rsi_os': 32, 'bear_rsi_ob': 56, 'bear_adx_thresh': 9.347504709943326, 'bear_atr_min_pct': 0.011671172825289362, 'bear_atr_max_pct': 0.10731583675200834, 'bear_tp_mult': 2.0221372308112135, 'bear_tsl_mult': 0.15794244527896864, 'bear_time_stop': 91, 'bear_use_sma': False, 'bear_use_ema': False, 'bear_use_atr': False, 'bear_use_adx': False, 'bear_use_spike': False, 'bear_rsi_required': False, 'sideways_strategy': 'mean_reversion', 'sideways_bb_std_mult': 3.011239678873541, 'sideways_rsi_os': 10, 'sideways_rsi_ob': 89, 'sideways_adx_thresh': 11.7651531461414, 'sideways_atr_min_pct': 0.004241443583172559, 'sideways_atr_max_pct': 0.14112795035570422, 'sideways_tp_mult': 2.4528059781561242, 'sideways_tsl_mult': 0.4177865554556295, 'sideways_time_stop': 239, 'sideways_use_sma': True, 'sideways_use_ema': True, 'sideways_use_atr': True, 'sideways_use_adx': False, 'sideways_use_spike': False, 'sideways_rsi_required': False}.
[I 2025-09-01 14:48:32,495] Trial 555 finished with values: [-1000000000.0, 1000000000.0] and parameters: {'p_sma': 21, 'p_std': 28, 'p_atr': 28, 'p_adx': 9, 'rsi_period': 41, 'ema1': 8, 'ema2': 59, 'slip_atr_k': 0.013024246341925665, 'slip_spread_k': 0.5917475587498797, 'spread_hl_frac': 0.006622209691124457, 'bb_std_mult': 2.233883654651228, 'rsi_os': 45, 'rsi_ob': 81, 'vol_spike': 0.10971995891828751, 'adx_thresh': 13.354632295431616, 'atr_min_pct': 0.019083822349795488, 'atr_max_pct': 0.039251980587845126, 'tp_mult': 1.2789718634219818, 'tsl_mult': 0.287960698157086, 'strategy': 'mean_reversion', 'time_stop': 126, 'use_sma': True, 'use_atr': False, 'use_adx': True, 'use_ema': True, 'use_spike': True, 'rsi_required': True, 'edge_k': 0.17004420538774498, 'edge_cap': 0.47510917753139364, 'bull_strategy': 'mean_reversion', 'bull_bb_std_mult': 3.1525141478949927, 'bull_rsi_os': 42, 'bull_rsi_ob': 86, 'bull_adx_thresh': 26.586137738214692, 'bull_atr_min_pct': 0.011445449469036492, 'bull_atr_max_pct': 0.027709895896548174, 'bull_tp_mult': 1.5603944889316068, 'bull_tsl_mult': 0.43975747788713426, 'bull_time_stop': 46, 'bull_use_sma': False, 'bull_use_ema': True, 'bull_use_atr': True, 'bull_use_adx': True, 'bull_use_spike': True, 'bull_rsi_required': True, 'bear_strategy': 'mean_reversion', 'bear_bb_std_mult': 2.274372354809093, 'bear_rsi_os': 35, 'bear_rsi_ob': 57, 'bear_adx_thresh': 20.492538316510554, 'bear_atr_min_pct': 0.02052868400636819, 'bear_atr_max_pct': 0.10799601484604145, 'bear_tp_mult': 2.1254826866443843, 'bear_tsl_mult': 0.44940134789535224, 'bear_time_stop': 78, 'bear_use_sma': False, 'bear_use_ema': False, 'bear_use_atr': False, 'bear_use_adx': False, 'bear_use_spike': False, 'bear_rsi_required': False, 'sideways_strategy': 'mean_reversion', 'sideways_bb_std_mult': 2.4866536437956785, 'sideways_rsi_os': 31, 'sideways_rsi_ob': 89, 'sideways_adx_thresh': 34.414616413250016, 'sideways_atr_min_pct': 0.004236927952309928, 'sideways_atr_max_pct': 0.10611497188607409, 'sideways_tp_mult': 2.457724332624756, 'sideways_tsl_mult': 0.4149448741040674, 'sideways_time_stop': 238, 'sideways_use_sma': True, 'sideways_use_ema': True, 'sideways_use_atr': True, 'sideways_use_adx': False, 'sideways_use_spike': False, 'sideways_rsi_required': False}.
[I 2025-09-01 14:48:33,224] Trial 557 finished with values: [-0.019587114212440082, 0.0218123059445947] and parameters: {'p_sma': 27, 'p_std': 25, 'p_atr': 28, 'p_adx': 9, 'rsi_period': 58, 'ema1': 8, 'ema2': 60, 'slip_atr_k': 0.15151136740690008, 'slip_spread_k': 0.5685496260754702, 'spread_hl_frac': 0.006598892045197428, 'bb_std_mult': 2.313123687746465, 'rsi_os': 25, 'rsi_ob': 54, 'vol_spike': 0.08105371763598336, 'adx_thresh': 18.28001032956425, 'atr_min_pct': 0.010604156995085046, 'atr_max_pct': 0.039491188078971486, 'tp_mult': 1.414935302610733, 'tsl_mult': 0.708359199893817, 'strategy': 'mean_reversion', 'time_stop': 149, 'use_sma': True, 'use_atr': False, 'use_adx': True, 'use_ema': True, 'use_spike': True, 'rsi_required': True, 'edge_k': 0.16358994144820366, 'edge_cap': 0.9681914197940573, 'bull_strategy': 'mean_reversion', 'bull_bb_std_mult': 3.1552781274042365, 'bull_rsi_os': 10, 'bull_rsi_ob': 73, 'bull_adx_thresh': 25.84899558503859, 'bull_atr_min_pct': 0.01438614357352579, 'bull_atr_max_pct': 0.03386529874031563, 'bull_tp_mult': 2.8367847928769376, 'bull_tsl_mult': 0.43957019109526807, 'bull_time_stop': 138, 'bull_use_sma': False, 'bull_use_ema': True, 'bull_use_atr': True, 'bull_use_adx': True, 'bull_use_spike': True, 'bull_rsi_required': True, 'bear_strategy': 'mean_reversion', 'bear_bb_std_mult': 2.6824016848347196, 'bear_rsi_os': 32, 'bear_rsi_ob': 56, 'bear_adx_thresh': 9.195882715393356, 'bear_atr_min_pct': 0.0012249009955204696, 'bear_atr_max_pct': 0.018160530219054, 'bear_tp_mult': 2.0271691291360967, 'bear_tsl_mult': 0.1709908039399735, 'bear_time_stop': 195, 'bear_use_sma': False, 'bear_use_ema': False, 'bear_use_atr': False, 'bear_use_adx': False, 'bear_use_spike': False, 'bear_rsi_required': False, 'sideways_strategy': 'mean_reversion', 'sideways_bb_std_mult': 1.6963057562312212, 'sideways_rsi_os': 26, 'sideways_rsi_ob': 80, 'sideways_adx_thresh': 25.245243446161094, 'sideways_atr_min_pct': 0.002542108862548015, 'sideways_atr_max_pct': 0.07114979553661926, 'sideways_tp_mult': 2.0077273924607377, 'sideways_tsl_mult': 0.33264241813847967, 'sideways_time_stop': 238, 'sideways_use_sma': True, 'sideways_use_ema': True, 'sideways_use_atr': True, 'sideways_use_adx': False, 'sideways_use_spike': False, 'sideways_rsi_required': False}.
