[I 2025-09-01 14:30:16,746] Trial 432 finished with values: [-0.00875204237543259, 0.012547912698573947] and parameters: {'p_sma': 29, 'p_std': 27, 'p_atr': 18, 'p_adx': 9, 'rsi_period': 79, 'ema1': 9, 'ema2': 58, 'slip_atr_k': 0.03755796563023689, 'slip_spread_k': 0.9189228022226095, 'spread_hl_frac': 0.010490863312686782, 'bb_std_mult': 3.290278516516872, 'rsi_os': 24, 'rsi_ob': 84, 'vol_spike': 0.09927535349789385, 'adx_thresh': 14.256902965211331, 'atr_min_pct': 0.0063710098091765924, 'atr_max_pct': 0.033671541980275936, 'tp_mult': 2.5020224650163225, 'tsl_mult': 0.7768539794325651, 'strategy': 'mean_reversion', 'time_stop': 17, 'use_sma': True, 'use_atr': False, 'use_adx': True, 'use_ema': True, 'use_spike': True, 'rsi_required': True, 'edge_k': 0.1431551760321701, 'edge_cap': 0.8135431474436896, 'bull_strategy': 'breakout', 'bull_bb_std_mult': 3.2820376423556104, 'bull_rsi_os': 8, 'bull_rsi_ob': 80, 'bull_adx_thresh': 11.278340918479458, 'bull_atr_min_pct': 0.010398462688012904, 'bull_atr_max_pct': 0.026562051603806466, 'bull_tp_mult': 2.736807134282489, 'bull_tsl_mult': 0.45724591088511246, 'bull_time_stop': 22, 'bull_use_sma': True, 'bull_use_ema': True, 'bull_use_atr': True, 'bull_use_adx': False, 'bull_use_spike': True, 'bull_rsi_required': True, 'bear_strategy': 'mean_reversion', 'bear_bb_std_mult': 1.9736103421473288, 'bear_rsi_os': 36, 'bear_rsi_ob': 84, 'bear_adx_thresh': 25.33944968875058, 'bear_atr_min_pct': 0.00042245019949065376, 'bear_atr_max_pct': 0.10387675760094411, 'bear_tp_mult': 2.048953348808169, 'bear_tsl_mult': 0.10741250185542027, 'bear_time_stop': 92, 'bear_use_sma': False, 'bear_use_ema': False, 'bear_use_atr': False, 'bear_use_adx': False, 'bear_use_spike': True, 'bear_rsi_required': False, 'sideways_strategy': 'mean_reversion', 'sideways_bb_std_mult': 2.721915349148943, 'sideways_rsi_os': 44, 'sideways_rsi_ob': 92, 'sideways_adx_thresh': 17.546894595247267, 'sideways_atr_min_pct': 0.009559005481374708, 'sideways_atr_max_pct': 0.06336238956098472, 'sideways_tp_mult': 2.458521572803805, 'sideways_tsl_mult': 0.3352445875035018, 'sideways_time_stop': 213, 'sideways_use_sma': True, 'sideways_use_ema': True, 'sideways_use_atr': True, 'sideways_use_adx': True, 'sideways_use_spike': False, 'sideways_rsi_required': False}.
[I 2025-09-01 14:30:16,746] Trial 431 finished with values: [-0.010742400848326006, 0.013986629195322764] and parameters: {'p_sma': 41, 'p_std': 6, 'p_atr': 23, 'p_adx': 9, 'rsi_period': 57, 'ema1': 27, 'ema2': 51, 'slip_atr_k': 0.14392216097004473, 'slip_spread_k': 0.5808938180661777, 'spread_hl_frac': 0.01037004898257057, 'bb_std_mult': 3.4364434474762864, 'rsi_os': 49, 'rsi_ob': 93, 'vol_spike': 0.08431528466937317, 'adx_thresh': 17.626357877613074, 'atr_min_pct': 0.0110405714291275, 'atr_max_pct': 0.03380252557227742, 'tp_mult': 1.3720371042121258, 'tsl_mult': 0.6916591723046396, 'strategy': 'mean_reversion', 'time_stop': 195, 'use_sma': False, 'use_atr': False, 'use_adx': True, 'use_ema': True, 'use_spike': True, 'rsi_required': True, 'edge_k': 0.2794380038981457, 'edge_cap': 0.9400772398623953, 'bull_strategy': 'breakout', 'bull_bb_std_mult': 0.6428424536862691, 'bull_rsi_os': 12, 'bull_rsi_ob': 80, 'bull_adx_thresh': 27.77709627509873, 'bull_atr_min_pct': 0.011654486152416528, 'bull_atr_max_pct': 0.09566362887372275, 'bull_tp_mult': 1.5760456559245932, 'bull_tsl_mult': 0.44757655710247685, 'bull_time_stop': 300, 'bull_use_sma': True, 'bull_use_ema': False, 'bull_use_atr': True, 'bull_use_adx': False, 'bull_use_spike': True, 'bull_rsi_required': True, 'bear_strategy': 'mean_reversion', 'bear_bb_std_mult': 1.9903719947385135, 'bear_rsi_os': 31, 'bear_rsi_ob': 56, 'bear_adx_thresh': 13.720759934183459, 'bear_atr_min_pct': 0.001848407311840626, 'bear_atr_max_pct': 0.027738747758433775, 'bear_tp_mult': 2.076875444846637, 'bear_tsl_mult': 0.7862570171128993, 'bear_time_stop': 23, 'bear_use_sma': False, 'bear_use_ema': False, 'bear_use_atr': True, 'bear_use_adx': False, 'bear_use_spike': True, 'bear_rsi_required': False, 'sideways_strategy': 'mean_reversion', 'sideways_bb_std_mult': 3.390494492069811, 'sideways_rsi_os': 7, 'sideways_rsi_ob': 89, 'sideways_adx_thresh': 20.450937445745573, 'sideways_atr_min_pct': 0.025795443376414783, 'sideways_atr_max_pct': 0.10712867208413474, 'sideways_tp_mult': 2.4687955194251585, 'sideways_tsl_mult': 0.8980274904811003, 'sideways_time_stop': 178, 'sideways_use_sma': True, 'sideways_use_ema': True, 'sideways_use_atr': True, 'sideways_use_adx': True, 'sideways_use_spike': False, 'sideways_rsi_required': True}.
[I 2025-09-01 14:30:17,086] Trial 433 finished with values: [-0.0028203622083831092, 0.007492785721580776] and parameters: {'p_sma': 29, 'p_std': 27, 'p_atr': 14, 'p_adx': 19, 'rsi_period': 57, 'ema1': 21, 'ema2': 60, 'slip_atr_k': 0.019684170885342637, 'slip_spread_k': 0.5295215120209248, 'spread_hl_frac': 0.012969318148135778, 'bb_std_mult': 3.43728366645381, 'rsi_os': 43, 'rsi_ob': 53, 'vol_spike': 0.14706734196806656, 'adx_thresh': 15.067935811877247, 'atr_min_pct': 0.012295080763265707, 'atr_max_pct': 0.0337807636764147, 'tp_mult': 2.5013137782679613, 'tsl_mult': 0.7734610486994214, 'strategy': 'mean_reversion', 'time_stop': 197, 'use_sma': False, 'use_atr': False, 'use_adx': True, 'use_ema': True, 'use_spike': True, 'rsi_required': True, 'edge_k': 0.1586194784815853, 'edge_cap': 0.5687736404708872, 'bull_strategy': 'breakout', 'bull_bb_std_mult': 3.1787967125287175, 'bull_rsi_os': 39, 'bull_rsi_ob': 79, 'bull_adx_thresh': 19.01453638981583, 'bull_atr_min_pct': 0.010357411125181964, 'bull_atr_max_pct': 0.029044511004113392, 'bull_tp_mult': 2.7266450875681967, 'bull_tsl_mult': 0.7848864117758187, 'bull_time_stop': 155, 'bull_use_sma': True, 'bull_use_ema': True, 'bull_use_atr': True, 'bull_use_adx': False, 'bull_use_spike': True, 'bull_rsi_required': True, 'bear_strategy': 'mean_reversion', 'bear_bb_std_mult': 1.9991804458083329, 'bear_rsi_os': 36, 'bear_rsi_ob': 56, 'bear_adx_thresh': 24.8438040870072, 'bear_atr_min_pct': 0.0033797929293752954, 'bear_atr_max_pct': 0.11107422445716979, 'bear_tp_mult': 2.0591945726758927, 'bear_tsl_mult': 0.8959740165892462, 'bear_time_stop': 92, 'bear_use_sma': True, 'bear_use_ema': False, 'bear_use_atr': False, 'bear_use_adx': False, 'bear_use_spike': True, 'bear_rsi_required': False, 'sideways_strategy': 'mean_reversion', 'sideways_bb_std_mult': 1.341745819011486, 'sideways_rsi_os': 6, 'sideways_rsi_ob': 88, 'sideways_adx_thresh': 24.199777307156364, 'sideways_atr_min_pct': 0.006532716932385323, 'sideways_atr_max_pct': 0.09394082863816586, 'sideways_tp_mult': 1.048871862621768, 'sideways_tsl_mult': 0.34364818884282977, 'sideways_time_stop': 97, 'sideways_use_sma': True, 'sideways_use_ema': True, 'sideways_use_atr': False, 'sideways_use_adx': True, 'sideways_use_spike': False, 'sideways_rsi_required': False}.
[I 2025-09-01 14:30:18,372] Trial 435 finished with values: [-1000000000.0, 1000000000.0] and parameters: {'p_sma': 50, 'p_std': 24, 'p_atr': 25, 'p_adx': 10, 'rsi_period': 82, 'ema1': 10, 'ema2': 58, 'slip_atr_k': 0.1643604583039906, 'slip_spread_k': 0.41555239658342863, 'spread_hl_frac': 0.012776589453734543, 'bb_std_mult': 3.4619327916679485, 'rsi_os': 43, 'rsi_ob': 47, 'vol_spike': 0.04752847158841663, 'adx_thresh': 17.60860189491529, 'atr_min_pct': 0.023198192721265436, 'atr_max_pct': 0.03382770293409798, 'tp_mult': 1.091886367609225, 'tsl_mult': 0.7059552590070993, 'strategy': 'mean_reversion', 'time_stop': 123, 'use_sma': True, 'use_atr': False, 'use_adx': True, 'use_ema': True, 'use_spike': True, 'rsi_required': True, 'edge_k': 0.15832065276339724, 'edge_cap': 0.9813264989693612, 'bull_strategy': 'breakout', 'bull_bb_std_mult': 0.6288490557145368, 'bull_rsi_os': 44, 'bull_rsi_ob': 77, 'bull_adx_thresh': 10.907756287677097, 'bull_atr_min_pct': 0.011658540898769807, 'bull_atr_max_pct': 0.1377143840402969, 'bull_tp_mult': 1.6681775959119614, 'bull_tsl_mult': 0.46970474901583353, 'bull_time_stop': 155, 'bull_use_sma': True, 'bull_use_ema': True, 'bull_use_atr': True, 'bull_use_adx': False, 'bull_use_spike': True, 'bull_rsi_required': True, 'bear_strategy': 'mean_reversion', 'bear_bb_std_mult': 2.56967885926857, 'bear_rsi_os': 35, 'bear_rsi_ob': 56, 'bear_adx_thresh': 32.201324004198575, 'bear_atr_min_pct': 0.00036565594346442496, 'bear_atr_max_pct': 0.10775715797954041, 'bear_tp_mult': 2.907647454265734, 'bear_tsl_mult': 0.16433647581963876, 'bear_time_stop': 89, 'bear_use_sma': False, 'bear_use_ema': False, 'bear_use_atr': False, 'bear_use_adx': False, 'bear_use_spike': True, 'bear_rsi_required': False, 'sideways_strategy': 'mean_reversion', 'sideways_bb_std_mult': 3.2400782571756563, 'sideways_rsi_os': 31, 'sideways_rsi_ob': 72, 'sideways_adx_thresh': 24.070844724896173, 'sideways_atr_min_pct': 0.005218140226279861, 'sideways_atr_max_pct': 0.11502814887177815, 'sideways_tp_mult': 2.471136741348725, 'sideways_tsl_mult': 0.8969654268881055, 'sideways_time_stop': 179, 'sideways_use_sma': True, 'sideways_use_ema': True, 'sideways_use_atr': True, 'sideways_use_adx': True, 'sideways_use_spike': False, 'sideways_rsi_required': False}.
[I 2025-09-01 14:30:59,604] Trial 438 finished with values: [-1000000000.0, 1000000000.0] and parameters: {'p_sma': 26, 'p_std': 24, 'p_atr': 27, 'p_adx': 25, 'rsi_period': 82, 'ema1': 20, 'ema2': 44, 'slip_atr_k': 0.004687829068470485, 'slip_spread_k': 0.4086862025404217, 'spread_hl_frac': 0.006569132369842705, 'bb_std_mult': 3.355897987094528, 'rsi_os': 15, 'rsi_ob': 58, 'vol_spike': 0.2539044050557845, 'adx_thresh': 5.045947211328452, 'atr_min_pct': 0.011714370050342846, 'atr_max_pct': 0.06387581969031016, 'tp_mult': 2.841603223652602, 'tsl_mult': 0.7119051281016766, 'strategy': 'mean_reversion', 'time_stop': 128, 'use_sma': True, 'use_atr': False, 'use_adx': True, 'use_ema': True, 'use_spike': False, 'rsi_required': True, 'edge_k': 0.22913055183815345, 'edge_cap': 0.9793660603653902, 'bull_strategy': 'breakout', 'bull_bb_std_mult': 3.0679045272312555, 'bull_rsi_os': 30, 'bull_rsi_ob': 70, 'bull_adx_thresh': 11.031121404576787, 'bull_atr_min_pct': 0.012663975182987376, 'bull_atr_max_pct': 0.13797680204957577, 'bull_tp_mult': 2.32185744672733, 'bull_tsl_mult': 0.47618519423964617, 'bull_time_stop': 151, 'bull_use_sma': False, 'bull_use_ema': True, 'bull_use_atr': True, 'bull_use_adx': True, 'bull_use_spike': True, 'bull_rsi_required': True, 'bear_strategy': 'mean_reversion', 'bear_bb_std_mult': 2.782120738768034, 'bear_rsi_os': 33, 'bear_rsi_ob': 71, 'bear_adx_thresh': 7.848259008629402, 'bear_atr_min_pct': 0.009266631011198085, 'bear_atr_max_pct': 0.016699861287551285, 'bear_tp_mult': 2.0994746559020747, 'bear_tsl_mult': 0.16545330225739335, 'bear_time_stop': 84, 'bear_use_sma': False, 'bear_use_ema': False, 'bear_use_atr': False, 'bear_use_adx': False, 'bear_use_spike': True, 'bear_rsi_required': False, 'sideways_strategy': 'mean_reversion', 'sideways_bb_std_mult': 3.2003009268577527, 'sideways_rsi_os': 30, 'sideways_rsi_ob': 91, 'sideways_adx_thresh': 25.82804996688356, 'sideways_atr_min_pct': 0.005202215101546557, 'sideways_atr_max_pct': 0.11485000587539197, 'sideways_tp_mult': 2.358821631047487, 'sideways_tsl_mult': 0.9507468452096619, 'sideways_time_stop': 266, 'sideways_use_sma': True, 'sideways_use_ema': False, 'sideways_use_atr': True, 'sideways_use_adx': True, 'sideways_use_spike': False, 'sideways_rsi_required': False}.
[I 2025-09-01 14:31:00,140] Trial 436 finished with values: [-1000000000.0, 1000000000.0] and parameters: {'p_sma': 26, 'p_std': 55, 'p_atr': 25, 'p_adx': 10, 'rsi_period': 82, 'ema1': 8, 'ema2': 56, 'slip_atr_k': 0.07633412402179643, 'slip_spread_k': 0.41325137601579887, 'spread_hl_frac': 0.01287998458363606, 'bb_std_mult': 3.598841656776432, 'rsi_os': 20, 'rsi_ob': 51, 'vol_spike': 0.2550512855051841, 'adx_thresh': 26.31763226168221, 'atr_min_pct': 0.012063525097888482, 'atr_max_pct': 0.08358916386389012, 'tp_mult': 1.2993834174580228, 'tsl_mult': 0.4327132649548421, 'strategy': 'mean_reversion', 'time_stop': 172, 'use_sma': True, 'use_atr': False, 'use_adx': True, 'use_ema': True, 'use_spike': False, 'rsi_required': True, 'edge_k': 0.157524652150058, 'edge_cap': 0.9801517429813017, 'bull_strategy': 'breakout', 'bull_bb_std_mult': 2.051495449103202, 'bull_rsi_os': 30, 'bull_rsi_ob': 92, 'bull_adx_thresh': 10.827617484806975, 'bull_atr_min_pct': 0.012785298029227541, 'bull_atr_max_pct': 0.13882846569901225, 'bull_tp_mult': 2.43518350091567, 'bull_tsl_mult': 0.473893809656291, 'bull_time_stop': 155, 'bull_use_sma': False, 'bull_use_ema': True, 'bull_use_atr': True, 'bull_use_adx': True, 'bull_use_spike': True, 'bull_rsi_required': True, 'bear_strategy': 'mean_reversion', 'bear_bb_std_mult': 2.785909299857212, 'bear_rsi_os': 33, 'bear_rsi_ob': 56, 'bear_adx_thresh': 24.71738163179001, 'bear_atr_min_pct': 0.009216653041009153, 'bear_atr_max_pct': 0.10747861701831563, 'bear_tp_mult': 2.1629232654762736, 'bear_tsl_mult': 0.16381308914715004, 'bear_time_stop': 85, 'bear_use_sma': True, 'bear_use_ema': False, 'bear_use_atr': False, 'bear_use_adx': False, 'bear_use_spike': True, 'bear_rsi_required': False, 'sideways_strategy': 'mean_reversion', 'sideways_bb_std_mult': 2.9245175693929344, 'sideways_rsi_os': 30, 'sideways_rsi_ob': 90, 'sideways_adx_thresh': 24.164717577101403, 'sideways_atr_min_pct': 0.00523499712832913, 'sideways_atr_max_pct': 0.1145111315243358, 'sideways_tp_mult': 1.474159947138525, 'sideways_tsl_mult': 0.9686752331979878, 'sideways_time_stop': 263, 'sideways_use_sma': True, 'sideways_use_ema': True, 'sideways_use_atr': False, 'sideways_use_adx': True, 'sideways_use_spike': False, 'sideways_rsi_required': False}.
[I 2025-09-01 14:31:00,845] Trial 439 finished with values: [-1000000000.0, 1000000000.0] and parameters: {'p_sma': 26, 'p_std': 26, 'p_atr': 20, 'p_adx': 22, 'rsi_period': 43, 'ema1': 8, 'ema2': 44, 'slip_atr_k': 0.00601769421906001, 'slip_spread_k': 0.5644721486290184, 'spread_hl_frac': 0.02479969711901882, 'bb_std_mult': 3.5569546455028638, 'rsi_os': 40, 'rsi_ob': 51, 'vol_spike': 0.10722509456893385, 'adx_thresh': 7.5181351357276585, 'atr_min_pct': 0.023964141738071404, 'atr_max_pct': 0.03809365127142541, 'tp_mult': 1.7702300983763628, 'tsl_mult': 0.6624733863653506, 'strategy': 'mean_reversion', 'time_stop': 230, 'use_sma': True, 'use_atr': False, 'use_adx': True, 'use_ema': True, 'use_spike': False, 'rsi_required': True, 'edge_k': 0.72496555482251, 'edge_cap': 0.9632800953716817, 'bull_strategy': 'breakout', 'bull_bb_std_mult': 2.0418089881095423, 'bull_rsi_os': 30, 'bull_rsi_ob': 77, 'bull_adx_thresh': 7.175810031539083, 'bull_atr_min_pct': 0.012487242522592664, 'bull_atr_max_pct': 0.1245041779424608, 'bull_tp_mult': 2.3234063692761837, 'bull_tsl_mult': 0.2293147146562574, 'bull_time_stop': 160, 'bull_use_sma': False, 'bull_use_ema': True, 'bull_use_atr': True, 'bull_use_adx': True, 'bull_use_spike': True, 'bull_rsi_required': True, 'bear_strategy': 'mean_reversion', 'bear_bb_std_mult': 0.9056432187094163, 'bear_rsi_os': 33, 'bear_rsi_ob': 60, 'bear_adx_thresh': 7.574893352014882, 'bear_atr_min_pct': 0.02307022173154462, 'bear_atr_max_pct': 0.11453249615294708, 'bear_tp_mult': 1.2998074739110206, 'bear_tsl_mult': 0.6426730253552436, 'bear_time_stop': 204, 'bear_use_sma': False, 'bear_use_ema': False, 'bear_use_atr': False, 'bear_use_adx': False, 'bear_use_spike': True, 'bear_rsi_required': False, 'sideways_strategy': 'mean_reversion', 'sideways_bb_std_mult': 1.474343105015794, 'sideways_rsi_os': 30, 'sideways_rsi_ob': 90, 'sideways_adx_thresh': 25.817708261041968, 'sideways_atr_min_pct': 0.02141427904679415, 'sideways_atr_max_pct': 0.06701005089233308, 'sideways_tp_mult': 1.470940531127363, 'sideways_tsl_mult': 0.3850032135079569, 'sideways_time_stop': 248, 'sideways_use_sma': True, 'sideways_use_ema': False, 'sideways_use_atr': True, 'sideways_use_adx': True, 'sideways_use_spike': False, 'sideways_rsi_required': False}.
[I 2025-09-01 14:31:01,233] Trial 437 finished with values: [-1000000000.0, 1000000000.0] and parameters: {'p_sma': 26, 'p_std': 24, 'p_atr': 25, 'p_adx': 12, 'rsi_period': 82, 'ema1': 8, 'ema2': 56, 'slip_atr_k': 0.020385367463157084, 'slip_spread_k': 0.2391898867836731, 'spread_hl_frac': 0.01270417853800044, 'bb_std_mult': 3.4735189275600646, 'rsi_os': 43, 'rsi_ob': 51, 'vol_spike': 0.266644700756895, 'adx_thresh': 5.00037939083487, 'atr_min_pct': 0.023988682973481598, 'atr_max_pct': 0.030740910446175607, 'tp_mult': 1.3011361541467084, 'tsl_mult': 0.6624721824273534, 'strategy': 'mean_reversion', 'time_stop': 170, 'use_sma': True, 'use_atr': False, 'use_adx': True, 'use_ema': True, 'use_spike': False, 'rsi_required': True, 'edge_k': 0.7223117728079964, 'edge_cap': 0.979189454568444, 'bull_strategy': 'breakout', 'bull_bb_std_mult': 3.1872534393135865, 'bull_rsi_os': 54, 'bull_rsi_ob': 77, 'bull_adx_thresh': 6.784984020311507, 'bull_atr_min_pct': 0.012580001473512289, 'bull_atr_max_pct': 0.05953945581899345, 'bull_tp_mult': 1.643772679960697, 'bull_tsl_mult': 0.4768996296177702, 'bull_time_stop': 153, 'bull_use_sma': False, 'bull_use_ema': True, 'bull_use_atr': True, 'bull_use_adx': True, 'bull_use_spike': True, 'bull_rsi_required': True, 'bear_strategy': 'mean_reversion', 'bear_bb_std_mult': 2.5935325483466527, 'bear_rsi_os': 33, 'bear_rsi_ob': 60, 'bear_adx_thresh': 32.94362801752003, 'bear_atr_min_pct': 0.001237031169733133, 'bear_atr_max_pct': 0.04627959099279668, 'bear_tp_mult': 2.1643765363740988, 'bear_tsl_mult': 0.8898141499879758, 'bear_time_stop': 84, 'bear_use_sma': True, 'bear_use_ema': False, 'bear_use_atr': False, 'bear_use_adx': False, 'bear_use_spike': True, 'bear_rsi_required': False, 'sideways_strategy': 'mean_reversion', 'sideways_bb_std_mult': 2.616672504524292, 'sideways_rsi_os': 30, 'sideways_rsi_ob': 90, 'sideways_adx_thresh': 24.345420149124383, 'sideways_atr_min_pct': 0.02772303054512562, 'sideways_atr_max_pct': 0.1140926527494028, 'sideways_tp_mult': 2.295958869494435, 'sideways_tsl_mult': 0.9597355229962949, 'sideways_time_stop': 248, 'sideways_use_sma': True, 'sideways_use_ema': True, 'sideways_use_atr': False, 'sideways_use_adx': True, 'sideways_use_spike': False, 'sideways_rsi_required': False}.
[I 2025-09-01 14:31:41,690] Trial 441 finished with values: [-1000000000.0, 1000000000.0] and parameters: {'p_sma': 33, 'p_std': 26, 'p_atr': 20, 'p_adx': 12, 'rsi_period': 47, 'ema1': 8, 'ema2': 55, 'slip_atr_k': 0.2153308908411859, 'slip_spread_k': 0.7276676546353603, 'spread_hl_frac': 0.02450656804531459, 'bb_std_mult': 0.8767826821388902, 'rsi_os': 6, 'rsi_ob': 52, 'vol_spike': 0.07236953040225849, 'adx_thresh': 10.880507516407846, 'atr_min_pct': 0.028527910068887836, 'atr_max_pct': 0.1337225210767053, 'tp_mult': 1.4813983269081918, 'tsl_mult': 0.20414545443213, 'strategy': 'mean_reversion', 'time_stop': 140, 'use_sma': True, 'use_atr': False, 'use_adx': True, 'use_ema': True, 'use_spike': True, 'rsi_required': True, 'edge_k': 0.20702973118293744, 'edge_cap': 0.961835463849108, 'bull_strategy': 'breakout', 'bull_bb_std_mult': 2.4550700843865463, 'bull_rsi_os': 54, 'bull_rsi_ob': 62, 'bull_adx_thresh': 25.4293381350141, 'bull_atr_min_pct': 0.011013353339687351, 'bull_atr_max_pct': 0.059570360292010405, 'bull_tp_mult': 1.5224788893591181, 'bull_tsl_mult': 0.8967227843364886, 'bull_time_stop': 237, 'bull_use_sma': False, 'bull_use_ema': False, 'bull_use_atr': True, 'bull_use_adx': True, 'bull_use_spike': True, 'bull_rsi_required': True, 'bear_strategy': 'mean_reversion', 'bear_bb_std_mult': 2.455266313147156, 'bear_rsi_os': 18, 'bear_rsi_ob': 48, 'bear_adx_thresh': 9.378281369318472, 'bear_atr_min_pct': 0.0012647389878551027, 'bear_atr_max_pct': 0.11342240800996727, 'bear_tp_mult': 1.9981280102232712, 'bear_tsl_mult': 0.08135017302162101, 'bear_time_stop': 205, 'bear_use_sma': False, 'bear_use_ema': False, 'bear_use_atr': False, 'bear_use_adx': False, 'bear_use_spike': True, 'bear_rsi_required': False, 'sideways_strategy': 'mean_reversion', 'sideways_bb_std_mult': 2.605710693887907, 'sideways_rsi_os': 48, 'sideways_rsi_ob': 92, 'sideways_adx_thresh': 10.641685059218116, 'sideways_atr_min_pct': 0.019840842404799622, 'sideways_atr_max_pct': 0.11139153618945032, 'sideways_tp_mult': 1.5291946955069404, 'sideways_tsl_mult': 0.3846671997265312, 'sideways_time_stop': 250, 'sideways_use_sma': True, 'sideways_use_ema': False, 'sideways_use_atr': True, 'sideways_use_adx': True, 'sideways_use_spike': True, 'sideways_rsi_required': False}.
