[I 2025-09-01 14:15:09,433] Trial 326 finished with values: [-0.05367567867493894, 0.05398892989837148] and parameters: {'p_sma': 32, 'p_std': 28, 'p_atr': 26, 'p_adx': 8, 'rsi_period': 77, 'ema1': 24, 'ema2': 56, 'slip_atr_k': 0.241215456617281, 'slip_spread_k': 0.579461705828665, 'spread_hl_frac': 0.040020147619839186, 'bb_std_mult': 3.5442449158572518, 'rsi_os': 29, 'rsi_ob': 57, 'vol_spike': 0.11914894322200481, 'adx_thresh': 5.718018719447167, 'atr_min_pct': 0.010307507836206199, 'atr_max_pct': 0.026815521998988453, 'tp_mult': 1.3308920902470662, 'tsl_mult': 0.673438425145848, 'strategy': 'mean_reversion', 'time_stop': 239, 'use_sma': True, 'use_atr': False, 'use_adx': True, 'use_ema': True, 'use_spike': True, 'rsi_required': True, 'edge_k': 0.1720452973119303, 'edge_cap': 0.9632395549646637, 'bull_strategy': 'breakout', 'bull_bb_std_mult': 3.196111937576787, 'bull_rsi_os': 14, 'bull_rsi_ob': 78, 'bull_adx_thresh': 32.426773406463106, 'bull_atr_min_pct': 0.012011762155813396, 'bull_atr_max_pct': 0.13490681396690313, 'bull_tp_mult': 1.6174632588579272, 'bull_tsl_mult': 0.46581613775901626, 'bull_time_stop': 148, 'bull_use_sma': False, 'bull_use_ema': True, 'bull_use_atr': True, 'bull_use_adx': True, 'bull_use_spike': True, 'bull_rsi_required': True, 'bear_strategy': 'mean_reversion', 'bear_bb_std_mult': 2.6961219375753553, 'bear_rsi_os': 37, 'bear_rsi_ob': 86, 'bear_adx_thresh': 8.82444133546784, 'bear_atr_min_pct': 0.002761638552261926, 'bear_atr_max_pct': 0.10473555171136754, 'bear_tp_mult': 2.125467399914218, 'bear_tsl_mult': 0.1333277065297577, 'bear_time_stop': 93, 'bear_use_sma': False, 'bear_use_ema': False, 'bear_use_atr': False, 'bear_use_adx': False, 'bear_use_spike': True, 'bear_rsi_required': False, 'sideways_strategy': 'mean_reversion', 'sideways_bb_std_mult': 2.970731495138725, 'sideways_rsi_os': 22, 'sideways_rsi_ob': 90, 'sideways_adx_thresh': 24.575360727259206, 'sideways_atr_min_pct': 0.004286604171243073, 'sideways_atr_max_pct': 0.04543283592925429, 'sideways_tp_mult': 2.161466577265971, 'sideways_tsl_mult': 0.43176064282973964, 'sideways_time_stop': 121, 'sideways_use_sma': True, 'sideways_use_ema': True, 'sideways_use_atr': True, 'sideways_use_adx': True, 'sideways_use_spike': False, 'sideways_rsi_required': False}.
[I 2025-09-01 14:15:10,474] Trial 324 finished with values: [-0.0032769243076973265, 0.0059897872067027355] and parameters: {'p_sma': 30, 'p_std': 28, 'p_atr': 26, 'p_adx': 9, 'rsi_period': 77, 'ema1': 15, 'ema2': 56, 'slip_atr_k': 0.008903373507065352, 'slip_spread_k': 0.5660342298672316, 'spread_hl_frac': 0.010493226902153227, 'bb_std_mult': 3.5470839258093663, 'rsi_os': 44, 'rsi_ob': 55, 'vol_spike': 0.11857977595758892, 'adx_thresh': 5.021281922665718, 'atr_min_pct': 0.011806357644750983, 'atr_max_pct': 0.026661682589864184, 'tp_mult': 1.345375540932952, 'tsl_mult': 0.6737198440113115, 'strategy': 'mean_reversion', 'time_stop': 129, 'use_sma': True, 'use_atr': False, 'use_adx': True, 'use_ema': True, 'use_spike': False, 'rsi_required': True, 'edge_k': 0.10042766198788886, 'edge_cap': 0.9994841337480069, 'bull_strategy': 'mean_reversion', 'bull_bb_std_mult': 3.185812127682529, 'bull_rsi_os': 13, 'bull_rsi_ob': 77, 'bull_adx_thresh': 20.94702743824815, 'bull_atr_min_pct': 0.025365680396218265, 'bull_atr_max_pct': 0.12964307833661404, 'bull_tp_mult': 1.6237305829014046, 'bull_tsl_mult': 0.4613327259661817, 'bull_time_stop': 147, 'bull_use_sma': False, 'bull_use_ema': False, 'bull_use_atr': True, 'bull_use_adx': True, 'bull_use_spike': True, 'bull_rsi_required': True, 'bear_strategy': 'mean_reversion', 'bear_bb_std_mult': 2.3840265387179334, 'bear_rsi_os': 37, 'bear_rsi_ob': 58, 'bear_adx_thresh': 8.672744822483354, 'bear_atr_min_pct': 0.0027700912798579247, 'bear_atr_max_pct': 0.11924324878890635, 'bear_tp_mult': 1.085616590635333, 'bear_tsl_mult': 0.8465332146739313, 'bear_time_stop': 85, 'bear_use_sma': False, 'bear_use_ema': False, 'bear_use_atr': True, 'bear_use_adx': False, 'bear_use_spike': True, 'bear_rsi_required': False, 'sideways_strategy': 'mean_reversion', 'sideways_bb_std_mult': 3.0904906502035105, 'sideways_rsi_os': 29, 'sideways_rsi_ob': 60, 'sideways_adx_thresh': 24.973794520676964, 'sideways_atr_min_pct': 0.004342077847268201, 'sideways_atr_max_pct': 0.04723097123796493, 'sideways_tp_mult': 2.390239933304189, 'sideways_tsl_mult': 0.40169588453001703, 'sideways_time_stop': 85, 'sideways_use_sma': True, 'sideways_use_ema': True, 'sideways_use_atr': True, 'sideways_use_adx': True, 'sideways_use_spike': False, 'sideways_rsi_required': False}.
[I 2025-09-01 14:15:11,277] Trial 323 finished with values: [-1000000000.0, 1000000000.0] and parameters: {'p_sma': 28, 'p_std': 55, 'p_atr': 24, 'p_adx': 8, 'rsi_period': 81, 'ema1': 11, 'ema2': 56, 'slip_atr_k': 0.008720500504192819, 'slip_spread_k': 0.5444054353873088, 'spread_hl_frac': 0.01052181732719325, 'bb_std_mult': 3.5088874514100765, 'rsi_os': 42, 'rsi_ob': 55, 'vol_spike': 0.09615903418738025, 'adx_thresh': 5.014457210587728, 'atr_min_pct': 0.011942995417132285, 'atr_max_pct': 0.03535866537201136, 'tp_mult': 1.403402032136505, 'tsl_mult': 0.668389652706974, 'strategy': 'mean_reversion', 'time_stop': 146, 'use_sma': True, 'use_atr': False, 'use_adx': True, 'use_ema': True, 'use_spike': True, 'rsi_required': True, 'edge_k': 0.09846463278455928, 'edge_cap': 0.9995321032075699, 'bull_strategy': 'mean_reversion', 'bull_bb_std_mult': 3.3392782699011336, 'bull_rsi_os': 14, 'bull_rsi_ob': 77, 'bull_adx_thresh': 24.78745190479254, 'bull_atr_min_pct': 0.003787844499891538, 'bull_atr_max_pct': 0.12986721102977555, 'bull_tp_mult': 2.7594336038117815, 'bull_tsl_mult': 0.4018095216240984, 'bull_time_stop': 174, 'bull_use_sma': False, 'bull_use_ema': True, 'bull_use_atr': True, 'bull_use_adx': True, 'bull_use_spike': True, 'bull_rsi_required': True, 'bear_strategy': 'mean_reversion', 'bear_bb_std_mult': 2.4315551759042693, 'bear_rsi_os': 37, 'bear_rsi_ob': 74, 'bear_adx_thresh': 13.922588621159784, 'bear_atr_min_pct': 0.014611928262030479, 'bear_atr_max_pct': 0.11187373620885477, 'bear_tp_mult': 2.1256501076752996, 'bear_tsl_mult': 0.12031530149966241, 'bear_time_stop': 94, 'bear_use_sma': False, 'bear_use_ema': False, 'bear_use_atr': True, 'bear_use_adx': False, 'bear_use_spike': True, 'bear_rsi_required': False, 'sideways_strategy': 'mean_reversion', 'sideways_bb_std_mult': 3.160312838621049, 'sideways_rsi_os': 29, 'sideways_rsi_ob': 71, 'sideways_adx_thresh': 24.305336669234435, 'sideways_atr_min_pct': 0.0060851139544220315, 'sideways_atr_max_pct': 0.07526890406671527, 'sideways_tp_mult': 2.399476561811506, 'sideways_tsl_mult': 0.39319438766062037, 'sideways_time_stop': 82, 'sideways_use_sma': True, 'sideways_use_ema': True, 'sideways_use_atr': True, 'sideways_use_adx': True, 'sideways_use_spike': False, 'sideways_rsi_required': False}.
[I 2025-09-01 14:15:12,217] Trial 329 finished with values: [-1000000000.0, 1000000000.0] and parameters: {'p_sma': 26, 'p_std': 31, 'p_atr': 27, 'p_adx': 8, 'rsi_period': 84, 'ema1': 11, 'ema2': 59, 'slip_atr_k': 0.018673593643561224, 'slip_spread_k': 0.5420148232455854, 'spread_hl_frac': 0.011816571430035921, 'bb_std_mult': 3.43016731517075, 'rsi_os': 35, 'rsi_ob': 50, 'vol_spike': 0.10422505611781789, 'adx_thresh': 6.02496754115056, 'atr_min_pct': 0.010717843459692464, 'atr_max_pct': 0.031577336679184206, 'tp_mult': 1.4811894087215496, 'tsl_mult': 0.6467695029470933, 'strategy': 'mean_reversion', 'time_stop': 113, 'use_sma': True, 'use_atr': False, 'use_adx': True, 'use_ema': True, 'use_spike': True, 'rsi_required': True, 'edge_k': 0.39217009706813954, 'edge_cap': 0.9507822605427457, 'bull_strategy': 'breakout', 'bull_bb_std_mult': 3.0746259277950148, 'bull_rsi_os': 11, 'bull_rsi_ob': 78, 'bull_adx_thresh': 8.889847328577671, 'bull_atr_min_pct': 0.013064152961040285, 'bull_atr_max_pct': 0.08252471650604735, 'bull_tp_mult': 2.3446717759916313, 'bull_tsl_mult': 0.48270915974510503, 'bull_time_stop': 164, 'bull_use_sma': False, 'bull_use_ema': True, 'bull_use_atr': True, 'bull_use_adx': True, 'bull_use_spike': True, 'bull_rsi_required': True, 'bear_strategy': 'mean_reversion', 'bear_bb_std_mult': 2.5644102859190006, 'bear_rsi_os': 32, 'bear_rsi_ob': 56, 'bear_adx_thresh': 7.774193881227033, 'bear_atr_min_pct': 0.010705816894474524, 'bear_atr_max_pct': 0.1123176226385972, 'bear_tp_mult': 2.1364830452221235, 'bear_tsl_mult': 0.7966138495981581, 'bear_time_stop': 116, 'bear_use_sma': False, 'bear_use_ema': False, 'bear_use_atr': False, 'bear_use_adx': False, 'bear_use_spike': True, 'bear_rsi_required': False, 'sideways_strategy': 'mean_reversion', 'sideways_bb_std_mult': 3.006319405078273, 'sideways_rsi_os': 24, 'sideways_rsi_ob': 89, 'sideways_adx_thresh': 25.48599437398169, 'sideways_atr_min_pct': 0.001872225375347543, 'sideways_atr_max_pct': 0.10226162161298082, 'sideways_tp_mult': 2.357136992637913, 'sideways_tsl_mult': 0.27897613722760467, 'sideways_time_stop': 253, 'sideways_use_sma': True, 'sideways_use_ema': True, 'sideways_use_atr': True, 'sideways_use_adx': True, 'sideways_use_spike': False, 'sideways_rsi_required': False}.
[I 2025-09-01 14:15:53,355] Trial 327 finished with values: [-0.006200563087356392, 0.0076528584067881295] and parameters: {'p_sma': 26, 'p_std': 30, 'p_atr': 24, 'p_adx': 8, 'rsi_period': 74, 'ema1': 11, 'ema2': 59, 'slip_atr_k': 0.01905933874311814, 'slip_spread_k': 0.5403528078288904, 'spread_hl_frac': 0.01196718073229814, 'bb_std_mult': 3.429830669988011, 'rsi_os': 44, 'rsi_ob': 51, 'vol_spike': 0.10402333394773641, 'adx_thresh': 5.0554733999971555, 'atr_min_pct': 0.008282887352991875, 'atr_max_pct': 0.03180105661425625, 'tp_mult': 1.3818943686110436, 'tsl_mult': 0.6532318202838086, 'strategy': 'mean_reversion', 'time_stop': 112, 'use_sma': True, 'use_atr': False, 'use_adx': True, 'use_ema': True, 'use_spike': False, 'rsi_required': True, 'edge_k': 0.34892466113246967, 'edge_cap': 0.9501218208468577, 'bull_strategy': 'mean_reversion', 'bull_bb_std_mult': 3.055355104305635, 'bull_rsi_os': 11, 'bull_rsi_ob': 78, 'bull_adx_thresh': 20.032310074729086, 'bull_atr_min_pct': 0.02351126327914865, 'bull_atr_max_pct': 0.044955292329555904, 'bull_tp_mult': 2.633990526510003, 'bull_tsl_mult': 0.0921910033071362, 'bull_time_stop': 157, 'bull_use_sma': False, 'bull_use_ema': True, 'bull_use_atr': True, 'bull_use_adx': True, 'bull_use_spike': True, 'bull_rsi_required': True, 'bear_strategy': 'mean_reversion', 'bear_bb_std_mult': 2.5669545197100745, 'bear_rsi_os': 35, 'bear_rsi_ob': 57, 'bear_adx_thresh': 33.44422545851248, 'bear_atr_min_pct': 0.0012746266611139184, 'bear_atr_max_pct': 0.11218468712382797, 'bear_tp_mult': 2.6860358191383096, 'bear_tsl_mult': 0.8526622162210833, 'bear_time_stop': 243, 'bear_use_sma': False, 'bear_use_ema': False, 'bear_use_atr': True, 'bear_use_adx': False, 'bear_use_spike': True, 'bear_rsi_required': False, 'sideways_strategy': 'mean_reversion', 'sideways_bb_std_mult': 3.022404272435681, 'sideways_rsi_os': 33, 'sideways_rsi_ob': 94, 'sideways_adx_thresh': 10.282302108836706, 'sideways_atr_min_pct': 0.0033670570618689263, 'sideways_atr_max_pct': 0.10178606376263492, 'sideways_tp_mult': 2.3614762804529263, 'sideways_tsl_mult': 0.3950110038810191, 'sideways_time_stop': 253, 'sideways_use_sma': True, 'sideways_use_ema': True, 'sideways_use_atr': True, 'sideways_use_adx': True, 'sideways_use_spike': False, 'sideways_rsi_required': False}.
[I 2025-09-01 14:15:53,320] Trial 331 finished with values: [-1000000000.0, 1000000000.0] and parameters: {'p_sma': 29, 'p_std': 37, 'p_atr': 27, 'p_adx': 12, 'rsi_period': 73, 'ema1': 9, 'ema2': 60, 'slip_atr_k': 0.23188513543911882, 'slip_spread_k': 0.5325093036268708, 'spread_hl_frac': 0.0058679241918020535, 'bb_std_mult': 0.5060915392584739, 'rsi_os': 44, 'rsi_ob': 53, 'vol_spike': 0.1110688548869123, 'adx_thresh': 5.593300320434638, 'atr_min_pct': 0.010065207164593429, 'atr_max_pct': 0.1019281159233171, 'tp_mult': 1.2644708364960153, 'tsl_mult': 0.7062612590137696, 'strategy': 'mean_reversion', 'time_stop': 119, 'use_sma': True, 'use_atr': False, 'use_adx': True, 'use_ema': True, 'use_spike': True, 'rsi_required': True, 'edge_k': 0.34043497021262925, 'edge_cap': 0.8824144544030379, 'bull_strategy': 'breakout', 'bull_bb_std_mult': 3.023734495247818, 'bull_rsi_os': 10, 'bull_rsi_ob': 79, 'bull_adx_thresh': 7.9650777274373254, 'bull_atr_min_pct': 0.02340141341213904, 'bull_atr_max_pct': 0.041897412626127464, 'bull_tp_mult': 1.5945244788597754, 'bull_tsl_mult': 0.09370104799403256, 'bull_time_stop': 156, 'bull_use_sma': False, 'bull_use_ema': True, 'bull_use_atr': True, 'bull_use_adx': True, 'bull_use_spike': True, 'bull_rsi_required': True, 'bear_strategy': 'mean_reversion', 'bear_bb_std_mult': 2.489931827016303, 'bear_rsi_os': 35, 'bear_rsi_ob': 55, 'bear_adx_thresh': 28.48555511847071, 'bear_atr_min_pct': 0.01226025256999344, 'bear_atr_max_pct': 0.11007810877235996, 'bear_tp_mult': 2.0788867089254914, 'bear_tsl_mult': 0.29142347653990164, 'bear_time_stop': 104, 'bear_use_sma': False, 'bear_use_ema': False, 'bear_use_atr': False, 'bear_use_adx': False, 'bear_use_spike': True, 'bear_rsi_required': False, 'sideways_strategy': 'mean_reversion', 'sideways_bb_std_mult': 1.8935292759433797, 'sideways_rsi_os': 15, 'sideways_rsi_ob': 94, 'sideways_adx_thresh': 7.132462025344488, 'sideways_atr_min_pct': 0.0034440182590632015, 'sideways_atr_max_pct': 0.11071642953292064, 'sideways_tp_mult': 2.452558491563693, 'sideways_tsl_mult': 0.35214315420205716, 'sideways_time_stop': 268, 'sideways_use_sma': True, 'sideways_use_ema': False, 'sideways_use_atr': True, 'sideways_use_adx': True, 'sideways_use_spike': False, 'sideways_rsi_required': False}.
[I 2025-09-01 14:15:54,296] Trial 328 finished with values: [-0.1356308752353007, 0.1355221599057693] and parameters: {'p_sma': 26, 'p_std': 11, 'p_atr': 27, 'p_adx': 8, 'rsi_period': 84, 'ema1': 21, 'ema2': 59, 'slip_atr_k': 0.19660909876944438, 'slip_spread_k': 0.331744017661922, 'spread_hl_frac': 0.012110358405238279, 'bb_std_mult': 3.1366962453563962, 'rsi_os': 44, 'rsi_ob': 51, 'vol_spike': 0.1051415473360509, 'adx_thresh': 5.670679133199705, 'atr_min_pct': 0.01055066209942296, 'atr_max_pct': 0.03170341729274471, 'tp_mult': 1.4731617567125577, 'tsl_mult': 0.7096286029541334, 'strategy': 'mean_reversion', 'time_stop': 131, 'use_sma': True, 'use_atr': False, 'use_adx': True, 'use_ema': True, 'use_spike': False, 'rsi_required': True, 'edge_k': 0.33693287048485815, 'edge_cap': 0.9981249501683063, 'bull_strategy': 'mean_reversion', 'bull_bb_std_mult': 3.043725049089678, 'bull_rsi_os': 10, 'bull_rsi_ob': 78, 'bull_adx_thresh': 24.245760465185345, 'bull_atr_min_pct': 0.023548763643661576, 'bull_atr_max_pct': 0.08192136598473729, 'bull_tp_mult': 2.635627756295423, 'bull_tsl_mult': 0.46582041275442915, 'bull_time_stop': 163, 'bull_use_sma': False, 'bull_use_ema': True, 'bull_use_atr': True, 'bull_use_adx': True, 'bull_use_spike': True, 'bull_rsi_required': True, 'bear_strategy': 'mean_reversion', 'bear_bb_std_mult': 2.578830031521536, 'bear_rsi_os': 35, 'bear_rsi_ob': 57, 'bear_adx_thresh': 28.544109330695868, 'bear_atr_min_pct': 0.001504614637035794, 'bear_atr_max_pct': 0.11213544505690533, 'bear_tp_mult': 1.0511731627268495, 'bear_tsl_mult': 0.3016629540928838, 'bear_time_stop': 115, 'bear_use_sma': False, 'bear_use_ema': False, 'bear_use_atr': True, 'bear_use_adx': False, 'bear_use_spike': True, 'bear_rsi_required': False, 'sideways_strategy': 'mean_reversion', 'sideways_bb_std_mult': 3.0200493292978647, 'sideways_rsi_os': 55, 'sideways_rsi_ob': 94, 'sideways_adx_thresh': 25.350002240448923, 'sideways_atr_min_pct': 0.0012908772282347008, 'sideways_atr_max_pct': 0.07657475839506231, 'sideways_tp_mult': 1.9323049534526715, 'sideways_tsl_mult': 0.3537746914665066, 'sideways_time_stop': 82, 'sideways_use_sma': True, 'sideways_use_ema': True, 'sideways_use_atr': True, 'sideways_use_adx': True, 'sideways_use_spike': False, 'sideways_rsi_required': False}.
[I 2025-09-01 14:15:54,739] Trial 330 finished with values: [-1000000000.0, 1000000000.0] and parameters: {'p_sma': 29, 'p_std': 14, 'p_atr': 27, 'p_adx': 16, 'rsi_period': 73, 'ema1': 18, 'ema2': 60, 'slip_atr_k': 0.1963335549687269, 'slip_spread_k': 0.5345517470832806, 'spread_hl_frac': 0.0057360576339806554, 'bb_std_mult': 3.4287917764105043, 'rsi_os': 44, 'rsi_ob': 53, 'vol_spike': 0.10492403171873008, 'adx_thresh': 6.137910663099552, 'atr_min_pct': 0.010653399294823198, 'atr_max_pct': 0.031000257534257388, 'tp_mult': 1.4826569557185223, 'tsl_mult': 0.6447626156335531, 'strategy': 'mean_reversion', 'time_stop': 286, 'use_sma': True, 'use_atr': False, 'use_adx': True, 'use_ema': True, 'use_spike': True, 'rsi_required': True, 'edge_k': 0.39554816216076816, 'edge_cap': 0.9493220977884547, 'bull_strategy': 'breakout', 'bull_bb_std_mult': 3.044323983482277, 'bull_rsi_os': 11, 'bull_rsi_ob': 78, 'bull_adx_thresh': 8.960804000791407, 'bull_atr_min_pct': 0.012973793274009628, 'bull_atr_max_pct': 0.13345076744460418, 'bull_tp_mult': 1.5400477914961441, 'bull_tsl_mult': 0.4821853009638759, 'bull_time_stop': 164, 'bull_use_sma': False, 'bull_use_ema': True, 'bull_use_atr': True, 'bull_use_adx': True, 'bull_use_spike': True, 'bull_rsi_required': True, 'bear_strategy': 'mean_reversion', 'bear_bb_std_mult': 2.583323392518932, 'bear_rsi_os': 32, 'bear_rsi_ob': 56, 'bear_adx_thresh': 18.054624777597308, 'bear_atr_min_pct': 0.00132962400177447, 'bear_atr_max_pct': 0.11204883674675525, 'bear_tp_mult': 2.0187464197231915, 'bear_tsl_mult': 0.2876757256107124, 'bear_time_stop': 103, 'bear_use_sma': False, 'bear_use_ema': False, 'bear_use_atr': False, 'bear_use_adx': False, 'bear_use_spike': True, 'bear_rsi_required': False, 'sideways_strategy': 'mean_reversion', 'sideways_bb_std_mult': 3.0007728699968794, 'sideways_rsi_os': 24, 'sideways_rsi_ob': 92, 'sideways_adx_thresh': 6.9653388590598375, 'sideways_atr_min_pct': 0.0033354443502479313, 'sideways_atr_max_pct': 0.10185282263019706, 'sideways_tp_mult': 2.3523222097277707, 'sideways_tsl_mult': 0.2971035409137659, 'sideways_time_stop': 253, 'sideways_use_sma': True, 'sideways_use_ema': True, 'sideways_use_atr': True, 'sideways_use_adx': True, 'sideways_use_spike': False, 'sideways_rsi_required': False}.
[I 2025-09-01 14:15:55,618] Trial 333 finished with values: [-1000000000.0, 1000000000.0] and parameters: {'p_sma': 31, 'p_std': 7, 'p_atr': 26, 'p_adx': 9, 'rsi_period': 9, 'ema1': 9, 'ema2': 57, 'slip_atr_k': 0.01573468374686434, 'slip_spread_k': 0.3263053235531966, 'spread_hl_frac': 0.009086993638001374, 'bb_std_mult': 3.464563288393653, 'rsi_os': 55, 'rsi_ob': 53, 'vol_spike': 0.10933673253778227, 'adx_thresh': 17.992197664195004, 'atr_min_pct': 0.01055223726340589, 'atr_max_pct': 0.040488135450107175, 'tp_mult': 1.4470248589753762, 'tsl_mult': 0.3634579208148703, 'strategy': 'mean_reversion', 'time_stop': 103, 'use_sma': True, 'use_atr': False, 'use_adx': True, 'use_ema': True, 'use_spike': True, 'rsi_required': True, 'edge_k': 1.7692875903595877, 'edge_cap': 0.9701243800106013, 'bull_strategy': 'breakout', 'bull_bb_std_mult': 3.1630411687840465, 'bull_rsi_os': 12, 'bull_rsi_ob': 80, 'bull_adx_thresh': 12.89349299536272, 'bull_atr_min_pct': 0.009736496646922431, 'bull_atr_max_pct': 0.015925231080822, 'bull_tp_mult': 1.5373729833721923, 'bull_tsl_mult': 0.9003970462675186, 'bull_time_stop': 161, 'bull_use_sma': False, 'bull_use_ema': False, 'bull_use_atr': True, 'bull_use_adx': False, 'bull_use_spike': True, 'bull_rsi_required': True, 'bear_strategy': 'mean_reversion', 'bear_bb_std_mult': 2.487160200075593, 'bear_rsi_os': 36, 'bear_rsi_ob': 61, 'bear_adx_thresh': 17.16302812428938, 'bear_atr_min_pct': 0.009740069460436995, 'bear_atr_max_pct': 0.10536891456295289, 'bear_tp_mult': 2.210728995211945, 'bear_tsl_mult': 0.9377455799220038, 'bear_time_stop': 99, 'bear_use_sma': True, 'bear_use_ema': False, 'bear_use_atr': False, 'bear_use_adx': False, 'bear_use_spike': True, 'bear_rsi_required': False, 'sideways_strategy': 'mean_reversion', 'sideways_bb_std_mult': 2.9051902009116404, 'sideways_rsi_os': 31, 'sideways_rsi_ob': 73, 'sideways_adx_thresh': 25.966799311690256, 'sideways_atr_min_pct': 0.003963636520566175, 'sideways_atr_max_pct': 0.11457940029295482, 'sideways_tp_mult': 2.4740378391463436, 'sideways_tsl_mult': 0.13200506622246816, 'sideways_time_stop': 269, 'sideways_use_sma': True, 'sideways_use_ema': True, 'sideways_use_atr': True, 'sideways_use_adx': True, 'sideways_use_spike': True, 'sideways_rsi_required': True}.
