[I 2025-09-01 13:39:32,353] Trial 77 finished with values: [-0.03219880456819102, 0.031901292134914765] and parameters: {'p_sma': 56, 'p_std': 29, 'p_atr': 10, 'p_adx': 28, 'rsi_period': 28, 'ema1': 15, 'ema2': 28, 'slip_atr_k': 0.18463999268270012, 'slip_spread_k': 0.546188988433699, 'spread_hl_frac': 0.0190927037736426, 'bb_std_mult': 2.2258822386413044, 'rsi_os': 27, 'rsi_ob': 80, 'vol_spike': 0.12878931898887874, 'adx_thresh': 21.833445967896708, 'atr_min_pct': 0.015447810476190241, 'atr_max_pct': 0.017395799677258104, 'tp_mult': 2.2903841949287607, 'tsl_mult': 0.3422175915747303, 'strategy': 'mean_reversion', 'time_stop': 284, 'use_sma': True, 'use_atr': True, 'use_adx': True, 'use_ema': True, 'use_spike': True, 'rsi_required': False, 'edge_k': 0.8934412055797538, 'edge_cap': 0.1452355401179509, 'bull_strategy': 'mean_reversion', 'bull_bb_std_mult': 1.0041600110124893, 'bull_rsi_os': 37, 'bull_rsi_ob': 54, 'bull_adx_thresh': 28.12080545897392, 'bull_atr_min_pct': 0.015455808015711349, 'bull_atr_max_pct': 0.14454972727822477, 'bull_tp_mult': 1.0690969467899454, 'bull_tsl_mult': 0.7064415084374026, 'bull_time_stop': 67, 'bull_use_sma': True, 'bull_use_ema': True, 'bull_use_atr': True, 'bull_use_adx': False, 'bull_use_spike': True, 'bull_rsi_required': True, 'bear_strategy': 'breakout', 'bear_bb_std_mult': 2.0056069817681816, 'bear_rsi_os': 48, 'bear_rsi_ob': 61, 'bear_adx_thresh': 27.996338810569537, 'bear_atr_min_pct': 0.0014646042483551563, 'bear_atr_max_pct': 0.1177363853964662, 'bear_tp_mult': 1.7392543284729705, 'bear_tsl_mult': 0.24200187414714885, 'bear_time_stop': 293, 'bear_use_sma': False, 'bear_use_ema': False, 'bear_use_atr': False, 'bear_use_adx': True, 'bear_use_spike': True, 'bear_rsi_required': True, 'sideways_strategy': 'breakout', 'sideways_bb_std_mult': 1.6390137096156752, 'sideways_rsi_os': 35, 'sideways_rsi_ob': 90, 'sideways_adx_thresh': 23.994528064313695, 'sideways_atr_min_pct': 0.029965900014365773, 'sideways_atr_max_pct': 0.13021069401709376, 'sideways_tp_mult': 2.489399242482406, 'sideways_tsl_mult': 0.7978026730001513, 'sideways_time_stop': 285, 'sideways_use_sma': False, 'sideways_use_ema': True, 'sideways_use_atr': False, 'sideways_use_adx': False, 'sideways_use_spike': True, 'sideways_rsi_required': False}.
[I 2025-09-01 13:40:09,916] Trial 82 finished with values: [-1000000000.0, 1000000000.0] and parameters: {'p_sma': 17, 'p_std': 33, 'p_atr': 12, 'p_adx': 29, 'rsi_period': 9, 'ema1': 18, 'ema2': 39, 'slip_atr_k': 0.00012078410082998344, 'slip_spread_k': 0.2695840124049166, 'spread_hl_frac': 0.04100156704690473, 'bb_std_mult': 3.4314189188205084, 'rsi_os': 22, 'rsi_ob': 73, 'vol_spike': 0.17871267996725912, 'adx_thresh': 7.740782486711845, 'atr_min_pct': 0.012261189391253955, 'atr_max_pct': 0.06873810876373573, 'tp_mult': 1.8457830571668394, 'tsl_mult': 0.1092029540488681, 'strategy': 'breakout', 'time_stop': 46, 'use_sma': True, 'use_atr': False, 'use_adx': False, 'use_ema': False, 'use_spike': False, 'rsi_required': False, 'edge_k': 1.876105232277983, 'edge_cap': 0.5495666363096284, 'bull_strategy': 'breakout', 'bull_bb_std_mult': 1.0403484092634983, 'bull_rsi_os': 53, 'bull_rsi_ob': 80, 'bull_adx_thresh': 18.90290077297903, 'bull_atr_min_pct': 0.010405067351391102, 'bull_atr_max_pct': 0.13403208987897333, 'bull_tp_mult': 1.5081348306338076, 'bull_tsl_mult': 0.7067961486699404, 'bull_time_stop': 123, 'bull_use_sma': False, 'bull_use_ema': True, 'bull_use_atr': False, 'bull_use_adx': True, 'bull_use_spike': False, 'bull_rsi_required': False, 'bear_strategy': 'breakout', 'bear_bb_std_mult': 3.3055960516865937, 'bear_rsi_os': 31, 'bear_rsi_ob': 65, 'bear_adx_thresh': 13.183512849827821, 'bear_atr_min_pct': 0.008725066526607378, 'bear_atr_max_pct': 0.14978170456035148, 'bear_tp_mult': 2.117740829779301, 'bear_tsl_mult': 0.37579378881484854, 'bear_time_stop': 286, 'bear_use_sma': True, 'bear_use_ema': True, 'bear_use_atr': False, 'bear_use_adx': True, 'bear_use_spike': False, 'bear_rsi_required': False, 'sideways_strategy': 'mean_reversion', 'sideways_bb_std_mult': 1.6582149475094194, 'sideways_rsi_os': 7, 'sideways_rsi_ob': 92, 'sideways_adx_thresh': 24.374887915533915, 'sideways_atr_min_pct': 0.02535398552860156, 'sideways_atr_max_pct': 0.12180224567953414, 'sideways_tp_mult': 1.0970761326600895, 'sideways_tsl_mult': 0.1274577056415494, 'sideways_time_stop': 178, 'sideways_use_sma': True, 'sideways_use_ema': False, 'sideways_use_atr': True, 'sideways_use_adx': True, 'sideways_use_spike': False, 'sideways_rsi_required': False}.
[I 2025-09-01 13:40:10,908] Trial 83 finished with values: [-1000000000.0, 1000000000.0] and parameters: {'p_sma': 5, 'p_std': 35, 'p_atr': 10, 'p_adx': 20, 'rsi_period': 17, 'ema1': 23, 'ema2': 17, 'slip_atr_k': 0.015742561538391375, 'slip_spread_k': 0.274331164843721, 'spread_hl_frac': 0.010494630091264103, 'bb_std_mult': 2.0785266443578356, 'rsi_os': 42, 'rsi_ob': 73, 'vol_spike': 0.1731702008535565, 'adx_thresh': 13.082174387544715, 'atr_min_pct': 0.012150314586940885, 'atr_max_pct': 0.023834318065180996, 'tp_mult': 2.886157412404106, 'tsl_mult': 0.24230942577986575, 'strategy': 'breakout', 'time_stop': 195, 'use_sma': True, 'use_atr': False, 'use_adx': False, 'use_ema': False, 'use_spike': True, 'rsi_required': True, 'edge_k': 1.3215213499573286, 'edge_cap': 0.5270586272831883, 'bull_strategy': 'breakout', 'bull_bb_std_mult': 2.3595589610355043, 'bull_rsi_os': 21, 'bull_rsi_ob': 66, 'bull_adx_thresh': 21.706977705355715, 'bull_atr_min_pct': 0.009796474397013585, 'bull_atr_max_pct': 0.1338194919915771, 'bull_tp_mult': 1.2367111590348578, 'bull_tsl_mult': 0.8084741603419096, 'bull_time_stop': 247, 'bull_use_sma': False, 'bull_use_ema': True, 'bull_use_atr': False, 'bull_use_adx': True, 'bull_use_spike': False, 'bull_rsi_required': False, 'bear_strategy': 'breakout', 'bear_bb_std_mult': 2.6733536310797374, 'bear_rsi_os': 9, 'bear_rsi_ob': 53, 'bear_adx_thresh': 15.041607121334406, 'bear_atr_min_pct': 0.014007777357319989, 'bear_atr_max_pct': 0.05052353235255958, 'bear_tp_mult': 2.4614536552202564, 'bear_tsl_mult': 0.2458444894044589, 'bear_time_stop': 289, 'bear_use_sma': False, 'bear_use_ema': True, 'bear_use_atr': False, 'bear_use_adx': True, 'bear_use_spike': False, 'bear_rsi_required': True, 'sideways_strategy': 'mean_reversion', 'sideways_bb_std_mult': 3.2858756001500975, 'sideways_rsi_os': 48, 'sideways_rsi_ob': 85, 'sideways_adx_thresh': 28.00766964421076, 'sideways_atr_min_pct': 0.0016650475145612489, 'sideways_atr_max_pct': 0.12116791855827175, 'sideways_tp_mult': 2.866104601587852, 'sideways_tsl_mult': 0.2975367469667225, 'sideways_time_stop': 291, 'sideways_use_sma': True, 'sideways_use_ema': True, 'sideways_use_atr': True, 'sideways_use_adx': True, 'sideways_use_spike': False, 'sideways_rsi_required': False}.
[I 2025-09-01 13:40:11,404] Trial 84 finished with values: [-1000000000.0, 1000000000.0] and parameters: {'p_sma': 10, 'p_std': 46, 'p_atr': 10, 'p_adx': 20, 'rsi_period': 27, 'ema1': 8, 'ema2': 24, 'slip_atr_k': 0.0006018197949969911, 'slip_spread_k': 0.16017096998665786, 'spread_hl_frac': 0.009462308280847773, 'bb_std_mult': 2.069433068192131, 'rsi_os': 42, 'rsi_ob': 73, 'vol_spike': 0.19794708097545455, 'adx_thresh': 24.096697889367288, 'atr_min_pct': 0.016279998317334995, 'atr_max_pct': 0.025013354553599116, 'tp_mult': 1.8578961335319537, 'tsl_mult': 0.23886534747254043, 'strategy': 'breakout', 'time_stop': 18, 'use_sma': True, 'use_atr': False, 'use_adx': False, 'use_ema': False, 'use_spike': True, 'rsi_required': False, 'edge_k': 1.4287423903541634, 'edge_cap': 0.6357947603245561, 'bull_strategy': 'breakout', 'bull_bb_std_mult': 2.3589040104184997, 'bull_rsi_os': 55, 'bull_rsi_ob': 52, 'bull_adx_thresh': 7.453771849101445, 'bull_atr_min_pct': 0.01722385923979385, 'bull_atr_max_pct': 0.041042174736419544, 'bull_tp_mult': 1.2369320461271522, 'bull_tsl_mult': 0.7129168170254527, 'bull_time_stop': 89, 'bull_use_sma': False, 'bull_use_ema': True, 'bull_use_atr': False, 'bull_use_adx': True, 'bull_use_spike': False, 'bull_rsi_required': False, 'bear_strategy': 'breakout', 'bear_bb_std_mult': 2.8668204807550697, 'bear_rsi_os': 9, 'bear_rsi_ob': 53, 'bear_adx_thresh': 11.363419804494631, 'bear_atr_min_pct': 0.0057471971951651175, 'bear_atr_max_pct': 0.04166807935541034, 'bear_tp_mult': 1.9755465618678278, 'bear_tsl_mult': 0.246173901506139, 'bear_time_stop': 198, 'bear_use_sma': False, 'bear_use_ema': True, 'bear_use_atr': False, 'bear_use_adx': True, 'bear_use_spike': False, 'bear_rsi_required': True, 'sideways_strategy': 'breakout', 'sideways_bb_std_mult': 3.144010796525794, 'sideways_rsi_os': 25, 'sideways_rsi_ob': 85, 'sideways_adx_thresh': 28.11605833699039, 'sideways_atr_min_pct': 0.0016668667599547913, 'sideways_atr_max_pct': 0.06463333696078925, 'sideways_tp_mult': 2.873407280964223, 'sideways_tsl_mult': 0.11567849940776975, 'sideways_time_stop': 232, 'sideways_use_sma': True, 'sideways_use_ema': True, 'sideways_use_atr': True, 'sideways_use_adx': True, 'sideways_use_spike': False, 'sideways_rsi_required': False}.
[I 2025-09-01 13:40:11,421] Trial 85 finished with values: [-1000000000.0, 1000000000.0] and parameters: {'p_sma': 10, 'p_std': 41, 'p_atr': 7, 'p_adx': 22, 'rsi_period': 16, 'ema1': 11, 'ema2': 24, 'slip_atr_k': 0.0005719941534423633, 'slip_spread_k': 0.1668184486754823, 'spread_hl_frac': 0.009606610070468577, 'bb_std_mult': 2.039859934580776, 'rsi_os': 42, 'rsi_ob': 57, 'vol_spike': 0.0956935632189912, 'adx_thresh': 24.128121604448832, 'atr_min_pct': 0.012520994399465813, 'atr_max_pct': 0.025493637847187, 'tp_mult': 1.8574570589839623, 'tsl_mult': 0.2457982236662269, 'strategy': 'breakout', 'time_stop': 15, 'use_sma': True, 'use_atr': False, 'use_adx': False, 'use_ema': False, 'use_spike': True, 'rsi_required': True, 'edge_k': 1.320076673951759, 'edge_cap': 0.24520753759279953, 'bull_strategy': 'breakout', 'bull_bb_std_mult': 0.8165724763285855, 'bull_rsi_os': 20, 'bull_rsi_ob': 66, 'bull_adx_thresh': 14.845540274394917, 'bull_atr_min_pct': 0.01760239618001463, 'bull_atr_max_pct': 0.13480736901376061, 'bull_tp_mult': 1.4994372699009122, 'bull_tsl_mult': 0.6456349894303584, 'bull_time_stop': 155, 'bull_use_sma': False, 'bull_use_ema': True, 'bull_use_atr': False, 'bull_use_adx': True, 'bull_use_spike': False, 'bull_rsi_required': False, 'bear_strategy': 'breakout', 'bear_bb_std_mult': 2.8165736592848636, 'bear_rsi_os': 14, 'bear_rsi_ob': 53, 'bear_adx_thresh': 10.809587856043795, 'bear_atr_min_pct': 0.005653711231413853, 'bear_atr_max_pct': 0.040143195242352554, 'bear_tp_mult': 2.011316292222109, 'bear_tsl_mult': 0.25602999102256974, 'bear_time_stop': 13, 'bear_use_sma': False, 'bear_use_ema': True, 'bear_use_atr': False, 'bear_use_adx': True, 'bear_use_spike': False, 'bear_rsi_required': True, 'sideways_strategy': 'mean_reversion', 'sideways_bb_std_mult': 3.2568433150980605, 'sideways_rsi_os': 35, 'sideways_rsi_ob': 85, 'sideways_adx_thresh': 27.7689235676769, 'sideways_atr_min_pct': 0.012557886516716344, 'sideways_atr_max_pct': 0.12147976750682103, 'sideways_tp_mult': 1.0875353014343108, 'sideways_tsl_mult': 0.12120869793121208, 'sideways_time_stop': 176, 'sideways_use_sma': True, 'sideways_use_ema': True, 'sideways_use_atr': True, 'sideways_use_adx': True, 'sideways_use_spike': False, 'sideways_rsi_required': False}.
[I 2025-09-01 13:40:49,125] Trial 87 finished with values: [-1000000000.0, 1000000000.0] and parameters: {'p_sma': 50, 'p_std': 40, 'p_atr': 7, 'p_adx': 14, 'rsi_period': 53, 'ema1': 11, 'ema2': 30, 'slip_atr_k': 0.042418376236892714, 'slip_spread_k': 0.48079363920763446, 'spread_hl_frac': 0.013231249995576755, 'bb_std_mult': 2.9527744470046917, 'rsi_os': 36, 'rsi_ob': 79, 'vol_spike': 0.09687839581388623, 'adx_thresh': 23.652230916845102, 'atr_min_pct': 0.01796621219899336, 'atr_max_pct': 0.019892956077134667, 'tp_mult': 2.0495614629356447, 'tsl_mult': 0.17904553889456873, 'strategy': 'breakout', 'time_stop': 20, 'use_sma': False, 'use_atr': True, 'use_adx': False, 'use_ema': False, 'use_spike': True, 'rsi_required': False, 'edge_k': 1.6226072892055114, 'edge_cap': 0.21206655758162132, 'bull_strategy': 'breakout', 'bull_bb_std_mult': 0.8157212686443589, 'bull_rsi_os': 36, 'bull_rsi_ob': 69, 'bull_adx_thresh': 14.836487320061028, 'bull_atr_min_pct': 0.017881320472522874, 'bull_atr_max_pct': 0.0430042631047097, 'bull_tp_mult': 2.4477892508180563, 'bull_tsl_mult': 0.5237514130124044, 'bull_time_stop': 154, 'bull_use_sma': False, 'bull_use_ema': True, 'bull_use_atr': False, 'bull_use_adx': True, 'bull_use_spike': False, 'bull_rsi_required': False, 'bear_strategy': 'breakout', 'bear_bb_std_mult': 2.8597930138411143, 'bear_rsi_os': 14, 'bear_rsi_ob': 80, 'bear_adx_thresh': 10.82604841150237, 'bear_atr_min_pct': 0.005482834952309802, 'bear_atr_max_pct': 0.0413351579467938, 'bear_tp_mult': 2.0160186806073903, 'bear_tsl_mult': 0.7097602072579957, 'bear_time_stop': 197, 'bear_use_sma': False, 'bear_use_ema': True, 'bear_use_atr': True, 'bear_use_adx': False, 'bear_use_spike': False, 'bear_rsi_required': True, 'sideways_strategy': 'breakout', 'sideways_bb_std_mult': 2.3086008329291086, 'sideways_rsi_os': 35, 'sideways_rsi_ob': 88, 'sideways_adx_thresh': 33.307812152159144, 'sideways_atr_min_pct': 0.02901831527942482, 'sideways_atr_max_pct': 0.11022851623671776, 'sideways_tp_mult': 2.786649272958703, 'sideways_tsl_mult': 0.7372074927317774, 'sideways_time_stop': 234, 'sideways_use_sma': False, 'sideways_use_ema': True, 'sideways_use_atr': True, 'sideways_use_adx': False, 'sideways_use_spike': False, 'sideways_rsi_required': False}.
[I 2025-09-01 13:40:49,160] Trial 89 finished with values: [-1000000000.0, 1000000000.0] and parameters: {'p_sma': 8, 'p_std': 27, 'p_atr': 8, 'p_adx': 14, 'rsi_period': 57, 'ema1': 26, 'ema2': 30, 'slip_atr_k': 0.09365801732915359, 'slip_spread_k': 0.4478500641333074, 'spread_hl_frac': 0.013435724874614566, 'bb_std_mult': 2.202024605358601, 'rsi_os': 13, 'rsi_ob': 80, 'vol_spike': 0.2616254997162494, 'adx_thresh': 10.962979157450468, 'atr_min_pct': 0.001472177941255334, 'atr_max_pct': 0.01921715036459606, 'tp_mult': 2.0318055820962067, 'tsl_mult': 0.17865383201969476, 'strategy': 'breakout', 'time_stop': 205, 'use_sma': False, 'use_atr': True, 'use_adx': False, 'use_ema': False, 'use_spike': False, 'rsi_required': False, 'edge_k': 1.6458627484363377, 'edge_cap': 0.19888400857915223, 'bull_strategy': 'breakout', 'bull_bb_std_mult': 0.6915635753887216, 'bull_rsi_os': 16, 'bull_rsi_ob': 62, 'bull_adx_thresh': 16.578666220586374, 'bull_atr_min_pct': 0.007726153853413879, 'bull_atr_max_pct': 0.08404306385374824, 'bull_tp_mult': 1.8173876776481195, 'bull_tsl_mult': 0.5280944200354455, 'bull_time_stop': 39, 'bull_use_sma': True, 'bull_use_ema': True, 'bull_use_atr': False, 'bull_use_adx': True, 'bull_use_spike': True, 'bull_rsi_required': True, 'bear_strategy': 'mean_reversion', 'bear_bb_std_mult': 1.2274006146698904, 'bear_rsi_os': 14, 'bear_rsi_ob': 50, 'bear_adx_thresh': 5.9890098169594514, 'bear_atr_min_pct': 0.007469592821443897, 'bear_atr_max_pct': 0.10205875868271845, 'bear_tp_mult': 2.887621147209459, 'bear_tsl_mult': 0.7153187136408192, 'bear_time_stop': 81, 'bear_use_sma': False, 'bear_use_ema': True, 'bear_use_atr': True, 'bear_use_adx': False, 'bear_use_spike': False, 'bear_rsi_required': True, 'sideways_strategy': 'breakout', 'sideways_bb_std_mult': 2.7490180887777114, 'sideways_rsi_os': 38, 'sideways_rsi_ob': 83, 'sideways_adx_thresh': 6.744508970783489, 'sideways_atr_min_pct': 0.015064516017335085, 'sideways_atr_max_pct': 0.11054566400277635, 'sideways_tp_mult': 2.7832370895530407, 'sideways_tsl_mult': 0.7053668344882913, 'sideways_time_stop': 267, 'sideways_use_sma': False, 'sideways_use_ema': True, 'sideways_use_atr': False, 'sideways_use_adx': False, 'sideways_use_spike': False, 'sideways_rsi_required': False}.
[I 2025-09-01 13:40:49,644] Trial 86 finished with values: [-1000000000.0, 1000000000.0] and parameters: {'p_sma': 31, 'p_std': 39, 'p_atr': 7, 'p_adx': 20, 'rsi_period': 16, 'ema1': 8, 'ema2': 24, 'slip_atr_k': 0.016084438679452553, 'slip_spread_k': 0.4851397785216848, 'spread_hl_frac': 0.010443343126517218, 'bb_std_mult': 2.05392410520818, 'rsi_os': 12, 'rsi_ob': 79, 'vol_spike': 0.09862668868383714, 'adx_thresh': 13.07080263004687, 'atr_min_pct': 0.0014860485565963283, 'atr_max_pct': 0.02259676451507718, 'tp_mult': 2.0292353759677595, 'tsl_mult': 0.24421837051593662, 'strategy': 'breakout', 'time_stop': 200, 'use_sma': False, 'use_atr': True, 'use_adx': False, 'use_ema': False, 'use_spike': True, 'rsi_required': True, 'edge_k': 1.3032941269549938, 'edge_cap': 0.64380442643361, 'bull_strategy': 'breakout', 'bull_bb_std_mult': 2.8145012564410337, 'bull_rsi_os': 25, 'bull_rsi_ob': 66, 'bull_adx_thresh': 26.32187299720616, 'bull_atr_min_pct': 0.017437420507424542, 'bull_atr_max_pct': 0.07507763570021272, 'bull_tp_mult': 1.22486946819761, 'bull_tsl_mult': 0.6389269812130609, 'bull_time_stop': 91, 'bull_use_sma': False, 'bull_use_ema': True, 'bull_use_atr': False, 'bull_use_adx': True, 'bull_use_spike': False, 'bull_rsi_required': False, 'bear_strategy': 'breakout', 'bear_bb_std_mult': 2.843443670743943, 'bear_rsi_os': 9, 'bear_rsi_ob': 53, 'bear_adx_thresh': 11.25625717539482, 'bear_atr_min_pct': 0.00712539559279325, 'bear_atr_max_pct': 0.03877449882134009, 'bear_tp_mult': 2.8906200991304978, 'bear_tsl_mult': 0.2418159672940166, 'bear_time_stop': 15, 'bear_use_sma': False, 'bear_use_ema': True, 'bear_use_atr': True, 'bear_use_adx': True, 'bear_use_spike': False, 'bear_rsi_required': True, 'sideways_strategy': 'breakout', 'sideways_bb_std_mult': 1.8103275721406284, 'sideways_rsi_os': 34, 'sideways_rsi_ob': 87, 'sideways_adx_thresh': 27.73763967838078, 'sideways_atr_min_pct': 0.014814238032201025, 'sideways_atr_max_pct': 0.12161104067118265, 'sideways_tp_mult': 2.8568459708208476, 'sideways_tsl_mult': 0.7473418763642578, 'sideways_time_stop': 234, 'sideways_use_sma': False, 'sideways_use_ema': True, 'sideways_use_atr': True, 'sideways_use_adx': False, 'sideways_use_spike': False, 'sideways_rsi_required': False}.
[I 2025-09-01 13:40:50,131] Trial 88 finished with values: [-1000000000.0, 1000000000.0] and parameters: {'p_sma': 49, 'p_std': 19, 'p_atr': 8, 'p_adx': 27, 'rsi_period': 56, 'ema1': 20, 'ema2': 30, 'slip_atr_k': 0.00878500000056953, 'slip_spread_k': 0.8693118112175953, 'spread_hl_frac': 0.013253861158134456, 'bb_std_mult': 2.426402594512181, 'rsi_os': 44, 'rsi_ob': 79, 'vol_spike': 0.1185358313174391, 'adx_thresh': 20.2255668706611, 'atr_min_pct': 0.001594141231331614, 'atr_max_pct': 0.02008408211328581, 'tp_mult': 2.146789936347627, 'tsl_mult': 0.16569646490871145, 'strategy': 'breakout', 'time_stop': 169, 'use_sma': False, 'use_atr': True, 'use_adx': False, 'use_ema': False, 'use_spike': False, 'rsi_required': False, 'edge_k': 0.5882940527604352, 'edge_cap': 0.20137502162880183, 'bull_strategy': 'breakout', 'bull_bb_std_mult': 2.8362288383353644, 'bull_rsi_os': 17, 'bull_rsi_ob': 62, 'bull_adx_thresh': 12.006065031489713, 'bull_atr_min_pct': 0.025880922554656537, 'bull_atr_max_pct': 0.07539763286256754, 'bull_tp_mult': 2.0590241722914717, 'bull_tsl_mult': 0.5201773128089897, 'bull_time_stop': 109, 'bull_use_sma': True, 'bull_use_ema': True, 'bull_use_atr': False, 'bull_use_adx': True, 'bull_use_spike': True, 'bull_rsi_required': True, 'bear_strategy': 'mean_reversion', 'bear_bb_std_mult': 1.4988438186650295, 'bear_rsi_os': 14, 'bear_rsi_ob': 57, 'bear_adx_thresh': 6.076173158672159, 'bear_atr_min_pct': 0.003731515913018488, 'bear_atr_max_pct': 0.060809129466214605, 'bear_tp_mult': 1.4209497622663947, 'bear_tsl_mult': 0.7136296444378861, 'bear_time_stop': 82, 'bear_use_sma': False, 'bear_use_ema': True, 'bear_use_atr': True, 'bear_use_adx': False, 'bear_use_spike': False, 'bear_rsi_required': True, 'sideways_strategy': 'breakout', 'sideways_bb_std_mult': 2.4995571299083106, 'sideways_rsi_os': 38, 'sideways_rsi_ob': 87, 'sideways_adx_thresh': 32.06506997277479, 'sideways_atr_min_pct': 0.015236142061457267, 'sideways_atr_max_pct': 0.11495017083785197, 'sideways_tp_mult': 2.774790386963096, 'sideways_tsl_mult': 0.7440218595649541, 'sideways_time_stop': 141, 'sideways_use_sma': False, 'sideways_use_ema': True, 'sideways_use_atr': False, 'sideways_use_adx': False, 'sideways_use_spike': False, 'sideways_rsi_required': False}.
