[I 2025-09-01 13:35:32,730] Trial 54 finished with values: [-1000000000.0, 1000000000.0] and parameters: {'p_sma': 10, 'p_std': 31, 'p_atr': 8, 'p_adx': 29, 'rsi_period': 13, 'ema1': 7, 'ema2': 52, 'slip_atr_k': 0.22273638225174414, 'slip_spread_k': 0.5629497418622589, 'spread_hl_frac': 0.011868876781071177, 'bb_std_mult': 3.154397137412172, 'rsi_os': 19, 'rsi_ob': 78, 'vol_spike': 0.05786671026991877, 'adx_thresh': 5.169133321020761, 'atr_min_pct': 0.022245388464484296, 'atr_max_pct': 0.011804488490803209, 'tp_mult': 2.1213628031534317, 'tsl_mult': 0.7311487804296095, 'strategy': 'breakout', 'time_stop': 37, 'use_sma': True, 'use_atr': True, 'use_adx': True, 'use_ema': True, 'use_spike': True, 'rsi_required': False, 'edge_k': 1.3253324732664393, 'edge_cap': 0.40194796527466264, 'bull_strategy': 'breakout', 'bull_bb_std_mult': 0.5250289558982981, 'bull_rsi_os': 23, 'bull_rsi_ob': 60, 'bull_adx_thresh': 6.397587073606331, 'bull_atr_min_pct': 0.0025810197535278655, 'bull_atr_max_pct': 0.05383825522366097, 'bull_tp_mult': 1.16633083257043, 'bull_tsl_mult': 0.30559780373821566, 'bull_time_stop': 114, 'bull_use_sma': False, 'bull_use_ema': True, 'bull_use_atr': False, 'bull_use_adx': True, 'bull_use_spike': False, 'bull_rsi_required': False, 'bear_strategy': 'breakout', 'bear_bb_std_mult': 0.6947742890290214, 'bear_rsi_os': 9, 'bear_rsi_ob': 62, 'bear_adx_thresh': 6.685366906384851, 'bear_atr_min_pct': 0.0023132227972004846, 'bear_atr_max_pct': 0.12996508301415094, 'bear_tp_mult': 1.9341635413082312, 'bear_tsl_mult': 0.2194581176396289, 'bear_time_stop': 48, 'bear_use_sma': False, 'bear_use_ema': True, 'bear_use_atr': False, 'bear_use_adx': True, 'bear_use_spike': True, 'bear_rsi_required': False, 'sideways_strategy': 'breakout', 'sideways_bb_std_mult': 0.86382817168142, 'sideways_rsi_os': 30, 'sideways_rsi_ob': 82, 'sideways_adx_thresh': 28.38047548621239, 'sideways_atr_min_pct': 0.011858968958411896, 'sideways_atr_max_pct': 0.11805877421488234, 'sideways_tp_mult': 1.549646671058282, 'sideways_tsl_mult': 0.6372347888989263, 'sideways_time_stop': 102, 'sideways_use_sma': False, 'sideways_use_ema': True, 'sideways_use_atr': True, 'sideways_use_adx': False, 'sideways_use_spike': True, 'sideways_rsi_required': True}.
[I 2025-09-01 13:35:32,734] Trial 56 finished with values: [-1000000000.0, 1000000000.0] and parameters: {'p_sma': 9, 'p_std': 15, 'p_atr': 28, 'p_adx': 20, 'rsi_period': 31, 'ema1': 7, 'ema2': 31, 'slip_atr_k': 0.012650694138687066, 'slip_spread_k': 0.5131049869449305, 'spread_hl_frac': 0.01209620360577193, 'bb_std_mult': 0.7611818470929679, 'rsi_os': 15, 'rsi_ob': 79, 'vol_spike': 0.10159868377959606, 'adx_thresh': 30.843672724006417, 'atr_min_pct': 0.02639762736327874, 'atr_max_pct': 0.011249404848834622, 'tp_mult': 1.9774176736807938, 'tsl_mult': 0.4425967510413503, 'strategy': 'breakout', 'time_stop': 84, 'use_sma': True, 'use_atr': False, 'use_adx': True, 'use_ema': True, 'use_spike': True, 'rsi_required': False, 'edge_k': 1.4808231864678734, 'edge_cap': 0.4264230046391132, 'bull_strategy': 'breakout', 'bull_bb_std_mult': 0.6281727152464021, 'bull_rsi_os': 22, 'bull_rsi_ob': 59, 'bull_adx_thresh': 29.020224028431997, 'bull_atr_min_pct': 0.0023599021131999343, 'bull_atr_max_pct': 0.12797408337497032, 'bull_tp_mult': 1.1272630459065909, 'bull_tsl_mult': 0.3040182278566202, 'bull_time_stop': 95, 'bull_use_sma': False, 'bull_use_ema': True, 'bull_use_atr': True, 'bull_use_adx': True, 'bull_use_spike': False, 'bull_rsi_required': False, 'bear_strategy': 'breakout', 'bear_bb_std_mult': 0.7399394140610702, 'bear_rsi_os': 36, 'bear_rsi_ob': 95, 'bear_adx_thresh': 23.041546774638196, 'bear_atr_min_pct': 0.01838075221761894, 'bear_atr_max_pct': 0.07407236462824299, 'bear_tp_mult': 1.346652011078673, 'bear_tsl_mult': 0.21006883650280128, 'bear_time_stop': 71, 'bear_use_sma': False, 'bear_use_ema': False, 'bear_use_atr': False, 'bear_use_adx': False, 'bear_use_spike': True, 'bear_rsi_required': False, 'sideways_strategy': 'breakout', 'sideways_bb_std_mult': 0.810210159509513, 'sideways_rsi_os': 10, 'sideways_rsi_ob': 45, 'sideways_adx_thresh': 28.39836351249925, 'sideways_atr_min_pct': 0.011355711301316596, 'sideways_atr_max_pct': 0.11832213205495924, 'sideways_tp_mult': 2.9061745938608747, 'sideways_tsl_mult': 0.7727716327108627, 'sideways_time_stop': 98, 'sideways_use_sma': False, 'sideways_use_ema': True, 'sideways_use_atr': True, 'sideways_use_adx': False, 'sideways_use_spike': True, 'sideways_rsi_required': True}.
[I 2025-09-01 13:35:32,736] Trial 55 finished with values: [-1000000000.0, 1000000000.0] and parameters: {'p_sma': 8, 'p_std': 15, 'p_atr': 24, 'p_adx': 29, 'rsi_period': 77, 'ema1': 7, 'ema2': 32, 'slip_atr_k': 0.17264931065848613, 'slip_spread_k': 0.5156056921940765, 'spread_hl_frac': 0.011827683789105717, 'bb_std_mult': 1.5403418112382927, 'rsi_os': 20, 'rsi_ob': 88, 'vol_spike': 0.2872028382379124, 'adx_thresh': 32.77328176905174, 'atr_min_pct': 0.022177474363081165, 'atr_max_pct': 0.015219324770991319, 'tp_mult': 2.73794509328344, 'tsl_mult': 0.2142669011719572, 'strategy': 'breakout', 'time_stop': 28, 'use_sma': True, 'use_atr': False, 'use_adx': True, 'use_ema': True, 'use_spike': True, 'rsi_required': False, 'edge_k': 1.4777009367421805, 'edge_cap': 0.4180434275968158, 'bull_strategy': 'breakout', 'bull_bb_std_mult': 0.6602624620165121, 'bull_rsi_os': 23, 'bull_rsi_ob': 60, 'bull_adx_thresh': 17.712618982448245, 'bull_atr_min_pct': 0.001982921509862186, 'bull_atr_max_pct': 0.05074282036410927, 'bull_tp_mult': 1.4419544386236807, 'bull_tsl_mult': 0.2998201086872084, 'bull_time_stop': 97, 'bull_use_sma': False, 'bull_use_ema': True, 'bull_use_atr': True, 'bull_use_adx': True, 'bull_use_spike': False, 'bull_rsi_required': False, 'bear_strategy': 'breakout', 'bear_bb_std_mult': 1.624420269767167, 'bear_rsi_os': 38, 'bear_rsi_ob': 93, 'bear_adx_thresh': 6.397592655836174, 'bear_atr_min_pct': 0.01875163691256057, 'bear_atr_max_pct': 0.13182840509244484, 'bear_tp_mult': 1.0423405873441567, 'bear_tsl_mult': 0.2046951480595901, 'bear_time_stop': 23, 'bear_use_sma': False, 'bear_use_ema': False, 'bear_use_atr': False, 'bear_use_adx': False, 'bear_use_spike': True, 'bear_rsi_required': False, 'sideways_strategy': 'breakout', 'sideways_bb_std_mult': 0.8301332163225831, 'sideways_rsi_os': 30, 'sideways_rsi_ob': 82, 'sideways_adx_thresh': 29.486257266000873, 'sideways_atr_min_pct': 0.02852101608236013, 'sideways_atr_max_pct': 0.11689558332394583, 'sideways_tp_mult': 1.6545942027400122, 'sideways_tsl_mult': 0.9359231633772152, 'sideways_time_stop': 239, 'sideways_use_sma': False, 'sideways_use_ema': True, 'sideways_use_atr': True, 'sideways_use_adx': False, 'sideways_use_spike': True, 'sideways_rsi_required': True}.
[I 2025-09-01 13:36:12,298] Trial 60 finished with values: [-1000000000.0, 1000000000.0] and parameters: {'p_sma': 25, 'p_std': 44, 'p_atr': 18, 'p_adx': 23, 'rsi_period': 66, 'ema1': 22, 'ema2': 57, 'slip_atr_k': 0.02751574116445744, 'slip_spread_k': 0.9335479334892316, 'spread_hl_frac': 0.004975198284672345, 'bb_std_mult': 1.179232132111395, 'rsi_os': 47, 'rsi_ob': 83, 'vol_spike': 0.11141567032563074, 'adx_thresh': 8.474541284735075, 'atr_min_pct': 0.011664586193430132, 'atr_max_pct': 0.13161896968370745, 'tp_mult': 1.6893931054722944, 'tsl_mult': 0.8041293767091822, 'strategy': 'mean_reversion', 'time_stop': 274, 'use_sma': True, 'use_atr': True, 'use_adx': False, 'use_ema': False, 'use_spike': False, 'rsi_required': False, 'edge_k': 1.1792261869465719, 'edge_cap': 0.28638045524420774, 'bull_strategy': 'breakout', 'bull_bb_std_mult': 1.5593070416404624, 'bull_rsi_os': 50, 'bull_rsi_ob': 54, 'bull_adx_thresh': 15.350205632814664, 'bull_atr_min_pct': 0.00894278280171849, 'bull_atr_max_pct': 0.06447569264062648, 'bull_tp_mult': 1.5346480949441987, 'bull_tsl_mult': 0.06322449875204056, 'bull_time_stop': 14, 'bull_use_sma': False, 'bull_use_ema': False, 'bull_use_atr': False, 'bull_use_adx': False, 'bull_use_spike': False, 'bull_rsi_required': True, 'bear_strategy': 'breakout', 'bear_bb_std_mult': 1.3970581416817027, 'bear_rsi_os': 15, 'bear_rsi_ob': 48, 'bear_adx_thresh': 32.958574182689716, 'bear_atr_min_pct': 0.0062854716220093615, 'bear_atr_max_pct': 0.08778090961755021, 'bear_tp_mult': 1.7129267106865278, 'bear_tsl_mult': 0.05839088261680625, 'bear_time_stop': 195, 'bear_use_sma': False, 'bear_use_ema': True, 'bear_use_atr': True, 'bear_use_adx': True, 'bear_use_spike': False, 'bear_rsi_required': True, 'sideways_strategy': 'breakout', 'sideways_bb_std_mult': 2.190111706536121, 'sideways_rsi_os': 14, 'sideways_rsi_ob': 94, 'sideways_adx_thresh': 25.927257194876617, 'sideways_atr_min_pct': 0.009796281857898211, 'sideways_atr_max_pct': 0.10549626327592368, 'sideways_tp_mult': 2.5422916158109103, 'sideways_tsl_mult': 0.4574160010991366, 'sideways_time_stop': 64, 'sideways_use_sma': False, 'sideways_use_ema': False, 'sideways_use_atr': True, 'sideways_use_adx': False, 'sideways_use_spike': False, 'sideways_rsi_required': False}.
[I 2025-09-01 13:36:13,001] Trial 59 finished with values: [-1000000000.0, 1000000000.0] and parameters: {'p_sma': 24, 'p_std': 51, 'p_atr': 18, 'p_adx': 27, 'rsi_period': 29, 'ema1': 6, 'ema2': 57, 'slip_atr_k': 0.04517750168956345, 'slip_spread_k': 0.6775579537177623, 'spread_hl_frac': 0.017286667275052667, 'bb_std_mult': 2.1482737823959552, 'rsi_os': 47, 'rsi_ob': 73, 'vol_spike': 0.2789908831812696, 'adx_thresh': 17.56115505708755, 'atr_min_pct': 0.014535186796666932, 'atr_max_pct': 0.1332947052699226, 'tp_mult': 2.3142031822119127, 'tsl_mult': 0.3304128762573799, 'strategy': 'mean_reversion', 'time_stop': 141, 'use_sma': True, 'use_atr': True, 'use_adx': True, 'use_ema': False, 'use_spike': True, 'rsi_required': False, 'edge_k': 0.9037565663376693, 'edge_cap': 0.28108067933514597, 'bull_strategy': 'breakout', 'bull_bb_std_mult': 1.591237657694363, 'bull_rsi_os': 16, 'bull_rsi_ob': 76, 'bull_adx_thresh': 17.85170717852827, 'bull_atr_min_pct': 0.008404889263248819, 'bull_atr_max_pct': 0.06380003691343616, 'bull_tp_mult': 1.4323625234651118, 'bull_tsl_mult': 0.1102339644274204, 'bull_time_stop': 118, 'bull_use_sma': False, 'bull_use_ema': False, 'bull_use_atr': False, 'bull_use_adx': False, 'bull_use_spike': False, 'bull_rsi_required': True, 'bear_strategy': 'breakout', 'bear_bb_std_mult': 1.3822642425738132, 'bear_rsi_os': 15, 'bear_rsi_ob': 47, 'bear_adx_thresh': 32.26524681531511, 'bear_atr_min_pct': 0.006460265326093112, 'bear_atr_max_pct': 0.0467864380169587, 'bear_tp_mult': 2.0742122311139033, 'bear_tsl_mult': 0.0600484614484106, 'bear_time_stop': 23, 'bear_use_sma': False, 'bear_use_ema': False, 'bear_use_atr': True, 'bear_use_adx': True, 'bear_use_spike': False, 'bear_rsi_required': True, 'sideways_strategy': 'breakout', 'sideways_bb_std_mult': 2.202234803655821, 'sideways_rsi_os': 13, 'sideways_rsi_ob': 74, 'sideways_adx_thresh': 29.860797087184444, 'sideways_atr_min_pct': 0.019084474944277306, 'sideways_atr_max_pct': 0.13834937335319517, 'sideways_tp_mult': 2.544297508929889, 'sideways_tsl_mult': 0.994627972642687, 'sideways_time_stop': 240, 'sideways_use_sma': False, 'sideways_use_ema': False, 'sideways_use_atr': True, 'sideways_use_adx': False, 'sideways_use_spike': False, 'sideways_rsi_required': False}.
[I 2025-09-01 13:36:13,445] Trial 58 finished with values: [-1000000000.0, 1000000000.0] and parameters: {'p_sma': 24, 'p_std': 44, 'p_atr': 18, 'p_adx': 22, 'rsi_period': 30, 'ema1': 6, 'ema2': 31, 'slip_atr_k': 0.012384644536419081, 'slip_spread_k': 0.510555107319678, 'spread_hl_frac': 0.006312053967407304, 'bb_std_mult': 1.787118431985908, 'rsi_os': 7, 'rsi_ob': 51, 'vol_spike': 0.10096583317452458, 'adx_thresh': 30.09302343808837, 'atr_min_pct': 0.027154405962673774, 'atr_max_pct': 0.11070170406015517, 'tp_mult': 1.97883584685628, 'tsl_mult': 0.43158276148379304, 'strategy': 'mean_reversion', 'time_stop': 81, 'use_sma': True, 'use_atr': True, 'use_adx': True, 'use_ema': True, 'use_spike': True, 'rsi_required': False, 'edge_k': 1.1939838883749452, 'edge_cap': 0.44366594051506425, 'bull_strategy': 'breakout', 'bull_bb_std_mult': 1.5741773876757834, 'bull_rsi_os': 21, 'bull_rsi_ob': 54, 'bull_adx_thresh': 10.689154276434955, 'bull_atr_min_pct': 0.009031398118645624, 'bull_atr_max_pct': 0.11787553732756471, 'bull_tp_mult': 1.4414532797651007, 'bull_tsl_mult': 0.9392427496080833, 'bull_time_stop': 95, 'bull_use_sma': False, 'bull_use_ema': False, 'bull_use_atr': False, 'bull_use_adx': False, 'bull_use_spike': False, 'bull_rsi_required': True, 'bear_strategy': 'breakout', 'bear_bb_std_mult': 2.7428083774075103, 'bear_rsi_os': 36, 'bear_rsi_ob': 48, 'bear_adx_thresh': 32.86912542307036, 'bear_atr_min_pct': 0.01845146671453636, 'bear_atr_max_pct': 0.08797869216238255, 'bear_tp_mult': 2.0667971464944395, 'bear_tsl_mult': 0.04978812554710475, 'bear_time_stop': 73, 'bear_use_sma': False, 'bear_use_ema': False, 'bear_use_atr': False, 'bear_use_adx': True, 'bear_use_spike': True, 'bear_rsi_required': True, 'sideways_strategy': 'breakout', 'sideways_bb_std_mult': 1.38649440020557, 'sideways_rsi_os': 36, 'sideways_rsi_ob': 74, 'sideways_adx_thresh': 32.498515845711175, 'sideways_atr_min_pct': 0.009235078404376654, 'sideways_atr_max_pct': 0.14793586537835027, 'sideways_tp_mult': 2.9073299236680867, 'sideways_tsl_mult': 0.7710135419250106, 'sideways_time_stop': 60, 'sideways_use_sma': False, 'sideways_use_ema': False, 'sideways_use_atr': True, 'sideways_use_adx': False, 'sideways_use_spike': True, 'sideways_rsi_required': True}.
[I 2025-09-01 13:36:13,790] Trial 57 finished with values: [-1000000000.0, 1000000000.0] and parameters: {'p_sma': 9, 'p_std': 51, 'p_atr': 8, 'p_adx': 29, 'rsi_period': 30, 'ema1': 6, 'ema2': 32, 'slip_atr_k': 0.1741667505322088, 'slip_spread_k': 0.506981607795989, 'spread_hl_frac': 0.005648442514965435, 'bb_std_mult': 0.7197835062678912, 'rsi_os': 10, 'rsi_ob': 51, 'vol_spike': 0.10211222068702464, 'adx_thresh': 32.069594059348155, 'atr_min_pct': 0.014733457840309765, 'atr_max_pct': 0.01628958706762573, 'tp_mult': 2.765683183862589, 'tsl_mult': 0.4296590543301937, 'strategy': 'mean_reversion', 'time_stop': 82, 'use_sma': True, 'use_atr': True, 'use_adx': True, 'use_ema': True, 'use_spike': True, 'rsi_required': False, 'edge_k': 1.357285609122331, 'edge_cap': 0.44978185595066716, 'bull_strategy': 'breakout', 'bull_bb_std_mult': 1.5597635543708586, 'bull_rsi_os': 23, 'bull_rsi_ob': 77, 'bull_adx_thresh': 17.765403952065476, 'bull_atr_min_pct': 0.008441296890934768, 'bull_atr_max_pct': 0.05414064601057025, 'bull_tp_mult': 1.431607021932544, 'bull_tsl_mult': 0.28203904340954367, 'bull_time_stop': 113, 'bull_use_sma': False, 'bull_use_ema': False, 'bull_use_atr': False, 'bull_use_adx': True, 'bull_use_spike': False, 'bull_rsi_required': False, 'bear_strategy': 'breakout', 'bear_bb_std_mult': 0.7709753984225287, 'bear_rsi_os': 9, 'bear_rsi_ob': 63, 'bear_adx_thresh': 14.190552786492164, 'bear_atr_min_pct': 0.018422683390116722, 'bear_atr_max_pct': 0.12973109182023881, 'bear_tp_mult': 1.0301604392698474, 'bear_tsl_mult': 0.05291608830649702, 'bear_time_stop': 71, 'bear_use_sma': False, 'bear_use_ema': False, 'bear_use_atr': False, 'bear_use_adx': True, 'bear_use_spike': True, 'bear_rsi_required': True, 'sideways_strategy': 'breakout', 'sideways_bb_std_mult': 0.8026394190902715, 'sideways_rsi_os': 30, 'sideways_rsi_ob': 56, 'sideways_adx_thresh': 29.6291398683661, 'sideways_atr_min_pct': 0.011617781488040574, 'sideways_atr_max_pct': 0.14948896331296466, 'sideways_tp_mult': 2.8975373235667625, 'sideways_tsl_mult': 0.7640840340964293, 'sideways_time_stop': 241, 'sideways_use_sma': False, 'sideways_use_ema': False, 'sideways_use_atr': True, 'sideways_use_adx': False, 'sideways_use_spike': True, 'sideways_rsi_required': True}.
[I 2025-09-01 13:36:50,699] Trial 61 finished with values: [-1000000000.0, 1000000000.0] and parameters: {'p_sma': 5, 'p_std': 50, 'p_atr': 11, 'p_adx': 27, 'rsi_period': 42, 'ema1': 11, 'ema2': 48, 'slip_atr_k': 0.046994784790558075, 'slip_spread_k': 0.3485430701554382, 'spread_hl_frac': 0.017106194594718294, 'bb_std_mult': 1.8061437871556107, 'rsi_os': 5, 'rsi_ob': 74, 'vol_spike': 0.14555736361123775, 'adx_thresh': 22.301039855241683, 'atr_min_pct': 0.017366860859502908, 'atr_max_pct': 0.025770400925942474, 'tp_mult': 1.5404218193204335, 'tsl_mult': 0.9484799569861747, 'strategy': 'mean_reversion', 'time_stop': 186, 'use_sma': True, 'use_atr': True, 'use_adx': False, 'use_ema': False, 'use_spike': True, 'rsi_required': False, 'edge_k': 0.5455730709989868, 'edge_cap': 0.12416073549501984, 'bull_strategy': 'breakout', 'bull_bb_std_mult': 2.9288727355999162, 'bull_rsi_os': 16, 'bull_rsi_ob': 77, 'bull_adx_thresh': 32.93405733969975, 'bull_atr_min_pct': 0.004273087455702274, 'bull_atr_max_pct': 0.11766603611240546, 'bull_tp_mult': 1.4187627644121579, 'bull_tsl_mult': 0.2564116893077565, 'bull_time_stop': 133, 'bull_use_sma': True, 'bull_use_ema': False, 'bull_use_atr': False, 'bull_use_adx': False, 'bull_use_spike': True, 'bull_rsi_required': False, 'bear_strategy': 'breakout', 'bear_bb_std_mult': 2.813284567599676, 'bear_rsi_os': 5, 'bear_rsi_ob': 45, 'bear_adx_thresh': 14.278778754996925, 'bear_atr_min_pct': 0.000269880980752547, 'bear_atr_max_pct': 0.04722544094392103, 'bear_tp_mult': 2.0631076388272946, 'bear_tsl_mult': 0.15697710003876617, 'bear_time_stop': 132, 'bear_use_sma': False, 'bear_use_ema': True, 'bear_use_atr': False, 'bear_use_adx': True, 'bear_use_spike': False, 'bear_rsi_required': True, 'sideways_strategy': 'breakout', 'sideways_bb_std_mult': 1.3413983153778437, 'sideways_rsi_os': 36, 'sideways_rsi_ob': 72, 'sideways_adx_thresh': 21.51850781317211, 'sideways_atr_min_pct': 0.014818909789577313, 'sideways_atr_max_pct': 0.13793613460192672, 'sideways_tp_mult': 2.3606743687869893, 'sideways_tsl_mult': 0.946593289962089, 'sideways_time_stop': 199, 'sideways_use_sma': False, 'sideways_use_ema': False, 'sideways_use_atr': True, 'sideways_use_adx': False, 'sideways_use_spike': False, 'sideways_rsi_required': False}.
[I 2025-09-01 13:36:52,045] Trial 63 finished with values: [-1000000000.0, 1000000000.0] and parameters: {'p_sma': 13, 'p_std': 8, 'p_atr': 11, 'p_adx': 27, 'rsi_period': 70, 'ema1': 11, 'ema2': 26, 'slip_atr_k': 0.10727743095901804, 'slip_spread_k': 0.7468193456857235, 'spread_hl_frac': 0.00028652274671413583, 'bb_std_mult': 2.6268119284596474, 'rsi_os': 40, 'rsi_ob': 70, 'vol_spike': 0.14985827466613427, 'adx_thresh': 22.861806371936364, 'atr_min_pct': 0.01705888795815292, 'atr_max_pct': 0.05864047405967912, 'tp_mult': 1.8213955119527154, 'tsl_mult': 0.22573135695220825, 'strategy': 'breakout', 'time_stop': 182, 'use_sma': True, 'use_atr': True, 'use_adx': False, 'use_ema': False, 'use_spike': True, 'rsi_required': False, 'edge_k': 1.3887217560654392, 'edge_cap': 0.08702360105507145, 'bull_strategy': 'mean_reversion', 'bull_bb_std_mult': 1.1813614556716399, 'bull_rsi_os': 31, 'bull_rsi_ob': 45, 'bull_adx_thresh': 24.50331501778025, 'bull_atr_min_pct': 0.00412213938074922, 'bull_atr_max_pct': 0.14197520140480702, 'bull_tp_mult': 1.2791362966929882, 'bull_tsl_mult': 0.21286941353478106, 'bull_time_stop': 137, 'bull_use_sma': True, 'bull_use_ema': True, 'bull_use_atr': False, 'bull_use_adx': True, 'bull_use_spike': True, 'bull_rsi_required': False, 'bear_strategy': 'breakout', 'bear_bb_std_mult': 1.1353034381752525, 'bear_rsi_os': 33, 'bear_rsi_ob': 45, 'bear_adx_thresh': 14.164255722330601, 'bear_atr_min_pct': 0.009577739051933421, 'bear_atr_max_pct': 0.07874155115216466, 'bear_tp_mult': 1.5904551941304446, 'bear_tsl_mult': 0.1474269167170127, 'bear_time_stop': 271, 'bear_use_sma': False, 'bear_use_ema': True, 'bear_use_atr': False, 'bear_use_adx': True, 'bear_use_spike': False, 'bear_rsi_required': True, 'sideways_strategy': 'breakout', 'sideways_bb_std_mult': 2.6166169847342884, 'sideways_rsi_os': 46, 'sideways_rsi_ob': 72, 'sideways_adx_thresh': 32.398923529798225, 'sideways_atr_min_pct': 0.014399019370931541, 'sideways_atr_max_pct': 0.0358337289038213, 'sideways_tp_mult': 2.662765093500562, 'sideways_tsl_mult': 0.33012247456807, 'sideways_time_stop': 217, 'sideways_use_sma': True, 'sideways_use_ema': True, 'sideways_use_atr': False, 'sideways_use_adx': True, 'sideways_use_spike': False, 'sideways_rsi_required': False}.
