[I 2025-09-01 13:55:26,934] Trial 188 finished with values: [-1000000000.0, 1000000000.0] and parameters: {'p_sma': 12, 'p_std': 26, 'p_atr': 26, 'p_adx': 28, 'rsi_period': 54, 'ema1': 30, 'ema2': 50, 'slip_atr_k': 0.01151268820563894, 'slip_spread_k': 0.49426539733168545, 'spread_hl_frac': 0.04079203971300758, 'bb_std_mult': 1.9203876396787452, 'rsi_os': 43, 'rsi_ob': 81, 'vol_spike': 0.14488368997632256, 'adx_thresh': 23.26519222464356, 'atr_min_pct': 0.016304860779205513, 'atr_max_pct': 0.09164863767351203, 'tp_mult': 1.354944856689284, 'tsl_mult': 0.642009712822964, 'strategy': 'mean_reversion', 'time_stop': 85, 'use_sma': True, 'use_atr': False, 'use_adx': True, 'use_ema': True, 'use_spike': True, 'rsi_required': False, 'edge_k': 1.7679657872159449, 'edge_cap': 0.8996820795452554, 'bull_strategy': 'mean_reversion', 'bull_bb_std_mult': 1.3751239520331646, 'bull_rsi_os': 33, 'bull_rsi_ob': 54, 'bull_adx_thresh': 10.809635590551514, 'bull_atr_min_pct': 0.011326135807924177, 'bull_atr_max_pct': 0.09000697561594281, 'bull_tp_mult': 1.4476197409151375, 'bull_tsl_mult': 0.5589959599712349, 'bull_time_stop': 79, 'bull_use_sma': True, 'bull_use_ema': False, 'bull_use_atr': True, 'bull_use_adx': False, 'bull_use_spike': True, 'bull_rsi_required': False, 'bear_strategy': 'mean_reversion', 'bear_bb_std_mult': 2.665822186291106, 'bear_rsi_os': 51, 'bear_rsi_ob': 72, 'bear_adx_thresh': 5.900635826077236, 'bear_atr_min_pct': 0.005424933385597114, 'bear_atr_max_pct': 0.06987519001804911, 'bear_tp_mult': 2.00843691439551, 'bear_tsl_mult': 0.2377545897298372, 'bear_time_stop': 153, 'bear_use_sma': False, 'bear_use_ema': True, 'bear_use_atr': False, 'bear_use_adx': False, 'bear_use_spike': True, 'bear_rsi_required': True, 'sideways_strategy': 'breakout', 'sideways_bb_std_mult': 0.7524332894180679, 'sideways_rsi_os': 38, 'sideways_rsi_ob': 86, 'sideways_adx_thresh': 28.57182670596685, 'sideways_atr_min_pct': 0.014029958947409346, 'sideways_atr_max_pct': 0.12523420414511222, 'sideways_tp_mult': 2.707536381973709, 'sideways_tsl_mult': 0.6472685512342526, 'sideways_time_stop': 14, 'sideways_use_sma': True, 'sideways_use_ema': False, 'sideways_use_atr': False, 'sideways_use_adx': True, 'sideways_use_spike': False, 'sideways_rsi_required': True}.
[I 2025-09-01 13:55:27,458] Trial 190 finished with values: [-1000000000.0, 1000000000.0] and parameters: {'p_sma': 10, 'p_std': 25, 'p_atr': 7, 'p_adx': 28, 'rsi_period': 71, 'ema1': 9, 'ema2': 21, 'slip_atr_k': 0.11032563261672344, 'slip_spread_k': 0.1871930813424823, 'spread_hl_frac': 0.012248266423180316, 'bb_std_mult': 2.1136301301282465, 'rsi_os': 12, 'rsi_ob': 73, 'vol_spike': 0.0004716212972167011, 'adx_thresh': 22.82556601093852, 'atr_min_pct': 0.018048549377968466, 'atr_max_pct': 0.010374111840570598, 'tp_mult': 1.3620875128085639, 'tsl_mult': 0.5716932685311069, 'strategy': 'mean_reversion', 'time_stop': 99, 'use_sma': True, 'use_atr': False, 'use_adx': True, 'use_ema': True, 'use_spike': False, 'rsi_required': False, 'edge_k': 0.23299576258388843, 'edge_cap': 0.1706130471641481, 'bull_strategy': 'mean_reversion', 'bull_bb_std_mult': 3.0133328984248258, 'bull_rsi_os': 19, 'bull_rsi_ob': 54, 'bull_adx_thresh': 10.15986614929894, 'bull_atr_min_pct': 0.01495063914513863, 'bull_atr_max_pct': 0.07132579033240857, 'bull_tp_mult': 1.3760282494272271, 'bull_tsl_mult': 0.40047593448215585, 'bull_time_stop': 81, 'bull_use_sma': False, 'bull_use_ema': False, 'bull_use_atr': True, 'bull_use_adx': False, 'bull_use_spike': True, 'bull_rsi_required': False, 'bear_strategy': 'mean_reversion', 'bear_bb_std_mult': 1.576633876757286, 'bear_rsi_os': 51, 'bear_rsi_ob': 52, 'bear_adx_thresh': 5.4950925480880315, 'bear_atr_min_pct': 0.0038129136189658346, 'bear_atr_max_pct': 0.06976406405649013, 'bear_tp_mult': 1.7763441082712363, 'bear_tsl_mult': 0.7363038194873961, 'bear_time_stop': 63, 'bear_use_sma': True, 'bear_use_ema': False, 'bear_use_atr': False, 'bear_use_adx': True, 'bear_use_spike': True, 'bear_rsi_required': True, 'sideways_strategy': 'breakout', 'sideways_bb_std_mult': 0.7429911490526941, 'sideways_rsi_os': 35, 'sideways_rsi_ob': 66, 'sideways_adx_thresh': 20.635956149295335, 'sideways_atr_min_pct': 0.01638529856238099, 'sideways_atr_max_pct': 0.12634897189821706, 'sideways_tp_mult': 2.672434952158237, 'sideways_tsl_mult': 0.5514949705132761, 'sideways_time_stop': 12, 'sideways_use_sma': False, 'sideways_use_ema': True, 'sideways_use_atr': False, 'sideways_use_adx': True, 'sideways_use_spike': False, 'sideways_rsi_required': True}.
[I 2025-09-01 13:55:27,476] Trial 193 finished with values: [-1000000000.0, 1000000000.0] and parameters: {'p_sma': 50, 'p_std': 29, 'p_atr': 7, 'p_adx': 25, 'rsi_period': 65, 'ema1': 8, 'ema2': 34, 'slip_atr_k': 0.0002921912572606864, 'slip_spread_k': 0.1805904564167402, 'spread_hl_frac': 0.010087364556263217, 'bb_std_mult': 3.113444357614326, 'rsi_os': 46, 'rsi_ob': 61, 'vol_spike': 0.09884757636077517, 'adx_thresh': 22.12654063664861, 'atr_min_pct': 0.018356454593577237, 'atr_max_pct': 0.010181155939710314, 'tp_mult': 2.028756031238791, 'tsl_mult': 0.09418983949459371, 'strategy': 'breakout', 'time_stop': 97, 'use_sma': False, 'use_atr': True, 'use_adx': False, 'use_ema': False, 'use_spike': False, 'rsi_required': True, 'edge_k': 1.0115579505163668, 'edge_cap': 0.34869495642357845, 'bull_strategy': 'breakout', 'bull_bb_std_mult': 1.2387947034444182, 'bull_rsi_os': 17, 'bull_rsi_ob': 70, 'bull_adx_thresh': 33.00413884461011, 'bull_atr_min_pct': 0.01722054220830825, 'bull_atr_max_pct': 0.07017634329711392, 'bull_tp_mult': 1.3558285093221443, 'bull_tsl_mult': 0.19658789285118589, 'bull_time_stop': 104, 'bull_use_sma': False, 'bull_use_ema': True, 'bull_use_atr': False, 'bull_use_adx': True, 'bull_use_spike': False, 'bull_rsi_required': False, 'bear_strategy': 'breakout', 'bear_bb_std_mult': 2.4443240490910347, 'bear_rsi_os': 11, 'bear_rsi_ob': 52, 'bear_adx_thresh': 5.426094828541079, 'bear_atr_min_pct': 0.005912989464490481, 'bear_atr_max_pct': 0.07633347443914307, 'bear_tp_mult': 1.8446388094014652, 'bear_tsl_mult': 0.30030423097627124, 'bear_time_stop': 64, 'bear_use_sma': True, 'bear_use_ema': False, 'bear_use_atr': False, 'bear_use_adx': True, 'bear_use_spike': False, 'bear_rsi_required': True, 'sideways_strategy': 'mean_reversion', 'sideways_bb_std_mult': 1.450274938489676, 'sideways_rsi_os': 35, 'sideways_rsi_ob': 65, 'sideways_adx_thresh': 27.65113506442559, 'sideways_atr_min_pct': 0.00721575220155239, 'sideways_atr_max_pct': 0.12261628656941403, 'sideways_tp_mult': 1.5498976423915953, 'sideways_tsl_mult': 0.24015972913320116, 'sideways_time_stop': 145, 'sideways_use_sma': False, 'sideways_use_ema': True, 'sideways_use_atr': True, 'sideways_use_adx': False, 'sideways_use_spike': True, 'sideways_rsi_required': False}.
[I 2025-09-01 13:56:06,048] Trial 192 finished with values: [-1000000000.0, 1000000000.0] and parameters: {'p_sma': 9, 'p_std': 15, 'p_atr': 7, 'p_adx': 11, 'rsi_period': 71, 'ema1': 9, 'ema2': 34, 'slip_atr_k': 0.012047015775595908, 'slip_spread_k': 0.1818270229636737, 'spread_hl_frac': 0.009955675699146835, 'bb_std_mult': 3.4998118307861907, 'rsi_os': 46, 'rsi_ob': 61, 'vol_spike': 0.1724355675526849, 'adx_thresh': 18.881557071837385, 'atr_min_pct': 0.01813049390406655, 'atr_max_pct': 0.054827881074370644, 'tp_mult': 1.1583579199727003, 'tsl_mult': 0.09377435352386274, 'strategy': 'mean_reversion', 'time_stop': 183, 'use_sma': False, 'use_atr': False, 'use_adx': False, 'use_ema': True, 'use_spike': False, 'rsi_required': True, 'edge_k': 0.24719427160585605, 'edge_cap': 0.20521757057800427, 'bull_strategy': 'breakout', 'bull_bb_std_mult': 1.231958932175595, 'bull_rsi_os': 18, 'bull_rsi_ob': 53, 'bull_adx_thresh': 32.865247196024995, 'bull_atr_min_pct': 0.011166826181736504, 'bull_atr_max_pct': 0.1251264054103326, 'bull_tp_mult': 2.719788574032573, 'bull_tsl_mult': 0.20876933838965672, 'bull_time_stop': 105, 'bull_use_sma': False, 'bull_use_ema': True, 'bull_use_atr': True, 'bull_use_adx': False, 'bull_use_spike': True, 'bull_rsi_required': False, 'bear_strategy': 'mean_reversion', 'bear_bb_std_mult': 2.536945335434818, 'bear_rsi_os': 48, 'bear_rsi_ob': 72, 'bear_adx_thresh': 5.440500162366659, 'bear_atr_min_pct': 0.006311191057651655, 'bear_atr_max_pct': 0.0221606767474039, 'bear_tp_mult': 2.55689796673437, 'bear_tsl_mult': 0.23207194463058944, 'bear_time_stop': 62, 'bear_use_sma': False, 'bear_use_ema': False, 'bear_use_atr': False, 'bear_use_adx': True, 'bear_use_spike': True, 'bear_rsi_required': True, 'sideways_strategy': 'mean_reversion', 'sideways_bb_std_mult': 0.5953307528071808, 'sideways_rsi_os': 35, 'sideways_rsi_ob': 65, 'sideways_adx_thresh': 20.583779770952024, 'sideways_atr_min_pct': 0.007172563345669675, 'sideways_atr_max_pct': 0.12463454198418546, 'sideways_tp_mult': 2.8519458299514007, 'sideways_tsl_mult': 0.7558769679772144, 'sideways_time_stop': 249, 'sideways_use_sma': False, 'sideways_use_ema': True, 'sideways_use_atr': True, 'sideways_use_adx': True, 'sideways_use_spike': True, 'sideways_rsi_required': False}.
[I 2025-09-01 13:56:07,102] Trial 191 finished with values: [-1000000000.0, 1000000000.0] and parameters: {'p_sma': 10, 'p_std': 23, 'p_atr': 26, 'p_adx': 11, 'rsi_period': 31, 'ema1': 9, 'ema2': 22, 'slip_atr_k': 0.019388273442003348, 'slip_spread_k': 0.5384226269569927, 'spread_hl_frac': 0.04091520383955967, 'bb_std_mult': 2.988892819347105, 'rsi_os': 46, 'rsi_ob': 85, 'vol_spike': 0.09919992885377996, 'adx_thresh': 22.703202623344872, 'atr_min_pct': 0.018004480044017744, 'atr_max_pct': 0.09087704122935952, 'tp_mult': 1.1731010331087965, 'tsl_mult': 0.06604345915125104, 'strategy': 'mean_reversion', 'time_stop': 99, 'use_sma': True, 'use_atr': True, 'use_adx': False, 'use_ema': False, 'use_spike': True, 'rsi_required': False, 'edge_k': 0.8565934731251285, 'edge_cap': 0.35690059846424366, 'bull_strategy': 'breakout', 'bull_bb_std_mult': 1.4597594046353883, 'bull_rsi_os': 19, 'bull_rsi_ob': 53, 'bull_adx_thresh': 10.284844732887118, 'bull_atr_min_pct': 0.015171886462023054, 'bull_atr_max_pct': 0.07139425205950144, 'bull_tp_mult': 1.3499105682326622, 'bull_tsl_mult': 0.8436246574621585, 'bull_time_stop': 82, 'bull_use_sma': False, 'bull_use_ema': True, 'bull_use_atr': False, 'bull_use_adx': True, 'bull_use_spike': True, 'bull_rsi_required': False, 'bear_strategy': 'mean_reversion', 'bear_bb_std_mult': 0.577235063969189, 'bear_rsi_os': 46, 'bear_rsi_ob': 50, 'bear_adx_thresh': 5.477320846457044, 'bear_atr_min_pct': 0.005258555917460484, 'bear_atr_max_pct': 0.07612794242146699, 'bear_tp_mult': 1.8464115698704842, 'bear_tsl_mult': 0.24147658044233442, 'bear_time_stop': 234, 'bear_use_sma': False, 'bear_use_ema': False, 'bear_use_atr': False, 'bear_use_adx': True, 'bear_use_spike': True, 'bear_rsi_required': True, 'sideways_strategy': 'mean_reversion', 'sideways_bb_std_mult': 3.0456847945045347, 'sideways_rsi_os': 38, 'sideways_rsi_ob': 66, 'sideways_adx_thresh': 28.557148907141467, 'sideways_atr_min_pct': 0.01618180711119921, 'sideways_atr_max_pct': 0.12452092127917305, 'sideways_tp_mult': 2.8489552486259457, 'sideways_tsl_mult': 0.2520979814269211, 'sideways_time_stop': 13, 'sideways_use_sma': False, 'sideways_use_ema': True, 'sideways_use_atr': True, 'sideways_use_adx': True, 'sideways_use_spike': True, 'sideways_rsi_required': False}.
[I 2025-09-01 13:56:07,915] Trial 195 finished with values: [-0.0025142338837118583, 0.008155527603248416] and parameters: {'p_sma': 13, 'p_std': 24, 'p_atr': 7, 'p_adx': 26, 'rsi_period': 29, 'ema1': 10, 'ema2': 24, 'slip_atr_k': 0.01803456921084405, 'slip_spread_k': 0.54029367948495, 'spread_hl_frac': 0.00840989311895418, 'bb_std_mult': 2.0240620009615733, 'rsi_os': 41, 'rsi_ob': 88, 'vol_spike': 0.23343237875749911, 'adx_thresh': 15.970013288285223, 'atr_min_pct': 0.017168511404883666, 'atr_max_pct': 0.018566255598276498, 'tp_mult': 2.5710414579819796, 'tsl_mult': 0.053808034692760465, 'strategy': 'breakout', 'time_stop': 122, 'use_sma': True, 'use_atr': True, 'use_adx': False, 'use_ema': False, 'use_spike': True, 'rsi_required': False, 'edge_k': 1.2614772747652383, 'edge_cap': 0.14380517993678965, 'bull_strategy': 'breakout', 'bull_bb_std_mult': 2.601621062377864, 'bull_rsi_os': 39, 'bull_rsi_ob': 52, 'bull_adx_thresh': 18.954862588398306, 'bull_atr_min_pct': 0.01034735282432492, 'bull_atr_max_pct': 0.1239930051645309, 'bull_tp_mult': 1.508821650618815, 'bull_tsl_mult': 0.6116152453538727, 'bull_time_stop': 210, 'bull_use_sma': False, 'bull_use_ema': True, 'bull_use_atr': False, 'bull_use_adx': True, 'bull_use_spike': False, 'bull_rsi_required': False, 'bear_strategy': 'breakout', 'bear_bb_std_mult': 3.2705257130925007, 'bear_rsi_os': 15, 'bear_rsi_ob': 50, 'bear_adx_thresh': 6.189920272229902, 'bear_atr_min_pct': 0.004140366029486732, 'bear_atr_max_pct': 0.1438763051789626, 'bear_tp_mult': 1.3478713051969384, 'bear_tsl_mult': 0.10588118740190551, 'bear_time_stop': 256, 'bear_use_sma': False, 'bear_use_ema': False, 'bear_use_atr': False, 'bear_use_adx': True, 'bear_use_spike': False, 'bear_rsi_required': False, 'sideways_strategy': 'mean_reversion', 'sideways_bb_std_mult': 0.575700874323037, 'sideways_rsi_os': 5, 'sideways_rsi_ob': 87, 'sideways_adx_thresh': 5.100219172316557, 'sideways_atr_min_pct': 0.014809961016434408, 'sideways_atr_max_pct': 0.0909612652271659, 'sideways_tp_mult': 1.134367108549336, 'sideways_tsl_mult': 0.016495078891180404, 'sideways_time_stop': 231, 'sideways_use_sma': False, 'sideways_use_ema': True, 'sideways_use_atr': True, 'sideways_use_adx': False, 'sideways_use_spike': True, 'sideways_rsi_required': False}.
[I 2025-09-01 13:56:08,357] Trial 194 finished with values: [-1000000000.0, 1000000000.0] and parameters: {'p_sma': 13, 'p_std': 23, 'p_atr': 7, 'p_adx': 11, 'rsi_period': 29, 'ema1': 22, 'ema2': 34, 'slip_atr_k': 0.06412790964373356, 'slip_spread_k': 0.9153924852037273, 'spread_hl_frac': 0.007971093666838059, 'bb_std_mult': 1.9904098560064938, 'rsi_os': 46, 'rsi_ob': 85, 'vol_spike': 0.28402757683404867, 'adx_thresh': 22.196286864260724, 'atr_min_pct': 0.01716190450512615, 'atr_max_pct': 0.019056871618558367, 'tp_mult': 2.0291840731960926, 'tsl_mult': 0.7742648110264255, 'strategy': 'breakout', 'time_stop': 98, 'use_sma': False, 'use_atr': True, 'use_adx': False, 'use_ema': False, 'use_spike': False, 'rsi_required': True, 'edge_k': 1.246824077368009, 'edge_cap': 0.3563184578659329, 'bull_strategy': 'breakout', 'bull_bb_std_mult': 1.2526650691386847, 'bull_rsi_os': 18, 'bull_rsi_ob': 70, 'bull_adx_thresh': 23.29865509915725, 'bull_atr_min_pct': 0.010074022862314359, 'bull_atr_max_pct': 0.12414759090431436, 'bull_tp_mult': 2.6854180790876567, 'bull_tsl_mult': 0.20189937199965757, 'bull_time_stop': 105, 'bull_use_sma': False, 'bull_use_ema': True, 'bull_use_atr': False, 'bull_use_adx': True, 'bull_use_spike': False, 'bull_rsi_required': False, 'bear_strategy': 'breakout', 'bear_bb_std_mult': 2.830123899427209, 'bear_rsi_os': 46, 'bear_rsi_ob': 50, 'bear_adx_thresh': 21.038854085075766, 'bear_atr_min_pct': 0.00625002282499845, 'bear_atr_max_pct': 0.022177808084994144, 'bear_tp_mult': 1.837642718281113, 'bear_tsl_mult': 0.11154214269932267, 'bear_time_stop': 72, 'bear_use_sma': False, 'bear_use_ema': False, 'bear_use_atr': False, 'bear_use_adx': True, 'bear_use_spike': False, 'bear_rsi_required': True, 'sideways_strategy': 'mean_reversion', 'sideways_bb_std_mult': 1.8703747532073312, 'sideways_rsi_os': 36, 'sideways_rsi_ob': 88, 'sideways_adx_thresh': 27.325166167651602, 'sideways_atr_min_pct': 0.014978006818652988, 'sideways_atr_max_pct': 0.12326312964452832, 'sideways_tp_mult': 1.5509220342436778, 'sideways_tsl_mult': 0.7656639310763282, 'sideways_time_stop': 229, 'sideways_use_sma': False, 'sideways_use_ema': True, 'sideways_use_atr': True, 'sideways_use_adx': False, 'sideways_use_spike': True, 'sideways_rsi_required': False}.
[I 2025-09-01 13:56:08,997] Trial 199 finished with values: [-1000000000.0, 1000000000.0] and parameters: {'p_sma': 23, 'p_std': 27, 'p_atr': 21, 'p_adx': 26, 'rsi_period': 14, 'ema1': 26, 'ema2': 24, 'slip_atr_k': 0.0048555910885079885, 'slip_spread_k': 0.752253063879929, 'spread_hl_frac': 0.016545642848753123, 'bb_std_mult': 1.286813489153575, 'rsi_os': 18, 'rsi_ob': 65, 'vol_spike': 0.10710953100917059, 'adx_thresh': 5.910925415917298, 'atr_min_pct': 0.017061394013073616, 'atr_max_pct': 0.015990266922168914, 'tp_mult': 2.711590270520351, 'tsl_mult': 0.042873874739339936, 'strategy': 'breakout', 'time_stop': 111, 'use_sma': True, 'use_atr': True, 'use_adx': False, 'use_ema': False, 'use_spike': True, 'rsi_required': False, 'edge_k': 1.3047681094621864, 'edge_cap': 0.14474414925206933, 'bull_strategy': 'breakout', 'bull_bb_std_mult': 1.3107404646790721, 'bull_rsi_os': 27, 'bull_rsi_ob': 91, 'bull_adx_thresh': 12.535593650558596, 'bull_atr_min_pct': 0.010513122306940525, 'bull_atr_max_pct': 0.09597840767969272, 'bull_tp_mult': 1.5159129267726206, 'bull_tsl_mult': 0.9144979809031184, 'bull_time_stop': 93, 'bull_use_sma': False, 'bull_use_ema': True, 'bull_use_atr': False, 'bull_use_adx': True, 'bull_use_spike': False, 'bull_rsi_required': False, 'bear_strategy': 'breakout', 'bear_bb_std_mult': 0.7115524220870297, 'bear_rsi_os': 14, 'bear_rsi_ob': 53, 'bear_adx_thresh': 25.10362078514011, 'bear_atr_min_pct': 0.020356373495066117, 'bear_atr_max_pct': 0.12942582246238724, 'bear_tp_mult': 1.9089080267489027, 'bear_tsl_mult': 0.04179505572968413, 'bear_time_stop': 258, 'bear_use_sma': False, 'bear_use_ema': True, 'bear_use_atr': True, 'bear_use_adx': True, 'bear_use_spike': False, 'bear_rsi_required': False, 'sideways_strategy': 'breakout', 'sideways_bb_std_mult': 1.3005769509495035, 'sideways_rsi_os': 25, 'sideways_rsi_ob': 84, 'sideways_adx_thresh': 14.072595632430037, 'sideways_atr_min_pct': 0.014805151973037764, 'sideways_atr_max_pct': 0.11820936442856309, 'sideways_tp_mult': 2.616194979347944, 'sideways_tsl_mult': 0.7116347327501271, 'sideways_time_stop': 242, 'sideways_use_sma': False, 'sideways_use_ema': True, 'sideways_use_atr': True, 'sideways_use_adx': False, 'sideways_use_spike': False, 'sideways_rsi_required': False}.
[I 2025-09-01 13:56:48,013] Trial 197 finished with values: [-1000000000.0, 1000000000.0] and parameters: {'p_sma': 13, 'p_std': 57, 'p_atr': 25, 'p_adx': 26, 'rsi_period': 14, 'ema1': 8, 'ema2': 35, 'slip_atr_k': 0.003722653945472509, 'slip_spread_k': 0.5136283249134296, 'spread_hl_frac': 0.007344789684487766, 'bb_std_mult': 2.026754575289373, 'rsi_os': 41, 'rsi_ob': 65, 'vol_spike': 0.057440661329727374, 'adx_thresh': 23.82863003454799, 'atr_min_pct': 0.017129104873257747, 'atr_max_pct': 0.018216590337658267, 'tp_mult': 2.371118866733984, 'tsl_mult': 0.3107647502939783, 'strategy': 'breakout', 'time_stop': 106, 'use_sma': True, 'use_atr': True, 'use_adx': False, 'use_ema': False, 'use_spike': True, 'rsi_required': False, 'edge_k': 0.42010080596469557, 'edge_cap': 0.0947803828110016, 'bull_strategy': 'breakout', 'bull_bb_std_mult': 0.7449779273877721, 'bull_rsi_os': 40, 'bull_rsi_ob': 51, 'bull_adx_thresh': 23.145038817350986, 'bull_atr_min_pct': 0.026270345546246618, 'bull_atr_max_pct': 0.09765012480947725, 'bull_tp_mult': 1.5138851166856528, 'bull_tsl_mult': 0.6054105023093762, 'bull_time_stop': 95, 'bull_use_sma': False, 'bull_use_ema': True, 'bull_use_atr': False, 'bull_use_adx': True, 'bull_use_spike': False, 'bull_rsi_required': False, 'bear_strategy': 'breakout', 'bear_bb_std_mult': 3.5991077222394585, 'bear_rsi_os': 25, 'bear_rsi_ob': 53, 'bear_adx_thresh': 20.861491557443976, 'bear_atr_min_pct': 0.02736322326255676, 'bear_atr_max_pct': 0.06415079779138919, 'bear_tp_mult': 1.9056397505328375, 'bear_tsl_mult': 0.11043762036726676, 'bear_time_stop': 72, 'bear_use_sma': False, 'bear_use_ema': True, 'bear_use_atr': False, 'bear_use_adx': True, 'bear_use_spike': False, 'bear_rsi_required': False, 'sideways_strategy': 'breakout', 'sideways_bb_std_mult': 2.8229224788812357, 'sideways_rsi_os': 36, 'sideways_rsi_ob': 48, 'sideways_adx_thresh': 29.803248080987824, 'sideways_atr_min_pct': 0.014830015595988602, 'sideways_atr_max_pct': 0.04456556783940926, 'sideways_tp_mult': 2.4844798436475473, 'sideways_tsl_mult': 0.005367052153915919, 'sideways_time_stop': 230, 'sideways_use_sma': False, 'sideways_use_ema': True, 'sideways_use_atr': True, 'sideways_use_adx': False, 'sideways_use_spike': False, 'sideways_rsi_required': False}.
