[I 2025-09-01 14:37:01,048] Trial 477 finished with values: [-1000000000.0, 1000000000.0] and parameters: {'p_sma': 18, 'p_std': 51, 'p_atr': 27, 'p_adx': 8, 'rsi_period': 67, 'ema1': 9, 'ema2': 57, 'slip_atr_k': 0.004821723289923835, 'slip_spread_k': 0.5558688558395243, 'spread_hl_frac': 0.04403235263311041, 'bb_std_mult': 2.275061306853482, 'rsi_os': 46, 'rsi_ob': 92, 'vol_spike': 0.011058754657160663, 'adx_thresh': 5.039615267508312, 'atr_min_pct': 0.015258507937840933, 'atr_max_pct': 0.03398695405043201, 'tp_mult': 1.2759616116918124, 'tsl_mult': 0.7409216311261207, 'strategy': 'mean_reversion', 'time_stop': 253, 'use_sma': True, 'use_atr': False, 'use_adx': True, 'use_ema': True, 'use_spike': True, 'rsi_required': True, 'edge_k': 0.17219071181581158, 'edge_cap': 0.933961639120267, 'bull_strategy': 'mean_reversion', 'bull_bb_std_mult': 3.1072413911884356, 'bull_rsi_os': 14, 'bull_rsi_ob': 80, 'bull_adx_thresh': 8.074057081970961, 'bull_atr_min_pct': 0.026174005971921148, 'bull_atr_max_pct': 0.12185939708245229, 'bull_tp_mult': 1.631806166963327, 'bull_tsl_mult': 0.4766057461016588, 'bull_time_stop': 154, 'bull_use_sma': True, 'bull_use_ema': True, 'bull_use_atr': True, 'bull_use_adx': False, 'bull_use_spike': True, 'bull_rsi_required': True, 'bear_strategy': 'mean_reversion', 'bear_bb_std_mult': 3.38042730335048, 'bear_rsi_os': 32, 'bear_rsi_ob': 94, 'bear_adx_thresh': 8.313776398336106, 'bear_atr_min_pct': 0.002711531173787565, 'bear_atr_max_pct': 0.11258445862805402, 'bear_tp_mult': 2.070825605000621, 'bear_tsl_mult': 0.15250806526489813, 'bear_time_stop': 81, 'bear_use_sma': True, 'bear_use_ema': False, 'bear_use_atr': False, 'bear_use_adx': False, 'bear_use_spike': True, 'bear_rsi_required': False, 'sideways_strategy': 'mean_reversion', 'sideways_bb_std_mult': 2.9076157819229875, 'sideways_rsi_os': 8, 'sideways_rsi_ob': 60, 'sideways_adx_thresh': 25.08089762102985, 'sideways_atr_min_pct': 0.004246662204860367, 'sideways_atr_max_pct': 0.10865795267430674, 'sideways_tp_mult': 2.5193030299641257, 'sideways_tsl_mult': 0.3687873195436598, 'sideways_time_stop': 274, 'sideways_use_sma': True, 'sideways_use_ema': False, 'sideways_use_atr': True, 'sideways_use_adx': True, 'sideways_use_spike': False, 'sideways_rsi_required': False}.
[I 2025-09-01 14:37:03,471] Trial 479 finished with values: [-1000000000.0, 1000000000.0] and parameters: {'p_sma': 29, 'p_std': 51, 'p_atr': 22, 'p_adx': 8, 'rsi_period': 78, 'ema1': 9, 'ema2': 57, 'slip_atr_k': 0.004498796484436279, 'slip_spread_k': 0.830694445061124, 'spread_hl_frac': 0.03996473885977249, 'bb_std_mult': 3.2449277077138863, 'rsi_os': 41, 'rsi_ob': 78, 'vol_spike': 0.1181268984178935, 'adx_thresh': 5.518351415057814, 'atr_min_pct': 0.010413613930941566, 'atr_max_pct': 0.03515822961702879, 'tp_mult': 2.7417730757861887, 'tsl_mult': 0.5181244983477851, 'strategy': 'mean_reversion', 'time_stop': 120, 'use_sma': False, 'use_atr': False, 'use_adx': True, 'use_ema': True, 'use_spike': True, 'rsi_required': True, 'edge_k': 0.2172321349331484, 'edge_cap': 0.9485616818308542, 'bull_strategy': 'mean_reversion', 'bull_bb_std_mult': 2.273750662841704, 'bull_rsi_os': 14, 'bull_rsi_ob': 79, 'bull_adx_thresh': 34.47498576155401, 'bull_atr_min_pct': 0.010553701124115442, 'bull_atr_max_pct': 0.1278161992191353, 'bull_tp_mult': 1.6462418947851483, 'bull_tsl_mult': 0.46917990310540575, 'bull_time_stop': 151, 'bull_use_sma': False, 'bull_use_ema': False, 'bull_use_atr': True, 'bull_use_adx': False, 'bull_use_spike': True, 'bull_rsi_required': True, 'bear_strategy': 'mean_reversion', 'bear_bb_std_mult': 2.5157298365987897, 'bear_rsi_os': 48, 'bear_rsi_ob': 57, 'bear_adx_thresh': 8.705437236776556, 'bear_atr_min_pct': 0.015080678658148123, 'bear_atr_max_pct': 0.10051790056152254, 'bear_tp_mult': 2.002316871232276, 'bear_tsl_mult': 0.9460800496702106, 'bear_time_stop': 71, 'bear_use_sma': True, 'bear_use_ema': False, 'bear_use_atr': False, 'bear_use_adx': False, 'bear_use_spike': False, 'bear_rsi_required': False, 'sideways_strategy': 'mean_reversion', 'sideways_bb_std_mult': 3.0092360333305117, 'sideways_rsi_os': 29, 'sideways_rsi_ob': 89, 'sideways_adx_thresh': 25.03988725182851, 'sideways_atr_min_pct': 0.0022904316285081673, 'sideways_atr_max_pct': 0.10949203607169046, 'sideways_tp_mult': 2.052294564695216, 'sideways_tsl_mult': 0.36636137064070445, 'sideways_time_stop': 135, 'sideways_use_sma': True, 'sideways_use_ema': True, 'sideways_use_atr': True, 'sideways_use_adx': True, 'sideways_use_spike': False, 'sideways_rsi_required': False}.
[I 2025-09-01 14:37:03,934] Trial 478 finished with values: [-0.004304120434584502, 0.008271592183743823] and parameters: {'p_sma': 30, 'p_std': 51, 'p_atr': 27, 'p_adx': 8, 'rsi_period': 77, 'ema1': 21, 'ema2': 57, 'slip_atr_k': 0.009445372725581578, 'slip_spread_k': 0.875366150834114, 'spread_hl_frac': 0.009077432746648564, 'bb_std_mult': 3.547072010086179, 'rsi_os': 46, 'rsi_ob': 86, 'vol_spike': 0.11742696876729793, 'adx_thresh': 28.781765645823423, 'atr_min_pct': 0.012560789150071711, 'atr_max_pct': 0.03467023031282732, 'tp_mult': 1.0115467394681275, 'tsl_mult': 0.7558437425511784, 'strategy': 'mean_reversion', 'time_stop': 116, 'use_sma': False, 'use_atr': False, 'use_adx': True, 'use_ema': True, 'use_spike': True, 'rsi_required': True, 'edge_k': 0.8231745700892876, 'edge_cap': 0.43591948975495315, 'bull_strategy': 'mean_reversion', 'bull_bb_std_mult': 3.0850980552981637, 'bull_rsi_os': 14, 'bull_rsi_ob': 60, 'bull_adx_thresh': 6.30968765878278, 'bull_atr_min_pct': 0.010481905339510749, 'bull_atr_max_pct': 0.1112130617228344, 'bull_tp_mult': 1.6449219982432326, 'bull_tsl_mult': 0.4725227568712048, 'bull_time_stop': 273, 'bull_use_sma': False, 'bull_use_ema': False, 'bull_use_atr': True, 'bull_use_adx': False, 'bull_use_spike': True, 'bull_rsi_required': True, 'bear_strategy': 'mean_reversion', 'bear_bb_std_mult': 2.520273825292506, 'bear_rsi_os': 36, 'bear_rsi_ob': 57, 'bear_adx_thresh': 8.705845660309398, 'bear_atr_min_pct': 0.002771122003701712, 'bear_atr_max_pct': 0.10057596597409389, 'bear_tp_mult': 1.4764338755597857, 'bear_tsl_mult': 0.1533124827633241, 'bear_time_stop': 71, 'bear_use_sma': True, 'bear_use_ema': False, 'bear_use_atr': False, 'bear_use_adx': False, 'bear_use_spike': False, 'bear_rsi_required': False, 'sideways_strategy': 'mean_reversion', 'sideways_bb_std_mult': 3.0767384531575592, 'sideways_rsi_os': 41, 'sideways_rsi_ob': 63, 'sideways_adx_thresh': 24.492478277488694, 'sideways_atr_min_pct': 0.0030261394535988535, 'sideways_atr_max_pct': 0.14354078441858317, 'sideways_tp_mult': 2.5415893742334985, 'sideways_tsl_mult': 0.3690387051510726, 'sideways_time_stop': 273, 'sideways_use_sma': True, 'sideways_use_ema': True, 'sideways_use_atr': True, 'sideways_use_adx': True, 'sideways_use_spike': False, 'sideways_rsi_required': False}.
[I 2025-09-01 14:37:04,419] Trial 480 finished with values: [-1000000000.0, 1000000000.0] and parameters: {'p_sma': 30, 'p_std': 29, 'p_atr': 27, 'p_adx': 8, 'rsi_period': 78, 'ema1': 28, 'ema2': 57, 'slip_atr_k': 0.008953271379010013, 'slip_spread_k': 0.5530583402906657, 'spread_hl_frac': 0.005942027669224531, 'bb_std_mult': 3.538332763188502, 'rsi_os': 39, 'rsi_ob': 52, 'vol_spike': 0.07661051797834983, 'adx_thresh': 29.859771104265707, 'atr_min_pct': 0.012757247079754223, 'atr_max_pct': 0.03017598731859476, 'tp_mult': 2.7504899183512013, 'tsl_mult': 0.7506549597653546, 'strategy': 'mean_reversion', 'time_stop': 120, 'use_sma': False, 'use_atr': False, 'use_adx': True, 'use_ema': True, 'use_spike': True, 'rsi_required': True, 'edge_k': 0.18135801716981945, 'edge_cap': 0.9457427602667354, 'bull_strategy': 'mean_reversion', 'bull_bb_std_mult': 2.9569901000444214, 'bull_rsi_os': 15, 'bull_rsi_ob': 92, 'bull_adx_thresh': 11.993589824470385, 'bull_atr_min_pct': 0.011618765357848415, 'bull_atr_max_pct': 0.1279500185381668, 'bull_tp_mult': 1.5407233396924989, 'bull_tsl_mult': 0.469504495048043, 'bull_time_stop': 155, 'bull_use_sma': False, 'bull_use_ema': False, 'bull_use_atr': True, 'bull_use_adx': False, 'bull_use_spike': True, 'bull_rsi_required': True, 'bear_strategy': 'mean_reversion', 'bear_bb_std_mult': 2.071577812058053, 'bear_rsi_os': 9, 'bear_rsi_ob': 85, 'bear_adx_thresh': 8.705227684273101, 'bear_atr_min_pct': 0.014909960311849012, 'bear_atr_max_pct': 0.08488746139741284, 'bear_tp_mult': 2.0075473614916857, 'bear_tsl_mult': 0.724210831089638, 'bear_time_stop': 32, 'bear_use_sma': False, 'bear_use_ema': False, 'bear_use_atr': False, 'bear_use_adx': False, 'bear_use_spike': False, 'bear_rsi_required': False, 'sideways_strategy': 'mean_reversion', 'sideways_bb_std_mult': 3.0132003338081743, 'sideways_rsi_os': 29, 'sideways_rsi_ob': 60, 'sideways_adx_thresh': 24.505618950371105, 'sideways_atr_min_pct': 0.0031150758203032053, 'sideways_atr_max_pct': 0.06020660737072007, 'sideways_tp_mult': 2.5143601630358967, 'sideways_tsl_mult': 0.36985273846402267, 'sideways_time_stop': 44, 'sideways_use_sma': True, 'sideways_use_ema': True, 'sideways_use_atr': True, 'sideways_use_adx': True, 'sideways_use_spike': False, 'sideways_rsi_required': False}.
[I 2025-09-01 14:37:39,815] Trial 481 finished with values: [-0.02295763583980348, 0.02610938771302311] and parameters: {'p_sma': 41, 'p_std': 28, 'p_atr': 14, 'p_adx': 7, 'rsi_period': 55, 'ema1': 9, 'ema2': 58, 'slip_atr_k': 0.009611093039616884, 'slip_spread_k': 0.8322475099883695, 'spread_hl_frac': 0.00572957018762233, 'bb_std_mult': 3.545799185337685, 'rsi_os': 41, 'rsi_ob': 55, 'vol_spike': 0.10235109698564143, 'adx_thresh': 5.5343004123845985, 'atr_min_pct': 0.010290576519545602, 'atr_max_pct': 0.030393324815671464, 'tp_mult': 2.7256005595156116, 'tsl_mult': 0.7506025799690751, 'strategy': 'mean_reversion', 'time_stop': 30, 'use_sma': False, 'use_atr': False, 'use_adx': True, 'use_ema': True, 'use_spike': True, 'rsi_required': True, 'edge_k': 0.21536183760579583, 'edge_cap': 0.9861924678766039, 'bull_strategy': 'mean_reversion', 'bull_bb_std_mult': 0.8620821398983793, 'bull_rsi_os': 14, 'bull_rsi_ob': 84, 'bull_adx_thresh': 12.009372807530294, 'bull_atr_min_pct': 0.013154957911879275, 'bull_atr_max_pct': 0.12853970547549576, 'bull_tp_mult': 1.5514707309084985, 'bull_tsl_mult': 0.44065791029574114, 'bull_time_stop': 31, 'bull_use_sma': False, 'bull_use_ema': False, 'bull_use_atr': True, 'bull_use_adx': True, 'bull_use_spike': True, 'bull_rsi_required': True, 'bear_strategy': 'mean_reversion', 'bear_bb_std_mult': 2.2058074534393266, 'bear_rsi_os': 36, 'bear_rsi_ob': 77, 'bear_adx_thresh': 7.098877050251469, 'bear_atr_min_pct': 0.0012968117961739193, 'bear_atr_max_pct': 0.08518828831693856, 'bear_tp_mult': 2.149134663096486, 'bear_tsl_mult': 0.1026706160034058, 'bear_time_stop': 105, 'bear_use_sma': False, 'bear_use_ema': False, 'bear_use_atr': False, 'bear_use_adx': False, 'bear_use_spike': False, 'bear_rsi_required': False, 'sideways_strategy': 'mean_reversion', 'sideways_bb_std_mult': 3.0321219397330434, 'sideways_rsi_os': 5, 'sideways_rsi_ob': 63, 'sideways_adx_thresh': 24.62037756119127, 'sideways_atr_min_pct': 0.0023829467107817815, 'sideways_atr_max_pct': 0.11115893876506351, 'sideways_tp_mult': 1.0877855922418194, 'sideways_tsl_mult': 0.3735311662346127, 'sideways_time_stop': 264, 'sideways_use_sma': True, 'sideways_use_ema': True, 'sideways_use_atr': True, 'sideways_use_adx': True, 'sideways_use_spike': True, 'sideways_rsi_required': False}.
[I 2025-09-01 14:37:40,480] Trial 484 finished with values: [-1000000000.0, 1000000000.0] and parameters: {'p_sma': 55, 'p_std': 28, 'p_atr': 19, 'p_adx': 7, 'rsi_period': 81, 'ema1': 8, 'ema2': 55, 'slip_atr_k': 0.1126907655576833, 'slip_spread_k': 0.5241982726579681, 'spread_hl_frac': 0.010213134391037977, 'bb_std_mult': 3.436487098797617, 'rsi_os': 42, 'rsi_ob': 54, 'vol_spike': 0.10242343833327854, 'adx_thresh': 5.014156505390149, 'atr_min_pct': 0.005651953493901945, 'atr_max_pct': 0.07323589532664485, 'tp_mult': 1.4509210382627613, 'tsl_mult': 0.6809330097718003, 'strategy': 'breakout', 'time_stop': 98, 'use_sma': True, 'use_atr': True, 'use_adx': False, 'use_ema': True, 'use_spike': True, 'rsi_required': False, 'edge_k': 0.27584666784457784, 'edge_cap': 0.9890098984524542, 'bull_strategy': 'breakout', 'bull_bb_std_mult': 3.185720736731744, 'bull_rsi_os': 12, 'bull_rsi_ob': 84, 'bull_adx_thresh': 10.473509537898533, 'bull_atr_min_pct': 0.013077168168733512, 'bull_atr_max_pct': 0.10773856817793712, 'bull_tp_mult': 1.8667605784283239, 'bull_tsl_mult': 0.43489661842128374, 'bull_time_stop': 186, 'bull_use_sma': False, 'bull_use_ema': True, 'bull_use_atr': True, 'bull_use_adx': True, 'bull_use_spike': False, 'bull_rsi_required': True, 'bear_strategy': 'breakout', 'bear_bb_std_mult': 2.1326770974782225, 'bear_rsi_os': 36, 'bear_rsi_ob': 75, 'bear_adx_thresh': 7.225971432761698, 'bear_atr_min_pct': 0.0015162798840019313, 'bear_atr_max_pct': 0.10901417000465265, 'bear_tp_mult': 2.4662113950562032, 'bear_tsl_mult': 0.45020041502092867, 'bear_time_stop': 93, 'bear_use_sma': False, 'bear_use_ema': True, 'bear_use_atr': True, 'bear_use_adx': False, 'bear_use_spike': True, 'bear_rsi_required': True, 'sideways_strategy': 'breakout', 'sideways_bb_std_mult': 2.5162891307750064, 'sideways_rsi_os': 5, 'sideways_rsi_ob': 90, 'sideways_adx_thresh': 22.423262136175133, 'sideways_atr_min_pct': 0.029471078731834917, 'sideways_atr_max_pct': 0.05622914150587444, 'sideways_tp_mult': 2.3831276188064967, 'sideways_tsl_mult': 0.1516935987768661, 'sideways_time_stop': 263, 'sideways_use_sma': False, 'sideways_use_ema': True, 'sideways_use_atr': False, 'sideways_use_adx': False, 'sideways_use_spike': True, 'sideways_rsi_required': True}.
[I 2025-09-01 14:37:40,486] Trial 483 finished with values: [-1000000000.0, 1000000000.0] and parameters: {'p_sma': 30, 'p_std': 28, 'p_atr': 25, 'p_adx': 25, 'rsi_period': 80, 'ema1': 10, 'ema2': 55, 'slip_atr_k': 0.01744047584469332, 'slip_spread_k': 0.7083444769401526, 'spread_hl_frac': 0.010132636016445082, 'bb_std_mult': 3.536592204502882, 'rsi_os': 34, 'rsi_ob': 52, 'vol_spike': 0.10291888244253405, 'adx_thresh': 5.020714023524722, 'atr_min_pct': 0.0040698839484843135, 'atr_max_pct': 0.13826642546803403, 'tp_mult': 1.4536398946761677, 'tsl_mult': 0.9367855183855336, 'strategy': 'mean_reversion', 'time_stop': 300, 'use_sma': True, 'use_atr': True, 'use_adx': True, 'use_ema': True, 'use_spike': True, 'rsi_required': False, 'edge_k': 1.0385632019085473, 'edge_cap': 0.9857138469606777, 'bull_strategy': 'breakout', 'bull_bb_std_mult': 3.1807115541772255, 'bull_rsi_os': 55, 'bull_rsi_ob': 75, 'bull_adx_thresh': 31.968768261552157, 'bull_atr_min_pct': 0.004371725462879759, 'bull_atr_max_pct': 0.12650253091408215, 'bull_tp_mult': 1.5551197100886902, 'bull_tsl_mult': 0.061790626806150106, 'bull_time_stop': 118, 'bull_use_sma': False, 'bull_use_ema': True, 'bull_use_atr': True, 'bull_use_adx': True, 'bull_use_spike': True, 'bull_rsi_required': True, 'bear_strategy': 'mean_reversion', 'bear_bb_std_mult': 2.2250091013103024, 'bear_rsi_os': 38, 'bear_rsi_ob': 85, 'bear_adx_thresh': 6.973938024286314, 'bear_atr_min_pct': 0.001514130419167418, 'bear_atr_max_pct': 0.10872300528681543, 'bear_tp_mult': 1.0479460211462464, 'bear_tsl_mult': 0.7136056234467087, 'bear_time_stop': 91, 'bear_use_sma': False, 'bear_use_ema': True, 'bear_use_atr': False, 'bear_use_adx': False, 'bear_use_spike': True, 'bear_rsi_required': True, 'sideways_strategy': 'breakout', 'sideways_bb_std_mult': 2.198252461780973, 'sideways_rsi_os': 31, 'sideways_rsi_ob': 91, 'sideways_adx_thresh': 24.540887901085163, 'sideways_atr_min_pct': 0.009290104990209519, 'sideways_atr_max_pct': 0.059821899972495665, 'sideways_tp_mult': 2.387537452366696, 'sideways_tsl_mult': 0.5344120557998305, 'sideways_time_stop': 266, 'sideways_use_sma': False, 'sideways_use_ema': True, 'sideways_use_atr': False, 'sideways_use_adx': False, 'sideways_use_spike': True, 'sideways_rsi_required': True}.
[I 2025-09-01 14:37:40,810] Trial 482 finished with values: [-0.011882538009020616, 0.014792496001205448] and parameters: {'p_sma': 30, 'p_std': 28, 'p_atr': 27, 'p_adx': 7, 'rsi_period': 77, 'ema1': 10, 'ema2': 58, 'slip_atr_k': 0.018604768053479173, 'slip_spread_k': 0.5431642849766545, 'spread_hl_frac': 0.009364111044530634, 'bb_std_mult': 3.5329723217384204, 'rsi_os': 43, 'rsi_ob': 62, 'vol_spike': 0.14226687842797078, 'adx_thresh': 5.021309919995079, 'atr_min_pct': 0.011185625195650008, 'atr_max_pct': 0.03144355906734672, 'tp_mult': 2.89417035057969, 'tsl_mult': 0.933186303669322, 'strategy': 'mean_reversion', 'time_stop': 98, 'use_sma': True, 'use_atr': True, 'use_adx': True, 'use_ema': True, 'use_spike': True, 'rsi_required': True, 'edge_k': 0.8080412046581098, 'edge_cap': 0.9867921261837228, 'bull_strategy': 'breakout', 'bull_bb_std_mult': 2.8394390424161324, 'bull_rsi_os': 12, 'bull_rsi_ob': 75, 'bull_adx_thresh': 18.625387572695143, 'bull_atr_min_pct': 0.0039903463751324985, 'bull_atr_max_pct': 0.14663238354684005, 'bull_tp_mult': 2.4024889794997892, 'bull_tsl_mult': 0.4417501272209039, 'bull_time_stop': 273, 'bull_use_sma': False, 'bull_use_ema': False, 'bull_use_atr': True, 'bull_use_adx': True, 'bull_use_spike': True, 'bull_rsi_required': True, 'bear_strategy': 'mean_reversion', 'bear_bb_std_mult': 2.229134036521893, 'bear_rsi_os': 36, 'bear_rsi_ob': 77, 'bear_adx_thresh': 6.973714130081662, 'bear_atr_min_pct': 0.0013830203281503905, 'bear_atr_max_pct': 0.10888026226809339, 'bear_tp_mult': 2.2871637672523395, 'bear_tsl_mult': 0.15174315284818887, 'bear_time_stop': 26, 'bear_use_sma': False, 'bear_use_ema': False, 'bear_use_atr': False, 'bear_use_adx': False, 'bear_use_spike': True, 'bear_rsi_required': True, 'sideways_strategy': 'breakout', 'sideways_bb_std_mult': 3.065032816048881, 'sideways_rsi_os': 19, 'sideways_rsi_ob': 79, 'sideways_adx_thresh': 24.413793159584216, 'sideways_atr_min_pct': 0.02898135635343485, 'sideways_atr_max_pct': 0.11169366640848392, 'sideways_tp_mult': 2.3943301047992405, 'sideways_tsl_mult': 0.15903382385337028, 'sideways_time_stop': 41, 'sideways_use_sma': True, 'sideways_use_ema': True, 'sideways_use_atr': False, 'sideways_use_adx': True, 'sideways_use_spike': True, 'sideways_rsi_required': False}.
[I 2025-09-01 14:37:41,510] Trial 486 finished with values: [-1000000000.0, 1000000000.0] and parameters: {'p_sma': 27, 'p_std': 17, 'p_atr': 15, 'p_adx': 29, 'rsi_period': 82, 'ema1': 10, 'ema2': 56, 'slip_atr_k': 0.20925734485119551, 'slip_spread_k': 0.36387434176424405, 'spread_hl_frac': 0.008792177793291845, 'bb_std_mult': 1.2016335200304717, 'rsi_os': 25, 'rsi_ob': 45, 'vol_spike': 0.043316644467712176, 'adx_thresh': 6.2155690774124, 'atr_min_pct': 0.011613535028884216, 'atr_max_pct': 0.026311725116061675, 'tp_mult': 2.919653593344464, 'tsl_mult': 0.4058568304407266, 'strategy': 'mean_reversion', 'time_stop': 204, 'use_sma': True, 'use_atr': False, 'use_adx': True, 'use_ema': True, 'use_spike': False, 'rsi_required': True, 'edge_k': 0.22929358758106308, 'edge_cap': 0.962393192771404, 'bull_strategy': 'breakout', 'bull_bb_std_mult': 3.1451688962394817, 'bull_rsi_os': 7, 'bull_rsi_ob': 78, 'bull_adx_thresh': 12.881942252033827, 'bull_atr_min_pct': 0.011569077352150384, 'bull_atr_max_pct': 0.09449695620488091, 'bull_tp_mult': 2.039652092174798, 'bull_tsl_mult': 0.5093742839091011, 'bull_time_stop': 212, 'bull_use_sma': False, 'bull_use_ema': True, 'bull_use_atr': False, 'bull_use_adx': True, 'bull_use_spike': True, 'bull_rsi_required': False, 'bear_strategy': 'mean_reversion', 'bear_bb_std_mult': 2.425802401000515, 'bear_rsi_os': 34, 'bear_rsi_ob': 61, 'bear_adx_thresh': 13.831151206744202, 'bear_atr_min_pct': 0.013459406532718144, 'bear_atr_max_pct': 0.10441565089171123, 'bear_tp_mult': 2.047371715771849, 'bear_tsl_mult': 0.09443624389007241, 'bear_time_stop': 199, 'bear_use_sma': False, 'bear_use_ema': False, 'bear_use_atr': False, 'bear_use_adx': True, 'bear_use_spike': True, 'bear_rsi_required': False, 'sideways_strategy': 'mean_reversion', 'sideways_bb_std_mult': 2.9681670557529705, 'sideways_rsi_os': 47, 'sideways_rsi_ob': 61, 'sideways_adx_thresh': 23.541243495283787, 'sideways_atr_min_pct': 0.005496104489627976, 'sideways_atr_max_pct': 0.0777500096818127, 'sideways_tp_mult': 2.455003906681117, 'sideways_tsl_mult': 0.4092562254513976, 'sideways_time_stop': 259, 'sideways_use_sma': True, 'sideways_use_ema': True, 'sideways_use_atr': True, 'sideways_use_adx': True, 'sideways_use_spike': False, 'sideways_rsi_required': False}.
