[I 2025-09-01 14:40:57,669] Trial 507 finished with values: [-1000000000.0, 1000000000.0] and parameters: {'p_sma': 27, 'p_std': 29, 'p_atr': 26, 'p_adx': 10, 'rsi_period': 80, 'ema1': 14, 'ema2': 60, 'slip_atr_k': 0.01381024366440451, 'slip_spread_k': 0.25463640754811645, 'spread_hl_frac': 0.00923086588292944, 'bb_std_mult': 3.4307962161807644, 'rsi_os': 43, 'rsi_ob': 58, 'vol_spike': 0.0596770605158035, 'adx_thresh': 6.023992749209741, 'atr_min_pct': 0.014758629898675572, 'atr_max_pct': 0.02938250548646664, 'tp_mult': 1.7063842912908114, 'tsl_mult': 0.7052638459001204, 'strategy': 'breakout', 'time_stop': 236, 'use_sma': True, 'use_atr': False, 'use_adx': False, 'use_ema': False, 'use_spike': True, 'rsi_required': False, 'edge_k': 0.03836179475592355, 'edge_cap': 0.7805277693129644, 'bull_strategy': 'breakout', 'bull_bb_std_mult': 3.219028499023645, 'bull_rsi_os': 14, 'bull_rsi_ob': 76, 'bull_adx_thresh': 24.448234905872756, 'bull_atr_min_pct': 0.011387408170503512, 'bull_atr_max_pct': 0.12621464478656233, 'bull_tp_mult': 2.9296790593078863, 'bull_tsl_mult': 0.8997570795422871, 'bull_time_stop': 168, 'bull_use_sma': True, 'bull_use_ema': True, 'bull_use_atr': True, 'bull_use_adx': True, 'bull_use_spike': False, 'bull_rsi_required': False, 'bear_strategy': 'breakout', 'bear_bb_std_mult': 1.1281985538681125, 'bear_rsi_os': 49, 'bear_rsi_ob': 66, 'bear_adx_thresh': 25.75062782900781, 'bear_atr_min_pct': 2.1948922254547837e-05, 'bear_atr_max_pct': 0.017867321201309832, 'bear_tp_mult': 2.8851225217378973, 'bear_tsl_mult': 0.144581355596433, 'bear_time_stop': 76, 'bear_use_sma': False, 'bear_use_ema': True, 'bear_use_atr': True, 'bear_use_adx': False, 'bear_use_spike': True, 'bear_rsi_required': False, 'sideways_strategy': 'mean_reversion', 'sideways_bb_std_mult': 3.171443615915484, 'sideways_rsi_os': 32, 'sideways_rsi_ob': 71, 'sideways_adx_thresh': 25.248353737813282, 'sideways_atr_min_pct': 0.0026611750750509065, 'sideways_atr_max_pct': 0.11653926583598616, 'sideways_tp_mult': 1.1726353263941136, 'sideways_tsl_mult': 0.8762969884473589, 'sideways_time_stop': 264, 'sideways_use_sma': True, 'sideways_use_ema': False, 'sideways_use_atr': True, 'sideways_use_adx': True, 'sideways_use_spike': False, 'sideways_rsi_required': True}.
[I 2025-09-01 14:40:58,269] Trial 506 finished with values: [-1000000000.0, 1000000000.0] and parameters: {'p_sma': 27, 'p_std': 29, 'p_atr': 26, 'p_adx': 16, 'rsi_period': 80, 'ema1': 10, 'ema2': 59, 'slip_atr_k': 0.01364406977094589, 'slip_spread_k': 0.9722109149107951, 'spread_hl_frac': 0.007988135003926032, 'bb_std_mult': 2.7544319596532625, 'rsi_os': 43, 'rsi_ob': 55, 'vol_spike': 0.11431452093231897, 'adx_thresh': 8.097253196635922, 'atr_min_pct': 0.010731252054161967, 'atr_max_pct': 0.08219437942325501, 'tp_mult': 1.8458861532820412, 'tsl_mult': 0.7251520589681087, 'strategy': 'breakout', 'time_stop': 94, 'use_sma': True, 'use_atr': False, 'use_adx': False, 'use_ema': False, 'use_spike': True, 'rsi_required': False, 'edge_k': 1.7425191329065508, 'edge_cap': 0.9993465983404789, 'bull_strategy': 'breakout', 'bull_bb_std_mult': 3.2159594163081175, 'bull_rsi_os': 15, 'bull_rsi_ob': 95, 'bull_adx_thresh': 11.975554125862365, 'bull_atr_min_pct': 0.011298212069949212, 'bull_atr_max_pct': 0.12687163226199327, 'bull_tp_mult': 1.953286070317923, 'bull_tsl_mult': 0.4345657054297639, 'bull_time_stop': 200, 'bull_use_sma': True, 'bull_use_ema': True, 'bull_use_atr': True, 'bull_use_adx': True, 'bull_use_spike': False, 'bull_rsi_required': False, 'bear_strategy': 'breakout', 'bear_bb_std_mult': 2.4868221209896886, 'bear_rsi_os': 51, 'bear_rsi_ob': 56, 'bear_adx_thresh': 8.524729812752517, 'bear_atr_min_pct': 0.0019205215489930744, 'bear_atr_max_pct': 0.09623685425593394, 'bear_tp_mult': 2.708193556124873, 'bear_tsl_mult': 0.5822028894094902, 'bear_time_stop': 76, 'bear_use_sma': False, 'bear_use_ema': True, 'bear_use_atr': True, 'bear_use_adx': False, 'bear_use_spike': True, 'bear_rsi_required': False, 'sideways_strategy': 'mean_reversion', 'sideways_bb_std_mult': 1.3098647588982035, 'sideways_rsi_os': 14, 'sideways_rsi_ob': 87, 'sideways_adx_thresh': 25.151284691628266, 'sideways_atr_min_pct': 0.002774364261269569, 'sideways_atr_max_pct': 0.11763379907049183, 'sideways_tp_mult': 1.8052125063297173, 'sideways_tsl_mult': 0.4684519153801974, 'sideways_time_stop': 19, 'sideways_use_sma': True, 'sideways_use_ema': False, 'sideways_use_atr': True, 'sideways_use_adx': True, 'sideways_use_spike': False, 'sideways_rsi_required': True}.
[I 2025-09-01 14:40:58,745] Trial 505 finished with values: [-0.02972178910055645, 0.029668590085829814] and parameters: {'p_sma': 27, 'p_std': 11, 'p_atr': 23, 'p_adx': 9, 'rsi_period': 43, 'ema1': 10, 'ema2': 49, 'slip_atr_k': 0.013451311211472996, 'slip_spread_k': 0.5533039108214808, 'spread_hl_frac': 0.008123959931857534, 'bb_std_mult': 3.4011848444072124, 'rsi_os': 49, 'rsi_ob': 55, 'vol_spike': 0.2436741693760226, 'adx_thresh': 8.119658778597746, 'atr_min_pct': 0.024725018318675632, 'atr_max_pct': 0.02875477864720622, 'tp_mult': 1.303212732049542, 'tsl_mult': 0.7260874407511685, 'strategy': 'breakout', 'time_stop': 107, 'use_sma': True, 'use_atr': False, 'use_adx': False, 'use_ema': False, 'use_spike': True, 'rsi_required': False, 'edge_k': 0.4522234040794333, 'edge_cap': 0.9165816637655082, 'bull_strategy': 'breakout', 'bull_bb_std_mult': 1.601675117769558, 'bull_rsi_os': 15, 'bull_rsi_ob': 94, 'bull_adx_thresh': 12.06912486615521, 'bull_atr_min_pct': 0.023003547722324262, 'bull_atr_max_pct': 0.030612645991270067, 'bull_tp_mult': 1.6611796924223032, 'bull_tsl_mult': 0.8931171336777628, 'bull_time_stop': 168, 'bull_use_sma': True, 'bull_use_ema': True, 'bull_use_atr': True, 'bull_use_adx': True, 'bull_use_spike': False, 'bull_rsi_required': False, 'bear_strategy': 'breakout', 'bear_bb_std_mult': 2.4954252950315063, 'bear_rsi_os': 35, 'bear_rsi_ob': 56, 'bear_adx_thresh': 25.754778649189745, 'bear_atr_min_pct': 0.0019850195521966783, 'bear_atr_max_pct': 0.12657910916537254, 'bear_tp_mult': 2.1010397597568393, 'bear_tsl_mult': 0.10223853816679596, 'bear_time_stop': 89, 'bear_use_sma': False, 'bear_use_ema': True, 'bear_use_atr': True, 'bear_use_adx': False, 'bear_use_spike': True, 'bear_rsi_required': False, 'sideways_strategy': 'mean_reversion', 'sideways_bb_std_mult': 3.5919127845589776, 'sideways_rsi_os': 32, 'sideways_rsi_ob': 87, 'sideways_adx_thresh': 25.16771106192955, 'sideways_atr_min_pct': 0.0014699110363307066, 'sideways_atr_max_pct': 0.0420474395784573, 'sideways_tp_mult': 1.448478678346227, 'sideways_tsl_mult': 0.8284318012020817, 'sideways_time_stop': 267, 'sideways_use_sma': False, 'sideways_use_ema': False, 'sideways_use_atr': True, 'sideways_use_adx': True, 'sideways_use_spike': False, 'sideways_rsi_required': True}.
[I 2025-09-01 14:40:59,166] Trial 504 finished with values: [-1000000000.0, 1000000000.0] and parameters: {'p_sma': 59, 'p_std': 29, 'p_atr': 26, 'p_adx': 9, 'rsi_period': 78, 'ema1': 17, 'ema2': 49, 'slip_atr_k': 0.013642736014192783, 'slip_spread_k': 0.5529083358970629, 'spread_hl_frac': 0.008167115958094521, 'bb_std_mult': 1.115608002568544, 'rsi_os': 42, 'rsi_ob': 55, 'vol_spike': 0.05955492241990422, 'adx_thresh': 26.098819460421574, 'atr_min_pct': 0.024815472831788005, 'atr_max_pct': 0.032346199273690396, 'tp_mult': 1.2928287732822565, 'tsl_mult': 0.7269281861078207, 'strategy': 'mean_reversion', 'time_stop': 234, 'use_sma': True, 'use_atr': False, 'use_adx': True, 'use_ema': True, 'use_spike': True, 'rsi_required': False, 'edge_k': 0.31031316324163827, 'edge_cap': 0.3475449310127744, 'bull_strategy': 'breakout', 'bull_bb_std_mult': 2.623114369513548, 'bull_rsi_os': 15, 'bull_rsi_ob': 72, 'bull_adx_thresh': 12.08256490240363, 'bull_atr_min_pct': 0.006998871354242734, 'bull_atr_max_pct': 0.12775491915953568, 'bull_tp_mult': 2.936510232330882, 'bull_tsl_mult': 0.8501835163032367, 'bull_time_stop': 132, 'bull_use_sma': False, 'bull_use_ema': True, 'bull_use_atr': True, 'bull_use_adx': True, 'bull_use_spike': False, 'bull_rsi_required': True, 'bear_strategy': 'mean_reversion', 'bear_bb_std_mult': 2.5417551007491475, 'bear_rsi_os': 28, 'bear_rsi_ob': 56, 'bear_adx_thresh': 7.2262396830996085, 'bear_atr_min_pct': 0.0019711912059531644, 'bear_atr_max_pct': 0.12630885395739877, 'bear_tp_mult': 2.0965965470678514, 'bear_tsl_mult': 0.5720814804689063, 'bear_time_stop': 89, 'bear_use_sma': True, 'bear_use_ema': True, 'bear_use_atr': False, 'bear_use_adx': False, 'bear_use_spike': True, 'bear_rsi_required': False, 'sideways_strategy': 'mean_reversion', 'sideways_bb_std_mult': 3.0605035921897747, 'sideways_rsi_os': 20, 'sideways_rsi_ob': 90, 'sideways_adx_thresh': 23.813824316546942, 'sideways_atr_min_pct': 0.004612917356837482, 'sideways_atr_max_pct': 0.11089075119482697, 'sideways_tp_mult': 1.1246485270805944, 'sideways_tsl_mult': 0.4251262783686222, 'sideways_time_stop': 267, 'sideways_use_sma': False, 'sideways_use_ema': True, 'sideways_use_atr': True, 'sideways_use_adx': False, 'sideways_use_spike': True, 'sideways_rsi_required': False}.
[I 2025-09-01 14:40:59,933] Trial 510 finished with values: [-1000000000.0, 1000000000.0] and parameters: {'p_sma': 28, 'p_std': 45, 'p_atr': 25, 'p_adx': 30, 'rsi_period': 78, 'ema1': 8, 'ema2': 56, 'slip_atr_k': 0.16159639715283997, 'slip_spread_k': 0.5795761250784872, 'spread_hl_frac': 0.010314370008992314, 'bb_std_mult': 2.9357999437673143, 'rsi_os': 51, 'rsi_ob': 80, 'vol_spike': 0.29480132049497804, 'adx_thresh': 5.01147649496292, 'atr_min_pct': 0.013088702691162668, 'atr_max_pct': 0.0330047690218014, 'tp_mult': 1.4813692714896838, 'tsl_mult': 0.6656085245114408, 'strategy': 'mean_reversion', 'time_stop': 112, 'use_sma': True, 'use_atr': False, 'use_adx': True, 'use_ema': True, 'use_spike': True, 'rsi_required': True, 'edge_k': 0.31850121369971696, 'edge_cap': 0.6720292374222571, 'bull_strategy': 'breakout', 'bull_bb_std_mult': 3.094533915426659, 'bull_rsi_os': 27, 'bull_rsi_ob': 61, 'bull_adx_thresh': 10.529498289778633, 'bull_atr_min_pct': 0.01214291146227679, 'bull_atr_max_pct': 0.12833500240680093, 'bull_tp_mult': 1.7137828707464378, 'bull_tsl_mult': 0.2809264752841808, 'bull_time_stop': 162, 'bull_use_sma': False, 'bull_use_ema': True, 'bull_use_atr': True, 'bull_use_adx': True, 'bull_use_spike': True, 'bull_rsi_required': True, 'bear_strategy': 'mean_reversion', 'bear_bb_std_mult': 2.5645330955185788, 'bear_rsi_os': 38, 'bear_rsi_ob': 82, 'bear_adx_thresh': 32.68883412375553, 'bear_atr_min_pct': 0.009849259251424953, 'bear_atr_max_pct': 0.0589105903778246, 'bear_tp_mult': 2.024518252954047, 'bear_tsl_mult': 0.3305622269068796, 'bear_time_stop': 286, 'bear_use_sma': False, 'bear_use_ema': False, 'bear_use_atr': False, 'bear_use_adx': False, 'bear_use_spike': True, 'bear_rsi_required': False, 'sideways_strategy': 'mean_reversion', 'sideways_bb_std_mult': 2.154899414008033, 'sideways_rsi_os': 31, 'sideways_rsi_ob': 89, 'sideways_adx_thresh': 31.78100809707726, 'sideways_atr_min_pct': 0.003434828951741696, 'sideways_atr_max_pct': 0.010560149718052442, 'sideways_tp_mult': 1.2745201305697582, 'sideways_tsl_mult': 0.5537327902609762, 'sideways_time_stop': 259, 'sideways_use_sma': True, 'sideways_use_ema': True, 'sideways_use_atr': False, 'sideways_use_adx': True, 'sideways_use_spike': False, 'sideways_rsi_required': False}.
[I 2025-09-01 14:41:32,819] Trial 509 finished with values: [-1000000000.0, 1000000000.0] and parameters: {'p_sma': 49, 'p_std': 11, 'p_atr': 23, 'p_adx': 30, 'rsi_period': 77, 'ema1': 10, 'ema2': 56, 'slip_atr_k': 0.0061615829313759266, 'slip_spread_k': 0.5853018281285626, 'spread_hl_frac': 0.02557028458686729, 'bb_std_mult': 3.353053468042601, 'rsi_os': 44, 'rsi_ob': 51, 'vol_spike': 0.1076429942058487, 'adx_thresh': 17.111478660353168, 'atr_min_pct': 0.012934576522310774, 'atr_max_pct': 0.09716429004176047, 'tp_mult': 1.2932006690042999, 'tsl_mult': 0.6609124542176325, 'strategy': 'mean_reversion', 'time_stop': 106, 'use_sma': True, 'use_atr': False, 'use_adx': True, 'use_ema': True, 'use_spike': True, 'rsi_required': True, 'edge_k': 0.32338149570144575, 'edge_cap': 0.6721388221837029, 'bull_strategy': 'breakout', 'bull_bb_std_mult': 3.096693476238242, 'bull_rsi_os': 11, 'bull_rsi_ob': 61, 'bull_adx_thresh': 8.970113302212843, 'bull_atr_min_pct': 0.008816660581267722, 'bull_atr_max_pct': 0.14383041559048798, 'bull_tp_mult': 1.5563596733617213, 'bull_tsl_mult': 0.5049426586548914, 'bull_time_stop': 244, 'bull_use_sma': False, 'bull_use_ema': True, 'bull_use_atr': True, 'bull_use_adx': True, 'bull_use_spike': True, 'bull_rsi_required': True, 'bear_strategy': 'mean_reversion', 'bear_bb_std_mult': 0.5599880066111853, 'bear_rsi_os': 35, 'bear_rsi_ob': 71, 'bear_adx_thresh': 6.824484282624843, 'bear_atr_min_pct': 0.02266274240436797, 'bear_atr_max_pct': 0.12603464741565343, 'bear_tp_mult': 2.0353778119502803, 'bear_tsl_mult': 0.33833088255422583, 'bear_time_stop': 89, 'bear_use_sma': False, 'bear_use_ema': False, 'bear_use_atr': False, 'bear_use_adx': False, 'bear_use_spike': True, 'bear_rsi_required': False, 'sideways_strategy': 'mean_reversion', 'sideways_bb_std_mult': 2.7032568956621534, 'sideways_rsi_os': 31, 'sideways_rsi_ob': 89, 'sideways_adx_thresh': 7.118687587067125, 'sideways_atr_min_pct': 0.003297986367978848, 'sideways_atr_max_pct': 0.042672434851660265, 'sideways_tp_mult': 1.2599277288545943, 'sideways_tsl_mult': 0.5557591840430453, 'sideways_time_stop': 268, 'sideways_use_sma': False, 'sideways_use_ema': True, 'sideways_use_atr': True, 'sideways_use_adx': True, 'sideways_use_spike': False, 'sideways_rsi_required': False}.
[I 2025-09-01 14:41:32,828] Trial 511 finished with values: [-1000000000.0, 1000000000.0] and parameters: {'p_sma': 28, 'p_std': 31, 'p_atr': 25, 'p_adx': 30, 'rsi_period': 82, 'ema1': 8, 'ema2': 57, 'slip_atr_k': 0.16447087285470757, 'slip_spread_k': 0.3908576890625156, 'spread_hl_frac': 0.012282662231880447, 'bb_std_mult': 3.4925815631454054, 'rsi_os': 19, 'rsi_ob': 51, 'vol_spike': 0.13698979089217783, 'adx_thresh': 5.547214699228228, 'atr_min_pct': 0.012919066799060137, 'atr_max_pct': 0.042263720231831836, 'tp_mult': 2.7913612469244926, 'tsl_mult': 0.6618678436312058, 'strategy': 'mean_reversion', 'time_stop': 112, 'use_sma': False, 'use_atr': False, 'use_adx': True, 'use_ema': True, 'use_spike': True, 'rsi_required': True, 'edge_k': 0.2713260201536911, 'edge_cap': 0.5844421721269716, 'bull_strategy': 'breakout', 'bull_bb_std_mult': 3.169142394836848, 'bull_rsi_os': 13, 'bull_rsi_ob': 89, 'bull_adx_thresh': 27.386782273054234, 'bull_atr_min_pct': 0.009015488643811397, 'bull_atr_max_pct': 0.14083932508310687, 'bull_tp_mult': 2.2640009588069914, 'bull_tsl_mult': 0.5036716850998302, 'bull_time_stop': 241, 'bull_use_sma': False, 'bull_use_ema': True, 'bull_use_atr': True, 'bull_use_adx': True, 'bull_use_spike': True, 'bull_rsi_required': True, 'bear_strategy': 'mean_reversion', 'bear_bb_std_mult': 2.598346072486022, 'bear_rsi_os': 38, 'bear_rsi_ob': 47, 'bear_adx_thresh': 6.424375039243679, 'bear_atr_min_pct': 0.02256635088323319, 'bear_atr_max_pct': 0.12194932523212065, 'bear_tp_mult': 1.9196836374639703, 'bear_tsl_mult': 0.3530692072925974, 'bear_time_stop': 189, 'bear_use_sma': False, 'bear_use_ema': False, 'bear_use_atr': False, 'bear_use_adx': False, 'bear_use_spike': True, 'bear_rsi_required': False, 'sideways_strategy': 'mean_reversion', 'sideways_bb_std_mult': 1.515663341231221, 'sideways_rsi_os': 31, 'sideways_rsi_ob': 93, 'sideways_adx_thresh': 14.144547271051998, 'sideways_atr_min_pct': 0.006944974497276499, 'sideways_atr_max_pct': 0.10702048725200936, 'sideways_tp_mult': 1.269759826095334, 'sideways_tsl_mult': 0.387344910094226, 'sideways_time_stop': 257, 'sideways_use_sma': True, 'sideways_use_ema': True, 'sideways_use_atr': False, 'sideways_use_adx': True, 'sideways_use_spike': False, 'sideways_rsi_required': False}.
[I 2025-09-01 14:41:33,263] Trial 508 finished with values: [-1000000000.0, 1000000000.0] and parameters: {'p_sma': 49, 'p_std': 29, 'p_atr': 9, 'p_adx': 9, 'rsi_period': 32, 'ema1': 6, 'ema2': 58, 'slip_atr_k': 0.0067813123087723855, 'slip_spread_k': 0.5805463169365819, 'spread_hl_frac': 0.016385298862704137, 'bb_std_mult': 2.9779562899782652, 'rsi_os': 43, 'rsi_ob': 51, 'vol_spike': 0.29631199156955423, 'adx_thresh': 34.970350620297374, 'atr_min_pct': 0.024834445250583974, 'atr_max_pct': 0.03377744094266373, 'tp_mult': 1.300638408453733, 'tsl_mult': 0.25908227755139535, 'strategy': 'mean_reversion', 'time_stop': 94, 'use_sma': True, 'use_atr': False, 'use_adx': True, 'use_ema': True, 'use_spike': True, 'rsi_required': False, 'edge_k': 0.12426338335056188, 'edge_cap': 0.9162705938175619, 'bull_strategy': 'breakout', 'bull_bb_std_mult': 3.1075939037599936, 'bull_rsi_os': 15, 'bull_rsi_ob': 95, 'bull_adx_thresh': 20.126485792493607, 'bull_atr_min_pct': 0.024158844080816755, 'bull_atr_max_pct': 0.1410126327202486, 'bull_tp_mult': 2.529764414662152, 'bull_tsl_mult': 0.4408504741216219, 'bull_time_stop': 294, 'bull_use_sma': True, 'bull_use_ema': True, 'bull_use_atr': True, 'bull_use_adx': True, 'bull_use_spike': False, 'bull_rsi_required': True, 'bear_strategy': 'mean_reversion', 'bear_bb_std_mult': 3.526646774831499, 'bear_rsi_os': 55, 'bear_rsi_ob': 71, 'bear_adx_thresh': 8.529138283391994, 'bear_atr_min_pct': 0.001891520294091344, 'bear_atr_max_pct': 0.11928903098702846, 'bear_tp_mult': 1.2466279917526357, 'bear_tsl_mult': 0.6623959296373856, 'bear_time_stop': 89, 'bear_use_sma': False, 'bear_use_ema': True, 'bear_use_atr': False, 'bear_use_adx': False, 'bear_use_spike': True, 'bear_rsi_required': False, 'sideways_strategy': 'mean_reversion', 'sideways_bb_std_mult': 1.429616524841451, 'sideways_rsi_os': 31, 'sideways_rsi_ob': 87, 'sideways_adx_thresh': 24.920823359674653, 'sideways_atr_min_pct': 0.006941271296720002, 'sideways_atr_max_pct': 0.10512903943809966, 'sideways_tp_mult': 2.5713453787520515, 'sideways_tsl_mult': 0.32490277235373405, 'sideways_time_stop': 143, 'sideways_use_sma': False, 'sideways_use_ema': True, 'sideways_use_atr': True, 'sideways_use_adx': True, 'sideways_use_spike': False, 'sideways_rsi_required': False}.
[I 2025-09-01 14:41:34,154] Trial 512 finished with values: [-0.053876031500661115, 0.05393091558313114] and parameters: {'p_sma': 34, 'p_std': 27, 'p_atr': 28, 'p_adx': 8, 'rsi_period': 17, 'ema1': 9, 'ema2': 57, 'slip_atr_k': 0.007218030126015, 'slip_spread_k': 0.38468778442952967, 'spread_hl_frac': 0.012117040849441551, 'bb_std_mult': 3.504104423305484, 'rsi_os': 44, 'rsi_ob': 51, 'vol_spike': 0.10685126079418654, 'adx_thresh': 5.0076235736382815, 'atr_min_pct': 0.010964549301041907, 'atr_max_pct': 0.035343171853089994, 'tp_mult': 1.648256205543747, 'tsl_mult': 0.6846216383916451, 'strategy': 'mean_reversion', 'time_stop': 103, 'use_sma': False, 'use_atr': False, 'use_adx': True, 'use_ema': True, 'use_spike': True, 'rsi_required': True, 'edge_k': 0.1384000384377892, 'edge_cap': 0.5707354742622418, 'bull_strategy': 'breakout', 'bull_bb_std_mult': 3.134096120562524, 'bull_rsi_os': 13, 'bull_rsi_ob': 77, 'bull_adx_thresh': 8.805044425878206, 'bull_atr_min_pct': 0.024156209554362762, 'bull_atr_max_pct': 0.12106406086853938, 'bull_tp_mult': 1.5490137718364718, 'bull_tsl_mult': 0.4555868575992189, 'bull_time_stop': 39, 'bull_use_sma': False, 'bull_use_ema': True, 'bull_use_atr': True, 'bull_use_adx': True, 'bull_use_spike': True, 'bull_rsi_required': True, 'bear_strategy': 'mean_reversion', 'bear_bb_std_mult': 2.423193668185439, 'bear_rsi_os': 34, 'bear_rsi_ob': 60, 'bear_adx_thresh': 26.879050768309625, 'bear_atr_min_pct': 0.0008283758928031681, 'bear_atr_max_pct': 0.11802098630370136, 'bear_tp_mult': 1.9269009166055113, 'bear_tsl_mult': 0.1442985570742449, 'bear_time_stop': 87, 'bear_use_sma': False, 'bear_use_ema': False, 'bear_use_atr': False, 'bear_use_adx': False, 'bear_use_spike': False, 'bear_rsi_required': False, 'sideways_strategy': 'mean_reversion', 'sideways_bb_std_mult': 2.3147547650639573, 'sideways_rsi_os': 33, 'sideways_rsi_ob': 53, 'sideways_adx_thresh': 18.680475220689914, 'sideways_atr_min_pct': 0.007182296156194003, 'sideways_atr_max_pct': 0.10603099477617463, 'sideways_tp_mult': 2.4799331958820043, 'sideways_tsl_mult': 0.32160406802196917, 'sideways_time_stop': 191, 'sideways_use_sma': True, 'sideways_use_ema': True, 'sideways_use_atr': True, 'sideways_use_adx': True, 'sideways_use_spike': False, 'sideways_rsi_required': False}.
