[I 2025-09-01 15:10:18,724] Trial 691 finished with values: [-1000000000.0, 1000000000.0] and parameters: {'p_sma': 27, 'p_std': 24, 'p_atr': 23, 'p_adx': 9, 'rsi_period': 83, 'ema1': 23, 'ema2': 58, 'slip_atr_k': 0.13319242403666215, 'slip_spread_k': 0.5812746823658405, 'spread_hl_frac': 0.008109129371172178, 'bb_std_mult': 3.3813038136212077, 'rsi_os': 36, 'rsi_ob': 52, 'vol_spike': 0.093761607349915, 'adx_thresh': 6.004139048839724, 'atr_min_pct': 0.010777378546151562, 'atr_max_pct': 0.08460319543354806, 'tp_mult': 2.320380852438932, 'tsl_mult': 0.818256025099974, 'strategy': 'mean_reversion', 'time_stop': 53, 'use_sma': True, 'use_atr': False, 'use_adx': True, 'use_ema': True, 'use_spike': True, 'rsi_required': False, 'edge_k': 0.15317390722747767, 'edge_cap': 0.9986173417263602, 'bull_strategy': 'breakout', 'bull_bb_std_mult': 2.965741845324901, 'bull_rsi_os': 12, 'bull_rsi_ob': 80, 'bull_adx_thresh': 12.519073984199007, 'bull_atr_min_pct': 0.006997041030076437, 'bull_atr_max_pct': 0.13068958411084164, 'bull_tp_mult': 1.5657894343247787, 'bull_tsl_mult': 0.4277991293674274, 'bull_time_stop': 165, 'bull_use_sma': False, 'bull_use_ema': True, 'bull_use_atr': True, 'bull_use_adx': True, 'bull_use_spike': True, 'bull_rsi_required': True, 'bear_strategy': 'mean_reversion', 'bear_bb_std_mult': 2.732453361758781, 'bear_rsi_os': 33, 'bear_rsi_ob': 59, 'bear_adx_thresh': 30.184213329089722, 'bear_atr_min_pct': 0.002913460895127144, 'bear_atr_max_pct': 0.1322895769724064, 'bear_tp_mult': 1.99419642650275, 'bear_tsl_mult': 0.6309554091419692, 'bear_time_stop': 300, 'bear_use_sma': False, 'bear_use_ema': True, 'bear_use_atr': False, 'bear_use_adx': False, 'bear_use_spike': True, 'bear_rsi_required': False, 'sideways_strategy': 'mean_reversion', 'sideways_bb_std_mult': 1.0065775458242168, 'sideways_rsi_os': 55, 'sideways_rsi_ob': 73, 'sideways_adx_thresh': 26.215242172009972, 'sideways_atr_min_pct': 0.0040843354315117895, 'sideways_atr_max_pct': 0.11057770144374009, 'sideways_tp_mult': 1.5103631607730112, 'sideways_tsl_mult': 0.4006968852463271, 'sideways_time_stop': 93, 'sideways_use_sma': True, 'sideways_use_ema': True, 'sideways_use_atr': False, 'sideways_use_adx': True, 'sideways_use_spike': False, 'sideways_rsi_required': False}.
[I 2025-09-01 15:10:19,221] Trial 694 finished with values: [-0.006784108388675492, 0.013742836637759562] and parameters: {'p_sma': 28, 'p_std': 24, 'p_atr': 27, 'p_adx': 8, 'rsi_period': 83, 'ema1': 9, 'ema2': 53, 'slip_atr_k': 0.03238419885427231, 'slip_spread_k': 0.5819305011029535, 'spread_hl_frac': 0.031395126512205045, 'bb_std_mult': 2.609817463948584, 'rsi_os': 22, 'rsi_ob': 54, 'vol_spike': 0.008320387451731637, 'adx_thresh': 5.011197234053996, 'atr_min_pct': 0.02251136283996113, 'atr_max_pct': 0.08387487468192434, 'tp_mult': 2.6919508650288497, 'tsl_mult': 0.5494815574845121, 'strategy': 'mean_reversion', 'time_stop': 127, 'use_sma': True, 'use_atr': False, 'use_adx': True, 'use_ema': True, 'use_spike': False, 'rsi_required': True, 'edge_k': 1.6760613669501099, 'edge_cap': 0.9870730906599746, 'bull_strategy': 'breakout', 'bull_bb_std_mult': 2.983110105542749, 'bull_rsi_os': 16, 'bull_rsi_ob': 78, 'bull_adx_thresh': 20.280517565344756, 'bull_atr_min_pct': 0.014013258450431868, 'bull_atr_max_pct': 0.1305762233514214, 'bull_tp_mult': 1.569458983321901, 'bull_tsl_mult': 0.4319241554211575, 'bull_time_stop': 167, 'bull_use_sma': False, 'bull_use_ema': True, 'bull_use_atr': False, 'bull_use_adx': True, 'bull_use_spike': True, 'bull_rsi_required': True, 'bear_strategy': 'mean_reversion', 'bear_bb_std_mult': 2.6319453196298412, 'bear_rsi_os': 36, 'bear_rsi_ob': 86, 'bear_adx_thresh': 31.06994874169999, 'bear_atr_min_pct': 0.0005737061131063752, 'bear_atr_max_pct': 0.029728725412911897, 'bear_tp_mult': 2.0095234844898195, 'bear_tsl_mult': 0.12917121563343115, 'bear_time_stop': 103, 'bear_use_sma': False, 'bear_use_ema': False, 'bear_use_atr': False, 'bear_use_adx': False, 'bear_use_spike': True, 'bear_rsi_required': False, 'sideways_strategy': 'breakout', 'sideways_bb_std_mult': 1.8995481707278359, 'sideways_rsi_os': 6, 'sideways_rsi_ob': 95, 'sideways_adx_thresh': 25.52446059206766, 'sideways_atr_min_pct': 0.004370891296112552, 'sideways_atr_max_pct': 0.10395258288196375, 'sideways_tp_mult': 2.489051949691901, 'sideways_tsl_mult': 0.47892703034324036, 'sideways_time_stop': 171, 'sideways_use_sma': True, 'sideways_use_ema': True, 'sideways_use_atr': False, 'sideways_use_adx': True, 'sideways_use_spike': True, 'sideways_rsi_required': False}.
[I 2025-09-01 15:11:02,238] Trial 697 finished with values: [-0.14371497338568695, 0.14434189863539426] and parameters: {'p_sma': 46, 'p_std': 29, 'p_atr': 27, 'p_adx': 17, 'rsi_period': 22, 'ema1': 5, 'ema2': 59, 'slip_atr_k': 0.18040711625274505, 'slip_spread_k': 0.9209472381232906, 'spread_hl_frac': 0.0109815369602511, 'bb_std_mult': 3.487030669086508, 'rsi_os': 54, 'rsi_ob': 68, 'vol_spike': 0.008556883015881867, 'adx_thresh': 5.046003612930965, 'atr_min_pct': 0.027382428229539485, 'atr_max_pct': 0.029350879682744503, 'tp_mult': 2.697548511129206, 'tsl_mult': 0.6594820663681625, 'strategy': 'breakout', 'time_stop': 163, 'use_sma': True, 'use_atr': False, 'use_adx': False, 'use_ema': False, 'use_spike': False, 'rsi_required': True, 'edge_k': 1.5587239498943102, 'edge_cap': 0.7875711819957494, 'bull_strategy': 'breakout', 'bull_bb_std_mult': 3.309329649288877, 'bull_rsi_os': 34, 'bull_rsi_ob': 56, 'bull_adx_thresh': 18.45430107673994, 'bull_atr_min_pct': 0.013615914420958872, 'bull_atr_max_pct': 0.06873594191460546, 'bull_tp_mult': 1.6965553038716583, 'bull_tsl_mult': 0.6787589336192268, 'bull_time_stop': 168, 'bull_use_sma': False, 'bull_use_ema': False, 'bull_use_atr': False, 'bull_use_adx': True, 'bull_use_spike': False, 'bull_rsi_required': False, 'bear_strategy': 'breakout', 'bear_bb_std_mult': 2.6332748662855923, 'bear_rsi_os': 36, 'bear_rsi_ob': 57, 'bear_adx_thresh': 8.068309909710514, 'bear_atr_min_pct': 0.0005257762152285615, 'bear_atr_max_pct': 0.10700418498560138, 'bear_tp_mult': 2.0437009285324854, 'bear_tsl_mult': 0.19545062462640184, 'bear_time_stop': 106, 'bear_use_sma': False, 'bear_use_ema': False, 'bear_use_atr': True, 'bear_use_adx': False, 'bear_use_spike': True, 'bear_rsi_required': True, 'sideways_strategy': 'breakout', 'sideways_bb_std_mult': 2.752008180356262, 'sideways_rsi_os': 31, 'sideways_rsi_ob': 88, 'sideways_adx_thresh': 25.33438053507877, 'sideways_atr_min_pct': 0.004477520021427463, 'sideways_atr_max_pct': 0.10537847445012165, 'sideways_tp_mult': 2.4001136967018026, 'sideways_tsl_mult': 0.5148593411103978, 'sideways_time_stop': 170, 'sideways_use_sma': True, 'sideways_use_ema': True, 'sideways_use_atr': True, 'sideways_use_adx': True, 'sideways_use_spike': True, 'sideways_rsi_required': False}.
[I 2025-09-01 15:11:02,443] Trial 695 finished with values: [-0.026692314334692324, 0.027196424890456847] and parameters: {'p_sma': 30, 'p_std': 29, 'p_atr': 27, 'p_adx': 8, 'rsi_period': 22, 'ema1': 5, 'ema2': 24, 'slip_atr_k': 0.16259109397651156, 'slip_spread_k': 0.5836313233657124, 'spread_hl_frac': 0.010958705941460744, 'bb_std_mult': 3.486661797798435, 'rsi_os': 52, 'rsi_ob': 79, 'vol_spike': 0.044998924229353976, 'adx_thresh': 6.168214168001046, 'atr_min_pct': 0.027030117171741308, 'atr_max_pct': 0.028610067249630243, 'tp_mult': 2.7070732095894208, 'tsl_mult': 0.004116004953008012, 'strategy': 'breakout', 'time_stop': 177, 'use_sma': True, 'use_atr': False, 'use_adx': False, 'use_ema': False, 'use_spike': False, 'rsi_required': True, 'edge_k': 0.7939993141544511, 'edge_cap': 0.7059761478301321, 'bull_strategy': 'breakout', 'bull_bb_std_mult': 3.29623422390954, 'bull_rsi_os': 11, 'bull_rsi_ob': 56, 'bull_adx_thresh': 12.579390396557136, 'bull_atr_min_pct': 0.013855893530788463, 'bull_atr_max_pct': 0.022253098731604887, 'bull_tp_mult': 1.1675983212511587, 'bull_tsl_mult': 0.6254458804860084, 'bull_time_stop': 163, 'bull_use_sma': False, 'bull_use_ema': False, 'bull_use_atr': False, 'bull_use_adx': True, 'bull_use_spike': False, 'bull_rsi_required': False, 'bear_strategy': 'breakout', 'bear_bb_std_mult': 2.632850618054943, 'bear_rsi_os': 36, 'bear_rsi_ob': 57, 'bear_adx_thresh': 24.827494161108596, 'bear_atr_min_pct': 0.004387335650004623, 'bear_atr_max_pct': 0.07788371605936276, 'bear_tp_mult': 1.987158311275497, 'bear_tsl_mult': 0.13149640962110315, 'bear_time_stop': 100, 'bear_use_sma': False, 'bear_use_ema': False, 'bear_use_atr': True, 'bear_use_adx': False, 'bear_use_spike': True, 'bear_rsi_required': False, 'sideways_strategy': 'breakout', 'sideways_bb_std_mult': 2.9991695514922223, 'sideways_rsi_os': 31, 'sideways_rsi_ob': 84, 'sideways_adx_thresh': 25.171796981847088, 'sideways_atr_min_pct': 0.004329862504699635, 'sideways_atr_max_pct': 0.10376273424617148, 'sideways_tp_mult': 2.5031754763367466, 'sideways_tsl_mult': 0.22367882615035717, 'sideways_time_stop': 178, 'sideways_use_sma': True, 'sideways_use_ema': True, 'sideways_use_atr': True, 'sideways_use_adx': True, 'sideways_use_spike': True, 'sideways_rsi_required': False}.
[I 2025-09-01 15:11:02,670] Trial 698 finished with values: [-1000000000.0, 1000000000.0] and parameters: {'p_sma': 31, 'p_std': 29, 'p_atr': 27, 'p_adx': 17, 'rsi_period': 41, 'ema1': 8, 'ema2': 56, 'slip_atr_k': 0.018770982748503848, 'slip_spread_k': 0.5310384038540409, 'spread_hl_frac': 0.01085924403280758, 'bb_std_mult': 3.4887346880266272, 'rsi_os': 54, 'rsi_ob': 53, 'vol_spike': 0.12302837721576934, 'adx_thresh': 31.20671194985549, 'atr_min_pct': 0.013724277797575547, 'atr_max_pct': 0.029063390863105616, 'tp_mult': 1.7717525319114236, 'tsl_mult': 0.6620979940469641, 'strategy': 'breakout', 'time_stop': 113, 'use_sma': False, 'use_atr': True, 'use_adx': False, 'use_ema': False, 'use_spike': False, 'rsi_required': True, 'edge_k': 0.32459232992518255, 'edge_cap': 0.4354464135592161, 'bull_strategy': 'breakout', 'bull_bb_std_mult': 3.3362018208048014, 'bull_rsi_os': 13, 'bull_rsi_ob': 61, 'bull_adx_thresh': 9.732928484860238, 'bull_atr_min_pct': 0.011336638285816068, 'bull_atr_max_pct': 0.12618337814619413, 'bull_tp_mult': 1.3575674339206438, 'bull_tsl_mult': 0.5468165058732513, 'bull_time_stop': 148, 'bull_use_sma': False, 'bull_use_ema': False, 'bull_use_atr': False, 'bull_use_adx': True, 'bull_use_spike': False, 'bull_rsi_required': False, 'bear_strategy': 'breakout', 'bear_bb_std_mult': 2.842357871535503, 'bear_rsi_os': 35, 'bear_rsi_ob': 57, 'bear_adx_thresh': 22.079673764477256, 'bear_atr_min_pct': 0.004375930136594876, 'bear_atr_max_pct': 0.10624422774551728, 'bear_tp_mult': 2.0519483133981677, 'bear_tsl_mult': 0.00019137450754752594, 'bear_time_stop': 217, 'bear_use_sma': True, 'bear_use_ema': False, 'bear_use_atr': True, 'bear_use_adx': True, 'bear_use_spike': True, 'bear_rsi_required': True, 'sideways_strategy': 'breakout', 'sideways_bb_std_mult': 1.4786107133601851, 'sideways_rsi_os': 31, 'sideways_rsi_ob': 88, 'sideways_adx_thresh': 25.15509062976927, 'sideways_atr_min_pct': 0.016328944600330693, 'sideways_atr_max_pct': 0.09525502145665635, 'sideways_tp_mult': 2.2760006732248583, 'sideways_tsl_mult': 0.5200760313797671, 'sideways_time_stop': 260, 'sideways_use_sma': False, 'sideways_use_ema': True, 'sideways_use_atr': True, 'sideways_use_adx': True, 'sideways_use_spike': True, 'sideways_rsi_required': False}.
[I 2025-09-01 15:11:02,906] Trial 696 finished with values: [-1000000000.0, 1000000000.0] and parameters: {'p_sma': 46, 'p_std': 29, 'p_atr': 27, 'p_adx': 8, 'rsi_period': 69, 'ema1': 8, 'ema2': 57, 'slip_atr_k': 0.020061092365769036, 'slip_spread_k': 0.48398042747544034, 'spread_hl_frac': 0.011009164248514353, 'bb_std_mult': 1.7271103146276823, 'rsi_os': 45, 'rsi_ob': 72, 'vol_spike': 0.12493360163166241, 'adx_thresh': 5.052349718805887, 'atr_min_pct': 0.027093060151868277, 'atr_max_pct': 0.02911121587983302, 'tp_mult': 1.9054968179488505, 'tsl_mult': 0.2154898909211138, 'strategy': 'breakout', 'time_stop': 216, 'use_sma': True, 'use_atr': False, 'use_adx': False, 'use_ema': False, 'use_spike': False, 'rsi_required': True, 'edge_k': 0.32864495339649885, 'edge_cap': 0.7604344906028703, 'bull_strategy': 'breakout', 'bull_bb_std_mult': 3.3208964141299018, 'bull_rsi_os': 6, 'bull_rsi_ob': 56, 'bull_adx_thresh': 23.335318253254023, 'bull_atr_min_pct': 0.02981626129532138, 'bull_atr_max_pct': 0.0712307743173224, 'bull_tp_mult': 1.6073174741687544, 'bull_tsl_mult': 0.476114666605327, 'bull_time_stop': 167, 'bull_use_sma': False, 'bull_use_ema': False, 'bull_use_atr': False, 'bull_use_adx': True, 'bull_use_spike': False, 'bull_rsi_required': False, 'bear_strategy': 'breakout', 'bear_bb_std_mult': 2.4583856159382824, 'bear_rsi_os': 54, 'bear_rsi_ob': 94, 'bear_adx_thresh': 16.65809362190788, 'bear_atr_min_pct': 0.0005380129361501743, 'bear_atr_max_pct': 0.10616247465105283, 'bear_tp_mult': 1.993368110605227, 'bear_tsl_mult': 0.19880960191664937, 'bear_time_stop': 100, 'bear_use_sma': False, 'bear_use_ema': False, 'bear_use_atr': True, 'bear_use_adx': False, 'bear_use_spike': True, 'bear_rsi_required': False, 'sideways_strategy': 'breakout', 'sideways_bb_std_mult': 2.0853149112901064, 'sideways_rsi_os': 55, 'sideways_rsi_ob': 88, 'sideways_adx_thresh': 25.29908017035267, 'sideways_atr_min_pct': 0.016407489299898777, 'sideways_atr_max_pct': 0.095290290159101, 'sideways_tp_mult': 2.3952178685004952, 'sideways_tsl_mult': 0.5190148395376085, 'sideways_time_stop': 260, 'sideways_use_sma': True, 'sideways_use_ema': True, 'sideways_use_atr': True, 'sideways_use_adx': True, 'sideways_use_spike': True, 'sideways_rsi_required': False}.
[I 2025-09-01 15:11:04,011] Trial 702 finished with values: [-1000000000.0, 1000000000.0] and parameters: {'p_sma': 32, 'p_std': 15, 'p_atr': 25, 'p_adx': 14, 'rsi_period': 79, 'ema1': 9, 'ema2': 55, 'slip_atr_k': 0.0075634765156532635, 'slip_spread_k': 0.3694240893516826, 'spread_hl_frac': 0.006582260376742158, 'bb_std_mult': 3.3534316617013054, 'rsi_os': 44, 'rsi_ob': 50, 'vol_spike': 0.18183365681353897, 'adx_thresh': 10.545962722165903, 'atr_min_pct': 0.012249488818550354, 'atr_max_pct': 0.032942522689279045, 'tp_mult': 2.9916756579045845, 'tsl_mult': 0.14681539799493043, 'strategy': 'mean_reversion', 'time_stop': 90, 'use_sma': False, 'use_atr': True, 'use_adx': True, 'use_ema': True, 'use_spike': True, 'rsi_required': True, 'edge_k': 0.22848700076757342, 'edge_cap': 0.940609903866993, 'bull_strategy': 'mean_reversion', 'bull_bb_std_mult': 0.8173635698634165, 'bull_rsi_os': 14, 'bull_rsi_ob': 79, 'bull_adx_thresh': 13.71883402708601, 'bull_atr_min_pct': 0.012363331579858656, 'bull_atr_max_pct': 0.1342536938179601, 'bull_tp_mult': 1.6730018022035025, 'bull_tsl_mult': 0.354403903681198, 'bull_time_stop': 57, 'bull_use_sma': True, 'bull_use_ema': True, 'bull_use_atr': True, 'bull_use_adx': False, 'bull_use_spike': True, 'bull_rsi_required': True, 'bear_strategy': 'mean_reversion', 'bear_bb_std_mult': 2.405908708131131, 'bear_rsi_os': 35, 'bear_rsi_ob': 46, 'bear_adx_thresh': 28.206504854656497, 'bear_atr_min_pct': 0.025731591991204058, 'bear_atr_max_pct': 0.09973712525266903, 'bear_tp_mult': 2.0808873794411595, 'bear_tsl_mult': 0.07150116651097776, 'bear_time_stop': 161, 'bear_use_sma': True, 'bear_use_ema': False, 'bear_use_atr': False, 'bear_use_adx': False, 'bear_use_spike': True, 'bear_rsi_required': False, 'sideways_strategy': 'mean_reversion', 'sideways_bb_std_mult': 2.3718706846452617, 'sideways_rsi_os': 29, 'sideways_rsi_ob': 90, 'sideways_adx_thresh': 24.456064271010625, 'sideways_atr_min_pct': 0.003425920014635081, 'sideways_atr_max_pct': 0.1144738886740302, 'sideways_tp_mult': 2.6204785763751004, 'sideways_tsl_mult': 0.7939508888733188, 'sideways_time_stop': 282, 'sideways_use_sma': True, 'sideways_use_ema': False, 'sideways_use_atr': True, 'sideways_use_adx': False, 'sideways_use_spike': False, 'sideways_rsi_required': True}.
[I 2025-09-01 15:11:04,733] Trial 703 finished with values: [-1000000000.0, 1000000000.0] and parameters: {'p_sma': 29, 'p_std': 33, 'p_atr': 17, 'p_adx': 8, 'rsi_period': 79, 'ema1': 11, 'ema2': 57, 'slip_atr_k': 0.0008338473285353799, 'slip_spread_k': 0.4446120353287828, 'spread_hl_frac': 0.026881574774427104, 'bb_std_mult': 3.4891707995683277, 'rsi_os': 8, 'rsi_ob': 45, 'vol_spike': 0.2717909657489272, 'adx_thresh': 6.674033600752835, 'atr_min_pct': 0.009331181945305446, 'atr_max_pct': 0.09025874318373915, 'tp_mult': 1.3085132827994135, 'tsl_mult': 0.7267709446940893, 'strategy': 'mean_reversion', 'time_stop': 107, 'use_sma': True, 'use_atr': False, 'use_adx': True, 'use_ema': True, 'use_spike': True, 'rsi_required': False, 'edge_k': 0.5704834162201748, 'edge_cap': 0.06940415538425726, 'bull_strategy': 'breakout', 'bull_bb_std_mult': 3.2262094663099528, 'bull_rsi_os': 30, 'bull_rsi_ob': 90, 'bull_adx_thresh': 17.69342761095729, 'bull_atr_min_pct': 0.011620517881932019, 'bull_atr_max_pct': 0.12144766102319773, 'bull_tp_mult': 1.081567636773552, 'bull_tsl_mult': 0.46208684833191016, 'bull_time_stop': 255, 'bull_use_sma': True, 'bull_use_ema': True, 'bull_use_atr': True, 'bull_use_adx': True, 'bull_use_spike': True, 'bull_rsi_required': True, 'bear_strategy': 'mean_reversion', 'bear_bb_std_mult': 3.2058883991483906, 'bear_rsi_os': 32, 'bear_rsi_ob': 73, 'bear_adx_thresh': 9.283884640163967, 'bear_atr_min_pct': 0.0013156540036460913, 'bear_atr_max_pct': 0.12518145059277683, 'bear_tp_mult': 2.46500239284992, 'bear_tsl_mult': 0.7376816584279479, 'bear_time_stop': 92, 'bear_use_sma': False, 'bear_use_ema': False, 'bear_use_atr': False, 'bear_use_adx': True, 'bear_use_spike': False, 'bear_rsi_required': False, 'sideways_strategy': 'mean_reversion', 'sideways_bb_std_mult': 3.0643750691824483, 'sideways_rsi_os': 33, 'sideways_rsi_ob': 91, 'sideways_adx_thresh': 24.140168295595092, 'sideways_atr_min_pct': 0.006099114921801278, 'sideways_atr_max_pct': 0.10813872367128217, 'sideways_tp_mult': 1.6212540833830462, 'sideways_tsl_mult': 0.37502655553787384, 'sideways_time_stop': 242, 'sideways_use_sma': False, 'sideways_use_ema': False, 'sideways_use_atr': True, 'sideways_use_adx': False, 'sideways_use_spike': False, 'sideways_rsi_required': False}.
[I 2025-09-01 15:11:38,172] Trial 700 finished with values: [-0.07426124901294973, 0.0741577026449222] and parameters: {'p_sma': 32, 'p_std': 27, 'p_atr': 17, 'p_adx': 24, 'rsi_period': 70, 'ema1': 14, 'ema2': 45, 'slip_atr_k': 0.00023345374351058622, 'slip_spread_k': 0.5394687200688119, 'spread_hl_frac': 0.01456990355560228, 'bb_std_mult': 2.2722295483748276, 'rsi_os': 8, 'rsi_ob': 53, 'vol_spike': 0.123852991825872, 'adx_thresh': 34.604646404743164, 'atr_min_pct': 0.01390842012441324, 'atr_max_pct': 0.03325739020382939, 'tp_mult': 1.153936532320332, 'tsl_mult': 0.1153258744346366, 'strategy': 'mean_reversion', 'time_stop': 112, 'use_sma': False, 'use_atr': True, 'use_adx': True, 'use_ema': True, 'use_spike': True, 'rsi_required': True, 'edge_k': 0.3397133315794494, 'edge_cap': 0.9285610135021913, 'bull_strategy': 'breakout', 'bull_bb_std_mult': 3.2430988522067863, 'bull_rsi_os': 6, 'bull_rsi_ob': 79, 'bull_adx_thresh': 29.743700079701934, 'bull_atr_min_pct': 0.02872145888455528, 'bull_atr_max_pct': 0.14722587406213614, 'bull_tp_mult': 1.8608778461149853, 'bull_tsl_mult': 0.470397662079293, 'bull_time_stop': 151, 'bull_use_sma': True, 'bull_use_ema': True, 'bull_use_atr': True, 'bull_use_adx': True, 'bull_use_spike': True, 'bull_rsi_required': True, 'bear_strategy': 'mean_reversion', 'bear_bb_std_mult': 2.8477252431899993, 'bear_rsi_os': 54, 'bear_rsi_ob': 47, 'bear_adx_thresh': 21.835842463962607, 'bear_atr_min_pct': 0.0012691925546618448, 'bear_atr_max_pct': 0.10847896142983937, 'bear_tp_mult': 2.3072017562950595, 'bear_tsl_mult': 0.2757228752314831, 'bear_time_stop': 68, 'bear_use_sma': True, 'bear_use_ema': False, 'bear_use_atr': False, 'bear_use_adx': True, 'bear_use_spike': True, 'bear_rsi_required': False, 'sideways_strategy': 'mean_reversion', 'sideways_bb_std_mult': 3.052586392974238, 'sideways_rsi_os': 33, 'sideways_rsi_ob': 89, 'sideways_adx_thresh': 14.789545680371873, 'sideways_atr_min_pct': 0.017323400843606458, 'sideways_atr_max_pct': 0.11438090268514642, 'sideways_tp_mult': 1.6297537614146769, 'sideways_tsl_mult': 0.2990764095722015, 'sideways_time_stop': 258, 'sideways_use_sma': False, 'sideways_use_ema': False, 'sideways_use_atr': True, 'sideways_use_adx': False, 'sideways_use_spike': False, 'sideways_rsi_required': True}.
