[I 2025-09-01 13:32:00,521] Trial 29 finished with values: [-1000000000.0, 1000000000.0] and parameters: {'p_sma': 32, 'p_std': 12, 'p_atr': 9, 'p_adx': 30, 'rsi_period': 38, 'ema1': 12, 'ema2': 24, 'slip_atr_k': 0.03371609150426714, 'slip_spread_k': 0.21579494489096418, 'spread_hl_frac': 0.023633825808881362, 'bb_std_mult': 2.649330458364268, 'rsi_os': 42, 'rsi_ob': 81, 'vol_spike': 0.07593833420646437, 'adx_thresh': 20.92535228793601, 'atr_min_pct': 0.018174258775667085, 'atr_max_pct': 0.03488238438753462, 'tp_mult': 2.628975645077026, 'tsl_mult': 0.17806922229538708, 'strategy': 'breakout', 'time_stop': 59, 'use_sma': False, 'use_atr': True, 'use_adx': False, 'use_ema': False, 'use_spike': True, 'rsi_required': False, 'edge_k': 1.367534122306823, 'edge_cap': 0.17386386547327956, 'bull_strategy': 'breakout', 'bull_bb_std_mult': 2.5550613401909414, 'bull_rsi_os': 25, 'bull_rsi_ob': 95, 'bull_adx_thresh': 22.520210031666206, 'bull_atr_min_pct': 0.011653197965818459, 'bull_atr_max_pct': 0.10288433662820969, 'bull_tp_mult': 2.3784681970041364, 'bull_tsl_mult': 0.35922024000822106, 'bull_time_stop': 151, 'bull_use_sma': True, 'bull_use_ema': True, 'bull_use_atr': True, 'bull_use_adx': True, 'bull_use_spike': True, 'bull_rsi_required': False, 'bear_strategy': 'mean_reversion', 'bear_bb_std_mult': 3.581326368201702, 'bear_rsi_os': 21, 'bear_rsi_ob': 56, 'bear_adx_thresh': 8.390020559960625, 'bear_atr_min_pct': 0.013156392059755086, 'bear_atr_max_pct': 0.06135074806246505, 'bear_tp_mult': 2.148678098656747, 'bear_tsl_mult': 0.38745974432234465, 'bear_time_stop': 89, 'bear_use_sma': False, 'bear_use_ema': True, 'bear_use_atr': True, 'bear_use_adx': True, 'bear_use_spike': False, 'bear_rsi_required': True, 'sideways_strategy': 'breakout', 'sideways_bb_std_mult': 2.339536249862718, 'sideways_rsi_os': 33, 'sideways_rsi_ob': 78, 'sideways_adx_thresh': 33.50712617766382, 'sideways_atr_min_pct': 0.013563932756759309, 'sideways_atr_max_pct': 0.09952586233505421, 'sideways_tp_mult': 2.4675154146203315, 'sideways_tsl_mult': 0.8996535968946022, 'sideways_time_stop': 249, 'sideways_use_sma': False, 'sideways_use_ema': True, 'sideways_use_atr': True, 'sideways_use_adx': False, 'sideways_use_spike': False, 'sideways_rsi_required': False}.
[I 2025-09-01 13:32:01,222] Trial 30 finished with values: [-1000000000.0, 1000000000.0] and parameters: {'p_sma': 47, 'p_std': 12, 'p_atr': 10, 'p_adx': 30, 'rsi_period': 39, 'ema1': 12, 'ema2': 24, 'slip_atr_k': 0.05119791335327433, 'slip_spread_k': 0.6217688494926162, 'spread_hl_frac': 0.014026879693967126, 'bb_std_mult': 2.4384830240639332, 'rsi_os': 49, 'rsi_ob': 72, 'vol_spike': 0.07935765276036558, 'adx_thresh': 14.23710792204456, 'atr_min_pct': 0.023509480479732208, 'atr_max_pct': 0.03292773740929157, 'tp_mult': 2.6418001561745914, 'tsl_mult': 0.16360745981380004, 'strategy': 'breakout', 'time_stop': 51, 'use_sma': False, 'use_atr': True, 'use_adx': False, 'use_ema': False, 'use_spike': True, 'rsi_required': False, 'edge_k': 1.4062713051566076, 'edge_cap': 0.31574883042737206, 'bull_strategy': 'breakout', 'bull_bb_std_mult': 2.432169187294752, 'bull_rsi_os': 5, 'bull_rsi_ob': 63, 'bull_adx_thresh': 22.423534932657997, 'bull_atr_min_pct': 0.011520264160091009, 'bull_atr_max_pct': 0.13710856614003009, 'bull_tp_mult': 2.265373011205254, 'bull_tsl_mult': 0.371140013676734, 'bull_time_stop': 33, 'bull_use_sma': True, 'bull_use_ema': True, 'bull_use_atr': True, 'bull_use_adx': True, 'bull_use_spike': True, 'bull_rsi_required': False, 'bear_strategy': 'mean_reversion', 'bear_bb_std_mult': 3.2223363040775594, 'bear_rsi_os': 22, 'bear_rsi_ob': 46, 'bear_adx_thresh': 7.906295341417118, 'bear_atr_min_pct': 0.012862481778256819, 'bear_atr_max_pct': 0.05345743339918098, 'bear_tp_mult': 2.197853469332301, 'bear_tsl_mult': 0.3463443299618765, 'bear_time_stop': 40, 'bear_use_sma': False, 'bear_use_ema': True, 'bear_use_atr': True, 'bear_use_adx': True, 'bear_use_spike': False, 'bear_rsi_required': True, 'sideways_strategy': 'breakout', 'sideways_bb_std_mult': 2.418372118398454, 'sideways_rsi_os': 33, 'sideways_rsi_ob': 89, 'sideways_adx_thresh': 34.69126689673702, 'sideways_atr_min_pct': 0.01276985094862502, 'sideways_atr_max_pct': 0.09738088470552975, 'sideways_tp_mult': 2.4459302093158986, 'sideways_tsl_mult': 0.8847919392108472, 'sideways_time_stop': 247, 'sideways_use_sma': False, 'sideways_use_ema': True, 'sideways_use_atr': True, 'sideways_use_adx': False, 'sideways_use_spike': False, 'sideways_rsi_required': False}.
[I 2025-09-01 13:32:01,721] Trial 28 finished with values: [-1000000000.0, 1000000000.0] and parameters: {'p_sma': 33, 'p_std': 11, 'p_atr': 10, 'p_adx': 30, 'rsi_period': 38, 'ema1': 12, 'ema2': 23, 'slip_atr_k': 0.03797239726806867, 'slip_spread_k': 0.2423901390532382, 'spread_hl_frac': 0.013564228739362135, 'bb_std_mult': 2.506490910013015, 'rsi_os': 41, 'rsi_ob': 71, 'vol_spike': 0.07502039742881432, 'adx_thresh': 20.93209897242566, 'atr_min_pct': 0.023705368477021857, 'atr_max_pct': 0.032537441144632716, 'tp_mult': 2.630624618010722, 'tsl_mult': 0.13751654270782293, 'strategy': 'breakout', 'time_stop': 50, 'use_sma': False, 'use_atr': True, 'use_adx': False, 'use_ema': False, 'use_spike': True, 'rsi_required': False, 'edge_k': 0.6670105749759416, 'edge_cap': 0.1580337151542559, 'bull_strategy': 'breakout', 'bull_bb_std_mult': 2.694015979039847, 'bull_rsi_os': 25, 'bull_rsi_ob': 73, 'bull_adx_thresh': 22.03682396244099, 'bull_atr_min_pct': 0.01209966682253565, 'bull_atr_max_pct': 0.10063524260676142, 'bull_tp_mult': 2.400270395129417, 'bull_tsl_mult': 0.3645716534284049, 'bull_time_stop': 30, 'bull_use_sma': True, 'bull_use_ema': True, 'bull_use_atr': True, 'bull_use_adx': True, 'bull_use_spike': True, 'bull_rsi_required': False, 'bear_strategy': 'mean_reversion', 'bear_bb_std_mult': 3.0828576382331736, 'bear_rsi_os': 22, 'bear_rsi_ob': 56, 'bear_adx_thresh': 8.253814746021293, 'bear_atr_min_pct': 0.012854569464810894, 'bear_atr_max_pct': 0.0664691156990974, 'bear_tp_mult': 2.206943582575408, 'bear_tsl_mult': 0.3340309643755729, 'bear_time_stop': 34, 'bear_use_sma': False, 'bear_use_ema': True, 'bear_use_atr': True, 'bear_use_adx': True, 'bear_use_spike': False, 'bear_rsi_required': True, 'sideways_strategy': 'breakout', 'sideways_bb_std_mult': 2.38420636876633, 'sideways_rsi_os': 46, 'sideways_rsi_ob': 79, 'sideways_adx_thresh': 33.64763302648553, 'sideways_atr_min_pct': 0.012887832784859991, 'sideways_atr_max_pct': 0.09505942917474616, 'sideways_tp_mult': 2.43448586610729, 'sideways_tsl_mult': 0.9042279560848654, 'sideways_time_stop': 247, 'sideways_use_sma': False, 'sideways_use_ema': True, 'sideways_use_atr': True, 'sideways_use_adx': False, 'sideways_use_spike': False, 'sideways_rsi_required': False}.
[I 2025-09-01 13:32:01,997] Trial 27 finished with values: [-1000000000.0, 1000000000.0] and parameters: {'p_sma': 33, 'p_std': 6, 'p_atr': 10, 'p_adx': 30, 'rsi_period': 40, 'ema1': 12, 'ema2': 25, 'slip_atr_k': 0.03496068508901475, 'slip_spread_k': 0.20602840291633057, 'spread_hl_frac': 0.023159633259592353, 'bb_std_mult': 2.4963045622444207, 'rsi_os': 41, 'rsi_ob': 72, 'vol_spike': 0.07433019543268021, 'adx_thresh': 21.1109941995506, 'atr_min_pct': 0.023387449152416338, 'atr_max_pct': 0.03076194262590877, 'tp_mult': 2.2431954258951237, 'tsl_mult': 0.15719875965906377, 'strategy': 'breakout', 'time_stop': 120, 'use_sma': False, 'use_atr': True, 'use_adx': False, 'use_ema': False, 'use_spike': True, 'rsi_required': False, 'edge_k': 0.709753962215991, 'edge_cap': 0.14778872371430551, 'bull_strategy': 'breakout', 'bull_bb_std_mult': 2.4598170186165307, 'bull_rsi_os': 26, 'bull_rsi_ob': 63, 'bull_adx_thresh': 23.375489876786844, 'bull_atr_min_pct': 0.01169346907371064, 'bull_atr_max_pct': 0.13675773850367245, 'bull_tp_mult': 2.3220450252776352, 'bull_tsl_mult': 0.38834683423386757, 'bull_time_stop': 172, 'bull_use_sma': True, 'bull_use_ema': True, 'bull_use_atr': True, 'bull_use_adx': True, 'bull_use_spike': True, 'bull_rsi_required': False, 'bear_strategy': 'mean_reversion', 'bear_bb_std_mult': 3.5790407674038356, 'bear_rsi_os': 23, 'bear_rsi_ob': 56, 'bear_adx_thresh': 8.467318305089773, 'bear_atr_min_pct': 0.013003649546142457, 'bear_atr_max_pct': 0.06064560052369949, 'bear_tp_mult': 2.1662787575860674, 'bear_tsl_mult': 0.34355018273716065, 'bear_time_stop': 38, 'bear_use_sma': False, 'bear_use_ema': True, 'bear_use_atr': True, 'bear_use_adx': True, 'bear_use_spike': False, 'bear_rsi_required': True, 'sideways_strategy': 'breakout', 'sideways_bb_std_mult': 2.4072065698303056, 'sideways_rsi_os': 46, 'sideways_rsi_ob': 78, 'sideways_adx_thresh': 33.953762809648175, 'sideways_atr_min_pct': 0.013793554735760922, 'sideways_atr_max_pct': 0.09746097010149347, 'sideways_tp_mult': 2.5079837780978123, 'sideways_tsl_mult': 0.8807582096054443, 'sideways_time_stop': 299, 'sideways_use_sma': False, 'sideways_use_ema': True, 'sideways_use_atr': True, 'sideways_use_adx': False, 'sideways_use_spike': False, 'sideways_rsi_required': False}.
[I 2025-09-01 13:32:42,595] Trial 34 finished with values: [-1000000000.0, 1000000000.0] and parameters: {'p_sma': 22, 'p_std': 25, 'p_atr': 7, 'p_adx': 25, 'rsi_period': 17, 'ema1': 7, 'ema2': 34, 'slip_atr_k': 0.016934403083844616, 'slip_spread_k': 0.46902202708775975, 'spread_hl_frac': 0.0338353649096302, 'bb_std_mult': 1.6251346774246358, 'rsi_os': 48, 'rsi_ob': 81, 'vol_spike': 0.2300202274460257, 'adx_thresh': 24.482809122249034, 'atr_min_pct': 0.012955708090529332, 'atr_max_pct': 0.12115197212212092, 'tp_mult': 1.903702682497428, 'tsl_mult': 0.28172810741778853, 'strategy': 'breakout', 'time_stop': 223, 'use_sma': True, 'use_atr': True, 'use_adx': False, 'use_ema': False, 'use_spike': False, 'rsi_required': False, 'edge_k': 1.0801530117997347, 'edge_cap': 0.3288725039124054, 'bull_strategy': 'breakout', 'bull_bb_std_mult': 1.0578941737607142, 'bull_rsi_os': 33, 'bull_rsi_ob': 86, 'bull_adx_thresh': 8.172338755766825, 'bull_atr_min_pct': 0.01956269200123793, 'bull_atr_max_pct': 0.1318097678489444, 'bull_tp_mult': 1.6036646592790778, 'bull_tsl_mult': 0.7632303832728649, 'bull_time_stop': 76, 'bull_use_sma': False, 'bull_use_ema': True, 'bull_use_atr': False, 'bull_use_adx': True, 'bull_use_spike': False, 'bull_rsi_required': False, 'bear_strategy': 'breakout', 'bear_bb_std_mult': 2.8752503216272816, 'bear_rsi_os': 45, 'bear_rsi_ob': 67, 'bear_adx_thresh': 11.181265082110487, 'bear_atr_min_pct': 0.007590116854810269, 'bear_atr_max_pct': 0.0907266227461071, 'bear_tp_mult': 1.4707904083678367, 'bear_tsl_mult': 0.09902410232544478, 'bear_time_stop': 298, 'bear_use_sma': False, 'bear_use_ema': True, 'bear_use_atr': False, 'bear_use_adx': False, 'bear_use_spike': False, 'bear_rsi_required': True, 'sideways_strategy': 'breakout', 'sideways_bb_std_mult': 1.0741708712210403, 'sideways_rsi_os': 23, 'sideways_rsi_ob': 85, 'sideways_adx_thresh': 27.45989386541395, 'sideways_atr_min_pct': 0.017831936263488085, 'sideways_atr_max_pct': 0.1131463942886163, 'sideways_tp_mult': 2.2296107251031563, 'sideways_tsl_mult': 0.6703104371598734, 'sideways_time_stop': 276, 'sideways_use_sma': False, 'sideways_use_ema': True, 'sideways_use_atr': True, 'sideways_use_adx': False, 'sideways_use_spike': False, 'sideways_rsi_required': False}.
[I 2025-09-01 13:32:43,586] Trial 33 finished with values: [-1000000000.0, 1000000000.0] and parameters: {'p_sma': 22, 'p_std': 34, 'p_atr': 8, 'p_adx': 17, 'rsi_period': 16, 'ema1': 16, 'ema2': 33, 'slip_atr_k': 0.09822007835107392, 'slip_spread_k': 0.8078132613288793, 'spread_hl_frac': 0.023008898400898366, 'bb_std_mult': 0.9359992525876422, 'rsi_os': 50, 'rsi_ob': 80, 'vol_spike': 0.24243141959289638, 'adx_thresh': 16.7537963144723, 'atr_min_pct': 0.013353630288712358, 'atr_max_pct': 0.11830306380311412, 'tp_mult': 2.250797772516669, 'tsl_mult': 0.27554805787010833, 'strategy': 'breakout', 'time_stop': 217, 'use_sma': True, 'use_atr': False, 'use_adx': False, 'use_ema': False, 'use_spike': False, 'rsi_required': False, 'edge_k': 1.1076715363760437, 'edge_cap': 0.3406094303797921, 'bull_strategy': 'breakout', 'bull_bb_std_mult': 1.7677566312882713, 'bull_rsi_os': 35, 'bull_rsi_ob': 64, 'bull_adx_thresh': 8.00363281201642, 'bull_atr_min_pct': 0.019118114470940965, 'bull_atr_max_pct': 0.13753766845550155, 'bull_tp_mult': 1.9979497697746549, 'bull_tsl_mult': 0.7321122340385009, 'bull_time_stop': 295, 'bull_use_sma': False, 'bull_use_ema': True, 'bull_use_atr': False, 'bull_use_adx': True, 'bull_use_spike': False, 'bull_rsi_required': False, 'bear_strategy': 'breakout', 'bear_bb_std_mult': 2.2097934833846598, 'bear_rsi_os': 29, 'bear_rsi_ob': 67, 'bear_adx_thresh': 11.519129964015228, 'bear_atr_min_pct': 0.007635657897735976, 'bear_atr_max_pct': 0.09640774221927198, 'bear_tp_mult': 1.4853621916264768, 'bear_tsl_mult': 0.10030002949306875, 'bear_time_stop': 89, 'bear_use_sma': False, 'bear_use_ema': True, 'bear_use_atr': False, 'bear_use_adx': False, 'bear_use_spike': False, 'bear_rsi_required': True, 'sideways_strategy': 'mean_reversion', 'sideways_bb_std_mult': 1.0705568208576617, 'sideways_rsi_os': 25, 'sideways_rsi_ob': 83, 'sideways_adx_thresh': 11.78364990928036, 'sideways_atr_min_pct': 0.005564342365368463, 'sideways_atr_max_pct': 0.11090340866782808, 'sideways_tp_mult': 2.1665821595562536, 'sideways_tsl_mult': 0.6824016968873616, 'sideways_time_stop': 284, 'sideways_use_sma': False, 'sideways_use_ema': True, 'sideways_use_atr': True, 'sideways_use_adx': False, 'sideways_use_spike': False, 'sideways_rsi_required': False}.
[I 2025-09-01 13:32:43,902] Trial 31 finished with values: [-1000000000.0, 1000000000.0] and parameters: {'p_sma': 47, 'p_std': 25, 'p_atr': 11, 'p_adx': 21, 'rsi_period': 46, 'ema1': 17, 'ema2': 24, 'slip_atr_k': 0.059566600269946764, 'slip_spread_k': 0.6139269759781327, 'spread_hl_frac': 0.014593015293379433, 'bb_std_mult': 0.9885325713623727, 'rsi_os': 32, 'rsi_ob': 72, 'vol_spike': 0.27216930045507737, 'adx_thresh': 15.553520555644285, 'atr_min_pct': 0.023410875033142854, 'atr_max_pct': 0.02797407416724604, 'tp_mult': 2.2137428767845124, 'tsl_mult': 0.2701661269836319, 'strategy': 'breakout', 'time_stop': 221, 'use_sma': True, 'use_atr': True, 'use_adx': False, 'use_ema': False, 'use_spike': True, 'rsi_required': False, 'edge_k': 1.9260422573810285, 'edge_cap': 0.36440280364982236, 'bull_strategy': 'breakout', 'bull_bb_std_mult': 2.390874283911759, 'bull_rsi_os': 7, 'bull_rsi_ob': 63, 'bull_adx_thresh': 11.025859154819157, 'bull_atr_min_pct': 0.012099793340723312, 'bull_atr_max_pct': 0.13647609875514322, 'bull_tp_mult': 2.0631367484670715, 'bull_tsl_mult': 0.8271271854706973, 'bull_time_stop': 33, 'bull_use_sma': False, 'bull_use_ema': True, 'bull_use_atr': False, 'bull_use_adx': True, 'bull_use_spike': False, 'bull_rsi_required': False, 'bear_strategy': 'breakout', 'bear_bb_std_mult': 3.097284395346918, 'bear_rsi_os': 29, 'bear_rsi_ob': 46, 'bear_adx_thresh': 29.30420724647741, 'bear_atr_min_pct': 0.008111016206970821, 'bear_atr_max_pct': 0.14995987479301587, 'bear_tp_mult': 1.4915012130766985, 'bear_tsl_mult': 0.09642871000343933, 'bear_time_stop': 38, 'bear_use_sma': False, 'bear_use_ema': True, 'bear_use_atr': False, 'bear_use_adx': True, 'bear_use_spike': False, 'bear_rsi_required': True, 'sideways_strategy': 'breakout', 'sideways_bb_std_mult': 0.9935821999699828, 'sideways_rsi_os': 23, 'sideways_rsi_ob': 89, 'sideways_adx_thresh': 27.403224267359636, 'sideways_atr_min_pct': 0.01310883124913869, 'sideways_atr_max_pct': 0.09785113775740283, 'sideways_tp_mult': 2.273251608139763, 'sideways_tsl_mult': 0.864424654180139, 'sideways_time_stop': 288, 'sideways_use_sma': False, 'sideways_use_ema': True, 'sideways_use_atr': True, 'sideways_use_adx': False, 'sideways_use_spike': False, 'sideways_rsi_required': False}.
[I 2025-09-01 13:32:44,298] Trial 32 finished with values: [-1000000000.0, 1000000000.0] and parameters: {'p_sma': 22, 'p_std': 34, 'p_atr': 11, 'p_adx': 21, 'rsi_period': 18, 'ema1': 16, 'ema2': 19, 'slip_atr_k': 0.06269214494546689, 'slip_spread_k': 0.46004607365652567, 'spread_hl_frac': 0.022969506312456152, 'bb_std_mult': 1.0417271769395227, 'rsi_os': 50, 'rsi_ob': 71, 'vol_spike': 0.26474610074007426, 'adx_thresh': 16.130286874405694, 'atr_min_pct': 0.01319314631992494, 'atr_max_pct': 0.1169828865283282, 'tp_mult': 2.2139787149039036, 'tsl_mult': 0.2946932181845943, 'strategy': 'breakout', 'time_stop': 207, 'use_sma': True, 'use_atr': True, 'use_adx': False, 'use_ema': False, 'use_spike': False, 'rsi_required': False, 'edge_k': 1.1169850759739521, 'edge_cap': 0.35159196440592694, 'bull_strategy': 'breakout', 'bull_bb_std_mult': 1.8293357669279773, 'bull_rsi_os': 34, 'bull_rsi_ob': 72, 'bull_adx_thresh': 8.929432933691976, 'bull_atr_min_pct': 0.019049490708470344, 'bull_atr_max_pct': 0.13499881662234003, 'bull_tp_mult': 1.9033590919579926, 'bull_tsl_mult': 0.7896555746616266, 'bull_time_stop': 71, 'bull_use_sma': False, 'bull_use_ema': True, 'bull_use_atr': False, 'bull_use_adx': True, 'bull_use_spike': False, 'bull_rsi_required': False, 'bear_strategy': 'breakout', 'bear_bb_std_mult': 3.031285331203812, 'bear_rsi_os': 30, 'bear_rsi_ob': 85, 'bear_adx_thresh': 30.21776562082384, 'bear_atr_min_pct': 0.008971298903467706, 'bear_atr_max_pct': 0.0972617512472308, 'bear_tp_mult': 1.5107233725324751, 'bear_tsl_mult': 0.11367368645065279, 'bear_time_stop': 34, 'bear_use_sma': False, 'bear_use_ema': True, 'bear_use_atr': False, 'bear_use_adx': False, 'bear_use_spike': False, 'bear_rsi_required': True, 'sideways_strategy': 'breakout', 'sideways_bb_std_mult': 0.9947734261499404, 'sideways_rsi_os': 24, 'sideways_rsi_ob': 84, 'sideways_adx_thresh': 27.40135018195712, 'sideways_atr_min_pct': 0.006441337284496527, 'sideways_atr_max_pct': 0.11170017883949711, 'sideways_tp_mult': 2.3430426190264493, 'sideways_tsl_mult': 0.688855187949093, 'sideways_time_stop': 299, 'sideways_use_sma': False, 'sideways_use_ema': True, 'sideways_use_atr': True, 'sideways_use_adx': False, 'sideways_use_spike': False, 'sideways_rsi_required': False}.
[I 2025-09-01 13:32:44,590] Trial 38 finished with values: [-1000000000.0, 1000000000.0] and parameters: {'p_sma': 28, 'p_std': 21, 'p_atr': 21, 'p_adx': 28, 'rsi_period': 33, 'ema1': 24, 'ema2': 17, 'slip_atr_k': 0.021501865156609633, 'slip_spread_k': 0.7701637171688186, 'spread_hl_frac': 0.04593353010603716, 'bb_std_mult': 3.5675458607099135, 'rsi_os': 55, 'rsi_ob': 85, 'vol_spike': 0.16290642153014687, 'adx_thresh': 19.538462981184413, 'atr_min_pct': 0.017973755075845615, 'atr_max_pct': 0.0505607481719545, 'tp_mult': 1.9218664077832832, 'tsl_mult': 0.5177885688399783, 'strategy': 'mean_reversion', 'time_stop': 132, 'use_sma': True, 'use_atr': False, 'use_adx': False, 'use_ema': False, 'use_spike': True, 'rsi_required': True, 'edge_k': 0.058586682743488994, 'edge_cap': 0.49414729420002856, 'bull_strategy': 'mean_reversion', 'bull_bb_std_mult': 0.764106672431899, 'bull_rsi_os': 43, 'bull_rsi_ob': 60, 'bull_adx_thresh': 16.613121895255013, 'bull_atr_min_pct': 0.021689872856128077, 'bull_atr_max_pct': 0.14926844835375372, 'bull_tp_mult': 1.4823709568474417, 'bull_tsl_mult': 0.18692506758821514, 'bull_time_stop': 143, 'bull_use_sma': False, 'bull_use_ema': True, 'bull_use_atr': False, 'bull_use_adx': True, 'bull_use_spike': False, 'bull_rsi_required': True, 'bear_strategy': 'breakout', 'bear_bb_std_mult': 3.358505429269928, 'bear_rsi_os': 7, 'bear_rsi_ob': 50, 'bear_adx_thresh': 6.697392612352889, 'bear_atr_min_pct': 0.010850436564327853, 'bear_atr_max_pct': 0.0753511347686893, 'bear_tp_mult': 1.8214481864478647, 'bear_tsl_mult': 0.6224666134746533, 'bear_time_stop': 5, 'bear_use_sma': True, 'bear_use_ema': False, 'bear_use_atr': False, 'bear_use_adx': True, 'bear_use_spike': False, 'bear_rsi_required': False, 'sideways_strategy': 'mean_reversion', 'sideways_bb_std_mult': 1.3952618830711696, 'sideways_rsi_os': 5, 'sideways_rsi_ob': 60, 'sideways_adx_thresh': 23.089075310547237, 'sideways_atr_min_pct': 0.007951005404746466, 'sideways_atr_max_pct': 0.13396545989558706, 'sideways_tp_mult': 1.02852250815402, 'sideways_tsl_mult': 0.5734757778521195, 'sideways_time_stop': 229, 'sideways_use_sma': False, 'sideways_use_ema': False, 'sideways_use_atr': False, 'sideways_use_adx': False, 'sideways_use_spike': False, 'sideways_rsi_required': False}.
