[I 2025-09-01 14:59:40,523] Trial 633 finished with values: [-1000000000.0, 1000000000.0] and parameters: {'p_sma': 58, 'p_std': 31, 'p_atr': 19, 'p_adx': 10, 'rsi_period': 81, 'ema1': 10, 'ema2': 50, 'slip_atr_k': 0.03358319151224805, 'slip_spread_k': 0.22399150381151273, 'spread_hl_frac': 0.01128371328496813, 'bb_std_mult': 3.4941618012580666, 'rsi_os': 39, 'rsi_ob': 49, 'vol_spike': 0.1287672523740205, 'adx_thresh': 5.016194697869148, 'atr_min_pct': 0.02171743483630205, 'atr_max_pct': 0.0387258943121669, 'tp_mult': 1.4946952274250016, 'tsl_mult': 0.6902125611037562, 'strategy': 'mean_reversion', 'time_stop': 273, 'use_sma': True, 'use_atr': True, 'use_adx': False, 'use_ema': True, 'use_spike': True, 'rsi_required': True, 'edge_k': 0.4514223089016458, 'edge_cap': 0.8062903691299708, 'bull_strategy': 'breakout', 'bull_bb_std_mult': 1.7924209876436226, 'bull_rsi_os': 14, 'bull_rsi_ob': 79, 'bull_adx_thresh': 22.816120870536338, 'bull_atr_min_pct': 0.012116960675366684, 'bull_atr_max_pct': 0.12733106544437428, 'bull_tp_mult': 2.136179562158281, 'bull_tsl_mult': 0.8630903359244775, 'bull_time_stop': 290, 'bull_use_sma': True, 'bull_use_ema': True, 'bull_use_atr': True, 'bull_use_adx': False, 'bull_use_spike': True, 'bull_rsi_required': True, 'bear_strategy': 'mean_reversion', 'bear_bb_std_mult': 2.3727104031243305, 'bear_rsi_os': 29, 'bear_rsi_ob': 56, 'bear_adx_thresh': 30.59043201492613, 'bear_atr_min_pct': 0.022134047909049347, 'bear_atr_max_pct': 0.10629076838566028, 'bear_tp_mult': 1.9004958848484443, 'bear_tsl_mult': 0.058328833894527726, 'bear_time_stop': 90, 'bear_use_sma': False, 'bear_use_ema': False, 'bear_use_atr': False, 'bear_use_adx': False, 'bear_use_spike': True, 'bear_rsi_required': False, 'sideways_strategy': 'mean_reversion', 'sideways_bb_std_mult': 2.6151676221417164, 'sideways_rsi_os': 44, 'sideways_rsi_ob': 91, 'sideways_adx_thresh': 23.945507542532, 'sideways_atr_min_pct': 0.011739902898794632, 'sideways_atr_max_pct': 0.1278121996475206, 'sideways_tp_mult': 2.3112108573351837, 'sideways_tsl_mult': 0.5832041321543, 'sideways_time_stop': 244, 'sideways_use_sma': True, 'sideways_use_ema': False, 'sideways_use_atr': True, 'sideways_use_adx': True, 'sideways_use_spike': False, 'sideways_rsi_required': False}.
[I 2025-09-01 15:00:17,875] Trial 631 finished with values: [0.0022877516514749896, 0.006351150972232642] and parameters: {'p_sma': 48, 'p_std': 31, 'p_atr': 24, 'p_adx': 10, 'rsi_period': 81, 'ema1': 10, 'ema2': 56, 'slip_atr_k': 0.03331112289999887, 'slip_spread_k': 0.22432646765768566, 'spread_hl_frac': 0.011515812294715818, 'bb_std_mult': 1.3498402730637433, 'rsi_os': 43, 'rsi_ob': 78, 'vol_spike': 0.00034397855778153796, 'adx_thresh': 5.025024995119442, 'atr_min_pct': 0.021671819855796394, 'atr_max_pct': 0.12141645549525955, 'tp_mult': 1.398714118559903, 'tsl_mult': 0.6973741355950195, 'strategy': 'mean_reversion', 'time_stop': 91, 'use_sma': True, 'use_atr': True, 'use_adx': False, 'use_ema': True, 'use_spike': True, 'rsi_required': True, 'edge_k': 0.1709537871768238, 'edge_cap': 0.8947924368734057, 'bull_strategy': 'breakout', 'bull_bb_std_mult': 2.0786920521165135, 'bull_rsi_os': 14, 'bull_rsi_ob': 46, 'bull_adx_thresh': 12.756535833851897, 'bull_atr_min_pct': 0.012033146639300385, 'bull_atr_max_pct': 0.11052319391424203, 'bull_tp_mult': 2.134913179041298, 'bull_tsl_mult': 0.4219954286826439, 'bull_time_stop': 141, 'bull_use_sma': True, 'bull_use_ema': True, 'bull_use_atr': True, 'bull_use_adx': False, 'bull_use_spike': True, 'bull_rsi_required': True, 'bear_strategy': 'mean_reversion', 'bear_bb_std_mult': 1.7954945031300729, 'bear_rsi_os': 37, 'bear_rsi_ob': 77, 'bear_adx_thresh': 9.634054549646766, 'bear_atr_min_pct': 0.003928496801009068, 'bear_atr_max_pct': 0.039681037278194345, 'bear_tp_mult': 1.9053765508607066, 'bear_tsl_mult': 0.05631027666624906, 'bear_time_stop': 70, 'bear_use_sma': False, 'bear_use_ema': False, 'bear_use_atr': False, 'bear_use_adx': False, 'bear_use_spike': True, 'bear_rsi_required': False, 'sideways_strategy': 'mean_reversion', 'sideways_bb_std_mult': 2.932878578391908, 'sideways_rsi_os': 44, 'sideways_rsi_ob': 54, 'sideways_adx_thresh': 17.29859190663901, 'sideways_atr_min_pct': 0.00923646525780801, 'sideways_atr_max_pct': 0.11575302433081278, 'sideways_tp_mult': 2.262213114137627, 'sideways_tsl_mult': 0.3397067143971062, 'sideways_time_stop': 241, 'sideways_use_sma': True, 'sideways_use_ema': False, 'sideways_use_atr': True, 'sideways_use_adx': True, 'sideways_use_spike': False, 'sideways_rsi_required': False}.
[I 2025-09-01 15:00:18,806] Trial 634 finished with values: [-1000000000.0, 1000000000.0] and parameters: {'p_sma': 48, 'p_std': 26, 'p_atr': 24, 'p_adx': 17, 'rsi_period': 81, 'ema1': 23, 'ema2': 56, 'slip_atr_k': 0.21338347139327268, 'slip_spread_k': 0.5124261997913884, 'spread_hl_frac': 0.038833351498921566, 'bb_std_mult': 3.1324283783514293, 'rsi_os': 47, 'rsi_ob': 53, 'vol_spike': 0.08846604312410551, 'adx_thresh': 15.73878040317009, 'atr_min_pct': 0.01123473575589047, 'atr_max_pct': 0.025781944343406478, 'tp_mult': 1.5808691579997918, 'tsl_mult': 0.3736381452008185, 'strategy': 'mean_reversion', 'time_stop': 124, 'use_sma': False, 'use_atr': False, 'use_adx': True, 'use_ema': True, 'use_spike': True, 'rsi_required': True, 'edge_k': 0.17990275627062713, 'edge_cap': 0.9082651278327868, 'bull_strategy': 'breakout', 'bull_bb_std_mult': 3.0864175056343592, 'bull_rsi_os': 42, 'bull_rsi_ob': 80, 'bull_adx_thresh': 12.7648670095277, 'bull_atr_min_pct': 0.006292275757990278, 'bull_atr_max_pct': 0.1302998593997595, 'bull_tp_mult': 2.80290305052394, 'bull_tsl_mult': 0.42067595627940063, 'bull_time_stop': 138, 'bull_use_sma': False, 'bull_use_ema': True, 'bull_use_atr': True, 'bull_use_adx': True, 'bull_use_spike': True, 'bull_rsi_required': True, 'bear_strategy': 'mean_reversion', 'bear_bb_std_mult': 0.6674615850701653, 'bear_rsi_os': 31, 'bear_rsi_ob': 58, 'bear_adx_thresh': 8.37674326878757, 'bear_atr_min_pct': 0.02536599842446636, 'bear_atr_max_pct': 0.0386054545346655, 'bear_tp_mult': 2.1151605148263104, 'bear_tsl_mult': 0.9165175176075946, 'bear_time_stop': 114, 'bear_use_sma': False, 'bear_use_ema': False, 'bear_use_atr': False, 'bear_use_adx': False, 'bear_use_spike': True, 'bear_rsi_required': False, 'sideways_strategy': 'mean_reversion', 'sideways_bb_std_mult': 0.93883810469621, 'sideways_rsi_os': 34, 'sideways_rsi_ob': 52, 'sideways_adx_thresh': 12.368371999996123, 'sideways_atr_min_pct': 0.0018757931456934505, 'sideways_atr_max_pct': 0.1176821777843942, 'sideways_tp_mult': 2.082480351391297, 'sideways_tsl_mult': 0.342675469916909, 'sideways_time_stop': 294, 'sideways_use_sma': True, 'sideways_use_ema': True, 'sideways_use_atr': False, 'sideways_use_adx': True, 'sideways_use_spike': False, 'sideways_rsi_required': False}.
[I 2025-09-01 15:00:19,129] Trial 632 finished with values: [-1000000000.0, 1000000000.0] and parameters: {'p_sma': 32, 'p_std': 28, 'p_atr': 19, 'p_adx': 10, 'rsi_period': 61, 'ema1': 10, 'ema2': 56, 'slip_atr_k': 0.01640510098716685, 'slip_spread_k': 0.5109640404372233, 'spread_hl_frac': 0.038713897138104816, 'bb_std_mult': 3.496990793817861, 'rsi_os': 24, 'rsi_ob': 53, 'vol_spike': 0.08946824423025453, 'adx_thresh': 30.877225988847464, 'atr_min_pct': 0.011329910855605621, 'atr_max_pct': 0.038823642179950796, 'tp_mult': 1.5873121959595777, 'tsl_mult': 0.69824899719619, 'strategy': 'mean_reversion', 'time_stop': 126, 'use_sma': True, 'use_atr': True, 'use_adx': False, 'use_ema': True, 'use_spike': True, 'rsi_required': True, 'edge_k': 0.17620672690391365, 'edge_cap': 0.9033520243548941, 'bull_strategy': 'breakout', 'bull_bb_std_mult': 3.0663802768467456, 'bull_rsi_os': 14, 'bull_rsi_ob': 80, 'bull_adx_thresh': 12.872099528686626, 'bull_atr_min_pct': 0.0061425558143239824, 'bull_atr_max_pct': 0.1093332789555223, 'bull_tp_mult': 1.6325697047117513, 'bull_tsl_mult': 0.3370515469219811, 'bull_time_stop': 140, 'bull_use_sma': True, 'bull_use_ema': True, 'bull_use_atr': True, 'bull_use_adx': False, 'bull_use_spike': True, 'bull_rsi_required': True, 'bear_strategy': 'mean_reversion', 'bear_bb_std_mult': 2.347350028342404, 'bear_rsi_os': 29, 'bear_rsi_ob': 66, 'bear_adx_thresh': 8.597524539617421, 'bear_atr_min_pct': 0.0025079190622238107, 'bear_atr_max_pct': 0.038930057540128654, 'bear_tp_mult': 1.896581128080285, 'bear_tsl_mult': 0.05467559223314078, 'bear_time_stop': 94, 'bear_use_sma': False, 'bear_use_ema': False, 'bear_use_atr': False, 'bear_use_adx': False, 'bear_use_spike': True, 'bear_rsi_required': False, 'sideways_strategy': 'mean_reversion', 'sideways_bb_std_mult': 0.9304667355339817, 'sideways_rsi_os': 51, 'sideways_rsi_ob': 91, 'sideways_adx_thresh': 18.818296403189954, 'sideways_atr_min_pct': 0.009138248144065674, 'sideways_atr_max_pct': 0.11818354730451673, 'sideways_tp_mult': 2.3225509829774498, 'sideways_tsl_mult': 0.342788661057306, 'sideways_time_stop': 215, 'sideways_use_sma': True, 'sideways_use_ema': False, 'sideways_use_atr': True, 'sideways_use_adx': True, 'sideways_use_spike': False, 'sideways_rsi_required': False}.
[I 2025-09-01 15:00:19,337] Trial 630 finished with values: [-0.04549033828654392, 0.04697230280504191] and parameters: {'p_sma': 32, 'p_std': 26, 'p_atr': 26, 'p_adx': 10, 'rsi_period': 61, 'ema1': 20, 'ema2': 57, 'slip_atr_k': 0.1369947739919513, 'slip_spread_k': 0.4739179348049552, 'spread_hl_frac': 0.03919120436618902, 'bb_std_mult': 3.108641976605806, 'rsi_os': 39, 'rsi_ob': 69, 'vol_spike': 0.24160499072508254, 'adx_thresh': 5.069193717183731, 'atr_min_pct': 0.011114754127448901, 'atr_max_pct': 0.035393846608008345, 'tp_mult': 1.2927828377670654, 'tsl_mult': 0.6952474463042644, 'strategy': 'mean_reversion', 'time_stop': 271, 'use_sma': True, 'use_atr': False, 'use_adx': False, 'use_ema': False, 'use_spike': True, 'rsi_required': True, 'edge_k': 1.319523229033202, 'edge_cap': 0.9024212104556026, 'bull_strategy': 'mean_reversion', 'bull_bb_std_mult': 3.269532133077369, 'bull_rsi_os': 14, 'bull_rsi_ob': 79, 'bull_adx_thresh': 22.855443456106382, 'bull_atr_min_pct': 0.012313094329856515, 'bull_atr_max_pct': 0.1267422633858193, 'bull_tp_mult': 1.6211303851242513, 'bull_tsl_mult': 0.4235739612302086, 'bull_time_stop': 290, 'bull_use_sma': False, 'bull_use_ema': True, 'bull_use_atr': True, 'bull_use_adx': True, 'bull_use_spike': True, 'bull_rsi_required': False, 'bear_strategy': 'mean_reversion', 'bear_bb_std_mult': 1.7064678664861797, 'bear_rsi_os': 36, 'bear_rsi_ob': 77, 'bear_adx_thresh': 7.91732709465587, 'bear_atr_min_pct': 0.0016913389408079987, 'bear_atr_max_pct': 0.016172651387552014, 'bear_tp_mult': 1.9020637712566109, 'bear_tsl_mult': 0.06389614162409857, 'bear_time_stop': 243, 'bear_use_sma': False, 'bear_use_ema': False, 'bear_use_atr': False, 'bear_use_adx': False, 'bear_use_spike': True, 'bear_rsi_required': False, 'sideways_strategy': 'mean_reversion', 'sideways_bb_std_mult': 0.9391560272045911, 'sideways_rsi_os': 29, 'sideways_rsi_ob': 91, 'sideways_adx_thresh': 24.553633628318686, 'sideways_atr_min_pct': 0.00515453146259863, 'sideways_atr_max_pct': 0.12782687398211207, 'sideways_tp_mult': 2.30463797207865, 'sideways_tsl_mult': 0.38585562934910456, 'sideways_time_stop': 300, 'sideways_use_sma': True, 'sideways_use_ema': True, 'sideways_use_atr': True, 'sideways_use_adx': True, 'sideways_use_spike': False, 'sideways_rsi_required': False}.
[I 2025-09-01 15:00:20,657] Trial 635 finished with values: [-1000000000.0, 1000000000.0] and parameters: {'p_sma': 32, 'p_std': 58, 'p_atr': 26, 'p_adx': 9, 'rsi_period': 61, 'ema1': 11, 'ema2': 58, 'slip_atr_k': 0.03992004508370364, 'slip_spread_k': 0.95460029436437, 'spread_hl_frac': 0.02024583367000524, 'bb_std_mult': 3.1336862733202713, 'rsi_os': 46, 'rsi_ob': 83, 'vol_spike': 0.10901441016052388, 'adx_thresh': 13.038230584601617, 'atr_min_pct': 0.011355434057879464, 'atr_max_pct': 0.010372455702544553, 'tp_mult': 1.433674008232085, 'tsl_mult': 0.7670074147623629, 'strategy': 'mean_reversion', 'time_stop': 199, 'use_sma': False, 'use_atr': False, 'use_adx': True, 'use_ema': True, 'use_spike': True, 'rsi_required': True, 'edge_k': 0.28275410628769704, 'edge_cap': 0.944194782624503, 'bull_strategy': 'breakout', 'bull_bb_std_mult': 3.086888476629936, 'bull_rsi_os': 12, 'bull_rsi_ob': 69, 'bull_adx_thresh': 11.47224975248934, 'bull_atr_min_pct': 0.02660905083595992, 'bull_atr_max_pct': 0.030239131982979325, 'bull_tp_mult': 2.364440133127053, 'bull_tsl_mult': 0.5367235270891023, 'bull_time_stop': 148, 'bull_use_sma': False, 'bull_use_ema': True, 'bull_use_atr': True, 'bull_use_adx': True, 'bull_use_spike': True, 'bull_rsi_required': True, 'bear_strategy': 'mean_reversion', 'bear_bb_std_mult': 2.662447535806965, 'bear_rsi_os': 7, 'bear_rsi_ob': 58, 'bear_adx_thresh': 8.743594700780108, 'bear_atr_min_pct': 0.00166633392387044, 'bear_atr_max_pct': 0.10142432735657156, 'bear_tp_mult': 2.122968833627116, 'bear_tsl_mult': 0.10536982374722935, 'bear_time_stop': 241, 'bear_use_sma': False, 'bear_use_ema': False, 'bear_use_atr': False, 'bear_use_adx': False, 'bear_use_spike': True, 'bear_rsi_required': False, 'sideways_strategy': 'mean_reversion', 'sideways_bb_std_mult': 2.3477452964095895, 'sideways_rsi_os': 29, 'sideways_rsi_ob': 61, 'sideways_adx_thresh': 18.694425274280555, 'sideways_atr_min_pct': 0.004424627525744131, 'sideways_atr_max_pct': 0.10500328111643788, 'sideways_tp_mult': 2.438671558417427, 'sideways_tsl_mult': 0.44507603910550686, 'sideways_time_stop': 256, 'sideways_use_sma': True, 'sideways_use_ema': True, 'sideways_use_atr': False, 'sideways_use_adx': True, 'sideways_use_spike': False, 'sideways_rsi_required': False}.
[I 2025-09-01 15:00:20,669] Trial 638 finished with values: [-1000000000.0, 1000000000.0] and parameters: {'p_sma': 36, 'p_std': 29, 'p_atr': 25, 'p_adx': 9, 'rsi_period': 15, 'ema1': 9, 'ema2': 59, 'slip_atr_k': 0.008608102291289417, 'slip_spread_k': 0.7211990231796493, 'spread_hl_frac': 0.01046128096369333, 'bb_std_mult': 3.3010159496414806, 'rsi_os': 46, 'rsi_ob': 50, 'vol_spike': 0.10747192572825082, 'adx_thresh': 7.148282436541365, 'atr_min_pct': 0.009817546300955653, 'atr_max_pct': 0.031135621250151405, 'tp_mult': 1.420890008463038, 'tsl_mult': 0.17477636155390175, 'strategy': 'mean_reversion', 'time_stop': 260, 'use_sma': False, 'use_atr': False, 'use_adx': True, 'use_ema': True, 'use_spike': False, 'rsi_required': False, 'edge_k': 0.2634860135691799, 'edge_cap': 0.9468812780494663, 'bull_strategy': 'breakout', 'bull_bb_std_mult': 3.5020875754715415, 'bull_rsi_os': 8, 'bull_rsi_ob': 78, 'bull_adx_thresh': 16.311278280006633, 'bull_atr_min_pct': 0.010633572905808405, 'bull_atr_max_pct': 0.08777659356480595, 'bull_tp_mult': 2.365502788141428, 'bull_tsl_mult': 0.3697418496662901, 'bull_time_stop': 166, 'bull_use_sma': False, 'bull_use_ema': False, 'bull_use_atr': False, 'bull_use_adx': True, 'bull_use_spike': True, 'bull_rsi_required': True, 'bear_strategy': 'mean_reversion', 'bear_bb_std_mult': 2.6576595607804756, 'bear_rsi_os': 33, 'bear_rsi_ob': 49, 'bear_adx_thresh': 33.15667865221738, 'bear_atr_min_pct': 0.008236963527094767, 'bear_atr_max_pct': 0.10787544889215486, 'bear_tp_mult': 2.0257971951747185, 'bear_tsl_mult': 0.20464251181466644, 'bear_time_stop': 128, 'bear_use_sma': True, 'bear_use_ema': True, 'bear_use_atr': False, 'bear_use_adx': False, 'bear_use_spike': False, 'bear_rsi_required': False, 'sideways_strategy': 'breakout', 'sideways_bb_std_mult': 2.9401935056080695, 'sideways_rsi_os': 30, 'sideways_rsi_ob': 87, 'sideways_adx_thresh': 25.887824391874283, 'sideways_atr_min_pct': 0.004287693668458725, 'sideways_atr_max_pct': 0.10642639052389308, 'sideways_tp_mult': 2.4420327139556783, 'sideways_tsl_mult': 0.6208180012619607, 'sideways_time_stop': 257, 'sideways_use_sma': False, 'sideways_use_ema': True, 'sideways_use_atr': False, 'sideways_use_adx': False, 'sideways_use_spike': True, 'sideways_rsi_required': False}.
[I 2025-09-01 15:00:20,745] Trial 637 finished with values: [-1000000000.0, 1000000000.0] and parameters: {'p_sma': 30, 'p_std': 18, 'p_atr': 25, 'p_adx': 14, 'rsi_period': 76, 'ema1': 22, 'ema2': 59, 'slip_atr_k': 0.040215308261385085, 'slip_spread_k': 0.5542716099288345, 'spread_hl_frac': 0.04220595151843838, 'bb_std_mult': 3.4032546665266543, 'rsi_os': 11, 'rsi_ob': 50, 'vol_spike': 0.1058317553174487, 'adx_thresh': 7.158991960308223, 'atr_min_pct': 0.010477477078057245, 'atr_max_pct': 0.029649998685575548, 'tp_mult': 1.4298620228471068, 'tsl_mult': 0.7406459445715716, 'strategy': 'mean_reversion', 'time_stop': 202, 'use_sma': False, 'use_atr': False, 'use_adx': True, 'use_ema': True, 'use_spike': False, 'rsi_required': False, 'edge_k': 0.2820384438693402, 'edge_cap': 0.950229962879136, 'bull_strategy': 'breakout', 'bull_bb_std_mult': 1.474737490893364, 'bull_rsi_os': 25, 'bull_rsi_ob': 78, 'bull_adx_thresh': 11.079075109793282, 'bull_atr_min_pct': 0.010430204751286158, 'bull_atr_max_pct': 0.11752410553472485, 'bull_tp_mult': 1.0634654612855976, 'bull_tsl_mult': 0.07609366492514402, 'bull_time_stop': 165, 'bull_use_sma': False, 'bull_use_ema': False, 'bull_use_atr': False, 'bull_use_adx': True, 'bull_use_spike': True, 'bull_rsi_required': True, 'bear_strategy': 'mean_reversion', 'bear_bb_std_mult': 2.0388664770053553, 'bear_rsi_os': 32, 'bear_rsi_ob': 70, 'bear_adx_thresh': 28.758926443762377, 'bear_atr_min_pct': 0.000513943233696754, 'bear_atr_max_pct': 0.1069453994699847, 'bear_tp_mult': 2.02541697572713, 'bear_tsl_mult': 0.20269320754180264, 'bear_time_stop': 38, 'bear_use_sma': True, 'bear_use_ema': True, 'bear_use_atr': False, 'bear_use_adx': False, 'bear_use_spike': False, 'bear_rsi_required': False, 'sideways_strategy': 'breakout', 'sideways_bb_std_mult': 1.4053615209169426, 'sideways_rsi_os': 30, 'sideways_rsi_ob': 80, 'sideways_adx_thresh': 26.15908452493833, 'sideways_atr_min_pct': 0.01914982633166165, 'sideways_atr_max_pct': 0.10528723219278005, 'sideways_tp_mult': 2.4491859527258284, 'sideways_tsl_mult': 0.41227446147492797, 'sideways_time_stop': 144, 'sideways_use_sma': False, 'sideways_use_ema': True, 'sideways_use_atr': False, 'sideways_use_adx': False, 'sideways_use_spike': True, 'sideways_rsi_required': False}.
[I 2025-09-01 15:00:20,766] Trial 636 finished with values: [-1000000000.0, 1000000000.0] and parameters: {'p_sma': 35, 'p_std': 29, 'p_atr': 25, 'p_adx': 9, 'rsi_period': 72, 'ema1': 5, 'ema2': 57, 'slip_atr_k': 0.12607870203155153, 'slip_spread_k': 0.9052606729545132, 'spread_hl_frac': 0.020097330717457278, 'bb_std_mult': 3.381296239520668, 'rsi_os': 46, 'rsi_ob': 50, 'vol_spike': 0.10444107773200582, 'adx_thresh': 7.134774164521257, 'atr_min_pct': 0.009728927506535852, 'atr_max_pct': 0.030228374052117552, 'tp_mult': 1.29676247404165, 'tsl_mult': 0.7786325019329857, 'strategy': 'mean_reversion', 'time_stop': 107, 'use_sma': True, 'use_atr': False, 'use_adx': True, 'use_ema': True, 'use_spike': True, 'rsi_required': False, 'edge_k': 0.2730053703766759, 'edge_cap': 0.514700508444632, 'bull_strategy': 'breakout', 'bull_bb_std_mult': 3.506556106768084, 'bull_rsi_os': 12, 'bull_rsi_ob': 92, 'bull_adx_thresh': 11.564383348258836, 'bull_atr_min_pct': 0.010380504896146241, 'bull_atr_max_pct': 0.057352746136362126, 'bull_tp_mult': 1.674393324843807, 'bull_tsl_mult': 0.5054229790056053, 'bull_time_stop': 223, 'bull_use_sma': False, 'bull_use_ema': False, 'bull_use_atr': False, 'bull_use_adx': True, 'bull_use_spike': True, 'bull_rsi_required': True, 'bear_strategy': 'mean_reversion', 'bear_bb_std_mult': 2.0256489175484464, 'bear_rsi_os': 36, 'bear_rsi_ob': 64, 'bear_adx_thresh': 8.34183616182081, 'bear_atr_min_pct': 0.0017756618828503878, 'bear_atr_max_pct': 0.10732984002445538, 'bear_tp_mult': 2.047802712448283, 'bear_tsl_mult': 0.6045867820369498, 'bear_time_stop': 239, 'bear_use_sma': False, 'bear_use_ema': True, 'bear_use_atr': False, 'bear_use_adx': False, 'bear_use_spike': True, 'bear_rsi_required': False, 'sideways_strategy': 'breakout', 'sideways_bb_std_mult': 1.8138252286454761, 'sideways_rsi_os': 30, 'sideways_rsi_ob': 91, 'sideways_adx_thresh': 18.58008327118995, 'sideways_atr_min_pct': 0.0045947941185976345, 'sideways_atr_max_pct': 0.10534268805703104, 'sideways_tp_mult': 2.4530680528723527, 'sideways_tsl_mult': 0.9977426987714704, 'sideways_time_stop': 300, 'sideways_use_sma': False, 'sideways_use_ema': True, 'sideways_use_atr': True, 'sideways_use_adx': True, 'sideways_use_spike': False, 'sideways_rsi_required': False}.
