[I 2025-09-01 14:56:49,600] Trial 615 finished with values: [-1000000000.0, 1000000000.0] and parameters: {'p_sma': 22, 'p_std': 30, 'p_atr': 27, 'p_adx': 18, 'rsi_period': 80, 'ema1': 12, 'ema2': 31, 'slip_atr_k': 0.010442461424475618, 'slip_spread_k': 0.6148010957106438, 'spread_hl_frac': 0.007835395319757358, 'bb_std_mult': 2.1968739866055844, 'rsi_os': 44, 'rsi_ob': 48, 'vol_spike': 0.22542307289912614, 'adx_thresh': 13.777715443251786, 'atr_min_pct': 0.023275618617469854, 'atr_max_pct': 0.04512866155578084, 'tp_mult': 1.66418717926022, 'tsl_mult': 0.9484850545153527, 'strategy': 'mean_reversion', 'time_stop': 212, 'use_sma': True, 'use_atr': False, 'use_adx': False, 'use_ema': True, 'use_spike': True, 'rsi_required': True, 'edge_k': 0.20464861334025067, 'edge_cap': 0.9999790762262554, 'bull_strategy': 'mean_reversion', 'bull_bb_std_mult': 3.1205706431624396, 'bull_rsi_os': 9, 'bull_rsi_ob': 81, 'bull_adx_thresh': 14.908929417801197, 'bull_atr_min_pct': 0.012418211801569996, 'bull_atr_max_pct': 0.10026119309192756, 'bull_tp_mult': 1.6357219880462213, 'bull_tsl_mult': 0.4004256082761975, 'bull_time_stop': 215, 'bull_use_sma': False, 'bull_use_ema': False, 'bull_use_atr': True, 'bull_use_adx': True, 'bull_use_spike': True, 'bull_rsi_required': True, 'bear_strategy': 'mean_reversion', 'bear_bb_std_mult': 2.537944984653322, 'bear_rsi_os': 22, 'bear_rsi_ob': 57, 'bear_adx_thresh': 34.97986528966105, 'bear_atr_min_pct': 1.7623708683708536e-05, 'bear_atr_max_pct': 0.1093105200134248, 'bear_tp_mult': 2.7913134068823306, 'bear_tsl_mult': 0.42946797388269875, 'bear_time_stop': 81, 'bear_use_sma': True, 'bear_use_ema': False, 'bear_use_atr': False, 'bear_use_adx': False, 'bear_use_spike': True, 'bear_rsi_required': True, 'sideways_strategy': 'mean_reversion', 'sideways_bb_std_mult': 3.0696305536853115, 'sideways_rsi_os': 26, 'sideways_rsi_ob': 91, 'sideways_adx_thresh': 25.293171297606317, 'sideways_atr_min_pct': 0.02422580824368223, 'sideways_atr_max_pct': 0.11000415802316019, 'sideways_tp_mult': 2.366399921740994, 'sideways_tsl_mult': 0.4525609968180707, 'sideways_time_stop': 265, 'sideways_use_sma': True, 'sideways_use_ema': True, 'sideways_use_atr': True, 'sideways_use_adx': True, 'sideways_use_spike': False, 'sideways_rsi_required': True}.
[I 2025-09-01 14:56:49,608] Trial 614 finished with values: [-1000000000.0, 1000000000.0] and parameters: {'p_sma': 55, 'p_std': 30, 'p_atr': 27, 'p_adx': 11, 'rsi_period': 80, 'ema1': 8, 'ema2': 25, 'slip_atr_k': 0.18292664037685213, 'slip_spread_k': 0.6115721472339574, 'spread_hl_frac': 0.012368358227313215, 'bb_std_mult': 3.5391208659235627, 'rsi_os': 44, 'rsi_ob': 48, 'vol_spike': 0.12043069565781836, 'adx_thresh': 6.2660843249338525, 'atr_min_pct': 0.023403186005528404, 'atr_max_pct': 0.07188850162877594, 'tp_mult': 1.6686874487187306, 'tsl_mult': 0.9414329641259176, 'strategy': 'mean_reversion', 'time_stop': 232, 'use_sma': True, 'use_atr': False, 'use_adx': False, 'use_ema': True, 'use_spike': True, 'rsi_required': True, 'edge_k': 0.5677572951288608, 'edge_cap': 0.07628227087642447, 'bull_strategy': 'mean_reversion', 'bull_bb_std_mult': 3.139328821224885, 'bull_rsi_os': 14, 'bull_rsi_ob': 93, 'bull_adx_thresh': 10.039649182019854, 'bull_atr_min_pct': 0.014004242737315216, 'bull_atr_max_pct': 0.1288181120623979, 'bull_tp_mult': 2.1043867187071674, 'bull_tsl_mult': 0.439201101401883, 'bull_time_stop': 144, 'bull_use_sma': False, 'bull_use_ema': False, 'bull_use_atr': True, 'bull_use_adx': True, 'bull_use_spike': True, 'bull_rsi_required': True, 'bear_strategy': 'mean_reversion', 'bear_bb_std_mult': 1.3999354827401107, 'bear_rsi_os': 36, 'bear_rsi_ob': 56, 'bear_adx_thresh': 10.92398372042449, 'bear_atr_min_pct': 0.013925649650109418, 'bear_atr_max_pct': 0.11029296452311489, 'bear_tp_mult': 2.068229091524031, 'bear_tsl_mult': 0.4796661122218268, 'bear_time_stop': 77, 'bear_use_sma': True, 'bear_use_ema': False, 'bear_use_atr': False, 'bear_use_adx': False, 'bear_use_spike': True, 'bear_rsi_required': True, 'sideways_strategy': 'mean_reversion', 'sideways_bb_std_mult': 2.044698035358083, 'sideways_rsi_os': 53, 'sideways_rsi_ob': 48, 'sideways_adx_thresh': 23.56485728600438, 'sideways_atr_min_pct': 0.0032673420757008383, 'sideways_atr_max_pct': 0.10958379938069807, 'sideways_tp_mult': 2.4541649762707896, 'sideways_tsl_mult': 0.24358132738321492, 'sideways_time_stop': 105, 'sideways_use_sma': True, 'sideways_use_ema': True, 'sideways_use_atr': True, 'sideways_use_adx': True, 'sideways_use_spike': False, 'sideways_rsi_required': True}.
[I 2025-09-01 14:57:32,949] Trial 612 finished with values: [-1000000000.0, 1000000000.0] and parameters: {'p_sma': 32, 'p_std': 30, 'p_atr': 27, 'p_adx': 8, 'rsi_period': 80, 'ema1': 7, 'ema2': 31, 'slip_atr_k': 0.009601141438212335, 'slip_spread_k': 0.6121182768019897, 'spread_hl_frac': 0.017518334494873694, 'bb_std_mult': 3.5514977279025057, 'rsi_os': 44, 'rsi_ob': 71, 'vol_spike': 0.12188301856636281, 'adx_thresh': 9.541519211141788, 'atr_min_pct': 0.009864999633337613, 'atr_max_pct': 0.044937766627192656, 'tp_mult': 1.36413419273016, 'tsl_mult': 0.8874687465643898, 'strategy': 'mean_reversion', 'time_stop': 108, 'use_sma': True, 'use_atr': False, 'use_adx': False, 'use_ema': True, 'use_spike': True, 'rsi_required': True, 'edge_k': 0.2129086597439911, 'edge_cap': 0.7781565148677025, 'bull_strategy': 'breakout', 'bull_bb_std_mult': 3.16617974953911, 'bull_rsi_os': 13, 'bull_rsi_ob': 57, 'bull_adx_thresh': 5.747837349221477, 'bull_atr_min_pct': 0.011789643591985468, 'bull_atr_max_pct': 0.12805574783451432, 'bull_tp_mult': 1.4586172336151284, 'bull_tsl_mult': 0.4009380713740233, 'bull_time_stop': 11, 'bull_use_sma': False, 'bull_use_ema': False, 'bull_use_atr': True, 'bull_use_adx': True, 'bull_use_spike': True, 'bull_rsi_required': True, 'bear_strategy': 'mean_reversion', 'bear_bb_std_mult': 2.5283072422659365, 'bear_rsi_os': 21, 'bear_rsi_ob': 80, 'bear_adx_thresh': 34.94295237527243, 'bear_atr_min_pct': 0.002069339039785523, 'bear_atr_max_pct': 0.10982316480173242, 'bear_tp_mult': 1.7808619891991648, 'bear_tsl_mult': 0.08047069420863559, 'bear_time_stop': 81, 'bear_use_sma': False, 'bear_use_ema': False, 'bear_use_atr': False, 'bear_use_adx': False, 'bear_use_spike': True, 'bear_rsi_required': False, 'sideways_strategy': 'mean_reversion', 'sideways_bb_std_mult': 3.527624939345754, 'sideways_rsi_os': 30, 'sideways_rsi_ob': 55, 'sideways_adx_thresh': 34.971624724098916, 'sideways_atr_min_pct': 0.0027718681724558606, 'sideways_atr_max_pct': 0.11036691253511503, 'sideways_tp_mult': 1.479870739832682, 'sideways_tsl_mult': 0.4350077997295062, 'sideways_time_stop': 262, 'sideways_use_sma': True, 'sideways_use_ema': True, 'sideways_use_atr': True, 'sideways_use_adx': True, 'sideways_use_spike': False, 'sideways_rsi_required': False}.
[I 2025-09-01 14:57:33,798] Trial 613 finished with values: [-1000000000.0, 1000000000.0] and parameters: {'p_sma': 22, 'p_std': 30, 'p_atr': 10, 'p_adx': 21, 'rsi_period': 80, 'ema1': 7, 'ema2': 31, 'slip_atr_k': 0.19503207745245593, 'slip_spread_k': 0.6124345873297593, 'spread_hl_frac': 0.012511776388797701, 'bb_std_mult': 3.5447859017042123, 'rsi_os': 44, 'rsi_ob': 71, 'vol_spike': 0.12212639663899091, 'adx_thresh': 6.245550732071891, 'atr_min_pct': 0.02339700676914351, 'atr_max_pct': 0.07236245990756898, 'tp_mult': 1.330707480968606, 'tsl_mult': 0.5019563792378542, 'strategy': 'mean_reversion', 'time_stop': 108, 'use_sma': True, 'use_atr': False, 'use_adx': False, 'use_ema': True, 'use_spike': True, 'rsi_required': True, 'edge_k': 0.11429515616888686, 'edge_cap': 0.9558543909174922, 'bull_strategy': 'mean_reversion', 'bull_bb_std_mult': 3.1249418771249986, 'bull_rsi_os': 15, 'bull_rsi_ob': 57, 'bull_adx_thresh': 12.791192958307782, 'bull_atr_min_pct': 0.014112818340301148, 'bull_atr_max_pct': 0.09990307469409139, 'bull_tp_mult': 1.6489570459787881, 'bull_tsl_mult': 0.39364142685314996, 'bull_time_stop': 214, 'bull_use_sma': False, 'bull_use_ema': False, 'bull_use_atr': True, 'bull_use_adx': True, 'bull_use_spike': True, 'bull_rsi_required': True, 'bear_strategy': 'mean_reversion', 'bear_bb_std_mult': 2.5249587748918705, 'bear_rsi_os': 53, 'bear_rsi_ob': 72, 'bear_adx_thresh': 34.92009644948562, 'bear_atr_min_pct': 0.013933661435698798, 'bear_atr_max_pct': 0.08298745375660975, 'bear_tp_mult': 1.7845845606234267, 'bear_tsl_mult': 0.9604533609249345, 'bear_time_stop': 75, 'bear_use_sma': True, 'bear_use_ema': False, 'bear_use_atr': False, 'bear_use_adx': False, 'bear_use_spike': True, 'bear_rsi_required': True, 'sideways_strategy': 'mean_reversion', 'sideways_bb_std_mult': 2.0435240341843204, 'sideways_rsi_os': 53, 'sideways_rsi_ob': 90, 'sideways_adx_thresh': 11.564083917874568, 'sideways_atr_min_pct': 0.0026285810170781224, 'sideways_atr_max_pct': 0.10997692408193772, 'sideways_tp_mult': 2.4481898907921384, 'sideways_tsl_mult': 0.20224777690149764, 'sideways_time_stop': 264, 'sideways_use_sma': True, 'sideways_use_ema': True, 'sideways_use_atr': True, 'sideways_use_adx': True, 'sideways_use_spike': False, 'sideways_rsi_required': True}.
[I 2025-09-01 14:57:36,007] Trial 616 finished with values: [-0.06537093405909744, 0.06504842265915886] and parameters: {'p_sma': 30, 'p_std': 6, 'p_atr': 17, 'p_adx': 9, 'rsi_period': 83, 'ema1': 7, 'ema2': 56, 'slip_atr_k': 0.14474207078648937, 'slip_spread_k': 0.00133281627342402, 'spread_hl_frac': 0.012262865791412475, 'bb_std_mult': 3.5949019966499627, 'rsi_os': 12, 'rsi_ob': 52, 'vol_spike': 0.12234507255989314, 'adx_thresh': 6.308618751661452, 'atr_min_pct': 0.027476360376374593, 'atr_max_pct': 0.028339680342274024, 'tp_mult': 1.3206592631910097, 'tsl_mult': 0.5935250830352439, 'strategy': 'mean_reversion', 'time_stop': 83, 'use_sma': True, 'use_atr': False, 'use_adx': True, 'use_ema': True, 'use_spike': True, 'rsi_required': True, 'edge_k': 0.1269385306272528, 'edge_cap': 0.966194780955819, 'bull_strategy': 'breakout', 'bull_bb_std_mult': 3.130247706387383, 'bull_rsi_os': 15, 'bull_rsi_ob': 80, 'bull_adx_thresh': 10.186382162886808, 'bull_atr_min_pct': 0.005177805890274398, 'bull_atr_max_pct': 0.12916617933278435, 'bull_tp_mult': 2.4171698840950926, 'bull_tsl_mult': 0.4417952502031226, 'bull_time_stop': 131, 'bull_use_sma': False, 'bull_use_ema': True, 'bull_use_atr': True, 'bull_use_adx': True, 'bull_use_spike': True, 'bull_rsi_required': True, 'bear_strategy': 'mean_reversion', 'bear_bb_std_mult': 2.448824708493756, 'bear_rsi_os': 38, 'bear_rsi_ob': 94, 'bear_adx_thresh': 11.416678364143744, 'bear_atr_min_pct': 0.002010053456993642, 'bear_atr_max_pct': 0.11136094561225487, 'bear_tp_mult': 2.6059937702154614, 'bear_tsl_mult': 0.4827564486230588, 'bear_time_stop': 95, 'bear_use_sma': False, 'bear_use_ema': False, 'bear_use_atr': False, 'bear_use_adx': False, 'bear_use_spike': True, 'bear_rsi_required': False, 'sideways_strategy': 'mean_reversion', 'sideways_bb_std_mult': 3.178212000497342, 'sideways_rsi_os': 30, 'sideways_rsi_ob': 90, 'sideways_adx_thresh': 23.5961576696525, 'sideways_atr_min_pct': 0.0025756253091658698, 'sideways_atr_max_pct': 0.06185717960867356, 'sideways_tp_mult': 2.5042569832467976, 'sideways_tsl_mult': 0.2471334931151286, 'sideways_time_stop': 181, 'sideways_use_sma': True, 'sideways_use_ema': True, 'sideways_use_atr': False, 'sideways_use_adx': False, 'sideways_use_spike': False, 'sideways_rsi_required': False}.
[I 2025-09-01 14:57:36,277] Trial 617 finished with values: [-0.04307433907895697, 0.04290151976130019] and parameters: {'p_sma': 53, 'p_std': 29, 'p_atr': 26, 'p_adx': 9, 'rsi_period': 70, 'ema1': 15, 'ema2': 58, 'slip_atr_k': 0.017747040220543214, 'slip_spread_k': 0.5453948743408122, 'spread_hl_frac': 0.017400311595821394, 'bb_std_mult': 3.596695793685181, 'rsi_os': 41, 'rsi_ob': 56, 'vol_spike': 0.20199419646766764, 'adx_thresh': 21.12874061643506, 'atr_min_pct': 0.028862614180641295, 'atr_max_pct': 0.042546290169004186, 'tp_mult': 1.1238719685915424, 'tsl_mult': 0.19960548837705339, 'strategy': 'mean_reversion', 'time_stop': 82, 'use_sma': False, 'use_atr': False, 'use_adx': True, 'use_ema': True, 'use_spike': True, 'rsi_required': True, 'edge_k': 0.11815078211462815, 'edge_cap': 0.961018746362363, 'bull_strategy': 'breakout', 'bull_bb_std_mult': 3.197755780723255, 'bull_rsi_os': 15, 'bull_rsi_ob': 70, 'bull_adx_thresh': 33.76021327955297, 'bull_atr_min_pct': 0.010708852924816083, 'bull_atr_max_pct': 0.11617770945647181, 'bull_tp_mult': 1.9865702694229062, 'bull_tsl_mult': 0.46889832101599116, 'bull_time_stop': 159, 'bull_use_sma': False, 'bull_use_ema': True, 'bull_use_atr': True, 'bull_use_adx': True, 'bull_use_spike': True, 'bull_rsi_required': True, 'bear_strategy': 'mean_reversion', 'bear_bb_std_mult': 2.462140575501325, 'bear_rsi_os': 38, 'bear_rsi_ob': 81, 'bear_adx_thresh': 8.186168100348649, 'bear_atr_min_pct': 0.0010579760225549757, 'bear_atr_max_pct': 0.08415084621526828, 'bear_tp_mult': 2.042358041970607, 'bear_tsl_mult': 0.0928945322578709, 'bear_time_stop': 284, 'bear_use_sma': False, 'bear_use_ema': False, 'bear_use_atr': False, 'bear_use_adx': False, 'bear_use_spike': True, 'bear_rsi_required': False, 'sideways_strategy': 'mean_reversion', 'sideways_bb_std_mult': 3.1805412673125963, 'sideways_rsi_os': 30, 'sideways_rsi_ob': 93, 'sideways_adx_thresh': 24.41803118112903, 'sideways_atr_min_pct': 0.004237519039446606, 'sideways_atr_max_pct': 0.03851318368531171, 'sideways_tp_mult': 1.3124470367705339, 'sideways_tsl_mult': 0.32975257823791526, 'sideways_time_stop': 167, 'sideways_use_sma': True, 'sideways_use_ema': True, 'sideways_use_atr': False, 'sideways_use_adx': False, 'sideways_use_spike': False, 'sideways_rsi_required': False}.
[I 2025-09-01 14:58:14,445] Trial 619 finished with values: [-0.02348936326657114, 0.02652622430570137] and parameters: {'p_sma': 30, 'p_std': 6, 'p_atr': 26, 'p_adx': 9, 'rsi_period': 83, 'ema1': 16, 'ema2': 56, 'slip_atr_k': 0.021653695556954664, 'slip_spread_k': 0.5458634846593746, 'spread_hl_frac': 0.023380715095651046, 'bb_std_mult': 3.384877745574775, 'rsi_os': 41, 'rsi_ob': 59, 'vol_spike': 0.1348307811072118, 'adx_thresh': 7.0862405379602205, 'atr_min_pct': 0.019835695032063973, 'atr_max_pct': 0.028353928216333004, 'tp_mult': 1.3925425345948126, 'tsl_mult': 0.5924089192256706, 'strategy': 'mean_reversion', 'time_stop': 13, 'use_sma': False, 'use_atr': True, 'use_adx': True, 'use_ema': True, 'use_spike': True, 'rsi_required': True, 'edge_k': 0.8410152686528429, 'edge_cap': 0.9668511669952263, 'bull_strategy': 'breakout', 'bull_bb_std_mult': 0.7181121809125521, 'bull_rsi_os': 26, 'bull_rsi_ob': 50, 'bull_adx_thresh': 34.1500785427262, 'bull_atr_min_pct': 0.0051981650454699675, 'bull_atr_max_pct': 0.13337946964888706, 'bull_tp_mult': 1.256520302835015, 'bull_tsl_mult': 0.8364347023868008, 'bull_time_stop': 71, 'bull_use_sma': True, 'bull_use_ema': True, 'bull_use_atr': True, 'bull_use_adx': False, 'bull_use_spike': True, 'bull_rsi_required': True, 'bear_strategy': 'mean_reversion', 'bear_bb_std_mult': 2.452368519156311, 'bear_rsi_os': 38, 'bear_rsi_ob': 59, 'bear_adx_thresh': 19.87478208083641, 'bear_atr_min_pct': 0.0009512768161687669, 'bear_atr_max_pct': 0.11357761277636629, 'bear_tp_mult': 2.485633123980178, 'bear_tsl_mult': 0.31966327868918293, 'bear_time_stop': 94, 'bear_use_sma': False, 'bear_use_ema': False, 'bear_use_atr': False, 'bear_use_adx': False, 'bear_use_spike': True, 'bear_rsi_required': False, 'sideways_strategy': 'mean_reversion', 'sideways_bb_std_mult': 2.996323110577869, 'sideways_rsi_os': 35, 'sideways_rsi_ob': 64, 'sideways_adx_thresh': 26.57466304791766, 'sideways_atr_min_pct': 0.003940585990396383, 'sideways_atr_max_pct': 0.13316802129287694, 'sideways_tp_mult': 2.511570075066405, 'sideways_tsl_mult': 0.34474310815456644, 'sideways_time_stop': 289, 'sideways_use_sma': True, 'sideways_use_ema': False, 'sideways_use_atr': False, 'sideways_use_adx': False, 'sideways_use_spike': False, 'sideways_rsi_required': False}.
[I 2025-09-01 14:58:14,946] Trial 620 finished with values: [-1000000000.0, 1000000000.0] and parameters: {'p_sma': 41, 'p_std': 15, 'p_atr': 26, 'p_adx': 13, 'rsi_period': 78, 'ema1': 14, 'ema2': 58, 'slip_atr_k': 0.02067844550260967, 'slip_spread_k': 0.10700286162654232, 'spread_hl_frac': 0.00683319507358694, 'bb_std_mult': 3.2998671514376063, 'rsi_os': 41, 'rsi_ob': 56, 'vol_spike': 0.11038299275874393, 'adx_thresh': 10.66708577664052, 'atr_min_pct': 0.010117745158962082, 'atr_max_pct': 0.04182122992854754, 'tp_mult': 1.4072611650948037, 'tsl_mult': 0.6291965711331062, 'strategy': 'mean_reversion', 'time_stop': 127, 'use_sma': False, 'use_atr': True, 'use_adx': True, 'use_ema': True, 'use_spike': True, 'rsi_required': False, 'edge_k': 0.30006732954140486, 'edge_cap': 0.5632870417678721, 'bull_strategy': 'breakout', 'bull_bb_std_mult': 0.7514181919898977, 'bull_rsi_os': 12, 'bull_rsi_ob': 76, 'bull_adx_thresh': 12.625945891059374, 'bull_atr_min_pct': 0.02817978703779385, 'bull_atr_max_pct': 0.13501678777328704, 'bull_tp_mult': 1.9871330089561605, 'bull_tsl_mult': 0.4796895765483719, 'bull_time_stop': 71, 'bull_use_sma': True, 'bull_use_ema': True, 'bull_use_atr': True, 'bull_use_adx': False, 'bull_use_spike': True, 'bull_rsi_required': True, 'bear_strategy': 'mean_reversion', 'bear_bb_std_mult': 2.4708967344164923, 'bear_rsi_os': 33, 'bear_rsi_ob': 59, 'bear_adx_thresh': 19.782500802504003, 'bear_atr_min_pct': 0.0009595902348472601, 'bear_atr_max_pct': 0.10540701989083388, 'bear_tp_mult': 2.042247214971607, 'bear_tsl_mult': 0.32054578163575564, 'bear_time_stop': 156, 'bear_use_sma': False, 'bear_use_ema': True, 'bear_use_atr': False, 'bear_use_adx': False, 'bear_use_spike': False, 'bear_rsi_required': False, 'sideways_strategy': 'mean_reversion', 'sideways_bb_std_mult': 2.986724071202808, 'sideways_rsi_os': 27, 'sideways_rsi_ob': 83, 'sideways_adx_thresh': 8.564351235243537, 'sideways_atr_min_pct': 0.0043776083321305, 'sideways_atr_max_pct': 0.11686489504080691, 'sideways_tp_mult': 1.6212980298361728, 'sideways_tsl_mult': 0.36595281873758806, 'sideways_time_stop': 273, 'sideways_use_sma': False, 'sideways_use_ema': False, 'sideways_use_atr': False, 'sideways_use_adx': False, 'sideways_use_spike': False, 'sideways_rsi_required': False}.
[I 2025-09-01 14:58:14,947] Trial 621 finished with values: [-1000000000.0, 1000000000.0] and parameters: {'p_sma': 28, 'p_std': 26, 'p_atr': 26, 'p_adx': 7, 'rsi_period': 74, 'ema1': 9, 'ema2': 60, 'slip_atr_k': 0.15860528942767238, 'slip_spread_k': 0.5176889184451325, 'spread_hl_frac': 0.03049964579103374, 'bb_std_mult': 3.3877479321252792, 'rsi_os': 42, 'rsi_ob': 67, 'vol_spike': 0.2708733329796291, 'adx_thresh': 5.070320846175123, 'atr_min_pct': 0.020132929446979524, 'atr_max_pct': 0.11331571690163877, 'tp_mult': 2.3151452217085096, 'tsl_mult': 0.6262915239112165, 'strategy': 'mean_reversion', 'time_stop': 115, 'use_sma': False, 'use_atr': True, 'use_adx': True, 'use_ema': True, 'use_spike': True, 'rsi_required': False, 'edge_k': 0.28181353365413137, 'edge_cap': 0.5622778499934805, 'bull_strategy': 'breakout', 'bull_bb_std_mult': 1.9295263733417793, 'bull_rsi_os': 51, 'bull_rsi_ob': 77, 'bull_adx_thresh': 29.45982139263638, 'bull_atr_min_pct': 0.024793867194206325, 'bull_atr_max_pct': 0.012192564459271554, 'bull_tp_mult': 2.4912919032261662, 'bull_tsl_mult': 0.4721213261021393, 'bull_time_stop': 52, 'bull_use_sma': True, 'bull_use_ema': True, 'bull_use_atr': True, 'bull_use_adx': False, 'bull_use_spike': True, 'bull_rsi_required': True, 'bear_strategy': 'mean_reversion', 'bear_bb_std_mult': 2.786833033339159, 'bear_rsi_os': 34, 'bear_rsi_ob': 59, 'bear_adx_thresh': 5.968036830403825, 'bear_atr_min_pct': 0.003257069779801178, 'bear_atr_max_pct': 0.13040596880320832, 'bear_tp_mult': 1.515361424136766, 'bear_tsl_mult': 0.10608291987623558, 'bear_time_stop': 108, 'bear_use_sma': False, 'bear_use_ema': True, 'bear_use_atr': False, 'bear_use_adx': False, 'bear_use_spike': False, 'bear_rsi_required': False, 'sideways_strategy': 'mean_reversion', 'sideways_bb_std_mult': 3.007258037907853, 'sideways_rsi_os': 31, 'sideways_rsi_ob': 83, 'sideways_adx_thresh': 26.724594013827723, 'sideways_atr_min_pct': 0.004988941893566281, 'sideways_atr_max_pct': 0.11489516190254041, 'sideways_tp_mult': 2.1556748056568016, 'sideways_tsl_mult': 0.37083279642908196, 'sideways_time_stop': 280, 'sideways_use_sma': False, 'sideways_use_ema': False, 'sideways_use_atr': True, 'sideways_use_adx': True, 'sideways_use_spike': False, 'sideways_rsi_required': False}.
