[I 2025-09-01 14:58:14,958] Trial 618 finished with values: [-0.0035287884049793883, 0.006841579858223164] and parameters: {'p_sma': 53, 'p_std': 34, 'p_atr': 17, 'p_adx': 12, 'rsi_period': 83, 'ema1': 10, 'ema2': 58, 'slip_atr_k': 0.021901209683100258, 'slip_spread_k': 0.11458841318006263, 'spread_hl_frac': 0.0069302835599891945, 'bb_std_mult': 3.599899852891447, 'rsi_os': 41, 'rsi_ob': 56, 'vol_spike': 0.11090947415856411, 'adx_thresh': 34.45092083405824, 'atr_min_pct': 0.007766995532845896, 'atr_max_pct': 0.042008589655949974, 'tp_mult': 1.1230990297687715, 'tsl_mult': 0.537289670058126, 'strategy': 'mean_reversion', 'time_stop': 84, 'use_sma': False, 'use_atr': False, 'use_adx': True, 'use_ema': True, 'use_spike': True, 'rsi_required': True, 'edge_k': 0.8072919876995482, 'edge_cap': 0.5615572821962402, 'bull_strategy': 'breakout', 'bull_bb_std_mult': 0.747119164963929, 'bull_rsi_os': 23, 'bull_rsi_ob': 60, 'bull_adx_thresh': 28.771041742841806, 'bull_atr_min_pct': 0.010845441230448625, 'bull_atr_max_pct': 0.1339277816694899, 'bull_tp_mult': 1.6588196543131897, 'bull_tsl_mult': 0.46664336294258224, 'bull_time_stop': 71, 'bull_use_sma': True, 'bull_use_ema': True, 'bull_use_atr': True, 'bull_use_adx': False, 'bull_use_spike': True, 'bull_rsi_required': True, 'bear_strategy': 'mean_reversion', 'bear_bb_std_mult': 2.457386475798086, 'bear_rsi_os': 34, 'bear_rsi_ob': 59, 'bear_adx_thresh': 8.053759958892218, 'bear_atr_min_pct': 0.0008682423370448334, 'bear_atr_max_pct': 0.10444010899070534, 'bear_tp_mult': 1.5712155600367155, 'bear_tsl_mult': 0.962285851457495, 'bear_time_stop': 95, 'bear_use_sma': False, 'bear_use_ema': False, 'bear_use_atr': False, 'bear_use_adx': False, 'bear_use_spike': True, 'bear_rsi_required': False, 'sideways_strategy': 'mean_reversion', 'sideways_bb_std_mult': 3.0082036706229998, 'sideways_rsi_os': 31, 'sideways_rsi_ob': 93, 'sideways_adx_thresh': 21.72072457112446, 'sideways_atr_min_pct': 0.004243809198747291, 'sideways_atr_max_pct': 0.08720111058262318, 'sideways_tp_mult': 2.508499038449081, 'sideways_tsl_mult': 0.40151968145938294, 'sideways_time_stop': 272, 'sideways_use_sma': True, 'sideways_use_ema': False, 'sideways_use_atr': False, 'sideways_use_adx': False, 'sideways_use_spike': False, 'sideways_rsi_required': False}.
[I 2025-09-01 14:58:55,727] Trial 625 finished with values: [-1000000000.0, 1000000000.0] and parameters: {'p_sma': 26, 'p_std': 28, 'p_atr': 30, 'p_adx': 8, 'rsi_period': 67, 'ema1': 26, 'ema2': 39, 'slip_atr_k': 0.014776409691412067, 'slip_spread_k': 0.5726481705187972, 'spread_hl_frac': 0.03596178718353692, 'bb_std_mult': 1.7976642929217677, 'rsi_os': 6, 'rsi_ob': 54, 'vol_spike': 0.2150728820476408, 'adx_thresh': 5.598715305771703, 'atr_min_pct': 0.011977640958141704, 'atr_max_pct': 0.03165954170286408, 'tp_mult': 2.4878791443123136, 'tsl_mult': 0.7242114366302171, 'strategy': 'breakout', 'time_stop': 98, 'use_sma': True, 'use_atr': False, 'use_adx': True, 'use_ema': True, 'use_spike': True, 'rsi_required': True, 'edge_k': 0.035373315698302044, 'edge_cap': 0.11141874044140687, 'bull_strategy': 'breakout', 'bull_bb_std_mult': 3.3956208220683743, 'bull_rsi_os': 47, 'bull_rsi_ob': 75, 'bull_adx_thresh': 11.863252460580151, 'bull_atr_min_pct': 0.011677404121216494, 'bull_atr_max_pct': 0.07309745324048558, 'bull_tp_mult': 1.5474661708208455, 'bull_tsl_mult': 0.4487266492027072, 'bull_time_stop': 41, 'bull_use_sma': False, 'bull_use_ema': True, 'bull_use_atr': True, 'bull_use_adx': True, 'bull_use_spike': False, 'bull_rsi_required': True, 'bear_strategy': 'breakout', 'bear_bb_std_mult': 3.3771115645332905, 'bear_rsi_os': 36, 'bear_rsi_ob': 57, 'bear_adx_thresh': 7.356226819030613, 'bear_atr_min_pct': 0.0022034799249270485, 'bear_atr_max_pct': 0.1148641482820567, 'bear_tp_mult': 1.9589348331074676, 'bear_tsl_mult': 0.38761922152667155, 'bear_time_stop': 102, 'bear_use_sma': True, 'bear_use_ema': False, 'bear_use_atr': True, 'bear_use_adx': True, 'bear_use_spike': True, 'bear_rsi_required': False, 'sideways_strategy': 'mean_reversion', 'sideways_bb_std_mult': 3.104800511467721, 'sideways_rsi_os': 32, 'sideways_rsi_ob': 77, 'sideways_adx_thresh': 25.37212560324717, 'sideways_atr_min_pct': 0.0034705188880474027, 'sideways_atr_max_pct': 0.08058686111662938, 'sideways_tp_mult': 2.3813260112463017, 'sideways_tsl_mult': 0.41750630227301155, 'sideways_time_stop': 156, 'sideways_use_sma': True, 'sideways_use_ema': True, 'sideways_use_atr': True, 'sideways_use_adx': True, 'sideways_use_spike': True, 'sideways_rsi_required': True}.
[I 2025-09-01 14:58:55,957] Trial 622 finished with values: [-1000000000.0, 1000000000.0] and parameters: {'p_sma': 31, 'p_std': 32, 'p_atr': 20, 'p_adx': 8, 'rsi_period': 32, 'ema1': 26, 'ema2': 39, 'slip_atr_k': 0.005208369907997228, 'slip_spread_k': 0.574374346262544, 'spread_hl_frac': 0.010085035651674826, 'bb_std_mult': 1.785491666488055, 'rsi_os': 7, 'rsi_ob': 54, 'vol_spike': 0.10358111657759425, 'adx_thresh': 5.918075569474134, 'atr_min_pct': 0.014241024241440286, 'atr_max_pct': 0.10118171557255401, 'tp_mult': 1.361297379120503, 'tsl_mult': 0.12509308475812014, 'strategy': 'breakout', 'time_stop': 99, 'use_sma': True, 'use_atr': False, 'use_adx': True, 'use_ema': True, 'use_spike': True, 'rsi_required': True, 'edge_k': 0.22900259206269635, 'edge_cap': 0.11038857263137258, 'bull_strategy': 'breakout', 'bull_bb_std_mult': 3.3791060246176827, 'bull_rsi_os': 13, 'bull_rsi_ob': 89, 'bull_adx_thresh': 11.977556936155993, 'bull_atr_min_pct': 0.011578968429208403, 'bull_atr_max_pct': 0.1402009750254325, 'bull_tp_mult': 1.5863078792821175, 'bull_tsl_mult': 0.4483243590043487, 'bull_time_stop': 117, 'bull_use_sma': False, 'bull_use_ema': True, 'bull_use_atr': True, 'bull_use_adx': True, 'bull_use_spike': False, 'bull_rsi_required': True, 'bear_strategy': 'breakout', 'bear_bb_std_mult': 2.5718346974563064, 'bear_rsi_os': 55, 'bear_rsi_ob': 57, 'bear_adx_thresh': 13.416395572327781, 'bear_atr_min_pct': 0.011623910535739261, 'bear_atr_max_pct': 0.11567782384787696, 'bear_tp_mult': 2.075005137049626, 'bear_tsl_mult': 0.8375718278794303, 'bear_time_stop': 101, 'bear_use_sma': True, 'bear_use_ema': False, 'bear_use_atr': True, 'bear_use_adx': True, 'bear_use_spike': True, 'bear_rsi_required': False, 'sideways_strategy': 'mean_reversion', 'sideways_bb_std_mult': 3.108271588756994, 'sideways_rsi_os': 9, 'sideways_rsi_ob': 77, 'sideways_adx_thresh': 25.188586331727635, 'sideways_atr_min_pct': 0.0033939424336029826, 'sideways_atr_max_pct': 0.14356810250161722, 'sideways_tp_mult': 1.0923091329044095, 'sideways_tsl_mult': 0.5009036883276573, 'sideways_time_stop': 198, 'sideways_use_sma': True, 'sideways_use_ema': True, 'sideways_use_atr': True, 'sideways_use_adx': True, 'sideways_use_spike': True, 'sideways_rsi_required': True}.
[I 2025-09-01 14:58:56,312] Trial 623 finished with values: [-1000000000.0, 1000000000.0] and parameters: {'p_sma': 26, 'p_std': 25, 'p_atr': 27, 'p_adx': 8, 'rsi_period': 76, 'ema1': 9, 'ema2': 39, 'slip_atr_k': 0.0032663522315285846, 'slip_spread_k': 0.5722309382612988, 'spread_hl_frac': 0.009862878369645256, 'bb_std_mult': 3.483242360838739, 'rsi_os': 7, 'rsi_ob': 54, 'vol_spike': 0.09978767280908477, 'adx_thresh': 8.768961064636354, 'atr_min_pct': 0.011976730967698797, 'atr_max_pct': 0.03164661002751687, 'tp_mult': 1.3632894512726834, 'tsl_mult': 0.31388926109761484, 'strategy': 'breakout', 'time_stop': 99, 'use_sma': True, 'use_atr': False, 'use_adx': True, 'use_ema': True, 'use_spike': True, 'rsi_required': True, 'edge_k': 0.2549342682325036, 'edge_cap': 0.9799981951062783, 'bull_strategy': 'breakout', 'bull_bb_std_mult': 3.367992752166667, 'bull_rsi_os': 34, 'bull_rsi_ob': 85, 'bull_adx_thresh': 31.133012704279487, 'bull_atr_min_pct': 0.014868966818848825, 'bull_atr_max_pct': 0.12238172578594321, 'bull_tp_mult': 1.5700902085145918, 'bull_tsl_mult': 0.4486105427397075, 'bull_time_stop': 203, 'bull_use_sma': False, 'bull_use_ema': True, 'bull_use_atr': True, 'bull_use_adx': True, 'bull_use_spike': False, 'bull_rsi_required': True, 'bear_strategy': 'breakout', 'bear_bb_std_mult': 2.5758172489185744, 'bear_rsi_os': 19, 'bear_rsi_ob': 57, 'bear_adx_thresh': 6.72791105686664, 'bear_atr_min_pct': 0.0019410335401602334, 'bear_atr_max_pct': 0.11580870170293724, 'bear_tp_mult': 2.078853893022301, 'bear_tsl_mult': 0.1403730477936423, 'bear_time_stop': 101, 'bear_use_sma': True, 'bear_use_ema': False, 'bear_use_atr': True, 'bear_use_adx': True, 'bear_use_spike': True, 'bear_rsi_required': False, 'sideways_strategy': 'mean_reversion', 'sideways_bb_std_mult': 3.1087870064049614, 'sideways_rsi_os': 32, 'sideways_rsi_ob': 89, 'sideways_adx_thresh': 25.359530790735654, 'sideways_atr_min_pct': 0.0033954106438033784, 'sideways_atr_max_pct': 0.018053347789083775, 'sideways_tp_mult': 1.5386083668877244, 'sideways_tsl_mult': 0.4992648483958258, 'sideways_time_stop': 22, 'sideways_use_sma': True, 'sideways_use_ema': True, 'sideways_use_atr': True, 'sideways_use_adx': True, 'sideways_use_spike': True, 'sideways_rsi_required': True}.
[I 2025-09-01 14:58:56,446] Trial 624 finished with values: [-1000000000.0, 1000000000.0] and parameters: {'p_sma': 26, 'p_std': 28, 'p_atr': 27, 'p_adx': 8, 'rsi_period': 78, 'ema1': 21, 'ema2': 54, 'slip_atr_k': 0.08238870059273351, 'slip_spread_k': 0.32091049150050677, 'spread_hl_frac': 0.03644158442013836, 'bb_std_mult': 0.9186125678808694, 'rsi_os': 53, 'rsi_ob': 54, 'vol_spike': 0.09901176421393551, 'adx_thresh': 8.512290801153124, 'atr_min_pct': 0.012169176347047915, 'atr_max_pct': 0.03250481661185774, 'tp_mult': 2.4979714244708195, 'tsl_mult': 0.7152562866236023, 'strategy': 'breakout', 'time_stop': 101, 'use_sma': True, 'use_atr': False, 'use_adx': True, 'use_ema': True, 'use_spike': True, 'rsi_required': True, 'edge_k': 0.22516504216665686, 'edge_cap': 0.984911727887203, 'bull_strategy': 'breakout', 'bull_bb_std_mult': 3.382311885708637, 'bull_rsi_os': 47, 'bull_rsi_ob': 78, 'bull_adx_thresh': 19.070712122193495, 'bull_atr_min_pct': 0.015559059641972593, 'bull_atr_max_pct': 0.12227526310139859, 'bull_tp_mult': 1.5541361671170406, 'bull_tsl_mult': 0.767763400104629, 'bull_time_stop': 278, 'bull_use_sma': False, 'bull_use_ema': True, 'bull_use_atr': True, 'bull_use_adx': True, 'bull_use_spike': False, 'bull_rsi_required': True, 'bear_strategy': 'breakout', 'bear_bb_std_mult': 2.5962128124865007, 'bear_rsi_os': 19, 'bear_rsi_ob': 57, 'bear_adx_thresh': 6.593265021068764, 'bear_atr_min_pct': 0.009649129290893831, 'bear_atr_max_pct': 0.11482131441907785, 'bear_tp_mult': 2.1857121197845117, 'bear_tsl_mult': 0.14691707152664019, 'bear_time_stop': 101, 'bear_use_sma': True, 'bear_use_ema': False, 'bear_use_atr': True, 'bear_use_adx': True, 'bear_use_spike': True, 'bear_rsi_required': False, 'sideways_strategy': 'mean_reversion', 'sideways_bb_std_mult': 2.4553209643807414, 'sideways_rsi_os': 16, 'sideways_rsi_ob': 89, 'sideways_adx_thresh': 25.264882515997314, 'sideways_atr_min_pct': 0.0035995933524474956, 'sideways_atr_max_pct': 0.112747127431574, 'sideways_tp_mult': 2.025799838191575, 'sideways_tsl_mult': 0.12309281653716886, 'sideways_time_stop': 88, 'sideways_use_sma': True, 'sideways_use_ema': True, 'sideways_use_atr': True, 'sideways_use_adx': True, 'sideways_use_spike': True, 'sideways_rsi_required': True}.
[I 2025-09-01 14:59:37,649] Trial 628 finished with values: [-1000000000.0, 1000000000.0] and parameters: {'p_sma': 28, 'p_std': 24, 'p_atr': 25, 'p_adx': 7, 'rsi_period': 78, 'ema1': 8, 'ema2': 55, 'slip_atr_k': 0.012176116307746425, 'slip_spread_k': 0.6365664653714055, 'spread_hl_frac': 0.008256106081593103, 'bb_std_mult': 3.462561738002121, 'rsi_os': 21, 'rsi_ob': 52, 'vol_spike': 0.11329890638302545, 'adx_thresh': 6.656245852641825, 'atr_min_pct': 0.010610515165155918, 'atr_max_pct': 0.03646749307904981, 'tp_mult': 1.4189574332981358, 'tsl_mult': 0.6707891431178131, 'strategy': 'mean_reversion', 'time_stop': 168, 'use_sma': True, 'use_atr': False, 'use_adx': True, 'use_ema': False, 'use_spike': False, 'rsi_required': False, 'edge_k': 0.3371000450568554, 'edge_cap': 0.9275586847688998, 'bull_strategy': 'mean_reversion', 'bull_bb_std_mult': 3.2491497414083126, 'bull_rsi_os': 12, 'bull_rsi_ob': 77, 'bull_adx_thresh': 27.083946282746748, 'bull_atr_min_pct': 0.012613740904690052, 'bull_atr_max_pct': 0.13062125350380238, 'bull_tp_mult': 1.7346925706974758, 'bull_tsl_mult': 0.49154407411535217, 'bull_time_stop': 146, 'bull_use_sma': False, 'bull_use_ema': False, 'bull_use_atr': False, 'bull_use_adx': True, 'bull_use_spike': True, 'bull_rsi_required': False, 'bear_strategy': 'mean_reversion', 'bear_bb_std_mult': 1.9554846633078835, 'bear_rsi_os': 35, 'bear_rsi_ob': 47, 'bear_adx_thresh': 7.394397142955242, 'bear_atr_min_pct': 0.0032215445363235114, 'bear_atr_max_pct': 0.12129141867713858, 'bear_tp_mult': 2.0151450820533534, 'bear_tsl_mult': 0.10789067226228592, 'bear_time_stop': 85, 'bear_use_sma': False, 'bear_use_ema': True, 'bear_use_atr': False, 'bear_use_adx': False, 'bear_use_spike': False, 'bear_rsi_required': True, 'sideways_strategy': 'breakout', 'sideways_bb_std_mult': 1.14617291219007, 'sideways_rsi_os': 18, 'sideways_rsi_ob': 71, 'sideways_adx_thresh': 24.37972078414943, 'sideways_atr_min_pct': 0.022446175006064946, 'sideways_atr_max_pct': 0.11273002801320982, 'sideways_tp_mult': 2.4008360551136922, 'sideways_tsl_mult': 0.1484769128153386, 'sideways_time_stop': 233, 'sideways_use_sma': False, 'sideways_use_ema': True, 'sideways_use_atr': True, 'sideways_use_adx': True, 'sideways_use_spike': False, 'sideways_rsi_required': False}.
[I 2025-09-01 14:59:38,350] Trial 629 finished with values: [-1000000000.0, 1000000000.0] and parameters: {'p_sma': 7, 'p_std': 16, 'p_atr': 22, 'p_adx': 7, 'rsi_period': 48, 'ema1': 8, 'ema2': 55, 'slip_atr_k': 0.012549340289457997, 'slip_spread_k': 0.6435398263013516, 'spread_hl_frac': 0.021571005420370635, 'bb_std_mult': 2.863620403015428, 'rsi_os': 17, 'rsi_ob': 52, 'vol_spike': 0.11437083413604064, 'adx_thresh': 5.476295132652377, 'atr_min_pct': 0.010811075658164188, 'atr_max_pct': 0.05801270970383049, 'tp_mult': 2.9254191297476604, 'tsl_mult': 0.670231153010056, 'strategy': 'mean_reversion', 'time_stop': 115, 'use_sma': True, 'use_atr': False, 'use_adx': False, 'use_ema': False, 'use_spike': False, 'rsi_required': False, 'edge_k': 0.3336251435717956, 'edge_cap': 0.9327163426426927, 'bull_strategy': 'mean_reversion', 'bull_bb_std_mult': 3.2453835081187576, 'bull_rsi_os': 29, 'bull_rsi_ob': 62, 'bull_adx_thresh': 10.712488279220018, 'bull_atr_min_pct': 0.012501656119153576, 'bull_atr_max_pct': 0.016906840655825123, 'bull_tp_mult': 1.7524164267620521, 'bull_tsl_mult': 0.03928070480121448, 'bull_time_stop': 160, 'bull_use_sma': False, 'bull_use_ema': False, 'bull_use_atr': False, 'bull_use_adx': True, 'bull_use_spike': True, 'bull_rsi_required': False, 'bear_strategy': 'mean_reversion', 'bear_bb_std_mult': 1.9462932309101781, 'bear_rsi_os': 35, 'bear_rsi_ob': 55, 'bear_adx_thresh': 7.521184959267982, 'bear_atr_min_pct': 0.0033560840239870906, 'bear_atr_max_pct': 0.11170428818198407, 'bear_tp_mult': 2.7033979879223007, 'bear_tsl_mult': 0.7304380865616256, 'bear_time_stop': 85, 'bear_use_sma': False, 'bear_use_ema': True, 'bear_use_atr': False, 'bear_use_adx': False, 'bear_use_spike': False, 'bear_rsi_required': True, 'sideways_strategy': 'breakout', 'sideways_bb_std_mult': 2.8124401834243145, 'sideways_rsi_os': 31, 'sideways_rsi_ob': 92, 'sideways_adx_thresh': 24.560391549178853, 'sideways_atr_min_pct': 0.005281065810989603, 'sideways_atr_max_pct': 0.10749343834792942, 'sideways_tp_mult': 2.4020822348570814, 'sideways_tsl_mult': 0.38744178504758375, 'sideways_time_stop': 268, 'sideways_use_sma': False, 'sideways_use_ema': True, 'sideways_use_atr': True, 'sideways_use_adx': True, 'sideways_use_spike': False, 'sideways_rsi_required': False}.
[I 2025-09-01 14:59:38,614] Trial 626 finished with values: [-1000000000.0, 1000000000.0] and parameters: {'p_sma': 25, 'p_std': 26, 'p_atr': 18, 'p_adx': 7, 'rsi_period': 78, 'ema1': 9, 'ema2': 54, 'slip_atr_k': 0.09166236656482135, 'slip_spread_k': 0.45822687306707216, 'spread_hl_frac': 0.009633262074215894, 'bb_std_mult': 3.009060984123838, 'rsi_os': 42, 'rsi_ob': 69, 'vol_spike': 0.2518305470689727, 'adx_thresh': 5.956327006409468, 'atr_min_pct': 0.010370232168704035, 'atr_max_pct': 0.03552461592074999, 'tp_mult': 1.3569421092582998, 'tsl_mult': 0.6663852611750001, 'strategy': 'mean_reversion', 'time_stop': 170, 'use_sma': True, 'use_atr': False, 'use_adx': True, 'use_ema': False, 'use_spike': True, 'rsi_required': True, 'edge_k': 0.22892442054700907, 'edge_cap': 0.9831398451487525, 'bull_strategy': 'mean_reversion', 'bull_bb_std_mult': 3.270052774029446, 'bull_rsi_os': 13, 'bull_rsi_ob': 88, 'bull_adx_thresh': 17.975858109499185, 'bull_atr_min_pct': 0.015993922809625645, 'bull_atr_max_pct': 0.1396015183731766, 'bull_tp_mult': 1.5764386304963087, 'bull_tsl_mult': 0.6721381744876149, 'bull_time_stop': 158, 'bull_use_sma': False, 'bull_use_ema': True, 'bull_use_atr': True, 'bull_use_adx': True, 'bull_use_spike': True, 'bull_rsi_required': False, 'bear_strategy': 'mean_reversion', 'bear_bb_std_mult': 2.594042315438848, 'bear_rsi_os': 40, 'bear_rsi_ob': 74, 'bear_adx_thresh': 7.0751765344594455, 'bear_atr_min_pct': 0.009463735608260459, 'bear_atr_max_pct': 0.09515589308831676, 'bear_tp_mult': 2.202433807236404, 'bear_tsl_mult': 0.14255698423709795, 'bear_time_stop': 85, 'bear_use_sma': False, 'bear_use_ema': False, 'bear_use_atr': False, 'bear_use_adx': False, 'bear_use_spike': True, 'bear_rsi_required': False, 'sideways_strategy': 'mean_reversion', 'sideways_bb_std_mult': 2.462023589494329, 'sideways_rsi_os': 29, 'sideways_rsi_ob': 92, 'sideways_adx_thresh': 19.98011825616365, 'sideways_atr_min_pct': 0.022391997528654336, 'sideways_atr_max_pct': 0.11331577234008847, 'sideways_tp_mult': 2.619899286559978, 'sideways_tsl_mult': 0.13200993543580553, 'sideways_time_stop': 259, 'sideways_use_sma': True, 'sideways_use_ema': True, 'sideways_use_atr': True, 'sideways_use_adx': True, 'sideways_use_spike': False, 'sideways_rsi_required': False}.
[I 2025-09-01 14:59:39,092] Trial 627 finished with values: [-0.006738316284706669, 0.013999898617188396] and parameters: {'p_sma': 5, 'p_std': 20, 'p_atr': 22, 'p_adx': 15, 'rsi_period': 78, 'ema1': 9, 'ema2': 45, 'slip_atr_k': 0.08581915649373068, 'slip_spread_k': 0.58597911812455, 'spread_hl_frac': 0.008407227305835789, 'bb_std_mult': 0.9484562458196428, 'rsi_os': 21, 'rsi_ob': 52, 'vol_spike': 0.2428581520349995, 'adx_thresh': 5.000954088118455, 'atr_min_pct': 0.00853895779846517, 'atr_max_pct': 0.035976870116333395, 'tp_mult': 1.2675726033690637, 'tsl_mult': 0.6699343026845892, 'strategy': 'mean_reversion', 'time_stop': 183, 'use_sma': True, 'use_atr': False, 'use_adx': True, 'use_ema': False, 'use_spike': True, 'rsi_required': True, 'edge_k': 1.511234987368507, 'edge_cap': 0.9848494150337501, 'bull_strategy': 'mean_reversion', 'bull_bb_std_mult': 3.2524845625259022, 'bull_rsi_os': 29, 'bull_rsi_ob': 62, 'bull_adx_thresh': 27.41156316120515, 'bull_atr_min_pct': 0.015754496691734794, 'bull_atr_max_pct': 0.12262743861247982, 'bull_tp_mult': 1.744145695984944, 'bull_tsl_mult': 0.7799409094048098, 'bull_time_stop': 158, 'bull_use_sma': False, 'bull_use_ema': True, 'bull_use_atr': True, 'bull_use_adx': True, 'bull_use_spike': True, 'bull_rsi_required': False, 'bear_strategy': 'mean_reversion', 'bear_bb_std_mult': 2.277179454413155, 'bear_rsi_os': 43, 'bear_rsi_ob': 54, 'bear_adx_thresh': 6.653563081495873, 'bear_atr_min_pct': 0.003413237334353978, 'bear_atr_max_pct': 0.12103764854347705, 'bear_tp_mult': 2.700831017812222, 'bear_tsl_mult': 0.13338595809012527, 'bear_time_stop': 89, 'bear_use_sma': False, 'bear_use_ema': False, 'bear_use_atr': False, 'bear_use_adx': False, 'bear_use_spike': True, 'bear_rsi_required': True, 'sideways_strategy': 'mean_reversion', 'sideways_bb_std_mult': 3.066745058389518, 'sideways_rsi_os': 32, 'sideways_rsi_ob': 89, 'sideways_adx_thresh': 24.589417858658898, 'sideways_atr_min_pct': 0.005157353725029085, 'sideways_atr_max_pct': 0.02824876893228611, 'sideways_tp_mult': 1.9932768057970636, 'sideways_tsl_mult': 0.6443769883737107, 'sideways_time_stop': 88, 'sideways_use_sma': True, 'sideways_use_ema': True, 'sideways_use_atr': True, 'sideways_use_adx': True, 'sideways_use_spike': False, 'sideways_rsi_required': False}.
