[I 2025-08-31 02:26:23,148] Trial 507 finished with values: [-1000000000.0, 1000000000.0] and parameters: {'p_sma': 55, 'p_std': 47, 'p_atr': 28, 'p_adx': 25, 'rsi_period': 67, 'ema1': 5, 'ema2': 24, 'slip_atr_k': 0.009328575303327119, 'slip_spread_k': 0.14961487309532823, 'spread_hl_frac': 0.0049919462601390446, 'bb_std_mult': 1.6964840330469078, 'rsi_os': 38, 'rsi_ob': 70, 'vol_spike': 0.1806561473740796, 'adx_thresh': 21.08376255013601, 'atr_min_pct': 0.008081706150529295, 'atr_max_pct': 0.118942912890828, 'tp_mult': 1.0639103267757624, 'tsl_mult': 0.020877919290101618, 'strategy': 'mean_reversion', 'time_stop': 112, 'use_sma': False, 'use_atr': False, 'use_adx': True, 'use_ema': False, 'use_spike': True, 'rsi_required': True, 'edge_k': 0.553782911679628, 'edge_cap': 0.11030155667488763, 'bull_strategy': 'breakout', 'bull_bb_std_mult': 2.4456158000543295, 'bull_rsi_os': 49, 'bull_rsi_ob': 61, 'bull_adx_thresh': 7.165589927778225, 'bull_atr_min_pct': 5.989058206689715e-05, 'bull_atr_max_pct': 0.14904754477515963, 'bull_tp_mult': 2.2212761847487466, 'bull_tsl_mult': 0.2677167852924594, 'bull_time_stop': 130, 'bull_use_sma': True, 'bull_use_ema': False, 'bull_use_atr': False, 'bull_use_adx': True, 'bull_use_spike': True, 'bull_rsi_required': True, 'bear_strategy': 'mean_reversion', 'bear_bb_std_mult': 1.440527776677266, 'bear_rsi_os': 17, 'bear_rsi_ob': 45, 'bear_adx_thresh': 5.504045129238321, 'bear_atr_min_pct': 0.0062874846842073855, 'bear_atr_max_pct': 0.013494267195342349, 'bear_tp_mult': 2.0994426298750293, 'bear_tsl_mult': 0.7696208647217602, 'bear_time_stop': 6, 'bear_use_sma': False, 'bear_use_ema': True, 'bear_use_atr': False, 'bear_use_adx': True, 'bear_use_spike': True, 'bear_rsi_required': True, 'sideways_strategy': 'mean_reversion', 'sideways_bb_std_mult': 0.6463035779927063, 'sideways_rsi_os': 40, 'sideways_rsi_ob': 95, 'sideways_adx_thresh': 9.901230693820228, 'sideways_atr_min_pct': 0.027356082283563933, 'sideways_atr_max_pct': 0.0524781466055748, 'sideways_tp_mult': 1.812144164976393, 'sideways_tsl_mult': 0.6246680775105302, 'sideways_time_stop': 190, 'sideways_use_sma': True, 'sideways_use_ema': False, 'sideways_use_atr': True, 'sideways_use_adx': False, 'sideways_use_spike': False, 'sideways_rsi_required': False}.
[I 2025-08-31 02:26:24,554] Trial 504 finished with values: [-0.014268929306082256, 0.014199640411628288] and parameters: {'p_sma': 56, 'p_std': 45, 'p_atr': 28, 'p_adx': 25, 'rsi_period': 67, 'ema1': 5, 'ema2': 24, 'slip_atr_k': 0.007736153086465442, 'slip_spread_k': 0.1440511554197399, 'spread_hl_frac': 0.004765551781584588, 'bb_std_mult': 1.6967036003998062, 'rsi_os': 39, 'rsi_ob': 70, 'vol_spike': 0.17899900286736775, 'adx_thresh': 21.180858637184688, 'atr_min_pct': 0.008139531175408407, 'atr_max_pct': 0.11874938836078475, 'tp_mult': 1.0540705138410689, 'tsl_mult': 0.021563435560914564, 'strategy': 'mean_reversion', 'time_stop': 109, 'use_sma': True, 'use_atr': False, 'use_adx': False, 'use_ema': False, 'use_spike': False, 'rsi_required': True, 'edge_k': 0.5478711066886751, 'edge_cap': 0.13906129169564374, 'bull_strategy': 'breakout', 'bull_bb_std_mult': 2.428615018773324, 'bull_rsi_os': 50, 'bull_rsi_ob': 62, 'bull_adx_thresh': 7.320717127688383, 'bull_atr_min_pct': 4.906360899508018e-05, 'bull_atr_max_pct': 0.14987398480433367, 'bull_tp_mult': 2.265201388783003, 'bull_tsl_mult': 0.2788299841683482, 'bull_time_stop': 130, 'bull_use_sma': True, 'bull_use_ema': False, 'bull_use_atr': False, 'bull_use_adx': True, 'bull_use_spike': True, 'bull_rsi_required': True, 'bear_strategy': 'mean_reversion', 'bear_bb_std_mult': 1.3949603026541695, 'bear_rsi_os': 17, 'bear_rsi_ob': 45, 'bear_adx_thresh': 5.648946991559288, 'bear_atr_min_pct': 0.006219929403855698, 'bear_atr_max_pct': 0.013046925145625896, 'bear_tp_mult': 2.104399407159983, 'bear_tsl_mult': 0.7636918008059375, 'bear_time_stop': 6, 'bear_use_sma': False, 'bear_use_ema': False, 'bear_use_atr': False, 'bear_use_adx': True, 'bear_use_spike': False, 'bear_rsi_required': True, 'sideways_strategy': 'mean_reversion', 'sideways_bb_std_mult': 0.616844874230955, 'sideways_rsi_os': 40, 'sideways_rsi_ob': 95, 'sideways_adx_thresh': 9.90702541580919, 'sideways_atr_min_pct': 0.02764614891053178, 'sideways_atr_max_pct': 0.04904469469021047, 'sideways_tp_mult': 1.8232669186546853, 'sideways_tsl_mult': 0.637383562580951, 'sideways_time_stop': 191, 'sideways_use_sma': True, 'sideways_use_ema': False, 'sideways_use_atr': False, 'sideways_use_adx': False, 'sideways_use_spike': True, 'sideways_rsi_required': False}.
[I 2025-08-31 02:26:24,981] Trial 505 finished with values: [-1000000000.0, 1000000000.0] and parameters: {'p_sma': 56, 'p_std': 45, 'p_atr': 28, 'p_adx': 25, 'rsi_period': 67, 'ema1': 5, 'ema2': 24, 'slip_atr_k': 0.005604878201423826, 'slip_spread_k': 0.13635611562995667, 'spread_hl_frac': 0.004966916380224809, 'bb_std_mult': 1.6979657494223677, 'rsi_os': 39, 'rsi_ob': 70, 'vol_spike': 0.18127965796424128, 'adx_thresh': 20.28473430894912, 'atr_min_pct': 0.008112932298085157, 'atr_max_pct': 0.11845853377503984, 'tp_mult': 1.0504813366658905, 'tsl_mult': 0.027847288955649682, 'strategy': 'mean_reversion', 'time_stop': 110, 'use_sma': True, 'use_atr': False, 'use_adx': False, 'use_ema': False, 'use_spike': True, 'rsi_required': True, 'edge_k': 0.5331807562923807, 'edge_cap': 0.11056059401075348, 'bull_strategy': 'breakout', 'bull_bb_std_mult': 2.4818664389372245, 'bull_rsi_os': 47, 'bull_rsi_ob': 62, 'bull_adx_thresh': 7.204206842984013, 'bull_atr_min_pct': 5.193736104423634e-05, 'bull_atr_max_pct': 0.14980983635745368, 'bull_tp_mult': 2.218214283584815, 'bull_tsl_mult': 0.2652108679835085, 'bull_time_stop': 137, 'bull_use_sma': True, 'bull_use_ema': False, 'bull_use_atr': False, 'bull_use_adx': True, 'bull_use_spike': True, 'bull_rsi_required': True, 'bear_strategy': 'mean_reversion', 'bear_bb_std_mult': 1.3803126711918337, 'bear_rsi_os': 17, 'bear_rsi_ob': 45, 'bear_adx_thresh': 5.087923868005712, 'bear_atr_min_pct': 0.005383027148574245, 'bear_atr_max_pct': 0.012937759930988047, 'bear_tp_mult': 2.106539180871747, 'bear_tsl_mult': 0.7560681491835068, 'bear_time_stop': 5, 'bear_use_sma': False, 'bear_use_ema': True, 'bear_use_atr': False, 'bear_use_adx': True, 'bear_use_spike': False, 'bear_rsi_required': True, 'sideways_strategy': 'mean_reversion', 'sideways_bb_std_mult': 0.6343058698652049, 'sideways_rsi_os': 40, 'sideways_rsi_ob': 95, 'sideways_adx_thresh': 9.78121369938769, 'sideways_atr_min_pct': 0.027797861661501097, 'sideways_atr_max_pct': 0.052941092945678586, 'sideways_tp_mult': 1.8166962640736288, 'sideways_tsl_mult': 0.6352947981007817, 'sideways_time_stop': 190, 'sideways_use_sma': True, 'sideways_use_ema': False, 'sideways_use_atr': False, 'sideways_use_adx': False, 'sideways_use_spike': True, 'sideways_rsi_required': False}.
[I 2025-08-31 02:26:25,125] Trial 506 finished with values: [-0.014565541645756852, 0.014496162490785764] and parameters: {'p_sma': 55, 'p_std': 46, 'p_atr': 28, 'p_adx': 25, 'rsi_period': 67, 'ema1': 5, 'ema2': 24, 'slip_atr_k': 0.009567173704263465, 'slip_spread_k': 0.14246921428827963, 'spread_hl_frac': 0.005070548675357993, 'bb_std_mult': 1.6544742790929452, 'rsi_os': 38, 'rsi_ob': 70, 'vol_spike': 0.18112844580666682, 'adx_thresh': 20.21567711942622, 'atr_min_pct': 0.008279838968518083, 'atr_max_pct': 0.11863820943409402, 'tp_mult': 1.0560272972435758, 'tsl_mult': 0.03108953777211549, 'strategy': 'mean_reversion', 'time_stop': 109, 'use_sma': False, 'use_atr': False, 'use_adx': False, 'use_ema': False, 'use_spike': True, 'rsi_required': True, 'edge_k': 0.547341053058563, 'edge_cap': 0.11098338726856952, 'bull_strategy': 'breakout', 'bull_bb_std_mult': 2.4698696909793916, 'bull_rsi_os': 49, 'bull_rsi_ob': 61, 'bull_adx_thresh': 7.159398310081643, 'bull_atr_min_pct': 5.394636922209715e-05, 'bull_atr_max_pct': 0.14957738040863378, 'bull_tp_mult': 2.257459811882344, 'bull_tsl_mult': 0.2758743861019918, 'bull_time_stop': 129, 'bull_use_sma': False, 'bull_use_ema': False, 'bull_use_atr': False, 'bull_use_adx': True, 'bull_use_spike': True, 'bull_rsi_required': True, 'bear_strategy': 'mean_reversion', 'bear_bb_std_mult': 1.4392929855700023, 'bear_rsi_os': 17, 'bear_rsi_ob': 45, 'bear_adx_thresh': 5.133502242423463, 'bear_atr_min_pct': 0.0062348348947908645, 'bear_atr_max_pct': 0.012745767256866209, 'bear_tp_mult': 2.129172245017349, 'bear_tsl_mult': 0.7634111533893819, 'bear_time_stop': 6, 'bear_use_sma': False, 'bear_use_ema': True, 'bear_use_atr': False, 'bear_use_adx': True, 'bear_use_spike': True, 'bear_rsi_required': True, 'sideways_strategy': 'mean_reversion', 'sideways_bb_std_mult': 0.6383948586604242, 'sideways_rsi_os': 40, 'sideways_rsi_ob': 95, 'sideways_adx_thresh': 9.807761823486754, 'sideways_atr_min_pct': 0.027725301885108723, 'sideways_atr_max_pct': 0.05437197149867415, 'sideways_tp_mult': 1.8130658931736743, 'sideways_tsl_mult': 0.634722049845166, 'sideways_time_stop': 191, 'sideways_use_sma': True, 'sideways_use_ema': False, 'sideways_use_atr': False, 'sideways_use_adx': False, 'sideways_use_spike': True, 'sideways_rsi_required': False}.
[I 2025-08-31 02:26:58,071] Trial 508 finished with values: [-0.014338513015621723, 0.01426942318631091] and parameters: {'p_sma': 54, 'p_std': 45, 'p_atr': 28, 'p_adx': 27, 'rsi_period': 66, 'ema1': 5, 'ema2': 24, 'slip_atr_k': 0.004550466217397782, 'slip_spread_k': 0.14411644196139675, 'spread_hl_frac': 0.0038919245685718417, 'bb_std_mult': 1.6546354188886692, 'rsi_os': 37, 'rsi_ob': 71, 'vol_spike': 0.17688337910976895, 'adx_thresh': 19.529762753089, 'atr_min_pct': 0.008397138967681756, 'atr_max_pct': 0.11831888112249765, 'tp_mult': 1.0123627088270737, 'tsl_mult': 0.016918071519082735, 'strategy': 'mean_reversion', 'time_stop': 109, 'use_sma': True, 'use_atr': True, 'use_adx': False, 'use_ema': False, 'use_spike': False, 'rsi_required': True, 'edge_k': 0.5164787276102516, 'edge_cap': 0.14610025417403588, 'bull_strategy': 'breakout', 'bull_bb_std_mult': 2.5110371578658084, 'bull_rsi_os': 50, 'bull_rsi_ob': 60, 'bull_adx_thresh': 6.292073939016592, 'bull_atr_min_pct': 9.947774184835837e-05, 'bull_atr_max_pct': 0.1464485471357453, 'bull_tp_mult': 2.273000013380864, 'bull_tsl_mult': 0.2825746277004597, 'bull_time_stop': 141, 'bull_use_sma': False, 'bull_use_ema': False, 'bull_use_atr': False, 'bull_use_adx': True, 'bull_use_spike': True, 'bull_rsi_required': True, 'bear_strategy': 'mean_reversion', 'bear_bb_std_mult': 1.374375647581512, 'bear_rsi_os': 17, 'bear_rsi_ob': 46, 'bear_adx_thresh': 5.091441620066988, 'bear_atr_min_pct': 0.005721765558998717, 'bear_atr_max_pct': 0.010023675573740329, 'bear_tp_mult': 2.0789929833118572, 'bear_tsl_mult': 0.7560612794626859, 'bear_time_stop': 7, 'bear_use_sma': False, 'bear_use_ema': False, 'bear_use_atr': False, 'bear_use_adx': True, 'bear_use_spike': False, 'bear_rsi_required': True, 'sideways_strategy': 'mean_reversion', 'sideways_bb_std_mult': 0.5611246132597273, 'sideways_rsi_os': 40, 'sideways_rsi_ob': 95, 'sideways_adx_thresh': 10.290826598126008, 'sideways_atr_min_pct': 0.026322403331553577, 'sideways_atr_max_pct': 0.04871350694232918, 'sideways_tp_mult': 1.854287138753895, 'sideways_tsl_mult': 0.6367445179105178, 'sideways_time_stop': 197, 'sideways_use_sma': True, 'sideways_use_ema': False, 'sideways_use_atr': False, 'sideways_use_adx': False, 'sideways_use_spike': True, 'sideways_rsi_required': False}.
[I 2025-08-31 02:26:58,423] Trial 509 finished with values: [-0.017644719300446976, 0.017575635027909948] and parameters: {'p_sma': 54, 'p_std': 45, 'p_atr': 28, 'p_adx': 25, 'rsi_period': 66, 'ema1': 5, 'ema2': 23, 'slip_atr_k': 0.008278602840351808, 'slip_spread_k': 0.13730482513160508, 'spread_hl_frac': 0.004987685788914734, 'bb_std_mult': 1.624259628469737, 'rsi_os': 37, 'rsi_ob': 71, 'vol_spike': 0.17795272338651494, 'adx_thresh': 20.131038372683708, 'atr_min_pct': 0.008118524956895948, 'atr_max_pct': 0.12242020436656774, 'tp_mult': 1.0434717275336827, 'tsl_mult': 0.03982891955987872, 'strategy': 'mean_reversion', 'time_stop': 110, 'use_sma': True, 'use_atr': True, 'use_adx': False, 'use_ema': False, 'use_spike': False, 'rsi_required': True, 'edge_k': 0.5235078301440542, 'edge_cap': 0.1862025569798147, 'bull_strategy': 'breakout', 'bull_bb_std_mult': 2.488173776786057, 'bull_rsi_os': 50, 'bull_rsi_ob': 60, 'bull_adx_thresh': 6.475402999553021, 'bull_atr_min_pct': 5.570331251283922e-05, 'bull_atr_max_pct': 0.14672584261166285, 'bull_tp_mult': 2.2812617323916577, 'bull_tsl_mult': 0.28636903901647637, 'bull_time_stop': 141, 'bull_use_sma': False, 'bull_use_ema': True, 'bull_use_atr': False, 'bull_use_adx': True, 'bull_use_spike': True, 'bull_rsi_required': True, 'bear_strategy': 'mean_reversion', 'bear_bb_std_mult': 1.39647815746831, 'bear_rsi_os': 18, 'bear_rsi_ob': 46, 'bear_adx_thresh': 5.162850057853916, 'bear_atr_min_pct': 0.0052411827380118466, 'bear_atr_max_pct': 0.010066705078612098, 'bear_tp_mult': 2.124494356390896, 'bear_tsl_mult': 0.7563136143370867, 'bear_time_stop': 5, 'bear_use_sma': False, 'bear_use_ema': False, 'bear_use_atr': False, 'bear_use_adx': True, 'bear_use_spike': False, 'bear_rsi_required': True, 'sideways_strategy': 'mean_reversion', 'sideways_bb_std_mult': 0.5636333541413769, 'sideways_rsi_os': 40, 'sideways_rsi_ob': 95, 'sideways_adx_thresh': 9.783824715836191, 'sideways_atr_min_pct': 0.026366601493006698, 'sideways_atr_max_pct': 0.04851242684892763, 'sideways_tp_mult': 1.9005592428671132, 'sideways_tsl_mult': 0.6286081336414167, 'sideways_time_stop': 198, 'sideways_use_sma': True, 'sideways_use_ema': False, 'sideways_use_atr': False, 'sideways_use_adx': False, 'sideways_use_spike': True, 'sideways_rsi_required': False}.
[I 2025-08-31 02:26:58,763] Trial 511 finished with values: [-0.01433632860061429, 0.014266883046810706] and parameters: {'p_sma': 54, 'p_std': 46, 'p_atr': 28, 'p_adx': 27, 'rsi_period': 65, 'ema1': 5, 'ema2': 23, 'slip_atr_k': 0.01043956626396923, 'slip_spread_k': 0.16332587312254976, 'spread_hl_frac': 0.003812595810666631, 'bb_std_mult': 1.6333889376216741, 'rsi_os': 37, 'rsi_ob': 71, 'vol_spike': 0.18670658630084674, 'adx_thresh': 19.347464024924545, 'atr_min_pct': 0.00839313112488955, 'atr_max_pct': 0.12312728894853614, 'tp_mult': 1.0209572386776626, 'tsl_mult': 0.042143174448274576, 'strategy': 'mean_reversion', 'time_stop': 118, 'use_sma': True, 'use_atr': True, 'use_adx': False, 'use_ema': False, 'use_spike': False, 'rsi_required': True, 'edge_k': 0.5119018176057033, 'edge_cap': 0.21210513960125382, 'bull_strategy': 'breakout', 'bull_bb_std_mult': 2.503024589352753, 'bull_rsi_os': 50, 'bull_rsi_ob': 60, 'bull_adx_thresh': 6.204001498286493, 'bull_atr_min_pct': 0.0006096818300758174, 'bull_atr_max_pct': 0.14398015670244935, 'bull_tp_mult': 2.255456963155078, 'bull_tsl_mult': 0.2878293744710694, 'bull_time_stop': 140, 'bull_use_sma': False, 'bull_use_ema': True, 'bull_use_atr': False, 'bull_use_adx': True, 'bull_use_spike': True, 'bull_rsi_required': True, 'bear_strategy': 'mean_reversion', 'bear_bb_std_mult': 1.4490763255150143, 'bear_rsi_os': 16, 'bear_rsi_ob': 46, 'bear_adx_thresh': 5.048791178799822, 'bear_atr_min_pct': 0.006267109395642132, 'bear_atr_max_pct': 0.010054841495154962, 'bear_tp_mult': 2.0729626672190533, 'bear_tsl_mult': 0.7561935737156096, 'bear_time_stop': 6, 'bear_use_sma': False, 'bear_use_ema': False, 'bear_use_atr': False, 'bear_use_adx': False, 'bear_use_spike': False, 'bear_rsi_required': True, 'sideways_strategy': 'mean_reversion', 'sideways_bb_std_mult': 0.5617048808559466, 'sideways_rsi_os': 39, 'sideways_rsi_ob': 95, 'sideways_adx_thresh': 10.238263100299157, 'sideways_atr_min_pct': 0.02633341311695966, 'sideways_atr_max_pct': 0.047477520141548886, 'sideways_tp_mult': 1.9085671751814188, 'sideways_tsl_mult': 0.640966220332615, 'sideways_time_stop': 199, 'sideways_use_sma': True, 'sideways_use_ema': False, 'sideways_use_atr': False, 'sideways_use_adx': False, 'sideways_use_spike': True, 'sideways_rsi_required': True}.
[I 2025-08-31 02:26:58,941] Trial 510 finished with values: [-0.014591509014644899, 0.014522049605048142] and parameters: {'p_sma': 54, 'p_std': 46, 'p_atr': 28, 'p_adx': 27, 'rsi_period': 65, 'ema1': 5, 'ema2': 23, 'slip_atr_k': 0.011008033857351001, 'slip_spread_k': 0.1601674167826245, 'spread_hl_frac': 0.003249070448353544, 'bb_std_mult': 1.6250123372126846, 'rsi_os': 37, 'rsi_ob': 71, 'vol_spike': 0.18848379537170917, 'adx_thresh': 19.965145078581703, 'atr_min_pct': 0.00838370161049856, 'atr_max_pct': 0.12213185620494146, 'tp_mult': 1.0243128841569777, 'tsl_mult': 0.03491120420023539, 'strategy': 'mean_reversion', 'time_stop': 106, 'use_sma': True, 'use_atr': True, 'use_adx': False, 'use_ema': False, 'use_spike': False, 'rsi_required': True, 'edge_k': 0.5118946979620675, 'edge_cap': 0.21253052518442236, 'bull_strategy': 'breakout', 'bull_bb_std_mult': 2.480800810992049, 'bull_rsi_os': 50, 'bull_rsi_ob': 60, 'bull_adx_thresh': 6.385881016427501, 'bull_atr_min_pct': 7.653954684472898e-05, 'bull_atr_max_pct': 0.1472775581155853, 'bull_tp_mult': 2.2707350546562672, 'bull_tsl_mult': 0.29109192565371944, 'bull_time_stop': 141, 'bull_use_sma': False, 'bull_use_ema': True, 'bull_use_atr': False, 'bull_use_adx': True, 'bull_use_spike': True, 'bull_rsi_required': True, 'bear_strategy': 'mean_reversion', 'bear_bb_std_mult': 1.3889423329773818, 'bear_rsi_os': 18, 'bear_rsi_ob': 46, 'bear_adx_thresh': 5.067169614786136, 'bear_atr_min_pct': 0.006154323395803562, 'bear_atr_max_pct': 0.01024038525523492, 'bear_tp_mult': 2.0704407833599854, 'bear_tsl_mult': 0.7590129071858185, 'bear_time_stop': 10, 'bear_use_sma': False, 'bear_use_ema': False, 'bear_use_atr': False, 'bear_use_adx': False, 'bear_use_spike': False, 'bear_rsi_required': True, 'sideways_strategy': 'mean_reversion', 'sideways_bb_std_mult': 0.696612099866085, 'sideways_rsi_os': 41, 'sideways_rsi_ob': 95, 'sideways_adx_thresh': 10.344361733650745, 'sideways_atr_min_pct': 0.026307574971569228, 'sideways_atr_max_pct': 0.04893379289914159, 'sideways_tp_mult': 1.8639594831477224, 'sideways_tsl_mult': 0.6403181805731363, 'sideways_time_stop': 197, 'sideways_use_sma': True, 'sideways_use_ema': False, 'sideways_use_atr': False, 'sideways_use_adx': False, 'sideways_use_spike': True, 'sideways_rsi_required': True}.
[I 2025-08-31 02:27:31,590] Trial 513 finished with values: [-1000000000.0, 1000000000.0] and parameters: {'p_sma': 56, 'p_std': 44, 'p_atr': 29, 'p_adx': 27, 'rsi_period': 69, 'ema1': 5, 'ema2': 24, 'slip_atr_k': 0.012150435490868708, 'slip_spread_k': 0.13082045508560905, 'spread_hl_frac': 0.0035068160414725835, 'bb_std_mult': 1.6604981853983254, 'rsi_os': 37, 'rsi_ob': 71, 'vol_spike': 0.1853328110011033, 'adx_thresh': 19.314872183746782, 'atr_min_pct': 0.007325582528282685, 'atr_max_pct': 0.11776460657776779, 'tp_mult': 1.012579238103743, 'tsl_mult': 0.04268986947331166, 'strategy': 'mean_reversion', 'time_stop': 117, 'use_sma': True, 'use_atr': False, 'use_adx': True, 'use_ema': False, 'use_spike': False, 'rsi_required': True, 'edge_k': 0.5545500703853866, 'edge_cap': 0.15200114094392678, 'bull_strategy': 'breakout', 'bull_bb_std_mult': 2.425693864201582, 'bull_rsi_os': 50, 'bull_rsi_ob': 60, 'bull_adx_thresh': 5.377047827002762, 'bull_atr_min_pct': 0.024811532217677186, 'bull_atr_max_pct': 0.14317657486959748, 'bull_tp_mult': 2.2882958761004213, 'bull_tsl_mult': 0.2926597201162783, 'bull_time_stop': 141, 'bull_use_sma': False, 'bull_use_ema': False, 'bull_use_atr': False, 'bull_use_adx': True, 'bull_use_spike': True, 'bull_rsi_required': True, 'bear_strategy': 'mean_reversion', 'bear_bb_std_mult': 1.3564858007863707, 'bear_rsi_os': 16, 'bear_rsi_ob': 46, 'bear_adx_thresh': 5.631914952249639, 'bear_atr_min_pct': 0.006606367721952378, 'bear_atr_max_pct': 0.012884365428822181, 'bear_tp_mult': 2.0625923524247245, 'bear_tsl_mult': 0.7386198699503359, 'bear_time_stop': 5, 'bear_use_sma': False, 'bear_use_ema': False, 'bear_use_atr': False, 'bear_use_adx': False, 'bear_use_spike': False, 'bear_rsi_required': True, 'sideways_strategy': 'breakout', 'sideways_bb_std_mult': 0.7518066424335196, 'sideways_rsi_os': 41, 'sideways_rsi_ob': 94, 'sideways_adx_thresh': 10.220380137124655, 'sideways_atr_min_pct': 0.02718165856961078, 'sideways_atr_max_pct': 0.047515319141696204, 'sideways_tp_mult': 1.7692340755515048, 'sideways_tsl_mult': 0.6457917599708901, 'sideways_time_stop': 187, 'sideways_use_sma': True, 'sideways_use_ema': False, 'sideways_use_atr': False, 'sideways_use_adx': False, 'sideways_use_spike': True, 'sideways_rsi_required': True}.
