[I 2025-08-31 00:21:05,648] Trial 149 finished with values: [-1000000000.0, 1000000000.0] and parameters: {'p_sma': 22, 'p_std': 47, 'p_atr': 20, 'p_adx': 12, 'rsi_period': 30, 'ema1': 28, 'ema2': 38, 'slip_atr_k': 0.06294127152727409, 'slip_spread_k': 0.1666369430272593, 'spread_hl_frac': 0.011387625989634737, 'bb_std_mult': 3.494456667356429, 'rsi_os': 10, 'rsi_ob': 65, 'vol_spike': 0.00020628355215669865, 'adx_thresh': 12.263705795324913, 'atr_min_pct': 0.002486869712781356, 'atr_max_pct': 0.06819490411188973, 'tp_mult': 1.972989826838082, 'tsl_mult': 0.36850443389635923, 'strategy': 'breakout', 'time_stop': 34, 'use_sma': False, 'use_atr': True, 'use_adx': False, 'use_ema': False, 'use_spike': True, 'rsi_required': True, 'edge_k': 1.6930917958464464, 'edge_cap': 0.25714376138519696, 'bull_strategy': 'breakout', 'bull_bb_std_mult': 2.686219832779709, 'bull_rsi_os': 42, 'bull_rsi_ob': 66, 'bull_adx_thresh': 23.184486197387212, 'bull_atr_min_pct': 0.022061562691182954, 'bull_atr_max_pct': 0.0774297362864765, 'bull_tp_mult': 2.9578427289855407, 'bull_tsl_mult': 0.10566293677321636, 'bull_time_stop': 85, 'bull_use_sma': True, 'bull_use_ema': True, 'bull_use_atr': False, 'bull_use_adx': False, 'bull_use_spike': True, 'bull_rsi_required': False, 'bear_strategy': 'breakout', 'bear_bb_std_mult': 0.5011889561837662, 'bear_rsi_os': 13, 'bear_rsi_ob': 76, 'bear_adx_thresh': 27.10603675658407, 'bear_atr_min_pct': 0.026137350290214467, 'bear_atr_max_pct': 0.1343488776304185, 'bear_tp_mult': 1.9982303318726362, 'bear_tsl_mult': 0.1670952451081693, 'bear_time_stop': 235, 'bear_use_sma': False, 'bear_use_ema': True, 'bear_use_atr': False, 'bear_use_adx': True, 'bear_use_spike': True, 'bear_rsi_required': False, 'sideways_strategy': 'mean_reversion', 'sideways_bb_std_mult': 3.226442627810104, 'sideways_rsi_os': 43, 'sideways_rsi_ob': 81, 'sideways_adx_thresh': 31.666322038713197, 'sideways_atr_min_pct': 0.020065428154640602, 'sideways_atr_max_pct': 0.12013858768924758, 'sideways_tp_mult': 2.8086023282476575, 'sideways_tsl_mult': 0.625714893340186, 'sideways_time_stop': 213, 'sideways_use_sma': False, 'sideways_use_ema': False, 'sideways_use_atr': False, 'sideways_use_adx': False, 'sideways_use_spike': True, 'sideways_rsi_required': False}.
[I 2025-08-31 00:21:06,566] Trial 154 finished with values: [-1000000000.0, 1000000000.0] and parameters: {'p_sma': 51, 'p_std': 37, 'p_atr': 13, 'p_adx': 7, 'rsi_period': 34, 'ema1': 27, 'ema2': 29, 'slip_atr_k': 0.052225926436009276, 'slip_spread_k': 0.36129398873903545, 'spread_hl_frac': 0.021476110781407293, 'bb_std_mult': 3.240719378852491, 'rsi_os': 55, 'rsi_ob': 74, 'vol_spike': 0.2471775221758435, 'adx_thresh': 12.251451744388092, 'atr_min_pct': 0.0013275604285680593, 'atr_max_pct': 0.04799695010347122, 'tp_mult': 1.7060093874900315, 'tsl_mult': 0.095913385987249, 'strategy': 'breakout', 'time_stop': 102, 'use_sma': False, 'use_atr': False, 'use_adx': False, 'use_ema': False, 'use_spike': False, 'rsi_required': True, 'edge_k': 0.7431577112510115, 'edge_cap': 0.9214759080084982, 'bull_strategy': 'breakout', 'bull_bb_std_mult': 2.6588841881140026, 'bull_rsi_os': 38, 'bull_rsi_ob': 64, 'bull_adx_thresh': 12.962906375498578, 'bull_atr_min_pct': 0.0067353011737839915, 'bull_atr_max_pct': 0.09184359667041148, 'bull_tp_mult': 2.909631478620749, 'bull_tsl_mult': 0.23014966735347678, 'bull_time_stop': 154, 'bull_use_sma': False, 'bull_use_ema': True, 'bull_use_atr': False, 'bull_use_adx': True, 'bull_use_spike': False, 'bull_rsi_required': True, 'bear_strategy': 'mean_reversion', 'bear_bb_std_mult': 2.5330655479157222, 'bear_rsi_os': 35, 'bear_rsi_ob': 78, 'bear_adx_thresh': 16.53251464241754, 'bear_atr_min_pct': 0.009770904051133952, 'bear_atr_max_pct': 0.13760515639278278, 'bear_tp_mult': 2.0472425721250005, 'bear_tsl_mult': 0.17326353878952971, 'bear_time_stop': 27, 'bear_use_sma': False, 'bear_use_ema': False, 'bear_use_atr': True, 'bear_use_adx': False, 'bear_use_spike': False, 'bear_rsi_required': False, 'sideways_strategy': 'mean_reversion', 'sideways_bb_std_mult': 1.1536265387456934, 'sideways_rsi_os': 6, 'sideways_rsi_ob': 70, 'sideways_adx_thresh': 11.143673502270659, 'sideways_atr_min_pct': 0.0058810472762862425, 'sideways_atr_max_pct': 0.09798246112300286, 'sideways_tp_mult': 1.0878711338419818, 'sideways_tsl_mult': 0.43000705910150694, 'sideways_time_stop': 185, 'sideways_use_sma': True, 'sideways_use_ema': True, 'sideways_use_atr': True, 'sideways_use_adx': True, 'sideways_use_spike': False, 'sideways_rsi_required': False}.
[I 2025-08-31 00:21:36,373] Trial 156 finished with values: [-1000000000.0, 1000000000.0] and parameters: {'p_sma': 49, 'p_std': 38, 'p_atr': 13, 'p_adx': 30, 'rsi_period': 34, 'ema1': 8, 'ema2': 31, 'slip_atr_k': 0.10331553065948726, 'slip_spread_k': 0.40078546621807376, 'spread_hl_frac': 0.04417055670325799, 'bb_std_mult': 2.8583357290457654, 'rsi_os': 53, 'rsi_ob': 75, 'vol_spike': 0.24657413294524286, 'adx_thresh': 9.473061541976254, 'atr_min_pct': 0.0015437110413706492, 'atr_max_pct': 0.07931322913701956, 'tp_mult': 1.697008153459783, 'tsl_mult': 0.40109756933829976, 'strategy': 'breakout', 'time_stop': 235, 'use_sma': True, 'use_atr': False, 'use_adx': False, 'use_ema': False, 'use_spike': False, 'rsi_required': False, 'edge_k': 0.054899545408807926, 'edge_cap': 0.9302408306025207, 'bull_strategy': 'breakout', 'bull_bb_std_mult': 1.4386082362121841, 'bull_rsi_os': 36, 'bull_rsi_ob': 64, 'bull_adx_thresh': 13.23429658469844, 'bull_atr_min_pct': 0.02453421851315431, 'bull_atr_max_pct': 0.09406635560592451, 'bull_tp_mult': 1.7208157249771294, 'bull_tsl_mult': 0.3100920344615319, 'bull_time_stop': 152, 'bull_use_sma': False, 'bull_use_ema': False, 'bull_use_atr': True, 'bull_use_adx': True, 'bull_use_spike': False, 'bull_rsi_required': True, 'bear_strategy': 'mean_reversion', 'bear_bb_std_mult': 2.1569661124007733, 'bear_rsi_os': 42, 'bear_rsi_ob': 78, 'bear_adx_thresh': 18.053083383173924, 'bear_atr_min_pct': 0.009578370427292818, 'bear_atr_max_pct': 0.11518127935052784, 'bear_tp_mult': 1.9418041700860182, 'bear_tsl_mult': 0.18203798723535658, 'bear_time_stop': 30, 'bear_use_sma': False, 'bear_use_ema': False, 'bear_use_atr': True, 'bear_use_adx': False, 'bear_use_spike': False, 'bear_rsi_required': True, 'sideways_strategy': 'mean_reversion', 'sideways_bb_std_mult': 2.2928937771053275, 'sideways_rsi_os': 46, 'sideways_rsi_ob': 70, 'sideways_adx_thresh': 19.99940675278426, 'sideways_atr_min_pct': 0.02472803157102771, 'sideways_atr_max_pct': 0.10215782478374086, 'sideways_tp_mult': 1.101194175730666, 'sideways_tsl_mult': 0.7243381843059662, 'sideways_time_stop': 48, 'sideways_use_sma': True, 'sideways_use_ema': True, 'sideways_use_atr': True, 'sideways_use_adx': True, 'sideways_use_spike': False, 'sideways_rsi_required': False}.
[I 2025-08-31 00:21:36,577] Trial 157 finished with values: [-0.016389270838510828, 0.016324290867940558] and parameters: {'p_sma': 49, 'p_std': 23, 'p_atr': 13, 'p_adx': 30, 'rsi_period': 35, 'ema1': 27, 'ema2': 17, 'slip_atr_k': 0.013993718375724318, 'slip_spread_k': 0.5223353845691723, 'spread_hl_frac': 0.00380447381360793, 'bb_std_mult': 3.2386252728210216, 'rsi_os': 33, 'rsi_ob': 49, 'vol_spike': 0.2642135606256077, 'adx_thresh': 9.894792537586735, 'atr_min_pct': 0.0015655732054123625, 'atr_max_pct': 0.07914994445245455, 'tp_mult': 2.569014891479713, 'tsl_mult': 0.1865704609677062, 'strategy': 'breakout', 'time_stop': 208, 'use_sma': True, 'use_atr': False, 'use_adx': False, 'use_ema': False, 'use_spike': False, 'rsi_required': False, 'edge_k': 0.7429461647561523, 'edge_cap': 0.9273836958931964, 'bull_strategy': 'breakout', 'bull_bb_std_mult': 2.188001359210619, 'bull_rsi_os': 38, 'bull_rsi_ob': 69, 'bull_adx_thresh': 13.1148101382729, 'bull_atr_min_pct': 0.0013521118094297572, 'bull_atr_max_pct': 0.1071655370963449, 'bull_tp_mult': 2.8803578574851505, 'bull_tsl_mult': 0.2269645342451478, 'bull_time_stop': 153, 'bull_use_sma': False, 'bull_use_ema': False, 'bull_use_atr': True, 'bull_use_adx': True, 'bull_use_spike': False, 'bull_rsi_required': True, 'bear_strategy': 'mean_reversion', 'bear_bb_std_mult': 1.5894357855929806, 'bear_rsi_os': 42, 'bear_rsi_ob': 78, 'bear_adx_thresh': 24.911924132889034, 'bear_atr_min_pct': 0.009767656045484087, 'bear_atr_max_pct': 0.11374898301558864, 'bear_tp_mult': 1.9462443419392879, 'bear_tsl_mult': 0.17994694790653987, 'bear_time_stop': 66, 'bear_use_sma': False, 'bear_use_ema': False, 'bear_use_atr': True, 'bear_use_adx': False, 'bear_use_spike': False, 'bear_rsi_required': True, 'sideways_strategy': 'mean_reversion', 'sideways_bb_std_mult': 1.1628694803248572, 'sideways_rsi_os': 41, 'sideways_rsi_ob': 70, 'sideways_adx_thresh': 11.00528099553857, 'sideways_atr_min_pct': 0.02170259641328026, 'sideways_atr_max_pct': 0.143185192924223, 'sideways_tp_mult': 1.5974832790512137, 'sideways_tsl_mult': 0.024979191003126622, 'sideways_time_stop': 186, 'sideways_use_sma': True, 'sideways_use_ema': True, 'sideways_use_atr': True, 'sideways_use_adx': True, 'sideways_use_spike': False, 'sideways_rsi_required': False}.
[I 2025-08-31 00:21:36,775] Trial 158 finished with values: [-1000000000.0, 1000000000.0] and parameters: {'p_sma': 45, 'p_std': 42, 'p_atr': 14, 'p_adx': 30, 'rsi_period': 35, 'ema1': 8, 'ema2': 20, 'slip_atr_k': 0.01265604035803091, 'slip_spread_k': 0.09681496525043962, 'spread_hl_frac': 0.022906237981023668, 'bb_std_mult': 0.5367296067579697, 'rsi_os': 53, 'rsi_ob': 75, 'vol_spike': 0.2236369367172797, 'adx_thresh': 13.347355311067165, 'atr_min_pct': 0.0004841384477040113, 'atr_max_pct': 0.08173628404290699, 'tp_mult': 2.5769439792304727, 'tsl_mult': 0.7873661215619914, 'strategy': 'breakout', 'time_stop': 61, 'use_sma': True, 'use_atr': False, 'use_adx': True, 'use_ema': False, 'use_spike': False, 'rsi_required': False, 'edge_k': 1.7877849011427907, 'edge_cap': 0.20006675013123892, 'bull_strategy': 'breakout', 'bull_bb_std_mult': 2.8485432934500734, 'bull_rsi_os': 38, 'bull_rsi_ob': 70, 'bull_adx_thresh': 13.94916293575201, 'bull_atr_min_pct': 0.0012602990406809919, 'bull_atr_max_pct': 0.09585748251635794, 'bull_tp_mult': 1.4303830997124773, 'bull_tsl_mult': 0.31902042328489566, 'bull_time_stop': 52, 'bull_use_sma': False, 'bull_use_ema': False, 'bull_use_atr': True, 'bull_use_adx': True, 'bull_use_spike': False, 'bull_rsi_required': True, 'bear_strategy': 'mean_reversion', 'bear_bb_std_mult': 2.181332218164537, 'bear_rsi_os': 5, 'bear_rsi_ob': 69, 'bear_adx_thresh': 20.995350288824874, 'bear_atr_min_pct': 0.00801871244253622, 'bear_atr_max_pct': 0.1139833734623695, 'bear_tp_mult': 1.941556268367742, 'bear_tsl_mult': 0.24902141223898597, 'bear_time_stop': 76, 'bear_use_sma': False, 'bear_use_ema': False, 'bear_use_atr': True, 'bear_use_adx': False, 'bear_use_spike': False, 'bear_rsi_required': True, 'sideways_strategy': 'mean_reversion', 'sideways_bb_std_mult': 0.5776637317570485, 'sideways_rsi_os': 42, 'sideways_rsi_ob': 67, 'sideways_adx_thresh': 26.646116233530844, 'sideways_atr_min_pct': 0.024814587232748212, 'sideways_atr_max_pct': 0.08048613479544613, 'sideways_tp_mult': 2.331779079920656, 'sideways_tsl_mult': 0.4807572319978081, 'sideways_time_stop': 114, 'sideways_use_sma': True, 'sideways_use_ema': True, 'sideways_use_atr': True, 'sideways_use_adx': True, 'sideways_use_spike': False, 'sideways_rsi_required': False}.
[I 2025-08-31 00:21:36,915] Trial 155 finished with values: [-1000000000.0, 1000000000.0] and parameters: {'p_sma': 49, 'p_std': 38, 'p_atr': 13, 'p_adx': 7, 'rsi_period': 34, 'ema1': 26, 'ema2': 28, 'slip_atr_k': 0.1979093397951425, 'slip_spread_k': 0.4812518235893663, 'spread_hl_frac': 0.018215104554079913, 'bb_std_mult': 3.3634118790549072, 'rsi_os': 38, 'rsi_ob': 62, 'vol_spike': 0.12416937917306631, 'adx_thresh': 26.732859925245652, 'atr_min_pct': 0.00159659943412491, 'atr_max_pct': 0.06723340339368114, 'tp_mult': 1.695592177341481, 'tsl_mult': 0.91121569004936, 'strategy': 'breakout', 'time_stop': 232, 'use_sma': True, 'use_atr': False, 'use_adx': False, 'use_ema': False, 'use_spike': False, 'rsi_required': True, 'edge_k': 0.06748265400295295, 'edge_cap': 0.9232057222703648, 'bull_strategy': 'breakout', 'bull_bb_std_mult': 2.839400014644071, 'bull_rsi_os': 38, 'bull_rsi_ob': 69, 'bull_adx_thresh': 34.99864105184176, 'bull_atr_min_pct': 0.0011901627930144907, 'bull_atr_max_pct': 0.10760440724036771, 'bull_tp_mult': 1.7213030214144216, 'bull_tsl_mult': 0.22577875996547006, 'bull_time_stop': 154, 'bull_use_sma': False, 'bull_use_ema': True, 'bull_use_atr': False, 'bull_use_adx': True, 'bull_use_spike': False, 'bull_rsi_required': True, 'bear_strategy': 'mean_reversion', 'bear_bb_std_mult': 3.5222435245972705, 'bear_rsi_os': 14, 'bear_rsi_ob': 78, 'bear_adx_thresh': 33.50788836258649, 'bear_atr_min_pct': 0.009679135740533522, 'bear_atr_max_pct': 0.1371364790129376, 'bear_tp_mult': 1.9413938252823222, 'bear_tsl_mult': 0.17380335585990236, 'bear_time_stop': 78, 'bear_use_sma': False, 'bear_use_ema': False, 'bear_use_atr': True, 'bear_use_adx': False, 'bear_use_spike': False, 'bear_rsi_required': False, 'sideways_strategy': 'mean_reversion', 'sideways_bb_std_mult': 1.1383000212260124, 'sideways_rsi_os': 14, 'sideways_rsi_ob': 69, 'sideways_adx_thresh': 11.053334988878856, 'sideways_atr_min_pct': 0.024771107322036613, 'sideways_atr_max_pct': 0.12085387366476597, 'sideways_tp_mult': 2.855169779194023, 'sideways_tsl_mult': 0.48394615290194315, 'sideways_time_stop': 45, 'sideways_use_sma': True, 'sideways_use_ema': True, 'sideways_use_atr': True, 'sideways_use_adx': True, 'sideways_use_spike': False, 'sideways_rsi_required': False}.
[I 2025-08-31 00:22:06,180] Trial 159 finished with values: [-1000000000.0, 1000000000.0] and parameters: {'p_sma': 45, 'p_std': 43, 'p_atr': 14, 'p_adx': 22, 'rsi_period': 35, 'ema1': 27, 'ema2': 20, 'slip_atr_k': 0.010888667838196947, 'slip_spread_k': 0.48825000645882843, 'spread_hl_frac': 0.02267930752202287, 'bb_std_mult': 3.34321175378577, 'rsi_os': 24, 'rsi_ob': 83, 'vol_spike': 0.16002703233400012, 'adx_thresh': 17.10119656448092, 'atr_min_pct': 0.025690304959809167, 'atr_max_pct': 0.08224399015515696, 'tp_mult': 1.1868327864699015, 'tsl_mult': 0.18465516073700386, 'strategy': 'breakout', 'time_stop': 207, 'use_sma': True, 'use_atr': False, 'use_adx': True, 'use_ema': False, 'use_spike': False, 'rsi_required': False, 'edge_k': 1.7669075888865173, 'edge_cap': 0.9106096725465462, 'bull_strategy': 'mean_reversion', 'bull_bb_std_mult': 2.180602030520435, 'bull_rsi_os': 38, 'bull_rsi_ob': 69, 'bull_adx_thresh': 13.938103156611433, 'bull_atr_min_pct': 0.0013474650333117019, 'bull_atr_max_pct': 0.030070416166296875, 'bull_tp_mult': 2.863922909066961, 'bull_tsl_mult': 0.18493257173527305, 'bull_time_stop': 169, 'bull_use_sma': False, 'bull_use_ema': True, 'bull_use_atr': True, 'bull_use_adx': True, 'bull_use_spike': False, 'bull_rsi_required': False, 'bear_strategy': 'breakout', 'bear_bb_std_mult': 0.5707744550092055, 'bear_rsi_os': 51, 'bear_rsi_ob': 55, 'bear_adx_thresh': 20.68613336973905, 'bear_atr_min_pct': 0.010064168917684626, 'bear_atr_max_pct': 0.14466701946723634, 'bear_tp_mult': 1.9099995298888695, 'bear_tsl_mult': 0.8666018105293121, 'bear_time_stop': 76, 'bear_use_sma': False, 'bear_use_ema': False, 'bear_use_atr': True, 'bear_use_adx': True, 'bear_use_spike': False, 'bear_rsi_required': True, 'sideways_strategy': 'mean_reversion', 'sideways_bb_std_mult': 1.2229242601658017, 'sideways_rsi_os': 26, 'sideways_rsi_ob': 67, 'sideways_adx_thresh': 11.889016524433757, 'sideways_atr_min_pct': 0.02282976076018866, 'sideways_atr_max_pct': 0.1441371901870528, 'sideways_tp_mult': 2.3163034420066646, 'sideways_tsl_mult': 0.36629673599229645, 'sideways_time_stop': 113, 'sideways_use_sma': False, 'sideways_use_ema': False, 'sideways_use_atr': False, 'sideways_use_adx': False, 'sideways_use_spike': True, 'sideways_rsi_required': True}.
[I 2025-08-31 00:22:06,738] Trial 162 finished with values: [-1000000000.0, 1000000000.0] and parameters: {'p_sma': 48, 'p_std': 25, 'p_atr': 15, 'p_adx': 28, 'rsi_period': 36, 'ema1': 16, 'ema2': 17, 'slip_atr_k': 0.03259542222024139, 'slip_spread_k': 0.5121715819628428, 'spread_hl_frac': 0.009030574273834371, 'bb_std_mult': 1.2253269170793821, 'rsi_os': 33, 'rsi_ob': 73, 'vol_spike': 0.03061687340863343, 'adx_thresh': 29.691551976050285, 'atr_min_pct': 0.018736336440644194, 'atr_max_pct': 0.05384365816651356, 'tp_mult': 1.1919456855052193, 'tsl_mult': 0.18597570319388762, 'strategy': 'breakout', 'time_stop': 23, 'use_sma': True, 'use_atr': False, 'use_adx': True, 'use_ema': False, 'use_spike': False, 'rsi_required': False, 'edge_k': 0.7980827968372028, 'edge_cap': 0.7009688630421488, 'bull_strategy': 'mean_reversion', 'bull_bb_std_mult': 1.3096851048832088, 'bull_rsi_os': 40, 'bull_rsi_ob': 68, 'bull_adx_thresh': 16.44732096930858, 'bull_atr_min_pct': 0.0022491270720467406, 'bull_atr_max_pct': 0.061317996191904346, 'bull_tp_mult': 2.861109944258906, 'bull_tsl_mult': 0.1858064072574157, 'bull_time_stop': 167, 'bull_use_sma': False, 'bull_use_ema': True, 'bull_use_atr': False, 'bull_use_adx': True, 'bull_use_spike': False, 'bull_rsi_required': False, 'bear_strategy': 'breakout', 'bear_bb_std_mult': 0.5594118804443966, 'bear_rsi_os': 21, 'bear_rsi_ob': 45, 'bear_adx_thresh': 9.876799975278024, 'bear_atr_min_pct': 0.029224670604969097, 'bear_atr_max_pct': 0.14339668302404754, 'bear_tp_mult': 2.879320053204014, 'bear_tsl_mult': 0.26289941171615117, 'bear_time_stop': 52, 'bear_use_sma': True, 'bear_use_ema': False, 'bear_use_atr': True, 'bear_use_adx': True, 'bear_use_spike': False, 'bear_rsi_required': True, 'sideways_strategy': 'mean_reversion', 'sideways_bb_std_mult': 1.2222253640232805, 'sideways_rsi_os': 29, 'sideways_rsi_ob': 46, 'sideways_adx_thresh': 16.582247487743686, 'sideways_atr_min_pct': 0.022945952750092348, 'sideways_atr_max_pct': 0.1149756127626943, 'sideways_tp_mult': 2.9969856205626666, 'sideways_tsl_mult': 0.9120971657295063, 'sideways_time_stop': 152, 'sideways_use_sma': False, 'sideways_use_ema': False, 'sideways_use_atr': False, 'sideways_use_adx': False, 'sideways_use_spike': True, 'sideways_rsi_required': True}.
[I 2025-08-31 00:22:06,929] Trial 160 finished with values: [-1000000000.0, 1000000000.0] and parameters: {'p_sma': 45, 'p_std': 42, 'p_atr': 14, 'p_adx': 28, 'rsi_period': 36, 'ema1': 26, 'ema2': 20, 'slip_atr_k': 0.19776171640800577, 'slip_spread_k': 0.4802580626756504, 'spread_hl_frac': 0.003658895796692975, 'bb_std_mult': 2.01398056162938, 'rsi_os': 33, 'rsi_ob': 73, 'vol_spike': 0.02852206500934791, 'adx_thresh': 5.010976107969892, 'atr_min_pct': 0.02584034618684447, 'atr_max_pct': 0.06527478893101753, 'tp_mult': 1.1622091553564573, 'tsl_mult': 0.9034269952949968, 'strategy': 'breakout', 'time_stop': 61, 'use_sma': True, 'use_atr': False, 'use_adx': True, 'use_ema': False, 'use_spike': False, 'rsi_required': False, 'edge_k': 0.8156008300598032, 'edge_cap': 0.5898010572525957, 'bull_strategy': 'breakout', 'bull_bb_std_mult': 2.160400586557688, 'bull_rsi_os': 38, 'bull_rsi_ob': 61, 'bull_adx_thresh': 14.051024222107662, 'bull_atr_min_pct': 0.0012075275187134193, 'bull_atr_max_pct': 0.09594919891654298, 'bull_tp_mult': 2.8723693701266257, 'bull_tsl_mult': 0.1916197109658903, 'bull_time_stop': 168, 'bull_use_sma': False, 'bull_use_ema': True, 'bull_use_atr': False, 'bull_use_adx': True, 'bull_use_spike': False, 'bull_rsi_required': False, 'bear_strategy': 'breakout', 'bear_bb_std_mult': 3.470922403248526, 'bear_rsi_os': 22, 'bear_rsi_ob': 80, 'bear_adx_thresh': 20.840360456208263, 'bear_atr_min_pct': 0.010231486621273671, 'bear_atr_max_pct': 0.09274593379731336, 'bear_tp_mult': 1.9041127172003502, 'bear_tsl_mult': 0.2539942436000291, 'bear_time_stop': 53, 'bear_use_sma': False, 'bear_use_ema': False, 'bear_use_atr': True, 'bear_use_adx': True, 'bear_use_spike': False, 'bear_rsi_required': True, 'sideways_strategy': 'mean_reversion', 'sideways_bb_std_mult': 0.5689834209182769, 'sideways_rsi_os': 24, 'sideways_rsi_ob': 65, 'sideways_adx_thresh': 26.432036350111893, 'sideways_atr_min_pct': 0.022870428233447333, 'sideways_atr_max_pct': 0.1424828622974306, 'sideways_tp_mult': 2.85022475291455, 'sideways_tsl_mult': 0.4097083538589432, 'sideways_time_stop': 113, 'sideways_use_sma': False, 'sideways_use_ema': False, 'sideways_use_atr': False, 'sideways_use_adx': False, 'sideways_use_spike': True, 'sideways_rsi_required': True}.
