[I 2025-08-31 00:36:27,796] Trial 295 finished with values: [-1000000000.0, 1000000000.0] and parameters: {'p_sma': 16, 'p_std': 9, 'p_atr': 21, 'p_adx': 8, 'rsi_period': 56, 'ema1': 8, 'ema2': 18, 'slip_atr_k': 0.037565504274012326, 'slip_spread_k': 0.39355141797402626, 'spread_hl_frac': 0.009920066275908121, 'bb_std_mult': 2.130566225741685, 'rsi_os': 41, 'rsi_ob': 55, 'vol_spike': 0.1474373452402793, 'adx_thresh': 10.304142463434896, 'atr_min_pct': 0.007089608891392896, 'atr_max_pct': 0.06901318925563711, 'tp_mult': 2.5850808011451947, 'tsl_mult': 0.30686179163915506, 'strategy': 'breakout', 'time_stop': 79, 'use_sma': True, 'use_atr': False, 'use_adx': True, 'use_ema': True, 'use_spike': False, 'rsi_required': False, 'edge_k': 0.7336667863017733, 'edge_cap': 0.49705297318140473, 'bull_strategy': 'mean_reversion', 'bull_bb_std_mult': 1.2344970045293593, 'bull_rsi_os': 53, 'bull_rsi_ob': 69, 'bull_adx_thresh': 32.96781475640462, 'bull_atr_min_pct': 0.01629323677099402, 'bull_atr_max_pct': 0.018506316125607415, 'bull_tp_mult': 2.498383325977427, 'bull_tsl_mult': 0.959011396836192, 'bull_time_stop': 165, 'bull_use_sma': False, 'bull_use_ema': False, 'bull_use_atr': True, 'bull_use_adx': False, 'bull_use_spike': False, 'bull_rsi_required': True, 'bear_strategy': 'mean_reversion', 'bear_bb_std_mult': 1.6991305215876156, 'bear_rsi_os': 24, 'bear_rsi_ob': 79, 'bear_adx_thresh': 15.308894509790257, 'bear_atr_min_pct': 0.02136801622335828, 'bear_atr_max_pct': 0.11130653285576711, 'bear_tp_mult': 1.899019662200354, 'bear_tsl_mult': 0.6433707111949052, 'bear_time_stop': 242, 'bear_use_sma': True, 'bear_use_ema': False, 'bear_use_atr': False, 'bear_use_adx': False, 'bear_use_spike': False, 'bear_rsi_required': False, 'sideways_strategy': 'mean_reversion', 'sideways_bb_std_mult': 0.5916046227229461, 'sideways_rsi_os': 25, 'sideways_rsi_ob': 88, 'sideways_adx_thresh': 10.544153707070656, 'sideways_atr_min_pct': 0.002667903454096515, 'sideways_atr_max_pct': 0.09608958895580236, 'sideways_tp_mult': 1.8406786657768652, 'sideways_tsl_mult': 0.6677873240678958, 'sideways_time_stop': 178, 'sideways_use_sma': True, 'sideways_use_ema': True, 'sideways_use_atr': False, 'sideways_use_adx': False, 'sideways_use_spike': True, 'sideways_rsi_required': False}.
[I 2025-08-31 00:36:56,878] Trial 298 finished with values: [-1000000000.0, 1000000000.0] and parameters: {'p_sma': 44, 'p_std': 41, 'p_atr': 21, 'p_adx': 8, 'rsi_period': 55, 'ema1': 7, 'ema2': 20, 'slip_atr_k': 0.13926152211303236, 'slip_spread_k': 0.2502430368024428, 'spread_hl_frac': 0.03572898132122531, 'bb_std_mult': 1.1468235224730807, 'rsi_os': 17, 'rsi_ob': 60, 'vol_spike': 0.2702987650561381, 'adx_thresh': 12.303450677061848, 'atr_min_pct': 0.018189880194486793, 'atr_max_pct': 0.14184028305871638, 'tp_mult': 1.3502383807242242, 'tsl_mult': 0.1607792575582771, 'strategy': 'breakout', 'time_stop': 185, 'use_sma': False, 'use_atr': False, 'use_adx': False, 'use_ema': True, 'use_spike': False, 'rsi_required': False, 'edge_k': 1.6228959934910518, 'edge_cap': 0.8397903532551814, 'bull_strategy': 'breakout', 'bull_bb_std_mult': 1.6880759077566372, 'bull_rsi_os': 37, 'bull_rsi_ob': 70, 'bull_adx_thresh': 14.509324281618222, 'bull_atr_min_pct': 0.001471973239248421, 'bull_atr_max_pct': 0.06981386322975282, 'bull_tp_mult': 2.502398667933459, 'bull_tsl_mult': 0.33389975092395113, 'bull_time_stop': 97, 'bull_use_sma': False, 'bull_use_ema': False, 'bull_use_atr': True, 'bull_use_adx': True, 'bull_use_spike': True, 'bull_rsi_required': False, 'bear_strategy': 'mean_reversion', 'bear_bb_std_mult': 1.9222532265269612, 'bear_rsi_os': 22, 'bear_rsi_ob': 83, 'bear_adx_thresh': 6.98606367179183, 'bear_atr_min_pct': 0.009475161948704399, 'bear_atr_max_pct': 0.019928204381858373, 'bear_tp_mult': 1.5158049766943718, 'bear_tsl_mult': 0.638556609065415, 'bear_time_stop': 105, 'bear_use_sma': True, 'bear_use_ema': False, 'bear_use_atr': False, 'bear_use_adx': False, 'bear_use_spike': False, 'bear_rsi_required': False, 'sideways_strategy': 'mean_reversion', 'sideways_bb_std_mult': 1.1346140189728202, 'sideways_rsi_os': 46, 'sideways_rsi_ob': 85, 'sideways_adx_thresh': 7.264821250678441, 'sideways_atr_min_pct': 0.01998549116910326, 'sideways_atr_max_pct': 0.03851966635847729, 'sideways_tp_mult': 1.0630780428537638, 'sideways_tsl_mult': 0.6238793851697982, 'sideways_time_stop': 30, 'sideways_use_sma': True, 'sideways_use_ema': False, 'sideways_use_atr': False, 'sideways_use_adx': True, 'sideways_use_spike': False, 'sideways_rsi_required': False}.
[I 2025-08-31 00:36:57,265] Trial 299 finished with values: [-1000000000.0, 1000000000.0] and parameters: {'p_sma': 47, 'p_std': 9, 'p_atr': 27, 'p_adx': 9, 'rsi_period': 62, 'ema1': 7, 'ema2': 20, 'slip_atr_k': 0.2081479339484058, 'slip_spread_k': 0.8202267540978854, 'spread_hl_frac': 0.01086964219826223, 'bb_std_mult': 1.1623172245914428, 'rsi_os': 29, 'rsi_ob': 82, 'vol_spike': 0.2870985030769775, 'adx_thresh': 6.921925124557335, 'atr_min_pct': 0.003399404191933534, 'atr_max_pct': 0.14216592202372674, 'tp_mult': 2.578238486358831, 'tsl_mult': 0.34634349849242324, 'strategy': 'breakout', 'time_stop': 79, 'use_sma': False, 'use_atr': False, 'use_adx': False, 'use_ema': True, 'use_spike': False, 'rsi_required': False, 'edge_k': 0.8314889373164235, 'edge_cap': 0.2678646318415945, 'bull_strategy': 'breakout', 'bull_bb_std_mult': 3.1121519772447703, 'bull_rsi_os': 53, 'bull_rsi_ob': 70, 'bull_adx_thresh': 21.700163944646174, 'bull_atr_min_pct': 0.0018640502529611842, 'bull_atr_max_pct': 0.08068879591110478, 'bull_tp_mult': 1.6205590980216322, 'bull_tsl_mult': 0.9499026909596249, 'bull_time_stop': 159, 'bull_use_sma': False, 'bull_use_ema': False, 'bull_use_atr': True, 'bull_use_adx': True, 'bull_use_spike': True, 'bull_rsi_required': False, 'bear_strategy': 'mean_reversion', 'bear_bb_std_mult': 0.8683648001965095, 'bear_rsi_os': 19, 'bear_rsi_ob': 95, 'bear_adx_thresh': 10.508545113272511, 'bear_atr_min_pct': 0.010309170459159337, 'bear_atr_max_pct': 0.019571068424259045, 'bear_tp_mult': 1.8842183212396493, 'bear_tsl_mult': 0.7582039905382821, 'bear_time_stop': 109, 'bear_use_sma': True, 'bear_use_ema': False, 'bear_use_atr': False, 'bear_use_adx': True, 'bear_use_spike': False, 'bear_rsi_required': False, 'sideways_strategy': 'mean_reversion', 'sideways_bb_std_mult': 1.06633757430999, 'sideways_rsi_os': 45, 'sideways_rsi_ob': 85, 'sideways_adx_thresh': 10.454046466489814, 'sideways_atr_min_pct': 0.011461624238030444, 'sideways_atr_max_pct': 0.14190256966629644, 'sideways_tp_mult': 1.6466093321456365, 'sideways_tsl_mult': 0.72578477987712, 'sideways_time_stop': 12, 'sideways_use_sma': True, 'sideways_use_ema': False, 'sideways_use_atr': False, 'sideways_use_adx': True, 'sideways_use_spike': False, 'sideways_rsi_required': False}.
[I 2025-08-31 00:36:58,148] Trial 300 finished with values: [-1000000000.0, 1000000000.0] and parameters: {'p_sma': 47, 'p_std': 39, 'p_atr': 17, 'p_adx': 8, 'rsi_period': 60, 'ema1': 7, 'ema2': 20, 'slip_atr_k': 0.16215174748746558, 'slip_spread_k': 0.3909087215936945, 'spread_hl_frac': 0.010774630091379637, 'bb_std_mult': 1.4274235655245298, 'rsi_os': 29, 'rsi_ob': 82, 'vol_spike': 0.27162876291239824, 'adx_thresh': 13.373807637071309, 'atr_min_pct': 0.011437228276820522, 'atr_max_pct': 0.07668898494868683, 'tp_mult': 2.570284644206832, 'tsl_mult': 0.3811177430322565, 'strategy': 'breakout', 'time_stop': 184, 'use_sma': False, 'use_atr': False, 'use_adx': False, 'use_ema': True, 'use_spike': False, 'rsi_required': False, 'edge_k': 0.5332150708265515, 'edge_cap': 0.825281643202492, 'bull_strategy': 'breakout', 'bull_bb_std_mult': 2.7823709113846933, 'bull_rsi_os': 11, 'bull_rsi_ob': 93, 'bull_adx_thresh': 33.55306715196784, 'bull_atr_min_pct': 0.0016385748221953156, 'bull_atr_max_pct': 0.08040738723750335, 'bull_tp_mult': 1.6153758252593122, 'bull_tsl_mult': 0.18286216381024156, 'bull_time_stop': 177, 'bull_use_sma': False, 'bull_use_ema': False, 'bull_use_atr': True, 'bull_use_adx': True, 'bull_use_spike': True, 'bull_rsi_required': False, 'bear_strategy': 'mean_reversion', 'bear_bb_std_mult': 1.0495381713473226, 'bear_rsi_os': 20, 'bear_rsi_ob': 66, 'bear_adx_thresh': 18.086524340713087, 'bear_atr_min_pct': 0.010307504588358002, 'bear_atr_max_pct': 0.04921054644370437, 'bear_tp_mult': 1.5840103820915532, 'bear_tsl_mult': 0.6998477814788171, 'bear_time_stop': 29, 'bear_use_sma': True, 'bear_use_ema': False, 'bear_use_atr': False, 'bear_use_adx': True, 'bear_use_spike': False, 'bear_rsi_required': True, 'sideways_strategy': 'mean_reversion', 'sideways_bb_std_mult': 1.0713969177161045, 'sideways_rsi_os': 52, 'sideways_rsi_ob': 86, 'sideways_adx_thresh': 14.575968196957366, 'sideways_atr_min_pct': 0.021366321015196196, 'sideways_atr_max_pct': 0.14057537707241022, 'sideways_tp_mult': 1.8412925974954775, 'sideways_tsl_mult': 0.5496691872743664, 'sideways_time_stop': 30, 'sideways_use_sma': True, 'sideways_use_ema': False, 'sideways_use_atr': False, 'sideways_use_adx': True, 'sideways_use_spike': False, 'sideways_rsi_required': False}.
[I 2025-08-31 00:36:58,211] Trial 301 finished with values: [-1000000000.0, 1000000000.0] and parameters: {'p_sma': 47, 'p_std': 29, 'p_atr': 17, 'p_adx': 24, 'rsi_period': 61, 'ema1': 6, 'ema2': 20, 'slip_atr_k': 0.11212453609942016, 'slip_spread_k': 0.19736565937925055, 'spread_hl_frac': 0.007398212238782221, 'bb_std_mult': 1.479255269951276, 'rsi_os': 17, 'rsi_ob': 91, 'vol_spike': 0.2997075170377066, 'adx_thresh': 13.33887165238034, 'atr_min_pct': 0.020872072161791013, 'atr_max_pct': 0.07675246566728719, 'tp_mult': 2.546083330438013, 'tsl_mult': 0.15335792087409295, 'strategy': 'breakout', 'time_stop': 87, 'use_sma': False, 'use_atr': True, 'use_adx': False, 'use_ema': True, 'use_spike': False, 'rsi_required': False, 'edge_k': 0.5265305900587482, 'edge_cap': 0.8226964742135026, 'bull_strategy': 'breakout', 'bull_bb_std_mult': 1.4375403541507974, 'bull_rsi_os': 37, 'bull_rsi_ob': 93, 'bull_adx_thresh': 14.794233947877979, 'bull_atr_min_pct': 0.0014288533088990256, 'bull_atr_max_pct': 0.07955964816066846, 'bull_tp_mult': 2.473569403934647, 'bull_tsl_mult': 0.8861072138680288, 'bull_time_stop': 134, 'bull_use_sma': True, 'bull_use_ema': False, 'bull_use_atr': True, 'bull_use_adx': True, 'bull_use_spike': True, 'bull_rsi_required': False, 'bear_strategy': 'mean_reversion', 'bear_bb_std_mult': 2.2956796557154493, 'bear_rsi_os': 19, 'bear_rsi_ob': 93, 'bear_adx_thresh': 7.740986343971233, 'bear_atr_min_pct': 0.013413963446080618, 'bear_atr_max_pct': 0.11897559364619803, 'bear_tp_mult': 1.5787917817537838, 'bear_tsl_mult': 0.7520386683448265, 'bear_time_stop': 138, 'bear_use_sma': True, 'bear_use_ema': False, 'bear_use_atr': False, 'bear_use_adx': True, 'bear_use_spike': False, 'bear_rsi_required': True, 'sideways_strategy': 'mean_reversion', 'sideways_bb_std_mult': 1.1175075579453677, 'sideways_rsi_os': 11, 'sideways_rsi_ob': 85, 'sideways_adx_thresh': 14.453499904606868, 'sideways_atr_min_pct': 0.01931080329215596, 'sideways_atr_max_pct': 0.1412636241826905, 'sideways_tp_mult': 1.6186197192785914, 'sideways_tsl_mult': 0.8439997002960181, 'sideways_time_stop': 275, 'sideways_use_sma': True, 'sideways_use_ema': False, 'sideways_use_atr': False, 'sideways_use_adx': True, 'sideways_use_spike': False, 'sideways_rsi_required': False}.
[I 2025-08-31 00:36:58,869] Trial 304 finished with values: [-1000000000.0, 1000000000.0] and parameters: {'p_sma': 29, 'p_std': 36, 'p_atr': 20, 'p_adx': 9, 'rsi_period': 53, 'ema1': 21, 'ema2': 15, 'slip_atr_k': 0.09604411967664389, 'slip_spread_k': 0.6795168515318527, 'spread_hl_frac': 0.009175678416865857, 'bb_std_mult': 2.010773155444999, 'rsi_os': 54, 'rsi_ob': 87, 'vol_spike': 0.20908496848767608, 'adx_thresh': 8.861137379107463, 'atr_min_pct': 0.02851872790765273, 'atr_max_pct': 0.12525848295478179, 'tp_mult': 2.3642381357342503, 'tsl_mult': 0.12537611903534873, 'strategy': 'mean_reversion', 'time_stop': 98, 'use_sma': True, 'use_atr': True, 'use_adx': False, 'use_ema': True, 'use_spike': True, 'rsi_required': False, 'edge_k': 0.9497861998186102, 'edge_cap': 0.5318107612703937, 'bull_strategy': 'mean_reversion', 'bull_bb_std_mult': 0.6826730050361611, 'bull_rsi_os': 16, 'bull_rsi_ob': 49, 'bull_adx_thresh': 13.505165429111173, 'bull_atr_min_pct': 0.012246408795290325, 'bull_atr_max_pct': 0.014270810629682384, 'bull_tp_mult': 2.3022321972944733, 'bull_tsl_mult': 0.36959156541181754, 'bull_time_stop': 184, 'bull_use_sma': True, 'bull_use_ema': False, 'bull_use_atr': True, 'bull_use_adx': False, 'bull_use_spike': False, 'bull_rsi_required': False, 'bear_strategy': 'mean_reversion', 'bear_bb_std_mult': 1.2859769276160806, 'bear_rsi_os': 9, 'bear_rsi_ob': 80, 'bear_adx_thresh': 14.469661889675592, 'bear_atr_min_pct': 0.016549952198377543, 'bear_atr_max_pct': 0.01592343171644607, 'bear_tp_mult': 2.318932357592391, 'bear_tsl_mult': 0.07013507928017848, 'bear_time_stop': 83, 'bear_use_sma': True, 'bear_use_ema': True, 'bear_use_atr': False, 'bear_use_adx': True, 'bear_use_spike': True, 'bear_rsi_required': False, 'sideways_strategy': 'breakout', 'sideways_bb_std_mult': 2.044293636023335, 'sideways_rsi_os': 47, 'sideways_rsi_ob': 89, 'sideways_adx_thresh': 17.7811548468842, 'sideways_atr_min_pct': 0.018451411354580293, 'sideways_atr_max_pct': 0.1353944916428885, 'sideways_tp_mult': 2.881275025869561, 'sideways_tsl_mult': 0.7444452319868702, 'sideways_time_stop': 265, 'sideways_use_sma': True, 'sideways_use_ema': False, 'sideways_use_atr': True, 'sideways_use_adx': False, 'sideways_use_spike': True, 'sideways_rsi_required': True}.
[I 2025-08-31 00:36:58,876] Trial 305 finished with values: [-1000000000.0, 1000000000.0] and parameters: {'p_sma': 29, 'p_std': 54, 'p_atr': 24, 'p_adx': 9, 'rsi_period': 79, 'ema1': 6, 'ema2': 25, 'slip_atr_k': 0.027160896153501958, 'slip_spread_k': 0.17181653506074823, 'spread_hl_frac': 0.008947863434726002, 'bb_std_mult': 2.018683058705202, 'rsi_os': 54, 'rsi_ob': 87, 'vol_spike': 0.13476651460802147, 'adx_thresh': 10.96903541556479, 'atr_min_pct': 0.0283711586571452, 'atr_max_pct': 0.12303711917967557, 'tp_mult': 2.2630171946719804, 'tsl_mult': 0.12764323217843754, 'strategy': 'mean_reversion', 'time_stop': 257, 'use_sma': True, 'use_atr': True, 'use_adx': False, 'use_ema': True, 'use_spike': True, 'rsi_required': False, 'edge_k': 0.3805604837280473, 'edge_cap': 0.7749033303850467, 'bull_strategy': 'mean_reversion', 'bull_bb_std_mult': 0.9554424800421393, 'bull_rsi_os': 40, 'bull_rsi_ob': 73, 'bull_adx_thresh': 13.512684568193995, 'bull_atr_min_pct': 0.012215424284184387, 'bull_atr_max_pct': 0.07391617601313061, 'bull_tp_mult': 1.2089678010462745, 'bull_tsl_mult': 0.7372134401333259, 'bull_time_stop': 146, 'bull_use_sma': True, 'bull_use_ema': False, 'bull_use_atr': True, 'bull_use_adx': False, 'bull_use_spike': False, 'bull_rsi_required': False, 'bear_strategy': 'mean_reversion', 'bear_bb_std_mult': 2.0695710305824977, 'bear_rsi_os': 9, 'bear_rsi_ob': 80, 'bear_adx_thresh': 9.749139251594332, 'bear_atr_min_pct': 0.016488421153345742, 'bear_atr_max_pct': 0.08555774954155529, 'bear_tp_mult': 1.8295713849534556, 'bear_tsl_mult': 0.7010791498684747, 'bear_time_stop': 12, 'bear_use_sma': True, 'bear_use_ema': True, 'bear_use_atr': False, 'bear_use_adx': True, 'bear_use_spike': True, 'bear_rsi_required': False, 'sideways_strategy': 'breakout', 'sideways_bb_std_mult': 1.8212044221264199, 'sideways_rsi_os': 21, 'sideways_rsi_ob': 94, 'sideways_adx_thresh': 17.75069690896567, 'sideways_atr_min_pct': 0.003921484137938275, 'sideways_atr_max_pct': 0.13657319857070757, 'sideways_tp_mult': 1.0883365493454304, 'sideways_tsl_mult': 0.7827805825958649, 'sideways_time_stop': 222, 'sideways_use_sma': True, 'sideways_use_ema': False, 'sideways_use_atr': True, 'sideways_use_adx': False, 'sideways_use_spike': True, 'sideways_rsi_required': True}.
[I 2025-08-31 00:37:24,376] Trial 302 finished with values: [-1000000000.0, 1000000000.0] and parameters: {'p_sma': 29, 'p_std': 39, 'p_atr': 17, 'p_adx': 9, 'rsi_period': 60, 'ema1': 6, 'ema2': 20, 'slip_atr_k': 0.02759019059381386, 'slip_spread_k': 0.6753708372934588, 'spread_hl_frac': 0.010991431232604718, 'bb_std_mult': 2.048009101751654, 'rsi_os': 54, 'rsi_ob': 78, 'vol_spike': 0.1093816753625734, 'adx_thresh': 9.23315023486489, 'atr_min_pct': 0.0030761088496822804, 'atr_max_pct': 0.07664520856728059, 'tp_mult': 2.5560578757868284, 'tsl_mult': 0.12561191615047756, 'strategy': 'breakout', 'time_stop': 85, 'use_sma': False, 'use_atr': True, 'use_adx': False, 'use_ema': True, 'use_spike': False, 'rsi_required': False, 'edge_k': 0.5385772838423329, 'edge_cap': 0.6719402882171325, 'bull_strategy': 'breakout', 'bull_bb_std_mult': 0.6754099423659385, 'bull_rsi_os': 11, 'bull_rsi_ob': 51, 'bull_adx_thresh': 28.75114771312488, 'bull_atr_min_pct': 0.012675713285962287, 'bull_atr_max_pct': 0.0803022316778014, 'bull_tp_mult': 1.3311383662031426, 'bull_tsl_mult': 0.3684796524240837, 'bull_time_stop': 185, 'bull_use_sma': True, 'bull_use_ema': False, 'bull_use_atr': True, 'bull_use_adx': True, 'bull_use_spike': True, 'bull_rsi_required': False, 'bear_strategy': 'mean_reversion', 'bear_bb_std_mult': 2.2563308584895654, 'bear_rsi_os': 19, 'bear_rsi_ob': 93, 'bear_adx_thresh': 18.087713833507394, 'bear_atr_min_pct': 0.01379492368562413, 'bear_atr_max_pct': 0.08950826779537333, 'bear_tp_mult': 2.3165062032720014, 'bear_tsl_mult': 0.6943362705400297, 'bear_time_stop': 270, 'bear_use_sma': True, 'bear_use_ema': False, 'bear_use_atr': False, 'bear_use_adx': True, 'bear_use_spike': False, 'bear_rsi_required': True, 'sideways_strategy': 'mean_reversion', 'sideways_bb_std_mult': 1.0552900454259555, 'sideways_rsi_os': 52, 'sideways_rsi_ob': 51, 'sideways_adx_thresh': 14.476956721072643, 'sideways_atr_min_pct': 0.0070505722037503445, 'sideways_atr_max_pct': 0.14143167022796907, 'sideways_tp_mult': 1.0994169581674553, 'sideways_tsl_mult': 0.5623025051420177, 'sideways_time_stop': 274, 'sideways_use_sma': True, 'sideways_use_ema': False, 'sideways_use_atr': False, 'sideways_use_adx': True, 'sideways_use_spike': False, 'sideways_rsi_required': False}.
[I 2025-08-31 00:37:25,542] Trial 303 finished with values: [-1000000000.0, 1000000000.0] and parameters: {'p_sma': 46, 'p_std': 30, 'p_atr': 24, 'p_adx': 27, 'rsi_period': 60, 'ema1': 6, 'ema2': 15, 'slip_atr_k': 0.02772129847285594, 'slip_spread_k': 0.19571603542147642, 'spread_hl_frac': 0.007119625330568516, 'bb_std_mult': 2.0412383323514534, 'rsi_os': 7, 'rsi_ob': 74, 'vol_spike': 0.10905792262844216, 'adx_thresh': 11.156230666134782, 'atr_min_pct': 0.011579363863571699, 'atr_max_pct': 0.12517909502581753, 'tp_mult': 2.6788690285571697, 'tsl_mult': 0.12336541594669598, 'strategy': 'mean_reversion', 'time_stop': 84, 'use_sma': True, 'use_atr': True, 'use_adx': False, 'use_ema': True, 'use_spike': False, 'rsi_required': False, 'edge_k': 0.996879792109159, 'edge_cap': 0.8650879521327653, 'bull_strategy': 'breakout', 'bull_bb_std_mult': 0.6776780311468382, 'bull_rsi_os': 40, 'bull_rsi_ob': 51, 'bull_adx_thresh': 13.493304458001402, 'bull_atr_min_pct': 0.007765680425163552, 'bull_atr_max_pct': 0.07449187870222623, 'bull_tp_mult': 2.4619871915619145, 'bull_tsl_mult': 0.8893153616778239, 'bull_time_stop': 176, 'bull_use_sma': True, 'bull_use_ema': False, 'bull_use_atr': True, 'bull_use_adx': True, 'bull_use_spike': False, 'bull_rsi_required': False, 'bear_strategy': 'mean_reversion', 'bear_bb_std_mult': 1.0441645281689074, 'bear_rsi_os': 20, 'bear_rsi_ob': 66, 'bear_adx_thresh': 21.738577465897603, 'bear_atr_min_pct': 0.009176387599605804, 'bear_atr_max_pct': 0.01472218328910006, 'bear_tp_mult': 1.8327356597166442, 'bear_tsl_mult': 0.0380546934116161, 'bear_time_stop': 265, 'bear_use_sma': True, 'bear_use_ema': False, 'bear_use_atr': False, 'bear_use_adx': True, 'bear_use_spike': True, 'bear_rsi_required': True, 'sideways_strategy': 'breakout', 'sideways_bb_std_mult': 1.1206115371852494, 'sideways_rsi_os': 31, 'sideways_rsi_ob': 95, 'sideways_adx_thresh': 26.454832478150756, 'sideways_atr_min_pct': 0.005381743997166717, 'sideways_atr_max_pct': 0.135783089465864, 'sideways_tp_mult': 1.0894010483259553, 'sideways_tsl_mult': 0.004806169618307432, 'sideways_time_stop': 140, 'sideways_use_sma': True, 'sideways_use_ema': False, 'sideways_use_atr': False, 'sideways_use_adx': False, 'sideways_use_spike': True, 'sideways_rsi_required': False}.
