[I 2025-08-31 02:37:49,389] Trial 584 finished with values: [-1000000000.0, 1000000000.0] and parameters: {'p_sma': 55, 'p_std': 56, 'p_atr': 27, 'p_adx': 17, 'rsi_period': 71, 'ema1': 6, 'ema2': 30, 'slip_atr_k': 0.05828826626769294, 'slip_spread_k': 0.08630542950742293, 'spread_hl_frac': 0.002706294820571891, 'bb_std_mult': 1.590678090400846, 'rsi_os': 39, 'rsi_ob': 70, 'vol_spike': 0.18886109743828666, 'adx_thresh': 21.205426045453034, 'atr_min_pct': 0.00800516283008479, 'atr_max_pct': 0.12334331804499958, 'tp_mult': 1.5422362497061715, 'tsl_mult': 0.24906925527459634, 'strategy': 'mean_reversion', 'time_stop': 18, 'use_sma': True, 'use_atr': False, 'use_adx': False, 'use_ema': False, 'use_spike': True, 'rsi_required': True, 'edge_k': 0.46813360346285454, 'edge_cap': 0.1519776681340467, 'bull_strategy': 'breakout', 'bull_bb_std_mult': 3.4086428094344914, 'bull_rsi_os': 28, 'bull_rsi_ob': 86, 'bull_adx_thresh': 8.749122191792335, 'bull_atr_min_pct': 0.025281777363074603, 'bull_atr_max_pct': 0.14329010263258193, 'bull_tp_mult': 2.1606136852391846, 'bull_tsl_mult': 0.9981716999449326, 'bull_time_stop': 139, 'bull_use_sma': True, 'bull_use_ema': False, 'bull_use_atr': False, 'bull_use_adx': True, 'bull_use_spike': True, 'bull_rsi_required': True, 'bear_strategy': 'mean_reversion', 'bear_bb_std_mult': 1.2524432075321332, 'bear_rsi_os': 49, 'bear_rsi_ob': 48, 'bear_adx_thresh': 22.696241656508473, 'bear_atr_min_pct': 0.0065250554877836296, 'bear_atr_max_pct': 0.06737357934178048, 'bear_tp_mult': 2.1140667353992786, 'bear_tsl_mult': 0.521649801723748, 'bear_time_stop': 206, 'bear_use_sma': False, 'bear_use_ema': True, 'bear_use_atr': False, 'bear_use_adx': True, 'bear_use_spike': False, 'bear_rsi_required': True, 'sideways_strategy': 'breakout', 'sideways_bb_std_mult': 0.5968538454991372, 'sideways_rsi_os': 41, 'sideways_rsi_ob': 94, 'sideways_adx_thresh': 9.87146071218085, 'sideways_atr_min_pct': 0.02775029027993274, 'sideways_atr_max_pct': 0.05237221420919581, 'sideways_tp_mult': 1.7503576825265563, 'sideways_tsl_mult': 0.6840421492354056, 'sideways_time_stop': 5, 'sideways_use_sma': True, 'sideways_use_ema': False, 'sideways_use_atr': False, 'sideways_use_adx': False, 'sideways_use_spike': True, 'sideways_rsi_required': False}.
[I 2025-08-31 02:37:49,685] Trial 586 finished with values: [-1000000000.0, 1000000000.0] and parameters: {'p_sma': 53, 'p_std': 55, 'p_atr': 29, 'p_adx': 12, 'rsi_period': 71, 'ema1': 6, 'ema2': 27, 'slip_atr_k': 0.057961596552051076, 'slip_spread_k': 0.1956835725908262, 'spread_hl_frac': 0.0030701783089431512, 'bb_std_mult': 2.779239028206479, 'rsi_os': 39, 'rsi_ob': 67, 'vol_spike': 0.27527682441554757, 'adx_thresh': 21.15182652681792, 'atr_min_pct': 0.008125142717716, 'atr_max_pct': 0.11990371435074396, 'tp_mult': 1.2194977079728968, 'tsl_mult': 0.24919593397112383, 'strategy': 'mean_reversion', 'time_stop': 116, 'use_sma': True, 'use_atr': False, 'use_adx': False, 'use_ema': False, 'use_spike': True, 'rsi_required': True, 'edge_k': 0.49063709834126246, 'edge_cap': 0.1944870112709198, 'bull_strategy': 'mean_reversion', 'bull_bb_std_mult': 3.4237449880871837, 'bull_rsi_os': 13, 'bull_rsi_ob': 86, 'bull_adx_thresh': 6.221140867141324, 'bull_atr_min_pct': 0.025599606985040803, 'bull_atr_max_pct': 0.14229070325791487, 'bull_tp_mult': 2.3344463813484193, 'bull_tsl_mult': 0.021005986027687606, 'bull_time_stop': 202, 'bull_use_sma': True, 'bull_use_ema': False, 'bull_use_atr': False, 'bull_use_adx': True, 'bull_use_spike': True, 'bull_rsi_required': True, 'bear_strategy': 'mean_reversion', 'bear_bb_std_mult': 1.2508560107579958, 'bear_rsi_os': 18, 'bear_rsi_ob': 50, 'bear_adx_thresh': 5.529776299117556, 'bear_atr_min_pct': 0.007050663676588841, 'bear_atr_max_pct': 0.01708083155117107, 'bear_tp_mult': 2.109801363610546, 'bear_tsl_mult': 0.5179095768514168, 'bear_time_stop': 205, 'bear_use_sma': False, 'bear_use_ema': True, 'bear_use_atr': False, 'bear_use_adx': True, 'bear_use_spike': False, 'bear_rsi_required': True, 'sideways_strategy': 'breakout', 'sideways_bb_std_mult': 0.7047291795948034, 'sideways_rsi_os': 42, 'sideways_rsi_ob': 62, 'sideways_adx_thresh': 9.990105328215614, 'sideways_atr_min_pct': 0.02631929951080169, 'sideways_atr_max_pct': 0.05918845044071563, 'sideways_tp_mult': 1.7497113592368347, 'sideways_tsl_mult': 0.6846232707029553, 'sideways_time_stop': 192, 'sideways_use_sma': True, 'sideways_use_ema': False, 'sideways_use_atr': False, 'sideways_use_adx': False, 'sideways_use_spike': True, 'sideways_rsi_required': False}.
[I 2025-08-31 02:37:49,846] Trial 587 finished with values: [-1000000000.0, 1000000000.0] and parameters: {'p_sma': 53, 'p_std': 51, 'p_atr': 29, 'p_adx': 17, 'rsi_period': 70, 'ema1': 5, 'ema2': 29, 'slip_atr_k': 0.05765399150374376, 'slip_spread_k': 0.7483585418680436, 'spread_hl_frac': 0.0012078022846274327, 'bb_std_mult': 3.032579204172733, 'rsi_os': 39, 'rsi_ob': 67, 'vol_spike': 0.17977371342533455, 'adx_thresh': 21.19154153397989, 'atr_min_pct': 0.008184924806816247, 'atr_max_pct': 0.11460037543623722, 'tp_mult': 1.342707087133523, 'tsl_mult': 0.26640489383480415, 'strategy': 'mean_reversion', 'time_stop': 164, 'use_sma': True, 'use_atr': True, 'use_adx': True, 'use_ema': False, 'use_spike': True, 'rsi_required': True, 'edge_k': 0.5035970606389969, 'edge_cap': 0.15568557084615392, 'bull_strategy': 'mean_reversion', 'bull_bb_std_mult': 0.7061038960140991, 'bull_rsi_os': 12, 'bull_rsi_ob': 58, 'bull_adx_thresh': 8.25967478099676, 'bull_atr_min_pct': 0.005241692791332908, 'bull_atr_max_pct': 0.14260535211673747, 'bull_tp_mult': 2.324005890264493, 'bull_tsl_mult': 0.9115891731768805, 'bull_time_stop': 204, 'bull_use_sma': True, 'bull_use_ema': False, 'bull_use_atr': False, 'bull_use_adx': False, 'bull_use_spike': True, 'bull_rsi_required': True, 'bear_strategy': 'mean_reversion', 'bear_bb_std_mult': 1.242092002136382, 'bear_rsi_os': 17, 'bear_rsi_ob': 48, 'bear_adx_thresh': 19.18897123450953, 'bear_atr_min_pct': 0.0014533133867238503, 'bear_atr_max_pct': 0.016347713736268532, 'bear_tp_mult': 2.001526578267017, 'bear_tsl_mult': 0.5120824117542417, 'bear_time_stop': 11, 'bear_use_sma': False, 'bear_use_ema': True, 'bear_use_atr': False, 'bear_use_adx': False, 'bear_use_spike': False, 'bear_rsi_required': True, 'sideways_strategy': 'breakout', 'sideways_bb_std_mult': 0.6979658398607083, 'sideways_rsi_os': 42, 'sideways_rsi_ob': 92, 'sideways_adx_thresh': 10.026205045949142, 'sideways_atr_min_pct': 0.027597267654281193, 'sideways_atr_max_pct': 0.058859813005337054, 'sideways_tp_mult': 1.746461662881227, 'sideways_tsl_mult': 0.0065153989876254315, 'sideways_time_stop': 49, 'sideways_use_sma': False, 'sideways_use_ema': False, 'sideways_use_atr': False, 'sideways_use_adx': True, 'sideways_use_spike': True, 'sideways_rsi_required': False}.
[I 2025-08-31 02:37:50,789] Trial 588 finished with values: [-1000000000.0, 1000000000.0] and parameters: {'p_sma': 52, 'p_std': 51, 'p_atr': 27, 'p_adx': 24, 'rsi_period': 70, 'ema1': 5, 'ema2': 29, 'slip_atr_k': 0.05937394976703604, 'slip_spread_k': 0.8915288274235615, 'spread_hl_frac': 0.0031079857311502182, 'bb_std_mult': 2.6880121390956964, 'rsi_os': 39, 'rsi_ob': 67, 'vol_spike': 0.2510512201473247, 'adx_thresh': 20.904757101982778, 'atr_min_pct': 0.024486527797040233, 'atr_max_pct': 0.12003184738045744, 'tp_mult': 1.3372208938763301, 'tsl_mult': 0.2713283126722411, 'strategy': 'mean_reversion', 'time_stop': 101, 'use_sma': True, 'use_atr': True, 'use_adx': True, 'use_ema': False, 'use_spike': True, 'rsi_required': True, 'edge_k': 0.5025408611808571, 'edge_cap': 0.11140047049068591, 'bull_strategy': 'breakout', 'bull_bb_std_mult': 0.6064504743882473, 'bull_rsi_os': 22, 'bull_rsi_ob': 86, 'bull_adx_thresh': 7.617600516886177, 'bull_atr_min_pct': 0.016116408739680524, 'bull_atr_max_pct': 0.14746668414427253, 'bull_tp_mult': 1.8783027366557148, 'bull_tsl_mult': 0.018097033544692442, 'bull_time_stop': 132, 'bull_use_sma': True, 'bull_use_ema': False, 'bull_use_atr': False, 'bull_use_adx': False, 'bull_use_spike': True, 'bull_rsi_required': True, 'bear_strategy': 'mean_reversion', 'bear_bb_std_mult': 1.2387103195975941, 'bear_rsi_os': 49, 'bear_rsi_ob': 45, 'bear_adx_thresh': 21.291024376409997, 'bear_atr_min_pct': 0.0015325974335268742, 'bear_atr_max_pct': 0.012862192555798088, 'bear_tp_mult': 2.0908650564247844, 'bear_tsl_mult': 0.5793147363009783, 'bear_time_stop': 225, 'bear_use_sma': False, 'bear_use_ema': True, 'bear_use_atr': False, 'bear_use_adx': False, 'bear_use_spike': False, 'bear_rsi_required': True, 'sideways_strategy': 'breakout', 'sideways_bb_std_mult': 0.6196676036798408, 'sideways_rsi_os': 40, 'sideways_rsi_ob': 73, 'sideways_adx_thresh': 8.952418677739542, 'sideways_atr_min_pct': 0.026455254664460075, 'sideways_atr_max_pct': 0.06021705497833722, 'sideways_tp_mult': 1.6834340060337778, 'sideways_tsl_mult': 0.0042361649692382874, 'sideways_time_stop': 195, 'sideways_use_sma': False, 'sideways_use_ema': False, 'sideways_use_atr': False, 'sideways_use_adx': True, 'sideways_use_spike': True, 'sideways_rsi_required': False}.
[I 2025-08-31 02:38:23,170] Trial 589 finished with values: [-1000000000.0, 1000000000.0] and parameters: {'p_sma': 26, 'p_std': 50, 'p_atr': 27, 'p_adx': 16, 'rsi_period': 70, 'ema1': 22, 'ema2': 27, 'slip_atr_k': 0.11029722784766682, 'slip_spread_k': 0.4128930961098993, 'spread_hl_frac': 0.0010457908433243988, 'bb_std_mult': 1.6351973841399485, 'rsi_os': 39, 'rsi_ob': 59, 'vol_spike': 0.274119175131075, 'adx_thresh': 21.750380527243486, 'atr_min_pct': 0.008822194674448435, 'atr_max_pct': 0.12041688135727073, 'tp_mult': 1.2278168640194398, 'tsl_mult': 0.6309706875737919, 'strategy': 'mean_reversion', 'time_stop': 98, 'use_sma': False, 'use_atr': True, 'use_adx': True, 'use_ema': False, 'use_spike': False, 'rsi_required': True, 'edge_k': 0.5142471313238348, 'edge_cap': 0.11782989458280811, 'bull_strategy': 'mean_reversion', 'bull_bb_std_mult': 3.2531752919995394, 'bull_rsi_os': 13, 'bull_rsi_ob': 58, 'bull_adx_thresh': 8.008250862136752, 'bull_atr_min_pct': 0.0034909817270633746, 'bull_atr_max_pct': 0.12730967551205433, 'bull_tp_mult': 1.8907546423871737, 'bull_tsl_mult': 0.9111672618270387, 'bull_time_stop': 128, 'bull_use_sma': True, 'bull_use_ema': False, 'bull_use_atr': False, 'bull_use_adx': False, 'bull_use_spike': True, 'bull_rsi_required': True, 'bear_strategy': 'breakout', 'bear_bb_std_mult': 1.455038877532444, 'bear_rsi_os': 17, 'bear_rsi_ob': 45, 'bear_adx_thresh': 5.493343958012566, 'bear_atr_min_pct': 0.007037848145593151, 'bear_atr_max_pct': 0.012610672045639811, 'bear_tp_mult': 2.013269024693485, 'bear_tsl_mult': 0.5841258301751738, 'bear_time_stop': 9, 'bear_use_sma': False, 'bear_use_ema': False, 'bear_use_atr': True, 'bear_use_adx': False, 'bear_use_spike': False, 'bear_rsi_required': True, 'sideways_strategy': 'breakout', 'sideways_bb_std_mult': 0.6572188433946837, 'sideways_rsi_os': 39, 'sideways_rsi_ob': 92, 'sideways_adx_thresh': 9.152479521454726, 'sideways_atr_min_pct': 0.025456458154313938, 'sideways_atr_max_pct': 0.060814049779034894, 'sideways_tp_mult': 1.6858815444613566, 'sideways_tsl_mult': 0.6512397542764438, 'sideways_time_stop': 193, 'sideways_use_sma': False, 'sideways_use_ema': False, 'sideways_use_atr': False, 'sideways_use_adx': True, 'sideways_use_spike': False, 'sideways_rsi_required': True}.
[I 2025-08-31 02:38:24,490] Trial 590 finished with values: [-1000000000.0, 1000000000.0] and parameters: {'p_sma': 26, 'p_std': 51, 'p_atr': 30, 'p_adx': 16, 'rsi_period': 75, 'ema1': 5, 'ema2': 39, 'slip_atr_k': 0.08395287315594413, 'slip_spread_k': 0.7331496488852225, 'spread_hl_frac': 0.000980182927052346, 'bb_std_mult': 3.1791997548779074, 'rsi_os': 40, 'rsi_ob': 54, 'vol_spike': 0.06518537000921497, 'adx_thresh': 20.50339652987153, 'atr_min_pct': 0.00908739652693496, 'atr_max_pct': 0.10981853962183102, 'tp_mult': 2.0415767970018783, 'tsl_mult': 0.6269067332658673, 'strategy': 'mean_reversion', 'time_stop': 105, 'use_sma': False, 'use_atr': True, 'use_adx': True, 'use_ema': False, 'use_spike': False, 'rsi_required': True, 'edge_k': 0.9902137369305442, 'edge_cap': 0.11308371922916624, 'bull_strategy': 'breakout', 'bull_bb_std_mult': 3.529910459355423, 'bull_rsi_os': 22, 'bull_rsi_ob': 58, 'bull_adx_thresh': 7.80633987043025, 'bull_atr_min_pct': 0.003591716630663556, 'bull_atr_max_pct': 0.1481852594728706, 'bull_tp_mult': 1.6046210693834935, 'bull_tsl_mult': 0.9210565429953694, 'bull_time_stop': 130, 'bull_use_sma': True, 'bull_use_ema': True, 'bull_use_atr': False, 'bull_use_adx': False, 'bull_use_spike': True, 'bull_rsi_required': True, 'bear_strategy': 'breakout', 'bear_bb_std_mult': 1.4648425196602002, 'bear_rsi_os': 15, 'bear_rsi_ob': 45, 'bear_adx_thresh': 34.56969244201103, 'bear_atr_min_pct': 0.004854414282137808, 'bear_atr_max_pct': 0.012421436534245423, 'bear_tp_mult': 2.0145570215187245, 'bear_tsl_mult': 0.582632123983215, 'bear_time_stop': 227, 'bear_use_sma': False, 'bear_use_ema': False, 'bear_use_atr': True, 'bear_use_adx': False, 'bear_use_spike': False, 'bear_rsi_required': True, 'sideways_strategy': 'breakout', 'sideways_bb_std_mult': 0.5028163203768292, 'sideways_rsi_os': 40, 'sideways_rsi_ob': 92, 'sideways_adx_thresh': 8.206290627134164, 'sideways_atr_min_pct': 0.026747824663520974, 'sideways_atr_max_pct': 0.05621944712367835, 'sideways_tp_mult': 1.7037292218128823, 'sideways_tsl_mult': 0.6387718569275153, 'sideways_time_stop': 196, 'sideways_use_sma': False, 'sideways_use_ema': True, 'sideways_use_atr': True, 'sideways_use_adx': True, 'sideways_use_spike': False, 'sideways_rsi_required': True}.
[I 2025-08-31 02:38:24,656] Trial 592 finished with values: [-1000000000.0, 1000000000.0] and parameters: {'p_sma': 26, 'p_std': 49, 'p_atr': 10, 'p_adx': 23, 'rsi_period': 75, 'ema1': 22, 'ema2': 39, 'slip_atr_k': 0.18675763211747343, 'slip_spread_k': 0.13168744374740243, 'spread_hl_frac': 0.004018226922857833, 'bb_std_mult': 3.187461848871285, 'rsi_os': 34, 'rsi_ob': 54, 'vol_spike': 0.03430414292699212, 'adx_thresh': 19.838284262641093, 'atr_min_pct': 0.00899179918263303, 'atr_max_pct': 0.12642302475863942, 'tp_mult': 2.0332147725106835, 'tsl_mult': 0.6315851249133986, 'strategy': 'mean_reversion', 'time_stop': 98, 'use_sma': False, 'use_atr': False, 'use_adx': False, 'use_ema': False, 'use_spike': False, 'rsi_required': True, 'edge_k': 0.5801799179688681, 'edge_cap': 0.12643691971941456, 'bull_strategy': 'breakout', 'bull_bb_std_mult': 1.2848970347076747, 'bull_rsi_os': 10, 'bull_rsi_ob': 57, 'bull_adx_thresh': 5.031855944372701, 'bull_atr_min_pct': 0.014112792611913673, 'bull_atr_max_pct': 0.12813513788321834, 'bull_tp_mult': 1.9686004378444966, 'bull_tsl_mult': 0.2169570750402375, 'bull_time_stop': 145, 'bull_use_sma': True, 'bull_use_ema': True, 'bull_use_atr': False, 'bull_use_adx': True, 'bull_use_spike': True, 'bull_rsi_required': True, 'bear_strategy': 'breakout', 'bear_bb_std_mult': 1.4545548861528945, 'bear_rsi_os': 15, 'bear_rsi_ob': 46, 'bear_adx_thresh': 33.643211096730525, 'bear_atr_min_pct': 0.007160699088915243, 'bear_atr_max_pct': 0.012671194392713948, 'bear_tp_mult': 2.2430378773865147, 'bear_tsl_mult': 0.5547031666083412, 'bear_time_stop': 240, 'bear_use_sma': False, 'bear_use_ema': False, 'bear_use_atr': True, 'bear_use_adx': True, 'bear_use_spike': True, 'bear_rsi_required': True, 'sideways_strategy': 'breakout', 'sideways_bb_std_mult': 0.5002805468717797, 'sideways_rsi_os': 39, 'sideways_rsi_ob': 59, 'sideways_adx_thresh': 8.378890704733506, 'sideways_atr_min_pct': 0.028589853716238907, 'sideways_atr_max_pct': 0.05524819501865135, 'sideways_tp_mult': 1.6912394368644923, 'sideways_tsl_mult': 0.6523286887464923, 'sideways_time_stop': 209, 'sideways_use_sma': True, 'sideways_use_ema': True, 'sideways_use_atr': True, 'sideways_use_adx': False, 'sideways_use_spike': False, 'sideways_rsi_required': True}.
[I 2025-08-31 02:38:24,812] Trial 591 finished with values: [-1000000000.0, 1000000000.0] and parameters: {'p_sma': 7, 'p_std': 50, 'p_atr': 27, 'p_adx': 13, 'rsi_period': 67, 'ema1': 22, 'ema2': 13, 'slip_atr_k': 0.0838498215596137, 'slip_spread_k': 0.8985734530970843, 'spread_hl_frac': 0.003984078779069874, 'bb_std_mult': 1.624803765137636, 'rsi_os': 34, 'rsi_ob': 70, 'vol_spike': 0.18206088074033397, 'adx_thresh': 21.806573143103634, 'atr_min_pct': 0.009117394417396719, 'atr_max_pct': 0.12709434821980656, 'tp_mult': 1.8708626085948088, 'tsl_mult': 0.6266075919418983, 'strategy': 'mean_reversion', 'time_stop': 101, 'use_sma': False, 'use_atr': True, 'use_adx': True, 'use_ema': False, 'use_spike': False, 'rsi_required': True, 'edge_k': 1.4793590349785697, 'edge_cap': 0.0879272309363224, 'bull_strategy': 'breakout', 'bull_bb_std_mult': 3.319785331583467, 'bull_rsi_os': 21, 'bull_rsi_ob': 56, 'bull_adx_thresh': 6.982069339498841, 'bull_atr_min_pct': 0.016247085331560055, 'bull_atr_max_pct': 0.13199634852318945, 'bull_tp_mult': 1.9913986796175593, 'bull_tsl_mult': 0.2184893606306892, 'bull_time_stop': 130, 'bull_use_sma': True, 'bull_use_ema': True, 'bull_use_atr': False, 'bull_use_adx': False, 'bull_use_spike': True, 'bull_rsi_required': True, 'bear_strategy': 'breakout', 'bear_bb_std_mult': 1.4432002267013095, 'bear_rsi_os': 15, 'bear_rsi_ob': 45, 'bear_adx_thresh': 5.086809904167291, 'bear_atr_min_pct': 0.005354873912912905, 'bear_atr_max_pct': 0.012712360038673884, 'bear_tp_mult': 2.010279890144511, 'bear_tsl_mult': 0.5823474579942293, 'bear_time_stop': 12, 'bear_use_sma': False, 'bear_use_ema': False, 'bear_use_atr': True, 'bear_use_adx': False, 'bear_use_spike': False, 'bear_rsi_required': True, 'sideways_strategy': 'breakout', 'sideways_bb_std_mult': 0.633244355800164, 'sideways_rsi_os': 40, 'sideways_rsi_ob': 56, 'sideways_adx_thresh': 8.177390664671455, 'sideways_atr_min_pct': 0.024984746246327412, 'sideways_atr_max_pct': 0.055406172310557424, 'sideways_tp_mult': 1.5856753402799495, 'sideways_tsl_mult': 0.6466258958389062, 'sideways_time_stop': 209, 'sideways_use_sma': False, 'sideways_use_ema': True, 'sideways_use_atr': True, 'sideways_use_adx': True, 'sideways_use_spike': False, 'sideways_rsi_required': True}.
[I 2025-08-31 02:38:59,644] Trial 595 finished with values: [-1000000000.0, 1000000000.0] and parameters: {'p_sma': 32, 'p_std': 52, 'p_atr': 9, 'p_adx': 25, 'rsi_period': 67, 'ema1': 5, 'ema2': 35, 'slip_atr_k': 0.24167094662054323, 'slip_spread_k': 0.19347772088705698, 'spread_hl_frac': 0.0018298463821003778, 'bb_std_mult': 1.5399269217249034, 'rsi_os': 42, 'rsi_ob': 62, 'vol_spike': 0.18094848518752374, 'adx_thresh': 21.73208537644018, 'atr_min_pct': 0.020599475155581352, 'atr_max_pct': 0.1289361634944463, 'tp_mult': 1.9534274405277545, 'tsl_mult': 0.3340268352995658, 'strategy': 'mean_reversion', 'time_stop': 107, 'use_sma': True, 'use_atr': False, 'use_adx': False, 'use_ema': False, 'use_spike': False, 'rsi_required': True, 'edge_k': 0.5579678644501689, 'edge_cap': 0.08011929379829362, 'bull_strategy': 'breakout', 'bull_bb_std_mult': 1.8942382764615384, 'bull_rsi_os': 44, 'bull_rsi_ob': 60, 'bull_adx_thresh': 6.761888980961583, 'bull_atr_min_pct': 0.029252186910982924, 'bull_atr_max_pct': 0.1312104335092661, 'bull_tp_mult': 1.103906631018157, 'bull_tsl_mult': 0.24919920381139424, 'bull_time_stop': 251, 'bull_use_sma': True, 'bull_use_ema': False, 'bull_use_atr': False, 'bull_use_adx': True, 'bull_use_spike': True, 'bull_rsi_required': True, 'bear_strategy': 'mean_reversion', 'bear_bb_std_mult': 1.3506574096678947, 'bear_rsi_os': 41, 'bear_rsi_ob': 46, 'bear_adx_thresh': 32.551291224163876, 'bear_atr_min_pct': 0.017808260423427782, 'bear_atr_max_pct': 0.06219541648512039, 'bear_tp_mult': 2.763163327895711, 'bear_tsl_mult': 0.546720783172999, 'bear_time_stop': 12, 'bear_use_sma': False, 'bear_use_ema': False, 'bear_use_atr': False, 'bear_use_adx': True, 'bear_use_spike': False, 'bear_rsi_required': True, 'sideways_strategy': 'breakout', 'sideways_bb_std_mult': 0.6184706043896078, 'sideways_rsi_os': 41, 'sideways_rsi_ob': 94, 'sideways_adx_thresh': 7.479946175579554, 'sideways_atr_min_pct': 0.027379288787640524, 'sideways_atr_max_pct': 0.0406023242969239, 'sideways_tp_mult': 1.578889120269185, 'sideways_tsl_mult': 0.6218700953030631, 'sideways_time_stop': 77, 'sideways_use_sma': True, 'sideways_use_ema': False, 'sideways_use_atr': False, 'sideways_use_adx': False, 'sideways_use_spike': True, 'sideways_rsi_required': False}.
