[I 2025-08-31 03:07:31,375] Trial 793 finished with values: [-1000000000.0, 1000000000.0] and parameters: {'p_sma': 53, 'p_std': 54, 'p_atr': 30, 'p_adx': 17, 'rsi_period': 69, 'ema1': 9, 'ema2': 15, 'slip_atr_k': 0.069799838459982, 'slip_spread_k': 0.048680766849690124, 'spread_hl_frac': 0.002675644915142374, 'bb_std_mult': 1.6092982338921253, 'rsi_os': 39, 'rsi_ob': 66, 'vol_spike': 0.19019181982358405, 'adx_thresh': 26.883944788463857, 'atr_min_pct': 0.009726960934089387, 'atr_max_pct': 0.13596345366534318, 'tp_mult': 1.0128145724976967, 'tsl_mult': 0.9451585756483039, 'strategy': 'mean_reversion', 'time_stop': 122, 'use_sma': True, 'use_atr': False, 'use_adx': False, 'use_ema': False, 'use_spike': False, 'rsi_required': True, 'edge_k': 0.5632402385319459, 'edge_cap': 0.1363653953210043, 'bull_strategy': 'breakout', 'bull_bb_std_mult': 1.6112323577953043, 'bull_rsi_os': 48, 'bull_rsi_ob': 65, 'bull_adx_thresh': 6.100935889407359, 'bull_atr_min_pct': 0.008085614273076667, 'bull_atr_max_pct': 0.1429818262840482, 'bull_tp_mult': 1.547231157078417, 'bull_tsl_mult': 0.020290632718859114, 'bull_time_stop': 243, 'bull_use_sma': True, 'bull_use_ema': False, 'bull_use_atr': False, 'bull_use_adx': True, 'bull_use_spike': True, 'bull_rsi_required': True, 'bear_strategy': 'mean_reversion', 'bear_bb_std_mult': 3.351022584156013, 'bear_rsi_os': 15, 'bear_rsi_ob': 47, 'bear_adx_thresh': 27.356277402233133, 'bear_atr_min_pct': 0.027518703249166797, 'bear_atr_max_pct': 0.01011028527869728, 'bear_tp_mult': 2.1888224716487965, 'bear_tsl_mult': 0.23619931315008624, 'bear_time_stop': 16, 'bear_use_sma': False, 'bear_use_ema': False, 'bear_use_atr': False, 'bear_use_adx': True, 'bear_use_spike': False, 'bear_rsi_required': True, 'sideways_strategy': 'breakout', 'sideways_bb_std_mult': 2.0169170446339373, 'sideways_rsi_os': 34, 'sideways_rsi_ob': 92, 'sideways_adx_thresh': 33.731223886379404, 'sideways_atr_min_pct': 0.028220113686855827, 'sideways_atr_max_pct': 0.06653862700395648, 'sideways_tp_mult': 1.2574776279334587, 'sideways_tsl_mult': 0.3812657530412931, 'sideways_time_stop': 247, 'sideways_use_sma': True, 'sideways_use_ema': False, 'sideways_use_atr': False, 'sideways_use_adx': False, 'sideways_use_spike': True, 'sideways_rsi_required': False}.
[I 2025-08-31 03:07:31,725] Trial 792 finished with values: [-0.047331026220369, 0.0471267255441988] and parameters: {'p_sma': 53, 'p_std': 54, 'p_atr': 30, 'p_adx': 17, 'rsi_period': 35, 'ema1': 5, 'ema2': 38, 'slip_atr_k': 0.005865891500000433, 'slip_spread_k': 0.9106499118733395, 'spread_hl_frac': 0.04900304243142933, 'bb_std_mult': 3.0084648888054497, 'rsi_os': 25, 'rsi_ob': 66, 'vol_spike': 0.1633378048637654, 'adx_thresh': 17.957198912070535, 'atr_min_pct': 0.021842973918616147, 'atr_max_pct': 0.03530388791842743, 'tp_mult': 1.25430719466085, 'tsl_mult': 0.5385677709052067, 'strategy': 'mean_reversion', 'time_stop': 121, 'use_sma': True, 'use_atr': False, 'use_adx': False, 'use_ema': False, 'use_spike': False, 'rsi_required': True, 'edge_k': 0.496325966763763, 'edge_cap': 0.13200173406409615, 'bull_strategy': 'breakout', 'bull_bb_std_mult': 1.5839538478171789, 'bull_rsi_os': 13, 'bull_rsi_ob': 49, 'bull_adx_thresh': 22.136558589384798, 'bull_atr_min_pct': 0.009677987450853224, 'bull_atr_max_pct': 0.11627317604075413, 'bull_tp_mult': 2.2964705541176245, 'bull_tsl_mult': 0.2338994889265776, 'bull_time_stop': 206, 'bull_use_sma': True, 'bull_use_ema': False, 'bull_use_atr': False, 'bull_use_adx': True, 'bull_use_spike': True, 'bull_rsi_required': True, 'bear_strategy': 'mean_reversion', 'bear_bb_std_mult': 3.2732481989027358, 'bear_rsi_os': 19, 'bear_rsi_ob': 47, 'bear_adx_thresh': 5.551201715072006, 'bear_atr_min_pct': 0.0006931928633885573, 'bear_atr_max_pct': 0.010068939512064772, 'bear_tp_mult': 2.19375951151382, 'bear_tsl_mult': 0.5607911604220841, 'bear_time_stop': 15, 'bear_use_sma': False, 'bear_use_ema': False, 'bear_use_atr': False, 'bear_use_adx': True, 'bear_use_spike': False, 'bear_rsi_required': True, 'sideways_strategy': 'breakout', 'sideways_bb_std_mult': 0.7907406675090098, 'sideways_rsi_os': 12, 'sideways_rsi_ob': 91, 'sideways_adx_thresh': 33.681974824053604, 'sideways_atr_min_pct': 0.014992962212168467, 'sideways_atr_max_pct': 0.046563627311845095, 'sideways_tp_mult': 1.669449575703303, 'sideways_tsl_mult': 0.5890090015068784, 'sideways_time_stop': 72, 'sideways_use_sma': True, 'sideways_use_ema': False, 'sideways_use_atr': False, 'sideways_use_adx': False, 'sideways_use_spike': True, 'sideways_rsi_required': False}.
[I 2025-08-31 03:07:31,758] Trial 794 finished with values: [-1000000000.0, 1000000000.0] and parameters: {'p_sma': 53, 'p_std': 26, 'p_atr': 28, 'p_adx': 25, 'rsi_period': 83, 'ema1': 9, 'ema2': 10, 'slip_atr_k': 0.005364814950963331, 'slip_spread_k': 0.5944440982374629, 'spread_hl_frac': 0.002634926443964368, 'bb_std_mult': 1.6027583979226434, 'rsi_os': 39, 'rsi_ob': 72, 'vol_spike': 0.20200036611183875, 'adx_thresh': 21.293936545565423, 'atr_min_pct': 0.009655653815865778, 'atr_max_pct': 0.021915943529150723, 'tp_mult': 2.272849678407915, 'tsl_mult': 0.5433031948291052, 'strategy': 'mean_reversion', 'time_stop': 180, 'use_sma': True, 'use_atr': False, 'use_adx': False, 'use_ema': False, 'use_spike': False, 'rsi_required': True, 'edge_k': 0.6059185138028558, 'edge_cap': 0.466248279070567, 'bull_strategy': 'breakout', 'bull_bb_std_mult': 1.5248872769771924, 'bull_rsi_os': 53, 'bull_rsi_ob': 49, 'bull_adx_thresh': 6.141840406431596, 'bull_atr_min_pct': 0.009440957901746837, 'bull_atr_max_pct': 0.14485197963703045, 'bull_tp_mult': 1.1399499384769554, 'bull_tsl_mult': 0.2279251124185521, 'bull_time_stop': 149, 'bull_use_sma': True, 'bull_use_ema': False, 'bull_use_atr': False, 'bull_use_adx': True, 'bull_use_spike': True, 'bull_rsi_required': True, 'bear_strategy': 'mean_reversion', 'bear_bb_std_mult': 0.6974858702797222, 'bear_rsi_os': 15, 'bear_rsi_ob': 47, 'bear_adx_thresh': 5.468478417420431, 'bear_atr_min_pct': 0.005086993905262839, 'bear_atr_max_pct': 0.016572719248735074, 'bear_tp_mult': 2.886865670259828, 'bear_tsl_mult': 0.8959389326748523, 'bear_time_stop': 55, 'bear_use_sma': False, 'bear_use_ema': False, 'bear_use_atr': False, 'bear_use_adx': True, 'bear_use_spike': False, 'bear_rsi_required': True, 'sideways_strategy': 'breakout', 'sideways_bb_std_mult': 2.9671674197142526, 'sideways_rsi_os': 37, 'sideways_rsi_ob': 50, 'sideways_adx_thresh': 28.101288234940586, 'sideways_atr_min_pct': 0.014825124167028483, 'sideways_atr_max_pct': 0.050300602513260004, 'sideways_tp_mult': 1.6668625211479768, 'sideways_tsl_mult': 0.655813865326606, 'sideways_time_stop': 289, 'sideways_use_sma': True, 'sideways_use_ema': False, 'sideways_use_atr': False, 'sideways_use_adx': False, 'sideways_use_spike': True, 'sideways_rsi_required': False}.
[I 2025-08-31 03:07:31,882] Trial 795 finished with values: [-1000000000.0, 1000000000.0] and parameters: {'p_sma': 53, 'p_std': 54, 'p_atr': 28, 'p_adx': 29, 'rsi_period': 35, 'ema1': 19, 'ema2': 52, 'slip_atr_k': 0.06562517297423341, 'slip_spread_k': 0.10288069117106138, 'spread_hl_frac': 0.04886783795011676, 'bb_std_mult': 1.596385887480512, 'rsi_os': 39, 'rsi_ob': 71, 'vol_spike': 0.16326202606814824, 'adx_thresh': 33.44451415576027, 'atr_min_pct': 0.02570423328574293, 'atr_max_pct': 0.10555710867176875, 'tp_mult': 1.251368417738881, 'tsl_mult': 0.9423786765942561, 'strategy': 'mean_reversion', 'time_stop': 180, 'use_sma': True, 'use_atr': False, 'use_adx': False, 'use_ema': False, 'use_spike': False, 'rsi_required': True, 'edge_k': 0.566753754293154, 'edge_cap': 0.08949099806008168, 'bull_strategy': 'breakout', 'bull_bb_std_mult': 2.2638918367050707, 'bull_rsi_os': 53, 'bull_rsi_ob': 66, 'bull_adx_thresh': 5.885135665917823, 'bull_atr_min_pct': 0.007630431614138637, 'bull_atr_max_pct': 0.1172365747482561, 'bull_tp_mult': 1.1417206785988379, 'bull_tsl_mult': 0.23473611903181674, 'bull_time_stop': 149, 'bull_use_sma': True, 'bull_use_ema': True, 'bull_use_atr': False, 'bull_use_adx': True, 'bull_use_spike': True, 'bull_rsi_required': True, 'bear_strategy': 'mean_reversion', 'bear_bb_std_mult': 1.1653744454796842, 'bear_rsi_os': 18, 'bear_rsi_ob': 46, 'bear_adx_thresh': 28.95415856858964, 'bear_atr_min_pct': 0.005180807161186294, 'bear_atr_max_pct': 0.07348725899159976, 'bear_tp_mult': 1.9766295286094868, 'bear_tsl_mult': 0.92522890880409, 'bear_time_stop': 5, 'bear_use_sma': False, 'bear_use_ema': False, 'bear_use_atr': False, 'bear_use_adx': True, 'bear_use_spike': False, 'bear_rsi_required': True, 'sideways_strategy': 'breakout', 'sideways_bb_std_mult': 0.606753345919972, 'sideways_rsi_os': 18, 'sideways_rsi_ob': 80, 'sideways_adx_thresh': 19.579703940523654, 'sideways_atr_min_pct': 0.02836332524906504, 'sideways_atr_max_pct': 0.07185082233815607, 'sideways_tp_mult': 1.2395907284244911, 'sideways_tsl_mult': 0.6156977165139187, 'sideways_time_stop': 84, 'sideways_use_sma': True, 'sideways_use_ema': False, 'sideways_use_atr': False, 'sideways_use_adx': True, 'sideways_use_spike': True, 'sideways_rsi_required': True}.
[I 2025-08-31 03:07:32,864] Trial 799 finished with values: [-1000000000.0, 1000000000.0] and parameters: {'p_sma': 30, 'p_std': 20, 'p_atr': 16, 'p_adx': 16, 'rsi_period': 72, 'ema1': 5, 'ema2': 33, 'slip_atr_k': 0.22745304338730093, 'slip_spread_k': 0.694932092872114, 'spread_hl_frac': 0.0015424115265247687, 'bb_std_mult': 1.976889790253151, 'rsi_os': 31, 'rsi_ob': 50, 'vol_spike': 0.19220235056717172, 'adx_thresh': 21.708595466876076, 'atr_min_pct': 0.00842543552945817, 'atr_max_pct': 0.04115694606347947, 'tp_mult': 1.735975562813328, 'tsl_mult': 0.6620721316803369, 'strategy': 'mean_reversion', 'time_stop': 110, 'use_sma': False, 'use_atr': True, 'use_adx': True, 'use_ema': False, 'use_spike': False, 'rsi_required': True, 'edge_k': 1.40324136971652, 'edge_cap': 0.106326724301312, 'bull_strategy': 'mean_reversion', 'bull_bb_std_mult': 1.8660843573937518, 'bull_rsi_os': 31, 'bull_rsi_ob': 78, 'bull_adx_thresh': 5.0107580319761835, 'bull_atr_min_pct': 0.011163457946922374, 'bull_atr_max_pct': 0.11073165862372339, 'bull_tp_mult': 2.34363806554461, 'bull_tsl_mult': 0.262445341781651, 'bull_time_stop': 136, 'bull_use_sma': True, 'bull_use_ema': True, 'bull_use_atr': False, 'bull_use_adx': True, 'bull_use_spike': True, 'bull_rsi_required': True, 'bear_strategy': 'breakout', 'bear_bb_std_mult': 1.5785006636917216, 'bear_rsi_os': 38, 'bear_rsi_ob': 68, 'bear_adx_thresh': 19.735055961991847, 'bear_atr_min_pct': 0.005821004927727184, 'bear_atr_max_pct': 0.06738029202124758, 'bear_tp_mult': 2.000959981486708, 'bear_tsl_mult': 0.2885528103734709, 'bear_time_stop': 23, 'bear_use_sma': False, 'bear_use_ema': False, 'bear_use_atr': True, 'bear_use_adx': False, 'bear_use_spike': False, 'bear_rsi_required': True, 'sideways_strategy': 'breakout', 'sideways_bb_std_mult': 0.564030123052674, 'sideways_rsi_os': 38, 'sideways_rsi_ob': 94, 'sideways_adx_thresh': 9.19742228581223, 'sideways_atr_min_pct': 0.026649875294051033, 'sideways_atr_max_pct': 0.057288534427448586, 'sideways_tp_mult': 1.7684631892029086, 'sideways_tsl_mult': 0.9489024766418068, 'sideways_time_stop': 232, 'sideways_use_sma': False, 'sideways_use_ema': True, 'sideways_use_atr': True, 'sideways_use_adx': True, 'sideways_use_spike': False, 'sideways_rsi_required': True}.
[I 2025-08-31 03:08:05,129] Trial 798 finished with values: [-1000000000.0, 1000000000.0] and parameters: {'p_sma': 51, 'p_std': 60, 'p_atr': 27, 'p_adx': 14, 'rsi_period': 71, 'ema1': 20, 'ema2': 32, 'slip_atr_k': 0.09911193948633484, 'slip_spread_k': 0.14684583668831783, 'spread_hl_frac': 2.7510282264595065e-05, 'bb_std_mult': 1.9827349896833943, 'rsi_os': 13, 'rsi_ob': 69, 'vol_spike': 0.05816131981419585, 'adx_thresh': 28.776365492506155, 'atr_min_pct': 0.008486806951811395, 'atr_max_pct': 0.10463714604943261, 'tp_mult': 1.3099243401120628, 'tsl_mult': 0.24776528975739098, 'strategy': 'mean_reversion', 'time_stop': 112, 'use_sma': False, 'use_atr': False, 'use_adx': False, 'use_ema': False, 'use_spike': False, 'rsi_required': True, 'edge_k': 1.4282251313105412, 'edge_cap': 0.21456231181261892, 'bull_strategy': 'mean_reversion', 'bull_bb_std_mult': 1.8648882561583835, 'bull_rsi_os': 22, 'bull_rsi_ob': 52, 'bull_adx_thresh': 5.5311780867658396, 'bull_atr_min_pct': 0.014972286998777803, 'bull_atr_max_pct': 0.08795575735549777, 'bull_tp_mult': 1.6911568667970713, 'bull_tsl_mult': 0.25192497300702477, 'bull_time_stop': 133, 'bull_use_sma': True, 'bull_use_ema': True, 'bull_use_atr': False, 'bull_use_adx': True, 'bull_use_spike': True, 'bull_rsi_required': True, 'bear_strategy': 'breakout', 'bear_bb_std_mult': 1.9658899809614052, 'bear_rsi_os': 18, 'bear_rsi_ob': 45, 'bear_adx_thresh': 12.103069599606114, 'bear_atr_min_pct': 0.007680350538226611, 'bear_atr_max_pct': 0.01476658276812401, 'bear_tp_mult': 1.9775595769610095, 'bear_tsl_mult': 0.9201401464473162, 'bear_time_stop': 5, 'bear_use_sma': False, 'bear_use_ema': False, 'bear_use_atr': True, 'bear_use_adx': True, 'bear_use_spike': False, 'bear_rsi_required': True, 'sideways_strategy': 'breakout', 'sideways_bb_std_mult': 0.503940750113022, 'sideways_rsi_os': 27, 'sideways_rsi_ob': 95, 'sideways_adx_thresh': 30.26462254993028, 'sideways_atr_min_pct': 0.00872999215256357, 'sideways_atr_max_pct': 0.05813070473906048, 'sideways_tp_mult': 2.9012045461940237, 'sideways_tsl_mult': 0.9526227147113984, 'sideways_time_stop': 212, 'sideways_use_sma': True, 'sideways_use_ema': False, 'sideways_use_atr': False, 'sideways_use_adx': True, 'sideways_use_spike': False, 'sideways_rsi_required': True}.
[I 2025-08-31 03:08:05,898] Trial 797 finished with values: [-1000000000.0, 1000000000.0] and parameters: {'p_sma': 51, 'p_std': 50, 'p_atr': 27, 'p_adx': 29, 'rsi_period': 72, 'ema1': 5, 'ema2': 55, 'slip_atr_k': 0.22449060950428976, 'slip_spread_k': 0.6936379860205092, 'spread_hl_frac': 0.03227826852684894, 'bb_std_mult': 1.7243783783412616, 'rsi_os': 37, 'rsi_ob': 95, 'vol_spike': 0.19126225125058732, 'adx_thresh': 28.462405539820004, 'atr_min_pct': 0.008486458129737062, 'atr_max_pct': 0.12333479353982033, 'tp_mult': 1.741575544526112, 'tsl_mult': 0.6546426259645655, 'strategy': 'mean_reversion', 'time_stop': 110, 'use_sma': False, 'use_atr': False, 'use_adx': False, 'use_ema': False, 'use_spike': False, 'rsi_required': True, 'edge_k': 0.19870648102748933, 'edge_cap': 0.2107709722498295, 'bull_strategy': 'mean_reversion', 'bull_bb_std_mult': 2.2814841970126123, 'bull_rsi_os': 31, 'bull_rsi_ob': 67, 'bull_adx_thresh': 5.478915961467374, 'bull_atr_min_pct': 0.015132152352440495, 'bull_atr_max_pct': 0.08789706779732648, 'bull_tp_mult': 2.3111338341532166, 'bull_tsl_mult': 0.254467287902012, 'bull_time_stop': 285, 'bull_use_sma': True, 'bull_use_ema': True, 'bull_use_atr': False, 'bull_use_adx': True, 'bull_use_spike': True, 'bull_rsi_required': True, 'bear_strategy': 'breakout', 'bear_bb_std_mult': 3.527695302560719, 'bear_rsi_os': 18, 'bear_rsi_ob': 45, 'bear_adx_thresh': 19.269858348822318, 'bear_atr_min_pct': 0.004925793969111003, 'bear_atr_max_pct': 0.06251951492917139, 'bear_tp_mult': 2.0173097526083934, 'bear_tsl_mult': 0.5272601135446524, 'bear_time_stop': 126, 'bear_use_sma': False, 'bear_use_ema': False, 'bear_use_atr': True, 'bear_use_adx': True, 'bear_use_spike': False, 'bear_rsi_required': True, 'sideways_strategy': 'breakout', 'sideways_bb_std_mult': 0.5506046704726849, 'sideways_rsi_os': 39, 'sideways_rsi_ob': 68, 'sideways_adx_thresh': 10.11478215159316, 'sideways_atr_min_pct': 0.00851196639990879, 'sideways_atr_max_pct': 0.12225613798802679, 'sideways_tp_mult': 1.8126079506443247, 'sideways_tsl_mult': 0.613801634112072, 'sideways_time_stop': 86, 'sideways_use_sma': True, 'sideways_use_ema': False, 'sideways_use_atr': False, 'sideways_use_adx': True, 'sideways_use_spike': False, 'sideways_rsi_required': True}.
[I 2025-08-31 03:08:06,102] Trial 796 finished with values: [-1000000000.0, 1000000000.0] and parameters: {'p_sma': 30, 'p_std': 56, 'p_atr': 28, 'p_adx': 29, 'rsi_period': 72, 'ema1': 5, 'ema2': 58, 'slip_atr_k': 0.09701006956986262, 'slip_spread_k': 0.5995677981570913, 'spread_hl_frac': 0.024012076217707207, 'bb_std_mult': 1.7291716165370763, 'rsi_os': 41, 'rsi_ob': 72, 'vol_spike': 0.19041812901396238, 'adx_thresh': 33.3115637335573, 'atr_min_pct': 0.008588681301003159, 'atr_max_pct': 0.12354376269743458, 'tp_mult': 1.738038657997619, 'tsl_mult': 0.657207298099822, 'strategy': 'mean_reversion', 'time_stop': 107, 'use_sma': True, 'use_atr': False, 'use_adx': False, 'use_ema': False, 'use_spike': False, 'rsi_required': True, 'edge_k': 0.18902735936716897, 'edge_cap': 0.06902846004468122, 'bull_strategy': 'breakout', 'bull_bb_std_mult': 1.9977586028742096, 'bull_rsi_os': 22, 'bull_rsi_ob': 75, 'bull_adx_thresh': 34.79542910370259, 'bull_atr_min_pct': 0.009681548892710922, 'bull_atr_max_pct': 0.11605693899397519, 'bull_tp_mult': 2.3183339608818065, 'bull_tsl_mult': 0.23501866272973534, 'bull_time_stop': 46, 'bull_use_sma': True, 'bull_use_ema': True, 'bull_use_atr': False, 'bull_use_adx': True, 'bull_use_spike': True, 'bull_rsi_required': True, 'bear_strategy': 'mean_reversion', 'bear_bb_std_mult': 1.1575593934308095, 'bear_rsi_os': 26, 'bear_rsi_ob': 46, 'bear_adx_thresh': 5.506929343713393, 'bear_atr_min_pct': 0.00511831118538107, 'bear_atr_max_pct': 0.0626527093356211, 'bear_tp_mult': 2.5908176432081236, 'bear_tsl_mult': 0.5663235008671711, 'bear_time_stop': 182, 'bear_use_sma': False, 'bear_use_ema': False, 'bear_use_atr': False, 'bear_use_adx': True, 'bear_use_spike': False, 'bear_rsi_required': True, 'sideways_strategy': 'breakout', 'sideways_bb_std_mult': 2.829750771873785, 'sideways_rsi_os': 37, 'sideways_rsi_ob': 95, 'sideways_adx_thresh': 28.33659966950249, 'sideways_atr_min_pct': 0.026775377653593183, 'sideways_atr_max_pct': 0.06979642044769106, 'sideways_tp_mult': 1.6668753811608525, 'sideways_tsl_mult': 0.6180283176509607, 'sideways_time_stop': 286, 'sideways_use_sma': True, 'sideways_use_ema': False, 'sideways_use_atr': False, 'sideways_use_adx': True, 'sideways_use_spike': True, 'sideways_rsi_required': True}.
[I 2025-08-31 03:08:07,268] Trial 800 finished with values: [-1000000000.0, 1000000000.0] and parameters: {'p_sma': 55, 'p_std': 50, 'p_atr': 26, 'p_adx': 15, 'rsi_period': 42, 'ema1': 20, 'ema2': 27, 'slip_atr_k': 0.09782566506860824, 'slip_spread_k': 0.6231034781493081, 'spread_hl_frac': 0.017798589414297544, 'bb_std_mult': 1.7336704148725965, 'rsi_os': 17, 'rsi_ob': 85, 'vol_spike': 0.17002578398418872, 'adx_thresh': 22.063974428272637, 'atr_min_pct': 0.00866792399343108, 'atr_max_pct': 0.12289692114235068, 'tp_mult': 1.2044021163059688, 'tsl_mult': 0.37027678532102615, 'strategy': 'mean_reversion', 'time_stop': 104, 'use_sma': True, 'use_atr': False, 'use_adx': False, 'use_ema': False, 'use_spike': False, 'rsi_required': True, 'edge_k': 0.6585507026727155, 'edge_cap': 0.20141657013456093, 'bull_strategy': 'breakout', 'bull_bb_std_mult': 2.030123650771012, 'bull_rsi_os': 27, 'bull_rsi_ob': 58, 'bull_adx_thresh': 10.244635173920313, 'bull_atr_min_pct': 0.01815579866842634, 'bull_atr_max_pct': 0.08700051751472156, 'bull_tp_mult': 2.3926928500987517, 'bull_tsl_mult': 0.2928238397668398, 'bull_time_stop': 128, 'bull_use_sma': True, 'bull_use_ema': False, 'bull_use_atr': False, 'bull_use_adx': False, 'bull_use_spike': True, 'bull_rsi_required': True, 'bear_strategy': 'mean_reversion', 'bear_bb_std_mult': 2.9014239843499112, 'bear_rsi_os': 45, 'bear_rsi_ob': 45, 'bear_adx_thresh': 25.908166079333846, 'bear_atr_min_pct': 0.007636064178365848, 'bear_atr_max_pct': 0.09589835886900963, 'bear_tp_mult': 2.804357006532864, 'bear_tsl_mult': 0.531913215878238, 'bear_time_stop': 144, 'bear_use_sma': False, 'bear_use_ema': False, 'bear_use_atr': False, 'bear_use_adx': True, 'bear_use_spike': False, 'bear_rsi_required': True, 'sideways_strategy': 'breakout', 'sideways_bb_std_mult': 0.5030585931496181, 'sideways_rsi_os': 41, 'sideways_rsi_ob': 57, 'sideways_adx_thresh': 31.221295023805347, 'sideways_atr_min_pct': 0.027192555253669926, 'sideways_atr_max_pct': 0.05341673019964216, 'sideways_tp_mult': 2.89515286933387, 'sideways_tsl_mult': 0.6826292400024672, 'sideways_time_stop': 214, 'sideways_use_sma': True, 'sideways_use_ema': False, 'sideways_use_atr': False, 'sideways_use_adx': False, 'sideways_use_spike': True, 'sideways_rsi_required': False}.
