[I 2025-08-31 00:30:48,073] Trial 241 finished with values: [-0.030224662620675136, 0.030182682945449003] and parameters: {'p_sma': 50, 'p_std': 48, 'p_atr': 12, 'p_adx': 10, 'rsi_period': 32, 'ema1': 27, 'ema2': 20, 'slip_atr_k': 0.042548824475190795, 'slip_spread_k': 0.7067028331923015, 'spread_hl_frac': 0.011436974904970677, 'bb_std_mult': 3.3220548489264585, 'rsi_os': 55, 'rsi_ob': 88, 'vol_spike': 0.016115804538685715, 'adx_thresh': 7.534281571899191, 'atr_min_pct': 0.0019984242536035712, 'atr_max_pct': 0.07119157185815878, 'tp_mult': 1.2451236232138592, 'tsl_mult': 0.09832926711953922, 'strategy': 'breakout', 'time_stop': 132, 'use_sma': False, 'use_atr': False, 'use_adx': True, 'use_ema': False, 'use_spike': False, 'rsi_required': True, 'edge_k': 0.09339635328382945, 'edge_cap': 0.39877421667082313, 'bull_strategy': 'breakout', 'bull_bb_std_mult': 1.966993235312517, 'bull_rsi_os': 35, 'bull_rsi_ob': 53, 'bull_adx_thresh': 24.795283243755673, 'bull_atr_min_pct': 6.309558170373872e-05, 'bull_atr_max_pct': 0.09436594706671335, 'bull_tp_mult': 2.924940655864793, 'bull_tsl_mult': 0.30203274958964954, 'bull_time_stop': 51, 'bull_use_sma': False, 'bull_use_ema': True, 'bull_use_atr': False, 'bull_use_adx': False, 'bull_use_spike': True, 'bull_rsi_required': True, 'bear_strategy': 'breakout', 'bear_bb_std_mult': 0.5705006882184301, 'bear_rsi_os': 39, 'bear_rsi_ob': 60, 'bear_adx_thresh': 28.583271668280656, 'bear_atr_min_pct': 0.003864197171445611, 'bear_atr_max_pct': 0.14170607610008507, 'bear_tp_mult': 1.8789581509164863, 'bear_tsl_mult': 0.3797147408480469, 'bear_time_stop': 285, 'bear_use_sma': False, 'bear_use_ema': False, 'bear_use_atr': True, 'bear_use_adx': False, 'bear_use_spike': False, 'bear_rsi_required': False, 'sideways_strategy': 'mean_reversion', 'sideways_bb_std_mult': 1.3163280589072983, 'sideways_rsi_os': 14, 'sideways_rsi_ob': 75, 'sideways_adx_thresh': 11.618175951913287, 'sideways_atr_min_pct': 0.021561996847069543, 'sideways_atr_max_pct': 0.1327244724795044, 'sideways_tp_mult': 1.4496892588862638, 'sideways_tsl_mult': 0.2070656827012547, 'sideways_time_stop': 123, 'sideways_use_sma': False, 'sideways_use_ema': True, 'sideways_use_atr': False, 'sideways_use_adx': True, 'sideways_use_spike': False, 'sideways_rsi_required': True}.
[I 2025-08-31 00:31:17,469] Trial 246 finished with values: [-0.015394629378147284, 0.015398311247833476] and parameters: {'p_sma': 48, 'p_std': 39, 'p_atr': 22, 'p_adx': 8, 'rsi_period': 58, 'ema1': 7, 'ema2': 19, 'slip_atr_k': 0.03702343731054597, 'slip_spread_k': 0.24736838238545658, 'spread_hl_frac': 0.009717838158454402, 'bb_std_mult': 1.852637563331489, 'rsi_os': 54, 'rsi_ob': 74, 'vol_spike': 0.19065448744488833, 'adx_thresh': 12.47224909993831, 'atr_min_pct': 0.009274330504543845, 'atr_max_pct': 0.06966960681266626, 'tp_mult': 2.6222094563866767, 'tsl_mult': 0.11876034942377384, 'strategy': 'breakout', 'time_stop': 86, 'use_sma': True, 'use_atr': False, 'use_adx': False, 'use_ema': True, 'use_spike': False, 'rsi_required': False, 'edge_k': 0.7499988512210995, 'edge_cap': 0.8244153070686834, 'bull_strategy': 'breakout', 'bull_bb_std_mult': 2.7665586671781495, 'bull_rsi_os': 38, 'bull_rsi_ob': 70, 'bull_adx_thresh': 13.852252760246703, 'bull_atr_min_pct': 0.0007190409834318182, 'bull_atr_max_pct': 0.07478378258252466, 'bull_tp_mult': 2.4627048719969062, 'bull_tsl_mult': 0.30251447849015145, 'bull_time_stop': 164, 'bull_use_sma': False, 'bull_use_ema': False, 'bull_use_atr': True, 'bull_use_adx': True, 'bull_use_spike': False, 'bull_rsi_required': False, 'bear_strategy': 'mean_reversion', 'bear_bb_std_mult': 1.0853451040607611, 'bear_rsi_os': 22, 'bear_rsi_ob': 78, 'bear_adx_thresh': 7.718981426659457, 'bear_atr_min_pct': 0.009023280459872551, 'bear_atr_max_pct': 0.020500082809689263, 'bear_tp_mult': 1.9260425199277678, 'bear_tsl_mult': 0.6955285617777396, 'bear_time_stop': 28, 'bear_use_sma': True, 'bear_use_ema': False, 'bear_use_atr': False, 'bear_use_adx': True, 'bear_use_spike': False, 'bear_rsi_required': False, 'sideways_strategy': 'mean_reversion', 'sideways_bb_std_mult': 1.1383978671915493, 'sideways_rsi_os': 46, 'sideways_rsi_ob': 90, 'sideways_adx_thresh': 12.524015666201281, 'sideways_atr_min_pct': 0.021327518302065165, 'sideways_atr_max_pct': 0.1421756988597173, 'sideways_tp_mult': 1.059458532464854, 'sideways_tsl_mult': 0.716321025868646, 'sideways_time_stop': 171, 'sideways_use_sma': True, 'sideways_use_ema': False, 'sideways_use_atr': False, 'sideways_use_adx': False, 'sideways_use_spike': True, 'sideways_rsi_required': False}.
[I 2025-08-31 00:31:17,724] Trial 244 finished with values: [-1000000000.0, 1000000000.0] and parameters: {'p_sma': 60, 'p_std': 39, 'p_atr': 22, 'p_adx': 10, 'rsi_period': 58, 'ema1': 7, 'ema2': 32, 'slip_atr_k': 0.03804002105519806, 'slip_spread_k': 0.02313218604724665, 'spread_hl_frac': 0.011105351941357474, 'bb_std_mult': 3.5422663604613023, 'rsi_os': 54, 'rsi_ob': 48, 'vol_spike': 0.006477727316578308, 'adx_thresh': 12.394347383513761, 'atr_min_pct': 1.230876032735879e-05, 'atr_max_pct': 0.06529295516316794, 'tp_mult': 1.9956167212261673, 'tsl_mult': 0.1667011061665196, 'strategy': 'breakout', 'time_stop': 88, 'use_sma': True, 'use_atr': False, 'use_adx': False, 'use_ema': False, 'use_spike': False, 'rsi_required': True, 'edge_k': 0.8109231899450916, 'edge_cap': 0.1639719373468022, 'bull_strategy': 'breakout', 'bull_bb_std_mult': 2.6790360462640233, 'bull_rsi_os': 11, 'bull_rsi_ob': 67, 'bull_adx_thresh': 31.450195350539495, 'bull_atr_min_pct': 0.0008987477773461065, 'bull_atr_max_pct': 0.12903872127342786, 'bull_tp_mult': 1.8688751359239761, 'bull_tsl_mult': 0.24942124412877512, 'bull_time_stop': 165, 'bull_use_sma': False, 'bull_use_ema': True, 'bull_use_atr': False, 'bull_use_adx': False, 'bull_use_spike': False, 'bull_rsi_required': False, 'bear_strategy': 'breakout', 'bear_bb_std_mult': 0.5533917488116027, 'bear_rsi_os': 55, 'bear_rsi_ob': 78, 'bear_adx_thresh': 27.965452930473983, 'bear_atr_min_pct': 0.009096494005197188, 'bear_atr_max_pct': 0.09974201223268096, 'bear_tp_mult': 2.2604576352610413, 'bear_tsl_mult': 0.21042956405526647, 'bear_time_stop': 49, 'bear_use_sma': False, 'bear_use_ema': False, 'bear_use_atr': True, 'bear_use_adx': True, 'bear_use_spike': False, 'bear_rsi_required': False, 'sideways_strategy': 'mean_reversion', 'sideways_bb_std_mult': 0.5174746495351925, 'sideways_rsi_os': 46, 'sideways_rsi_ob': 45, 'sideways_adx_thresh': 11.396384292601743, 'sideways_atr_min_pct': 0.021269343607057442, 'sideways_atr_max_pct': 0.057326445345924695, 'sideways_tp_mult': 1.078115252466989, 'sideways_tsl_mult': 0.26870831794385797, 'sideways_time_stop': 106, 'sideways_use_sma': True, 'sideways_use_ema': False, 'sideways_use_atr': False, 'sideways_use_adx': False, 'sideways_use_spike': True, 'sideways_rsi_required': True}.
[I 2025-08-31 00:31:18,153] Trial 245 finished with values: [-1000000000.0, 1000000000.0] and parameters: {'p_sma': 50, 'p_std': 53, 'p_atr': 12, 'p_adx': 22, 'rsi_period': 73, 'ema1': 16, 'ema2': 22, 'slip_atr_k': 0.03724872285894229, 'slip_spread_k': 0.16825677063390476, 'spread_hl_frac': 0.009315242608422482, 'bb_std_mult': 1.5737619125905498, 'rsi_os': 54, 'rsi_ob': 88, 'vol_spike': 0.006938088213551158, 'adx_thresh': 32.97029185308606, 'atr_min_pct': 0.0009134193667149203, 'atr_max_pct': 0.0663092353508991, 'tp_mult': 2.621106631047107, 'tsl_mult': 0.13099182264877524, 'strategy': 'breakout', 'time_stop': 44, 'use_sma': True, 'use_atr': False, 'use_adx': False, 'use_ema': False, 'use_spike': False, 'rsi_required': True, 'edge_k': 0.7525898300499902, 'edge_cap': 0.9142666485052793, 'bull_strategy': 'breakout', 'bull_bb_std_mult': 2.799701732016247, 'bull_rsi_os': 38, 'bull_rsi_ob': 66, 'bull_adx_thresh': 13.896180194024359, 'bull_atr_min_pct': 0.0009159434724125232, 'bull_atr_max_pct': 0.129505793839479, 'bull_tp_mult': 1.99458666933191, 'bull_tsl_mult': 0.281561438365502, 'bull_time_stop': 46, 'bull_use_sma': False, 'bull_use_ema': True, 'bull_use_atr': True, 'bull_use_adx': True, 'bull_use_spike': False, 'bull_rsi_required': False, 'bear_strategy': 'breakout', 'bear_bb_std_mult': 1.1368966006157963, 'bear_rsi_os': 22, 'bear_rsi_ob': 78, 'bear_adx_thresh': 27.7322033129145, 'bear_atr_min_pct': 0.009217641970691923, 'bear_atr_max_pct': 0.07748877842017941, 'bear_tp_mult': 1.930107697267356, 'bear_tsl_mult': 0.20027698540416428, 'bear_time_stop': 178, 'bear_use_sma': False, 'bear_use_ema': False, 'bear_use_atr': False, 'bear_use_adx': True, 'bear_use_spike': False, 'bear_rsi_required': False, 'sideways_strategy': 'mean_reversion', 'sideways_bb_std_mult': 3.5965347998313506, 'sideways_rsi_os': 46, 'sideways_rsi_ob': 90, 'sideways_adx_thresh': 11.363294848231217, 'sideways_atr_min_pct': 0.021243246847741714, 'sideways_atr_max_pct': 0.14220697311489827, 'sideways_tp_mult': 1.9331731467678532, 'sideways_tsl_mult': 0.6541228025933145, 'sideways_time_stop': 170, 'sideways_use_sma': True, 'sideways_use_ema': False, 'sideways_use_atr': False, 'sideways_use_adx': False, 'sideways_use_spike': True, 'sideways_rsi_required': False}.
[I 2025-08-31 00:31:18,215] Trial 247 finished with values: [-1000000000.0, 1000000000.0] and parameters: {'p_sma': 38, 'p_std': 39, 'p_atr': 23, 'p_adx': 13, 'rsi_period': 76, 'ema1': 7, 'ema2': 32, 'slip_atr_k': 0.037642303239752914, 'slip_spread_k': 0.250271719870144, 'spread_hl_frac': 0.009450105957629023, 'bb_std_mult': 2.2302395203139698, 'rsi_os': 54, 'rsi_ob': 74, 'vol_spike': 0.00641856924230637, 'adx_thresh': 17.19630299706214, 'atr_min_pct': 0.02241681347331812, 'atr_max_pct': 0.06099016736328068, 'tp_mult': 2.6241649617470792, 'tsl_mult': 0.25297496927083163, 'strategy': 'breakout', 'time_stop': 42, 'use_sma': True, 'use_atr': False, 'use_adx': False, 'use_ema': True, 'use_spike': False, 'rsi_required': False, 'edge_k': 0.7486599206767277, 'edge_cap': 0.9175798628060995, 'bull_strategy': 'breakout', 'bull_bb_std_mult': 1.13490592126914, 'bull_rsi_os': 38, 'bull_rsi_ob': 91, 'bull_adx_thresh': 25.931369531270402, 'bull_atr_min_pct': 0.0009549537304831568, 'bull_atr_max_pct': 0.031358919088703086, 'bull_tp_mult': 2.26588059191114, 'bull_tsl_mult': 0.2491356871983315, 'bull_time_stop': 156, 'bull_use_sma': False, 'bull_use_ema': False, 'bull_use_atr': True, 'bull_use_adx': True, 'bull_use_spike': False, 'bull_rsi_required': False, 'bear_strategy': 'mean_reversion', 'bear_bb_std_mult': 1.2878418481076945, 'bear_rsi_os': 22, 'bear_rsi_ob': 78, 'bear_adx_thresh': 30.756510381342235, 'bear_atr_min_pct': 0.009292223738402957, 'bear_atr_max_pct': 0.07622832537129547, 'bear_tp_mult': 2.2789846617877982, 'bear_tsl_mult': 0.18856264659017336, 'bear_time_stop': 27, 'bear_use_sma': True, 'bear_use_ema': False, 'bear_use_atr': False, 'bear_use_adx': True, 'bear_use_spike': False, 'bear_rsi_required': False, 'sideways_strategy': 'breakout', 'sideways_bb_std_mult': 1.2049004127247889, 'sideways_rsi_os': 46, 'sideways_rsi_ob': 66, 'sideways_adx_thresh': 34.826506913556756, 'sideways_atr_min_pct': 0.020951997956775978, 'sideways_atr_max_pct': 0.07466669058639591, 'sideways_tp_mult': 1.0705985850918387, 'sideways_tsl_mult': 0.37777768837521886, 'sideways_time_stop': 106, 'sideways_use_sma': True, 'sideways_use_ema': False, 'sideways_use_atr': False, 'sideways_use_adx': False, 'sideways_use_spike': True, 'sideways_rsi_required': False}.
[I 2025-08-31 00:31:18,729] Trial 251 finished with values: [-1000000000.0, 1000000000.0] and parameters: {'p_sma': 47, 'p_std': 41, 'p_atr': 21, 'p_adx': 14, 'rsi_period': 55, 'ema1': 6, 'ema2': 16, 'slip_atr_k': 0.030277921271673246, 'slip_spread_k': 0.22033812223920182, 'spread_hl_frac': 0.008637414393310918, 'bb_std_mult': 1.7266314609825866, 'rsi_os': 51, 'rsi_ob': 70, 'vol_spike': 0.19270438122590616, 'adx_thresh': 11.887807674543915, 'atr_min_pct': 0.012312461745898343, 'atr_max_pct': 0.07554114966555474, 'tp_mult': 2.746952283052707, 'tsl_mult': 0.11647920487372396, 'strategy': 'mean_reversion', 'time_stop': 95, 'use_sma': True, 'use_atr': True, 'use_adx': False, 'use_ema': True, 'use_spike': False, 'rsi_required': False, 'edge_k': 0.670245284585158, 'edge_cap': 0.8263755359987421, 'bull_strategy': 'mean_reversion', 'bull_bb_std_mult': 3.036194200104781, 'bull_rsi_os': 41, 'bull_rsi_ob': 72, 'bull_adx_thresh': 14.799634370464746, 'bull_atr_min_pct': 0.0026423880435322705, 'bull_atr_max_pct': 0.0757978455104574, 'bull_tp_mult': 2.455197047546017, 'bull_tsl_mult': 0.36180158532647766, 'bull_time_stop': 187, 'bull_use_sma': True, 'bull_use_ema': False, 'bull_use_atr': True, 'bull_use_adx': True, 'bull_use_spike': False, 'bull_rsi_required': False, 'bear_strategy': 'mean_reversion', 'bear_bb_std_mult': 1.0297567515680544, 'bear_rsi_os': 21, 'bear_rsi_ob': 80, 'bear_adx_thresh': 5.803588869404582, 'bear_atr_min_pct': 0.007414989655017196, 'bear_atr_max_pct': 0.020581267469782474, 'bear_tp_mult': 1.8639357067714775, 'bear_tsl_mult': 0.717842175623128, 'bear_time_stop': 21, 'bear_use_sma': True, 'bear_use_ema': False, 'bear_use_atr': False, 'bear_use_adx': True, 'bear_use_spike': True, 'bear_rsi_required': False, 'sideways_strategy': 'breakout', 'sideways_bb_std_mult': 0.9451117356246587, 'sideways_rsi_os': 49, 'sideways_rsi_ob': 86, 'sideways_adx_thresh': 13.595050575611621, 'sideways_atr_min_pct': 0.013705599683734512, 'sideways_atr_max_pct': 0.14722250559633815, 'sideways_tp_mult': 1.0480218421203162, 'sideways_tsl_mult': 0.6831054083855133, 'sideways_time_stop': 165, 'sideways_use_sma': True, 'sideways_use_ema': False, 'sideways_use_atr': False, 'sideways_use_adx': False, 'sideways_use_spike': True, 'sideways_rsi_required': False}.
[I 2025-08-31 00:31:48,042] Trial 248 finished with values: [-1000000000.0, 1000000000.0] and parameters: {'p_sma': 44, 'p_std': 42, 'p_atr': 22, 'p_adx': 13, 'rsi_period': 57, 'ema1': 7, 'ema2': 17, 'slip_atr_k': 0.030523351303051015, 'slip_spread_k': 0.2250712048480908, 'spread_hl_frac': 0.008853036522566103, 'bb_std_mult': 1.8560346433388049, 'rsi_os': 51, 'rsi_ob': 71, 'vol_spike': 0.19230625012419167, 'adx_thresh': 12.563682957604248, 'atr_min_pct': 0.009369352862711967, 'atr_max_pct': 0.0744045885628299, 'tp_mult': 2.669586999272004, 'tsl_mult': 0.12194967937145695, 'strategy': 'breakout', 'time_stop': 90, 'use_sma': True, 'use_atr': False, 'use_adx': False, 'use_ema': True, 'use_spike': False, 'rsi_required': False, 'edge_k': 0.6422226587018584, 'edge_cap': 0.8235782893827993, 'bull_strategy': 'mean_reversion', 'bull_bb_std_mult': 2.806669848005849, 'bull_rsi_os': 39, 'bull_rsi_ob': 72, 'bull_adx_thresh': 31.418539895071746, 'bull_atr_min_pct': 0.0025341396426795553, 'bull_atr_max_pct': 0.07532468982150377, 'bull_tp_mult': 2.443175505048957, 'bull_tsl_mult': 0.3609652300674606, 'bull_time_stop': 169, 'bull_use_sma': False, 'bull_use_ema': False, 'bull_use_atr': True, 'bull_use_adx': True, 'bull_use_spike': False, 'bull_rsi_required': False, 'bear_strategy': 'mean_reversion', 'bear_bb_std_mult': 1.0566152605905879, 'bear_rsi_os': 22, 'bear_rsi_ob': 81, 'bear_adx_thresh': 7.962419975782272, 'bear_atr_min_pct': 0.0075159212201895195, 'bear_atr_max_pct': 0.02086953206784942, 'bear_tp_mult': 1.8011510126400092, 'bear_tsl_mult': 0.7112709119602749, 'bear_time_stop': 23, 'bear_use_sma': True, 'bear_use_ema': False, 'bear_use_atr': False, 'bear_use_adx': True, 'bear_use_spike': False, 'bear_rsi_required': False, 'sideways_strategy': 'breakout', 'sideways_bb_std_mult': 0.974410605206366, 'sideways_rsi_os': 49, 'sideways_rsi_ob': 90, 'sideways_adx_thresh': 13.37696637316703, 'sideways_atr_min_pct': 0.013636142909923231, 'sideways_atr_max_pct': 0.14250424581149107, 'sideways_tp_mult': 1.0313155894142738, 'sideways_tsl_mult': 0.7147302232177155, 'sideways_time_stop': 170, 'sideways_use_sma': True, 'sideways_use_ema': False, 'sideways_use_atr': False, 'sideways_use_adx': False, 'sideways_use_spike': True, 'sideways_rsi_required': False}.
[I 2025-08-31 00:31:48,257] Trial 250 finished with values: [-1000000000.0, 1000000000.0] and parameters: {'p_sma': 47, 'p_std': 41, 'p_atr': 23, 'p_adx': 11, 'rsi_period': 56, 'ema1': 7, 'ema2': 17, 'slip_atr_k': 0.029516758865460506, 'slip_spread_k': 0.23309580135187036, 'spread_hl_frac': 0.0091103159841949, 'bb_std_mult': 1.8429705875755942, 'rsi_os': 51, 'rsi_ob': 69, 'vol_spike': 0.1874042108484119, 'adx_thresh': 18.05759805903783, 'atr_min_pct': 0.008880490193162595, 'atr_max_pct': 0.07351895880160528, 'tp_mult': 2.6452577443077017, 'tsl_mult': 0.11928770055641424, 'strategy': 'breakout', 'time_stop': 95, 'use_sma': True, 'use_atr': True, 'use_adx': False, 'use_ema': True, 'use_spike': False, 'rsi_required': False, 'edge_k': 0.6824948527038363, 'edge_cap': 0.8159320145617824, 'bull_strategy': 'mean_reversion', 'bull_bb_std_mult': 2.9935856788047164, 'bull_rsi_os': 41, 'bull_rsi_ob': 71, 'bull_adx_thresh': 14.748041923953961, 'bull_atr_min_pct': 0.002649801413054682, 'bull_atr_max_pct': 0.07422479487590845, 'bull_tp_mult': 2.4679805347225328, 'bull_tsl_mult': 0.3733097777610314, 'bull_time_stop': 189, 'bull_use_sma': True, 'bull_use_ema': False, 'bull_use_atr': True, 'bull_use_adx': True, 'bull_use_spike': False, 'bull_rsi_required': False, 'bear_strategy': 'mean_reversion', 'bear_bb_std_mult': 1.0476195303652078, 'bear_rsi_os': 21, 'bear_rsi_ob': 82, 'bear_adx_thresh': 6.022360682234624, 'bear_atr_min_pct': 0.007772331061826799, 'bear_atr_max_pct': 0.02050433428943791, 'bear_tp_mult': 1.8502065258101816, 'bear_tsl_mult': 0.7143042258115765, 'bear_time_stop': 24, 'bear_use_sma': True, 'bear_use_ema': False, 'bear_use_atr': False, 'bear_use_adx': True, 'bear_use_spike': False, 'bear_rsi_required': False, 'sideways_strategy': 'breakout', 'sideways_bb_std_mult': 0.9648615160489471, 'sideways_rsi_os': 49, 'sideways_rsi_ob': 86, 'sideways_adx_thresh': 13.448500319664113, 'sideways_atr_min_pct': 0.013697243420587984, 'sideways_atr_max_pct': 0.14748760491589952, 'sideways_tp_mult': 1.051901097648852, 'sideways_tsl_mult': 0.6865474396014325, 'sideways_time_stop': 165, 'sideways_use_sma': True, 'sideways_use_ema': False, 'sideways_use_atr': False, 'sideways_use_adx': False, 'sideways_use_spike': True, 'sideways_rsi_required': False}.
[I 2025-08-31 00:31:48,289] Trial 249 finished with values: [-1000000000.0, 0.15791552918290425] and parameters: {'p_sma': 47, 'p_std': 42, 'p_atr': 23, 'p_adx': 13, 'rsi_period': 56, 'ema1': 6, 'ema2': 17, 'slip_atr_k': 0.030399731679876293, 'slip_spread_k': 0.2540039354543914, 'spread_hl_frac': 0.009228297439590496, 'bb_std_mult': 1.8355102033267445, 'rsi_os': 51, 'rsi_ob': 71, 'vol_spike': 0.19737704974663095, 'adx_thresh': 12.586167613442742, 'atr_min_pct': 0.009478950742435613, 'atr_max_pct': 0.07579594256839621, 'tp_mult': 2.7238401809838857, 'tsl_mult': 0.2359312472855798, 'strategy': 'breakout', 'time_stop': 98, 'use_sma': True, 'use_atr': True, 'use_adx': False, 'use_ema': True, 'use_spike': False, 'rsi_required': False, 'edge_k': 0.6378481041010158, 'edge_cap': 0.8229922463744648, 'bull_strategy': 'mean_reversion', 'bull_bb_std_mult': 3.049876241662039, 'bull_rsi_os': 40, 'bull_rsi_ob': 71, 'bull_adx_thresh': 25.9315509737354, 'bull_atr_min_pct': 0.0027287748519172926, 'bull_atr_max_pct': 0.07502691290211687, 'bull_tp_mult': 2.493494399292721, 'bull_tsl_mult': 0.36982248056086, 'bull_time_stop': 190, 'bull_use_sma': True, 'bull_use_ema': False, 'bull_use_atr': True, 'bull_use_adx': True, 'bull_use_spike': False, 'bull_rsi_required': False, 'bear_strategy': 'mean_reversion', 'bear_bb_std_mult': 1.0564063538379154, 'bear_rsi_os': 22, 'bear_rsi_ob': 82, 'bear_adx_thresh': 8.730848551269792, 'bear_atr_min_pct': 0.007834252516165903, 'bear_atr_max_pct': 0.02061046977847638, 'bear_tp_mult': 1.8450122326136282, 'bear_tsl_mult': 0.71266648260987, 'bear_time_stop': 23, 'bear_use_sma': True, 'bear_use_ema': False, 'bear_use_atr': False, 'bear_use_adx': True, 'bear_use_spike': False, 'bear_rsi_required': False, 'sideways_strategy': 'breakout', 'sideways_bb_std_mult': 0.9675750337837111, 'sideways_rsi_os': 49, 'sideways_rsi_ob': 90, 'sideways_adx_thresh': 13.818807407915688, 'sideways_atr_min_pct': 8.604211448207111e-05, 'sideways_atr_max_pct': 0.14778216782567843, 'sideways_tp_mult': 1.0469733223573643, 'sideways_tsl_mult': 0.6844915852578661, 'sideways_time_stop': 170, 'sideways_use_sma': True, 'sideways_use_ema': False, 'sideways_use_atr': False, 'sideways_use_adx': False, 'sideways_use_spike': True, 'sideways_rsi_required': False}.
