[I 2025-08-31 00:12:01,481] Trial 80 finished with values: [-1000000000.0, 1000000000.0] and parameters: {'p_sma': 28, 'p_std': 12, 'p_atr': 14, 'p_adx': 26, 'rsi_period': 56, 'ema1': 16, 'ema2': 21, 'slip_atr_k': 0.2083274524892292, 'slip_spread_k': 0.5238922622113149, 'spread_hl_frac': 0.028326503624144003, 'bb_std_mult': 0.961521696580472, 'rsi_os': 14, 'rsi_ob': 78, 'vol_spike': 0.061486402989688944, 'adx_thresh': 24.771731800065425, 'atr_min_pct': 0.0047959831863902255, 'atr_max_pct': 0.038452156658530745, 'tp_mult': 1.010533209338147, 'tsl_mult': 0.18976261779371995, 'strategy': 'mean_reversion', 'time_stop': 206, 'use_sma': True, 'use_atr': True, 'use_adx': False, 'use_ema': False, 'use_spike': False, 'rsi_required': False, 'edge_k': 1.341589974186514, 'edge_cap': 0.9616899018319862, 'bull_strategy': 'breakout', 'bull_bb_std_mult': 0.846158496947176, 'bull_rsi_os': 8, 'bull_rsi_ob': 73, 'bull_adx_thresh': 12.158012993731779, 'bull_atr_min_pct': 0.0031109437373378957, 'bull_atr_max_pct': 0.07326827972252913, 'bull_tp_mult': 2.181297248050947, 'bull_tsl_mult': 0.5409592211765168, 'bull_time_stop': 114, 'bull_use_sma': True, 'bull_use_ema': True, 'bull_use_atr': False, 'bull_use_adx': True, 'bull_use_spike': False, 'bull_rsi_required': False, 'bear_strategy': 'breakout', 'bear_bb_std_mult': 0.9035743626852807, 'bear_rsi_os': 11, 'bear_rsi_ob': 72, 'bear_adx_thresh': 25.924928363774647, 'bear_atr_min_pct': 0.012952896160389802, 'bear_atr_max_pct': 0.11163306585272692, 'bear_tp_mult': 2.6984958452241594, 'bear_tsl_mult': 0.3763642392741504, 'bear_time_stop': 183, 'bear_use_sma': False, 'bear_use_ema': False, 'bear_use_atr': True, 'bear_use_adx': True, 'bear_use_spike': False, 'bear_rsi_required': True, 'sideways_strategy': 'mean_reversion', 'sideways_bb_std_mult': 3.0801084267557424, 'sideways_rsi_os': 54, 'sideways_rsi_ob': 68, 'sideways_adx_thresh': 20.342789823744315, 'sideways_atr_min_pct': 0.009896283603450831, 'sideways_atr_max_pct': 0.06524032502080637, 'sideways_tp_mult': 1.920020367968903, 'sideways_tsl_mult': 0.0004231365710200691, 'sideways_time_stop': 129, 'sideways_use_sma': False, 'sideways_use_ema': False, 'sideways_use_atr': False, 'sideways_use_adx': False, 'sideways_use_spike': True, 'sideways_rsi_required': True}.
[I 2025-08-31 00:12:01,630] Trial 82 finished with values: [-0.02070897112703174, 0.02062841407600434] and parameters: {'p_sma': 28, 'p_std': 14, 'p_atr': 29, 'p_adx': 26, 'rsi_period': 63, 'ema1': 25, 'ema2': 27, 'slip_atr_k': 0.04239225551823688, 'slip_spread_k': 0.544971934447183, 'spread_hl_frac': 0.0225718788874207, 'bb_std_mult': 1.4252436045300647, 'rsi_os': 14, 'rsi_ob': 94, 'vol_spike': 0.16499249454405693, 'adx_thresh': 27.611527388449236, 'atr_min_pct': 0.00015771762483904415, 'atr_max_pct': 0.10774370716104234, 'tp_mult': 2.6001316729886574, 'tsl_mult': 0.17440043822785356, 'strategy': 'mean_reversion', 'time_stop': 207, 'use_sma': True, 'use_atr': False, 'use_adx': False, 'use_ema': False, 'use_spike': False, 'rsi_required': False, 'edge_k': 0.8414453205812208, 'edge_cap': 0.5961809811301849, 'bull_strategy': 'breakout', 'bull_bb_std_mult': 0.9897373314639413, 'bull_rsi_os': 38, 'bull_rsi_ob': 70, 'bull_adx_thresh': 14.038246979508497, 'bull_atr_min_pct': 0.00010169380072705826, 'bull_atr_max_pct': 0.07683028617372696, 'bull_tp_mult': 2.9996843724171414, 'bull_tsl_mult': 0.558234360110337, 'bull_time_stop': 164, 'bull_use_sma': False, 'bull_use_ema': True, 'bull_use_atr': False, 'bull_use_adx': True, 'bull_use_spike': False, 'bull_rsi_required': False, 'bear_strategy': 'breakout', 'bear_bb_std_mult': 0.5731628270662974, 'bear_rsi_os': 13, 'bear_rsi_ob': 92, 'bear_adx_thresh': 18.758150364453932, 'bear_atr_min_pct': 0.017234594131028312, 'bear_atr_max_pct': 0.11190063402632823, 'bear_tp_mult': 2.670036031013117, 'bear_tsl_mult': 0.17925013525474576, 'bear_time_stop': 182, 'bear_use_sma': False, 'bear_use_ema': False, 'bear_use_atr': True, 'bear_use_adx': True, 'bear_use_spike': False, 'bear_rsi_required': True, 'sideways_strategy': 'mean_reversion', 'sideways_bb_std_mult': 3.421725000858893, 'sideways_rsi_os': 45, 'sideways_rsi_ob': 68, 'sideways_adx_thresh': 26.858003727770154, 'sideways_atr_min_pct': 0.02091261145278931, 'sideways_atr_max_pct': 0.06832063808751807, 'sideways_tp_mult': 1.9271670388814905, 'sideways_tsl_mult': 0.13276392549098787, 'sideways_time_stop': 102, 'sideways_use_sma': False, 'sideways_use_ema': False, 'sideways_use_atr': False, 'sideways_use_adx': False, 'sideways_use_spike': True, 'sideways_rsi_required': True}.
[I 2025-08-31 00:12:32,627] Trial 86 finished with values: [-1000000000.0, 1000000000.0] and parameters: {'p_sma': 41, 'p_std': 32, 'p_atr': 11, 'p_adx': 30, 'rsi_period': 63, 'ema1': 25, 'ema2': 19, 'slip_atr_k': 0.06008265852167686, 'slip_spread_k': 0.5370428388039745, 'spread_hl_frac': 0.023686040312536388, 'bb_std_mult': 2.1277555192732827, 'rsi_os': 53, 'rsi_ob': 95, 'vol_spike': 0.011140512619399079, 'adx_thresh': 27.62920556931728, 'atr_min_pct': 0.02709464797884923, 'atr_max_pct': 0.10905259181715456, 'tp_mult': 2.5015964139614733, 'tsl_mult': 0.028330149870002985, 'strategy': 'breakout', 'time_stop': 49, 'use_sma': False, 'use_atr': False, 'use_adx': False, 'use_ema': False, 'use_spike': False, 'rsi_required': False, 'edge_k': 0.813707876321613, 'edge_cap': 0.8623230913388897, 'bull_strategy': 'breakout', 'bull_bb_std_mult': 0.6584384997386692, 'bull_rsi_os': 47, 'bull_rsi_ob': 80, 'bull_adx_thresh': 5.001570323055711, 'bull_atr_min_pct': 0.025458035263445845, 'bull_atr_max_pct': 0.07842272491112583, 'bull_tp_mult': 2.1476493830827823, 'bull_tsl_mult': 0.306720090167239, 'bull_time_stop': 138, 'bull_use_sma': False, 'bull_use_ema': True, 'bull_use_atr': False, 'bull_use_adx': True, 'bull_use_spike': False, 'bull_rsi_required': False, 'bear_strategy': 'breakout', 'bear_bb_std_mult': 1.6671976465070912, 'bear_rsi_os': 13, 'bear_rsi_ob': 71, 'bear_adx_thresh': 19.023701921082203, 'bear_atr_min_pct': 0.017442125759930364, 'bear_atr_max_pct': 0.07552719333459285, 'bear_tp_mult': 2.228126207143839, 'bear_tsl_mult': 0.10719285611362966, 'bear_time_stop': 197, 'bear_use_sma': False, 'bear_use_ema': False, 'bear_use_atr': True, 'bear_use_adx': True, 'bear_use_spike': False, 'bear_rsi_required': True, 'sideways_strategy': 'breakout', 'sideways_bb_std_mult': 3.4590631961959133, 'sideways_rsi_os': 46, 'sideways_rsi_ob': 72, 'sideways_adx_thresh': 23.937837473490173, 'sideways_atr_min_pct': 0.021176653627255734, 'sideways_atr_max_pct': 0.1487511797135176, 'sideways_tp_mult': 1.8345811629371314, 'sideways_tsl_mult': 0.1488560258071598, 'sideways_time_stop': 106, 'sideways_use_sma': False, 'sideways_use_ema': False, 'sideways_use_atr': False, 'sideways_use_adx': False, 'sideways_use_spike': False, 'sideways_rsi_required': True}.
[I 2025-08-31 00:12:32,963] Trial 85 finished with values: [-0.01643057568777062, 0.0164310618525924] and parameters: {'p_sma': 42, 'p_std': 34, 'p_atr': 13, 'p_adx': 7, 'rsi_period': 63, 'ema1': 25, 'ema2': 20, 'slip_atr_k': 0.05914100484358386, 'slip_spread_k': 0.4612667796708006, 'spread_hl_frac': 0.010720548564020646, 'bb_std_mult': 3.4561808113849564, 'rsi_os': 53, 'rsi_ob': 75, 'vol_spike': 0.013553464348982469, 'adx_thresh': 22.510553197724725, 'atr_min_pct': 8.435619593225507e-05, 'atr_max_pct': 0.10619133900469147, 'tp_mult': 2.5159066072858836, 'tsl_mult': 0.037534386589986576, 'strategy': 'breakout', 'time_stop': 149, 'use_sma': True, 'use_atr': False, 'use_adx': False, 'use_ema': False, 'use_spike': False, 'rsi_required': False, 'edge_k': 0.8572107000490712, 'edge_cap': 0.8619656304531701, 'bull_strategy': 'breakout', 'bull_bb_std_mult': 2.2810394454215435, 'bull_rsi_os': 39, 'bull_rsi_ob': 71, 'bull_adx_thresh': 13.937954024667903, 'bull_atr_min_pct': 0.0007597532323844893, 'bull_atr_max_pct': 0.09087868345153557, 'bull_tp_mult': 2.9814571086482617, 'bull_tsl_mult': 0.37818044494513725, 'bull_time_stop': 143, 'bull_use_sma': False, 'bull_use_ema': True, 'bull_use_atr': False, 'bull_use_adx': True, 'bull_use_spike': False, 'bull_rsi_required': False, 'bear_strategy': 'breakout', 'bear_bb_std_mult': 0.917552219457158, 'bear_rsi_os': 23, 'bear_rsi_ob': 77, 'bear_adx_thresh': 31.008466425638055, 'bear_atr_min_pct': 0.011575509458648915, 'bear_atr_max_pct': 0.13546468487083288, 'bear_tp_mult': 2.236022995509308, 'bear_tsl_mult': 0.18092415054888122, 'bear_time_stop': 202, 'bear_use_sma': False, 'bear_use_ema': False, 'bear_use_atr': True, 'bear_use_adx': True, 'bear_use_spike': False, 'bear_rsi_required': True, 'sideways_strategy': 'mean_reversion', 'sideways_bb_std_mult': 1.1819036261321059, 'sideways_rsi_os': 46, 'sideways_rsi_ob': 71, 'sideways_adx_thresh': 11.532924932655769, 'sideways_atr_min_pct': 0.021352123241337447, 'sideways_atr_max_pct': 0.14246820009410022, 'sideways_tp_mult': 1.0106293953223449, 'sideways_tsl_mult': 0.1473599902921169, 'sideways_time_stop': 107, 'sideways_use_sma': False, 'sideways_use_ema': False, 'sideways_use_atr': False, 'sideways_use_adx': False, 'sideways_use_spike': True, 'sideways_rsi_required': False}.
[I 2025-08-31 00:12:33,383] Trial 83 finished with values: [-0.021235021420630606, 0.021140169265435167] and parameters: {'p_sma': 27, 'p_std': 32, 'p_atr': 29, 'p_adx': 8, 'rsi_period': 64, 'ema1': 16, 'ema2': 20, 'slip_atr_k': 0.14263644460378141, 'slip_spread_k': 0.5316143920090852, 'spread_hl_frac': 0.028166072531564088, 'bb_std_mult': 0.982696308500763, 'rsi_os': 14, 'rsi_ob': 75, 'vol_spike': 0.009939976583080629, 'adx_thresh': 27.07930606277567, 'atr_min_pct': 0.0048711445712739665, 'atr_max_pct': 0.03192474714261321, 'tp_mult': 2.588845659410251, 'tsl_mult': 0.18962634424009478, 'strategy': 'mean_reversion', 'time_stop': 45, 'use_sma': True, 'use_atr': False, 'use_adx': False, 'use_ema': False, 'use_spike': False, 'rsi_required': False, 'edge_k': 0.843203747071746, 'edge_cap': 0.9582844890784751, 'bull_strategy': 'breakout', 'bull_bb_std_mult': 0.855951132921521, 'bull_rsi_os': 15, 'bull_rsi_ob': 71, 'bull_adx_thresh': 33.76406927036413, 'bull_atr_min_pct': 4.8538547127275765e-05, 'bull_atr_max_pct': 0.07567540999644803, 'bull_tp_mult': 2.177101486508102, 'bull_tsl_mult': 0.5477781321684358, 'bull_time_stop': 146, 'bull_use_sma': False, 'bull_use_ema': True, 'bull_use_atr': False, 'bull_use_adx': True, 'bull_use_spike': False, 'bull_rsi_required': False, 'bear_strategy': 'breakout', 'bear_bb_std_mult': 0.8817773381425151, 'bear_rsi_os': 12, 'bear_rsi_ob': 93, 'bear_adx_thresh': 17.2552083153765, 'bear_atr_min_pct': 0.0132202933817329, 'bear_atr_max_pct': 0.13684288344428316, 'bear_tp_mult': 2.6930545376635653, 'bear_tsl_mult': 0.16574890966674466, 'bear_time_stop': 178, 'bear_use_sma': False, 'bear_use_ema': False, 'bear_use_atr': True, 'bear_use_adx': True, 'bear_use_spike': False, 'bear_rsi_required': True, 'sideways_strategy': 'mean_reversion', 'sideways_bb_std_mult': 1.242056713808076, 'sideways_rsi_os': 45, 'sideways_rsi_ob': 67, 'sideways_adx_thresh': 20.23434597654061, 'sideways_atr_min_pct': 0.009770132715320883, 'sideways_atr_max_pct': 0.06674335634707923, 'sideways_tp_mult': 2.333026422503279, 'sideways_tsl_mult': 0.002898273327227474, 'sideways_time_stop': 100, 'sideways_use_sma': False, 'sideways_use_ema': False, 'sideways_use_atr': False, 'sideways_use_adx': False, 'sideways_use_spike': True, 'sideways_rsi_required': False}.
[I 2025-08-31 00:12:33,394] Trial 84 finished with values: [-0.01886385439007865, 0.018800102163268165] and parameters: {'p_sma': 41, 'p_std': 13, 'p_atr': 11, 'p_adx': 26, 'rsi_period': 63, 'ema1': 25, 'ema2': 20, 'slip_atr_k': 0.05901825891705927, 'slip_spread_k': 0.5332793645068702, 'spread_hl_frac': 0.028539511420623706, 'bb_std_mult': 3.444991305626734, 'rsi_os': 14, 'rsi_ob': 75, 'vol_spike': 0.05922978178397362, 'adx_thresh': 12.51385022725891, 'atr_min_pct': 0.004761297562930585, 'atr_max_pct': 0.10926011459045562, 'tp_mult': 2.4137303426392007, 'tsl_mult': 0.030369521260411172, 'strategy': 'mean_reversion', 'time_stop': 147, 'use_sma': True, 'use_atr': False, 'use_adx': False, 'use_ema': False, 'use_spike': False, 'rsi_required': False, 'edge_k': 0.8468808253364684, 'edge_cap': 0.9451384420286075, 'bull_strategy': 'breakout', 'bull_bb_std_mult': 0.828480463183374, 'bull_rsi_os': 14, 'bull_rsi_ob': 70, 'bull_adx_thresh': 16.421593762628422, 'bull_atr_min_pct': 0.0013479782531923001, 'bull_atr_max_pct': 0.07783872243492518, 'bull_tp_mult': 2.151775595986774, 'bull_tsl_mult': 0.5504639772829143, 'bull_time_stop': 146, 'bull_use_sma': False, 'bull_use_ema': True, 'bull_use_atr': False, 'bull_use_adx': True, 'bull_use_spike': False, 'bull_rsi_required': False, 'bear_strategy': 'breakout', 'bear_bb_std_mult': 0.9134645294297559, 'bear_rsi_os': 11, 'bear_rsi_ob': 72, 'bear_adx_thresh': 19.433453336143597, 'bear_atr_min_pct': 0.016943657078737916, 'bear_atr_max_pct': 0.11586355844077725, 'bear_tp_mult': 2.6159164186309325, 'bear_tsl_mult': 0.17968326466044204, 'bear_time_stop': 182, 'bear_use_sma': False, 'bear_use_ema': False, 'bear_use_atr': True, 'bear_use_adx': True, 'bear_use_spike': False, 'bear_rsi_required': True, 'sideways_strategy': 'mean_reversion', 'sideways_bb_std_mult': 1.1113900694333774, 'sideways_rsi_os': 54, 'sideways_rsi_ob': 67, 'sideways_adx_thresh': 12.021864584370856, 'sideways_atr_min_pct': 0.010227106428572157, 'sideways_atr_max_pct': 0.06721584430358823, 'sideways_tp_mult': 1.4356715876149442, 'sideways_tsl_mult': 0.13502717465841518, 'sideways_time_stop': 106, 'sideways_use_sma': False, 'sideways_use_ema': False, 'sideways_use_atr': False, 'sideways_use_adx': False, 'sideways_use_spike': True, 'sideways_rsi_required': True}.
[I 2025-08-31 00:13:04,122] Trial 90 finished with values: [-1000000000.0, 1000000000.0] and parameters: {'p_sma': 48, 'p_std': 38, 'p_atr': 15, 'p_adx': 8, 'rsi_period': 63, 'ema1': 26, 'ema2': 56, 'slip_atr_k': 0.0431709674072079, 'slip_spread_k': 0.24843773673050545, 'spread_hl_frac': 0.016884518774232225, 'bb_std_mult': 3.454365037912853, 'rsi_os': 55, 'rsi_ob': 60, 'vol_spike': 0.0006181442655681692, 'adx_thresh': 12.302604618866855, 'atr_min_pct': 3.866887894245257e-05, 'atr_max_pct': 0.14553689655882032, 'tp_mult': 2.59922699184323, 'tsl_mult': 0.04067987488229981, 'strategy': 'breakout', 'time_stop': 128, 'use_sma': False, 'use_atr': False, 'use_adx': False, 'use_ema': False, 'use_spike': False, 'rsi_required': True, 'edge_k': 0.7298621670091228, 'edge_cap': 0.9309314375594376, 'bull_strategy': 'breakout', 'bull_bb_std_mult': 2.3876204912300665, 'bull_rsi_os': 34, 'bull_rsi_ob': 70, 'bull_adx_thresh': 16.27841269069478, 'bull_atr_min_pct': 0.002968529306412815, 'bull_atr_max_pct': 0.0947523074217834, 'bull_tp_mult': 2.9746182419268794, 'bull_tsl_mult': 0.22986855863314823, 'bull_time_stop': 162, 'bull_use_sma': False, 'bull_use_ema': True, 'bull_use_atr': False, 'bull_use_adx': True, 'bull_use_spike': False, 'bull_rsi_required': False, 'bear_strategy': 'breakout', 'bear_bb_std_mult': 0.5394201611444189, 'bear_rsi_os': 16, 'bear_rsi_ob': 77, 'bear_adx_thresh': 25.683043613788843, 'bear_atr_min_pct': 0.011310283512873054, 'bear_atr_max_pct': 0.13787547649311235, 'bear_tp_mult': 1.755329818328877, 'bear_tsl_mult': 0.31045873950515035, 'bear_time_stop': 260, 'bear_use_sma': False, 'bear_use_ema': False, 'bear_use_atr': True, 'bear_use_adx': True, 'bear_use_spike': False, 'bear_rsi_required': False, 'sideways_strategy': 'mean_reversion', 'sideways_bb_std_mult': 1.1131792642313538, 'sideways_rsi_os': 41, 'sideways_rsi_ob': 73, 'sideways_adx_thresh': 11.76979645020884, 'sideways_atr_min_pct': 0.02399102623177761, 'sideways_atr_max_pct': 0.142132716047459, 'sideways_tp_mult': 1.0889770498434495, 'sideways_tsl_mult': 0.35618962863129267, 'sideways_time_stop': 78, 'sideways_use_sma': False, 'sideways_use_ema': False, 'sideways_use_atr': False, 'sideways_use_adx': False, 'sideways_use_spike': False, 'sideways_rsi_required': False}.
[I 2025-08-31 00:13:04,361] Trial 89 finished with values: [-1000000000.0, 1000000000.0] and parameters: {'p_sma': 42, 'p_std': 39, 'p_atr': 17, 'p_adx': 8, 'rsi_period': 62, 'ema1': 26, 'ema2': 27, 'slip_atr_k': 0.05410641260043396, 'slip_spread_k': 0.15338255691074615, 'spread_hl_frac': 0.016670893479264644, 'bb_std_mult': 3.15493643772876, 'rsi_os': 55, 'rsi_ob': 50, 'vol_spike': 0.01829023872503044, 'adx_thresh': 21.11864922211059, 'atr_min_pct': 0.001483244688075436, 'atr_max_pct': 0.14859201582909493, 'tp_mult': 2.455138830090963, 'tsl_mult': 0.11684649236311812, 'strategy': 'breakout', 'time_stop': 129, 'use_sma': False, 'use_atr': False, 'use_adx': False, 'use_ema': False, 'use_spike': False, 'rsi_required': True, 'edge_k': 0.7536036943694879, 'edge_cap': 0.8720620227457216, 'bull_strategy': 'breakout', 'bull_bb_std_mult': 2.158202904893905, 'bull_rsi_os': 34, 'bull_rsi_ob': 67, 'bull_adx_thresh': 17.353594599944913, 'bull_atr_min_pct': 0.012669570568868012, 'bull_atr_max_pct': 0.09409993505960854, 'bull_tp_mult': 2.962951521145411, 'bull_tsl_mult': 0.24170332771480862, 'bull_time_stop': 145, 'bull_use_sma': False, 'bull_use_ema': True, 'bull_use_atr': False, 'bull_use_adx': True, 'bull_use_spike': False, 'bull_rsi_required': False, 'bear_strategy': 'breakout', 'bear_bb_std_mult': 0.527067444720623, 'bear_rsi_os': 23, 'bear_rsi_ob': 76, 'bear_adx_thresh': 28.38528504446156, 'bear_atr_min_pct': 0.011381509657865671, 'bear_atr_max_pct': 0.13869231606950408, 'bear_tp_mult': 1.7568213483287733, 'bear_tsl_mult': 0.30964225023738745, 'bear_time_stop': 151, 'bear_use_sma': False, 'bear_use_ema': False, 'bear_use_atr': True, 'bear_use_adx': True, 'bear_use_spike': False, 'bear_rsi_required': False, 'sideways_strategy': 'mean_reversion', 'sideways_bb_std_mult': 1.0285581460305435, 'sideways_rsi_os': 41, 'sideways_rsi_ob': 74, 'sideways_adx_thresh': 11.739789179798837, 'sideways_atr_min_pct': 0.024469132466720285, 'sideways_atr_max_pct': 0.1434835482960871, 'sideways_tp_mult': 1.0604127543818669, 'sideways_tsl_mult': 0.336127398111624, 'sideways_time_stop': 79, 'sideways_use_sma': False, 'sideways_use_ema': False, 'sideways_use_atr': False, 'sideways_use_adx': False, 'sideways_use_spike': False, 'sideways_rsi_required': False}.
[I 2025-08-31 00:13:04,947] Trial 88 finished with values: [-0.015791395056616975, 0.015792442068241604] and parameters: {'p_sma': 49, 'p_std': 38, 'p_atr': 13, 'p_adx': 7, 'rsi_period': 33, 'ema1': 26, 'ema2': 20, 'slip_atr_k': 0.04221376325191209, 'slip_spread_k': 0.2442914890419497, 'spread_hl_frac': 0.011099875809587982, 'bb_std_mult': 3.4584902863207247, 'rsi_os': 55, 'rsi_ob': 75, 'vol_spike': 0.01114307081149446, 'adx_thresh': 12.4281776286083, 'atr_min_pct': 0.00013277533633062225, 'atr_max_pct': 0.06667344026407052, 'tp_mult': 2.5925695561879385, 'tsl_mult': 0.11969492090006256, 'strategy': 'breakout', 'time_stop': 38, 'use_sma': True, 'use_atr': False, 'use_adx': False, 'use_ema': False, 'use_spike': False, 'rsi_required': True, 'edge_k': 0.7749365023748869, 'edge_cap': 0.9276157737572824, 'bull_strategy': 'breakout', 'bull_bb_std_mult': 2.3424611061308194, 'bull_rsi_os': 37, 'bull_rsi_ob': 67, 'bull_adx_thresh': 13.835499742623902, 'bull_atr_min_pct': 0.00010928595743123291, 'bull_atr_max_pct': 0.09274010175291253, 'bull_tp_mult': 2.988260436829976, 'bull_tsl_mult': 0.25843867785333025, 'bull_time_stop': 160, 'bull_use_sma': False, 'bull_use_ema': True, 'bull_use_atr': False, 'bull_use_adx': True, 'bull_use_spike': False, 'bull_rsi_required': False, 'bear_strategy': 'breakout', 'bear_bb_std_mult': 0.5566999985019114, 'bear_rsi_os': 24, 'bear_rsi_ob': 77, 'bear_adx_thresh': 28.841007211386, 'bear_atr_min_pct': 0.009551784998283061, 'bear_atr_max_pct': 0.13900644333531553, 'bear_tp_mult': 1.9673968233601087, 'bear_tsl_mult': 0.20075818582777324, 'bear_time_stop': 51, 'bear_use_sma': False, 'bear_use_ema': False, 'bear_use_atr': True, 'bear_use_adx': True, 'bear_use_spike': False, 'bear_rsi_required': False, 'sideways_strategy': 'mean_reversion', 'sideways_bb_std_mult': 1.1983890339541639, 'sideways_rsi_os': 45, 'sideways_rsi_ob': 67, 'sideways_adx_thresh': 11.991732145727813, 'sideways_atr_min_pct': 0.021175019890220092, 'sideways_atr_max_pct': 0.14046467260944193, 'sideways_tp_mult': 1.1038335731720519, 'sideways_tsl_mult': 0.34816180986924006, 'sideways_time_stop': 101, 'sideways_use_sma': False, 'sideways_use_ema': False, 'sideways_use_atr': False, 'sideways_use_adx': False, 'sideways_use_spike': True, 'sideways_rsi_required': False}.
