[I 2025-08-31 00:15:16,190] Trial 108 finished with values: [-1000000000.0, 1000000000.0] and parameters: {'p_sma': 58, 'p_std': 9, 'p_atr': 12, 'p_adx': 7, 'rsi_period': 39, 'ema1': 9, 'ema2': 17, 'slip_atr_k': 0.0736576185996291, 'slip_spread_k': 0.5990282456621424, 'spread_hl_frac': 0.010218217843010882, 'bb_std_mult': 3.078889895889043, 'rsi_os': 50, 'rsi_ob': 74, 'vol_spike': 0.03513028042801494, 'adx_thresh': 8.035646448078182, 'atr_min_pct': 0.0006523775990875186, 'atr_max_pct': 0.04282359175344427, 'tp_mult': 1.2753275940098967, 'tsl_mult': 0.13169841501797214, 'strategy': 'breakout', 'time_stop': 48, 'use_sma': True, 'use_atr': False, 'use_adx': True, 'use_ema': False, 'use_spike': False, 'rsi_required': True, 'edge_k': 1.1201007544980408, 'edge_cap': 0.14457993324861274, 'bull_strategy': 'breakout', 'bull_bb_std_mult': 2.603103864166016, 'bull_rsi_os': 38, 'bull_rsi_ob': 68, 'bull_adx_thresh': 20.721506333592583, 'bull_atr_min_pct': 0.02030853829367324, 'bull_atr_max_pct': 0.08333919982065373, 'bull_tp_mult': 1.2779341509736435, 'bull_tsl_mult': 0.2041093955499612, 'bull_time_stop': 227, 'bull_use_sma': False, 'bull_use_ema': True, 'bull_use_atr': False, 'bull_use_adx': True, 'bull_use_spike': False, 'bull_rsi_required': False, 'bear_strategy': 'breakout', 'bear_bb_std_mult': 0.5131293173654721, 'bear_rsi_os': 53, 'bear_rsi_ob': 81, 'bear_adx_thresh': 25.504923149944428, 'bear_atr_min_pct': 0.008531538540949554, 'bear_atr_max_pct': 0.13557835285001588, 'bear_tp_mult': 1.3527636344123408, 'bear_tsl_mult': 0.47358356966613213, 'bear_time_stop': 71, 'bear_use_sma': False, 'bear_use_ema': False, 'bear_use_atr': True, 'bear_use_adx': True, 'bear_use_spike': False, 'bear_rsi_required': False, 'sideways_strategy': 'mean_reversion', 'sideways_bb_std_mult': 1.1479748352303034, 'sideways_rsi_os': 33, 'sideways_rsi_ob': 68, 'sideways_adx_thresh': 14.070633100965113, 'sideways_atr_min_pct': 0.018652983125957215, 'sideways_atr_max_pct': 0.14025851737556255, 'sideways_tp_mult': 1.2598300693815916, 'sideways_tsl_mult': 0.3863689548244592, 'sideways_time_stop': 83, 'sideways_use_sma': False, 'sideways_use_ema': False, 'sideways_use_atr': False, 'sideways_use_adx': False, 'sideways_use_spike': True, 'sideways_rsi_required': False}.
[I 2025-08-31 00:15:47,910] Trial 112 finished with values: [-1000000000.0, 1000000000.0] and parameters: {'p_sma': 55, 'p_std': 37, 'p_atr': 22, 'p_adx': 12, 'rsi_period': 16, 'ema1': 6, 'ema2': 46, 'slip_atr_k': 0.05604666014916029, 'slip_spread_k': 0.040324630079340396, 'spread_hl_frac': 0.048132972655554024, 'bb_std_mult': 3.2721943519563093, 'rsi_os': 54, 'rsi_ob': 88, 'vol_spike': 0.2759448600347727, 'adx_thresh': 10.944872855540991, 'atr_min_pct': 0.0009800491368843899, 'atr_max_pct': 0.01677509678279783, 'tp_mult': 2.7558916536346314, 'tsl_mult': 0.15689844445711873, 'strategy': 'breakout', 'time_stop': 13, 'use_sma': False, 'use_atr': False, 'use_adx': True, 'use_ema': True, 'use_spike': True, 'rsi_required': True, 'edge_k': 1.710006789401573, 'edge_cap': 0.9341822864881367, 'bull_strategy': 'breakout', 'bull_bb_std_mult': 2.9618228820620343, 'bull_rsi_os': 13, 'bull_rsi_ob': 53, 'bull_adx_thresh': 14.965670119147193, 'bull_atr_min_pct': 0.01085006714708983, 'bull_atr_max_pct': 0.0288818468211657, 'bull_tp_mult': 2.8093577516645705, 'bull_tsl_mult': 0.032532142452799784, 'bull_time_stop': 254, 'bull_use_sma': False, 'bull_use_ema': False, 'bull_use_atr': False, 'bull_use_adx': True, 'bull_use_spike': True, 'bull_rsi_required': False, 'bear_strategy': 'breakout', 'bear_bb_std_mult': 2.169915022902487, 'bear_rsi_os': 35, 'bear_rsi_ob': 80, 'bear_adx_thresh': 7.3854617185103155, 'bear_atr_min_pct': 0.012180341010848757, 'bear_atr_max_pct': 0.14542126416664217, 'bear_tp_mult': 1.1118242774289042, 'bear_tsl_mult': 0.0257628639098047, 'bear_time_stop': 26, 'bear_use_sma': False, 'bear_use_ema': True, 'bear_use_atr': True, 'bear_use_adx': True, 'bear_use_spike': False, 'bear_rsi_required': False, 'sideways_strategy': 'mean_reversion', 'sideways_bb_std_mult': 1.0896413215225937, 'sideways_rsi_os': 48, 'sideways_rsi_ob': 61, 'sideways_adx_thresh': 12.100133227308518, 'sideways_atr_min_pct': 0.02667422343874204, 'sideways_atr_max_pct': 0.13417471215380486, 'sideways_tp_mult': 1.0922574876539264, 'sideways_tsl_mult': 0.31544229656537254, 'sideways_time_stop': 91, 'sideways_use_sma': False, 'sideways_use_ema': False, 'sideways_use_atr': False, 'sideways_use_adx': False, 'sideways_use_spike': True, 'sideways_rsi_required': False}.
[I 2025-08-31 00:15:48,110] Trial 110 finished with values: [-1000000000.0, 1000000000.0] and parameters: {'p_sma': 55, 'p_std': 37, 'p_atr': 10, 'p_adx': 11, 'rsi_period': 54, 'ema1': 29, 'ema2': 15, 'slip_atr_k': 0.07425462898257737, 'slip_spread_k': 0.4229967435649106, 'spread_hl_frac': 0.010524985799869551, 'bb_std_mult': 3.2192634727000145, 'rsi_os': 47, 'rsi_ob': 74, 'vol_spike': 0.018913005420438778, 'adx_thresh': 9.26887635820362, 'atr_min_pct': 0.003470482687977457, 'atr_max_pct': 0.04389611069905831, 'tp_mult': 1.263244019346876, 'tsl_mult': 0.08241004809791519, 'strategy': 'breakout', 'time_stop': 46, 'use_sma': True, 'use_atr': False, 'use_adx': True, 'use_ema': True, 'use_spike': True, 'rsi_required': True, 'edge_k': 1.1413488500975757, 'edge_cap': 0.4618591687246641, 'bull_strategy': 'breakout', 'bull_bb_std_mult': 2.4774937290991206, 'bull_rsi_os': 40, 'bull_rsi_ob': 50, 'bull_adx_thresh': 11.58989943271456, 'bull_atr_min_pct': 0.003300468038626589, 'bull_atr_max_pct': 0.08199415372165757, 'bull_tp_mult': 1.2660663989648238, 'bull_tsl_mult': 0.032975820307711345, 'bull_time_stop': 192, 'bull_use_sma': False, 'bull_use_ema': True, 'bull_use_atr': False, 'bull_use_adx': True, 'bull_use_spike': True, 'bull_rsi_required': False, 'bear_strategy': 'breakout', 'bear_bb_std_mult': 0.7834131605269241, 'bear_rsi_os': 26, 'bear_rsi_ob': 81, 'bear_adx_thresh': 29.862562380115968, 'bear_atr_min_pct': 0.008213489753231822, 'bear_atr_max_pct': 0.14647045305044742, 'bear_tp_mult': 1.067469790831071, 'bear_tsl_mult': 0.030588271178008775, 'bear_time_stop': 5, 'bear_use_sma': False, 'bear_use_ema': True, 'bear_use_atr': True, 'bear_use_adx': True, 'bear_use_spike': False, 'bear_rsi_required': False, 'sideways_strategy': 'mean_reversion', 'sideways_bb_std_mult': 1.0890162733252446, 'sideways_rsi_os': 47, 'sideways_rsi_ob': 65, 'sideways_adx_thresh': 12.348674343898942, 'sideways_atr_min_pct': 0.018408164646866267, 'sideways_atr_max_pct': 0.13361530738244293, 'sideways_tp_mult': 1.0725074365342948, 'sideways_tsl_mult': 0.27023031689716753, 'sideways_time_stop': 85, 'sideways_use_sma': False, 'sideways_use_ema': False, 'sideways_use_atr': False, 'sideways_use_adx': False, 'sideways_use_spike': True, 'sideways_rsi_required': False}.
[I 2025-08-31 00:15:48,320] Trial 111 finished with values: [-1000000000.0, 1000000000.0] and parameters: {'p_sma': 55, 'p_std': 16, 'p_atr': 24, 'p_adx': 11, 'rsi_period': 44, 'ema1': 13, 'ema2': 18, 'slip_atr_k': 0.03573702939687651, 'slip_spread_k': 0.59375066725187, 'spread_hl_frac': 0.017384007152998163, 'bb_std_mult': 0.8059351690817047, 'rsi_os': 52, 'rsi_ob': 45, 'vol_spike': 0.017321999146734268, 'adx_thresh': 9.104283100539268, 'atr_min_pct': 0.0006966943782758109, 'atr_max_pct': 0.044121136014735524, 'tp_mult': 1.2742305494786619, 'tsl_mult': 0.6187100839634608, 'strategy': 'breakout', 'time_stop': 300, 'use_sma': False, 'use_atr': False, 'use_adx': True, 'use_ema': True, 'use_spike': True, 'rsi_required': True, 'edge_k': 1.3579204994505214, 'edge_cap': 0.24869378250427226, 'bull_strategy': 'breakout', 'bull_bb_std_mult': 2.4695055979441367, 'bull_rsi_os': 41, 'bull_rsi_ob': 49, 'bull_adx_thresh': 15.322102503400332, 'bull_atr_min_pct': 0.002758522542485764, 'bull_atr_max_pct': 0.08117697141900533, 'bull_tp_mult': 1.233376938849885, 'bull_tsl_mult': 0.03838099925686389, 'bull_time_stop': 253, 'bull_use_sma': False, 'bull_use_ema': True, 'bull_use_atr': False, 'bull_use_adx': True, 'bull_use_spike': True, 'bull_rsi_required': False, 'bear_strategy': 'breakout', 'bear_bb_std_mult': 0.7871348765101189, 'bear_rsi_os': 11, 'bear_rsi_ob': 73, 'bear_adx_thresh': 7.4864882222349625, 'bear_atr_min_pct': 0.012206175328100814, 'bear_atr_max_pct': 0.14691008090255583, 'bear_tp_mult': 1.7564809010327511, 'bear_tsl_mult': 0.18312913642344722, 'bear_time_stop': 115, 'bear_use_sma': False, 'bear_use_ema': True, 'bear_use_atr': True, 'bear_use_adx': True, 'bear_use_spike': False, 'bear_rsi_required': False, 'sideways_strategy': 'mean_reversion', 'sideways_bb_std_mult': 1.3794946106027561, 'sideways_rsi_os': 48, 'sideways_rsi_ob': 65, 'sideways_adx_thresh': 12.548326519331491, 'sideways_atr_min_pct': 0.018804776800976898, 'sideways_atr_max_pct': 0.13380313081786752, 'sideways_tp_mult': 1.0876387607420979, 'sideways_tsl_mult': 0.30965135757959283, 'sideways_time_stop': 87, 'sideways_use_sma': False, 'sideways_use_ema': False, 'sideways_use_atr': False, 'sideways_use_adx': False, 'sideways_use_spike': True, 'sideways_rsi_required': False}.
[I 2025-08-31 00:15:48,321] Trial 109 finished with values: [-0.06594077586406133, 0.06586389091679215] and parameters: {'p_sma': 55, 'p_std': 14, 'p_atr': 10, 'p_adx': 11, 'rsi_period': 17, 'ema1': 6, 'ema2': 26, 'slip_atr_k': 0.05565044906797143, 'slip_spread_k': 0.4182750876622388, 'spread_hl_frac': 0.015753334024399282, 'bb_std_mult': 3.1879408339373168, 'rsi_os': 52, 'rsi_ob': 45, 'vol_spike': 0.020284061398460274, 'adx_thresh': 15.37521608563015, 'atr_min_pct': 0.012953513597003346, 'atr_max_pct': 0.042379628282496515, 'tp_mult': 1.0797162441475807, 'tsl_mult': 0.7372495950284316, 'strategy': 'breakout', 'time_stop': 45, 'use_sma': True, 'use_atr': False, 'use_adx': True, 'use_ema': False, 'use_spike': True, 'rsi_required': True, 'edge_k': 1.9404399766492064, 'edge_cap': 0.8805502587417487, 'bull_strategy': 'breakout', 'bull_bb_std_mult': 1.8986124198738246, 'bull_rsi_os': 29, 'bull_rsi_ob': 53, 'bull_adx_thresh': 11.698738237571218, 'bull_atr_min_pct': 2.8256449494405613e-08, 'bull_atr_max_pct': 0.09176729251840421, 'bull_tp_mult': 2.7310741550667452, 'bull_tsl_mult': 0.03843979189100388, 'bull_time_stop': 260, 'bull_use_sma': False, 'bull_use_ema': True, 'bull_use_atr': False, 'bull_use_adx': True, 'bull_use_spike': True, 'bull_rsi_required': False, 'bear_strategy': 'breakout', 'bear_bb_std_mult': 2.5179704374965324, 'bear_rsi_os': 33, 'bear_rsi_ob': 46, 'bear_adx_thresh': 25.43264727820952, 'bear_atr_min_pct': 0.0011816388653962048, 'bear_atr_max_pct': 0.1465025935121032, 'bear_tp_mult': 1.502815186436084, 'bear_tsl_mult': 0.4432957146555603, 'bear_time_stop': 64, 'bear_use_sma': False, 'bear_use_ema': True, 'bear_use_atr': True, 'bear_use_adx': True, 'bear_use_spike': False, 'bear_rsi_required': False, 'sideways_strategy': 'mean_reversion', 'sideways_bb_std_mult': 1.0566696188652236, 'sideways_rsi_os': 48, 'sideways_rsi_ob': 68, 'sideways_adx_thresh': 12.506789598506561, 'sideways_atr_min_pct': 0.027140157071153755, 'sideways_atr_max_pct': 0.010273959481013367, 'sideways_tp_mult': 1.08313870176687, 'sideways_tsl_mult': 0.2567405688108886, 'sideways_time_stop': 53, 'sideways_use_sma': False, 'sideways_use_ema': False, 'sideways_use_atr': False, 'sideways_use_adx': False, 'sideways_use_spike': True, 'sideways_rsi_required': False}.
[I 2025-08-31 00:16:19,735] Trial 113 finished with values: [-1000000000.0, 1000000000.0] and parameters: {'p_sma': 52, 'p_std': 15, 'p_atr': 10, 'p_adx': 11, 'rsi_period': 32, 'ema1': 29, 'ema2': 25, 'slip_atr_k': 0.0006764667811942279, 'slip_spread_k': 0.3434561703978635, 'spread_hl_frac': 0.017795797628591323, 'bb_std_mult': 3.426349749987762, 'rsi_os': 52, 'rsi_ob': 45, 'vol_spike': 0.01833583703576706, 'adx_thresh': 12.519255374347846, 'atr_min_pct': 0.008994120942589154, 'atr_max_pct': 0.06285490601666413, 'tp_mult': 1.5637036992701352, 'tsl_mult': 0.0795507315997464, 'strategy': 'breakout', 'time_stop': 81, 'use_sma': True, 'use_atr': False, 'use_adx': False, 'use_ema': True, 'use_spike': True, 'rsi_required': True, 'edge_k': 0.6182443250274225, 'edge_cap': 0.9455788973191567, 'bull_strategy': 'breakout', 'bull_bb_std_mult': 2.482540189295606, 'bull_rsi_os': 40, 'bull_rsi_ob': 66, 'bull_adx_thresh': 15.531670636482371, 'bull_atr_min_pct': 0.02967326369052755, 'bull_atr_max_pct': 0.09891052508565823, 'bull_tp_mult': 2.8837055743801496, 'bull_tsl_mult': 0.28828780036415047, 'bull_time_stop': 284, 'bull_use_sma': False, 'bull_use_ema': True, 'bull_use_atr': False, 'bull_use_adx': True, 'bull_use_spike': True, 'bull_rsi_required': False, 'bear_strategy': 'breakout', 'bear_bb_std_mult': 2.059168101104936, 'bear_rsi_os': 48, 'bear_rsi_ob': 73, 'bear_adx_thresh': 13.714156506725214, 'bear_atr_min_pct': 0.01000618253208658, 'bear_atr_max_pct': 0.03336653127540229, 'bear_tp_mult': 1.7059081987569957, 'bear_tsl_mult': 0.4489914519824317, 'bear_time_stop': 59, 'bear_use_sma': True, 'bear_use_ema': True, 'bear_use_atr': True, 'bear_use_adx': True, 'bear_use_spike': True, 'bear_rsi_required': False, 'sideways_strategy': 'mean_reversion', 'sideways_bb_std_mult': 0.9859086038950007, 'sideways_rsi_os': 16, 'sideways_rsi_ob': 65, 'sideways_adx_thresh': 17.566431965299323, 'sideways_atr_min_pct': 0.02464184899961626, 'sideways_atr_max_pct': 0.11493228428709645, 'sideways_tp_mult': 1.084197691903309, 'sideways_tsl_mult': 0.2616180375204304, 'sideways_time_stop': 114, 'sideways_use_sma': False, 'sideways_use_ema': False, 'sideways_use_atr': False, 'sideways_use_adx': False, 'sideways_use_spike': True, 'sideways_rsi_required': False}.
[I 2025-08-31 00:16:20,696] Trial 116 finished with values: [-0.01754574616062088, 0.01745567479497784] and parameters: {'p_sma': 52, 'p_std': 43, 'p_atr': 14, 'p_adx': 7, 'rsi_period': 36, 'ema1': 20, 'ema2': 22, 'slip_atr_k': 0.001567784687306499, 'slip_spread_k': 0.11867711542944204, 'spread_hl_frac': 0.04200440649797377, 'bb_std_mult': 1.4668414264301188, 'rsi_os': 54, 'rsi_ob': 75, 'vol_spike': 0.013674466373778775, 'adx_thresh': 16.984705194790543, 'atr_min_pct': 0.0013501410942830506, 'atr_max_pct': 0.037888200659922745, 'tp_mult': 1.555910392018172, 'tsl_mult': 0.06481306185003646, 'strategy': 'breakout', 'time_stop': 81, 'use_sma': True, 'use_atr': False, 'use_adx': False, 'use_ema': False, 'use_spike': False, 'rsi_required': True, 'edge_k': 0.6208083799934495, 'edge_cap': 0.9524310431118708, 'bull_strategy': 'mean_reversion', 'bull_bb_std_mult': 2.0692826300993516, 'bull_rsi_os': 5, 'bull_rsi_ob': 47, 'bull_adx_thresh': 13.568394940117182, 'bull_atr_min_pct': 0.0011132250382863405, 'bull_atr_max_pct': 0.09715968311527057, 'bull_tp_mult': 2.872900182151026, 'bull_tsl_mult': 0.28283024078181496, 'bull_time_stop': 291, 'bull_use_sma': False, 'bull_use_ema': False, 'bull_use_atr': False, 'bull_use_adx': True, 'bull_use_spike': False, 'bull_rsi_required': False, 'bear_strategy': 'mean_reversion', 'bear_bb_std_mult': 0.7053657619007635, 'bear_rsi_os': 22, 'bear_rsi_ob': 79, 'bear_adx_thresh': 16.304733161744824, 'bear_atr_min_pct': 0.007340973564039519, 'bear_atr_max_pct': 0.02129042257502739, 'bear_tp_mult': 1.261143993805312, 'bear_tsl_mult': 0.5076052267705626, 'bear_time_stop': 131, 'bear_use_sma': True, 'bear_use_ema': False, 'bear_use_atr': True, 'bear_use_adx': True, 'bear_use_spike': True, 'bear_rsi_required': False, 'sideways_strategy': 'mean_reversion', 'sideways_bb_std_mult': 0.9772262953065278, 'sideways_rsi_os': 46, 'sideways_rsi_ob': 93, 'sideways_adx_thresh': 11.427003720263665, 'sideways_atr_min_pct': 0.0208243109790925, 'sideways_atr_max_pct': 0.11536387518419698, 'sideways_tp_mult': 1.2286381973443323, 'sideways_tsl_mult': 0.5582211334481905, 'sideways_time_stop': 116, 'sideways_use_sma': False, 'sideways_use_ema': True, 'sideways_use_atr': False, 'sideways_use_adx': True, 'sideways_use_spike': True, 'sideways_rsi_required': False}.
[I 2025-08-31 00:16:20,992] Trial 115 finished with values: [-1000000000.0, 1000000000.0] and parameters: {'p_sma': 43, 'p_std': 43, 'p_atr': 14, 'p_adx': 7, 'rsi_period': 32, 'ema1': 26, 'ema2': 19, 'slip_atr_k': 0.19733815946801636, 'slip_spread_k': 0.174913109322264, 'spread_hl_frac': 0.007713608373305665, 'bb_std_mult': 1.0426590353001983, 'rsi_os': 54, 'rsi_ob': 79, 'vol_spike': 0.2545206154473161, 'adx_thresh': 17.55375172956429, 'atr_min_pct': 0.0021535058923923024, 'atr_max_pct': 0.03811983688351668, 'tp_mult': 2.0211936346991437, 'tsl_mult': 0.09481592601849119, 'strategy': 'breakout', 'time_stop': 86, 'use_sma': True, 'use_atr': False, 'use_adx': False, 'use_ema': False, 'use_spike': False, 'rsi_required': True, 'edge_k': 0.60458213757978, 'edge_cap': 0.9480773446542837, 'bull_strategy': 'mean_reversion', 'bull_bb_std_mult': 2.2819237572138786, 'bull_rsi_os': 38, 'bull_rsi_ob': 89, 'bull_adx_thresh': 13.572701190766706, 'bull_atr_min_pct': 0.0011511648329879617, 'bull_atr_max_pct': 0.09911602902737368, 'bull_tp_mult': 2.879482075266611, 'bull_tsl_mult': 0.30781529210241115, 'bull_time_stop': 290, 'bull_use_sma': False, 'bull_use_ema': False, 'bull_use_atr': False, 'bull_use_adx': True, 'bull_use_spike': False, 'bull_rsi_required': False, 'bear_strategy': 'mean_reversion', 'bear_bb_std_mult': 1.76521316008479, 'bear_rsi_os': 22, 'bear_rsi_ob': 78, 'bear_adx_thresh': 16.183009478014046, 'bear_atr_min_pct': 0.010011747635442008, 'bear_atr_max_pct': 0.0294855188124917, 'bear_tp_mult': 2.244407344937698, 'bear_tsl_mult': 0.5718567991829554, 'bear_time_stop': 130, 'bear_use_sma': True, 'bear_use_ema': False, 'bear_use_atr': True, 'bear_use_adx': True, 'bear_use_spike': True, 'bear_rsi_required': False, 'sideways_strategy': 'mean_reversion', 'sideways_bb_std_mult': 1.2169179523037092, 'sideways_rsi_os': 16, 'sideways_rsi_ob': 67, 'sideways_adx_thresh': 10.294401209514694, 'sideways_atr_min_pct': 0.02058203318285159, 'sideways_atr_max_pct': 0.11748544104563706, 'sideways_tp_mult': 2.7912809718544955, 'sideways_tsl_mult': 0.48440009607090917, 'sideways_time_stop': 126, 'sideways_use_sma': False, 'sideways_use_ema': True, 'sideways_use_atr': False, 'sideways_use_adx': True, 'sideways_use_spike': True, 'sideways_rsi_required': False}.
[I 2025-08-31 00:16:21,004] Trial 114 finished with values: [-0.01977614019839491, 0.019678019431923034] and parameters: {'p_sma': 46, 'p_std': 41, 'p_atr': 14, 'p_adx': 7, 'rsi_period': 33, 'ema1': 20, 'ema2': 21, 'slip_atr_k': 0.10657574255262044, 'slip_spread_k': 0.778530736656398, 'spread_hl_frac': 0.040501189531577705, 'bb_std_mult': 1.4565081913225386, 'rsi_os': 54, 'rsi_ob': 75, 'vol_spike': 0.2552293296069007, 'adx_thresh': 12.378695416235209, 'atr_min_pct': 0.002042275778397401, 'atr_max_pct': 0.033184556383132745, 'tp_mult': 1.7582097466436823, 'tsl_mult': 0.10622440348737748, 'strategy': 'breakout', 'time_stop': 62, 'use_sma': True, 'use_atr': False, 'use_adx': False, 'use_ema': False, 'use_spike': False, 'rsi_required': True, 'edge_k': 0.5186098049417751, 'edge_cap': 0.9435593193581021, 'bull_strategy': 'mean_reversion', 'bull_bb_std_mult': 1.6942371221194583, 'bull_rsi_os': 19, 'bull_rsi_ob': 47, 'bull_adx_thresh': 14.513454526409992, 'bull_atr_min_pct': 0.0012098383765005586, 'bull_atr_max_pct': 0.0977136821715227, 'bull_tp_mult': 2.8715135474256592, 'bull_tsl_mult': 0.29370690993418164, 'bull_time_stop': 288, 'bull_use_sma': False, 'bull_use_ema': False, 'bull_use_atr': False, 'bull_use_adx': True, 'bull_use_spike': False, 'bull_rsi_required': False, 'bear_strategy': 'mean_reversion', 'bear_bb_std_mult': 1.79080901793137, 'bear_rsi_os': 48, 'bear_rsi_ob': 78, 'bear_adx_thresh': 16.265038739754665, 'bear_atr_min_pct': 0.009676350142023669, 'bear_atr_max_pct': 0.1330801258295748, 'bear_tp_mult': 1.6993206908551968, 'bear_tsl_mult': 0.35885060302784655, 'bear_time_stop': 114, 'bear_use_sma': True, 'bear_use_ema': False, 'bear_use_atr': True, 'bear_use_adx': True, 'bear_use_spike': True, 'bear_rsi_required': False, 'sideways_strategy': 'mean_reversion', 'sideways_bb_std_mult': 0.9669227544404451, 'sideways_rsi_os': 18, 'sideways_rsi_ob': 67, 'sideways_adx_thresh': 10.962479720957957, 'sideways_atr_min_pct': 0.024548494994697658, 'sideways_atr_max_pct': 0.11562260389262828, 'sideways_tp_mult': 2.7482856767061685, 'sideways_tsl_mult': 0.47751703745411767, 'sideways_time_stop': 100, 'sideways_use_sma': False, 'sideways_use_ema': True, 'sideways_use_atr': False, 'sideways_use_adx': True, 'sideways_use_spike': True, 'sideways_rsi_required': False}.
