[I 2025-08-31 00:17:59,707] Trial 128 finished with values: [-0.05146762775911051, 0.051401596360324785] and parameters: {'p_sma': 51, 'p_std': 51, 'p_atr': 13, 'p_adx': 17, 'rsi_period': 45, 'ema1': 12, 'ema2': 16, 'slip_atr_k': 0.12870625954940687, 'slip_spread_k': 0.7442530769397402, 'spread_hl_frac': 0.032298903206079366, 'bb_std_mult': 0.6119198802527108, 'rsi_os': 42, 'rsi_ob': 74, 'vol_spike': 0.2800715655042589, 'adx_thresh': 11.019926108360686, 'atr_min_pct': 0.0005463665765119576, 'atr_max_pct': 0.05233640850333203, 'tp_mult': 2.5699619213247384, 'tsl_mult': 0.10516388688985796, 'strategy': 'breakout', 'time_stop': 29, 'use_sma': False, 'use_atr': False, 'use_adx': True, 'use_ema': True, 'use_spike': False, 'rsi_required': True, 'edge_k': 0.9526508391827747, 'edge_cap': 0.6123804371617938, 'bull_strategy': 'breakout', 'bull_bb_std_mult': 2.5765693930198315, 'bull_rsi_os': 44, 'bull_rsi_ob': 74, 'bull_adx_thresh': 14.46939176693455, 'bull_atr_min_pct': 0.0007766140458660842, 'bull_atr_max_pct': 0.10270366926232403, 'bull_tp_mult': 1.494335732257142, 'bull_tsl_mult': 0.29333124278227407, 'bull_time_stop': 210, 'bull_use_sma': False, 'bull_use_ema': True, 'bull_use_atr': False, 'bull_use_adx': True, 'bull_use_spike': False, 'bull_rsi_required': False, 'bear_strategy': 'breakout', 'bear_bb_std_mult': 1.5476152701986878, 'bear_rsi_os': 26, 'bear_rsi_ob': 94, 'bear_adx_thresh': 10.260484250057345, 'bear_atr_min_pct': 0.008923287668100808, 'bear_atr_max_pct': 0.052630143937840775, 'bear_tp_mult': 1.700855110736513, 'bear_tsl_mult': 0.15453788179174732, 'bear_time_stop': 95, 'bear_use_sma': False, 'bear_use_ema': False, 'bear_use_atr': True, 'bear_use_adx': False, 'bear_use_spike': False, 'bear_rsi_required': False, 'sideways_strategy': 'mean_reversion', 'sideways_bb_std_mult': 1.8286704413579529, 'sideways_rsi_os': 44, 'sideways_rsi_ob': 66, 'sideways_adx_thresh': 14.740706627666409, 'sideways_atr_min_pct': 0.00022401709022453267, 'sideways_atr_max_pct': 0.05158909124998705, 'sideways_tp_mult': 1.2407545173084227, 'sideways_tsl_mult': 0.9849711912887611, 'sideways_time_stop': 257, 'sideways_use_sma': False, 'sideways_use_ema': False, 'sideways_use_atr': False, 'sideways_use_adx': False, 'sideways_use_spike': False, 'sideways_rsi_required': False}.
[I 2025-08-31 00:17:59,848] Trial 127 finished with values: [-1000000000.0, 1000000000.0] and parameters: {'p_sma': 52, 'p_std': 41, 'p_atr': 13, 'p_adx': 7, 'rsi_period': 74, 'ema1': 26, 'ema2': 22, 'slip_atr_k': 0.12879303701840294, 'slip_spread_k': 0.37790480844754, 'spread_hl_frac': 0.03199991529616704, 'bb_std_mult': 3.29103158150912, 'rsi_os': 53, 'rsi_ob': 78, 'vol_spike': 0.011375364984523935, 'adx_thresh': 10.737794086677246, 'atr_min_pct': 0.000608588577218159, 'atr_max_pct': 0.09013753474322439, 'tp_mult': 2.4371278157342986, 'tsl_mult': 0.03488342597444355, 'strategy': 'breakout', 'time_stop': 28, 'use_sma': False, 'use_atr': False, 'use_adx': False, 'use_ema': True, 'use_spike': False, 'rsi_required': True, 'edge_k': 0.6475224203464669, 'edge_cap': 0.8578725305494543, 'bull_strategy': 'breakout', 'bull_bb_std_mult': 2.543023518089797, 'bull_rsi_os': 33, 'bull_rsi_ob': 59, 'bull_adx_thresh': 14.312356244521824, 'bull_atr_min_pct': 0.0009957917990269143, 'bull_atr_max_pct': 0.10355016402185264, 'bull_tp_mult': 1.4908312115417537, 'bull_tsl_mult': 0.28916235503562976, 'bull_time_stop': 270, 'bull_use_sma': False, 'bull_use_ema': True, 'bull_use_atr': True, 'bull_use_adx': True, 'bull_use_spike': False, 'bull_rsi_required': True, 'bear_strategy': 'breakout', 'bear_bb_std_mult': 0.8602676046416462, 'bear_rsi_os': 26, 'bear_rsi_ob': 75, 'bear_adx_thresh': 30.682545848987, 'bear_atr_min_pct': 0.02244217798567099, 'bear_atr_max_pct': 0.13538884535389095, 'bear_tp_mult': 1.677595948324272, 'bear_tsl_mult': 0.2886691881033798, 'bear_time_stop': 94, 'bear_use_sma': False, 'bear_use_ema': False, 'bear_use_atr': True, 'bear_use_adx': False, 'bear_use_spike': False, 'bear_rsi_required': False, 'sideways_strategy': 'mean_reversion', 'sideways_bb_std_mult': 0.9835465695281329, 'sideways_rsi_os': 46, 'sideways_rsi_ob': 64, 'sideways_adx_thresh': 10.391763357830694, 'sideways_atr_min_pct': 0.023940125049890904, 'sideways_atr_max_pct': 0.13143941099989603, 'sideways_tp_mult': 1.221796427793498, 'sideways_tsl_mult': 0.5482054355630198, 'sideways_time_stop': 117, 'sideways_use_sma': False, 'sideways_use_ema': False, 'sideways_use_atr': False, 'sideways_use_adx': False, 'sideways_use_spike': False, 'sideways_rsi_required': False}.
[I 2025-08-31 00:17:59,862] Trial 125 finished with values: [-0.01682825211082639, 0.016754636522489957] and parameters: {'p_sma': 50, 'p_std': 35, 'p_atr': 13, 'p_adx': 7, 'rsi_period': 73, 'ema1': 27, 'ema2': 19, 'slip_atr_k': 0.06356976843606302, 'slip_spread_k': 0.014966349485485697, 'spread_hl_frac': 0.02915141048615934, 'bb_std_mult': 3.3096942834621346, 'rsi_os': 6, 'rsi_ob': 62, 'vol_spike': 0.01403432213234947, 'adx_thresh': 12.824177234207216, 'atr_min_pct': 0.0010861250236088782, 'atr_max_pct': 0.08853510569063099, 'tp_mult': 2.4391126572271835, 'tsl_mult': 0.1117726991542553, 'strategy': 'breakout', 'time_stop': 92, 'use_sma': False, 'use_atr': False, 'use_adx': False, 'use_ema': False, 'use_spike': False, 'rsi_required': True, 'edge_k': 0.8622491871848976, 'edge_cap': 0.0759075041910574, 'bull_strategy': 'breakout', 'bull_bb_std_mult': 2.550713137533695, 'bull_rsi_os': 32, 'bull_rsi_ob': 90, 'bull_adx_thresh': 12.51546312212987, 'bull_atr_min_pct': 0.0008357680563129995, 'bull_atr_max_pct': 0.08526443981111323, 'bull_tp_mult': 2.9352171139837173, 'bull_tsl_mult': 0.29072955125303135, 'bull_time_stop': 158, 'bull_use_sma': False, 'bull_use_ema': True, 'bull_use_atr': False, 'bull_use_adx': True, 'bull_use_spike': False, 'bull_rsi_required': False, 'bear_strategy': 'breakout', 'bear_bb_std_mult': 0.8503210857877452, 'bear_rsi_os': 23, 'bear_rsi_ob': 55, 'bear_adx_thresh': 30.526163647607508, 'bear_atr_min_pct': 0.022431629024091224, 'bear_atr_max_pct': 0.12689084290868352, 'bear_tp_mult': 1.6798011262590247, 'bear_tsl_mult': 0.3275761358787189, 'bear_time_stop': 300, 'bear_use_sma': False, 'bear_use_ema': False, 'bear_use_atr': True, 'bear_use_adx': False, 'bear_use_spike': False, 'bear_rsi_required': False, 'sideways_strategy': 'mean_reversion', 'sideways_bb_std_mult': 1.4311105291177515, 'sideways_rsi_os': 44, 'sideways_rsi_ob': 72, 'sideways_adx_thresh': 14.76261916993787, 'sideways_atr_min_pct': 0.0009513043663774683, 'sideways_atr_max_pct': 0.03235052001134527, 'sideways_tp_mult': 1.1606134313909697, 'sideways_tsl_mult': 0.9901672830748027, 'sideways_time_stop': 251, 'sideways_use_sma': True, 'sideways_use_ema': False, 'sideways_use_atr': True, 'sideways_use_adx': False, 'sideways_use_spike': False, 'sideways_rsi_required': False}.
[I 2025-08-31 00:18:31,443] Trial 129 finished with values: [-1000000000.0, 1000000000.0] and parameters: {'p_sma': 52, 'p_std': 49, 'p_atr': 13, 'p_adx': 7, 'rsi_period': 24, 'ema1': 26, 'ema2': 20, 'slip_atr_k': 0.16211303435012, 'slip_spread_k': 0.02566942950903639, 'spread_hl_frac': 0.032416552925552185, 'bb_std_mult': 3.006019537917178, 'rsi_os': 6, 'rsi_ob': 95, 'vol_spike': 0.28004216419715533, 'adx_thresh': 10.659526658471727, 'atr_min_pct': 0.0005082497648274006, 'atr_max_pct': 0.09456522164569654, 'tp_mult': 2.9993617115102733, 'tsl_mult': 0.02867699812145752, 'strategy': 'breakout', 'time_stop': 6, 'use_sma': False, 'use_atr': False, 'use_adx': True, 'use_ema': False, 'use_spike': True, 'rsi_required': True, 'edge_k': 0.7396334380112328, 'edge_cap': 0.6415920275671558, 'bull_strategy': 'mean_reversion', 'bull_bb_std_mult': 2.5294741553904294, 'bull_rsi_os': 10, 'bull_rsi_ob': 47, 'bull_adx_thresh': 16.049784944177485, 'bull_atr_min_pct': 0.0009342256456333579, 'bull_atr_max_pct': 0.10232843538712778, 'bull_tp_mult': 1.066900810273838, 'bull_tsl_mult': 0.2912207747280456, 'bull_time_stop': 177, 'bull_use_sma': False, 'bull_use_ema': True, 'bull_use_atr': False, 'bull_use_adx': True, 'bull_use_spike': True, 'bull_rsi_required': False, 'bear_strategy': 'breakout', 'bear_bb_std_mult': 0.7505672175596589, 'bear_rsi_os': 26, 'bear_rsi_ob': 56, 'bear_adx_thresh': 30.790960429203178, 'bear_atr_min_pct': 0.009528109066373946, 'bear_atr_max_pct': 0.050742768782071575, 'bear_tp_mult': 1.713064839140853, 'bear_tsl_mult': 0.15700526654661628, 'bear_time_stop': 60, 'bear_use_sma': False, 'bear_use_ema': True, 'bear_use_atr': True, 'bear_use_adx': True, 'bear_use_spike': False, 'bear_rsi_required': False, 'sideways_strategy': 'mean_reversion', 'sideways_bb_std_mult': 1.8470012351566454, 'sideways_rsi_os': 44, 'sideways_rsi_ob': 67, 'sideways_adx_thresh': 10.340217993589196, 'sideways_atr_min_pct': 0.008265893876786865, 'sideways_atr_max_pct': 0.01802603595105287, 'sideways_tp_mult': 1.2294974734206372, 'sideways_tsl_mult': 0.9442285176675618, 'sideways_time_stop': 200, 'sideways_use_sma': False, 'sideways_use_ema': False, 'sideways_use_atr': False, 'sideways_use_adx': False, 'sideways_use_spike': False, 'sideways_rsi_required': False}.
[I 2025-08-31 00:18:32,212] Trial 130 finished with values: [-1000000000.0, 1000000000.0] and parameters: {'p_sma': 53, 'p_std': 38, 'p_atr': 13, 'p_adx': 7, 'rsi_period': 42, 'ema1': 26, 'ema2': 48, 'slip_atr_k': 0.03920625952089267, 'slip_spread_k': 0.06601389139535585, 'spread_hl_frac': 0.02921544674364688, 'bb_std_mult': 3.294953844427059, 'rsi_os': 51, 'rsi_ob': 86, 'vol_spike': 0.022421471953386382, 'adx_thresh': 13.007105736270539, 'atr_min_pct': 0.0009800085565921084, 'atr_max_pct': 0.13586630276796258, 'tp_mult': 2.677438208187853, 'tsl_mult': 0.05965647091377352, 'strategy': 'breakout', 'time_stop': 61, 'use_sma': True, 'use_atr': False, 'use_adx': False, 'use_ema': False, 'use_spike': True, 'rsi_required': True, 'edge_k': 0.7297227596954821, 'edge_cap': 0.8535436823174368, 'bull_strategy': 'mean_reversion', 'bull_bb_std_mult': 3.0175235277277306, 'bull_rsi_os': 32, 'bull_rsi_ob': 69, 'bull_adx_thresh': 25.45251257825574, 'bull_atr_min_pct': 0.016357534987484657, 'bull_atr_max_pct': 0.09699999837720634, 'bull_tp_mult': 2.8593680721614683, 'bull_tsl_mult': 0.7295689010140223, 'bull_time_stop': 171, 'bull_use_sma': False, 'bull_use_ema': False, 'bull_use_atr': True, 'bull_use_adx': True, 'bull_use_spike': True, 'bull_rsi_required': False, 'bear_strategy': 'breakout', 'bear_bb_std_mult': 0.7499645595116771, 'bear_rsi_os': 20, 'bear_rsi_ob': 75, 'bear_adx_thresh': 30.87140689723111, 'bear_atr_min_pct': 0.005622485708151928, 'bear_atr_max_pct': 0.023124443733586388, 'bear_tp_mult': 2.513730300607212, 'bear_tsl_mult': 0.07369806422561478, 'bear_time_stop': 57, 'bear_use_sma': False, 'bear_use_ema': True, 'bear_use_atr': True, 'bear_use_adx': True, 'bear_use_spike': True, 'bear_rsi_required': False, 'sideways_strategy': 'mean_reversion', 'sideways_bb_std_mult': 0.9578600215044109, 'sideways_rsi_os': 36, 'sideways_rsi_ob': 64, 'sideways_adx_thresh': 10.4934264705272, 'sideways_atr_min_pct': 0.028378732259395974, 'sideways_atr_max_pct': 0.013720872190875227, 'sideways_tp_mult': 1.1213858272952075, 'sideways_tsl_mult': 0.9496773269412617, 'sideways_time_stop': 233, 'sideways_use_sma': False, 'sideways_use_ema': False, 'sideways_use_atr': False, 'sideways_use_adx': False, 'sideways_use_spike': True, 'sideways_rsi_required': False}.
[I 2025-08-31 00:18:32,636] Trial 131 finished with values: [-0.01893395925743968, 0.018931508133584195] and parameters: {'p_sma': 46, 'p_std': 37, 'p_atr': 15, 'p_adx': 15, 'rsi_period': 24, 'ema1': 14, 'ema2': 24, 'slip_atr_k': 0.1615655775416403, 'slip_spread_k': 0.013718366896966927, 'spread_hl_frac': 0.01915376013940711, 'bb_std_mult': 2.9298318779844585, 'rsi_os': 6, 'rsi_ob': 65, 'vol_spike': 0.02323007526835022, 'adx_thresh': 16.229372810943055, 'atr_min_pct': 0.000762249118400161, 'atr_max_pct': 0.055998087377623164, 'tp_mult': 2.5107023056622113, 'tsl_mult': 0.20356836652042998, 'strategy': 'breakout', 'time_stop': 107, 'use_sma': True, 'use_atr': False, 'use_adx': True, 'use_ema': False, 'use_spike': True, 'rsi_required': True, 'edge_k': 0.6474491778604747, 'edge_cap': 0.9811846650521068, 'bull_strategy': 'breakout', 'bull_bb_std_mult': 3.1914812119142586, 'bull_rsi_os': 37, 'bull_rsi_ob': 69, 'bull_adx_thresh': 18.741291009010755, 'bull_atr_min_pct': 7.21880702122743e-07, 'bull_atr_max_pct': 0.09603811960791905, 'bull_tp_mult': 1.6878879860516411, 'bull_tsl_mult': 0.7296300292528195, 'bull_time_stop': 177, 'bull_use_sma': False, 'bull_use_ema': True, 'bull_use_atr': False, 'bull_use_adx': True, 'bull_use_spike': True, 'bull_rsi_required': False, 'bear_strategy': 'breakout', 'bear_bb_std_mult': 0.7467126755596851, 'bear_rsi_os': 20, 'bear_rsi_ob': 63, 'bear_adx_thresh': 31.494706216449096, 'bear_atr_min_pct': 0.00971580860106964, 'bear_atr_max_pct': 0.1311306803440931, 'bear_tp_mult': 2.147232920438078, 'bear_tsl_mult': 0.2347835803450378, 'bear_time_stop': 113, 'bear_use_sma': False, 'bear_use_ema': True, 'bear_use_atr': True, 'bear_use_adx': True, 'bear_use_spike': True, 'bear_rsi_required': False, 'sideways_strategy': 'mean_reversion', 'sideways_bb_std_mult': 3.5793242750744745, 'sideways_rsi_os': 47, 'sideways_rsi_ob': 61, 'sideways_adx_thresh': 28.467984230039733, 'sideways_atr_min_pct': 0.021170356665117265, 'sideways_atr_max_pct': 0.14870538701180872, 'sideways_tp_mult': 1.10880294772734, 'sideways_tsl_mult': 0.340559607406954, 'sideways_time_stop': 238, 'sideways_use_sma': False, 'sideways_use_ema': False, 'sideways_use_atr': False, 'sideways_use_adx': False, 'sideways_use_spike': True, 'sideways_rsi_required': False}.
[I 2025-08-31 00:18:32,705] Trial 132 finished with values: [-1000000000.0, 1000000000.0] and parameters: {'p_sma': 47, 'p_std': 38, 'p_atr': 15, 'p_adx': 15, 'rsi_period': 23, 'ema1': 15, 'ema2': 24, 'slip_atr_k': 0.23171136495914255, 'slip_spread_k': 0.061327859151055764, 'spread_hl_frac': 0.029469206167718625, 'bb_std_mult': 3.412293428367238, 'rsi_os': 51, 'rsi_ob': 75, 'vol_spike': 0.02223633475909309, 'adx_thresh': 13.034770648318059, 'atr_min_pct': 0.023005902660036028, 'atr_max_pct': 0.0856858357976996, 'tp_mult': 2.6795385811558936, 'tsl_mult': 0.4540860000853908, 'strategy': 'breakout', 'time_stop': 253, 'use_sma': True, 'use_atr': False, 'use_adx': True, 'use_ema': False, 'use_spike': True, 'rsi_required': True, 'edge_k': 0.9429478509675316, 'edge_cap': 0.17549856267217434, 'bull_strategy': 'breakout', 'bull_bb_std_mult': 2.9782875231257604, 'bull_rsi_os': 41, 'bull_rsi_ob': 69, 'bull_adx_thresh': 31.613728620205038, 'bull_atr_min_pct': 0.02647867797640896, 'bull_atr_max_pct': 0.09663321653315962, 'bull_tp_mult': 1.072316456856426, 'bull_tsl_mult': 0.7166306570312216, 'bull_time_stop': 242, 'bull_use_sma': False, 'bull_use_ema': True, 'bull_use_atr': False, 'bull_use_adx': True, 'bull_use_spike': True, 'bull_rsi_required': False, 'bear_strategy': 'breakout', 'bear_bb_std_mult': 0.7240986282525611, 'bear_rsi_os': 22, 'bear_rsi_ob': 48, 'bear_adx_thresh': 12.7710308881978, 'bear_atr_min_pct': 0.00968362023038942, 'bear_atr_max_pct': 0.1314475998742185, 'bear_tp_mult': 1.9638992938278512, 'bear_tsl_mult': 0.2247280946474103, 'bear_time_stop': 148, 'bear_use_sma': False, 'bear_use_ema': True, 'bear_use_atr': True, 'bear_use_adx': True, 'bear_use_spike': True, 'bear_rsi_required': False, 'sideways_strategy': 'mean_reversion', 'sideways_bb_std_mult': 0.9332676919458431, 'sideways_rsi_os': 41, 'sideways_rsi_ob': 61, 'sideways_adx_thresh': 12.285552667047156, 'sideways_atr_min_pct': 0.02120903987541122, 'sideways_atr_max_pct': 0.14942757333809695, 'sideways_tp_mult': 1.1117910350284934, 'sideways_tsl_mult': 0.19566242484092783, 'sideways_time_stop': 203, 'sideways_use_sma': False, 'sideways_use_ema': False, 'sideways_use_atr': False, 'sideways_use_adx': False, 'sideways_use_spike': True, 'sideways_rsi_required': False}.
[I 2025-08-31 00:19:04,666] Trial 136 finished with values: [-1000000000.0, 1000000000.0] and parameters: {'p_sma': 14, 'p_std': 36, 'p_atr': 14, 'p_adx': 9, 'rsi_period': 36, 'ema1': 25, 'ema2': 18, 'slip_atr_k': 0.03298492435540802, 'slip_spread_k': 0.0076564892742465585, 'spread_hl_frac': 0.019724255959501363, 'bb_std_mult': 3.4447553960853527, 'rsi_os': 52, 'rsi_ob': 73, 'vol_spike': 0.054580822801354074, 'adx_thresh': 11.628480290343715, 'atr_min_pct': 0.01107874993779477, 'atr_max_pct': 0.056830246224294494, 'tp_mult': 2.5127650846922527, 'tsl_mult': 0.16526641813111012, 'strategy': 'breakout', 'time_stop': 53, 'use_sma': True, 'use_atr': False, 'use_adx': False, 'use_ema': False, 'use_spike': False, 'rsi_required': True, 'edge_k': 0.793001122601902, 'edge_cap': 0.44440650674543547, 'bull_strategy': 'breakout', 'bull_bb_std_mult': 2.8502564976642013, 'bull_rsi_os': 5, 'bull_rsi_ob': 65, 'bull_adx_thresh': 27.506212789659713, 'bull_atr_min_pct': 0.0019202417839192143, 'bull_atr_max_pct': 0.11980599915088745, 'bull_tp_mult': 2.99871408866823, 'bull_tsl_mult': 0.2523035644313246, 'bull_time_stop': 150, 'bull_use_sma': False, 'bull_use_ema': True, 'bull_use_atr': False, 'bull_use_adx': True, 'bull_use_spike': False, 'bull_rsi_required': False, 'bear_strategy': 'mean_reversion', 'bear_bb_std_mult': 1.4154810302182355, 'bear_rsi_os': 45, 'bear_rsi_ob': 59, 'bear_adx_thresh': 11.354909742069077, 'bear_atr_min_pct': 0.003963651652137197, 'bear_atr_max_pct': 0.13646770447702303, 'bear_tp_mult': 1.4732133118399182, 'bear_tsl_mult': 0.19681033371897663, 'bear_time_stop': 13, 'bear_use_sma': False, 'bear_use_ema': False, 'bear_use_atr': True, 'bear_use_adx': True, 'bear_use_spike': False, 'bear_rsi_required': False, 'sideways_strategy': 'mean_reversion', 'sideways_bb_std_mult': 1.3613438876189932, 'sideways_rsi_os': 47, 'sideways_rsi_ob': 78, 'sideways_adx_thresh': 12.9002793683391, 'sideways_atr_min_pct': 0.002972367973490174, 'sideways_atr_max_pct': 0.11183108204959559, 'sideways_tp_mult': 2.504807397858167, 'sideways_tsl_mult': 0.2922685889199184, 'sideways_time_stop': 94, 'sideways_use_sma': False, 'sideways_use_ema': False, 'sideways_use_atr': False, 'sideways_use_adx': False, 'sideways_use_spike': True, 'sideways_rsi_required': False}.
[I 2025-08-31 00:19:04,935] Trial 133 finished with values: [-0.04833848003572461, 0.048271294390702234] and parameters: {'p_sma': 47, 'p_std': 36, 'p_atr': 14, 'p_adx': 15, 'rsi_period': 57, 'ema1': 14, 'ema2': 24, 'slip_atr_k': 0.21524628910317467, 'slip_spread_k': 0.25884003986406845, 'spread_hl_frac': 0.01954737764713225, 'bb_std_mult': 3.425807940671579, 'rsi_os': 52, 'rsi_ob': 75, 'vol_spike': 0.16736636886592515, 'adx_thresh': 11.544435492946063, 'atr_min_pct': 0.0031513874546363796, 'atr_max_pct': 0.02582701533952015, 'tp_mult': 2.6755063710761404, 'tsl_mult': 0.05599783804757097, 'strategy': 'breakout', 'time_stop': 53, 'use_sma': True, 'use_atr': False, 'use_adx': False, 'use_ema': False, 'use_spike': True, 'rsi_required': True, 'edge_k': 0.6524361770572352, 'edge_cap': 0.43895371115449217, 'bull_strategy': 'breakout', 'bull_bb_std_mult': 3.0604859815913645, 'bull_rsi_os': 37, 'bull_rsi_ob': 65, 'bull_adx_thresh': 26.61297354072653, 'bull_atr_min_pct': 0.015940280979376505, 'bull_atr_max_pct': 0.09722913102618189, 'bull_tp_mult': 2.8547535321415607, 'bull_tsl_mult': 0.7203726042216942, 'bull_time_stop': 149, 'bull_use_sma': False, 'bull_use_ema': False, 'bull_use_atr': False, 'bull_use_adx': True, 'bull_use_spike': True, 'bull_rsi_required': False, 'bear_strategy': 'breakout', 'bear_bb_std_mult': 1.7784022547687826, 'bear_rsi_os': 20, 'bear_rsi_ob': 52, 'bear_adx_thresh': 31.458991222766247, 'bear_atr_min_pct': 0.02041425363537236, 'bear_atr_max_pct': 0.13729222534904392, 'bear_tp_mult': 1.963747769818094, 'bear_tsl_mult': 0.2317178666876027, 'bear_time_stop': 114, 'bear_use_sma': False, 'bear_use_ema': True, 'bear_use_atr': True, 'bear_use_adx': True, 'bear_use_spike': True, 'bear_rsi_required': False, 'sideways_strategy': 'mean_reversion', 'sideways_bb_std_mult': 0.9163516007431243, 'sideways_rsi_os': 49, 'sideways_rsi_ob': 61, 'sideways_adx_thresh': 12.318954124263248, 'sideways_atr_min_pct': 0.0008976426062405219, 'sideways_atr_max_pct': 0.11284084813708561, 'sideways_tp_mult': 1.120718368667123, 'sideways_tsl_mult': 0.19810904715693284, 'sideways_time_stop': 95, 'sideways_use_sma': False, 'sideways_use_ema': False, 'sideways_use_atr': False, 'sideways_use_adx': False, 'sideways_use_spike': True, 'sideways_rsi_required': False}.
