[I 2025-08-31 03:08:39,168] Trial 801 finished with values: [-1000000000.0, 1000000000.0] and parameters: {'p_sma': 23, 'p_std': 34, 'p_atr': 28, 'p_adx': 21, 'rsi_period': 66, 'ema1': 5, 'ema2': 29, 'slip_atr_k': 0.05724916127664473, 'slip_spread_k': 0.8796081595499678, 'spread_hl_frac': 0.032073989972733793, 'bb_std_mult': 1.719935088667018, 'rsi_os': 43, 'rsi_ob': 67, 'vol_spike': 0.17160569783158158, 'adx_thresh': 20.48618565184518, 'atr_min_pct': 0.01675686969204026, 'atr_max_pct': 0.12452445350060744, 'tp_mult': 1.2038664018212015, 'tsl_mult': 0.7689024208808812, 'strategy': 'mean_reversion', 'time_stop': 288, 'use_sma': True, 'use_atr': False, 'use_adx': False, 'use_ema': False, 'use_spike': False, 'rsi_required': True, 'edge_k': 0.5325182082715397, 'edge_cap': 0.6910611267827432, 'bull_strategy': 'breakout', 'bull_bb_std_mult': 2.3475445020911967, 'bull_rsi_os': 44, 'bull_rsi_ob': 56, 'bull_adx_thresh': 8.354275318782445, 'bull_atr_min_pct': 0.0179651737281508, 'bull_atr_max_pct': 0.0634840602041224, 'bull_tp_mult': 1.2446765952358538, 'bull_tsl_mult': 0.2910578002584714, 'bull_time_stop': 287, 'bull_use_sma': True, 'bull_use_ema': False, 'bull_use_atr': False, 'bull_use_adx': False, 'bull_use_spike': True, 'bull_rsi_required': True, 'bear_strategy': 'mean_reversion', 'bear_bb_std_mult': 1.397417094036626, 'bear_rsi_os': 45, 'bear_rsi_ob': 74, 'bear_adx_thresh': 19.215623356773158, 'bear_atr_min_pct': 0.022742671177312424, 'bear_atr_max_pct': 0.013490558152327149, 'bear_tp_mult': 1.0111551665715093, 'bear_tsl_mult': 0.07150917998635148, 'bear_time_stop': 287, 'bear_use_sma': False, 'bear_use_ema': False, 'bear_use_atr': False, 'bear_use_adx': True, 'bear_use_spike': True, 'bear_rsi_required': True, 'sideways_strategy': 'breakout', 'sideways_bb_std_mult': 0.5020254392135678, 'sideways_rsi_os': 41, 'sideways_rsi_ob': 93, 'sideways_adx_thresh': 10.275362042189466, 'sideways_atr_min_pct': 0.0169019572717979, 'sideways_atr_max_pct': 0.11393561746303041, 'sideways_tp_mult': 1.8090181698939005, 'sideways_tsl_mult': 0.6843545468847098, 'sideways_time_stop': 186, 'sideways_use_sma': True, 'sideways_use_ema': False, 'sideways_use_atr': False, 'sideways_use_adx': False, 'sideways_use_spike': True, 'sideways_rsi_required': False}.
[I 2025-08-31 03:08:40,186] Trial 802 finished with values: [-1000000000.0, 1000000000.0] and parameters: {'p_sma': 6, 'p_std': 52, 'p_atr': 25, 'p_adx': 27, 'rsi_period': 66, 'ema1': 6, 'ema2': 24, 'slip_atr_k': 0.05680348893949182, 'slip_spread_k': 0.39581844990247717, 'spread_hl_frac': 0.005301180089611017, 'bb_std_mult': 2.720443435441756, 'rsi_os': 43, 'rsi_ob': 84, 'vol_spike': 0.23863076235969824, 'adx_thresh': 34.879099696465936, 'atr_min_pct': 0.029398328940956578, 'atr_max_pct': 0.11771117091428414, 'tp_mult': 1.1978568499913524, 'tsl_mult': 0.37347505829530164, 'strategy': 'mean_reversion', 'time_stop': 289, 'use_sma': True, 'use_atr': False, 'use_adx': False, 'use_ema': False, 'use_spike': False, 'rsi_required': True, 'edge_k': 0.6591261914183406, 'edge_cap': 0.06393228668539369, 'bull_strategy': 'breakout', 'bull_bb_std_mult': 1.9899064054411097, 'bull_rsi_os': 43, 'bull_rsi_ob': 56, 'bull_adx_thresh': 27.630182932604548, 'bull_atr_min_pct': 0.018011780836590264, 'bull_atr_max_pct': 0.1448888584331209, 'bull_tp_mult': 2.3926560871780818, 'bull_tsl_mult': 0.9059480785990908, 'bull_time_stop': 44, 'bull_use_sma': True, 'bull_use_ema': False, 'bull_use_atr': False, 'bull_use_adx': False, 'bull_use_spike': True, 'bull_rsi_required': True, 'bear_strategy': 'mean_reversion', 'bear_bb_std_mult': 1.398413786858592, 'bear_rsi_os': 17, 'bear_rsi_ob': 85, 'bear_adx_thresh': 5.0661736099873265, 'bear_atr_min_pct': 0.0038471827661760217, 'bear_atr_max_pct': 0.012907669392076385, 'bear_tp_mult': 2.5892396323875593, 'bear_tsl_mult': 0.08622517252406214, 'bear_time_stop': 19, 'bear_use_sma': False, 'bear_use_ema': False, 'bear_use_atr': False, 'bear_use_adx': True, 'bear_use_spike': True, 'bear_rsi_required': True, 'sideways_strategy': 'breakout', 'sideways_bb_std_mult': 0.640084484890487, 'sideways_rsi_os': 41, 'sideways_rsi_ob': 45, 'sideways_adx_thresh': 8.328826963023689, 'sideways_atr_min_pct': 0.02738587312991096, 'sideways_atr_max_pct': 0.05286874739805286, 'sideways_tp_mult': 1.700509601387656, 'sideways_tsl_mult': 0.6816364781688798, 'sideways_time_stop': 56, 'sideways_use_sma': True, 'sideways_use_ema': True, 'sideways_use_atr': True, 'sideways_use_adx': False, 'sideways_use_spike': True, 'sideways_rsi_required': False}.
[I 2025-08-31 03:08:40,619] Trial 803 finished with values: [-1000000000.0, 1000000000.0] and parameters: {'p_sma': 54, 'p_std': 52, 'p_atr': 28, 'p_adx': 21, 'rsi_period': 70, 'ema1': 6, 'ema2': 29, 'slip_atr_k': 0.055113560222962515, 'slip_spread_k': 0.7990408597424082, 'spread_hl_frac': 0.005442307851218327, 'bb_std_mult': 3.3527342584862128, 'rsi_os': 43, 'rsi_ob': 67, 'vol_spike': 0.17202971587814608, 'adx_thresh': 20.73661936155527, 'atr_min_pct': 0.007767177614018196, 'atr_max_pct': 0.05617993704535407, 'tp_mult': 1.2010539499112625, 'tsl_mult': 0.3408581576860317, 'strategy': 'mean_reversion', 'time_stop': 102, 'use_sma': True, 'use_atr': True, 'use_adx': True, 'use_ema': False, 'use_spike': False, 'rsi_required': True, 'edge_k': 0.6567206681935635, 'edge_cap': 0.16161968055624495, 'bull_strategy': 'breakout', 'bull_bb_std_mult': 3.4647370282216103, 'bull_rsi_os': 26, 'bull_rsi_ob': 58, 'bull_adx_thresh': 10.761579279323843, 'bull_atr_min_pct': 0.019960425861891645, 'bull_atr_max_pct': 0.14543480179585008, 'bull_tp_mult': 2.4030306053308914, 'bull_tsl_mult': 0.2927193077844157, 'bull_time_stop': 128, 'bull_use_sma': True, 'bull_use_ema': False, 'bull_use_atr': False, 'bull_use_adx': False, 'bull_use_spike': True, 'bull_rsi_required': True, 'bear_strategy': 'mean_reversion', 'bear_bb_std_mult': 1.3983647714847174, 'bear_rsi_os': 16, 'bear_rsi_ob': 54, 'bear_adx_thresh': 5.01009510618646, 'bear_atr_min_pct': 0.02955410513115675, 'bear_atr_max_pct': 0.012984378649526866, 'bear_tp_mult': 1.1730050885829817, 'bear_tsl_mult': 0.5140573228212817, 'bear_time_stop': 15, 'bear_use_sma': False, 'bear_use_ema': False, 'bear_use_atr': False, 'bear_use_adx': False, 'bear_use_spike': True, 'bear_rsi_required': True, 'sideways_strategy': 'breakout', 'sideways_bb_std_mult': 0.6233842462653723, 'sideways_rsi_os': 41, 'sideways_rsi_ob': 45, 'sideways_adx_thresh': 6.965682573334158, 'sideways_atr_min_pct': 0.027567884794935712, 'sideways_atr_max_pct': 0.05326581683392516, 'sideways_tp_mult': 1.611236759813792, 'sideways_tsl_mult': 0.6819714160880912, 'sideways_time_stop': 189, 'sideways_use_sma': False, 'sideways_use_ema': True, 'sideways_use_atr': True, 'sideways_use_adx': False, 'sideways_use_spike': True, 'sideways_rsi_required': False}.
[I 2025-08-31 03:08:40,696] Trial 804 finished with values: [-1000000000.0, 1000000000.0] and parameters: {'p_sma': 16, 'p_std': 52, 'p_atr': 29, 'p_adx': 26, 'rsi_period': 66, 'ema1': 6, 'ema2': 24, 'slip_atr_k': 0.05529381968807738, 'slip_spread_k': 0.11129422895561328, 'spread_hl_frac': 0.0019538734005464242, 'bb_std_mult': 1.2903898901567659, 'rsi_os': 38, 'rsi_ob': 60, 'vol_spike': 0.21427795888178366, 'adx_thresh': 20.67490331945065, 'atr_min_pct': 0.00795234875589185, 'atr_max_pct': 0.11737864026354736, 'tp_mult': 2.3620015510578583, 'tsl_mult': 0.4354307773731195, 'strategy': 'mean_reversion', 'time_stop': 96, 'use_sma': True, 'use_atr': True, 'use_adx': True, 'use_ema': False, 'use_spike': True, 'rsi_required': True, 'edge_k': 0.5332028022650909, 'edge_cap': 0.16745054963528108, 'bull_strategy': 'breakout', 'bull_bb_std_mult': 2.2063055261803646, 'bull_rsi_os': 43, 'bull_rsi_ob': 61, 'bull_adx_thresh': 6.906936690151137, 'bull_atr_min_pct': 0.029859578106802998, 'bull_atr_max_pct': 0.06359458993552818, 'bull_tp_mult': 2.6408469846730496, 'bull_tsl_mult': 0.5672179147331403, 'bull_time_stop': 92, 'bull_use_sma': True, 'bull_use_ema': False, 'bull_use_atr': False, 'bull_use_adx': False, 'bull_use_spike': True, 'bull_rsi_required': True, 'bear_strategy': 'mean_reversion', 'bear_bb_std_mult': 1.2437002386759317, 'bear_rsi_os': 5, 'bear_rsi_ob': 48, 'bear_adx_thresh': 5.039032293937275, 'bear_atr_min_pct': 0.018004872963927505, 'bear_atr_max_pct': 0.013349210156940385, 'bear_tp_mult': 2.153368525273656, 'bear_tsl_mult': 0.5017486776326805, 'bear_time_stop': 18, 'bear_use_sma': False, 'bear_use_ema': True, 'bear_use_atr': False, 'bear_use_adx': False, 'bear_use_spike': True, 'bear_rsi_required': True, 'sideways_strategy': 'breakout', 'sideways_bb_std_mult': 0.6175355950617197, 'sideways_rsi_os': 39, 'sideways_rsi_ob': 92, 'sideways_adx_thresh': 7.20388030638077, 'sideways_atr_min_pct': 0.027683617781022442, 'sideways_atr_max_pct': 0.052693252533372655, 'sideways_tp_mult': 1.7265558724405285, 'sideways_tsl_mult': 0.6473486726367472, 'sideways_time_stop': 188, 'sideways_use_sma': False, 'sideways_use_ema': True, 'sideways_use_atr': True, 'sideways_use_adx': False, 'sideways_use_spike': True, 'sideways_rsi_required': False}.
[I 2025-08-31 03:09:15,554] Trial 807 finished with values: [-1000000000.0, 1000000000.0] and parameters: {'p_sma': 40, 'p_std': 51, 'p_atr': 29, 'p_adx': 19, 'rsi_period': 68, 'ema1': 30, 'ema2': 56, 'slip_atr_k': 0.08893998782202372, 'slip_spread_k': 0.5041910393766906, 'spread_hl_frac': 0.0017218320154451336, 'bb_std_mult': 0.6995764893808774, 'rsi_os': 28, 'rsi_ob': 87, 'vol_spike': 0.18394233944933971, 'adx_thresh': 19.202054361612166, 'atr_min_pct': 0.028205131392226898, 'atr_max_pct': 0.11952308451769252, 'tp_mult': 1.066069086655562, 'tsl_mult': 0.18214656714860877, 'strategy': 'mean_reversion', 'time_stop': 94, 'use_sma': True, 'use_atr': True, 'use_adx': True, 'use_ema': False, 'use_spike': True, 'rsi_required': True, 'edge_k': 0.5424774728564918, 'edge_cap': 0.10955002250513123, 'bull_strategy': 'breakout', 'bull_bb_std_mult': 1.7606436512564287, 'bull_rsi_os': 51, 'bull_rsi_ob': 61, 'bull_adx_thresh': 25.329546996582433, 'bull_atr_min_pct': 0.02383428468892666, 'bull_atr_max_pct': 0.13160362961404048, 'bull_tp_mult': 2.626507002537279, 'bull_tsl_mult': 0.5798233684195192, 'bull_time_stop': 92, 'bull_use_sma': True, 'bull_use_ema': False, 'bull_use_atr': False, 'bull_use_adx': True, 'bull_use_spike': True, 'bull_rsi_required': True, 'bear_strategy': 'mean_reversion', 'bear_bb_std_mult': 1.2682347082422396, 'bear_rsi_os': 5, 'bear_rsi_ob': 48, 'bear_adx_thresh': 10.733065154007694, 'bear_atr_min_pct': 0.006216786333916902, 'bear_atr_max_pct': 0.01002242932501155, 'bear_tp_mult': 2.067580412263081, 'bear_tsl_mult': 0.5431496170248844, 'bear_time_stop': 10, 'bear_use_sma': False, 'bear_use_ema': True, 'bear_use_atr': False, 'bear_use_adx': False, 'bear_use_spike': False, 'bear_rsi_required': True, 'sideways_strategy': 'breakout', 'sideways_bb_std_mult': 3.1073179689826658, 'sideways_rsi_os': 6, 'sideways_rsi_ob': 94, 'sideways_adx_thresh': 25.175289408744618, 'sideways_atr_min_pct': 0.028859264994380445, 'sideways_atr_max_pct': 0.04635542272891735, 'sideways_tp_mult': 1.7415077086605308, 'sideways_tsl_mult': 0.6552152618402001, 'sideways_time_stop': 194, 'sideways_use_sma': False, 'sideways_use_ema': False, 'sideways_use_atr': False, 'sideways_use_adx': False, 'sideways_use_spike': True, 'sideways_rsi_required': False}.
[I 2025-08-31 03:09:15,996] Trial 808 finished with values: [-1000000000.0, 1000000000.0] and parameters: {'p_sma': 52, 'p_std': 58, 'p_atr': 17, 'p_adx': 19, 'rsi_period': 68, 'ema1': 30, 'ema2': 41, 'slip_atr_k': 0.020519419489562953, 'slip_spread_k': 0.14858002220848981, 'spread_hl_frac': 0.0015762284494052537, 'bb_std_mult': 1.6571351627378905, 'rsi_os': 40, 'rsi_ob': 81, 'vol_spike': 0.183828259587061, 'adx_thresh': 19.38851256954098, 'atr_min_pct': 0.0110011663732957, 'atr_max_pct': 0.1199960742167505, 'tp_mult': 1.5317730045450615, 'tsl_mult': 0.5870618109228843, 'strategy': 'mean_reversion', 'time_stop': 6, 'use_sma': True, 'use_atr': False, 'use_adx': False, 'use_ema': False, 'use_spike': True, 'rsi_required': True, 'edge_k': 0.08609743380152057, 'edge_cap': 0.10660639234712249, 'bull_strategy': 'breakout', 'bull_bb_std_mult': 2.5393745335317193, 'bull_rsi_os': 45, 'bull_rsi_ob': 74, 'bull_adx_thresh': 6.497562638816307, 'bull_atr_min_pct': 0.023626222249145762, 'bull_atr_max_pct': 0.12526297277382575, 'bull_tp_mult': 1.9737078247508195, 'bull_tsl_mult': 0.34258906586222426, 'bull_time_stop': 142, 'bull_use_sma': True, 'bull_use_ema': False, 'bull_use_atr': False, 'bull_use_adx': True, 'bull_use_spike': True, 'bull_rsi_required': True, 'bear_strategy': 'mean_reversion', 'bear_bb_std_mult': 2.357825557048168, 'bear_rsi_os': 14, 'bear_rsi_ob': 46, 'bear_adx_thresh': 14.846751156838788, 'bear_atr_min_pct': 0.006201877858509962, 'bear_atr_max_pct': 0.01703522875598293, 'bear_tp_mult': 2.072453054859659, 'bear_tsl_mult': 0.5451131949344674, 'bear_time_stop': 25, 'bear_use_sma': False, 'bear_use_ema': True, 'bear_use_atr': False, 'bear_use_adx': True, 'bear_use_spike': False, 'bear_rsi_required': True, 'sideways_strategy': 'breakout', 'sideways_bb_std_mult': 0.7257831188986549, 'sideways_rsi_os': 43, 'sideways_rsi_ob': 94, 'sideways_adx_thresh': 9.15638687101242, 'sideways_atr_min_pct': 0.007823865840155559, 'sideways_atr_max_pct': 0.04755342669878963, 'sideways_tp_mult': 1.766122724771195, 'sideways_tsl_mult': 0.6638515497693798, 'sideways_time_stop': 207, 'sideways_use_sma': True, 'sideways_use_ema': False, 'sideways_use_atr': False, 'sideways_use_adx': False, 'sideways_use_spike': True, 'sideways_rsi_required': False}.
[I 2025-08-31 03:09:16,042] Trial 806 finished with values: [-1000000000.0, 1000000000.0] and parameters: {'p_sma': 55, 'p_std': 53, 'p_atr': 17, 'p_adx': 25, 'rsi_period': 78, 'ema1': 6, 'ema2': 45, 'slip_atr_k': 0.19163298457242267, 'slip_spread_k': 0.5018455490988558, 'spread_hl_frac': 0.0018918898522057978, 'bb_std_mult': 0.6947762354085782, 'rsi_os': 37, 'rsi_ob': 69, 'vol_spike': 0.0006560108713707657, 'adx_thresh': 19.50957294901234, 'atr_min_pct': 0.007934894179662802, 'atr_max_pct': 0.013720250823229418, 'tp_mult': 1.9952047914307844, 'tsl_mult': 0.5898530786648335, 'strategy': 'mean_reversion', 'time_stop': 5, 'use_sma': True, 'use_atr': True, 'use_adx': True, 'use_ema': False, 'use_spike': True, 'rsi_required': True, 'edge_k': 0.5463371342857383, 'edge_cap': 0.16328971843613627, 'bull_strategy': 'breakout', 'bull_bb_std_mult': 2.988776627235422, 'bull_rsi_os': 24, 'bull_rsi_ob': 76, 'bull_adx_thresh': 6.737245461123026, 'bull_atr_min_pct': 0.020002869230783503, 'bull_atr_max_pct': 0.14758254877158267, 'bull_tp_mult': 1.8677742704832703, 'bull_tsl_mult': 0.34198409870987767, 'bull_time_stop': 143, 'bull_use_sma': True, 'bull_use_ema': False, 'bull_use_atr': False, 'bull_use_adx': True, 'bull_use_spike': True, 'bull_rsi_required': True, 'bear_strategy': 'mean_reversion', 'bear_bb_std_mult': 2.348300659592307, 'bear_rsi_os': 14, 'bear_rsi_ob': 48, 'bear_adx_thresh': 14.770046704797124, 'bear_atr_min_pct': 0.006233807151173586, 'bear_atr_max_pct': 0.01661745241720326, 'bear_tp_mult': 1.1776275497766275, 'bear_tsl_mult': 0.5072189748141154, 'bear_time_stop': 274, 'bear_use_sma': False, 'bear_use_ema': True, 'bear_use_atr': False, 'bear_use_adx': False, 'bear_use_spike': False, 'bear_rsi_required': True, 'sideways_strategy': 'breakout', 'sideways_bb_std_mult': 0.7148354927348372, 'sideways_rsi_os': 6, 'sideways_rsi_ob': 93, 'sideways_adx_thresh': 7.326655022000095, 'sideways_atr_min_pct': 0.02458986075953478, 'sideways_atr_max_pct': 0.04346811400343038, 'sideways_tp_mult': 1.724142173260287, 'sideways_tsl_mult': 0.6559526257277999, 'sideways_time_stop': 198, 'sideways_use_sma': False, 'sideways_use_ema': True, 'sideways_use_atr': True, 'sideways_use_adx': False, 'sideways_use_spike': True, 'sideways_rsi_required': False}.
[I 2025-08-31 03:09:16,356] Trial 805 finished with values: [-1000000000.0, 1000000000.0] and parameters: {'p_sma': 55, 'p_std': 13, 'p_atr': 17, 'p_adx': 27, 'rsi_period': 19, 'ema1': 6, 'ema2': 42, 'slip_atr_k': 0.17323242887051976, 'slip_spread_k': 0.397851756711693, 'spread_hl_frac': 0.006061034380843506, 'bb_std_mult': 3.085014380107674, 'rsi_os': 14, 'rsi_ob': 69, 'vol_spike': 0.23741882427551414, 'adx_thresh': 20.905544345681626, 'atr_min_pct': 0.01131725046010481, 'atr_max_pct': 0.11784990805288238, 'tp_mult': 2.173925113322497, 'tsl_mult': 0.3389033103339232, 'strategy': 'mean_reversion', 'time_stop': 64, 'use_sma': True, 'use_atr': True, 'use_adx': True, 'use_ema': False, 'use_spike': True, 'rsi_required': True, 'edge_k': 0.5971357146977225, 'edge_cap': 0.1716559928441605, 'bull_strategy': 'breakout', 'bull_bb_std_mult': 2.189352177354433, 'bull_rsi_os': 24, 'bull_rsi_ob': 62, 'bull_adx_thresh': 23.874371102099907, 'bull_atr_min_pct': 0.0026164597525936, 'bull_atr_max_pct': 0.14983943215685566, 'bull_tp_mult': 2.242514674159407, 'bull_tsl_mult': 0.21007820216879147, 'bull_time_stop': 140, 'bull_use_sma': True, 'bull_use_ema': False, 'bull_use_atr': False, 'bull_use_adx': True, 'bull_use_spike': True, 'bull_rsi_required': True, 'bear_strategy': 'mean_reversion', 'bear_bb_std_mult': 1.2496509607926252, 'bear_rsi_os': 17, 'bear_rsi_ob': 48, 'bear_adx_thresh': 34.01779021400965, 'bear_atr_min_pct': 0.0064287170047362535, 'bear_atr_max_pct': 0.1272122688215266, 'bear_tp_mult': 2.1607589259490774, 'bear_tsl_mult': 0.5049948837088292, 'bear_time_stop': 19, 'bear_use_sma': False, 'bear_use_ema': True, 'bear_use_atr': False, 'bear_use_adx': False, 'bear_use_spike': True, 'bear_rsi_required': True, 'sideways_strategy': 'breakout', 'sideways_bb_std_mult': 0.6205366062832862, 'sideways_rsi_os': 39, 'sideways_rsi_ob': 94, 'sideways_adx_thresh': 8.44750475427957, 'sideways_atr_min_pct': 0.005527094275127558, 'sideways_atr_max_pct': 0.043050487272767515, 'sideways_tp_mult': 2.31174426056437, 'sideways_tsl_mult': 0.6490781002422781, 'sideways_time_stop': 190, 'sideways_use_sma': False, 'sideways_use_ema': True, 'sideways_use_atr': True, 'sideways_use_adx': False, 'sideways_use_spike': True, 'sideways_rsi_required': False}.
[I 2025-08-31 03:09:49,796] Trial 812 finished with values: [-1000000000.0, 1000000000.0] and parameters: {'p_sma': 19, 'p_std': 49, 'p_atr': 27, 'p_adx': 13, 'rsi_period': 70, 'ema1': 5, 'ema2': 23, 'slip_atr_k': 0.20184915409045115, 'slip_spread_k': 0.1844208807332522, 'spread_hl_frac': 0.004256730864505746, 'bb_std_mult': 1.83963613260937, 'rsi_os': 45, 'rsi_ob': 58, 'vol_spike': 0.24865022700230993, 'adx_thresh': 21.8750214819375, 'atr_min_pct': 0.02640542880647819, 'atr_max_pct': 0.12723691354967526, 'tp_mult': 2.039773800555918, 'tsl_mult': 0.9027381024714147, 'strategy': 'mean_reversion', 'time_stop': 234, 'use_sma': False, 'use_atr': False, 'use_adx': False, 'use_ema': False, 'use_spike': False, 'rsi_required': True, 'edge_k': 1.1062194872954638, 'edge_cap': 0.2706703900470693, 'bull_strategy': 'mean_reversion', 'bull_bb_std_mult': 2.4010669582884727, 'bull_rsi_os': 49, 'bull_rsi_ob': 79, 'bull_adx_thresh': 26.96620340432851, 'bull_atr_min_pct': 0.012043806318132563, 'bull_atr_max_pct': 0.12063128083263312, 'bull_tp_mult': 1.0185330757987618, 'bull_tsl_mult': 0.6127426877698371, 'bull_time_stop': 134, 'bull_use_sma': True, 'bull_use_ema': False, 'bull_use_atr': False, 'bull_use_adx': True, 'bull_use_spike': True, 'bull_rsi_required': True, 'bear_strategy': 'breakout', 'bear_bb_std_mult': 2.2257214643744736, 'bear_rsi_os': 16, 'bear_rsi_ob': 45, 'bear_adx_thresh': 6.206946074259227, 'bear_atr_min_pct': 0.007139919747707605, 'bear_atr_max_pct': 0.10452601274224012, 'bear_tp_mult': 2.5058727149570146, 'bear_tsl_mult': 0.6116154060936, 'bear_time_stop': 5, 'bear_use_sma': False, 'bear_use_ema': False, 'bear_use_atr': True, 'bear_use_adx': True, 'bear_use_spike': False, 'bear_rsi_required': True, 'sideways_strategy': 'breakout', 'sideways_bb_std_mult': 0.5740370083445174, 'sideways_rsi_os': 14, 'sideways_rsi_ob': 85, 'sideways_adx_thresh': 16.47845622171892, 'sideways_atr_min_pct': 0.009627422841531893, 'sideways_atr_max_pct': 0.12705425678787996, 'sideways_tp_mult': 2.511482451695023, 'sideways_tsl_mult': 0.9820293026636193, 'sideways_time_stop': 23, 'sideways_use_sma': True, 'sideways_use_ema': False, 'sideways_use_atr': False, 'sideways_use_adx': False, 'sideways_use_spike': False, 'sideways_rsi_required': False}.
