[I 2025-08-31 02:24:41,436] Trial 493 finished with values: [-0.01420621010406009, 0.01413698018134744] and parameters: {'p_sma': 55, 'p_std': 45, 'p_atr': 28, 'p_adx': 26, 'rsi_period': 67, 'ema1': 5, 'ema2': 23, 'slip_atr_k': 0.006678501969403141, 'slip_spread_k': 0.1444351274893309, 'spread_hl_frac': 0.004778239672404036, 'bb_std_mult': 1.6784341842713444, 'rsi_os': 39, 'rsi_ob': 66, 'vol_spike': 0.18137029005452804, 'adx_thresh': 20.159198534356413, 'atr_min_pct': 0.00788015722662613, 'atr_max_pct': 0.11867234106864717, 'tp_mult': 1.0315865609444874, 'tsl_mult': 0.023383617121753353, 'strategy': 'mean_reversion', 'time_stop': 113, 'use_sma': True, 'use_atr': False, 'use_adx': False, 'use_ema': False, 'use_spike': True, 'rsi_required': True, 'edge_k': 0.5384587561808027, 'edge_cap': 0.1438587148167121, 'bull_strategy': 'breakout', 'bull_bb_std_mult': 2.4433516760386693, 'bull_rsi_os': 50, 'bull_rsi_ob': 61, 'bull_adx_thresh': 6.539354581610356, 'bull_atr_min_pct': 0.00019887868138272264, 'bull_atr_max_pct': 0.14731734866339907, 'bull_tp_mult': 2.26067269656018, 'bull_tsl_mult': 0.2776040576519075, 'bull_time_stop': 136, 'bull_use_sma': True, 'bull_use_ema': False, 'bull_use_atr': False, 'bull_use_adx': False, 'bull_use_spike': True, 'bull_rsi_required': True, 'bear_strategy': 'mean_reversion', 'bear_bb_std_mult': 1.407891777646834, 'bear_rsi_os': 17, 'bear_rsi_ob': 46, 'bear_adx_thresh': 5.061170270409599, 'bear_atr_min_pct': 0.005851785682496534, 'bear_atr_max_pct': 0.012227185770103175, 'bear_tp_mult': 2.1197973101692686, 'bear_tsl_mult': 0.7664191403689797, 'bear_time_stop': 5, 'bear_use_sma': False, 'bear_use_ema': True, 'bear_use_atr': False, 'bear_use_adx': False, 'bear_use_spike': False, 'bear_rsi_required': True, 'sideways_strategy': 'mean_reversion', 'sideways_bb_std_mult': 0.632662537651208, 'sideways_rsi_os': 41, 'sideways_rsi_ob': 95, 'sideways_adx_thresh': 9.605439958310827, 'sideways_atr_min_pct': 0.027039369889388733, 'sideways_atr_max_pct': 0.04890839216456877, 'sideways_tp_mult': 1.8554370068377715, 'sideways_tsl_mult': 0.6334446065091115, 'sideways_time_stop': 200, 'sideways_use_sma': True, 'sideways_use_ema': False, 'sideways_use_atr': False, 'sideways_use_adx': False, 'sideways_use_spike': True, 'sideways_rsi_required': False}.
[I 2025-08-31 02:25:14,975] Trial 496 finished with values: [-0.014243512615258247, 0.014174189151760915] and parameters: {'p_sma': 55, 'p_std': 45, 'p_atr': 28, 'p_adx': 25, 'rsi_period': 66, 'ema1': 5, 'ema2': 24, 'slip_atr_k': 0.00830470468279813, 'slip_spread_k': 0.13881283450921067, 'spread_hl_frac': 0.004379965789637649, 'bb_std_mult': 1.7001774409046977, 'rsi_os': 42, 'rsi_ob': 68, 'vol_spike': 0.18252087142006326, 'adx_thresh': 19.747012653570312, 'atr_min_pct': 0.007350968678724985, 'atr_max_pct': 0.11812285115337832, 'tp_mult': 1.0146886887008935, 'tsl_mult': 0.035000959682995714, 'strategy': 'mean_reversion', 'time_stop': 113, 'use_sma': True, 'use_atr': False, 'use_adx': False, 'use_ema': False, 'use_spike': True, 'rsi_required': True, 'edge_k': 0.5404443083670576, 'edge_cap': 0.09761679700007381, 'bull_strategy': 'breakout', 'bull_bb_std_mult': 2.502177070309417, 'bull_rsi_os': 49, 'bull_rsi_ob': 61, 'bull_adx_thresh': 6.113133808137195, 'bull_atr_min_pct': 8.778833645545358e-05, 'bull_atr_max_pct': 0.14936767085359848, 'bull_tp_mult': 2.2636358581075093, 'bull_tsl_mult': 0.281198075820014, 'bull_time_stop': 141, 'bull_use_sma': True, 'bull_use_ema': False, 'bull_use_atr': False, 'bull_use_adx': False, 'bull_use_spike': True, 'bull_rsi_required': True, 'bear_strategy': 'mean_reversion', 'bear_bb_std_mult': 1.4118510512971638, 'bear_rsi_os': 17, 'bear_rsi_ob': 46, 'bear_adx_thresh': 5.097491436489153, 'bear_atr_min_pct': 0.006140998558665362, 'bear_atr_max_pct': 0.01007871103117805, 'bear_tp_mult': 2.109056408129635, 'bear_tsl_mult': 0.7812881521345482, 'bear_time_stop': 6, 'bear_use_sma': False, 'bear_use_ema': True, 'bear_use_atr': False, 'bear_use_adx': False, 'bear_use_spike': False, 'bear_rsi_required': True, 'sideways_strategy': 'mean_reversion', 'sideways_bb_std_mult': 0.6698723883692186, 'sideways_rsi_os': 40, 'sideways_rsi_ob': 95, 'sideways_adx_thresh': 10.096188397827085, 'sideways_atr_min_pct': 0.026875753899067125, 'sideways_atr_max_pct': 0.04936343426954237, 'sideways_tp_mult': 1.810731065733266, 'sideways_tsl_mult': 0.6408112355214921, 'sideways_time_stop': 192, 'sideways_use_sma': True, 'sideways_use_ema': False, 'sideways_use_atr': False, 'sideways_use_adx': False, 'sideways_use_spike': False, 'sideways_rsi_required': False}.
[I 2025-08-31 02:25:15,003] Trial 499 finished with values: [-0.014181186211839614, 0.014111861175635112] and parameters: {'p_sma': 55, 'p_std': 45, 'p_atr': 28, 'p_adx': 25, 'rsi_period': 66, 'ema1': 5, 'ema2': 24, 'slip_atr_k': 0.008243104323274048, 'slip_spread_k': 0.14257142542079349, 'spread_hl_frac': 0.004630699348730508, 'bb_std_mult': 1.6864734238459622, 'rsi_os': 37, 'rsi_ob': 71, 'vol_spike': 0.1827742291527472, 'adx_thresh': 19.632189641732005, 'atr_min_pct': 0.007487873800537785, 'atr_max_pct': 0.11778359854921742, 'tp_mult': 1.0130518064153284, 'tsl_mult': 0.03953265405207526, 'strategy': 'mean_reversion', 'time_stop': 110, 'use_sma': True, 'use_atr': False, 'use_adx': False, 'use_ema': False, 'use_spike': True, 'rsi_required': True, 'edge_k': 0.5400017847479694, 'edge_cap': 0.10558891110411261, 'bull_strategy': 'breakout', 'bull_bb_std_mult': 2.4838542655613898, 'bull_rsi_os': 50, 'bull_rsi_ob': 61, 'bull_adx_thresh': 6.334894460955397, 'bull_atr_min_pct': 0.00046914103612629473, 'bull_atr_max_pct': 0.14970001160022764, 'bull_tp_mult': 2.2664680539298265, 'bull_tsl_mult': 0.26681875839326374, 'bull_time_stop': 138, 'bull_use_sma': True, 'bull_use_ema': False, 'bull_use_atr': False, 'bull_use_adx': False, 'bull_use_spike': True, 'bull_rsi_required': True, 'bear_strategy': 'mean_reversion', 'bear_bb_std_mult': 1.4069283865931546, 'bear_rsi_os': 17, 'bear_rsi_ob': 46, 'bear_adx_thresh': 5.083154661082633, 'bear_atr_min_pct': 0.006497599275965136, 'bear_atr_max_pct': 0.010450681902796627, 'bear_tp_mult': 2.1124188457472024, 'bear_tsl_mult': 0.78397919646282, 'bear_time_stop': 5, 'bear_use_sma': False, 'bear_use_ema': True, 'bear_use_atr': False, 'bear_use_adx': True, 'bear_use_spike': False, 'bear_rsi_required': True, 'sideways_strategy': 'mean_reversion', 'sideways_bb_std_mult': 0.7146702982978245, 'sideways_rsi_os': 40, 'sideways_rsi_ob': 95, 'sideways_adx_thresh': 9.847707748251237, 'sideways_atr_min_pct': 0.027055703369192465, 'sideways_atr_max_pct': 0.049524772581699704, 'sideways_tp_mult': 1.8512223030378037, 'sideways_tsl_mult': 0.6281989017956945, 'sideways_time_stop': 195, 'sideways_use_sma': True, 'sideways_use_ema': False, 'sideways_use_atr': False, 'sideways_use_adx': False, 'sideways_use_spike': False, 'sideways_rsi_required': False}.
[I 2025-08-31 02:25:15,272] Trial 498 finished with values: [-0.014262955082467998, 0.014193593649464284] and parameters: {'p_sma': 55, 'p_std': 45, 'p_atr': 28, 'p_adx': 26, 'rsi_period': 66, 'ema1': 5, 'ema2': 24, 'slip_atr_k': 0.008924551514999924, 'slip_spread_k': 0.15563440498625894, 'spread_hl_frac': 0.0045634678398539675, 'bb_std_mult': 1.6793870830796864, 'rsi_os': 39, 'rsi_ob': 70, 'vol_spike': 0.18334679786173025, 'adx_thresh': 20.004218882086956, 'atr_min_pct': 0.007475916398619409, 'atr_max_pct': 0.11719330233544763, 'tp_mult': 1.0287797661406575, 'tsl_mult': 0.04114429608202494, 'strategy': 'mean_reversion', 'time_stop': 108, 'use_sma': True, 'use_atr': False, 'use_adx': False, 'use_ema': False, 'use_spike': True, 'rsi_required': True, 'edge_k': 0.5519749324190177, 'edge_cap': 0.10526668325700378, 'bull_strategy': 'breakout', 'bull_bb_std_mult': 2.500465405552195, 'bull_rsi_os': 49, 'bull_rsi_ob': 61, 'bull_adx_thresh': 6.3002801835491695, 'bull_atr_min_pct': 7.406497235154291e-05, 'bull_atr_max_pct': 0.14938231462977905, 'bull_tp_mult': 2.2683236472234225, 'bull_tsl_mult': 0.27791561117774416, 'bull_time_stop': 136, 'bull_use_sma': True, 'bull_use_ema': False, 'bull_use_atr': False, 'bull_use_adx': False, 'bull_use_spike': True, 'bull_rsi_required': True, 'bear_strategy': 'mean_reversion', 'bear_bb_std_mult': 1.4356048540127158, 'bear_rsi_os': 17, 'bear_rsi_ob': 46, 'bear_adx_thresh': 5.137314700282784, 'bear_atr_min_pct': 0.006274582169872385, 'bear_atr_max_pct': 0.012418288258737253, 'bear_tp_mult': 2.1107230859480692, 'bear_tsl_mult': 0.7703482233697169, 'bear_time_stop': 5, 'bear_use_sma': False, 'bear_use_ema': True, 'bear_use_atr': False, 'bear_use_adx': False, 'bear_use_spike': False, 'bear_rsi_required': True, 'sideways_strategy': 'mean_reversion', 'sideways_bb_std_mult': 0.6752792719194166, 'sideways_rsi_os': 40, 'sideways_rsi_ob': 95, 'sideways_adx_thresh': 9.787007706817672, 'sideways_atr_min_pct': 0.02687956396492563, 'sideways_atr_max_pct': 0.04934860191974198, 'sideways_tp_mult': 1.8508594559831533, 'sideways_tsl_mult': 0.6330543027540039, 'sideways_time_stop': 191, 'sideways_use_sma': True, 'sideways_use_ema': False, 'sideways_use_atr': False, 'sideways_use_adx': False, 'sideways_use_spike': False, 'sideways_rsi_required': False}.
[I 2025-08-31 02:25:15,371] Trial 497 finished with values: [-0.014245824364533255, 0.014176539154463185] and parameters: {'p_sma': 55, 'p_std': 45, 'p_atr': 28, 'p_adx': 25, 'rsi_period': 66, 'ema1': 5, 'ema2': 24, 'slip_atr_k': 0.007577541695083769, 'slip_spread_k': 0.142349202769493, 'spread_hl_frac': 0.006159201607008304, 'bb_std_mult': 1.6882095726074278, 'rsi_os': 37, 'rsi_ob': 66, 'vol_spike': 0.18110175489523792, 'adx_thresh': 19.782366329305557, 'atr_min_pct': 0.007486504795228378, 'atr_max_pct': 0.11940975666291578, 'tp_mult': 1.02033461459341, 'tsl_mult': 0.034960906703548095, 'strategy': 'mean_reversion', 'time_stop': 112, 'use_sma': True, 'use_atr': False, 'use_adx': False, 'use_ema': False, 'use_spike': True, 'rsi_required': True, 'edge_k': 0.5153661242189991, 'edge_cap': 0.10621606224901152, 'bull_strategy': 'breakout', 'bull_bb_std_mult': 2.4879541451526275, 'bull_rsi_os': 49, 'bull_rsi_ob': 61, 'bull_adx_thresh': 6.266385030653368, 'bull_atr_min_pct': 0.0004156997086513091, 'bull_atr_max_pct': 0.14904819088095128, 'bull_tp_mult': 2.259173186766924, 'bull_tsl_mult': 0.27603249180305073, 'bull_time_stop': 141, 'bull_use_sma': True, 'bull_use_ema': False, 'bull_use_atr': False, 'bull_use_adx': False, 'bull_use_spike': True, 'bull_rsi_required': True, 'bear_strategy': 'mean_reversion', 'bear_bb_std_mult': 1.4015609145494268, 'bear_rsi_os': 17, 'bear_rsi_ob': 46, 'bear_adx_thresh': 5.19406704521023, 'bear_atr_min_pct': 0.006086105702306173, 'bear_atr_max_pct': 0.01016912317285223, 'bear_tp_mult': 2.103362506676452, 'bear_tsl_mult': 0.7562555886290436, 'bear_time_stop': 5, 'bear_use_sma': False, 'bear_use_ema': True, 'bear_use_atr': False, 'bear_use_adx': False, 'bear_use_spike': False, 'bear_rsi_required': True, 'sideways_strategy': 'mean_reversion', 'sideways_bb_std_mult': 0.7014421013273341, 'sideways_rsi_os': 40, 'sideways_rsi_ob': 95, 'sideways_adx_thresh': 9.931059762513774, 'sideways_atr_min_pct': 0.026668689257357298, 'sideways_atr_max_pct': 0.049413744530629994, 'sideways_tp_mult': 1.8439109095166164, 'sideways_tsl_mult': 0.6327178770301167, 'sideways_time_stop': 194, 'sideways_use_sma': True, 'sideways_use_ema': False, 'sideways_use_atr': False, 'sideways_use_adx': False, 'sideways_use_spike': False, 'sideways_rsi_required': False}.
[I 2025-08-31 02:25:49,838] Trial 503 finished with values: [-1000000000.0, 1000000000.0] and parameters: {'p_sma': 55, 'p_std': 45, 'p_atr': 28, 'p_adx': 26, 'rsi_period': 66, 'ema1': 5, 'ema2': 24, 'slip_atr_k': 0.006201862522648594, 'slip_spread_k': 0.14768517188155542, 'spread_hl_frac': 0.004205918968368033, 'bb_std_mult': 1.685105639552577, 'rsi_os': 39, 'rsi_ob': 70, 'vol_spike': 0.18393737770881707, 'adx_thresh': 19.732292040005813, 'atr_min_pct': 0.007447916442863163, 'atr_max_pct': 0.11804678557206219, 'tp_mult': 1.0149518179771777, 'tsl_mult': 0.041003212067445616, 'strategy': 'mean_reversion', 'time_stop': 111, 'use_sma': True, 'use_atr': False, 'use_adx': False, 'use_ema': False, 'use_spike': True, 'rsi_required': True, 'edge_k': 0.541669445588028, 'edge_cap': 0.22999145631219087, 'bull_strategy': 'breakout', 'bull_bb_std_mult': 2.5060845647133125, 'bull_rsi_os': 51, 'bull_rsi_ob': 61, 'bull_adx_thresh': 6.088994666583172, 'bull_atr_min_pct': 0.012560399637649898, 'bull_atr_max_pct': 0.14815661080419804, 'bull_tp_mult': 2.2701052354765245, 'bull_tsl_mult': 0.270752348047119, 'bull_time_stop': 138, 'bull_use_sma': True, 'bull_use_ema': False, 'bull_use_atr': False, 'bull_use_adx': False, 'bull_use_spike': True, 'bull_rsi_required': True, 'bear_strategy': 'mean_reversion', 'bear_bb_std_mult': 1.412522170581512, 'bear_rsi_os': 17, 'bear_rsi_ob': 46, 'bear_adx_thresh': 5.051896792775295, 'bear_atr_min_pct': 0.00625147175915684, 'bear_atr_max_pct': 0.01005707903384273, 'bear_tp_mult': 2.1040250299217864, 'bear_tsl_mult': 0.784457009678622, 'bear_time_stop': 5, 'bear_use_sma': False, 'bear_use_ema': True, 'bear_use_atr': False, 'bear_use_adx': False, 'bear_use_spike': False, 'bear_rsi_required': True, 'sideways_strategy': 'mean_reversion', 'sideways_bb_std_mult': 0.715967794327705, 'sideways_rsi_os': 40, 'sideways_rsi_ob': 95, 'sideways_adx_thresh': 9.780339975501334, 'sideways_atr_min_pct': 0.02685100159750045, 'sideways_atr_max_pct': 0.049977444798496425, 'sideways_tp_mult': 1.8522015338776374, 'sideways_tsl_mult': 0.634388560782311, 'sideways_time_stop': 193, 'sideways_use_sma': True, 'sideways_use_ema': False, 'sideways_use_atr': False, 'sideways_use_adx': False, 'sideways_use_spike': False, 'sideways_rsi_required': False}.
[I 2025-08-31 02:25:50,973] Trial 500 finished with values: [-0.014239824906946752, 0.014170546142932847] and parameters: {'p_sma': 55, 'p_std': 45, 'p_atr': 28, 'p_adx': 26, 'rsi_period': 66, 'ema1': 5, 'ema2': 24, 'slip_atr_k': 0.007529343231976876, 'slip_spread_k': 0.14334859169704756, 'spread_hl_frac': 0.004806603289755571, 'bb_std_mult': 1.6869483452505991, 'rsi_os': 39, 'rsi_ob': 70, 'vol_spike': 0.18021964701186538, 'adx_thresh': 19.61940947597008, 'atr_min_pct': 0.007388745170533571, 'atr_max_pct': 0.11769180187747469, 'tp_mult': 1.0215528927016515, 'tsl_mult': 0.04067070515465097, 'strategy': 'mean_reversion', 'time_stop': 110, 'use_sma': True, 'use_atr': False, 'use_adx': False, 'use_ema': False, 'use_spike': True, 'rsi_required': True, 'edge_k': 0.5402623315805376, 'edge_cap': 0.32243001320840925, 'bull_strategy': 'breakout', 'bull_bb_std_mult': 2.491430557926886, 'bull_rsi_os': 52, 'bull_rsi_ob': 61, 'bull_adx_thresh': 6.329754566834354, 'bull_atr_min_pct': 0.0004358981818367709, 'bull_atr_max_pct': 0.14972792043173944, 'bull_tp_mult': 2.262462183333462, 'bull_tsl_mult': 0.2672910015241297, 'bull_time_stop': 139, 'bull_use_sma': True, 'bull_use_ema': False, 'bull_use_atr': False, 'bull_use_adx': True, 'bull_use_spike': True, 'bull_rsi_required': True, 'bear_strategy': 'mean_reversion', 'bear_bb_std_mult': 1.4181696260081096, 'bear_rsi_os': 17, 'bear_rsi_ob': 46, 'bear_adx_thresh': 5.142120685229726, 'bear_atr_min_pct': 0.006299474410112447, 'bear_atr_max_pct': 0.012491613398613911, 'bear_tp_mult': 2.102903785058628, 'bear_tsl_mult': 0.7591236786781064, 'bear_time_stop': 5, 'bear_use_sma': False, 'bear_use_ema': True, 'bear_use_atr': False, 'bear_use_adx': False, 'bear_use_spike': False, 'bear_rsi_required': True, 'sideways_strategy': 'mean_reversion', 'sideways_bb_std_mult': 0.701613912873846, 'sideways_rsi_os': 40, 'sideways_rsi_ob': 95, 'sideways_adx_thresh': 10.137774748404732, 'sideways_atr_min_pct': 0.02691768343327349, 'sideways_atr_max_pct': 0.04930828885928097, 'sideways_tp_mult': 1.8470720894831074, 'sideways_tsl_mult': 0.6357148357974759, 'sideways_time_stop': 191, 'sideways_use_sma': True, 'sideways_use_ema': False, 'sideways_use_atr': False, 'sideways_use_adx': False, 'sideways_use_spike': False, 'sideways_rsi_required': False}.
[I 2025-08-31 02:25:51,271] Trial 502 finished with values: [-0.014247772865763508, 0.014178442833561929] and parameters: {'p_sma': 55, 'p_std': 45, 'p_atr': 28, 'p_adx': 26, 'rsi_period': 66, 'ema1': 5, 'ema2': 24, 'slip_atr_k': 0.00839875728312596, 'slip_spread_k': 0.1446057139954616, 'spread_hl_frac': 0.004552249590034891, 'bb_std_mult': 1.7005527410976078, 'rsi_os': 38, 'rsi_ob': 70, 'vol_spike': 0.18492690423022665, 'adx_thresh': 19.52039033891591, 'atr_min_pct': 0.007639691130656467, 'atr_max_pct': 0.11835879051012486, 'tp_mult': 1.0125538755266088, 'tsl_mult': 0.038872564665070664, 'strategy': 'mean_reversion', 'time_stop': 112, 'use_sma': True, 'use_atr': False, 'use_adx': False, 'use_ema': False, 'use_spike': True, 'rsi_required': True, 'edge_k': 0.5536288182160582, 'edge_cap': 0.11105676176825907, 'bull_strategy': 'breakout', 'bull_bb_std_mult': 2.510578921582841, 'bull_rsi_os': 49, 'bull_rsi_ob': 61, 'bull_adx_thresh': 6.2544806554164145, 'bull_atr_min_pct': 3.420906395050971e-05, 'bull_atr_max_pct': 0.14992113848109628, 'bull_tp_mult': 2.25063305036262, 'bull_tsl_mult': 0.2783473051707199, 'bull_time_stop': 138, 'bull_use_sma': True, 'bull_use_ema': False, 'bull_use_atr': False, 'bull_use_adx': True, 'bull_use_spike': True, 'bull_rsi_required': True, 'bear_strategy': 'mean_reversion', 'bear_bb_std_mult': 1.4047677772337035, 'bear_rsi_os': 17, 'bear_rsi_ob': 46, 'bear_adx_thresh': 5.003625161446888, 'bear_atr_min_pct': 0.006397435796850417, 'bear_atr_max_pct': 0.013337478690977001, 'bear_tp_mult': 2.1047313225615163, 'bear_tsl_mult': 0.7533034471030475, 'bear_time_stop': 5, 'bear_use_sma': False, 'bear_use_ema': True, 'bear_use_atr': False, 'bear_use_adx': False, 'bear_use_spike': False, 'bear_rsi_required': True, 'sideways_strategy': 'mean_reversion', 'sideways_bb_std_mult': 0.7040064621625943, 'sideways_rsi_os': 40, 'sideways_rsi_ob': 95, 'sideways_adx_thresh': 9.83768768030251, 'sideways_atr_min_pct': 0.026825848594241808, 'sideways_atr_max_pct': 0.04997663940405844, 'sideways_tp_mult': 1.8544279714147796, 'sideways_tsl_mult': 0.6288964383830504, 'sideways_time_stop': 193, 'sideways_use_sma': True, 'sideways_use_ema': False, 'sideways_use_atr': False, 'sideways_use_adx': False, 'sideways_use_spike': False, 'sideways_rsi_required': False}.
[I 2025-08-31 02:25:51,438] Trial 501 finished with values: [-0.01426105122295307, 0.01419171275821785] and parameters: {'p_sma': 55, 'p_std': 45, 'p_atr': 28, 'p_adx': 26, 'rsi_period': 66, 'ema1': 5, 'ema2': 24, 'slip_atr_k': 0.008580201457961725, 'slip_spread_k': 0.14671183273550703, 'spread_hl_frac': 0.004062364563002156, 'bb_std_mult': 1.664231866529898, 'rsi_os': 39, 'rsi_ob': 70, 'vol_spike': 0.18360200982840627, 'adx_thresh': 19.648258655649112, 'atr_min_pct': 0.007528009615874549, 'atr_max_pct': 0.11842823832569165, 'tp_mult': 1.0297246779011995, 'tsl_mult': 0.024121929312647006, 'strategy': 'mean_reversion', 'time_stop': 118, 'use_sma': True, 'use_atr': False, 'use_adx': False, 'use_ema': False, 'use_spike': True, 'rsi_required': True, 'edge_k': 0.5554425551756568, 'edge_cap': 0.1164994679915294, 'bull_strategy': 'breakout', 'bull_bb_std_mult': 2.504848235850079, 'bull_rsi_os': 49, 'bull_rsi_ob': 61, 'bull_adx_thresh': 6.359068439374784, 'bull_atr_min_pct': 0.00042616011282647556, 'bull_atr_max_pct': 0.14780762795012176, 'bull_tp_mult': 2.2768601083062823, 'bull_tsl_mult': 0.25989928141651863, 'bull_time_stop': 133, 'bull_use_sma': True, 'bull_use_ema': False, 'bull_use_atr': False, 'bull_use_adx': True, 'bull_use_spike': True, 'bull_rsi_required': True, 'bear_strategy': 'mean_reversion', 'bear_bb_std_mult': 1.3903924433407093, 'bear_rsi_os': 17, 'bear_rsi_ob': 46, 'bear_adx_thresh': 5.085799645075307, 'bear_atr_min_pct': 0.006227704531732231, 'bear_atr_max_pct': 0.012783654430480428, 'bear_tp_mult': 2.0967021175942953, 'bear_tsl_mult': 0.7599264882444399, 'bear_time_stop': 6, 'bear_use_sma': False, 'bear_use_ema': True, 'bear_use_atr': False, 'bear_use_adx': False, 'bear_use_spike': False, 'bear_rsi_required': True, 'sideways_strategy': 'mean_reversion', 'sideways_bb_std_mult': 0.6950441382827315, 'sideways_rsi_os': 40, 'sideways_rsi_ob': 95, 'sideways_adx_thresh': 9.9668120961459, 'sideways_atr_min_pct': 0.026753968955534283, 'sideways_atr_max_pct': 0.04942638610532059, 'sideways_tp_mult': 1.8564415418027334, 'sideways_tsl_mult': 0.6389955771044993, 'sideways_time_stop': 191, 'sideways_use_sma': True, 'sideways_use_ema': False, 'sideways_use_atr': False, 'sideways_use_adx': False, 'sideways_use_spike': False, 'sideways_rsi_required': False}.
