[I 2025-08-31 00:35:55,096] Trial 290 finished with values: [-1000000000.0, 1000000000.0] and parameters: {'p_sma': 12, 'p_std': 50, 'p_atr': 22, 'p_adx': 8, 'rsi_period': 58, 'ema1': 6, 'ema2': 20, 'slip_atr_k': 0.020521649609979195, 'slip_spread_k': 0.3351216261746105, 'spread_hl_frac': 0.031189336445587166, 'bb_std_mult': 2.7428425762110935, 'rsi_os': 45, 'rsi_ob': 57, 'vol_spike': 0.11581609437726918, 'adx_thresh': 13.4579825727888, 'atr_min_pct': 0.008060047297345864, 'atr_max_pct': 0.11426525251196143, 'tp_mult': 1.5357104423573222, 'tsl_mult': 0.011379749178744458, 'strategy': 'breakout', 'time_stop': 81, 'use_sma': True, 'use_atr': False, 'use_adx': False, 'use_ema': True, 'use_spike': True, 'rsi_required': False, 'edge_k': 0.45280605788620154, 'edge_cap': 0.467732132423877, 'bull_strategy': 'breakout', 'bull_bb_std_mult': 0.5484903239341448, 'bull_rsi_os': 39, 'bull_rsi_ob': 86, 'bull_adx_thresh': 11.933020675258492, 'bull_atr_min_pct': 0.0014489071513741235, 'bull_atr_max_pct': 0.06594872102396196, 'bull_tp_mult': 2.4127004531588168, 'bull_tsl_mult': 0.3796844015691027, 'bull_time_stop': 154, 'bull_use_sma': False, 'bull_use_ema': False, 'bull_use_atr': True, 'bull_use_adx': True, 'bull_use_spike': False, 'bull_rsi_required': False, 'bear_strategy': 'mean_reversion', 'bear_bb_std_mult': 3.440941932069526, 'bear_rsi_os': 52, 'bear_rsi_ob': 77, 'bear_adx_thresh': 5.513217263484003, 'bear_atr_min_pct': 0.0030245591682147004, 'bear_atr_max_pct': 0.016055036603131435, 'bear_tp_mult': 1.9556036146988893, 'bear_tsl_mult': 0.7043359493931675, 'bear_time_stop': 154, 'bear_use_sma': True, 'bear_use_ema': True, 'bear_use_atr': False, 'bear_use_adx': True, 'bear_use_spike': False, 'bear_rsi_required': False, 'sideways_strategy': 'mean_reversion', 'sideways_bb_std_mult': 0.9055656760484793, 'sideways_rsi_os': 19, 'sideways_rsi_ob': 94, 'sideways_adx_thresh': 17.00835192364153, 'sideways_atr_min_pct': 0.027972640269972694, 'sideways_atr_max_pct': 0.14278518693136552, 'sideways_tp_mult': 1.7269727198290705, 'sideways_tsl_mult': 0.7939039982947226, 'sideways_time_stop': 160, 'sideways_use_sma': True, 'sideways_use_ema': False, 'sideways_use_atr': True, 'sideways_use_adx': False, 'sideways_use_spike': False, 'sideways_rsi_required': True}.
[I 2025-08-31 00:35:55,815] Trial 288 finished with values: [-1000000000.0, 1000000000.0] and parameters: {'p_sma': 37, 'p_std': 57, 'p_atr': 22, 'p_adx': 9, 'rsi_period': 58, 'ema1': 7, 'ema2': 40, 'slip_atr_k': 0.019700863708944347, 'slip_spread_k': 0.7398222263509172, 'spread_hl_frac': 0.012227869658055066, 'bb_std_mult': 2.33039918858338, 'rsi_os': 54, 'rsi_ob': 57, 'vol_spike': 0.2531137448957007, 'adx_thresh': 11.792629815196662, 'atr_min_pct': 0.005832487029428422, 'atr_max_pct': 0.072168352263731, 'tp_mult': 1.9296231653179297, 'tsl_mult': 0.11023175269191857, 'strategy': 'breakout', 'time_stop': 114, 'use_sma': True, 'use_atr': False, 'use_adx': False, 'use_ema': True, 'use_spike': True, 'rsi_required': False, 'edge_k': 0.46007587832562324, 'edge_cap': 0.8326371743606205, 'bull_strategy': 'breakout', 'bull_bb_std_mult': 2.982832308965534, 'bull_rsi_os': 41, 'bull_rsi_ob': 86, 'bull_adx_thresh': 12.390394668978413, 'bull_atr_min_pct': 0.0022373906604032582, 'bull_atr_max_pct': 0.06587799263207093, 'bull_tp_mult': 2.427072638889403, 'bull_tsl_mult': 0.41337531137691125, 'bull_time_stop': 90, 'bull_use_sma': True, 'bull_use_ema': False, 'bull_use_atr': True, 'bull_use_adx': True, 'bull_use_spike': False, 'bull_rsi_required': False, 'bear_strategy': 'mean_reversion', 'bear_bb_std_mult': 1.150369458587135, 'bear_rsi_os': 6, 'bear_rsi_ob': 77, 'bear_adx_thresh': 14.163299222118315, 'bear_atr_min_pct': 0.0031133970196272065, 'bear_atr_max_pct': 0.03014975164762796, 'bear_tp_mult': 1.962656942102997, 'bear_tsl_mult': 0.6791344080430609, 'bear_time_stop': 120, 'bear_use_sma': True, 'bear_use_ema': True, 'bear_use_atr': False, 'bear_use_adx': True, 'bear_use_spike': True, 'bear_rsi_required': False, 'sideways_strategy': 'mean_reversion', 'sideways_bb_std_mult': 1.5688120642057477, 'sideways_rsi_os': 45, 'sideways_rsi_ob': 91, 'sideways_adx_thresh': 7.710785498516392, 'sideways_atr_min_pct': 0.020400328551265376, 'sideways_atr_max_pct': 0.07198437990750603, 'sideways_tp_mult': 1.7212332868123412, 'sideways_tsl_mult': 0.6946584154724058, 'sideways_time_stop': 161, 'sideways_use_sma': True, 'sideways_use_ema': False, 'sideways_use_atr': True, 'sideways_use_adx': False, 'sideways_use_spike': True, 'sideways_rsi_required': False}.
[I 2025-08-31 00:35:55,902] Trial 289 finished with values: [-1000000000.0, 1000000000.0] and parameters: {'p_sma': 42, 'p_std': 57, 'p_atr': 22, 'p_adx': 9, 'rsi_period': 59, 'ema1': 6, 'ema2': 17, 'slip_atr_k': 0.24543979938452903, 'slip_spread_k': 0.26665799829428727, 'spread_hl_frac': 0.027231946834607314, 'bb_std_mult': 2.361696084712771, 'rsi_os': 24, 'rsi_ob': 49, 'vol_spike': 0.12432746228941272, 'adx_thresh': 11.858123029511907, 'atr_min_pct': 0.006316616318714729, 'atr_max_pct': 0.09260843565889464, 'tp_mult': 2.64326958722991, 'tsl_mult': 0.21381179478267692, 'strategy': 'breakout', 'time_stop': 95, 'use_sma': True, 'use_atr': False, 'use_adx': False, 'use_ema': True, 'use_spike': True, 'rsi_required': False, 'edge_k': 0.6556553157973009, 'edge_cap': 0.7418829481113359, 'bull_strategy': 'breakout', 'bull_bb_std_mult': 0.5811113021846459, 'bull_rsi_os': 39, 'bull_rsi_ob': 85, 'bull_adx_thresh': 23.6593976170075, 'bull_atr_min_pct': 0.014707786418841066, 'bull_atr_max_pct': 0.06541167931020268, 'bull_tp_mult': 2.42088093512483, 'bull_tsl_mult': 0.7752560722390613, 'bull_time_stop': 224, 'bull_use_sma': False, 'bull_use_ema': False, 'bull_use_atr': True, 'bull_use_adx': True, 'bull_use_spike': False, 'bull_rsi_required': False, 'bear_strategy': 'mean_reversion', 'bear_bb_std_mult': 1.3539050035547442, 'bear_rsi_os': 21, 'bear_rsi_ob': 70, 'bear_adx_thresh': 5.666009584158853, 'bear_atr_min_pct': 0.01462863555059974, 'bear_atr_max_pct': 0.030458423379593057, 'bear_tp_mult': 1.9537403726069589, 'bear_tsl_mult': 0.7134001715920527, 'bear_time_stop': 99, 'bear_use_sma': True, 'bear_use_ema': True, 'bear_use_atr': False, 'bear_use_adx': True, 'bear_use_spike': False, 'bear_rsi_required': False, 'sideways_strategy': 'mean_reversion', 'sideways_bb_std_mult': 2.8423395504228326, 'sideways_rsi_os': 19, 'sideways_rsi_ob': 90, 'sideways_adx_thresh': 9.988031453828546, 'sideways_atr_min_pct': 0.02402774368339236, 'sideways_atr_max_pct': 0.13638819360644472, 'sideways_tp_mult': 2.3413705812039005, 'sideways_tsl_mult': 0.6403860647287036, 'sideways_time_stop': 162, 'sideways_use_sma': True, 'sideways_use_ema': False, 'sideways_use_atr': True, 'sideways_use_adx': False, 'sideways_use_spike': True, 'sideways_rsi_required': True}.
[I 2025-08-31 00:35:56,430] Trial 292 finished with values: [-1000000000.0, 1000000000.0] and parameters: {'p_sma': 27, 'p_std': 38, 'p_atr': 26, 'p_adx': 8, 'rsi_period': 58, 'ema1': 8, 'ema2': 17, 'slip_atr_k': 0.17183522679842284, 'slip_spread_k': 0.20965015174973606, 'spread_hl_frac': 0.021909556280437573, 'bb_std_mult': 1.2370345583651483, 'rsi_os': 52, 'rsi_ob': 72, 'vol_spike': 0.2511535897643219, 'adx_thresh': 12.794183592548299, 'atr_min_pct': 0.01726489112047837, 'atr_max_pct': 0.07276577897009398, 'tp_mult': 2.628574268311845, 'tsl_mult': 0.22136426002551635, 'strategy': 'mean_reversion', 'time_stop': 84, 'use_sma': True, 'use_atr': False, 'use_adx': True, 'use_ema': True, 'use_spike': False, 'rsi_required': False, 'edge_k': 1.2716105295844968, 'edge_cap': 0.8046108771829883, 'bull_strategy': 'breakout', 'bull_bb_std_mult': 2.590486152401387, 'bull_rsi_os': 30, 'bull_rsi_ob': 58, 'bull_adx_thresh': 12.577744024689782, 'bull_atr_min_pct': 0.015855608004817195, 'bull_atr_max_pct': 0.0770023463480282, 'bull_tp_mult': 2.3955753168286424, 'bull_tsl_mult': 0.4158857966439833, 'bull_time_stop': 69, 'bull_use_sma': False, 'bull_use_ema': False, 'bull_use_atr': True, 'bull_use_adx': True, 'bull_use_spike': False, 'bull_rsi_required': True, 'bear_strategy': 'mean_reversion', 'bear_bb_std_mult': 1.0780692287379492, 'bear_rsi_os': 5, 'bear_rsi_ob': 62, 'bear_adx_thresh': 8.363081981562651, 'bear_atr_min_pct': 0.017807411831639784, 'bear_atr_max_pct': 0.025630097807958416, 'bear_tp_mult': 1.3941479488885289, 'bear_tsl_mult': 0.71898928550074, 'bear_time_stop': 123, 'bear_use_sma': True, 'bear_use_ema': False, 'bear_use_atr': False, 'bear_use_adx': True, 'bear_use_spike': False, 'bear_rsi_required': False, 'sideways_strategy': 'breakout', 'sideways_bb_std_mult': 3.3613683039858397, 'sideways_rsi_os': 45, 'sideways_rsi_ob': 91, 'sideways_adx_thresh': 8.367670006587353, 'sideways_atr_min_pct': 0.022232682309017128, 'sideways_atr_max_pct': 0.14673703044216838, 'sideways_tp_mult': 1.1404993014953244, 'sideways_tsl_mult': 0.6951326715874623, 'sideways_time_stop': 155, 'sideways_use_sma': True, 'sideways_use_ema': True, 'sideways_use_atr': False, 'sideways_use_adx': False, 'sideways_use_spike': True, 'sideways_rsi_required': False}.
[I 2025-08-31 00:35:56,464] Trial 294 finished with values: [-1000000000.0, 1000000000.0] and parameters: {'p_sma': 16, 'p_std': 38, 'p_atr': 26, 'p_adx': 8, 'rsi_period': 57, 'ema1': 8, 'ema2': 18, 'slip_atr_k': 0.17742265846578859, 'slip_spread_k': 0.46859695566922926, 'spread_hl_frac': 0.049947689724977304, 'bb_std_mult': 1.0721148001880336, 'rsi_os': 52, 'rsi_ob': 80, 'vol_spike': 0.14485286838744582, 'adx_thresh': 10.279368340553328, 'atr_min_pct': 0.019835661571789755, 'atr_max_pct': 0.06840196437647662, 'tp_mult': 2.1617931610557735, 'tsl_mult': 0.1363950240597706, 'strategy': 'mean_reversion', 'time_stop': 172, 'use_sma': True, 'use_atr': False, 'use_adx': True, 'use_ema': True, 'use_spike': False, 'rsi_required': False, 'edge_k': 0.7375162811097281, 'edge_cap': 0.8185751405473841, 'bull_strategy': 'mean_reversion', 'bull_bb_std_mult': 1.245368776737726, 'bull_rsi_os': 38, 'bull_rsi_ob': 78, 'bull_adx_thresh': 13.129987743710808, 'bull_atr_min_pct': 0.0005424125148054262, 'bull_atr_max_pct': 0.11813115729105905, 'bull_tp_mult': 2.564365333507569, 'bull_tsl_mult': 0.5449724526440031, 'bull_time_stop': 166, 'bull_use_sma': False, 'bull_use_ema': False, 'bull_use_atr': True, 'bull_use_adx': False, 'bull_use_spike': False, 'bull_rsi_required': True, 'bear_strategy': 'mean_reversion', 'bear_bb_std_mult': 1.1028530360559556, 'bear_rsi_os': 24, 'bear_rsi_ob': 55, 'bear_adx_thresh': 8.448108480536188, 'bear_atr_min_pct': 0.009001109597426763, 'bear_atr_max_pct': 0.025789724480415378, 'bear_tp_mult': 1.3771347876602262, 'bear_tsl_mult': 0.7219285965150262, 'bear_time_stop': 5, 'bear_use_sma': True, 'bear_use_ema': False, 'bear_use_atr': False, 'bear_use_adx': False, 'bear_use_spike': False, 'bear_rsi_required': False, 'sideways_strategy': 'breakout', 'sideways_bb_std_mult': 3.3904209399710292, 'sideways_rsi_os': 36, 'sideways_rsi_ob': 87, 'sideways_adx_thresh': 14.292850285656153, 'sideways_atr_min_pct': 0.02133307125969585, 'sideways_atr_max_pct': 0.04464028586187448, 'sideways_tp_mult': 1.1510136104598148, 'sideways_tsl_mult': 0.5848063382847968, 'sideways_time_stop': 177, 'sideways_use_sma': True, 'sideways_use_ema': True, 'sideways_use_atr': False, 'sideways_use_adx': False, 'sideways_use_spike': True, 'sideways_rsi_required': False}.
[I 2025-08-31 00:35:56,483] Trial 293 finished with values: [-1000000000.0, 1000000000.0] and parameters: {'p_sma': 46, 'p_std': 15, 'p_atr': 16, 'p_adx': 8, 'rsi_period': 57, 'ema1': 8, 'ema2': 60, 'slip_atr_k': 0.03818941518593301, 'slip_spread_k': 0.12157131590931344, 'spread_hl_frac': 0.009812689796050602, 'bb_std_mult': 2.122515162271534, 'rsi_os': 52, 'rsi_ob': 72, 'vol_spike': 0.260469180457699, 'adx_thresh': 31.773162224021497, 'atr_min_pct': 0.008974926322760252, 'atr_max_pct': 0.06790634866378384, 'tp_mult': 2.6436769949757624, 'tsl_mult': 0.21861042374247497, 'strategy': 'mean_reversion', 'time_stop': 141, 'use_sma': True, 'use_atr': False, 'use_adx': True, 'use_ema': True, 'use_spike': False, 'rsi_required': False, 'edge_k': 0.7420255253690531, 'edge_cap': 0.7476335728867345, 'bull_strategy': 'mean_reversion', 'bull_bb_std_mult': 1.2192848917527028, 'bull_rsi_os': 39, 'bull_rsi_ob': 82, 'bull_adx_thresh': 12.95905194011051, 'bull_atr_min_pct': 0.0008486139048954817, 'bull_atr_max_pct': 0.0755236779332556, 'bull_tp_mult': 2.5726587863324024, 'bull_tsl_mult': 0.705273270341831, 'bull_time_stop': 167, 'bull_use_sma': False, 'bull_use_ema': False, 'bull_use_atr': True, 'bull_use_adx': False, 'bull_use_spike': False, 'bull_rsi_required': True, 'bear_strategy': 'mean_reversion', 'bear_bb_std_mult': 1.0889988452098882, 'bear_rsi_os': 24, 'bear_rsi_ob': 78, 'bear_adx_thresh': 6.158425103458122, 'bear_atr_min_pct': 0.00758881030781746, 'bear_atr_max_pct': 0.025202086049956357, 'bear_tp_mult': 1.884713084363228, 'bear_tsl_mult': 0.7310924312455364, 'bear_time_stop': 28, 'bear_use_sma': True, 'bear_use_ema': False, 'bear_use_atr': False, 'bear_use_adx': True, 'bear_use_spike': False, 'bear_rsi_required': False, 'sideways_strategy': 'breakout', 'sideways_bb_std_mult': 1.7156513017596369, 'sideways_rsi_os': 35, 'sideways_rsi_ob': 89, 'sideways_adx_thresh': 8.231715588612362, 'sideways_atr_min_pct': 0.022446712056558474, 'sideways_atr_max_pct': 0.06419905263108133, 'sideways_tp_mult': 1.523523858146091, 'sideways_tsl_mult': 0.6421695613772511, 'sideways_time_stop': 170, 'sideways_use_sma': True, 'sideways_use_ema': True, 'sideways_use_atr': False, 'sideways_use_adx': False, 'sideways_use_spike': True, 'sideways_rsi_required': True}.
[I 2025-08-31 00:36:22,407] Trial 291 finished with values: [-1000000000.0, 1000000000.0] and parameters: {'p_sma': 49, 'p_std': 15, 'p_atr': 22, 'p_adx': 8, 'rsi_period': 58, 'ema1': 6, 'ema2': 17, 'slip_atr_k': 0.1490401956362237, 'slip_spread_k': 0.26847226743375274, 'spread_hl_frac': 0.021593030857265515, 'bb_std_mult': 2.7292629402458597, 'rsi_os': 52, 'rsi_ob': 80, 'vol_spike': 0.11816703260517679, 'adx_thresh': 13.053541392284165, 'atr_min_pct': 0.007094670156872499, 'atr_max_pct': 0.09293921502749256, 'tp_mult': 1.9320497324148624, 'tsl_mult': 0.018309130251545014, 'strategy': 'breakout', 'time_stop': 115, 'use_sma': True, 'use_atr': False, 'use_adx': True, 'use_ema': True, 'use_spike': True, 'rsi_required': False, 'edge_k': 0.7322195086928074, 'edge_cap': 0.8042539053215929, 'bull_strategy': 'breakout', 'bull_bb_std_mult': 1.244147672724729, 'bull_rsi_os': 39, 'bull_rsi_ob': 58, 'bull_adx_thresh': 12.184109027592633, 'bull_atr_min_pct': 0.014881407352191067, 'bull_atr_max_pct': 0.12089009140176821, 'bull_tp_mult': 2.422655766149925, 'bull_tsl_mult': 0.6585944005139582, 'bull_time_stop': 166, 'bull_use_sma': False, 'bull_use_ema': False, 'bull_use_atr': True, 'bull_use_adx': True, 'bull_use_spike': False, 'bull_rsi_required': True, 'bear_strategy': 'mean_reversion', 'bear_bb_std_mult': 1.136074804602134, 'bear_rsi_os': 6, 'bear_rsi_ob': 77, 'bear_adx_thresh': 5.802752384502959, 'bear_atr_min_pct': 0.007627251460328929, 'bear_atr_max_pct': 0.02601998638342898, 'bear_tp_mult': 1.944047506603338, 'bear_tsl_mult': 0.7224422414052344, 'bear_time_stop': 239, 'bear_use_sma': True, 'bear_use_ema': True, 'bear_use_atr': False, 'bear_use_adx': True, 'bear_use_spike': False, 'bear_rsi_required': False, 'sideways_strategy': 'mean_reversion', 'sideways_bb_std_mult': 3.303293710784822, 'sideways_rsi_os': 35, 'sideways_rsi_ob': 91, 'sideways_adx_thresh': 9.90586839027047, 'sideways_atr_min_pct': 0.022416700991156384, 'sideways_atr_max_pct': 0.06503264425540878, 'sideways_tp_mult': 1.1445322393437207, 'sideways_tsl_mult': 0.8104663027537067, 'sideways_time_stop': 161, 'sideways_use_sma': True, 'sideways_use_ema': True, 'sideways_use_atr': True, 'sideways_use_adx': False, 'sideways_use_spike': True, 'sideways_rsi_required': True}.
[I 2025-08-31 00:36:27,200] Trial 297 finished with values: [-1000000000.0, 1000000000.0] and parameters: {'p_sma': 48, 'p_std': 41, 'p_atr': 21, 'p_adx': 30, 'rsi_period': 55, 'ema1': 7, 'ema2': 36, 'slip_atr_k': 0.14794756535611647, 'slip_spread_k': 0.018869166406571408, 'spread_hl_frac': 0.03584207790453533, 'bb_std_mult': 1.5900285695030674, 'rsi_os': 55, 'rsi_ob': 55, 'vol_spike': 0.19970622988668235, 'adx_thresh': 20.633129153236663, 'atr_min_pct': 0.01827264664189327, 'atr_max_pct': 0.10021173749490792, 'tp_mult': 2.7063975365573016, 'tsl_mult': 0.30708195773819197, 'strategy': 'breakout', 'time_stop': 110, 'use_sma': True, 'use_atr': False, 'use_adx': False, 'use_ema': True, 'use_spike': False, 'rsi_required': False, 'edge_k': 0.7179713917772392, 'edge_cap': 0.8405421581268269, 'bull_strategy': 'breakout', 'bull_bb_std_mult': 1.6930820187268207, 'bull_rsi_os': 23, 'bull_rsi_ob': 54, 'bull_adx_thresh': 18.655562553227597, 'bull_atr_min_pct': 0.01351578361266645, 'bull_atr_max_pct': 0.07005745154262485, 'bull_tp_mult': 2.514979165781263, 'bull_tsl_mult': 0.33668483843787195, 'bull_time_stop': 165, 'bull_use_sma': False, 'bull_use_ema': False, 'bull_use_atr': True, 'bull_use_adx': True, 'bull_use_spike': False, 'bull_rsi_required': False, 'bear_strategy': 'mean_reversion', 'bear_bb_std_mult': 3.309505136833981, 'bear_rsi_os': 22, 'bear_rsi_ob': 83, 'bear_adx_thresh': 7.048373669654465, 'bear_atr_min_pct': 0.009673578849017667, 'bear_atr_max_pct': 0.019598243682914802, 'bear_tp_mult': 1.5026734828966166, 'bear_tsl_mult': 0.6502287566361319, 'bear_time_stop': 191, 'bear_use_sma': True, 'bear_use_ema': False, 'bear_use_atr': False, 'bear_use_adx': False, 'bear_use_spike': False, 'bear_rsi_required': False, 'sideways_strategy': 'mean_reversion', 'sideways_bb_std_mult': 0.7929803295250182, 'sideways_rsi_os': 46, 'sideways_rsi_ob': 93, 'sideways_adx_thresh': 18.362063411665527, 'sideways_atr_min_pct': 0.010498736222897629, 'sideways_atr_max_pct': 0.03840738182664179, 'sideways_tp_mult': 1.053676937134595, 'sideways_tsl_mult': 0.8096734851227068, 'sideways_time_stop': 183, 'sideways_use_sma': True, 'sideways_use_ema': False, 'sideways_use_atr': False, 'sideways_use_adx': False, 'sideways_use_spike': True, 'sideways_rsi_required': False}.
[I 2025-08-31 00:36:27,586] Trial 296 finished with values: [-1000000000.0, 1000000000.0] and parameters: {'p_sma': 49, 'p_std': 45, 'p_atr': 29, 'p_adx': 8, 'rsi_period': 62, 'ema1': 7, 'ema2': 60, 'slip_atr_k': 0.03757146029160085, 'slip_spread_k': 0.12115025663950801, 'spread_hl_frac': 0.0097473396375115, 'bb_std_mult': 0.929703618729967, 'rsi_os': 53, 'rsi_ob': 60, 'vol_spike': 0.19821169825922647, 'adx_thresh': 6.804060520946791, 'atr_min_pct': 0.007256386388556187, 'atr_max_pct': 0.1420288776215233, 'tp_mult': 1.122169032900307, 'tsl_mult': 0.35158400722950844, 'strategy': 'breakout', 'time_stop': 78, 'use_sma': True, 'use_atr': False, 'use_adx': False, 'use_ema': True, 'use_spike': False, 'rsi_required': False, 'edge_k': 1.6144528219420877, 'edge_cap': 0.8035036565740893, 'bull_strategy': 'breakout', 'bull_bb_std_mult': 3.069795866242706, 'bull_rsi_os': 21, 'bull_rsi_ob': 76, 'bull_adx_thresh': 18.91122401397885, 'bull_atr_min_pct': 0.016523886093293336, 'bull_atr_max_pct': 0.14511469295728288, 'bull_tp_mult': 2.5081499780319807, 'bull_tsl_mult': 0.33568222770555156, 'bull_time_stop': 97, 'bull_use_sma': False, 'bull_use_ema': False, 'bull_use_atr': True, 'bull_use_adx': True, 'bull_use_spike': False, 'bull_rsi_required': False, 'bear_strategy': 'mean_reversion', 'bear_bb_std_mult': 1.6812503070252478, 'bear_rsi_os': 22, 'bear_rsi_ob': 78, 'bear_adx_thresh': 15.334336597112124, 'bear_atr_min_pct': 0.007507675149181603, 'bear_atr_max_pct': 0.019568198809589932, 'bear_tp_mult': 1.8946335172408122, 'bear_tsl_mult': 0.6493896564218953, 'bear_time_stop': 28, 'bear_use_sma': True, 'bear_use_ema': False, 'bear_use_atr': False, 'bear_use_adx': True, 'bear_use_spike': False, 'bear_rsi_required': False, 'sideways_strategy': 'mean_reversion', 'sideways_bb_std_mult': 2.938745245421509, 'sideways_rsi_os': 25, 'sideways_rsi_ob': 93, 'sideways_adx_thresh': 7.1569491427419045, 'sideways_atr_min_pct': 0.02672561530911057, 'sideways_atr_max_pct': 0.03858676949675319, 'sideways_tp_mult': 1.055772005596459, 'sideways_tsl_mult': 0.668826172652172, 'sideways_time_stop': 168, 'sideways_use_sma': True, 'sideways_use_ema': False, 'sideways_use_atr': False, 'sideways_use_adx': False, 'sideways_use_spike': True, 'sideways_rsi_required': False}.
