[I 2025-08-31 00:04:58,907] Trial 27 finished with values: [-1000000000.0, 1000000000.0] and parameters: {'p_sma': 60, 'p_std': 33, 'p_atr': 10, 'p_adx': 26, 'rsi_period': 17, 'ema1': 20, 'ema2': 21, 'slip_atr_k': 0.09921524266711318, 'slip_spread_k': 0.5491557136428771, 'spread_hl_frac': 0.021922470196090737, 'bb_std_mult': 3.5647818060580794, 'rsi_os': 20, 'rsi_ob': 74, 'vol_spike': 0.17890631231843232, 'adx_thresh': 25.42792931188199, 'atr_min_pct': 0.01847034763825699, 'atr_max_pct': 0.042418528624645055, 'tp_mult': 1.3614748214573384, 'tsl_mult': 0.7128910070461606, 'strategy': 'breakout', 'time_stop': 189, 'use_sma': True, 'use_atr': True, 'use_adx': False, 'use_ema': False, 'use_spike': False, 'rsi_required': True, 'edge_k': 0.2893846233203819, 'edge_cap': 0.9913831236772367, 'bull_strategy': 'breakout', 'bull_bb_std_mult': 0.9239658144767047, 'bull_rsi_os': 33, 'bull_rsi_ob': 84, 'bull_adx_thresh': 17.495065011495964, 'bull_atr_min_pct': 0.011576950043307572, 'bull_atr_max_pct': 0.06343626543459294, 'bull_tp_mult': 1.9869813315976164, 'bull_tsl_mult': 0.8721214989206024, 'bull_time_stop': 120, 'bull_use_sma': False, 'bull_use_ema': False, 'bull_use_atr': True, 'bull_use_adx': True, 'bull_use_spike': False, 'bull_rsi_required': True, 'bear_strategy': 'mean_reversion', 'bear_bb_std_mult': 3.4133446836795587, 'bear_rsi_os': 34, 'bear_rsi_ob': 63, 'bear_adx_thresh': 31.627146497937826, 'bear_atr_min_pct': 0.005199186826530454, 'bear_atr_max_pct': 0.048401449932852975, 'bear_tp_mult': 2.9749056401227696, 'bear_tsl_mult': 0.5152271218383812, 'bear_time_stop': 268, 'bear_use_sma': True, 'bear_use_ema': False, 'bear_use_atr': False, 'bear_use_adx': False, 'bear_use_spike': False, 'bear_rsi_required': True, 'sideways_strategy': 'breakout', 'sideways_bb_std_mult': 2.346221836020356, 'sideways_rsi_os': 23, 'sideways_rsi_ob': 83, 'sideways_adx_thresh': 31.062681755349594, 'sideways_atr_min_pct': 0.02013572360090011, 'sideways_atr_max_pct': 0.10008061423767466, 'sideways_tp_mult': 1.477741246376652, 'sideways_tsl_mult': 0.5359383269308868, 'sideways_time_stop': 205, 'sideways_use_sma': False, 'sideways_use_ema': True, 'sideways_use_atr': True, 'sideways_use_adx': True, 'sideways_use_spike': True, 'sideways_rsi_required': False}.
[I 2025-08-31 00:05:27,847] Trial 28 finished with values: [-1000000000.0, 1000000000.0] and parameters: {'p_sma': 59, 'p_std': 33, 'p_atr': 10, 'p_adx': 26, 'rsi_period': 16, 'ema1': 27, 'ema2': 22, 'slip_atr_k': 0.08728465764067168, 'slip_spread_k': 0.9441986234471966, 'spread_hl_frac': 0.012844376811634018, 'bb_std_mult': 1.8470902925013772, 'rsi_os': 22, 'rsi_ob': 74, 'vol_spike': 0.1797294454805139, 'adx_thresh': 31.234194253666292, 'atr_min_pct': 0.018432559273773526, 'atr_max_pct': 0.10537367915831089, 'tp_mult': 1.3922700732986506, 'tsl_mult': 0.6998835420032645, 'strategy': 'mean_reversion', 'time_stop': 184, 'use_sma': True, 'use_atr': True, 'use_adx': False, 'use_ema': False, 'use_spike': False, 'rsi_required': False, 'edge_k': 0.27955300816635925, 'edge_cap': 0.7693597117639629, 'bull_strategy': 'breakout', 'bull_bb_std_mult': 0.9311839332970203, 'bull_rsi_os': 6, 'bull_rsi_ob': 81, 'bull_adx_thresh': 16.562417150646837, 'bull_atr_min_pct': 0.020941030876794754, 'bull_atr_max_pct': 0.06261034714196426, 'bull_tp_mult': 1.92193837461782, 'bull_tsl_mult': 0.857069482241127, 'bull_time_stop': 168, 'bull_use_sma': True, 'bull_use_ema': False, 'bull_use_atr': True, 'bull_use_adx': False, 'bull_use_spike': False, 'bull_rsi_required': True, 'bear_strategy': 'mean_reversion', 'bear_bb_std_mult': 3.5915911469458726, 'bear_rsi_os': 34, 'bear_rsi_ob': 62, 'bear_adx_thresh': 31.613535940327473, 'bear_atr_min_pct': 0.004864460459671562, 'bear_atr_max_pct': 0.04699725622030805, 'bear_tp_mult': 2.3167770032271866, 'bear_tsl_mult': 0.5021488643002057, 'bear_time_stop': 267, 'bear_use_sma': False, 'bear_use_ema': False, 'bear_use_atr': False, 'bear_use_adx': False, 'bear_use_spike': False, 'bear_rsi_required': True, 'sideways_strategy': 'breakout', 'sideways_bb_std_mult': 1.8908140330507386, 'sideways_rsi_os': 23, 'sideways_rsi_ob': 67, 'sideways_adx_thresh': 31.017177858718128, 'sideways_atr_min_pct': 0.003583714321708383, 'sideways_atr_max_pct': 0.10117238449760163, 'sideways_tp_mult': 1.3665665381926457, 'sideways_tsl_mult': 0.5270414265817758, 'sideways_time_stop': 200, 'sideways_use_sma': False, 'sideways_use_ema': True, 'sideways_use_atr': True, 'sideways_use_adx': True, 'sideways_use_spike': True, 'sideways_rsi_required': False}.
[I 2025-08-31 00:05:30,918] Trial 29 finished with values: [-1000000000.0, 1000000000.0] and parameters: {'p_sma': 59, 'p_std': 33, 'p_atr': 9, 'p_adx': 25, 'rsi_period': 14, 'ema1': 26, 'ema2': 23, 'slip_atr_k': 0.13506144420817248, 'slip_spread_k': 0.9253535980832114, 'spread_hl_frac': 0.0133676496704092, 'bb_std_mult': 3.5743122574979935, 'rsi_os': 20, 'rsi_ob': 75, 'vol_spike': 0.17094331926802736, 'adx_thresh': 24.735425305489226, 'atr_min_pct': 0.012025251205700265, 'atr_max_pct': 0.10891668632290644, 'tp_mult': 1.3076775160738077, 'tsl_mult': 0.701867915815607, 'strategy': 'breakout', 'time_stop': 264, 'use_sma': True, 'use_atr': True, 'use_adx': False, 'use_ema': False, 'use_spike': False, 'rsi_required': True, 'edge_k': 0.2717641255294766, 'edge_cap': 0.7595304470415993, 'bull_strategy': 'breakout', 'bull_bb_std_mult': 0.920634363575172, 'bull_rsi_os': 6, 'bull_rsi_ob': 79, 'bull_adx_thresh': 7.610338586657803, 'bull_atr_min_pct': 0.010906406509079071, 'bull_atr_max_pct': 0.011545071259171827, 'bull_tp_mult': 2.0014551755984287, 'bull_tsl_mult': 0.8762757526864221, 'bull_time_stop': 117, 'bull_use_sma': False, 'bull_use_ema': False, 'bull_use_atr': False, 'bull_use_adx': True, 'bull_use_spike': False, 'bull_rsi_required': False, 'bear_strategy': 'mean_reversion', 'bear_bb_std_mult': 3.4519789071297957, 'bear_rsi_os': 47, 'bear_rsi_ob': 64, 'bear_adx_thresh': 12.934901575261232, 'bear_atr_min_pct': 0.00418094442692445, 'bear_atr_max_pct': 0.14728098033946227, 'bear_tp_mult': 1.4653326949884313, 'bear_tsl_mult': 0.4644917519945101, 'bear_time_stop': 269, 'bear_use_sma': True, 'bear_use_ema': False, 'bear_use_atr': False, 'bear_use_adx': False, 'bear_use_spike': False, 'bear_rsi_required': True, 'sideways_strategy': 'breakout', 'sideways_bb_std_mult': 2.274137619631187, 'sideways_rsi_os': 23, 'sideways_rsi_ob': 51, 'sideways_adx_thresh': 26.10216875592015, 'sideways_atr_min_pct': 0.010595319725631314, 'sideways_atr_max_pct': 0.042787217867097015, 'sideways_tp_mult': 1.5097602631071574, 'sideways_tsl_mult': 0.4940249563070096, 'sideways_time_stop': 155, 'sideways_use_sma': False, 'sideways_use_ema': True, 'sideways_use_atr': True, 'sideways_use_adx': True, 'sideways_use_spike': True, 'sideways_rsi_required': False}.
[I 2025-08-31 00:05:31,275] Trial 31 finished with values: [-1000000000.0, 1000000000.0] and parameters: {'p_sma': 26, 'p_std': 39, 'p_atr': 17, 'p_adx': 15, 'rsi_period': 28, 'ema1': 27, 'ema2': 15, 'slip_atr_k': 0.12999141060622876, 'slip_spread_k': 0.9033501082467228, 'spread_hl_frac': 0.014691656172074031, 'bb_std_mult': 1.9051485129072758, 'rsi_os': 43, 'rsi_ob': 87, 'vol_spike': 0.020149188347694177, 'adx_thresh': 32.25486401504005, 'atr_min_pct': 0.012330571227287843, 'atr_max_pct': 0.13372725415093348, 'tp_mult': 2.8727821675282352, 'tsl_mult': 0.995504770391211, 'strategy': 'mean_reversion', 'time_stop': 269, 'use_sma': True, 'use_atr': True, 'use_adx': False, 'use_ema': False, 'use_spike': False, 'rsi_required': False, 'edge_k': 0.7574202930068796, 'edge_cap': 0.5687652222950127, 'bull_strategy': 'mean_reversion', 'bull_bb_std_mult': 0.8815926882610635, 'bull_rsi_os': 50, 'bull_rsi_ob': 79, 'bull_adx_thresh': 7.000699870179275, 'bull_atr_min_pct': 0.021562959900228662, 'bull_atr_max_pct': 0.11874465995896075, 'bull_tp_mult': 2.3279219352744147, 'bull_tsl_mult': 0.9106257038782689, 'bull_time_stop': 176, 'bull_use_sma': True, 'bull_use_ema': False, 'bull_use_atr': False, 'bull_use_adx': False, 'bull_use_spike': False, 'bull_rsi_required': False, 'bear_strategy': 'mean_reversion', 'bear_bb_std_mult': 3.255975840448113, 'bear_rsi_os': 45, 'bear_rsi_ob': 51, 'bear_adx_thresh': 12.336181387632452, 'bear_atr_min_pct': 0.0045440350491057525, 'bear_atr_max_pct': 0.14403338891998535, 'bear_tp_mult': 1.3447709992964012, 'bear_tsl_mult': 0.18794490506871986, 'bear_time_stop': 231, 'bear_use_sma': False, 'bear_use_ema': False, 'bear_use_atr': False, 'bear_use_adx': False, 'bear_use_spike': False, 'bear_rsi_required': True, 'sideways_strategy': 'breakout', 'sideways_bb_std_mult': 1.901044701921851, 'sideways_rsi_os': 46, 'sideways_rsi_ob': 67, 'sideways_adx_thresh': 26.44391030463831, 'sideways_atr_min_pct': 0.007378855480531982, 'sideways_atr_max_pct': 0.03386203506482102, 'sideways_tp_mult': 1.054294423499904, 'sideways_tsl_mult': 0.21152176456158045, 'sideways_time_stop': 160, 'sideways_use_sma': False, 'sideways_use_ema': True, 'sideways_use_atr': True, 'sideways_use_adx': True, 'sideways_use_spike': True, 'sideways_rsi_required': True}.
[I 2025-08-31 00:05:31,529] Trial 30 finished with values: [-1000000000.0, 1000000000.0] and parameters: {'p_sma': 60, 'p_std': 33, 'p_atr': 17, 'p_adx': 16, 'rsi_period': 17, 'ema1': 27, 'ema2': 23, 'slip_atr_k': 0.13507717491367682, 'slip_spread_k': 0.5509440759193167, 'spread_hl_frac': 0.015529932327288273, 'bb_std_mult': 1.9374717710354914, 'rsi_os': 19, 'rsi_ob': 85, 'vol_spike': 0.16743430057171124, 'adx_thresh': 24.29548200421503, 'atr_min_pct': 0.012186441080555941, 'atr_max_pct': 0.10094290729452585, 'tp_mult': 1.360989039938851, 'tsl_mult': 0.6870941084977319, 'strategy': 'mean_reversion', 'time_stop': 262, 'use_sma': True, 'use_atr': True, 'use_adx': False, 'use_ema': False, 'use_spike': False, 'rsi_required': False, 'edge_k': 0.2682114116592903, 'edge_cap': 0.9918154396232244, 'bull_strategy': 'breakout', 'bull_bb_std_mult': 0.9084140015780314, 'bull_rsi_os': 33, 'bull_rsi_ob': 59, 'bull_adx_thresh': 7.123300697197111, 'bull_atr_min_pct': 0.012278134658545103, 'bull_atr_max_pct': 0.06243242801489943, 'bull_tp_mult': 1.9667425635387317, 'bull_tsl_mult': 0.891657465718575, 'bull_time_stop': 121, 'bull_use_sma': True, 'bull_use_ema': False, 'bull_use_atr': False, 'bull_use_adx': False, 'bull_use_spike': False, 'bull_rsi_required': False, 'bear_strategy': 'mean_reversion', 'bear_bb_std_mult': 3.594947553581159, 'bear_rsi_os': 46, 'bear_rsi_ob': 51, 'bear_adx_thresh': 31.877601667838075, 'bear_atr_min_pct': 0.004857021019786429, 'bear_atr_max_pct': 0.1447669010619096, 'bear_tp_mult': 1.4377617075508473, 'bear_tsl_mult': 0.48720125713795165, 'bear_time_stop': 227, 'bear_use_sma': False, 'bear_use_ema': False, 'bear_use_atr': False, 'bear_use_adx': False, 'bear_use_spike': False, 'bear_rsi_required': True, 'sideways_strategy': 'breakout', 'sideways_bb_std_mult': 2.297204871776812, 'sideways_rsi_os': 23, 'sideways_rsi_ob': 65, 'sideways_adx_thresh': 31.764701024341147, 'sideways_atr_min_pct': 0.019375084781695445, 'sideways_atr_max_pct': 0.04159887164354487, 'sideways_tp_mult': 1.8730670133138398, 'sideways_tsl_mult': 0.18893971797120024, 'sideways_time_stop': 154, 'sideways_use_sma': False, 'sideways_use_ema': True, 'sideways_use_atr': True, 'sideways_use_adx': True, 'sideways_use_spike': True, 'sideways_rsi_required': False}.
[I 2025-08-31 00:06:01,769] Trial 32 finished with values: [-1000000000.0, 1000000000.0] and parameters: {'p_sma': 27, 'p_std': 40, 'p_atr': 12, 'p_adx': 16, 'rsi_period': 65, 'ema1': 27, 'ema2': 16, 'slip_atr_k': 0.13725137891399256, 'slip_spread_k': 0.868311441612205, 'spread_hl_frac': 0.004411920895489094, 'bb_std_mult': 2.447670794134786, 'rsi_os': 43, 'rsi_ob': 85, 'vol_spike': 0.02065957264398286, 'adx_thresh': 31.92620055843925, 'atr_min_pct': 0.01174257709720863, 'atr_max_pct': 0.13354212025933654, 'tp_mult': 2.8618560599028298, 'tsl_mult': 0.9910823570901135, 'strategy': 'mean_reversion', 'time_stop': 268, 'use_sma': True, 'use_atr': True, 'use_adx': False, 'use_ema': False, 'use_spike': True, 'rsi_required': False, 'edge_k': 1.3387276999148063, 'edge_cap': 0.5689993721249753, 'bull_strategy': 'mean_reversion', 'bull_bb_std_mult': 0.8173932952076723, 'bull_rsi_os': 51, 'bull_rsi_ob': 60, 'bull_adx_thresh': 7.507728671048227, 'bull_atr_min_pct': 0.024397304993279596, 'bull_atr_max_pct': 0.011413983062092348, 'bull_tp_mult': 2.3274041463706525, 'bull_tsl_mult': 0.9110200625374139, 'bull_time_stop': 167, 'bull_use_sma': True, 'bull_use_ema': False, 'bull_use_atr': False, 'bull_use_adx': False, 'bull_use_spike': False, 'bull_rsi_required': False, 'bear_strategy': 'mean_reversion', 'bear_bb_std_mult': 2.7798571307387068, 'bear_rsi_os': 47, 'bear_rsi_ob': 51, 'bear_adx_thresh': 12.273774855236962, 'bear_atr_min_pct': 0.01040438276834125, 'bear_atr_max_pct': 0.14916603837881592, 'bear_tp_mult': 1.4259885878377991, 'bear_tsl_mult': 0.2339501092098007, 'bear_time_stop': 152, 'bear_use_sma': False, 'bear_use_ema': True, 'bear_use_atr': False, 'bear_use_adx': True, 'bear_use_spike': False, 'bear_rsi_required': True, 'sideways_strategy': 'mean_reversion', 'sideways_bb_std_mult': 2.237941229897654, 'sideways_rsi_os': 13, 'sideways_rsi_ob': 52, 'sideways_adx_thresh': 26.9614768265918, 'sideways_atr_min_pct': 0.008050241432734053, 'sideways_atr_max_pct': 0.03745163345359131, 'sideways_tp_mult': 1.8542221277463091, 'sideways_tsl_mult': 0.9237404014450553, 'sideways_time_stop': 147, 'sideways_use_sma': False, 'sideways_use_ema': True, 'sideways_use_atr': True, 'sideways_use_adx': True, 'sideways_use_spike': True, 'sideways_rsi_required': True}.
[I 2025-08-31 00:06:03,220] Trial 35 finished with values: [-1000000000.0, 1000000000.0] and parameters: {'p_sma': 46, 'p_std': 44, 'p_atr': 13, 'p_adx': 22, 'rsi_period': 27, 'ema1': 28, 'ema2': 14, 'slip_atr_k': 0.03515839481953617, 'slip_spread_k': 0.8211190297372427, 'spread_hl_frac': 0.005955204027879326, 'bb_std_mult': 2.3861148209062297, 'rsi_os': 27, 'rsi_ob': 67, 'vol_spike': 0.06462183204637742, 'adx_thresh': 27.09259045045793, 'atr_min_pct': 0.016096092362951602, 'atr_max_pct': 0.12345979235953884, 'tp_mult': 2.2267637303114576, 'tsl_mult': 0.3877103603561085, 'strategy': 'mean_reversion', 'time_stop': 213, 'use_sma': False, 'use_atr': False, 'use_adx': True, 'use_ema': False, 'use_spike': True, 'rsi_required': False, 'edge_k': 1.1699880238529856, 'edge_cap': 0.42047781162531817, 'bull_strategy': 'mean_reversion', 'bull_bb_std_mult': 1.258757203638768, 'bull_rsi_os': 25, 'bull_rsi_ob': 87, 'bull_adx_thresh': 28.20960625996511, 'bull_atr_min_pct': 0.023768435319148754, 'bull_atr_max_pct': 0.035028466377372114, 'bull_tp_mult': 1.6893579727751782, 'bull_tsl_mult': 0.7265484310007267, 'bull_time_stop': 158, 'bull_use_sma': True, 'bull_use_ema': True, 'bull_use_atr': True, 'bull_use_adx': False, 'bull_use_spike': False, 'bull_rsi_required': True, 'bear_strategy': 'mean_reversion', 'bear_bb_std_mult': 1.745494300730902, 'bear_rsi_os': 24, 'bear_rsi_ob': 59, 'bear_adx_thresh': 27.55899853012501, 'bear_atr_min_pct': 0.010019470326168907, 'bear_atr_max_pct': 0.022702157501380174, 'bear_tp_mult': 2.2163406883512944, 'bear_tsl_mult': 0.2431385264130662, 'bear_time_stop': 208, 'bear_use_sma': False, 'bear_use_ema': True, 'bear_use_atr': True, 'bear_use_adx': True, 'bear_use_spike': True, 'bear_rsi_required': True, 'sideways_strategy': 'mean_reversion', 'sideways_bb_std_mult': 0.5192376418902274, 'sideways_rsi_os': 13, 'sideways_rsi_ob': 75, 'sideways_adx_thresh': 14.905494582039145, 'sideways_atr_min_pct': 0.00382779317457756, 'sideways_atr_max_pct': 0.07818921116747835, 'sideways_tp_mult': 1.8992034805609737, 'sideways_tsl_mult': 0.9041392254056735, 'sideways_time_stop': 77, 'sideways_use_sma': True, 'sideways_use_ema': False, 'sideways_use_atr': False, 'sideways_use_adx': True, 'sideways_use_spike': True, 'sideways_rsi_required': True}.
[I 2025-08-31 00:06:03,366] Trial 34 finished with values: [-1000000000.0, 1000000000.0] and parameters: {'p_sma': 47, 'p_std': 14, 'p_atr': 30, 'p_adx': 28, 'rsi_period': 65, 'ema1': 28, 'ema2': 14, 'slip_atr_k': 0.03682149046209736, 'slip_spread_k': 0.8138263874329652, 'spread_hl_frac': 0.004233945379218947, 'bb_std_mult': 2.8814723921250036, 'rsi_os': 31, 'rsi_ob': 67, 'vol_spike': 0.06880726364995994, 'adx_thresh': 31.89572771709515, 'atr_min_pct': 0.015690834184202602, 'atr_max_pct': 0.09481866574065773, 'tp_mult': 2.1684308523836973, 'tsl_mult': 0.3794271865557537, 'strategy': 'mean_reversion', 'time_stop': 133, 'use_sma': True, 'use_atr': True, 'use_adx': False, 'use_ema': False, 'use_spike': True, 'rsi_required': False, 'edge_k': 1.084001681864867, 'edge_cap': 0.4123181430106593, 'bull_strategy': 'mean_reversion', 'bull_bb_std_mult': 1.2508013031695597, 'bull_rsi_os': 35, 'bull_rsi_ob': 88, 'bull_adx_thresh': 19.845634351115844, 'bull_atr_min_pct': 0.024113234109791527, 'bull_atr_max_pct': 0.031748410168270076, 'bull_tp_mult': 2.3088874858899575, 'bull_tsl_mult': 0.7619963692482541, 'bull_time_stop': 237, 'bull_use_sma': True, 'bull_use_ema': False, 'bull_use_atr': True, 'bull_use_adx': False, 'bull_use_spike': False, 'bull_rsi_required': True, 'bear_strategy': 'mean_reversion', 'bear_bb_std_mult': 2.785698648029082, 'bear_rsi_os': 25, 'bear_rsi_ob': 59, 'bear_adx_thresh': 27.11290470331238, 'bear_atr_min_pct': 0.010067384153385903, 'bear_atr_max_pct': 0.02415883478820125, 'bear_tp_mult': 2.6378079671502648, 'bear_tsl_mult': 0.24997654397437608, 'bear_time_stop': 216, 'bear_use_sma': False, 'bear_use_ema': True, 'bear_use_atr': False, 'bear_use_adx': True, 'bear_use_spike': False, 'bear_rsi_required': True, 'sideways_strategy': 'mean_reversion', 'sideways_bb_std_mult': 2.580791823353279, 'sideways_rsi_os': 13, 'sideways_rsi_ob': 74, 'sideways_adx_thresh': 28.036724698303445, 'sideways_atr_min_pct': 0.013380263488347168, 'sideways_atr_max_pct': 0.07742918197725057, 'sideways_tp_mult': 1.879209621672395, 'sideways_tsl_mult': 0.9324507335209523, 'sideways_time_stop': 298, 'sideways_use_sma': False, 'sideways_use_ema': True, 'sideways_use_atr': True, 'sideways_use_adx': True, 'sideways_use_spike': True, 'sideways_rsi_required': True}.
[I 2025-08-31 00:06:03,493] Trial 33 finished with values: [-1000000000.0, 1000000000.0] and parameters: {'p_sma': 27, 'p_std': 40, 'p_atr': 18, 'p_adx': 22, 'rsi_period': 29, 'ema1': 28, 'ema2': 15, 'slip_atr_k': 0.03535836462702477, 'slip_spread_k': 0.8160494599678856, 'spread_hl_frac': 0.02321254151559592, 'bb_std_mult': 2.3699012989371853, 'rsi_os': 30, 'rsi_ob': 84, 'vol_spike': 0.06241902167084389, 'adx_thresh': 32.58354292542714, 'atr_min_pct': 0.012921140836582327, 'atr_max_pct': 0.13572675856299107, 'tp_mult': 2.201206564658635, 'tsl_mult': 0.999234525574786, 'strategy': 'mean_reversion', 'time_stop': 265, 'use_sma': False, 'use_atr': False, 'use_adx': True, 'use_ema': True, 'use_spike': True, 'rsi_required': False, 'edge_k': 0.7608426602261573, 'edge_cap': 0.569593998455362, 'bull_strategy': 'mean_reversion', 'bull_bb_std_mult': 1.2775034735814417, 'bull_rsi_os': 49, 'bull_rsi_ob': 71, 'bull_adx_thresh': 7.463635348343949, 'bull_atr_min_pct': 0.022138112503352417, 'bull_atr_max_pct': 0.03433250583284585, 'bull_tp_mult': 2.349636782753436, 'bull_tsl_mult': 0.7514838817860641, 'bull_time_stop': 56, 'bull_use_sma': True, 'bull_use_ema': False, 'bull_use_atr': False, 'bull_use_adx': False, 'bull_use_spike': False, 'bull_rsi_required': False, 'bear_strategy': 'mean_reversion', 'bear_bb_std_mult': 3.196403867521056, 'bear_rsi_os': 24, 'bear_rsi_ob': 50, 'bear_adx_thresh': 27.0318915418525, 'bear_atr_min_pct': 0.01041674915096435, 'bear_atr_max_pct': 0.09329859054782665, 'bear_tp_mult': 2.6523246576404405, 'bear_tsl_mult': 0.24823949593406325, 'bear_time_stop': 153, 'bear_use_sma': False, 'bear_use_ema': True, 'bear_use_atr': True, 'bear_use_adx': True, 'bear_use_spike': True, 'bear_rsi_required': False, 'sideways_strategy': 'mean_reversion', 'sideways_bb_std_mult': 2.55329109439913, 'sideways_rsi_os': 47, 'sideways_rsi_ob': 77, 'sideways_adx_thresh': 14.54582160923554, 'sideways_atr_min_pct': 0.007431570588181152, 'sideways_atr_max_pct': 0.033492592286079925, 'sideways_tp_mult': 1.9526271907146255, 'sideways_tsl_mult': 0.9611832986291176, 'sideways_time_stop': 146, 'sideways_use_sma': False, 'sideways_use_ema': True, 'sideways_use_atr': True, 'sideways_use_adx': True, 'sideways_use_spike': False, 'sideways_rsi_required': True}.
