[I 2025-08-31 00:38:31,409] Trial 313 finished with values: [-1000000000.0, 1000000000.0] and parameters: {'p_sma': 48, 'p_std': 37, 'p_atr': 19, 'p_adx': 10, 'rsi_period': 57, 'ema1': 18, 'ema2': 19, 'slip_atr_k': 0.04164761019478704, 'slip_spread_k': 0.23688798526352867, 'spread_hl_frac': 0.044185640694691976, 'bb_std_mult': 1.2700080676822578, 'rsi_os': 55, 'rsi_ob': 72, 'vol_spike': 0.18696953764432156, 'adx_thresh': 7.846854924797729, 'atr_min_pct': 0.00893543774814703, 'atr_max_pct': 0.07052516036855364, 'tp_mult': 1.9878316837400458, 'tsl_mult': 0.725794163497902, 'strategy': 'breakout', 'time_stop': 73, 'use_sma': True, 'use_atr': False, 'use_adx': True, 'use_ema': True, 'use_spike': True, 'rsi_required': False, 'edge_k': 0.6150879781987559, 'edge_cap': 0.3767854910887671, 'bull_strategy': 'breakout', 'bull_bb_std_mult': 2.615291550469402, 'bull_rsi_os': 42, 'bull_rsi_ob': 69, 'bull_adx_thresh': 7.071583914179691, 'bull_atr_min_pct': 0.0036421891096172047, 'bull_atr_max_pct': 0.02254610475976223, 'bull_tp_mult': 1.130644385597319, 'bull_tsl_mult': 0.34930679101748735, 'bull_time_stop': 171, 'bull_use_sma': False, 'bull_use_ema': False, 'bull_use_atr': True, 'bull_use_adx': False, 'bull_use_spike': False, 'bull_rsi_required': True, 'bear_strategy': 'mean_reversion', 'bear_bb_std_mult': 1.8106794242623012, 'bear_rsi_os': 23, 'bear_rsi_ob': 78, 'bear_adx_thresh': 11.26955484741093, 'bear_atr_min_pct': 0.025378046410742053, 'bear_atr_max_pct': 0.023029559401780246, 'bear_tp_mult': 1.9216705157217862, 'bear_tsl_mult': 0.33720290044504786, 'bear_time_stop': 29, 'bear_use_sma': True, 'bear_use_ema': True, 'bear_use_atr': False, 'bear_use_adx': False, 'bear_use_spike': False, 'bear_rsi_required': False, 'sideways_strategy': 'mean_reversion', 'sideways_bb_std_mult': 2.72532784830151, 'sideways_rsi_os': 45, 'sideways_rsi_ob': 90, 'sideways_adx_thresh': 9.754994429796174, 'sideways_atr_min_pct': 0.008551341817614948, 'sideways_atr_max_pct': 0.13830422801114084, 'sideways_tp_mult': 2.143761716801076, 'sideways_tsl_mult': 0.7230660334140396, 'sideways_time_stop': 50, 'sideways_use_sma': True, 'sideways_use_ema': True, 'sideways_use_atr': True, 'sideways_use_adx': False, 'sideways_use_spike': True, 'sideways_rsi_required': True}.
[I 2025-08-31 00:38:31,863] Trial 316 finished with values: [-1000000000.0, 1000000000.0] and parameters: {'p_sma': 44, 'p_std': 38, 'p_atr': 19, 'p_adx': 29, 'rsi_period': 57, 'ema1': 22, 'ema2': 19, 'slip_atr_k': 0.0349712151329649, 'slip_spread_k': 0.27915226454116976, 'spread_hl_frac': 0.01295035150030478, 'bb_std_mult': 1.5839950358868116, 'rsi_os': 51, 'rsi_ob': 46, 'vol_spike': 0.15185155669969475, 'adx_thresh': 14.219293369165738, 'atr_min_pct': 0.024199918332616675, 'atr_max_pct': 0.07052136790186285, 'tp_mult': 1.0838045165483725, 'tsl_mult': 0.6514275053269056, 'strategy': 'breakout', 'time_stop': 90, 'use_sma': True, 'use_atr': False, 'use_adx': False, 'use_ema': True, 'use_spike': False, 'rsi_required': False, 'edge_k': 0.6653497799143144, 'edge_cap': 0.8011892657335086, 'bull_strategy': 'breakout', 'bull_bb_std_mult': 1.7676331528910367, 'bull_rsi_os': 32, 'bull_rsi_ob': 69, 'bull_adx_thresh': 14.17568144394683, 'bull_atr_min_pct': 0.0036774818938780382, 'bull_atr_max_pct': 0.06839552970193843, 'bull_tp_mult': 2.5521920874570596, 'bull_tsl_mult': 0.027888223278395297, 'bull_time_stop': 39, 'bull_use_sma': False, 'bull_use_ema': False, 'bull_use_atr': True, 'bull_use_adx': False, 'bull_use_spike': False, 'bull_rsi_required': False, 'bear_strategy': 'mean_reversion', 'bear_bb_std_mult': 3.59293209057902, 'bear_rsi_os': 25, 'bear_rsi_ob': 90, 'bear_adx_thresh': 13.509861860096962, 'bear_atr_min_pct': 0.019750082060571862, 'bear_atr_max_pct': 0.11620815542731641, 'bear_tp_mult': 2.672794850830554, 'bear_tsl_mult': 0.7385522135112526, 'bear_time_stop': 16, 'bear_use_sma': True, 'bear_use_ema': False, 'bear_use_atr': False, 'bear_use_adx': True, 'bear_use_spike': False, 'bear_rsi_required': False, 'sideways_strategy': 'mean_reversion', 'sideways_bb_std_mult': 0.9656921450125802, 'sideways_rsi_os': 28, 'sideways_rsi_ob': 89, 'sideways_adx_thresh': 16.53234820892579, 'sideways_atr_min_pct': 0.02010944193291726, 'sideways_atr_max_pct': 0.13814987541668242, 'sideways_tp_mult': 1.0443507330968793, 'sideways_tsl_mult': 0.6734026392243808, 'sideways_time_stop': 167, 'sideways_use_sma': True, 'sideways_use_ema': False, 'sideways_use_atr': False, 'sideways_use_adx': False, 'sideways_use_spike': True, 'sideways_rsi_required': True}.
[I 2025-08-31 00:38:32,457] Trial 319 finished with values: [-1000000000.0, 1000000000.0] and parameters: {'p_sma': 8, 'p_std': 41, 'p_atr': 20, 'p_adx': 9, 'rsi_period': 7, 'ema1': 7, 'ema2': 51, 'slip_atr_k': 0.1937884366812889, 'slip_spread_k': 0.21931962276809702, 'spread_hl_frac': 0.008763741456087729, 'bb_std_mult': 1.606675713432981, 'rsi_os': 51, 'rsi_ob': 62, 'vol_spike': 0.17184898299305384, 'adx_thresh': 14.252341873908184, 'atr_min_pct': 0.00798676476512224, 'atr_max_pct': 0.0714171229126845, 'tp_mult': 2.1221544329867688, 'tsl_mult': 0.9616048838403424, 'strategy': 'mean_reversion', 'time_stop': 277, 'use_sma': False, 'use_atr': False, 'use_adx': False, 'use_ema': True, 'use_spike': False, 'rsi_required': False, 'edge_k': 1.0541409958577732, 'edge_cap': 0.05194924887377306, 'bull_strategy': 'breakout', 'bull_bb_std_mult': 2.5584182287147677, 'bull_rsi_os': 26, 'bull_rsi_ob': 83, 'bull_adx_thresh': 14.162874990115432, 'bull_atr_min_pct': 0.002362915172501737, 'bull_atr_max_pct': 0.04618852557777499, 'bull_tp_mult': 2.459213243462787, 'bull_tsl_mult': 0.1977940781156735, 'bull_time_stop': 40, 'bull_use_sma': False, 'bull_use_ema': False, 'bull_use_atr': True, 'bull_use_adx': True, 'bull_use_spike': True, 'bull_rsi_required': False, 'bear_strategy': 'mean_reversion', 'bear_bb_std_mult': 3.3953523761687396, 'bear_rsi_os': 54, 'bear_rsi_ob': 76, 'bear_adx_thresh': 6.265105915000668, 'bear_atr_min_pct': 0.029919022457105024, 'bear_atr_max_pct': 0.11369403336070213, 'bear_tp_mult': 1.9825887565076754, 'bear_tsl_mult': 0.7233691267936478, 'bear_time_stop': 19, 'bear_use_sma': True, 'bear_use_ema': False, 'bear_use_atr': False, 'bear_use_adx': True, 'bear_use_spike': True, 'bear_rsi_required': True, 'sideways_strategy': 'breakout', 'sideways_bb_std_mult': 2.281671057502012, 'sideways_rsi_os': 16, 'sideways_rsi_ob': 91, 'sideways_adx_thresh': 32.74083742788578, 'sideways_atr_min_pct': 0.017390001508310472, 'sideways_atr_max_pct': 0.016023338403498844, 'sideways_tp_mult': 1.0464899908581473, 'sideways_tsl_mult': 0.7868424316028619, 'sideways_time_stop': 167, 'sideways_use_sma': True, 'sideways_use_ema': False, 'sideways_use_atr': False, 'sideways_use_adx': True, 'sideways_use_spike': False, 'sideways_rsi_required': False}.
[I 2025-08-31 00:38:32,469] Trial 320 finished with values: [-1000000000.0, 1000000000.0] and parameters: {'p_sma': 10, 'p_std': 40, 'p_atr': 23, 'p_adx': 19, 'rsi_period': 69, 'ema1': 7, 'ema2': 21, 'slip_atr_k': 0.15297767458554834, 'slip_spread_k': 0.22340285091009832, 'spread_hl_frac': 0.030061539331545865, 'bb_std_mult': 2.1889865187760837, 'rsi_os': 53, 'rsi_ob': 73, 'vol_spike': 0.16873532315288944, 'adx_thresh': 22.38902927739106, 'atr_min_pct': 0.008232781321198134, 'atr_max_pct': 0.1322430488171885, 'tp_mult': 2.118603560322997, 'tsl_mult': 0.15048949456492688, 'strategy': 'mean_reversion', 'time_stop': 81, 'use_sma': False, 'use_atr': True, 'use_adx': False, 'use_ema': True, 'use_spike': False, 'rsi_required': False, 'edge_k': 0.8061465004359922, 'edge_cap': 0.29575712346751903, 'bull_strategy': 'breakout', 'bull_bb_std_mult': 2.5573215747103406, 'bull_rsi_os': 13, 'bull_rsi_ob': 74, 'bull_adx_thresh': 9.55843616772703, 'bull_atr_min_pct': 0.0024479799173008766, 'bull_atr_max_pct': 0.04581882143093018, 'bull_tp_mult': 1.9472735679340758, 'bull_tsl_mult': 0.3883283658529581, 'bull_time_stop': 149, 'bull_use_sma': False, 'bull_use_ema': False, 'bull_use_atr': True, 'bull_use_adx': True, 'bull_use_spike': True, 'bull_rsi_required': False, 'bear_strategy': 'mean_reversion', 'bear_bb_std_mult': 0.9033810571640539, 'bear_rsi_os': 21, 'bear_rsi_ob': 50, 'bear_adx_thresh': 9.470716855152547, 'bear_atr_min_pct': 0.00874917245531274, 'bear_atr_max_pct': 0.01711719957830699, 'bear_tp_mult': 2.6107052247954874, 'bear_tsl_mult': 0.6703394989835734, 'bear_time_stop': 22, 'bear_use_sma': True, 'bear_use_ema': False, 'bear_use_atr': False, 'bear_use_adx': True, 'bear_use_spike': True, 'bear_rsi_required': True, 'sideways_strategy': 'breakout', 'sideways_bb_std_mult': 1.281241343435692, 'sideways_rsi_os': 40, 'sideways_rsi_ob': 91, 'sideways_adx_thresh': 15.510562507022634, 'sideways_atr_min_pct': 0.02204390719590602, 'sideways_atr_max_pct': 0.1497707807089221, 'sideways_tp_mult': 2.495701355338796, 'sideways_tsl_mult': 0.7859151072801737, 'sideways_time_stop': 183, 'sideways_use_sma': True, 'sideways_use_ema': False, 'sideways_use_atr': False, 'sideways_use_adx': True, 'sideways_use_spike': False, 'sideways_rsi_required': False}.
[I 2025-08-31 00:38:58,935] Trial 318 finished with values: [-1000000000.0, 1000000000.0] and parameters: {'p_sma': 45, 'p_std': 40, 'p_atr': 26, 'p_adx': 22, 'rsi_period': 58, 'ema1': 7, 'ema2': 19, 'slip_atr_k': 0.03394775696477308, 'slip_spread_k': 0.219562457785341, 'spread_hl_frac': 0.013232966513561394, 'bb_std_mult': 1.6116182091824187, 'rsi_os': 53, 'rsi_ob': 72, 'vol_spike': 0.04881701699450737, 'adx_thresh': 29.01983900101881, 'atr_min_pct': 0.024714320887398673, 'atr_max_pct': 0.07050359505708195, 'tp_mult': 2.753034647111384, 'tsl_mult': 0.566450320008354, 'strategy': 'breakout', 'time_stop': 91, 'use_sma': False, 'use_atr': False, 'use_adx': False, 'use_ema': True, 'use_spike': False, 'rsi_required': False, 'edge_k': 0.6794801568807741, 'edge_cap': 0.5685465888708958, 'bull_strategy': 'breakout', 'bull_bb_std_mult': 2.5943985815685853, 'bull_rsi_os': 37, 'bull_rsi_ob': 47, 'bull_adx_thresh': 27.112315167808106, 'bull_atr_min_pct': 0.029320388595756128, 'bull_atr_max_pct': 0.04489920877357708, 'bull_tp_mult': 2.4553986211325105, 'bull_tsl_mult': 0.3510000348125055, 'bull_time_stop': 39, 'bull_use_sma': False, 'bull_use_ema': False, 'bull_use_atr': True, 'bull_use_adx': True, 'bull_use_spike': True, 'bull_rsi_required': False, 'bear_strategy': 'mean_reversion', 'bear_bb_std_mult': 2.6718098659471736, 'bear_rsi_os': 54, 'bear_rsi_ob': 46, 'bear_adx_thresh': 13.58452352426415, 'bear_atr_min_pct': 0.008740441824789344, 'bear_atr_max_pct': 0.11517494770771923, 'bear_tp_mult': 2.426928296757096, 'bear_tsl_mult': 0.7373016506267913, 'bear_time_stop': 21, 'bear_use_sma': True, 'bear_use_ema': False, 'bear_use_atr': False, 'bear_use_adx': True, 'bear_use_spike': True, 'bear_rsi_required': False, 'sideways_strategy': 'mean_reversion', 'sideways_bb_std_mult': 1.1603646746284146, 'sideways_rsi_os': 45, 'sideways_rsi_ob': 90, 'sideways_adx_thresh': 15.530640238274218, 'sideways_atr_min_pct': 0.008991255094081285, 'sideways_atr_max_pct': 0.06857165175867232, 'sideways_tp_mult': 2.1353866719904255, 'sideways_tsl_mult': 0.789786160862485, 'sideways_time_stop': 167, 'sideways_use_sma': True, 'sideways_use_ema': False, 'sideways_use_atr': False, 'sideways_use_adx': True, 'sideways_use_spike': False, 'sideways_rsi_required': False}.
[I 2025-08-31 00:38:59,644] Trial 317 finished with values: [-1000000000.0, 1000000000.0] and parameters: {'p_sma': 6, 'p_std': 42, 'p_atr': 27, 'p_adx': 10, 'rsi_period': 9, 'ema1': 7, 'ema2': 28, 'slip_atr_k': 0.035238727901571704, 'slip_spread_k': 0.2535956652430538, 'spread_hl_frac': 0.008867772220830947, 'bb_std_mult': 1.6353012280691004, 'rsi_os': 10, 'rsi_ob': 46, 'vol_spike': 0.17130546091254337, 'adx_thresh': 29.34582810494777, 'atr_min_pct': 0.008390818527713898, 'atr_max_pct': 0.09592840250841153, 'tp_mult': 1.5961219629596184, 'tsl_mult': 0.1433277089407406, 'strategy': 'breakout', 'time_stop': 89, 'use_sma': False, 'use_atr': False, 'use_adx': False, 'use_ema': True, 'use_spike': True, 'rsi_required': False, 'edge_k': 1.5506144612706847, 'edge_cap': 0.8025921010448839, 'bull_strategy': 'breakout', 'bull_bb_std_mult': 2.756405749412991, 'bull_rsi_os': 42, 'bull_rsi_ob': 74, 'bull_adx_thresh': 14.140559172723348, 'bull_atr_min_pct': 0.01093731232766046, 'bull_atr_max_pct': 0.07683913900043639, 'bull_tp_mult': 2.5522899594928736, 'bull_tsl_mult': 0.46737153716390767, 'bull_time_stop': 40, 'bull_use_sma': False, 'bull_use_ema': False, 'bull_use_atr': True, 'bull_use_adx': True, 'bull_use_spike': True, 'bull_rsi_required': False, 'bear_strategy': 'mean_reversion', 'bear_bb_std_mult': 1.0853465983989563, 'bear_rsi_os': 36, 'bear_rsi_ob': 57, 'bear_adx_thresh': 13.66250114553299, 'bear_atr_min_pct': 0.009873576168831303, 'bear_atr_max_pct': 0.05721148440446039, 'bear_tp_mult': 2.2336682748690726, 'bear_tsl_mult': 0.725423402284614, 'bear_time_stop': 18, 'bear_use_sma': True, 'bear_use_ema': True, 'bear_use_atr': False, 'bear_use_adx': True, 'bear_use_spike': False, 'bear_rsi_required': False, 'sideways_strategy': 'mean_reversion', 'sideways_bb_std_mult': 1.1769311328713823, 'sideways_rsi_os': 45, 'sideways_rsi_ob': 89, 'sideways_adx_thresh': 29.953960409499064, 'sideways_atr_min_pct': 0.02534587586308821, 'sideways_atr_max_pct': 0.016376894656919508, 'sideways_tp_mult': 1.0209242175766498, 'sideways_tsl_mult': 0.6773895414040382, 'sideways_time_stop': 167, 'sideways_use_sma': True, 'sideways_use_ema': False, 'sideways_use_atr': True, 'sideways_use_adx': True, 'sideways_use_spike': False, 'sideways_rsi_required': False}.
[I 2025-08-31 00:39:02,243] Trial 321 finished with values: [-1000000000.0, 1000000000.0] and parameters: {'p_sma': 54, 'p_std': 42, 'p_atr': 21, 'p_adx': 22, 'rsi_period': 58, 'ema1': 15, 'ema2': 21, 'slip_atr_k': 0.12714772195888766, 'slip_spread_k': 0.25804245850399626, 'spread_hl_frac': 0.009682094578149251, 'bb_std_mult': 2.1964987216524356, 'rsi_os': 20, 'rsi_ob': 76, 'vol_spike': 0.2575822786816986, 'adx_thresh': 29.160810007605754, 'atr_min_pct': 0.009845626409856773, 'atr_max_pct': 0.10354397584999309, 'tp_mult': 2.436003458460342, 'tsl_mult': 0.1479712591361042, 'strategy': 'breakout', 'time_stop': 81, 'use_sma': False, 'use_atr': True, 'use_adx': False, 'use_ema': True, 'use_spike': False, 'rsi_required': False, 'edge_k': 0.6953510527840074, 'edge_cap': 0.30407840525173574, 'bull_strategy': 'breakout', 'bull_bb_std_mult': 2.7663100137477863, 'bull_rsi_os': 13, 'bull_rsi_ob': 70, 'bull_adx_thresh': 12.91255879418801, 'bull_atr_min_pct': 0.01720245119245896, 'bull_atr_max_pct': 0.07675281326467831, 'bull_tp_mult': 1.4638176767424662, 'bull_tsl_mult': 0.39259723738804475, 'bull_time_stop': 152, 'bull_use_sma': True, 'bull_use_ema': False, 'bull_use_atr': True, 'bull_use_adx': True, 'bull_use_spike': True, 'bull_rsi_required': False, 'bear_strategy': 'mean_reversion', 'bear_bb_std_mult': 1.071221755741928, 'bear_rsi_os': 22, 'bear_rsi_ob': 47, 'bear_adx_thresh': 7.34591920893337, 'bear_atr_min_pct': 0.008727119544045054, 'bear_atr_max_pct': 0.0582276267079616, 'bear_tp_mult': 1.137186575119895, 'bear_tsl_mult': 0.667381144638583, 'bear_time_stop': 24, 'bear_use_sma': True, 'bear_use_ema': False, 'bear_use_atr': False, 'bear_use_adx': True, 'bear_use_spike': False, 'bear_rsi_required': False, 'sideways_strategy': 'mean_reversion', 'sideways_bb_std_mult': 1.2708642424823753, 'sideways_rsi_os': 44, 'sideways_rsi_ob': 87, 'sideways_adx_thresh': 5.01935188987755, 'sideways_atr_min_pct': 0.023827324508421305, 'sideways_atr_max_pct': 0.09954474265110362, 'sideways_tp_mult': 1.0122767567162234, 'sideways_tsl_mult': 0.8663209608054186, 'sideways_time_stop': 175, 'sideways_use_sma': True, 'sideways_use_ema': False, 'sideways_use_atr': False, 'sideways_use_adx': True, 'sideways_use_spike': False, 'sideways_rsi_required': False}.
[I 2025-08-31 00:39:02,680] Trial 322 finished with values: [-1000000000.0, 1000000000.0] and parameters: {'p_sma': 54, 'p_std': 43, 'p_atr': 26, 'p_adx': 8, 'rsi_period': 53, 'ema1': 8, 'ema2': 16, 'slip_atr_k': 0.08902513310472585, 'slip_spread_k': 0.2609183263145033, 'spread_hl_frac': 0.01019279751590749, 'bb_std_mult': 2.8280496079935893, 'rsi_os': 10, 'rsi_ob': 71, 'vol_spike': 0.2785761655318535, 'adx_thresh': 23.52124334506371, 'atr_min_pct': 0.01298396317082561, 'atr_max_pct': 0.021152232189703503, 'tp_mult': 2.6581997826628037, 'tsl_mult': 0.10265859104791149, 'strategy': 'breakout', 'time_stop': 91, 'use_sma': True, 'use_atr': False, 'use_adx': False, 'use_ema': True, 'use_spike': False, 'rsi_required': False, 'edge_k': 0.7013452081939244, 'edge_cap': 0.45444495655686923, 'bull_strategy': 'breakout', 'bull_bb_std_mult': 1.0521231748761508, 'bull_rsi_os': 36, 'bull_rsi_ob': 60, 'bull_adx_thresh': 8.46567185368051, 'bull_atr_min_pct': 0.011268625990230421, 'bull_atr_max_pct': 0.07719057292071117, 'bull_tp_mult': 2.3879230424356397, 'bull_tsl_mult': 0.5920917645435178, 'bull_time_stop': 162, 'bull_use_sma': True, 'bull_use_ema': False, 'bull_use_atr': True, 'bull_use_adx': True, 'bull_use_spike': False, 'bull_rsi_required': False, 'bear_strategy': 'mean_reversion', 'bear_bb_std_mult': 1.0817457507711898, 'bear_rsi_os': 22, 'bear_rsi_ob': 77, 'bear_adx_thresh': 7.640184584928655, 'bear_atr_min_pct': 0.010186125354125745, 'bear_atr_max_pct': 0.056521268534400815, 'bear_tp_mult': 2.440265482227256, 'bear_tsl_mult': 0.6304770910408645, 'bear_time_stop': 131, 'bear_use_sma': True, 'bear_use_ema': False, 'bear_use_atr': False, 'bear_use_adx': True, 'bear_use_spike': False, 'bear_rsi_required': False, 'sideways_strategy': 'mean_reversion', 'sideways_bb_std_mult': 1.1328950834378655, 'sideways_rsi_os': 46, 'sideways_rsi_ob': 89, 'sideways_adx_thresh': 29.701192790132193, 'sideways_atr_min_pct': 0.029938681644619908, 'sideways_atr_max_pct': 0.02964747434472511, 'sideways_tp_mult': 1.0133239418618167, 'sideways_tsl_mult': 0.5892630506672838, 'sideways_time_stop': 175, 'sideways_use_sma': True, 'sideways_use_ema': False, 'sideways_use_atr': False, 'sideways_use_adx': False, 'sideways_use_spike': True, 'sideways_rsi_required': False}.
[I 2025-08-31 00:39:31,676] Trial 323 finished with values: [-1000000000.0, 1000000000.0] and parameters: {'p_sma': 50, 'p_std': 42, 'p_atr': 27, 'p_adx': 8, 'rsi_period': 53, 'ema1': 13, 'ema2': 39, 'slip_atr_k': 0.21304718201451023, 'slip_spread_k': 0.2793712950342283, 'spread_hl_frac': 0.010253902717964702, 'bb_std_mult': 2.273391508446034, 'rsi_os': 20, 'rsi_ob': 76, 'vol_spike': 0.07145990835980566, 'adx_thresh': 6.090223831977141, 'atr_min_pct': 0.009824856752247677, 'atr_max_pct': 0.06451220540711625, 'tp_mult': 1.211089302514658, 'tsl_mult': 0.09633219201219695, 'strategy': 'breakout', 'time_stop': 194, 'use_sma': True, 'use_atr': False, 'use_adx': False, 'use_ema': True, 'use_spike': False, 'rsi_required': False, 'edge_k': 0.7674280842424497, 'edge_cap': 0.8163090819231451, 'bull_strategy': 'breakout', 'bull_bb_std_mult': 2.757030454931417, 'bull_rsi_os': 39, 'bull_rsi_ob': 60, 'bull_adx_thresh': 12.895855128489671, 'bull_atr_min_pct': 0.0007130687925016915, 'bull_atr_max_pct': 0.1489716996328918, 'bull_tp_mult': 2.1163621714924217, 'bull_tsl_mult': 0.12023052993798766, 'bull_time_stop': 162, 'bull_use_sma': True, 'bull_use_ema': False, 'bull_use_atr': True, 'bull_use_adx': True, 'bull_use_spike': False, 'bull_rsi_required': False, 'bear_strategy': 'mean_reversion', 'bear_bb_std_mult': 3.058435859818277, 'bear_rsi_os': 22, 'bear_rsi_ob': 58, 'bear_adx_thresh': 7.472278656177463, 'bear_atr_min_pct': 0.02202373285790685, 'bear_atr_max_pct': 0.0959167661479569, 'bear_tp_mult': 1.9706959144907712, 'bear_tsl_mult': 0.6251362418177983, 'bear_time_stop': 92, 'bear_use_sma': True, 'bear_use_ema': False, 'bear_use_atr': False, 'bear_use_adx': True, 'bear_use_spike': False, 'bear_rsi_required': False, 'sideways_strategy': 'mean_reversion', 'sideways_bb_std_mult': 1.1641983034424268, 'sideways_rsi_os': 43, 'sideways_rsi_ob': 88, 'sideways_adx_thresh': 10.762108627437206, 'sideways_atr_min_pct': 0.023500992803566084, 'sideways_atr_max_pct': 0.05436244021231178, 'sideways_tp_mult': 1.0119642829884392, 'sideways_tsl_mult': 0.7493215320488096, 'sideways_time_stop': 176, 'sideways_use_sma': True, 'sideways_use_ema': False, 'sideways_use_atr': False, 'sideways_use_adx': False, 'sideways_use_spike': True, 'sideways_rsi_required': False}.
