[I 2025-08-31 02:28:42,461] Trial 521 finished with values: [-0.012346042624800102, 0.012276310775413293] and parameters: {'p_sma': 53, 'p_std': 51, 'p_atr': 28, 'p_adx': 25, 'rsi_period': 70, 'ema1': 5, 'ema2': 25, 'slip_atr_k': 0.01536576831549975, 'slip_spread_k': 0.1630985161705498, 'spread_hl_frac': 0.002126441086661068, 'bb_std_mult': 1.6912122027712198, 'rsi_os': 38, 'rsi_ob': 69, 'vol_spike': 0.18777616131824465, 'adx_thresh': 20.810988274670287, 'atr_min_pct': 0.00845682741221126, 'atr_max_pct': 0.12039108165979746, 'tp_mult': 1.0678679899857375, 'tsl_mult': 0.3511340638731639, 'strategy': 'mean_reversion', 'time_stop': 106, 'use_sma': True, 'use_atr': False, 'use_adx': False, 'use_ema': False, 'use_spike': False, 'rsi_required': True, 'edge_k': 0.5648393032082524, 'edge_cap': 0.12160967357683822, 'bull_strategy': 'breakout', 'bull_bb_std_mult': 2.3660389903783607, 'bull_rsi_os': 48, 'bull_rsi_ob': 62, 'bull_adx_thresh': 5.788632605617955, 'bull_atr_min_pct': 0.0007338495587728298, 'bull_atr_max_pct': 0.14089326964585386, 'bull_tp_mult': 2.3049622045780263, 'bull_tsl_mult': 0.26654247038032614, 'bull_time_stop': 135, 'bull_use_sma': True, 'bull_use_ema': False, 'bull_use_atr': False, 'bull_use_adx': True, 'bull_use_spike': True, 'bull_rsi_required': True, 'bear_strategy': 'mean_reversion', 'bear_bb_std_mult': 1.3210371272661088, 'bear_rsi_os': 17, 'bear_rsi_ob': 45, 'bear_adx_thresh': 5.038332017377511, 'bear_atr_min_pct': 0.006155472156513004, 'bear_atr_max_pct': 0.01038609084826539, 'bear_tp_mult': 2.0606974390795236, 'bear_tsl_mult': 0.5359828277116784, 'bear_time_stop': 10, 'bear_use_sma': False, 'bear_use_ema': False, 'bear_use_atr': False, 'bear_use_adx': True, 'bear_use_spike': False, 'bear_rsi_required': True, 'sideways_strategy': 'breakout', 'sideways_bb_std_mult': 0.5439684102976644, 'sideways_rsi_os': 40, 'sideways_rsi_ob': 94, 'sideways_adx_thresh': 9.112272222047345, 'sideways_atr_min_pct': 0.027028437309838317, 'sideways_atr_max_pct': 0.05368332440999491, 'sideways_tp_mult': 1.7205577708134572, 'sideways_tsl_mult': 0.6611625921739169, 'sideways_time_stop': 201, 'sideways_use_sma': True, 'sideways_use_ema': False, 'sideways_use_atr': False, 'sideways_use_adx': False, 'sideways_use_spike': True, 'sideways_rsi_required': False}.
[I 2025-08-31 02:28:42,734] Trial 520 finished with values: [-0.015201974468955437, 0.015132573610438606] and parameters: {'p_sma': 53, 'p_std': 49, 'p_atr': 27, 'p_adx': 25, 'rsi_period': 65, 'ema1': 5, 'ema2': 22, 'slip_atr_k': 0.015865580402296058, 'slip_spread_k': 0.15318342056913156, 'spread_hl_frac': 0.0029338556388161193, 'bb_std_mult': 1.5998928882288483, 'rsi_os': 38, 'rsi_ob': 69, 'vol_spike': 0.19053736356138454, 'adx_thresh': 20.613468779452234, 'atr_min_pct': 0.008177201756421606, 'atr_max_pct': 0.12107869820774024, 'tp_mult': 1.0799994463112013, 'tsl_mult': 0.2951767352071604, 'strategy': 'mean_reversion', 'time_stop': 105, 'use_sma': True, 'use_atr': True, 'use_adx': False, 'use_ema': False, 'use_spike': False, 'rsi_required': True, 'edge_k': 0.5855298529464974, 'edge_cap': 0.11763709070107402, 'bull_strategy': 'breakout', 'bull_bb_std_mult': 2.380364861045122, 'bull_rsi_os': 48, 'bull_rsi_ob': 61, 'bull_adx_thresh': 5.837465565068262, 'bull_atr_min_pct': 0.0007042591886509104, 'bull_atr_max_pct': 0.14106986808497854, 'bull_tp_mult': 2.2019035889228147, 'bull_tsl_mult': 0.262942852645266, 'bull_time_stop': 134, 'bull_use_sma': True, 'bull_use_ema': False, 'bull_use_atr': False, 'bull_use_adx': False, 'bull_use_spike': True, 'bull_rsi_required': True, 'bear_strategy': 'mean_reversion', 'bear_bb_std_mult': 1.319663300401371, 'bear_rsi_os': 17, 'bear_rsi_ob': 45, 'bear_adx_thresh': 5.004417894999429, 'bear_atr_min_pct': 0.005913685445814998, 'bear_atr_max_pct': 0.012761334497466362, 'bear_tp_mult': 2.0828260124661355, 'bear_tsl_mult': 0.9283601354505292, 'bear_time_stop': 10, 'bear_use_sma': False, 'bear_use_ema': False, 'bear_use_atr': False, 'bear_use_adx': True, 'bear_use_spike': False, 'bear_rsi_required': True, 'sideways_strategy': 'mean_reversion', 'sideways_bb_std_mult': 0.6881968497690113, 'sideways_rsi_os': 41, 'sideways_rsi_ob': 94, 'sideways_adx_thresh': 10.432693241131169, 'sideways_atr_min_pct': 0.02736603116253928, 'sideways_atr_max_pct': 0.05334517662373094, 'sideways_tp_mult': 1.8691971288266114, 'sideways_tsl_mult': 0.6121255192810837, 'sideways_time_stop': 201, 'sideways_use_sma': True, 'sideways_use_ema': True, 'sideways_use_atr': False, 'sideways_use_adx': True, 'sideways_use_spike': True, 'sideways_rsi_required': False}.
[I 2025-08-31 02:29:17,506] Trial 527 finished with values: [-1000000000.0, 1000000000.0] and parameters: {'p_sma': 53, 'p_std': 51, 'p_atr': 27, 'p_adx': 28, 'rsi_period': 71, 'ema1': 5, 'ema2': 32, 'slip_atr_k': 0.09063460753833232, 'slip_spread_k': 0.10512457534510086, 'spread_hl_frac': 0.0012233404090664084, 'bb_std_mult': 1.5825119177337739, 'rsi_os': 36, 'rsi_ob': 68, 'vol_spike': 0.1942743963739175, 'adx_thresh': 21.9530992659451, 'atr_min_pct': 0.009279388815910661, 'atr_max_pct': 0.12772059995509388, 'tp_mult': 1.5173320312755134, 'tsl_mult': 0.32302878431826554, 'strategy': 'mean_reversion', 'time_stop': 114, 'use_sma': True, 'use_atr': False, 'use_adx': False, 'use_ema': False, 'use_spike': False, 'rsi_required': True, 'edge_k': 0.5651585756184736, 'edge_cap': 0.09182426535647498, 'bull_strategy': 'mean_reversion', 'bull_bb_std_mult': 2.1198621331318, 'bull_rsi_os': 45, 'bull_rsi_ob': 57, 'bull_adx_thresh': 5.605531728487492, 'bull_atr_min_pct': 0.0074148851028533105, 'bull_atr_max_pct': 0.13804256248336472, 'bull_tp_mult': 2.3195788822209384, 'bull_tsl_mult': 0.22387896444559047, 'bull_time_stop': 122, 'bull_use_sma': True, 'bull_use_ema': False, 'bull_use_atr': False, 'bull_use_adx': True, 'bull_use_spike': True, 'bull_rsi_required': True, 'bear_strategy': 'breakout', 'bear_bb_std_mult': 1.3284751674050104, 'bear_rsi_os': 14, 'bear_rsi_ob': 46, 'bear_adx_thresh': 5.789463840685664, 'bear_atr_min_pct': 0.004847810938269276, 'bear_atr_max_pct': 0.015325439978964434, 'bear_tp_mult': 2.0592309341745216, 'bear_tsl_mult': 0.5364063038150882, 'bear_time_stop': 13, 'bear_use_sma': False, 'bear_use_ema': False, 'bear_use_atr': False, 'bear_use_adx': True, 'bear_use_spike': False, 'bear_rsi_required': True, 'sideways_strategy': 'breakout', 'sideways_bb_std_mult': 0.5089753871267291, 'sideways_rsi_os': 39, 'sideways_rsi_ob': 93, 'sideways_adx_thresh': 8.340018874055337, 'sideways_atr_min_pct': 0.02814888336712057, 'sideways_atr_max_pct': 0.0563734140208257, 'sideways_tp_mult': 1.693661416467165, 'sideways_tsl_mult': 0.6601484294662383, 'sideways_time_stop': 208, 'sideways_use_sma': False, 'sideways_use_ema': False, 'sideways_use_atr': False, 'sideways_use_adx': False, 'sideways_use_spike': False, 'sideways_rsi_required': False}.
[I 2025-08-31 02:29:17,821] Trial 526 finished with values: [-1000000000.0, 1000000000.0] and parameters: {'p_sma': 53, 'p_std': 50, 'p_atr': 27, 'p_adx': 28, 'rsi_period': 71, 'ema1': 5, 'ema2': 32, 'slip_atr_k': 0.08107913552012458, 'slip_spread_k': 0.10436263768058832, 'spread_hl_frac': 0.0013427539437061676, 'bb_std_mult': 1.6008939406836815, 'rsi_os': 36, 'rsi_ob': 68, 'vol_spike': 0.19433840024342786, 'adx_thresh': 21.999351795634837, 'atr_min_pct': 0.008844090929152452, 'atr_max_pct': 0.12683372350082928, 'tp_mult': 1.157318727231406, 'tsl_mult': 0.3804414201069677, 'strategy': 'mean_reversion', 'time_stop': 121, 'use_sma': True, 'use_atr': False, 'use_adx': False, 'use_ema': False, 'use_spike': False, 'rsi_required': True, 'edge_k': 0.5839964495495373, 'edge_cap': 0.11544139392613334, 'bull_strategy': 'mean_reversion', 'bull_bb_std_mult': 2.3136139719540885, 'bull_rsi_os': 45, 'bull_rsi_ob': 57, 'bull_adx_thresh': 5.272107142718477, 'bull_atr_min_pct': 0.00482303146841225, 'bull_atr_max_pct': 0.13895330314379212, 'bull_tp_mult': 2.3105184593068793, 'bull_tsl_mult': 0.2340092847103837, 'bull_time_stop': 123, 'bull_use_sma': True, 'bull_use_ema': False, 'bull_use_atr': False, 'bull_use_adx': True, 'bull_use_spike': True, 'bull_rsi_required': True, 'bear_strategy': 'breakout', 'bear_bb_std_mult': 1.2964322912794966, 'bear_rsi_os': 15, 'bear_rsi_ob': 45, 'bear_adx_thresh': 5.062972028557421, 'bear_atr_min_pct': 0.005215968826798227, 'bear_atr_max_pct': 0.01015798715293322, 'bear_tp_mult': 2.0992090309739058, 'bear_tsl_mult': 0.528261249381054, 'bear_time_stop': 14, 'bear_use_sma': False, 'bear_use_ema': False, 'bear_use_atr': False, 'bear_use_adx': True, 'bear_use_spike': False, 'bear_rsi_required': True, 'sideways_strategy': 'breakout', 'sideways_bb_std_mult': 0.5079290482618886, 'sideways_rsi_os': 39, 'sideways_rsi_ob': 93, 'sideways_adx_thresh': 8.52465780912863, 'sideways_atr_min_pct': 0.027996045448831653, 'sideways_atr_max_pct': 0.055608894239211414, 'sideways_tp_mult': 1.7098830093311173, 'sideways_tsl_mult': 0.6687080588215073, 'sideways_time_stop': 208, 'sideways_use_sma': False, 'sideways_use_ema': False, 'sideways_use_atr': False, 'sideways_use_adx': False, 'sideways_use_spike': False, 'sideways_rsi_required': False}.
[I 2025-08-31 02:29:18,415] Trial 524 finished with values: [-1000000000.0, 1000000000.0] and parameters: {'p_sma': 57, 'p_std': 51, 'p_atr': 28, 'p_adx': 25, 'rsi_period': 70, 'ema1': 11, 'ema2': 25, 'slip_atr_k': 0.0059819277380090165, 'slip_spread_k': 0.10592582908648387, 'spread_hl_frac': 0.001788929264083989, 'bb_std_mult': 1.5955770432095489, 'rsi_os': 38, 'rsi_ob': 68, 'vol_spike': 0.1913290928645753, 'adx_thresh': 21.90564763223259, 'atr_min_pct': 0.01852850972625364, 'atr_max_pct': 0.12488477026181968, 'tp_mult': 1.1433639043847665, 'tsl_mult': 0.3717707151421196, 'strategy': 'mean_reversion', 'time_stop': 128, 'use_sma': True, 'use_atr': False, 'use_adx': False, 'use_ema': False, 'use_spike': False, 'rsi_required': True, 'edge_k': 0.5636859290746739, 'edge_cap': 0.12178413821115137, 'bull_strategy': 'breakout', 'bull_bb_std_mult': 2.322512512515418, 'bull_rsi_os': 44, 'bull_rsi_ob': 59, 'bull_adx_thresh': 5.055619149739142, 'bull_atr_min_pct': 0.007371227357157182, 'bull_atr_max_pct': 0.13969992801830788, 'bull_tp_mult': 2.30483409515644, 'bull_tsl_mult': 0.22531634569903866, 'bull_time_stop': 123, 'bull_use_sma': True, 'bull_use_ema': False, 'bull_use_atr': False, 'bull_use_adx': True, 'bull_use_spike': True, 'bull_rsi_required': True, 'bear_strategy': 'mean_reversion', 'bear_bb_std_mult': 1.6331066340598237, 'bear_rsi_os': 15, 'bear_rsi_ob': 45, 'bear_adx_thresh': 6.079341846968385, 'bear_atr_min_pct': 0.005080683400041768, 'bear_atr_max_pct': 0.01578499652597465, 'bear_tp_mult': 2.138979065057061, 'bear_tsl_mult': 0.4929591721143042, 'bear_time_stop': 148, 'bear_use_sma': False, 'bear_use_ema': False, 'bear_use_atr': False, 'bear_use_adx': True, 'bear_use_spike': False, 'bear_rsi_required': True, 'sideways_strategy': 'mean_reversion', 'sideways_bb_std_mult': 0.5329760719678515, 'sideways_rsi_os': 41, 'sideways_rsi_ob': 94, 'sideways_adx_thresh': 8.287085462509877, 'sideways_atr_min_pct': 0.0272691973887403, 'sideways_atr_max_pct': 0.05544387819188159, 'sideways_tp_mult': 1.94145123783844, 'sideways_tsl_mult': 0.6582339372348031, 'sideways_time_stop': 185, 'sideways_use_sma': False, 'sideways_use_ema': False, 'sideways_use_atr': False, 'sideways_use_adx': False, 'sideways_use_spike': True, 'sideways_rsi_required': False}.
[I 2025-08-31 02:29:18,608] Trial 525 finished with values: [-1000000000.0, 1000000000.0] and parameters: {'p_sma': 58, 'p_std': 51, 'p_atr': 27, 'p_adx': 25, 'rsi_period': 70, 'ema1': 11, 'ema2': 22, 'slip_atr_k': 0.005520691866617246, 'slip_spread_k': 0.09899788359900286, 'spread_hl_frac': 0.003061142608128408, 'bb_std_mult': 1.7314947573601744, 'rsi_os': 38, 'rsi_ob': 68, 'vol_spike': 0.19014427894763491, 'adx_thresh': 21.92735068658295, 'atr_min_pct': 0.01881817637775707, 'atr_max_pct': 0.12317863906320034, 'tp_mult': 1.1412334836010407, 'tsl_mult': 0.3108524251244251, 'strategy': 'mean_reversion', 'time_stop': 123, 'use_sma': True, 'use_atr': False, 'use_adx': False, 'use_ema': False, 'use_spike': False, 'rsi_required': True, 'edge_k': 0.5912542048364411, 'edge_cap': 0.11581762240846408, 'bull_strategy': 'breakout', 'bull_bb_std_mult': 2.0951910653874695, 'bull_rsi_os': 53, 'bull_rsi_ob': 59, 'bull_adx_thresh': 5.635725250823912, 'bull_atr_min_pct': 0.00749755282276384, 'bull_atr_max_pct': 0.14015351680316693, 'bull_tp_mult': 2.305926691640916, 'bull_tsl_mult': 0.2379309695397099, 'bull_time_stop': 121, 'bull_use_sma': True, 'bull_use_ema': False, 'bull_use_atr': False, 'bull_use_adx': True, 'bull_use_spike': True, 'bull_rsi_required': True, 'bear_strategy': 'breakout', 'bear_bb_std_mult': 1.6226318501794217, 'bear_rsi_os': 15, 'bear_rsi_ob': 45, 'bear_adx_thresh': 5.704101215502803, 'bear_atr_min_pct': 0.005062497910498988, 'bear_atr_max_pct': 0.015658815073327545, 'bear_tp_mult': 2.139150759981947, 'bear_tsl_mult': 0.4710748650970474, 'bear_time_stop': 142, 'bear_use_sma': False, 'bear_use_ema': False, 'bear_use_atr': False, 'bear_use_adx': True, 'bear_use_spike': False, 'bear_rsi_required': True, 'sideways_strategy': 'mean_reversion', 'sideways_bb_std_mult': 0.5269551127501821, 'sideways_rsi_os': 41, 'sideways_rsi_ob': 94, 'sideways_adx_thresh': 8.574347637094212, 'sideways_atr_min_pct': 0.02743027791485446, 'sideways_atr_max_pct': 0.05536356879543457, 'sideways_tp_mult': 1.883124614579171, 'sideways_tsl_mult': 0.6626360005841454, 'sideways_time_stop': 184, 'sideways_use_sma': False, 'sideways_use_ema': False, 'sideways_use_atr': False, 'sideways_use_adx': False, 'sideways_use_spike': True, 'sideways_rsi_required': False}.
[I 2025-08-31 02:29:52,854] Trial 528 finished with values: [-1000000000.0, 1000000000.0] and parameters: {'p_sma': 53, 'p_std': 51, 'p_atr': 28, 'p_adx': 28, 'rsi_period': 72, 'ema1': 5, 'ema2': 26, 'slip_atr_k': 0.11159115725424312, 'slip_spread_k': 0.13791587678694817, 'spread_hl_frac': 0.001971084746454852, 'bb_std_mult': 1.631862179838576, 'rsi_os': 38, 'rsi_ob': 66, 'vol_spike': 0.19026481191247419, 'adx_thresh': 21.793163091296936, 'atr_min_pct': 0.008881653510786616, 'atr_max_pct': 0.12469042813122765, 'tp_mult': 1.3594539667777081, 'tsl_mult': 0.4285278048246738, 'strategy': 'mean_reversion', 'time_stop': 110, 'use_sma': True, 'use_atr': False, 'use_adx': False, 'use_ema': False, 'use_spike': False, 'rsi_required': True, 'edge_k': 0.6047565136975377, 'edge_cap': 0.10533482042189168, 'bull_strategy': 'breakout', 'bull_bb_std_mult': 2.315499733735987, 'bull_rsi_os': 44, 'bull_rsi_ob': 55, 'bull_adx_thresh': 5.032590010263571, 'bull_atr_min_pct': 0.004785851785987569, 'bull_atr_max_pct': 0.13549765692847318, 'bull_tp_mult': 2.319895270967882, 'bull_tsl_mult': 0.23884454005414288, 'bull_time_stop': 125, 'bull_use_sma': True, 'bull_use_ema': False, 'bull_use_atr': False, 'bull_use_adx': True, 'bull_use_spike': True, 'bull_rsi_required': True, 'bear_strategy': 'mean_reversion', 'bear_bb_std_mult': 1.2978760941409309, 'bear_rsi_os': 16, 'bear_rsi_ob': 45, 'bear_adx_thresh': 5.637471652658002, 'bear_atr_min_pct': 0.005480298369387689, 'bear_atr_max_pct': 0.01053436821697092, 'bear_tp_mult': 2.0752952735779777, 'bear_tsl_mult': 0.5578127196760041, 'bear_time_stop': 13, 'bear_use_sma': False, 'bear_use_ema': False, 'bear_use_atr': False, 'bear_use_adx': True, 'bear_use_spike': False, 'bear_rsi_required': True, 'sideways_strategy': 'breakout', 'sideways_bb_std_mult': 0.5449331381961724, 'sideways_rsi_os': 38, 'sideways_rsi_ob': 93, 'sideways_adx_thresh': 8.620743263270551, 'sideways_atr_min_pct': 0.026799563139978885, 'sideways_atr_max_pct': 0.05506724222016865, 'sideways_tp_mult': 1.7101770812498291, 'sideways_tsl_mult': 0.658885760692218, 'sideways_time_stop': 211, 'sideways_use_sma': False, 'sideways_use_ema': False, 'sideways_use_atr': False, 'sideways_use_adx': False, 'sideways_use_spike': True, 'sideways_rsi_required': False}.
[I 2025-08-31 02:29:53,215] Trial 531 finished with values: [-1000000000.0, 1000000000.0] and parameters: {'p_sma': 53, 'p_std': 52, 'p_atr': 28, 'p_adx': 21, 'rsi_period': 72, 'ema1': 5, 'ema2': 28, 'slip_atr_k': 0.0998423015868635, 'slip_spread_k': 0.13177881730382174, 'spread_hl_frac': 0.0006700931941051914, 'bb_std_mult': 1.5432593548776752, 'rsi_os': 37, 'rsi_ob': 66, 'vol_spike': 0.19313807539390382, 'adx_thresh': 21.244842012221316, 'atr_min_pct': 0.009105530760702883, 'atr_max_pct': 0.1246718932847529, 'tp_mult': 1.2979663123151253, 'tsl_mult': 0.41653926136701375, 'strategy': 'mean_reversion', 'time_stop': 119, 'use_sma': True, 'use_atr': False, 'use_adx': False, 'use_ema': False, 'use_spike': False, 'rsi_required': True, 'edge_k': 0.5217690104302646, 'edge_cap': 0.08071055638820634, 'bull_strategy': 'breakout', 'bull_bb_std_mult': 2.1746272312298, 'bull_rsi_os': 28, 'bull_rsi_ob': 55, 'bull_adx_thresh': 5.7968801289089145, 'bull_atr_min_pct': 0.005885152460645948, 'bull_atr_max_pct': 0.13477872571612926, 'bull_tp_mult': 2.3143300287589215, 'bull_tsl_mult': 0.23475797974930268, 'bull_time_stop': 132, 'bull_use_sma': True, 'bull_use_ema': True, 'bull_use_atr': False, 'bull_use_adx': True, 'bull_use_spike': True, 'bull_rsi_required': True, 'bear_strategy': 'mean_reversion', 'bear_bb_std_mult': 1.3020053254492516, 'bear_rsi_os': 16, 'bear_rsi_ob': 48, 'bear_adx_thresh': 5.5561437577507515, 'bear_atr_min_pct': 0.005659926056351995, 'bear_atr_max_pct': 0.010173654489285986, 'bear_tp_mult': 2.058488264097811, 'bear_tsl_mult': 0.5587670239649883, 'bear_time_stop': 12, 'bear_use_sma': False, 'bear_use_ema': False, 'bear_use_atr': True, 'bear_use_adx': True, 'bear_use_spike': False, 'bear_rsi_required': True, 'sideways_strategy': 'breakout', 'sideways_bb_std_mult': 0.5668694371911257, 'sideways_rsi_os': 38, 'sideways_rsi_ob': 93, 'sideways_adx_thresh': 7.632554216483065, 'sideways_atr_min_pct': 0.026625044074883343, 'sideways_atr_max_pct': 0.06038008380534312, 'sideways_tp_mult': 1.6849495650619872, 'sideways_tsl_mult': 0.6323636649704036, 'sideways_time_stop': 216, 'sideways_use_sma': True, 'sideways_use_ema': False, 'sideways_use_atr': True, 'sideways_use_adx': False, 'sideways_use_spike': True, 'sideways_rsi_required': False}.
[I 2025-08-31 02:29:53,305] Trial 529 finished with values: [-1000000000.0, 1000000000.0] and parameters: {'p_sma': 53, 'p_std': 51, 'p_atr': 28, 'p_adx': 21, 'rsi_period': 72, 'ema1': 5, 'ema2': 27, 'slip_atr_k': 0.11164705812514636, 'slip_spread_k': 0.1295305681759889, 'spread_hl_frac': 0.0018612424509196447, 'bb_std_mult': 1.5451442584273465, 'rsi_os': 38, 'rsi_ob': 66, 'vol_spike': 0.19390061678206152, 'adx_thresh': 21.354361524867397, 'atr_min_pct': 0.009074643294005758, 'atr_max_pct': 0.12505808485324757, 'tp_mult': 1.3587603665807497, 'tsl_mult': 0.41684250941885714, 'strategy': 'mean_reversion', 'time_stop': 117, 'use_sma': True, 'use_atr': False, 'use_adx': False, 'use_ema': False, 'use_spike': False, 'rsi_required': True, 'edge_k': 0.605977728691032, 'edge_cap': 0.10269389842419144, 'bull_strategy': 'breakout', 'bull_bb_std_mult': 2.162679915689631, 'bull_rsi_os': 44, 'bull_rsi_ob': 55, 'bull_adx_thresh': 5.009365253625986, 'bull_atr_min_pct': 0.01066979830149741, 'bull_atr_max_pct': 0.13570768111939696, 'bull_tp_mult': 2.3052235908852667, 'bull_tsl_mult': 0.23695144980429192, 'bull_time_stop': 127, 'bull_use_sma': True, 'bull_use_ema': False, 'bull_use_atr': False, 'bull_use_adx': True, 'bull_use_spike': True, 'bull_rsi_required': True, 'bear_strategy': 'mean_reversion', 'bear_bb_std_mult': 1.3271927974455124, 'bear_rsi_os': 16, 'bear_rsi_ob': 48, 'bear_adx_thresh': 5.710685747308993, 'bear_atr_min_pct': 0.005502204829162917, 'bear_atr_max_pct': 0.010126302842922631, 'bear_tp_mult': 2.0705396001646617, 'bear_tsl_mult': 0.5378602117164952, 'bear_time_stop': 12, 'bear_use_sma': False, 'bear_use_ema': False, 'bear_use_atr': False, 'bear_use_adx': True, 'bear_use_spike': False, 'bear_rsi_required': True, 'sideways_strategy': 'breakout', 'sideways_bb_std_mult': 0.5529566917386426, 'sideways_rsi_os': 38, 'sideways_rsi_ob': 94, 'sideways_adx_thresh': 8.686472373979754, 'sideways_atr_min_pct': 0.027171031829802003, 'sideways_atr_max_pct': 0.05386064700282194, 'sideways_tp_mult': 1.6968581367582065, 'sideways_tsl_mult': 0.6635009997867694, 'sideways_time_stop': 213, 'sideways_use_sma': True, 'sideways_use_ema': False, 'sideways_use_atr': False, 'sideways_use_adx': False, 'sideways_use_spike': True, 'sideways_rsi_required': False}.
