[I 2025-08-31 02:36:42,884] Trial 579 finished with values: [-1000000000.0, 1000000000.0] and parameters: {'p_sma': 56, 'p_std': 50, 'p_atr': 26, 'p_adx': 20, 'rsi_period': 73, 'ema1': 5, 'ema2': 54, 'slip_atr_k': 0.11940714911742327, 'slip_spread_k': 0.11854187761189139, 'spread_hl_frac': 0.0009162368855182325, 'bb_std_mult': 0.7415748156095316, 'rsi_os': 39, 'rsi_ob': 91, 'vol_spike': 0.19518938593943358, 'adx_thresh': 21.54739489567445, 'atr_min_pct': 0.0071349169578685395, 'atr_max_pct': 0.11651774220321413, 'tp_mult': 1.3925028104211754, 'tsl_mult': 0.4214961138869122, 'strategy': 'mean_reversion', 'time_stop': 187, 'use_sma': True, 'use_atr': False, 'use_adx': False, 'use_ema': False, 'use_spike': False, 'rsi_required': True, 'edge_k': 0.6271206963090004, 'edge_cap': 0.13666979209342928, 'bull_strategy': 'mean_reversion', 'bull_bb_std_mult': 1.5861612052131167, 'bull_rsi_os': 7, 'bull_rsi_ob': 56, 'bull_adx_thresh': 6.243484880532522, 'bull_atr_min_pct': 0.02148255362959769, 'bull_atr_max_pct': 0.14512065371809205, 'bull_tp_mult': 2.330402233312062, 'bull_tsl_mult': 0.2706037335913728, 'bull_time_stop': 125, 'bull_use_sma': True, 'bull_use_ema': False, 'bull_use_atr': False, 'bull_use_adx': True, 'bull_use_spike': True, 'bull_rsi_required': True, 'bear_strategy': 'mean_reversion', 'bear_bb_std_mult': 2.6156841791484764, 'bear_rsi_os': 16, 'bear_rsi_ob': 47, 'bear_adx_thresh': 5.0190677002218615, 'bear_atr_min_pct': 0.006949511966024813, 'bear_atr_max_pct': 0.01531327101718261, 'bear_tp_mult': 1.296170019635615, 'bear_tsl_mult': 0.49693863133171035, 'bear_time_stop': 296, 'bear_use_sma': False, 'bear_use_ema': False, 'bear_use_atr': False, 'bear_use_adx': True, 'bear_use_spike': False, 'bear_rsi_required': True, 'sideways_strategy': 'breakout', 'sideways_bb_std_mult': 0.7680971998500641, 'sideways_rsi_os': 40, 'sideways_rsi_ob': 80, 'sideways_adx_thresh': 7.614204298753425, 'sideways_atr_min_pct': 0.02509580359391461, 'sideways_atr_max_pct': 0.04890510108454735, 'sideways_tp_mult': 1.5958878914655605, 'sideways_tsl_mult': 0.36713020313963174, 'sideways_time_stop': 201, 'sideways_use_sma': True, 'sideways_use_ema': False, 'sideways_use_atr': False, 'sideways_use_adx': False, 'sideways_use_spike': True, 'sideways_rsi_required': False}.
[I 2025-08-31 02:36:43,206] Trial 577 finished with values: [-1000000000.0, 1000000000.0] and parameters: {'p_sma': 56, 'p_std': 50, 'p_atr': 26, 'p_adx': 22, 'rsi_period': 69, 'ema1': 5, 'ema2': 25, 'slip_atr_k': 0.07479315413693391, 'slip_spread_k': 0.6466918998517451, 'spread_hl_frac': 3.445072758157322e-05, 'bb_std_mult': 1.7897393481109833, 'rsi_os': 37, 'rsi_ob': 64, 'vol_spike': 0.1991267427672472, 'adx_thresh': 18.635281552828406, 'atr_min_pct': 0.007331969314097864, 'atr_max_pct': 0.12719929185860598, 'tp_mult': 1.2830973373797074, 'tsl_mult': 0.522075267492359, 'strategy': 'mean_reversion', 'time_stop': 187, 'use_sma': True, 'use_atr': False, 'use_adx': False, 'use_ema': False, 'use_spike': False, 'rsi_required': True, 'edge_k': 0.6108320230003357, 'edge_cap': 0.13007483131338615, 'bull_strategy': 'breakout', 'bull_bb_std_mult': 2.094160587218483, 'bull_rsi_os': 16, 'bull_rsi_ob': 75, 'bull_adx_thresh': 34.96117870011181, 'bull_atr_min_pct': 0.021447332060831277, 'bull_atr_max_pct': 0.14398703609968755, 'bull_tp_mult': 2.2962959482079683, 'bull_tsl_mult': 0.2760170274408872, 'bull_time_stop': 125, 'bull_use_sma': True, 'bull_use_ema': False, 'bull_use_atr': False, 'bull_use_adx': True, 'bull_use_spike': True, 'bull_rsi_required': True, 'bear_strategy': 'mean_reversion', 'bear_bb_std_mult': 2.624762187176238, 'bear_rsi_os': 19, 'bear_rsi_ob': 47, 'bear_adx_thresh': 6.13297959422737, 'bear_atr_min_pct': 0.005316282541159333, 'bear_atr_max_pct': 0.0981261501738345, 'bear_tp_mult': 2.608606087432909, 'bear_tsl_mult': 0.5052979375440187, 'bear_time_stop': 122, 'bear_use_sma': False, 'bear_use_ema': False, 'bear_use_atr': False, 'bear_use_adx': True, 'bear_use_spike': False, 'bear_rsi_required': True, 'sideways_strategy': 'breakout', 'sideways_bb_std_mult': 0.550558841556468, 'sideways_rsi_os': 40, 'sideways_rsi_ob': 95, 'sideways_adx_thresh': 8.073002033148281, 'sideways_atr_min_pct': 0.026836263312680308, 'sideways_atr_max_pct': 0.05020586017507237, 'sideways_tp_mult': 1.7980326350079294, 'sideways_tsl_mult': 0.36341133060513003, 'sideways_time_stop': 269, 'sideways_use_sma': True, 'sideways_use_ema': False, 'sideways_use_atr': False, 'sideways_use_adx': False, 'sideways_use_spike': True, 'sideways_rsi_required': False}.
[I 2025-08-31 02:36:43,407] Trial 578 finished with values: [-1000000000.0, 1000000000.0] and parameters: {'p_sma': 56, 'p_std': 53, 'p_atr': 26, 'p_adx': 19, 'rsi_period': 69, 'ema1': 5, 'ema2': 43, 'slip_atr_k': 0.1732371428500654, 'slip_spread_k': 0.10681404791116934, 'spread_hl_frac': 0.0024721374290183162, 'bb_std_mult': 1.759550710928981, 'rsi_os': 37, 'rsi_ob': 52, 'vol_spike': 0.1943722880315644, 'adx_thresh': 18.45913722057078, 'atr_min_pct': 0.023380090288377516, 'atr_max_pct': 0.11772981134487784, 'tp_mult': 1.630945986619702, 'tsl_mult': 0.3595477728208377, 'strategy': 'mean_reversion', 'time_stop': 99, 'use_sma': True, 'use_atr': False, 'use_adx': False, 'use_ema': False, 'use_spike': False, 'rsi_required': True, 'edge_k': 0.629452350596689, 'edge_cap': 0.12729931341361111, 'bull_strategy': 'mean_reversion', 'bull_bb_std_mult': 2.079671587293999, 'bull_rsi_os': 32, 'bull_rsi_ob': 79, 'bull_adx_thresh': 6.114354858892655, 'bull_atr_min_pct': 0.017696771914401447, 'bull_atr_max_pct': 0.14549747310807673, 'bull_tp_mult': 2.2761254541930263, 'bull_tsl_mult': 0.26832561721624526, 'bull_time_stop': 139, 'bull_use_sma': True, 'bull_use_ema': False, 'bull_use_atr': False, 'bull_use_adx': True, 'bull_use_spike': True, 'bull_rsi_required': True, 'bear_strategy': 'mean_reversion', 'bear_bb_std_mult': 1.5168921435650142, 'bear_rsi_os': 14, 'bear_rsi_ob': 47, 'bear_adx_thresh': 6.2538786902186585, 'bear_atr_min_pct': 0.0025444300051767604, 'bear_atr_max_pct': 0.015400152683080093, 'bear_tp_mult': 1.5508026461200646, 'bear_tsl_mult': 0.5434996145528569, 'bear_time_stop': 295, 'bear_use_sma': False, 'bear_use_ema': False, 'bear_use_atr': False, 'bear_use_adx': True, 'bear_use_spike': False, 'bear_rsi_required': True, 'sideways_strategy': 'breakout', 'sideways_bb_std_mult': 0.7710812742378522, 'sideways_rsi_os': 40, 'sideways_rsi_ob': 95, 'sideways_adx_thresh': 7.654359895432632, 'sideways_atr_min_pct': 0.025977563797811874, 'sideways_atr_max_pct': 0.04906421405850672, 'sideways_tp_mult': 1.7783646864758964, 'sideways_tsl_mult': 0.6466413514326192, 'sideways_time_stop': 256, 'sideways_use_sma': True, 'sideways_use_ema': False, 'sideways_use_atr': False, 'sideways_use_adx': False, 'sideways_use_spike': True, 'sideways_rsi_required': False}.
[I 2025-08-31 02:36:43,493] Trial 576 finished with values: [-1000000000.0, 1000000000.0] and parameters: {'p_sma': 51, 'p_std': 49, 'p_atr': 28, 'p_adx': 18, 'rsi_period': 68, 'ema1': 18, 'ema2': 43, 'slip_atr_k': 0.2499818155958376, 'slip_spread_k': 0.16704412504892024, 'spread_hl_frac': 3.8134661146547663e-06, 'bb_std_mult': 1.775363212376344, 'rsi_os': 41, 'rsi_ob': 68, 'vol_spike': 0.19762628119237857, 'adx_thresh': 19.449726619510294, 'atr_min_pct': 0.007468458496698766, 'atr_max_pct': 0.11796701378308258, 'tp_mult': 2.1172761602731036, 'tsl_mult': 0.29620834720000355, 'strategy': 'mean_reversion', 'time_stop': 108, 'use_sma': True, 'use_atr': False, 'use_adx': False, 'use_ema': False, 'use_spike': False, 'rsi_required': True, 'edge_k': 0.6301738438968927, 'edge_cap': 0.06809858833695401, 'bull_strategy': 'breakout', 'bull_bb_std_mult': 2.1420818491584237, 'bull_rsi_os': 32, 'bull_rsi_ob': 79, 'bull_adx_thresh': 7.278405596313627, 'bull_atr_min_pct': 0.027610069332820647, 'bull_atr_max_pct': 0.1451388260927164, 'bull_tp_mult': 2.280799316471838, 'bull_tsl_mult': 0.27197943543522035, 'bull_time_stop': 124, 'bull_use_sma': True, 'bull_use_ema': False, 'bull_use_atr': False, 'bull_use_adx': True, 'bull_use_spike': True, 'bull_rsi_required': True, 'bear_strategy': 'mean_reversion', 'bear_bb_std_mult': 2.3577135411282826, 'bear_rsi_os': 16, 'bear_rsi_ob': 45, 'bear_adx_thresh': 6.305908241149263, 'bear_atr_min_pct': 0.005081761704342269, 'bear_atr_max_pct': 0.11041179666508909, 'bear_tp_mult': 1.6182115317201589, 'bear_tsl_mult': 0.5395330789536424, 'bear_time_stop': 251, 'bear_use_sma': False, 'bear_use_ema': False, 'bear_use_atr': False, 'bear_use_adx': True, 'bear_use_spike': False, 'bear_rsi_required': True, 'sideways_strategy': 'breakout', 'sideways_bb_std_mult': 0.5471759334761025, 'sideways_rsi_os': 38, 'sideways_rsi_ob': 80, 'sideways_adx_thresh': 9.071663017876531, 'sideways_atr_min_pct': 0.025960711278812415, 'sideways_atr_max_pct': 0.04787638019939466, 'sideways_tp_mult': 1.7999022063862902, 'sideways_tsl_mult': 0.6354637047793483, 'sideways_time_stop': 14, 'sideways_use_sma': True, 'sideways_use_ema': False, 'sideways_use_atr': False, 'sideways_use_adx': False, 'sideways_use_spike': True, 'sideways_rsi_required': False}.
[I 2025-08-31 02:37:16,323] Trial 582 finished with values: [-1000000000.0, 1000000000.0] and parameters: {'p_sma': 53, 'p_std': 51, 'p_atr': 28, 'p_adx': 18, 'rsi_period': 72, 'ema1': 17, 'ema2': 34, 'slip_atr_k': 0.22164547854129402, 'slip_spread_k': 0.17256920466369993, 'spread_hl_frac': 0.0019814948296601118, 'bb_std_mult': 0.9505782791186612, 'rsi_os': 38, 'rsi_ob': 69, 'vol_spike': 0.18783642534837214, 'adx_thresh': 22.23937521074335, 'atr_min_pct': 0.00977123086993962, 'atr_max_pct': 0.12396997643819112, 'tp_mult': 1.5817097467912835, 'tsl_mult': 0.29652455676845646, 'strategy': 'mean_reversion', 'time_stop': 263, 'use_sma': False, 'use_atr': False, 'use_adx': False, 'use_ema': False, 'use_spike': False, 'rsi_required': True, 'edge_k': 0.5532645605668198, 'edge_cap': 0.0989447037171656, 'bull_strategy': 'breakout', 'bull_bb_std_mult': 2.202442627764927, 'bull_rsi_os': 26, 'bull_rsi_ob': 66, 'bull_adx_thresh': 5.451082592383307, 'bull_atr_min_pct': 0.0102628633603045, 'bull_atr_max_pct': 0.13899386125207625, 'bull_tp_mult': 2.365934964425929, 'bull_tsl_mult': 0.2575489251175293, 'bull_time_stop': 112, 'bull_use_sma': True, 'bull_use_ema': True, 'bull_use_atr': False, 'bull_use_adx': True, 'bull_use_spike': True, 'bull_rsi_required': True, 'bear_strategy': 'mean_reversion', 'bear_bb_std_mult': 1.3993476582782312, 'bear_rsi_os': 16, 'bear_rsi_ob': 45, 'bear_adx_thresh': 23.31366047085294, 'bear_atr_min_pct': 0.0060652829954366, 'bear_atr_max_pct': 0.013088936841549548, 'bear_tp_mult': 1.636274558658028, 'bear_tsl_mult': 0.46507837847799033, 'bear_time_stop': 18, 'bear_use_sma': False, 'bear_use_ema': False, 'bear_use_atr': True, 'bear_use_adx': True, 'bear_use_spike': True, 'bear_rsi_required': True, 'sideways_strategy': 'breakout', 'sideways_bb_std_mult': 0.5874580675764433, 'sideways_rsi_os': 38, 'sideways_rsi_ob': 94, 'sideways_adx_thresh': 9.40599635522385, 'sideways_atr_min_pct': 0.027126706632295303, 'sideways_atr_max_pct': 0.05367036159452745, 'sideways_tp_mult': 1.6358239621733919, 'sideways_tsl_mult': 0.32550734939115905, 'sideways_time_stop': 201, 'sideways_use_sma': True, 'sideways_use_ema': False, 'sideways_use_atr': True, 'sideways_use_adx': False, 'sideways_use_spike': False, 'sideways_rsi_required': True}.
[I 2025-08-31 02:37:16,495] Trial 583 finished with values: [-1000000000.0, 1000000000.0] and parameters: {'p_sma': 54, 'p_std': 51, 'p_atr': 28, 'p_adx': 21, 'rsi_period': 72, 'ema1': 6, 'ema2': 34, 'slip_atr_k': 0.21200051631567657, 'slip_spread_k': 0.15631827707022913, 'spread_hl_frac': 0.0019507751242060641, 'bb_std_mult': 0.978175896657423, 'rsi_os': 38, 'rsi_ob': 69, 'vol_spike': 0.180788440312878, 'adx_thresh': 22.68934452388664, 'atr_min_pct': 0.008599934959162971, 'atr_max_pct': 0.12246322098063751, 'tp_mult': 2.232524875230276, 'tsl_mult': 0.5842781461908368, 'strategy': 'mean_reversion', 'time_stop': 222, 'use_sma': False, 'use_atr': True, 'use_adx': True, 'use_ema': False, 'use_spike': False, 'rsi_required': True, 'edge_k': 0.5792457608518112, 'edge_cap': 0.09891248019509728, 'bull_strategy': 'breakout', 'bull_bb_std_mult': 2.2174620059938164, 'bull_rsi_os': 29, 'bull_rsi_ob': 60, 'bull_adx_thresh': 5.5142874790469945, 'bull_atr_min_pct': 0.01325689630645753, 'bull_atr_max_pct': 0.13800499848906098, 'bull_tp_mult': 1.4466356792791963, 'bull_tsl_mult': 0.7066956183477722, 'bull_time_stop': 145, 'bull_use_sma': True, 'bull_use_ema': True, 'bull_use_atr': False, 'bull_use_adx': True, 'bull_use_spike': True, 'bull_rsi_required': True, 'bear_strategy': 'mean_reversion', 'bear_bb_std_mult': 1.400716561491743, 'bear_rsi_os': 18, 'bear_rsi_ob': 45, 'bear_adx_thresh': 5.607582290198604, 'bear_atr_min_pct': 0.005944649236361604, 'bear_atr_max_pct': 0.11808583280863556, 'bear_tp_mult': 1.4024629603341525, 'bear_tsl_mult': 0.4660951927095313, 'bear_time_stop': 99, 'bear_use_sma': False, 'bear_use_ema': False, 'bear_use_atr': True, 'bear_use_adx': True, 'bear_use_spike': True, 'bear_rsi_required': True, 'sideways_strategy': 'breakout', 'sideways_bb_std_mult': 0.5605888231523055, 'sideways_rsi_os': 38, 'sideways_rsi_ob': 92, 'sideways_adx_thresh': 6.469983038086811, 'sideways_atr_min_pct': 0.02718582347887787, 'sideways_atr_max_pct': 0.05306946840187999, 'sideways_tp_mult': 1.6731414707724235, 'sideways_tsl_mult': 0.6134448882385384, 'sideways_time_stop': 210, 'sideways_use_sma': False, 'sideways_use_ema': False, 'sideways_use_atr': True, 'sideways_use_adx': False, 'sideways_use_spike': False, 'sideways_rsi_required': True}.
[I 2025-08-31 02:37:16,574] Trial 580 finished with values: [-1000000000.0, 1000000000.0] and parameters: {'p_sma': 55, 'p_std': 49, 'p_atr': 28, 'p_adx': 21, 'rsi_period': 68, 'ema1': 6, 'ema2': 42, 'slip_atr_k': 0.13759791128297202, 'slip_spread_k': 0.16098009595793744, 'spread_hl_frac': 0.0025811783952888272, 'bb_std_mult': 1.7907683360353845, 'rsi_os': 37, 'rsi_ob': 69, 'vol_spike': 0.18928404556563583, 'adx_thresh': 22.528245345619343, 'atr_min_pct': 0.023352550393880456, 'atr_max_pct': 0.1232645886122013, 'tp_mult': 2.117480494136919, 'tsl_mult': 0.507849120374528, 'strategy': 'mean_reversion', 'time_stop': 266, 'use_sma': True, 'use_atr': False, 'use_adx': False, 'use_ema': False, 'use_spike': False, 'rsi_required': True, 'edge_k': 1.3682834199444074, 'edge_cap': 0.13479181887779712, 'bull_strategy': 'breakout', 'bull_bb_std_mult': 2.0935278872018603, 'bull_rsi_os': 28, 'bull_rsi_ob': 79, 'bull_adx_thresh': 5.030825665641277, 'bull_atr_min_pct': 0.010318896926001395, 'bull_atr_max_pct': 0.138038916957579, 'bull_tp_mult': 2.1658746926334884, 'bull_tsl_mult': 0.6053174001827203, 'bull_time_stop': 139, 'bull_use_sma': True, 'bull_use_ema': False, 'bull_use_atr': False, 'bull_use_adx': True, 'bull_use_spike': True, 'bull_rsi_required': True, 'bear_strategy': 'mean_reversion', 'bear_bb_std_mult': 2.070968519735379, 'bear_rsi_os': 14, 'bear_rsi_ob': 47, 'bear_adx_thresh': 5.972069208069269, 'bear_atr_min_pct': 0.0059372134489771725, 'bear_atr_max_pct': 0.06648965617257778, 'bear_tp_mult': 1.5609511009609915, 'bear_tsl_mult': 0.5384797864057166, 'bear_time_stop': 18, 'bear_use_sma': False, 'bear_use_ema': False, 'bear_use_atr': False, 'bear_use_adx': True, 'bear_use_spike': False, 'bear_rsi_required': True, 'sideways_strategy': 'breakout', 'sideways_bb_std_mult': 0.573980129963902, 'sideways_rsi_os': 38, 'sideways_rsi_ob': 95, 'sideways_adx_thresh': 9.229154209013968, 'sideways_atr_min_pct': 0.02694657861037421, 'sideways_atr_max_pct': 0.052675949884973705, 'sideways_tp_mult': 1.797950691826686, 'sideways_tsl_mult': 0.32235930017442843, 'sideways_time_stop': 202, 'sideways_use_sma': True, 'sideways_use_ema': False, 'sideways_use_atr': False, 'sideways_use_adx': False, 'sideways_use_spike': True, 'sideways_rsi_required': False}.
[I 2025-08-31 02:37:16,798] Trial 581 finished with values: [-1000000000.0, 1000000000.0] and parameters: {'p_sma': 54, 'p_std': 53, 'p_atr': 28, 'p_adx': 25, 'rsi_period': 72, 'ema1': 6, 'ema2': 44, 'slip_atr_k': 0.16856456977563872, 'slip_spread_k': 0.1010627468306819, 'spread_hl_frac': 0.0025786183646766634, 'bb_std_mult': 1.7391577121365775, 'rsi_os': 37, 'rsi_ob': 69, 'vol_spike': 0.10218977564362675, 'adx_thresh': 22.67985336019848, 'atr_min_pct': 0.009917713538759436, 'atr_max_pct': 0.12360360040890053, 'tp_mult': 2.2373616483856664, 'tsl_mult': 0.3609854430784975, 'strategy': 'mean_reversion', 'time_stop': 294, 'use_sma': True, 'use_atr': False, 'use_adx': False, 'use_ema': False, 'use_spike': False, 'rsi_required': True, 'edge_k': 0.6269652764155084, 'edge_cap': 0.190691920990307, 'bull_strategy': 'breakout', 'bull_bb_std_mult': 1.1603145259568368, 'bull_rsi_os': 32, 'bull_rsi_ob': 79, 'bull_adx_thresh': 6.172960782682894, 'bull_atr_min_pct': 0.009144023251448304, 'bull_atr_max_pct': 0.13897963941514108, 'bull_tp_mult': 1.0507196727532753, 'bull_tsl_mult': 0.9989175285567631, 'bull_time_stop': 138, 'bull_use_sma': True, 'bull_use_ema': False, 'bull_use_atr': False, 'bull_use_adx': True, 'bull_use_spike': True, 'bull_rsi_required': True, 'bear_strategy': 'mean_reversion', 'bear_bb_std_mult': 1.391627617818508, 'bear_rsi_os': 14, 'bear_rsi_ob': 50, 'bear_adx_thresh': 5.536238987824944, 'bear_atr_min_pct': 0.006012714708514007, 'bear_atr_max_pct': 0.10908087552255782, 'bear_tp_mult': 2.109107284210902, 'bear_tsl_mult': 0.5374491576676507, 'bear_time_stop': 19, 'bear_use_sma': False, 'bear_use_ema': False, 'bear_use_atr': False, 'bear_use_adx': True, 'bear_use_spike': True, 'bear_rsi_required': True, 'sideways_strategy': 'breakout', 'sideways_bb_std_mult': 0.5786592187020021, 'sideways_rsi_os': 38, 'sideways_rsi_ob': 94, 'sideways_adx_thresh': 6.5720688690561415, 'sideways_atr_min_pct': 0.026130886828253708, 'sideways_atr_max_pct': 0.05191234893281853, 'sideways_tp_mult': 1.6330204349709672, 'sideways_tsl_mult': 0.18534847771092627, 'sideways_time_stop': 200, 'sideways_use_sma': True, 'sideways_use_ema': False, 'sideways_use_atr': False, 'sideways_use_adx': False, 'sideways_use_spike': True, 'sideways_rsi_required': False}.
[I 2025-08-31 02:37:17,641] Trial 585 finished with values: [-1000000000.0, 1000000000.0] and parameters: {'p_sma': 53, 'p_std': 53, 'p_atr': 29, 'p_adx': 17, 'rsi_period': 71, 'ema1': 23, 'ema2': 59, 'slip_atr_k': 0.16614522829262748, 'slip_spread_k': 0.09539388733289465, 'spread_hl_frac': 0.0011303736461700333, 'bb_std_mult': 1.694349775444234, 'rsi_os': 35, 'rsi_ob': 45, 'vol_spike': 0.10387971162207485, 'adx_thresh': 21.209070475768332, 'atr_min_pct': 0.008258727772955948, 'atr_max_pct': 0.1137515662205509, 'tp_mult': 2.169665260202685, 'tsl_mult': 0.2440750347207521, 'strategy': 'mean_reversion', 'time_stop': 115, 'use_sma': True, 'use_atr': False, 'use_adx': False, 'use_ema': False, 'use_spike': True, 'rsi_required': True, 'edge_k': 0.46231107429265794, 'edge_cap': 0.1577750337227865, 'bull_strategy': 'mean_reversion', 'bull_bb_std_mult': 0.7325466237341571, 'bull_rsi_os': 42, 'bull_rsi_ob': 62, 'bull_adx_thresh': 6.192376054600444, 'bull_atr_min_pct': 0.005179258922576559, 'bull_atr_max_pct': 0.14323747745308024, 'bull_tp_mult': 2.3321491133793586, 'bull_tsl_mult': 0.2979198792577757, 'bull_time_stop': 201, 'bull_use_sma': True, 'bull_use_ema': False, 'bull_use_atr': False, 'bull_use_adx': True, 'bull_use_spike': True, 'bull_rsi_required': True, 'bear_strategy': 'mean_reversion', 'bear_bb_std_mult': 1.2489136365765248, 'bear_rsi_os': 18, 'bear_rsi_ob': 46, 'bear_adx_thresh': 5.593549939057718, 'bear_atr_min_pct': 0.00650691403544906, 'bear_atr_max_pct': 0.01713392740861827, 'bear_tp_mult': 2.2850692489591324, 'bear_tsl_mult': 0.5153318145701833, 'bear_time_stop': 176, 'bear_use_sma': False, 'bear_use_ema': True, 'bear_use_atr': False, 'bear_use_adx': True, 'bear_use_spike': False, 'bear_rsi_required': True, 'sideways_strategy': 'breakout', 'sideways_bb_std_mult': 0.703859836837296, 'sideways_rsi_os': 42, 'sideways_rsi_ob': 48, 'sideways_adx_thresh': 9.761261021112007, 'sideways_atr_min_pct': 0.027663582593384868, 'sideways_atr_max_pct': 0.05944153012467191, 'sideways_tp_mult': 1.7526860962375417, 'sideways_tsl_mult': 0.6815217697347214, 'sideways_time_stop': 219, 'sideways_use_sma': True, 'sideways_use_ema': False, 'sideways_use_atr': False, 'sideways_use_adx': False, 'sideways_use_spike': True, 'sideways_rsi_required': False}.
