[I 2025-08-31 02:54:02,998] Trial 702 finished with values: [-1000000000.0, 1000000000.0] and parameters: {'p_sma': 54, 'p_std': 52, 'p_atr': 8, 'p_adx': 14, 'rsi_period': 36, 'ema1': 5, 'ema2': 14, 'slip_atr_k': 0.06201508565252954, 'slip_spread_k': 0.8675762223888651, 'spread_hl_frac': 0.026733418801160085, 'bb_std_mult': 1.6285653697790663, 'rsi_os': 40, 'rsi_ob': 66, 'vol_spike': 0.19568747567312722, 'adx_thresh': 34.15629043619893, 'atr_min_pct': 0.009499508081996039, 'atr_max_pct': 0.11867704193557364, 'tp_mult': 1.2888007740406917, 'tsl_mult': 0.39303156046739185, 'strategy': 'mean_reversion', 'time_stop': 268, 'use_sma': True, 'use_atr': False, 'use_adx': True, 'use_ema': False, 'use_spike': False, 'rsi_required': True, 'edge_k': 1.6898993423439528, 'edge_cap': 0.12780790838741035, 'bull_strategy': 'mean_reversion', 'bull_bb_std_mult': 1.970627117124358, 'bull_rsi_os': 24, 'bull_rsi_ob': 59, 'bull_adx_thresh': 5.0068405184339015, 'bull_atr_min_pct': 0.02326490026616075, 'bull_atr_max_pct': 0.13772423687418456, 'bull_tp_mult': 2.070378000258029, 'bull_tsl_mult': 0.11256932023154881, 'bull_time_stop': 142, 'bull_use_sma': True, 'bull_use_ema': False, 'bull_use_atr': False, 'bull_use_adx': True, 'bull_use_spike': True, 'bull_rsi_required': True, 'bear_strategy': 'mean_reversion', 'bear_bb_std_mult': 2.858029552990055, 'bear_rsi_os': 55, 'bear_rsi_ob': 48, 'bear_adx_thresh': 27.560640157024686, 'bear_atr_min_pct': 0.006580679891500578, 'bear_atr_max_pct': 0.014630928212295561, 'bear_tp_mult': 2.067205757672041, 'bear_tsl_mult': 0.5903666546487858, 'bear_time_stop': 20, 'bear_use_sma': False, 'bear_use_ema': False, 'bear_use_atr': False, 'bear_use_adx': False, 'bear_use_spike': False, 'bear_rsi_required': True, 'sideways_strategy': 'breakout', 'sideways_bb_std_mult': 0.5610106144910895, 'sideways_rsi_os': 40, 'sideways_rsi_ob': 53, 'sideways_adx_thresh': 5.394150898180349, 'sideways_atr_min_pct': 0.009981535878199471, 'sideways_atr_max_pct': 0.06962184157844614, 'sideways_tp_mult': 1.6316855520130353, 'sideways_tsl_mult': 0.6777796647006616, 'sideways_time_stop': 127, 'sideways_use_sma': True, 'sideways_use_ema': True, 'sideways_use_atr': True, 'sideways_use_adx': True, 'sideways_use_spike': True, 'sideways_rsi_required': True}.
[I 2025-08-31 02:54:03,670] Trial 700 finished with values: [-1000000000.0, 1000000000.0] and parameters: {'p_sma': 11, 'p_std': 52, 'p_atr': 26, 'p_adx': 13, 'rsi_period': 41, 'ema1': 5, 'ema2': 52, 'slip_atr_k': 0.07289293906137004, 'slip_spread_k': 0.48695108624721506, 'spread_hl_frac': 0.002448587548540686, 'bb_std_mult': 1.1267159746399094, 'rsi_os': 8, 'rsi_ob': 66, 'vol_spike': 0.0408590089225586, 'adx_thresh': 15.235873153209972, 'atr_min_pct': 0.0023432955572062104, 'atr_max_pct': 0.11832399311320937, 'tp_mult': 2.8066764798137713, 'tsl_mult': 0.2812728642176041, 'strategy': 'mean_reversion', 'time_stop': 142, 'use_sma': True, 'use_atr': False, 'use_adx': True, 'use_ema': False, 'use_spike': True, 'rsi_required': True, 'edge_k': 0.5782928281462499, 'edge_cap': 0.12040601714314218, 'bull_strategy': 'breakout', 'bull_bb_std_mult': 2.6027937540484154, 'bull_rsi_os': 20, 'bull_rsi_ob': 52, 'bull_adx_thresh': 34.433209063847215, 'bull_atr_min_pct': 0.018642370739948698, 'bull_atr_max_pct': 0.13856466229606718, 'bull_tp_mult': 2.0303862899565366, 'bull_tsl_mult': 0.22910685075458492, 'bull_time_stop': 143, 'bull_use_sma': True, 'bull_use_ema': False, 'bull_use_atr': False, 'bull_use_adx': False, 'bull_use_spike': True, 'bull_rsi_required': True, 'bear_strategy': 'mean_reversion', 'bear_bb_std_mult': 2.9263500259962765, 'bear_rsi_os': 17, 'bear_rsi_ob': 87, 'bear_adx_thresh': 5.008848068578915, 'bear_atr_min_pct': 0.02324919240688847, 'bear_atr_max_pct': 0.012639741205718154, 'bear_tp_mult': 2.1761294853840614, 'bear_tsl_mult': 0.5099283391774949, 'bear_time_stop': 23, 'bear_use_sma': False, 'bear_use_ema': True, 'bear_use_atr': False, 'bear_use_adx': False, 'bear_use_spike': False, 'bear_rsi_required': True, 'sideways_strategy': 'breakout', 'sideways_bb_std_mult': 3.3991627600932492, 'sideways_rsi_os': 31, 'sideways_rsi_ob': 95, 'sideways_adx_thresh': 18.892824901419086, 'sideways_atr_min_pct': 0.02637116333133476, 'sideways_atr_max_pct': 0.05501557690862257, 'sideways_tp_mult': 2.400493227371837, 'sideways_tsl_mult': 0.6841014653472783, 'sideways_time_stop': 214, 'sideways_use_sma': True, 'sideways_use_ema': True, 'sideways_use_atr': False, 'sideways_use_adx': True, 'sideways_use_spike': True, 'sideways_rsi_required': False}.
[I 2025-08-31 02:54:42,786] Trial 704 finished with values: [-1000000000.0, 1000000000.0] and parameters: {'p_sma': 58, 'p_std': 28, 'p_atr': 26, 'p_adx': 22, 'rsi_period': 72, 'ema1': 19, 'ema2': 14, 'slip_atr_k': 0.06184065212187617, 'slip_spread_k': 0.17200878942176015, 'spread_hl_frac': 0.0025384044398769033, 'bb_std_mult': 1.1308841394460045, 'rsi_os': 39, 'rsi_ob': 90, 'vol_spike': 0.18663639147041122, 'adx_thresh': 18.610324212662242, 'atr_min_pct': 0.008327257760980221, 'atr_max_pct': 0.11872831345973948, 'tp_mult': 1.7889013424773013, 'tsl_mult': 0.5370980887136547, 'strategy': 'mean_reversion', 'time_stop': 108, 'use_sma': True, 'use_atr': False, 'use_adx': False, 'use_ema': False, 'use_spike': False, 'rsi_required': True, 'edge_k': 1.196863176133953, 'edge_cap': 0.9790871860796118, 'bull_strategy': 'breakout', 'bull_bb_std_mult': 1.9946866594638188, 'bull_rsi_os': 20, 'bull_rsi_ob': 66, 'bull_adx_thresh': 5.567274340035721, 'bull_atr_min_pct': 0.023168992531779425, 'bull_atr_max_pct': 0.10840422206721642, 'bull_tp_mult': 2.6629748012623153, 'bull_tsl_mult': 0.2879963260621842, 'bull_time_stop': 142, 'bull_use_sma': True, 'bull_use_ema': False, 'bull_use_atr': False, 'bull_use_adx': True, 'bull_use_spike': True, 'bull_rsi_required': True, 'bear_strategy': 'mean_reversion', 'bear_bb_std_mult': 1.2794507823342793, 'bear_rsi_os': 17, 'bear_rsi_ob': 47, 'bear_adx_thresh': 5.0246378041128, 'bear_atr_min_pct': 0.006665053372091157, 'bear_atr_max_pct': 0.1297724207499204, 'bear_tp_mult': 2.04414332681378, 'bear_tsl_mult': 0.45642170332040777, 'bear_time_stop': 23, 'bear_use_sma': False, 'bear_use_ema': False, 'bear_use_atr': False, 'bear_use_adx': True, 'bear_use_spike': False, 'bear_rsi_required': True, 'sideways_strategy': 'breakout', 'sideways_bb_std_mult': 0.5461908731194324, 'sideways_rsi_os': 39, 'sideways_rsi_ob': 95, 'sideways_adx_thresh': 16.783436076672846, 'sideways_atr_min_pct': 0.009852947766081708, 'sideways_atr_max_pct': 0.058269552055717516, 'sideways_tp_mult': 1.6272160128500706, 'sideways_tsl_mult': 0.6815609127938403, 'sideways_time_stop': 216, 'sideways_use_sma': False, 'sideways_use_ema': False, 'sideways_use_atr': True, 'sideways_use_adx': False, 'sideways_use_spike': True, 'sideways_rsi_required': False}.
[I 2025-08-31 02:54:43,543] Trial 706 finished with values: [-1000000000.0, 1000000000.0] and parameters: {'p_sma': 57, 'p_std': 49, 'p_atr': 28, 'p_adx': 29, 'rsi_period': 49, 'ema1': 23, 'ema2': 36, 'slip_atr_k': 0.17941969154538212, 'slip_spread_k': 0.1129901867419723, 'spread_hl_frac': 0.0028318171170564005, 'bb_std_mult': 1.1038300225853503, 'rsi_os': 39, 'rsi_ob': 70, 'vol_spike': 0.18731344413383674, 'adx_thresh': 18.313557087557932, 'atr_min_pct': 0.008156721435415543, 'atr_max_pct': 0.024273677544507412, 'tp_mult': 1.81279921409001, 'tsl_mult': 0.49755232514406317, 'strategy': 'mean_reversion', 'time_stop': 109, 'use_sma': True, 'use_atr': True, 'use_adx': False, 'use_ema': False, 'use_spike': False, 'rsi_required': True, 'edge_k': 0.5302127573125895, 'edge_cap': 0.23153081197276293, 'bull_strategy': 'breakout', 'bull_bb_std_mult': 0.7674200733103902, 'bull_rsi_os': 48, 'bull_rsi_ob': 52, 'bull_adx_thresh': 5.765195860746826, 'bull_atr_min_pct': 0.006283142405936479, 'bull_atr_max_pct': 0.1260953544282334, 'bull_tp_mult': 1.629088354407885, 'bull_tsl_mult': 0.0016612792086159733, 'bull_time_stop': 228, 'bull_use_sma': True, 'bull_use_ema': True, 'bull_use_atr': False, 'bull_use_adx': True, 'bull_use_spike': True, 'bull_rsi_required': True, 'bear_strategy': 'mean_reversion', 'bear_bb_std_mult': 1.2891600784576758, 'bear_rsi_os': 15, 'bear_rsi_ob': 46, 'bear_adx_thresh': 5.015274069050125, 'bear_atr_min_pct': 0.0060044834711731115, 'bear_atr_max_pct': 0.010128166510722993, 'bear_tp_mult': 2.038415208606195, 'bear_tsl_mult': 0.4777732999551122, 'bear_time_stop': 24, 'bear_use_sma': False, 'bear_use_ema': False, 'bear_use_atr': False, 'bear_use_adx': True, 'bear_use_spike': False, 'bear_rsi_required': True, 'sideways_strategy': 'breakout', 'sideways_bb_std_mult': 0.5481378586052337, 'sideways_rsi_os': 40, 'sideways_rsi_ob': 95, 'sideways_adx_thresh': 9.654908098254339, 'sideways_atr_min_pct': 0.026974357706811003, 'sideways_atr_max_pct': 0.05773227549800847, 'sideways_tp_mult': 1.6811228782200949, 'sideways_tsl_mult': 0.4679650527650846, 'sideways_time_stop': 84, 'sideways_use_sma': False, 'sideways_use_ema': False, 'sideways_use_atr': False, 'sideways_use_adx': False, 'sideways_use_spike': True, 'sideways_rsi_required': False}.
[I 2025-08-31 02:54:43,881] Trial 707 finished with values: [-1000000000.0, 1000000000.0] and parameters: {'p_sma': 57, 'p_std': 49, 'p_atr': 28, 'p_adx': 18, 'rsi_period': 48, 'ema1': 12, 'ema2': 36, 'slip_atr_k': 0.1799230982741468, 'slip_spread_k': 0.10632349096119581, 'spread_hl_frac': 0.04566764042395553, 'bb_std_mult': 1.5758822820548222, 'rsi_os': 23, 'rsi_ob': 81, 'vol_spike': 0.14602525706511216, 'adx_thresh': 18.341165340257774, 'atr_min_pct': 0.007956720180748937, 'atr_max_pct': 0.0249687072751998, 'tp_mult': 1.7691760675637604, 'tsl_mult': 0.500783070487581, 'strategy': 'mean_reversion', 'time_stop': 111, 'use_sma': True, 'use_atr': True, 'use_adx': False, 'use_ema': False, 'use_spike': False, 'rsi_required': True, 'edge_k': 0.5187395398162078, 'edge_cap': 0.9800979676674678, 'bull_strategy': 'breakout', 'bull_bb_std_mult': 2.4408379452942186, 'bull_rsi_os': 6, 'bull_rsi_ob': 66, 'bull_adx_thresh': 6.0557792876228325, 'bull_atr_min_pct': 0.017473736102987143, 'bull_atr_max_pct': 0.14702390644521218, 'bull_tp_mult': 2.3816830448975743, 'bull_tsl_mult': 0.2945023367554005, 'bull_time_stop': 287, 'bull_use_sma': True, 'bull_use_ema': True, 'bull_use_atr': False, 'bull_use_adx': True, 'bull_use_spike': True, 'bull_rsi_required': True, 'bear_strategy': 'mean_reversion', 'bear_bb_std_mult': 1.284472148677942, 'bear_rsi_os': 44, 'bear_rsi_ob': 46, 'bear_adx_thresh': 22.619355911742364, 'bear_atr_min_pct': 0.01212787507542514, 'bear_atr_max_pct': 0.018978900574689234, 'bear_tp_mult': 2.029151877558121, 'bear_tsl_mult': 0.2542161734748882, 'bear_time_stop': 273, 'bear_use_sma': False, 'bear_use_ema': False, 'bear_use_atr': False, 'bear_use_adx': True, 'bear_use_spike': False, 'bear_rsi_required': True, 'sideways_strategy': 'breakout', 'sideways_bb_std_mult': 0.8786519640391837, 'sideways_rsi_os': 39, 'sideways_rsi_ob': 93, 'sideways_adx_thresh': 9.66069095387692, 'sideways_atr_min_pct': 0.029433341222111557, 'sideways_atr_max_pct': 0.05801472235312148, 'sideways_tp_mult': 1.6846431607494639, 'sideways_tsl_mult': 0.6386627038027187, 'sideways_time_stop': 200, 'sideways_use_sma': False, 'sideways_use_ema': False, 'sideways_use_atr': False, 'sideways_use_adx': False, 'sideways_use_spike': True, 'sideways_rsi_required': False}.
[I 2025-08-31 02:54:44,320] Trial 705 finished with values: [-1000000000.0, 1000000000.0] and parameters: {'p_sma': 56, 'p_std': 49, 'p_atr': 28, 'p_adx': 29, 'rsi_period': 50, 'ema1': 6, 'ema2': 51, 'slip_atr_k': 0.061865272745870656, 'slip_spread_k': 0.11100026744434953, 'spread_hl_frac': 0.0025703026575890735, 'bb_std_mult': 1.5918360758014962, 'rsi_os': 23, 'rsi_ob': 67, 'vol_spike': 0.1850970909259824, 'adx_thresh': 21.2774510459438, 'atr_min_pct': 0.019775725243790232, 'atr_max_pct': 0.024849363914705998, 'tp_mult': 1.7686029067052673, 'tsl_mult': 0.5354119808515387, 'strategy': 'mean_reversion', 'time_stop': 191, 'use_sma': True, 'use_atr': False, 'use_adx': False, 'use_ema': False, 'use_spike': False, 'rsi_required': True, 'edge_k': 1.6912136575348362, 'edge_cap': 0.09836705084226374, 'bull_strategy': 'breakout', 'bull_bb_std_mult': 2.0109882854320245, 'bull_rsi_os': 6, 'bull_rsi_ob': 51, 'bull_adx_thresh': 5.880094659834276, 'bull_atr_min_pct': 0.028163364445843324, 'bull_atr_max_pct': 0.1453786822088598, 'bull_tp_mult': 2.3743302211791666, 'bull_tsl_mult': 0.11919176973372492, 'bull_time_stop': 264, 'bull_use_sma': True, 'bull_use_ema': True, 'bull_use_atr': False, 'bull_use_adx': True, 'bull_use_spike': True, 'bull_rsi_required': True, 'bear_strategy': 'mean_reversion', 'bear_bb_std_mult': 1.275160048676295, 'bear_rsi_os': 15, 'bear_rsi_ob': 87, 'bear_adx_thresh': 17.283294571065042, 'bear_atr_min_pct': 0.02388739825449014, 'bear_atr_max_pct': 0.014947109895072419, 'bear_tp_mult': 2.0468063502648253, 'bear_tsl_mult': 0.5943815365928607, 'bear_time_stop': 24, 'bear_use_sma': False, 'bear_use_ema': False, 'bear_use_atr': False, 'bear_use_adx': True, 'bear_use_spike': False, 'bear_rsi_required': True, 'sideways_strategy': 'breakout', 'sideways_bb_std_mult': 0.8528203919218573, 'sideways_rsi_os': 39, 'sideways_rsi_ob': 95, 'sideways_adx_thresh': 9.788994068123854, 'sideways_atr_min_pct': 0.02715682262899117, 'sideways_atr_max_pct': 0.058511278553728695, 'sideways_tp_mult': 2.411517733776074, 'sideways_tsl_mult': 0.630835489382906, 'sideways_time_stop': 214, 'sideways_use_sma': True, 'sideways_use_ema': True, 'sideways_use_atr': True, 'sideways_use_adx': False, 'sideways_use_spike': True, 'sideways_rsi_required': False}.
[I 2025-08-31 02:55:19,259] Trial 711 finished with values: [-1000000000.0, 1000000000.0] and parameters: {'p_sma': 7, 'p_std': 51, 'p_atr': 27, 'p_adx': 20, 'rsi_period': 75, 'ema1': 6, 'ema2': 41, 'slip_atr_k': 0.0940063540122864, 'slip_spread_k': 0.16040896422166673, 'spread_hl_frac': 0.04123270713431748, 'bb_std_mult': 1.7455150551218628, 'rsi_os': 37, 'rsi_ob': 51, 'vol_spike': 0.20335128048582052, 'adx_thresh': 24.133696554854122, 'atr_min_pct': 0.008929934101616532, 'atr_max_pct': 0.12175815084580105, 'tp_mult': 2.030278799497804, 'tsl_mult': 0.8599077124455998, 'strategy': 'mean_reversion', 'time_stop': 94, 'use_sma': False, 'use_atr': False, 'use_adx': False, 'use_ema': False, 'use_spike': False, 'rsi_required': True, 'edge_k': 0.5731517423964912, 'edge_cap': 0.6821028621587049, 'bull_strategy': 'breakout', 'bull_bb_std_mult': 2.3007188670412333, 'bull_rsi_os': 10, 'bull_rsi_ob': 50, 'bull_adx_thresh': 6.992376437832424, 'bull_atr_min_pct': 0.013698446449453977, 'bull_atr_max_pct': 0.015221143038472426, 'bull_tp_mult': 2.1965531424097637, 'bull_tsl_mult': 0.03409214620886164, 'bull_time_stop': 59, 'bull_use_sma': True, 'bull_use_ema': False, 'bull_use_atr': False, 'bull_use_adx': True, 'bull_use_spike': True, 'bull_rsi_required': True, 'bear_strategy': 'mean_reversion', 'bear_bb_std_mult': 1.3511668494980817, 'bear_rsi_os': 18, 'bear_rsi_ob': 45, 'bear_adx_thresh': 12.31788778891227, 'bear_atr_min_pct': 0.027139850962630413, 'bear_atr_max_pct': 0.14740523536035227, 'bear_tp_mult': 2.681206501033853, 'bear_tsl_mult': 0.5573846568566921, 'bear_time_stop': 5, 'bear_use_sma': False, 'bear_use_ema': False, 'bear_use_atr': False, 'bear_use_adx': True, 'bear_use_spike': False, 'bear_rsi_required': True, 'sideways_strategy': 'breakout', 'sideways_bb_std_mult': 2.9692465846199356, 'sideways_rsi_os': 41, 'sideways_rsi_ob': 92, 'sideways_adx_thresh': 8.176342793480309, 'sideways_atr_min_pct': 0.01866249775411595, 'sideways_atr_max_pct': 0.013109108867486494, 'sideways_tp_mult': 1.7283883915886364, 'sideways_tsl_mult': 0.3565572172138227, 'sideways_time_stop': 26, 'sideways_use_sma': True, 'sideways_use_ema': False, 'sideways_use_atr': False, 'sideways_use_adx': False, 'sideways_use_spike': True, 'sideways_rsi_required': False}.
[I 2025-08-31 02:55:19,774] Trial 708 finished with values: [-1000000000.0, 1000000000.0] and parameters: {'p_sma': 7, 'p_std': 13, 'p_atr': 15, 'p_adx': 18, 'rsi_period': 49, 'ema1': 12, 'ema2': 47, 'slip_atr_k': 0.09291200372804327, 'slip_spread_k': 0.5328945921629873, 'spread_hl_frac': 0.03973011420024554, 'bb_std_mult': 1.5796248786459839, 'rsi_os': 44, 'rsi_ob': 70, 'vol_spike': 0.17964888793207448, 'adx_thresh': 21.16935899724261, 'atr_min_pct': 0.007852517686316604, 'atr_max_pct': 0.12127303916063648, 'tp_mult': 2.27950864998974, 'tsl_mult': 0.5051729305751766, 'strategy': 'mean_reversion', 'time_stop': 102, 'use_sma': True, 'use_atr': True, 'use_adx': False, 'use_ema': False, 'use_spike': False, 'rsi_required': True, 'edge_k': 0.5008315045697794, 'edge_cap': 0.22673374546008052, 'bull_strategy': 'breakout', 'bull_bb_std_mult': 2.444947576868648, 'bull_rsi_os': 48, 'bull_rsi_ob': 50, 'bull_adx_thresh': 5.874497747685725, 'bull_atr_min_pct': 0.013596400731539511, 'bull_atr_max_pct': 0.14643761879516945, 'bull_tp_mult': 2.3678009845816064, 'bull_tsl_mult': 0.8802768235747376, 'bull_time_stop': 32, 'bull_use_sma': True, 'bull_use_ema': True, 'bull_use_atr': False, 'bull_use_adx': True, 'bull_use_spike': True, 'bull_rsi_required': True, 'bear_strategy': 'mean_reversion', 'bear_bb_std_mult': 1.7910842103828826, 'bear_rsi_os': 35, 'bear_rsi_ob': 46, 'bear_adx_thresh': 6.643944702525709, 'bear_atr_min_pct': 0.022025422992909882, 'bear_atr_max_pct': 0.014669745748790153, 'bear_tp_mult': 2.0959024384055986, 'bear_tsl_mult': 0.5297953303519812, 'bear_time_stop': 217, 'bear_use_sma': False, 'bear_use_ema': False, 'bear_use_atr': False, 'bear_use_adx': True, 'bear_use_spike': False, 'bear_rsi_required': True, 'sideways_strategy': 'breakout', 'sideways_bb_std_mult': 3.054478884606006, 'sideways_rsi_os': 28, 'sideways_rsi_ob': 92, 'sideways_adx_thresh': 19.89274682132114, 'sideways_atr_min_pct': 0.029416676017533654, 'sideways_atr_max_pct': 0.08534595807963802, 'sideways_tp_mult': 1.6809426121849433, 'sideways_tsl_mult': 0.6363051593265006, 'sideways_time_stop': 288, 'sideways_use_sma': True, 'sideways_use_ema': False, 'sideways_use_atr': False, 'sideways_use_adx': False, 'sideways_use_spike': True, 'sideways_rsi_required': False}.
[I 2025-08-31 02:55:19,797] Trial 710 finished with values: [-0.049636700076196916, 0.04958738118614878] and parameters: {'p_sma': 51, 'p_std': 51, 'p_atr': 27, 'p_adx': 20, 'rsi_period': 75, 'ema1': 6, 'ema2': 29, 'slip_atr_k': 0.09314032535961408, 'slip_spread_k': 0.16402048795146837, 'spread_hl_frac': 0.004511213882726727, 'bb_std_mult': 3.2295013914409063, 'rsi_os': 26, 'rsi_ob': 69, 'vol_spike': 0.24903656102957727, 'adx_thresh': 20.88155511745764, 'atr_min_pct': 0.008728251103403684, 'atr_max_pct': 0.12304842577375273, 'tp_mult': 2.2716873655040133, 'tsl_mult': 0.2412487608988628, 'strategy': 'mean_reversion', 'time_stop': 284, 'use_sma': False, 'use_atr': False, 'use_adx': False, 'use_ema': False, 'use_spike': False, 'rsi_required': True, 'edge_k': 0.6432806590561847, 'edge_cap': 0.44938270632414024, 'bull_strategy': 'breakout', 'bull_bb_std_mult': 1.400333326976801, 'bull_rsi_os': 49, 'bull_rsi_ob': 50, 'bull_adx_thresh': 7.151607771713273, 'bull_atr_min_pct': 0.007325254881894707, 'bull_atr_max_pct': 0.14576468146512025, 'bull_tp_mult': 2.2691353298338623, 'bull_tsl_mult': 0.8757414949486609, 'bull_time_stop': 54, 'bull_use_sma': True, 'bull_use_ema': False, 'bull_use_atr': False, 'bull_use_adx': True, 'bull_use_spike': True, 'bull_rsi_required': True, 'bear_strategy': 'mean_reversion', 'bear_bb_std_mult': 1.3487903166154167, 'bear_rsi_os': 18, 'bear_rsi_ob': 93, 'bear_adx_thresh': 6.4249499066836675, 'bear_atr_min_pct': 0.027110192297462296, 'bear_atr_max_pct': 0.010020853673257364, 'bear_tp_mult': 2.1214939556897074, 'bear_tsl_mult': 0.5298861919400792, 'bear_time_stop': 5, 'bear_use_sma': False, 'bear_use_ema': False, 'bear_use_atr': False, 'bear_use_adx': True, 'bear_use_spike': False, 'bear_rsi_required': True, 'sideways_strategy': 'breakout', 'sideways_bb_std_mult': 3.0312408947165066, 'sideways_rsi_os': 41, 'sideways_rsi_ob': 92, 'sideways_adx_thresh': 8.221425210135067, 'sideways_atr_min_pct': 3.896736210208529e-05, 'sideways_atr_max_pct': 0.08688356265521041, 'sideways_tp_mult': 1.7227898687305383, 'sideways_tsl_mult': 0.3610545687404988, 'sideways_time_stop': 14, 'sideways_use_sma': True, 'sideways_use_ema': False, 'sideways_use_atr': False, 'sideways_use_adx': False, 'sideways_use_spike': True, 'sideways_rsi_required': False}.
