[I 2025-08-31 02:44:19,197] Trial 633 finished with values: [-1000000000.0, 1000000000.0] and parameters: {'p_sma': 41, 'p_std': 52, 'p_atr': 10, 'p_adx': 21, 'rsi_period': 84, 'ema1': 5, 'ema2': 32, 'slip_atr_k': 0.17256836543560491, 'slip_spread_k': 0.032289257543944516, 'spread_hl_frac': 0.0005695848599268484, 'bb_std_mult': 1.7898295801950754, 'rsi_os': 36, 'rsi_ob': 70, 'vol_spike': 0.169620441434564, 'adx_thresh': 21.551180320272838, 'atr_min_pct': 0.0074162070662238105, 'atr_max_pct': 0.12988056060578926, 'tp_mult': 1.2563547364448886, 'tsl_mult': 0.3170678045382514, 'strategy': 'mean_reversion', 'time_stop': 113, 'use_sma': True, 'use_atr': False, 'use_adx': False, 'use_ema': False, 'use_spike': False, 'rsi_required': True, 'edge_k': 1.5142527105355759, 'edge_cap': 0.13574625249553546, 'bull_strategy': 'breakout', 'bull_bb_std_mult': 1.0063229568804783, 'bull_rsi_os': 52, 'bull_rsi_ob': 84, 'bull_adx_thresh': 5.655969826244059, 'bull_atr_min_pct': 0.015456590275641915, 'bull_atr_max_pct': 0.13479507755496956, 'bull_tp_mult': 2.215392117519972, 'bull_tsl_mult': 0.8798009056723222, 'bull_time_stop': 138, 'bull_use_sma': True, 'bull_use_ema': True, 'bull_use_atr': False, 'bull_use_adx': False, 'bull_use_spike': True, 'bull_rsi_required': True, 'bear_strategy': 'mean_reversion', 'bear_bb_std_mult': 1.4768953448685422, 'bear_rsi_os': 14, 'bear_rsi_ob': 54, 'bear_adx_thresh': 6.401411958452053, 'bear_atr_min_pct': 0.005837626241592588, 'bear_atr_max_pct': 0.05878631745919011, 'bear_tp_mult': 2.0018610982203096, 'bear_tsl_mult': 0.5670173863227016, 'bear_time_stop': 5, 'bear_use_sma': False, 'bear_use_ema': False, 'bear_use_atr': False, 'bear_use_adx': True, 'bear_use_spike': False, 'bear_rsi_required': True, 'sideways_strategy': 'breakout', 'sideways_bb_std_mult': 3.2797433640800144, 'sideways_rsi_os': 36, 'sideways_rsi_ob': 49, 'sideways_adx_thresh': 18.192199356828073, 'sideways_atr_min_pct': 0.026893226062993606, 'sideways_atr_max_pct': 0.05465462051244081, 'sideways_tp_mult': 1.6867755926825978, 'sideways_tsl_mult': 0.6032413143350771, 'sideways_time_stop': 194, 'sideways_use_sma': True, 'sideways_use_ema': False, 'sideways_use_atr': True, 'sideways_use_adx': False, 'sideways_use_spike': True, 'sideways_rsi_required': True}.
[I 2025-08-31 02:44:19,485] Trial 630 finished with values: [-1000000000.0, 1000000000.0] and parameters: {'p_sma': 51, 'p_std': 52, 'p_atr': 27, 'p_adx': 18, 'rsi_period': 47, 'ema1': 5, 'ema2': 56, 'slip_atr_k': 0.17357489348194713, 'slip_spread_k': 0.13432914175745303, 'spread_hl_frac': 0.00019932860062768466, 'bb_std_mult': 1.7182750075883346, 'rsi_os': 39, 'rsi_ob': 70, 'vol_spike': 0.13531150663717298, 'adx_thresh': 21.619340773770112, 'atr_min_pct': 0.016333941868382853, 'atr_max_pct': 0.10925811768029806, 'tp_mult': 2.1501354738427043, 'tsl_mult': 0.2275450522575851, 'strategy': 'mean_reversion', 'time_stop': 217, 'use_sma': True, 'use_atr': False, 'use_adx': False, 'use_ema': False, 'use_spike': False, 'rsi_required': True, 'edge_k': 0.5482120287485094, 'edge_cap': 0.1367568293324562, 'bull_strategy': 'breakout', 'bull_bb_std_mult': 3.488556127384153, 'bull_rsi_os': 9, 'bull_rsi_ob': 61, 'bull_adx_thresh': 6.1887647169116216, 'bull_atr_min_pct': 0.015512892398079611, 'bull_atr_max_pct': 0.14706499450909563, 'bull_tp_mult': 2.2937659036060514, 'bull_tsl_mult': 0.2497807896740898, 'bull_time_stop': 148, 'bull_use_sma': True, 'bull_use_ema': False, 'bull_use_atr': False, 'bull_use_adx': True, 'bull_use_spike': True, 'bull_rsi_required': True, 'bear_strategy': 'mean_reversion', 'bear_bb_std_mult': 1.4125008424354737, 'bear_rsi_os': 34, 'bear_rsi_ob': 46, 'bear_adx_thresh': 5.581161774520372, 'bear_atr_min_pct': 0.0057744587712838516, 'bear_atr_max_pct': 0.12595163219376798, 'bear_tp_mult': 2.0011962983935456, 'bear_tsl_mult': 0.9772349219504681, 'bear_time_stop': 184, 'bear_use_sma': False, 'bear_use_ema': False, 'bear_use_atr': False, 'bear_use_adx': True, 'bear_use_spike': False, 'bear_rsi_required': True, 'sideways_strategy': 'breakout', 'sideways_bb_std_mult': 2.5827636175034914, 'sideways_rsi_os': 8, 'sideways_rsi_ob': 74, 'sideways_adx_thresh': 10.08051246822763, 'sideways_atr_min_pct': 0.02554258599718376, 'sideways_atr_max_pct': 0.054183797617594495, 'sideways_tp_mult': 1.6804130103841428, 'sideways_tsl_mult': 0.5966764923290688, 'sideways_time_stop': 192, 'sideways_use_sma': True, 'sideways_use_ema': False, 'sideways_use_atr': False, 'sideways_use_adx': False, 'sideways_use_spike': True, 'sideways_rsi_required': True}.
[I 2025-08-31 02:44:19,816] Trial 632 finished with values: [-1000000000.0, 1000000000.0] and parameters: {'p_sma': 24, 'p_std': 52, 'p_atr': 10, 'p_adx': 22, 'rsi_period': 49, 'ema1': 5, 'ema2': 10, 'slip_atr_k': 0.07138796404664013, 'slip_spread_k': 0.6337460349534629, 'spread_hl_frac': 0.0003762437964165688, 'bb_std_mult': 1.7979494141511303, 'rsi_os': 41, 'rsi_ob': 70, 'vol_spike': 0.16954263104066192, 'adx_thresh': 21.62919269712614, 'atr_min_pct': 0.010303883747463667, 'atr_max_pct': 0.10363245314528732, 'tp_mult': 1.4522942713289857, 'tsl_mult': 0.6865144622639001, 'strategy': 'mean_reversion', 'time_stop': 111, 'use_sma': True, 'use_atr': False, 'use_adx': False, 'use_ema': False, 'use_spike': False, 'rsi_required': True, 'edge_k': 0.48934265426827295, 'edge_cap': 0.37603827882680596, 'bull_strategy': 'breakout', 'bull_bb_std_mult': 2.321995902010857, 'bull_rsi_os': 47, 'bull_rsi_ob': 84, 'bull_adx_thresh': 7.060481932112841, 'bull_atr_min_pct': 0.003363341579804141, 'bull_atr_max_pct': 0.13390301466132268, 'bull_tp_mult': 2.226564524421043, 'bull_tsl_mult': 0.255894571177565, 'bull_time_stop': 137, 'bull_use_sma': True, 'bull_use_ema': True, 'bull_use_atr': False, 'bull_use_adx': False, 'bull_use_spike': True, 'bull_rsi_required': True, 'bear_strategy': 'mean_reversion', 'bear_bb_std_mult': 1.4390117711506536, 'bear_rsi_os': 16, 'bear_rsi_ob': 62, 'bear_adx_thresh': 5.05414278959143, 'bear_atr_min_pct': 0.006049673173342237, 'bear_atr_max_pct': 0.059474051812751304, 'bear_tp_mult': 2.0688852092890317, 'bear_tsl_mult': 0.5979748222341497, 'bear_time_stop': 256, 'bear_use_sma': False, 'bear_use_ema': False, 'bear_use_atr': False, 'bear_use_adx': True, 'bear_use_spike': False, 'bear_rsi_required': True, 'sideways_strategy': 'breakout', 'sideways_bb_std_mult': 0.6743614286433025, 'sideways_rsi_os': 40, 'sideways_rsi_ob': 58, 'sideways_adx_thresh': 10.12623202287409, 'sideways_atr_min_pct': 0.027098230746706697, 'sideways_atr_max_pct': 0.05383298389251392, 'sideways_tp_mult': 2.8244940897990425, 'sideways_tsl_mult': 0.6049418728304243, 'sideways_time_stop': 82, 'sideways_use_sma': True, 'sideways_use_ema': False, 'sideways_use_atr': True, 'sideways_use_adx': False, 'sideways_use_spike': True, 'sideways_rsi_required': True}.
[I 2025-08-31 02:44:19,916] Trial 631 finished with values: [-1000000000.0, 1000000000.0] and parameters: {'p_sma': 51, 'p_std': 54, 'p_atr': 10, 'p_adx': 20, 'rsi_period': 69, 'ema1': 5, 'ema2': 51, 'slip_atr_k': 0.17307888750393027, 'slip_spread_k': 0.13980834682774557, 'spread_hl_frac': 0.0003392548529472215, 'bb_std_mult': 1.7241490359686333, 'rsi_os': 35, 'rsi_ob': 70, 'vol_spike': 0.08298433888106586, 'adx_thresh': 21.568790495932067, 'atr_min_pct': 0.010318620197068907, 'atr_max_pct': 0.11971709252378411, 'tp_mult': 1.232098567075601, 'tsl_mult': 0.7404224591492511, 'strategy': 'mean_reversion', 'time_stop': 113, 'use_sma': True, 'use_atr': False, 'use_adx': False, 'use_ema': False, 'use_spike': False, 'rsi_required': True, 'edge_k': 1.4227290256533185, 'edge_cap': 0.13683306257802566, 'bull_strategy': 'breakout', 'bull_bb_std_mult': 1.0175057146807263, 'bull_rsi_os': 46, 'bull_rsi_ob': 64, 'bull_adx_thresh': 6.003163936032173, 'bull_atr_min_pct': 0.0031921360557184714, 'bull_atr_max_pct': 0.14883007272686644, 'bull_tp_mult': 2.226609392263922, 'bull_tsl_mult': 0.24523053565726996, 'bull_time_stop': 16, 'bull_use_sma': True, 'bull_use_ema': True, 'bull_use_atr': False, 'bull_use_adx': True, 'bull_use_spike': True, 'bull_rsi_required': True, 'bear_strategy': 'mean_reversion', 'bear_bb_std_mult': 1.4776359366143668, 'bear_rsi_os': 52, 'bear_rsi_ob': 56, 'bear_adx_thresh': 20.902419254525817, 'bear_atr_min_pct': 0.022632992412564314, 'bear_atr_max_pct': 0.1492425014457331, 'bear_tp_mult': 2.0585829681545884, 'bear_tsl_mult': 0.5886081328516723, 'bear_time_stop': 257, 'bear_use_sma': False, 'bear_use_ema': False, 'bear_use_atr': False, 'bear_use_adx': True, 'bear_use_spike': False, 'bear_rsi_required': True, 'sideways_strategy': 'breakout', 'sideways_bb_std_mult': 0.5702196363236643, 'sideways_rsi_os': 40, 'sideways_rsi_ob': 92, 'sideways_adx_thresh': 32.44510800745763, 'sideways_atr_min_pct': 0.011445443336031036, 'sideways_atr_max_pct': 0.0670336154057792, 'sideways_tp_mult': 2.2073758085673223, 'sideways_tsl_mult': 0.6020464545761977, 'sideways_time_stop': 199, 'sideways_use_sma': True, 'sideways_use_ema': False, 'sideways_use_atr': True, 'sideways_use_adx': False, 'sideways_use_spike': True, 'sideways_rsi_required': True}.
[I 2025-08-31 02:44:53,908] Trial 636 finished with values: [-1000000000.0, 1000000000.0] and parameters: {'p_sma': 54, 'p_std': 23, 'p_atr': 29, 'p_adx': 24, 'rsi_period': 66, 'ema1': 5, 'ema2': 37, 'slip_atr_k': 0.15017544455444695, 'slip_spread_k': 0.14951558044812066, 'spread_hl_frac': 0.0030533822517390995, 'bb_std_mult': 2.7504575220098944, 'rsi_os': 26, 'rsi_ob': 52, 'vol_spike': 0.18515759869448659, 'adx_thresh': 24.66845084686475, 'atr_min_pct': 0.019212106018909644, 'atr_max_pct': 0.12105130593019688, 'tp_mult': 2.0947226035887385, 'tsl_mult': 0.3921994428481433, 'strategy': 'mean_reversion', 'time_stop': 106, 'use_sma': True, 'use_atr': False, 'use_adx': False, 'use_ema': False, 'use_spike': False, 'rsi_required': True, 'edge_k': 0.09166668366289998, 'edge_cap': 0.16147561424049683, 'bull_strategy': 'breakout', 'bull_bb_std_mult': 2.4139286955192634, 'bull_rsi_os': 29, 'bull_rsi_ob': 81, 'bull_adx_thresh': 17.289519284525415, 'bull_atr_min_pct': 0.007166476082229686, 'bull_atr_max_pct': 0.10744437855109062, 'bull_tp_mult': 2.334925863983777, 'bull_tsl_mult': 0.9754031735275037, 'bull_time_stop': 73, 'bull_use_sma': True, 'bull_use_ema': False, 'bull_use_atr': False, 'bull_use_adx': True, 'bull_use_spike': True, 'bull_rsi_required': True, 'bear_strategy': 'mean_reversion', 'bear_bb_std_mult': 1.2063764239727444, 'bear_rsi_os': 17, 'bear_rsi_ob': 45, 'bear_adx_thresh': 20.849868385962115, 'bear_atr_min_pct': 0.02744236418249644, 'bear_atr_max_pct': 0.045531905693705306, 'bear_tp_mult': 2.406832234386239, 'bear_tsl_mult': 0.439150781589878, 'bear_time_stop': 277, 'bear_use_sma': False, 'bear_use_ema': False, 'bear_use_atr': False, 'bear_use_adx': True, 'bear_use_spike': False, 'bear_rsi_required': True, 'sideways_strategy': 'breakout', 'sideways_bb_std_mult': 0.8126110449212252, 'sideways_rsi_os': 40, 'sideways_rsi_ob': 77, 'sideways_adx_thresh': 7.234136851558228, 'sideways_atr_min_pct': 0.0043656826188751136, 'sideways_atr_max_pct': 0.06579335970751443, 'sideways_tp_mult': 1.7813983528188464, 'sideways_tsl_mult': 0.6886371751143147, 'sideways_time_stop': 222, 'sideways_use_sma': True, 'sideways_use_ema': False, 'sideways_use_atr': False, 'sideways_use_adx': False, 'sideways_use_spike': True, 'sideways_rsi_required': False}.
[I 2025-08-31 02:44:54,247] Trial 637 finished with values: [-1000000000.0, 1000000000.0] and parameters: {'p_sma': 54, 'p_std': 23, 'p_atr': 29, 'p_adx': 30, 'rsi_period': 66, 'ema1': 6, 'ema2': 24, 'slip_atr_k': 0.16414931845004285, 'slip_spread_k': 0.9733490614391183, 'spread_hl_frac': 0.003246392795397693, 'bb_std_mult': 2.7366490722302834, 'rsi_os': 37, 'rsi_ob': 68, 'vol_spike': 0.1870822342509449, 'adx_thresh': 23.173995076828962, 'atr_min_pct': 0.019182044409905688, 'atr_max_pct': 0.02087086993057735, 'tp_mult': 2.0994212024907712, 'tsl_mult': 0.60950148212899, 'strategy': 'mean_reversion', 'time_stop': 270, 'use_sma': True, 'use_atr': False, 'use_adx': False, 'use_ema': False, 'use_spike': False, 'rsi_required': True, 'edge_k': 0.515650874870089, 'edge_cap': 0.1593203329331646, 'bull_strategy': 'breakout', 'bull_bb_std_mult': 3.066085771034552, 'bull_rsi_os': 29, 'bull_rsi_ob': 54, 'bull_adx_thresh': 5.483483658169909, 'bull_atr_min_pct': 0.007541031119318481, 'bull_atr_max_pct': 0.05854358752819461, 'bull_tp_mult': 2.2659094295192976, 'bull_tsl_mult': 0.2750666784312324, 'bull_time_stop': 126, 'bull_use_sma': True, 'bull_use_ema': False, 'bull_use_atr': False, 'bull_use_adx': True, 'bull_use_spike': True, 'bull_rsi_required': True, 'bear_strategy': 'mean_reversion', 'bear_bb_std_mult': 1.2130494650945771, 'bear_rsi_os': 17, 'bear_rsi_ob': 45, 'bear_adx_thresh': 10.819428716081848, 'bear_atr_min_pct': 0.004944995162228995, 'bear_atr_max_pct': 0.014010375579189664, 'bear_tp_mult': 2.421604637520027, 'bear_tsl_mult': 0.5004872918202088, 'bear_time_stop': 279, 'bear_use_sma': False, 'bear_use_ema': False, 'bear_use_atr': False, 'bear_use_adx': True, 'bear_use_spike': True, 'bear_rsi_required': True, 'sideways_strategy': 'breakout', 'sideways_bb_std_mult': 3.2141788977499965, 'sideways_rsi_os': 38, 'sideways_rsi_ob': 93, 'sideways_adx_thresh': 16.91593147548219, 'sideways_atr_min_pct': 0.0276965239252151, 'sideways_atr_max_pct': 0.05127257179874103, 'sideways_tp_mult': 1.7677084831151963, 'sideways_tsl_mult': 0.384759151111284, 'sideways_time_stop': 205, 'sideways_use_sma': True, 'sideways_use_ema': False, 'sideways_use_atr': False, 'sideways_use_adx': False, 'sideways_use_spike': True, 'sideways_rsi_required': False}.
[I 2025-08-31 02:44:54,520] Trial 635 finished with values: [-1000000000.0, 1000000000.0] and parameters: {'p_sma': 55, 'p_std': 27, 'p_atr': 27, 'p_adx': 23, 'rsi_period': 40, 'ema1': 5, 'ema2': 37, 'slip_atr_k': 0.20593453567646913, 'slip_spread_k': 0.15499198502995282, 'spread_hl_frac': 0.0033277433231120286, 'bb_std_mult': 2.565212627821413, 'rsi_os': 37, 'rsi_ob': 86, 'vol_spike': 0.18444987798493415, 'adx_thresh': 20.54290116346961, 'atr_min_pct': 0.019396156726485307, 'atr_max_pct': 0.13996973321702003, 'tp_mult': 1.4608934198563768, 'tsl_mult': 0.7298095096729611, 'strategy': 'mean_reversion', 'time_stop': 107, 'use_sma': True, 'use_atr': False, 'use_adx': False, 'use_ema': False, 'use_spike': False, 'rsi_required': True, 'edge_k': 0.09149878853195192, 'edge_cap': 0.16682381908098448, 'bull_strategy': 'breakout', 'bull_bb_std_mult': 2.3873607092619498, 'bull_rsi_os': 47, 'bull_rsi_ob': 53, 'bull_adx_thresh': 7.468064311270609, 'bull_atr_min_pct': 0.003157877859175767, 'bull_atr_max_pct': 0.012519331047678148, 'bull_tp_mult': 2.2540501513068407, 'bull_tsl_mult': 0.10103805156706103, 'bull_time_stop': 133, 'bull_use_sma': True, 'bull_use_ema': True, 'bull_use_atr': False, 'bull_use_adx': True, 'bull_use_spike': True, 'bull_rsi_required': True, 'bear_strategy': 'mean_reversion', 'bear_bb_std_mult': 1.6986016985284869, 'bear_rsi_os': 17, 'bear_rsi_ob': 45, 'bear_adx_thresh': 10.696346432780606, 'bear_atr_min_pct': 0.007194868341901327, 'bear_atr_max_pct': 0.11615189960895869, 'bear_tp_mult': 1.7277325307414442, 'bear_tsl_mult': 0.4493491979064958, 'bear_time_stop': 212, 'bear_use_sma': False, 'bear_use_ema': False, 'bear_use_atr': False, 'bear_use_adx': True, 'bear_use_spike': False, 'bear_rsi_required': True, 'sideways_strategy': 'breakout', 'sideways_bb_std_mult': 0.5676613348038295, 'sideways_rsi_os': 33, 'sideways_rsi_ob': 92, 'sideways_adx_thresh': 7.058656611677932, 'sideways_atr_min_pct': 0.027814829128938276, 'sideways_atr_max_pct': 0.06558732830545569, 'sideways_tp_mult': 1.7694804014198156, 'sideways_tsl_mult': 0.24807107749334534, 'sideways_time_stop': 210, 'sideways_use_sma': True, 'sideways_use_ema': False, 'sideways_use_atr': True, 'sideways_use_adx': False, 'sideways_use_spike': True, 'sideways_rsi_required': False}.
[I 2025-08-31 02:44:54,658] Trial 634 finished with values: [-1000000000.0, 1000000000.0] and parameters: {'p_sma': 51, 'p_std': 50, 'p_atr': 27, 'p_adx': 22, 'rsi_period': 69, 'ema1': 24, 'ema2': 37, 'slip_atr_k': 0.1650384439446635, 'slip_spread_k': 0.1411208009989193, 'spread_hl_frac': 0.003618309910672612, 'bb_std_mult': 2.909966411604846, 'rsi_os': 8, 'rsi_ob': 52, 'vol_spike': 0.059596615803024375, 'adx_thresh': 20.802650900378623, 'atr_min_pct': 0.010126281738578838, 'atr_max_pct': 0.12025911049644454, 'tp_mult': 1.6748263828128631, 'tsl_mult': 0.7468193336696023, 'strategy': 'mean_reversion', 'time_stop': 110, 'use_sma': True, 'use_atr': False, 'use_adx': False, 'use_ema': False, 'use_spike': False, 'rsi_required': True, 'edge_k': 0.5181512979985302, 'edge_cap': 0.15947315479524965, 'bull_strategy': 'breakout', 'bull_bb_std_mult': 2.3379285317054097, 'bull_rsi_os': 29, 'bull_rsi_ob': 53, 'bull_adx_thresh': 5.029318024528817, 'bull_atr_min_pct': 0.028641403567278033, 'bull_atr_max_pct': 0.14740495543837884, 'bull_tp_mult': 2.2824953015363807, 'bull_tsl_mult': 0.25866522604835107, 'bull_time_stop': 136, 'bull_use_sma': True, 'bull_use_ema': True, 'bull_use_atr': False, 'bull_use_adx': True, 'bull_use_spike': True, 'bull_rsi_required': True, 'bear_strategy': 'mean_reversion', 'bear_bb_std_mult': 1.2090440123134423, 'bear_rsi_os': 17, 'bear_rsi_ob': 49, 'bear_adx_thresh': 5.662672741460618, 'bear_atr_min_pct': 0.004891662786625501, 'bear_atr_max_pct': 0.11333994165625091, 'bear_tp_mult': 1.73159968922247, 'bear_tsl_mult': 0.09530049712645217, 'bear_time_stop': 211, 'bear_use_sma': False, 'bear_use_ema': False, 'bear_use_atr': False, 'bear_use_adx': True, 'bear_use_spike': False, 'bear_rsi_required': True, 'sideways_strategy': 'breakout', 'sideways_bb_std_mult': 0.8086391728923457, 'sideways_rsi_os': 40, 'sideways_rsi_ob': 92, 'sideways_adx_thresh': 30.798217388717667, 'sideways_atr_min_pct': 0.003889426702155937, 'sideways_atr_max_pct': 0.05349643516460423, 'sideways_tp_mult': 1.7666867185366106, 'sideways_tsl_mult': 0.17774480938959686, 'sideways_time_stop': 192, 'sideways_use_sma': True, 'sideways_use_ema': False, 'sideways_use_atr': False, 'sideways_use_adx': False, 'sideways_use_spike': True, 'sideways_rsi_required': True}.
[I 2025-08-31 02:45:30,137] Trial 641 finished with values: [-1000000000.0, 1000000000.0] and parameters: {'p_sma': 6, 'p_std': 49, 'p_atr': 28, 'p_adx': 14, 'rsi_period': 71, 'ema1': 12, 'ema2': 35, 'slip_atr_k': 0.09678416436125258, 'slip_spread_k': 0.20023266939320847, 'spread_hl_frac': 0.03928856443536954, 'bb_std_mult': 0.8909746380965731, 'rsi_os': 19, 'rsi_ob': 55, 'vol_spike': 0.19542330049260986, 'adx_thresh': 32.01370028212723, 'atr_min_pct': 0.009215671499687427, 'atr_max_pct': 0.015359395206458015, 'tp_mult': 2.304167905087026, 'tsl_mult': 0.4395059436494855, 'strategy': 'mean_reversion', 'time_stop': 193, 'use_sma': False, 'use_atr': True, 'use_adx': False, 'use_ema': False, 'use_spike': True, 'rsi_required': True, 'edge_k': 1.5933331672423434, 'edge_cap': 0.28282862082115495, 'bull_strategy': 'mean_reversion', 'bull_bb_std_mult': 1.8788780199290667, 'bull_rsi_os': 33, 'bull_rsi_ob': 66, 'bull_adx_thresh': 6.520980978466757, 'bull_atr_min_pct': 0.022599678927273464, 'bull_atr_max_pct': 0.14212348567643887, 'bull_tp_mult': 1.189991711900679, 'bull_tsl_mult': 0.19241164887920914, 'bull_time_stop': 44, 'bull_use_sma': True, 'bull_use_ema': False, 'bull_use_atr': False, 'bull_use_adx': False, 'bull_use_spike': True, 'bull_rsi_required': True, 'bear_strategy': 'breakout', 'bear_bb_std_mult': 1.3250046190891767, 'bear_rsi_os': 27, 'bear_rsi_ob': 61, 'bear_adx_thresh': 5.052438127726053, 'bear_atr_min_pct': 0.006608806856364476, 'bear_atr_max_pct': 0.014127498595895346, 'bear_tp_mult': 2.2244134491348504, 'bear_tsl_mult': 0.5144863359974428, 'bear_time_stop': 196, 'bear_use_sma': False, 'bear_use_ema': True, 'bear_use_atr': False, 'bear_use_adx': True, 'bear_use_spike': True, 'bear_rsi_required': True, 'sideways_strategy': 'breakout', 'sideways_bb_std_mult': 2.4887737374982293, 'sideways_rsi_os': 19, 'sideways_rsi_ob': 95, 'sideways_adx_thresh': 8.705951867809103, 'sideways_atr_min_pct': 0.008195635650200286, 'sideways_atr_max_pct': 0.04240821732801372, 'sideways_tp_mult': 1.6098591286075512, 'sideways_tsl_mult': 0.6818062059313393, 'sideways_time_stop': 199, 'sideways_use_sma': False, 'sideways_use_ema': False, 'sideways_use_atr': False, 'sideways_use_adx': False, 'sideways_use_spike': True, 'sideways_rsi_required': False}.
