[I 2025-08-31 03:03:32,789] Trial 765 finished with values: [-1000000000.0, 1000000000.0] and parameters: {'p_sma': 54, 'p_std': 28, 'p_atr': 28, 'p_adx': 17, 'rsi_period': 68, 'ema1': 14, 'ema2': 12, 'slip_atr_k': 0.2422691234281842, 'slip_spread_k': 0.13842916728485416, 'spread_hl_frac': 0.04371196481183001, 'bb_std_mult': 1.6217860249704972, 'rsi_os': 33, 'rsi_ob': 88, 'vol_spike': 0.19516775061764338, 'adx_thresh': 29.634434882481457, 'atr_min_pct': 0.00857920934024753, 'atr_max_pct': 0.14214214611146891, 'tp_mult': 2.0706091520755274, 'tsl_mult': 0.8463439688001779, 'strategy': 'mean_reversion', 'time_stop': 106, 'use_sma': True, 'use_atr': False, 'use_adx': False, 'use_ema': False, 'use_spike': False, 'rsi_required': True, 'edge_k': 0.4494210806758887, 'edge_cap': 0.1239890634924074, 'bull_strategy': 'mean_reversion', 'bull_bb_std_mult': 2.208722750400432, 'bull_rsi_os': 55, 'bull_rsi_ob': 73, 'bull_adx_thresh': 9.3584550039158, 'bull_atr_min_pct': 0.0052583778378502725, 'bull_atr_max_pct': 0.1394566246579803, 'bull_tp_mult': 1.2950610980847506, 'bull_tsl_mult': 0.4308915832674757, 'bull_time_stop': 215, 'bull_use_sma': True, 'bull_use_ema': False, 'bull_use_atr': False, 'bull_use_adx': True, 'bull_use_spike': True, 'bull_rsi_required': True, 'bear_strategy': 'mean_reversion', 'bear_bb_std_mult': 1.1881309650353713, 'bear_rsi_os': 54, 'bear_rsi_ob': 55, 'bear_adx_thresh': 6.082407444575152, 'bear_atr_min_pct': 0.02071213122341266, 'bear_atr_max_pct': 0.01389543859411305, 'bear_tp_mult': 2.0641564326625126, 'bear_tsl_mult': 0.3877473790928125, 'bear_time_stop': 10, 'bear_use_sma': False, 'bear_use_ema': False, 'bear_use_atr': False, 'bear_use_adx': True, 'bear_use_spike': False, 'bear_rsi_required': True, 'sideways_strategy': 'breakout', 'sideways_bb_std_mult': 1.4048241178163847, 'sideways_rsi_os': 21, 'sideways_rsi_ob': 95, 'sideways_adx_thresh': 10.924127290783634, 'sideways_atr_min_pct': 0.013091632518510575, 'sideways_atr_max_pct': 0.05347921638662265, 'sideways_tp_mult': 2.751816425625564, 'sideways_tsl_mult': 0.558285222393843, 'sideways_time_stop': 199, 'sideways_use_sma': True, 'sideways_use_ema': True, 'sideways_use_atr': True, 'sideways_use_adx': False, 'sideways_use_spike': True, 'sideways_rsi_required': False}.
[I 2025-08-31 03:03:32,929] Trial 766 finished with values: [-1000000000.0, 1000000000.0] and parameters: {'p_sma': 55, 'p_std': 18, 'p_atr': 27, 'p_adx': 18, 'rsi_period': 68, 'ema1': 14, 'ema2': 49, 'slip_atr_k': 0.1320928878154604, 'slip_spread_k': 0.12262506534349202, 'spread_hl_frac': 0.0032055678626706652, 'bb_std_mult': 3.140643936732348, 'rsi_os': 29, 'rsi_ob': 89, 'vol_spike': 0.19772568339546157, 'adx_thresh': 15.395691865492939, 'atr_min_pct': 0.008598250590746578, 'atr_max_pct': 0.12210697708673894, 'tp_mult': 1.8414494422744023, 'tsl_mult': 0.38640324469031284, 'strategy': 'mean_reversion', 'time_stop': 106, 'use_sma': True, 'use_atr': True, 'use_adx': True, 'use_ema': False, 'use_spike': False, 'rsi_required': True, 'edge_k': 0.43982746715740284, 'edge_cap': 0.28860143022437124, 'bull_strategy': 'mean_reversion', 'bull_bb_std_mult': 2.1709199060881743, 'bull_rsi_os': 29, 'bull_rsi_ob': 61, 'bull_adx_thresh': 19.286589781450882, 'bull_atr_min_pct': 0.00955046886833013, 'bull_atr_max_pct': 0.12245289974689116, 'bull_tp_mult': 1.6369384951824335, 'bull_tsl_mult': 0.6938867228543305, 'bull_time_stop': 222, 'bull_use_sma': True, 'bull_use_ema': False, 'bull_use_atr': False, 'bull_use_adx': False, 'bull_use_spike': True, 'bull_rsi_required': True, 'bear_strategy': 'mean_reversion', 'bear_bb_std_mult': 2.0107916810921465, 'bear_rsi_os': 7, 'bear_rsi_ob': 49, 'bear_adx_thresh': 15.542636447974369, 'bear_atr_min_pct': 0.006093504392305251, 'bear_atr_max_pct': 0.05126989600227905, 'bear_tp_mult': 1.2205922648140717, 'bear_tsl_mult': 0.9684338198930451, 'bear_time_stop': 15, 'bear_use_sma': False, 'bear_use_ema': False, 'bear_use_atr': False, 'bear_use_adx': True, 'bear_use_spike': False, 'bear_rsi_required': True, 'sideways_strategy': 'breakout', 'sideways_bb_std_mult': 0.6515989882381412, 'sideways_rsi_os': 5, 'sideways_rsi_ob': 95, 'sideways_adx_thresh': 7.789179909202304, 'sideways_atr_min_pct': 0.003034516716480265, 'sideways_atr_max_pct': 0.053642631557111325, 'sideways_tp_mult': 2.3555416365628568, 'sideways_tsl_mult': 0.673084479537944, 'sideways_time_stop': 91, 'sideways_use_sma': False, 'sideways_use_ema': True, 'sideways_use_atr': True, 'sideways_use_adx': False, 'sideways_use_spike': True, 'sideways_rsi_required': False}.
[I 2025-08-31 03:04:06,175] Trial 770 finished with values: [-1000000000.0, 1000000000.0] and parameters: {'p_sma': 16, 'p_std': 14, 'p_atr': 10, 'p_adx': 23, 'rsi_period': 73, 'ema1': 10, 'ema2': 14, 'slip_atr_k': 0.07258215618594627, 'slip_spread_k': 0.20174276148906667, 'spread_hl_frac': 0.022942634126228746, 'bb_std_mult': 1.8155194037813083, 'rsi_os': 37, 'rsi_ob': 85, 'vol_spike': 0.28543121599436083, 'adx_thresh': 19.46507130673173, 'atr_min_pct': 0.006508690504257814, 'atr_max_pct': 0.11808218022718066, 'tp_mult': 2.952973085474513, 'tsl_mult': 0.9728200853460172, 'strategy': 'mean_reversion', 'time_stop': 146, 'use_sma': False, 'use_atr': True, 'use_adx': True, 'use_ema': False, 'use_spike': False, 'rsi_required': True, 'edge_k': 0.6326320140262816, 'edge_cap': 0.14248216187098547, 'bull_strategy': 'breakout', 'bull_bb_std_mult': 1.9546869126811115, 'bull_rsi_os': 41, 'bull_rsi_ob': 66, 'bull_adx_thresh': 6.535183123516171, 'bull_atr_min_pct': 0.006270202966558775, 'bull_atr_max_pct': 0.04948488203085072, 'bull_tp_mult': 2.276566758421698, 'bull_tsl_mult': 0.21228460888932277, 'bull_time_stop': 238, 'bull_use_sma': True, 'bull_use_ema': False, 'bull_use_atr': False, 'bull_use_adx': False, 'bull_use_spike': True, 'bull_rsi_required': True, 'bear_strategy': 'breakout', 'bear_bb_std_mult': 1.4563685988194026, 'bear_rsi_os': 16, 'bear_rsi_ob': 45, 'bear_adx_thresh': 5.621833728410501, 'bear_atr_min_pct': 0.007494304213433116, 'bear_atr_max_pct': 0.09985830737542534, 'bear_tp_mult': 2.026783676929507, 'bear_tsl_mult': 0.4990249132786228, 'bear_time_stop': 5, 'bear_use_sma': False, 'bear_use_ema': False, 'bear_use_atr': True, 'bear_use_adx': True, 'bear_use_spike': True, 'bear_rsi_required': True, 'sideways_strategy': 'breakout', 'sideways_bb_std_mult': 3.478156842910744, 'sideways_rsi_os': 19, 'sideways_rsi_ob': 64, 'sideways_adx_thresh': 9.023425720662175, 'sideways_atr_min_pct': 0.027608623912274987, 'sideways_atr_max_pct': 0.1033822126063331, 'sideways_tp_mult': 2.2561420843626347, 'sideways_tsl_mult': 0.9205037690045673, 'sideways_time_stop': 201, 'sideways_use_sma': False, 'sideways_use_ema': False, 'sideways_use_atr': False, 'sideways_use_adx': False, 'sideways_use_spike': False, 'sideways_rsi_required': True}.
[I 2025-08-31 03:04:07,006] Trial 769 finished with values: [-1000000000.0, 1000000000.0] and parameters: {'p_sma': 50, 'p_std': 17, 'p_atr': 15, 'p_adx': 25, 'rsi_period': 70, 'ema1': 6, 'ema2': 42, 'slip_atr_k': 0.13236171386656395, 'slip_spread_k': 0.12152498277546253, 'spread_hl_frac': 0.002936666623966719, 'bb_std_mult': 2.4467100113383564, 'rsi_os': 40, 'rsi_ob': 90, 'vol_spike': 0.2853981334534056, 'adx_thresh': 19.601461746906242, 'atr_min_pct': 0.006507658755602659, 'atr_max_pct': 0.09477121718759497, 'tp_mult': 1.1378080402312016, 'tsl_mult': 0.3876332021367113, 'strategy': 'mean_reversion', 'time_stop': 157, 'use_sma': False, 'use_atr': True, 'use_adx': True, 'use_ema': False, 'use_spike': False, 'rsi_required': True, 'edge_k': 1.5323915007900166, 'edge_cap': 0.43191682158668626, 'bull_strategy': 'mean_reversion', 'bull_bb_std_mult': 1.7229987142250687, 'bull_rsi_os': 17, 'bull_rsi_ob': 75, 'bull_adx_thresh': 6.628570152781934, 'bull_atr_min_pct': 0.0061899461603477455, 'bull_atr_max_pct': 0.09898843570337323, 'bull_tp_mult': 1.638469774823107, 'bull_tsl_mult': 0.271410412163294, 'bull_time_stop': 191, 'bull_use_sma': True, 'bull_use_ema': False, 'bull_use_atr': False, 'bull_use_adx': False, 'bull_use_spike': True, 'bull_rsi_required': True, 'bear_strategy': 'breakout', 'bear_bb_std_mult': 1.431723805145566, 'bear_rsi_os': 7, 'bear_rsi_ob': 49, 'bear_adx_thresh': 5.624070880515822, 'bear_atr_min_pct': 0.006278944657143138, 'bear_atr_max_pct': 0.014628852459593882, 'bear_tp_mult': 2.1312139817611064, 'bear_tsl_mult': 0.4988917169319399, 'bear_time_stop': 76, 'bear_use_sma': False, 'bear_use_ema': False, 'bear_use_atr': True, 'bear_use_adx': True, 'bear_use_spike': True, 'bear_rsi_required': True, 'sideways_strategy': 'breakout', 'sideways_bb_std_mult': 2.5467355395398674, 'sideways_rsi_os': 33, 'sideways_rsi_ob': 81, 'sideways_adx_thresh': 8.036190246108104, 'sideways_atr_min_pct': 0.0032420133971113804, 'sideways_atr_max_pct': 0.06098687144681278, 'sideways_tp_mult': 1.6744476737356615, 'sideways_tsl_mult': 0.09978945995634375, 'sideways_time_stop': 134, 'sideways_use_sma': False, 'sideways_use_ema': True, 'sideways_use_atr': True, 'sideways_use_adx': False, 'sideways_use_spike': False, 'sideways_rsi_required': True}.
[I 2025-08-31 03:04:07,299] Trial 767 finished with values: [-1000000000.0, 1000000000.0] and parameters: {'p_sma': 55, 'p_std': 27, 'p_atr': 27, 'p_adx': 18, 'rsi_period': 40, 'ema1': 5, 'ema2': 50, 'slip_atr_k': 0.04917598712937331, 'slip_spread_k': 0.13347595548333452, 'spread_hl_frac': 0.0032457250297523808, 'bb_std_mult': 0.8906206747303689, 'rsi_os': 42, 'rsi_ob': 66, 'vol_spike': 0.14085484771283382, 'adx_thresh': 21.57233320979991, 'atr_min_pct': 0.009264372085046508, 'atr_max_pct': 0.1224599150174947, 'tp_mult': 1.1492922286207854, 'tsl_mult': 0.7295099193502422, 'strategy': 'mean_reversion', 'time_stop': 189, 'use_sma': True, 'use_atr': True, 'use_adx': True, 'use_ema': False, 'use_spike': False, 'rsi_required': True, 'edge_k': 0.5066022693789315, 'edge_cap': 0.1455065502988022, 'bull_strategy': 'mean_reversion', 'bull_bb_std_mult': 1.9428198995833248, 'bull_rsi_os': 55, 'bull_rsi_ob': 65, 'bull_adx_thresh': 9.405680443678667, 'bull_atr_min_pct': 0.00633014663961573, 'bull_atr_max_pct': 0.14328115265382874, 'bull_tp_mult': 2.6969195853995562, 'bull_tsl_mult': 0.2691084011123597, 'bull_time_stop': 20, 'bull_use_sma': True, 'bull_use_ema': False, 'bull_use_atr': False, 'bull_use_adx': False, 'bull_use_spike': True, 'bull_rsi_required': True, 'bear_strategy': 'mean_reversion', 'bear_bb_std_mult': 1.428556202535189, 'bear_rsi_os': 54, 'bear_rsi_ob': 49, 'bear_adx_thresh': 18.37004520451928, 'bear_atr_min_pct': 0.006027799577665548, 'bear_atr_max_pct': 0.07816763839054613, 'bear_tp_mult': 2.07332135009823, 'bear_tsl_mult': 0.38446658062423344, 'bear_time_stop': 76, 'bear_use_sma': False, 'bear_use_ema': False, 'bear_use_atr': False, 'bear_use_adx': True, 'bear_use_spike': False, 'bear_rsi_required': True, 'sideways_strategy': 'breakout', 'sideways_bb_std_mult': 1.8487659830841634, 'sideways_rsi_os': 39, 'sideways_rsi_ob': 93, 'sideways_adx_thresh': 10.955239003151384, 'sideways_atr_min_pct': 0.027496948448480225, 'sideways_atr_max_pct': 0.05118834534748095, 'sideways_tp_mult': 2.265200690036887, 'sideways_tsl_mult': 0.10753215941569416, 'sideways_time_stop': 199, 'sideways_use_sma': False, 'sideways_use_ema': True, 'sideways_use_atr': True, 'sideways_use_adx': False, 'sideways_use_spike': True, 'sideways_rsi_required': False}.
[I 2025-08-31 03:04:07,393] Trial 768 finished with values: [-1000000000.0, 1000000000.0] and parameters: {'p_sma': 58, 'p_std': 28, 'p_atr': 27, 'p_adx': 11, 'rsi_period': 69, 'ema1': 6, 'ema2': 31, 'slip_atr_k': 0.12747325831277392, 'slip_spread_k': 0.1361693060965904, 'spread_hl_frac': 0.0151820187548165, 'bb_std_mult': 1.64346290098777, 'rsi_os': 41, 'rsi_ob': 83, 'vol_spike': 0.29948902741690653, 'adx_thresh': 21.565633148910106, 'atr_min_pct': 0.01364403444523743, 'atr_max_pct': 0.051956874077681375, 'tp_mult': 1.1645918888801259, 'tsl_mult': 0.3858628024770696, 'strategy': 'mean_reversion', 'time_stop': 113, 'use_sma': False, 'use_atr': True, 'use_adx': True, 'use_ema': False, 'use_spike': False, 'rsi_required': True, 'edge_k': 0.639358404153305, 'edge_cap': 0.13509708847950128, 'bull_strategy': 'mean_reversion', 'bull_bb_std_mult': 1.9484796894366696, 'bull_rsi_os': 34, 'bull_rsi_ob': 51, 'bull_adx_thresh': 6.596981528037027, 'bull_atr_min_pct': 0.006276239051341275, 'bull_atr_max_pct': 0.11383432656620616, 'bull_tp_mult': 2.2723775601705776, 'bull_tsl_mult': 0.8137783163643038, 'bull_time_stop': 147, 'bull_use_sma': True, 'bull_use_ema': False, 'bull_use_atr': False, 'bull_use_adx': False, 'bull_use_spike': True, 'bull_rsi_required': True, 'bear_strategy': 'breakout', 'bear_bb_std_mult': 2.0315818180235006, 'bear_rsi_os': 54, 'bear_rsi_ob': 63, 'bear_adx_thresh': 22.26956805247171, 'bear_atr_min_pct': 0.006227349821772461, 'bear_atr_max_pct': 0.01473165792154146, 'bear_tp_mult': 2.1372293972763465, 'bear_tsl_mult': 0.5030437324129315, 'bear_time_stop': 15, 'bear_use_sma': False, 'bear_use_ema': False, 'bear_use_atr': True, 'bear_use_adx': True, 'bear_use_spike': True, 'bear_rsi_required': True, 'sideways_strategy': 'breakout', 'sideways_bb_std_mult': 2.5323377321616474, 'sideways_rsi_os': 20, 'sideways_rsi_ob': 64, 'sideways_adx_thresh': 19.295489095210545, 'sideways_atr_min_pct': 0.003044770941759955, 'sideways_atr_max_pct': 0.049285456823982346, 'sideways_tp_mult': 2.2844792709717106, 'sideways_tsl_mult': 0.2610638962405589, 'sideways_time_stop': 199, 'sideways_use_sma': False, 'sideways_use_ema': True, 'sideways_use_atr': True, 'sideways_use_adx': False, 'sideways_use_spike': False, 'sideways_rsi_required': False}.
[I 2025-08-31 03:04:39,146] Trial 773 finished with values: [-1000000000.0, 1000000000.0] and parameters: {'p_sma': 58, 'p_std': 16, 'p_atr': 27, 'p_adx': 20, 'rsi_period': 11, 'ema1': 6, 'ema2': 31, 'slip_atr_k': 0.1076853744043806, 'slip_spread_k': 0.4117710535135342, 'spread_hl_frac': 0.0009420757998148954, 'bb_std_mult': 1.483923141934997, 'rsi_os': 36, 'rsi_ob': 70, 'vol_spike': 0.17696918351925583, 'adx_thresh': 20.050600828242175, 'atr_min_pct': 0.013745226177378177, 'atr_max_pct': 0.12851436563342197, 'tp_mult': 1.5739963741975458, 'tsl_mult': 0.447055873176938, 'strategy': 'mean_reversion', 'time_stop': 114, 'use_sma': True, 'use_atr': False, 'use_adx': False, 'use_ema': False, 'use_spike': True, 'rsi_required': True, 'edge_k': 1.9491862391664636, 'edge_cap': 0.3275233568446013, 'bull_strategy': 'breakout', 'bull_bb_std_mult': 1.201895387806763, 'bull_rsi_os': 32, 'bull_rsi_ob': 82, 'bull_adx_thresh': 33.14209624140251, 'bull_atr_min_pct': 0.007283534492973986, 'bull_atr_max_pct': 0.13772306664723682, 'bull_tp_mult': 2.33116201280283, 'bull_tsl_mult': 0.22907281066614826, 'bull_time_stop': 146, 'bull_use_sma': True, 'bull_use_ema': False, 'bull_use_atr': False, 'bull_use_adx': True, 'bull_use_spike': True, 'bull_rsi_required': True, 'bear_strategy': 'mean_reversion', 'bear_bb_std_mult': 1.356845634345719, 'bear_rsi_os': 30, 'bear_rsi_ob': 92, 'bear_adx_thresh': 12.819005676127983, 'bear_atr_min_pct': 0.016771458394852827, 'bear_atr_max_pct': 0.018447302686572874, 'bear_tp_mult': 2.1466940285859093, 'bear_tsl_mult': 0.5544635102685255, 'bear_time_stop': 215, 'bear_use_sma': False, 'bear_use_ema': True, 'bear_use_atr': False, 'bear_use_adx': False, 'bear_use_spike': False, 'bear_rsi_required': True, 'sideways_strategy': 'breakout', 'sideways_bb_std_mult': 0.5780621474182014, 'sideways_rsi_os': 40, 'sideways_rsi_ob': 46, 'sideways_adx_thresh': 16.07488182297027, 'sideways_atr_min_pct': 0.026513450966761738, 'sideways_atr_max_pct': 0.04916054833396308, 'sideways_tp_mult': 2.5665140959202244, 'sideways_tsl_mult': 0.673645505638606, 'sideways_time_stop': 117, 'sideways_use_sma': True, 'sideways_use_ema': False, 'sideways_use_atr': False, 'sideways_use_adx': True, 'sideways_use_spike': True, 'sideways_rsi_required': False}.
[I 2025-08-31 03:04:39,179] Trial 772 finished with values: [-1000000000.0, 1000000000.0] and parameters: {'p_sma': 58, 'p_std': 24, 'p_atr': 27, 'p_adx': 29, 'rsi_period': 71, 'ema1': 5, 'ema2': 53, 'slip_atr_k': 0.02005886349342187, 'slip_spread_k': 0.1463276236697559, 'spread_hl_frac': 0.015379165066414938, 'bb_std_mult': 1.8887517804176208, 'rsi_os': 36, 'rsi_ob': 70, 'vol_spike': 0.034109394958515074, 'adx_thresh': 21.379115840929607, 'atr_min_pct': 0.02893574173987113, 'atr_max_pct': 0.12702395220702664, 'tp_mult': 1.5706572507788226, 'tsl_mult': 0.3100417282182959, 'strategy': 'mean_reversion', 'time_stop': 115, 'use_sma': True, 'use_atr': False, 'use_adx': False, 'use_ema': False, 'use_spike': True, 'rsi_required': True, 'edge_k': 1.919561284857008, 'edge_cap': 0.14535091286741675, 'bull_strategy': 'breakout', 'bull_bb_std_mult': 0.8293318518900621, 'bull_rsi_os': 5, 'bull_rsi_ob': 82, 'bull_adx_thresh': 6.005175737858201, 'bull_atr_min_pct': 0.013287266799662505, 'bull_atr_max_pct': 0.1441716778323459, 'bull_tp_mult': 2.3360848919896187, 'bull_tsl_mult': 0.22688926929960562, 'bull_time_stop': 140, 'bull_use_sma': True, 'bull_use_ema': False, 'bull_use_atr': False, 'bull_use_adx': True, 'bull_use_spike': True, 'bull_rsi_required': True, 'bear_strategy': 'mean_reversion', 'bear_bb_std_mult': 0.808995303348073, 'bear_rsi_os': 14, 'bear_rsi_ob': 65, 'bear_adx_thresh': 6.7714403370910405, 'bear_atr_min_pct': 0.01187104615804735, 'bear_atr_max_pct': 0.01510999892515515, 'bear_tp_mult': 2.404662649183829, 'bear_tsl_mult': 0.8187132121757724, 'bear_time_stop': 215, 'bear_use_sma': False, 'bear_use_ema': True, 'bear_use_atr': False, 'bear_use_adx': True, 'bear_use_spike': False, 'bear_rsi_required': True, 'sideways_strategy': 'breakout', 'sideways_bb_std_mult': 0.5944699296316127, 'sideways_rsi_os': 39, 'sideways_rsi_ob': 70, 'sideways_adx_thresh': 10.1627800122662, 'sideways_atr_min_pct': 0.025083186835595166, 'sideways_atr_max_pct': 0.04826291597731452, 'sideways_tp_mult': 1.3662697201886087, 'sideways_tsl_mult': 0.4577402542944633, 'sideways_time_stop': 218, 'sideways_use_sma': True, 'sideways_use_ema': False, 'sideways_use_atr': False, 'sideways_use_adx': False, 'sideways_use_spike': True, 'sideways_rsi_required': False}.
[I 2025-08-31 03:04:39,487] Trial 774 finished with values: [-1000000000.0, 1000000000.0] and parameters: {'p_sma': 8, 'p_std': 53, 'p_atr': 12, 'p_adx': 19, 'rsi_period': 71, 'ema1': 5, 'ema2': 27, 'slip_atr_k': 0.23393778437275292, 'slip_spread_k': 0.16264505156824138, 'spread_hl_frac': 0.0010158580799570908, 'bb_std_mult': 1.4829783301118002, 'rsi_os': 36, 'rsi_ob': 69, 'vol_spike': 0.0341588822020885, 'adx_thresh': 20.73587089859714, 'atr_min_pct': 0.008019362430693218, 'atr_max_pct': 0.12740060490534857, 'tp_mult': 2.414202559122886, 'tsl_mult': 0.451874259805664, 'strategy': 'mean_reversion', 'time_stop': 117, 'use_sma': True, 'use_atr': False, 'use_adx': False, 'use_ema': False, 'use_spike': True, 'rsi_required': True, 'edge_k': 1.9240724690398814, 'edge_cap': 0.315186585093459, 'bull_strategy': 'breakout', 'bull_bb_std_mult': 1.1039430189861408, 'bull_rsi_os': 35, 'bull_rsi_ob': 64, 'bull_adx_thresh': 5.9237216237627495, 'bull_atr_min_pct': 0.015384758360102248, 'bull_atr_max_pct': 0.13870721061340283, 'bull_tp_mult': 2.3227221004653082, 'bull_tsl_mult': 0.29653717190547085, 'bull_time_stop': 140, 'bull_use_sma': True, 'bull_use_ema': False, 'bull_use_atr': False, 'bull_use_adx': True, 'bull_use_spike': True, 'bull_rsi_required': True, 'bear_strategy': 'mean_reversion', 'bear_bb_std_mult': 2.5352421625058073, 'bear_rsi_os': 17, 'bear_rsi_ob': 92, 'bear_adx_thresh': 6.643039054538146, 'bear_atr_min_pct': 0.01165576257786966, 'bear_atr_max_pct': 0.047653339302505815, 'bear_tp_mult': 1.9935616356416324, 'bear_tsl_mult': 0.5559761329390223, 'bear_time_stop': 20, 'bear_use_sma': False, 'bear_use_ema': True, 'bear_use_atr': False, 'bear_use_adx': False, 'bear_use_spike': False, 'bear_rsi_required': True, 'sideways_strategy': 'breakout', 'sideways_bb_std_mult': 0.5858794900384315, 'sideways_rsi_os': 38, 'sideways_rsi_ob': 92, 'sideways_adx_thresh': 9.345545881178417, 'sideways_atr_min_pct': 0.016165759185925617, 'sideways_atr_max_pct': 0.0900439311752225, 'sideways_tp_mult': 1.9756594075909784, 'sideways_tsl_mult': 0.6530484556985305, 'sideways_time_stop': 219, 'sideways_use_sma': True, 'sideways_use_ema': False, 'sideways_use_atr': False, 'sideways_use_adx': True, 'sideways_use_spike': True, 'sideways_rsi_required': False}.
