[I 2025-08-31 02:48:57,015] Trial 666 finished with values: [-1000000000.0, 1000000000.0] and parameters: {'p_sma': 5, 'p_std': 57, 'p_atr': 28, 'p_adx': 28, 'rsi_period': 66, 'ema1': 5, 'ema2': 29, 'slip_atr_k': 0.05433098929866299, 'slip_spread_k': 0.4282708281260818, 'spread_hl_frac': 0.0008007829440581623, 'bb_std_mult': 1.6074120855116554, 'rsi_os': 39, 'rsi_ob': 66, 'vol_spike': 0.12932007835659232, 'adx_thresh': 23.786656551935366, 'atr_min_pct': 0.006891637217383067, 'atr_max_pct': 0.12687884642236733, 'tp_mult': 1.5361652511014592, 'tsl_mult': 0.4659774432595777, 'strategy': 'mean_reversion', 'time_stop': 19, 'use_sma': True, 'use_atr': False, 'use_adx': False, 'use_ema': False, 'use_spike': False, 'rsi_required': True, 'edge_k': 0.6030746085106297, 'edge_cap': 0.5025956720460302, 'bull_strategy': 'breakout', 'bull_bb_std_mult': 1.809802680002234, 'bull_rsi_os': 51, 'bull_rsi_ob': 94, 'bull_adx_thresh': 10.315246808051041, 'bull_atr_min_pct': 0.012536316611102808, 'bull_atr_max_pct': 0.1435845966764504, 'bull_tp_mult': 1.4314825343727344, 'bull_tsl_mult': 0.6513269989128853, 'bull_time_stop': 224, 'bull_use_sma': True, 'bull_use_ema': False, 'bull_use_atr': False, 'bull_use_adx': True, 'bull_use_spike': True, 'bull_rsi_required': True, 'bear_strategy': 'mean_reversion', 'bear_bb_std_mult': 1.3232067128713179, 'bear_rsi_os': 18, 'bear_rsi_ob': 84, 'bear_adx_thresh': 5.513463998600893, 'bear_atr_min_pct': 0.020871399710308092, 'bear_atr_max_pct': 0.010013965785939655, 'bear_tp_mult': 1.9922036682789646, 'bear_tsl_mult': 0.14010724189225449, 'bear_time_stop': 176, 'bear_use_sma': False, 'bear_use_ema': False, 'bear_use_atr': False, 'bear_use_adx': True, 'bear_use_spike': False, 'bear_rsi_required': True, 'sideways_strategy': 'breakout', 'sideways_bb_std_mult': 2.7110959849587353, 'sideways_rsi_os': 37, 'sideways_rsi_ob': 94, 'sideways_adx_thresh': 7.346371347733088, 'sideways_atr_min_pct': 0.011956578395258035, 'sideways_atr_max_pct': 0.05941119067006456, 'sideways_tp_mult': 1.6594127853481855, 'sideways_tsl_mult': 0.45850956944899995, 'sideways_time_stop': 202, 'sideways_use_sma': False, 'sideways_use_ema': False, 'sideways_use_atr': True, 'sideways_use_adx': False, 'sideways_use_spike': True, 'sideways_rsi_required': False}.
[I 2025-08-31 02:48:57,099] Trial 667 finished with values: [-1000000000.0, 1000000000.0] and parameters: {'p_sma': 54, 'p_std': 52, 'p_atr': 30, 'p_adx': 27, 'rsi_period': 66, 'ema1': 5, 'ema2': 40, 'slip_atr_k': 0.10865454300687871, 'slip_spread_k': 0.07170944549932667, 'spread_hl_frac': 0.0009792007337818358, 'bb_std_mult': 1.5966724498011164, 'rsi_os': 40, 'rsi_ob': 93, 'vol_spike': 0.16739092299733382, 'adx_thresh': 21.252369435551426, 'atr_min_pct': 0.007196455927766518, 'atr_max_pct': 0.12508854600043395, 'tp_mult': 1.5290651535083317, 'tsl_mult': 0.5676060661422649, 'strategy': 'mean_reversion', 'time_stop': 102, 'use_sma': True, 'use_atr': False, 'use_adx': False, 'use_ema': False, 'use_spike': False, 'rsi_required': True, 'edge_k': 0.5918684133718654, 'edge_cap': 0.6481290427917694, 'bull_strategy': 'breakout', 'bull_bb_std_mult': 1.7805489318512846, 'bull_rsi_os': 33, 'bull_rsi_ob': 76, 'bull_adx_thresh': 18.828078376925184, 'bull_atr_min_pct': 0.013752131640652143, 'bull_atr_max_pct': 0.1428414399065024, 'bull_tp_mult': 2.724289461815032, 'bull_tsl_mult': 0.17503051873394426, 'bull_time_stop': 146, 'bull_use_sma': True, 'bull_use_ema': False, 'bull_use_atr': False, 'bull_use_adx': True, 'bull_use_spike': True, 'bull_rsi_required': True, 'bear_strategy': 'mean_reversion', 'bear_bb_std_mult': 1.3348139060328286, 'bear_rsi_os': 18, 'bear_rsi_ob': 48, 'bear_adx_thresh': 25.432357610935416, 'bear_atr_min_pct': 0.006042163584447045, 'bear_atr_max_pct': 0.13259305054973197, 'bear_tp_mult': 2.6406218961458583, 'bear_tsl_mult': 0.611821430309093, 'bear_time_stop': 22, 'bear_use_sma': False, 'bear_use_ema': False, 'bear_use_atr': False, 'bear_use_adx': True, 'bear_use_spike': False, 'bear_rsi_required': True, 'sideways_strategy': 'breakout', 'sideways_bb_std_mult': 2.6980949758809554, 'sideways_rsi_os': 42, 'sideways_rsi_ob': 94, 'sideways_adx_thresh': 26.31975035461868, 'sideways_atr_min_pct': 0.012136149414887986, 'sideways_atr_max_pct': 0.059541533913279814, 'sideways_tp_mult': 1.6571143352132627, 'sideways_tsl_mult': 0.27248762330557474, 'sideways_time_stop': 278, 'sideways_use_sma': False, 'sideways_use_ema': False, 'sideways_use_atr': True, 'sideways_use_adx': False, 'sideways_use_spike': True, 'sideways_rsi_required': False}.
[I 2025-08-31 02:48:57,461] Trial 665 finished with values: [-1000000000.0, 1000000000.0] and parameters: {'p_sma': 57, 'p_std': 52, 'p_atr': 28, 'p_adx': 15, 'rsi_period': 25, 'ema1': 5, 'ema2': 33, 'slip_atr_k': 0.05460766181174059, 'slip_spread_k': 0.10024906251448493, 'spread_hl_frac': 0.0011480537966760418, 'bb_std_mult': 1.5977316365851943, 'rsi_os': 39, 'rsi_ob': 71, 'vol_spike': 0.1671245130129807, 'adx_thresh': 29.093568018381802, 'atr_min_pct': 0.009086864264967041, 'atr_max_pct': 0.09745278319365383, 'tp_mult': 1.5544663166224442, 'tsl_mult': 0.7104662320262461, 'strategy': 'mean_reversion', 'time_stop': 102, 'use_sma': True, 'use_atr': False, 'use_adx': True, 'use_ema': False, 'use_spike': False, 'rsi_required': True, 'edge_k': 0.5921983054784826, 'edge_cap': 0.6468999723329086, 'bull_strategy': 'breakout', 'bull_bb_std_mult': 0.7982984616998368, 'bull_rsi_os': 51, 'bull_rsi_ob': 76, 'bull_adx_thresh': 5.083761530686052, 'bull_atr_min_pct': 0.012365218676231545, 'bull_atr_max_pct': 0.10501521059386942, 'bull_tp_mult': 2.2473226551576917, 'bull_tsl_mult': 0.6515621248538969, 'bull_time_stop': 146, 'bull_use_sma': True, 'bull_use_ema': False, 'bull_use_atr': False, 'bull_use_adx': True, 'bull_use_spike': True, 'bull_rsi_required': True, 'bear_strategy': 'mean_reversion', 'bear_bb_std_mult': 1.3408980176184986, 'bear_rsi_os': 12, 'bear_rsi_ob': 45, 'bear_adx_thresh': 5.006121003521172, 'bear_atr_min_pct': 0.02552220221395876, 'bear_atr_max_pct': 0.1319638019499521, 'bear_tp_mult': 2.0457376146315083, 'bear_tsl_mult': 0.6147826201765029, 'bear_time_stop': 170, 'bear_use_sma': False, 'bear_use_ema': False, 'bear_use_atr': False, 'bear_use_adx': False, 'bear_use_spike': False, 'bear_rsi_required': True, 'sideways_strategy': 'breakout', 'sideways_bb_std_mult': 3.339210558363514, 'sideways_rsi_os': 20, 'sideways_rsi_ob': 92, 'sideways_adx_thresh': 7.385800520782371, 'sideways_atr_min_pct': 0.02624370959813395, 'sideways_atr_max_pct': 0.047634769204771873, 'sideways_tp_mult': 1.7219833529643025, 'sideways_tsl_mult': 0.6607926026750054, 'sideways_time_stop': 205, 'sideways_use_sma': False, 'sideways_use_ema': True, 'sideways_use_atr': True, 'sideways_use_adx': True, 'sideways_use_spike': True, 'sideways_rsi_required': False}.
[I 2025-08-31 02:48:58,587] Trial 670 finished with values: [-1000000000.0, 1000000000.0] and parameters: {'p_sma': 40, 'p_std': 54, 'p_atr': 29, 'p_adx': 30, 'rsi_period': 70, 'ema1': 5, 'ema2': 30, 'slip_atr_k': 0.06921561828642507, 'slip_spread_k': 0.09766159365669604, 'spread_hl_frac': 0.0041345368468854345, 'bb_std_mult': 3.286688367857119, 'rsi_os': 37, 'rsi_ob': 47, 'vol_spike': 0.17693248469551082, 'adx_thresh': 17.212239741704135, 'atr_min_pct': 0.029545119790479656, 'atr_max_pct': 0.10871649606660548, 'tp_mult': 1.6406503436131914, 'tsl_mult': 0.7103862050087453, 'strategy': 'mean_reversion', 'time_stop': 107, 'use_sma': True, 'use_atr': True, 'use_adx': False, 'use_ema': False, 'use_spike': False, 'rsi_required': True, 'edge_k': 0.5151961485222932, 'edge_cap': 0.5593619559980141, 'bull_strategy': 'breakout', 'bull_bb_std_mult': 3.1219762820709493, 'bull_rsi_os': 19, 'bull_rsi_ob': 59, 'bull_adx_thresh': 6.843527513489023, 'bull_atr_min_pct': 0.015998489051717413, 'bull_atr_max_pct': 0.13736164814972462, 'bull_tp_mult': 2.216711809105784, 'bull_tsl_mult': 0.29772487211300397, 'bull_time_stop': 126, 'bull_use_sma': True, 'bull_use_ema': False, 'bull_use_atr': False, 'bull_use_adx': True, 'bull_use_spike': True, 'bull_rsi_required': True, 'bear_strategy': 'mean_reversion', 'bear_bb_std_mult': 1.4632749658074862, 'bear_rsi_os': 15, 'bear_rsi_ob': 45, 'bear_adx_thresh': 18.154389014544535, 'bear_atr_min_pct': 0.006214924449872539, 'bear_atr_max_pct': 0.07311779481538774, 'bear_tp_mult': 2.055562330791295, 'bear_tsl_mult': 0.07740199477670423, 'bear_time_stop': 135, 'bear_use_sma': False, 'bear_use_ema': False, 'bear_use_atr': False, 'bear_use_adx': True, 'bear_use_spike': False, 'bear_rsi_required': True, 'sideways_strategy': 'breakout', 'sideways_bb_std_mult': 1.8943356282750365, 'sideways_rsi_os': 39, 'sideways_rsi_ob': 48, 'sideways_adx_thresh': 9.850425059629282, 'sideways_atr_min_pct': 0.028094314736772062, 'sideways_atr_max_pct': 0.05329534248931667, 'sideways_tp_mult': 2.5109519504871396, 'sideways_tsl_mult': 0.14309491891732534, 'sideways_time_stop': 121, 'sideways_use_sma': True, 'sideways_use_ema': False, 'sideways_use_atr': False, 'sideways_use_adx': False, 'sideways_use_spike': True, 'sideways_rsi_required': True}.
[I 2025-08-31 02:48:58,699] Trial 672 finished with values: [-1000000000.0, 1000000000.0] and parameters: {'p_sma': 15, 'p_std': 47, 'p_atr': 29, 'p_adx': 30, 'rsi_period': 39, 'ema1': 30, 'ema2': 11, 'slip_atr_k': 0.18324606105073285, 'slip_spread_k': 0.046039944981481506, 'spread_hl_frac': 0.00426538690386486, 'bb_std_mult': 1.677591150445442, 'rsi_os': 37, 'rsi_ob': 47, 'vol_spike': 0.17721080603364925, 'adx_thresh': 22.990209793865326, 'atr_min_pct': 0.006061330862254903, 'atr_max_pct': 0.12027198142410117, 'tp_mult': 1.786958231377747, 'tsl_mult': 0.34171614823369595, 'strategy': 'mean_reversion', 'time_stop': 108, 'use_sma': True, 'use_atr': True, 'use_adx': False, 'use_ema': False, 'use_spike': False, 'rsi_required': True, 'edge_k': 1.4515655587895586, 'edge_cap': 0.40395735854021936, 'bull_strategy': 'mean_reversion', 'bull_bb_std_mult': 3.11688537540342, 'bull_rsi_os': 43, 'bull_rsi_ob': 48, 'bull_adx_thresh': 21.075876373710106, 'bull_atr_min_pct': 0.015770007802933365, 'bull_atr_max_pct': 0.12893815678968243, 'bull_tp_mult': 2.1777065869865297, 'bull_tsl_mult': 0.28659478198444804, 'bull_time_stop': 23, 'bull_use_sma': True, 'bull_use_ema': True, 'bull_use_atr': False, 'bull_use_adx': True, 'bull_use_spike': True, 'bull_rsi_required': True, 'bear_strategy': 'mean_reversion', 'bear_bb_std_mult': 3.3166872883611287, 'bear_rsi_os': 30, 'bear_rsi_ob': 67, 'bear_adx_thresh': 26.724981124166753, 'bear_atr_min_pct': 0.004659551115313854, 'bear_atr_max_pct': 0.015923095333735225, 'bear_tp_mult': 2.056882490509805, 'bear_tsl_mult': 0.4716840905402845, 'bear_time_stop': 250, 'bear_use_sma': False, 'bear_use_ema': False, 'bear_use_atr': False, 'bear_use_adx': True, 'bear_use_spike': False, 'bear_rsi_required': True, 'sideways_strategy': 'breakout', 'sideways_bb_std_mult': 0.6285225754589495, 'sideways_rsi_os': 39, 'sideways_rsi_ob': 95, 'sideways_adx_thresh': 9.7980094517975, 'sideways_atr_min_pct': 0.028216216126476998, 'sideways_atr_max_pct': 0.05311870777546897, 'sideways_tp_mult': 1.8447941944607638, 'sideways_tsl_mult': 0.11686863234167627, 'sideways_time_stop': 190, 'sideways_use_sma': True, 'sideways_use_ema': False, 'sideways_use_atr': False, 'sideways_use_adx': False, 'sideways_use_spike': True, 'sideways_rsi_required': True}.
[I 2025-08-31 02:48:58,742] Trial 671 finished with values: [-1000000000.0, 1000000000.0] and parameters: {'p_sma': 15, 'p_std': 60, 'p_atr': 29, 'p_adx': 11, 'rsi_period': 70, 'ema1': 5, 'ema2': 11, 'slip_atr_k': 0.10441418495797943, 'slip_spread_k': 0.4577733766731782, 'spread_hl_frac': 0.004065043789721799, 'bb_std_mult': 1.6665223299500622, 'rsi_os': 37, 'rsi_ob': 47, 'vol_spike': 0.1751595563253821, 'adx_thresh': 22.92805291478656, 'atr_min_pct': 0.009739837663849605, 'atr_max_pct': 0.10946721855051672, 'tp_mult': 2.4496987981327623, 'tsl_mult': 0.9984964889631878, 'strategy': 'mean_reversion', 'time_stop': 109, 'use_sma': True, 'use_atr': True, 'use_adx': False, 'use_ema': False, 'use_spike': False, 'rsi_required': True, 'edge_k': 0.5236355424883323, 'edge_cap': 0.41032185120264575, 'bull_strategy': 'breakout', 'bull_bb_std_mult': 3.110092802065168, 'bull_rsi_os': 34, 'bull_rsi_ob': 48, 'bull_adx_thresh': 21.18535829251434, 'bull_atr_min_pct': 0.011146710112352005, 'bull_atr_max_pct': 0.1369493972081799, 'bull_tp_mult': 2.2140301411097156, 'bull_tsl_mult': 0.28977842175213425, 'bull_time_stop': 300, 'bull_use_sma': True, 'bull_use_ema': False, 'bull_use_atr': False, 'bull_use_adx': True, 'bull_use_spike': True, 'bull_rsi_required': True, 'bear_strategy': 'mean_reversion', 'bear_bb_std_mult': 3.308469371290826, 'bear_rsi_os': 15, 'bear_rsi_ob': 45, 'bear_adx_thresh': 6.18372264905741, 'bear_atr_min_pct': 0.00516208297397828, 'bear_atr_max_pct': 0.0910189859382922, 'bear_tp_mult': 2.042030559856636, 'bear_tsl_mult': 0.5211790541395172, 'bear_time_stop': 250, 'bear_use_sma': False, 'bear_use_ema': False, 'bear_use_atr': False, 'bear_use_adx': True, 'bear_use_spike': False, 'bear_rsi_required': True, 'sideways_strategy': 'breakout', 'sideways_bb_std_mult': 3.116074101884116, 'sideways_rsi_os': 39, 'sideways_rsi_ob': 48, 'sideways_adx_thresh': 23.141618369960014, 'sideways_atr_min_pct': 0.015838960353879068, 'sideways_atr_max_pct': 0.053429134553227904, 'sideways_tp_mult': 1.8479566605010256, 'sideways_tsl_mult': 0.6302116726447206, 'sideways_time_stop': 249, 'sideways_use_sma': True, 'sideways_use_ema': False, 'sideways_use_atr': False, 'sideways_use_adx': False, 'sideways_use_spike': True, 'sideways_rsi_required': True}.
[I 2025-08-31 02:49:19,162] Trial 669 finished with values: [-0.04633093542763511, 0.046190710666346196] and parameters: {'p_sma': 40, 'p_std': 54, 'p_atr': 28, 'p_adx': 30, 'rsi_period': 70, 'ema1': 5, 'ema2': 10, 'slip_atr_k': 0.05840765035475573, 'slip_spread_k': 0.4223751375085863, 'spread_hl_frac': 1.9205460569230327e-05, 'bb_std_mult': 1.635861598318261, 'rsi_os': 40, 'rsi_ob': 92, 'vol_spike': 0.19177542397597377, 'adx_thresh': 33.04421017593842, 'atr_min_pct': 0.029997836393402623, 'atr_max_pct': 0.1107135073685894, 'tp_mult': 1.5582928429219822, 'tsl_mult': 0.47615699619770535, 'strategy': 'mean_reversion', 'time_stop': 102, 'use_sma': True, 'use_atr': True, 'use_adx': False, 'use_ema': False, 'use_spike': False, 'rsi_required': True, 'edge_k': 0.6065128584676311, 'edge_cap': 0.41306492634251785, 'bull_strategy': 'breakout', 'bull_bb_std_mult': 1.7694167985424079, 'bull_rsi_os': 43, 'bull_rsi_ob': 76, 'bull_adx_thresh': 6.386345291789729, 'bull_atr_min_pct': 0.01403517841779288, 'bull_atr_max_pct': 0.14311691722217337, 'bull_tp_mult': 1.5319411307172843, 'bull_tsl_mult': 0.17872506854528478, 'bull_time_stop': 26, 'bull_use_sma': True, 'bull_use_ema': False, 'bull_use_atr': False, 'bull_use_adx': True, 'bull_use_spike': True, 'bull_rsi_required': True, 'bear_strategy': 'mean_reversion', 'bear_bb_std_mult': 2.1727531926552794, 'bear_rsi_os': 12, 'bear_rsi_ob': 45, 'bear_adx_thresh': 5.044197549658836, 'bear_atr_min_pct': 0.0010312395576249408, 'bear_atr_max_pct': 0.010138485645571505, 'bear_tp_mult': 2.053002809977095, 'bear_tsl_mult': 0.5875543540141459, 'bear_time_stop': 248, 'bear_use_sma': False, 'bear_use_ema': False, 'bear_use_atr': False, 'bear_use_adx': True, 'bear_use_spike': False, 'bear_rsi_required': True, 'sideways_strategy': 'breakout', 'sideways_bb_std_mult': 1.90358248130327, 'sideways_rsi_os': 42, 'sideways_rsi_ob': 94, 'sideways_adx_thresh': 9.943271288412816, 'sideways_atr_min_pct': 0.025074210686983005, 'sideways_atr_max_pct': 0.05936430757982515, 'sideways_tp_mult': 2.9198938154886482, 'sideways_tsl_mult': 0.6499055338978219, 'sideways_time_stop': 279, 'sideways_use_sma': False, 'sideways_use_ema': False, 'sideways_use_atr': False, 'sideways_use_adx': False, 'sideways_use_spike': True, 'sideways_rsi_required': False}.
[I 2025-08-31 02:49:34,015] Trial 674 finished with values: [-1000000000.0, 1000000000.0] and parameters: {'p_sma': 51, 'p_std': 51, 'p_atr': 18, 'p_adx': 24, 'rsi_period': 68, 'ema1': 20, 'ema2': 36, 'slip_atr_k': 0.13571424098034918, 'slip_spread_k': 0.3930042429824554, 'spread_hl_frac': 0.0031207010103200088, 'bb_std_mult': 2.613123646144813, 'rsi_os': 24, 'rsi_ob': 70, 'vol_spike': 0.191329855960007, 'adx_thresh': 16.21568813404807, 'atr_min_pct': 0.025326624247749736, 'atr_max_pct': 0.11078272670777525, 'tp_mult': 2.075152974178006, 'tsl_mult': 0.9830471338465361, 'strategy': 'mean_reversion', 'time_stop': 98, 'use_sma': True, 'use_atr': False, 'use_adx': False, 'use_ema': False, 'use_spike': False, 'rsi_required': True, 'edge_k': 0.3066733132857431, 'edge_cap': 0.12019787763723466, 'bull_strategy': 'breakout', 'bull_bb_std_mult': 2.0804467146058467, 'bull_rsi_os': 49, 'bull_rsi_ob': 82, 'bull_adx_thresh': 6.349317816334806, 'bull_atr_min_pct': 0.011403717747565907, 'bull_atr_max_pct': 0.1361814544930413, 'bull_tp_mult': 2.2866903134961363, 'bull_tsl_mult': 0.07201128435194565, 'bull_time_stop': 299, 'bull_use_sma': True, 'bull_use_ema': False, 'bull_use_atr': False, 'bull_use_adx': True, 'bull_use_spike': True, 'bull_rsi_required': True, 'bear_strategy': 'mean_reversion', 'bear_bb_std_mult': 1.5670656329689914, 'bear_rsi_os': 17, 'bear_rsi_ob': 86, 'bear_adx_thresh': 5.017732911336416, 'bear_atr_min_pct': 0.005317792964902144, 'bear_atr_max_pct': 0.056328036199408515, 'bear_tp_mult': 2.1953758106427426, 'bear_tsl_mult': 0.038600934672638865, 'bear_time_stop': 83, 'bear_use_sma': False, 'bear_use_ema': False, 'bear_use_atr': False, 'bear_use_adx': True, 'bear_use_spike': False, 'bear_rsi_required': True, 'sideways_strategy': 'breakout', 'sideways_bb_std_mult': 2.2516747003855313, 'sideways_rsi_os': 16, 'sideways_rsi_ob': 51, 'sideways_adx_thresh': 8.505208231649041, 'sideways_atr_min_pct': 0.017927106215293864, 'sideways_atr_max_pct': 0.02371271801944881, 'sideways_tp_mult': 1.2834088517824953, 'sideways_tsl_mult': 0.5706350685539168, 'sideways_time_stop': 207, 'sideways_use_sma': True, 'sideways_use_ema': False, 'sideways_use_atr': False, 'sideways_use_adx': False, 'sideways_use_spike': True, 'sideways_rsi_required': False}.
[I 2025-08-31 02:49:34,030] Trial 673 finished with values: [-0.048183319594357954, 0.04796579739227615] and parameters: {'p_sma': 15, 'p_std': 50, 'p_atr': 18, 'p_adx': 24, 'rsi_period': 68, 'ema1': 6, 'ema2': 11, 'slip_atr_k': 0.15191587332717787, 'slip_spread_k': 0.1805570356286803, 'spread_hl_frac': 0.002921060513603062, 'bb_std_mult': 1.6774972358142992, 'rsi_os': 30, 'rsi_ob': 70, 'vol_spike': 0.28917003052432394, 'adx_thresh': 23.08951541299852, 'atr_min_pct': 0.00986739982403162, 'atr_max_pct': 0.11045922214934727, 'tp_mult': 2.4421919461593116, 'tsl_mult': 0.2666962939416869, 'strategy': 'mean_reversion', 'time_stop': 97, 'use_sma': True, 'use_atr': True, 'use_adx': False, 'use_ema': False, 'use_spike': False, 'rsi_required': True, 'edge_k': 1.257411672874407, 'edge_cap': 0.1265852574604165, 'bull_strategy': 'mean_reversion', 'bull_bb_std_mult': 1.2846449381719949, 'bull_rsi_os': 34, 'bull_rsi_ob': 48, 'bull_adx_thresh': 6.229938671244883, 'bull_atr_min_pct': 0.008726581307655093, 'bull_atr_max_pct': 0.05582542524906879, 'bull_tp_mult': 2.293317731428117, 'bull_tsl_mult': 0.2147677609715704, 'bull_time_stop': 95, 'bull_use_sma': True, 'bull_use_ema': True, 'bull_use_atr': False, 'bull_use_adx': True, 'bull_use_spike': True, 'bull_rsi_required': True, 'bear_strategy': 'mean_reversion', 'bear_bb_std_mult': 1.5761418477690752, 'bear_rsi_os': 48, 'bear_rsi_ob': 47, 'bear_adx_thresh': 5.044860920709299, 'bear_atr_min_pct': 5.035510383139333e-05, 'bear_atr_max_pct': 0.015746329286789457, 'bear_tp_mult': 2.084320554811954, 'bear_tsl_mult': 0.4696848833098929, 'bear_time_stop': 249, 'bear_use_sma': False, 'bear_use_ema': False, 'bear_use_atr': False, 'bear_use_adx': True, 'bear_use_spike': False, 'bear_rsi_required': True, 'sideways_strategy': 'breakout', 'sideways_bb_std_mult': 3.142007981148034, 'sideways_rsi_os': 41, 'sideways_rsi_ob': 95, 'sideways_adx_thresh': 8.547309584792274, 'sideways_atr_min_pct': 0.025479986847106187, 'sideways_atr_max_pct': 0.05219774647848955, 'sideways_tp_mult': 1.277728748892763, 'sideways_tsl_mult': 0.6250560469888725, 'sideways_time_stop': 248, 'sideways_use_sma': True, 'sideways_use_ema': False, 'sideways_use_atr': False, 'sideways_use_adx': False, 'sideways_use_spike': True, 'sideways_rsi_required': False}.
