[I 2025-08-31 02:15:58,231] Trial 431 finished with values: [-1000000000.0, 1000000000.0] and parameters: {'p_sma': 55, 'p_std': 10, 'p_atr': 22, 'p_adx': 20, 'rsi_period': 10, 'ema1': 5, 'ema2': 57, 'slip_atr_k': 0.030565866377319003, 'slip_spread_k': 0.6299654858333632, 'spread_hl_frac': 0.019844649286411532, 'bb_std_mult': 2.724684052556832, 'rsi_os': 55, 'rsi_ob': 73, 'vol_spike': 0.14750652594022534, 'adx_thresh': 17.59016592468891, 'atr_min_pct': 0.014115541287085523, 'atr_max_pct': 0.019595652519700434, 'tp_mult': 2.3271902949692502, 'tsl_mult': 0.12233906900262204, 'strategy': 'breakout', 'time_stop': 70, 'use_sma': False, 'use_atr': True, 'use_adx': True, 'use_ema': False, 'use_spike': False, 'rsi_required': False, 'edge_k': 0.33022470187581965, 'edge_cap': 0.5509645444382325, 'bull_strategy': 'mean_reversion', 'bull_bb_std_mult': 0.5126514215009887, 'bull_rsi_os': 38, 'bull_rsi_ob': 73, 'bull_adx_thresh': 25.16820096427169, 'bull_atr_min_pct': 0.0010092069416114404, 'bull_atr_max_pct': 0.015962595313766953, 'bull_tp_mult': 1.4899823150247662, 'bull_tsl_mult': 0.16283691235241352, 'bull_time_stop': 152, 'bull_use_sma': False, 'bull_use_ema': True, 'bull_use_atr': True, 'bull_use_adx': True, 'bull_use_spike': False, 'bull_rsi_required': False, 'bear_strategy': 'breakout', 'bear_bb_std_mult': 1.1658413970162593, 'bear_rsi_os': 23, 'bear_rsi_ob': 47, 'bear_adx_thresh': 7.18920727039567, 'bear_atr_min_pct': 0.0086457353436605, 'bear_atr_max_pct': 0.020759721106332788, 'bear_tp_mult': 1.0749022706863727, 'bear_tsl_mult': 0.6714709406309413, 'bear_time_stop': 284, 'bear_use_sma': False, 'bear_use_ema': False, 'bear_use_atr': False, 'bear_use_adx': True, 'bear_use_spike': False, 'bear_rsi_required': False, 'sideways_strategy': 'mean_reversion', 'sideways_bb_std_mult': 3.498671984546897, 'sideways_rsi_os': 22, 'sideways_rsi_ob': 88, 'sideways_adx_thresh': 12.740577108262844, 'sideways_atr_min_pct': 0.021949490114086825, 'sideways_atr_max_pct': 0.13878311044602235, 'sideways_tp_mult': 2.950877464489157, 'sideways_tsl_mult': 0.7150839878824374, 'sideways_time_stop': 142, 'sideways_use_sma': False, 'sideways_use_ema': True, 'sideways_use_atr': False, 'sideways_use_adx': True, 'sideways_use_spike': False, 'sideways_rsi_required': True}.
[I 2025-08-31 02:15:58,433] Trial 433 finished with values: [-1000000000.0, 1000000000.0] and parameters: {'p_sma': 48, 'p_std': 10, 'p_atr': 22, 'p_adx': 20, 'rsi_period': 55, 'ema1': 6, 'ema2': 18, 'slip_atr_k': 0.043360028773533225, 'slip_spread_k': 0.29853138443207433, 'spread_hl_frac': 0.01994804428005679, 'bb_std_mult': 2.1348178650411374, 'rsi_os': 54, 'rsi_ob': 73, 'vol_spike': 0.19799911149470148, 'adx_thresh': 13.765360909795866, 'atr_min_pct': 0.0053116325476373315, 'atr_max_pct': 0.04566781395644668, 'tp_mult': 2.613900946864132, 'tsl_mult': 0.1221603140334854, 'strategy': 'breakout', 'time_stop': 117, 'use_sma': True, 'use_atr': False, 'use_adx': False, 'use_ema': False, 'use_spike': False, 'rsi_required': True, 'edge_k': 0.43848627643929483, 'edge_cap': 0.21964177375243715, 'bull_strategy': 'breakout', 'bull_bb_std_mult': 0.5139061797950979, 'bull_rsi_os': 38, 'bull_rsi_ob': 70, 'bull_adx_thresh': 27.551428113633133, 'bull_atr_min_pct': 0.017065099719237753, 'bull_atr_max_pct': 0.1326783453376402, 'bull_tp_mult': 1.2405059747282168, 'bull_tsl_mult': 0.3898543467743947, 'bull_time_stop': 115, 'bull_use_sma': True, 'bull_use_ema': False, 'bull_use_atr': True, 'bull_use_adx': True, 'bull_use_spike': False, 'bull_rsi_required': False, 'bear_strategy': 'mean_reversion', 'bear_bb_std_mult': 0.8734704303394223, 'bear_rsi_os': 18, 'bear_rsi_ob': 92, 'bear_adx_thresh': 7.2625068988823305, 'bear_atr_min_pct': 0.0020246755737755133, 'bear_atr_max_pct': 0.022443132756253904, 'bear_tp_mult': 2.995700735725193, 'bear_tsl_mult': 0.6580902732351832, 'bear_time_stop': 12, 'bear_use_sma': False, 'bear_use_ema': False, 'bear_use_atr': False, 'bear_use_adx': True, 'bear_use_spike': True, 'bear_rsi_required': False, 'sideways_strategy': 'mean_reversion', 'sideways_bb_std_mult': 0.8733693452178004, 'sideways_rsi_os': 50, 'sideways_rsi_ob': 92, 'sideways_adx_thresh': 26.07625506223513, 'sideways_atr_min_pct': 0.0035070257547707914, 'sideways_atr_max_pct': 0.11525380116571943, 'sideways_tp_mult': 2.8545713222614264, 'sideways_tsl_mult': 0.6995749859184542, 'sideways_time_stop': 172, 'sideways_use_sma': True, 'sideways_use_ema': False, 'sideways_use_atr': True, 'sideways_use_adx': False, 'sideways_use_spike': True, 'sideways_rsi_required': False}.
[I 2025-08-31 02:15:58,906] Trial 432 finished with values: [-1000000000.0, 1000000000.0] and parameters: {'p_sma': 48, 'p_std': 38, 'p_atr': 9, 'p_adx': 7, 'rsi_period': 66, 'ema1': 6, 'ema2': 55, 'slip_atr_k': 0.017949778700164384, 'slip_spread_k': 0.7803030050301925, 'spread_hl_frac': 0.009508144677476372, 'bb_std_mult': 2.1579284510101218, 'rsi_os': 54, 'rsi_ob': 95, 'vol_spike': 0.19339287448540624, 'adx_thresh': 23.927046053934095, 'atr_min_pct': 0.01705581602079052, 'atr_max_pct': 0.04645073305853647, 'tp_mult': 2.594546639425094, 'tsl_mult': 0.12203024072963892, 'strategy': 'breakout', 'time_stop': 118, 'use_sma': True, 'use_atr': True, 'use_adx': False, 'use_ema': False, 'use_spike': False, 'rsi_required': True, 'edge_k': 1.5015113797092368, 'edge_cap': 0.8650742938131323, 'bull_strategy': 'breakout', 'bull_bb_std_mult': 2.839183827853732, 'bull_rsi_os': 38, 'bull_rsi_ob': 52, 'bull_adx_thresh': 10.720397411292712, 'bull_atr_min_pct': 0.017200788755737818, 'bull_atr_max_pct': 0.13345296938764273, 'bull_tp_mult': 1.3355769064365206, 'bull_tsl_mult': 0.3424618971741702, 'bull_time_stop': 151, 'bull_use_sma': True, 'bull_use_ema': True, 'bull_use_atr': True, 'bull_use_adx': True, 'bull_use_spike': False, 'bull_rsi_required': False, 'bear_strategy': 'mean_reversion', 'bear_bb_std_mult': 0.8431498379249074, 'bear_rsi_os': 28, 'bear_rsi_ob': 47, 'bear_adx_thresh': 17.623765221612718, 'bear_atr_min_pct': 0.029445941715237456, 'bear_atr_max_pct': 0.09768140823016956, 'bear_tp_mult': 1.0728286503715467, 'bear_tsl_mult': 0.6597164622214946, 'bear_time_stop': 11, 'bear_use_sma': False, 'bear_use_ema': False, 'bear_use_atr': False, 'bear_use_adx': True, 'bear_use_spike': True, 'bear_rsi_required': False, 'sideways_strategy': 'mean_reversion', 'sideways_bb_std_mult': 1.1162282300168338, 'sideways_rsi_os': 15, 'sideways_rsi_ob': 87, 'sideways_adx_thresh': 12.948916064984358, 'sideways_atr_min_pct': 0.023577459202482214, 'sideways_atr_max_pct': 0.020674988157983867, 'sideways_tp_mult': 2.935855178532878, 'sideways_tsl_mult': 0.6696442458724673, 'sideways_time_stop': 156, 'sideways_use_sma': True, 'sideways_use_ema': True, 'sideways_use_atr': True, 'sideways_use_adx': False, 'sideways_use_spike': False, 'sideways_rsi_required': True}.
[I 2025-08-31 02:15:59,906] Trial 436 finished with values: [-1000000000.0, 1000000000.0] and parameters: {'p_sma': 49, 'p_std': 39, 'p_atr': 11, 'p_adx': 9, 'rsi_period': 56, 'ema1': 6, 'ema2': 21, 'slip_atr_k': 0.10771064638745852, 'slip_spread_k': 0.1858441566441015, 'spread_hl_frac': 0.03928811618569526, 'bb_std_mult': 1.5200953107508361, 'rsi_os': 54, 'rsi_ob': 49, 'vol_spike': 0.16848088645898066, 'adx_thresh': 25.12717331547173, 'atr_min_pct': 0.004189963105848181, 'atr_max_pct': 0.08686259930214986, 'tp_mult': 2.0779454637904577, 'tsl_mult': 0.15040153913739124, 'strategy': 'mean_reversion', 'time_stop': 263, 'use_sma': True, 'use_atr': False, 'use_adx': False, 'use_ema': True, 'use_spike': False, 'rsi_required': True, 'edge_k': 0.9405024313485942, 'edge_cap': 0.8327669446151338, 'bull_strategy': 'breakout', 'bull_bb_std_mult': 2.95293412648164, 'bull_rsi_os': 36, 'bull_rsi_ob': 74, 'bull_adx_thresh': 11.010912258657047, 'bull_atr_min_pct': 0.0042920800202672395, 'bull_atr_max_pct': 0.07362286356096172, 'bull_tp_mult': 2.5019547849372277, 'bull_tsl_mult': 0.34527120279790846, 'bull_time_stop': 224, 'bull_use_sma': True, 'bull_use_ema': False, 'bull_use_atr': True, 'bull_use_adx': True, 'bull_use_spike': False, 'bull_rsi_required': False, 'bear_strategy': 'mean_reversion', 'bear_bb_std_mult': 0.8305278665595444, 'bear_rsi_os': 20, 'bear_rsi_ob': 92, 'bear_adx_thresh': 8.000891304240437, 'bear_atr_min_pct': 0.01060350514061111, 'bear_atr_max_pct': 0.10948742084450239, 'bear_tp_mult': 2.0367735793146924, 'bear_tsl_mult': 0.6500008184159745, 'bear_time_stop': 5, 'bear_use_sma': True, 'bear_use_ema': False, 'bear_use_atr': False, 'bear_use_adx': True, 'bear_use_spike': True, 'bear_rsi_required': False, 'sideways_strategy': 'mean_reversion', 'sideways_bb_std_mult': 2.7700069193608763, 'sideways_rsi_os': 31, 'sideways_rsi_ob': 72, 'sideways_adx_thresh': 13.401425729760827, 'sideways_atr_min_pct': 0.023160346763732492, 'sideways_atr_max_pct': 0.1269858987127436, 'sideways_tp_mult': 2.332651301582161, 'sideways_tsl_mult': 0.6732495965873347, 'sideways_time_stop': 157, 'sideways_use_sma': True, 'sideways_use_ema': False, 'sideways_use_atr': True, 'sideways_use_adx': False, 'sideways_use_spike': True, 'sideways_rsi_required': False}.
[I 2025-08-31 02:15:59,914] Trial 438 finished with values: [-1000000000.0, 1000000000.0] and parameters: {'p_sma': 46, 'p_std': 55, 'p_atr': 21, 'p_adx': 12, 'rsi_period': 61, 'ema1': 7, 'ema2': 21, 'slip_atr_k': 0.24632063484737032, 'slip_spread_k': 0.18659905158237078, 'spread_hl_frac': 0.04176553439059316, 'bb_std_mult': 3.020330883279973, 'rsi_os': 51, 'rsi_ob': 49, 'vol_spike': 0.1801766515021681, 'adx_thresh': 11.738050643430466, 'atr_min_pct': 0.0034957299418430674, 'atr_max_pct': 0.037486964925403855, 'tp_mult': 2.0662983245063415, 'tsl_mult': 0.03726456791230209, 'strategy': 'mean_reversion', 'time_stop': 93, 'use_sma': True, 'use_atr': False, 'use_adx': False, 'use_ema': True, 'use_spike': False, 'rsi_required': False, 'edge_k': 0.8606593038347884, 'edge_cap': 0.7990989325572738, 'bull_strategy': 'breakout', 'bull_bb_std_mult': 2.730067122908017, 'bull_rsi_os': 31, 'bull_rsi_ob': 81, 'bull_adx_thresh': 5.762983269416452, 'bull_atr_min_pct': 0.016191104875180374, 'bull_atr_max_pct': 0.03898358347814069, 'bull_tp_mult': 2.52048637070687, 'bull_tsl_mult': 0.2934236961247906, 'bull_time_stop': 76, 'bull_use_sma': False, 'bull_use_ema': False, 'bull_use_atr': True, 'bull_use_adx': False, 'bull_use_spike': True, 'bull_rsi_required': False, 'bear_strategy': 'mean_reversion', 'bear_bb_std_mult': 1.1784802981431772, 'bear_rsi_os': 20, 'bear_rsi_ob': 73, 'bear_adx_thresh': 16.61010826214005, 'bear_atr_min_pct': 0.008803589434577604, 'bear_atr_max_pct': 0.1281068298726036, 'bear_tp_mult': 1.8030654721255728, 'bear_tsl_mult': 0.7079431072626021, 'bear_time_stop': 27, 'bear_use_sma': True, 'bear_use_ema': False, 'bear_use_atr': False, 'bear_use_adx': True, 'bear_use_spike': False, 'bear_rsi_required': True, 'sideways_strategy': 'mean_reversion', 'sideways_bb_std_mult': 1.1915487245645007, 'sideways_rsi_os': 46, 'sideways_rsi_ob': 74, 'sideways_adx_thresh': 21.862864133446084, 'sideways_atr_min_pct': 0.021068140641420124, 'sideways_atr_max_pct': 0.06908931983835388, 'sideways_tp_mult': 1.0832065124788959, 'sideways_tsl_mult': 0.6680635355116599, 'sideways_time_stop': 165, 'sideways_use_sma': True, 'sideways_use_ema': False, 'sideways_use_atr': False, 'sideways_use_adx': False, 'sideways_use_spike': True, 'sideways_rsi_required': False}.
[I 2025-08-31 02:16:44,996] Trial 435 finished with values: [-1000000000.0, 1000000000.0] and parameters: {'p_sma': 48, 'p_std': 10, 'p_atr': 29, 'p_adx': 20, 'rsi_period': 52, 'ema1': 6, 'ema2': 21, 'slip_atr_k': 0.0426085846536304, 'slip_spread_k': 0.24833836639862558, 'spread_hl_frac': 0.04191508597696847, 'bb_std_mult': 2.1794139407395248, 'rsi_os': 55, 'rsi_ob': 50, 'vol_spike': 0.17984458471670525, 'adx_thresh': 17.521582763686748, 'atr_min_pct': 0.004083002243178223, 'atr_max_pct': 0.03824956173003445, 'tp_mult': 1.8984317705459084, 'tsl_mult': 0.035299667141632005, 'strategy': 'breakout', 'time_stop': 83, 'use_sma': True, 'use_atr': False, 'use_adx': False, 'use_ema': True, 'use_spike': False, 'rsi_required': False, 'edge_k': 0.9424811545904663, 'edge_cap': 0.8313398055817705, 'bull_strategy': 'breakout', 'bull_bb_std_mult': 2.737397331869, 'bull_rsi_os': 38, 'bull_rsi_ob': 73, 'bull_adx_thresh': 5.835445099083, 'bull_atr_min_pct': 0.016329112527666924, 'bull_atr_max_pct': 0.03271674020627311, 'bull_tp_mult': 2.5899287382801894, 'bull_tsl_mult': 0.4452477352002807, 'bull_time_stop': 78, 'bull_use_sma': True, 'bull_use_ema': False, 'bull_use_atr': True, 'bull_use_adx': True, 'bull_use_spike': False, 'bull_rsi_required': False, 'bear_strategy': 'mean_reversion', 'bear_bb_std_mult': 1.1839785218736996, 'bear_rsi_os': 46, 'bear_rsi_ob': 48, 'bear_adx_thresh': 17.59397211763499, 'bear_atr_min_pct': 0.008762448756478924, 'bear_atr_max_pct': 0.020902061149117315, 'bear_tp_mult': 1.9217116822467415, 'bear_tsl_mult': 0.6598016124212759, 'bear_time_stop': 26, 'bear_use_sma': True, 'bear_use_ema': False, 'bear_use_atr': False, 'bear_use_adx': True, 'bear_use_spike': False, 'bear_rsi_required': False, 'sideways_strategy': 'mean_reversion', 'sideways_bb_std_mult': 2.755042201303721, 'sideways_rsi_os': 32, 'sideways_rsi_ob': 72, 'sideways_adx_thresh': 13.186967575687504, 'sideways_atr_min_pct': 0.021035553044775033, 'sideways_atr_max_pct': 0.12592741677561173, 'sideways_tp_mult': 1.0848858259970537, 'sideways_tsl_mult': 0.6709302057985395, 'sideways_time_stop': 158, 'sideways_use_sma': True, 'sideways_use_ema': False, 'sideways_use_atr': False, 'sideways_use_adx': False, 'sideways_use_spike': True, 'sideways_rsi_required': False}.
[I 2025-08-31 02:16:47,189] Trial 437 finished with values: [-1000000000.0, 1000000000.0] and parameters: {'p_sma': 44, 'p_std': 5, 'p_atr': 21, 'p_adx': 23, 'rsi_period': 56, 'ema1': 20, 'ema2': 22, 'slip_atr_k': 0.01916094222838942, 'slip_spread_k': 0.781923406184625, 'spread_hl_frac': 0.044916967219632495, 'bb_std_mult': 2.2076080239892613, 'rsi_os': 36, 'rsi_ob': 59, 'vol_spike': 0.16812303222449446, 'adx_thresh': 11.28253291326029, 'atr_min_pct': 0.008095648171340217, 'atr_max_pct': 0.07891784493283234, 'tp_mult': 2.555443523720054, 'tsl_mult': 0.2038123576097544, 'strategy': 'mean_reversion', 'time_stop': 290, 'use_sma': True, 'use_atr': False, 'use_adx': False, 'use_ema': True, 'use_spike': False, 'rsi_required': False, 'edge_k': 1.0321031396470215, 'edge_cap': 0.8373503079834415, 'bull_strategy': 'breakout', 'bull_bb_std_mult': 2.7480777715908076, 'bull_rsi_os': 31, 'bull_rsi_ob': 78, 'bull_adx_thresh': 5.852309803616798, 'bull_atr_min_pct': 0.004175459798174742, 'bull_atr_max_pct': 0.03126699943349076, 'bull_tp_mult': 2.499205334780445, 'bull_tsl_mult': 0.7935289595034356, 'bull_time_stop': 191, 'bull_use_sma': False, 'bull_use_ema': False, 'bull_use_atr': True, 'bull_use_adx': False, 'bull_use_spike': True, 'bull_rsi_required': False, 'bear_strategy': 'mean_reversion', 'bear_bb_std_mult': 1.2014046350509822, 'bear_rsi_os': 46, 'bear_rsi_ob': 61, 'bear_adx_thresh': 17.612673601544827, 'bear_atr_min_pct': 0.02013556421472993, 'bear_atr_max_pct': 0.09561628325557231, 'bear_tp_mult': 1.415069910770811, 'bear_tsl_mult': 0.7125623212734175, 'bear_time_stop': 199, 'bear_use_sma': True, 'bear_use_ema': False, 'bear_use_atr': False, 'bear_use_adx': True, 'bear_use_spike': False, 'bear_rsi_required': False, 'sideways_strategy': 'mean_reversion', 'sideways_bb_std_mult': 1.1901037011263345, 'sideways_rsi_os': 46, 'sideways_rsi_ob': 72, 'sideways_adx_thresh': 13.671494608567317, 'sideways_atr_min_pct': 0.027579838028116248, 'sideways_atr_max_pct': 0.1435635972645778, 'sideways_tp_mult': 1.0861406759914356, 'sideways_tsl_mult': 0.6787125233843826, 'sideways_time_stop': 156, 'sideways_use_sma': True, 'sideways_use_ema': False, 'sideways_use_atr': False, 'sideways_use_adx': False, 'sideways_use_spike': True, 'sideways_rsi_required': False}.
[I 2025-08-31 02:16:50,002] Trial 440 finished with values: [-1000000000.0, 1000000000.0] and parameters: {'p_sma': 50, 'p_std': 31, 'p_atr': 23, 'p_adx': 8, 'rsi_period': 60, 'ema1': 22, 'ema2': 46, 'slip_atr_k': 0.04919242290830338, 'slip_spread_k': 0.2515544620714631, 'spread_hl_frac': 0.03391394834863386, 'bb_std_mult': 1.7665611593270374, 'rsi_os': 55, 'rsi_ob': 90, 'vol_spike': 0.2302945920498678, 'adx_thresh': 28.5398581813187, 'atr_min_pct': 0.008281564626739084, 'atr_max_pct': 0.06576389948507498, 'tp_mult': 2.5537093728318108, 'tsl_mult': 0.08392048685122017, 'strategy': 'breakout', 'time_stop': 83, 'use_sma': True, 'use_atr': False, 'use_adx': False, 'use_ema': True, 'use_spike': False, 'rsi_required': False, 'edge_k': 1.1732054881551717, 'edge_cap': 0.2556353168705555, 'bull_strategy': 'breakout', 'bull_bb_std_mult': 2.6191850908717655, 'bull_rsi_os': 30, 'bull_rsi_ob': 78, 'bull_adx_thresh': 18.358532941539895, 'bull_atr_min_pct': 0.001912212373706904, 'bull_atr_max_pct': 0.08410241915081874, 'bull_tp_mult': 2.603057232366916, 'bull_tsl_mult': 0.4462707070037055, 'bull_time_stop': 290, 'bull_use_sma': False, 'bull_use_ema': False, 'bull_use_atr': True, 'bull_use_adx': True, 'bull_use_spike': False, 'bull_rsi_required': True, 'bear_strategy': 'mean_reversion', 'bear_bb_std_mult': 1.0732113043551186, 'bear_rsi_os': 34, 'bear_rsi_ob': 79, 'bear_adx_thresh': 18.557992143840274, 'bear_atr_min_pct': 0.008811235442830393, 'bear_atr_max_pct': 0.019527650394764767, 'bear_tp_mult': 1.8732439431811265, 'bear_tsl_mult': 0.7494687934139264, 'bear_time_stop': 188, 'bear_use_sma': True, 'bear_use_ema': False, 'bear_use_atr': False, 'bear_use_adx': True, 'bear_use_spike': False, 'bear_rsi_required': False, 'sideways_strategy': 'mean_reversion', 'sideways_bb_std_mult': 0.9296943007692902, 'sideways_rsi_os': 46, 'sideways_rsi_ob': 48, 'sideways_adx_thresh': 11.954786523853004, 'sideways_atr_min_pct': 0.0243065228185634, 'sideways_atr_max_pct': 0.14393440339812247, 'sideways_tp_mult': 1.0943131327952018, 'sideways_tsl_mult': 0.7492358062157785, 'sideways_time_stop': 186, 'sideways_use_sma': True, 'sideways_use_ema': False, 'sideways_use_atr': False, 'sideways_use_adx': False, 'sideways_use_spike': True, 'sideways_rsi_required': False}.
[I 2025-08-31 02:16:50,157] Trial 439 finished with values: [-1000000000.0, 1000000000.0] and parameters: {'p_sma': 46, 'p_std': 55, 'p_atr': 21, 'p_adx': 11, 'rsi_period': 52, 'ema1': 7, 'ema2': 22, 'slip_atr_k': 0.13493320716002757, 'slip_spread_k': 0.22612996266153657, 'spread_hl_frac': 0.013250380970068393, 'bb_std_mult': 1.6682432831020204, 'rsi_os': 11, 'rsi_ob': 72, 'vol_spike': 0.18041951666772418, 'adx_thresh': 6.074405583993348, 'atr_min_pct': 0.008047776999033073, 'atr_max_pct': 0.08243536209280306, 'tp_mult': 2.71820856777182, 'tsl_mult': 0.08496337924724368, 'strategy': 'mean_reversion', 'time_stop': 83, 'use_sma': True, 'use_atr': False, 'use_adx': False, 'use_ema': True, 'use_spike': False, 'rsi_required': False, 'edge_k': 1.1636111309614152, 'edge_cap': 0.8107993707726789, 'bull_strategy': 'breakout', 'bull_bb_std_mult': 1.9443961399478358, 'bull_rsi_os': 37, 'bull_rsi_ob': 83, 'bull_adx_thresh': 18.327640746570395, 'bull_atr_min_pct': 0.021091837164272216, 'bull_atr_max_pct': 0.1150645481817494, 'bull_tp_mult': 2.5822903273312243, 'bull_tsl_mult': 0.44535967026873935, 'bull_time_stop': 187, 'bull_use_sma': False, 'bull_use_ema': False, 'bull_use_atr': True, 'bull_use_adx': False, 'bull_use_spike': True, 'bull_rsi_required': False, 'bear_strategy': 'mean_reversion', 'bear_bb_std_mult': 2.408594232992634, 'bear_rsi_os': 6, 'bear_rsi_ob': 78, 'bear_adx_thresh': 32.033489941454235, 'bear_atr_min_pct': 0.008887056913593445, 'bear_atr_max_pct': 0.12686097846699484, 'bear_tp_mult': 1.8183772353279097, 'bear_tsl_mult': 0.7182390155454185, 'bear_time_stop': 197, 'bear_use_sma': True, 'bear_use_ema': False, 'bear_use_atr': False, 'bear_use_adx': True, 'bear_use_spike': False, 'bear_rsi_required': True, 'sideways_strategy': 'mean_reversion', 'sideways_bb_std_mult': 1.1935997222380028, 'sideways_rsi_os': 46, 'sideways_rsi_ob': 91, 'sideways_adx_thresh': 11.972918288443458, 'sideways_atr_min_pct': 0.02118291503647207, 'sideways_atr_max_pct': 0.14412466509771293, 'sideways_tp_mult': 1.0837402979808854, 'sideways_tsl_mult': 0.6946511449715022, 'sideways_time_stop': 165, 'sideways_use_sma': True, 'sideways_use_ema': False, 'sideways_use_atr': False, 'sideways_use_adx': False, 'sideways_use_spike': True, 'sideways_rsi_required': False}.
