[I 2025-08-31 02:41:20,952] Trial 610 finished with values: [-1000000000.0, 1000000000.0] and parameters: {'p_sma': 33, 'p_std': 49, 'p_atr': 27, 'p_adx': 27, 'rsi_period': 67, 'ema1': 30, 'ema2': 33, 'slip_atr_k': 0.21912354623265223, 'slip_spread_k': 0.14778686534014046, 'spread_hl_frac': 0.004479380472332291, 'bb_std_mult': 2.9586121995856667, 'rsi_os': 39, 'rsi_ob': 82, 'vol_spike': 0.1981555920717622, 'adx_thresh': 23.949204169068654, 'atr_min_pct': 0.022460912856389, 'atr_max_pct': 0.12492947059047493, 'tp_mult': 1.6219132114299337, 'tsl_mult': 0.591981170152575, 'strategy': 'mean_reversion', 'time_stop': 204, 'use_sma': True, 'use_atr': False, 'use_adx': False, 'use_ema': False, 'use_spike': True, 'rsi_required': True, 'edge_k': 0.5370468080684077, 'edge_cap': 0.12221058516443517, 'bull_strategy': 'breakout', 'bull_bb_std_mult': 2.1522001355061016, 'bull_rsi_os': 34, 'bull_rsi_ob': 52, 'bull_adx_thresh': 6.981951639761114, 'bull_atr_min_pct': 0.019333165521174638, 'bull_atr_max_pct': 0.051650051405537536, 'bull_tp_mult': 1.1526808119117034, 'bull_tsl_mult': 0.0660476589605406, 'bull_time_stop': 141, 'bull_use_sma': True, 'bull_use_ema': False, 'bull_use_atr': False, 'bull_use_adx': True, 'bull_use_spike': True, 'bull_rsi_required': True, 'bear_strategy': 'mean_reversion', 'bear_bb_std_mult': 1.9849610387954104, 'bear_rsi_os': 13, 'bear_rsi_ob': 47, 'bear_adx_thresh': 5.031428301102187, 'bear_atr_min_pct': 0.006226912102999238, 'bear_atr_max_pct': 0.012550027939330287, 'bear_tp_mult': 2.0920441238441088, 'bear_tsl_mult': 0.5647423604192809, 'bear_time_stop': 10, 'bear_use_sma': False, 'bear_use_ema': True, 'bear_use_atr': False, 'bear_use_adx': True, 'bear_use_spike': False, 'bear_rsi_required': True, 'sideways_strategy': 'breakout', 'sideways_bb_std_mult': 2.6828542937679853, 'sideways_rsi_os': 41, 'sideways_rsi_ob': 94, 'sideways_adx_thresh': 5.874415510975911, 'sideways_atr_min_pct': 0.0274500941562139, 'sideways_atr_max_pct': 0.061724279135988026, 'sideways_tp_mult': 1.680065170340177, 'sideways_tsl_mult': 0.6874392031759771, 'sideways_time_stop': 193, 'sideways_use_sma': True, 'sideways_use_ema': True, 'sideways_use_atr': False, 'sideways_use_adx': False, 'sideways_use_spike': True, 'sideways_rsi_required': False}.
[I 2025-08-31 02:41:54,107] Trial 615 finished with values: [-1000000000.0, 1000000000.0] and parameters: {'p_sma': 51, 'p_std': 49, 'p_atr': 29, 'p_adx': 24, 'rsi_period': 27, 'ema1': 6, 'ema2': 15, 'slip_atr_k': 0.07840600023012997, 'slip_spread_k': 0.15239990798821662, 'spread_hl_frac': 0.0028601850030247336, 'bb_std_mult': 1.0882089326364603, 'rsi_os': 40, 'rsi_ob': 69, 'vol_spike': 0.18378150586349354, 'adx_thresh': 17.90487057526066, 'atr_min_pct': 0.02253393830301963, 'atr_max_pct': 0.11955453967647477, 'tp_mult': 1.908277508111751, 'tsl_mult': 0.5678945165539817, 'strategy': 'mean_reversion', 'time_stop': 204, 'use_sma': False, 'use_atr': False, 'use_adx': False, 'use_ema': False, 'use_spike': False, 'rsi_required': True, 'edge_k': 0.3467612718664793, 'edge_cap': 0.15656363460026979, 'bull_strategy': 'breakout', 'bull_bb_std_mult': 2.1292873454439927, 'bull_rsi_os': 27, 'bull_rsi_ob': 74, 'bull_adx_thresh': 32.5888865801393, 'bull_atr_min_pct': 0.004212474490107336, 'bull_atr_max_pct': 0.13897675816968655, 'bull_tp_mult': 2.7513355386284726, 'bull_tsl_mult': 0.27736297642933483, 'bull_time_stop': 129, 'bull_use_sma': True, 'bull_use_ema': False, 'bull_use_atr': False, 'bull_use_adx': True, 'bull_use_spike': True, 'bull_rsi_required': True, 'bear_strategy': 'breakout', 'bear_bb_std_mult': 3.3439055143198524, 'bear_rsi_os': 18, 'bear_rsi_ob': 89, 'bear_adx_thresh': 5.486439059425333, 'bear_atr_min_pct': 0.014103401990319711, 'bear_atr_max_pct': 0.07155243394252615, 'bear_tp_mult': 2.0097614946214706, 'bear_tsl_mult': 0.5133649090251494, 'bear_time_stop': 11, 'bear_use_sma': False, 'bear_use_ema': False, 'bear_use_atr': True, 'bear_use_adx': True, 'bear_use_spike': False, 'bear_rsi_required': True, 'sideways_strategy': 'breakout', 'sideways_bb_std_mult': 2.1660478239340346, 'sideways_rsi_os': 26, 'sideways_rsi_ob': 82, 'sideways_adx_thresh': 8.949007910165536, 'sideways_atr_min_pct': 0.026008280290513764, 'sideways_atr_max_pct': 0.09784728458786905, 'sideways_tp_mult': 1.8075094114752566, 'sideways_tsl_mult': 0.6790967241053613, 'sideways_time_stop': 197, 'sideways_use_sma': True, 'sideways_use_ema': False, 'sideways_use_atr': False, 'sideways_use_adx': False, 'sideways_use_spike': False, 'sideways_rsi_required': False}.
[I 2025-08-31 02:41:55,117] Trial 616 finished with values: [-1000000000.0, 1000000000.0] and parameters: {'p_sma': 55, 'p_std': 53, 'p_atr': 28, 'p_adx': 25, 'rsi_period': 27, 'ema1': 10, 'ema2': 15, 'slip_atr_k': 0.06701872390599461, 'slip_spread_k': 0.15259860278926546, 'spread_hl_frac': 0.002579836352585158, 'bb_std_mult': 0.5119538138482926, 'rsi_os': 5, 'rsi_ob': 69, 'vol_spike': 0.12611576899434898, 'adx_thresh': 20.90670269764985, 'atr_min_pct': 0.00929452878186652, 'atr_max_pct': 0.09961837753458025, 'tp_mult': 1.7210054147313274, 'tsl_mult': 0.3019870058021972, 'strategy': 'mean_reversion', 'time_stop': 114, 'use_sma': False, 'use_atr': False, 'use_adx': False, 'use_ema': False, 'use_spike': False, 'rsi_required': True, 'edge_k': 1.2339479756536909, 'edge_cap': 0.15358738094718433, 'bull_strategy': 'breakout', 'bull_bb_std_mult': 2.2181587919666725, 'bull_rsi_os': 27, 'bull_rsi_ob': 61, 'bull_adx_thresh': 5.887378969171439, 'bull_atr_min_pct': 0.005674938570613103, 'bull_atr_max_pct': 0.03737981033786124, 'bull_tp_mult': 2.6762402811028267, 'bull_tsl_mult': 0.2333597652950275, 'bull_time_stop': 129, 'bull_use_sma': True, 'bull_use_ema': True, 'bull_use_atr': False, 'bull_use_adx': True, 'bull_use_spike': True, 'bull_rsi_required': True, 'bear_strategy': 'breakout', 'bear_bb_std_mult': 1.2843867314572472, 'bear_rsi_os': 17, 'bear_rsi_ob': 90, 'bear_adx_thresh': 5.953277330288561, 'bear_atr_min_pct': 0.004592054928185015, 'bear_atr_max_pct': 0.10690961690821933, 'bear_tp_mult': 2.0342772594503016, 'bear_tsl_mult': 0.5088719458535162, 'bear_time_stop': 15, 'bear_use_sma': False, 'bear_use_ema': False, 'bear_use_atr': True, 'bear_use_adx': True, 'bear_use_spike': False, 'bear_rsi_required': True, 'sideways_strategy': 'breakout', 'sideways_bb_std_mult': 2.1562141951907914, 'sideways_rsi_os': 35, 'sideways_rsi_ob': 92, 'sideways_adx_thresh': 9.302068992986584, 'sideways_atr_min_pct': 0.02639053198076815, 'sideways_atr_max_pct': 0.05776171630803893, 'sideways_tp_mult': 2.4782411413523393, 'sideways_tsl_mult': 0.6554984421864057, 'sideways_time_stop': 32, 'sideways_use_sma': True, 'sideways_use_ema': False, 'sideways_use_atr': True, 'sideways_use_adx': False, 'sideways_use_spike': False, 'sideways_rsi_required': True}.
[I 2025-08-31 02:41:55,745] Trial 613 finished with values: [-1000000000.0, 1000000000.0] and parameters: {'p_sma': 55, 'p_std': 49, 'p_atr': 29, 'p_adx': 25, 'rsi_period': 70, 'ema1': 10, 'ema2': 15, 'slip_atr_k': 0.1927941727233276, 'slip_spread_k': 0.36557398466498287, 'spread_hl_frac': 0.002562874953076632, 'bb_std_mult': 1.6400949084442342, 'rsi_os': 17, 'rsi_ob': 69, 'vol_spike': 0.110145496882807, 'adx_thresh': 21.066457421806458, 'atr_min_pct': 0.009396307848168497, 'atr_max_pct': 0.1339185548344428, 'tp_mult': 1.6385104850095973, 'tsl_mult': 0.2834018821599843, 'strategy': 'mean_reversion', 'time_stop': 10, 'use_sma': True, 'use_atr': False, 'use_adx': False, 'use_ema': False, 'use_spike': False, 'rsi_required': True, 'edge_k': 1.974828526508271, 'edge_cap': 0.5786121822338615, 'bull_strategy': 'breakout', 'bull_bb_std_mult': 2.170063224127541, 'bull_rsi_os': 52, 'bull_rsi_ob': 64, 'bull_adx_thresh': 32.57037370829674, 'bull_atr_min_pct': 0.007380105063388148, 'bull_atr_max_pct': 0.14058929628206343, 'bull_tp_mult': 2.2649767027216567, 'bull_tsl_mult': 0.22457853648933065, 'bull_time_stop': 210, 'bull_use_sma': True, 'bull_use_ema': False, 'bull_use_atr': False, 'bull_use_adx': True, 'bull_use_spike': True, 'bull_rsi_required': True, 'bear_strategy': 'mean_reversion', 'bear_bb_std_mult': 1.2233969846098256, 'bear_rsi_os': 18, 'bear_rsi_ob': 94, 'bear_adx_thresh': 5.09058001436859, 'bear_atr_min_pct': 0.021589510309954978, 'bear_atr_max_pct': 0.010129401351002211, 'bear_tp_mult': 2.1938394021565686, 'bear_tsl_mult': 0.5473408539381497, 'bear_time_stop': 10, 'bear_use_sma': False, 'bear_use_ema': False, 'bear_use_atr': False, 'bear_use_adx': True, 'bear_use_spike': False, 'bear_rsi_required': True, 'sideways_strategy': 'breakout', 'sideways_bb_std_mult': 0.5472192556408358, 'sideways_rsi_os': 42, 'sideways_rsi_ob': 82, 'sideways_adx_thresh': 9.216953517253419, 'sideways_atr_min_pct': 0.026245494319805555, 'sideways_atr_max_pct': 0.05766756833714559, 'sideways_tp_mult': 1.8134657649356012, 'sideways_tsl_mult': 0.6394948426061611, 'sideways_time_stop': 212, 'sideways_use_sma': True, 'sideways_use_ema': False, 'sideways_use_atr': False, 'sideways_use_adx': False, 'sideways_use_spike': True, 'sideways_rsi_required': False}.
[I 2025-08-31 02:41:55,758] Trial 614 finished with values: [-1000000000.0, 1000000000.0] and parameters: {'p_sma': 34, 'p_std': 53, 'p_atr': 29, 'p_adx': 25, 'rsi_period': 13, 'ema1': 10, 'ema2': 15, 'slip_atr_k': 0.07997801301099754, 'slip_spread_k': 0.3576493168484055, 'spread_hl_frac': 0.04872122964950268, 'bb_std_mult': 3.10995486468021, 'rsi_os': 40, 'rsi_ob': 91, 'vol_spike': 0.2006493304061381, 'adx_thresh': 18.021143202296173, 'atr_min_pct': 0.02228453448479034, 'atr_max_pct': 0.11969989294146006, 'tp_mult': 1.8593352234260039, 'tsl_mult': 0.2892175392858216, 'strategy': 'mean_reversion', 'time_stop': 113, 'use_sma': True, 'use_atr': False, 'use_adx': False, 'use_ema': False, 'use_spike': False, 'rsi_required': True, 'edge_k': 0.5139905828812487, 'edge_cap': 0.11470301138546284, 'bull_strategy': 'breakout', 'bull_bb_std_mult': 2.173383772449886, 'bull_rsi_os': 27, 'bull_rsi_ob': 59, 'bull_adx_thresh': 5.060880716235473, 'bull_atr_min_pct': 0.009862209841191096, 'bull_atr_max_pct': 0.036810222688937196, 'bull_tp_mult': 2.7660418613200934, 'bull_tsl_mult': 0.22552402792295156, 'bull_time_stop': 235, 'bull_use_sma': True, 'bull_use_ema': False, 'bull_use_atr': False, 'bull_use_adx': True, 'bull_use_spike': True, 'bull_rsi_required': True, 'bear_strategy': 'mean_reversion', 'bear_bb_std_mult': 1.2169292724772367, 'bear_rsi_os': 18, 'bear_rsi_ob': 46, 'bear_adx_thresh': 5.0736723628026414, 'bear_atr_min_pct': 0.014323370722416748, 'bear_atr_max_pct': 0.012516730634581266, 'bear_tp_mult': 2.018191456637259, 'bear_tsl_mult': 0.5077136931411691, 'bear_time_stop': 5, 'bear_use_sma': False, 'bear_use_ema': False, 'bear_use_atr': False, 'bear_use_adx': True, 'bear_use_spike': False, 'bear_rsi_required': True, 'sideways_strategy': 'breakout', 'sideways_bb_std_mult': 2.4496578692864404, 'sideways_rsi_os': 42, 'sideways_rsi_ob': 92, 'sideways_adx_thresh': 5.66640475189522, 'sideways_atr_min_pct': 0.01645163221574914, 'sideways_atr_max_pct': 0.05771497832343595, 'sideways_tp_mult': 1.8117617580198941, 'sideways_tsl_mult': 0.638987367619707, 'sideways_time_stop': 232, 'sideways_use_sma': True, 'sideways_use_ema': False, 'sideways_use_atr': False, 'sideways_use_adx': False, 'sideways_use_spike': True, 'sideways_rsi_required': False}.
[I 2025-08-31 02:42:30,195] Trial 618 finished with values: [-1000000000.0, 1000000000.0] and parameters: {'p_sma': 55, 'p_std': 29, 'p_atr': 29, 'p_adx': 23, 'rsi_period': 70, 'ema1': 6, 'ema2': 36, 'slip_atr_k': 0.15245958835888837, 'slip_spread_k': 0.44076894874336076, 'spread_hl_frac': 0.03160724238375949, 'bb_std_mult': 1.6574823901540103, 'rsi_os': 38, 'rsi_ob': 91, 'vol_spike': 0.10964542237976188, 'adx_thresh': 22.32297976003349, 'atr_min_pct': 0.01002471781962491, 'atr_max_pct': 0.11673855463863643, 'tp_mult': 2.956983345935635, 'tsl_mult': 0.2823392514864795, 'strategy': 'mean_reversion', 'time_stop': 14, 'use_sma': True, 'use_atr': False, 'use_adx': False, 'use_ema': False, 'use_spike': False, 'rsi_required': True, 'edge_k': 0.450532309978503, 'edge_cap': 0.10586192939307654, 'bull_strategy': 'breakout', 'bull_bb_std_mult': 1.2289179445716072, 'bull_rsi_os': 51, 'bull_rsi_ob': 77, 'bull_adx_thresh': 5.582063195736043, 'bull_atr_min_pct': 0.009330691475656776, 'bull_atr_max_pct': 0.140523459473718, 'bull_tp_mult': 2.124776061574076, 'bull_tsl_mult': 0.2574560878872718, 'bull_time_stop': 233, 'bull_use_sma': True, 'bull_use_ema': False, 'bull_use_atr': False, 'bull_use_adx': False, 'bull_use_spike': True, 'bull_rsi_required': True, 'bear_strategy': 'mean_reversion', 'bear_bb_std_mult': 1.5593154159598728, 'bear_rsi_os': 18, 'bear_rsi_ob': 57, 'bear_adx_thresh': 6.460929117351484, 'bear_atr_min_pct': 0.0056451031506563176, 'bear_atr_max_pct': 0.017667088320220112, 'bear_tp_mult': 2.1872974537546783, 'bear_tsl_mult': 0.30772152550958537, 'bear_time_stop': 191, 'bear_use_sma': False, 'bear_use_ema': False, 'bear_use_atr': False, 'bear_use_adx': True, 'bear_use_spike': False, 'bear_rsi_required': True, 'sideways_strategy': 'breakout', 'sideways_bb_std_mult': 0.5435965418500355, 'sideways_rsi_os': 42, 'sideways_rsi_ob': 95, 'sideways_adx_thresh': 9.926950408208567, 'sideways_atr_min_pct': 0.026904422843121875, 'sideways_atr_max_pct': 0.057396968722704264, 'sideways_tp_mult': 1.8239115215676303, 'sideways_tsl_mult': 0.6277456919037281, 'sideways_time_stop': 215, 'sideways_use_sma': True, 'sideways_use_ema': False, 'sideways_use_atr': False, 'sideways_use_adx': False, 'sideways_use_spike': True, 'sideways_rsi_required': False}.
[I 2025-08-31 02:42:30,213] Trial 617 finished with values: [-1000000000.0, 1000000000.0] and parameters: {'p_sma': 8, 'p_std': 56, 'p_atr': 28, 'p_adx': 25, 'rsi_period': 70, 'ema1': 5, 'ema2': 38, 'slip_atr_k': 0.1416566118915455, 'slip_spread_k': 0.8494411575980867, 'spread_hl_frac': 0.03171244369351621, 'bb_std_mult': 1.6535880362711621, 'rsi_os': 38, 'rsi_ob': 91, 'vol_spike': 0.11972606617926702, 'adx_thresh': 20.95742287991829, 'atr_min_pct': 0.009544321427795623, 'atr_max_pct': 0.1345139141211283, 'tp_mult': 1.8015768542122157, 'tsl_mult': 0.29938207406195744, 'strategy': 'mean_reversion', 'time_stop': 11, 'use_sma': True, 'use_atr': False, 'use_adx': False, 'use_ema': False, 'use_spike': False, 'rsi_required': True, 'edge_k': 1.2071372137394747, 'edge_cap': 0.10983986288705119, 'bull_strategy': 'breakout', 'bull_bb_std_mult': 1.214371684455923, 'bull_rsi_os': 42, 'bull_rsi_ob': 59, 'bull_adx_thresh': 5.011441248500008, 'bull_atr_min_pct': 0.009310066558460688, 'bull_atr_max_pct': 0.03784211018870096, 'bull_tp_mult': 2.3243112573514972, 'bull_tsl_mult': 0.22643957750723914, 'bull_time_stop': 220, 'bull_use_sma': True, 'bull_use_ema': True, 'bull_use_atr': False, 'bull_use_adx': False, 'bull_use_spike': True, 'bull_rsi_required': True, 'bear_strategy': 'mean_reversion', 'bear_bb_std_mult': 2.11920283465968, 'bear_rsi_os': 10, 'bear_rsi_ob': 45, 'bear_adx_thresh': 25.425647127130606, 'bear_atr_min_pct': 0.018602885089592777, 'bear_atr_max_pct': 0.016293635083681552, 'bear_tp_mult': 2.0365720997045313, 'bear_tsl_mult': 0.2948197362760038, 'bear_time_stop': 15, 'bear_use_sma': False, 'bear_use_ema': False, 'bear_use_atr': False, 'bear_use_adx': True, 'bear_use_spike': False, 'bear_rsi_required': True, 'sideways_strategy': 'breakout', 'sideways_bb_std_mult': 0.5021506438127049, 'sideways_rsi_os': 39, 'sideways_rsi_ob': 71, 'sideways_adx_thresh': 9.441448381197217, 'sideways_atr_min_pct': 0.02627028199444753, 'sideways_atr_max_pct': 0.05673868508550998, 'sideways_tp_mult': 1.8348075386753735, 'sideways_tsl_mult': 0.6448015282445735, 'sideways_time_stop': 214, 'sideways_use_sma': True, 'sideways_use_ema': False, 'sideways_use_atr': True, 'sideways_use_adx': False, 'sideways_use_spike': True, 'sideways_rsi_required': True}.
[I 2025-08-31 02:42:30,827] Trial 619 finished with values: [-1000000000.0, 1000000000.0] and parameters: {'p_sma': 38, 'p_std': 51, 'p_atr': 30, 'p_adx': 29, 'rsi_period': 82, 'ema1': 5, 'ema2': 42, 'slip_atr_k': 0.1391206010241663, 'slip_spread_k': 0.11174270328805277, 'spread_hl_frac': 0.049730294328001086, 'bb_std_mult': 0.7227483035448719, 'rsi_os': 11, 'rsi_ob': 64, 'vol_spike': 0.19074957537910095, 'adx_thresh': 22.188593319024108, 'atr_min_pct': 0.006653769729882471, 'atr_max_pct': 0.05199719135126543, 'tp_mult': 2.858700570462621, 'tsl_mult': 0.5187797874071264, 'strategy': 'mean_reversion', 'time_stop': 105, 'use_sma': True, 'use_atr': False, 'use_adx': False, 'use_ema': False, 'use_spike': False, 'rsi_required': True, 'edge_k': 1.0663722702530554, 'edge_cap': 0.07946690520236935, 'bull_strategy': 'mean_reversion', 'bull_bb_std_mult': 2.2806482211847734, 'bull_rsi_os': 42, 'bull_rsi_ob': 77, 'bull_adx_thresh': 5.752010343224641, 'bull_atr_min_pct': 0.018570194731373224, 'bull_atr_max_pct': 0.13822628260153222, 'bull_tp_mult': 1.010419977986571, 'bull_tsl_mult': 0.545035131414514, 'bull_time_stop': 126, 'bull_use_sma': True, 'bull_use_ema': True, 'bull_use_atr': False, 'bull_use_adx': False, 'bull_use_spike': True, 'bull_rsi_required': True, 'bear_strategy': 'mean_reversion', 'bear_bb_std_mult': 2.2822248126851434, 'bear_rsi_os': 10, 'bear_rsi_ob': 45, 'bear_adx_thresh': 18.723319834670868, 'bear_atr_min_pct': 0.016619361588858825, 'bear_atr_max_pct': 0.01673449928406616, 'bear_tp_mult': 1.0104636110294212, 'bear_tsl_mult': 0.307707009622449, 'bear_time_stop': 148, 'bear_use_sma': False, 'bear_use_ema': False, 'bear_use_atr': False, 'bear_use_adx': True, 'bear_use_spike': True, 'bear_rsi_required': True, 'sideways_strategy': 'breakout', 'sideways_bb_std_mult': 0.5114033232699957, 'sideways_rsi_os': 39, 'sideways_rsi_ob': 95, 'sideways_adx_thresh': 7.891011034237168, 'sideways_atr_min_pct': 0.003203628609851192, 'sideways_atr_max_pct': 0.11337131329226842, 'sideways_tp_mult': 1.7178836320425188, 'sideways_tsl_mult': 0.6215697918259753, 'sideways_time_stop': 54, 'sideways_use_sma': True, 'sideways_use_ema': False, 'sideways_use_atr': True, 'sideways_use_adx': False, 'sideways_use_spike': True, 'sideways_rsi_required': True}.
[I 2025-08-31 02:42:30,939] Trial 620 finished with values: [-1000000000.0, 1000000000.0] and parameters: {'p_sma': 58, 'p_std': 51, 'p_atr': 28, 'p_adx': 29, 'rsi_period': 70, 'ema1': 20, 'ema2': 58, 'slip_atr_k': 9.030466588876018e-05, 'slip_spread_k': 0.11195383585175467, 'spread_hl_frac': 0.018194743334850293, 'bb_std_mult': 1.4879548194238061, 'rsi_os': 38, 'rsi_ob': 64, 'vol_spike': 0.17708004143221556, 'adx_thresh': 22.38324708606923, 'atr_min_pct': 0.008104508648127355, 'atr_max_pct': 0.11515940868203788, 'tp_mult': 2.830871193497308, 'tsl_mult': 0.8373092844062351, 'strategy': 'mean_reversion', 'time_stop': 106, 'use_sma': True, 'use_atr': False, 'use_adx': False, 'use_ema': False, 'use_spike': False, 'rsi_required': True, 'edge_k': 1.8979899394891617, 'edge_cap': 0.08465567506648697, 'bull_strategy': 'mean_reversion', 'bull_bb_std_mult': 1.6724889235702975, 'bull_rsi_os': 49, 'bull_rsi_ob': 83, 'bull_adx_thresh': 5.665353813132981, 'bull_atr_min_pct': 0.026653230480766524, 'bull_atr_max_pct': 0.13800893094813657, 'bull_tp_mult': 2.3076794629571835, 'bull_tsl_mult': 0.25981822204939214, 'bull_time_stop': 55, 'bull_use_sma': True, 'bull_use_ema': True, 'bull_use_atr': False, 'bull_use_adx': False, 'bull_use_spike': True, 'bull_rsi_required': True, 'bear_strategy': 'mean_reversion', 'bear_bb_std_mult': 1.7539024355920083, 'bear_rsi_os': 10, 'bear_rsi_ob': 45, 'bear_adx_thresh': 6.459526950466371, 'bear_atr_min_pct': 0.005374709337587914, 'bear_atr_max_pct': 0.01731992249901916, 'bear_tp_mult': 2.0903347235752703, 'bear_tsl_mult': 0.3086348625568039, 'bear_time_stop': 93, 'bear_use_sma': False, 'bear_use_ema': False, 'bear_use_atr': False, 'bear_use_adx': True, 'bear_use_spike': True, 'bear_rsi_required': True, 'sideways_strategy': 'breakout', 'sideways_bb_std_mult': 1.819463607545914, 'sideways_rsi_os': 30, 'sideways_rsi_ob': 95, 'sideways_adx_thresh': 7.8493302748779445, 'sideways_atr_min_pct': 0.013799230062059678, 'sideways_atr_max_pct': 0.046561628366711245, 'sideways_tp_mult': 1.7234773413317126, 'sideways_tsl_mult': 0.4857168722465842, 'sideways_time_stop': 57, 'sideways_use_sma': True, 'sideways_use_ema': False, 'sideways_use_atr': True, 'sideways_use_adx': False, 'sideways_use_spike': True, 'sideways_rsi_required': True}.
