[I 2025-08-31 00:10:56,171] Trial 72 finished with values: [-1000000000.0, 1000000000.0] and parameters: {'p_sma': 23, 'p_std': 42, 'p_atr': 19, 'p_adx': 23, 'rsi_period': 84, 'ema1': 23, 'ema2': 31, 'slip_atr_k': 0.08292265347906798, 'slip_spread_k': 0.39927048689377126, 'spread_hl_frac': 0.0038654060472043113, 'bb_std_mult': 2.1858749870325638, 'rsi_os': 22, 'rsi_ob': 80, 'vol_spike': 0.08030443620709955, 'adx_thresh': 21.742750531185155, 'atr_min_pct': 0.00078380946275996, 'atr_max_pct': 0.12026056609224667, 'tp_mult': 2.310686254007311, 'tsl_mult': 0.054472270393105954, 'strategy': 'mean_reversion', 'time_stop': 136, 'use_sma': True, 'use_atr': True, 'use_adx': True, 'use_ema': True, 'use_spike': True, 'rsi_required': False, 'edge_k': 1.1053647360046324, 'edge_cap': 0.8845767256853754, 'bull_strategy': 'breakout', 'bull_bb_std_mult': 0.63711007941114, 'bull_rsi_os': 54, 'bull_rsi_ob': 78, 'bull_adx_thresh': 8.570604710056852, 'bull_atr_min_pct': 0.003984965823683285, 'bull_atr_max_pct': 0.10948437914274267, 'bull_tp_mult': 2.391374868321369, 'bull_tsl_mult': 0.4611104990377501, 'bull_time_stop': 93, 'bull_use_sma': True, 'bull_use_ema': True, 'bull_use_atr': False, 'bull_use_adx': False, 'bull_use_spike': False, 'bull_rsi_required': False, 'bear_strategy': 'breakout', 'bear_bb_std_mult': 1.2863467257657282, 'bear_rsi_os': 17, 'bear_rsi_ob': 79, 'bear_adx_thresh': 34.182384445841315, 'bear_atr_min_pct': 0.014220761117055126, 'bear_atr_max_pct': 0.0956507549870126, 'bear_tp_mult': 2.317794951968538, 'bear_tsl_mult': 0.9238471603039149, 'bear_time_stop': 217, 'bear_use_sma': True, 'bear_use_ema': True, 'bear_use_atr': False, 'bear_use_adx': True, 'bear_use_spike': True, 'bear_rsi_required': True, 'sideways_strategy': 'breakout', 'sideways_bb_std_mult': 2.51047197734048, 'sideways_rsi_os': 48, 'sideways_rsi_ob': 49, 'sideways_adx_thresh': 21.689397711676982, 'sideways_atr_min_pct': 0.014644070575631723, 'sideways_atr_max_pct': 0.07395348900477904, 'sideways_tp_mult': 2.190733699731637, 'sideways_tsl_mult': 0.04955028680968044, 'sideways_time_stop': 119, 'sideways_use_sma': False, 'sideways_use_ema': False, 'sideways_use_atr': False, 'sideways_use_adx': False, 'sideways_use_spike': True, 'sideways_rsi_required': True}.
[I 2025-08-31 00:10:56,445] Trial 73 finished with values: [-1000000000.0, 1000000000.0] and parameters: {'p_sma': 24, 'p_std': 42, 'p_atr': 22, 'p_adx': 23, 'rsi_period': 84, 'ema1': 23, 'ema2': 24, 'slip_atr_k': 0.08050646557109534, 'slip_spread_k': 0.39310699665623816, 'spread_hl_frac': 0.03404973327380822, 'bb_std_mult': 1.7411041812985186, 'rsi_os': 21, 'rsi_ob': 80, 'vol_spike': 0.24034124867240853, 'adx_thresh': 25.752512296825664, 'atr_min_pct': 0.0010459919490878264, 'atr_max_pct': 0.09859159381815917, 'tp_mult': 2.356111544916002, 'tsl_mult': 0.07972047355077681, 'strategy': 'mean_reversion', 'time_stop': 99, 'use_sma': True, 'use_atr': True, 'use_adx': True, 'use_ema': True, 'use_spike': True, 'rsi_required': False, 'edge_k': 1.0705058584728118, 'edge_cap': 0.7908588927949296, 'bull_strategy': 'breakout', 'bull_bb_std_mult': 1.3716246838955208, 'bull_rsi_os': 50, 'bull_rsi_ob': 90, 'bull_adx_thresh': 8.360420890603006, 'bull_atr_min_pct': 0.003986283296579904, 'bull_atr_max_pct': 0.058446056911326996, 'bull_tp_mult': 1.7515493249897722, 'bull_tsl_mult': 0.45481085379913744, 'bull_time_stop': 97, 'bull_use_sma': True, 'bull_use_ema': True, 'bull_use_atr': False, 'bull_use_adx': False, 'bull_use_spike': False, 'bull_rsi_required': False, 'bear_strategy': 'breakout', 'bear_bb_std_mult': 1.3443549032712063, 'bear_rsi_os': 27, 'bear_rsi_ob': 84, 'bear_adx_thresh': 33.935412390148464, 'bear_atr_min_pct': 0.013943124535489525, 'bear_atr_max_pct': 0.09086455144675579, 'bear_tp_mult': 2.326082048403494, 'bear_tsl_mult': 0.9136576312010618, 'bear_time_stop': 67, 'bear_use_sma': True, 'bear_use_ema': True, 'bear_use_atr': False, 'bear_use_adx': True, 'bear_use_spike': True, 'bear_rsi_required': True, 'sideways_strategy': 'breakout', 'sideways_bb_std_mult': 2.406252211185536, 'sideways_rsi_os': 55, 'sideways_rsi_ob': 57, 'sideways_adx_thresh': 22.06455382222795, 'sideways_atr_min_pct': 0.014460617629038507, 'sideways_atr_max_pct': 0.02623974462760517, 'sideways_tp_mult': 2.558154469682721, 'sideways_tsl_mult': 0.04514978553788203, 'sideways_time_stop': 111, 'sideways_use_sma': True, 'sideways_use_ema': False, 'sideways_use_atr': False, 'sideways_use_adx': False, 'sideways_use_spike': True, 'sideways_rsi_required': True}.
[I 2025-08-31 00:10:56,529] Trial 74 finished with values: [-1000000000.0, 1000000000.0] and parameters: {'p_sma': 37, 'p_std': 56, 'p_atr': 19, 'p_adx': 23, 'rsi_period': 59, 'ema1': 23, 'ema2': 36, 'slip_atr_k': 0.24970386786341556, 'slip_spread_k': 0.384890574362894, 'spread_hl_frac': 0.004857267391681606, 'bb_std_mult': 1.9608871496477642, 'rsi_os': 18, 'rsi_ob': 80, 'vol_spike': 0.0803994771391397, 'adx_thresh': 21.65350610900658, 'atr_min_pct': 0.006924979445784447, 'atr_max_pct': 0.09831022652580257, 'tp_mult': 2.287790369202585, 'tsl_mult': 0.07475324999541917, 'strategy': 'mean_reversion', 'time_stop': 137, 'use_sma': True, 'use_atr': True, 'use_adx': True, 'use_ema': True, 'use_spike': True, 'rsi_required': False, 'edge_k': 1.0766198854135631, 'edge_cap': 0.7881598762120532, 'bull_strategy': 'breakout', 'bull_bb_std_mult': 1.374347625112204, 'bull_rsi_os': 54, 'bull_rsi_ob': 78, 'bull_adx_thresh': 8.521511406559297, 'bull_atr_min_pct': 0.004219220867763812, 'bull_atr_max_pct': 0.05785302254584064, 'bull_tp_mult': 1.7621461896151212, 'bull_tsl_mult': 0.45966294801284985, 'bull_time_stop': 42, 'bull_use_sma': True, 'bull_use_ema': True, 'bull_use_atr': False, 'bull_use_adx': False, 'bull_use_spike': True, 'bull_rsi_required': False, 'bear_strategy': 'breakout', 'bear_bb_std_mult': 1.3154879226837697, 'bear_rsi_os': 27, 'bear_rsi_ob': 88, 'bear_adx_thresh': 32.03360768452698, 'bear_atr_min_pct': 0.014142909255186182, 'bear_atr_max_pct': 0.09820204473575828, 'bear_tp_mult': 2.2994300338393976, 'bear_tsl_mult': 0.8157628845512548, 'bear_time_stop': 223, 'bear_use_sma': True, 'bear_use_ema': True, 'bear_use_atr': False, 'bear_use_adx': True, 'bear_use_spike': True, 'bear_rsi_required': True, 'sideways_strategy': 'breakout', 'sideways_bb_std_mult': 2.437743745252585, 'sideways_rsi_os': 49, 'sideways_rsi_ob': 57, 'sideways_adx_thresh': 25.06886101135192, 'sideways_atr_min_pct': 0.014404537679817487, 'sideways_atr_max_pct': 0.10486201202709546, 'sideways_tp_mult': 2.699203753615481, 'sideways_tsl_mult': 0.04794471735214101, 'sideways_time_stop': 119, 'sideways_use_sma': True, 'sideways_use_ema': False, 'sideways_use_atr': False, 'sideways_use_adx': False, 'sideways_use_spike': True, 'sideways_rsi_required': True}.
[I 2025-08-31 00:11:29,281] Trial 78 finished with values: [-1000000000.0, 1000000000.0] and parameters: {'p_sma': 34, 'p_std': 19, 'p_atr': 13, 'p_adx': 19, 'rsi_period': 41, 'ema1': 17, 'ema2': 60, 'slip_atr_k': 0.16686554592732064, 'slip_spread_k': 0.3052859205181526, 'spread_hl_frac': 0.0075627292263289615, 'bb_std_mult': 2.4209455052076714, 'rsi_os': 40, 'rsi_ob': 73, 'vol_spike': 0.09733130511749678, 'adx_thresh': 19.425326697345568, 'atr_min_pct': 0.0027423281930124533, 'atr_max_pct': 0.11499172561515372, 'tp_mult': 1.6520778277007497, 'tsl_mult': 0.1408548501848197, 'strategy': 'mean_reversion', 'time_stop': 189, 'use_sma': False, 'use_atr': True, 'use_adx': False, 'use_ema': False, 'use_spike': False, 'rsi_required': True, 'edge_k': 0.9259064127310129, 'edge_cap': 0.7434687512038247, 'bull_strategy': 'breakout', 'bull_bb_std_mult': 2.6343552753911994, 'bull_rsi_os': 51, 'bull_rsi_ob': 95, 'bull_adx_thresh': 12.972808199128927, 'bull_atr_min_pct': 0.0068932446916101665, 'bull_atr_max_pct': 0.0655543657677897, 'bull_tp_mult': 2.0391973310690794, 'bull_tsl_mult': 0.27782273919273437, 'bull_time_stop': 16, 'bull_use_sma': False, 'bull_use_ema': True, 'bull_use_atr': False, 'bull_use_adx': False, 'bull_use_spike': True, 'bull_rsi_required': False, 'bear_strategy': 'breakout', 'bear_bb_std_mult': 1.0818962573534174, 'bear_rsi_os': 30, 'bear_rsi_ob': 76, 'bear_adx_thresh': 14.409572265286705, 'bear_atr_min_pct': 0.02576876713442145, 'bear_atr_max_pct': 0.08367237478264018, 'bear_tp_mult': 2.7899042424147695, 'bear_tsl_mult': 0.6588327309362481, 'bear_time_stop': 122, 'bear_use_sma': False, 'bear_use_ema': False, 'bear_use_atr': False, 'bear_use_adx': True, 'bear_use_spike': False, 'bear_rsi_required': False, 'sideways_strategy': 'breakout', 'sideways_bb_std_mult': 0.8603159215186027, 'sideways_rsi_os': 52, 'sideways_rsi_ob': 64, 'sideways_adx_thresh': 25.252410671253934, 'sideways_atr_min_pct': 0.015676021974048597, 'sideways_atr_max_pct': 0.09106197267343927, 'sideways_tp_mult': 2.0132995576393453, 'sideways_tsl_mult': 0.08385719453508686, 'sideways_time_stop': 143, 'sideways_use_sma': True, 'sideways_use_ema': False, 'sideways_use_atr': False, 'sideways_use_adx': False, 'sideways_use_spike': False, 'sideways_rsi_required': False}.
[I 2025-08-31 00:11:29,450] Trial 77 finished with values: [-1000000000.0, 1000000000.0] and parameters: {'p_sma': 34, 'p_std': 54, 'p_atr': 18, 'p_adx': 19, 'rsi_period': 40, 'ema1': 19, 'ema2': 36, 'slip_atr_k': 0.24992689205282903, 'slip_spread_k': 0.2759831045486627, 'spread_hl_frac': 0.004827241907438227, 'bb_std_mult': 1.9606930916671037, 'rsi_os': 18, 'rsi_ob': 73, 'vol_spike': 0.09407467067139208, 'adx_thresh': 19.66040357095017, 'atr_min_pct': 0.0026085168250956584, 'atr_max_pct': 0.1293767962554047, 'tp_mult': 1.6123979130123192, 'tsl_mult': 0.14392670436010652, 'strategy': 'mean_reversion', 'time_stop': 190, 'use_sma': False, 'use_atr': True, 'use_adx': False, 'use_ema': False, 'use_spike': False, 'rsi_required': True, 'edge_k': 0.9067943047970999, 'edge_cap': 0.730615289142918, 'bull_strategy': 'breakout', 'bull_bb_std_mult': 2.645561389088469, 'bull_rsi_os': 20, 'bull_rsi_ob': 82, 'bull_adx_thresh': 26.22304457659883, 'bull_atr_min_pct': 0.001070482194404282, 'bull_atr_max_pct': 0.06746824050927572, 'bull_tp_mult': 2.0403927219067852, 'bull_tsl_mult': 0.36782154445064297, 'bull_time_stop': 15, 'bull_use_sma': True, 'bull_use_ema': True, 'bull_use_atr': False, 'bull_use_adx': False, 'bull_use_spike': True, 'bull_rsi_required': False, 'bear_strategy': 'breakout', 'bear_bb_std_mult': 1.1247813504820043, 'bear_rsi_os': 29, 'bear_rsi_ob': 90, 'bear_adx_thresh': 32.07731633869829, 'bear_atr_min_pct': 0.025450497622245292, 'bear_atr_max_pct': 0.08287531165877125, 'bear_tp_mult': 1.0168775874020146, 'bear_tsl_mult': 0.7799623519540829, 'bear_time_stop': 228, 'bear_use_sma': False, 'bear_use_ema': False, 'bear_use_atr': False, 'bear_use_adx': True, 'bear_use_spike': False, 'bear_rsi_required': False, 'sideways_strategy': 'breakout', 'sideways_bb_std_mult': 2.661767413894154, 'sideways_rsi_os': 52, 'sideways_rsi_ob': 64, 'sideways_adx_thresh': 25.326734418261676, 'sideways_atr_min_pct': 0.01385778915556256, 'sideways_atr_max_pct': 0.10403447773737305, 'sideways_tp_mult': 2.0270437009225994, 'sideways_tsl_mult': 0.240929585790738, 'sideways_time_stop': 145, 'sideways_use_sma': True, 'sideways_use_ema': False, 'sideways_use_atr': False, 'sideways_use_adx': False, 'sideways_use_spike': False, 'sideways_rsi_required': False}.
[I 2025-08-31 00:11:29,915] Trial 75 finished with values: [-1000000000.0, 1000000000.0] and parameters: {'p_sma': 37, 'p_std': 19, 'p_atr': 19, 'p_adx': 23, 'rsi_period': 56, 'ema1': 19, 'ema2': 36, 'slip_atr_k': 0.08536108356629724, 'slip_spread_k': 0.2938907806538368, 'spread_hl_frac': 0.005113250156216272, 'bb_std_mult': 2.4344170157097342, 'rsi_os': 22, 'rsi_ob': 73, 'vol_spike': 0.07797706249320213, 'adx_thresh': 25.334275564347877, 'atr_min_pct': 0.002262410206876214, 'atr_max_pct': 0.09862057778734852, 'tp_mult': 1.6532276611098904, 'tsl_mult': 0.09723141892632509, 'strategy': 'mean_reversion', 'time_stop': 192, 'use_sma': True, 'use_atr': True, 'use_adx': True, 'use_ema': True, 'use_spike': True, 'rsi_required': False, 'edge_k': 0.9289379666063533, 'edge_cap': 0.8090603686912285, 'bull_strategy': 'breakout', 'bull_bb_std_mult': 1.3884323619209462, 'bull_rsi_os': 8, 'bull_rsi_ob': 78, 'bull_adx_thresh': 12.796609055954814, 'bull_atr_min_pct': 0.004133539104780937, 'bull_atr_max_pct': 0.06614759933208952, 'bull_tp_mult': 1.7599800883916052, 'bull_tsl_mult': 0.46801040587077025, 'bull_time_stop': 110, 'bull_use_sma': True, 'bull_use_ema': True, 'bull_use_atr': False, 'bull_use_adx': False, 'bull_use_spike': True, 'bull_rsi_required': False, 'bear_strategy': 'breakout', 'bear_bb_std_mult': 1.3428391927754868, 'bear_rsi_os': 27, 'bear_rsi_ob': 88, 'bear_adx_thresh': 32.23292105598217, 'bear_atr_min_pct': 0.014139150534404897, 'bear_atr_max_pct': 0.09822838111746396, 'bear_tp_mult': 1.5681765691972602, 'bear_tsl_mult': 0.29424467849605906, 'bear_time_stop': 110, 'bear_use_sma': True, 'bear_use_ema': True, 'bear_use_atr': False, 'bear_use_adx': True, 'bear_use_spike': True, 'bear_rsi_required': True, 'sideways_strategy': 'breakout', 'sideways_bb_std_mult': 2.396191866789346, 'sideways_rsi_os': 49, 'sideways_rsi_ob': 65, 'sideways_adx_thresh': 25.458695037881753, 'sideways_atr_min_pct': 0.01432252456491834, 'sideways_atr_max_pct': 0.08964342755083873, 'sideways_tp_mult': 2.196393333287058, 'sideways_tsl_mult': 0.0754934135114909, 'sideways_time_stop': 124, 'sideways_use_sma': True, 'sideways_use_ema': False, 'sideways_use_atr': False, 'sideways_use_adx': False, 'sideways_use_spike': True, 'sideways_rsi_required': True}.
[I 2025-08-31 00:11:30,155] Trial 76 finished with values: [-1000000000.0, 1000000000.0] and parameters: {'p_sma': 37, 'p_std': 18, 'p_atr': 23, 'p_adx': 14, 'rsi_period': 42, 'ema1': 19, 'ema2': 21, 'slip_atr_k': 0.20836848748781478, 'slip_spread_k': 0.29294750574581696, 'spread_hl_frac': 0.004753418311575275, 'bb_std_mult': 2.396974549639511, 'rsi_os': 18, 'rsi_ob': 73, 'vol_spike': 0.07965200603958289, 'adx_thresh': 25.91960093947933, 'atr_min_pct': 0.0027119147238810464, 'atr_max_pct': 0.09946619194228182, 'tp_mult': 2.25452526503842, 'tsl_mult': 0.09566620934133752, 'strategy': 'mean_reversion', 'time_stop': 192, 'use_sma': True, 'use_atr': True, 'use_adx': False, 'use_ema': True, 'use_spike': True, 'rsi_required': False, 'edge_k': 1.291623145508431, 'edge_cap': 0.785330912796506, 'bull_strategy': 'breakout', 'bull_bb_std_mult': 2.52515856977225, 'bull_rsi_os': 50, 'bull_rsi_ob': 73, 'bull_adx_thresh': 12.396262895466684, 'bull_atr_min_pct': 0.0038904283959498866, 'bull_atr_max_pct': 0.059096893086678134, 'bull_tp_mult': 2.0100992575138283, 'bull_tsl_mult': 0.46994268547962853, 'bull_time_stop': 42, 'bull_use_sma': True, 'bull_use_ema': True, 'bull_use_atr': False, 'bull_use_adx': False, 'bull_use_spike': True, 'bull_rsi_required': False, 'bear_strategy': 'breakout', 'bear_bb_std_mult': 1.1272015276987217, 'bear_rsi_os': 27, 'bear_rsi_ob': 84, 'bear_adx_thresh': 32.12243010054687, 'bear_atr_min_pct': 0.018486784760282284, 'bear_atr_max_pct': 0.0836397045193179, 'bear_tp_mult': 2.7754066407840243, 'bear_tsl_mult': 0.8966157161388901, 'bear_time_stop': 123, 'bear_use_sma': False, 'bear_use_ema': True, 'bear_use_atr': False, 'bear_use_adx': True, 'bear_use_spike': True, 'bear_rsi_required': True, 'sideways_strategy': 'breakout', 'sideways_bb_std_mult': 2.3846204761563703, 'sideways_rsi_os': 51, 'sideways_rsi_ob': 63, 'sideways_adx_thresh': 25.08782717664124, 'sideways_atr_min_pct': 0.014034156721984275, 'sideways_atr_max_pct': 0.08928838456571718, 'sideways_tp_mult': 2.013916684324339, 'sideways_tsl_mult': 0.23410994100903057, 'sideways_time_stop': 142, 'sideways_use_sma': True, 'sideways_use_ema': False, 'sideways_use_atr': False, 'sideways_use_adx': False, 'sideways_use_spike': True, 'sideways_rsi_required': True}.
[I 2025-08-31 00:12:01,137] Trial 79 finished with values: [-0.0213441809365158, 0.021239060164361116] and parameters: {'p_sma': 28, 'p_std': 34, 'p_atr': 18, 'p_adx': 7, 'rsi_period': 56, 'ema1': 19, 'ema2': 21, 'slip_atr_k': 0.20400095235145854, 'slip_spread_k': 0.5416427143336097, 'spread_hl_frac': 0.011034491622582533, 'bb_std_mult': 3.4334996794814527, 'rsi_os': 14, 'rsi_ob': 95, 'vol_spike': 0.0565836396187719, 'adx_thresh': 25.328066870666433, 'atr_min_pct': 3.8267329141694183e-05, 'atr_max_pct': 0.0336842138023637, 'tp_mult': 2.4194549625569826, 'tsl_mult': 0.09970850382661756, 'strategy': 'mean_reversion', 'time_stop': 38, 'use_sma': True, 'use_atr': True, 'use_adx': False, 'use_ema': False, 'use_spike': False, 'rsi_required': False, 'edge_k': 1.3056153967180137, 'edge_cap': 0.9727634637969186, 'bull_strategy': 'breakout', 'bull_bb_std_mult': 0.8500447807826146, 'bull_rsi_os': 38, 'bull_rsi_ob': 72, 'bull_adx_thresh': 25.86773163603005, 'bull_atr_min_pct': 0.0009828114452065143, 'bull_atr_max_pct': 0.06579163109951353, 'bull_tp_mult': 2.9853662099451057, 'bull_tsl_mult': 0.5547151612919192, 'bull_time_stop': 144, 'bull_use_sma': True, 'bull_use_ema': True, 'bull_use_atr': False, 'bull_use_adx': True, 'bull_use_spike': True, 'bull_rsi_required': False, 'bear_strategy': 'breakout', 'bear_bb_std_mult': 1.1291638111532665, 'bear_rsi_os': 14, 'bear_rsi_ob': 71, 'bear_adx_thresh': 19.427227237520714, 'bear_atr_min_pct': 0.016935351704498766, 'bear_atr_max_pct': 0.13746190685553283, 'bear_tp_mult': 2.68901118774302, 'bear_tsl_mult': 0.8791166954601386, 'bear_time_stop': 183, 'bear_use_sma': False, 'bear_use_ema': False, 'bear_use_atr': True, 'bear_use_adx': True, 'bear_use_spike': False, 'bear_rsi_required': True, 'sideways_strategy': 'breakout', 'sideways_bb_std_mult': 2.6328221080765837, 'sideways_rsi_os': 46, 'sideways_rsi_ob': 67, 'sideways_adx_thresh': 20.034103441779536, 'sideways_atr_min_pct': 0.020837644573163595, 'sideways_atr_max_pct': 0.06766166255169898, 'sideways_tp_mult': 2.86706911311736, 'sideways_tsl_mult': 0.0028363220424650892, 'sideways_time_stop': 127, 'sideways_use_sma': False, 'sideways_use_ema': False, 'sideways_use_atr': False, 'sideways_use_adx': False, 'sideways_use_spike': True, 'sideways_rsi_required': True}.
[I 2025-08-31 00:12:01,328] Trial 81 finished with values: [-0.027601146412812305, 0.027537228793467202] and parameters: {'p_sma': 28, 'p_std': 12, 'p_atr': 14, 'p_adx': 7, 'rsi_period': 33, 'ema1': 16, 'ema2': 21, 'slip_atr_k': 0.20740782460214033, 'slip_spread_k': 0.534729121590092, 'spread_hl_frac': 0.011089727754700974, 'bb_std_mult': 1.4454473490790707, 'rsi_os': 14, 'rsi_ob': 75, 'vol_spike': 0.06184528308925137, 'adx_thresh': 27.30145767239255, 'atr_min_pct': 0.004825093790807922, 'atr_max_pct': 0.038466901320395035, 'tp_mult': 2.596954893812973, 'tsl_mult': 0.1833279884140391, 'strategy': 'mean_reversion', 'time_stop': 150, 'use_sma': True, 'use_atr': False, 'use_adx': False, 'use_ema': False, 'use_spike': False, 'rsi_required': False, 'edge_k': 1.3038715574112834, 'edge_cap': 0.9572860227801873, 'bull_strategy': 'breakout', 'bull_bb_std_mult': 0.8334845325900346, 'bull_rsi_os': 38, 'bull_rsi_ob': 48, 'bull_adx_thresh': 13.773964896251488, 'bull_atr_min_pct': 0.0011998013022381428, 'bull_atr_max_pct': 0.07402194233410113, 'bull_tp_mult': 2.1664449353012243, 'bull_tsl_mult': 0.5589457954560322, 'bull_time_stop': 298, 'bull_use_sma': True, 'bull_use_ema': True, 'bull_use_atr': False, 'bull_use_adx': True, 'bull_use_spike': False, 'bull_rsi_required': False, 'bear_strategy': 'breakout', 'bear_bb_std_mult': 1.1304282602201947, 'bear_rsi_os': 13, 'bear_rsi_ob': 92, 'bear_adx_thresh': 17.949815317436364, 'bear_atr_min_pct': 0.012938540162448305, 'bear_atr_max_pct': 0.01643072999915189, 'bear_tp_mult': 2.6962581557787164, 'bear_tsl_mult': 0.16590397932428375, 'bear_time_stop': 199, 'bear_use_sma': False, 'bear_use_ema': False, 'bear_use_atr': True, 'bear_use_adx': True, 'bear_use_spike': False, 'bear_rsi_required': True, 'sideways_strategy': 'mean_reversion', 'sideways_bb_std_mult': 1.2128929146936103, 'sideways_rsi_os': 46, 'sideways_rsi_ob': 67, 'sideways_adx_thresh': 11.714741867775377, 'sideways_atr_min_pct': 0.020734819859879232, 'sideways_atr_max_pct': 0.06748229646604723, 'sideways_tp_mult': 1.9195393490504236, 'sideways_tsl_mult': 0.14152389626856976, 'sideways_time_stop': 102, 'sideways_use_sma': False, 'sideways_use_ema': False, 'sideways_use_atr': False, 'sideways_use_adx': False, 'sideways_use_spike': True, 'sideways_rsi_required': True}.
