[I 2025-08-31 00:08:14,854] Trial 54 finished with values: [-1000000000.0, 1000000000.0] and parameters: {'p_sma': 44, 'p_std': 7, 'p_atr': 8, 'p_adx': 29, 'rsi_period': 12, 'ema1': 30, 'ema2': 44, 'slip_atr_k': 0.052732658624425416, 'slip_spread_k': 0.8908031748841907, 'spread_hl_frac': 0.003012196261720361, 'bb_std_mult': 2.5164251731218834, 'rsi_os': 49, 'rsi_ob': 69, 'vol_spike': 0.04977485640773846, 'adx_thresh': 33.47932934317665, 'atr_min_pct': 0.005444474397513031, 'atr_max_pct': 0.10324984762218714, 'tp_mult': 1.9428264917826712, 'tsl_mult': 0.6471606222248175, 'strategy': 'mean_reversion', 'time_stop': 29, 'use_sma': False, 'use_atr': True, 'use_adx': False, 'use_ema': False, 'use_spike': False, 'rsi_required': False, 'edge_k': 0.6120128171261758, 'edge_cap': 0.7050034744423183, 'bull_strategy': 'mean_reversion', 'bull_bb_std_mult': 1.0989067478819186, 'bull_rsi_os': 42, 'bull_rsi_ob': 55, 'bull_adx_thresh': 14.84352285594544, 'bull_atr_min_pct': 0.009019241894182612, 'bull_atr_max_pct': 0.11370037157191461, 'bull_tp_mult': 2.7001860697861106, 'bull_tsl_mult': 0.8083488108441289, 'bull_time_stop': 151, 'bull_use_sma': False, 'bull_use_ema': False, 'bull_use_atr': True, 'bull_use_adx': True, 'bull_use_spike': False, 'bull_rsi_required': True, 'bear_strategy': 'mean_reversion', 'bear_bb_std_mult': 2.9219516758439705, 'bear_rsi_os': 43, 'bear_rsi_ob': 53, 'bear_adx_thresh': 33.00014351318718, 'bear_atr_min_pct': 0.02170164165369999, 'bear_atr_max_pct': 0.07323344673137056, 'bear_tp_mult': 1.2356999666831632, 'bear_tsl_mult': 0.5443255519166712, 'bear_time_stop': 109, 'bear_use_sma': True, 'bear_use_ema': False, 'bear_use_atr': True, 'bear_use_adx': False, 'bear_use_spike': True, 'bear_rsi_required': False, 'sideways_strategy': 'breakout', 'sideways_bb_std_mult': 1.4189252042499931, 'sideways_rsi_os': 11, 'sideways_rsi_ob': 76, 'sideways_adx_thresh': 16.689073424747313, 'sideways_atr_min_pct': 0.027433670833919257, 'sideways_atr_max_pct': 0.09596668593098773, 'sideways_tp_mult': 1.7814403916677817, 'sideways_tsl_mult': 0.4664543343998525, 'sideways_time_stop': 224, 'sideways_use_sma': False, 'sideways_use_ema': True, 'sideways_use_atr': True, 'sideways_use_adx': True, 'sideways_use_spike': False, 'sideways_rsi_required': True}.
[I 2025-08-31 00:08:46,497] Trial 55 finished with values: [-1000000000.0, 1000000000.0] and parameters: {'p_sma': 30, 'p_std': 60, 'p_atr': 20, 'p_adx': 29, 'rsi_period': 20, 'ema1': 29, 'ema2': 17, 'slip_atr_k': 0.151908990544718, 'slip_spread_k': 0.5748975390748007, 'spread_hl_frac': 0.03028117694108764, 'bb_std_mult': 1.5732857110483855, 'rsi_os': 29, 'rsi_ob': 70, 'vol_spike': 0.0504342639528592, 'adx_thresh': 18.215877079146683, 'atr_min_pct': 0.005574458376542763, 'atr_max_pct': 0.10299321424644138, 'tp_mult': 1.9424439782185792, 'tsl_mult': 0.6543167596868541, 'strategy': 'breakout', 'time_stop': 154, 'use_sma': False, 'use_atr': True, 'use_adx': False, 'use_ema': False, 'use_spike': False, 'rsi_required': False, 'edge_k': 0.6586801097282791, 'edge_cap': 0.2746064521519327, 'bull_strategy': 'mean_reversion', 'bull_bb_std_mult': 1.086440673588859, 'bull_rsi_os': 43, 'bull_rsi_ob': 62, 'bull_adx_thresh': 15.229578603437607, 'bull_atr_min_pct': 0.009540895450426433, 'bull_atr_max_pct': 0.05659877076125757, 'bull_tp_mult': 2.8321096476165306, 'bull_tsl_mult': 0.9986563679051961, 'bull_time_stop': 283, 'bull_use_sma': True, 'bull_use_ema': False, 'bull_use_atr': True, 'bull_use_adx': True, 'bull_use_spike': False, 'bull_rsi_required': True, 'bear_strategy': 'mean_reversion', 'bear_bb_std_mult': 1.9695723289558447, 'bear_rsi_os': 43, 'bear_rsi_ob': 65, 'bear_adx_thresh': 20.82917783710978, 'bear_atr_min_pct': 0.021301969520714288, 'bear_atr_max_pct': 0.07257849071570582, 'bear_tp_mult': 2.032177896302582, 'bear_tsl_mult': 0.5458202968470257, 'bear_time_stop': 28, 'bear_use_sma': True, 'bear_use_ema': False, 'bear_use_atr': True, 'bear_use_adx': False, 'bear_use_spike': True, 'bear_rsi_required': False, 'sideways_strategy': 'breakout', 'sideways_bb_std_mult': 1.3806637265912243, 'sideways_rsi_os': 50, 'sideways_rsi_ob': 76, 'sideways_adx_thresh': 20.998664162104422, 'sideways_atr_min_pct': 0.00609761767667728, 'sideways_atr_max_pct': 0.09525446722696229, 'sideways_tp_mult': 1.7911341398651557, 'sideways_tsl_mult': 0.6716740579554137, 'sideways_time_stop': 63, 'sideways_use_sma': False, 'sideways_use_ema': True, 'sideways_use_atr': True, 'sideways_use_adx': True, 'sideways_use_spike': False, 'sideways_rsi_required': True}.
[I 2025-08-31 00:08:47,967] Trial 57 finished with values: [-1000000000.0, 1000000000.0] and parameters: {'p_sma': 38, 'p_std': 25, 'p_atr': 8, 'p_adx': 27, 'rsi_period': 20, 'ema1': 7, 'ema2': 33, 'slip_atr_k': 0.15208168918217296, 'slip_spread_k': 0.8778149285648944, 'spread_hl_frac': 0.04559043381725962, 'bb_std_mult': 2.801871106564086, 'rsi_os': 28, 'rsi_ob': 72, 'vol_spike': 0.29267046202843694, 'adx_thresh': 16.707781496625106, 'atr_min_pct': 0.005942568346399059, 'atr_max_pct': 0.0629407400247197, 'tp_mult': 2.791859577141069, 'tsl_mult': 0.5831483972872671, 'strategy': 'mean_reversion', 'time_stop': 281, 'use_sma': True, 'use_atr': True, 'use_adx': False, 'use_ema': True, 'use_spike': False, 'rsi_required': False, 'edge_k': 0.3811539199765417, 'edge_cap': 0.29727804649667844, 'bull_strategy': 'mean_reversion', 'bull_bb_std_mult': 0.6944784265249474, 'bull_rsi_os': 41, 'bull_rsi_ob': 69, 'bull_adx_thresh': 30.376930108261476, 'bull_atr_min_pct': 0.027988425073668326, 'bull_atr_max_pct': 0.04422343655951779, 'bull_tp_mult': 1.5441133483850773, 'bull_tsl_mult': 0.947877983889954, 'bull_time_stop': 157, 'bull_use_sma': True, 'bull_use_ema': False, 'bull_use_atr': True, 'bull_use_adx': True, 'bull_use_spike': True, 'bull_rsi_required': True, 'bear_strategy': 'mean_reversion', 'bear_bb_std_mult': 1.9161426532643995, 'bear_rsi_os': 26, 'bear_rsi_ob': 61, 'bear_adx_thresh': 22.814917922765563, 'bear_atr_min_pct': 0.021668796897113252, 'bear_atr_max_pct': 0.07106112941919579, 'bear_tp_mult': 2.0691081739903585, 'bear_tsl_mult': 0.004672028302776021, 'bear_time_stop': 31, 'bear_use_sma': False, 'bear_use_ema': False, 'bear_use_atr': False, 'bear_use_adx': False, 'bear_use_spike': True, 'bear_rsi_required': True, 'sideways_strategy': 'breakout', 'sideways_bb_std_mult': 2.159123763508423, 'sideways_rsi_os': 50, 'sideways_rsi_ob': 87, 'sideways_adx_thresh': 34.94050075847692, 'sideways_atr_min_pct': 0.027814005861787464, 'sideways_atr_max_pct': 0.09413029168169598, 'sideways_tp_mult': 1.6264447380078564, 'sideways_tsl_mult': 0.7024387255896282, 'sideways_time_stop': 84, 'sideways_use_sma': True, 'sideways_use_ema': True, 'sideways_use_atr': True, 'sideways_use_adx': True, 'sideways_use_spike': True, 'sideways_rsi_required': False}.
[I 2025-08-31 00:08:48,137] Trial 58 finished with values: [-1000000000.0, 1000000000.0] and parameters: {'p_sma': 39, 'p_std': 60, 'p_atr': 8, 'p_adx': 10, 'rsi_period': 22, 'ema1': 7, 'ema2': 17, 'slip_atr_k': 0.04890199790560152, 'slip_spread_k': 0.7711607064338197, 'spread_hl_frac': 0.025921546444402793, 'bb_std_mult': 2.7746701281904036, 'rsi_os': 40, 'rsi_ob': 64, 'vol_spike': 0.2906243240382954, 'adx_thresh': 12.817350455487176, 'atr_min_pct': 0.024765284054801634, 'atr_max_pct': 0.06045705162076701, 'tp_mult': 2.787374292235162, 'tsl_mult': 0.5703553480282458, 'strategy': 'mean_reversion', 'time_stop': 281, 'use_sma': True, 'use_atr': True, 'use_adx': False, 'use_ema': True, 'use_spike': False, 'rsi_required': False, 'edge_k': 0.8255575784686908, 'edge_cap': 0.30322664586144177, 'bull_strategy': 'mean_reversion', 'bull_bb_std_mult': 0.7591008006066075, 'bull_rsi_os': 52, 'bull_rsi_ob': 62, 'bull_adx_thresh': 26.809104375995183, 'bull_atr_min_pct': 0.004690311531223382, 'bull_atr_max_pct': 0.04316483895819063, 'bull_tp_mult': 1.5945626321688873, 'bull_tsl_mult': 0.5806528926973253, 'bull_time_stop': 116, 'bull_use_sma': True, 'bull_use_ema': False, 'bull_use_atr': True, 'bull_use_adx': True, 'bull_use_spike': True, 'bull_rsi_required': True, 'bear_strategy': 'mean_reversion', 'bear_bb_std_mult': 1.9047327219154127, 'bear_rsi_os': 9, 'bear_rsi_ob': 66, 'bear_adx_thresh': 22.652525667765776, 'bear_atr_min_pct': 0.011353910916861498, 'bear_atr_max_pct': 0.06407543560438118, 'bear_tp_mult': 2.0451355684150516, 'bear_tsl_mult': 0.9908831354153418, 'bear_time_stop': 160, 'bear_use_sma': False, 'bear_use_ema': False, 'bear_use_atr': False, 'bear_use_adx': False, 'bear_use_spike': False, 'bear_rsi_required': True, 'sideways_strategy': 'breakout', 'sideways_bb_std_mult': 2.158797824730078, 'sideways_rsi_os': 50, 'sideways_rsi_ob': 87, 'sideways_adx_thresh': 32.359114098617496, 'sideways_atr_min_pct': 0.02317682321637079, 'sideways_atr_max_pct': 0.14660513378546622, 'sideways_tp_mult': 1.639947821339292, 'sideways_tsl_mult': 0.654246295117421, 'sideways_time_stop': 84, 'sideways_use_sma': True, 'sideways_use_ema': True, 'sideways_use_atr': True, 'sideways_use_adx': True, 'sideways_use_spike': True, 'sideways_rsi_required': False}.
[I 2025-08-31 00:08:48,215] Trial 56 finished with values: [-1000000000.0, 1000000000.0] and parameters: {'p_sma': 39, 'p_std': 31, 'p_atr': 8, 'p_adx': 10, 'rsi_period': 20, 'ema1': 7, 'ema2': 18, 'slip_atr_k': 0.14945254578952877, 'slip_spread_k': 0.8642227802092539, 'spread_hl_frac': 0.02534099139368223, 'bb_std_mult': 2.7859289711641164, 'rsi_os': 28, 'rsi_ob': 71, 'vol_spike': 0.08994245443234775, 'adx_thresh': 17.564422637322295, 'atr_min_pct': 0.006328196110291836, 'atr_max_pct': 0.05928250667210509, 'tp_mult': 2.796048011099406, 'tsl_mult': 0.6427405415072986, 'strategy': 'mean_reversion', 'time_stop': 166, 'use_sma': True, 'use_atr': True, 'use_adx': False, 'use_ema': True, 'use_spike': False, 'rsi_required': False, 'edge_k': 0.6753427732737209, 'edge_cap': 0.2940686750173972, 'bull_strategy': 'mean_reversion', 'bull_bb_std_mult': 0.7609520190671902, 'bull_rsi_os': 16, 'bull_rsi_ob': 62, 'bull_adx_thresh': 8.692250902799184, 'bull_atr_min_pct': 0.026843418956938918, 'bull_atr_max_pct': 0.04550477236720956, 'bull_tp_mult': 1.4802539360202136, 'bull_tsl_mult': 0.585031313521393, 'bull_time_stop': 276, 'bull_use_sma': True, 'bull_use_ema': False, 'bull_use_atr': True, 'bull_use_adx': True, 'bull_use_spike': True, 'bull_rsi_required': True, 'bear_strategy': 'mean_reversion', 'bear_bb_std_mult': 1.923000911271177, 'bear_rsi_os': 43, 'bear_rsi_ob': 66, 'bear_adx_thresh': 22.737107286618592, 'bear_atr_min_pct': 0.02070243790738603, 'bear_atr_max_pct': 0.06531520627150247, 'bear_tp_mult': 1.700778643091629, 'bear_tsl_mult': 0.6451278106597713, 'bear_time_stop': 190, 'bear_use_sma': False, 'bear_use_ema': False, 'bear_use_atr': False, 'bear_use_adx': False, 'bear_use_spike': True, 'bear_rsi_required': True, 'sideways_strategy': 'breakout', 'sideways_bb_std_mult': 2.1886146674995537, 'sideways_rsi_os': 51, 'sideways_rsi_ob': 85, 'sideways_adx_thresh': 16.52818504664329, 'sideways_atr_min_pct': 0.026000015401472256, 'sideways_atr_max_pct': 0.09691368097332377, 'sideways_tp_mult': 1.7675706784372707, 'sideways_tsl_mult': 0.694497207798887, 'sideways_time_stop': 89, 'sideways_use_sma': True, 'sideways_use_ema': True, 'sideways_use_atr': True, 'sideways_use_adx': True, 'sideways_use_spike': True, 'sideways_rsi_required': False}.
[I 2025-08-31 00:09:20,078] Trial 61 finished with values: [-0.025168813467789874, 0.025068714246932303] and parameters: {'p_sma': 32, 'p_std': 30, 'p_atr': 28, 'p_adx': 25, 'rsi_period': 84, 'ema1': 18, 'ema2': 11, 'slip_atr_k': 0.24724672686831545, 'slip_spread_k': 0.6602561672844636, 'spread_hl_frac': 0.010834250205594385, 'bb_std_mult': 2.294835603385267, 'rsi_os': 37, 'rsi_ob': 76, 'vol_spike': 0.034235439563856204, 'adx_thresh': 8.600965662957597, 'atr_min_pct': 0.02998506675794231, 'atr_max_pct': 0.14114757458562444, 'tp_mult': 1.5514994666072273, 'tsl_mult': 0.07464416541441138, 'strategy': 'mean_reversion', 'time_stop': 224, 'use_sma': True, 'use_atr': True, 'use_adx': False, 'use_ema': False, 'use_spike': False, 'rsi_required': False, 'edge_k': 1.0535575546413551, 'edge_cap': 0.8233251834481707, 'bull_strategy': 'breakout', 'bull_bb_std_mult': 0.5835780861306418, 'bull_rsi_os': 48, 'bull_rsi_ob': 78, 'bull_adx_thresh': 6.373239713319437, 'bull_atr_min_pct': 0.00021150056243918192, 'bull_atr_max_pct': 0.09093886747794248, 'bull_tp_mult': 1.7564269397529064, 'bull_tsl_mult': 0.48981162981003695, 'bull_time_stop': 72, 'bull_use_sma': True, 'bull_use_ema': True, 'bull_use_atr': False, 'bull_use_adx': False, 'bull_use_spike': False, 'bull_rsi_required': False, 'bear_strategy': 'breakout', 'bear_bb_std_mult': 2.687916708054437, 'bear_rsi_os': 38, 'bear_rsi_ob': 80, 'bear_adx_thresh': 29.89258616068716, 'bear_atr_min_pct': 0.01637094502725829, 'bear_atr_max_pct': 0.08547759239175928, 'bear_tp_mult': 1.6243987457146556, 'bear_tsl_mult': 0.7438189288191182, 'bear_time_stop': 190, 'bear_use_sma': False, 'bear_use_ema': False, 'bear_use_atr': False, 'bear_use_adx': True, 'bear_use_spike': False, 'bear_rsi_required': True, 'sideways_strategy': 'breakout', 'sideways_bb_std_mult': 1.9698671303497095, 'sideways_rsi_os': 7, 'sideways_rsi_ob': 85, 'sideways_adx_thresh': 6.826734907404477, 'sideways_atr_min_pct': 0.014154218574052272, 'sideways_atr_max_pct': 0.08296434893410014, 'sideways_tp_mult': 1.9605210075713848, 'sideways_tsl_mult': 0.8041642419892647, 'sideways_time_stop': 170, 'sideways_use_sma': False, 'sideways_use_ema': False, 'sideways_use_atr': False, 'sideways_use_adx': False, 'sideways_use_spike': True, 'sideways_rsi_required': True}.
[I 2025-08-31 00:09:20,293] Trial 62 finished with values: [-1000000000.0, 1000000000.0] and parameters: {'p_sma': 24, 'p_std': 24, 'p_atr': 11, 'p_adx': 13, 'rsi_period': 10, 'ema1': 26, 'ema2': 47, 'slip_atr_k': 0.06914704450293022, 'slip_spread_k': 0.6729800561936287, 'spread_hl_frac': 0.006313489800454299, 'bb_std_mult': 2.2739818766828144, 'rsi_os': 9, 'rsi_ob': 77, 'vol_spike': 0.2040018364937931, 'adx_thresh': 22.305733617060227, 'atr_min_pct': 0.0021134222158724018, 'atr_max_pct': 0.050367866183701815, 'tp_mult': 1.5080636107802168, 'tsl_mult': 0.4245515338034296, 'strategy': 'mean_reversion', 'time_stop': 230, 'use_sma': True, 'use_atr': True, 'use_adx': False, 'use_ema': False, 'use_spike': False, 'rsi_required': False, 'edge_k': 1.0398496865216713, 'edge_cap': 0.3890419639610741, 'bull_strategy': 'breakout', 'bull_bb_std_mult': 0.5908994732796142, 'bull_rsi_os': 53, 'bull_rsi_ob': 77, 'bull_adx_thresh': 6.103290808903093, 'bull_atr_min_pct': 0.000429378515632904, 'bull_atr_max_pct': 0.07067077188299056, 'bull_tp_mult': 1.7854511343777573, 'bull_tsl_mult': 0.46000774303351477, 'bull_time_stop': 105, 'bull_use_sma': True, 'bull_use_ema': True, 'bull_use_atr': False, 'bull_use_adx': False, 'bull_use_spike': False, 'bull_rsi_required': False, 'bear_strategy': 'breakout', 'bear_bb_std_mult': 2.3099465001889197, 'bear_rsi_os': 37, 'bear_rsi_ob': 87, 'bear_adx_thresh': 30.511948524085483, 'bear_atr_min_pct': 0.005716219352025935, 'bear_atr_max_pct': 0.08286077746173513, 'bear_tp_mult': 2.4035298242439014, 'bear_tsl_mult': 0.9135824993836528, 'bear_time_stop': 135, 'bear_use_sma': False, 'bear_use_ema': False, 'bear_use_atr': False, 'bear_use_adx': True, 'bear_use_spike': False, 'bear_rsi_required': True, 'sideways_strategy': 'mean_reversion', 'sideways_bb_std_mult': 3.3062680936193924, 'sideways_rsi_os': 55, 'sideways_rsi_ob': 79, 'sideways_adx_thresh': 6.8835352714056235, 'sideways_atr_min_pct': 0.014418337101547938, 'sideways_atr_max_pct': 0.08379695131397237, 'sideways_tp_mult': 2.1431910381617203, 'sideways_tsl_mult': 0.6084619944521192, 'sideways_time_stop': 122, 'sideways_use_sma': False, 'sideways_use_ema': False, 'sideways_use_atr': False, 'sideways_use_adx': False, 'sideways_use_spike': True, 'sideways_rsi_required': True}.
[I 2025-08-31 00:09:20,456] Trial 60 finished with values: [-0.016696977240398314, 0.016631498200784762] and parameters: {'p_sma': 33, 'p_std': 31, 'p_atr': 11, 'p_adx': 25, 'rsi_period': 84, 'ema1': 26, 'ema2': 20, 'slip_atr_k': 0.06852295557361722, 'slip_spread_k': 0.511192233552467, 'spread_hl_frac': 0.00021405278986253579, 'bb_std_mult': 2.283007809803458, 'rsi_os': 22, 'rsi_ob': 76, 'vol_spike': 0.09105747022494466, 'adx_thresh': 22.681085816299408, 'atr_min_pct': 0.002675933829397294, 'atr_max_pct': 0.1119584189526466, 'tp_mult': 2.430240335658259, 'tsl_mult': 0.051246541434207316, 'strategy': 'mean_reversion', 'time_stop': 169, 'use_sma': True, 'use_atr': True, 'use_adx': False, 'use_ema': False, 'use_spike': False, 'rsi_required': False, 'edge_k': 1.0148202143718985, 'edge_cap': 0.8339492602145732, 'bull_strategy': 'breakout', 'bull_bb_std_mult': 0.5114034862118999, 'bull_rsi_os': 48, 'bull_rsi_ob': 78, 'bull_adx_thresh': 6.411087360688488, 'bull_atr_min_pct': 0.000783147485491944, 'bull_atr_max_pct': 0.07385985637471812, 'bull_tp_mult': 2.1182706787701564, 'bull_tsl_mult': 0.47376639028667156, 'bull_time_stop': 127, 'bull_use_sma': True, 'bull_use_ema': True, 'bull_use_atr': False, 'bull_use_adx': False, 'bull_use_spike': False, 'bull_rsi_required': False, 'bear_strategy': 'breakout', 'bear_bb_std_mult': 0.9770058711344656, 'bear_rsi_os': 22, 'bear_rsi_ob': 79, 'bear_adx_thresh': 34.989281179729915, 'bear_atr_min_pct': 0.014078755658947005, 'bear_atr_max_pct': 0.08359063382779423, 'bear_tp_mult': 2.453524610482014, 'bear_tsl_mult': 0.740433448957091, 'bear_time_stop': 194, 'bear_use_sma': False, 'bear_use_ema': False, 'bear_use_atr': False, 'bear_use_adx': True, 'bear_use_spike': False, 'bear_rsi_required': True, 'sideways_strategy': 'breakout', 'sideways_bb_std_mult': 2.4511835473088843, 'sideways_rsi_os': 55, 'sideways_rsi_ob': 69, 'sideways_adx_thresh': 23.15737012760188, 'sideways_atr_min_pct': 0.014536916608289487, 'sideways_atr_max_pct': 0.0847712374512214, 'sideways_tp_mult': 1.9787290365018932, 'sideways_tsl_mult': 0.10419491101187234, 'sideways_time_stop': 125, 'sideways_use_sma': False, 'sideways_use_ema': False, 'sideways_use_atr': False, 'sideways_use_adx': False, 'sideways_use_spike': True, 'sideways_rsi_required': True}.
[I 2025-08-31 00:09:20,855] Trial 59 finished with values: [-1000000000.0, 1000000000.0] and parameters: {'p_sma': 56, 'p_std': 23, 'p_atr': 8, 'p_adx': 27, 'rsi_period': 22, 'ema1': 7, 'ema2': 12, 'slip_atr_k': 0.006754196472509308, 'slip_spread_k': 0.6531720877062553, 'spread_hl_frac': 0.005563379136479529, 'bb_std_mult': 2.7655139269455082, 'rsi_os': 38, 'rsi_ob': 65, 'vol_spike': 0.09048310003804563, 'adx_thresh': 34.847272906679414, 'atr_min_pct': 0.017652328111170866, 'atr_max_pct': 0.11197091949445737, 'tp_mult': 2.77157172783596, 'tsl_mult': 0.5606402339223409, 'strategy': 'mean_reversion', 'time_stop': 170, 'use_sma': True, 'use_atr': True, 'use_adx': False, 'use_ema': True, 'use_spike': False, 'rsi_required': False, 'edge_k': 0.8288008972632928, 'edge_cap': 0.8370412274999957, 'bull_strategy': 'mean_reversion', 'bull_bb_std_mult': 0.7728838845387356, 'bull_rsi_os': 53, 'bull_rsi_ob': 77, 'bull_adx_thresh': 6.234436935086011, 'bull_atr_min_pct': 0.02885221345732198, 'bull_atr_max_pct': 0.0438915934548957, 'bull_tp_mult': 1.5792361673724662, 'bull_tsl_mult': 0.5831932149135319, 'bull_time_stop': 125, 'bull_use_sma': True, 'bull_use_ema': True, 'bull_use_atr': False, 'bull_use_adx': False, 'bull_use_spike': True, 'bull_rsi_required': True, 'bear_strategy': 'mean_reversion', 'bear_bb_std_mult': 2.7099591043042675, 'bear_rsi_os': 9, 'bear_rsi_ob': 49, 'bear_adx_thresh': 30.108023514848817, 'bear_atr_min_pct': 0.014025531455923087, 'bear_atr_max_pct': 0.06363738908573904, 'bear_tp_mult': 1.6476884256739521, 'bear_tsl_mult': 0.7500971115420383, 'bear_time_stop': 189, 'bear_use_sma': False, 'bear_use_ema': False, 'bear_use_atr': False, 'bear_use_adx': False, 'bear_use_spike': False, 'bear_rsi_required': True, 'sideways_strategy': 'breakout', 'sideways_bb_std_mult': 2.4372816645458126, 'sideways_rsi_os': 8, 'sideways_rsi_ob': 85, 'sideways_adx_thresh': 32.567684295036685, 'sideways_atr_min_pct': 0.022991371646246227, 'sideways_atr_max_pct': 0.08567706021041455, 'sideways_tp_mult': 1.6135683196884205, 'sideways_tsl_mult': 0.6334232369034294, 'sideways_time_stop': 89, 'sideways_use_sma': True, 'sideways_use_ema': True, 'sideways_use_atr': True, 'sideways_use_adx': True, 'sideways_use_spike': True, 'sideways_rsi_required': False}.
