[I 2025-08-31 00:45:26,311] Trial 372 finished with values: [-1000000000.0, 1000000000.0] and parameters: {'p_sma': 60, 'p_std': 41, 'p_atr': 22, 'p_adx': 26, 'rsi_period': 59, 'ema1': 6, 'ema2': 22, 'slip_atr_k': 0.040807264789498865, 'slip_spread_k': 0.2616148931043561, 'spread_hl_frac': 0.008260607047363979, 'bb_std_mult': 1.3607139677300433, 'rsi_os': 54, 'rsi_ob': 51, 'vol_spike': 0.040612779574183425, 'adx_thresh': 12.027501528044168, 'atr_min_pct': 0.006916630177272419, 'atr_max_pct': 0.057107665159974785, 'tp_mult': 2.5491499407938862, 'tsl_mult': 0.12953775330901648, 'strategy': 'breakout', 'time_stop': 147, 'use_sma': False, 'use_atr': True, 'use_adx': False, 'use_ema': True, 'use_spike': False, 'rsi_required': False, 'edge_k': 1.8642407531968765, 'edge_cap': 0.4359531657188966, 'bull_strategy': 'breakout', 'bull_bb_std_mult': 1.3752105019098875, 'bull_rsi_os': 38, 'bull_rsi_ob': 84, 'bull_adx_thresh': 13.290620708379803, 'bull_atr_min_pct': 0.0019495896596482439, 'bull_atr_max_pct': 0.12542857233036026, 'bull_tp_mult': 2.4398237337629136, 'bull_tsl_mult': 0.8303891971499695, 'bull_time_stop': 146, 'bull_use_sma': False, 'bull_use_ema': False, 'bull_use_atr': True, 'bull_use_adx': False, 'bull_use_spike': True, 'bull_rsi_required': False, 'bear_strategy': 'mean_reversion', 'bear_bb_std_mult': 2.755227932075119, 'bear_rsi_os': 55, 'bear_rsi_ob': 81, 'bear_adx_thresh': 7.484643342566408, 'bear_atr_min_pct': 0.008327384046070647, 'bear_atr_max_pct': 0.024505720513476447, 'bear_tp_mult': 1.860718990263793, 'bear_tsl_mult': 0.37138004053263174, 'bear_time_stop': 135, 'bear_use_sma': True, 'bear_use_ema': False, 'bear_use_atr': False, 'bear_use_adx': True, 'bear_use_spike': False, 'bear_rsi_required': False, 'sideways_strategy': 'mean_reversion', 'sideways_bb_std_mult': 1.0863780643919942, 'sideways_rsi_os': 47, 'sideways_rsi_ob': 88, 'sideways_adx_thresh': 15.77452984749786, 'sideways_atr_min_pct': 0.020854421783513724, 'sideways_atr_max_pct': 0.1169047348723084, 'sideways_tp_mult': 1.8828295521311336, 'sideways_tsl_mult': 0.7597402013297824, 'sideways_time_stop': 159, 'sideways_use_sma': True, 'sideways_use_ema': False, 'sideways_use_atr': False, 'sideways_use_adx': False, 'sideways_use_spike': True, 'sideways_rsi_required': False}.
[I 2025-08-31 00:45:26,353] Trial 369 finished with values: [-1000000000.0, 1000000000.0] and parameters: {'p_sma': 34, 'p_std': 59, 'p_atr': 23, 'p_adx': 9, 'rsi_period': 59, 'ema1': 5, 'ema2': 58, 'slip_atr_k': 0.040728700073087945, 'slip_spread_k': 0.7632122904940621, 'spread_hl_frac': 0.007603579053521667, 'bb_std_mult': 1.038869776958598, 'rsi_os': 51, 'rsi_ob': 73, 'vol_spike': 0.14362188041907886, 'adx_thresh': 11.490988338566265, 'atr_min_pct': 0.012579963337498355, 'atr_max_pct': 0.1350520816735831, 'tp_mult': 2.567407376944397, 'tsl_mult': 0.9499070331071493, 'strategy': 'breakout', 'time_stop': 83, 'use_sma': True, 'use_atr': False, 'use_adx': False, 'use_ema': True, 'use_spike': False, 'rsi_required': False, 'edge_k': 1.3420998642851167, 'edge_cap': 0.8194914952550365, 'bull_strategy': 'breakout', 'bull_bb_std_mult': 2.74502602783585, 'bull_rsi_os': 19, 'bull_rsi_ob': 87, 'bull_adx_thresh': 8.02966017720426, 'bull_atr_min_pct': 0.002075126315725151, 'bull_atr_max_pct': 0.06818162582967677, 'bull_tp_mult': 2.2834805894032977, 'bull_tsl_mult': 0.10645525855210125, 'bull_time_stop': 148, 'bull_use_sma': False, 'bull_use_ema': False, 'bull_use_atr': True, 'bull_use_adx': True, 'bull_use_spike': False, 'bull_rsi_required': False, 'bear_strategy': 'mean_reversion', 'bear_bb_std_mult': 2.750631024226372, 'bear_rsi_os': 24, 'bear_rsi_ob': 84, 'bear_adx_thresh': 7.585816373938003, 'bear_atr_min_pct': 0.009257829000591383, 'bear_atr_max_pct': 0.03357377625738157, 'bear_tp_mult': 1.8438930176801893, 'bear_tsl_mult': 0.9364952864421816, 'bear_time_stop': 222, 'bear_use_sma': True, 'bear_use_ema': False, 'bear_use_atr': False, 'bear_use_adx': True, 'bear_use_spike': False, 'bear_rsi_required': False, 'sideways_strategy': 'mean_reversion', 'sideways_bb_std_mult': 2.6445279752002087, 'sideways_rsi_os': 38, 'sideways_rsi_ob': 88, 'sideways_adx_thresh': 15.891529856875465, 'sideways_atr_min_pct': 0.020925868919003034, 'sideways_atr_max_pct': 0.13994266491009655, 'sideways_tp_mult': 1.8810976142833302, 'sideways_tsl_mult': 0.6786084678761993, 'sideways_time_stop': 139, 'sideways_use_sma': True, 'sideways_use_ema': False, 'sideways_use_atr': False, 'sideways_use_adx': False, 'sideways_use_spike': True, 'sideways_rsi_required': False}.
[I 2025-08-31 00:45:26,571] Trial 371 finished with values: [-1000000000.0, 1000000000.0] and parameters: {'p_sma': 60, 'p_std': 60, 'p_atr': 22, 'p_adx': 8, 'rsi_period': 84, 'ema1': 5, 'ema2': 20, 'slip_atr_k': 0.04248928692076515, 'slip_spread_k': 0.26715373215935506, 'spread_hl_frac': 0.008222829493003098, 'bb_std_mult': 2.1932690724326362, 'rsi_os': 54, 'rsi_ob': 73, 'vol_spike': 0.1430721491096425, 'adx_thresh': 19.051604113844128, 'atr_min_pct': 0.01270685584686588, 'atr_max_pct': 0.056944716963495366, 'tp_mult': 2.5441844866478576, 'tsl_mult': 0.0589424389351253, 'strategy': 'breakout', 'time_stop': 69, 'use_sma': False, 'use_atr': True, 'use_adx': False, 'use_ema': True, 'use_spike': False, 'rsi_required': False, 'edge_k': 0.9676432097087465, 'edge_cap': 0.4292763394970366, 'bull_strategy': 'breakout', 'bull_bb_std_mult': 2.7437305836152825, 'bull_rsi_os': 40, 'bull_rsi_ob': 48, 'bull_adx_thresh': 21.83493514616433, 'bull_atr_min_pct': 0.01561965806634768, 'bull_atr_max_pct': 0.07162368901681651, 'bull_tp_mult': 2.3412299884284997, 'bull_tsl_mult': 0.26295876175166455, 'bull_time_stop': 145, 'bull_use_sma': False, 'bull_use_ema': False, 'bull_use_atr': True, 'bull_use_adx': False, 'bull_use_spike': True, 'bull_rsi_required': False, 'bear_strategy': 'mean_reversion', 'bear_bb_std_mult': 1.2308530226115586, 'bear_rsi_os': 21, 'bear_rsi_ob': 82, 'bear_adx_thresh': 34.02607951285219, 'bear_atr_min_pct': 0.008310717707669986, 'bear_atr_max_pct': 0.032695136818280665, 'bear_tp_mult': 1.8445678759272541, 'bear_tsl_mult': 0.6109721828329207, 'bear_time_stop': 111, 'bear_use_sma': True, 'bear_use_ema': False, 'bear_use_atr': False, 'bear_use_adx': True, 'bear_use_spike': False, 'bear_rsi_required': False, 'sideways_strategy': 'mean_reversion', 'sideways_bb_std_mult': 1.1574040367701848, 'sideways_rsi_os': 47, 'sideways_rsi_ob': 45, 'sideways_adx_thresh': 34.40091317369659, 'sideways_atr_min_pct': 0.024902534873656356, 'sideways_atr_max_pct': 0.14781476697276535, 'sideways_tp_mult': 1.8773430155842885, 'sideways_tsl_mult': 0.9997944398556597, 'sideways_time_stop': 159, 'sideways_use_sma': True, 'sideways_use_ema': False, 'sideways_use_atr': False, 'sideways_use_adx': False, 'sideways_use_spike': True, 'sideways_rsi_required': False}.
[I 2025-08-31 00:45:26,687] Trial 370 finished with values: [-1000000000.0, 1000000000.0] and parameters: {'p_sma': 5, 'p_std': 44, 'p_atr': 22, 'p_adx': 25, 'rsi_period': 59, 'ema1': 5, 'ema2': 20, 'slip_atr_k': 0.0414768770197835, 'slip_spread_k': 0.2685046874669259, 'spread_hl_frac': 0.008483591749214061, 'bb_std_mult': 2.8039348783329894, 'rsi_os': 54, 'rsi_ob': 73, 'vol_spike': 0.21846510099492394, 'adx_thresh': 11.474389899361356, 'atr_min_pct': 0.009989048963056827, 'atr_max_pct': 0.06943885316581845, 'tp_mult': 2.5509601983490926, 'tsl_mult': 0.0703600814948655, 'strategy': 'breakout', 'time_stop': 83, 'use_sma': False, 'use_atr': True, 'use_adx': False, 'use_ema': True, 'use_spike': False, 'rsi_required': False, 'edge_k': 0.35715832439701267, 'edge_cap': 0.11070329168815057, 'bull_strategy': 'breakout', 'bull_bb_std_mult': 2.7398068230315604, 'bull_rsi_os': 38, 'bull_rsi_ob': 72, 'bull_adx_thresh': 13.241963111468763, 'bull_atr_min_pct': 0.015355389418908749, 'bull_atr_max_pct': 0.037656844097590014, 'bull_tp_mult': 2.2764756591516413, 'bull_tsl_mult': 0.28077345201681553, 'bull_time_stop': 146, 'bull_use_sma': False, 'bull_use_ema': False, 'bull_use_atr': True, 'bull_use_adx': False, 'bull_use_spike': True, 'bull_rsi_required': False, 'bear_strategy': 'mean_reversion', 'bear_bb_std_mult': 1.205817402567702, 'bear_rsi_os': 21, 'bear_rsi_ob': 78, 'bear_adx_thresh': 34.08006685677148, 'bear_atr_min_pct': 0.024823287400470337, 'bear_atr_max_pct': 0.03259273876720402, 'bear_tp_mult': 1.84169551926702, 'bear_tsl_mult': 0.6106532353838034, 'bear_time_stop': 137, 'bear_use_sma': True, 'bear_use_ema': False, 'bear_use_atr': False, 'bear_use_adx': True, 'bear_use_spike': False, 'bear_rsi_required': False, 'sideways_strategy': 'mean_reversion', 'sideways_bb_std_mult': 3.025281801628554, 'sideways_rsi_os': 47, 'sideways_rsi_ob': 45, 'sideways_adx_thresh': 34.361972969020066, 'sideways_atr_min_pct': 0.017925422727459363, 'sideways_atr_max_pct': 0.14865960961991942, 'sideways_tp_mult': 2.235545308536799, 'sideways_tsl_mult': 0.9475300664986266, 'sideways_time_stop': 155, 'sideways_use_sma': True, 'sideways_use_ema': False, 'sideways_use_atr': False, 'sideways_use_adx': False, 'sideways_use_spike': True, 'sideways_rsi_required': False}.
[I 2025-08-31 00:46:05,381] Trial 373 finished with values: [-1000000000.0, 1000000000.0] and parameters: {'p_sma': 50, 'p_std': 43, 'p_atr': 23, 'p_adx': 7, 'rsi_period': 55, 'ema1': 8, 'ema2': 20, 'slip_atr_k': 0.03408757845548471, 'slip_spread_k': 0.270396635644308, 'spread_hl_frac': 0.010202755766207907, 'bb_std_mult': 2.7833508480772196, 'rsi_os': 40, 'rsi_ob': 68, 'vol_spike': 0.21827142309740788, 'adx_thresh': 10.81412657169615, 'atr_min_pct': 0.009975984709804908, 'atr_max_pct': 0.06927218134739202, 'tp_mult': 2.664383534290895, 'tsl_mult': 0.1647136418784761, 'strategy': 'mean_reversion', 'time_stop': 6, 'use_sma': True, 'use_atr': True, 'use_adx': False, 'use_ema': True, 'use_spike': False, 'rsi_required': False, 'edge_k': 1.5273434279521876, 'edge_cap': 0.6569297076845051, 'bull_strategy': 'breakout', 'bull_bb_std_mult': 2.745336063473931, 'bull_rsi_os': 40, 'bull_rsi_ob': 71, 'bull_adx_thresh': 14.866925248223149, 'bull_atr_min_pct': 0.007081970821980088, 'bull_atr_max_pct': 0.0422743420446372, 'bull_tp_mult': 1.1365046163473271, 'bull_tsl_mult': 0.2729249992740576, 'bull_time_stop': 205, 'bull_use_sma': False, 'bull_use_ema': False, 'bull_use_atr': True, 'bull_use_adx': False, 'bull_use_spike': True, 'bull_rsi_required': True, 'bear_strategy': 'mean_reversion', 'bear_bb_std_mult': 1.2377452561324103, 'bear_rsi_os': 21, 'bear_rsi_ob': 78, 'bear_adx_thresh': 33.893580111481306, 'bear_atr_min_pct': 0.0048864103430374325, 'bear_atr_max_pct': 0.054212240485879123, 'bear_tp_mult': 2.069389283539585, 'bear_tsl_mult': 0.4866434704603378, 'bear_time_stop': 19, 'bear_use_sma': True, 'bear_use_ema': False, 'bear_use_atr': False, 'bear_use_adx': True, 'bear_use_spike': False, 'bear_rsi_required': True, 'sideways_strategy': 'mean_reversion', 'sideways_bb_std_mult': 1.147811155093986, 'sideways_rsi_os': 21, 'sideways_rsi_ob': 91, 'sideways_adx_thresh': 11.180375420982845, 'sideways_atr_min_pct': 0.016594312818522913, 'sideways_atr_max_pct': 0.12964407229339098, 'sideways_tp_mult': 1.6921707706217641, 'sideways_tsl_mult': 0.7656081290135835, 'sideways_time_stop': 293, 'sideways_use_sma': True, 'sideways_use_ema': False, 'sideways_use_atr': False, 'sideways_use_adx': False, 'sideways_use_spike': True, 'sideways_rsi_required': False}.
[I 2025-08-31 00:46:05,615] Trial 375 finished with values: [-1000000000.0, 1000000000.0] and parameters: {'p_sma': 5, 'p_std': 40, 'p_atr': 23, 'p_adx': 17, 'rsi_period': 12, 'ema1': 6, 'ema2': 18, 'slip_atr_k': 0.11517790141597206, 'slip_spread_k': 0.2934279714394975, 'spread_hl_frac': 0.009924057443708889, 'bb_std_mult': 1.2175567225906954, 'rsi_os': 40, 'rsi_ob': 71, 'vol_spike': 0.20982285962690433, 'adx_thresh': 13.426437335038536, 'atr_min_pct': 0.010334055224945342, 'atr_max_pct': 0.06988027468616939, 'tp_mult': 1.2615548732076722, 'tsl_mult': 0.16151770255966985, 'strategy': 'mean_reversion', 'time_stop': 209, 'use_sma': True, 'use_atr': False, 'use_adx': False, 'use_ema': True, 'use_spike': False, 'rsi_required': False, 'edge_k': 0.7868996698886869, 'edge_cap': 0.2708292544583801, 'bull_strategy': 'breakout', 'bull_bb_std_mult': 2.869307974513898, 'bull_rsi_os': 37, 'bull_rsi_ob': 72, 'bull_adx_thresh': 14.693399984379756, 'bull_atr_min_pct': 0.0008280536640093454, 'bull_atr_max_pct': 0.07682324120853556, 'bull_tp_mult': 1.8285813272179579, 'bull_tsl_mult': 0.16439411269411405, 'bull_time_stop': 29, 'bull_use_sma': False, 'bull_use_ema': False, 'bull_use_atr': True, 'bull_use_adx': True, 'bull_use_spike': False, 'bull_rsi_required': True, 'bear_strategy': 'mean_reversion', 'bear_bb_std_mult': 1.1424895893452136, 'bear_rsi_os': 45, 'bear_rsi_ob': 78, 'bear_adx_thresh': 7.184958458672927, 'bear_atr_min_pct': 0.024893571515096604, 'bear_atr_max_pct': 0.039417008952876344, 'bear_tp_mult': 1.9608412791121266, 'bear_tsl_mult': 0.4956176654529597, 'bear_time_stop': 41, 'bear_use_sma': True, 'bear_use_ema': False, 'bear_use_atr': False, 'bear_use_adx': True, 'bear_use_spike': False, 'bear_rsi_required': True, 'sideways_strategy': 'mean_reversion', 'sideways_bb_std_mult': 0.7415498283203348, 'sideways_rsi_os': 42, 'sideways_rsi_ob': 57, 'sideways_adx_thresh': 11.298050158529977, 'sideways_atr_min_pct': 0.022203338781764684, 'sideways_atr_max_pct': 0.1447701397945745, 'sideways_tp_mult': 1.0414457853865775, 'sideways_tsl_mult': 0.8853729464378624, 'sideways_time_stop': 192, 'sideways_use_sma': True, 'sideways_use_ema': False, 'sideways_use_atr': False, 'sideways_use_adx': False, 'sideways_use_spike': True, 'sideways_rsi_required': False}.
[I 2025-08-31 00:46:05,977] Trial 376 finished with values: [-1000000000.0, 1000000000.0] and parameters: {'p_sma': 8, 'p_std': 40, 'p_atr': 23, 'p_adx': 28, 'rsi_period': 12, 'ema1': 8, 'ema2': 19, 'slip_atr_k': 0.03274859946811245, 'slip_spread_k': 0.2547587642586303, 'spread_hl_frac': 0.010041271687743561, 'bb_std_mult': 0.6658884233279356, 'rsi_os': 40, 'rsi_ob': 61, 'vol_spike': 0.21098269685848595, 'adx_thresh': 20.74667405855186, 'atr_min_pct': 0.004697989095966352, 'atr_max_pct': 0.13861736520394086, 'tp_mult': 2.662314518633341, 'tsl_mult': 0.09160494850342249, 'strategy': 'mean_reversion', 'time_stop': 293, 'use_sma': True, 'use_atr': False, 'use_adx': False, 'use_ema': True, 'use_spike': False, 'rsi_required': False, 'edge_k': 0.1625735738950741, 'edge_cap': 0.8429518674399007, 'bull_strategy': 'breakout', 'bull_bb_std_mult': 2.869415712092798, 'bull_rsi_os': 36, 'bull_rsi_ob': 71, 'bull_adx_thresh': 14.599624738877246, 'bull_atr_min_pct': 0.022713679529593023, 'bull_atr_max_pct': 0.07634286515026414, 'bull_tp_mult': 1.1737812439712338, 'bull_tsl_mult': 0.5454296626805581, 'bull_time_stop': 159, 'bull_use_sma': False, 'bull_use_ema': False, 'bull_use_atr': True, 'bull_use_adx': True, 'bull_use_spike': False, 'bull_rsi_required': True, 'bear_strategy': 'mean_reversion', 'bear_bb_std_mult': 2.2099171370433477, 'bear_rsi_os': 23, 'bear_rsi_ob': 78, 'bear_adx_thresh': 8.094274197360459, 'bear_atr_min_pct': 0.006435686805519357, 'bear_atr_max_pct': 0.03861321178256712, 'bear_tp_mult': 1.9543361285789786, 'bear_tsl_mult': 0.6815392543245852, 'bear_time_stop': 42, 'bear_use_sma': True, 'bear_use_ema': False, 'bear_use_atr': False, 'bear_use_adx': False, 'bear_use_spike': False, 'bear_rsi_required': True, 'sideways_strategy': 'breakout', 'sideways_bb_std_mult': 1.3671213839748173, 'sideways_rsi_os': 11, 'sideways_rsi_ob': 91, 'sideways_adx_thresh': 10.987489693738391, 'sideways_atr_min_pct': 0.022184923898251288, 'sideways_atr_max_pct': 0.12881934076847734, 'sideways_tp_mult': 1.050091214678823, 'sideways_tsl_mult': 0.7699188233078731, 'sideways_time_stop': 196, 'sideways_use_sma': True, 'sideways_use_ema': False, 'sideways_use_atr': False, 'sideways_use_adx': False, 'sideways_use_spike': True, 'sideways_rsi_required': False}.
[I 2025-08-31 00:46:06,126] Trial 374 finished with values: [-1000000000.0, 1000000000.0] and parameters: {'p_sma': 50, 'p_std': 43, 'p_atr': 23, 'p_adx': 7, 'rsi_period': 18, 'ema1': 8, 'ema2': 54, 'slip_atr_k': 0.11682535027769324, 'slip_spread_k': 0.60421293898722, 'spread_hl_frac': 0.009993936155319167, 'bb_std_mult': 0.6731195882919616, 'rsi_os': 46, 'rsi_ob': 68, 'vol_spike': 0.21828729911729713, 'adx_thresh': 20.597231486582736, 'atr_min_pct': 0.01009032991234882, 'atr_max_pct': 0.017636260863403155, 'tp_mult': 1.272081211710021, 'tsl_mult': 0.553227239332985, 'strategy': 'mean_reversion', 'time_stop': 103, 'use_sma': True, 'use_atr': True, 'use_adx': False, 'use_ema': True, 'use_spike': False, 'rsi_required': False, 'edge_k': 1.2669755135895706, 'edge_cap': 0.35766973797521473, 'bull_strategy': 'breakout', 'bull_bb_std_mult': 2.7472222953459893, 'bull_rsi_os': 40, 'bull_rsi_ob': 72, 'bull_adx_thresh': 21.80928653773506, 'bull_atr_min_pct': 0.007102473102332635, 'bull_atr_max_pct': 0.017759006456510698, 'bull_tp_mult': 1.1886650008903925, 'bull_tsl_mult': 0.2666864675563479, 'bull_time_stop': 166, 'bull_use_sma': False, 'bull_use_ema': False, 'bull_use_atr': True, 'bull_use_adx': False, 'bull_use_spike': True, 'bull_rsi_required': True, 'bear_strategy': 'mean_reversion', 'bear_bb_std_mult': 2.2123859968745907, 'bear_rsi_os': 21, 'bear_rsi_ob': 78, 'bear_adx_thresh': 7.135524725435046, 'bear_atr_min_pct': 0.024900194419702933, 'bear_atr_max_pct': 0.061439400773826494, 'bear_tp_mult': 1.9388531411333354, 'bear_tsl_mult': 0.01914486643214247, 'bear_time_stop': 111, 'bear_use_sma': True, 'bear_use_ema': False, 'bear_use_atr': False, 'bear_use_adx': True, 'bear_use_spike': False, 'bear_rsi_required': True, 'sideways_strategy': 'mean_reversion', 'sideways_bb_std_mult': 1.1484458123687533, 'sideways_rsi_os': 11, 'sideways_rsi_ob': 57, 'sideways_adx_thresh': 11.050338089575215, 'sideways_atr_min_pct': 0.015222991564996718, 'sideways_atr_max_pct': 0.1451376669516927, 'sideways_tp_mult': 1.0477867076026814, 'sideways_tsl_mult': 0.11857442132965557, 'sideways_time_stop': 161, 'sideways_use_sma': True, 'sideways_use_ema': False, 'sideways_use_atr': False, 'sideways_use_adx': False, 'sideways_use_spike': True, 'sideways_rsi_required': False}.
[I 2025-08-31 00:46:44,671] Trial 378 finished with values: [-0.026302199209674693, 0.02630652107120229] and parameters: {'p_sma': 56, 'p_std': 40, 'p_atr': 20, 'p_adx': 8, 'rsi_period': 51, 'ema1': 23, 'ema2': 16, 'slip_atr_k': 0.07631438454798606, 'slip_spread_k': 0.251757372063713, 'spread_hl_frac': 0.009432865820819961, 'bb_std_mult': 0.7234849578064071, 'rsi_os': 53, 'rsi_ob': 61, 'vol_spike': 0.17966975421731557, 'adx_thresh': 12.147381229233176, 'atr_min_pct': 0.005536085820784376, 'atr_max_pct': 0.0602535592184809, 'tp_mult': 2.6512122789317925, 'tsl_mult': 0.5461929942030702, 'strategy': 'breakout', 'time_stop': 101, 'use_sma': True, 'use_atr': False, 'use_adx': False, 'use_ema': True, 'use_spike': False, 'rsi_required': False, 'edge_k': 1.0219593052765035, 'edge_cap': 0.8390808657821228, 'bull_strategy': 'breakout', 'bull_bb_std_mult': 1.5776286343769768, 'bull_rsi_os': 10, 'bull_rsi_ob': 68, 'bull_adx_thresh': 15.695184756505418, 'bull_atr_min_pct': 0.0009782196852533016, 'bull_atr_max_pct': 0.11139762071602453, 'bull_tp_mult': 1.3539845124487486, 'bull_tsl_mult': 0.5355169891951774, 'bull_time_stop': 166, 'bull_use_sma': True, 'bull_use_ema': False, 'bull_use_atr': True, 'bull_use_adx': True, 'bull_use_spike': False, 'bull_rsi_required': False, 'bear_strategy': 'mean_reversion', 'bear_bb_std_mult': 0.8865731903702025, 'bear_rsi_os': 23, 'bear_rsi_ob': 68, 'bear_adx_thresh': 8.069250200084591, 'bear_atr_min_pct': 0.010625193903875741, 'bear_atr_max_pct': 0.010079136430914145, 'bear_tp_mult': 1.1783186294676635, 'bear_tsl_mult': 0.8323170228794352, 'bear_time_stop': 24, 'bear_use_sma': True, 'bear_use_ema': False, 'bear_use_atr': False, 'bear_use_adx': False, 'bear_use_spike': False, 'bear_rsi_required': False, 'sideways_strategy': 'breakout', 'sideways_bb_std_mult': 1.0560961702040719, 'sideways_rsi_os': 51, 'sideways_rsi_ob': 90, 'sideways_adx_thresh': 17.096766940160023, 'sideways_atr_min_pct': 0.0029537764901792565, 'sideways_atr_max_pct': 0.07742213220262507, 'sideways_tp_mult': 1.1508697546983337, 'sideways_tsl_mult': 0.02200174661643428, 'sideways_time_stop': 269, 'sideways_use_sma': True, 'sideways_use_ema': False, 'sideways_use_atr': False, 'sideways_use_adx': True, 'sideways_use_spike': False, 'sideways_rsi_required': False}.
