[I 2025-08-31 03:02:20,481] Trial 754 finished with values: [-1000000000.0, 1000000000.0] and parameters: {'p_sma': 51, 'p_std': 6, 'p_atr': 29, 'p_adx': 21, 'rsi_period': 76, 'ema1': 19, 'ema2': 22, 'slip_atr_k': 0.0003867153792916113, 'slip_spread_k': 0.1755282807848852, 'spread_hl_frac': 0.002380328963856468, 'bb_std_mult': 1.6803477778888032, 'rsi_os': 17, 'rsi_ob': 72, 'vol_spike': 0.09340381979159593, 'adx_thresh': 31.212754430670273, 'atr_min_pct': 0.010289904090498915, 'atr_max_pct': 0.1123663398134459, 'tp_mult': 2.4661572774041787, 'tsl_mult': 0.35463854216989893, 'strategy': 'mean_reversion', 'time_stop': 240, 'use_sma': True, 'use_atr': False, 'use_adx': False, 'use_ema': False, 'use_spike': True, 'rsi_required': True, 'edge_k': 0.5283735351903629, 'edge_cap': 0.13461770824153596, 'bull_strategy': 'breakout', 'bull_bb_std_mult': 2.9806299877365228, 'bull_rsi_os': 48, 'bull_rsi_ob': 45, 'bull_adx_thresh': 5.610598371367943, 'bull_atr_min_pct': 0.004500219900384095, 'bull_atr_max_pct': 0.13392689055170856, 'bull_tp_mult': 2.307202026333984, 'bull_tsl_mult': 0.25573895482010445, 'bull_time_stop': 143, 'bull_use_sma': True, 'bull_use_ema': False, 'bull_use_atr': False, 'bull_use_adx': True, 'bull_use_spike': True, 'bull_rsi_required': True, 'bear_strategy': 'mean_reversion', 'bear_bb_std_mult': 1.8459050023229682, 'bear_rsi_os': 19, 'bear_rsi_ob': 72, 'bear_adx_thresh': 6.64602247511736, 'bear_atr_min_pct': 0.006734730671010069, 'bear_atr_max_pct': 0.0100707501808746, 'bear_tp_mult': 2.630547213159692, 'bear_tsl_mult': 0.6081247752642425, 'bear_time_stop': 16, 'bear_use_sma': False, 'bear_use_ema': True, 'bear_use_atr': False, 'bear_use_adx': False, 'bear_use_spike': False, 'bear_rsi_required': True, 'sideways_strategy': 'breakout', 'sideways_bb_std_mult': 0.6513495345620762, 'sideways_rsi_os': 43, 'sideways_rsi_ob': 94, 'sideways_adx_thresh': 8.461019853821536, 'sideways_atr_min_pct': 0.02707957460669903, 'sideways_atr_max_pct': 0.05773978398908258, 'sideways_tp_mult': 1.7774798577136741, 'sideways_tsl_mult': 0.19252036808899603, 'sideways_time_stop': 185, 'sideways_use_sma': True, 'sideways_use_ema': False, 'sideways_use_atr': False, 'sideways_use_adx': True, 'sideways_use_spike': True, 'sideways_rsi_required': False}.
[I 2025-08-31 03:02:20,686] Trial 755 finished with values: [-1000000000.0, 1000000000.0] and parameters: {'p_sma': 51, 'p_std': 52, 'p_atr': 17, 'p_adx': 21, 'rsi_period': 75, 'ema1': 6, 'ema2': 57, 'slip_atr_k': 0.17580704959849827, 'slip_spread_k': 0.1665467613264544, 'spread_hl_frac': 0.004520584143529127, 'bb_std_mult': 1.7414752780927323, 'rsi_os': 6, 'rsi_ob': 69, 'vol_spike': 0.04969105878666173, 'adx_thresh': 22.451606153349903, 'atr_min_pct': 0.020473764102735457, 'atr_max_pct': 0.12500174066438857, 'tp_mult': 1.2847490854134263, 'tsl_mult': 0.23207588099313858, 'strategy': 'mean_reversion', 'time_stop': 126, 'use_sma': True, 'use_atr': False, 'use_adx': False, 'use_ema': False, 'use_spike': True, 'rsi_required': True, 'edge_k': 1.3455014113396326, 'edge_cap': 0.06641320364676544, 'bull_strategy': 'breakout', 'bull_bb_std_mult': 2.311708239428566, 'bull_rsi_os': 14, 'bull_rsi_ob': 62, 'bull_adx_thresh': 8.305803186014678, 'bull_atr_min_pct': 0.02759717329354052, 'bull_atr_max_pct': 0.029799007063332286, 'bull_tp_mult': 2.2995532488063435, 'bull_tsl_mult': 0.6006199750983148, 'bull_time_stop': 50, 'bull_use_sma': True, 'bull_use_ema': False, 'bull_use_atr': False, 'bull_use_adx': False, 'bull_use_spike': True, 'bull_rsi_required': True, 'bear_strategy': 'mean_reversion', 'bear_bb_std_mult': 2.6248740937772257, 'bear_rsi_os': 48, 'bear_rsi_ob': 72, 'bear_adx_thresh': 5.011749637888121, 'bear_atr_min_pct': 0.0068506173630234505, 'bear_atr_max_pct': 0.016853638506069878, 'bear_tp_mult': 1.7371265535702716, 'bear_tsl_mult': 0.5399391914091456, 'bear_time_stop': 5, 'bear_use_sma': False, 'bear_use_ema': True, 'bear_use_atr': False, 'bear_use_adx': False, 'bear_use_spike': False, 'bear_rsi_required': True, 'sideways_strategy': 'breakout', 'sideways_bb_std_mult': 0.554440214641758, 'sideways_rsi_os': 8, 'sideways_rsi_ob': 59, 'sideways_adx_thresh': 8.434820140911057, 'sideways_atr_min_pct': 0.027086498082580727, 'sideways_atr_max_pct': 0.057156900090210086, 'sideways_tp_mult': 1.7844290263170317, 'sideways_tsl_mult': 0.43278801358605734, 'sideways_time_stop': 186, 'sideways_use_sma': True, 'sideways_use_ema': False, 'sideways_use_atr': False, 'sideways_use_adx': True, 'sideways_use_spike': True, 'sideways_rsi_required': False}.
[I 2025-08-31 03:02:21,614] Trial 758 finished with values: [-1000000000.0, 1000000000.0] and parameters: {'p_sma': 27, 'p_std': 50, 'p_atr': 27, 'p_adx': 27, 'rsi_period': 47, 'ema1': 5, 'ema2': 24, 'slip_atr_k': 0.0975768376598358, 'slip_spread_k': 0.771588962848509, 'spread_hl_frac': 0.0023062107333257607, 'bb_std_mult': 3.299252456982704, 'rsi_os': 36, 'rsi_ob': 71, 'vol_spike': 0.18876242679814126, 'adx_thresh': 23.6403104463533, 'atr_min_pct': 0.010422384190237267, 'atr_max_pct': 0.020697996279105534, 'tp_mult': 1.3406125956130148, 'tsl_mult': 0.4237155413526821, 'strategy': 'mean_reversion', 'time_stop': 99, 'use_sma': False, 'use_atr': False, 'use_adx': False, 'use_ema': False, 'use_spike': False, 'rsi_required': True, 'edge_k': 1.862674260631301, 'edge_cap': 0.09658381361530893, 'bull_strategy': 'breakout', 'bull_bb_std_mult': 2.046232954592163, 'bull_rsi_os': 14, 'bull_rsi_ob': 45, 'bull_adx_thresh': 7.659731374556924, 'bull_atr_min_pct': 0.003527810356345221, 'bull_atr_max_pct': 0.060587315185469746, 'bull_tp_mult': 2.1024423027405255, 'bull_tsl_mult': 0.6330576129121548, 'bull_time_stop': 137, 'bull_use_sma': True, 'bull_use_ema': True, 'bull_use_atr': False, 'bull_use_adx': True, 'bull_use_spike': True, 'bull_rsi_required': True, 'bear_strategy': 'mean_reversion', 'bear_bb_std_mult': 1.3313114977773695, 'bear_rsi_os': 18, 'bear_rsi_ob': 47, 'bear_adx_thresh': 6.598193953955358, 'bear_atr_min_pct': 0.005189706063178147, 'bear_atr_max_pct': 0.01573341953095503, 'bear_tp_mult': 1.760854932315917, 'bear_tsl_mult': 0.1545800875256798, 'bear_time_stop': 23, 'bear_use_sma': False, 'bear_use_ema': False, 'bear_use_atr': False, 'bear_use_adx': False, 'bear_use_spike': False, 'bear_rsi_required': True, 'sideways_strategy': 'breakout', 'sideways_bb_std_mult': 0.5019506383628505, 'sideways_rsi_os': 10, 'sideways_rsi_ob': 59, 'sideways_adx_thresh': 9.98688194743687, 'sideways_atr_min_pct': 0.025882285553625956, 'sideways_atr_max_pct': 0.054806014294689516, 'sideways_tp_mult': 1.9282613837369293, 'sideways_tsl_mult': 0.1595124580638218, 'sideways_time_stop': 208, 'sideways_use_sma': True, 'sideways_use_ema': False, 'sideways_use_atr': False, 'sideways_use_adx': True, 'sideways_use_spike': True, 'sideways_rsi_required': True}.
[I 2025-08-31 03:02:57,017] Trial 761 finished with values: [-1000000000.0, 1000000000.0] and parameters: {'p_sma': 27, 'p_std': 50, 'p_atr': 26, 'p_adx': 29, 'rsi_period': 65, 'ema1': 5, 'ema2': 13, 'slip_atr_k': 0.144884037275697, 'slip_spread_k': 0.9324977675160581, 'spread_hl_frac': 0.0336848218336472, 'bb_std_mult': 2.9250500388223433, 'rsi_os': 38, 'rsi_ob': 94, 'vol_spike': 0.1884964951331911, 'adx_thresh': 20.738656468495737, 'atr_min_pct': 0.009708016054090478, 'atr_max_pct': 0.11459397006669853, 'tp_mult': 1.3680181183797853, 'tsl_mult': 0.29838119557113363, 'strategy': 'mean_reversion', 'time_stop': 99, 'use_sma': False, 'use_atr': False, 'use_adx': False, 'use_ema': False, 'use_spike': False, 'rsi_required': True, 'edge_k': 0.5962149471879965, 'edge_cap': 0.1003755291854602, 'bull_strategy': 'breakout', 'bull_bb_std_mult': 2.078508592145356, 'bull_rsi_os': 25, 'bull_rsi_ob': 64, 'bull_adx_thresh': 6.617727085982759, 'bull_atr_min_pct': 0.003463648822172291, 'bull_atr_max_pct': 0.14635537023875608, 'bull_tp_mult': 1.8201745218611003, 'bull_tsl_mult': 0.16013710795261066, 'bull_time_stop': 128, 'bull_use_sma': True, 'bull_use_ema': True, 'bull_use_atr': False, 'bull_use_adx': True, 'bull_use_spike': True, 'bull_rsi_required': True, 'bear_strategy': 'mean_reversion', 'bear_bb_std_mult': 1.34189388926776, 'bear_rsi_os': 18, 'bear_rsi_ob': 46, 'bear_adx_thresh': 5.63350831923039, 'bear_atr_min_pct': 0.02862296454300268, 'bear_atr_max_pct': 0.11606915898443057, 'bear_tp_mult': 2.1786116405733478, 'bear_tsl_mult': 0.481619729605395, 'bear_time_stop': 119, 'bear_use_sma': False, 'bear_use_ema': False, 'bear_use_atr': False, 'bear_use_adx': True, 'bear_use_spike': False, 'bear_rsi_required': True, 'sideways_strategy': 'breakout', 'sideways_bb_std_mult': 0.5486258902525096, 'sideways_rsi_os': 23, 'sideways_rsi_ob': 92, 'sideways_adx_thresh': 23.25275542336017, 'sideways_atr_min_pct': 0.026441832334478013, 'sideways_atr_max_pct': 0.04460073552327893, 'sideways_tp_mult': 2.044734953675713, 'sideways_tsl_mult': 0.9717465306682003, 'sideways_time_stop': 10, 'sideways_use_sma': True, 'sideways_use_ema': False, 'sideways_use_atr': False, 'sideways_use_adx': False, 'sideways_use_spike': True, 'sideways_rsi_required': True}.
[I 2025-08-31 03:02:57,271] Trial 760 finished with values: [-1000000000.0, 1000000000.0] and parameters: {'p_sma': 34, 'p_std': 50, 'p_atr': 28, 'p_adx': 27, 'rsi_period': 51, 'ema1': 5, 'ema2': 43, 'slip_atr_k': 0.1595384217777998, 'slip_spread_k': 0.19299204354517974, 'spread_hl_frac': 0.004476789866489989, 'bb_std_mult': 1.7358132173986072, 'rsi_os': 38, 'rsi_ob': 71, 'vol_spike': 0.18919699289550193, 'adx_thresh': 21.287304279669538, 'atr_min_pct': 0.004111390660490145, 'atr_max_pct': 0.12446573416483467, 'tp_mult': 1.3717763633846274, 'tsl_mult': 0.4197957620878362, 'strategy': 'mean_reversion', 'time_stop': 163, 'use_sma': True, 'use_atr': False, 'use_adx': False, 'use_ema': False, 'use_spike': False, 'rsi_required': True, 'edge_k': 0.5822279618865149, 'edge_cap': 0.10118668001997641, 'bull_strategy': 'breakout', 'bull_bb_std_mult': 2.304323055397139, 'bull_rsi_os': 19, 'bull_rsi_ob': 55, 'bull_adx_thresh': 7.737237187443616, 'bull_atr_min_pct': 0.028511627724652152, 'bull_atr_max_pct': 0.030809111589966923, 'bull_tp_mult': 2.296288122517195, 'bull_tsl_mult': 0.15937254434223813, 'bull_time_stop': 132, 'bull_use_sma': True, 'bull_use_ema': True, 'bull_use_atr': False, 'bull_use_adx': True, 'bull_use_spike': True, 'bull_rsi_required': True, 'bear_strategy': 'mean_reversion', 'bear_bb_std_mult': 2.4500826839355883, 'bear_rsi_os': 33, 'bear_rsi_ob': 70, 'bear_adx_thresh': 22.95889638288774, 'bear_atr_min_pct': 0.005243529158119003, 'bear_atr_max_pct': 0.07171666653125704, 'bear_tp_mult': 1.5349647497304024, 'bear_tsl_mult': 0.15289552788259403, 'bear_time_stop': 268, 'bear_use_sma': False, 'bear_use_ema': False, 'bear_use_atr': False, 'bear_use_adx': True, 'bear_use_spike': False, 'bear_rsi_required': True, 'sideways_strategy': 'breakout', 'sideways_bb_std_mult': 0.507669740564277, 'sideways_rsi_os': 41, 'sideways_rsi_ob': 59, 'sideways_adx_thresh': 9.401371785006654, 'sideways_atr_min_pct': 0.017504262912247544, 'sideways_atr_max_pct': 0.0731050541954445, 'sideways_tp_mult': 1.781749744343528, 'sideways_tsl_mult': 0.5325317094184464, 'sideways_time_stop': 208, 'sideways_use_sma': True, 'sideways_use_ema': False, 'sideways_use_atr': False, 'sideways_use_adx': False, 'sideways_use_spike': True, 'sideways_rsi_required': False}.
[I 2025-08-31 03:02:57,666] Trial 759 finished with values: [-1000000000.0, 1000000000.0] and parameters: {'p_sma': 53, 'p_std': 50, 'p_atr': 28, 'p_adx': 20, 'rsi_period': 71, 'ema1': 20, 'ema2': 23, 'slip_atr_k': 0.00031298752526698337, 'slip_spread_k': 0.3696727554966349, 'spread_hl_frac': 0.004607522424915932, 'bb_std_mult': 1.7476664495174405, 'rsi_os': 38, 'rsi_ob': 56, 'vol_spike': 0.04720006544000824, 'adx_thresh': 20.51048319102335, 'atr_min_pct': 0.01009296788116296, 'atr_max_pct': 0.11388277570099849, 'tp_mult': 2.3329277907848422, 'tsl_mult': 0.2317570623644313, 'strategy': 'mean_reversion', 'time_stop': 99, 'use_sma': True, 'use_atr': False, 'use_adx': False, 'use_ema': False, 'use_spike': False, 'rsi_required': True, 'edge_k': 0.5394209268657612, 'edge_cap': 0.09847559734540723, 'bull_strategy': 'breakout', 'bull_bb_std_mult': 2.288516140607996, 'bull_rsi_os': 51, 'bull_rsi_ob': 62, 'bull_adx_thresh': 16.766826204816116, 'bull_atr_min_pct': 0.00356345481950782, 'bull_atr_max_pct': 0.02169253056004817, 'bull_tp_mult': 2.090436466876547, 'bull_tsl_mult': 0.321838148558825, 'bull_time_stop': 127, 'bull_use_sma': True, 'bull_use_ema': True, 'bull_use_atr': False, 'bull_use_adx': True, 'bull_use_spike': True, 'bull_rsi_required': True, 'bear_strategy': 'mean_reversion', 'bear_bb_std_mult': 1.5373869781295646, 'bear_rsi_os': 33, 'bear_rsi_ob': 46, 'bear_adx_thresh': 5.010857138400247, 'bear_atr_min_pct': 0.00516124531184835, 'bear_atr_max_pct': 0.0865558390249074, 'bear_tp_mult': 2.7687965908127405, 'bear_tsl_mult': 0.5452095686917806, 'bear_time_stop': 120, 'bear_use_sma': False, 'bear_use_ema': False, 'bear_use_atr': False, 'bear_use_adx': True, 'bear_use_spike': False, 'bear_rsi_required': True, 'sideways_strategy': 'breakout', 'sideways_bb_std_mult': 1.5454857709983219, 'sideways_rsi_os': 23, 'sideways_rsi_ob': 59, 'sideways_adx_thresh': 8.33254376728489, 'sideways_atr_min_pct': 0.02444807681679117, 'sideways_atr_max_pct': 0.09430483554113081, 'sideways_tp_mult': 1.7885192506498453, 'sideways_tsl_mult': 0.0021111423470142054, 'sideways_time_stop': 30, 'sideways_use_sma': True, 'sideways_use_ema': False, 'sideways_use_atr': False, 'sideways_use_adx': False, 'sideways_use_spike': True, 'sideways_rsi_required': False}.
[I 2025-08-31 03:02:57,797] Trial 762 finished with values: [-1000000000.0, 1000000000.0] and parameters: {'p_sma': 53, 'p_std': 55, 'p_atr': 28, 'p_adx': 26, 'rsi_period': 51, 'ema1': 16, 'ema2': 29, 'slip_atr_k': 0.15930790376959764, 'slip_spread_k': 0.8567835484117133, 'spread_hl_frac': 0.029542231556024767, 'bb_std_mult': 1.7353449083343782, 'rsi_os': 38, 'rsi_ob': 94, 'vol_spike': 0.19318061765186884, 'adx_thresh': 7.098752753126837, 'atr_min_pct': 0.003955067509567534, 'atr_max_pct': 0.14277023289578333, 'tp_mult': 1.7332428788499323, 'tsl_mult': 0.6951700029843586, 'strategy': 'mean_reversion', 'time_stop': 106, 'use_sma': True, 'use_atr': False, 'use_adx': False, 'use_ema': False, 'use_spike': False, 'rsi_required': True, 'edge_k': 0.5828733880736165, 'edge_cap': 0.10255321784890088, 'bull_strategy': 'breakout', 'bull_bb_std_mult': 0.9345288661357558, 'bull_rsi_os': 30, 'bull_rsi_ob': 73, 'bull_adx_thresh': 5.003618376472289, 'bull_atr_min_pct': 0.028649747425867365, 'bull_atr_max_pct': 0.10551656246825465, 'bull_tp_mult': 1.367479112477568, 'bull_tsl_mult': 0.28480960289988716, 'bull_time_stop': 125, 'bull_use_sma': True, 'bull_use_ema': True, 'bull_use_atr': False, 'bull_use_adx': True, 'bull_use_spike': True, 'bull_rsi_required': True, 'bear_strategy': 'mean_reversion', 'bear_bb_std_mult': 2.4476021931144514, 'bear_rsi_os': 33, 'bear_rsi_ob': 86, 'bear_adx_thresh': 10.282802315186826, 'bear_atr_min_pct': 0.020409971987756695, 'bear_atr_max_pct': 0.010019137371863445, 'bear_tp_mult': 1.547566053968455, 'bear_tsl_mult': 0.47970038729064773, 'bear_time_stop': 11, 'bear_use_sma': False, 'bear_use_ema': False, 'bear_use_atr': False, 'bear_use_adx': True, 'bear_use_spike': False, 'bear_rsi_required': True, 'sideways_strategy': 'breakout', 'sideways_bb_std_mult': 0.5000894174426926, 'sideways_rsi_os': 41, 'sideways_rsi_ob': 55, 'sideways_adx_thresh': 9.546864437864748, 'sideways_atr_min_pct': 0.02649064734038602, 'sideways_atr_max_pct': 0.04062870412485167, 'sideways_tp_mult': 1.7408188329857968, 'sideways_tsl_mult': 0.5249779056241861, 'sideways_time_stop': 20, 'sideways_use_sma': True, 'sideways_use_ema': False, 'sideways_use_atr': False, 'sideways_use_adx': False, 'sideways_use_spike': True, 'sideways_rsi_required': False}.
[I 2025-08-31 03:03:31,951] Trial 764 finished with values: [-1000000000.0, 1000000000.0] and parameters: {'p_sma': 53, 'p_std': 55, 'p_atr': 28, 'p_adx': 26, 'rsi_period': 71, 'ema1': 5, 'ema2': 29, 'slip_atr_k': 0.05830431753093557, 'slip_spread_k': 0.3735000924111711, 'spread_hl_frac': 0.029308214356118675, 'bb_std_mult': 1.6275640024687814, 'rsi_os': 33, 'rsi_ob': 68, 'vol_spike': 0.19512856053547248, 'adx_thresh': 20.459970279184123, 'atr_min_pct': 0.008529160971127523, 'atr_max_pct': 0.14149819447557133, 'tp_mult': 2.3246276057707136, 'tsl_mult': 0.8441000653899642, 'strategy': 'mean_reversion', 'time_stop': 106, 'use_sma': True, 'use_atr': False, 'use_adx': False, 'use_ema': False, 'use_spike': False, 'rsi_required': True, 'edge_k': 0.29306572302823464, 'edge_cap': 0.12019998685116254, 'bull_strategy': 'breakout', 'bull_bb_std_mult': 2.184318385392087, 'bull_rsi_os': 51, 'bull_rsi_ob': 61, 'bull_adx_thresh': 5.9679699856340305, 'bull_atr_min_pct': 0.018084364887463435, 'bull_atr_max_pct': 0.13943699465985712, 'bull_tp_mult': 1.891728270333685, 'bull_tsl_mult': 0.6995160037584522, 'bull_time_stop': 220, 'bull_use_sma': True, 'bull_use_ema': False, 'bull_use_atr': False, 'bull_use_adx': True, 'bull_use_spike': True, 'bull_rsi_required': True, 'bear_strategy': 'mean_reversion', 'bear_bb_std_mult': 3.0144320670766547, 'bear_rsi_os': 52, 'bear_rsi_ob': 90, 'bear_adx_thresh': 28.179862983528857, 'bear_atr_min_pct': 0.0019973035412406987, 'bear_atr_max_pct': 0.08646654067338476, 'bear_tp_mult': 1.4156511343999603, 'bear_tsl_mult': 0.530905578270368, 'bear_time_stop': 11, 'bear_use_sma': False, 'bear_use_ema': False, 'bear_use_atr': False, 'bear_use_adx': True, 'bear_use_spike': False, 'bear_rsi_required': True, 'sideways_strategy': 'breakout', 'sideways_bb_std_mult': 0.8336722041595945, 'sideways_rsi_os': 40, 'sideways_rsi_ob': 95, 'sideways_adx_thresh': 9.898935222639988, 'sideways_atr_min_pct': 0.012614615346941083, 'sideways_atr_max_pct': 0.040549925183206055, 'sideways_tp_mult': 1.4529725423810511, 'sideways_tsl_mult': 0.645368770129096, 'sideways_time_stop': 281, 'sideways_use_sma': True, 'sideways_use_ema': False, 'sideways_use_atr': False, 'sideways_use_adx': False, 'sideways_use_spike': True, 'sideways_rsi_required': False}.
[I 2025-08-31 03:03:32,601] Trial 763 finished with values: [-1000000000.0, 1000000000.0] and parameters: {'p_sma': 53, 'p_std': 46, 'p_atr': 28, 'p_adx': 26, 'rsi_period': 40, 'ema1': 5, 'ema2': 33, 'slip_atr_k': 0.05151049605184113, 'slip_spread_k': 0.3698116832278023, 'spread_hl_frac': 0.004044754531447984, 'bb_std_mult': 1.7394740024574826, 'rsi_os': 39, 'rsi_ob': 56, 'vol_spike': 0.19580823875891204, 'adx_thresh': 7.103688854636996, 'atr_min_pct': 0.008570131484243014, 'atr_max_pct': 0.12195232107334064, 'tp_mult': 1.8257361115333728, 'tsl_mult': 0.7284665716201444, 'strategy': 'mean_reversion', 'time_stop': 107, 'use_sma': True, 'use_atr': False, 'use_adx': False, 'use_ema': False, 'use_spike': False, 'rsi_required': True, 'edge_k': 0.43281816536503587, 'edge_cap': 0.12090389464682659, 'bull_strategy': 'breakout', 'bull_bb_std_mult': 3.0520240173790327, 'bull_rsi_os': 29, 'bull_rsi_ob': 73, 'bull_adx_thresh': 17.161004790916397, 'bull_atr_min_pct': 0.028557329645680807, 'bull_atr_max_pct': 0.14414997436544177, 'bull_tp_mult': 1.2957021254685213, 'bull_tsl_mult': 0.33402349436002743, 'bull_time_stop': 121, 'bull_use_sma': True, 'bull_use_ema': False, 'bull_use_atr': False, 'bull_use_adx': True, 'bull_use_spike': True, 'bull_rsi_required': True, 'bear_strategy': 'mean_reversion', 'bear_bb_std_mult': 1.5088706756778805, 'bear_rsi_os': 14, 'bear_rsi_ob': 70, 'bear_adx_thresh': 5.9129872455326025, 'bear_atr_min_pct': 0.005637883020713466, 'bear_atr_max_pct': 0.0856635557544557, 'bear_tp_mult': 2.0837276597712577, 'bear_tsl_mult': 0.5310384814246143, 'bear_time_stop': 10, 'bear_use_sma': False, 'bear_use_ema': False, 'bear_use_atr': False, 'bear_use_adx': True, 'bear_use_spike': False, 'bear_rsi_required': True, 'sideways_strategy': 'breakout', 'sideways_bb_std_mult': 1.6504914186107058, 'sideways_rsi_os': 41, 'sideways_rsi_ob': 95, 'sideways_adx_thresh': 10.863707965534257, 'sideways_atr_min_pct': 0.012666006297235183, 'sideways_atr_max_pct': 0.05345814774059239, 'sideways_tp_mult': 2.9991914388553695, 'sideways_tsl_mult': 0.5353212950247259, 'sideways_time_stop': 30, 'sideways_use_sma': True, 'sideways_use_ema': False, 'sideways_use_atr': False, 'sideways_use_adx': False, 'sideways_use_spike': True, 'sideways_rsi_required': False}.
