[I 2025-08-31 02:47:46,928] Trial 656 finished with values: [-1000000000.0, 1000000000.0] and parameters: {'p_sma': 54, 'p_std': 5, 'p_atr': 29, 'p_adx': 17, 'rsi_period': 69, 'ema1': 5, 'ema2': 14, 'slip_atr_k': 0.1945986959606481, 'slip_spread_k': 0.5436480445855367, 'spread_hl_frac': 0.0254410151986236, 'bb_std_mult': 1.7864827608704565, 'rsi_os': 47, 'rsi_ob': 69, 'vol_spike': 0.1992677001658073, 'adx_thresh': 22.248946805542726, 'atr_min_pct': 0.01725589944028249, 'atr_max_pct': 0.11773397629779446, 'tp_mult': 1.146716200494768, 'tsl_mult': 0.5187291790002131, 'strategy': 'mean_reversion', 'time_stop': 182, 'use_sma': False, 'use_atr': False, 'use_adx': False, 'use_ema': False, 'use_spike': False, 'rsi_required': True, 'edge_k': 0.5639305952089975, 'edge_cap': 0.1438542993406069, 'bull_strategy': 'breakout', 'bull_bb_std_mult': 2.4443373731880813, 'bull_rsi_os': 45, 'bull_rsi_ob': 45, 'bull_adx_thresh': 7.983919901229031, 'bull_atr_min_pct': 0.016486880173180174, 'bull_atr_max_pct': 0.04048904905160241, 'bull_tp_mult': 2.2969467660580714, 'bull_tsl_mult': 0.7069159752779681, 'bull_time_stop': 114, 'bull_use_sma': True, 'bull_use_ema': False, 'bull_use_atr': False, 'bull_use_adx': True, 'bull_use_spike': True, 'bull_rsi_required': True, 'bear_strategy': 'breakout', 'bear_bb_std_mult': 2.4993020931960226, 'bear_rsi_os': 6, 'bear_rsi_ob': 91, 'bear_adx_thresh': 6.5028061853755705, 'bear_atr_min_pct': 0.01727057627103058, 'bear_atr_max_pct': 0.010004544896798778, 'bear_tp_mult': 2.892107238911156, 'bear_tsl_mult': 0.5037398752963685, 'bear_time_stop': 12, 'bear_use_sma': False, 'bear_use_ema': False, 'bear_use_atr': False, 'bear_use_adx': True, 'bear_use_spike': False, 'bear_rsi_required': True, 'sideways_strategy': 'breakout', 'sideways_bb_std_mult': 1.990341180982164, 'sideways_rsi_os': 22, 'sideways_rsi_ob': 76, 'sideways_adx_thresh': 10.531847037576217, 'sideways_atr_min_pct': 0.02727179381996702, 'sideways_atr_max_pct': 0.0547974907832631, 'sideways_tp_mult': 1.6597629818873987, 'sideways_tsl_mult': 0.30326347805876763, 'sideways_time_stop': 211, 'sideways_use_sma': True, 'sideways_use_ema': False, 'sideways_use_atr': False, 'sideways_use_adx': False, 'sideways_use_spike': True, 'sideways_rsi_required': False}.
[I 2025-08-31 02:47:48,759] Trial 659 finished with values: [-1000000000.0, 1000000000.0] and parameters: {'p_sma': 28, 'p_std': 5, 'p_atr': 27, 'p_adx': 20, 'rsi_period': 43, 'ema1': 6, 'ema2': 54, 'slip_atr_k': 0.08278792607296555, 'slip_spread_k': 0.1347508681713278, 'spread_hl_frac': 0.03732532718045753, 'bb_std_mult': 1.6670656849559218, 'rsi_os': 38, 'rsi_ob': 84, 'vol_spike': 0.054104155320430725, 'adx_thresh': 20.166969316113992, 'atr_min_pct': 0.009603352820305153, 'atr_max_pct': 0.04843300215808576, 'tp_mult': 1.1784496526804231, 'tsl_mult': 0.37531941004042396, 'strategy': 'mean_reversion', 'time_stop': 115, 'use_sma': False, 'use_atr': False, 'use_adx': False, 'use_ema': False, 'use_spike': True, 'rsi_required': True, 'edge_k': 0.5505256953571906, 'edge_cap': 0.14454994583534506, 'bull_strategy': 'breakout', 'bull_bb_std_mult': 2.383718640003361, 'bull_rsi_os': 15, 'bull_rsi_ob': 46, 'bull_adx_thresh': 7.600589450156549, 'bull_atr_min_pct': 0.02513904837886788, 'bull_atr_max_pct': 0.141116101265665, 'bull_tp_mult': 2.11589363278836, 'bull_tsl_mult': 0.2633374828514887, 'bull_time_stop': 35, 'bull_use_sma': True, 'bull_use_ema': False, 'bull_use_atr': False, 'bull_use_adx': False, 'bull_use_spike': True, 'bull_rsi_required': True, 'bear_strategy': 'breakout', 'bear_bb_std_mult': 1.2413647953796492, 'bear_rsi_os': 40, 'bear_rsi_ob': 46, 'bear_adx_thresh': 5.999821566692857, 'bear_atr_min_pct': 0.007261594431452789, 'bear_atr_max_pct': 0.08650435162647922, 'bear_tp_mult': 2.0842553529888423, 'bear_tsl_mult': 0.4228888563377935, 'bear_time_stop': 68, 'bear_use_sma': False, 'bear_use_ema': True, 'bear_use_atr': False, 'bear_use_adx': True, 'bear_use_spike': False, 'bear_rsi_required': True, 'sideways_strategy': 'breakout', 'sideways_bb_std_mult': 0.5584162157478354, 'sideways_rsi_os': 23, 'sideways_rsi_ob': 95, 'sideways_adx_thresh': 9.824024256064389, 'sideways_atr_min_pct': 0.004996029069718119, 'sideways_atr_max_pct': 0.07208935879587197, 'sideways_tp_mult': 1.5278566683642631, 'sideways_tsl_mult': 0.3087128449964106, 'sideways_time_stop': 212, 'sideways_use_sma': True, 'sideways_use_ema': False, 'sideways_use_atr': False, 'sideways_use_adx': False, 'sideways_use_spike': True, 'sideways_rsi_required': False}.
[I 2025-08-31 02:47:49,166] Trial 658 finished with values: [-1000000000.0, 1000000000.0] and parameters: {'p_sma': 53, 'p_std': 5, 'p_atr': 16, 'p_adx': 20, 'rsi_period': 72, 'ema1': 12, 'ema2': 13, 'slip_atr_k': 0.15618493505726938, 'slip_spread_k': 0.9540656598152518, 'spread_hl_frac': 0.025614906978470735, 'bb_std_mult': 1.6869627412774124, 'rsi_os': 32, 'rsi_ob': 62, 'vol_spike': 0.20059475466915908, 'adx_thresh': 22.131982697456884, 'atr_min_pct': 0.020580469979362966, 'atr_max_pct': 0.11695982271368222, 'tp_mult': 2.367429286031551, 'tsl_mult': 0.5273583589486033, 'strategy': 'mean_reversion', 'time_stop': 117, 'use_sma': False, 'use_atr': False, 'use_adx': False, 'use_ema': False, 'use_spike': False, 'rsi_required': True, 'edge_k': 0.5511413507731466, 'edge_cap': 0.14638326847229963, 'bull_strategy': 'breakout', 'bull_bb_std_mult': 2.3059672596063194, 'bull_rsi_os': 54, 'bull_rsi_ob': 61, 'bull_adx_thresh': 28.16867074467492, 'bull_atr_min_pct': 0.008364572277867525, 'bull_atr_max_pct': 0.046768156320766495, 'bull_tp_mult': 2.138230705113864, 'bull_tsl_mult': 0.25663727963718497, 'bull_time_stop': 5, 'bull_use_sma': True, 'bull_use_ema': False, 'bull_use_atr': False, 'bull_use_adx': False, 'bull_use_spike': True, 'bull_rsi_required': True, 'bear_strategy': 'breakout', 'bear_bb_std_mult': 1.2729032805766483, 'bear_rsi_os': 14, 'bear_rsi_ob': 93, 'bear_adx_thresh': 21.90513214727408, 'bear_atr_min_pct': 0.007004258313818413, 'bear_atr_max_pct': 0.013011108058005875, 'bear_tp_mult': 2.350876006706451, 'bear_tsl_mult': 0.49661478369249057, 'bear_time_stop': 220, 'bear_use_sma': False, 'bear_use_ema': False, 'bear_use_atr': False, 'bear_use_adx': True, 'bear_use_spike': False, 'bear_rsi_required': True, 'sideways_strategy': 'breakout', 'sideways_bb_std_mult': 2.3799183428682817, 'sideways_rsi_os': 40, 'sideways_rsi_ob': 73, 'sideways_adx_thresh': 10.429516435115088, 'sideways_atr_min_pct': 0.02747386484282305, 'sideways_atr_max_pct': 0.11048056332264446, 'sideways_tp_mult': 1.751876718989339, 'sideways_tsl_mult': 0.6216055590867066, 'sideways_time_stop': 265, 'sideways_use_sma': True, 'sideways_use_ema': False, 'sideways_use_atr': False, 'sideways_use_adx': False, 'sideways_use_spike': True, 'sideways_rsi_required': False}.
[I 2025-08-31 02:47:50,274] Trial 663 finished with values: [-1000000000.0, 1000000000.0] and parameters: {'p_sma': 55, 'p_std': 50, 'p_atr': 28, 'p_adx': 24, 'rsi_period': 70, 'ema1': 6, 'ema2': 26, 'slip_atr_k': 0.11847668206706426, 'slip_spread_k': 0.19802169825117377, 'spread_hl_frac': 0.03456917700103709, 'bb_std_mult': 1.7489020372497834, 'rsi_os': 45, 'rsi_ob': 50, 'vol_spike': 0.1728178415930695, 'adx_thresh': 26.214959999390032, 'atr_min_pct': 0.02367158977521444, 'atr_max_pct': 0.1207790467585301, 'tp_mult': 1.4104290173612708, 'tsl_mult': 0.24322862621321878, 'strategy': 'mean_reversion', 'time_stop': 147, 'use_sma': True, 'use_atr': False, 'use_adx': True, 'use_ema': False, 'use_spike': True, 'rsi_required': True, 'edge_k': 0.395386666181181, 'edge_cap': 0.06599345781830959, 'bull_strategy': 'breakout', 'bull_bb_std_mult': 2.5634111819836916, 'bull_rsi_os': 31, 'bull_rsi_ob': 74, 'bull_adx_thresh': 5.572707386596219, 'bull_atr_min_pct': 0.020370018858880217, 'bull_atr_max_pct': 0.14534091501984903, 'bull_tp_mult': 1.0763917103170517, 'bull_tsl_mult': 0.3051381101572256, 'bull_time_stop': 133, 'bull_use_sma': True, 'bull_use_ema': False, 'bull_use_atr': False, 'bull_use_adx': True, 'bull_use_spike': True, 'bull_rsi_required': True, 'bear_strategy': 'mean_reversion', 'bear_bb_std_mult': 1.2999402164486582, 'bear_rsi_os': 45, 'bear_rsi_ob': 45, 'bear_adx_thresh': 23.304517844713164, 'bear_atr_min_pct': 0.012930502400754499, 'bear_atr_max_pct': 0.015189015312748966, 'bear_tp_mult': 2.0823559764170643, 'bear_tsl_mult': 0.5419021271656009, 'bear_time_stop': 21, 'bear_use_sma': False, 'bear_use_ema': True, 'bear_use_atr': True, 'bear_use_adx': False, 'bear_use_spike': True, 'bear_rsi_required': True, 'sideways_strategy': 'breakout', 'sideways_bb_std_mult': 0.6278285852167248, 'sideways_rsi_os': 27, 'sideways_rsi_ob': 94, 'sideways_adx_thresh': 8.885863906688293, 'sideways_atr_min_pct': 0.029032376247290773, 'sideways_atr_max_pct': 0.04454851342455621, 'sideways_tp_mult': 1.8015092894234108, 'sideways_tsl_mult': 0.6588142529340528, 'sideways_time_stop': 189, 'sideways_use_sma': True, 'sideways_use_ema': True, 'sideways_use_atr': False, 'sideways_use_adx': True, 'sideways_use_spike': False, 'sideways_rsi_required': False}.
[I 2025-08-31 02:48:21,577] Trial 660 finished with values: [-1000000000.0, 1000000000.0] and parameters: {'p_sma': 29, 'p_std': 50, 'p_atr': 27, 'p_adx': 26, 'rsi_period': 72, 'ema1': 14, 'ema2': 49, 'slip_atr_k': 0.08139380987468087, 'slip_spread_k': 0.14028900556582122, 'spread_hl_frac': 0.002450827422456351, 'bb_std_mult': 1.7687298426282696, 'rsi_os': 32, 'rsi_ob': 68, 'vol_spike': 0.054779031265978065, 'adx_thresh': 26.313076424077394, 'atr_min_pct': 0.007945322646595528, 'atr_max_pct': 0.05098140474814049, 'tp_mult': 2.370403470781558, 'tsl_mult': 0.35832619351302913, 'strategy': 'mean_reversion', 'time_stop': 118, 'use_sma': False, 'use_atr': False, 'use_adx': False, 'use_ema': False, 'use_spike': True, 'rsi_required': True, 'edge_k': 0.5508597692744527, 'edge_cap': 0.45882756345088976, 'bull_strategy': 'breakout', 'bull_bb_std_mult': 0.9413065436030896, 'bull_rsi_os': 54, 'bull_rsi_ob': 55, 'bull_adx_thresh': 5.503654533429421, 'bull_atr_min_pct': 0.008188377825486887, 'bull_atr_max_pct': 0.046980963809394025, 'bull_tp_mult': 2.303852067700693, 'bull_tsl_mult': 0.265219362245327, 'bull_time_stop': 194, 'bull_use_sma': True, 'bull_use_ema': False, 'bull_use_atr': False, 'bull_use_adx': False, 'bull_use_spike': True, 'bull_rsi_required': True, 'bear_strategy': 'breakout', 'bear_bb_std_mult': 1.2383297654876029, 'bear_rsi_os': 6, 'bear_rsi_ob': 46, 'bear_adx_thresh': 6.612811098191897, 'bear_atr_min_pct': 0.005300142755720919, 'bear_atr_max_pct': 0.012342383565217907, 'bear_tp_mult': 1.6728967959527818, 'bear_tsl_mult': 0.33877782083482266, 'bear_time_stop': 156, 'bear_use_sma': False, 'bear_use_ema': True, 'bear_use_atr': True, 'bear_use_adx': True, 'bear_use_spike': True, 'bear_rsi_required': True, 'sideways_strategy': 'breakout', 'sideways_bb_std_mult': 0.5043520163663571, 'sideways_rsi_os': 40, 'sideways_rsi_ob': 83, 'sideways_adx_thresh': 33.892312867226195, 'sideways_atr_min_pct': 0.002294577837104815, 'sideways_atr_max_pct': 0.05598769501189855, 'sideways_tp_mult': 1.3694076731681935, 'sideways_tsl_mult': 0.030651476695621127, 'sideways_time_stop': 218, 'sideways_use_sma': True, 'sideways_use_ema': False, 'sideways_use_atr': False, 'sideways_use_adx': False, 'sideways_use_spike': False, 'sideways_rsi_required': False}.
[I 2025-08-31 02:48:23,237] Trial 661 finished with values: [-1000000000.0, 1000000000.0] and parameters: {'p_sma': 56, 'p_std': 30, 'p_atr': 27, 'p_adx': 22, 'rsi_period': 81, 'ema1': 6, 'ema2': 54, 'slip_atr_k': 0.07403031485074456, 'slip_spread_k': 0.2016070393491185, 'spread_hl_frac': 0.0024608305622357933, 'bb_std_mult': 3.0866170242165483, 'rsi_os': 38, 'rsi_ob': 68, 'vol_spike': 0.140567743523391, 'adx_thresh': 20.39614250287923, 'atr_min_pct': 0.023984391671328424, 'atr_max_pct': 0.04876776757621633, 'tp_mult': 1.2156766692554508, 'tsl_mult': 0.9042594403179638, 'strategy': 'mean_reversion', 'time_stop': 115, 'use_sma': True, 'use_atr': False, 'use_adx': True, 'use_ema': False, 'use_spike': True, 'rsi_required': True, 'edge_k': 0.00443523088859743, 'edge_cap': 0.06622676021327313, 'bull_strategy': 'breakout', 'bull_bb_std_mult': 1.4546500390644446, 'bull_rsi_os': 15, 'bull_rsi_ob': 78, 'bull_adx_thresh': 19.705062281664016, 'bull_atr_min_pct': 0.020312368571163288, 'bull_atr_max_pct': 0.14075344021980443, 'bull_tp_mult': 2.2497243913928515, 'bull_tsl_mult': 0.9406288249225374, 'bull_time_stop': 133, 'bull_use_sma': True, 'bull_use_ema': False, 'bull_use_atr': False, 'bull_use_adx': False, 'bull_use_spike': True, 'bull_rsi_required': True, 'bear_strategy': 'mean_reversion', 'bear_bb_std_mult': 1.2429700721592174, 'bear_rsi_os': 17, 'bear_rsi_ob': 46, 'bear_adx_thresh': 14.177136341078763, 'bear_atr_min_pct': 0.0070874870166473414, 'bear_atr_max_pct': 0.012817778119887713, 'bear_tp_mult': 2.1032625614579485, 'bear_tsl_mult': 0.00023742364748080558, 'bear_time_stop': 5, 'bear_use_sma': False, 'bear_use_ema': True, 'bear_use_atr': True, 'bear_use_adx': False, 'bear_use_spike': True, 'bear_rsi_required': True, 'sideways_strategy': 'breakout', 'sideways_bb_std_mult': 0.7548559199912765, 'sideways_rsi_os': 41, 'sideways_rsi_ob': 92, 'sideways_adx_thresh': 33.944656266041505, 'sideways_atr_min_pct': 0.005446595040207997, 'sideways_atr_max_pct': 0.0475502596278834, 'sideways_tp_mult': 1.7443870591238375, 'sideways_tsl_mult': 0.6189824742966245, 'sideways_time_stop': 219, 'sideways_use_sma': True, 'sideways_use_ema': True, 'sideways_use_atr': False, 'sideways_use_adx': True, 'sideways_use_spike': False, 'sideways_rsi_required': False}.
[I 2025-08-31 02:48:23,402] Trial 662 finished with values: [-1000000000.0, 1000000000.0] and parameters: {'p_sma': 53, 'p_std': 25, 'p_atr': 16, 'p_adx': 23, 'rsi_period': 72, 'ema1': 6, 'ema2': 34, 'slip_atr_k': 0.12121553332776831, 'slip_spread_k': 0.7237442874043467, 'spread_hl_frac': 0.042656683771597884, 'bb_std_mult': 2.5028230411386034, 'rsi_os': 39, 'rsi_ob': 62, 'vol_spike': 0.18440931702418561, 'adx_thresh': 20.484425332257075, 'atr_min_pct': 0.00784020464021253, 'atr_max_pct': 0.09697206336046545, 'tp_mult': 2.379246059757081, 'tsl_mult': 0.6502824250930589, 'strategy': 'mean_reversion', 'time_stop': 121, 'use_sma': True, 'use_atr': False, 'use_adx': True, 'use_ema': False, 'use_spike': True, 'rsi_required': True, 'edge_k': 1.3437101257554636, 'edge_cap': 0.10211134075450898, 'bull_strategy': 'breakout', 'bull_bb_std_mult': 2.293346655800308, 'bull_rsi_os': 25, 'bull_rsi_ob': 74, 'bull_adx_thresh': 5.013236301742409, 'bull_atr_min_pct': 0.020369567467896636, 'bull_atr_max_pct': 0.1460779348824976, 'bull_tp_mult': 1.2404450808733314, 'bull_tsl_mult': 0.2446631905062837, 'bull_time_stop': 6, 'bull_use_sma': True, 'bull_use_ema': False, 'bull_use_atr': False, 'bull_use_adx': False, 'bull_use_spike': True, 'bull_rsi_required': True, 'bear_strategy': 'mean_reversion', 'bear_bb_std_mult': 1.3042818221513608, 'bear_rsi_os': 53, 'bear_rsi_ob': 45, 'bear_adx_thresh': 5.687797044411685, 'bear_atr_min_pct': 0.005496391880818198, 'bear_atr_max_pct': 0.014664359247241947, 'bear_tp_mult': 1.992739242706149, 'bear_tsl_mult': 0.9630878766483666, 'bear_time_stop': 172, 'bear_use_sma': False, 'bear_use_ema': True, 'bear_use_atr': True, 'bear_use_adx': False, 'bear_use_spike': True, 'bear_rsi_required': True, 'sideways_strategy': 'breakout', 'sideways_bb_std_mult': 0.766675967689561, 'sideways_rsi_os': 39, 'sideways_rsi_ob': 92, 'sideways_adx_thresh': 8.92678157598963, 'sideways_atr_min_pct': 0.02888192280820419, 'sideways_atr_max_pct': 0.09645505020663046, 'sideways_tp_mult': 1.7409481888084009, 'sideways_tsl_mult': 0.8997138098678998, 'sideways_time_stop': 219, 'sideways_use_sma': True, 'sideways_use_ema': True, 'sideways_use_atr': False, 'sideways_use_adx': True, 'sideways_use_spike': False, 'sideways_rsi_required': False}.
[I 2025-08-31 02:48:24,387] Trial 664 finished with values: [-1000000000.0, 1000000000.0] and parameters: {'p_sma': 56, 'p_std': 57, 'p_atr': 27, 'p_adx': 15, 'rsi_period': 66, 'ema1': 5, 'ema2': 34, 'slip_atr_k': 0.18919714579621666, 'slip_spread_k': 0.08081640551538877, 'spread_hl_frac': 0.0023510785523704752, 'bb_std_mult': 1.73469907322824, 'rsi_os': 39, 'rsi_ob': 87, 'vol_spike': 0.18582132288481884, 'adx_thresh': 20.435883417824357, 'atr_min_pct': 0.007155828073438992, 'atr_max_pct': 0.12589780337424775, 'tp_mult': 1.2280515198714386, 'tsl_mult': 0.9022793641072573, 'strategy': 'mean_reversion', 'time_stop': 197, 'use_sma': True, 'use_atr': False, 'use_adx': False, 'use_ema': False, 'use_spike': False, 'rsi_required': True, 'edge_k': 0.605922652104483, 'edge_cap': 0.0923420846460474, 'bull_strategy': 'breakout', 'bull_bb_std_mult': 1.838774652449757, 'bull_rsi_os': 30, 'bull_rsi_ob': 56, 'bull_adx_thresh': 5.56627861592997, 'bull_atr_min_pct': 0.0068142565357426155, 'bull_atr_max_pct': 0.1400144120223477, 'bull_tp_mult': 2.7147807650400435, 'bull_tsl_mult': 0.23967225938325437, 'bull_time_stop': 145, 'bull_use_sma': True, 'bull_use_ema': False, 'bull_use_atr': False, 'bull_use_adx': True, 'bull_use_spike': True, 'bull_rsi_required': True, 'bear_strategy': 'mean_reversion', 'bear_bb_std_mult': 1.3257837953956968, 'bear_rsi_os': 53, 'bear_rsi_ob': 48, 'bear_adx_thresh': 5.519153883356532, 'bear_atr_min_pct': 0.025980340910685993, 'bear_atr_max_pct': 0.012695007637819548, 'bear_tp_mult': 1.5940698951803598, 'bear_tsl_mult': 0.3314092875107004, 'bear_time_stop': 21, 'bear_use_sma': False, 'bear_use_ema': False, 'bear_use_atr': True, 'bear_use_adx': True, 'bear_use_spike': True, 'bear_rsi_required': True, 'sideways_strategy': 'breakout', 'sideways_bb_std_mult': 0.7568887576057223, 'sideways_rsi_os': 35, 'sideways_rsi_ob': 92, 'sideways_adx_thresh': 7.379169238476255, 'sideways_atr_min_pct': 0.02640673275536691, 'sideways_atr_max_pct': 0.0956036399126661, 'sideways_tp_mult': 1.7468083837856625, 'sideways_tsl_mult': 0.6559617119025208, 'sideways_time_stop': 222, 'sideways_use_sma': True, 'sideways_use_ema': True, 'sideways_use_atr': True, 'sideways_use_adx': False, 'sideways_use_spike': False, 'sideways_rsi_required': False}.
[I 2025-08-31 02:48:56,639] Trial 668 finished with values: [-1000000000.0, 1000000000.0] and parameters: {'p_sma': 12, 'p_std': 52, 'p_atr': 28, 'p_adx': 18, 'rsi_period': 67, 'ema1': 5, 'ema2': 42, 'slip_atr_k': 0.2444729607609293, 'slip_spread_k': 0.1616908154026378, 'spread_hl_frac': 0.001244255207188972, 'bb_std_mult': 1.8179416998173752, 'rsi_os': 43, 'rsi_ob': 94, 'vol_spike': 0.0758267286822121, 'adx_thresh': 29.03502285016029, 'atr_min_pct': 0.009006333162627988, 'atr_max_pct': 0.12063371713594645, 'tp_mult': 2.0243478513878888, 'tsl_mult': 0.45634673747814464, 'strategy': 'mean_reversion', 'time_stop': 22, 'use_sma': True, 'use_atr': False, 'use_adx': False, 'use_ema': False, 'use_spike': False, 'rsi_required': True, 'edge_k': 0.49837143527984595, 'edge_cap': 0.24235550514890092, 'bull_strategy': 'mean_reversion', 'bull_bb_std_mult': 2.1813077057430874, 'bull_rsi_os': 51, 'bull_rsi_ob': 65, 'bull_adx_thresh': 5.011666002797979, 'bull_atr_min_pct': 0.01014350743598264, 'bull_atr_max_pct': 0.019012999874647614, 'bull_tp_mult': 1.4307505415044277, 'bull_tsl_mult': 0.2815399395090507, 'bull_time_stop': 138, 'bull_use_sma': True, 'bull_use_ema': True, 'bull_use_atr': False, 'bull_use_adx': True, 'bull_use_spike': True, 'bull_rsi_required': True, 'bear_strategy': 'mean_reversion', 'bear_bb_std_mult': 3.040939390470515, 'bear_rsi_os': 18, 'bear_rsi_ob': 85, 'bear_adx_thresh': 5.527081470378431, 'bear_atr_min_pct': 0.021197038907012192, 'bear_atr_max_pct': 0.10539144908537258, 'bear_tp_mult': 2.304772613093116, 'bear_tsl_mult': 0.13960917248429178, 'bear_time_stop': 11, 'bear_use_sma': False, 'bear_use_ema': False, 'bear_use_atr': False, 'bear_use_adx': True, 'bear_use_spike': False, 'bear_rsi_required': True, 'sideways_strategy': 'breakout', 'sideways_bb_std_mult': 2.7289971968809947, 'sideways_rsi_os': 38, 'sideways_rsi_ob': 94, 'sideways_adx_thresh': 17.454976621468802, 'sideways_atr_min_pct': 0.01197065999268744, 'sideways_atr_max_pct': 0.015679772066509515, 'sideways_tp_mult': 2.1842394413367408, 'sideways_tsl_mult': 0.6712111963090122, 'sideways_time_stop': 34, 'sideways_use_sma': False, 'sideways_use_ema': False, 'sideways_use_atr': True, 'sideways_use_adx': False, 'sideways_use_spike': True, 'sideways_rsi_required': True}.
