[I 2025-08-31 00:25:10,365] Trial 191 finished with values: [-1000000000.0, 1000000000.0] and parameters: {'p_sma': 46, 'p_std': 31, 'p_atr': 19, 'p_adx': 7, 'rsi_period': 34, 'ema1': 26, 'ema2': 22, 'slip_atr_k': 0.08350081663490391, 'slip_spread_k': 0.37554277613929493, 'spread_hl_frac': 0.03607389466564597, 'bb_std_mult': 1.372605532264273, 'rsi_os': 55, 'rsi_ob': 91, 'vol_spike': 0.07546721229880908, 'adx_thresh': 32.04937975381504, 'atr_min_pct': 0.012389492507985284, 'atr_max_pct': 0.01219919182161816, 'tp_mult': 2.522592762258907, 'tsl_mult': 0.6805950916237788, 'strategy': 'mean_reversion', 'time_stop': 279, 'use_sma': False, 'use_atr': False, 'use_adx': False, 'use_ema': False, 'use_spike': True, 'rsi_required': True, 'edge_k': 0.6872891656589294, 'edge_cap': 0.2273513917840363, 'bull_strategy': 'mean_reversion', 'bull_bb_std_mult': 2.288888212957044, 'bull_rsi_os': 37, 'bull_rsi_ob': 67, 'bull_adx_thresh': 13.70689474728057, 'bull_atr_min_pct': 0.0009150310797273321, 'bull_atr_max_pct': 0.1485760548107325, 'bull_tp_mult': 2.95262788559215, 'bull_tsl_mult': 0.20487962030698592, 'bull_time_stop': 278, 'bull_use_sma': True, 'bull_use_ema': False, 'bull_use_atr': True, 'bull_use_adx': True, 'bull_use_spike': True, 'bull_rsi_required': True, 'bear_strategy': 'mean_reversion', 'bear_bb_std_mult': 0.5618270655114703, 'bear_rsi_os': 15, 'bear_rsi_ob': 89, 'bear_adx_thresh': 27.639621194081805, 'bear_atr_min_pct': 0.019042055568378194, 'bear_atr_max_pct': 0.14109755173577565, 'bear_tp_mult': 1.9380706023405663, 'bear_tsl_mult': 0.5573498480474753, 'bear_time_stop': 186, 'bear_use_sma': True, 'bear_use_ema': True, 'bear_use_atr': True, 'bear_use_adx': False, 'bear_use_spike': True, 'bear_rsi_required': False, 'sideways_strategy': 'breakout', 'sideways_bb_std_mult': 3.0385973137039706, 'sideways_rsi_os': 42, 'sideways_rsi_ob': 66, 'sideways_adx_thresh': 10.547834373487333, 'sideways_atr_min_pct': 0.015958874604532804, 'sideways_atr_max_pct': 0.1498111765911242, 'sideways_tp_mult': 2.7102477157146323, 'sideways_tsl_mult': 0.5988872744286924, 'sideways_time_stop': 239, 'sideways_use_sma': True, 'sideways_use_ema': True, 'sideways_use_atr': True, 'sideways_use_adx': True, 'sideways_use_spike': False, 'sideways_rsi_required': False}.
[I 2025-08-31 00:25:10,395] Trial 192 finished with values: [-1000000000.0, 1000000000.0] and parameters: {'p_sma': 46, 'p_std': 31, 'p_atr': 14, 'p_adx': 7, 'rsi_period': 78, 'ema1': 25, 'ema2': 25, 'slip_atr_k': 0.09020074454008906, 'slip_spread_k': 0.380954120123858, 'spread_hl_frac': 0.04032593518343018, 'bb_std_mult': 2.364260327903681, 'rsi_os': 54, 'rsi_ob': 91, 'vol_spike': 0.07562334241207477, 'adx_thresh': 6.67559231055761, 'atr_min_pct': 0.0004674276752524441, 'atr_max_pct': 0.011985424678271059, 'tp_mult': 2.516439536924458, 'tsl_mult': 0.1303184764035724, 'strategy': 'mean_reversion', 'time_stop': 272, 'use_sma': True, 'use_atr': False, 'use_adx': False, 'use_ema': False, 'use_spike': False, 'rsi_required': True, 'edge_k': 0.5549250983319001, 'edge_cap': 0.9311162653558067, 'bull_strategy': 'mean_reversion', 'bull_bb_std_mult': 2.76718424848894, 'bull_rsi_os': 23, 'bull_rsi_ob': 69, 'bull_adx_thresh': 23.931435023545347, 'bull_atr_min_pct': 0.0009293267286715582, 'bull_atr_max_pct': 0.1223151265839515, 'bull_tp_mult': 2.9681013399428995, 'bull_tsl_mult': 0.21064241659568686, 'bull_time_stop': 174, 'bull_use_sma': False, 'bull_use_ema': False, 'bull_use_atr': True, 'bull_use_adx': True, 'bull_use_spike': False, 'bull_rsi_required': False, 'bear_strategy': 'breakout', 'bear_bb_std_mult': 0.5476702403955075, 'bear_rsi_os': 6, 'bear_rsi_ob': 50, 'bear_adx_thresh': 29.8466817072639, 'bear_atr_min_pct': 0.011308203120352647, 'bear_atr_max_pct': 0.14183584796998963, 'bear_tp_mult': 1.2534384846504911, 'bear_tsl_mult': 0.5552770187576774, 'bear_time_stop': 221, 'bear_use_sma': True, 'bear_use_ema': False, 'bear_use_atr': True, 'bear_use_adx': False, 'bear_use_spike': True, 'bear_rsi_required': False, 'sideways_strategy': 'breakout', 'sideways_bb_std_mult': 2.9867367573948993, 'sideways_rsi_os': 42, 'sideways_rsi_ob': 69, 'sideways_adx_thresh': 10.80144008022627, 'sideways_atr_min_pct': 0.02227613158774687, 'sideways_atr_max_pct': 0.14953285793612567, 'sideways_tp_mult': 2.0579489445857515, 'sideways_tsl_mult': 0.60724695305029, 'sideways_time_stop': 86, 'sideways_use_sma': True, 'sideways_use_ema': False, 'sideways_use_atr': False, 'sideways_use_adx': False, 'sideways_use_spike': False, 'sideways_rsi_required': False}.
[I 2025-08-31 00:25:37,454] Trial 190 finished with values: [-0.023846607399765296, 0.023743404545119105] and parameters: {'p_sma': 44, 'p_std': 31, 'p_atr': 28, 'p_adx': 22, 'rsi_period': 35, 'ema1': 24, 'ema2': 52, 'slip_atr_k': 0.16993315075769522, 'slip_spread_k': 0.12604257983630573, 'spread_hl_frac': 0.007937817954052982, 'bb_std_mult': 0.9152015905467654, 'rsi_os': 54, 'rsi_ob': 76, 'vol_spike': 0.015119609856386107, 'adx_thresh': 6.378579200542557, 'atr_min_pct': 0.0007749281097396361, 'atr_max_pct': 0.07121497449468604, 'tp_mult': 1.1191886746265027, 'tsl_mult': 0.5175319742104653, 'strategy': 'breakout', 'time_stop': 271, 'use_sma': False, 'use_atr': True, 'use_adx': False, 'use_ema': False, 'use_spike': True, 'rsi_required': True, 'edge_k': 0.5554465857622872, 'edge_cap': 0.9696596536576902, 'bull_strategy': 'mean_reversion', 'bull_bb_std_mult': 1.84717081754123, 'bull_rsi_os': 36, 'bull_rsi_ob': 69, 'bull_adx_thresh': 27.320990108282817, 'bull_atr_min_pct': 0.0009126656100043441, 'bull_atr_max_pct': 0.09581081962616446, 'bull_tp_mult': 1.5238544284716697, 'bull_tsl_mult': 0.5603375328936727, 'bull_time_stop': 173, 'bull_use_sma': True, 'bull_use_ema': False, 'bull_use_atr': True, 'bull_use_adx': False, 'bull_use_spike': True, 'bull_rsi_required': True, 'bear_strategy': 'mean_reversion', 'bear_bb_std_mult': 0.5587706888970039, 'bear_rsi_os': 30, 'bear_rsi_ob': 73, 'bear_adx_thresh': 28.8733295086065, 'bear_atr_min_pct': 0.011616951088807517, 'bear_atr_max_pct': 0.14561918088080256, 'bear_tp_mult': 1.2823206241719347, 'bear_tsl_mult': 0.5798529342358338, 'bear_time_stop': 32, 'bear_use_sma': False, 'bear_use_ema': True, 'bear_use_atr': False, 'bear_use_adx': False, 'bear_use_spike': True, 'bear_rsi_required': False, 'sideways_strategy': 'breakout', 'sideways_bb_std_mult': 1.2147461708846135, 'sideways_rsi_os': 42, 'sideways_rsi_ob': 69, 'sideways_adx_thresh': 12.208840662775255, 'sideways_atr_min_pct': 0.020740471295281792, 'sideways_atr_max_pct': 0.014685655426446328, 'sideways_tp_mult': 1.0557996279048971, 'sideways_tsl_mult': 0.7096792099298621, 'sideways_time_stop': 88, 'sideways_use_sma': True, 'sideways_use_ema': True, 'sideways_use_atr': True, 'sideways_use_adx': True, 'sideways_use_spike': False, 'sideways_rsi_required': False}.
[I 2025-08-31 00:25:38,548] Trial 189 finished with values: [-0.02101280838800179, 0.020919032771238164] and parameters: {'p_sma': 30, 'p_std': 31, 'p_atr': 28, 'p_adx': 7, 'rsi_period': 35, 'ema1': 10, 'ema2': 52, 'slip_atr_k': 0.02775151148674555, 'slip_spread_k': 0.13342462260596505, 'spread_hl_frac': 0.04577175258885548, 'bb_std_mult': 3.4128775839675116, 'rsi_os': 54, 'rsi_ob': 76, 'vol_spike': 0.014424148180051841, 'adx_thresh': 6.439208742278309, 'atr_min_pct': 0.0010502742633806096, 'atr_max_pct': 0.07977183849084042, 'tp_mult': 2.6745233144985083, 'tsl_mult': 0.13043625906908135, 'strategy': 'breakout', 'time_stop': 271, 'use_sma': False, 'use_atr': True, 'use_adx': False, 'use_ema': False, 'use_spike': True, 'rsi_required': True, 'edge_k': 0.7781445805016743, 'edge_cap': 0.4139158012510223, 'bull_strategy': 'mean_reversion', 'bull_bb_std_mult': 2.197146557776588, 'bull_rsi_os': 35, 'bull_rsi_ob': 67, 'bull_adx_thresh': 6.9475436473745305, 'bull_atr_min_pct': 0.0009469442359183312, 'bull_atr_max_pct': 0.09187229568449594, 'bull_tp_mult': 1.9078105647743482, 'bull_tsl_mult': 0.6178624422553629, 'bull_time_stop': 173, 'bull_use_sma': True, 'bull_use_ema': False, 'bull_use_atr': True, 'bull_use_adx': False, 'bull_use_spike': True, 'bull_rsi_required': True, 'bear_strategy': 'mean_reversion', 'bear_bb_std_mult': 0.5769535494020782, 'bear_rsi_os': 15, 'bear_rsi_ob': 91, 'bear_adx_thresh': 28.973722090703532, 'bear_atr_min_pct': 0.00916638502664456, 'bear_atr_max_pct': 0.14098383909591425, 'bear_tp_mult': 2.8403354078774106, 'bear_tsl_mult': 0.20117806217341036, 'bear_time_stop': 261, 'bear_use_sma': False, 'bear_use_ema': True, 'bear_use_atr': False, 'bear_use_adx': True, 'bear_use_spike': True, 'bear_rsi_required': True, 'sideways_strategy': 'breakout', 'sideways_bb_std_mult': 1.0472042899095786, 'sideways_rsi_os': 44, 'sideways_rsi_ob': 69, 'sideways_adx_thresh': 12.413426745485204, 'sideways_atr_min_pct': 0.010514378011828734, 'sideways_atr_max_pct': 0.14673592500318403, 'sideways_tp_mult': 1.3718127863460228, 'sideways_tsl_mult': 0.6023127094141235, 'sideways_time_stop': 89, 'sideways_use_sma': False, 'sideways_use_ema': True, 'sideways_use_atr': True, 'sideways_use_adx': True, 'sideways_use_spike': True, 'sideways_rsi_required': False}.
[I 2025-08-31 00:25:40,278] Trial 193 finished with values: [-1000000000.0, 1000000000.0] and parameters: {'p_sma': 43, 'p_std': 14, 'p_atr': 14, 'p_adx': 7, 'rsi_period': 82, 'ema1': 25, 'ema2': 31, 'slip_atr_k': 0.03644287704714474, 'slip_spread_k': 0.07842289330985278, 'spread_hl_frac': 0.01761453335415397, 'bb_std_mult': 3.4482388949105607, 'rsi_os': 54, 'rsi_ob': 76, 'vol_spike': 0.014111837280683891, 'adx_thresh': 28.028258293143338, 'atr_min_pct': 0.01011246083526278, 'atr_max_pct': 0.049993052165446694, 'tp_mult': 2.672954576415449, 'tsl_mult': 0.13381163820422895, 'strategy': 'breakout', 'time_stop': 125, 'use_sma': True, 'use_atr': False, 'use_adx': False, 'use_ema': False, 'use_spike': False, 'rsi_required': False, 'edge_k': 1.8947848558267704, 'edge_cap': 0.06925768949016264, 'bull_strategy': 'breakout', 'bull_bb_std_mult': 2.190922350496591, 'bull_rsi_os': 38, 'bull_rsi_ob': 69, 'bull_adx_thresh': 13.332162529297905, 'bull_atr_min_pct': 0.021702747553280482, 'bull_atr_max_pct': 0.12821823390596448, 'bull_tp_mult': 2.9694297382478916, 'bull_tsl_mult': 0.28733983641513056, 'bull_time_stop': 163, 'bull_use_sma': False, 'bull_use_ema': False, 'bull_use_atr': True, 'bull_use_adx': True, 'bull_use_spike': False, 'bull_rsi_required': False, 'bear_strategy': 'breakout', 'bear_bb_std_mult': 0.6868493111681826, 'bear_rsi_os': 30, 'bear_rsi_ob': 50, 'bear_adx_thresh': 29.819426530424252, 'bear_atr_min_pct': 0.010194985756845283, 'bear_atr_max_pct': 0.12517411000626275, 'bear_tp_mult': 1.266811287285072, 'bear_tsl_mult': 0.5926298697100322, 'bear_time_stop': 31, 'bear_use_sma': False, 'bear_use_ema': False, 'bear_use_atr': True, 'bear_use_adx': True, 'bear_use_spike': False, 'bear_rsi_required': False, 'sideways_strategy': 'mean_reversion', 'sideways_bb_std_mult': 1.1896730316078277, 'sideways_rsi_os': 45, 'sideways_rsi_ob': 69, 'sideways_adx_thresh': 14.361472538989478, 'sideways_atr_min_pct': 0.02220078410668727, 'sideways_atr_max_pct': 0.13211538848122928, 'sideways_tp_mult': 1.4000532888094164, 'sideways_tsl_mult': 0.7432559498080901, 'sideways_time_stop': 89, 'sideways_use_sma': True, 'sideways_use_ema': False, 'sideways_use_atr': False, 'sideways_use_adx': False, 'sideways_use_spike': True, 'sideways_rsi_required': False}.
[I 2025-08-31 00:25:40,689] Trial 194 finished with values: [-1000000000.0, 1000000000.0] and parameters: {'p_sma': 48, 'p_std': 14, 'p_atr': 13, 'p_adx': 26, 'rsi_period': 83, 'ema1': 26, 'ema2': 54, 'slip_atr_k': 0.038085563209479326, 'slip_spread_k': 0.13242222105315554, 'spread_hl_frac': 0.047354569510191166, 'bb_std_mult': 3.4631497070491197, 'rsi_os': 23, 'rsi_ob': 85, 'vol_spike': 0.17329073506532458, 'adx_thresh': 26.29684092440881, 'atr_min_pct': 0.006184365637101711, 'atr_max_pct': 0.0790997639462903, 'tp_mult': 1.106790428617703, 'tsl_mult': 0.43721661235253306, 'strategy': 'breakout', 'time_stop': 91, 'use_sma': True, 'use_atr': False, 'use_adx': False, 'use_ema': False, 'use_spike': False, 'rsi_required': False, 'edge_k': 0.8489049371177411, 'edge_cap': 0.954927280726603, 'bull_strategy': 'breakout', 'bull_bb_std_mult': 2.203711999159966, 'bull_rsi_os': 38, 'bull_rsi_ob': 64, 'bull_adx_thresh': 5.723550992849301, 'bull_atr_min_pct': 0.008588365192096062, 'bull_atr_max_pct': 0.13351936137671594, 'bull_tp_mult': 2.0428691696008183, 'bull_tsl_mult': 0.27376474104018844, 'bull_time_stop': 161, 'bull_use_sma': False, 'bull_use_ema': True, 'bull_use_atr': True, 'bull_use_adx': True, 'bull_use_spike': False, 'bull_rsi_required': False, 'bear_strategy': 'breakout', 'bear_bb_std_mult': 2.823684812233795, 'bear_rsi_os': 46, 'bear_rsi_ob': 75, 'bear_adx_thresh': 17.40758124289757, 'bear_atr_min_pct': 0.010006259137974281, 'bear_atr_max_pct': 0.13655829369422526, 'bear_tp_mult': 1.8530327923951417, 'bear_tsl_mult': 0.2014125268100389, 'bear_time_stop': 56, 'bear_use_sma': False, 'bear_use_ema': False, 'bear_use_atr': True, 'bear_use_adx': True, 'bear_use_spike': False, 'bear_rsi_required': False, 'sideways_strategy': 'mean_reversion', 'sideways_bb_std_mult': 1.1957424779733774, 'sideways_rsi_os': 45, 'sideways_rsi_ob': 56, 'sideways_adx_thresh': 6.646409259958864, 'sideways_atr_min_pct': 0.02097027075503211, 'sideways_atr_max_pct': 0.1372537045386149, 'sideways_tp_mult': 1.1216778283755717, 'sideways_tsl_mult': 0.18430555839946303, 'sideways_time_stop': 196, 'sideways_use_sma': False, 'sideways_use_ema': False, 'sideways_use_atr': False, 'sideways_use_adx': False, 'sideways_use_spike': True, 'sideways_rsi_required': False}.
[I 2025-08-31 00:26:10,555] Trial 195 finished with values: [-1000000000.0, 1000000000.0] and parameters: {'p_sma': 48, 'p_std': 41, 'p_atr': 13, 'p_adx': 7, 'rsi_period': 83, 'ema1': 26, 'ema2': 54, 'slip_atr_k': 0.17125132161393328, 'slip_spread_k': 0.13741099477914615, 'spread_hl_frac': 0.04594744642976978, 'bb_std_mult': 3.47674306450474, 'rsi_os': 54, 'rsi_ob': 86, 'vol_spike': 0.17489080098685816, 'adx_thresh': 8.344733975031614, 'atr_min_pct': 0.005734097208369456, 'atr_max_pct': 0.0694054647354679, 'tp_mult': 1.580666787396048, 'tsl_mult': 0.5053166681151159, 'strategy': 'breakout', 'time_stop': 197, 'use_sma': True, 'use_atr': False, 'use_adx': False, 'use_ema': False, 'use_spike': False, 'rsi_required': False, 'edge_k': 1.9155003237779966, 'edge_cap': 0.085935935101431, 'bull_strategy': 'breakout', 'bull_bb_std_mult': 2.209481264077398, 'bull_rsi_os': 36, 'bull_rsi_ob': 64, 'bull_adx_thresh': 27.501688744750453, 'bull_atr_min_pct': 0.011349730333045812, 'bull_atr_max_pct': 0.09709114742278835, 'bull_tp_mult': 2.4568844013255386, 'bull_tsl_mult': 0.28558363137313597, 'bull_time_stop': 161, 'bull_use_sma': False, 'bull_use_ema': True, 'bull_use_atr': False, 'bull_use_adx': True, 'bull_use_spike': False, 'bull_rsi_required': False, 'bear_strategy': 'breakout', 'bear_bb_std_mult': 0.6654460724599353, 'bear_rsi_os': 23, 'bear_rsi_ob': 75, 'bear_adx_thresh': 17.410190850869665, 'bear_atr_min_pct': 0.019970134553305534, 'bear_atr_max_pct': 0.03444581834134395, 'bear_tp_mult': 1.9653872921419986, 'bear_tsl_mult': 0.20082607545062509, 'bear_time_stop': 33, 'bear_use_sma': False, 'bear_use_ema': False, 'bear_use_atr': True, 'bear_use_adx': True, 'bear_use_spike': False, 'bear_rsi_required': False, 'sideways_strategy': 'mean_reversion', 'sideways_bb_std_mult': 1.2164298394404884, 'sideways_rsi_os': 45, 'sideways_rsi_ob': 62, 'sideways_adx_thresh': 11.67177146154653, 'sideways_atr_min_pct': 0.02103416909155909, 'sideways_atr_max_pct': 0.01366043687393978, 'sideways_tp_mult': 1.1241570395401488, 'sideways_tsl_mult': 0.6442553528936976, 'sideways_time_stop': 98, 'sideways_use_sma': False, 'sideways_use_ema': False, 'sideways_use_atr': False, 'sideways_use_adx': False, 'sideways_use_spike': True, 'sideways_rsi_required': False}.
[I 2025-08-31 00:26:10,726] Trial 196 finished with values: [-1000000000.0, 1000000000.0] and parameters: {'p_sma': 50, 'p_std': 60, 'p_atr': 13, 'p_adx': 7, 'rsi_period': 25, 'ema1': 26, 'ema2': 18, 'slip_atr_k': 0.03766838399979259, 'slip_spread_k': 0.08209423554525258, 'spread_hl_frac': 0.04892250351587102, 'bb_std_mult': 2.57140697154525, 'rsi_os': 54, 'rsi_ob': 86, 'vol_spike': 0.010222715982029186, 'adx_thresh': 12.612374744132058, 'atr_min_pct': 0.010149688591244401, 'atr_max_pct': 0.06462706532378881, 'tp_mult': 1.1283658489542012, 'tsl_mult': 0.11056405879863015, 'strategy': 'breakout', 'time_stop': 125, 'use_sma': True, 'use_atr': False, 'use_adx': False, 'use_ema': False, 'use_spike': False, 'rsi_required': False, 'edge_k': 1.6587170864249559, 'edge_cap': 0.07571710049534147, 'bull_strategy': 'breakout', 'bull_bb_std_mult': 2.194783691191488, 'bull_rsi_os': 36, 'bull_rsi_ob': 70, 'bull_adx_thresh': 13.551466965397408, 'bull_atr_min_pct': 0.011428818768057849, 'bull_atr_max_pct': 0.09561974053470373, 'bull_tp_mult': 2.572640254970979, 'bull_tsl_mult': 0.2901682427678207, 'bull_time_stop': 148, 'bull_use_sma': False, 'bull_use_ema': True, 'bull_use_atr': False, 'bull_use_adx': True, 'bull_use_spike': False, 'bull_rsi_required': False, 'bear_strategy': 'breakout', 'bear_bb_std_mult': 2.097996721974494, 'bear_rsi_os': 46, 'bear_rsi_ob': 75, 'bear_adx_thresh': 25.44121319713859, 'bear_atr_min_pct': 0.010373474798354768, 'bear_atr_max_pct': 0.032627988064207955, 'bear_tp_mult': 2.697667289546586, 'bear_tsl_mult': 0.5925898409255846, 'bear_time_stop': 265, 'bear_use_sma': False, 'bear_use_ema': False, 'bear_use_atr': True, 'bear_use_adx': True, 'bear_use_spike': False, 'bear_rsi_required': False, 'sideways_strategy': 'mean_reversion', 'sideways_bb_std_mult': 1.1853422863648786, 'sideways_rsi_os': 32, 'sideways_rsi_ob': 50, 'sideways_adx_thresh': 11.63707517698182, 'sideways_atr_min_pct': 0.02097638703742948, 'sideways_atr_max_pct': 0.13366809215615513, 'sideways_tp_mult': 1.1367070815020852, 'sideways_tsl_mult': 0.46150181909233035, 'sideways_time_stop': 91, 'sideways_use_sma': False, 'sideways_use_ema': False, 'sideways_use_atr': False, 'sideways_use_adx': False, 'sideways_use_spike': True, 'sideways_rsi_required': False}.
[I 2025-08-31 00:26:10,953] Trial 198 finished with values: [-1000000000.0, 1000000000.0] and parameters: {'p_sma': 50, 'p_std': 41, 'p_atr': 12, 'p_adx': 8, 'rsi_period': 47, 'ema1': 26, 'ema2': 57, 'slip_atr_k': 0.05134130255085313, 'slip_spread_k': 0.30430530466370875, 'spread_hl_frac': 0.007936952024734444, 'bb_std_mult': 3.367357675996333, 'rsi_os': 30, 'rsi_ob': 77, 'vol_spike': 0.1203075640420356, 'adx_thresh': 34.8048208592048, 'atr_min_pct': 0.0005078798662912372, 'atr_max_pct': 0.06427293378167882, 'tp_mult': 1.32537575214847, 'tsl_mult': 0.10782993896392856, 'strategy': 'breakout', 'time_stop': 198, 'use_sma': True, 'use_atr': False, 'use_adx': False, 'use_ema': False, 'use_spike': False, 'rsi_required': True, 'edge_k': 1.561636161403002, 'edge_cap': 0.8976717602079679, 'bull_strategy': 'breakout', 'bull_bb_std_mult': 2.448219497769747, 'bull_rsi_os': 36, 'bull_rsi_ob': 67, 'bull_adx_thresh': 14.062991757155903, 'bull_atr_min_pct': 0.009778590590831679, 'bull_atr_max_pct': 0.09677408270315369, 'bull_tp_mult': 1.904607437043485, 'bull_tsl_mult': 0.24563421692940596, 'bull_time_stop': 203, 'bull_use_sma': False, 'bull_use_ema': True, 'bull_use_atr': False, 'bull_use_adx': True, 'bull_use_spike': False, 'bull_rsi_required': False, 'bear_strategy': 'breakout', 'bear_bb_std_mult': 3.278704764423845, 'bear_rsi_os': 10, 'bear_rsi_ob': 54, 'bear_adx_thresh': 30.958915311784487, 'bear_atr_min_pct': 0.028566692257645812, 'bear_atr_max_pct': 0.14060679186049493, 'bear_tp_mult': 2.8457938748257274, 'bear_tsl_mult': 0.1532327020529969, 'bear_time_stop': 257, 'bear_use_sma': False, 'bear_use_ema': False, 'bear_use_atr': True, 'bear_use_adx': True, 'bear_use_spike': False, 'bear_rsi_required': False, 'sideways_strategy': 'mean_reversion', 'sideways_bb_std_mult': 1.786603444358721, 'sideways_rsi_os': 32, 'sideways_rsi_ob': 68, 'sideways_adx_thresh': 34.23000401528706, 'sideways_atr_min_pct': 0.020130078625518723, 'sideways_atr_max_pct': 0.14489154451963923, 'sideways_tp_mult': 1.1622693090752299, 'sideways_tsl_mult': 0.06119591534550839, 'sideways_time_stop': 99, 'sideways_use_sma': False, 'sideways_use_ema': False, 'sideways_use_atr': False, 'sideways_use_adx': False, 'sideways_use_spike': True, 'sideways_rsi_required': False}.
