[I 2025-08-31 00:49:25,662] Trial 396 finished with values: [-1000000000.0, 1000000000.0] and parameters: {'p_sma': 35, 'p_std': 45, 'p_atr': 24, 'p_adx': 8, 'rsi_period': 82, 'ema1': 11, 'ema2': 41, 'slip_atr_k': 0.1736260797175846, 'slip_spread_k': 0.8745810079333693, 'spread_hl_frac': 0.002924139464563616, 'bb_std_mult': 1.873761463326846, 'rsi_os': 30, 'rsi_ob': 78, 'vol_spike': 0.16464115641422505, 'adx_thresh': 8.463395919879384, 'atr_min_pct': 0.004582716613917134, 'atr_max_pct': 0.04931359974293571, 'tp_mult': 2.6296738338572023, 'tsl_mult': 0.11850648749853607, 'strategy': 'breakout', 'time_stop': 201, 'use_sma': True, 'use_atr': False, 'use_adx': False, 'use_ema': True, 'use_spike': False, 'rsi_required': False, 'edge_k': 0.6465330143795891, 'edge_cap': 0.17867965082121634, 'bull_strategy': 'breakout', 'bull_bb_std_mult': 1.4703338857562174, 'bull_rsi_os': 26, 'bull_rsi_ob': 59, 'bull_adx_thresh': 15.345234389450324, 'bull_atr_min_pct': 0.0017581478786616632, 'bull_atr_max_pct': 0.08377811790967558, 'bull_tp_mult': 2.3485852291779246, 'bull_tsl_mult': 0.33142033322156234, 'bull_time_stop': 261, 'bull_use_sma': True, 'bull_use_ema': False, 'bull_use_atr': True, 'bull_use_adx': False, 'bull_use_spike': True, 'bull_rsi_required': False, 'bear_strategy': 'mean_reversion', 'bear_bb_std_mult': 1.0612314712398088, 'bear_rsi_os': 17, 'bear_rsi_ob': 76, 'bear_adx_thresh': 7.585903792522701, 'bear_atr_min_pct': 0.021596883845056536, 'bear_atr_max_pct': 0.021079388138989706, 'bear_tp_mult': 1.9358325584950975, 'bear_tsl_mult': 0.686208342700002, 'bear_time_stop': 211, 'bear_use_sma': True, 'bear_use_ema': False, 'bear_use_atr': False, 'bear_use_adx': True, 'bear_use_spike': False, 'bear_rsi_required': False, 'sideways_strategy': 'mean_reversion', 'sideways_bb_std_mult': 1.2395885481004774, 'sideways_rsi_os': 46, 'sideways_rsi_ob': 79, 'sideways_adx_thresh': 13.873968954122363, 'sideways_atr_min_pct': 0.020909599896728758, 'sideways_atr_max_pct': 0.14519520894005347, 'sideways_tp_mult': 1.1138652691551278, 'sideways_tsl_mult': 0.7817991317980473, 'sideways_time_stop': 171, 'sideways_use_sma': True, 'sideways_use_ema': False, 'sideways_use_atr': False, 'sideways_use_adx': False, 'sideways_use_spike': True, 'sideways_rsi_required': False}.
[I 2025-08-31 00:49:26,119] Trial 398 finished with values: [-1000000000.0, 1000000000.0] and parameters: {'p_sma': 48, 'p_std': 41, 'p_atr': 22, 'p_adx': 8, 'rsi_period': 60, 'ema1': 8, 'ema2': 23, 'slip_atr_k': 0.04647346361700517, 'slip_spread_k': 0.2674976461777367, 'spread_hl_frac': 0.0052628594572012855, 'bb_std_mult': 2.134046920571575, 'rsi_os': 52, 'rsi_ob': 74, 'vol_spike': 0.15370776112027962, 'adx_thresh': 12.961810389035385, 'atr_min_pct': 0.02099293386504339, 'atr_max_pct': 0.06432298448936917, 'tp_mult': 1.96244248754346, 'tsl_mult': 0.8007697060743348, 'strategy': 'breakout', 'time_stop': 238, 'use_sma': True, 'use_atr': False, 'use_adx': False, 'use_ema': True, 'use_spike': False, 'rsi_required': False, 'edge_k': 0.6487944147288884, 'edge_cap': 0.798516858076901, 'bull_strategy': 'breakout', 'bull_bb_std_mult': 1.3136805592979661, 'bull_rsi_os': 34, 'bull_rsi_ob': 59, 'bull_adx_thresh': 15.112942334845687, 'bull_atr_min_pct': 0.02356214644394218, 'bull_atr_max_pct': 0.0754569229097155, 'bull_tp_mult': 2.356370840262402, 'bull_tsl_mult': 0.3276322229790252, 'bull_time_stop': 54, 'bull_use_sma': True, 'bull_use_ema': False, 'bull_use_atr': True, 'bull_use_adx': True, 'bull_use_spike': False, 'bull_rsi_required': False, 'bear_strategy': 'mean_reversion', 'bear_bb_std_mult': 1.0576134779033033, 'bear_rsi_os': 8, 'bear_rsi_ob': 64, 'bear_adx_thresh': 7.596759079218246, 'bear_atr_min_pct': 0.010994077663954488, 'bear_atr_max_pct': 0.07542452172978521, 'bear_tp_mult': 1.9387812329949197, 'bear_tsl_mult': 0.692988955390161, 'bear_time_stop': 227, 'bear_use_sma': True, 'bear_use_ema': False, 'bear_use_atr': False, 'bear_use_adx': True, 'bear_use_spike': True, 'bear_rsi_required': False, 'sideways_strategy': 'mean_reversion', 'sideways_bb_std_mult': 1.2400690491780808, 'sideways_rsi_os': 48, 'sideways_rsi_ob': 90, 'sideways_adx_thresh': 12.936996484521613, 'sideways_atr_min_pct': 0.007206912356737966, 'sideways_atr_max_pct': 0.1447543069551015, 'sideways_tp_mult': 1.3446677952581765, 'sideways_tsl_mult': 0.721542411622572, 'sideways_time_stop': 20, 'sideways_use_sma': True, 'sideways_use_ema': False, 'sideways_use_atr': True, 'sideways_use_adx': False, 'sideways_use_spike': True, 'sideways_rsi_required': True}.
[I 2025-08-31 00:49:26,289] Trial 397 finished with values: [-1000000000.0, 1000000000.0] and parameters: {'p_sma': 47, 'p_std': 33, 'p_atr': 22, 'p_adx': 21, 'rsi_period': 45, 'ema1': 30, 'ema2': 16, 'slip_atr_k': 0.029075016818350383, 'slip_spread_k': 0.2879145155569365, 'spread_hl_frac': 0.018694141214768534, 'bb_std_mult': 1.9063932717950445, 'rsi_os': 50, 'rsi_ob': 45, 'vol_spike': 0.17540092869338944, 'adx_thresh': 8.48917412309774, 'atr_min_pct': 0.004974547295459852, 'atr_max_pct': 0.10577857787317946, 'tp_mult': 2.64896998144495, 'tsl_mult': 0.09374604188932217, 'strategy': 'breakout', 'time_stop': 74, 'use_sma': True, 'use_atr': False, 'use_adx': False, 'use_ema': True, 'use_spike': False, 'rsi_required': False, 'edge_k': 0.653337673251481, 'edge_cap': 0.6395235562925515, 'bull_strategy': 'breakout', 'bull_bb_std_mult': 3.5900387861787, 'bull_rsi_os': 24, 'bull_rsi_ob': 73, 'bull_adx_thresh': 13.72501693918599, 'bull_atr_min_pct': 0.0017355841210342376, 'bull_atr_max_pct': 0.07554549595393745, 'bull_tp_mult': 2.6390753661436346, 'bull_tsl_mult': 0.2899241267122321, 'bull_time_stop': 263, 'bull_use_sma': True, 'bull_use_ema': False, 'bull_use_atr': True, 'bull_use_adx': True, 'bull_use_spike': False, 'bull_rsi_required': False, 'bear_strategy': 'mean_reversion', 'bear_bb_std_mult': 3.4555994512056216, 'bear_rsi_os': 23, 'bear_rsi_ob': 77, 'bear_adx_thresh': 7.030932850902128, 'bear_atr_min_pct': 0.008659043493492015, 'bear_atr_max_pct': 0.020352996876089602, 'bear_tp_mult': 2.340544331281063, 'bear_tsl_mult': 0.6809600181548886, 'bear_time_stop': 12, 'bear_use_sma': True, 'bear_use_ema': False, 'bear_use_atr': False, 'bear_use_adx': True, 'bear_use_spike': False, 'bear_rsi_required': False, 'sideways_strategy': 'mean_reversion', 'sideways_bb_std_mult': 1.2254564361223819, 'sideways_rsi_os': 40, 'sideways_rsi_ob': 79, 'sideways_adx_thresh': 12.484621877461791, 'sideways_atr_min_pct': 0.020946405832552015, 'sideways_atr_max_pct': 0.06715890299077007, 'sideways_tp_mult': 1.1258692625536106, 'sideways_tsl_mult': 0.7145972280848994, 'sideways_time_stop': 19, 'sideways_use_sma': True, 'sideways_use_ema': False, 'sideways_use_atr': False, 'sideways_use_adx': False, 'sideways_use_spike': True, 'sideways_rsi_required': False}.
[I 2025-08-31 00:50:05,092] Trial 402 finished with values: [-1000000000.0, 1000000000.0] and parameters: {'p_sma': 23, 'p_std': 39, 'p_atr': 22, 'p_adx': 7, 'rsi_period': 59, 'ema1': 7, 'ema2': 25, 'slip_atr_k': 0.06829950503690943, 'slip_spread_k': 0.49397069514230246, 'spread_hl_frac': 0.008512119416188279, 'bb_std_mult': 2.8923286929093015, 'rsi_os': 54, 'rsi_ob': 71, 'vol_spike': 0.06985371490362878, 'adx_thresh': 12.246792212716842, 'atr_min_pct': 0.01967416658946377, 'atr_max_pct': 0.0708175175268027, 'tp_mult': 2.445458876075272, 'tsl_mult': 0.1535587568599666, 'strategy': 'breakout', 'time_stop': 225, 'use_sma': False, 'use_atr': False, 'use_adx': True, 'use_ema': True, 'use_spike': False, 'rsi_required': False, 'edge_k': 1.588317212349191, 'edge_cap': 0.6144591557809337, 'bull_strategy': 'mean_reversion', 'bull_bb_std_mult': 2.9393002850558774, 'bull_rsi_os': 38, 'bull_rsi_ob': 71, 'bull_adx_thresh': 5.029983129665014, 'bull_atr_min_pct': 0.0004672049022344353, 'bull_atr_max_pct': 0.0786662206791543, 'bull_tp_mult': 2.198770017889839, 'bull_tsl_mult': 0.4012778727889542, 'bull_time_stop': 190, 'bull_use_sma': False, 'bull_use_ema': False, 'bull_use_atr': True, 'bull_use_adx': True, 'bull_use_spike': False, 'bull_rsi_required': False, 'bear_strategy': 'mean_reversion', 'bear_bb_std_mult': 0.9743220591918876, 'bear_rsi_os': 36, 'bear_rsi_ob': 79, 'bear_adx_thresh': 8.458275862966932, 'bear_atr_min_pct': 0.009647182115615254, 'bear_atr_max_pct': 0.048296580914936285, 'bear_tp_mult': 2.267313732945245, 'bear_tsl_mult': 0.7043211868022443, 'bear_time_stop': 25, 'bear_use_sma': True, 'bear_use_ema': False, 'bear_use_atr': False, 'bear_use_adx': False, 'bear_use_spike': True, 'bear_rsi_required': False, 'sideways_strategy': 'mean_reversion', 'sideways_bb_std_mult': 1.1114424896446893, 'sideways_rsi_os': 49, 'sideways_rsi_ob': 74, 'sideways_adx_thresh': 11.84113346972886, 'sideways_atr_min_pct': 0.02236052733736424, 'sideways_atr_max_pct': 0.05128506019215256, 'sideways_tp_mult': 2.1613427882955407, 'sideways_tsl_mult': 0.733593929842123, 'sideways_time_stop': 223, 'sideways_use_sma': True, 'sideways_use_ema': True, 'sideways_use_atr': True, 'sideways_use_adx': False, 'sideways_use_spike': False, 'sideways_rsi_required': True}.
[I 2025-08-31 00:50:05,105] Trial 401 finished with values: [-1000000000.0, 1000000000.0] and parameters: {'p_sma': 51, 'p_std': 56, 'p_atr': 22, 'p_adx': 7, 'rsi_period': 44, 'ema1': 10, 'ema2': 22, 'slip_atr_k': 0.14313867189504867, 'slip_spread_k': 0.2531074833308617, 'spread_hl_frac': 0.008646063420931945, 'bb_std_mult': 2.5467203786893373, 'rsi_os': 54, 'rsi_ob': 71, 'vol_spike': 0.17510183403831733, 'adx_thresh': 9.938922471840264, 'atr_min_pct': 0.024808197167609625, 'atr_max_pct': 0.0333475521605219, 'tp_mult': 1.4492011150311837, 'tsl_mult': 0.413820716736342, 'strategy': 'breakout', 'time_stop': 74, 'use_sma': False, 'use_atr': False, 'use_adx': True, 'use_ema': True, 'use_spike': False, 'rsi_required': False, 'edge_k': 0.770287491465681, 'edge_cap': 0.5688332014227326, 'bull_strategy': 'mean_reversion', 'bull_bb_std_mult': 0.9658492067015421, 'bull_rsi_os': 24, 'bull_rsi_ob': 71, 'bull_adx_thresh': 13.542805110717184, 'bull_atr_min_pct': 0.00042472675573412475, 'bull_atr_max_pct': 0.04889077133908762, 'bull_tp_mult': 2.5239673250521872, 'bull_tsl_mult': 0.4030096538537616, 'bull_time_stop': 175, 'bull_use_sma': False, 'bull_use_ema': False, 'bull_use_atr': True, 'bull_use_adx': True, 'bull_use_spike': False, 'bull_rsi_required': False, 'bear_strategy': 'mean_reversion', 'bear_bb_std_mult': 1.9515853385735369, 'bear_rsi_os': 26, 'bear_rsi_ob': 74, 'bear_adx_thresh': 18.98072021472319, 'bear_atr_min_pct': 0.008492113423756921, 'bear_atr_max_pct': 0.14993009031716387, 'bear_tp_mult': 2.265396285180945, 'bear_tsl_mult': 0.6981328279303114, 'bear_time_stop': 80, 'bear_use_sma': True, 'bear_use_ema': False, 'bear_use_atr': False, 'bear_use_adx': True, 'bear_use_spike': False, 'bear_rsi_required': False, 'sideways_strategy': 'mean_reversion', 'sideways_bb_std_mult': 1.1456521612861514, 'sideways_rsi_os': 41, 'sideways_rsi_ob': 59, 'sideways_adx_thresh': 11.956368854223221, 'sideways_atr_min_pct': 0.029463383371798425, 'sideways_atr_max_pct': 0.03113459547792949, 'sideways_tp_mult': 2.806172274673112, 'sideways_tsl_mult': 0.7318240757518801, 'sideways_time_stop': 228, 'sideways_use_sma': True, 'sideways_use_ema': True, 'sideways_use_atr': True, 'sideways_use_adx': False, 'sideways_use_spike': False, 'sideways_rsi_required': True}.
[I 2025-08-31 00:50:05,334] Trial 399 finished with values: [-0.023236960355115688, 0.023160302625003393] and parameters: {'p_sma': 47, 'p_std': 28, 'p_atr': 22, 'p_adx': 8, 'rsi_period': 45, 'ema1': 8, 'ema2': 25, 'slip_atr_k': 0.1653474053115942, 'slip_spread_k': 0.25019089064123584, 'spread_hl_frac': 0.008644617557734297, 'bb_std_mult': 2.5395851965325957, 'rsi_os': 54, 'rsi_ob': 78, 'vol_spike': 0.15415530926415694, 'adx_thresh': 8.371544034107188, 'atr_min_pct': 0.0208817671634008, 'atr_max_pct': 0.07109715647692108, 'tp_mult': 1.7564855012131961, 'tsl_mult': 0.392406848170927, 'strategy': 'breakout', 'time_stop': 167, 'use_sma': True, 'use_atr': False, 'use_adx': False, 'use_ema': True, 'use_spike': False, 'rsi_required': False, 'edge_k': 0.6441523010905202, 'edge_cap': 0.797916429397211, 'bull_strategy': 'breakout', 'bull_bb_std_mult': 2.6147479465341203, 'bull_rsi_os': 12, 'bull_rsi_ob': 57, 'bull_adx_thresh': 12.576123890284105, 'bull_atr_min_pct': 0.0005364051468116136, 'bull_atr_max_pct': 0.082939671618569, 'bull_tp_mult': 2.540837049313186, 'bull_tsl_mult': 0.3263317554377681, 'bull_time_stop': 176, 'bull_use_sma': False, 'bull_use_ema': False, 'bull_use_atr': True, 'bull_use_adx': False, 'bull_use_spike': True, 'bull_rsi_required': False, 'bear_strategy': 'mean_reversion', 'bear_bb_std_mult': 1.9448153273800761, 'bear_rsi_os': 17, 'bear_rsi_ob': 77, 'bear_adx_thresh': 6.734999354378175, 'bear_atr_min_pct': 0.014198149490382995, 'bear_atr_max_pct': 0.04659848268626596, 'bear_tp_mult': 1.9514094234917971, 'bear_tsl_mult': 0.6945756444542068, 'bear_time_stop': 210, 'bear_use_sma': True, 'bear_use_ema': False, 'bear_use_atr': False, 'bear_use_adx': True, 'bear_use_spike': True, 'bear_rsi_required': False, 'sideways_strategy': 'mean_reversion', 'sideways_bb_std_mult': 1.10845439127615, 'sideways_rsi_os': 46, 'sideways_rsi_ob': 90, 'sideways_adx_thresh': 12.722818645887177, 'sideways_atr_min_pct': 0.01329663817371027, 'sideways_atr_max_pct': 0.14420878552644, 'sideways_tp_mult': 1.1136180275995862, 'sideways_tsl_mult': 0.7044391822718027, 'sideways_time_stop': 210, 'sideways_use_sma': True, 'sideways_use_ema': False, 'sideways_use_atr': True, 'sideways_use_adx': False, 'sideways_use_spike': True, 'sideways_rsi_required': True}.
[I 2025-08-31 00:50:05,827] Trial 400 finished with values: [-0.025430033287542786, 0.02533583713147295] and parameters: {'p_sma': 48, 'p_std': 30, 'p_atr': 22, 'p_adx': 7, 'rsi_period': 54, 'ema1': 8, 'ema2': 23, 'slip_atr_k': 0.03129687731465724, 'slip_spread_k': 0.7346116286165842, 'spread_hl_frac': 0.036727962519264, 'bb_std_mult': 2.6695008520312147, 'rsi_os': 54, 'rsi_ob': 74, 'vol_spike': 0.17493946838239835, 'adx_thresh': 12.365704334548358, 'atr_min_pct': 0.009210815014983591, 'atr_max_pct': 0.07099730569693208, 'tp_mult': 2.4376785582216582, 'tsl_mult': 0.4121832082108503, 'strategy': 'breakout', 'time_stop': 83, 'use_sma': False, 'use_atr': False, 'use_adx': True, 'use_ema': True, 'use_spike': False, 'rsi_required': False, 'edge_k': 0.7645169743030897, 'edge_cap': 0.8030330537002573, 'bull_strategy': 'mean_reversion', 'bull_bb_std_mult': 2.6134130942209155, 'bull_rsi_os': 38, 'bull_rsi_ob': 71, 'bull_adx_thresh': 12.560612915731756, 'bull_atr_min_pct': 0.0004992052911960978, 'bull_atr_max_pct': 0.07693948099049971, 'bull_tp_mult': 2.5454132249898422, 'bull_tsl_mult': 0.9985417073763676, 'bull_time_stop': 174, 'bull_use_sma': False, 'bull_use_ema': False, 'bull_use_atr': True, 'bull_use_adx': True, 'bull_use_spike': False, 'bull_rsi_required': False, 'bear_strategy': 'mean_reversion', 'bear_bb_std_mult': 0.9806569985034688, 'bear_rsi_os': 36, 'bear_rsi_ob': 71, 'bear_adx_thresh': 6.858070905256876, 'bear_atr_min_pct': 0.01153919939111973, 'bear_atr_max_pct': 0.11246059555522483, 'bear_tp_mult': 2.669593491948208, 'bear_tsl_mult': 0.6941028139564279, 'bear_time_stop': 80, 'bear_use_sma': True, 'bear_use_ema': False, 'bear_use_atr': False, 'bear_use_adx': True, 'bear_use_spike': True, 'bear_rsi_required': False, 'sideways_strategy': 'mean_reversion', 'sideways_bb_std_mult': 2.0381876085772457, 'sideways_rsi_os': 49, 'sideways_rsi_ob': 59, 'sideways_adx_thresh': 12.768625348929657, 'sideways_atr_min_pct': 0.019532429433205947, 'sideways_atr_max_pct': 0.05305118762358207, 'sideways_tp_mult': 2.173762975997633, 'sideways_tsl_mult': 0.7190636521668707, 'sideways_time_stop': 207, 'sideways_use_sma': True, 'sideways_use_ema': True, 'sideways_use_atr': True, 'sideways_use_adx': False, 'sideways_use_spike': True, 'sideways_rsi_required': True}.
[I 2025-08-31 00:50:06,501] Trial 403 finished with values: [-1000000000.0, 1000000000.0] and parameters: {'p_sma': 49, 'p_std': 40, 'p_atr': 22, 'p_adx': 25, 'rsi_period': 58, 'ema1': 6, 'ema2': 17, 'slip_atr_k': 0.03821304866514072, 'slip_spread_k': 0.3093319943152124, 'spread_hl_frac': 0.022419255486904526, 'bb_std_mult': 1.976185997409008, 'rsi_os': 53, 'rsi_ob': 75, 'vol_spike': 0.2048256765015508, 'adx_thresh': 14.528452325172431, 'atr_min_pct': 0.01320694627614771, 'atr_max_pct': 0.0740817669411644, 'tp_mult': 1.760987104987481, 'tsl_mult': 0.052724573158101584, 'strategy': 'mean_reversion', 'time_stop': 85, 'use_sma': True, 'use_atr': True, 'use_adx': False, 'use_ema': True, 'use_spike': True, 'rsi_required': False, 'edge_k': 0.7251815833951876, 'edge_cap': 0.8076252086333862, 'bull_strategy': 'breakout', 'bull_bb_std_mult': 2.6385228692920575, 'bull_rsi_os': 35, 'bull_rsi_ob': 69, 'bull_adx_thresh': 12.11511226703574, 'bull_atr_min_pct': 0.029013706559210258, 'bull_atr_max_pct': 0.01003015700442228, 'bull_tp_mult': 2.5510751789324315, 'bull_tsl_mult': 0.971907629628687, 'bull_time_stop': 167, 'bull_use_sma': False, 'bull_use_ema': False, 'bull_use_atr': True, 'bull_use_adx': False, 'bull_use_spike': True, 'bull_rsi_required': False, 'bear_strategy': 'mean_reversion', 'bear_bb_std_mult': 2.6408509434943195, 'bear_rsi_os': 25, 'bear_rsi_ob': 95, 'bear_adx_thresh': 6.846360524787487, 'bear_atr_min_pct': 0.01934214707689607, 'bear_atr_max_pct': 0.02947055346731574, 'bear_tp_mult': 2.672144997236935, 'bear_tsl_mult': 0.6621869070740891, 'bear_time_stop': 180, 'bear_use_sma': True, 'bear_use_ema': True, 'bear_use_atr': False, 'bear_use_adx': True, 'bear_use_spike': False, 'bear_rsi_required': False, 'sideways_strategy': 'breakout', 'sideways_bb_std_mult': 1.083303375254207, 'sideways_rsi_os': 47, 'sideways_rsi_ob': 91, 'sideways_adx_thresh': 12.747415999432711, 'sideways_atr_min_pct': 0.01983810774660981, 'sideways_atr_max_pct': 0.028056397972453538, 'sideways_tp_mult': 1.0606314012644877, 'sideways_tsl_mult': 0.7027540970965297, 'sideways_time_stop': 211, 'sideways_use_sma': True, 'sideways_use_ema': False, 'sideways_use_atr': False, 'sideways_use_adx': True, 'sideways_use_spike': True, 'sideways_rsi_required': False}.
[I 2025-08-31 00:50:06,547] Trial 404 finished with values: [-1000000000.0, 1000000000.0] and parameters: {'p_sma': 49, 'p_std': 28, 'p_atr': 22, 'p_adx': 22, 'rsi_period': 54, 'ema1': 6, 'ema2': 34, 'slip_atr_k': 0.04078807617161347, 'slip_spread_k': 0.22675360160312985, 'spread_hl_frac': 0.028132725642277003, 'bb_std_mult': 2.3634142420026447, 'rsi_os': 53, 'rsi_ob': 53, 'vol_spike': 0.2046804162817693, 'adx_thresh': 14.065110921222683, 'atr_min_pct': 0.008784315791161117, 'atr_max_pct': 0.074463132956469, 'tp_mult': 2.597077412239685, 'tsl_mult': 0.0035966918284527916, 'strategy': 'mean_reversion', 'time_stop': 300, 'use_sma': True, 'use_atr': True, 'use_adx': False, 'use_ema': True, 'use_spike': True, 'rsi_required': False, 'edge_k': 1.787269220504438, 'edge_cap': 0.8090773223638139, 'bull_strategy': 'breakout', 'bull_bb_std_mult': 2.804730466433812, 'bull_rsi_os': 35, 'bull_rsi_ob': 77, 'bull_adx_thresh': 11.730713885834282, 'bull_atr_min_pct': 0.0011781748087232832, 'bull_atr_max_pct': 0.07124208444429017, 'bull_tp_mult': 2.550613008103876, 'bull_tsl_mult': 0.3737158472127255, 'bull_time_stop': 100, 'bull_use_sma': False, 'bull_use_ema': False, 'bull_use_atr': True, 'bull_use_adx': False, 'bull_use_spike': True, 'bull_rsi_required': False, 'bear_strategy': 'mean_reversion', 'bear_bb_std_mult': 1.0995541396625175, 'bear_rsi_os': 25, 'bear_rsi_ob': 78, 'bear_adx_thresh': 6.635374890183787, 'bear_atr_min_pct': 0.007827627840773873, 'bear_atr_max_pct': 0.03611595728831468, 'bear_tp_mult': 1.8636421304701254, 'bear_tsl_mult': 0.6666556906749633, 'bear_time_stop': 44, 'bear_use_sma': True, 'bear_use_ema': True, 'bear_use_atr': False, 'bear_use_adx': True, 'bear_use_spike': False, 'bear_rsi_required': False, 'sideways_strategy': 'breakout', 'sideways_bb_std_mult': 2.4510888410606633, 'sideways_rsi_os': 47, 'sideways_rsi_ob': 91, 'sideways_adx_thresh': 12.779066561351819, 'sideways_atr_min_pct': 0.020253125951434855, 'sideways_atr_max_pct': 0.13228671704761158, 'sideways_tp_mult': 1.0685383107257143, 'sideways_tsl_mult': 0.7044564810544386, 'sideways_time_stop': 206, 'sideways_use_sma': True, 'sideways_use_ema': False, 'sideways_use_atr': False, 'sideways_use_adx': True, 'sideways_use_spike': True, 'sideways_rsi_required': False}.
