[I 2025-08-31 00:07:09,533] Trial 45 finished with values: [-1000000000.0, 1000000000.0] and parameters: {'p_sma': 19, 'p_std': 30, 'p_atr': 12, 'p_adx': 20, 'rsi_period': 7, 'ema1': 15, 'ema2': 39, 'slip_atr_k': 0.07570244419495076, 'slip_spread_k': 0.9883996860768953, 'spread_hl_frac': 0.03814534560671585, 'bb_std_mult': 3.25724783504191, 'rsi_os': 24, 'rsi_ob': 47, 'vol_spike': 0.10463677529935698, 'adx_thresh': 15.115215505622526, 'atr_min_pct': 0.010170927433334191, 'atr_max_pct': 0.05607838223229859, 'tp_mult': 1.7956715760793607, 'tsl_mult': 0.32572038452173857, 'strategy': 'mean_reversion', 'time_stop': 169, 'use_sma': True, 'use_atr': True, 'use_adx': False, 'use_ema': False, 'use_spike': False, 'rsi_required': False, 'edge_k': 1.962266960592941, 'edge_cap': 0.4930906494473527, 'bull_strategy': 'breakout', 'bull_bb_std_mult': 2.240746240097165, 'bull_rsi_os': 12, 'bull_rsi_ob': 93, 'bull_adx_thresh': 32.35564945362477, 'bull_atr_min_pct': 0.0013814632425345466, 'bull_atr_max_pct': 0.08212713001977281, 'bull_tp_mult': 1.8490690504977794, 'bull_tsl_mult': 0.9297505839707003, 'bull_time_stop': 105, 'bull_use_sma': True, 'bull_use_ema': False, 'bull_use_atr': False, 'bull_use_adx': False, 'bull_use_spike': False, 'bull_rsi_required': False, 'bear_strategy': 'mean_reversion', 'bear_bb_std_mult': 0.7773481393275024, 'bear_rsi_os': 55, 'bear_rsi_ob': 95, 'bear_adx_thresh': 24.723520300771256, 'bear_atr_min_pct': 0.0027887428125616433, 'bear_atr_max_pct': 0.03914280852995674, 'bear_tp_mult': 2.856659374696271, 'bear_tsl_mult': 0.601370198779734, 'bear_time_stop': 280, 'bear_use_sma': False, 'bear_use_ema': False, 'bear_use_atr': False, 'bear_use_adx': True, 'bear_use_spike': False, 'bear_rsi_required': True, 'sideways_strategy': 'mean_reversion', 'sideways_bb_std_mult': 2.0556636468952205, 'sideways_rsi_os': 27, 'sideways_rsi_ob': 46, 'sideways_adx_thresh': 9.471474212896432, 'sideways_atr_min_pct': 0.008800725452663695, 'sideways_atr_max_pct': 0.12424865127852469, 'sideways_tp_mult': 1.25166212043795, 'sideways_tsl_mult': 0.29904861226120016, 'sideways_time_stop': 244, 'sideways_use_sma': False, 'sideways_use_ema': True, 'sideways_use_atr': True, 'sideways_use_adx': True, 'sideways_use_spike': True, 'sideways_rsi_required': False}.
[I 2025-08-31 00:07:09,538] Trial 46 finished with values: [-1000000000.0, 1000000000.0] and parameters: {'p_sma': 21, 'p_std': 29, 'p_atr': 12, 'p_adx': 20, 'rsi_period': 7, 'ema1': 14, 'ema2': 37, 'slip_atr_k': 0.01961706830944346, 'slip_spread_k': 0.9980626914799016, 'spread_hl_frac': 0.0391068591765177, 'bb_std_mult': 2.4842813100912355, 'rsi_os': 24, 'rsi_ob': 47, 'vol_spike': 0.10367683771269179, 'adx_thresh': 14.583617990273618, 'atr_min_pct': 0.013919623304319916, 'atr_max_pct': 0.12976419153633023, 'tp_mult': 1.7200452134878392, 'tsl_mult': 0.30688419318348936, 'strategy': 'mean_reversion', 'time_stop': 20, 'use_sma': True, 'use_atr': True, 'use_adx': False, 'use_ema': False, 'use_spike': False, 'rsi_required': False, 'edge_k': 1.4220591705839667, 'edge_cap': 0.48134963643651807, 'bull_strategy': 'breakout', 'bull_bb_std_mult': 0.6764582567551783, 'bull_rsi_os': 48, 'bull_rsi_ob': 92, 'bull_adx_thresh': 31.71910305584696, 'bull_atr_min_pct': 0.027632282389442313, 'bull_atr_max_pct': 0.08488397865457, 'bull_tp_mult': 2.5053440440957186, 'bull_tsl_mult': 0.417076720600011, 'bull_time_stop': 58, 'bull_use_sma': True, 'bull_use_ema': False, 'bull_use_atr': False, 'bull_use_adx': False, 'bull_use_spike': False, 'bull_rsi_required': False, 'bear_strategy': 'mean_reversion', 'bear_bb_std_mult': 0.7648995062236721, 'bear_rsi_os': 55, 'bear_rsi_ob': 85, 'bear_adx_thresh': 30.507087172367818, 'bear_atr_min_pct': 0.0025433628028134333, 'bear_atr_max_pct': 0.03772792407087622, 'bear_tp_mult': 2.8939025158549296, 'bear_tsl_mult': 0.6009777182119458, 'bear_time_stop': 286, 'bear_use_sma': False, 'bear_use_ema': False, 'bear_use_atr': False, 'bear_use_adx': True, 'bear_use_spike': False, 'bear_rsi_required': True, 'sideways_strategy': 'mean_reversion', 'sideways_bb_std_mult': 2.0048324073243444, 'sideways_rsi_os': 27, 'sideways_rsi_ob': 45, 'sideways_adx_thresh': 30.42450677008061, 'sideways_atr_min_pct': 0.022013144751776063, 'sideways_atr_max_pct': 0.12063427319949067, 'sideways_tp_mult': 1.7680526557977998, 'sideways_tsl_mult': 0.5877801883100788, 'sideways_time_stop': 254, 'sideways_use_sma': False, 'sideways_use_ema': True, 'sideways_use_atr': True, 'sideways_use_adx': True, 'sideways_use_spike': True, 'sideways_rsi_required': True}.
[I 2025-08-31 00:07:39,048] Trial 47 finished with values: [-0.044067122230959876, 0.04400472012037068] and parameters: {'p_sma': 20, 'p_std': 30, 'p_atr': 25, 'p_adx': 20, 'rsi_period': 13, 'ema1': 11, 'ema2': 38, 'slip_atr_k': 0.07060790232788344, 'slip_spread_k': 0.4635246836948287, 'spread_hl_frac': 0.018664709888810027, 'bb_std_mult': 2.5007671745636775, 'rsi_os': 34, 'rsi_ob': 81, 'vol_spike': 0.10178932774238111, 'adx_thresh': 19.201326534817596, 'atr_min_pct': 0.02969580313908212, 'atr_max_pct': 0.05417629521450277, 'tp_mult': 1.8612880812725545, 'tsl_mult': 0.6550874514067173, 'strategy': 'mean_reversion', 'time_stop': 22, 'use_sma': True, 'use_atr': True, 'use_adx': False, 'use_ema': False, 'use_spike': False, 'rsi_required': False, 'edge_k': 1.4353980636890675, 'edge_cap': 0.48780148771277504, 'bull_strategy': 'breakout', 'bull_bb_std_mult': 2.2212386189654416, 'bull_rsi_os': 42, 'bull_rsi_ob': 92, 'bull_adx_thresh': 23.458942007442364, 'bull_atr_min_pct': 0.001232312818366034, 'bull_atr_max_pct': 0.0752909676665302, 'bull_tp_mult': 1.8466813758096474, 'bull_tsl_mult': 0.3696701511809668, 'bull_time_stop': 104, 'bull_use_sma': True, 'bull_use_ema': False, 'bull_use_atr': False, 'bull_use_adx': False, 'bull_use_spike': False, 'bull_rsi_required': False, 'bear_strategy': 'breakout', 'bear_bb_std_mult': 0.7510603534844795, 'bear_rsi_os': 50, 'bear_rsi_ob': 86, 'bear_adx_thresh': 24.61923363024267, 'bear_atr_min_pct': 0.0021397329862245552, 'bear_atr_max_pct': 0.05661312923271307, 'bear_tp_mult': 2.1152060416618914, 'bear_tsl_mult': 0.6175169224187785, 'bear_time_stop': 100, 'bear_use_sma': False, 'bear_use_ema': False, 'bear_use_atr': False, 'bear_use_adx': True, 'bear_use_spike': False, 'bear_rsi_required': True, 'sideways_strategy': 'mean_reversion', 'sideways_bb_std_mult': 2.0911419091180385, 'sideways_rsi_os': 28, 'sideways_rsi_ob': 59, 'sideways_adx_thresh': 8.544172181567587, 'sideways_atr_min_pct': 0.009036127801722563, 'sideways_atr_max_pct': 0.11783792864720895, 'sideways_tp_mult': 1.1806026155591192, 'sideways_tsl_mult': 0.31601526973677924, 'sideways_time_stop': 234, 'sideways_use_sma': False, 'sideways_use_ema': True, 'sideways_use_atr': True, 'sideways_use_adx': True, 'sideways_use_spike': True, 'sideways_rsi_required': False}.
[I 2025-08-31 00:07:41,226] Trial 48 finished with values: [-1000000000.0, 1000000000.0] and parameters: {'p_sma': 20, 'p_std': 36, 'p_atr': 25, 'p_adx': 24, 'rsi_period': 52, 'ema1': 11, 'ema2': 13, 'slip_atr_k': 0.07646675769010958, 'slip_spread_k': 0.4524441528568288, 'spread_hl_frac': 0.04024769738702088, 'bb_std_mult': 3.295070843380363, 'rsi_os': 34, 'rsi_ob': 82, 'vol_spike': 0.10584738546619418, 'adx_thresh': 20.760178245523633, 'atr_min_pct': 0.010279287868820697, 'atr_max_pct': 0.08531269239111035, 'tp_mult': 2.918411881254483, 'tsl_mult': 0.6470853542788795, 'strategy': 'mean_reversion', 'time_stop': 11, 'use_sma': True, 'use_atr': False, 'use_adx': False, 'use_ema': False, 'use_spike': True, 'rsi_required': False, 'edge_k': 1.4204673614901233, 'edge_cap': 0.9406434340199396, 'bull_strategy': 'breakout', 'bull_bb_std_mult': 3.2773958720814353, 'bull_rsi_os': 10, 'bull_rsi_ob': 92, 'bull_adx_thresh': 24.165454514860887, 'bull_atr_min_pct': 0.014861354307591586, 'bull_atr_max_pct': 0.08027521270507255, 'bull_tp_mult': 1.3087475120398242, 'bull_tsl_mult': 0.9512772295293912, 'bull_time_stop': 64, 'bull_use_sma': True, 'bull_use_ema': False, 'bull_use_atr': False, 'bull_use_adx': False, 'bull_use_spike': False, 'bull_rsi_required': False, 'bear_strategy': 'mean_reversion', 'bear_bb_std_mult': 3.1327206220562918, 'bear_rsi_os': 50, 'bear_rsi_ob': 57, 'bear_adx_thresh': 8.829986060267984, 'bear_atr_min_pct': 0.0024723913276252854, 'bear_atr_max_pct': 0.07784695636270984, 'bear_tp_mult': 2.1551287068434926, 'bear_tsl_mult': 0.613635455192559, 'bear_time_stop': 67, 'bear_use_sma': False, 'bear_use_ema': True, 'bear_use_atr': False, 'bear_use_adx': True, 'bear_use_spike': False, 'bear_rsi_required': True, 'sideways_strategy': 'mean_reversion', 'sideways_bb_std_mult': 1.7245713451813407, 'sideways_rsi_os': 20, 'sideways_rsi_ob': 81, 'sideways_adx_thresh': 24.09223864437296, 'sideways_atr_min_pct': 0.0122012630890506, 'sideways_atr_max_pct': 0.12761993114960873, 'sideways_tp_mult': 1.1942530587601814, 'sideways_tsl_mult': 0.5760467336031931, 'sideways_time_stop': 270, 'sideways_use_sma': False, 'sideways_use_ema': True, 'sideways_use_atr': True, 'sideways_use_adx': True, 'sideways_use_spike': True, 'sideways_rsi_required': True}.
[I 2025-08-31 00:07:41,482] Trial 50 finished with values: [-1000000000.0, 1000000000.0] and parameters: {'p_sma': 9, 'p_std': 36, 'p_atr': 25, 'p_adx': 25, 'rsi_period': 14, 'ema1': 7, 'ema2': 13, 'slip_atr_k': 0.019566796864611512, 'slip_spread_k': 0.2030833536790393, 'spread_hl_frac': 0.01981760003790725, 'bb_std_mult': 0.5008574403956902, 'rsi_os': 34, 'rsi_ob': 58, 'vol_spike': 0.14983999655242325, 'adx_thresh': 33.29982372718881, 'atr_min_pct': 0.029141751396083427, 'atr_max_pct': 0.08860656812674131, 'tp_mult': 2.9331007550540784, 'tsl_mult': 0.8754637874259035, 'strategy': 'mean_reversion', 'time_stop': 115, 'use_sma': True, 'use_atr': False, 'use_adx': True, 'use_ema': False, 'use_spike': True, 'rsi_required': True, 'edge_k': 0.004263197242218575, 'edge_cap': 0.6324041150674103, 'bull_strategy': 'mean_reversion', 'bull_bb_std_mult': 3.3239857159432074, 'bull_rsi_os': 22, 'bull_rsi_ob': 48, 'bull_adx_thresh': 22.329216996142563, 'bull_atr_min_pct': 0.014857305288234122, 'bull_atr_max_pct': 0.02494263448062224, 'bull_tp_mult': 2.089171718266616, 'bull_tsl_mult': 0.6715247711801968, 'bull_time_stop': 135, 'bull_use_sma': True, 'bull_use_ema': False, 'bull_use_atr': True, 'bull_use_adx': False, 'bull_use_spike': False, 'bull_rsi_required': True, 'bear_strategy': 'breakout', 'bear_bb_std_mult': 3.082049107094834, 'bear_rsi_os': 18, 'bear_rsi_ob': 81, 'bear_adx_thresh': 9.124578358964667, 'bear_atr_min_pct': 0.02773853038812176, 'bear_atr_max_pct': 0.07910568187237813, 'bear_tp_mult': 2.1707850293406707, 'bear_tsl_mult': 0.5363228837572855, 'bear_time_stop': 79, 'bear_use_sma': False, 'bear_use_ema': True, 'bear_use_atr': False, 'bear_use_adx': False, 'bear_use_spike': False, 'bear_rsi_required': True, 'sideways_strategy': 'breakout', 'sideways_bb_std_mult': 1.6991280724533444, 'sideways_rsi_os': 20, 'sideways_rsi_ob': 59, 'sideways_adx_thresh': 19.54053824399468, 'sideways_atr_min_pct': 0.011609243705127607, 'sideways_atr_max_pct': 0.1328498140578834, 'sideways_tp_mult': 2.9849985609876386, 'sideways_tsl_mult': 0.687701981252499, 'sideways_time_stop': 179, 'sideways_use_sma': False, 'sideways_use_ema': True, 'sideways_use_atr': True, 'sideways_use_adx': True, 'sideways_use_spike': True, 'sideways_rsi_required': True}.
[I 2025-08-31 00:07:41,804] Trial 49 finished with values: [-1000000000.0, 1000000000.0] and parameters: {'p_sma': 7, 'p_std': 36, 'p_atr': 25, 'p_adx': 24, 'rsi_period': 75, 'ema1': 11, 'ema2': 13, 'slip_atr_k': 0.015276974156441372, 'slip_spread_k': 0.2007345047556272, 'spread_hl_frac': 0.018287753286037003, 'bb_std_mult': 1.7613932042891725, 'rsi_os': 15, 'rsi_ob': 58, 'vol_spike': 0.15027406615477448, 'adx_thresh': 20.76861284822027, 'atr_min_pct': 0.020502781055144737, 'atr_max_pct': 0.08796210388643047, 'tp_mult': 2.9222885831725005, 'tsl_mult': 0.8536946415038097, 'strategy': 'mean_reversion', 'time_stop': 123, 'use_sma': True, 'use_atr': False, 'use_adx': True, 'use_ema': False, 'use_spike': True, 'rsi_required': True, 'edge_k': 0.5149482774540832, 'edge_cap': 0.6653558069957006, 'bull_strategy': 'mean_reversion', 'bull_bb_std_mult': 3.420055045310529, 'bull_rsi_os': 37, 'bull_rsi_ob': 52, 'bull_adx_thresh': 22.784906402907442, 'bull_atr_min_pct': 0.013931638725332568, 'bull_atr_max_pct': 0.02496595388531645, 'bull_tp_mult': 1.3252125599184512, 'bull_tsl_mult': 0.6730411878019452, 'bull_time_stop': 221, 'bull_use_sma': True, 'bull_use_ema': False, 'bull_use_atr': True, 'bull_use_adx': False, 'bull_use_spike': False, 'bull_rsi_required': True, 'bear_strategy': 'breakout', 'bear_bb_std_mult': 3.079807859428657, 'bear_rsi_os': 51, 'bear_rsi_ob': 60, 'bear_adx_thresh': 8.374795038443267, 'bear_atr_min_pct': 0.02706314229810397, 'bear_atr_max_pct': 0.057091235260484714, 'bear_tp_mult': 2.166654567955211, 'bear_tsl_mult': 0.8438646363442832, 'bear_time_stop': 103, 'bear_use_sma': False, 'bear_use_ema': True, 'bear_use_atr': False, 'bear_use_adx': False, 'bear_use_spike': False, 'bear_rsi_required': True, 'sideways_strategy': 'breakout', 'sideways_bb_std_mult': 1.711365623584765, 'sideways_rsi_os': 43, 'sideways_rsi_ob': 80, 'sideways_adx_thresh': 18.831610393440855, 'sideways_atr_min_pct': 0.012301595266875343, 'sideways_atr_max_pct': 0.06459902110950898, 'sideways_tp_mult': 2.469041974486865, 'sideways_tsl_mult': 0.8507566602140892, 'sideways_time_stop': 280, 'sideways_use_sma': False, 'sideways_use_ema': True, 'sideways_use_atr': True, 'sideways_use_adx': True, 'sideways_use_spike': True, 'sideways_rsi_required': True}.
[I 2025-08-31 00:08:13,757] Trial 51 finished with values: [-1000000000.0, 1000000000.0] and parameters: {'p_sma': 45, 'p_std': 37, 'p_atr': 8, 'p_adx': 24, 'rsi_period': 13, 'ema1': 10, 'ema2': 13, 'slip_atr_k': 0.02030065392315774, 'slip_spread_k': 0.4362610476532842, 'spread_hl_frac': 0.003157813315312421, 'bb_std_mult': 2.026588184450387, 'rsi_os': 34, 'rsi_ob': 82, 'vol_spike': 0.15182818665573222, 'adx_thresh': 20.572261814012098, 'atr_min_pct': 0.020259936046058087, 'atr_max_pct': 0.08571506700089823, 'tp_mult': 2.9041727391389105, 'tsl_mult': 0.8893010249191933, 'strategy': 'mean_reversion', 'time_stop': 120, 'use_sma': False, 'use_atr': False, 'use_adx': True, 'use_ema': False, 'use_spike': True, 'rsi_required': True, 'edge_k': 0.5542619521676337, 'edge_cap': 0.6684718719211667, 'bull_strategy': 'mean_reversion', 'bull_bb_std_mult': 3.591540488413989, 'bull_rsi_os': 42, 'bull_rsi_ob': 55, 'bull_adx_thresh': 34.717911107708275, 'bull_atr_min_pct': 0.013753326916083915, 'bull_atr_max_pct': 0.02532716660963976, 'bull_tp_mult': 2.679474695131769, 'bull_tsl_mult': 0.6875935919066349, 'bull_time_stop': 148, 'bull_use_sma': False, 'bull_use_ema': False, 'bull_use_atr': True, 'bull_use_adx': False, 'bull_use_spike': False, 'bull_rsi_required': False, 'bear_strategy': 'mean_reversion', 'bear_bb_std_mult': 2.8873265391593708, 'bear_rsi_os': 50, 'bear_rsi_ob': 57, 'bear_adx_thresh': 33.15051679442066, 'bear_atr_min_pct': 0.02715858013413716, 'bear_atr_max_pct': 0.05559438246452838, 'bear_tp_mult': 1.1985848011991123, 'bear_tsl_mult': 0.647120494794171, 'bear_time_stop': 92, 'bear_use_sma': False, 'bear_use_ema': True, 'bear_use_atr': False, 'bear_use_adx': True, 'bear_use_spike': False, 'bear_rsi_required': False, 'sideways_strategy': 'breakout', 'sideways_bb_std_mult': 1.7620472713749127, 'sideways_rsi_os': 42, 'sideways_rsi_ob': 81, 'sideways_adx_thresh': 24.132781403123445, 'sideways_atr_min_pct': 0.011588905958108369, 'sideways_atr_max_pct': 0.13393214519170954, 'sideways_tp_mult': 2.396965044329448, 'sideways_tsl_mult': 0.8539816455476079, 'sideways_time_stop': 221, 'sideways_use_sma': False, 'sideways_use_ema': True, 'sideways_use_atr': True, 'sideways_use_adx': True, 'sideways_use_spike': False, 'sideways_rsi_required': True}.
[I 2025-08-31 00:08:14,419] Trial 53 finished with values: [-1000000000.0, 1000000000.0] and parameters: {'p_sma': 44, 'p_std': 6, 'p_atr': 21, 'p_adx': 29, 'rsi_period': 31, 'ema1': 29, 'ema2': 26, 'slip_atr_k': 0.20548960168610925, 'slip_spread_k': 0.5801401396285522, 'spread_hl_frac': 0.002315679620121097, 'bb_std_mult': 2.094961436777825, 'rsi_os': 47, 'rsi_ob': 89, 'vol_spike': 0.04951512612147739, 'adx_thresh': 19.252215146373608, 'atr_min_pct': 0.02024268903580009, 'atr_max_pct': 0.03199432708495211, 'tp_mult': 2.012359740104894, 'tsl_mult': 0.7612906396139669, 'strategy': 'breakout', 'time_stop': 147, 'use_sma': False, 'use_atr': False, 'use_adx': True, 'use_ema': False, 'use_spike': False, 'rsi_required': True, 'edge_k': 0.5774134261166181, 'edge_cap': 0.6877085538375896, 'bull_strategy': 'mean_reversion', 'bull_bb_std_mult': 1.0847135804170258, 'bull_rsi_os': 43, 'bull_rsi_ob': 75, 'bull_adx_thresh': 28.120422587909676, 'bull_atr_min_pct': 0.013770073215690792, 'bull_atr_max_pct': 0.11661908559628659, 'bull_tp_mult': 2.6770911254033876, 'bull_tsl_mult': 0.9988429288775744, 'bull_time_stop': 221, 'bull_use_sma': False, 'bull_use_ema': False, 'bull_use_atr': True, 'bull_use_adx': False, 'bull_use_spike': False, 'bull_rsi_required': True, 'bear_strategy': 'mean_reversion', 'bear_bb_std_mult': 2.8796264780115237, 'bear_rsi_os': 42, 'bear_rsi_ob': 53, 'bear_adx_thresh': 33.33251763898597, 'bear_atr_min_pct': 0.024381721834929836, 'bear_atr_max_pct': 0.05592223029620194, 'bear_tp_mult': 2.9925410590139334, 'bear_tsl_mult': 0.4212830001220763, 'bear_time_stop': 121, 'bear_use_sma': True, 'bear_use_ema': False, 'bear_use_atr': True, 'bear_use_adx': False, 'bear_use_spike': True, 'bear_rsi_required': False, 'sideways_strategy': 'breakout', 'sideways_bb_std_mult': 1.4573763054832412, 'sideways_rsi_os': 31, 'sideways_rsi_ob': 76, 'sideways_adx_thresh': 27.667993763733215, 'sideways_atr_min_pct': 0.006579000878116862, 'sideways_atr_max_pct': 0.04916100929218813, 'sideways_tp_mult': 2.4319801305566484, 'sideways_tsl_mult': 0.45907212544405485, 'sideways_time_stop': 16, 'sideways_use_sma': False, 'sideways_use_ema': True, 'sideways_use_atr': True, 'sideways_use_adx': True, 'sideways_use_spike': False, 'sideways_rsi_required': True}.
[I 2025-08-31 00:08:14,437] Trial 52 finished with values: [-1000000000.0, 1000000000.0] and parameters: {'p_sma': 44, 'p_std': 37, 'p_atr': 20, 'p_adx': 29, 'rsi_period': 13, 'ema1': 29, 'ema2': 43, 'slip_atr_k': 0.01634273622335697, 'slip_spread_k': 0.3507287020892501, 'spread_hl_frac': 0.003304973485281222, 'bb_std_mult': 0.6975192345926091, 'rsi_os': 16, 'rsi_ob': 69, 'vol_spike': 0.14353216736707025, 'adx_thresh': 33.573987237025314, 'atr_min_pct': 0.004186918412042573, 'atr_max_pct': 0.10315056480862463, 'tp_mult': 2.6410558502540518, 'tsl_mult': 0.8683588451533308, 'strategy': 'mean_reversion', 'time_stop': 141, 'use_sma': False, 'use_atr': False, 'use_adx': True, 'use_ema': False, 'use_spike': True, 'rsi_required': True, 'edge_k': 0.5699321567979443, 'edge_cap': 0.6795357837730114, 'bull_strategy': 'mean_reversion', 'bull_bb_std_mult': 1.0861966205045144, 'bull_rsi_os': 43, 'bull_rsi_ob': 52, 'bull_adx_thresh': 14.937227330188993, 'bull_atr_min_pct': 0.008370285952591169, 'bull_atr_max_pct': 0.02529012934956654, 'bull_tp_mult': 2.7019070448236304, 'bull_tsl_mult': 0.6537062449993793, 'bull_time_stop': 139, 'bull_use_sma': False, 'bull_use_ema': False, 'bull_use_atr': True, 'bull_use_adx': False, 'bull_use_spike': False, 'bull_rsi_required': True, 'bear_strategy': 'breakout', 'bear_bb_std_mult': 2.9280560216305465, 'bear_rsi_os': 19, 'bear_rsi_ob': 65, 'bear_adx_thresh': 33.17618796366798, 'bear_atr_min_pct': 0.026766899301050508, 'bear_atr_max_pct': 0.05509591583848458, 'bear_tp_mult': 1.1589276552751004, 'bear_tsl_mult': 0.53461103487961, 'bear_time_stop': 98, 'bear_use_sma': True, 'bear_use_ema': True, 'bear_use_atr': True, 'bear_use_adx': False, 'bear_use_spike': False, 'bear_rsi_required': False, 'sideways_strategy': 'breakout', 'sideways_bb_std_mult': 1.466035180437824, 'sideways_rsi_os': 43, 'sideways_rsi_ob': 76, 'sideways_adx_thresh': 18.89941702381404, 'sideways_atr_min_pct': 0.015060853322811558, 'sideways_atr_max_pct': 0.04888563611118203, 'sideways_tp_mult': 2.8755577407634405, 'sideways_tsl_mult': 0.8457899829480752, 'sideways_time_stop': 66, 'sideways_use_sma': False, 'sideways_use_ema': True, 'sideways_use_atr': True, 'sideways_use_adx': True, 'sideways_use_spike': False, 'sideways_rsi_required': True}.
