[I 2025-08-31 00:28:45,341] Trial 224 finished with values: [-1000000000.0, 1000000000.0] and parameters: {'p_sma': 47, 'p_std': 29, 'p_atr': 13, 'p_adx': 7, 'rsi_period': 43, 'ema1': 8, 'ema2': 37, 'slip_atr_k': 0.18397881142663663, 'slip_spread_k': 0.04560352251032246, 'spread_hl_frac': 0.01641234351876332, 'bb_std_mult': 2.6374515476586233, 'rsi_os': 55, 'rsi_ob': 55, 'vol_spike': 0.28412055138397907, 'adx_thresh': 6.218536769014591, 'atr_min_pct': 0.023119779330236075, 'atr_max_pct': 0.10132492549633788, 'tp_mult': 2.5505582163266616, 'tsl_mult': 0.11144940630657446, 'strategy': 'breakout', 'time_stop': 287, 'use_sma': True, 'use_atr': False, 'use_adx': False, 'use_ema': False, 'use_spike': False, 'rsi_required': True, 'edge_k': 0.7923391040030648, 'edge_cap': 0.3448163076480478, 'bull_strategy': 'breakout', 'bull_bb_std_mult': 2.2502547302793765, 'bull_rsi_os': 9, 'bull_rsi_ob': 67, 'bull_adx_thresh': 8.942856032643194, 'bull_atr_min_pct': 0.020193312753778527, 'bull_atr_max_pct': 0.027147431250750143, 'bull_tp_mult': 2.8859076309903573, 'bull_tsl_mult': 0.2571546986947507, 'bull_time_stop': 159, 'bull_use_sma': False, 'bull_use_ema': True, 'bull_use_atr': False, 'bull_use_adx': True, 'bull_use_spike': False, 'bull_rsi_required': False, 'bear_strategy': 'breakout', 'bear_bb_std_mult': 0.505681877445119, 'bear_rsi_os': 34, 'bear_rsi_ob': 76, 'bear_adx_thresh': 20.206171552321205, 'bear_atr_min_pct': 0.02203323562223713, 'bear_atr_max_pct': 0.0704169955689646, 'bear_tp_mult': 1.0352907829625757, 'bear_tsl_mult': 0.12701310980881253, 'bear_time_stop': 54, 'bear_use_sma': False, 'bear_use_ema': False, 'bear_use_atr': True, 'bear_use_adx': True, 'bear_use_spike': False, 'bear_rsi_required': True, 'sideways_strategy': 'mean_reversion', 'sideways_bb_std_mult': 1.9543957537405219, 'sideways_rsi_os': 45, 'sideways_rsi_ob': 69, 'sideways_adx_thresh': 21.768766762436236, 'sideways_atr_min_pct': 0.02250148565714817, 'sideways_atr_max_pct': 0.1370554576363125, 'sideways_tp_mult': 1.1855820717236993, 'sideways_tsl_mult': 0.3963199907089553, 'sideways_time_stop': 177, 'sideways_use_sma': True, 'sideways_use_ema': False, 'sideways_use_atr': False, 'sideways_use_adx': False, 'sideways_use_spike': True, 'sideways_rsi_required': True}.
[I 2025-08-31 00:29:14,788] Trial 227 finished with values: [-1000000000.0, 1000000000.0] and parameters: {'p_sma': 48, 'p_std': 38, 'p_atr': 13, 'p_adx': 7, 'rsi_period': 64, 'ema1': 30, 'ema2': 37, 'slip_atr_k': 0.03468588370304308, 'slip_spread_k': 0.1104577513246981, 'spread_hl_frac': 0.0169369200178907, 'bb_std_mult': 3.493357001251588, 'rsi_os': 55, 'rsi_ob': 73, 'vol_spike': 0.24105124151910698, 'adx_thresh': 16.431988345764022, 'atr_min_pct': 0.020161685391474424, 'atr_max_pct': 0.06801259544151554, 'tp_mult': 2.2932938246664474, 'tsl_mult': 0.06769803696711685, 'strategy': 'breakout', 'time_stop': 287, 'use_sma': True, 'use_atr': False, 'use_adx': False, 'use_ema': True, 'use_spike': False, 'rsi_required': False, 'edge_k': 0.791298451897521, 'edge_cap': 0.13494422929900957, 'bull_strategy': 'breakout', 'bull_bb_std_mult': 2.2446664778281, 'bull_rsi_os': 9, 'bull_rsi_ob': 68, 'bull_adx_thresh': 14.18875663757249, 'bull_atr_min_pct': 0.009499650580204713, 'bull_atr_max_pct': 0.09350767104512042, 'bull_tp_mult': 2.9054736983675906, 'bull_tsl_mult': 0.276575697990578, 'bull_time_stop': 164, 'bull_use_sma': False, 'bull_use_ema': False, 'bull_use_atr': False, 'bull_use_adx': True, 'bull_use_spike': False, 'bull_rsi_required': False, 'bear_strategy': 'breakout', 'bear_bb_std_mult': 0.604858885188806, 'bear_rsi_os': 11, 'bear_rsi_ob': 74, 'bear_adx_thresh': 29.235974824864673, 'bear_atr_min_pct': 0.0023794047377902593, 'bear_atr_max_pct': 0.13939240118341512, 'bear_tp_mult': 1.9465265960012819, 'bear_tsl_mult': 0.6434732391193705, 'bear_time_stop': 44, 'bear_use_sma': False, 'bear_use_ema': False, 'bear_use_atr': False, 'bear_use_adx': True, 'bear_use_spike': False, 'bear_rsi_required': False, 'sideways_strategy': 'mean_reversion', 'sideways_bb_std_mult': 1.2406875429624484, 'sideways_rsi_os': 54, 'sideways_rsi_ob': 92, 'sideways_adx_thresh': 11.983926974241866, 'sideways_atr_min_pct': 0.021102288297743764, 'sideways_atr_max_pct': 0.13556353354256193, 'sideways_tp_mult': 2.5276536091610557, 'sideways_tsl_mult': 0.42523775059366087, 'sideways_time_stop': 114, 'sideways_use_sma': False, 'sideways_use_ema': False, 'sideways_use_atr': False, 'sideways_use_adx': False, 'sideways_use_spike': True, 'sideways_rsi_required': True}.
[I 2025-08-31 00:29:14,976] Trial 226 finished with values: [-1000000000.0, 1000000000.0] and parameters: {'p_sma': 29, 'p_std': 38, 'p_atr': 13, 'p_adx': 7, 'rsi_period': 26, 'ema1': 27, 'ema2': 41, 'slip_atr_k': 0.03409118976348844, 'slip_spread_k': 0.34711926554603423, 'spread_hl_frac': 0.017011901920412263, 'bb_std_mult': 3.4756348820659144, 'rsi_os': 55, 'rsi_ob': 73, 'vol_spike': 0.000736517953333812, 'adx_thresh': 11.670255058018338, 'atr_min_pct': 0.023790350052628716, 'atr_max_pct': 0.0673432544798542, 'tp_mult': 1.767825878070059, 'tsl_mult': 0.0736773703416046, 'strategy': 'breakout', 'time_stop': 212, 'use_sma': True, 'use_atr': False, 'use_adx': True, 'use_ema': True, 'use_spike': False, 'rsi_required': True, 'edge_k': 0.778013061766668, 'edge_cap': 0.3460740548550558, 'bull_strategy': 'breakout', 'bull_bb_std_mult': 2.249322276687428, 'bull_rsi_os': 39, 'bull_rsi_ob': 65, 'bull_adx_thresh': 14.278697771807654, 'bull_atr_min_pct': 0.007447189519194923, 'bull_atr_max_pct': 0.034031962664373146, 'bull_tp_mult': 1.5311687465455441, 'bull_tsl_mult': 0.27758082631735576, 'bull_time_stop': 159, 'bull_use_sma': False, 'bull_use_ema': False, 'bull_use_atr': False, 'bull_use_adx': True, 'bull_use_spike': False, 'bull_rsi_required': False, 'bear_strategy': 'breakout', 'bear_bb_std_mult': 0.594257104735752, 'bear_rsi_os': 12, 'bear_rsi_ob': 77, 'bear_adx_thresh': 30.16948921483676, 'bear_atr_min_pct': 0.011095203002099725, 'bear_atr_max_pct': 0.14000302304631804, 'bear_tp_mult': 1.9528335854930683, 'bear_tsl_mult': 0.20633245963527577, 'bear_time_stop': 44, 'bear_use_sma': False, 'bear_use_ema': False, 'bear_use_atr': False, 'bear_use_adx': True, 'bear_use_spike': False, 'bear_rsi_required': False, 'sideways_strategy': 'mean_reversion', 'sideways_bb_std_mult': 3.1510477078024515, 'sideways_rsi_os': 24, 'sideways_rsi_ob': 69, 'sideways_adx_thresh': 15.982640597513896, 'sideways_atr_min_pct': 0.022549796214124097, 'sideways_atr_max_pct': 0.13619378316700675, 'sideways_tp_mult': 1.1230695269252327, 'sideways_tsl_mult': 0.4203350541317352, 'sideways_time_stop': 209, 'sideways_use_sma': False, 'sideways_use_ema': False, 'sideways_use_atr': False, 'sideways_use_adx': False, 'sideways_use_spike': True, 'sideways_rsi_required': False}.
[I 2025-08-31 00:29:15,274] Trial 229 finished with values: [-1000000000.0, 1000000000.0] and parameters: {'p_sma': 51, 'p_std': 38, 'p_atr': 19, 'p_adx': 14, 'rsi_period': 27, 'ema1': 25, 'ema2': 19, 'slip_atr_k': 0.0344798432246312, 'slip_spread_k': 0.11206108620258512, 'spread_hl_frac': 0.03980505969726911, 'bb_std_mult': 3.481364165777504, 'rsi_os': 35, 'rsi_ob': 93, 'vol_spike': 0.020886912239941127, 'adx_thresh': 27.30759983963764, 'atr_min_pct': 0.004875431765190312, 'atr_max_pct': 0.06725622197684172, 'tp_mult': 1.7962139431046027, 'tsl_mult': 0.07582373608537751, 'strategy': 'breakout', 'time_stop': 39, 'use_sma': True, 'use_atr': False, 'use_adx': False, 'use_ema': True, 'use_spike': False, 'rsi_required': False, 'edge_k': 0.3549420100990577, 'edge_cap': 0.312336824857543, 'bull_strategy': 'breakout', 'bull_bb_std_mult': 2.5950194992050633, 'bull_rsi_os': 40, 'bull_rsi_ob': 68, 'bull_adx_thresh': 34.07767775742669, 'bull_atr_min_pct': 0.001302879399361976, 'bull_atr_max_pct': 0.09238717179234808, 'bull_tp_mult': 2.5208426529994044, 'bull_tsl_mult': 0.2342822856002935, 'bull_time_stop': 285, 'bull_use_sma': True, 'bull_use_ema': False, 'bull_use_atr': False, 'bull_use_adx': True, 'bull_use_spike': False, 'bull_rsi_required': False, 'bear_strategy': 'mean_reversion', 'bear_bb_std_mult': 1.3910932868098238, 'bear_rsi_os': 23, 'bear_rsi_ob': 78, 'bear_adx_thresh': 29.449097984601217, 'bear_atr_min_pct': 0.010861774613302642, 'bear_atr_max_pct': 0.13572057033811358, 'bear_tp_mult': 2.9991963601381295, 'bear_tsl_mult': 0.4679247001948553, 'bear_time_stop': 42, 'bear_use_sma': True, 'bear_use_ema': False, 'bear_use_atr': False, 'bear_use_adx': True, 'bear_use_spike': False, 'bear_rsi_required': False, 'sideways_strategy': 'mean_reversion', 'sideways_bb_std_mult': 1.2409889764051205, 'sideways_rsi_os': 43, 'sideways_rsi_ob': 65, 'sideways_adx_thresh': 15.967824035706762, 'sideways_atr_min_pct': 0.021129232741944646, 'sideways_atr_max_pct': 0.1455176555389594, 'sideways_tp_mult': 1.0393843112201457, 'sideways_tsl_mult': 0.44402896552550974, 'sideways_time_stop': 100, 'sideways_use_sma': False, 'sideways_use_ema': False, 'sideways_use_atr': False, 'sideways_use_adx': False, 'sideways_use_spike': True, 'sideways_rsi_required': False}.
[I 2025-08-31 00:29:15,412] Trial 228 finished with values: [-1000000000.0, 1000000000.0] and parameters: {'p_sma': 48, 'p_std': 38, 'p_atr': 13, 'p_adx': 20, 'rsi_period': 26, 'ema1': 24, 'ema2': 19, 'slip_atr_k': 0.1257507157109334, 'slip_spread_k': 0.3434663642148694, 'spread_hl_frac': 0.042524385824728755, 'bb_std_mult': 3.4939864785397563, 'rsi_os': 35, 'rsi_ob': 50, 'vol_spike': 0.0955583141872916, 'adx_thresh': 11.327145490041996, 'atr_min_pct': 0.001061922768049857, 'atr_max_pct': 0.06796407493222645, 'tp_mult': 1.777413731913256, 'tsl_mult': 0.07018212426820386, 'strategy': 'breakout', 'time_stop': 40, 'use_sma': True, 'use_atr': False, 'use_adx': False, 'use_ema': True, 'use_spike': False, 'rsi_required': False, 'edge_k': 0.7664669741475973, 'edge_cap': 0.9646922097426092, 'bull_strategy': 'breakout', 'bull_bb_std_mult': 0.7763345579317538, 'bull_rsi_os': 40, 'bull_rsi_ob': 68, 'bull_adx_thresh': 9.030368182450667, 'bull_atr_min_pct': 0.0013472102714610088, 'bull_atr_max_pct': 0.09540347100537327, 'bull_tp_mult': 2.9694884770645693, 'bull_tsl_mult': 0.23414328884501406, 'bull_time_stop': 165, 'bull_use_sma': True, 'bull_use_ema': False, 'bull_use_atr': False, 'bull_use_adx': True, 'bull_use_spike': False, 'bull_rsi_required': False, 'bear_strategy': 'breakout', 'bear_bb_std_mult': 0.5141635876813864, 'bear_rsi_os': 8, 'bear_rsi_ob': 74, 'bear_adx_thresh': 29.154981481681574, 'bear_atr_min_pct': 0.009453572418699806, 'bear_atr_max_pct': 0.13852482963081098, 'bear_tp_mult': 1.9487651140548121, 'bear_tsl_mult': 0.4744332403730692, 'bear_time_stop': 44, 'bear_use_sma': False, 'bear_use_ema': False, 'bear_use_atr': False, 'bear_use_adx': True, 'bear_use_spike': False, 'bear_rsi_required': False, 'sideways_strategy': 'mean_reversion', 'sideways_bb_std_mult': 1.2513025343168498, 'sideways_rsi_os': 47, 'sideways_rsi_ob': 64, 'sideways_adx_thresh': 12.04967847422125, 'sideways_atr_min_pct': 0.029172791756477523, 'sideways_atr_max_pct': 0.1459980464320964, 'sideways_tp_mult': 2.5210827401575138, 'sideways_tsl_mult': 0.4323390804677106, 'sideways_time_stop': 101, 'sideways_use_sma': True, 'sideways_use_ema': False, 'sideways_use_atr': False, 'sideways_use_adx': False, 'sideways_use_spike': True, 'sideways_rsi_required': True}.
[I 2025-08-31 00:29:15,909] Trial 231 finished with values: [-1000000000.0, 1000000000.0] and parameters: {'p_sma': 51, 'p_std': 37, 'p_atr': 17, 'p_adx': 8, 'rsi_period': 39, 'ema1': 13, 'ema2': 18, 'slip_atr_k': 0.20272774610412797, 'slip_spread_k': 0.9360634703405881, 'spread_hl_frac': 0.03932700596180761, 'bb_std_mult': 3.415797449495165, 'rsi_os': 54, 'rsi_ob': 94, 'vol_spike': 0.020950221515527598, 'adx_thresh': 12.346374252756473, 'atr_min_pct': 0.0011018642499783396, 'atr_max_pct': 0.0730157002264524, 'tp_mult': 1.4272276260607881, 'tsl_mult': 0.6330510623795506, 'strategy': 'mean_reversion', 'time_stop': 40, 'use_sma': True, 'use_atr': False, 'use_adx': False, 'use_ema': False, 'use_spike': False, 'rsi_required': False, 'edge_k': 0.9184797949037647, 'edge_cap': 0.9291114173595411, 'bull_strategy': 'mean_reversion', 'bull_bb_std_mult': 0.8286283986509642, 'bull_rsi_os': 36, 'bull_rsi_ob': 81, 'bull_adx_thresh': 34.09743529275606, 'bull_atr_min_pct': 0.0015405268197816071, 'bull_atr_max_pct': 0.0978503640871156, 'bull_tp_mult': 2.9672708140467448, 'bull_tsl_mult': 0.2316834748835213, 'bull_time_stop': 236, 'bull_use_sma': True, 'bull_use_ema': True, 'bull_use_atr': True, 'bull_use_adx': True, 'bull_use_spike': False, 'bull_rsi_required': False, 'bear_strategy': 'mean_reversion', 'bear_bb_std_mult': 1.4280719183018724, 'bear_rsi_os': 25, 'bear_rsi_ob': 68, 'bear_adx_thresh': 23.629941017208864, 'bear_atr_min_pct': 0.009498799930464156, 'bear_atr_max_pct': 0.13554789813810322, 'bear_tp_mult': 1.4837008562469838, 'bear_tsl_mult': 0.46591082504969844, 'bear_time_stop': 37, 'bear_use_sma': True, 'bear_use_ema': False, 'bear_use_atr': True, 'bear_use_adx': True, 'bear_use_spike': True, 'bear_rsi_required': False, 'sideways_strategy': 'breakout', 'sideways_bb_std_mult': 1.4108307839709389, 'sideways_rsi_os': 34, 'sideways_rsi_ob': 64, 'sideways_adx_thresh': 12.146110720379523, 'sideways_atr_min_pct': 0.004392318344167255, 'sideways_atr_max_pct': 0.1464182682535212, 'sideways_tp_mult': 1.0460035273740553, 'sideways_tsl_mult': 0.8553296069143257, 'sideways_time_stop': 100, 'sideways_use_sma': True, 'sideways_use_ema': False, 'sideways_use_atr': False, 'sideways_use_adx': False, 'sideways_use_spike': True, 'sideways_rsi_required': False}.
[I 2025-08-31 00:29:15,917] Trial 232 finished with values: [-1000000000.0, 1000000000.0] and parameters: {'p_sma': 49, 'p_std': 37, 'p_atr': 7, 'p_adx': 8, 'rsi_period': 24, 'ema1': 26, 'ema2': 21, 'slip_atr_k': 0.05139590902841755, 'slip_spread_k': 0.4564344234830567, 'spread_hl_frac': 0.010213091037799611, 'bb_std_mult': 2.939659941110205, 'rsi_os': 51, 'rsi_ob': 75, 'vol_spike': 0.009404704166595647, 'adx_thresh': 33.7344746244238, 'atr_min_pct': 0.02641663628922046, 'atr_max_pct': 0.07322442947034155, 'tp_mult': 2.6271451946474236, 'tsl_mult': 0.8779554019683218, 'strategy': 'mean_reversion', 'time_stop': 48, 'use_sma': True, 'use_atr': True, 'use_adx': False, 'use_ema': False, 'use_spike': False, 'rsi_required': True, 'edge_k': 1.1492380716267359, 'edge_cap': 0.9313618012315693, 'bull_strategy': 'mean_reversion', 'bull_bb_std_mult': 0.8861327073627676, 'bull_rsi_os': 36, 'bull_rsi_ob': 86, 'bull_adx_thresh': 23.26458305058078, 'bull_atr_min_pct': 0.024981236422225682, 'bull_atr_max_pct': 0.09664926480998831, 'bull_tp_mult': 2.9652171796476416, 'bull_tsl_mult': 0.4229447424674556, 'bull_time_stop': 138, 'bull_use_sma': True, 'bull_use_ema': True, 'bull_use_atr': True, 'bull_use_adx': True, 'bull_use_spike': False, 'bull_rsi_required': False, 'bear_strategy': 'breakout', 'bear_bb_std_mult': 2.4657377353735135, 'bear_rsi_os': 30, 'bear_rsi_ob': 79, 'bear_adx_thresh': 12.934525183235888, 'bear_atr_min_pct': 0.023959994524533134, 'bear_atr_max_pct': 0.01596955756144397, 'bear_tp_mult': 1.1122806794618132, 'bear_tsl_mult': 0.2347543258691308, 'bear_time_stop': 34, 'bear_use_sma': False, 'bear_use_ema': False, 'bear_use_atr': True, 'bear_use_adx': True, 'bear_use_spike': True, 'bear_rsi_required': False, 'sideways_strategy': 'breakout', 'sideways_bb_std_mult': 1.4257248259373974, 'sideways_rsi_os': 34, 'sideways_rsi_ob': 50, 'sideways_adx_thresh': 18.37472470089596, 'sideways_atr_min_pct': 0.02003037508400198, 'sideways_atr_max_pct': 0.14640697187660126, 'sideways_tp_mult': 1.9838416737137727, 'sideways_tsl_mult': 0.10192191399528278, 'sideways_time_stop': 110, 'sideways_use_sma': True, 'sideways_use_ema': False, 'sideways_use_atr': False, 'sideways_use_adx': False, 'sideways_use_spike': True, 'sideways_rsi_required': False}.
[I 2025-08-31 00:29:42,941] Trial 230 finished with values: [-1000000000.0, 1000000000.0] and parameters: {'p_sma': 51, 'p_std': 37, 'p_atr': 7, 'p_adx': 19, 'rsi_period': 26, 'ema1': 25, 'ema2': 18, 'slip_atr_k': 0.050717328168889866, 'slip_spread_k': 0.967135765966594, 'spread_hl_frac': 0.010321040524313556, 'bb_std_mult': 1.9374867427695575, 'rsi_os': 35, 'rsi_ob': 75, 'vol_spike': 0.011337070061360066, 'adx_thresh': 11.456016870376313, 'atr_min_pct': 0.0009325015921355898, 'atr_max_pct': 0.14132470112450427, 'tp_mult': 2.4072851337662042, 'tsl_mult': 0.9270004093934281, 'strategy': 'mean_reversion', 'time_stop': 157, 'use_sma': True, 'use_atr': False, 'use_adx': False, 'use_ema': True, 'use_spike': False, 'rsi_required': True, 'edge_k': 0.7288621986706083, 'edge_cap': 0.9362985788157472, 'bull_strategy': 'breakout', 'bull_bb_std_mult': 0.7294683423913291, 'bull_rsi_os': 39, 'bull_rsi_ob': 77, 'bull_adx_thresh': 12.881388378588202, 'bull_atr_min_pct': 0.012141007563409629, 'bull_atr_max_pct': 0.09736970454880267, 'bull_tp_mult': 1.8023363401499537, 'bull_tsl_mult': 0.23415930940161137, 'bull_time_stop': 286, 'bull_use_sma': True, 'bull_use_ema': True, 'bull_use_atr': False, 'bull_use_adx': True, 'bull_use_spike': False, 'bull_rsi_required': False, 'bear_strategy': 'mean_reversion', 'bear_bb_std_mult': 0.5645937989727123, 'bear_rsi_os': 8, 'bear_rsi_ob': 79, 'bear_adx_thresh': 31.12428150757225, 'bear_atr_min_pct': 0.024023000204050418, 'bear_atr_max_pct': 0.13569036679269675, 'bear_tp_mult': 2.96814173045267, 'bear_tsl_mult': 0.20955515391491575, 'bear_time_stop': 41, 'bear_use_sma': True, 'bear_use_ema': False, 'bear_use_atr': True, 'bear_use_adx': True, 'bear_use_spike': True, 'bear_rsi_required': False, 'sideways_strategy': 'breakout', 'sideways_bb_std_mult': 1.4119866503445953, 'sideways_rsi_os': 47, 'sideways_rsi_ob': 67, 'sideways_adx_thresh': 12.163143824981226, 'sideways_atr_min_pct': 0.02003239323264729, 'sideways_atr_max_pct': 0.1438139910652573, 'sideways_tp_mult': 1.800087385700301, 'sideways_tsl_mult': 0.9267996544911168, 'sideways_time_stop': 206, 'sideways_use_sma': False, 'sideways_use_ema': False, 'sideways_use_atr': False, 'sideways_use_adx': False, 'sideways_use_spike': True, 'sideways_rsi_required': False}.
[I 2025-08-31 00:29:43,446] Trial 233 finished with values: [-1000000000.0, 1000000000.0] and parameters: {'p_sma': 49, 'p_std': 37, 'p_atr': 17, 'p_adx': 18, 'rsi_period': 39, 'ema1': 15, 'ema2': 21, 'slip_atr_k': 0.04917673383329996, 'slip_spread_k': 0.9650364449708257, 'spread_hl_frac': 0.010516782556575746, 'bb_std_mult': 3.417628603129455, 'rsi_os': 9, 'rsi_ob': 75, 'vol_spike': 0.01126197918843792, 'adx_thresh': 12.363655908072767, 'atr_min_pct': 2.892739280187061e-05, 'atr_max_pct': 0.11088927121103152, 'tp_mult': 2.9550959119779603, 'tsl_mult': 0.8870472525324522, 'strategy': 'mean_reversion', 'time_stop': 155, 'use_sma': True, 'use_atr': True, 'use_adx': False, 'use_ema': False, 'use_spike': False, 'rsi_required': True, 'edge_k': 1.1437076089874951, 'edge_cap': 0.5576186870539679, 'bull_strategy': 'mean_reversion', 'bull_bb_std_mult': 2.4787818228646974, 'bull_rsi_os': 36, 'bull_rsi_ob': 70, 'bull_adx_thresh': 22.92138322564098, 'bull_atr_min_pct': 0.0004884021607227737, 'bull_atr_max_pct': 0.08514136170266977, 'bull_tp_mult': 2.9962063270017048, 'bull_tsl_mult': 0.214166098605784, 'bull_time_stop': 173, 'bull_use_sma': False, 'bull_use_ema': True, 'bull_use_atr': True, 'bull_use_adx': True, 'bull_use_spike': False, 'bull_rsi_required': False, 'bear_strategy': 'mean_reversion', 'bear_bb_std_mult': 2.4778426930843813, 'bear_rsi_os': 25, 'bear_rsi_ob': 68, 'bear_adx_thresh': 25.684544106871243, 'bear_atr_min_pct': 0.024087340237241094, 'bear_atr_max_pct': 0.10423798657972966, 'bear_tp_mult': 1.4550568320226922, 'bear_tsl_mult': 0.22689890991804537, 'bear_time_stop': 38, 'bear_use_sma': True, 'bear_use_ema': False, 'bear_use_atr': True, 'bear_use_adx': True, 'bear_use_spike': True, 'bear_rsi_required': False, 'sideways_strategy': 'breakout', 'sideways_bb_std_mult': 1.078247976046668, 'sideways_rsi_os': 41, 'sideways_rsi_ob': 67, 'sideways_adx_thresh': 13.131751743062118, 'sideways_atr_min_pct': 0.0034621730078488178, 'sideways_atr_max_pct': 0.14421927803388088, 'sideways_tp_mult': 1.3585116744946335, 'sideways_tsl_mult': 0.4814613527054956, 'sideways_time_stop': 109, 'sideways_use_sma': False, 'sideways_use_ema': False, 'sideways_use_atr': True, 'sideways_use_adx': False, 'sideways_use_spike': True, 'sideways_rsi_required': False}.
