[I 2025-08-31 00:24:08,849] Trial 180 finished with values: [-1000000000.0, 1000000000.0] and parameters: {'p_sma': 25, 'p_std': 38, 'p_atr': 14, 'p_adx': 8, 'rsi_period': 37, 'ema1': 27, 'ema2': 23, 'slip_atr_k': 0.0044106784057070594, 'slip_spread_k': 0.2416646787996783, 'spread_hl_frac': 0.010143841529700926, 'bb_std_mult': 3.364998326977337, 'rsi_os': 55, 'rsi_ob': 74, 'vol_spike': 0.0063123370983678845, 'adx_thresh': 11.924845904383163, 'atr_min_pct': 0.0016807645062544732, 'atr_max_pct': 0.13160036142499817, 'tp_mult': 2.8764682848629635, 'tsl_mult': 0.09723633908854115, 'strategy': 'breakout', 'time_stop': 18, 'use_sma': True, 'use_atr': False, 'use_adx': True, 'use_ema': True, 'use_spike': False, 'rsi_required': True, 'edge_k': 1.3972950526008279, 'edge_cap': 0.9634245096080265, 'bull_strategy': 'breakout', 'bull_bb_std_mult': 1.9186505125940483, 'bull_rsi_os': 21, 'bull_rsi_ob': 67, 'bull_adx_thresh': 15.230824910998049, 'bull_atr_min_pct': 3.158836650015161e-05, 'bull_atr_max_pct': 0.08262025817836022, 'bull_tp_mult': 2.3478481334923993, 'bull_tsl_mult': 0.6773442123618397, 'bull_time_stop': 262, 'bull_use_sma': False, 'bull_use_ema': True, 'bull_use_atr': False, 'bull_use_adx': True, 'bull_use_spike': False, 'bull_rsi_required': False, 'bear_strategy': 'breakout', 'bear_bb_std_mult': 0.8236824242187586, 'bear_rsi_os': 20, 'bear_rsi_ob': 64, 'bear_adx_thresh': 31.394207346056334, 'bear_atr_min_pct': 0.009544837909650264, 'bear_atr_max_pct': 0.04039911741431483, 'bear_tp_mult': 2.362913388434938, 'bear_tsl_mult': 0.23374383397445275, 'bear_time_stop': 62, 'bear_use_sma': True, 'bear_use_ema': False, 'bear_use_atr': True, 'bear_use_adx': True, 'bear_use_spike': False, 'bear_rsi_required': False, 'sideways_strategy': 'mean_reversion', 'sideways_bb_std_mult': 2.0022885517139675, 'sideways_rsi_os': 47, 'sideways_rsi_ob': 58, 'sideways_adx_thresh': 27.29504232131584, 'sideways_atr_min_pct': 0.01966679916920598, 'sideways_atr_max_pct': 0.06319184572746725, 'sideways_tp_mult': 1.1112493278995457, 'sideways_tsl_mult': 0.5250673389236835, 'sideways_time_stop': 111, 'sideways_use_sma': False, 'sideways_use_ema': False, 'sideways_use_atr': False, 'sideways_use_adx': False, 'sideways_use_spike': True, 'sideways_rsi_required': True}.
[I 2025-08-31 00:24:38,134] Trial 182 finished with values: [-1000000000.0, 1000000000.0] and parameters: {'p_sma': 39, 'p_std': 54, 'p_atr': 12, 'p_adx': 8, 'rsi_period': 62, 'ema1': 5, 'ema2': 19, 'slip_atr_k': 0.04666239771207618, 'slip_spread_k': 0.24009146528215525, 'spread_hl_frac': 0.008841906477152805, 'bb_std_mult': 3.5515267314957955, 'rsi_os': 53, 'rsi_ob': 72, 'vol_spike': 0.19459927920110026, 'adx_thresh': 31.200416195453762, 'atr_min_pct': 0.010781320254624766, 'atr_max_pct': 0.12268245501799688, 'tp_mult': 2.5271554857560288, 'tsl_mult': 0.8594956197994252, 'strategy': 'breakout', 'time_stop': 42, 'use_sma': True, 'use_atr': False, 'use_adx': True, 'use_ema': True, 'use_spike': False, 'rsi_required': True, 'edge_k': 0.40837261092205046, 'edge_cap': 0.8616170762772883, 'bull_strategy': 'breakout', 'bull_bb_std_mult': 0.9889446279141996, 'bull_rsi_os': 34, 'bull_rsi_ob': 65, 'bull_adx_thresh': 25.47147196549038, 'bull_atr_min_pct': 0.00012719865171619688, 'bull_atr_max_pct': 0.036981024549706865, 'bull_tp_mult': 1.953343823103032, 'bull_tsl_mult': 0.6844102607460554, 'bull_time_stop': 294, 'bull_use_sma': False, 'bull_use_ema': True, 'bull_use_atr': False, 'bull_use_adx': True, 'bull_use_spike': False, 'bull_rsi_required': False, 'bear_strategy': 'breakout', 'bear_bb_std_mult': 2.2398266791822894, 'bear_rsi_os': 33, 'bear_rsi_ob': 76, 'bear_adx_thresh': 31.72640491267673, 'bear_atr_min_pct': 0.008456563615169803, 'bear_atr_max_pct': 0.1085284915841204, 'bear_tp_mult': 2.6030037568929365, 'bear_tsl_mult': 0.1592332023002142, 'bear_time_stop': 50, 'bear_use_sma': False, 'bear_use_ema': False, 'bear_use_atr': True, 'bear_use_adx': True, 'bear_use_spike': False, 'bear_rsi_required': False, 'sideways_strategy': 'mean_reversion', 'sideways_bb_std_mult': 3.519290387768934, 'sideways_rsi_os': 22, 'sideways_rsi_ob': 75, 'sideways_adx_thresh': 21.057321272483275, 'sideways_atr_min_pct': 0.011821899010805097, 'sideways_atr_max_pct': 0.03998867213889253, 'sideways_tp_mult': 1.1011033894058708, 'sideways_tsl_mult': 0.37349503126916606, 'sideways_time_stop': 121, 'sideways_use_sma': False, 'sideways_use_ema': False, 'sideways_use_atr': False, 'sideways_use_adx': False, 'sideways_use_spike': True, 'sideways_rsi_required': False}.
[I 2025-08-31 00:24:38,835] Trial 184 finished with values: [-1000000000.0, 1000000000.0] and parameters: {'p_sma': 40, 'p_std': 33, 'p_atr': 13, 'p_adx': 25, 'rsi_period': 32, 'ema1': 30, 'ema2': 20, 'slip_atr_k': 0.04059895934353219, 'slip_spread_k': 0.3162589776124993, 'spread_hl_frac': 0.012745477370196786, 'bb_std_mult': 1.6109568843369393, 'rsi_os': 36, 'rsi_ob': 52, 'vol_spike': 0.29284854864971965, 'adx_thresh': 11.239050921059958, 'atr_min_pct': 0.011700543079531512, 'atr_max_pct': 0.06538773290361766, 'tp_mult': 2.037130727166788, 'tsl_mult': 0.7141348414128049, 'strategy': 'breakout', 'time_stop': 163, 'use_sma': True, 'use_atr': False, 'use_adx': False, 'use_ema': True, 'use_spike': False, 'rsi_required': True, 'edge_k': 1.9996129062440187, 'edge_cap': 0.8848621225432555, 'bull_strategy': 'breakout', 'bull_bb_std_mult': 1.6050149617623413, 'bull_rsi_os': 34, 'bull_rsi_ob': 68, 'bull_adx_thresh': 17.750798907081766, 'bull_atr_min_pct': 0.02998993252343235, 'bull_atr_max_pct': 0.010479250166948242, 'bull_tp_mult': 2.896123653632865, 'bull_tsl_mult': 0.3032719964152053, 'bull_time_stop': 248, 'bull_use_sma': False, 'bull_use_ema': True, 'bull_use_atr': False, 'bull_use_adx': True, 'bull_use_spike': False, 'bull_rsi_required': False, 'bear_strategy': 'breakout', 'bear_bb_std_mult': 3.0313248882364925, 'bear_rsi_os': 27, 'bear_rsi_ob': 83, 'bear_adx_thresh': 26.24667508046426, 'bear_atr_min_pct': 0.005412226132669387, 'bear_atr_max_pct': 0.0859672526533886, 'bear_tp_mult': 1.8841483435685138, 'bear_tsl_mult': 0.18762078408760868, 'bear_time_stop': 51, 'bear_use_sma': False, 'bear_use_ema': False, 'bear_use_atr': True, 'bear_use_adx': True, 'bear_use_spike': False, 'bear_rsi_required': False, 'sideways_strategy': 'mean_reversion', 'sideways_bb_std_mult': 1.3171388377292945, 'sideways_rsi_os': 39, 'sideways_rsi_ob': 66, 'sideways_adx_thresh': 13.634548010849173, 'sideways_atr_min_pct': 0.028441638991394957, 'sideways_atr_max_pct': 0.022800951295283804, 'sideways_tp_mult': 1.1550989148286823, 'sideways_tsl_mult': 0.7978392072032987, 'sideways_time_stop': 72, 'sideways_use_sma': False, 'sideways_use_ema': False, 'sideways_use_atr': False, 'sideways_use_adx': False, 'sideways_use_spike': True, 'sideways_rsi_required': False}.
[I 2025-08-31 00:24:39,074] Trial 181 finished with values: [-1000000000.0, 1000000000.0] and parameters: {'p_sma': 39, 'p_std': 55, 'p_atr': 11, 'p_adx': 8, 'rsi_period': 32, 'ema1': 27, 'ema2': 19, 'slip_atr_k': 0.00476826996111375, 'slip_spread_k': 0.23436131013378225, 'spread_hl_frac': 0.01257889034463256, 'bb_std_mult': 3.536751535970769, 'rsi_os': 53, 'rsi_ob': 94, 'vol_spike': 0.2918276402555332, 'adx_thresh': 31.08382985865834, 'atr_min_pct': 0.00837073165892854, 'atr_max_pct': 0.12697933568063968, 'tp_mult': 1.4217105387603208, 'tsl_mult': 0.8398682765416103, 'strategy': 'breakout', 'time_stop': 41, 'use_sma': True, 'use_atr': False, 'use_adx': True, 'use_ema': True, 'use_spike': False, 'rsi_required': True, 'edge_k': 1.3768426157986466, 'edge_cap': 0.8664710954669432, 'bull_strategy': 'breakout', 'bull_bb_std_mult': 2.0960298737148464, 'bull_rsi_os': 33, 'bull_rsi_ob': 65, 'bull_adx_thresh': 25.64912173487084, 'bull_atr_min_pct': 2.218898582615866e-05, 'bull_atr_max_pct': 0.036932002930282835, 'bull_tp_mult': 2.2105907919242562, 'bull_tsl_mult': 0.6732685531286804, 'bull_time_stop': 293, 'bull_use_sma': False, 'bull_use_ema': True, 'bull_use_atr': False, 'bull_use_adx': True, 'bull_use_spike': False, 'bull_rsi_required': False, 'bear_strategy': 'breakout', 'bear_bb_std_mult': 0.6486483978809652, 'bear_rsi_os': 41, 'bear_rsi_ob': 76, 'bear_adx_thresh': 26.11393688949001, 'bear_atr_min_pct': 0.008394343345775027, 'bear_atr_max_pct': 0.13530575961237803, 'bear_tp_mult': 2.02212342246232, 'bear_tsl_mult': 0.9301955762893318, 'bear_time_stop': 49, 'bear_use_sma': False, 'bear_use_ema': False, 'bear_use_atr': True, 'bear_use_adx': True, 'bear_use_spike': False, 'bear_rsi_required': False, 'sideways_strategy': 'mean_reversion', 'sideways_bb_std_mult': 1.2947323549958925, 'sideways_rsi_os': 50, 'sideways_rsi_ob': 60, 'sideways_adx_thresh': 13.626125097283733, 'sideways_atr_min_pct': 0.011833425741988217, 'sideways_atr_max_pct': 0.10991870732245933, 'sideways_tp_mult': 2.927140529632179, 'sideways_tsl_mult': 0.38619577983216946, 'sideways_time_stop': 74, 'sideways_use_sma': False, 'sideways_use_ema': False, 'sideways_use_atr': False, 'sideways_use_adx': False, 'sideways_use_spike': True, 'sideways_rsi_required': False}.
[I 2025-08-31 00:24:39,157] Trial 183 finished with values: [-1000000000.0, 1000000000.0] and parameters: {'p_sma': 25, 'p_std': 56, 'p_atr': 12, 'p_adx': 16, 'rsi_period': 31, 'ema1': 5, 'ema2': 34, 'slip_atr_k': 0.0048302476332903604, 'slip_spread_k': 0.3281311908771675, 'spread_hl_frac': 0.008911904686890813, 'bb_std_mult': 3.540544720746102, 'rsi_os': 36, 'rsi_ob': 54, 'vol_spike': 0.2102711211639174, 'adx_thresh': 12.576491955850003, 'atr_min_pct': 0.001920349718272024, 'atr_max_pct': 0.08776163490921694, 'tp_mult': 2.0473204406870726, 'tsl_mult': 0.7250832480631043, 'strategy': 'breakout', 'time_stop': 18, 'use_sma': True, 'use_atr': False, 'use_adx': False, 'use_ema': True, 'use_spike': False, 'rsi_required': True, 'edge_k': 0.9796944641795271, 'edge_cap': 0.35962720672987186, 'bull_strategy': 'breakout', 'bull_bb_std_mult': 1.7496665646766134, 'bull_rsi_os': 10, 'bull_rsi_ob': 65, 'bull_adx_thresh': 15.86692893344194, 'bull_atr_min_pct': 0.0017990342103143286, 'bull_atr_max_pct': 0.10005013489404088, 'bull_tp_mult': 2.897013185916337, 'bull_tsl_mult': 0.938582129236938, 'bull_time_stop': 128, 'bull_use_sma': False, 'bull_use_ema': True, 'bull_use_atr': False, 'bull_use_adx': True, 'bull_use_spike': False, 'bull_rsi_required': False, 'bear_strategy': 'breakout', 'bear_bb_std_mult': 1.8541087157441083, 'bear_rsi_os': 32, 'bear_rsi_ob': 78, 'bear_adx_thresh': 26.318494420548152, 'bear_atr_min_pct': 0.020927787573567985, 'bear_atr_max_pct': 0.041223598164999445, 'bear_tp_mult': 1.884719350601503, 'bear_tsl_mult': 0.17356062062480573, 'bear_time_stop': 49, 'bear_use_sma': True, 'bear_use_ema': False, 'bear_use_atr': True, 'bear_use_adx': True, 'bear_use_spike': False, 'bear_rsi_required': False, 'sideways_strategy': 'mean_reversion', 'sideways_bb_std_mult': 1.286860922271797, 'sideways_rsi_os': 39, 'sideways_rsi_ob': 77, 'sideways_adx_thresh': 18.065558415514385, 'sideways_atr_min_pct': 0.0015759030746344636, 'sideways_atr_max_pct': 0.12340376445302595, 'sideways_tp_mult': 2.1690241725852233, 'sideways_tsl_mult': 0.3721080994427626, 'sideways_time_stop': 246, 'sideways_use_sma': False, 'sideways_use_ema': False, 'sideways_use_atr': False, 'sideways_use_adx': False, 'sideways_use_spike': True, 'sideways_rsi_required': True}.
[I 2025-08-31 00:25:08,417] Trial 185 finished with values: [-1000000000.0, 1000000000.0] and parameters: {'p_sma': 54, 'p_std': 51, 'p_atr': 13, 'p_adx': 25, 'rsi_period': 32, 'ema1': 15, 'ema2': 20, 'slip_atr_k': 0.07202245203562155, 'slip_spread_k': 0.33488751076684575, 'spread_hl_frac': 0.011008975087917504, 'bb_std_mult': 1.775973196876148, 'rsi_os': 41, 'rsi_ob': 52, 'vol_spike': 0.29345465952031885, 'adx_thresh': 24.250895591754674, 'atr_min_pct': 0.020898099416034932, 'atr_max_pct': 0.06105976786493444, 'tp_mult': 1.4948379318812273, 'tsl_mult': 0.8316545970476655, 'strategy': 'breakout', 'time_stop': 53, 'use_sma': True, 'use_atr': False, 'use_adx': False, 'use_ema': False, 'use_spike': False, 'rsi_required': True, 'edge_k': 0.31111977290915316, 'edge_cap': 0.8896359113570199, 'bull_strategy': 'breakout', 'bull_bb_std_mult': 2.3869306368742036, 'bull_rsi_os': 40, 'bull_rsi_ob': 68, 'bull_adx_thresh': 15.690400592876303, 'bull_atr_min_pct': 0.0016341209367370388, 'bull_atr_max_pct': 0.010341777597857524, 'bull_tp_mult': 2.8945348292551913, 'bull_tsl_mult': 0.747022281170264, 'bull_time_stop': 155, 'bull_use_sma': False, 'bull_use_ema': True, 'bull_use_atr': False, 'bull_use_adx': True, 'bull_use_spike': False, 'bull_rsi_required': False, 'bear_strategy': 'breakout', 'bear_bb_std_mult': 0.6412863487897449, 'bear_rsi_os': 49, 'bear_rsi_ob': 78, 'bear_adx_thresh': 27.529395697066157, 'bear_atr_min_pct': 0.021224657229763553, 'bear_atr_max_pct': 0.13422653041257, 'bear_tp_mult': 1.6170756362360121, 'bear_tsl_mult': 0.18447133924593045, 'bear_time_stop': 48, 'bear_use_sma': False, 'bear_use_ema': False, 'bear_use_atr': True, 'bear_use_adx': True, 'bear_use_spike': False, 'bear_rsi_required': True, 'sideways_strategy': 'mean_reversion', 'sideways_bb_std_mult': 1.3044266837059355, 'sideways_rsi_os': 35, 'sideways_rsi_ob': 67, 'sideways_adx_thresh': 24.557810994290875, 'sideways_atr_min_pct': 0.029785081947865732, 'sideways_atr_max_pct': 0.022188812642164615, 'sideways_tp_mult': 2.1672887521623587, 'sideways_tsl_mult': 0.9654330248174798, 'sideways_time_stop': 106, 'sideways_use_sma': False, 'sideways_use_ema': False, 'sideways_use_atr': False, 'sideways_use_adx': False, 'sideways_use_spike': True, 'sideways_rsi_required': True}.
[I 2025-08-31 00:25:09,195] Trial 186 finished with values: [-1000000000.0, 1000000000.0] and parameters: {'p_sma': 8, 'p_std': 56, 'p_atr': 13, 'p_adx': 14, 'rsi_period': 27, 'ema1': 10, 'ema2': 11, 'slip_atr_k': 0.02010859123018041, 'slip_spread_k': 0.9195481113756148, 'spread_hl_frac': 0.01408822996561309, 'bb_std_mult': 1.7645577278972495, 'rsi_os': 54, 'rsi_ob': 75, 'vol_spike': 0.02214890832797039, 'adx_thresh': 12.553929098865536, 'atr_min_pct': 0.0010526549498660336, 'atr_max_pct': 0.10571686017755436, 'tp_mult': 2.9540803483777993, 'tsl_mult': 0.5733626798942095, 'strategy': 'breakout', 'time_stop': 49, 'use_sma': True, 'use_atr': True, 'use_adx': False, 'use_ema': False, 'use_spike': False, 'rsi_required': True, 'edge_k': 0.7731889434284055, 'edge_cap': 0.921096478012415, 'bull_strategy': 'breakout', 'bull_bb_std_mult': 2.3729557120556053, 'bull_rsi_os': 35, 'bull_rsi_ob': 67, 'bull_adx_thresh': 14.782872819461563, 'bull_atr_min_pct': 0.0017069904775806957, 'bull_atr_max_pct': 0.09087093993726224, 'bull_tp_mult': 2.2100988434036584, 'bull_tsl_mult': 0.6042324657636613, 'bull_time_stop': 156, 'bull_use_sma': False, 'bull_use_ema': True, 'bull_use_atr': False, 'bull_use_adx': False, 'bull_use_spike': False, 'bull_rsi_required': False, 'bear_strategy': 'breakout', 'bear_bb_std_mult': 1.8258973801650884, 'bear_rsi_os': 37, 'bear_rsi_ob': 94, 'bear_adx_thresh': 26.77834168444199, 'bear_atr_min_pct': 0.016748161957397333, 'bear_atr_max_pct': 0.13373077293507735, 'bear_tp_mult': 2.024140863479483, 'bear_tsl_mult': 0.422319289808775, 'bear_time_stop': 70, 'bear_use_sma': False, 'bear_use_ema': False, 'bear_use_atr': False, 'bear_use_adx': True, 'bear_use_spike': False, 'bear_rsi_required': True, 'sideways_strategy': 'mean_reversion', 'sideways_bb_std_mult': 1.029267354756981, 'sideways_rsi_os': 51, 'sideways_rsi_ob': 88, 'sideways_adx_thresh': 12.499589391239036, 'sideways_atr_min_pct': 0.0017527134315837769, 'sideways_atr_max_pct': 0.1471269283523913, 'sideways_tp_mult': 2.9307841806997406, 'sideways_tsl_mult': 0.3248348848078803, 'sideways_time_stop': 107, 'sideways_use_sma': False, 'sideways_use_ema': False, 'sideways_use_atr': False, 'sideways_use_adx': False, 'sideways_use_spike': True, 'sideways_rsi_required': True}.
[I 2025-08-31 00:25:09,692] Trial 187 finished with values: [-1000000000.0, 1000000000.0] and parameters: {'p_sma': 31, 'p_std': 51, 'p_atr': 28, 'p_adx': 16, 'rsi_period': 35, 'ema1': 24, 'ema2': 35, 'slip_atr_k': 0.026618042316643505, 'slip_spread_k': 0.1144855451517752, 'spread_hl_frac': 0.010941897376314373, 'bb_std_mult': 2.7071352155834516, 'rsi_os': 42, 'rsi_ob': 75, 'vol_spike': 0.01699907324075237, 'adx_thresh': 19.94789766441691, 'atr_min_pct': 0.0011265698715380561, 'atr_max_pct': 0.1056854435663452, 'tp_mult': 2.68469479324822, 'tsl_mult': 0.5852248266225427, 'strategy': 'breakout', 'time_stop': 52, 'use_sma': False, 'use_atr': True, 'use_adx': False, 'use_ema': False, 'use_spike': True, 'rsi_required': True, 'edge_k': 1.4540698302896535, 'edge_cap': 0.41082944444013464, 'bull_strategy': 'breakout', 'bull_bb_std_mult': 1.7410203492943919, 'bull_rsi_os': 14, 'bull_rsi_ob': 68, 'bull_adx_thresh': 14.691596993628707, 'bull_atr_min_pct': 0.0007626987740597336, 'bull_atr_max_pct': 0.09122101443109938, 'bull_tp_mult': 1.5473019319188634, 'bull_tsl_mult': 0.5603083004710524, 'bull_time_stop': 74, 'bull_use_sma': True, 'bull_use_ema': True, 'bull_use_atr': False, 'bull_use_adx': False, 'bull_use_spike': True, 'bull_rsi_required': True, 'bear_strategy': 'mean_reversion', 'bear_bb_std_mult': 0.5803897841386424, 'bear_rsi_os': 17, 'bear_rsi_ob': 78, 'bear_adx_thresh': 29.034025187041085, 'bear_atr_min_pct': 0.009207975440447982, 'bear_atr_max_pct': 0.1457924292483942, 'bear_tp_mult': 1.628560879173319, 'bear_tsl_mult': 0.4178645643376031, 'bear_time_stop': 70, 'bear_use_sma': False, 'bear_use_ema': True, 'bear_use_atr': False, 'bear_use_adx': True, 'bear_use_spike': False, 'bear_rsi_required': True, 'sideways_strategy': 'mean_reversion', 'sideways_bb_std_mult': 1.0468714192194843, 'sideways_rsi_os': 44, 'sideways_rsi_ob': 88, 'sideways_adx_thresh': 12.10145908025274, 'sideways_atr_min_pct': 0.0015982034048413196, 'sideways_atr_max_pct': 0.08753163130777906, 'sideways_tp_mult': 1.4877926350264614, 'sideways_tsl_mult': 0.7016368180286471, 'sideways_time_stop': 107, 'sideways_use_sma': False, 'sideways_use_ema': True, 'sideways_use_atr': True, 'sideways_use_adx': True, 'sideways_use_spike': True, 'sideways_rsi_required': True}.
[I 2025-08-31 00:25:09,974] Trial 188 finished with values: [-1000000000.0, 1000000000.0] and parameters: {'p_sma': 31, 'p_std': 50, 'p_atr': 28, 'p_adx': 7, 'rsi_period': 35, 'ema1': 24, 'ema2': 22, 'slip_atr_k': 0.083621270056606, 'slip_spread_k': 0.9005233175912324, 'spread_hl_frac': 0.013695712238969895, 'bb_std_mult': 3.419157595299383, 'rsi_os': 42, 'rsi_ob': 75, 'vol_spike': 0.06806588621001805, 'adx_thresh': 32.142501148993105, 'atr_min_pct': 0.001014788301271796, 'atr_max_pct': 0.10488896056821877, 'tp_mult': 1.5262532675832847, 'tsl_mult': 0.6823311707638805, 'strategy': 'breakout', 'time_stop': 54, 'use_sma': False, 'use_atr': True, 'use_adx': False, 'use_ema': False, 'use_spike': True, 'rsi_required': True, 'edge_k': 0.2548876414098502, 'edge_cap': 0.4678554824661602, 'bull_strategy': 'mean_reversion', 'bull_bb_std_mult': 2.3338888323594595, 'bull_rsi_os': 35, 'bull_rsi_ob': 68, 'bull_adx_thresh': 7.074826832034951, 'bull_atr_min_pct': 0.0009299230951995823, 'bull_atr_max_pct': 0.09096623177069844, 'bull_tp_mult': 2.9443882372092687, 'bull_tsl_mult': 0.7488242153375667, 'bull_time_stop': 74, 'bull_use_sma': True, 'bull_use_ema': True, 'bull_use_atr': False, 'bull_use_adx': False, 'bull_use_spike': True, 'bull_rsi_required': True, 'bear_strategy': 'mean_reversion', 'bear_bb_std_mult': 0.6074539764850508, 'bear_rsi_os': 49, 'bear_rsi_ob': 95, 'bear_adx_thresh': 27.469278120613996, 'bear_atr_min_pct': 0.016652316079056186, 'bear_atr_max_pct': 0.12000420904267319, 'bear_tp_mult': 1.6340819001424214, 'bear_tsl_mult': 0.7718226262968357, 'bear_time_stop': 70, 'bear_use_sma': False, 'bear_use_ema': True, 'bear_use_atr': False, 'bear_use_adx': True, 'bear_use_spike': True, 'bear_rsi_required': True, 'sideways_strategy': 'breakout', 'sideways_bb_std_mult': 2.5092005004442806, 'sideways_rsi_os': 44, 'sideways_rsi_ob': 91, 'sideways_adx_thresh': 12.291589319593735, 'sideways_atr_min_pct': 0.01044092214909273, 'sideways_atr_max_pct': 0.08693805985460995, 'sideways_tp_mult': 1.0720251167760178, 'sideways_tsl_mult': 0.28167488820498304, 'sideways_time_stop': 14, 'sideways_use_sma': False, 'sideways_use_ema': True, 'sideways_use_atr': True, 'sideways_use_adx': True, 'sideways_use_spike': True, 'sideways_rsi_required': False}.
