[I 2025-08-31 00:20:06,071] Trial 142 finished with values: [-0.025310891043864858, 0.025212167287938153] and parameters: {'p_sma': 49, 'p_std': 39, 'p_atr': 12, 'p_adx': 7, 'rsi_period': 38, 'ema1': 12, 'ema2': 55, 'slip_atr_k': 0.1208472652096046, 'slip_spread_k': 0.7092999209748191, 'spread_hl_frac': 0.04742671430470681, 'bb_std_mult': 3.136937364738967, 'rsi_os': 47, 'rsi_ob': 70, 'vol_spike': 0.02870457803941514, 'adx_thresh': 32.780510526480846, 'atr_min_pct': 0.016662996173748446, 'atr_max_pct': 0.06253838190858044, 'tp_mult': 2.4016778607522675, 'tsl_mult': 0.20472911516036507, 'strategy': 'breakout', 'time_stop': 93, 'use_sma': True, 'use_atr': False, 'use_adx': True, 'use_ema': False, 'use_spike': False, 'rsi_required': True, 'edge_k': 0.6888276918010776, 'edge_cap': 0.9531618033149138, 'bull_strategy': 'mean_reversion', 'bull_bb_std_mult': 2.2291620299004156, 'bull_rsi_os': 35, 'bull_rsi_ob': 72, 'bull_adx_thresh': 14.897591571375665, 'bull_atr_min_pct': 0.0005616608294388128, 'bull_atr_max_pct': 0.1339792652706137, 'bull_tp_mult': 2.7488539782238313, 'bull_tsl_mult': 0.2836218952754381, 'bull_time_stop': 160, 'bull_use_sma': False, 'bull_use_ema': False, 'bull_use_atr': True, 'bull_use_adx': True, 'bull_use_spike': False, 'bull_rsi_required': False, 'bear_strategy': 'breakout', 'bear_bb_std_mult': 2.818853537989259, 'bear_rsi_os': 18, 'bear_rsi_ob': 67, 'bear_adx_thresh': 22.45057610082621, 'bear_atr_min_pct': 0.00874341137322617, 'bear_atr_max_pct': 0.14266894615035702, 'bear_tp_mult': 1.8577913013748268, 'bear_tsl_mult': 0.2037622786913125, 'bear_time_stop': 85, 'bear_use_sma': False, 'bear_use_ema': False, 'bear_use_atr': True, 'bear_use_adx': True, 'bear_use_spike': False, 'bear_rsi_required': False, 'sideways_strategy': 'mean_reversion', 'sideways_bb_std_mult': 1.0329374111187664, 'sideways_rsi_os': 9, 'sideways_rsi_ob': 55, 'sideways_adx_thresh': 6.192542608609491, 'sideways_atr_min_pct': 0.004681440360953885, 'sideways_atr_max_pct': 0.13695738088338133, 'sideways_tp_mult': 1.2956900593706195, 'sideways_tsl_mult': 0.34572614253778416, 'sideways_time_stop': 80, 'sideways_use_sma': False, 'sideways_use_ema': False, 'sideways_use_atr': False, 'sideways_use_adx': False, 'sideways_use_spike': True, 'sideways_rsi_required': False}.
[I 2025-08-31 00:20:34,723] Trial 145 finished with values: [-1000000000.0, 1000000000.0] and parameters: {'p_sma': 5, 'p_std': 39, 'p_atr': 30, 'p_adx': 8, 'rsi_period': 33, 'ema1': 12, 'ema2': 56, 'slip_atr_k': 0.04226170462381825, 'slip_spread_k': 0.6940509877821399, 'spread_hl_frac': 0.024942865603215632, 'bb_std_mult': 0.7460771623445976, 'rsi_os': 54, 'rsi_ob': 56, 'vol_spike': 0.01488887120505878, 'adx_thresh': 5.645195403725827, 'atr_min_pct': 0.01651297028660148, 'atr_max_pct': 0.06035752101839271, 'tp_mult': 1.8211476667437987, 'tsl_mult': 0.1354580371220482, 'strategy': 'breakout', 'time_stop': 110, 'use_sma': True, 'use_atr': False, 'use_adx': False, 'use_ema': False, 'use_spike': False, 'rsi_required': True, 'edge_k': 1.860227593019268, 'edge_cap': 0.8920455249153436, 'bull_strategy': 'mean_reversion', 'bull_bb_std_mult': 2.240240457765022, 'bull_rsi_os': 8, 'bull_rsi_ob': 61, 'bull_adx_thresh': 15.5943300922609, 'bull_atr_min_pct': 0.018457603154928757, 'bull_atr_max_pct': 0.05390660932631193, 'bull_tp_mult': 2.9060905930914567, 'bull_tsl_mult': 0.2141306135140619, 'bull_time_stop': 133, 'bull_use_sma': False, 'bull_use_ema': False, 'bull_use_atr': True, 'bull_use_adx': True, 'bull_use_spike': False, 'bull_rsi_required': True, 'bear_strategy': 'mean_reversion', 'bear_bb_std_mult': 1.9979787407162024, 'bear_rsi_os': 18, 'bear_rsi_ob': 81, 'bear_adx_thresh': 22.376740189283648, 'bear_atr_min_pct': 0.017206723153004585, 'bear_atr_max_pct': 0.04454690673461988, 'bear_tp_mult': 1.8608179444588326, 'bear_tsl_mult': 0.14227391329348277, 'bear_time_stop': 20, 'bear_use_sma': False, 'bear_use_ema': False, 'bear_use_atr': True, 'bear_use_adx': False, 'bear_use_spike': False, 'bear_rsi_required': False, 'sideways_strategy': 'mean_reversion', 'sideways_bb_std_mult': 1.2992991232916955, 'sideways_rsi_os': 46, 'sideways_rsi_ob': 71, 'sideways_adx_thresh': 11.110691377574875, 'sideways_atr_min_pct': 0.021300182300667225, 'sideways_atr_max_pct': 0.10657181809121229, 'sideways_tp_mult': 1.2894477977820538, 'sideways_tsl_mult': 0.5146813226593934, 'sideways_time_stop': 246, 'sideways_use_sma': False, 'sideways_use_ema': False, 'sideways_use_atr': False, 'sideways_use_adx': False, 'sideways_use_spike': False, 'sideways_rsi_required': False}.
[I 2025-08-31 00:20:35,677] Trial 146 finished with values: [-1000000000.0, 1000000000.0] and parameters: {'p_sma': 5, 'p_std': 39, 'p_atr': 30, 'p_adx': 8, 'rsi_period': 32, 'ema1': 12, 'ema2': 44, 'slip_atr_k': 0.07003151973749235, 'slip_spread_k': 0.954170909542139, 'spread_hl_frac': 0.02488687610946699, 'bb_std_mult': 3.4981169448002505, 'rsi_os': 47, 'rsi_ob': 71, 'vol_spike': 0.012946599931734462, 'adx_thresh': 28.724312516733104, 'atr_min_pct': 0.026678011798687402, 'atr_max_pct': 0.06974386927557084, 'tp_mult': 1.8297254135113075, 'tsl_mult': 0.14540746619580927, 'strategy': 'breakout', 'time_stop': 290, 'use_sma': True, 'use_atr': False, 'use_adx': True, 'use_ema': False, 'use_spike': True, 'rsi_required': True, 'edge_k': 1.5006131250158004, 'edge_cap': 0.8806791792164682, 'bull_strategy': 'mean_reversion', 'bull_bb_std_mult': 1.895490505938966, 'bull_rsi_os': 35, 'bull_rsi_ob': 66, 'bull_adx_thresh': 12.13419472416918, 'bull_atr_min_pct': 0.0006345970643121587, 'bull_atr_max_pct': 0.05436159998826716, 'bull_tp_mult': 2.956850165231065, 'bull_tsl_mult': 0.10515741234695877, 'bull_time_stop': 85, 'bull_use_sma': False, 'bull_use_ema': True, 'bull_use_atr': False, 'bull_use_adx': True, 'bull_use_spike': True, 'bull_rsi_required': False, 'bear_strategy': 'breakout', 'bear_bb_std_mult': 0.6796987761317731, 'bear_rsi_os': 12, 'bear_rsi_ob': 61, 'bear_adx_thresh': 32.832712303344245, 'bear_atr_min_pct': 0.010272771195872957, 'bear_atr_max_pct': 0.13418088406421566, 'bear_tp_mult': 1.8512377797249973, 'bear_tsl_mult': 0.1479566184769504, 'bear_time_stop': 290, 'bear_use_sma': False, 'bear_use_ema': True, 'bear_use_atr': True, 'bear_use_adx': True, 'bear_use_spike': False, 'bear_rsi_required': False, 'sideways_strategy': 'mean_reversion', 'sideways_bb_std_mult': 1.0285734416006793, 'sideways_rsi_os': 9, 'sideways_rsi_ob': 56, 'sideways_adx_thresh': 18.809483985689265, 'sideways_atr_min_pct': 0.021059245467134308, 'sideways_atr_max_pct': 0.10543820338039533, 'sideways_tp_mult': 1.2836650067521191, 'sideways_tsl_mult': 0.767385412621088, 'sideways_time_stop': 79, 'sideways_use_sma': False, 'sideways_use_ema': False, 'sideways_use_atr': False, 'sideways_use_adx': False, 'sideways_use_spike': True, 'sideways_rsi_required': False}.
[I 2025-08-31 00:20:36,076] Trial 148 finished with values: [-1000000000.0, 1000000000.0] and parameters: {'p_sma': 26, 'p_std': 37, 'p_atr': 30, 'p_adx': 8, 'rsi_period': 31, 'ema1': 28, 'ema2': 38, 'slip_atr_k': 0.06988601342684408, 'slip_spread_k': 0.16347762121114479, 'spread_hl_frac': 0.025031613012711645, 'bb_std_mult': 3.5134312532248884, 'rsi_os': 20, 'rsi_ob': 66, 'vol_spike': 0.014454548316480435, 'adx_thresh': 12.478464531088633, 'atr_min_pct': 0.0009685474444395772, 'atr_max_pct': 0.07607394461065625, 'tp_mult': 1.9664668038635371, 'tsl_mult': 0.13275150741396186, 'strategy': 'breakout', 'time_stop': 111, 'use_sma': True, 'use_atr': True, 'use_adx': False, 'use_ema': False, 'use_spike': True, 'rsi_required': True, 'edge_k': 0.8894407505979162, 'edge_cap': 0.25638971961745527, 'bull_strategy': 'breakout', 'bull_bb_std_mult': 2.400268942497605, 'bull_rsi_os': 8, 'bull_rsi_ob': 67, 'bull_adx_thresh': 33.36665580884905, 'bull_atr_min_pct': 6.955546539457534e-06, 'bull_atr_max_pct': 0.08994099276611131, 'bull_tp_mult': 2.9058888529288853, 'bull_tsl_mult': 0.6360950393607812, 'bull_time_stop': 175, 'bull_use_sma': False, 'bull_use_ema': True, 'bull_use_atr': False, 'bull_use_adx': False, 'bull_use_spike': True, 'bull_rsi_required': False, 'bear_strategy': 'breakout', 'bear_bb_std_mult': 2.4304017895823504, 'bear_rsi_os': 13, 'bear_rsi_ob': 61, 'bear_adx_thresh': 32.68953855960763, 'bear_atr_min_pct': 0.011384761640721462, 'bear_atr_max_pct': 0.13436347685610478, 'bear_tp_mult': 2.001772320926281, 'bear_tsl_mult': 0.13955225001061866, 'bear_time_stop': 21, 'bear_use_sma': False, 'bear_use_ema': True, 'bear_use_atr': True, 'bear_use_adx': False, 'bear_use_spike': True, 'bear_rsi_required': False, 'sideways_strategy': 'mean_reversion', 'sideways_bb_std_mult': 3.024845051401409, 'sideways_rsi_os': 43, 'sideways_rsi_ob': 52, 'sideways_adx_thresh': 31.64710798561259, 'sideways_atr_min_pct': 0.021394334857269753, 'sideways_atr_max_pct': 0.13101180937442422, 'sideways_tp_mult': 1.4293842338012923, 'sideways_tsl_mult': 0.7731070172380098, 'sideways_time_stop': 25, 'sideways_use_sma': False, 'sideways_use_ema': False, 'sideways_use_atr': False, 'sideways_use_adx': False, 'sideways_use_spike': True, 'sideways_rsi_required': False}.
[I 2025-08-31 00:20:36,173] Trial 147 finished with values: [-1000000000.0, 1000000000.0] and parameters: {'p_sma': 51, 'p_std': 53, 'p_atr': 30, 'p_adx': 8, 'rsi_period': 31, 'ema1': 28, 'ema2': 44, 'slip_atr_k': 0.08714343592190643, 'slip_spread_k': 0.4530688572339613, 'spread_hl_frac': 0.03802029718174839, 'bb_std_mult': 3.5946642580309334, 'rsi_os': 10, 'rsi_ob': 51, 'vol_spike': 0.013850874736870009, 'adx_thresh': 32.82734222616604, 'atr_min_pct': 0.01692827089143846, 'atr_max_pct': 0.06880989027711226, 'tp_mult': 1.377403907691618, 'tsl_mult': 0.5344102592007594, 'strategy': 'breakout', 'time_stop': 33, 'use_sma': True, 'use_atr': False, 'use_adx': False, 'use_ema': False, 'use_spike': True, 'rsi_required': True, 'edge_k': 1.8412637928301787, 'edge_cap': 0.8866427165367263, 'bull_strategy': 'breakout', 'bull_bb_std_mult': 2.4275816097637835, 'bull_rsi_os': 35, 'bull_rsi_ob': 63, 'bull_adx_thresh': 15.30351759613947, 'bull_atr_min_pct': 0.01866414183559862, 'bull_atr_max_pct': 0.08908081869670947, 'bull_tp_mult': 2.9603902890465155, 'bull_tsl_mult': 0.38801485990723283, 'bull_time_stop': 169, 'bull_use_sma': False, 'bull_use_ema': False, 'bull_use_atr': True, 'bull_use_adx': True, 'bull_use_spike': True, 'bull_rsi_required': False, 'bear_strategy': 'breakout', 'bear_bb_std_mult': 0.6815099854050718, 'bear_rsi_os': 18, 'bear_rsi_ob': 81, 'bear_adx_thresh': 32.579850583427245, 'bear_atr_min_pct': 0.0013894457499964014, 'bear_atr_max_pct': 0.018124811798021556, 'bear_tp_mult': 1.92985313712935, 'bear_tsl_mult': 0.9843896027460444, 'bear_time_stop': 115, 'bear_use_sma': False, 'bear_use_ema': True, 'bear_use_atr': True, 'bear_use_adx': True, 'bear_use_spike': True, 'bear_rsi_required': False, 'sideways_strategy': 'mean_reversion', 'sideways_bb_std_mult': 1.0846389021026466, 'sideways_rsi_os': 47, 'sideways_rsi_ob': 52, 'sideways_adx_thresh': 11.89497359240542, 'sideways_atr_min_pct': 0.0068758701541520115, 'sideways_atr_max_pct': 0.10653248093558143, 'sideways_tp_mult': 1.2944596043807268, 'sideways_tsl_mult': 0.873421529930887, 'sideways_time_stop': 214, 'sideways_use_sma': False, 'sideways_use_ema': False, 'sideways_use_atr': False, 'sideways_use_adx': False, 'sideways_use_spike': True, 'sideways_rsi_required': False}.
[I 2025-08-31 00:20:36,562] Trial 152 finished with values: [-1000000000.0, 1000000000.0] and parameters: {'p_sma': 21, 'p_std': 46, 'p_atr': 23, 'p_adx': 19, 'rsi_period': 21, 'ema1': 27, 'ema2': 21, 'slip_atr_k': 0.036283794419409966, 'slip_spread_k': 0.14365270207820208, 'spread_hl_frac': 0.011513559888787082, 'bb_std_mult': 1.3324396091710433, 'rsi_os': 50, 'rsi_ob': 76, 'vol_spike': 0.005028335192628815, 'adx_thresh': 16.125161960976964, 'atr_min_pct': 0.0094797273938779, 'atr_max_pct': 0.0731718096878325, 'tp_mult': 1.9043458679574234, 'tsl_mult': 0.08484515476494472, 'strategy': 'mean_reversion', 'time_stop': 23, 'use_sma': False, 'use_atr': True, 'use_adx': False, 'use_ema': True, 'use_spike': False, 'rsi_required': True, 'edge_k': 1.7109687477190603, 'edge_cap': 0.8033624786992891, 'bull_strategy': 'breakout', 'bull_bb_std_mult': 2.023117360813139, 'bull_rsi_os': 41, 'bull_rsi_ob': 67, 'bull_adx_thresh': 9.984724210457017, 'bull_atr_min_pct': 0.003433918437793842, 'bull_atr_max_pct': 0.07894737703744614, 'bull_tp_mult': 2.9581359084578667, 'bull_tsl_mult': 0.4351421429923541, 'bull_time_stop': 11, 'bull_use_sma': True, 'bull_use_ema': True, 'bull_use_atr': False, 'bull_use_adx': False, 'bull_use_spike': False, 'bull_rsi_required': True, 'bear_strategy': 'breakout', 'bear_bb_std_mult': 2.3480879058588506, 'bear_rsi_os': 33, 'bear_rsi_ob': 76, 'bear_adx_thresh': 27.005293460021747, 'bear_atr_min_pct': 0.026211735463654694, 'bear_atr_max_pct': 0.12743343492142306, 'bear_tp_mult': 2.0782082480108235, 'bear_tsl_mult': 0.2196338826162525, 'bear_time_stop': 275, 'bear_use_sma': True, 'bear_use_ema': False, 'bear_use_atr': False, 'bear_use_adx': True, 'bear_use_spike': False, 'bear_rsi_required': False, 'sideways_strategy': 'breakout', 'sideways_bb_std_mult': 2.8601561616829376, 'sideways_rsi_os': 31, 'sideways_rsi_ob': 68, 'sideways_adx_thresh': 14.502995295765801, 'sideways_atr_min_pct': 0.009702680171390893, 'sideways_atr_max_pct': 0.14605375942401644, 'sideways_tp_mult': 1.7338107781376149, 'sideways_tsl_mult': 0.5585166120987232, 'sideways_time_stop': 87, 'sideways_use_sma': False, 'sideways_use_ema': False, 'sideways_use_atr': False, 'sideways_use_adx': False, 'sideways_use_spike': False, 'sideways_rsi_required': True}.
[I 2025-08-31 00:20:36,866] Trial 153 finished with values: [-1000000000.0, 1000000000.0] and parameters: {'p_sma': 54, 'p_std': 32, 'p_atr': 11, 'p_adx': 10, 'rsi_period': 43, 'ema1': 26, 'ema2': 35, 'slip_atr_k': 0.1833619557003106, 'slip_spread_k': 0.3401207511695611, 'spread_hl_frac': 0.0429546892726753, 'bb_std_mult': 3.3140376723853358, 'rsi_os': 53, 'rsi_ob': 72, 'vol_spike': 0.023691983794190227, 'adx_thresh': 14.834600090994611, 'atr_min_pct': 0.001990465009177816, 'atr_max_pct': 0.05134519213808162, 'tp_mult': 2.5417154190709748, 'tsl_mult': 0.3570981815121557, 'strategy': 'mean_reversion', 'time_stop': 44, 'use_sma': False, 'use_atr': False, 'use_adx': False, 'use_ema': False, 'use_spike': False, 'rsi_required': True, 'edge_k': 0.7562792921794138, 'edge_cap': 0.771997760038246, 'bull_strategy': 'breakout', 'bull_bb_std_mult': 2.347075001295971, 'bull_rsi_os': 26, 'bull_rsi_ob': 70, 'bull_adx_thresh': 11.228922619190318, 'bull_atr_min_pct': 0.01032602505517477, 'bull_atr_max_pct': 0.10034003306375333, 'bull_tp_mult': 2.8258517216856456, 'bull_tsl_mult': 0.013676917604141275, 'bull_time_stop': 141, 'bull_use_sma': True, 'bull_use_ema': True, 'bull_use_atr': False, 'bull_use_adx': True, 'bull_use_spike': False, 'bull_rsi_required': False, 'bear_strategy': 'mean_reversion', 'bear_bb_std_mult': 0.5560488601693548, 'bear_rsi_os': 30, 'bear_rsi_ob': 74, 'bear_adx_thresh': 24.21756159158786, 'bear_atr_min_pct': 0.024594828049003342, 'bear_atr_max_pct': 0.10130192868678708, 'bear_tp_mult': 2.0103267807946787, 'bear_tsl_mult': 0.9620352251792106, 'bear_time_stop': 235, 'bear_use_sma': False, 'bear_use_ema': False, 'bear_use_atr': False, 'bear_use_adx': True, 'bear_use_spike': False, 'bear_rsi_required': False, 'sideways_strategy': 'breakout', 'sideways_bb_std_mult': 3.2416771603522525, 'sideways_rsi_os': 44, 'sideways_rsi_ob': 81, 'sideways_adx_thresh': 13.445218583926973, 'sideways_atr_min_pct': 0.02017906855770098, 'sideways_atr_max_pct': 0.06013333880939814, 'sideways_tp_mult': 2.7759192858901263, 'sideways_tsl_mult': 0.6240321635713872, 'sideways_time_stop': 128, 'sideways_use_sma': False, 'sideways_use_ema': False, 'sideways_use_atr': False, 'sideways_use_adx': False, 'sideways_use_spike': True, 'sideways_rsi_required': False}.
[I 2025-08-31 00:21:05,106] Trial 150 finished with values: [-1000000000.0, 1000000000.0] and parameters: {'p_sma': 7, 'p_std': 37, 'p_atr': 20, 'p_adx': 13, 'rsi_period': 30, 'ema1': 26, 'ema2': 14, 'slip_atr_k': 0.06267640675981168, 'slip_spread_k': 0.1470483053010476, 'spread_hl_frac': 0.04984529540801332, 'bb_std_mult': 3.579111109042042, 'rsi_os': 20, 'rsi_ob': 65, 'vol_spike': 0.0003647543823751334, 'adx_thresh': 12.580929078768735, 'atr_min_pct': 0.0009206504355005277, 'atr_max_pct': 0.050046815105889216, 'tp_mult': 1.063890689856223, 'tsl_mult': 0.3701308061639106, 'strategy': 'mean_reversion', 'time_stop': 34, 'use_sma': False, 'use_atr': True, 'use_adx': False, 'use_ema': True, 'use_spike': True, 'rsi_required': True, 'edge_k': 0.9125684932503663, 'edge_cap': 0.9946147394202077, 'bull_strategy': 'breakout', 'bull_bb_std_mult': 2.6900685934564774, 'bull_rsi_os': 41, 'bull_rsi_ob': 63, 'bull_adx_thresh': 33.08662522104165, 'bull_atr_min_pct': 0.006809476018566173, 'bull_atr_max_pct': 0.07867648416110945, 'bull_tp_mult': 2.4141802946412394, 'bull_tsl_mult': 0.38897386250874244, 'bull_time_stop': 175, 'bull_use_sma': True, 'bull_use_ema': True, 'bull_use_atr': False, 'bull_use_adx': False, 'bull_use_spike': True, 'bull_rsi_required': False, 'bear_strategy': 'breakout', 'bear_bb_std_mult': 2.5423370887607244, 'bear_rsi_os': 10, 'bear_rsi_ob': 76, 'bear_adx_thresh': 23.20309955319363, 'bear_atr_min_pct': 0.01849624280663368, 'bear_atr_max_pct': 0.1280826429711729, 'bear_tp_mult': 2.0145134214591667, 'bear_tsl_mult': 0.22120196393626124, 'bear_time_stop': 175, 'bear_use_sma': True, 'bear_use_ema': True, 'bear_use_atr': False, 'bear_use_adx': True, 'bear_use_spike': True, 'bear_rsi_required': False, 'sideways_strategy': 'breakout', 'sideways_bb_std_mult': 3.584343354487161, 'sideways_rsi_os': 43, 'sideways_rsi_ob': 82, 'sideways_adx_thresh': 13.28825880376848, 'sideways_atr_min_pct': 0.023947870535004447, 'sideways_atr_max_pct': 0.05931916760804232, 'sideways_tp_mult': 2.751702014828373, 'sideways_tsl_mult': 0.5589862470087626, 'sideways_time_stop': 121, 'sideways_use_sma': False, 'sideways_use_ema': False, 'sideways_use_atr': False, 'sideways_use_adx': False, 'sideways_use_spike': True, 'sideways_rsi_required': False}.
[I 2025-08-31 00:21:05,570] Trial 151 finished with values: [-1000000000.0, 1000000000.0] and parameters: {'p_sma': 51, 'p_std': 47, 'p_atr': 23, 'p_adx': 13, 'rsi_period': 43, 'ema1': 26, 'ema2': 28, 'slip_atr_k': 0.06301113976434286, 'slip_spread_k': 0.35506754349437863, 'spread_hl_frac': 0.038801822608038744, 'bb_std_mult': 3.586533079165453, 'rsi_os': 39, 'rsi_ob': 77, 'vol_spike': 0.000915040243891314, 'adx_thresh': 12.167976280465169, 'atr_min_pct': 0.002193370921714764, 'atr_max_pct': 0.06849220590731636, 'tp_mult': 1.3535516639130782, 'tsl_mult': 0.08323071712578642, 'strategy': 'mean_reversion', 'time_stop': 45, 'use_sma': False, 'use_atr': True, 'use_adx': False, 'use_ema': True, 'use_spike': False, 'rsi_required': True, 'edge_k': 0.7706277915091387, 'edge_cap': 0.7661373963088254, 'bull_strategy': 'breakout', 'bull_bb_std_mult': 2.3315517941407298, 'bull_rsi_os': 42, 'bull_rsi_ob': 67, 'bull_adx_thresh': 34.70765762384245, 'bull_atr_min_pct': 0.010788291354206912, 'bull_atr_max_pct': 0.11357144103850601, 'bull_tp_mult': 2.4134802755702784, 'bull_tsl_mult': 0.38279853679221454, 'bull_time_stop': 179, 'bull_use_sma': True, 'bull_use_ema': True, 'bull_use_atr': False, 'bull_use_adx': False, 'bull_use_spike': False, 'bull_rsi_required': False, 'bear_strategy': 'breakout', 'bear_bb_std_mult': 2.338893415976789, 'bear_rsi_os': 35, 'bear_rsi_ob': 75, 'bear_adx_thresh': 8.11123501018629, 'bear_atr_min_pct': 0.0013423183143751617, 'bear_atr_max_pct': 0.10138524481908079, 'bear_tp_mult': 2.0598265368536177, 'bear_tsl_mult': 0.9556221032235139, 'bear_time_stop': 172, 'bear_use_sma': True, 'bear_use_ema': False, 'bear_use_atr': False, 'bear_use_adx': True, 'bear_use_spike': True, 'bear_rsi_required': False, 'sideways_strategy': 'breakout', 'sideways_bb_std_mult': 2.8466612533383886, 'sideways_rsi_os': 47, 'sideways_rsi_ob': 68, 'sideways_adx_thresh': 5.107835202591598, 'sideways_atr_min_pct': 0.023715723021553364, 'sideways_atr_max_pct': 0.11950630040896068, 'sideways_tp_mult': 2.775968491376765, 'sideways_tsl_mult': 0.4313438600299786, 'sideways_time_stop': 88, 'sideways_use_sma': False, 'sideways_use_ema': False, 'sideways_use_atr': False, 'sideways_use_adx': False, 'sideways_use_spike': True, 'sideways_rsi_required': True}.
