[I 2025-08-31 00:31:48,990] Trial 252 finished with values: [-1000000000.0, 1000000000.0] and parameters: {'p_sma': 44, 'p_std': 41, 'p_atr': 25, 'p_adx': 11, 'rsi_period': 61, 'ema1': 5, 'ema2': 17, 'slip_atr_k': 0.030402408048887643, 'slip_spread_k': 0.13413422062591096, 'spread_hl_frac': 0.00873335738942704, 'bb_std_mult': 1.8487561963246315, 'rsi_os': 52, 'rsi_ob': 69, 'vol_spike': 0.1809597273103903, 'adx_thresh': 12.948343168311565, 'atr_min_pct': 0.009582149494446218, 'atr_max_pct': 0.07485370727448441, 'tp_mult': 2.7183573010937847, 'tsl_mult': 0.09602629853814235, 'strategy': 'breakout', 'time_stop': 85, 'use_sma': True, 'use_atr': False, 'use_adx': False, 'use_ema': True, 'use_spike': False, 'rsi_required': False, 'edge_k': 0.6304097026956168, 'edge_cap': 0.8068840623145018, 'bull_strategy': 'mean_reversion', 'bull_bb_std_mult': 3.1395302510147167, 'bull_rsi_os': 39, 'bull_rsi_ob': 71, 'bull_adx_thresh': 26.523170861841407, 'bull_atr_min_pct': 0.002103636615550742, 'bull_atr_max_pct': 0.07589718043455397, 'bull_tp_mult': 2.4800687208029517, 'bull_tsl_mult': 0.4403043240374468, 'bull_time_stop': 177, 'bull_use_sma': False, 'bull_use_ema': False, 'bull_use_atr': True, 'bull_use_adx': True, 'bull_use_spike': False, 'bull_rsi_required': False, 'bear_strategy': 'mean_reversion', 'bear_bb_std_mult': 1.0862476877173184, 'bear_rsi_os': 23, 'bear_rsi_ob': 82, 'bear_adx_thresh': 7.37154811503783, 'bear_atr_min_pct': 0.008056206369832803, 'bear_atr_max_pct': 0.020916319767224256, 'bear_tp_mult': 1.854621949473935, 'bear_tsl_mult': 0.7621885319404283, 'bear_time_stop': 15, 'bear_use_sma': True, 'bear_use_ema': False, 'bear_use_atr': False, 'bear_use_adx': True, 'bear_use_spike': False, 'bear_rsi_required': False, 'sideways_strategy': 'mean_reversion', 'sideways_bb_std_mult': 1.0457036493245955, 'sideways_rsi_os': 48, 'sideways_rsi_ob': 88, 'sideways_adx_thresh': 14.431986411166676, 'sideways_atr_min_pct': 0.022123859766979583, 'sideways_atr_max_pct': 0.04090118943332333, 'sideways_tp_mult': 1.0119341683816507, 'sideways_tsl_mult': 0.708270210278884, 'sideways_time_stop': 175, 'sideways_use_sma': True, 'sideways_use_ema': False, 'sideways_use_atr': False, 'sideways_use_adx': False, 'sideways_use_spike': True, 'sideways_rsi_required': False}.
[I 2025-08-31 00:31:49,454] Trial 255 finished with values: [-1000000000.0, 1000000000.0] and parameters: {'p_sma': 46, 'p_std': 40, 'p_atr': 25, 'p_adx': 12, 'rsi_period': 60, 'ema1': 8, 'ema2': 14, 'slip_atr_k': 0.03462393250266543, 'slip_spread_k': 0.2849432077130495, 'spread_hl_frac': 0.008275104915554344, 'bb_std_mult': 1.9844841595160518, 'rsi_os': 52, 'rsi_ob': 69, 'vol_spike': 0.17976944877165343, 'adx_thresh': 11.88964491727011, 'atr_min_pct': 0.006734834539531017, 'atr_max_pct': 0.07225913840096228, 'tp_mult': 2.679696847079165, 'tsl_mult': 0.09718949833846012, 'strategy': 'mean_reversion', 'time_stop': 84, 'use_sma': True, 'use_atr': False, 'use_adx': False, 'use_ema': True, 'use_spike': True, 'rsi_required': False, 'edge_k': 0.7198824782126796, 'edge_cap': 0.7969014392340281, 'bull_strategy': 'breakout', 'bull_bb_std_mult': 2.886032971083449, 'bull_rsi_os': 39, 'bull_rsi_ob': 70, 'bull_adx_thresh': 12.363236690399143, 'bull_atr_min_pct': 0.00199674567017288, 'bull_atr_max_pct': 0.06745965626649934, 'bull_tp_mult': 2.5544358952443407, 'bull_tsl_mult': 0.40402270669833057, 'bull_time_stop': 181, 'bull_use_sma': False, 'bull_use_ema': False, 'bull_use_atr': True, 'bull_use_adx': True, 'bull_use_spike': False, 'bull_rsi_required': False, 'bear_strategy': 'mean_reversion', 'bear_bb_std_mult': 1.126825584063448, 'bear_rsi_os': 23, 'bear_rsi_ob': 80, 'bear_adx_thresh': 14.312011054291276, 'bear_atr_min_pct': 0.008275788754837842, 'bear_atr_max_pct': 0.016320103048277287, 'bear_tp_mult': 1.911650842281887, 'bear_tsl_mult': 0.6890191997194178, 'bear_time_stop': 30, 'bear_use_sma': True, 'bear_use_ema': True, 'bear_use_atr': False, 'bear_use_adx': True, 'bear_use_spike': True, 'bear_rsi_required': False, 'sideways_strategy': 'mean_reversion', 'sideways_bb_std_mult': 1.0803423349140027, 'sideways_rsi_os': 48, 'sideways_rsi_ob': 95, 'sideways_adx_thresh': 14.085418470831721, 'sideways_atr_min_pct': 0.022248098867696683, 'sideways_atr_max_pct': 0.14407005349854524, 'sideways_tp_mult': 1.0148742467983776, 'sideways_tsl_mult': 0.7559616271910794, 'sideways_time_stop': 179, 'sideways_use_sma': True, 'sideways_use_ema': False, 'sideways_use_atr': True, 'sideways_use_adx': False, 'sideways_use_spike': True, 'sideways_rsi_required': False}.
[I 2025-08-31 00:31:49,507] Trial 256 finished with values: [-1000000000.0, 1000000000.0] and parameters: {'p_sma': 48, 'p_std': 40, 'p_atr': 22, 'p_adx': 15, 'rsi_period': 59, 'ema1': 8, 'ema2': 18, 'slip_atr_k': 0.022600340262596205, 'slip_spread_k': 0.3283043835489848, 'spread_hl_frac': 0.010402702105611342, 'bb_std_mult': 2.0023023026925766, 'rsi_os': 52, 'rsi_ob': 71, 'vol_spike': 0.20444026321757605, 'adx_thresh': 30.55843937402235, 'atr_min_pct': 0.011058204319818903, 'atr_max_pct': 0.07875805190175274, 'tp_mult': 2.7882174015090406, 'tsl_mult': 0.6655189470674919, 'strategy': 'mean_reversion', 'time_stop': 85, 'use_sma': True, 'use_atr': False, 'use_adx': False, 'use_ema': True, 'use_spike': True, 'rsi_required': False, 'edge_k': 0.22428880390379513, 'edge_cap': 0.7874382003894924, 'bull_strategy': 'breakout', 'bull_bb_std_mult': 3.2539498839326466, 'bull_rsi_os': 40, 'bull_rsi_ob': 70, 'bull_adx_thresh': 12.296920353755175, 'bull_atr_min_pct': 0.0014494406979617296, 'bull_atr_max_pct': 0.06772032586128417, 'bull_tp_mult': 2.3802710810890417, 'bull_tsl_mult': 0.3975833776964278, 'bull_time_stop': 175, 'bull_use_sma': False, 'bull_use_ema': False, 'bull_use_atr': True, 'bull_use_adx': True, 'bull_use_spike': False, 'bull_rsi_required': False, 'bear_strategy': 'mean_reversion', 'bear_bb_std_mult': 0.9640945693333179, 'bear_rsi_os': 23, 'bear_rsi_ob': 80, 'bear_adx_thresh': 13.59167507139649, 'bear_atr_min_pct': 0.008451803906480843, 'bear_atr_max_pct': 0.016963039794315977, 'bear_tp_mult': 1.8890184468073665, 'bear_tsl_mult': 0.6855470128326674, 'bear_time_stop': 29, 'bear_use_sma': True, 'bear_use_ema': True, 'bear_use_atr': False, 'bear_use_adx': False, 'bear_use_spike': True, 'bear_rsi_required': True, 'sideways_strategy': 'mean_reversion', 'sideways_bb_std_mult': 1.0326884895820367, 'sideways_rsi_os': 47, 'sideways_rsi_ob': 95, 'sideways_adx_thresh': 12.777873438807053, 'sideways_atr_min_pct': 0.021992215617565713, 'sideways_atr_max_pct': 0.06974647803359382, 'sideways_tp_mult': 1.019848153967116, 'sideways_tsl_mult': 0.7531498586354338, 'sideways_time_stop': 181, 'sideways_use_sma': True, 'sideways_use_ema': False, 'sideways_use_atr': True, 'sideways_use_adx': False, 'sideways_use_spike': False, 'sideways_rsi_required': False}.
[I 2025-08-31 00:32:16,117] Trial 254 finished with values: [-1000000000.0, 1000000000.0] and parameters: {'p_sma': 47, 'p_std': 41, 'p_atr': 25, 'p_adx': 15, 'rsi_period': 58, 'ema1': 9, 'ema2': 18, 'slip_atr_k': 0.026216649351706277, 'slip_spread_k': 0.28923207555430563, 'spread_hl_frac': 0.009983825038096387, 'bb_std_mult': 1.6269371551168297, 'rsi_os': 52, 'rsi_ob': 71, 'vol_spike': 0.18003546377612972, 'adx_thresh': 12.759287624337018, 'atr_min_pct': 0.011243434616100579, 'atr_max_pct': 0.07797575896182536, 'tp_mult': 2.789422584989785, 'tsl_mult': 0.09650403218101491, 'strategy': 'breakout', 'time_stop': 82, 'use_sma': True, 'use_atr': False, 'use_adx': False, 'use_ema': True, 'use_spike': True, 'rsi_required': False, 'edge_k': 0.7028913251328907, 'edge_cap': 0.7924354610186932, 'bull_strategy': 'breakout', 'bull_bb_std_mult': 3.103616253964215, 'bull_rsi_os': 39, 'bull_rsi_ob': 71, 'bull_adx_thresh': 13.292771898108144, 'bull_atr_min_pct': 0.0020083776213630695, 'bull_atr_max_pct': 0.06846746671882864, 'bull_tp_mult': 2.488095126086148, 'bull_tsl_mult': 0.4011579048988978, 'bull_time_stop': 180, 'bull_use_sma': False, 'bull_use_ema': False, 'bull_use_atr': True, 'bull_use_adx': True, 'bull_use_spike': False, 'bull_rsi_required': False, 'bear_strategy': 'mean_reversion', 'bear_bb_std_mult': 0.974624267725884, 'bear_rsi_os': 23, 'bear_rsi_ob': 80, 'bear_adx_thresh': 12.079183825943362, 'bear_atr_min_pct': 0.00606827912831283, 'bear_atr_max_pct': 0.023604590617918336, 'bear_tp_mult': 1.8440507505889454, 'bear_tsl_mult': 0.6901813569236867, 'bear_time_stop': 8, 'bear_use_sma': True, 'bear_use_ema': True, 'bear_use_atr': False, 'bear_use_adx': True, 'bear_use_spike': True, 'bear_rsi_required': False, 'sideways_strategy': 'mean_reversion', 'sideways_bb_std_mult': 1.038596497859722, 'sideways_rsi_os': 48, 'sideways_rsi_ob': 95, 'sideways_adx_thresh': 12.768790068856008, 'sideways_atr_min_pct': 0.014882975102446454, 'sideways_atr_max_pct': 0.05267488299136775, 'sideways_tp_mult': 1.0118486107109774, 'sideways_tsl_mult': 0.7356205951423718, 'sideways_time_stop': 178, 'sideways_use_sma': True, 'sideways_use_ema': False, 'sideways_use_atr': True, 'sideways_use_adx': False, 'sideways_use_spike': True, 'sideways_rsi_required': False}.
[I 2025-08-31 00:32:16,445] Trial 253 finished with values: [-1000000000.0, 1000000000.0] and parameters: {'p_sma': 47, 'p_std': 41, 'p_atr': 23, 'p_adx': 15, 'rsi_period': 59, 'ema1': 9, 'ema2': 18, 'slip_atr_k': 0.03255027695991083, 'slip_spread_k': 0.5999084729138981, 'spread_hl_frac': 0.009813149042003972, 'bb_std_mult': 1.9962360736295535, 'rsi_os': 52, 'rsi_ob': 71, 'vol_spike': 0.1987202841371902, 'adx_thresh': 30.123657854866828, 'atr_min_pct': 0.006835413932547815, 'atr_max_pct': 0.07306112511751517, 'tp_mult': 2.7111020857646966, 'tsl_mult': 0.096585946615425, 'strategy': 'breakout', 'time_stop': 84, 'use_sma': True, 'use_atr': True, 'use_adx': False, 'use_ema': True, 'use_spike': True, 'rsi_required': False, 'edge_k': 0.696157407334187, 'edge_cap': 0.7921216978538477, 'bull_strategy': 'breakout', 'bull_bb_std_mult': 3.1211709788689697, 'bull_rsi_os': 40, 'bull_rsi_ob': 71, 'bull_adx_thresh': 14.440463233137974, 'bull_atr_min_pct': 0.001857705001502536, 'bull_atr_max_pct': 0.0730100765572306, 'bull_tp_mult': 2.491660038700737, 'bull_tsl_mult': 0.3960422612787666, 'bull_time_stop': 179, 'bull_use_sma': True, 'bull_use_ema': False, 'bull_use_atr': True, 'bull_use_adx': True, 'bull_use_spike': False, 'bull_rsi_required': False, 'bear_strategy': 'mean_reversion', 'bear_bb_std_mult': 1.10537346602832, 'bear_rsi_os': 23, 'bear_rsi_ob': 80, 'bear_adx_thresh': 8.907662600350283, 'bear_atr_min_pct': 0.008072888950864079, 'bear_atr_max_pct': 0.019119766484446216, 'bear_tp_mult': 1.8617486377935657, 'bear_tsl_mult': 0.7687852493114874, 'bear_time_stop': 16, 'bear_use_sma': True, 'bear_use_ema': True, 'bear_use_atr': False, 'bear_use_adx': True, 'bear_use_spike': False, 'bear_rsi_required': False, 'sideways_strategy': 'mean_reversion', 'sideways_bb_std_mult': 1.0160151716100083, 'sideways_rsi_os': 47, 'sideways_rsi_ob': 88, 'sideways_adx_thresh': 14.561363484200324, 'sideways_atr_min_pct': 0.00011893437851037865, 'sideways_atr_max_pct': 0.14415029564930404, 'sideways_tp_mult': 1.020305054706107, 'sideways_tsl_mult': 0.7503514490769396, 'sideways_time_stop': 181, 'sideways_use_sma': True, 'sideways_use_ema': False, 'sideways_use_atr': False, 'sideways_use_adx': False, 'sideways_use_spike': True, 'sideways_rsi_required': False}.
[I 2025-08-31 00:32:19,588] Trial 257 finished with values: [-1000000000.0, 1000000000.0] and parameters: {'p_sma': 47, 'p_std': 40, 'p_atr': 21, 'p_adx': 10, 'rsi_period': 65, 'ema1': 9, 'ema2': 18, 'slip_atr_k': 0.023400409926112274, 'slip_spread_k': 0.5059881845168048, 'spread_hl_frac': 0.010159630242672479, 'bb_std_mult': 2.0740676815337946, 'rsi_os': 53, 'rsi_ob': 71, 'vol_spike': 0.16342287415820334, 'adx_thresh': 30.17911432205572, 'atr_min_pct': 0.01081563285877129, 'atr_max_pct': 0.03236784551362013, 'tp_mult': 2.6661632784645946, 'tsl_mult': 0.7909149056079248, 'strategy': 'breakout', 'time_stop': 76, 'use_sma': False, 'use_atr': False, 'use_adx': True, 'use_ema': True, 'use_spike': True, 'rsi_required': False, 'edge_k': 0.7070930163209842, 'edge_cap': 0.8444629958633696, 'bull_strategy': 'breakout', 'bull_bb_std_mult': 2.747860207265748, 'bull_rsi_os': 40, 'bull_rsi_ob': 72, 'bull_adx_thresh': 15.669127151602243, 'bull_atr_min_pct': 0.0018304124317895948, 'bull_atr_max_pct': 0.07195687446202821, 'bull_tp_mult': 2.3789861201714686, 'bull_tsl_mult': 0.3354729187164318, 'bull_time_stop': 167, 'bull_use_sma': False, 'bull_use_ema': False, 'bull_use_atr': True, 'bull_use_adx': True, 'bull_use_spike': True, 'bull_rsi_required': True, 'bear_strategy': 'mean_reversion', 'bear_bb_std_mult': 1.242323546409557, 'bear_rsi_os': 21, 'bear_rsi_ob': 52, 'bear_adx_thresh': 5.045221947230525, 'bear_atr_min_pct': 0.008396639909666681, 'bear_atr_max_pct': 0.02407179015111402, 'bear_tp_mult': 1.7824378240352634, 'bear_tsl_mult': 0.6105816402256736, 'bear_time_stop': 9, 'bear_use_sma': True, 'bear_use_ema': True, 'bear_use_atr': False, 'bear_use_adx': False, 'bear_use_spike': False, 'bear_rsi_required': True, 'sideways_strategy': 'mean_reversion', 'sideways_bb_std_mult': 1.0308052335406073, 'sideways_rsi_os': 47, 'sideways_rsi_ob': 92, 'sideways_adx_thresh': 12.787445653783157, 'sideways_atr_min_pct': 0.021983292498774072, 'sideways_atr_max_pct': 0.051419602117263895, 'sideways_tp_mult': 1.0206961026812083, 'sideways_tsl_mult': 0.7384015889064948, 'sideways_time_stop': 159, 'sideways_use_sma': True, 'sideways_use_ema': True, 'sideways_use_atr': True, 'sideways_use_adx': True, 'sideways_use_spike': False, 'sideways_rsi_required': False}.
[I 2025-08-31 00:32:20,037] Trial 258 finished with values: [-1000000000.0, 1000000000.0] and parameters: {'p_sma': 45, 'p_std': 39, 'p_atr': 21, 'p_adx': 16, 'rsi_period': 54, 'ema1': 9, 'ema2': 18, 'slip_atr_k': 0.21239736553360344, 'slip_spread_k': 0.7917401160283528, 'spread_hl_frac': 0.01012963762505856, 'bb_std_mult': 1.6385930643481523, 'rsi_os': 53, 'rsi_ob': 72, 'vol_spike': 0.16519564658405048, 'adx_thresh': 13.688590478093055, 'atr_min_pct': 0.00529784617122332, 'atr_max_pct': 0.019162509489217418, 'tp_mult': 2.6720596273353654, 'tsl_mult': 0.14044681681818116, 'strategy': 'breakout', 'time_stop': 76, 'use_sma': False, 'use_atr': False, 'use_adx': True, 'use_ema': True, 'use_spike': False, 'rsi_required': False, 'edge_k': 0.6992836225089197, 'edge_cap': 0.8464451493008929, 'bull_strategy': 'breakout', 'bull_bb_std_mult': 2.719968425074163, 'bull_rsi_os': 39, 'bull_rsi_ob': 73, 'bull_adx_thresh': 11.076498995954863, 'bull_atr_min_pct': 0.0017935442015996094, 'bull_atr_max_pct': 0.07209210883417064, 'bull_tp_mult': 2.4206740583145874, 'bull_tsl_mult': 0.35628626872499825, 'bull_time_stop': 164, 'bull_use_sma': False, 'bull_use_ema': False, 'bull_use_atr': True, 'bull_use_adx': True, 'bull_use_spike': True, 'bull_rsi_required': True, 'bear_strategy': 'mean_reversion', 'bear_bb_std_mult': 1.1664310040620316, 'bear_rsi_os': 21, 'bear_rsi_ob': 52, 'bear_adx_thresh': 11.569148036542503, 'bear_atr_min_pct': 0.006252755443859507, 'bear_atr_max_pct': 0.024475158968666047, 'bear_tp_mult': 1.7541631455354385, 'bear_tsl_mult': 0.6141655399398976, 'bear_time_stop': 9, 'bear_use_sma': True, 'bear_use_ema': False, 'bear_use_atr': False, 'bear_use_adx': True, 'bear_use_spike': False, 'bear_rsi_required': False, 'sideways_strategy': 'mean_reversion', 'sideways_bb_std_mult': 1.1279354966887705, 'sideways_rsi_os': 47, 'sideways_rsi_ob': 92, 'sideways_adx_thresh': 12.717997624390373, 'sideways_atr_min_pct': 0.02310855809173205, 'sideways_atr_max_pct': 0.14230202709728734, 'sideways_tp_mult': 2.885541929239379, 'sideways_tsl_mult': 0.7303700065850057, 'sideways_time_stop': 158, 'sideways_use_sma': True, 'sideways_use_ema': True, 'sideways_use_atr': False, 'sideways_use_adx': True, 'sideways_use_spike': True, 'sideways_rsi_required': False}.
[I 2025-08-31 00:32:20,539] Trial 261 finished with values: [-1000000000.0, 1000000000.0] and parameters: {'p_sma': 34, 'p_std': 39, 'p_atr': 19, 'p_adx': 11, 'rsi_period': 54, 'ema1': 5, 'ema2': 15, 'slip_atr_k': 0.03660313001698511, 'slip_spread_k': 0.8851515501379128, 'spread_hl_frac': 0.007736214991855917, 'bb_std_mult': 1.3101056261613317, 'rsi_os': 53, 'rsi_ob': 79, 'vol_spike': 0.17258117451646127, 'adx_thresh': 9.735719185982244, 'atr_min_pct': 0.014410169736359335, 'atr_max_pct': 0.01003272410641659, 'tp_mult': 2.099484805006727, 'tsl_mult': 0.13803332001198815, 'strategy': 'breakout', 'time_stop': 77, 'use_sma': False, 'use_atr': False, 'use_adx': True, 'use_ema': True, 'use_spike': False, 'rsi_required': False, 'edge_k': 1.9523141780155884, 'edge_cap': 0.8323235762088066, 'bull_strategy': 'breakout', 'bull_bb_std_mult': 2.962947748585694, 'bull_rsi_os': 6, 'bull_rsi_ob': 73, 'bull_adx_thresh': 29.94615513335869, 'bull_atr_min_pct': 0.02388629442330098, 'bull_atr_max_pct': 0.07811231041177652, 'bull_tp_mult': 2.4117141213933024, 'bull_tsl_mult': 0.3443933707722187, 'bull_time_stop': 170, 'bull_use_sma': False, 'bull_use_ema': False, 'bull_use_atr': True, 'bull_use_adx': False, 'bull_use_spike': True, 'bull_rsi_required': True, 'bear_strategy': 'mean_reversion', 'bear_bb_std_mult': 1.1766547718177753, 'bear_rsi_os': 21, 'bear_rsi_ob': 79, 'bear_adx_thresh': 17.08681395375154, 'bear_atr_min_pct': 0.004803328123024621, 'bear_atr_max_pct': 0.0146003407524176, 'bear_tp_mult': 1.7349489690378692, 'bear_tsl_mult': 0.7398683309008207, 'bear_time_stop': 28, 'bear_use_sma': True, 'bear_use_ema': False, 'bear_use_atr': False, 'bear_use_adx': True, 'bear_use_spike': False, 'bear_rsi_required': False, 'sideways_strategy': 'mean_reversion', 'sideways_bb_std_mult': 1.1280504977533334, 'sideways_rsi_os': 10, 'sideways_rsi_ob': 93, 'sideways_adx_thresh': 12.530233854874249, 'sideways_atr_min_pct': 0.019678320579210987, 'sideways_atr_max_pct': 0.07880972389609169, 'sideways_tp_mult': 1.053846002795929, 'sideways_tsl_mult': 0.8053316589082291, 'sideways_time_stop': 172, 'sideways_use_sma': True, 'sideways_use_ema': True, 'sideways_use_atr': False, 'sideways_use_adx': True, 'sideways_use_spike': True, 'sideways_rsi_required': True}.
[I 2025-08-31 00:32:49,465] Trial 260 finished with values: [-1000000000.0, 1000000000.0] and parameters: {'p_sma': 45, 'p_std': 59, 'p_atr': 21, 'p_adx': 16, 'rsi_period': 62, 'ema1': 5, 'ema2': 57, 'slip_atr_k': 0.14338044759044208, 'slip_spread_k': 0.7723252280526665, 'spread_hl_frac': 0.008327708797918882, 'bb_std_mult': 1.297041231738684, 'rsi_os': 53, 'rsi_ob': 79, 'vol_spike': 0.16901431202846742, 'adx_thresh': 13.712517722601394, 'atr_min_pct': 0.014181959634083884, 'atr_max_pct': 0.07021499384387431, 'tp_mult': 2.677609542017959, 'tsl_mult': 0.49264910856938104, 'strategy': 'breakout', 'time_stop': 91, 'use_sma': False, 'use_atr': False, 'use_adx': True, 'use_ema': True, 'use_spike': False, 'rsi_required': False, 'edge_k': 0.589791654123655, 'edge_cap': 0.8444750684620208, 'bull_strategy': 'breakout', 'bull_bb_std_mult': 2.92042468394891, 'bull_rsi_os': 6, 'bull_rsi_ob': 72, 'bull_adx_thresh': 15.911255169387884, 'bull_atr_min_pct': 0.0015493520794287014, 'bull_atr_max_pct': 0.07933475597393709, 'bull_tp_mult': 2.41394405388217, 'bull_tsl_mult': 0.34786261638547844, 'bull_time_stop': 165, 'bull_use_sma': False, 'bull_use_ema': False, 'bull_use_atr': True, 'bull_use_adx': False, 'bull_use_spike': True, 'bull_rsi_required': True, 'bear_strategy': 'mean_reversion', 'bear_bb_std_mult': 1.1878502749359474, 'bear_rsi_os': 21, 'bear_rsi_ob': 52, 'bear_adx_thresh': 5.226551071886039, 'bear_atr_min_pct': 0.028622794194796096, 'bear_atr_max_pct': 0.025119659098735307, 'bear_tp_mult': 2.6429059703515554, 'bear_tsl_mult': 0.6191870536059824, 'bear_time_stop': 18, 'bear_use_sma': True, 'bear_use_ema': False, 'bear_use_atr': False, 'bear_use_adx': False, 'bear_use_spike': False, 'bear_rsi_required': True, 'sideways_strategy': 'mean_reversion', 'sideways_bb_std_mult': 1.1185766622795428, 'sideways_rsi_os': 47, 'sideways_rsi_ob': 92, 'sideways_adx_thresh': 12.595529595520874, 'sideways_atr_min_pct': 0.01689877439170337, 'sideways_atr_max_pct': 0.1407130472881743, 'sideways_tp_mult': 1.0737777648538154, 'sideways_tsl_mult': 0.8325363382628099, 'sideways_time_stop': 160, 'sideways_use_sma': True, 'sideways_use_ema': True, 'sideways_use_atr': False, 'sideways_use_adx': True, 'sideways_use_spike': False, 'sideways_rsi_required': True}.
