[I 2025-08-31 02:51:23,037] Trial 684 finished with values: [-1000000000.0, 1000000000.0] and parameters: {'p_sma': 55, 'p_std': 53, 'p_atr': 11, 'p_adx': 18, 'rsi_period': 71, 'ema1': 5, 'ema2': 28, 'slip_atr_k': 0.11155179202656548, 'slip_spread_k': 0.12909403899399022, 'spread_hl_frac': 0.0014558760359003184, 'bb_std_mult': 1.8171797784450732, 'rsi_os': 42, 'rsi_ob': 58, 'vol_spike': 0.2612311927982841, 'adx_thresh': 19.58319527189161, 'atr_min_pct': 0.008978537297501994, 'atr_max_pct': 0.12127319379381786, 'tp_mult': 2.2329999126580677, 'tsl_mult': 0.5533605739619418, 'strategy': 'mean_reversion', 'time_stop': 124, 'use_sma': True, 'use_atr': False, 'use_adx': False, 'use_ema': False, 'use_spike': False, 'rsi_required': True, 'edge_k': 0.48458893566767014, 'edge_cap': 0.48172178334775995, 'bull_strategy': 'breakout', 'bull_bb_std_mult': 3.0102707709254064, 'bull_rsi_os': 30, 'bull_rsi_ob': 62, 'bull_adx_thresh': 5.659955053104234, 'bull_atr_min_pct': 0.019488760947706987, 'bull_atr_max_pct': 0.03390000570288838, 'bull_tp_mult': 1.9254749541813156, 'bull_tsl_mult': 0.5125659296911037, 'bull_time_stop': 140, 'bull_use_sma': True, 'bull_use_ema': False, 'bull_use_atr': False, 'bull_use_adx': True, 'bull_use_spike': True, 'bull_rsi_required': True, 'bear_strategy': 'mean_reversion', 'bear_bb_std_mult': 1.434793387734977, 'bear_rsi_os': 13, 'bear_rsi_ob': 54, 'bear_adx_thresh': 33.36408173777261, 'bear_atr_min_pct': 0.007536030493671171, 'bear_atr_max_pct': 0.12507182114237933, 'bear_tp_mult': 2.131247941520579, 'bear_tsl_mult': 0.5717342567445095, 'bear_time_stop': 18, 'bear_use_sma': False, 'bear_use_ema': False, 'bear_use_atr': False, 'bear_use_adx': True, 'bear_use_spike': False, 'bear_rsi_required': True, 'sideways_strategy': 'breakout', 'sideways_bb_std_mult': 0.5052462150363235, 'sideways_rsi_os': 11, 'sideways_rsi_ob': 60, 'sideways_adx_thresh': 8.162998408531823, 'sideways_atr_min_pct': 0.010637923524237359, 'sideways_atr_max_pct': 0.04965992141597144, 'sideways_tp_mult': 2.8063567377741983, 'sideways_tsl_mult': 0.6516236432645706, 'sideways_time_stop': 189, 'sideways_use_sma': False, 'sideways_use_ema': False, 'sideways_use_atr': True, 'sideways_use_adx': False, 'sideways_use_spike': True, 'sideways_rsi_required': True}.
[I 2025-08-31 02:51:23,533] Trial 686 finished with values: [-1000000000.0, 1000000000.0] and parameters: {'p_sma': 54, 'p_std': 53, 'p_atr': 28, 'p_adx': 11, 'rsi_period': 71, 'ema1': 13, 'ema2': 40, 'slip_atr_k': 0.08561037789477635, 'slip_spread_k': 0.34710615220799496, 'spread_hl_frac': 0.028480334924449766, 'bb_std_mult': 1.7949181603445177, 'rsi_os': 38, 'rsi_ob': 71, 'vol_spike': 0.09727735822798586, 'adx_thresh': 19.605812225907343, 'atr_min_pct': 0.006555659365696725, 'atr_max_pct': 0.08332115847962536, 'tp_mult': 2.991155514841878, 'tsl_mult': 0.3826964159365551, 'strategy': 'mean_reversion', 'time_stop': 104, 'use_sma': True, 'use_atr': False, 'use_adx': False, 'use_ema': False, 'use_spike': False, 'rsi_required': True, 'edge_k': 0.4740248987541522, 'edge_cap': 0.1444905871738678, 'bull_strategy': 'mean_reversion', 'bull_bb_std_mult': 1.882022672299253, 'bull_rsi_os': 12, 'bull_rsi_ob': 67, 'bull_adx_thresh': 5.9449936915588655, 'bull_atr_min_pct': 0.010569364532515956, 'bull_atr_max_pct': 0.14451616320535823, 'bull_tp_mult': 1.944304112861114, 'bull_tsl_mult': 0.2798553679239649, 'bull_time_stop': 140, 'bull_use_sma': True, 'bull_use_ema': False, 'bull_use_atr': False, 'bull_use_adx': True, 'bull_use_spike': True, 'bull_rsi_required': True, 'bear_strategy': 'mean_reversion', 'bear_bb_std_mult': 1.4357680978744933, 'bear_rsi_os': 15, 'bear_rsi_ob': 49, 'bear_adx_thresh': 19.65408447957712, 'bear_atr_min_pct': 0.0073049363329293175, 'bear_atr_max_pct': 0.01000957516928752, 'bear_tp_mult': 2.1386650307046358, 'bear_tsl_mult': 0.5215206035368082, 'bear_time_stop': 21, 'bear_use_sma': False, 'bear_use_ema': False, 'bear_use_atr': False, 'bear_use_adx': True, 'bear_use_spike': False, 'bear_rsi_required': True, 'sideways_strategy': 'breakout', 'sideways_bb_std_mult': 0.5023629301319014, 'sideways_rsi_os': 18, 'sideways_rsi_ob': 93, 'sideways_adx_thresh': 6.51920108512911, 'sideways_atr_min_pct': 0.01417719591938416, 'sideways_atr_max_pct': 0.049004646817205504, 'sideways_tp_mult': 1.6223839084896103, 'sideways_tsl_mult': 0.6459009185845513, 'sideways_time_stop': 209, 'sideways_use_sma': False, 'sideways_use_ema': False, 'sideways_use_atr': True, 'sideways_use_adx': False, 'sideways_use_spike': True, 'sideways_rsi_required': True}.
[I 2025-08-31 02:51:23,921] Trial 687 finished with values: [-1000000000.0, 1000000000.0] and parameters: {'p_sma': 54, 'p_std': 50, 'p_atr': 28, 'p_adx': 27, 'rsi_period': 71, 'ema1': 6, 'ema2': 15, 'slip_atr_k': 0.08548131954579058, 'slip_spread_k': 0.12769503241489427, 'spread_hl_frac': 0.023878070817738826, 'bb_std_mult': 1.8177165544609153, 'rsi_os': 37, 'rsi_ob': 71, 'vol_spike': 0.19795020216418874, 'adx_thresh': 19.945363345918302, 'atr_min_pct': 0.007600369673806513, 'atr_max_pct': 0.10435723740343601, 'tp_mult': 2.9360445372476174, 'tsl_mult': 0.24703306468000494, 'strategy': 'mean_reversion', 'time_stop': 122, 'use_sma': True, 'use_atr': False, 'use_adx': False, 'use_ema': False, 'use_spike': False, 'rsi_required': True, 'edge_k': 0.5555189605849558, 'edge_cap': 0.14418701015529994, 'bull_strategy': 'mean_reversion', 'bull_bb_std_mult': 3.016265866295526, 'bull_rsi_os': 13, 'bull_rsi_ob': 66, 'bull_adx_thresh': 5.746377957531895, 'bull_atr_min_pct': 0.01072404677444671, 'bull_atr_max_pct': 0.12268067684613747, 'bull_tp_mult': 2.2750930192346295, 'bull_tsl_mult': 0.8561958788431646, 'bull_time_stop': 122, 'bull_use_sma': True, 'bull_use_ema': True, 'bull_use_atr': False, 'bull_use_adx': True, 'bull_use_spike': True, 'bull_rsi_required': True, 'bear_strategy': 'mean_reversion', 'bear_bb_std_mult': 2.6971239198924115, 'bear_rsi_os': 16, 'bear_rsi_ob': 46, 'bear_adx_thresh': 13.142817398101341, 'bear_atr_min_pct': 0.006406233322152211, 'bear_atr_max_pct': 0.01537836661624793, 'bear_tp_mult': 2.847208634271277, 'bear_tsl_mult': 0.5762084683476126, 'bear_time_stop': 114, 'bear_use_sma': False, 'bear_use_ema': False, 'bear_use_atr': False, 'bear_use_adx': True, 'bear_use_spike': False, 'bear_rsi_required': True, 'sideways_strategy': 'breakout', 'sideways_bb_std_mult': 2.8174576816074066, 'sideways_rsi_os': 11, 'sideways_rsi_ob': 93, 'sideways_adx_thresh': 8.039409954500627, 'sideways_atr_min_pct': 0.008706782965984258, 'sideways_atr_max_pct': 0.05710306251045074, 'sideways_tp_mult': 1.7077445854186473, 'sideways_tsl_mult': 0.6399810748690636, 'sideways_time_stop': 209, 'sideways_use_sma': False, 'sideways_use_ema': False, 'sideways_use_atr': True, 'sideways_use_adx': False, 'sideways_use_spike': True, 'sideways_rsi_required': True}.
[I 2025-08-31 02:51:24,064] Trial 685 finished with values: [-1000000000.0, 1000000000.0] and parameters: {'p_sma': 19, 'p_std': 53, 'p_atr': 28, 'p_adx': 22, 'rsi_period': 15, 'ema1': 5, 'ema2': 57, 'slip_atr_k': 0.14746083190736278, 'slip_spread_k': 0.15350421392359595, 'spread_hl_frac': 0.02893656744170259, 'bb_std_mult': 2.424131190830532, 'rsi_os': 42, 'rsi_ob': 71, 'vol_spike': 0.19718638263050906, 'adx_thresh': 19.66705381549912, 'atr_min_pct': 0.018253758455313306, 'atr_max_pct': 0.1433928936054087, 'tp_mult': 2.9706478245293577, 'tsl_mult': 0.3648517106509571, 'strategy': 'mean_reversion', 'time_stop': 105, 'use_sma': True, 'use_atr': False, 'use_adx': False, 'use_ema': False, 'use_spike': False, 'rsi_required': True, 'edge_k': 0.4679688884198921, 'edge_cap': 0.1485914932429055, 'bull_strategy': 'breakout', 'bull_bb_std_mult': 3.452431365475251, 'bull_rsi_os': 26, 'bull_rsi_ob': 61, 'bull_adx_thresh': 8.802666377239191, 'bull_atr_min_pct': 0.009760674865768844, 'bull_atr_max_pct': 0.11352921779437936, 'bull_tp_mult': 1.9316809744687056, 'bull_tsl_mult': 0.5130264848880193, 'bull_time_stop': 80, 'bull_use_sma': True, 'bull_use_ema': False, 'bull_use_atr': False, 'bull_use_adx': True, 'bull_use_spike': True, 'bull_rsi_required': True, 'bear_strategy': 'mean_reversion', 'bear_bb_std_mult': 1.4240595268784375, 'bear_rsi_os': 16, 'bear_rsi_ob': 70, 'bear_adx_thresh': 30.188467873684388, 'bear_atr_min_pct': 0.007215507244406135, 'bear_atr_max_pct': 0.015309899058221926, 'bear_tp_mult': 2.86035720865728, 'bear_tsl_mult': 0.5730286716003439, 'bear_time_stop': 19, 'bear_use_sma': False, 'bear_use_ema': False, 'bear_use_atr': False, 'bear_use_adx': True, 'bear_use_spike': False, 'bear_rsi_required': True, 'sideways_strategy': 'breakout', 'sideways_bb_std_mult': 0.5005382090192178, 'sideways_rsi_os': 38, 'sideways_rsi_ob': 58, 'sideways_adx_thresh': 7.746369442837602, 'sideways_atr_min_pct': 0.014266313504620718, 'sideways_atr_max_pct': 0.04913351238411682, 'sideways_tp_mult': 2.8038844475240046, 'sideways_tsl_mult': 0.6493550090161442, 'sideways_time_stop': 190, 'sideways_use_sma': False, 'sideways_use_ema': False, 'sideways_use_atr': True, 'sideways_use_adx': False, 'sideways_use_spike': True, 'sideways_rsi_required': True}.
[I 2025-08-31 02:52:01,918] Trial 691 finished with values: [-1000000000.0, 1000000000.0] and parameters: {'p_sma': 52, 'p_std': 49, 'p_atr': 29, 'p_adx': 21, 'rsi_period': 29, 'ema1': 6, 'ema2': 32, 'slip_atr_k': 0.07840866092799487, 'slip_spread_k': 0.19632071579410204, 'spread_hl_frac': 0.030546852280227244, 'bb_std_mult': 1.6345967847511296, 'rsi_os': 33, 'rsi_ob': 53, 'vol_spike': 0.17943785339806836, 'adx_thresh': 21.72915321330189, 'atr_min_pct': 0.00944388266065665, 'atr_max_pct': 0.03468704138735394, 'tp_mult': 2.1468896901378614, 'tsl_mult': 0.3074791280751255, 'strategy': 'mean_reversion', 'time_stop': 256, 'use_sma': True, 'use_atr': True, 'use_adx': False, 'use_ema': False, 'use_spike': False, 'rsi_required': True, 'edge_k': 0.5264832242724604, 'edge_cap': 0.1720223154111687, 'bull_strategy': 'breakout', 'bull_bb_std_mult': 1.6230071117516842, 'bull_rsi_os': 52, 'bull_rsi_ob': 80, 'bull_adx_thresh': 17.85054045169241, 'bull_atr_min_pct': 0.022729302843894954, 'bull_atr_max_pct': 0.13092592333438482, 'bull_tp_mult': 2.2413761819423654, 'bull_tsl_mult': 0.6759853348668878, 'bull_time_stop': 133, 'bull_use_sma': True, 'bull_use_ema': True, 'bull_use_atr': False, 'bull_use_adx': True, 'bull_use_spike': True, 'bull_rsi_required': True, 'bear_strategy': 'mean_reversion', 'bear_bb_std_mult': 0.7552582309060805, 'bear_rsi_os': 18, 'bear_rsi_ob': 46, 'bear_adx_thresh': 26.097591743341095, 'bear_atr_min_pct': 0.016390673808693447, 'bear_atr_max_pct': 0.04559783438867929, 'bear_tp_mult': 1.9893701487334914, 'bear_tsl_mult': 0.39686523443841615, 'bear_time_stop': 9, 'bear_use_sma': False, 'bear_use_ema': False, 'bear_use_atr': False, 'bear_use_adx': True, 'bear_use_spike': False, 'bear_rsi_required': True, 'sideways_strategy': 'breakout', 'sideways_bb_std_mult': 1.768051887626926, 'sideways_rsi_os': 13, 'sideways_rsi_ob': 95, 'sideways_adx_thresh': 10.0826470237003, 'sideways_atr_min_pct': 0.027978384534837586, 'sideways_atr_max_pct': 0.09097790549250764, 'sideways_tp_mult': 2.067854678335933, 'sideways_tsl_mult': 0.6169953126320985, 'sideways_time_stop': 75, 'sideways_use_sma': True, 'sideways_use_ema': False, 'sideways_use_atr': False, 'sideways_use_adx': False, 'sideways_use_spike': True, 'sideways_rsi_required': False}.
[I 2025-08-31 02:52:02,648] Trial 690 finished with values: [-1000000000.0, 1000000000.0] and parameters: {'p_sma': 52, 'p_std': 50, 'p_atr': 28, 'p_adx': 21, 'rsi_period': 69, 'ema1': 29, 'ema2': 56, 'slip_atr_k': 0.1165784217631835, 'slip_spread_k': 0.15088216585484487, 'spread_hl_frac': 0.003903086801339658, 'bb_std_mult': 0.5037229676159964, 'rsi_os': 36, 'rsi_ob': 53, 'vol_spike': 0.1879462808507083, 'adx_thresh': 21.330001107427222, 'atr_min_pct': 0.003428123290052442, 'atr_max_pct': 0.12307911710829575, 'tp_mult': 2.1450090588234114, 'tsl_mult': 0.3641064876110451, 'strategy': 'mean_reversion', 'time_stop': 235, 'use_sma': True, 'use_atr': True, 'use_adx': False, 'use_ema': False, 'use_spike': False, 'rsi_required': True, 'edge_k': 0.5213972247495827, 'edge_cap': 0.1636286924825965, 'bull_strategy': 'breakout', 'bull_bb_std_mult': 2.2419315765087844, 'bull_rsi_os': 26, 'bull_rsi_ob': 64, 'bull_adx_thresh': 29.580122699082814, 'bull_atr_min_pct': 0.006791701862924397, 'bull_atr_max_pct': 0.09984931471364066, 'bull_tp_mult': 1.6618283873926916, 'bull_tsl_mult': 0.3087925009563457, 'bull_time_stop': 149, 'bull_use_sma': True, 'bull_use_ema': True, 'bull_use_atr': False, 'bull_use_adx': True, 'bull_use_spike': True, 'bull_rsi_required': True, 'bear_strategy': 'mean_reversion', 'bear_bb_std_mult': 0.774275673726005, 'bear_rsi_os': 18, 'bear_rsi_ob': 52, 'bear_adx_thresh': 5.613560314950723, 'bear_atr_min_pct': 0.018290830744667336, 'bear_atr_max_pct': 0.018204542253325726, 'bear_tp_mult': 2.0057823927864744, 'bear_tsl_mult': 0.4877571844851272, 'bear_time_stop': 5, 'bear_use_sma': False, 'bear_use_ema': False, 'bear_use_atr': False, 'bear_use_adx': True, 'bear_use_spike': False, 'bear_rsi_required': True, 'sideways_strategy': 'breakout', 'sideways_bb_std_mult': 1.4979828911988586, 'sideways_rsi_os': 29, 'sideways_rsi_ob': 56, 'sideways_adx_thresh': 10.231002948007562, 'sideways_atr_min_pct': 0.02796314295349061, 'sideways_atr_max_pct': 0.05488109891115234, 'sideways_tp_mult': 1.4489593009878472, 'sideways_tsl_mult': 0.6109879335721906, 'sideways_time_stop': 205, 'sideways_use_sma': True, 'sideways_use_ema': False, 'sideways_use_atr': False, 'sideways_use_adx': False, 'sideways_use_spike': True, 'sideways_rsi_required': False}.
[I 2025-08-31 02:52:02,983] Trial 689 finished with values: [-1000000000.0, 1000000000.0] and parameters: {'p_sma': 52, 'p_std': 50, 'p_atr': 28, 'p_adx': 21, 'rsi_period': 69, 'ema1': 6, 'ema2': 46, 'slip_atr_k': 0.14361686842873536, 'slip_spread_k': 0.15392730787349038, 'spread_hl_frac': 0.003295479957249243, 'bb_std_mult': 2.4051700873626007, 'rsi_os': 37, 'rsi_ob': 53, 'vol_spike': 0.1994357465578945, 'adx_thresh': 20.33520757601876, 'atr_min_pct': 0.0075804904671632044, 'atr_max_pct': 0.1019369066332293, 'tp_mult': 2.130397100992049, 'tsl_mult': 0.9340682828193184, 'strategy': 'mean_reversion', 'time_stop': 160, 'use_sma': True, 'use_atr': True, 'use_adx': False, 'use_ema': False, 'use_spike': False, 'rsi_required': True, 'edge_k': 0.5601874528212379, 'edge_cap': 0.15554736368826427, 'bull_strategy': 'breakout', 'bull_bb_std_mult': 2.2350139671766343, 'bull_rsi_os': 18, 'bull_rsi_ob': 65, 'bull_adx_thresh': 6.51689717860747, 'bull_atr_min_pct': 0.014714666235920932, 'bull_atr_max_pct': 0.13540957971203127, 'bull_tp_mult': 2.2496309654041573, 'bull_tsl_mult': 0.30916328826050754, 'bull_time_stop': 148, 'bull_use_sma': True, 'bull_use_ema': True, 'bull_use_atr': False, 'bull_use_adx': True, 'bull_use_spike': True, 'bull_rsi_required': True, 'bear_strategy': 'mean_reversion', 'bear_bb_std_mult': 2.683878225591781, 'bear_rsi_os': 16, 'bear_rsi_ob': 72, 'bear_adx_thresh': 5.72385149564016, 'bear_atr_min_pct': 0.004758957081399063, 'bear_atr_max_pct': 0.045632778169785546, 'bear_tp_mult': 2.001823033107019, 'bear_tsl_mult': 0.5680974809982452, 'bear_time_stop': 115, 'bear_use_sma': False, 'bear_use_ema': False, 'bear_use_atr': False, 'bear_use_adx': True, 'bear_use_spike': False, 'bear_rsi_required': True, 'sideways_strategy': 'breakout', 'sideways_bb_std_mult': 2.8684969515904175, 'sideways_rsi_os': 38, 'sideways_rsi_ob': 56, 'sideways_adx_thresh': 10.098297770932096, 'sideways_atr_min_pct': 0.02801388811702704, 'sideways_atr_max_pct': 0.05678430657865917, 'sideways_tp_mult': 1.7117250368371824, 'sideways_tsl_mult': 0.6147099514404446, 'sideways_time_stop': 207, 'sideways_use_sma': True, 'sideways_use_ema': False, 'sideways_use_atr': False, 'sideways_use_adx': False, 'sideways_use_spike': True, 'sideways_rsi_required': False}.
[I 2025-08-31 02:52:03,232] Trial 688 finished with values: [-1000000000.0, 1000000000.0] and parameters: {'p_sma': 52, 'p_std': 50, 'p_atr': 28, 'p_adx': 21, 'rsi_period': 79, 'ema1': 6, 'ema2': 40, 'slip_atr_k': 0.22448238790084785, 'slip_spread_k': 0.9981939764542258, 'spread_hl_frac': 0.022847142568669803, 'bb_std_mult': 1.8094765749715778, 'rsi_os': 14, 'rsi_ob': 71, 'vol_spike': 0.08523089446575022, 'adx_thresh': 19.89028190599312, 'atr_min_pct': 0.006514836046450205, 'atr_max_pct': 0.08412299734213548, 'tp_mult': 2.142413013561067, 'tsl_mult': 0.3622765003402853, 'strategy': 'mean_reversion', 'time_stop': 104, 'use_sma': True, 'use_atr': True, 'use_adx': False, 'use_ema': False, 'use_spike': False, 'rsi_required': True, 'edge_k': 0.5577942566634276, 'edge_cap': 0.15761223323954734, 'bull_strategy': 'mean_reversion', 'bull_bb_std_mult': 1.5755881423879006, 'bull_rsi_os': 55, 'bull_rsi_ob': 80, 'bull_adx_thresh': 17.75419007900163, 'bull_atr_min_pct': 0.0247552058787563, 'bull_atr_max_pct': 0.14454222235529776, 'bull_tp_mult': 1.1209349617957591, 'bull_tsl_mult': 0.6747708323546923, 'bull_time_stop': 79, 'bull_use_sma': True, 'bull_use_ema': True, 'bull_use_atr': False, 'bull_use_adx': True, 'bull_use_spike': True, 'bull_rsi_required': True, 'bear_strategy': 'mean_reversion', 'bear_bb_std_mult': 1.49744120342537, 'bear_rsi_os': 16, 'bear_rsi_ob': 52, 'bear_adx_thresh': 5.68774896097054, 'bear_atr_min_pct': 0.006554452105713643, 'bear_atr_max_pct': 0.07003475563761917, 'bear_tp_mult': 2.00531485620256, 'bear_tsl_mult': 0.568511738124168, 'bear_time_stop': 22, 'bear_use_sma': False, 'bear_use_ema': False, 'bear_use_atr': False, 'bear_use_adx': True, 'bear_use_spike': False, 'bear_rsi_required': True, 'sideways_strategy': 'breakout', 'sideways_bb_std_mult': 1.4827973951093023, 'sideways_rsi_os': 38, 'sideways_rsi_ob': 93, 'sideways_adx_thresh': 10.55243731557158, 'sideways_atr_min_pct': 0.027926225140558127, 'sideways_atr_max_pct': 0.09229507094153255, 'sideways_tp_mult': 2.1069201341499886, 'sideways_tsl_mult': 0.6428836532229403, 'sideways_time_stop': 208, 'sideways_use_sma': False, 'sideways_use_ema': False, 'sideways_use_atr': False, 'sideways_use_adx': False, 'sideways_use_spike': True, 'sideways_rsi_required': False}.
[I 2025-08-31 02:52:42,330] Trial 695 finished with values: [-1000000000.0, 1000000000.0] and parameters: {'p_sma': 22, 'p_std': 52, 'p_atr': 17, 'p_adx': 26, 'rsi_period': 44, 'ema1': 14, 'ema2': 12, 'slip_atr_k': 0.009655344719742553, 'slip_spread_k': 0.8452950636021803, 'spread_hl_frac': 0.005433344944267157, 'bb_std_mult': 1.4122793504961808, 'rsi_os': 39, 'rsi_ob': 83, 'vol_spike': 0.17358361757067045, 'adx_thresh': 20.687834134279406, 'atr_min_pct': 0.008725475628422918, 'atr_max_pct': 0.01885373792659676, 'tp_mult': 1.1648271406483581, 'tsl_mult': 0.3390983708222536, 'strategy': 'mean_reversion', 'time_stop': 215, 'use_sma': False, 'use_atr': False, 'use_adx': True, 'use_ema': False, 'use_spike': False, 'rsi_required': True, 'edge_k': 0.6155255236068882, 'edge_cap': 0.0795699315583078, 'bull_strategy': 'breakout', 'bull_bb_std_mult': 1.6973815496340565, 'bull_rsi_os': 46, 'bull_rsi_ob': 88, 'bull_adx_thresh': 6.5907082691095304, 'bull_atr_min_pct': 0.0038414761029009785, 'bull_atr_max_pct': 0.0233309056803574, 'bull_tp_mult': 2.1851364782025007, 'bull_tsl_mult': 0.7452779275083591, 'bull_time_stop': 109, 'bull_use_sma': True, 'bull_use_ema': False, 'bull_use_atr': False, 'bull_use_adx': True, 'bull_use_spike': True, 'bull_rsi_required': True, 'bear_strategy': 'breakout', 'bear_bb_std_mult': 3.5314385458838373, 'bear_rsi_os': 50, 'bear_rsi_ob': 45, 'bear_adx_thresh': 16.475007884756874, 'bear_atr_min_pct': 0.006291274095437419, 'bear_atr_max_pct': 0.06396609768699922, 'bear_tp_mult': 2.5710199585332716, 'bear_tsl_mult': 0.5372822215585096, 'bear_time_stop': 14, 'bear_use_sma': False, 'bear_use_ema': False, 'bear_use_atr': False, 'bear_use_adx': False, 'bear_use_spike': True, 'bear_rsi_required': True, 'sideways_strategy': 'breakout', 'sideways_bb_std_mult': 0.5879755556856416, 'sideways_rsi_os': 40, 'sideways_rsi_ob': 80, 'sideways_adx_thresh': 28.7181926982788, 'sideways_atr_min_pct': 0.027280013908028446, 'sideways_atr_max_pct': 0.12735023487031744, 'sideways_tp_mult': 1.6681291034557382, 'sideways_tsl_mult': 0.5089172480003378, 'sideways_time_stop': 50, 'sideways_use_sma': True, 'sideways_use_ema': False, 'sideways_use_atr': False, 'sideways_use_adx': True, 'sideways_use_spike': True, 'sideways_rsi_required': False}.
