[I 2025-08-31 00:14:13,274] Trial 102 finished with values: [-1000000000.0, 1000000000.0] and parameters: {'p_sma': 5, 'p_std': 38, 'p_atr': 27, 'p_adx': 8, 'rsi_period': 29, 'ema1': 27, 'ema2': 16, 'slip_atr_k': 0.19085246862021543, 'slip_spread_k': 0.18145134104614802, 'spread_hl_frac': 0.01265891405820244, 'bb_std_mult': 3.2430765315482253, 'rsi_os': 55, 'rsi_ob': 72, 'vol_spike': 0.040896751400625084, 'adx_thresh': 13.472954979356157, 'atr_min_pct': 0.021225218946707113, 'atr_max_pct': 0.02110462310330838, 'tp_mult': 2.8433053075419528, 'tsl_mult': 0.8122322769355477, 'strategy': 'breakout', 'time_stop': 56, 'use_sma': False, 'use_atr': False, 'use_adx': False, 'use_ema': False, 'use_spike': False, 'rsi_required': True, 'edge_k': 0.05194815899024119, 'edge_cap': 0.5431788773656858, 'bull_strategy': 'breakout', 'bull_bb_std_mult': 2.7715744839643386, 'bull_rsi_os': 35, 'bull_rsi_ob': 61, 'bull_adx_thresh': 16.14921271392474, 'bull_atr_min_pct': 0.0017326285790380184, 'bull_atr_max_pct': 0.13182128305412458, 'bull_tp_mult': 2.8460889192851653, 'bull_tsl_mult': 0.26913999006912825, 'bull_time_stop': 164, 'bull_use_sma': False, 'bull_use_ema': True, 'bull_use_atr': False, 'bull_use_adx': True, 'bull_use_spike': False, 'bull_rsi_required': False, 'bear_strategy': 'breakout', 'bear_bb_std_mult': 0.8099240993928061, 'bear_rsi_os': 31, 'bear_rsi_ob': 71, 'bear_adx_thresh': 28.997171501230206, 'bear_atr_min_pct': 0.009949692151458737, 'bear_atr_max_pct': 0.11956764738069015, 'bear_tp_mult': 2.1069897190843525, 'bear_tsl_mult': 0.2698786480596524, 'bear_time_stop': 79, 'bear_use_sma': False, 'bear_use_ema': False, 'bear_use_atr': True, 'bear_use_adx': True, 'bear_use_spike': False, 'bear_rsi_required': False, 'sideways_strategy': 'mean_reversion', 'sideways_bb_std_mult': 0.7029776925758526, 'sideways_rsi_os': 42, 'sideways_rsi_ob': 63, 'sideways_adx_thresh': 15.760171330643562, 'sideways_atr_min_pct': 0.02331542072961532, 'sideways_atr_max_pct': 0.12231420667449097, 'sideways_tp_mult': 1.4210031205301612, 'sideways_tsl_mult': 0.28992760901706055, 'sideways_time_stop': 71, 'sideways_use_sma': True, 'sideways_use_ema': False, 'sideways_use_atr': False, 'sideways_use_adx': False, 'sideways_use_spike': False, 'sideways_rsi_required': False}.
[I 2025-08-31 00:14:43,409] Trial 99 finished with values: [-1000000000.0, 1000000000.0] and parameters: {'p_sma': 47, 'p_std': 40, 'p_atr': 27, 'p_adx': 7, 'rsi_period': 26, 'ema1': 28, 'ema2': 50, 'slip_atr_k': 0.05869706768451058, 'slip_spread_k': 0.32616668003192073, 'spread_hl_frac': 0.027080197322169392, 'bb_std_mult': 3.5965489621677724, 'rsi_os': 54, 'rsi_ob': 70, 'vol_spike': 0.04165149133793865, 'adx_thresh': 13.321033305508442, 'atr_min_pct': 0.021475941985468483, 'atr_max_pct': 0.022213880894738552, 'tp_mult': 2.719198449311599, 'tsl_mult': 0.2095497908239179, 'strategy': 'breakout', 'time_stop': 56, 'use_sma': False, 'use_atr': False, 'use_adx': False, 'use_ema': False, 'use_spike': False, 'rsi_required': True, 'edge_k': 0.3839588134483828, 'edge_cap': 0.9996613435766122, 'bull_strategy': 'breakout', 'bull_bb_std_mult': 2.3069418685191407, 'bull_rsi_os': 36, 'bull_rsi_ob': 60, 'bull_adx_thresh': 30.283814266760807, 'bull_atr_min_pct': 0.0001744316848255802, 'bull_atr_max_pct': 0.12355617989789636, 'bull_tp_mult': 2.9972310057896427, 'bull_tsl_mult': 0.2637179616190551, 'bull_time_stop': 166, 'bull_use_sma': False, 'bull_use_ema': True, 'bull_use_atr': False, 'bull_use_adx': True, 'bull_use_spike': False, 'bull_rsi_required': False, 'bear_strategy': 'breakout', 'bear_bb_std_mult': 0.5905606992360286, 'bear_rsi_os': 31, 'bear_rsi_ob': 75, 'bear_adx_thresh': 28.249127555410503, 'bear_atr_min_pct': 0.006479175236716053, 'bear_atr_max_pct': 0.14924213603402048, 'bear_tp_mult': 2.0894266205199004, 'bear_tsl_mult': 0.3925788448565585, 'bear_time_stop': 59, 'bear_use_sma': False, 'bear_use_ema': False, 'bear_use_atr': True, 'bear_use_adx': True, 'bear_use_spike': False, 'bear_rsi_required': False, 'sideways_strategy': 'mean_reversion', 'sideways_bb_std_mult': 1.5615870359996449, 'sideways_rsi_os': 45, 'sideways_rsi_ob': 71, 'sideways_adx_thresh': 15.490143288694185, 'sideways_atr_min_pct': 0.02554835959854565, 'sideways_atr_max_pct': 0.12231316278323418, 'sideways_tp_mult': 1.130087825740713, 'sideways_tsl_mult': 0.5056929841786082, 'sideways_time_stop': 286, 'sideways_use_sma': True, 'sideways_use_ema': False, 'sideways_use_atr': False, 'sideways_use_adx': False, 'sideways_use_spike': False, 'sideways_rsi_required': False}.
[I 2025-08-31 00:14:43,841] Trial 101 finished with values: [-1000000000.0, 1000000000.0] and parameters: {'p_sma': 49, 'p_std': 45, 'p_atr': 29, 'p_adx': 8, 'rsi_period': 30, 'ema1': 27, 'ema2': 50, 'slip_atr_k': 0.048063027960006756, 'slip_spread_k': 0.19283768590396044, 'spread_hl_frac': 0.020637820598618677, 'bb_std_mult': 3.5975937570809178, 'rsi_os': 55, 'rsi_ob': 72, 'vol_spike': 0.044100655612614684, 'adx_thresh': 13.521332413916356, 'atr_min_pct': 0.024129161438315783, 'atr_max_pct': 0.07855848461464401, 'tp_mult': 2.585863116936154, 'tsl_mult': 0.3533075284636442, 'strategy': 'breakout', 'time_stop': 40, 'use_sma': True, 'use_atr': False, 'use_adx': False, 'use_ema': False, 'use_spike': False, 'rsi_required': True, 'edge_k': 0.4553474023700769, 'edge_cap': 0.9278897801829864, 'bull_strategy': 'breakout', 'bull_bb_std_mult': 2.732986083845963, 'bull_rsi_os': 36, 'bull_rsi_ob': 54, 'bull_adx_thresh': 18.047270166622468, 'bull_atr_min_pct': 0.004983212153314445, 'bull_atr_max_pct': 0.09380475884939449, 'bull_tp_mult': 2.602913043015126, 'bull_tsl_mult': 0.25972276949388146, 'bull_time_stop': 164, 'bull_use_sma': False, 'bull_use_ema': True, 'bull_use_atr': False, 'bull_use_adx': True, 'bull_use_spike': False, 'bull_rsi_required': False, 'bear_strategy': 'breakout', 'bear_bb_std_mult': 0.6155668953060915, 'bear_rsi_os': 23, 'bear_rsi_ob': 70, 'bear_adx_thresh': 26.649423716423314, 'bear_atr_min_pct': 0.01073503482207346, 'bear_atr_max_pct': 0.12665185851580366, 'bear_tp_mult': 2.0964767422145547, 'bear_tsl_mult': 0.3795299549723936, 'bear_time_stop': 20, 'bear_use_sma': True, 'bear_use_ema': False, 'bear_use_atr': True, 'bear_use_adx': True, 'bear_use_spike': True, 'bear_rsi_required': False, 'sideways_strategy': 'mean_reversion', 'sideways_bb_std_mult': 0.6478513244532664, 'sideways_rsi_os': 42, 'sideways_rsi_ob': 63, 'sideways_adx_thresh': 15.493156164683056, 'sideways_atr_min_pct': 0.023192573103926858, 'sideways_atr_max_pct': 0.12161575860170755, 'sideways_tp_mult': 1.2043303125194824, 'sideways_tsl_mult': 0.43746997167261426, 'sideways_time_stop': 214, 'sideways_use_sma': True, 'sideways_use_ema': False, 'sideways_use_atr': False, 'sideways_use_adx': False, 'sideways_use_spike': False, 'sideways_rsi_required': False}.
[I 2025-08-31 00:14:43,842] Trial 100 finished with values: [-1000000000.0, 1000000000.0] and parameters: {'p_sma': 48, 'p_std': 45, 'p_atr': 27, 'p_adx': 8, 'rsi_period': 26, 'ema1': 28, 'ema2': 51, 'slip_atr_k': 0.04942028905389251, 'slip_spread_k': 0.32408621060220544, 'spread_hl_frac': 0.011858727149742477, 'bb_std_mult': 3.5497425259257867, 'rsi_os': 55, 'rsi_ob': 72, 'vol_spike': 0.04384826581831787, 'adx_thresh': 13.857891757077965, 'atr_min_pct': 0.011013386343142719, 'atr_max_pct': 0.0773659730337725, 'tp_mult': 1.469884788471305, 'tsl_mult': 0.2031583603836297, 'strategy': 'breakout', 'time_stop': 37, 'use_sma': True, 'use_atr': False, 'use_adx': False, 'use_ema': False, 'use_spike': False, 'rsi_required': True, 'edge_k': 0.19807884353006977, 'edge_cap': 0.9208132795748397, 'bull_strategy': 'breakout', 'bull_bb_std_mult': 2.7201067255659552, 'bull_rsi_os': 36, 'bull_rsi_ob': 60, 'bull_adx_thresh': 33.75944385365725, 'bull_atr_min_pct': 0.0018575351490243471, 'bull_atr_max_pct': 0.09161273687048062, 'bull_tp_mult': 2.8435198908607275, 'bull_tsl_mult': 0.2596182916259056, 'bull_time_stop': 166, 'bull_use_sma': False, 'bull_use_ema': True, 'bull_use_atr': False, 'bull_use_adx': True, 'bull_use_spike': False, 'bull_rsi_required': False, 'bear_strategy': 'breakout', 'bear_bb_std_mult': 0.5981012089526526, 'bear_rsi_os': 29, 'bear_rsi_ob': 71, 'bear_adx_thresh': 10.406807368852055, 'bear_atr_min_pct': 0.006320946645039674, 'bear_atr_max_pct': 0.11865080799735508, 'bear_tp_mult': 1.8211642925961797, 'bear_tsl_mult': 0.2700215004069935, 'bear_time_stop': 82, 'bear_use_sma': True, 'bear_use_ema': False, 'bear_use_atr': True, 'bear_use_adx': True, 'bear_use_spike': True, 'bear_rsi_required': False, 'sideways_strategy': 'mean_reversion', 'sideways_bb_std_mult': 0.6375091548415659, 'sideways_rsi_os': 43, 'sideways_rsi_ob': 63, 'sideways_adx_thresh': 15.614062675333955, 'sideways_atr_min_pct': 0.023292016532234262, 'sideways_atr_max_pct': 0.14469725774279563, 'sideways_tp_mult': 1.46744199545213, 'sideways_tsl_mult': 0.4382408816228283, 'sideways_time_stop': 288, 'sideways_use_sma': True, 'sideways_use_ema': False, 'sideways_use_atr': False, 'sideways_use_adx': False, 'sideways_use_spike': False, 'sideways_rsi_required': False}.
[I 2025-08-31 00:14:44,492] Trial 103 finished with values: [-1000000000.0, 1000000000.0] and parameters: {'p_sma': 48, 'p_std': 39, 'p_atr': 11, 'p_adx': 10, 'rsi_period': 26, 'ema1': 28, 'ema2': 42, 'slip_atr_k': 0.04800628177230067, 'slip_spread_k': 0.314606157711366, 'spread_hl_frac': 0.02668158851483241, 'bb_std_mult': 3.3629147519892824, 'rsi_os': 49, 'rsi_ob': 78, 'vol_spike': 0.04225539051995096, 'adx_thresh': 15.719465281430804, 'atr_min_pct': 0.023563685338480772, 'atr_max_pct': 0.029078666341046368, 'tp_mult': 2.541947369827512, 'tsl_mult': 0.28335485344313627, 'strategy': 'breakout', 'time_stop': 32, 'use_sma': True, 'use_atr': False, 'use_adx': False, 'use_ema': False, 'use_spike': False, 'rsi_required': True, 'edge_k': 0.4432448389890679, 'edge_cap': 0.21112970724187335, 'bull_strategy': 'breakout', 'bull_bb_std_mult': 2.1750072779245317, 'bull_rsi_os': 22, 'bull_rsi_ob': 64, 'bull_adx_thresh': 13.412942886587267, 'bull_atr_min_pct': 0.005104596170738923, 'bull_atr_max_pct': 0.09478145628274476, 'bull_tp_mult': 2.982863122807963, 'bull_tsl_mult': 0.1658942490198575, 'bull_time_stop': 200, 'bull_use_sma': False, 'bull_use_ema': True, 'bull_use_atr': False, 'bull_use_adx': True, 'bull_use_spike': False, 'bull_rsi_required': False, 'bear_strategy': 'breakout', 'bear_bb_std_mult': 0.5940215603918245, 'bear_rsi_os': 29, 'bear_rsi_ob': 75, 'bear_adx_thresh': 23.758477227220922, 'bear_atr_min_pct': 0.029179242786062314, 'bear_atr_max_pct': 0.1489948313257238, 'bear_tp_mult': 1.8210093896714534, 'bear_tsl_mult': 0.1311506391778794, 'bear_time_stop': 44, 'bear_use_sma': False, 'bear_use_ema': False, 'bear_use_atr': True, 'bear_use_adx': True, 'bear_use_spike': False, 'bear_rsi_required': False, 'sideways_strategy': 'mean_reversion', 'sideways_bb_std_mult': 1.5419672044340995, 'sideways_rsi_os': 42, 'sideways_rsi_ob': 69, 'sideways_adx_thresh': 8.3512287090182, 'sideways_atr_min_pct': 0.025605419731309226, 'sideways_atr_max_pct': 0.14541851838554204, 'sideways_tp_mult': 1.0180660793538674, 'sideways_tsl_mult': 0.4430945885494775, 'sideways_time_stop': 109, 'sideways_use_sma': True, 'sideways_use_ema': False, 'sideways_use_atr': False, 'sideways_use_adx': False, 'sideways_use_spike': False, 'sideways_rsi_required': False}.
[I 2025-08-31 00:14:44,861] Trial 105 finished with values: [-1000000000.0, 1000000000.0] and parameters: {'p_sma': 10, 'p_std': 58, 'p_atr': 11, 'p_adx': 10, 'rsi_period': 48, 'ema1': 22, 'ema2': 42, 'slip_atr_k': 0.012136313319455846, 'slip_spread_k': 0.43834605814714345, 'spread_hl_frac': 0.018980481563037277, 'bb_std_mult': 3.377518916678922, 'rsi_os': 49, 'rsi_ob': 76, 'vol_spike': 0.001144878024003081, 'adx_thresh': 7.320593797474691, 'atr_min_pct': 0.028328339918485428, 'atr_max_pct': 0.028267638251008753, 'tp_mult': 2.532088865611459, 'tsl_mult': 0.2678222288045588, 'strategy': 'breakout', 'time_stop': 24, 'use_sma': True, 'use_atr': False, 'use_adx': False, 'use_ema': False, 'use_spike': False, 'rsi_required': True, 'edge_k': 1.241317272020095, 'edge_cap': 0.6058342014190725, 'bull_strategy': 'breakout', 'bull_bb_std_mult': 2.2326461729097837, 'bull_rsi_os': 24, 'bull_rsi_ob': 45, 'bull_adx_thresh': 13.548718345376331, 'bull_atr_min_pct': 0.00013262331558729946, 'bull_atr_max_pct': 0.08805703222834764, 'bull_tp_mult': 2.9923021858930334, 'bull_tsl_mult': 0.16504601961581128, 'bull_time_stop': 149, 'bull_use_sma': False, 'bull_use_ema': True, 'bull_use_atr': False, 'bull_use_adx': True, 'bull_use_spike': False, 'bull_rsi_required': False, 'bear_strategy': 'breakout', 'bear_bb_std_mult': 0.5126699559051384, 'bear_rsi_os': 7, 'bear_rsi_ob': 76, 'bear_adx_thresh': 29.257881403051677, 'bear_atr_min_pct': 0.023180241925512567, 'bear_atr_max_pct': 0.13909302969578882, 'bear_tp_mult': 1.6054062549396164, 'bear_tsl_mult': 0.13923345743740073, 'bear_time_stop': 38, 'bear_use_sma': False, 'bear_use_ema': False, 'bear_use_atr': True, 'bear_use_adx': True, 'bear_use_spike': False, 'bear_rsi_required': False, 'sideways_strategy': 'mean_reversion', 'sideways_bb_std_mult': 1.1738651865172507, 'sideways_rsi_os': 40, 'sideways_rsi_ob': 48, 'sideways_adx_thresh': 7.432549226446619, 'sideways_atr_min_pct': 0.021913331078035007, 'sideways_atr_max_pct': 0.1499860302973497, 'sideways_tp_mult': 1.0150469413283048, 'sideways_tsl_mult': 0.35782576001098026, 'sideways_time_stop': 108, 'sideways_use_sma': False, 'sideways_use_ema': False, 'sideways_use_atr': False, 'sideways_use_adx': False, 'sideways_use_spike': True, 'sideways_rsi_required': False}.
[I 2025-08-31 00:15:15,511] Trial 107 finished with values: [-1000000000.0, 1000000000.0] and parameters: {'p_sma': 10, 'p_std': 9, 'p_atr': 17, 'p_adx': 7, 'rsi_period': 50, 'ema1': 9, 'ema2': 17, 'slip_atr_k': 0.011250110768251553, 'slip_spread_k': 0.27072976153932216, 'spread_hl_frac': 0.024246429165115622, 'bb_std_mult': 3.0860903482615463, 'rsi_os': 50, 'rsi_ob': 76, 'vol_spike': 0.03465699702204604, 'adx_thresh': 7.451191449145252, 'atr_min_pct': 0.025938776369302797, 'atr_max_pct': 0.053603541302390804, 'tp_mult': 2.643197527935356, 'tsl_mult': 0.12468478675000055, 'strategy': 'breakout', 'time_stop': 21, 'use_sma': True, 'use_atr': False, 'use_adx': False, 'use_ema': False, 'use_spike': False, 'rsi_required': True, 'edge_k': 1.5372807183153725, 'edge_cap': 0.12575369539947506, 'bull_strategy': 'breakout', 'bull_bb_std_mult': 2.0770249097236655, 'bull_rsi_os': 24, 'bull_rsi_ob': 45, 'bull_adx_thresh': 25.032381354716776, 'bull_atr_min_pct': 0.020811777511041282, 'bull_atr_max_pct': 0.08751923751807539, 'bull_tp_mult': 2.9494420999704576, 'bull_tsl_mult': 0.2079438819746647, 'bull_time_stop': 146, 'bull_use_sma': False, 'bull_use_ema': True, 'bull_use_atr': False, 'bull_use_adx': True, 'bull_use_spike': False, 'bull_rsi_required': False, 'bear_strategy': 'breakout', 'bear_bb_std_mult': 0.5086701138985312, 'bear_rsi_os': 22, 'bear_rsi_ob': 76, 'bear_adx_thresh': 29.292820516591227, 'bear_atr_min_pct': 0.023715388169816845, 'bear_atr_max_pct': 0.1403772565972799, 'bear_tp_mult': 1.3475913627391027, 'bear_tsl_mult': 0.08419270192816107, 'bear_time_stop': 106, 'bear_use_sma': False, 'bear_use_ema': False, 'bear_use_atr': True, 'bear_use_adx': True, 'bear_use_spike': False, 'bear_rsi_required': False, 'sideways_strategy': 'mean_reversion', 'sideways_bb_std_mult': 1.1908843660357842, 'sideways_rsi_os': 40, 'sideways_rsi_ob': 48, 'sideways_adx_thresh': 13.996653179423078, 'sideways_atr_min_pct': 0.02176084237162513, 'sideways_atr_max_pct': 0.14089293142032952, 'sideways_tp_mult': 1.2764040342003358, 'sideways_tsl_mult': 0.38322499390449416, 'sideways_time_stop': 271, 'sideways_use_sma': False, 'sideways_use_ema': False, 'sideways_use_atr': False, 'sideways_use_adx': False, 'sideways_use_spike': True, 'sideways_rsi_required': False}.
[I 2025-08-31 00:15:15,687] Trial 104 finished with values: [-1000000000.0, 1000000000.0] and parameters: {'p_sma': 58, 'p_std': 39, 'p_atr': 15, 'p_adx': 8, 'rsi_period': 38, 'ema1': 8, 'ema2': 27, 'slip_atr_k': 0.0467703775630568, 'slip_spread_k': 0.20842082299572, 'spread_hl_frac': 0.03671047265382502, 'bb_std_mult': 3.3898144446183864, 'rsi_os': 49, 'rsi_ob': 76, 'vol_spike': 0.0008468190061694334, 'adx_thresh': 15.424746303522424, 'atr_min_pct': 0.028276571536028333, 'atr_max_pct': 0.030604586944927563, 'tp_mult': 1.4392321302822373, 'tsl_mult': 0.7389405484475531, 'strategy': 'breakout', 'time_stop': 26, 'use_sma': True, 'use_atr': False, 'use_adx': False, 'use_ema': False, 'use_spike': False, 'rsi_required': True, 'edge_k': 1.9063243309355216, 'edge_cap': 0.8740510940610886, 'bull_strategy': 'breakout', 'bull_bb_std_mult': 2.624773125575019, 'bull_rsi_os': 25, 'bull_rsi_ob': 63, 'bull_adx_thresh': 34.05748463017797, 'bull_atr_min_pct': 0.00019143678395881547, 'bull_atr_max_pct': 0.09302767716264487, 'bull_tp_mult': 2.601611172448009, 'bull_tsl_mult': 0.18506832898711512, 'bull_time_stop': 197, 'bull_use_sma': False, 'bull_use_ema': True, 'bull_use_atr': False, 'bull_use_adx': True, 'bull_use_spike': False, 'bull_rsi_required': False, 'bear_strategy': 'breakout', 'bear_bb_std_mult': 0.5117936175692334, 'bear_rsi_os': 29, 'bear_rsi_ob': 76, 'bear_adx_thresh': 26.631160091125977, 'bear_atr_min_pct': 0.010674757075261249, 'bear_atr_max_pct': 0.13540324092889322, 'bear_tp_mult': 1.5874631940833606, 'bear_tsl_mult': 0.12843721421567245, 'bear_time_stop': 34, 'bear_use_sma': False, 'bear_use_ema': False, 'bear_use_atr': True, 'bear_use_adx': True, 'bear_use_spike': False, 'bear_rsi_required': False, 'sideways_strategy': 'mean_reversion', 'sideways_bb_std_mult': 1.1589722271291465, 'sideways_rsi_os': 39, 'sideways_rsi_ob': 68, 'sideways_adx_thresh': 8.661750626708507, 'sideways_atr_min_pct': 0.021462543190035564, 'sideways_atr_max_pct': 0.14608053865124407, 'sideways_tp_mult': 1.0151285118683897, 'sideways_tsl_mult': 0.38007661949180005, 'sideways_time_stop': 108, 'sideways_use_sma': False, 'sideways_use_ema': False, 'sideways_use_atr': False, 'sideways_use_adx': False, 'sideways_use_spike': True, 'sideways_rsi_required': False}.
[I 2025-08-31 00:15:15,948] Trial 106 finished with values: [-1000000000.0, 1000000000.0] and parameters: {'p_sma': 58, 'p_std': 39, 'p_atr': 11, 'p_adx': 7, 'rsi_period': 48, 'ema1': 9, 'ema2': 41, 'slip_atr_k': 0.1775470077628578, 'slip_spread_k': 0.4214337445576345, 'spread_hl_frac': 0.03638929528705239, 'bb_std_mult': 3.3525654800564255, 'rsi_os': 49, 'rsi_ob': 76, 'vol_spike': 0.0029488652640855817, 'adx_thresh': 15.428495807847645, 'atr_min_pct': 0.013035459668901257, 'atr_max_pct': 0.029567160209008, 'tp_mult': 2.552425625246771, 'tsl_mult': 0.1249595719414931, 'strategy': 'breakout', 'time_stop': 32, 'use_sma': True, 'use_atr': False, 'use_adx': False, 'use_ema': False, 'use_spike': False, 'rsi_required': True, 'edge_k': 0.6776236434943872, 'edge_cap': 0.8766675963042467, 'bull_strategy': 'breakout', 'bull_bb_std_mult': 2.192053985064346, 'bull_rsi_os': 29, 'bull_rsi_ob': 68, 'bull_adx_thresh': 11.632753347076385, 'bull_atr_min_pct': 0.021069567277705068, 'bull_atr_max_pct': 0.08751249498759367, 'bull_tp_mult': 2.9510262666461085, 'bull_tsl_mult': 0.21289551391901823, 'bull_time_stop': 230, 'bull_use_sma': False, 'bull_use_ema': True, 'bull_use_atr': False, 'bull_use_adx': True, 'bull_use_spike': False, 'bull_rsi_required': False, 'bear_strategy': 'breakout', 'bear_bb_std_mult': 0.5062855041656834, 'bear_rsi_os': 53, 'bear_rsi_ob': 46, 'bear_adx_thresh': 29.970232927957483, 'bear_atr_min_pct': 0.023457346243246496, 'bear_atr_max_pct': 0.14074907535626305, 'bear_tp_mult': 1.526309495722487, 'bear_tsl_mult': 0.09110546450336858, 'bear_time_stop': 41, 'bear_use_sma': False, 'bear_use_ema': False, 'bear_use_atr': True, 'bear_use_adx': True, 'bear_use_spike': False, 'bear_rsi_required': False, 'sideways_strategy': 'mean_reversion', 'sideways_bb_std_mult': 1.1731138428390129, 'sideways_rsi_os': 32, 'sideways_rsi_ob': 48, 'sideways_adx_thresh': 8.175044342385327, 'sideways_atr_min_pct': 0.021620864945205848, 'sideways_atr_max_pct': 0.14094265785073168, 'sideways_tp_mult': 1.0477810518363722, 'sideways_tsl_mult': 0.36622596099896537, 'sideways_time_stop': 267, 'sideways_use_sma': False, 'sideways_use_ema': False, 'sideways_use_atr': False, 'sideways_use_adx': False, 'sideways_use_spike': True, 'sideways_rsi_required': False}.
