[I 2025-08-31 00:22:07,098] Trial 161 finished with values: [-1000000000.0, 1000000000.0] and parameters: {'p_sma': 60, 'p_std': 40, 'p_atr': 7, 'p_adx': 28, 'rsi_period': 33, 'ema1': 6, 'ema2': 17, 'slip_atr_k': 0.03165636118943609, 'slip_spread_k': 0.47759121476054844, 'spread_hl_frac': 0.0039141994913896696, 'bb_std_mult': 1.2084199152815507, 'rsi_os': 33, 'rsi_ob': 80, 'vol_spike': 0.16015568786983211, 'adx_thresh': 10.21089442305611, 'atr_min_pct': 0.029138301333341252, 'atr_max_pct': 0.05546456198168413, 'tp_mult': 1.2183443034296748, 'tsl_mult': 0.6130354078664441, 'strategy': 'breakout', 'time_stop': 204, 'use_sma': True, 'use_atr': False, 'use_adx': True, 'use_ema': False, 'use_spike': False, 'rsi_required': True, 'edge_k': 0.8312626815889076, 'edge_cap': 0.520576134644375, 'bull_strategy': 'breakout', 'bull_bb_std_mult': 1.193251964935296, 'bull_rsi_os': 22, 'bull_rsi_ob': 68, 'bull_adx_thresh': 14.1891562611163, 'bull_atr_min_pct': 0.0020142443316238396, 'bull_atr_max_pct': 0.08605654180465058, 'bull_tp_mult': 1.8339264819798857, 'bull_tsl_mult': 0.9180080995573371, 'bull_time_stop': 35, 'bull_use_sma': False, 'bull_use_ema': True, 'bull_use_atr': False, 'bull_use_adx': True, 'bull_use_spike': False, 'bull_rsi_required': False, 'bear_strategy': 'breakout', 'bear_bb_std_mult': 0.5691776436743075, 'bear_rsi_os': 21, 'bear_rsi_ob': 80, 'bear_adx_thresh': 25.037220604702853, 'bear_atr_min_pct': 0.011738546732811704, 'bear_atr_max_pct': 0.14271651995213303, 'bear_tp_mult': 1.9092770793073017, 'bear_tsl_mult': 0.8563009793920009, 'bear_time_stop': 55, 'bear_use_sma': False, 'bear_use_ema': False, 'bear_use_atr': True, 'bear_use_adx': True, 'bear_use_spike': False, 'bear_rsi_required': False, 'sideways_strategy': 'mean_reversion', 'sideways_bb_std_mult': 1.220382323802087, 'sideways_rsi_os': 15, 'sideways_rsi_ob': 94, 'sideways_adx_thresh': 12.773654392494715, 'sideways_atr_min_pct': 0.022658129961013334, 'sideways_atr_max_pct': 0.13932663533288733, 'sideways_tp_mult': 1.6674160486950986, 'sideways_tsl_mult': 0.14924523762510478, 'sideways_time_stop': 150, 'sideways_use_sma': False, 'sideways_use_ema': False, 'sideways_use_atr': False, 'sideways_use_adx': False, 'sideways_use_spike': True, 'sideways_rsi_required': True}.
[I 2025-08-31 00:22:07,536] Trial 165 finished with values: [-1000000000.0, 1000000000.0] and parameters: {'p_sma': 47, 'p_std': 40, 'p_atr': 13, 'p_adx': 7, 'rsi_period': 33, 'ema1': 6, 'ema2': 22, 'slip_atr_k': 0.09489608724944759, 'slip_spread_k': 0.211840093302221, 'spread_hl_frac': 0.01509078138611602, 'bb_std_mult': 1.87386060303748, 'rsi_os': 54, 'rsi_ob': 48, 'vol_spike': 0.008646506516980785, 'adx_thresh': 13.041683628948807, 'atr_min_pct': 0.029108609858338727, 'atr_max_pct': 0.0722535824426386, 'tp_mult': 2.186207347620535, 'tsl_mult': 0.9829586757341615, 'strategy': 'mean_reversion', 'time_stop': 221, 'use_sma': True, 'use_atr': False, 'use_adx': False, 'use_ema': True, 'use_spike': False, 'rsi_required': True, 'edge_k': 0.7352743589385135, 'edge_cap': 0.5429806349980956, 'bull_strategy': 'breakout', 'bull_bb_std_mult': 1.1907085315639845, 'bull_rsi_os': 37, 'bull_rsi_ob': 72, 'bull_adx_thresh': 14.659791189210477, 'bull_atr_min_pct': 6.813394514379814e-06, 'bull_atr_max_pct': 0.08585648623056744, 'bull_tp_mult': 1.5944494083316385, 'bull_tsl_mult': 0.2732326573279796, 'bull_time_stop': 213, 'bull_use_sma': False, 'bull_use_ema': False, 'bull_use_atr': False, 'bull_use_adx': True, 'bull_use_spike': False, 'bull_rsi_required': False, 'bear_strategy': 'breakout', 'bear_bb_std_mult': 0.6328640548528651, 'bear_rsi_os': 25, 'bear_rsi_ob': 77, 'bear_adx_thresh': 30.216746449362805, 'bear_atr_min_pct': 0.008849144639658415, 'bear_atr_max_pct': 0.14220686126048193, 'bear_tp_mult': 1.809371330759745, 'bear_tsl_mult': 0.2177788767876339, 'bear_time_stop': 66, 'bear_use_sma': False, 'bear_use_ema': False, 'bear_use_atr': True, 'bear_use_adx': True, 'bear_use_spike': False, 'bear_rsi_required': False, 'sideways_strategy': 'breakout', 'sideways_bb_std_mult': 2.7040966122836414, 'sideways_rsi_os': 45, 'sideways_rsi_ob': 65, 'sideways_adx_thresh': 12.784132614345664, 'sideways_atr_min_pct': 0.01916205298969812, 'sideways_atr_max_pct': 0.13998016720040823, 'sideways_tp_mult': 1.139043843808784, 'sideways_tsl_mult': 0.152601984176679, 'sideways_time_stop': 5, 'sideways_use_sma': False, 'sideways_use_ema': False, 'sideways_use_atr': False, 'sideways_use_adx': False, 'sideways_use_spike': True, 'sideways_rsi_required': False}.
[I 2025-08-31 00:22:37,073] Trial 164 finished with values: [-1000000000.0, 1000000000.0] and parameters: {'p_sma': 47, 'p_std': 40, 'p_atr': 12, 'p_adx': 7, 'rsi_period': 33, 'ema1': 26, 'ema2': 22, 'slip_atr_k': 0.15839134667516605, 'slip_spread_k': 0.305302371048147, 'spread_hl_frac': 0.003829574498312516, 'bb_std_mult': 3.457899671938196, 'rsi_os': 54, 'rsi_ob': 78, 'vol_spike': 0.007807637152059461, 'adx_thresh': 18.56876041989734, 'atr_min_pct': 0.02193503491589554, 'atr_max_pct': 0.05946617894749124, 'tp_mult': 2.6294622900760243, 'tsl_mult': 0.6055909940171537, 'strategy': 'breakout', 'time_stop': 222, 'use_sma': True, 'use_atr': False, 'use_adx': False, 'use_ema': True, 'use_spike': False, 'rsi_required': True, 'edge_k': 0.8357358074135723, 'edge_cap': 0.5865724853996606, 'bull_strategy': 'breakout', 'bull_bb_std_mult': 2.468515559671445, 'bull_rsi_os': 36, 'bull_rsi_ob': 62, 'bull_adx_thresh': 14.269316441423042, 'bull_atr_min_pct': 0.0007812419240905839, 'bull_atr_max_pct': 0.08685942791088329, 'bull_tp_mult': 1.0121402908266237, 'bull_tsl_mult': 0.24183374092527948, 'bull_time_stop': 162, 'bull_use_sma': False, 'bull_use_ema': True, 'bull_use_atr': False, 'bull_use_adx': True, 'bull_use_spike': False, 'bull_rsi_required': False, 'bear_strategy': 'breakout', 'bear_bb_std_mult': 0.6233598072048874, 'bear_rsi_os': 23, 'bear_rsi_ob': 77, 'bear_adx_thresh': 6.7544315424499235, 'bear_atr_min_pct': 0.010495160366213101, 'bear_atr_max_pct': 0.14874731356030138, 'bear_tp_mult': 1.8012890594539042, 'bear_tsl_mult': 0.6715045950040177, 'bear_time_stop': 65, 'bear_use_sma': False, 'bear_use_ema': False, 'bear_use_atr': True, 'bear_use_adx': True, 'bear_use_spike': False, 'bear_rsi_required': False, 'sideways_strategy': 'mean_reversion', 'sideways_bb_std_mult': 1.3607343161693968, 'sideways_rsi_os': 45, 'sideways_rsi_ob': 65, 'sideways_adx_thresh': 12.853225713339977, 'sideways_atr_min_pct': 0.021776898023630153, 'sideways_atr_max_pct': 0.14031801790447498, 'sideways_tp_mult': 1.141942965993008, 'sideways_tsl_mult': 0.40549366529163905, 'sideways_time_stop': 92, 'sideways_use_sma': False, 'sideways_use_ema': False, 'sideways_use_atr': False, 'sideways_use_adx': False, 'sideways_use_spike': True, 'sideways_rsi_required': False}.
[I 2025-08-31 00:22:37,276] Trial 166 finished with values: [-1000000000.0, 1000000000.0] and parameters: {'p_sma': 19, 'p_std': 22, 'p_atr': 13, 'p_adx': 7, 'rsi_period': 33, 'ema1': 13, 'ema2': 60, 'slip_atr_k': 0.15741751524708336, 'slip_spread_k': 0.20993116462026667, 'spread_hl_frac': 0.005988039516867744, 'bb_std_mult': 3.4981062335224578, 'rsi_os': 17, 'rsi_ob': 77, 'vol_spike': 0.007033682371801854, 'adx_thresh': 11.058604508572694, 'atr_min_pct': 0.024323971918539557, 'atr_max_pct': 0.07199999005088936, 'tp_mult': 2.648405169865973, 'tsl_mult': 0.12312897745669124, 'strategy': 'mean_reversion', 'time_stop': 260, 'use_sma': True, 'use_atr': False, 'use_adx': False, 'use_ema': True, 'use_spike': False, 'rsi_required': True, 'edge_k': 0.7396119367232563, 'edge_cap': 0.9395543473245371, 'bull_strategy': 'breakout', 'bull_bb_std_mult': 2.49321531720788, 'bull_rsi_os': 36, 'bull_rsi_ob': 73, 'bull_adx_thresh': 20.593943380373297, 'bull_atr_min_pct': 0.014282657260228322, 'bull_atr_max_pct': 0.08992740484259816, 'bull_tp_mult': 2.948764322887995, 'bull_tsl_mult': 0.8836084202681753, 'bull_time_stop': 65, 'bull_use_sma': False, 'bull_use_ema': False, 'bull_use_atr': False, 'bull_use_adx': True, 'bull_use_spike': False, 'bull_rsi_required': False, 'bear_strategy': 'breakout', 'bear_bb_std_mult': 1.1973679801028307, 'bear_rsi_os': 28, 'bear_rsi_ob': 77, 'bear_adx_thresh': 30.339242164429848, 'bear_atr_min_pct': 0.008760694869443562, 'bear_atr_max_pct': 0.013882877599899188, 'bear_tp_mult': 2.113720593207737, 'bear_tsl_mult': 0.6682323917398496, 'bear_time_stop': 65, 'bear_use_sma': False, 'bear_use_ema': False, 'bear_use_atr': True, 'bear_use_adx': True, 'bear_use_spike': False, 'bear_rsi_required': False, 'sideways_strategy': 'breakout', 'sideways_bb_std_mult': 2.7111667001906126, 'sideways_rsi_os': 44, 'sideways_rsi_ob': 64, 'sideways_adx_thresh': 30.922922860321847, 'sideways_atr_min_pct': 0.018236009802006032, 'sideways_atr_max_pct': 0.05463601469228675, 'sideways_tp_mult': 1.5929762652228001, 'sideways_tsl_mult': 0.30602511821392914, 'sideways_time_stop': 174, 'sideways_use_sma': False, 'sideways_use_ema': False, 'sideways_use_atr': False, 'sideways_use_adx': False, 'sideways_use_spike': True, 'sideways_rsi_required': False}.
[I 2025-08-31 00:22:37,277] Trial 163 finished with values: [-1000000000.0, 1000000000.0] and parameters: {'p_sma': 48, 'p_std': 12, 'p_atr': 18, 'p_adx': 28, 'rsi_period': 32, 'ema1': 14, 'ema2': 15, 'slip_atr_k': 0.03196142384968481, 'slip_spread_k': 0.2096864350998154, 'spread_hl_frac': 0.014777365824888422, 'bb_std_mult': 3.4626839212713603, 'rsi_os': 33, 'rsi_ob': 49, 'vol_spike': 0.025001001477518416, 'adx_thresh': 10.231755689424903, 'atr_min_pct': 0.01456970337178734, 'atr_max_pct': 0.05540032059342928, 'tp_mult': 2.4480160029355535, 'tsl_mult': 0.0653547484836374, 'strategy': 'breakout', 'time_stop': 251, 'use_sma': True, 'use_atr': False, 'use_adx': False, 'use_ema': True, 'use_spike': False, 'rsi_required': True, 'edge_k': 0.8015610101306493, 'edge_cap': 0.5820800035556823, 'bull_strategy': 'breakout', 'bull_bb_std_mult': 1.2958394942057732, 'bull_rsi_os': 36, 'bull_rsi_ob': 61, 'bull_adx_thresh': 20.163269277794516, 'bull_atr_min_pct': 0.0023533919990601036, 'bull_atr_max_pct': 0.08635150338654238, 'bull_tp_mult': 1.8346688198540853, 'bull_tsl_mult': 0.8620960498891386, 'bull_time_stop': 165, 'bull_use_sma': False, 'bull_use_ema': True, 'bull_use_atr': False, 'bull_use_adx': True, 'bull_use_spike': False, 'bull_rsi_required': False, 'bear_strategy': 'breakout', 'bear_bb_std_mult': 1.208556903852159, 'bear_rsi_os': 21, 'bear_rsi_ob': 92, 'bear_adx_thresh': 6.750031667883912, 'bear_atr_min_pct': 0.010972224045764891, 'bear_atr_max_pct': 0.14853367514567947, 'bear_tp_mult': 1.8168129620243338, 'bear_tsl_mult': 0.27027605286566836, 'bear_time_stop': 53, 'bear_use_sma': True, 'bear_use_ema': False, 'bear_use_atr': True, 'bear_use_adx': True, 'bear_use_spike': False, 'bear_rsi_required': False, 'sideways_strategy': 'mean_reversion', 'sideways_bb_std_mult': 1.5953569411456587, 'sideways_rsi_os': 29, 'sideways_rsi_ob': 65, 'sideways_adx_thresh': 12.910362464932406, 'sideways_atr_min_pct': 0.021973048238072578, 'sideways_atr_max_pct': 0.11488494799942642, 'sideways_tp_mult': 1.1500126009284215, 'sideways_tsl_mult': 0.3055784607622043, 'sideways_time_stop': 63, 'sideways_use_sma': False, 'sideways_use_ema': False, 'sideways_use_atr': False, 'sideways_use_adx': False, 'sideways_use_spike': True, 'sideways_rsi_required': True}.
[I 2025-08-31 00:22:37,458] Trial 167 finished with values: [-1000000000.0, 1000000000.0] and parameters: {'p_sma': 11, 'p_std': 7, 'p_atr': 12, 'p_adx': 9, 'rsi_period': 30, 'ema1': 11, 'ema2': 59, 'slip_atr_k': 0.02378908689941453, 'slip_spread_k': 0.007071494063391387, 'spread_hl_frac': 0.0054976100252411625, 'bb_std_mult': 3.458916978567403, 'rsi_os': 29, 'rsi_ob': 78, 'vol_spike': 0.018823623825486753, 'adx_thresh': 14.158204889953527, 'atr_min_pct': 0.000787223372548474, 'atr_max_pct': 0.05932029386484517, 'tp_mult': 2.6476096666651237, 'tsl_mult': 0.11874517357900702, 'strategy': 'breakout', 'time_stop': 11, 'use_sma': True, 'use_atr': True, 'use_adx': False, 'use_ema': False, 'use_spike': True, 'rsi_required': True, 'edge_k': 0.6126620971210665, 'edge_cap': 0.9405267456935221, 'bull_strategy': 'mean_reversion', 'bull_bb_std_mult': 2.2813023711871385, 'bull_rsi_os': 17, 'bull_rsi_ob': 59, 'bull_adx_thresh': 20.51772247365281, 'bull_atr_min_pct': 0.0005031979807710232, 'bull_atr_max_pct': 0.08990723453116896, 'bull_tp_mult': 1.1766346428505994, 'bull_tsl_mult': 0.2488204940123161, 'bull_time_stop': 160, 'bull_use_sma': False, 'bull_use_ema': True, 'bull_use_atr': False, 'bull_use_adx': False, 'bull_use_spike': True, 'bull_rsi_required': False, 'bear_strategy': 'breakout', 'bear_bb_std_mult': 0.5066119881568063, 'bear_rsi_os': 28, 'bear_rsi_ob': 77, 'bear_adx_thresh': 6.465008821874024, 'bear_atr_min_pct': 0.010652441582377471, 'bear_atr_max_pct': 0.13861644510013116, 'bear_tp_mult': 1.980215994475443, 'bear_tsl_mult': 0.6727415713499889, 'bear_time_stop': 43, 'bear_use_sma': True, 'bear_use_ema': True, 'bear_use_atr': True, 'bear_use_adx': True, 'bear_use_spike': False, 'bear_rsi_required': False, 'sideways_strategy': 'mean_reversion', 'sideways_bb_std_mult': 1.3904066192345597, 'sideways_rsi_os': 41, 'sideways_rsi_ob': 74, 'sideways_adx_thresh': 11.948382703328837, 'sideways_atr_min_pct': 0.01283220941593181, 'sideways_atr_max_pct': 0.1257278967607326, 'sideways_tp_mult': 1.1890138055453996, 'sideways_tsl_mult': 0.30377719148776905, 'sideways_time_stop': 91, 'sideways_use_sma': False, 'sideways_use_ema': False, 'sideways_use_atr': False, 'sideways_use_adx': False, 'sideways_use_spike': True, 'sideways_rsi_required': False}.
[I 2025-08-31 00:23:07,934] Trial 168 finished with values: [-1000000000.0, 1000000000.0] and parameters: {'p_sma': 50, 'p_std': 33, 'p_atr': 18, 'p_adx': 18, 'rsi_period': 30, 'ema1': 14, 'ema2': 59, 'slip_atr_k': 0.2429225883813796, 'slip_spread_k': 0.0030409115978406176, 'spread_hl_frac': 0.034604719265270964, 'bb_std_mult': 1.4754086307250076, 'rsi_os': 16, 'rsi_ob': 76, 'vol_spike': 0.0191585414971781, 'adx_thresh': 11.182553087757162, 'atr_min_pct': 0.0006800463901791676, 'atr_max_pct': 0.14453119065037592, 'tp_mult': 2.5694655465183307, 'tsl_mult': 0.1238344195786949, 'strategy': 'breakout', 'time_stop': 12, 'use_sma': True, 'use_atr': True, 'use_adx': False, 'use_ema': False, 'use_spike': True, 'rsi_required': True, 'edge_k': 0.6023000138120878, 'edge_cap': 0.9465549760062674, 'bull_strategy': 'mean_reversion', 'bull_bb_std_mult': 2.567466322708705, 'bull_rsi_os': 36, 'bull_rsi_ob': 75, 'bull_adx_thresh': 20.25415424746511, 'bull_atr_min_pct': 0.014542110150948157, 'bull_atr_max_pct': 0.0413202423802727, 'bull_tp_mult': 1.1784903124156978, 'bull_tsl_mult': 0.8964750423664802, 'bull_time_stop': 66, 'bull_use_sma': True, 'bull_use_ema': False, 'bull_use_atr': True, 'bull_use_adx': False, 'bull_use_spike': True, 'bull_rsi_required': False, 'bear_strategy': 'breakout', 'bear_bb_std_mult': 1.1957269392290817, 'bear_rsi_os': 28, 'bear_rsi_ob': 48, 'bear_adx_thresh': 13.973321537270785, 'bear_atr_min_pct': 0.01100193381465298, 'bear_atr_max_pct': 0.13836163077469343, 'bear_tp_mult': 2.1340361369374383, 'bear_tsl_mult': 0.12123379500639518, 'bear_time_stop': 45, 'bear_use_sma': True, 'bear_use_ema': True, 'bear_use_atr': False, 'bear_use_adx': True, 'bear_use_spike': True, 'bear_rsi_required': False, 'sideways_strategy': 'mean_reversion', 'sideways_bb_std_mult': 1.420712021540703, 'sideways_rsi_os': 12, 'sideways_rsi_ob': 64, 'sideways_adx_thresh': 11.763699390748119, 'sideways_atr_min_pct': 0.020757257832357767, 'sideways_atr_max_pct': 0.12671262595524085, 'sideways_tp_mult': 1.191987666457491, 'sideways_tsl_mult': 0.2596884882738399, 'sideways_time_stop': 104, 'sideways_use_sma': False, 'sideways_use_ema': False, 'sideways_use_atr': False, 'sideways_use_adx': False, 'sideways_use_spike': True, 'sideways_rsi_required': False}.
[I 2025-08-31 00:23:08,141] Trial 171 finished with values: [-1000000000.0, 1000000000.0] and parameters: {'p_sma': 50, 'p_std': 28, 'p_atr': 26, 'p_adx': 8, 'rsi_period': 66, 'ema1': 25, 'ema2': 18, 'slip_atr_k': 0.05092023955428486, 'slip_spread_k': 0.060622342843332594, 'spread_hl_frac': 0.02051021948540243, 'bb_std_mult': 0.6390613706519199, 'rsi_os': 27, 'rsi_ob': 59, 'vol_spike': 0.2673889704290956, 'adx_thresh': 14.624316982108802, 'atr_min_pct': 0.0005656250360620156, 'atr_max_pct': 0.07681897901634556, 'tp_mult': 2.561389707757367, 'tsl_mult': 0.2882000774602653, 'strategy': 'breakout', 'time_stop': 47, 'use_sma': False, 'use_atr': True, 'use_adx': False, 'use_ema': False, 'use_spike': True, 'rsi_required': True, 'edge_k': 1.6136488701515022, 'edge_cap': 0.38329714668880394, 'bull_strategy': 'mean_reversion', 'bull_bb_std_mult': 2.5860746042383, 'bull_rsi_os': 34, 'bull_rsi_ob': 71, 'bull_adx_thresh': 30.046204871351794, 'bull_atr_min_pct': 0.028812942315246694, 'bull_atr_max_pct': 0.09836919019677233, 'bull_tp_mult': 2.6264625993646, 'bull_tsl_mult': 0.26662212391381135, 'bull_time_stop': 145, 'bull_use_sma': True, 'bull_use_ema': True, 'bull_use_atr': True, 'bull_use_adx': False, 'bull_use_spike': True, 'bull_rsi_required': True, 'bear_strategy': 'mean_reversion', 'bear_bb_std_mult': 0.9392909261553877, 'bear_rsi_os': 31, 'bear_rsi_ob': 87, 'bear_adx_thresh': 29.515271972900436, 'bear_atr_min_pct': 0.012385465664987137, 'bear_atr_max_pct': 0.02553081418485844, 'bear_tp_mult': 2.068834315415879, 'bear_tsl_mult': 0.20124171678043928, 'bear_time_stop': 248, 'bear_use_sma': False, 'bear_use_ema': True, 'bear_use_atr': False, 'bear_use_adx': False, 'bear_use_spike': True, 'bear_rsi_required': False, 'sideways_strategy': 'mean_reversion', 'sideways_bb_std_mult': 1.295753480169846, 'sideways_rsi_os': 12, 'sideways_rsi_ob': 62, 'sideways_adx_thresh': 7.594791274880468, 'sideways_atr_min_pct': 0.01524219240756364, 'sideways_atr_max_pct': 0.030657667720719296, 'sideways_tp_mult': 1.0647297896505756, 'sideways_tsl_mult': 0.6695290348066394, 'sideways_time_stop': 102, 'sideways_use_sma': True, 'sideways_use_ema': True, 'sideways_use_atr': True, 'sideways_use_adx': True, 'sideways_use_spike': False, 'sideways_rsi_required': False}.
[I 2025-08-31 00:23:08,336] Trial 170 finished with values: [-1000000000.0, 1000000000.0] and parameters: {'p_sma': 12, 'p_std': 35, 'p_atr': 26, 'p_adx': 9, 'rsi_period': 30, 'ema1': 20, 'ema2': 18, 'slip_atr_k': 0.21539052879872583, 'slip_spread_k': 0.6771676546701096, 'spread_hl_frac': 0.03508618525249127, 'bb_std_mult': 1.4977690065126978, 'rsi_os': 27, 'rsi_ob': 76, 'vol_spike': 0.018527307179765636, 'adx_thresh': 14.18500170491274, 'atr_min_pct': 0.013409285120850083, 'atr_max_pct': 0.07591984369977463, 'tp_mult': 2.7130488285179766, 'tsl_mult': 0.2930167254453542, 'strategy': 'breakout', 'time_stop': 11, 'use_sma': False, 'use_atr': True, 'use_adx': False, 'use_ema': False, 'use_spike': True, 'rsi_required': True, 'edge_k': 0.8811821391142161, 'edge_cap': 0.3257767512423779, 'bull_strategy': 'mean_reversion', 'bull_bb_std_mult': 2.291830012568428, 'bull_rsi_os': 39, 'bull_rsi_ob': 75, 'bull_adx_thresh': 12.504631701302356, 'bull_atr_min_pct': 0.0006158966326520217, 'bull_atr_max_pct': 0.09875683354469933, 'bull_tp_mult': 2.9947529383661893, 'bull_tsl_mult': 0.2556739313298732, 'bull_time_stop': 158, 'bull_use_sma': True, 'bull_use_ema': True, 'bull_use_atr': True, 'bull_use_adx': False, 'bull_use_spike': True, 'bull_rsi_required': True, 'bear_strategy': 'mean_reversion', 'bear_bb_std_mult': 2.6323180213061503, 'bear_rsi_os': 38, 'bear_rsi_ob': 86, 'bear_adx_thresh': 13.549255424005842, 'bear_atr_min_pct': 0.012610507044287995, 'bear_atr_max_pct': 0.13896873774786142, 'bear_tp_mult': 1.9837731196103157, 'bear_tsl_mult': 0.2004883089717678, 'bear_time_stop': 45, 'bear_use_sma': False, 'bear_use_ema': True, 'bear_use_atr': False, 'bear_use_adx': False, 'bear_use_spike': True, 'bear_rsi_required': False, 'sideways_strategy': 'mean_reversion', 'sideways_bb_std_mult': 2.616042729576831, 'sideways_rsi_os': 12, 'sideways_rsi_ob': 84, 'sideways_adx_thresh': 11.659604705682733, 'sideways_atr_min_pct': 0.003898935831425766, 'sideways_atr_max_pct': 0.12584502881354706, 'sideways_tp_mult': 1.8196648042477228, 'sideways_tsl_mult': 0.2629954730861622, 'sideways_time_stop': 103, 'sideways_use_sma': True, 'sideways_use_ema': True, 'sideways_use_atr': True, 'sideways_use_adx': True, 'sideways_use_spike': False, 'sideways_rsi_required': False}.
